2022-04-04 23:01:34.142317 IP (tos 0x0, ttl 64, id 28651, offset 0, flags [DF], proto TCP (6), length 60)
    127.0.0.1.58212 > 127.0.0.1.10050: Flags [S], cksum 0xfe30 (incorrect -> 0x500d), seq 1612906199, win 65495, options [mss 65495,sackOK,TS val 750938513 ecr 0,nop,wscale 7], length 0
2022-04-04 23:01:34.142327 IP (tos 0x0, ttl 64, id 0, offset 0, flags [DF], proto TCP (6), length 60)
    127.0.0.1.10050 > 127.0.0.1.58212: Flags [S.], cksum 0xfe30 (incorrect -> 0xcb68), seq 788447053, ack 1612906200, win 65483, options [mss 65495,sackOK,TS val 750938513 ecr 750938513,nop,wscale 7], length 0
2022-04-04 23:01:34.142337 IP (tos 0x0, ttl 64, id 28652, offset 0, flags [DF], proto TCP (6), length 52)
    127.0.0.1.58212 > 127.0.0.1.10050: Flags [.], cksum 0xfe28 (incorrect -> 0xf224), seq 1, ack 1, win 512, options [nop,nop,TS val 750938513 ecr 750938513], length 0
2022-04-04 23:01:34.142452 IP (tos 0x0, ttl 64, id 28653, offset 0, flags [DF], proto TCP (6), length 55)
    127.0.0.1.58212 > 127.0.0.1.10050: Flags [P.], cksum 0xfe2b (incorrect -> 0xed17), seq 1:4, ack 1, win 512, options [nop,nop,TS val 750938514 ecr 750938513], length 3
2022-04-04 23:01:34.142455 IP (tos 0x0, ttl 64, id 63709, offset 0, flags [DF], proto TCP (6), length 52)
    127.0.0.1.10050 > 127.0.0.1.58212: Flags [.], cksum 0xfe28 (incorrect -> 0xf21f), seq 1, ack 4, win 512, options [nop,nop,TS val 750938514 ecr 750938514], length 0
2022-04-04 23:01:34.142540 IP (tos 0x0, ttl 64, id 63710, offset 0, flags [DF], proto TCP (6), length 54)
    127.0.0.1.10050 > 127.0.0.1.58212: Flags [P.], cksum 0xfe2a (incorrect -> 0xed15), seq 1:3, ack 4, win 512, options [nop,nop,TS val 750938514 ecr 750938514], length 2
2022-04-04 23:01:34.142544 IP (tos 0x0, ttl 64, id 28654, offset 0, flags [DF], proto TCP (6), length 52)
    127.0.0.1.58212 > 127.0.0.1.10050: Flags [.], cksum 0xfe28 (incorrect -> 0xf21d), seq 4, ack 3, win 512, options [nop,nop,TS val 750938514 ecr 750938514], length 0
2022-04-04 23:01:34.144252 IP (tos 0x0, ttl 64, id 28655, offset 0, flags [DF], proto TCP (6), length 62)
    127.0.0.1.58212 > 127.0.0.1.10050: Flags [P.], cksum 0xfe32 (incorrect -> 0x60ae), seq 4:14, ack 3, win 512, options [nop,nop,TS val 750938515 ecr 750938514], length 10
2022-04-04 23:01:34.144275 IP (tos 0x0, ttl 64, id 63711, offset 0, flags [DF], proto TCP (6), length 52)
    127.0.0.1.10050 > 127.0.0.1.58212: Flags [.], cksum 0xfe28 (incorrect -> 0xf211), seq 3, ack 14, win 512, options [nop,nop,TS val 750938515 ecr 750938515], length 0
2022-04-04 23:01:34.363170 IP (tos 0x0, ttl 64, id 63712, offset 0, flags [DF], proto TCP (6), length 62)
    127.0.0.1.10050 > 127.0.0.1.58212: Flags [P.], cksum 0xfe32 (incorrect -> 0xec23), seq 3:13, ack 14, win 512, options [nop,nop,TS val 750938734 ecr 750938515], length 10
2022-04-04 23:01:34.363185 IP (tos 0x0, ttl 64, id 28656, offset 0, flags [DF], proto TCP (6), length 52)
    127.0.0.1.58212 > 127.0.0.1.10050: Flags [.], cksum 0xfe28 (incorrect -> 0xf051), seq 14, ack 13, win 512, options [nop,nop,TS val 750938734 ecr 750938734], length 0
2022-04-04 23:01:34.370770 IP (tos 0x0, ttl 64, id 28657, offset 0, flags [DF], proto TCP (6), length 569)
    127.0.0.1.58212 > 127.0.0.1.10050: Flags [P.], cksum 0x002e (incorrect -> 0xb0ff), seq 14:531, ack 13, win 512, options [nop,nop,TS val 750938742 ecr 750938734], length 517
2022-04-04 23:01:34.370793 IP (tos 0x0, ttl 64, id 63713, offset 0, flags [DF], proto TCP (6), length 52)
    127.0.0.1.10050 > 127.0.0.1.58212: Flags [.], cksum 0xfe28 (incorrect -> 0xee40), seq 13, ack 531, win 508, options [nop,nop,TS val 750938742 ecr 750938742], length 0
2022-04-04 23:01:34.583195 IP (tos 0x0, ttl 64, id 63714, offset 0, flags [DF], proto TCP (6), length 3538)
    127.0.0.1.10050 > 127.0.0.1.58212: Flags [P.], cksum 0x0bc7 (incorrect -> 0x0df9), seq 13:3499, ack 531, win 512, options [nop,nop,TS val 750938954 ecr 750938742], length 3486
2022-04-04 23:01:34.583208 IP (tos 0x0, ttl 64, id 28658, offset 0, flags [DF], proto TCP (6), length 52)
    127.0.0.1.58212 > 127.0.0.1.10050: Flags [.], cksum 0xfe28 (incorrect -> 0xdf08), seq 531, ack 3499, win 494, options [nop,nop,TS val 750938954 ecr 750938954], length 0
2022-04-04 23:01:34.682022 IP (tos 0x0, ttl 64, id 63715, offset 0, flags [DF], proto TCP (6), length 55)
    127.0.0.1.10050 > 127.0.0.1.58212: Flags [P.], cksum 0xfe2b (incorrect -> 0xa572), seq 3499:3502, ack 531, win 512, options [nop,nop,TS val 750939053 ecr 750938954], length 3
2022-04-04 23:01:34.682029 IP (tos 0x0, ttl 64, id 28659, offset 0, flags [DF], proto TCP (6), length 52)
    127.0.0.1.58212 > 127.0.0.1.10050: Flags [.], cksum 0xfe28 (incorrect -> 0xde32), seq 531, ack 3502, win 507, options [nop,nop,TS val 750939053 ecr 750939053], length 0
2022-04-04 23:01:34.682501 IP (tos 0x0, ttl 64, id 28660, offset 0, flags [DF], proto TCP (6), length 116)
    127.0.0.1.58212 > 127.0.0.1.10050: Flags [P.], cksum 0xfe68 (incorrect -> 0xabe6), seq 531:595, ack 3502, win 512, options [nop,nop,TS val 750939054 ecr 750939053], length 64
2022-04-04 23:01:34.682510 IP (tos 0x0, ttl 64, id 63716, offset 0, flags [DF], proto TCP (6), length 52)
    127.0.0.1.10050 > 127.0.0.1.58212: Flags [.], cksum 0xfe28 (incorrect -> 0xddeb), seq 3502, ack 595, win 512, options [nop,nop,TS val 750939054 ecr 750939054], length 0
2022-04-04 23:01:34.683040 IP (tos 0x0, ttl 64, id 28661, offset 0, flags [DF], proto TCP (6), length 361)
    127.0.0.1.58212 > 127.0.0.1.10050: Flags [P.], cksum 0xff5d (incorrect -> 0xcbbb), seq 595:904, ack 3502, win 512, options [nop,nop,TS val 750939054 ecr 750939054], length 309
2022-04-04 23:01:34.683045 IP (tos 0x0, ttl 64, id 63717, offset 0, flags [DF], proto TCP (6), length 52)
    127.0.0.1.10050 > 127.0.0.1.58212: Flags [.], cksum 0xfe28 (incorrect -> 0xdcb8), seq 3502, ack 904, win 510, options [nop,nop,TS val 750939054 ecr 750939054], length 0
2022-04-04 23:01:34.900166 IP (tos 0x0, ttl 64, id 63718, offset 0, flags [DF], proto TCP (6), length 226)
    127.0.0.1.10050 > 127.0.0.1.58212: Flags [P.], cksum 0xfed6 (incorrect -> 0x50be), seq 3502:3676, ack 904, win 512, options [nop,nop,TS val 750939271 ecr 750939054], length 174
2022-04-04 23:01:34.900173 IP (tos 0x0, ttl 64, id 28662, offset 0, flags [DF], proto TCP (6), length 52)
    127.0.0.1.58212 > 127.0.0.1.10050: Flags [.], cksum 0xfe28 (incorrect -> 0xda57), seq 904, ack 3676, win 511, options [nop,nop,TS val 750939271 ecr 750939271], length 0
200, 11.887784242630005, 1.5224621295928955