2022-04-04 23:26:15.737683 IP (tos 0x0, ttl 64, id 43059, offset 0, flags [DF], proto TCP (6), length 60)
    127.0.0.1.51368 > 127.0.0.1.9250: Flags [S], cksum 0xfe30 (incorrect -> 0x9c81), seq 2545155355, win 65495, options [mss 65495,sackOK,TS val 752420109 ecr 0,nop,wscale 7], length 0
2022-04-04 23:26:15.737702 IP (tos 0x0, ttl 64, id 0, offset 0, flags [DF], proto TCP (6), length 60)
    127.0.0.1.9250 > 127.0.0.1.51368: Flags [S.], cksum 0xfe30 (incorrect -> 0xd582), seq 184453653, ack 2545155356, win 65483, options [mss 65495,sackOK,TS val 752420109 ecr 752420109,nop,wscale 7], length 0
2022-04-04 23:26:15.737716 IP (tos 0x0, ttl 64, id 43060, offset 0, flags [DF], proto TCP (6), length 52)
    127.0.0.1.51368 > 127.0.0.1.9250: Flags [.], cksum 0xfe28 (incorrect -> 0xfc3e), seq 1, ack 1, win 512, options [nop,nop,TS val 752420109 ecr 752420109], length 0
2022-04-04 23:26:15.737859 IP (tos 0x0, ttl 64, id 43061, offset 0, flags [DF], proto TCP (6), length 55)
    127.0.0.1.51368 > 127.0.0.1.9250: Flags [P.], cksum 0xfe2b (incorrect -> 0xf732), seq 1:4, ack 1, win 512, options [nop,nop,TS val 752420109 ecr 752420109], length 3
2022-04-04 23:26:15.737868 IP (tos 0x0, ttl 64, id 33647, offset 0, flags [DF], proto TCP (6), length 52)
    127.0.0.1.9250 > 127.0.0.1.51368: Flags [.], cksum 0xfe28 (incorrect -> 0xfc3b), seq 1, ack 4, win 512, options [nop,nop,TS val 752420109 ecr 752420109], length 0
2022-04-04 23:26:15.737890 IP (tos 0x0, ttl 64, id 33648, offset 0, flags [DF], proto TCP (6), length 54)
    127.0.0.1.9250 > 127.0.0.1.51368: Flags [P.], cksum 0xfe2a (incorrect -> 0xf731), seq 1:3, ack 4, win 512, options [nop,nop,TS val 752420109 ecr 752420109], length 2
2022-04-04 23:26:15.737899 IP (tos 0x0, ttl 64, id 43062, offset 0, flags [DF], proto TCP (6), length 52)
    127.0.0.1.51368 > 127.0.0.1.9250: Flags [.], cksum 0xfe28 (incorrect -> 0xfc39), seq 4, ack 3, win 512, options [nop,nop,TS val 752420109 ecr 752420109], length 0
2022-04-04 23:26:15.739881 IP (tos 0x0, ttl 64, id 43063, offset 0, flags [DF], proto TCP (6), length 62)
    127.0.0.1.51368 > 127.0.0.1.9250: Flags [P.], cksum 0xfe32 (incorrect -> 0x634d), seq 4:14, ack 3, win 512, options [nop,nop,TS val 752420111 ecr 752420109], length 10
2022-04-04 23:26:15.739901 IP (tos 0x0, ttl 64, id 33649, offset 0, flags [DF], proto TCP (6), length 52)
    127.0.0.1.9250 > 127.0.0.1.51368: Flags [.], cksum 0xfe28 (incorrect -> 0xfc2b), seq 3, ack 14, win 512, options [nop,nop,TS val 752420111 ecr 752420111], length 0
2022-04-04 23:26:15.857187 IP (tos 0x0, ttl 64, id 33650, offset 0, flags [DF], proto TCP (6), length 62)
    127.0.0.1.9250 > 127.0.0.1.51368: Flags [P.], cksum 0xfe32 (incorrect -> 0xf6a3), seq 3:13, ack 14, win 512, options [nop,nop,TS val 752420228 ecr 752420111], length 10
2022-04-04 23:26:15.857201 IP (tos 0x0, ttl 64, id 43064, offset 0, flags [DF], proto TCP (6), length 52)
    127.0.0.1.51368 > 127.0.0.1.9250: Flags [.], cksum 0xfe28 (incorrect -> 0xfb37), seq 14, ack 13, win 512, options [nop,nop,TS val 752420228 ecr 752420228], length 0
2022-04-04 23:26:15.863117 IP (tos 0x0, ttl 64, id 43065, offset 0, flags [DF], proto TCP (6), length 569)
    127.0.0.1.51368 > 127.0.0.1.9250: Flags [P.], cksum 0x002e (incorrect -> 0x4a2f), seq 14:531, ack 13, win 512, options [nop,nop,TS val 752420234 ecr 752420228], length 517
2022-04-04 23:26:15.863129 IP (tos 0x0, ttl 64, id 33651, offset 0, flags [DF], proto TCP (6), length 52)
    127.0.0.1.9250 > 127.0.0.1.51368: Flags [.], cksum 0xfe28 (incorrect -> 0xf92a), seq 13, ack 531, win 508, options [nop,nop,TS val 752420234 ecr 752420234], length 0
2022-04-04 23:26:15.987311 IP (tos 0x0, ttl 64, id 33652, offset 0, flags [DF], proto TCP (6), length 3538)
    127.0.0.1.9250 > 127.0.0.1.51368: Flags [P.], cksum 0x0bc7 (incorrect -> 0x0bfa), seq 13:3499, ack 531, win 512, options [nop,nop,TS val 752420358 ecr 752420234], length 3486
2022-04-04 23:26:15.987322 IP (tos 0x0, ttl 64, id 43066, offset 0, flags [DF], proto TCP (6), length 52)
    127.0.0.1.51368 > 127.0.0.1.9250: Flags [.], cksum 0xfe28 (incorrect -> 0xeaa2), seq 531, ack 3499, win 494, options [nop,nop,TS val 752420358 ecr 752420358], length 0
2022-04-04 23:26:16.047611 IP (tos 0x0, ttl 64, id 33653, offset 0, flags [DF], proto TCP (6), length 494)
    127.0.0.1.9250 > 127.0.0.1.51368: Flags [P.], cksum 0xffe2 (incorrect -> 0xc8b0), seq 3499:3941, ack 531, win 512, options [nop,nop,TS val 752420419 ecr 752420358], length 442
2022-04-04 23:26:16.047621 IP (tos 0x0, ttl 64, id 43067, offset 0, flags [DF], proto TCP (6), length 52)
    127.0.0.1.51368 > 127.0.0.1.9250: Flags [.], cksum 0xfe28 (incorrect -> 0xe862), seq 531, ack 3941, win 506, options [nop,nop,TS val 752420419 ecr 752420419], length 0
2022-04-04 23:26:16.050069 IP (tos 0x0, ttl 64, id 43068, offset 0, flags [DF], proto TCP (6), length 210)
    127.0.0.1.51368 > 127.0.0.1.9250: Flags [P.], cksum 0xfec6 (incorrect -> 0xa777), seq 531:689, ack 3941, win 512, options [nop,nop,TS val 752420421 ecr 752420419], length 158
2022-04-04 23:26:16.050080 IP (tos 0x0, ttl 64, id 33654, offset 0, flags [DF], proto TCP (6), length 52)
    127.0.0.1.9250 > 127.0.0.1.51368: Flags [.], cksum 0xfe28 (incorrect -> 0xe7bb), seq 3941, ack 689, win 511, options [nop,nop,TS val 752420421 ecr 752420421], length 0
2022-04-04 23:26:16.165593 IP (tos 0x0, ttl 64, id 33655, offset 0, flags [DF], proto TCP (6), length 394)
    127.0.0.1.9250 > 127.0.0.1.51368: Flags [P.], cksum 0xff7e (incorrect -> 0xea33), seq 3941:4283, ack 689, win 512, options [nop,nop,TS val 752420537 ecr 752420421], length 342
2022-04-04 23:26:16.165604 IP (tos 0x0, ttl 64, id 43069, offset 0, flags [DF], proto TCP (6), length 52)
    127.0.0.1.51368 > 127.0.0.1.9250: Flags [.], cksum 0xfe28 (incorrect -> 0xe57e), seq 689, ack 4283, win 510, options [nop,nop,TS val 752420537 ecr 752420537], length 0
2022-04-04 23:26:16.166053 IP (tos 0x0, ttl 64, id 43070, offset 0, flags [DF], proto TCP (6), length 340)
    127.0.0.1.51368 > 127.0.0.1.9250: Flags [P.], cksum 0xff48 (incorrect -> 0x9b71), seq 689:977, ack 4283, win 512, options [nop,nop,TS val 752420537 ecr 752420537], length 288
2022-04-04 23:26:16.166063 IP (tos 0x0, ttl 64, id 33656, offset 0, flags [DF], proto TCP (6), length 52)
    127.0.0.1.9250 > 127.0.0.1.51368: Flags [.], cksum 0xfe28 (incorrect -> 0xe45e), seq 4283, ack 977, win 510, options [nop,nop,TS val 752420537 ecr 752420537], length 0
2022-04-04 23:26:16.576834 IP (tos 0x0, ttl 64, id 33657, offset 0, flags [DF], proto TCP (6), length 2384)
    127.0.0.1.9250 > 127.0.0.1.51368: Flags [P.], cksum 0x0745 (incorrect -> 0x867b), seq 4283:6615, ack 977, win 512, options [nop,nop,TS val 752420948 ecr 752420537], length 2332
2022-04-04 23:26:16.582291 IP (tos 0x0, ttl 64, id 43071, offset 0, flags [DF], proto TCP (6), length 666)
    127.0.0.1.51368 > 127.0.0.1.9250: Flags [P.], cksum 0x008f (incorrect -> 0x1489), seq 977:1591, ack 6615, win 512, options [nop,nop,TS val 752420953 ecr 752420948], length 614
2022-04-04 23:26:16.582307 IP (tos 0x0, ttl 64, id 33658, offset 0, flags [DF], proto TCP (6), length 52)
    127.0.0.1.9250 > 127.0.0.1.51368: Flags [.], cksum 0xfe28 (incorrect -> 0xd59e), seq 6615, ack 1591, win 508, options [nop,nop,TS val 752420953 ecr 752420953], length 0
200, 4.854603290557861, 1.4576361179351807