2022-04-04 21:10:40.238136 IP (tos 0x0, ttl 64, id 52080, offset 0, flags [DF], proto TCP (6), length 60)
    127.0.0.1.36482 > 127.0.0.1.9450: Flags [S], cksum 0xfe30 (incorrect -> 0xabe2), seq 2985832604, win 65495, options [mss 65495,sackOK,TS val 744284609 ecr 0,nop,wscale 7], length 0
2022-04-04 21:10:40.238155 IP (tos 0x0, ttl 64, id 0, offset 0, flags [DF], proto TCP (6), length 60)
    127.0.0.1.9450 > 127.0.0.1.36482: Flags [S.], cksum 0xfe30 (incorrect -> 0x9ed9), seq 1326165978, ack 2985832605, win 65483, options [mss 65495,sackOK,TS val 744284609 ecr 744284609,nop,wscale 7], length 0
2022-04-04 21:10:40.238171 IP (tos 0x0, ttl 64, id 52081, offset 0, flags [DF], proto TCP (6), length 52)
    127.0.0.1.36482 > 127.0.0.1.9450: Flags [.], cksum 0xfe28 (incorrect -> 0xc595), seq 1, ack 1, win 512, options [nop,nop,TS val 744284609 ecr 744284609], length 0
2022-04-04 21:10:40.238345 IP (tos 0x0, ttl 64, id 52082, offset 0, flags [DF], proto TCP (6), length 55)
    127.0.0.1.36482 > 127.0.0.1.9450: Flags [P.], cksum 0xfe2b (incorrect -> 0xc089), seq 1:4, ack 1, win 512, options [nop,nop,TS val 744284609 ecr 744284609], length 3
2022-04-04 21:10:40.238354 IP (tos 0x0, ttl 64, id 43612, offset 0, flags [DF], proto TCP (6), length 52)
    127.0.0.1.9450 > 127.0.0.1.36482: Flags [.], cksum 0xfe28 (incorrect -> 0xc592), seq 1, ack 4, win 512, options [nop,nop,TS val 744284609 ecr 744284609], length 0
2022-04-04 21:10:40.238380 IP (tos 0x0, ttl 64, id 43613, offset 0, flags [DF], proto TCP (6), length 54)
    127.0.0.1.9450 > 127.0.0.1.36482: Flags [P.], cksum 0xfe2a (incorrect -> 0xc088), seq 1:3, ack 4, win 512, options [nop,nop,TS val 744284609 ecr 744284609], length 2
2022-04-04 21:10:40.238389 IP (tos 0x0, ttl 64, id 52083, offset 0, flags [DF], proto TCP (6), length 52)
    127.0.0.1.36482 > 127.0.0.1.9450: Flags [.], cksum 0xfe28 (incorrect -> 0xc590), seq 4, ack 3, win 512, options [nop,nop,TS val 744284609 ecr 744284609], length 0
2022-04-04 21:10:40.240019 IP (tos 0x0, ttl 64, id 52084, offset 0, flags [DF], proto TCP (6), length 62)
    127.0.0.1.36482 > 127.0.0.1.9450: Flags [P.], cksum 0xfe32 (incorrect -> 0x882f), seq 4:14, ack 3, win 512, options [nop,nop,TS val 744284611 ecr 744284609], length 10
2022-04-04 21:10:40.240040 IP (tos 0x0, ttl 64, id 43614, offset 0, flags [DF], proto TCP (6), length 52)
    127.0.0.1.9450 > 127.0.0.1.36482: Flags [.], cksum 0xfe28 (incorrect -> 0xc582), seq 3, ack 14, win 512, options [nop,nop,TS val 744284611 ecr 744284611], length 0
2022-04-04 21:10:40.334674 IP (tos 0x0, ttl 64, id 43615, offset 0, flags [DF], proto TCP (6), length 62)
    127.0.0.1.9450 > 127.0.0.1.36482: Flags [P.], cksum 0xfe32 (incorrect -> 0xc010), seq 3:13, ack 14, win 512, options [nop,nop,TS val 744284706 ecr 744284611], length 10
2022-04-04 21:10:40.334685 IP (tos 0x0, ttl 64, id 52085, offset 0, flags [DF], proto TCP (6), length 52)
    127.0.0.1.36482 > 127.0.0.1.9450: Flags [.], cksum 0xfe28 (incorrect -> 0xc4ba), seq 14, ack 13, win 512, options [nop,nop,TS val 744284706 ecr 744284706], length 0
2022-04-04 21:10:40.340680 IP (tos 0x0, ttl 64, id 52086, offset 0, flags [DF], proto TCP (6), length 569)
    127.0.0.1.36482 > 127.0.0.1.9450: Flags [P.], cksum 0x002e (incorrect -> 0x3f35), seq 14:531, ack 13, win 512, options [nop,nop,TS val 744284712 ecr 744284706], length 517
2022-04-04 21:10:40.340692 IP (tos 0x0, ttl 64, id 43616, offset 0, flags [DF], proto TCP (6), length 52)
    127.0.0.1.9450 > 127.0.0.1.36482: Flags [.], cksum 0xfe28 (incorrect -> 0xc2ad), seq 13, ack 531, win 508, options [nop,nop,TS val 744284712 ecr 744284712], length 0
200, 5.950427055358887, 0.9366483688354492