2022-04-04 23:55:00.990288 IP (tos 0x0, ttl 64, id 13491, offset 0, flags [DF], proto TCP (6), length 60)
    127.0.0.1.46940 > 127.0.0.1.10850: Flags [S], cksum 0xfe30 (incorrect -> 0x5de6), seq 3396649123, win 65495, options [mss 65495,sackOK,TS val 754145361 ecr 0,nop,wscale 7], length 0
2022-04-04 23:55:00.990297 IP (tos 0x0, ttl 64, id 0, offset 0, flags [DF], proto TCP (6), length 60)
    127.0.0.1.10850 > 127.0.0.1.46940: Flags [S.], cksum 0xfe30 (incorrect -> 0xa704), seq 3155654016, ack 3396649124, win 65483, options [mss 65495,sackOK,TS val 754145361 ecr 754145361,nop,wscale 7], length 0
2022-04-04 23:55:00.990304 IP (tos 0x0, ttl 64, id 13492, offset 0, flags [DF], proto TCP (6), length 52)
    127.0.0.1.46940 > 127.0.0.1.10850: Flags [.], cksum 0xfe28 (incorrect -> 0xcdc0), seq 1, ack 1, win 512, options [nop,nop,TS val 754145361 ecr 754145361], length 0
2022-04-04 23:55:00.990466 IP (tos 0x0, ttl 64, id 13493, offset 0, flags [DF], proto TCP (6), length 55)
    127.0.0.1.46940 > 127.0.0.1.10850: Flags [P.], cksum 0xfe2b (incorrect -> 0xc8b3), seq 1:4, ack 1, win 512, options [nop,nop,TS val 754145362 ecr 754145361], length 3
2022-04-04 23:55:00.990474 IP (tos 0x0, ttl 64, id 63772, offset 0, flags [DF], proto TCP (6), length 52)
    127.0.0.1.10850 > 127.0.0.1.46940: Flags [.], cksum 0xfe28 (incorrect -> 0xcdbb), seq 1, ack 4, win 512, options [nop,nop,TS val 754145362 ecr 754145362], length 0
2022-04-04 23:55:00.990497 IP (tos 0x0, ttl 64, id 63773, offset 0, flags [DF], proto TCP (6), length 54)
    127.0.0.1.10850 > 127.0.0.1.46940: Flags [P.], cksum 0xfe2a (incorrect -> 0xc8b1), seq 1:3, ack 4, win 512, options [nop,nop,TS val 754145362 ecr 754145362], length 2
2022-04-04 23:55:00.990505 IP (tos 0x0, ttl 64, id 13494, offset 0, flags [DF], proto TCP (6), length 52)
    127.0.0.1.46940 > 127.0.0.1.10850: Flags [.], cksum 0xfe28 (incorrect -> 0xcdb9), seq 4, ack 3, win 512, options [nop,nop,TS val 754145362 ecr 754145362], length 0
2022-04-04 23:55:01.001773 IP (tos 0x0, ttl 64, id 13495, offset 0, flags [DF], proto TCP (6), length 62)
    127.0.0.1.46940 > 127.0.0.1.10850: Flags [P.], cksum 0xfe32 (incorrect -> 0x0a0f), seq 4:14, ack 3, win 512, options [nop,nop,TS val 754145373 ecr 754145362], length 10
2022-04-04 23:55:01.001783 IP (tos 0x0, ttl 64, id 63774, offset 0, flags [DF], proto TCP (6), length 52)
    127.0.0.1.10850 > 127.0.0.1.46940: Flags [.], cksum 0xfe28 (incorrect -> 0xcd99), seq 3, ack 14, win 512, options [nop,nop,TS val 754145373 ecr 754145373], length 0
2022-04-04 23:55:01.106678 IP (tos 0x0, ttl 64, id 63775, offset 0, flags [DF], proto TCP (6), length 62)
    127.0.0.1.10850 > 127.0.0.1.46940: Flags [P.], cksum 0xfe32 (incorrect -> 0xc81d), seq 3:13, ack 14, win 512, options [nop,nop,TS val 754145478 ecr 754145373], length 10
2022-04-04 23:55:01.106686 IP (tos 0x0, ttl 64, id 13496, offset 0, flags [DF], proto TCP (6), length 52)
    127.0.0.1.46940 > 127.0.0.1.10850: Flags [.], cksum 0xfe28 (incorrect -> 0xccbd), seq 14, ack 13, win 512, options [nop,nop,TS val 754145478 ecr 754145478], length 0
2022-04-04 23:55:01.112409 IP (tos 0x0, ttl 64, id 13497, offset 0, flags [DF], proto TCP (6), length 569)
    127.0.0.1.46940 > 127.0.0.1.10850: Flags [P.], cksum 0x002e (incorrect -> 0x5487), seq 14:531, ack 13, win 512, options [nop,nop,TS val 754145484 ecr 754145478], length 517
2022-04-04 23:55:01.112419 IP (tos 0x0, ttl 64, id 63776, offset 0, flags [DF], proto TCP (6), length 52)
    127.0.0.1.10850 > 127.0.0.1.46940: Flags [.], cksum 0xfe28 (incorrect -> 0xcab0), seq 13, ack 531, win 508, options [nop,nop,TS val 754145484 ecr 754145484], length 0
2022-04-04 23:55:01.223823 IP (tos 0x0, ttl 64, id 63777, offset 0, flags [DF], proto TCP (6), length 1512)
    127.0.0.1.10850 > 127.0.0.1.46940: Flags [P.], cksum 0x03dd (incorrect -> 0xae2e), seq 13:1473, ack 531, win 512, options [nop,nop,TS val 754145595 ecr 754145484], length 1460
2022-04-04 23:55:01.223832 IP (tos 0x0, ttl 64, id 13498, offset 0, flags [DF], proto TCP (6), length 52)
    127.0.0.1.46940 > 127.0.0.1.10850: Flags [.], cksum 0xfe28 (incorrect -> 0xc424), seq 531, ack 1473, win 502, options [nop,nop,TS val 754145595 ecr 754145595], length 0
2022-04-04 23:55:01.250794 IP (tos 0x0, ttl 64, id 63778, offset 0, flags [DF], proto TCP (6), length 1959)
    127.0.0.1.10850 > 127.0.0.1.46940: Flags [P.], cksum 0x059c (incorrect -> 0x3e6b), seq 1473:3380, ack 531, win 512, options [nop,nop,TS val 754145622 ecr 754145595], length 1907
2022-04-04 23:55:01.250802 IP (tos 0x0, ttl 64, id 13499, offset 0, flags [DF], proto TCP (6), length 52)
    127.0.0.1.46940 > 127.0.0.1.10850: Flags [.], cksum 0xfe28 (incorrect -> 0xbc7d), seq 531, ack 3380, win 500, options [nop,nop,TS val 754145622 ecr 754145622], length 0
2022-04-04 23:55:01.251263 IP (tos 0x0, ttl 64, id 13500, offset 0, flags [DF], proto TCP (6), length 116)
    127.0.0.1.46940 > 127.0.0.1.10850: Flags [P.], cksum 0xfe68 (incorrect -> 0x955d), seq 531:595, ack 3380, win 512, options [nop,nop,TS val 754145622 ecr 754145622], length 64
2022-04-04 23:55:01.251272 IP (tos 0x0, ttl 64, id 63779, offset 0, flags [DF], proto TCP (6), length 52)
    127.0.0.1.10850 > 127.0.0.1.46940: Flags [.], cksum 0xfe28 (incorrect -> 0xbc31), seq 3380, ack 595, win 512, options [nop,nop,TS val 754145622 ecr 754145622], length 0
2022-04-04 23:55:01.251702 IP (tos 0x0, ttl 64, id 13501, offset 0, flags [DF], proto TCP (6), length 341)
    127.0.0.1.46940 > 127.0.0.1.10850: Flags [P.], cksum 0xff49 (incorrect -> 0x3581), seq 595:884, ack 3380, win 512, options [nop,nop,TS val 754145623 ecr 754145622], length 289
2022-04-04 23:55:01.251711 IP (tos 0x0, ttl 64, id 63780, offset 0, flags [DF], proto TCP (6), length 52)
    127.0.0.1.10850 > 127.0.0.1.46940: Flags [.], cksum 0xfe28 (incorrect -> 0xbb10), seq 3380, ack 884, win 510, options [nop,nop,TS val 754145623 ecr 754145623], length 0
2022-04-04 23:55:01.356415 IP (tos 0x0, ttl 64, id 63781, offset 0, flags [DF], proto TCP (6), length 323)
    127.0.0.1.10850 > 127.0.0.1.46940: Flags [P.], cksum 0xff37 (incorrect -> 0xf550), seq 3380:3651, ack 884, win 512, options [nop,nop,TS val 754145728 ecr 754145623], length 271
2022-04-04 23:55:01.356423 IP (tos 0x0, ttl 64, id 13502, offset 0, flags [DF], proto TCP (6), length 52)
    127.0.0.1.46940 > 127.0.0.1.10850: Flags [.], cksum 0xfe28 (incorrect -> 0xb92f), seq 884, ack 3651, win 510, options [nop,nop,TS val 754145728 ecr 754145728], length 0
2022-04-04 23:55:01.423937 IP (tos 0x0, ttl 64, id 63782, offset 0, flags [DF], proto TCP (6), length 323)
    127.0.0.1.10850 > 127.0.0.1.46940: Flags [P.], cksum 0xff37 (incorrect -> 0x3558), seq 3651:3922, ack 884, win 512, options [nop,nop,TS val 754145795 ecr 754145728], length 271
2022-04-04 23:55:01.423944 IP (tos 0x0, ttl 64, id 13503, offset 0, flags [DF], proto TCP (6), length 52)
    127.0.0.1.46940 > 127.0.0.1.10850: Flags [.], cksum 0xfe28 (incorrect -> 0xb79c), seq 884, ack 3922, win 508, options [nop,nop,TS val 754145795 ecr 754145795], length 0
2022-04-04 23:55:01.524917 IP (tos 0x0, ttl 64, id 63783, offset 0, flags [DF], proto TCP (6), length 1491)
    127.0.0.1.10850 > 127.0.0.1.46940: Flags [P.], cksum 0x03c8 (incorrect -> 0x36f6), seq 3922:5361, ack 884, win 512, options [nop,nop,TS val 754145896 ecr 754145795], length 1439
2022-04-04 23:55:01.524924 IP (tos 0x0, ttl 64, id 13504, offset 0, flags [DF], proto TCP (6), length 52)
    127.0.0.1.46940 > 127.0.0.1.10850: Flags [.], cksum 0xfe28 (incorrect -> 0xb139), seq 884, ack 5361, win 502, options [nop,nop,TS val 754145896 ecr 754145896], length 0
2022-04-04 23:55:01.547841 IP (tos 0x0, ttl 64, id 63784, offset 0, flags [DF], proto TCP (6), length 94)
    127.0.0.1.10850 > 127.0.0.1.46940: Flags [P.], cksum 0xfe52 (incorrect -> 0x0858), seq 5361:5403, ack 884, win 512, options [nop,nop,TS val 754145919 ecr 754145896], length 42
2022-04-04 23:55:01.547847 IP (tos 0x0, ttl 64, id 13505, offset 0, flags [DF], proto TCP (6), length 52)
    127.0.0.1.46940 > 127.0.0.1.10850: Flags [.], cksum 0xfe28 (incorrect -> 0xb0dc), seq 884, ack 5403, win 507, options [nop,nop,TS val 754145919 ecr 754145919], length 0
2022-04-04 23:55:01.572653 IP (tos 0x0, ttl 64, id 63785, offset 0, flags [DF], proto TCP (6), length 3194)
    127.0.0.1.10850 > 127.0.0.1.46940: Flags [P.], cksum 0x0a6f (incorrect -> 0x0a5a), seq 5403:8545, ack 884, win 512, options [nop,nop,TS val 754145944 ecr 754145919], length 3142
2022-04-04 23:55:01.572661 IP (tos 0x0, ttl 64, id 13506, offset 0, flags [DF], proto TCP (6), length 52)
    127.0.0.1.46940 > 127.0.0.1.10850: Flags [.], cksum 0xfe28 (incorrect -> 0xa470), seq 884, ack 8545, win 495, options [nop,nop,TS val 754145944 ecr 754145944], length 0
2022-04-04 23:55:01.582651 IP (tos 0x0, ttl 64, id 63786, offset 0, flags [DF], proto TCP (6), length 54)
    127.0.0.1.10850 > 127.0.0.1.46940: Flags [P.], cksum 0xfe2a (incorrect -> 0x432e), seq 8545:8547, ack 884, win 512, options [nop,nop,TS val 754145954 ecr 754145944], length 2
2022-04-04 23:55:01.582657 IP (tos 0x0, ttl 64, id 13507, offset 0, flags [DF], proto TCP (6), length 52)
    127.0.0.1.46940 > 127.0.0.1.10850: Flags [.], cksum 0xfe28 (incorrect -> 0xa44e), seq 884, ack 8547, win 507, options [nop,nop,TS val 754145954 ecr 754145954], length 0
2022-04-04 23:55:01.582750 IP (tos 0x0, ttl 64, id 63787, offset 0, flags [DF], proto TCP (6), length 3538)
    127.0.0.1.10850 > 127.0.0.1.46940: Flags [P.], cksum 0x0bc7 (incorrect -> 0x2c30), seq 8547:12033, ack 884, win 512, options [nop,nop,TS val 754145954 ecr 754145954], length 3486
2022-04-04 23:55:01.582754 IP (tos 0x0, ttl 64, id 13508, offset 0, flags [DF], proto TCP (6), length 52)
    127.0.0.1.46940 > 127.0.0.1.10850: Flags [.], cksum 0xfe28 (incorrect -> 0x96bd), seq 884, ack 12033, win 494, options [nop,nop,TS val 754145954 ecr 754145954], length 0
2022-04-04 23:55:01.584569 IP (tos 0x0, ttl 64, id 63788, offset 0, flags [DF], proto TCP (6), length 1048)
    127.0.0.1.10850 > 127.0.0.1.46940: Flags [P.], cksum 0x020d (incorrect -> 0x812d), seq 12033:13029, ack 884, win 512, options [nop,nop,TS val 754145956 ecr 754145954], length 996
2022-04-04 23:55:01.584574 IP (tos 0x0, ttl 64, id 13509, offset 0, flags [DF], proto TCP (6), length 52)
    127.0.0.1.46940 > 127.0.0.1.10850: Flags [.], cksum 0xfe28 (incorrect -> 0x92cb), seq 884, ack 13029, win 504, options [nop,nop,TS val 754145956 ecr 754145956], length 0
2022-04-04 23:55:01.585150 IP (tos 0x0, ttl 64, id 63789, offset 0, flags [DF], proto TCP (6), length 4100)
    127.0.0.1.10850 > 127.0.0.1.46940: Flags [P.], cksum 0x0df9 (incorrect -> 0x15d0), seq 13029:17077, ack 884, win 512, options [nop,nop,TS val 754145956 ecr 754145956], length 4048
2022-04-04 23:55:01.625383 IP (tos 0x0, ttl 64, id 13510, offset 0, flags [DF], proto TCP (6), length 52)
    127.0.0.1.46940 > 127.0.0.1.10850: Flags [.], cksum 0xfe28 (incorrect -> 0x82cb), seq 884, ack 17077, win 512, options [nop,nop,TS val 754145996 ecr 754145956], length 0
2022-04-04 23:55:01.625400 IP (tos 0x0, ttl 64, id 63790, offset 0, flags [DF], proto TCP (6), length 32158)
    127.0.0.1.10850 > 127.0.0.1.46940: Flags [P.], cksum 0x7b93 (incorrect -> 0x4e03), seq 17077:49183, ack 884, win 512, options [nop,nop,TS val 754145996 ecr 754145996], length 32106
2022-04-04 23:55:01.646803 IP (tos 0x0, ttl 64, id 63791, offset 0, flags [DF], proto TCP (6), length 32820)
    127.0.0.1.10850 > 127.0.0.1.46940: Flags [.], cksum 0x7e29 (incorrect -> 0x880a), seq 49183:81951, ack 884, win 512, options [nop,nop,TS val 754146018 ecr 754145996], length 32768
2022-04-04 23:55:01.646852 IP (tos 0x0, ttl 64, id 13511, offset 0, flags [DF], proto TCP (6), length 52)
    127.0.0.1.46940 > 127.0.0.1.10850: Flags [.], cksum 0xfe28 (incorrect -> 0x85a7), seq 884, ack 81951, win 379, options [nop,nop,TS val 754146018 ecr 754145996], length 0
2022-04-04 23:55:01.646862 IP (tos 0x0, ttl 64, id 63792, offset 0, flags [DF], proto TCP (6), length 5925)
    127.0.0.1.10850 > 127.0.0.1.46940: Flags [P.], cksum 0x151a (incorrect -> 0x79e6), seq 81951:87824, ack 884, win 512, options [nop,nop,TS val 754146018 ecr 754146018], length 5873
2022-04-04 23:55:01.647980 IP (tos 0x0, ttl 64, id 13512, offset 0, flags [DF], proto TCP (6), length 52)
    127.0.0.1.46940 > 127.0.0.1.10850: Flags [.], cksum 0xfe28 (incorrect -> 0x6e1a), seq 884, ack 87824, win 512, options [nop,nop,TS val 754146019 ecr 754146018], length 0
2022-04-04 23:55:01.647987 IP (tos 0x0, ttl 64, id 63793, offset 0, flags [DF], proto TCP (6), length 7522)
    127.0.0.1.10850 > 127.0.0.1.46940: Flags [P.], cksum 0x1b57 (incorrect -> 0x4288), seq 87824:95294, ack 884, win 512, options [nop,nop,TS val 754146019 ecr 754146019], length 7470
2022-04-04 23:55:01.648186 IP (tos 0x0, ttl 64, id 13513, offset 0, flags [DF], proto TCP (6), length 52)
    127.0.0.1.46940 > 127.0.0.1.10850: Flags [.], cksum 0xfe28 (incorrect -> 0x50eb), seq 884, ack 95294, win 512, options [nop,nop,TS val 754146019 ecr 754146019], length 0
2022-04-04 23:55:01.660149 IP (tos 0x0, ttl 64, id 63794, offset 0, flags [DF], proto TCP (6), length 2044)
    127.0.0.1.10850 > 127.0.0.1.46940: Flags [P.], cksum 0x05f1 (incorrect -> 0x9dce), seq 95294:97286, ack 884, win 512, options [nop,nop,TS val 754146031 ecr 754146019], length 1992
2022-04-04 23:55:01.660180 IP (tos 0x0, ttl 64, id 13514, offset 0, flags [DF], proto TCP (6), length 52)
    127.0.0.1.46940 > 127.0.0.1.10850: Flags [.], cksum 0xfe28 (incorrect -> 0x490b), seq 884, ack 97286, win 512, options [nop,nop,TS val 754146031 ecr 754146031], length 0
2022-04-04 23:55:01.667711 IP (tos 0x0, ttl 64, id 63795, offset 0, flags [DF], proto TCP (6), length 3538)
    127.0.0.1.10850 > 127.0.0.1.46940: Flags [P.], cksum 0x0bc7 (incorrect -> 0x69dc), seq 97286:100772, ack 884, win 512, options [nop,nop,TS val 754146039 ecr 754146031], length 3486
2022-04-04 23:55:01.667745 IP (tos 0x0, ttl 64, id 13515, offset 0, flags [DF], proto TCP (6), length 52)
    127.0.0.1.46940 > 127.0.0.1.10850: Flags [.], cksum 0xfe28 (incorrect -> 0x3b5d), seq 884, ack 100772, win 512, options [nop,nop,TS val 754146039 ecr 754146039], length 0
2022-04-04 23:55:01.670094 IP (tos 0x0, ttl 64, id 63796, offset 0, flags [DF], proto TCP (6), length 720)
    127.0.0.1.10850 > 127.0.0.1.46940: Flags [P.], cksum 0x00c5 (incorrect -> 0x8d93), seq 100772:101440, ack 884, win 512, options [nop,nop,TS val 754146041 ecr 754146039], length 668
2022-04-04 23:55:01.670127 IP (tos 0x0, ttl 64, id 13516, offset 0, flags [DF], proto TCP (6), length 52)
    127.0.0.1.46940 > 127.0.0.1.10850: Flags [.], cksum 0xfe28 (incorrect -> 0x38bd), seq 884, ack 101440, win 512, options [nop,nop,TS val 754146041 ecr 754146041], length 0
2022-04-04 23:55:01.672484 IP (tos 0x0, ttl 64, id 63797, offset 0, flags [DF], proto TCP (6), length 3538)
    127.0.0.1.10850 > 127.0.0.1.46940: Flags [P.], cksum 0x0bc7 (incorrect -> 0x6a51), seq 101440:104926, ack 884, win 512, options [nop,nop,TS val 754146044 ecr 754146041], length 3486
2022-04-04 23:55:01.672517 IP (tos 0x0, ttl 64, id 13517, offset 0, flags [DF], proto TCP (6), length 52)
    127.0.0.1.46940 > 127.0.0.1.10850: Flags [.], cksum 0xfe28 (incorrect -> 0x2b19), seq 884, ack 104926, win 512, options [nop,nop,TS val 754146044 ecr 754146044], length 0
2022-04-04 23:55:01.672592 IP (tos 0x0, ttl 64, id 63798, offset 0, flags [DF], proto TCP (6), length 4100)
    127.0.0.1.10850 > 127.0.0.1.46940: Flags [P.], cksum 0x0df9 (incorrect -> 0xdab0), seq 104926:108974, ack 884, win 512, options [nop,nop,TS val 754146044 ecr 754146044], length 4048
2022-04-04 23:55:01.672641 IP (tos 0x0, ttl 64, id 13518, offset 0, flags [DF], proto TCP (6), length 52)
    127.0.0.1.46940 > 127.0.0.1.10850: Flags [.], cksum 0xfe28 (incorrect -> 0x1b49), seq 884, ack 108974, win 512, options [nop,nop,TS val 754146044 ecr 754146044], length 0
2022-04-04 23:55:01.672646 IP (tos 0x0, ttl 64, id 63799, offset 0, flags [DF], proto TCP (6), length 5864)
    127.0.0.1.10850 > 127.0.0.1.46940: Flags [P.], cksum 0x14dd (incorrect -> 0xe958), seq 108974:114786, ack 884, win 512, options [nop,nop,TS val 754146044 ecr 754146044], length 5812
2022-04-04 23:55:01.672884 IP (tos 0x0, ttl 64, id 13519, offset 0, flags [DF], proto TCP (6), length 52)
    127.0.0.1.46940 > 127.0.0.1.10850: Flags [.], cksum 0xfe28 (incorrect -> 0x0495), seq 884, ack 114786, win 512, options [nop,nop,TS val 754146044 ecr 754146044], length 0
2022-04-04 23:55:01.680742 IP (tos 0x0, ttl 64, id 63800, offset 0, flags [DF], proto TCP (6), length 3486)
    127.0.0.1.10850 > 127.0.0.1.46940: Flags [P.], cksum 0x0b93 (incorrect -> 0x763c), seq 114786:118220, ack 884, win 512, options [nop,nop,TS val 754146052 ecr 754146044], length 3434
2022-04-04 23:55:01.680781 IP (tos 0x0, ttl 64, id 13520, offset 0, flags [DF], proto TCP (6), length 52)
    127.0.0.1.46940 > 127.0.0.1.10850: Flags [.], cksum 0xfe28 (incorrect -> 0xf71a), seq 884, ack 118220, win 512, options [nop,nop,TS val 754146052 ecr 754146052], length 0
2022-04-04 23:55:01.680851 IP (tos 0x0, ttl 64, id 63801, offset 0, flags [DF], proto TCP (6), length 4036)
    127.0.0.1.10850 > 127.0.0.1.46940: Flags [P.], cksum 0x0db9 (incorrect -> 0xc1cd), seq 118220:122204, ack 884, win 512, options [nop,nop,TS val 754146052 ecr 754146052], length 3984
2022-04-04 23:55:01.680881 IP (tos 0x0, ttl 64, id 13521, offset 0, flags [DF], proto TCP (6), length 52)
    127.0.0.1.46940 > 127.0.0.1.10850: Flags [.], cksum 0xfe28 (incorrect -> 0xe78a), seq 884, ack 122204, win 512, options [nop,nop,TS val 754146052 ecr 754146052], length 0
200, 5.888200521469116, 0.9490125179290771