2022-04-04 23:01:02.057852 IP (tos 0x0, ttl 64, id 3174, offset 0, flags [DF], proto TCP (6), length 60)
    127.0.0.1.34834 > 127.0.0.1.12050: Flags [S], cksum 0xfe30 (incorrect -> 0x3a02), seq 3498276184, win 65495, options [mss 65495,sackOK,TS val 750906429 ecr 0,nop,wscale 7], length 0
2022-04-04 23:01:02.057870 IP (tos 0x0, ttl 64, id 0, offset 0, flags [DF], proto TCP (6), length 60)
    127.0.0.1.12050 > 127.0.0.1.34834: Flags [S.], cksum 0xfe30 (incorrect -> 0x1c5f), seq 3377609548, ack 3498276185, win 65483, options [mss 65495,sackOK,TS val 750906429 ecr 750906429,nop,wscale 7], length 0
2022-04-04 23:01:02.057881 IP (tos 0x0, ttl 64, id 3175, offset 0, flags [DF], proto TCP (6), length 52)
    127.0.0.1.34834 > 127.0.0.1.12050: Flags [.], cksum 0xfe28 (incorrect -> 0x431b), seq 1, ack 1, win 512, options [nop,nop,TS val 750906429 ecr 750906429], length 0
2022-04-04 23:01:02.057980 IP (tos 0x0, ttl 64, id 3176, offset 0, flags [DF], proto TCP (6), length 55)
    127.0.0.1.34834 > 127.0.0.1.12050: Flags [P.], cksum 0xfe2b (incorrect -> 0x3e0f), seq 1:4, ack 1, win 512, options [nop,nop,TS val 750906429 ecr 750906429], length 3
2022-04-04 23:01:02.057984 IP (tos 0x0, ttl 64, id 9668, offset 0, flags [DF], proto TCP (6), length 52)
    127.0.0.1.12050 > 127.0.0.1.34834: Flags [.], cksum 0xfe28 (incorrect -> 0x4318), seq 1, ack 4, win 512, options [nop,nop,TS val 750906429 ecr 750906429], length 0
2022-04-04 23:01:02.058123 IP (tos 0x0, ttl 64, id 9669, offset 0, flags [DF], proto TCP (6), length 54)
    127.0.0.1.12050 > 127.0.0.1.34834: Flags [P.], cksum 0xfe2a (incorrect -> 0x3e0e), seq 1:3, ack 4, win 512, options [nop,nop,TS val 750906429 ecr 750906429], length 2
2022-04-04 23:01:02.058152 IP (tos 0x0, ttl 64, id 3177, offset 0, flags [DF], proto TCP (6), length 52)
    127.0.0.1.34834 > 127.0.0.1.12050: Flags [.], cksum 0xfe28 (incorrect -> 0x4316), seq 4, ack 3, win 512, options [nop,nop,TS val 750906429 ecr 750906429], length 0
2022-04-04 23:01:02.077107 IP (tos 0x0, ttl 64, id 3178, offset 0, flags [DF], proto TCP (6), length 62)
    127.0.0.1.34834 > 127.0.0.1.12050: Flags [P.], cksum 0xfe32 (incorrect -> 0x7ed6), seq 4:14, ack 3, win 512, options [nop,nop,TS val 750906448 ecr 750906429], length 10
2022-04-04 23:01:02.077121 IP (tos 0x0, ttl 64, id 9670, offset 0, flags [DF], proto TCP (6), length 52)
    127.0.0.1.12050 > 127.0.0.1.34834: Flags [.], cksum 0xfe28 (incorrect -> 0x42e6), seq 3, ack 14, win 512, options [nop,nop,TS val 750906448 ecr 750906448], length 0
2022-04-04 23:01:02.128871 IP (tos 0x0, ttl 64, id 9671, offset 0, flags [DF], proto TCP (6), length 62)
    127.0.0.1.12050 > 127.0.0.1.34834: Flags [P.], cksum 0xfe32 (incorrect -> 0x3d9f), seq 3:13, ack 14, win 512, options [nop,nop,TS val 750906500 ecr 750906448], length 10
2022-04-04 23:01:02.128878 IP (tos 0x0, ttl 64, id 3179, offset 0, flags [DF], proto TCP (6), length 52)
    127.0.0.1.34834 > 127.0.0.1.12050: Flags [.], cksum 0xfe28 (incorrect -> 0x4274), seq 14, ack 13, win 512, options [nop,nop,TS val 750906500 ecr 750906500], length 0
2022-04-04 23:01:02.134629 IP (tos 0x0, ttl 64, id 3180, offset 0, flags [DF], proto TCP (6), length 569)
    127.0.0.1.34834 > 127.0.0.1.12050: Flags [P.], cksum 0x002e (incorrect -> 0x9cfe), seq 14:531, ack 13, win 512, options [nop,nop,TS val 750906506 ecr 750906500], length 517
2022-04-04 23:01:02.134647 IP (tos 0x0, ttl 64, id 9672, offset 0, flags [DF], proto TCP (6), length 52)
    127.0.0.1.12050 > 127.0.0.1.34834: Flags [.], cksum 0xfe28 (incorrect -> 0x4067), seq 13, ack 531, win 508, options [nop,nop,TS val 750906506 ecr 750906506], length 0
2022-04-04 23:01:02.192987 IP (tos 0x0, ttl 64, id 9673, offset 0, flags [DF], proto TCP (6), length 3538)
    127.0.0.1.12050 > 127.0.0.1.34834: Flags [P.], cksum 0x0bc7 (incorrect -> 0x85ea), seq 13:3499, ack 531, win 512, options [nop,nop,TS val 750906564 ecr 750906506], length 3486
2022-04-04 23:01:02.192993 IP (tos 0x0, ttl 64, id 3181, offset 0, flags [DF], proto TCP (6), length 52)
    127.0.0.1.34834 > 127.0.0.1.12050: Flags [.], cksum 0xfe28 (incorrect -> 0x3263), seq 531, ack 3499, win 494, options [nop,nop,TS val 750906564 ecr 750906564], length 0
200, 123.16299390792847, 0.41335082054138184