2022-04-04 23:44:39.991027 IP (tos 0x0, ttl 64, id 52643, offset 0, flags [DF], proto TCP (6), length 60)
    127.0.0.1.34472 > 127.0.0.1.10750: Flags [S], cksum 0xfe30 (incorrect -> 0x7725), seq 1326108087, win 65495, options [mss 65495,sackOK,TS val 753524362 ecr 0,nop,wscale 7], length 0
2022-04-04 23:44:39.991040 IP (tos 0x0, ttl 64, id 0, offset 0, flags [DF], proto TCP (6), length 60)
    127.0.0.1.10750 > 127.0.0.1.34472: Flags [S.], cksum 0xfe30 (incorrect -> 0x61ee), seq 2864799484, ack 1326108088, win 65483, options [mss 65495,sackOK,TS val 753524362 ecr 753524362,nop,wscale 7], length 0
2022-04-04 23:44:39.991050 IP (tos 0x0, ttl 64, id 52644, offset 0, flags [DF], proto TCP (6), length 52)
    127.0.0.1.34472 > 127.0.0.1.10750: Flags [.], cksum 0xfe28 (incorrect -> 0x88aa), seq 1, ack 1, win 512, options [nop,nop,TS val 753524362 ecr 753524362], length 0
2022-04-04 23:44:39.991164 IP (tos 0x0, ttl 64, id 52645, offset 0, flags [DF], proto TCP (6), length 55)
    127.0.0.1.34472 > 127.0.0.1.10750: Flags [P.], cksum 0xfe2b (incorrect -> 0x839e), seq 1:4, ack 1, win 512, options [nop,nop,TS val 753524362 ecr 753524362], length 3
2022-04-04 23:44:39.991180 IP (tos 0x0, ttl 64, id 19007, offset 0, flags [DF], proto TCP (6), length 52)
    127.0.0.1.10750 > 127.0.0.1.34472: Flags [.], cksum 0xfe28 (incorrect -> 0x88a7), seq 1, ack 4, win 512, options [nop,nop,TS val 753524362 ecr 753524362], length 0
2022-04-04 23:44:39.991209 IP (tos 0x0, ttl 64, id 19008, offset 0, flags [DF], proto TCP (6), length 54)
    127.0.0.1.10750 > 127.0.0.1.34472: Flags [P.], cksum 0xfe2a (incorrect -> 0x839d), seq 1:3, ack 4, win 512, options [nop,nop,TS val 753524362 ecr 753524362], length 2
2022-04-04 23:44:39.991222 IP (tos 0x0, ttl 64, id 52646, offset 0, flags [DF], proto TCP (6), length 52)
    127.0.0.1.34472 > 127.0.0.1.10750: Flags [.], cksum 0xfe28 (incorrect -> 0x88a5), seq 4, ack 3, win 512, options [nop,nop,TS val 753524362 ecr 753524362], length 0
2022-04-04 23:44:39.992632 IP (tos 0x0, ttl 64, id 52647, offset 0, flags [DF], proto TCP (6), length 62)
    127.0.0.1.34472 > 127.0.0.1.10750: Flags [P.], cksum 0xfe32 (incorrect -> 0x305f), seq 4:14, ack 3, win 512, options [nop,nop,TS val 753524364 ecr 753524362], length 10
2022-04-04 23:44:39.992652 IP (tos 0x0, ttl 64, id 19009, offset 0, flags [DF], proto TCP (6), length 52)
    127.0.0.1.10750 > 127.0.0.1.34472: Flags [.], cksum 0xfe28 (incorrect -> 0x8897), seq 3, ack 14, win 512, options [nop,nop,TS val 753524364 ecr 753524364], length 0
2022-04-04 23:44:40.033382 IP (tos 0x0, ttl 64, id 19010, offset 0, flags [DF], proto TCP (6), length 62)
    127.0.0.1.10750 > 127.0.0.1.34472: Flags [P.], cksum 0xfe32 (incorrect -> 0x835c), seq 3:13, ack 14, win 512, options [nop,nop,TS val 753524404 ecr 753524364], length 10
2022-04-04 23:44:40.033397 IP (tos 0x0, ttl 64, id 52648, offset 0, flags [DF], proto TCP (6), length 52)
    127.0.0.1.34472 > 127.0.0.1.10750: Flags [.], cksum 0xfe28 (incorrect -> 0x883d), seq 14, ack 13, win 512, options [nop,nop,TS val 753524404 ecr 753524404], length 0
2022-04-04 23:44:40.039106 IP (tos 0x0, ttl 64, id 52649, offset 0, flags [DF], proto TCP (6), length 569)
    127.0.0.1.34472 > 127.0.0.1.10750: Flags [P.], cksum 0x002e (incorrect -> 0x42d6), seq 14:531, ack 13, win 512, options [nop,nop,TS val 753524410 ecr 753524404], length 517
2022-04-04 23:44:40.039135 IP (tos 0x0, ttl 64, id 19011, offset 0, flags [DF], proto TCP (6), length 52)
    127.0.0.1.10750 > 127.0.0.1.34472: Flags [.], cksum 0xfe28 (incorrect -> 0x8630), seq 13, ack 531, win 508, options [nop,nop,TS val 753524410 ecr 753524410], length 0
2022-04-04 23:44:40.080685 IP (tos 0x0, ttl 64, id 19012, offset 0, flags [DF], proto TCP (6), length 3538)
    127.0.0.1.10750 > 127.0.0.1.34472: Flags [P.], cksum 0x0bc7 (incorrect -> 0xd155), seq 13:3499, ack 531, win 512, options [nop,nop,TS val 753524452 ecr 753524410], length 3486
2022-04-04 23:44:40.080697 IP (tos 0x0, ttl 64, id 52650, offset 0, flags [DF], proto TCP (6), length 52)
    127.0.0.1.34472 > 127.0.0.1.10750: Flags [.], cksum 0xfe28 (incorrect -> 0x784c), seq 531, ack 3499, win 494, options [nop,nop,TS val 753524452 ecr 753524452], length 0
2022-04-04 23:44:40.093470 IP (tos 0x0, ttl 64, id 19013, offset 0, flags [DF], proto TCP (6), length 272)
    127.0.0.1.10750 > 127.0.0.1.34472: Flags [P.], cksum 0xff04 (incorrect -> 0xf8d4), seq 3499:3719, ack 531, win 512, options [nop,nop,TS val 753524465 ecr 753524452], length 220
2022-04-04 23:44:40.093485 IP (tos 0x0, ttl 64, id 52651, offset 0, flags [DF], proto TCP (6), length 52)
    127.0.0.1.34472 > 127.0.0.1.10750: Flags [.], cksum 0xfe28 (incorrect -> 0x7749), seq 531, ack 3719, win 507, options [nop,nop,TS val 753524465 ecr 753524465], length 0
2022-04-04 23:44:40.093614 IP (tos 0x0, ttl 64, id 52652, offset 0, flags [DF], proto TCP (6), length 132)
    127.0.0.1.34472 > 127.0.0.1.10750: Flags [P.], cksum 0xfe78 (incorrect -> 0x0d2d), seq 531:611, ack 3719, win 507, options [nop,nop,TS val 753524465 ecr 753524465], length 80
2022-04-04 23:44:40.093626 IP (tos 0x0, ttl 64, id 19014, offset 0, flags [DF], proto TCP (6), length 52)
    127.0.0.1.10750 > 127.0.0.1.34472: Flags [.], cksum 0xfe28 (incorrect -> 0x76f4), seq 3719, ack 611, win 512, options [nop,nop,TS val 753524465 ecr 753524465], length 0
2022-04-04 23:44:40.094003 IP (tos 0x0, ttl 64, id 52653, offset 0, flags [DF], proto TCP (6), length 346)
    127.0.0.1.34472 > 127.0.0.1.10750: Flags [P.], cksum 0xff4e (incorrect -> 0xfab0), seq 611:905, ack 3719, win 507, options [nop,nop,TS val 753524465 ecr 753524465], length 294
2022-04-04 23:44:40.094013 IP (tos 0x0, ttl 64, id 19015, offset 0, flags [DF], proto TCP (6), length 52)
    127.0.0.1.10750 > 127.0.0.1.34472: Flags [.], cksum 0xfe28 (incorrect -> 0x75d0), seq 3719, ack 905, win 510, options [nop,nop,TS val 753524465 ecr 753524465], length 0
2022-04-04 23:44:40.444219 IP (tos 0x0, ttl 64, id 19016, offset 0, flags [DF], proto TCP (6), length 3230)
    127.0.0.1.10750 > 127.0.0.1.34472: Flags [P.], cksum 0x0a93 (incorrect -> 0x5106), seq 3719:6897, ack 905, win 512, options [nop,nop,TS val 753524815 ecr 753524465], length 3178
2022-04-04 23:44:40.444229 IP (tos 0x0, ttl 64, id 52654, offset 0, flags [DF], proto TCP (6), length 52)
    127.0.0.1.34472 > 127.0.0.1.10750: Flags [.], cksum 0xfe28 (incorrect -> 0x66b9), seq 905, ack 6897, win 495, options [nop,nop,TS val 753524815 ecr 753524815], length 0
2022-04-04 23:44:40.444317 IP (tos 0x0, ttl 64, id 19017, offset 0, flags [DF], proto TCP (6), length 1546)
    127.0.0.1.10750 > 127.0.0.1.34472: Flags [P.], cksum 0x03ff (incorrect -> 0x11af), seq 6897:8391, ack 905, win 512, options [nop,nop,TS val 753524815 ecr 753524815], length 1494
2022-04-04 23:44:40.444324 IP (tos 0x0, ttl 64, id 52655, offset 0, flags [DF], proto TCP (6), length 52)
    127.0.0.1.34472 > 127.0.0.1.10750: Flags [.], cksum 0xfe28 (incorrect -> 0x60e9), seq 905, ack 8391, win 489, options [nop,nop,TS val 753524815 ecr 753524815], length 0
2022-04-04 23:44:40.444530 IP (tos 0x0, ttl 64, id 19018, offset 0, flags [DF], proto TCP (6), length 4100)
    127.0.0.1.10750 > 127.0.0.1.34472: Flags [P.], cksum 0x0df9 (incorrect -> 0xc9c2), seq 8391:12439, ack 905, win 512, options [nop,nop,TS val 753524816 ecr 753524815], length 4048
2022-04-04 23:44:40.444541 IP (tos 0x0, ttl 64, id 52656, offset 0, flags [DF], proto TCP (6), length 52)
    127.0.0.1.34472 > 127.0.0.1.10750: Flags [.], cksum 0xfe28 (incorrect -> 0x5127), seq 905, ack 12439, win 473, options [nop,nop,TS val 753524816 ecr 753524816], length 0
2022-04-04 23:44:40.444554 IP (tos 0x0, ttl 64, id 19019, offset 0, flags [DF], proto TCP (6), length 486)
    127.0.0.1.10750 > 127.0.0.1.34472: Flags [P.], cksum 0xffda (incorrect -> 0x1838), seq 12439:12873, ack 905, win 512, options [nop,nop,TS val 753524816 ecr 753524816], length 434
2022-04-04 23:44:40.444562 IP (tos 0x0, ttl 64, id 52657, offset 0, flags [DF], proto TCP (6), length 52)
    127.0.0.1.34472 > 127.0.0.1.10750: Flags [.], cksum 0xfe28 (incorrect -> 0x4f76), seq 905, ack 12873, win 472, options [nop,nop,TS val 753524816 ecr 753524816], length 0
2022-04-04 23:44:40.444616 IP (tos 0x0, ttl 64, id 19020, offset 0, flags [DF], proto TCP (6), length 3310)
    127.0.0.1.10750 > 127.0.0.1.34472: Flags [P.], cksum 0x0ae3 (incorrect -> 0x5fe0), seq 12873:16131, ack 905, win 512, options [nop,nop,TS val 753524816 ecr 753524816], length 3258
2022-04-04 23:44:40.444624 IP (tos 0x0, ttl 64, id 52658, offset 0, flags [DF], proto TCP (6), length 52)
    127.0.0.1.34472 > 127.0.0.1.10750: Flags [.], cksum 0xfe28 (incorrect -> 0x42c9), seq 905, ack 16131, win 459, options [nop,nop,TS val 753524816 ecr 753524816], length 0
2022-04-04 23:44:40.457162 IP (tos 0x0, ttl 64, id 19021, offset 0, flags [DF], proto TCP (6), length 3884)
    127.0.0.1.10750 > 127.0.0.1.34472: Flags [P.], cksum 0x0d21 (incorrect -> 0x7922), seq 16131:19963, ack 905, win 512, options [nop,nop,TS val 753524828 ecr 753524816], length 3832
2022-04-04 23:44:40.457178 IP (tos 0x0, ttl 64, id 52659, offset 0, flags [DF], proto TCP (6), length 52)
    127.0.0.1.34472 > 127.0.0.1.10750: Flags [.], cksum 0xfe28 (incorrect -> 0x3397), seq 905, ack 19963, win 493, options [nop,nop,TS val 753524828 ecr 753524828], length 0
2022-04-04 23:44:40.457271 IP (tos 0x0, ttl 64, id 19022, offset 0, flags [DF], proto TCP (6), length 4100)
    127.0.0.1.10750 > 127.0.0.1.34472: Flags [P.], cksum 0x0df9 (incorrect -> 0xa3ed), seq 19963:24011, ack 905, win 512, options [nop,nop,TS val 753524828 ecr 753524828], length 4048
2022-04-04 23:44:40.457281 IP (tos 0x0, ttl 64, id 52660, offset 0, flags [DF], proto TCP (6), length 52)
    127.0.0.1.34472 > 127.0.0.1.10750: Flags [.], cksum 0xfe28 (incorrect -> 0x23d7), seq 905, ack 24011, win 477, options [nop,nop,TS val 753524828 ecr 753524828], length 0
2022-04-04 23:44:40.457294 IP (tos 0x0, ttl 64, id 19023, offset 0, flags [DF], proto TCP (6), length 3100)
    127.0.0.1.10750 > 127.0.0.1.34472: Flags [P.], cksum 0x0a11 (incorrect -> 0x5eea), seq 24011:27059, ack 905, win 512, options [nop,nop,TS val 753524828 ecr 753524828], length 3048
2022-04-04 23:44:40.457302 IP (tos 0x0, ttl 64, id 52661, offset 0, flags [DF], proto TCP (6), length 52)
    127.0.0.1.34472 > 127.0.0.1.10750: Flags [.], cksum 0xfe28 (incorrect -> 0x17fb), seq 905, ack 27059, win 465, options [nop,nop,TS val 753524828 ecr 753524828], length 0
2022-04-04 23:44:40.457439 IP (tos 0x0, ttl 64, id 19024, offset 0, flags [DF], proto TCP (6), length 2926)
    127.0.0.1.10750 > 127.0.0.1.34472: Flags [P.], cksum 0x0963 (incorrect -> 0x8119), seq 27059:29933, ack 905, win 512, options [nop,nop,TS val 753524829 ecr 753524828], length 2874
2022-04-04 23:44:40.457446 IP (tos 0x0, ttl 64, id 52662, offset 0, flags [DF], proto TCP (6), length 52)
    127.0.0.1.34472 > 127.0.0.1.10750: Flags [.], cksum 0xfe28 (incorrect -> 0x0cca), seq 905, ack 29933, win 454, options [nop,nop,TS val 753524829 ecr 753524829], length 0
2022-04-04 23:44:40.457533 IP (tos 0x0, ttl 64, id 19025, offset 0, flags [DF], proto TCP (6), length 3500)
    127.0.0.1.10750 > 127.0.0.1.34472: Flags [P.], cksum 0x0ba1 (incorrect -> 0xc882), seq 29933:33381, ack 905, win 512, options [nop,nop,TS val 753524829 ecr 753524829], length 3448
2022-04-04 23:44:40.457777 IP (tos 0x0, ttl 64, id 52663, offset 0, flags [DF], proto TCP (6), length 52)
    127.0.0.1.34472 > 127.0.0.1.10750: Flags [.], cksum 0xfe28 (incorrect -> 0xff17), seq 905, ack 33381, win 512, options [nop,nop,TS val 753524829 ecr 753524829], length 0
2022-04-04 23:44:40.457791 IP (tos 0x0, ttl 64, id 19026, offset 0, flags [DF], proto TCP (6), length 7792)
    127.0.0.1.10750 > 127.0.0.1.34472: Flags [P.], cksum 0x1c65 (incorrect -> 0x186e), seq 33381:41121, ack 905, win 512, options [nop,nop,TS val 753524829 ecr 753524829], length 7740
2022-04-04 23:44:40.501398 IP (tos 0x0, ttl 64, id 52664, offset 0, flags [DF], proto TCP (6), length 52)
    127.0.0.1.34472 > 127.0.0.1.10750: Flags [.], cksum 0xfe28 (incorrect -> 0xe0b0), seq 905, ack 41121, win 512, options [nop,nop,TS val 753524872 ecr 753524829], length 0
2022-04-04 23:44:40.501410 IP (tos 0x0, ttl 64, id 19027, offset 0, flags [DF], proto TCP (6), length 17267)
    127.0.0.1.10750 > 127.0.0.1.34472: Flags [P.], cksum 0x4168 (incorrect -> 0xfed8), seq 41121:58336, ack 905, win 512, options [nop,nop,TS val 753524873 ecr 753524872], length 17215
2022-04-04 23:44:40.545397 IP (tos 0x0, ttl 64, id 52665, offset 0, flags [DF], proto TCP (6), length 52)
    127.0.0.1.34472 > 127.0.0.1.10750: Flags [.], cksum 0xfe28 (incorrect -> 0x9d19), seq 905, ack 58336, win 512, options [nop,nop,TS val 753524916 ecr 753524873], length 0
2022-04-04 23:44:41.447089 IP (tos 0x0, ttl 64, id 19028, offset 0, flags [DF], proto TCP (6), length 603)
    127.0.0.1.10750 > 127.0.0.1.34472: Flags [P.], cksum 0x0050 (incorrect -> 0x5f79), seq 58336:58887, ack 905, win 512, options [nop,nop,TS val 753525818 ecr 753524916], length 551
2022-04-04 23:44:41.447102 IP (tos 0x0, ttl 64, id 52666, offset 0, flags [DF], proto TCP (6), length 52)
    127.0.0.1.34472 > 127.0.0.1.10750: Flags [.], cksum 0xfe28 (incorrect -> 0x93bf), seq 905, ack 58887, win 508, options [nop,nop,TS val 753525818 ecr 753525818], length 0
2022-04-04 23:44:41.472918 IP (tos 0x0, ttl 64, id 19029, offset 0, flags [DF], proto TCP (6), length 3174)
    127.0.0.1.10750 > 127.0.0.1.34472: Flags [P.], cksum 0x0a5b (incorrect -> 0xa61e), seq 58887:62009, ack 905, win 512, options [nop,nop,TS val 753525844 ecr 753525818], length 3122
2022-04-04 23:44:41.473031 IP (tos 0x0, ttl 64, id 52667, offset 0, flags [DF], proto TCP (6), length 52)
    127.0.0.1.34472 > 127.0.0.1.10750: Flags [.], cksum 0xfe28 (incorrect -> 0x8755), seq 905, ack 62009, win 512, options [nop,nop,TS val 753525844 ecr 753525844], length 0
2022-04-04 23:44:41.475212 IP (tos 0x0, ttl 64, id 19030, offset 0, flags [DF], proto TCP (6), length 4036)
    127.0.0.1.10750 > 127.0.0.1.34472: Flags [P.], cksum 0x0db9 (incorrect -> 0xb316), seq 62009:65993, ack 905, win 512, options [nop,nop,TS val 753525846 ecr 753525844], length 3984
2022-04-04 23:44:41.475227 IP (tos 0x0, ttl 64, id 52668, offset 0, flags [DF], proto TCP (6), length 52)
    127.0.0.1.34472 > 127.0.0.1.10750: Flags [.], cksum 0xfe28 (incorrect -> 0x77c1), seq 905, ack 65993, win 512, options [nop,nop,TS val 753525846 ecr 753525846], length 0
2022-04-04 23:44:41.483258 IP (tos 0x0, ttl 64, id 19031, offset 0, flags [DF], proto TCP (6), length 3272)
    127.0.0.1.10750 > 127.0.0.1.34472: Flags [P.], cksum 0x0abd (incorrect -> 0x9f6c), seq 65993:69213, ack 905, win 512, options [nop,nop,TS val 753525854 ecr 753525846], length 3220
2022-04-04 23:44:41.483272 IP (tos 0x0, ttl 64, id 52669, offset 0, flags [DF], proto TCP (6), length 52)
    127.0.0.1.34472 > 127.0.0.1.10750: Flags [.], cksum 0xfe28 (incorrect -> 0x6b1d), seq 905, ack 69213, win 512, options [nop,nop,TS val 753525854 ecr 753525854], length 0
2022-04-04 23:44:41.485713 IP (tos 0x0, ttl 64, id 19032, offset 0, flags [DF], proto TCP (6), length 3163)
    127.0.0.1.10750 > 127.0.0.1.34472: Flags [P.], cksum 0x0a50 (incorrect -> 0x7681), seq 69213:72324, ack 905, win 512, options [nop,nop,TS val 753525857 ecr 753525854], length 3111
2022-04-04 23:44:41.486068 IP (tos 0x0, ttl 64, id 52670, offset 0, flags [DF], proto TCP (6), length 52)
    127.0.0.1.34472 > 127.0.0.1.10750: Flags [.], cksum 0xfe28 (incorrect -> 0x5ef0), seq 905, ack 72324, win 512, options [nop,nop,TS val 753525857 ecr 753525857], length 0
2022-04-04 23:44:41.486081 IP (tos 0x0, ttl 64, id 19033, offset 0, flags [DF], proto TCP (6), length 13000)
    127.0.0.1.10750 > 127.0.0.1.34472: Flags [P.], cksum 0x30bd (incorrect -> 0xd066), seq 72324:85272, ack 905, win 512, options [nop,nop,TS val 753525857 ecr 753525857], length 12948
2022-04-04 23:44:41.486151 IP (tos 0x0, ttl 64, id 52671, offset 0, flags [DF], proto TCP (6), length 52)
    127.0.0.1.34472 > 127.0.0.1.10750: Flags [.], cksum 0xfe28 (incorrect -> 0x2c5c), seq 905, ack 85272, win 512, options [nop,nop,TS val 753525857 ecr 753525857], length 0
2022-04-04 23:44:41.488125 IP (tos 0x0, ttl 64, id 19034, offset 0, flags [DF], proto TCP (6), length 4100)
    127.0.0.1.10750 > 127.0.0.1.34472: Flags [P.], cksum 0x0df9 (incorrect -> 0x22ae), seq 85272:89320, ack 905, win 512, options [nop,nop,TS val 753525859 ecr 753525857], length 4048
2022-04-04 23:44:41.488505 IP (tos 0x0, ttl 64, id 52672, offset 0, flags [DF], proto TCP (6), length 52)
    127.0.0.1.34472 > 127.0.0.1.10750: Flags [.], cksum 0xfe28 (incorrect -> 0x1c87), seq 905, ack 89320, win 512, options [nop,nop,TS val 753525860 ecr 753525859], length 0
2022-04-04 23:44:41.488512 IP (tos 0x0, ttl 64, id 19035, offset 0, flags [DF], proto TCP (6), length 2573)
    127.0.0.1.10750 > 127.0.0.1.34472: Flags [P.], cksum 0x0802 (incorrect -> 0xcbe3), seq 89320:91841, ack 905, win 512, options [nop,nop,TS val 753525860 ecr 753525860], length 2521
2022-04-04 23:44:41.488517 IP (tos 0x0, ttl 64, id 52673, offset 0, flags [DF], proto TCP (6), length 52)
    127.0.0.1.34472 > 127.0.0.1.10750: Flags [.], cksum 0xfe28 (incorrect -> 0x12ad), seq 905, ack 91841, win 512, options [nop,nop,TS val 753525860 ecr 753525860], length 0
2022-04-04 23:44:41.496092 IP (tos 0x0, ttl 64, id 19036, offset 0, flags [DF], proto TCP (6), length 2542)
    127.0.0.1.10750 > 127.0.0.1.34472: Flags [P.], cksum 0x07e3 (incorrect -> 0x9037), seq 91841:94331, ack 905, win 512, options [nop,nop,TS val 753525867 ecr 753525860], length 2490
2022-04-04 23:44:41.496152 IP (tos 0x0, ttl 64, id 52674, offset 0, flags [DF], proto TCP (6), length 52)
    127.0.0.1.34472 > 127.0.0.1.10750: Flags [.], cksum 0xfe28 (incorrect -> 0x08e5), seq 905, ack 94331, win 512, options [nop,nop,TS val 753525867 ecr 753525867], length 0
2022-04-04 23:44:41.496158 IP (tos 0x0, ttl 64, id 19037, offset 0, flags [DF], proto TCP (6), length 3538)
    127.0.0.1.10750 > 127.0.0.1.34472: Flags [P.], cksum 0x0bc7 (incorrect -> 0xc807), seq 94331:97817, ack 905, win 512, options [nop,nop,TS val 753525867 ecr 753525867], length 3486
2022-04-04 23:44:41.496163 IP (tos 0x0, ttl 64, id 52675, offset 0, flags [DF], proto TCP (6), length 52)
    127.0.0.1.34472 > 127.0.0.1.10750: Flags [.], cksum 0xfe28 (incorrect -> 0xfb46), seq 905, ack 97817, win 512, options [nop,nop,TS val 753525867 ecr 753525867], length 0
2022-04-04 23:44:41.498673 IP (tos 0x0, ttl 64, id 19038, offset 0, flags [DF], proto TCP (6), length 4100)
    127.0.0.1.10750 > 127.0.0.1.34472: Flags [P.], cksum 0x0df9 (incorrect -> 0xd9c8), seq 97817:101865, ack 905, win 512, options [nop,nop,TS val 753525870 ecr 753525867], length 4048
2022-04-04 23:44:41.498700 IP (tos 0x0, ttl 64, id 52676, offset 0, flags [DF], proto TCP (6), length 52)
    127.0.0.1.34472 > 127.0.0.1.10750: Flags [.], cksum 0xfe28 (incorrect -> 0xeb70), seq 905, ack 101865, win 512, options [nop,nop,TS val 753525870 ecr 753525870], length 0
2022-04-04 23:44:41.498705 IP (tos 0x0, ttl 64, id 19039, offset 0, flags [DF], proto TCP (6), length 3569)
    127.0.0.1.10750 > 127.0.0.1.34472: Flags [P.], cksum 0x0be6 (incorrect -> 0x0b6f), seq 101865:105382, ack 905, win 512, options [nop,nop,TS val 753525870 ecr 753525870], length 3517
2022-04-04 23:44:41.499116 IP (tos 0x0, ttl 64, id 52677, offset 0, flags [DF], proto TCP (6), length 52)
    127.0.0.1.34472 > 127.0.0.1.10750: Flags [.], cksum 0xfe28 (incorrect -> 0xddb3), seq 905, ack 105382, win 512, options [nop,nop,TS val 753525870 ecr 753525870], length 0
2022-04-04 23:44:41.499124 IP (tos 0x0, ttl 64, id 19040, offset 0, flags [DF], proto TCP (6), length 13845)
    127.0.0.1.10750 > 127.0.0.1.34472: Flags [P.], cksum 0x340a (incorrect -> 0x311c), seq 105382:119175, ack 905, win 512, options [nop,nop,TS val 753525870 ecr 753525870], length 13793
2022-04-04 23:44:41.499276 IP (tos 0x0, ttl 64, id 52678, offset 0, flags [DF], proto TCP (6), length 52)
    127.0.0.1.34472 > 127.0.0.1.10750: Flags [.], cksum 0xfe28 (incorrect -> 0xa7d2), seq 905, ack 119175, win 512, options [nop,nop,TS val 753525870 ecr 753525870], length 0
2022-04-04 23:44:41.500840 IP (tos 0x0, ttl 64, id 19041, offset 0, flags [DF], proto TCP (6), length 4100)
    127.0.0.1.10750 > 127.0.0.1.34472: Flags [P.], cksum 0x0df9 (incorrect -> 0xb035), seq 119175:123223, ack 905, win 512, options [nop,nop,TS val 753525872 ecr 753525870], length 4048
2022-04-04 23:44:41.501217 IP (tos 0x0, ttl 64, id 52679, offset 0, flags [DF], proto TCP (6), length 52)
    127.0.0.1.34472 > 127.0.0.1.10750: Flags [.], cksum 0xfe28 (incorrect -> 0x97fe), seq 905, ack 123223, win 512, options [nop,nop,TS val 753525872 ecr 753525872], length 0
2022-04-04 23:44:41.501225 IP (tos 0x0, ttl 64, id 19042, offset 0, flags [DF], proto TCP (6), length 14783)
    127.0.0.1.10750 > 127.0.0.1.34472: Flags [P.], cksum 0x37b4 (incorrect -> 0x8358), seq 123223:137954, ack 905, win 512, options [nop,nop,TS val 753525872 ecr 753525872], length 14731
2022-04-04 23:44:41.501291 IP (tos 0x0, ttl 64, id 52680, offset 0, flags [DF], proto TCP (6), length 52)
    127.0.0.1.34472 > 127.0.0.1.10750: Flags [.], cksum 0xfe28 (incorrect -> 0x5e73), seq 905, ack 137954, win 512, options [nop,nop,TS val 753525872 ecr 753525872], length 0
2022-04-04 23:44:41.513793 IP (tos 0x0, ttl 64, id 19043, offset 0, flags [DF], proto TCP (6), length 614)
    127.0.0.1.10750 > 127.0.0.1.34472: Flags [P.], cksum 0x005b (incorrect -> 0xfd87), seq 137954:138516, ack 905, win 512, options [nop,nop,TS val 753525885 ecr 753525872], length 562
2022-04-04 23:44:41.514044 IP (tos 0x0, ttl 64, id 52681, offset 0, flags [DF], proto TCP (6), length 52)
    127.0.0.1.34472 > 127.0.0.1.10750: Flags [.], cksum 0xfe28 (incorrect -> 0x5c27), seq 905, ack 138516, win 512, options [nop,nop,TS val 753525885 ecr 753525885], length 0
2022-04-04 23:44:41.564652 IP (tos 0x0, ttl 64, id 19044, offset 0, flags [DF], proto TCP (6), length 4100)
    127.0.0.1.10750 > 127.0.0.1.34472: Flags [P.], cksum 0x0df9 (incorrect -> 0xffb5), seq 138516:142564, ack 905, win 512, options [nop,nop,TS val 753525936 ecr 753525885], length 4048
2022-04-04 23:44:41.564697 IP (tos 0x0, ttl 64, id 52682, offset 0, flags [DF], proto TCP (6), length 52)
    127.0.0.1.34472 > 127.0.0.1.10750: Flags [.], cksum 0xfe28 (incorrect -> 0x4bf1), seq 905, ack 142564, win 512, options [nop,nop,TS val 753525936 ecr 753525936], length 0
2022-04-04 23:44:41.564703 IP (tos 0x0, ttl 64, id 19045, offset 0, flags [DF], proto TCP (6), length 3284)
    127.0.0.1.10750 > 127.0.0.1.34472: Flags [P.], cksum 0x0ac9 (incorrect -> 0x5ffd), seq 142564:145796, ack 905, win 512, options [nop,nop,TS val 753525936 ecr 753525936], length 3232
2022-04-04 23:44:41.564708 IP (tos 0x0, ttl 64, id 52683, offset 0, flags [DF], proto TCP (6), length 52)
    127.0.0.1.34472 > 127.0.0.1.10750: Flags [.], cksum 0xfe28 (incorrect -> 0x3f51), seq 905, ack 145796, win 512, options [nop,nop,TS val 753525936 ecr 753525936], length 0
2022-04-04 23:44:41.567007 IP (tos 0x0, ttl 64, id 19046, offset 0, flags [DF], proto TCP (6), length 3538)
    127.0.0.1.10750 > 127.0.0.1.34472: Flags [P.], cksum 0x0bc7 (incorrect -> 0xa747), seq 145796:149282, ack 905, win 512, options [nop,nop,TS val 753525938 ecr 753525936], length 3486
2022-04-04 23:44:41.567021 IP (tos 0x0, ttl 64, id 52684, offset 0, flags [DF], proto TCP (6), length 52)
    127.0.0.1.34472 > 127.0.0.1.10750: Flags [.], cksum 0xfe28 (incorrect -> 0x31af), seq 905, ack 149282, win 512, options [nop,nop,TS val 753525938 ecr 753525938], length 0
2022-04-04 23:44:41.567116 IP (tos 0x0, ttl 64, id 19047, offset 0, flags [DF], proto TCP (6), length 4100)
    127.0.0.1.10750 > 127.0.0.1.34472: Flags [P.], cksum 0x0df9 (incorrect -> 0x531c), seq 149282:153330, ack 905, win 512, options [nop,nop,TS val 753525938 ecr 753525938], length 4048
2022-04-04 23:44:41.567153 IP (tos 0x0, ttl 64, id 52685, offset 0, flags [DF], proto TCP (6), length 52)
    127.0.0.1.34472 > 127.0.0.1.10750: Flags [.], cksum 0xfe28 (incorrect -> 0x21df), seq 905, ack 153330, win 512, options [nop,nop,TS val 753525938 ecr 753525938], length 0
2022-04-04 23:44:41.567159 IP (tos 0x0, ttl 64, id 19048, offset 0, flags [DF], proto TCP (6), length 6747)
    127.0.0.1.10750 > 127.0.0.1.34472: Flags [P.], cksum 0x1850 (incorrect -> 0xc8db), seq 153330:160025, ack 905, win 512, options [nop,nop,TS val 753525938 ecr 753525938], length 6695
2022-04-04 23:44:41.567537 IP (tos 0x0, ttl 64, id 52686, offset 0, flags [DF], proto TCP (6), length 52)
    127.0.0.1.34472 > 127.0.0.1.10750: Flags [.], cksum 0xfe28 (incorrect -> 0x07b7), seq 905, ack 160025, win 512, options [nop,nop,TS val 753525939 ecr 753525938], length 0
2022-04-04 23:44:41.567545 IP (tos 0x0, ttl 64, id 19049, offset 0, flags [DF], proto TCP (6), length 7814)
    127.0.0.1.10750 > 127.0.0.1.34472: Flags [P.], cksum 0x1c7b (incorrect -> 0x7f09), seq 160025:167787, ack 905, win 512, options [nop,nop,TS val 753525939 ecr 753525939], length 7762
2022-04-04 23:44:41.567667 IP (tos 0x0, ttl 64, id 52687, offset 0, flags [DF], proto TCP (6), length 52)
    127.0.0.1.34472 > 127.0.0.1.10750: Flags [.], cksum 0xfe28 (incorrect -> 0xe963), seq 905, ack 167787, win 512, options [nop,nop,TS val 753525939 ecr 753525939], length 0
2022-04-04 23:44:41.568378 IP (tos 0x0, ttl 64, id 19050, offset 0, flags [DF], proto TCP (6), length 3040)
    127.0.0.1.10750 > 127.0.0.1.34472: Flags [P.], cksum 0x09d5 (incorrect -> 0x903d), seq 167787:170775, ack 905, win 512, options [nop,nop,TS val 753525939 ecr 753525939], length 2988
2022-04-04 23:44:41.568393 IP (tos 0x0, ttl 64, id 52688, offset 0, flags [DF], proto TCP (6), length 52)
    127.0.0.1.34472 > 127.0.0.1.10750: Flags [.], cksum 0xfe28 (incorrect -> 0xddb7), seq 905, ack 170775, win 512, options [nop,nop,TS val 753525939 ecr 753525939], length 0
2022-04-04 23:44:41.568473 IP (tos 0x0, ttl 64, id 19051, offset 0, flags [DF], proto TCP (6), length 4100)
    127.0.0.1.10750 > 127.0.0.1.34472: Flags [P.], cksum 0x0df9 (incorrect -> 0x9a8d), seq 170775:174823, ack 905, win 512, options [nop,nop,TS val 753525940 ecr 753525939], length 4048
2022-04-04 23:44:41.568572 IP (tos 0x0, ttl 64, id 52689, offset 0, flags [DF], proto TCP (6), length 52)
    127.0.0.1.34472 > 127.0.0.1.10750: Flags [.], cksum 0xfe28 (incorrect -> 0xcde5), seq 905, ack 174823, win 512, options [nop,nop,TS val 753525940 ecr 753525940], length 0
2022-04-04 23:44:41.568584 IP (tos 0x0, ttl 64, id 19052, offset 0, flags [DF], proto TCP (6), length 7338)
    127.0.0.1.10750 > 127.0.0.1.34472: Flags [P.], cksum 0x1a9f (incorrect -> 0x32b8), seq 174823:182109, ack 905, win 512, options [nop,nop,TS val 753525940 ecr 753525940], length 7286
2022-04-04 23:44:41.569010 IP (tos 0x0, ttl 64, id 52690, offset 0, flags [DF], proto TCP (6), length 52)
    127.0.0.1.34472 > 127.0.0.1.10750: Flags [.], cksum 0xfe28 (incorrect -> 0xb16f), seq 905, ack 182109, win 512, options [nop,nop,TS val 753525940 ecr 753525940], length 0
2022-04-04 23:44:41.573166 IP (tos 0x0, ttl 64, id 19053, offset 0, flags [DF], proto TCP (6), length 3234)
    127.0.0.1.10750 > 127.0.0.1.34472: Flags [P.], cksum 0x0a97 (incorrect -> 0xeec9), seq 182109:185291, ack 905, win 512, options [nop,nop,TS val 753525944 ecr 753525940], length 3182
2022-04-04 23:44:41.573262 IP (tos 0x0, ttl 64, id 52691, offset 0, flags [DF], proto TCP (6), length 52)
    127.0.0.1.34472 > 127.0.0.1.10750: Flags [.], cksum 0xfe28 (incorrect -> 0xa4f9), seq 905, ack 185291, win 512, options [nop,nop,TS val 753525944 ecr 753525944], length 0
2022-04-04 23:44:41.573268 IP (tos 0x0, ttl 64, id 19054, offset 0, flags [DF], proto TCP (6), length 7346)
    127.0.0.1.10750 > 127.0.0.1.34472: Flags [P.], cksum 0x1aa7 (incorrect -> 0x11cc), seq 185291:192585, ack 905, win 512, options [nop,nop,TS val 753525944 ecr 753525944], length 7294
2022-04-04 23:44:41.573465 IP (tos 0x0, ttl 64, id 52692, offset 0, flags [DF], proto TCP (6), length 52)
    127.0.0.1.34472 > 127.0.0.1.10750: Flags [.], cksum 0xfe28 (incorrect -> 0x887a), seq 905, ack 192585, win 512, options [nop,nop,TS val 753525945 ecr 753525944], length 0
2022-04-04 23:44:41.576578 IP (tos 0x0, ttl 64, id 19055, offset 0, flags [DF], proto TCP (6), length 2044)
    127.0.0.1.10750 > 127.0.0.1.34472: Flags [P.], cksum 0x05f1 (incorrect -> 0xb6f5), seq 192585:194577, ack 905, win 512, options [nop,nop,TS val 753525948 ecr 753525945], length 1992
2022-04-04 23:44:41.576652 IP (tos 0x0, ttl 64, id 52693, offset 0, flags [DF], proto TCP (6), length 52)
    127.0.0.1.34472 > 127.0.0.1.10750: Flags [.], cksum 0xfe28 (incorrect -> 0x80ab), seq 905, ack 194577, win 512, options [nop,nop,TS val 753525948 ecr 753525948], length 0
2022-04-04 23:44:41.576663 IP (tos 0x0, ttl 64, id 19056, offset 0, flags [DF], proto TCP (6), length 3538)
    127.0.0.1.10750 > 127.0.0.1.34472: Flags [P.], cksum 0x0bc7 (incorrect -> 0xa94b), seq 194577:198063, ack 905, win 512, options [nop,nop,TS val 753525948 ecr 753525948], length 3486
2022-04-04 23:44:41.576668 IP (tos 0x0, ttl 64, id 52694, offset 0, flags [DF], proto TCP (6), length 52)
    127.0.0.1.34472 > 127.0.0.1.10750: Flags [.], cksum 0xfe28 (incorrect -> 0x730d), seq 905, ack 198063, win 512, options [nop,nop,TS val 753525948 ecr 753525948], length 0
2022-04-04 23:44:41.576831 IP (tos 0x0, ttl 64, id 19057, offset 0, flags [DF], proto TCP (6), length 3809)
    127.0.0.1.10750 > 127.0.0.1.34472: Flags [P.], cksum 0x0cd6 (incorrect -> 0x2b59), seq 198063:201820, ack 905, win 512, options [nop,nop,TS val 753525948 ecr 753525948], length 3757
2022-04-04 23:44:41.576871 IP (tos 0x0, ttl 64, id 52695, offset 0, flags [DF], proto TCP (6), length 52)
    127.0.0.1.34472 > 127.0.0.1.10750: Flags [.], cksum 0xfe28 (incorrect -> 0x6460), seq 905, ack 201820, win 512, options [nop,nop,TS val 753525948 ecr 753525948], length 0
2022-04-04 23:44:41.577490 IP (tos 0x0, ttl 64, id 19058, offset 0, flags [DF], proto TCP (6), length 2044)
    127.0.0.1.10750 > 127.0.0.1.34472: Flags [P.], cksum 0x05f1 (incorrect -> 0x4993), seq 201820:203812, ack 905, win 512, options [nop,nop,TS val 753525949 ecr 753525948], length 1992
2022-04-04 23:44:41.577525 IP (tos 0x0, ttl 64, id 52696, offset 0, flags [DF], proto TCP (6), length 52)
    127.0.0.1.34472 > 127.0.0.1.10750: Flags [.], cksum 0xfe28 (incorrect -> 0x5c96), seq 905, ack 203812, win 512, options [nop,nop,TS val 753525949 ecr 753525949], length 0
2022-04-04 23:44:41.589283 IP (tos 0x0, ttl 64, id 19059, offset 0, flags [DF], proto TCP (6), length 859)
    127.0.0.1.10750 > 127.0.0.1.34472: Flags [P.], cksum 0x0150 (incorrect -> 0x9808), seq 203812:204619, ack 905, win 512, options [nop,nop,TS val 753525960 ecr 753525949], length 807
2022-04-04 23:44:41.589599 IP (tos 0x0, ttl 64, id 52697, offset 0, flags [DF], proto TCP (6), length 52)
    127.0.0.1.34472 > 127.0.0.1.10750: Flags [.], cksum 0xfe28 (incorrect -> 0x5958), seq 905, ack 204619, win 512, options [nop,nop,TS val 753525961 ecr 753525960], length 0
2022-04-04 23:44:41.589613 IP (tos 0x0, ttl 64, id 19060, offset 0, flags [DF], proto TCP (6), length 7522)
    127.0.0.1.10750 > 127.0.0.1.34472: Flags [P.], cksum 0x1b57 (incorrect -> 0x3e7e), seq 204619:212089, ack 905, win 512, options [nop,nop,TS val 753525961 ecr 753525961], length 7470
2022-04-04 23:44:41.589780 IP (tos 0x0, ttl 64, id 52698, offset 0, flags [DF], proto TCP (6), length 52)
    127.0.0.1.34472 > 127.0.0.1.10750: Flags [.], cksum 0xfe28 (incorrect -> 0x3c29), seq 905, ack 212089, win 512, options [nop,nop,TS val 753525961 ecr 753525961], length 0
2022-04-04 23:44:41.590356 IP (tos 0x0, ttl 64, id 19061, offset 0, flags [DF], proto TCP (6), length 4036)
    127.0.0.1.10750 > 127.0.0.1.34472: Flags [P.], cksum 0x0db9 (incorrect -> 0xc39c), seq 212089:216073, ack 905, win 512, options [nop,nop,TS val 753525961 ecr 753525961], length 3984
2022-04-04 23:44:41.590387 IP (tos 0x0, ttl 64, id 52699, offset 0, flags [DF], proto TCP (6), length 52)
    127.0.0.1.34472 > 127.0.0.1.10750: Flags [.], cksum 0xfe28 (incorrect -> 0x2c99), seq 905, ack 216073, win 512, options [nop,nop,TS val 753525961 ecr 753525961], length 0
2022-04-04 23:44:41.591098 IP (tos 0x0, ttl 64, id 19062, offset 0, flags [DF], proto TCP (6), length 4100)
    127.0.0.1.10750 > 127.0.0.1.34472: Flags [P.], cksum 0x0df9 (incorrect -> 0x4585), seq 216073:220121, ack 905, win 512, options [nop,nop,TS val 753525962 ecr 753525961], length 4048
2022-04-04 23:44:41.591121 IP (tos 0x0, ttl 64, id 52700, offset 0, flags [DF], proto TCP (6), length 52)
    127.0.0.1.34472 > 127.0.0.1.10750: Flags [.], cksum 0xfe28 (incorrect -> 0x1cc7), seq 905, ack 220121, win 512, options [nop,nop,TS val 753525962 ecr 753525962], length 0
2022-04-04 23:44:41.591126 IP (tos 0x0, ttl 64, id 19063, offset 0, flags [DF], proto TCP (6), length 3474)
    127.0.0.1.10750 > 127.0.0.1.34472: Flags [P.], cksum 0x0b87 (incorrect -> 0x6ef7), seq 220121:223543, ack 905, win 512, options [nop,nop,TS val 753525962 ecr 753525962], length 3422
2022-04-04 23:44:41.591280 IP (tos 0x0, ttl 64, id 52701, offset 0, flags [DF], proto TCP (6), length 52)
    127.0.0.1.34472 > 127.0.0.1.10750: Flags [.], cksum 0xfe28 (incorrect -> 0x0f69), seq 905, ack 223543, win 512, options [nop,nop,TS val 753525962 ecr 753525962], length 0
2022-04-04 23:44:41.592638 IP (tos 0x0, ttl 64, id 19064, offset 0, flags [DF], proto TCP (6), length 4036)
    127.0.0.1.10750 > 127.0.0.1.34472: Flags [P.], cksum 0x0db9 (incorrect -> 0xbf30), seq 223543:227527, ack 905, win 512, options [nop,nop,TS val 753525964 ecr 753525962], length 3984
2022-04-04 23:44:41.592651 IP (tos 0x0, ttl 64, id 52702, offset 0, flags [DF], proto TCP (6), length 52)
    127.0.0.1.34472 > 127.0.0.1.10750: Flags [.], cksum 0xfe28 (incorrect -> 0xffd4), seq 905, ack 227527, win 512, options [nop,nop,TS val 753525964 ecr 753525964], length 0
2022-04-04 23:44:41.592803 IP (tos 0x0, ttl 64, id 19065, offset 0, flags [DF], proto TCP (6), length 4100)
    127.0.0.1.10750 > 127.0.0.1.34472: Flags [P.], cksum 0x0df9 (incorrect -> 0xafb7), seq 227527:231575, ack 905, win 512, options [nop,nop,TS val 753525964 ecr 753525964], length 4048
2022-04-04 23:44:41.592824 IP (tos 0x0, ttl 64, id 52703, offset 0, flags [DF], proto TCP (6), length 52)
    127.0.0.1.34472 > 127.0.0.1.10750: Flags [.], cksum 0xfe28 (incorrect -> 0xf004), seq 905, ack 231575, win 512, options [nop,nop,TS val 753525964 ecr 753525964], length 0
2022-04-04 23:44:41.592829 IP (tos 0x0, ttl 64, id 19066, offset 0, flags [DF], proto TCP (6), length 3474)
    127.0.0.1.10750 > 127.0.0.1.34472: Flags [P.], cksum 0x0b87 (incorrect -> 0x1507), seq 231575:234997, ack 905, win 512, options [nop,nop,TS val 753525964 ecr 753525964], length 3422
2022-04-04 23:44:41.592833 IP (tos 0x0, ttl 64, id 52704, offset 0, flags [DF], proto TCP (6), length 52)
    127.0.0.1.34472 > 127.0.0.1.10750: Flags [.], cksum 0xfe28 (incorrect -> 0xe2a6), seq 905, ack 234997, win 512, options [nop,nop,TS val 753525964 ecr 753525964], length 0
2022-04-04 23:44:41.599003 IP (tos 0x0, ttl 64, id 19067, offset 0, flags [DF], proto TCP (6), length 1546)
    127.0.0.1.10750 > 127.0.0.1.34472: Flags [P.], cksum 0x03ff (incorrect -> 0x3d2a), seq 234997:236491, ack 905, win 512, options [nop,nop,TS val 753525970 ecr 753525964], length 1494
2022-04-04 23:44:41.599017 IP (tos 0x0, ttl 64, id 52705, offset 0, flags [DF], proto TCP (6), length 52)
    127.0.0.1.34472 > 127.0.0.1.10750: Flags [.], cksum 0xfe28 (incorrect -> 0xdcc4), seq 905, ack 236491, win 512, options [nop,nop,TS val 753525970 ecr 753525970], length 0
2022-04-04 23:44:41.620038 IP (tos 0x0, ttl 64, id 19068, offset 0, flags [DF], proto TCP (6), length 1216)
    127.0.0.1.10750 > 127.0.0.1.34472: Flags [P.], cksum 0x02b5 (incorrect -> 0xf1c1), seq 236491:237655, ack 905, win 512, options [nop,nop,TS val 753525991 ecr 753525970], length 1164
2022-04-04 23:44:41.620218 IP (tos 0x0, ttl 64, id 52706, offset 0, flags [DF], proto TCP (6), length 52)
    127.0.0.1.34472 > 127.0.0.1.10750: Flags [.], cksum 0xfe28 (incorrect -> 0xd80e), seq 905, ack 237655, win 512, options [nop,nop,TS val 753525991 ecr 753525991], length 0
2022-04-04 23:44:41.656674 IP (tos 0x0, ttl 64, id 19069, offset 0, flags [DF], proto TCP (6), length 4100)
    127.0.0.1.10750 > 127.0.0.1.34472: Flags [P.], cksum 0x0df9 (incorrect -> 0x982b), seq 237655:241703, ack 905, win 512, options [nop,nop,TS val 753526028 ecr 753525991], length 4048
2022-04-04 23:44:41.656759 IP (tos 0x0, ttl 64, id 52707, offset 0, flags [DF], proto TCP (6), length 52)
    127.0.0.1.34472 > 127.0.0.1.10750: Flags [.], cksum 0xfe28 (incorrect -> 0xc7f4), seq 905, ack 241703, win 512, options [nop,nop,TS val 753526028 ecr 753526028], length 0
2022-04-04 23:44:41.656766 IP (tos 0x0, ttl 64, id 19070, offset 0, flags [DF], proto TCP (6), length 6808)
    127.0.0.1.10750 > 127.0.0.1.34472: Flags [P.], cksum 0x188d (incorrect -> 0x20ae), seq 241703:248459, ack 905, win 512, options [nop,nop,TS val 753526028 ecr 753526028], length 6756
2022-04-04 23:44:41.656771 IP (tos 0x0, ttl 64, id 52708, offset 0, flags [DF], proto TCP (6), length 52)
    127.0.0.1.34472 > 127.0.0.1.10750: Flags [.], cksum 0xfe28 (incorrect -> 0xad90), seq 905, ack 248459, win 512, options [nop,nop,TS val 753526028 ecr 753526028], length 0
2022-04-04 23:44:41.667061 IP (tos 0x0, ttl 64, id 19071, offset 0, flags [DF], proto TCP (6), length 4100)
    127.0.0.1.10750 > 127.0.0.1.34472: Flags [P.], cksum 0x0df9 (incorrect -> 0xbbe7), seq 248459:252507, ack 905, win 512, options [nop,nop,TS val 753526038 ecr 753526028], length 4048
2022-04-04 23:44:41.667108 IP (tos 0x0, ttl 64, id 52709, offset 0, flags [DF], proto TCP (6), length 52)
    127.0.0.1.34472 > 127.0.0.1.10750: Flags [.], cksum 0xfe28 (incorrect -> 0x9dac), seq 905, ack 252507, win 512, options [nop,nop,TS val 753526038 ecr 753526038], length 0
2022-04-04 23:44:41.667114 IP (tos 0x0, ttl 64, id 19072, offset 0, flags [DF], proto TCP (6), length 3707)
    127.0.0.1.10750 > 127.0.0.1.34472: Flags [P.], cksum 0x0c70 (incorrect -> 0x83ee), seq 252507:256162, ack 905, win 512, options [nop,nop,TS val 753526038 ecr 753526038], length 3655
2022-04-04 23:44:41.667351 IP (tos 0x0, ttl 64, id 52710, offset 0, flags [DF], proto TCP (6), length 52)
    127.0.0.1.34472 > 127.0.0.1.10750: Flags [.], cksum 0xfe28 (incorrect -> 0x8f65), seq 905, ack 256162, win 512, options [nop,nop,TS val 753526038 ecr 753526038], length 0
2022-04-04 23:44:41.669292 IP (tos 0x0, ttl 64, id 19073, offset 0, flags [DF], proto TCP (6), length 4100)
    127.0.0.1.10750 > 127.0.0.1.34472: Flags [P.], cksum 0x0df9 (incorrect -> 0x931e), seq 256162:260210, ack 905, win 512, options [nop,nop,TS val 753526040 ecr 753526038], length 4048
2022-04-04 23:44:41.669308 IP (tos 0x0, ttl 64, id 52711, offset 0, flags [DF], proto TCP (6), length 52)
    127.0.0.1.34472 > 127.0.0.1.10750: Flags [.], cksum 0xfe28 (incorrect -> 0x7f91), seq 905, ack 260210, win 512, options [nop,nop,TS val 753526040 ecr 753526040], length 0
2022-04-04 23:44:41.669313 IP (tos 0x0, ttl 64, id 19074, offset 0, flags [DF], proto TCP (6), length 1482)
    127.0.0.1.10750 > 127.0.0.1.34472: Flags [P.], cksum 0x03bf (incorrect -> 0x0bcb), seq 260210:261640, ack 905, win 512, options [nop,nop,TS val 753526040 ecr 753526040], length 1430
2022-04-04 23:44:41.669317 IP (tos 0x0, ttl 64, id 52712, offset 0, flags [DF], proto TCP (6), length 52)
    127.0.0.1.34472 > 127.0.0.1.10750: Flags [.], cksum 0xfe28 (incorrect -> 0x79fb), seq 905, ack 261640, win 512, options [nop,nop,TS val 753526040 ecr 753526040], length 0
2022-04-04 23:44:41.670014 IP (tos 0x0, ttl 64, id 19075, offset 0, flags [DF], proto TCP (6), length 4100)
    127.0.0.1.10750 > 127.0.0.1.34472: Flags [P.], cksum 0x0df9 (incorrect -> 0x0827), seq 261640:265688, ack 905, win 512, options [nop,nop,TS val 753526041 ecr 753526040], length 4048
2022-04-04 23:44:41.670056 IP (tos 0x0, ttl 64, id 52713, offset 0, flags [DF], proto TCP (6), length 52)
    127.0.0.1.34472 > 127.0.0.1.10750: Flags [.], cksum 0xfe28 (incorrect -> 0x6a29), seq 905, ack 265688, win 512, options [nop,nop,TS val 753526041 ecr 753526041], length 0
2022-04-04 23:44:41.670062 IP (tos 0x0, ttl 64, id 19076, offset 0, flags [DF], proto TCP (6), length 6952)
    127.0.0.1.10750 > 127.0.0.1.34472: Flags [P.], cksum 0x191d (incorrect -> 0x2cb3), seq 265688:272588, ack 905, win 512, options [nop,nop,TS val 753526041 ecr 753526041], length 6900
2022-04-04 23:44:41.670220 IP (tos 0x0, ttl 64, id 52714, offset 0, flags [DF], proto TCP (6), length 52)
    127.0.0.1.34472 > 127.0.0.1.10750: Flags [.], cksum 0xfe28 (incorrect -> 0x4f35), seq 905, ack 272588, win 512, options [nop,nop,TS val 753526041 ecr 753526041], length 0
2022-04-04 23:44:41.671097 IP (tos 0x0, ttl 64, id 19077, offset 0, flags [DF], proto TCP (6), length 4100)
    127.0.0.1.10750 > 127.0.0.1.34472: Flags [P.], cksum 0x0df9 (incorrect -> 0x8104), seq 272588:276636, ack 905, win 512, options [nop,nop,TS val 753526042 ecr 753526041], length 4048
2022-04-04 23:44:41.671117 IP (tos 0x0, ttl 64, id 52715, offset 0, flags [DF], proto TCP (6), length 52)
    127.0.0.1.34472 > 127.0.0.1.10750: Flags [.], cksum 0xfe28 (incorrect -> 0x3f63), seq 905, ack 276636, win 512, options [nop,nop,TS val 753526042 ecr 753526042], length 0
2022-04-04 23:44:41.671121 IP (tos 0x0, ttl 64, id 19078, offset 0, flags [DF], proto TCP (6), length 486)
    127.0.0.1.10750 > 127.0.0.1.34472: Flags [P.], cksum 0xffda (incorrect -> 0x7630), seq 276636:277070, ack 905, win 512, options [nop,nop,TS val 753526042 ecr 753526042], length 434
2022-04-04 23:44:41.671126 IP (tos 0x0, ttl 64, id 52716, offset 0, flags [DF], proto TCP (6), length 52)
    127.0.0.1.34472 > 127.0.0.1.10750: Flags [.], cksum 0xfe28 (incorrect -> 0x3db1), seq 905, ack 277070, win 512, options [nop,nop,TS val 753526042 ecr 753526042], length 0
2022-04-04 23:44:41.672298 IP (tos 0x0, ttl 64, id 19079, offset 0, flags [DF], proto TCP (6), length 2044)
    127.0.0.1.10750 > 127.0.0.1.34472: Flags [P.], cksum 0x05f1 (incorrect -> 0xba29), seq 277070:279062, ack 905, win 512, options [nop,nop,TS val 753526043 ecr 753526042], length 1992
2022-04-04 23:44:41.672313 IP (tos 0x0, ttl 64, id 52717, offset 0, flags [DF], proto TCP (6), length 52)
    127.0.0.1.34472 > 127.0.0.1.10750: Flags [.], cksum 0xfe28 (incorrect -> 0x35e7), seq 905, ack 279062, win 512, options [nop,nop,TS val 753526043 ecr 753526043], length 0
2022-04-04 23:44:41.672445 IP (tos 0x0, ttl 64, id 19080, offset 0, flags [DF], proto TCP (6), length 4100)
    127.0.0.1.10750 > 127.0.0.1.34472: Flags [P.], cksum 0x0df9 (incorrect -> 0xa861), seq 279062:283110, ack 905, win 512, options [nop,nop,TS val 753526044 ecr 753526043], length 4048
2022-04-04 23:44:41.672501 IP (tos 0x0, ttl 64, id 52718, offset 0, flags [DF], proto TCP (6), length 52)
    127.0.0.1.34472 > 127.0.0.1.10750: Flags [.], cksum 0xfe28 (incorrect -> 0x2615), seq 905, ack 283110, win 512, options [nop,nop,TS val 753526044 ecr 753526044], length 0
2022-04-04 23:44:41.672507 IP (tos 0x0, ttl 64, id 19081, offset 0, flags [DF], proto TCP (6), length 7192)
    127.0.0.1.10750 > 127.0.0.1.34472: Flags [P.], cksum 0x1a0d (incorrect -> 0x142e), seq 283110:290250, ack 905, win 512, options [nop,nop,TS val 753526044 ecr 753526044], length 7140
2022-04-04 23:44:41.672747 IP (tos 0x0, ttl 64, id 52719, offset 0, flags [DF], proto TCP (6), length 52)
    127.0.0.1.34472 > 127.0.0.1.10750: Flags [.], cksum 0xfe28 (incorrect -> 0x0a31), seq 905, ack 290250, win 512, options [nop,nop,TS val 753526044 ecr 753526044], length 0
2022-04-04 23:44:41.672753 IP (tos 0x0, ttl 64, id 19082, offset 0, flags [DF], proto TCP (6), length 4534)
    127.0.0.1.10750 > 127.0.0.1.34472: Flags [P.], cksum 0x0fab (incorrect -> 0x16fe), seq 290250:294732, ack 905, win 512, options [nop,nop,TS val 753526044 ecr 753526044], length 4482
2022-04-04 23:44:41.672758 IP (tos 0x0, ttl 64, id 52720, offset 0, flags [DF], proto TCP (6), length 52)
    127.0.0.1.34472 > 127.0.0.1.10750: Flags [.], cksum 0xfe28 (incorrect -> 0xf8ae), seq 905, ack 294732, win 512, options [nop,nop,TS val 753526044 ecr 753526044], length 0
2022-04-04 23:44:41.672968 IP (tos 0x0, ttl 64, id 19083, offset 0, flags [DF], proto TCP (6), length 4100)
    127.0.0.1.10750 > 127.0.0.1.34472: Flags [P.], cksum 0x0df9 (incorrect -> 0xa4e7), seq 294732:298780, ack 905, win 512, options [nop,nop,TS val 753526044 ecr 753526044], length 4048
2022-04-04 23:44:41.673063 IP (tos 0x0, ttl 64, id 52721, offset 0, flags [DF], proto TCP (6), length 52)
    127.0.0.1.34472 > 127.0.0.1.10750: Flags [.], cksum 0xfe28 (incorrect -> 0xe8de), seq 905, ack 298780, win 512, options [nop,nop,TS val 753526044 ecr 753526044], length 0
200, 5.855117321014404, 1.7723772525787354