2022-04-04 23:12:11.229197 IP (tos 0x0, ttl 64, id 6937, offset 0, flags [DF], proto TCP (6), length 60)
    127.0.0.1.52404 > 127.0.0.1.9550: Flags [S], cksum 0xfe30 (incorrect -> 0x2349), seq 190767195, win 65495, options [mss 65495,sackOK,TS val 751575600 ecr 0,nop,wscale 7], length 0
2022-04-04 23:12:11.229207 IP (tos 0x0, ttl 64, id 0, offset 0, flags [DF], proto TCP (6), length 60)
    127.0.0.1.9550 > 127.0.0.1.52404: Flags [S.], cksum 0xfe30 (incorrect -> 0xda3e), seq 2767213848, ack 190767196, win 65483, options [mss 65495,sackOK,TS val 751575600 ecr 751575600,nop,wscale 7], length 0
2022-04-04 23:12:11.229216 IP (tos 0x0, ttl 64, id 6938, offset 0, flags [DF], proto TCP (6), length 52)
    127.0.0.1.52404 > 127.0.0.1.9550: Flags [.], cksum 0xfe28 (incorrect -> 0x00fb), seq 1, ack 1, win 512, options [nop,nop,TS val 751575600 ecr 751575600], length 0
2022-04-04 23:12:11.229314 IP (tos 0x0, ttl 64, id 6939, offset 0, flags [DF], proto TCP (6), length 55)
    127.0.0.1.52404 > 127.0.0.1.9550: Flags [P.], cksum 0xfe2b (incorrect -> 0xfbee), seq 1:4, ack 1, win 512, options [nop,nop,TS val 751575600 ecr 751575600], length 3
2022-04-04 23:12:11.229329 IP (tos 0x0, ttl 64, id 21427, offset 0, flags [DF], proto TCP (6), length 52)
    127.0.0.1.9550 > 127.0.0.1.52404: Flags [.], cksum 0xfe28 (incorrect -> 0x00f8), seq 1, ack 4, win 512, options [nop,nop,TS val 751575600 ecr 751575600], length 0
2022-04-04 23:12:11.229355 IP (tos 0x0, ttl 64, id 21428, offset 0, flags [DF], proto TCP (6), length 54)
    127.0.0.1.9550 > 127.0.0.1.52404: Flags [P.], cksum 0xfe2a (incorrect -> 0xfbed), seq 1:3, ack 4, win 512, options [nop,nop,TS val 751575600 ecr 751575600], length 2
2022-04-04 23:12:11.229364 IP (tos 0x0, ttl 64, id 6940, offset 0, flags [DF], proto TCP (6), length 52)
    127.0.0.1.52404 > 127.0.0.1.9550: Flags [.], cksum 0xfe28 (incorrect -> 0x00f6), seq 4, ack 3, win 512, options [nop,nop,TS val 751575600 ecr 751575600], length 0
2022-04-04 23:12:11.231349 IP (tos 0x0, ttl 64, id 6941, offset 0, flags [DF], proto TCP (6), length 62)
    127.0.0.1.52404 > 127.0.0.1.9550: Flags [P.], cksum 0xfe32 (incorrect -> 0x1672), seq 4:14, ack 3, win 512, options [nop,nop,TS val 751575602 ecr 751575600], length 10
2022-04-04 23:12:11.231362 IP (tos 0x0, ttl 64, id 21429, offset 0, flags [DF], proto TCP (6), length 52)
    127.0.0.1.9550 > 127.0.0.1.52404: Flags [.], cksum 0xfe28 (incorrect -> 0x00e8), seq 3, ack 14, win 512, options [nop,nop,TS val 751575602 ecr 751575602], length 0
2022-04-04 23:12:22.173964 IP (tos 0x0, ttl 64, id 21430, offset 0, flags [DF], proto TCP (6), length 62)
    127.0.0.1.9550 > 127.0.0.1.52404: Flags [P.], cksum 0xfe32 (incorrect -> 0xd115), seq 3:13, ack 14, win 512, options [nop,nop,TS val 751586545 ecr 751575602], length 10
2022-04-04 23:12:22.173974 IP (tos 0x0, ttl 64, id 6942, offset 0, flags [DF], proto TCP (6), length 52)
    127.0.0.1.52404 > 127.0.0.1.9550: Flags [.], cksum 0xfe28 (incorrect -> 0xab5f), seq 14, ack 13, win 512, options [nop,nop,TS val 751586545 ecr 751586545], length 0
2022-04-04 23:12:22.179610 IP (tos 0x0, ttl 64, id 6943, offset 0, flags [DF], proto TCP (6), length 569)
    127.0.0.1.52404 > 127.0.0.1.9550: Flags [P.], cksum 0x002e (incorrect -> 0xd72f), seq 14:531, ack 13, win 512, options [nop,nop,TS val 751586551 ecr 751586545], length 517
2022-04-04 23:12:22.179627 IP (tos 0x0, ttl 64, id 21431, offset 0, flags [DF], proto TCP (6), length 52)
    127.0.0.1.9550 > 127.0.0.1.52404: Flags [.], cksum 0xfe28 (incorrect -> 0xa952), seq 13, ack 531, win 508, options [nop,nop,TS val 751586551 ecr 751586551], length 0
2022-04-04 23:12:22.353408 IP (tos 0x0, ttl 64, id 21432, offset 0, flags [DF], proto TCP (6), length 3538)
    127.0.0.1.9550 > 127.0.0.1.52404: Flags [P.], cksum 0x0bc7 (incorrect -> 0x534d), seq 13:3499, ack 531, win 512, options [nop,nop,TS val 751586725 ecr 751586551], length 3486
2022-04-04 23:12:22.353429 IP (tos 0x0, ttl 64, id 6944, offset 0, flags [DF], proto TCP (6), length 52)
    127.0.0.1.52404 > 127.0.0.1.9550: Flags [.], cksum 0xfe28 (incorrect -> 0x9a66), seq 531, ack 3499, win 494, options [nop,nop,TS val 751586725 ecr 751586725], length 0
2022-04-04 23:12:22.391746 IP (tos 0x0, ttl 64, id 21433, offset 0, flags [DF], proto TCP (6), length 606)
    127.0.0.1.9550 > 127.0.0.1.52404: Flags [P.], cksum 0x0053 (incorrect -> 0x1b09), seq 3499:4053, ack 531, win 512, options [nop,nop,TS val 751586763 ecr 751586725], length 554
2022-04-04 23:12:22.391752 IP (tos 0x0, ttl 64, id 6945, offset 0, flags [DF], proto TCP (6), length 52)
    127.0.0.1.52404 > 127.0.0.1.9550: Flags [.], cksum 0xfe28 (incorrect -> 0x97e5), seq 531, ack 4053, win 505, options [nop,nop,TS val 751586763 ecr 751586763], length 0
2022-04-04 23:12:22.392297 IP (tos 0x0, ttl 64, id 6946, offset 0, flags [DF], proto TCP (6), length 132)
    127.0.0.1.52404 > 127.0.0.1.9550: Flags [P.], cksum 0xfe78 (incorrect -> 0xa3e1), seq 531:611, ack 4053, win 512, options [nop,nop,TS val 751586763 ecr 751586763], length 80
2022-04-04 23:12:22.392306 IP (tos 0x0, ttl 64, id 21434, offset 0, flags [DF], proto TCP (6), length 52)
    127.0.0.1.9550 > 127.0.0.1.52404: Flags [.], cksum 0xfe28 (incorrect -> 0x978e), seq 4053, ack 611, win 512, options [nop,nop,TS val 751586763 ecr 751586763], length 0
2022-04-04 23:12:22.392694 IP (tos 0x0, ttl 64, id 6947, offset 0, flags [DF], proto TCP (6), length 364)
    127.0.0.1.52404 > 127.0.0.1.9550: Flags [P.], cksum 0xff60 (incorrect -> 0x24a0), seq 611:923, ack 4053, win 512, options [nop,nop,TS val 751586764 ecr 751586763], length 312
2022-04-04 23:12:22.392698 IP (tos 0x0, ttl 64, id 21435, offset 0, flags [DF], proto TCP (6), length 52)
    127.0.0.1.9550 > 127.0.0.1.52404: Flags [.], cksum 0xfe28 (incorrect -> 0x9656), seq 4053, ack 923, win 510, options [nop,nop,TS val 751586764 ecr 751586764], length 0
2022-04-04 23:12:22.589786 IP (tos 0x0, ttl 64, id 21436, offset 0, flags [DF], proto TCP (6), length 323)
    127.0.0.1.9550 > 127.0.0.1.52404: Flags [P.], cksum 0xff37 (incorrect -> 0x9b51), seq 4053:4324, ack 923, win 512, options [nop,nop,TS val 751586961 ecr 751586764], length 271
2022-04-04 23:12:22.589795 IP (tos 0x0, ttl 64, id 6948, offset 0, flags [DF], proto TCP (6), length 52)
    127.0.0.1.52404 > 127.0.0.1.9550: Flags [.], cksum 0xfe28 (incorrect -> 0x93bd), seq 923, ack 4324, win 510, options [nop,nop,TS val 751586961 ecr 751586961], length 0
2022-04-04 23:12:22.609985 IP (tos 0x0, ttl 64, id 21437, offset 0, flags [DF], proto TCP (6), length 747)
    127.0.0.1.9550 > 127.0.0.1.52404: Flags [P.], cksum 0x00e0 (incorrect -> 0x64a8), seq 4324:5019, ack 923, win 512, options [nop,nop,TS val 751586981 ecr 751586961], length 695
2022-04-04 23:12:22.609991 IP (tos 0x0, ttl 64, id 6949, offset 0, flags [DF], proto TCP (6), length 52)
    127.0.0.1.52404 > 127.0.0.1.9550: Flags [.], cksum 0xfe28 (incorrect -> 0x90e3), seq 923, ack 5019, win 505, options [nop,nop,TS val 751586981 ecr 751586981], length 0
2022-04-04 23:12:22.611826 IP (tos 0x0, ttl 64, id 49209, offset 0, flags [DF], proto TCP (6), length 60)
    127.0.0.1.52406 > 127.0.0.1.9550: Flags [S], cksum 0xfe30 (incorrect -> 0x501c), seq 2763845040, win 65495, options [mss 65495,sackOK,TS val 751586983 ecr 0,nop,wscale 7], length 0
2022-04-04 23:12:22.611834 IP (tos 0x0, ttl 64, id 0, offset 0, flags [DF], proto TCP (6), length 60)
    127.0.0.1.9550 > 127.0.0.1.52406: Flags [S.], cksum 0xfe30 (incorrect -> 0x6c35), seq 2720908864, ack 2763845041, win 65483, options [mss 65495,sackOK,TS val 751586983 ecr 751586983,nop,wscale 7], length 0
2022-04-04 23:12:22.611841 IP (tos 0x0, ttl 64, id 49210, offset 0, flags [DF], proto TCP (6), length 52)
    127.0.0.1.52406 > 127.0.0.1.9550: Flags [.], cksum 0xfe28 (incorrect -> 0x92f1), seq 1, ack 1, win 512, options [nop,nop,TS val 751586983 ecr 751586983], length 0
2022-04-04 23:12:22.611888 IP (tos 0x0, ttl 64, id 49211, offset 0, flags [DF], proto TCP (6), length 55)
    127.0.0.1.52406 > 127.0.0.1.9550: Flags [P.], cksum 0xfe2b (incorrect -> 0x8de5), seq 1:4, ack 1, win 512, options [nop,nop,TS val 751586983 ecr 751586983], length 3
2022-04-04 23:12:22.611891 IP (tos 0x0, ttl 64, id 48934, offset 0, flags [DF], proto TCP (6), length 52)
    127.0.0.1.9550 > 127.0.0.1.52406: Flags [.], cksum 0xfe28 (incorrect -> 0x92ee), seq 1, ack 4, win 512, options [nop,nop,TS val 751586983 ecr 751586983], length 0
2022-04-04 23:12:22.611934 IP (tos 0x0, ttl 64, id 48935, offset 0, flags [DF], proto TCP (6), length 54)
    127.0.0.1.9550 > 127.0.0.1.52406: Flags [P.], cksum 0xfe2a (incorrect -> 0x8de4), seq 1:3, ack 4, win 512, options [nop,nop,TS val 751586983 ecr 751586983], length 2
2022-04-04 23:12:22.611938 IP (tos 0x0, ttl 64, id 49212, offset 0, flags [DF], proto TCP (6), length 52)
    127.0.0.1.52406 > 127.0.0.1.9550: Flags [.], cksum 0xfe28 (incorrect -> 0x92ec), seq 4, ack 3, win 512, options [nop,nop,TS val 751586983 ecr 751586983], length 0
2022-04-04 23:12:22.613022 IP (tos 0x0, ttl 64, id 49213, offset 0, flags [DF], proto TCP (6), length 62)
    127.0.0.1.52406 > 127.0.0.1.9550: Flags [P.], cksum 0xfe32 (incorrect -> 0xaa8d), seq 4:14, ack 3, win 512, options [nop,nop,TS val 751586984 ecr 751586983], length 10
2022-04-04 23:12:22.613036 IP (tos 0x0, ttl 64, id 48936, offset 0, flags [DF], proto TCP (6), length 52)
    127.0.0.1.9550 > 127.0.0.1.52406: Flags [.], cksum 0xfe28 (incorrect -> 0x92e0), seq 3, ack 14, win 512, options [nop,nop,TS val 751586984 ecr 751586984], length 0
200, 6.667917490005493, 12.237271785736084