2022-04-04 21:31:29.521141 IP (tos 0x0, ttl 64, id 58281, offset 0, flags [DF], proto TCP (6), length 60)
    127.0.0.1.41884 > 127.0.0.1.9850: Flags [S], cksum 0xfe30 (incorrect -> 0xc7d8), seq 536051691, win 65495, options [mss 65495,sackOK,TS val 745533892 ecr 0,nop,wscale 7], length 0
2022-04-04 21:31:29.521151 IP (tos 0x0, ttl 64, id 0, offset 0, flags [DF], proto TCP (6), length 60)
    127.0.0.1.9850 > 127.0.0.1.41884: Flags [S.], cksum 0xfe30 (incorrect -> 0x86d6), seq 3358743190, ack 536051692, win 65483, options [mss 65495,sackOK,TS val 745533892 ecr 745533892,nop,wscale 7], length 0
2022-04-04 21:31:29.521159 IP (tos 0x0, ttl 64, id 58282, offset 0, flags [DF], proto TCP (6), length 52)
    127.0.0.1.41884 > 127.0.0.1.9850: Flags [.], cksum 0xfe28 (incorrect -> 0xad92), seq 1, ack 1, win 512, options [nop,nop,TS val 745533892 ecr 745533892], length 0
2022-04-04 21:31:29.521244 IP (tos 0x0, ttl 64, id 58283, offset 0, flags [DF], proto TCP (6), length 55)
    127.0.0.1.41884 > 127.0.0.1.9850: Flags [P.], cksum 0xfe2b (incorrect -> 0xa886), seq 1:4, ack 1, win 512, options [nop,nop,TS val 745533892 ecr 745533892], length 3
2022-04-04 21:31:29.521248 IP (tos 0x0, ttl 64, id 58530, offset 0, flags [DF], proto TCP (6), length 52)
    127.0.0.1.9850 > 127.0.0.1.41884: Flags [.], cksum 0xfe28 (incorrect -> 0xad8f), seq 1, ack 4, win 512, options [nop,nop,TS val 745533892 ecr 745533892], length 0
2022-04-04 21:31:29.521303 IP (tos 0x0, ttl 64, id 58531, offset 0, flags [DF], proto TCP (6), length 54)
    127.0.0.1.9850 > 127.0.0.1.41884: Flags [P.], cksum 0xfe2a (incorrect -> 0xa885), seq 1:3, ack 4, win 512, options [nop,nop,TS val 745533892 ecr 745533892], length 2
2022-04-04 21:31:29.521308 IP (tos 0x0, ttl 64, id 58284, offset 0, flags [DF], proto TCP (6), length 52)
    127.0.0.1.41884 > 127.0.0.1.9850: Flags [.], cksum 0xfe28 (incorrect -> 0xad8d), seq 4, ack 3, win 512, options [nop,nop,TS val 745533892 ecr 745533892], length 0
2022-04-04 21:31:29.532843 IP (tos 0x0, ttl 64, id 58285, offset 0, flags [DF], proto TCP (6), length 62)
    127.0.0.1.41884 > 127.0.0.1.9850: Flags [P.], cksum 0xfe32 (incorrect -> 0x13bd), seq 4:14, ack 3, win 512, options [nop,nop,TS val 745533904 ecr 745533892], length 10
2022-04-04 21:31:29.532851 IP (tos 0x0, ttl 64, id 58532, offset 0, flags [DF], proto TCP (6), length 52)
    127.0.0.1.9850 > 127.0.0.1.41884: Flags [.], cksum 0xfe28 (incorrect -> 0xad6b), seq 3, ack 14, win 512, options [nop,nop,TS val 745533904 ecr 745533904], length 0
2022-04-04 21:31:29.611436 IP (tos 0x0, ttl 64, id 58533, offset 0, flags [DF], proto TCP (6), length 62)
    127.0.0.1.9850 > 127.0.0.1.41884: Flags [P.], cksum 0xfe32 (incorrect -> 0xa809), seq 3:13, ack 14, win 512, options [nop,nop,TS val 745533983 ecr 745533904], length 10
2022-04-04 21:31:29.611442 IP (tos 0x0, ttl 64, id 58286, offset 0, flags [DF], proto TCP (6), length 52)
    127.0.0.1.41884 > 127.0.0.1.9850: Flags [.], cksum 0xfe28 (incorrect -> 0xacc3), seq 14, ack 13, win 512, options [nop,nop,TS val 745533983 ecr 745533983], length 0
2022-04-04 21:31:29.616905 IP (tos 0x0, ttl 64, id 58287, offset 0, flags [DF], proto TCP (6), length 569)
    127.0.0.1.41884 > 127.0.0.1.9850: Flags [P.], cksum 0x002e (incorrect -> 0x6833), seq 14:531, ack 13, win 512, options [nop,nop,TS val 745533988 ecr 745533983], length 517
2022-04-04 21:31:29.616914 IP (tos 0x0, ttl 64, id 58534, offset 0, flags [DF], proto TCP (6), length 52)
    127.0.0.1.9850 > 127.0.0.1.41884: Flags [.], cksum 0xfe28 (incorrect -> 0xaab8), seq 13, ack 531, win 508, options [nop,nop,TS val 745533988 ecr 745533988], length 0
200, 10.852121114730835, 0.9388387203216553