2022-04-04 20:01:37.356312 IP (tos 0x0, ttl 64, id 43373, offset 0, flags [DF], proto TCP (6), length 60)
    127.0.0.1.51208 > 127.0.0.1.9250: Flags [S], cksum 0xfe30 (incorrect -> 0xb2f7), seq 1389397842, win 65495, options [mss 65495,sackOK,TS val 740141727 ecr 0,nop,wscale 7], length 0
2022-04-04 20:01:37.356324 IP (tos 0x0, ttl 64, id 0, offset 0, flags [DF], proto TCP (6), length 60)
    127.0.0.1.9250 > 127.0.0.1.51208: Flags [S.], cksum 0xfe30 (incorrect -> 0x9d5b), seq 1124793295, ack 1389397843, win 65483, options [mss 65495,sackOK,TS val 740141727 ecr 740141727,nop,wscale 7], length 0
2022-04-04 20:01:37.356333 IP (tos 0x0, ttl 64, id 43374, offset 0, flags [DF], proto TCP (6), length 52)
    127.0.0.1.51208 > 127.0.0.1.9250: Flags [.], cksum 0xfe28 (incorrect -> 0xc417), seq 1, ack 1, win 512, options [nop,nop,TS val 740141727 ecr 740141727], length 0
2022-04-04 20:01:37.356481 IP (tos 0x0, ttl 64, id 43375, offset 0, flags [DF], proto TCP (6), length 55)
    127.0.0.1.51208 > 127.0.0.1.9250: Flags [P.], cksum 0xfe2b (incorrect -> 0xbf0a), seq 1:4, ack 1, win 512, options [nop,nop,TS val 740141728 ecr 740141727], length 3
2022-04-04 20:01:37.356494 IP (tos 0x0, ttl 64, id 38529, offset 0, flags [DF], proto TCP (6), length 52)
    127.0.0.1.9250 > 127.0.0.1.51208: Flags [.], cksum 0xfe28 (incorrect -> 0xc412), seq 1, ack 4, win 512, options [nop,nop,TS val 740141728 ecr 740141728], length 0
2022-04-04 20:01:37.356527 IP (tos 0x0, ttl 64, id 38530, offset 0, flags [DF], proto TCP (6), length 54)
    127.0.0.1.9250 > 127.0.0.1.51208: Flags [P.], cksum 0xfe2a (incorrect -> 0xbf08), seq 1:3, ack 4, win 512, options [nop,nop,TS val 740141728 ecr 740141728], length 2
2022-04-04 20:01:37.356545 IP (tos 0x0, ttl 64, id 43376, offset 0, flags [DF], proto TCP (6), length 52)
    127.0.0.1.51208 > 127.0.0.1.9250: Flags [.], cksum 0xfe28 (incorrect -> 0xc410), seq 4, ack 3, win 512, options [nop,nop,TS val 740141728 ecr 740141728], length 0
2022-04-04 20:01:37.357874 IP (tos 0x0, ttl 64, id 43377, offset 0, flags [DF], proto TCP (6), length 62)
    127.0.0.1.51208 > 127.0.0.1.9250: Flags [P.], cksum 0xfe32 (incorrect -> 0xc81c), seq 4:14, ack 3, win 512, options [nop,nop,TS val 740141729 ecr 740141728], length 10
2022-04-04 20:01:37.357892 IP (tos 0x0, ttl 64, id 38531, offset 0, flags [DF], proto TCP (6), length 52)
    127.0.0.1.9250 > 127.0.0.1.51208: Flags [.], cksum 0xfe28 (incorrect -> 0xc404), seq 3, ack 14, win 512, options [nop,nop,TS val 740141729 ecr 740141729], length 0
2022-04-04 20:01:37.719112 IP (tos 0x0, ttl 64, id 38532, offset 0, flags [DF], proto TCP (6), length 62)
    127.0.0.1.9250 > 127.0.0.1.51208: Flags [P.], cksum 0xfe32 (incorrect -> 0xbd88), seq 3:13, ack 14, win 512, options [nop,nop,TS val 740142090 ecr 740141729], length 10
2022-04-04 20:01:37.719121 IP (tos 0x0, ttl 64, id 43378, offset 0, flags [DF], proto TCP (6), length 52)
    127.0.0.1.51208 > 127.0.0.1.9250: Flags [.], cksum 0xfe28 (incorrect -> 0xc128), seq 14, ack 13, win 512, options [nop,nop,TS val 740142090 ecr 740142090], length 0
2022-04-04 20:01:37.725332 IP (tos 0x0, ttl 64, id 43379, offset 0, flags [DF], proto TCP (6), length 569)
    127.0.0.1.51208 > 127.0.0.1.9250: Flags [P.], cksum 0x002e (incorrect -> 0x54b3), seq 14:531, ack 13, win 512, options [nop,nop,TS val 740142096 ecr 740142090], length 517
2022-04-04 20:01:37.725342 IP (tos 0x0, ttl 64, id 38533, offset 0, flags [DF], proto TCP (6), length 52)
    127.0.0.1.9250 > 127.0.0.1.51208: Flags [.], cksum 0xfe28 (incorrect -> 0xbf1b), seq 13, ack 531, win 508, options [nop,nop,TS val 740142096 ecr 740142096], length 0
2022-04-04 20:01:38.025761 IP (tos 0x0, ttl 64, id 38534, offset 0, flags [DF], proto TCP (6), length 3538)
    127.0.0.1.9250 > 127.0.0.1.51208: Flags [P.], cksum 0x0bc7 (incorrect -> 0xa2ac), seq 13:3499, ack 531, win 512, options [nop,nop,TS val 740142397 ecr 740142096], length 3486
2022-04-04 20:01:38.025771 IP (tos 0x0, ttl 64, id 43380, offset 0, flags [DF], proto TCP (6), length 52)
    127.0.0.1.51208 > 127.0.0.1.9250: Flags [.], cksum 0xfe28 (incorrect -> 0xaf31), seq 531, ack 3499, win 494, options [nop,nop,TS val 740142397 ecr 740142397], length 0
2022-04-04 20:01:38.142537 IP (tos 0x0, ttl 64, id 38535, offset 0, flags [DF], proto TCP (6), length 64)
    127.0.0.1.9250 > 127.0.0.1.51208: Flags [P.], cksum 0xfe34 (incorrect -> 0xcf6d), seq 3499:3511, ack 531, win 512, options [nop,nop,TS val 740142514 ecr 740142397], length 12
2022-04-04 20:01:38.142553 IP (tos 0x0, ttl 64, id 43381, offset 0, flags [DF], proto TCP (6), length 52)
    127.0.0.1.51208 > 127.0.0.1.9250: Flags [.], cksum 0xfe28 (incorrect -> 0xae2e), seq 531, ack 3511, win 507, options [nop,nop,TS val 740142514 ecr 740142514], length 0
2022-04-04 20:01:38.142867 IP (tos 0x0, ttl 64, id 43382, offset 0, flags [DF], proto TCP (6), length 178)
    127.0.0.1.51208 > 127.0.0.1.9250: Flags [P.], cksum 0xfea6 (incorrect -> 0xfb7b), seq 531:657, ack 3511, win 512, options [nop,nop,TS val 740142514 ecr 740142514], length 126
2022-04-04 20:01:38.142875 IP (tos 0x0, ttl 64, id 38536, offset 0, flags [DF], proto TCP (6), length 52)
    127.0.0.1.9250 > 127.0.0.1.51208: Flags [.], cksum 0xfe28 (incorrect -> 0xadab), seq 3511, ack 657, win 512, options [nop,nop,TS val 740142514 ecr 740142514], length 0
2022-04-04 20:01:38.479114 IP (tos 0x0, ttl 64, id 38537, offset 0, flags [DF], proto TCP (6), length 103)
    127.0.0.1.9250 > 127.0.0.1.51208: Flags [P.], cksum 0xfe5b (incorrect -> 0xeb79), seq 3511:3562, ack 657, win 512, options [nop,nop,TS val 740142850 ecr 740142514], length 51
2022-04-04 20:01:38.479122 IP (tos 0x0, ttl 64, id 43383, offset 0, flags [DF], proto TCP (6), length 52)
    127.0.0.1.51208 > 127.0.0.1.9250: Flags [.], cksum 0xfe28 (incorrect -> 0xaad8), seq 657, ack 3562, win 512, options [nop,nop,TS val 740142850 ecr 740142850], length 0
2022-04-04 20:01:38.479571 IP (tos 0x0, ttl 64, id 43384, offset 0, flags [DF], proto TCP (6), length 361)
    127.0.0.1.51208 > 127.0.0.1.9250: Flags [P.], cksum 0xff5d (incorrect -> 0x1f4b), seq 657:966, ack 3562, win 512, options [nop,nop,TS val 740142851 ecr 740142850], length 309
2022-04-04 20:01:38.479578 IP (tos 0x0, ttl 64, id 38538, offset 0, flags [DF], proto TCP (6), length 52)
    127.0.0.1.9250 > 127.0.0.1.51208: Flags [.], cksum 0xfe28 (incorrect -> 0xa9a3), seq 3562, ack 966, win 510, options [nop,nop,TS val 740142851 ecr 740142851], length 0
200, 6.930738687515259, 1.8921842575073242