2022-04-04 21:48:41.724402 IP (tos 0x0, ttl 64, id 60923, offset 0, flags [DF], proto TCP (6), length 60)
    127.0.0.1.37026 > 127.0.0.1.10650: Flags [S], cksum 0xfe30 (incorrect -> 0xeb3f), seq 2970360618, win 65495, options [mss 65495,sackOK,TS val 746566095 ecr 0,nop,wscale 7], length 0
2022-04-04 21:48:41.724413 IP (tos 0x0, ttl 64, id 0, offset 0, flags [DF], proto TCP (6), length 60)
    127.0.0.1.10650 > 127.0.0.1.37026: Flags [S.], cksum 0xfe30 (incorrect -> 0x47af), seq 4173450361, ack 2970360619, win 65483, options [mss 65495,sackOK,TS val 746566096 ecr 746566095,nop,wscale 7], length 0
2022-04-04 21:48:41.724422 IP (tos 0x0, ttl 64, id 60924, offset 0, flags [DF], proto TCP (6), length 52)
    127.0.0.1.37026 > 127.0.0.1.10650: Flags [.], cksum 0xfe28 (incorrect -> 0x6e6a), seq 1, ack 1, win 512, options [nop,nop,TS val 746566096 ecr 746566096], length 0
2022-04-04 21:48:41.724585 IP (tos 0x0, ttl 64, id 60925, offset 0, flags [DF], proto TCP (6), length 55)
    127.0.0.1.37026 > 127.0.0.1.10650: Flags [P.], cksum 0xfe2b (incorrect -> 0x695e), seq 1:4, ack 1, win 512, options [nop,nop,TS val 746566096 ecr 746566096], length 3
2022-04-04 21:48:41.724591 IP (tos 0x0, ttl 64, id 35564, offset 0, flags [DF], proto TCP (6), length 52)
    127.0.0.1.10650 > 127.0.0.1.37026: Flags [.], cksum 0xfe28 (incorrect -> 0x6e67), seq 1, ack 4, win 512, options [nop,nop,TS val 746566096 ecr 746566096], length 0
2022-04-04 21:48:41.724617 IP (tos 0x0, ttl 64, id 35565, offset 0, flags [DF], proto TCP (6), length 54)
    127.0.0.1.10650 > 127.0.0.1.37026: Flags [P.], cksum 0xfe2a (incorrect -> 0x695d), seq 1:3, ack 4, win 512, options [nop,nop,TS val 746566096 ecr 746566096], length 2
2022-04-04 21:48:41.724624 IP (tos 0x0, ttl 64, id 60926, offset 0, flags [DF], proto TCP (6), length 52)
    127.0.0.1.37026 > 127.0.0.1.10650: Flags [.], cksum 0xfe28 (incorrect -> 0x6e65), seq 4, ack 3, win 512, options [nop,nop,TS val 746566096 ecr 746566096], length 0
2022-04-04 21:48:41.735772 IP (tos 0x0, ttl 64, id 60927, offset 0, flags [DF], proto TCP (6), length 62)
    127.0.0.1.37026 > 127.0.0.1.10650: Flags [P.], cksum 0xfe32 (incorrect -> 0xddd4), seq 4:14, ack 3, win 512, options [nop,nop,TS val 746566107 ecr 746566096], length 10
2022-04-04 21:48:41.735780 IP (tos 0x0, ttl 64, id 35566, offset 0, flags [DF], proto TCP (6), length 52)
    127.0.0.1.10650 > 127.0.0.1.37026: Flags [.], cksum 0xfe28 (incorrect -> 0x6e45), seq 3, ack 14, win 512, options [nop,nop,TS val 746566107 ecr 746566107], length 0
2022-04-04 21:48:41.819731 IP (tos 0x0, ttl 64, id 35567, offset 0, flags [DF], proto TCP (6), length 62)
    127.0.0.1.10650 > 127.0.0.1.37026: Flags [P.], cksum 0xfe32 (incorrect -> 0x68de), seq 3:13, ack 14, win 512, options [nop,nop,TS val 746566191 ecr 746566107], length 10
2022-04-04 21:48:41.819738 IP (tos 0x0, ttl 64, id 60928, offset 0, flags [DF], proto TCP (6), length 52)
    127.0.0.1.37026 > 127.0.0.1.10650: Flags [.], cksum 0xfe28 (incorrect -> 0x6d93), seq 14, ack 13, win 512, options [nop,nop,TS val 746566191 ecr 746566191], length 0
2022-04-04 21:48:41.825516 IP (tos 0x0, ttl 64, id 60929, offset 0, flags [DF], proto TCP (6), length 569)
    127.0.0.1.37026 > 127.0.0.1.10650: Flags [P.], cksum 0x002e (incorrect -> 0xb8b7), seq 14:531, ack 13, win 512, options [nop,nop,TS val 746566197 ecr 746566191], length 517
2022-04-04 21:48:41.825523 IP (tos 0x0, ttl 64, id 35568, offset 0, flags [DF], proto TCP (6), length 52)
    127.0.0.1.10650 > 127.0.0.1.37026: Flags [.], cksum 0xfe28 (incorrect -> 0x6b86), seq 13, ack 531, win 508, options [nop,nop,TS val 746566197 ecr 746566197], length 0
200, 8.934564590454102, 0.4799344539642334