2022-04-04 21:23:48.958202 IP (tos 0x0, ttl 64, id 302, offset 0, flags [DF], proto TCP (6), length 60)
    127.0.0.1.57848 > 127.0.0.1.9950: Flags [S], cksum 0xfe30 (incorrect -> 0xd811), seq 781789542, win 65495, options [mss 65495,sackOK,TS val 745073329 ecr 0,nop,wscale 7], length 0
2022-04-04 21:23:48.958214 IP (tos 0x0, ttl 64, id 0, offset 0, flags [DF], proto TCP (6), length 60)
    127.0.0.1.9950 > 127.0.0.1.57848: Flags [S.], cksum 0xfe30 (incorrect -> 0xea96), seq 789817160, ack 781789543, win 65483, options [mss 65495,sackOK,TS val 745073329 ecr 745073329,nop,wscale 7], length 0
2022-04-04 21:23:48.958225 IP (tos 0x0, ttl 64, id 303, offset 0, flags [DF], proto TCP (6), length 52)
    127.0.0.1.57848 > 127.0.0.1.9950: Flags [.], cksum 0xfe28 (incorrect -> 0x1153), seq 1, ack 1, win 512, options [nop,nop,TS val 745073329 ecr 745073329], length 0
2022-04-04 21:23:48.958403 IP (tos 0x0, ttl 64, id 304, offset 0, flags [DF], proto TCP (6), length 55)
    127.0.0.1.57848 > 127.0.0.1.9950: Flags [P.], cksum 0xfe2b (incorrect -> 0x0c46), seq 1:4, ack 1, win 512, options [nop,nop,TS val 745073330 ecr 745073329], length 3
2022-04-04 21:23:48.958412 IP (tos 0x0, ttl 64, id 10386, offset 0, flags [DF], proto TCP (6), length 52)
    127.0.0.1.9950 > 127.0.0.1.57848: Flags [.], cksum 0xfe28 (incorrect -> 0x114e), seq 1, ack 4, win 512, options [nop,nop,TS val 745073330 ecr 745073330], length 0
2022-04-04 21:23:48.958443 IP (tos 0x0, ttl 64, id 10387, offset 0, flags [DF], proto TCP (6), length 54)
    127.0.0.1.9950 > 127.0.0.1.57848: Flags [P.], cksum 0xfe2a (incorrect -> 0x0c44), seq 1:3, ack 4, win 512, options [nop,nop,TS val 745073330 ecr 745073330], length 2
2022-04-04 21:23:48.958453 IP (tos 0x0, ttl 64, id 305, offset 0, flags [DF], proto TCP (6), length 52)
    127.0.0.1.57848 > 127.0.0.1.9950: Flags [.], cksum 0xfe28 (incorrect -> 0x114c), seq 4, ack 3, win 512, options [nop,nop,TS val 745073330 ecr 745073330], length 0
2022-04-04 21:23:48.960215 IP (tos 0x0, ttl 64, id 306, offset 0, flags [DF], proto TCP (6), length 62)
    127.0.0.1.57848 > 127.0.0.1.9950: Flags [P.], cksum 0xfe32 (incorrect -> 0xc212), seq 4:14, ack 3, win 512, options [nop,nop,TS val 745073331 ecr 745073330], length 10
2022-04-04 21:23:48.960238 IP (tos 0x0, ttl 64, id 10388, offset 0, flags [DF], proto TCP (6), length 52)
    127.0.0.1.9950 > 127.0.0.1.57848: Flags [.], cksum 0xfe28 (incorrect -> 0x1140), seq 3, ack 14, win 512, options [nop,nop,TS val 745073331 ecr 745073331], length 0
2022-04-04 21:23:49.101518 IP (tos 0x0, ttl 64, id 10389, offset 0, flags [DF], proto TCP (6), length 62)
    127.0.0.1.9950 > 127.0.0.1.57848: Flags [P.], cksum 0xfe32 (incorrect -> 0x0b9f), seq 3:13, ack 14, win 512, options [nop,nop,TS val 745073473 ecr 745073331], length 10
2022-04-04 21:23:49.101530 IP (tos 0x0, ttl 64, id 307, offset 0, flags [DF], proto TCP (6), length 52)
    127.0.0.1.57848 > 127.0.0.1.9950: Flags [.], cksum 0xfe28 (incorrect -> 0x101a), seq 14, ack 13, win 512, options [nop,nop,TS val 745073473 ecr 745073473], length 0
2022-04-04 21:23:49.107474 IP (tos 0x0, ttl 64, id 308, offset 0, flags [DF], proto TCP (6), length 569)
    127.0.0.1.57848 > 127.0.0.1.9950: Flags [P.], cksum 0x002e (incorrect -> 0x007c), seq 14:531, ack 13, win 512, options [nop,nop,TS val 745073479 ecr 745073473], length 517
2022-04-04 21:23:49.107485 IP (tos 0x0, ttl 64, id 10390, offset 0, flags [DF], proto TCP (6), length 52)
    127.0.0.1.9950 > 127.0.0.1.57848: Flags [.], cksum 0xfe28 (incorrect -> 0x0e0d), seq 13, ack 531, win 508, options [nop,nop,TS val 745073479 ecr 745073479], length 0
2022-04-04 21:23:49.235231 IP (tos 0x0, ttl 64, id 10391, offset 0, flags [DF], proto TCP (6), length 1546)
    127.0.0.1.9950 > 127.0.0.1.57848: Flags [P.], cksum 0x03ff (incorrect -> 0x386d), seq 13:1507, ack 531, win 512, options [nop,nop,TS val 745073606 ecr 745073479], length 1494
2022-04-04 21:23:49.235240 IP (tos 0x0, ttl 64, id 309, offset 0, flags [DF], proto TCP (6), length 52)
    127.0.0.1.57848 > 127.0.0.1.9950: Flags [.], cksum 0xfe28 (incorrect -> 0x073f), seq 531, ack 1507, win 502, options [nop,nop,TS val 745073606 ecr 745073606], length 0
2022-04-04 21:23:49.274012 IP (tos 0x0, ttl 64, id 10392, offset 0, flags [DF], proto TCP (6), length 2044)
    127.0.0.1.9950 > 127.0.0.1.57848: Flags [P.], cksum 0x05f1 (incorrect -> 0x298f), seq 1507:3499, ack 531, win 512, options [nop,nop,TS val 745073645 ecr 745073606], length 1992
2022-04-04 21:23:49.274019 IP (tos 0x0, ttl 64, id 310, offset 0, flags [DF], proto TCP (6), length 52)
    127.0.0.1.57848 > 127.0.0.1.9950: Flags [.], cksum 0xfe28 (incorrect -> 0xff2a), seq 531, ack 3499, win 500, options [nop,nop,TS val 745073645 ecr 745073645], length 0
2022-04-04 21:23:49.308174 IP (tos 0x0, ttl 64, id 10393, offset 0, flags [DF], proto TCP (6), length 2044)
    127.0.0.1.9950 > 127.0.0.1.57848: Flags [P.], cksum 0x05f1 (incorrect -> 0x2faa), seq 3499:5491, ack 531, win 512, options [nop,nop,TS val 745073679 ecr 745073645], length 1992
2022-04-04 21:23:49.308182 IP (tos 0x0, ttl 64, id 311, offset 0, flags [DF], proto TCP (6), length 52)
    127.0.0.1.57848 > 127.0.0.1.9950: Flags [.], cksum 0xfe28 (incorrect -> 0xf71e), seq 531, ack 5491, win 500, options [nop,nop,TS val 745073679 ecr 745073679], length 0
2022-04-04 21:23:49.340882 IP (tos 0x0, ttl 64, id 10394, offset 0, flags [DF], proto TCP (6), length 1251)
    127.0.0.1.9950 > 127.0.0.1.57848: Flags [P.], cksum 0x02d8 (incorrect -> 0x7e8b), seq 5491:6690, ack 531, win 512, options [nop,nop,TS val 745073712 ecr 745073679], length 1199
2022-04-04 21:23:49.340891 IP (tos 0x0, ttl 64, id 312, offset 0, flags [DF], proto TCP (6), length 52)
    127.0.0.1.57848 > 127.0.0.1.9950: Flags [.], cksum 0xfe28 (incorrect -> 0xf22a), seq 531, ack 6690, win 503, options [nop,nop,TS val 745073712 ecr 745073712], length 0
2022-04-04 21:23:49.341594 IP (tos 0x0, ttl 64, id 313, offset 0, flags [DF], proto TCP (6), length 132)
    127.0.0.1.57848 > 127.0.0.1.9950: Flags [P.], cksum 0xfe78 (incorrect -> 0xf532), seq 531:611, ack 6690, win 512, options [nop,nop,TS val 745073713 ecr 745073712], length 80
2022-04-04 21:23:49.341605 IP (tos 0x0, ttl 64, id 10395, offset 0, flags [DF], proto TCP (6), length 52)
    127.0.0.1.9950 > 127.0.0.1.57848: Flags [.], cksum 0xfe28 (incorrect -> 0xf1cf), seq 6690, ack 611, win 512, options [nop,nop,TS val 745073713 ecr 745073713], length 0
2022-04-04 21:23:49.342241 IP (tos 0x0, ttl 64, id 314, offset 0, flags [DF], proto TCP (6), length 332)
    127.0.0.1.57848 > 127.0.0.1.9950: Flags [P.], cksum 0xff40 (incorrect -> 0xc2a3), seq 611:891, ack 6690, win 512, options [nop,nop,TS val 745073713 ecr 745073713], length 280
2022-04-04 21:23:49.342251 IP (tos 0x0, ttl 64, id 10396, offset 0, flags [DF], proto TCP (6), length 52)
    127.0.0.1.9950 > 127.0.0.1.57848: Flags [.], cksum 0xfe28 (incorrect -> 0xf0b9), seq 6690, ack 891, win 510, options [nop,nop,TS val 745073713 ecr 745073713], length 0
2022-04-04 21:23:49.976002 IP (tos 0x0, ttl 64, id 10397, offset 0, flags [DF], proto TCP (6), length 1728)
    127.0.0.1.9950 > 127.0.0.1.57848: Flags [P.], cksum 0x04b5 (incorrect -> 0x4757), seq 6690:8366, ack 891, win 512, options [nop,nop,TS val 745074347 ecr 745073713], length 1676
2022-04-04 21:23:49.976014 IP (tos 0x0, ttl 64, id 315, offset 0, flags [DF], proto TCP (6), length 52)
    127.0.0.1.57848 > 127.0.0.1.9950: Flags [.], cksum 0xfe28 (incorrect -> 0xe542), seq 891, ack 8366, win 501, options [nop,nop,TS val 745074347 ecr 745074347], length 0
2022-04-04 21:23:49.979004 IP (tos 0x0, ttl 64, id 42384, offset 0, flags [DF], proto TCP (6), length 60)
    127.0.0.1.57850 > 127.0.0.1.9950: Flags [S], cksum 0xfe30 (incorrect -> 0xfa48), seq 116009695, win 65495, options [mss 65495,sackOK,TS val 745074350 ecr 0,nop,wscale 7], length 0
2022-04-04 21:23:49.979014 IP (tos 0x0, ttl 64, id 0, offset 0, flags [DF], proto TCP (6), length 60)
    127.0.0.1.9950 > 127.0.0.1.57850: Flags [S.], cksum 0xfe30 (incorrect -> 0xbd45), seq 3614526069, ack 116009696, win 65483, options [mss 65495,sackOK,TS val 745074350 ecr 745074350,nop,wscale 7], length 0
2022-04-04 21:23:49.979023 IP (tos 0x0, ttl 64, id 42385, offset 0, flags [DF], proto TCP (6), length 52)
    127.0.0.1.57850 > 127.0.0.1.9950: Flags [.], cksum 0xfe28 (incorrect -> 0xe401), seq 1, ack 1, win 512, options [nop,nop,TS val 745074350 ecr 745074350], length 0
2022-04-04 21:23:49.979115 IP (tos 0x0, ttl 64, id 42386, offset 0, flags [DF], proto TCP (6), length 55)
    127.0.0.1.57850 > 127.0.0.1.9950: Flags [P.], cksum 0xfe2b (incorrect -> 0xdef5), seq 1:4, ack 1, win 512, options [nop,nop,TS val 745074350 ecr 745074350], length 3
2022-04-04 21:23:49.979122 IP (tos 0x0, ttl 64, id 25384, offset 0, flags [DF], proto TCP (6), length 52)
    127.0.0.1.9950 > 127.0.0.1.57850: Flags [.], cksum 0xfe28 (incorrect -> 0xe3fe), seq 1, ack 4, win 512, options [nop,nop,TS val 745074350 ecr 745074350], length 0
2022-04-04 21:23:49.979142 IP (tos 0x0, ttl 64, id 25385, offset 0, flags [DF], proto TCP (6), length 54)
    127.0.0.1.9950 > 127.0.0.1.57850: Flags [P.], cksum 0xfe2a (incorrect -> 0xdef4), seq 1:3, ack 4, win 512, options [nop,nop,TS val 745074350 ecr 745074350], length 2
2022-04-04 21:23:49.979150 IP (tos 0x0, ttl 64, id 42387, offset 0, flags [DF], proto TCP (6), length 52)
    127.0.0.1.57850 > 127.0.0.1.9950: Flags [.], cksum 0xfe28 (incorrect -> 0xe3fc), seq 4, ack 3, win 512, options [nop,nop,TS val 745074350 ecr 745074350], length 0
2022-04-04 21:23:49.980097 IP (tos 0x0, ttl 64, id 42388, offset 0, flags [DF], proto TCP (6), length 62)
    127.0.0.1.57850 > 127.0.0.1.9950: Flags [P.], cksum 0xfe32 (incorrect -> 0x304d), seq 4:14, ack 3, win 512, options [nop,nop,TS val 745074351 ecr 745074350], length 10
2022-04-04 21:23:49.980119 IP (tos 0x0, ttl 64, id 25386, offset 0, flags [DF], proto TCP (6), length 52)
    127.0.0.1.9950 > 127.0.0.1.57850: Flags [.], cksum 0xfe28 (incorrect -> 0xe3f0), seq 3, ack 14, win 512, options [nop,nop,TS val 745074351 ecr 745074351], length 0
2022-04-04 21:23:50.069827 IP (tos 0x0, ttl 64, id 25387, offset 0, flags [DF], proto TCP (6), length 62)
    127.0.0.1.9950 > 127.0.0.1.57850: Flags [P.], cksum 0xfe32 (incorrect -> 0xde83), seq 3:13, ack 14, win 512, options [nop,nop,TS val 745074441 ecr 745074351], length 10
2022-04-04 21:23:50.069840 IP (tos 0x0, ttl 64, id 42389, offset 0, flags [DF], proto TCP (6), length 52)
    127.0.0.1.57850 > 127.0.0.1.9950: Flags [.], cksum 0xfe28 (incorrect -> 0xe332), seq 14, ack 13, win 512, options [nop,nop,TS val 745074441 ecr 745074441], length 0
2022-04-04 21:23:50.074921 IP (tos 0x0, ttl 64, id 42390, offset 0, flags [DF], proto TCP (6), length 569)
    127.0.0.1.57850 > 127.0.0.1.9950: Flags [P.], cksum 0x002e (incorrect -> 0xc83d), seq 14:531, ack 13, win 512, options [nop,nop,TS val 745074446 ecr 745074441], length 517
2022-04-04 21:23:50.074931 IP (tos 0x0, ttl 64, id 25388, offset 0, flags [DF], proto TCP (6), length 52)
    127.0.0.1.9950 > 127.0.0.1.57850: Flags [.], cksum 0xfe28 (incorrect -> 0xe127), seq 13, ack 531, win 508, options [nop,nop,TS val 745074446 ecr 745074446], length 0
2022-04-04 21:23:50.202436 IP (tos 0x0, ttl 64, id 25389, offset 0, flags [DF], proto TCP (6), length 2542)
    127.0.0.1.9950 > 127.0.0.1.57850: Flags [P.], cksum 0x07e3 (incorrect -> 0xac9a), seq 13:2503, ack 531, win 512, options [nop,nop,TS val 745074574 ecr 745074446], length 2490
2022-04-04 21:23:50.202444 IP (tos 0x0, ttl 64, id 42391, offset 0, flags [DF], proto TCP (6), length 52)
    127.0.0.1.57850 > 127.0.0.1.9950: Flags [.], cksum 0xfe28 (incorrect -> 0xd677), seq 531, ack 2503, win 498, options [nop,nop,TS val 745074574 ecr 745074574], length 0
2022-04-04 21:23:50.236480 IP (tos 0x0, ttl 64, id 25390, offset 0, flags [DF], proto TCP (6), length 1855)
    127.0.0.1.9950 > 127.0.0.1.57850: Flags [P.], cksum 0x0534 (incorrect -> 0xc071), seq 2503:4306, ack 531, win 512, options [nop,nop,TS val 745074608 ecr 745074574], length 1803
2022-04-04 21:23:50.236494 IP (tos 0x0, ttl 64, id 42392, offset 0, flags [DF], proto TCP (6), length 52)
    127.0.0.1.57850 > 127.0.0.1.9950: Flags [.], cksum 0xfe28 (incorrect -> 0xcf26), seq 531, ack 4306, win 500, options [nop,nop,TS val 745074608 ecr 745074608], length 0
2022-04-04 21:23:50.236989 IP (tos 0x0, ttl 64, id 42393, offset 0, flags [DF], proto TCP (6), length 132)
    127.0.0.1.57850 > 127.0.0.1.9950: Flags [P.], cksum 0xfe78 (incorrect -> 0x8457), seq 531:611, ack 4306, win 512, options [nop,nop,TS val 745074608 ecr 745074608], length 80
2022-04-04 21:23:50.236997 IP (tos 0x0, ttl 64, id 25391, offset 0, flags [DF], proto TCP (6), length 52)
    127.0.0.1.9950 > 127.0.0.1.57850: Flags [.], cksum 0xfe28 (incorrect -> 0xceca), seq 4306, ack 611, win 512, options [nop,nop,TS val 745074608 ecr 745074608], length 0
2022-04-04 21:23:50.237246 IP (tos 0x0, ttl 64, id 42394, offset 0, flags [DF], proto TCP (6), length 429)
    127.0.0.1.57850 > 127.0.0.1.9950: Flags [P.], cksum 0xffa1 (incorrect -> 0x550f), seq 611:988, ack 4306, win 512, options [nop,nop,TS val 745074608 ecr 745074608], length 377
2022-04-04 21:23:50.237255 IP (tos 0x0, ttl 64, id 25392, offset 0, flags [DF], proto TCP (6), length 52)
    127.0.0.1.9950 > 127.0.0.1.57850: Flags [.], cksum 0xfe28 (incorrect -> 0xcd53), seq 4306, ack 988, win 510, options [nop,nop,TS val 745074608 ecr 745074608], length 0
2022-04-04 21:23:50.434579 IP (tos 0x0, ttl 64, id 25393, offset 0, flags [DF], proto TCP (6), length 1774)
    127.0.0.1.9950 > 127.0.0.1.57850: Flags [P.], cksum 0x04e3 (incorrect -> 0x8027), seq 4306:6028, ack 988, win 512, options [nop,nop,TS val 745074806 ecr 745074608], length 1722
2022-04-04 21:23:50.434590 IP (tos 0x0, ttl 64, id 42395, offset 0, flags [DF], proto TCP (6), length 52)
    127.0.0.1.57850 > 127.0.0.1.9950: Flags [.], cksum 0xfe28 (incorrect -> 0xc516), seq 988, ack 6028, win 501, options [nop,nop,TS val 745074806 ecr 745074806], length 0
2022-04-04 21:23:50.437504 IP (tos 0x0, ttl 64, id 316, offset 0, flags [DF], proto TCP (6), length 572)
    127.0.0.1.57848 > 127.0.0.1.9950: Flags [P.], cksum 0x0031 (incorrect -> 0x27e2), seq 891:1411, ack 8366, win 512, options [nop,nop,TS val 745074809 ecr 745074347], length 520
2022-04-04 21:23:50.437517 IP (tos 0x0, ttl 64, id 10398, offset 0, flags [DF], proto TCP (6), length 52)
    127.0.0.1.9950 > 127.0.0.1.57848: Flags [.], cksum 0xfe28 (incorrect -> 0xdf97), seq 8366, ack 1411, win 508, options [nop,nop,TS val 745074809 ecr 745074809], length 0
2022-04-04 21:23:50.977865 IP (tos 0x0, ttl 64, id 10399, offset 0, flags [DF], proto TCP (6), length 972)
    127.0.0.1.9950 > 127.0.0.1.57848: Flags [P.], cksum 0x01c1 (incorrect -> 0x339d), seq 8366:9286, ack 1411, win 512, options [nop,nop,TS val 745075349 ecr 745074809], length 920
2022-04-04 21:23:50.977875 IP (tos 0x0, ttl 64, id 317, offset 0, flags [DF], proto TCP (6), length 52)
    127.0.0.1.57848 > 127.0.0.1.9950: Flags [.], cksum 0xfe28 (incorrect -> 0xd7ca), seq 1411, ack 9286, win 505, options [nop,nop,TS val 745075349 ecr 745075349], length 0
2022-04-04 21:23:50.981093 IP (tos 0x0, ttl 64, id 318, offset 0, flags [DF], proto TCP (6), length 468)
    127.0.0.1.57848 > 127.0.0.1.9950: Flags [P.], cksum 0xffc8 (incorrect -> 0x22ad), seq 1411:1827, ack 9286, win 512, options [nop,nop,TS val 745075352 ecr 745075349], length 416
2022-04-04 21:23:50.981103 IP (tos 0x0, ttl 64, id 10400, offset 0, flags [DF], proto TCP (6), length 52)
    127.0.0.1.9950 > 127.0.0.1.57848: Flags [.], cksum 0xfe28 (incorrect -> 0xd620), seq 9286, ack 1827, win 509, options [nop,nop,TS val 745075352 ecr 745075352], length 0
2022-04-04 21:23:51.130055 IP (tos 0x0, ttl 64, id 10401, offset 0, flags [DF], proto TCP (6), length 2044)
    127.0.0.1.9950 > 127.0.0.1.57848: Flags [P.], cksum 0x05f1 (incorrect -> 0x1d53), seq 9286:11278, ack 1827, win 512, options [nop,nop,TS val 745075501 ecr 745075352], length 1992
200, 4.983341217041016, 2.6972875595092773