2022-04-04 23:31:15.061842 IP (tos 0x0, ttl 64, id 38205, offset 0, flags [DF], proto TCP (6), length 60)
    127.0.0.1.48758 > 127.0.0.1.10150: Flags [S], cksum 0xfe30 (incorrect -> 0xb91b), seq 98166729, win 65495, options [mss 65495,sackOK,TS val 752719433 ecr 0,nop,wscale 7], length 0
2022-04-04 23:31:15.061852 IP (tos 0x0, ttl 64, id 0, offset 0, flags [DF], proto TCP (6), length 60)
    127.0.0.1.10150 > 127.0.0.1.48758: Flags [S.], cksum 0xfe30 (incorrect -> 0x84a2), seq 743326975, ack 98166730, win 65483, options [mss 65495,sackOK,TS val 752719433 ecr 752719433,nop,wscale 7], length 0
2022-04-04 23:31:15.061860 IP (tos 0x0, ttl 64, id 38206, offset 0, flags [DF], proto TCP (6), length 52)
    127.0.0.1.48758 > 127.0.0.1.10150: Flags [.], cksum 0xfe28 (incorrect -> 0xab5e), seq 1, ack 1, win 512, options [nop,nop,TS val 752719433 ecr 752719433], length 0
2022-04-04 23:31:15.062010 IP (tos 0x0, ttl 64, id 38207, offset 0, flags [DF], proto TCP (6), length 55)
    127.0.0.1.48758 > 127.0.0.1.10150: Flags [P.], cksum 0xfe2b (incorrect -> 0xa652), seq 1:4, ack 1, win 512, options [nop,nop,TS val 752719433 ecr 752719433], length 3
2022-04-04 23:31:15.062016 IP (tos 0x0, ttl 64, id 47026, offset 0, flags [DF], proto TCP (6), length 52)
    127.0.0.1.10150 > 127.0.0.1.48758: Flags [.], cksum 0xfe28 (incorrect -> 0xab5b), seq 1, ack 4, win 512, options [nop,nop,TS val 752719433 ecr 752719433], length 0
2022-04-04 23:31:15.062037 IP (tos 0x0, ttl 64, id 47027, offset 0, flags [DF], proto TCP (6), length 54)
    127.0.0.1.10150 > 127.0.0.1.48758: Flags [P.], cksum 0xfe2a (incorrect -> 0xa651), seq 1:3, ack 4, win 512, options [nop,nop,TS val 752719433 ecr 752719433], length 2
2022-04-04 23:31:15.062043 IP (tos 0x0, ttl 64, id 38208, offset 0, flags [DF], proto TCP (6), length 52)
    127.0.0.1.48758 > 127.0.0.1.10150: Flags [.], cksum 0xfe28 (incorrect -> 0xab59), seq 4, ack 3, win 512, options [nop,nop,TS val 752719433 ecr 752719433], length 0
2022-04-04 23:31:15.063376 IP (tos 0x0, ttl 64, id 38209, offset 0, flags [DF], proto TCP (6), length 62)
    127.0.0.1.48758 > 127.0.0.1.10150: Flags [P.], cksum 0xfe32 (incorrect -> 0xf1ea), seq 4:14, ack 3, win 512, options [nop,nop,TS val 752719434 ecr 752719433], length 10
2022-04-04 23:31:15.063388 IP (tos 0x0, ttl 64, id 47028, offset 0, flags [DF], proto TCP (6), length 52)
    127.0.0.1.10150 > 127.0.0.1.48758: Flags [.], cksum 0xfe28 (incorrect -> 0xab4d), seq 3, ack 14, win 512, options [nop,nop,TS val 752719434 ecr 752719434], length 0
2022-04-04 23:31:15.155919 IP (tos 0x0, ttl 64, id 47029, offset 0, flags [DF], proto TCP (6), length 62)
    127.0.0.1.10150 > 127.0.0.1.48758: Flags [P.], cksum 0xfe32 (incorrect -> 0xa5dd), seq 3:13, ack 14, win 512, options [nop,nop,TS val 752719527 ecr 752719434], length 10
2022-04-04 23:31:15.155926 IP (tos 0x0, ttl 64, id 38210, offset 0, flags [DF], proto TCP (6), length 52)
    127.0.0.1.48758 > 127.0.0.1.10150: Flags [.], cksum 0xfe28 (incorrect -> 0xaa89), seq 14, ack 13, win 512, options [nop,nop,TS val 752719527 ecr 752719527], length 0
2022-04-04 23:31:15.161605 IP (tos 0x0, ttl 64, id 38211, offset 0, flags [DF], proto TCP (6), length 569)
    127.0.0.1.48758 > 127.0.0.1.10150: Flags [P.], cksum 0x002e (incorrect -> 0x3e4f), seq 14:531, ack 13, win 512, options [nop,nop,TS val 752719533 ecr 752719527], length 517
2022-04-04 23:31:15.161613 IP (tos 0x0, ttl 64, id 47030, offset 0, flags [DF], proto TCP (6), length 52)
    127.0.0.1.10150 > 127.0.0.1.48758: Flags [.], cksum 0xfe28 (incorrect -> 0xa87c), seq 13, ack 531, win 508, options [nop,nop,TS val 752719533 ecr 752719533], length 0
200, 9.779274463653564, 1.065385341644287