2022-04-04 20:01:34.357843 IP (tos 0x0, ttl 64, id 51247, offset 0, flags [DF], proto TCP (6), length 60)
    127.0.0.1.49236 > 127.0.0.1.11250: Flags [S], cksum 0xfe30 (incorrect -> 0x6058), seq 1382409718, win 65495, options [mss 65495,sackOK,TS val 740138729 ecr 0,nop,wscale 7], length 0
2022-04-04 20:01:34.357859 IP (tos 0x0, ttl 64, id 0, offset 0, flags [DF], proto TCP (6), length 60)
    127.0.0.1.11250 > 127.0.0.1.49236: Flags [S.], cksum 0xfe30 (incorrect -> 0x8120), seq 239863264, ack 1382409719, win 65483, options [mss 65495,sackOK,TS val 740138729 ecr 740138729,nop,wscale 7], length 0
2022-04-04 20:01:34.357872 IP (tos 0x0, ttl 64, id 51248, offset 0, flags [DF], proto TCP (6), length 52)
    127.0.0.1.49236 > 127.0.0.1.11250: Flags [.], cksum 0xfe28 (incorrect -> 0xa7dc), seq 1, ack 1, win 512, options [nop,nop,TS val 740138729 ecr 740138729], length 0
2022-04-04 20:01:34.357981 IP (tos 0x0, ttl 64, id 51249, offset 0, flags [DF], proto TCP (6), length 55)
    127.0.0.1.49236 > 127.0.0.1.11250: Flags [P.], cksum 0xfe2b (incorrect -> 0xa2d0), seq 1:4, ack 1, win 512, options [nop,nop,TS val 740138729 ecr 740138729], length 3
2022-04-04 20:01:34.357997 IP (tos 0x0, ttl 64, id 36659, offset 0, flags [DF], proto TCP (6), length 52)
    127.0.0.1.11250 > 127.0.0.1.49236: Flags [.], cksum 0xfe28 (incorrect -> 0xa7d9), seq 1, ack 4, win 512, options [nop,nop,TS val 740138729 ecr 740138729], length 0
2022-04-04 20:01:34.358063 IP (tos 0x0, ttl 64, id 36660, offset 0, flags [DF], proto TCP (6), length 54)
    127.0.0.1.11250 > 127.0.0.1.49236: Flags [P.], cksum 0xfe2a (incorrect -> 0xa2cf), seq 1:3, ack 4, win 512, options [nop,nop,TS val 740138729 ecr 740138729], length 2
2022-04-04 20:01:34.358079 IP (tos 0x0, ttl 64, id 51250, offset 0, flags [DF], proto TCP (6), length 52)
    127.0.0.1.49236 > 127.0.0.1.11250: Flags [.], cksum 0xfe28 (incorrect -> 0xa7d7), seq 4, ack 3, win 512, options [nop,nop,TS val 740138729 ecr 740138729], length 0
2022-04-04 20:01:34.359793 IP (tos 0x0, ttl 64, id 51251, offset 0, flags [DF], proto TCP (6), length 62)
    127.0.0.1.49236 > 127.0.0.1.11250: Flags [P.], cksum 0xfe32 (incorrect -> 0x4f91), seq 4:14, ack 3, win 512, options [nop,nop,TS val 740138731 ecr 740138729], length 10
2022-04-04 20:01:34.359804 IP (tos 0x0, ttl 64, id 36661, offset 0, flags [DF], proto TCP (6), length 52)
    127.0.0.1.11250 > 127.0.0.1.49236: Flags [.], cksum 0xfe28 (incorrect -> 0xa7c9), seq 3, ack 14, win 512, options [nop,nop,TS val 740138731 ecr 740138731], length 0
2022-04-04 20:01:34.604469 IP (tos 0x0, ttl 64, id 36662, offset 0, flags [DF], proto TCP (6), length 62)
    127.0.0.1.11250 > 127.0.0.1.49236: Flags [P.], cksum 0xfe32 (incorrect -> 0xa1c1), seq 3:13, ack 14, win 512, options [nop,nop,TS val 740138976 ecr 740138731], length 10
2022-04-04 20:01:34.604482 IP (tos 0x0, ttl 64, id 51252, offset 0, flags [DF], proto TCP (6), length 52)
    127.0.0.1.49236 > 127.0.0.1.11250: Flags [.], cksum 0xfe28 (incorrect -> 0xa5d5), seq 14, ack 13, win 512, options [nop,nop,TS val 740138976 ecr 740138976], length 0
2022-04-04 20:01:34.610424 IP (tos 0x0, ttl 64, id 51253, offset 0, flags [DF], proto TCP (6), length 569)
    127.0.0.1.49236 > 127.0.0.1.11250: Flags [P.], cksum 0x002e (incorrect -> 0x34ef), seq 14:531, ack 13, win 512, options [nop,nop,TS val 740138982 ecr 740138976], length 517
2022-04-04 20:01:34.610435 IP (tos 0x0, ttl 64, id 36663, offset 0, flags [DF], proto TCP (6), length 52)
    127.0.0.1.11250 > 127.0.0.1.49236: Flags [.], cksum 0xfe28 (incorrect -> 0xa3c8), seq 13, ack 531, win 508, options [nop,nop,TS val 740138982 ecr 740138982], length 0
2022-04-04 20:01:34.853424 IP (tos 0x0, ttl 64, id 36664, offset 0, flags [DF], proto TCP (6), length 3538)
    127.0.0.1.11250 > 127.0.0.1.49236: Flags [P.], cksum 0x0bc7 (incorrect -> 0x6407), seq 13:3499, ack 531, win 512, options [nop,nop,TS val 740139225 ecr 740138982], length 3486
2022-04-04 20:01:34.853436 IP (tos 0x0, ttl 64, id 51254, offset 0, flags [DF], proto TCP (6), length 52)
    127.0.0.1.49236 > 127.0.0.1.11250: Flags [.], cksum 0xfe28 (incorrect -> 0x9452), seq 531, ack 3499, win 494, options [nop,nop,TS val 740139225 ecr 740139225], length 0
2022-04-04 20:01:34.956919 IP (tos 0x0, ttl 64, id 36665, offset 0, flags [DF], proto TCP (6), length 272)
    127.0.0.1.11250 > 127.0.0.1.49236: Flags [P.], cksum 0xff04 (incorrect -> 0xa2e8), seq 3499:3719, ack 531, win 512, options [nop,nop,TS val 740139328 ecr 740139225], length 220
2022-04-04 20:01:34.956929 IP (tos 0x0, ttl 64, id 51255, offset 0, flags [DF], proto TCP (6), length 52)
    127.0.0.1.49236 > 127.0.0.1.11250: Flags [.], cksum 0xfe28 (incorrect -> 0x929b), seq 531, ack 3719, win 507, options [nop,nop,TS val 740139328 ecr 740139328], length 0
2022-04-04 20:01:34.957055 IP (tos 0x0, ttl 64, id 51256, offset 0, flags [DF], proto TCP (6), length 132)
    127.0.0.1.49236 > 127.0.0.1.11250: Flags [P.], cksum 0xfe78 (incorrect -> 0x8d84), seq 531:611, ack 3719, win 507, options [nop,nop,TS val 740139328 ecr 740139328], length 80
2022-04-04 20:01:34.957063 IP (tos 0x0, ttl 64, id 36666, offset 0, flags [DF], proto TCP (6), length 52)
    127.0.0.1.11250 > 127.0.0.1.49236: Flags [.], cksum 0xfe28 (incorrect -> 0x9246), seq 3719, ack 611, win 512, options [nop,nop,TS val 740139328 ecr 740139328], length 0
2022-04-04 20:01:34.957653 IP (tos 0x0, ttl 64, id 51257, offset 0, flags [DF], proto TCP (6), length 335)
    127.0.0.1.49236 > 127.0.0.1.11250: Flags [P.], cksum 0xff43 (incorrect -> 0x6060), seq 611:894, ack 3719, win 507, options [nop,nop,TS val 740139329 ecr 740139328], length 283
2022-04-04 20:01:34.957660 IP (tos 0x0, ttl 64, id 36667, offset 0, flags [DF], proto TCP (6), length 52)
    127.0.0.1.11250 > 127.0.0.1.49236: Flags [.], cksum 0xfe28 (incorrect -> 0x912b), seq 3719, ack 894, win 510, options [nop,nop,TS val 740139329 ecr 740139329], length 0
2022-04-04 20:01:35.406636 IP (tos 0x0, ttl 64, id 36668, offset 0, flags [DF], proto TCP (6), length 3230)
    127.0.0.1.11250 > 127.0.0.1.49236: Flags [P.], cksum 0x0a93 (incorrect -> 0xf1cb), seq 3719:6897, ack 894, win 512, options [nop,nop,TS val 740139778 ecr 740139329], length 3178
2022-04-04 20:01:35.406648 IP (tos 0x0, ttl 64, id 51258, offset 0, flags [DF], proto TCP (6), length 52)
    127.0.0.1.49236 > 127.0.0.1.11250: Flags [.], cksum 0xfe28 (incorrect -> 0x814e), seq 894, ack 6897, win 495, options [nop,nop,TS val 740139778 ecr 740139778], length 0
2022-04-04 20:01:35.421096 IP (tos 0x0, ttl 64, id 36669, offset 0, flags [DF], proto TCP (6), length 4036)
    127.0.0.1.11250 > 127.0.0.1.49236: Flags [P.], cksum 0x0db9 (incorrect -> 0x9339), seq 6897:10881, ack 894, win 512, options [nop,nop,TS val 740139792 ecr 740139778], length 3984
2022-04-04 20:01:35.421103 IP (tos 0x0, ttl 64, id 51259, offset 0, flags [DF], proto TCP (6), length 52)
    127.0.0.1.49236 > 127.0.0.1.11250: Flags [.], cksum 0xfe28 (incorrect -> 0x71a5), seq 894, ack 10881, win 492, options [nop,nop,TS val 740139792 ecr 740139792], length 0
2022-04-04 20:01:35.437633 IP (tos 0x0, ttl 64, id 36670, offset 0, flags [DF], proto TCP (6), length 2044)
    127.0.0.1.11250 > 127.0.0.1.49236: Flags [P.], cksum 0x05f1 (incorrect -> 0x3782), seq 10881:12873, ack 894, win 512, options [nop,nop,TS val 740139809 ecr 740139792], length 1992
2022-04-04 20:01:35.437658 IP (tos 0x0, ttl 64, id 51260, offset 0, flags [DF], proto TCP (6), length 52)
    127.0.0.1.49236 > 127.0.0.1.11250: Flags [.], cksum 0xfe28 (incorrect -> 0x69b3), seq 894, ack 12873, win 500, options [nop,nop,TS val 740139809 ecr 740139809], length 0
2022-04-04 20:01:35.449929 IP (tos 0x0, ttl 64, id 36671, offset 0, flags [DF], proto TCP (6), length 1246)
    127.0.0.1.11250 > 127.0.0.1.49236: Flags [P.], cksum 0x02d3 (incorrect -> 0xccde), seq 12873:14067, ack 894, win 512, options [nop,nop,TS val 740139821 ecr 740139809], length 1194
2022-04-04 20:01:35.449938 IP (tos 0x0, ttl 64, id 51261, offset 0, flags [DF], proto TCP (6), length 52)
    127.0.0.1.49236 > 127.0.0.1.11250: Flags [.], cksum 0xfe28 (incorrect -> 0x64ee), seq 894, ack 14067, win 503, options [nop,nop,TS val 740139821 ecr 740139821], length 0
2022-04-04 20:01:35.511101 IP (tos 0x0, ttl 64, id 36672, offset 0, flags [DF], proto TCP (6), length 3438)
    127.0.0.1.11250 > 127.0.0.1.49236: Flags [P.], cksum 0x0b63 (incorrect -> 0x2689), seq 14067:17453, ack 894, win 512, options [nop,nop,TS val 740139882 ecr 740139821], length 3386
2022-04-04 20:01:35.511113 IP (tos 0x0, ttl 64, id 51262, offset 0, flags [DF], proto TCP (6), length 52)
    127.0.0.1.49236 > 127.0.0.1.11250: Flags [.], cksum 0xfe28 (incorrect -> 0x5743), seq 894, ack 17453, win 494, options [nop,nop,TS val 740139882 ecr 740139882], length 0
2022-04-04 20:01:35.512546 IP (tos 0x0, ttl 64, id 36673, offset 0, flags [DF], proto TCP (6), length 4100)
    127.0.0.1.11250 > 127.0.0.1.49236: Flags [P.], cksum 0x0df9 (incorrect -> 0x7532), seq 17453:21501, ack 894, win 512, options [nop,nop,TS val 740139884 ecr 740139882], length 4048
2022-04-04 20:01:35.512554 IP (tos 0x0, ttl 64, id 51263, offset 0, flags [DF], proto TCP (6), length 52)
    127.0.0.1.49236 > 127.0.0.1.11250: Flags [.], cksum 0xfe28 (incorrect -> 0x4771), seq 894, ack 21501, win 492, options [nop,nop,TS val 740139884 ecr 740139884], length 0
2022-04-04 20:01:35.512572 IP (tos 0x0, ttl 64, id 36674, offset 0, flags [DF], proto TCP (6), length 3274)
    127.0.0.1.11250 > 127.0.0.1.49236: Flags [P.], cksum 0x0abf (incorrect -> 0xabff), seq 21501:24723, ack 894, win 512, options [nop,nop,TS val 740139884 ecr 740139884], length 3222
2022-04-04 20:01:35.512578 IP (tos 0x0, ttl 64, id 51264, offset 0, flags [DF], proto TCP (6), length 52)
    127.0.0.1.49236 > 127.0.0.1.11250: Flags [.], cksum 0xfe28 (incorrect -> 0x3ae8), seq 894, ack 24723, win 479, options [nop,nop,TS val 740139884 ecr 740139884], length 0
2022-04-04 20:01:35.526158 IP (tos 0x0, ttl 64, id 36675, offset 0, flags [DF], proto TCP (6), length 4100)
    127.0.0.1.11250 > 127.0.0.1.49236: Flags [P.], cksum 0x0df9 (incorrect -> 0x5f11), seq 24723:28771, ack 894, win 512, options [nop,nop,TS val 740139897 ecr 740139884], length 4048
2022-04-04 20:01:35.526174 IP (tos 0x0, ttl 64, id 51265, offset 0, flags [DF], proto TCP (6), length 52)
    127.0.0.1.49236 > 127.0.0.1.11250: Flags [.], cksum 0xfe28 (incorrect -> 0x2af1), seq 894, ack 28771, win 492, options [nop,nop,TS val 740139897 ecr 740139897], length 0
2022-04-04 20:01:35.526185 IP (tos 0x0, ttl 64, id 36676, offset 0, flags [DF], proto TCP (6), length 1282)
    127.0.0.1.11250 > 127.0.0.1.49236: Flags [P.], cksum 0x02f7 (incorrect -> 0x8e91), seq 28771:30001, ack 894, win 512, options [nop,nop,TS val 740139897 ecr 740139897], length 1230
2022-04-04 20:01:35.526190 IP (tos 0x0, ttl 64, id 51266, offset 0, flags [DF], proto TCP (6), length 52)
    127.0.0.1.49236 > 127.0.0.1.11250: Flags [.], cksum 0xfe28 (incorrect -> 0x2628), seq 894, ack 30001, win 487, options [nop,nop,TS val 740139897 ecr 740139897], length 0
2022-04-04 20:01:35.526221 IP (tos 0x0, ttl 64, id 36677, offset 0, flags [DF], proto TCP (6), length 3438)
    127.0.0.1.11250 > 127.0.0.1.49236: Flags [P.], cksum 0x0b63 (incorrect -> 0x2298), seq 30001:33387, ack 894, win 512, options [nop,nop,TS val 740139897 ecr 740139897], length 3386
2022-04-04 20:01:35.526225 IP (tos 0x0, ttl 64, id 51267, offset 0, flags [DF], proto TCP (6), length 52)
    127.0.0.1.49236 > 127.0.0.1.11250: Flags [.], cksum 0xfe28 (incorrect -> 0x18fb), seq 894, ack 33387, win 474, options [nop,nop,TS val 740139897 ecr 740139897], length 0
2022-04-04 20:01:35.540764 IP (tos 0x0, ttl 64, id 36678, offset 0, flags [DF], proto TCP (6), length 3438)
    127.0.0.1.11250 > 127.0.0.1.49236: Flags [P.], cksum 0x0b63 (incorrect -> 0xd23d), seq 33387:36773, ack 894, win 512, options [nop,nop,TS val 740139912 ecr 740139897], length 3386
2022-04-04 20:01:35.581393 IP (tos 0x0, ttl 64, id 51268, offset 0, flags [DF], proto TCP (6), length 52)
    127.0.0.1.49236 > 127.0.0.1.11250: Flags [.], cksum 0xfe28 (incorrect -> 0x0b55), seq 894, ack 36773, win 512, options [nop,nop,TS val 740139952 ecr 740139912], length 0
2022-04-04 20:01:35.581403 IP (tos 0x0, ttl 64, id 36679, offset 0, flags [DF], proto TCP (6), length 4334)
    127.0.0.1.11250 > 127.0.0.1.49236: Flags [P.], cksum 0x0ee3 (incorrect -> 0x283c), seq 36773:41055, ack 894, win 512, options [nop,nop,TS val 740139953 ecr 740139952], length 4282
2022-04-04 20:01:35.625395 IP (tos 0x0, ttl 64, id 51269, offset 0, flags [DF], proto TCP (6), length 52)
    127.0.0.1.49236 > 127.0.0.1.11250: Flags [.], cksum 0xfe28 (incorrect -> 0xfa45), seq 894, ack 41055, win 512, options [nop,nop,TS val 740139996 ecr 740139953], length 0
2022-04-04 20:01:35.625411 IP (tos 0x0, ttl 64, id 36680, offset 0, flags [DF], proto TCP (6), length 15488)
    127.0.0.1.11250 > 127.0.0.1.49236: Flags [P.], cksum 0x3a75 (incorrect -> 0x0148), seq 41055:56491, ack 894, win 512, options [nop,nop,TS val 740139997 ecr 740139996], length 15436
2022-04-04 20:01:35.673385 IP (tos 0x0, ttl 64, id 51270, offset 0, flags [DF], proto TCP (6), length 52)
    127.0.0.1.49236 > 127.0.0.1.11250: Flags [.], cksum 0xfe28 (incorrect -> 0xbd9d), seq 894, ack 56491, win 512, options [nop,nop,TS val 740140044 ecr 740139997], length 0
2022-04-04 20:01:35.673397 IP (tos 0x0, ttl 64, id 36681, offset 0, flags [DF], proto TCP (6), length 1916)
    127.0.0.1.11250 > 127.0.0.1.49236: Flags [P.], cksum 0x0571 (incorrect -> 0x1716), seq 56491:58355, ack 894, win 512, options [nop,nop,TS val 740140044 ecr 740140044], length 1864
2022-04-04 20:01:35.673434 IP (tos 0x0, ttl 64, id 51271, offset 0, flags [DF], proto TCP (6), length 52)
    127.0.0.1.49236 > 127.0.0.1.11250: Flags [.], cksum 0xfe28 (incorrect -> 0xb625), seq 894, ack 58355, win 512, options [nop,nop,TS val 740140045 ecr 740140044], length 0
2022-04-04 20:01:36.179521 IP (tos 0x0, ttl 64, id 36682, offset 0, flags [DF], proto TCP (6), length 603)
    127.0.0.1.11250 > 127.0.0.1.49236: Flags [P.], cksum 0x0050 (incorrect -> 0x402c), seq 58355:58906, ack 894, win 512, options [nop,nop,TS val 740140551 ecr 740140045], length 551
2022-04-04 20:01:36.179538 IP (tos 0x0, ttl 64, id 51272, offset 0, flags [DF], proto TCP (6), length 52)
    127.0.0.1.49236 > 127.0.0.1.11250: Flags [.], cksum 0xfe28 (incorrect -> 0xb00d), seq 894, ack 58906, win 508, options [nop,nop,TS val 740140551 ecr 740140551], length 0
2022-04-04 20:01:36.187947 IP (tos 0x0, ttl 64, id 36683, offset 0, flags [DF], proto TCP (6), length 4100)
    127.0.0.1.11250 > 127.0.0.1.49236: Flags [P.], cksum 0x0df9 (incorrect -> 0xab40), seq 58906:62954, ack 894, win 512, options [nop,nop,TS val 740140559 ecr 740140551], length 4048
2022-04-04 20:01:36.187955 IP (tos 0x0, ttl 64, id 51273, offset 0, flags [DF], proto TCP (6), length 52)
    127.0.0.1.49236 > 127.0.0.1.11250: Flags [.], cksum 0xfe28 (incorrect -> 0xa03d), seq 894, ack 62954, win 492, options [nop,nop,TS val 740140559 ecr 740140559], length 0
2022-04-04 20:01:36.187962 IP (tos 0x0, ttl 64, id 36684, offset 0, flags [DF], proto TCP (6), length 2337)
    127.0.0.1.11250 > 127.0.0.1.49236: Flags [P.], cksum 0x0716 (incorrect -> 0x5664), seq 62954:65239, ack 894, win 512, options [nop,nop,TS val 740140559 ecr 740140559], length 2285
2022-04-04 20:01:36.188137 IP (tos 0x0, ttl 64, id 51274, offset 0, flags [DF], proto TCP (6), length 52)
    127.0.0.1.49236 > 127.0.0.1.11250: Flags [.], cksum 0xfe28 (incorrect -> 0x973c), seq 894, ack 65239, win 512, options [nop,nop,TS val 740140559 ecr 740140559], length 0
2022-04-04 20:01:36.193806 IP (tos 0x0, ttl 64, id 36685, offset 0, flags [DF], proto TCP (6), length 1446)
    127.0.0.1.11250 > 127.0.0.1.49236: Flags [P.], cksum 0x039b (incorrect -> 0x575a), seq 65239:66633, ack 894, win 512, options [nop,nop,TS val 740140565 ecr 740140559], length 1394
2022-04-04 20:01:36.193826 IP (tos 0x0, ttl 64, id 51275, offset 0, flags [DF], proto TCP (6), length 52)
    127.0.0.1.49236 > 127.0.0.1.11250: Flags [.], cksum 0xfe28 (incorrect -> 0x91be), seq 894, ack 66633, win 512, options [nop,nop,TS val 740140565 ecr 740140565], length 0
2022-04-04 20:01:36.214350 IP (tos 0x0, ttl 64, id 36686, offset 0, flags [DF], proto TCP (6), length 2940)
    127.0.0.1.11250 > 127.0.0.1.49236: Flags [P.], cksum 0x0971 (incorrect -> 0x347b), seq 66633:69521, ack 894, win 512, options [nop,nop,TS val 740140585 ecr 740140565], length 2888
2022-04-04 20:01:36.214376 IP (tos 0x0, ttl 64, id 51276, offset 0, flags [DF], proto TCP (6), length 52)
    127.0.0.1.49236 > 127.0.0.1.11250: Flags [.], cksum 0xfe28 (incorrect -> 0x864e), seq 894, ack 69521, win 512, options [nop,nop,TS val 740140585 ecr 740140585], length 0
2022-04-04 20:01:36.228897 IP (tos 0x0, ttl 64, id 36687, offset 0, flags [DF], proto TCP (6), length 2442)
    127.0.0.1.11250 > 127.0.0.1.49236: Flags [P.], cksum 0x077f (incorrect -> 0x152c), seq 69521:71911, ack 894, win 512, options [nop,nop,TS val 740140600 ecr 740140585], length 2390
2022-04-04 20:01:36.228917 IP (tos 0x0, ttl 64, id 51277, offset 0, flags [DF], proto TCP (6), length 52)
    127.0.0.1.49236 > 127.0.0.1.11250: Flags [.], cksum 0xfe28 (incorrect -> 0x7cda), seq 894, ack 71911, win 512, options [nop,nop,TS val 740140600 ecr 740140600], length 0
2022-04-04 20:01:36.282956 IP (tos 0x0, ttl 64, id 36688, offset 0, flags [DF], proto TCP (6), length 3438)
    127.0.0.1.11250 > 127.0.0.1.49236: Flags [P.], cksum 0x0b63 (incorrect -> 0x6496), seq 71911:75297, ack 894, win 512, options [nop,nop,TS val 740140654 ecr 740140600], length 3386
2022-04-04 20:01:36.283275 IP (tos 0x0, ttl 64, id 51278, offset 0, flags [DF], proto TCP (6), length 52)
    127.0.0.1.49236 > 127.0.0.1.11250: Flags [.], cksum 0xfe28 (incorrect -> 0x6f34), seq 894, ack 75297, win 512, options [nop,nop,TS val 740140654 ecr 740140654], length 0
2022-04-04 20:01:36.286140 IP (tos 0x0, ttl 64, id 36689, offset 0, flags [DF], proto TCP (6), length 3438)
    127.0.0.1.11250 > 127.0.0.1.49236: Flags [P.], cksum 0x0b63 (incorrect -> 0xfc99), seq 75297:78683, ack 894, win 512, options [nop,nop,TS val 740140657 ecr 740140654], length 3386
2022-04-04 20:01:36.333407 IP (tos 0x0, ttl 64, id 51279, offset 0, flags [DF], proto TCP (6), length 52)
    127.0.0.1.49236 > 127.0.0.1.11250: Flags [.], cksum 0xfe28 (incorrect -> 0x61c5), seq 894, ack 78683, win 512, options [nop,nop,TS val 740140704 ecr 740140657], length 0
2022-04-04 20:01:36.333427 IP (tos 0x0, ttl 64, id 36690, offset 0, flags [DF], proto TCP (6), length 21014)
    127.0.0.1.11250 > 127.0.0.1.49236: Flags [P.], cksum 0x500b (incorrect -> 0x7dcd), seq 78683:99645, ack 894, win 512, options [nop,nop,TS val 740140705 ecr 740140704], length 20962
2022-04-04 20:01:36.377391 IP (tos 0x0, ttl 64, id 51280, offset 0, flags [DF], proto TCP (6), length 52)
    127.0.0.1.49236 > 127.0.0.1.11250: Flags [.], cksum 0xfe28 (incorrect -> 0x0f87), seq 894, ack 99645, win 512, options [nop,nop,TS val 740140748 ecr 740140705], length 0
2022-04-04 20:01:36.377399 IP (tos 0x0, ttl 64, id 36691, offset 0, flags [DF], proto TCP (6), length 948)
    127.0.0.1.11250 > 127.0.0.1.49236: Flags [P.], cksum 0x01a9 (incorrect -> 0x140d), seq 99645:100541, ack 894, win 512, options [nop,nop,TS val 740140749 ecr 740140748], length 896
2022-04-04 20:01:36.377627 IP (tos 0x0, ttl 64, id 51281, offset 0, flags [DF], proto TCP (6), length 52)
    127.0.0.1.49236 > 127.0.0.1.11250: Flags [.], cksum 0xfe28 (incorrect -> 0x0bda), seq 894, ack 100541, win 512, options [nop,nop,TS val 740140749 ecr 740140749], length 0
2022-04-04 20:01:36.386734 IP (tos 0x0, ttl 64, id 36692, offset 0, flags [DF], proto TCP (6), length 3438)
    127.0.0.1.11250 > 127.0.0.1.49236: Flags [P.], cksum 0x0b63 (incorrect -> 0x60e8), seq 100541:103927, ack 894, win 512, options [nop,nop,TS val 740140758 ecr 740140749], length 3386
2022-04-04 20:01:36.386752 IP (tos 0x0, ttl 64, id 51282, offset 0, flags [DF], proto TCP (6), length 52)
    127.0.0.1.49236 > 127.0.0.1.11250: Flags [.], cksum 0xfe28 (incorrect -> 0xfe8d), seq 894, ack 103927, win 512, options [nop,nop,TS val 740140758 ecr 740140758], length 0
2022-04-04 20:01:36.389411 IP (tos 0x0, ttl 64, id 36693, offset 0, flags [DF], proto TCP (6), length 1048)
    127.0.0.1.11250 > 127.0.0.1.49236: Flags [P.], cksum 0x020d (incorrect -> 0x5cc4), seq 103927:104923, ack 894, win 512, options [nop,nop,TS val 740140761 ecr 740140758], length 996
2022-04-04 20:01:36.389426 IP (tos 0x0, ttl 64, id 51283, offset 0, flags [DF], proto TCP (6), length 52)
    127.0.0.1.49236 > 127.0.0.1.11250: Flags [.], cksum 0xfe28 (incorrect -> 0xfaa3), seq 894, ack 104923, win 512, options [nop,nop,TS val 740140761 ecr 740140761], length 0
2022-04-04 20:01:36.390735 IP (tos 0x0, ttl 64, id 36694, offset 0, flags [DF], proto TCP (6), length 4100)
    127.0.0.1.11250 > 127.0.0.1.49236: Flags [P.], cksum 0x0df9 (incorrect -> 0x14de), seq 104923:108971, ack 894, win 512, options [nop,nop,TS val 740140762 ecr 740140761], length 4048
2022-04-04 20:01:36.390874 IP (tos 0x0, ttl 64, id 51284, offset 0, flags [DF], proto TCP (6), length 52)
    127.0.0.1.49236 > 127.0.0.1.11250: Flags [.], cksum 0xfe28 (incorrect -> 0xead1), seq 894, ack 108971, win 512, options [nop,nop,TS val 740140762 ecr 740140762], length 0
2022-04-04 20:01:36.390880 IP (tos 0x0, ttl 64, id 36695, offset 0, flags [DF], proto TCP (6), length 2776)
    127.0.0.1.11250 > 127.0.0.1.49236: Flags [P.], cksum 0x08cd (incorrect -> 0xda24), seq 108971:111695, ack 894, win 512, options [nop,nop,TS val 740140762 ecr 740140762], length 2724
2022-04-04 20:01:36.390886 IP (tos 0x0, ttl 64, id 51285, offset 0, flags [DF], proto TCP (6), length 52)
    127.0.0.1.49236 > 127.0.0.1.11250: Flags [.], cksum 0xfe28 (incorrect -> 0xe02d), seq 894, ack 111695, win 512, options [nop,nop,TS val 740140762 ecr 740140762], length 0
2022-04-04 20:01:36.397215 IP (tos 0x0, ttl 64, id 36696, offset 0, flags [DF], proto TCP (6), length 4100)
    127.0.0.1.11250 > 127.0.0.1.49236: Flags [P.], cksum 0x0df9 (incorrect -> 0x6d5e), seq 111695:115743, ack 894, win 512, options [nop,nop,TS val 740140768 ecr 740140762], length 4048
2022-04-04 20:01:36.397406 IP (tos 0x0, ttl 64, id 51286, offset 0, flags [DF], proto TCP (6), length 52)
    127.0.0.1.49236 > 127.0.0.1.11250: Flags [.], cksum 0xfe28 (incorrect -> 0xd050), seq 894, ack 115743, win 512, options [nop,nop,TS val 740140769 ecr 740140768], length 0
2022-04-04 20:01:36.397415 IP (tos 0x0, ttl 64, id 36697, offset 0, flags [DF], proto TCP (6), length 15224)
    127.0.0.1.11250 > 127.0.0.1.49236: Flags [P.], cksum 0x396d (incorrect -> 0xeace), seq 115743:130915, ack 894, win 512, options [nop,nop,TS val 740140769 ecr 740140769], length 15172
2022-04-04 20:01:36.397930 IP (tos 0x0, ttl 64, id 51287, offset 0, flags [DF], proto TCP (6), length 52)
    127.0.0.1.49236 > 127.0.0.1.11250: Flags [.], cksum 0xfe28 (incorrect -> 0x950b), seq 894, ack 130915, win 512, options [nop,nop,TS val 740140769 ecr 740140769], length 0
2022-04-04 20:01:36.397967 IP (tos 0x0, ttl 64, id 36698, offset 0, flags [DF], proto TCP (6), length 550)
    127.0.0.1.11250 > 127.0.0.1.49236: Flags [P.], cksum 0x001b (incorrect -> 0x3bea), seq 130915:131413, ack 894, win 512, options [nop,nop,TS val 740140769 ecr 740140769], length 498
2022-04-04 20:01:36.397982 IP (tos 0x0, ttl 64, id 51288, offset 0, flags [DF], proto TCP (6), length 52)
    127.0.0.1.49236 > 127.0.0.1.11250: Flags [.], cksum 0xfe28 (incorrect -> 0x9319), seq 894, ack 131413, win 512, options [nop,nop,TS val 740140769 ecr 740140769], length 0
2022-04-04 20:01:36.403855 IP (tos 0x0, ttl 64, id 36699, offset 0, flags [DF], proto TCP (6), length 1446)
    127.0.0.1.11250 > 127.0.0.1.49236: Flags [P.], cksum 0x039b (incorrect -> 0xf76c), seq 131413:132807, ack 894, win 512, options [nop,nop,TS val 740140775 ecr 740140769], length 1394
2022-04-04 20:01:36.403875 IP (tos 0x0, ttl 64, id 51289, offset 0, flags [DF], proto TCP (6), length 52)
    127.0.0.1.49236 > 127.0.0.1.11250: Flags [.], cksum 0xfe28 (incorrect -> 0x8d9b), seq 894, ack 132807, win 512, options [nop,nop,TS val 740140775 ecr 740140775], length 0
2022-04-04 20:01:36.429546 IP (tos 0x0, ttl 64, id 36700, offset 0, flags [DF], proto TCP (6), length 1546)
    127.0.0.1.11250 > 127.0.0.1.49236: Flags [P.], cksum 0x03ff (incorrect -> 0x8670), seq 132807:134301, ack 894, win 512, options [nop,nop,TS val 740140801 ecr 740140775], length 1494
2022-04-04 20:01:36.429566 IP (tos 0x0, ttl 64, id 51290, offset 0, flags [DF], proto TCP (6), length 52)
    127.0.0.1.49236 > 127.0.0.1.11250: Flags [.], cksum 0xfe28 (incorrect -> 0x8791), seq 894, ack 134301, win 512, options [nop,nop,TS val 740140801 ecr 740140801], length 0
2022-04-04 20:01:36.441300 IP (tos 0x0, ttl 64, id 36701, offset 0, flags [DF], proto TCP (6), length 3438)
    127.0.0.1.11250 > 127.0.0.1.49236: Flags [P.], cksum 0x0b63 (incorrect -> 0x9a87), seq 134301:137687, ack 894, win 512, options [nop,nop,TS val 740140812 ecr 740140801], length 3386
2022-04-04 20:01:36.441321 IP (tos 0x0, ttl 64, id 51291, offset 0, flags [DF], proto TCP (6), length 52)
    127.0.0.1.49236 > 127.0.0.1.11250: Flags [.], cksum 0xfe28 (incorrect -> 0x7a41), seq 894, ack 137687, win 512, options [nop,nop,TS val 740140812 ecr 740140812], length 0
2022-04-04 20:01:36.494331 IP (tos 0x0, ttl 64, id 36702, offset 0, flags [DF], proto TCP (6), length 3836)
    127.0.0.1.11250 > 127.0.0.1.49236: Flags [P.], cksum 0x0cf1 (incorrect -> 0xbdd4), seq 137687:141471, ack 894, win 512, options [nop,nop,TS val 740140865 ecr 740140812], length 3784
2022-04-04 20:01:36.494797 IP (tos 0x0, ttl 64, id 51292, offset 0, flags [DF], proto TCP (6), length 52)
    127.0.0.1.49236 > 127.0.0.1.11250: Flags [.], cksum 0xfe28 (incorrect -> 0x6b0e), seq 894, ack 141471, win 512, options [nop,nop,TS val 740140866 ecr 740140865], length 0
2022-04-04 20:01:36.494805 IP (tos 0x0, ttl 64, id 36703, offset 0, flags [DF], proto TCP (6), length 7064)
    127.0.0.1.11250 > 127.0.0.1.49236: Flags [P.], cksum 0x198d (incorrect -> 0x5723), seq 141471:148483, ack 894, win 512, options [nop,nop,TS val 740140866 ecr 740140866], length 7012
2022-04-04 20:01:36.494810 IP (tos 0x0, ttl 64, id 51293, offset 0, flags [DF], proto TCP (6), length 52)
    127.0.0.1.49236 > 127.0.0.1.11250: Flags [.], cksum 0xfe28 (incorrect -> 0x4fa9), seq 894, ack 148483, win 512, options [nop,nop,TS val 740140866 ecr 740140866], length 0
2022-04-04 20:01:36.496032 IP (tos 0x0, ttl 64, id 36704, offset 0, flags [DF], proto TCP (6), length 2044)
    127.0.0.1.11250 > 127.0.0.1.49236: Flags [P.], cksum 0x05f1 (incorrect -> 0x3242), seq 148483:150475, ack 894, win 512, options [nop,nop,TS val 740140867 ecr 740140866], length 1992
2022-04-04 20:01:36.496047 IP (tos 0x0, ttl 64, id 51294, offset 0, flags [DF], proto TCP (6), length 52)
    127.0.0.1.49236 > 127.0.0.1.11250: Flags [.], cksum 0xfe28 (incorrect -> 0x47df), seq 894, ack 150475, win 512, options [nop,nop,TS val 740140867 ecr 740140867], length 0
2022-04-04 20:01:36.496132 IP (tos 0x0, ttl 64, id 36705, offset 0, flags [DF], proto TCP (6), length 3438)
    127.0.0.1.11250 > 127.0.0.1.49236: Flags [P.], cksum 0x0b63 (incorrect -> 0xe238), seq 150475:153861, ack 894, win 512, options [nop,nop,TS val 740140867 ecr 740140867], length 3386
2022-04-04 20:01:36.496145 IP (tos 0x0, ttl 64, id 51295, offset 0, flags [DF], proto TCP (6), length 52)
    127.0.0.1.49236 > 127.0.0.1.11250: Flags [.], cksum 0xfe28 (incorrect -> 0x3aa5), seq 894, ack 153861, win 512, options [nop,nop,TS val 740140867 ecr 740140867], length 0
2022-04-04 20:01:36.499907 IP (tos 0x0, ttl 64, id 36706, offset 0, flags [DF], proto TCP (6), length 3836)
    127.0.0.1.11250 > 127.0.0.1.49236: Flags [P.], cksum 0x0cf1 (incorrect -> 0x11ed), seq 153861:157645, ack 894, win 512, options [nop,nop,TS val 740140871 ecr 740140867], length 3784
2022-04-04 20:01:36.500433 IP (tos 0x0, ttl 64, id 51296, offset 0, flags [DF], proto TCP (6), length 52)
    127.0.0.1.49236 > 127.0.0.1.11250: Flags [.], cksum 0xfe28 (incorrect -> 0x2bd5), seq 894, ack 157645, win 512, options [nop,nop,TS val 740140871 ecr 740140871], length 0
200, 3.8868067264556885, 2.3939106464385986