2022-04-04 20:09:37.711585 IP (tos 0x0, ttl 64, id 54284, offset 0, flags [DF], proto TCP (6), length 60)
    127.0.0.1.60168 > 127.0.0.1.10350: Flags [S], cksum 0xfe30 (incorrect -> 0x8ec0), seq 1154235862, win 65495, options [mss 65495,sackOK,TS val 740622083 ecr 0,nop,wscale 7], length 0
2022-04-04 20:09:37.711607 IP (tos 0x0, ttl 64, id 0, offset 0, flags [DF], proto TCP (6), length 60)
    127.0.0.1.10350 > 127.0.0.1.60168: Flags [S.], cksum 0xfe30 (incorrect -> 0xaaf2), seq 1686918164, ack 1154235863, win 65483, options [mss 65495,sackOK,TS val 740622083 ecr 740622083,nop,wscale 7], length 0
2022-04-04 20:09:37.711623 IP (tos 0x0, ttl 64, id 54285, offset 0, flags [DF], proto TCP (6), length 52)
    127.0.0.1.60168 > 127.0.0.1.10350: Flags [.], cksum 0xfe28 (incorrect -> 0xd1ae), seq 1, ack 1, win 512, options [nop,nop,TS val 740622083 ecr 740622083], length 0
2022-04-04 20:09:37.711749 IP (tos 0x0, ttl 64, id 54286, offset 0, flags [DF], proto TCP (6), length 55)
    127.0.0.1.60168 > 127.0.0.1.10350: Flags [P.], cksum 0xfe2b (incorrect -> 0xcca2), seq 1:4, ack 1, win 512, options [nop,nop,TS val 740622083 ecr 740622083], length 3
2022-04-04 20:09:37.711763 IP (tos 0x0, ttl 64, id 4753, offset 0, flags [DF], proto TCP (6), length 52)
    127.0.0.1.10350 > 127.0.0.1.60168: Flags [.], cksum 0xfe28 (incorrect -> 0xd1ab), seq 1, ack 4, win 512, options [nop,nop,TS val 740622083 ecr 740622083], length 0
2022-04-04 20:09:37.711831 IP (tos 0x0, ttl 64, id 4754, offset 0, flags [DF], proto TCP (6), length 54)
    127.0.0.1.10350 > 127.0.0.1.60168: Flags [P.], cksum 0xfe2a (incorrect -> 0xcca1), seq 1:3, ack 4, win 512, options [nop,nop,TS val 740622083 ecr 740622083], length 2
2022-04-04 20:09:37.711845 IP (tos 0x0, ttl 64, id 54287, offset 0, flags [DF], proto TCP (6), length 52)
    127.0.0.1.60168 > 127.0.0.1.10350: Flags [.], cksum 0xfe28 (incorrect -> 0xd1a9), seq 4, ack 3, win 512, options [nop,nop,TS val 740622083 ecr 740622083], length 0
2022-04-04 20:09:37.713476 IP (tos 0x0, ttl 64, id 54288, offset 0, flags [DF], proto TCP (6), length 62)
    127.0.0.1.60168 > 127.0.0.1.10350: Flags [P.], cksum 0xfe32 (incorrect -> 0x7963), seq 4:14, ack 3, win 512, options [nop,nop,TS val 740622085 ecr 740622083], length 10
2022-04-04 20:09:37.713487 IP (tos 0x0, ttl 64, id 4755, offset 0, flags [DF], proto TCP (6), length 52)
    127.0.0.1.10350 > 127.0.0.1.60168: Flags [.], cksum 0xfe28 (incorrect -> 0xd19b), seq 3, ack 14, win 512, options [nop,nop,TS val 740622085 ecr 740622085], length 0
2022-04-04 20:09:37.773824 IP (tos 0x0, ttl 64, id 4756, offset 0, flags [DF], proto TCP (6), length 62)
    127.0.0.1.10350 > 127.0.0.1.60168: Flags [P.], cksum 0xfe32 (incorrect -> 0xcc4c), seq 3:13, ack 14, win 512, options [nop,nop,TS val 740622145 ecr 740622085], length 10
2022-04-04 20:09:37.773832 IP (tos 0x0, ttl 64, id 54289, offset 0, flags [DF], proto TCP (6), length 52)
    127.0.0.1.60168 > 127.0.0.1.10350: Flags [.], cksum 0xfe28 (incorrect -> 0xd119), seq 14, ack 13, win 512, options [nop,nop,TS val 740622145 ecr 740622145], length 0
2022-04-04 20:09:37.779895 IP (tos 0x0, ttl 64, id 54290, offset 0, flags [DF], proto TCP (6), length 569)
    127.0.0.1.60168 > 127.0.0.1.10350: Flags [P.], cksum 0x002e (incorrect -> 0x2fcb), seq 14:531, ack 13, win 512, options [nop,nop,TS val 740622151 ecr 740622145], length 517
2022-04-04 20:09:37.779905 IP (tos 0x0, ttl 64, id 4757, offset 0, flags [DF], proto TCP (6), length 52)
    127.0.0.1.10350 > 127.0.0.1.60168: Flags [.], cksum 0xfe28 (incorrect -> 0xcf0c), seq 13, ack 531, win 508, options [nop,nop,TS val 740622151 ecr 740622151], length 0
2022-04-04 20:09:37.833321 IP (tos 0x0, ttl 64, id 4758, offset 0, flags [DF], proto TCP (6), length 3538)
    127.0.0.1.10350 > 127.0.0.1.60168: Flags [P.], cksum 0x0bc7 (incorrect -> 0x16b3), seq 13:3499, ack 531, win 512, options [nop,nop,TS val 740622204 ecr 740622151], length 3486
2022-04-04 20:09:37.833330 IP (tos 0x0, ttl 64, id 54291, offset 0, flags [DF], proto TCP (6), length 52)
    127.0.0.1.60168 > 127.0.0.1.10350: Flags [.], cksum 0xfe28 (incorrect -> 0xc112), seq 531, ack 3499, win 494, options [nop,nop,TS val 740622204 ecr 740622204], length 0
2022-04-04 20:09:37.847264 IP (tos 0x0, ttl 64, id 4759, offset 0, flags [DF], proto TCP (6), length 272)
    127.0.0.1.10350 > 127.0.0.1.60168: Flags [P.], cksum 0xff04 (incorrect -> 0x3660), seq 3499:3719, ack 531, win 512, options [nop,nop,TS val 740622218 ecr 740622204], length 220
2022-04-04 20:09:37.847273 IP (tos 0x0, ttl 64, id 54292, offset 0, flags [DF], proto TCP (6), length 52)
    127.0.0.1.60168 > 127.0.0.1.10350: Flags [.], cksum 0xfe28 (incorrect -> 0xc00d), seq 531, ack 3719, win 507, options [nop,nop,TS val 740622218 ecr 740622218], length 0
2022-04-04 20:09:37.847342 IP (tos 0x0, ttl 64, id 54293, offset 0, flags [DF], proto TCP (6), length 132)
    127.0.0.1.60168 > 127.0.0.1.10350: Flags [P.], cksum 0xfe78 (incorrect -> 0x182a), seq 531:611, ack 3719, win 507, options [nop,nop,TS val 740622218 ecr 740622218], length 80
2022-04-04 20:09:37.847349 IP (tos 0x0, ttl 64, id 4760, offset 0, flags [DF], proto TCP (6), length 52)
    127.0.0.1.10350 > 127.0.0.1.60168: Flags [.], cksum 0xfe28 (incorrect -> 0xbfb8), seq 3719, ack 611, win 512, options [nop,nop,TS val 740622218 ecr 740622218], length 0
2022-04-04 20:09:37.847765 IP (tos 0x0, ttl 64, id 54294, offset 0, flags [DF], proto TCP (6), length 304)
    127.0.0.1.60168 > 127.0.0.1.10350: Flags [P.], cksum 0xff24 (incorrect -> 0xf083), seq 611:863, ack 3719, win 507, options [nop,nop,TS val 740622219 ecr 740622218], length 252
2022-04-04 20:09:37.847774 IP (tos 0x0, ttl 64, id 4761, offset 0, flags [DF], proto TCP (6), length 52)
    127.0.0.1.10350 > 127.0.0.1.60168: Flags [.], cksum 0xfe28 (incorrect -> 0xbebb), seq 3719, ack 863, win 511, options [nop,nop,TS val 740622219 ecr 740622219], length 0
2022-04-04 20:09:38.230449 IP (tos 0x0, ttl 64, id 4762, offset 0, flags [DF], proto TCP (6), length 3230)
    127.0.0.1.10350 > 127.0.0.1.60168: Flags [P.], cksum 0x0a93 (incorrect -> 0x4b53), seq 3719:6897, ack 863, win 512, options [nop,nop,TS val 740622602 ecr 740622219], length 3178
2022-04-04 20:09:38.230459 IP (tos 0x0, ttl 64, id 54295, offset 0, flags [DF], proto TCP (6), length 52)
    127.0.0.1.60168 > 127.0.0.1.10350: Flags [.], cksum 0xfe28 (incorrect -> 0xaf63), seq 863, ack 6897, win 495, options [nop,nop,TS val 740622602 ecr 740622602], length 0
2022-04-04 20:09:38.240715 IP (tos 0x0, ttl 64, id 4763, offset 0, flags [DF], proto TCP (6), length 4100)
    127.0.0.1.10350 > 127.0.0.1.60168: Flags [P.], cksum 0x0df9 (incorrect -> 0x05e8), seq 6897:10945, ack 863, win 512, options [nop,nop,TS val 740622612 ecr 740622602], length 4048
2022-04-04 20:09:38.240725 IP (tos 0x0, ttl 64, id 54296, offset 0, flags [DF], proto TCP (6), length 52)
    127.0.0.1.60168 > 127.0.0.1.10350: Flags [.], cksum 0xfe28 (incorrect -> 0x9f82), seq 863, ack 10945, win 492, options [nop,nop,TS val 740622612 ecr 740622612], length 0
2022-04-04 20:09:38.240734 IP (tos 0x0, ttl 64, id 4764, offset 0, flags [DF], proto TCP (6), length 486)
    127.0.0.1.10350 > 127.0.0.1.60168: Flags [P.], cksum 0xffda (incorrect -> 0x1e3f), seq 10945:11379, ack 863, win 512, options [nop,nop,TS val 740622612 ecr 740622612], length 434
2022-04-04 20:09:38.240739 IP (tos 0x0, ttl 64, id 54297, offset 0, flags [DF], proto TCP (6), length 52)
    127.0.0.1.60168 > 127.0.0.1.10350: Flags [.], cksum 0xfe28 (incorrect -> 0x9dd2), seq 863, ack 11379, win 490, options [nop,nop,TS val 740622612 ecr 740622612], length 0
2022-04-04 20:09:38.240773 IP (tos 0x0, ttl 64, id 4765, offset 0, flags [DF], proto TCP (6), length 3538)
    127.0.0.1.10350 > 127.0.0.1.60168: Flags [P.], cksum 0x0bc7 (incorrect -> 0x7c0c), seq 11379:14865, ack 863, win 512, options [nop,nop,TS val 740622612 ecr 740622612], length 3486
2022-04-04 20:09:38.240777 IP (tos 0x0, ttl 64, id 54298, offset 0, flags [DF], proto TCP (6), length 52)
    127.0.0.1.60168 > 127.0.0.1.10350: Flags [.], cksum 0xfe28 (incorrect -> 0x9042), seq 863, ack 14865, win 476, options [nop,nop,TS val 740622612 ecr 740622612], length 0
2022-04-04 20:09:38.251322 IP (tos 0x0, ttl 64, id 4766, offset 0, flags [DF], proto TCP (6), length 4100)
    127.0.0.1.10350 > 127.0.0.1.60168: Flags [P.], cksum 0x0df9 (incorrect -> 0x4608), seq 14865:18913, ack 863, win 512, options [nop,nop,TS val 740622622 ecr 740622612], length 4048
2022-04-04 20:09:38.251330 IP (tos 0x0, ttl 64, id 54299, offset 0, flags [DF], proto TCP (6), length 52)
    127.0.0.1.60168 > 127.0.0.1.10350: Flags [.], cksum 0xfe28 (incorrect -> 0x804e), seq 863, ack 18913, win 492, options [nop,nop,TS val 740622622 ecr 740622622], length 0
2022-04-04 20:09:38.251336 IP (tos 0x0, ttl 64, id 4767, offset 0, flags [DF], proto TCP (6), length 634)
    127.0.0.1.10350 > 127.0.0.1.60168: Flags [P.], cksum 0x006f (incorrect -> 0xd717), seq 18913:19495, ack 863, win 512, options [nop,nop,TS val 740622622 ecr 740622622], length 582
2022-04-04 20:09:38.251340 IP (tos 0x0, ttl 64, id 54300, offset 0, flags [DF], proto TCP (6), length 52)
    127.0.0.1.60168 > 127.0.0.1.10350: Flags [.], cksum 0xfe28 (incorrect -> 0x7e0b), seq 863, ack 19495, win 489, options [nop,nop,TS val 740622622 ecr 740622622], length 0
2022-04-04 20:09:38.251356 IP (tos 0x0, ttl 64, id 4768, offset 0, flags [DF], proto TCP (6), length 550)
    127.0.0.1.10350 > 127.0.0.1.60168: Flags [P.], cksum 0x001b (incorrect -> 0xaa9a), seq 19495:19993, ack 863, win 512, options [nop,nop,TS val 740622622 ecr 740622622], length 498
2022-04-04 20:09:38.251360 IP (tos 0x0, ttl 64, id 54301, offset 0, flags [DF], proto TCP (6), length 52)
    127.0.0.1.60168 > 127.0.0.1.10350: Flags [.], cksum 0xfe28 (incorrect -> 0x7c1b), seq 863, ack 19993, win 487, options [nop,nop,TS val 740622622 ecr 740622622], length 0
2022-04-04 20:09:38.262160 IP (tos 0x0, ttl 64, id 4769, offset 0, flags [DF], proto TCP (6), length 2214)
    127.0.0.1.10350 > 127.0.0.1.60168: Flags [P.], cksum 0x069b (incorrect -> 0x1836), seq 19993:22155, ack 863, win 512, options [nop,nop,TS val 740622633 ecr 740622622], length 2162
2022-04-04 20:09:38.262169 IP (tos 0x0, ttl 64, id 54302, offset 0, flags [DF], proto TCP (6), length 52)
    127.0.0.1.60168 > 127.0.0.1.10350: Flags [.], cksum 0xfe28 (incorrect -> 0x7387), seq 863, ack 22155, win 499, options [nop,nop,TS val 740622633 ecr 740622633], length 0
2022-04-04 20:09:38.304881 IP (tos 0x0, ttl 64, id 4770, offset 0, flags [DF], proto TCP (6), length 3538)
    127.0.0.1.10350 > 127.0.0.1.60168: Flags [P.], cksum 0x0bc7 (incorrect -> 0x8a1a), seq 22155:25641, ack 863, win 512, options [nop,nop,TS val 740622676 ecr 740622633], length 3486
2022-04-04 20:09:38.304889 IP (tos 0x0, ttl 64, id 54303, offset 0, flags [DF], proto TCP (6), length 52)
    127.0.0.1.60168 > 127.0.0.1.10350: Flags [.], cksum 0xfe28 (incorrect -> 0x6598), seq 863, ack 25641, win 494, options [nop,nop,TS val 740622676 ecr 740622676], length 0
2022-04-04 20:09:38.316172 IP (tos 0x0, ttl 64, id 4771, offset 0, flags [DF], proto TCP (6), length 3538)
    127.0.0.1.10350 > 127.0.0.1.60168: Flags [P.], cksum 0x0bc7 (incorrect -> 0xdcc0), seq 25641:29127, ack 863, win 512, options [nop,nop,TS val 740622687 ecr 740622676], length 3486
2022-04-04 20:09:38.357402 IP (tos 0x0, ttl 64, id 54304, offset 0, flags [DF], proto TCP (6), length 52)
    127.0.0.1.60168 > 127.0.0.1.10350: Flags [.], cksum 0xfe28 (incorrect -> 0x57a9), seq 863, ack 29127, win 512, options [nop,nop,TS val 740622728 ecr 740622687], length 0
2022-04-04 20:09:38.357414 IP (tos 0x0, ttl 64, id 4772, offset 0, flags [DF], proto TCP (6), length 21974)
    127.0.0.1.10350 > 127.0.0.1.60168: Flags [P.], cksum 0x53cb (incorrect -> 0x2987), seq 29127:51049, ack 863, win 512, options [nop,nop,TS val 740622729 ecr 740622728], length 21922
2022-04-04 20:09:38.401410 IP (tos 0x0, ttl 64, id 54305, offset 0, flags [DF], proto TCP (6), length 52)
    127.0.0.1.60168 > 127.0.0.1.10350: Flags [.], cksum 0xfe28 (incorrect -> 0x01b1), seq 863, ack 51049, win 512, options [nop,nop,TS val 740622772 ecr 740622729], length 0
2022-04-04 20:09:38.401420 IP (tos 0x0, ttl 64, id 4773, offset 0, flags [DF], proto TCP (6), length 7268)
    127.0.0.1.10350 > 127.0.0.1.60168: Flags [P.], cksum 0x1a59 (incorrect -> 0xda0f), seq 51049:58265, ack 863, win 512, options [nop,nop,TS val 740622773 ecr 740622772], length 7216
2022-04-04 20:09:38.401671 IP (tos 0x0, ttl 64, id 54306, offset 0, flags [DF], proto TCP (6), length 52)
    127.0.0.1.60168 > 127.0.0.1.10350: Flags [.], cksum 0xfe28 (incorrect -> 0xe553), seq 863, ack 58265, win 512, options [nop,nop,TS val 740622773 ecr 740622773], length 0
2022-04-04 20:09:38.984138 IP (tos 0x0, ttl 64, id 4774, offset 0, flags [DF], proto TCP (6), length 3538)
    127.0.0.1.10350 > 127.0.0.1.60168: Flags [P.], cksum 0x0bc7 (incorrect -> 0x580b), seq 58265:61751, ack 863, win 512, options [nop,nop,TS val 740623355 ecr 740622773], length 3486
2022-04-04 20:09:38.984146 IP (tos 0x0, ttl 64, id 54307, offset 0, flags [DF], proto TCP (6), length 52)
    127.0.0.1.60168 > 127.0.0.1.10350: Flags [.], cksum 0xfe28 (incorrect -> 0xd33b), seq 863, ack 61751, win 494, options [nop,nop,TS val 740623355 ecr 740623355], length 0
2022-04-04 20:09:39.002043 IP (tos 0x0, ttl 64, id 4775, offset 0, flags [DF], proto TCP (6), length 3538)
    127.0.0.1.10350 > 127.0.0.1.60168: Flags [P.], cksum 0x0bc7 (incorrect -> 0xdd7b), seq 61751:65237, ack 863, win 512, options [nop,nop,TS val 740623373 ecr 740623355], length 3486
2022-04-04 20:09:39.045386 IP (tos 0x0, ttl 64, id 54308, offset 0, flags [DF], proto TCP (6), length 52)
    127.0.0.1.60168 > 127.0.0.1.10350: Flags [.], cksum 0xfe28 (incorrect -> 0xc53c), seq 863, ack 65237, win 512, options [nop,nop,TS val 740623416 ecr 740623373], length 0
2022-04-04 20:09:39.045394 IP (tos 0x0, ttl 64, id 4776, offset 0, flags [DF], proto TCP (6), length 6923)
    127.0.0.1.10350 > 127.0.0.1.60168: Flags [P.], cksum 0x1900 (incorrect -> 0x7093), seq 65237:72108, ack 863, win 512, options [nop,nop,TS val 740623416 ecr 740623416], length 6871
2022-04-04 20:09:39.082252 IP (tos 0x0, ttl 64, id 4777, offset 0, flags [DF], proto TCP (6), length 32820)
    127.0.0.1.10350 > 127.0.0.1.60168: Flags [.], cksum 0x7e29 (incorrect -> 0xc284), seq 72108:104876, ack 863, win 512, options [nop,nop,TS val 740623453 ecr 740623416], length 32768
2022-04-04 20:09:39.082260 IP (tos 0x0, ttl 64, id 54309, offset 0, flags [DF], proto TCP (6), length 52)
    127.0.0.1.60168 > 127.0.0.1.10350: Flags [.], cksum 0xfe28 (incorrect -> 0x2a9a), seq 863, ack 104876, win 379, options [nop,nop,TS val 740623453 ecr 740623416], length 0
2022-04-04 20:09:39.082269 IP (tos 0x0, ttl 64, id 4778, offset 0, flags [DF], proto TCP (6), length 2165)
    127.0.0.1.10350 > 127.0.0.1.60168: Flags [P.], cksum 0x066a (incorrect -> 0x5fa1), seq 104876:106989, ack 863, win 512, options [nop,nop,TS val 740623453 ecr 740623453], length 2113
2022-04-04 20:09:39.082847 IP (tos 0x0, ttl 64, id 54310, offset 0, flags [DF], proto TCP (6), length 52)
    127.0.0.1.60168 > 127.0.0.1.10350: Flags [.], cksum 0xfe28 (incorrect -> 0x21ae), seq 863, ack 106989, win 512, options [nop,nop,TS val 740623454 ecr 740623453], length 0
2022-04-04 20:09:39.082907 IP (tos 0x0, ttl 64, id 4779, offset 0, flags [DF], proto TCP (6), length 2044)
    127.0.0.1.10350 > 127.0.0.1.60168: Flags [P.], cksum 0x05f1 (incorrect -> 0x255b), seq 106989:108981, ack 863, win 512, options [nop,nop,TS val 740623454 ecr 740623454], length 1992
2022-04-04 20:09:39.082921 IP (tos 0x0, ttl 64, id 54311, offset 0, flags [DF], proto TCP (6), length 52)
    127.0.0.1.60168 > 127.0.0.1.10350: Flags [.], cksum 0xfe28 (incorrect -> 0x19e5), seq 863, ack 108981, win 512, options [nop,nop,TS val 740623454 ecr 740623454], length 0
2022-04-04 20:09:39.097665 IP (tos 0x0, ttl 64, id 4780, offset 0, flags [DF], proto TCP (6), length 4100)
    127.0.0.1.10350 > 127.0.0.1.60168: Flags [P.], cksum 0x0df9 (incorrect -> 0xdf6f), seq 108981:113029, ack 863, win 512, options [nop,nop,TS val 740623469 ecr 740623454], length 4048
2022-04-04 20:09:39.097744 IP (tos 0x0, ttl 64, id 54312, offset 0, flags [DF], proto TCP (6), length 52)
    127.0.0.1.60168 > 127.0.0.1.10350: Flags [.], cksum 0xfe28 (incorrect -> 0x09f7), seq 863, ack 113029, win 512, options [nop,nop,TS val 740623469 ecr 740623469], length 0
2022-04-04 20:09:39.097751 IP (tos 0x0, ttl 64, id 4781, offset 0, flags [DF], proto TCP (6), length 8104)
    127.0.0.1.10350 > 127.0.0.1.60168: Flags [P.], cksum 0x1d9d (incorrect -> 0x0ce6), seq 113029:121081, ack 863, win 512, options [nop,nop,TS val 740623469 ecr 740623469], length 8052
2022-04-04 20:09:39.097756 IP (tos 0x0, ttl 64, id 54313, offset 0, flags [DF], proto TCP (6), length 52)
    127.0.0.1.60168 > 127.0.0.1.10350: Flags [.], cksum 0xfe28 (incorrect -> 0xea82), seq 863, ack 121081, win 512, options [nop,nop,TS val 740623469 ecr 740623469], length 0
2022-04-04 20:09:39.113556 IP (tos 0x0, ttl 64, id 4782, offset 0, flags [DF], proto TCP (6), length 4100)
    127.0.0.1.10350 > 127.0.0.1.60168: Flags [P.], cksum 0x0df9 (incorrect -> 0x6384), seq 121081:125129, ack 863, win 512, options [nop,nop,TS val 740623485 ecr 740623469], length 4048
2022-04-04 20:09:39.114061 IP (tos 0x0, ttl 64, id 54314, offset 0, flags [DF], proto TCP (6), length 52)
    127.0.0.1.60168 > 127.0.0.1.10350: Flags [.], cksum 0xfe28 (incorrect -> 0xda92), seq 863, ack 125129, win 512, options [nop,nop,TS val 740623485 ecr 740623485], length 0
2022-04-04 20:09:39.114067 IP (tos 0x0, ttl 64, id 4783, offset 0, flags [DF], proto TCP (6), length 1980)
    127.0.0.1.10350 > 127.0.0.1.60168: Flags [P.], cksum 0x05b1 (incorrect -> 0xfc31), seq 125129:127057, ack 863, win 512, options [nop,nop,TS val 740623485 ecr 740623485], length 1928
2022-04-04 20:09:39.114072 IP (tos 0x0, ttl 64, id 54315, offset 0, flags [DF], proto TCP (6), length 52)
    127.0.0.1.60168 > 127.0.0.1.10350: Flags [.], cksum 0xfe28 (incorrect -> 0xd30a), seq 863, ack 127057, win 512, options [nop,nop,TS val 740623485 ecr 740623485], length 0
2022-04-04 20:09:39.124240 IP (tos 0x0, ttl 64, id 4784, offset 0, flags [DF], proto TCP (6), length 550)
    127.0.0.1.10350 > 127.0.0.1.60168: Flags [P.], cksum 0x001b (incorrect -> 0x305e), seq 127057:127555, ack 863, win 512, options [nop,nop,TS val 740623495 ecr 740623485], length 498
2022-04-04 20:09:39.124257 IP (tos 0x0, ttl 64, id 54316, offset 0, flags [DF], proto TCP (6), length 52)
    127.0.0.1.60168 > 127.0.0.1.10350: Flags [.], cksum 0xfe28 (incorrect -> 0xd104), seq 863, ack 127555, win 512, options [nop,nop,TS val 740623495 ecr 740623495], length 0
2022-04-04 20:09:39.130634 IP (tos 0x0, ttl 64, id 4785, offset 0, flags [DF], proto TCP (6), length 4100)
    127.0.0.1.10350 > 127.0.0.1.60168: Flags [P.], cksum 0x0df9 (incorrect -> 0x5f40), seq 127555:131603, ack 863, win 512, options [nop,nop,TS val 740623502 ecr 740623495], length 4048
2022-04-04 20:09:39.130685 IP (tos 0x0, ttl 64, id 54317, offset 0, flags [DF], proto TCP (6), length 52)
    127.0.0.1.60168 > 127.0.0.1.10350: Flags [.], cksum 0xfe28 (incorrect -> 0xc126), seq 863, ack 131603, win 512, options [nop,nop,TS val 740623502 ecr 740623502], length 0
2022-04-04 20:09:39.130690 IP (tos 0x0, ttl 64, id 4786, offset 0, flags [DF], proto TCP (6), length 7023)
    127.0.0.1.10350 > 127.0.0.1.60168: Flags [P.], cksum 0x1964 (incorrect -> 0xed2e), seq 131603:138574, ack 863, win 512, options [nop,nop,TS val 740623502 ecr 740623502], length 6971
2022-04-04 20:09:39.131036 IP (tos 0x0, ttl 64, id 54318, offset 0, flags [DF], proto TCP (6), length 52)
    127.0.0.1.60168 > 127.0.0.1.10350: Flags [.], cksum 0xfe28 (incorrect -> 0xa5eb), seq 863, ack 138574, win 512, options [nop,nop,TS val 740623502 ecr 740623502], length 0
2022-04-04 20:09:39.144891 IP (tos 0x0, ttl 64, id 4787, offset 0, flags [DF], proto TCP (6), length 4100)
    127.0.0.1.10350 > 127.0.0.1.60168: Flags [P.], cksum 0x0df9 (incorrect -> 0x494a), seq 138574:142622, ack 863, win 512, options [nop,nop,TS val 740623516 ecr 740623502], length 4048
2022-04-04 20:09:39.144956 IP (tos 0x0, ttl 64, id 54319, offset 0, flags [DF], proto TCP (6), length 52)
    127.0.0.1.60168 > 127.0.0.1.10350: Flags [.], cksum 0xfe28 (incorrect -> 0x95ff), seq 863, ack 142622, win 512, options [nop,nop,TS val 740623516 ecr 740623516], length 0
2022-04-04 20:09:39.144963 IP (tos 0x0, ttl 64, id 4788, offset 0, flags [DF], proto TCP (6), length 7458)
    127.0.0.1.10350 > 127.0.0.1.60168: Flags [P.], cksum 0x1b17 (incorrect -> 0x32b3), seq 142622:150028, ack 863, win 512, options [nop,nop,TS val 740623516 ecr 740623516], length 7406
2022-04-04 20:09:39.144968 IP (tos 0x0, ttl 64, id 54320, offset 0, flags [DF], proto TCP (6), length 52)
    127.0.0.1.60168 > 127.0.0.1.10350: Flags [.], cksum 0xfe28 (incorrect -> 0x7911), seq 863, ack 150028, win 512, options [nop,nop,TS val 740623516 ecr 740623516], length 0
2022-04-04 20:09:39.174880 IP (tos 0x0, ttl 64, id 4789, offset 0, flags [DF], proto TCP (6), length 4100)
    127.0.0.1.10350 > 127.0.0.1.60168: Flags [P.], cksum 0x0df9 (incorrect -> 0xe2ba), seq 150028:154076, ack 863, win 512, options [nop,nop,TS val 740623546 ecr 740623516], length 4048
2022-04-04 20:09:39.174901 IP (tos 0x0, ttl 64, id 54321, offset 0, flags [DF], proto TCP (6), length 52)
    127.0.0.1.60168 > 127.0.0.1.10350: Flags [.], cksum 0xfe28 (incorrect -> 0x6905), seq 863, ack 154076, win 512, options [nop,nop,TS val 740623546 ecr 740623546], length 0
2022-04-04 20:09:39.174906 IP (tos 0x0, ttl 64, id 4790, offset 0, flags [DF], proto TCP (6), length 3304)
    127.0.0.1.10350 > 127.0.0.1.60168: Flags [P.], cksum 0x0add (incorrect -> 0x4b88), seq 154076:157328, ack 863, win 512, options [nop,nop,TS val 740623546 ecr 740623546], length 3252
2022-04-04 20:09:39.175138 IP (tos 0x0, ttl 64, id 54322, offset 0, flags [DF], proto TCP (6), length 52)
    127.0.0.1.60168 > 127.0.0.1.10350: Flags [.], cksum 0xfe28 (incorrect -> 0x5c51), seq 863, ack 157328, win 512, options [nop,nop,TS val 740623546 ecr 740623546], length 0
2022-04-04 20:09:39.176166 IP (tos 0x0, ttl 64, id 4791, offset 0, flags [DF], proto TCP (6), length 550)
    127.0.0.1.10350 > 127.0.0.1.60168: Flags [P.], cksum 0x001b (incorrect -> 0x438d), seq 157328:157826, ack 863, win 512, options [nop,nop,TS val 740623547 ecr 740623546], length 498
2022-04-04 20:09:39.176180 IP (tos 0x0, ttl 64, id 54323, offset 0, flags [DF], proto TCP (6), length 52)
    127.0.0.1.60168 > 127.0.0.1.10350: Flags [.], cksum 0xfe28 (incorrect -> 0x5a5d), seq 863, ack 157826, win 512, options [nop,nop,TS val 740623547 ecr 740623547], length 0
2022-04-04 20:09:39.176247 IP (tos 0x0, ttl 64, id 4792, offset 0, flags [DF], proto TCP (6), length 3538)
    127.0.0.1.10350 > 127.0.0.1.60168: Flags [P.], cksum 0x0bc7 (incorrect -> 0xfacd), seq 157826:161312, ack 863, win 512, options [nop,nop,TS val 740623547 ecr 740623547], length 3486
2022-04-04 20:09:39.176260 IP (tos 0x0, ttl 64, id 54324, offset 0, flags [DF], proto TCP (6), length 52)
    127.0.0.1.60168 > 127.0.0.1.10350: Flags [.], cksum 0xfe28 (incorrect -> 0x4cbf), seq 863, ack 161312, win 512, options [nop,nop,TS val 740623547 ecr 740623547], length 0
2022-04-04 20:09:39.184811 IP (tos 0x0, ttl 64, id 4793, offset 0, flags [DF], proto TCP (6), length 4100)
    127.0.0.1.10350 > 127.0.0.1.60168: Flags [P.], cksum 0x0df9 (incorrect -> 0x32fa), seq 161312:165360, ack 863, win 512, options [nop,nop,TS val 740623556 ecr 740623547], length 4048
2022-04-04 20:09:39.184897 IP (tos 0x0, ttl 64, id 54325, offset 0, flags [DF], proto TCP (6), length 52)
    127.0.0.1.60168 > 127.0.0.1.10350: Flags [.], cksum 0xfe28 (incorrect -> 0x3cdd), seq 863, ack 165360, win 512, options [nop,nop,TS val 740623556 ecr 740623556], length 0
2022-04-04 20:09:39.184905 IP (tos 0x0, ttl 64, id 4794, offset 0, flags [DF], proto TCP (6), length 10102)
    127.0.0.1.10350 > 127.0.0.1.60168: Flags [P.], cksum 0x256b (incorrect -> 0xa3a0), seq 165360:175410, ack 863, win 512, options [nop,nop,TS val 740623556 ecr 740623556], length 10050
2022-04-04 20:09:39.185073 IP (tos 0x0, ttl 64, id 54326, offset 0, flags [DF], proto TCP (6), length 52)
    127.0.0.1.60168 > 127.0.0.1.10350: Flags [.], cksum 0xfe28 (incorrect -> 0x159b), seq 863, ack 175410, win 512, options [nop,nop,TS val 740623556 ecr 740623556], length 0
2022-04-04 20:09:39.187062 IP (tos 0x0, ttl 64, id 4795, offset 0, flags [DF], proto TCP (6), length 2044)
    127.0.0.1.10350 > 127.0.0.1.60168: Flags [P.], cksum 0x05f1 (incorrect -> 0x937b), seq 175410:177402, ack 863, win 512, options [nop,nop,TS val 740623558 ecr 740623556], length 1992
2022-04-04 20:09:39.187077 IP (tos 0x0, ttl 64, id 54327, offset 0, flags [DF], proto TCP (6), length 52)
    127.0.0.1.60168 > 127.0.0.1.10350: Flags [.], cksum 0xfe28 (incorrect -> 0x0dcf), seq 863, ack 177402, win 512, options [nop,nop,TS val 740623558 ecr 740623558], length 0
2022-04-04 20:09:39.191294 IP (tos 0x0, ttl 64, id 4796, offset 0, flags [DF], proto TCP (6), length 4100)
    127.0.0.1.10350 > 127.0.0.1.60168: Flags [P.], cksum 0x0df9 (incorrect -> 0x4023), seq 177402:181450, ack 863, win 512, options [nop,nop,TS val 740623562 ecr 740623558], length 4048
2022-04-04 20:09:39.191334 IP (tos 0x0, ttl 64, id 54328, offset 0, flags [DF], proto TCP (6), length 52)
    127.0.0.1.60168 > 127.0.0.1.10350: Flags [.], cksum 0xfe28 (incorrect -> 0xfdf6), seq 863, ack 181450, win 512, options [nop,nop,TS val 740623562 ecr 740623562], length 0
2022-04-04 20:09:39.191345 IP (tos 0x0, ttl 64, id 4797, offset 0, flags [DF], proto TCP (6), length 3972)
    127.0.0.1.10350 > 127.0.0.1.60168: Flags [P.], cksum 0x0d79 (incorrect -> 0x4045), seq 181450:185370, ack 863, win 512, options [nop,nop,TS val 740623562 ecr 740623562], length 3920
2022-04-04 20:09:39.191738 IP (tos 0x0, ttl 64, id 54329, offset 0, flags [DF], proto TCP (6), length 52)
    127.0.0.1.60168 > 127.0.0.1.10350: Flags [.], cksum 0xfe28 (incorrect -> 0xeea5), seq 863, ack 185370, win 512, options [nop,nop,TS val 740623563 ecr 740623562], length 0
2022-04-04 20:09:39.201422 IP (tos 0x0, ttl 64, id 4798, offset 0, flags [DF], proto TCP (6), length 1048)
    127.0.0.1.10350 > 127.0.0.1.60168: Flags [P.], cksum 0x020d (incorrect -> 0x7798), seq 185370:186366, ack 863, win 512, options [nop,nop,TS val 740623573 ecr 740623563], length 996
2022-04-04 20:09:39.201436 IP (tos 0x0, ttl 64, id 54330, offset 0, flags [DF], proto TCP (6), length 52)
    127.0.0.1.60168 > 127.0.0.1.10350: Flags [.], cksum 0xfe28 (incorrect -> 0xeaac), seq 863, ack 186366, win 512, options [nop,nop,TS val 740623573 ecr 740623573], length 0
2022-04-04 20:09:39.201609 IP (tos 0x0, ttl 64, id 4799, offset 0, flags [DF], proto TCP (6), length 4100)
    127.0.0.1.10350 > 127.0.0.1.60168: Flags [P.], cksum 0x0df9 (incorrect -> 0xa31b), seq 186366:190414, ack 863, win 512, options [nop,nop,TS val 740623573 ecr 740623573], length 4048
2022-04-04 20:09:39.201824 IP (tos 0x0, ttl 64, id 54331, offset 0, flags [DF], proto TCP (6), length 52)
    127.0.0.1.60168 > 127.0.0.1.10350: Flags [.], cksum 0xfe28 (incorrect -> 0xdadc), seq 863, ack 190414, win 512, options [nop,nop,TS val 740623573 ecr 740623573], length 0
2022-04-04 20:09:39.201830 IP (tos 0x0, ttl 64, id 4800, offset 0, flags [DF], proto TCP (6), length 5982)
    127.0.0.1.10350 > 127.0.0.1.60168: Flags [P.], cksum 0x1553 (incorrect -> 0x96e7), seq 190414:196344, ack 863, win 512, options [nop,nop,TS val 740623573 ecr 740623573], length 5930
2022-04-04 20:09:39.201836 IP (tos 0x0, ttl 64, id 54332, offset 0, flags [DF], proto TCP (6), length 52)
    127.0.0.1.60168 > 127.0.0.1.10350: Flags [.], cksum 0xfe28 (incorrect -> 0xc3b2), seq 863, ack 196344, win 512, options [nop,nop,TS val 740623573 ecr 740623573], length 0
2022-04-04 20:09:39.213557 IP (tos 0x0, ttl 64, id 4801, offset 0, flags [DF], proto TCP (6), length 3538)
    127.0.0.1.10350 > 127.0.0.1.60168: Flags [P.], cksum 0x0bc7 (incorrect -> 0xd008), seq 196344:199830, ack 863, win 512, options [nop,nop,TS val 740623585 ecr 740623573], length 3486
2022-04-04 20:09:39.213598 IP (tos 0x0, ttl 64, id 54333, offset 0, flags [DF], proto TCP (6), length 52)
    127.0.0.1.60168 > 127.0.0.1.10350: Flags [.], cksum 0xfe28 (incorrect -> 0xb5fc), seq 863, ack 199830, win 512, options [nop,nop,TS val 740623585 ecr 740623585], length 0
2022-04-04 20:09:39.216289 IP (tos 0x0, ttl 64, id 4802, offset 0, flags [DF], proto TCP (6), length 550)
    127.0.0.1.10350 > 127.0.0.1.60168: Flags [P.], cksum 0x001b (incorrect -> 0xf1e2), seq 199830:200328, ack 863, win 512, options [nop,nop,TS val 740623587 ecr 740623585], length 498
2022-04-04 20:09:39.216401 IP (tos 0x0, ttl 64, id 54334, offset 0, flags [DF], proto TCP (6), length 52)
    127.0.0.1.60168 > 127.0.0.1.10350: Flags [.], cksum 0xfe28 (incorrect -> 0xb405), seq 863, ack 200328, win 512, options [nop,nop,TS val 740623588 ecr 740623587], length 0
2022-04-04 20:09:39.216408 IP (tos 0x0, ttl 64, id 4803, offset 0, flags [DF], proto TCP (6), length 11088)
    127.0.0.1.10350 > 127.0.0.1.60168: Flags [P.], cksum 0x2945 (incorrect -> 0x3670), seq 200328:211364, ack 863, win 512, options [nop,nop,TS val 740623588 ecr 740623588], length 11036
2022-04-04 20:09:39.216722 IP (tos 0x0, ttl 64, id 54335, offset 0, flags [DF], proto TCP (6), length 52)
    127.0.0.1.60168 > 127.0.0.1.10350: Flags [.], cksum 0xfe28 (incorrect -> 0x88e8), seq 863, ack 211364, win 512, options [nop,nop,TS val 740623588 ecr 740623588], length 0
2022-04-04 20:09:39.227608 IP (tos 0x0, ttl 64, id 4804, offset 0, flags [DF], proto TCP (6), length 3538)
    127.0.0.1.10350 > 127.0.0.1.60168: Flags [P.], cksum 0x0bc7 (incorrect -> 0x1544), seq 211364:214850, ack 863, win 512, options [nop,nop,TS val 740623599 ecr 740623588], length 3486
2022-04-04 20:09:39.227630 IP (tos 0x0, ttl 64, id 54336, offset 0, flags [DF], proto TCP (6), length 52)
    127.0.0.1.60168 > 127.0.0.1.10350: Flags [.], cksum 0xfe28 (incorrect -> 0x7b34), seq 863, ack 214850, win 512, options [nop,nop,TS val 740623599 ecr 740623599], length 0
2022-04-04 20:09:39.237857 IP (tos 0x0, ttl 64, id 4805, offset 0, flags [DF], proto TCP (6), length 1546)
    127.0.0.1.10350 > 127.0.0.1.60168: Flags [P.], cksum 0x03ff (incorrect -> 0xd7b3), seq 214850:216344, ack 863, win 512, options [nop,nop,TS val 740623609 ecr 740623599], length 1494
2022-04-04 20:09:39.237871 IP (tos 0x0, ttl 64, id 54337, offset 0, flags [DF], proto TCP (6), length 52)
    127.0.0.1.60168 > 127.0.0.1.10350: Flags [.], cksum 0xfe28 (incorrect -> 0x754a), seq 863, ack 216344, win 512, options [nop,nop,TS val 740623609 ecr 740623609], length 0
2022-04-04 20:09:39.238369 IP (tos 0x0, ttl 64, id 4806, offset 0, flags [DF], proto TCP (6), length 4100)
    127.0.0.1.10350 > 127.0.0.1.60168: Flags [P.], cksum 0x0df9 (incorrect -> 0x3a6c), seq 216344:220392, ack 863, win 512, options [nop,nop,TS val 740623609 ecr 740623609], length 4048
2022-04-04 20:09:39.238603 IP (tos 0x0, ttl 64, id 54338, offset 0, flags [DF], proto TCP (6), length 52)
    127.0.0.1.60168 > 127.0.0.1.10350: Flags [.], cksum 0xfe28 (incorrect -> 0x6579), seq 863, ack 220392, win 512, options [nop,nop,TS val 740623610 ecr 740623609], length 0
2022-04-04 20:09:39.238608 IP (tos 0x0, ttl 64, id 4807, offset 0, flags [DF], proto TCP (6), length 7458)
    127.0.0.1.10350 > 127.0.0.1.60168: Flags [P.], cksum 0x1b17 (incorrect -> 0xc5e7), seq 220392:227798, ack 863, win 512, options [nop,nop,TS val 740623610 ecr 740623610], length 7406
2022-04-04 20:09:39.238613 IP (tos 0x0, ttl 64, id 54339, offset 0, flags [DF], proto TCP (6), length 52)
    127.0.0.1.60168 > 127.0.0.1.10350: Flags [.], cksum 0xfe28 (incorrect -> 0x488a), seq 863, ack 227798, win 512, options [nop,nop,TS val 740623610 ecr 740623610], length 0
2022-04-04 20:09:39.251222 IP (tos 0x0, ttl 64, id 4808, offset 0, flags [DF], proto TCP (6), length 3538)
    127.0.0.1.10350 > 127.0.0.1.60168: Flags [P.], cksum 0x0bc7 (incorrect -> 0xed53), seq 227798:231284, ack 863, win 512, options [nop,nop,TS val 740623622 ecr 740623610], length 3486
2022-04-04 20:09:39.251237 IP (tos 0x0, ttl 64, id 54340, offset 0, flags [DF], proto TCP (6), length 52)
    127.0.0.1.60168 > 127.0.0.1.10350: Flags [.], cksum 0xfe28 (incorrect -> 0x3ad4), seq 863, ack 231284, win 512, options [nop,nop,TS val 740623622 ecr 740623622], length 0
2022-04-04 20:09:39.251295 IP (tos 0x0, ttl 64, id 4809, offset 0, flags [DF], proto TCP (6), length 4036)
    127.0.0.1.10350 > 127.0.0.1.60168: Flags [P.], cksum 0x0db9 (incorrect -> 0x546e), seq 231284:235268, ack 863, win 512, options [nop,nop,TS val 740623622 ecr 740623622], length 3984
2022-04-04 20:09:39.251347 IP (tos 0x0, ttl 64, id 54341, offset 0, flags [DF], proto TCP (6), length 52)
    127.0.0.1.60168 > 127.0.0.1.10350: Flags [.], cksum 0xfe28 (incorrect -> 0x2b44), seq 863, ack 235268, win 512, options [nop,nop,TS val 740623622 ecr 740623622], length 0
2022-04-04 20:09:39.251405 IP (tos 0x0, ttl 64, id 4810, offset 0, flags [DF], proto TCP (6), length 4100)
    127.0.0.1.10350 > 127.0.0.1.60168: Flags [P.], cksum 0x0df9 (incorrect -> 0x68d5), seq 235268:239316, ack 863, win 512, options [nop,nop,TS val 740623623 ecr 740623622], length 4048
2022-04-04 20:09:39.251620 IP (tos 0x0, ttl 64, id 54342, offset 0, flags [DF], proto TCP (6), length 52)
    127.0.0.1.60168 > 127.0.0.1.10350: Flags [.], cksum 0xfe28 (incorrect -> 0x1b72), seq 863, ack 239316, win 512, options [nop,nop,TS val 740623623 ecr 740623623], length 0
2022-04-04 20:09:39.251626 IP (tos 0x0, ttl 64, id 4811, offset 0, flags [DF], proto TCP (6), length 3577)
    127.0.0.1.10350 > 127.0.0.1.60168: Flags [P.], cksum 0x0bee (incorrect -> 0x4793), seq 239316:242841, ack 863, win 512, options [nop,nop,TS val 740623623 ecr 740623623], length 3525
2022-04-04 20:09:39.251631 IP (tos 0x0, ttl 64, id 54343, offset 0, flags [DF], proto TCP (6), length 52)
    127.0.0.1.60168 > 127.0.0.1.10350: Flags [.], cksum 0xfe28 (incorrect -> 0x0dad), seq 863, ack 242841, win 512, options [nop,nop,TS val 740623623 ecr 740623623], length 0
2022-04-04 20:09:39.261737 IP (tos 0x0, ttl 64, id 4812, offset 0, flags [DF], proto TCP (6), length 3538)
    127.0.0.1.10350 > 127.0.0.1.60168: Flags [P.], cksum 0x0bc7 (incorrect -> 0x8746), seq 242841:246327, ack 863, win 512, options [nop,nop,TS val 740623633 ecr 740623623], length 3486
2022-04-04 20:09:39.261761 IP (tos 0x0, ttl 64, id 54344, offset 0, flags [DF], proto TCP (6), length 52)
    127.0.0.1.60168 > 127.0.0.1.10350: Flags [.], cksum 0xfe28 (incorrect -> 0xfffa), seq 863, ack 246327, win 512, options [nop,nop,TS val 740623633 ecr 740623633], length 0
2022-04-04 20:09:39.270233 IP (tos 0x0, ttl 64, id 4813, offset 0, flags [DF], proto TCP (6), length 4100)
    127.0.0.1.10350 > 127.0.0.1.60168: Flags [P.], cksum 0x0df9 (incorrect -> 0x0c62), seq 246327:250375, ack 863, win 512, options [nop,nop,TS val 740623641 ecr 740623633], length 4048
2022-04-04 20:09:39.270271 IP (tos 0x0, ttl 64, id 54345, offset 0, flags [DF], proto TCP (6), length 52)
    127.0.0.1.60168 > 127.0.0.1.10350: Flags [.], cksum 0xfe28 (incorrect -> 0xf01a), seq 863, ack 250375, win 512, options [nop,nop,TS val 740623641 ecr 740623641], length 0
2022-04-04 20:09:39.270277 IP (tos 0x0, ttl 64, id 4814, offset 0, flags [DF], proto TCP (6), length 7458)
    127.0.0.1.10350 > 127.0.0.1.60168: Flags [P.], cksum 0x1b17 (incorrect -> 0x5d28), seq 250375:257781, ack 863, win 512, options [nop,nop,TS val 740623641 ecr 740623641], length 7406
2022-04-04 20:09:39.270558 IP (tos 0x0, ttl 64, id 54346, offset 0, flags [DF], proto TCP (6), length 52)
    127.0.0.1.60168 > 127.0.0.1.10350: Flags [.], cksum 0xfe28 (incorrect -> 0xd32b), seq 863, ack 257781, win 512, options [nop,nop,TS val 740623642 ecr 740623641], length 0
2022-04-04 20:09:39.274873 IP (tos 0x0, ttl 64, id 4815, offset 0, flags [DF], proto TCP (6), length 3538)
    127.0.0.1.10350 > 127.0.0.1.60168: Flags [P.], cksum 0x0bc7 (incorrect -> 0x33f1), seq 257781:261267, ack 863, win 512, options [nop,nop,TS val 740623646 ecr 740623642], length 3486
2022-04-04 20:09:39.274888 IP (tos 0x0, ttl 64, id 54347, offset 0, flags [DF], proto TCP (6), length 52)
    127.0.0.1.60168 > 127.0.0.1.10350: Flags [.], cksum 0xfe28 (incorrect -> 0xc584), seq 863, ack 261267, win 512, options [nop,nop,TS val 740623646 ecr 740623646], length 0
2022-04-04 20:09:39.285126 IP (tos 0x0, ttl 64, id 4816, offset 0, flags [DF], proto TCP (6), length 1048)
    127.0.0.1.10350 > 127.0.0.1.60168: Flags [P.], cksum 0x020d (incorrect -> 0x2a68), seq 261267:262263, ack 863, win 512, options [nop,nop,TS val 740623656 ecr 740623646], length 996
2022-04-04 20:09:39.285142 IP (tos 0x0, ttl 64, id 54348, offset 0, flags [DF], proto TCP (6), length 52)
    127.0.0.1.60168 > 127.0.0.1.10350: Flags [.], cksum 0xfe28 (incorrect -> 0xc18c), seq 863, ack 262263, win 512, options [nop,nop,TS val 740623656 ecr 740623656], length 0
2022-04-04 20:09:39.289865 IP (tos 0x0, ttl 64, id 4817, offset 0, flags [DF], proto TCP (6), length 3538)
    127.0.0.1.10350 > 127.0.0.1.60168: Flags [P.], cksum 0x0bc7 (incorrect -> 0x6dc0), seq 262263:265749, ack 863, win 512, options [nop,nop,TS val 740623661 ecr 740623656], length 3486
2022-04-04 20:09:39.289882 IP (tos 0x0, ttl 64, id 54349, offset 0, flags [DF], proto TCP (6), length 52)
    127.0.0.1.60168 > 127.0.0.1.10350: Flags [.], cksum 0xfe28 (incorrect -> 0xb3e4), seq 863, ack 265749, win 512, options [nop,nop,TS val 740623661 ecr 740623661], length 0
2022-04-04 20:09:39.295776 IP (tos 0x0, ttl 64, id 4818, offset 0, flags [DF], proto TCP (6), length 4100)
    127.0.0.1.10350 > 127.0.0.1.60168: Flags [P.], cksum 0x0df9 (incorrect -> 0x50fa), seq 265749:269797, ack 863, win 512, options [nop,nop,TS val 740623667 ecr 740623661], length 4048
2022-04-04 20:09:39.295795 IP (tos 0x0, ttl 64, id 54350, offset 0, flags [DF], proto TCP (6), length 52)
    127.0.0.1.60168 > 127.0.0.1.10350: Flags [.], cksum 0xfe28 (incorrect -> 0xa408), seq 863, ack 269797, win 512, options [nop,nop,TS val 740623667 ecr 740623667], length 0
2022-04-04 20:09:39.295800 IP (tos 0x0, ttl 64, id 4819, offset 0, flags [DF], proto TCP (6), length 3474)
    127.0.0.1.10350 > 127.0.0.1.60168: Flags [P.], cksum 0x0b87 (incorrect -> 0xc2af), seq 269797:273219, ack 863, win 512, options [nop,nop,TS val 740623667 ecr 740623667], length 3422
2022-04-04 20:09:39.296005 IP (tos 0x0, ttl 64, id 54351, offset 0, flags [DF], proto TCP (6), length 52)
    127.0.0.1.60168 > 127.0.0.1.10350: Flags [.], cksum 0xfe28 (incorrect -> 0x96aa), seq 863, ack 273219, win 512, options [nop,nop,TS val 740623667 ecr 740623667], length 0
2022-04-04 20:09:39.299749 IP (tos 0x0, ttl 64, id 4820, offset 0, flags [DF], proto TCP (6), length 3538)
    127.0.0.1.10350 > 127.0.0.1.60168: Flags [P.], cksum 0x0bc7 (incorrect -> 0x7596), seq 273219:276705, ack 863, win 512, options [nop,nop,TS val 740623671 ecr 740623667], length 3486
2022-04-04 20:09:39.299763 IP (tos 0x0, ttl 64, id 54352, offset 0, flags [DF], proto TCP (6), length 52)
    127.0.0.1.60168 > 127.0.0.1.10350: Flags [.], cksum 0xfe28 (incorrect -> 0x8904), seq 863, ack 276705, win 512, options [nop,nop,TS val 740623671 ecr 740623671], length 0
2022-04-04 20:09:39.309797 IP (tos 0x0, ttl 64, id 4821, offset 0, flags [DF], proto TCP (6), length 1048)
    127.0.0.1.10350 > 127.0.0.1.60168: Flags [P.], cksum 0x020d (incorrect -> 0x2eb1), seq 276705:277701, ack 863, win 512, options [nop,nop,TS val 740623681 ecr 740623671], length 996
2022-04-04 20:09:39.309809 IP (tos 0x0, ttl 64, id 54353, offset 0, flags [DF], proto TCP (6), length 52)
    127.0.0.1.60168 > 127.0.0.1.10350: Flags [.], cksum 0xfe28 (incorrect -> 0x850c), seq 863, ack 277701, win 512, options [nop,nop,TS val 740623681 ecr 740623681], length 0
2022-04-04 20:09:39.311270 IP (tos 0x0, ttl 64, id 4822, offset 0, flags [DF], proto TCP (6), length 3538)
    127.0.0.1.10350 > 127.0.0.1.60168: Flags [P.], cksum 0x0bc7 (incorrect -> 0x288d), seq 277701:281187, ack 863, win 512, options [nop,nop,TS val 740623682 ecr 740623681], length 3486
2022-04-04 20:09:39.311283 IP (tos 0x0, ttl 64, id 54354, offset 0, flags [DF], proto TCP (6), length 52)
    127.0.0.1.60168 > 127.0.0.1.10350: Flags [.], cksum 0xfe28 (incorrect -> 0x776c), seq 863, ack 281187, win 512, options [nop,nop,TS val 740623682 ecr 740623682], length 0
2022-04-04 20:09:39.316947 IP (tos 0x0, ttl 64, id 4823, offset 0, flags [DF], proto TCP (6), length 4036)
    127.0.0.1.10350 > 127.0.0.1.60168: Flags [P.], cksum 0x0db9 (incorrect -> 0x69fa), seq 281187:285171, ack 863, win 512, options [nop,nop,TS val 740623688 ecr 740623682], length 3984
2022-04-04 20:09:39.317095 IP (tos 0x0, ttl 64, id 54355, offset 0, flags [DF], proto TCP (6), length 52)
    127.0.0.1.60168 > 127.0.0.1.10350: Flags [.], cksum 0xfe28 (incorrect -> 0x67d0), seq 863, ack 285171, win 512, options [nop,nop,TS val 740623688 ecr 740623688], length 0
2022-04-04 20:09:39.317104 IP (tos 0x0, ttl 64, id 4824, offset 0, flags [DF], proto TCP (6), length 14474)
    127.0.0.1.10350 > 127.0.0.1.60168: Flags [P.], cksum 0x367f (incorrect -> 0xfc66), seq 285171:299593, ack 863, win 512, options [nop,nop,TS val 740623688 ecr 740623688], length 14422
2022-04-04 20:09:39.317297 IP (tos 0x0, ttl 64, id 54356, offset 0, flags [DF], proto TCP (6), length 52)
    127.0.0.1.60168 > 127.0.0.1.10350: Flags [.], cksum 0xfe28 (incorrect -> 0x2f7a), seq 863, ack 299593, win 512, options [nop,nop,TS val 740623688 ecr 740623688], length 0
2022-04-04 20:09:39.326785 IP (tos 0x0, ttl 64, id 4825, offset 0, flags [DF], proto TCP (6), length 2064)
    127.0.0.1.10350 > 127.0.0.1.60168: Flags [P.], cksum 0x0605 (incorrect -> 0x44fa), seq 299593:301605, ack 863, win 512, options [nop,nop,TS val 740623698 ecr 740623688], length 2012
2022-04-04 20:09:39.326799 IP (tos 0x0, ttl 64, id 54357, offset 0, flags [DF], proto TCP (6), length 52)
    127.0.0.1.60168 > 127.0.0.1.10350: Flags [.], cksum 0xfe28 (incorrect -> 0x278a), seq 863, ack 301605, win 512, options [nop,nop,TS val 740623698 ecr 740623698], length 0
200, 4.6155922412872314, 1.7585771083831787