2022-04-05 04:34:01.621232 IP (tos 0x0, ttl 64, id 24783, offset 0, flags [DF], proto TCP (6), length 60)
    127.0.0.1.53438 > 127.0.0.1.9150: Flags [S], cksum 0xfe30 (incorrect -> 0x7806), seq 3221433376, win 65495, options [mss 65495,sackOK,TS val 770885992 ecr 0,nop,wscale 7], length 0
2022-04-05 04:34:01.621242 IP (tos 0x0, ttl 64, id 0, offset 0, flags [DF], proto TCP (6), length 60)
    127.0.0.1.9150 > 127.0.0.1.53438: Flags [S.], cksum 0xfe30 (incorrect -> 0xd14b), seq 2051028250, ack 3221433377, win 65483, options [mss 65495,sackOK,TS val 770885992 ecr 770885992,nop,wscale 7], length 0
2022-04-05 04:34:01.621252 IP (tos 0x0, ttl 64, id 24784, offset 0, flags [DF], proto TCP (6), length 52)
    127.0.0.1.53438 > 127.0.0.1.9150: Flags [.], cksum 0xfe28 (incorrect -> 0xf807), seq 1, ack 1, win 512, options [nop,nop,TS val 770885992 ecr 770885992], length 0
2022-04-05 04:34:01.621428 IP (tos 0x0, ttl 64, id 24785, offset 0, flags [DF], proto TCP (6), length 55)
    127.0.0.1.53438 > 127.0.0.1.9150: Flags [P.], cksum 0xfe2b (incorrect -> 0xf2fa), seq 1:4, ack 1, win 512, options [nop,nop,TS val 770885993 ecr 770885992], length 3
2022-04-05 04:34:01.621438 IP (tos 0x0, ttl 64, id 41715, offset 0, flags [DF], proto TCP (6), length 52)
    127.0.0.1.9150 > 127.0.0.1.53438: Flags [.], cksum 0xfe28 (incorrect -> 0xf802), seq 1, ack 4, win 512, options [nop,nop,TS val 770885993 ecr 770885993], length 0
2022-04-05 04:34:01.621465 IP (tos 0x0, ttl 64, id 41716, offset 0, flags [DF], proto TCP (6), length 54)
    127.0.0.1.9150 > 127.0.0.1.53438: Flags [P.], cksum 0xfe2a (incorrect -> 0xf2f8), seq 1:3, ack 4, win 512, options [nop,nop,TS val 770885993 ecr 770885993], length 2
2022-04-05 04:34:01.621475 IP (tos 0x0, ttl 64, id 24786, offset 0, flags [DF], proto TCP (6), length 52)
    127.0.0.1.53438 > 127.0.0.1.9150: Flags [.], cksum 0xfe28 (incorrect -> 0xf800), seq 4, ack 3, win 512, options [nop,nop,TS val 770885993 ecr 770885993], length 0
2022-04-05 04:34:01.632493 IP (tos 0x0, ttl 64, id 24787, offset 0, flags [DF], proto TCP (6), length 62)
    127.0.0.1.53438 > 127.0.0.1.9150: Flags [P.], cksum 0xfe32 (incorrect -> 0x3f02), seq 4:14, ack 3, win 512, options [nop,nop,TS val 770886004 ecr 770885993], length 10
2022-04-05 04:34:01.632515 IP (tos 0x0, ttl 64, id 41717, offset 0, flags [DF], proto TCP (6), length 52)
    127.0.0.1.9150 > 127.0.0.1.53438: Flags [.], cksum 0xfe28 (incorrect -> 0xf7e0), seq 3, ack 14, win 512, options [nop,nop,TS val 770886004 ecr 770886004], length 0
2022-04-05 04:34:01.696560 IP (tos 0x0, ttl 64, id 41718, offset 0, flags [DF], proto TCP (6), length 62)
    127.0.0.1.9150 > 127.0.0.1.53438: Flags [P.], cksum 0xfe32 (incorrect -> 0xf28d), seq 3:13, ack 14, win 512, options [nop,nop,TS val 770886068 ecr 770886004], length 10
2022-04-05 04:34:01.696572 IP (tos 0x0, ttl 64, id 24788, offset 0, flags [DF], proto TCP (6), length 52)
    127.0.0.1.53438 > 127.0.0.1.9150: Flags [.], cksum 0xfe28 (incorrect -> 0xf756), seq 14, ack 13, win 512, options [nop,nop,TS val 770886068 ecr 770886068], length 0
2022-04-05 04:34:01.702262 IP (tos 0x0, ttl 64, id 24789, offset 0, flags [DF], proto TCP (6), length 569)
    127.0.0.1.53438 > 127.0.0.1.9150: Flags [P.], cksum 0x002e (incorrect -> 0x7acf), seq 14:531, ack 13, win 512, options [nop,nop,TS val 770886073 ecr 770886068], length 517
2022-04-05 04:34:01.702273 IP (tos 0x0, ttl 64, id 41719, offset 0, flags [DF], proto TCP (6), length 52)
    127.0.0.1.9150 > 127.0.0.1.53438: Flags [.], cksum 0xfe28 (incorrect -> 0xf54b), seq 13, ack 531, win 508, options [nop,nop,TS val 770886073 ecr 770886073], length 0
200, 3.8740744590759277, 0.5619690418243408