2022-04-05 19:29:43.355906 IP (tos 0x0, ttl 64, id 13275, offset 0, flags [DF], proto TCP (6), length 60)
    127.0.0.1.53284 > 127.0.0.1.12050: Flags [S], cksum 0xfe30 (incorrect -> 0xbddc), seq 2461549671, win 65495, options [mss 65495,sackOK,TS val 269265858 ecr 0,nop,wscale 7], length 0
2022-04-05 19:29:43.355919 IP (tos 0x0, ttl 64, id 0, offset 0, flags [DF], proto TCP (6), length 60)
    127.0.0.1.12050 > 127.0.0.1.53284: Flags [S.], cksum 0xfe30 (incorrect -> 0xe014), seq 3991483402, ack 2461549672, win 65483, options [mss 65495,sackOK,TS val 269265858 ecr 269265858,nop,wscale 7], length 0
2022-04-05 19:29:43.355929 IP (tos 0x0, ttl 64, id 13276, offset 0, flags [DF], proto TCP (6), length 52)
    127.0.0.1.53284 > 127.0.0.1.12050: Flags [.], cksum 0xfe28 (incorrect -> 0x06d1), seq 1, ack 1, win 512, options [nop,nop,TS val 269265858 ecr 269265858], length 0
2022-04-05 19:29:43.356045 IP (tos 0x0, ttl 64, id 13277, offset 0, flags [DF], proto TCP (6), length 55)
    127.0.0.1.53284 > 127.0.0.1.12050: Flags [P.], cksum 0xfe2b (incorrect -> 0x01c5), seq 1:4, ack 1, win 512, options [nop,nop,TS val 269265858 ecr 269265858], length 3
2022-04-05 19:29:43.356060 IP (tos 0x0, ttl 64, id 51678, offset 0, flags [DF], proto TCP (6), length 52)
    127.0.0.1.12050 > 127.0.0.1.53284: Flags [.], cksum 0xfe28 (incorrect -> 0x06ce), seq 1, ack 4, win 512, options [nop,nop,TS val 269265858 ecr 269265858], length 0
2022-04-05 19:29:43.356129 IP (tos 0x0, ttl 64, id 51679, offset 0, flags [DF], proto TCP (6), length 54)
    127.0.0.1.12050 > 127.0.0.1.53284: Flags [P.], cksum 0xfe2a (incorrect -> 0x01c3), seq 1:3, ack 4, win 512, options [nop,nop,TS val 269265859 ecr 269265858], length 2
2022-04-05 19:29:43.356146 IP (tos 0x0, ttl 64, id 13278, offset 0, flags [DF], proto TCP (6), length 52)
    127.0.0.1.53284 > 127.0.0.1.12050: Flags [.], cksum 0xfe28 (incorrect -> 0x06ca), seq 4, ack 3, win 512, options [nop,nop,TS val 269265859 ecr 269265859], length 0
2022-04-05 19:29:43.357732 IP (tos 0x0, ttl 64, id 13279, offset 0, flags [DF], proto TCP (6), length 62)
    127.0.0.1.53284 > 127.0.0.1.12050: Flags [P.], cksum 0xfe32 (incorrect -> 0xf5fa), seq 4:14, ack 3, win 512, options [nop,nop,TS val 269265860 ecr 269265859], length 10
2022-04-05 19:29:43.357748 IP (tos 0x0, ttl 64, id 51680, offset 0, flags [DF], proto TCP (6), length 52)
    127.0.0.1.12050 > 127.0.0.1.53284: Flags [.], cksum 0xfe28 (incorrect -> 0x06be), seq 3, ack 14, win 512, options [nop,nop,TS val 269265860 ecr 269265860], length 0
2022-04-05 19:29:43.425916 IP (tos 0x0, ttl 64, id 51681, offset 0, flags [DF], proto TCP (6), length 62)
    127.0.0.1.12050 > 127.0.0.1.53284: Flags [P.], cksum 0xfe32 (incorrect -> 0x0167), seq 3:13, ack 14, win 512, options [nop,nop,TS val 269265928 ecr 269265860], length 10
2022-04-05 19:29:43.425928 IP (tos 0x0, ttl 64, id 13280, offset 0, flags [DF], proto TCP (6), length 52)
    127.0.0.1.53284 > 127.0.0.1.12050: Flags [.], cksum 0xfe28 (incorrect -> 0x062c), seq 14, ack 13, win 512, options [nop,nop,TS val 269265928 ecr 269265928], length 0
2022-04-05 19:29:43.431943 IP (tos 0x0, ttl 64, id 13281, offset 0, flags [DF], proto TCP (6), length 569)
    127.0.0.1.53284 > 127.0.0.1.12050: Flags [P.], cksum 0x002e (incorrect -> 0x083b), seq 14:531, ack 13, win 512, options [nop,nop,TS val 269265934 ecr 269265928], length 517
2022-04-05 19:29:43.431956 IP (tos 0x0, ttl 64, id 51682, offset 0, flags [DF], proto TCP (6), length 52)
    127.0.0.1.12050 > 127.0.0.1.53284: Flags [.], cksum 0xfe28 (incorrect -> 0x041f), seq 13, ack 531, win 508, options [nop,nop,TS val 269265934 ecr 269265934], length 0
2022-04-05 19:29:43.510326 IP (tos 0x0, ttl 64, id 51683, offset 0, flags [DF], proto TCP (6), length 3538)
    127.0.0.1.12050 > 127.0.0.1.53284: Flags [P.], cksum 0x0bc7 (incorrect -> 0x65e7), seq 13:3499, ack 531, win 512, options [nop,nop,TS val 269266013 ecr 269265934], length 3486
2022-04-05 19:29:43.510339 IP (tos 0x0, ttl 64, id 13282, offset 0, flags [DF], proto TCP (6), length 52)
    127.0.0.1.53284 > 127.0.0.1.12050: Flags [.], cksum 0xfe28 (incorrect -> 0xf5f0), seq 531, ack 3499, win 494, options [nop,nop,TS val 269266013 ecr 269266013], length 0
200, 10.042152166366577, 0.4177131652832031