2022-04-05 21:37:45.051449 IP (tos 0x0, ttl 64, id 24307, offset 0, flags [DF], proto TCP (6), length 60)
    127.0.0.1.52372 > 127.0.0.1.11550: Flags [S], cksum 0xfe30 (incorrect -> 0x5590), seq 3800574802, win 65495, options [mss 65495,sackOK,TS val 276947554 ecr 0,nop,wscale 7], length 0
2022-04-05 21:37:45.051463 IP (tos 0x0, ttl 64, id 0, offset 0, flags [DF], proto TCP (6), length 60)
    127.0.0.1.11550 > 127.0.0.1.52372: Flags [S.], cksum 0xfe30 (incorrect -> 0xb23a), seq 2943222014, ack 3800574803, win 65483, options [mss 65495,sackOK,TS val 276947554 ecr 276947554,nop,wscale 7], length 0
2022-04-05 21:37:45.051473 IP (tos 0x0, ttl 64, id 24308, offset 0, flags [DF], proto TCP (6), length 52)
    127.0.0.1.52372 > 127.0.0.1.11550: Flags [.], cksum 0xfe28 (incorrect -> 0xd8f6), seq 1, ack 1, win 512, options [nop,nop,TS val 276947554 ecr 276947554], length 0
2022-04-05 21:37:45.051583 IP (tos 0x0, ttl 64, id 24309, offset 0, flags [DF], proto TCP (6), length 55)
    127.0.0.1.52372 > 127.0.0.1.11550: Flags [P.], cksum 0xfe2b (incorrect -> 0xd3ea), seq 1:4, ack 1, win 512, options [nop,nop,TS val 276947554 ecr 276947554], length 3
2022-04-05 21:37:45.051598 IP (tos 0x0, ttl 64, id 7984, offset 0, flags [DF], proto TCP (6), length 52)
    127.0.0.1.11550 > 127.0.0.1.52372: Flags [.], cksum 0xfe28 (incorrect -> 0xd8f3), seq 1, ack 4, win 512, options [nop,nop,TS val 276947554 ecr 276947554], length 0
2022-04-05 21:37:45.051634 IP (tos 0x0, ttl 64, id 7985, offset 0, flags [DF], proto TCP (6), length 54)
    127.0.0.1.11550 > 127.0.0.1.52372: Flags [P.], cksum 0xfe2a (incorrect -> 0xd3e9), seq 1:3, ack 4, win 512, options [nop,nop,TS val 276947554 ecr 276947554], length 2
2022-04-05 21:37:45.051646 IP (tos 0x0, ttl 64, id 24310, offset 0, flags [DF], proto TCP (6), length 52)
    127.0.0.1.52372 > 127.0.0.1.11550: Flags [.], cksum 0xfe28 (incorrect -> 0xd8f1), seq 4, ack 3, win 512, options [nop,nop,TS val 276947554 ecr 276947554], length 0
2022-04-05 21:37:45.053148 IP (tos 0x0, ttl 64, id 24311, offset 0, flags [DF], proto TCP (6), length 62)
    127.0.0.1.52372 > 127.0.0.1.11550: Flags [P.], cksum 0xfe32 (incorrect -> 0x7f90), seq 4:14, ack 3, win 512, options [nop,nop,TS val 276947556 ecr 276947554], length 10
2022-04-05 21:37:45.053162 IP (tos 0x0, ttl 64, id 7986, offset 0, flags [DF], proto TCP (6), length 52)
    127.0.0.1.11550 > 127.0.0.1.52372: Flags [.], cksum 0xfe28 (incorrect -> 0xd8e3), seq 3, ack 14, win 512, options [nop,nop,TS val 276947556 ecr 276947556], length 0
2022-04-05 21:37:46.204242 IP (tos 0x0, ttl 64, id 7987, offset 0, flags [DF], proto TCP (6), length 62)
    127.0.0.1.11550 > 127.0.0.1.52372: Flags [P.], cksum 0xfe32 (incorrect -> 0xcf51), seq 3:13, ack 14, win 512, options [nop,nop,TS val 276948707 ecr 276947556], length 10
2022-04-05 21:37:46.204262 IP (tos 0x0, ttl 64, id 24312, offset 0, flags [DF], proto TCP (6), length 52)
    127.0.0.1.52372 > 127.0.0.1.11550: Flags [.], cksum 0xfe28 (incorrect -> 0xcfdb), seq 14, ack 13, win 512, options [nop,nop,TS val 276948707 ecr 276948707], length 0
2022-04-05 21:37:46.210439 IP (tos 0x0, ttl 64, id 24313, offset 0, flags [DF], proto TCP (6), length 569)
    127.0.0.1.52372 > 127.0.0.1.11550: Flags [P.], cksum 0x002e (incorrect -> 0x1686), seq 14:531, ack 13, win 512, options [nop,nop,TS val 276948713 ecr 276948707], length 517
2022-04-05 21:37:46.210451 IP (tos 0x0, ttl 64, id 7988, offset 0, flags [DF], proto TCP (6), length 52)
    127.0.0.1.11550 > 127.0.0.1.52372: Flags [.], cksum 0xfe28 (incorrect -> 0xcdce), seq 13, ack 531, win 508, options [nop,nop,TS val 276948713 ecr 276948713], length 0
200, 4.869340658187866, 1.6049649715423584