2022-04-05 00:08:40.955006 IP (tos 0x0, ttl 64, id 59819, offset 0, flags [DF], proto TCP (6), length 60)
    127.0.0.1.60632 > 127.0.0.1.10350: Flags [S], cksum 0xfe30 (incorrect -> 0x885b), seq 2000433877, win 65495, options [mss 65495,sackOK,TS val 754965326 ecr 0,nop,wscale 7], length 0
2022-04-05 00:08:40.955018 IP (tos 0x0, ttl 64, id 0, offset 0, flags [DF], proto TCP (6), length 60)
    127.0.0.1.10350 > 127.0.0.1.60632: Flags [S.], cksum 0xfe30 (incorrect -> 0xa39a), seq 1775923859, ack 2000433878, win 65483, options [mss 65495,sackOK,TS val 754965326 ecr 754965326,nop,wscale 7], length 0
2022-04-05 00:08:40.955027 IP (tos 0x0, ttl 64, id 59820, offset 0, flags [DF], proto TCP (6), length 52)
    127.0.0.1.60632 > 127.0.0.1.10350: Flags [.], cksum 0xfe28 (incorrect -> 0xca56), seq 1, ack 1, win 512, options [nop,nop,TS val 754965326 ecr 754965326], length 0
2022-04-05 00:08:40.955128 IP (tos 0x0, ttl 64, id 59821, offset 0, flags [DF], proto TCP (6), length 55)
    127.0.0.1.60632 > 127.0.0.1.10350: Flags [P.], cksum 0xfe2b (incorrect -> 0xc54a), seq 1:4, ack 1, win 512, options [nop,nop,TS val 754965326 ecr 754965326], length 3
2022-04-05 00:08:40.955141 IP (tos 0x0, ttl 64, id 5378, offset 0, flags [DF], proto TCP (6), length 52)
    127.0.0.1.10350 > 127.0.0.1.60632: Flags [.], cksum 0xfe28 (incorrect -> 0xca53), seq 1, ack 4, win 512, options [nop,nop,TS val 754965326 ecr 754965326], length 0
2022-04-05 00:08:40.955171 IP (tos 0x0, ttl 64, id 5379, offset 0, flags [DF], proto TCP (6), length 54)
    127.0.0.1.10350 > 127.0.0.1.60632: Flags [P.], cksum 0xfe2a (incorrect -> 0xc549), seq 1:3, ack 4, win 512, options [nop,nop,TS val 754965326 ecr 754965326], length 2
2022-04-05 00:08:40.955186 IP (tos 0x0, ttl 64, id 59822, offset 0, flags [DF], proto TCP (6), length 52)
    127.0.0.1.60632 > 127.0.0.1.10350: Flags [.], cksum 0xfe28 (incorrect -> 0xca51), seq 4, ack 3, win 512, options [nop,nop,TS val 754965326 ecr 754965326], length 0
2022-04-05 00:08:40.966988 IP (tos 0x0, ttl 64, id 59823, offset 0, flags [DF], proto TCP (6), length 62)
    127.0.0.1.60632 > 127.0.0.1.10350: Flags [P.], cksum 0xfe32 (incorrect -> 0x48ca), seq 4:14, ack 3, win 512, options [nop,nop,TS val 754965338 ecr 754965326], length 10
2022-04-05 00:08:40.967008 IP (tos 0x0, ttl 64, id 5380, offset 0, flags [DF], proto TCP (6), length 52)
    127.0.0.1.10350 > 127.0.0.1.60632: Flags [.], cksum 0xfe28 (incorrect -> 0xca2f), seq 3, ack 14, win 512, options [nop,nop,TS val 754965338 ecr 754965338], length 0
2022-04-05 00:08:41.062915 IP (tos 0x0, ttl 64, id 5381, offset 0, flags [DF], proto TCP (6), length 62)
    127.0.0.1.10350 > 127.0.0.1.60632: Flags [P.], cksum 0xfe32 (incorrect -> 0xc4bc), seq 3:13, ack 14, win 512, options [nop,nop,TS val 754965434 ecr 754965338], length 10
2022-04-05 00:08:41.062925 IP (tos 0x0, ttl 64, id 59824, offset 0, flags [DF], proto TCP (6), length 52)
    127.0.0.1.60632 > 127.0.0.1.10350: Flags [.], cksum 0xfe28 (incorrect -> 0xc965), seq 14, ack 13, win 512, options [nop,nop,TS val 754965434 ecr 754965434], length 0
2022-04-05 00:08:41.069228 IP (tos 0x0, ttl 64, id 59825, offset 0, flags [DF], proto TCP (6), length 569)
    127.0.0.1.60632 > 127.0.0.1.10350: Flags [P.], cksum 0x002e (incorrect -> 0x809f), seq 14:531, ack 13, win 512, options [nop,nop,TS val 754965440 ecr 754965434], length 517
2022-04-05 00:08:41.069243 IP (tos 0x0, ttl 64, id 5382, offset 0, flags [DF], proto TCP (6), length 52)
    127.0.0.1.10350 > 127.0.0.1.60632: Flags [.], cksum 0xfe28 (incorrect -> 0xc758), seq 13, ack 531, win 508, options [nop,nop,TS val 754965440 ecr 754965440], length 0
200, 9.924559593200684, 0.5846090316772461