2022-04-05 00:36:59.826485 IP (tos 0x0, ttl 64, id 61716, offset 0, flags [DF], proto TCP (6), length 60)
    127.0.0.1.49736 > 127.0.0.1.10250: Flags [S], cksum 0xfe30 (incorrect -> 0xf39c), seq 1656494774, win 65495, options [mss 65495,sackOK,TS val 756664198 ecr 0,nop,wscale 7], length 0
2022-04-05 00:36:59.826502 IP (tos 0x0, ttl 64, id 0, offset 0, flags [DF], proto TCP (6), length 60)
    127.0.0.1.10250 > 127.0.0.1.49736: Flags [S.], cksum 0xfe30 (incorrect -> 0xb9f3), seq 2854984408, ack 1656494775, win 65483, options [mss 65495,sackOK,TS val 756664198 ecr 756664198,nop,wscale 7], length 0
2022-04-05 00:36:59.826516 IP (tos 0x0, ttl 64, id 61717, offset 0, flags [DF], proto TCP (6), length 52)
    127.0.0.1.49736 > 127.0.0.1.10250: Flags [.], cksum 0xfe28 (incorrect -> 0xe0af), seq 1, ack 1, win 512, options [nop,nop,TS val 756664198 ecr 756664198], length 0
2022-04-05 00:36:59.826619 IP (tos 0x0, ttl 64, id 61718, offset 0, flags [DF], proto TCP (6), length 55)
    127.0.0.1.49736 > 127.0.0.1.10250: Flags [P.], cksum 0xfe2b (incorrect -> 0xdba3), seq 1:4, ack 1, win 512, options [nop,nop,TS val 756664198 ecr 756664198], length 3
2022-04-05 00:36:59.826631 IP (tos 0x0, ttl 64, id 43338, offset 0, flags [DF], proto TCP (6), length 52)
    127.0.0.1.10250 > 127.0.0.1.49736: Flags [.], cksum 0xfe28 (incorrect -> 0xe0ac), seq 1, ack 4, win 512, options [nop,nop,TS val 756664198 ecr 756664198], length 0
2022-04-05 00:36:59.826668 IP (tos 0x0, ttl 64, id 43339, offset 0, flags [DF], proto TCP (6), length 54)
    127.0.0.1.10250 > 127.0.0.1.49736: Flags [P.], cksum 0xfe2a (incorrect -> 0xdba2), seq 1:3, ack 4, win 512, options [nop,nop,TS val 756664198 ecr 756664198], length 2
2022-04-05 00:36:59.826680 IP (tos 0x0, ttl 64, id 61719, offset 0, flags [DF], proto TCP (6), length 52)
    127.0.0.1.49736 > 127.0.0.1.10250: Flags [.], cksum 0xfe28 (incorrect -> 0xe0aa), seq 4, ack 3, win 512, options [nop,nop,TS val 756664198 ecr 756664198], length 0
2022-04-05 00:36:59.828989 IP (tos 0x0, ttl 64, id 61720, offset 0, flags [DF], proto TCP (6), length 62)
    127.0.0.1.49736 > 127.0.0.1.10250: Flags [P.], cksum 0xfe32 (incorrect -> 0x6c58), seq 4:14, ack 3, win 512, options [nop,nop,TS val 756664200 ecr 756664198], length 10
2022-04-05 00:36:59.828996 IP (tos 0x0, ttl 64, id 43340, offset 0, flags [DF], proto TCP (6), length 52)
    127.0.0.1.10250 > 127.0.0.1.49736: Flags [.], cksum 0xfe28 (incorrect -> 0xe09c), seq 3, ack 14, win 512, options [nop,nop,TS val 756664200 ecr 756664200], length 0
2022-04-05 00:36:59.958903 IP (tos 0x0, ttl 64, id 43341, offset 0, flags [DF], proto TCP (6), length 62)
    127.0.0.1.10250 > 127.0.0.1.49736: Flags [P.], cksum 0xfe32 (incorrect -> 0xdb07), seq 3:13, ack 14, win 512, options [nop,nop,TS val 756664330 ecr 756664200], length 10
2022-04-05 00:36:59.958908 IP (tos 0x0, ttl 64, id 61721, offset 0, flags [DF], proto TCP (6), length 52)
    127.0.0.1.49736 > 127.0.0.1.10250: Flags [.], cksum 0xfe28 (incorrect -> 0xdf8e), seq 14, ack 13, win 512, options [nop,nop,TS val 756664330 ecr 756664330], length 0
2022-04-05 00:36:59.964591 IP (tos 0x0, ttl 64, id 61722, offset 0, flags [DF], proto TCP (6), length 569)
    127.0.0.1.49736 > 127.0.0.1.10250: Flags [P.], cksum 0x002e (incorrect -> 0xf12f), seq 14:531, ack 13, win 512, options [nop,nop,TS val 756664336 ecr 756664330], length 517
2022-04-05 00:36:59.964609 IP (tos 0x0, ttl 64, id 43342, offset 0, flags [DF], proto TCP (6), length 52)
    127.0.0.1.10250 > 127.0.0.1.49736: Flags [.], cksum 0xfe28 (incorrect -> 0xdd81), seq 13, ack 531, win 508, options [nop,nop,TS val 756664336 ecr 756664336], length 0
403, 18.919888734817505, 0.5222969055175781