2022-04-05 04:47:41.987339 IP (tos 0x0, ttl 64, id 60445, offset 0, flags [DF], proto TCP (6), length 60)
    127.0.0.1.39622 > 127.0.0.1.11050: Flags [S], cksum 0xfe30 (incorrect -> 0x0e6a), seq 3553111017, win 65495, options [mss 65495,sackOK,TS val 771706358 ecr 0,nop,wscale 7], length 0
2022-04-05 04:47:41.987356 IP (tos 0x0, ttl 64, id 0, offset 0, flags [DF], proto TCP (6), length 60)
    127.0.0.1.11050 > 127.0.0.1.39622: Flags [S.], cksum 0xfe30 (incorrect -> 0xc690), seq 1486844735, ack 3553111018, win 65483, options [mss 65495,sackOK,TS val 771706358 ecr 771706358,nop,wscale 7], length 0
2022-04-05 04:47:41.987371 IP (tos 0x0, ttl 64, id 60446, offset 0, flags [DF], proto TCP (6), length 52)
    127.0.0.1.39622 > 127.0.0.1.11050: Flags [.], cksum 0xfe28 (incorrect -> 0xed4c), seq 1, ack 1, win 512, options [nop,nop,TS val 771706358 ecr 771706358], length 0
2022-04-05 04:47:41.987483 IP (tos 0x0, ttl 64, id 60447, offset 0, flags [DF], proto TCP (6), length 55)
    127.0.0.1.39622 > 127.0.0.1.11050: Flags [P.], cksum 0xfe2b (incorrect -> 0xe83f), seq 1:4, ack 1, win 512, options [nop,nop,TS val 771706359 ecr 771706358], length 3
2022-04-05 04:47:41.987495 IP (tos 0x0, ttl 64, id 46582, offset 0, flags [DF], proto TCP (6), length 52)
    127.0.0.1.11050 > 127.0.0.1.39622: Flags [.], cksum 0xfe28 (incorrect -> 0xed47), seq 1, ack 4, win 512, options [nop,nop,TS val 771706359 ecr 771706359], length 0
2022-04-05 04:47:41.987542 IP (tos 0x0, ttl 64, id 46583, offset 0, flags [DF], proto TCP (6), length 54)
    127.0.0.1.11050 > 127.0.0.1.39622: Flags [P.], cksum 0xfe2a (incorrect -> 0xe83d), seq 1:3, ack 4, win 512, options [nop,nop,TS val 771706359 ecr 771706359], length 2
2022-04-05 04:47:41.987558 IP (tos 0x0, ttl 64, id 60448, offset 0, flags [DF], proto TCP (6), length 52)
    127.0.0.1.39622 > 127.0.0.1.11050: Flags [.], cksum 0xfe28 (incorrect -> 0xed45), seq 4, ack 3, win 512, options [nop,nop,TS val 771706359 ecr 771706359], length 0
2022-04-05 04:47:41.999454 IP (tos 0x0, ttl 64, id 60449, offset 0, flags [DF], proto TCP (6), length 62)
    127.0.0.1.39622 > 127.0.0.1.11050: Flags [P.], cksum 0xfe32 (incorrect -> 0x5d29), seq 4:14, ack 3, win 512, options [nop,nop,TS val 771706371 ecr 771706359], length 10
2022-04-05 04:47:41.999471 IP (tos 0x0, ttl 64, id 46584, offset 0, flags [DF], proto TCP (6), length 52)
    127.0.0.1.11050 > 127.0.0.1.39622: Flags [.], cksum 0xfe28 (incorrect -> 0xed23), seq 3, ack 14, win 512, options [nop,nop,TS val 771706371 ecr 771706371], length 0
2022-04-05 04:47:42.051341 IP (tos 0x0, ttl 64, id 46585, offset 0, flags [DF], proto TCP (6), length 62)
    127.0.0.1.11050 > 127.0.0.1.39622: Flags [P.], cksum 0xfe32 (incorrect -> 0xe7dd), seq 3:13, ack 14, win 512, options [nop,nop,TS val 771706422 ecr 771706371], length 10
2022-04-05 04:47:42.051358 IP (tos 0x0, ttl 64, id 60450, offset 0, flags [DF], proto TCP (6), length 52)
    127.0.0.1.39622 > 127.0.0.1.11050: Flags [.], cksum 0xfe28 (incorrect -> 0xecb3), seq 14, ack 13, win 512, options [nop,nop,TS val 771706422 ecr 771706422], length 0
2022-04-05 04:47:42.057439 IP (tos 0x0, ttl 64, id 60451, offset 0, flags [DF], proto TCP (6), length 569)
    127.0.0.1.39622 > 127.0.0.1.11050: Flags [P.], cksum 0x002e (incorrect -> 0x1829), seq 14:531, ack 13, win 512, options [nop,nop,TS val 771706429 ecr 771706422], length 517
2022-04-05 04:47:42.057449 IP (tos 0x0, ttl 64, id 46586, offset 0, flags [DF], proto TCP (6), length 52)
    127.0.0.1.11050 > 127.0.0.1.39622: Flags [.], cksum 0xfe28 (incorrect -> 0xeaa4), seq 13, ack 531, win 508, options [nop,nop,TS val 771706429 ecr 771706429], length 0
2022-04-05 04:47:42.114785 IP (tos 0x0, ttl 64, id 46587, offset 0, flags [DF], proto TCP (6), length 3492)
    127.0.0.1.11050 > 127.0.0.1.39622: Flags [P.], cksum 0x0b99 (incorrect -> 0xe079), seq 13:3453, ack 531, win 512, options [nop,nop,TS val 771706486 ecr 771706429], length 3440
2022-04-05 04:47:42.114794 IP (tos 0x0, ttl 64, id 60452, offset 0, flags [DF], proto TCP (6), length 52)
    127.0.0.1.39622 > 127.0.0.1.11050: Flags [.], cksum 0xfe28 (incorrect -> 0xdcd0), seq 531, ack 3453, win 494, options [nop,nop,TS val 771706486 ecr 771706486], length 0
2022-04-05 04:47:42.131939 IP (tos 0x0, ttl 64, id 46588, offset 0, flags [DF], proto TCP (6), length 1197)
    127.0.0.1.11050 > 127.0.0.1.39622: Flags [P.], cksum 0x02a2 (incorrect -> 0xa8bd), seq 3453:4598, ack 531, win 512, options [nop,nop,TS val 771706503 ecr 771706486], length 1145
2022-04-05 04:47:42.131946 IP (tos 0x0, ttl 64, id 60453, offset 0, flags [DF], proto TCP (6), length 52)
    127.0.0.1.39622 > 127.0.0.1.11050: Flags [.], cksum 0xfe28 (incorrect -> 0xd82c), seq 531, ack 4598, win 503, options [nop,nop,TS val 771706503 ecr 771706503], length 0
2022-04-05 04:47:42.132350 IP (tos 0x0, ttl 64, id 60454, offset 0, flags [DF], proto TCP (6), length 132)
    127.0.0.1.39622 > 127.0.0.1.11050: Flags [P.], cksum 0xfe78 (incorrect -> 0xdbbc), seq 531:611, ack 4598, win 512, options [nop,nop,TS val 771706503 ecr 771706503], length 80
2022-04-05 04:47:42.132358 IP (tos 0x0, ttl 64, id 46589, offset 0, flags [DF], proto TCP (6), length 52)
    127.0.0.1.11050 > 127.0.0.1.39622: Flags [.], cksum 0xfe28 (incorrect -> 0xd7d3), seq 4598, ack 611, win 512, options [nop,nop,TS val 771706503 ecr 771706503], length 0
2022-04-05 04:47:42.132738 IP (tos 0x0, ttl 64, id 60455, offset 0, flags [DF], proto TCP (6), length 319)
    127.0.0.1.39622 > 127.0.0.1.11050: Flags [P.], cksum 0xff33 (incorrect -> 0x6801), seq 611:878, ack 4598, win 512, options [nop,nop,TS val 771706504 ecr 771706503], length 267
2022-04-05 04:47:42.132742 IP (tos 0x0, ttl 64, id 46590, offset 0, flags [DF], proto TCP (6), length 52)
    127.0.0.1.11050 > 127.0.0.1.39622: Flags [.], cksum 0xfe28 (incorrect -> 0xd6c8), seq 4598, ack 878, win 510, options [nop,nop,TS val 771706504 ecr 771706504], length 0
2022-04-05 04:47:42.184247 IP (tos 0x0, ttl 64, id 46591, offset 0, flags [DF], proto TCP (6), length 210)
    127.0.0.1.11050 > 127.0.0.1.39622: Flags [P.], cksum 0xfec6 (incorrect -> 0x053f), seq 4598:4756, ack 878, win 512, options [nop,nop,TS val 771706555 ecr 771706504], length 158
2022-04-05 04:47:42.184257 IP (tos 0x0, ttl 64, id 60456, offset 0, flags [DF], proto TCP (6), length 52)
    127.0.0.1.39622 > 127.0.0.1.11050: Flags [.], cksum 0xfe28 (incorrect -> 0xd5c3), seq 878, ack 4756, win 511, options [nop,nop,TS val 771706555 ecr 771706555], length 0
2022-04-05 04:47:42.189724 IP (tos 0x0, ttl 64, id 46592, offset 0, flags [DF], proto TCP (6), length 3538)
    127.0.0.1.11050 > 127.0.0.1.39622: Flags [P.], cksum 0x0bc7 (incorrect -> 0x8bc6), seq 4756:8242, ack 878, win 512, options [nop,nop,TS val 771706561 ecr 771706555], length 3486
2022-04-05 04:47:42.189731 IP (tos 0x0, ttl 64, id 60457, offset 0, flags [DF], proto TCP (6), length 52)
    127.0.0.1.39622 > 127.0.0.1.11050: Flags [.], cksum 0xfe28 (incorrect -> 0xc82a), seq 878, ack 8242, win 494, options [nop,nop,TS val 771706561 ecr 771706561], length 0
2022-04-05 04:47:42.193685 IP (tos 0x0, ttl 64, id 46593, offset 0, flags [DF], proto TCP (6), length 4036)
    127.0.0.1.11050 > 127.0.0.1.39622: Flags [P.], cksum 0x0db9 (incorrect -> 0xc6f8), seq 8242:12226, ack 878, win 512, options [nop,nop,TS val 771706565 ecr 771706561], length 3984
2022-04-05 04:47:42.193689 IP (tos 0x0, ttl 64, id 60458, offset 0, flags [DF], proto TCP (6), length 52)
    127.0.0.1.39622 > 127.0.0.1.11050: Flags [.], cksum 0xfe28 (incorrect -> 0xb894), seq 878, ack 12226, win 492, options [nop,nop,TS val 771706565 ecr 771706565], length 0
2022-04-05 04:47:42.195407 IP (tos 0x0, ttl 64, id 46594, offset 0, flags [DF], proto TCP (6), length 3216)
    127.0.0.1.11050 > 127.0.0.1.39622: Flags [P.], cksum 0x0a85 (incorrect -> 0x607f), seq 12226:15390, ack 878, win 512, options [nop,nop,TS val 771706567 ecr 771706565], length 3164
2022-04-05 04:47:42.195412 IP (tos 0x0, ttl 64, id 60459, offset 0, flags [DF], proto TCP (6), length 52)
    127.0.0.1.39622 > 127.0.0.1.11050: Flags [.], cksum 0xfe28 (incorrect -> 0xac31), seq 878, ack 15390, win 495, options [nop,nop,TS val 771706567 ecr 771706567], length 0
2022-04-05 04:47:42.198037 IP (tos 0x0, ttl 64, id 46595, offset 0, flags [DF], proto TCP (6), length 1002)
    127.0.0.1.11050 > 127.0.0.1.39622: Flags [P.], cksum 0x01df (incorrect -> 0x4ba1), seq 15390:16340, ack 878, win 512, options [nop,nop,TS val 771706569 ecr 771706567], length 950
2022-04-05 04:47:42.198042 IP (tos 0x0, ttl 64, id 60460, offset 0, flags [DF], proto TCP (6), length 52)
    127.0.0.1.39622 > 127.0.0.1.11050: Flags [.], cksum 0xfe28 (incorrect -> 0xa86e), seq 878, ack 16340, win 504, options [nop,nop,TS val 771706569 ecr 771706569], length 0
2022-04-05 04:47:42.205187 IP (tos 0x0, ttl 64, id 46596, offset 0, flags [DF], proto TCP (6), length 3492)
    127.0.0.1.11050 > 127.0.0.1.39622: Flags [P.], cksum 0x0b99 (incorrect -> 0xb22a), seq 16340:19780, ack 878, win 512, options [nop,nop,TS val 771706576 ecr 771706569], length 3440
2022-04-05 04:47:42.205192 IP (tos 0x0, ttl 64, id 60461, offset 0, flags [DF], proto TCP (6), length 52)
    127.0.0.1.39622 > 127.0.0.1.11050: Flags [.], cksum 0xfe28 (incorrect -> 0x9afa), seq 878, ack 19780, win 494, options [nop,nop,TS val 771706576 ecr 771706576], length 0
2022-04-05 04:47:42.205271 IP (tos 0x0, ttl 64, id 46597, offset 0, flags [DF], proto TCP (6), length 3898)
    127.0.0.1.11050 > 127.0.0.1.39622: Flags [P.], cksum 0x0d2f (incorrect -> 0x2a3f), seq 19780:23626, ack 878, win 512, options [nop,nop,TS val 771706576 ecr 771706576], length 3846
2022-04-05 04:47:42.205274 IP (tos 0x0, ttl 64, id 60462, offset 0, flags [DF], proto TCP (6), length 52)
    127.0.0.1.39622 > 127.0.0.1.11050: Flags [.], cksum 0xfe28 (incorrect -> 0x8c03), seq 878, ack 23626, win 479, options [nop,nop,TS val 771706576 ecr 771706576], length 0
2022-04-05 04:47:42.205305 IP (tos 0x0, ttl 64, id 46598, offset 0, flags [DF], proto TCP (6), length 4036)
    127.0.0.1.11050 > 127.0.0.1.39622: Flags [P.], cksum 0x0db9 (incorrect -> 0xbe46), seq 23626:27610, ack 878, win 512, options [nop,nop,TS val 771706576 ecr 771706576], length 3984
2022-04-05 04:47:42.205308 IP (tos 0x0, ttl 64, id 60463, offset 0, flags [DF], proto TCP (6), length 52)
    127.0.0.1.39622 > 127.0.0.1.11050: Flags [.], cksum 0xfe28 (incorrect -> 0x7c83), seq 878, ack 27610, win 463, options [nop,nop,TS val 771706576 ecr 771706576], length 0
2022-04-05 04:47:42.206927 IP (tos 0x0, ttl 64, id 46599, offset 0, flags [DF], proto TCP (6), length 3040)
    127.0.0.1.11050 > 127.0.0.1.39622: Flags [P.], cksum 0x09d5 (incorrect -> 0x9135), seq 27610:30598, ack 878, win 512, options [nop,nop,TS val 771706578 ecr 771706576], length 2988
2022-04-05 04:47:42.206944 IP (tos 0x0, ttl 64, id 60464, offset 0, flags [DF], proto TCP (6), length 52)
    127.0.0.1.39622 > 127.0.0.1.11050: Flags [.], cksum 0xfe28 (incorrect -> 0x70a2), seq 878, ack 30598, win 512, options [nop,nop,TS val 771706578 ecr 771706578], length 0
2022-04-05 04:47:42.208581 IP (tos 0x0, ttl 64, id 46600, offset 0, flags [DF], proto TCP (6), length 3538)
    127.0.0.1.11050 > 127.0.0.1.39622: Flags [P.], cksum 0x0bc7 (incorrect -> 0x92e0), seq 30598:34084, ack 878, win 512, options [nop,nop,TS val 771706580 ecr 771706578], length 3486
2022-04-05 04:47:42.208594 IP (tos 0x0, ttl 64, id 60465, offset 0, flags [DF], proto TCP (6), length 52)
    127.0.0.1.39622 > 127.0.0.1.11050: Flags [.], cksum 0xfe28 (incorrect -> 0x6300), seq 878, ack 34084, win 512, options [nop,nop,TS val 771706580 ecr 771706580], length 0
2022-04-05 04:47:42.211860 IP (tos 0x0, ttl 64, id 46601, offset 0, flags [DF], proto TCP (6), length 4036)
    127.0.0.1.11050 > 127.0.0.1.39622: Flags [P.], cksum 0x0db9 (incorrect -> 0x452a), seq 34084:38068, ack 878, win 512, options [nop,nop,TS val 771706583 ecr 771706580], length 3984
2022-04-05 04:47:42.224342 IP (tos 0x0, ttl 64, id 46602, offset 0, flags [DF], proto TCP (6), length 32820)
    127.0.0.1.11050 > 127.0.0.1.39622: Flags [.], cksum 0x7e29 (incorrect -> 0x727a), seq 38068:70836, ack 878, win 512, options [nop,nop,TS val 771706595 ecr 771706580], length 32768
2022-04-05 04:47:42.224405 IP (tos 0x0, ttl 64, id 60466, offset 0, flags [DF], proto TCP (6), length 52)
    127.0.0.1.39622 > 127.0.0.1.11050: Flags [.], cksum 0xfe28 (incorrect -> 0xd3e1), seq 878, ack 70836, win 379, options [nop,nop,TS val 771706596 ecr 771706583], length 0
2022-04-05 04:47:42.224410 IP (tos 0x0, ttl 64, id 46603, offset 0, flags [DF], proto TCP (6), length 4472)
    127.0.0.1.11050 > 127.0.0.1.39622: Flags [P.], cksum 0x0f6d (incorrect -> 0x5f7c), seq 70836:75256, ack 878, win 512, options [nop,nop,TS val 771706596 ecr 771706596], length 4420
2022-04-05 04:47:42.225133 IP (tos 0x0, ttl 64, id 60467, offset 0, flags [DF], proto TCP (6), length 52)
    127.0.0.1.39622 > 127.0.0.1.11050: Flags [.], cksum 0xfe28 (incorrect -> 0xc20b), seq 878, ack 75256, win 512, options [nop,nop,TS val 771706596 ecr 771706596], length 0
2022-04-05 04:47:42.225729 IP (tos 0x0, ttl 64, id 46604, offset 0, flags [DF], proto TCP (6), length 4100)
    127.0.0.1.11050 > 127.0.0.1.39622: Flags [P.], cksum 0x0df9 (incorrect -> 0xb274), seq 75256:79304, ack 878, win 512, options [nop,nop,TS val 771706597 ecr 771706596], length 4048
2022-04-05 04:47:42.225746 IP (tos 0x0, ttl 64, id 60468, offset 0, flags [DF], proto TCP (6), length 52)
    127.0.0.1.39622 > 127.0.0.1.11050: Flags [.], cksum 0xfe28 (incorrect -> 0xb239), seq 878, ack 79304, win 512, options [nop,nop,TS val 771706597 ecr 771706597], length 0
2022-04-05 04:47:42.225749 IP (tos 0x0, ttl 64, id 46605, offset 0, flags [DF], proto TCP (6), length 486)
    127.0.0.1.11050 > 127.0.0.1.39622: Flags [P.], cksum 0xffda (incorrect -> 0x047e), seq 79304:79738, ack 878, win 512, options [nop,nop,TS val 771706597 ecr 771706597], length 434
2022-04-05 04:47:42.225752 IP (tos 0x0, ttl 64, id 60469, offset 0, flags [DF], proto TCP (6), length 52)
    127.0.0.1.39622 > 127.0.0.1.11050: Flags [.], cksum 0xfe28 (incorrect -> 0xb087), seq 878, ack 79738, win 512, options [nop,nop,TS val 771706597 ecr 771706597], length 0
2022-04-05 04:47:42.228958 IP (tos 0x0, ttl 64, id 46606, offset 0, flags [DF], proto TCP (6), length 4100)
    127.0.0.1.11050 > 127.0.0.1.39622: Flags [P.], cksum 0x0df9 (incorrect -> 0x3eb4), seq 79738:83786, ack 878, win 512, options [nop,nop,TS val 771706600 ecr 771706597], length 4048
2022-04-05 04:47:42.228977 IP (tos 0x0, ttl 64, id 60470, offset 0, flags [DF], proto TCP (6), length 52)
    127.0.0.1.39622 > 127.0.0.1.11050: Flags [.], cksum 0xfe28 (incorrect -> 0xa0b1), seq 878, ack 83786, win 512, options [nop,nop,TS val 771706600 ecr 771706600], length 0
2022-04-05 04:47:42.228980 IP (tos 0x0, ttl 64, id 46607, offset 0, flags [DF], proto TCP (6), length 1704)
    127.0.0.1.11050 > 127.0.0.1.39622: Flags [P.], cksum 0x049d (incorrect -> 0x77a8), seq 83786:85438, ack 878, win 512, options [nop,nop,TS val 771706600 ecr 771706600], length 1652
2022-04-05 04:47:42.228983 IP (tos 0x0, ttl 64, id 60471, offset 0, flags [DF], proto TCP (6), length 52)
    127.0.0.1.39622 > 127.0.0.1.11050: Flags [.], cksum 0xfe28 (incorrect -> 0x9a3d), seq 878, ack 85438, win 512, options [nop,nop,TS val 771706600 ecr 771706600], length 0
2022-04-05 04:47:42.236900 IP (tos 0x0, ttl 64, id 46608, offset 0, flags [DF], proto TCP (6), length 1546)
    127.0.0.1.11050 > 127.0.0.1.39622: Flags [P.], cksum 0x03ff (incorrect -> 0x5781), seq 85438:86932, ack 878, win 512, options [nop,nop,TS val 771706608 ecr 771706600], length 1494
2022-04-05 04:47:42.237167 IP (tos 0x0, ttl 64, id 60472, offset 0, flags [DF], proto TCP (6), length 52)
    127.0.0.1.39622 > 127.0.0.1.11050: Flags [.], cksum 0xfe28 (incorrect -> 0x9457), seq 878, ack 86932, win 512, options [nop,nop,TS val 771706608 ecr 771706608], length 0
2022-04-05 04:47:42.238044 IP (tos 0x0, ttl 64, id 46609, offset 0, flags [DF], proto TCP (6), length 2902)
    127.0.0.1.11050 > 127.0.0.1.39622: Flags [P.], cksum 0x094b (incorrect -> 0x2e43), seq 86932:89782, ack 878, win 512, options [nop,nop,TS val 771706609 ecr 771706608], length 2850
2022-04-05 04:47:42.238058 IP (tos 0x0, ttl 64, id 60473, offset 0, flags [DF], proto TCP (6), length 52)
    127.0.0.1.39622 > 127.0.0.1.11050: Flags [.], cksum 0xfe28 (incorrect -> 0x8933), seq 878, ack 89782, win 512, options [nop,nop,TS val 771706609 ecr 771706609], length 0
2022-04-05 04:47:42.239527 IP (tos 0x0, ttl 64, id 46610, offset 0, flags [DF], proto TCP (6), length 3354)
    127.0.0.1.11050 > 127.0.0.1.39622: Flags [P.], cksum 0x0b0f (incorrect -> 0x88d5), seq 89782:93084, ack 878, win 512, options [nop,nop,TS val 771706611 ecr 771706609], length 3302
2022-04-05 04:47:42.239538 IP (tos 0x0, ttl 64, id 60474, offset 0, flags [DF], proto TCP (6), length 52)
    127.0.0.1.39622 > 127.0.0.1.11050: Flags [.], cksum 0xfe28 (incorrect -> 0x7c49), seq 878, ack 93084, win 512, options [nop,nop,TS val 771706611 ecr 771706611], length 0
2022-04-05 04:47:42.240006 IP (tos 0x0, ttl 64, id 46611, offset 0, flags [DF], proto TCP (6), length 3538)
    127.0.0.1.11050 > 127.0.0.1.39622: Flags [P.], cksum 0x0bc7 (incorrect -> 0xfef7), seq 93084:96570, ack 878, win 512, options [nop,nop,TS val 771706611 ecr 771706611], length 3486
2022-04-05 04:47:42.240018 IP (tos 0x0, ttl 64, id 60475, offset 0, flags [DF], proto TCP (6), length 52)
    127.0.0.1.39622 > 127.0.0.1.11050: Flags [.], cksum 0xfe28 (incorrect -> 0x6eab), seq 878, ack 96570, win 512, options [nop,nop,TS val 771706611 ecr 771706611], length 0
2022-04-05 04:47:42.241358 IP (tos 0x0, ttl 64, id 46612, offset 0, flags [DF], proto TCP (6), length 1048)
    127.0.0.1.11050 > 127.0.0.1.39622: Flags [P.], cksum 0x020d (incorrect -> 0xbff0), seq 96570:97566, ack 878, win 512, options [nop,nop,TS val 771706612 ecr 771706611], length 996
2022-04-05 04:47:42.241388 IP (tos 0x0, ttl 64, id 60476, offset 0, flags [DF], proto TCP (6), length 52)
    127.0.0.1.39622 > 127.0.0.1.11050: Flags [.], cksum 0xfe28 (incorrect -> 0x6ac5), seq 878, ack 97566, win 512, options [nop,nop,TS val 771706612 ecr 771706612], length 0
2022-04-05 04:47:42.244270 IP (tos 0x0, ttl 64, id 46613, offset 0, flags [DF], proto TCP (6), length 4100)
    127.0.0.1.11050 > 127.0.0.1.39622: Flags [P.], cksum 0x0df9 (incorrect -> 0x50a9), seq 97566:101614, ack 878, win 512, options [nop,nop,TS val 771706615 ecr 771706612], length 4048
2022-04-05 04:47:42.244295 IP (tos 0x0, ttl 64, id 60477, offset 0, flags [DF], proto TCP (6), length 52)
    127.0.0.1.39622 > 127.0.0.1.11050: Flags [.], cksum 0xfe28 (incorrect -> 0x5aef), seq 878, ack 101614, win 512, options [nop,nop,TS val 771706615 ecr 771706615], length 0
2022-04-05 04:47:42.244299 IP (tos 0x0, ttl 64, id 46614, offset 0, flags [DF], proto TCP (6), length 2654)
    127.0.0.1.11050 > 127.0.0.1.39622: Flags [P.], cksum 0x0853 (incorrect -> 0x114a), seq 101614:104216, ack 878, win 512, options [nop,nop,TS val 771706615 ecr 771706615], length 2602
2022-04-05 04:47:42.244656 IP (tos 0x0, ttl 64, id 60478, offset 0, flags [DF], proto TCP (6), length 52)
    127.0.0.1.39622 > 127.0.0.1.11050: Flags [.], cksum 0xfe28 (incorrect -> 0x50c4), seq 878, ack 104216, win 512, options [nop,nop,TS val 771706616 ecr 771706615], length 0
2022-04-05 04:47:42.245973 IP (tos 0x0, ttl 64, id 46615, offset 0, flags [DF], proto TCP (6), length 4100)
    127.0.0.1.11050 > 127.0.0.1.39622: Flags [P.], cksum 0x0df9 (incorrect -> 0x1e3b), seq 104216:108264, ack 878, win 512, options [nop,nop,TS val 771706617 ecr 771706616], length 4048
2022-04-05 04:47:42.246014 IP (tos 0x0, ttl 64, id 60479, offset 0, flags [DF], proto TCP (6), length 52)
    127.0.0.1.39622 > 127.0.0.1.11050: Flags [.], cksum 0xfe28 (incorrect -> 0x40f1), seq 878, ack 108264, win 512, options [nop,nop,TS val 771706617 ecr 771706617], length 0
2022-04-05 04:47:42.246018 IP (tos 0x0, ttl 64, id 46616, offset 0, flags [DF], proto TCP (6), length 3788)
    127.0.0.1.11050 > 127.0.0.1.39622: Flags [P.], cksum 0x0cc1 (incorrect -> 0x23b3), seq 108264:112000, ack 878, win 512, options [nop,nop,TS val 771706617 ecr 771706617], length 3736
2022-04-05 04:47:42.246021 IP (tos 0x0, ttl 64, id 60480, offset 0, flags [DF], proto TCP (6), length 52)
    127.0.0.1.39622 > 127.0.0.1.11050: Flags [.], cksum 0xfe28 (incorrect -> 0x3259), seq 878, ack 112000, win 512, options [nop,nop,TS val 771706617 ecr 771706617], length 0
2022-04-05 04:47:42.250005 IP (tos 0x0, ttl 64, id 46617, offset 0, flags [DF], proto TCP (6), length 4100)
    127.0.0.1.11050 > 127.0.0.1.39622: Flags [P.], cksum 0x0df9 (incorrect -> 0x4398), seq 112000:116048, ack 878, win 512, options [nop,nop,TS val 771706621 ecr 771706617], length 4048
2022-04-05 04:47:42.250103 IP (tos 0x0, ttl 64, id 60481, offset 0, flags [DF], proto TCP (6), length 52)
    127.0.0.1.39622 > 127.0.0.1.11050: Flags [.], cksum 0xfe28 (incorrect -> 0x2281), seq 878, ack 116048, win 512, options [nop,nop,TS val 771706621 ecr 771706621], length 0
200, 124.01364827156067, 0.27240753173828125