2022-04-05 12:53:04.706680 IP (tos 0x0, ttl 64, id 6445, offset 0, flags [DF], proto TCP (6), length 60)
    127.0.0.1.39112 > 127.0.0.1.10250: Flags [S], cksum 0xfe30 (incorrect -> 0x8346), seq 3051798295, win 65495, options [mss 65495,sackOK,TS val 245467209 ecr 0,nop,wscale 7], length 0
2022-04-05 12:53:04.706694 IP (tos 0x0, ttl 64, id 0, offset 0, flags [DF], proto TCP (6), length 60)
    127.0.0.1.10250 > 127.0.0.1.39112: Flags [S.], cksum 0xfe30 (incorrect -> 0x5f49), seq 966284149, ack 3051798296, win 65483, options [mss 65495,sackOK,TS val 245467209 ecr 245467209,nop,wscale 7], length 0
2022-04-05 12:53:04.706706 IP (tos 0x0, ttl 64, id 6446, offset 0, flags [DF], proto TCP (6), length 52)
    127.0.0.1.39112 > 127.0.0.1.10250: Flags [.], cksum 0xfe28 (incorrect -> 0x8605), seq 1, ack 1, win 512, options [nop,nop,TS val 245467209 ecr 245467209], length 0
2022-04-05 12:53:04.706811 IP (tos 0x0, ttl 64, id 6447, offset 0, flags [DF], proto TCP (6), length 55)
    127.0.0.1.39112 > 127.0.0.1.10250: Flags [P.], cksum 0xfe2b (incorrect -> 0x80f9), seq 1:4, ack 1, win 512, options [nop,nop,TS val 245467209 ecr 245467209], length 3
2022-04-05 12:53:04.706826 IP (tos 0x0, ttl 64, id 5617, offset 0, flags [DF], proto TCP (6), length 52)
    127.0.0.1.10250 > 127.0.0.1.39112: Flags [.], cksum 0xfe28 (incorrect -> 0x8602), seq 1, ack 4, win 512, options [nop,nop,TS val 245467209 ecr 245467209], length 0
2022-04-05 12:53:04.706910 IP (tos 0x0, ttl 64, id 5618, offset 0, flags [DF], proto TCP (6), length 54)
    127.0.0.1.10250 > 127.0.0.1.39112: Flags [P.], cksum 0xfe2a (incorrect -> 0x80f8), seq 1:3, ack 4, win 512, options [nop,nop,TS val 245467209 ecr 245467209], length 2
2022-04-05 12:53:04.706934 IP (tos 0x0, ttl 64, id 6448, offset 0, flags [DF], proto TCP (6), length 52)
    127.0.0.1.39112 > 127.0.0.1.10250: Flags [.], cksum 0xfe28 (incorrect -> 0x8600), seq 4, ack 3, win 512, options [nop,nop,TS val 245467209 ecr 245467209], length 0
2022-04-05 12:53:04.709463 IP (tos 0x0, ttl 64, id 6449, offset 0, flags [DF], proto TCP (6), length 62)
    127.0.0.1.39112 > 127.0.0.1.10250: Flags [P.], cksum 0xfe32 (incorrect -> 0xd965), seq 4:14, ack 3, win 512, options [nop,nop,TS val 245467212 ecr 245467209], length 10
2022-04-05 12:53:04.709473 IP (tos 0x0, ttl 64, id 5619, offset 0, flags [DF], proto TCP (6), length 52)
    127.0.0.1.10250 > 127.0.0.1.39112: Flags [.], cksum 0xfe28 (incorrect -> 0x85f0), seq 3, ack 14, win 512, options [nop,nop,TS val 245467212 ecr 245467212], length 0
2022-04-05 12:53:04.799175 IP (tos 0x0, ttl 64, id 5620, offset 0, flags [DF], proto TCP (6), length 62)
    127.0.0.1.10250 > 127.0.0.1.39112: Flags [P.], cksum 0xfe32 (incorrect -> 0x8083), seq 3:13, ack 14, win 512, options [nop,nop,TS val 245467302 ecr 245467212], length 10
2022-04-05 12:53:04.799185 IP (tos 0x0, ttl 64, id 6450, offset 0, flags [DF], proto TCP (6), length 52)
    127.0.0.1.39112 > 127.0.0.1.10250: Flags [.], cksum 0xfe28 (incorrect -> 0x8532), seq 14, ack 13, win 512, options [nop,nop,TS val 245467302 ecr 245467302], length 0
2022-04-05 12:53:04.805053 IP (tos 0x0, ttl 64, id 6451, offset 0, flags [DF], proto TCP (6), length 569)
    127.0.0.1.39112 > 127.0.0.1.10250: Flags [P.], cksum 0x002e (incorrect -> 0x9349), seq 14:531, ack 13, win 512, options [nop,nop,TS val 245467307 ecr 245467302], length 517
2022-04-05 12:53:04.805064 IP (tos 0x0, ttl 64, id 5621, offset 0, flags [DF], proto TCP (6), length 52)
    127.0.0.1.10250 > 127.0.0.1.39112: Flags [.], cksum 0xfe28 (incorrect -> 0x8326), seq 13, ack 531, win 508, options [nop,nop,TS val 245467308 ecr 245467307], length 0
2022-04-05 12:53:04.906357 IP (tos 0x0, ttl 64, id 5622, offset 0, flags [DF], proto TCP (6), length 3538)
    127.0.0.1.10250 > 127.0.0.1.39112: Flags [P.], cksum 0x0bc7 (incorrect -> 0x643d), seq 13:3499, ack 531, win 512, options [nop,nop,TS val 245467409 ecr 245467307], length 3486
2022-04-05 12:53:04.906374 IP (tos 0x0, ttl 64, id 6452, offset 0, flags [DF], proto TCP (6), length 52)
    127.0.0.1.39112 > 127.0.0.1.10250: Flags [.], cksum 0xfe28 (incorrect -> 0x74cb), seq 531, ack 3499, win 494, options [nop,nop,TS val 245467409 ecr 245467409], length 0
2022-04-05 12:53:04.925772 IP (tos 0x0, ttl 64, id 5623, offset 0, flags [DF], proto TCP (6), length 494)
    127.0.0.1.10250 > 127.0.0.1.39112: Flags [P.], cksum 0xffe2 (incorrect -> 0xd3f5), seq 3499:3941, ack 531, win 512, options [nop,nop,TS val 245467428 ecr 245467409], length 442
2022-04-05 12:53:04.925784 IP (tos 0x0, ttl 64, id 6453, offset 0, flags [DF], proto TCP (6), length 52)
    127.0.0.1.39112 > 127.0.0.1.10250: Flags [.], cksum 0xfe28 (incorrect -> 0x72df), seq 531, ack 3941, win 506, options [nop,nop,TS val 245467428 ecr 245467428], length 0
2022-04-05 12:53:04.928323 IP (tos 0x0, ttl 64, id 6454, offset 0, flags [DF], proto TCP (6), length 210)
    127.0.0.1.39112 > 127.0.0.1.10250: Flags [P.], cksum 0xfec6 (incorrect -> 0xcef8), seq 531:689, ack 3941, win 512, options [nop,nop,TS val 245467431 ecr 245467428], length 158
2022-04-05 12:53:04.928333 IP (tos 0x0, ttl 64, id 5624, offset 0, flags [DF], proto TCP (6), length 52)
    127.0.0.1.10250 > 127.0.0.1.39112: Flags [.], cksum 0xfe28 (incorrect -> 0x7236), seq 3941, ack 689, win 511, options [nop,nop,TS val 245467431 ecr 245467431], length 0
2022-04-05 12:53:05.124488 IP (tos 0x0, ttl 64, id 5625, offset 0, flags [DF], proto TCP (6), length 394)
    127.0.0.1.10250 > 127.0.0.1.39112: Flags [P.], cksum 0xff7e (incorrect -> 0x0699), seq 3941:4283, ack 689, win 512, options [nop,nop,TS val 245467627 ecr 245467431], length 342
2022-04-05 12:53:05.124498 IP (tos 0x0, ttl 64, id 6455, offset 0, flags [DF], proto TCP (6), length 52)
    127.0.0.1.39112 > 127.0.0.1.10250: Flags [.], cksum 0xfe28 (incorrect -> 0x6f59), seq 689, ack 4283, win 510, options [nop,nop,TS val 245467627 ecr 245467627], length 0
2022-04-05 12:53:05.124953 IP (tos 0x0, ttl 64, id 6456, offset 0, flags [DF], proto TCP (6), length 338)
    127.0.0.1.39112 > 127.0.0.1.10250: Flags [P.], cksum 0xff46 (incorrect -> 0x32de), seq 689:975, ack 4283, win 512, options [nop,nop,TS val 245467627 ecr 245467627], length 286
2022-04-05 12:53:05.124963 IP (tos 0x0, ttl 64, id 5626, offset 0, flags [DF], proto TCP (6), length 52)
    127.0.0.1.10250 > 127.0.0.1.39112: Flags [.], cksum 0xfe28 (incorrect -> 0x6e3b), seq 4283, ack 975, win 510, options [nop,nop,TS val 245467627 ecr 245467627], length 0
2022-04-05 12:53:05.378447 IP (tos 0x0, ttl 64, id 5627, offset 0, flags [DF], proto TCP (6), length 2382)
    127.0.0.1.10250 > 127.0.0.1.39112: Flags [P.], cksum 0x0743 (incorrect -> 0xf7ca), seq 4283:6613, ack 975, win 512, options [nop,nop,TS val 245467881 ecr 245467627], length 2330
2022-04-05 12:53:05.381000 IP (tos 0x0, ttl 64, id 6457, offset 0, flags [DF], proto TCP (6), length 664)
    127.0.0.1.39112 > 127.0.0.1.10250: Flags [P.], cksum 0x008d (incorrect -> 0x9148), seq 975:1587, ack 6613, win 512, options [nop,nop,TS val 245467883 ecr 245467881], length 612
2022-04-05 12:53:05.381013 IP (tos 0x0, ttl 64, id 5628, offset 0, flags [DF], proto TCP (6), length 52)
    127.0.0.1.10250 > 127.0.0.1.39112: Flags [.], cksum 0xfe28 (incorrect -> 0x60bf), seq 6613, ack 1587, win 508, options [nop,nop,TS val 245467883 ecr 245467883], length 0
2022-04-05 12:53:05.759923 IP (tos 0x0, ttl 64, id 5629, offset 0, flags [DF], proto TCP (6), length 3379)
    127.0.0.1.10250 > 127.0.0.1.39112: Flags [P.], cksum 0x0b28 (incorrect -> 0xfd7f), seq 6613:9940, ack 1587, win 512, options [nop,nop,TS val 245468262 ecr 245467883], length 3327
2022-04-05 12:53:05.802697 IP (tos 0x0, ttl 64, id 6458, offset 0, flags [DF], proto TCP (6), length 52)
    127.0.0.1.39112 > 127.0.0.1.10250: Flags [.], cksum 0xfe28 (incorrect -> 0x509b), seq 1587, ack 9940, win 512, options [nop,nop,TS val 245468305 ecr 245468262], length 0
2022-04-05 12:53:05.802707 IP (tos 0x0, ttl 64, id 5630, offset 0, flags [DF], proto TCP (6), length 7522)
    127.0.0.1.10250 > 127.0.0.1.39112: Flags [P.], cksum 0x1b57 (incorrect -> 0xe01d), seq 9940:17410, ack 1587, win 512, options [nop,nop,TS val 245468305 ecr 245468305], length 7470
2022-04-05 12:53:05.802714 IP (tos 0x0, ttl 64, id 6459, offset 0, flags [DF], proto TCP (6), length 52)
    127.0.0.1.39112 > 127.0.0.1.10250: Flags [.], cksum 0xfe28 (incorrect -> 0x3364), seq 1587, ack 17410, win 478, options [nop,nop,TS val 245468305 ecr 245468305], length 0
2022-04-05 12:53:05.817220 IP (tos 0x0, ttl 64, id 5631, offset 0, flags [DF], proto TCP (6), length 3267)
    127.0.0.1.10250 > 127.0.0.1.39112: Flags [P.], cksum 0x0ab8 (incorrect -> 0x973b), seq 17410:20625, ack 1587, win 512, options [nop,nop,TS val 245468320 ecr 245468305], length 3215
2022-04-05 12:53:05.817229 IP (tos 0x0, ttl 64, id 6460, offset 0, flags [DF], proto TCP (6), length 52)
    127.0.0.1.39112 > 127.0.0.1.10250: Flags [.], cksum 0xfe28 (incorrect -> 0x26a6), seq 1587, ack 20625, win 495, options [nop,nop,TS val 245468320 ecr 245468320], length 0
2022-04-05 12:53:05.831204 IP (tos 0x0, ttl 64, id 5632, offset 0, flags [DF], proto TCP (6), length 3748)
    127.0.0.1.10250 > 127.0.0.1.39112: Flags [P.], cksum 0x0c99 (incorrect -> 0x2769), seq 20625:24321, ack 1587, win 512, options [nop,nop,TS val 245468334 ecr 245468320], length 3696
2022-04-05 12:53:05.831221 IP (tos 0x0, ttl 64, id 6461, offset 0, flags [DF], proto TCP (6), length 52)
    127.0.0.1.39112 > 127.0.0.1.10250: Flags [.], cksum 0xfe28 (incorrect -> 0x181c), seq 1587, ack 24321, win 493, options [nop,nop,TS val 245468334 ecr 245468334], length 0
2022-04-05 12:53:05.845155 IP (tos 0x0, ttl 64, id 5633, offset 0, flags [DF], proto TCP (6), length 1048)
    127.0.0.1.10250 > 127.0.0.1.39112: Flags [P.], cksum 0x020d (incorrect -> 0xc178), seq 24321:25317, ack 1587, win 512, options [nop,nop,TS val 245468348 ecr 245468334], length 996
2022-04-05 12:53:05.845169 IP (tos 0x0, ttl 64, id 6462, offset 0, flags [DF], proto TCP (6), length 52)
    127.0.0.1.39112 > 127.0.0.1.10250: Flags [.], cksum 0xfe28 (incorrect -> 0x1411), seq 1587, ack 25317, win 504, options [nop,nop,TS val 245468348 ecr 245468348], length 0
2022-04-05 12:53:05.878627 IP (tos 0x0, ttl 64, id 5634, offset 0, flags [DF], proto TCP (6), length 3538)
    127.0.0.1.10250 > 127.0.0.1.39112: Flags [P.], cksum 0x0bc7 (incorrect -> 0x3885), seq 25317:28803, ack 1587, win 512, options [nop,nop,TS val 245468381 ecr 245468348], length 3486
200, 3.8584866523742676, 1.4937756061553955