2022-04-05 17:46:25.854242 IP (tos 0x0, ttl 64, id 64578, offset 0, flags [DF], proto TCP (6), length 60)
    127.0.0.1.44842 > 127.0.0.1.10650: Flags [S], cksum 0xfe30 (incorrect -> 0x99d8), seq 4218730364, win 65495, options [mss 65495,sackOK,TS val 263068357 ecr 0,nop,wscale 7], length 0
2022-04-05 17:46:25.854252 IP (tos 0x0, ttl 64, id 0, offset 0, flags [DF], proto TCP (6), length 60)
    127.0.0.1.10650 > 127.0.0.1.44842: Flags [S.], cksum 0xfe30 (incorrect -> 0xb4aa), seq 3436703197, ack 4218730365, win 65483, options [mss 65495,sackOK,TS val 263068357 ecr 263068357,nop,wscale 7], length 0
2022-04-05 17:46:25.854262 IP (tos 0x0, ttl 64, id 64579, offset 0, flags [DF], proto TCP (6), length 52)
    127.0.0.1.44842 > 127.0.0.1.10650: Flags [.], cksum 0xfe28 (incorrect -> 0xdb66), seq 1, ack 1, win 512, options [nop,nop,TS val 263068357 ecr 263068357], length 0
2022-04-05 17:46:25.854344 IP (tos 0x0, ttl 64, id 64580, offset 0, flags [DF], proto TCP (6), length 55)
    127.0.0.1.44842 > 127.0.0.1.10650: Flags [P.], cksum 0xfe2b (incorrect -> 0xd65a), seq 1:4, ack 1, win 512, options [nop,nop,TS val 263068357 ecr 263068357], length 3
2022-04-05 17:46:25.854349 IP (tos 0x0, ttl 64, id 35572, offset 0, flags [DF], proto TCP (6), length 52)
    127.0.0.1.10650 > 127.0.0.1.44842: Flags [.], cksum 0xfe28 (incorrect -> 0xdb63), seq 1, ack 4, win 512, options [nop,nop,TS val 263068357 ecr 263068357], length 0
2022-04-05 17:46:25.854412 IP (tos 0x0, ttl 64, id 35573, offset 0, flags [DF], proto TCP (6), length 54)
    127.0.0.1.10650 > 127.0.0.1.44842: Flags [P.], cksum 0xfe2a (incorrect -> 0xd659), seq 1:3, ack 4, win 512, options [nop,nop,TS val 263068357 ecr 263068357], length 2
2022-04-05 17:46:25.854419 IP (tos 0x0, ttl 64, id 64581, offset 0, flags [DF], proto TCP (6), length 52)
    127.0.0.1.44842 > 127.0.0.1.10650: Flags [.], cksum 0xfe28 (incorrect -> 0xdb61), seq 4, ack 3, win 512, options [nop,nop,TS val 263068357 ecr 263068357], length 0
2022-04-05 17:46:25.856468 IP (tos 0x0, ttl 64, id 64582, offset 0, flags [DF], proto TCP (6), length 62)
    127.0.0.1.44842 > 127.0.0.1.10650: Flags [P.], cksum 0xfe32 (incorrect -> 0xbc53), seq 4:14, ack 3, win 512, options [nop,nop,TS val 263068359 ecr 263068357], length 10
2022-04-05 17:46:25.856478 IP (tos 0x0, ttl 64, id 35574, offset 0, flags [DF], proto TCP (6), length 52)
    127.0.0.1.10650 > 127.0.0.1.44842: Flags [.], cksum 0xfe28 (incorrect -> 0xdb53), seq 3, ack 14, win 512, options [nop,nop,TS val 263068359 ecr 263068359], length 0
2022-04-05 17:46:25.935586 IP (tos 0x0, ttl 64, id 35575, offset 0, flags [DF], proto TCP (6), length 62)
    127.0.0.1.10650 > 127.0.0.1.44842: Flags [P.], cksum 0xfe32 (incorrect -> 0xd5f1), seq 3:13, ack 14, win 512, options [nop,nop,TS val 263068438 ecr 263068359], length 10
2022-04-05 17:46:25.935593 IP (tos 0x0, ttl 64, id 64583, offset 0, flags [DF], proto TCP (6), length 52)
    127.0.0.1.44842 > 127.0.0.1.10650: Flags [.], cksum 0xfe28 (incorrect -> 0xdaab), seq 14, ack 13, win 512, options [nop,nop,TS val 263068438 ecr 263068438], length 0
2022-04-05 17:46:25.940862 IP (tos 0x0, ttl 64, id 64584, offset 0, flags [DF], proto TCP (6), length 569)
    127.0.0.1.44842 > 127.0.0.1.10650: Flags [P.], cksum 0x002e (incorrect -> 0xc432), seq 14:531, ack 13, win 512, options [nop,nop,TS val 263068443 ecr 263068438], length 517
2022-04-05 17:46:25.940874 IP (tos 0x0, ttl 64, id 35576, offset 0, flags [DF], proto TCP (6), length 52)
    127.0.0.1.10650 > 127.0.0.1.44842: Flags [.], cksum 0xfe28 (incorrect -> 0xd8a0), seq 13, ack 531, win 508, options [nop,nop,TS val 263068443 ecr 263068443], length 0
200, 3.888176918029785, 0.5793116092681885