2022-04-05 12:22:15.980191 IP (tos 0x0, ttl 64, id 57364, offset 0, flags [DF], proto TCP (6), length 60)
    127.0.0.1.50206 > 127.0.0.1.11250: Flags [S], cksum 0xfe30 (incorrect -> 0x879c), seq 1325017122, win 65495, options [mss 65495,sackOK,TS val 243618483 ecr 0,nop,wscale 7], length 0
2022-04-05 12:22:15.980205 IP (tos 0x0, ttl 64, id 0, offset 0, flags [DF], proto TCP (6), length 60)
    127.0.0.1.11250 > 127.0.0.1.50206: Flags [S.], cksum 0xfe30 (incorrect -> 0x8b53), seq 966812011, ack 1325017123, win 65483, options [mss 65495,sackOK,TS val 243618483 ecr 243618483,nop,wscale 7], length 0
2022-04-05 12:22:15.980214 IP (tos 0x0, ttl 64, id 57365, offset 0, flags [DF], proto TCP (6), length 52)
    127.0.0.1.50206 > 127.0.0.1.11250: Flags [.], cksum 0xfe28 (incorrect -> 0xb20f), seq 1, ack 1, win 512, options [nop,nop,TS val 243618483 ecr 243618483], length 0
2022-04-05 12:22:15.980325 IP (tos 0x0, ttl 64, id 57366, offset 0, flags [DF], proto TCP (6), length 55)
    127.0.0.1.50206 > 127.0.0.1.11250: Flags [P.], cksum 0xfe2b (incorrect -> 0xad03), seq 1:4, ack 1, win 512, options [nop,nop,TS val 243618483 ecr 243618483], length 3
2022-04-05 12:22:15.980339 IP (tos 0x0, ttl 64, id 36544, offset 0, flags [DF], proto TCP (6), length 52)
    127.0.0.1.11250 > 127.0.0.1.50206: Flags [.], cksum 0xfe28 (incorrect -> 0xb20c), seq 1, ack 4, win 512, options [nop,nop,TS val 243618483 ecr 243618483], length 0
2022-04-05 12:22:15.980370 IP (tos 0x0, ttl 64, id 36545, offset 0, flags [DF], proto TCP (6), length 54)
    127.0.0.1.11250 > 127.0.0.1.50206: Flags [P.], cksum 0xfe2a (incorrect -> 0xad02), seq 1:3, ack 4, win 512, options [nop,nop,TS val 243618483 ecr 243618483], length 2
2022-04-05 12:22:15.980383 IP (tos 0x0, ttl 64, id 57367, offset 0, flags [DF], proto TCP (6), length 52)
    127.0.0.1.50206 > 127.0.0.1.11250: Flags [.], cksum 0xfe28 (incorrect -> 0xb20a), seq 4, ack 3, win 512, options [nop,nop,TS val 243618483 ecr 243618483], length 0
2022-04-05 12:22:15.982420 IP (tos 0x0, ttl 64, id 57368, offset 0, flags [DF], proto TCP (6), length 62)
    127.0.0.1.50206 > 127.0.0.1.11250: Flags [P.], cksum 0xfe32 (incorrect -> 0x9524), seq 4:14, ack 3, win 512, options [nop,nop,TS val 243618485 ecr 243618483], length 10
2022-04-05 12:22:15.982429 IP (tos 0x0, ttl 64, id 36546, offset 0, flags [DF], proto TCP (6), length 52)
    127.0.0.1.11250 > 127.0.0.1.50206: Flags [.], cksum 0xfe28 (incorrect -> 0xb1fc), seq 3, ack 14, win 512, options [nop,nop,TS val 243618485 ecr 243618485], length 0
2022-04-05 12:22:16.047387 IP (tos 0x0, ttl 64, id 36547, offset 0, flags [DF], proto TCP (6), length 62)
    127.0.0.1.11250 > 127.0.0.1.50206: Flags [P.], cksum 0xfe32 (incorrect -> 0xaca8), seq 3:13, ack 14, win 512, options [nop,nop,TS val 243618550 ecr 243618485], length 10
2022-04-05 12:22:16.047398 IP (tos 0x0, ttl 64, id 57369, offset 0, flags [DF], proto TCP (6), length 52)
    127.0.0.1.50206 > 127.0.0.1.11250: Flags [.], cksum 0xfe28 (incorrect -> 0xb170), seq 14, ack 13, win 512, options [nop,nop,TS val 243618550 ecr 243618550], length 0
2022-04-05 12:22:16.053349 IP (tos 0x0, ttl 64, id 57370, offset 0, flags [DF], proto TCP (6), length 569)
    127.0.0.1.50206 > 127.0.0.1.11250: Flags [P.], cksum 0x002e (incorrect -> 0xc693), seq 14:531, ack 13, win 512, options [nop,nop,TS val 243618556 ecr 243618550], length 517
2022-04-05 12:22:16.053360 IP (tos 0x0, ttl 64, id 36548, offset 0, flags [DF], proto TCP (6), length 52)
    127.0.0.1.11250 > 127.0.0.1.50206: Flags [.], cksum 0xfe28 (incorrect -> 0xaf63), seq 13, ack 531, win 508, options [nop,nop,TS val 243618556 ecr 243618556], length 0
2022-04-05 12:22:16.118375 IP (tos 0x0, ttl 64, id 36549, offset 0, flags [DF], proto TCP (6), length 2865)
    127.0.0.1.11250 > 127.0.0.1.50206: Flags [P.], cksum 0x0926 (incorrect -> 0x74c2), seq 13:2826, ack 531, win 512, options [nop,nop,TS val 243618621 ecr 243618556], length 2813
2022-04-05 12:22:16.118383 IP (tos 0x0, ttl 64, id 57371, offset 0, flags [DF], proto TCP (6), length 52)
    127.0.0.1.50206 > 127.0.0.1.11250: Flags [.], cksum 0xfe28 (incorrect -> 0xa3ef), seq 531, ack 2826, win 497, options [nop,nop,TS val 243618621 ecr 243618621], length 0
2022-04-05 12:22:16.119755 IP (tos 0x0, ttl 64, id 57372, offset 0, flags [DF], proto TCP (6), length 116)
    127.0.0.1.50206 > 127.0.0.1.11250: Flags [P.], cksum 0xfe68 (incorrect -> 0xf831), seq 531:595, ack 2826, win 512, options [nop,nop,TS val 243618622 ecr 243618621], length 64
2022-04-05 12:22:16.119765 IP (tos 0x0, ttl 64, id 36550, offset 0, flags [DF], proto TCP (6), length 52)
    127.0.0.1.11250 > 127.0.0.1.50206: Flags [.], cksum 0xfe28 (incorrect -> 0xa39e), seq 2826, ack 595, win 512, options [nop,nop,TS val 243618622 ecr 243618622], length 0
2022-04-05 12:22:16.120169 IP (tos 0x0, ttl 64, id 57373, offset 0, flags [DF], proto TCP (6), length 346)
    127.0.0.1.50206 > 127.0.0.1.11250: Flags [P.], cksum 0xff4e (incorrect -> 0x5eb3), seq 595:889, ack 2826, win 512, options [nop,nop,TS val 243618623 ecr 243618622], length 294
2022-04-05 12:22:16.120178 IP (tos 0x0, ttl 64, id 36551, offset 0, flags [DF], proto TCP (6), length 52)
    127.0.0.1.11250 > 127.0.0.1.50206: Flags [.], cksum 0xfe28 (incorrect -> 0xa278), seq 2826, ack 889, win 510, options [nop,nop,TS val 243618623 ecr 243618623], length 0
2022-04-05 12:22:16.184376 IP (tos 0x0, ttl 64, id 36552, offset 0, flags [DF], proto TCP (6), length 307)
    127.0.0.1.11250 > 127.0.0.1.50206: Flags [P.], cksum 0xff27 (incorrect -> 0xaa12), seq 2826:3081, ack 889, win 512, options [nop,nop,TS val 243618687 ecr 243618623], length 255
2022-04-05 12:22:16.184386 IP (tos 0x0, ttl 64, id 57374, offset 0, flags [DF], proto TCP (6), length 52)
    127.0.0.1.50206 > 127.0.0.1.11250: Flags [.], cksum 0xfe28 (incorrect -> 0xa0f8), seq 889, ack 3081, win 511, options [nop,nop,TS val 243618687 ecr 243618687], length 0
2022-04-05 12:22:16.433902 IP (tos 0x0, ttl 64, id 36553, offset 0, flags [DF], proto TCP (6), length 3538)
    127.0.0.1.11250 > 127.0.0.1.50206: Flags [P.], cksum 0x0bc7 (incorrect -> 0x5117), seq 3081:6567, ack 889, win 512, options [nop,nop,TS val 243618936 ecr 243618687], length 3486
2022-04-05 12:22:16.433911 IP (tos 0x0, ttl 64, id 57375, offset 0, flags [DF], proto TCP (6), length 52)
    127.0.0.1.50206 > 127.0.0.1.11250: Flags [.], cksum 0xfe28 (incorrect -> 0x9179), seq 889, ack 6567, win 494, options [nop,nop,TS val 243618936 ecr 243618936], length 0
2022-04-05 12:22:16.461520 IP (tos 0x0, ttl 64, id 36554, offset 0, flags [DF], proto TCP (6), length 2157)
    127.0.0.1.11250 > 127.0.0.1.50206: Flags [P.], cksum 0x0662 (incorrect -> 0x91b9), seq 6567:8672, ack 889, win 512, options [nop,nop,TS val 243618964 ecr 243618936], length 2105
2022-04-05 12:22:16.461531 IP (tos 0x0, ttl 64, id 57376, offset 0, flags [DF], proto TCP (6), length 52)
    127.0.0.1.50206 > 127.0.0.1.11250: Flags [.], cksum 0xfe28 (incorrect -> 0x8903), seq 889, ack 8672, win 499, options [nop,nop,TS val 243618964 ecr 243618964], length 0
2022-04-05 12:22:16.977833 IP (tos 0x0, ttl 64, id 36555, offset 0, flags [DF], proto TCP (6), length 3538)
    127.0.0.1.11250 > 127.0.0.1.50206: Flags [P.], cksum 0x0bc7 (incorrect -> 0x4552), seq 8672:12158, ack 889, win 512, options [nop,nop,TS val 243619480 ecr 243618964], length 3486
2022-04-05 12:22:16.977843 IP (tos 0x0, ttl 64, id 57377, offset 0, flags [DF], proto TCP (6), length 52)
    127.0.0.1.50206 > 127.0.0.1.11250: Flags [.], cksum 0xfe28 (incorrect -> 0x7762), seq 889, ack 12158, win 494, options [nop,nop,TS val 243619480 ecr 243619480], length 0
2022-04-05 12:22:16.980543 IP (tos 0x0, ttl 64, id 36556, offset 0, flags [DF], proto TCP (6), length 4036)
    127.0.0.1.11250 > 127.0.0.1.50206: Flags [P.], cksum 0x0db9 (incorrect -> 0x4116), seq 12158:16142, ack 889, win 512, options [nop,nop,TS val 243619483 ecr 243619480], length 3984
2022-04-05 12:22:16.980549 IP (tos 0x0, ttl 64, id 57378, offset 0, flags [DF], proto TCP (6), length 52)
    127.0.0.1.50206 > 127.0.0.1.11250: Flags [.], cksum 0xfe28 (incorrect -> 0x67ce), seq 889, ack 16142, win 492, options [nop,nop,TS val 243619483 ecr 243619483], length 0
2022-04-05 12:22:16.995846 IP (tos 0x0, ttl 64, id 36557, offset 0, flags [DF], proto TCP (6), length 4036)
    127.0.0.1.11250 > 127.0.0.1.50206: Flags [P.], cksum 0x0db9 (incorrect -> 0x8837), seq 16142:20126, ack 889, win 512, options [nop,nop,TS val 243619498 ecr 243619483], length 3984
2022-04-05 12:22:16.995852 IP (tos 0x0, ttl 64, id 57379, offset 0, flags [DF], proto TCP (6), length 52)
    127.0.0.1.50206 > 127.0.0.1.11250: Flags [.], cksum 0xfe28 (incorrect -> 0x5820), seq 889, ack 20126, win 492, options [nop,nop,TS val 243619498 ecr 243619498], length 0
2022-04-05 12:22:16.999181 IP (tos 0x0, ttl 64, id 36558, offset 0, flags [DF], proto TCP (6), length 4100)
    127.0.0.1.11250 > 127.0.0.1.50206: Flags [P.], cksum 0x0df9 (incorrect -> 0x642a), seq 20126:24174, ack 889, win 512, options [nop,nop,TS val 243619502 ecr 243619498], length 4048
2022-04-05 12:22:16.999187 IP (tos 0x0, ttl 64, id 57380, offset 0, flags [DF], proto TCP (6), length 52)
    127.0.0.1.50206 > 127.0.0.1.11250: Flags [.], cksum 0xfe28 (incorrect -> 0x4848), seq 889, ack 24174, win 492, options [nop,nop,TS val 243619502 ecr 243619502], length 0
2022-04-05 12:22:16.999193 IP (tos 0x0, ttl 64, id 36559, offset 0, flags [DF], proto TCP (6), length 1832)
    127.0.0.1.11250 > 127.0.0.1.50206: Flags [P.], cksum 0x051d (incorrect -> 0xb297), seq 24174:25954, ack 889, win 512, options [nop,nop,TS val 243619502 ecr 243619502], length 1780
2022-04-05 12:22:16.999197 IP (tos 0x0, ttl 64, id 57381, offset 0, flags [DF], proto TCP (6), length 52)
    127.0.0.1.50206 > 127.0.0.1.11250: Flags [.], cksum 0xfe28 (incorrect -> 0x415b), seq 889, ack 25954, win 485, options [nop,nop,TS val 243619502 ecr 243619502], length 0
2022-04-05 12:22:16.999244 IP (tos 0x0, ttl 64, id 36560, offset 0, flags [DF], proto TCP (6), length 4036)
    127.0.0.1.11250 > 127.0.0.1.50206: Flags [P.], cksum 0x0db9 (incorrect -> 0x4da5), seq 25954:29938, ack 889, win 512, options [nop,nop,TS val 243619502 ecr 243619502], length 3984
2022-04-05 12:22:16.999248 IP (tos 0x0, ttl 64, id 57382, offset 0, flags [DF], proto TCP (6), length 52)
    127.0.0.1.50206 > 127.0.0.1.11250: Flags [.], cksum 0xfe28 (incorrect -> 0x31db), seq 889, ack 29938, win 469, options [nop,nop,TS val 243619502 ecr 243619502], length 0
2022-04-05 12:22:17.008407 IP (tos 0x0, ttl 64, id 36561, offset 0, flags [DF], proto TCP (6), length 4036)
    127.0.0.1.11250 > 127.0.0.1.50206: Flags [P.], cksum 0x0db9 (incorrect -> 0x7240), seq 29938:33922, ack 889, win 512, options [nop,nop,TS val 243619511 ecr 243619502], length 3984
2022-04-05 12:22:17.008414 IP (tos 0x0, ttl 64, id 57383, offset 0, flags [DF], proto TCP (6), length 52)
    127.0.0.1.50206 > 127.0.0.1.11250: Flags [.], cksum 0xfe28 (incorrect -> 0x2222), seq 889, ack 33922, win 492, options [nop,nop,TS val 243619511 ecr 243619511], length 0
2022-04-05 12:22:17.008446 IP (tos 0x0, ttl 64, id 36562, offset 0, flags [DF], proto TCP (6), length 3538)
    127.0.0.1.11250 > 127.0.0.1.50206: Flags [P.], cksum 0x0bc7 (incorrect -> 0xbe5b), seq 33922:37408, ack 889, win 512, options [nop,nop,TS val 243619511 ecr 243619511], length 3486
2022-04-05 12:22:17.008450 IP (tos 0x0, ttl 64, id 57384, offset 0, flags [DF], proto TCP (6), length 52)
    127.0.0.1.50206 > 127.0.0.1.11250: Flags [.], cksum 0xfe28 (incorrect -> 0x1492), seq 889, ack 37408, win 478, options [nop,nop,TS val 243619511 ecr 243619511], length 0
2022-04-05 12:22:17.017207 IP (tos 0x0, ttl 64, id 36563, offset 0, flags [DF], proto TCP (6), length 4100)
    127.0.0.1.11250 > 127.0.0.1.50206: Flags [P.], cksum 0x0df9 (incorrect -> 0xc8db), seq 37408:41456, ack 889, win 512, options [nop,nop,TS val 243619520 ecr 243619511], length 4048
2022-04-05 12:22:17.017213 IP (tos 0x0, ttl 64, id 57385, offset 0, flags [DF], proto TCP (6), length 52)
    127.0.0.1.50206 > 127.0.0.1.11250: Flags [.], cksum 0xfe28 (incorrect -> 0x04a2), seq 889, ack 41456, win 492, options [nop,nop,TS val 243619520 ecr 243619520], length 0
2022-04-05 12:22:17.017220 IP (tos 0x0, ttl 64, id 36564, offset 0, flags [DF], proto TCP (6), length 3474)
    127.0.0.1.11250 > 127.0.0.1.50206: Flags [P.], cksum 0x0b87 (incorrect -> 0xa76f), seq 41456:44878, ack 889, win 512, options [nop,nop,TS val 243619520 ecr 243619520], length 3422
2022-04-05 12:22:17.017250 IP (tos 0x0, ttl 64, id 57386, offset 0, flags [DF], proto TCP (6), length 52)
    127.0.0.1.50206 > 127.0.0.1.11250: Flags [.], cksum 0xfe28 (incorrect -> 0xf72f), seq 889, ack 44878, win 512, options [nop,nop,TS val 243619520 ecr 243619520], length 0
2022-04-05 12:22:17.017254 IP (tos 0x0, ttl 64, id 36565, offset 0, flags [DF], proto TCP (6), length 1048)
    127.0.0.1.11250 > 127.0.0.1.50206: Flags [P.], cksum 0x020d (incorrect -> 0x36bd), seq 44878:45874, ack 889, win 512, options [nop,nop,TS val 243619520 ecr 243619520], length 996
2022-04-05 12:22:17.017258 IP (tos 0x0, ttl 64, id 57387, offset 0, flags [DF], proto TCP (6), length 52)
    127.0.0.1.50206 > 127.0.0.1.11250: Flags [.], cksum 0xfe28 (incorrect -> 0xf34b), seq 889, ack 45874, win 512, options [nop,nop,TS val 243619520 ecr 243619520], length 0
2022-04-05 12:22:17.020563 IP (tos 0x0, ttl 64, id 36566, offset 0, flags [DF], proto TCP (6), length 4100)
    127.0.0.1.11250 > 127.0.0.1.50206: Flags [P.], cksum 0x0df9 (incorrect -> 0xd21a), seq 45874:49922, ack 889, win 512, options [nop,nop,TS val 243619523 ecr 243619520], length 4048
2022-04-05 12:22:17.029827 IP (tos 0x0, ttl 64, id 36567, offset 0, flags [DF], proto TCP (6), length 32820)
    127.0.0.1.11250 > 127.0.0.1.50206: Flags [.], cksum 0x7e29 (incorrect -> 0xf7d5), seq 49922:82690, ack 889, win 512, options [nop,nop,TS val 243619532 ecr 243619520], length 32768
2022-04-05 12:22:17.029861 IP (tos 0x0, ttl 64, id 57388, offset 0, flags [DF], proto TCP (6), length 52)
    127.0.0.1.50206 > 127.0.0.1.11250: Flags [.], cksum 0xfe28 (incorrect -> 0x63f1), seq 889, ack 82690, win 379, options [nop,nop,TS val 243619532 ecr 243619523], length 0
2022-04-05 12:22:17.029866 IP (tos 0x0, ttl 64, id 36568, offset 0, flags [DF], proto TCP (6), length 1562)
    127.0.0.1.11250 > 127.0.0.1.50206: Flags [P.], cksum 0x040f (incorrect -> 0x5376), seq 82690:84200, ack 889, win 512, options [nop,nop,TS val 243619532 ecr 243619532], length 1510
2022-04-05 12:22:17.030496 IP (tos 0x0, ttl 64, id 57389, offset 0, flags [DF], proto TCP (6), length 52)
    127.0.0.1.50206 > 127.0.0.1.11250: Flags [.], cksum 0xfe28 (incorrect -> 0x5d7c), seq 889, ack 84200, win 512, options [nop,nop,TS val 243619533 ecr 243619532], length 0
2022-04-05 12:22:17.038665 IP (tos 0x0, ttl 64, id 36569, offset 0, flags [DF], proto TCP (6), length 4100)
    127.0.0.1.11250 > 127.0.0.1.50206: Flags [P.], cksum 0x0df9 (incorrect -> 0x45a0), seq 84200:88248, ack 889, win 512, options [nop,nop,TS val 243619541 ecr 243619533], length 4048
2022-04-05 12:22:17.038765 IP (tos 0x0, ttl 64, id 57390, offset 0, flags [DF], proto TCP (6), length 52)
    127.0.0.1.50206 > 127.0.0.1.11250: Flags [.], cksum 0xfe28 (incorrect -> 0x4d9b), seq 889, ack 88248, win 512, options [nop,nop,TS val 243619541 ecr 243619541], length 0
2022-04-05 12:22:17.038772 IP (tos 0x0, ttl 64, id 36570, offset 0, flags [DF], proto TCP (6), length 11462)
    127.0.0.1.11250 > 127.0.0.1.50206: Flags [P.], cksum 0x2abb (incorrect -> 0x41ec), seq 88248:99658, ack 889, win 512, options [nop,nop,TS val 243619541 ecr 243619541], length 11410
2022-04-05 12:22:17.039200 IP (tos 0x0, ttl 64, id 57391, offset 0, flags [DF], proto TCP (6), length 52)
    127.0.0.1.50206 > 127.0.0.1.11250: Flags [.], cksum 0xfe28 (incorrect -> 0x2108), seq 889, ack 99658, win 512, options [nop,nop,TS val 243619542 ecr 243619541], length 0
2022-04-05 12:22:17.040646 IP (tos 0x0, ttl 64, id 36571, offset 0, flags [DF], proto TCP (6), length 3538)
    127.0.0.1.11250 > 127.0.0.1.50206: Flags [P.], cksum 0x0bc7 (incorrect -> 0x87d8), seq 99658:103144, ack 889, win 512, options [nop,nop,TS val 243619543 ecr 243619542], length 3486
2022-04-05 12:22:17.040658 IP (tos 0x0, ttl 64, id 57392, offset 0, flags [DF], proto TCP (6), length 52)
    127.0.0.1.50206 > 127.0.0.1.11250: Flags [.], cksum 0xfe28 (incorrect -> 0x1367), seq 889, ack 103144, win 512, options [nop,nop,TS val 243619543 ecr 243619543], length 0
2022-04-05 12:22:17.041820 IP (tos 0x0, ttl 64, id 36572, offset 0, flags [DF], proto TCP (6), length 4100)
    127.0.0.1.11250 > 127.0.0.1.50206: Flags [P.], cksum 0x0df9 (incorrect -> 0xf708), seq 103144:107192, ack 889, win 512, options [nop,nop,TS val 243619544 ecr 243619543], length 4048
2022-04-05 12:22:17.041839 IP (tos 0x0, ttl 64, id 57393, offset 0, flags [DF], proto TCP (6), length 52)
    127.0.0.1.50206 > 127.0.0.1.11250: Flags [.], cksum 0xfe28 (incorrect -> 0x0395), seq 889, ack 107192, win 512, options [nop,nop,TS val 243619544 ecr 243619544], length 0
2022-04-05 12:22:17.041843 IP (tos 0x0, ttl 64, id 36573, offset 0, flags [DF], proto TCP (6), length 3972)
    127.0.0.1.11250 > 127.0.0.1.50206: Flags [P.], cksum 0x0d79 (incorrect -> 0x699d), seq 107192:111112, ack 889, win 512, options [nop,nop,TS val 243619544 ecr 243619544], length 3920
2022-04-05 12:22:17.041847 IP (tos 0x0, ttl 64, id 57394, offset 0, flags [DF], proto TCP (6), length 52)
    127.0.0.1.50206 > 127.0.0.1.11250: Flags [.], cksum 0xfe28 (incorrect -> 0xf444), seq 889, ack 111112, win 512, options [nop,nop,TS val 243619544 ecr 243619544], length 0
2022-04-05 12:22:17.049533 IP (tos 0x0, ttl 64, id 36574, offset 0, flags [DF], proto TCP (6), length 4100)
    127.0.0.1.11250 > 127.0.0.1.50206: Flags [P.], cksum 0x0df9 (incorrect -> 0x9ca4), seq 111112:115160, ack 889, win 512, options [nop,nop,TS val 243619552 ecr 243619544], length 4048
2022-04-05 12:22:17.049836 IP (tos 0x0, ttl 64, id 57395, offset 0, flags [DF], proto TCP (6), length 52)
    127.0.0.1.50206 > 127.0.0.1.11250: Flags [.], cksum 0xfe28 (incorrect -> 0xe464), seq 889, ack 115160, win 512, options [nop,nop,TS val 243619552 ecr 243619552], length 0
200, 5.9444029331207275, 1.0768108367919922