2022-04-05 11:23:18.448550 IP (tos 0x0, ttl 64, id 44432, offset 0, flags [DF], proto TCP (6), length 60)
    127.0.0.1.39012 > 127.0.0.1.10250: Flags [S], cksum 0xfe30 (incorrect -> 0xdafc), seq 3110900899, win 65495, options [mss 65495,sackOK,TS val 240080951 ecr 0,nop,wscale 7], length 0
2022-04-05 11:23:18.448562 IP (tos 0x0, ttl 64, id 0, offset 0, flags [DF], proto TCP (6), length 60)
    127.0.0.1.10250 > 127.0.0.1.39012: Flags [S.], cksum 0xfe30 (incorrect -> 0xe607), seq 1658334097, ack 3110900900, win 65483, options [mss 65495,sackOK,TS val 240080951 ecr 240080951,nop,wscale 7], length 0
2022-04-05 11:23:18.448571 IP (tos 0x0, ttl 64, id 44433, offset 0, flags [DF], proto TCP (6), length 52)
    127.0.0.1.39012 > 127.0.0.1.10250: Flags [.], cksum 0xfe28 (incorrect -> 0x0cc4), seq 1, ack 1, win 512, options [nop,nop,TS val 240080951 ecr 240080951], length 0
2022-04-05 11:23:18.448675 IP (tos 0x0, ttl 64, id 44434, offset 0, flags [DF], proto TCP (6), length 55)
    127.0.0.1.39012 > 127.0.0.1.10250: Flags [P.], cksum 0xfe2b (incorrect -> 0x07b8), seq 1:4, ack 1, win 512, options [nop,nop,TS val 240080951 ecr 240080951], length 3
2022-04-05 11:23:18.448688 IP (tos 0x0, ttl 64, id 16206, offset 0, flags [DF], proto TCP (6), length 52)
    127.0.0.1.10250 > 127.0.0.1.39012: Flags [.], cksum 0xfe28 (incorrect -> 0x0cc1), seq 1, ack 4, win 512, options [nop,nop,TS val 240080951 ecr 240080951], length 0
2022-04-05 11:23:18.448719 IP (tos 0x0, ttl 64, id 16207, offset 0, flags [DF], proto TCP (6), length 54)
    127.0.0.1.10250 > 127.0.0.1.39012: Flags [P.], cksum 0xfe2a (incorrect -> 0x07b7), seq 1:3, ack 4, win 512, options [nop,nop,TS val 240080951 ecr 240080951], length 2
2022-04-05 11:23:18.448737 IP (tos 0x0, ttl 64, id 44435, offset 0, flags [DF], proto TCP (6), length 52)
    127.0.0.1.39012 > 127.0.0.1.10250: Flags [.], cksum 0xfe28 (incorrect -> 0x0cbf), seq 4, ack 3, win 512, options [nop,nop,TS val 240080951 ecr 240080951], length 0
2022-04-05 11:23:18.449942 IP (tos 0x0, ttl 64, id 44436, offset 0, flags [DF], proto TCP (6), length 62)
    127.0.0.1.39012 > 127.0.0.1.10250: Flags [P.], cksum 0xfe32 (incorrect -> 0xa271), seq 4:14, ack 3, win 512, options [nop,nop,TS val 240080952 ecr 240080951], length 10
2022-04-05 11:23:18.449952 IP (tos 0x0, ttl 64, id 16208, offset 0, flags [DF], proto TCP (6), length 52)
    127.0.0.1.10250 > 127.0.0.1.39012: Flags [.], cksum 0xfe28 (incorrect -> 0x0cb3), seq 3, ack 14, win 512, options [nop,nop,TS val 240080952 ecr 240080952], length 0
2022-04-05 11:23:18.529024 IP (tos 0x0, ttl 64, id 16209, offset 0, flags [DF], proto TCP (6), length 62)
    127.0.0.1.10250 > 127.0.0.1.39012: Flags [P.], cksum 0xfe32 (incorrect -> 0x0751), seq 3:13, ack 14, win 512, options [nop,nop,TS val 240081031 ecr 240080952], length 10
2022-04-05 11:23:18.529033 IP (tos 0x0, ttl 64, id 44437, offset 0, flags [DF], proto TCP (6), length 52)
    127.0.0.1.39012 > 127.0.0.1.10250: Flags [.], cksum 0xfe28 (incorrect -> 0x0c0b), seq 14, ack 13, win 512, options [nop,nop,TS val 240081031 ecr 240081031], length 0
2022-04-05 11:23:18.534916 IP (tos 0x0, ttl 64, id 44438, offset 0, flags [DF], proto TCP (6), length 569)
    127.0.0.1.39012 > 127.0.0.1.10250: Flags [P.], cksum 0x002e (incorrect -> 0x3b7f), seq 14:531, ack 13, win 512, options [nop,nop,TS val 240081037 ecr 240081031], length 517
2022-04-05 11:23:18.534927 IP (tos 0x0, ttl 64, id 16210, offset 0, flags [DF], proto TCP (6), length 52)
    127.0.0.1.10250 > 127.0.0.1.39012: Flags [.], cksum 0xfe28 (incorrect -> 0x09fe), seq 13, ack 531, win 508, options [nop,nop,TS val 240081037 ecr 240081037], length 0
200, 5.831813097000122, 0.7965974807739258