2022-04-05 02:19:21.574607 IP (tos 0x0, ttl 64, id 30950, offset 0, flags [DF], proto TCP (6), length 60)
    127.0.0.1.55350 > 127.0.0.1.10550: Flags [S], cksum 0xfe30 (incorrect -> 0x85a6), seq 1631828857, win 65495, options [mss 65495,sackOK,TS val 762805946 ecr 0,nop,wscale 7], length 0
2022-04-05 02:19:21.574622 IP (tos 0x0, ttl 64, id 0, offset 0, flags [DF], proto TCP (6), length 60)
    127.0.0.1.10550 > 127.0.0.1.55350: Flags [S.], cksum 0xfe30 (incorrect -> 0x2ef8), seq 2882535079, ack 1631828858, win 65483, options [mss 65495,sackOK,TS val 762805946 ecr 762805946,nop,wscale 7], length 0
2022-04-05 02:19:21.574636 IP (tos 0x0, ttl 64, id 30951, offset 0, flags [DF], proto TCP (6), length 52)
    127.0.0.1.55350 > 127.0.0.1.10550: Flags [.], cksum 0xfe28 (incorrect -> 0x55b4), seq 1, ack 1, win 512, options [nop,nop,TS val 762805946 ecr 762805946], length 0
2022-04-05 02:19:21.574815 IP (tos 0x0, ttl 64, id 30952, offset 0, flags [DF], proto TCP (6), length 55)
    127.0.0.1.55350 > 127.0.0.1.10550: Flags [P.], cksum 0xfe2b (incorrect -> 0x50a8), seq 1:4, ack 1, win 512, options [nop,nop,TS val 762805946 ecr 762805946], length 3
2022-04-05 02:19:21.574825 IP (tos 0x0, ttl 64, id 12080, offset 0, flags [DF], proto TCP (6), length 52)
    127.0.0.1.10550 > 127.0.0.1.55350: Flags [.], cksum 0xfe28 (incorrect -> 0x55b1), seq 1, ack 4, win 512, options [nop,nop,TS val 762805946 ecr 762805946], length 0
2022-04-05 02:19:21.574851 IP (tos 0x0, ttl 64, id 12081, offset 0, flags [DF], proto TCP (6), length 54)
    127.0.0.1.10550 > 127.0.0.1.55350: Flags [P.], cksum 0xfe2a (incorrect -> 0x50a7), seq 1:3, ack 4, win 512, options [nop,nop,TS val 762805946 ecr 762805946], length 2
2022-04-05 02:19:21.574860 IP (tos 0x0, ttl 64, id 30953, offset 0, flags [DF], proto TCP (6), length 52)
    127.0.0.1.55350 > 127.0.0.1.10550: Flags [.], cksum 0xfe28 (incorrect -> 0x55af), seq 4, ack 3, win 512, options [nop,nop,TS val 762805946 ecr 762805946], length 0
2022-04-05 02:19:21.576307 IP (tos 0x0, ttl 64, id 30954, offset 0, flags [DF], proto TCP (6), length 62)
    127.0.0.1.55350 > 127.0.0.1.10550: Flags [P.], cksum 0xfe32 (incorrect -> 0x59bb), seq 4:14, ack 3, win 512, options [nop,nop,TS val 762805947 ecr 762805946], length 10
2022-04-05 02:19:21.576327 IP (tos 0x0, ttl 64, id 12082, offset 0, flags [DF], proto TCP (6), length 52)
    127.0.0.1.10550 > 127.0.0.1.55350: Flags [.], cksum 0xfe28 (incorrect -> 0x55a3), seq 3, ack 14, win 512, options [nop,nop,TS val 762805947 ecr 762805947], length 0
2022-04-05 02:19:28.756019 IP (tos 0x0, ttl 64, id 12083, offset 0, flags [DF], proto TCP (6), length 62)
    127.0.0.1.10550 > 127.0.0.1.55350: Flags [P.], cksum 0xfe32 (incorrect -> 0x3484), seq 3:13, ack 14, win 512, options [nop,nop,TS val 762813127 ecr 762805947], length 10
2022-04-05 02:19:28.756029 IP (tos 0x0, ttl 64, id 30955, offset 0, flags [DF], proto TCP (6), length 52)
    127.0.0.1.55350 > 127.0.0.1.10550: Flags [.], cksum 0xfe28 (incorrect -> 0x1d81), seq 14, ack 13, win 512, options [nop,nop,TS val 762813127 ecr 762813127], length 0
2022-04-05 02:19:28.761780 IP (tos 0x0, ttl 64, id 30956, offset 0, flags [DF], proto TCP (6), length 569)
    127.0.0.1.55350 > 127.0.0.1.10550: Flags [P.], cksum 0x002e (incorrect -> 0x04e8), seq 14:531, ack 13, win 512, options [nop,nop,TS val 762813133 ecr 762813127], length 517
2022-04-05 02:19:28.761789 IP (tos 0x0, ttl 64, id 12084, offset 0, flags [DF], proto TCP (6), length 52)
    127.0.0.1.10550 > 127.0.0.1.55350: Flags [.], cksum 0xfe28 (incorrect -> 0x1b74), seq 13, ack 531, win 508, options [nop,nop,TS val 762813133 ecr 762813133], length 0
2022-04-05 02:19:28.823299 IP (tos 0x0, ttl 64, id 12085, offset 0, flags [DF], proto TCP (6), length 1500)
    127.0.0.1.10550 > 127.0.0.1.55350: Flags [P.], cksum 0x03d1 (incorrect -> 0x1c28), seq 13:1461, ack 531, win 512, options [nop,nop,TS val 762813194 ecr 762813133], length 1448
2022-04-05 02:19:28.823305 IP (tos 0x0, ttl 64, id 30957, offset 0, flags [DF], proto TCP (6), length 52)
    127.0.0.1.55350 > 127.0.0.1.10550: Flags [.], cksum 0xfe28 (incorrect -> 0x1558), seq 531, ack 1461, win 502, options [nop,nop,TS val 762813194 ecr 762813194], length 0
2022-04-05 02:19:28.844862 IP (tos 0x0, ttl 64, id 12086, offset 0, flags [DF], proto TCP (6), length 2102)
    127.0.0.1.10550 > 127.0.0.1.55350: Flags [P.], cksum 0x062b (incorrect -> 0x8c3b), seq 1461:3511, ack 531, win 512, options [nop,nop,TS val 762813216 ecr 762813194], length 2050
2022-04-05 02:19:28.844867 IP (tos 0x0, ttl 64, id 30958, offset 0, flags [DF], proto TCP (6), length 52)
    127.0.0.1.55350 > 127.0.0.1.10550: Flags [.], cksum 0xfe28 (incorrect -> 0x0d2d), seq 531, ack 3511, win 499, options [nop,nop,TS val 762813216 ecr 762813216], length 0
2022-04-05 02:19:28.845588 IP (tos 0x0, ttl 64, id 30959, offset 0, flags [DF], proto TCP (6), length 178)
    127.0.0.1.55350 > 127.0.0.1.10550: Flags [P.], cksum 0xfea6 (incorrect -> 0xa1ca), seq 531:657, ack 3511, win 512, options [nop,nop,TS val 762813217 ecr 762813216], length 126
2022-04-05 02:19:28.845599 IP (tos 0x0, ttl 64, id 12087, offset 0, flags [DF], proto TCP (6), length 52)
    127.0.0.1.10550 > 127.0.0.1.55350: Flags [.], cksum 0xfe28 (incorrect -> 0x0ca0), seq 3511, ack 657, win 512, options [nop,nop,TS val 762813217 ecr 762813217], length 0
2022-04-05 02:19:29.843609 IP (tos 0x0, ttl 64, id 12088, offset 0, flags [DF], proto TCP (6), length 103)
    127.0.0.1.10550 > 127.0.0.1.55350: Flags [P.], cksum 0xfe5b (incorrect -> 0x9838), seq 3511:3562, ack 657, win 512, options [nop,nop,TS val 762814215 ecr 762813217], length 51
2022-04-05 02:19:29.843617 IP (tos 0x0, ttl 64, id 30960, offset 0, flags [DF], proto TCP (6), length 52)
    127.0.0.1.55350 > 127.0.0.1.10550: Flags [.], cksum 0xfe28 (incorrect -> 0x04a1), seq 657, ack 3562, win 512, options [nop,nop,TS val 762814215 ecr 762814215], length 0
2022-04-05 02:19:29.844036 IP (tos 0x0, ttl 64, id 30961, offset 0, flags [DF], proto TCP (6), length 369)
    127.0.0.1.55350 > 127.0.0.1.10550: Flags [P.], cksum 0xff65 (incorrect -> 0x8e8c), seq 657:974, ack 3562, win 512, options [nop,nop,TS val 762814215 ecr 762814215], length 317
2022-04-05 02:19:29.844044 IP (tos 0x0, ttl 64, id 12089, offset 0, flags [DF], proto TCP (6), length 52)
    127.0.0.1.10550 > 127.0.0.1.55350: Flags [.], cksum 0xfe28 (incorrect -> 0x0366), seq 3562, ack 974, win 510, options [nop,nop,TS val 762814215 ecr 762814215], length 0
200, 4.555032253265381, 67.56842994689941