2022-04-05 00:08:36.026994 IP (tos 0x0, ttl 64, id 46998, offset 0, flags [DF], proto TCP (6), length 60)
    127.0.0.1.45086 > 127.0.0.1.12250: Flags [S], cksum 0xfe30 (incorrect -> 0xe673), seq 4253652733, win 65495, options [mss 65495,sackOK,TS val 754960398 ecr 0,nop,wscale 7], length 0
2022-04-05 00:08:36.027007 IP (tos 0x0, ttl 64, id 0, offset 0, flags [DF], proto TCP (6), length 60)
    127.0.0.1.12250 > 127.0.0.1.45086: Flags [S.], cksum 0xfe30 (incorrect -> 0x6fb7), seq 2029390003, ack 4253652734, win 65483, options [mss 65495,sackOK,TS val 754960398 ecr 754960398,nop,wscale 7], length 0
2022-04-05 00:08:36.027016 IP (tos 0x0, ttl 64, id 46999, offset 0, flags [DF], proto TCP (6), length 52)
    127.0.0.1.45086 > 127.0.0.1.12250: Flags [.], cksum 0xfe28 (incorrect -> 0x9673), seq 1, ack 1, win 512, options [nop,nop,TS val 754960398 ecr 754960398], length 0
2022-04-05 00:08:36.027142 IP (tos 0x0, ttl 64, id 47000, offset 0, flags [DF], proto TCP (6), length 55)
    127.0.0.1.45086 > 127.0.0.1.12250: Flags [P.], cksum 0xfe2b (incorrect -> 0x9167), seq 1:4, ack 1, win 512, options [nop,nop,TS val 754960398 ecr 754960398], length 3
2022-04-05 00:08:36.027161 IP (tos 0x0, ttl 64, id 2767, offset 0, flags [DF], proto TCP (6), length 52)
    127.0.0.1.12250 > 127.0.0.1.45086: Flags [.], cksum 0xfe28 (incorrect -> 0x9670), seq 1, ack 4, win 512, options [nop,nop,TS val 754960398 ecr 754960398], length 0
2022-04-05 00:08:36.027218 IP (tos 0x0, ttl 64, id 2768, offset 0, flags [DF], proto TCP (6), length 54)
    127.0.0.1.12250 > 127.0.0.1.45086: Flags [P.], cksum 0xfe2a (incorrect -> 0x9166), seq 1:3, ack 4, win 512, options [nop,nop,TS val 754960398 ecr 754960398], length 2
2022-04-05 00:08:36.027249 IP (tos 0x0, ttl 64, id 47001, offset 0, flags [DF], proto TCP (6), length 52)
    127.0.0.1.45086 > 127.0.0.1.12250: Flags [.], cksum 0xfe28 (incorrect -> 0x966e), seq 4, ack 3, win 512, options [nop,nop,TS val 754960398 ecr 754960398], length 0
2022-04-05 00:08:36.029650 IP (tos 0x0, ttl 64, id 47002, offset 0, flags [DF], proto TCP (6), length 62)
    127.0.0.1.45086 > 127.0.0.1.12250: Flags [P.], cksum 0xfe32 (incorrect -> 0x0a7b), seq 4:14, ack 3, win 512, options [nop,nop,TS val 754960401 ecr 754960398], length 10
2022-04-05 00:08:36.029670 IP (tos 0x0, ttl 64, id 2769, offset 0, flags [DF], proto TCP (6), length 52)
    127.0.0.1.12250 > 127.0.0.1.45086: Flags [.], cksum 0xfe28 (incorrect -> 0x965e), seq 3, ack 14, win 512, options [nop,nop,TS val 754960401 ecr 754960401], length 0
2022-04-05 00:08:36.158883 IP (tos 0x0, ttl 64, id 2770, offset 0, flags [DF], proto TCP (6), length 62)
    127.0.0.1.12250 > 127.0.0.1.45086: Flags [P.], cksum 0xfe32 (incorrect -> 0x90ca), seq 3:13, ack 14, win 512, options [nop,nop,TS val 754960530 ecr 754960401], length 10
2022-04-05 00:08:36.158893 IP (tos 0x0, ttl 64, id 47003, offset 0, flags [DF], proto TCP (6), length 52)
    127.0.0.1.45086 > 127.0.0.1.12250: Flags [.], cksum 0xfe28 (incorrect -> 0x9552), seq 14, ack 13, win 512, options [nop,nop,TS val 754960530 ecr 754960530], length 0
2022-04-05 00:08:36.165786 IP (tos 0x0, ttl 64, id 47004, offset 0, flags [DF], proto TCP (6), length 569)
    127.0.0.1.45086 > 127.0.0.1.12250: Flags [P.], cksum 0x002e (incorrect -> 0x9f10), seq 14:531, ack 13, win 512, options [nop,nop,TS val 754960537 ecr 754960530], length 517
2022-04-05 00:08:36.165797 IP (tos 0x0, ttl 64, id 2771, offset 0, flags [DF], proto TCP (6), length 52)
    127.0.0.1.12250 > 127.0.0.1.45086: Flags [.], cksum 0xfe28 (incorrect -> 0x9343), seq 13, ack 531, win 508, options [nop,nop,TS val 754960537 ecr 754960537], length 0
200, 4.947540760040283, 0.9530825614929199