2022-04-05 09:40:41.546062 IP (tos 0x0, ttl 64, id 17003, offset 0, flags [DF], proto TCP (6), length 60)
    127.0.0.1.35130 > 127.0.0.1.10750: Flags [S], cksum 0xfe30 (incorrect -> 0x04ff), seq 3453226701, win 65495, options [mss 65495,sackOK,TS val 789285917 ecr 0,nop,wscale 7], length 0
2022-04-05 09:40:41.546084 IP (tos 0x0, ttl 64, id 0, offset 0, flags [DF], proto TCP (6), length 60)
    127.0.0.1.10750 > 127.0.0.1.35130: Flags [S.], cksum 0xfe30 (incorrect -> 0x39a8), seq 4246606602, ack 3453226702, win 65483, options [mss 65495,sackOK,TS val 789285917 ecr 789285917,nop,wscale 7], length 0
2022-04-05 09:40:41.546102 IP (tos 0x0, ttl 64, id 17004, offset 0, flags [DF], proto TCP (6), length 52)
    127.0.0.1.35130 > 127.0.0.1.10750: Flags [.], cksum 0xfe28 (incorrect -> 0x6064), seq 1, ack 1, win 512, options [nop,nop,TS val 789285917 ecr 789285917], length 0
2022-04-05 09:40:41.546245 IP (tos 0x0, ttl 64, id 17005, offset 0, flags [DF], proto TCP (6), length 55)
    127.0.0.1.35130 > 127.0.0.1.10750: Flags [P.], cksum 0xfe2b (incorrect -> 0x5b58), seq 1:4, ack 1, win 512, options [nop,nop,TS val 789285917 ecr 789285917], length 3
2022-04-05 09:40:41.546264 IP (tos 0x0, ttl 64, id 54571, offset 0, flags [DF], proto TCP (6), length 52)
    127.0.0.1.10750 > 127.0.0.1.35130: Flags [.], cksum 0xfe28 (incorrect -> 0x6061), seq 1, ack 4, win 512, options [nop,nop,TS val 789285917 ecr 789285917], length 0
2022-04-05 09:40:41.546311 IP (tos 0x0, ttl 64, id 54572, offset 0, flags [DF], proto TCP (6), length 54)
    127.0.0.1.10750 > 127.0.0.1.35130: Flags [P.], cksum 0xfe2a (incorrect -> 0x5b57), seq 1:3, ack 4, win 512, options [nop,nop,TS val 789285917 ecr 789285917], length 2
2022-04-05 09:40:41.546328 IP (tos 0x0, ttl 64, id 17006, offset 0, flags [DF], proto TCP (6), length 52)
    127.0.0.1.35130 > 127.0.0.1.10750: Flags [.], cksum 0xfe28 (incorrect -> 0x605f), seq 4, ack 3, win 512, options [nop,nop,TS val 789285917 ecr 789285917], length 0
2022-04-05 09:40:41.558201 IP (tos 0x0, ttl 64, id 17007, offset 0, flags [DF], proto TCP (6), length 62)
    127.0.0.1.35130 > 127.0.0.1.10750: Flags [P.], cksum 0xfe32 (incorrect -> 0xaa8b), seq 4:14, ack 3, win 512, options [nop,nop,TS val 789285929 ecr 789285917], length 10
2022-04-05 09:40:41.558211 IP (tos 0x0, ttl 64, id 54573, offset 0, flags [DF], proto TCP (6), length 52)
    127.0.0.1.10750 > 127.0.0.1.35130: Flags [.], cksum 0xfe28 (incorrect -> 0x603d), seq 3, ack 14, win 512, options [nop,nop,TS val 789285929 ecr 789285929], length 0
2022-04-05 09:40:41.644177 IP (tos 0x0, ttl 64, id 54574, offset 0, flags [DF], proto TCP (6), length 62)
    127.0.0.1.10750 > 127.0.0.1.35130: Flags [P.], cksum 0xfe32 (incorrect -> 0x5ad4), seq 3:13, ack 14, win 512, options [nop,nop,TS val 789286015 ecr 789285929], length 10
2022-04-05 09:40:41.644195 IP (tos 0x0, ttl 64, id 17008, offset 0, flags [DF], proto TCP (6), length 52)
    127.0.0.1.35130 > 127.0.0.1.10750: Flags [.], cksum 0xfe28 (incorrect -> 0x5f87), seq 14, ack 13, win 512, options [nop,nop,TS val 789286015 ecr 789286015], length 0
2022-04-05 09:40:41.650310 IP (tos 0x0, ttl 64, id 17009, offset 0, flags [DF], proto TCP (6), length 569)
    127.0.0.1.35130 > 127.0.0.1.10750: Flags [P.], cksum 0x002e (incorrect -> 0x3dad), seq 14:531, ack 13, win 512, options [nop,nop,TS val 789286021 ecr 789286015], length 517
2022-04-05 09:40:41.650320 IP (tos 0x0, ttl 64, id 54575, offset 0, flags [DF], proto TCP (6), length 52)
    127.0.0.1.10750 > 127.0.0.1.35130: Flags [.], cksum 0xfe28 (incorrect -> 0x5d7a), seq 13, ack 531, win 508, options [nop,nop,TS val 789286021 ecr 789286021], length 0
2022-04-05 09:40:41.739061 IP (tos 0x0, ttl 64, id 54576, offset 0, flags [DF], proto TCP (6), length 3538)
    127.0.0.1.10750 > 127.0.0.1.35130: Flags [P.], cksum 0x0bc7 (incorrect -> 0x083b), seq 13:3499, ack 531, win 512, options [nop,nop,TS val 789286110 ecr 789286021], length 3486
2022-04-05 09:40:41.739074 IP (tos 0x0, ttl 64, id 17010, offset 0, flags [DF], proto TCP (6), length 52)
    127.0.0.1.35130 > 127.0.0.1.10750: Flags [.], cksum 0xfe28 (incorrect -> 0x4f38), seq 531, ack 3499, win 494, options [nop,nop,TS val 789286110 ecr 789286110], length 0
2022-04-05 09:40:41.766897 IP (tos 0x0, ttl 64, id 54577, offset 0, flags [DF], proto TCP (6), length 659)
    127.0.0.1.10750 > 127.0.0.1.35130: Flags [P.], cksum 0x0088 (incorrect -> 0x9d2b), seq 3499:4106, ack 531, win 512, options [nop,nop,TS val 789286138 ecr 789286110], length 607
2022-04-05 09:40:41.766907 IP (tos 0x0, ttl 64, id 17011, offset 0, flags [DF], proto TCP (6), length 52)
    127.0.0.1.35130 > 127.0.0.1.10750: Flags [.], cksum 0xfe28 (incorrect -> 0x4c96), seq 531, ack 4106, win 505, options [nop,nop,TS val 789286138 ecr 789286138], length 0
2022-04-05 09:40:41.767302 IP (tos 0x0, ttl 64, id 17012, offset 0, flags [DF], proto TCP (6), length 132)
    127.0.0.1.35130 > 127.0.0.1.10750: Flags [P.], cksum 0xfe78 (incorrect -> 0x8bdb), seq 531:611, ack 4106, win 512, options [nop,nop,TS val 789286138 ecr 789286138], length 80
2022-04-05 09:40:41.767311 IP (tos 0x0, ttl 64, id 54578, offset 0, flags [DF], proto TCP (6), length 52)
    127.0.0.1.10750 > 127.0.0.1.35130: Flags [.], cksum 0xfe28 (incorrect -> 0x4c3f), seq 4106, ack 611, win 512, options [nop,nop,TS val 789286138 ecr 789286138], length 0
2022-04-05 09:40:41.767799 IP (tos 0x0, ttl 64, id 17013, offset 0, flags [DF], proto TCP (6), length 362)
    127.0.0.1.35130 > 127.0.0.1.10750: Flags [P.], cksum 0xff5e (incorrect -> 0xd4e2), seq 611:921, ack 4106, win 512, options [nop,nop,TS val 789286139 ecr 789286138], length 310
2022-04-05 09:40:41.767809 IP (tos 0x0, ttl 64, id 54579, offset 0, flags [DF], proto TCP (6), length 52)
    127.0.0.1.10750 > 127.0.0.1.35130: Flags [.], cksum 0xfe28 (incorrect -> 0x4b09), seq 4106, ack 921, win 510, options [nop,nop,TS val 789286139 ecr 789286139], length 0
2022-04-05 09:40:41.850188 IP (tos 0x0, ttl 64, id 54580, offset 0, flags [DF], proto TCP (6), length 323)
    127.0.0.1.10750 > 127.0.0.1.35130: Flags [P.], cksum 0xff37 (incorrect -> 0x46dd), seq 4106:4377, ack 921, win 512, options [nop,nop,TS val 789286221 ecr 789286139], length 271
2022-04-05 09:40:41.850198 IP (tos 0x0, ttl 64, id 17014, offset 0, flags [DF], proto TCP (6), length 52)
    127.0.0.1.35130 > 127.0.0.1.10750: Flags [.], cksum 0xfe28 (incorrect -> 0x4956), seq 921, ack 4377, win 510, options [nop,nop,TS val 789286221 ecr 789286221], length 0
2022-04-05 09:40:41.896648 IP (tos 0x0, ttl 64, id 54581, offset 0, flags [DF], proto TCP (6), length 3809)
    127.0.0.1.10750 > 127.0.0.1.35130: Flags [P.], cksum 0x0cd6 (incorrect -> 0xe808), seq 4377:8134, ack 921, win 512, options [nop,nop,TS val 789286268 ecr 789286221], length 3757
2022-04-05 09:40:41.896657 IP (tos 0x0, ttl 64, id 17015, offset 0, flags [DF], proto TCP (6), length 52)
    127.0.0.1.35130 > 127.0.0.1.10750: Flags [.], cksum 0xfe28 (incorrect -> 0x3a5c), seq 921, ack 8134, win 493, options [nop,nop,TS val 789286268 ecr 789286268], length 0
2022-04-05 09:40:41.904616 IP (tos 0x0, ttl 64, id 54582, offset 0, flags [DF], proto TCP (6), length 4036)
    127.0.0.1.10750 > 127.0.0.1.35130: Flags [P.], cksum 0x0db9 (incorrect -> 0xa81b), seq 8134:12118, ack 921, win 512, options [nop,nop,TS val 789286276 ecr 789286268], length 3984
2022-04-05 09:40:41.904623 IP (tos 0x0, ttl 64, id 17016, offset 0, flags [DF], proto TCP (6), length 52)
    127.0.0.1.35130 > 127.0.0.1.10750: Flags [.], cksum 0xfe28 (incorrect -> 0x2abd), seq 921, ack 12118, win 492, options [nop,nop,TS val 789286276 ecr 789286276], length 0
2022-04-05 09:40:41.910409 IP (tos 0x0, ttl 64, id 54583, offset 0, flags [DF], proto TCP (6), length 2044)
    127.0.0.1.10750 > 127.0.0.1.35130: Flags [P.], cksum 0x05f1 (incorrect -> 0x5014), seq 12118:14110, ack 921, win 512, options [nop,nop,TS val 789286282 ecr 789286276], length 1992
2022-04-05 09:40:41.910416 IP (tos 0x0, ttl 64, id 17017, offset 0, flags [DF], proto TCP (6), length 52)
    127.0.0.1.35130 > 127.0.0.1.10750: Flags [.], cksum 0xfe28 (incorrect -> 0x22e1), seq 921, ack 14110, win 500, options [nop,nop,TS val 789286282 ecr 789286282], length 0
2022-04-05 09:40:41.926982 IP (tos 0x0, ttl 64, id 54584, offset 0, flags [DF], proto TCP (6), length 4100)
    127.0.0.1.10750 > 127.0.0.1.35130: Flags [P.], cksum 0x0df9 (incorrect -> 0x8143), seq 14110:18158, ack 921, win 512, options [nop,nop,TS val 789286298 ecr 789286282], length 4048
2022-04-05 09:40:41.926996 IP (tos 0x0, ttl 64, id 17018, offset 0, flags [DF], proto TCP (6), length 52)
    127.0.0.1.35130 > 127.0.0.1.10750: Flags [.], cksum 0xfe28 (incorrect -> 0x12f9), seq 921, ack 18158, win 492, options [nop,nop,TS val 789286298 ecr 789286298], length 0
2022-04-05 09:40:41.927005 IP (tos 0x0, ttl 64, id 54585, offset 0, flags [DF], proto TCP (6), length 3474)
    127.0.0.1.10750 > 127.0.0.1.35130: Flags [P.], cksum 0x0b87 (incorrect -> 0x7f31), seq 18158:21580, ack 921, win 512, options [nop,nop,TS val 789286298 ecr 789286298], length 3422
2022-04-05 09:40:41.927011 IP (tos 0x0, ttl 64, id 17019, offset 0, flags [DF], proto TCP (6), length 52)
    127.0.0.1.35130 > 127.0.0.1.10750: Flags [.], cksum 0xfe28 (incorrect -> 0x05a9), seq 921, ack 21580, win 478, options [nop,nop,TS val 789286298 ecr 789286298], length 0
2022-04-05 09:40:41.927078 IP (tos 0x0, ttl 64, id 54586, offset 0, flags [DF], proto TCP (6), length 3890)
    127.0.0.1.10750 > 127.0.0.1.35130: Flags [P.], cksum 0x0d27 (incorrect -> 0xc34d), seq 21580:25418, ack 921, win 512, options [nop,nop,TS val 789286298 ecr 789286298], length 3838
2022-04-05 09:40:41.927085 IP (tos 0x0, ttl 64, id 17020, offset 0, flags [DF], proto TCP (6), length 52)
    127.0.0.1.35130 > 127.0.0.1.10750: Flags [.], cksum 0xfe28 (incorrect -> 0xf6b9), seq 921, ack 25418, win 463, options [nop,nop,TS val 789286298 ecr 789286298], length 0
2022-04-05 09:40:41.927447 IP (tos 0x0, ttl 64, id 54587, offset 0, flags [DF], proto TCP (6), length 4100)
    127.0.0.1.10750 > 127.0.0.1.35130: Flags [P.], cksum 0x0df9 (incorrect -> 0x9583), seq 25418:29466, ack 921, win 512, options [nop,nop,TS val 789286299 ecr 789286298], length 4048
2022-04-05 09:40:41.927453 IP (tos 0x0, ttl 64, id 17021, offset 0, flags [DF], proto TCP (6), length 52)
    127.0.0.1.35130 > 127.0.0.1.10750: Flags [.], cksum 0xfe28 (incorrect -> 0xe6f6), seq 921, ack 29466, win 448, options [nop,nop,TS val 789286299 ecr 789286299], length 0
2022-04-05 09:40:41.927459 IP (tos 0x0, ttl 64, id 54588, offset 0, flags [DF], proto TCP (6), length 394)
    127.0.0.1.10750 > 127.0.0.1.35130: Flags [P.], cksum 0xff7e (incorrect -> 0x5b17), seq 29466:29808, ack 921, win 512, options [nop,nop,TS val 789286299 ecr 789286299], length 342
2022-04-05 09:40:41.928325 IP (tos 0x0, ttl 64, id 17022, offset 0, flags [DF], proto TCP (6), length 52)
    127.0.0.1.35130 > 127.0.0.1.10750: Flags [.], cksum 0xfe28 (incorrect -> 0xe560), seq 921, ack 29808, win 512, options [nop,nop,TS val 789286299 ecr 789286299], length 0
2022-04-05 09:40:41.934738 IP (tos 0x0, ttl 64, id 54589, offset 0, flags [DF], proto TCP (6), length 3852)
    127.0.0.1.10750 > 127.0.0.1.35130: Flags [P.], cksum 0x0d01 (incorrect -> 0x88e5), seq 29808:33608, ack 921, win 512, options [nop,nop,TS val 789286306 ecr 789286299], length 3800
2022-04-05 09:40:41.934770 IP (tos 0x0, ttl 64, id 17023, offset 0, flags [DF], proto TCP (6), length 52)
    127.0.0.1.35130 > 127.0.0.1.10750: Flags [.], cksum 0xfe28 (incorrect -> 0xd67a), seq 921, ack 33608, win 512, options [nop,nop,TS val 789286306 ecr 789286306], length 0
2022-04-05 09:40:41.944058 IP (tos 0x0, ttl 64, id 54590, offset 0, flags [DF], proto TCP (6), length 3538)
    127.0.0.1.10750 > 127.0.0.1.35130: Flags [P.], cksum 0x0bc7 (incorrect -> 0x56a4), seq 33608:37094, ack 921, win 512, options [nop,nop,TS val 789286315 ecr 789286306], length 3486
2022-04-05 09:40:41.944088 IP (tos 0x0, ttl 64, id 17024, offset 0, flags [DF], proto TCP (6), length 52)
    127.0.0.1.35130 > 127.0.0.1.10750: Flags [.], cksum 0xfe28 (incorrect -> 0xc8ca), seq 921, ack 37094, win 512, options [nop,nop,TS val 789286315 ecr 789286315], length 0
2022-04-05 09:40:41.944509 IP (tos 0x0, ttl 64, id 54591, offset 0, flags [DF], proto TCP (6), length 4100)
    127.0.0.1.10750 > 127.0.0.1.35130: Flags [P.], cksum 0x0df9 (incorrect -> 0x7469), seq 37094:41142, ack 921, win 512, options [nop,nop,TS val 789286316 ecr 789286315], length 4048
2022-04-05 09:40:41.961560 IP (tos 0x0, ttl 64, id 54592, offset 0, flags [DF], proto TCP (6), length 32820)
    127.0.0.1.10750 > 127.0.0.1.35130: Flags [.], cksum 0x7e29 (incorrect -> 0x3706), seq 41142:73910, ack 921, win 512, options [nop,nop,TS val 789286333 ecr 789286315], length 32768
2022-04-05 09:40:41.961601 IP (tos 0x0, ttl 64, id 17025, offset 0, flags [DF], proto TCP (6), length 52)
    127.0.0.1.35130 > 127.0.0.1.10750: Flags [.], cksum 0xfe28 (incorrect -> 0x396c), seq 921, ack 73910, win 379, options [nop,nop,TS val 789286333 ecr 789286316], length 0
2022-04-05 09:40:41.961614 IP (tos 0x0, ttl 64, id 54593, offset 0, flags [DF], proto TCP (6), length 2876)
    127.0.0.1.10750 > 127.0.0.1.35130: Flags [P.], cksum 0x0931 (incorrect -> 0xab46), seq 73910:76734, ack 921, win 512, options [nop,nop,TS val 789286333 ecr 789286333], length 2824
2022-04-05 09:40:41.962769 IP (tos 0x0, ttl 64, id 17026, offset 0, flags [DF], proto TCP (6), length 52)
    127.0.0.1.35130 > 127.0.0.1.10750: Flags [.], cksum 0xfe28 (incorrect -> 0x2dcd), seq 921, ack 76734, win 512, options [nop,nop,TS val 789286334 ecr 789286333], length 0
2022-04-05 09:40:41.963428 IP (tos 0x0, ttl 64, id 54594, offset 0, flags [DF], proto TCP (6), length 4036)
    127.0.0.1.10750 > 127.0.0.1.35130: Flags [P.], cksum 0x0db9 (incorrect -> 0xfbbf), seq 76734:80718, ack 921, win 512, options [nop,nop,TS val 789286335 ecr 789286334], length 3984
2022-04-05 09:40:41.963474 IP (tos 0x0, ttl 64, id 17027, offset 0, flags [DF], proto TCP (6), length 52)
    127.0.0.1.35130 > 127.0.0.1.10750: Flags [.], cksum 0xfe28 (incorrect -> 0x1e3a), seq 921, ack 80718, win 512, options [nop,nop,TS val 789286335 ecr 789286335], length 0
2022-04-05 09:40:41.963495 IP (tos 0x0, ttl 64, id 54595, offset 0, flags [DF], proto TCP (6), length 4100)
    127.0.0.1.10750 > 127.0.0.1.35130: Flags [P.], cksum 0x0df9 (incorrect -> 0x070b), seq 80718:84766, ack 921, win 512, options [nop,nop,TS val 789286335 ecr 789286335], length 4048
2022-04-05 09:40:41.963525 IP (tos 0x0, ttl 64, id 17028, offset 0, flags [DF], proto TCP (6), length 52)
    127.0.0.1.35130 > 127.0.0.1.10750: Flags [.], cksum 0xfe28 (incorrect -> 0x0e6a), seq 921, ack 84766, win 512, options [nop,nop,TS val 789286335 ecr 789286335], length 0
2022-04-05 09:40:41.963531 IP (tos 0x0, ttl 64, id 54596, offset 0, flags [DF], proto TCP (6), length 3211)
    127.0.0.1.10750 > 127.0.0.1.35130: Flags [P.], cksum 0x0a80 (incorrect -> 0xee8c), seq 84766:87925, ack 921, win 512, options [nop,nop,TS val 789286335 ecr 789286335], length 3159
2022-04-05 09:40:41.963892 IP (tos 0x0, ttl 64, id 17029, offset 0, flags [DF], proto TCP (6), length 52)
    127.0.0.1.35130 > 127.0.0.1.10750: Flags [.], cksum 0xfe28 (incorrect -> 0x0213), seq 921, ack 87925, win 512, options [nop,nop,TS val 789286335 ecr 789286335], length 0
2022-04-05 09:40:41.966896 IP (tos 0x0, ttl 64, id 54597, offset 0, flags [DF], proto TCP (6), length 4100)
    127.0.0.1.10750 > 127.0.0.1.35130: Flags [P.], cksum 0x0df9 (incorrect -> 0xfde0), seq 87925:91973, ack 921, win 512, options [nop,nop,TS val 789286338 ecr 789286335], length 4048
2022-04-05 09:40:41.966919 IP (tos 0x0, ttl 64, id 17030, offset 0, flags [DF], proto TCP (6), length 52)
    127.0.0.1.35130 > 127.0.0.1.10750: Flags [.], cksum 0xfe28 (incorrect -> 0xf23c), seq 921, ack 91973, win 512, options [nop,nop,TS val 789286338 ecr 789286338], length 0
2022-04-05 09:40:41.966924 IP (tos 0x0, ttl 64, id 54598, offset 0, flags [DF], proto TCP (6), length 486)
    127.0.0.1.10750 > 127.0.0.1.35130: Flags [P.], cksum 0xffda (incorrect -> 0xf0ab), seq 91973:92407, ack 921, win 512, options [nop,nop,TS val 789286338 ecr 789286338], length 434
2022-04-05 09:40:41.966930 IP (tos 0x0, ttl 64, id 17031, offset 0, flags [DF], proto TCP (6), length 52)
    127.0.0.1.35130 > 127.0.0.1.10750: Flags [.], cksum 0xfe28 (incorrect -> 0xf08a), seq 921, ack 92407, win 512, options [nop,nop,TS val 789286338 ecr 789286338], length 0
2022-04-05 09:40:41.978530 IP (tos 0x0, ttl 64, id 54599, offset 0, flags [DF], proto TCP (6), length 3760)
    127.0.0.1.10750 > 127.0.0.1.35130: Flags [P.], cksum 0x0ca5 (incorrect -> 0x123b), seq 92407:96115, ack 921, win 512, options [nop,nop,TS val 789286350 ecr 789286338], length 3708
2022-04-05 09:40:41.978562 IP (tos 0x0, ttl 64, id 17032, offset 0, flags [DF], proto TCP (6), length 52)
    127.0.0.1.35130 > 127.0.0.1.10750: Flags [.], cksum 0xfe28 (incorrect -> 0xe1f6), seq 921, ack 96115, win 512, options [nop,nop,TS val 789286350 ecr 789286350], length 0
2022-04-05 09:40:41.984575 IP (tos 0x0, ttl 64, id 54600, offset 0, flags [DF], proto TCP (6), length 4100)
    127.0.0.1.10750 > 127.0.0.1.35130: Flags [P.], cksum 0x0df9 (incorrect -> 0x7c4d), seq 96115:100163, ack 921, win 512, options [nop,nop,TS val 789286356 ecr 789286350], length 4048
2022-04-05 09:40:41.984624 IP (tos 0x0, ttl 64, id 17033, offset 0, flags [DF], proto TCP (6), length 52)
    127.0.0.1.35130 > 127.0.0.1.10750: Flags [.], cksum 0xfe28 (incorrect -> 0xd21a), seq 921, ack 100163, win 512, options [nop,nop,TS val 789286356 ecr 789286356], length 0
2022-04-05 09:40:41.984630 IP (tos 0x0, ttl 64, id 54601, offset 0, flags [DF], proto TCP (6), length 4378)
    127.0.0.1.10750 > 127.0.0.1.35130: Flags [P.], cksum 0x0f0f (incorrect -> 0xe5ee), seq 100163:104489, ack 921, win 512, options [nop,nop,TS val 789286356 ecr 789286356], length 4326
2022-04-05 09:40:41.985327 IP (tos 0x0, ttl 64, id 17034, offset 0, flags [DF], proto TCP (6), length 52)
    127.0.0.1.35130 > 127.0.0.1.10750: Flags [.], cksum 0xfe28 (incorrect -> 0xc134), seq 921, ack 104489, win 512, options [nop,nop,TS val 789286356 ecr 789286356], length 0
2022-04-05 09:40:41.986201 IP (tos 0x0, ttl 64, id 54602, offset 0, flags [DF], proto TCP (6), length 4100)
    127.0.0.1.10750 > 127.0.0.1.35130: Flags [P.], cksum 0x0df9 (incorrect -> 0x1b8c), seq 104489:108537, ack 921, win 512, options [nop,nop,TS val 789286357 ecr 789286356], length 4048
2022-04-05 09:40:41.986240 IP (tos 0x0, ttl 64, id 17035, offset 0, flags [DF], proto TCP (6), length 52)
    127.0.0.1.35130 > 127.0.0.1.10750: Flags [.], cksum 0xfe28 (incorrect -> 0xb162), seq 921, ack 108537, win 512, options [nop,nop,TS val 789286357 ecr 789286357], length 0
2022-04-05 09:40:41.986255 IP (tos 0x0, ttl 64, id 54603, offset 0, flags [DF], proto TCP (6), length 486)
    127.0.0.1.10750 > 127.0.0.1.35130: Flags [P.], cksum 0xffda (incorrect -> 0xacae), seq 108537:108971, ack 921, win 512, options [nop,nop,TS val 789286357 ecr 789286357], length 434
2022-04-05 09:40:41.986264 IP (tos 0x0, ttl 64, id 17036, offset 0, flags [DF], proto TCP (6), length 52)
    127.0.0.1.35130 > 127.0.0.1.10750: Flags [.], cksum 0xfe28 (incorrect -> 0xafb0), seq 921, ack 108971, win 512, options [nop,nop,TS val 789286357 ecr 789286357], length 0
2022-04-05 09:40:41.986289 IP (tos 0x0, ttl 64, id 54604, offset 0, flags [DF], proto TCP (6), length 4100)
    127.0.0.1.10750 > 127.0.0.1.35130: Flags [P.], cksum 0x0df9 (incorrect -> 0xeedd), seq 108971:113019, ack 921, win 512, options [nop,nop,TS val 789286357 ecr 789286357], length 4048
2022-04-05 09:40:41.986723 IP (tos 0x0, ttl 64, id 17037, offset 0, flags [DF], proto TCP (6), length 52)
    127.0.0.1.35130 > 127.0.0.1.10750: Flags [.], cksum 0xfe28 (incorrect -> 0x9fdf), seq 921, ack 113019, win 512, options [nop,nop,TS val 789286358 ecr 789286357], length 0
2022-04-05 09:40:41.986743 IP (tos 0x0, ttl 64, id 54605, offset 0, flags [DF], proto TCP (6), length 20344)
    127.0.0.1.10750 > 127.0.0.1.35130: Flags [P.], cksum 0x4d6d (incorrect -> 0x161c), seq 113019:133311, ack 921, win 512, options [nop,nop,TS val 789286358 ecr 789286358], length 20292
2022-04-05 09:40:41.987601 IP (tos 0x0, ttl 64, id 17038, offset 0, flags [DF], proto TCP (6), length 52)
    127.0.0.1.35130 > 127.0.0.1.10750: Flags [.], cksum 0xfe28 (incorrect -> 0x5099), seq 921, ack 133311, win 512, options [nop,nop,TS val 789286359 ecr 789286358], length 0
2022-04-05 09:40:41.987612 IP (tos 0x0, ttl 64, id 54606, offset 0, flags [DF], proto TCP (6), length 7882)
    127.0.0.1.10750 > 127.0.0.1.35130: Flags [P.], cksum 0x1cbf (incorrect -> 0x20a0), seq 133311:141141, ack 921, win 512, options [nop,nop,TS val 789286359 ecr 789286359], length 7830
2022-04-05 09:40:41.987950 IP (tos 0x0, ttl 64, id 17039, offset 0, flags [DF], proto TCP (6), length 52)
    127.0.0.1.35130 > 127.0.0.1.10750: Flags [.], cksum 0xfe28 (incorrect -> 0x3202), seq 921, ack 141141, win 512, options [nop,nop,TS val 789286359 ecr 789286359], length 0
2022-04-05 09:40:41.989554 IP (tos 0x0, ttl 64, id 54607, offset 0, flags [DF], proto TCP (6), length 4100)
    127.0.0.1.10750 > 127.0.0.1.35130: Flags [P.], cksum 0x0df9 (incorrect -> 0x6325), seq 141141:145189, ack 921, win 512, options [nop,nop,TS val 789286361 ecr 789286359], length 4048
2022-04-05 09:40:41.989595 IP (tos 0x0, ttl 64, id 17040, offset 0, flags [DF], proto TCP (6), length 52)
    127.0.0.1.35130 > 127.0.0.1.10750: Flags [.], cksum 0xfe28 (incorrect -> 0x222e), seq 921, ack 145189, win 512, options [nop,nop,TS val 789286361 ecr 789286361], length 0
2022-04-05 09:40:41.989601 IP (tos 0x0, ttl 64, id 54608, offset 0, flags [DF], proto TCP (6), length 2202)
    127.0.0.1.10750 > 127.0.0.1.35130: Flags [P.], cksum 0x068f (incorrect -> 0x90a5), seq 145189:147339, ack 921, win 512, options [nop,nop,TS val 789286361 ecr 789286361], length 2150
2022-04-05 09:40:41.989607 IP (tos 0x0, ttl 64, id 17041, offset 0, flags [DF], proto TCP (6), length 52)
    127.0.0.1.35130 > 127.0.0.1.10750: Flags [.], cksum 0xfe28 (incorrect -> 0x19c8), seq 921, ack 147339, win 512, options [nop,nop,TS val 789286361 ecr 789286361], length 0
2022-04-05 09:40:41.992329 IP (tos 0x0, ttl 64, id 54609, offset 0, flags [DF], proto TCP (6), length 4100)
    127.0.0.1.10750 > 127.0.0.1.35130: Flags [P.], cksum 0x0df9 (incorrect -> 0xc451), seq 147339:151387, ack 921, win 512, options [nop,nop,TS val 789286363 ecr 789286361], length 4048
2022-04-05 09:40:41.993133 IP (tos 0x0, ttl 64, id 17042, offset 0, flags [DF], proto TCP (6), length 52)
    127.0.0.1.35130 > 127.0.0.1.10750: Flags [.], cksum 0xfe28 (incorrect -> 0x09f3), seq 921, ack 151387, win 512, options [nop,nop,TS val 789286364 ecr 789286363], length 0
2022-04-05 09:40:41.993140 IP (tos 0x0, ttl 64, id 54610, offset 0, flags [DF], proto TCP (6), length 1482)
    127.0.0.1.10750 > 127.0.0.1.35130: Flags [P.], cksum 0x03bf (incorrect -> 0xa888), seq 151387:152817, ack 921, win 512, options [nop,nop,TS val 789286364 ecr 789286364], length 1430
2022-04-05 09:40:41.993146 IP (tos 0x0, ttl 64, id 17043, offset 0, flags [DF], proto TCP (6), length 52)
    127.0.0.1.35130 > 127.0.0.1.10750: Flags [.], cksum 0xfe28 (incorrect -> 0x045c), seq 921, ack 152817, win 512, options [nop,nop,TS val 789286364 ecr 789286364], length 0
2022-04-05 09:40:42.001580 IP (tos 0x0, ttl 64, id 54611, offset 0, flags [DF], proto TCP (6), length 4036)
    127.0.0.1.10750 > 127.0.0.1.35130: Flags [P.], cksum 0x0db9 (incorrect -> 0xc63f), seq 152817:156801, ack 921, win 512, options [nop,nop,TS val 789286373 ecr 789286364], length 3984
2022-04-05 09:40:42.001620 IP (tos 0x0, ttl 64, id 17044, offset 0, flags [DF], proto TCP (6), length 52)
    127.0.0.1.35130 > 127.0.0.1.10750: Flags [.], cksum 0xfe28 (incorrect -> 0xf4b9), seq 921, ack 156801, win 512, options [nop,nop,TS val 789286373 ecr 789286373], length 0
2022-04-05 09:40:42.001626 IP (tos 0x0, ttl 64, id 54612, offset 0, flags [DF], proto TCP (6), length 3538)
    127.0.0.1.10750 > 127.0.0.1.35130: Flags [P.], cksum 0x0bc7 (incorrect -> 0x051e), seq 156801:160287, ack 921, win 512, options [nop,nop,TS val 789286373 ecr 789286373], length 3486
2022-04-05 09:40:42.001632 IP (tos 0x0, ttl 64, id 17045, offset 0, flags [DF], proto TCP (6), length 52)
    127.0.0.1.35130 > 127.0.0.1.10750: Flags [.], cksum 0xfe28 (incorrect -> 0xe71b), seq 921, ack 160287, win 512, options [nop,nop,TS val 789286373 ecr 789286373], length 0
2022-04-05 09:40:42.001733 IP (tos 0x0, ttl 64, id 54613, offset 0, flags [DF], proto TCP (6), length 4100)
    127.0.0.1.10750 > 127.0.0.1.35130: Flags [P.], cksum 0x0df9 (incorrect -> 0xc3cd), seq 160287:164335, ack 921, win 512, options [nop,nop,TS val 789286373 ecr 789286373], length 4048
2022-04-05 09:40:42.001797 IP (tos 0x0, ttl 64, id 17046, offset 0, flags [DF], proto TCP (6), length 52)
    127.0.0.1.35130 > 127.0.0.1.10750: Flags [.], cksum 0xfe28 (incorrect -> 0xd74b), seq 921, ack 164335, win 512, options [nop,nop,TS val 789286373 ecr 789286373], length 0
2022-04-05 09:40:42.001803 IP (tos 0x0, ttl 64, id 54614, offset 0, flags [DF], proto TCP (6), length 8454)
    127.0.0.1.10750 > 127.0.0.1.35130: Flags [P.], cksum 0x1efb (incorrect -> 0x558d), seq 164335:172737, ack 921, win 512, options [nop,nop,TS val 789286373 ecr 789286373], length 8402
2022-04-05 09:40:42.002169 IP (tos 0x0, ttl 64, id 17047, offset 0, flags [DF], proto TCP (6), length 52)
    127.0.0.1.35130 > 127.0.0.1.10750: Flags [.], cksum 0xfe28 (incorrect -> 0xb679), seq 921, ack 172737, win 512, options [nop,nop,TS val 789286373 ecr 789286373], length 0
2022-04-05 09:40:42.003757 IP (tos 0x0, ttl 64, id 54615, offset 0, flags [DF], proto TCP (6), length 3538)
    127.0.0.1.10750 > 127.0.0.1.35130: Flags [P.], cksum 0x0bc7 (incorrect -> 0x68cb), seq 172737:176223, ack 921, win 512, options [nop,nop,TS val 789286375 ecr 789286373], length 3486
2022-04-05 09:40:42.004433 IP (tos 0x0, ttl 64, id 17048, offset 0, flags [DF], proto TCP (6), length 52)
    127.0.0.1.35130 > 127.0.0.1.10750: Flags [.], cksum 0xfe28 (incorrect -> 0xa8d6), seq 921, ack 176223, win 512, options [nop,nop,TS val 789286376 ecr 789286375], length 0
2022-04-05 09:40:42.012685 IP (tos 0x0, ttl 64, id 54616, offset 0, flags [DF], proto TCP (6), length 1546)
    127.0.0.1.10750 > 127.0.0.1.35130: Flags [P.], cksum 0x03ff (incorrect -> 0xcd57), seq 176223:177717, ack 921, win 512, options [nop,nop,TS val 789286384 ecr 789286376], length 1494
2022-04-05 09:40:42.012728 IP (tos 0x0, ttl 64, id 17049, offset 0, flags [DF], proto TCP (6), length 52)
    127.0.0.1.35130 > 127.0.0.1.10750: Flags [.], cksum 0xfe28 (incorrect -> 0xa2ef), seq 921, ack 177717, win 512, options [nop,nop,TS val 789286384 ecr 789286384], length 0
2022-04-05 09:40:42.013611 IP (tos 0x0, ttl 64, id 54617, offset 0, flags [DF], proto TCP (6), length 4100)
    127.0.0.1.10750 > 127.0.0.1.35130: Flags [P.], cksum 0x0df9 (incorrect -> 0xb186), seq 177717:181765, ack 921, win 512, options [nop,nop,TS val 789286385 ecr 789286384], length 4048
2022-04-05 09:40:42.013619 IP (tos 0x0, ttl 64, id 17050, offset 0, flags [DF], proto TCP (6), length 52)
    127.0.0.1.35130 > 127.0.0.1.10750: Flags [.], cksum 0xfe28 (incorrect -> 0x8f1e), seq 921, ack 181765, win 1535, options [nop,nop,TS val 789286385 ecr 789286385], length 0
2022-04-05 09:40:42.013629 IP (tos 0x0, ttl 64, id 54618, offset 0, flags [DF], proto TCP (6), length 3454)
    127.0.0.1.10750 > 127.0.0.1.35130: Flags [P.], cksum 0x0b73 (incorrect -> 0x9a24), seq 181765:185167, ack 921, win 512, options [nop,nop,TS val 789286385 ecr 789286385], length 3402
2022-04-05 09:40:42.013634 IP (tos 0x0, ttl 64, id 17051, offset 0, flags [DF], proto TCP (6), length 52)
    127.0.0.1.35130 > 127.0.0.1.10750: Flags [.], cksum 0xfe28 (incorrect -> 0x7dd4), seq 921, ack 185167, win 2559, options [nop,nop,TS val 789286385 ecr 789286385], length 0
2022-04-05 09:40:42.013682 IP (tos 0x0, ttl 64, id 54619, offset 0, flags [DF], proto TCP (6), length 4100)
    127.0.0.1.10750 > 127.0.0.1.35130: Flags [P.], cksum 0x0df9 (incorrect -> 0xe8b5), seq 185167:189215, ack 921, win 512, options [nop,nop,TS val 789286385 ecr 789286385], length 4048
2022-04-05 09:40:42.013687 IP (tos 0x0, ttl 64, id 17052, offset 0, flags [DF], proto TCP (6), length 52)
    127.0.0.1.35130 > 127.0.0.1.10750: Flags [.], cksum 0xfe28 (incorrect -> 0x6a05), seq 921, ack 189215, win 3582, options [nop,nop,TS val 789286385 ecr 789286385], length 0
2022-04-05 09:40:42.013696 IP (tos 0x0, ttl 64, id 54620, offset 0, flags [DF], proto TCP (6), length 3972)
    127.0.0.1.10750 > 127.0.0.1.35130: Flags [P.], cksum 0x0d79 (incorrect -> 0x61f8), seq 189215:193135, ack 921, win 512, options [nop,nop,TS val 789286385 ecr 789286385], length 3920
2022-04-05 09:40:42.013700 IP (tos 0x0, ttl 64, id 17053, offset 0, flags [DF], proto TCP (6), length 52)
    127.0.0.1.35130 > 127.0.0.1.10750: Flags [.], cksum 0xfe28 (incorrect -> 0x56b6), seq 921, ack 193135, win 4605, options [nop,nop,TS val 789286385 ecr 789286385], length 0
2022-04-05 09:40:42.013751 IP (tos 0x0, ttl 64, id 54621, offset 0, flags [DF], proto TCP (6), length 3558)
    127.0.0.1.10750 > 127.0.0.1.35130: Flags [P.], cksum 0x0bdb (incorrect -> 0x529a), seq 193135:196641, ack 921, win 512, options [nop,nop,TS val 789286385 ecr 789286385], length 3506
2022-04-05 09:40:42.013756 IP (tos 0x0, ttl 64, id 17054, offset 0, flags [DF], proto TCP (6), length 52)
    127.0.0.1.35130 > 127.0.0.1.10750: Flags [.], cksum 0xfe28 (incorrect -> 0x4505), seq 921, ack 196641, win 5628, options [nop,nop,TS val 789286385 ecr 789286385], length 0
2022-04-05 09:40:42.015112 IP (tos 0x0, ttl 64, id 54622, offset 0, flags [DF], proto TCP (6), length 4100)
    127.0.0.1.10750 > 127.0.0.1.35130: Flags [P.], cksum 0x0df9 (incorrect -> 0x4028), seq 196641:200689, ack 921, win 512, options [nop,nop,TS val 789286386 ecr 789286385], length 4048
2022-04-05 09:40:42.015124 IP (tos 0x0, ttl 64, id 17055, offset 0, flags [DF], proto TCP (6), length 52)
    127.0.0.1.35130 > 127.0.0.1.10750: Flags [.], cksum 0xfe28 (incorrect -> 0x3134), seq 921, ack 200689, win 6651, options [nop,nop,TS val 789286386 ecr 789286386], length 0
2022-04-05 09:40:42.015135 IP (tos 0x0, ttl 64, id 54623, offset 0, flags [DF], proto TCP (6), length 984)
    127.0.0.1.10750 > 127.0.0.1.35130: Flags [P.], cksum 0x01cd (incorrect -> 0xf1f1), seq 200689:201621, ack 921, win 512, options [nop,nop,TS val 789286386 ecr 789286386], length 932
2022-04-05 09:40:42.015139 IP (tos 0x0, ttl 64, id 17056, offset 0, flags [DF], proto TCP (6), length 52)
    127.0.0.1.35130 > 127.0.0.1.10750: Flags [.], cksum 0xfe28 (incorrect -> 0x2b90), seq 921, ack 201621, win 7163, options [nop,nop,TS val 789286386 ecr 789286386], length 0
2022-04-05 09:40:42.015184 IP (tos 0x0, ttl 64, id 54624, offset 0, flags [DF], proto TCP (6), length 4100)
    127.0.0.1.10750 > 127.0.0.1.35130: Flags [P.], cksum 0x0df9 (incorrect -> 0x14e4), seq 201621:205669, ack 921, win 512, options [nop,nop,TS val 789286386 ecr 789286386], length 4048
2022-04-05 09:40:42.015189 IP (tos 0x0, ttl 64, id 17057, offset 0, flags [DF], proto TCP (6), length 52)
    127.0.0.1.35130 > 127.0.0.1.10750: Flags [.], cksum 0xfe28 (incorrect -> 0x17c1), seq 921, ack 205669, win 8186, options [nop,nop,TS val 789286386 ecr 789286386], length 0
2022-04-05 09:40:42.015205 IP (tos 0x0, ttl 64, id 54625, offset 0, flags [DF], proto TCP (6), length 3972)
    127.0.0.1.10750 > 127.0.0.1.35130: Flags [P.], cksum 0x0d79 (incorrect -> 0xf368), seq 205669:209589, ack 921, win 512, options [nop,nop,TS val 789286386 ecr 789286386], length 3920
2022-04-05 09:40:42.015210 IP (tos 0x0, ttl 64, id 17058, offset 0, flags [DF], proto TCP (6), length 52)
    127.0.0.1.35130 > 127.0.0.1.10750: Flags [.], cksum 0xfe28 (incorrect -> 0x0471), seq 921, ack 209589, win 9210, options [nop,nop,TS val 789286386 ecr 789286386], length 0
2022-04-05 09:40:42.015645 IP (tos 0x0, ttl 64, id 54626, offset 0, flags [DF], proto TCP (6), length 4100)
    127.0.0.1.10750 > 127.0.0.1.35130: Flags [P.], cksum 0x0df9 (incorrect -> 0x6528), seq 209589:213637, ack 921, win 512, options [nop,nop,TS val 789286387 ecr 789286386], length 4048
2022-04-05 09:40:42.015650 IP (tos 0x0, ttl 64, id 17059, offset 0, flags [DF], proto TCP (6), length 52)
    127.0.0.1.35130 > 127.0.0.1.10750: Flags [.], cksum 0xfe28 (incorrect -> 0xf09f), seq 921, ack 213637, win 10233, options [nop,nop,TS val 789286387 ecr 789286387], length 0
2022-04-05 09:40:42.015657 IP (tos 0x0, ttl 64, id 54627, offset 0, flags [DF], proto TCP (6), length 486)
    127.0.0.1.10750 > 127.0.0.1.35130: Flags [P.], cksum 0xffda (incorrect -> 0xfbc8), seq 213637:214071, ack 921, win 512, options [nop,nop,TS val 789286387 ecr 789286387], length 434
2022-04-05 09:40:42.015661 IP (tos 0x0, ttl 64, id 17060, offset 0, flags [DF], proto TCP (6), length 52)
    127.0.0.1.35130 > 127.0.0.1.10750: Flags [.], cksum 0xfe28 (incorrect -> 0xeced), seq 921, ack 214071, win 10745, options [nop,nop,TS val 789286387 ecr 789286387], length 0
2022-04-05 09:40:42.015689 IP (tos 0x0, ttl 64, id 54628, offset 0, flags [DF], proto TCP (6), length 3538)
    127.0.0.1.10750 > 127.0.0.1.35130: Flags [P.], cksum 0x0bc7 (incorrect -> 0x6db0), seq 214071:217557, ack 921, win 512, options [nop,nop,TS val 789286387 ecr 789286387], length 3486
2022-04-05 09:40:42.015693 IP (tos 0x0, ttl 64, id 17061, offset 0, flags [DF], proto TCP (6), length 52)
    127.0.0.1.35130 > 127.0.0.1.10750: Flags [.], cksum 0xfe28 (incorrect -> 0xdb50), seq 921, ack 217557, win 11768, options [nop,nop,TS val 789286387 ecr 789286387], length 0
2022-04-05 09:40:42.016697 IP (tos 0x0, ttl 64, id 54629, offset 0, flags [DF], proto TCP (6), length 4100)
    127.0.0.1.10750 > 127.0.0.1.35130: Flags [P.], cksum 0x0df9 (incorrect -> 0x82d2), seq 217557:221605, ack 921, win 512, options [nop,nop,TS val 789286388 ecr 789286387], length 4048
2022-04-05 09:40:42.016705 IP (tos 0x0, ttl 64, id 17062, offset 0, flags [DF], proto TCP (6), length 52)
    127.0.0.1.35130 > 127.0.0.1.10750: Flags [.], cksum 0xfe28 (incorrect -> 0xc77f), seq 921, ack 221605, win 12791, options [nop,nop,TS val 789286388 ecr 789286388], length 0
2022-04-05 09:40:42.016714 IP (tos 0x0, ttl 64, id 54630, offset 0, flags [DF], proto TCP (6), length 3474)
    127.0.0.1.10750 > 127.0.0.1.35130: Flags [P.], cksum 0x0b87 (incorrect -> 0x0128), seq 221605:225027, ack 921, win 512, options [nop,nop,TS val 789286388 ecr 789286388], length 3422
2022-04-05 09:40:42.016719 IP (tos 0x0, ttl 64, id 17063, offset 0, flags [DF], proto TCP (6), length 52)
    127.0.0.1.35130 > 127.0.0.1.10750: Flags [.], cksum 0xfe28 (incorrect -> 0xb63f), seq 921, ack 225027, win 13785, options [nop,nop,TS val 789286388 ecr 789286388], length 0
2022-04-05 09:40:42.016762 IP (tos 0x0, ttl 64, id 54631, offset 0, flags [DF], proto TCP (6), length 4100)
    127.0.0.1.10750 > 127.0.0.1.35130: Flags [P.], cksum 0x0df9 (incorrect -> 0x1896), seq 225027:229075, ack 921, win 512, options [nop,nop,TS val 789286388 ecr 789286388], length 4048
2022-04-05 09:40:42.016819 IP (tos 0x0, ttl 64, id 17064, offset 0, flags [DF], proto TCP (6), length 52)
    127.0.0.1.35130 > 127.0.0.1.10750: Flags [.], cksum 0xfe28 (incorrect -> 0xa66f), seq 921, ack 229075, win 13785, options [nop,nop,TS val 789286388 ecr 789286388], length 0
200, 4.464195251464844, 0.5770058631896973