2022-04-05 13:34:59.548895 IP (tos 0x0, ttl 64, id 44074, offset 0, flags [DF], proto TCP (6), length 60)
    127.0.0.1.53774 > 127.0.0.1.11050: Flags [S], cksum 0xfe30 (incorrect -> 0xb308), seq 3342983635, win 65495, options [mss 65495,sackOK,TS val 247982051 ecr 0,nop,wscale 7], length 0
2022-04-05 13:34:59.548904 IP (tos 0x0, ttl 64, id 0, offset 0, flags [DF], proto TCP (6), length 60)
    127.0.0.1.11050 > 127.0.0.1.53774: Flags [S.], cksum 0xfe30 (incorrect -> 0x7c5b), seq 3746455726, ack 3342983636, win 65483, options [mss 65495,sackOK,TS val 247982051 ecr 247982051,nop,wscale 7], length 0
2022-04-05 13:34:59.548912 IP (tos 0x0, ttl 64, id 44075, offset 0, flags [DF], proto TCP (6), length 52)
    127.0.0.1.53774 > 127.0.0.1.11050: Flags [.], cksum 0xfe28 (incorrect -> 0xa317), seq 1, ack 1, win 512, options [nop,nop,TS val 247982051 ecr 247982051], length 0
2022-04-05 13:34:59.548999 IP (tos 0x0, ttl 64, id 44076, offset 0, flags [DF], proto TCP (6), length 55)
    127.0.0.1.53774 > 127.0.0.1.11050: Flags [P.], cksum 0xfe2b (incorrect -> 0x9e0b), seq 1:4, ack 1, win 512, options [nop,nop,TS val 247982051 ecr 247982051], length 3
2022-04-05 13:34:59.549013 IP (tos 0x0, ttl 64, id 55875, offset 0, flags [DF], proto TCP (6), length 52)
    127.0.0.1.11050 > 127.0.0.1.53774: Flags [.], cksum 0xfe28 (incorrect -> 0xa314), seq 1, ack 4, win 512, options [nop,nop,TS val 247982051 ecr 247982051], length 0
2022-04-05 13:34:59.549036 IP (tos 0x0, ttl 64, id 55876, offset 0, flags [DF], proto TCP (6), length 54)
    127.0.0.1.11050 > 127.0.0.1.53774: Flags [P.], cksum 0xfe2a (incorrect -> 0x9e0a), seq 1:3, ack 4, win 512, options [nop,nop,TS val 247982051 ecr 247982051], length 2
2022-04-05 13:34:59.549048 IP (tos 0x0, ttl 64, id 44077, offset 0, flags [DF], proto TCP (6), length 52)
    127.0.0.1.53774 > 127.0.0.1.11050: Flags [.], cksum 0xfe28 (incorrect -> 0xa312), seq 4, ack 3, win 512, options [nop,nop,TS val 247982051 ecr 247982051], length 0
2022-04-05 13:34:59.550441 IP (tos 0x0, ttl 64, id 44078, offset 0, flags [DF], proto TCP (6), length 62)
    127.0.0.1.53774 > 127.0.0.1.11050: Flags [P.], cksum 0xfe32 (incorrect -> 0xf67b), seq 4:14, ack 3, win 512, options [nop,nop,TS val 247982053 ecr 247982051], length 10
2022-04-05 13:34:59.550458 IP (tos 0x0, ttl 64, id 55877, offset 0, flags [DF], proto TCP (6), length 52)
    127.0.0.1.11050 > 127.0.0.1.53774: Flags [.], cksum 0xfe28 (incorrect -> 0xa304), seq 3, ack 14, win 512, options [nop,nop,TS val 247982053 ecr 247982053], length 0
200, 3.9697539806365967, 1.077486276626587