2022-04-05 03:21:11.119788 IP (tos 0x0, ttl 64, id 47391, offset 0, flags [DF], proto TCP (6), length 60)
    127.0.0.1.34730 > 127.0.0.1.10750: Flags [S], cksum 0xfe30 (incorrect -> 0x9a63), seq 3247176598, win 65495, options [mss 65495,sackOK,TS val 766515491 ecr 0,nop,wscale 7], length 0
2022-04-05 03:21:11.119810 IP (tos 0x0, ttl 64, id 0, offset 0, flags [DF], proto TCP (6), length 60)
    127.0.0.1.10750 > 127.0.0.1.34730: Flags [S.], cksum 0xfe30 (incorrect -> 0xde4a), seq 3538657876, ack 3247176599, win 65483, options [mss 65495,sackOK,TS val 766515491 ecr 766515491,nop,wscale 7], length 0
2022-04-05 03:21:11.119825 IP (tos 0x0, ttl 64, id 47392, offset 0, flags [DF], proto TCP (6), length 52)
    127.0.0.1.34730 > 127.0.0.1.10750: Flags [.], cksum 0xfe28 (incorrect -> 0x0507), seq 1, ack 1, win 512, options [nop,nop,TS val 766515491 ecr 766515491], length 0
2022-04-05 03:21:11.119985 IP (tos 0x0, ttl 64, id 47393, offset 0, flags [DF], proto TCP (6), length 55)
    127.0.0.1.34730 > 127.0.0.1.10750: Flags [P.], cksum 0xfe2b (incorrect -> 0xfffa), seq 1:4, ack 1, win 512, options [nop,nop,TS val 766515491 ecr 766515491], length 3
2022-04-05 03:21:11.119995 IP (tos 0x0, ttl 64, id 19468, offset 0, flags [DF], proto TCP (6), length 52)
    127.0.0.1.10750 > 127.0.0.1.34730: Flags [.], cksum 0xfe28 (incorrect -> 0x0504), seq 1, ack 4, win 512, options [nop,nop,TS val 766515491 ecr 766515491], length 0
2022-04-05 03:21:11.120023 IP (tos 0x0, ttl 64, id 19469, offset 0, flags [DF], proto TCP (6), length 54)
    127.0.0.1.10750 > 127.0.0.1.34730: Flags [P.], cksum 0xfe2a (incorrect -> 0xfff9), seq 1:3, ack 4, win 512, options [nop,nop,TS val 766515491 ecr 766515491], length 2
2022-04-05 03:21:11.120033 IP (tos 0x0, ttl 64, id 47394, offset 0, flags [DF], proto TCP (6), length 52)
    127.0.0.1.34730 > 127.0.0.1.10750: Flags [.], cksum 0xfe28 (incorrect -> 0x0502), seq 4, ack 3, win 512, options [nop,nop,TS val 766515491 ecr 766515491], length 0
2022-04-05 03:21:11.121557 IP (tos 0x0, ttl 64, id 47395, offset 0, flags [DF], proto TCP (6), length 62)
    127.0.0.1.34730 > 127.0.0.1.10750: Flags [P.], cksum 0xfe32 (incorrect -> 0xb762), seq 4:14, ack 3, win 512, options [nop,nop,TS val 766515493 ecr 766515491], length 10
2022-04-05 03:21:11.121576 IP (tos 0x0, ttl 64, id 19470, offset 0, flags [DF], proto TCP (6), length 52)
    127.0.0.1.10750 > 127.0.0.1.34730: Flags [.], cksum 0xfe28 (incorrect -> 0x04f4), seq 3, ack 14, win 512, options [nop,nop,TS val 766515493 ecr 766515493], length 0
2022-04-05 03:21:11.310957 IP (tos 0x0, ttl 64, id 19471, offset 0, flags [DF], proto TCP (6), length 62)
    127.0.0.1.10750 > 127.0.0.1.34730: Flags [P.], cksum 0xfe32 (incorrect -> 0xff23), seq 3:13, ack 14, win 512, options [nop,nop,TS val 766515682 ecr 766515493], length 10
2022-04-05 03:21:11.310972 IP (tos 0x0, ttl 64, id 47396, offset 0, flags [DF], proto TCP (6), length 52)
    127.0.0.1.34730 > 127.0.0.1.10750: Flags [.], cksum 0xfe28 (incorrect -> 0x0370), seq 14, ack 13, win 512, options [nop,nop,TS val 766515682 ecr 766515682], length 0
2022-04-05 03:21:11.317016 IP (tos 0x0, ttl 64, id 47397, offset 0, flags [DF], proto TCP (6), length 569)
    127.0.0.1.34730 > 127.0.0.1.10750: Flags [P.], cksum 0x002e (incorrect -> 0xfb76), seq 14:531, ack 13, win 512, options [nop,nop,TS val 766515688 ecr 766515682], length 517
2022-04-05 03:21:11.317028 IP (tos 0x0, ttl 64, id 19472, offset 0, flags [DF], proto TCP (6), length 52)
    127.0.0.1.10750 > 127.0.0.1.34730: Flags [.], cksum 0xfe28 (incorrect -> 0x0163), seq 13, ack 531, win 508, options [nop,nop,TS val 766515688 ecr 766515688], length 0
2022-04-05 03:21:11.504145 IP (tos 0x0, ttl 64, id 19473, offset 0, flags [DF], proto TCP (6), length 3340)
    127.0.0.1.10750 > 127.0.0.1.34730: Flags [P.], cksum 0x0b01 (incorrect -> 0x4ef7), seq 13:3301, ack 531, win 512, options [nop,nop,TS val 766515875 ecr 766515688], length 3288
2022-04-05 03:21:11.504154 IP (tos 0x0, ttl 64, id 47398, offset 0, flags [DF], proto TCP (6), length 52)
    127.0.0.1.34730 > 127.0.0.1.10750: Flags [.], cksum 0xfe28 (incorrect -> 0xf321), seq 531, ack 3301, win 495, options [nop,nop,TS val 766515875 ecr 766515875], length 0
2022-04-05 03:21:11.504576 IP (tos 0x0, ttl 64, id 47399, offset 0, flags [DF], proto TCP (6), length 145)
    127.0.0.1.34730 > 127.0.0.1.10750: Flags [P.], cksum 0xfe85 (incorrect -> 0xddb6), seq 531:624, ack 3301, win 512, options [nop,nop,TS val 766515876 ecr 766515875], length 93
2022-04-05 03:21:11.504587 IP (tos 0x0, ttl 64, id 19474, offset 0, flags [DF], proto TCP (6), length 52)
    127.0.0.1.10750 > 127.0.0.1.34730: Flags [.], cksum 0xfe28 (incorrect -> 0xf2b1), seq 3301, ack 624, win 512, options [nop,nop,TS val 766515876 ecr 766515876], length 0
2022-04-05 03:21:11.718771 IP (tos 0x0, ttl 64, id 19475, offset 0, flags [DF], proto TCP (6), length 103)
    127.0.0.1.10750 > 127.0.0.1.34730: Flags [P.], cksum 0xfe5b (incorrect -> 0xb35a), seq 3301:3352, ack 624, win 512, options [nop,nop,TS val 766516090 ecr 766515876], length 51
2022-04-05 03:21:11.718781 IP (tos 0x0, ttl 64, id 47400, offset 0, flags [DF], proto TCP (6), length 52)
    127.0.0.1.34730 > 127.0.0.1.10750: Flags [.], cksum 0xfe28 (incorrect -> 0xf0d2), seq 624, ack 3352, win 512, options [nop,nop,TS val 766516090 ecr 766516090], length 0
2022-04-05 03:21:11.719140 IP (tos 0x0, ttl 64, id 47401, offset 0, flags [DF], proto TCP (6), length 356)
    127.0.0.1.34730 > 127.0.0.1.10750: Flags [P.], cksum 0xff58 (incorrect -> 0xdb6a), seq 624:928, ack 3352, win 512, options [nop,nop,TS val 766516090 ecr 766516090], length 304
2022-04-05 03:21:11.719149 IP (tos 0x0, ttl 64, id 19476, offset 0, flags [DF], proto TCP (6), length 52)
    127.0.0.1.10750 > 127.0.0.1.34730: Flags [.], cksum 0xfe28 (incorrect -> 0xefa4), seq 3352, ack 928, win 510, options [nop,nop,TS val 766516090 ecr 766516090], length 0
2022-04-05 03:21:11.970188 IP (tos 0x0, ttl 64, id 19477, offset 0, flags [DF], proto TCP (6), length 3538)
    127.0.0.1.10750 > 127.0.0.1.34730: Flags [P.], cksum 0x0bc7 (incorrect -> 0xb90a), seq 3352:6838, ack 928, win 512, options [nop,nop,TS val 766516341 ecr 766516090], length 3486
2022-04-05 03:21:12.013384 IP (tos 0x0, ttl 64, id 47402, offset 0, flags [DF], proto TCP (6), length 52)
    127.0.0.1.34730 > 127.0.0.1.10750: Flags [.], cksum 0xfe28 (incorrect -> 0xdfe3), seq 928, ack 6838, win 512, options [nop,nop,TS val 766516384 ecr 766516341], length 0
2022-04-05 03:21:12.013394 IP (tos 0x0, ttl 64, id 19478, offset 0, flags [DF], proto TCP (6), length 11506)
    127.0.0.1.10750 > 127.0.0.1.34730: Flags [P.], cksum 0x2ae7 (incorrect -> 0x9998), seq 6838:18292, ack 928, win 512, options [nop,nop,TS val 766516384 ecr 766516384], length 11454
2022-04-05 03:21:12.013401 IP (tos 0x0, ttl 64, id 47403, offset 0, flags [DF], proto TCP (6), length 52)
    127.0.0.1.34730 > 127.0.0.1.10750: Flags [.], cksum 0xfe28 (incorrect -> 0xb32a), seq 928, ack 18292, win 463, options [nop,nop,TS val 766516385 ecr 766516384], length 0
2022-04-05 03:21:12.014835 IP (tos 0x0, ttl 64, id 19479, offset 0, flags [DF], proto TCP (6), length 2488)
    127.0.0.1.10750 > 127.0.0.1.34730: Flags [P.], cksum 0x07ad (incorrect -> 0x6888), seq 18292:20728, ack 928, win 512, options [nop,nop,TS val 766516386 ecr 766516385], length 2436
2022-04-05 03:21:12.014842 IP (tos 0x0, ttl 64, id 47404, offset 0, flags [DF], proto TCP (6), length 52)
    127.0.0.1.34730 > 127.0.0.1.10750: Flags [.], cksum 0xfe28 (incorrect -> 0xa980), seq 928, ack 20728, win 498, options [nop,nop,TS val 766516386 ecr 766516386], length 0
2022-04-05 03:21:12.073060 IP (tos 0x0, ttl 64, id 19480, offset 0, flags [DF], proto TCP (6), length 3538)
    127.0.0.1.10750 > 127.0.0.1.34730: Flags [P.], cksum 0x0bc7 (incorrect -> 0x1d1f), seq 20728:24214, ack 928, win 512, options [nop,nop,TS val 766516444 ecr 766516386], length 3486
2022-04-05 03:21:12.073072 IP (tos 0x0, ttl 64, id 47405, offset 0, flags [DF], proto TCP (6), length 52)
    127.0.0.1.34730 > 127.0.0.1.10750: Flags [.], cksum 0xfe28 (incorrect -> 0x9b72), seq 928, ack 24214, win 494, options [nop,nop,TS val 766516444 ecr 766516444], length 0
2022-04-05 03:21:12.077586 IP (tos 0x0, ttl 64, id 19481, offset 0, flags [DF], proto TCP (6), length 4100)
    127.0.0.1.10750 > 127.0.0.1.34730: Flags [P.], cksum 0x0df9 (incorrect -> 0xadf3), seq 24214:28262, ack 928, win 512, options [nop,nop,TS val 766516449 ecr 766516444], length 4048
2022-04-05 03:21:12.077606 IP (tos 0x0, ttl 64, id 47406, offset 0, flags [DF], proto TCP (6), length 52)
    127.0.0.1.34730 > 127.0.0.1.10750: Flags [.], cksum 0xfe28 (incorrect -> 0x8b9a), seq 928, ack 28262, win 492, options [nop,nop,TS val 766516449 ecr 766516449], length 0
2022-04-05 03:21:12.077617 IP (tos 0x0, ttl 64, id 19482, offset 0, flags [DF], proto TCP (6), length 2746)
    127.0.0.1.10750 > 127.0.0.1.34730: Flags [P.], cksum 0x08af (incorrect -> 0xc9cd), seq 28262:30956, ack 928, win 512, options [nop,nop,TS val 766516449 ecr 766516449], length 2694
2022-04-05 03:21:12.077623 IP (tos 0x0, ttl 64, id 47407, offset 0, flags [DF], proto TCP (6), length 52)
    127.0.0.1.34730 > 127.0.0.1.10750: Flags [.], cksum 0xfe28 (incorrect -> 0x811f), seq 928, ack 30956, win 481, options [nop,nop,TS val 766516449 ecr 766516449], length 0
2022-04-05 03:21:12.077666 IP (tos 0x0, ttl 64, id 19483, offset 0, flags [DF], proto TCP (6), length 4100)
    127.0.0.1.10750 > 127.0.0.1.34730: Flags [P.], cksum 0x0df9 (incorrect -> 0xfb31), seq 30956:35004, ack 928, win 512, options [nop,nop,TS val 766516449 ecr 766516449], length 4048
2022-04-05 03:21:12.077671 IP (tos 0x0, ttl 64, id 47408, offset 0, flags [DF], proto TCP (6), length 52)
    127.0.0.1.34730 > 127.0.0.1.10750: Flags [.], cksum 0xfe28 (incorrect -> 0x715f), seq 928, ack 35004, win 465, options [nop,nop,TS val 766516449 ecr 766516449], length 0
2022-04-05 03:21:12.077677 IP (tos 0x0, ttl 64, id 19484, offset 0, flags [DF], proto TCP (6), length 2976)
    127.0.0.1.10750 > 127.0.0.1.34730: Flags [P.], cksum 0x0995 (incorrect -> 0xb2f2), seq 35004:37928, ack 928, win 512, options [nop,nop,TS val 766516449 ecr 766516449], length 2924
2022-04-05 03:21:12.077681 IP (tos 0x0, ttl 64, id 47409, offset 0, flags [DF], proto TCP (6), length 52)
    127.0.0.1.34730 > 127.0.0.1.10750: Flags [.], cksum 0xfe28 (incorrect -> 0x65fe), seq 928, ack 37928, win 454, options [nop,nop,TS val 766516449 ecr 766516449], length 0
2022-04-05 03:21:12.095954 IP (tos 0x0, ttl 64, id 19485, offset 0, flags [DF], proto TCP (6), length 3538)
    127.0.0.1.10750 > 127.0.0.1.34730: Flags [P.], cksum 0x0bc7 (incorrect -> 0xfa70), seq 37928:41414, ack 928, win 512, options [nop,nop,TS val 766516467 ecr 766516449], length 3486
2022-04-05 03:21:12.095967 IP (tos 0x0, ttl 64, id 47410, offset 0, flags [DF], proto TCP (6), length 52)
    127.0.0.1.34730 > 127.0.0.1.10750: Flags [.], cksum 0xfe28 (incorrect -> 0x5814), seq 928, ack 41414, win 494, options [nop,nop,TS val 766516467 ecr 766516467], length 0
2022-04-05 03:21:12.096006 IP (tos 0x0, ttl 64, id 19486, offset 0, flags [DF], proto TCP (6), length 4036)
    127.0.0.1.10750 > 127.0.0.1.34730: Flags [P.], cksum 0x0db9 (incorrect -> 0x430d), seq 41414:45398, ack 928, win 512, options [nop,nop,TS val 766516467 ecr 766516467], length 3984
2022-04-05 03:21:12.096043 IP (tos 0x0, ttl 64, id 47411, offset 0, flags [DF], proto TCP (6), length 52)
    127.0.0.1.34730 > 127.0.0.1.10750: Flags [.], cksum 0xfe28 (incorrect -> 0x4872), seq 928, ack 45398, win 512, options [nop,nop,TS val 766516467 ecr 766516467], length 0
2022-04-05 03:21:12.111340 IP (tos 0x0, ttl 64, id 19487, offset 0, flags [DF], proto TCP (6), length 2044)
    127.0.0.1.10750 > 127.0.0.1.34730: Flags [P.], cksum 0x05f1 (incorrect -> 0x3433), seq 45398:47390, ack 928, win 512, options [nop,nop,TS val 766516482 ecr 766516467], length 1992
2022-04-05 03:21:12.111371 IP (tos 0x0, ttl 64, id 47412, offset 0, flags [DF], proto TCP (6), length 52)
    127.0.0.1.34730 > 127.0.0.1.10750: Flags [.], cksum 0xfe28 (incorrect -> 0x408c), seq 928, ack 47390, win 512, options [nop,nop,TS val 766516482 ecr 766516482], length 0
2022-04-05 03:21:12.164797 IP (tos 0x0, ttl 64, id 19488, offset 0, flags [DF], proto TCP (6), length 3798)
    127.0.0.1.10750 > 127.0.0.1.34730: Flags [P.], cksum 0x0ccb (incorrect -> 0xba7b), seq 47390:51136, ack 928, win 512, options [nop,nop,TS val 766516536 ecr 766516482], length 3746
2022-04-05 03:21:12.164835 IP (tos 0x0, ttl 64, id 47413, offset 0, flags [DF], proto TCP (6), length 52)
    127.0.0.1.34730 > 127.0.0.1.10750: Flags [.], cksum 0xfe28 (incorrect -> 0x317e), seq 928, ack 51136, win 512, options [nop,nop,TS val 766516536 ecr 766516536], length 0
2022-04-05 03:21:12.212411 IP (tos 0x0, ttl 64, id 19489, offset 0, flags [DF], proto TCP (6), length 3538)
    127.0.0.1.10750 > 127.0.0.1.34730: Flags [P.], cksum 0x0bc7 (incorrect -> 0x6a1d), seq 51136:54622, ack 928, win 512, options [nop,nop,TS val 766516584 ecr 766516536], length 3486
2022-04-05 03:21:12.212785 IP (tos 0x0, ttl 64, id 47414, offset 0, flags [DF], proto TCP (6), length 52)
    127.0.0.1.34730 > 127.0.0.1.10750: Flags [.], cksum 0xfe28 (incorrect -> 0x2380), seq 928, ack 54622, win 512, options [nop,nop,TS val 766516584 ecr 766516584], length 0
2022-04-05 03:21:12.212813 IP (tos 0x0, ttl 64, id 19490, offset 0, flags [DF], proto TCP (6), length 8020)
    127.0.0.1.10750 > 127.0.0.1.34730: Flags [P.], cksum 0x1d49 (incorrect -> 0xefac), seq 54622:62590, ack 928, win 512, options [nop,nop,TS val 766516584 ecr 766516584], length 7968
2022-04-05 03:21:12.212828 IP (tos 0x0, ttl 64, id 47415, offset 0, flags [DF], proto TCP (6), length 52)
    127.0.0.1.34730 > 127.0.0.1.10750: Flags [.], cksum 0xfe28 (incorrect -> 0x0460), seq 928, ack 62590, win 512, options [nop,nop,TS val 766516584 ecr 766516584], length 0
2022-04-05 03:21:12.227903 IP (tos 0x0, ttl 64, id 19491, offset 0, flags [DF], proto TCP (6), length 4100)
    127.0.0.1.10750 > 127.0.0.1.34730: Flags [P.], cksum 0x0df9 (incorrect -> 0x07a4), seq 62590:66638, ack 928, win 512, options [nop,nop,TS val 766516599 ecr 766516584], length 4048
2022-04-05 03:21:12.227932 IP (tos 0x0, ttl 64, id 47416, offset 0, flags [DF], proto TCP (6), length 52)
    127.0.0.1.34730 > 127.0.0.1.10750: Flags [.], cksum 0xfe28 (incorrect -> 0xf471), seq 928, ack 66638, win 512, options [nop,nop,TS val 766516599 ecr 766516599], length 0
2022-04-05 03:21:12.227938 IP (tos 0x0, ttl 64, id 19492, offset 0, flags [DF], proto TCP (6), length 486)
    127.0.0.1.10750 > 127.0.0.1.34730: Flags [P.], cksum 0xffda (incorrect -> 0xa432), seq 66638:67072, ack 928, win 512, options [nop,nop,TS val 766516599 ecr 766516599], length 434
2022-04-05 03:21:12.227943 IP (tos 0x0, ttl 64, id 47417, offset 0, flags [DF], proto TCP (6), length 52)
    127.0.0.1.34730 > 127.0.0.1.10750: Flags [.], cksum 0xfe28 (incorrect -> 0xf2bf), seq 928, ack 67072, win 512, options [nop,nop,TS val 766516599 ecr 766516599], length 0
2022-04-05 03:21:12.246105 IP (tos 0x0, ttl 64, id 19493, offset 0, flags [DF], proto TCP (6), length 3538)
    127.0.0.1.10750 > 127.0.0.1.34730: Flags [P.], cksum 0x0bc7 (incorrect -> 0xbf42), seq 67072:70558, ack 928, win 512, options [nop,nop,TS val 766516617 ecr 766516599], length 3486
2022-04-05 03:21:12.246282 IP (tos 0x0, ttl 64, id 47418, offset 0, flags [DF], proto TCP (6), length 52)
    127.0.0.1.34730 > 127.0.0.1.10750: Flags [.], cksum 0xfe28 (incorrect -> 0xe4fd), seq 928, ack 70558, win 512, options [nop,nop,TS val 766516617 ecr 766516617], length 0
2022-04-05 03:21:12.246363 IP (tos 0x0, ttl 64, id 19494, offset 0, flags [DF], proto TCP (6), length 4036)
    127.0.0.1.10750 > 127.0.0.1.34730: Flags [P.], cksum 0x0db9 (incorrect -> 0xccfb), seq 70558:74542, ack 928, win 512, options [nop,nop,TS val 766516617 ecr 766516617], length 3984
2022-04-05 03:21:12.246382 IP (tos 0x0, ttl 64, id 47419, offset 0, flags [DF], proto TCP (6), length 52)
    127.0.0.1.34730 > 127.0.0.1.10750: Flags [.], cksum 0xfe28 (incorrect -> 0xd56d), seq 928, ack 74542, win 512, options [nop,nop,TS val 766516617 ecr 766516617], length 0
2022-04-05 03:21:12.249113 IP (tos 0x0, ttl 64, id 19495, offset 0, flags [DF], proto TCP (6), length 4100)
    127.0.0.1.10750 > 127.0.0.1.34730: Flags [P.], cksum 0x0df9 (incorrect -> 0xb1a4), seq 74542:78590, ack 928, win 512, options [nop,nop,TS val 766516620 ecr 766516617], length 4048
2022-04-05 03:21:12.249140 IP (tos 0x0, ttl 64, id 47420, offset 0, flags [DF], proto TCP (6), length 52)
    127.0.0.1.34730 > 127.0.0.1.10750: Flags [.], cksum 0xfe28 (incorrect -> 0xc597), seq 928, ack 78590, win 512, options [nop,nop,TS val 766516620 ecr 766516620], length 0
2022-04-05 03:21:12.249151 IP (tos 0x0, ttl 64, id 19496, offset 0, flags [DF], proto TCP (6), length 486)
    127.0.0.1.10750 > 127.0.0.1.34730: Flags [P.], cksum 0xffda (incorrect -> 0xe938), seq 78590:79024, ack 928, win 512, options [nop,nop,TS val 766516620 ecr 766516620], length 434
2022-04-05 03:21:12.249156 IP (tos 0x0, ttl 64, id 47421, offset 0, flags [DF], proto TCP (6), length 52)
    127.0.0.1.34730 > 127.0.0.1.10750: Flags [.], cksum 0xfe28 (incorrect -> 0xc3e5), seq 928, ack 79024, win 512, options [nop,nop,TS val 766516620 ecr 766516620], length 0
2022-04-05 03:21:12.249197 IP (tos 0x0, ttl 64, id 19497, offset 0, flags [DF], proto TCP (6), length 3538)
    127.0.0.1.10750 > 127.0.0.1.34730: Flags [P.], cksum 0x0bc7 (incorrect -> 0xbe9a), seq 79024:82510, ack 928, win 512, options [nop,nop,TS val 766516620 ecr 766516620], length 3486
2022-04-05 03:21:12.249209 IP (tos 0x0, ttl 64, id 47422, offset 0, flags [DF], proto TCP (6), length 52)
    127.0.0.1.34730 > 127.0.0.1.10750: Flags [.], cksum 0xfe28 (incorrect -> 0xb647), seq 928, ack 82510, win 512, options [nop,nop,TS val 766516620 ecr 766516620], length 0
2022-04-05 03:21:12.249256 IP (tos 0x0, ttl 64, id 19498, offset 0, flags [DF], proto TCP (6), length 4036)
    127.0.0.1.10750 > 127.0.0.1.34730: Flags [P.], cksum 0x0db9 (incorrect -> 0xca5f), seq 82510:86494, ack 928, win 512, options [nop,nop,TS val 766516620 ecr 766516620], length 3984
2022-04-05 03:21:12.249317 IP (tos 0x0, ttl 64, id 47423, offset 0, flags [DF], proto TCP (6), length 52)
    127.0.0.1.34730 > 127.0.0.1.10750: Flags [.], cksum 0xfe28 (incorrect -> 0xa6b7), seq 928, ack 86494, win 512, options [nop,nop,TS val 766516620 ecr 766516620], length 0
2022-04-05 03:21:12.249365 IP (tos 0x0, ttl 64, id 19499, offset 0, flags [DF], proto TCP (6), length 4036)
    127.0.0.1.10750 > 127.0.0.1.34730: Flags [P.], cksum 0x0db9 (incorrect -> 0x68c8), seq 86494:90478, ack 928, win 512, options [nop,nop,TS val 766516620 ecr 766516620], length 3984
2022-04-05 03:21:12.293412 IP (tos 0x0, ttl 64, id 47424, offset 0, flags [DF], proto TCP (6), length 52)
    127.0.0.1.34730 > 127.0.0.1.10750: Flags [.], cksum 0xfe28 (incorrect -> 0x96fb), seq 928, ack 90478, win 512, options [nop,nop,TS val 766516664 ecr 766516620], length 0
2022-04-05 03:21:12.293433 IP (tos 0x0, ttl 64, id 19500, offset 0, flags [DF], proto TCP (6), length 24246)
    127.0.0.1.10750 > 127.0.0.1.34730: Flags [P.], cksum 0x5cab (incorrect -> 0x9370), seq 90478:114672, ack 928, win 512, options [nop,nop,TS val 766516665 ecr 766516664], length 24194
2022-04-05 03:21:12.341393 IP (tos 0x0, ttl 64, id 47425, offset 0, flags [DF], proto TCP (6), length 52)
    127.0.0.1.34730 > 127.0.0.1.10750: Flags [.], cksum 0xfe28 (incorrect -> 0x381c), seq 928, ack 114672, win 512, options [nop,nop,TS val 766516712 ecr 766516665], length 0
2022-04-05 03:21:12.341414 IP (tos 0x0, ttl 64, id 19501, offset 0, flags [DF], proto TCP (6), length 29188)
    127.0.0.1.10750 > 127.0.0.1.34730: Flags [P.], cksum 0x6ff9 (incorrect -> 0x88e2), seq 114672:143808, ack 928, win 512, options [nop,nop,TS val 766516713 ecr 766516712], length 29136
2022-04-05 03:21:12.385397 IP (tos 0x0, ttl 64, id 47426, offset 0, flags [DF], proto TCP (6), length 52)
    127.0.0.1.34730 > 127.0.0.1.10750: Flags [.], cksum 0xfe28 (incorrect -> 0xc5ef), seq 928, ack 143808, win 512, options [nop,nop,TS val 766516756 ecr 766516713], length 0
2022-04-05 03:21:12.389867 IP (tos 0x0, ttl 64, id 19502, offset 0, flags [DF], proto TCP (6), length 3538)
    127.0.0.1.10750 > 127.0.0.1.34730: Flags [P.], cksum 0x0bc7 (incorrect -> 0x08f6), seq 143808:147294, ack 928, win 512, options [nop,nop,TS val 766516761 ecr 766516756], length 3486
2022-04-05 03:21:12.389904 IP (tos 0x0, ttl 64, id 47427, offset 0, flags [DF], proto TCP (6), length 52)
    127.0.0.1.34730 > 127.0.0.1.10750: Flags [.], cksum 0xfe28 (incorrect -> 0xb81c), seq 928, ack 147294, win 512, options [nop,nop,TS val 766516761 ecr 766516761], length 0
2022-04-05 03:21:12.391915 IP (tos 0x0, ttl 64, id 19503, offset 0, flags [DF], proto TCP (6), length 4036)
    127.0.0.1.10750 > 127.0.0.1.34730: Flags [P.], cksum 0x0db9 (incorrect -> 0xe4d8), seq 147294:151278, ack 928, win 512, options [nop,nop,TS val 766516763 ecr 766516761], length 3984
2022-04-05 03:21:12.392076 IP (tos 0x0, ttl 64, id 47428, offset 0, flags [DF], proto TCP (6), length 52)
    127.0.0.1.34730 > 127.0.0.1.10750: Flags [.], cksum 0xfe28 (incorrect -> 0xa888), seq 928, ack 151278, win 512, options [nop,nop,TS val 766516763 ecr 766516763], length 0
2022-04-05 03:21:12.392083 IP (tos 0x0, ttl 64, id 19504, offset 0, flags [DF], proto TCP (6), length 3538)
    127.0.0.1.10750 > 127.0.0.1.34730: Flags [P.], cksum 0x0bc7 (incorrect -> 0x23af), seq 151278:154764, ack 928, win 512, options [nop,nop,TS val 766516763 ecr 766516763], length 3486
2022-04-05 03:21:12.392091 IP (tos 0x0, ttl 64, id 47429, offset 0, flags [DF], proto TCP (6), length 52)
    127.0.0.1.34730 > 127.0.0.1.10750: Flags [.], cksum 0xfe28 (incorrect -> 0x9aea), seq 928, ack 154764, win 512, options [nop,nop,TS val 766516763 ecr 766516763], length 0
2022-04-05 03:21:12.392160 IP (tos 0x0, ttl 64, id 19505, offset 0, flags [DF], proto TCP (6), length 4100)
    127.0.0.1.10750 > 127.0.0.1.34730: Flags [P.], cksum 0x0df9 (incorrect -> 0xed0a), seq 154764:158812, ack 928, win 512, options [nop,nop,TS val 766516763 ecr 766516763], length 4048
2022-04-05 03:21:12.392184 IP (tos 0x0, ttl 64, id 47430, offset 0, flags [DF], proto TCP (6), length 52)
    127.0.0.1.34730 > 127.0.0.1.10750: Flags [.], cksum 0xfe28 (incorrect -> 0x8b1a), seq 928, ack 158812, win 512, options [nop,nop,TS val 766516763 ecr 766516763], length 0
2022-04-05 03:21:12.392190 IP (tos 0x0, ttl 64, id 19506, offset 0, flags [DF], proto TCP (6), length 3972)
    127.0.0.1.10750 > 127.0.0.1.34730: Flags [P.], cksum 0x0d79 (incorrect -> 0x767e), seq 158812:162732, ack 928, win 512, options [nop,nop,TS val 766516763 ecr 766516763], length 3920
2022-04-05 03:21:12.392197 IP (tos 0x0, ttl 64, id 47431, offset 0, flags [DF], proto TCP (6), length 52)
    127.0.0.1.34730 > 127.0.0.1.10750: Flags [.], cksum 0xfe28 (incorrect -> 0x7bca), seq 928, ack 162732, win 512, options [nop,nop,TS val 766516763 ecr 766516763], length 0
2022-04-05 03:21:12.395403 IP (tos 0x0, ttl 64, id 19507, offset 0, flags [DF], proto TCP (6), length 4036)
    127.0.0.1.10750 > 127.0.0.1.34730: Flags [P.], cksum 0x0db9 (incorrect -> 0xf4be), seq 162732:166716, ack 928, win 512, options [nop,nop,TS val 766516767 ecr 766516763], length 3984
2022-04-05 03:21:12.395419 IP (tos 0x0, ttl 64, id 47432, offset 0, flags [DF], proto TCP (6), length 52)
    127.0.0.1.34730 > 127.0.0.1.10750: Flags [.], cksum 0xfe28 (incorrect -> 0x6c32), seq 928, ack 166716, win 512, options [nop,nop,TS val 766516767 ecr 766516767], length 0
2022-04-05 03:21:12.395525 IP (tos 0x0, ttl 64, id 19508, offset 0, flags [DF], proto TCP (6), length 4100)
    127.0.0.1.10750 > 127.0.0.1.34730: Flags [P.], cksum 0x0df9 (incorrect -> 0x9770), seq 166716:170764, ack 928, win 512, options [nop,nop,TS val 766516767 ecr 766516767], length 4048
2022-04-05 03:21:12.395666 IP (tos 0x0, ttl 64, id 47433, offset 0, flags [DF], proto TCP (6), length 52)
    127.0.0.1.34730 > 127.0.0.1.10750: Flags [.], cksum 0xfe28 (incorrect -> 0x5c62), seq 928, ack 170764, win 512, options [nop,nop,TS val 766516767 ecr 766516767], length 0
2022-04-05 03:21:12.395674 IP (tos 0x0, ttl 64, id 19509, offset 0, flags [DF], proto TCP (6), length 10744)
    127.0.0.1.10750 > 127.0.0.1.34730: Flags [P.], cksum 0x27ed (incorrect -> 0x72d2), seq 170764:181456, ack 928, win 512, options [nop,nop,TS val 766516767 ecr 766516767], length 10692
2022-04-05 03:21:12.395681 IP (tos 0x0, ttl 64, id 47434, offset 0, flags [DF], proto TCP (6), length 52)
    127.0.0.1.34730 > 127.0.0.1.10750: Flags [.], cksum 0xfe28 (incorrect -> 0x329e), seq 928, ack 181456, win 512, options [nop,nop,TS val 766516767 ecr 766516767], length 0
2022-04-05 03:21:12.395861 IP (tos 0x0, ttl 64, id 19510, offset 0, flags [DF], proto TCP (6), length 3944)
    127.0.0.1.10750 > 127.0.0.1.34730: Flags [P.], cksum 0x0d5d (incorrect -> 0x5e13), seq 181456:185348, ack 928, win 512, options [nop,nop,TS val 766516767 ecr 766516767], length 3892
2022-04-05 03:21:12.395933 IP (tos 0x0, ttl 64, id 47435, offset 0, flags [DF], proto TCP (6), length 52)
    127.0.0.1.34730 > 127.0.0.1.10750: Flags [.], cksum 0xfe28 (incorrect -> 0x236a), seq 928, ack 185348, win 512, options [nop,nop,TS val 766516767 ecr 766516767], length 0
2022-04-05 03:21:12.397301 IP (tos 0x0, ttl 64, id 19511, offset 0, flags [DF], proto TCP (6), length 1048)
    127.0.0.1.10750 > 127.0.0.1.34730: Flags [P.], cksum 0x020d (incorrect -> 0x442c), seq 185348:186344, ack 928, win 512, options [nop,nop,TS val 766516768 ecr 766516767], length 996
2022-04-05 03:21:12.397315 IP (tos 0x0, ttl 64, id 47436, offset 0, flags [DF], proto TCP (6), length 52)
    127.0.0.1.34730 > 127.0.0.1.10750: Flags [.], cksum 0xfe28 (incorrect -> 0x1f84), seq 928, ack 186344, win 512, options [nop,nop,TS val 766516768 ecr 766516768], length 0
2022-04-05 03:21:12.397362 IP (tos 0x0, ttl 64, id 19512, offset 0, flags [DF], proto TCP (6), length 3538)
    127.0.0.1.10750 > 127.0.0.1.34730: Flags [P.], cksum 0x0bc7 (incorrect -> 0xfd3d), seq 186344:189830, ack 928, win 512, options [nop,nop,TS val 766516768 ecr 766516768], length 3486
2022-04-05 03:21:12.397398 IP (tos 0x0, ttl 64, id 47437, offset 0, flags [DF], proto TCP (6), length 52)
    127.0.0.1.34730 > 127.0.0.1.10750: Flags [.], cksum 0xfe28 (incorrect -> 0x11e5), seq 928, ack 189830, win 512, options [nop,nop,TS val 766516769 ecr 766516768], length 0
2022-04-05 03:21:12.399322 IP (tos 0x0, ttl 64, id 19513, offset 0, flags [DF], proto TCP (6), length 4100)
    127.0.0.1.10750 > 127.0.0.1.34730: Flags [P.], cksum 0x0df9 (incorrect -> 0xeab1), seq 189830:193878, ack 928, win 512, options [nop,nop,TS val 766516770 ecr 766516769], length 4048
2022-04-05 03:21:12.399390 IP (tos 0x0, ttl 64, id 47438, offset 0, flags [DF], proto TCP (6), length 52)
    127.0.0.1.34730 > 127.0.0.1.10750: Flags [.], cksum 0xfe28 (incorrect -> 0x0212), seq 928, ack 193878, win 512, options [nop,nop,TS val 766516770 ecr 766516770], length 0
2022-04-05 03:21:12.399410 IP (tos 0x0, ttl 64, id 19514, offset 0, flags [DF], proto TCP (6), length 3972)
    127.0.0.1.10750 > 127.0.0.1.34730: Flags [P.], cksum 0x0d79 (incorrect -> 0xe6d0), seq 193878:197798, ack 928, win 512, options [nop,nop,TS val 766516771 ecr 766516770], length 3920
2022-04-05 03:21:12.399420 IP (tos 0x0, ttl 64, id 47439, offset 0, flags [DF], proto TCP (6), length 52)
    127.0.0.1.34730 > 127.0.0.1.10750: Flags [.], cksum 0xfe28 (incorrect -> 0xf2bf), seq 928, ack 197798, win 512, options [nop,nop,TS val 766516771 ecr 766516771], length 0
2022-04-05 03:21:12.401641 IP (tos 0x0, ttl 64, id 19515, offset 0, flags [DF], proto TCP (6), length 4100)
    127.0.0.1.10750 > 127.0.0.1.34730: Flags [P.], cksum 0x0df9 (incorrect -> 0x22a3), seq 197798:201846, ack 928, win 512, options [nop,nop,TS val 766516773 ecr 766516771], length 4048
2022-04-05 03:21:12.401831 IP (tos 0x0, ttl 64, id 47440, offset 0, flags [DF], proto TCP (6), length 52)
    127.0.0.1.34730 > 127.0.0.1.10750: Flags [.], cksum 0xfe28 (incorrect -> 0xe2eb), seq 928, ack 201846, win 512, options [nop,nop,TS val 766516773 ecr 766516773], length 0
2022-04-05 03:21:12.401843 IP (tos 0x0, ttl 64, id 19516, offset 0, flags [DF], proto TCP (6), length 7956)
    127.0.0.1.10750 > 127.0.0.1.34730: Flags [P.], cksum 0x1d09 (incorrect -> 0xc8cc), seq 201846:209750, ack 928, win 512, options [nop,nop,TS val 766516773 ecr 766516773], length 7904
2022-04-05 03:21:12.401854 IP (tos 0x0, ttl 64, id 47441, offset 0, flags [DF], proto TCP (6), length 52)
    127.0.0.1.34730 > 127.0.0.1.10750: Flags [.], cksum 0xfe28 (incorrect -> 0xc40b), seq 928, ack 209750, win 512, options [nop,nop,TS val 766516773 ecr 766516773], length 0
2022-04-05 03:21:12.401874 IP (tos 0x0, ttl 64, id 19517, offset 0, flags [DF], proto TCP (6), length 4036)
    127.0.0.1.10750 > 127.0.0.1.34730: Flags [P.], cksum 0x0db9 (incorrect -> 0x7a43), seq 209750:213734, ack 928, win 512, options [nop,nop,TS val 766516773 ecr 766516773], length 3984
2022-04-05 03:21:12.401913 IP (tos 0x0, ttl 64, id 47442, offset 0, flags [DF], proto TCP (6), length 52)
    127.0.0.1.34730 > 127.0.0.1.10750: Flags [.], cksum 0xfe28 (incorrect -> 0xb47b), seq 928, ack 213734, win 512, options [nop,nop,TS val 766516773 ecr 766516773], length 0
200, 3.641491413116455, 1.4247684478759766