2022-04-05 15:54:25.675823 IP (tos 0x0, ttl 64, id 20091, offset 0, flags [DF], proto TCP (6), length 60)
    127.0.0.1.36568 > 127.0.0.1.9450: Flags [S], cksum 0xfe30 (incorrect -> 0xf2c7), seq 3451010155, win 65495, options [mss 65495,sackOK,TS val 256348178 ecr 0,nop,wscale 7], length 0
2022-04-05 15:54:25.675834 IP (tos 0x0, ttl 64, id 0, offset 0, flags [DF], proto TCP (6), length 60)
    127.0.0.1.9450 > 127.0.0.1.36568: Flags [S.], cksum 0xfe30 (incorrect -> 0xb6c5), seq 1665874264, ack 3451010156, win 65483, options [mss 65495,sackOK,TS val 256348178 ecr 256348178,nop,wscale 7], length 0
2022-04-05 15:54:25.675844 IP (tos 0x0, ttl 64, id 20092, offset 0, flags [DF], proto TCP (6), length 52)
    127.0.0.1.36568 > 127.0.0.1.9450: Flags [.], cksum 0xfe28 (incorrect -> 0xdd81), seq 1, ack 1, win 512, options [nop,nop,TS val 256348178 ecr 256348178], length 0
2022-04-05 15:54:25.675947 IP (tos 0x0, ttl 64, id 20093, offset 0, flags [DF], proto TCP (6), length 55)
    127.0.0.1.36568 > 127.0.0.1.9450: Flags [P.], cksum 0xfe2b (incorrect -> 0xd875), seq 1:4, ack 1, win 512, options [nop,nop,TS val 256348178 ecr 256348178], length 3
2022-04-05 15:54:25.675961 IP (tos 0x0, ttl 64, id 53923, offset 0, flags [DF], proto TCP (6), length 52)
    127.0.0.1.9450 > 127.0.0.1.36568: Flags [.], cksum 0xfe28 (incorrect -> 0xdd7e), seq 1, ack 4, win 512, options [nop,nop,TS val 256348178 ecr 256348178], length 0
2022-04-05 15:54:25.675992 IP (tos 0x0, ttl 64, id 53924, offset 0, flags [DF], proto TCP (6), length 54)
    127.0.0.1.9450 > 127.0.0.1.36568: Flags [P.], cksum 0xfe2a (incorrect -> 0xd874), seq 1:3, ack 4, win 512, options [nop,nop,TS val 256348178 ecr 256348178], length 2
2022-04-05 15:54:25.676005 IP (tos 0x0, ttl 64, id 20094, offset 0, flags [DF], proto TCP (6), length 52)
    127.0.0.1.36568 > 127.0.0.1.9450: Flags [.], cksum 0xfe28 (incorrect -> 0xdd7c), seq 4, ack 3, win 512, options [nop,nop,TS val 256348178 ecr 256348178], length 0
2022-04-05 15:54:25.677775 IP (tos 0x0, ttl 64, id 20095, offset 0, flags [DF], proto TCP (6), length 62)
    127.0.0.1.36568 > 127.0.0.1.9450: Flags [P.], cksum 0xfe32 (incorrect -> 0x4992), seq 4:14, ack 3, win 512, options [nop,nop,TS val 256348180 ecr 256348178], length 10
2022-04-05 15:54:25.677795 IP (tos 0x0, ttl 64, id 53925, offset 0, flags [DF], proto TCP (6), length 52)
    127.0.0.1.9450 > 127.0.0.1.36568: Flags [.], cksum 0xfe28 (incorrect -> 0xdd6e), seq 3, ack 14, win 512, options [nop,nop,TS val 256348180 ecr 256348180], length 0
2022-04-05 15:54:25.777539 IP (tos 0x0, ttl 64, id 53926, offset 0, flags [DF], proto TCP (6), length 62)
    127.0.0.1.9450 > 127.0.0.1.36568: Flags [P.], cksum 0xfe32 (incorrect -> 0xd7f7), seq 3:13, ack 14, win 512, options [nop,nop,TS val 256348280 ecr 256348180], length 10
2022-04-05 15:54:25.777558 IP (tos 0x0, ttl 64, id 20096, offset 0, flags [DF], proto TCP (6), length 52)
    127.0.0.1.36568 > 127.0.0.1.9450: Flags [.], cksum 0xfe28 (incorrect -> 0xdc9c), seq 14, ack 13, win 512, options [nop,nop,TS val 256348280 ecr 256348280], length 0
2022-04-05 15:54:25.783493 IP (tos 0x0, ttl 64, id 20097, offset 0, flags [DF], proto TCP (6), length 569)
    127.0.0.1.36568 > 127.0.0.1.9450: Flags [P.], cksum 0x002e (incorrect -> 0xe650), seq 14:531, ack 13, win 512, options [nop,nop,TS val 256348286 ecr 256348280], length 517
2022-04-05 15:54:25.783503 IP (tos 0x0, ttl 64, id 53927, offset 0, flags [DF], proto TCP (6), length 52)
    127.0.0.1.9450 > 127.0.0.1.36568: Flags [.], cksum 0xfe28 (incorrect -> 0xda8f), seq 13, ack 531, win 508, options [nop,nop,TS val 256348286 ecr 256348286], length 0
2022-04-05 15:54:25.903867 IP (tos 0x0, ttl 64, id 53928, offset 0, flags [DF], proto TCP (6), length 3098)
    127.0.0.1.9450 > 127.0.0.1.36568: Flags [P.], cksum 0x0a0f (incorrect -> 0xf7ee), seq 13:3059, ack 531, win 512, options [nop,nop,TS val 256348406 ecr 256348286], length 3046
2022-04-05 15:54:25.903875 IP (tos 0x0, ttl 64, id 20098, offset 0, flags [DF], proto TCP (6), length 52)
    127.0.0.1.36568 > 127.0.0.1.9450: Flags [.], cksum 0xfe28 (incorrect -> 0xcdc5), seq 531, ack 3059, win 496, options [nop,nop,TS val 256348406 ecr 256348406], length 0
2022-04-05 15:54:25.904449 IP (tos 0x0, ttl 64, id 20099, offset 0, flags [DF], proto TCP (6), length 132)
    127.0.0.1.36568 > 127.0.0.1.9450: Flags [P.], cksum 0xfe78 (incorrect -> 0xa4c1), seq 531:611, ack 3059, win 512, options [nop,nop,TS val 256348407 ecr 256348406], length 80
2022-04-05 15:54:25.904458 IP (tos 0x0, ttl 64, id 53929, offset 0, flags [DF], proto TCP (6), length 52)
    127.0.0.1.9450 > 127.0.0.1.36568: Flags [.], cksum 0xfe28 (incorrect -> 0xcd63), seq 3059, ack 611, win 512, options [nop,nop,TS val 256348407 ecr 256348407], length 0
2022-04-05 15:54:25.904997 IP (tos 0x0, ttl 64, id 20100, offset 0, flags [DF], proto TCP (6), length 391)
    127.0.0.1.36568 > 127.0.0.1.9450: Flags [P.], cksum 0xff7b (incorrect -> 0x0e2b), seq 611:950, ack 3059, win 512, options [nop,nop,TS val 256348407 ecr 256348407], length 339
2022-04-05 15:54:25.905005 IP (tos 0x0, ttl 64, id 53930, offset 0, flags [DF], proto TCP (6), length 52)
    127.0.0.1.9450 > 127.0.0.1.36568: Flags [.], cksum 0xfe28 (incorrect -> 0xcc12), seq 3059, ack 950, win 510, options [nop,nop,TS val 256348407 ecr 256348407], length 0
2022-04-05 15:54:26.008484 IP (tos 0x0, ttl 64, id 53931, offset 0, flags [DF], proto TCP (6), length 594)
    127.0.0.1.9450 > 127.0.0.1.36568: Flags [P.], cksum 0x0047 (incorrect -> 0x09f8), seq 3059:3601, ack 950, win 512, options [nop,nop,TS val 256348511 ecr 256348407], length 542
2022-04-05 15:54:26.008493 IP (tos 0x0, ttl 64, id 20101, offset 0, flags [DF], proto TCP (6), length 52)
    127.0.0.1.36568 > 127.0.0.1.9450: Flags [.], cksum 0xfe28 (incorrect -> 0xc926), seq 950, ack 3601, win 508, options [nop,nop,TS val 256348511 ecr 256348511], length 0
2022-04-05 15:54:26.080649 IP (tos 0x0, ttl 64, id 53932, offset 0, flags [DF], proto TCP (6), length 3538)
    127.0.0.1.9450 > 127.0.0.1.36568: Flags [P.], cksum 0x0bc7 (incorrect -> 0xd1e1), seq 3601:7087, ack 950, win 512, options [nop,nop,TS val 256348583 ecr 256348511], length 3486
2022-04-05 15:54:26.080659 IP (tos 0x0, ttl 64, id 20102, offset 0, flags [DF], proto TCP (6), length 52)
    127.0.0.1.36568 > 127.0.0.1.9450: Flags [.], cksum 0xfe28 (incorrect -> 0xbb06), seq 950, ack 7087, win 494, options [nop,nop,TS val 256348583 ecr 256348583], length 0
2022-04-05 15:54:26.107662 IP (tos 0x0, ttl 64, id 53933, offset 0, flags [DF], proto TCP (6), length 3354)
    127.0.0.1.9450 > 127.0.0.1.36568: Flags [P.], cksum 0x0b0f (incorrect -> 0x5272), seq 7087:10389, ack 950, win 512, options [nop,nop,TS val 256348610 ecr 256348583], length 3302
2022-04-05 15:54:26.107668 IP (tos 0x0, ttl 64, id 20103, offset 0, flags [DF], proto TCP (6), length 52)
    127.0.0.1.36568 > 127.0.0.1.9450: Flags [.], cksum 0xfe28 (incorrect -> 0xade9), seq 950, ack 10389, win 495, options [nop,nop,TS val 256348610 ecr 256348610], length 0
2022-04-05 15:54:26.108979 IP (tos 0x0, ttl 64, id 53934, offset 0, flags [DF], proto TCP (6), length 1048)
    127.0.0.1.9450 > 127.0.0.1.36568: Flags [P.], cksum 0x020d (incorrect -> 0xcec3), seq 10389:11385, ack 950, win 512, options [nop,nop,TS val 256348611 ecr 256348610], length 996
2022-04-05 15:54:26.108985 IP (tos 0x0, ttl 64, id 20104, offset 0, flags [DF], proto TCP (6), length 52)
    127.0.0.1.36568 > 127.0.0.1.9450: Flags [.], cksum 0xfe28 (incorrect -> 0xa9fa), seq 950, ack 11385, win 504, options [nop,nop,TS val 256348611 ecr 256348611], length 0
2022-04-05 15:54:26.122259 IP (tos 0x0, ttl 64, id 53935, offset 0, flags [DF], proto TCP (6), length 4100)
    127.0.0.1.9450 > 127.0.0.1.36568: Flags [P.], cksum 0x0df9 (incorrect -> 0x95bf), seq 11385:15433, ack 950, win 512, options [nop,nop,TS val 256348625 ecr 256348611], length 4048
2022-04-05 15:54:26.122266 IP (tos 0x0, ttl 64, id 20105, offset 0, flags [DF], proto TCP (6), length 52)
    127.0.0.1.36568 > 127.0.0.1.9450: Flags [.], cksum 0xfe28 (incorrect -> 0x9a1a), seq 950, ack 15433, win 492, options [nop,nop,TS val 256348625 ecr 256348625], length 0
2022-04-05 15:54:26.122274 IP (tos 0x0, ttl 64, id 53936, offset 0, flags [DF], proto TCP (6), length 2746)
    127.0.0.1.9450 > 127.0.0.1.36568: Flags [P.], cksum 0x08af (incorrect -> 0x5419), seq 15433:18127, ack 950, win 512, options [nop,nop,TS val 256348625 ecr 256348625], length 2694
2022-04-05 15:54:26.122279 IP (tos 0x0, ttl 64, id 20106, offset 0, flags [DF], proto TCP (6), length 52)
    127.0.0.1.36568 > 127.0.0.1.9450: Flags [.], cksum 0xfe28 (incorrect -> 0x8f9f), seq 950, ack 18127, win 481, options [nop,nop,TS val 256348625 ecr 256348625], length 0
2022-04-05 15:54:26.124878 IP (tos 0x0, ttl 64, id 53937, offset 0, flags [DF], proto TCP (6), length 1952)
    127.0.0.1.9450 > 127.0.0.1.36568: Flags [P.], cksum 0x0595 (incorrect -> 0x1df2), seq 18127:20027, ack 950, win 512, options [nop,nop,TS val 256348627 ecr 256348625], length 1900
2022-04-05 15:54:26.124884 IP (tos 0x0, ttl 64, id 20107, offset 0, flags [DF], proto TCP (6), length 52)
    127.0.0.1.36568 > 127.0.0.1.9450: Flags [.], cksum 0xfe28 (incorrect -> 0x881c), seq 950, ack 20027, win 500, options [nop,nop,TS val 256348627 ecr 256348627], length 0
2022-04-05 15:54:26.129946 IP (tos 0x0, ttl 64, id 53938, offset 0, flags [DF], proto TCP (6), length 4100)
    127.0.0.1.9450 > 127.0.0.1.36568: Flags [P.], cksum 0x0df9 (incorrect -> 0xe736), seq 20027:24075, ack 950, win 512, options [nop,nop,TS val 256348632 ecr 256348627], length 4048
2022-04-05 15:54:26.129953 IP (tos 0x0, ttl 64, id 20108, offset 0, flags [DF], proto TCP (6), length 52)
    127.0.0.1.36568 > 127.0.0.1.9450: Flags [.], cksum 0xfe28 (incorrect -> 0x784a), seq 950, ack 24075, win 492, options [nop,nop,TS val 256348632 ecr 256348632], length 0
2022-04-05 15:54:26.129960 IP (tos 0x0, ttl 64, id 53939, offset 0, flags [DF], proto TCP (6), length 486)
    127.0.0.1.9450 > 127.0.0.1.36568: Flags [P.], cksum 0xffda (incorrect -> 0xbea0), seq 24075:24509, ack 950, win 512, options [nop,nop,TS val 256348632 ecr 256348632], length 434
2022-04-05 15:54:26.129964 IP (tos 0x0, ttl 64, id 20109, offset 0, flags [DF], proto TCP (6), length 52)
    127.0.0.1.36568 > 127.0.0.1.9450: Flags [.], cksum 0xfe28 (incorrect -> 0x769a), seq 950, ack 24509, win 490, options [nop,nop,TS val 256348632 ecr 256348632], length 0
2022-04-05 15:54:26.133890 IP (tos 0x0, ttl 64, id 53940, offset 0, flags [DF], proto TCP (6), length 2542)
    127.0.0.1.9450 > 127.0.0.1.36568: Flags [P.], cksum 0x07e3 (incorrect -> 0xd25c), seq 24509:26999, ack 950, win 512, options [nop,nop,TS val 256348636 ecr 256348632], length 2490
2022-04-05 15:54:26.133905 IP (tos 0x0, ttl 64, id 20110, offset 0, flags [DF], proto TCP (6), length 52)
    127.0.0.1.36568 > 127.0.0.1.9450: Flags [.], cksum 0xfe28 (incorrect -> 0x6cc2), seq 950, ack 26999, win 512, options [nop,nop,TS val 256348636 ecr 256348636], length 0
2022-04-05 15:54:26.141612 IP (tos 0x0, ttl 64, id 53941, offset 0, flags [DF], proto TCP (6), length 3714)
    127.0.0.1.9450 > 127.0.0.1.36568: Flags [P.], cksum 0x0c77 (incorrect -> 0xa2dd), seq 26999:30661, ack 950, win 512, options [nop,nop,TS val 256348644 ecr 256348636], length 3662
2022-04-05 15:54:26.141695 IP (tos 0x0, ttl 64, id 20111, offset 0, flags [DF], proto TCP (6), length 52)
    127.0.0.1.36568 > 127.0.0.1.9450: Flags [.], cksum 0xfe28 (incorrect -> 0x5e64), seq 950, ack 30661, win 512, options [nop,nop,TS val 256348644 ecr 256348644], length 0
2022-04-05 15:54:26.141720 IP (tos 0x0, ttl 64, id 53942, offset 0, flags [DF], proto TCP (6), length 3538)
    127.0.0.1.9450 > 127.0.0.1.36568: Flags [P.], cksum 0x0bc7 (incorrect -> 0x7780), seq 30661:34147, ack 950, win 512, options [nop,nop,TS val 256348644 ecr 256348644], length 3486
2022-04-05 15:54:26.141727 IP (tos 0x0, ttl 64, id 20112, offset 0, flags [DF], proto TCP (6), length 52)
    127.0.0.1.36568 > 127.0.0.1.9450: Flags [.], cksum 0xfe28 (incorrect -> 0x50c6), seq 950, ack 34147, win 512, options [nop,nop,TS val 256348644 ecr 256348644], length 0
2022-04-05 15:54:26.142083 IP (tos 0x0, ttl 64, id 53943, offset 0, flags [DF], proto TCP (6), length 4100)
    127.0.0.1.9450 > 127.0.0.1.36568: Flags [P.], cksum 0x0df9 (incorrect -> 0x52ec), seq 34147:38195, ack 950, win 512, options [nop,nop,TS val 256348645 ecr 256348644], length 4048
2022-04-05 15:54:26.182666 IP (tos 0x0, ttl 64, id 20113, offset 0, flags [DF], proto TCP (6), length 52)
    127.0.0.1.36568 > 127.0.0.1.9450: Flags [.], cksum 0xfe28 (incorrect -> 0x40cc), seq 950, ack 38195, win 512, options [nop,nop,TS val 256348685 ecr 256348645], length 0
2022-04-05 15:54:26.182684 IP (tos 0x0, ttl 64, id 53944, offset 0, flags [DF], proto TCP (6), length 31752)
    127.0.0.1.9450 > 127.0.0.1.36568: Flags [P.], cksum 0x79fd (incorrect -> 0x83ef), seq 38195:69895, ack 950, win 512, options [nop,nop,TS val 256348685 ecr 256348685], length 31700
2022-04-05 15:54:26.226169 IP (tos 0x0, ttl 64, id 53945, offset 0, flags [DF], proto TCP (6), length 32820)
    127.0.0.1.9450 > 127.0.0.1.36568: Flags [.], cksum 0x7e29 (incorrect -> 0x66d9), seq 69895:102663, ack 950, win 512, options [nop,nop,TS val 256348729 ecr 256348685], length 32768
2022-04-05 15:54:26.226176 IP (tos 0x0, ttl 64, id 20114, offset 0, flags [DF], proto TCP (6), length 52)
    127.0.0.1.36568 > 127.0.0.1.9450: Flags [.], cksum 0xfe28 (incorrect -> 0x4528), seq 950, ack 102663, win 379, options [nop,nop,TS val 256348729 ecr 256348685], length 0
2022-04-05 15:54:26.226185 IP (tos 0x0, ttl 64, id 53946, offset 0, flags [DF], proto TCP (6), length 1860)
    127.0.0.1.9450 > 127.0.0.1.36568: Flags [P.], cksum 0x0539 (incorrect -> 0x8d47), seq 102663:104471, ack 950, win 512, options [nop,nop,TS val 256348729 ecr 256348729], length 1808
2022-04-05 15:54:26.227029 IP (tos 0x0, ttl 64, id 20115, offset 0, flags [DF], proto TCP (6), length 52)
    127.0.0.1.36568 > 127.0.0.1.9450: Flags [.], cksum 0xfe28 (incorrect -> 0x3d67), seq 950, ack 104471, win 512, options [nop,nop,TS val 256348729 ecr 256348729], length 0
2022-04-05 15:54:26.239449 IP (tos 0x0, ttl 64, id 53947, offset 0, flags [DF], proto TCP (6), length 4036)
    127.0.0.1.9450 > 127.0.0.1.36568: Flags [P.], cksum 0x0db9 (incorrect -> 0xbda5), seq 104471:108455, ack 950, win 512, options [nop,nop,TS val 256348742 ecr 256348729], length 3984
2022-04-05 15:54:26.239470 IP (tos 0x0, ttl 64, id 20116, offset 0, flags [DF], proto TCP (6), length 52)
    127.0.0.1.36568 > 127.0.0.1.9450: Flags [.], cksum 0xfe28 (incorrect -> 0x2dbd), seq 950, ack 108455, win 512, options [nop,nop,TS val 256348742 ecr 256348742], length 0
2022-04-05 15:54:26.242300 IP (tos 0x0, ttl 64, id 53948, offset 0, flags [DF], proto TCP (6), length 4036)
    127.0.0.1.9450 > 127.0.0.1.36568: Flags [P.], cksum 0x0db9 (incorrect -> 0x4d4a), seq 108455:112439, ack 950, win 512, options [nop,nop,TS val 256348745 ecr 256348742], length 3984
2022-04-05 15:54:26.282674 IP (tos 0x0, ttl 64, id 20117, offset 0, flags [DF], proto TCP (6), length 52)
    127.0.0.1.36568 > 127.0.0.1.9450: Flags [.], cksum 0xfe28 (incorrect -> 0x1dff), seq 950, ack 112439, win 512, options [nop,nop,TS val 256348785 ecr 256348745], length 0
200, 4.85169243812561, 0.6564552783966064