2022-04-05 06:53:12.813760 IP (tos 0x0, ttl 64, id 1766, offset 0, flags [DF], proto TCP (6), length 60)
    127.0.0.1.35758 > 127.0.0.1.11850: Flags [S], cksum 0xfe30 (incorrect -> 0xf6ae), seq 702615494, win 65495, options [mss 65495,sackOK,TS val 779237185 ecr 0,nop,wscale 7], length 0
2022-04-05 06:53:12.813772 IP (tos 0x0, ttl 64, id 0, offset 0, flags [DF], proto TCP (6), length 60)
    127.0.0.1.11850 > 127.0.0.1.35758: Flags [S.], cksum 0xfe30 (incorrect -> 0x7484), seq 3144245512, ack 702615495, win 65483, options [mss 65495,sackOK,TS val 779237185 ecr 779237185,nop,wscale 7], length 0
2022-04-05 06:53:12.813783 IP (tos 0x0, ttl 64, id 1767, offset 0, flags [DF], proto TCP (6), length 52)
    127.0.0.1.35758 > 127.0.0.1.11850: Flags [.], cksum 0xfe28 (incorrect -> 0x9b40), seq 1, ack 1, win 512, options [nop,nop,TS val 779237185 ecr 779237185], length 0
2022-04-05 06:53:12.813883 IP (tos 0x0, ttl 64, id 1768, offset 0, flags [DF], proto TCP (6), length 55)
    127.0.0.1.35758 > 127.0.0.1.11850: Flags [P.], cksum 0xfe2b (incorrect -> 0x9634), seq 1:4, ack 1, win 512, options [nop,nop,TS val 779237185 ecr 779237185], length 3
2022-04-05 06:53:12.813889 IP (tos 0x0, ttl 64, id 55708, offset 0, flags [DF], proto TCP (6), length 52)
    127.0.0.1.11850 > 127.0.0.1.35758: Flags [.], cksum 0xfe28 (incorrect -> 0x9b3d), seq 1, ack 4, win 512, options [nop,nop,TS val 779237185 ecr 779237185], length 0
2022-04-05 06:53:12.813956 IP (tos 0x0, ttl 64, id 55709, offset 0, flags [DF], proto TCP (6), length 54)
    127.0.0.1.11850 > 127.0.0.1.35758: Flags [P.], cksum 0xfe2a (incorrect -> 0x9633), seq 1:3, ack 4, win 512, options [nop,nop,TS val 779237185 ecr 779237185], length 2
2022-04-05 06:53:12.813964 IP (tos 0x0, ttl 64, id 1769, offset 0, flags [DF], proto TCP (6), length 52)
    127.0.0.1.35758 > 127.0.0.1.11850: Flags [.], cksum 0xfe28 (incorrect -> 0x9b3b), seq 4, ack 3, win 512, options [nop,nop,TS val 779237185 ecr 779237185], length 0
2022-04-05 06:53:12.815270 IP (tos 0x0, ttl 64, id 1770, offset 0, flags [DF], proto TCP (6), length 62)
    127.0.0.1.35758 > 127.0.0.1.11850: Flags [P.], cksum 0xfe32 (incorrect -> 0xfbfb), seq 4:14, ack 3, win 512, options [nop,nop,TS val 779237186 ecr 779237185], length 10
2022-04-05 06:53:12.815288 IP (tos 0x0, ttl 64, id 55710, offset 0, flags [DF], proto TCP (6), length 52)
    127.0.0.1.11850 > 127.0.0.1.35758: Flags [.], cksum 0xfe28 (incorrect -> 0x9b2f), seq 3, ack 14, win 512, options [nop,nop,TS val 779237186 ecr 779237186], length 0
2022-04-05 06:53:13.164586 IP (tos 0x0, ttl 64, id 55711, offset 0, flags [DF], proto TCP (6), length 62)
    127.0.0.1.11850 > 127.0.0.1.35758: Flags [P.], cksum 0xfe32 (incorrect -> 0x94be), seq 3:13, ack 14, win 512, options [nop,nop,TS val 779237536 ecr 779237186], length 10
2022-04-05 06:53:13.164599 IP (tos 0x0, ttl 64, id 1771, offset 0, flags [DF], proto TCP (6), length 52)
    127.0.0.1.35758 > 127.0.0.1.11850: Flags [.], cksum 0xfe28 (incorrect -> 0x9869), seq 14, ack 13, win 512, options [nop,nop,TS val 779237536 ecr 779237536], length 0
2022-04-05 06:53:13.170307 IP (tos 0x0, ttl 64, id 1772, offset 0, flags [DF], proto TCP (6), length 569)
    127.0.0.1.35758 > 127.0.0.1.11850: Flags [P.], cksum 0x002e (incorrect -> 0x812e), seq 14:531, ack 13, win 512, options [nop,nop,TS val 779237541 ecr 779237536], length 517
2022-04-05 06:53:13.170318 IP (tos 0x0, ttl 64, id 55712, offset 0, flags [DF], proto TCP (6), length 52)
    127.0.0.1.11850 > 127.0.0.1.35758: Flags [.], cksum 0xfe28 (incorrect -> 0x965e), seq 13, ack 531, win 508, options [nop,nop,TS val 779237541 ecr 779237541], length 0
2022-04-05 06:53:13.525479 IP (tos 0x0, ttl 64, id 55713, offset 0, flags [DF], proto TCP (6), length 3538)
    127.0.0.1.11850 > 127.0.0.1.35758: Flags [P.], cksum 0x0bc7 (incorrect -> 0x842c), seq 13:3499, ack 531, win 512, options [nop,nop,TS val 779237897 ecr 779237541], length 3486
2022-04-05 06:53:13.525490 IP (tos 0x0, ttl 64, id 1773, offset 0, flags [DF], proto TCP (6), length 52)
    127.0.0.1.35758 > 127.0.0.1.11850: Flags [.], cksum 0xfe28 (incorrect -> 0x8606), seq 531, ack 3499, win 494, options [nop,nop,TS val 779237897 ecr 779237897], length 0
2022-04-05 06:53:13.636828 IP (tos 0x0, ttl 64, id 55714, offset 0, flags [DF], proto TCP (6), length 662)
    127.0.0.1.11850 > 127.0.0.1.35758: Flags [P.], cksum 0x008b (incorrect -> 0xa412), seq 3499:4109, ack 531, win 512, options [nop,nop,TS val 779238008 ecr 779237897], length 610
2022-04-05 06:53:13.636837 IP (tos 0x0, ttl 64, id 1774, offset 0, flags [DF], proto TCP (6), length 52)
    127.0.0.1.35758 > 127.0.0.1.11850: Flags [.], cksum 0xfe28 (incorrect -> 0x82bb), seq 531, ack 4109, win 505, options [nop,nop,TS val 779238008 ecr 779238008], length 0
2022-04-05 06:53:13.746815 IP (tos 0x0, ttl 64, id 55715, offset 0, flags [DF], proto TCP (6), length 1081)
    127.0.0.1.11850 > 127.0.0.1.35758: Flags [P.], cksum 0x022e (incorrect -> 0x6d2b), seq 4109:5138, ack 531, win 512, options [nop,nop,TS val 779238118 ecr 779238008], length 1029
2022-04-05 06:53:13.746826 IP (tos 0x0, ttl 64, id 1775, offset 0, flags [DF], proto TCP (6), length 52)
    127.0.0.1.35758 > 127.0.0.1.11850: Flags [.], cksum 0xfe28 (incorrect -> 0x7ddc), seq 531, ack 5138, win 503, options [nop,nop,TS val 779238118 ecr 779238118], length 0
2022-04-05 06:53:13.747852 IP (tos 0x0, ttl 64, id 1776, offset 0, flags [DF], proto TCP (6), length 132)
    127.0.0.1.35758 > 127.0.0.1.11850: Flags [P.], cksum 0xfe78 (incorrect -> 0xa020), seq 531:611, ack 5138, win 512, options [nop,nop,TS val 779238119 ecr 779238118], length 80
2022-04-05 06:53:13.747863 IP (tos 0x0, ttl 64, id 55716, offset 0, flags [DF], proto TCP (6), length 52)
    127.0.0.1.11850 > 127.0.0.1.35758: Flags [.], cksum 0xfe28 (incorrect -> 0x7d81), seq 5138, ack 611, win 512, options [nop,nop,TS val 779238119 ecr 779238119], length 0
2022-04-05 06:53:13.748172 IP (tos 0x0, ttl 64, id 1777, offset 0, flags [DF], proto TCP (6), length 338)
    127.0.0.1.35758 > 127.0.0.1.11850: Flags [P.], cksum 0xff46 (incorrect -> 0xb245), seq 611:897, ack 5138, win 512, options [nop,nop,TS val 779238119 ecr 779238119], length 286
2022-04-05 06:53:13.748179 IP (tos 0x0, ttl 64, id 55717, offset 0, flags [DF], proto TCP (6), length 52)
    127.0.0.1.11850 > 127.0.0.1.35758: Flags [.], cksum 0xfe28 (incorrect -> 0x7c65), seq 5138, ack 897, win 510, options [nop,nop,TS val 779238119 ecr 779238119], length 0
200, 4.038516998291016, 1.4171125888824463