2022-04-05 00:14:59.577518 IP (tos 0x0, ttl 64, id 7040, offset 0, flags [DF], proto TCP (6), length 60)
    127.0.0.1.48802 > 127.0.0.1.10150: Flags [S], cksum 0xfe30 (incorrect -> 0x0881), seq 3897731474, win 65495, options [mss 65495,sackOK,TS val 755343949 ecr 0,nop,wscale 7], length 0
2022-04-05 00:14:59.577530 IP (tos 0x0, ttl 64, id 0, offset 0, flags [DF], proto TCP (6), length 60)
    127.0.0.1.10150 > 127.0.0.1.48802: Flags [S.], cksum 0xfe30 (incorrect -> 0x9b96), seq 973955973, ack 3897731475, win 65483, options [mss 65495,sackOK,TS val 755343949 ecr 755343949,nop,wscale 7], length 0
2022-04-05 00:14:59.577540 IP (tos 0x0, ttl 64, id 7041, offset 0, flags [DF], proto TCP (6), length 52)
    127.0.0.1.48802 > 127.0.0.1.10150: Flags [.], cksum 0xfe28 (incorrect -> 0xc252), seq 1, ack 1, win 512, options [nop,nop,TS val 755343949 ecr 755343949], length 0
2022-04-05 00:14:59.577676 IP (tos 0x0, ttl 64, id 7042, offset 0, flags [DF], proto TCP (6), length 55)
    127.0.0.1.48802 > 127.0.0.1.10150: Flags [P.], cksum 0xfe2b (incorrect -> 0xbd46), seq 1:4, ack 1, win 512, options [nop,nop,TS val 755343949 ecr 755343949], length 3
2022-04-05 00:14:59.577683 IP (tos 0x0, ttl 64, id 34285, offset 0, flags [DF], proto TCP (6), length 52)
    127.0.0.1.10150 > 127.0.0.1.48802: Flags [.], cksum 0xfe28 (incorrect -> 0xc24f), seq 1, ack 4, win 512, options [nop,nop,TS val 755343949 ecr 755343949], length 0
2022-04-05 00:14:59.577705 IP (tos 0x0, ttl 64, id 34286, offset 0, flags [DF], proto TCP (6), length 54)
    127.0.0.1.10150 > 127.0.0.1.48802: Flags [P.], cksum 0xfe2a (incorrect -> 0xbd45), seq 1:3, ack 4, win 512, options [nop,nop,TS val 755343949 ecr 755343949], length 2
2022-04-05 00:14:59.577712 IP (tos 0x0, ttl 64, id 7043, offset 0, flags [DF], proto TCP (6), length 52)
    127.0.0.1.48802 > 127.0.0.1.10150: Flags [.], cksum 0xfe28 (incorrect -> 0xc24d), seq 4, ack 3, win 512, options [nop,nop,TS val 755343949 ecr 755343949], length 0
2022-04-05 00:14:59.578949 IP (tos 0x0, ttl 64, id 7044, offset 0, flags [DF], proto TCP (6), length 62)
    127.0.0.1.48802 > 127.0.0.1.10150: Flags [P.], cksum 0xfe32 (incorrect -> 0xb0f6), seq 4:14, ack 3, win 512, options [nop,nop,TS val 755343950 ecr 755343949], length 10
2022-04-05 00:14:59.578958 IP (tos 0x0, ttl 64, id 34287, offset 0, flags [DF], proto TCP (6), length 52)
    127.0.0.1.10150 > 127.0.0.1.48802: Flags [.], cksum 0xfe28 (incorrect -> 0xc241), seq 3, ack 14, win 512, options [nop,nop,TS val 755343950 ecr 755343950], length 0
2022-04-05 00:14:59.670435 IP (tos 0x0, ttl 64, id 34288, offset 0, flags [DF], proto TCP (6), length 62)
    127.0.0.1.10150 > 127.0.0.1.48802: Flags [P.], cksum 0xfe32 (incorrect -> 0xbcd2), seq 3:13, ack 14, win 512, options [nop,nop,TS val 755344042 ecr 755343950], length 10
2022-04-05 00:14:59.670443 IP (tos 0x0, ttl 64, id 7045, offset 0, flags [DF], proto TCP (6), length 52)
    127.0.0.1.48802 > 127.0.0.1.10150: Flags [.], cksum 0xfe28 (incorrect -> 0xc17f), seq 14, ack 13, win 512, options [nop,nop,TS val 755344042 ecr 755344042], length 0
2022-04-05 00:14:59.675976 IP (tos 0x0, ttl 64, id 7046, offset 0, flags [DF], proto TCP (6), length 569)
    127.0.0.1.48802 > 127.0.0.1.10150: Flags [P.], cksum 0x002e (incorrect -> 0xcb5e), seq 14:531, ack 13, win 512, options [nop,nop,TS val 755344047 ecr 755344042], length 517
2022-04-05 00:14:59.675985 IP (tos 0x0, ttl 64, id 34289, offset 0, flags [DF], proto TCP (6), length 52)
    127.0.0.1.10150 > 127.0.0.1.48802: Flags [.], cksum 0xfe28 (incorrect -> 0xbf74), seq 13, ack 531, win 508, options [nop,nop,TS val 755344047 ecr 755344047], length 0
200, 5.884807586669922, 0.35584473609924316