2022-04-05 22:57:19.428918 IP (tos 0x0, ttl 64, id 23674, offset 0, flags [DF], proto TCP (6), length 60)
    127.0.0.1.37046 > 127.0.0.1.9450: Flags [S], cksum 0xfe30 (incorrect -> 0x54e1), seq 1323903361, win 65495, options [mss 65495,sackOK,TS val 281721931 ecr 0,nop,wscale 7], length 0
2022-04-05 22:57:19.428928 IP (tos 0x0, ttl 64, id 0, offset 0, flags [DF], proto TCP (6), length 60)
    127.0.0.1.9450 > 127.0.0.1.37046: Flags [S.], cksum 0xfe30 (incorrect -> 0x9b99), seq 665044105, ack 1323903362, win 65483, options [mss 65495,sackOK,TS val 281721931 ecr 281721931,nop,wscale 7], length 0
2022-04-05 22:57:19.428935 IP (tos 0x0, ttl 64, id 23675, offset 0, flags [DF], proto TCP (6), length 52)
    127.0.0.1.37046 > 127.0.0.1.9450: Flags [.], cksum 0xfe28 (incorrect -> 0xc255), seq 1, ack 1, win 512, options [nop,nop,TS val 281721931 ecr 281721931], length 0
2022-04-05 22:57:19.429051 IP (tos 0x0, ttl 64, id 23676, offset 0, flags [DF], proto TCP (6), length 55)
    127.0.0.1.37046 > 127.0.0.1.9450: Flags [P.], cksum 0xfe2b (incorrect -> 0xbd49), seq 1:4, ack 1, win 512, options [nop,nop,TS val 281721931 ecr 281721931], length 3
2022-04-05 22:57:19.429054 IP (tos 0x0, ttl 64, id 20112, offset 0, flags [DF], proto TCP (6), length 52)
    127.0.0.1.9450 > 127.0.0.1.37046: Flags [.], cksum 0xfe28 (incorrect -> 0xc252), seq 1, ack 4, win 512, options [nop,nop,TS val 281721931 ecr 281721931], length 0
2022-04-05 22:57:19.429129 IP (tos 0x0, ttl 64, id 20113, offset 0, flags [DF], proto TCP (6), length 54)
    127.0.0.1.9450 > 127.0.0.1.37046: Flags [P.], cksum 0xfe2a (incorrect -> 0xbd47), seq 1:3, ack 4, win 512, options [nop,nop,TS val 281721932 ecr 281721931], length 2
2022-04-05 22:57:19.429134 IP (tos 0x0, ttl 64, id 23677, offset 0, flags [DF], proto TCP (6), length 52)
    127.0.0.1.37046 > 127.0.0.1.9450: Flags [.], cksum 0xfe28 (incorrect -> 0xc24e), seq 4, ack 3, win 512, options [nop,nop,TS val 281721932 ecr 281721932], length 0
2022-04-05 22:57:19.430986 IP (tos 0x0, ttl 64, id 23678, offset 0, flags [DF], proto TCP (6), length 62)
    127.0.0.1.37046 > 127.0.0.1.9450: Flags [P.], cksum 0xfe32 (incorrect -> 0x2732), seq 4:14, ack 3, win 512, options [nop,nop,TS val 281721933 ecr 281721932], length 10
2022-04-05 22:57:19.431009 IP (tos 0x0, ttl 64, id 20114, offset 0, flags [DF], proto TCP (6), length 52)
    127.0.0.1.9450 > 127.0.0.1.37046: Flags [.], cksum 0xfe28 (incorrect -> 0xc242), seq 3, ack 14, win 512, options [nop,nop,TS val 281721933 ecr 281721933], length 0
2022-04-05 22:57:19.468453 IP (tos 0x0, ttl 64, id 20115, offset 0, flags [DF], proto TCP (6), length 62)
    127.0.0.1.9450 > 127.0.0.1.37046: Flags [P.], cksum 0xfe32 (incorrect -> 0xbd09), seq 3:13, ack 14, win 512, options [nop,nop,TS val 281721971 ecr 281721933], length 10
2022-04-05 22:57:19.468463 IP (tos 0x0, ttl 64, id 23679, offset 0, flags [DF], proto TCP (6), length 52)
    127.0.0.1.37046 > 127.0.0.1.9450: Flags [.], cksum 0xfe28 (incorrect -> 0xc1ec), seq 14, ack 13, win 512, options [nop,nop,TS val 281721971 ecr 281721971], length 0
2022-04-05 22:57:19.474369 IP (tos 0x0, ttl 64, id 23680, offset 0, flags [DF], proto TCP (6), length 569)
    127.0.0.1.37046 > 127.0.0.1.9450: Flags [P.], cksum 0x002e (incorrect -> 0x0edf), seq 14:531, ack 13, win 512, options [nop,nop,TS val 281721977 ecr 281721971], length 517
2022-04-05 22:57:19.474386 IP (tos 0x0, ttl 64, id 20116, offset 0, flags [DF], proto TCP (6), length 52)
    127.0.0.1.9450 > 127.0.0.1.37046: Flags [.], cksum 0xfe28 (incorrect -> 0xbfdf), seq 13, ack 531, win 508, options [nop,nop,TS val 281721977 ecr 281721977], length 0
2022-04-05 22:57:19.534690 IP (tos 0x0, ttl 64, id 20117, offset 0, flags [DF], proto TCP (6), length 3538)
    127.0.0.1.9450 > 127.0.0.1.37046: Flags [P.], cksum 0x0bc7 (incorrect -> 0x89c9), seq 13:3499, ack 531, win 512, options [nop,nop,TS val 281722037 ecr 281721977], length 3486
2022-04-05 22:57:19.534700 IP (tos 0x0, ttl 64, id 23681, offset 0, flags [DF], proto TCP (6), length 52)
    127.0.0.1.37046 > 127.0.0.1.9450: Flags [.], cksum 0xfe28 (incorrect -> 0xb1d7), seq 531, ack 3499, win 494, options [nop,nop,TS val 281722037 ecr 281722037], length 0
2022-04-05 22:57:19.547304 IP (tos 0x0, ttl 64, id 20118, offset 0, flags [DF], proto TCP (6), length 781)
    127.0.0.1.9450 > 127.0.0.1.37046: Flags [P.], cksum 0x0102 (incorrect -> 0x4ab4), seq 3499:4228, ack 531, win 512, options [nop,nop,TS val 281722050 ecr 281722037], length 729
2022-04-05 22:57:19.547312 IP (tos 0x0, ttl 64, id 23682, offset 0, flags [DF], proto TCP (6), length 52)
    127.0.0.1.37046 > 127.0.0.1.9450: Flags [.], cksum 0xfe28 (incorrect -> 0xaed9), seq 531, ack 4228, win 505, options [nop,nop,TS val 281722050 ecr 281722050], length 0
2022-04-05 22:57:19.547734 IP (tos 0x0, ttl 64, id 23683, offset 0, flags [DF], proto TCP (6), length 132)
    127.0.0.1.37046 > 127.0.0.1.9450: Flags [P.], cksum 0xfe78 (incorrect -> 0x6f9d), seq 531:611, ack 4228, win 512, options [nop,nop,TS val 281722050 ecr 281722050], length 80
2022-04-05 22:57:19.547741 IP (tos 0x0, ttl 64, id 20119, offset 0, flags [DF], proto TCP (6), length 52)
    127.0.0.1.9450 > 127.0.0.1.37046: Flags [.], cksum 0xfe28 (incorrect -> 0xae82), seq 4228, ack 611, win 512, options [nop,nop,TS val 281722050 ecr 281722050], length 0
2022-04-05 22:57:19.548093 IP (tos 0x0, ttl 64, id 23684, offset 0, flags [DF], proto TCP (6), length 382)
    127.0.0.1.37046 > 127.0.0.1.9450: Flags [P.], cksum 0xff72 (incorrect -> 0x0754), seq 611:941, ack 4228, win 512, options [nop,nop,TS val 281722051 ecr 281722050], length 330
2022-04-05 22:57:19.548109 IP (tos 0x0, ttl 64, id 20120, offset 0, flags [DF], proto TCP (6), length 52)
    127.0.0.1.9450 > 127.0.0.1.37046: Flags [.], cksum 0xfe28 (incorrect -> 0xad38), seq 4228, ack 941, win 510, options [nop,nop,TS val 281722051 ecr 281722051], length 0
2022-04-05 22:57:19.864108 IP (tos 0x0, ttl 64, id 20121, offset 0, flags [DF], proto TCP (6), length 4100)
    127.0.0.1.9450 > 127.0.0.1.37046: Flags [P.], cksum 0x0df9 (incorrect -> 0xc216), seq 4228:8276, ack 941, win 512, options [nop,nop,TS val 281722367 ecr 281722051], length 4048
2022-04-05 22:57:19.864119 IP (tos 0x0, ttl 64, id 23685, offset 0, flags [DF], proto TCP (6), length 52)
    127.0.0.1.37046 > 127.0.0.1.9450: Flags [.], cksum 0xfe28 (incorrect -> 0x9b02), seq 941, ack 8276, win 492, options [nop,nop,TS val 281722367 ecr 281722367], length 0
2022-04-05 22:57:19.864218 IP (tos 0x0, ttl 64, id 20122, offset 0, flags [DF], proto TCP (6), length 984)
    127.0.0.1.9450 > 127.0.0.1.37046: Flags [P.], cksum 0x01cd (incorrect -> 0x4aee), seq 8276:9208, ack 941, win 512, options [nop,nop,TS val 281722367 ecr 281722367], length 932
2022-04-05 22:57:19.864223 IP (tos 0x0, ttl 64, id 23686, offset 0, flags [DF], proto TCP (6), length 52)
    127.0.0.1.37046 > 127.0.0.1.9450: Flags [.], cksum 0xfe28 (incorrect -> 0x9752), seq 941, ack 9208, win 504, options [nop,nop,TS val 281722367 ecr 281722367], length 0
2022-04-05 22:57:19.864264 IP (tos 0x0, ttl 64, id 20123, offset 0, flags [DF], proto TCP (6), length 3538)
    127.0.0.1.9450 > 127.0.0.1.37046: Flags [P.], cksum 0x0bc7 (incorrect -> 0x2792), seq 9208:12694, ack 941, win 512, options [nop,nop,TS val 281722367 ecr 281722367], length 3486
2022-04-05 22:57:19.864268 IP (tos 0x0, ttl 64, id 23687, offset 0, flags [DF], proto TCP (6), length 52)
    127.0.0.1.37046 > 127.0.0.1.9450: Flags [.], cksum 0xfe28 (incorrect -> 0x89be), seq 941, ack 12694, win 494, options [nop,nop,TS val 281722367 ecr 281722367], length 0
2022-04-05 22:57:19.865895 IP (tos 0x0, ttl 64, id 20124, offset 0, flags [DF], proto TCP (6), length 2044)
    127.0.0.1.9450 > 127.0.0.1.37046: Flags [P.], cksum 0x05f1 (incorrect -> 0x8bc7), seq 12694:14686, ack 941, win 512, options [nop,nop,TS val 281722368 ecr 281722367], length 1992
2022-04-05 22:57:19.865901 IP (tos 0x0, ttl 64, id 23688, offset 0, flags [DF], proto TCP (6), length 52)
    127.0.0.1.37046 > 127.0.0.1.9450: Flags [.], cksum 0xfe28 (incorrect -> 0x81ee), seq 941, ack 14686, win 500, options [nop,nop,TS val 281722368 ecr 281722368], length 0
2022-04-05 22:57:19.872453 IP (tos 0x0, ttl 64, id 20125, offset 0, flags [DF], proto TCP (6), length 1048)
    127.0.0.1.9450 > 127.0.0.1.37046: Flags [P.], cksum 0x020d (incorrect -> 0x37b3), seq 14686:15682, ack 941, win 512, options [nop,nop,TS val 281722375 ecr 281722368], length 996
2022-04-05 22:57:19.872459 IP (tos 0x0, ttl 64, id 23689, offset 0, flags [DF], proto TCP (6), length 52)
    127.0.0.1.37046 > 127.0.0.1.9450: Flags [.], cksum 0xfe28 (incorrect -> 0x7df8), seq 941, ack 15682, win 504, options [nop,nop,TS val 281722375 ecr 281722375], length 0
2022-04-05 22:57:19.876385 IP (tos 0x0, ttl 64, id 20126, offset 0, flags [DF], proto TCP (6), length 4100)
    127.0.0.1.9450 > 127.0.0.1.37046: Flags [P.], cksum 0x0df9 (incorrect -> 0xd4f6), seq 15682:19730, ack 941, win 512, options [nop,nop,TS val 281722379 ecr 281722375], length 4048
2022-04-05 22:57:19.876392 IP (tos 0x0, ttl 64, id 23690, offset 0, flags [DF], proto TCP (6), length 52)
    127.0.0.1.37046 > 127.0.0.1.9450: Flags [.], cksum 0xfe28 (incorrect -> 0x6e2c), seq 941, ack 19730, win 492, options [nop,nop,TS val 281722379 ecr 281722379], length 0
2022-04-05 22:57:19.876408 IP (tos 0x0, ttl 64, id 20127, offset 0, flags [DF], proto TCP (6), length 486)
    127.0.0.1.9450 > 127.0.0.1.37046: Flags [P.], cksum 0xffda (incorrect -> 0xcf28), seq 19730:20164, ack 941, win 512, options [nop,nop,TS val 281722379 ecr 281722379], length 434
2022-04-05 22:57:19.876411 IP (tos 0x0, ttl 64, id 23691, offset 0, flags [DF], proto TCP (6), length 52)
    127.0.0.1.37046 > 127.0.0.1.9450: Flags [.], cksum 0xfe28 (incorrect -> 0x6c6c), seq 941, ack 20164, win 506, options [nop,nop,TS val 281722379 ecr 281722379], length 0
2022-04-05 22:57:19.963079 IP (tos 0x0, ttl 64, id 20128, offset 0, flags [DF], proto TCP (6), length 3538)
    127.0.0.1.9450 > 127.0.0.1.37046: Flags [P.], cksum 0x0bc7 (incorrect -> 0x466d), seq 20164:23650, ack 941, win 512, options [nop,nop,TS val 281722466 ecr 281722379], length 3486
2022-04-05 22:57:19.963088 IP (tos 0x0, ttl 64, id 23692, offset 0, flags [DF], proto TCP (6), length 52)
    127.0.0.1.37046 > 127.0.0.1.9450: Flags [.], cksum 0xfe28 (incorrect -> 0x5e2c), seq 941, ack 23650, win 494, options [nop,nop,TS val 281722466 ecr 281722466], length 0
2022-04-05 22:57:19.969185 IP (tos 0x0, ttl 64, id 20129, offset 0, flags [DF], proto TCP (6), length 3538)
    127.0.0.1.9450 > 127.0.0.1.37046: Flags [P.], cksum 0x0bc7 (incorrect -> 0xad07), seq 23650:27136, ack 941, win 512, options [nop,nop,TS val 281722472 ecr 281722466], length 3486
2022-04-05 22:57:20.010758 IP (tos 0x0, ttl 64, id 23693, offset 0, flags [DF], proto TCP (6), length 52)
    127.0.0.1.37046 > 127.0.0.1.9450: Flags [.], cksum 0xfe28 (incorrect -> 0x5047), seq 941, ack 27136, win 512, options [nop,nop,TS val 281722513 ecr 281722472], length 0
2022-04-05 22:57:20.010780 IP (tos 0x0, ttl 64, id 20130, offset 0, flags [DF], proto TCP (6), length 9016)
    127.0.0.1.9450 > 127.0.0.1.37046: Flags [P.], cksum 0x212d (incorrect -> 0x8b7a), seq 27136:36100, ack 941, win 512, options [nop,nop,TS val 281722513 ecr 281722513], length 8964
2022-04-05 22:57:20.058652 IP (tos 0x0, ttl 64, id 23694, offset 0, flags [DF], proto TCP (6), length 52)
    127.0.0.1.37046 > 127.0.0.1.9450: Flags [.], cksum 0xfe28 (incorrect -> 0x2cea), seq 941, ack 36100, win 512, options [nop,nop,TS val 281722561 ecr 281722513], length 0
2022-04-05 22:57:20.093610 IP (tos 0x0, ttl 64, id 20131, offset 0, flags [DF], proto TCP (6), length 4100)
    127.0.0.1.9450 > 127.0.0.1.37046: Flags [P.], cksum 0x0df9 (incorrect -> 0x77d3), seq 36100:40148, ack 941, win 512, options [nop,nop,TS val 281722596 ecr 281722561], length 4048
2022-04-05 22:57:20.094120 IP (tos 0x0, ttl 64, id 23695, offset 0, flags [DF], proto TCP (6), length 52)
    127.0.0.1.37046 > 127.0.0.1.9450: Flags [.], cksum 0xfe28 (incorrect -> 0x1ca3), seq 941, ack 40148, win 512, options [nop,nop,TS val 281722597 ecr 281722596], length 0
2022-04-05 22:57:20.094134 IP (tos 0x0, ttl 64, id 20132, offset 0, flags [DF], proto TCP (6), length 3474)
    127.0.0.1.9450 > 127.0.0.1.37046: Flags [P.], cksum 0x0b87 (incorrect -> 0xa147), seq 40148:43570, ack 941, win 512, options [nop,nop,TS val 281722597 ecr 281722597], length 3422
2022-04-05 22:57:20.094141 IP (tos 0x0, ttl 64, id 23696, offset 0, flags [DF], proto TCP (6), length 52)
    127.0.0.1.37046 > 127.0.0.1.9450: Flags [.], cksum 0xfe28 (incorrect -> 0x0f44), seq 941, ack 43570, win 512, options [nop,nop,TS val 281722597 ecr 281722597], length 0
2022-04-05 22:57:20.097411 IP (tos 0x0, ttl 64, id 20133, offset 0, flags [DF], proto TCP (6), length 4036)
    127.0.0.1.9450 > 127.0.0.1.37046: Flags [P.], cksum 0x0db9 (incorrect -> 0x9e99), seq 43570:47554, ack 941, win 512, options [nop,nop,TS val 281722600 ecr 281722597], length 3984
2022-04-05 22:57:20.097421 IP (tos 0x0, ttl 64, id 23697, offset 0, flags [DF], proto TCP (6), length 52)
    127.0.0.1.37046 > 127.0.0.1.9450: Flags [.], cksum 0xfe28 (incorrect -> 0xffad), seq 941, ack 47554, win 512, options [nop,nop,TS val 281722600 ecr 281722600], length 0
2022-04-05 22:57:20.102243 IP (tos 0x0, ttl 64, id 20134, offset 0, flags [DF], proto TCP (6), length 1546)
    127.0.0.1.9450 > 127.0.0.1.37046: Flags [P.], cksum 0x03ff (incorrect -> 0x6aeb), seq 47554:49048, ack 941, win 512, options [nop,nop,TS val 281722605 ecr 281722600], length 1494
2022-04-05 22:57:20.102252 IP (tos 0x0, ttl 64, id 23698, offset 0, flags [DF], proto TCP (6), length 52)
    127.0.0.1.37046 > 127.0.0.1.9450: Flags [.], cksum 0xfe28 (incorrect -> 0xf9cd), seq 941, ack 49048, win 512, options [nop,nop,TS val 281722605 ecr 281722605], length 0
2022-04-05 22:57:20.106068 IP (tos 0x0, ttl 64, id 20135, offset 0, flags [DF], proto TCP (6), length 3040)
    127.0.0.1.9450 > 127.0.0.1.37046: Flags [P.], cksum 0x09d5 (incorrect -> 0x30f0), seq 49048:52036, ack 941, win 512, options [nop,nop,TS val 281722609 ecr 281722605], length 2988
2022-04-05 22:57:20.106086 IP (tos 0x0, ttl 64, id 23699, offset 0, flags [DF], proto TCP (6), length 52)
    127.0.0.1.37046 > 127.0.0.1.9450: Flags [.], cksum 0xfe28 (incorrect -> 0xee19), seq 941, ack 52036, win 512, options [nop,nop,TS val 281722609 ecr 281722609], length 0
2022-04-05 22:57:20.250327 IP (tos 0x0, ttl 64, id 20136, offset 0, flags [DF], proto TCP (6), length 3538)
    127.0.0.1.9450 > 127.0.0.1.37046: Flags [P.], cksum 0x0bc7 (incorrect -> 0xaac8), seq 52036:55522, ack 941, win 512, options [nop,nop,TS val 281722753 ecr 281722609], length 3486
2022-04-05 22:57:20.250355 IP (tos 0x0, ttl 64, id 23700, offset 0, flags [DF], proto TCP (6), length 52)
    127.0.0.1.37046 > 127.0.0.1.9450: Flags [.], cksum 0xfe28 (incorrect -> 0xdf5b), seq 941, ack 55522, win 512, options [nop,nop,TS val 281722753 ecr 281722753], length 0
2022-04-05 22:57:20.250404 IP (tos 0x0, ttl 64, id 20137, offset 0, flags [DF], proto TCP (6), length 4036)
    127.0.0.1.9450 > 127.0.0.1.37046: Flags [P.], cksum 0x0db9 (incorrect -> 0x92cf), seq 55522:59506, ack 941, win 512, options [nop,nop,TS val 281722753 ecr 281722753], length 3984
2022-04-05 22:57:20.250775 IP (tos 0x0, ttl 64, id 23701, offset 0, flags [DF], proto TCP (6), length 52)
    127.0.0.1.37046 > 127.0.0.1.9450: Flags [.], cksum 0xfe28 (incorrect -> 0xcfcb), seq 941, ack 59506, win 512, options [nop,nop,TS val 281722753 ecr 281722753], length 0
2022-04-05 22:57:20.254614 IP (tos 0x0, ttl 64, id 20138, offset 0, flags [DF], proto TCP (6), length 4036)
    127.0.0.1.9450 > 127.0.0.1.37046: Flags [P.], cksum 0x0db9 (incorrect -> 0xb907), seq 59506:63490, ack 941, win 512, options [nop,nop,TS val 281722757 ecr 281722753], length 3984
2022-04-05 22:57:20.294660 IP (tos 0x0, ttl 64, id 23702, offset 0, flags [DF], proto TCP (6), length 52)
    127.0.0.1.37046 > 127.0.0.1.9450: Flags [.], cksum 0xfe28 (incorrect -> 0xc00b), seq 941, ack 63490, win 512, options [nop,nop,TS val 281722797 ecr 281722757], length 0
2022-04-05 22:57:20.294667 IP (tos 0x0, ttl 64, id 20139, offset 0, flags [DF], proto TCP (6), length 4534)
    127.0.0.1.9450 > 127.0.0.1.37046: Flags [P.], cksum 0x0fab (incorrect -> 0x12bb), seq 63490:67972, ack 941, win 512, options [nop,nop,TS val 281722797 ecr 281722797], length 4482
2022-04-05 22:57:20.338653 IP (tos 0x0, ttl 64, id 23703, offset 0, flags [DF], proto TCP (6), length 52)
    127.0.0.1.37046 > 127.0.0.1.9450: Flags [.], cksum 0xfe28 (incorrect -> 0xae35), seq 941, ack 67972, win 512, options [nop,nop,TS val 281722841 ecr 281722797], length 0
2022-04-05 22:57:20.402052 IP (tos 0x0, ttl 64, id 20140, offset 0, flags [DF], proto TCP (6), length 3538)
    127.0.0.1.9450 > 127.0.0.1.37046: Flags [P.], cksum 0x0bc7 (incorrect -> 0x225b), seq 67972:71458, ack 941, win 512, options [nop,nop,TS val 281722904 ecr 281722841], length 3486
2022-04-05 22:57:20.402480 IP (tos 0x0, ttl 64, id 23704, offset 0, flags [DF], proto TCP (6), length 52)
    127.0.0.1.37046 > 127.0.0.1.9450: Flags [.], cksum 0xfe28 (incorrect -> 0x9fec), seq 941, ack 71458, win 512, options [nop,nop,TS val 281722905 ecr 281722904], length 0
2022-04-05 22:57:20.406518 IP (tos 0x0, ttl 64, id 20141, offset 0, flags [DF], proto TCP (6), length 4036)
    127.0.0.1.9450 > 127.0.0.1.37046: Flags [P.], cksum 0x0db9 (incorrect -> 0x7b42), seq 71458:75442, ack 941, win 512, options [nop,nop,TS val 281722909 ecr 281722905], length 3984
2022-04-05 22:57:20.406529 IP (tos 0x0, ttl 64, id 23705, offset 0, flags [DF], proto TCP (6), length 52)
    127.0.0.1.37046 > 127.0.0.1.9450: Flags [.], cksum 0xfe28 (incorrect -> 0x9053), seq 941, ack 75442, win 512, options [nop,nop,TS val 281722909 ecr 281722909], length 0
2022-04-05 22:57:20.407889 IP (tos 0x0, ttl 64, id 20142, offset 0, flags [DF], proto TCP (6), length 2542)
    127.0.0.1.9450 > 127.0.0.1.37046: Flags [P.], cksum 0x07e3 (incorrect -> 0x11f6), seq 75442:77932, ack 941, win 512, options [nop,nop,TS val 281722910 ecr 281722909], length 2490
2022-04-05 22:57:20.407897 IP (tos 0x0, ttl 64, id 23706, offset 0, flags [DF], proto TCP (6), length 52)
    127.0.0.1.37046 > 127.0.0.1.9450: Flags [.], cksum 0xfe28 (incorrect -> 0x8697), seq 941, ack 77932, win 512, options [nop,nop,TS val 281722910 ecr 281722910], length 0
2022-04-05 22:57:20.410709 IP (tos 0x0, ttl 64, id 20143, offset 0, flags [DF], proto TCP (6), length 4100)
    127.0.0.1.9450 > 127.0.0.1.37046: Flags [P.], cksum 0x0df9 (incorrect -> 0x578f), seq 77932:81980, ack 941, win 512, options [nop,nop,TS val 281722913 ecr 281722910], length 4048
2022-04-05 22:57:20.410719 IP (tos 0x0, ttl 64, id 23707, offset 0, flags [DF], proto TCP (6), length 52)
    127.0.0.1.37046 > 127.0.0.1.9450: Flags [.], cksum 0xfe28 (incorrect -> 0x76c1), seq 941, ack 81980, win 512, options [nop,nop,TS val 281722913 ecr 281722913], length 0
2022-04-05 22:57:20.410726 IP (tos 0x0, ttl 64, id 20144, offset 0, flags [DF], proto TCP (6), length 466)
    127.0.0.1.9450 > 127.0.0.1.37046: Flags [P.], cksum 0xffc6 (incorrect -> 0xdc2e), seq 81980:82394, ack 941, win 512, options [nop,nop,TS val 281722913 ecr 281722913], length 414
2022-04-05 22:57:20.410732 IP (tos 0x0, ttl 64, id 23708, offset 0, flags [DF], proto TCP (6), length 52)
    127.0.0.1.37046 > 127.0.0.1.9450: Flags [.], cksum 0xfe28 (incorrect -> 0x7523), seq 941, ack 82394, win 512, options [nop,nop,TS val 281722913 ecr 281722913], length 0
2022-04-05 22:57:20.414320 IP (tos 0x0, ttl 64, id 20145, offset 0, flags [DF], proto TCP (6), length 1566)
    127.0.0.1.9450 > 127.0.0.1.37046: Flags [P.], cksum 0x0413 (incorrect -> 0xa25a), seq 82394:83908, ack 941, win 512, options [nop,nop,TS val 281722917 ecr 281722913], length 1514
2022-04-05 22:57:20.414328 IP (tos 0x0, ttl 64, id 23709, offset 0, flags [DF], proto TCP (6), length 52)
    127.0.0.1.37046 > 127.0.0.1.9450: Flags [.], cksum 0xfe28 (incorrect -> 0x6f31), seq 941, ack 83908, win 512, options [nop,nop,TS val 281722917 ecr 281722917], length 0
2022-04-05 22:57:20.511688 IP (tos 0x0, ttl 64, id 20146, offset 0, flags [DF], proto TCP (6), length 3538)
    127.0.0.1.9450 > 127.0.0.1.37046: Flags [P.], cksum 0x0bc7 (incorrect -> 0x3a67), seq 83908:87394, ack 941, win 512, options [nop,nop,TS val 281723014 ecr 281722917], length 3486
2022-04-05 22:57:20.511872 IP (tos 0x0, ttl 64, id 23710, offset 0, flags [DF], proto TCP (6), length 52)
    127.0.0.1.37046 > 127.0.0.1.9450: Flags [.], cksum 0xfe28 (incorrect -> 0x60d1), seq 941, ack 87394, win 512, options [nop,nop,TS val 281723014 ecr 281723014], length 0
2022-04-05 22:57:20.511914 IP (tos 0x0, ttl 64, id 20147, offset 0, flags [DF], proto TCP (6), length 4036)
    127.0.0.1.9450 > 127.0.0.1.37046: Flags [P.], cksum 0x0db9 (incorrect -> 0x1467), seq 87394:91378, ack 941, win 512, options [nop,nop,TS val 281723014 ecr 281723014], length 3984
2022-04-05 22:57:20.511922 IP (tos 0x0, ttl 64, id 23711, offset 0, flags [DF], proto TCP (6), length 52)
    127.0.0.1.37046 > 127.0.0.1.9450: Flags [.], cksum 0xfe28 (incorrect -> 0x5141), seq 941, ack 91378, win 512, options [nop,nop,TS val 281723014 ecr 281723014], length 0
2022-04-05 22:57:20.515496 IP (tos 0x0, ttl 64, id 20148, offset 0, flags [DF], proto TCP (6), length 4036)
    127.0.0.1.9450 > 127.0.0.1.37046: Flags [P.], cksum 0x0db9 (incorrect -> 0x01a2), seq 91378:95362, ack 941, win 512, options [nop,nop,TS val 281723018 ecr 281723014], length 3984
2022-04-05 22:57:20.558657 IP (tos 0x0, ttl 64, id 23712, offset 0, flags [DF], proto TCP (6), length 52)
    127.0.0.1.37046 > 127.0.0.1.9450: Flags [.], cksum 0xfe28 (incorrect -> 0x417e), seq 941, ack 95362, win 512, options [nop,nop,TS val 281723061 ecr 281723018], length 0
2022-04-05 22:57:20.558665 IP (tos 0x0, ttl 64, id 20149, offset 0, flags [DF], proto TCP (6), length 4534)
    127.0.0.1.9450 > 127.0.0.1.37046: Flags [P.], cksum 0x0fab (incorrect -> 0x57ea), seq 95362:99844, ack 941, win 512, options [nop,nop,TS val 281723061 ecr 281723061], length 4482
200, 6.738452434539795, 1.69716477394104