2022-04-05 09:59:29.609542 IP (tos 0x0, ttl 64, id 39636, offset 0, flags [DF], proto TCP (6), length 60)
    127.0.0.1.58324 > 127.0.0.1.9350: Flags [S], cksum 0xfe30 (incorrect -> 0x771f), seq 1904719021, win 65495, options [mss 65495,sackOK,TS val 235052112 ecr 0,nop,wscale 7], length 0
2022-04-05 09:59:29.609551 IP (tos 0x0, ttl 64, id 0, offset 0, flags [DF], proto TCP (6), length 60)
    127.0.0.1.9350 > 127.0.0.1.58324: Flags [S.], cksum 0xfe30 (incorrect -> 0x1dbc), seq 1527862266, ack 1904719022, win 65483, options [mss 65495,sackOK,TS val 235052112 ecr 235052112,nop,wscale 7], length 0
2022-04-05 09:59:29.609559 IP (tos 0x0, ttl 64, id 39637, offset 0, flags [DF], proto TCP (6), length 52)
    127.0.0.1.58324 > 127.0.0.1.9350: Flags [.], cksum 0xfe28 (incorrect -> 0x4478), seq 1, ack 1, win 512, options [nop,nop,TS val 235052112 ecr 235052112], length 0
2022-04-05 09:59:29.609657 IP (tos 0x0, ttl 64, id 39638, offset 0, flags [DF], proto TCP (6), length 55)
    127.0.0.1.58324 > 127.0.0.1.9350: Flags [P.], cksum 0xfe2b (incorrect -> 0x3f6c), seq 1:4, ack 1, win 512, options [nop,nop,TS val 235052112 ecr 235052112], length 3
2022-04-05 09:59:29.609668 IP (tos 0x0, ttl 64, id 61302, offset 0, flags [DF], proto TCP (6), length 52)
    127.0.0.1.9350 > 127.0.0.1.58324: Flags [.], cksum 0xfe28 (incorrect -> 0x4475), seq 1, ack 4, win 512, options [nop,nop,TS val 235052112 ecr 235052112], length 0
2022-04-05 09:59:29.609903 IP (tos 0x0, ttl 64, id 61303, offset 0, flags [DF], proto TCP (6), length 54)
    127.0.0.1.9350 > 127.0.0.1.58324: Flags [P.], cksum 0xfe2a (incorrect -> 0x3f6b), seq 1:3, ack 4, win 512, options [nop,nop,TS val 235052112 ecr 235052112], length 2
2022-04-05 09:59:29.609918 IP (tos 0x0, ttl 64, id 39639, offset 0, flags [DF], proto TCP (6), length 52)
    127.0.0.1.58324 > 127.0.0.1.9350: Flags [.], cksum 0xfe28 (incorrect -> 0x4473), seq 4, ack 3, win 512, options [nop,nop,TS val 235052112 ecr 235052112], length 0
2022-04-05 09:59:29.612087 IP (tos 0x0, ttl 64, id 39640, offset 0, flags [DF], proto TCP (6), length 62)
    127.0.0.1.58324 > 127.0.0.1.9350: Flags [P.], cksum 0xfe32 (incorrect -> 0xa531), seq 4:14, ack 3, win 512, options [nop,nop,TS val 235052115 ecr 235052112], length 10
2022-04-05 09:59:29.612110 IP (tos 0x0, ttl 64, id 61304, offset 0, flags [DF], proto TCP (6), length 52)
    127.0.0.1.9350 > 127.0.0.1.58324: Flags [.], cksum 0xfe28 (incorrect -> 0x4463), seq 3, ack 14, win 512, options [nop,nop,TS val 235052115 ecr 235052115], length 0
2022-04-05 09:59:30.005098 IP (tos 0x0, ttl 64, id 61305, offset 0, flags [DF], proto TCP (6), length 62)
    127.0.0.1.9350 > 127.0.0.1.58324: Flags [P.], cksum 0xfe32 (incorrect -> 0x3dc7), seq 3:13, ack 14, win 512, options [nop,nop,TS val 235052508 ecr 235052115], length 10
2022-04-05 09:59:30.005125 IP (tos 0x0, ttl 64, id 39641, offset 0, flags [DF], proto TCP (6), length 52)
    127.0.0.1.58324 > 127.0.0.1.9350: Flags [.], cksum 0xfe28 (incorrect -> 0x4147), seq 14, ack 13, win 512, options [nop,nop,TS val 235052508 ecr 235052508], length 0
2022-04-05 09:59:30.011210 IP (tos 0x0, ttl 64, id 39642, offset 0, flags [DF], proto TCP (6), length 569)
    127.0.0.1.58324 > 127.0.0.1.9350: Flags [P.], cksum 0x002e (incorrect -> 0x33cd), seq 14:531, ack 13, win 512, options [nop,nop,TS val 235052514 ecr 235052508], length 517
2022-04-05 09:59:30.011227 IP (tos 0x0, ttl 64, id 61306, offset 0, flags [DF], proto TCP (6), length 52)
    127.0.0.1.9350 > 127.0.0.1.58324: Flags [.], cksum 0xfe28 (incorrect -> 0x3f3a), seq 13, ack 531, win 508, options [nop,nop,TS val 235052514 ecr 235052514], length 0
2022-04-05 09:59:30.405880 IP (tos 0x0, ttl 64, id 61307, offset 0, flags [DF], proto TCP (6), length 3538)
    127.0.0.1.9350 > 127.0.0.1.58324: Flags [P.], cksum 0x0bc7 (incorrect -> 0xedda), seq 13:3499, ack 531, win 512, options [nop,nop,TS val 235052908 ecr 235052514], length 3486
2022-04-05 09:59:30.405907 IP (tos 0x0, ttl 64, id 39643, offset 0, flags [DF], proto TCP (6), length 52)
    127.0.0.1.58324 > 127.0.0.1.9350: Flags [.], cksum 0xfe28 (incorrect -> 0x2e96), seq 531, ack 3499, win 494, options [nop,nop,TS val 235052908 ecr 235052908], length 0
2022-04-05 09:59:30.540224 IP (tos 0x0, ttl 64, id 61308, offset 0, flags [DF], proto TCP (6), length 662)
    127.0.0.1.9350 > 127.0.0.1.58324: Flags [P.], cksum 0x008b (incorrect -> 0xe87b), seq 3499:4109, ack 531, win 512, options [nop,nop,TS val 235053043 ecr 235052908], length 610
2022-04-05 09:59:30.540232 IP (tos 0x0, ttl 64, id 39644, offset 0, flags [DF], proto TCP (6), length 52)
    127.0.0.1.58324 > 127.0.0.1.9350: Flags [.], cksum 0xfe28 (incorrect -> 0x2b1b), seq 531, ack 4109, win 505, options [nop,nop,TS val 235053043 ecr 235053043], length 0
2022-04-05 09:59:30.558876 IP (tos 0x0, ttl 64, id 61309, offset 0, flags [DF], proto TCP (6), length 1081)
    127.0.0.1.9350 > 127.0.0.1.58324: Flags [P.], cksum 0x022e (incorrect -> 0x2eed), seq 4109:5138, ack 531, win 512, options [nop,nop,TS val 235053061 ecr 235053043], length 1029
2022-04-05 09:59:30.558900 IP (tos 0x0, ttl 64, id 39645, offset 0, flags [DF], proto TCP (6), length 52)
    127.0.0.1.58324 > 127.0.0.1.9350: Flags [.], cksum 0xfe28 (incorrect -> 0x26f4), seq 531, ack 5138, win 503, options [nop,nop,TS val 235053061 ecr 235053061], length 0
2022-04-05 09:59:30.559569 IP (tos 0x0, ttl 64, id 39646, offset 0, flags [DF], proto TCP (6), length 132)
    127.0.0.1.58324 > 127.0.0.1.9350: Flags [P.], cksum 0xfe78 (incorrect -> 0xd670), seq 531:611, ack 5138, win 512, options [nop,nop,TS val 235053062 ecr 235053061], length 80
2022-04-05 09:59:30.559577 IP (tos 0x0, ttl 64, id 61310, offset 0, flags [DF], proto TCP (6), length 52)
    127.0.0.1.9350 > 127.0.0.1.58324: Flags [.], cksum 0xfe28 (incorrect -> 0x2699), seq 5138, ack 611, win 512, options [nop,nop,TS val 235053062 ecr 235053062], length 0
2022-04-05 09:59:30.560122 IP (tos 0x0, ttl 64, id 39647, offset 0, flags [DF], proto TCP (6), length 351)
    127.0.0.1.58324 > 127.0.0.1.9350: Flags [P.], cksum 0xff53 (incorrect -> 0x5eab), seq 611:910, ack 5138, win 512, options [nop,nop,TS val 235053063 ecr 235053062], length 299
2022-04-05 09:59:30.560128 IP (tos 0x0, ttl 64, id 61311, offset 0, flags [DF], proto TCP (6), length 52)
    127.0.0.1.9350 > 127.0.0.1.58324: Flags [.], cksum 0xfe28 (incorrect -> 0x256e), seq 5138, ack 910, win 510, options [nop,nop,TS val 235053063 ecr 235053063], length 0
200, 8.3204345703125, 1.5372896194458008