2022-04-05 09:06:07.142315 IP (tos 0x0, ttl 64, id 49052, offset 0, flags [DF], proto TCP (6), length 60)
    127.0.0.1.45676 > 127.0.0.1.12250: Flags [S], cksum 0xfe30 (incorrect -> 0xa5c7), seq 260220044, win 65495, options [mss 65495,sackOK,TS val 787211513 ecr 0,nop,wscale 7], length 0
2022-04-05 09:06:07.142321 IP (tos 0x0, ttl 64, id 0, offset 0, flags [DF], proto TCP (6), length 60)
    127.0.0.1.12250 > 127.0.0.1.45676: Flags [S.], cksum 0xfe30 (incorrect -> 0xa5ca), seq 2594460014, ack 260220045, win 65483, options [mss 65495,sackOK,TS val 787211513 ecr 787211513,nop,wscale 7], length 0
2022-04-05 09:06:07.142327 IP (tos 0x0, ttl 64, id 49053, offset 0, flags [DF], proto TCP (6), length 52)
    127.0.0.1.45676 > 127.0.0.1.12250: Flags [.], cksum 0xfe28 (incorrect -> 0xcc86), seq 1, ack 1, win 512, options [nop,nop,TS val 787211513 ecr 787211513], length 0
2022-04-05 09:06:07.142414 IP (tos 0x0, ttl 64, id 49054, offset 0, flags [DF], proto TCP (6), length 55)
    127.0.0.1.45676 > 127.0.0.1.12250: Flags [P.], cksum 0xfe2b (incorrect -> 0xc779), seq 1:4, ack 1, win 512, options [nop,nop,TS val 787211514 ecr 787211513], length 3
2022-04-05 09:06:07.142417 IP (tos 0x0, ttl 64, id 51349, offset 0, flags [DF], proto TCP (6), length 52)
    127.0.0.1.12250 > 127.0.0.1.45676: Flags [.], cksum 0xfe28 (incorrect -> 0xcc81), seq 1, ack 4, win 512, options [nop,nop,TS val 787211514 ecr 787211514], length 0
2022-04-05 09:06:07.142476 IP (tos 0x0, ttl 64, id 51350, offset 0, flags [DF], proto TCP (6), length 54)
    127.0.0.1.12250 > 127.0.0.1.45676: Flags [P.], cksum 0xfe2a (incorrect -> 0xc777), seq 1:3, ack 4, win 512, options [nop,nop,TS val 787211514 ecr 787211514], length 2
2022-04-05 09:06:07.142480 IP (tos 0x0, ttl 64, id 49055, offset 0, flags [DF], proto TCP (6), length 52)
    127.0.0.1.45676 > 127.0.0.1.12250: Flags [.], cksum 0xfe28 (incorrect -> 0xcc7f), seq 4, ack 3, win 512, options [nop,nop,TS val 787211514 ecr 787211514], length 0
2022-04-05 09:06:07.143749 IP (tos 0x0, ttl 64, id 49056, offset 0, flags [DF], proto TCP (6), length 62)
    127.0.0.1.45676 > 127.0.0.1.12250: Flags [P.], cksum 0xfe32 (incorrect -> 0x4646), seq 4:14, ack 3, win 512, options [nop,nop,TS val 787211515 ecr 787211514], length 10
2022-04-05 09:06:07.143756 IP (tos 0x0, ttl 64, id 51351, offset 0, flags [DF], proto TCP (6), length 52)
    127.0.0.1.12250 > 127.0.0.1.45676: Flags [.], cksum 0xfe28 (incorrect -> 0xcc73), seq 3, ack 14, win 512, options [nop,nop,TS val 787211515 ecr 787211515], length 0
2022-04-05 09:06:07.240091 IP (tos 0x0, ttl 64, id 51352, offset 0, flags [DF], proto TCP (6), length 62)
    127.0.0.1.12250 > 127.0.0.1.45676: Flags [P.], cksum 0xfe32 (incorrect -> 0xc700), seq 3:13, ack 14, win 512, options [nop,nop,TS val 787211611 ecr 787211515], length 10
2022-04-05 09:06:07.240102 IP (tos 0x0, ttl 64, id 49057, offset 0, flags [DF], proto TCP (6), length 52)
    127.0.0.1.45676 > 127.0.0.1.12250: Flags [.], cksum 0xfe28 (incorrect -> 0xcba9), seq 14, ack 13, win 512, options [nop,nop,TS val 787211611 ecr 787211611], length 0
2022-04-05 09:06:07.246015 IP (tos 0x0, ttl 64, id 49058, offset 0, flags [DF], proto TCP (6), length 569)
    127.0.0.1.45676 > 127.0.0.1.12250: Flags [P.], cksum 0x002e (incorrect -> 0xd68e), seq 14:531, ack 13, win 512, options [nop,nop,TS val 787211617 ecr 787211611], length 517
2022-04-05 09:06:07.246034 IP (tos 0x0, ttl 64, id 51353, offset 0, flags [DF], proto TCP (6), length 52)
    127.0.0.1.12250 > 127.0.0.1.45676: Flags [.], cksum 0xfe28 (incorrect -> 0xc99c), seq 13, ack 531, win 508, options [nop,nop,TS val 787211617 ecr 787211617], length 0
200, 124.31652331352234, 1.0582585334777832