2022-04-05 14:35:16.175153 IP (tos 0x0, ttl 64, id 44881, offset 0, flags [DF], proto TCP (6), length 60)
    127.0.0.1.44318 > 127.0.0.1.9150: Flags [S], cksum 0xfe30 (incorrect -> 0x35c5), seq 3868343416, win 65495, options [mss 65495,sackOK,TS val 251598678 ecr 0,nop,wscale 7], length 0
2022-04-05 14:35:16.175164 IP (tos 0x0, ttl 64, id 0, offset 0, flags [DF], proto TCP (6), length 60)
    127.0.0.1.9150 > 127.0.0.1.44318: Flags [S.], cksum 0xfe30 (incorrect -> 0xf56e), seq 347669827, ack 3868343417, win 65483, options [mss 65495,sackOK,TS val 251598678 ecr 251598678,nop,wscale 7], length 0
2022-04-05 14:35:16.175175 IP (tos 0x0, ttl 64, id 44882, offset 0, flags [DF], proto TCP (6), length 52)
    127.0.0.1.44318 > 127.0.0.1.9150: Flags [.], cksum 0xfe28 (incorrect -> 0x1c2b), seq 1, ack 1, win 512, options [nop,nop,TS val 251598678 ecr 251598678], length 0
2022-04-05 14:35:16.175296 IP (tos 0x0, ttl 64, id 44883, offset 0, flags [DF], proto TCP (6), length 55)
    127.0.0.1.44318 > 127.0.0.1.9150: Flags [P.], cksum 0xfe2b (incorrect -> 0x171f), seq 1:4, ack 1, win 512, options [nop,nop,TS val 251598678 ecr 251598678], length 3
2022-04-05 14:35:16.175311 IP (tos 0x0, ttl 64, id 28998, offset 0, flags [DF], proto TCP (6), length 52)
    127.0.0.1.9150 > 127.0.0.1.44318: Flags [.], cksum 0xfe28 (incorrect -> 0x1c28), seq 1, ack 4, win 512, options [nop,nop,TS val 251598678 ecr 251598678], length 0
2022-04-05 14:35:16.175374 IP (tos 0x0, ttl 64, id 28999, offset 0, flags [DF], proto TCP (6), length 54)
    127.0.0.1.9150 > 127.0.0.1.44318: Flags [P.], cksum 0xfe2a (incorrect -> 0x171e), seq 1:3, ack 4, win 512, options [nop,nop,TS val 251598678 ecr 251598678], length 2
2022-04-05 14:35:16.175394 IP (tos 0x0, ttl 64, id 44884, offset 0, flags [DF], proto TCP (6), length 52)
    127.0.0.1.44318 > 127.0.0.1.9150: Flags [.], cksum 0xfe28 (incorrect -> 0x1c26), seq 4, ack 3, win 512, options [nop,nop,TS val 251598678 ecr 251598678], length 0
2022-04-05 14:35:16.187435 IP (tos 0x0, ttl 64, id 44885, offset 0, flags [DF], proto TCP (6), length 62)
    127.0.0.1.44318 > 127.0.0.1.9150: Flags [P.], cksum 0xfe32 (incorrect -> 0x8c0b), seq 4:14, ack 3, win 512, options [nop,nop,TS val 251598690 ecr 251598678], length 10
2022-04-05 14:35:16.187453 IP (tos 0x0, ttl 64, id 29000, offset 0, flags [DF], proto TCP (6), length 52)
    127.0.0.1.9150 > 127.0.0.1.44318: Flags [.], cksum 0xfe28 (incorrect -> 0x1c04), seq 3, ack 14, win 512, options [nop,nop,TS val 251598690 ecr 251598690], length 0
2022-04-05 14:35:16.231561 IP (tos 0x0, ttl 64, id 29001, offset 0, flags [DF], proto TCP (6), length 62)
    127.0.0.1.9150 > 127.0.0.1.44318: Flags [P.], cksum 0xfe32 (incorrect -> 0x16c5), seq 3:13, ack 14, win 512, options [nop,nop,TS val 251598734 ecr 251598690], length 10
2022-04-05 14:35:16.231576 IP (tos 0x0, ttl 64, id 44886, offset 0, flags [DF], proto TCP (6), length 52)
    127.0.0.1.44318 > 127.0.0.1.9150: Flags [.], cksum 0xfe28 (incorrect -> 0x1ba2), seq 14, ack 13, win 512, options [nop,nop,TS val 251598734 ecr 251598734], length 0
2022-04-05 14:35:16.237306 IP (tos 0x0, ttl 64, id 44887, offset 0, flags [DF], proto TCP (6), length 569)
    127.0.0.1.44318 > 127.0.0.1.9150: Flags [P.], cksum 0x002e (incorrect -> 0xc915), seq 14:531, ack 13, win 512, options [nop,nop,TS val 251598740 ecr 251598734], length 517
2022-04-05 14:35:16.237314 IP (tos 0x0, ttl 64, id 29002, offset 0, flags [DF], proto TCP (6), length 52)
    127.0.0.1.9150 > 127.0.0.1.44318: Flags [.], cksum 0xfe28 (incorrect -> 0x1995), seq 13, ack 531, win 508, options [nop,nop,TS val 251598740 ecr 251598740], length 0
2022-04-05 14:35:16.281447 IP (tos 0x0, ttl 64, id 29003, offset 0, flags [DF], proto TCP (6), length 3504)
    127.0.0.1.9150 > 127.0.0.1.44318: Flags [P.], cksum 0x0ba5 (incorrect -> 0x7b1b), seq 13:3465, ack 531, win 512, options [nop,nop,TS val 251598784 ecr 251598740], length 3452
2022-04-05 14:35:16.281462 IP (tos 0x0, ttl 64, id 44888, offset 0, flags [DF], proto TCP (6), length 52)
    127.0.0.1.44318 > 127.0.0.1.9150: Flags [.], cksum 0xfe28 (incorrect -> 0x0bcf), seq 531, ack 3465, win 494, options [nop,nop,TS val 251598784 ecr 251598784], length 0
2022-04-05 14:35:16.337579 IP (tos 0x0, ttl 64, id 29004, offset 0, flags [DF], proto TCP (6), length 1185)
    127.0.0.1.9150 > 127.0.0.1.44318: Flags [P.], cksum 0x0296 (incorrect -> 0x929f), seq 3465:4598, ack 531, win 512, options [nop,nop,TS val 251598840 ecr 251598784], length 1133
2022-04-05 14:35:16.337589 IP (tos 0x0, ttl 64, id 44889, offset 0, flags [DF], proto TCP (6), length 52)
    127.0.0.1.44318 > 127.0.0.1.9150: Flags [.], cksum 0xfe28 (incorrect -> 0x06e9), seq 531, ack 4598, win 503, options [nop,nop,TS val 251598840 ecr 251598840], length 0
2022-04-05 14:35:16.338053 IP (tos 0x0, ttl 64, id 44890, offset 0, flags [DF], proto TCP (6), length 132)
    127.0.0.1.44318 > 127.0.0.1.9150: Flags [P.], cksum 0xfe78 (incorrect -> 0xe37e), seq 531:611, ack 4598, win 512, options [nop,nop,TS val 251598840 ecr 251598840], length 80
2022-04-05 14:35:16.338062 IP (tos 0x0, ttl 64, id 29005, offset 0, flags [DF], proto TCP (6), length 52)
    127.0.0.1.9150 > 127.0.0.1.44318: Flags [.], cksum 0xfe28 (incorrect -> 0x0690), seq 4598, ack 611, win 512, options [nop,nop,TS val 251598840 ecr 251598840], length 0
2022-04-05 14:35:16.338472 IP (tos 0x0, ttl 64, id 44891, offset 0, flags [DF], proto TCP (6), length 365)
    127.0.0.1.44318 > 127.0.0.1.9150: Flags [P.], cksum 0xff61 (incorrect -> 0xc7d0), seq 611:924, ack 4598, win 512, options [nop,nop,TS val 251598841 ecr 251598840], length 313
2022-04-05 14:35:16.338479 IP (tos 0x0, ttl 64, id 29006, offset 0, flags [DF], proto TCP (6), length 52)
    127.0.0.1.9150 > 127.0.0.1.44318: Flags [.], cksum 0xfe28 (incorrect -> 0x0557), seq 4598, ack 924, win 510, options [nop,nop,TS val 251598841 ecr 251598841], length 0
2022-04-05 14:35:16.428532 IP (tos 0x0, ttl 64, id 29007, offset 0, flags [DF], proto TCP (6), length 3198)
    127.0.0.1.9150 > 127.0.0.1.44318: Flags [P.], cksum 0x0a73 (incorrect -> 0xcf81), seq 4598:7744, ack 924, win 512, options [nop,nop,TS val 251598931 ecr 251598841], length 3146
2022-04-05 14:35:16.428543 IP (tos 0x0, ttl 64, id 44892, offset 0, flags [DF], proto TCP (6), length 52)
    127.0.0.1.44318 > 127.0.0.1.9150: Flags [.], cksum 0xfe28 (incorrect -> 0xf867), seq 924, ack 7744, win 495, options [nop,nop,TS val 251598931 ecr 251598931], length 0
2022-04-05 14:35:16.433713 IP (tos 0x0, ttl 64, id 29008, offset 0, flags [DF], proto TCP (6), length 1048)
    127.0.0.1.9150 > 127.0.0.1.44318: Flags [P.], cksum 0x020d (incorrect -> 0x9d73), seq 7744:8740, ack 924, win 512, options [nop,nop,TS val 251598936 ecr 251598931], length 996
2022-04-05 14:35:16.433721 IP (tos 0x0, ttl 64, id 44893, offset 0, flags [DF], proto TCP (6), length 52)
    127.0.0.1.44318 > 127.0.0.1.9150: Flags [.], cksum 0xfe28 (incorrect -> 0xf470), seq 924, ack 8740, win 504, options [nop,nop,TS val 251598936 ecr 251598936], length 0
2022-04-05 14:35:16.439661 IP (tos 0x0, ttl 64, id 29009, offset 0, flags [DF], proto TCP (6), length 4036)
    127.0.0.1.9150 > 127.0.0.1.44318: Flags [P.], cksum 0x0db9 (incorrect -> 0x467d), seq 8740:12724, ack 924, win 512, options [nop,nop,TS val 251598942 ecr 251598936], length 3984
2022-04-05 14:35:16.439669 IP (tos 0x0, ttl 64, id 44894, offset 0, flags [DF], proto TCP (6), length 52)
    127.0.0.1.44318 > 127.0.0.1.9150: Flags [.], cksum 0xfe28 (incorrect -> 0xe4e0), seq 924, ack 12724, win 492, options [nop,nop,TS val 251598942 ecr 251598942], length 0
2022-04-05 14:35:16.439724 IP (tos 0x0, ttl 64, id 29010, offset 0, flags [DF], proto TCP (6), length 4100)
    127.0.0.1.9150 > 127.0.0.1.44318: Flags [P.], cksum 0x0df9 (incorrect -> 0x08bd), seq 12724:16772, ack 924, win 512, options [nop,nop,TS val 251598942 ecr 251598942], length 4048
2022-04-05 14:35:16.439729 IP (tos 0x0, ttl 64, id 44895, offset 0, flags [DF], proto TCP (6), length 52)
    127.0.0.1.44318 > 127.0.0.1.9150: Flags [.], cksum 0xfe28 (incorrect -> 0xd520), seq 924, ack 16772, win 476, options [nop,nop,TS val 251598942 ecr 251598942], length 0
2022-04-05 14:35:16.439736 IP (tos 0x0, ttl 64, id 29011, offset 0, flags [DF], proto TCP (6), length 3202)
    127.0.0.1.9150 > 127.0.0.1.44318: Flags [P.], cksum 0x0a77 (incorrect -> 0x27b1), seq 16772:19922, ack 924, win 512, options [nop,nop,TS val 251598942 ecr 251598942], length 3150
2022-04-05 14:35:16.439741 IP (tos 0x0, ttl 64, id 44896, offset 0, flags [DF], proto TCP (6), length 52)
    127.0.0.1.44318 > 127.0.0.1.9150: Flags [.], cksum 0xfe28 (incorrect -> 0xc8de), seq 924, ack 19922, win 464, options [nop,nop,TS val 251598942 ecr 251598942], length 0
2022-04-05 14:35:16.442631 IP (tos 0x0, ttl 64, id 29012, offset 0, flags [DF], proto TCP (6), length 550)
    127.0.0.1.9150 > 127.0.0.1.44318: Flags [P.], cksum 0x001b (incorrect -> 0x0f54), seq 19922:20420, ack 924, win 512, options [nop,nop,TS val 251598945 ecr 251598942], length 498
2022-04-05 14:35:16.442659 IP (tos 0x0, ttl 64, id 44897, offset 0, flags [DF], proto TCP (6), length 52)
    127.0.0.1.44318 > 127.0.0.1.9150: Flags [.], cksum 0xfe28 (incorrect -> 0xc6bc), seq 924, ack 20420, win 506, options [nop,nop,TS val 251598945 ecr 251598945], length 0
2022-04-05 14:35:16.446599 IP (tos 0x0, ttl 64, id 29013, offset 0, flags [DF], proto TCP (6), length 4100)
    127.0.0.1.9150 > 127.0.0.1.44318: Flags [P.], cksum 0x0df9 (incorrect -> 0x5b52), seq 20420:24468, ack 924, win 512, options [nop,nop,TS val 251598949 ecr 251598945], length 4048
2022-04-05 14:35:16.446607 IP (tos 0x0, ttl 64, id 44898, offset 0, flags [DF], proto TCP (6), length 52)
    127.0.0.1.44318 > 127.0.0.1.9150: Flags [.], cksum 0xfe28 (incorrect -> 0xb6f2), seq 924, ack 24468, win 492, options [nop,nop,TS val 251598949 ecr 251598949], length 0
2022-04-05 14:35:16.446615 IP (tos 0x0, ttl 64, id 29014, offset 0, flags [DF], proto TCP (6), length 2840)
    127.0.0.1.9150 > 127.0.0.1.44318: Flags [P.], cksum 0x090d (incorrect -> 0x2f46), seq 24468:27256, ack 924, win 512, options [nop,nop,TS val 251598949 ecr 251598949], length 2788
2022-04-05 14:35:16.446620 IP (tos 0x0, ttl 64, id 44899, offset 0, flags [DF], proto TCP (6), length 52)
    127.0.0.1.44318 > 127.0.0.1.9150: Flags [.], cksum 0xfe28 (incorrect -> 0xac19), seq 924, ack 27256, win 481, options [nop,nop,TS val 251598949 ecr 251598949], length 0
2022-04-05 14:35:16.446683 IP (tos 0x0, ttl 64, id 29015, offset 0, flags [DF], proto TCP (6), length 4100)
    127.0.0.1.9150 > 127.0.0.1.44318: Flags [P.], cksum 0x0df9 (incorrect -> 0x73e4), seq 27256:31304, ack 924, win 512, options [nop,nop,TS val 251598949 ecr 251598949], length 4048
2022-04-05 14:35:16.460884 IP (tos 0x0, ttl 64, id 29016, offset 0, flags [DF], proto TCP (6), length 32820)
    127.0.0.1.9150 > 127.0.0.1.44318: Flags [.], cksum 0x7e29 (incorrect -> 0xd6d0), seq 31304:64072, ack 924, win 512, options [nop,nop,TS val 251598963 ecr 251598949], length 32768
2022-04-05 14:35:16.460927 IP (tos 0x0, ttl 64, id 44900, offset 0, flags [DF], proto TCP (6), length 52)
    127.0.0.1.44318 > 127.0.0.1.9150: Flags [.], cksum 0xfe28 (incorrect -> 0x1ca1), seq 924, ack 64072, win 379, options [nop,nop,TS val 251598963 ecr 251598949], length 0
2022-04-05 14:35:16.460937 IP (tos 0x0, ttl 64, id 29017, offset 0, flags [DF], proto TCP (6), length 5248)
    127.0.0.1.9150 > 127.0.0.1.44318: Flags [P.], cksum 0x1275 (incorrect -> 0xa6c7), seq 64072:69268, ack 924, win 512, options [nop,nop,TS val 251598963 ecr 251598963], length 5196
2022-04-05 14:35:16.461784 IP (tos 0x0, ttl 64, id 44901, offset 0, flags [DF], proto TCP (6), length 52)
    127.0.0.1.44318 > 127.0.0.1.9150: Flags [.], cksum 0xfe28 (incorrect -> 0x07c1), seq 924, ack 69268, win 512, options [nop,nop,TS val 251598964 ecr 251598963], length 0
2022-04-05 14:35:16.463104 IP (tos 0x0, ttl 64, id 29018, offset 0, flags [DF], proto TCP (6), length 2044)
    127.0.0.1.9150 > 127.0.0.1.44318: Flags [P.], cksum 0x05f1 (incorrect -> 0x9980), seq 69268:71260, ack 924, win 512, options [nop,nop,TS val 251598966 ecr 251598964], length 1992
2022-04-05 14:35:16.463532 IP (tos 0x0, ttl 64, id 44902, offset 0, flags [DF], proto TCP (6), length 52)
    127.0.0.1.44318 > 127.0.0.1.9150: Flags [.], cksum 0xfe28 (incorrect -> 0xfff3), seq 924, ack 71260, win 512, options [nop,nop,TS val 251598966 ecr 251598966], length 0
2022-04-05 14:35:16.463603 IP (tos 0x0, ttl 64, id 29019, offset 0, flags [DF], proto TCP (6), length 4100)
    127.0.0.1.9150 > 127.0.0.1.44318: Flags [P.], cksum 0x0df9 (incorrect -> 0x8685), seq 71260:75308, ack 924, win 512, options [nop,nop,TS val 251598966 ecr 251598966], length 4048
2022-04-05 14:35:16.463643 IP (tos 0x0, ttl 64, id 44903, offset 0, flags [DF], proto TCP (6), length 52)
    127.0.0.1.44318 > 127.0.0.1.9150: Flags [.], cksum 0xfe28 (incorrect -> 0xf023), seq 924, ack 75308, win 512, options [nop,nop,TS val 251598966 ecr 251598966], length 0
2022-04-05 14:35:16.463650 IP (tos 0x0, ttl 64, id 29020, offset 0, flags [DF], proto TCP (6), length 7458)
    127.0.0.1.9150 > 127.0.0.1.44318: Flags [P.], cksum 0x1b17 (incorrect -> 0xc11b), seq 75308:82714, ack 924, win 512, options [nop,nop,TS val 251598966 ecr 251598966], length 7406
2022-04-05 14:35:16.463656 IP (tos 0x0, ttl 64, id 44904, offset 0, flags [DF], proto TCP (6), length 52)
    127.0.0.1.44318 > 127.0.0.1.9150: Flags [.], cksum 0xfe28 (incorrect -> 0xd335), seq 924, ack 82714, win 512, options [nop,nop,TS val 251598966 ecr 251598966], length 0
2022-04-05 14:35:16.465984 IP (tos 0x0, ttl 64, id 29021, offset 0, flags [DF], proto TCP (6), length 4036)
    127.0.0.1.9150 > 127.0.0.1.44318: Flags [P.], cksum 0x0db9 (incorrect -> 0xc778), seq 82714:86698, ack 924, win 512, options [nop,nop,TS val 251598968 ecr 251598966], length 3984
2022-04-05 14:35:16.465997 IP (tos 0x0, ttl 64, id 44905, offset 0, flags [DF], proto TCP (6), length 52)
    127.0.0.1.44318 > 127.0.0.1.9150: Flags [.], cksum 0xfe28 (incorrect -> 0xc3a1), seq 924, ack 86698, win 512, options [nop,nop,TS val 251598968 ecr 251598968], length 0
2022-04-05 14:35:16.467273 IP (tos 0x0, ttl 64, id 29022, offset 0, flags [DF], proto TCP (6), length 3492)
    127.0.0.1.9150 > 127.0.0.1.44318: Flags [P.], cksum 0x0b99 (incorrect -> 0x49d1), seq 86698:90138, ack 924, win 512, options [nop,nop,TS val 251598970 ecr 251598968], length 3440
2022-04-05 14:35:16.467544 IP (tos 0x0, ttl 64, id 44906, offset 0, flags [DF], proto TCP (6), length 52)
    127.0.0.1.44318 > 127.0.0.1.9150: Flags [.], cksum 0xfe28 (incorrect -> 0xb62d), seq 924, ack 90138, win 512, options [nop,nop,TS val 251598970 ecr 251598970], length 0
2022-04-05 14:35:16.470023 IP (tos 0x0, ttl 64, id 29023, offset 0, flags [DF], proto TCP (6), length 4100)
    127.0.0.1.9150 > 127.0.0.1.44318: Flags [P.], cksum 0x0df9 (incorrect -> 0x0f50), seq 90138:94186, ack 924, win 512, options [nop,nop,TS val 251598972 ecr 251598970], length 4048
2022-04-05 14:35:16.470085 IP (tos 0x0, ttl 64, id 44907, offset 0, flags [DF], proto TCP (6), length 52)
    127.0.0.1.44318 > 127.0.0.1.9150: Flags [.], cksum 0xfe28 (incorrect -> 0xa658), seq 924, ack 94186, win 512, options [nop,nop,TS val 251598973 ecr 251598972], length 0
2022-04-05 14:35:16.470092 IP (tos 0x0, ttl 64, id 29024, offset 0, flags [DF], proto TCP (6), length 3574)
    127.0.0.1.9150 > 127.0.0.1.44318: Flags [P.], cksum 0x0beb (incorrect -> 0x0b0f), seq 94186:97708, ack 924, win 512, options [nop,nop,TS val 251598973 ecr 251598973], length 3522
2022-04-05 14:35:16.470098 IP (tos 0x0, ttl 64, id 44908, offset 0, flags [DF], proto TCP (6), length 52)
    127.0.0.1.44318 > 127.0.0.1.9150: Flags [.], cksum 0xfe28 (incorrect -> 0x9895), seq 924, ack 97708, win 512, options [nop,nop,TS val 251598973 ecr 251598973], length 0
2022-04-05 14:35:16.474826 IP (tos 0x0, ttl 64, id 29025, offset 0, flags [DF], proto TCP (6), length 4100)
    127.0.0.1.9150 > 127.0.0.1.44318: Flags [P.], cksum 0x0df9 (incorrect -> 0x6c31), seq 97708:101756, ack 924, win 512, options [nop,nop,TS val 251598977 ecr 251598973], length 4048
2022-04-05 14:35:16.474846 IP (tos 0x0, ttl 64, id 44909, offset 0, flags [DF], proto TCP (6), length 52)
    127.0.0.1.44318 > 127.0.0.1.9150: Flags [.], cksum 0xfe28 (incorrect -> 0x88bd), seq 924, ack 101756, win 512, options [nop,nop,TS val 251598977 ecr 251598977], length 0
2022-04-05 14:35:16.474852 IP (tos 0x0, ttl 64, id 29026, offset 0, flags [DF], proto TCP (6), length 442)
    127.0.0.1.9150 > 127.0.0.1.44318: Flags [P.], cksum 0xffae (incorrect -> 0x272a), seq 101756:102146, ack 924, win 512, options [nop,nop,TS val 251598977 ecr 251598977], length 390
2022-04-05 14:35:16.474860 IP (tos 0x0, ttl 64, id 44910, offset 0, flags [DF], proto TCP (6), length 52)
    127.0.0.1.44318 > 127.0.0.1.9150: Flags [.], cksum 0xfe28 (incorrect -> 0x8737), seq 924, ack 102146, win 512, options [nop,nop,TS val 251598977 ecr 251598977], length 0
2022-04-05 14:35:16.474952 IP (tos 0x0, ttl 64, id 29027, offset 0, flags [DF], proto TCP (6), length 3538)
    127.0.0.1.9150 > 127.0.0.1.44318: Flags [P.], cksum 0x0bc7 (incorrect -> 0x9d5f), seq 102146:105632, ack 924, win 512, options [nop,nop,TS val 251598977 ecr 251598977], length 3486
2022-04-05 14:35:16.475383 IP (tos 0x0, ttl 64, id 44911, offset 0, flags [DF], proto TCP (6), length 52)
    127.0.0.1.44318 > 127.0.0.1.9150: Flags [.], cksum 0xfe28 (incorrect -> 0x7998), seq 924, ack 105632, win 512, options [nop,nop,TS val 251598978 ecr 251598977], length 0
2022-04-05 14:35:16.475620 IP (tos 0x0, ttl 64, id 29028, offset 0, flags [DF], proto TCP (6), length 4100)
    127.0.0.1.9150 > 127.0.0.1.44318: Flags [P.], cksum 0x0df9 (incorrect -> 0xf1f9), seq 105632:109680, ack 924, win 512, options [nop,nop,TS val 251598978 ecr 251598978], length 4048
2022-04-05 14:35:16.475635 IP (tos 0x0, ttl 64, id 44912, offset 0, flags [DF], proto TCP (6), length 52)
    127.0.0.1.44318 > 127.0.0.1.9150: Flags [.], cksum 0xfe28 (incorrect -> 0x69c7), seq 924, ack 109680, win 512, options [nop,nop,TS val 251598978 ecr 251598978], length 0
2022-04-05 14:35:16.475640 IP (tos 0x0, ttl 64, id 29029, offset 0, flags [DF], proto TCP (6), length 486)
    127.0.0.1.9150 > 127.0.0.1.44318: Flags [P.], cksum 0xffda (incorrect -> 0x8e85), seq 109680:110114, ack 924, win 512, options [nop,nop,TS val 251598978 ecr 251598978], length 434
2022-04-05 14:35:16.475646 IP (tos 0x0, ttl 64, id 44913, offset 0, flags [DF], proto TCP (6), length 52)
    127.0.0.1.44318 > 127.0.0.1.9150: Flags [.], cksum 0xfe28 (incorrect -> 0x6815), seq 924, ack 110114, win 512, options [nop,nop,TS val 251598978 ecr 251598978], length 0
2022-04-05 14:35:16.476095 IP (tos 0x0, ttl 64, id 29030, offset 0, flags [DF], proto TCP (6), length 4100)
    127.0.0.1.9150 > 127.0.0.1.44318: Flags [P.], cksum 0x0df9 (incorrect -> 0x05f1), seq 110114:114162, ack 924, win 512, options [nop,nop,TS val 251598979 ecr 251598978], length 4048
2022-04-05 14:35:16.476115 IP (tos 0x0, ttl 64, id 44914, offset 0, flags [DF], proto TCP (6), length 52)
    127.0.0.1.44318 > 127.0.0.1.9150: Flags [.], cksum 0xfe28 (incorrect -> 0x5843), seq 924, ack 114162, win 512, options [nop,nop,TS val 251598979 ecr 251598979], length 0
2022-04-05 14:35:16.476121 IP (tos 0x0, ttl 64, id 29031, offset 0, flags [DF], proto TCP (6), length 3474)
    127.0.0.1.9150 > 127.0.0.1.44318: Flags [P.], cksum 0x0b87 (incorrect -> 0x53c5), seq 114162:117584, ack 924, win 512, options [nop,nop,TS val 251598979 ecr 251598979], length 3422
2022-04-05 14:35:16.476126 IP (tos 0x0, ttl 64, id 44915, offset 0, flags [DF], proto TCP (6), length 52)
    127.0.0.1.44318 > 127.0.0.1.9150: Flags [.], cksum 0xfe28 (incorrect -> 0x4ae5), seq 924, ack 117584, win 512, options [nop,nop,TS val 251598979 ecr 251598979], length 0
2022-04-05 14:35:16.477966 IP (tos 0x0, ttl 64, id 29032, offset 0, flags [DF], proto TCP (6), length 4100)
    127.0.0.1.9150 > 127.0.0.1.44318: Flags [P.], cksum 0x0df9 (incorrect -> 0xabd2), seq 117584:121632, ack 924, win 512, options [nop,nop,TS val 251598980 ecr 251598979], length 4048
2022-04-05 14:35:16.478366 IP (tos 0x0, ttl 64, id 44916, offset 0, flags [DF], proto TCP (6), length 52)
    127.0.0.1.44318 > 127.0.0.1.9150: Flags [.], cksum 0xfe28 (incorrect -> 0x3b12), seq 924, ack 121632, win 512, options [nop,nop,TS val 251598981 ecr 251598980], length 0
2022-04-05 14:35:16.478373 IP (tos 0x0, ttl 64, id 29033, offset 0, flags [DF], proto TCP (6), length 542)
    127.0.0.1.9150 > 127.0.0.1.44318: Flags [P.], cksum 0x0013 (incorrect -> 0x1cbe), seq 121632:122122, ack 924, win 512, options [nop,nop,TS val 251598981 ecr 251598981], length 490
2022-04-05 14:35:16.478378 IP (tos 0x0, ttl 64, id 44917, offset 0, flags [DF], proto TCP (6), length 52)
    127.0.0.1.44318 > 127.0.0.1.9150: Flags [.], cksum 0xfe28 (incorrect -> 0x3927), seq 924, ack 122122, win 512, options [nop,nop,TS val 251598981 ecr 251598981], length 0
2022-04-05 14:35:16.483995 IP (tos 0x0, ttl 64, id 29034, offset 0, flags [DF], proto TCP (6), length 3538)
    127.0.0.1.9150 > 127.0.0.1.44318: Flags [P.], cksum 0x0bc7 (incorrect -> 0x6a53), seq 122122:125608, ack 924, win 512, options [nop,nop,TS val 251598986 ecr 251598981], length 3486
2022-04-05 14:35:16.484009 IP (tos 0x0, ttl 64, id 44918, offset 0, flags [DF], proto TCP (6), length 52)
    127.0.0.1.44318 > 127.0.0.1.9150: Flags [.], cksum 0xfe28 (incorrect -> 0x2b7f), seq 924, ack 125608, win 512, options [nop,nop,TS val 251598986 ecr 251598986], length 0
200, 4.707050323486328, 0.31688380241394043