2022-04-05 06:27:17.014546 IP (tos 0x0, ttl 64, id 52948, offset 0, flags [DF], proto TCP (6), length 60)
    127.0.0.1.45496 > 127.0.0.1.12250: Flags [S], cksum 0xfe30 (incorrect -> 0xb342), seq 1059050440, win 65495, options [mss 65495,sackOK,TS val 777681386 ecr 0,nop,wscale 7], length 0
2022-04-05 06:27:17.014558 IP (tos 0x0, ttl 64, id 0, offset 0, flags [DF], proto TCP (6), length 60)
    127.0.0.1.12250 > 127.0.0.1.45496: Flags [S.], cksum 0xfe30 (incorrect -> 0x5adf), seq 2354324421, ack 1059050441, win 65483, options [mss 65495,sackOK,TS val 777681386 ecr 777681386,nop,wscale 7], length 0
2022-04-05 06:27:17.014569 IP (tos 0x0, ttl 64, id 52949, offset 0, flags [DF], proto TCP (6), length 52)
    127.0.0.1.45496 > 127.0.0.1.12250: Flags [.], cksum 0xfe28 (incorrect -> 0x819b), seq 1, ack 1, win 512, options [nop,nop,TS val 777681386 ecr 777681386], length 0
2022-04-05 06:27:17.014757 IP (tos 0x0, ttl 64, id 52950, offset 0, flags [DF], proto TCP (6), length 55)
    127.0.0.1.45496 > 127.0.0.1.12250: Flags [P.], cksum 0xfe2b (incorrect -> 0x7c8f), seq 1:4, ack 1, win 512, options [nop,nop,TS val 777681386 ecr 777681386], length 3
2022-04-05 06:27:17.014765 IP (tos 0x0, ttl 64, id 15033, offset 0, flags [DF], proto TCP (6), length 52)
    127.0.0.1.12250 > 127.0.0.1.45496: Flags [.], cksum 0xfe28 (incorrect -> 0x8198), seq 1, ack 4, win 512, options [nop,nop,TS val 777681386 ecr 777681386], length 0
2022-04-05 06:27:17.014792 IP (tos 0x0, ttl 64, id 15034, offset 0, flags [DF], proto TCP (6), length 54)
    127.0.0.1.12250 > 127.0.0.1.45496: Flags [P.], cksum 0xfe2a (incorrect -> 0x7c8e), seq 1:3, ack 4, win 512, options [nop,nop,TS val 777681386 ecr 777681386], length 2
2022-04-05 06:27:17.014801 IP (tos 0x0, ttl 64, id 52951, offset 0, flags [DF], proto TCP (6), length 52)
    127.0.0.1.45496 > 127.0.0.1.12250: Flags [.], cksum 0xfe28 (incorrect -> 0x8196), seq 4, ack 3, win 512, options [nop,nop,TS val 777681386 ecr 777681386], length 0
2022-04-05 06:27:17.046567 IP (tos 0x0, ttl 64, id 52952, offset 0, flags [DF], proto TCP (6), length 62)
    127.0.0.1.45496 > 127.0.0.1.12250: Flags [P.], cksum 0xfe32 (incorrect -> 0x0f06), seq 4:14, ack 3, win 512, options [nop,nop,TS val 777681418 ecr 777681386], length 10
2022-04-05 06:27:17.046587 IP (tos 0x0, ttl 64, id 15035, offset 0, flags [DF], proto TCP (6), length 52)
    127.0.0.1.12250 > 127.0.0.1.45496: Flags [.], cksum 0xfe28 (incorrect -> 0x814c), seq 3, ack 14, win 512, options [nop,nop,TS val 777681418 ecr 777681418], length 0
2022-04-05 06:27:17.125760 IP (tos 0x0, ttl 64, id 15036, offset 0, flags [DF], proto TCP (6), length 62)
    127.0.0.1.12250 > 127.0.0.1.45496: Flags [P.], cksum 0xfe32 (incorrect -> 0x7bea), seq 3:13, ack 14, win 512, options [nop,nop,TS val 777681497 ecr 777681418], length 10
2022-04-05 06:27:17.125776 IP (tos 0x0, ttl 64, id 52953, offset 0, flags [DF], proto TCP (6), length 52)
    127.0.0.1.45496 > 127.0.0.1.12250: Flags [.], cksum 0xfe28 (incorrect -> 0x80a4), seq 14, ack 13, win 512, options [nop,nop,TS val 777681497 ecr 777681497], length 0
2022-04-05 06:27:17.131951 IP (tos 0x0, ttl 64, id 52954, offset 0, flags [DF], proto TCP (6), length 569)
    127.0.0.1.45496 > 127.0.0.1.12250: Flags [P.], cksum 0x002e (incorrect -> 0x748c), seq 14:531, ack 13, win 512, options [nop,nop,TS val 777681503 ecr 777681497], length 517
2022-04-05 06:27:17.131961 IP (tos 0x0, ttl 64, id 15037, offset 0, flags [DF], proto TCP (6), length 52)
    127.0.0.1.12250 > 127.0.0.1.45496: Flags [.], cksum 0xfe28 (incorrect -> 0x7e97), seq 13, ack 531, win 508, options [nop,nop,TS val 777681503 ecr 777681503], length 0
200, 4.722553491592407, 0.6553709506988525