2022-04-05 00:21:28.898291 IP (tos 0x0, ttl 64, id 20695, offset 0, flags [DF], proto TCP (6), length 60)
    127.0.0.1.51542 > 127.0.0.1.11150: Flags [S], cksum 0xfe30 (incorrect -> 0x0337), seq 1393640628, win 65495, options [mss 65495,sackOK,TS val 755733269 ecr 0,nop,wscale 7], length 0
2022-04-05 00:21:28.898303 IP (tos 0x0, ttl 64, id 0, offset 0, flags [DF], proto TCP (6), length 60)
    127.0.0.1.11150 > 127.0.0.1.51542: Flags [S.], cksum 0xfe30 (incorrect -> 0xd83d), seq 2027024897, ack 1393640629, win 65483, options [mss 65495,sackOK,TS val 755733269 ecr 755733269,nop,wscale 7], length 0
2022-04-05 00:21:28.898314 IP (tos 0x0, ttl 64, id 20696, offset 0, flags [DF], proto TCP (6), length 52)
    127.0.0.1.51542 > 127.0.0.1.11150: Flags [.], cksum 0xfe28 (incorrect -> 0xfef9), seq 1, ack 1, win 512, options [nop,nop,TS val 755733269 ecr 755733269], length 0
2022-04-05 00:21:28.898424 IP (tos 0x0, ttl 64, id 20697, offset 0, flags [DF], proto TCP (6), length 55)
    127.0.0.1.51542 > 127.0.0.1.11150: Flags [P.], cksum 0xfe2b (incorrect -> 0xf9ec), seq 1:4, ack 1, win 512, options [nop,nop,TS val 755733270 ecr 755733269], length 3
2022-04-05 00:21:28.898427 IP (tos 0x0, ttl 64, id 29159, offset 0, flags [DF], proto TCP (6), length 52)
    127.0.0.1.11150 > 127.0.0.1.51542: Flags [.], cksum 0xfe28 (incorrect -> 0xfef4), seq 1, ack 4, win 512, options [nop,nop,TS val 755733270 ecr 755733270], length 0
2022-04-05 00:21:28.898514 IP (tos 0x0, ttl 64, id 29160, offset 0, flags [DF], proto TCP (6), length 54)
    127.0.0.1.11150 > 127.0.0.1.51542: Flags [P.], cksum 0xfe2a (incorrect -> 0xf9ea), seq 1:3, ack 4, win 512, options [nop,nop,TS val 755733270 ecr 755733270], length 2
2022-04-05 00:21:28.898518 IP (tos 0x0, ttl 64, id 20698, offset 0, flags [DF], proto TCP (6), length 52)
    127.0.0.1.51542 > 127.0.0.1.11150: Flags [.], cksum 0xfe28 (incorrect -> 0xfef2), seq 4, ack 3, win 512, options [nop,nop,TS val 755733270 ecr 755733270], length 0
2022-04-05 00:21:28.900026 IP (tos 0x0, ttl 64, id 20699, offset 0, flags [DF], proto TCP (6), length 62)
    127.0.0.1.51542 > 127.0.0.1.11150: Flags [P.], cksum 0xfe32 (incorrect -> 0xb154), seq 4:14, ack 3, win 512, options [nop,nop,TS val 755733271 ecr 755733270], length 10
2022-04-05 00:21:28.900033 IP (tos 0x0, ttl 64, id 29161, offset 0, flags [DF], proto TCP (6), length 52)
    127.0.0.1.11150 > 127.0.0.1.51542: Flags [.], cksum 0xfe28 (incorrect -> 0xfee6), seq 3, ack 14, win 512, options [nop,nop,TS val 755733271 ecr 755733271], length 0
2022-04-05 00:21:29.100894 IP (tos 0x0, ttl 64, id 29162, offset 0, flags [DF], proto TCP (6), length 62)
    127.0.0.1.11150 > 127.0.0.1.51542: Flags [P.], cksum 0xfe32 (incorrect -> 0xf90a), seq 3:13, ack 14, win 512, options [nop,nop,TS val 755733472 ecr 755733271], length 10
2022-04-05 00:21:29.100901 IP (tos 0x0, ttl 64, id 20700, offset 0, flags [DF], proto TCP (6), length 52)
    127.0.0.1.51542 > 127.0.0.1.11150: Flags [.], cksum 0xfe28 (incorrect -> 0xfd4a), seq 14, ack 13, win 512, options [nop,nop,TS val 755733472 ecr 755733472], length 0
2022-04-05 00:21:29.106702 IP (tos 0x0, ttl 64, id 20701, offset 0, flags [DF], proto TCP (6), length 569)
    127.0.0.1.51542 > 127.0.0.1.11150: Flags [P.], cksum 0x002e (incorrect -> 0xb7f5), seq 14:531, ack 13, win 512, options [nop,nop,TS val 755733478 ecr 755733472], length 517
2022-04-05 00:21:29.106724 IP (tos 0x0, ttl 64, id 29163, offset 0, flags [DF], proto TCP (6), length 52)
    127.0.0.1.11150 > 127.0.0.1.51542: Flags [.], cksum 0xfe28 (incorrect -> 0xfb3d), seq 13, ack 531, win 508, options [nop,nop,TS val 755733478 ecr 755733478], length 0
2022-04-05 00:21:29.283855 IP (tos 0x0, ttl 64, id 29164, offset 0, flags [DF], proto TCP (6), length 3340)
    127.0.0.1.11150 > 127.0.0.1.51542: Flags [P.], cksum 0x0b01 (incorrect -> 0x8ce1), seq 13:3301, ack 531, win 512, options [nop,nop,TS val 755733655 ecr 755733478], length 3288
2022-04-05 00:21:29.283859 IP (tos 0x0, ttl 64, id 20702, offset 0, flags [DF], proto TCP (6), length 52)
    127.0.0.1.51542 > 127.0.0.1.11150: Flags [.], cksum 0xfe28 (incorrect -> 0xed10), seq 531, ack 3301, win 495, options [nop,nop,TS val 755733655 ecr 755733655], length 0
2022-04-05 00:21:29.284299 IP (tos 0x0, ttl 64, id 20703, offset 0, flags [DF], proto TCP (6), length 145)
    127.0.0.1.51542 > 127.0.0.1.11150: Flags [P.], cksum 0xfe85 (incorrect -> 0xf96b), seq 531:624, ack 3301, win 512, options [nop,nop,TS val 755733655 ecr 755733655], length 93
2022-04-05 00:21:29.284305 IP (tos 0x0, ttl 64, id 29165, offset 0, flags [DF], proto TCP (6), length 52)
    127.0.0.1.11150 > 127.0.0.1.51542: Flags [.], cksum 0xfe28 (incorrect -> 0xeca2), seq 3301, ack 624, win 512, options [nop,nop,TS val 755733655 ecr 755733655], length 0
2022-04-05 00:21:29.444232 IP (tos 0x0, ttl 64, id 29166, offset 0, flags [DF], proto TCP (6), length 103)
    127.0.0.1.11150 > 127.0.0.1.51542: Flags [P.], cksum 0xfe5b (incorrect -> 0xea68), seq 3301:3352, ack 624, win 512, options [nop,nop,TS val 755733815 ecr 755733655], length 51
2022-04-05 00:21:29.444238 IP (tos 0x0, ttl 64, id 20704, offset 0, flags [DF], proto TCP (6), length 52)
    127.0.0.1.51542 > 127.0.0.1.11150: Flags [.], cksum 0xfe28 (incorrect -> 0xeb2f), seq 624, ack 3352, win 512, options [nop,nop,TS val 755733815 ecr 755733815], length 0
2022-04-05 00:21:29.444593 IP (tos 0x0, ttl 64, id 20705, offset 0, flags [DF], proto TCP (6), length 444)
    127.0.0.1.51542 > 127.0.0.1.11150: Flags [P.], cksum 0xffb0 (incorrect -> 0xc263), seq 624:1016, ack 3352, win 512, options [nop,nop,TS val 755733816 ecr 755733815], length 392
2022-04-05 00:21:29.444600 IP (tos 0x0, ttl 64, id 29167, offset 0, flags [DF], proto TCP (6), length 52)
    127.0.0.1.11150 > 127.0.0.1.51542: Flags [.], cksum 0xfe28 (incorrect -> 0xe9a8), seq 3352, ack 1016, win 509, options [nop,nop,TS val 755733816 ecr 755733816], length 0
2022-04-05 00:21:29.786463 IP (tos 0x0, ttl 64, id 29168, offset 0, flags [DF], proto TCP (6), length 3538)
    127.0.0.1.11150 > 127.0.0.1.51542: Flags [P.], cksum 0x0bc7 (incorrect -> 0x1291), seq 3352:6838, ack 1016, win 512, options [nop,nop,TS val 755734158 ecr 755733816], length 3486
2022-04-05 00:21:29.829386 IP (tos 0x0, ttl 64, id 20706, offset 0, flags [DF], proto TCP (6), length 52)
    127.0.0.1.51542 > 127.0.0.1.11150: Flags [.], cksum 0xfe28 (incorrect -> 0xd931), seq 1016, ack 6838, win 512, options [nop,nop,TS val 755734200 ecr 755734158], length 0
2022-04-05 00:21:29.829397 IP (tos 0x0, ttl 64, id 29169, offset 0, flags [DF], proto TCP (6), length 13942)
    127.0.0.1.11150 > 127.0.0.1.51542: Flags [P.], cksum 0x346b (incorrect -> 0x3579), seq 6838:20728, ack 1016, win 512, options [nop,nop,TS val 755734200 ecr 755734200], length 13890
2022-04-05 00:21:29.829401 IP (tos 0x0, ttl 64, id 20707, offset 0, flags [DF], proto TCP (6), length 52)
    127.0.0.1.51542 > 127.0.0.1.11150: Flags [.], cksum 0xfe28 (incorrect -> 0xa2ff), seq 1016, ack 20728, win 453, options [nop,nop,TS val 755734201 ecr 755734200], length 0
2022-04-05 00:21:29.879707 IP (tos 0x0, ttl 64, id 29170, offset 0, flags [DF], proto TCP (6), length 4100)
    127.0.0.1.11150 > 127.0.0.1.51542: Flags [P.], cksum 0x0df9 (incorrect -> 0xe133), seq 20728:24776, ack 1016, win 512, options [nop,nop,TS val 755734251 ecr 755734201], length 4048
2022-04-05 00:21:29.879713 IP (tos 0x0, ttl 64, id 20708, offset 0, flags [DF], proto TCP (6), length 52)
    127.0.0.1.51542 > 127.0.0.1.11150: Flags [.], cksum 0xfe28 (incorrect -> 0x92a3), seq 1016, ack 24776, win 492, options [nop,nop,TS val 755734251 ecr 755734251], length 0
2022-04-05 00:21:29.879752 IP (tos 0x0, ttl 64, id 29171, offset 0, flags [DF], proto TCP (6), length 2976)
    127.0.0.1.11150 > 127.0.0.1.51542: Flags [P.], cksum 0x0995 (incorrect -> 0xca59), seq 24776:27700, ack 1016, win 512, options [nop,nop,TS val 755734251 ecr 755734251], length 2924
2022-04-05 00:21:29.879755 IP (tos 0x0, ttl 64, id 20709, offset 0, flags [DF], proto TCP (6), length 52)
    127.0.0.1.51542 > 127.0.0.1.11150: Flags [.], cksum 0xfe28 (incorrect -> 0x8733), seq 1016, ack 27700, win 496, options [nop,nop,TS val 755734251 ecr 755734251], length 0
2022-04-05 00:21:29.879801 IP (tos 0x0, ttl 64, id 29172, offset 0, flags [DF], proto TCP (6), length 4036)
    127.0.0.1.11150 > 127.0.0.1.51542: Flags [P.], cksum 0x0db9 (incorrect -> 0xf926), seq 27700:31684, ack 1016, win 512, options [nop,nop,TS val 755734251 ecr 755734251], length 3984
2022-04-05 00:21:29.879804 IP (tos 0x0, ttl 64, id 20710, offset 0, flags [DF], proto TCP (6), length 52)
    127.0.0.1.51542 > 127.0.0.1.11150: Flags [.], cksum 0xfe28 (incorrect -> 0x77a7), seq 1016, ack 31684, win 492, options [nop,nop,TS val 755734251 ecr 755734251], length 0
2022-04-05 00:21:29.883279 IP (tos 0x0, ttl 64, id 29173, offset 0, flags [DF], proto TCP (6), length 2044)
    127.0.0.1.11150 > 127.0.0.1.51542: Flags [P.], cksum 0x05f1 (incorrect -> 0x6057), seq 31684:33676, ack 1016, win 512, options [nop,nop,TS val 755734254 ecr 755734251], length 1992
2022-04-05 00:21:29.883283 IP (tos 0x0, ttl 64, id 20711, offset 0, flags [DF], proto TCP (6), length 52)
    127.0.0.1.51542 > 127.0.0.1.11150: Flags [.], cksum 0xfe28 (incorrect -> 0x6fd1), seq 1016, ack 33676, win 500, options [nop,nop,TS val 755734254 ecr 755734254], length 0
2022-04-05 00:21:29.883366 IP (tos 0x0, ttl 64, id 29174, offset 0, flags [DF], proto TCP (6), length 4100)
    127.0.0.1.11150 > 127.0.0.1.51542: Flags [P.], cksum 0x0df9 (incorrect -> 0x6b72), seq 33676:37724, ack 1016, win 512, options [nop,nop,TS val 755734254 ecr 755734254], length 4048
2022-04-05 00:21:29.883370 IP (tos 0x0, ttl 64, id 20712, offset 0, flags [DF], proto TCP (6), length 52)
    127.0.0.1.51542 > 127.0.0.1.11150: Flags [.], cksum 0xfe28 (incorrect -> 0x6009), seq 1016, ack 37724, win 492, options [nop,nop,TS val 755734254 ecr 755734254], length 0
2022-04-05 00:21:29.883447 IP (tos 0x0, ttl 64, id 29175, offset 0, flags [DF], proto TCP (6), length 3474)
    127.0.0.1.11150 > 127.0.0.1.51542: Flags [P.], cksum 0x0b87 (incorrect -> 0x86de), seq 37724:41146, ack 1016, win 512, options [nop,nop,TS val 755734255 ecr 755734254], length 3422
2022-04-05 00:21:29.883450 IP (tos 0x0, ttl 64, id 20713, offset 0, flags [DF], proto TCP (6), length 52)
    127.0.0.1.51542 > 127.0.0.1.11150: Flags [.], cksum 0xfe28 (incorrect -> 0x52a7), seq 1016, ack 41146, win 494, options [nop,nop,TS val 755734255 ecr 755734255], length 0
2022-04-05 00:21:29.884759 IP (tos 0x0, ttl 64, id 29176, offset 0, flags [DF], proto TCP (6), length 1546)
    127.0.0.1.11150 > 127.0.0.1.51542: Flags [P.], cksum 0x03ff (incorrect -> 0x7a96), seq 41146:42640, ack 1016, win 512, options [nop,nop,TS val 755734256 ecr 755734255], length 1494
2022-04-05 00:21:29.884764 IP (tos 0x0, ttl 64, id 20714, offset 0, flags [DF], proto TCP (6), length 52)
    127.0.0.1.51542 > 127.0.0.1.11150: Flags [.], cksum 0xfe28 (incorrect -> 0x4cc7), seq 1016, ack 42640, win 502, options [nop,nop,TS val 755734256 ecr 755734256], length 0
2022-04-05 00:21:29.886834 IP (tos 0x0, ttl 64, id 29177, offset 0, flags [DF], proto TCP (6), length 3538)
    127.0.0.1.11150 > 127.0.0.1.51542: Flags [P.], cksum 0x0bc7 (incorrect -> 0xc135), seq 42640:46126, ack 1016, win 512, options [nop,nop,TS val 755734258 ecr 755734256], length 3486
2022-04-05 00:21:29.886848 IP (tos 0x0, ttl 64, id 20715, offset 0, flags [DF], proto TCP (6), length 52)
    127.0.0.1.51542 > 127.0.0.1.11150: Flags [.], cksum 0xfe28 (incorrect -> 0x3f1b), seq 1016, ack 46126, win 512, options [nop,nop,TS val 755734258 ecr 755734258], length 0
2022-04-05 00:21:29.891062 IP (tos 0x0, ttl 64, id 29178, offset 0, flags [DF], proto TCP (6), length 3040)
    127.0.0.1.11150 > 127.0.0.1.51542: Flags [P.], cksum 0x09d5 (incorrect -> 0xfaeb), seq 46126:49114, ack 1016, win 512, options [nop,nop,TS val 755734262 ecr 755734258], length 2988
2022-04-05 00:21:29.891072 IP (tos 0x0, ttl 64, id 20716, offset 0, flags [DF], proto TCP (6), length 52)
    127.0.0.1.51542 > 127.0.0.1.11150: Flags [.], cksum 0xfe28 (incorrect -> 0x3367), seq 1016, ack 49114, win 512, options [nop,nop,TS val 755734262 ecr 755734262], length 0
2022-04-05 00:21:29.912093 IP (tos 0x0, ttl 64, id 29179, offset 0, flags [DF], proto TCP (6), length 3522)
    127.0.0.1.11150 > 127.0.0.1.51542: Flags [P.], cksum 0x0bb7 (incorrect -> 0xe0a0), seq 49114:52584, ack 1016, win 512, options [nop,nop,TS val 755734283 ecr 755734262], length 3470
2022-04-05 00:21:29.912102 IP (tos 0x0, ttl 64, id 20717, offset 0, flags [DF], proto TCP (6), length 52)
    127.0.0.1.51542 > 127.0.0.1.11150: Flags [.], cksum 0xfe28 (incorrect -> 0x25af), seq 1016, ack 52584, win 512, options [nop,nop,TS val 755734283 ecr 755734283], length 0
2022-04-05 00:21:29.939472 IP (tos 0x0, ttl 64, id 29180, offset 0, flags [DF], proto TCP (6), length 2948)
    127.0.0.1.11150 > 127.0.0.1.51542: Flags [P.], cksum 0x0979 (incorrect -> 0x4c46), seq 52584:55480, ack 1016, win 512, options [nop,nop,TS val 755734311 ecr 755734283], length 2896
2022-04-05 00:21:29.939527 IP (tos 0x0, ttl 64, id 20718, offset 0, flags [DF], proto TCP (6), length 52)
    127.0.0.1.51542 > 127.0.0.1.11150: Flags [.], cksum 0xfe28 (incorrect -> 0x1a27), seq 1016, ack 55480, win 512, options [nop,nop,TS val 755734311 ecr 755734311], length 0
2022-04-05 00:21:29.990741 IP (tos 0x0, ttl 64, id 29181, offset 0, flags [DF], proto TCP (6), length 3538)
    127.0.0.1.11150 > 127.0.0.1.51542: Flags [P.], cksum 0x0bc7 (incorrect -> 0x8e29), seq 55480:58966, ack 1016, win 512, options [nop,nop,TS val 755734362 ecr 755734311], length 3486
2022-04-05 00:21:29.990752 IP (tos 0x0, ttl 64, id 20719, offset 0, flags [DF], proto TCP (6), length 52)
    127.0.0.1.51542 > 127.0.0.1.11150: Flags [.], cksum 0xfe28 (incorrect -> 0x0c23), seq 1016, ack 58966, win 512, options [nop,nop,TS val 755734362 ecr 755734362], length 0
2022-04-05 00:21:29.993054 IP (tos 0x0, ttl 64, id 29182, offset 0, flags [DF], proto TCP (6), length 4100)
    127.0.0.1.11150 > 127.0.0.1.51542: Flags [P.], cksum 0x0df9 (incorrect -> 0xb54b), seq 58966:63014, ack 1016, win 512, options [nop,nop,TS val 755734364 ecr 755734362], length 4048
2022-04-05 00:21:29.993062 IP (tos 0x0, ttl 64, id 20720, offset 0, flags [DF], proto TCP (6), length 52)
    127.0.0.1.51542 > 127.0.0.1.11150: Flags [.], cksum 0xfe28 (incorrect -> 0xfc4e), seq 1016, ack 63014, win 512, options [nop,nop,TS val 755734364 ecr 755734364], length 0
2022-04-05 00:21:29.993071 IP (tos 0x0, ttl 64, id 29183, offset 0, flags [DF], proto TCP (6), length 3474)
    127.0.0.1.11150 > 127.0.0.1.51542: Flags [P.], cksum 0x0b87 (incorrect -> 0x188b), seq 63014:66436, ack 1016, win 512, options [nop,nop,TS val 755734364 ecr 755734364], length 3422
2022-04-05 00:21:29.993077 IP (tos 0x0, ttl 64, id 20721, offset 0, flags [DF], proto TCP (6), length 52)
    127.0.0.1.51542 > 127.0.0.1.11150: Flags [.], cksum 0xfe28 (incorrect -> 0xeef0), seq 1016, ack 66436, win 512, options [nop,nop,TS val 755734364 ecr 755734364], length 0
2022-04-05 00:21:29.996188 IP (tos 0x0, ttl 64, id 29184, offset 0, flags [DF], proto TCP (6), length 4100)
    127.0.0.1.11150 > 127.0.0.1.51542: Flags [P.], cksum 0x0df9 (incorrect -> 0x1c22), seq 66436:70484, ack 1016, win 512, options [nop,nop,TS val 755734367 ecr 755734364], length 4048
2022-04-05 00:21:29.996251 IP (tos 0x0, ttl 64, id 20722, offset 0, flags [DF], proto TCP (6), length 52)
    127.0.0.1.51542 > 127.0.0.1.11150: Flags [.], cksum 0xfe28 (incorrect -> 0xdf1a), seq 1016, ack 70484, win 512, options [nop,nop,TS val 755734367 ecr 755734367], length 0
2022-04-05 00:21:29.996261 IP (tos 0x0, ttl 64, id 29185, offset 0, flags [DF], proto TCP (6), length 1482)
    127.0.0.1.11150 > 127.0.0.1.51542: Flags [P.], cksum 0x03bf (incorrect -> 0x3631), seq 70484:71914, ack 1016, win 512, options [nop,nop,TS val 755734367 ecr 755734367], length 1430
2022-04-05 00:21:29.996267 IP (tos 0x0, ttl 64, id 20723, offset 0, flags [DF], proto TCP (6), length 52)
    127.0.0.1.51542 > 127.0.0.1.11150: Flags [.], cksum 0xfe28 (incorrect -> 0xd984), seq 1016, ack 71914, win 512, options [nop,nop,TS val 755734367 ecr 755734367], length 0
2022-04-05 00:21:29.996333 IP (tos 0x0, ttl 64, id 29186, offset 0, flags [DF], proto TCP (6), length 4036)
    127.0.0.1.11150 > 127.0.0.1.51542: Flags [P.], cksum 0x0db9 (incorrect -> 0xb422), seq 71914:75898, ack 1016, win 512, options [nop,nop,TS val 755734367 ecr 755734367], length 3984
2022-04-05 00:21:29.996345 IP (tos 0x0, ttl 64, id 20724, offset 0, flags [DF], proto TCP (6), length 52)
    127.0.0.1.51542 > 127.0.0.1.11150: Flags [.], cksum 0xfe28 (incorrect -> 0xc9f4), seq 1016, ack 75898, win 512, options [nop,nop,TS val 755734367 ecr 755734367], length 0
2022-04-05 00:21:29.998912 IP (tos 0x0, ttl 64, id 29187, offset 0, flags [DF], proto TCP (6), length 4100)
    127.0.0.1.11150 > 127.0.0.1.51542: Flags [P.], cksum 0x0df9 (incorrect -> 0xa1d8), seq 75898:79946, ack 1016, win 512, options [nop,nop,TS val 755734370 ecr 755734367], length 4048
2022-04-05 00:21:29.998925 IP (tos 0x0, ttl 64, id 20725, offset 0, flags [DF], proto TCP (6), length 52)
    127.0.0.1.51542 > 127.0.0.1.11150: Flags [.], cksum 0xfe28 (incorrect -> 0xba1e), seq 1016, ack 79946, win 512, options [nop,nop,TS val 755734370 ecr 755734370], length 0
2022-04-05 00:21:29.998933 IP (tos 0x0, ttl 64, id 29188, offset 0, flags [DF], proto TCP (6), length 486)
    127.0.0.1.11150 > 127.0.0.1.51542: Flags [P.], cksum 0xffda (incorrect -> 0x9237), seq 79946:80380, ack 1016, win 512, options [nop,nop,TS val 755734370 ecr 755734370], length 434
2022-04-05 00:21:29.998938 IP (tos 0x0, ttl 64, id 20726, offset 0, flags [DF], proto TCP (6), length 52)
    127.0.0.1.51542 > 127.0.0.1.11150: Flags [.], cksum 0xfe28 (incorrect -> 0xb86c), seq 1016, ack 80380, win 512, options [nop,nop,TS val 755734370 ecr 755734370], length 0
2022-04-05 00:21:29.998983 IP (tos 0x0, ttl 64, id 29189, offset 0, flags [DF], proto TCP (6), length 4100)
    127.0.0.1.11150 > 127.0.0.1.51542: Flags [P.], cksum 0x0df9 (incorrect -> 0x024a), seq 80380:84428, ack 1016, win 512, options [nop,nop,TS val 755734370 ecr 755734370], length 4048
2022-04-05 00:21:29.998990 IP (tos 0x0, ttl 64, id 20727, offset 0, flags [DF], proto TCP (6), length 52)
    127.0.0.1.51542 > 127.0.0.1.11150: Flags [.], cksum 0xfe28 (incorrect -> 0xa89c), seq 1016, ack 84428, win 512, options [nop,nop,TS val 755734370 ecr 755734370], length 0
2022-04-05 00:21:29.998998 IP (tos 0x0, ttl 64, id 29190, offset 0, flags [DF], proto TCP (6), length 3474)
    127.0.0.1.11150 > 127.0.0.1.51542: Flags [P.], cksum 0x0b87 (incorrect -> 0x470e), seq 84428:87850, ack 1016, win 512, options [nop,nop,TS val 755734370 ecr 755734370], length 3422
2022-04-05 00:21:29.999046 IP (tos 0x0, ttl 64, id 20728, offset 0, flags [DF], proto TCP (6), length 52)
    127.0.0.1.51542 > 127.0.0.1.11150: Flags [.], cksum 0xfe28 (incorrect -> 0x9b3e), seq 1016, ack 87850, win 512, options [nop,nop,TS val 755734370 ecr 755734370], length 0
2022-04-05 00:21:29.999155 IP (tos 0x0, ttl 64, id 29191, offset 0, flags [DF], proto TCP (6), length 4036)
    127.0.0.1.11150 > 127.0.0.1.51542: Flags [P.], cksum 0x0db9 (incorrect -> 0x63b6), seq 87850:91834, ack 1016, win 512, options [nop,nop,TS val 755734370 ecr 755734370], length 3984
2022-04-05 00:21:29.999164 IP (tos 0x0, ttl 64, id 20729, offset 0, flags [DF], proto TCP (6), length 52)
    127.0.0.1.51542 > 127.0.0.1.11150: Flags [.], cksum 0xfe28 (incorrect -> 0x8bae), seq 1016, ack 91834, win 512, options [nop,nop,TS val 755734370 ecr 755734370], length 0
2022-04-05 00:21:30.001275 IP (tos 0x0, ttl 64, id 29192, offset 0, flags [DF], proto TCP (6), length 4100)
    127.0.0.1.11150 > 127.0.0.1.51542: Flags [P.], cksum 0x0df9 (incorrect -> 0x1fe3), seq 91834:95882, ack 1016, win 512, options [nop,nop,TS val 755734372 ecr 755734370], length 4048
2022-04-05 00:21:30.001286 IP (tos 0x0, ttl 64, id 20730, offset 0, flags [DF], proto TCP (6), length 52)
    127.0.0.1.51542 > 127.0.0.1.11150: Flags [.], cksum 0xfe28 (incorrect -> 0x7bda), seq 1016, ack 95882, win 512, options [nop,nop,TS val 755734372 ecr 755734372], length 0
2022-04-05 00:21:30.001295 IP (tos 0x0, ttl 64, id 29193, offset 0, flags [DF], proto TCP (6), length 486)
    127.0.0.1.11150 > 127.0.0.1.51542: Flags [P.], cksum 0xffda (incorrect -> 0x1646), seq 95882:96316, ack 1016, win 512, options [nop,nop,TS val 755734372 ecr 755734372], length 434
2022-04-05 00:21:30.001300 IP (tos 0x0, ttl 64, id 20731, offset 0, flags [DF], proto TCP (6), length 52)
    127.0.0.1.51542 > 127.0.0.1.11150: Flags [.], cksum 0xfe28 (incorrect -> 0x7a28), seq 1016, ack 96316, win 512, options [nop,nop,TS val 755734372 ecr 755734372], length 0
2022-04-05 00:21:30.001417 IP (tos 0x0, ttl 64, id 29194, offset 0, flags [DF], proto TCP (6), length 4100)
    127.0.0.1.11150 > 127.0.0.1.51542: Flags [P.], cksum 0x0df9 (incorrect -> 0xdfa1), seq 96316:100364, ack 1016, win 512, options [nop,nop,TS val 755734373 ecr 755734372], length 4048
2022-04-05 00:21:30.001428 IP (tos 0x0, ttl 64, id 20732, offset 0, flags [DF], proto TCP (6), length 52)
    127.0.0.1.51542 > 127.0.0.1.11150: Flags [.], cksum 0xfe28 (incorrect -> 0x6a56), seq 1016, ack 100364, win 512, options [nop,nop,TS val 755734373 ecr 755734373], length 0
2022-04-05 00:21:30.001445 IP (tos 0x0, ttl 64, id 29195, offset 0, flags [DF], proto TCP (6), length 3972)
    127.0.0.1.11150 > 127.0.0.1.51542: Flags [P.], cksum 0x0d79 (incorrect -> 0x2985), seq 100364:104284, ack 1016, win 512, options [nop,nop,TS val 755734373 ecr 755734373], length 3920
2022-04-05 00:21:30.001516 IP (tos 0x0, ttl 64, id 20733, offset 0, flags [DF], proto TCP (6), length 52)
    127.0.0.1.51542 > 127.0.0.1.11150: Flags [.], cksum 0xfe28 (incorrect -> 0x5b06), seq 1016, ack 104284, win 512, options [nop,nop,TS val 755734373 ecr 755734373], length 0
2022-04-05 00:21:30.018319 IP (tos 0x0, ttl 64, id 29196, offset 0, flags [DF], proto TCP (6), length 1928)
    127.0.0.1.11150 > 127.0.0.1.51542: Flags [P.], cksum 0x057d (incorrect -> 0x789c), seq 104284:106160, ack 1016, win 512, options [nop,nop,TS val 755734389 ecr 755734373], length 1876
2022-04-05 00:21:30.018344 IP (tos 0x0, ttl 64, id 20734, offset 0, flags [DF], proto TCP (6), length 52)
    127.0.0.1.51542 > 127.0.0.1.11150: Flags [.], cksum 0xfe28 (incorrect -> 0x5392), seq 1016, ack 106160, win 512, options [nop,nop,TS val 755734389 ecr 755734389], length 0
2022-04-05 00:21:30.034145 IP (tos 0x0, ttl 64, id 29197, offset 0, flags [DF], proto TCP (6), length 4100)
    127.0.0.1.11150 > 127.0.0.1.51542: Flags [P.], cksum 0x0df9 (incorrect -> 0x8223), seq 106160:110208, ack 1016, win 512, options [nop,nop,TS val 755734405 ecr 755734389], length 4048
2022-04-05 00:21:30.034163 IP (tos 0x0, ttl 64, id 20735, offset 0, flags [DF], proto TCP (6), length 52)
    127.0.0.1.51542 > 127.0.0.1.11150: Flags [.], cksum 0xfe28 (incorrect -> 0x43a2), seq 1016, ack 110208, win 512, options [nop,nop,TS val 755734405 ecr 755734405], length 0
2022-04-05 00:21:30.034173 IP (tos 0x0, ttl 64, id 29198, offset 0, flags [DF], proto TCP (6), length 3428)
    127.0.0.1.11150 > 127.0.0.1.51542: Flags [P.], cksum 0x0b59 (incorrect -> 0xac1a), seq 110208:113584, ack 1016, win 512, options [nop,nop,TS val 755734405 ecr 755734405], length 3376
2022-04-05 00:21:30.034178 IP (tos 0x0, ttl 64, id 20736, offset 0, flags [DF], proto TCP (6), length 52)
    127.0.0.1.51542 > 127.0.0.1.11150: Flags [.], cksum 0xfe28 (incorrect -> 0x3672), seq 1016, ack 113584, win 512, options [nop,nop,TS val 755734405 ecr 755734405], length 0
2022-04-05 00:21:30.038365 IP (tos 0x0, ttl 64, id 29199, offset 0, flags [DF], proto TCP (6), length 1546)
    127.0.0.1.11150 > 127.0.0.1.51542: Flags [P.], cksum 0x03ff (incorrect -> 0xa4b0), seq 113584:115078, ack 1016, win 512, options [nop,nop,TS val 755734409 ecr 755734405], length 1494
2022-04-05 00:21:30.038379 IP (tos 0x0, ttl 64, id 20737, offset 0, flags [DF], proto TCP (6), length 52)
    127.0.0.1.51542 > 127.0.0.1.11150: Flags [.], cksum 0xfe28 (incorrect -> 0x3094), seq 1016, ack 115078, win 512, options [nop,nop,TS val 755734409 ecr 755734409], length 0
2022-04-05 00:21:30.045444 IP (tos 0x0, ttl 64, id 29200, offset 0, flags [DF], proto TCP (6), length 2718)
    127.0.0.1.11150 > 127.0.0.1.51542: Flags [P.], cksum 0x0893 (incorrect -> 0xdc87), seq 115078:117744, ack 1016, win 512, options [nop,nop,TS val 755734417 ecr 755734409], length 2666
2022-04-05 00:21:30.045462 IP (tos 0x0, ttl 64, id 20738, offset 0, flags [DF], proto TCP (6), length 52)
    127.0.0.1.51542 > 127.0.0.1.11150: Flags [.], cksum 0xfe28 (incorrect -> 0x261a), seq 1016, ack 117744, win 512, options [nop,nop,TS val 755734417 ecr 755734417], length 0
2022-04-05 00:21:30.100805 IP (tos 0x0, ttl 64, id 29201, offset 0, flags [DF], proto TCP (6), length 3538)
    127.0.0.1.11150 > 127.0.0.1.51542: Flags [P.], cksum 0x0bc7 (incorrect -> 0x959a), seq 117744:121230, ack 1016, win 512, options [nop,nop,TS val 755734472 ecr 755734417], length 3486
2022-04-05 00:21:30.101034 IP (tos 0x0, ttl 64, id 20739, offset 0, flags [DF], proto TCP (6), length 52)
    127.0.0.1.51542 > 127.0.0.1.11150: Flags [.], cksum 0xfe28 (incorrect -> 0x180e), seq 1016, ack 121230, win 512, options [nop,nop,TS val 755734472 ecr 755734472], length 0
2022-04-05 00:21:30.101130 IP (tos 0x0, ttl 64, id 29202, offset 0, flags [DF], proto TCP (6), length 4036)
    127.0.0.1.11150 > 127.0.0.1.51542: Flags [P.], cksum 0x0db9 (incorrect -> 0x6549), seq 121230:125214, ack 1016, win 512, options [nop,nop,TS val 755734472 ecr 755734472], length 3984
2022-04-05 00:21:30.101145 IP (tos 0x0, ttl 64, id 20740, offset 0, flags [DF], proto TCP (6), length 52)
    127.0.0.1.51542 > 127.0.0.1.11150: Flags [.], cksum 0xfe28 (incorrect -> 0x087e), seq 1016, ack 125214, win 512, options [nop,nop,TS val 755734472 ecr 755734472], length 0
2022-04-05 00:21:30.103575 IP (tos 0x0, ttl 64, id 29203, offset 0, flags [DF], proto TCP (6), length 4100)
    127.0.0.1.11150 > 127.0.0.1.51542: Flags [P.], cksum 0x0df9 (incorrect -> 0xb866), seq 125214:129262, ack 1016, win 512, options [nop,nop,TS val 755734475 ecr 755734472], length 4048
2022-04-05 00:21:30.103590 IP (tos 0x0, ttl 64, id 20741, offset 0, flags [DF], proto TCP (6), length 52)
    127.0.0.1.51542 > 127.0.0.1.11150: Flags [.], cksum 0xfe28 (incorrect -> 0xf8a7), seq 1016, ack 129262, win 512, options [nop,nop,TS val 755734475 ecr 755734475], length 0
2022-04-05 00:21:30.103598 IP (tos 0x0, ttl 64, id 29204, offset 0, flags [DF], proto TCP (6), length 486)
    127.0.0.1.11150 > 127.0.0.1.51542: Flags [P.], cksum 0xffda (incorrect -> 0xd091), seq 129262:129696, ack 1016, win 512, options [nop,nop,TS val 755734475 ecr 755734475], length 434
2022-04-05 00:21:30.103604 IP (tos 0x0, ttl 64, id 20742, offset 0, flags [DF], proto TCP (6), length 52)
    127.0.0.1.51542 > 127.0.0.1.11150: Flags [.], cksum 0xfe28 (incorrect -> 0xf6f5), seq 1016, ack 129696, win 512, options [nop,nop,TS val 755734475 ecr 755734475], length 0
2022-04-05 00:21:30.111020 IP (tos 0x0, ttl 64, id 29205, offset 0, flags [DF], proto TCP (6), length 4036)
    127.0.0.1.11150 > 127.0.0.1.51542: Flags [P.], cksum 0x0db9 (incorrect -> 0xc84e), seq 129696:133680, ack 1016, win 512, options [nop,nop,TS val 755734482 ecr 755734475], length 3984
2022-04-05 00:21:30.111033 IP (tos 0x0, ttl 64, id 20743, offset 0, flags [DF], proto TCP (6), length 52)
    127.0.0.1.51542 > 127.0.0.1.11150: Flags [.], cksum 0xfe28 (incorrect -> 0xe757), seq 1016, ack 133680, win 512, options [nop,nop,TS val 755734482 ecr 755734482], length 0
2022-04-05 00:21:30.111068 IP (tos 0x0, ttl 64, id 29206, offset 0, flags [DF], proto TCP (6), length 3538)
    127.0.0.1.11150 > 127.0.0.1.51542: Flags [P.], cksum 0x0bc7 (incorrect -> 0xb717), seq 133680:137166, ack 1016, win 512, options [nop,nop,TS val 755734482 ecr 755734482], length 3486
2022-04-05 00:21:30.111136 IP (tos 0x0, ttl 64, id 20744, offset 0, flags [DF], proto TCP (6), length 52)
    127.0.0.1.51542 > 127.0.0.1.11150: Flags [.], cksum 0xfe28 (incorrect -> 0xd9b9), seq 1016, ack 137166, win 512, options [nop,nop,TS val 755734482 ecr 755734482], length 0
2022-04-05 00:21:30.115411 IP (tos 0x0, ttl 64, id 29207, offset 0, flags [DF], proto TCP (6), length 4100)
    127.0.0.1.11150 > 127.0.0.1.51542: Flags [P.], cksum 0x0df9 (incorrect -> 0x0b10), seq 137166:141214, ack 1016, win 512, options [nop,nop,TS val 755734487 ecr 755734482], length 4048
2022-04-05 00:21:30.115422 IP (tos 0x0, ttl 64, id 20745, offset 0, flags [DF], proto TCP (6), length 52)
    127.0.0.1.51542 > 127.0.0.1.11150: Flags [.], cksum 0xfe28 (incorrect -> 0xc9df), seq 1016, ack 141214, win 512, options [nop,nop,TS val 755734487 ecr 755734487], length 0
2022-04-05 00:21:30.115430 IP (tos 0x0, ttl 64, id 29208, offset 0, flags [DF], proto TCP (6), length 486)
    127.0.0.1.11150 > 127.0.0.1.51542: Flags [P.], cksum 0xffda (incorrect -> 0x1aad), seq 141214:141648, ack 1016, win 512, options [nop,nop,TS val 755734487 ecr 755734487], length 434
2022-04-05 00:21:30.115435 IP (tos 0x0, ttl 64, id 20746, offset 0, flags [DF], proto TCP (6), length 52)
    127.0.0.1.51542 > 127.0.0.1.11150: Flags [.], cksum 0xfe28 (incorrect -> 0xc82d), seq 1016, ack 141648, win 512, options [nop,nop,TS val 755734487 ecr 755734487], length 0
2022-04-05 00:21:30.115486 IP (tos 0x0, ttl 64, id 29209, offset 0, flags [DF], proto TCP (6), length 4100)
    127.0.0.1.11150 > 127.0.0.1.51542: Flags [P.], cksum 0x0df9 (incorrect -> 0x1fcc), seq 141648:145696, ack 1016, win 512, options [nop,nop,TS val 755734487 ecr 755734487], length 4048
2022-04-05 00:21:30.115493 IP (tos 0x0, ttl 64, id 20747, offset 0, flags [DF], proto TCP (6), length 52)
    127.0.0.1.51542 > 127.0.0.1.11150: Flags [.], cksum 0xfe28 (incorrect -> 0xb85d), seq 1016, ack 145696, win 512, options [nop,nop,TS val 755734487 ecr 755734487], length 0
2022-04-05 00:21:30.115501 IP (tos 0x0, ttl 64, id 29210, offset 0, flags [DF], proto TCP (6), length 3474)
    127.0.0.1.11150 > 127.0.0.1.51542: Flags [P.], cksum 0x0b87 (incorrect -> 0x6f77), seq 145696:149118, ack 1016, win 512, options [nop,nop,TS val 755734487 ecr 755734487], length 3422
2022-04-05 00:21:30.115506 IP (tos 0x0, ttl 64, id 20748, offset 0, flags [DF], proto TCP (6), length 52)
    127.0.0.1.51542 > 127.0.0.1.11150: Flags [.], cksum 0xfe28 (incorrect -> 0xaaff), seq 1016, ack 149118, win 512, options [nop,nop,TS val 755734487 ecr 755734487], length 0
2022-04-05 00:21:30.115555 IP (tos 0x0, ttl 64, id 29211, offset 0, flags [DF], proto TCP (6), length 4036)
    127.0.0.1.11150 > 127.0.0.1.51542: Flags [P.], cksum 0x0db9 (incorrect -> 0x457b), seq 149118:153102, ack 1016, win 512, options [nop,nop,TS val 755734487 ecr 755734487], length 3984
2022-04-05 00:21:30.115619 IP (tos 0x0, ttl 64, id 20749, offset 0, flags [DF], proto TCP (6), length 52)
    127.0.0.1.51542 > 127.0.0.1.11150: Flags [.], cksum 0xfe28 (incorrect -> 0x9b6f), seq 1016, ack 153102, win 512, options [nop,nop,TS val 755734487 ecr 755734487], length 0
2022-04-05 00:21:30.115978 IP (tos 0x0, ttl 64, id 29212, offset 0, flags [DF], proto TCP (6), length 4100)
    127.0.0.1.11150 > 127.0.0.1.51542: Flags [P.], cksum 0x0df9 (incorrect -> 0x5680), seq 153102:157150, ack 1016, win 512, options [nop,nop,TS val 755734487 ecr 755734487], length 4048
2022-04-05 00:21:30.115992 IP (tos 0x0, ttl 64, id 20750, offset 0, flags [DF], proto TCP (6), length 52)
    127.0.0.1.51542 > 127.0.0.1.11150: Flags [.], cksum 0xfe28 (incorrect -> 0x8b9f), seq 1016, ack 157150, win 512, options [nop,nop,TS val 755734487 ecr 755734487], length 0
2022-04-05 00:21:30.116000 IP (tos 0x0, ttl 64, id 29213, offset 0, flags [DF], proto TCP (6), length 486)
    127.0.0.1.11150 > 127.0.0.1.51542: Flags [P.], cksum 0xffda (incorrect -> 0xcd6d), seq 157150:157584, ack 1016, win 512, options [nop,nop,TS val 755734487 ecr 755734487], length 434
2022-04-05 00:21:30.116005 IP (tos 0x0, ttl 64, id 20751, offset 0, flags [DF], proto TCP (6), length 52)
    127.0.0.1.51542 > 127.0.0.1.11150: Flags [.], cksum 0xfe28 (incorrect -> 0x89ed), seq 1016, ack 157584, win 512, options [nop,nop,TS val 755734487 ecr 755734487], length 0
2022-04-05 00:21:30.116582 IP (tos 0x0, ttl 64, id 29214, offset 0, flags [DF], proto TCP (6), length 4036)
    127.0.0.1.11150 > 127.0.0.1.51542: Flags [P.], cksum 0x0db9 (incorrect -> 0x6c17), seq 157584:161568, ack 1016, win 512, options [nop,nop,TS val 755734488 ecr 755734487], length 3984
2022-04-05 00:21:30.116595 IP (tos 0x0, ttl 64, id 20752, offset 0, flags [DF], proto TCP (6), length 52)
    127.0.0.1.51542 > 127.0.0.1.11150: Flags [.], cksum 0xfe28 (incorrect -> 0x7a5b), seq 1016, ack 161568, win 512, options [nop,nop,TS val 755734488 ecr 755734488], length 0
2022-04-05 00:21:30.117249 IP (tos 0x0, ttl 64, id 29215, offset 0, flags [DF], proto TCP (6), length 4100)
    127.0.0.1.11150 > 127.0.0.1.51542: Flags [P.], cksum 0x0df9 (incorrect -> 0x9c53), seq 161568:165616, ack 1016, win 512, options [nop,nop,TS val 755734488 ecr 755734488], length 4048
2022-04-05 00:21:30.117260 IP (tos 0x0, ttl 64, id 20753, offset 0, flags [DF], proto TCP (6), length 52)
    127.0.0.1.51542 > 127.0.0.1.11150: Flags [.], cksum 0xfe28 (incorrect -> 0x6a8b), seq 1016, ack 165616, win 512, options [nop,nop,TS val 755734488 ecr 755734488], length 0
2022-04-05 00:21:30.117270 IP (tos 0x0, ttl 64, id 29216, offset 0, flags [DF], proto TCP (6), length 3474)
    127.0.0.1.11150 > 127.0.0.1.51542: Flags [P.], cksum 0x0b87 (incorrect -> 0xb939), seq 165616:169038, ack 1016, win 512, options [nop,nop,TS val 755734488 ecr 755734488], length 3422
2022-04-05 00:21:30.117318 IP (tos 0x0, ttl 64, id 20754, offset 0, flags [DF], proto TCP (6), length 52)
    127.0.0.1.51542 > 127.0.0.1.11150: Flags [.], cksum 0xfe28 (incorrect -> 0x5d2d), seq 1016, ack 169038, win 512, options [nop,nop,TS val 755734488 ecr 755734488], length 0
2022-04-05 00:21:30.119237 IP (tos 0x0, ttl 64, id 29217, offset 0, flags [DF], proto TCP (6), length 4036)
    127.0.0.1.11150 > 127.0.0.1.51542: Flags [P.], cksum 0x0db9 (incorrect -> 0x9b93), seq 169038:173022, ack 1016, win 512, options [nop,nop,TS val 755734490 ecr 755734488], length 3984
2022-04-05 00:21:30.119276 IP (tos 0x0, ttl 64, id 20755, offset 0, flags [DF], proto TCP (6), length 52)
    127.0.0.1.51542 > 127.0.0.1.11150: Flags [.], cksum 0xfe28 (incorrect -> 0x4d99), seq 1016, ack 173022, win 512, options [nop,nop,TS val 755734490 ecr 755734490], length 0
2022-04-05 00:21:30.119329 IP (tos 0x0, ttl 64, id 29218, offset 0, flags [DF], proto TCP (6), length 4100)
    127.0.0.1.11150 > 127.0.0.1.51542: Flags [P.], cksum 0x0df9 (incorrect -> 0xd68f), seq 173022:177070, ack 1016, win 512, options [nop,nop,TS val 755734490 ecr 755734490], length 4048
2022-04-05 00:21:30.119337 IP (tos 0x0, ttl 64, id 20756, offset 0, flags [DF], proto TCP (6), length 52)
    127.0.0.1.51542 > 127.0.0.1.11150: Flags [.], cksum 0xfe28 (incorrect -> 0x3dc9), seq 1016, ack 177070, win 512, options [nop,nop,TS val 755734490 ecr 755734490], length 0
2022-04-05 00:21:30.119346 IP (tos 0x0, ttl 64, id 29219, offset 0, flags [DF], proto TCP (6), length 3474)
    127.0.0.1.11150 > 127.0.0.1.51542: Flags [P.], cksum 0x0b87 (incorrect -> 0xe3b5), seq 177070:180492, ack 1016, win 512, options [nop,nop,TS val 755734490 ecr 755734490], length 3422
2022-04-05 00:21:30.119351 IP (tos 0x0, ttl 64, id 20757, offset 0, flags [DF], proto TCP (6), length 52)
    127.0.0.1.51542 > 127.0.0.1.11150: Flags [.], cksum 0xfe28 (incorrect -> 0x306b), seq 1016, ack 180492, win 512, options [nop,nop,TS val 755734490 ecr 755734490], length 0
2022-04-05 00:21:30.121919 IP (tos 0x0, ttl 64, id 29220, offset 0, flags [DF], proto TCP (6), length 4100)
    127.0.0.1.11150 > 127.0.0.1.51542: Flags [P.], cksum 0x0df9 (incorrect -> 0xfe6c), seq 180492:184540, ack 1016, win 512, options [nop,nop,TS val 755734493 ecr 755734490], length 4048
2022-04-05 00:21:30.121983 IP (tos 0x0, ttl 64, id 20758, offset 0, flags [DF], proto TCP (6), length 52)
    127.0.0.1.51542 > 127.0.0.1.11150: Flags [.], cksum 0xfe28 (incorrect -> 0x2095), seq 1016, ack 184540, win 512, options [nop,nop,TS val 755734493 ecr 755734493], length 0
2022-04-05 00:21:30.121993 IP (tos 0x0, ttl 64, id 29221, offset 0, flags [DF], proto TCP (6), length 486)
    127.0.0.1.11150 > 127.0.0.1.51542: Flags [P.], cksum 0xffda (incorrect -> 0xbadb), seq 184540:184974, ack 1016, win 512, options [nop,nop,TS val 755734493 ecr 755734493], length 434
2022-04-05 00:21:30.122000 IP (tos 0x0, ttl 64, id 20759, offset 0, flags [DF], proto TCP (6), length 52)
    127.0.0.1.51542 > 127.0.0.1.11150: Flags [.], cksum 0xfe28 (incorrect -> 0x1ee3), seq 1016, ack 184974, win 512, options [nop,nop,TS val 755734493 ecr 755734493], length 0
2022-04-05 00:21:30.125158 IP (tos 0x0, ttl 64, id 29222, offset 0, flags [DF], proto TCP (6), length 4100)
    127.0.0.1.11150 > 127.0.0.1.51542: Flags [P.], cksum 0x0df9 (incorrect -> 0x5723), seq 184974:189022, ack 1016, win 512, options [nop,nop,TS val 755734496 ecr 755734493], length 4048
2022-04-05 00:21:30.125175 IP (tos 0x0, ttl 64, id 20760, offset 0, flags [DF], proto TCP (6), length 52)
    127.0.0.1.51542 > 127.0.0.1.11150: Flags [.], cksum 0xfe28 (incorrect -> 0x0f0d), seq 1016, ack 189022, win 512, options [nop,nop,TS val 755734496 ecr 755734496], length 0
2022-04-05 00:21:30.125184 IP (tos 0x0, ttl 64, id 29223, offset 0, flags [DF], proto TCP (6), length 3454)
    127.0.0.1.11150 > 127.0.0.1.51542: Flags [P.], cksum 0x0b73 (incorrect -> 0xeb60), seq 189022:192424, ack 1016, win 512, options [nop,nop,TS val 755734496 ecr 755734496], length 3402
2022-04-05 00:21:30.125190 IP (tos 0x0, ttl 64, id 20761, offset 0, flags [DF], proto TCP (6), length 52)
    127.0.0.1.51542 > 127.0.0.1.11150: Flags [.], cksum 0xfe28 (incorrect -> 0x01c3), seq 1016, ack 192424, win 512, options [nop,nop,TS val 755734496 ecr 755734496], length 0
2022-04-05 00:21:30.125245 IP (tos 0x0, ttl 64, id 29224, offset 0, flags [DF], proto TCP (6), length 4100)
    127.0.0.1.11150 > 127.0.0.1.51542: Flags [P.], cksum 0x0df9 (incorrect -> 0x5b6b), seq 192424:196472, ack 1016, win 512, options [nop,nop,TS val 755734496 ecr 755734496], length 4048
2022-04-05 00:21:30.125255 IP (tos 0x0, ttl 64, id 20762, offset 0, flags [DF], proto TCP (6), length 52)
    127.0.0.1.51542 > 127.0.0.1.11150: Flags [.], cksum 0xfe28 (incorrect -> 0xf1f2), seq 1016, ack 196472, win 512, options [nop,nop,TS val 755734496 ecr 755734496], length 0
2022-04-05 00:21:30.125262 IP (tos 0x0, ttl 64, id 29225, offset 0, flags [DF], proto TCP (6), length 3494)
    127.0.0.1.11150 > 127.0.0.1.51542: Flags [P.], cksum 0x0b9b (incorrect -> 0x4bc9), seq 196472:199914, ack 1016, win 512, options [nop,nop,TS val 755734496 ecr 755734496], length 3442
2022-04-05 00:21:30.125267 IP (tos 0x0, ttl 64, id 20763, offset 0, flags [DF], proto TCP (6), length 52)
    127.0.0.1.51542 > 127.0.0.1.11150: Flags [.], cksum 0xfe28 (incorrect -> 0xe480), seq 1016, ack 199914, win 512, options [nop,nop,TS val 755734496 ecr 755734496], length 0
2022-04-05 00:21:30.125314 IP (tos 0x0, ttl 64, id 29226, offset 0, flags [DF], proto TCP (6), length 4036)
    127.0.0.1.11150 > 127.0.0.1.51542: Flags [P.], cksum 0x0db9 (incorrect -> 0x0f91), seq 199914:203898, ack 1016, win 512, options [nop,nop,TS val 755734496 ecr 755734496], length 3984
2022-04-05 00:21:30.125393 IP (tos 0x0, ttl 64, id 20764, offset 0, flags [DF], proto TCP (6), length 52)
    127.0.0.1.51542 > 127.0.0.1.11150: Flags [.], cksum 0xfe28 (incorrect -> 0xd4f0), seq 1016, ack 203898, win 512, options [nop,nop,TS val 755734496 ecr 755734496], length 0
2022-04-05 00:21:30.128724 IP (tos 0x0, ttl 64, id 29227, offset 0, flags [DF], proto TCP (6), length 4036)
    127.0.0.1.11150 > 127.0.0.1.51542: Flags [P.], cksum 0x0db9 (incorrect -> 0xa236), seq 203898:207882, ack 1016, win 512, options [nop,nop,TS val 755734500 ecr 755734496], length 3984
2022-04-05 00:21:30.169386 IP (tos 0x0, ttl 64, id 20765, offset 0, flags [DF], proto TCP (6), length 52)
    127.0.0.1.51542 > 127.0.0.1.11150: Flags [.], cksum 0xfe28 (incorrect -> 0xc530), seq 1016, ack 207882, win 512, options [nop,nop,TS val 755734540 ecr 755734500], length 0
200, 128.41251254081726, 1.3464858531951904