2022-04-05 05:39:49.744366 IP (tos 0x0, ttl 64, id 31005, offset 0, flags [DF], proto TCP (6), length 60)
    127.0.0.1.43036 > 127.0.0.1.11450: Flags [S], cksum 0xfe30 (incorrect -> 0x2b51), seq 2664659732, win 65495, options [mss 65495,sackOK,TS val 774834115 ecr 0,nop,wscale 7], length 0
2022-04-05 05:39:49.744380 IP (tos 0x0, ttl 64, id 0, offset 0, flags [DF], proto TCP (6), length 60)
    127.0.0.1.11450 > 127.0.0.1.43036: Flags [S.], cksum 0xfe30 (incorrect -> 0xee56), seq 827512240, ack 2664659733, win 65483, options [mss 65495,sackOK,TS val 774834115 ecr 774834115,nop,wscale 7], length 0
2022-04-05 05:39:49.744392 IP (tos 0x0, ttl 64, id 31006, offset 0, flags [DF], proto TCP (6), length 52)
    127.0.0.1.43036 > 127.0.0.1.11450: Flags [.], cksum 0xfe28 (incorrect -> 0x1513), seq 1, ack 1, win 512, options [nop,nop,TS val 774834115 ecr 774834115], length 0
2022-04-05 05:39:49.744526 IP (tos 0x0, ttl 64, id 31007, offset 0, flags [DF], proto TCP (6), length 55)
    127.0.0.1.43036 > 127.0.0.1.11450: Flags [P.], cksum 0xfe2b (incorrect -> 0x1006), seq 1:4, ack 1, win 512, options [nop,nop,TS val 774834116 ecr 774834115], length 3
2022-04-05 05:39:49.744530 IP (tos 0x0, ttl 64, id 33433, offset 0, flags [DF], proto TCP (6), length 52)
    127.0.0.1.11450 > 127.0.0.1.43036: Flags [.], cksum 0xfe28 (incorrect -> 0x150e), seq 1, ack 4, win 512, options [nop,nop,TS val 774834116 ecr 774834116], length 0
2022-04-05 05:39:49.744605 IP (tos 0x0, ttl 64, id 33434, offset 0, flags [DF], proto TCP (6), length 54)
    127.0.0.1.11450 > 127.0.0.1.43036: Flags [P.], cksum 0xfe2a (incorrect -> 0x1004), seq 1:3, ack 4, win 512, options [nop,nop,TS val 774834116 ecr 774834116], length 2
2022-04-05 05:39:49.744610 IP (tos 0x0, ttl 64, id 31008, offset 0, flags [DF], proto TCP (6), length 52)
    127.0.0.1.43036 > 127.0.0.1.11450: Flags [.], cksum 0xfe28 (incorrect -> 0x150c), seq 4, ack 3, win 512, options [nop,nop,TS val 774834116 ecr 774834116], length 0
2022-04-05 05:39:49.746066 IP (tos 0x0, ttl 64, id 31009, offset 0, flags [DF], proto TCP (6), length 62)
    127.0.0.1.43036 > 127.0.0.1.11450: Flags [P.], cksum 0xfe32 (incorrect -> 0x8485), seq 4:14, ack 3, win 512, options [nop,nop,TS val 774834117 ecr 774834116], length 10
2022-04-05 05:39:49.746083 IP (tos 0x0, ttl 64, id 33435, offset 0, flags [DF], proto TCP (6), length 52)
    127.0.0.1.11450 > 127.0.0.1.43036: Flags [.], cksum 0xfe28 (incorrect -> 0x1500), seq 3, ack 14, win 512, options [nop,nop,TS val 774834117 ecr 774834117], length 0
200, 7.769230842590332, 0.7164616584777832