2022-04-05 11:47:18.715304 IP (tos 0x0, ttl 64, id 46905, offset 0, flags [DF], proto TCP (6), length 60)
    127.0.0.1.54100 > 127.0.0.1.12150: Flags [S], cksum 0xfe30 (incorrect -> 0x6127), seq 2086407948, win 65495, options [mss 65495,sackOK,TS val 241521218 ecr 0,nop,wscale 7], length 0
2022-04-05 11:47:18.715319 IP (tos 0x0, ttl 64, id 0, offset 0, flags [DF], proto TCP (6), length 60)
    127.0.0.1.12150 > 127.0.0.1.54100: Flags [S.], cksum 0xfe30 (incorrect -> 0xf0fb), seq 1628286577, ack 2086407949, win 65483, options [mss 65495,sackOK,TS val 241521218 ecr 241521218,nop,wscale 7], length 0
2022-04-05 11:47:18.715330 IP (tos 0x0, ttl 64, id 46906, offset 0, flags [DF], proto TCP (6), length 52)
    127.0.0.1.54100 > 127.0.0.1.12150: Flags [.], cksum 0xfe28 (incorrect -> 0x17b8), seq 1, ack 1, win 512, options [nop,nop,TS val 241521218 ecr 241521218], length 0
2022-04-05 11:47:18.715497 IP (tos 0x0, ttl 64, id 46907, offset 0, flags [DF], proto TCP (6), length 55)
    127.0.0.1.54100 > 127.0.0.1.12150: Flags [P.], cksum 0xfe2b (incorrect -> 0x12ac), seq 1:4, ack 1, win 512, options [nop,nop,TS val 241521218 ecr 241521218], length 3
2022-04-05 11:47:18.715504 IP (tos 0x0, ttl 64, id 50739, offset 0, flags [DF], proto TCP (6), length 52)
    127.0.0.1.12150 > 127.0.0.1.54100: Flags [.], cksum 0xfe28 (incorrect -> 0x17b5), seq 1, ack 4, win 512, options [nop,nop,TS val 241521218 ecr 241521218], length 0
2022-04-05 11:47:18.715529 IP (tos 0x0, ttl 64, id 50740, offset 0, flags [DF], proto TCP (6), length 54)
    127.0.0.1.12150 > 127.0.0.1.54100: Flags [P.], cksum 0xfe2a (incorrect -> 0x12ab), seq 1:3, ack 4, win 512, options [nop,nop,TS val 241521218 ecr 241521218], length 2
2022-04-05 11:47:18.715537 IP (tos 0x0, ttl 64, id 46908, offset 0, flags [DF], proto TCP (6), length 52)
    127.0.0.1.54100 > 127.0.0.1.12150: Flags [.], cksum 0xfe28 (incorrect -> 0x17b3), seq 4, ack 3, win 512, options [nop,nop,TS val 241521218 ecr 241521218], length 0
2022-04-05 11:47:18.717472 IP (tos 0x0, ttl 64, id 46909, offset 0, flags [DF], proto TCP (6), length 62)
    127.0.0.1.54100 > 127.0.0.1.12150: Flags [P.], cksum 0xfe32 (incorrect -> 0x1c0a), seq 4:14, ack 3, win 512, options [nop,nop,TS val 241521220 ecr 241521218], length 10
2022-04-05 11:47:18.717480 IP (tos 0x0, ttl 64, id 50741, offset 0, flags [DF], proto TCP (6), length 52)
    127.0.0.1.12150 > 127.0.0.1.54100: Flags [.], cksum 0xfe28 (incorrect -> 0x17a5), seq 3, ack 14, win 512, options [nop,nop,TS val 241521220 ecr 241521220], length 0
2022-04-05 11:47:18.764279 IP (tos 0x0, ttl 64, id 50742, offset 0, flags [DF], proto TCP (6), length 62)
    127.0.0.1.12150 > 127.0.0.1.54100: Flags [P.], cksum 0xfe32 (incorrect -> 0x1263), seq 3:13, ack 14, win 512, options [nop,nop,TS val 241521267 ecr 241521220], length 10
2022-04-05 11:47:18.764290 IP (tos 0x0, ttl 64, id 46910, offset 0, flags [DF], proto TCP (6), length 52)
    127.0.0.1.54100 > 127.0.0.1.12150: Flags [.], cksum 0xfe28 (incorrect -> 0x173d), seq 14, ack 13, win 512, options [nop,nop,TS val 241521267 ecr 241521267], length 0
2022-04-05 11:47:18.769971 IP (tos 0x0, ttl 64, id 46911, offset 0, flags [DF], proto TCP (6), length 569)
    127.0.0.1.54100 > 127.0.0.1.12150: Flags [P.], cksum 0x002e (incorrect -> 0x1245), seq 14:531, ack 13, win 512, options [nop,nop,TS val 241521272 ecr 241521267], length 517
2022-04-05 11:47:18.769981 IP (tos 0x0, ttl 64, id 50743, offset 0, flags [DF], proto TCP (6), length 52)
    127.0.0.1.12150 > 127.0.0.1.54100: Flags [.], cksum 0xfe28 (incorrect -> 0x1532), seq 13, ack 531, win 508, options [nop,nop,TS val 241521272 ecr 241521272], length 0
2022-04-05 11:47:18.827022 IP (tos 0x0, ttl 64, id 50744, offset 0, flags [DF], proto TCP (6), length 3538)
    127.0.0.1.12150 > 127.0.0.1.54100: Flags [P.], cksum 0x0bc7 (incorrect -> 0x3b57), seq 13:3499, ack 531, win 512, options [nop,nop,TS val 241521329 ecr 241521272], length 3486
2022-04-05 11:47:18.827031 IP (tos 0x0, ttl 64, id 46912, offset 0, flags [DF], proto TCP (6), length 52)
    127.0.0.1.54100 > 127.0.0.1.12150: Flags [.], cksum 0xfe28 (incorrect -> 0x0730), seq 531, ack 3499, win 494, options [nop,nop,TS val 241521329 ecr 241521329], length 0
200, 4.896780967712402, 0.8337154388427734