2022-04-05 20:04:19.029026 IP (tos 0x0, ttl 64, id 51840, offset 0, flags [DF], proto TCP (6), length 60)
    127.0.0.1.45620 > 127.0.0.1.9950: Flags [S], cksum 0xfe30 (incorrect -> 0x3784), seq 1425965669, win 65495, options [mss 65495,sackOK,TS val 271341531 ecr 0,nop,wscale 7], length 0
2022-04-05 20:04:19.029036 IP (tos 0x0, ttl 64, id 0, offset 0, flags [DF], proto TCP (6), length 60)
    127.0.0.1.9950 > 127.0.0.1.45620: Flags [S.], cksum 0xfe30 (incorrect -> 0xa5c5), seq 3302712534, ack 1425965670, win 65483, options [mss 65495,sackOK,TS val 271341531 ecr 271341531,nop,wscale 7], length 0
2022-04-05 20:04:19.029044 IP (tos 0x0, ttl 64, id 51841, offset 0, flags [DF], proto TCP (6), length 52)
    127.0.0.1.45620 > 127.0.0.1.9950: Flags [.], cksum 0xfe28 (incorrect -> 0xcc81), seq 1, ack 1, win 512, options [nop,nop,TS val 271341531 ecr 271341531], length 0
2022-04-05 20:04:19.029171 IP (tos 0x0, ttl 64, id 51842, offset 0, flags [DF], proto TCP (6), length 55)
    127.0.0.1.45620 > 127.0.0.1.9950: Flags [P.], cksum 0xfe2b (incorrect -> 0xc774), seq 1:4, ack 1, win 512, options [nop,nop,TS val 271341532 ecr 271341531], length 3
2022-04-05 20:04:19.029178 IP (tos 0x0, ttl 64, id 44700, offset 0, flags [DF], proto TCP (6), length 52)
    127.0.0.1.9950 > 127.0.0.1.45620: Flags [.], cksum 0xfe28 (incorrect -> 0xcc7c), seq 1, ack 4, win 512, options [nop,nop,TS val 271341532 ecr 271341532], length 0
2022-04-05 20:04:19.029199 IP (tos 0x0, ttl 64, id 44701, offset 0, flags [DF], proto TCP (6), length 54)
    127.0.0.1.9950 > 127.0.0.1.45620: Flags [P.], cksum 0xfe2a (incorrect -> 0xc772), seq 1:3, ack 4, win 512, options [nop,nop,TS val 271341532 ecr 271341532], length 2
2022-04-05 20:04:19.029208 IP (tos 0x0, ttl 64, id 51843, offset 0, flags [DF], proto TCP (6), length 52)
    127.0.0.1.45620 > 127.0.0.1.9950: Flags [.], cksum 0xfe28 (incorrect -> 0xcc7a), seq 4, ack 3, win 512, options [nop,nop,TS val 271341532 ecr 271341532], length 0
2022-04-05 20:04:19.031185 IP (tos 0x0, ttl 64, id 51844, offset 0, flags [DF], proto TCP (6), length 62)
    127.0.0.1.45620 > 127.0.0.1.9950: Flags [P.], cksum 0xfe32 (incorrect -> 0x1fe1), seq 4:14, ack 3, win 512, options [nop,nop,TS val 271341534 ecr 271341532], length 10
2022-04-05 20:04:19.031194 IP (tos 0x0, ttl 64, id 44702, offset 0, flags [DF], proto TCP (6), length 52)
    127.0.0.1.9950 > 127.0.0.1.45620: Flags [.], cksum 0xfe28 (incorrect -> 0xcc6c), seq 3, ack 14, win 512, options [nop,nop,TS val 271341534 ecr 271341534], length 0
200, 3.9836926460266113, 1.123532772064209