2022-04-05 12:46:26.810214 IP (tos 0x0, ttl 64, id 9182, offset 0, flags [DF], proto TCP (6), length 60)
    127.0.0.1.44922 > 127.0.0.1.9750: Flags [S], cksum 0xfe30 (incorrect -> 0xdf0e), seq 3886952215, win 65495, options [mss 65495,sackOK,TS val 245069313 ecr 0,nop,wscale 7], length 0
2022-04-05 12:46:26.810222 IP (tos 0x0, ttl 64, id 0, offset 0, flags [DF], proto TCP (6), length 60)
    127.0.0.1.9750 > 127.0.0.1.44922: Flags [S.], cksum 0xfe30 (incorrect -> 0x4d57), seq 3876267530, ack 3886952216, win 65483, options [mss 65495,sackOK,TS val 245069313 ecr 245069313,nop,wscale 7], length 0
2022-04-05 12:46:26.810229 IP (tos 0x0, ttl 64, id 9183, offset 0, flags [DF], proto TCP (6), length 52)
    127.0.0.1.44922 > 127.0.0.1.9750: Flags [.], cksum 0xfe28 (incorrect -> 0x7413), seq 1, ack 1, win 512, options [nop,nop,TS val 245069313 ecr 245069313], length 0
2022-04-05 12:46:26.810325 IP (tos 0x0, ttl 64, id 9184, offset 0, flags [DF], proto TCP (6), length 55)
    127.0.0.1.44922 > 127.0.0.1.9750: Flags [P.], cksum 0xfe2b (incorrect -> 0x6f07), seq 1:4, ack 1, win 512, options [nop,nop,TS val 245069313 ecr 245069313], length 3
2022-04-05 12:46:26.810337 IP (tos 0x0, ttl 64, id 22411, offset 0, flags [DF], proto TCP (6), length 52)
    127.0.0.1.9750 > 127.0.0.1.44922: Flags [.], cksum 0xfe28 (incorrect -> 0x7410), seq 1, ack 4, win 512, options [nop,nop,TS val 245069313 ecr 245069313], length 0
2022-04-05 12:46:26.810374 IP (tos 0x0, ttl 64, id 22412, offset 0, flags [DF], proto TCP (6), length 54)
    127.0.0.1.9750 > 127.0.0.1.44922: Flags [P.], cksum 0xfe2a (incorrect -> 0x6f06), seq 1:3, ack 4, win 512, options [nop,nop,TS val 245069313 ecr 245069313], length 2
2022-04-05 12:46:26.810388 IP (tos 0x0, ttl 64, id 9185, offset 0, flags [DF], proto TCP (6), length 52)
    127.0.0.1.44922 > 127.0.0.1.9750: Flags [.], cksum 0xfe28 (incorrect -> 0x740e), seq 4, ack 3, win 512, options [nop,nop,TS val 245069313 ecr 245069313], length 0
2022-04-05 12:46:26.812002 IP (tos 0x0, ttl 64, id 9186, offset 0, flags [DF], proto TCP (6), length 62)
    127.0.0.1.44922 > 127.0.0.1.9750: Flags [P.], cksum 0xfe32 (incorrect -> 0xbb19), seq 4:14, ack 3, win 512, options [nop,nop,TS val 245069314 ecr 245069313], length 10
2022-04-05 12:46:26.812012 IP (tos 0x0, ttl 64, id 22413, offset 0, flags [DF], proto TCP (6), length 52)
    127.0.0.1.9750 > 127.0.0.1.44922: Flags [.], cksum 0xfe28 (incorrect -> 0x7402), seq 3, ack 14, win 512, options [nop,nop,TS val 245069314 ecr 245069314], length 0
2022-04-05 12:46:27.033548 IP (tos 0x0, ttl 64, id 22414, offset 0, flags [DF], proto TCP (6), length 62)
    127.0.0.1.9750 > 127.0.0.1.44922: Flags [P.], cksum 0xfe32 (incorrect -> 0x6e11), seq 3:13, ack 14, win 512, options [nop,nop,TS val 245069536 ecr 245069314], length 10
2022-04-05 12:46:27.033557 IP (tos 0x0, ttl 64, id 9187, offset 0, flags [DF], proto TCP (6), length 52)
    127.0.0.1.44922 > 127.0.0.1.9750: Flags [.], cksum 0xfe28 (incorrect -> 0x723c), seq 14, ack 13, win 512, options [nop,nop,TS val 245069536 ecr 245069536], length 0
2022-04-05 12:46:27.039313 IP (tos 0x0, ttl 64, id 9188, offset 0, flags [DF], proto TCP (6), length 569)
    127.0.0.1.44922 > 127.0.0.1.9750: Flags [P.], cksum 0x002e (incorrect -> 0xb34e), seq 14:531, ack 13, win 512, options [nop,nop,TS val 245069542 ecr 245069536], length 517
2022-04-05 12:46:27.039322 IP (tos 0x0, ttl 64, id 22415, offset 0, flags [DF], proto TCP (6), length 52)
    127.0.0.1.9750 > 127.0.0.1.44922: Flags [.], cksum 0xfe28 (incorrect -> 0x702f), seq 13, ack 531, win 508, options [nop,nop,TS val 245069542 ecr 245069542], length 0
2022-04-05 12:46:27.263153 IP (tos 0x0, ttl 64, id 22416, offset 0, flags [DF], proto TCP (6), length 3215)
    127.0.0.1.9750 > 127.0.0.1.44922: Flags [P.], cksum 0x0a84 (incorrect -> 0xd7e5), seq 13:3176, ack 531, win 512, options [nop,nop,TS val 245069766 ecr 245069542], length 3163
2022-04-05 12:46:27.263162 IP (tos 0x0, ttl 64, id 9189, offset 0, flags [DF], proto TCP (6), length 52)
    127.0.0.1.44922 > 127.0.0.1.9750: Flags [.], cksum 0xfe28 (incorrect -> 0x6221), seq 531, ack 3176, win 495, options [nop,nop,TS val 245069766 ecr 245069766], length 0
2022-04-05 12:46:27.263645 IP (tos 0x0, ttl 64, id 9190, offset 0, flags [DF], proto TCP (6), length 116)
    127.0.0.1.44922 > 127.0.0.1.9750: Flags [P.], cksum 0xfe68 (incorrect -> 0x2122), seq 531:595, ack 3176, win 512, options [nop,nop,TS val 245069766 ecr 245069766], length 64
2022-04-05 12:46:27.263652 IP (tos 0x0, ttl 64, id 22417, offset 0, flags [DF], proto TCP (6), length 52)
    127.0.0.1.9750 > 127.0.0.1.44922: Flags [.], cksum 0xfe28 (incorrect -> 0x61d0), seq 3176, ack 595, win 512, options [nop,nop,TS val 245069766 ecr 245069766], length 0
2022-04-05 12:46:27.264046 IP (tos 0x0, ttl 64, id 9191, offset 0, flags [DF], proto TCP (6), length 402)
    127.0.0.1.44922 > 127.0.0.1.9750: Flags [P.], cksum 0xff86 (incorrect -> 0xb8c3), seq 595:945, ack 3176, win 512, options [nop,nop,TS val 245069766 ecr 245069766], length 350
2022-04-05 12:46:27.264052 IP (tos 0x0, ttl 64, id 22418, offset 0, flags [DF], proto TCP (6), length 52)
    127.0.0.1.9750 > 127.0.0.1.44922: Flags [.], cksum 0xfe28 (incorrect -> 0x6074), seq 3176, ack 945, win 510, options [nop,nop,TS val 245069766 ecr 245069766], length 0
2022-04-05 12:46:27.487426 IP (tos 0x0, ttl 64, id 22419, offset 0, flags [DF], proto TCP (6), length 221)
    127.0.0.1.9750 > 127.0.0.1.44922: Flags [P.], cksum 0xfed1 (incorrect -> 0x587b), seq 3176:3345, ack 945, win 512, options [nop,nop,TS val 245069990 ecr 245069766], length 169
2022-04-05 12:46:27.487435 IP (tos 0x0, ttl 64, id 9192, offset 0, flags [DF], proto TCP (6), length 52)
    127.0.0.1.44922 > 127.0.0.1.9750: Flags [.], cksum 0xfe28 (incorrect -> 0x5e0a), seq 945, ack 3345, win 511, options [nop,nop,TS val 245069990 ecr 245069990], length 0
2022-04-05 12:46:27.848916 IP (tos 0x0, ttl 64, id 22420, offset 0, flags [DF], proto TCP (6), length 3538)
    127.0.0.1.9750 > 127.0.0.1.44922: Flags [P.], cksum 0x0bc7 (incorrect -> 0x909a), seq 3345:6831, ack 945, win 512, options [nop,nop,TS val 245070351 ecr 245069990], length 3486
2022-04-05 12:46:27.848932 IP (tos 0x0, ttl 64, id 9193, offset 0, flags [DF], proto TCP (6), length 52)
    127.0.0.1.44922 > 127.0.0.1.9750: Flags [.], cksum 0xfe28 (incorrect -> 0x4dab), seq 945, ack 6831, win 494, options [nop,nop,TS val 245070351 ecr 245070351], length 0
2022-04-05 12:46:27.857836 IP (tos 0x0, ttl 64, id 22421, offset 0, flags [DF], proto TCP (6), length 3538)
    127.0.0.1.9750 > 127.0.0.1.44922: Flags [P.], cksum 0x0bc7 (incorrect -> 0x825c), seq 6831:10317, ack 945, win 512, options [nop,nop,TS val 245070360 ecr 245070351], length 3486
2022-04-05 12:46:27.857847 IP (tos 0x0, ttl 64, id 9194, offset 0, flags [DF], proto TCP (6), length 52)
    127.0.0.1.44922 > 127.0.0.1.9750: Flags [.], cksum 0xfe28 (incorrect -> 0x3ffb), seq 945, ack 10317, win 494, options [nop,nop,TS val 245070360 ecr 245070360], length 0
2022-04-05 12:46:27.870783 IP (tos 0x0, ttl 64, id 22422, offset 0, flags [DF], proto TCP (6), length 3850)
    127.0.0.1.9750 > 127.0.0.1.44922: Flags [P.], cksum 0x0cff (incorrect -> 0x006e), seq 10317:14115, ack 945, win 512, options [nop,nop,TS val 245070373 ecr 245070360], length 3798
2022-04-05 12:46:27.870788 IP (tos 0x0, ttl 64, id 9195, offset 0, flags [DF], proto TCP (6), length 52)
    127.0.0.1.44922 > 127.0.0.1.9750: Flags [.], cksum 0xfe28 (incorrect -> 0x310c), seq 945, ack 14115, win 493, options [nop,nop,TS val 245070373 ecr 245070373], length 0
2022-04-05 12:46:27.938210 IP (tos 0x0, ttl 64, id 22423, offset 0, flags [DF], proto TCP (6), length 1048)
    127.0.0.1.9750 > 127.0.0.1.44922: Flags [P.], cksum 0x020d (incorrect -> 0x259e), seq 14115:15111, ack 945, win 512, options [nop,nop,TS val 245070441 ecr 245070373], length 996
2022-04-05 12:46:27.938216 IP (tos 0x0, ttl 64, id 9196, offset 0, flags [DF], proto TCP (6), length 52)
    127.0.0.1.44922 > 127.0.0.1.9750: Flags [.], cksum 0xfe28 (incorrect -> 0x2c95), seq 945, ack 15111, win 504, options [nop,nop,TS val 245070441 ecr 245070441], length 0
2022-04-05 12:46:27.958428 IP (tos 0x0, ttl 64, id 22424, offset 0, flags [DF], proto TCP (6), length 3196)
    127.0.0.1.9750 > 127.0.0.1.44922: Flags [P.], cksum 0x0a71 (incorrect -> 0x51aa), seq 15111:18255, ack 945, win 512, options [nop,nop,TS val 245070461 ecr 245070441], length 3144
2022-04-05 12:46:27.958433 IP (tos 0x0, ttl 64, id 9197, offset 0, flags [DF], proto TCP (6), length 52)
    127.0.0.1.44922 > 127.0.0.1.9750: Flags [.], cksum 0xfe28 (incorrect -> 0x202e), seq 945, ack 18255, win 495, options [nop,nop,TS val 245070461 ecr 245070461], length 0
2022-04-05 12:46:27.960192 IP (tos 0x0, ttl 64, id 22425, offset 0, flags [DF], proto TCP (6), length 3196)
    127.0.0.1.9750 > 127.0.0.1.44922: Flags [P.], cksum 0x0a71 (incorrect -> 0x20ff), seq 18255:21399, ack 945, win 512, options [nop,nop,TS val 245070463 ecr 245070461], length 3144
2022-04-05 12:46:27.960198 IP (tos 0x0, ttl 64, id 9198, offset 0, flags [DF], proto TCP (6), length 52)
    127.0.0.1.44922 > 127.0.0.1.9750: Flags [.], cksum 0xfe28 (incorrect -> 0x13e2), seq 945, ack 21399, win 495, options [nop,nop,TS val 245070463 ecr 245070463], length 0
2022-04-05 12:46:27.961402 IP (tos 0x0, ttl 64, id 22426, offset 0, flags [DF], proto TCP (6), length 4100)
    127.0.0.1.9750 > 127.0.0.1.44922: Flags [P.], cksum 0x0df9 (incorrect -> 0x9d20), seq 21399:25447, ack 945, win 512, options [nop,nop,TS val 245070464 ecr 245070463], length 4048
2022-04-05 12:46:27.961409 IP (tos 0x0, ttl 64, id 9199, offset 0, flags [DF], proto TCP (6), length 52)
    127.0.0.1.44922 > 127.0.0.1.9750: Flags [.], cksum 0xfe28 (incorrect -> 0x0413), seq 945, ack 25447, win 492, options [nop,nop,TS val 245070464 ecr 245070464], length 0
2022-04-05 12:46:27.961413 IP (tos 0x0, ttl 64, id 22427, offset 0, flags [DF], proto TCP (6), length 1254)
    127.0.0.1.9750 > 127.0.0.1.44922: Flags [P.], cksum 0x02db (incorrect -> 0x925d), seq 25447:26649, ack 945, win 512, options [nop,nop,TS val 245070464 ecr 245070464], length 1202
2022-04-05 12:46:27.961416 IP (tos 0x0, ttl 64, id 9200, offset 0, flags [DF], proto TCP (6), length 52)
    127.0.0.1.44922 > 127.0.0.1.9750: Flags [.], cksum 0xfe28 (incorrect -> 0xff65), seq 945, ack 26649, win 487, options [nop,nop,TS val 245070464 ecr 245070464], length 0
2022-04-05 12:46:27.966248 IP (tos 0x0, ttl 64, id 22428, offset 0, flags [DF], proto TCP (6), length 2200)
    127.0.0.1.9750 > 127.0.0.1.44922: Flags [P.], cksum 0x068d (incorrect -> 0xb681), seq 26649:28797, ack 945, win 512, options [nop,nop,TS val 245070469 ecr 245070464], length 2148
2022-04-05 12:46:27.966253 IP (tos 0x0, ttl 64, id 9201, offset 0, flags [DF], proto TCP (6), length 52)
    127.0.0.1.44922 > 127.0.0.1.9750: Flags [.], cksum 0xfe28 (incorrect -> 0xf6eb), seq 945, ack 28797, win 499, options [nop,nop,TS val 245070469 ecr 245070469], length 0
2022-04-05 12:46:27.966360 IP (tos 0x0, ttl 64, id 22429, offset 0, flags [DF], proto TCP (6), length 3196)
    127.0.0.1.9750 > 127.0.0.1.44922: Flags [P.], cksum 0x0a71 (incorrect -> 0xfd2c), seq 28797:31941, ack 945, win 512, options [nop,nop,TS val 245070469 ecr 245070469], length 3144
2022-04-05 12:46:27.966364 IP (tos 0x0, ttl 64, id 9202, offset 0, flags [DF], proto TCP (6), length 52)
    127.0.0.1.44922 > 127.0.0.1.9750: Flags [.], cksum 0xfe28 (incorrect -> 0xeaa7), seq 945, ack 31941, win 495, options [nop,nop,TS val 245070469 ecr 245070469], length 0
2022-04-05 12:46:27.971086 IP (tos 0x0, ttl 64, id 22430, offset 0, flags [DF], proto TCP (6), length 4100)
    127.0.0.1.9750 > 127.0.0.1.44922: Flags [P.], cksum 0x0df9 (incorrect -> 0xeb07), seq 31941:35989, ack 945, win 512, options [nop,nop,TS val 245070474 ecr 245070469], length 4048
200, 9.065699338912964, 1.2795584201812744