2022-04-05 01:36:52.690447 IP (tos 0x0, ttl 64, id 21842, offset 0, flags [DF], proto TCP (6), length 60)
    127.0.0.1.42738 > 127.0.0.1.11450: Flags [S], cksum 0xfe30 (incorrect -> 0x9b8a), seq 1514061589, win 65495, options [mss 65495,sackOK,TS val 760257062 ecr 0,nop,wscale 7], length 0
2022-04-05 01:36:52.690460 IP (tos 0x0, ttl 64, id 0, offset 0, flags [DF], proto TCP (6), length 60)
    127.0.0.1.11450 > 127.0.0.1.42738: Flags [S.], cksum 0xfe30 (incorrect -> 0x4b11), seq 3340091879, ack 1514061590, win 65483, options [mss 65495,sackOK,TS val 760257062 ecr 760257062,nop,wscale 7], length 0
2022-04-05 01:36:52.690470 IP (tos 0x0, ttl 64, id 21843, offset 0, flags [DF], proto TCP (6), length 52)
    127.0.0.1.42738 > 127.0.0.1.11450: Flags [.], cksum 0xfe28 (incorrect -> 0x71cd), seq 1, ack 1, win 512, options [nop,nop,TS val 760257062 ecr 760257062], length 0
2022-04-05 01:36:52.690611 IP (tos 0x0, ttl 64, id 21844, offset 0, flags [DF], proto TCP (6), length 55)
    127.0.0.1.42738 > 127.0.0.1.11450: Flags [P.], cksum 0xfe2b (incorrect -> 0x6cc1), seq 1:4, ack 1, win 512, options [nop,nop,TS val 760257062 ecr 760257062], length 3
2022-04-05 01:36:52.690630 IP (tos 0x0, ttl 64, id 6745, offset 0, flags [DF], proto TCP (6), length 52)
    127.0.0.1.11450 > 127.0.0.1.42738: Flags [.], cksum 0xfe28 (incorrect -> 0x71ca), seq 1, ack 4, win 512, options [nop,nop,TS val 760257062 ecr 760257062], length 0
2022-04-05 01:36:52.690801 IP (tos 0x0, ttl 64, id 6746, offset 0, flags [DF], proto TCP (6), length 54)
    127.0.0.1.11450 > 127.0.0.1.42738: Flags [P.], cksum 0xfe2a (incorrect -> 0x6cc0), seq 1:3, ack 4, win 512, options [nop,nop,TS val 760257062 ecr 760257062], length 2
2022-04-05 01:36:52.690824 IP (tos 0x0, ttl 64, id 21845, offset 0, flags [DF], proto TCP (6), length 52)
    127.0.0.1.42738 > 127.0.0.1.11450: Flags [.], cksum 0xfe28 (incorrect -> 0x71c8), seq 4, ack 3, win 512, options [nop,nop,TS val 760257062 ecr 760257062], length 0
2022-04-05 01:36:52.702596 IP (tos 0x0, ttl 64, id 21846, offset 0, flags [DF], proto TCP (6), length 62)
    127.0.0.1.42738 > 127.0.0.1.11450: Flags [P.], cksum 0xfe32 (incorrect -> 0xe1ad), seq 4:14, ack 3, win 512, options [nop,nop,TS val 760257074 ecr 760257062], length 10
2022-04-05 01:36:52.702604 IP (tos 0x0, ttl 64, id 6747, offset 0, flags [DF], proto TCP (6), length 52)
    127.0.0.1.11450 > 127.0.0.1.42738: Flags [.], cksum 0xfe28 (incorrect -> 0x71a6), seq 3, ack 14, win 512, options [nop,nop,TS val 760257074 ecr 760257074], length 0
2022-04-05 01:36:52.790877 IP (tos 0x0, ttl 64, id 6748, offset 0, flags [DF], proto TCP (6), length 62)
    127.0.0.1.11450 > 127.0.0.1.42738: Flags [P.], cksum 0xfe32 (incorrect -> 0x6c3b), seq 3:13, ack 14, win 512, options [nop,nop,TS val 760257162 ecr 760257074], length 10
2022-04-05 01:36:52.790883 IP (tos 0x0, ttl 64, id 21847, offset 0, flags [DF], proto TCP (6), length 52)
    127.0.0.1.42738 > 127.0.0.1.11450: Flags [.], cksum 0xfe28 (incorrect -> 0x70ec), seq 14, ack 13, win 512, options [nop,nop,TS val 760257162 ecr 760257162], length 0
2022-04-05 01:36:52.796853 IP (tos 0x0, ttl 64, id 21848, offset 0, flags [DF], proto TCP (6), length 569)
    127.0.0.1.42738 > 127.0.0.1.11450: Flags [P.], cksum 0x002e (incorrect -> 0xb660), seq 14:531, ack 13, win 512, options [nop,nop,TS val 760257168 ecr 760257162], length 517
2022-04-05 01:36:52.796862 IP (tos 0x0, ttl 64, id 6749, offset 0, flags [DF], proto TCP (6), length 52)
    127.0.0.1.11450 > 127.0.0.1.42738: Flags [.], cksum 0xfe28 (incorrect -> 0x6edf), seq 13, ack 531, win 508, options [nop,nop,TS val 760257168 ecr 760257168], length 0
2022-04-05 01:36:52.888569 IP (tos 0x0, ttl 64, id 6750, offset 0, flags [DF], proto TCP (6), length 3538)
    127.0.0.1.11450 > 127.0.0.1.42738: Flags [P.], cksum 0x0bc7 (incorrect -> 0x14b4), seq 13:3499, ack 531, win 512, options [nop,nop,TS val 760257260 ecr 760257168], length 3486
2022-04-05 01:36:52.888576 IP (tos 0x0, ttl 64, id 21849, offset 0, flags [DF], proto TCP (6), length 52)
    127.0.0.1.42738 > 127.0.0.1.11450: Flags [.], cksum 0xfe28 (incorrect -> 0x6097), seq 531, ack 3499, win 494, options [nop,nop,TS val 760257260 ecr 760257260], length 0
2022-04-05 01:36:52.919142 IP (tos 0x0, ttl 64, id 6751, offset 0, flags [DF], proto TCP (6), length 1151)
    127.0.0.1.11450 > 127.0.0.1.42738: Flags [P.], cksum 0x0274 (incorrect -> 0x7c35), seq 3499:4598, ack 531, win 512, options [nop,nop,TS val 760257290 ecr 760257260], length 1099
2022-04-05 01:36:52.919148 IP (tos 0x0, ttl 64, id 21850, offset 0, flags [DF], proto TCP (6), length 52)
    127.0.0.1.42738 > 127.0.0.1.11450: Flags [.], cksum 0xfe28 (incorrect -> 0x5c07), seq 531, ack 4598, win 503, options [nop,nop,TS val 760257290 ecr 760257290], length 0
2022-04-05 01:36:52.919505 IP (tos 0x0, ttl 64, id 21851, offset 0, flags [DF], proto TCP (6), length 132)
    127.0.0.1.42738 > 127.0.0.1.11450: Flags [P.], cksum 0xfe78 (incorrect -> 0xbf37), seq 531:611, ack 4598, win 512, options [nop,nop,TS val 760257291 ecr 760257290], length 80
2022-04-05 01:36:52.919512 IP (tos 0x0, ttl 64, id 6752, offset 0, flags [DF], proto TCP (6), length 52)
    127.0.0.1.11450 > 127.0.0.1.42738: Flags [.], cksum 0xfe28 (incorrect -> 0x5bac), seq 4598, ack 611, win 512, options [nop,nop,TS val 760257291 ecr 760257291], length 0
2022-04-05 01:36:52.919829 IP (tos 0x0, ttl 64, id 21852, offset 0, flags [DF], proto TCP (6), length 325)
    127.0.0.1.42738 > 127.0.0.1.11450: Flags [P.], cksum 0xff39 (incorrect -> 0x92ee), seq 611:884, ack 4598, win 512, options [nop,nop,TS val 760257291 ecr 760257291], length 273
2022-04-05 01:36:52.919837 IP (tos 0x0, ttl 64, id 6753, offset 0, flags [DF], proto TCP (6), length 52)
    127.0.0.1.11450 > 127.0.0.1.42738: Flags [.], cksum 0xfe28 (incorrect -> 0x5a9d), seq 4598, ack 884, win 510, options [nop,nop,TS val 760257291 ecr 760257291], length 0
2022-04-05 01:36:53.063868 IP (tos 0x0, ttl 64, id 6754, offset 0, flags [DF], proto TCP (6), length 210)
    127.0.0.1.11450 > 127.0.0.1.42738: Flags [P.], cksum 0xfec6 (incorrect -> 0x2afd), seq 4598:4756, ack 884, win 512, options [nop,nop,TS val 760257435 ecr 760257291], length 158
2022-04-05 01:36:53.063875 IP (tos 0x0, ttl 64, id 21853, offset 0, flags [DF], proto TCP (6), length 52)
    127.0.0.1.42738 > 127.0.0.1.11450: Flags [.], cksum 0xfe28 (incorrect -> 0x58de), seq 884, ack 4756, win 511, options [nop,nop,TS val 760257435 ecr 760257435], length 0
2022-04-05 01:36:53.072555 IP (tos 0x0, ttl 64, id 6755, offset 0, flags [DF], proto TCP (6), length 3538)
    127.0.0.1.11450 > 127.0.0.1.42738: Flags [P.], cksum 0x0bc7 (incorrect -> 0xa0bb), seq 4756:8242, ack 884, win 512, options [nop,nop,TS val 760257444 ecr 760257435], length 3486
2022-04-05 01:36:53.072560 IP (tos 0x0, ttl 64, id 21854, offset 0, flags [DF], proto TCP (6), length 52)
    127.0.0.1.42738 > 127.0.0.1.11450: Flags [.], cksum 0xfe28 (incorrect -> 0x4b3f), seq 884, ack 8242, win 494, options [nop,nop,TS val 760257444 ecr 760257444], length 0
2022-04-05 01:36:53.084550 IP (tos 0x0, ttl 64, id 6756, offset 0, flags [DF], proto TCP (6), length 4036)
    127.0.0.1.11450 > 127.0.0.1.42738: Flags [P.], cksum 0x0db9 (incorrect -> 0xffb4), seq 8242:12226, ack 884, win 512, options [nop,nop,TS val 760257456 ecr 760257444], length 3984
2022-04-05 01:36:53.084554 IP (tos 0x0, ttl 64, id 21855, offset 0, flags [DF], proto TCP (6), length 52)
    127.0.0.1.42738 > 127.0.0.1.11450: Flags [.], cksum 0xfe28 (incorrect -> 0x3b99), seq 884, ack 12226, win 492, options [nop,nop,TS val 760257456 ecr 760257456], length 0
2022-04-05 01:36:53.089093 IP (tos 0x0, ttl 64, id 6757, offset 0, flags [DF], proto TCP (6), length 3538)
    127.0.0.1.11450 > 127.0.0.1.42738: Flags [P.], cksum 0x0bc7 (incorrect -> 0xdb6d), seq 12226:15712, ack 884, win 512, options [nop,nop,TS val 760257460 ecr 760257456], length 3486
2022-04-05 01:36:53.089102 IP (tos 0x0, ttl 64, id 21856, offset 0, flags [DF], proto TCP (6), length 52)
    127.0.0.1.42738 > 127.0.0.1.11450: Flags [.], cksum 0xfe28 (incorrect -> 0x2df1), seq 884, ack 15712, win 494, options [nop,nop,TS val 760257460 ecr 760257460], length 0
2022-04-05 01:36:53.099650 IP (tos 0x0, ttl 64, id 6758, offset 0, flags [DF], proto TCP (6), length 4074)
    127.0.0.1.11450 > 127.0.0.1.42738: Flags [P.], cksum 0x0ddf (incorrect -> 0x7828), seq 15712:19734, ack 884, win 512, options [nop,nop,TS val 760257471 ecr 760257460], length 4022
2022-04-05 01:36:53.099655 IP (tos 0x0, ttl 64, id 21857, offset 0, flags [DF], proto TCP (6), length 52)
    127.0.0.1.42738 > 127.0.0.1.11450: Flags [.], cksum 0xfe28 (incorrect -> 0x1e27), seq 884, ack 19734, win 492, options [nop,nop,TS val 760257471 ecr 760257471], length 0
2022-04-05 01:36:53.099743 IP (tos 0x0, ttl 64, id 6759, offset 0, flags [DF], proto TCP (6), length 4100)
    127.0.0.1.11450 > 127.0.0.1.42738: Flags [P.], cksum 0x0df9 (incorrect -> 0xba9d), seq 19734:23782, ack 884, win 512, options [nop,nop,TS val 760257471 ecr 760257471], length 4048
2022-04-05 01:36:53.099747 IP (tos 0x0, ttl 64, id 21858, offset 0, flags [DF], proto TCP (6), length 52)
    127.0.0.1.42738 > 127.0.0.1.11450: Flags [.], cksum 0xfe28 (incorrect -> 0x0e67), seq 884, ack 23782, win 476, options [nop,nop,TS val 760257471 ecr 760257471], length 0
2022-04-05 01:36:53.099752 IP (tos 0x0, ttl 64, id 6760, offset 0, flags [DF], proto TCP (6), length 3742)
    127.0.0.1.11450 > 127.0.0.1.42738: Flags [P.], cksum 0x0c93 (incorrect -> 0x2589), seq 23782:27472, ack 884, win 512, options [nop,nop,TS val 760257471 ecr 760257471], length 3690
2022-04-05 01:36:53.099754 IP (tos 0x0, ttl 64, id 21859, offset 0, flags [DF], proto TCP (6), length 52)
    127.0.0.1.42738 > 127.0.0.1.11450: Flags [.], cksum 0xfe28 (incorrect -> 0x000b), seq 884, ack 27472, win 462, options [nop,nop,TS val 760257471 ecr 760257471], length 0
2022-04-05 01:36:53.105260 IP (tos 0x0, ttl 64, id 6761, offset 0, flags [DF], proto TCP (6), length 2450)
    127.0.0.1.11450 > 127.0.0.1.42738: Flags [P.], cksum 0x0787 (incorrect -> 0x1698), seq 27472:29870, ack 884, win 512, options [nop,nop,TS val 760257476 ecr 760257471], length 2398
2022-04-05 01:36:53.105265 IP (tos 0x0, ttl 64, id 21860, offset 0, flags [DF], proto TCP (6), length 52)
    127.0.0.1.42738 > 127.0.0.1.11450: Flags [.], cksum 0xfe28 (incorrect -> 0xf67e), seq 884, ack 29870, win 498, options [nop,nop,TS val 760257476 ecr 760257476], length 0
2022-04-05 01:36:53.109728 IP (tos 0x0, ttl 64, id 6762, offset 0, flags [DF], proto TCP (6), length 3492)
    127.0.0.1.11450 > 127.0.0.1.42738: Flags [P.], cksum 0x0b99 (incorrect -> 0x5db8), seq 29870:33310, ack 884, win 512, options [nop,nop,TS val 760257481 ecr 760257476], length 3440
2022-04-05 01:36:53.109739 IP (tos 0x0, ttl 64, id 21861, offset 0, flags [DF], proto TCP (6), length 52)
    127.0.0.1.42738 > 127.0.0.1.11450: Flags [.], cksum 0xfe28 (incorrect -> 0xe8f6), seq 884, ack 33310, win 512, options [nop,nop,TS val 760257481 ecr 760257481], length 0
2022-04-05 01:36:53.129678 IP (tos 0x0, ttl 64, id 6763, offset 0, flags [DF], proto TCP (6), length 4100)
    127.0.0.1.11450 > 127.0.0.1.42738: Flags [P.], cksum 0x0df9 (incorrect -> 0xd21f), seq 33310:37358, ack 884, win 512, options [nop,nop,TS val 760257501 ecr 760257481], length 4048
2022-04-05 01:36:53.163880 IP (tos 0x0, ttl 64, id 6764, offset 0, flags [DF], proto TCP (6), length 32820)
    127.0.0.1.11450 > 127.0.0.1.42738: Flags [.], cksum 0x7e29 (incorrect -> 0x2350), seq 37358:70126, ack 884, win 512, options [nop,nop,TS val 760257535 ecr 760257481], length 32768
2022-04-05 01:36:53.163886 IP (tos 0x0, ttl 64, id 21862, offset 0, flags [DF], proto TCP (6), length 52)
    127.0.0.1.42738 > 127.0.0.1.11450: Flags [.], cksum 0xfe28 (incorrect -> 0x5961), seq 884, ack 70126, win 379, options [nop,nop,TS val 760257535 ecr 760257501], length 0
2022-04-05 01:36:53.163892 IP (tos 0x0, ttl 64, id 6765, offset 0, flags [DF], proto TCP (6), length 1980)
    127.0.0.1.11450 > 127.0.0.1.42738: Flags [P.], cksum 0x05b1 (incorrect -> 0xf01c), seq 70126:72054, ack 884, win 512, options [nop,nop,TS val 760257535 ecr 760257535], length 1928
2022-04-05 01:36:53.165114 IP (tos 0x0, ttl 64, id 21863, offset 0, flags [DF], proto TCP (6), length 52)
    127.0.0.1.42738 > 127.0.0.1.11450: Flags [.], cksum 0xfe28 (incorrect -> 0x5131), seq 884, ack 72054, win 512, options [nop,nop,TS val 760257536 ecr 760257535], length 0
2022-04-05 01:36:53.165121 IP (tos 0x0, ttl 64, id 6766, offset 0, flags [DF], proto TCP (6), length 7100)
    127.0.0.1.11450 > 127.0.0.1.42738: Flags [P.], cksum 0x19b1 (incorrect -> 0x8e9b), seq 72054:79102, ack 884, win 512, options [nop,nop,TS val 760257536 ecr 760257536], length 7048
2022-04-05 01:36:53.165124 IP (tos 0x0, ttl 64, id 21864, offset 0, flags [DF], proto TCP (6), length 52)
    127.0.0.1.42738 > 127.0.0.1.11450: Flags [.], cksum 0xfe28 (incorrect -> 0x35a8), seq 884, ack 79102, win 512, options [nop,nop,TS val 760257536 ecr 760257536], length 0
2022-04-05 01:36:53.171100 IP (tos 0x0, ttl 64, id 6767, offset 0, flags [DF], proto TCP (6), length 2496)
    127.0.0.1.11450 > 127.0.0.1.42738: Flags [P.], cksum 0x07b5 (incorrect -> 0xe425), seq 79102:81546, ack 884, win 512, options [nop,nop,TS val 760257542 ecr 760257536], length 2444
2022-04-05 01:36:53.171111 IP (tos 0x0, ttl 64, id 21865, offset 0, flags [DF], proto TCP (6), length 52)
    127.0.0.1.42738 > 127.0.0.1.11450: Flags [.], cksum 0xfe28 (incorrect -> 0x2c10), seq 884, ack 81546, win 512, options [nop,nop,TS val 760257542 ecr 760257542], length 0
2022-04-05 01:36:53.191814 IP (tos 0x0, ttl 64, id 6768, offset 0, flags [DF], proto TCP (6), length 4100)
    127.0.0.1.11450 > 127.0.0.1.42738: Flags [P.], cksum 0x0df9 (incorrect -> 0xd287), seq 81546:85594, ack 884, win 512, options [nop,nop,TS val 760257563 ecr 760257542], length 4048
2022-04-05 01:36:53.191833 IP (tos 0x0, ttl 64, id 21866, offset 0, flags [DF], proto TCP (6), length 52)
    127.0.0.1.42738 > 127.0.0.1.11450: Flags [.], cksum 0xfe28 (incorrect -> 0x1c16), seq 884, ack 85594, win 512, options [nop,nop,TS val 760257563 ecr 760257563], length 0
2022-04-05 01:36:53.191837 IP (tos 0x0, ttl 64, id 6769, offset 0, flags [DF], proto TCP (6), length 3474)
    127.0.0.1.11450 > 127.0.0.1.42738: Flags [P.], cksum 0x0b87 (incorrect -> 0xf2db), seq 85594:89016, ack 884, win 512, options [nop,nop,TS val 760257563 ecr 760257563], length 3422
2022-04-05 01:36:53.192205 IP (tos 0x0, ttl 64, id 21867, offset 0, flags [DF], proto TCP (6), length 52)
    127.0.0.1.42738 > 127.0.0.1.11450: Flags [.], cksum 0xfe28 (incorrect -> 0x0eb8), seq 884, ack 89016, win 512, options [nop,nop,TS val 760257563 ecr 760257563], length 0
2022-04-05 01:36:53.195093 IP (tos 0x0, ttl 64, id 6770, offset 0, flags [DF], proto TCP (6), length 4100)
    127.0.0.1.11450 > 127.0.0.1.42738: Flags [P.], cksum 0x0df9 (incorrect -> 0xda3d), seq 89016:93064, ack 884, win 512, options [nop,nop,TS val 760257566 ecr 760257563], length 4048
2022-04-05 01:36:53.195176 IP (tos 0x0, ttl 64, id 21868, offset 0, flags [DF], proto TCP (6), length 52)
    127.0.0.1.42738 > 127.0.0.1.11450: Flags [.], cksum 0xfe28 (incorrect -> 0xfee1), seq 884, ack 93064, win 512, options [nop,nop,TS val 760257566 ecr 760257566], length 0
2022-04-05 01:36:53.195182 IP (tos 0x0, ttl 64, id 6771, offset 0, flags [DF], proto TCP (6), length 6998)
    127.0.0.1.11450 > 127.0.0.1.42738: Flags [P.], cksum 0x194b (incorrect -> 0xb68e), seq 93064:100010, ack 884, win 512, options [nop,nop,TS val 760257566 ecr 760257566], length 6946
2022-04-05 01:36:53.195186 IP (tos 0x0, ttl 64, id 21869, offset 0, flags [DF], proto TCP (6), length 52)
    127.0.0.1.42738 > 127.0.0.1.11450: Flags [.], cksum 0xfe28 (incorrect -> 0xe3bf), seq 884, ack 100010, win 512, options [nop,nop,TS val 760257566 ecr 760257566], length 0
2022-04-05 01:36:53.212398 IP (tos 0x0, ttl 64, id 6772, offset 0, flags [DF], proto TCP (6), length 4036)
    127.0.0.1.11450 > 127.0.0.1.42738: Flags [P.], cksum 0x0db9 (incorrect -> 0x8d76), seq 100010:103994, ack 884, win 512, options [nop,nop,TS val 760257584 ecr 760257566], length 3984
2022-04-05 01:36:53.212599 IP (tos 0x0, ttl 64, id 21870, offset 0, flags [DF], proto TCP (6), length 52)
    127.0.0.1.42738 > 127.0.0.1.11450: Flags [.], cksum 0xfe28 (incorrect -> 0xd40b), seq 884, ack 103994, win 512, options [nop,nop,TS val 760257584 ecr 760257584], length 0
2022-04-05 01:36:53.225120 IP (tos 0x0, ttl 64, id 6773, offset 0, flags [DF], proto TCP (6), length 4100)
    127.0.0.1.11450 > 127.0.0.1.42738: Flags [P.], cksum 0x0df9 (incorrect -> 0x94b3), seq 103994:108042, ack 884, win 512, options [nop,nop,TS val 760257596 ecr 760257584], length 4048
2022-04-05 01:36:53.225234 IP (tos 0x0, ttl 64, id 21871, offset 0, flags [DF], proto TCP (6), length 52)
    127.0.0.1.42738 > 127.0.0.1.11450: Flags [.], cksum 0xfe28 (incorrect -> 0xc423), seq 884, ack 108042, win 512, options [nop,nop,TS val 760257596 ecr 760257596], length 0
2022-04-05 01:36:53.225243 IP (tos 0x0, ttl 64, id 6774, offset 0, flags [DF], proto TCP (6), length 10208)
    127.0.0.1.11450 > 127.0.0.1.42738: Flags [P.], cksum 0x25d5 (incorrect -> 0xa35a), seq 108042:118198, ack 884, win 512, options [nop,nop,TS val 760257596 ecr 760257596], length 10156
2022-04-05 01:36:53.225250 IP (tos 0x0, ttl 64, id 21872, offset 0, flags [DF], proto TCP (6), length 52)
    127.0.0.1.42738 > 127.0.0.1.11450: Flags [.], cksum 0xfe28 (incorrect -> 0x9c77), seq 884, ack 118198, win 512, options [nop,nop,TS val 760257596 ecr 760257596], length 0
2022-04-05 01:36:53.225415 IP (tos 0x0, ttl 64, id 6775, offset 0, flags [DF], proto TCP (6), length 4100)
    127.0.0.1.11450 > 127.0.0.1.42738: Flags [P.], cksum 0x0df9 (incorrect -> 0x8309), seq 118198:122246, ack 884, win 512, options [nop,nop,TS val 760257597 ecr 760257596], length 4048
2022-04-05 01:36:53.225843 IP (tos 0x0, ttl 64, id 21873, offset 0, flags [DF], proto TCP (6), length 52)
    127.0.0.1.42738 > 127.0.0.1.11450: Flags [.], cksum 0xfe28 (incorrect -> 0x8ca5), seq 884, ack 122246, win 512, options [nop,nop,TS val 760257597 ecr 760257597], length 0
200, 125.2676031589508, 0.5621905326843262