2022-04-05 07:11:10.073493 IP (tos 0x0, ttl 64, id 25476, offset 0, flags [DF], proto TCP (6), length 60)
    127.0.0.1.58746 > 127.0.0.1.9950: Flags [S], cksum 0xfe30 (incorrect -> 0xb26a), seq 140030742, win 65495, options [mss 65495,sackOK,TS val 780314445 ecr 0,nop,wscale 7], length 0
2022-04-05 07:11:10.073507 IP (tos 0x0, ttl 64, id 0, offset 0, flags [DF], proto TCP (6), length 60)
    127.0.0.1.9950 > 127.0.0.1.58746: Flags [S.], cksum 0xfe30 (incorrect -> 0xf323), seq 1489866916, ack 140030743, win 65483, options [mss 65495,sackOK,TS val 780314445 ecr 780314445,nop,wscale 7], length 0
2022-04-05 07:11:10.073518 IP (tos 0x0, ttl 64, id 25477, offset 0, flags [DF], proto TCP (6), length 52)
    127.0.0.1.58746 > 127.0.0.1.9950: Flags [.], cksum 0xfe28 (incorrect -> 0x19e0), seq 1, ack 1, win 512, options [nop,nop,TS val 780314445 ecr 780314445], length 0
2022-04-05 07:11:10.073655 IP (tos 0x0, ttl 64, id 25478, offset 0, flags [DF], proto TCP (6), length 55)
    127.0.0.1.58746 > 127.0.0.1.9950: Flags [P.], cksum 0xfe2b (incorrect -> 0x14d4), seq 1:4, ack 1, win 512, options [nop,nop,TS val 780314445 ecr 780314445], length 3
2022-04-05 07:11:10.073678 IP (tos 0x0, ttl 64, id 10941, offset 0, flags [DF], proto TCP (6), length 52)
    127.0.0.1.9950 > 127.0.0.1.58746: Flags [.], cksum 0xfe28 (incorrect -> 0x19dd), seq 1, ack 4, win 512, options [nop,nop,TS val 780314445 ecr 780314445], length 0
2022-04-05 07:11:10.073710 IP (tos 0x0, ttl 64, id 10942, offset 0, flags [DF], proto TCP (6), length 54)
    127.0.0.1.9950 > 127.0.0.1.58746: Flags [P.], cksum 0xfe2a (incorrect -> 0x14d3), seq 1:3, ack 4, win 512, options [nop,nop,TS val 780314445 ecr 780314445], length 2
2022-04-05 07:11:10.073722 IP (tos 0x0, ttl 64, id 25479, offset 0, flags [DF], proto TCP (6), length 52)
    127.0.0.1.58746 > 127.0.0.1.9950: Flags [.], cksum 0xfe28 (incorrect -> 0x19db), seq 4, ack 3, win 512, options [nop,nop,TS val 780314445 ecr 780314445], length 0
2022-04-05 07:11:10.085632 IP (tos 0x0, ttl 64, id 25480, offset 0, flags [DF], proto TCP (6), length 62)
    127.0.0.1.58746 > 127.0.0.1.9950: Flags [P.], cksum 0xfe32 (incorrect -> 0x4536), seq 4:14, ack 3, win 512, options [nop,nop,TS val 780314457 ecr 780314445], length 10
2022-04-05 07:11:10.085652 IP (tos 0x0, ttl 64, id 10943, offset 0, flags [DF], proto TCP (6), length 52)
    127.0.0.1.9950 > 127.0.0.1.58746: Flags [.], cksum 0xfe28 (incorrect -> 0x19b9), seq 3, ack 14, win 512, options [nop,nop,TS val 780314457 ecr 780314457], length 0
2022-04-05 07:11:10.168047 IP (tos 0x0, ttl 64, id 10944, offset 0, flags [DF], proto TCP (6), length 62)
    127.0.0.1.9950 > 127.0.0.1.58746: Flags [P.], cksum 0xfe32 (incorrect -> 0x1454), seq 3:13, ack 14, win 512, options [nop,nop,TS val 780314539 ecr 780314457], length 10
2022-04-05 07:11:10.168058 IP (tos 0x0, ttl 64, id 25481, offset 0, flags [DF], proto TCP (6), length 52)
    127.0.0.1.58746 > 127.0.0.1.9950: Flags [.], cksum 0xfe28 (incorrect -> 0x190b), seq 14, ack 13, win 512, options [nop,nop,TS val 780314539 ecr 780314539], length 0
2022-04-05 07:11:10.175223 IP (tos 0x0, ttl 64, id 25482, offset 0, flags [DF], proto TCP (6), length 569)
    127.0.0.1.58746 > 127.0.0.1.9950: Flags [P.], cksum 0x002e (incorrect -> 0x3f4f), seq 14:531, ack 13, win 512, options [nop,nop,TS val 780314546 ecr 780314539], length 517
2022-04-05 07:11:10.175239 IP (tos 0x0, ttl 64, id 10945, offset 0, flags [DF], proto TCP (6), length 52)
    127.0.0.1.9950 > 127.0.0.1.58746: Flags [.], cksum 0xfe28 (incorrect -> 0x16fc), seq 13, ack 531, win 508, options [nop,nop,TS val 780314546 ecr 780314546], length 0
200, 4.861147880554199, 0.6966753005981445