2022-04-05 05:19:56.353703 IP (tos 0x0, ttl 64, id 59522, offset 0, flags [DF], proto TCP (6), length 60)
    127.0.0.1.53536 > 127.0.0.1.9150: Flags [S], cksum 0xfe30 (incorrect -> 0x3160), seq 5646651, win 65495, options [mss 65495,sackOK,TS val 773640725 ecr 0,nop,wscale 7], length 0
2022-04-05 05:19:56.353716 IP (tos 0x0, ttl 64, id 0, offset 0, flags [DF], proto TCP (6), length 60)
    127.0.0.1.9150 > 127.0.0.1.53536: Flags [S.], cksum 0xfe30 (incorrect -> 0x45eb), seq 1818656471, ack 5646652, win 65483, options [mss 65495,sackOK,TS val 773640725 ecr 773640725,nop,wscale 7], length 0
2022-04-05 05:19:56.353725 IP (tos 0x0, ttl 64, id 59523, offset 0, flags [DF], proto TCP (6), length 52)
    127.0.0.1.53536 > 127.0.0.1.9150: Flags [.], cksum 0xfe28 (incorrect -> 0x6ca7), seq 1, ack 1, win 512, options [nop,nop,TS val 773640725 ecr 773640725], length 0
2022-04-05 05:19:56.353839 IP (tos 0x0, ttl 64, id 59524, offset 0, flags [DF], proto TCP (6), length 55)
    127.0.0.1.53536 > 127.0.0.1.9150: Flags [P.], cksum 0xfe2b (incorrect -> 0x679b), seq 1:4, ack 1, win 512, options [nop,nop,TS val 773640725 ecr 773640725], length 3
2022-04-05 05:19:56.353858 IP (tos 0x0, ttl 64, id 22857, offset 0, flags [DF], proto TCP (6), length 52)
    127.0.0.1.9150 > 127.0.0.1.53536: Flags [.], cksum 0xfe28 (incorrect -> 0x6ca4), seq 1, ack 4, win 512, options [nop,nop,TS val 773640725 ecr 773640725], length 0
2022-04-05 05:19:56.353902 IP (tos 0x0, ttl 64, id 22858, offset 0, flags [DF], proto TCP (6), length 54)
    127.0.0.1.9150 > 127.0.0.1.53536: Flags [P.], cksum 0xfe2a (incorrect -> 0x679a), seq 1:3, ack 4, win 512, options [nop,nop,TS val 773640725 ecr 773640725], length 2
2022-04-05 05:19:56.353926 IP (tos 0x0, ttl 64, id 59525, offset 0, flags [DF], proto TCP (6), length 52)
    127.0.0.1.53536 > 127.0.0.1.9150: Flags [.], cksum 0xfe28 (incorrect -> 0x6ca2), seq 4, ack 3, win 512, options [nop,nop,TS val 773640725 ecr 773640725], length 0
2022-04-05 05:19:56.365896 IP (tos 0x0, ttl 64, id 59526, offset 0, flags [DF], proto TCP (6), length 62)
    127.0.0.1.53536 > 127.0.0.1.9150: Flags [P.], cksum 0xfe32 (incorrect -> 0x4d9f), seq 4:14, ack 3, win 512, options [nop,nop,TS val 773640737 ecr 773640725], length 10
2022-04-05 05:19:56.365921 IP (tos 0x0, ttl 64, id 22859, offset 0, flags [DF], proto TCP (6), length 52)
    127.0.0.1.9150 > 127.0.0.1.53536: Flags [.], cksum 0xfe28 (incorrect -> 0x6c80), seq 3, ack 14, win 512, options [nop,nop,TS val 773640737 ecr 773640737], length 0
2022-04-05 05:19:56.432369 IP (tos 0x0, ttl 64, id 22860, offset 0, flags [DF], proto TCP (6), length 62)
    127.0.0.1.9150 > 127.0.0.1.53536: Flags [P.], cksum 0xfe32 (incorrect -> 0x672b), seq 3:13, ack 14, win 512, options [nop,nop,TS val 773640803 ecr 773640737], length 10
2022-04-05 05:19:56.432389 IP (tos 0x0, ttl 64, id 59527, offset 0, flags [DF], proto TCP (6), length 52)
    127.0.0.1.53536 > 127.0.0.1.9150: Flags [.], cksum 0xfe28 (incorrect -> 0x6bf2), seq 14, ack 13, win 512, options [nop,nop,TS val 773640803 ecr 773640803], length 0
2022-04-05 05:19:56.438424 IP (tos 0x0, ttl 64, id 59528, offset 0, flags [DF], proto TCP (6), length 569)
    127.0.0.1.53536 > 127.0.0.1.9150: Flags [P.], cksum 0x002e (incorrect -> 0x8d87), seq 14:531, ack 13, win 512, options [nop,nop,TS val 773640810 ecr 773640803], length 517
2022-04-05 05:19:56.438446 IP (tos 0x0, ttl 64, id 22861, offset 0, flags [DF], proto TCP (6), length 52)
    127.0.0.1.9150 > 127.0.0.1.53536: Flags [.], cksum 0xfe28 (incorrect -> 0x69e3), seq 13, ack 531, win 508, options [nop,nop,TS val 773640810 ecr 773640810], length 0
2022-04-05 05:19:56.504280 IP (tos 0x0, ttl 64, id 22862, offset 0, flags [DF], proto TCP (6), length 3538)
    127.0.0.1.9150 > 127.0.0.1.53536: Flags [P.], cksum 0x0bc7 (incorrect -> 0x0b60), seq 13:3499, ack 531, win 512, options [nop,nop,TS val 773640875 ecr 773640810], length 3486
2022-04-05 05:19:56.504303 IP (tos 0x0, ttl 64, id 59529, offset 0, flags [DF], proto TCP (6), length 52)
    127.0.0.1.53536 > 127.0.0.1.9150: Flags [.], cksum 0xfe28 (incorrect -> 0x5bd1), seq 531, ack 3499, win 494, options [nop,nop,TS val 773640875 ecr 773640875], length 0
200, 4.491732358932495, 0.34481358528137207