2022-04-05 12:41:38.039035 IP (tos 0x0, ttl 64, id 13327, offset 0, flags [DF], proto TCP (6), length 60)
    127.0.0.1.45614 > 127.0.0.1.9650: Flags [S], cksum 0xfe30 (incorrect -> 0xb1f6), seq 372282214, win 65495, options [mss 65495,sackOK,TS val 244780541 ecr 0,nop,wscale 7], length 0
2022-04-05 12:41:38.039047 IP (tos 0x0, ttl 64, id 0, offset 0, flags [DF], proto TCP (6), length 60)
    127.0.0.1.9650 > 127.0.0.1.45614: Flags [S.], cksum 0xfe30 (incorrect -> 0x2ee6), seq 3929766971, ack 372282215, win 65483, options [mss 65495,sackOK,TS val 244780541 ecr 244780541,nop,wscale 7], length 0
2022-04-05 12:41:38.039055 IP (tos 0x0, ttl 64, id 13328, offset 0, flags [DF], proto TCP (6), length 52)
    127.0.0.1.45614 > 127.0.0.1.9650: Flags [.], cksum 0xfe28 (incorrect -> 0x55a2), seq 1, ack 1, win 512, options [nop,nop,TS val 244780541 ecr 244780541], length 0
2022-04-05 12:41:38.039173 IP (tos 0x0, ttl 64, id 13329, offset 0, flags [DF], proto TCP (6), length 55)
    127.0.0.1.45614 > 127.0.0.1.9650: Flags [P.], cksum 0xfe2b (incorrect -> 0x5095), seq 1:4, ack 1, win 512, options [nop,nop,TS val 244780542 ecr 244780541], length 3
2022-04-05 12:41:38.039182 IP (tos 0x0, ttl 64, id 5093, offset 0, flags [DF], proto TCP (6), length 52)
    127.0.0.1.9650 > 127.0.0.1.45614: Flags [.], cksum 0xfe28 (incorrect -> 0x559d), seq 1, ack 4, win 512, options [nop,nop,TS val 244780542 ecr 244780542], length 0
2022-04-05 12:41:38.039205 IP (tos 0x0, ttl 64, id 5094, offset 0, flags [DF], proto TCP (6), length 54)
    127.0.0.1.9650 > 127.0.0.1.45614: Flags [P.], cksum 0xfe2a (incorrect -> 0x5093), seq 1:3, ack 4, win 512, options [nop,nop,TS val 244780542 ecr 244780542], length 2
2022-04-05 12:41:38.039217 IP (tos 0x0, ttl 64, id 13330, offset 0, flags [DF], proto TCP (6), length 52)
    127.0.0.1.45614 > 127.0.0.1.9650: Flags [.], cksum 0xfe28 (incorrect -> 0x559b), seq 4, ack 3, win 512, options [nop,nop,TS val 244780542 ecr 244780542], length 0
2022-04-05 12:41:38.041354 IP (tos 0x0, ttl 64, id 13331, offset 0, flags [DF], proto TCP (6), length 62)
    127.0.0.1.45614 > 127.0.0.1.9650: Flags [P.], cksum 0xfe32 (incorrect -> 0xe187), seq 4:14, ack 3, win 512, options [nop,nop,TS val 244780544 ecr 244780542], length 10
2022-04-05 12:41:38.041363 IP (tos 0x0, ttl 64, id 5095, offset 0, flags [DF], proto TCP (6), length 52)
    127.0.0.1.9650 > 127.0.0.1.45614: Flags [.], cksum 0xfe28 (incorrect -> 0x558d), seq 3, ack 14, win 512, options [nop,nop,TS val 244780544 ecr 244780544], length 0
2022-04-05 12:41:38.103728 IP (tos 0x0, ttl 64, id 5096, offset 0, flags [DF], proto TCP (6), length 62)
    127.0.0.1.9650 > 127.0.0.1.45614: Flags [P.], cksum 0xfe32 (incorrect -> 0x503c), seq 3:13, ack 14, win 512, options [nop,nop,TS val 244780606 ecr 244780544], length 10
2022-04-05 12:41:38.103734 IP (tos 0x0, ttl 64, id 13332, offset 0, flags [DF], proto TCP (6), length 52)
    127.0.0.1.45614 > 127.0.0.1.9650: Flags [.], cksum 0xfe28 (incorrect -> 0x5507), seq 14, ack 13, win 512, options [nop,nop,TS val 244780606 ecr 244780606], length 0
2022-04-05 12:41:38.109230 IP (tos 0x0, ttl 64, id 13333, offset 0, flags [DF], proto TCP (6), length 569)
    127.0.0.1.45614 > 127.0.0.1.9650: Flags [P.], cksum 0x002e (incorrect -> 0x64a9), seq 14:531, ack 13, win 512, options [nop,nop,TS val 244780612 ecr 244780606], length 517
2022-04-05 12:41:38.109237 IP (tos 0x0, ttl 64, id 5097, offset 0, flags [DF], proto TCP (6), length 52)
    127.0.0.1.9650 > 127.0.0.1.45614: Flags [.], cksum 0xfe28 (incorrect -> 0x52fa), seq 13, ack 531, win 508, options [nop,nop,TS val 244780612 ecr 244780612], length 0
403, 7.900158166885376, 0.2839164733886719