2022-04-05 02:40:12.041522 IP (tos 0x0, ttl 64, id 6990, offset 0, flags [DF], proto TCP (6), length 60)
    127.0.0.1.43852 > 127.0.0.1.11650: Flags [S], cksum 0xfe30 (incorrect -> 0x4f5f), seq 192502643, win 65495, options [mss 65495,sackOK,TS val 764056413 ecr 0,nop,wscale 7], length 0
2022-04-05 02:40:12.041540 IP (tos 0x0, ttl 64, id 0, offset 0, flags [DF], proto TCP (6), length 60)
    127.0.0.1.11650 > 127.0.0.1.43852: Flags [S.], cksum 0xfe30 (incorrect -> 0x48c6), seq 2357115181, ack 192502644, win 65483, options [mss 65495,sackOK,TS val 764056413 ecr 764056413,nop,wscale 7], length 0
2022-04-05 02:40:12.041554 IP (tos 0x0, ttl 64, id 6991, offset 0, flags [DF], proto TCP (6), length 52)
    127.0.0.1.43852 > 127.0.0.1.11650: Flags [.], cksum 0xfe28 (incorrect -> 0x6f82), seq 1, ack 1, win 512, options [nop,nop,TS val 764056413 ecr 764056413], length 0
2022-04-05 02:40:12.041660 IP (tos 0x0, ttl 64, id 6992, offset 0, flags [DF], proto TCP (6), length 55)
    127.0.0.1.43852 > 127.0.0.1.11650: Flags [P.], cksum 0xfe2b (incorrect -> 0x6a76), seq 1:4, ack 1, win 512, options [nop,nop,TS val 764056413 ecr 764056413], length 3
2022-04-05 02:40:12.041672 IP (tos 0x0, ttl 64, id 54874, offset 0, flags [DF], proto TCP (6), length 52)
    127.0.0.1.11650 > 127.0.0.1.43852: Flags [.], cksum 0xfe28 (incorrect -> 0x6f7f), seq 1, ack 4, win 512, options [nop,nop,TS val 764056413 ecr 764056413], length 0
2022-04-05 02:40:12.041707 IP (tos 0x0, ttl 64, id 54875, offset 0, flags [DF], proto TCP (6), length 54)
    127.0.0.1.11650 > 127.0.0.1.43852: Flags [P.], cksum 0xfe2a (incorrect -> 0x6a75), seq 1:3, ack 4, win 512, options [nop,nop,TS val 764056413 ecr 764056413], length 2
2022-04-05 02:40:12.041718 IP (tos 0x0, ttl 64, id 6993, offset 0, flags [DF], proto TCP (6), length 52)
    127.0.0.1.43852 > 127.0.0.1.11650: Flags [.], cksum 0xfe28 (incorrect -> 0x6f7d), seq 4, ack 3, win 512, options [nop,nop,TS val 764056413 ecr 764056413], length 0
2022-04-05 02:40:12.043233 IP (tos 0x0, ttl 64, id 6994, offset 0, flags [DF], proto TCP (6), length 62)
    127.0.0.1.43852 > 127.0.0.1.11650: Flags [P.], cksum 0xfe32 (incorrect -> 0x9fa8), seq 4:14, ack 3, win 512, options [nop,nop,TS val 764056414 ecr 764056413], length 10
2022-04-05 02:40:12.043240 IP (tos 0x0, ttl 64, id 54876, offset 0, flags [DF], proto TCP (6), length 52)
    127.0.0.1.11650 > 127.0.0.1.43852: Flags [.], cksum 0xfe28 (incorrect -> 0x6f71), seq 3, ack 14, win 512, options [nop,nop,TS val 764056414 ecr 764056414], length 0
2022-04-05 02:40:12.179332 IP (tos 0x0, ttl 64, id 54877, offset 0, flags [DF], proto TCP (6), length 62)
    127.0.0.1.11650 > 127.0.0.1.43852: Flags [P.], cksum 0xfe32 (incorrect -> 0x69d6), seq 3:13, ack 14, win 512, options [nop,nop,TS val 764056550 ecr 764056414], length 10
2022-04-05 02:40:12.179338 IP (tos 0x0, ttl 64, id 6995, offset 0, flags [DF], proto TCP (6), length 52)
    127.0.0.1.43852 > 127.0.0.1.11650: Flags [.], cksum 0xfe28 (incorrect -> 0x6e57), seq 14, ack 13, win 512, options [nop,nop,TS val 764056550 ecr 764056550], length 0
2022-04-05 02:40:12.184914 IP (tos 0x0, ttl 64, id 6996, offset 0, flags [DF], proto TCP (6), length 569)
    127.0.0.1.43852 > 127.0.0.1.11650: Flags [P.], cksum 0x002e (incorrect -> 0x0665), seq 14:531, ack 13, win 512, options [nop,nop,TS val 764056556 ecr 764056550], length 517
2022-04-05 02:40:12.184928 IP (tos 0x0, ttl 64, id 54878, offset 0, flags [DF], proto TCP (6), length 52)
    127.0.0.1.11650 > 127.0.0.1.43852: Flags [.], cksum 0xfe28 (incorrect -> 0x6c4a), seq 13, ack 531, win 508, options [nop,nop,TS val 764056556 ecr 764056556], length 0
200, 11.560603380203247, 1.0703237056732178