2022-04-05 06:57:37.026720 IP (tos 0x0, ttl 64, id 25610, offset 0, flags [DF], proto TCP (6), length 60)
    127.0.0.1.52830 > 127.0.0.1.9550: Flags [S], cksum 0xfe30 (incorrect -> 0x385b), seq 3338202932, win 65495, options [mss 65495,sackOK,TS val 779501398 ecr 0,nop,wscale 7], length 0
2022-04-05 06:57:37.026732 IP (tos 0x0, ttl 64, id 0, offset 0, flags [DF], proto TCP (6), length 60)
    127.0.0.1.9550 > 127.0.0.1.52830: Flags [S.], cksum 0xfe30 (incorrect -> 0xbc29), seq 3456778325, ack 3338202933, win 65483, options [mss 65495,sackOK,TS val 779501398 ecr 779501398,nop,wscale 7], length 0
2022-04-05 06:57:37.026743 IP (tos 0x0, ttl 64, id 25611, offset 0, flags [DF], proto TCP (6), length 52)
    127.0.0.1.52830 > 127.0.0.1.9550: Flags [.], cksum 0xfe28 (incorrect -> 0xe2e5), seq 1, ack 1, win 512, options [nop,nop,TS val 779501398 ecr 779501398], length 0
2022-04-05 06:57:37.026869 IP (tos 0x0, ttl 64, id 25612, offset 0, flags [DF], proto TCP (6), length 55)
    127.0.0.1.52830 > 127.0.0.1.9550: Flags [P.], cksum 0xfe2b (incorrect -> 0xddd9), seq 1:4, ack 1, win 512, options [nop,nop,TS val 779501398 ecr 779501398], length 3
2022-04-05 06:57:37.026884 IP (tos 0x0, ttl 64, id 62134, offset 0, flags [DF], proto TCP (6), length 52)
    127.0.0.1.9550 > 127.0.0.1.52830: Flags [.], cksum 0xfe28 (incorrect -> 0xe2e2), seq 1, ack 4, win 512, options [nop,nop,TS val 779501398 ecr 779501398], length 0
2022-04-05 06:57:37.026920 IP (tos 0x0, ttl 64, id 62135, offset 0, flags [DF], proto TCP (6), length 54)
    127.0.0.1.9550 > 127.0.0.1.52830: Flags [P.], cksum 0xfe2a (incorrect -> 0xddd8), seq 1:3, ack 4, win 512, options [nop,nop,TS val 779501398 ecr 779501398], length 2
2022-04-05 06:57:37.026935 IP (tos 0x0, ttl 64, id 25613, offset 0, flags [DF], proto TCP (6), length 52)
    127.0.0.1.52830 > 127.0.0.1.9550: Flags [.], cksum 0xfe28 (incorrect -> 0xe2e0), seq 4, ack 3, win 512, options [nop,nop,TS val 779501398 ecr 779501398], length 0
2022-04-05 06:57:37.038741 IP (tos 0x0, ttl 64, id 25614, offset 0, flags [DF], proto TCP (6), length 62)
    127.0.0.1.52830 > 127.0.0.1.9550: Flags [P.], cksum 0xfe32 (incorrect -> 0x52c4), seq 4:14, ack 3, win 512, options [nop,nop,TS val 779501410 ecr 779501398], length 10
2022-04-05 06:57:37.038762 IP (tos 0x0, ttl 64, id 62136, offset 0, flags [DF], proto TCP (6), length 52)
    127.0.0.1.9550 > 127.0.0.1.52830: Flags [.], cksum 0xfe28 (incorrect -> 0xe2be), seq 3, ack 14, win 512, options [nop,nop,TS val 779501410 ecr 779501410], length 0
2022-04-05 06:57:37.381228 IP (tos 0x0, ttl 64, id 62137, offset 0, flags [DF], proto TCP (6), length 62)
    127.0.0.1.9550 > 127.0.0.1.52830: Flags [P.], cksum 0xfe32 (incorrect -> 0xdc55), seq 3:13, ack 14, win 512, options [nop,nop,TS val 779501752 ecr 779501410], length 10
2022-04-05 06:57:37.381243 IP (tos 0x0, ttl 64, id 25615, offset 0, flags [DF], proto TCP (6), length 52)
    127.0.0.1.52830 > 127.0.0.1.9550: Flags [.], cksum 0xfe28 (incorrect -> 0xe008), seq 14, ack 13, win 512, options [nop,nop,TS val 779501752 ecr 779501752], length 0
2022-04-05 06:57:37.387216 IP (tos 0x0, ttl 64, id 25616, offset 0, flags [DF], proto TCP (6), length 569)
    127.0.0.1.52830 > 127.0.0.1.9550: Flags [P.], cksum 0x002e (incorrect -> 0xe059), seq 14:531, ack 13, win 512, options [nop,nop,TS val 779501758 ecr 779501752], length 517
2022-04-05 06:57:37.387227 IP (tos 0x0, ttl 64, id 62138, offset 0, flags [DF], proto TCP (6), length 52)
    127.0.0.1.9550 > 127.0.0.1.52830: Flags [.], cksum 0xfe28 (incorrect -> 0xddfb), seq 13, ack 531, win 508, options [nop,nop,TS val 779501758 ecr 779501758], length 0
2022-04-05 06:57:37.722496 IP (tos 0x0, ttl 64, id 62139, offset 0, flags [DF], proto TCP (6), length 3538)
    127.0.0.1.9550 > 127.0.0.1.52830: Flags [P.], cksum 0x0bc7 (incorrect -> 0x9e75), seq 13:3499, ack 531, win 512, options [nop,nop,TS val 779502094 ecr 779501758], length 3486
2022-04-05 06:57:37.722508 IP (tos 0x0, ttl 64, id 25617, offset 0, flags [DF], proto TCP (6), length 52)
    127.0.0.1.52830 > 127.0.0.1.9550: Flags [.], cksum 0xfe28 (incorrect -> 0xcdcb), seq 531, ack 3499, win 494, options [nop,nop,TS val 779502094 ecr 779502094], length 0
2022-04-05 06:57:37.903228 IP (tos 0x0, ttl 64, id 62140, offset 0, flags [DF], proto TCP (6), length 1151)
    127.0.0.1.9550 > 127.0.0.1.52830: Flags [P.], cksum 0x0274 (incorrect -> 0x6614), seq 3499:4598, ack 531, win 512, options [nop,nop,TS val 779502274 ecr 779502094], length 1099
2022-04-05 06:57:37.903238 IP (tos 0x0, ttl 64, id 25618, offset 0, flags [DF], proto TCP (6), length 52)
    127.0.0.1.52830 > 127.0.0.1.9550: Flags [.], cksum 0xfe28 (incorrect -> 0xc80f), seq 531, ack 4598, win 503, options [nop,nop,TS val 779502274 ecr 779502274], length 0
2022-04-05 06:57:37.903683 IP (tos 0x0, ttl 64, id 25619, offset 0, flags [DF], proto TCP (6), length 132)
    127.0.0.1.52830 > 127.0.0.1.9550: Flags [P.], cksum 0xfe78 (incorrect -> 0x9eb4), seq 531:611, ack 4598, win 512, options [nop,nop,TS val 779502275 ecr 779502274], length 80
2022-04-05 06:57:37.903691 IP (tos 0x0, ttl 64, id 62141, offset 0, flags [DF], proto TCP (6), length 52)
    127.0.0.1.9550 > 127.0.0.1.52830: Flags [.], cksum 0xfe28 (incorrect -> 0xc7b4), seq 4598, ack 611, win 512, options [nop,nop,TS val 779502275 ecr 779502275], length 0
2022-04-05 06:57:37.904005 IP (tos 0x0, ttl 64, id 25620, offset 0, flags [DF], proto TCP (6), length 286)
    127.0.0.1.52830 > 127.0.0.1.9550: Flags [P.], cksum 0xff12 (incorrect -> 0x22cf), seq 611:845, ack 4598, win 512, options [nop,nop,TS val 779502275 ecr 779502275], length 234
2022-04-05 06:57:37.904011 IP (tos 0x0, ttl 64, id 62142, offset 0, flags [DF], proto TCP (6), length 52)
    127.0.0.1.9550 > 127.0.0.1.52830: Flags [.], cksum 0xfe28 (incorrect -> 0xc6cb), seq 4598, ack 845, win 511, options [nop,nop,TS val 779502275 ecr 779502275], length 0
2022-04-05 06:57:38.244360 IP (tos 0x0, ttl 64, id 62143, offset 0, flags [DF], proto TCP (6), length 131)
    127.0.0.1.9550 > 127.0.0.1.52830: Flags [P.], cksum 0xfe77 (incorrect -> 0x53ea), seq 4598:4677, ack 845, win 512, options [nop,nop,TS val 779502615 ecr 779502275], length 79
2022-04-05 06:57:38.244377 IP (tos 0x0, ttl 64, id 25621, offset 0, flags [DF], proto TCP (6), length 52)
    127.0.0.1.52830 > 127.0.0.1.9550: Flags [.], cksum 0xfe28 (incorrect -> 0xc3d3), seq 845, ack 4677, win 512, options [nop,nop,TS val 779502615 ecr 779502615], length 0
2022-04-05 06:57:38.246880 IP (tos 0x0, ttl 64, id 62144, offset 0, flags [DF], proto TCP (6), length 3119)
    127.0.0.1.9550 > 127.0.0.1.52830: Flags [P.], cksum 0x0a24 (incorrect -> 0x5a45), seq 4677:7744, ack 845, win 512, options [nop,nop,TS val 779502618 ecr 779502615], length 3067
2022-04-05 06:57:38.246887 IP (tos 0x0, ttl 64, id 25622, offset 0, flags [DF], proto TCP (6), length 52)
    127.0.0.1.52830 > 127.0.0.1.9550: Flags [.], cksum 0xfe28 (incorrect -> 0xb7e2), seq 845, ack 7744, win 496, options [nop,nop,TS val 779502618 ecr 779502618], length 0
2022-04-05 06:57:38.248249 IP (tos 0x0, ttl 64, id 62145, offset 0, flags [DF], proto TCP (6), length 1048)
    127.0.0.1.9550 > 127.0.0.1.52830: Flags [P.], cksum 0x020d (incorrect -> 0x061e), seq 7744:8740, ack 845, win 512, options [nop,nop,TS val 779502619 ecr 779502618], length 996
2022-04-05 06:57:38.248255 IP (tos 0x0, ttl 64, id 25623, offset 0, flags [DF], proto TCP (6), length 52)
    127.0.0.1.52830 > 127.0.0.1.9550: Flags [.], cksum 0xfe28 (incorrect -> 0xb3f4), seq 845, ack 8740, win 504, options [nop,nop,TS val 779502619 ecr 779502619], length 0
2022-04-05 06:57:38.258077 IP (tos 0x0, ttl 64, id 62146, offset 0, flags [DF], proto TCP (6), length 4100)
    127.0.0.1.9550 > 127.0.0.1.52830: Flags [P.], cksum 0x0df9 (incorrect -> 0x41fb), seq 8740:12788, ack 845, win 512, options [nop,nop,TS val 779502629 ecr 779502619], length 4048
2022-04-05 06:57:38.258083 IP (tos 0x0, ttl 64, id 25624, offset 0, flags [DF], proto TCP (6), length 52)
    127.0.0.1.52830 > 127.0.0.1.9550: Flags [.], cksum 0xfe28 (incorrect -> 0xa41c), seq 845, ack 12788, win 492, options [nop,nop,TS val 779502629 ecr 779502629], length 0
2022-04-05 06:57:38.258089 IP (tos 0x0, ttl 64, id 62147, offset 0, flags [DF], proto TCP (6), length 486)
    127.0.0.1.9550 > 127.0.0.1.52830: Flags [P.], cksum 0xffda (incorrect -> 0x20da), seq 12788:13222, ack 845, win 512, options [nop,nop,TS val 779502629 ecr 779502629], length 434
2022-04-05 06:57:38.258093 IP (tos 0x0, ttl 64, id 25625, offset 0, flags [DF], proto TCP (6), length 52)
    127.0.0.1.52830 > 127.0.0.1.9550: Flags [.], cksum 0xfe28 (incorrect -> 0xa26c), seq 845, ack 13222, win 490, options [nop,nop,TS val 779502629 ecr 779502629], length 0
2022-04-05 06:57:38.271820 IP (tos 0x0, ttl 64, id 62148, offset 0, flags [DF], proto TCP (6), length 2764)
    127.0.0.1.9550 > 127.0.0.1.52830: Flags [P.], cksum 0x08c1 (incorrect -> 0xb5e4), seq 13222:15934, ack 845, win 512, options [nop,nop,TS val 779502643 ecr 779502629], length 2712
2022-04-05 06:57:38.271827 IP (tos 0x0, ttl 64, id 25626, offset 0, flags [DF], proto TCP (6), length 52)
    127.0.0.1.52830 > 127.0.0.1.9550: Flags [.], cksum 0xfe28 (incorrect -> 0x97b1), seq 845, ack 15934, win 497, options [nop,nop,TS val 779502643 ecr 779502643], length 0
2022-04-05 06:57:38.397548 IP (tos 0x0, ttl 64, id 62149, offset 0, flags [DF], proto TCP (6), length 3944)
    127.0.0.1.9550 > 127.0.0.1.52830: Flags [P.], cksum 0x0d5d (incorrect -> 0x05da), seq 15934:19826, ack 845, win 512, options [nop,nop,TS val 779502769 ecr 779502643], length 3892
2022-04-05 06:57:38.397562 IP (tos 0x0, ttl 64, id 25627, offset 0, flags [DF], proto TCP (6), length 52)
    127.0.0.1.52830 > 127.0.0.1.9550: Flags [.], cksum 0xfe28 (incorrect -> 0x8786), seq 845, ack 19826, win 492, options [nop,nop,TS val 779502769 ecr 779502769], length 0
2022-04-05 06:57:38.398940 IP (tos 0x0, ttl 64, id 62150, offset 0, flags [DF], proto TCP (6), length 4100)
    127.0.0.1.9550 > 127.0.0.1.52830: Flags [P.], cksum 0x0df9 (incorrect -> 0xee7c), seq 19826:23874, ack 845, win 512, options [nop,nop,TS val 779502770 ecr 779502769], length 4048
2022-04-05 06:57:38.398947 IP (tos 0x0, ttl 64, id 25628, offset 0, flags [DF], proto TCP (6), length 52)
    127.0.0.1.52830 > 127.0.0.1.9550: Flags [.], cksum 0xfe28 (incorrect -> 0x77b4), seq 845, ack 23874, win 492, options [nop,nop,TS val 779502770 ecr 779502770], length 0
2022-04-05 06:57:38.398953 IP (tos 0x0, ttl 64, id 62151, offset 0, flags [DF], proto TCP (6), length 3290)
    127.0.0.1.9550 > 127.0.0.1.52830: Flags [P.], cksum 0x0acf (incorrect -> 0xc42f), seq 23874:27112, ack 845, win 512, options [nop,nop,TS val 779502770 ecr 779502770], length 3238
2022-04-05 06:57:38.398956 IP (tos 0x0, ttl 64, id 25629, offset 0, flags [DF], proto TCP (6), length 52)
    127.0.0.1.52830 > 127.0.0.1.9550: Flags [.], cksum 0xfe28 (incorrect -> 0x6b1b), seq 845, ack 27112, win 479, options [nop,nop,TS val 779502770 ecr 779502770], length 0
2022-04-05 06:57:38.402126 IP (tos 0x0, ttl 64, id 62152, offset 0, flags [DF], proto TCP (6), length 4100)
    127.0.0.1.9550 > 127.0.0.1.52830: Flags [P.], cksum 0x0df9 (incorrect -> 0x203a), seq 27112:31160, ack 845, win 512, options [nop,nop,TS val 779502773 ecr 779502770], length 4048
2022-04-05 06:57:38.402145 IP (tos 0x0, ttl 64, id 25630, offset 0, flags [DF], proto TCP (6), length 52)
    127.0.0.1.52830 > 127.0.0.1.9550: Flags [.], cksum 0xfe28 (incorrect -> 0x5b38), seq 845, ack 31160, win 492, options [nop,nop,TS val 779502773 ecr 779502773], length 0
2022-04-05 06:57:38.402157 IP (tos 0x0, ttl 64, id 62153, offset 0, flags [DF], proto TCP (6), length 3474)
    127.0.0.1.9550 > 127.0.0.1.52830: Flags [P.], cksum 0x0b87 (incorrect -> 0x6a59), seq 31160:34582, ack 845, win 512, options [nop,nop,TS val 779502773 ecr 779502773], length 3422
2022-04-05 06:57:38.402169 IP (tos 0x0, ttl 64, id 25631, offset 0, flags [DF], proto TCP (6), length 52)
    127.0.0.1.52830 > 127.0.0.1.9550: Flags [.], cksum 0xfe28 (incorrect -> 0x4dc6), seq 845, ack 34582, win 512, options [nop,nop,TS val 779502773 ecr 779502773], length 0
2022-04-05 06:57:38.411342 IP (tos 0x0, ttl 64, id 62154, offset 0, flags [DF], proto TCP (6), length 2542)
    127.0.0.1.9550 > 127.0.0.1.52830: Flags [P.], cksum 0x07e3 (incorrect -> 0x8630), seq 34582:37072, ack 845, win 512, options [nop,nop,TS val 779502782 ecr 779502773], length 2490
2022-04-05 06:57:38.411368 IP (tos 0x0, ttl 64, id 25632, offset 0, flags [DF], proto TCP (6), length 52)
    127.0.0.1.52830 > 127.0.0.1.9550: Flags [.], cksum 0xfe28 (incorrect -> 0x43fa), seq 845, ack 37072, win 512, options [nop,nop,TS val 779502782 ecr 779502782], length 0
2022-04-05 06:57:38.411456 IP (tos 0x0, ttl 64, id 62155, offset 0, flags [DF], proto TCP (6), length 3538)
    127.0.0.1.9550 > 127.0.0.1.52830: Flags [P.], cksum 0x0bc7 (incorrect -> 0x7430), seq 37072:40558, ack 845, win 512, options [nop,nop,TS val 779502783 ecr 779502782], length 3486
2022-04-05 06:57:38.411901 IP (tos 0x0, ttl 64, id 25633, offset 0, flags [DF], proto TCP (6), length 52)
    127.0.0.1.52830 > 127.0.0.1.9550: Flags [.], cksum 0xfe28 (incorrect -> 0x365a), seq 845, ack 40558, win 512, options [nop,nop,TS val 779502783 ecr 779502783], length 0
2022-04-05 06:57:38.425168 IP (tos 0x0, ttl 64, id 62156, offset 0, flags [DF], proto TCP (6), length 1048)
    127.0.0.1.9550 > 127.0.0.1.52830: Flags [P.], cksum 0x020d (incorrect -> 0xe67c), seq 40558:41554, ack 845, win 512, options [nop,nop,TS val 779502796 ecr 779502783], length 996
2022-04-05 06:57:38.425208 IP (tos 0x0, ttl 64, id 25634, offset 0, flags [DF], proto TCP (6), length 52)
    127.0.0.1.52830 > 127.0.0.1.9550: Flags [.], cksum 0xfe28 (incorrect -> 0x325c), seq 845, ack 41554, win 512, options [nop,nop,TS val 779502796 ecr 779502796], length 0
2022-04-05 06:57:38.548220 IP (tos 0x0, ttl 64, id 62157, offset 0, flags [DF], proto TCP (6), length 4100)
    127.0.0.1.9550 > 127.0.0.1.52830: Flags [P.], cksum 0x0df9 (incorrect -> 0x5fe5), seq 41554:45602, ack 845, win 512, options [nop,nop,TS val 779502919 ecr 779502796], length 4048
2022-04-05 06:57:38.562427 IP (tos 0x0, ttl 64, id 62158, offset 0, flags [DF], proto TCP (6), length 32820)
    127.0.0.1.9550 > 127.0.0.1.52830: Flags [.], cksum 0x7e29 (incorrect -> 0x886c), seq 45602:78370, ack 845, win 512, options [nop,nop,TS val 779502934 ecr 779502796], length 32768
2022-04-05 06:57:38.562456 IP (tos 0x0, ttl 64, id 25635, offset 0, flags [DF], proto TCP (6), length 52)
    127.0.0.1.52830 > 127.0.0.1.9550: Flags [.], cksum 0xfe28 (incorrect -> 0xa20b), seq 845, ack 78370, win 379, options [nop,nop,TS val 779502934 ecr 779502919], length 0
2022-04-05 06:57:38.562467 IP (tos 0x0, ttl 64, id 62159, offset 0, flags [DF], proto TCP (6), length 930)
    127.0.0.1.9550 > 127.0.0.1.52830: Flags [P.], cksum 0x0197 (incorrect -> 0xeb1c), seq 78370:79248, ack 845, win 512, options [nop,nop,TS val 779502934 ecr 779502934], length 878
2022-04-05 06:57:38.563263 IP (tos 0x0, ttl 64, id 25636, offset 0, flags [DF], proto TCP (6), length 52)
    127.0.0.1.52830 > 127.0.0.1.9550: Flags [.], cksum 0xfe28 (incorrect -> 0x9e09), seq 845, ack 79248, win 512, options [nop,nop,TS val 779502934 ecr 779502934], length 0
2022-04-05 06:57:38.563272 IP (tos 0x0, ttl 64, id 62160, offset 0, flags [DF], proto TCP (6), length 12984)
    127.0.0.1.9550 > 127.0.0.1.52830: Flags [P.], cksum 0x30ad (incorrect -> 0x4c51), seq 79248:92180, ack 845, win 512, options [nop,nop,TS val 779502934 ecr 779502934], length 12932
2022-04-05 06:57:38.563512 IP (tos 0x0, ttl 64, id 25637, offset 0, flags [DF], proto TCP (6), length 52)
    127.0.0.1.52830 > 127.0.0.1.9550: Flags [.], cksum 0xfe28 (incorrect -> 0x6b84), seq 845, ack 92180, win 512, options [nop,nop,TS val 779502935 ecr 779502934], length 0
2022-04-05 06:57:38.692922 IP (tos 0x0, ttl 64, id 62161, offset 0, flags [DF], proto TCP (6), length 3446)
    127.0.0.1.9550 > 127.0.0.1.52830: Flags [P.], cksum 0x0b6b (incorrect -> 0xdd9d), seq 92180:95574, ack 845, win 512, options [nop,nop,TS val 779503064 ecr 779502935], length 3394
2022-04-05 06:57:38.692963 IP (tos 0x0, ttl 64, id 25638, offset 0, flags [DF], proto TCP (6), length 52)
    127.0.0.1.52830 > 127.0.0.1.9550: Flags [.], cksum 0xfe28 (incorrect -> 0x5d3f), seq 845, ack 95574, win 512, options [nop,nop,TS val 779503064 ecr 779503064], length 0
2022-04-05 06:57:38.696967 IP (tos 0x0, ttl 64, id 62162, offset 0, flags [DF], proto TCP (6), length 3944)
    127.0.0.1.9550 > 127.0.0.1.52830: Flags [P.], cksum 0x0d5d (incorrect -> 0xdb74), seq 95574:99466, ack 845, win 512, options [nop,nop,TS val 779503068 ecr 779503064], length 3892
2022-04-05 06:57:38.697007 IP (tos 0x0, ttl 64, id 25639, offset 0, flags [DF], proto TCP (6), length 52)
    127.0.0.1.52830 > 127.0.0.1.9550: Flags [.], cksum 0xfe28 (incorrect -> 0x4e03), seq 845, ack 99466, win 512, options [nop,nop,TS val 779503068 ecr 779503068], length 0
2022-04-05 06:57:38.697050 IP (tos 0x0, ttl 64, id 62163, offset 0, flags [DF], proto TCP (6), length 3354)
    127.0.0.1.9550 > 127.0.0.1.52830: Flags [P.], cksum 0x0b0f (incorrect -> 0x1314), seq 99466:102768, ack 845, win 512, options [nop,nop,TS val 779503068 ecr 779503068], length 3302
2022-04-05 06:57:38.697078 IP (tos 0x0, ttl 64, id 25640, offset 0, flags [DF], proto TCP (6), length 52)
    127.0.0.1.52830 > 127.0.0.1.9550: Flags [.], cksum 0xfe28 (incorrect -> 0x411d), seq 845, ack 102768, win 512, options [nop,nop,TS val 779503068 ecr 779503068], length 0
2022-04-05 06:57:38.697154 IP (tos 0x0, ttl 64, id 62164, offset 0, flags [DF], proto TCP (6), length 3990)
    127.0.0.1.9550 > 127.0.0.1.52830: Flags [P.], cksum 0x0d8b (incorrect -> 0x1da9), seq 102768:106706, ack 845, win 512, options [nop,nop,TS val 779503068 ecr 779503068], length 3938
2022-04-05 06:57:38.697616 IP (tos 0x0, ttl 64, id 25641, offset 0, flags [DF], proto TCP (6), length 52)
    127.0.0.1.52830 > 127.0.0.1.9550: Flags [.], cksum 0xfe28 (incorrect -> 0x31ba), seq 845, ack 106706, win 512, options [nop,nop,TS val 779503069 ecr 779503068], length 0
2022-04-05 06:57:38.697625 IP (tos 0x0, ttl 64, id 62165, offset 0, flags [DF], proto TCP (6), length 8518)
    127.0.0.1.9550 > 127.0.0.1.52830: Flags [P.], cksum 0x1f3b (incorrect -> 0xcd35), seq 106706:115172, ack 845, win 512, options [nop,nop,TS val 779503069 ecr 779503069], length 8466
2022-04-05 06:57:38.697631 IP (tos 0x0, ttl 64, id 25642, offset 0, flags [DF], proto TCP (6), length 52)
    127.0.0.1.52830 > 127.0.0.1.9550: Flags [.], cksum 0xfe28 (incorrect -> 0x10a7), seq 845, ack 115172, win 512, options [nop,nop,TS val 779503069 ecr 779503069], length 0
2022-04-05 06:57:38.699490 IP (tos 0x0, ttl 64, id 62166, offset 0, flags [DF], proto TCP (6), length 3538)
    127.0.0.1.9550 > 127.0.0.1.52830: Flags [P.], cksum 0x0bc7 (incorrect -> 0xbb77), seq 115172:118658, ack 845, win 512, options [nop,nop,TS val 779503071 ecr 779503069], length 3486
2022-04-05 06:57:38.699524 IP (tos 0x0, ttl 64, id 25643, offset 0, flags [DF], proto TCP (6), length 52)
    127.0.0.1.52830 > 127.0.0.1.9550: Flags [.], cksum 0xfe28 (incorrect -> 0x0305), seq 845, ack 118658, win 512, options [nop,nop,TS val 779503071 ecr 779503071], length 0
2022-04-05 06:57:38.699662 IP (tos 0x0, ttl 64, id 62167, offset 0, flags [DF], proto TCP (6), length 3538)
    127.0.0.1.9550 > 127.0.0.1.52830: Flags [P.], cksum 0x0bc7 (incorrect -> 0x1eca), seq 118658:122144, ack 845, win 512, options [nop,nop,TS val 779503071 ecr 779503071], length 3486
2022-04-05 06:57:38.745416 IP (tos 0x0, ttl 64, id 25644, offset 0, flags [DF], proto TCP (6), length 52)
    127.0.0.1.52830 > 127.0.0.1.9550: Flags [.], cksum 0xfe28 (incorrect -> 0xf539), seq 845, ack 122144, win 512, options [nop,nop,TS val 779503116 ecr 779503071], length 0
200, 5.081538677215576, 1.7251806259155273