2022-04-05 11:33:24.478381 IP (tos 0x0, ttl 64, id 21736, offset 0, flags [DF], proto TCP (6), length 60)
    127.0.0.1.60502 > 127.0.0.1.12250: Flags [S], cksum 0xfe30 (incorrect -> 0x362c), seq 1185878296, win 65495, options [mss 65495,sackOK,TS val 240686981 ecr 0,nop,wscale 7], length 0
2022-04-05 11:33:24.478391 IP (tos 0x0, ttl 64, id 0, offset 0, flags [DF], proto TCP (6), length 60)
    127.0.0.1.12250 > 127.0.0.1.60502: Flags [S.], cksum 0xfe30 (incorrect -> 0xa25c), seq 2303485088, ack 1185878297, win 65483, options [mss 65495,sackOK,TS val 240686981 ecr 240686981,nop,wscale 7], length 0
2022-04-05 11:33:24.478398 IP (tos 0x0, ttl 64, id 21737, offset 0, flags [DF], proto TCP (6), length 52)
    127.0.0.1.60502 > 127.0.0.1.12250: Flags [.], cksum 0xfe28 (incorrect -> 0xc918), seq 1, ack 1, win 512, options [nop,nop,TS val 240686981 ecr 240686981], length 0
2022-04-05 11:33:24.478490 IP (tos 0x0, ttl 64, id 21738, offset 0, flags [DF], proto TCP (6), length 55)
    127.0.0.1.60502 > 127.0.0.1.12250: Flags [P.], cksum 0xfe2b (incorrect -> 0xc40c), seq 1:4, ack 1, win 512, options [nop,nop,TS val 240686981 ecr 240686981], length 3
2022-04-05 11:33:24.478504 IP (tos 0x0, ttl 64, id 45589, offset 0, flags [DF], proto TCP (6), length 52)
    127.0.0.1.12250 > 127.0.0.1.60502: Flags [.], cksum 0xfe28 (incorrect -> 0xc915), seq 1, ack 4, win 512, options [nop,nop,TS val 240686981 ecr 240686981], length 0
2022-04-05 11:33:24.478539 IP (tos 0x0, ttl 64, id 45590, offset 0, flags [DF], proto TCP (6), length 54)
    127.0.0.1.12250 > 127.0.0.1.60502: Flags [P.], cksum 0xfe2a (incorrect -> 0xc40b), seq 1:3, ack 4, win 512, options [nop,nop,TS val 240686981 ecr 240686981], length 2
2022-04-05 11:33:24.478552 IP (tos 0x0, ttl 64, id 21739, offset 0, flags [DF], proto TCP (6), length 52)
    127.0.0.1.60502 > 127.0.0.1.12250: Flags [.], cksum 0xfe28 (incorrect -> 0xc913), seq 4, ack 3, win 512, options [nop,nop,TS val 240686981 ecr 240686981], length 0
2022-04-05 11:33:24.479953 IP (tos 0x0, ttl 64, id 21740, offset 0, flags [DF], proto TCP (6), length 62)
    127.0.0.1.60502 > 127.0.0.1.12250: Flags [P.], cksum 0xfe32 (incorrect -> 0x4e21), seq 4:14, ack 3, win 512, options [nop,nop,TS val 240686982 ecr 240686981], length 10
2022-04-05 11:33:24.479962 IP (tos 0x0, ttl 64, id 45591, offset 0, flags [DF], proto TCP (6), length 52)
    127.0.0.1.12250 > 127.0.0.1.60502: Flags [.], cksum 0xfe28 (incorrect -> 0xc907), seq 3, ack 14, win 512, options [nop,nop,TS val 240686982 ecr 240686982], length 0
2022-04-05 11:33:24.633286 IP (tos 0x0, ttl 64, id 45592, offset 0, flags [DF], proto TCP (6), length 62)
    127.0.0.1.12250 > 127.0.0.1.60502: Flags [P.], cksum 0xfe32 (incorrect -> 0xc35a), seq 3:13, ack 14, win 512, options [nop,nop,TS val 240687136 ecr 240686982], length 10
2022-04-05 11:33:24.633302 IP (tos 0x0, ttl 64, id 21741, offset 0, flags [DF], proto TCP (6), length 52)
    127.0.0.1.60502 > 127.0.0.1.12250: Flags [.], cksum 0xfe28 (incorrect -> 0xc7c9), seq 14, ack 13, win 512, options [nop,nop,TS val 240687136 ecr 240687136], length 0
2022-04-05 11:33:24.639430 IP (tos 0x0, ttl 64, id 21742, offset 0, flags [DF], proto TCP (6), length 569)
    127.0.0.1.60502 > 127.0.0.1.12250: Flags [P.], cksum 0x002e (incorrect -> 0x27aa), seq 14:531, ack 13, win 512, options [nop,nop,TS val 240687142 ecr 240687136], length 517
2022-04-05 11:33:24.639441 IP (tos 0x0, ttl 64, id 45593, offset 0, flags [DF], proto TCP (6), length 52)
    127.0.0.1.12250 > 127.0.0.1.60502: Flags [.], cksum 0xfe28 (incorrect -> 0xc5bc), seq 13, ack 531, win 508, options [nop,nop,TS val 240687142 ecr 240687142], length 0
2022-04-05 11:33:24.792396 IP (tos 0x0, ttl 64, id 45594, offset 0, flags [DF], proto TCP (6), length 3381)
    127.0.0.1.12250 > 127.0.0.1.60502: Flags [P.], cksum 0x0b2a (incorrect -> 0xa1aa), seq 13:3342, ack 531, win 512, options [nop,nop,TS val 240687295 ecr 240687142], length 3329
2022-04-05 11:33:24.792406 IP (tos 0x0, ttl 64, id 21743, offset 0, flags [DF], proto TCP (6), length 52)
    127.0.0.1.60502 > 127.0.0.1.12250: Flags [.], cksum 0xfe28 (incorrect -> 0xb797), seq 531, ack 3342, win 494, options [nop,nop,TS val 240687295 ecr 240687295], length 0
2022-04-05 11:33:24.792887 IP (tos 0x0, ttl 64, id 21744, offset 0, flags [DF], proto TCP (6), length 145)
    127.0.0.1.60502 > 127.0.0.1.12250: Flags [P.], cksum 0xfe85 (incorrect -> 0x5a69), seq 531:624, ack 3342, win 512, options [nop,nop,TS val 240687295 ecr 240687295], length 93
2022-04-05 11:33:24.792895 IP (tos 0x0, ttl 64, id 45595, offset 0, flags [DF], proto TCP (6), length 52)
    127.0.0.1.12250 > 127.0.0.1.60502: Flags [.], cksum 0xfe28 (incorrect -> 0xb728), seq 3342, ack 624, win 512, options [nop,nop,TS val 240687295 ecr 240687295], length 0
2022-04-05 11:33:24.948039 IP (tos 0x0, ttl 64, id 45596, offset 0, flags [DF], proto TCP (6), length 310)
    127.0.0.1.12250 > 127.0.0.1.60502: Flags [P.], cksum 0xff2a (incorrect -> 0x8cb0), seq 3342:3600, ack 624, win 512, options [nop,nop,TS val 240687450 ecr 240687295], length 258
2022-04-05 11:33:24.948050 IP (tos 0x0, ttl 64, id 21745, offset 0, flags [DF], proto TCP (6), length 52)
    127.0.0.1.60502 > 127.0.0.1.12250: Flags [.], cksum 0xfe28 (incorrect -> 0xb4f2), seq 624, ack 3600, win 510, options [nop,nop,TS val 240687450 ecr 240687450], length 0
2022-04-05 11:33:24.948473 IP (tos 0x0, ttl 64, id 21746, offset 0, flags [DF], proto TCP (6), length 356)
    127.0.0.1.60502 > 127.0.0.1.12250: Flags [P.], cksum 0xff58 (incorrect -> 0x6b3f), seq 624:928, ack 3600, win 512, options [nop,nop,TS val 240687451 ecr 240687450], length 304
2022-04-05 11:33:24.948482 IP (tos 0x0, ttl 64, id 45597, offset 0, flags [DF], proto TCP (6), length 52)
    127.0.0.1.12250 > 127.0.0.1.60502: Flags [.], cksum 0xfe28 (incorrect -> 0xb3c0), seq 3600, ack 928, win 510, options [nop,nop,TS val 240687451 ecr 240687451], length 0
2022-04-05 11:33:25.105270 IP (tos 0x0, ttl 64, id 45598, offset 0, flags [DF], proto TCP (6), length 220)
    127.0.0.1.12250 > 127.0.0.1.60502: Flags [P.], cksum 0xfed0 (incorrect -> 0x28f2), seq 3600:3768, ack 928, win 512, options [nop,nop,TS val 240687608 ecr 240687451], length 168
2022-04-05 11:33:25.107369 IP (tos 0x0, ttl 64, id 60417, offset 0, flags [DF], proto TCP (6), length 60)
    127.0.0.1.60504 > 127.0.0.1.12250: Flags [S], cksum 0xfe30 (incorrect -> 0xe8da), seq 1007445653, win 65495, options [mss 65495,sackOK,TS val 240687610 ecr 0,nop,wscale 7], length 0
2022-04-05 11:33:25.107382 IP (tos 0x0, ttl 64, id 0, offset 0, flags [DF], proto TCP (6), length 60)
    127.0.0.1.12250 > 127.0.0.1.60504: Flags [S.], cksum 0xfe30 (incorrect -> 0x3537), seq 1616227062, ack 1007445654, win 65483, options [mss 65495,sackOK,TS val 240687610 ecr 240687610,nop,wscale 7], length 0
2022-04-05 11:33:25.107393 IP (tos 0x0, ttl 64, id 60418, offset 0, flags [DF], proto TCP (6), length 52)
    127.0.0.1.60504 > 127.0.0.1.12250: Flags [.], cksum 0xfe28 (incorrect -> 0x5bf3), seq 1, ack 1, win 512, options [nop,nop,TS val 240687610 ecr 240687610], length 0
2022-04-05 11:33:25.107488 IP (tos 0x0, ttl 64, id 60419, offset 0, flags [DF], proto TCP (6), length 55)
    127.0.0.1.60504 > 127.0.0.1.12250: Flags [P.], cksum 0xfe2b (incorrect -> 0x56e7), seq 1:4, ack 1, win 512, options [nop,nop,TS val 240687610 ecr 240687610], length 3
2022-04-05 11:33:25.107494 IP (tos 0x0, ttl 64, id 44874, offset 0, flags [DF], proto TCP (6), length 52)
    127.0.0.1.12250 > 127.0.0.1.60504: Flags [.], cksum 0xfe28 (incorrect -> 0x5bf0), seq 1, ack 4, win 512, options [nop,nop,TS val 240687610 ecr 240687610], length 0
2022-04-05 11:33:25.107512 IP (tos 0x0, ttl 64, id 44875, offset 0, flags [DF], proto TCP (6), length 54)
    127.0.0.1.12250 > 127.0.0.1.60504: Flags [P.], cksum 0xfe2a (incorrect -> 0x56e6), seq 1:3, ack 4, win 512, options [nop,nop,TS val 240687610 ecr 240687610], length 2
2022-04-05 11:33:25.107519 IP (tos 0x0, ttl 64, id 60420, offset 0, flags [DF], proto TCP (6), length 52)
    127.0.0.1.60504 > 127.0.0.1.12250: Flags [.], cksum 0xfe28 (incorrect -> 0x5bee), seq 4, ack 3, win 512, options [nop,nop,TS val 240687610 ecr 240687610], length 0
2022-04-05 11:33:25.146659 IP (tos 0x0, ttl 64, id 21747, offset 0, flags [DF], proto TCP (6), length 52)
    127.0.0.1.60502 > 127.0.0.1.12250: Flags [.], cksum 0xfe28 (incorrect -> 0xb1b3), seq 928, ack 3768, win 512, options [nop,nop,TS val 240687649 ecr 240687608], length 0
2022-04-05 11:33:25.153739 IP (tos 0x0, ttl 64, id 60421, offset 0, flags [DF], proto TCP (6), length 62)
    127.0.0.1.60504 > 127.0.0.1.12250: Flags [P.], cksum 0xfe32 (incorrect -> 0x38a9), seq 4:14, ack 3, win 512, options [nop,nop,TS val 240687656 ecr 240687610], length 10
2022-04-05 11:33:25.153748 IP (tos 0x0, ttl 64, id 44876, offset 0, flags [DF], proto TCP (6), length 52)
    127.0.0.1.12250 > 127.0.0.1.60504: Flags [.], cksum 0xfe28 (incorrect -> 0x5b88), seq 3, ack 14, win 512, options [nop,nop,TS val 240687656 ecr 240687656], length 0
2022-04-05 11:33:25.318591 IP (tos 0x0, ttl 64, id 44877, offset 0, flags [DF], proto TCP (6), length 62)
    127.0.0.1.12250 > 127.0.0.1.60504: Flags [P.], cksum 0xfe32 (incorrect -> 0x55d0), seq 3:13, ack 14, win 512, options [nop,nop,TS val 240687821 ecr 240687656], length 10
2022-04-05 11:33:25.318603 IP (tos 0x0, ttl 64, id 60422, offset 0, flags [DF], proto TCP (6), length 52)
    127.0.0.1.60504 > 127.0.0.1.12250: Flags [.], cksum 0xfe28 (incorrect -> 0x5a34), seq 14, ack 13, win 512, options [nop,nop,TS val 240687821 ecr 240687821], length 0
2022-04-05 11:33:25.324292 IP (tos 0x0, ttl 64, id 60423, offset 0, flags [DF], proto TCP (6), length 569)
    127.0.0.1.60504 > 127.0.0.1.12250: Flags [P.], cksum 0x002e (incorrect -> 0x56d5), seq 14:531, ack 13, win 512, options [nop,nop,TS val 240687827 ecr 240687821], length 517
2022-04-05 11:33:25.324302 IP (tos 0x0, ttl 64, id 44878, offset 0, flags [DF], proto TCP (6), length 52)
    127.0.0.1.12250 > 127.0.0.1.60504: Flags [.], cksum 0xfe28 (incorrect -> 0x5827), seq 13, ack 531, win 508, options [nop,nop,TS val 240687827 ecr 240687827], length 0
2022-04-05 11:33:25.478407 IP (tos 0x0, ttl 64, id 44879, offset 0, flags [DF], proto TCP (6), length 3381)
    127.0.0.1.12250 > 127.0.0.1.60504: Flags [P.], cksum 0x0b2a (incorrect -> 0xc64e), seq 13:3342, ack 531, win 512, options [nop,nop,TS val 240687981 ecr 240687827], length 3329
2022-04-05 11:33:25.478415 IP (tos 0x0, ttl 64, id 60424, offset 0, flags [DF], proto TCP (6), length 52)
    127.0.0.1.60504 > 127.0.0.1.12250: Flags [.], cksum 0xfe28 (incorrect -> 0x4a00), seq 531, ack 3342, win 494, options [nop,nop,TS val 240687981 ecr 240687981], length 0
2022-04-05 11:33:25.478891 IP (tos 0x0, ttl 64, id 60425, offset 0, flags [DF], proto TCP (6), length 145)
    127.0.0.1.60504 > 127.0.0.1.12250: Flags [P.], cksum 0xfe85 (incorrect -> 0x18a7), seq 531:624, ack 3342, win 512, options [nop,nop,TS val 240687981 ecr 240687981], length 93
2022-04-05 11:33:25.478901 IP (tos 0x0, ttl 64, id 44880, offset 0, flags [DF], proto TCP (6), length 52)
    127.0.0.1.12250 > 127.0.0.1.60504: Flags [.], cksum 0xfe28 (incorrect -> 0x4991), seq 3342, ack 624, win 512, options [nop,nop,TS val 240687981 ecr 240687981], length 0
2022-04-05 11:33:25.629846 IP (tos 0x0, ttl 64, id 44881, offset 0, flags [DF], proto TCP (6), length 310)
    127.0.0.1.12250 > 127.0.0.1.60504: Flags [P.], cksum 0xff2a (incorrect -> 0xc673), seq 3342:3600, ack 624, win 512, options [nop,nop,TS val 240688132 ecr 240687981], length 258
2022-04-05 11:33:25.629866 IP (tos 0x0, ttl 64, id 60426, offset 0, flags [DF], proto TCP (6), length 52)
    127.0.0.1.60504 > 127.0.0.1.12250: Flags [.], cksum 0xfe28 (incorrect -> 0x4763), seq 624, ack 3600, win 510, options [nop,nop,TS val 240688132 ecr 240688132], length 0
2022-04-05 11:33:25.630317 IP (tos 0x0, ttl 64, id 60427, offset 0, flags [DF], proto TCP (6), length 352)
    127.0.0.1.60504 > 127.0.0.1.12250: Flags [P.], cksum 0xff54 (incorrect -> 0x3038), seq 624:924, ack 3600, win 512, options [nop,nop,TS val 240688133 ecr 240688132], length 300
2022-04-05 11:33:25.630325 IP (tos 0x0, ttl 64, id 44882, offset 0, flags [DF], proto TCP (6), length 52)
    127.0.0.1.12250 > 127.0.0.1.60504: Flags [.], cksum 0xfe28 (incorrect -> 0x4635), seq 3600, ack 924, win 510, options [nop,nop,TS val 240688133 ecr 240688133], length 0
200, 5.874497175216675, 1.5140156745910645