2022-04-05 01:51:14.607885 IP (tos 0x0, ttl 64, id 27913, offset 0, flags [DF], proto TCP (6), length 60)
    127.0.0.1.37266 > 127.0.0.1.10650: Flags [S], cksum 0xfe30 (incorrect -> 0x4728), seq 2030691906, win 65495, options [mss 65495,sackOK,TS val 761118979 ecr 0,nop,wscale 7], length 0
2022-04-05 01:51:14.607900 IP (tos 0x0, ttl 64, id 0, offset 0, flags [DF], proto TCP (6), length 60)
    127.0.0.1.10650 > 127.0.0.1.37266: Flags [S.], cksum 0xfe30 (incorrect -> 0x52a0), seq 3628674520, ack 2030691907, win 65483, options [mss 65495,sackOK,TS val 761118979 ecr 761118979,nop,wscale 7], length 0
2022-04-05 01:51:14.607911 IP (tos 0x0, ttl 64, id 27914, offset 0, flags [DF], proto TCP (6), length 52)
    127.0.0.1.37266 > 127.0.0.1.10650: Flags [.], cksum 0xfe28 (incorrect -> 0x795c), seq 1, ack 1, win 512, options [nop,nop,TS val 761118979 ecr 761118979], length 0
2022-04-05 01:51:14.608092 IP (tos 0x0, ttl 64, id 27915, offset 0, flags [DF], proto TCP (6), length 55)
    127.0.0.1.37266 > 127.0.0.1.10650: Flags [P.], cksum 0xfe2b (incorrect -> 0x7450), seq 1:4, ack 1, win 512, options [nop,nop,TS val 761118979 ecr 761118979], length 3
2022-04-05 01:51:14.608100 IP (tos 0x0, ttl 64, id 2964, offset 0, flags [DF], proto TCP (6), length 52)
    127.0.0.1.10650 > 127.0.0.1.37266: Flags [.], cksum 0xfe28 (incorrect -> 0x7959), seq 1, ack 4, win 512, options [nop,nop,TS val 761118979 ecr 761118979], length 0
2022-04-05 01:51:14.608127 IP (tos 0x0, ttl 64, id 2965, offset 0, flags [DF], proto TCP (6), length 54)
    127.0.0.1.10650 > 127.0.0.1.37266: Flags [P.], cksum 0xfe2a (incorrect -> 0x744f), seq 1:3, ack 4, win 512, options [nop,nop,TS val 761118979 ecr 761118979], length 2
2022-04-05 01:51:14.608135 IP (tos 0x0, ttl 64, id 27916, offset 0, flags [DF], proto TCP (6), length 52)
    127.0.0.1.37266 > 127.0.0.1.10650: Flags [.], cksum 0xfe28 (incorrect -> 0x7957), seq 4, ack 3, win 512, options [nop,nop,TS val 761118979 ecr 761118979], length 0
2022-04-05 01:51:14.609935 IP (tos 0x0, ttl 64, id 27917, offset 0, flags [DF], proto TCP (6), length 62)
    127.0.0.1.37266 > 127.0.0.1.10650: Flags [P.], cksum 0xfe32 (incorrect -> 0x89e5), seq 4:14, ack 3, win 512, options [nop,nop,TS val 761118981 ecr 761118979], length 10
2022-04-05 01:51:14.609958 IP (tos 0x0, ttl 64, id 2966, offset 0, flags [DF], proto TCP (6), length 52)
    127.0.0.1.10650 > 127.0.0.1.37266: Flags [.], cksum 0xfe28 (incorrect -> 0x7949), seq 3, ack 14, win 512, options [nop,nop,TS val 761118981 ecr 761118981], length 0
2022-04-05 01:51:14.691572 IP (tos 0x0, ttl 64, id 2967, offset 0, flags [DF], proto TCP (6), length 62)
    127.0.0.1.10650 > 127.0.0.1.37266: Flags [P.], cksum 0xfe32 (incorrect -> 0x73e4), seq 3:13, ack 14, win 512, options [nop,nop,TS val 761119063 ecr 761118981], length 10
2022-04-05 01:51:14.691584 IP (tos 0x0, ttl 64, id 27918, offset 0, flags [DF], proto TCP (6), length 52)
    127.0.0.1.37266 > 127.0.0.1.10650: Flags [.], cksum 0xfe28 (incorrect -> 0x789b), seq 14, ack 13, win 512, options [nop,nop,TS val 761119063 ecr 761119063], length 0
2022-04-05 01:51:14.697543 IP (tos 0x0, ttl 64, id 27919, offset 0, flags [DF], proto TCP (6), length 569)
    127.0.0.1.37266 > 127.0.0.1.10650: Flags [P.], cksum 0x002e (incorrect -> 0xcb0c), seq 14:531, ack 13, win 512, options [nop,nop,TS val 761119069 ecr 761119063], length 517
2022-04-05 01:51:14.697552 IP (tos 0x0, ttl 64, id 2968, offset 0, flags [DF], proto TCP (6), length 52)
    127.0.0.1.10650 > 127.0.0.1.37266: Flags [.], cksum 0xfe28 (incorrect -> 0x768e), seq 13, ack 531, win 508, options [nop,nop,TS val 761119069 ecr 761119069], length 0
2022-04-05 01:51:14.781323 IP (tos 0x0, ttl 64, id 2969, offset 0, flags [DF], proto TCP (6), length 3538)
    127.0.0.1.10650 > 127.0.0.1.37266: Flags [P.], cksum 0x0bc7 (incorrect -> 0xb0f4), seq 13:3499, ack 531, win 512, options [nop,nop,TS val 761119152 ecr 761119069], length 3486
2022-04-05 01:51:14.781338 IP (tos 0x0, ttl 64, id 27920, offset 0, flags [DF], proto TCP (6), length 52)
    127.0.0.1.37266 > 127.0.0.1.10650: Flags [.], cksum 0xfe28 (incorrect -> 0x6858), seq 531, ack 3499, win 494, options [nop,nop,TS val 761119152 ecr 761119152], length 0
403, 6.8377463817596436, 0.3848283290863037