2022-04-05 03:10:54.602470 IP (tos 0x0, ttl 64, id 7584, offset 0, flags [DF], proto TCP (6), length 60)
    127.0.0.1.42864 > 127.0.0.1.11450: Flags [S], cksum 0xfe30 (incorrect -> 0x1197), seq 2198735021, win 65495, options [mss 65495,sackOK,TS val 765898974 ecr 0,nop,wscale 7], length 0
2022-04-05 03:10:54.602482 IP (tos 0x0, ttl 64, id 0, offset 0, flags [DF], proto TCP (6), length 60)
    127.0.0.1.11450 > 127.0.0.1.42864: Flags [S.], cksum 0xfe30 (incorrect -> 0xb2d3), seq 3077097680, ack 2198735022, win 65483, options [mss 65495,sackOK,TS val 765898974 ecr 765898974,nop,wscale 7], length 0
2022-04-05 03:10:54.602493 IP (tos 0x0, ttl 64, id 7585, offset 0, flags [DF], proto TCP (6), length 52)
    127.0.0.1.42864 > 127.0.0.1.11450: Flags [.], cksum 0xfe28 (incorrect -> 0xd98f), seq 1, ack 1, win 512, options [nop,nop,TS val 765898974 ecr 765898974], length 0
2022-04-05 03:10:54.602619 IP (tos 0x0, ttl 64, id 7586, offset 0, flags [DF], proto TCP (6), length 55)
    127.0.0.1.42864 > 127.0.0.1.11450: Flags [P.], cksum 0xfe2b (incorrect -> 0xd483), seq 1:4, ack 1, win 512, options [nop,nop,TS val 765898974 ecr 765898974], length 3
2022-04-05 03:10:54.602633 IP (tos 0x0, ttl 64, id 63447, offset 0, flags [DF], proto TCP (6), length 52)
    127.0.0.1.11450 > 127.0.0.1.42864: Flags [.], cksum 0xfe28 (incorrect -> 0xd98c), seq 1, ack 4, win 512, options [nop,nop,TS val 765898974 ecr 765898974], length 0
2022-04-05 03:10:54.602675 IP (tos 0x0, ttl 64, id 63448, offset 0, flags [DF], proto TCP (6), length 54)
    127.0.0.1.11450 > 127.0.0.1.42864: Flags [P.], cksum 0xfe2a (incorrect -> 0xd482), seq 1:3, ack 4, win 512, options [nop,nop,TS val 765898974 ecr 765898974], length 2
2022-04-05 03:10:54.602688 IP (tos 0x0, ttl 64, id 7587, offset 0, flags [DF], proto TCP (6), length 52)
    127.0.0.1.42864 > 127.0.0.1.11450: Flags [.], cksum 0xfe28 (incorrect -> 0xd98a), seq 4, ack 3, win 512, options [nop,nop,TS val 765898974 ecr 765898974], length 0
2022-04-05 03:10:54.614464 IP (tos 0x0, ttl 64, id 7588, offset 0, flags [DF], proto TCP (6), length 62)
    127.0.0.1.42864 > 127.0.0.1.11450: Flags [P.], cksum 0xfe32 (incorrect -> 0x2ea7), seq 4:14, ack 3, win 512, options [nop,nop,TS val 765898986 ecr 765898974], length 10
2022-04-05 03:10:54.614482 IP (tos 0x0, ttl 64, id 63449, offset 0, flags [DF], proto TCP (6), length 52)
    127.0.0.1.11450 > 127.0.0.1.42864: Flags [.], cksum 0xfe28 (incorrect -> 0xd968), seq 3, ack 14, win 512, options [nop,nop,TS val 765898986 ecr 765898986], length 0
2022-04-05 03:10:54.704597 IP (tos 0x0, ttl 64, id 63450, offset 0, flags [DF], proto TCP (6), length 62)
    127.0.0.1.11450 > 127.0.0.1.42864: Flags [P.], cksum 0xfe32 (incorrect -> 0xd3fb), seq 3:13, ack 14, win 512, options [nop,nop,TS val 765899076 ecr 765898986], length 10
2022-04-05 03:10:54.704609 IP (tos 0x0, ttl 64, id 7589, offset 0, flags [DF], proto TCP (6), length 52)
    127.0.0.1.42864 > 127.0.0.1.11450: Flags [.], cksum 0xfe28 (incorrect -> 0xd8aa), seq 14, ack 13, win 512, options [nop,nop,TS val 765899076 ecr 765899076], length 0
2022-04-05 03:10:54.710686 IP (tos 0x0, ttl 64, id 7590, offset 0, flags [DF], proto TCP (6), length 569)
    127.0.0.1.42864 > 127.0.0.1.11450: Flags [P.], cksum 0x002e (incorrect -> 0xcd67), seq 14:531, ack 13, win 512, options [nop,nop,TS val 765899082 ecr 765899076], length 517
2022-04-05 03:10:54.710694 IP (tos 0x0, ttl 64, id 63451, offset 0, flags [DF], proto TCP (6), length 52)
    127.0.0.1.11450 > 127.0.0.1.42864: Flags [.], cksum 0xfe28 (incorrect -> 0xd69d), seq 13, ack 531, win 508, options [nop,nop,TS val 765899082 ecr 765899082], length 0
2022-04-05 03:10:54.805098 IP (tos 0x0, ttl 64, id 63452, offset 0, flags [DF], proto TCP (6), length 151)
    127.0.0.1.11450 > 127.0.0.1.42864: Flags [P.], cksum 0xfe8b (incorrect -> 0xd249), seq 13:112, ack 531, win 512, options [nop,nop,TS val 765899176 ecr 765899082], length 99
2022-04-05 03:10:54.805107 IP (tos 0x0, ttl 64, id 7591, offset 0, flags [DF], proto TCP (6), length 52)
    127.0.0.1.42864 > 127.0.0.1.11450: Flags [.], cksum 0xfe28 (incorrect -> 0xd57a), seq 531, ack 112, win 512, options [nop,nop,TS val 765899176 ecr 765899176], length 0
2022-04-05 03:10:54.805234 IP (tos 0x0, ttl 64, id 7592, offset 0, flags [DF], proto TCP (6), length 575)
    127.0.0.1.42864 > 127.0.0.1.11450: Flags [P.], cksum 0x0034 (incorrect -> 0x4c0c), seq 531:1054, ack 112, win 512, options [nop,nop,TS val 765899176 ecr 765899176], length 523
2022-04-05 03:10:54.805241 IP (tos 0x0, ttl 64, id 63453, offset 0, flags [DF], proto TCP (6), length 52)
    127.0.0.1.11450 > 127.0.0.1.42864: Flags [.], cksum 0xfe28 (incorrect -> 0xd373), seq 112, ack 1054, win 508, options [nop,nop,TS val 765899176 ecr 765899176], length 0
2022-04-05 03:10:54.898179 IP (tos 0x0, ttl 64, id 63454, offset 0, flags [DF], proto TCP (6), length 3538)
    127.0.0.1.11450 > 127.0.0.1.42864: Flags [P.], cksum 0x0bc7 (incorrect -> 0x7ec9), seq 112:3598, ack 1054, win 512, options [nop,nop,TS val 765899269 ecr 765899176], length 3486
2022-04-05 03:10:54.898194 IP (tos 0x0, ttl 64, id 7593, offset 0, flags [DF], proto TCP (6), length 52)
    127.0.0.1.42864 > 127.0.0.1.11450: Flags [.], cksum 0xfe28 (incorrect -> 0xc529), seq 1054, ack 3598, win 494, options [nop,nop,TS val 765899269 ecr 765899269], length 0
2022-04-05 03:10:54.904647 IP (tos 0x0, ttl 64, id 63455, offset 0, flags [DF], proto TCP (6), length 1546)
    127.0.0.1.11450 > 127.0.0.1.42864: Flags [P.], cksum 0x03ff (incorrect -> 0x641f), seq 3598:5092, ack 1054, win 512, options [nop,nop,TS val 765899276 ecr 765899269], length 1494
2022-04-05 03:10:54.904658 IP (tos 0x0, ttl 64, id 7594, offset 0, flags [DF], proto TCP (6), length 52)
    127.0.0.1.42864 > 127.0.0.1.11450: Flags [.], cksum 0xfe28 (incorrect -> 0xbf3d), seq 1054, ack 5092, win 502, options [nop,nop,TS val 765899276 ecr 765899276], length 0
2022-04-05 03:10:54.910042 IP (tos 0x0, ttl 64, id 63456, offset 0, flags [DF], proto TCP (6), length 2542)
    127.0.0.1.11450 > 127.0.0.1.42864: Flags [P.], cksum 0x07e3 (incorrect -> 0x5e2e), seq 5092:7582, ack 1054, win 512, options [nop,nop,TS val 765899281 ecr 765899276], length 2490
2022-04-05 03:10:54.910049 IP (tos 0x0, ttl 64, id 7595, offset 0, flags [DF], proto TCP (6), length 52)
    127.0.0.1.42864 > 127.0.0.1.11450: Flags [.], cksum 0xfe28 (incorrect -> 0xb57d), seq 1054, ack 7582, win 498, options [nop,nop,TS val 765899281 ecr 765899281], length 0
2022-04-05 03:10:54.924252 IP (tos 0x0, ttl 64, id 63457, offset 0, flags [DF], proto TCP (6), length 2522)
    127.0.0.1.11450 > 127.0.0.1.42864: Flags [P.], cksum 0x07cf (incorrect -> 0x88b0), seq 7582:10052, ack 1054, win 512, options [nop,nop,TS val 765899295 ecr 765899281], length 2470
2022-04-05 03:10:54.924258 IP (tos 0x0, ttl 64, id 7596, offset 0, flags [DF], proto TCP (6), length 52)
    127.0.0.1.42864 > 127.0.0.1.11450: Flags [.], cksum 0xfe28 (incorrect -> 0xabbb), seq 1054, ack 10052, win 498, options [nop,nop,TS val 765899295 ecr 765899295], length 0
2022-04-05 03:10:54.949756 IP (tos 0x0, ttl 64, id 63458, offset 0, flags [DF], proto TCP (6), length 412)
    127.0.0.1.11450 > 127.0.0.1.42864: Flags [P.], cksum 0xff90 (incorrect -> 0x7085), seq 10052:10412, ack 1054, win 512, options [nop,nop,TS val 765899321 ecr 765899295], length 360
2022-04-05 03:10:54.949770 IP (tos 0x0, ttl 64, id 7597, offset 0, flags [DF], proto TCP (6), length 52)
    127.0.0.1.42864 > 127.0.0.1.11450: Flags [.], cksum 0xfe28 (incorrect -> 0xaa17), seq 1054, ack 10412, win 506, options [nop,nop,TS val 765899321 ecr 765899321], length 0
2022-04-05 03:10:54.949939 IP (tos 0x0, ttl 64, id 7598, offset 0, flags [DF], proto TCP (6), length 126)
    127.0.0.1.42864 > 127.0.0.1.11450: Flags [P.], cksum 0xfe72 (incorrect -> 0xe99b), seq 1054:1128, ack 10412, win 512, options [nop,nop,TS val 765899321 ecr 765899321], length 74
2022-04-05 03:10:54.949945 IP (tos 0x0, ttl 64, id 63459, offset 0, flags [DF], proto TCP (6), length 52)
    127.0.0.1.11450 > 127.0.0.1.42864: Flags [.], cksum 0xfe28 (incorrect -> 0xa9c7), seq 10412, ack 1128, win 512, options [nop,nop,TS val 765899321 ecr 765899321], length 0
2022-04-05 03:10:54.950548 IP (tos 0x0, ttl 64, id 7599, offset 0, flags [DF], proto TCP (6), length 333)
    127.0.0.1.42864 > 127.0.0.1.11450: Flags [P.], cksum 0xff41 (incorrect -> 0xfd6e), seq 1128:1409, ack 10412, win 512, options [nop,nop,TS val 765899322 ecr 765899321], length 281
2022-04-05 03:10:54.950556 IP (tos 0x0, ttl 64, id 63460, offset 0, flags [DF], proto TCP (6), length 52)
    127.0.0.1.11450 > 127.0.0.1.42864: Flags [.], cksum 0xfe28 (incorrect -> 0xa8ae), seq 10412, ack 1409, win 510, options [nop,nop,TS val 765899322 ecr 765899322], length 0
2022-04-05 03:10:55.040634 IP (tos 0x0, ttl 64, id 63461, offset 0, flags [DF], proto TCP (6), length 339)
    127.0.0.1.11450 > 127.0.0.1.42864: Flags [P.], cksum 0xff47 (incorrect -> 0xd998), seq 10412:10699, ack 1409, win 512, options [nop,nop,TS val 765899412 ecr 765899322], length 287
2022-04-05 03:10:55.081406 IP (tos 0x0, ttl 64, id 7600, offset 0, flags [DF], proto TCP (6), length 52)
    127.0.0.1.42864 > 127.0.0.1.11450: Flags [.], cksum 0xfe28 (incorrect -> 0xa6b1), seq 1409, ack 10699, win 512, options [nop,nop,TS val 765899452 ecr 765899412], length 0
2022-04-05 03:10:55.109831 IP (tos 0x0, ttl 64, id 63462, offset 0, flags [DF], proto TCP (6), length 339)
    127.0.0.1.11450 > 127.0.0.1.42864: Flags [P.], cksum 0xff47 (incorrect -> 0x6ce9), seq 10699:10986, ack 1409, win 512, options [nop,nop,TS val 765899481 ecr 765899452], length 287
2022-04-05 03:10:55.109842 IP (tos 0x0, ttl 64, id 7601, offset 0, flags [DF], proto TCP (6), length 52)
    127.0.0.1.42864 > 127.0.0.1.11450: Flags [.], cksum 0xfe28 (incorrect -> 0xa532), seq 1409, ack 10986, win 510, options [nop,nop,TS val 765899481 ecr 765899481], length 0
2022-04-05 03:10:55.537875 IP (tos 0x0, ttl 64, id 63463, offset 0, flags [DF], proto TCP (6), length 2948)
    127.0.0.1.11450 > 127.0.0.1.42864: Flags [P.], cksum 0x0979 (incorrect -> 0x7bda), seq 10986:13882, ack 1409, win 512, options [nop,nop,TS val 765899909 ecr 765899481], length 2896
2022-04-05 03:10:55.537888 IP (tos 0x0, ttl 64, id 7602, offset 0, flags [DF], proto TCP (6), length 52)
    127.0.0.1.42864 > 127.0.0.1.11450: Flags [.], cksum 0xfe28 (incorrect -> 0x9698), seq 1409, ack 13882, win 496, options [nop,nop,TS val 765899909 ecr 765899909], length 0
2022-04-05 03:10:55.538347 IP (tos 0x0, ttl 64, id 63464, offset 0, flags [DF], proto TCP (6), length 2948)
    127.0.0.1.11450 > 127.0.0.1.42864: Flags [P.], cksum 0x0979 (incorrect -> 0xb943), seq 13882:16778, ack 1409, win 512, options [nop,nop,TS val 765899909 ecr 765899909], length 2896
2022-04-05 03:10:55.538353 IP (tos 0x0, ttl 64, id 7603, offset 0, flags [DF], proto TCP (6), length 52)
    127.0.0.1.42864 > 127.0.0.1.11450: Flags [.], cksum 0xfe28 (incorrect -> 0x8b48), seq 1409, ack 16778, win 496, options [nop,nop,TS val 765899909 ecr 765899909], length 0
2022-04-05 03:10:55.559009 IP (tos 0x0, ttl 64, id 63465, offset 0, flags [DF], proto TCP (6), length 2948)
    127.0.0.1.11450 > 127.0.0.1.42864: Flags [P.], cksum 0x0979 (incorrect -> 0xd4af), seq 16778:19674, ack 1409, win 512, options [nop,nop,TS val 765899930 ecr 765899909], length 2896
2022-04-05 03:10:55.559016 IP (tos 0x0, ttl 64, id 7604, offset 0, flags [DF], proto TCP (6), length 52)
    127.0.0.1.42864 > 127.0.0.1.11450: Flags [.], cksum 0xfe28 (incorrect -> 0x7fce), seq 1409, ack 19674, win 496, options [nop,nop,TS val 765899930 ecr 765899930], length 0
2022-04-05 03:10:55.565615 IP (tos 0x0, ttl 64, id 63466, offset 0, flags [DF], proto TCP (6), length 3446)
    127.0.0.1.11450 > 127.0.0.1.42864: Flags [P.], cksum 0x0b6b (incorrect -> 0xeac1), seq 19674:23068, ack 1409, win 512, options [nop,nop,TS val 765899937 ecr 765899930], length 3394
2022-04-05 03:10:55.565624 IP (tos 0x0, ttl 64, id 7605, offset 0, flags [DF], proto TCP (6), length 52)
    127.0.0.1.42864 > 127.0.0.1.11450: Flags [.], cksum 0xfe28 (incorrect -> 0x7280), seq 1409, ack 23068, win 494, options [nop,nop,TS val 765899937 ecr 765899937], length 0
2022-04-05 03:10:55.571007 IP (tos 0x0, ttl 64, id 63467, offset 0, flags [DF], proto TCP (6), length 2450)
    127.0.0.1.11450 > 127.0.0.1.42864: Flags [P.], cksum 0x0787 (incorrect -> 0xc9cf), seq 23068:25466, ack 1409, win 512, options [nop,nop,TS val 765899942 ecr 765899937], length 2398
2022-04-05 03:10:55.571013 IP (tos 0x0, ttl 64, id 7606, offset 0, flags [DF], proto TCP (6), length 52)
    127.0.0.1.42864 > 127.0.0.1.11450: Flags [.], cksum 0xfe28 (incorrect -> 0x6914), seq 1409, ack 25466, win 498, options [nop,nop,TS val 765899942 ecr 765899942], length 0
2022-04-05 03:10:55.596839 IP (tos 0x0, ttl 64, id 63468, offset 0, flags [DF], proto TCP (6), length 2240)
    127.0.0.1.11450 > 127.0.0.1.42864: Flags [P.], cksum 0x06b5 (incorrect -> 0x259a), seq 25466:27654, ack 1409, win 512, options [nop,nop,TS val 765899968 ecr 765899942], length 2188
2022-04-05 03:10:55.596846 IP (tos 0x0, ttl 64, id 7607, offset 0, flags [DF], proto TCP (6), length 52)
    127.0.0.1.42864 > 127.0.0.1.11450: Flags [.], cksum 0xfe28 (incorrect -> 0x6053), seq 1409, ack 27654, win 499, options [nop,nop,TS val 765899968 ecr 765899968], length 0
2022-04-05 03:10:55.619751 IP (tos 0x0, ttl 64, id 63469, offset 0, flags [DF], proto TCP (6), length 3538)
    127.0.0.1.11450 > 127.0.0.1.42864: Flags [P.], cksum 0x0bc7 (incorrect -> 0x8892), seq 27654:31140, ack 1409, win 512, options [nop,nop,TS val 765899991 ecr 765899968], length 3486
2022-04-05 03:10:55.619758 IP (tos 0x0, ttl 64, id 7608, offset 0, flags [DF], proto TCP (6), length 52)
    127.0.0.1.42864 > 127.0.0.1.11450: Flags [.], cksum 0xfe28 (incorrect -> 0x528c), seq 1409, ack 31140, win 494, options [nop,nop,TS val 765899991 ecr 765899991], length 0
2022-04-05 03:10:55.619880 IP (tos 0x0, ttl 64, id 63470, offset 0, flags [DF], proto TCP (6), length 3354)
    127.0.0.1.11450 > 127.0.0.1.42864: Flags [P.], cksum 0x0b0f (incorrect -> 0x9452), seq 31140:34442, ack 1409, win 512, options [nop,nop,TS val 765899991 ecr 765899991], length 3302
2022-04-05 03:10:55.619885 IP (tos 0x0, ttl 64, id 7609, offset 0, flags [DF], proto TCP (6), length 52)
    127.0.0.1.42864 > 127.0.0.1.11450: Flags [.], cksum 0xfe28 (incorrect -> 0x45a5), seq 1409, ack 34442, win 495, options [nop,nop,TS val 765899991 ecr 765899991], length 0
2022-04-05 03:10:55.622560 IP (tos 0x0, ttl 64, id 63471, offset 0, flags [DF], proto TCP (6), length 3538)
    127.0.0.1.11450 > 127.0.0.1.42864: Flags [P.], cksum 0x0bc7 (incorrect -> 0x2682), seq 34442:37928, ack 1409, win 512, options [nop,nop,TS val 765899994 ecr 765899991], length 3486
2022-04-05 03:10:55.622566 IP (tos 0x0, ttl 64, id 7610, offset 0, flags [DF], proto TCP (6), length 52)
    127.0.0.1.42864 > 127.0.0.1.11450: Flags [.], cksum 0xfe28 (incorrect -> 0x3802), seq 1409, ack 37928, win 494, options [nop,nop,TS val 765899994 ecr 765899994], length 0
2022-04-05 03:10:55.630457 IP (tos 0x0, ttl 64, id 63472, offset 0, flags [DF], proto TCP (6), length 2358)
    127.0.0.1.11450 > 127.0.0.1.42864: Flags [P.], cksum 0x072b (incorrect -> 0xb796), seq 37928:40234, ack 1409, win 512, options [nop,nop,TS val 765900002 ecr 765899994], length 2306
2022-04-05 03:10:55.630469 IP (tos 0x0, ttl 64, id 7611, offset 0, flags [DF], proto TCP (6), length 52)
    127.0.0.1.42864 > 127.0.0.1.11450: Flags [.], cksum 0xfe28 (incorrect -> 0x2ede), seq 1409, ack 40234, win 512, options [nop,nop,TS val 765900002 ecr 765900002], length 0
2022-04-05 03:10:55.656267 IP (tos 0x0, ttl 64, id 63473, offset 0, flags [DF], proto TCP (6), length 2450)
    127.0.0.1.11450 > 127.0.0.1.42864: Flags [P.], cksum 0x0787 (incorrect -> 0xf2cd), seq 40234:42632, ack 1409, win 512, options [nop,nop,TS val 765900027 ecr 765900002], length 2398
2022-04-05 03:10:55.656281 IP (tos 0x0, ttl 64, id 7612, offset 0, flags [DF], proto TCP (6), length 52)
    127.0.0.1.42864 > 127.0.0.1.11450: Flags [.], cksum 0xfe28 (incorrect -> 0x254e), seq 1409, ack 42632, win 512, options [nop,nop,TS val 765900027 ecr 765900027], length 0
2022-04-05 03:10:55.681406 IP (tos 0x0, ttl 64, id 63474, offset 0, flags [DF], proto TCP (6), length 1510)
    127.0.0.1.11450 > 127.0.0.1.42864: Flags [P.], cksum 0x03db (incorrect -> 0x49ab), seq 42632:44090, ack 1409, win 512, options [nop,nop,TS val 765900053 ecr 765900027], length 1458
2022-04-05 03:10:55.681758 IP (tos 0x0, ttl 64, id 7613, offset 0, flags [DF], proto TCP (6), length 52)
    127.0.0.1.42864 > 127.0.0.1.11450: Flags [.], cksum 0xfe28 (incorrect -> 0x1f68), seq 1409, ack 44090, win 512, options [nop,nop,TS val 765900053 ecr 765900053], length 0
2022-04-05 03:10:55.704595 IP (tos 0x0, ttl 64, id 63475, offset 0, flags [DF], proto TCP (6), length 4100)
    127.0.0.1.11450 > 127.0.0.1.42864: Flags [P.], cksum 0x0df9 (incorrect -> 0x57fe), seq 44090:48138, ack 1409, win 512, options [nop,nop,TS val 765900076 ecr 765900053], length 4048
2022-04-05 03:10:55.745408 IP (tos 0x0, ttl 64, id 7614, offset 0, flags [DF], proto TCP (6), length 52)
    127.0.0.1.42864 > 127.0.0.1.11450: Flags [.], cksum 0xfe28 (incorrect -> 0x0f42), seq 1409, ack 48138, win 512, options [nop,nop,TS val 765900116 ecr 765900076], length 0
2022-04-05 03:10:55.745423 IP (tos 0x0, ttl 64, id 63476, offset 0, flags [DF], proto TCP (6), length 10484)
    127.0.0.1.11450 > 127.0.0.1.42864: Flags [P.], cksum 0x26e9 (incorrect -> 0xa6fe), seq 48138:58570, ack 1409, win 512, options [nop,nop,TS val 765900117 ecr 765900116], length 10432
200, 6.94160270690918, 1.2815580368041992