2022-04-05 09:13:36.269354 IP (tos 0x0, ttl 64, id 62691, offset 0, flags [DF], proto TCP (6), length 60)
    127.0.0.1.56268 > 127.0.0.1.11750: Flags [S], cksum 0xfe30 (incorrect -> 0x0fa0), seq 1055787374, win 65495, options [mss 65495,sackOK,TS val 787660640 ecr 0,nop,wscale 7], length 0
2022-04-05 09:13:36.269366 IP (tos 0x0, ttl 64, id 0, offset 0, flags [DF], proto TCP (6), length 60)
    127.0.0.1.11750 > 127.0.0.1.56268: Flags [S.], cksum 0xfe30 (incorrect -> 0x2094), seq 3054717600, ack 1055787375, win 65483, options [mss 65495,sackOK,TS val 787660640 ecr 787660640,nop,wscale 7], length 0
2022-04-05 09:13:36.269397 IP (tos 0x0, ttl 64, id 62692, offset 0, flags [DF], proto TCP (6), length 52)
    127.0.0.1.56268 > 127.0.0.1.11750: Flags [.], cksum 0xfe28 (incorrect -> 0x4750), seq 1, ack 1, win 512, options [nop,nop,TS val 787660640 ecr 787660640], length 0
2022-04-05 09:13:36.269511 IP (tos 0x0, ttl 64, id 62693, offset 0, flags [DF], proto TCP (6), length 55)
    127.0.0.1.56268 > 127.0.0.1.11750: Flags [P.], cksum 0xfe2b (incorrect -> 0x4243), seq 1:4, ack 1, win 512, options [nop,nop,TS val 787660641 ecr 787660640], length 3
2022-04-05 09:13:36.269525 IP (tos 0x0, ttl 64, id 52050, offset 0, flags [DF], proto TCP (6), length 52)
    127.0.0.1.11750 > 127.0.0.1.56268: Flags [.], cksum 0xfe28 (incorrect -> 0x474b), seq 1, ack 4, win 512, options [nop,nop,TS val 787660641 ecr 787660641], length 0
2022-04-05 09:13:36.269633 IP (tos 0x0, ttl 64, id 52051, offset 0, flags [DF], proto TCP (6), length 54)
    127.0.0.1.11750 > 127.0.0.1.56268: Flags [P.], cksum 0xfe2a (incorrect -> 0x4241), seq 1:3, ack 4, win 512, options [nop,nop,TS val 787660641 ecr 787660641], length 2
2022-04-05 09:13:36.269656 IP (tos 0x0, ttl 64, id 62694, offset 0, flags [DF], proto TCP (6), length 52)
    127.0.0.1.56268 > 127.0.0.1.11750: Flags [.], cksum 0xfe28 (incorrect -> 0x4749), seq 4, ack 3, win 512, options [nop,nop,TS val 787660641 ecr 787660641], length 0
2022-04-05 09:13:36.271212 IP (tos 0x0, ttl 64, id 62695, offset 0, flags [DF], proto TCP (6), length 62)
    127.0.0.1.56268 > 127.0.0.1.11750: Flags [P.], cksum 0xfe32 (incorrect -> 0xa809), seq 4:14, ack 3, win 512, options [nop,nop,TS val 787660642 ecr 787660641], length 10
2022-04-05 09:13:36.271232 IP (tos 0x0, ttl 64, id 52052, offset 0, flags [DF], proto TCP (6), length 52)
    127.0.0.1.11750 > 127.0.0.1.56268: Flags [.], cksum 0xfe28 (incorrect -> 0x473d), seq 3, ack 14, win 512, options [nop,nop,TS val 787660642 ecr 787660642], length 0
2022-04-05 09:13:39.521273 IP (tos 0x0, ttl 64, id 52053, offset 0, flags [DF], proto TCP (6), length 62)
    127.0.0.1.11750 > 127.0.0.1.56268: Flags [P.], cksum 0xfe32 (incorrect -> 0x3578), seq 3:13, ack 14, win 512, options [nop,nop,TS val 787663892 ecr 787660642], length 10
2022-04-05 09:13:39.521284 IP (tos 0x0, ttl 64, id 62696, offset 0, flags [DF], proto TCP (6), length 52)
    127.0.0.1.56268 > 127.0.0.1.11750: Flags [.], cksum 0xfe28 (incorrect -> 0x2dcf), seq 14, ack 13, win 512, options [nop,nop,TS val 787663892 ecr 787663892], length 0
2022-04-05 09:13:39.527169 IP (tos 0x0, ttl 64, id 62697, offset 0, flags [DF], proto TCP (6), length 569)
    127.0.0.1.56268 > 127.0.0.1.11750: Flags [P.], cksum 0x002e (incorrect -> 0xa339), seq 14:531, ack 13, win 512, options [nop,nop,TS val 787663898 ecr 787663892], length 517
2022-04-05 09:13:39.527181 IP (tos 0x0, ttl 64, id 52054, offset 0, flags [DF], proto TCP (6), length 52)
    127.0.0.1.11750 > 127.0.0.1.56268: Flags [.], cksum 0xfe28 (incorrect -> 0x2bc2), seq 13, ack 531, win 508, options [nop,nop,TS val 787663898 ecr 787663898], length 0
2022-04-05 09:13:40.992593 IP (tos 0x0, ttl 64, id 52055, offset 0, flags [DF], proto TCP (6), length 3538)
    127.0.0.1.11750 > 127.0.0.1.56268: Flags [P.], cksum 0x0bc7 (incorrect -> 0x6b96), seq 13:3499, ack 531, win 512, options [nop,nop,TS val 787665364 ecr 787663898], length 3486
2022-04-05 09:13:40.992602 IP (tos 0x0, ttl 64, id 62698, offset 0, flags [DF], proto TCP (6), length 52)
    127.0.0.1.56268 > 127.0.0.1.11750: Flags [.], cksum 0xfe28 (incorrect -> 0x12be), seq 531, ack 3499, win 494, options [nop,nop,TS val 787665364 ecr 787665364], length 0
2022-04-05 09:13:41.004666 IP (tos 0x0, ttl 64, id 52056, offset 0, flags [DF], proto TCP (6), length 1048)
    127.0.0.1.11750 > 127.0.0.1.56268: Flags [P.], cksum 0x020d (incorrect -> 0x1cdf), seq 3499:4495, ack 531, win 512, options [nop,nop,TS val 787665376 ecr 787665364], length 996
2022-04-05 09:13:41.004674 IP (tos 0x0, ttl 64, id 62699, offset 0, flags [DF], proto TCP (6), length 52)
    127.0.0.1.56268 > 127.0.0.1.11750: Flags [.], cksum 0xfe28 (incorrect -> 0x0eb8), seq 531, ack 4495, win 504, options [nop,nop,TS val 787665376 ecr 787665376], length 0
2022-04-05 09:13:41.023520 IP (tos 0x0, ttl 64, id 52057, offset 0, flags [DF], proto TCP (6), length 695)
    127.0.0.1.11750 > 127.0.0.1.56268: Flags [P.], cksum 0x00ac (incorrect -> 0xa5df), seq 4495:5138, ack 531, win 512, options [nop,nop,TS val 787665395 ecr 787665376], length 643
2022-04-05 09:13:41.023526 IP (tos 0x0, ttl 64, id 62700, offset 0, flags [DF], proto TCP (6), length 52)
    127.0.0.1.56268 > 127.0.0.1.11750: Flags [.], cksum 0xfe28 (incorrect -> 0x0c0e), seq 531, ack 5138, win 505, options [nop,nop,TS val 787665395 ecr 787665395], length 0
2022-04-05 09:13:41.024115 IP (tos 0x0, ttl 64, id 62701, offset 0, flags [DF], proto TCP (6), length 132)
    127.0.0.1.56268 > 127.0.0.1.11750: Flags [P.], cksum 0xfe78 (incorrect -> 0x5f6f), seq 531:611, ack 5138, win 512, options [nop,nop,TS val 787665395 ecr 787665395], length 80
2022-04-05 09:13:41.024124 IP (tos 0x0, ttl 64, id 52058, offset 0, flags [DF], proto TCP (6), length 52)
    127.0.0.1.11750 > 127.0.0.1.56268: Flags [.], cksum 0xfe28 (incorrect -> 0x0bb7), seq 5138, ack 611, win 512, options [nop,nop,TS val 787665395 ecr 787665395], length 0
2022-04-05 09:13:41.024555 IP (tos 0x0, ttl 64, id 62702, offset 0, flags [DF], proto TCP (6), length 362)
    127.0.0.1.56268 > 127.0.0.1.11750: Flags [P.], cksum 0xff5e (incorrect -> 0x2581), seq 611:921, ack 5138, win 512, options [nop,nop,TS val 787665396 ecr 787665395], length 310
2022-04-05 09:13:41.024560 IP (tos 0x0, ttl 64, id 52059, offset 0, flags [DF], proto TCP (6), length 52)
    127.0.0.1.11750 > 127.0.0.1.56268: Flags [.], cksum 0xfe28 (incorrect -> 0x0a81), seq 5138, ack 921, win 510, options [nop,nop,TS val 787665396 ecr 787665396], length 0
200, 3.7917351722717285, 5.5042572021484375