2022-04-05 01:12:59.002502 IP (tos 0x0, ttl 64, id 25651, offset 0, flags [DF], proto TCP (6), length 60)
    127.0.0.1.45140 > 127.0.0.1.12250: Flags [S], cksum 0xfe30 (incorrect -> 0x1dbf), seq 1484722828, win 65495, options [mss 65495,sackOK,TS val 758823374 ecr 0,nop,wscale 7], length 0
2022-04-05 01:12:59.002517 IP (tos 0x0, ttl 64, id 0, offset 0, flags [DF], proto TCP (6), length 60)
    127.0.0.1.12250 > 127.0.0.1.45140: Flags [S.], cksum 0xfe30 (incorrect -> 0x4800), seq 1398250329, ack 1484722829, win 65483, options [mss 65495,sackOK,TS val 758823374 ecr 758823374,nop,wscale 7], length 0
2022-04-05 01:12:59.002530 IP (tos 0x0, ttl 64, id 25652, offset 0, flags [DF], proto TCP (6), length 52)
    127.0.0.1.45140 > 127.0.0.1.12250: Flags [.], cksum 0xfe28 (incorrect -> 0x6ebc), seq 1, ack 1, win 512, options [nop,nop,TS val 758823374 ecr 758823374], length 0
2022-04-05 01:12:59.002636 IP (tos 0x0, ttl 64, id 25653, offset 0, flags [DF], proto TCP (6), length 55)
    127.0.0.1.45140 > 127.0.0.1.12250: Flags [P.], cksum 0xfe2b (incorrect -> 0x69b0), seq 1:4, ack 1, win 512, options [nop,nop,TS val 758823374 ecr 758823374], length 3
2022-04-05 01:12:59.002651 IP (tos 0x0, ttl 64, id 33275, offset 0, flags [DF], proto TCP (6), length 52)
    127.0.0.1.12250 > 127.0.0.1.45140: Flags [.], cksum 0xfe28 (incorrect -> 0x6eb9), seq 1, ack 4, win 512, options [nop,nop,TS val 758823374 ecr 758823374], length 0
2022-04-05 01:12:59.002735 IP (tos 0x0, ttl 64, id 33276, offset 0, flags [DF], proto TCP (6), length 54)
    127.0.0.1.12250 > 127.0.0.1.45140: Flags [P.], cksum 0xfe2a (incorrect -> 0x69af), seq 1:3, ack 4, win 512, options [nop,nop,TS val 758823374 ecr 758823374], length 2
2022-04-05 01:12:59.002768 IP (tos 0x0, ttl 64, id 25654, offset 0, flags [DF], proto TCP (6), length 52)
    127.0.0.1.45140 > 127.0.0.1.12250: Flags [.], cksum 0xfe28 (incorrect -> 0x6eb7), seq 4, ack 3, win 512, options [nop,nop,TS val 758823374 ecr 758823374], length 0
2022-04-05 01:12:59.004711 IP (tos 0x0, ttl 64, id 25655, offset 0, flags [DF], proto TCP (6), length 62)
    127.0.0.1.45140 > 127.0.0.1.12250: Flags [P.], cksum 0xfe32 (incorrect -> 0x14ee), seq 4:14, ack 3, win 512, options [nop,nop,TS val 758823376 ecr 758823374], length 10
2022-04-05 01:12:59.004734 IP (tos 0x0, ttl 64, id 33277, offset 0, flags [DF], proto TCP (6), length 52)
    127.0.0.1.12250 > 127.0.0.1.45140: Flags [.], cksum 0xfe28 (incorrect -> 0x6ea9), seq 3, ack 14, win 512, options [nop,nop,TS val 758823376 ecr 758823376], length 0
2022-04-05 01:12:59.221598 IP (tos 0x0, ttl 64, id 33278, offset 0, flags [DF], proto TCP (6), length 62)
    127.0.0.1.12250 > 127.0.0.1.45140: Flags [P.], cksum 0xfe32 (incorrect -> 0x68bd), seq 3:13, ack 14, win 512, options [nop,nop,TS val 758823593 ecr 758823376], length 10
2022-04-05 01:12:59.221624 IP (tos 0x0, ttl 64, id 25656, offset 0, flags [DF], proto TCP (6), length 52)
    127.0.0.1.45140 > 127.0.0.1.12250: Flags [.], cksum 0xfe28 (incorrect -> 0x6ced), seq 14, ack 13, win 512, options [nop,nop,TS val 758823593 ecr 758823593], length 0
2022-04-05 01:12:59.227943 IP (tos 0x0, ttl 64, id 25657, offset 0, flags [DF], proto TCP (6), length 569)
    127.0.0.1.45140 > 127.0.0.1.12250: Flags [P.], cksum 0x002e (incorrect -> 0xfd44), seq 14:531, ack 13, win 512, options [nop,nop,TS val 758823599 ecr 758823593], length 517
2022-04-05 01:12:59.227956 IP (tos 0x0, ttl 64, id 33279, offset 0, flags [DF], proto TCP (6), length 52)
    127.0.0.1.12250 > 127.0.0.1.45140: Flags [.], cksum 0xfe28 (incorrect -> 0x6ae0), seq 13, ack 531, win 508, options [nop,nop,TS val 758823599 ecr 758823599], length 0
2022-04-05 01:12:59.444531 IP (tos 0x0, ttl 64, id 33280, offset 0, flags [DF], proto TCP (6), length 3538)
    127.0.0.1.12250 > 127.0.0.1.45140: Flags [P.], cksum 0x0bc7 (incorrect -> 0xf332), seq 13:3499, ack 531, win 512, options [nop,nop,TS val 758823816 ecr 758823599], length 3486
2022-04-05 01:12:59.444549 IP (tos 0x0, ttl 64, id 25658, offset 0, flags [DF], proto TCP (6), length 52)
    127.0.0.1.45140 > 127.0.0.1.12250: Flags [.], cksum 0xfe28 (incorrect -> 0x5b9e), seq 531, ack 3499, win 494, options [nop,nop,TS val 758823816 ecr 758823816], length 0
2022-04-05 01:12:59.542635 IP (tos 0x0, ttl 64, id 33281, offset 0, flags [DF], proto TCP (6), length 1720)
    127.0.0.1.12250 > 127.0.0.1.45140: Flags [P.], cksum 0x04ad (incorrect -> 0xcc16), seq 3499:5167, ack 531, win 512, options [nop,nop,TS val 758823914 ecr 758823816], length 1668
2022-04-05 01:12:59.542646 IP (tos 0x0, ttl 64, id 25659, offset 0, flags [DF], proto TCP (6), length 52)
    127.0.0.1.45140 > 127.0.0.1.12250: Flags [.], cksum 0xfe28 (incorrect -> 0x544f), seq 531, ack 5167, win 501, options [nop,nop,TS val 758823914 ecr 758823914], length 0
2022-04-05 01:12:59.543176 IP (tos 0x0, ttl 64, id 25660, offset 0, flags [DF], proto TCP (6), length 132)
    127.0.0.1.45140 > 127.0.0.1.12250: Flags [P.], cksum 0xfe78 (incorrect -> 0x4f37), seq 531:611, ack 5167, win 512, options [nop,nop,TS val 758823914 ecr 758823914], length 80
2022-04-05 01:12:59.543186 IP (tos 0x0, ttl 64, id 33282, offset 0, flags [DF], proto TCP (6), length 52)
    127.0.0.1.12250 > 127.0.0.1.45140: Flags [.], cksum 0xfe28 (incorrect -> 0x53f4), seq 5167, ack 611, win 512, options [nop,nop,TS val 758823914 ecr 758823914], length 0
2022-04-05 01:12:59.543709 IP (tos 0x0, ttl 64, id 25661, offset 0, flags [DF], proto TCP (6), length 303)
    127.0.0.1.45140 > 127.0.0.1.12250: Flags [P.], cksum 0xff23 (incorrect -> 0xa2a1), seq 611:862, ack 5167, win 512, options [nop,nop,TS val 758823915 ecr 758823914], length 251
2022-04-05 01:12:59.543719 IP (tos 0x0, ttl 64, id 33283, offset 0, flags [DF], proto TCP (6), length 52)
    127.0.0.1.12250 > 127.0.0.1.45140: Flags [.], cksum 0xfe28 (incorrect -> 0x52f8), seq 5167, ack 862, win 511, options [nop,nop,TS val 758823915 ecr 758823915], length 0
2022-04-05 01:12:59.767343 IP (tos 0x0, ttl 64, id 33284, offset 0, flags [DF], proto TCP (6), length 610)
    127.0.0.1.12250 > 127.0.0.1.45140: Flags [P.], cksum 0x0057 (incorrect -> 0x1f06), seq 5167:5725, ack 862, win 512, options [nop,nop,TS val 758824138 ecr 758823915], length 558
2022-04-05 01:12:59.767366 IP (tos 0x0, ttl 64, id 25662, offset 0, flags [DF], proto TCP (6), length 52)
    127.0.0.1.45140 > 127.0.0.1.12250: Flags [.], cksum 0xfe28 (incorrect -> 0x4f0f), seq 862, ack 5725, win 508, options [nop,nop,TS val 758824138 ecr 758824138], length 0
2022-04-05 01:12:59.872305 IP (tos 0x0, ttl 64, id 33285, offset 0, flags [DF], proto TCP (6), length 3194)
    127.0.0.1.12250 > 127.0.0.1.45140: Flags [P.], cksum 0x0a6f (incorrect -> 0x926c), seq 5725:8867, ack 862, win 512, options [nop,nop,TS val 758824243 ecr 758824138], length 3142
2022-04-05 01:12:59.872317 IP (tos 0x0, ttl 64, id 25663, offset 0, flags [DF], proto TCP (6), length 52)
    127.0.0.1.45140 > 127.0.0.1.12250: Flags [.], cksum 0xfe28 (incorrect -> 0x4204), seq 862, ack 8867, win 495, options [nop,nop,TS val 758824243 ecr 758824243], length 0
2022-04-05 01:12:59.885563 IP (tos 0x0, ttl 64, id 33286, offset 0, flags [DF], proto TCP (6), length 1048)
    127.0.0.1.12250 > 127.0.0.1.45140: Flags [P.], cksum 0x020d (incorrect -> 0x06a1), seq 8867:9863, ack 862, win 512, options [nop,nop,TS val 758824257 ecr 758824243], length 996
2022-04-05 01:12:59.885591 IP (tos 0x0, ttl 64, id 25664, offset 0, flags [DF], proto TCP (6), length 52)
    127.0.0.1.45140 > 127.0.0.1.12250: Flags [.], cksum 0xfe28 (incorrect -> 0x3dfb), seq 862, ack 9863, win 504, options [nop,nop,TS val 758824257 ecr 758824257], length 0
2022-04-05 01:12:59.886207 IP (tos 0x0, ttl 64, id 33287, offset 0, flags [DF], proto TCP (6), length 2545)
    127.0.0.1.12250 > 127.0.0.1.45140: Flags [P.], cksum 0x07e6 (incorrect -> 0x0960), seq 9863:12356, ack 862, win 512, options [nop,nop,TS val 758824257 ecr 758824257], length 2493
2022-04-05 01:12:59.886215 IP (tos 0x0, ttl 64, id 25665, offset 0, flags [DF], proto TCP (6), length 52)
    127.0.0.1.45140 > 127.0.0.1.12250: Flags [.], cksum 0xfe28 (incorrect -> 0x3444), seq 862, ack 12356, win 498, options [nop,nop,TS val 758824257 ecr 758824257], length 0
2022-04-05 01:12:59.958869 IP (tos 0x0, ttl 64, id 33288, offset 0, flags [DF], proto TCP (6), length 3640)
    127.0.0.1.12250 > 127.0.0.1.45140: Flags [P.], cksum 0x0c2d (incorrect -> 0x6dda), seq 12356:15944, ack 862, win 512, options [nop,nop,TS val 758824330 ecr 758824257], length 3588
2022-04-05 01:12:59.958888 IP (tos 0x0, ttl 64, id 25666, offset 0, flags [DF], proto TCP (6), length 52)
    127.0.0.1.45140 > 127.0.0.1.12250: Flags [.], cksum 0xfe28 (incorrect -> 0x25b3), seq 862, ack 15944, win 493, options [nop,nop,TS val 758824330 ecr 758824330], length 0
2022-04-05 01:12:59.970496 IP (tos 0x0, ttl 64, id 33289, offset 0, flags [DF], proto TCP (6), length 3446)
    127.0.0.1.12250 > 127.0.0.1.45140: Flags [P.], cksum 0x0b6b (incorrect -> 0x69f5), seq 15944:19338, ack 862, win 512, options [nop,nop,TS val 758824342 ecr 758824330], length 3394
2022-04-05 01:12:59.970507 IP (tos 0x0, ttl 64, id 25667, offset 0, flags [DF], proto TCP (6), length 52)
    127.0.0.1.45140 > 127.0.0.1.12250: Flags [.], cksum 0xfe28 (incorrect -> 0x1858), seq 862, ack 19338, win 494, options [nop,nop,TS val 758824342 ecr 758824342], length 0
2022-04-05 01:12:59.971802 IP (tos 0x0, ttl 64, id 33290, offset 0, flags [DF], proto TCP (6), length 3990)
    127.0.0.1.12250 > 127.0.0.1.45140: Flags [P.], cksum 0x0d8b (incorrect -> 0x9107), seq 19338:23276, ack 862, win 512, options [nop,nop,TS val 758824343 ecr 758824342], length 3938
2022-04-05 01:12:59.971811 IP (tos 0x0, ttl 64, id 25668, offset 0, flags [DF], proto TCP (6), length 52)
    127.0.0.1.45140 > 127.0.0.1.12250: Flags [.], cksum 0xfe28 (incorrect -> 0x08f6), seq 862, ack 23276, win 492, options [nop,nop,TS val 758824343 ecr 758824343], length 0
2022-04-05 01:12:59.972980 IP (tos 0x0, ttl 64, id 33291, offset 0, flags [DF], proto TCP (6), length 4100)
    127.0.0.1.12250 > 127.0.0.1.45140: Flags [P.], cksum 0x0df9 (incorrect -> 0xbbb0), seq 23276:27324, ack 862, win 512, options [nop,nop,TS val 758824344 ecr 758824343], length 4048
2022-04-05 01:12:59.972990 IP (tos 0x0, ttl 64, id 25669, offset 0, flags [DF], proto TCP (6), length 52)
    127.0.0.1.45140 > 127.0.0.1.12250: Flags [.], cksum 0xfe28 (incorrect -> 0xf923), seq 862, ack 27324, win 492, options [nop,nop,TS val 758824344 ecr 758824344], length 0
2022-04-05 01:12:59.972997 IP (tos 0x0, ttl 64, id 33292, offset 0, flags [DF], proto TCP (6), length 3474)
    127.0.0.1.12250 > 127.0.0.1.45140: Flags [P.], cksum 0x0b87 (incorrect -> 0x016c), seq 27324:30746, ack 862, win 512, options [nop,nop,TS val 758824344 ecr 758824344], length 3422
2022-04-05 01:12:59.973002 IP (tos 0x0, ttl 64, id 25670, offset 0, flags [DF], proto TCP (6), length 52)
    127.0.0.1.45140 > 127.0.0.1.12250: Flags [.], cksum 0xfe28 (incorrect -> 0xebd3), seq 862, ack 30746, win 478, options [nop,nop,TS val 758824344 ecr 758824344], length 0
2022-04-05 01:12:59.973019 IP (tos 0x0, ttl 64, id 33293, offset 0, flags [DF], proto TCP (6), length 550)
    127.0.0.1.12250 > 127.0.0.1.45140: Flags [P.], cksum 0x001b (incorrect -> 0xe4da), seq 30746:31244, ack 862, win 512, options [nop,nop,TS val 758824344 ecr 758824344], length 498
2022-04-05 01:12:59.973023 IP (tos 0x0, ttl 64, id 25671, offset 0, flags [DF], proto TCP (6), length 52)
    127.0.0.1.45140 > 127.0.0.1.12250: Flags [.], cksum 0xfe28 (incorrect -> 0xe9e3), seq 862, ack 31244, win 476, options [nop,nop,TS val 758824344 ecr 758824344], length 0
2022-04-05 01:12:59.983530 IP (tos 0x0, ttl 64, id 33294, offset 0, flags [DF], proto TCP (6), length 3538)
    127.0.0.1.12250 > 127.0.0.1.45140: Flags [P.], cksum 0x0bc7 (incorrect -> 0xfc57), seq 31244:34730, ack 862, win 512, options [nop,nop,TS val 758824355 ecr 758824344], length 3486
2022-04-05 01:12:59.983669 IP (tos 0x0, ttl 64, id 25672, offset 0, flags [DF], proto TCP (6), length 52)
    127.0.0.1.45140 > 127.0.0.1.12250: Flags [.], cksum 0xfe28 (incorrect -> 0xdc0b), seq 862, ack 34730, win 512, options [nop,nop,TS val 758824355 ecr 758824355], length 0
2022-04-05 01:12:59.986829 IP (tos 0x0, ttl 64, id 33295, offset 0, flags [DF], proto TCP (6), length 4036)
    127.0.0.1.12250 > 127.0.0.1.45140: Flags [P.], cksum 0x0db9 (incorrect -> 0xd0fe), seq 34730:38714, ack 862, win 512, options [nop,nop,TS val 758824358 ecr 758824355], length 3984
2022-04-05 01:12:59.986972 IP (tos 0x0, ttl 64, id 25673, offset 0, flags [DF], proto TCP (6), length 52)
    127.0.0.1.45140 > 127.0.0.1.12250: Flags [.], cksum 0xfe28 (incorrect -> 0xcc75), seq 862, ack 38714, win 512, options [nop,nop,TS val 758824358 ecr 758824358], length 0
2022-04-05 01:13:00.058703 IP (tos 0x0, ttl 64, id 33296, offset 0, flags [DF], proto TCP (6), length 3538)
    127.0.0.1.12250 > 127.0.0.1.45140: Flags [P.], cksum 0x0bc7 (incorrect -> 0x1409), seq 38714:42200, ack 862, win 512, options [nop,nop,TS val 758824430 ecr 758824358], length 3486
2022-04-05 01:13:00.058953 IP (tos 0x0, ttl 64, id 25674, offset 0, flags [DF], proto TCP (6), length 52)
    127.0.0.1.45140 > 127.0.0.1.12250: Flags [.], cksum 0xfe28 (incorrect -> 0xbe47), seq 862, ack 42200, win 512, options [nop,nop,TS val 758824430 ecr 758824430], length 0
2022-04-05 01:13:00.067946 IP (tos 0x0, ttl 64, id 33297, offset 0, flags [DF], proto TCP (6), length 550)
    127.0.0.1.12250 > 127.0.0.1.45140: Flags [P.], cksum 0x001b (incorrect -> 0x9bff), seq 42200:42698, ack 862, win 512, options [nop,nop,TS val 758824439 ecr 758824430], length 498
2022-04-05 01:13:00.068059 IP (tos 0x0, ttl 64, id 25675, offset 0, flags [DF], proto TCP (6), length 52)
    127.0.0.1.45140 > 127.0.0.1.12250: Flags [.], cksum 0xfe28 (incorrect -> 0xbc43), seq 862, ack 42698, win 512, options [nop,nop,TS val 758824439 ecr 758824439], length 0
2022-04-05 01:13:00.069867 IP (tos 0x0, ttl 64, id 33298, offset 0, flags [DF], proto TCP (6), length 3254)
    127.0.0.1.12250 > 127.0.0.1.45140: Flags [P.], cksum 0x0aab (incorrect -> 0xada1), seq 42698:45900, ack 862, win 512, options [nop,nop,TS val 758824441 ecr 758824439], length 3202
2022-04-05 01:13:00.070012 IP (tos 0x0, ttl 64, id 25676, offset 0, flags [DF], proto TCP (6), length 52)
    127.0.0.1.45140 > 127.0.0.1.12250: Flags [.], cksum 0xfe28 (incorrect -> 0xafbd), seq 862, ack 45900, win 512, options [nop,nop,TS val 758824441 ecr 758824441], length 0
2022-04-05 01:13:00.070118 IP (tos 0x0, ttl 64, id 33299, offset 0, flags [DF], proto TCP (6), length 4100)
    127.0.0.1.12250 > 127.0.0.1.45140: Flags [P.], cksum 0x0df9 (incorrect -> 0xbfb9), seq 45900:49948, ack 862, win 512, options [nop,nop,TS val 758824441 ecr 758824441], length 4048
2022-04-05 01:13:00.086409 IP (tos 0x0, ttl 64, id 33300, offset 0, flags [DF], proto TCP (6), length 32820)
    127.0.0.1.12250 > 127.0.0.1.45140: Flags [.], cksum 0x7e29 (incorrect -> 0xfcd9), seq 49948:82716, ack 862, win 512, options [nop,nop,TS val 758824458 ecr 758824441], length 32768
2022-04-05 01:13:00.086430 IP (tos 0x0, ttl 64, id 25677, offset 0, flags [DF], proto TCP (6), length 52)
    127.0.0.1.45140 > 127.0.0.1.12250: Flags [.], cksum 0xfe28 (incorrect -> 0x2061), seq 862, ack 82716, win 379, options [nop,nop,TS val 758824458 ecr 758824441], length 0
2022-04-05 01:13:00.086438 IP (tos 0x0, ttl 64, id 33301, offset 0, flags [DF], proto TCP (6), length 4416)
    127.0.0.1.12250 > 127.0.0.1.45140: Flags [P.], cksum 0x0f35 (incorrect -> 0xbb68), seq 82716:87080, ack 862, win 512, options [nop,nop,TS val 758824458 ecr 758824458], length 4364
2022-04-05 01:13:00.087664 IP (tos 0x0, ttl 64, id 25678, offset 0, flags [DF], proto TCP (6), length 52)
    127.0.0.1.45140 > 127.0.0.1.12250: Flags [.], cksum 0xfe28 (incorrect -> 0x0ebe), seq 862, ack 87080, win 512, options [nop,nop,TS val 758824459 ecr 758824458], length 0
2022-04-05 01:13:00.155282 IP (tos 0x0, ttl 64, id 33302, offset 0, flags [DF], proto TCP (6), length 3538)
    127.0.0.1.12250 > 127.0.0.1.45140: Flags [P.], cksum 0x0bc7 (incorrect -> 0xd7e1), seq 87080:90566, ack 862, win 512, options [nop,nop,TS val 758824526 ecr 758824459], length 3486
2022-04-05 01:13:00.155439 IP (tos 0x0, ttl 64, id 25679, offset 0, flags [DF], proto TCP (6), length 52)
    127.0.0.1.45140 > 127.0.0.1.12250: Flags [.], cksum 0xfe28 (incorrect -> 0x0098), seq 862, ack 90566, win 512, options [nop,nop,TS val 758824527 ecr 758824526], length 0
2022-04-05 01:13:00.156618 IP (tos 0x0, ttl 64, id 33303, offset 0, flags [DF], proto TCP (6), length 3538)
    127.0.0.1.12250 > 127.0.0.1.45140: Flags [P.], cksum 0x0bc7 (incorrect -> 0x1923), seq 90566:94052, ack 862, win 512, options [nop,nop,TS val 758824528 ecr 758824527], length 3486
200, 3.675776481628418, 1.279111385345459