2022-04-05 10:55:34.999101 IP (tos 0x0, ttl 64, id 58348, offset 0, flags [DF], proto TCP (6), length 60)
    127.0.0.1.55620 > 127.0.0.1.11450: Flags [S], cksum 0xfe30 (incorrect -> 0x31e5), seq 3370207912, win 65495, options [mss 65495,sackOK,TS val 238417502 ecr 0,nop,wscale 7], length 0
2022-04-05 10:55:34.999112 IP (tos 0x0, ttl 64, id 0, offset 0, flags [DF], proto TCP (6), length 60)
    127.0.0.1.11450 > 127.0.0.1.55620: Flags [S.], cksum 0xfe30 (incorrect -> 0xd637), seq 2451948782, ack 3370207913, win 65483, options [mss 65495,sackOK,TS val 238417502 ecr 238417502,nop,wscale 7], length 0
2022-04-05 10:55:34.999123 IP (tos 0x0, ttl 64, id 58349, offset 0, flags [DF], proto TCP (6), length 52)
    127.0.0.1.55620 > 127.0.0.1.11450: Flags [.], cksum 0xfe28 (incorrect -> 0xfcf3), seq 1, ack 1, win 512, options [nop,nop,TS val 238417502 ecr 238417502], length 0
2022-04-05 10:55:34.999266 IP (tos 0x0, ttl 64, id 58350, offset 0, flags [DF], proto TCP (6), length 55)
    127.0.0.1.55620 > 127.0.0.1.11450: Flags [P.], cksum 0xfe2b (incorrect -> 0xf7e7), seq 1:4, ack 1, win 512, options [nop,nop,TS val 238417502 ecr 238417502], length 3
2022-04-05 10:55:34.999274 IP (tos 0x0, ttl 64, id 64068, offset 0, flags [DF], proto TCP (6), length 52)
    127.0.0.1.11450 > 127.0.0.1.55620: Flags [.], cksum 0xfe28 (incorrect -> 0xfcf0), seq 1, ack 4, win 512, options [nop,nop,TS val 238417502 ecr 238417502], length 0
2022-04-05 10:55:34.999296 IP (tos 0x0, ttl 64, id 64069, offset 0, flags [DF], proto TCP (6), length 54)
    127.0.0.1.11450 > 127.0.0.1.55620: Flags [P.], cksum 0xfe2a (incorrect -> 0xf7e6), seq 1:3, ack 4, win 512, options [nop,nop,TS val 238417502 ecr 238417502], length 2
2022-04-05 10:55:34.999305 IP (tos 0x0, ttl 64, id 58351, offset 0, flags [DF], proto TCP (6), length 52)
    127.0.0.1.55620 > 127.0.0.1.11450: Flags [.], cksum 0xfe28 (incorrect -> 0xfcee), seq 4, ack 3, win 512, options [nop,nop,TS val 238417502 ecr 238417502], length 0
2022-04-05 10:55:35.001359 IP (tos 0x0, ttl 64, id 58352, offset 0, flags [DF], proto TCP (6), length 62)
    127.0.0.1.55620 > 127.0.0.1.11450: Flags [P.], cksum 0xfe32 (incorrect -> 0x6c09), seq 4:14, ack 3, win 512, options [nop,nop,TS val 238417504 ecr 238417502], length 10
2022-04-05 10:55:35.001368 IP (tos 0x0, ttl 64, id 64070, offset 0, flags [DF], proto TCP (6), length 52)
    127.0.0.1.11450 > 127.0.0.1.55620: Flags [.], cksum 0xfe28 (incorrect -> 0xfce0), seq 3, ack 14, win 512, options [nop,nop,TS val 238417504 ecr 238417504], length 0
2022-04-05 10:55:35.115755 IP (tos 0x0, ttl 64, id 64071, offset 0, flags [DF], proto TCP (6), length 62)
    127.0.0.1.11450 > 127.0.0.1.55620: Flags [P.], cksum 0xfe32 (incorrect -> 0xf75b), seq 3:13, ack 14, win 512, options [nop,nop,TS val 238417618 ecr 238417504], length 10
2022-04-05 10:55:35.115765 IP (tos 0x0, ttl 64, id 58353, offset 0, flags [DF], proto TCP (6), length 52)
    127.0.0.1.55620 > 127.0.0.1.11450: Flags [.], cksum 0xfe28 (incorrect -> 0xfbf2), seq 14, ack 13, win 512, options [nop,nop,TS val 238417618 ecr 238417618], length 0
2022-04-05 10:55:35.121416 IP (tos 0x0, ttl 64, id 58354, offset 0, flags [DF], proto TCP (6), length 569)
    127.0.0.1.55620 > 127.0.0.1.11450: Flags [P.], cksum 0x002e (incorrect -> 0x0115), seq 14:531, ack 13, win 512, options [nop,nop,TS val 238417624 ecr 238417618], length 517
2022-04-05 10:55:35.121426 IP (tos 0x0, ttl 64, id 64072, offset 0, flags [DF], proto TCP (6), length 52)
    127.0.0.1.11450 > 127.0.0.1.55620: Flags [.], cksum 0xfe28 (incorrect -> 0xf9e5), seq 13, ack 531, win 508, options [nop,nop,TS val 238417624 ecr 238417624], length 0
200, 3.7068886756896973, 0.6482675075531006