2022-04-05 07:23:05.000698 IP (tos 0x0, ttl 64, id 14823, offset 0, flags [DF], proto TCP (6), length 60)
    127.0.0.1.51924 > 127.0.0.1.11150: Flags [S], cksum 0xfe30 (incorrect -> 0x3026), seq 3332809800, win 65495, options [mss 65495,sackOK,TS val 781029372 ecr 0,nop,wscale 7], length 0
2022-04-05 07:23:05.000706 IP (tos 0x0, ttl 64, id 0, offset 0, flags [DF], proto TCP (6), length 60)
    127.0.0.1.11150 > 127.0.0.1.51924: Flags [S.], cksum 0xfe30 (incorrect -> 0x9832), seq 1977181067, ack 3332809801, win 65483, options [mss 65495,sackOK,TS val 781029372 ecr 781029372,nop,wscale 7], length 0
2022-04-05 07:23:05.000713 IP (tos 0x0, ttl 64, id 14824, offset 0, flags [DF], proto TCP (6), length 52)
    127.0.0.1.51924 > 127.0.0.1.11150: Flags [.], cksum 0xfe28 (incorrect -> 0xbeee), seq 1, ack 1, win 512, options [nop,nop,TS val 781029372 ecr 781029372], length 0
2022-04-05 07:23:05.000809 IP (tos 0x0, ttl 64, id 14825, offset 0, flags [DF], proto TCP (6), length 55)
    127.0.0.1.51924 > 127.0.0.1.11150: Flags [P.], cksum 0xfe2b (incorrect -> 0xb9e2), seq 1:4, ack 1, win 512, options [nop,nop,TS val 781029372 ecr 781029372], length 3
2022-04-05 07:23:05.000820 IP (tos 0x0, ttl 64, id 44624, offset 0, flags [DF], proto TCP (6), length 52)
    127.0.0.1.11150 > 127.0.0.1.51924: Flags [.], cksum 0xfe28 (incorrect -> 0xbeeb), seq 1, ack 4, win 512, options [nop,nop,TS val 781029372 ecr 781029372], length 0
2022-04-05 07:23:05.000873 IP (tos 0x0, ttl 64, id 44625, offset 0, flags [DF], proto TCP (6), length 54)
    127.0.0.1.11150 > 127.0.0.1.51924: Flags [P.], cksum 0xfe2a (incorrect -> 0xb9e1), seq 1:3, ack 4, win 512, options [nop,nop,TS val 781029372 ecr 781029372], length 2
2022-04-05 07:23:05.000894 IP (tos 0x0, ttl 64, id 14826, offset 0, flags [DF], proto TCP (6), length 52)
    127.0.0.1.51924 > 127.0.0.1.11150: Flags [.], cksum 0xfe28 (incorrect -> 0xbee9), seq 4, ack 3, win 512, options [nop,nop,TS val 781029372 ecr 781029372], length 0
2022-04-05 07:23:05.015726 IP (tos 0x0, ttl 64, id 14827, offset 0, flags [DF], proto TCP (6), length 62)
    127.0.0.1.51924 > 127.0.0.1.11150: Flags [P.], cksum 0xfe32 (incorrect -> 0x5685), seq 4:14, ack 3, win 512, options [nop,nop,TS val 781029387 ecr 781029372], length 10
2022-04-05 07:23:05.015742 IP (tos 0x0, ttl 64, id 44626, offset 0, flags [DF], proto TCP (6), length 52)
    127.0.0.1.11150 > 127.0.0.1.51924: Flags [.], cksum 0xfe28 (incorrect -> 0xbec1), seq 3, ack 14, win 512, options [nop,nop,TS val 781029387 ecr 781029387], length 0
2022-04-05 07:23:05.087952 IP (tos 0x0, ttl 64, id 44627, offset 0, flags [DF], proto TCP (6), length 62)
    127.0.0.1.11150 > 127.0.0.1.51924: Flags [P.], cksum 0xfe32 (incorrect -> 0xb966), seq 3:13, ack 14, win 512, options [nop,nop,TS val 781029459 ecr 781029387], length 10
2022-04-05 07:23:05.087968 IP (tos 0x0, ttl 64, id 14828, offset 0, flags [DF], proto TCP (6), length 52)
    127.0.0.1.51924 > 127.0.0.1.11150: Flags [.], cksum 0xfe28 (incorrect -> 0xbe27), seq 14, ack 13, win 512, options [nop,nop,TS val 781029459 ecr 781029459], length 0
2022-04-05 07:23:05.093470 IP (tos 0x0, ttl 64, id 14829, offset 0, flags [DF], proto TCP (6), length 569)
    127.0.0.1.51924 > 127.0.0.1.11150: Flags [P.], cksum 0x002e (incorrect -> 0x35fb), seq 14:531, ack 13, win 512, options [nop,nop,TS val 781029465 ecr 781029459], length 517
2022-04-05 07:23:05.093481 IP (tos 0x0, ttl 64, id 44628, offset 0, flags [DF], proto TCP (6), length 52)
    127.0.0.1.11150 > 127.0.0.1.51924: Flags [.], cksum 0xfe28 (incorrect -> 0xbc1a), seq 13, ack 531, win 508, options [nop,nop,TS val 781029465 ecr 781029465], length 0
2022-04-05 07:23:05.187725 IP (tos 0x0, ttl 64, id 44629, offset 0, flags [DF], proto TCP (6), length 3538)
    127.0.0.1.11150 > 127.0.0.1.51924: Flags [P.], cksum 0x0bc7 (incorrect -> 0xc5bb), seq 13:3499, ack 531, win 512, options [nop,nop,TS val 781029559 ecr 781029465], length 3486
2022-04-05 07:23:05.187746 IP (tos 0x0, ttl 64, id 14830, offset 0, flags [DF], proto TCP (6), length 52)
    127.0.0.1.51924 > 127.0.0.1.11150: Flags [.], cksum 0xfe28 (incorrect -> 0xadce), seq 531, ack 3499, win 494, options [nop,nop,TS val 781029559 ecr 781029559], length 0
2022-04-05 07:23:05.200400 IP (tos 0x0, ttl 64, id 44630, offset 0, flags [DF], proto TCP (6), length 730)
    127.0.0.1.11150 > 127.0.0.1.51924: Flags [P.], cksum 0x00cf (incorrect -> 0x7e64), seq 3499:4177, ack 531, win 512, options [nop,nop,TS val 781029572 ecr 781029559], length 678
2022-04-05 07:23:05.200412 IP (tos 0x0, ttl 64, id 14831, offset 0, flags [DF], proto TCP (6), length 52)
    127.0.0.1.51924 > 127.0.0.1.11150: Flags [.], cksum 0xfe28 (incorrect -> 0xab03), seq 531, ack 4177, win 505, options [nop,nop,TS val 781029572 ecr 781029572], length 0
2022-04-05 07:23:05.254214 IP (tos 0x0, ttl 64, id 44631, offset 0, flags [DF], proto TCP (6), length 816)
    127.0.0.1.11150 > 127.0.0.1.51924: Flags [P.], cksum 0x0125 (incorrect -> 0xfa9b), seq 4177:4941, ack 531, win 512, options [nop,nop,TS val 781029625 ecr 781029572], length 764
2022-04-05 07:23:05.254224 IP (tos 0x0, ttl 64, id 14832, offset 0, flags [DF], proto TCP (6), length 52)
    127.0.0.1.51924 > 127.0.0.1.11150: Flags [.], cksum 0xfe28 (incorrect -> 0xa79d), seq 531, ack 4941, win 505, options [nop,nop,TS val 781029625 ecr 781029625], length 0
2022-04-05 07:23:05.256909 IP (tos 0x0, ttl 64, id 14833, offset 0, flags [DF], proto TCP (6), length 116)
    127.0.0.1.51924 > 127.0.0.1.11150: Flags [P.], cksum 0xfe68 (incorrect -> 0x6c00), seq 531:595, ack 4941, win 512, options [nop,nop,TS val 781029628 ecr 781029625], length 64
2022-04-05 07:23:05.256917 IP (tos 0x0, ttl 64, id 44632, offset 0, flags [DF], proto TCP (6), length 52)
    127.0.0.1.11150 > 127.0.0.1.51924: Flags [.], cksum 0xfe28 (incorrect -> 0xa750), seq 4941, ack 595, win 512, options [nop,nop,TS val 781029628 ecr 781029628], length 0
2022-04-05 07:23:05.257380 IP (tos 0x0, ttl 64, id 14834, offset 0, flags [DF], proto TCP (6), length 326)
    127.0.0.1.51924 > 127.0.0.1.11150: Flags [P.], cksum 0xff3a (incorrect -> 0x71e7), seq 595:869, ack 4941, win 512, options [nop,nop,TS val 781029628 ecr 781029628], length 274
2022-04-05 07:23:05.257385 IP (tos 0x0, ttl 64, id 44633, offset 0, flags [DF], proto TCP (6), length 52)
    127.0.0.1.11150 > 127.0.0.1.51924: Flags [.], cksum 0xfe28 (incorrect -> 0xa640), seq 4941, ack 869, win 510, options [nop,nop,TS val 781029628 ecr 781029628], length 0
2022-04-05 07:23:05.728170 IP (tos 0x0, ttl 64, id 44634, offset 0, flags [DF], proto TCP (6), length 1919)
    127.0.0.1.11150 > 127.0.0.1.51924: Flags [P.], cksum 0x0574 (incorrect -> 0x8e37), seq 4941:6808, ack 869, win 512, options [nop,nop,TS val 781030099 ecr 781029628], length 1867
2022-04-05 07:23:05.728207 IP (tos 0x0, ttl 64, id 14835, offset 0, flags [DF], proto TCP (6), length 52)
    127.0.0.1.51924 > 127.0.0.1.11150: Flags [.], cksum 0xfe28 (incorrect -> 0x9b51), seq 869, ack 6808, win 500, options [nop,nop,TS val 781030099 ecr 781030099], length 0
2022-04-05 07:23:05.740665 IP (tos 0x0, ttl 64, id 44635, offset 0, flags [DF], proto TCP (6), length 3538)
    127.0.0.1.11150 > 127.0.0.1.51924: Flags [P.], cksum 0x0bc7 (incorrect -> 0x7835), seq 6808:10294, ack 869, win 512, options [nop,nop,TS val 781030112 ecr 781030099], length 3486
2022-04-05 07:23:05.740675 IP (tos 0x0, ttl 64, id 14836, offset 0, flags [DF], proto TCP (6), length 52)
    127.0.0.1.51924 > 127.0.0.1.11150: Flags [.], cksum 0xfe28 (incorrect -> 0x8d9f), seq 869, ack 10294, win 494, options [nop,nop,TS val 781030112 ecr 781030112], length 0
2022-04-05 07:23:05.753309 IP (tos 0x0, ttl 64, id 44636, offset 0, flags [DF], proto TCP (6), length 1250)
    127.0.0.1.11150 > 127.0.0.1.51924: Flags [P.], cksum 0x02d7 (incorrect -> 0x23fc), seq 10294:11492, ack 869, win 512, options [nop,nop,TS val 781030124 ecr 781030112], length 1198
2022-04-05 07:23:05.753329 IP (tos 0x0, ttl 64, id 14837, offset 0, flags [DF], proto TCP (6), length 52)
    127.0.0.1.51924 > 127.0.0.1.11150: Flags [.], cksum 0xfe28 (incorrect -> 0x88d0), seq 869, ack 11492, win 503, options [nop,nop,TS val 781030124 ecr 781030124], length 0
2022-04-05 07:23:05.818958 IP (tos 0x0, ttl 64, id 44637, offset 0, flags [DF], proto TCP (6), length 3538)
    127.0.0.1.11150 > 127.0.0.1.51924: Flags [P.], cksum 0x0bc7 (incorrect -> 0xb931), seq 11492:14978, ack 869, win 512, options [nop,nop,TS val 781030190 ecr 781030124], length 3486
2022-04-05 07:23:05.818974 IP (tos 0x0, ttl 64, id 14838, offset 0, flags [DF], proto TCP (6), length 52)
    127.0.0.1.51924 > 127.0.0.1.11150: Flags [.], cksum 0xfe28 (incorrect -> 0x7ab7), seq 869, ack 14978, win 494, options [nop,nop,TS val 781030190 ecr 781030190], length 0
2022-04-05 07:23:05.820771 IP (tos 0x0, ttl 64, id 44638, offset 0, flags [DF], proto TCP (6), length 4100)
    127.0.0.1.11150 > 127.0.0.1.51924: Flags [P.], cksum 0x0df9 (incorrect -> 0xec99), seq 14978:19026, ack 869, win 512, options [nop,nop,TS val 781030192 ecr 781030190], length 4048
2022-04-05 07:23:05.820779 IP (tos 0x0, ttl 64, id 14839, offset 0, flags [DF], proto TCP (6), length 52)
    127.0.0.1.51924 > 127.0.0.1.11150: Flags [.], cksum 0xfe28 (incorrect -> 0x6ae5), seq 869, ack 19026, win 492, options [nop,nop,TS val 781030192 ecr 781030192], length 0
2022-04-05 07:23:05.820784 IP (tos 0x0, ttl 64, id 44639, offset 0, flags [DF], proto TCP (6), length 2782)
    127.0.0.1.11150 > 127.0.0.1.51924: Flags [P.], cksum 0x08d3 (incorrect -> 0x1819), seq 19026:21756, ack 869, win 512, options [nop,nop,TS val 781030192 ecr 781030192], length 2730
2022-04-05 07:23:05.820786 IP (tos 0x0, ttl 64, id 14840, offset 0, flags [DF], proto TCP (6), length 52)
    127.0.0.1.51924 > 127.0.0.1.11150: Flags [.], cksum 0xfe28 (incorrect -> 0x6046), seq 869, ack 21756, win 481, options [nop,nop,TS val 781030192 ecr 781030192], length 0
2022-04-05 07:23:05.838967 IP (tos 0x0, ttl 64, id 44640, offset 0, flags [DF], proto TCP (6), length 3538)
    127.0.0.1.11150 > 127.0.0.1.51924: Flags [P.], cksum 0x0bc7 (incorrect -> 0x5b5b), seq 21756:25242, ack 869, win 512, options [nop,nop,TS val 781030210 ecr 781030192], length 3486
2022-04-05 07:23:05.838975 IP (tos 0x0, ttl 64, id 14841, offset 0, flags [DF], proto TCP (6), length 52)
    127.0.0.1.51924 > 127.0.0.1.11150: Flags [.], cksum 0xfe28 (incorrect -> 0x5277), seq 869, ack 25242, win 494, options [nop,nop,TS val 781030210 ecr 781030210], length 0
2022-04-05 07:23:05.841137 IP (tos 0x0, ttl 64, id 44641, offset 0, flags [DF], proto TCP (6), length 4100)
    127.0.0.1.11150 > 127.0.0.1.51924: Flags [P.], cksum 0x0df9 (incorrect -> 0x00aa), seq 25242:29290, ack 869, win 512, options [nop,nop,TS val 781030212 ecr 781030210], length 4048
2022-04-05 07:23:05.841144 IP (tos 0x0, ttl 64, id 14842, offset 0, flags [DF], proto TCP (6), length 52)
    127.0.0.1.51924 > 127.0.0.1.11150: Flags [.], cksum 0xfe28 (incorrect -> 0x42a5), seq 869, ack 29290, win 492, options [nop,nop,TS val 781030212 ecr 781030212], length 0
2022-04-05 07:23:05.841149 IP (tos 0x0, ttl 64, id 44642, offset 0, flags [DF], proto TCP (6), length 3474)
    127.0.0.1.11150 > 127.0.0.1.51924: Flags [P.], cksum 0x0b87 (incorrect -> 0x753c), seq 29290:32712, ack 869, win 512, options [nop,nop,TS val 781030212 ecr 781030212], length 3422
2022-04-05 07:23:05.841157 IP (tos 0x0, ttl 64, id 14843, offset 0, flags [DF], proto TCP (6), length 52)
    127.0.0.1.51924 > 127.0.0.1.11150: Flags [.], cksum 0xfe28 (incorrect -> 0x3557), seq 869, ack 32712, win 476, options [nop,nop,TS val 781030212 ecr 781030212], length 0
2022-04-05 07:23:05.851603 IP (tos 0x0, ttl 64, id 44643, offset 0, flags [DF], proto TCP (6), length 2571)
    127.0.0.1.11150 > 127.0.0.1.51924: Flags [P.], cksum 0x0800 (incorrect -> 0xc02f), seq 32712:35231, ack 869, win 512, options [nop,nop,TS val 781030223 ecr 781030212], length 2519
2022-04-05 07:23:05.852077 IP (tos 0x0, ttl 64, id 14844, offset 0, flags [DF], proto TCP (6), length 52)
    127.0.0.1.51924 > 127.0.0.1.11150: Flags [.], cksum 0xfe28 (incorrect -> 0x2b46), seq 869, ack 35231, win 512, options [nop,nop,TS val 781030223 ecr 781030223], length 0
2022-04-05 07:23:05.906770 IP (tos 0x0, ttl 64, id 44644, offset 0, flags [DF], proto TCP (6), length 3538)
    127.0.0.1.11150 > 127.0.0.1.51924: Flags [P.], cksum 0x0bc7 (incorrect -> 0x5110), seq 35231:38717, ack 869, win 512, options [nop,nop,TS val 781030278 ecr 781030223], length 3486
2022-04-05 07:23:05.906791 IP (tos 0x0, ttl 64, id 14845, offset 0, flags [DF], proto TCP (6), length 52)
    127.0.0.1.51924 > 127.0.0.1.11150: Flags [.], cksum 0xfe28 (incorrect -> 0x1d3a), seq 869, ack 38717, win 512, options [nop,nop,TS val 781030278 ecr 781030278], length 0
2022-04-05 07:23:05.906836 IP (tos 0x0, ttl 64, id 44645, offset 0, flags [DF], proto TCP (6), length 1546)
    127.0.0.1.11150 > 127.0.0.1.51924: Flags [P.], cksum 0x03ff (incorrect -> 0x0dbe), seq 38717:40211, ack 869, win 512, options [nop,nop,TS val 781030278 ecr 781030278], length 1494
2022-04-05 07:23:05.906849 IP (tos 0x0, ttl 64, id 14846, offset 0, flags [DF], proto TCP (6), length 52)
    127.0.0.1.51924 > 127.0.0.1.11150: Flags [.], cksum 0xfe28 (incorrect -> 0x1764), seq 869, ack 40211, win 512, options [nop,nop,TS val 781030278 ecr 781030278], length 0
2022-04-05 07:23:05.908536 IP (tos 0x0, ttl 64, id 44646, offset 0, flags [DF], proto TCP (6), length 2542)
    127.0.0.1.11150 > 127.0.0.1.51924: Flags [P.], cksum 0x07e3 (incorrect -> 0x0998), seq 40211:42701, ack 869, win 512, options [nop,nop,TS val 781030280 ecr 781030278], length 2490
2022-04-05 07:23:05.908554 IP (tos 0x0, ttl 64, id 14847, offset 0, flags [DF], proto TCP (6), length 52)
    127.0.0.1.51924 > 127.0.0.1.11150: Flags [.], cksum 0xfe28 (incorrect -> 0x0da6), seq 869, ack 42701, win 512, options [nop,nop,TS val 781030280 ecr 781030280], length 0
2022-04-05 07:23:05.908566 IP (tos 0x0, ttl 64, id 44647, offset 0, flags [DF], proto TCP (6), length 3538)
    127.0.0.1.11150 > 127.0.0.1.51924: Flags [P.], cksum 0x0bc7 (incorrect -> 0x88c6), seq 42701:46187, ack 869, win 512, options [nop,nop,TS val 781030280 ecr 781030280], length 3486
2022-04-05 07:23:05.908599 IP (tos 0x0, ttl 64, id 14848, offset 0, flags [DF], proto TCP (6), length 52)
    127.0.0.1.51924 > 127.0.0.1.11150: Flags [.], cksum 0xfe28 (incorrect -> 0x0008), seq 869, ack 46187, win 512, options [nop,nop,TS val 781030280 ecr 781030280], length 0
2022-04-05 07:23:05.908638 IP (tos 0x0, ttl 64, id 44648, offset 0, flags [DF], proto TCP (6), length 4100)
    127.0.0.1.11150 > 127.0.0.1.51924: Flags [P.], cksum 0x0df9 (incorrect -> 0xa85d), seq 46187:50235, ack 869, win 512, options [nop,nop,TS val 781030280 ecr 781030280], length 4048
2022-04-05 07:23:05.949385 IP (tos 0x0, ttl 64, id 14849, offset 0, flags [DF], proto TCP (6), length 52)
    127.0.0.1.51924 > 127.0.0.1.11150: Flags [.], cksum 0xfe28 (incorrect -> 0xf00f), seq 869, ack 50235, win 512, options [nop,nop,TS val 781030320 ecr 781030280], length 0
2022-04-05 07:23:05.949393 IP (tos 0x0, ttl 64, id 44649, offset 0, flags [DF], proto TCP (6), length 14094)
    127.0.0.1.11150 > 127.0.0.1.51924: Flags [P.], cksum 0x3503 (incorrect -> 0xd60f), seq 50235:64277, ack 869, win 512, options [nop,nop,TS val 781030320 ecr 781030320], length 14042
2022-04-05 07:23:05.993381 IP (tos 0x0, ttl 64, id 14850, offset 0, flags [DF], proto TCP (6), length 52)
    127.0.0.1.51924 > 127.0.0.1.11150: Flags [.], cksum 0xfe28 (incorrect -> 0xb8e1), seq 869, ack 64277, win 512, options [nop,nop,TS val 781030364 ecr 781030320], length 0
2022-04-05 07:23:05.993392 IP (tos 0x0, ttl 64, id 44650, offset 0, flags [DF], proto TCP (6), length 30436)
    127.0.0.1.11150 > 127.0.0.1.51924: Flags [P.], cksum 0x74d9 (incorrect -> 0xbfab), seq 64277:94661, ack 869, win 512, options [nop,nop,TS val 781030364 ecr 781030364], length 30384
200, 126.4072654247284, 1.0140197277069092