2022-04-05 17:42:06.410685 IP (tos 0x0, ttl 64, id 35324, offset 0, flags [DF], proto TCP (6), length 60)
    127.0.0.1.44838 > 127.0.0.1.10650: Flags [S], cksum 0xfe30 (incorrect -> 0x47eb), seq 2306240740, win 65495, options [mss 65495,sackOK,TS val 262808913 ecr 0,nop,wscale 7], length 0
2022-04-05 17:42:06.410696 IP (tos 0x0, ttl 64, id 0, offset 0, flags [DF], proto TCP (6), length 60)
    127.0.0.1.10650 > 127.0.0.1.44838: Flags [S.], cksum 0xfe30 (incorrect -> 0xaaaa), seq 1840052883, ack 2306240741, win 65483, options [mss 65495,sackOK,TS val 262808913 ecr 262808913,nop,wscale 7], length 0
2022-04-05 17:42:06.410704 IP (tos 0x0, ttl 64, id 35325, offset 0, flags [DF], proto TCP (6), length 52)
    127.0.0.1.44838 > 127.0.0.1.10650: Flags [.], cksum 0xfe28 (incorrect -> 0xd166), seq 1, ack 1, win 512, options [nop,nop,TS val 262808913 ecr 262808913], length 0
2022-04-05 17:42:06.410841 IP (tos 0x0, ttl 64, id 35326, offset 0, flags [DF], proto TCP (6), length 55)
    127.0.0.1.44838 > 127.0.0.1.10650: Flags [P.], cksum 0xfe2b (incorrect -> 0xcc5a), seq 1:4, ack 1, win 512, options [nop,nop,TS val 262808913 ecr 262808913], length 3
2022-04-05 17:42:06.410848 IP (tos 0x0, ttl 64, id 52044, offset 0, flags [DF], proto TCP (6), length 52)
    127.0.0.1.10650 > 127.0.0.1.44838: Flags [.], cksum 0xfe28 (incorrect -> 0xd163), seq 1, ack 4, win 512, options [nop,nop,TS val 262808913 ecr 262808913], length 0
2022-04-05 17:42:06.410871 IP (tos 0x0, ttl 64, id 52045, offset 0, flags [DF], proto TCP (6), length 54)
    127.0.0.1.10650 > 127.0.0.1.44838: Flags [P.], cksum 0xfe2a (incorrect -> 0xcc59), seq 1:3, ack 4, win 512, options [nop,nop,TS val 262808913 ecr 262808913], length 2
2022-04-05 17:42:06.410879 IP (tos 0x0, ttl 64, id 35327, offset 0, flags [DF], proto TCP (6), length 52)
    127.0.0.1.44838 > 127.0.0.1.10650: Flags [.], cksum 0xfe28 (incorrect -> 0xd161), seq 4, ack 3, win 512, options [nop,nop,TS val 262808913 ecr 262808913], length 0
2022-04-05 17:42:06.412345 IP (tos 0x0, ttl 64, id 35328, offset 0, flags [DF], proto TCP (6), length 62)
    127.0.0.1.44838 > 127.0.0.1.10650: Flags [P.], cksum 0xfe32 (incorrect -> 0x0dc0), seq 4:14, ack 3, win 512, options [nop,nop,TS val 262808915 ecr 262808913], length 10
2022-04-05 17:42:06.412366 IP (tos 0x0, ttl 64, id 52046, offset 0, flags [DF], proto TCP (6), length 52)
    127.0.0.1.10650 > 127.0.0.1.44838: Flags [.], cksum 0xfe28 (incorrect -> 0xd153), seq 3, ack 14, win 512, options [nop,nop,TS val 262808915 ecr 262808915], length 0
2022-04-05 17:42:10.252399 IP (tos 0x0, ttl 64, id 52047, offset 0, flags [DF], proto TCP (6), length 62)
    127.0.0.1.10650 > 127.0.0.1.44838: Flags [P.], cksum 0xfe32 (incorrect -> 0xbd40), seq 3:13, ack 14, win 512, options [nop,nop,TS val 262812755 ecr 262808915], length 10
2022-04-05 17:42:10.252409 IP (tos 0x0, ttl 64, id 35329, offset 0, flags [DF], proto TCP (6), length 52)
    127.0.0.1.44838 > 127.0.0.1.10650: Flags [.], cksum 0xfe28 (incorrect -> 0xb349), seq 14, ack 13, win 512, options [nop,nop,TS val 262812755 ecr 262812755], length 0
2022-04-05 17:42:10.258026 IP (tos 0x0, ttl 64, id 35330, offset 0, flags [DF], proto TCP (6), length 569)
    127.0.0.1.44838 > 127.0.0.1.10650: Flags [P.], cksum 0x002e (incorrect -> 0x44a2), seq 14:531, ack 13, win 512, options [nop,nop,TS val 262812760 ecr 262812755], length 517
2022-04-05 17:42:10.258034 IP (tos 0x0, ttl 64, id 52048, offset 0, flags [DF], proto TCP (6), length 52)
    127.0.0.1.10650 > 127.0.0.1.44838: Flags [.], cksum 0xfe28 (incorrect -> 0xb13e), seq 13, ack 531, win 508, options [nop,nop,TS val 262812760 ecr 262812760], length 0
2022-04-05 17:42:12.197339 IP (tos 0x0, ttl 64, id 52049, offset 0, flags [DF], proto TCP (6), length 3420)
    127.0.0.1.10650 > 127.0.0.1.44838: Flags [P.], cksum 0x0b51 (incorrect -> 0xc335), seq 13:3381, ack 531, win 512, options [nop,nop,TS val 262814700 ecr 262812760], length 3368
2022-04-05 17:42:12.197348 IP (tos 0x0, ttl 64, id 35331, offset 0, flags [DF], proto TCP (6), length 52)
    127.0.0.1.44838 > 127.0.0.1.10650: Flags [.], cksum 0xfe28 (incorrect -> 0x94fc), seq 531, ack 3381, win 494, options [nop,nop,TS val 262814700 ecr 262814700], length 0
2022-04-05 17:42:12.197938 IP (tos 0x0, ttl 64, id 35332, offset 0, flags [DF], proto TCP (6), length 116)
    127.0.0.1.44838 > 127.0.0.1.10650: Flags [P.], cksum 0xfe68 (incorrect -> 0x1102), seq 531:595, ack 3381, win 512, options [nop,nop,TS val 262814700 ecr 262814700], length 64
2022-04-05 17:42:12.197945 IP (tos 0x0, ttl 64, id 52050, offset 0, flags [DF], proto TCP (6), length 52)
    127.0.0.1.10650 > 127.0.0.1.44838: Flags [.], cksum 0xfe28 (incorrect -> 0x94aa), seq 3381, ack 595, win 512, options [nop,nop,TS val 262814700 ecr 262814700], length 0
2022-04-05 17:42:12.198295 IP (tos 0x0, ttl 64, id 35333, offset 0, flags [DF], proto TCP (6), length 328)
    127.0.0.1.44838 > 127.0.0.1.10650: Flags [P.], cksum 0xff3c (incorrect -> 0xcd34), seq 595:871, ack 3381, win 512, options [nop,nop,TS val 262814701 ecr 262814700], length 276
2022-04-05 17:42:12.198310 IP (tos 0x0, ttl 64, id 52051, offset 0, flags [DF], proto TCP (6), length 52)
    127.0.0.1.10650 > 127.0.0.1.44838: Flags [.], cksum 0xfe28 (incorrect -> 0x9396), seq 3381, ack 871, win 510, options [nop,nop,TS val 262814701 ecr 262814701], length 0
2022-04-05 17:42:12.597439 IP (tos 0x0, ttl 64, id 52052, offset 0, flags [DF], proto TCP (6), length 2028)
    127.0.0.1.10650 > 127.0.0.1.44838: Flags [P.], cksum 0x05e1 (incorrect -> 0x56fe), seq 3381:5357, ack 871, win 512, options [nop,nop,TS val 262815100 ecr 262814701], length 1976
2022-04-05 17:42:12.597451 IP (tos 0x0, ttl 64, id 35334, offset 0, flags [DF], proto TCP (6), length 52)
    127.0.0.1.44838 > 127.0.0.1.10650: Flags [.], cksum 0xfe28 (incorrect -> 0x88ca), seq 871, ack 5357, win 500, options [nop,nop,TS val 262815100 ecr 262815100], length 0
2022-04-05 17:42:12.599880 IP (tos 0x0, ttl 64, id 63831, offset 0, flags [DF], proto TCP (6), length 60)
    127.0.0.1.44840 > 127.0.0.1.10650: Flags [S], cksum 0xfe30 (incorrect -> 0x7513), seq 3551584594, win 65495, options [mss 65495,sackOK,TS val 262815102 ecr 0,nop,wscale 7], length 0
2022-04-05 17:42:12.599889 IP (tos 0x0, ttl 64, id 0, offset 0, flags [DF], proto TCP (6), length 60)
    127.0.0.1.10650 > 127.0.0.1.44840: Flags [S.], cksum 0xfe30 (incorrect -> 0xea4d), seq 3860748153, ack 3551584595, win 65483, options [mss 65495,sackOK,TS val 262815102 ecr 262815102,nop,wscale 7], length 0
2022-04-05 17:42:12.599896 IP (tos 0x0, ttl 64, id 63832, offset 0, flags [DF], proto TCP (6), length 52)
    127.0.0.1.44840 > 127.0.0.1.10650: Flags [.], cksum 0xfe28 (incorrect -> 0x110a), seq 1, ack 1, win 512, options [nop,nop,TS val 262815102 ecr 262815102], length 0
2022-04-05 17:42:12.599948 IP (tos 0x0, ttl 64, id 63833, offset 0, flags [DF], proto TCP (6), length 55)
    127.0.0.1.44840 > 127.0.0.1.10650: Flags [P.], cksum 0xfe2b (incorrect -> 0x0bfe), seq 1:4, ack 1, win 512, options [nop,nop,TS val 262815102 ecr 262815102], length 3
2022-04-05 17:42:12.599951 IP (tos 0x0, ttl 64, id 25948, offset 0, flags [DF], proto TCP (6), length 52)
    127.0.0.1.10650 > 127.0.0.1.44840: Flags [.], cksum 0xfe28 (incorrect -> 0x1107), seq 1, ack 4, win 512, options [nop,nop,TS val 262815102 ecr 262815102], length 0
2022-04-05 17:42:12.599995 IP (tos 0x0, ttl 64, id 25949, offset 0, flags [DF], proto TCP (6), length 54)
    127.0.0.1.10650 > 127.0.0.1.44840: Flags [P.], cksum 0xfe2a (incorrect -> 0x0bfd), seq 1:3, ack 4, win 512, options [nop,nop,TS val 262815102 ecr 262815102], length 2
2022-04-05 17:42:12.600000 IP (tos 0x0, ttl 64, id 63834, offset 0, flags [DF], proto TCP (6), length 52)
    127.0.0.1.44840 > 127.0.0.1.10650: Flags [.], cksum 0xfe28 (incorrect -> 0x1105), seq 4, ack 3, win 512, options [nop,nop,TS val 262815102 ecr 262815102], length 0
2022-04-05 17:42:12.621389 IP (tos 0x0, ttl 64, id 63835, offset 0, flags [DF], proto TCP (6), length 62)
    127.0.0.1.44840 > 127.0.0.1.10650: Flags [P.], cksum 0xfe32 (incorrect -> 0x4d4f), seq 4:14, ack 3, win 512, options [nop,nop,TS val 262815124 ecr 262815102], length 10
2022-04-05 17:42:12.621415 IP (tos 0x0, ttl 64, id 25950, offset 0, flags [DF], proto TCP (6), length 52)
    127.0.0.1.10650 > 127.0.0.1.44840: Flags [.], cksum 0xfe28 (incorrect -> 0x10cf), seq 3, ack 14, win 512, options [nop,nop,TS val 262815124 ecr 262815124], length 0
2022-04-05 17:42:12.786842 IP (tos 0x0, ttl 64, id 25951, offset 0, flags [DF], proto TCP (6), length 62)
    127.0.0.1.10650 > 127.0.0.1.44840: Flags [P.], cksum 0xfe32 (incorrect -> 0x0b17), seq 3:13, ack 14, win 512, options [nop,nop,TS val 262815289 ecr 262815124], length 10
2022-04-05 17:42:12.786852 IP (tos 0x0, ttl 64, id 63836, offset 0, flags [DF], proto TCP (6), length 52)
    127.0.0.1.44840 > 127.0.0.1.10650: Flags [.], cksum 0xfe28 (incorrect -> 0x0f7b), seq 14, ack 13, win 512, options [nop,nop,TS val 262815289 ecr 262815289], length 0
2022-04-05 17:42:12.791827 IP (tos 0x0, ttl 64, id 63837, offset 0, flags [DF], proto TCP (6), length 569)
    127.0.0.1.44840 > 127.0.0.1.10650: Flags [P.], cksum 0x002e (incorrect -> 0x66c5), seq 14:531, ack 13, win 512, options [nop,nop,TS val 262815294 ecr 262815289], length 517
2022-04-05 17:42:12.791836 IP (tos 0x0, ttl 64, id 25952, offset 0, flags [DF], proto TCP (6), length 52)
    127.0.0.1.10650 > 127.0.0.1.44840: Flags [.], cksum 0xfe28 (incorrect -> 0x0d70), seq 13, ack 531, win 508, options [nop,nop,TS val 262815294 ecr 262815294], length 0
2022-04-05 17:42:13.012657 IP (tos 0x0, ttl 64, id 25953, offset 0, flags [DF], proto TCP (6), length 3421)
    127.0.0.1.10650 > 127.0.0.1.44840: Flags [P.], cksum 0x0b52 (incorrect -> 0xa520), seq 13:3382, ack 531, win 512, options [nop,nop,TS val 262815515 ecr 262815294], length 3369
2022-04-05 17:42:13.012673 IP (tos 0x0, ttl 64, id 63838, offset 0, flags [DF], proto TCP (6), length 52)
    127.0.0.1.44840 > 127.0.0.1.10650: Flags [.], cksum 0xfe28 (incorrect -> 0xfe9a), seq 531, ack 3382, win 494, options [nop,nop,TS val 262815515 ecr 262815515], length 0
2022-04-05 17:42:13.013264 IP (tos 0x0, ttl 64, id 63839, offset 0, flags [DF], proto TCP (6), length 116)
    127.0.0.1.44840 > 127.0.0.1.10650: Flags [P.], cksum 0xfe68 (incorrect -> 0x827c), seq 531:595, ack 3382, win 512, options [nop,nop,TS val 262815516 ecr 262815515], length 64
2022-04-05 17:42:13.013272 IP (tos 0x0, ttl 64, id 25954, offset 0, flags [DF], proto TCP (6), length 52)
    127.0.0.1.10650 > 127.0.0.1.44840: Flags [.], cksum 0xfe28 (incorrect -> 0xfe46), seq 3382, ack 595, win 512, options [nop,nop,TS val 262815516 ecr 262815516], length 0
2022-04-05 17:42:13.013684 IP (tos 0x0, ttl 64, id 63840, offset 0, flags [DF], proto TCP (6), length 332)
    127.0.0.1.44840 > 127.0.0.1.10650: Flags [P.], cksum 0xff40 (incorrect -> 0x791f), seq 595:875, ack 3382, win 512, options [nop,nop,TS val 262815516 ecr 262815516], length 280
2022-04-05 17:42:13.013692 IP (tos 0x0, ttl 64, id 25955, offset 0, flags [DF], proto TCP (6), length 52)
    127.0.0.1.10650 > 127.0.0.1.44840: Flags [.], cksum 0xfe28 (incorrect -> 0xfd30), seq 3382, ack 875, win 510, options [nop,nop,TS val 262815516 ecr 262815516], length 0
2022-04-05 17:42:13.208827 IP (tos 0x0, ttl 64, id 25956, offset 0, flags [DF], proto TCP (6), length 594)
    127.0.0.1.10650 > 127.0.0.1.44840: Flags [P.], cksum 0x0047 (incorrect -> 0x7b4d), seq 3382:3924, ack 875, win 512, options [nop,nop,TS val 262815711 ecr 262815516], length 542
2022-04-05 17:42:13.208834 IP (tos 0x0, ttl 64, id 63841, offset 0, flags [DF], proto TCP (6), length 52)
    127.0.0.1.44840 > 127.0.0.1.10650: Flags [.], cksum 0xfe28 (incorrect -> 0xf98e), seq 875, ack 3924, win 508, options [nop,nop,TS val 262815711 ecr 262815711], length 0
2022-04-05 17:42:13.567621 IP (tos 0x0, ttl 64, id 25957, offset 0, flags [DF], proto TCP (6), length 3538)
    127.0.0.1.10650 > 127.0.0.1.44840: Flags [P.], cksum 0x0bc7 (incorrect -> 0x3871), seq 3924:7410, ack 875, win 512, options [nop,nop,TS val 262816070 ecr 262815711], length 3486
2022-04-05 17:42:13.567628 IP (tos 0x0, ttl 64, id 63842, offset 0, flags [DF], proto TCP (6), length 52)
    127.0.0.1.44840 > 127.0.0.1.10650: Flags [.], cksum 0xfe28 (incorrect -> 0xe930), seq 875, ack 7410, win 494, options [nop,nop,TS val 262816070 ecr 262816070], length 0
2022-04-05 17:42:13.581951 IP (tos 0x0, ttl 64, id 25958, offset 0, flags [DF], proto TCP (6), length 3538)
    127.0.0.1.10650 > 127.0.0.1.44840: Flags [P.], cksum 0x0bc7 (incorrect -> 0xef81), seq 7410:10896, ack 875, win 512, options [nop,nop,TS val 262816084 ecr 262816070], length 3486
2022-04-05 17:42:13.581959 IP (tos 0x0, ttl 64, id 63843, offset 0, flags [DF], proto TCP (6), length 52)
    127.0.0.1.44840 > 127.0.0.1.10650: Flags [.], cksum 0xfe28 (incorrect -> 0xdb76), seq 875, ack 10896, win 494, options [nop,nop,TS val 262816084 ecr 262816084], length 0
2022-04-05 17:42:13.624829 IP (tos 0x0, ttl 64, id 25959, offset 0, flags [DF], proto TCP (6), length 3282)
    127.0.0.1.10650 > 127.0.0.1.44840: Flags [P.], cksum 0x0ac7 (incorrect -> 0x69ed), seq 10896:14126, ack 875, win 512, options [nop,nop,TS val 262816127 ecr 262816084], length 3230
2022-04-05 17:42:13.624839 IP (tos 0x0, ttl 64, id 63844, offset 0, flags [DF], proto TCP (6), length 52)
    127.0.0.1.44840 > 127.0.0.1.10650: Flags [.], cksum 0xfe28 (incorrect -> 0xce81), seq 875, ack 14126, win 495, options [nop,nop,TS val 262816127 ecr 262816127], length 0
2022-04-05 17:42:13.626027 IP (tos 0x0, ttl 64, id 25960, offset 0, flags [DF], proto TCP (6), length 1048)
    127.0.0.1.10650 > 127.0.0.1.44840: Flags [P.], cksum 0x020d (incorrect -> 0x8c5e), seq 14126:15122, ack 875, win 512, options [nop,nop,TS val 262816128 ecr 262816127], length 996
2022-04-05 17:42:13.626032 IP (tos 0x0, ttl 64, id 63845, offset 0, flags [DF], proto TCP (6), length 52)
    127.0.0.1.44840 > 127.0.0.1.10650: Flags [.], cksum 0xfe28 (incorrect -> 0xca92), seq 875, ack 15122, win 504, options [nop,nop,TS val 262816128 ecr 262816128], length 0
2022-04-05 17:42:13.629096 IP (tos 0x0, ttl 64, id 25961, offset 0, flags [DF], proto TCP (6), length 2044)
    127.0.0.1.10650 > 127.0.0.1.44840: Flags [P.], cksum 0x05f1 (incorrect -> 0x0035), seq 15122:17114, ack 875, win 512, options [nop,nop,TS val 262816132 ecr 262816128], length 1992
2022-04-05 17:42:13.629100 IP (tos 0x0, ttl 64, id 63846, offset 0, flags [DF], proto TCP (6), length 52)
    127.0.0.1.44840 > 127.0.0.1.10650: Flags [.], cksum 0xfe28 (incorrect -> 0xc2c6), seq 875, ack 17114, win 500, options [nop,nop,TS val 262816132 ecr 262816132], length 0
2022-04-05 17:42:13.637931 IP (tos 0x0, ttl 64, id 25962, offset 0, flags [DF], proto TCP (6), length 3538)
    127.0.0.1.10650 > 127.0.0.1.44840: Flags [P.], cksum 0x0bc7 (incorrect -> 0x26a0), seq 17114:20600, ack 875, win 512, options [nop,nop,TS val 262816140 ecr 262816132], length 3486
2022-04-05 17:42:13.637939 IP (tos 0x0, ttl 64, id 63847, offset 0, flags [DF], proto TCP (6), length 52)
    127.0.0.1.44840 > 127.0.0.1.10650: Flags [.], cksum 0xfe28 (incorrect -> 0xb51e), seq 875, ack 20600, win 494, options [nop,nop,TS val 262816140 ecr 262816140], length 0
2022-04-05 17:42:13.672157 IP (tos 0x0, ttl 64, id 25963, offset 0, flags [DF], proto TCP (6), length 3538)
    127.0.0.1.10650 > 127.0.0.1.44840: Flags [P.], cksum 0x0bc7 (incorrect -> 0x6cbf), seq 20600:24086, ack 875, win 512, options [nop,nop,TS val 262816175 ecr 262816140], length 3486
2022-04-05 17:42:13.672163 IP (tos 0x0, ttl 64, id 63848, offset 0, flags [DF], proto TCP (6), length 52)
    127.0.0.1.44840 > 127.0.0.1.10650: Flags [.], cksum 0xfe28 (incorrect -> 0xa73a), seq 875, ack 24086, win 494, options [nop,nop,TS val 262816175 ecr 262816175], length 0
2022-04-05 17:42:13.680228 IP (tos 0x0, ttl 64, id 25964, offset 0, flags [DF], proto TCP (6), length 550)
    127.0.0.1.10650 > 127.0.0.1.44840: Flags [P.], cksum 0x001b (incorrect -> 0xd96a), seq 24086:24584, ack 875, win 512, options [nop,nop,TS val 262816183 ecr 262816175], length 498
2022-04-05 17:42:13.680232 IP (tos 0x0, ttl 64, id 63849, offset 0, flags [DF], proto TCP (6), length 52)
    127.0.0.1.44840 > 127.0.0.1.10650: Flags [.], cksum 0xfe28 (incorrect -> 0xa52c), seq 875, ack 24584, win 506, options [nop,nop,TS val 262816183 ecr 262816183], length 0
2022-04-05 17:42:13.680260 IP (tos 0x0, ttl 64, id 25965, offset 0, flags [DF], proto TCP (6), length 3142)
    127.0.0.1.10650 > 127.0.0.1.44840: Flags [P.], cksum 0x0a3b (incorrect -> 0x7b98), seq 24584:27674, ack 875, win 512, options [nop,nop,TS val 262816183 ecr 262816183], length 3090
2022-04-05 17:42:13.680263 IP (tos 0x0, ttl 64, id 63850, offset 0, flags [DF], proto TCP (6), length 52)
    127.0.0.1.44840 > 127.0.0.1.10650: Flags [.], cksum 0xfe28 (incorrect -> 0x9927), seq 875, ack 27674, win 493, options [nop,nop,TS val 262816183 ecr 262816183], length 0
2022-04-05 17:42:13.684045 IP (tos 0x0, ttl 64, id 25966, offset 0, flags [DF], proto TCP (6), length 2044)
    127.0.0.1.10650 > 127.0.0.1.44840: Flags [P.], cksum 0x05f1 (incorrect -> 0xf79a), seq 27674:29666, ack 875, win 512, options [nop,nop,TS val 262816186 ecr 262816183], length 1992
2022-04-05 17:42:13.684068 IP (tos 0x0, ttl 64, id 63851, offset 0, flags [DF], proto TCP (6), length 52)
    127.0.0.1.44840 > 127.0.0.1.10650: Flags [.], cksum 0xfe28 (incorrect -> 0x9145), seq 875, ack 29666, win 512, options [nop,nop,TS val 262816187 ecr 262816186], length 0
2022-04-05 17:42:13.685196 IP (tos 0x0, ttl 64, id 25967, offset 0, flags [DF], proto TCP (6), length 2904)
    127.0.0.1.10650 > 127.0.0.1.44840: Flags [P.], cksum 0x094d (incorrect -> 0xed7a), seq 29666:32518, ack 875, win 512, options [nop,nop,TS val 262816188 ecr 262816187], length 2852
2022-04-05 17:42:13.685233 IP (tos 0x0, ttl 64, id 63852, offset 0, flags [DF], proto TCP (6), length 52)
    127.0.0.1.44840 > 127.0.0.1.10650: Flags [.], cksum 0xfe28 (incorrect -> 0x861e), seq 875, ack 32518, win 512, options [nop,nop,TS val 262816188 ecr 262816188], length 0
2022-04-05 17:42:13.710146 IP (tos 0x0, ttl 64, id 25968, offset 0, flags [DF], proto TCP (6), length 2542)
    127.0.0.1.10650 > 127.0.0.1.44840: Flags [P.], cksum 0x07e3 (incorrect -> 0x3fea), seq 32518:35008, ack 875, win 512, options [nop,nop,TS val 262816213 ecr 262816188], length 2490
2022-04-05 17:42:13.710179 IP (tos 0x0, ttl 64, id 63853, offset 0, flags [DF], proto TCP (6), length 52)
    127.0.0.1.44840 > 127.0.0.1.10650: Flags [.], cksum 0xfe28 (incorrect -> 0x7c32), seq 875, ack 35008, win 512, options [nop,nop,TS val 262816213 ecr 262816213], length 0
2022-04-05 17:42:13.715837 IP (tos 0x0, ttl 64, id 25969, offset 0, flags [DF], proto TCP (6), length 3538)
    127.0.0.1.10650 > 127.0.0.1.44840: Flags [P.], cksum 0x0bc7 (incorrect -> 0xc2ad), seq 35008:38494, ack 875, win 512, options [nop,nop,TS val 262816218 ecr 262816213], length 3486
2022-04-05 17:42:13.758662 IP (tos 0x0, ttl 64, id 63854, offset 0, flags [DF], proto TCP (6), length 52)
    127.0.0.1.44840 > 127.0.0.1.10650: Flags [.], cksum 0xfe28 (incorrect -> 0x6e5f), seq 875, ack 38494, win 512, options [nop,nop,TS val 262816261 ecr 262816218], length 0
2022-04-05 17:42:13.758671 IP (tos 0x0, ttl 64, id 25970, offset 0, flags [DF], proto TCP (6), length 7024)
    127.0.0.1.10650 > 127.0.0.1.44840: Flags [P.], cksum 0x1965 (incorrect -> 0xf788), seq 38494:45466, ack 875, win 512, options [nop,nop,TS val 262816261 ecr 262816261], length 6972
2022-04-05 17:42:13.802651 IP (tos 0x0, ttl 64, id 63855, offset 0, flags [DF], proto TCP (6), length 52)
    127.0.0.1.44840 > 127.0.0.1.10650: Flags [.], cksum 0xfe28 (incorrect -> 0x52cc), seq 875, ack 45466, win 512, options [nop,nop,TS val 262816305 ecr 262816261], length 0
2022-04-05 17:42:13.802658 IP (tos 0x0, ttl 64, id 25971, offset 0, flags [DF], proto TCP (6), length 12502)
    127.0.0.1.10650 > 127.0.0.1.44840: Flags [P.], cksum 0x2ecb (incorrect -> 0xaf99), seq 45466:57916, ack 875, win 512, options [nop,nop,TS val 262816305 ecr 262816305], length 12450
2022-04-05 17:42:13.846654 IP (tos 0x0, ttl 64, id 63856, offset 0, flags [DF], proto TCP (6), length 52)
    127.0.0.1.44840 > 127.0.0.1.10650: Flags [.], cksum 0xfe28 (incorrect -> 0x21d2), seq 875, ack 57916, win 512, options [nop,nop,TS val 262816349 ecr 262816305], length 0
2022-04-05 17:42:13.846664 IP (tos 0x0, ttl 64, id 25972, offset 0, flags [DF], proto TCP (6), length 11506)
    127.0.0.1.10650 > 127.0.0.1.44840: Flags [P.], cksum 0x2ae7 (incorrect -> 0xdab0), seq 57916:69370, ack 875, win 512, options [nop,nop,TS val 262816349 ecr 262816349], length 11454
2022-04-05 17:42:13.846793 IP (tos 0x0, ttl 64, id 63857, offset 0, flags [DF], proto TCP (6), length 52)
    127.0.0.1.44840 > 127.0.0.1.10650: Flags [.], cksum 0xfe28 (incorrect -> 0xf4e7), seq 875, ack 69370, win 512, options [nop,nop,TS val 262816349 ecr 262816349], length 0
2022-04-05 17:42:13.849608 IP (tos 0x0, ttl 64, id 25973, offset 0, flags [DF], proto TCP (6), length 1048)
    127.0.0.1.10650 > 127.0.0.1.44840: Flags [P.], cksum 0x020d (incorrect -> 0xbd1a), seq 69370:70366, ack 875, win 512, options [nop,nop,TS val 262816352 ecr 262816349], length 996
2022-04-05 17:42:13.849647 IP (tos 0x0, ttl 64, id 63858, offset 0, flags [DF], proto TCP (6), length 52)
    127.0.0.1.44840 > 127.0.0.1.10650: Flags [.], cksum 0xfe28 (incorrect -> 0xf0fd), seq 875, ack 70366, win 512, options [nop,nop,TS val 262816352 ecr 262816352], length 0
2022-04-05 17:42:13.902753 IP (tos 0x0, ttl 64, id 25974, offset 0, flags [DF], proto TCP (6), length 1048)
    127.0.0.1.10650 > 127.0.0.1.44840: Flags [P.], cksum 0x020d (incorrect -> 0x4f7f), seq 70366:71362, ack 875, win 512, options [nop,nop,TS val 262816405 ecr 262816352], length 996
2022-04-05 17:42:13.946657 IP (tos 0x0, ttl 64, id 63859, offset 0, flags [DF], proto TCP (6), length 52)
    127.0.0.1.44840 > 127.0.0.1.10650: Flags [.], cksum 0xfe28 (incorrect -> 0xec83), seq 875, ack 71362, win 512, options [nop,nop,TS val 262816449 ecr 262816405], length 0
2022-04-05 17:42:13.946665 IP (tos 0x0, ttl 64, id 25975, offset 0, flags [DF], proto TCP (6), length 11482)
    127.0.0.1.10650 > 127.0.0.1.44840: Flags [P.], cksum 0x2acf (incorrect -> 0xa069), seq 71362:82792, ack 875, win 512, options [nop,nop,TS val 262816449 ecr 262816449], length 11430
2022-04-05 17:42:13.990661 IP (tos 0x0, ttl 64, id 63860, offset 0, flags [DF], proto TCP (6), length 52)
    127.0.0.1.44840 > 127.0.0.1.10650: Flags [.], cksum 0xfe28 (incorrect -> 0xbf85), seq 875, ack 82792, win 512, options [nop,nop,TS val 262816493 ecr 262816449], length 0
2022-04-05 17:42:13.990668 IP (tos 0x0, ttl 64, id 25976, offset 0, flags [DF], proto TCP (6), length 11506)
    127.0.0.1.10650 > 127.0.0.1.44840: Flags [P.], cksum 0x2ae7 (incorrect -> 0xfebc), seq 82792:94246, ack 875, win 512, options [nop,nop,TS val 262816493 ecr 262816493], length 11454
2022-04-05 17:42:14.034659 IP (tos 0x0, ttl 64, id 63861, offset 0, flags [DF], proto TCP (6), length 52)
    127.0.0.1.44840 > 127.0.0.1.10650: Flags [.], cksum 0xfe28 (incorrect -> 0x926f), seq 875, ack 94246, win 512, options [nop,nop,TS val 262816537 ecr 262816493], length 0
2022-04-05 17:42:14.034665 IP (tos 0x0, ttl 64, id 25977, offset 0, flags [DF], proto TCP (6), length 1048)
    127.0.0.1.10650 > 127.0.0.1.44840: Flags [P.], cksum 0x020d (incorrect -> 0x4ceb), seq 94246:95242, ack 875, win 512, options [nop,nop,TS val 262816537 ecr 262816537], length 996
2022-04-05 17:42:14.034679 IP (tos 0x0, ttl 64, id 63862, offset 0, flags [DF], proto TCP (6), length 52)
    127.0.0.1.44840 > 127.0.0.1.10650: Flags [.], cksum 0xfe28 (incorrect -> 0x8e5f), seq 875, ack 95242, win 512, options [nop,nop,TS val 262816537 ecr 262816537], length 0
2022-04-05 17:42:14.041781 IP (tos 0x0, ttl 64, id 25978, offset 0, flags [DF], proto TCP (6), length 3538)
    127.0.0.1.10650 > 127.0.0.1.44840: Flags [P.], cksum 0x0bc7 (incorrect -> 0x60b9), seq 95242:98728, ack 875, win 512, options [nop,nop,TS val 262816544 ecr 262816537], length 3486
2022-04-05 17:42:14.041816 IP (tos 0x0, ttl 64, id 63863, offset 0, flags [DF], proto TCP (6), length 52)
    127.0.0.1.44840 > 127.0.0.1.10650: Flags [.], cksum 0xfe28 (incorrect -> 0x80b3), seq 875, ack 98728, win 512, options [nop,nop,TS val 262816544 ecr 262816544], length 0
2022-04-05 17:42:14.054928 IP (tos 0x0, ttl 64, id 25979, offset 0, flags [DF], proto TCP (6), length 2044)
    127.0.0.1.10650 > 127.0.0.1.44840: Flags [P.], cksum 0x05f1 (incorrect -> 0x0396), seq 98728:100720, ack 875, win 512, options [nop,nop,TS val 262816557 ecr 262816544], length 1992
2022-04-05 17:42:14.054957 IP (tos 0x0, ttl 64, id 63864, offset 0, flags [DF], proto TCP (6), length 52)
    127.0.0.1.44840 > 127.0.0.1.10650: Flags [.], cksum 0xfe28 (incorrect -> 0x78d1), seq 875, ack 100720, win 512, options [nop,nop,TS val 262816557 ecr 262816557], length 0
2022-04-05 17:42:14.059609 IP (tos 0x0, ttl 64, id 25980, offset 0, flags [DF], proto TCP (6), length 3538)
    127.0.0.1.10650 > 127.0.0.1.44840: Flags [P.], cksum 0x0bc7 (incorrect -> 0x8841), seq 100720:104206, ack 875, win 512, options [nop,nop,TS val 262816562 ecr 262816557], length 3486
2022-04-05 17:42:14.059835 IP (tos 0x0, ttl 64, id 63865, offset 0, flags [DF], proto TCP (6), length 52)
    127.0.0.1.44840 > 127.0.0.1.10650: Flags [.], cksum 0xfe28 (incorrect -> 0x6b29), seq 875, ack 104206, win 512, options [nop,nop,TS val 262816562 ecr 262816562], length 0
2022-04-05 17:42:14.068026 IP (tos 0x0, ttl 64, id 25981, offset 0, flags [DF], proto TCP (6), length 4036)
    127.0.0.1.10650 > 127.0.0.1.44840: Flags [P.], cksum 0x0db9 (incorrect -> 0xede8), seq 104206:108190, ack 875, win 512, options [nop,nop,TS val 262816570 ecr 262816562], length 3984
2022-04-05 17:42:14.068203 IP (tos 0x0, ttl 64, id 63866, offset 0, flags [DF], proto TCP (6), length 52)
    127.0.0.1.44840 > 127.0.0.1.10650: Flags [.], cksum 0xfe28 (incorrect -> 0x5b88), seq 875, ack 108190, win 512, options [nop,nop,TS val 262816571 ecr 262816570], length 0
2022-04-05 17:42:14.081230 IP (tos 0x0, ttl 64, id 25982, offset 0, flags [DF], proto TCP (6), length 1546)
    127.0.0.1.10650 > 127.0.0.1.44840: Flags [P.], cksum 0x03ff (incorrect -> 0xd467), seq 108190:109684, ack 875, win 512, options [nop,nop,TS val 262816584 ecr 262816571], length 1494
2022-04-05 17:42:14.081258 IP (tos 0x0, ttl 64, id 63867, offset 0, flags [DF], proto TCP (6), length 52)
    127.0.0.1.44840 > 127.0.0.1.10650: Flags [.], cksum 0xfe28 (incorrect -> 0x5597), seq 875, ack 109684, win 512, options [nop,nop,TS val 262816584 ecr 262816584], length 0
2022-04-05 17:42:14.115476 IP (tos 0x0, ttl 64, id 25983, offset 0, flags [DF], proto TCP (6), length 3538)
    127.0.0.1.10650 > 127.0.0.1.44840: Flags [P.], cksum 0x0bc7 (incorrect -> 0x9149), seq 109684:113170, ack 875, win 512, options [nop,nop,TS val 262816618 ecr 262816584], length 3486
2022-04-05 17:42:14.115508 IP (tos 0x0, ttl 64, id 63868, offset 0, flags [DF], proto TCP (6), length 52)
    127.0.0.1.44840 > 127.0.0.1.10650: Flags [.], cksum 0xfe28 (incorrect -> 0x47b5), seq 875, ack 113170, win 512, options [nop,nop,TS val 262816618 ecr 262816618], length 0
2022-04-05 17:42:14.128636 IP (tos 0x0, ttl 64, id 25984, offset 0, flags [DF], proto TCP (6), length 4036)
    127.0.0.1.10650 > 127.0.0.1.44840: Flags [P.], cksum 0x0db9 (incorrect -> 0x09e1), seq 113170:117154, ack 875, win 512, options [nop,nop,TS val 262816631 ecr 262816618], length 3984
2022-04-05 17:42:14.128665 IP (tos 0x0, ttl 64, id 63869, offset 0, flags [DF], proto TCP (6), length 52)
    127.0.0.1.44840 > 127.0.0.1.10650: Flags [.], cksum 0xfe28 (incorrect -> 0x380b), seq 875, ack 117154, win 512, options [nop,nop,TS val 262816631 ecr 262816631], length 0
2022-04-05 17:42:14.130354 IP (tos 0x0, ttl 64, id 25985, offset 0, flags [DF], proto TCP (6), length 3538)
    127.0.0.1.10650 > 127.0.0.1.44840: Flags [P.], cksum 0x0bc7 (incorrect -> 0x2e8f), seq 117154:120640, ack 875, win 512, options [nop,nop,TS val 262816633 ecr 262816631], length 3486
2022-04-05 17:42:14.130555 IP (tos 0x0, ttl 64, id 63870, offset 0, flags [DF], proto TCP (6), length 52)
    127.0.0.1.44840 > 127.0.0.1.10650: Flags [.], cksum 0xfe28 (incorrect -> 0x2a69), seq 875, ack 120640, win 512, options [nop,nop,TS val 262816633 ecr 262816633], length 0
2022-04-05 17:42:14.143634 IP (tos 0x0, ttl 64, id 25986, offset 0, flags [DF], proto TCP (6), length 3040)
    127.0.0.1.10650 > 127.0.0.1.44840: Flags [P.], cksum 0x09d5 (incorrect -> 0x65bf), seq 120640:123628, ack 875, win 512, options [nop,nop,TS val 262816646 ecr 262816633], length 2988
2022-04-05 17:42:14.143667 IP (tos 0x0, ttl 64, id 63871, offset 0, flags [DF], proto TCP (6), length 52)
    127.0.0.1.44840 > 127.0.0.1.10650: Flags [.], cksum 0xfe28 (incorrect -> 0x1ea3), seq 875, ack 123628, win 512, options [nop,nop,TS val 262816646 ecr 262816646], length 0
2022-04-05 17:42:14.157690 IP (tos 0x0, ttl 64, id 25987, offset 0, flags [DF], proto TCP (6), length 2542)
    127.0.0.1.10650 > 127.0.0.1.44840: Flags [P.], cksum 0x07e3 (incorrect -> 0x03b9), seq 123628:126118, ack 875, win 512, options [nop,nop,TS val 262816660 ecr 262816646], length 2490
2022-04-05 17:42:14.157720 IP (tos 0x0, ttl 64, id 63872, offset 0, flags [DF], proto TCP (6), length 52)
    127.0.0.1.44840 > 127.0.0.1.10650: Flags [.], cksum 0xfe28 (incorrect -> 0x14cd), seq 875, ack 126118, win 512, options [nop,nop,TS val 262816660 ecr 262816660], length 0
2022-04-05 17:42:14.176370 IP (tos 0x0, ttl 64, id 25988, offset 0, flags [DF], proto TCP (6), length 4100)
    127.0.0.1.10650 > 127.0.0.1.44840: Flags [P.], cksum 0x0df9 (incorrect -> 0xe9a4), seq 126118:130166, ack 875, win 512, options [nop,nop,TS val 262816679 ecr 262816660], length 4048
2022-04-05 17:42:14.176621 IP (tos 0x0, ttl 64, id 63873, offset 0, flags [DF], proto TCP (6), length 52)
    127.0.0.1.44840 > 127.0.0.1.10650: Flags [.], cksum 0xfe28 (incorrect -> 0x04d7), seq 875, ack 130166, win 512, options [nop,nop,TS val 262816679 ecr 262816679], length 0
2022-04-05 17:42:14.176625 IP (tos 0x0, ttl 64, id 25989, offset 0, flags [DF], proto TCP (6), length 3454)
    127.0.0.1.10650 > 127.0.0.1.44840: Flags [P.], cksum 0x0b73 (incorrect -> 0x536c), seq 130166:133568, ack 875, win 512, options [nop,nop,TS val 262816679 ecr 262816679], length 3402
2022-04-05 17:42:14.176641 IP (tos 0x0, ttl 64, id 63874, offset 0, flags [DF], proto TCP (6), length 52)
    127.0.0.1.44840 > 127.0.0.1.10650: Flags [.], cksum 0xfe28 (incorrect -> 0xf78c), seq 875, ack 133568, win 512, options [nop,nop,TS val 262816679 ecr 262816679], length 0
2022-04-05 17:42:14.189539 IP (tos 0x0, ttl 64, id 25990, offset 0, flags [DF], proto TCP (6), length 1048)
    127.0.0.1.10650 > 127.0.0.1.44840: Flags [P.], cksum 0x020d (incorrect -> 0xd220), seq 133568:134564, ack 875, win 512, options [nop,nop,TS val 262816692 ecr 262816679], length 996
2022-04-05 17:42:14.189564 IP (tos 0x0, ttl 64, id 63875, offset 0, flags [DF], proto TCP (6), length 52)
    127.0.0.1.44840 > 127.0.0.1.10650: Flags [.], cksum 0xfe28 (incorrect -> 0xf38e), seq 875, ack 134564, win 512, options [nop,nop,TS val 262816692 ecr 262816692], length 0
2022-04-05 17:42:14.202671 IP (tos 0x0, ttl 64, id 25991, offset 0, flags [DF], proto TCP (6), length 3040)
    127.0.0.1.10650 > 127.0.0.1.44840: Flags [P.], cksum 0x09d5 (incorrect -> 0xd8bc), seq 134564:137552, ack 875, win 512, options [nop,nop,TS val 262816705 ecr 262816692], length 2988
2022-04-05 17:42:14.202699 IP (tos 0x0, ttl 64, id 63876, offset 0, flags [DF], proto TCP (6), length 52)
    127.0.0.1.44840 > 127.0.0.1.10650: Flags [.], cksum 0xfe28 (incorrect -> 0xe7c8), seq 875, ack 137552, win 512, options [nop,nop,TS val 262816705 ecr 262816705], length 0
2022-04-05 17:42:14.241685 IP (tos 0x0, ttl 64, id 25992, offset 0, flags [DF], proto TCP (6), length 4100)
    127.0.0.1.10650 > 127.0.0.1.44840: Flags [P.], cksum 0x0df9 (incorrect -> 0xdda2), seq 137552:141600, ack 875, win 512, options [nop,nop,TS val 262816744 ecr 262816705], length 4048
2022-04-05 17:42:14.241951 IP (tos 0x0, ttl 64, id 63877, offset 0, flags [DF], proto TCP (6), length 52)
    127.0.0.1.44840 > 127.0.0.1.10650: Flags [.], cksum 0xfe28 (incorrect -> 0xd7aa), seq 875, ack 141600, win 512, options [nop,nop,TS val 262816744 ecr 262816744], length 0
2022-04-05 17:42:14.241956 IP (tos 0x0, ttl 64, id 25993, offset 0, flags [DF], proto TCP (6), length 1502)
    127.0.0.1.10650 > 127.0.0.1.44840: Flags [P.], cksum 0x03d3 (incorrect -> 0xf3f7), seq 141600:143050, ack 875, win 512, options [nop,nop,TS val 262816744 ecr 262816744], length 1450
2022-04-05 17:42:14.241967 IP (tos 0x0, ttl 64, id 63878, offset 0, flags [DF], proto TCP (6), length 52)
    127.0.0.1.44840 > 127.0.0.1.10650: Flags [.], cksum 0xfe28 (incorrect -> 0xd200), seq 875, ack 143050, win 512, options [nop,nop,TS val 262816744 ecr 262816744], length 0
2022-04-05 17:42:14.243499 IP (tos 0x0, ttl 64, id 25994, offset 0, flags [DF], proto TCP (6), length 3040)
    127.0.0.1.10650 > 127.0.0.1.44840: Flags [P.], cksum 0x09d5 (incorrect -> 0xe11a), seq 143050:146038, ack 875, win 512, options [nop,nop,TS val 262816746 ecr 262816744], length 2988
2022-04-05 17:42:14.243525 IP (tos 0x0, ttl 64, id 63879, offset 0, flags [DF], proto TCP (6), length 52)
    127.0.0.1.44840 > 127.0.0.1.10650: Flags [.], cksum 0xfe28 (incorrect -> 0xc650), seq 875, ack 146038, win 512, options [nop,nop,TS val 262816746 ecr 262816746], length 0
2022-04-05 17:42:14.245568 IP (tos 0x0, ttl 64, id 25995, offset 0, flags [DF], proto TCP (6), length 2044)
    127.0.0.1.10650 > 127.0.0.1.44840: Flags [P.], cksum 0x05f1 (incorrect -> 0x0e17), seq 146038:148030, ack 875, win 512, options [nop,nop,TS val 262816748 ecr 262816746], length 1992
2022-04-05 17:42:14.245595 IP (tos 0x0, ttl 64, id 63880, offset 0, flags [DF], proto TCP (6), length 52)
    127.0.0.1.44840 > 127.0.0.1.10650: Flags [.], cksum 0xfe28 (incorrect -> 0xbe84), seq 875, ack 148030, win 512, options [nop,nop,TS val 262816748 ecr 262816748], length 0
2022-04-05 17:42:14.258694 IP (tos 0x0, ttl 64, id 25996, offset 0, flags [DF], proto TCP (6), length 2542)
    127.0.0.1.10650 > 127.0.0.1.44840: Flags [P.], cksum 0x07e3 (incorrect -> 0x93c5), seq 148030:150520, ack 875, win 512, options [nop,nop,TS val 262816761 ecr 262816748], length 2490
2022-04-05 17:42:14.258721 IP (tos 0x0, ttl 64, id 63881, offset 0, flags [DF], proto TCP (6), length 52)
    127.0.0.1.44840 > 127.0.0.1.10650: Flags [.], cksum 0xfe28 (incorrect -> 0xb4b0), seq 875, ack 150520, win 512, options [nop,nop,TS val 262816761 ecr 262816761], length 0
2022-04-05 17:42:14.312651 IP (tos 0x0, ttl 64, id 25997, offset 0, flags [DF], proto TCP (6), length 3538)
    127.0.0.1.10650 > 127.0.0.1.44840: Flags [P.], cksum 0x0bc7 (incorrect -> 0x9fcb), seq 150520:154006, ack 875, win 512, options [nop,nop,TS val 262816815 ecr 262816761], length 3486
2022-04-05 17:42:14.312844 IP (tos 0x0, ttl 64, id 63882, offset 0, flags [DF], proto TCP (6), length 52)
    127.0.0.1.44840 > 127.0.0.1.10650: Flags [.], cksum 0xfe28 (incorrect -> 0xa6a6), seq 875, ack 154006, win 512, options [nop,nop,TS val 262816815 ecr 262816815], length 0
2022-04-05 17:42:14.316728 IP (tos 0x0, ttl 64, id 25998, offset 0, flags [DF], proto TCP (6), length 2542)
    127.0.0.1.10650 > 127.0.0.1.44840: Flags [P.], cksum 0x07e3 (incorrect -> 0x6d0e), seq 154006:156496, ack 875, win 512, options [nop,nop,TS val 262816819 ecr 262816815], length 2490
2022-04-05 17:42:14.316819 IP (tos 0x0, ttl 64, id 63883, offset 0, flags [DF], proto TCP (6), length 52)
    127.0.0.1.44840 > 127.0.0.1.10650: Flags [.], cksum 0xfe28 (incorrect -> 0x9ce4), seq 875, ack 156496, win 512, options [nop,nop,TS val 262816819 ecr 262816819], length 0
200, 5.842517852783203, 8.033459901809692