2022-04-05 01:10:36.671490 IP (tos 0x0, ttl 64, id 36012, offset 0, flags [DF], proto TCP (6), length 60)
    127.0.0.1.37710 > 127.0.0.1.11350: Flags [S], cksum 0xfe30 (incorrect -> 0xfd68), seq 3028755297, win 65495, options [mss 65495,sackOK,TS val 758681043 ecr 0,nop,wscale 7], length 0
2022-04-05 01:10:36.671502 IP (tos 0x0, ttl 64, id 0, offset 0, flags [DF], proto TCP (6), length 60)
    127.0.0.1.11350 > 127.0.0.1.37710: Flags [S.], cksum 0xfe30 (incorrect -> 0xd63d), seq 1356536639, ack 3028755298, win 65483, options [mss 65495,sackOK,TS val 758681043 ecr 758681043,nop,wscale 7], length 0
2022-04-05 01:10:36.671511 IP (tos 0x0, ttl 64, id 36013, offset 0, flags [DF], proto TCP (6), length 52)
    127.0.0.1.37710 > 127.0.0.1.11350: Flags [.], cksum 0xfe28 (incorrect -> 0xfcf9), seq 1, ack 1, win 512, options [nop,nop,TS val 758681043 ecr 758681043], length 0
2022-04-05 01:10:36.671613 IP (tos 0x0, ttl 64, id 36014, offset 0, flags [DF], proto TCP (6), length 55)
    127.0.0.1.37710 > 127.0.0.1.11350: Flags [P.], cksum 0xfe2b (incorrect -> 0xf7ed), seq 1:4, ack 1, win 512, options [nop,nop,TS val 758681043 ecr 758681043], length 3
2022-04-05 01:10:36.671625 IP (tos 0x0, ttl 64, id 37629, offset 0, flags [DF], proto TCP (6), length 52)
    127.0.0.1.11350 > 127.0.0.1.37710: Flags [.], cksum 0xfe28 (incorrect -> 0xfcf6), seq 1, ack 4, win 512, options [nop,nop,TS val 758681043 ecr 758681043], length 0
2022-04-05 01:10:36.671679 IP (tos 0x0, ttl 64, id 37630, offset 0, flags [DF], proto TCP (6), length 54)
    127.0.0.1.11350 > 127.0.0.1.37710: Flags [P.], cksum 0xfe2a (incorrect -> 0xf7ec), seq 1:3, ack 4, win 512, options [nop,nop,TS val 758681043 ecr 758681043], length 2
2022-04-05 01:10:36.671697 IP (tos 0x0, ttl 64, id 36015, offset 0, flags [DF], proto TCP (6), length 52)
    127.0.0.1.37710 > 127.0.0.1.11350: Flags [.], cksum 0xfe28 (incorrect -> 0xfcf4), seq 4, ack 3, win 512, options [nop,nop,TS val 758681043 ecr 758681043], length 0
2022-04-05 01:10:36.682881 IP (tos 0x0, ttl 64, id 36016, offset 0, flags [DF], proto TCP (6), length 62)
    127.0.0.1.37710 > 127.0.0.1.11350: Flags [P.], cksum 0xfe32 (incorrect -> 0xa38a), seq 4:14, ack 3, win 512, options [nop,nop,TS val 758681054 ecr 758681043], length 10
2022-04-05 01:10:36.682901 IP (tos 0x0, ttl 64, id 37631, offset 0, flags [DF], proto TCP (6), length 52)
    127.0.0.1.11350 > 127.0.0.1.37710: Flags [.], cksum 0xfe28 (incorrect -> 0xfcd4), seq 3, ack 14, win 512, options [nop,nop,TS val 758681054 ecr 758681054], length 0
2022-04-05 01:10:36.763333 IP (tos 0x0, ttl 64, id 37632, offset 0, flags [DF], proto TCP (6), length 62)
    127.0.0.1.11350 > 127.0.0.1.37710: Flags [P.], cksum 0xfe32 (incorrect -> 0xf771), seq 3:13, ack 14, win 512, options [nop,nop,TS val 758681134 ecr 758681054], length 10
2022-04-05 01:10:36.763350 IP (tos 0x0, ttl 64, id 36017, offset 0, flags [DF], proto TCP (6), length 52)
    127.0.0.1.37710 > 127.0.0.1.11350: Flags [.], cksum 0xfe28 (incorrect -> 0xfc2a), seq 14, ack 13, win 512, options [nop,nop,TS val 758681134 ecr 758681134], length 0
2022-04-05 01:10:36.769237 IP (tos 0x0, ttl 64, id 36018, offset 0, flags [DF], proto TCP (6), length 569)
    127.0.0.1.37710 > 127.0.0.1.11350: Flags [P.], cksum 0x002e (incorrect -> 0xd110), seq 14:531, ack 13, win 512, options [nop,nop,TS val 758681140 ecr 758681134], length 517
2022-04-05 01:10:36.769247 IP (tos 0x0, ttl 64, id 37633, offset 0, flags [DF], proto TCP (6), length 52)
    127.0.0.1.11350 > 127.0.0.1.37710: Flags [.], cksum 0xfe28 (incorrect -> 0xfa1d), seq 13, ack 531, win 508, options [nop,nop,TS val 758681140 ecr 758681140], length 0
200, 5.79365348815918, 0.4435586929321289