2022-04-05 11:23:17.552331 IP (tos 0x0, ttl 64, id 2679, offset 0, flags [DF], proto TCP (6), length 60)
    127.0.0.1.45356 > 127.0.0.1.11350: Flags [S], cksum 0xfe30 (incorrect -> 0x3c7d), seq 1693675016, win 65495, options [mss 65495,sackOK,TS val 240080055 ecr 0,nop,wscale 7], length 0
2022-04-05 11:23:17.552344 IP (tos 0x0, ttl 64, id 0, offset 0, flags [DF], proto TCP (6), length 60)
    127.0.0.1.11350 > 127.0.0.1.45356: Flags [S.], cksum 0xfe30 (incorrect -> 0x9f2a), seq 202976814, ack 1693675017, win 65483, options [mss 65495,sackOK,TS val 240080055 ecr 240080055,nop,wscale 7], length 0
2022-04-05 11:23:17.552354 IP (tos 0x0, ttl 64, id 2680, offset 0, flags [DF], proto TCP (6), length 52)
    127.0.0.1.45356 > 127.0.0.1.11350: Flags [.], cksum 0xfe28 (incorrect -> 0xc5e6), seq 1, ack 1, win 512, options [nop,nop,TS val 240080055 ecr 240080055], length 0
2022-04-05 11:23:17.552457 IP (tos 0x0, ttl 64, id 2681, offset 0, flags [DF], proto TCP (6), length 55)
    127.0.0.1.45356 > 127.0.0.1.11350: Flags [P.], cksum 0xfe2b (incorrect -> 0xc0da), seq 1:4, ack 1, win 512, options [nop,nop,TS val 240080055 ecr 240080055], length 3
2022-04-05 11:23:17.552468 IP (tos 0x0, ttl 64, id 1587, offset 0, flags [DF], proto TCP (6), length 52)
    127.0.0.1.11350 > 127.0.0.1.45356: Flags [.], cksum 0xfe28 (incorrect -> 0xc5e3), seq 1, ack 4, win 512, options [nop,nop,TS val 240080055 ecr 240080055], length 0
2022-04-05 11:23:17.552494 IP (tos 0x0, ttl 64, id 1588, offset 0, flags [DF], proto TCP (6), length 54)
    127.0.0.1.11350 > 127.0.0.1.45356: Flags [P.], cksum 0xfe2a (incorrect -> 0xc0d9), seq 1:3, ack 4, win 512, options [nop,nop,TS val 240080055 ecr 240080055], length 2
2022-04-05 11:23:17.552506 IP (tos 0x0, ttl 64, id 2682, offset 0, flags [DF], proto TCP (6), length 52)
    127.0.0.1.45356 > 127.0.0.1.11350: Flags [.], cksum 0xfe28 (incorrect -> 0xc5e1), seq 4, ack 3, win 512, options [nop,nop,TS val 240080055 ecr 240080055], length 0
2022-04-05 11:23:17.564215 IP (tos 0x0, ttl 64, id 2683, offset 0, flags [DF], proto TCP (6), length 62)
    127.0.0.1.45356 > 127.0.0.1.11350: Flags [P.], cksum 0xfe32 (incorrect -> 0x0ce2), seq 4:14, ack 3, win 512, options [nop,nop,TS val 240080067 ecr 240080055], length 10
2022-04-05 11:23:17.564235 IP (tos 0x0, ttl 64, id 1589, offset 0, flags [DF], proto TCP (6), length 52)
    127.0.0.1.11350 > 127.0.0.1.45356: Flags [.], cksum 0xfe28 (incorrect -> 0xc5bf), seq 3, ack 14, win 512, options [nop,nop,TS val 240080067 ecr 240080067], length 0
2022-04-05 11:23:17.650506 IP (tos 0x0, ttl 64, id 1590, offset 0, flags [DF], proto TCP (6), length 62)
    127.0.0.1.11350 > 127.0.0.1.45356: Flags [P.], cksum 0xfe32 (incorrect -> 0xc056), seq 3:13, ack 14, win 512, options [nop,nop,TS val 240080153 ecr 240080067], length 10
2022-04-05 11:23:17.650519 IP (tos 0x0, ttl 64, id 2684, offset 0, flags [DF], proto TCP (6), length 52)
    127.0.0.1.45356 > 127.0.0.1.11350: Flags [.], cksum 0xfe28 (incorrect -> 0xc509), seq 14, ack 13, win 512, options [nop,nop,TS val 240080153 ecr 240080153], length 0
2022-04-05 11:23:17.656424 IP (tos 0x0, ttl 64, id 2685, offset 0, flags [DF], proto TCP (6), length 569)
    127.0.0.1.45356 > 127.0.0.1.11350: Flags [P.], cksum 0x002e (incorrect -> 0x9667), seq 14:531, ack 13, win 512, options [nop,nop,TS val 240080159 ecr 240080153], length 517
2022-04-05 11:23:17.656434 IP (tos 0x0, ttl 64, id 1591, offset 0, flags [DF], proto TCP (6), length 52)
    127.0.0.1.11350 > 127.0.0.1.45356: Flags [.], cksum 0xfe28 (incorrect -> 0xc2fc), seq 13, ack 531, win 508, options [nop,nop,TS val 240080159 ecr 240080159], length 0
200, 4.91136622428894, 0.6846818923950195