2022-04-05 14:28:27.414839 IP (tos 0x0, ttl 64, id 18609, offset 0, flags [DF], proto TCP (6), length 60)
    127.0.0.1.55812 > 127.0.0.1.11450: Flags [S], cksum 0xfe30 (incorrect -> 0x3f77), seq 365103731, win 65495, options [mss 65495,sackOK,TS val 251189917 ecr 0,nop,wscale 7], length 0
2022-04-05 14:28:27.414849 IP (tos 0x0, ttl 64, id 0, offset 0, flags [DF], proto TCP (6), length 60)
    127.0.0.1.11450 > 127.0.0.1.55812: Flags [S.], cksum 0xfe30 (incorrect -> 0x91e6), seq 1718705540, ack 365103732, win 65483, options [mss 65495,sackOK,TS val 251189917 ecr 251189917,nop,wscale 7], length 0
2022-04-05 14:28:27.414856 IP (tos 0x0, ttl 64, id 18610, offset 0, flags [DF], proto TCP (6), length 52)
    127.0.0.1.55812 > 127.0.0.1.11450: Flags [.], cksum 0xfe28 (incorrect -> 0xb8a2), seq 1, ack 1, win 512, options [nop,nop,TS val 251189917 ecr 251189917], length 0
2022-04-05 14:28:27.414995 IP (tos 0x0, ttl 64, id 18611, offset 0, flags [DF], proto TCP (6), length 55)
    127.0.0.1.55812 > 127.0.0.1.11450: Flags [P.], cksum 0xfe2b (incorrect -> 0xb396), seq 1:4, ack 1, win 512, options [nop,nop,TS val 251189917 ecr 251189917], length 3
2022-04-05 14:28:27.415002 IP (tos 0x0, ttl 64, id 12989, offset 0, flags [DF], proto TCP (6), length 52)
    127.0.0.1.11450 > 127.0.0.1.55812: Flags [.], cksum 0xfe28 (incorrect -> 0xb89f), seq 1, ack 4, win 512, options [nop,nop,TS val 251189917 ecr 251189917], length 0
2022-04-05 14:28:27.415022 IP (tos 0x0, ttl 64, id 12990, offset 0, flags [DF], proto TCP (6), length 54)
    127.0.0.1.11450 > 127.0.0.1.55812: Flags [P.], cksum 0xfe2a (incorrect -> 0xb395), seq 1:3, ack 4, win 512, options [nop,nop,TS val 251189917 ecr 251189917], length 2
2022-04-05 14:28:27.415030 IP (tos 0x0, ttl 64, id 18612, offset 0, flags [DF], proto TCP (6), length 52)
    127.0.0.1.55812 > 127.0.0.1.11450: Flags [.], cksum 0xfe28 (incorrect -> 0xb89d), seq 4, ack 3, win 512, options [nop,nop,TS val 251189917 ecr 251189917], length 0
2022-04-05 14:28:27.416736 IP (tos 0x0, ttl 64, id 18613, offset 0, flags [DF], proto TCP (6), length 62)
    127.0.0.1.55812 > 127.0.0.1.11450: Flags [P.], cksum 0xfe32 (incorrect -> 0x83dd), seq 4:14, ack 3, win 512, options [nop,nop,TS val 251189919 ecr 251189917], length 10
2022-04-05 14:28:27.416744 IP (tos 0x0, ttl 64, id 12991, offset 0, flags [DF], proto TCP (6), length 52)
    127.0.0.1.11450 > 127.0.0.1.55812: Flags [.], cksum 0xfe28 (incorrect -> 0xb88f), seq 3, ack 14, win 512, options [nop,nop,TS val 251189919 ecr 251189919], length 0
2022-04-05 14:28:27.509670 IP (tos 0x0, ttl 64, id 12992, offset 0, flags [DF], proto TCP (6), length 62)
    127.0.0.1.11450 > 127.0.0.1.55812: Flags [P.], cksum 0xfe32 (incorrect -> 0xb31f), seq 3:13, ack 14, win 512, options [nop,nop,TS val 251190012 ecr 251189919], length 10
2022-04-05 14:28:27.509677 IP (tos 0x0, ttl 64, id 18614, offset 0, flags [DF], proto TCP (6), length 52)
    127.0.0.1.55812 > 127.0.0.1.11450: Flags [.], cksum 0xfe28 (incorrect -> 0xb7cb), seq 14, ack 13, win 512, options [nop,nop,TS val 251190012 ecr 251190012], length 0
2022-04-05 14:28:27.515325 IP (tos 0x0, ttl 64, id 18615, offset 0, flags [DF], proto TCP (6), length 569)
    127.0.0.1.55812 > 127.0.0.1.11450: Flags [P.], cksum 0x002e (incorrect -> 0x5af2), seq 14:531, ack 13, win 512, options [nop,nop,TS val 251190018 ecr 251190012], length 517
2022-04-05 14:28:27.515334 IP (tos 0x0, ttl 64, id 12993, offset 0, flags [DF], proto TCP (6), length 52)
    127.0.0.1.11450 > 127.0.0.1.55812: Flags [.], cksum 0xfe28 (incorrect -> 0xb5be), seq 13, ack 531, win 508, options [nop,nop,TS val 251190018 ecr 251190018], length 0
2022-04-05 14:28:27.638245 IP (tos 0x0, ttl 64, id 12994, offset 0, flags [DF], proto TCP (6), length 3538)
    127.0.0.1.11450 > 127.0.0.1.55812: Flags [P.], cksum 0x0bc7 (incorrect -> 0x137f), seq 13:3499, ack 531, win 512, options [nop,nop,TS val 251190141 ecr 251190018], length 3486
2022-04-05 14:28:27.638252 IP (tos 0x0, ttl 64, id 18616, offset 0, flags [DF], proto TCP (6), length 52)
    127.0.0.1.55812 > 127.0.0.1.11450: Flags [.], cksum 0xfe28 (incorrect -> 0xa738), seq 531, ack 3499, win 494, options [nop,nop,TS val 251190141 ecr 251190141], length 0
2022-04-05 14:28:27.665970 IP (tos 0x0, ttl 64, id 12995, offset 0, flags [DF], proto TCP (6), length 1334)
    127.0.0.1.11450 > 127.0.0.1.55812: Flags [P.], cksum 0x032b (incorrect -> 0xef75), seq 3499:4781, ack 531, win 512, options [nop,nop,TS val 251190168 ecr 251190141], length 1282
2022-04-05 14:28:27.665976 IP (tos 0x0, ttl 64, id 18617, offset 0, flags [DF], proto TCP (6), length 52)
    127.0.0.1.55812 > 127.0.0.1.11450: Flags [.], cksum 0xfe28 (incorrect -> 0xa1f8), seq 531, ack 4781, win 502, options [nop,nop,TS val 251190168 ecr 251190168], length 0
2022-04-05 14:28:27.666413 IP (tos 0x0, ttl 64, id 18618, offset 0, flags [DF], proto TCP (6), length 116)
    127.0.0.1.55812 > 127.0.0.1.11450: Flags [P.], cksum 0xfe68 (incorrect -> 0x15d5), seq 531:595, ack 4781, win 512, options [nop,nop,TS val 251190169 ecr 251190168], length 64
2022-04-05 14:28:27.666422 IP (tos 0x0, ttl 64, id 12996, offset 0, flags [DF], proto TCP (6), length 52)
    127.0.0.1.11450 > 127.0.0.1.55812: Flags [.], cksum 0xfe28 (incorrect -> 0xa1ac), seq 4781, ack 595, win 512, options [nop,nop,TS val 251190169 ecr 251190169], length 0
2022-04-05 14:28:27.666756 IP (tos 0x0, ttl 64, id 18619, offset 0, flags [DF], proto TCP (6), length 377)
    127.0.0.1.55812 > 127.0.0.1.11450: Flags [P.], cksum 0xff6d (incorrect -> 0x6e38), seq 595:920, ack 4781, win 512, options [nop,nop,TS val 251190169 ecr 251190169], length 325
2022-04-05 14:28:27.666765 IP (tos 0x0, ttl 64, id 12997, offset 0, flags [DF], proto TCP (6), length 52)
    127.0.0.1.11450 > 127.0.0.1.55812: Flags [.], cksum 0xfe28 (incorrect -> 0xa069), seq 4781, ack 920, win 510, options [nop,nop,TS val 251190169 ecr 251190169], length 0
2022-04-05 14:28:27.835994 IP (tos 0x0, ttl 64, id 12998, offset 0, flags [DF], proto TCP (6), length 3538)
    127.0.0.1.11450 > 127.0.0.1.55812: Flags [P.], cksum 0x0bc7 (incorrect -> 0x6c13), seq 4781:8267, ack 920, win 512, options [nop,nop,TS val 251190338 ecr 251190169], length 3486
2022-04-05 14:28:27.836002 IP (tos 0x0, ttl 64, id 18620, offset 0, flags [DF], proto TCP (6), length 52)
    127.0.0.1.55812 > 127.0.0.1.11450: Flags [.], cksum 0xfe28 (incorrect -> 0x9189), seq 920, ack 8267, win 494, options [nop,nop,TS val 251190338 ecr 251190338], length 0
2022-04-05 14:28:27.850164 IP (tos 0x0, ttl 64, id 12999, offset 0, flags [DF], proto TCP (6), length 3538)
    127.0.0.1.11450 > 127.0.0.1.55812: Flags [P.], cksum 0x0bc7 (incorrect -> 0xb411), seq 8267:11753, ack 920, win 512, options [nop,nop,TS val 251190353 ecr 251190338], length 3486
2022-04-05 14:28:27.850176 IP (tos 0x0, ttl 64, id 18621, offset 0, flags [DF], proto TCP (6), length 52)
    127.0.0.1.55812 > 127.0.0.1.11450: Flags [.], cksum 0xfe28 (incorrect -> 0x83cd), seq 920, ack 11753, win 494, options [nop,nop,TS val 251190353 ecr 251190353], length 0
2022-04-05 14:28:27.863063 IP (tos 0x0, ttl 64, id 13000, offset 0, flags [DF], proto TCP (6), length 4100)
    127.0.0.1.11450 > 127.0.0.1.55812: Flags [P.], cksum 0x0df9 (incorrect -> 0x689b), seq 11753:15801, ack 920, win 512, options [nop,nop,TS val 251190366 ecr 251190353], length 4048
2022-04-05 14:28:27.863069 IP (tos 0x0, ttl 64, id 18622, offset 0, flags [DF], proto TCP (6), length 52)
    127.0.0.1.55812 > 127.0.0.1.11450: Flags [.], cksum 0xfe28 (incorrect -> 0x73e5), seq 920, ack 15801, win 492, options [nop,nop,TS val 251190366 ecr 251190366], length 0
2022-04-05 14:28:27.863077 IP (tos 0x0, ttl 64, id 13001, offset 0, flags [DF], proto TCP (6), length 3474)
    127.0.0.1.11450 > 127.0.0.1.55812: Flags [P.], cksum 0x0b87 (incorrect -> 0xbea9), seq 15801:19223, ack 920, win 512, options [nop,nop,TS val 251190366 ecr 251190366], length 3422
2022-04-05 14:28:27.863081 IP (tos 0x0, ttl 64, id 18623, offset 0, flags [DF], proto TCP (6), length 52)
    127.0.0.1.55812 > 127.0.0.1.11450: Flags [.], cksum 0xfe28 (incorrect -> 0x6695), seq 920, ack 19223, win 478, options [nop,nop,TS val 251190366 ecr 251190366], length 0
2022-04-05 14:28:27.863111 IP (tos 0x0, ttl 64, id 13002, offset 0, flags [DF], proto TCP (6), length 3628)
    127.0.0.1.11450 > 127.0.0.1.55812: Flags [P.], cksum 0x0c21 (incorrect -> 0xb8c4), seq 19223:22799, ack 920, win 512, options [nop,nop,TS val 251190366 ecr 251190366], length 3576
2022-04-05 14:28:27.863115 IP (tos 0x0, ttl 64, id 18624, offset 0, flags [DF], proto TCP (6), length 52)
    127.0.0.1.55812 > 127.0.0.1.11450: Flags [.], cksum 0xfe28 (incorrect -> 0x58ab), seq 920, ack 22799, win 464, options [nop,nop,TS val 251190366 ecr 251190366], length 0
2022-04-05 14:28:27.876938 IP (tos 0x0, ttl 64, id 13003, offset 0, flags [DF], proto TCP (6), length 4100)
    127.0.0.1.11450 > 127.0.0.1.55812: Flags [P.], cksum 0x0df9 (incorrect -> 0x32c5), seq 22799:26847, ack 920, win 512, options [nop,nop,TS val 251190379 ecr 251190366], length 4048
2022-04-05 14:28:27.876945 IP (tos 0x0, ttl 64, id 18625, offset 0, flags [DF], proto TCP (6), length 52)
    127.0.0.1.55812 > 127.0.0.1.11450: Flags [.], cksum 0xfe28 (incorrect -> 0x48a5), seq 920, ack 26847, win 492, options [nop,nop,TS val 251190379 ecr 251190379], length 0
2022-04-05 14:28:27.876953 IP (tos 0x0, ttl 64, id 13004, offset 0, flags [DF], proto TCP (6), length 486)
    127.0.0.1.11450 > 127.0.0.1.55812: Flags [P.], cksum 0xffda (incorrect -> 0xf1b0), seq 26847:27281, ack 920, win 512, options [nop,nop,TS val 251190379 ecr 251190379], length 434
2022-04-05 14:28:27.876957 IP (tos 0x0, ttl 64, id 18626, offset 0, flags [DF], proto TCP (6), length 52)
    127.0.0.1.55812 > 127.0.0.1.11450: Flags [.], cksum 0xfe28 (incorrect -> 0x46f5), seq 920, ack 27281, win 490, options [nop,nop,TS val 251190379 ecr 251190379], length 0
2022-04-05 14:28:27.876987 IP (tos 0x0, ttl 64, id 13005, offset 0, flags [DF], proto TCP (6), length 4036)
    127.0.0.1.11450 > 127.0.0.1.55812: Flags [P.], cksum 0x0db9 (incorrect -> 0xda73), seq 27281:31265, ack 920, win 512, options [nop,nop,TS val 251190379 ecr 251190379], length 3984
2022-04-05 14:28:27.876991 IP (tos 0x0, ttl 64, id 18627, offset 0, flags [DF], proto TCP (6), length 52)
    127.0.0.1.55812 > 127.0.0.1.11450: Flags [.], cksum 0xfe28 (incorrect -> 0x3775), seq 920, ack 31265, win 474, options [nop,nop,TS val 251190379 ecr 251190379], length 0
2022-04-05 14:28:27.877004 IP (tos 0x0, ttl 64, id 13006, offset 0, flags [DF], proto TCP (6), length 550)
    127.0.0.1.11450 > 127.0.0.1.55812: Flags [P.], cksum 0x001b (incorrect -> 0x6950), seq 31265:31763, ack 920, win 512, options [nop,nop,TS val 251190379 ecr 251190379], length 498
2022-04-05 14:28:27.877017 IP (tos 0x0, ttl 64, id 18628, offset 0, flags [DF], proto TCP (6), length 52)
    127.0.0.1.55812 > 127.0.0.1.11450: Flags [.], cksum 0xfe28 (incorrect -> 0x355d), seq 920, ack 31763, win 512, options [nop,nop,TS val 251190379 ecr 251190379], length 0
2022-04-05 14:28:27.889761 IP (tos 0x0, ttl 64, id 13007, offset 0, flags [DF], proto TCP (6), length 4100)
    127.0.0.1.11450 > 127.0.0.1.55812: Flags [P.], cksum 0x0df9 (incorrect -> 0x4390), seq 31763:35811, ack 920, win 512, options [nop,nop,TS val 251190392 ecr 251190379], length 4048
2022-04-05 14:28:27.903420 IP (tos 0x0, ttl 64, id 13008, offset 0, flags [DF], proto TCP (6), length 32820)
    127.0.0.1.11450 > 127.0.0.1.55812: Flags [.], cksum 0x7e29 (incorrect -> 0xec3c), seq 35811:68579, ack 920, win 512, options [nop,nop,TS val 251190406 ecr 251190379], length 32768
2022-04-05 14:28:27.903437 IP (tos 0x0, ttl 64, id 18629, offset 0, flags [DF], proto TCP (6), length 52)
    127.0.0.1.55812 > 127.0.0.1.11450: Flags [.], cksum 0xfe28 (incorrect -> 0xa5e9), seq 920, ack 68579, win 379, options [nop,nop,TS val 251190406 ecr 251190392], length 0
2022-04-05 14:28:27.903442 IP (tos 0x0, ttl 64, id 13009, offset 0, flags [DF], proto TCP (6), length 1619)
    127.0.0.1.11450 > 127.0.0.1.55812: Flags [P.], cksum 0x0448 (incorrect -> 0x00c2), seq 68579:70146, ack 920, win 512, options [nop,nop,TS val 251190406 ecr 251190406], length 1567
2022-04-05 14:28:27.903909 IP (tos 0x0, ttl 64, id 18630, offset 0, flags [DF], proto TCP (6), length 52)
    127.0.0.1.55812 > 127.0.0.1.11450: Flags [.], cksum 0xfe28 (incorrect -> 0x9f37), seq 920, ack 70146, win 512, options [nop,nop,TS val 251190406 ecr 251190406], length 0
2022-04-05 14:28:27.903915 IP (tos 0x0, ttl 64, id 13010, offset 0, flags [DF], proto TCP (6), length 3456)
    127.0.0.1.11450 > 127.0.0.1.55812: Flags [P.], cksum 0x0b75 (incorrect -> 0x6f75), seq 70146:73550, ack 920, win 512, options [nop,nop,TS val 251190406 ecr 251190406], length 3404
2022-04-05 14:28:27.904335 IP (tos 0x0, ttl 64, id 18631, offset 0, flags [DF], proto TCP (6), length 52)
    127.0.0.1.55812 > 127.0.0.1.11450: Flags [.], cksum 0xfe28 (incorrect -> 0x91ea), seq 920, ack 73550, win 512, options [nop,nop,TS val 251190407 ecr 251190406], length 0
2022-04-05 14:28:27.906392 IP (tos 0x0, ttl 64, id 13011, offset 0, flags [DF], proto TCP (6), length 3538)
    127.0.0.1.11450 > 127.0.0.1.55812: Flags [P.], cksum 0x0bc7 (incorrect -> 0x749b), seq 73550:77036, ack 920, win 512, options [nop,nop,TS val 251190409 ecr 251190407], length 3486
2022-04-05 14:28:27.906405 IP (tos 0x0, ttl 64, id 18632, offset 0, flags [DF], proto TCP (6), length 52)
    127.0.0.1.55812 > 127.0.0.1.11450: Flags [.], cksum 0xfe28 (incorrect -> 0x8447), seq 920, ack 77036, win 512, options [nop,nop,TS val 251190409 ecr 251190409], length 0
2022-04-05 14:28:27.914269 IP (tos 0x0, ttl 64, id 13012, offset 0, flags [DF], proto TCP (6), length 550)
    127.0.0.1.11450 > 127.0.0.1.55812: Flags [P.], cksum 0x001b (incorrect -> 0xcb47), seq 77036:77534, ack 920, win 512, options [nop,nop,TS val 251190417 ecr 251190409], length 498
2022-04-05 14:28:27.914283 IP (tos 0x0, ttl 64, id 18633, offset 0, flags [DF], proto TCP (6), length 52)
    127.0.0.1.55812 > 127.0.0.1.11450: Flags [.], cksum 0xfe28 (incorrect -> 0x8245), seq 920, ack 77534, win 512, options [nop,nop,TS val 251190417 ecr 251190417], length 0
2022-04-05 14:28:27.914371 IP (tos 0x0, ttl 64, id 13013, offset 0, flags [DF], proto TCP (6), length 4100)
    127.0.0.1.11450 > 127.0.0.1.55812: Flags [P.], cksum 0x0df9 (incorrect -> 0xbd78), seq 77534:81582, ack 920, win 512, options [nop,nop,TS val 251190417 ecr 251190417], length 4048
2022-04-05 14:28:27.914389 IP (tos 0x0, ttl 64, id 18634, offset 0, flags [DF], proto TCP (6), length 52)
    127.0.0.1.55812 > 127.0.0.1.11450: Flags [.], cksum 0xfe28 (incorrect -> 0x7275), seq 920, ack 81582, win 512, options [nop,nop,TS val 251190417 ecr 251190417], length 0
2022-04-05 14:28:27.914394 IP (tos 0x0, ttl 64, id 13014, offset 0, flags [DF], proto TCP (6), length 3474)
    127.0.0.1.11450 > 127.0.0.1.55812: Flags [P.], cksum 0x0b87 (incorrect -> 0x96d6), seq 81582:85004, ack 920, win 512, options [nop,nop,TS val 251190417 ecr 251190417], length 3422
2022-04-05 14:28:27.914399 IP (tos 0x0, ttl 64, id 18635, offset 0, flags [DF], proto TCP (6), length 52)
    127.0.0.1.55812 > 127.0.0.1.11450: Flags [.], cksum 0xfe28 (incorrect -> 0x6517), seq 920, ack 85004, win 512, options [nop,nop,TS val 251190417 ecr 251190417], length 0
2022-04-05 14:28:27.915944 IP (tos 0x0, ttl 64, id 13015, offset 0, flags [DF], proto TCP (6), length 4100)
    127.0.0.1.11450 > 127.0.0.1.55812: Flags [P.], cksum 0x0df9 (incorrect -> 0x5650), seq 85004:89052, ack 920, win 512, options [nop,nop,TS val 251190418 ecr 251190417], length 4048
2022-04-05 14:28:27.916184 IP (tos 0x0, ttl 64, id 18636, offset 0, flags [DF], proto TCP (6), length 52)
    127.0.0.1.55812 > 127.0.0.1.11450: Flags [.], cksum 0xfe28 (incorrect -> 0x5544), seq 920, ack 89052, win 512, options [nop,nop,TS val 251190419 ecr 251190418], length 0
2022-04-05 14:28:27.916191 IP (tos 0x0, ttl 64, id 13016, offset 0, flags [DF], proto TCP (6), length 7988)
    127.0.0.1.11450 > 127.0.0.1.55812: Flags [P.], cksum 0x1d29 (incorrect -> 0xa14d), seq 89052:96988, ack 920, win 512, options [nop,nop,TS val 251190419 ecr 251190419], length 7936
2022-04-05 14:28:27.916381 IP (tos 0x0, ttl 64, id 18637, offset 0, flags [DF], proto TCP (6), length 52)
    127.0.0.1.55812 > 127.0.0.1.11450: Flags [.], cksum 0xfe28 (incorrect -> 0x3643), seq 920, ack 96988, win 512, options [nop,nop,TS val 251190419 ecr 251190419], length 0
2022-04-05 14:28:27.916593 IP (tos 0x0, ttl 64, id 13017, offset 0, flags [DF], proto TCP (6), length 4100)
    127.0.0.1.11450 > 127.0.0.1.55812: Flags [P.], cksum 0x0df9 (incorrect -> 0xeaca), seq 96988:101036, ack 920, win 512, options [nop,nop,TS val 251190419 ecr 251190419], length 4048
2022-04-05 14:28:27.916613 IP (tos 0x0, ttl 64, id 18638, offset 0, flags [DF], proto TCP (6), length 52)
    127.0.0.1.55812 > 127.0.0.1.11450: Flags [.], cksum 0xfe28 (incorrect -> 0x2673), seq 920, ack 101036, win 512, options [nop,nop,TS val 251190419 ecr 251190419], length 0
2022-04-05 14:28:27.916617 IP (tos 0x0, ttl 64, id 13018, offset 0, flags [DF], proto TCP (6), length 486)
    127.0.0.1.11450 > 127.0.0.1.55812: Flags [P.], cksum 0xffda (incorrect -> 0xa44d), seq 101036:101470, ack 920, win 512, options [nop,nop,TS val 251190419 ecr 251190419], length 434
2022-04-05 14:28:27.916622 IP (tos 0x0, ttl 64, id 18639, offset 0, flags [DF], proto TCP (6), length 52)
    127.0.0.1.55812 > 127.0.0.1.11450: Flags [.], cksum 0xfe28 (incorrect -> 0x24c1), seq 920, ack 101470, win 512, options [nop,nop,TS val 251190419 ecr 251190419], length 0
2022-04-05 14:28:27.917813 IP (tos 0x0, ttl 64, id 13019, offset 0, flags [DF], proto TCP (6), length 3040)
    127.0.0.1.11450 > 127.0.0.1.55812: Flags [P.], cksum 0x09d5 (incorrect -> 0xfe1e), seq 101470:104458, ack 920, win 512, options [nop,nop,TS val 251190420 ecr 251190419], length 2988
2022-04-05 14:28:27.917825 IP (tos 0x0, ttl 64, id 18640, offset 0, flags [DF], proto TCP (6), length 52)
    127.0.0.1.55812 > 127.0.0.1.11450: Flags [.], cksum 0xfe28 (incorrect -> 0x1913), seq 920, ack 104458, win 512, options [nop,nop,TS val 251190420 ecr 251190420], length 0
2022-04-05 14:28:27.917889 IP (tos 0x0, ttl 64, id 13020, offset 0, flags [DF], proto TCP (6), length 3538)
    127.0.0.1.11450 > 127.0.0.1.55812: Flags [P.], cksum 0x0bc7 (incorrect -> 0x0b76), seq 104458:107944, ack 920, win 512, options [nop,nop,TS val 251190420 ecr 251190420], length 3486
2022-04-05 14:28:27.917900 IP (tos 0x0, ttl 64, id 18641, offset 0, flags [DF], proto TCP (6), length 52)
    127.0.0.1.55812 > 127.0.0.1.11450: Flags [.], cksum 0xfe28 (incorrect -> 0x0b75), seq 920, ack 107944, win 512, options [nop,nop,TS val 251190420 ecr 251190420], length 0
2022-04-05 14:28:27.919947 IP (tos 0x0, ttl 64, id 13021, offset 0, flags [DF], proto TCP (6), length 1546)
    127.0.0.1.11450 > 127.0.0.1.55812: Flags [P.], cksum 0x03ff (incorrect -> 0xa6f2), seq 107944:109438, ack 920, win 512, options [nop,nop,TS val 251190422 ecr 251190420], length 1494
2022-04-05 14:28:27.919961 IP (tos 0x0, ttl 64, id 18642, offset 0, flags [DF], proto TCP (6), length 52)
    127.0.0.1.55812 > 127.0.0.1.11450: Flags [.], cksum 0xfe28 (incorrect -> 0x059b), seq 920, ack 109438, win 512, options [nop,nop,TS val 251190422 ecr 251190422], length 0
2022-04-05 14:28:27.920066 IP (tos 0x0, ttl 64, id 13022, offset 0, flags [DF], proto TCP (6), length 4100)
    127.0.0.1.11450 > 127.0.0.1.55812: Flags [P.], cksum 0x0df9 (incorrect -> 0x13de), seq 109438:113486, ack 920, win 512, options [nop,nop,TS val 251190423 ecr 251190422], length 4048
2022-04-05 14:28:27.920072 IP (tos 0x0, ttl 64, id 18643, offset 0, flags [DF], proto TCP (6), length 52)
    127.0.0.1.55812 > 127.0.0.1.11450: Flags [.], cksum 0xfe28 (incorrect -> 0xf1c9), seq 920, ack 113486, win 1535, options [nop,nop,TS val 251190423 ecr 251190423], length 0
2022-04-05 14:28:27.920079 IP (tos 0x0, ttl 64, id 13023, offset 0, flags [DF], proto TCP (6), length 3474)
    127.0.0.1.11450 > 127.0.0.1.55812: Flags [P.], cksum 0x0b87 (incorrect -> 0xf0b4), seq 113486:116908, ack 920, win 512, options [nop,nop,TS val 251190423 ecr 251190423], length 3422
2022-04-05 14:28:27.920082 IP (tos 0x0, ttl 64, id 18644, offset 0, flags [DF], proto TCP (6), length 52)
    127.0.0.1.55812 > 127.0.0.1.11450: Flags [.], cksum 0xfe28 (incorrect -> 0xe06b), seq 920, ack 116908, win 2559, options [nop,nop,TS val 251190423 ecr 251190423], length 0
2022-04-05 14:28:27.920101 IP (tos 0x0, ttl 64, id 13024, offset 0, flags [DF], proto TCP (6), length 1048)
    127.0.0.1.11450 > 127.0.0.1.55812: Flags [P.], cksum 0x020d (incorrect -> 0x90bf), seq 116908:117904, ack 920, win 512, options [nop,nop,TS val 251190423 ecr 251190423], length 996
2022-04-05 14:28:27.920105 IP (tos 0x0, ttl 64, id 18645, offset 0, flags [DF], proto TCP (6), length 52)
    127.0.0.1.55812 > 127.0.0.1.11450: Flags [.], cksum 0xfe28 (incorrect -> 0xda87), seq 920, ack 117904, win 3071, options [nop,nop,TS val 251190423 ecr 251190423], length 0
200, 4.724645614624023, 0.6254212856292725