2022-04-05 16:21:13.787269 IP (tos 0x0, ttl 64, id 14923, offset 0, flags [DF], proto TCP (6), length 60)
    127.0.0.1.45668 > 127.0.0.1.11350: Flags [S], cksum 0xfe30 (incorrect -> 0x6b4e), seq 1850961539, win 65495, options [mss 65495,sackOK,TS val 257956290 ecr 0,nop,wscale 7], length 0
2022-04-05 16:21:13.787280 IP (tos 0x0, ttl 64, id 0, offset 0, flags [DF], proto TCP (6), length 60)
    127.0.0.1.11350 > 127.0.0.1.45668: Flags [S.], cksum 0xfe30 (incorrect -> 0xf33f), seq 70732464, ack 1850961540, win 65483, options [mss 65495,sackOK,TS val 257956290 ecr 257956290,nop,wscale 7], length 0
2022-04-05 16:21:13.787288 IP (tos 0x0, ttl 64, id 14924, offset 0, flags [DF], proto TCP (6), length 52)
    127.0.0.1.45668 > 127.0.0.1.11350: Flags [.], cksum 0xfe28 (incorrect -> 0x19fc), seq 1, ack 1, win 512, options [nop,nop,TS val 257956290 ecr 257956290], length 0
2022-04-05 16:21:13.787397 IP (tos 0x0, ttl 64, id 14925, offset 0, flags [DF], proto TCP (6), length 55)
    127.0.0.1.45668 > 127.0.0.1.11350: Flags [P.], cksum 0xfe2b (incorrect -> 0x14f0), seq 1:4, ack 1, win 512, options [nop,nop,TS val 257956290 ecr 257956290], length 3
2022-04-05 16:21:13.787410 IP (tos 0x0, ttl 64, id 2195, offset 0, flags [DF], proto TCP (6), length 52)
    127.0.0.1.11350 > 127.0.0.1.45668: Flags [.], cksum 0xfe28 (incorrect -> 0x19f9), seq 1, ack 4, win 512, options [nop,nop,TS val 257956290 ecr 257956290], length 0
2022-04-05 16:21:13.787443 IP (tos 0x0, ttl 64, id 2196, offset 0, flags [DF], proto TCP (6), length 54)
    127.0.0.1.11350 > 127.0.0.1.45668: Flags [P.], cksum 0xfe2a (incorrect -> 0x14ef), seq 1:3, ack 4, win 512, options [nop,nop,TS val 257956290 ecr 257956290], length 2
2022-04-05 16:21:13.787456 IP (tos 0x0, ttl 64, id 14926, offset 0, flags [DF], proto TCP (6), length 52)
    127.0.0.1.45668 > 127.0.0.1.11350: Flags [.], cksum 0xfe28 (incorrect -> 0x19f7), seq 4, ack 3, win 512, options [nop,nop,TS val 257956290 ecr 257956290], length 0
2022-04-05 16:21:13.789556 IP (tos 0x0, ttl 64, id 14927, offset 0, flags [DF], proto TCP (6), length 62)
    127.0.0.1.45668 > 127.0.0.1.11350: Flags [P.], cksum 0xfe32 (incorrect -> 0x7200), seq 4:14, ack 3, win 512, options [nop,nop,TS val 257956292 ecr 257956290], length 10
2022-04-05 16:21:13.789572 IP (tos 0x0, ttl 64, id 2197, offset 0, flags [DF], proto TCP (6), length 52)
    127.0.0.1.11350 > 127.0.0.1.45668: Flags [.], cksum 0xfe28 (incorrect -> 0x19e9), seq 3, ack 14, win 512, options [nop,nop,TS val 257956292 ecr 257956292], length 0
2022-04-05 16:21:13.869154 IP (tos 0x0, ttl 64, id 2198, offset 0, flags [DF], proto TCP (6), length 62)
    127.0.0.1.11350 > 127.0.0.1.45668: Flags [P.], cksum 0xfe32 (incorrect -> 0x1486), seq 3:13, ack 14, win 512, options [nop,nop,TS val 257956372 ecr 257956292], length 10
2022-04-05 16:21:13.869166 IP (tos 0x0, ttl 64, id 14928, offset 0, flags [DF], proto TCP (6), length 52)
    127.0.0.1.45668 > 127.0.0.1.11350: Flags [.], cksum 0xfe28 (incorrect -> 0x193f), seq 14, ack 13, win 512, options [nop,nop,TS val 257956372 ecr 257956372], length 0
2022-04-05 16:21:13.874830 IP (tos 0x0, ttl 64, id 14929, offset 0, flags [DF], proto TCP (6), length 569)
    127.0.0.1.45668 > 127.0.0.1.11350: Flags [P.], cksum 0x002e (incorrect -> 0x057a), seq 14:531, ack 13, win 512, options [nop,nop,TS val 257956377 ecr 257956372], length 517
2022-04-05 16:21:13.874840 IP (tos 0x0, ttl 64, id 2199, offset 0, flags [DF], proto TCP (6), length 52)
    127.0.0.1.11350 > 127.0.0.1.45668: Flags [.], cksum 0xfe28 (incorrect -> 0x1734), seq 13, ack 531, win 508, options [nop,nop,TS val 257956377 ecr 257956377], length 0
200, 4.98073410987854, 0.7256946563720703