2022-04-05 20:25:03.159069 IP (tos 0x0, ttl 64, id 10483, offset 0, flags [DF], proto TCP (6), length 60)
    127.0.0.1.44984 > 127.0.0.1.10650: Flags [S], cksum 0xfe30 (incorrect -> 0xd791), seq 2536940521, win 65495, options [mss 65495,sackOK,TS val 272585662 ecr 0,nop,wscale 7], length 0
2022-04-05 20:25:03.159078 IP (tos 0x0, ttl 64, id 0, offset 0, flags [DF], proto TCP (6), length 60)
    127.0.0.1.10650 > 127.0.0.1.44984: Flags [S.], cksum 0xfe30 (incorrect -> 0x70ae), seq 128056127, ack 2536940522, win 65483, options [mss 65495,sackOK,TS val 272585662 ecr 272585662,nop,wscale 7], length 0
2022-04-05 20:25:03.159086 IP (tos 0x0, ttl 64, id 10484, offset 0, flags [DF], proto TCP (6), length 52)
    127.0.0.1.44984 > 127.0.0.1.10650: Flags [.], cksum 0xfe28 (incorrect -> 0x976a), seq 1, ack 1, win 512, options [nop,nop,TS val 272585662 ecr 272585662], length 0
2022-04-05 20:25:03.159176 IP (tos 0x0, ttl 64, id 10485, offset 0, flags [DF], proto TCP (6), length 55)
    127.0.0.1.44984 > 127.0.0.1.10650: Flags [P.], cksum 0xfe2b (incorrect -> 0x925e), seq 1:4, ack 1, win 512, options [nop,nop,TS val 272585662 ecr 272585662], length 3
2022-04-05 20:25:03.159190 IP (tos 0x0, ttl 64, id 64171, offset 0, flags [DF], proto TCP (6), length 52)
    127.0.0.1.10650 > 127.0.0.1.44984: Flags [.], cksum 0xfe28 (incorrect -> 0x9767), seq 1, ack 4, win 512, options [nop,nop,TS val 272585662 ecr 272585662], length 0
2022-04-05 20:25:03.159256 IP (tos 0x0, ttl 64, id 64172, offset 0, flags [DF], proto TCP (6), length 54)
    127.0.0.1.10650 > 127.0.0.1.44984: Flags [P.], cksum 0xfe2a (incorrect -> 0x925d), seq 1:3, ack 4, win 512, options [nop,nop,TS val 272585662 ecr 272585662], length 2
2022-04-05 20:25:03.159270 IP (tos 0x0, ttl 64, id 10486, offset 0, flags [DF], proto TCP (6), length 52)
    127.0.0.1.44984 > 127.0.0.1.10650: Flags [.], cksum 0xfe28 (incorrect -> 0x9765), seq 4, ack 3, win 512, options [nop,nop,TS val 272585662 ecr 272585662], length 0
2022-04-05 20:25:03.171075 IP (tos 0x0, ttl 64, id 10487, offset 0, flags [DF], proto TCP (6), length 62)
    127.0.0.1.44984 > 127.0.0.1.10650: Flags [P.], cksum 0xfe32 (incorrect -> 0xed81), seq 4:14, ack 3, win 512, options [nop,nop,TS val 272585674 ecr 272585662], length 10
2022-04-05 20:25:03.171095 IP (tos 0x0, ttl 64, id 64173, offset 0, flags [DF], proto TCP (6), length 52)
    127.0.0.1.10650 > 127.0.0.1.44984: Flags [.], cksum 0xfe28 (incorrect -> 0x9743), seq 3, ack 14, win 512, options [nop,nop,TS val 272585674 ecr 272585674], length 0
2022-04-05 20:25:03.269016 IP (tos 0x0, ttl 64, id 64174, offset 0, flags [DF], proto TCP (6), length 62)
    127.0.0.1.10650 > 127.0.0.1.44984: Flags [P.], cksum 0xfe32 (incorrect -> 0x91cf), seq 3:13, ack 14, win 512, options [nop,nop,TS val 272585771 ecr 272585674], length 10
2022-04-05 20:25:03.269031 IP (tos 0x0, ttl 64, id 10488, offset 0, flags [DF], proto TCP (6), length 52)
    127.0.0.1.44984 > 127.0.0.1.10650: Flags [.], cksum 0xfe28 (incorrect -> 0x9677), seq 14, ack 13, win 512, options [nop,nop,TS val 272585771 ecr 272585771], length 0
2022-04-05 20:25:03.275339 IP (tos 0x0, ttl 64, id 10489, offset 0, flags [DF], proto TCP (6), length 569)
    127.0.0.1.44984 > 127.0.0.1.10650: Flags [P.], cksum 0x002e (incorrect -> 0x14f6), seq 14:531, ack 13, win 512, options [nop,nop,TS val 272585778 ecr 272585771], length 517
2022-04-05 20:25:03.275348 IP (tos 0x0, ttl 64, id 64175, offset 0, flags [DF], proto TCP (6), length 52)
    127.0.0.1.10650 > 127.0.0.1.44984: Flags [.], cksum 0xfe28 (incorrect -> 0x9468), seq 13, ack 531, win 508, options [nop,nop,TS val 272585778 ecr 272585778], length 0
2022-04-05 20:25:03.396148 IP (tos 0x0, ttl 64, id 64176, offset 0, flags [DF], proto TCP (6), length 151)
    127.0.0.1.10650 > 127.0.0.1.44984: Flags [P.], cksum 0xfe8b (incorrect -> 0xed1b), seq 13:112, ack 531, win 512, options [nop,nop,TS val 272585899 ecr 272585778], length 99
2022-04-05 20:25:03.396160 IP (tos 0x0, ttl 64, id 10490, offset 0, flags [DF], proto TCP (6), length 52)
    127.0.0.1.44984 > 127.0.0.1.10650: Flags [.], cksum 0xfe28 (incorrect -> 0x930f), seq 531, ack 112, win 512, options [nop,nop,TS val 272585899 ecr 272585899], length 0
2022-04-05 20:25:03.396357 IP (tos 0x0, ttl 64, id 10491, offset 0, flags [DF], proto TCP (6), length 575)
    127.0.0.1.44984 > 127.0.0.1.10650: Flags [P.], cksum 0x0034 (incorrect -> 0x1b23), seq 531:1054, ack 112, win 512, options [nop,nop,TS val 272585899 ecr 272585899], length 523
2022-04-05 20:25:03.396364 IP (tos 0x0, ttl 64, id 64177, offset 0, flags [DF], proto TCP (6), length 52)
    127.0.0.1.10650 > 127.0.0.1.44984: Flags [.], cksum 0xfe28 (incorrect -> 0x9108), seq 112, ack 1054, win 508, options [nop,nop,TS val 272585899 ecr 272585899], length 0
2022-04-05 20:25:03.472408 IP (tos 0x0, ttl 64, id 64178, offset 0, flags [DF], proto TCP (6), length 3538)
    127.0.0.1.10650 > 127.0.0.1.44984: Flags [P.], cksum 0x0bc7 (incorrect -> 0x8fa1), seq 112:3598, ack 1054, win 512, options [nop,nop,TS val 272585975 ecr 272585899], length 3486
2022-04-05 20:25:03.472419 IP (tos 0x0, ttl 64, id 10492, offset 0, flags [DF], proto TCP (6), length 52)
    127.0.0.1.44984 > 127.0.0.1.10650: Flags [.], cksum 0xfe28 (incorrect -> 0x82e0), seq 1054, ack 3598, win 494, options [nop,nop,TS val 272585975 ecr 272585975], length 0
2022-04-05 20:25:03.480091 IP (tos 0x0, ttl 64, id 64179, offset 0, flags [DF], proto TCP (6), length 3538)
    127.0.0.1.10650 > 127.0.0.1.44984: Flags [P.], cksum 0x0bc7 (incorrect -> 0xeb49), seq 3598:7084, ack 1054, win 512, options [nop,nop,TS val 272585983 ecr 272585975], length 3486
2022-04-05 20:25:03.480098 IP (tos 0x0, ttl 64, id 10493, offset 0, flags [DF], proto TCP (6), length 52)
    127.0.0.1.44984 > 127.0.0.1.10650: Flags [.], cksum 0xfe28 (incorrect -> 0x7532), seq 1054, ack 7084, win 494, options [nop,nop,TS val 272585983 ecr 272585983], length 0
2022-04-05 20:25:03.486876 IP (tos 0x0, ttl 64, id 64180, offset 0, flags [DF], proto TCP (6), length 3380)
    127.0.0.1.10650 > 127.0.0.1.44984: Flags [P.], cksum 0x0b29 (incorrect -> 0x5753), seq 7084:10412, ack 1054, win 512, options [nop,nop,TS val 272585989 ecr 272585983], length 3328
2022-04-05 20:25:03.486886 IP (tos 0x0, ttl 64, id 10494, offset 0, flags [DF], proto TCP (6), length 52)
    127.0.0.1.44984 > 127.0.0.1.10650: Flags [.], cksum 0xfe28 (incorrect -> 0x6826), seq 1054, ack 10412, win 494, options [nop,nop,TS val 272585989 ecr 272585989], length 0
2022-04-05 20:25:03.487514 IP (tos 0x0, ttl 64, id 10495, offset 0, flags [DF], proto TCP (6), length 126)
    127.0.0.1.44984 > 127.0.0.1.10650: Flags [P.], cksum 0xfe72 (incorrect -> 0x1867), seq 1054:1128, ack 10412, win 512, options [nop,nop,TS val 272585990 ecr 272585989], length 74
2022-04-05 20:25:03.487523 IP (tos 0x0, ttl 64, id 64181, offset 0, flags [DF], proto TCP (6), length 52)
    127.0.0.1.10650 > 127.0.0.1.44984: Flags [.], cksum 0xfe28 (incorrect -> 0x67c8), seq 10412, ack 1128, win 512, options [nop,nop,TS val 272585990 ecr 272585990], length 0
2022-04-05 20:25:03.488059 IP (tos 0x0, ttl 64, id 10496, offset 0, flags [DF], proto TCP (6), length 318)
    127.0.0.1.44984 > 127.0.0.1.10650: Flags [P.], cksum 0xff32 (incorrect -> 0xafb8), seq 1128:1394, ack 10412, win 512, options [nop,nop,TS val 272585990 ecr 272585990], length 266
2022-04-05 20:25:03.488067 IP (tos 0x0, ttl 64, id 64182, offset 0, flags [DF], proto TCP (6), length 52)
    127.0.0.1.10650 > 127.0.0.1.44984: Flags [.], cksum 0xfe28 (incorrect -> 0x66bf), seq 10412, ack 1394, win 510, options [nop,nop,TS val 272585991 ecr 272585990], length 0
2022-04-05 20:25:03.546661 IP (tos 0x0, ttl 64, id 64183, offset 0, flags [DF], proto TCP (6), length 626)
    127.0.0.1.10650 > 127.0.0.1.44984: Flags [P.], cksum 0x0067 (incorrect -> 0xfe41), seq 10412:10986, ack 1394, win 512, options [nop,nop,TS val 272586049 ecr 272585990], length 574
2022-04-05 20:25:03.590665 IP (tos 0x0, ttl 64, id 10497, offset 0, flags [DF], proto TCP (6), length 52)
    127.0.0.1.44984 > 127.0.0.1.10650: Flags [.], cksum 0xfe28 (incorrect -> 0x63de), seq 1394, ack 10986, win 512, options [nop,nop,TS val 272586093 ecr 272586049], length 0
2022-04-05 20:25:04.074937 IP (tos 0x0, ttl 64, id 64184, offset 0, flags [DF], proto TCP (6), length 3538)
    127.0.0.1.10650 > 127.0.0.1.44984: Flags [P.], cksum 0x0bc7 (incorrect -> 0x40aa), seq 10986:14472, ack 1394, win 512, options [nop,nop,TS val 272586577 ecr 272586093], length 3486
2022-04-05 20:25:04.074948 IP (tos 0x0, ttl 64, id 10498, offset 0, flags [DF], proto TCP (6), length 52)
    127.0.0.1.44984 > 127.0.0.1.10650: Flags [.], cksum 0xfe28 (incorrect -> 0x525e), seq 1394, ack 14472, win 494, options [nop,nop,TS val 272586577 ecr 272586577], length 0
2022-04-05 20:25:04.094163 IP (tos 0x0, ttl 64, id 64185, offset 0, flags [DF], proto TCP (6), length 3538)
    127.0.0.1.10650 > 127.0.0.1.44984: Flags [P.], cksum 0x0bc7 (incorrect -> 0xd2ac), seq 14472:17958, ack 1394, win 512, options [nop,nop,TS val 272586597 ecr 272586577], length 3486
2022-04-05 20:25:04.094170 IP (tos 0x0, ttl 64, id 10499, offset 0, flags [DF], proto TCP (6), length 52)
    127.0.0.1.44984 > 127.0.0.1.10650: Flags [.], cksum 0xfe28 (incorrect -> 0x4498), seq 1394, ack 17958, win 494, options [nop,nop,TS val 272586597 ecr 272586597], length 0
2022-04-05 20:25:04.099170 IP (tos 0x0, ttl 64, id 64186, offset 0, flags [DF], proto TCP (6), length 4036)
    127.0.0.1.10650 > 127.0.0.1.44984: Flags [P.], cksum 0x0db9 (incorrect -> 0x4740), seq 17958:21942, ack 1394, win 512, options [nop,nop,TS val 272586602 ecr 272586597], length 3984
2022-04-05 20:25:04.099177 IP (tos 0x0, ttl 64, id 10500, offset 0, flags [DF], proto TCP (6), length 52)
    127.0.0.1.44984 > 127.0.0.1.10650: Flags [.], cksum 0xfe28 (incorrect -> 0x3500), seq 1394, ack 21942, win 492, options [nop,nop,TS val 272586602 ecr 272586602], length 0
2022-04-05 20:25:04.105515 IP (tos 0x0, ttl 64, id 64187, offset 0, flags [DF], proto TCP (6), length 4036)
    127.0.0.1.10650 > 127.0.0.1.44984: Flags [P.], cksum 0x0db9 (incorrect -> 0xb2e4), seq 21942:25926, ack 1394, win 512, options [nop,nop,TS val 272586608 ecr 272586602], length 3984
2022-04-05 20:25:04.105521 IP (tos 0x0, ttl 64, id 10501, offset 0, flags [DF], proto TCP (6), length 52)
    127.0.0.1.44984 > 127.0.0.1.10650: Flags [.], cksum 0xfe28 (incorrect -> 0x2564), seq 1394, ack 25926, win 492, options [nop,nop,TS val 272586608 ecr 272586608], length 0
2022-04-05 20:25:04.105562 IP (tos 0x0, ttl 64, id 64188, offset 0, flags [DF], proto TCP (6), length 1780)
    127.0.0.1.10650 > 127.0.0.1.44984: Flags [P.], cksum 0x04e9 (incorrect -> 0x2c75), seq 25926:27654, ack 1394, win 512, options [nop,nop,TS val 272586608 ecr 272586608], length 1728
2022-04-05 20:25:04.105567 IP (tos 0x0, ttl 64, id 10502, offset 0, flags [DF], proto TCP (6), length 52)
    127.0.0.1.44984 > 127.0.0.1.10650: Flags [.], cksum 0xfe28 (incorrect -> 0x1eab), seq 1394, ack 27654, win 485, options [nop,nop,TS val 272586608 ecr 272586608], length 0
2022-04-05 20:25:04.178416 IP (tos 0x0, ttl 64, id 64189, offset 0, flags [DF], proto TCP (6), length 3538)
    127.0.0.1.10650 > 127.0.0.1.44984: Flags [P.], cksum 0x0bc7 (incorrect -> 0x9258), seq 27654:31140, ack 1394, win 512, options [nop,nop,TS val 272586681 ecr 272586608], length 3486
2022-04-05 20:25:04.178426 IP (tos 0x0, ttl 64, id 10503, offset 0, flags [DF], proto TCP (6), length 52)
    127.0.0.1.44984 > 127.0.0.1.10650: Flags [.], cksum 0xfe28 (incorrect -> 0x1072), seq 1394, ack 31140, win 494, options [nop,nop,TS val 272586681 ecr 272586681], length 0
2022-04-05 20:25:04.199851 IP (tos 0x0, ttl 64, id 64190, offset 0, flags [DF], proto TCP (6), length 3538)
    127.0.0.1.10650 > 127.0.0.1.44984: Flags [P.], cksum 0x0bc7 (incorrect -> 0xd562), seq 31140:34626, ack 1394, win 512, options [nop,nop,TS val 272586702 ecr 272586681], length 3486
2022-04-05 20:25:04.199859 IP (tos 0x0, ttl 64, id 10504, offset 0, flags [DF], proto TCP (6), length 52)
    127.0.0.1.44984 > 127.0.0.1.10650: Flags [.], cksum 0xfe28 (incorrect -> 0x02aa), seq 1394, ack 34626, win 494, options [nop,nop,TS val 272586702 ecr 272586702], length 0
2022-04-05 20:25:04.207016 IP (tos 0x0, ttl 64, id 64191, offset 0, flags [DF], proto TCP (6), length 4036)
    127.0.0.1.10650 > 127.0.0.1.44984: Flags [P.], cksum 0x0db9 (incorrect -> 0x8e3d), seq 34626:38610, ack 1394, win 512, options [nop,nop,TS val 272586709 ecr 272586702], length 3984
2022-04-05 20:25:04.207022 IP (tos 0x0, ttl 64, id 10505, offset 0, flags [DF], proto TCP (6), length 52)
    127.0.0.1.44984 > 127.0.0.1.10650: Flags [.], cksum 0xfe28 (incorrect -> 0xf30d), seq 1394, ack 38610, win 492, options [nop,nop,TS val 272586709 ecr 272586709], length 0
2022-04-05 20:25:04.217952 IP (tos 0x0, ttl 64, id 64192, offset 0, flags [DF], proto TCP (6), length 4036)
    127.0.0.1.10650 > 127.0.0.1.44984: Flags [P.], cksum 0x0db9 (incorrect -> 0xccb5), seq 38610:42594, ack 1394, win 512, options [nop,nop,TS val 272586720 ecr 272586709], length 3984
2022-04-05 20:25:04.217958 IP (tos 0x0, ttl 64, id 10506, offset 0, flags [DF], proto TCP (6), length 52)
    127.0.0.1.44984 > 127.0.0.1.10650: Flags [.], cksum 0xfe28 (incorrect -> 0xe367), seq 1394, ack 42594, win 492, options [nop,nop,TS val 272586720 ecr 272586720], length 0
2022-04-05 20:25:04.224159 IP (tos 0x0, ttl 64, id 64193, offset 0, flags [DF], proto TCP (6), length 1548)
    127.0.0.1.10650 > 127.0.0.1.44984: Flags [P.], cksum 0x0401 (incorrect -> 0x5396), seq 42594:44090, ack 1394, win 512, options [nop,nop,TS val 272586727 ecr 272586720], length 1496
2022-04-05 20:25:04.224521 IP (tos 0x0, ttl 64, id 10507, offset 0, flags [DF], proto TCP (6), length 52)
    127.0.0.1.44984 > 127.0.0.1.10650: Flags [.], cksum 0xfe28 (incorrect -> 0xdd6d), seq 1394, ack 44090, win 512, options [nop,nop,TS val 272586727 ecr 272586727], length 0
2022-04-05 20:25:04.267440 IP (tos 0x0, ttl 64, id 64194, offset 0, flags [DF], proto TCP (6), length 3538)
    127.0.0.1.10650 > 127.0.0.1.44984: Flags [P.], cksum 0x0bc7 (incorrect -> 0x8267), seq 44090:47576, ack 1394, win 512, options [nop,nop,TS val 272586770 ecr 272586727], length 3486
2022-04-05 20:25:04.267471 IP (tos 0x0, ttl 64, id 10508, offset 0, flags [DF], proto TCP (6), length 52)
    127.0.0.1.44984 > 127.0.0.1.10650: Flags [.], cksum 0xfe28 (incorrect -> 0xcf79), seq 1394, ack 47576, win 512, options [nop,nop,TS val 272586770 ecr 272586770], length 0
2022-04-05 20:25:04.283871 IP (tos 0x0, ttl 64, id 64195, offset 0, flags [DF], proto TCP (6), length 3538)
    127.0.0.1.10650 > 127.0.0.1.44984: Flags [P.], cksum 0x0bc7 (incorrect -> 0xd0e4), seq 47576:51062, ack 1394, win 512, options [nop,nop,TS val 272586786 ecr 272586770], length 3486
2022-04-05 20:25:04.326661 IP (tos 0x0, ttl 64, id 10509, offset 0, flags [DF], proto TCP (6), length 52)
    127.0.0.1.44984 > 127.0.0.1.10650: Flags [.], cksum 0xfe28 (incorrect -> 0xc190), seq 1394, ack 51062, win 512, options [nop,nop,TS val 272586829 ecr 272586786], length 0
2022-04-05 20:25:04.326669 IP (tos 0x0, ttl 64, id 64196, offset 0, flags [DF], proto TCP (6), length 9516)
    127.0.0.1.10650 > 127.0.0.1.44984: Flags [P.], cksum 0x2321 (incorrect -> 0x16e7), seq 51062:60526, ack 1394, win 512, options [nop,nop,TS val 272586829 ecr 272586829], length 9464
200, 5.583469390869141, 1.2657349109649658