2022-04-05 08:05:14.913537 IP (tos 0x0, ttl 64, id 53130, offset 0, flags [DF], proto TCP (6), length 60)
    127.0.0.1.57652 > 127.0.0.1.12150: Flags [S], cksum 0xfe30 (incorrect -> 0x4cf0), seq 3037127734, win 65495, options [mss 65495,sackOK,TS val 783559285 ecr 0,nop,wscale 7], length 0
2022-04-05 08:05:14.913552 IP (tos 0x0, ttl 64, id 0, offset 0, flags [DF], proto TCP (6), length 60)
    127.0.0.1.12150 > 127.0.0.1.57652: Flags [S.], cksum 0xfe30 (incorrect -> 0xfebf), seq 245950041, ack 3037127735, win 65483, options [mss 65495,sackOK,TS val 783559285 ecr 783559285,nop,wscale 7], length 0
2022-04-05 08:05:14.913565 IP (tos 0x0, ttl 64, id 53131, offset 0, flags [DF], proto TCP (6), length 52)
    127.0.0.1.57652 > 127.0.0.1.12150: Flags [.], cksum 0xfe28 (incorrect -> 0x257c), seq 1, ack 1, win 512, options [nop,nop,TS val 783559285 ecr 783559285], length 0
2022-04-05 08:05:14.913662 IP (tos 0x0, ttl 64, id 53132, offset 0, flags [DF], proto TCP (6), length 55)
    127.0.0.1.57652 > 127.0.0.1.12150: Flags [P.], cksum 0xfe2b (incorrect -> 0x2070), seq 1:4, ack 1, win 512, options [nop,nop,TS val 783559285 ecr 783559285], length 3
2022-04-05 08:05:14.913668 IP (tos 0x0, ttl 64, id 48850, offset 0, flags [DF], proto TCP (6), length 52)
    127.0.0.1.12150 > 127.0.0.1.57652: Flags [.], cksum 0xfe28 (incorrect -> 0x2579), seq 1, ack 4, win 512, options [nop,nop,TS val 783559285 ecr 783559285], length 0
2022-04-05 08:05:14.913734 IP (tos 0x0, ttl 64, id 48851, offset 0, flags [DF], proto TCP (6), length 54)
    127.0.0.1.12150 > 127.0.0.1.57652: Flags [P.], cksum 0xfe2a (incorrect -> 0x206f), seq 1:3, ack 4, win 512, options [nop,nop,TS val 783559285 ecr 783559285], length 2
2022-04-05 08:05:14.913740 IP (tos 0x0, ttl 64, id 53133, offset 0, flags [DF], proto TCP (6), length 52)
    127.0.0.1.57652 > 127.0.0.1.12150: Flags [.], cksum 0xfe28 (incorrect -> 0x2577), seq 4, ack 3, win 512, options [nop,nop,TS val 783559285 ecr 783559285], length 0
2022-04-05 08:05:14.915073 IP (tos 0x0, ttl 64, id 53134, offset 0, flags [DF], proto TCP (6), length 62)
    127.0.0.1.57652 > 127.0.0.1.12150: Flags [P.], cksum 0xfe32 (incorrect -> 0xd5c7), seq 4:14, ack 3, win 512, options [nop,nop,TS val 783559286 ecr 783559285], length 10
2022-04-05 08:05:14.915082 IP (tos 0x0, ttl 64, id 48852, offset 0, flags [DF], proto TCP (6), length 52)
    127.0.0.1.12150 > 127.0.0.1.57652: Flags [.], cksum 0xfe28 (incorrect -> 0x256b), seq 3, ack 14, win 512, options [nop,nop,TS val 783559286 ecr 783559286], length 0
2022-04-05 08:05:15.005922 IP (tos 0x0, ttl 64, id 48853, offset 0, flags [DF], proto TCP (6), length 62)
    127.0.0.1.12150 > 127.0.0.1.57652: Flags [P.], cksum 0xfe32 (incorrect -> 0x1ffd), seq 3:13, ack 14, win 512, options [nop,nop,TS val 783559377 ecr 783559286], length 10
2022-04-05 08:05:15.005931 IP (tos 0x0, ttl 64, id 53135, offset 0, flags [DF], proto TCP (6), length 52)
    127.0.0.1.57652 > 127.0.0.1.12150: Flags [.], cksum 0xfe28 (incorrect -> 0x24ab), seq 14, ack 13, win 512, options [nop,nop,TS val 783559377 ecr 783559377], length 0
2022-04-05 08:05:15.011527 IP (tos 0x0, ttl 64, id 53136, offset 0, flags [DF], proto TCP (6), length 569)
    127.0.0.1.57652 > 127.0.0.1.12150: Flags [P.], cksum 0x002e (incorrect -> 0x259c), seq 14:531, ack 13, win 512, options [nop,nop,TS val 783559383 ecr 783559377], length 517
2022-04-05 08:05:15.011537 IP (tos 0x0, ttl 64, id 48854, offset 0, flags [DF], proto TCP (6), length 52)
    127.0.0.1.12150 > 127.0.0.1.57652: Flags [.], cksum 0xfe28 (incorrect -> 0x229e), seq 13, ack 531, win 508, options [nop,nop,TS val 783559383 ecr 783559383], length 0
200, 4.864722728729248, 0.6209518909454346