2022-04-05 05:07:02.681604 IP (tos 0x0, ttl 64, id 17160, offset 0, flags [DF], proto TCP (6), length 60)
    127.0.0.1.45416 > 127.0.0.1.12250: Flags [S], cksum 0xfe30 (incorrect -> 0x9563), seq 3388595555, win 65495, options [mss 65495,sackOK,TS val 772867053 ecr 0,nop,wscale 7], length 0
2022-04-05 05:07:02.681615 IP (tos 0x0, ttl 64, id 0, offset 0, flags [DF], proto TCP (6), length 60)
    127.0.0.1.12250 > 127.0.0.1.45416: Flags [S.], cksum 0xfe30 (incorrect -> 0xfa20), seq 1442190153, ack 3388595556, win 65483, options [mss 65495,sackOK,TS val 772867053 ecr 772867053,nop,wscale 7], length 0
2022-04-05 05:07:02.681624 IP (tos 0x0, ttl 64, id 17161, offset 0, flags [DF], proto TCP (6), length 52)
    127.0.0.1.45416 > 127.0.0.1.12250: Flags [.], cksum 0xfe28 (incorrect -> 0x20dd), seq 1, ack 1, win 512, options [nop,nop,TS val 772867053 ecr 772867053], length 0
2022-04-05 05:07:02.681764 IP (tos 0x0, ttl 64, id 17162, offset 0, flags [DF], proto TCP (6), length 55)
    127.0.0.1.45416 > 127.0.0.1.12250: Flags [P.], cksum 0xfe2b (incorrect -> 0x1bd1), seq 1:4, ack 1, win 512, options [nop,nop,TS val 772867053 ecr 772867053], length 3
2022-04-05 05:07:02.681773 IP (tos 0x0, ttl 64, id 44462, offset 0, flags [DF], proto TCP (6), length 52)
    127.0.0.1.12250 > 127.0.0.1.45416: Flags [.], cksum 0xfe28 (incorrect -> 0x20da), seq 1, ack 4, win 512, options [nop,nop,TS val 772867053 ecr 772867053], length 0
2022-04-05 05:07:02.681795 IP (tos 0x0, ttl 64, id 44463, offset 0, flags [DF], proto TCP (6), length 54)
    127.0.0.1.12250 > 127.0.0.1.45416: Flags [P.], cksum 0xfe2a (incorrect -> 0x1bd0), seq 1:3, ack 4, win 512, options [nop,nop,TS val 772867053 ecr 772867053], length 2
2022-04-05 05:07:02.681804 IP (tos 0x0, ttl 64, id 17163, offset 0, flags [DF], proto TCP (6), length 52)
    127.0.0.1.45416 > 127.0.0.1.12250: Flags [.], cksum 0xfe28 (incorrect -> 0x20d8), seq 4, ack 3, win 512, options [nop,nop,TS val 772867053 ecr 772867053], length 0
2022-04-05 05:07:02.683149 IP (tos 0x0, ttl 64, id 17164, offset 0, flags [DF], proto TCP (6), length 62)
    127.0.0.1.45416 > 127.0.0.1.12250: Flags [P.], cksum 0xfe32 (incorrect -> 0x12b9), seq 4:14, ack 3, win 512, options [nop,nop,TS val 772867054 ecr 772867053], length 10
2022-04-05 05:07:02.683165 IP (tos 0x0, ttl 64, id 44464, offset 0, flags [DF], proto TCP (6), length 52)
    127.0.0.1.12250 > 127.0.0.1.45416: Flags [.], cksum 0xfe28 (incorrect -> 0x20cc), seq 3, ack 14, win 512, options [nop,nop,TS val 772867054 ecr 772867054], length 0
2022-04-05 05:07:02.810910 IP (tos 0x0, ttl 64, id 44465, offset 0, flags [DF], proto TCP (6), length 62)
    127.0.0.1.12250 > 127.0.0.1.45416: Flags [P.], cksum 0xfe32 (incorrect -> 0x1b39), seq 3:13, ack 14, win 512, options [nop,nop,TS val 772867182 ecr 772867054], length 10
2022-04-05 05:07:02.810918 IP (tos 0x0, ttl 64, id 17165, offset 0, flags [DF], proto TCP (6), length 52)
    127.0.0.1.45416 > 127.0.0.1.12250: Flags [.], cksum 0xfe28 (incorrect -> 0x1fc2), seq 14, ack 13, win 512, options [nop,nop,TS val 772867182 ecr 772867182], length 0
2022-04-05 05:07:02.816661 IP (tos 0x0, ttl 64, id 17166, offset 0, flags [DF], proto TCP (6), length 569)
    127.0.0.1.45416 > 127.0.0.1.12250: Flags [P.], cksum 0x002e (incorrect -> 0x5ebf), seq 14:531, ack 13, win 512, options [nop,nop,TS val 772867188 ecr 772867182], length 517
2022-04-05 05:07:02.816673 IP (tos 0x0, ttl 64, id 44466, offset 0, flags [DF], proto TCP (6), length 52)
    127.0.0.1.12250 > 127.0.0.1.45416: Flags [.], cksum 0xfe28 (incorrect -> 0x1db5), seq 13, ack 531, win 508, options [nop,nop,TS val 772867188 ecr 772867188], length 0
200, 3.8253185749053955, 0.6929945945739746