2022-04-05 09:10:51.399531 IP (tos 0x0, ttl 64, id 51791, offset 0, flags [DF], proto TCP (6), length 60)
    127.0.0.1.37212 > 127.0.0.1.9450: Flags [S], cksum 0xfe30 (incorrect -> 0x6d62), seq 1879134732, win 65495, options [mss 65495,sackOK,TS val 787495771 ecr 0,nop,wscale 7], length 0
2022-04-05 09:10:51.399544 IP (tos 0x0, ttl 64, id 0, offset 0, flags [DF], proto TCP (6), length 60)
    127.0.0.1.9450 > 127.0.0.1.37212: Flags [S.], cksum 0xfe30 (incorrect -> 0x57f5), seq 2957376214, ack 1879134733, win 65483, options [mss 65495,sackOK,TS val 787495771 ecr 787495771,nop,wscale 7], length 0
2022-04-05 09:10:51.399554 IP (tos 0x0, ttl 64, id 51792, offset 0, flags [DF], proto TCP (6), length 52)
    127.0.0.1.37212 > 127.0.0.1.9450: Flags [.], cksum 0xfe28 (incorrect -> 0x7eb1), seq 1, ack 1, win 512, options [nop,nop,TS val 787495771 ecr 787495771], length 0
2022-04-05 09:10:51.399669 IP (tos 0x0, ttl 64, id 51793, offset 0, flags [DF], proto TCP (6), length 55)
    127.0.0.1.37212 > 127.0.0.1.9450: Flags [P.], cksum 0xfe2b (incorrect -> 0x79a5), seq 1:4, ack 1, win 512, options [nop,nop,TS val 787495771 ecr 787495771], length 3
2022-04-05 09:10:51.399683 IP (tos 0x0, ttl 64, id 58847, offset 0, flags [DF], proto TCP (6), length 52)
    127.0.0.1.9450 > 127.0.0.1.37212: Flags [.], cksum 0xfe28 (incorrect -> 0x7eae), seq 1, ack 4, win 512, options [nop,nop,TS val 787495771 ecr 787495771], length 0
2022-04-05 09:10:51.399755 IP (tos 0x0, ttl 64, id 58848, offset 0, flags [DF], proto TCP (6), length 54)
    127.0.0.1.9450 > 127.0.0.1.37212: Flags [P.], cksum 0xfe2a (incorrect -> 0x79a4), seq 1:3, ack 4, win 512, options [nop,nop,TS val 787495771 ecr 787495771], length 2
2022-04-05 09:10:51.399774 IP (tos 0x0, ttl 64, id 51794, offset 0, flags [DF], proto TCP (6), length 52)
    127.0.0.1.37212 > 127.0.0.1.9450: Flags [.], cksum 0xfe28 (incorrect -> 0x7eac), seq 4, ack 3, win 512, options [nop,nop,TS val 787495771 ecr 787495771], length 0
2022-04-05 09:10:51.401833 IP (tos 0x0, ttl 64, id 51795, offset 0, flags [DF], proto TCP (6), length 62)
    127.0.0.1.37212 > 127.0.0.1.9450: Flags [P.], cksum 0xfe32 (incorrect -> 0xdf6b), seq 4:14, ack 3, win 512, options [nop,nop,TS val 787495773 ecr 787495771], length 10
2022-04-05 09:10:51.401844 IP (tos 0x0, ttl 64, id 58849, offset 0, flags [DF], proto TCP (6), length 52)
    127.0.0.1.9450 > 127.0.0.1.37212: Flags [.], cksum 0xfe28 (incorrect -> 0x7e9e), seq 3, ack 14, win 512, options [nop,nop,TS val 787495773 ecr 787495773], length 0
2022-04-05 09:10:51.563319 IP (tos 0x0, ttl 64, id 58850, offset 0, flags [DF], proto TCP (6), length 62)
    127.0.0.1.9450 > 127.0.0.1.37212: Flags [P.], cksum 0xfe32 (incorrect -> 0x78ea), seq 3:13, ack 14, win 512, options [nop,nop,TS val 787495934 ecr 787495773], length 10
2022-04-05 09:10:51.563337 IP (tos 0x0, ttl 64, id 51796, offset 0, flags [DF], proto TCP (6), length 52)
    127.0.0.1.37212 > 127.0.0.1.9450: Flags [.], cksum 0xfe28 (incorrect -> 0x7d52), seq 14, ack 13, win 512, options [nop,nop,TS val 787495934 ecr 787495934], length 0
2022-04-05 09:10:51.569659 IP (tos 0x0, ttl 64, id 51797, offset 0, flags [DF], proto TCP (6), length 569)
    127.0.0.1.37212 > 127.0.0.1.9450: Flags [P.], cksum 0x002e (incorrect -> 0x7cb0), seq 14:531, ack 13, win 512, options [nop,nop,TS val 787495941 ecr 787495934], length 517
2022-04-05 09:10:51.569672 IP (tos 0x0, ttl 64, id 58851, offset 0, flags [DF], proto TCP (6), length 52)
    127.0.0.1.9450 > 127.0.0.1.37212: Flags [.], cksum 0xfe28 (incorrect -> 0x7b43), seq 13, ack 531, win 508, options [nop,nop,TS val 787495941 ecr 787495941], length 0
200, 4.700803995132446, 0.8312695026397705