2022-04-05 01:13:09.114616 IP (tos 0x0, ttl 64, id 25131, offset 0, flags [DF], proto TCP (6), length 60)
    127.0.0.1.34968 > 127.0.0.1.12050: Flags [S], cksum 0xfe30 (incorrect -> 0x4056), seq 1891948723, win 65495, options [mss 65495,sackOK,TS val 758833486 ecr 0,nop,wscale 7], length 0
2022-04-05 01:13:09.114627 IP (tos 0x0, ttl 64, id 0, offset 0, flags [DF], proto TCP (6), length 60)
    127.0.0.1.12050 > 127.0.0.1.34968: Flags [S.], cksum 0xfe30 (incorrect -> 0xf1d6), seq 2193210679, ack 1891948724, win 65483, options [mss 65495,sackOK,TS val 758833486 ecr 758833486,nop,wscale 7], length 0
2022-04-05 01:13:09.114636 IP (tos 0x0, ttl 64, id 25132, offset 0, flags [DF], proto TCP (6), length 52)
    127.0.0.1.34968 > 127.0.0.1.12050: Flags [.], cksum 0xfe28 (incorrect -> 0x1893), seq 1, ack 1, win 512, options [nop,nop,TS val 758833486 ecr 758833486], length 0
2022-04-05 01:13:09.114728 IP (tos 0x0, ttl 64, id 25133, offset 0, flags [DF], proto TCP (6), length 55)
    127.0.0.1.34968 > 127.0.0.1.12050: Flags [P.], cksum 0xfe2b (incorrect -> 0x1387), seq 1:4, ack 1, win 512, options [nop,nop,TS val 758833486 ecr 758833486], length 3
2022-04-05 01:13:09.114732 IP (tos 0x0, ttl 64, id 9395, offset 0, flags [DF], proto TCP (6), length 52)
    127.0.0.1.12050 > 127.0.0.1.34968: Flags [.], cksum 0xfe28 (incorrect -> 0x1890), seq 1, ack 4, win 512, options [nop,nop,TS val 758833486 ecr 758833486], length 0
2022-04-05 01:13:09.114801 IP (tos 0x0, ttl 64, id 9396, offset 0, flags [DF], proto TCP (6), length 54)
    127.0.0.1.12050 > 127.0.0.1.34968: Flags [P.], cksum 0xfe2a (incorrect -> 0x1386), seq 1:3, ack 4, win 512, options [nop,nop,TS val 758833486 ecr 758833486], length 2
2022-04-05 01:13:09.114805 IP (tos 0x0, ttl 64, id 25134, offset 0, flags [DF], proto TCP (6), length 52)
    127.0.0.1.34968 > 127.0.0.1.12050: Flags [.], cksum 0xfe28 (incorrect -> 0x188e), seq 4, ack 3, win 512, options [nop,nop,TS val 758833486 ecr 758833486], length 0
2022-04-05 01:13:09.135029 IP (tos 0x0, ttl 64, id 25135, offset 0, flags [DF], proto TCP (6), length 62)
    127.0.0.1.34968 > 127.0.0.1.12050: Flags [P.], cksum 0xfe32 (incorrect -> 0x64a2), seq 4:14, ack 3, win 512, options [nop,nop,TS val 758833506 ecr 758833486], length 10
2022-04-05 01:13:09.135053 IP (tos 0x0, ttl 64, id 9397, offset 0, flags [DF], proto TCP (6), length 52)
    127.0.0.1.12050 > 127.0.0.1.34968: Flags [.], cksum 0xfe28 (incorrect -> 0x185c), seq 3, ack 14, win 512, options [nop,nop,TS val 758833506 ecr 758833506], length 0
2022-04-05 01:13:09.273070 IP (tos 0x0, ttl 64, id 9398, offset 0, flags [DF], proto TCP (6), length 62)
    127.0.0.1.12050 > 127.0.0.1.34968: Flags [P.], cksum 0xfe32 (incorrect -> 0x12bf), seq 3:13, ack 14, win 512, options [nop,nop,TS val 758833644 ecr 758833506], length 10
2022-04-05 01:13:09.273080 IP (tos 0x0, ttl 64, id 25136, offset 0, flags [DF], proto TCP (6), length 52)
    127.0.0.1.34968 > 127.0.0.1.12050: Flags [.], cksum 0xfe28 (incorrect -> 0x173e), seq 14, ack 13, win 512, options [nop,nop,TS val 758833644 ecr 758833644], length 0
200, 13.790430068969727, 0.8864116668701172