2022-04-05 22:54:55.806568 IP (tos 0x0, ttl 64, id 14860, offset 0, flags [DF], proto TCP (6), length 60)
    127.0.0.1.58336 > 127.0.0.1.10450: Flags [S], cksum 0xfe30 (incorrect -> 0x8087), seq 486410684, win 65495, options [mss 65495,sackOK,TS val 281578309 ecr 0,nop,wscale 7], length 0
2022-04-05 22:54:55.806580 IP (tos 0x0, ttl 64, id 0, offset 0, flags [DF], proto TCP (6), length 60)
    127.0.0.1.10450 > 127.0.0.1.58336: Flags [S.], cksum 0xfe30 (incorrect -> 0x77f0), seq 4048059195, ack 486410685, win 65483, options [mss 65495,sackOK,TS val 281578309 ecr 281578309,nop,wscale 7], length 0
2022-04-05 22:54:55.806590 IP (tos 0x0, ttl 64, id 14861, offset 0, flags [DF], proto TCP (6), length 52)
    127.0.0.1.58336 > 127.0.0.1.10450: Flags [.], cksum 0xfe28 (incorrect -> 0x9eac), seq 1, ack 1, win 512, options [nop,nop,TS val 281578309 ecr 281578309], length 0
2022-04-05 22:54:55.806727 IP (tos 0x0, ttl 64, id 14862, offset 0, flags [DF], proto TCP (6), length 55)
    127.0.0.1.58336 > 127.0.0.1.10450: Flags [P.], cksum 0xfe2b (incorrect -> 0x99a0), seq 1:4, ack 1, win 512, options [nop,nop,TS val 281578309 ecr 281578309], length 3
2022-04-05 22:54:55.806741 IP (tos 0x0, ttl 64, id 49250, offset 0, flags [DF], proto TCP (6), length 52)
    127.0.0.1.10450 > 127.0.0.1.58336: Flags [.], cksum 0xfe28 (incorrect -> 0x9ea9), seq 1, ack 4, win 512, options [nop,nop,TS val 281578309 ecr 281578309], length 0
2022-04-05 22:54:55.806796 IP (tos 0x0, ttl 64, id 49251, offset 0, flags [DF], proto TCP (6), length 54)
    127.0.0.1.10450 > 127.0.0.1.58336: Flags [P.], cksum 0xfe2a (incorrect -> 0x999f), seq 1:3, ack 4, win 512, options [nop,nop,TS val 281578309 ecr 281578309], length 2
2022-04-05 22:54:55.806812 IP (tos 0x0, ttl 64, id 14863, offset 0, flags [DF], proto TCP (6), length 52)
    127.0.0.1.58336 > 127.0.0.1.10450: Flags [.], cksum 0xfe28 (incorrect -> 0x9ea7), seq 4, ack 3, win 512, options [nop,nop,TS val 281578309 ecr 281578309], length 0
2022-04-05 22:54:55.808332 IP (tos 0x0, ttl 64, id 14864, offset 0, flags [DF], proto TCP (6), length 62)
    127.0.0.1.58336 > 127.0.0.1.10450: Flags [P.], cksum 0xfe32 (incorrect -> 0x69e7), seq 4:14, ack 3, win 512, options [nop,nop,TS val 281578311 ecr 281578309], length 10
2022-04-05 22:54:55.808349 IP (tos 0x0, ttl 64, id 49252, offset 0, flags [DF], proto TCP (6), length 52)
    127.0.0.1.10450 > 127.0.0.1.58336: Flags [.], cksum 0xfe28 (incorrect -> 0x9e99), seq 3, ack 14, win 512, options [nop,nop,TS val 281578311 ecr 281578311], length 0
2022-04-05 22:54:56.082751 IP (tos 0x0, ttl 64, id 49253, offset 0, flags [DF], proto TCP (6), length 62)
    127.0.0.1.10450 > 127.0.0.1.58336: Flags [P.], cksum 0xfe32 (incorrect -> 0x9874), seq 3:13, ack 14, win 512, options [nop,nop,TS val 281578585 ecr 281578311], length 10
2022-04-05 22:54:56.082766 IP (tos 0x0, ttl 64, id 14865, offset 0, flags [DF], proto TCP (6), length 52)
    127.0.0.1.58336 > 127.0.0.1.10450: Flags [.], cksum 0xfe28 (incorrect -> 0x9c6b), seq 14, ack 13, win 512, options [nop,nop,TS val 281578585 ecr 281578585], length 0
2022-04-05 22:54:56.088851 IP (tos 0x0, ttl 64, id 14866, offset 0, flags [DF], proto TCP (6), length 569)
    127.0.0.1.58336 > 127.0.0.1.10450: Flags [P.], cksum 0x002e (incorrect -> 0x7800), seq 14:531, ack 13, win 512, options [nop,nop,TS val 281578591 ecr 281578585], length 517
2022-04-05 22:54:56.088861 IP (tos 0x0, ttl 64, id 49254, offset 0, flags [DF], proto TCP (6), length 52)
    127.0.0.1.10450 > 127.0.0.1.58336: Flags [.], cksum 0xfe28 (incorrect -> 0x9a5e), seq 13, ack 531, win 508, options [nop,nop,TS val 281578591 ecr 281578591], length 0
2022-04-05 22:54:56.378405 IP (tos 0x0, ttl 64, id 49255, offset 0, flags [DF], proto TCP (6), length 3538)
    127.0.0.1.10450 > 127.0.0.1.58336: Flags [P.], cksum 0x0bc7 (incorrect -> 0xac81), seq 13:3499, ack 531, win 512, options [nop,nop,TS val 281578881 ecr 281578591], length 3486
2022-04-05 22:54:56.378418 IP (tos 0x0, ttl 64, id 14867, offset 0, flags [DF], proto TCP (6), length 52)
    127.0.0.1.58336 > 127.0.0.1.10450: Flags [.], cksum 0xfe28 (incorrect -> 0x8a8a), seq 531, ack 3499, win 494, options [nop,nop,TS val 281578881 ecr 281578881], length 0
2022-04-05 22:54:56.481884 IP (tos 0x0, ttl 64, id 49256, offset 0, flags [DF], proto TCP (6), length 1334)
    127.0.0.1.10450 > 127.0.0.1.58336: Flags [P.], cksum 0x032b (incorrect -> 0x5350), seq 3499:4781, ack 531, win 512, options [nop,nop,TS val 281578984 ecr 281578881], length 1282
2022-04-05 22:54:56.481892 IP (tos 0x0, ttl 64, id 14868, offset 0, flags [DF], proto TCP (6), length 52)
    127.0.0.1.58336 > 127.0.0.1.10450: Flags [.], cksum 0xfe28 (incorrect -> 0x84b2), seq 531, ack 4781, win 502, options [nop,nop,TS val 281578984 ecr 281578984], length 0
2022-04-05 22:54:56.482370 IP (tos 0x0, ttl 64, id 14869, offset 0, flags [DF], proto TCP (6), length 116)
    127.0.0.1.58336 > 127.0.0.1.10450: Flags [P.], cksum 0xfe68 (incorrect -> 0x55c3), seq 531:595, ack 4781, win 512, options [nop,nop,TS val 281578985 ecr 281578984], length 64
2022-04-05 22:54:56.482378 IP (tos 0x0, ttl 64, id 49257, offset 0, flags [DF], proto TCP (6), length 52)
    127.0.0.1.10450 > 127.0.0.1.58336: Flags [.], cksum 0xfe28 (incorrect -> 0x8466), seq 4781, ack 595, win 512, options [nop,nop,TS val 281578985 ecr 281578985], length 0
2022-04-05 22:54:56.482805 IP (tos 0x0, ttl 64, id 14870, offset 0, flags [DF], proto TCP (6), length 329)
    127.0.0.1.58336 > 127.0.0.1.10450: Flags [P.], cksum 0xff3d (incorrect -> 0x6e4f), seq 595:872, ack 4781, win 512, options [nop,nop,TS val 281578985 ecr 281578985], length 277
2022-04-05 22:54:56.482815 IP (tos 0x0, ttl 64, id 49258, offset 0, flags [DF], proto TCP (6), length 52)
    127.0.0.1.10450 > 127.0.0.1.58336: Flags [.], cksum 0xfe28 (incorrect -> 0x8353), seq 4781, ack 872, win 510, options [nop,nop,TS val 281578985 ecr 281578985], length 0
2022-04-05 22:54:56.873327 IP (tos 0x0, ttl 64, id 49259, offset 0, flags [DF], proto TCP (6), length 3538)
    127.0.0.1.10450 > 127.0.0.1.58336: Flags [P.], cksum 0x0bc7 (incorrect -> 0x28fc), seq 4781:8267, ack 872, win 512, options [nop,nop,TS val 281579376 ecr 281578985], length 3486
2022-04-05 22:54:56.873336 IP (tos 0x0, ttl 64, id 14871, offset 0, flags [DF], proto TCP (6), length 52)
    127.0.0.1.58336 > 127.0.0.1.10450: Flags [.], cksum 0xfe28 (incorrect -> 0x72b7), seq 872, ack 8267, win 494, options [nop,nop,TS val 281579376 ecr 281579376], length 0
2022-04-05 22:54:56.892920 IP (tos 0x0, ttl 64, id 49260, offset 0, flags [DF], proto TCP (6), length 4036)
    127.0.0.1.10450 > 127.0.0.1.58336: Flags [P.], cksum 0x0db9 (incorrect -> 0xddf4), seq 8267:12251, ack 872, win 512, options [nop,nop,TS val 281579395 ecr 281579376], length 3984
2022-04-05 22:54:56.892927 IP (tos 0x0, ttl 64, id 14872, offset 0, flags [DF], proto TCP (6), length 52)
    127.0.0.1.58336 > 127.0.0.1.10450: Flags [.], cksum 0xfe28 (incorrect -> 0x6303), seq 872, ack 12251, win 492, options [nop,nop,TS val 281579395 ecr 281579395], length 0
2022-04-05 22:54:56.917643 IP (tos 0x0, ttl 64, id 49261, offset 0, flags [DF], proto TCP (6), length 4036)
    127.0.0.1.10450 > 127.0.0.1.58336: Flags [P.], cksum 0x0db9 (incorrect -> 0x3b5c), seq 12251:16235, ack 872, win 512, options [nop,nop,TS val 281579420 ecr 281579395], length 3984
2022-04-05 22:54:56.917654 IP (tos 0x0, ttl 64, id 14873, offset 0, flags [DF], proto TCP (6), length 52)
    127.0.0.1.58336 > 127.0.0.1.10450: Flags [.], cksum 0xfe28 (incorrect -> 0x5341), seq 872, ack 16235, win 492, options [nop,nop,TS val 281579420 ecr 281579420], length 0
2022-04-05 22:54:56.970001 IP (tos 0x0, ttl 64, id 49262, offset 0, flags [DF], proto TCP (6), length 4100)
    127.0.0.1.10450 > 127.0.0.1.58336: Flags [P.], cksum 0x0df9 (incorrect -> 0x5a65), seq 16235:20283, ack 872, win 512, options [nop,nop,TS val 281579472 ecr 281579420], length 4048
2022-04-05 22:54:56.970009 IP (tos 0x0, ttl 64, id 14874, offset 0, flags [DF], proto TCP (6), length 52)
    127.0.0.1.58336 > 127.0.0.1.10450: Flags [.], cksum 0xfe28 (incorrect -> 0x4309), seq 872, ack 20283, win 492, options [nop,nop,TS val 281579472 ecr 281579472], length 0
2022-04-05 22:54:56.970018 IP (tos 0x0, ttl 64, id 49263, offset 0, flags [DF], proto TCP (6), length 3420)
    127.0.0.1.10450 > 127.0.0.1.58336: Flags [P.], cksum 0x0b51 (incorrect -> 0x2211), seq 20283:23651, ack 872, win 512, options [nop,nop,TS val 281579472 ecr 281579472], length 3368
2022-04-05 22:54:56.970023 IP (tos 0x0, ttl 64, id 14875, offset 0, flags [DF], proto TCP (6), length 52)
    127.0.0.1.58336 > 127.0.0.1.10450: Flags [.], cksum 0xfe28 (incorrect -> 0x35ee), seq 872, ack 23651, win 479, options [nop,nop,TS val 281579472 ecr 281579472], length 0
2022-04-05 22:54:56.981986 IP (tos 0x0, ttl 64, id 49264, offset 0, flags [DF], proto TCP (6), length 1549)
    127.0.0.1.10450 > 127.0.0.1.58336: Flags [P.], cksum 0x0402 (incorrect -> 0x2333), seq 23651:25148, ack 872, win 512, options [nop,nop,TS val 281579484 ecr 281579472], length 1497
2022-04-05 22:54:56.981995 IP (tos 0x0, ttl 64, id 14876, offset 0, flags [DF], proto TCP (6), length 52)
    127.0.0.1.58336 > 127.0.0.1.10450: Flags [.], cksum 0xfe28 (incorrect -> 0x2fe6), seq 872, ack 25148, win 502, options [nop,nop,TS val 281579484 ecr 281579484], length 0
2022-04-05 22:54:57.001206 IP (tos 0x0, ttl 64, id 49265, offset 0, flags [DF], proto TCP (6), length 4036)
    127.0.0.1.10450 > 127.0.0.1.58336: Flags [P.], cksum 0x0db9 (incorrect -> 0x88ca), seq 25148:29132, ack 872, win 512, options [nop,nop,TS val 281579504 ecr 281579484], length 3984
2022-04-05 22:54:57.001213 IP (tos 0x0, ttl 64, id 14877, offset 0, flags [DF], proto TCP (6), length 52)
    127.0.0.1.58336 > 127.0.0.1.10450: Flags [.], cksum 0xfe28 (incorrect -> 0x2038), seq 872, ack 29132, win 492, options [nop,nop,TS val 281579504 ecr 281579504], length 0
2022-04-05 22:54:57.010682 IP (tos 0x0, ttl 64, id 49266, offset 0, flags [DF], proto TCP (6), length 4036)
    127.0.0.1.10450 > 127.0.0.1.58336: Flags [P.], cksum 0x0db9 (incorrect -> 0x420d), seq 29132:33116, ack 872, win 512, options [nop,nop,TS val 281579513 ecr 281579504], length 3984
2022-04-05 22:54:57.010689 IP (tos 0x0, ttl 64, id 14878, offset 0, flags [DF], proto TCP (6), length 52)
    127.0.0.1.58336 > 127.0.0.1.10450: Flags [.], cksum 0xfe28 (incorrect -> 0x1096), seq 872, ack 33116, win 492, options [nop,nop,TS val 281579513 ecr 281579513], length 0
2022-04-05 22:54:57.018813 IP (tos 0x0, ttl 64, id 49267, offset 0, flags [DF], proto TCP (6), length 4036)
    127.0.0.1.10450 > 127.0.0.1.58336: Flags [P.], cksum 0x0db9 (incorrect -> 0x8500), seq 33116:37100, ack 872, win 512, options [nop,nop,TS val 281579521 ecr 281579513], length 3984
2022-04-05 22:54:57.018820 IP (tos 0x0, ttl 64, id 14879, offset 0, flags [DF], proto TCP (6), length 52)
    127.0.0.1.58336 > 127.0.0.1.10450: Flags [.], cksum 0xfe28 (incorrect -> 0x00f6), seq 872, ack 37100, win 492, options [nop,nop,TS val 281579521 ecr 281579521], length 0
2022-04-05 22:54:57.020406 IP (tos 0x0, ttl 64, id 49268, offset 0, flags [DF], proto TCP (6), length 550)
    127.0.0.1.10450 > 127.0.0.1.58336: Flags [P.], cksum 0x001b (incorrect -> 0xb52e), seq 37100:37598, ack 872, win 512, options [nop,nop,TS val 281579523 ecr 281579521], length 498
2022-04-05 22:54:57.020412 IP (tos 0x0, ttl 64, id 14880, offset 0, flags [DF], proto TCP (6), length 52)
    127.0.0.1.58336 > 127.0.0.1.10450: Flags [.], cksum 0xfe28 (incorrect -> 0xfef1), seq 872, ack 37598, win 506, options [nop,nop,TS val 281579523 ecr 281579523], length 0
2022-04-05 22:54:57.035478 IP (tos 0x0, ttl 64, id 49269, offset 0, flags [DF], proto TCP (6), length 3538)
    127.0.0.1.10450 > 127.0.0.1.58336: Flags [P.], cksum 0x0bc7 (incorrect -> 0xed6b), seq 37598:41084, ack 872, win 512, options [nop,nop,TS val 281579538 ecr 281579523], length 3486
2022-04-05 22:54:57.035493 IP (tos 0x0, ttl 64, id 14881, offset 0, flags [DF], proto TCP (6), length 52)
    127.0.0.1.58336 > 127.0.0.1.10450: Flags [.], cksum 0xfe28 (incorrect -> 0xf12f), seq 872, ack 41084, win 512, options [nop,nop,TS val 281579538 ecr 281579538], length 0
2022-04-05 22:54:57.039944 IP (tos 0x0, ttl 64, id 49270, offset 0, flags [DF], proto TCP (6), length 1946)
    127.0.0.1.10450 > 127.0.0.1.58336: Flags [P.], cksum 0x058f (incorrect -> 0xcb34), seq 41084:42978, ack 872, win 512, options [nop,nop,TS val 281579542 ecr 281579538], length 1894
2022-04-05 22:54:57.040174 IP (tos 0x0, ttl 64, id 14882, offset 0, flags [DF], proto TCP (6), length 52)
    127.0.0.1.58336 > 127.0.0.1.10450: Flags [.], cksum 0xfe28 (incorrect -> 0xe9c0), seq 872, ack 42978, win 512, options [nop,nop,TS val 281579543 ecr 281579542], length 0
2022-04-05 22:54:57.069528 IP (tos 0x0, ttl 64, id 49271, offset 0, flags [DF], proto TCP (6), length 3538)
    127.0.0.1.10450 > 127.0.0.1.58336: Flags [P.], cksum 0x0bc7 (incorrect -> 0x64a7), seq 42978:46464, ack 872, win 512, options [nop,nop,TS val 281579572 ecr 281579543], length 3486
2022-04-05 22:54:57.069601 IP (tos 0x0, ttl 64, id 14883, offset 0, flags [DF], proto TCP (6), length 52)
    127.0.0.1.58336 > 127.0.0.1.10450: Flags [.], cksum 0xfe28 (incorrect -> 0xdbe7), seq 872, ack 46464, win 512, options [nop,nop,TS val 281579572 ecr 281579572], length 0
2022-04-05 22:54:57.069629 IP (tos 0x0, ttl 64, id 49272, offset 0, flags [DF], proto TCP (6), length 4100)
    127.0.0.1.10450 > 127.0.0.1.58336: Flags [P.], cksum 0x0df9 (incorrect -> 0xf821), seq 46464:50512, ack 872, win 512, options [nop,nop,TS val 281579572 ecr 281579572], length 4048
2022-04-05 22:54:57.110667 IP (tos 0x0, ttl 64, id 14884, offset 0, flags [DF], proto TCP (6), length 52)
    127.0.0.1.58336 > 127.0.0.1.10450: Flags [.], cksum 0xfe28 (incorrect -> 0xcbee), seq 872, ack 50512, win 512, options [nop,nop,TS val 281579613 ecr 281579572], length 0
2022-04-05 22:54:57.110686 IP (tos 0x0, ttl 64, id 49273, offset 0, flags [DF], proto TCP (6), length 21158)
    127.0.0.1.10450 > 127.0.0.1.58336: Flags [P.], cksum 0x509b (incorrect -> 0x8b59), seq 50512:71618, ack 872, win 512, options [nop,nop,TS val 281579613 ecr 281579613], length 21106
2022-04-05 22:54:57.154661 IP (tos 0x0, ttl 64, id 14885, offset 0, flags [DF], proto TCP (6), length 52)
    127.0.0.1.58336 > 127.0.0.1.10450: Flags [.], cksum 0xfe28 (incorrect -> 0x7927), seq 872, ack 71618, win 512, options [nop,nop,TS val 281579657 ecr 281579613], length 0
2022-04-05 22:54:57.154682 IP (tos 0x0, ttl 64, id 49274, offset 0, flags [DF], proto TCP (6), length 20968)
    127.0.0.1.10450 > 127.0.0.1.58336: Flags [P.], cksum 0x4fdd (incorrect -> 0x3d55), seq 71618:92534, ack 872, win 512, options [nop,nop,TS val 281579657 ecr 281579657], length 20916
2022-04-05 22:54:57.155066 IP (tos 0x0, ttl 64, id 14886, offset 0, flags [DF], proto TCP (6), length 52)
    127.0.0.1.58336 > 127.0.0.1.10450: Flags [.], cksum 0xfe28 (incorrect -> 0x2746), seq 872, ack 92534, win 512, options [nop,nop,TS val 281579658 ecr 281579657], length 0
2022-04-05 22:54:57.164827 IP (tos 0x0, ttl 64, id 49275, offset 0, flags [DF], proto TCP (6), length 4100)
    127.0.0.1.10450 > 127.0.0.1.58336: Flags [P.], cksum 0x0df9 (incorrect -> 0x9e2e), seq 92534:96582, ack 872, win 512, options [nop,nop,TS val 281579667 ecr 281579658], length 4048
2022-04-05 22:54:57.165077 IP (tos 0x0, ttl 64, id 14887, offset 0, flags [DF], proto TCP (6), length 52)
    127.0.0.1.58336 > 127.0.0.1.10450: Flags [.], cksum 0xfe28 (incorrect -> 0x1762), seq 872, ack 96582, win 512, options [nop,nop,TS val 281579668 ecr 281579667], length 0
2022-04-05 22:54:57.165089 IP (tos 0x0, ttl 64, id 49276, offset 0, flags [DF], proto TCP (6), length 3474)
    127.0.0.1.10450 > 127.0.0.1.58336: Flags [P.], cksum 0x0b87 (incorrect -> 0x7f55), seq 96582:100004, ack 872, win 512, options [nop,nop,TS val 281579668 ecr 281579668], length 3422
2022-04-05 22:54:57.165094 IP (tos 0x0, ttl 64, id 14888, offset 0, flags [DF], proto TCP (6), length 52)
    127.0.0.1.58336 > 127.0.0.1.10450: Flags [.], cksum 0xfe28 (incorrect -> 0x0a03), seq 872, ack 100004, win 512, options [nop,nop,TS val 281579668 ecr 281579668], length 0
2022-04-05 22:54:57.170427 IP (tos 0x0, ttl 64, id 49277, offset 0, flags [DF], proto TCP (6), length 4064)
    127.0.0.1.10450 > 127.0.0.1.58336: Flags [P.], cksum 0x0dd5 (incorrect -> 0x79cd), seq 100004:104016, ack 872, win 512, options [nop,nop,TS val 281579673 ecr 281579668], length 4012
2022-04-05 22:54:57.170468 IP (tos 0x0, ttl 64, id 14889, offset 0, flags [DF], proto TCP (6), length 52)
    127.0.0.1.58336 > 127.0.0.1.10450: Flags [.], cksum 0xfe28 (incorrect -> 0xfa4c), seq 872, ack 104016, win 512, options [nop,nop,TS val 281579673 ecr 281579673], length 0
2022-04-05 22:54:57.170487 IP (tos 0x0, ttl 64, id 49278, offset 0, flags [DF], proto TCP (6), length 3538)
    127.0.0.1.10450 > 127.0.0.1.58336: Flags [P.], cksum 0x0bc7 (incorrect -> 0xb6de), seq 104016:107502, ack 872, win 512, options [nop,nop,TS val 281579673 ecr 281579673], length 3486
2022-04-05 22:54:57.170691 IP (tos 0x0, ttl 64, id 14890, offset 0, flags [DF], proto TCP (6), length 52)
    127.0.0.1.58336 > 127.0.0.1.10450: Flags [.], cksum 0xfe28 (incorrect -> 0xecae), seq 872, ack 107502, win 512, options [nop,nop,TS val 281579673 ecr 281579673], length 0
2022-04-05 22:54:57.175603 IP (tos 0x0, ttl 64, id 49279, offset 0, flags [DF], proto TCP (6), length 4036)
    127.0.0.1.10450 > 127.0.0.1.58336: Flags [P.], cksum 0x0db9 (incorrect -> 0xdf6b), seq 107502:111486, ack 872, win 512, options [nop,nop,TS val 281579678 ecr 281579673], length 3984
2022-04-05 22:54:57.175648 IP (tos 0x0, ttl 64, id 14891, offset 0, flags [DF], proto TCP (6), length 52)
    127.0.0.1.58336 > 127.0.0.1.10450: Flags [.], cksum 0xfe28 (incorrect -> 0xdd14), seq 872, ack 111486, win 512, options [nop,nop,TS val 281579678 ecr 281579678], length 0
2022-04-05 22:54:57.183346 IP (tos 0x0, ttl 64, id 49280, offset 0, flags [DF], proto TCP (6), length 4100)
    127.0.0.1.10450 > 127.0.0.1.58336: Flags [P.], cksum 0x0df9 (incorrect -> 0x8c3f), seq 111486:115534, ack 872, win 512, options [nop,nop,TS val 281579686 ecr 281579678], length 4048
2022-04-05 22:54:57.183388 IP (tos 0x0, ttl 64, id 14892, offset 0, flags [DF], proto TCP (6), length 52)
    127.0.0.1.58336 > 127.0.0.1.10450: Flags [.], cksum 0xfe28 (incorrect -> 0xcd34), seq 872, ack 115534, win 512, options [nop,nop,TS val 281579686 ecr 281579686], length 0
2022-04-05 22:54:57.183397 IP (tos 0x0, ttl 64, id 49281, offset 0, flags [DF], proto TCP (6), length 984)
    127.0.0.1.10450 > 127.0.0.1.58336: Flags [P.], cksum 0x01cd (incorrect -> 0x805a), seq 115534:116466, ack 872, win 512, options [nop,nop,TS val 281579686 ecr 281579686], length 932
2022-04-05 22:54:57.183402 IP (tos 0x0, ttl 64, id 14893, offset 0, flags [DF], proto TCP (6), length 52)
    127.0.0.1.58336 > 127.0.0.1.10450: Flags [.], cksum 0xfe28 (incorrect -> 0xc990), seq 872, ack 116466, win 512, options [nop,nop,TS val 281579686 ecr 281579686], length 0
2022-04-05 22:54:57.183989 IP (tos 0x0, ttl 64, id 49282, offset 0, flags [DF], proto TCP (6), length 4036)
    127.0.0.1.10450 > 127.0.0.1.58336: Flags [P.], cksum 0x0db9 (incorrect -> 0x5526), seq 116466:120450, ack 872, win 512, options [nop,nop,TS val 281579686 ecr 281579686], length 3984
2022-04-05 22:54:57.184024 IP (tos 0x0, ttl 64, id 14894, offset 0, flags [DF], proto TCP (6), length 52)
    127.0.0.1.58336 > 127.0.0.1.10450: Flags [.], cksum 0xfe28 (incorrect -> 0xba00), seq 872, ack 120450, win 512, options [nop,nop,TS val 281579686 ecr 281579686], length 0
2022-04-05 22:54:57.195800 IP (tos 0x0, ttl 64, id 49283, offset 0, flags [DF], proto TCP (6), length 3538)
    127.0.0.1.10450 > 127.0.0.1.58336: Flags [P.], cksum 0x0bc7 (incorrect -> 0x51a6), seq 120450:123936, ack 872, win 512, options [nop,nop,TS val 281579698 ecr 281579686], length 3486
2022-04-05 22:54:57.195843 IP (tos 0x0, ttl 64, id 14895, offset 0, flags [DF], proto TCP (6), length 52)
    127.0.0.1.58336 > 127.0.0.1.10450: Flags [.], cksum 0xfe28 (incorrect -> 0xac4a), seq 872, ack 123936, win 512, options [nop,nop,TS val 281579698 ecr 281579698], length 0
2022-04-05 22:54:57.202742 IP (tos 0x0, ttl 64, id 49284, offset 0, flags [DF], proto TCP (6), length 1546)
    127.0.0.1.10450 > 127.0.0.1.58336: Flags [P.], cksum 0x03ff (incorrect -> 0xb9f9), seq 123936:125430, ack 872, win 512, options [nop,nop,TS val 281579705 ecr 281579698], length 1494
2022-04-05 22:54:57.203343 IP (tos 0x0, ttl 64, id 14896, offset 0, flags [DF], proto TCP (6), length 52)
    127.0.0.1.58336 > 127.0.0.1.10450: Flags [.], cksum 0xfe28 (incorrect -> 0xa665), seq 872, ack 125430, win 512, options [nop,nop,TS val 281579706 ecr 281579705], length 0
2022-04-05 22:54:57.203381 IP (tos 0x0, ttl 64, id 49285, offset 0, flags [DF], proto TCP (6), length 3538)
    127.0.0.1.10450 > 127.0.0.1.58336: Flags [P.], cksum 0x0bc7 (incorrect -> 0xaf34), seq 125430:128916, ack 872, win 512, options [nop,nop,TS val 281579706 ecr 281579706], length 3486
2022-04-05 22:54:57.203392 IP (tos 0x0, ttl 64, id 14897, offset 0, flags [DF], proto TCP (6), length 52)
    127.0.0.1.58336 > 127.0.0.1.10450: Flags [.], cksum 0xfe28 (incorrect -> 0x98c6), seq 872, ack 128916, win 512, options [nop,nop,TS val 281579706 ecr 281579706], length 0
2022-04-05 22:54:57.211094 IP (tos 0x0, ttl 64, id 49286, offset 0, flags [DF], proto TCP (6), length 3538)
    127.0.0.1.10450 > 127.0.0.1.58336: Flags [P.], cksum 0x0bc7 (incorrect -> 0x0f03), seq 128916:132402, ack 872, win 512, options [nop,nop,TS val 281579714 ecr 281579706], length 3486
2022-04-05 22:54:57.254666 IP (tos 0x0, ttl 64, id 14898, offset 0, flags [DF], proto TCP (6), length 52)
    127.0.0.1.58336 > 127.0.0.1.10450: Flags [.], cksum 0xfe28 (incorrect -> 0x8aed), seq 872, ack 132402, win 512, options [nop,nop,TS val 281579757 ecr 281579714], length 0
200, 5.1940813064575195, 1.503328800201416