2022-04-05 09:13:37.325905 IP (tos 0x0, ttl 64, id 17055, offset 0, flags [DF], proto TCP (6), length 60)
    127.0.0.1.51954 > 127.0.0.1.10450: Flags [S], cksum 0xfe30 (incorrect -> 0x8dfb), seq 1706325529, win 65495, options [mss 65495,sackOK,TS val 787661697 ecr 0,nop,wscale 7], length 0
2022-04-05 09:13:37.325916 IP (tos 0x0, ttl 64, id 0, offset 0, flags [DF], proto TCP (6), length 60)
    127.0.0.1.10450 > 127.0.0.1.51954: Flags [S.], cksum 0xfe30 (incorrect -> 0x1c87), seq 2494360142, ack 1706325530, win 65483, options [mss 65495,sackOK,TS val 787661697 ecr 787661697,nop,wscale 7], length 0
2022-04-05 09:13:37.325924 IP (tos 0x0, ttl 64, id 17056, offset 0, flags [DF], proto TCP (6), length 52)
    127.0.0.1.51954 > 127.0.0.1.10450: Flags [.], cksum 0xfe28 (incorrect -> 0x4343), seq 1, ack 1, win 512, options [nop,nop,TS val 787661697 ecr 787661697], length 0
2022-04-05 09:13:37.326067 IP (tos 0x0, ttl 64, id 17057, offset 0, flags [DF], proto TCP (6), length 55)
    127.0.0.1.51954 > 127.0.0.1.10450: Flags [P.], cksum 0xfe2b (incorrect -> 0x3e37), seq 1:4, ack 1, win 512, options [nop,nop,TS val 787661697 ecr 787661697], length 3
2022-04-05 09:13:37.326076 IP (tos 0x0, ttl 64, id 1411, offset 0, flags [DF], proto TCP (6), length 52)
    127.0.0.1.10450 > 127.0.0.1.51954: Flags [.], cksum 0xfe28 (incorrect -> 0x4340), seq 1, ack 4, win 512, options [nop,nop,TS val 787661697 ecr 787661697], length 0
2022-04-05 09:13:37.326099 IP (tos 0x0, ttl 64, id 1412, offset 0, flags [DF], proto TCP (6), length 54)
    127.0.0.1.10450 > 127.0.0.1.51954: Flags [P.], cksum 0xfe2a (incorrect -> 0x3e36), seq 1:3, ack 4, win 512, options [nop,nop,TS val 787661697 ecr 787661697], length 2
2022-04-05 09:13:37.326107 IP (tos 0x0, ttl 64, id 17058, offset 0, flags [DF], proto TCP (6), length 52)
    127.0.0.1.51954 > 127.0.0.1.10450: Flags [.], cksum 0xfe28 (incorrect -> 0x433e), seq 4, ack 3, win 512, options [nop,nop,TS val 787661697 ecr 787661697], length 0
2022-04-05 09:13:37.327898 IP (tos 0x0, ttl 64, id 17059, offset 0, flags [DF], proto TCP (6), length 62)
    127.0.0.1.51954 > 127.0.0.1.10450: Flags [P.], cksum 0xfe32 (incorrect -> 0xa3f2), seq 4:14, ack 3, win 512, options [nop,nop,TS val 787661699 ecr 787661697], length 10
2022-04-05 09:13:37.327908 IP (tos 0x0, ttl 64, id 1413, offset 0, flags [DF], proto TCP (6), length 52)
    127.0.0.1.10450 > 127.0.0.1.51954: Flags [.], cksum 0xfe28 (incorrect -> 0x4330), seq 3, ack 14, win 512, options [nop,nop,TS val 787661699 ecr 787661699], length 0
2022-04-05 09:13:37.381072 IP (tos 0x0, ttl 64, id 1414, offset 0, flags [DF], proto TCP (6), length 62)
    127.0.0.1.10450 > 127.0.0.1.51954: Flags [P.], cksum 0xfe32 (incorrect -> 0x3de8), seq 3:13, ack 14, win 512, options [nop,nop,TS val 787661752 ecr 787661699], length 10
2022-04-05 09:13:37.381082 IP (tos 0x0, ttl 64, id 17060, offset 0, flags [DF], proto TCP (6), length 52)
    127.0.0.1.51954 > 127.0.0.1.10450: Flags [.], cksum 0xfe28 (incorrect -> 0x42bc), seq 14, ack 13, win 512, options [nop,nop,TS val 787661752 ecr 787661752], length 0
2022-04-05 09:13:37.386971 IP (tos 0x0, ttl 64, id 17061, offset 0, flags [DF], proto TCP (6), length 569)
    127.0.0.1.51954 > 127.0.0.1.10450: Flags [P.], cksum 0x002e (incorrect -> 0x02d9), seq 14:531, ack 13, win 512, options [nop,nop,TS val 787661758 ecr 787661752], length 517
2022-04-05 09:13:37.386982 IP (tos 0x0, ttl 64, id 1415, offset 0, flags [DF], proto TCP (6), length 52)
    127.0.0.1.10450 > 127.0.0.1.51954: Flags [.], cksum 0xfe28 (incorrect -> 0x40af), seq 13, ack 531, win 508, options [nop,nop,TS val 787661758 ecr 787661758], length 0
2022-04-05 09:13:37.437667 IP (tos 0x0, ttl 64, id 1416, offset 0, flags [DF], proto TCP (6), length 3538)
    127.0.0.1.10450 > 127.0.0.1.51954: Flags [P.], cksum 0x0bc7 (incorrect -> 0x4596), seq 13:3499, ack 531, win 512, options [nop,nop,TS val 787661809 ecr 787661758], length 3486
2022-04-05 09:13:37.437687 IP (tos 0x0, ttl 64, id 17062, offset 0, flags [DF], proto TCP (6), length 52)
    127.0.0.1.51954 > 127.0.0.1.10450: Flags [.], cksum 0xfe28 (incorrect -> 0x32b9), seq 531, ack 3499, win 494, options [nop,nop,TS val 787661809 ecr 787661809], length 0
2022-04-05 09:13:37.464991 IP (tos 0x0, ttl 64, id 1417, offset 0, flags [DF], proto TCP (6), length 1217)
    127.0.0.1.10450 > 127.0.0.1.51954: Flags [P.], cksum 0x02b6 (incorrect -> 0xffcc), seq 3499:4664, ack 531, win 512, options [nop,nop,TS val 787661836 ecr 787661809], length 1165
2022-04-05 09:13:37.465009 IP (tos 0x0, ttl 64, id 17063, offset 0, flags [DF], proto TCP (6), length 52)
    127.0.0.1.51954 > 127.0.0.1.10450: Flags [.], cksum 0xfe28 (incorrect -> 0x2ded), seq 531, ack 4664, win 503, options [nop,nop,TS val 787661836 ecr 787661836], length 0
2022-04-05 09:13:37.465495 IP (tos 0x0, ttl 64, id 17064, offset 0, flags [DF], proto TCP (6), length 132)
    127.0.0.1.51954 > 127.0.0.1.10450: Flags [P.], cksum 0xfe78 (incorrect -> 0x59cd), seq 531:611, ack 4664, win 503, options [nop,nop,TS val 787661837 ecr 787661836], length 80
2022-04-05 09:13:37.465515 IP (tos 0x0, ttl 64, id 1418, offset 0, flags [DF], proto TCP (6), length 52)
    127.0.0.1.10450 > 127.0.0.1.51954: Flags [.], cksum 0xfe28 (incorrect -> 0x2d92), seq 4664, ack 611, win 512, options [nop,nop,TS val 787661837 ecr 787661837], length 0
2022-04-05 09:13:37.465822 IP (tos 0x0, ttl 64, id 17065, offset 0, flags [DF], proto TCP (6), length 382)
    127.0.0.1.51954 > 127.0.0.1.10450: Flags [P.], cksum 0xff72 (incorrect -> 0x7783), seq 611:941, ack 4664, win 503, options [nop,nop,TS val 787661837 ecr 787661837], length 330
2022-04-05 09:13:37.465841 IP (tos 0x0, ttl 64, id 1419, offset 0, flags [DF], proto TCP (6), length 52)
    127.0.0.1.10450 > 127.0.0.1.51954: Flags [.], cksum 0xfe28 (incorrect -> 0x2c4a), seq 4664, ack 941, win 510, options [nop,nop,TS val 787661837 ecr 787661837], length 0
200, 4.855643272399902, 1.0542972087860107