2022-04-05 23:16:52.439865 IP (tos 0x0, ttl 64, id 2783, offset 0, flags [DF], proto TCP (6), length 60)
    127.0.0.1.54410 > 127.0.0.1.11050: Flags [S], cksum 0xfe30 (incorrect -> 0xece4), seq 1472092271, win 65495, options [mss 65495,sackOK,TS val 282894942 ecr 0,nop,wscale 7], length 0
2022-04-05 23:16:52.439880 IP (tos 0x0, ttl 64, id 0, offset 0, flags [DF], proto TCP (6), length 60)
    127.0.0.1.11050 > 127.0.0.1.54410: Flags [S.], cksum 0xfe30 (incorrect -> 0x6b8a), seq 1226081542, ack 1472092272, win 65483, options [mss 65495,sackOK,TS val 282894942 ecr 282894942,nop,wscale 7], length 0
2022-04-05 23:16:52.439891 IP (tos 0x0, ttl 64, id 2784, offset 0, flags [DF], proto TCP (6), length 52)
    127.0.0.1.54410 > 127.0.0.1.11050: Flags [.], cksum 0xfe28 (incorrect -> 0x9246), seq 1, ack 1, win 512, options [nop,nop,TS val 282894942 ecr 282894942], length 0
2022-04-05 23:16:52.440004 IP (tos 0x0, ttl 64, id 2785, offset 0, flags [DF], proto TCP (6), length 55)
    127.0.0.1.54410 > 127.0.0.1.11050: Flags [P.], cksum 0xfe2b (incorrect -> 0x8d3a), seq 1:4, ack 1, win 512, options [nop,nop,TS val 282894942 ecr 282894942], length 3
2022-04-05 23:16:52.440018 IP (tos 0x0, ttl 64, id 78, offset 0, flags [DF], proto TCP (6), length 52)
    127.0.0.1.11050 > 127.0.0.1.54410: Flags [.], cksum 0xfe28 (incorrect -> 0x9243), seq 1, ack 4, win 512, options [nop,nop,TS val 282894942 ecr 282894942], length 0
2022-04-05 23:16:52.440055 IP (tos 0x0, ttl 64, id 79, offset 0, flags [DF], proto TCP (6), length 54)
    127.0.0.1.11050 > 127.0.0.1.54410: Flags [P.], cksum 0xfe2a (incorrect -> 0x8d39), seq 1:3, ack 4, win 512, options [nop,nop,TS val 282894942 ecr 282894942], length 2
2022-04-05 23:16:52.440069 IP (tos 0x0, ttl 64, id 2786, offset 0, flags [DF], proto TCP (6), length 52)
    127.0.0.1.54410 > 127.0.0.1.11050: Flags [.], cksum 0xfe28 (incorrect -> 0x9240), seq 4, ack 3, win 512, options [nop,nop,TS val 282894943 ecr 282894942], length 0
2022-04-05 23:16:52.451430 IP (tos 0x0, ttl 64, id 2787, offset 0, flags [DF], proto TCP (6), length 62)
    127.0.0.1.54410 > 127.0.0.1.11050: Flags [P.], cksum 0xfe32 (incorrect -> 0x6ad6), seq 4:14, ack 3, win 512, options [nop,nop,TS val 282894954 ecr 282894942], length 10
2022-04-05 23:16:52.451440 IP (tos 0x0, ttl 64, id 80, offset 0, flags [DF], proto TCP (6), length 52)
    127.0.0.1.11050 > 127.0.0.1.54410: Flags [.], cksum 0xfe28 (incorrect -> 0x921f), seq 3, ack 14, win 512, options [nop,nop,TS val 282894954 ecr 282894954], length 0
2022-04-05 23:16:52.510611 IP (tos 0x0, ttl 64, id 81, offset 0, flags [DF], proto TCP (6), length 62)
    127.0.0.1.11050 > 127.0.0.1.54410: Flags [P.], cksum 0xfe32 (incorrect -> 0x8cd1), seq 3:13, ack 14, win 512, options [nop,nop,TS val 282895013 ecr 282894954], length 10
2022-04-05 23:16:52.510624 IP (tos 0x0, ttl 64, id 2788, offset 0, flags [DF], proto TCP (6), length 52)
    127.0.0.1.54410 > 127.0.0.1.11050: Flags [.], cksum 0xfe28 (incorrect -> 0x919f), seq 14, ack 13, win 512, options [nop,nop,TS val 282895013 ecr 282895013], length 0
2022-04-05 23:16:52.516763 IP (tos 0x0, ttl 64, id 2789, offset 0, flags [DF], proto TCP (6), length 569)
    127.0.0.1.54410 > 127.0.0.1.11050: Flags [P.], cksum 0x002e (incorrect -> 0x8928), seq 14:531, ack 13, win 512, options [nop,nop,TS val 282895019 ecr 282895013], length 517
2022-04-05 23:16:52.516775 IP (tos 0x0, ttl 64, id 82, offset 0, flags [DF], proto TCP (6), length 52)
    127.0.0.1.11050 > 127.0.0.1.54410: Flags [.], cksum 0xfe28 (incorrect -> 0x8f92), seq 13, ack 531, win 508, options [nop,nop,TS val 282895019 ecr 282895019], length 0
200, 4.776846408843994, 0.8016479015350342