2022-04-05 20:25:01.180921 IP (tos 0x0, ttl 64, id 734, offset 0, flags [DF], proto TCP (6), length 60)
    127.0.0.1.38382 > 127.0.0.1.11950: Flags [S], cksum 0xfe30 (incorrect -> 0x4c1c), seq 355716563, win 65495, options [mss 65495,sackOK,TS val 272583683 ecr 0,nop,wscale 7], length 0
2022-04-05 20:25:01.180936 IP (tos 0x0, ttl 64, id 0, offset 0, flags [DF], proto TCP (6), length 60)
    127.0.0.1.11950 > 127.0.0.1.38382: Flags [S.], cksum 0xfe30 (incorrect -> 0x01f6), seq 1700825214, ack 355716564, win 65483, options [mss 65495,sackOK,TS val 272583683 ecr 272583683,nop,wscale 7], length 0
2022-04-05 20:25:01.180949 IP (tos 0x0, ttl 64, id 735, offset 0, flags [DF], proto TCP (6), length 52)
    127.0.0.1.38382 > 127.0.0.1.11950: Flags [.], cksum 0xfe28 (incorrect -> 0x28b2), seq 1, ack 1, win 512, options [nop,nop,TS val 272583683 ecr 272583683], length 0
2022-04-05 20:25:01.181100 IP (tos 0x0, ttl 64, id 736, offset 0, flags [DF], proto TCP (6), length 55)
    127.0.0.1.38382 > 127.0.0.1.11950: Flags [P.], cksum 0xfe2b (incorrect -> 0x23a5), seq 1:4, ack 1, win 512, options [nop,nop,TS val 272583684 ecr 272583683], length 3
2022-04-05 20:25:01.181113 IP (tos 0x0, ttl 64, id 17558, offset 0, flags [DF], proto TCP (6), length 52)
    127.0.0.1.11950 > 127.0.0.1.38382: Flags [.], cksum 0xfe28 (incorrect -> 0x28ad), seq 1, ack 4, win 512, options [nop,nop,TS val 272583684 ecr 272583684], length 0
2022-04-05 20:25:01.181142 IP (tos 0x0, ttl 64, id 17559, offset 0, flags [DF], proto TCP (6), length 54)
    127.0.0.1.11950 > 127.0.0.1.38382: Flags [P.], cksum 0xfe2a (incorrect -> 0x23a3), seq 1:3, ack 4, win 512, options [nop,nop,TS val 272583684 ecr 272583684], length 2
2022-04-05 20:25:01.181152 IP (tos 0x0, ttl 64, id 737, offset 0, flags [DF], proto TCP (6), length 52)
    127.0.0.1.38382 > 127.0.0.1.11950: Flags [.], cksum 0xfe28 (incorrect -> 0x28ab), seq 4, ack 3, win 512, options [nop,nop,TS val 272583684 ecr 272583684], length 0
2022-04-05 20:25:01.183737 IP (tos 0x0, ttl 64, id 738, offset 0, flags [DF], proto TCP (6), length 62)
    127.0.0.1.38382 > 127.0.0.1.11950: Flags [P.], cksum 0xfe32 (incorrect -> 0x014a), seq 4:14, ack 3, win 512, options [nop,nop,TS val 272583686 ecr 272583684], length 10
2022-04-05 20:25:01.183746 IP (tos 0x0, ttl 64, id 17560, offset 0, flags [DF], proto TCP (6), length 52)
    127.0.0.1.11950 > 127.0.0.1.38382: Flags [.], cksum 0xfe28 (incorrect -> 0x289d), seq 3, ack 14, win 512, options [nop,nop,TS val 272583686 ecr 272583686], length 0
2022-04-05 20:25:01.505247 IP (tos 0x0, ttl 64, id 17561, offset 0, flags [DF], proto TCP (6), length 62)
    127.0.0.1.11950 > 127.0.0.1.38382: Flags [P.], cksum 0xfe32 (incorrect -> 0x2248), seq 3:13, ack 14, win 512, options [nop,nop,TS val 272584008 ecr 272583686], length 10
2022-04-05 20:25:01.505258 IP (tos 0x0, ttl 64, id 739, offset 0, flags [DF], proto TCP (6), length 52)
    127.0.0.1.38382 > 127.0.0.1.11950: Flags [.], cksum 0xfe28 (incorrect -> 0x260f), seq 14, ack 13, win 512, options [nop,nop,TS val 272584008 ecr 272584008], length 0
2022-04-05 20:25:01.511206 IP (tos 0x0, ttl 64, id 740, offset 0, flags [DF], proto TCP (6), length 569)
    127.0.0.1.38382 > 127.0.0.1.11950: Flags [P.], cksum 0x002e (incorrect -> 0x2b74), seq 14:531, ack 13, win 512, options [nop,nop,TS val 272584014 ecr 272584008], length 517
2022-04-05 20:25:01.511218 IP (tos 0x0, ttl 64, id 17562, offset 0, flags [DF], proto TCP (6), length 52)
    127.0.0.1.11950 > 127.0.0.1.38382: Flags [.], cksum 0xfe28 (incorrect -> 0x2402), seq 13, ack 531, win 508, options [nop,nop,TS val 272584014 ecr 272584014], length 0
2022-04-05 20:25:01.819766 IP (tos 0x0, ttl 64, id 17563, offset 0, flags [DF], proto TCP (6), length 3538)
    127.0.0.1.11950 > 127.0.0.1.38382: Flags [P.], cksum 0x0bc7 (incorrect -> 0xe6bf), seq 13:3499, ack 531, win 512, options [nop,nop,TS val 272584322 ecr 272584014], length 3486
2022-04-05 20:25:01.819776 IP (tos 0x0, ttl 64, id 741, offset 0, flags [DF], proto TCP (6), length 52)
    127.0.0.1.38382 > 127.0.0.1.11950: Flags [.], cksum 0xfe28 (incorrect -> 0x140a), seq 531, ack 3499, win 494, options [nop,nop,TS val 272584322 ecr 272584322], length 0
2022-04-05 20:25:01.983827 IP (tos 0x0, ttl 64, id 17564, offset 0, flags [DF], proto TCP (6), length 1668)
    127.0.0.1.11950 > 127.0.0.1.38382: Flags [P.], cksum 0x0479 (incorrect -> 0x1d1f), seq 3499:5115, ack 531, win 512, options [nop,nop,TS val 272584486 ecr 272584322], length 1616
2022-04-05 20:25:01.983836 IP (tos 0x0, ttl 64, id 742, offset 0, flags [DF], proto TCP (6), length 52)
    127.0.0.1.38382 > 127.0.0.1.11950: Flags [.], cksum 0xfe28 (incorrect -> 0x0c6b), seq 531, ack 5115, win 501, options [nop,nop,TS val 272584486 ecr 272584486], length 0
2022-04-05 20:25:01.984415 IP (tos 0x0, ttl 64, id 743, offset 0, flags [DF], proto TCP (6), length 132)
    127.0.0.1.38382 > 127.0.0.1.11950: Flags [P.], cksum 0xfe78 (incorrect -> 0xa102), seq 531:611, ack 5115, win 512, options [nop,nop,TS val 272584487 ecr 272584486], length 80
2022-04-05 20:25:01.984879 IP (tos 0x0, ttl 64, id 744, offset 0, flags [DF], proto TCP (6), length 366)
    127.0.0.1.38382 > 127.0.0.1.11950: Flags [P.], cksum 0xff62 (incorrect -> 0xfc60), seq 611:925, ack 5115, win 512, options [nop,nop,TS val 272584487 ecr 272584486], length 314
2022-04-05 20:25:01.984988 IP (tos 0x0, ttl 64, id 17565, offset 0, flags [DF], proto TCP (6), length 52)
    127.0.0.1.11950 > 127.0.0.1.38382: Flags [.], cksum 0xfe28 (incorrect -> 0x0c0e), seq 5115, ack 611, win 512, options [nop,nop,TS val 272584487 ecr 272584487], length 0
2022-04-05 20:25:01.984995 IP (tos 0x0, ttl 64, id 17566, offset 0, flags [DF], proto TCP (6), length 52)
    127.0.0.1.11950 > 127.0.0.1.38382: Flags [.], cksum 0xfe28 (incorrect -> 0x0ad6), seq 5115, ack 925, win 510, options [nop,nop,TS val 272584487 ecr 272584487], length 0
2022-04-05 20:25:02.291963 IP (tos 0x0, ttl 64, id 17567, offset 0, flags [DF], proto TCP (6), length 594)
    127.0.0.1.11950 > 127.0.0.1.38382: Flags [P.], cksum 0x0047 (incorrect -> 0xfab1), seq 5115:5657, ack 925, win 512, options [nop,nop,TS val 272584794 ecr 272584487], length 542
2022-04-05 20:25:02.291973 IP (tos 0x0, ttl 64, id 745, offset 0, flags [DF], proto TCP (6), length 52)
    127.0.0.1.38382 > 127.0.0.1.11950: Flags [.], cksum 0xfe28 (incorrect -> 0x0654), seq 925, ack 5657, win 508, options [nop,nop,TS val 272584794 ecr 272584794], length 0
200, 3.587848424911499, 1.5068135261535645