2022-04-05 16:34:40.962997 IP (tos 0x0, ttl 64, id 15215, offset 0, flags [DF], proto TCP (6), length 60)
    127.0.0.1.47778 > 127.0.0.1.10950: Flags [S], cksum 0xfe30 (incorrect -> 0x9da8), seq 2299251119, win 65495, options [mss 65495,sackOK,TS val 258763465 ecr 0,nop,wscale 7], length 0
2022-04-05 16:34:40.963011 IP (tos 0x0, ttl 64, id 0, offset 0, flags [DF], proto TCP (6), length 60)
    127.0.0.1.10950 > 127.0.0.1.47778: Flags [S.], cksum 0xfe30 (incorrect -> 0xfc51), seq 1592772652, ack 2299251120, win 65483, options [mss 65495,sackOK,TS val 258763465 ecr 258763465,nop,wscale 7], length 0
2022-04-05 16:34:40.963023 IP (tos 0x0, ttl 64, id 15216, offset 0, flags [DF], proto TCP (6), length 52)
    127.0.0.1.47778 > 127.0.0.1.10950: Flags [.], cksum 0xfe28 (incorrect -> 0x230e), seq 1, ack 1, win 512, options [nop,nop,TS val 258763465 ecr 258763465], length 0
2022-04-05 16:34:40.963133 IP (tos 0x0, ttl 64, id 15217, offset 0, flags [DF], proto TCP (6), length 55)
    127.0.0.1.47778 > 127.0.0.1.10950: Flags [P.], cksum 0xfe2b (incorrect -> 0x1e01), seq 1:4, ack 1, win 512, options [nop,nop,TS val 258763466 ecr 258763465], length 3
2022-04-05 16:34:40.963139 IP (tos 0x0, ttl 64, id 53773, offset 0, flags [DF], proto TCP (6), length 52)
    127.0.0.1.10950 > 127.0.0.1.47778: Flags [.], cksum 0xfe28 (incorrect -> 0x2309), seq 1, ack 4, win 512, options [nop,nop,TS val 258763466 ecr 258763466], length 0
2022-04-05 16:34:40.963229 IP (tos 0x0, ttl 64, id 53774, offset 0, flags [DF], proto TCP (6), length 54)
    127.0.0.1.10950 > 127.0.0.1.47778: Flags [P.], cksum 0xfe2a (incorrect -> 0x1dff), seq 1:3, ack 4, win 512, options [nop,nop,TS val 258763466 ecr 258763466], length 2
2022-04-05 16:34:40.963237 IP (tos 0x0, ttl 64, id 15218, offset 0, flags [DF], proto TCP (6), length 52)
    127.0.0.1.47778 > 127.0.0.1.10950: Flags [.], cksum 0xfe28 (incorrect -> 0x2307), seq 4, ack 3, win 512, options [nop,nop,TS val 258763466 ecr 258763466], length 0
2022-04-05 16:34:40.964580 IP (tos 0x0, ttl 64, id 15219, offset 0, flags [DF], proto TCP (6), length 62)
    127.0.0.1.47778 > 127.0.0.1.10950: Flags [P.], cksum 0xfe32 (incorrect -> 0x6a23), seq 4:14, ack 3, win 512, options [nop,nop,TS val 258763467 ecr 258763466], length 10
2022-04-05 16:34:40.964600 IP (tos 0x0, ttl 64, id 53775, offset 0, flags [DF], proto TCP (6), length 52)
    127.0.0.1.10950 > 127.0.0.1.47778: Flags [.], cksum 0xfe28 (incorrect -> 0x22fb), seq 3, ack 14, win 512, options [nop,nop,TS val 258763467 ecr 258763467], length 0
2022-04-05 16:34:41.160801 IP (tos 0x0, ttl 64, id 53776, offset 0, flags [DF], proto TCP (6), length 62)
    127.0.0.1.10950 > 127.0.0.1.47778: Flags [P.], cksum 0xfe32 (incorrect -> 0x1d24), seq 3:13, ack 14, win 512, options [nop,nop,TS val 258763663 ecr 258763467], length 10
2022-04-05 16:34:41.160811 IP (tos 0x0, ttl 64, id 15220, offset 0, flags [DF], proto TCP (6), length 52)
    127.0.0.1.47778 > 127.0.0.1.10950: Flags [.], cksum 0xfe28 (incorrect -> 0x2169), seq 14, ack 13, win 512, options [nop,nop,TS val 258763663 ecr 258763663], length 0
2022-04-05 16:34:41.166463 IP (tos 0x0, ttl 64, id 15221, offset 0, flags [DF], proto TCP (6), length 569)
    127.0.0.1.47778 > 127.0.0.1.10950: Flags [P.], cksum 0x002e (incorrect -> 0x7a0b), seq 14:531, ack 13, win 512, options [nop,nop,TS val 258763669 ecr 258763663], length 517
2022-04-05 16:34:41.166477 IP (tos 0x0, ttl 64, id 53777, offset 0, flags [DF], proto TCP (6), length 52)
    127.0.0.1.10950 > 127.0.0.1.47778: Flags [.], cksum 0xfe28 (incorrect -> 0x1f5c), seq 13, ack 531, win 508, options [nop,nop,TS val 258763669 ecr 258763669], length 0
2022-04-05 16:34:41.448609 IP (tos 0x0, ttl 64, id 53778, offset 0, flags [DF], proto TCP (6), length 3280)
    127.0.0.1.10950 > 127.0.0.1.47778: Flags [P.], cksum 0x0ac5 (incorrect -> 0xbecf), seq 13:3241, ack 531, win 512, options [nop,nop,TS val 258763951 ecr 258763669], length 3228
2022-04-05 16:34:41.448622 IP (tos 0x0, ttl 64, id 15222, offset 0, flags [DF], proto TCP (6), length 52)
    127.0.0.1.47778 > 127.0.0.1.10950: Flags [.], cksum 0xfe28 (incorrect -> 0x1099), seq 531, ack 3241, win 495, options [nop,nop,TS val 258763951 ecr 258763951], length 0
2022-04-05 16:34:41.449186 IP (tos 0x0, ttl 64, id 15223, offset 0, flags [DF], proto TCP (6), length 116)
    127.0.0.1.47778 > 127.0.0.1.10950: Flags [P.], cksum 0xfe68 (incorrect -> 0x5171), seq 531:595, ack 3241, win 512, options [nop,nop,TS val 258763952 ecr 258763951], length 64
2022-04-05 16:34:41.449195 IP (tos 0x0, ttl 64, id 53779, offset 0, flags [DF], proto TCP (6), length 52)
    127.0.0.1.10950 > 127.0.0.1.47778: Flags [.], cksum 0xfe28 (incorrect -> 0x1046), seq 3241, ack 595, win 512, options [nop,nop,TS val 258763952 ecr 258763952], length 0
2022-04-05 16:34:41.449592 IP (tos 0x0, ttl 64, id 15224, offset 0, flags [DF], proto TCP (6), length 387)
    127.0.0.1.47778 > 127.0.0.1.10950: Flags [P.], cksum 0xff77 (incorrect -> 0xe2e7), seq 595:930, ack 3241, win 512, options [nop,nop,TS val 258763952 ecr 258763952], length 335
2022-04-05 16:34:41.449598 IP (tos 0x0, ttl 64, id 53780, offset 0, flags [DF], proto TCP (6), length 52)
    127.0.0.1.10950 > 127.0.0.1.47778: Flags [.], cksum 0xfe28 (incorrect -> 0x0ef9), seq 3241, ack 930, win 510, options [nop,nop,TS val 258763952 ecr 258763952], length 0
2022-04-05 16:34:41.642084 IP (tos 0x0, ttl 64, id 53781, offset 0, flags [DF], proto TCP (6), length 221)
    127.0.0.1.10950 > 127.0.0.1.47778: Flags [P.], cksum 0xfed1 (incorrect -> 0x3cef), seq 3241:3410, ack 930, win 512, options [nop,nop,TS val 258764145 ecr 258763952], length 169
2022-04-05 16:34:41.642096 IP (tos 0x0, ttl 64, id 15225, offset 0, flags [DF], proto TCP (6), length 52)
    127.0.0.1.47778 > 127.0.0.1.10950: Flags [.], cksum 0xfe28 (incorrect -> 0x0ccd), seq 930, ack 3410, win 511, options [nop,nop,TS val 258764145 ecr 258764145], length 0
2022-04-05 16:34:42.364033 IP (tos 0x0, ttl 64, id 53782, offset 0, flags [DF], proto TCP (6), length 3538)
    127.0.0.1.10950 > 127.0.0.1.47778: Flags [P.], cksum 0x0bc7 (incorrect -> 0xef69), seq 3410:6896, ack 930, win 512, options [nop,nop,TS val 258764866 ecr 258764145], length 3486
2022-04-05 16:34:42.364043 IP (tos 0x0, ttl 64, id 15226, offset 0, flags [DF], proto TCP (6), length 52)
    127.0.0.1.47778 > 127.0.0.1.10950: Flags [.], cksum 0xfe28 (incorrect -> 0xf99d), seq 930, ack 6896, win 494, options [nop,nop,TS val 258764866 ecr 258764866], length 0
2022-04-05 16:34:42.376643 IP (tos 0x0, ttl 64, id 53783, offset 0, flags [DF], proto TCP (6), length 1546)
    127.0.0.1.10950 > 127.0.0.1.47778: Flags [P.], cksum 0x03ff (incorrect -> 0x7352), seq 6896:8390, ack 930, win 512, options [nop,nop,TS val 258764879 ecr 258764866], length 1494
2022-04-05 16:34:42.376650 IP (tos 0x0, ttl 64, id 15227, offset 0, flags [DF], proto TCP (6), length 52)
    127.0.0.1.47778 > 127.0.0.1.10950: Flags [.], cksum 0xfe28 (incorrect -> 0xf3a5), seq 930, ack 8390, win 502, options [nop,nop,TS val 258764879 ecr 258764879], length 0
2022-04-05 16:34:42.468424 IP (tos 0x0, ttl 64, id 53784, offset 0, flags [DF], proto TCP (6), length 3538)
    127.0.0.1.10950 > 127.0.0.1.47778: Flags [P.], cksum 0x0bc7 (incorrect -> 0x6e81), seq 8390:11876, ack 930, win 512, options [nop,nop,TS val 258764971 ecr 258764879], length 3486
2022-04-05 16:34:42.468439 IP (tos 0x0, ttl 64, id 15228, offset 0, flags [DF], proto TCP (6), length 52)
    127.0.0.1.47778 > 127.0.0.1.10950: Flags [.], cksum 0xfe28 (incorrect -> 0xe557), seq 930, ack 11876, win 494, options [nop,nop,TS val 258764971 ecr 258764971], length 0
2022-04-05 16:34:42.482901 IP (tos 0x0, ttl 64, id 53785, offset 0, flags [DF], proto TCP (6), length 1048)
    127.0.0.1.10950 > 127.0.0.1.47778: Flags [P.], cksum 0x020d (incorrect -> 0x70aa), seq 11876:12872, ack 930, win 512, options [nop,nop,TS val 258764985 ecr 258764971], length 996
2022-04-05 16:34:42.482908 IP (tos 0x0, ttl 64, id 15229, offset 0, flags [DF], proto TCP (6), length 52)
    127.0.0.1.47778 > 127.0.0.1.10950: Flags [.], cksum 0xfe28 (incorrect -> 0xe14d), seq 930, ack 12872, win 504, options [nop,nop,TS val 258764985 ecr 258764985], length 0
2022-04-05 16:34:42.552747 IP (tos 0x0, ttl 64, id 53786, offset 0, flags [DF], proto TCP (6), length 3030)
    127.0.0.1.10950 > 127.0.0.1.47778: Flags [P.], cksum 0x09cb (incorrect -> 0xad33), seq 12872:15850, ack 930, win 512, options [nop,nop,TS val 258765055 ecr 258764985], length 2978
2022-04-05 16:34:42.552760 IP (tos 0x0, ttl 64, id 15230, offset 0, flags [DF], proto TCP (6), length 52)
    127.0.0.1.47778 > 127.0.0.1.10950: Flags [.], cksum 0xfe28 (incorrect -> 0xd527), seq 930, ack 15850, win 496, options [nop,nop,TS val 258765055 ecr 258765055], length 0
2022-04-05 16:34:43.261334 IP (tos 0x0, ttl 64, id 53787, offset 0, flags [DF], proto TCP (6), length 3538)
    127.0.0.1.10950 > 127.0.0.1.47778: Flags [P.], cksum 0x0bc7 (incorrect -> 0xbb0b), seq 15850:19336, ack 930, win 512, options [nop,nop,TS val 258765764 ecr 258765055], length 3486
2022-04-05 16:34:43.261343 IP (tos 0x0, ttl 64, id 15231, offset 0, flags [DF], proto TCP (6), length 52)
    127.0.0.1.47778 > 127.0.0.1.10950: Flags [.], cksum 0xfe28 (incorrect -> 0xc201), seq 930, ack 19336, win 494, options [nop,nop,TS val 258765764 ecr 258765764], length 0
2022-04-05 16:34:44.120438 IP (tos 0x0, ttl 64, id 53788, offset 0, flags [DF], proto TCP (6), length 3040)
    127.0.0.1.10950 > 127.0.0.1.47778: Flags [P.], cksum 0x09d5 (incorrect -> 0x211a), seq 19336:22324, ack 930, win 512, options [nop,nop,TS val 258766623 ecr 258765764], length 2988
2022-04-05 16:34:44.120446 IP (tos 0x0, ttl 64, id 15232, offset 0, flags [DF], proto TCP (6), length 52)
    127.0.0.1.47778 > 127.0.0.1.10950: Flags [.], cksum 0xfe28 (incorrect -> 0xaf9d), seq 930, ack 22324, win 496, options [nop,nop,TS val 258766623 ecr 258766623], length 0
2022-04-05 16:34:45.451287 IP (tos 0x0, ttl 64, id 53789, offset 0, flags [DF], proto TCP (6), length 3538)
    127.0.0.1.10950 > 127.0.0.1.47778: Flags [P.], cksum 0x0bc7 (incorrect -> 0x306f), seq 22324:25810, ack 930, win 512, options [nop,nop,TS val 258767954 ecr 258766623], length 3486
2022-04-05 16:34:45.451296 IP (tos 0x0, ttl 64, id 15233, offset 0, flags [DF], proto TCP (6), length 52)
    127.0.0.1.47778 > 127.0.0.1.10950: Flags [.], cksum 0xfe28 (incorrect -> 0x979b), seq 930, ack 25810, win 494, options [nop,nop,TS val 258767954 ecr 258767954], length 0
2022-04-05 16:34:45.464047 IP (tos 0x0, ttl 64, id 53790, offset 0, flags [DF], proto TCP (6), length 550)
    127.0.0.1.10950 > 127.0.0.1.47778: Flags [P.], cksum 0x001b (incorrect -> 0x8b93), seq 25810:26308, ack 930, win 512, options [nop,nop,TS val 258767966 ecr 258767954], length 498
2022-04-05 16:34:45.464052 IP (tos 0x0, ttl 64, id 15234, offset 0, flags [DF], proto TCP (6), length 52)
    127.0.0.1.47778 > 127.0.0.1.10950: Flags [.], cksum 0xfe28 (incorrect -> 0x9585), seq 930, ack 26308, win 506, options [nop,nop,TS val 258767966 ecr 258767966], length 0
200, 3.842161178588867, 6.031699895858765