2022-04-05 09:29:16.372706 IP (tos 0x0, ttl 64, id 44244, offset 0, flags [DF], proto TCP (6), length 60)
    127.0.0.1.49320 > 127.0.0.1.10150: Flags [S], cksum 0xfe30 (incorrect -> 0x4d27), seq 2052807047, win 65495, options [mss 65495,sackOK,TS val 788600744 ecr 0,nop,wscale 7], length 0
2022-04-05 09:29:16.372727 IP (tos 0x0, ttl 64, id 0, offset 0, flags [DF], proto TCP (6), length 60)
    127.0.0.1.10150 > 127.0.0.1.49320: Flags [S.], cksum 0xfe30 (incorrect -> 0x9814), seq 3523583070, ack 2052807048, win 65483, options [mss 65495,sackOK,TS val 788600744 ecr 788600744,nop,wscale 7], length 0
2022-04-05 09:29:16.372743 IP (tos 0x0, ttl 64, id 44245, offset 0, flags [DF], proto TCP (6), length 52)
    127.0.0.1.49320 > 127.0.0.1.10150: Flags [.], cksum 0xfe28 (incorrect -> 0xbed0), seq 1, ack 1, win 512, options [nop,nop,TS val 788600744 ecr 788600744], length 0
2022-04-05 09:29:16.372859 IP (tos 0x0, ttl 64, id 44246, offset 0, flags [DF], proto TCP (6), length 55)
    127.0.0.1.49320 > 127.0.0.1.10150: Flags [P.], cksum 0xfe2b (incorrect -> 0xb9c4), seq 1:4, ack 1, win 512, options [nop,nop,TS val 788600744 ecr 788600744], length 3
2022-04-05 09:29:16.372876 IP (tos 0x0, ttl 64, id 19581, offset 0, flags [DF], proto TCP (6), length 52)
    127.0.0.1.10150 > 127.0.0.1.49320: Flags [.], cksum 0xfe28 (incorrect -> 0xbecd), seq 1, ack 4, win 512, options [nop,nop,TS val 788600744 ecr 788600744], length 0
2022-04-05 09:29:16.372904 IP (tos 0x0, ttl 64, id 19582, offset 0, flags [DF], proto TCP (6), length 54)
    127.0.0.1.10150 > 127.0.0.1.49320: Flags [P.], cksum 0xfe2a (incorrect -> 0xb9c3), seq 1:3, ack 4, win 512, options [nop,nop,TS val 788600744 ecr 788600744], length 2
2022-04-05 09:29:16.372917 IP (tos 0x0, ttl 64, id 44247, offset 0, flags [DF], proto TCP (6), length 52)
    127.0.0.1.49320 > 127.0.0.1.10150: Flags [.], cksum 0xfe28 (incorrect -> 0xbecb), seq 4, ack 3, win 512, options [nop,nop,TS val 788600744 ecr 788600744], length 0
2022-04-05 09:29:16.374423 IP (tos 0x0, ttl 64, id 44248, offset 0, flags [DF], proto TCP (6), length 62)
    127.0.0.1.49320 > 127.0.0.1.10150: Flags [P.], cksum 0xfe32 (incorrect -> 0x8081), seq 4:14, ack 3, win 512, options [nop,nop,TS val 788600746 ecr 788600744], length 10
2022-04-05 09:29:16.374433 IP (tos 0x0, ttl 64, id 19583, offset 0, flags [DF], proto TCP (6), length 52)
    127.0.0.1.10150 > 127.0.0.1.49320: Flags [.], cksum 0xfe28 (incorrect -> 0xbebd), seq 3, ack 14, win 512, options [nop,nop,TS val 788600746 ecr 788600746], length 0
2022-04-05 09:29:16.711648 IP (tos 0x0, ttl 64, id 19584, offset 0, flags [DF], proto TCP (6), length 62)
    127.0.0.1.10150 > 127.0.0.1.49320: Flags [P.], cksum 0xfe32 (incorrect -> 0xb859), seq 3:13, ack 14, win 512, options [nop,nop,TS val 788601083 ecr 788600746], length 10
2022-04-05 09:29:16.711667 IP (tos 0x0, ttl 64, id 44249, offset 0, flags [DF], proto TCP (6), length 52)
    127.0.0.1.49320 > 127.0.0.1.10150: Flags [.], cksum 0xfe28 (incorrect -> 0xbc11), seq 14, ack 13, win 512, options [nop,nop,TS val 788601083 ecr 788601083], length 0
2022-04-05 09:29:16.717422 IP (tos 0x0, ttl 64, id 44250, offset 0, flags [DF], proto TCP (6), length 569)
    127.0.0.1.49320 > 127.0.0.1.10150: Flags [P.], cksum 0x002e (incorrect -> 0x4cc6), seq 14:531, ack 13, win 512, options [nop,nop,TS val 788601089 ecr 788601083], length 517
2022-04-05 09:29:16.717434 IP (tos 0x0, ttl 64, id 19585, offset 0, flags [DF], proto TCP (6), length 52)
    127.0.0.1.10150 > 127.0.0.1.49320: Flags [.], cksum 0xfe28 (incorrect -> 0xba04), seq 13, ack 531, win 508, options [nop,nop,TS val 788601089 ecr 788601089], length 0
2022-04-05 09:29:16.918509 IP (tos 0x0, ttl 64, id 19586, offset 0, flags [DF], proto TCP (6), length 3538)
    127.0.0.1.10150 > 127.0.0.1.49320: Flags [P.], cksum 0x0bc7 (incorrect -> 0xa184), seq 13:3499, ack 531, win 512, options [nop,nop,TS val 788601290 ecr 788601089], length 3486
2022-04-05 09:29:16.918519 IP (tos 0x0, ttl 64, id 44251, offset 0, flags [DF], proto TCP (6), length 52)
    127.0.0.1.49320 > 127.0.0.1.10150: Flags [.], cksum 0xfe28 (incorrect -> 0xaae2), seq 531, ack 3499, win 494, options [nop,nop,TS val 788601290 ecr 788601290], length 0
2022-04-05 09:29:17.069558 IP (tos 0x0, ttl 64, id 19587, offset 0, flags [DF], proto TCP (6), length 567)
    127.0.0.1.10150 > 127.0.0.1.49320: Flags [P.], cksum 0x002c (incorrect -> 0x55a2), seq 3499:4014, ack 531, win 512, options [nop,nop,TS val 788601441 ecr 788601290], length 515
2022-04-05 09:29:17.069571 IP (tos 0x0, ttl 64, id 44252, offset 0, flags [DF], proto TCP (6), length 52)
    127.0.0.1.49320 > 127.0.0.1.10150: Flags [.], cksum 0xfe28 (incorrect -> 0xa7a6), seq 531, ack 4014, win 505, options [nop,nop,TS val 788601441 ecr 788601441], length 0
2022-04-05 09:29:17.072178 IP (tos 0x0, ttl 64, id 44253, offset 0, flags [DF], proto TCP (6), length 210)
    127.0.0.1.49320 > 127.0.0.1.10150: Flags [P.], cksum 0xfec6 (incorrect -> 0x4c79), seq 531:689, ack 4014, win 512, options [nop,nop,TS val 788601443 ecr 788601441], length 158
2022-04-05 09:29:17.072190 IP (tos 0x0, ttl 64, id 19588, offset 0, flags [DF], proto TCP (6), length 52)
    127.0.0.1.10150 > 127.0.0.1.49320: Flags [.], cksum 0xfe28 (incorrect -> 0xa6fe), seq 4014, ack 689, win 511, options [nop,nop,TS val 788601443 ecr 788601443], length 0
2022-04-05 09:29:17.273855 IP (tos 0x0, ttl 64, id 19589, offset 0, flags [DF], proto TCP (6), length 394)
    127.0.0.1.10150 > 127.0.0.1.49320: Flags [P.], cksum 0xff7e (incorrect -> 0x4f0d), seq 4014:4356, ack 689, win 512, options [nop,nop,TS val 788601645 ecr 788601443], length 342
2022-04-05 09:29:17.273869 IP (tos 0x0, ttl 64, id 44254, offset 0, flags [DF], proto TCP (6), length 52)
    127.0.0.1.49320 > 127.0.0.1.10150: Flags [.], cksum 0xfe28 (incorrect -> 0xa415), seq 689, ack 4356, win 510, options [nop,nop,TS val 788601645 ecr 788601645], length 0
2022-04-05 09:29:17.274401 IP (tos 0x0, ttl 64, id 44255, offset 0, flags [DF], proto TCP (6), length 371)
    127.0.0.1.49320 > 127.0.0.1.10150: Flags [P.], cksum 0xff67 (incorrect -> 0xc135), seq 689:1008, ack 4356, win 512, options [nop,nop,TS val 788601645 ecr 788601645], length 319
2022-04-05 09:29:17.274413 IP (tos 0x0, ttl 64, id 19590, offset 0, flags [DF], proto TCP (6), length 52)
    127.0.0.1.10150 > 127.0.0.1.49320: Flags [.], cksum 0xfe28 (incorrect -> 0xa2d5), seq 4356, ack 1008, win 510, options [nop,nop,TS val 788601646 ecr 788601645], length 0
200, 2.8988661766052246, 1.4020283222198486