2022-04-05 17:07:10.522208 IP (tos 0x0, ttl 64, id 24147, offset 0, flags [DF], proto TCP (6), length 60)
    127.0.0.1.59854 > 127.0.0.1.10850: Flags [S], cksum 0xfe30 (incorrect -> 0x5114), seq 3318934302, win 65495, options [mss 65495,sackOK,TS val 260713025 ecr 0,nop,wscale 7], length 0
2022-04-05 17:07:10.522224 IP (tos 0x0, ttl 64, id 0, offset 0, flags [DF], proto TCP (6), length 60)
    127.0.0.1.10850 > 127.0.0.1.59854: Flags [S.], cksum 0xfe30 (incorrect -> 0x6ded), seq 2904095805, ack 3318934303, win 65483, options [mss 65495,sackOK,TS val 260713025 ecr 260713025,nop,wscale 7], length 0
2022-04-05 17:07:10.522236 IP (tos 0x0, ttl 64, id 24148, offset 0, flags [DF], proto TCP (6), length 52)
    127.0.0.1.59854 > 127.0.0.1.10850: Flags [.], cksum 0xfe28 (incorrect -> 0x94a9), seq 1, ack 1, win 512, options [nop,nop,TS val 260713025 ecr 260713025], length 0
2022-04-05 17:07:10.522394 IP (tos 0x0, ttl 64, id 24149, offset 0, flags [DF], proto TCP (6), length 55)
    127.0.0.1.59854 > 127.0.0.1.10850: Flags [P.], cksum 0xfe2b (incorrect -> 0x8f9d), seq 1:4, ack 1, win 512, options [nop,nop,TS val 260713025 ecr 260713025], length 3
2022-04-05 17:07:10.522402 IP (tos 0x0, ttl 64, id 21932, offset 0, flags [DF], proto TCP (6), length 52)
    127.0.0.1.10850 > 127.0.0.1.59854: Flags [.], cksum 0xfe28 (incorrect -> 0x94a6), seq 1, ack 4, win 512, options [nop,nop,TS val 260713025 ecr 260713025], length 0
2022-04-05 17:07:10.522428 IP (tos 0x0, ttl 64, id 21933, offset 0, flags [DF], proto TCP (6), length 54)
    127.0.0.1.10850 > 127.0.0.1.59854: Flags [P.], cksum 0xfe2a (incorrect -> 0x8f9c), seq 1:3, ack 4, win 512, options [nop,nop,TS val 260713025 ecr 260713025], length 2
2022-04-05 17:07:10.522436 IP (tos 0x0, ttl 64, id 24150, offset 0, flags [DF], proto TCP (6), length 52)
    127.0.0.1.59854 > 127.0.0.1.10850: Flags [.], cksum 0xfe28 (incorrect -> 0x94a4), seq 4, ack 3, win 512, options [nop,nop,TS val 260713025 ecr 260713025], length 0
2022-04-05 17:07:10.524016 IP (tos 0x0, ttl 64, id 24151, offset 0, flags [DF], proto TCP (6), length 62)
    127.0.0.1.59854 > 127.0.0.1.10850: Flags [P.], cksum 0xfe32 (incorrect -> 0x03a7), seq 4:14, ack 3, win 512, options [nop,nop,TS val 260713026 ecr 260713025], length 10
2022-04-05 17:07:10.524035 IP (tos 0x0, ttl 64, id 21934, offset 0, flags [DF], proto TCP (6), length 52)
    127.0.0.1.10850 > 127.0.0.1.59854: Flags [.], cksum 0xfe28 (incorrect -> 0x9498), seq 3, ack 14, win 512, options [nop,nop,TS val 260713026 ecr 260713026], length 0
2022-04-05 17:07:10.551396 IP (tos 0x0, ttl 64, id 21935, offset 0, flags [DF], proto TCP (6), length 62)
    127.0.0.1.10850 > 127.0.0.1.59854: Flags [P.], cksum 0xfe32 (incorrect -> 0x8f69), seq 3:13, ack 14, win 512, options [nop,nop,TS val 260713054 ecr 260713026], length 10
2022-04-05 17:07:10.551416 IP (tos 0x0, ttl 64, id 24152, offset 0, flags [DF], proto TCP (6), length 52)
    127.0.0.1.59854 > 127.0.0.1.10850: Flags [.], cksum 0xfe28 (incorrect -> 0x9456), seq 14, ack 13, win 512, options [nop,nop,TS val 260713054 ecr 260713054], length 0
2022-04-05 17:07:10.557074 IP (tos 0x0, ttl 64, id 24153, offset 0, flags [DF], proto TCP (6), length 569)
    127.0.0.1.59854 > 127.0.0.1.10850: Flags [P.], cksum 0x002e (incorrect -> 0x4d0c), seq 14:531, ack 13, win 512, options [nop,nop,TS val 260713060 ecr 260713054], length 517
2022-04-05 17:07:10.557084 IP (tos 0x0, ttl 64, id 21936, offset 0, flags [DF], proto TCP (6), length 52)
    127.0.0.1.10850 > 127.0.0.1.59854: Flags [.], cksum 0xfe28 (incorrect -> 0x9249), seq 13, ack 531, win 508, options [nop,nop,TS val 260713060 ecr 260713060], length 0
2022-04-05 17:07:10.588624 IP (tos 0x0, ttl 64, id 21937, offset 0, flags [DF], proto TCP (6), length 3217)
    127.0.0.1.10850 > 127.0.0.1.59854: Flags [P.], cksum 0x0a86 (incorrect -> 0x73a2), seq 13:3178, ack 531, win 512, options [nop,nop,TS val 260713091 ecr 260713060], length 3165
2022-04-05 17:07:10.588636 IP (tos 0x0, ttl 64, id 24154, offset 0, flags [DF], proto TCP (6), length 52)
    127.0.0.1.59854 > 127.0.0.1.10850: Flags [.], cksum 0xfe28 (incorrect -> 0x85bb), seq 531, ack 3178, win 495, options [nop,nop,TS val 260713091 ecr 260713091], length 0
2022-04-05 17:07:10.589250 IP (tos 0x0, ttl 64, id 24155, offset 0, flags [DF], proto TCP (6), length 116)
    127.0.0.1.59854 > 127.0.0.1.10850: Flags [P.], cksum 0xfe68 (incorrect -> 0x5c27), seq 531:595, ack 3178, win 512, options [nop,nop,TS val 260713092 ecr 260713091], length 64
2022-04-05 17:07:10.589259 IP (tos 0x0, ttl 64, id 21938, offset 0, flags [DF], proto TCP (6), length 52)
    127.0.0.1.10850 > 127.0.0.1.59854: Flags [.], cksum 0xfe28 (incorrect -> 0x8568), seq 3178, ack 595, win 512, options [nop,nop,TS val 260713092 ecr 260713092], length 0
2022-04-05 17:07:10.589727 IP (tos 0x0, ttl 64, id 24156, offset 0, flags [DF], proto TCP (6), length 396)
    127.0.0.1.59854 > 127.0.0.1.10850: Flags [P.], cksum 0xff80 (incorrect -> 0x6495), seq 595:939, ack 3178, win 512, options [nop,nop,TS val 260713092 ecr 260713092], length 344
2022-04-05 17:07:10.589736 IP (tos 0x0, ttl 64, id 21939, offset 0, flags [DF], proto TCP (6), length 52)
    127.0.0.1.10850 > 127.0.0.1.59854: Flags [.], cksum 0xfe28 (incorrect -> 0x8412), seq 3178, ack 939, win 510, options [nop,nop,TS val 260713092 ecr 260713092], length 0
2022-04-05 17:07:10.620259 IP (tos 0x0, ttl 64, id 21940, offset 0, flags [DF], proto TCP (6), length 221)
    127.0.0.1.10850 > 127.0.0.1.59854: Flags [P.], cksum 0xfed1 (incorrect -> 0xd4fd), seq 3178:3347, ack 939, win 512, options [nop,nop,TS val 260713123 ecr 260713092], length 169
2022-04-05 17:07:10.620267 IP (tos 0x0, ttl 64, id 24157, offset 0, flags [DF], proto TCP (6), length 52)
    127.0.0.1.59854 > 127.0.0.1.10850: Flags [.], cksum 0xfe28 (incorrect -> 0x832a), seq 939, ack 3347, win 511, options [nop,nop,TS val 260713123 ecr 260713123], length 0
200, 4.51269268989563, 0.4202568531036377