2022-04-05 13:08:56.631980 IP (tos 0x0, ttl 64, id 58559, offset 0, flags [DF], proto TCP (6), length 60)
    127.0.0.1.47404 > 127.0.0.1.10950: Flags [S], cksum 0xfe30 (incorrect -> 0x79aa), seq 3960989918, win 65495, options [mss 65495,sackOK,TS val 246419134 ecr 0,nop,wscale 7], length 0
2022-04-05 13:08:56.632004 IP (tos 0x0, ttl 64, id 0, offset 0, flags [DF], proto TCP (6), length 60)
    127.0.0.1.10950 > 127.0.0.1.47404: Flags [S.], cksum 0xfe30 (incorrect -> 0xa4b9), seq 3953183708, ack 3960989919, win 65483, options [mss 65495,sackOK,TS val 246419134 ecr 246419134,nop,wscale 7], length 0
2022-04-05 13:08:56.632020 IP (tos 0x0, ttl 64, id 58560, offset 0, flags [DF], proto TCP (6), length 52)
    127.0.0.1.47404 > 127.0.0.1.10950: Flags [.], cksum 0xfe28 (incorrect -> 0xcb75), seq 1, ack 1, win 512, options [nop,nop,TS val 246419134 ecr 246419134], length 0
2022-04-05 13:08:56.632151 IP (tos 0x0, ttl 64, id 58561, offset 0, flags [DF], proto TCP (6), length 55)
    127.0.0.1.47404 > 127.0.0.1.10950: Flags [P.], cksum 0xfe2b (incorrect -> 0xc668), seq 1:4, ack 1, win 512, options [nop,nop,TS val 246419135 ecr 246419134], length 3
2022-04-05 13:08:56.632169 IP (tos 0x0, ttl 64, id 20905, offset 0, flags [DF], proto TCP (6), length 52)
    127.0.0.1.10950 > 127.0.0.1.47404: Flags [.], cksum 0xfe28 (incorrect -> 0xcb70), seq 1, ack 4, win 512, options [nop,nop,TS val 246419135 ecr 246419135], length 0
2022-04-05 13:08:56.632204 IP (tos 0x0, ttl 64, id 20906, offset 0, flags [DF], proto TCP (6), length 54)
    127.0.0.1.10950 > 127.0.0.1.47404: Flags [P.], cksum 0xfe2a (incorrect -> 0xc666), seq 1:3, ack 4, win 512, options [nop,nop,TS val 246419135 ecr 246419135], length 2
2022-04-05 13:08:56.632218 IP (tos 0x0, ttl 64, id 58562, offset 0, flags [DF], proto TCP (6), length 52)
    127.0.0.1.47404 > 127.0.0.1.10950: Flags [.], cksum 0xfe28 (incorrect -> 0xcb6e), seq 4, ack 3, win 512, options [nop,nop,TS val 246419135 ecr 246419135], length 0
2022-04-05 13:08:56.644310 IP (tos 0x0, ttl 64, id 58563, offset 0, flags [DF], proto TCP (6), length 62)
    127.0.0.1.47404 > 127.0.0.1.10950: Flags [P.], cksum 0xfe32 (incorrect -> 0x218b), seq 4:14, ack 3, win 512, options [nop,nop,TS val 246419147 ecr 246419135], length 10
2022-04-05 13:08:56.644326 IP (tos 0x0, ttl 64, id 20907, offset 0, flags [DF], proto TCP (6), length 52)
    127.0.0.1.10950 > 127.0.0.1.47404: Flags [.], cksum 0xfe28 (incorrect -> 0xcb4c), seq 3, ack 14, win 512, options [nop,nop,TS val 246419147 ecr 246419147], length 0
2022-04-05 13:08:56.692461 IP (tos 0x0, ttl 64, id 20908, offset 0, flags [DF], proto TCP (6), length 62)
    127.0.0.1.10950 > 127.0.0.1.47404: Flags [P.], cksum 0xfe32 (incorrect -> 0xc609), seq 3:13, ack 14, win 512, options [nop,nop,TS val 246419195 ecr 246419147], length 10
2022-04-05 13:08:56.692472 IP (tos 0x0, ttl 64, id 58564, offset 0, flags [DF], proto TCP (6), length 52)
    127.0.0.1.47404 > 127.0.0.1.10950: Flags [.], cksum 0xfe28 (incorrect -> 0xcae2), seq 14, ack 13, win 512, options [nop,nop,TS val 246419195 ecr 246419195], length 0
2022-04-05 13:08:56.698199 IP (tos 0x0, ttl 64, id 58565, offset 0, flags [DF], proto TCP (6), length 569)
    127.0.0.1.47404 > 127.0.0.1.10950: Flags [P.], cksum 0x002e (incorrect -> 0x9208), seq 14:531, ack 13, win 512, options [nop,nop,TS val 246419201 ecr 246419195], length 517
2022-04-05 13:08:56.698208 IP (tos 0x0, ttl 64, id 20909, offset 0, flags [DF], proto TCP (6), length 52)
    127.0.0.1.10950 > 127.0.0.1.47404: Flags [.], cksum 0xfe28 (incorrect -> 0xc8d5), seq 13, ack 531, win 508, options [nop,nop,TS val 246419201 ecr 246419201], length 0
2022-04-05 13:08:56.734776 IP (tos 0x0, ttl 64, id 20910, offset 0, flags [DF], proto TCP (6), length 151)
    127.0.0.1.10950 > 127.0.0.1.47404: Flags [P.], cksum 0xfe8b (incorrect -> 0x2496), seq 13:112, ack 531, win 512, options [nop,nop,TS val 246419237 ecr 246419201], length 99
2022-04-05 13:08:56.734791 IP (tos 0x0, ttl 64, id 58566, offset 0, flags [DF], proto TCP (6), length 52)
    127.0.0.1.47404 > 127.0.0.1.10950: Flags [.], cksum 0xfe28 (incorrect -> 0xc826), seq 531, ack 112, win 512, options [nop,nop,TS val 246419237 ecr 246419237], length 0
2022-04-05 13:08:56.734937 IP (tos 0x0, ttl 64, id 58567, offset 0, flags [DF], proto TCP (6), length 575)
    127.0.0.1.47404 > 127.0.0.1.10950: Flags [P.], cksum 0x0034 (incorrect -> 0xa9fc), seq 531:1054, ack 112, win 512, options [nop,nop,TS val 246419237 ecr 246419237], length 523
2022-04-05 13:08:56.734943 IP (tos 0x0, ttl 64, id 20911, offset 0, flags [DF], proto TCP (6), length 52)
    127.0.0.1.10950 > 127.0.0.1.47404: Flags [.], cksum 0xfe28 (incorrect -> 0xc61f), seq 112, ack 1054, win 508, options [nop,nop,TS val 246419237 ecr 246419237], length 0
2022-04-05 13:08:56.804841 IP (tos 0x0, ttl 64, id 20912, offset 0, flags [DF], proto TCP (6), length 3538)
    127.0.0.1.10950 > 127.0.0.1.47404: Flags [P.], cksum 0x0bc7 (incorrect -> 0xff2c), seq 112:3598, ack 1054, win 512, options [nop,nop,TS val 246419307 ecr 246419237], length 3486
2022-04-05 13:08:56.804848 IP (tos 0x0, ttl 64, id 58568, offset 0, flags [DF], proto TCP (6), length 52)
    127.0.0.1.47404 > 127.0.0.1.10950: Flags [.], cksum 0xfe28 (incorrect -> 0xb803), seq 1054, ack 3598, win 494, options [nop,nop,TS val 246419307 ecr 246419307], length 0
2022-04-05 13:08:56.807348 IP (tos 0x0, ttl 64, id 20913, offset 0, flags [DF], proto TCP (6), length 3538)
    127.0.0.1.10950 > 127.0.0.1.47404: Flags [P.], cksum 0x0bc7 (incorrect -> 0xf961), seq 3598:7084, ack 1054, win 512, options [nop,nop,TS val 246419310 ecr 246419307], length 3486
2022-04-05 13:08:56.807354 IP (tos 0x0, ttl 64, id 58569, offset 0, flags [DF], proto TCP (6), length 52)
    127.0.0.1.47404 > 127.0.0.1.10950: Flags [.], cksum 0xfe28 (incorrect -> 0xaa5f), seq 1054, ack 7084, win 494, options [nop,nop,TS val 246419310 ecr 246419310], length 0
2022-04-05 13:08:56.813569 IP (tos 0x0, ttl 64, id 20914, offset 0, flags [DF], proto TCP (6), length 3380)
    127.0.0.1.10950 > 127.0.0.1.47404: Flags [P.], cksum 0x0b29 (incorrect -> 0x2d80), seq 7084:10412, ack 1054, win 512, options [nop,nop,TS val 246419316 ecr 246419310], length 3328
2022-04-05 13:08:56.813575 IP (tos 0x0, ttl 64, id 58570, offset 0, flags [DF], proto TCP (6), length 52)
    127.0.0.1.47404 > 127.0.0.1.10950: Flags [.], cksum 0xfe28 (incorrect -> 0x9d53), seq 1054, ack 10412, win 494, options [nop,nop,TS val 246419316 ecr 246419316], length 0
2022-04-05 13:08:56.814115 IP (tos 0x0, ttl 64, id 58571, offset 0, flags [DF], proto TCP (6), length 126)
    127.0.0.1.47404 > 127.0.0.1.10950: Flags [P.], cksum 0xfe72 (incorrect -> 0x8162), seq 1054:1128, ack 10412, win 512, options [nop,nop,TS val 246419317 ecr 246419316], length 74
2022-04-05 13:08:56.814122 IP (tos 0x0, ttl 64, id 20915, offset 0, flags [DF], proto TCP (6), length 52)
    127.0.0.1.10950 > 127.0.0.1.47404: Flags [.], cksum 0xfe28 (incorrect -> 0x9cf5), seq 10412, ack 1128, win 512, options [nop,nop,TS val 246419317 ecr 246419317], length 0
2022-04-05 13:08:56.814519 IP (tos 0x0, ttl 64, id 58572, offset 0, flags [DF], proto TCP (6), length 322)
    127.0.0.1.47404 > 127.0.0.1.10950: Flags [P.], cksum 0xff36 (incorrect -> 0x0782), seq 1128:1398, ack 10412, win 512, options [nop,nop,TS val 246419317 ecr 246419317], length 270
2022-04-05 13:08:56.814527 IP (tos 0x0, ttl 64, id 20916, offset 0, flags [DF], proto TCP (6), length 52)
    127.0.0.1.10950 > 127.0.0.1.47404: Flags [.], cksum 0xfe28 (incorrect -> 0x9be9), seq 10412, ack 1398, win 510, options [nop,nop,TS val 246419317 ecr 246419317], length 0
2022-04-05 13:08:56.883081 IP (tos 0x0, ttl 64, id 20917, offset 0, flags [DF], proto TCP (6), length 626)
    127.0.0.1.10950 > 127.0.0.1.47404: Flags [P.], cksum 0x0067 (incorrect -> 0x346a), seq 10412:10986, ack 1398, win 512, options [nop,nop,TS val 246419386 ecr 246419317], length 574
2022-04-05 13:08:56.926660 IP (tos 0x0, ttl 64, id 58573, offset 0, flags [DF], proto TCP (6), length 52)
    127.0.0.1.47404 > 127.0.0.1.10950: Flags [.], cksum 0xfe28 (incorrect -> 0x98f4), seq 1398, ack 10986, win 512, options [nop,nop,TS val 246419429 ecr 246419386], length 0
2022-04-05 13:08:57.690108 IP (tos 0x0, ttl 64, id 20918, offset 0, flags [DF], proto TCP (6), length 3538)
    127.0.0.1.10950 > 127.0.0.1.47404: Flags [P.], cksum 0x0bc7 (incorrect -> 0x9014), seq 10986:14472, ack 1398, win 512, options [nop,nop,TS val 246420193 ecr 246419429], length 3486
2022-04-05 13:08:57.690117 IP (tos 0x0, ttl 64, id 58574, offset 0, flags [DF], proto TCP (6), length 52)
    127.0.0.1.47404 > 127.0.0.1.10950: Flags [.], cksum 0xfe28 (incorrect -> 0x8545), seq 1398, ack 14472, win 494, options [nop,nop,TS val 246420193 ecr 246420193], length 0
2022-04-05 13:08:57.711922 IP (tos 0x0, ttl 64, id 20919, offset 0, flags [DF], proto TCP (6), length 4100)
    127.0.0.1.10950 > 127.0.0.1.47404: Flags [P.], cksum 0x0df9 (incorrect -> 0xe5c4), seq 14472:18520, ack 1398, win 512, options [nop,nop,TS val 246420214 ecr 246420193], length 4048
2022-04-05 13:08:57.711932 IP (tos 0x0, ttl 64, id 58575, offset 0, flags [DF], proto TCP (6), length 52)
    127.0.0.1.47404 > 127.0.0.1.10950: Flags [.], cksum 0xfe28 (incorrect -> 0x754d), seq 1398, ack 18520, win 492, options [nop,nop,TS val 246420214 ecr 246420214], length 0
2022-04-05 13:08:57.711938 IP (tos 0x0, ttl 64, id 20920, offset 0, flags [DF], proto TCP (6), length 984)
    127.0.0.1.10950 > 127.0.0.1.47404: Flags [P.], cksum 0x01cd (incorrect -> 0xe252), seq 18520:19452, ack 1398, win 512, options [nop,nop,TS val 246420214 ecr 246420214], length 932
2022-04-05 13:08:57.711941 IP (tos 0x0, ttl 64, id 58576, offset 0, flags [DF], proto TCP (6), length 52)
    127.0.0.1.47404 > 127.0.0.1.10950: Flags [.], cksum 0xfe28 (incorrect -> 0x71ad), seq 1398, ack 19452, win 488, options [nop,nop,TS val 246420214 ecr 246420214], length 0
2022-04-05 13:08:57.711994 IP (tos 0x0, ttl 64, id 20921, offset 0, flags [DF], proto TCP (6), length 4100)
    127.0.0.1.10950 > 127.0.0.1.47404: Flags [P.], cksum 0x0df9 (incorrect -> 0x30be), seq 19452:23500, ack 1398, win 512, options [nop,nop,TS val 246420214 ecr 246420214], length 4048
2022-04-05 13:08:57.711997 IP (tos 0x0, ttl 64, id 58577, offset 0, flags [DF], proto TCP (6), length 52)
    127.0.0.1.47404 > 127.0.0.1.10950: Flags [.], cksum 0xfe28 (incorrect -> 0x61ed), seq 1398, ack 23500, win 472, options [nop,nop,TS val 246420214 ecr 246420214], length 0
2022-04-05 13:08:57.712001 IP (tos 0x0, ttl 64, id 20922, offset 0, flags [DF], proto TCP (6), length 3474)
    127.0.0.1.10950 > 127.0.0.1.47404: Flags [P.], cksum 0x0b87 (incorrect -> 0x481c), seq 23500:26922, ack 1398, win 512, options [nop,nop,TS val 246420214 ecr 246420214], length 3422
2022-04-05 13:08:57.712004 IP (tos 0x0, ttl 64, id 58578, offset 0, flags [DF], proto TCP (6), length 52)
    127.0.0.1.47404 > 127.0.0.1.10950: Flags [.], cksum 0xfe28 (incorrect -> 0x549c), seq 1398, ack 26922, win 459, options [nop,nop,TS val 246420214 ecr 246420214], length 0
2022-04-05 13:08:57.722090 IP (tos 0x0, ttl 64, id 20923, offset 0, flags [DF], proto TCP (6), length 784)
    127.0.0.1.10950 > 127.0.0.1.47404: Flags [P.], cksum 0x0105 (incorrect -> 0x12f9), seq 26922:27654, ack 1398, win 512, options [nop,nop,TS val 246420225 ecr 246420214], length 732
2022-04-05 13:08:57.722094 IP (tos 0x0, ttl 64, id 58579, offset 0, flags [DF], proto TCP (6), length 52)
    127.0.0.1.47404 > 127.0.0.1.10950: Flags [.], cksum 0xfe28 (incorrect -> 0x517c), seq 1398, ack 27654, win 505, options [nop,nop,TS val 246420225 ecr 246420225], length 0
200, 7.740985870361328, 1.3881361484527588