2022-04-05 11:58:31.459548 IP (tos 0x0, ttl 64, id 65030, offset 0, flags [DF], proto TCP (6), length 60)
    127.0.0.1.57760 > 127.0.0.1.10450: Flags [S], cksum 0xfe30 (incorrect -> 0x8843), seq 2347666627, win 65495, options [mss 65495,sackOK,TS val 242193962 ecr 0,nop,wscale 7], length 0
2022-04-05 11:58:31.459559 IP (tos 0x0, ttl 64, id 0, offset 0, flags [DF], proto TCP (6), length 60)
    127.0.0.1.10450 > 127.0.0.1.57760: Flags [S.], cksum 0xfe30 (incorrect -> 0x0961), seq 1383761865, ack 2347666628, win 65483, options [mss 65495,sackOK,TS val 242193962 ecr 242193962,nop,wscale 7], length 0
2022-04-05 11:58:31.459568 IP (tos 0x0, ttl 64, id 65031, offset 0, flags [DF], proto TCP (6), length 52)
    127.0.0.1.57760 > 127.0.0.1.10450: Flags [.], cksum 0xfe28 (incorrect -> 0x301d), seq 1, ack 1, win 512, options [nop,nop,TS val 242193962 ecr 242193962], length 0
2022-04-05 11:58:31.459688 IP (tos 0x0, ttl 64, id 65032, offset 0, flags [DF], proto TCP (6), length 55)
    127.0.0.1.57760 > 127.0.0.1.10450: Flags [P.], cksum 0xfe2b (incorrect -> 0x2b11), seq 1:4, ack 1, win 512, options [nop,nop,TS val 242193962 ecr 242193962], length 3
2022-04-05 11:58:31.459705 IP (tos 0x0, ttl 64, id 16520, offset 0, flags [DF], proto TCP (6), length 52)
    127.0.0.1.10450 > 127.0.0.1.57760: Flags [.], cksum 0xfe28 (incorrect -> 0x301a), seq 1, ack 4, win 512, options [nop,nop,TS val 242193962 ecr 242193962], length 0
2022-04-05 11:58:31.459761 IP (tos 0x0, ttl 64, id 16521, offset 0, flags [DF], proto TCP (6), length 54)
    127.0.0.1.10450 > 127.0.0.1.57760: Flags [P.], cksum 0xfe2a (incorrect -> 0x2b10), seq 1:3, ack 4, win 512, options [nop,nop,TS val 242193962 ecr 242193962], length 2
2022-04-05 11:58:31.459778 IP (tos 0x0, ttl 64, id 65033, offset 0, flags [DF], proto TCP (6), length 52)
    127.0.0.1.57760 > 127.0.0.1.10450: Flags [.], cksum 0xfe28 (incorrect -> 0x3018), seq 4, ack 3, win 512, options [nop,nop,TS val 242193962 ecr 242193962], length 0
2022-04-05 11:58:31.461436 IP (tos 0x0, ttl 64, id 65034, offset 0, flags [DF], proto TCP (6), length 62)
    127.0.0.1.57760 > 127.0.0.1.10450: Flags [P.], cksum 0xfe32 (incorrect -> 0x3423), seq 4:14, ack 3, win 512, options [nop,nop,TS val 242193964 ecr 242193962], length 10
2022-04-05 11:58:31.461460 IP (tos 0x0, ttl 64, id 16522, offset 0, flags [DF], proto TCP (6), length 52)
    127.0.0.1.10450 > 127.0.0.1.57760: Flags [.], cksum 0xfe28 (incorrect -> 0x300a), seq 3, ack 14, win 512, options [nop,nop,TS val 242193964 ecr 242193964], length 0
2022-04-05 11:58:31.782499 IP (tos 0x0, ttl 64, id 16523, offset 0, flags [DF], proto TCP (6), length 62)
    127.0.0.1.10450 > 127.0.0.1.57760: Flags [P.], cksum 0xfe32 (incorrect -> 0x29b6), seq 3:13, ack 14, win 512, options [nop,nop,TS val 242194285 ecr 242193964], length 10
2022-04-05 11:58:31.782520 IP (tos 0x0, ttl 64, id 65035, offset 0, flags [DF], proto TCP (6), length 52)
    127.0.0.1.57760 > 127.0.0.1.10450: Flags [.], cksum 0xfe28 (incorrect -> 0x2d7e), seq 14, ack 13, win 512, options [nop,nop,TS val 242194285 ecr 242194285], length 0
2022-04-05 11:58:31.788556 IP (tos 0x0, ttl 64, id 65036, offset 0, flags [DF], proto TCP (6), length 569)
    127.0.0.1.57760 > 127.0.0.1.10450: Flags [P.], cksum 0x002e (incorrect -> 0x3e3d), seq 14:531, ack 13, win 512, options [nop,nop,TS val 242194291 ecr 242194285], length 517
2022-04-05 11:58:31.788567 IP (tos 0x0, ttl 64, id 16524, offset 0, flags [DF], proto TCP (6), length 52)
    127.0.0.1.10450 > 127.0.0.1.57760: Flags [.], cksum 0xfe28 (incorrect -> 0x2b71), seq 13, ack 531, win 508, options [nop,nop,TS val 242194291 ecr 242194291], length 0
2022-04-05 11:58:32.087572 IP (tos 0x0, ttl 64, id 16525, offset 0, flags [DF], proto TCP (6), length 3538)
    127.0.0.1.10450 > 127.0.0.1.57760: Flags [P.], cksum 0x0bc7 (incorrect -> 0x456d), seq 13:3499, ack 531, win 512, options [nop,nop,TS val 242194590 ecr 242194291], length 3486
2022-04-05 11:58:32.087587 IP (tos 0x0, ttl 64, id 65037, offset 0, flags [DF], proto TCP (6), length 52)
    127.0.0.1.57760 > 127.0.0.1.10450: Flags [.], cksum 0xfe28 (incorrect -> 0x1b8b), seq 531, ack 3499, win 494, options [nop,nop,TS val 242194590 ecr 242194590], length 0
2022-04-05 11:58:32.217260 IP (tos 0x0, ttl 64, id 16526, offset 0, flags [DF], proto TCP (6), length 64)
    127.0.0.1.10450 > 127.0.0.1.57760: Flags [P.], cksum 0xfe34 (incorrect -> 0xa2e2), seq 3499:3511, ack 531, win 512, options [nop,nop,TS val 242194720 ecr 242194590], length 12
2022-04-05 11:58:32.217268 IP (tos 0x0, ttl 64, id 65038, offset 0, flags [DF], proto TCP (6), length 52)
    127.0.0.1.57760 > 127.0.0.1.10450: Flags [.], cksum 0xfe28 (incorrect -> 0x1a6e), seq 531, ack 3511, win 507, options [nop,nop,TS val 242194720 ecr 242194720], length 0
2022-04-05 11:58:32.217663 IP (tos 0x0, ttl 64, id 65039, offset 0, flags [DF], proto TCP (6), length 178)
    127.0.0.1.57760 > 127.0.0.1.10450: Flags [P.], cksum 0xfea6 (incorrect -> 0x1c1b), seq 531:657, ack 3511, win 512, options [nop,nop,TS val 242194720 ecr 242194720], length 126
2022-04-05 11:58:32.217677 IP (tos 0x0, ttl 64, id 16527, offset 0, flags [DF], proto TCP (6), length 52)
    127.0.0.1.10450 > 127.0.0.1.57760: Flags [.], cksum 0xfe28 (incorrect -> 0x19eb), seq 3511, ack 657, win 512, options [nop,nop,TS val 242194720 ecr 242194720], length 0
2022-04-05 11:58:32.517752 IP (tos 0x0, ttl 64, id 16528, offset 0, flags [DF], proto TCP (6), length 103)
    127.0.0.1.10450 > 127.0.0.1.57760: Flags [P.], cksum 0xfe5b (incorrect -> 0x8ba4), seq 3511:3562, ack 657, win 512, options [nop,nop,TS val 242195020 ecr 242194720], length 51
2022-04-05 11:58:32.517767 IP (tos 0x0, ttl 64, id 65040, offset 0, flags [DF], proto TCP (6), length 52)
    127.0.0.1.57760 > 127.0.0.1.10450: Flags [.], cksum 0xfe28 (incorrect -> 0x1760), seq 657, ack 3562, win 512, options [nop,nop,TS val 242195020 ecr 242195020], length 0
2022-04-05 11:58:32.518181 IP (tos 0x0, ttl 64, id 65041, offset 0, flags [DF], proto TCP (6), length 352)
    127.0.0.1.57760 > 127.0.0.1.10450: Flags [P.], cksum 0xff54 (incorrect -> 0x9e3b), seq 657:957, ack 3562, win 512, options [nop,nop,TS val 242195021 ecr 242195020], length 300
2022-04-05 11:58:32.518190 IP (tos 0x0, ttl 64, id 16529, offset 0, flags [DF], proto TCP (6), length 52)
    127.0.0.1.10450 > 127.0.0.1.57760: Flags [.], cksum 0xfe28 (incorrect -> 0x1634), seq 3562, ack 957, win 510, options [nop,nop,TS val 242195021 ecr 242195021], length 0
200, 5.148822784423828, 1.8701746463775635