2022-04-05 06:36:47.442566 IP (tos 0x0, ttl 64, id 60599, offset 0, flags [DF], proto TCP (6), length 60)
    127.0.0.1.51766 > 127.0.0.1.9250: Flags [S], cksum 0xfe30 (incorrect -> 0xe049), seq 901639960, win 65495, options [mss 65495,sackOK,TS val 778251814 ecr 0,nop,wscale 7], length 0
2022-04-05 06:36:47.442582 IP (tos 0x0, ttl 64, id 0, offset 0, flags [DF], proto TCP (6), length 60)
    127.0.0.1.9250 > 127.0.0.1.51766: Flags [S.], cksum 0xfe30 (incorrect -> 0xc388), seq 949913492, ack 901639961, win 65483, options [mss 65495,sackOK,TS val 778251814 ecr 778251814,nop,wscale 7], length 0
2022-04-05 06:36:47.442594 IP (tos 0x0, ttl 64, id 60600, offset 0, flags [DF], proto TCP (6), length 52)
    127.0.0.1.51766 > 127.0.0.1.9250: Flags [.], cksum 0xfe28 (incorrect -> 0xea44), seq 1, ack 1, win 512, options [nop,nop,TS val 778251814 ecr 778251814], length 0
2022-04-05 06:36:47.442810 IP (tos 0x0, ttl 64, id 60601, offset 0, flags [DF], proto TCP (6), length 55)
    127.0.0.1.51766 > 127.0.0.1.9250: Flags [P.], cksum 0xfe2b (incorrect -> 0xe538), seq 1:4, ack 1, win 512, options [nop,nop,TS val 778251814 ecr 778251814], length 3
2022-04-05 06:36:47.442818 IP (tos 0x0, ttl 64, id 42522, offset 0, flags [DF], proto TCP (6), length 52)
    127.0.0.1.9250 > 127.0.0.1.51766: Flags [.], cksum 0xfe28 (incorrect -> 0xea41), seq 1, ack 4, win 512, options [nop,nop,TS val 778251814 ecr 778251814], length 0
2022-04-05 06:36:47.442853 IP (tos 0x0, ttl 64, id 42523, offset 0, flags [DF], proto TCP (6), length 54)
    127.0.0.1.9250 > 127.0.0.1.51766: Flags [P.], cksum 0xfe2a (incorrect -> 0xe537), seq 1:3, ack 4, win 512, options [nop,nop,TS val 778251814 ecr 778251814], length 2
2022-04-05 06:36:47.442861 IP (tos 0x0, ttl 64, id 60602, offset 0, flags [DF], proto TCP (6), length 52)
    127.0.0.1.51766 > 127.0.0.1.9250: Flags [.], cksum 0xfe28 (incorrect -> 0xea3f), seq 4, ack 3, win 512, options [nop,nop,TS val 778251814 ecr 778251814], length 0
2022-04-05 06:36:47.444337 IP (tos 0x0, ttl 64, id 60603, offset 0, flags [DF], proto TCP (6), length 62)
    127.0.0.1.51766 > 127.0.0.1.9250: Flags [P.], cksum 0xfe32 (incorrect -> 0xabf6), seq 4:14, ack 3, win 512, options [nop,nop,TS val 778251815 ecr 778251814], length 10
2022-04-05 06:36:47.444357 IP (tos 0x0, ttl 64, id 42524, offset 0, flags [DF], proto TCP (6), length 52)
    127.0.0.1.9250 > 127.0.0.1.51766: Flags [.], cksum 0xfe28 (incorrect -> 0xea33), seq 3, ack 14, win 512, options [nop,nop,TS val 778251815 ecr 778251815], length 0
200, 4.930870532989502, 1.1878628730773926