2022-04-05 06:53:15.966250 IP (tos 0x0, ttl 64, id 41843, offset 0, flags [DF], proto TCP (6), length 60)
    127.0.0.1.42482 > 127.0.0.1.9850: Flags [S], cksum 0xfe30 (incorrect -> 0x0938), seq 1343076428, win 65495, options [mss 65495,sackOK,TS val 779240337 ecr 0,nop,wscale 7], length 0
2022-04-05 06:53:15.966261 IP (tos 0x0, ttl 64, id 0, offset 0, flags [DF], proto TCP (6), length 60)
    127.0.0.1.9850 > 127.0.0.1.42482: Flags [S.], cksum 0xfe30 (incorrect -> 0x4dc4), seq 3471669885, ack 1343076429, win 65483, options [mss 65495,sackOK,TS val 779240337 ecr 779240337,nop,wscale 7], length 0
2022-04-05 06:53:15.966272 IP (tos 0x0, ttl 64, id 41844, offset 0, flags [DF], proto TCP (6), length 52)
    127.0.0.1.42482 > 127.0.0.1.9850: Flags [.], cksum 0xfe28 (incorrect -> 0x7480), seq 1, ack 1, win 512, options [nop,nop,TS val 779240337 ecr 779240337], length 0
2022-04-05 06:53:15.966389 IP (tos 0x0, ttl 64, id 41845, offset 0, flags [DF], proto TCP (6), length 55)
    127.0.0.1.42482 > 127.0.0.1.9850: Flags [P.], cksum 0xfe2b (incorrect -> 0x6f74), seq 1:4, ack 1, win 512, options [nop,nop,TS val 779240337 ecr 779240337], length 3
2022-04-05 06:53:15.966403 IP (tos 0x0, ttl 64, id 51836, offset 0, flags [DF], proto TCP (6), length 52)
    127.0.0.1.9850 > 127.0.0.1.42482: Flags [.], cksum 0xfe28 (incorrect -> 0x747d), seq 1, ack 4, win 512, options [nop,nop,TS val 779240337 ecr 779240337], length 0
2022-04-05 06:53:15.966434 IP (tos 0x0, ttl 64, id 51837, offset 0, flags [DF], proto TCP (6), length 54)
    127.0.0.1.9850 > 127.0.0.1.42482: Flags [P.], cksum 0xfe2a (incorrect -> 0x6f72), seq 1:3, ack 4, win 512, options [nop,nop,TS val 779240338 ecr 779240337], length 2
2022-04-05 06:53:15.966444 IP (tos 0x0, ttl 64, id 41846, offset 0, flags [DF], proto TCP (6), length 52)
    127.0.0.1.42482 > 127.0.0.1.9850: Flags [.], cksum 0xfe28 (incorrect -> 0x7479), seq 4, ack 3, win 512, options [nop,nop,TS val 779240338 ecr 779240338], length 0
2022-04-05 06:53:15.978351 IP (tos 0x0, ttl 64, id 41847, offset 0, flags [DF], proto TCP (6), length 62)
    127.0.0.1.42482 > 127.0.0.1.9850: Flags [P.], cksum 0xfe32 (incorrect -> 0x9577), seq 4:14, ack 3, win 512, options [nop,nop,TS val 779240349 ecr 779240338], length 10
2022-04-05 06:53:15.978366 IP (tos 0x0, ttl 64, id 51838, offset 0, flags [DF], proto TCP (6), length 52)
    127.0.0.1.9850 > 127.0.0.1.42482: Flags [.], cksum 0xfe28 (incorrect -> 0x7459), seq 3, ack 14, win 512, options [nop,nop,TS val 779240349 ecr 779240349], length 0
200, 7.2334065437316895, 0.9758162498474121