2022-04-05 19:47:23.513835 IP (tos 0x0, ttl 64, id 37363, offset 0, flags [DF], proto TCP (6), length 60)
    127.0.0.1.46002 > 127.0.0.1.9250: Flags [S], cksum 0xfe30 (incorrect -> 0x1dc7), seq 3556482381, win 65495, options [mss 65495,sackOK,TS val 270326016 ecr 0,nop,wscale 7], length 0
2022-04-05 19:47:23.513846 IP (tos 0x0, ttl 64, id 0, offset 0, flags [DF], proto TCP (6), length 60)
    127.0.0.1.9250 > 127.0.0.1.46002: Flags [S.], cksum 0xfe30 (incorrect -> 0x1252), seq 4201195497, ack 3556482382, win 65483, options [mss 65495,sackOK,TS val 270326016 ecr 270326016,nop,wscale 7], length 0
2022-04-05 19:47:23.513856 IP (tos 0x0, ttl 64, id 37364, offset 0, flags [DF], proto TCP (6), length 52)
    127.0.0.1.46002 > 127.0.0.1.9250: Flags [.], cksum 0xfe28 (incorrect -> 0x390e), seq 1, ack 1, win 512, options [nop,nop,TS val 270326016 ecr 270326016], length 0
2022-04-05 19:47:23.513951 IP (tos 0x0, ttl 64, id 37365, offset 0, flags [DF], proto TCP (6), length 55)
    127.0.0.1.46002 > 127.0.0.1.9250: Flags [P.], cksum 0xfe2b (incorrect -> 0x3402), seq 1:4, ack 1, win 512, options [nop,nop,TS val 270326016 ecr 270326016], length 3
2022-04-05 19:47:23.513961 IP (tos 0x0, ttl 64, id 25478, offset 0, flags [DF], proto TCP (6), length 52)
    127.0.0.1.9250 > 127.0.0.1.46002: Flags [.], cksum 0xfe28 (incorrect -> 0x390b), seq 1, ack 4, win 512, options [nop,nop,TS val 270326016 ecr 270326016], length 0
2022-04-05 19:47:23.514009 IP (tos 0x0, ttl 64, id 25479, offset 0, flags [DF], proto TCP (6), length 54)
    127.0.0.1.9250 > 127.0.0.1.46002: Flags [P.], cksum 0xfe2a (incorrect -> 0x3401), seq 1:3, ack 4, win 512, options [nop,nop,TS val 270326016 ecr 270326016], length 2
2022-04-05 19:47:23.514024 IP (tos 0x0, ttl 64, id 37366, offset 0, flags [DF], proto TCP (6), length 52)
    127.0.0.1.46002 > 127.0.0.1.9250: Flags [.], cksum 0xfe28 (incorrect -> 0x3909), seq 4, ack 3, win 512, options [nop,nop,TS val 270326016 ecr 270326016], length 0
2022-04-05 19:47:23.516419 IP (tos 0x0, ttl 64, id 37367, offset 0, flags [DF], proto TCP (6), length 62)
    127.0.0.1.46002 > 127.0.0.1.9250: Flags [P.], cksum 0xfe32 (incorrect -> 0x61ea), seq 4:14, ack 3, win 512, options [nop,nop,TS val 270326019 ecr 270326016], length 10
2022-04-05 19:47:23.516446 IP (tos 0x0, ttl 64, id 25480, offset 0, flags [DF], proto TCP (6), length 52)
    127.0.0.1.9250 > 127.0.0.1.46002: Flags [.], cksum 0xfe28 (incorrect -> 0x38f9), seq 3, ack 14, win 512, options [nop,nop,TS val 270326019 ecr 270326019], length 0
200, 41.69845509529114, 0.8000497817993164