2022-04-05 10:57:58.890483 IP (tos 0x0, ttl 64, id 8193, offset 0, flags [DF], proto TCP (6), length 60)
    127.0.0.1.53044 > 127.0.0.1.11750: Flags [S], cksum 0xfe30 (incorrect -> 0xcd8d), seq 2461318139, win 65495, options [mss 65495,sackOK,TS val 238561393 ecr 0,nop,wscale 7], length 0
2022-04-05 10:57:58.890498 IP (tos 0x0, ttl 64, id 0, offset 0, flags [DF], proto TCP (6), length 60)
    127.0.0.1.11750 > 127.0.0.1.53044: Flags [S.], cksum 0xfe30 (incorrect -> 0x5c84), seq 533666444, ack 2461318140, win 65483, options [mss 65495,sackOK,TS val 238561393 ecr 238561393,nop,wscale 7], length 0
2022-04-05 10:57:58.890512 IP (tos 0x0, ttl 64, id 8194, offset 0, flags [DF], proto TCP (6), length 52)
    127.0.0.1.53044 > 127.0.0.1.11750: Flags [.], cksum 0xfe28 (incorrect -> 0x8340), seq 1, ack 1, win 512, options [nop,nop,TS val 238561393 ecr 238561393], length 0
2022-04-05 10:57:58.890631 IP (tos 0x0, ttl 64, id 8195, offset 0, flags [DF], proto TCP (6), length 55)
    127.0.0.1.53044 > 127.0.0.1.11750: Flags [P.], cksum 0xfe2b (incorrect -> 0x7e34), seq 1:4, ack 1, win 512, options [nop,nop,TS val 238561393 ecr 238561393], length 3
2022-04-05 10:57:58.890670 IP (tos 0x0, ttl 64, id 10801, offset 0, flags [DF], proto TCP (6), length 52)
    127.0.0.1.11750 > 127.0.0.1.53044: Flags [.], cksum 0xfe28 (incorrect -> 0x833d), seq 1, ack 4, win 512, options [nop,nop,TS val 238561393 ecr 238561393], length 0
2022-04-05 10:57:58.890761 IP (tos 0x0, ttl 64, id 10802, offset 0, flags [DF], proto TCP (6), length 54)
    127.0.0.1.11750 > 127.0.0.1.53044: Flags [P.], cksum 0xfe2a (incorrect -> 0x7e33), seq 1:3, ack 4, win 512, options [nop,nop,TS val 238561393 ecr 238561393], length 2
2022-04-05 10:57:58.890796 IP (tos 0x0, ttl 64, id 8196, offset 0, flags [DF], proto TCP (6), length 52)
    127.0.0.1.53044 > 127.0.0.1.11750: Flags [.], cksum 0xfe28 (incorrect -> 0x833b), seq 4, ack 3, win 512, options [nop,nop,TS val 238561393 ecr 238561393], length 0
2022-04-05 10:57:58.892049 IP (tos 0x0, ttl 64, id 8197, offset 0, flags [DF], proto TCP (6), length 62)
    127.0.0.1.53044 > 127.0.0.1.11750: Flags [P.], cksum 0xfe32 (incorrect -> 0x29db), seq 4:14, ack 3, win 512, options [nop,nop,TS val 238561394 ecr 238561393], length 10
2022-04-05 10:57:58.892069 IP (tos 0x0, ttl 64, id 10803, offset 0, flags [DF], proto TCP (6), length 52)
    127.0.0.1.11750 > 127.0.0.1.53044: Flags [.], cksum 0xfe28 (incorrect -> 0x832f), seq 3, ack 14, win 512, options [nop,nop,TS val 238561394 ecr 238561394], length 0
2022-04-05 10:57:58.968117 IP (tos 0x0, ttl 64, id 10804, offset 0, flags [DF], proto TCP (6), length 62)
    127.0.0.1.11750 > 127.0.0.1.53044: Flags [P.], cksum 0xfe32 (incorrect -> 0x7dcf), seq 3:13, ack 14, win 512, options [nop,nop,TS val 238561471 ecr 238561394], length 10
2022-04-05 10:57:58.968141 IP (tos 0x0, ttl 64, id 8198, offset 0, flags [DF], proto TCP (6), length 52)
    127.0.0.1.53044 > 127.0.0.1.11750: Flags [.], cksum 0xfe28 (incorrect -> 0x828b), seq 14, ack 13, win 512, options [nop,nop,TS val 238561471 ecr 238561471], length 0
2022-04-05 10:57:58.973885 IP (tos 0x0, ttl 64, id 8199, offset 0, flags [DF], proto TCP (6), length 569)
    127.0.0.1.53044 > 127.0.0.1.11750: Flags [P.], cksum 0x002e (incorrect -> 0xd2da), seq 14:531, ack 13, win 512, options [nop,nop,TS val 238561476 ecr 238561471], length 517
2022-04-05 10:57:58.973907 IP (tos 0x0, ttl 64, id 10805, offset 0, flags [DF], proto TCP (6), length 52)
    127.0.0.1.11750 > 127.0.0.1.53044: Flags [.], cksum 0xfe28 (incorrect -> 0x8080), seq 13, ack 531, win 508, options [nop,nop,TS val 238561476 ecr 238561476], length 0
2022-04-05 10:57:59.061371 IP (tos 0x0, ttl 64, id 10806, offset 0, flags [DF], proto TCP (6), length 3538)
    127.0.0.1.11750 > 127.0.0.1.53044: Flags [P.], cksum 0x0bc7 (incorrect -> 0x24c2), seq 13:3499, ack 531, win 512, options [nop,nop,TS val 238561564 ecr 238561476], length 3486
2022-04-05 10:57:59.061390 IP (tos 0x0, ttl 64, id 8200, offset 0, flags [DF], proto TCP (6), length 52)
    127.0.0.1.53044 > 127.0.0.1.11750: Flags [.], cksum 0xfe28 (incorrect -> 0x7240), seq 531, ack 3499, win 494, options [nop,nop,TS val 238561564 ecr 238561564], length 0
2022-04-05 10:57:59.061965 IP (tos 0x0, ttl 64, id 8201, offset 0, flags [DF], proto TCP (6), length 132)
    127.0.0.1.53044 > 127.0.0.1.11750: Flags [P.], cksum 0xfe78 (incorrect -> 0x8725), seq 531:611, ack 3499, win 494, options [nop,nop,TS val 238561564 ecr 238561564], length 80
2022-04-05 10:57:59.061988 IP (tos 0x0, ttl 64, id 10807, offset 0, flags [DF], proto TCP (6), length 52)
    127.0.0.1.11750 > 127.0.0.1.53044: Flags [.], cksum 0xfe28 (incorrect -> 0x71de), seq 3499, ack 611, win 512, options [nop,nop,TS val 238561564 ecr 238561564], length 0
2022-04-05 10:57:59.062401 IP (tos 0x0, ttl 64, id 8202, offset 0, flags [DF], proto TCP (6), length 408)
    127.0.0.1.53044 > 127.0.0.1.11750: Flags [P.], cksum 0xff8c (incorrect -> 0x70ec), seq 611:967, ack 3499, win 494, options [nop,nop,TS val 238561565 ecr 238561564], length 356
2022-04-05 10:57:59.062420 IP (tos 0x0, ttl 64, id 10808, offset 0, flags [DF], proto TCP (6), length 52)
    127.0.0.1.11750 > 127.0.0.1.53044: Flags [.], cksum 0xfe28 (incorrect -> 0x707a), seq 3499, ack 967, win 510, options [nop,nop,TS val 238561565 ecr 238561565], length 0
200, 3.549370050430298, 0.4213266372680664