2022-04-05 17:04:34.570615 IP (tos 0x0, ttl 64, id 17507, offset 0, flags [DF], proto TCP (6), length 60)
    127.0.0.1.54000 > 127.0.0.1.11050: Flags [S], cksum 0xfe30 (incorrect -> 0x9c92), seq 1974560522, win 65495, options [mss 65495,sackOK,TS val 260557073 ecr 0,nop,wscale 7], length 0
2022-04-05 17:04:34.570625 IP (tos 0x0, ttl 64, id 0, offset 0, flags [DF], proto TCP (6), length 60)
    127.0.0.1.11050 > 127.0.0.1.54000: Flags [S.], cksum 0xfe30 (incorrect -> 0xf393), seq 1555264429, ack 1974560523, win 65483, options [mss 65495,sackOK,TS val 260557073 ecr 260557073,nop,wscale 7], length 0
2022-04-05 17:04:34.570632 IP (tos 0x0, ttl 64, id 17508, offset 0, flags [DF], proto TCP (6), length 52)
    127.0.0.1.54000 > 127.0.0.1.11050: Flags [.], cksum 0xfe28 (incorrect -> 0x1a50), seq 1, ack 1, win 512, options [nop,nop,TS val 260557073 ecr 260557073], length 0
2022-04-05 17:04:34.570765 IP (tos 0x0, ttl 64, id 17509, offset 0, flags [DF], proto TCP (6), length 55)
    127.0.0.1.54000 > 127.0.0.1.11050: Flags [P.], cksum 0xfe2b (incorrect -> 0x1544), seq 1:4, ack 1, win 512, options [nop,nop,TS val 260557073 ecr 260557073], length 3
2022-04-05 17:04:34.570779 IP (tos 0x0, ttl 64, id 37101, offset 0, flags [DF], proto TCP (6), length 52)
    127.0.0.1.11050 > 127.0.0.1.54000: Flags [.], cksum 0xfe28 (incorrect -> 0x1a4d), seq 1, ack 4, win 512, options [nop,nop,TS val 260557073 ecr 260557073], length 0
2022-04-05 17:04:34.570810 IP (tos 0x0, ttl 64, id 37102, offset 0, flags [DF], proto TCP (6), length 54)
    127.0.0.1.11050 > 127.0.0.1.54000: Flags [P.], cksum 0xfe2a (incorrect -> 0x1543), seq 1:3, ack 4, win 512, options [nop,nop,TS val 260557073 ecr 260557073], length 2
2022-04-05 17:04:34.570823 IP (tos 0x0, ttl 64, id 17510, offset 0, flags [DF], proto TCP (6), length 52)
    127.0.0.1.54000 > 127.0.0.1.11050: Flags [.], cksum 0xfe28 (incorrect -> 0x1a4b), seq 4, ack 3, win 512, options [nop,nop,TS val 260557073 ecr 260557073], length 0
2022-04-05 17:04:34.572259 IP (tos 0x0, ttl 64, id 17511, offset 0, flags [DF], proto TCP (6), length 62)
    127.0.0.1.54000 > 127.0.0.1.11050: Flags [P.], cksum 0xfe32 (incorrect -> 0xfd64), seq 4:14, ack 3, win 512, options [nop,nop,TS val 260557075 ecr 260557073], length 10
2022-04-05 17:04:34.572276 IP (tos 0x0, ttl 64, id 37103, offset 0, flags [DF], proto TCP (6), length 52)
    127.0.0.1.11050 > 127.0.0.1.54000: Flags [.], cksum 0xfe28 (incorrect -> 0x1a3d), seq 3, ack 14, win 512, options [nop,nop,TS val 260557075 ecr 260557075], length 0
2022-04-05 17:04:34.659602 IP (tos 0x0, ttl 64, id 37104, offset 0, flags [DF], proto TCP (6), length 62)
    127.0.0.1.11050 > 127.0.0.1.54000: Flags [P.], cksum 0xfe32 (incorrect -> 0x14d3), seq 3:13, ack 14, win 512, options [nop,nop,TS val 260557162 ecr 260557075], length 10
2022-04-05 17:04:34.659617 IP (tos 0x0, ttl 64, id 17512, offset 0, flags [DF], proto TCP (6), length 52)
    127.0.0.1.54000 > 127.0.0.1.11050: Flags [.], cksum 0xfe28 (incorrect -> 0x1985), seq 14, ack 13, win 512, options [nop,nop,TS val 260557162 ecr 260557162], length 0
2022-04-05 17:04:34.665530 IP (tos 0x0, ttl 64, id 17513, offset 0, flags [DF], proto TCP (6), length 569)
    127.0.0.1.54000 > 127.0.0.1.11050: Flags [P.], cksum 0x002e (incorrect -> 0x932f), seq 14:531, ack 13, win 512, options [nop,nop,TS val 260557168 ecr 260557162], length 517
2022-04-05 17:04:34.665539 IP (tos 0x0, ttl 64, id 37105, offset 0, flags [DF], proto TCP (6), length 52)
    127.0.0.1.11050 > 127.0.0.1.54000: Flags [.], cksum 0xfe28 (incorrect -> 0x1778), seq 13, ack 531, win 508, options [nop,nop,TS val 260557168 ecr 260557168], length 0
2022-04-05 17:04:34.743574 IP (tos 0x0, ttl 64, id 37106, offset 0, flags [DF], proto TCP (6), length 2864)
    127.0.0.1.11050 > 127.0.0.1.54000: Flags [P.], cksum 0x0925 (incorrect -> 0x58d2), seq 13:2825, ack 531, win 512, options [nop,nop,TS val 260557246 ecr 260557168], length 2812
2022-04-05 17:04:34.743581 IP (tos 0x0, ttl 64, id 17514, offset 0, flags [DF], proto TCP (6), length 52)
    127.0.0.1.54000 > 127.0.0.1.11050: Flags [.], cksum 0xfe28 (incorrect -> 0x0beb), seq 531, ack 2825, win 497, options [nop,nop,TS val 260557246 ecr 260557246], length 0
2022-04-05 17:04:34.744854 IP (tos 0x0, ttl 64, id 17515, offset 0, flags [DF], proto TCP (6), length 116)
    127.0.0.1.54000 > 127.0.0.1.11050: Flags [P.], cksum 0xfe68 (incorrect -> 0x38b3), seq 531:595, ack 2825, win 512, options [nop,nop,TS val 260557247 ecr 260557246], length 64
2022-04-05 17:04:34.744863 IP (tos 0x0, ttl 64, id 37107, offset 0, flags [DF], proto TCP (6), length 52)
    127.0.0.1.11050 > 127.0.0.1.54000: Flags [.], cksum 0xfe28 (incorrect -> 0x0b9a), seq 2825, ack 595, win 512, options [nop,nop,TS val 260557247 ecr 260557247], length 0
2022-04-05 17:04:34.745177 IP (tos 0x0, ttl 64, id 17516, offset 0, flags [DF], proto TCP (6), length 292)
    127.0.0.1.54000 > 127.0.0.1.11050: Flags [P.], cksum 0xff18 (incorrect -> 0x2140), seq 595:835, ack 2825, win 512, options [nop,nop,TS val 260557248 ecr 260557247], length 240
2022-04-05 17:04:34.745186 IP (tos 0x0, ttl 64, id 37108, offset 0, flags [DF], proto TCP (6), length 52)
    127.0.0.1.11050 > 127.0.0.1.54000: Flags [.], cksum 0xfe28 (incorrect -> 0x0aa9), seq 2825, ack 835, win 511, options [nop,nop,TS val 260557248 ecr 260557248], length 0
2022-04-05 17:04:34.821118 IP (tos 0x0, ttl 64, id 37109, offset 0, flags [DF], proto TCP (6), length 307)
    127.0.0.1.11050 > 127.0.0.1.54000: Flags [P.], cksum 0xff27 (incorrect -> 0xe9df), seq 2825:3080, ack 835, win 512, options [nop,nop,TS val 260557324 ecr 260557248], length 255
2022-04-05 17:04:34.821134 IP (tos 0x0, ttl 64, id 17517, offset 0, flags [DF], proto TCP (6), length 52)
    127.0.0.1.54000 > 127.0.0.1.11050: Flags [.], cksum 0xfe28 (incorrect -> 0x0912), seq 835, ack 3080, win 511, options [nop,nop,TS val 260557324 ecr 260557324], length 0
2022-04-05 17:04:34.967687 IP (tos 0x0, ttl 64, id 37110, offset 0, flags [DF], proto TCP (6), length 1944)
    127.0.0.1.11050 > 127.0.0.1.54000: Flags [P.], cksum 0x058d (incorrect -> 0xd5dc), seq 3080:4972, ack 835, win 512, options [nop,nop,TS val 260557470 ecr 260557324], length 1892
2022-04-05 17:04:34.967697 IP (tos 0x0, ttl 64, id 17518, offset 0, flags [DF], proto TCP (6), length 52)
    127.0.0.1.54000 > 127.0.0.1.11050: Flags [.], cksum 0xfe28 (incorrect -> 0x0095), seq 835, ack 4972, win 500, options [nop,nop,TS val 260557470 ecr 260557470], length 0
2022-04-05 17:04:34.990684 IP (tos 0x0, ttl 64, id 37111, offset 0, flags [DF], proto TCP (6), length 79)
    127.0.0.1.11050 > 127.0.0.1.54000: Flags [P.], cksum 0xfe43 (incorrect -> 0x3bf2), seq 4972:4999, ack 835, win 512, options [nop,nop,TS val 260557493 ecr 260557470], length 27
2022-04-05 17:04:34.990692 IP (tos 0x0, ttl 64, id 17519, offset 0, flags [DF], proto TCP (6), length 52)
    127.0.0.1.54000 > 127.0.0.1.11050: Flags [.], cksum 0xfe28 (incorrect -> 0x0045), seq 835, ack 4999, win 507, options [nop,nop,TS val 260557493 ecr 260557493], length 0
2022-04-05 17:04:34.992845 IP (tos 0x0, ttl 64, id 17520, offset 0, flags [DF], proto TCP (6), length 996)
    127.0.0.1.54000 > 127.0.0.1.11050: Flags [P.], cksum 0x01d9 (incorrect -> 0x9a4a), seq 835:1779, ack 4999, win 512, options [nop,nop,TS val 260557495 ecr 260557493], length 944
2022-04-05 17:04:34.992855 IP (tos 0x0, ttl 64, id 37112, offset 0, flags [DF], proto TCP (6), length 52)
    127.0.0.1.11050 > 127.0.0.1.54000: Flags [.], cksum 0xfe28 (incorrect -> 0xfc92), seq 4999, ack 1779, win 505, options [nop,nop,TS val 260557495 ecr 260557495], length 0
2022-04-05 17:04:35.791198 IP (tos 0x0, ttl 64, id 37113, offset 0, flags [DF], proto TCP (6), length 3538)
    127.0.0.1.11050 > 127.0.0.1.54000: Flags [P.], cksum 0x0bc7 (incorrect -> 0x139d), seq 4999:8485, ack 1779, win 512, options [nop,nop,TS val 260558294 ecr 260557495], length 3486
2022-04-05 17:04:35.838660 IP (tos 0x0, ttl 64, id 17521, offset 0, flags [DF], proto TCP (6), length 52)
    127.0.0.1.54000 > 127.0.0.1.11050: Flags [.], cksum 0xfe28 (incorrect -> 0xe880), seq 1779, ack 8485, win 512, options [nop,nop,TS val 260558341 ecr 260558294], length 0
2022-04-05 17:04:35.851507 IP (tos 0x0, ttl 64, id 37114, offset 0, flags [DF], proto TCP (6), length 2134)
    127.0.0.1.11050 > 127.0.0.1.54000: Flags [P.], cksum 0x064b (incorrect -> 0x3658), seq 8485:10567, ack 1779, win 512, options [nop,nop,TS val 260558354 ecr 260558341], length 2082
2022-04-05 17:04:35.851519 IP (tos 0x0, ttl 64, id 17522, offset 0, flags [DF], proto TCP (6), length 52)
    127.0.0.1.54000 > 127.0.0.1.11050: Flags [.], cksum 0xfe28 (incorrect -> 0xe022), seq 1779, ack 10567, win 499, options [nop,nop,TS val 260558354 ecr 260558354], length 0
2022-04-05 17:04:36.468000 IP (tos 0x0, ttl 64, id 37115, offset 0, flags [DF], proto TCP (6), length 3538)
    127.0.0.1.11050 > 127.0.0.1.54000: Flags [P.], cksum 0x0bc7 (incorrect -> 0xab36), seq 10567:14053, ack 1779, win 512, options [nop,nop,TS val 260558970 ecr 260558354], length 3486
2022-04-05 17:04:36.468016 IP (tos 0x0, ttl 64, id 17523, offset 0, flags [DF], proto TCP (6), length 52)
    127.0.0.1.54000 > 127.0.0.1.11050: Flags [.], cksum 0xfe28 (incorrect -> 0xcdb9), seq 1779, ack 14053, win 494, options [nop,nop,TS val 260558970 ecr 260558970], length 0
2022-04-05 17:04:36.487666 IP (tos 0x0, ttl 64, id 37116, offset 0, flags [DF], proto TCP (6), length 3538)
    127.0.0.1.11050 > 127.0.0.1.54000: Flags [P.], cksum 0x0bc7 (incorrect -> 0x1afe), seq 14053:17539, ack 1779, win 512, options [nop,nop,TS val 260558990 ecr 260558970], length 3486
2022-04-05 17:04:36.487672 IP (tos 0x0, ttl 64, id 17524, offset 0, flags [DF], proto TCP (6), length 52)
    127.0.0.1.54000 > 127.0.0.1.11050: Flags [.], cksum 0xfe28 (incorrect -> 0xbff3), seq 1779, ack 17539, win 494, options [nop,nop,TS val 260558990 ecr 260558990], length 0
2022-04-05 17:04:36.501553 IP (tos 0x0, ttl 64, id 37117, offset 0, flags [DF], proto TCP (6), length 550)
    127.0.0.1.11050 > 127.0.0.1.54000: Flags [P.], cksum 0x001b (incorrect -> 0xbc05), seq 17539:18037, ack 1779, win 512, options [nop,nop,TS val 260559004 ecr 260558990], length 498
2022-04-05 17:04:36.501558 IP (tos 0x0, ttl 64, id 17525, offset 0, flags [DF], proto TCP (6), length 52)
    127.0.0.1.54000 > 127.0.0.1.11050: Flags [.], cksum 0xfe28 (incorrect -> 0xbdd9), seq 1779, ack 18037, win 506, options [nop,nop,TS val 260559004 ecr 260559004], length 0
2022-04-05 17:04:36.515395 IP (tos 0x0, ttl 64, id 37118, offset 0, flags [DF], proto TCP (6), length 3496)
    127.0.0.1.11050 > 127.0.0.1.54000: Flags [P.], cksum 0x0b9d (incorrect -> 0xb1b0), seq 18037:21481, ack 1779, win 512, options [nop,nop,TS val 260559018 ecr 260559004], length 3444
2022-04-05 17:04:36.515402 IP (tos 0x0, ttl 64, id 17526, offset 0, flags [DF], proto TCP (6), length 52)
    127.0.0.1.54000 > 127.0.0.1.11050: Flags [.], cksum 0xfe28 (incorrect -> 0xb055), seq 1779, ack 21481, win 494, options [nop,nop,TS val 260559018 ecr 260559018], length 0
2022-04-05 17:04:36.529331 IP (tos 0x0, ttl 64, id 37119, offset 0, flags [DF], proto TCP (6), length 2934)
    127.0.0.1.11050 > 127.0.0.1.54000: Flags [P.], cksum 0x096b (incorrect -> 0x0910), seq 21481:24363, ack 1779, win 512, options [nop,nop,TS val 260559032 ecr 260559018], length 2882
2022-04-05 17:04:36.529346 IP (tos 0x0, ttl 64, id 17527, offset 0, flags [DF], proto TCP (6), length 52)
    127.0.0.1.54000 > 127.0.0.1.11050: Flags [.], cksum 0xfe28 (incorrect -> 0xa4f5), seq 1779, ack 24363, win 496, options [nop,nop,TS val 260559032 ecr 260559032], length 0
2022-04-05 17:04:36.534314 IP (tos 0x0, ttl 64, id 37120, offset 0, flags [DF], proto TCP (6), length 3538)
    127.0.0.1.11050 > 127.0.0.1.54000: Flags [P.], cksum 0x0bc7 (incorrect -> 0xf89c), seq 24363:27849, ack 1779, win 512, options [nop,nop,TS val 260559037 ecr 260559032], length 3486
2022-04-05 17:04:36.534322 IP (tos 0x0, ttl 64, id 17528, offset 0, flags [DF], proto TCP (6), length 52)
    127.0.0.1.54000 > 127.0.0.1.11050: Flags [.], cksum 0xfe28 (incorrect -> 0x974f), seq 1779, ack 27849, win 494, options [nop,nop,TS val 260559037 ecr 260559037], length 0
2022-04-05 17:04:36.540681 IP (tos 0x0, ttl 64, id 37121, offset 0, flags [DF], proto TCP (6), length 4036)
    127.0.0.1.11050 > 127.0.0.1.54000: Flags [P.], cksum 0x0db9 (incorrect -> 0xc491), seq 27849:31833, ack 1779, win 512, options [nop,nop,TS val 260559043 ecr 260559037], length 3984
2022-04-05 17:04:36.540694 IP (tos 0x0, ttl 64, id 17529, offset 0, flags [DF], proto TCP (6), length 52)
    127.0.0.1.54000 > 127.0.0.1.11050: Flags [.], cksum 0xfe28 (incorrect -> 0x87b5), seq 1779, ack 31833, win 492, options [nop,nop,TS val 260559043 ecr 260559043], length 0
2022-04-05 17:04:36.543041 IP (tos 0x0, ttl 64, id 37122, offset 0, flags [DF], proto TCP (6), length 4036)
    127.0.0.1.11050 > 127.0.0.1.54000: Flags [P.], cksum 0x0db9 (incorrect -> 0x0013), seq 31833:35817, ack 1779, win 512, options [nop,nop,TS val 260559045 ecr 260559043], length 3984
2022-04-05 17:04:36.543049 IP (tos 0x0, ttl 64, id 17530, offset 0, flags [DF], proto TCP (6), length 52)
    127.0.0.1.54000 > 127.0.0.1.11050: Flags [.], cksum 0xfe28 (incorrect -> 0x7821), seq 1779, ack 35817, win 492, options [nop,nop,TS val 260559045 ecr 260559045], length 0
2022-04-05 17:04:36.557714 IP (tos 0x0, ttl 64, id 37123, offset 0, flags [DF], proto TCP (6), length 3538)
    127.0.0.1.11050 > 127.0.0.1.54000: Flags [P.], cksum 0x0bc7 (incorrect -> 0x46e7), seq 35817:39303, ack 1779, win 512, options [nop,nop,TS val 260559060 ecr 260559045], length 3486
2022-04-05 17:04:36.557720 IP (tos 0x0, ttl 64, id 17531, offset 0, flags [DF], proto TCP (6), length 52)
    127.0.0.1.54000 > 127.0.0.1.11050: Flags [.], cksum 0xfe28 (incorrect -> 0x6a63), seq 1779, ack 39303, win 494, options [nop,nop,TS val 260559060 ecr 260559060], length 0
2022-04-05 17:04:36.562364 IP (tos 0x0, ttl 64, id 37124, offset 0, flags [DF], proto TCP (6), length 3538)
    127.0.0.1.11050 > 127.0.0.1.54000: Flags [P.], cksum 0x0bc7 (incorrect -> 0xe80c), seq 39303:42789, ack 1779, win 512, options [nop,nop,TS val 260559065 ecr 260559060], length 3486
2022-04-05 17:04:36.602655 IP (tos 0x0, ttl 64, id 17532, offset 0, flags [DF], proto TCP (6), length 52)
    127.0.0.1.54000 > 127.0.0.1.11050: Flags [.], cksum 0xfe28 (incorrect -> 0x5c81), seq 1779, ack 42789, win 512, options [nop,nop,TS val 260559105 ecr 260559065], length 0
2022-04-05 17:04:36.602661 IP (tos 0x0, ttl 64, id 37125, offset 0, flags [DF], proto TCP (6), length 4534)
    127.0.0.1.11050 > 127.0.0.1.54000: Flags [P.], cksum 0x0fab (incorrect -> 0x1242), seq 42789:47271, ack 1779, win 512, options [nop,nop,TS val 260559105 ecr 260559105], length 4482
2022-04-05 17:04:36.640177 IP (tos 0x0, ttl 64, id 37126, offset 0, flags [DF], proto TCP (6), length 32820)
    127.0.0.1.11050 > 127.0.0.1.54000: Flags [.], cksum 0x7e29 (incorrect -> 0x78a2), seq 47271:80039, ack 1779, win 512, options [nop,nop,TS val 260559143 ecr 260559105], length 32768
2022-04-05 17:04:36.640185 IP (tos 0x0, ttl 64, id 17533, offset 0, flags [DF], proto TCP (6), length 52)
    127.0.0.1.54000 > 127.0.0.1.11050: Flags [.], cksum 0xfe28 (incorrect -> 0xcb35), seq 1779, ack 80039, win 379, options [nop,nop,TS val 260559143 ecr 260559105], length 0
2022-04-05 17:04:36.640192 IP (tos 0x0, ttl 64, id 37127, offset 0, flags [DF], proto TCP (6), length 146)
    127.0.0.1.11050 > 127.0.0.1.54000: Flags [P.], cksum 0xfe86 (incorrect -> 0x1e5b), seq 80039:80133, ack 1779, win 512, options [nop,nop,TS val 260559143 ecr 260559143], length 94
2022-04-05 17:04:36.640684 IP (tos 0x0, ttl 64, id 17534, offset 0, flags [DF], proto TCP (6), length 52)
    127.0.0.1.54000 > 127.0.0.1.11050: Flags [.], cksum 0xfe28 (incorrect -> 0xca2c), seq 1779, ack 80133, win 512, options [nop,nop,TS val 260559143 ecr 260559143], length 0
2022-04-05 17:04:36.640689 IP (tos 0x0, ttl 64, id 37128, offset 0, flags [DF], proto TCP (6), length 486)
    127.0.0.1.11050 > 127.0.0.1.54000: Flags [P.], cksum 0xffda (incorrect -> 0x81af), seq 80133:80567, ack 1779, win 512, options [nop,nop,TS val 260559143 ecr 260559143], length 434
2022-04-05 17:04:36.640692 IP (tos 0x0, ttl 64, id 17535, offset 0, flags [DF], proto TCP (6), length 52)
    127.0.0.1.54000 > 127.0.0.1.11050: Flags [.], cksum 0xfe28 (incorrect -> 0xc87a), seq 1779, ack 80567, win 512, options [nop,nop,TS val 260559143 ecr 260559143], length 0
2022-04-05 17:04:36.659654 IP (tos 0x0, ttl 64, id 37129, offset 0, flags [DF], proto TCP (6), length 3216)
    127.0.0.1.11050 > 127.0.0.1.54000: Flags [P.], cksum 0x0a85 (incorrect -> 0x2ba7), seq 80567:83731, ack 1779, win 512, options [nop,nop,TS val 260559162 ecr 260559143], length 3164
2022-04-05 17:04:36.659670 IP (tos 0x0, ttl 64, id 17536, offset 0, flags [DF], proto TCP (6), length 52)
    127.0.0.1.54000 > 127.0.0.1.11050: Flags [.], cksum 0xfe28 (incorrect -> 0xbbf8), seq 1779, ack 83731, win 512, options [nop,nop,TS val 260559162 ecr 260559162], length 0
2022-04-05 17:04:36.661122 IP (tos 0x0, ttl 64, id 37130, offset 0, flags [DF], proto TCP (6), length 1048)
    127.0.0.1.11050 > 127.0.0.1.54000: Flags [P.], cksum 0x020d (incorrect -> 0x4211), seq 83731:84727, ack 1779, win 512, options [nop,nop,TS val 260559164 ecr 260559162], length 996
2022-04-05 17:04:36.661133 IP (tos 0x0, ttl 64, id 17537, offset 0, flags [DF], proto TCP (6), length 52)
    127.0.0.1.54000 > 127.0.0.1.11050: Flags [.], cksum 0xfe28 (incorrect -> 0xb810), seq 1779, ack 84727, win 512, options [nop,nop,TS val 260559164 ecr 260559164], length 0
2022-04-05 17:04:36.671152 IP (tos 0x0, ttl 64, id 37131, offset 0, flags [DF], proto TCP (6), length 3538)
    127.0.0.1.11050 > 127.0.0.1.54000: Flags [P.], cksum 0x0bc7 (incorrect -> 0x718c), seq 84727:88213, ack 1779, win 512, options [nop,nop,TS val 260559174 ecr 260559164], length 3486
2022-04-05 17:04:36.671415 IP (tos 0x0, ttl 64, id 17538, offset 0, flags [DF], proto TCP (6), length 52)
    127.0.0.1.54000 > 127.0.0.1.11050: Flags [.], cksum 0xfe28 (incorrect -> 0xaa5e), seq 1779, ack 88213, win 512, options [nop,nop,TS val 260559174 ecr 260559174], length 0
2022-04-05 17:04:36.673879 IP (tos 0x0, ttl 64, id 37132, offset 0, flags [DF], proto TCP (6), length 3806)
    127.0.0.1.11050 > 127.0.0.1.54000: Flags [P.], cksum 0x0cd3 (incorrect -> 0xf208), seq 88213:91967, ack 1779, win 512, options [nop,nop,TS val 260559176 ecr 260559174], length 3754
2022-04-05 17:04:36.673891 IP (tos 0x0, ttl 64, id 17539, offset 0, flags [DF], proto TCP (6), length 52)
    127.0.0.1.54000 > 127.0.0.1.11050: Flags [.], cksum 0xfe28 (incorrect -> 0x9bb0), seq 1779, ack 91967, win 512, options [nop,nop,TS val 260559176 ecr 260559176], length 0
2022-04-05 17:04:36.677372 IP (tos 0x0, ttl 64, id 37133, offset 0, flags [DF], proto TCP (6), length 3538)
    127.0.0.1.11050 > 127.0.0.1.54000: Flags [P.], cksum 0x0bc7 (incorrect -> 0x5f6b), seq 91967:95453, ack 1779, win 512, options [nop,nop,TS val 260559180 ecr 260559176], length 3486
2022-04-05 17:04:36.677385 IP (tos 0x0, ttl 64, id 17540, offset 0, flags [DF], proto TCP (6), length 52)
    127.0.0.1.54000 > 127.0.0.1.11050: Flags [.], cksum 0xfe28 (incorrect -> 0x8e0a), seq 1779, ack 95453, win 512, options [nop,nop,TS val 260559180 ecr 260559180], length 0
2022-04-05 17:04:36.677493 IP (tos 0x0, ttl 64, id 37134, offset 0, flags [DF], proto TCP (6), length 4036)
    127.0.0.1.11050 > 127.0.0.1.54000: Flags [P.], cksum 0x0db9 (incorrect -> 0x23d3), seq 95453:99437, ack 1779, win 512, options [nop,nop,TS val 260559180 ecr 260559180], length 3984
2022-04-05 17:04:36.677845 IP (tos 0x0, ttl 64, id 17541, offset 0, flags [DF], proto TCP (6), length 52)
    127.0.0.1.54000 > 127.0.0.1.11050: Flags [.], cksum 0xfe28 (incorrect -> 0x7e7a), seq 1779, ack 99437, win 512, options [nop,nop,TS val 260559180 ecr 260559180], length 0
2022-04-05 17:04:36.684698 IP (tos 0x0, ttl 64, id 37135, offset 0, flags [DF], proto TCP (6), length 4100)
    127.0.0.1.11050 > 127.0.0.1.54000: Flags [P.], cksum 0x0df9 (incorrect -> 0x3289), seq 99437:103485, ack 1779, win 512, options [nop,nop,TS val 260559187 ecr 260559180], length 4048
2022-04-05 17:04:36.684717 IP (tos 0x0, ttl 64, id 17542, offset 0, flags [DF], proto TCP (6), length 52)
    127.0.0.1.54000 > 127.0.0.1.11050: Flags [.], cksum 0xfe28 (incorrect -> 0x6e9c), seq 1779, ack 103485, win 512, options [nop,nop,TS val 260559187 ecr 260559187], length 0
2022-04-05 17:04:36.684720 IP (tos 0x0, ttl 64, id 37136, offset 0, flags [DF], proto TCP (6), length 708)
    127.0.0.1.11050 > 127.0.0.1.54000: Flags [P.], cksum 0x00b9 (incorrect -> 0xe8fe), seq 103485:104141, ack 1779, win 512, options [nop,nop,TS val 260559187 ecr 260559187], length 656
2022-04-05 17:04:36.684723 IP (tos 0x0, ttl 64, id 17543, offset 0, flags [DF], proto TCP (6), length 52)
    127.0.0.1.54000 > 127.0.0.1.11050: Flags [.], cksum 0xfe28 (incorrect -> 0x6c0c), seq 1779, ack 104141, win 512, options [nop,nop,TS val 260559187 ecr 260559187], length 0
2022-04-05 17:04:36.691078 IP (tos 0x0, ttl 64, id 37137, offset 0, flags [DF], proto TCP (6), length 3308)
    127.0.0.1.11050 > 127.0.0.1.54000: Flags [P.], cksum 0x0ae1 (incorrect -> 0xaf07), seq 104141:107397, ack 1779, win 512, options [nop,nop,TS val 260559194 ecr 260559187], length 3256
2022-04-05 17:04:36.691091 IP (tos 0x0, ttl 64, id 17544, offset 0, flags [DF], proto TCP (6), length 52)
    127.0.0.1.54000 > 127.0.0.1.11050: Flags [.], cksum 0xfe28 (incorrect -> 0x5f46), seq 1779, ack 107397, win 512, options [nop,nop,TS val 260559194 ecr 260559194], length 0
2022-04-05 17:04:36.715287 IP (tos 0x0, ttl 64, id 37138, offset 0, flags [DF], proto TCP (6), length 3538)
    127.0.0.1.11050 > 127.0.0.1.54000: Flags [P.], cksum 0x0bc7 (incorrect -> 0x212f), seq 107397:110883, ack 1779, win 512, options [nop,nop,TS val 260559218 ecr 260559194], length 3486
2022-04-05 17:04:36.715314 IP (tos 0x0, ttl 64, id 17545, offset 0, flags [DF], proto TCP (6), length 52)
    127.0.0.1.54000 > 127.0.0.1.11050: Flags [.], cksum 0xfe28 (incorrect -> 0x5178), seq 1779, ack 110883, win 512, options [nop,nop,TS val 260559218 ecr 260559218], length 0
2022-04-05 17:04:36.715317 IP (tos 0x0, ttl 64, id 37139, offset 0, flags [DF], proto TCP (6), length 1408)
    127.0.0.1.11050 > 127.0.0.1.54000: Flags [P.], cksum 0x0375 (incorrect -> 0x26db), seq 110883:112239, ack 1779, win 512, options [nop,nop,TS val 260559218 ecr 260559218], length 1356
2022-04-05 17:04:36.715321 IP (tos 0x0, ttl 64, id 17546, offset 0, flags [DF], proto TCP (6), length 52)
    127.0.0.1.54000 > 127.0.0.1.11050: Flags [.], cksum 0xfe28 (incorrect -> 0x4c2c), seq 1779, ack 112239, win 512, options [nop,nop,TS val 260559218 ecr 260559218], length 0
2022-04-05 17:04:36.715444 IP (tos 0x0, ttl 64, id 37140, offset 0, flags [DF], proto TCP (6), length 3538)
    127.0.0.1.11050 > 127.0.0.1.54000: Flags [P.], cksum 0x0bc7 (incorrect -> 0xe1df), seq 112239:115725, ack 1779, win 512, options [nop,nop,TS val 260559218 ecr 260559218], length 3486
2022-04-05 17:04:36.715639 IP (tos 0x0, ttl 64, id 17547, offset 0, flags [DF], proto TCP (6), length 52)
    127.0.0.1.54000 > 127.0.0.1.11050: Flags [.], cksum 0xfe28 (incorrect -> 0x3e8e), seq 1779, ack 115725, win 512, options [nop,nop,TS val 260559218 ecr 260559218], length 0
2022-04-05 17:04:36.725891 IP (tos 0x0, ttl 64, id 37141, offset 0, flags [DF], proto TCP (6), length 4100)
    127.0.0.1.11050 > 127.0.0.1.54000: Flags [P.], cksum 0x0df9 (incorrect -> 0x3aea), seq 115725:119773, ack 1779, win 512, options [nop,nop,TS val 260559228 ecr 260559218], length 4048
2022-04-05 17:04:36.725949 IP (tos 0x0, ttl 64, id 17548, offset 0, flags [DF], proto TCP (6), length 52)
    127.0.0.1.54000 > 127.0.0.1.11050: Flags [.], cksum 0xfe28 (incorrect -> 0x2eaa), seq 1779, ack 119773, win 512, options [nop,nop,TS val 260559228 ecr 260559228], length 0
2022-04-05 17:04:36.725953 IP (tos 0x0, ttl 64, id 37142, offset 0, flags [DF], proto TCP (6), length 3290)
    127.0.0.1.11050 > 127.0.0.1.54000: Flags [P.], cksum 0x0acf (incorrect -> 0x87de), seq 119773:123011, ack 1779, win 512, options [nop,nop,TS val 260559228 ecr 260559228], length 3238
2022-04-05 17:04:36.726163 IP (tos 0x0, ttl 64, id 17549, offset 0, flags [DF], proto TCP (6), length 52)
    127.0.0.1.54000 > 127.0.0.1.11050: Flags [.], cksum 0xfe28 (incorrect -> 0x2203), seq 1779, ack 123011, win 512, options [nop,nop,TS val 260559229 ecr 260559228], length 0
200, 4.77648138999939, 2.2195208072662354