2022-04-05 14:32:51.543497 IP (tos 0x0, ttl 64, id 24686, offset 0, flags [DF], proto TCP (6), length 60)
    127.0.0.1.45074 > 127.0.0.1.9950: Flags [S], cksum 0xfe30 (incorrect -> 0xea04), seq 947479864, win 65495, options [mss 65495,sackOK,TS val 251454046 ecr 0,nop,wscale 7], length 0
2022-04-05 14:32:51.543507 IP (tos 0x0, ttl 64, id 0, offset 0, flags [DF], proto TCP (6), length 60)
    127.0.0.1.9950 > 127.0.0.1.45074: Flags [S.], cksum 0xfe30 (incorrect -> 0x5dbe), seq 3051742464, ack 947479865, win 65483, options [mss 65495,sackOK,TS val 251454046 ecr 251454046,nop,wscale 7], length 0
2022-04-05 14:32:51.543515 IP (tos 0x0, ttl 64, id 24687, offset 0, flags [DF], proto TCP (6), length 52)
    127.0.0.1.45074 > 127.0.0.1.9950: Flags [.], cksum 0xfe28 (incorrect -> 0x847a), seq 1, ack 1, win 512, options [nop,nop,TS val 251454046 ecr 251454046], length 0
2022-04-05 14:32:51.543613 IP (tos 0x0, ttl 64, id 24688, offset 0, flags [DF], proto TCP (6), length 55)
    127.0.0.1.45074 > 127.0.0.1.9950: Flags [P.], cksum 0xfe2b (incorrect -> 0x7f6e), seq 1:4, ack 1, win 512, options [nop,nop,TS val 251454046 ecr 251454046], length 3
2022-04-05 14:32:51.543630 IP (tos 0x0, ttl 64, id 34227, offset 0, flags [DF], proto TCP (6), length 52)
    127.0.0.1.9950 > 127.0.0.1.45074: Flags [.], cksum 0xfe28 (incorrect -> 0x8477), seq 1, ack 4, win 512, options [nop,nop,TS val 251454046 ecr 251454046], length 0
2022-04-05 14:32:51.543693 IP (tos 0x0, ttl 64, id 34228, offset 0, flags [DF], proto TCP (6), length 54)
    127.0.0.1.9950 > 127.0.0.1.45074: Flags [P.], cksum 0xfe2a (incorrect -> 0x7f6d), seq 1:3, ack 4, win 512, options [nop,nop,TS val 251454046 ecr 251454046], length 2
2022-04-05 14:32:51.543713 IP (tos 0x0, ttl 64, id 24689, offset 0, flags [DF], proto TCP (6), length 52)
    127.0.0.1.45074 > 127.0.0.1.9950: Flags [.], cksum 0xfe28 (incorrect -> 0x8475), seq 4, ack 3, win 512, options [nop,nop,TS val 251454046 ecr 251454046], length 0
2022-04-05 14:32:51.545357 IP (tos 0x0, ttl 64, id 24690, offset 0, flags [DF], proto TCP (6), length 62)
    127.0.0.1.45074 > 127.0.0.1.9950: Flags [P.], cksum 0xfe32 (incorrect -> 0x09c4), seq 4:14, ack 3, win 512, options [nop,nop,TS val 251454048 ecr 251454046], length 10
2022-04-05 14:32:51.545379 IP (tos 0x0, ttl 64, id 34229, offset 0, flags [DF], proto TCP (6), length 52)
    127.0.0.1.9950 > 127.0.0.1.45074: Flags [.], cksum 0xfe28 (incorrect -> 0x8467), seq 3, ack 14, win 512, options [nop,nop,TS val 251454048 ecr 251454048], length 0
2022-04-05 14:32:51.625621 IP (tos 0x0, ttl 64, id 34230, offset 0, flags [DF], proto TCP (6), length 62)
    127.0.0.1.9950 > 127.0.0.1.45074: Flags [P.], cksum 0xfe32 (incorrect -> 0x7f04), seq 3:13, ack 14, win 512, options [nop,nop,TS val 251454128 ecr 251454048], length 10
2022-04-05 14:32:51.625636 IP (tos 0x0, ttl 64, id 24691, offset 0, flags [DF], proto TCP (6), length 52)
    127.0.0.1.45074 > 127.0.0.1.9950: Flags [.], cksum 0xfe28 (incorrect -> 0x83bd), seq 14, ack 13, win 512, options [nop,nop,TS val 251454128 ecr 251454128], length 0
2022-04-05 14:32:51.631468 IP (tos 0x0, ttl 64, id 24692, offset 0, flags [DF], proto TCP (6), length 569)
    127.0.0.1.45074 > 127.0.0.1.9950: Flags [P.], cksum 0x002e (incorrect -> 0x9d40), seq 14:531, ack 13, win 512, options [nop,nop,TS val 251454134 ecr 251454128], length 517
2022-04-05 14:32:51.631478 IP (tos 0x0, ttl 64, id 34231, offset 0, flags [DF], proto TCP (6), length 52)
    127.0.0.1.9950 > 127.0.0.1.45074: Flags [.], cksum 0xfe28 (incorrect -> 0x81b0), seq 13, ack 531, win 508, options [nop,nop,TS val 251454134 ecr 251454134], length 0
2022-04-05 14:32:51.705790 IP (tos 0x0, ttl 64, id 34232, offset 0, flags [DF], proto TCP (6), length 3538)
    127.0.0.1.9950 > 127.0.0.1.45074: Flags [P.], cksum 0x0bc7 (incorrect -> 0x998e), seq 13:3499, ack 531, win 512, options [nop,nop,TS val 251454208 ecr 251454134], length 3486
2022-04-05 14:32:51.705799 IP (tos 0x0, ttl 64, id 24693, offset 0, flags [DF], proto TCP (6), length 52)
    127.0.0.1.45074 > 127.0.0.1.9950: Flags [.], cksum 0xfe28 (incorrect -> 0x738c), seq 531, ack 3499, win 494, options [nop,nop,TS val 251454208 ecr 251454208], length 0
2022-04-05 14:32:51.720163 IP (tos 0x0, ttl 64, id 34233, offset 0, flags [DF], proto TCP (6), length 886)
    127.0.0.1.9950 > 127.0.0.1.45074: Flags [P.], cksum 0x016b (incorrect -> 0xd6a4), seq 3499:4333, ack 531, win 512, options [nop,nop,TS val 251454223 ecr 251454208], length 834
2022-04-05 14:32:51.720171 IP (tos 0x0, ttl 64, id 24694, offset 0, flags [DF], proto TCP (6), length 52)
    127.0.0.1.45074 > 127.0.0.1.9950: Flags [.], cksum 0xfe28 (incorrect -> 0x7022), seq 531, ack 4333, win 504, options [nop,nop,TS val 251454223 ecr 251454223], length 0
2022-04-05 14:32:51.738010 IP (tos 0x0, ttl 64, id 34234, offset 0, flags [DF], proto TCP (6), length 1300)
    127.0.0.1.9950 > 127.0.0.1.45074: Flags [P.], cksum 0x0309 (incorrect -> 0x25ce), seq 4333:5581, ack 531, win 512, options [nop,nop,TS val 251454240 ecr 251454223], length 1248
2022-04-05 14:32:51.738019 IP (tos 0x0, ttl 64, id 24695, offset 0, flags [DF], proto TCP (6), length 52)
    127.0.0.1.45074 > 127.0.0.1.9950: Flags [.], cksum 0xfe28 (incorrect -> 0x6b21), seq 531, ack 5581, win 503, options [nop,nop,TS val 251454240 ecr 251454240], length 0
2022-04-05 14:32:51.738383 IP (tos 0x0, ttl 64, id 24696, offset 0, flags [DF], proto TCP (6), length 116)
    127.0.0.1.45074 > 127.0.0.1.9950: Flags [P.], cksum 0xfe68 (incorrect -> 0xcd2d), seq 531:595, ack 5581, win 512, options [nop,nop,TS val 251454241 ecr 251454240], length 64
2022-04-05 14:32:51.738391 IP (tos 0x0, ttl 64, id 34235, offset 0, flags [DF], proto TCP (6), length 52)
    127.0.0.1.9950 > 127.0.0.1.45074: Flags [.], cksum 0xfe28 (incorrect -> 0x6ad6), seq 5581, ack 595, win 512, options [nop,nop,TS val 251454241 ecr 251454241], length 0
2022-04-05 14:32:51.738781 IP (tos 0x0, ttl 64, id 24697, offset 0, flags [DF], proto TCP (6), length 347)
    127.0.0.1.45074 > 127.0.0.1.9950: Flags [P.], cksum 0xff4f (incorrect -> 0x4e04), seq 595:890, ack 5581, win 512, options [nop,nop,TS val 251454241 ecr 251454241], length 295
2022-04-05 14:32:51.738792 IP (tos 0x0, ttl 64, id 34236, offset 0, flags [DF], proto TCP (6), length 52)
    127.0.0.1.9950 > 127.0.0.1.45074: Flags [.], cksum 0xfe28 (incorrect -> 0x69b1), seq 5581, ack 890, win 510, options [nop,nop,TS val 251454241 ecr 251454241], length 0
2022-04-05 14:32:51.884246 IP (tos 0x0, ttl 64, id 34237, offset 0, flags [DF], proto TCP (6), length 3538)
    127.0.0.1.9950 > 127.0.0.1.45074: Flags [P.], cksum 0x0bc7 (incorrect -> 0xf4ae), seq 5581:9067, ack 890, win 512, options [nop,nop,TS val 251454387 ecr 251454241], length 3486
2022-04-05 14:32:51.884257 IP (tos 0x0, ttl 64, id 24698, offset 0, flags [DF], proto TCP (6), length 52)
    127.0.0.1.45074 > 127.0.0.1.9950: Flags [.], cksum 0xfe28 (incorrect -> 0x5aff), seq 890, ack 9067, win 494, options [nop,nop,TS val 251454387 ecr 251454387], length 0
2022-04-05 14:32:51.895064 IP (tos 0x0, ttl 64, id 34238, offset 0, flags [DF], proto TCP (6), length 4036)
    127.0.0.1.9950 > 127.0.0.1.45074: Flags [P.], cksum 0x0db9 (incorrect -> 0xa839), seq 9067:13051, ack 890, win 512, options [nop,nop,TS val 251454398 ecr 251454387], length 3984
2022-04-05 14:32:51.895072 IP (tos 0x0, ttl 64, id 24699, offset 0, flags [DF], proto TCP (6), length 52)
    127.0.0.1.45074 > 127.0.0.1.9950: Flags [.], cksum 0xfe28 (incorrect -> 0x4b5b), seq 890, ack 13051, win 492, options [nop,nop,TS val 251454398 ecr 251454398], length 0
2022-04-05 14:32:51.896657 IP (tos 0x0, ttl 64, id 34239, offset 0, flags [DF], proto TCP (6), length 4036)
    127.0.0.1.9950 > 127.0.0.1.45074: Flags [P.], cksum 0x0db9 (incorrect -> 0xb1de), seq 13051:17035, ack 890, win 512, options [nop,nop,TS val 251454399 ecr 251454398], length 3984
2022-04-05 14:32:51.896668 IP (tos 0x0, ttl 64, id 24700, offset 0, flags [DF], proto TCP (6), length 52)
    127.0.0.1.45074 > 127.0.0.1.9950: Flags [.], cksum 0xfe28 (incorrect -> 0x3bc9), seq 890, ack 17035, win 492, options [nop,nop,TS val 251454399 ecr 251454399], length 0
2022-04-05 14:32:51.914968 IP (tos 0x0, ttl 64, id 34240, offset 0, flags [DF], proto TCP (6), length 2998)
    127.0.0.1.9950 > 127.0.0.1.45074: Flags [P.], cksum 0x09ab (incorrect -> 0x1aa1), seq 17035:19981, ack 890, win 512, options [nop,nop,TS val 251454417 ecr 251454399], length 2946
2022-04-05 14:32:51.914979 IP (tos 0x0, ttl 64, id 24701, offset 0, flags [DF], proto TCP (6), length 52)
    127.0.0.1.45074 > 127.0.0.1.9950: Flags [.], cksum 0xfe28 (incorrect -> 0x301f), seq 890, ack 19981, win 496, options [nop,nop,TS val 251454417 ecr 251454417], length 0
2022-04-05 14:32:51.917188 IP (tos 0x0, ttl 64, id 34241, offset 0, flags [DF], proto TCP (6), length 3538)
    127.0.0.1.9950 > 127.0.0.1.45074: Flags [P.], cksum 0x0bc7 (incorrect -> 0x1f4d), seq 19981:23467, ack 890, win 512, options [nop,nop,TS val 251454420 ecr 251454417], length 3486
2022-04-05 14:32:51.917196 IP (tos 0x0, ttl 64, id 24702, offset 0, flags [DF], proto TCP (6), length 52)
    127.0.0.1.45074 > 127.0.0.1.9950: Flags [.], cksum 0xfe28 (incorrect -> 0x227d), seq 890, ack 23467, win 494, options [nop,nop,TS val 251454420 ecr 251454420], length 0
2022-04-05 14:32:51.917266 IP (tos 0x0, ttl 64, id 34242, offset 0, flags [DF], proto TCP (6), length 3766)
    127.0.0.1.9950 > 127.0.0.1.45074: Flags [P.], cksum 0x0cab (incorrect -> 0x335a), seq 23467:27181, ack 890, win 512, options [nop,nop,TS val 251454420 ecr 251454420], length 3714
2022-04-05 14:32:51.917272 IP (tos 0x0, ttl 64, id 24703, offset 0, flags [DF], proto TCP (6), length 52)
    127.0.0.1.45074 > 127.0.0.1.9950: Flags [.], cksum 0xfe28 (incorrect -> 0x140a), seq 890, ack 27181, win 479, options [nop,nop,TS val 251454420 ecr 251454420], length 0
2022-04-05 14:32:51.919460 IP (tos 0x0, ttl 64, id 34243, offset 0, flags [DF], proto TCP (6), length 4036)
    127.0.0.1.9950 > 127.0.0.1.45074: Flags [P.], cksum 0x0db9 (incorrect -> 0x226a), seq 27181:31165, ack 890, win 512, options [nop,nop,TS val 251454422 ecr 251454420], length 3984
2022-04-05 14:32:51.919469 IP (tos 0x0, ttl 64, id 24704, offset 0, flags [DF], proto TCP (6), length 52)
    127.0.0.1.45074 > 127.0.0.1.9950: Flags [.], cksum 0xfe28 (incorrect -> 0x0469), seq 890, ack 31165, win 492, options [nop,nop,TS val 251454422 ecr 251454422], length 0
2022-04-05 14:32:51.926547 IP (tos 0x0, ttl 64, id 34244, offset 0, flags [DF], proto TCP (6), length 4100)
    127.0.0.1.9950 > 127.0.0.1.45074: Flags [P.], cksum 0x0df9 (incorrect -> 0x1df0), seq 31165:35213, ack 890, win 512, options [nop,nop,TS val 251454429 ecr 251454422], length 4048
2022-04-05 14:32:51.949323 IP (tos 0x0, ttl 64, id 34245, offset 0, flags [DF], proto TCP (6), length 32820)
    127.0.0.1.9950 > 127.0.0.1.45074: Flags [.], cksum 0x7e29 (incorrect -> 0x2b89), seq 35213:67981, ack 890, win 512, options [nop,nop,TS val 251454452 ecr 251454422], length 32768
2022-04-05 14:32:51.949348 IP (tos 0x0, ttl 64, id 24705, offset 0, flags [DF], proto TCP (6), length 52)
    127.0.0.1.45074 > 127.0.0.1.9950: Flags [.], cksum 0xfe28 (incorrect -> 0x74e4), seq 890, ack 67981, win 379, options [nop,nop,TS val 251454452 ecr 251454429], length 0
2022-04-05 14:32:51.949355 IP (tos 0x0, ttl 64, id 34246, offset 0, flags [DF], proto TCP (6), length 2116)
    127.0.0.1.9950 > 127.0.0.1.45074: Flags [P.], cksum 0x0639 (incorrect -> 0xa25a), seq 67981:70045, ack 890, win 512, options [nop,nop,TS val 251454452 ecr 251454452], length 2064
2022-04-05 14:32:51.950235 IP (tos 0x0, ttl 64, id 24706, offset 0, flags [DF], proto TCP (6), length 52)
    127.0.0.1.45074 > 127.0.0.1.9950: Flags [.], cksum 0xfe28 (incorrect -> 0x6c37), seq 890, ack 70045, win 512, options [nop,nop,TS val 251454453 ecr 251454452], length 0
2022-04-05 14:32:51.950243 IP (tos 0x0, ttl 64, id 34247, offset 0, flags [DF], proto TCP (6), length 3268)
    127.0.0.1.9950 > 127.0.0.1.45074: Flags [P.], cksum 0x0ab9 (incorrect -> 0xb63d), seq 70045:73261, ack 890, win 512, options [nop,nop,TS val 251454453 ecr 251454453], length 3216
2022-04-05 14:32:51.950796 IP (tos 0x0, ttl 64, id 24707, offset 0, flags [DF], proto TCP (6), length 52)
    127.0.0.1.45074 > 127.0.0.1.9950: Flags [.], cksum 0xfe28 (incorrect -> 0x5fa6), seq 890, ack 73261, win 512, options [nop,nop,TS val 251454453 ecr 251454453], length 0
2022-04-05 14:32:51.951194 IP (tos 0x0, ttl 64, id 34248, offset 0, flags [DF], proto TCP (6), length 3040)
    127.0.0.1.9950 > 127.0.0.1.45074: Flags [P.], cksum 0x09d5 (incorrect -> 0x3712), seq 73261:76249, ack 890, win 512, options [nop,nop,TS val 251454454 ecr 251454453], length 2988
2022-04-05 14:32:51.951233 IP (tos 0x0, ttl 64, id 24708, offset 0, flags [DF], proto TCP (6), length 52)
    127.0.0.1.45074 > 127.0.0.1.9950: Flags [.], cksum 0xfe28 (incorrect -> 0x53f8), seq 890, ack 76249, win 512, options [nop,nop,TS val 251454454 ecr 251454454], length 0
2022-04-05 14:32:51.951239 IP (tos 0x0, ttl 64, id 34249, offset 0, flags [DF], proto TCP (6), length 3538)
    127.0.0.1.9950 > 127.0.0.1.45074: Flags [P.], cksum 0x0bc7 (incorrect -> 0xca9d), seq 76249:79735, ack 890, win 512, options [nop,nop,TS val 251454454 ecr 251454454], length 3486
2022-04-05 14:32:51.951249 IP (tos 0x0, ttl 64, id 24709, offset 0, flags [DF], proto TCP (6), length 52)
    127.0.0.1.45074 > 127.0.0.1.9950: Flags [.], cksum 0xfe28 (incorrect -> 0x465a), seq 890, ack 79735, win 512, options [nop,nop,TS val 251454454 ecr 251454454], length 0
2022-04-05 14:32:51.951289 IP (tos 0x0, ttl 64, id 34250, offset 0, flags [DF], proto TCP (6), length 3766)
    127.0.0.1.9950 > 127.0.0.1.45074: Flags [P.], cksum 0x0cab (incorrect -> 0x3adc), seq 79735:83449, ack 890, win 512, options [nop,nop,TS val 251454454 ecr 251454454], length 3714
2022-04-05 14:32:51.951299 IP (tos 0x0, ttl 64, id 24710, offset 0, flags [DF], proto TCP (6), length 52)
    127.0.0.1.45074 > 127.0.0.1.9950: Flags [.], cksum 0xfe28 (incorrect -> 0x37d8), seq 890, ack 83449, win 512, options [nop,nop,TS val 251454454 ecr 251454454], length 0
2022-04-05 14:32:51.957947 IP (tos 0x0, ttl 64, id 34251, offset 0, flags [DF], proto TCP (6), length 4036)
    127.0.0.1.9950 > 127.0.0.1.45074: Flags [P.], cksum 0x0db9 (incorrect -> 0x94c6), seq 83449:87433, ack 890, win 512, options [nop,nop,TS val 251454460 ecr 251454454], length 3984
2022-04-05 14:32:51.957963 IP (tos 0x0, ttl 64, id 24711, offset 0, flags [DF], proto TCP (6), length 52)
    127.0.0.1.45074 > 127.0.0.1.9950: Flags [.], cksum 0xfe28 (incorrect -> 0x283c), seq 890, ack 87433, win 512, options [nop,nop,TS val 251454460 ecr 251454460], length 0
2022-04-05 14:32:51.958503 IP (tos 0x0, ttl 64, id 34252, offset 0, flags [DF], proto TCP (6), length 778)
    127.0.0.1.9950 > 127.0.0.1.45074: Flags [P.], cksum 0x00ff (incorrect -> 0xe054), seq 87433:88159, ack 890, win 512, options [nop,nop,TS val 251454461 ecr 251454460], length 726
2022-04-05 14:32:51.958939 IP (tos 0x0, ttl 64, id 24712, offset 0, flags [DF], proto TCP (6), length 52)
    127.0.0.1.45074 > 127.0.0.1.9950: Flags [.], cksum 0xfe28 (incorrect -> 0x2564), seq 890, ack 88159, win 512, options [nop,nop,TS val 251454461 ecr 251454461], length 0
2022-04-05 14:32:51.958948 IP (tos 0x0, ttl 64, id 34253, offset 0, flags [DF], proto TCP (6), length 11128)
    127.0.0.1.9950 > 127.0.0.1.45074: Flags [P.], cksum 0x296d (incorrect -> 0xa1f2), seq 88159:99235, ack 890, win 512, options [nop,nop,TS val 251454461 ecr 251454461], length 11076
2022-04-05 14:32:51.958954 IP (tos 0x0, ttl 64, id 24713, offset 0, flags [DF], proto TCP (6), length 52)
    127.0.0.1.45074 > 127.0.0.1.9950: Flags [.], cksum 0xfe28 (incorrect -> 0xfa1f), seq 890, ack 99235, win 512, options [nop,nop,TS val 251454461 ecr 251454461], length 0
2022-04-05 14:32:51.978144 IP (tos 0x0, ttl 64, id 34254, offset 0, flags [DF], proto TCP (6), length 4100)
    127.0.0.1.9950 > 127.0.0.1.45074: Flags [P.], cksum 0x0df9 (incorrect -> 0x25f6), seq 99235:103283, ack 890, win 512, options [nop,nop,TS val 251454481 ecr 251454461], length 4048
2022-04-05 14:32:51.978190 IP (tos 0x0, ttl 64, id 24714, offset 0, flags [DF], proto TCP (6), length 52)
    127.0.0.1.45074 > 127.0.0.1.9950: Flags [.], cksum 0xfe28 (incorrect -> 0xea27), seq 890, ack 103283, win 512, options [nop,nop,TS val 251454481 ecr 251454481], length 0
2022-04-05 14:32:51.978197 IP (tos 0x0, ttl 64, id 34255, offset 0, flags [DF], proto TCP (6), length 7134)
    127.0.0.1.9950 > 127.0.0.1.45074: Flags [P.], cksum 0x19d3 (incorrect -> 0x692e), seq 103283:110365, ack 890, win 512, options [nop,nop,TS val 251454481 ecr 251454481], length 7082
2022-04-05 14:32:51.978682 IP (tos 0x0, ttl 64, id 24715, offset 0, flags [DF], proto TCP (6), length 52)
    127.0.0.1.45074 > 127.0.0.1.9950: Flags [.], cksum 0xfe28 (incorrect -> 0xce7d), seq 890, ack 110365, win 512, options [nop,nop,TS val 251454481 ecr 251454481], length 0
2022-04-05 14:32:51.980779 IP (tos 0x0, ttl 64, id 34256, offset 0, flags [DF], proto TCP (6), length 4100)
    127.0.0.1.9950 > 127.0.0.1.45074: Flags [P.], cksum 0x0df9 (incorrect -> 0x9679), seq 110365:114413, ack 890, win 512, options [nop,nop,TS val 251454483 ecr 251454481], length 4048
2022-04-05 14:32:51.980801 IP (tos 0x0, ttl 64, id 24716, offset 0, flags [DF], proto TCP (6), length 52)
    127.0.0.1.45074 > 127.0.0.1.9950: Flags [.], cksum 0xfe28 (incorrect -> 0xbea9), seq 890, ack 114413, win 512, options [nop,nop,TS val 251454483 ecr 251454483], length 0
2022-04-05 14:32:51.980807 IP (tos 0x0, ttl 64, id 34257, offset 0, flags [DF], proto TCP (6), length 480)
    127.0.0.1.9950 > 127.0.0.1.45074: Flags [P.], cksum 0xffd4 (incorrect -> 0xebae), seq 114413:114841, ack 890, win 512, options [nop,nop,TS val 251454483 ecr 251454483], length 428
2022-04-05 14:32:51.980812 IP (tos 0x0, ttl 64, id 24717, offset 0, flags [DF], proto TCP (6), length 52)
    127.0.0.1.45074 > 127.0.0.1.9950: Flags [.], cksum 0xfe28 (incorrect -> 0xbcfd), seq 890, ack 114841, win 512, options [nop,nop,TS val 251454483 ecr 251454483], length 0
2022-04-05 14:32:51.980893 IP (tos 0x0, ttl 64, id 34258, offset 0, flags [DF], proto TCP (6), length 4100)
    127.0.0.1.9950 > 127.0.0.1.45074: Flags [P.], cksum 0x0df9 (incorrect -> 0xe2de), seq 114841:118889, ack 890, win 512, options [nop,nop,TS val 251454483 ecr 251454483], length 4048
2022-04-05 14:32:51.980971 IP (tos 0x0, ttl 64, id 24718, offset 0, flags [DF], proto TCP (6), length 52)
    127.0.0.1.45074 > 127.0.0.1.9950: Flags [.], cksum 0xfe28 (incorrect -> 0xad2d), seq 890, ack 118889, win 512, options [nop,nop,TS val 251454483 ecr 251454483], length 0
200, 4.646925926208496, 0.46496081352233887