2022-04-05 10:55:35.990891 IP (tos 0x0, ttl 64, id 50635, offset 0, flags [DF], proto TCP (6), length 60)
    127.0.0.1.48164 > 127.0.0.1.10150: Flags [S], cksum 0xfe30 (incorrect -> 0xd6ac), seq 2000033249, win 65495, options [mss 65495,sackOK,TS val 238418493 ecr 0,nop,wscale 7], length 0
2022-04-05 10:55:35.990909 IP (tos 0x0, ttl 64, id 0, offset 0, flags [DF], proto TCP (6), length 60)
    127.0.0.1.10150 > 127.0.0.1.48164: Flags [S.], cksum 0xfe30 (incorrect -> 0x260d), seq 345215892, ack 2000033250, win 65483, options [mss 65495,sackOK,TS val 238418493 ecr 238418493,nop,wscale 7], length 0
2022-04-05 10:55:35.990923 IP (tos 0x0, ttl 64, id 50636, offset 0, flags [DF], proto TCP (6), length 52)
    127.0.0.1.48164 > 127.0.0.1.10150: Flags [.], cksum 0xfe28 (incorrect -> 0x4cc9), seq 1, ack 1, win 512, options [nop,nop,TS val 238418493 ecr 238418493], length 0
2022-04-05 10:55:35.991024 IP (tos 0x0, ttl 64, id 50637, offset 0, flags [DF], proto TCP (6), length 55)
    127.0.0.1.48164 > 127.0.0.1.10150: Flags [P.], cksum 0xfe2b (incorrect -> 0x47bd), seq 1:4, ack 1, win 512, options [nop,nop,TS val 238418493 ecr 238418493], length 3
2022-04-05 10:55:35.991030 IP (tos 0x0, ttl 64, id 37140, offset 0, flags [DF], proto TCP (6), length 52)
    127.0.0.1.10150 > 127.0.0.1.48164: Flags [.], cksum 0xfe28 (incorrect -> 0x4cc6), seq 1, ack 4, win 512, options [nop,nop,TS val 238418493 ecr 238418493], length 0
2022-04-05 10:55:35.991584 IP (tos 0x0, ttl 64, id 37141, offset 0, flags [DF], proto TCP (6), length 54)
    127.0.0.1.10150 > 127.0.0.1.48164: Flags [P.], cksum 0xfe2a (incorrect -> 0x47bb), seq 1:3, ack 4, win 512, options [nop,nop,TS val 238418494 ecr 238418493], length 2
2022-04-05 10:55:35.991602 IP (tos 0x0, ttl 64, id 50638, offset 0, flags [DF], proto TCP (6), length 52)
    127.0.0.1.48164 > 127.0.0.1.10150: Flags [.], cksum 0xfe28 (incorrect -> 0x4cc2), seq 4, ack 3, win 512, options [nop,nop,TS val 238418494 ecr 238418494], length 0
2022-04-05 10:55:35.993142 IP (tos 0x0, ttl 64, id 50639, offset 0, flags [DF], proto TCP (6), length 62)
    127.0.0.1.48164 > 127.0.0.1.10150: Flags [P.], cksum 0xfe32 (incorrect -> 0x0e78), seq 4:14, ack 3, win 512, options [nop,nop,TS val 238418496 ecr 238418494], length 10
2022-04-05 10:55:35.993151 IP (tos 0x0, ttl 64, id 37142, offset 0, flags [DF], proto TCP (6), length 52)
    127.0.0.1.10150 > 127.0.0.1.48164: Flags [.], cksum 0xfe28 (incorrect -> 0x4cb4), seq 3, ack 14, win 512, options [nop,nop,TS val 238418496 ecr 238418496], length 0
2022-04-05 10:55:36.046480 IP (tos 0x0, ttl 64, id 37143, offset 0, flags [DF], proto TCP (6), length 62)
    127.0.0.1.10150 > 127.0.0.1.48164: Flags [P.], cksum 0xfe32 (incorrect -> 0x476c), seq 3:13, ack 14, win 512, options [nop,nop,TS val 238418549 ecr 238418496], length 10
2022-04-05 10:55:36.046493 IP (tos 0x0, ttl 64, id 50640, offset 0, flags [DF], proto TCP (6), length 52)
    127.0.0.1.48164 > 127.0.0.1.10150: Flags [.], cksum 0xfe28 (incorrect -> 0x4c40), seq 14, ack 13, win 512, options [nop,nop,TS val 238418549 ecr 238418549], length 0
2022-04-05 10:55:36.052913 IP (tos 0x0, ttl 64, id 50641, offset 0, flags [DF], proto TCP (6), length 569)
    127.0.0.1.48164 > 127.0.0.1.10150: Flags [P.], cksum 0x002e (incorrect -> 0xa877), seq 14:531, ack 13, win 512, options [nop,nop,TS val 238418555 ecr 238418549], length 517
2022-04-05 10:55:36.052926 IP (tos 0x0, ttl 64, id 37144, offset 0, flags [DF], proto TCP (6), length 52)
    127.0.0.1.10150 > 127.0.0.1.48164: Flags [.], cksum 0xfe28 (incorrect -> 0x4a33), seq 13, ack 531, win 508, options [nop,nop,TS val 238418555 ecr 238418555], length 0
2022-04-05 10:55:36.127703 IP (tos 0x0, ttl 64, id 37145, offset 0, flags [DF], proto TCP (6), length 3538)
    127.0.0.1.10150 > 127.0.0.1.48164: Flags [P.], cksum 0x0bc7 (incorrect -> 0x2996), seq 13:3499, ack 531, win 512, options [nop,nop,TS val 238418630 ecr 238418555], length 3486
2022-04-05 10:55:36.127711 IP (tos 0x0, ttl 64, id 50642, offset 0, flags [DF], proto TCP (6), length 52)
    127.0.0.1.48164 > 127.0.0.1.10150: Flags [.], cksum 0xfe28 (incorrect -> 0x3c0d), seq 531, ack 3499, win 494, options [nop,nop,TS val 238418630 ecr 238418630], length 0
200, 4.723408460617065, 0.686492919921875