2022-04-05 05:53:13.381472 IP (tos 0x0, ttl 64, id 6888, offset 0, flags [DF], proto TCP (6), length 60)
    127.0.0.1.33178 > 127.0.0.1.10350: Flags [S], cksum 0xfe30 (incorrect -> 0x3847), seq 25424634, win 65495, options [mss 65495,sackOK,TS val 775637753 ecr 0,nop,wscale 7], length 0
2022-04-05 05:53:13.381482 IP (tos 0x0, ttl 64, id 0, offset 0, flags [DF], proto TCP (6), length 60)
    127.0.0.1.10350 > 127.0.0.1.33178: Flags [S.], cksum 0xfe30 (incorrect -> 0x4cb0), seq 2227563927, ack 25424635, win 65483, options [mss 65495,sackOK,TS val 775637753 ecr 775637753,nop,wscale 7], length 0
2022-04-05 05:53:13.381491 IP (tos 0x0, ttl 64, id 6889, offset 0, flags [DF], proto TCP (6), length 52)
    127.0.0.1.33178 > 127.0.0.1.10350: Flags [.], cksum 0xfe28 (incorrect -> 0x736c), seq 1, ack 1, win 512, options [nop,nop,TS val 775637753 ecr 775637753], length 0
2022-04-05 05:53:13.381588 IP (tos 0x0, ttl 64, id 6890, offset 0, flags [DF], proto TCP (6), length 55)
    127.0.0.1.33178 > 127.0.0.1.10350: Flags [P.], cksum 0xfe2b (incorrect -> 0x6e60), seq 1:4, ack 1, win 512, options [nop,nop,TS val 775637753 ecr 775637753], length 3
2022-04-05 05:53:13.381603 IP (tos 0x0, ttl 64, id 39034, offset 0, flags [DF], proto TCP (6), length 52)
    127.0.0.1.10350 > 127.0.0.1.33178: Flags [.], cksum 0xfe28 (incorrect -> 0x7369), seq 1, ack 4, win 512, options [nop,nop,TS val 775637753 ecr 775637753], length 0
2022-04-05 05:53:13.381673 IP (tos 0x0, ttl 64, id 39035, offset 0, flags [DF], proto TCP (6), length 54)
    127.0.0.1.10350 > 127.0.0.1.33178: Flags [P.], cksum 0xfe2a (incorrect -> 0x6e5f), seq 1:3, ack 4, win 512, options [nop,nop,TS val 775637753 ecr 775637753], length 2
2022-04-05 05:53:13.381697 IP (tos 0x0, ttl 64, id 6891, offset 0, flags [DF], proto TCP (6), length 52)
    127.0.0.1.33178 > 127.0.0.1.10350: Flags [.], cksum 0xfe28 (incorrect -> 0x7367), seq 4, ack 3, win 512, options [nop,nop,TS val 775637753 ecr 775637753], length 0
2022-04-05 05:53:13.393586 IP (tos 0x0, ttl 64, id 6892, offset 0, flags [DF], proto TCP (6), length 62)
    127.0.0.1.33178 > 127.0.0.1.10350: Flags [P.], cksum 0xfe32 (incorrect -> 0x928f), seq 4:14, ack 3, win 512, options [nop,nop,TS val 775637765 ecr 775637753], length 10
2022-04-05 05:53:13.393597 IP (tos 0x0, ttl 64, id 39036, offset 0, flags [DF], proto TCP (6), length 52)
    127.0.0.1.10350 > 127.0.0.1.33178: Flags [.], cksum 0xfe28 (incorrect -> 0x7345), seq 3, ack 14, win 512, options [nop,nop,TS val 775637765 ecr 775637765], length 0
2022-04-05 05:53:13.463882 IP (tos 0x0, ttl 64, id 39037, offset 0, flags [DF], proto TCP (6), length 62)
    127.0.0.1.10350 > 127.0.0.1.33178: Flags [P.], cksum 0xfe32 (incorrect -> 0x6dec), seq 3:13, ack 14, win 512, options [nop,nop,TS val 775637835 ecr 775637765], length 10
2022-04-05 05:53:13.463893 IP (tos 0x0, ttl 64, id 6893, offset 0, flags [DF], proto TCP (6), length 52)
    127.0.0.1.33178 > 127.0.0.1.10350: Flags [.], cksum 0xfe28 (incorrect -> 0x72af), seq 14, ack 13, win 512, options [nop,nop,TS val 775637835 ecr 775637835], length 0
2022-04-05 05:53:13.469602 IP (tos 0x0, ttl 64, id 6894, offset 0, flags [DF], proto TCP (6), length 569)
    127.0.0.1.33178 > 127.0.0.1.10350: Flags [P.], cksum 0x002e (incorrect -> 0x9b2b), seq 14:531, ack 13, win 512, options [nop,nop,TS val 775637841 ecr 775637835], length 517
2022-04-05 05:53:13.469612 IP (tos 0x0, ttl 64, id 39038, offset 0, flags [DF], proto TCP (6), length 52)
    127.0.0.1.10350 > 127.0.0.1.33178: Flags [.], cksum 0xfe28 (incorrect -> 0x70a2), seq 13, ack 531, win 508, options [nop,nop,TS val 775637841 ecr 775637841], length 0
2022-04-05 05:53:13.564005 IP (tos 0x0, ttl 64, id 39039, offset 0, flags [DF], proto TCP (6), length 3538)
    127.0.0.1.10350 > 127.0.0.1.33178: Flags [P.], cksum 0x0bc7 (incorrect -> 0x3904), seq 13:3499, ack 531, win 512, options [nop,nop,TS val 775637935 ecr 775637841], length 3486
2022-04-05 05:53:13.564017 IP (tos 0x0, ttl 64, id 6895, offset 0, flags [DF], proto TCP (6), length 52)
    127.0.0.1.33178 > 127.0.0.1.10350: Flags [.], cksum 0xfe28 (incorrect -> 0x6256), seq 531, ack 3499, win 494, options [nop,nop,TS val 775637935 ecr 775637935], length 0
2022-04-05 05:53:13.614664 IP (tos 0x0, ttl 64, id 39040, offset 0, flags [DF], proto TCP (6), length 541)
    127.0.0.1.10350 > 127.0.0.1.33178: Flags [P.], cksum 0x0012 (incorrect -> 0x9b0c), seq 3499:3988, ack 531, win 512, options [nop,nop,TS val 775637986 ecr 775637935], length 489
2022-04-05 05:53:13.614674 IP (tos 0x0, ttl 64, id 6896, offset 0, flags [DF], proto TCP (6), length 52)
    127.0.0.1.33178 > 127.0.0.1.10350: Flags [.], cksum 0xfe28 (incorrect -> 0x5ffb), seq 531, ack 3988, win 506, options [nop,nop,TS val 775637986 ecr 775637986], length 0
2022-04-05 05:53:13.615025 IP (tos 0x0, ttl 64, id 6897, offset 0, flags [DF], proto TCP (6), length 132)
    127.0.0.1.33178 > 127.0.0.1.10350: Flags [P.], cksum 0xfe78 (incorrect -> 0xf3a4), seq 531:611, ack 3988, win 512, options [nop,nop,TS val 775637986 ecr 775637986], length 80
2022-04-05 05:53:13.615036 IP (tos 0x0, ttl 64, id 39041, offset 0, flags [DF], proto TCP (6), length 52)
    127.0.0.1.10350 > 127.0.0.1.33178: Flags [.], cksum 0xfe28 (incorrect -> 0x5fa5), seq 3988, ack 611, win 512, options [nop,nop,TS val 775637986 ecr 775637986], length 0
2022-04-05 05:53:13.615401 IP (tos 0x0, ttl 64, id 6898, offset 0, flags [DF], proto TCP (6), length 320)
    127.0.0.1.33178 > 127.0.0.1.10350: Flags [P.], cksum 0xff34 (incorrect -> 0xd3a0), seq 611:879, ack 3988, win 512, options [nop,nop,TS val 775637986 ecr 775637986], length 268
2022-04-05 05:53:13.615411 IP (tos 0x0, ttl 64, id 39042, offset 0, flags [DF], proto TCP (6), length 52)
    127.0.0.1.10350 > 127.0.0.1.33178: Flags [.], cksum 0xfe28 (incorrect -> 0x5e9a), seq 3988, ack 879, win 510, options [nop,nop,TS val 775637987 ecr 775637986], length 0
2022-04-05 05:53:13.684531 IP (tos 0x0, ttl 64, id 39043, offset 0, flags [DF], proto TCP (6), length 594)
    127.0.0.1.10350 > 127.0.0.1.33178: Flags [P.], cksum 0x0047 (incorrect -> 0xa383), seq 3988:4530, ack 879, win 512, options [nop,nop,TS val 775638056 ecr 775637986], length 542
2022-04-05 05:53:13.684543 IP (tos 0x0, ttl 64, id 6899, offset 0, flags [DF], proto TCP (6), length 52)
    127.0.0.1.33178 > 127.0.0.1.10350: Flags [.], cksum 0xfe28 (incorrect -> 0x5bf3), seq 879, ack 4530, win 508, options [nop,nop,TS val 775638056 ecr 775638056], length 0
2022-04-05 05:53:13.729421 IP (tos 0x0, ttl 64, id 39044, offset 0, flags [DF], proto TCP (6), length 3538)
    127.0.0.1.10350 > 127.0.0.1.33178: Flags [P.], cksum 0x0bc7 (incorrect -> 0x02a1), seq 4530:8016, ack 879, win 512, options [nop,nop,TS val 775638101 ecr 775638056], length 3486
2022-04-05 05:53:13.729430 IP (tos 0x0, ttl 64, id 6900, offset 0, flags [DF], proto TCP (6), length 52)
    127.0.0.1.33178 > 127.0.0.1.10350: Flags [.], cksum 0xfe28 (incorrect -> 0x4e09), seq 879, ack 8016, win 494, options [nop,nop,TS val 775638101 ecr 775638101], length 0
2022-04-05 05:53:13.749569 IP (tos 0x0, ttl 64, id 39045, offset 0, flags [DF], proto TCP (6), length 4036)
    127.0.0.1.10350 > 127.0.0.1.33178: Flags [P.], cksum 0x0db9 (incorrect -> 0x93f0), seq 8016:12000, ack 879, win 512, options [nop,nop,TS val 775638121 ecr 775638101], length 3984
2022-04-05 05:53:13.749577 IP (tos 0x0, ttl 64, id 6901, offset 0, flags [DF], proto TCP (6), length 52)
    127.0.0.1.33178 > 127.0.0.1.10350: Flags [.], cksum 0xfe28 (incorrect -> 0x3e53), seq 879, ack 12000, win 492, options [nop,nop,TS val 775638121 ecr 775638121], length 0
2022-04-05 05:53:13.772973 IP (tos 0x0, ttl 64, id 39046, offset 0, flags [DF], proto TCP (6), length 4036)
    127.0.0.1.10350 > 127.0.0.1.33178: Flags [P.], cksum 0x0db9 (incorrect -> 0xccf5), seq 12000:15984, ack 879, win 512, options [nop,nop,TS val 775638144 ecr 775638121], length 3984
2022-04-05 05:53:13.772981 IP (tos 0x0, ttl 64, id 6902, offset 0, flags [DF], proto TCP (6), length 52)
    127.0.0.1.33178 > 127.0.0.1.10350: Flags [.], cksum 0xfe28 (incorrect -> 0x2e95), seq 879, ack 15984, win 492, options [nop,nop,TS val 775638144 ecr 775638144], length 0
2022-04-05 05:53:13.786775 IP (tos 0x0, ttl 64, id 39047, offset 0, flags [DF], proto TCP (6), length 2044)
    127.0.0.1.10350 > 127.0.0.1.33178: Flags [P.], cksum 0x05f1 (incorrect -> 0x6486), seq 15984:17976, ack 879, win 512, options [nop,nop,TS val 775638158 ecr 775638144], length 1992
2022-04-05 05:53:13.786784 IP (tos 0x0, ttl 64, id 6903, offset 0, flags [DF], proto TCP (6), length 52)
    127.0.0.1.33178 > 127.0.0.1.10350: Flags [.], cksum 0xfe28 (incorrect -> 0x26a9), seq 879, ack 17976, win 500, options [nop,nop,TS val 775638158 ecr 775638158], length 0
2022-04-05 05:53:13.800641 IP (tos 0x0, ttl 64, id 39048, offset 0, flags [DF], proto TCP (6), length 3538)
    127.0.0.1.10350 > 127.0.0.1.33178: Flags [P.], cksum 0x0bc7 (incorrect -> 0xea42), seq 17976:21462, ack 879, win 512, options [nop,nop,TS val 775638172 ecr 775638158], length 3486
2022-04-05 05:53:13.800650 IP (tos 0x0, ttl 64, id 6904, offset 0, flags [DF], proto TCP (6), length 52)
    127.0.0.1.33178 > 127.0.0.1.10350: Flags [.], cksum 0xfe28 (incorrect -> 0x18f5), seq 879, ack 21462, win 494, options [nop,nop,TS val 775638172 ecr 775638172], length 0
2022-04-05 05:53:13.817163 IP (tos 0x0, ttl 64, id 39049, offset 0, flags [DF], proto TCP (6), length 4036)
    127.0.0.1.10350 > 127.0.0.1.33178: Flags [P.], cksum 0x0db9 (incorrect -> 0x8daf), seq 21462:25446, ack 879, win 512, options [nop,nop,TS val 775638188 ecr 775638172], length 3984
2022-04-05 05:53:13.817173 IP (tos 0x0, ttl 64, id 6905, offset 0, flags [DF], proto TCP (6), length 52)
    127.0.0.1.33178 > 127.0.0.1.10350: Flags [.], cksum 0xfe28 (incorrect -> 0x0947), seq 879, ack 25446, win 492, options [nop,nop,TS val 775638188 ecr 775638188], length 0
2022-04-05 05:53:13.830954 IP (tos 0x0, ttl 64, id 39050, offset 0, flags [DF], proto TCP (6), length 3872)
    127.0.0.1.10350 > 127.0.0.1.33178: Flags [P.], cksum 0x0d15 (incorrect -> 0x9e80), seq 25446:29266, ack 879, win 512, options [nop,nop,TS val 775638202 ecr 775638188], length 3820
2022-04-05 05:53:13.830963 IP (tos 0x0, ttl 64, id 6906, offset 0, flags [DF], proto TCP (6), length 52)
    127.0.0.1.33178 > 127.0.0.1.10350: Flags [.], cksum 0xfe28 (incorrect -> 0xfa3d), seq 879, ack 29266, win 493, options [nop,nop,TS val 775638202 ecr 775638202], length 0
2022-04-05 05:53:13.843882 IP (tos 0x0, ttl 64, id 39051, offset 0, flags [DF], proto TCP (6), length 2474)
    127.0.0.1.10350 > 127.0.0.1.33178: Flags [P.], cksum 0x079f (incorrect -> 0xa22d), seq 29266:31688, ack 879, win 512, options [nop,nop,TS val 775638215 ecr 775638202], length 2422
2022-04-05 05:53:13.843907 IP (tos 0x0, ttl 64, id 6907, offset 0, flags [DF], proto TCP (6), length 52)
    127.0.0.1.33178 > 127.0.0.1.10350: Flags [.], cksum 0xfe28 (incorrect -> 0xf09a), seq 879, ack 31688, win 512, options [nop,nop,TS val 775638215 ecr 775638215], length 0
2022-04-05 05:53:13.849162 IP (tos 0x0, ttl 64, id 39052, offset 0, flags [DF], proto TCP (6), length 3470)
    127.0.0.1.10350 > 127.0.0.1.33178: Flags [P.], cksum 0x0b83 (incorrect -> 0x2343), seq 31688:35106, ack 879, win 512, options [nop,nop,TS val 775638220 ecr 775638215], length 3418
2022-04-05 05:53:13.849180 IP (tos 0x0, ttl 64, id 6908, offset 0, flags [DF], proto TCP (6), length 52)
    127.0.0.1.33178 > 127.0.0.1.10350: Flags [.], cksum 0xfe28 (incorrect -> 0xe336), seq 879, ack 35106, win 512, options [nop,nop,TS val 775638220 ecr 775638220], length 0
2022-04-05 05:53:13.860355 IP (tos 0x0, ttl 64, id 39053, offset 0, flags [DF], proto TCP (6), length 3470)
    127.0.0.1.10350 > 127.0.0.1.33178: Flags [P.], cksum 0x0b83 (incorrect -> 0xdab9), seq 35106:38524, ack 879, win 512, options [nop,nop,TS val 775638231 ecr 775638220], length 3418
2022-04-05 05:53:13.901399 IP (tos 0x0, ttl 64, id 6909, offset 0, flags [DF], proto TCP (6), length 52)
    127.0.0.1.33178 > 127.0.0.1.10350: Flags [.], cksum 0xfe28 (incorrect -> 0xd59d), seq 879, ack 38524, win 512, options [nop,nop,TS val 775638272 ecr 775638231], length 0
2022-04-05 05:53:13.901410 IP (tos 0x0, ttl 64, id 39054, offset 0, flags [DF], proto TCP (6), length 5032)
    127.0.0.1.10350 > 127.0.0.1.33178: Flags [P.], cksum 0x119d (incorrect -> 0x7a4e), seq 38524:43504, ack 879, win 512, options [nop,nop,TS val 775638273 ecr 775638272], length 4980
2022-04-05 05:53:13.940024 IP (tos 0x0, ttl 64, id 39055, offset 0, flags [DF], proto TCP (6), length 32820)
    127.0.0.1.10350 > 127.0.0.1.33178: Flags [.], cksum 0x7e29 (incorrect -> 0xcd35), seq 43504:76272, ack 879, win 512, options [nop,nop,TS val 775638311 ecr 775638272], length 32768
2022-04-05 05:53:13.940036 IP (tos 0x0, ttl 64, id 6910, offset 0, flags [DF], proto TCP (6), length 52)
    127.0.0.1.33178 > 127.0.0.1.10350: Flags [.], cksum 0xfe28 (incorrect -> 0x425d), seq 879, ack 76272, win 379, options [nop,nop,TS val 775638311 ecr 775638273], length 0
2022-04-05 05:53:13.940045 IP (tos 0x0, ttl 64, id 39056, offset 0, flags [DF], proto TCP (6), length 152)
    127.0.0.1.10350 > 127.0.0.1.33178: Flags [P.], cksum 0xfe8c (incorrect -> 0xbfcb), seq 76272:76372, ack 879, win 512, options [nop,nop,TS val 775638311 ecr 775638311], length 100
2022-04-05 05:53:13.940847 IP (tos 0x0, ttl 64, id 6911, offset 0, flags [DF], proto TCP (6), length 52)
    127.0.0.1.33178 > 127.0.0.1.10350: Flags [.], cksum 0xfe28 (incorrect -> 0x414d), seq 879, ack 76372, win 512, options [nop,nop,TS val 775638312 ecr 775638311], length 0
2022-04-05 05:53:13.944909 IP (tos 0x0, ttl 64, id 39057, offset 0, flags [DF], proto TCP (6), length 550)
    127.0.0.1.10350 > 127.0.0.1.33178: Flags [P.], cksum 0x001b (incorrect -> 0xa463), seq 76372:76870, ack 879, win 512, options [nop,nop,TS val 775638316 ecr 775638312], length 498
2022-04-05 05:53:13.944926 IP (tos 0x0, ttl 64, id 6912, offset 0, flags [DF], proto TCP (6), length 52)
    127.0.0.1.33178 > 127.0.0.1.10350: Flags [.], cksum 0xfe28 (incorrect -> 0x3f52), seq 879, ack 76870, win 512, options [nop,nop,TS val 775638316 ecr 775638316], length 0
2022-04-05 05:53:13.949474 IP (tos 0x0, ttl 64, id 39058, offset 0, flags [DF], proto TCP (6), length 2542)
    127.0.0.1.10350 > 127.0.0.1.33178: Flags [P.], cksum 0x07e3 (incorrect -> 0x153a), seq 76870:79360, ack 879, win 512, options [nop,nop,TS val 775638321 ecr 775638316], length 2490
2022-04-05 05:53:13.949491 IP (tos 0x0, ttl 64, id 6913, offset 0, flags [DF], proto TCP (6), length 52)
    127.0.0.1.33178 > 127.0.0.1.10350: Flags [.], cksum 0xfe28 (incorrect -> 0x358e), seq 879, ack 79360, win 512, options [nop,nop,TS val 775638321 ecr 775638321], length 0
2022-04-05 05:53:13.951953 IP (tos 0x0, ttl 64, id 39059, offset 0, flags [DF], proto TCP (6), length 2156)
    127.0.0.1.10350 > 127.0.0.1.33178: Flags [P.], cksum 0x0661 (incorrect -> 0xaf15), seq 79360:81464, ack 879, win 512, options [nop,nop,TS val 775638323 ecr 775638321], length 2104
2022-04-05 05:53:13.951970 IP (tos 0x0, ttl 64, id 6914, offset 0, flags [DF], proto TCP (6), length 52)
    127.0.0.1.33178 > 127.0.0.1.10350: Flags [.], cksum 0xfe28 (incorrect -> 0x2d52), seq 879, ack 81464, win 512, options [nop,nop,TS val 775638323 ecr 775638323], length 0
2022-04-05 05:53:13.958109 IP (tos 0x0, ttl 64, id 39060, offset 0, flags [DF], proto TCP (6), length 550)
    127.0.0.1.10350 > 127.0.0.1.33178: Flags [P.], cksum 0x001b (incorrect -> 0x2ef4), seq 81464:81962, ack 879, win 512, options [nop,nop,TS val 775638329 ecr 775638323], length 498
2022-04-05 05:53:13.958126 IP (tos 0x0, ttl 64, id 6915, offset 0, flags [DF], proto TCP (6), length 52)
    127.0.0.1.33178 > 127.0.0.1.10350: Flags [.], cksum 0xfe28 (incorrect -> 0x2b54), seq 879, ack 81962, win 512, options [nop,nop,TS val 775638329 ecr 775638329], length 0
2022-04-05 05:53:13.962720 IP (tos 0x0, ttl 64, id 39061, offset 0, flags [DF], proto TCP (6), length 2542)
    127.0.0.1.10350 > 127.0.0.1.33178: Flags [P.], cksum 0x07e3 (incorrect -> 0x7359), seq 81962:84452, ack 879, win 512, options [nop,nop,TS val 775638334 ecr 775638329], length 2490
2022-04-05 05:53:13.962738 IP (tos 0x0, ttl 64, id 6916, offset 0, flags [DF], proto TCP (6), length 52)
    127.0.0.1.33178 > 127.0.0.1.10350: Flags [.], cksum 0xfe28 (incorrect -> 0x2190), seq 879, ack 84452, win 512, options [nop,nop,TS val 775638334 ecr 775638334], length 0
2022-04-05 05:53:13.965617 IP (tos 0x0, ttl 64, id 39062, offset 0, flags [DF], proto TCP (6), length 3040)
    127.0.0.1.10350 > 127.0.0.1.33178: Flags [P.], cksum 0x09d5 (incorrect -> 0xc8b4), seq 84452:87440, ack 879, win 512, options [nop,nop,TS val 775638337 ecr 775638334], length 2988
2022-04-05 05:53:13.966007 IP (tos 0x0, ttl 64, id 6917, offset 0, flags [DF], proto TCP (6), length 52)
    127.0.0.1.33178 > 127.0.0.1.10350: Flags [.], cksum 0xfe28 (incorrect -> 0x15de), seq 879, ack 87440, win 512, options [nop,nop,TS val 775638337 ecr 775638337], length 0
2022-04-05 05:53:13.966016 IP (tos 0x0, ttl 64, id 39063, offset 0, flags [DF], proto TCP (6), length 4534)
    127.0.0.1.10350 > 127.0.0.1.33178: Flags [P.], cksum 0x0fab (incorrect -> 0x861c), seq 87440:91922, ack 879, win 512, options [nop,nop,TS val 775638337 ecr 775638337], length 4482
2022-04-05 05:53:13.966022 IP (tos 0x0, ttl 64, id 6918, offset 0, flags [DF], proto TCP (6), length 52)
    127.0.0.1.33178 > 127.0.0.1.10350: Flags [.], cksum 0xfe28 (incorrect -> 0x045c), seq 879, ack 91922, win 512, options [nop,nop,TS val 775638337 ecr 775638337], length 0
2022-04-05 05:53:13.974791 IP (tos 0x0, ttl 64, id 39064, offset 0, flags [DF], proto TCP (6), length 550)
    127.0.0.1.10350 > 127.0.0.1.33178: Flags [P.], cksum 0x001b (incorrect -> 0x48f0), seq 91922:92420, ack 879, win 512, options [nop,nop,TS val 775638346 ecr 775638337], length 498
2022-04-05 05:53:13.974809 IP (tos 0x0, ttl 64, id 6919, offset 0, flags [DF], proto TCP (6), length 52)
    127.0.0.1.33178 > 127.0.0.1.10350: Flags [.], cksum 0xfe28 (incorrect -> 0x0258), seq 879, ack 92420, win 512, options [nop,nop,TS val 775638346 ecr 775638346], length 0
2022-04-05 05:53:13.979533 IP (tos 0x0, ttl 64, id 39065, offset 0, flags [DF], proto TCP (6), length 2542)
    127.0.0.1.10350 > 127.0.0.1.33178: Flags [P.], cksum 0x07e3 (incorrect -> 0x38db), seq 92420:94910, ack 879, win 512, options [nop,nop,TS val 775638351 ecr 775638346], length 2490
2022-04-05 05:53:13.979550 IP (tos 0x0, ttl 64, id 6920, offset 0, flags [DF], proto TCP (6), length 52)
    127.0.0.1.33178 > 127.0.0.1.10350: Flags [.], cksum 0xfe28 (incorrect -> 0xf893), seq 879, ack 94910, win 512, options [nop,nop,TS val 775638351 ecr 775638351], length 0
2022-04-05 05:53:13.982001 IP (tos 0x0, ttl 64, id 39066, offset 0, flags [DF], proto TCP (6), length 3040)
    127.0.0.1.10350 > 127.0.0.1.33178: Flags [P.], cksum 0x09d5 (incorrect -> 0xc8ec), seq 94910:97898, ack 879, win 512, options [nop,nop,TS val 775638353 ecr 775638351], length 2988
2022-04-05 05:53:13.982019 IP (tos 0x0, ttl 64, id 6921, offset 0, flags [DF], proto TCP (6), length 52)
    127.0.0.1.33178 > 127.0.0.1.10350: Flags [.], cksum 0xfe28 (incorrect -> 0xece3), seq 879, ack 97898, win 512, options [nop,nop,TS val 775638353 ecr 775638353], length 0
2022-04-05 05:53:13.986545 IP (tos 0x0, ttl 64, id 39067, offset 0, flags [DF], proto TCP (6), length 2542)
    127.0.0.1.10350 > 127.0.0.1.33178: Flags [P.], cksum 0x07e3 (incorrect -> 0x695f), seq 97898:100388, ack 879, win 512, options [nop,nop,TS val 775638358 ecr 775638353], length 2490
2022-04-05 05:53:13.986564 IP (tos 0x0, ttl 64, id 6922, offset 0, flags [DF], proto TCP (6), length 52)
    127.0.0.1.33178 > 127.0.0.1.10350: Flags [.], cksum 0xfe28 (incorrect -> 0xe31f), seq 879, ack 100388, win 512, options [nop,nop,TS val 775638358 ecr 775638358], length 0
2022-04-05 05:53:13.990715 IP (tos 0x0, ttl 64, id 39068, offset 0, flags [DF], proto TCP (6), length 2542)
    127.0.0.1.10350 > 127.0.0.1.33178: Flags [P.], cksum 0x07e3 (incorrect -> 0x6311), seq 100388:102878, ack 879, win 512, options [nop,nop,TS val 775638362 ecr 775638358], length 2490
200, 3.8631765842437744, 0.7220363616943359