2022-04-05 00:49:55.321944 IP (tos 0x0, ttl 64, id 57281, offset 0, flags [DF], proto TCP (6), length 60)
    127.0.0.1.58054 > 127.0.0.1.11550: Flags [S], cksum 0xfe30 (incorrect -> 0xddb2), seq 3155156071, win 65495, options [mss 65495,sackOK,TS val 757439693 ecr 0,nop,wscale 7], length 0
2022-04-05 00:49:55.321956 IP (tos 0x0, ttl 64, id 0, offset 0, flags [DF], proto TCP (6), length 60)
    127.0.0.1.11550 > 127.0.0.1.58054: Flags [S.], cksum 0xfe30 (incorrect -> 0x127e), seq 1341960512, ack 3155156072, win 65483, options [mss 65495,sackOK,TS val 757439693 ecr 757439693,nop,wscale 7], length 0
2022-04-05 00:49:55.321965 IP (tos 0x0, ttl 64, id 57282, offset 0, flags [DF], proto TCP (6), length 52)
    127.0.0.1.58054 > 127.0.0.1.11550: Flags [.], cksum 0xfe28 (incorrect -> 0x393a), seq 1, ack 1, win 512, options [nop,nop,TS val 757439693 ecr 757439693], length 0
2022-04-05 00:49:55.322080 IP (tos 0x0, ttl 64, id 57283, offset 0, flags [DF], proto TCP (6), length 55)
    127.0.0.1.58054 > 127.0.0.1.11550: Flags [P.], cksum 0xfe2b (incorrect -> 0x342e), seq 1:4, ack 1, win 512, options [nop,nop,TS val 757439693 ecr 757439693], length 3
2022-04-05 00:49:55.322091 IP (tos 0x0, ttl 64, id 735, offset 0, flags [DF], proto TCP (6), length 52)
    127.0.0.1.11550 > 127.0.0.1.58054: Flags [.], cksum 0xfe28 (incorrect -> 0x3937), seq 1, ack 4, win 512, options [nop,nop,TS val 757439693 ecr 757439693], length 0
2022-04-05 00:49:55.322125 IP (tos 0x0, ttl 64, id 736, offset 0, flags [DF], proto TCP (6), length 54)
    127.0.0.1.11550 > 127.0.0.1.58054: Flags [P.], cksum 0xfe2a (incorrect -> 0x342d), seq 1:3, ack 4, win 512, options [nop,nop,TS val 757439693 ecr 757439693], length 2
2022-04-05 00:49:55.322136 IP (tos 0x0, ttl 64, id 57284, offset 0, flags [DF], proto TCP (6), length 52)
    127.0.0.1.58054 > 127.0.0.1.11550: Flags [.], cksum 0xfe28 (incorrect -> 0x3935), seq 4, ack 3, win 512, options [nop,nop,TS val 757439693 ecr 757439693], length 0
2022-04-05 00:49:55.324065 IP (tos 0x0, ttl 64, id 57285, offset 0, flags [DF], proto TCP (6), length 62)
    127.0.0.1.58054 > 127.0.0.1.11550: Flags [P.], cksum 0xfe32 (incorrect -> 0xa04b), seq 4:14, ack 3, win 512, options [nop,nop,TS val 757439695 ecr 757439693], length 10
2022-04-05 00:49:55.324080 IP (tos 0x0, ttl 64, id 737, offset 0, flags [DF], proto TCP (6), length 52)
    127.0.0.1.11550 > 127.0.0.1.58054: Flags [.], cksum 0xfe28 (incorrect -> 0x3927), seq 3, ack 14, win 512, options [nop,nop,TS val 757439695 ecr 757439695], length 0
2022-04-05 00:49:55.675822 IP (tos 0x0, ttl 64, id 738, offset 0, flags [DF], proto TCP (6), length 62)
    127.0.0.1.11550 > 127.0.0.1.58054: Flags [P.], cksum 0xfe32 (incorrect -> 0x32b4), seq 3:13, ack 14, win 512, options [nop,nop,TS val 757440047 ecr 757439695], length 10
2022-04-05 00:49:55.675837 IP (tos 0x0, ttl 64, id 57286, offset 0, flags [DF], proto TCP (6), length 52)
    127.0.0.1.58054 > 127.0.0.1.11550: Flags [.], cksum 0xfe28 (incorrect -> 0x365d), seq 14, ack 13, win 512, options [nop,nop,TS val 757440047 ecr 757440047], length 0
2022-04-05 00:49:55.681748 IP (tos 0x0, ttl 64, id 57287, offset 0, flags [DF], proto TCP (6), length 569)
    127.0.0.1.58054 > 127.0.0.1.11550: Flags [P.], cksum 0x002e (incorrect -> 0x61b5), seq 14:531, ack 13, win 512, options [nop,nop,TS val 757440053 ecr 757440047], length 517
2022-04-05 00:49:55.681759 IP (tos 0x0, ttl 64, id 739, offset 0, flags [DF], proto TCP (6), length 52)
    127.0.0.1.11550 > 127.0.0.1.58054: Flags [.], cksum 0xfe28 (incorrect -> 0x3450), seq 13, ack 531, win 508, options [nop,nop,TS val 757440053 ecr 757440053], length 0
2022-04-05 00:49:56.042933 IP (tos 0x0, ttl 64, id 740, offset 0, flags [DF], proto TCP (6), length 3538)
    127.0.0.1.11550 > 127.0.0.1.58054: Flags [P.], cksum 0x0bc7 (incorrect -> 0xf171), seq 13:3499, ack 531, win 512, options [nop,nop,TS val 757440414 ecr 757440053], length 3486
2022-04-05 00:49:56.042945 IP (tos 0x0, ttl 64, id 57288, offset 0, flags [DF], proto TCP (6), length 52)
    127.0.0.1.58054 > 127.0.0.1.11550: Flags [.], cksum 0xfe28 (incorrect -> 0x23ee), seq 531, ack 3499, win 494, options [nop,nop,TS val 757440414 ecr 757440414], length 0
2022-04-05 00:49:56.194717 IP (tos 0x0, ttl 64, id 741, offset 0, flags [DF], proto TCP (6), length 1840)
    127.0.0.1.11550 > 127.0.0.1.58054: Flags [P.], cksum 0x0525 (incorrect -> 0xe6a1), seq 3499:5287, ack 531, win 512, options [nop,nop,TS val 757440566 ecr 757440414], length 1788
2022-04-05 00:49:56.194726 IP (tos 0x0, ttl 64, id 57289, offset 0, flags [DF], proto TCP (6), length 52)
    127.0.0.1.58054 > 127.0.0.1.11550: Flags [.], cksum 0xfe28 (incorrect -> 0x1bbb), seq 531, ack 5287, win 501, options [nop,nop,TS val 757440566 ecr 757440566], length 0
2022-04-05 00:49:56.197384 IP (tos 0x0, ttl 64, id 57290, offset 0, flags [DF], proto TCP (6), length 210)
    127.0.0.1.58054 > 127.0.0.1.11550: Flags [P.], cksum 0xfec6 (incorrect -> 0x12e6), seq 531:689, ack 5287, win 512, options [nop,nop,TS val 757440568 ecr 757440566], length 158
2022-04-05 00:49:56.197398 IP (tos 0x0, ttl 64, id 742, offset 0, flags [DF], proto TCP (6), length 52)
    127.0.0.1.11550 > 127.0.0.1.58054: Flags [.], cksum 0xfe28 (incorrect -> 0x1b0f), seq 5287, ack 689, win 511, options [nop,nop,TS val 757440568 ecr 757440568], length 0
200, 5.14450216293335, 2.1182754039764404