2022-04-05 11:33:41.637086 IP (tos 0x0, ttl 64, id 12007, offset 0, flags [DF], proto TCP (6), length 60)
    127.0.0.1.45362 > 127.0.0.1.11350: Flags [S], cksum 0xfe30 (incorrect -> 0xc40b), seq 160283643, win 65495, options [mss 65495,sackOK,TS val 240704140 ecr 0,nop,wscale 7], length 0
2022-04-05 11:33:41.637100 IP (tos 0x0, ttl 64, id 0, offset 0, flags [DF], proto TCP (6), length 60)
    127.0.0.1.11350 > 127.0.0.1.45362: Flags [S.], cksum 0xfe30 (incorrect -> 0x53fc), seq 2504389087, ack 160283644, win 65483, options [mss 65495,sackOK,TS val 240704140 ecr 240704140,nop,wscale 7], length 0
2022-04-05 11:33:41.637112 IP (tos 0x0, ttl 64, id 12008, offset 0, flags [DF], proto TCP (6), length 52)
    127.0.0.1.45362 > 127.0.0.1.11350: Flags [.], cksum 0xfe28 (incorrect -> 0x7ab8), seq 1, ack 1, win 512, options [nop,nop,TS val 240704140 ecr 240704140], length 0
2022-04-05 11:33:41.637217 IP (tos 0x0, ttl 64, id 12009, offset 0, flags [DF], proto TCP (6), length 55)
    127.0.0.1.45362 > 127.0.0.1.11350: Flags [P.], cksum 0xfe2b (incorrect -> 0x75ac), seq 1:4, ack 1, win 512, options [nop,nop,TS val 240704140 ecr 240704140], length 3
2022-04-05 11:33:41.637220 IP (tos 0x0, ttl 64, id 2314, offset 0, flags [DF], proto TCP (6), length 52)
    127.0.0.1.11350 > 127.0.0.1.45362: Flags [.], cksum 0xfe28 (incorrect -> 0x7ab5), seq 1, ack 4, win 512, options [nop,nop,TS val 240704140 ecr 240704140], length 0
2022-04-05 11:33:41.637311 IP (tos 0x0, ttl 64, id 2315, offset 0, flags [DF], proto TCP (6), length 54)
    127.0.0.1.11350 > 127.0.0.1.45362: Flags [P.], cksum 0xfe2a (incorrect -> 0x75ab), seq 1:3, ack 4, win 512, options [nop,nop,TS val 240704140 ecr 240704140], length 2
2022-04-05 11:33:41.637315 IP (tos 0x0, ttl 64, id 12010, offset 0, flags [DF], proto TCP (6), length 52)
    127.0.0.1.45362 > 127.0.0.1.11350: Flags [.], cksum 0xfe28 (incorrect -> 0x7ab3), seq 4, ack 3, win 512, options [nop,nop,TS val 240704140 ecr 240704140], length 0
2022-04-05 11:33:41.639568 IP (tos 0x0, ttl 64, id 12011, offset 0, flags [DF], proto TCP (6), length 62)
    127.0.0.1.45362 > 127.0.0.1.11350: Flags [P.], cksum 0xfe32 (incorrect -> 0x3be9), seq 4:14, ack 3, win 512, options [nop,nop,TS val 240704142 ecr 240704140], length 10
2022-04-05 11:33:41.639574 IP (tos 0x0, ttl 64, id 2316, offset 0, flags [DF], proto TCP (6), length 52)
    127.0.0.1.11350 > 127.0.0.1.45362: Flags [.], cksum 0xfe28 (incorrect -> 0x7aa5), seq 3, ack 14, win 512, options [nop,nop,TS val 240704142 ecr 240704142], length 0
2022-04-05 11:33:41.746366 IP (tos 0x0, ttl 64, id 2317, offset 0, flags [DF], proto TCP (6), length 62)
    127.0.0.1.11350 > 127.0.0.1.45362: Flags [P.], cksum 0xfe32 (incorrect -> 0x7527), seq 3:13, ack 14, win 512, options [nop,nop,TS val 240704249 ecr 240704142], length 10
2022-04-05 11:33:41.746371 IP (tos 0x0, ttl 64, id 12012, offset 0, flags [DF], proto TCP (6), length 52)
    127.0.0.1.45362 > 127.0.0.1.11350: Flags [.], cksum 0xfe28 (incorrect -> 0x79c5), seq 14, ack 13, win 512, options [nop,nop,TS val 240704249 ecr 240704249], length 0
2022-04-05 11:33:41.751997 IP (tos 0x0, ttl 64, id 12013, offset 0, flags [DF], proto TCP (6), length 569)
    127.0.0.1.45362 > 127.0.0.1.11350: Flags [P.], cksum 0x002e (incorrect -> 0x5f31), seq 14:531, ack 13, win 512, options [nop,nop,TS val 240704254 ecr 240704249], length 517
2022-04-05 11:33:41.752003 IP (tos 0x0, ttl 64, id 2318, offset 0, flags [DF], proto TCP (6), length 52)
    127.0.0.1.11350 > 127.0.0.1.45362: Flags [.], cksum 0xfe28 (incorrect -> 0x77ba), seq 13, ack 531, win 508, options [nop,nop,TS val 240704254 ecr 240704254], length 0
200, 23.042297840118408, 1.0596959590911865