2022-04-05 15:51:59.885435 IP (tos 0x0, ttl 64, id 47284, offset 0, flags [DF], proto TCP (6), length 60)
    127.0.0.1.60864 > 127.0.0.1.12250: Flags [S], cksum 0xfe30 (incorrect -> 0x8d23), seq 2047001959, win 65495, options [mss 65495,sackOK,TS val 256202388 ecr 0,nop,wscale 7], length 0
2022-04-05 15:51:59.885447 IP (tos 0x0, ttl 64, id 0, offset 0, flags [DF], proto TCP (6), length 60)
    127.0.0.1.12250 > 127.0.0.1.60864: Flags [S.], cksum 0xfe30 (incorrect -> 0xf83c), seq 3352782640, ack 2047001960, win 65483, options [mss 65495,sackOK,TS val 256202388 ecr 256202388,nop,wscale 7], length 0
2022-04-05 15:51:59.885457 IP (tos 0x0, ttl 64, id 47285, offset 0, flags [DF], proto TCP (6), length 52)
    127.0.0.1.60864 > 127.0.0.1.12250: Flags [.], cksum 0xfe28 (incorrect -> 0x1ef9), seq 1, ack 1, win 512, options [nop,nop,TS val 256202388 ecr 256202388], length 0
2022-04-05 15:51:59.885553 IP (tos 0x0, ttl 64, id 47286, offset 0, flags [DF], proto TCP (6), length 55)
    127.0.0.1.60864 > 127.0.0.1.12250: Flags [P.], cksum 0xfe2b (incorrect -> 0x19ed), seq 1:4, ack 1, win 512, options [nop,nop,TS val 256202388 ecr 256202388], length 3
2022-04-05 15:51:59.885557 IP (tos 0x0, ttl 64, id 22599, offset 0, flags [DF], proto TCP (6), length 52)
    127.0.0.1.12250 > 127.0.0.1.60864: Flags [.], cksum 0xfe28 (incorrect -> 0x1ef6), seq 1, ack 4, win 512, options [nop,nop,TS val 256202388 ecr 256202388], length 0
2022-04-05 15:51:59.885635 IP (tos 0x0, ttl 64, id 22600, offset 0, flags [DF], proto TCP (6), length 54)
    127.0.0.1.12250 > 127.0.0.1.60864: Flags [P.], cksum 0xfe2a (incorrect -> 0x19ec), seq 1:3, ack 4, win 512, options [nop,nop,TS val 256202388 ecr 256202388], length 2
2022-04-05 15:51:59.885640 IP (tos 0x0, ttl 64, id 47287, offset 0, flags [DF], proto TCP (6), length 52)
    127.0.0.1.60864 > 127.0.0.1.12250: Flags [.], cksum 0xfe28 (incorrect -> 0x1ef4), seq 4, ack 3, win 512, options [nop,nop,TS val 256202388 ecr 256202388], length 0
2022-04-05 15:51:59.898190 IP (tos 0x0, ttl 64, id 47288, offset 0, flags [DF], proto TCP (6), length 62)
    127.0.0.1.60864 > 127.0.0.1.12250: Flags [P.], cksum 0xfe32 (incorrect -> 0x85f3), seq 4:14, ack 3, win 512, options [nop,nop,TS val 256202401 ecr 256202388], length 10
2022-04-05 15:51:59.898218 IP (tos 0x0, ttl 64, id 22601, offset 0, flags [DF], proto TCP (6), length 52)
    127.0.0.1.12250 > 127.0.0.1.60864: Flags [.], cksum 0xfe28 (incorrect -> 0x1ed0), seq 3, ack 14, win 512, options [nop,nop,TS val 256202401 ecr 256202401], length 0
2022-04-05 15:51:59.941209 IP (tos 0x0, ttl 64, id 22602, offset 0, flags [DF], proto TCP (6), length 62)
    127.0.0.1.12250 > 127.0.0.1.60864: Flags [P.], cksum 0xfe32 (incorrect -> 0x1992), seq 3:13, ack 14, win 512, options [nop,nop,TS val 256202444 ecr 256202401], length 10
2022-04-05 15:51:59.941220 IP (tos 0x0, ttl 64, id 47289, offset 0, flags [DF], proto TCP (6), length 52)
    127.0.0.1.60864 > 127.0.0.1.12250: Flags [.], cksum 0xfe28 (incorrect -> 0x1e70), seq 14, ack 13, win 512, options [nop,nop,TS val 256202444 ecr 256202444], length 0
2022-04-05 15:51:59.946613 IP (tos 0x0, ttl 64, id 47290, offset 0, flags [DF], proto TCP (6), length 569)
    127.0.0.1.60864 > 127.0.0.1.12250: Flags [P.], cksum 0x002e (incorrect -> 0xb2b8), seq 14:531, ack 13, win 512, options [nop,nop,TS val 256202449 ecr 256202444], length 517
2022-04-05 15:51:59.946620 IP (tos 0x0, ttl 64, id 22603, offset 0, flags [DF], proto TCP (6), length 52)
    127.0.0.1.12250 > 127.0.0.1.60864: Flags [.], cksum 0xfe28 (incorrect -> 0x1c65), seq 13, ack 531, win 508, options [nop,nop,TS val 256202449 ecr 256202449], length 0
2022-04-05 15:51:59.983014 IP (tos 0x0, ttl 64, id 22604, offset 0, flags [DF], proto TCP (6), length 3538)
    127.0.0.1.12250 > 127.0.0.1.60864: Flags [P.], cksum 0x0bc7 (incorrect -> 0xe36c), seq 13:3499, ack 531, win 512, options [nop,nop,TS val 256202485 ecr 256202449], length 3486
2022-04-05 15:51:59.983021 IP (tos 0x0, ttl 64, id 47291, offset 0, flags [DF], proto TCP (6), length 52)
    127.0.0.1.60864 > 127.0.0.1.12250: Flags [.], cksum 0xfe28 (incorrect -> 0x0e8d), seq 531, ack 3499, win 494, options [nop,nop,TS val 256202485 ecr 256202485], length 0
2022-04-05 15:51:59.996947 IP (tos 0x0, ttl 64, id 22605, offset 0, flags [DF], proto TCP (6), length 201)
    127.0.0.1.12250 > 127.0.0.1.60864: Flags [P.], cksum 0xfebd (incorrect -> 0x4da3), seq 3499:3648, ack 531, win 512, options [nop,nop,TS val 256202499 ecr 256202485], length 149
2022-04-05 15:51:59.996957 IP (tos 0x0, ttl 64, id 47292, offset 0, flags [DF], proto TCP (6), length 52)
    127.0.0.1.60864 > 127.0.0.1.12250: Flags [.], cksum 0xfe28 (incorrect -> 0x0dcf), seq 531, ack 3648, win 507, options [nop,nop,TS val 256202499 ecr 256202499], length 0
2022-04-05 15:51:59.999431 IP (tos 0x0, ttl 64, id 47293, offset 0, flags [DF], proto TCP (6), length 210)
    127.0.0.1.60864 > 127.0.0.1.12250: Flags [P.], cksum 0xfec6 (incorrect -> 0xe8d9), seq 531:689, ack 3648, win 512, options [nop,nop,TS val 256202502 ecr 256202499], length 158
2022-04-05 15:51:59.999438 IP (tos 0x0, ttl 64, id 22606, offset 0, flags [DF], proto TCP (6), length 52)
    127.0.0.1.12250 > 127.0.0.1.60864: Flags [.], cksum 0xfe28 (incorrect -> 0x0d27), seq 3648, ack 689, win 511, options [nop,nop,TS val 256202502 ecr 256202502], length 0
200, 10.722225189208984, 0.6224234104156494