2022-04-05 05:39:45.808328 IP (tos 0x0, ttl 64, id 37268, offset 0, flags [DF], proto TCP (6), length 60)
    127.0.0.1.37468 > 127.0.0.1.10650: Flags [S], cksum 0xfe30 (incorrect -> 0x5906), seq 431225535, win 65495, options [mss 65495,sackOK,TS val 774830179 ecr 0,nop,wscale 7], length 0
2022-04-05 05:39:45.808340 IP (tos 0x0, ttl 64, id 0, offset 0, flags [DF], proto TCP (6), length 60)
    127.0.0.1.10650 > 127.0.0.1.37468: Flags [S.], cksum 0xfe30 (incorrect -> 0x58dd), seq 1018928342, ack 431225536, win 65483, options [mss 65495,sackOK,TS val 774830179 ecr 774830179,nop,wscale 7], length 0
2022-04-05 05:39:45.808349 IP (tos 0x0, ttl 64, id 37269, offset 0, flags [DF], proto TCP (6), length 52)
    127.0.0.1.37468 > 127.0.0.1.10650: Flags [.], cksum 0xfe28 (incorrect -> 0x7f99), seq 1, ack 1, win 512, options [nop,nop,TS val 774830179 ecr 774830179], length 0
2022-04-05 05:39:45.808452 IP (tos 0x0, ttl 64, id 37270, offset 0, flags [DF], proto TCP (6), length 55)
    127.0.0.1.37468 > 127.0.0.1.10650: Flags [P.], cksum 0xfe2b (incorrect -> 0x7a8c), seq 1:4, ack 1, win 512, options [nop,nop,TS val 774830180 ecr 774830179], length 3
2022-04-05 05:39:45.808467 IP (tos 0x0, ttl 64, id 9492, offset 0, flags [DF], proto TCP (6), length 52)
    127.0.0.1.10650 > 127.0.0.1.37468: Flags [.], cksum 0xfe28 (incorrect -> 0x7f94), seq 1, ack 4, win 512, options [nop,nop,TS val 774830180 ecr 774830180], length 0
2022-04-05 05:39:45.808547 IP (tos 0x0, ttl 64, id 9493, offset 0, flags [DF], proto TCP (6), length 54)
    127.0.0.1.10650 > 127.0.0.1.37468: Flags [P.], cksum 0xfe2a (incorrect -> 0x7a8a), seq 1:3, ack 4, win 512, options [nop,nop,TS val 774830180 ecr 774830180], length 2
2022-04-05 05:39:45.808563 IP (tos 0x0, ttl 64, id 37271, offset 0, flags [DF], proto TCP (6), length 52)
    127.0.0.1.37468 > 127.0.0.1.10650: Flags [.], cksum 0xfe28 (incorrect -> 0x7f92), seq 4, ack 3, win 512, options [nop,nop,TS val 774830180 ecr 774830180], length 0
2022-04-05 05:39:45.820319 IP (tos 0x0, ttl 64, id 37272, offset 0, flags [DF], proto TCP (6), length 62)
    127.0.0.1.37468 > 127.0.0.1.10650: Flags [P.], cksum 0xfe32 (incorrect -> 0xca20), seq 4:14, ack 3, win 512, options [nop,nop,TS val 774830191 ecr 774830180], length 10
2022-04-05 05:39:45.820330 IP (tos 0x0, ttl 64, id 9494, offset 0, flags [DF], proto TCP (6), length 52)
    127.0.0.1.10650 > 127.0.0.1.37468: Flags [.], cksum 0xfe28 (incorrect -> 0x7f72), seq 3, ack 14, win 512, options [nop,nop,TS val 774830191 ecr 774830191], length 0
2022-04-05 05:39:45.904210 IP (tos 0x0, ttl 64, id 9495, offset 0, flags [DF], proto TCP (6), length 62)
    127.0.0.1.10650 > 127.0.0.1.37468: Flags [P.], cksum 0xfe32 (incorrect -> 0x7a0b), seq 3:13, ack 14, win 512, options [nop,nop,TS val 774830275 ecr 774830191], length 10
2022-04-05 05:39:45.904221 IP (tos 0x0, ttl 64, id 37273, offset 0, flags [DF], proto TCP (6), length 52)
    127.0.0.1.37468 > 127.0.0.1.10650: Flags [.], cksum 0xfe28 (incorrect -> 0x7ec0), seq 14, ack 13, win 512, options [nop,nop,TS val 774830275 ecr 774830275], length 0
2022-04-05 05:39:45.910229 IP (tos 0x0, ttl 64, id 37274, offset 0, flags [DF], proto TCP (6), length 569)
    127.0.0.1.37468 > 127.0.0.1.10650: Flags [P.], cksum 0x002e (incorrect -> 0xebee), seq 14:531, ack 13, win 512, options [nop,nop,TS val 774830281 ecr 774830275], length 517
2022-04-05 05:39:45.910240 IP (tos 0x0, ttl 64, id 9496, offset 0, flags [DF], proto TCP (6), length 52)
    127.0.0.1.10650 > 127.0.0.1.37468: Flags [.], cksum 0xfe28 (incorrect -> 0x7cb3), seq 13, ack 531, win 508, options [nop,nop,TS val 774830281 ecr 774830281], length 0
2022-04-05 05:39:45.994327 IP (tos 0x0, ttl 64, id 9497, offset 0, flags [DF], proto TCP (6), length 3538)
    127.0.0.1.10650 > 127.0.0.1.37468: Flags [P.], cksum 0x0bc7 (incorrect -> 0xa9f4), seq 13:3499, ack 531, win 512, options [nop,nop,TS val 774830365 ecr 774830281], length 3486
2022-04-05 05:39:45.994336 IP (tos 0x0, ttl 64, id 37275, offset 0, flags [DF], proto TCP (6), length 52)
    127.0.0.1.37468 > 127.0.0.1.10650: Flags [.], cksum 0xfe28 (incorrect -> 0x6e7b), seq 531, ack 3499, win 494, options [nop,nop,TS val 774830365 ecr 774830365], length 0
2022-04-05 05:39:46.059301 IP (tos 0x0, ttl 64, id 9498, offset 0, flags [DF], proto TCP (6), length 781)
    127.0.0.1.10650 > 127.0.0.1.37468: Flags [P.], cksum 0x0102 (incorrect -> 0x06d1), seq 3499:4228, ack 531, win 512, options [nop,nop,TS val 774830430 ecr 774830365], length 729
2022-04-05 05:39:46.059316 IP (tos 0x0, ttl 64, id 37276, offset 0, flags [DF], proto TCP (6), length 52)
    127.0.0.1.37468 > 127.0.0.1.10650: Flags [.], cksum 0xfe28 (incorrect -> 0x6b15), seq 531, ack 4228, win 505, options [nop,nop,TS val 774830430 ecr 774830430], length 0
2022-04-05 05:39:46.059949 IP (tos 0x0, ttl 64, id 37277, offset 0, flags [DF], proto TCP (6), length 132)
    127.0.0.1.37468 > 127.0.0.1.10650: Flags [P.], cksum 0xfe78 (incorrect -> 0x853f), seq 531:611, ack 4228, win 512, options [nop,nop,TS val 774830431 ecr 774830430], length 80
2022-04-05 05:39:46.059967 IP (tos 0x0, ttl 64, id 9499, offset 0, flags [DF], proto TCP (6), length 52)
    127.0.0.1.10650 > 127.0.0.1.37468: Flags [.], cksum 0xfe28 (incorrect -> 0x6abc), seq 4228, ack 611, win 512, options [nop,nop,TS val 774830431 ecr 774830431], length 0
2022-04-05 05:39:46.060426 IP (tos 0x0, ttl 64, id 37278, offset 0, flags [DF], proto TCP (6), length 339)
    127.0.0.1.37468 > 127.0.0.1.10650: Flags [P.], cksum 0xff47 (incorrect -> 0x5ffd), seq 611:898, ack 4228, win 512, options [nop,nop,TS val 774830432 ecr 774830431], length 287
2022-04-05 05:39:46.060437 IP (tos 0x0, ttl 64, id 9500, offset 0, flags [DF], proto TCP (6), length 52)
    127.0.0.1.10650 > 127.0.0.1.37468: Flags [.], cksum 0xfe28 (incorrect -> 0x699d), seq 4228, ack 898, win 510, options [nop,nop,TS val 774830432 ecr 774830432], length 0
2022-04-05 05:39:46.156816 IP (tos 0x0, ttl 64, id 9501, offset 0, flags [DF], proto TCP (6), length 594)
    127.0.0.1.10650 > 127.0.0.1.37468: Flags [P.], cksum 0x0047 (incorrect -> 0x8c15), seq 4228:4770, ack 898, win 512, options [nop,nop,TS val 774830528 ecr 774830432], length 542
2022-04-05 05:39:46.156825 IP (tos 0x0, ttl 64, id 37279, offset 0, flags [DF], proto TCP (6), length 52)
    127.0.0.1.37468 > 127.0.0.1.10650: Flags [.], cksum 0xfe28 (incorrect -> 0x66c1), seq 898, ack 4770, win 508, options [nop,nop,TS val 774830528 ecr 774830528], length 0
2022-04-05 05:39:46.215649 IP (tos 0x0, ttl 64, id 9502, offset 0, flags [DF], proto TCP (6), length 3538)
    127.0.0.1.10650 > 127.0.0.1.37468: Flags [P.], cksum 0x0bc7 (incorrect -> 0x45d3), seq 4770:8256, ack 898, win 512, options [nop,nop,TS val 774830587 ecr 774830528], length 3486
2022-04-05 05:39:46.215658 IP (tos 0x0, ttl 64, id 37280, offset 0, flags [DF], proto TCP (6), length 52)
    127.0.0.1.37468 > 127.0.0.1.10650: Flags [.], cksum 0xfe28 (incorrect -> 0x58bb), seq 898, ack 8256, win 494, options [nop,nop,TS val 774830587 ecr 774830587], length 0
2022-04-05 05:39:46.230804 IP (tos 0x0, ttl 64, id 9503, offset 0, flags [DF], proto TCP (6), length 4036)
    127.0.0.1.10650 > 127.0.0.1.37468: Flags [P.], cksum 0x0db9 (incorrect -> 0xe9ac), seq 8256:12240, ack 898, win 512, options [nop,nop,TS val 774830602 ecr 774830587], length 3984
2022-04-05 05:39:46.230812 IP (tos 0x0, ttl 64, id 37281, offset 0, flags [DF], proto TCP (6), length 52)
    127.0.0.1.37468 > 127.0.0.1.10650: Flags [.], cksum 0xfe28 (incorrect -> 0x490f), seq 898, ack 12240, win 492, options [nop,nop,TS val 774830602 ecr 774830602], length 0
2022-04-05 05:39:46.248994 IP (tos 0x0, ttl 64, id 9504, offset 0, flags [DF], proto TCP (6), length 4036)
    127.0.0.1.10650 > 127.0.0.1.37468: Flags [P.], cksum 0x0db9 (incorrect -> 0x022f), seq 12240:16224, ack 898, win 512, options [nop,nop,TS val 774830620 ecr 774830602], length 3984
2022-04-05 05:39:46.249003 IP (tos 0x0, ttl 64, id 37282, offset 0, flags [DF], proto TCP (6), length 52)
    127.0.0.1.37468 > 127.0.0.1.10650: Flags [.], cksum 0xfe28 (incorrect -> 0x395b), seq 898, ack 16224, win 492, options [nop,nop,TS val 774830620 ecr 774830620], length 0
2022-04-05 05:39:46.249062 IP (tos 0x0, ttl 64, id 9505, offset 0, flags [DF], proto TCP (6), length 4100)
    127.0.0.1.10650 > 127.0.0.1.37468: Flags [P.], cksum 0x0df9 (incorrect -> 0xf853), seq 16224:20272, ack 898, win 512, options [nop,nop,TS val 774830620 ecr 774830620], length 4048
2022-04-05 05:39:46.249067 IP (tos 0x0, ttl 64, id 37283, offset 0, flags [DF], proto TCP (6), length 52)
    127.0.0.1.37468 > 127.0.0.1.10650: Flags [.], cksum 0xfe28 (incorrect -> 0x299b), seq 898, ack 20272, win 476, options [nop,nop,TS val 774830620 ecr 774830620], length 0
2022-04-05 05:39:46.249074 IP (tos 0x0, ttl 64, id 9506, offset 0, flags [DF], proto TCP (6), length 2922)
    127.0.0.1.10650 > 127.0.0.1.37468: Flags [P.], cksum 0x095f (incorrect -> 0x28b9), seq 20272:23142, ack 898, win 512, options [nop,nop,TS val 774830620 ecr 774830620], length 2870
2022-04-05 05:39:46.249078 IP (tos 0x0, ttl 64, id 37284, offset 0, flags [DF], proto TCP (6), length 52)
    127.0.0.1.37468 > 127.0.0.1.10650: Flags [.], cksum 0xfe28 (incorrect -> 0x1e70), seq 898, ack 23142, win 465, options [nop,nop,TS val 774830620 ecr 774830620], length 0
2022-04-05 05:39:46.249144 IP (tos 0x0, ttl 64, id 9507, offset 0, flags [DF], proto TCP (6), length 3944)
    127.0.0.1.10650 > 127.0.0.1.37468: Flags [P.], cksum 0x0d5d (incorrect -> 0x5db6), seq 23142:27034, ack 898, win 512, options [nop,nop,TS val 774830620 ecr 774830620], length 3892
2022-04-05 05:39:46.249150 IP (tos 0x0, ttl 64, id 37285, offset 0, flags [DF], proto TCP (6), length 52)
    127.0.0.1.37468 > 127.0.0.1.10650: Flags [.], cksum 0xfe28 (incorrect -> 0x0f4b), seq 898, ack 27034, win 450, options [nop,nop,TS val 774830620 ecr 774830620], length 0
2022-04-05 05:39:46.264326 IP (tos 0x0, ttl 64, id 9508, offset 0, flags [DF], proto TCP (6), length 1454)
    127.0.0.1.10650 > 127.0.0.1.37468: Flags [P.], cksum 0x03a3 (incorrect -> 0x2ea6), seq 27034:28436, ack 898, win 512, options [nop,nop,TS val 774830635 ecr 774830620], length 1402
2022-04-05 05:39:46.264333 IP (tos 0x0, ttl 64, id 37286, offset 0, flags [DF], proto TCP (6), length 52)
    127.0.0.1.37468 > 127.0.0.1.10650: Flags [.], cksum 0xfe28 (incorrect -> 0x097f), seq 898, ack 28436, win 502, options [nop,nop,TS val 774830635 ecr 774830635], length 0
2022-04-05 05:39:46.278857 IP (tos 0x0, ttl 64, id 9509, offset 0, flags [DF], proto TCP (6), length 3944)
    127.0.0.1.10650 > 127.0.0.1.37468: Flags [P.], cksum 0x0d5d (incorrect -> 0xbf72), seq 28436:32328, ack 898, win 512, options [nop,nop,TS val 774830650 ecr 774830635], length 3892
2022-04-05 05:39:46.278943 IP (tos 0x0, ttl 64, id 37287, offset 0, flags [DF], proto TCP (6), length 52)
    127.0.0.1.37468 > 127.0.0.1.10650: Flags [.], cksum 0xfe28 (incorrect -> 0xfa22), seq 898, ack 32328, win 512, options [nop,nop,TS val 774830650 ecr 774830650], length 0
2022-04-05 05:39:46.278952 IP (tos 0x0, ttl 64, id 9510, offset 0, flags [DF], proto TCP (6), length 7790)
    127.0.0.1.10650 > 127.0.0.1.37468: Flags [P.], cksum 0x1c63 (incorrect -> 0x4db4), seq 32328:40066, ack 898, win 512, options [nop,nop,TS val 774830650 ecr 774830650], length 7738
2022-04-05 05:39:46.321393 IP (tos 0x0, ttl 64, id 37288, offset 0, flags [DF], proto TCP (6), length 52)
    127.0.0.1.37468 > 127.0.0.1.10650: Flags [.], cksum 0xfe28 (incorrect -> 0xdbbe), seq 898, ack 40066, win 512, options [nop,nop,TS val 774830692 ecr 774830650], length 0
2022-04-05 05:39:46.321406 IP (tos 0x0, ttl 64, id 9511, offset 0, flags [DF], proto TCP (6), length 17972)
    127.0.0.1.10650 > 127.0.0.1.37468: Flags [P.], cksum 0x4429 (incorrect -> 0xe6ca), seq 40066:57986, ack 898, win 512, options [nop,nop,TS val 774830693 ecr 774830692], length 17920
2022-04-05 05:39:46.365411 IP (tos 0x0, ttl 64, id 37289, offset 0, flags [DF], proto TCP (6), length 52)
    127.0.0.1.37468 > 127.0.0.1.10650: Flags [.], cksum 0xfe28 (incorrect -> 0x9567), seq 898, ack 57986, win 512, options [nop,nop,TS val 774830736 ecr 774830693], length 0
2022-04-05 05:39:46.365433 IP (tos 0x0, ttl 64, id 9512, offset 0, flags [DF], proto TCP (6), length 25166)
    127.0.0.1.10650 > 127.0.0.1.37468: Flags [P.], cksum 0x6043 (incorrect -> 0x6c44), seq 57986:83100, ack 898, win 512, options [nop,nop,TS val 774830737 ecr 774830736], length 25114
2022-04-05 05:39:46.409161 IP (tos 0x0, ttl 64, id 9513, offset 0, flags [DF], proto TCP (6), length 32820)
    127.0.0.1.10650 > 127.0.0.1.37468: Flags [.], cksum 0x7e29 (incorrect -> 0x1d35), seq 83100:115868, ack 898, win 512, options [nop,nop,TS val 774830780 ecr 774830736], length 32768
2022-04-05 05:39:46.409170 IP (tos 0x0, ttl 64, id 37290, offset 0, flags [DF], proto TCP (6), length 52)
    127.0.0.1.37468 > 127.0.0.1.10650: Flags [.], cksum 0xfe28 (incorrect -> 0xb379), seq 898, ack 115868, win 379, options [nop,nop,TS val 774830780 ecr 774830737], length 0
2022-04-05 05:39:46.409193 IP (tos 0x0, ttl 64, id 9514, offset 0, flags [DF], proto TCP (6), length 1546)
    127.0.0.1.10650 > 127.0.0.1.37468: Flags [P.], cksum 0x03ff (incorrect -> 0x21c5), seq 115868:117362, ack 898, win 512, options [nop,nop,TS val 774830780 ecr 774830780], length 1494
2022-04-05 05:39:46.409635 IP (tos 0x0, ttl 64, id 37291, offset 0, flags [DF], proto TCP (6), length 52)
    127.0.0.1.37468 > 127.0.0.1.10650: Flags [.], cksum 0xfe28 (incorrect -> 0xacf2), seq 898, ack 117362, win 512, options [nop,nop,TS val 774830781 ecr 774830780], length 0
2022-04-05 05:39:46.410218 IP (tos 0x0, ttl 64, id 9515, offset 0, flags [DF], proto TCP (6), length 4100)
    127.0.0.1.10650 > 127.0.0.1.37468: Flags [P.], cksum 0x0df9 (incorrect -> 0x0b24), seq 117362:121410, ack 898, win 512, options [nop,nop,TS val 774830781 ecr 774830781], length 4048
2022-04-05 05:39:46.410242 IP (tos 0x0, ttl 64, id 37292, offset 0, flags [DF], proto TCP (6), length 52)
    127.0.0.1.37468 > 127.0.0.1.10650: Flags [.], cksum 0xfe28 (incorrect -> 0x9d21), seq 898, ack 121410, win 512, options [nop,nop,TS val 774830781 ecr 774830781], length 0
2022-04-05 05:39:46.410247 IP (tos 0x0, ttl 64, id 9516, offset 0, flags [DF], proto TCP (6), length 486)
    127.0.0.1.10650 > 127.0.0.1.37468: Flags [P.], cksum 0xffda (incorrect -> 0xb658), seq 121410:121844, ack 898, win 512, options [nop,nop,TS val 774830781 ecr 774830781], length 434
2022-04-05 05:39:46.410256 IP (tos 0x0, ttl 64, id 37293, offset 0, flags [DF], proto TCP (6), length 52)
    127.0.0.1.37468 > 127.0.0.1.10650: Flags [.], cksum 0xfe28 (incorrect -> 0x9b6f), seq 898, ack 121844, win 512, options [nop,nop,TS val 774830781 ecr 774830781], length 0
200, 3.853044033050537, 0.7704930305480957