2022-04-05 07:46:03.970430 IP (tos 0x0, ttl 64, id 11773, offset 0, flags [DF], proto TCP (6), length 60)
    127.0.0.1.35024 > 127.0.0.1.10750: Flags [S], cksum 0xfe30 (incorrect -> 0x8320), seq 1866654103, win 65495, options [mss 65495,sackOK,TS val 782408342 ecr 0,nop,wscale 7], length 0
2022-04-05 07:46:03.970447 IP (tos 0x0, ttl 64, id 0, offset 0, flags [DF], proto TCP (6), length 60)
    127.0.0.1.10750 > 127.0.0.1.35024: Flags [S.], cksum 0xfe30 (incorrect -> 0xa43b), seq 3304870058, ack 1866654104, win 65483, options [mss 65495,sackOK,TS val 782408342 ecr 782408342,nop,wscale 7], length 0
2022-04-05 07:46:03.970462 IP (tos 0x0, ttl 64, id 11774, offset 0, flags [DF], proto TCP (6), length 52)
    127.0.0.1.35024 > 127.0.0.1.10750: Flags [.], cksum 0xfe28 (incorrect -> 0xcaf7), seq 1, ack 1, win 512, options [nop,nop,TS val 782408342 ecr 782408342], length 0
2022-04-05 07:46:03.970576 IP (tos 0x0, ttl 64, id 11775, offset 0, flags [DF], proto TCP (6), length 55)
    127.0.0.1.35024 > 127.0.0.1.10750: Flags [P.], cksum 0xfe2b (incorrect -> 0xc5eb), seq 1:4, ack 1, win 512, options [nop,nop,TS val 782408342 ecr 782408342], length 3
2022-04-05 07:46:03.970588 IP (tos 0x0, ttl 64, id 26880, offset 0, flags [DF], proto TCP (6), length 52)
    127.0.0.1.10750 > 127.0.0.1.35024: Flags [.], cksum 0xfe28 (incorrect -> 0xcaf4), seq 1, ack 4, win 512, options [nop,nop,TS val 782408342 ecr 782408342], length 0
2022-04-05 07:46:03.970621 IP (tos 0x0, ttl 64, id 26881, offset 0, flags [DF], proto TCP (6), length 54)
    127.0.0.1.10750 > 127.0.0.1.35024: Flags [P.], cksum 0xfe2a (incorrect -> 0xc5ea), seq 1:3, ack 4, win 512, options [nop,nop,TS val 782408342 ecr 782408342], length 2
2022-04-05 07:46:03.970631 IP (tos 0x0, ttl 64, id 11776, offset 0, flags [DF], proto TCP (6), length 52)
    127.0.0.1.35024 > 127.0.0.1.10750: Flags [.], cksum 0xfe28 (incorrect -> 0xcaf2), seq 4, ack 3, win 512, options [nop,nop,TS val 782408342 ecr 782408342], length 0
2022-04-05 07:46:03.973264 IP (tos 0x0, ttl 64, id 11777, offset 0, flags [DF], proto TCP (6), length 62)
    127.0.0.1.35024 > 127.0.0.1.10750: Flags [P.], cksum 0xfe32 (incorrect -> 0x629b), seq 4:14, ack 3, win 512, options [nop,nop,TS val 782408344 ecr 782408342], length 10
2022-04-05 07:46:03.973281 IP (tos 0x0, ttl 64, id 26882, offset 0, flags [DF], proto TCP (6), length 52)
    127.0.0.1.10750 > 127.0.0.1.35024: Flags [.], cksum 0xfe28 (incorrect -> 0xcae4), seq 3, ack 14, win 512, options [nop,nop,TS val 782408344 ecr 782408344], length 0
2022-04-05 07:46:04.083571 IP (tos 0x0, ttl 64, id 26883, offset 0, flags [DF], proto TCP (6), length 62)
    127.0.0.1.10750 > 127.0.0.1.35024: Flags [P.], cksum 0xfe32 (incorrect -> 0xc562), seq 3:13, ack 14, win 512, options [nop,nop,TS val 782408455 ecr 782408344], length 10
2022-04-05 07:46:04.083584 IP (tos 0x0, ttl 64, id 11778, offset 0, flags [DF], proto TCP (6), length 52)
    127.0.0.1.35024 > 127.0.0.1.10750: Flags [.], cksum 0xfe28 (incorrect -> 0xc9fc), seq 14, ack 13, win 512, options [nop,nop,TS val 782408455 ecr 782408455], length 0
2022-04-05 07:46:04.089614 IP (tos 0x0, ttl 64, id 11779, offset 0, flags [DF], proto TCP (6), length 569)
    127.0.0.1.35024 > 127.0.0.1.10750: Flags [P.], cksum 0x002e (incorrect -> 0xa258), seq 14:531, ack 13, win 512, options [nop,nop,TS val 782408461 ecr 782408455], length 517
2022-04-05 07:46:04.089623 IP (tos 0x0, ttl 64, id 26884, offset 0, flags [DF], proto TCP (6), length 52)
    127.0.0.1.10750 > 127.0.0.1.35024: Flags [.], cksum 0xfe28 (incorrect -> 0xc7ef), seq 13, ack 531, win 508, options [nop,nop,TS val 782408461 ecr 782408461], length 0
2022-04-05 07:46:04.230332 IP (tos 0x0, ttl 64, id 26885, offset 0, flags [DF], proto TCP (6), length 3538)
    127.0.0.1.10750 > 127.0.0.1.35024: Flags [P.], cksum 0x0bc7 (incorrect -> 0xb996), seq 13:3499, ack 531, win 512, options [nop,nop,TS val 782408601 ecr 782408461], length 3486
2022-04-05 07:46:04.230342 IP (tos 0x0, ttl 64, id 11780, offset 0, flags [DF], proto TCP (6), length 52)
    127.0.0.1.35024 > 127.0.0.1.10750: Flags [.], cksum 0xfe28 (incorrect -> 0xb947), seq 531, ack 3499, win 494, options [nop,nop,TS val 782408601 ecr 782408601], length 0
2022-04-05 07:46:04.282048 IP (tos 0x0, ttl 64, id 26886, offset 0, flags [DF], proto TCP (6), length 1494)
    127.0.0.1.10750 > 127.0.0.1.35024: Flags [P.], cksum 0x03cb (incorrect -> 0x7181), seq 3499:4941, ack 531, win 512, options [nop,nop,TS val 782408653 ecr 782408601], length 1442
2022-04-05 07:46:04.282055 IP (tos 0x0, ttl 64, id 11781, offset 0, flags [DF], proto TCP (6), length 52)
    127.0.0.1.35024 > 127.0.0.1.10750: Flags [.], cksum 0xfe28 (incorrect -> 0xb335), seq 531, ack 4941, win 502, options [nop,nop,TS val 782408653 ecr 782408653], length 0
2022-04-05 07:46:04.282407 IP (tos 0x0, ttl 64, id 11782, offset 0, flags [DF], proto TCP (6), length 116)
    127.0.0.1.35024 > 127.0.0.1.10750: Flags [P.], cksum 0xfe68 (incorrect -> 0xe447), seq 531:595, ack 4941, win 512, options [nop,nop,TS val 782408654 ecr 782408653], length 64
2022-04-05 07:46:04.282414 IP (tos 0x0, ttl 64, id 26887, offset 0, flags [DF], proto TCP (6), length 52)
    127.0.0.1.10750 > 127.0.0.1.35024: Flags [.], cksum 0xfe28 (incorrect -> 0xb2e9), seq 4941, ack 595, win 512, options [nop,nop,TS val 782408654 ecr 782408654], length 0
2022-04-05 07:46:04.282787 IP (tos 0x0, ttl 64, id 11783, offset 0, flags [DF], proto TCP (6), length 293)
    127.0.0.1.35024 > 127.0.0.1.10750: Flags [P.], cksum 0xff19 (incorrect -> 0xfbea), seq 595:836, ack 4941, win 512, options [nop,nop,TS val 782408654 ecr 782408654], length 241
2022-04-05 07:46:04.282796 IP (tos 0x0, ttl 64, id 26888, offset 0, flags [DF], proto TCP (6), length 52)
    127.0.0.1.10750 > 127.0.0.1.35024: Flags [.], cksum 0xfe28 (incorrect -> 0xb1f9), seq 4941, ack 836, win 511, options [nop,nop,TS val 782408654 ecr 782408654], length 0
2022-04-05 07:46:04.848573 IP (tos 0x0, ttl 64, id 26889, offset 0, flags [DF], proto TCP (6), length 1919)
    127.0.0.1.10750 > 127.0.0.1.35024: Flags [P.], cksum 0x0574 (incorrect -> 0xfb11), seq 4941:6808, ack 836, win 512, options [nop,nop,TS val 782409220 ecr 782408654], length 1867
2022-04-05 07:46:04.848594 IP (tos 0x0, ttl 64, id 11784, offset 0, flags [DF], proto TCP (6), length 52)
    127.0.0.1.35024 > 127.0.0.1.10750: Flags [.], cksum 0xfe28 (incorrect -> 0xa64d), seq 836, ack 6808, win 500, options [nop,nop,TS val 782409220 ecr 782409220], length 0
2022-04-05 07:46:04.869014 IP (tos 0x0, ttl 64, id 26890, offset 0, flags [DF], proto TCP (6), length 3538)
    127.0.0.1.10750 > 127.0.0.1.35024: Flags [P.], cksum 0x0bc7 (incorrect -> 0xd2d4), seq 6808:10294, ack 836, win 512, options [nop,nop,TS val 782409240 ecr 782409220], length 3486
2022-04-05 07:46:04.869023 IP (tos 0x0, ttl 64, id 11785, offset 0, flags [DF], proto TCP (6), length 52)
    127.0.0.1.35024 > 127.0.0.1.10750: Flags [.], cksum 0xfe28 (incorrect -> 0x988d), seq 836, ack 10294, win 494, options [nop,nop,TS val 782409240 ecr 782409240], length 0
2022-04-05 07:46:04.901519 IP (tos 0x0, ttl 64, id 26891, offset 0, flags [DF], proto TCP (6), length 1251)
    127.0.0.1.10750 > 127.0.0.1.35024: Flags [P.], cksum 0x02d8 (incorrect -> 0xfb29), seq 10294:11493, ack 836, win 512, options [nop,nop,TS val 782409273 ecr 782409240], length 1199
2022-04-05 07:46:04.901531 IP (tos 0x0, ttl 64, id 11786, offset 0, flags [DF], proto TCP (6), length 52)
    127.0.0.1.35024 > 127.0.0.1.10750: Flags [.], cksum 0xfe28 (incorrect -> 0x9393), seq 836, ack 11493, win 503, options [nop,nop,TS val 782409273 ecr 782409273], length 0
2022-04-05 07:46:04.944610 IP (tos 0x0, ttl 64, id 26892, offset 0, flags [DF], proto TCP (6), length 3430)
    127.0.0.1.10750 > 127.0.0.1.35024: Flags [P.], cksum 0x0b5b (incorrect -> 0xdfd5), seq 11493:14871, ack 836, win 512, options [nop,nop,TS val 782409316 ecr 782409273], length 3378
2022-04-05 07:46:04.944618 IP (tos 0x0, ttl 64, id 11787, offset 0, flags [DF], proto TCP (6), length 52)
    127.0.0.1.35024 > 127.0.0.1.10750: Flags [.], cksum 0xfe28 (incorrect -> 0x8614), seq 836, ack 14871, win 494, options [nop,nop,TS val 782409316 ecr 782409316], length 0
2022-04-05 07:46:04.944915 IP (tos 0x0, ttl 64, id 26893, offset 0, flags [DF], proto TCP (6), length 2932)
    127.0.0.1.10750 > 127.0.0.1.35024: Flags [P.], cksum 0x0969 (incorrect -> 0x82d1), seq 14871:17751, ack 836, win 512, options [nop,nop,TS val 782409316 ecr 782409316], length 2880
2022-04-05 07:46:04.944920 IP (tos 0x0, ttl 64, id 11788, offset 0, flags [DF], proto TCP (6), length 52)
    127.0.0.1.35024 > 127.0.0.1.10750: Flags [.], cksum 0xfe28 (incorrect -> 0x7ad2), seq 836, ack 17751, win 496, options [nop,nop,TS val 782409316 ecr 782409316], length 0
2022-04-05 07:46:04.958478 IP (tos 0x0, ttl 64, id 26894, offset 0, flags [DF], proto TCP (6), length 578)
    127.0.0.1.10750 > 127.0.0.1.35024: Flags [P.], cksum 0x0037 (incorrect -> 0x4d15), seq 17751:18277, ack 836, win 512, options [nop,nop,TS val 782409330 ecr 782409316], length 526
2022-04-05 07:46:04.958483 IP (tos 0x0, ttl 64, id 11789, offset 0, flags [DF], proto TCP (6), length 52)
    127.0.0.1.35024 > 127.0.0.1.10750: Flags [.], cksum 0xfe28 (incorrect -> 0x789f), seq 836, ack 18277, win 505, options [nop,nop,TS val 782409330 ecr 782409330], length 0
2022-04-05 07:46:04.972559 IP (tos 0x0, ttl 64, id 26895, offset 0, flags [DF], proto TCP (6), length 2932)
    127.0.0.1.10750 > 127.0.0.1.35024: Flags [P.], cksum 0x0969 (incorrect -> 0x8661), seq 18277:21157, ack 836, win 512, options [nop,nop,TS val 782409344 ecr 782409330], length 2880
2022-04-05 07:46:04.972566 IP (tos 0x0, ttl 64, id 11790, offset 0, flags [DF], proto TCP (6), length 52)
    127.0.0.1.35024 > 127.0.0.1.10750: Flags [.], cksum 0xfe28 (incorrect -> 0x6d4c), seq 836, ack 21157, win 496, options [nop,nop,TS val 782409344 ecr 782409344], length 0
2022-04-05 07:46:05.006402 IP (tos 0x0, ttl 64, id 26896, offset 0, flags [DF], proto TCP (6), length 4100)
    127.0.0.1.10750 > 127.0.0.1.35024: Flags [P.], cksum 0x0df9 (incorrect -> 0x070a), seq 21157:25205, ack 836, win 512, options [nop,nop,TS val 782409378 ecr 782409344], length 4048
2022-04-05 07:46:05.006410 IP (tos 0x0, ttl 64, id 11791, offset 0, flags [DF], proto TCP (6), length 52)
    127.0.0.1.35024 > 127.0.0.1.10750: Flags [.], cksum 0xfe28 (incorrect -> 0x5d3c), seq 836, ack 25205, win 492, options [nop,nop,TS val 782409378 ecr 782409378], length 0
2022-04-05 07:46:05.006416 IP (tos 0x0, ttl 64, id 26897, offset 0, flags [DF], proto TCP (6), length 2760)
    127.0.0.1.10750 > 127.0.0.1.35024: Flags [P.], cksum 0x08bd (incorrect -> 0xd9c3), seq 25205:27913, ack 836, win 512, options [nop,nop,TS val 782409378 ecr 782409378], length 2708
2022-04-05 07:46:05.006419 IP (tos 0x0, ttl 64, id 11792, offset 0, flags [DF], proto TCP (6), length 52)
    127.0.0.1.35024 > 127.0.0.1.10750: Flags [.], cksum 0xfe28 (incorrect -> 0x52b3), seq 836, ack 27913, win 481, options [nop,nop,TS val 782409378 ecr 782409378], length 0
2022-04-05 07:46:05.006818 IP (tos 0x0, ttl 64, id 26898, offset 0, flags [DF], proto TCP (6), length 2403)
    127.0.0.1.10750 > 127.0.0.1.35024: Flags [P.], cksum 0x0758 (incorrect -> 0x425b), seq 27913:30264, ack 836, win 512, options [nop,nop,TS val 782409378 ecr 782409378], length 2351
2022-04-05 07:46:05.007085 IP (tos 0x0, ttl 64, id 11793, offset 0, flags [DF], proto TCP (6), length 52)
    127.0.0.1.35024 > 127.0.0.1.10750: Flags [.], cksum 0xfe28 (incorrect -> 0x4965), seq 836, ack 30264, win 512, options [nop,nop,TS val 782409378 ecr 782409378], length 0
2022-04-05 07:46:05.018903 IP (tos 0x0, ttl 64, id 26899, offset 0, flags [DF], proto TCP (6), length 1936)
    127.0.0.1.10750 > 127.0.0.1.35024: Flags [P.], cksum 0x0585 (incorrect -> 0xb669), seq 30264:32148, ack 836, win 512, options [nop,nop,TS val 782409390 ecr 782409378], length 1884
2022-04-05 07:46:05.018920 IP (tos 0x0, ttl 64, id 11794, offset 0, flags [DF], proto TCP (6), length 52)
    127.0.0.1.35024 > 127.0.0.1.10750: Flags [.], cksum 0xfe28 (incorrect -> 0x41f1), seq 836, ack 32148, win 512, options [nop,nop,TS val 782409390 ecr 782409390], length 0
2022-04-05 07:46:05.028735 IP (tos 0x0, ttl 64, id 26900, offset 0, flags [DF], proto TCP (6), length 4100)
    127.0.0.1.10750 > 127.0.0.1.35024: Flags [P.], cksum 0x0df9 (incorrect -> 0xaece), seq 32148:36196, ack 836, win 512, options [nop,nop,TS val 782409400 ecr 782409390], length 4048
2022-04-05 07:46:05.069391 IP (tos 0x0, ttl 64, id 11795, offset 0, flags [DF], proto TCP (6), length 52)
    127.0.0.1.35024 > 127.0.0.1.10750: Flags [.], cksum 0xfe28 (incorrect -> 0x31e5), seq 836, ack 36196, win 512, options [nop,nop,TS val 782409440 ecr 782409400], length 0
2022-04-05 07:46:05.069401 IP (tos 0x0, ttl 64, id 26901, offset 0, flags [DF], proto TCP (6), length 28323)
    127.0.0.1.10750 > 127.0.0.1.35024: Flags [P.], cksum 0x6c98 (incorrect -> 0xbb5f), seq 36196:64467, ack 836, win 512, options [nop,nop,TS val 782409441 ecr 782409440], length 28271
2022-04-05 07:46:05.113395 IP (tos 0x0, ttl 64, id 11796, offset 0, flags [DF], proto TCP (6), length 52)
    127.0.0.1.35024 > 127.0.0.1.10750: Flags [.], cksum 0xfe28 (incorrect -> 0xc320), seq 836, ack 64467, win 512, options [nop,nop,TS val 782409484 ecr 782409441], length 0
2022-04-05 07:46:05.136145 IP (tos 0x0, ttl 64, id 26902, offset 0, flags [DF], proto TCP (6), length 3430)
    127.0.0.1.10750 > 127.0.0.1.35024: Flags [P.], cksum 0x0b5b (incorrect -> 0x35a4), seq 64467:67845, ack 836, win 512, options [nop,nop,TS val 782409507 ecr 782409484], length 3378
2022-04-05 07:46:05.136165 IP (tos 0x0, ttl 64, id 11797, offset 0, flags [DF], proto TCP (6), length 52)
    127.0.0.1.35024 > 127.0.0.1.10750: Flags [.], cksum 0xfe28 (incorrect -> 0xb595), seq 836, ack 67845, win 512, options [nop,nop,TS val 782409507 ecr 782409507], length 0
2022-04-05 07:46:05.140074 IP (tos 0x0, ttl 64, id 26903, offset 0, flags [DF], proto TCP (6), length 3041)
    127.0.0.1.10750 > 127.0.0.1.35024: Flags [P.], cksum 0x09d6 (incorrect -> 0x2f46), seq 67845:70834, ack 836, win 512, options [nop,nop,TS val 782409511 ecr 782409507], length 2989
2022-04-05 07:46:05.140305 IP (tos 0x0, ttl 64, id 11798, offset 0, flags [DF], proto TCP (6), length 52)
    127.0.0.1.35024 > 127.0.0.1.10750: Flags [.], cksum 0xfe28 (incorrect -> 0xa9e0), seq 836, ack 70834, win 512, options [nop,nop,TS val 782409511 ecr 782409511], length 0
2022-04-05 07:46:05.142090 IP (tos 0x0, ttl 64, id 26904, offset 0, flags [DF], proto TCP (6), length 4100)
    127.0.0.1.10750 > 127.0.0.1.35024: Flags [P.], cksum 0x0df9 (incorrect -> 0x9f61), seq 70834:74882, ack 836, win 512, options [nop,nop,TS val 782409513 ecr 782409511], length 4048
2022-04-05 07:46:05.142439 IP (tos 0x0, ttl 64, id 11799, offset 0, flags [DF], proto TCP (6), length 52)
    127.0.0.1.35024 > 127.0.0.1.10750: Flags [.], cksum 0xfe28 (incorrect -> 0x9a0b), seq 836, ack 74882, win 512, options [nop,nop,TS val 782409514 ecr 782409513], length 0
2022-04-05 07:46:05.142457 IP (tos 0x0, ttl 64, id 26905, offset 0, flags [DF], proto TCP (6), length 6919)
    127.0.0.1.10750 > 127.0.0.1.35024: Flags [P.], cksum 0x18fc (incorrect -> 0x3fe5), seq 74882:81749, ack 836, win 512, options [nop,nop,TS val 782409514 ecr 782409514], length 6867
2022-04-05 07:46:05.142462 IP (tos 0x0, ttl 64, id 11800, offset 0, flags [DF], proto TCP (6), length 52)
    127.0.0.1.35024 > 127.0.0.1.10750: Flags [.], cksum 0xfe28 (incorrect -> 0x7f37), seq 836, ack 81749, win 512, options [nop,nop,TS val 782409514 ecr 782409514], length 0
200, 10.931694269180298, 1.2969183921813965