2022-04-05 22:14:24.708265 IP (tos 0x0, ttl 64, id 7160, offset 0, flags [DF], proto TCP (6), length 60)
    127.0.0.1.45872 > 127.0.0.1.9950: Flags [S], cksum 0xfe30 (incorrect -> 0xfe40), seq 1330816241, win 65495, options [mss 65495,sackOK,TS val 279147211 ecr 0,nop,wscale 7], length 0
2022-04-05 22:14:24.708276 IP (tos 0x0, ttl 64, id 0, offset 0, flags [DF], proto TCP (6), length 60)
    127.0.0.1.9950 > 127.0.0.1.45872: Flags [S.], cksum 0xfe30 (incorrect -> 0x6ab6), seq 1491318579, ack 1330816242, win 65483, options [mss 65495,sackOK,TS val 279147211 ecr 279147211,nop,wscale 7], length 0
2022-04-05 22:14:24.708284 IP (tos 0x0, ttl 64, id 7161, offset 0, flags [DF], proto TCP (6), length 52)
    127.0.0.1.45872 > 127.0.0.1.9950: Flags [.], cksum 0xfe28 (incorrect -> 0x9172), seq 1, ack 1, win 512, options [nop,nop,TS val 279147211 ecr 279147211], length 0
2022-04-05 22:14:24.708369 IP (tos 0x0, ttl 64, id 7162, offset 0, flags [DF], proto TCP (6), length 55)
    127.0.0.1.45872 > 127.0.0.1.9950: Flags [P.], cksum 0xfe2b (incorrect -> 0x8c66), seq 1:4, ack 1, win 512, options [nop,nop,TS val 279147211 ecr 279147211], length 3
2022-04-05 22:14:24.708376 IP (tos 0x0, ttl 64, id 11529, offset 0, flags [DF], proto TCP (6), length 52)
    127.0.0.1.9950 > 127.0.0.1.45872: Flags [.], cksum 0xfe28 (incorrect -> 0x916f), seq 1, ack 4, win 512, options [nop,nop,TS val 279147211 ecr 279147211], length 0
2022-04-05 22:14:24.708457 IP (tos 0x0, ttl 64, id 11530, offset 0, flags [DF], proto TCP (6), length 54)
    127.0.0.1.9950 > 127.0.0.1.45872: Flags [P.], cksum 0xfe2a (incorrect -> 0x8c65), seq 1:3, ack 4, win 512, options [nop,nop,TS val 279147211 ecr 279147211], length 2
2022-04-05 22:14:24.708470 IP (tos 0x0, ttl 64, id 7163, offset 0, flags [DF], proto TCP (6), length 52)
    127.0.0.1.45872 > 127.0.0.1.9950: Flags [.], cksum 0xfe28 (incorrect -> 0x916d), seq 4, ack 3, win 512, options [nop,nop,TS val 279147211 ecr 279147211], length 0
2022-04-05 22:14:24.710495 IP (tos 0x0, ttl 64, id 7164, offset 0, flags [DF], proto TCP (6), length 62)
    127.0.0.1.45872 > 127.0.0.1.9950: Flags [P.], cksum 0xfe32 (incorrect -> 0x4253), seq 4:14, ack 3, win 512, options [nop,nop,TS val 279147213 ecr 279147211], length 10
2022-04-05 22:14:24.710504 IP (tos 0x0, ttl 64, id 11531, offset 0, flags [DF], proto TCP (6), length 52)
    127.0.0.1.9950 > 127.0.0.1.45872: Flags [.], cksum 0xfe28 (incorrect -> 0x915f), seq 3, ack 14, win 512, options [nop,nop,TS val 279147213 ecr 279147213], length 0
2022-04-05 22:14:24.838721 IP (tos 0x0, ttl 64, id 11532, offset 0, flags [DF], proto TCP (6), length 62)
    127.0.0.1.9950 > 127.0.0.1.45872: Flags [P.], cksum 0xfe32 (incorrect -> 0x8bcc), seq 3:13, ack 14, win 512, options [nop,nop,TS val 279147341 ecr 279147213], length 10
2022-04-05 22:14:24.838734 IP (tos 0x0, ttl 64, id 7165, offset 0, flags [DF], proto TCP (6), length 52)
    127.0.0.1.45872 > 127.0.0.1.9950: Flags [.], cksum 0xfe28 (incorrect -> 0x9055), seq 14, ack 13, win 512, options [nop,nop,TS val 279147341 ecr 279147341], length 0
2022-04-05 22:14:24.844648 IP (tos 0x0, ttl 64, id 7166, offset 0, flags [DF], proto TCP (6), length 569)
    127.0.0.1.45872 > 127.0.0.1.9950: Flags [P.], cksum 0x002e (incorrect -> 0xa3cb), seq 14:531, ack 13, win 512, options [nop,nop,TS val 279147347 ecr 279147341], length 517
2022-04-05 22:14:24.844657 IP (tos 0x0, ttl 64, id 11533, offset 0, flags [DF], proto TCP (6), length 52)
    127.0.0.1.9950 > 127.0.0.1.45872: Flags [.], cksum 0xfe28 (incorrect -> 0x8e48), seq 13, ack 531, win 508, options [nop,nop,TS val 279147347 ecr 279147347], length 0
2022-04-05 22:14:24.981000 IP (tos 0x0, ttl 64, id 11534, offset 0, flags [DF], proto TCP (6), length 3538)
    127.0.0.1.9950 > 127.0.0.1.45872: Flags [P.], cksum 0x0bc7 (incorrect -> 0xfaea), seq 13:3499, ack 531, win 512, options [nop,nop,TS val 279147483 ecr 279147347], length 3486
2022-04-05 22:14:24.981010 IP (tos 0x0, ttl 64, id 7167, offset 0, flags [DF], proto TCP (6), length 52)
    127.0.0.1.45872 > 127.0.0.1.9950: Flags [.], cksum 0xfe28 (incorrect -> 0x7fa8), seq 531, ack 3499, win 494, options [nop,nop,TS val 279147483 ecr 279147483], length 0
2022-04-05 22:14:25.016996 IP (tos 0x0, ttl 64, id 11535, offset 0, flags [DF], proto TCP (6), length 3243)
    127.0.0.1.9950 > 127.0.0.1.45872: Flags [P.], cksum 0x0aa0 (incorrect -> 0x0787), seq 3499:6690, ack 531, win 512, options [nop,nop,TS val 279147519 ecr 279147483], length 3191
2022-04-05 22:14:25.017005 IP (tos 0x0, ttl 64, id 7168, offset 0, flags [DF], proto TCP (6), length 52)
    127.0.0.1.45872 > 127.0.0.1.9950: Flags [.], cksum 0xfe28 (incorrect -> 0x72e8), seq 531, ack 6690, win 495, options [nop,nop,TS val 279147519 ecr 279147519], length 0
2022-04-05 22:14:25.017720 IP (tos 0x0, ttl 64, id 7169, offset 0, flags [DF], proto TCP (6), length 132)
    127.0.0.1.45872 > 127.0.0.1.9950: Flags [P.], cksum 0xfe78 (incorrect -> 0xcbfb), seq 531:611, ack 6690, win 512, options [nop,nop,TS val 279147520 ecr 279147519], length 80
2022-04-05 22:14:25.017729 IP (tos 0x0, ttl 64, id 11536, offset 0, flags [DF], proto TCP (6), length 52)
    127.0.0.1.9950 > 127.0.0.1.45872: Flags [.], cksum 0xfe28 (incorrect -> 0x7285), seq 6690, ack 611, win 512, options [nop,nop,TS val 279147520 ecr 279147520], length 0
2022-04-05 22:14:25.018366 IP (tos 0x0, ttl 64, id 7170, offset 0, flags [DF], proto TCP (6), length 323)
    127.0.0.1.45872 > 127.0.0.1.9950: Flags [P.], cksum 0xff37 (incorrect -> 0x2ce2), seq 611:882, ack 6690, win 512, options [nop,nop,TS val 279147521 ecr 279147520], length 271
2022-04-05 22:14:25.018372 IP (tos 0x0, ttl 64, id 11537, offset 0, flags [DF], proto TCP (6), length 52)
    127.0.0.1.9950 > 127.0.0.1.45872: Flags [.], cksum 0xfe28 (incorrect -> 0x7176), seq 6690, ack 882, win 510, options [nop,nop,TS val 279147521 ecr 279147521], length 0
2022-04-05 22:14:25.179680 IP (tos 0x0, ttl 64, id 11538, offset 0, flags [DF], proto TCP (6), length 3538)
    127.0.0.1.9950 > 127.0.0.1.45872: Flags [P.], cksum 0x0bc7 (incorrect -> 0x16b8), seq 6690:10176, ack 882, win 512, options [nop,nop,TS val 279147682 ecr 279147521], length 3486
2022-04-05 22:14:25.179694 IP (tos 0x0, ttl 64, id 7171, offset 0, flags [DF], proto TCP (6), length 52)
    127.0.0.1.45872 > 127.0.0.1.9950: Flags [.], cksum 0xfe28 (incorrect -> 0x62a6), seq 882, ack 10176, win 494, options [nop,nop,TS val 279147682 ecr 279147682], length 0
2022-04-05 22:14:25.191044 IP (tos 0x0, ttl 64, id 11539, offset 0, flags [DF], proto TCP (6), length 3356)
    127.0.0.1.9950 > 127.0.0.1.45872: Flags [P.], cksum 0x0b11 (incorrect -> 0xbfcc), seq 10176:13480, ack 882, win 512, options [nop,nop,TS val 279147693 ecr 279147682], length 3304
2022-04-05 22:14:25.191053 IP (tos 0x0, ttl 64, id 7172, offset 0, flags [DF], proto TCP (6), length 52)
    127.0.0.1.45872 > 127.0.0.1.9950: Flags [.], cksum 0xfe28 (incorrect -> 0x55a7), seq 882, ack 13480, win 495, options [nop,nop,TS val 279147693 ecr 279147693], length 0
2022-04-05 22:14:25.194868 IP (tos 0x0, ttl 64, id 11540, offset 0, flags [DF], proto TCP (6), length 2044)
    127.0.0.1.9950 > 127.0.0.1.45872: Flags [P.], cksum 0x05f1 (incorrect -> 0x0694), seq 13480:15472, ack 882, win 512, options [nop,nop,TS val 279147697 ecr 279147693], length 1992
2022-04-05 22:14:25.194876 IP (tos 0x0, ttl 64, id 7173, offset 0, flags [DF], proto TCP (6), length 52)
    127.0.0.1.45872 > 127.0.0.1.9950: Flags [.], cksum 0xfe28 (incorrect -> 0x4dd2), seq 882, ack 15472, win 500, options [nop,nop,TS val 279147697 ecr 279147697], length 0
2022-04-05 22:14:25.200205 IP (tos 0x0, ttl 64, id 11541, offset 0, flags [DF], proto TCP (6), length 820)
    127.0.0.1.9950 > 127.0.0.1.45872: Flags [P.], cksum 0x0129 (incorrect -> 0x9e5f), seq 15472:16240, ack 882, win 512, options [nop,nop,TS val 279147703 ecr 279147697], length 768
2022-04-05 22:14:25.200213 IP (tos 0x0, ttl 64, id 7174, offset 0, flags [DF], proto TCP (6), length 52)
    127.0.0.1.45872 > 127.0.0.1.9950: Flags [.], cksum 0xfe28 (incorrect -> 0x4ac2), seq 882, ack 16240, win 504, options [nop,nop,TS val 279147703 ecr 279147703], length 0
2022-04-05 22:14:25.211259 IP (tos 0x0, ttl 64, id 11542, offset 0, flags [DF], proto TCP (6), length 3386)
    127.0.0.1.9950 > 127.0.0.1.45872: Flags [P.], cksum 0x0b2f (incorrect -> 0x5613), seq 16240:19574, ack 882, win 512, options [nop,nop,TS val 279147714 ecr 279147703], length 3334
2022-04-05 22:14:25.211267 IP (tos 0x0, ttl 64, id 7175, offset 0, flags [DF], proto TCP (6), length 52)
    127.0.0.1.45872 > 127.0.0.1.9950: Flags [.], cksum 0xfe28 (incorrect -> 0x3db0), seq 882, ack 19574, win 494, options [nop,nop,TS val 279147714 ecr 279147714], length 0
2022-04-05 22:14:25.211350 IP (tos 0x0, ttl 64, id 11543, offset 0, flags [DF], proto TCP (6), length 3386)
    127.0.0.1.9950 > 127.0.0.1.45872: Flags [P.], cksum 0x0b2f (incorrect -> 0x241b), seq 19574:22908, ack 882, win 512, options [nop,nop,TS val 279147714 ecr 279147714], length 3334
2022-04-05 22:14:25.211357 IP (tos 0x0, ttl 64, id 7176, offset 0, flags [DF], proto TCP (6), length 52)
    127.0.0.1.45872 > 127.0.0.1.9950: Flags [.], cksum 0xfe28 (incorrect -> 0x30aa), seq 882, ack 22908, win 494, options [nop,nop,TS val 279147714 ecr 279147714], length 0
2022-04-05 22:14:25.220867 IP (tos 0x0, ttl 64, id 11544, offset 0, flags [DF], proto TCP (6), length 3310)
    127.0.0.1.9950 > 127.0.0.1.45872: Flags [P.], cksum 0x0ae3 (incorrect -> 0x6d0c), seq 22908:26166, ack 882, win 512, options [nop,nop,TS val 279147723 ecr 279147714], length 3258
2022-04-05 22:14:25.220884 IP (tos 0x0, ttl 64, id 7177, offset 0, flags [DF], proto TCP (6), length 52)
    127.0.0.1.45872 > 127.0.0.1.9950: Flags [.], cksum 0xfe28 (incorrect -> 0x23dd), seq 882, ack 26166, win 495, options [nop,nop,TS val 279147723 ecr 279147723], length 0
2022-04-05 22:14:25.226065 IP (tos 0x0, ttl 64, id 11545, offset 0, flags [DF], proto TCP (6), length 3386)
    127.0.0.1.9950 > 127.0.0.1.45872: Flags [P.], cksum 0x0b2f (incorrect -> 0xbafa), seq 26166:29500, ack 882, win 512, options [nop,nop,TS val 279147729 ecr 279147723], length 3334
2022-04-05 22:14:25.226076 IP (tos 0x0, ttl 64, id 7178, offset 0, flags [DF], proto TCP (6), length 52)
    127.0.0.1.45872 > 127.0.0.1.9950: Flags [.], cksum 0xfe28 (incorrect -> 0x16cc), seq 882, ack 29500, win 494, options [nop,nop,TS val 279147729 ecr 279147729], length 0
2022-04-05 22:14:25.230374 IP (tos 0x0, ttl 64, id 11546, offset 0, flags [DF], proto TCP (6), length 2390)
    127.0.0.1.9950 > 127.0.0.1.45872: Flags [P.], cksum 0x074b (incorrect -> 0x1f03), seq 29500:31838, ack 882, win 512, options [nop,nop,TS val 279147733 ecr 279147729], length 2338
2022-04-05 22:14:25.230458 IP (tos 0x0, ttl 64, id 7179, offset 0, flags [DF], proto TCP (6), length 52)
    127.0.0.1.45872 > 127.0.0.1.9950: Flags [.], cksum 0xfe28 (incorrect -> 0x0d90), seq 882, ack 31838, win 512, options [nop,nop,TS val 279147733 ecr 279147733], length 0
2022-04-05 22:14:25.241445 IP (tos 0x0, ttl 64, id 11547, offset 0, flags [DF], proto TCP (6), length 2888)
    127.0.0.1.9950 > 127.0.0.1.45872: Flags [P.], cksum 0x093d (incorrect -> 0x0c59), seq 31838:34674, ack 882, win 512, options [nop,nop,TS val 279147744 ecr 279147733], length 2836
2022-04-05 22:14:25.241584 IP (tos 0x0, ttl 64, id 7180, offset 0, flags [DF], proto TCP (6), length 52)
    127.0.0.1.45872 > 127.0.0.1.9950: Flags [.], cksum 0xfe28 (incorrect -> 0x0266), seq 882, ack 34674, win 512, options [nop,nop,TS val 279147744 ecr 279147744], length 0
2022-04-05 22:14:25.250830 IP (tos 0x0, ttl 64, id 11548, offset 0, flags [DF], proto TCP (6), length 3386)
    127.0.0.1.9950 > 127.0.0.1.45872: Flags [P.], cksum 0x0b2f (incorrect -> 0x6b89), seq 34674:38008, ack 882, win 512, options [nop,nop,TS val 279147753 ecr 279147744], length 3334
2022-04-05 22:14:25.294661 IP (tos 0x0, ttl 64, id 7181, offset 0, flags [DF], proto TCP (6), length 52)
    127.0.0.1.45872 > 127.0.0.1.9950: Flags [.], cksum 0xfe28 (incorrect -> 0xf521), seq 882, ack 38008, win 512, options [nop,nop,TS val 279147797 ecr 279147753], length 0
2022-04-05 22:14:25.294673 IP (tos 0x0, ttl 64, id 11549, offset 0, flags [DF], proto TCP (6), length 1790)
    127.0.0.1.9950 > 127.0.0.1.45872: Flags [P.], cksum 0x04f3 (incorrect -> 0x4278), seq 38008:39746, ack 882, win 512, options [nop,nop,TS val 279147797 ecr 279147797], length 1738
2022-04-05 22:14:25.294704 IP (tos 0x0, ttl 64, id 7182, offset 0, flags [DF], proto TCP (6), length 52)
    127.0.0.1.45872 > 127.0.0.1.9950: Flags [.], cksum 0xfe28 (incorrect -> 0xee2b), seq 882, ack 39746, win 512, options [nop,nop,TS val 279147797 ecr 279147797], length 0
2022-04-05 22:14:25.758565 IP (tos 0x0, ttl 64, id 11550, offset 0, flags [DF], proto TCP (6), length 231)
    127.0.0.1.9950 > 127.0.0.1.45872: Flags [P.], cksum 0xfedb (incorrect -> 0x3206), seq 39746:39925, ack 882, win 512, options [nop,nop,TS val 279148261 ecr 279147797], length 179
2022-04-05 22:14:25.758577 IP (tos 0x0, ttl 64, id 7183, offset 0, flags [DF], proto TCP (6), length 52)
    127.0.0.1.45872 > 127.0.0.1.9950: Flags [.], cksum 0xfe28 (incorrect -> 0xe9d9), seq 882, ack 39925, win 511, options [nop,nop,TS val 279148261 ecr 279148261], length 0
2022-04-05 22:14:25.776593 IP (tos 0x0, ttl 64, id 11551, offset 0, flags [DF], proto TCP (6), length 1470)
    127.0.0.1.9950 > 127.0.0.1.45872: Flags [P.], cksum 0x03b3 (incorrect -> 0x7964), seq 39925:41343, ack 882, win 512, options [nop,nop,TS val 279148279 ecr 279148261], length 1418
2022-04-05 22:14:25.776611 IP (tos 0x0, ttl 64, id 7184, offset 0, flags [DF], proto TCP (6), length 52)
    127.0.0.1.45872 > 127.0.0.1.9950: Flags [.], cksum 0xfe28 (incorrect -> 0xe434), seq 882, ack 41343, win 502, options [nop,nop,TS val 279148279 ecr 279148279], length 0
2022-04-05 22:14:25.779159 IP (tos 0x0, ttl 64, id 11552, offset 0, flags [DF], proto TCP (6), length 3386)
    127.0.0.1.9950 > 127.0.0.1.45872: Flags [P.], cksum 0x0b2f (incorrect -> 0x7036), seq 41343:44677, ack 882, win 512, options [nop,nop,TS val 279148282 ecr 279148279], length 3334
2022-04-05 22:14:25.779167 IP (tos 0x0, ttl 64, id 7185, offset 0, flags [DF], proto TCP (6), length 52)
    127.0.0.1.45872 > 127.0.0.1.9950: Flags [.], cksum 0xfe28 (incorrect -> 0xd730), seq 882, ack 44677, win 494, options [nop,nop,TS val 279148282 ecr 279148282], length 0
2022-04-05 22:14:25.792530 IP (tos 0x0, ttl 64, id 11553, offset 0, flags [DF], proto TCP (6), length 4100)
    127.0.0.1.9950 > 127.0.0.1.45872: Flags [P.], cksum 0x0df9 (incorrect -> 0xedca), seq 44677:48725, ack 882, win 512, options [nop,nop,TS val 279148295 ecr 279148282], length 4048
2022-04-05 22:14:25.792540 IP (tos 0x0, ttl 64, id 7186, offset 0, flags [DF], proto TCP (6), length 52)
    127.0.0.1.45872 > 127.0.0.1.9950: Flags [.], cksum 0xfe28 (incorrect -> 0xc748), seq 882, ack 48725, win 492, options [nop,nop,TS val 279148295 ecr 279148295], length 0
2022-04-05 22:14:25.792547 IP (tos 0x0, ttl 64, id 11554, offset 0, flags [DF], proto TCP (6), length 90)
    127.0.0.1.9950 > 127.0.0.1.45872: Flags [P.], cksum 0xfe4e (incorrect -> 0xdbe9), seq 48725:48763, ack 882, win 512, options [nop,nop,TS val 279148295 ecr 279148295], length 38
2022-04-05 22:14:25.792552 IP (tos 0x0, ttl 64, id 7187, offset 0, flags [DF], proto TCP (6), length 52)
    127.0.0.1.45872 > 127.0.0.1.9950: Flags [.], cksum 0xfe28 (incorrect -> 0xc722), seq 882, ack 48763, win 492, options [nop,nop,TS val 279148295 ecr 279148295], length 0
2022-04-05 22:14:25.797053 IP (tos 0x0, ttl 64, id 11555, offset 0, flags [DF], proto TCP (6), length 4100)
    127.0.0.1.9950 > 127.0.0.1.45872: Flags [P.], cksum 0x0df9 (incorrect -> 0x8c85), seq 48763:52811, ack 882, win 512, options [nop,nop,TS val 279148299 ecr 279148295], length 4048
2022-04-05 22:14:25.797064 IP (tos 0x0, ttl 64, id 7188, offset 0, flags [DF], proto TCP (6), length 52)
    127.0.0.1.45872 > 127.0.0.1.9950: Flags [.], cksum 0xfe28 (incorrect -> 0xb74a), seq 882, ack 52811, win 492, options [nop,nop,TS val 279148299 ecr 279148299], length 0
2022-04-05 22:14:25.797073 IP (tos 0x0, ttl 64, id 11556, offset 0, flags [DF], proto TCP (6), length 169)
    127.0.0.1.9950 > 127.0.0.1.45872: Flags [P.], cksum 0xfe9d (incorrect -> 0xfcd0), seq 52811:52928, ack 882, win 512, options [nop,nop,TS val 279148300 ecr 279148299], length 117
2022-04-05 22:14:25.797078 IP (tos 0x0, ttl 64, id 7189, offset 0, flags [DF], proto TCP (6), length 52)
    127.0.0.1.45872 > 127.0.0.1.9950: Flags [.], cksum 0xfe28 (incorrect -> 0xb6d3), seq 882, ack 52928, win 492, options [nop,nop,TS val 279148300 ecr 279148300], length 0
2022-04-05 22:14:25.797099 IP (tos 0x0, ttl 64, id 11557, offset 0, flags [DF], proto TCP (6), length 474)
    127.0.0.1.9950 > 127.0.0.1.45872: Flags [P.], cksum 0xffce (incorrect -> 0x8cc1), seq 52928:53350, ack 882, win 512, options [nop,nop,TS val 279148300 ecr 279148300], length 422
2022-04-05 22:14:25.797104 IP (tos 0x0, ttl 64, id 7190, offset 0, flags [DF], proto TCP (6), length 52)
    127.0.0.1.45872 > 127.0.0.1.9950: Flags [.], cksum 0xfe28 (incorrect -> 0xb52f), seq 882, ack 53350, win 490, options [nop,nop,TS val 279148300 ecr 279148300], length 0
2022-04-05 22:14:25.799807 IP (tos 0x0, ttl 64, id 11558, offset 0, flags [DF], proto TCP (6), length 1470)
    127.0.0.1.9950 > 127.0.0.1.45872: Flags [P.], cksum 0x03b3 (incorrect -> 0x9d15), seq 53350:54768, ack 882, win 512, options [nop,nop,TS val 279148302 ecr 279148300], length 1418
2022-04-05 22:14:25.799815 IP (tos 0x0, ttl 64, id 7191, offset 0, flags [DF], proto TCP (6), length 52)
    127.0.0.1.45872 > 127.0.0.1.9950: Flags [.], cksum 0xfe28 (incorrect -> 0xaf95), seq 882, ack 54768, win 502, options [nop,nop,TS val 279148302 ecr 279148302], length 0
2022-04-05 22:14:25.804567 IP (tos 0x0, ttl 64, id 11559, offset 0, flags [DF], proto TCP (6), length 3386)
    127.0.0.1.9950 > 127.0.0.1.45872: Flags [P.], cksum 0x0b2f (incorrect -> 0x0201), seq 54768:58102, ack 882, win 512, options [nop,nop,TS val 279148307 ecr 279148302], length 3334
2022-04-05 22:14:25.804927 IP (tos 0x0, ttl 64, id 7192, offset 0, flags [DF], proto TCP (6), length 52)
    127.0.0.1.45872 > 127.0.0.1.9950: Flags [.], cksum 0xfe28 (incorrect -> 0xa27b), seq 882, ack 58102, win 512, options [nop,nop,TS val 279148307 ecr 279148307], length 0
2022-04-05 22:14:25.806353 IP (tos 0x0, ttl 64, id 11560, offset 0, flags [DF], proto TCP (6), length 2390)
    127.0.0.1.9950 > 127.0.0.1.45872: Flags [P.], cksum 0x074b (incorrect -> 0x2aa8), seq 58102:60440, ack 882, win 512, options [nop,nop,TS val 279148309 ecr 279148307], length 2338
2022-04-05 22:14:25.806616 IP (tos 0x0, ttl 64, id 7193, offset 0, flags [DF], proto TCP (6), length 52)
    127.0.0.1.45872 > 127.0.0.1.9950: Flags [.], cksum 0xfe28 (incorrect -> 0x9955), seq 882, ack 60440, win 512, options [nop,nop,TS val 279148309 ecr 279148309], length 0
2022-04-05 22:14:25.809719 IP (tos 0x0, ttl 64, id 11561, offset 0, flags [DF], proto TCP (6), length 2888)
    127.0.0.1.9950 > 127.0.0.1.45872: Flags [P.], cksum 0x093d (incorrect -> 0x1f25), seq 60440:63276, ack 882, win 512, options [nop,nop,TS val 279148312 ecr 279148309], length 2836
2022-04-05 22:14:25.809885 IP (tos 0x0, ttl 64, id 7194, offset 0, flags [DF], proto TCP (6), length 52)
    127.0.0.1.45872 > 127.0.0.1.9950: Flags [.], cksum 0xfe28 (incorrect -> 0x8e3b), seq 882, ack 63276, win 512, options [nop,nop,TS val 279148312 ecr 279148312], length 0
2022-04-05 22:14:25.815994 IP (tos 0x0, ttl 64, id 11562, offset 0, flags [DF], proto TCP (6), length 2888)
    127.0.0.1.9950 > 127.0.0.1.45872: Flags [P.], cksum 0x093d (incorrect -> 0x133d), seq 63276:66112, ack 882, win 512, options [nop,nop,TS val 279148318 ecr 279148312], length 2836
2022-04-05 22:14:25.858661 IP (tos 0x0, ttl 64, id 7195, offset 0, flags [DF], proto TCP (6), length 52)
    127.0.0.1.45872 > 127.0.0.1.9950: Flags [.], cksum 0xfe28 (incorrect -> 0x82f0), seq 882, ack 66112, win 512, options [nop,nop,TS val 279148361 ecr 279148318], length 0
2022-04-05 22:14:25.858670 IP (tos 0x0, ttl 64, id 11563, offset 0, flags [DF], proto TCP (6), length 8560)
    127.0.0.1.9950 > 127.0.0.1.45872: Flags [P.], cksum 0x1f65 (incorrect -> 0xf3a2), seq 66112:74620, ack 882, win 512, options [nop,nop,TS val 279148361 ecr 279148361], length 8508
200, 3.799440860748291, 1.1997323036193848