2022-04-05 11:47:21.530128 IP (tos 0x0, ttl 64, id 17837, offset 0, flags [DF], proto TCP (6), length 60)
    127.0.0.1.44780 > 127.0.0.1.9950: Flags [S], cksum 0xfe30 (incorrect -> 0xaac1), seq 4167723876, win 65495, options [mss 65495,sackOK,TS val 241524033 ecr 0,nop,wscale 7], length 0
2022-04-05 11:47:21.530141 IP (tos 0x0, ttl 64, id 0, offset 0, flags [DF], proto TCP (6), length 60)
    127.0.0.1.9950 > 127.0.0.1.44780: Flags [S.], cksum 0xfe30 (incorrect -> 0x6ced), seq 1774872670, ack 4167723877, win 65483, options [mss 65495,sackOK,TS val 241524033 ecr 241524033,nop,wscale 7], length 0
2022-04-05 11:47:21.530150 IP (tos 0x0, ttl 64, id 17838, offset 0, flags [DF], proto TCP (6), length 52)
    127.0.0.1.44780 > 127.0.0.1.9950: Flags [.], cksum 0xfe28 (incorrect -> 0x93a9), seq 1, ack 1, win 512, options [nop,nop,TS val 241524033 ecr 241524033], length 0
2022-04-05 11:47:21.530248 IP (tos 0x0, ttl 64, id 17839, offset 0, flags [DF], proto TCP (6), length 55)
    127.0.0.1.44780 > 127.0.0.1.9950: Flags [P.], cksum 0xfe2b (incorrect -> 0x8e9d), seq 1:4, ack 1, win 512, options [nop,nop,TS val 241524033 ecr 241524033], length 3
2022-04-05 11:47:21.530261 IP (tos 0x0, ttl 64, id 35314, offset 0, flags [DF], proto TCP (6), length 52)
    127.0.0.1.9950 > 127.0.0.1.44780: Flags [.], cksum 0xfe28 (incorrect -> 0x93a6), seq 1, ack 4, win 512, options [nop,nop,TS val 241524033 ecr 241524033], length 0
2022-04-05 11:47:21.530315 IP (tos 0x0, ttl 64, id 35315, offset 0, flags [DF], proto TCP (6), length 54)
    127.0.0.1.9950 > 127.0.0.1.44780: Flags [P.], cksum 0xfe2a (incorrect -> 0x8e9c), seq 1:3, ack 4, win 512, options [nop,nop,TS val 241524033 ecr 241524033], length 2
2022-04-05 11:47:21.530331 IP (tos 0x0, ttl 64, id 17840, offset 0, flags [DF], proto TCP (6), length 52)
    127.0.0.1.44780 > 127.0.0.1.9950: Flags [.], cksum 0xfe28 (incorrect -> 0x93a4), seq 4, ack 3, win 512, options [nop,nop,TS val 241524033 ecr 241524033], length 0
2022-04-05 11:47:21.532658 IP (tos 0x0, ttl 64, id 17841, offset 0, flags [DF], proto TCP (6), length 62)
    127.0.0.1.44780 > 127.0.0.1.9950: Flags [P.], cksum 0xfe32 (incorrect -> 0x1f8b), seq 4:14, ack 3, win 512, options [nop,nop,TS val 241524035 ecr 241524033], length 10
2022-04-05 11:47:21.532677 IP (tos 0x0, ttl 64, id 35316, offset 0, flags [DF], proto TCP (6), length 52)
    127.0.0.1.9950 > 127.0.0.1.44780: Flags [.], cksum 0xfe28 (incorrect -> 0x9396), seq 3, ack 14, win 512, options [nop,nop,TS val 241524035 ecr 241524035], length 0
403, 7.726004600524902, 10.294856548309326