2022-04-05 01:10:37.945361 IP (tos 0x0, ttl 64, id 46183, offset 0, flags [DF], proto TCP (6), length 60)
    127.0.0.1.43738 > 127.0.0.1.11650: Flags [S], cksum 0xfe30 (incorrect -> 0x18a9), seq 3704603175, win 65495, options [mss 65495,sackOK,TS val 758682316 ecr 0,nop,wscale 7], length 0
2022-04-05 01:10:37.945384 IP (tos 0x0, ttl 64, id 0, offset 0, flags [DF], proto TCP (6), length 60)
    127.0.0.1.11650 > 127.0.0.1.43738: Flags [S.], cksum 0xfe30 (incorrect -> 0x9c61), seq 666801279, ack 3704603176, win 65483, options [mss 65495,sackOK,TS val 758682316 ecr 758682316,nop,wscale 7], length 0
2022-04-05 01:10:37.945399 IP (tos 0x0, ttl 64, id 46184, offset 0, flags [DF], proto TCP (6), length 52)
    127.0.0.1.43738 > 127.0.0.1.11650: Flags [.], cksum 0xfe28 (incorrect -> 0xc31c), seq 1, ack 1, win 512, options [nop,nop,TS val 758682317 ecr 758682316], length 0
2022-04-05 01:10:37.945504 IP (tos 0x0, ttl 64, id 46185, offset 0, flags [DF], proto TCP (6), length 55)
    127.0.0.1.43738 > 127.0.0.1.11650: Flags [P.], cksum 0xfe2b (incorrect -> 0xbe10), seq 1:4, ack 1, win 512, options [nop,nop,TS val 758682317 ecr 758682316], length 3
2022-04-05 01:10:37.945516 IP (tos 0x0, ttl 64, id 10806, offset 0, flags [DF], proto TCP (6), length 52)
    127.0.0.1.11650 > 127.0.0.1.43738: Flags [.], cksum 0xfe28 (incorrect -> 0xc318), seq 1, ack 4, win 512, options [nop,nop,TS val 758682317 ecr 758682317], length 0
2022-04-05 01:10:37.945557 IP (tos 0x0, ttl 64, id 10807, offset 0, flags [DF], proto TCP (6), length 54)
    127.0.0.1.11650 > 127.0.0.1.43738: Flags [P.], cksum 0xfe2a (incorrect -> 0xbe0e), seq 1:3, ack 4, win 512, options [nop,nop,TS val 758682317 ecr 758682317], length 2
2022-04-05 01:10:37.945567 IP (tos 0x0, ttl 64, id 46186, offset 0, flags [DF], proto TCP (6), length 52)
    127.0.0.1.43738 > 127.0.0.1.11650: Flags [.], cksum 0xfe28 (incorrect -> 0xc316), seq 4, ack 3, win 512, options [nop,nop,TS val 758682317 ecr 758682317], length 0
2022-04-05 01:10:37.946778 IP (tos 0x0, ttl 64, id 46187, offset 0, flags [DF], proto TCP (6), length 62)
    127.0.0.1.43738 > 127.0.0.1.11650: Flags [P.], cksum 0xfe32 (incorrect -> 0x3290), seq 4:14, ack 3, win 512, options [nop,nop,TS val 758682318 ecr 758682317], length 10
2022-04-05 01:10:37.946793 IP (tos 0x0, ttl 64, id 10808, offset 0, flags [DF], proto TCP (6), length 52)
    127.0.0.1.11650 > 127.0.0.1.43738: Flags [.], cksum 0xfe28 (incorrect -> 0xc30a), seq 3, ack 14, win 512, options [nop,nop,TS val 758682318 ecr 758682318], length 0
2022-04-05 01:10:38.182012 IP (tos 0x0, ttl 64, id 10809, offset 0, flags [DF], proto TCP (6), length 62)
    127.0.0.1.11650 > 127.0.0.1.43738: Flags [P.], cksum 0xfe32 (incorrect -> 0xbd0c), seq 3:13, ack 14, win 512, options [nop,nop,TS val 758682553 ecr 758682318], length 10
2022-04-05 01:10:38.182031 IP (tos 0x0, ttl 64, id 46188, offset 0, flags [DF], proto TCP (6), length 52)
    127.0.0.1.43738 > 127.0.0.1.11650: Flags [.], cksum 0xfe28 (incorrect -> 0xc12a), seq 14, ack 13, win 512, options [nop,nop,TS val 758682553 ecr 758682553], length 0
2022-04-05 01:10:38.188153 IP (tos 0x0, ttl 64, id 46189, offset 0, flags [DF], proto TCP (6), length 569)
    127.0.0.1.43738 > 127.0.0.1.11650: Flags [P.], cksum 0x002e (incorrect -> 0x2b8c), seq 14:531, ack 13, win 512, options [nop,nop,TS val 758682559 ecr 758682553], length 517
2022-04-05 01:10:38.188163 IP (tos 0x0, ttl 64, id 10810, offset 0, flags [DF], proto TCP (6), length 52)
    127.0.0.1.11650 > 127.0.0.1.43738: Flags [.], cksum 0xfe28 (incorrect -> 0xbf1d), seq 13, ack 531, win 508, options [nop,nop,TS val 758682559 ecr 758682559], length 0
2022-04-05 01:10:38.422858 IP (tos 0x0, ttl 64, id 10811, offset 0, flags [DF], proto TCP (6), length 3538)
    127.0.0.1.11650 > 127.0.0.1.43738: Flags [P.], cksum 0x0bc7 (incorrect -> 0x76fd), seq 13:3499, ack 531, win 512, options [nop,nop,TS val 758682794 ecr 758682559], length 3486
2022-04-05 01:10:38.422870 IP (tos 0x0, ttl 64, id 46190, offset 0, flags [DF], proto TCP (6), length 52)
    127.0.0.1.43738 > 127.0.0.1.11650: Flags [.], cksum 0xfe28 (incorrect -> 0xafb7), seq 531, ack 3499, win 494, options [nop,nop,TS val 758682794 ecr 758682794], length 0
2022-04-05 01:10:38.516919 IP (tos 0x0, ttl 64, id 10812, offset 0, flags [DF], proto TCP (6), length 662)
    127.0.0.1.11650 > 127.0.0.1.43738: Flags [P.], cksum 0x008b (incorrect -> 0x8c23), seq 3499:4109, ack 531, win 512, options [nop,nop,TS val 758682888 ecr 758682794], length 610
2022-04-05 01:10:38.516933 IP (tos 0x0, ttl 64, id 46191, offset 0, flags [DF], proto TCP (6), length 52)
    127.0.0.1.43738 > 127.0.0.1.11650: Flags [.], cksum 0xfe28 (incorrect -> 0xac8e), seq 531, ack 4109, win 505, options [nop,nop,TS val 758682888 ecr 758682888], length 0
2022-04-05 01:10:38.610990 IP (tos 0x0, ttl 64, id 10813, offset 0, flags [DF], proto TCP (6), length 2695)
    127.0.0.1.11650 > 127.0.0.1.43738: Flags [P.], cksum 0x087c (incorrect -> 0x068f), seq 4109:6752, ack 531, win 512, options [nop,nop,TS val 758682982 ecr 758682888], length 2643
2022-04-05 01:10:38.611000 IP (tos 0x0, ttl 64, id 46192, offset 0, flags [DF], proto TCP (6), length 52)
    127.0.0.1.43738 > 127.0.0.1.11650: Flags [.], cksum 0xfe28 (incorrect -> 0xa187), seq 531, ack 6752, win 497, options [nop,nop,TS val 758682982 ecr 758682982], length 0
2022-04-05 01:10:38.611702 IP (tos 0x0, ttl 64, id 46193, offset 0, flags [DF], proto TCP (6), length 132)
    127.0.0.1.43738 > 127.0.0.1.11650: Flags [P.], cksum 0xfe78 (incorrect -> 0xcb98), seq 531:611, ack 6752, win 512, options [nop,nop,TS val 758682983 ecr 758682982], length 80
2022-04-05 01:10:38.611710 IP (tos 0x0, ttl 64, id 10814, offset 0, flags [DF], proto TCP (6), length 52)
    127.0.0.1.11650 > 127.0.0.1.43738: Flags [.], cksum 0xfe28 (incorrect -> 0xa126), seq 6752, ack 611, win 512, options [nop,nop,TS val 758682983 ecr 758682983], length 0
2022-04-05 01:10:38.612106 IP (tos 0x0, ttl 64, id 46194, offset 0, flags [DF], proto TCP (6), length 328)
    127.0.0.1.43738 > 127.0.0.1.11650: Flags [P.], cksum 0xff3c (incorrect -> 0xff79), seq 611:887, ack 6752, win 512, options [nop,nop,TS val 758682983 ecr 758682983], length 276
2022-04-05 01:10:38.612110 IP (tos 0x0, ttl 64, id 10815, offset 0, flags [DF], proto TCP (6), length 52)
    127.0.0.1.11650 > 127.0.0.1.43738: Flags [.], cksum 0xfe28 (incorrect -> 0xa014), seq 6752, ack 887, win 510, options [nop,nop,TS val 758682983 ecr 758682983], length 0
2022-04-05 01:10:38.852713 IP (tos 0x0, ttl 64, id 10816, offset 0, flags [DF], proto TCP (6), length 626)
    127.0.0.1.11650 > 127.0.0.1.43738: Flags [P.], cksum 0x0067 (incorrect -> 0x8c37), seq 6752:7326, ack 887, win 512, options [nop,nop,TS val 758683224 ecr 758682983], length 574
2022-04-05 01:10:38.852724 IP (tos 0x0, ttl 64, id 46195, offset 0, flags [DF], proto TCP (6), length 52)
    127.0.0.1.43738 > 127.0.0.1.11650: Flags [.], cksum 0xfe28 (incorrect -> 0x9bf6), seq 887, ack 7326, win 508, options [nop,nop,TS val 758683224 ecr 758683224], length 0
2022-04-05 01:10:38.879020 IP (tos 0x0, ttl 64, id 10817, offset 0, flags [DF], proto TCP (6), length 3538)
    127.0.0.1.11650 > 127.0.0.1.43738: Flags [P.], cksum 0x0bc7 (incorrect -> 0x7cf1), seq 7326:10812, ack 887, win 512, options [nop,nop,TS val 758683250 ecr 758683224], length 3486
2022-04-05 01:10:38.879027 IP (tos 0x0, ttl 64, id 46196, offset 0, flags [DF], proto TCP (6), length 52)
    127.0.0.1.43738 > 127.0.0.1.11650: Flags [.], cksum 0xfe28 (incorrect -> 0x8e32), seq 887, ack 10812, win 494, options [nop,nop,TS val 758683250 ecr 758683250], length 0
2022-04-05 01:10:38.892958 IP (tos 0x0, ttl 64, id 10818, offset 0, flags [DF], proto TCP (6), length 3538)
    127.0.0.1.11650 > 127.0.0.1.43738: Flags [P.], cksum 0x0bc7 (incorrect -> 0x2de9), seq 10812:14298, ack 887, win 512, options [nop,nop,TS val 758683264 ecr 758683250], length 3486
2022-04-05 01:10:38.892965 IP (tos 0x0, ttl 64, id 46197, offset 0, flags [DF], proto TCP (6), length 52)
    127.0.0.1.43738 > 127.0.0.1.11650: Flags [.], cksum 0xfe28 (incorrect -> 0x8078), seq 887, ack 14298, win 494, options [nop,nop,TS val 758683264 ecr 758683264], length 0
2022-04-05 01:10:38.947378 IP (tos 0x0, ttl 64, id 10819, offset 0, flags [DF], proto TCP (6), length 3538)
    127.0.0.1.11650 > 127.0.0.1.43738: Flags [P.], cksum 0x0bc7 (incorrect -> 0xb8bb), seq 14298:17784, ack 887, win 512, options [nop,nop,TS val 758683318 ecr 758683264], length 3486
2022-04-05 01:10:38.947385 IP (tos 0x0, ttl 64, id 46198, offset 0, flags [DF], proto TCP (6), length 52)
    127.0.0.1.43738 > 127.0.0.1.11650: Flags [.], cksum 0xfe28 (incorrect -> 0x726e), seq 887, ack 17784, win 494, options [nop,nop,TS val 758683318 ecr 758683318], length 0
2022-04-05 01:10:38.961274 IP (tos 0x0, ttl 64, id 10820, offset 0, flags [DF], proto TCP (6), length 1048)
    127.0.0.1.11650 > 127.0.0.1.43738: Flags [P.], cksum 0x020d (incorrect -> 0xc068), seq 17784:18780, ack 887, win 512, options [nop,nop,TS val 758683332 ecr 758683318], length 996
2022-04-05 01:10:38.961288 IP (tos 0x0, ttl 64, id 46199, offset 0, flags [DF], proto TCP (6), length 52)
    127.0.0.1.43738 > 127.0.0.1.11650: Flags [.], cksum 0xfe28 (incorrect -> 0x6e64), seq 887, ack 18780, win 504, options [nop,nop,TS val 758683332 ecr 758683332], length 0
2022-04-05 01:10:38.978936 IP (tos 0x0, ttl 64, id 10821, offset 0, flags [DF], proto TCP (6), length 3456)
    127.0.0.1.11650 > 127.0.0.1.43738: Flags [P.], cksum 0x0b75 (incorrect -> 0x319d), seq 18780:22184, ack 887, win 512, options [nop,nop,TS val 758683350 ecr 758683332], length 3404
2022-04-05 01:10:38.978945 IP (tos 0x0, ttl 64, id 46200, offset 0, flags [DF], proto TCP (6), length 52)
    127.0.0.1.43738 > 127.0.0.1.11650: Flags [.], cksum 0xfe28 (incorrect -> 0x60fe), seq 887, ack 22184, win 494, options [nop,nop,TS val 758683350 ecr 758683350], length 0
2022-04-05 01:10:38.979178 IP (tos 0x0, ttl 64, id 10822, offset 0, flags [DF], proto TCP (6), length 4100)
    127.0.0.1.11650 > 127.0.0.1.43738: Flags [P.], cksum 0x0df9 (incorrect -> 0x96ca), seq 22184:26232, ack 887, win 512, options [nop,nop,TS val 758683350 ecr 758683350], length 4048
2022-04-05 01:10:38.979184 IP (tos 0x0, ttl 64, id 46201, offset 0, flags [DF], proto TCP (6), length 52)
    127.0.0.1.43738 > 127.0.0.1.11650: Flags [.], cksum 0xfe28 (incorrect -> 0x5130), seq 887, ack 26232, win 492, options [nop,nop,TS val 758683350 ecr 758683350], length 0
2022-04-05 01:10:38.979190 IP (tos 0x0, ttl 64, id 10823, offset 0, flags [DF], proto TCP (6), length 3972)
    127.0.0.1.11650 > 127.0.0.1.43738: Flags [P.], cksum 0x0d79 (incorrect -> 0x3d02), seq 26232:30152, ack 887, win 512, options [nop,nop,TS val 758683350 ecr 758683350], length 3920
2022-04-05 01:10:38.979192 IP (tos 0x0, ttl 64, id 46202, offset 0, flags [DF], proto TCP (6), length 52)
    127.0.0.1.43738 > 127.0.0.1.11650: Flags [.], cksum 0xfe28 (incorrect -> 0x41f0), seq 887, ack 30152, win 476, options [nop,nop,TS val 758683350 ecr 758683350], length 0
2022-04-05 01:10:38.992824 IP (tos 0x0, ttl 64, id 10824, offset 0, flags [DF], proto TCP (6), length 4100)
    127.0.0.1.11650 > 127.0.0.1.43738: Flags [P.], cksum 0x0df9 (incorrect -> 0xa103), seq 30152:34200, ack 887, win 512, options [nop,nop,TS val 758683364 ecr 758683350], length 4048
2022-04-05 01:10:38.992831 IP (tos 0x0, ttl 64, id 46203, offset 0, flags [DF], proto TCP (6), length 52)
    127.0.0.1.43738 > 127.0.0.1.11650: Flags [.], cksum 0xfe28 (incorrect -> 0x31f4), seq 887, ack 34200, win 492, options [nop,nop,TS val 758683364 ecr 758683364], length 0
2022-04-05 01:10:38.992838 IP (tos 0x0, ttl 64, id 10825, offset 0, flags [DF], proto TCP (6), length 2478)
    127.0.0.1.11650 > 127.0.0.1.43738: Flags [P.], cksum 0x07a3 (incorrect -> 0xe73c), seq 34200:36626, ack 887, win 512, options [nop,nop,TS val 758683364 ecr 758683364], length 2426
2022-04-05 01:10:38.992863 IP (tos 0x0, ttl 64, id 46204, offset 0, flags [DF], proto TCP (6), length 52)
    127.0.0.1.43738 > 127.0.0.1.11650: Flags [.], cksum 0xfe28 (incorrect -> 0x2866), seq 887, ack 36626, win 512, options [nop,nop,TS val 758683364 ecr 758683364], length 0
2022-04-05 01:10:38.992867 IP (tos 0x0, ttl 64, id 10826, offset 0, flags [DF], proto TCP (6), length 1546)
    127.0.0.1.11650 > 127.0.0.1.43738: Flags [P.], cksum 0x03ff (incorrect -> 0x0ca2), seq 36626:38120, ack 887, win 512, options [nop,nop,TS val 758683364 ecr 758683364], length 1494
2022-04-05 01:10:38.992870 IP (tos 0x0, ttl 64, id 46205, offset 0, flags [DF], proto TCP (6), length 52)
    127.0.0.1.43738 > 127.0.0.1.11650: Flags [.], cksum 0xfe28 (incorrect -> 0x2290), seq 887, ack 38120, win 512, options [nop,nop,TS val 758683364 ecr 758683364], length 0
2022-04-05 01:10:39.042060 IP (tos 0x0, ttl 64, id 10827, offset 0, flags [DF], proto TCP (6), length 3538)
    127.0.0.1.11650 > 127.0.0.1.43738: Flags [P.], cksum 0x0bc7 (incorrect -> 0x2003), seq 38120:41606, ack 887, win 512, options [nop,nop,TS val 758683413 ecr 758683364], length 3486
2022-04-05 01:10:39.042544 IP (tos 0x0, ttl 64, id 46206, offset 0, flags [DF], proto TCP (6), length 52)
    127.0.0.1.43738 > 127.0.0.1.11650: Flags [.], cksum 0xfe28 (incorrect -> 0x148f), seq 887, ack 41606, win 512, options [nop,nop,TS val 758683414 ecr 758683413], length 0
200, 7.072574615478516, 1.2360665798187256