2022-04-05 05:46:33.482072 IP (tos 0x0, ttl 64, id 2404, offset 0, flags [DF], proto TCP (6), length 60)
    127.0.0.1.36996 > 127.0.0.1.9450: Flags [S], cksum 0xfe30 (incorrect -> 0x9022), seq 2895773380, win 65495, options [mss 65495,sackOK,TS val 775237853 ecr 0,nop,wscale 7], length 0
2022-04-05 05:46:33.482084 IP (tos 0x0, ttl 64, id 0, offset 0, flags [DF], proto TCP (6), length 60)
    127.0.0.1.9450 > 127.0.0.1.36996: Flags [S.], cksum 0xfe30 (incorrect -> 0x1b51), seq 1216531767, ack 2895773381, win 65483, options [mss 65495,sackOK,TS val 775237853 ecr 775237853,nop,wscale 7], length 0
2022-04-05 05:46:33.482092 IP (tos 0x0, ttl 64, id 2405, offset 0, flags [DF], proto TCP (6), length 52)
    127.0.0.1.36996 > 127.0.0.1.9450: Flags [.], cksum 0xfe28 (incorrect -> 0x420d), seq 1, ack 1, win 512, options [nop,nop,TS val 775237853 ecr 775237853], length 0
2022-04-05 05:46:33.482220 IP (tos 0x0, ttl 64, id 2406, offset 0, flags [DF], proto TCP (6), length 55)
    127.0.0.1.36996 > 127.0.0.1.9450: Flags [P.], cksum 0xfe2b (incorrect -> 0x3d01), seq 1:4, ack 1, win 512, options [nop,nop,TS val 775237853 ecr 775237853], length 3
2022-04-05 05:46:33.482236 IP (tos 0x0, ttl 64, id 6364, offset 0, flags [DF], proto TCP (6), length 52)
    127.0.0.1.9450 > 127.0.0.1.36996: Flags [.], cksum 0xfe28 (incorrect -> 0x420a), seq 1, ack 4, win 512, options [nop,nop,TS val 775237853 ecr 775237853], length 0
2022-04-05 05:46:33.482283 IP (tos 0x0, ttl 64, id 6365, offset 0, flags [DF], proto TCP (6), length 54)
    127.0.0.1.9450 > 127.0.0.1.36996: Flags [P.], cksum 0xfe2a (incorrect -> 0x3d00), seq 1:3, ack 4, win 512, options [nop,nop,TS val 775237853 ecr 775237853], length 2
2022-04-05 05:46:33.482299 IP (tos 0x0, ttl 64, id 2407, offset 0, flags [DF], proto TCP (6), length 52)
    127.0.0.1.36996 > 127.0.0.1.9450: Flags [.], cksum 0xfe28 (incorrect -> 0x4208), seq 4, ack 3, win 512, options [nop,nop,TS val 775237853 ecr 775237853], length 0
2022-04-05 05:46:33.484947 IP (tos 0x0, ttl 64, id 2408, offset 0, flags [DF], proto TCP (6), length 62)
    127.0.0.1.36996 > 127.0.0.1.9450: Flags [P.], cksum 0xfe32 (incorrect -> 0xa2bb), seq 4:14, ack 3, win 512, options [nop,nop,TS val 775237856 ecr 775237853], length 10
2022-04-05 05:46:33.484972 IP (tos 0x0, ttl 64, id 6366, offset 0, flags [DF], proto TCP (6), length 52)
    127.0.0.1.9450 > 127.0.0.1.36996: Flags [.], cksum 0xfe28 (incorrect -> 0x41f8), seq 3, ack 14, win 512, options [nop,nop,TS val 775237856 ecr 775237856], length 0
2022-04-05 05:46:33.573660 IP (tos 0x0, ttl 64, id 6367, offset 0, flags [DF], proto TCP (6), length 62)
    127.0.0.1.9450 > 127.0.0.1.36996: Flags [P.], cksum 0xfe32 (incorrect -> 0x3c8c), seq 3:13, ack 14, win 512, options [nop,nop,TS val 775237945 ecr 775237856], length 10
2022-04-05 05:46:33.573671 IP (tos 0x0, ttl 64, id 2409, offset 0, flags [DF], proto TCP (6), length 52)
    127.0.0.1.36996 > 127.0.0.1.9450: Flags [.], cksum 0xfe28 (incorrect -> 0x413c), seq 14, ack 13, win 512, options [nop,nop,TS val 775237945 ecr 775237945], length 0
2022-04-05 05:46:33.579591 IP (tos 0x0, ttl 64, id 2410, offset 0, flags [DF], proto TCP (6), length 569)
    127.0.0.1.36996 > 127.0.0.1.9450: Flags [P.], cksum 0x002e (incorrect -> 0x9897), seq 14:531, ack 13, win 512, options [nop,nop,TS val 775237951 ecr 775237945], length 517
2022-04-05 05:46:33.579603 IP (tos 0x0, ttl 64, id 6368, offset 0, flags [DF], proto TCP (6), length 52)
    127.0.0.1.9450 > 127.0.0.1.36996: Flags [.], cksum 0xfe28 (incorrect -> 0x3f2f), seq 13, ack 531, win 508, options [nop,nop,TS val 775237951 ecr 775237951], length 0
2022-04-05 05:46:33.670096 IP (tos 0x0, ttl 64, id 6369, offset 0, flags [DF], proto TCP (6), length 3538)
    127.0.0.1.9450 > 127.0.0.1.36996: Flags [P.], cksum 0x0bc7 (incorrect -> 0xbaae), seq 13:3499, ack 531, win 512, options [nop,nop,TS val 775238041 ecr 775237951], length 3486
2022-04-05 05:46:33.670103 IP (tos 0x0, ttl 64, id 2411, offset 0, flags [DF], proto TCP (6), length 52)
    127.0.0.1.36996 > 127.0.0.1.9450: Flags [.], cksum 0xfe28 (incorrect -> 0x30eb), seq 531, ack 3499, win 494, options [nop,nop,TS val 775238041 ecr 775238041], length 0
2022-04-05 05:46:33.693849 IP (tos 0x0, ttl 64, id 6370, offset 0, flags [DF], proto TCP (6), length 1217)
    127.0.0.1.9450 > 127.0.0.1.36996: Flags [P.], cksum 0x02b6 (incorrect -> 0xdca8), seq 3499:4664, ack 531, win 512, options [nop,nop,TS val 775238065 ecr 775238041], length 1165
2022-04-05 05:46:33.693855 IP (tos 0x0, ttl 64, id 2412, offset 0, flags [DF], proto TCP (6), length 52)
    127.0.0.1.36996 > 127.0.0.1.9450: Flags [.], cksum 0xfe28 (incorrect -> 0x2c25), seq 531, ack 4664, win 503, options [nop,nop,TS val 775238065 ecr 775238065], length 0
2022-04-05 05:46:33.694221 IP (tos 0x0, ttl 64, id 2413, offset 0, flags [DF], proto TCP (6), length 132)
    127.0.0.1.36996 > 127.0.0.1.9450: Flags [P.], cksum 0xfe78 (incorrect -> 0x3685), seq 531:611, ack 4664, win 503, options [nop,nop,TS val 775238065 ecr 775238065], length 80
2022-04-05 05:46:33.694230 IP (tos 0x0, ttl 64, id 6371, offset 0, flags [DF], proto TCP (6), length 52)
    127.0.0.1.9450 > 127.0.0.1.36996: Flags [.], cksum 0xfe28 (incorrect -> 0x2bcc), seq 4664, ack 611, win 512, options [nop,nop,TS val 775238065 ecr 775238065], length 0
2022-04-05 05:46:33.694588 IP (tos 0x0, ttl 64, id 2414, offset 0, flags [DF], proto TCP (6), length 338)
    127.0.0.1.36996 > 127.0.0.1.9450: Flags [P.], cksum 0xff46 (incorrect -> 0xa98f), seq 611:897, ack 4664, win 503, options [nop,nop,TS val 775238066 ecr 775238065], length 286
2022-04-05 05:46:33.694594 IP (tos 0x0, ttl 64, id 6372, offset 0, flags [DF], proto TCP (6), length 52)
    127.0.0.1.9450 > 127.0.0.1.36996: Flags [.], cksum 0xfe28 (incorrect -> 0x2aae), seq 4664, ack 897, win 510, options [nop,nop,TS val 775238066 ecr 775238066], length 0
2022-04-05 05:46:33.787339 IP (tos 0x0, ttl 64, id 6373, offset 0, flags [DF], proto TCP (6), length 510)
    127.0.0.1.9450 > 127.0.0.1.36996: Flags [P.], cksum 0xfff2 (incorrect -> 0xe544), seq 4664:5122, ack 897, win 512, options [nop,nop,TS val 775238158 ecr 775238066], length 458
2022-04-05 05:46:33.787348 IP (tos 0x0, ttl 64, id 2415, offset 0, flags [DF], proto TCP (6), length 52)
    127.0.0.1.36996 > 127.0.0.1.9450: Flags [.], cksum 0xfe28 (incorrect -> 0x2830), seq 897, ack 5122, win 506, options [nop,nop,TS val 775238158 ecr 775238158], length 0
2022-04-05 05:46:33.787365 IP (tos 0x0, ttl 64, id 6374, offset 0, flags [DF], proto TCP (6), length 52)
    127.0.0.1.9450 > 127.0.0.1.36996: Flags [F.], cksum 0xfe28 (incorrect -> 0x2829), seq 5122, ack 897, win 512, options [nop,nop,TS val 775238158 ecr 775238158], length 0
2022-04-05 05:46:33.788275 IP (tos 0x0, ttl 64, id 2416, offset 0, flags [DF], proto TCP (6), length 52)
    127.0.0.1.36996 > 127.0.0.1.9450: Flags [R.], cksum 0xfe28 (incorrect -> 0x2824), seq 897, ack 5123, win 512, options [nop,nop,TS val 775238159 ecr 775238158], length 0
2022-04-05 05:46:33.789380 IP (tos 0x0, ttl 64, id 62055, offset 0, flags [DF], proto TCP (6), length 60)
    127.0.0.1.36998 > 127.0.0.1.9450: Flags [S], cksum 0xfe30 (incorrect -> 0x9905), seq 4108495971, win 65495, options [mss 65495,sackOK,TS val 775238160 ecr 0,nop,wscale 7], length 0
2022-04-05 05:46:33.789391 IP (tos 0x0, ttl 64, id 0, offset 0, flags [DF], proto TCP (6), length 60)
    127.0.0.1.9450 > 127.0.0.1.36998: Flags [S.], cksum 0xfe30 (incorrect -> 0x6805), seq 488682389, ack 4108495972, win 65483, options [mss 65495,sackOK,TS val 775238160 ecr 775238160,nop,wscale 7], length 0
2022-04-05 05:46:33.789403 IP (tos 0x0, ttl 64, id 62056, offset 0, flags [DF], proto TCP (6), length 52)
    127.0.0.1.36998 > 127.0.0.1.9450: Flags [.], cksum 0xfe28 (incorrect -> 0x8ec0), seq 1, ack 1, win 512, options [nop,nop,TS val 775238161 ecr 775238160], length 0
2022-04-05 05:46:33.789493 IP (tos 0x0, ttl 64, id 62057, offset 0, flags [DF], proto TCP (6), length 55)
    127.0.0.1.36998 > 127.0.0.1.9450: Flags [P.], cksum 0xfe2b (incorrect -> 0x89b4), seq 1:4, ack 1, win 512, options [nop,nop,TS val 775238161 ecr 775238160], length 3
2022-04-05 05:46:33.789499 IP (tos 0x0, ttl 64, id 5308, offset 0, flags [DF], proto TCP (6), length 52)
    127.0.0.1.9450 > 127.0.0.1.36998: Flags [.], cksum 0xfe28 (incorrect -> 0x8ebc), seq 1, ack 4, win 512, options [nop,nop,TS val 775238161 ecr 775238161], length 0
2022-04-05 05:46:33.789516 IP (tos 0x0, ttl 64, id 5309, offset 0, flags [DF], proto TCP (6), length 54)
    127.0.0.1.9450 > 127.0.0.1.36998: Flags [P.], cksum 0xfe2a (incorrect -> 0x89b2), seq 1:3, ack 4, win 512, options [nop,nop,TS val 775238161 ecr 775238161], length 2
2022-04-05 05:46:33.789523 IP (tos 0x0, ttl 64, id 62058, offset 0, flags [DF], proto TCP (6), length 52)
    127.0.0.1.36998 > 127.0.0.1.9450: Flags [.], cksum 0xfe28 (incorrect -> 0x8eba), seq 4, ack 3, win 512, options [nop,nop,TS val 775238161 ecr 775238161], length 0
2022-04-05 05:46:33.790644 IP (tos 0x0, ttl 64, id 62059, offset 0, flags [DF], proto TCP (6), length 62)
    127.0.0.1.36998 > 127.0.0.1.9450: Flags [P.], cksum 0xfe32 (incorrect -> 0xef6f), seq 4:14, ack 3, win 512, options [nop,nop,TS val 775238162 ecr 775238161], length 10
2022-04-05 05:46:33.790660 IP (tos 0x0, ttl 64, id 5310, offset 0, flags [DF], proto TCP (6), length 52)
    127.0.0.1.9450 > 127.0.0.1.36998: Flags [.], cksum 0xfe28 (incorrect -> 0x8eae), seq 3, ack 14, win 512, options [nop,nop,TS val 775238162 ecr 775238162], length 0
2022-04-05 05:46:33.883505 IP (tos 0x0, ttl 64, id 5311, offset 0, flags [DF], proto TCP (6), length 62)
    127.0.0.1.9450 > 127.0.0.1.36998: Flags [P.], cksum 0xfe32 (incorrect -> 0x893e), seq 3:13, ack 14, win 512, options [nop,nop,TS val 775238255 ecr 775238162], length 10
2022-04-05 05:46:33.883517 IP (tos 0x0, ttl 64, id 62060, offset 0, flags [DF], proto TCP (6), length 52)
    127.0.0.1.36998 > 127.0.0.1.9450: Flags [.], cksum 0xfe28 (incorrect -> 0x8dea), seq 14, ack 13, win 512, options [nop,nop,TS val 775238255 ecr 775238255], length 0
2022-04-05 05:46:33.890375 IP (tos 0x0, ttl 64, id 62061, offset 0, flags [DF], proto TCP (6), length 569)
    127.0.0.1.36998 > 127.0.0.1.9450: Flags [P.], cksum 0x002e (incorrect -> 0x9266), seq 14:531, ack 13, win 512, options [nop,nop,TS val 775238261 ecr 775238255], length 517
2022-04-05 05:46:33.890384 IP (tos 0x0, ttl 64, id 5312, offset 0, flags [DF], proto TCP (6), length 52)
    127.0.0.1.9450 > 127.0.0.1.36998: Flags [.], cksum 0xfe28 (incorrect -> 0x8bdd), seq 13, ack 531, win 508, options [nop,nop,TS val 775238261 ecr 775238261], length 0
2022-04-05 05:46:33.979580 IP (tos 0x0, ttl 64, id 5313, offset 0, flags [DF], proto TCP (6), length 3438)
    127.0.0.1.9450 > 127.0.0.1.36998: Flags [P.], cksum 0x0b63 (incorrect -> 0xa856), seq 13:3399, ack 531, win 512, options [nop,nop,TS val 775238351 ecr 775238261], length 3386
2022-04-05 05:46:33.979587 IP (tos 0x0, ttl 64, id 62062, offset 0, flags [DF], proto TCP (6), length 52)
    127.0.0.1.36998 > 127.0.0.1.9450: Flags [.], cksum 0xfe28 (incorrect -> 0x7dfd), seq 531, ack 3399, win 494, options [nop,nop,TS val 775238351 ecr 775238351], length 0
2022-04-05 05:46:34.003373 IP (tos 0x0, ttl 64, id 5314, offset 0, flags [DF], proto TCP (6), length 1317)
    127.0.0.1.9450 > 127.0.0.1.36998: Flags [P.], cksum 0x031a (incorrect -> 0x15dc), seq 3399:4664, ack 531, win 512, options [nop,nop,TS val 775238374 ecr 775238351], length 1265
2022-04-05 05:46:34.003379 IP (tos 0x0, ttl 64, id 62063, offset 0, flags [DF], proto TCP (6), length 52)
    127.0.0.1.36998 > 127.0.0.1.9450: Flags [.], cksum 0xfe28 (incorrect -> 0x78d5), seq 531, ack 4664, win 503, options [nop,nop,TS val 775238374 ecr 775238374], length 0
2022-04-05 05:46:34.003770 IP (tos 0x0, ttl 64, id 62064, offset 0, flags [DF], proto TCP (6), length 132)
    127.0.0.1.36998 > 127.0.0.1.9450: Flags [P.], cksum 0xfe78 (incorrect -> 0xefe7), seq 531:611, ack 4664, win 503, options [nop,nop,TS val 775238375 ecr 775238374], length 80
2022-04-05 05:46:34.003776 IP (tos 0x0, ttl 64, id 5315, offset 0, flags [DF], proto TCP (6), length 52)
    127.0.0.1.9450 > 127.0.0.1.36998: Flags [.], cksum 0xfe28 (incorrect -> 0x787a), seq 4664, ack 611, win 512, options [nop,nop,TS val 775238375 ecr 775238375], length 0
2022-04-05 05:46:34.004193 IP (tos 0x0, ttl 64, id 62065, offset 0, flags [DF], proto TCP (6), length 345)
    127.0.0.1.36998 > 127.0.0.1.9450: Flags [P.], cksum 0xff4d (incorrect -> 0x0cb3), seq 611:904, ack 4664, win 503, options [nop,nop,TS val 775238375 ecr 775238375], length 293
2022-04-05 05:46:34.004201 IP (tos 0x0, ttl 64, id 5316, offset 0, flags [DF], proto TCP (6), length 52)
    127.0.0.1.9450 > 127.0.0.1.36998: Flags [.], cksum 0xfe28 (incorrect -> 0x7757), seq 4664, ack 904, win 510, options [nop,nop,TS val 775238375 ecr 775238375], length 0
2022-04-05 05:46:34.590161 IP (tos 0x0, ttl 64, id 5317, offset 0, flags [DF], proto TCP (6), length 3538)
    127.0.0.1.9450 > 127.0.0.1.36998: Flags [P.], cksum 0x0bc7 (incorrect -> 0x2e7d), seq 4664:8150, ack 904, win 512, options [nop,nop,TS val 775238961 ecr 775238375], length 3486
2022-04-05 05:46:34.590170 IP (tos 0x0, ttl 64, id 62066, offset 0, flags [DF], proto TCP (6), length 52)
    127.0.0.1.36998 > 127.0.0.1.9450: Flags [.], cksum 0xfe28 (incorrect -> 0x6535), seq 904, ack 8150, win 494, options [nop,nop,TS val 775238961 ecr 775238961], length 0
2022-04-05 05:46:34.606802 IP (tos 0x0, ttl 64, id 5318, offset 0, flags [DF], proto TCP (6), length 2680)
    127.0.0.1.9450 > 127.0.0.1.36998: Flags [P.], cksum 0x086d (incorrect -> 0xb596), seq 8150:10778, ack 904, win 512, options [nop,nop,TS val 775238978 ecr 775238961], length 2628
2022-04-05 05:46:34.606808 IP (tos 0x0, ttl 64, id 62067, offset 0, flags [DF], proto TCP (6), length 52)
    127.0.0.1.36998 > 127.0.0.1.9450: Flags [.], cksum 0xfe28 (incorrect -> 0x5acc), seq 904, ack 10778, win 497, options [nop,nop,TS val 775238978 ecr 775238978], length 0
2022-04-05 05:46:34.607265 IP (tos 0x0, ttl 64, id 5319, offset 0, flags [DF], proto TCP (6), length 1625)
    127.0.0.1.9450 > 127.0.0.1.36998: Flags [P.], cksum 0x044e (incorrect -> 0x08e3), seq 10778:12351, ack 904, win 512, options [nop,nop,TS val 775238978 ecr 775238978], length 1573
2022-04-05 05:46:34.607270 IP (tos 0x0, ttl 64, id 62068, offset 0, flags [DF], proto TCP (6), length 52)
    127.0.0.1.36998 > 127.0.0.1.9450: Flags [.], cksum 0xfe28 (incorrect -> 0x54a3), seq 904, ack 12351, win 501, options [nop,nop,TS val 775238978 ecr 775238978], length 0
2022-04-05 05:46:34.608451 IP (tos 0x0, ttl 64, id 5320, offset 0, flags [DF], proto TCP (6), length 3123)
    127.0.0.1.9450 > 127.0.0.1.36998: Flags [P.], cksum 0x0a28 (incorrect -> 0xcd2c), seq 12351:15422, ack 904, win 512, options [nop,nop,TS val 775238980 ecr 775238978], length 3071
2022-04-05 05:46:34.608455 IP (tos 0x0, ttl 64, id 62069, offset 0, flags [DF], proto TCP (6), length 52)
    127.0.0.1.36998 > 127.0.0.1.9450: Flags [.], cksum 0xfe28 (incorrect -> 0x48a5), seq 904, ack 15422, win 496, options [nop,nop,TS val 775238980 ecr 775238980], length 0
2022-04-05 05:46:34.613764 IP (tos 0x0, ttl 64, id 5321, offset 0, flags [DF], proto TCP (6), length 3871)
    127.0.0.1.9450 > 127.0.0.1.36998: Flags [P.], cksum 0x0d14 (incorrect -> 0x712b), seq 15422:19241, ack 904, win 512, options [nop,nop,TS val 775238985 ecr 775238980], length 3819
2022-04-05 05:46:34.613769 IP (tos 0x0, ttl 64, id 62070, offset 0, flags [DF], proto TCP (6), length 52)
    127.0.0.1.36998 > 127.0.0.1.9450: Flags [.], cksum 0xfe28 (incorrect -> 0x39b3), seq 904, ack 19241, win 493, options [nop,nop,TS val 775238985 ecr 775238985], length 0
2022-04-05 05:46:34.627992 IP (tos 0x0, ttl 64, id 5322, offset 0, flags [DF], proto TCP (6), length 1689)
    127.0.0.1.9450 > 127.0.0.1.36998: Flags [P.], cksum 0x048e (incorrect -> 0xa0ee), seq 19241:20878, ack 904, win 512, options [nop,nop,TS val 775238999 ecr 775238985], length 1637
2022-04-05 05:46:34.627998 IP (tos 0x0, ttl 64, id 62071, offset 0, flags [DF], proto TCP (6), length 52)
    127.0.0.1.36998 > 127.0.0.1.9450: Flags [.], cksum 0xfe28 (incorrect -> 0x332a), seq 904, ack 20878, win 501, options [nop,nop,TS val 775238999 ecr 775238999], length 0
2022-04-05 05:46:34.637311 IP (tos 0x0, ttl 64, id 5323, offset 0, flags [DF], proto TCP (6), length 3081)
    127.0.0.1.9450 > 127.0.0.1.36998: Flags [P.], cksum 0x09fe (incorrect -> 0x4197), seq 20878:23907, ack 904, win 512, options [nop,nop,TS val 775239008 ecr 775238999], length 3029
2022-04-05 05:46:34.637318 IP (tos 0x0, ttl 64, id 62072, offset 0, flags [DF], proto TCP (6), length 52)
    127.0.0.1.36998 > 127.0.0.1.9450: Flags [.], cksum 0xfe28 (incorrect -> 0x2748), seq 904, ack 23907, win 496, options [nop,nop,TS val 775239008 ecr 775239008], length 0
200, 6.797857761383057, 1.2687513828277588