2022-04-05 17:14:58.873465 IP (tos 0x0, ttl 64, id 15245, offset 0, flags [DF], proto TCP (6), length 60)
    127.0.0.1.44524 > 127.0.0.1.9150: Flags [S], cksum 0xfe30 (incorrect -> 0x2f11), seq 1090432758, win 65495, options [mss 65495,sackOK,TS val 261181376 ecr 0,nop,wscale 7], length 0
2022-04-05 17:14:58.873489 IP (tos 0x0, ttl 64, id 0, offset 0, flags [DF], proto TCP (6), length 60)
    127.0.0.1.9150 > 127.0.0.1.44524: Flags [S.], cksum 0xfe30 (incorrect -> 0x02d9), seq 1879530714, ack 1090432759, win 65483, options [mss 65495,sackOK,TS val 261181376 ecr 261181376,nop,wscale 7], length 0
2022-04-05 17:14:58.873506 IP (tos 0x0, ttl 64, id 15246, offset 0, flags [DF], proto TCP (6), length 52)
    127.0.0.1.44524 > 127.0.0.1.9150: Flags [.], cksum 0xfe28 (incorrect -> 0x2995), seq 1, ack 1, win 512, options [nop,nop,TS val 261181376 ecr 261181376], length 0
2022-04-05 17:14:58.873625 IP (tos 0x0, ttl 64, id 15247, offset 0, flags [DF], proto TCP (6), length 55)
    127.0.0.1.44524 > 127.0.0.1.9150: Flags [P.], cksum 0xfe2b (incorrect -> 0x2489), seq 1:4, ack 1, win 512, options [nop,nop,TS val 261181376 ecr 261181376], length 3
2022-04-05 17:14:58.873632 IP (tos 0x0, ttl 64, id 40097, offset 0, flags [DF], proto TCP (6), length 52)
    127.0.0.1.9150 > 127.0.0.1.44524: Flags [.], cksum 0xfe28 (incorrect -> 0x2992), seq 1, ack 4, win 512, options [nop,nop,TS val 261181376 ecr 261181376], length 0
2022-04-05 17:14:58.873724 IP (tos 0x0, ttl 64, id 40098, offset 0, flags [DF], proto TCP (6), length 54)
    127.0.0.1.9150 > 127.0.0.1.44524: Flags [P.], cksum 0xfe2a (incorrect -> 0x2488), seq 1:3, ack 4, win 512, options [nop,nop,TS val 261181376 ecr 261181376], length 2
2022-04-05 17:14:58.873732 IP (tos 0x0, ttl 64, id 15248, offset 0, flags [DF], proto TCP (6), length 52)
    127.0.0.1.44524 > 127.0.0.1.9150: Flags [.], cksum 0xfe28 (incorrect -> 0x2990), seq 4, ack 3, win 512, options [nop,nop,TS val 261181376 ecr 261181376], length 0
2022-04-05 17:14:58.875179 IP (tos 0x0, ttl 64, id 15249, offset 0, flags [DF], proto TCP (6), length 62)
    127.0.0.1.44524 > 127.0.0.1.9150: Flags [P.], cksum 0xfe32 (incorrect -> 0xd149), seq 4:14, ack 3, win 512, options [nop,nop,TS val 261181378 ecr 261181376], length 10
2022-04-05 17:14:58.875202 IP (tos 0x0, ttl 64, id 40099, offset 0, flags [DF], proto TCP (6), length 52)
    127.0.0.1.9150 > 127.0.0.1.44524: Flags [.], cksum 0xfe28 (incorrect -> 0x2982), seq 3, ack 14, win 512, options [nop,nop,TS val 261181378 ecr 261181378], length 0
2022-04-05 17:14:59.164648 IP (tos 0x0, ttl 64, id 40100, offset 0, flags [DF], proto TCP (6), length 62)
    127.0.0.1.9150 > 127.0.0.1.44524: Flags [P.], cksum 0xfe32 (incorrect -> 0x234e), seq 3:13, ack 14, win 512, options [nop,nop,TS val 261181667 ecr 261181378], length 10
2022-04-05 17:14:59.164662 IP (tos 0x0, ttl 64, id 15250, offset 0, flags [DF], proto TCP (6), length 52)
    127.0.0.1.44524 > 127.0.0.1.9150: Flags [.], cksum 0xfe28 (incorrect -> 0x2736), seq 14, ack 13, win 512, options [nop,nop,TS val 261181667 ecr 261181667], length 0
2022-04-05 17:14:59.170380 IP (tos 0x0, ttl 64, id 15251, offset 0, flags [DF], proto TCP (6), length 569)
    127.0.0.1.44524 > 127.0.0.1.9150: Flags [P.], cksum 0x002e (incorrect -> 0x23bd), seq 14:531, ack 13, win 512, options [nop,nop,TS val 261181673 ecr 261181667], length 517
2022-04-05 17:14:59.170389 IP (tos 0x0, ttl 64, id 40101, offset 0, flags [DF], proto TCP (6), length 52)
    127.0.0.1.9150 > 127.0.0.1.44524: Flags [.], cksum 0xfe28 (incorrect -> 0x2529), seq 13, ack 531, win 508, options [nop,nop,TS val 261181673 ecr 261181673], length 0
2022-04-05 17:14:59.459005 IP (tos 0x0, ttl 64, id 40102, offset 0, flags [DF], proto TCP (6), length 3538)
    127.0.0.1.9150 > 127.0.0.1.44524: Flags [P.], cksum 0x0bc7 (incorrect -> 0xb66b), seq 13:3499, ack 531, win 512, options [nop,nop,TS val 261181961 ecr 261181673], length 3486
2022-04-05 17:14:59.459018 IP (tos 0x0, ttl 64, id 15252, offset 0, flags [DF], proto TCP (6), length 52)
    127.0.0.1.44524 > 127.0.0.1.9150: Flags [.], cksum 0xfe28 (incorrect -> 0x1559), seq 531, ack 3499, win 494, options [nop,nop,TS val 261181961 ecr 261181961], length 0
2022-04-05 17:14:59.631055 IP (tos 0x0, ttl 64, id 40103, offset 0, flags [DF], proto TCP (6), length 272)
    127.0.0.1.9150 > 127.0.0.1.44524: Flags [P.], cksum 0xff04 (incorrect -> 0xb57c), seq 3499:3719, ack 531, win 512, options [nop,nop,TS val 261182133 ecr 261181961], length 220
2022-04-05 17:14:59.631065 IP (tos 0x0, ttl 64, id 15253, offset 0, flags [DF], proto TCP (6), length 52)
    127.0.0.1.44524 > 127.0.0.1.9150: Flags [.], cksum 0xfe28 (incorrect -> 0x1317), seq 531, ack 3719, win 507, options [nop,nop,TS val 261182134 ecr 261182133], length 0
2022-04-05 17:14:59.631163 IP (tos 0x0, ttl 64, id 15254, offset 0, flags [DF], proto TCP (6), length 132)
    127.0.0.1.44524 > 127.0.0.1.9150: Flags [P.], cksum 0xfe78 (incorrect -> 0x092f), seq 531:611, ack 3719, win 507, options [nop,nop,TS val 261182134 ecr 261182133], length 80
2022-04-05 17:14:59.631171 IP (tos 0x0, ttl 64, id 40104, offset 0, flags [DF], proto TCP (6), length 52)
    127.0.0.1.9150 > 127.0.0.1.44524: Flags [.], cksum 0xfe28 (incorrect -> 0x12c1), seq 3719, ack 611, win 512, options [nop,nop,TS val 261182134 ecr 261182134], length 0
2022-04-05 17:14:59.631591 IP (tos 0x0, ttl 64, id 15255, offset 0, flags [DF], proto TCP (6), length 369)
    127.0.0.1.44524 > 127.0.0.1.9150: Flags [P.], cksum 0xff65 (incorrect -> 0x5b73), seq 611:928, ack 3719, win 507, options [nop,nop,TS val 261182134 ecr 261182134], length 317
2022-04-05 17:14:59.631598 IP (tos 0x0, ttl 64, id 40105, offset 0, flags [DF], proto TCP (6), length 52)
    127.0.0.1.9150 > 127.0.0.1.44524: Flags [.], cksum 0xfe28 (incorrect -> 0x1186), seq 3719, ack 928, win 510, options [nop,nop,TS val 261182134 ecr 261182134], length 0
2022-04-05 17:15:00.482596 IP (tos 0x0, ttl 64, id 40106, offset 0, flags [DF], proto TCP (6), length 1736)
    127.0.0.1.9150 > 127.0.0.1.44524: Flags [P.], cksum 0x04bd (incorrect -> 0xae95), seq 3719:5403, ack 928, win 512, options [nop,nop,TS val 261182985 ecr 261182134], length 1684
2022-04-05 17:15:00.482608 IP (tos 0x0, ttl 64, id 15256, offset 0, flags [DF], proto TCP (6), length 52)
    127.0.0.1.44524 > 127.0.0.1.9150: Flags [.], cksum 0xfe28 (incorrect -> 0x0455), seq 928, ack 5403, win 501, options [nop,nop,TS val 261182985 ecr 261182985], length 0
2022-04-05 17:15:00.584843 IP (tos 0x0, ttl 64, id 40107, offset 0, flags [DF], proto TCP (6), length 3538)
    127.0.0.1.9150 > 127.0.0.1.44524: Flags [P.], cksum 0x0bc7 (incorrect -> 0xcf2c), seq 5403:8889, ack 928, win 512, options [nop,nop,TS val 261183087 ecr 261182985], length 3486
2022-04-05 17:15:00.584853 IP (tos 0x0, ttl 64, id 15257, offset 0, flags [DF], proto TCP (6), length 52)
    127.0.0.1.44524 > 127.0.0.1.9150: Flags [.], cksum 0xfe28 (incorrect -> 0xf5f1), seq 928, ack 8889, win 494, options [nop,nop,TS val 261183087 ecr 261183087], length 0
2022-04-05 17:15:00.597850 IP (tos 0x0, ttl 64, id 40108, offset 0, flags [DF], proto TCP (6), length 3884)
    127.0.0.1.9150 > 127.0.0.1.44524: Flags [P.], cksum 0x0d21 (incorrect -> 0x199f), seq 8889:12721, ack 928, win 512, options [nop,nop,TS val 261183100 ecr 261183087], length 3832
2022-04-05 17:15:00.597860 IP (tos 0x0, ttl 64, id 15258, offset 0, flags [DF], proto TCP (6), length 52)
    127.0.0.1.44524 > 127.0.0.1.9150: Flags [.], cksum 0xfe28 (incorrect -> 0xe6e0), seq 928, ack 12721, win 493, options [nop,nop,TS val 261183100 ecr 261183100], length 0
2022-04-05 17:15:00.598738 IP (tos 0x0, ttl 64, id 40109, offset 0, flags [DF], proto TCP (6), length 1470)
    127.0.0.1.9150 > 127.0.0.1.44524: Flags [P.], cksum 0x03b3 (incorrect -> 0xbdfe), seq 12721:14139, ack 928, win 512, options [nop,nop,TS val 261183101 ecr 261183100], length 1418
2022-04-05 17:15:00.598746 IP (tos 0x0, ttl 64, id 15259, offset 0, flags [DF], proto TCP (6), length 52)
    127.0.0.1.44524 > 127.0.0.1.9150: Flags [.], cksum 0xfe28 (incorrect -> 0xe14b), seq 928, ack 14139, win 502, options [nop,nop,TS val 261183101 ecr 261183101], length 0
2022-04-05 17:15:00.614441 IP (tos 0x0, ttl 64, id 40110, offset 0, flags [DF], proto TCP (6), length 3462)
    127.0.0.1.9150 > 127.0.0.1.44524: Flags [P.], cksum 0x0b7b (incorrect -> 0xa260), seq 14139:17549, ack 928, win 512, options [nop,nop,TS val 261183117 ecr 261183101], length 3410
2022-04-05 17:15:00.614451 IP (tos 0x0, ttl 64, id 15260, offset 0, flags [DF], proto TCP (6), length 52)
    127.0.0.1.44524 > 127.0.0.1.9150: Flags [.], cksum 0xfe28 (incorrect -> 0xd3e1), seq 928, ack 17549, win 494, options [nop,nop,TS val 261183117 ecr 261183117], length 0
2022-04-05 17:15:00.628472 IP (tos 0x0, ttl 64, id 40111, offset 0, flags [DF], proto TCP (6), length 2466)
    127.0.0.1.9150 > 127.0.0.1.44524: Flags [P.], cksum 0x0797 (incorrect -> 0x5fb4), seq 17549:19963, ack 928, win 512, options [nop,nop,TS val 261183131 ecr 261183117], length 2414
2022-04-05 17:15:00.628479 IP (tos 0x0, ttl 64, id 15261, offset 0, flags [DF], proto TCP (6), length 52)
    127.0.0.1.44524 > 127.0.0.1.9150: Flags [.], cksum 0xfe28 (incorrect -> 0xca53), seq 928, ack 19963, win 498, options [nop,nop,TS val 261183131 ecr 261183131], length 0
2022-04-05 17:15:00.719638 IP (tos 0x0, ttl 64, id 40112, offset 0, flags [DF], proto TCP (6), length 3462)
    127.0.0.1.9150 > 127.0.0.1.44524: Flags [P.], cksum 0x0b7b (incorrect -> 0x0fcc), seq 19963:23373, ack 928, win 512, options [nop,nop,TS val 261183222 ecr 261183131], length 3410
2022-04-05 17:15:00.719648 IP (tos 0x0, ttl 64, id 15262, offset 0, flags [DF], proto TCP (6), length 52)
    127.0.0.1.44524 > 127.0.0.1.9150: Flags [.], cksum 0xfe28 (incorrect -> 0xbc4f), seq 928, ack 23373, win 494, options [nop,nop,TS val 261183222 ecr 261183222], length 0
2022-04-05 17:15:00.720149 IP (tos 0x0, ttl 64, id 40113, offset 0, flags [DF], proto TCP (6), length 4100)
    127.0.0.1.9150 > 127.0.0.1.44524: Flags [P.], cksum 0x0df9 (incorrect -> 0xb47e), seq 23373:27421, ack 928, win 512, options [nop,nop,TS val 261183223 ecr 261183222], length 4048
2022-04-05 17:15:00.720156 IP (tos 0x0, ttl 64, id 15263, offset 0, flags [DF], proto TCP (6), length 52)
    127.0.0.1.44524 > 127.0.0.1.9150: Flags [.], cksum 0xfe28 (incorrect -> 0xac7f), seq 928, ack 27421, win 492, options [nop,nop,TS val 261183223 ecr 261183223], length 0
2022-04-05 17:15:00.720164 IP (tos 0x0, ttl 64, id 40114, offset 0, flags [DF], proto TCP (6), length 3820)
    127.0.0.1.9150 > 127.0.0.1.44524: Flags [P.], cksum 0x0ce1 (incorrect -> 0x7839), seq 27421:31189, ack 928, win 512, options [nop,nop,TS val 261183223 ecr 261183223], length 3768
2022-04-05 17:15:00.720167 IP (tos 0x0, ttl 64, id 15264, offset 0, flags [DF], proto TCP (6), length 52)
    127.0.0.1.44524 > 127.0.0.1.9150: Flags [.], cksum 0xfe28 (incorrect -> 0x9dd6), seq 928, ack 31189, win 477, options [nop,nop,TS val 261183223 ecr 261183223], length 0
2022-04-05 17:15:00.726527 IP (tos 0x0, ttl 64, id 40115, offset 0, flags [DF], proto TCP (6), length 972)
    127.0.0.1.9150 > 127.0.0.1.44524: Flags [P.], cksum 0x01c1 (incorrect -> 0xa1bc), seq 31189:32109, ack 928, win 512, options [nop,nop,TS val 261183229 ecr 261183223], length 920
2022-04-05 17:15:00.726533 IP (tos 0x0, ttl 64, id 15265, offset 0, flags [DF], proto TCP (6), length 52)
    127.0.0.1.44524 > 127.0.0.1.9150: Flags [.], cksum 0xfe28 (incorrect -> 0x9a17), seq 928, ack 32109, win 504, options [nop,nop,TS val 261183229 ecr 261183229], length 0
2022-04-05 17:15:00.731486 IP (tos 0x0, ttl 64, id 40116, offset 0, flags [DF], proto TCP (6), length 3960)
    127.0.0.1.9150 > 127.0.0.1.44524: Flags [P.], cksum 0x0d6d (incorrect -> 0x8d7d), seq 32109:36017, ack 928, win 512, options [nop,nop,TS val 261183234 ecr 261183229], length 3908
2022-04-05 17:15:00.731523 IP (tos 0x0, ttl 64, id 15266, offset 0, flags [DF], proto TCP (6), length 52)
    127.0.0.1.44524 > 127.0.0.1.9150: Flags [.], cksum 0xfe28 (incorrect -> 0x8ac1), seq 928, ack 36017, win 512, options [nop,nop,TS val 261183234 ecr 261183234], length 0
2022-04-05 17:15:00.733881 IP (tos 0x0, ttl 64, id 40117, offset 0, flags [DF], proto TCP (6), length 3388)
    127.0.0.1.9150 > 127.0.0.1.44524: Flags [P.], cksum 0x0b31 (incorrect -> 0x8199), seq 36017:39353, ack 928, win 512, options [nop,nop,TS val 261183236 ecr 261183234], length 3336
2022-04-05 17:15:00.734322 IP (tos 0x0, ttl 64, id 15267, offset 0, flags [DF], proto TCP (6), length 52)
    127.0.0.1.44524 > 127.0.0.1.9150: Flags [.], cksum 0xfe28 (incorrect -> 0x7db4), seq 928, ack 39353, win 512, options [nop,nop,TS val 261183237 ecr 261183236], length 0
2022-04-05 17:15:00.734358 IP (tos 0x0, ttl 64, id 40118, offset 0, flags [DF], proto TCP (6), length 2044)
    127.0.0.1.9150 > 127.0.0.1.44524: Flags [P.], cksum 0x05f1 (incorrect -> 0x1e75), seq 39353:41345, ack 928, win 512, options [nop,nop,TS val 261183237 ecr 261183237], length 1992
2022-04-05 17:15:00.734378 IP (tos 0x0, ttl 64, id 15268, offset 0, flags [DF], proto TCP (6), length 52)
    127.0.0.1.44524 > 127.0.0.1.9150: Flags [.], cksum 0xfe28 (incorrect -> 0x75eb), seq 928, ack 41345, win 512, options [nop,nop,TS val 261183237 ecr 261183237], length 0
2022-04-05 17:15:00.743214 IP (tos 0x0, ttl 64, id 40119, offset 0, flags [DF], proto TCP (6), length 3386)
    127.0.0.1.9150 > 127.0.0.1.44524: Flags [P.], cksum 0x0b2f (incorrect -> 0x702b), seq 41345:44679, ack 928, win 512, options [nop,nop,TS val 261183246 ecr 261183237], length 3334
2022-04-05 17:15:00.743255 IP (tos 0x0, ttl 64, id 15269, offset 0, flags [DF], proto TCP (6), length 52)
    127.0.0.1.44524 > 127.0.0.1.9150: Flags [.], cksum 0xfe28 (incorrect -> 0x68d3), seq 928, ack 44679, win 512, options [nop,nop,TS val 261183246 ecr 261183246], length 0
2022-04-05 17:15:00.743563 IP (tos 0x0, ttl 64, id 40120, offset 0, flags [DF], proto TCP (6), length 3756)
    127.0.0.1.9150 > 127.0.0.1.44524: Flags [P.], cksum 0x0ca1 (incorrect -> 0x9bfb), seq 44679:48383, ack 928, win 512, options [nop,nop,TS val 261183246 ecr 261183246], length 3704
2022-04-05 17:15:00.743594 IP (tos 0x0, ttl 64, id 15270, offset 0, flags [DF], proto TCP (6), length 52)
    127.0.0.1.44524 > 127.0.0.1.9150: Flags [.], cksum 0xfe28 (incorrect -> 0x5a5b), seq 928, ack 48383, win 512, options [nop,nop,TS val 261183246 ecr 261183246], length 0
2022-04-05 17:15:00.743971 IP (tos 0x0, ttl 64, id 40121, offset 0, flags [DF], proto TCP (6), length 1546)
    127.0.0.1.9150 > 127.0.0.1.44524: Flags [P.], cksum 0x03ff (incorrect -> 0xd327), seq 48383:49877, ack 928, win 512, options [nop,nop,TS val 261183246 ecr 261183246], length 1494
2022-04-05 17:15:00.743994 IP (tos 0x0, ttl 64, id 15271, offset 0, flags [DF], proto TCP (6), length 52)
    127.0.0.1.44524 > 127.0.0.1.9150: Flags [.], cksum 0xfe28 (incorrect -> 0x5485), seq 928, ack 49877, win 512, options [nop,nop,TS val 261183246 ecr 261183246], length 0
2022-04-05 17:15:00.748079 IP (tos 0x0, ttl 64, id 40122, offset 0, flags [DF], proto TCP (6), length 2964)
    127.0.0.1.9150 > 127.0.0.1.44524: Flags [P.], cksum 0x0989 (incorrect -> 0x7c4b), seq 49877:52789, ack 928, win 512, options [nop,nop,TS val 261183251 ecr 261183246], length 2912
2022-04-05 17:15:00.748284 IP (tos 0x0, ttl 64, id 15272, offset 0, flags [DF], proto TCP (6), length 52)
    127.0.0.1.44524 > 127.0.0.1.9150: Flags [.], cksum 0xfe28 (incorrect -> 0x491b), seq 928, ack 52789, win 512, options [nop,nop,TS val 261183251 ecr 261183251], length 0
2022-04-05 17:15:00.849080 IP (tos 0x0, ttl 64, id 40123, offset 0, flags [DF], proto TCP (6), length 3386)
    127.0.0.1.9150 > 127.0.0.1.44524: Flags [P.], cksum 0x0b2f (incorrect -> 0xfc6e), seq 52789:56123, ack 928, win 512, options [nop,nop,TS val 261183351 ecr 261183251], length 3334
2022-04-05 17:15:00.849358 IP (tos 0x0, ttl 64, id 15273, offset 0, flags [DF], proto TCP (6), length 52)
    127.0.0.1.44524 > 127.0.0.1.9150: Flags [.], cksum 0xfe28 (incorrect -> 0x3b4c), seq 928, ack 56123, win 512, options [nop,nop,TS val 261183352 ecr 261183351], length 0
2022-04-05 17:15:00.863016 IP (tos 0x0, ttl 64, id 40124, offset 0, flags [DF], proto TCP (6), length 2193)
    127.0.0.1.9150 > 127.0.0.1.44524: Flags [P.], cksum 0x0686 (incorrect -> 0x9df8), seq 56123:58264, ack 928, win 512, options [nop,nop,TS val 261183365 ecr 261183352], length 2141
2022-04-05 17:15:00.863052 IP (tos 0x0, ttl 64, id 15274, offset 0, flags [DF], proto TCP (6), length 52)
    127.0.0.1.44524 > 127.0.0.1.9150: Flags [.], cksum 0xfe28 (incorrect -> 0x32d4), seq 928, ack 58264, win 512, options [nop,nop,TS val 261183365 ecr 261183365], length 0
2022-04-05 17:15:02.530754 IP (tos 0x0, ttl 64, id 40125, offset 0, flags [DF], proto TCP (6), length 602)
    127.0.0.1.9150 > 127.0.0.1.44524: Flags [P.], cksum 0x004f (incorrect -> 0x3dc4), seq 58264:58814, ack 928, win 512, options [nop,nop,TS val 261185033 ecr 261183365], length 550
2022-04-05 17:15:02.530763 IP (tos 0x0, ttl 64, id 15275, offset 0, flags [DF], proto TCP (6), length 52)
    127.0.0.1.44524 > 127.0.0.1.9150: Flags [.], cksum 0xfe28 (incorrect -> 0x23aa), seq 928, ack 58814, win 508, options [nop,nop,TS val 261185033 ecr 261185033], length 0
2022-04-05 17:15:02.585416 IP (tos 0x0, ttl 64, id 40126, offset 0, flags [DF], proto TCP (6), length 3098)
    127.0.0.1.9150 > 127.0.0.1.44524: Flags [P.], cksum 0x0a0f (incorrect -> 0x722d), seq 58814:61860, ack 928, win 512, options [nop,nop,TS val 261185088 ecr 261185033], length 3046
2022-04-05 17:15:02.585422 IP (tos 0x0, ttl 64, id 15276, offset 0, flags [DF], proto TCP (6), length 52)
    127.0.0.1.44524 > 127.0.0.1.9150: Flags [.], cksum 0xfe28 (incorrect -> 0x1762), seq 928, ack 61860, win 496, options [nop,nop,TS val 261185088 ecr 261185088], length 0
2022-04-05 17:15:02.598745 IP (tos 0x0, ttl 64, id 40127, offset 0, flags [DF], proto TCP (6), length 2964)
    127.0.0.1.9150 > 127.0.0.1.44524: Flags [P.], cksum 0x0989 (incorrect -> 0xf3b6), seq 61860:64772, ack 928, win 512, options [nop,nop,TS val 261185101 ecr 261185088], length 2912
2022-04-05 17:15:02.598751 IP (tos 0x0, ttl 64, id 15277, offset 0, flags [DF], proto TCP (6), length 52)
    127.0.0.1.44524 > 127.0.0.1.9150: Flags [.], cksum 0xfe28 (incorrect -> 0x0be8), seq 928, ack 64772, win 496, options [nop,nop,TS val 261185101 ecr 261185101], length 0
2022-04-05 17:15:02.599790 IP (tos 0x0, ttl 64, id 40128, offset 0, flags [DF], proto TCP (6), length 3462)
    127.0.0.1.9150 > 127.0.0.1.44524: Flags [P.], cksum 0x0b7b (incorrect -> 0xc92b), seq 64772:68182, ack 928, win 512, options [nop,nop,TS val 261185102 ecr 261185101], length 3410
2022-04-05 17:15:02.599795 IP (tos 0x0, ttl 64, id 15278, offset 0, flags [DF], proto TCP (6), length 52)
    127.0.0.1.44524 > 127.0.0.1.9150: Flags [.], cksum 0xfe28 (incorrect -> 0xfe95), seq 928, ack 68182, win 494, options [nop,nop,TS val 261185102 ecr 261185102], length 0
2022-04-05 17:15:02.663173 IP (tos 0x0, ttl 64, id 40129, offset 0, flags [DF], proto TCP (6), length 2466)
    127.0.0.1.9150 > 127.0.0.1.44524: Flags [P.], cksum 0x0797 (incorrect -> 0x6dd2), seq 68182:70596, ack 928, win 512, options [nop,nop,TS val 261185166 ecr 261185102], length 2414
2022-04-05 17:15:02.663178 IP (tos 0x0, ttl 64, id 15279, offset 0, flags [DF], proto TCP (6), length 52)
    127.0.0.1.44524 > 127.0.0.1.9150: Flags [.], cksum 0xfe28 (incorrect -> 0xf4a3), seq 928, ack 70596, win 498, options [nop,nop,TS val 261185166 ecr 261185166], length 0
2022-04-05 17:15:02.715191 IP (tos 0x0, ttl 64, id 40130, offset 0, flags [DF], proto TCP (6), length 1709)
    127.0.0.1.9150 > 127.0.0.1.44524: Flags [P.], cksum 0x04a2 (incorrect -> 0xaabc), seq 70596:72253, ack 928, win 512, options [nop,nop,TS val 261185218 ecr 261185166], length 1657
2022-04-05 17:15:02.715199 IP (tos 0x0, ttl 64, id 15280, offset 0, flags [DF], proto TCP (6), length 52)
    127.0.0.1.44524 > 127.0.0.1.9150: Flags [.], cksum 0xfe28 (incorrect -> 0xedbf), seq 928, ack 72253, win 501, options [nop,nop,TS val 261185218 ecr 261185218], length 0
2022-04-05 17:15:02.731259 IP (tos 0x0, ttl 64, id 40131, offset 0, flags [DF], proto TCP (6), length 2964)
    127.0.0.1.9150 > 127.0.0.1.44524: Flags [P.], cksum 0x0989 (incorrect -> 0xf366), seq 72253:75165, ack 928, win 512, options [nop,nop,TS val 261185234 ecr 261185218], length 2912
2022-04-05 17:15:02.731264 IP (tos 0x0, ttl 64, id 15281, offset 0, flags [DF], proto TCP (6), length 52)
    127.0.0.1.44524 > 127.0.0.1.9150: Flags [.], cksum 0xfe28 (incorrect -> 0xe244), seq 928, ack 75165, win 496, options [nop,nop,TS val 261185234 ecr 261185234], length 0
2022-04-05 17:15:02.737964 IP (tos 0x0, ttl 64, id 40132, offset 0, flags [DF], proto TCP (6), length 4100)
    127.0.0.1.9150 > 127.0.0.1.44524: Flags [P.], cksum 0x0df9 (incorrect -> 0x2403), seq 75165:79213, ack 928, win 512, options [nop,nop,TS val 261185240 ecr 261185234], length 4048
2022-04-05 17:15:02.737969 IP (tos 0x0, ttl 64, id 15282, offset 0, flags [DF], proto TCP (6), length 52)
    127.0.0.1.44524 > 127.0.0.1.9150: Flags [.], cksum 0xfe28 (incorrect -> 0xd26c), seq 928, ack 79213, win 492, options [nop,nop,TS val 261185240 ecr 261185240], length 0
2022-04-05 17:15:02.737975 IP (tos 0x0, ttl 64, id 40133, offset 0, flags [DF], proto TCP (6), length 908)
    127.0.0.1.9150 > 127.0.0.1.44524: Flags [P.], cksum 0x0181 (incorrect -> 0xe538), seq 79213:80069, ack 928, win 512, options [nop,nop,TS val 261185240 ecr 261185240], length 856
2022-04-05 17:15:02.737990 IP (tos 0x0, ttl 64, id 15283, offset 0, flags [DF], proto TCP (6), length 52)
    127.0.0.1.44524 > 127.0.0.1.9150: Flags [.], cksum 0xfe28 (incorrect -> 0xcf00), seq 928, ack 80069, win 512, options [nop,nop,TS val 261185240 ecr 261185240], length 0
2022-04-05 17:15:02.743165 IP (tos 0x0, ttl 64, id 40134, offset 0, flags [DF], proto TCP (6), length 2466)
    127.0.0.1.9150 > 127.0.0.1.44524: Flags [P.], cksum 0x0797 (incorrect -> 0x27b1), seq 80069:82483, ack 928, win 512, options [nop,nop,TS val 261185246 ecr 261185240], length 2414
2022-04-05 17:15:02.743178 IP (tos 0x0, ttl 64, id 15284, offset 0, flags [DF], proto TCP (6), length 52)
    127.0.0.1.44524 > 127.0.0.1.9150: Flags [.], cksum 0xfe28 (incorrect -> 0xc586), seq 928, ack 82483, win 512, options [nop,nop,TS val 261185246 ecr 261185246], length 0
2022-04-05 17:15:02.751818 IP (tos 0x0, ttl 64, id 40135, offset 0, flags [DF], proto TCP (6), length 1470)
    127.0.0.1.9150 > 127.0.0.1.44524: Flags [P.], cksum 0x03b3 (incorrect -> 0xc613), seq 82483:83901, ack 928, win 512, options [nop,nop,TS val 261185254 ecr 261185246], length 1418
2022-04-05 17:15:02.751831 IP (tos 0x0, ttl 64, id 15285, offset 0, flags [DF], proto TCP (6), length 52)
    127.0.0.1.44524 > 127.0.0.1.9150: Flags [.], cksum 0xfe28 (incorrect -> 0xbfec), seq 928, ack 83901, win 512, options [nop,nop,TS val 261185254 ecr 261185254], length 0
2022-04-05 17:15:02.751983 IP (tos 0x0, ttl 64, id 40136, offset 0, flags [DF], proto TCP (6), length 3462)
    127.0.0.1.9150 > 127.0.0.1.44524: Flags [P.], cksum 0x0b7b (incorrect -> 0xee5d), seq 83901:87311, ack 928, win 512, options [nop,nop,TS val 261185254 ecr 261185254], length 3410
2022-04-05 17:15:02.751995 IP (tos 0x0, ttl 64, id 15286, offset 0, flags [DF], proto TCP (6), length 52)
    127.0.0.1.44524 > 127.0.0.1.9150: Flags [.], cksum 0xfe28 (incorrect -> 0xb29a), seq 928, ack 87311, win 512, options [nop,nop,TS val 261185254 ecr 261185254], length 0
2022-04-05 17:15:02.778305 IP (tos 0x0, ttl 64, id 40137, offset 0, flags [DF], proto TCP (6), length 1523)
    127.0.0.1.9150 > 127.0.0.1.44524: Flags [P.], cksum 0x03e8 (incorrect -> 0x7b5c), seq 87311:88782, ack 928, win 512, options [nop,nop,TS val 261185281 ecr 261185254], length 1471
2022-04-05 17:15:02.778613 IP (tos 0x0, ttl 64, id 15287, offset 0, flags [DF], proto TCP (6), length 52)
    127.0.0.1.44524 > 127.0.0.1.9150: Flags [.], cksum 0xfe28 (incorrect -> 0xaca5), seq 928, ack 88782, win 512, options [nop,nop,TS val 261185281 ecr 261185281], length 0
2022-04-05 17:15:02.865055 IP (tos 0x0, ttl 64, id 40138, offset 0, flags [DF], proto TCP (6), length 3462)
    127.0.0.1.9150 > 127.0.0.1.44524: Flags [P.], cksum 0x0b7b (incorrect -> 0xe8c7), seq 88782:92192, ack 928, win 512, options [nop,nop,TS val 261185367 ecr 261185281], length 3410
2022-04-05 17:15:02.865090 IP (tos 0x0, ttl 64, id 15288, offset 0, flags [DF], proto TCP (6), length 52)
    127.0.0.1.44524 > 127.0.0.1.9150: Flags [.], cksum 0xfe28 (incorrect -> 0x9ea6), seq 928, ack 92192, win 512, options [nop,nop,TS val 261185368 ecr 261185367], length 0
2022-04-05 17:15:02.878770 IP (tos 0x0, ttl 64, id 40139, offset 0, flags [DF], proto TCP (6), length 3002)
    127.0.0.1.9150 > 127.0.0.1.44524: Flags [P.], cksum 0x09af (incorrect -> 0x11e0), seq 92192:95142, ack 928, win 512, options [nop,nop,TS val 261185381 ecr 261185368], length 2950
2022-04-05 17:15:02.878787 IP (tos 0x0, ttl 64, id 15289, offset 0, flags [DF], proto TCP (6), length 52)
    127.0.0.1.44524 > 127.0.0.1.9150: Flags [.], cksum 0xfe28 (incorrect -> 0x9305), seq 928, ack 95142, win 512, options [nop,nop,TS val 261185381 ecr 261185381], length 0
2022-04-05 17:15:02.901641 IP (tos 0x0, ttl 64, id 40140, offset 0, flags [DF], proto TCP (6), length 3538)
    127.0.0.1.9150 > 127.0.0.1.44524: Flags [P.], cksum 0x0bc7 (incorrect -> 0xcbf8), seq 95142:98628, ack 928, win 512, options [nop,nop,TS val 261185404 ecr 261185381], length 3486
2022-04-05 17:15:02.901655 IP (tos 0x0, ttl 64, id 15290, offset 0, flags [DF], proto TCP (6), length 52)
    127.0.0.1.44524 > 127.0.0.1.9150: Flags [.], cksum 0xfe28 (incorrect -> 0x8539), seq 928, ack 98628, win 512, options [nop,nop,TS val 261185404 ecr 261185404], length 0
2022-04-05 17:15:02.902838 IP (tos 0x0, ttl 64, id 40141, offset 0, flags [DF], proto TCP (6), length 4036)
    127.0.0.1.9150 > 127.0.0.1.44524: Flags [P.], cksum 0x0db9 (incorrect -> 0x8b80), seq 98628:102612, ack 928, win 512, options [nop,nop,TS val 261185405 ecr 261185404], length 3984
2022-04-05 17:15:02.902857 IP (tos 0x0, ttl 64, id 15291, offset 0, flags [DF], proto TCP (6), length 52)
    127.0.0.1.44524 > 127.0.0.1.9150: Flags [.], cksum 0xfe28 (incorrect -> 0x75a7), seq 928, ack 102612, win 512, options [nop,nop,TS val 261185405 ecr 261185405], length 0
2022-04-05 17:15:02.909938 IP (tos 0x0, ttl 64, id 40142, offset 0, flags [DF], proto TCP (6), length 4036)
    127.0.0.1.9150 > 127.0.0.1.44524: Flags [P.], cksum 0x0db9 (incorrect -> 0x4dd9), seq 102612:106596, ack 928, win 512, options [nop,nop,TS val 261185412 ecr 261185405], length 3984
2022-04-05 17:15:02.950658 IP (tos 0x0, ttl 64, id 15292, offset 0, flags [DF], proto TCP (6), length 52)
    127.0.0.1.44524 > 127.0.0.1.9150: Flags [.], cksum 0xfe28 (incorrect -> 0x65e0), seq 928, ack 106596, win 512, options [nop,nop,TS val 261185453 ecr 261185412], length 0
2022-04-05 17:15:02.950671 IP (tos 0x0, ttl 64, id 40143, offset 0, flags [DF], proto TCP (6), length 21964)
    127.0.0.1.9150 > 127.0.0.1.44524: Flags [P.], cksum 0x53c1 (incorrect -> 0x6c54), seq 106596:128508, ack 928, win 512, options [nop,nop,TS val 261185453 ecr 261185453], length 21912
2022-04-05 17:15:02.994654 IP (tos 0x0, ttl 64, id 15293, offset 0, flags [DF], proto TCP (6), length 52)
    127.0.0.1.44524 > 127.0.0.1.9150: Flags [.], cksum 0xfe28 (incorrect -> 0x0ff3), seq 928, ack 128508, win 512, options [nop,nop,TS val 261185497 ecr 261185453], length 0
2022-04-05 17:15:02.994661 IP (tos 0x0, ttl 64, id 40144, offset 0, flags [DF], proto TCP (6), length 4036)
    127.0.0.1.9150 > 127.0.0.1.44524: Flags [P.], cksum 0x0db9 (incorrect -> 0x6d14), seq 128508:132492, ack 928, win 512, options [nop,nop,TS val 261185497 ecr 261185497], length 3984
2022-04-05 17:15:02.994672 IP (tos 0x0, ttl 64, id 15294, offset 0, flags [DF], proto TCP (6), length 52)
    127.0.0.1.44524 > 127.0.0.1.9150: Flags [.], cksum 0xfe28 (incorrect -> 0x0037), seq 928, ack 132492, win 512, options [nop,nop,TS val 261185497 ecr 261185497], length 0
2022-04-05 17:15:03.242809 IP (tos 0x0, ttl 64, id 40145, offset 0, flags [DF], proto TCP (6), length 3538)
    127.0.0.1.9150 > 127.0.0.1.44524: Flags [P.], cksum 0x0bc7 (incorrect -> 0xa861), seq 132492:135978, ack 928, win 512, options [nop,nop,TS val 261185745 ecr 261185497], length 3486
2022-04-05 17:15:03.242816 IP (tos 0x0, ttl 64, id 15295, offset 0, flags [DF], proto TCP (6), length 52)
    127.0.0.1.44524 > 127.0.0.1.9150: Flags [.], cksum 0xfe28 (incorrect -> 0xf0ba), seq 928, ack 135978, win 494, options [nop,nop,TS val 261185745 ecr 261185745], length 0
2022-04-05 17:15:03.247699 IP (tos 0x0, ttl 64, id 40146, offset 0, flags [DF], proto TCP (6), length 3538)
    127.0.0.1.9150 > 127.0.0.1.44524: Flags [P.], cksum 0x0bc7 (incorrect -> 0xd15e), seq 135978:139464, ack 928, win 512, options [nop,nop,TS val 261185750 ecr 261185745], length 3486
2022-04-05 17:15:03.268272 IP (tos 0x0, ttl 64, id 40147, offset 0, flags [DF], proto TCP (6), length 32820)
    127.0.0.1.9150 > 127.0.0.1.44524: Flags [.], cksum 0x7e29 (incorrect -> 0xb34a), seq 139464:172232, ack 928, win 512, options [nop,nop,TS val 261185771 ecr 261185745], length 32768
2022-04-05 17:15:03.268302 IP (tos 0x0, ttl 64, id 15296, offset 0, flags [DF], proto TCP (6), length 52)
    127.0.0.1.44524 > 127.0.0.1.9150: Flags [.], cksum 0xfe28 (incorrect -> 0x6370), seq 928, ack 172232, win 379, options [nop,nop,TS val 261185771 ecr 261185750], length 0
2022-04-05 17:15:03.268310 IP (tos 0x0, ttl 64, id 40148, offset 0, flags [DF], proto TCP (6), length 1148)
    127.0.0.1.9150 > 127.0.0.1.44524: Flags [P.], cksum 0x0271 (incorrect -> 0x4063), seq 172232:173328, ack 928, win 512, options [nop,nop,TS val 261185771 ecr 261185771], length 1096
2022-04-05 17:15:03.268764 IP (tos 0x0, ttl 64, id 15297, offset 0, flags [DF], proto TCP (6), length 52)
    127.0.0.1.44524 > 127.0.0.1.9150: Flags [.], cksum 0xfe28 (incorrect -> 0x5e8e), seq 928, ack 173328, win 512, options [nop,nop,TS val 261185771 ecr 261185771], length 0
2022-04-05 17:15:03.270622 IP (tos 0x0, ttl 64, id 40149, offset 0, flags [DF], proto TCP (6), length 4036)
    127.0.0.1.9150 > 127.0.0.1.44524: Flags [P.], cksum 0x0db9 (incorrect -> 0xc338), seq 173328:177312, ack 928, win 512, options [nop,nop,TS val 261185773 ecr 261185771], length 3984
2022-04-05 17:15:03.270637 IP (tos 0x0, ttl 64, id 15298, offset 0, flags [DF], proto TCP (6), length 52)
    127.0.0.1.44524 > 127.0.0.1.9150: Flags [.], cksum 0xfe28 (incorrect -> 0x4efa), seq 928, ack 177312, win 512, options [nop,nop,TS val 261185773 ecr 261185773], length 0
2022-04-05 17:15:03.270803 IP (tos 0x0, ttl 64, id 40150, offset 0, flags [DF], proto TCP (6), length 4100)
    127.0.0.1.9150 > 127.0.0.1.44524: Flags [P.], cksum 0x0df9 (incorrect -> 0x5bdc), seq 177312:181360, ack 928, win 512, options [nop,nop,TS val 261185773 ecr 261185773], length 4048
2022-04-05 17:15:03.270823 IP (tos 0x0, ttl 64, id 15299, offset 0, flags [DF], proto TCP (6), length 52)
    127.0.0.1.44524 > 127.0.0.1.9150: Flags [.], cksum 0xfe28 (incorrect -> 0x3f2a), seq 928, ack 181360, win 512, options [nop,nop,TS val 261185773 ecr 261185773], length 0
2022-04-05 17:15:03.270828 IP (tos 0x0, ttl 64, id 40151, offset 0, flags [DF], proto TCP (6), length 3474)
    127.0.0.1.9150 > 127.0.0.1.44524: Flags [P.], cksum 0x0b87 (incorrect -> 0x4183), seq 181360:184782, ack 928, win 512, options [nop,nop,TS val 261185773 ecr 261185773], length 3422
2022-04-05 17:15:03.270832 IP (tos 0x0, ttl 64, id 15300, offset 0, flags [DF], proto TCP (6), length 52)
    127.0.0.1.44524 > 127.0.0.1.9150: Flags [.], cksum 0xfe28 (incorrect -> 0x31cc), seq 928, ack 184782, win 512, options [nop,nop,TS val 261185773 ecr 261185773], length 0
2022-04-05 17:15:03.271094 IP (tos 0x0, ttl 64, id 40152, offset 0, flags [DF], proto TCP (6), length 4100)
    127.0.0.1.9150 > 127.0.0.1.44524: Flags [P.], cksum 0x0df9 (incorrect -> 0x5103), seq 184782:188830, ack 928, win 512, options [nop,nop,TS val 261185774 ecr 261185773], length 4048
2022-04-05 17:15:03.271288 IP (tos 0x0, ttl 64, id 15301, offset 0, flags [DF], proto TCP (6), length 52)
    127.0.0.1.44524 > 127.0.0.1.9150: Flags [.], cksum 0xfe28 (incorrect -> 0x21fa), seq 928, ack 188830, win 512, options [nop,nop,TS val 261185774 ecr 261185774], length 0
2022-04-05 17:15:03.271294 IP (tos 0x0, ttl 64, id 40153, offset 0, flags [DF], proto TCP (6), length 4470)
    127.0.0.1.9150 > 127.0.0.1.44524: Flags [P.], cksum 0x0f6b (incorrect -> 0xc788), seq 188830:193248, ack 928, win 512, options [nop,nop,TS val 261185774 ecr 261185774], length 4418
2022-04-05 17:15:03.271298 IP (tos 0x0, ttl 64, id 15302, offset 0, flags [DF], proto TCP (6), length 52)
    127.0.0.1.44524 > 127.0.0.1.9150: Flags [.], cksum 0xfe28 (incorrect -> 0x10b8), seq 928, ack 193248, win 512, options [nop,nop,TS val 261185774 ecr 261185774], length 0
2022-04-05 17:15:03.275472 IP (tos 0x0, ttl 64, id 40154, offset 0, flags [DF], proto TCP (6), length 4100)
    127.0.0.1.9150 > 127.0.0.1.44524: Flags [P.], cksum 0x0df9 (incorrect -> 0xf2bd), seq 193248:197296, ack 928, win 512, options [nop,nop,TS val 261185778 ecr 261185774], length 4048
2022-04-05 17:15:03.275595 IP (tos 0x0, ttl 64, id 15303, offset 0, flags [DF], proto TCP (6), length 52)
    127.0.0.1.44524 > 127.0.0.1.9150: Flags [.], cksum 0xfe28 (incorrect -> 0x00e0), seq 928, ack 197296, win 512, options [nop,nop,TS val 261185778 ecr 261185778], length 0
2022-04-05 17:15:03.275607 IP (tos 0x0, ttl 64, id 40155, offset 0, flags [DF], proto TCP (6), length 11867)
    127.0.0.1.9150 > 127.0.0.1.44524: Flags [P.], cksum 0x2c50 (incorrect -> 0xcb68), seq 197296:209111, ack 928, win 512, options [nop,nop,TS val 261185778 ecr 261185778], length 11815
2022-04-05 17:15:03.276050 IP (tos 0x0, ttl 64, id 15304, offset 0, flags [DF], proto TCP (6), length 52)
    127.0.0.1.44524 > 127.0.0.1.9150: Flags [.], cksum 0xfe28 (incorrect -> 0xd2b8), seq 928, ack 209111, win 512, options [nop,nop,TS val 261185778 ecr 261185778], length 0
2022-04-05 17:15:03.276124 IP (tos 0x0, ttl 64, id 40156, offset 0, flags [DF], proto TCP (6), length 3538)
    127.0.0.1.9150 > 127.0.0.1.44524: Flags [P.], cksum 0x0bc7 (incorrect -> 0x36e3), seq 209111:212597, ack 928, win 512, options [nop,nop,TS val 261185779 ecr 261185778], length 3486
2022-04-05 17:15:03.276148 IP (tos 0x0, ttl 64, id 15305, offset 0, flags [DF], proto TCP (6), length 52)
    127.0.0.1.44524 > 127.0.0.1.9150: Flags [.], cksum 0xfe28 (incorrect -> 0xc518), seq 928, ack 212597, win 512, options [nop,nop,TS val 261185779 ecr 261185779], length 0
2022-04-05 17:15:03.280588 IP (tos 0x0, ttl 64, id 40157, offset 0, flags [DF], proto TCP (6), length 1546)
    127.0.0.1.9150 > 127.0.0.1.44524: Flags [P.], cksum 0x03ff (incorrect -> 0xbe88), seq 212597:214091, ack 928, win 512, options [nop,nop,TS val 261185783 ecr 261185779], length 1494
2022-04-05 17:15:03.280601 IP (tos 0x0, ttl 64, id 15306, offset 0, flags [DF], proto TCP (6), length 52)
    127.0.0.1.44524 > 127.0.0.1.9150: Flags [.], cksum 0xfe28 (incorrect -> 0xbf3a), seq 928, ack 214091, win 512, options [nop,nop,TS val 261185783 ecr 261185783], length 0
2022-04-05 17:15:03.281850 IP (tos 0x0, ttl 64, id 40158, offset 0, flags [DF], proto TCP (6), length 4100)
    127.0.0.1.9150 > 127.0.0.1.44524: Flags [P.], cksum 0x0df9 (incorrect -> 0x2863), seq 214091:218139, ack 928, win 512, options [nop,nop,TS val 261185784 ecr 261185783], length 4048
2022-04-05 17:15:03.281897 IP (tos 0x0, ttl 64, id 15307, offset 0, flags [DF], proto TCP (6), length 52)
    127.0.0.1.44524 > 127.0.0.1.9150: Flags [.], cksum 0xfe28 (incorrect -> 0xaf68), seq 928, ack 218139, win 512, options [nop,nop,TS val 261185784 ecr 261185784], length 0
2022-04-05 17:15:03.281902 IP (tos 0x0, ttl 64, id 40159, offset 0, flags [DF], proto TCP (6), length 3018)
    127.0.0.1.9150 > 127.0.0.1.44524: Flags [P.], cksum 0x09bf (incorrect -> 0x65d3), seq 218139:221105, ack 928, win 512, options [nop,nop,TS val 261185784 ecr 261185784], length 2966
2022-04-05 17:15:03.282067 IP (tos 0x0, ttl 64, id 15308, offset 0, flags [DF], proto TCP (6), length 52)
    127.0.0.1.44524 > 127.0.0.1.9150: Flags [.], cksum 0xfe28 (incorrect -> 0xa3d1), seq 928, ack 221105, win 512, options [nop,nop,TS val 261185785 ecr 261185784], length 0
2022-04-05 17:15:03.282247 IP (tos 0x0, ttl 64, id 40160, offset 0, flags [DF], proto TCP (6), length 4100)
    127.0.0.1.9150 > 127.0.0.1.44524: Flags [P.], cksum 0x0df9 (incorrect -> 0xa5eb), seq 221105:225153, ack 928, win 512, options [nop,nop,TS val 261185785 ecr 261185785], length 4048
2022-04-05 17:15:03.282287 IP (tos 0x0, ttl 64, id 15309, offset 0, flags [DF], proto TCP (6), length 52)
    127.0.0.1.44524 > 127.0.0.1.9150: Flags [.], cksum 0xfe28 (incorrect -> 0x9400), seq 928, ack 225153, win 512, options [nop,nop,TS val 261185785 ecr 261185785], length 0
2022-04-05 17:15:03.282294 IP (tos 0x0, ttl 64, id 40161, offset 0, flags [DF], proto TCP (6), length 4470)
    127.0.0.1.9150 > 127.0.0.1.44524: Flags [P.], cksum 0x0f6b (incorrect -> 0xf918), seq 225153:229571, ack 928, win 512, options [nop,nop,TS val 261185785 ecr 261185785], length 4418
2022-04-05 17:15:03.282298 IP (tos 0x0, ttl 64, id 15310, offset 0, flags [DF], proto TCP (6), length 52)
    127.0.0.1.44524 > 127.0.0.1.9150: Flags [.], cksum 0xfe28 (incorrect -> 0x82be), seq 928, ack 229571, win 512, options [nop,nop,TS val 261185785 ecr 261185785], length 0
2022-04-05 17:15:03.285912 IP (tos 0x0, ttl 64, id 40162, offset 0, flags [DF], proto TCP (6), length 1048)
    127.0.0.1.9150 > 127.0.0.1.44524: Flags [P.], cksum 0x020d (incorrect -> 0x9406), seq 229571:230567, ack 928, win 512, options [nop,nop,TS val 261185788 ecr 261185785], length 996
2022-04-05 17:15:03.285935 IP (tos 0x0, ttl 64, id 15311, offset 0, flags [DF], proto TCP (6), length 52)
    127.0.0.1.44524 > 127.0.0.1.9150: Flags [.], cksum 0xfe28 (incorrect -> 0x7ed4), seq 928, ack 230567, win 512, options [nop,nop,TS val 261185788 ecr 261185788], length 0
2022-04-05 17:15:03.327024 IP (tos 0x0, ttl 64, id 40163, offset 0, flags [DF], proto TCP (6), length 3538)
    127.0.0.1.9150 > 127.0.0.1.44524: Flags [P.], cksum 0x0bc7 (incorrect -> 0xa3e5), seq 230567:234053, ack 928, win 512, options [nop,nop,TS val 261185829 ecr 261185788], length 3486
2022-04-05 17:15:03.327041 IP (tos 0x0, ttl 64, id 15312, offset 0, flags [DF], proto TCP (6), length 52)
    127.0.0.1.44524 > 127.0.0.1.9150: Flags [.], cksum 0xfe28 (incorrect -> 0x70e4), seq 928, ack 234053, win 512, options [nop,nop,TS val 261185829 ecr 261185829], length 0
2022-04-05 17:15:03.340914 IP (tos 0x0, ttl 64, id 40164, offset 0, flags [DF], proto TCP (6), length 4100)
    127.0.0.1.9150 > 127.0.0.1.44524: Flags [P.], cksum 0x0df9 (incorrect -> 0x9e4a), seq 234053:238101, ack 928, win 512, options [nop,nop,TS val 261185843 ecr 261185829], length 4048
2022-04-05 17:15:03.340919 IP (tos 0x0, ttl 64, id 15313, offset 0, flags [DF], proto TCP (6), length 52)
    127.0.0.1.44524 > 127.0.0.1.9150: Flags [.], cksum 0xfe28 (incorrect -> 0x5cf9), seq 928, ack 238101, win 1535, options [nop,nop,TS val 261185843 ecr 261185843], length 0
2022-04-05 17:15:03.340926 IP (tos 0x0, ttl 64, id 40165, offset 0, flags [DF], proto TCP (6), length 486)
    127.0.0.1.9150 > 127.0.0.1.44524: Flags [P.], cksum 0xffda (incorrect -> 0x3aa9), seq 238101:238535, ack 928, win 512, options [nop,nop,TS val 261185843 ecr 261185843], length 434
2022-04-05 17:15:03.340928 IP (tos 0x0, ttl 64, id 15314, offset 0, flags [DF], proto TCP (6), length 52)
    127.0.0.1.44524 > 127.0.0.1.9150: Flags [.], cksum 0xfe28 (incorrect -> 0x5947), seq 928, ack 238535, win 2047, options [nop,nop,TS val 261185843 ecr 261185843], length 0
2022-04-05 17:15:03.356263 IP (tos 0x0, ttl 64, id 40166, offset 0, flags [DF], proto TCP (6), length 3538)
    127.0.0.1.9150 > 127.0.0.1.44524: Flags [P.], cksum 0x0bc7 (incorrect -> 0x4dca), seq 238535:242021, ack 928, win 512, options [nop,nop,TS val 261185859 ecr 261185843], length 3486
2022-04-05 17:15:03.356268 IP (tos 0x0, ttl 64, id 15315, offset 0, flags [DF], proto TCP (6), length 52)
    127.0.0.1.44524 > 127.0.0.1.9150: Flags [.], cksum 0xfe28 (incorrect -> 0x4789), seq 928, ack 242021, win 3071, options [nop,nop,TS val 261185859 ecr 261185859], length 0
2022-04-05 17:15:03.358153 IP (tos 0x0, ttl 64, id 40167, offset 0, flags [DF], proto TCP (6), length 3538)
    127.0.0.1.9150 > 127.0.0.1.44524: Flags [P.], cksum 0x0bc7 (incorrect -> 0x34c0), seq 242021:245507, ack 928, win 512, options [nop,nop,TS val 261185861 ecr 261185859], length 3486
2022-04-05 17:15:03.358159 IP (tos 0x0, ttl 64, id 15316, offset 0, flags [DF], proto TCP (6), length 52)
    127.0.0.1.44524 > 127.0.0.1.9150: Flags [.], cksum 0xfe28 (incorrect -> 0x35e8), seq 928, ack 245507, win 4094, options [nop,nop,TS val 261185861 ecr 261185861], length 0
2022-04-05 17:15:03.370418 IP (tos 0x0, ttl 64, id 40168, offset 0, flags [DF], proto TCP (6), length 2044)
    127.0.0.1.9150 > 127.0.0.1.44524: Flags [P.], cksum 0x05f1 (incorrect -> 0x5561), seq 245507:247499, ack 928, win 512, options [nop,nop,TS val 261185873 ecr 261185861], length 1992
2022-04-05 17:15:03.370422 IP (tos 0x0, ttl 64, id 15317, offset 0, flags [DF], proto TCP (6), length 52)
    127.0.0.1.44524 > 127.0.0.1.9150: Flags [.], cksum 0xfe28 (incorrect -> 0x2a09), seq 928, ack 247499, win 5117, options [nop,nop,TS val 261185873 ecr 261185873], length 0
2022-04-05 17:15:03.387033 IP (tos 0x0, ttl 64, id 40169, offset 0, flags [DF], proto TCP (6), length 3538)
    127.0.0.1.9150 > 127.0.0.1.44524: Flags [P.], cksum 0x0bc7 (incorrect -> 0xe048), seq 247499:250985, ack 928, win 512, options [nop,nop,TS val 261185889 ecr 261185873], length 3486
2022-04-05 17:15:03.387042 IP (tos 0x0, ttl 64, id 15318, offset 0, flags [DF], proto TCP (6), length 52)
    127.0.0.1.44524 > 127.0.0.1.9150: Flags [.], cksum 0xfe28 (incorrect -> 0x184c), seq 928, ack 250985, win 6140, options [nop,nop,TS val 261185889 ecr 261185889], length 0
2022-04-05 17:15:03.389040 IP (tos 0x0, ttl 64, id 40170, offset 0, flags [DF], proto TCP (6), length 2044)
    127.0.0.1.9150 > 127.0.0.1.44524: Flags [P.], cksum 0x05f1 (incorrect -> 0xff80), seq 250985:252977, ack 928, win 512, options [nop,nop,TS val 261185891 ecr 261185889], length 1992
2022-04-05 17:15:03.389045 IP (tos 0x0, ttl 64, id 15319, offset 0, flags [DF], proto TCP (6), length 52)
    127.0.0.1.44524 > 127.0.0.1.9150: Flags [.], cksum 0xfe28 (incorrect -> 0x0c81), seq 928, ack 252977, win 7163, options [nop,nop,TS val 261185891 ecr 261185891], length 0
200, 4.902650356292725, 4.932244539260864