2022-04-05 04:45:43.041906 IP (tos 0x0, ttl 64, id 31786, offset 0, flags [DF], proto TCP (6), length 60)
    127.0.0.1.49060 > 127.0.0.1.10150: Flags [S], cksum 0xfe30 (incorrect -> 0x673f), seq 111366018, win 65495, options [mss 65495,sackOK,TS val 771587413 ecr 0,nop,wscale 7], length 0
2022-04-05 04:45:43.041916 IP (tos 0x0, ttl 64, id 0, offset 0, flags [DF], proto TCP (6), length 60)
    127.0.0.1.10150 > 127.0.0.1.49060: Flags [S.], cksum 0xfe30 (incorrect -> 0xca71), seq 4003594963, ack 111366019, win 65483, options [mss 65495,sackOK,TS val 771587413 ecr 771587413,nop,wscale 7], length 0
2022-04-05 04:45:43.041925 IP (tos 0x0, ttl 64, id 31787, offset 0, flags [DF], proto TCP (6), length 52)
    127.0.0.1.49060 > 127.0.0.1.10150: Flags [.], cksum 0xfe28 (incorrect -> 0xf12d), seq 1, ack 1, win 512, options [nop,nop,TS val 771587413 ecr 771587413], length 0
2022-04-05 04:45:43.042071 IP (tos 0x0, ttl 64, id 31788, offset 0, flags [DF], proto TCP (6), length 55)
    127.0.0.1.49060 > 127.0.0.1.10150: Flags [P.], cksum 0xfe2b (incorrect -> 0xec21), seq 1:4, ack 1, win 512, options [nop,nop,TS val 771587413 ecr 771587413], length 3
2022-04-05 04:45:43.042079 IP (tos 0x0, ttl 64, id 36231, offset 0, flags [DF], proto TCP (6), length 52)
    127.0.0.1.10150 > 127.0.0.1.49060: Flags [.], cksum 0xfe28 (incorrect -> 0xf12a), seq 1, ack 4, win 512, options [nop,nop,TS val 771587413 ecr 771587413], length 0
2022-04-05 04:45:43.042101 IP (tos 0x0, ttl 64, id 36232, offset 0, flags [DF], proto TCP (6), length 54)
    127.0.0.1.10150 > 127.0.0.1.49060: Flags [P.], cksum 0xfe2a (incorrect -> 0xec20), seq 1:3, ack 4, win 512, options [nop,nop,TS val 771587413 ecr 771587413], length 2
2022-04-05 04:45:43.042109 IP (tos 0x0, ttl 64, id 31789, offset 0, flags [DF], proto TCP (6), length 52)
    127.0.0.1.49060 > 127.0.0.1.10150: Flags [.], cksum 0xfe28 (incorrect -> 0xf128), seq 4, ack 3, win 512, options [nop,nop,TS val 771587413 ecr 771587413], length 0
2022-04-05 04:45:43.043479 IP (tos 0x0, ttl 64, id 31790, offset 0, flags [DF], proto TCP (6), length 62)
    127.0.0.1.49060 > 127.0.0.1.10150: Flags [P.], cksum 0xfe32 (incorrect -> 0x51e8), seq 4:14, ack 3, win 512, options [nop,nop,TS val 771587415 ecr 771587413], length 10
2022-04-05 04:45:43.043493 IP (tos 0x0, ttl 64, id 36233, offset 0, flags [DF], proto TCP (6), length 52)
    127.0.0.1.10150 > 127.0.0.1.49060: Flags [.], cksum 0xfe28 (incorrect -> 0xf11a), seq 3, ack 14, win 512, options [nop,nop,TS val 771587415 ecr 771587415], length 0
2022-04-05 04:45:43.350889 IP (tos 0x0, ttl 64, id 36234, offset 0, flags [DF], proto TCP (6), length 62)
    127.0.0.1.10150 > 127.0.0.1.49060: Flags [P.], cksum 0xfe32 (incorrect -> 0xead4), seq 3:13, ack 14, win 512, options [nop,nop,TS val 771587722 ecr 771587415], length 10
2022-04-05 04:45:43.350900 IP (tos 0x0, ttl 64, id 31791, offset 0, flags [DF], proto TCP (6), length 52)
    127.0.0.1.49060 > 127.0.0.1.10150: Flags [.], cksum 0xfe28 (incorrect -> 0xeeaa), seq 14, ack 13, win 512, options [nop,nop,TS val 771587722 ecr 771587722], length 0
2022-04-05 04:45:43.356813 IP (tos 0x0, ttl 64, id 31792, offset 0, flags [DF], proto TCP (6), length 569)
    127.0.0.1.49060 > 127.0.0.1.10150: Flags [P.], cksum 0x002e (incorrect -> 0xdf00), seq 14:531, ack 13, win 512, options [nop,nop,TS val 771587728 ecr 771587722], length 517
2022-04-05 04:45:43.356823 IP (tos 0x0, ttl 64, id 36235, offset 0, flags [DF], proto TCP (6), length 52)
    127.0.0.1.10150 > 127.0.0.1.49060: Flags [.], cksum 0xfe28 (incorrect -> 0xec9d), seq 13, ack 531, win 508, options [nop,nop,TS val 771587728 ecr 771587728], length 0
2022-04-05 04:45:46.201714 IP (tos 0x0, ttl 64, id 36236, offset 0, flags [DF], proto TCP (6), length 2972)
    127.0.0.1.10150 > 127.0.0.1.49060: Flags [P.], cksum 0x0991 (incorrect -> 0xe215), seq 13:2933, ack 531, win 512, options [nop,nop,TS val 771590573 ecr 771587728], length 2920
2022-04-05 04:45:46.201725 IP (tos 0x0, ttl 64, id 31793, offset 0, flags [DF], proto TCP (6), length 52)
    127.0.0.1.49060 > 127.0.0.1.10150: Flags [.], cksum 0xfe28 (incorrect -> 0xcb07), seq 531, ack 2933, win 496, options [nop,nop,TS val 771590573 ecr 771590573], length 0
2022-04-05 04:45:46.324170 IP (tos 0x0, ttl 64, id 36237, offset 0, flags [DF], proto TCP (6), length 2257)
    127.0.0.1.10150 > 127.0.0.1.49060: Flags [P.], cksum 0x06c6 (incorrect -> 0x9601), seq 2933:5138, ack 531, win 512, options [nop,nop,TS val 771590695 ecr 771590573], length 2205
2022-04-05 04:45:46.324178 IP (tos 0x0, ttl 64, id 31794, offset 0, flags [DF], proto TCP (6), length 52)
    127.0.0.1.49060 > 127.0.0.1.10150: Flags [.], cksum 0xfe28 (incorrect -> 0xc173), seq 531, ack 5138, win 499, options [nop,nop,TS val 771590695 ecr 771590695], length 0
2022-04-05 04:45:46.324753 IP (tos 0x0, ttl 64, id 31795, offset 0, flags [DF], proto TCP (6), length 132)
    127.0.0.1.49060 > 127.0.0.1.10150: Flags [P.], cksum 0xfe78 (incorrect -> 0xca81), seq 531:611, ack 5138, win 512, options [nop,nop,TS val 771590696 ecr 771590695], length 80
2022-04-05 04:45:46.324761 IP (tos 0x0, ttl 64, id 36238, offset 0, flags [DF], proto TCP (6), length 52)
    127.0.0.1.10150 > 127.0.0.1.49060: Flags [.], cksum 0xfe28 (incorrect -> 0xc114), seq 5138, ack 611, win 512, options [nop,nop,TS val 771590696 ecr 771590696], length 0
2022-04-05 04:45:46.325221 IP (tos 0x0, ttl 64, id 31796, offset 0, flags [DF], proto TCP (6), length 355)
    127.0.0.1.49060 > 127.0.0.1.10150: Flags [P.], cksum 0xff57 (incorrect -> 0x3326), seq 611:914, ack 5138, win 512, options [nop,nop,TS val 771590696 ecr 771590696], length 303
2022-04-05 04:45:46.325226 IP (tos 0x0, ttl 64, id 36239, offset 0, flags [DF], proto TCP (6), length 52)
    127.0.0.1.10150 > 127.0.0.1.49060: Flags [.], cksum 0xfe28 (incorrect -> 0xbfe7), seq 5138, ack 914, win 510, options [nop,nop,TS val 771590696 ecr 771590696], length 0
2022-04-05 04:45:46.628712 IP (tos 0x0, ttl 64, id 36240, offset 0, flags [DF], proto TCP (6), length 594)
    127.0.0.1.10150 > 127.0.0.1.49060: Flags [P.], cksum 0x0047 (incorrect -> 0x2d82), seq 5138:5680, ack 914, win 512, options [nop,nop,TS val 771591000 ecr 771590696], length 542
2022-04-05 04:45:46.628721 IP (tos 0x0, ttl 64, id 31797, offset 0, flags [DF], proto TCP (6), length 52)
    127.0.0.1.49060 > 127.0.0.1.10150: Flags [.], cksum 0xfe28 (incorrect -> 0xbb6b), seq 914, ack 5680, win 508, options [nop,nop,TS val 771591000 ecr 771591000], length 0
2022-04-05 04:45:46.723354 IP (tos 0x0, ttl 64, id 36241, offset 0, flags [DF], proto TCP (6), length 1512)
    127.0.0.1.10150 > 127.0.0.1.49060: Flags [P.], cksum 0x03dd (incorrect -> 0x0344), seq 5680:7140, ack 914, win 512, options [nop,nop,TS val 771591094 ecr 771591000], length 1460
2022-04-05 04:45:46.723362 IP (tos 0x0, ttl 64, id 31798, offset 0, flags [DF], proto TCP (6), length 52)
    127.0.0.1.49060 > 127.0.0.1.10150: Flags [.], cksum 0xfe28 (incorrect -> 0xb501), seq 914, ack 7140, win 502, options [nop,nop,TS val 771591094 ecr 771591094], length 0
200, 5.087386608123779, 4.7954487800598145