2022-04-05 06:16:12.624493 IP (tos 0x0, ttl 64, id 14847, offset 0, flags [DF], proto TCP (6), length 60)
    127.0.0.1.53640 > 127.0.0.1.9150: Flags [S], cksum 0xfe30 (incorrect -> 0xfbc0), seq 3783587968, win 65495, options [mss 65495,sackOK,TS val 777016996 ecr 0,nop,wscale 7], length 0
2022-04-05 06:16:12.624512 IP (tos 0x0, ttl 64, id 0, offset 0, flags [DF], proto TCP (6), length 60)
    127.0.0.1.9150 > 127.0.0.1.53640: Flags [S.], cksum 0xfe30 (incorrect -> 0x0ba5), seq 2738735076, ack 3783587969, win 65483, options [mss 65495,sackOK,TS val 777016996 ecr 777016996,nop,wscale 7], length 0
2022-04-05 06:16:12.624525 IP (tos 0x0, ttl 64, id 14848, offset 0, flags [DF], proto TCP (6), length 52)
    127.0.0.1.53640 > 127.0.0.1.9150: Flags [.], cksum 0xfe28 (incorrect -> 0x3261), seq 1, ack 1, win 512, options [nop,nop,TS val 777016996 ecr 777016996], length 0
2022-04-05 06:16:12.624628 IP (tos 0x0, ttl 64, id 14849, offset 0, flags [DF], proto TCP (6), length 55)
    127.0.0.1.53640 > 127.0.0.1.9150: Flags [P.], cksum 0xfe2b (incorrect -> 0x2d55), seq 1:4, ack 1, win 512, options [nop,nop,TS val 777016996 ecr 777016996], length 3
2022-04-05 06:16:12.624641 IP (tos 0x0, ttl 64, id 7538, offset 0, flags [DF], proto TCP (6), length 52)
    127.0.0.1.9150 > 127.0.0.1.53640: Flags [.], cksum 0xfe28 (incorrect -> 0x325e), seq 1, ack 4, win 512, options [nop,nop,TS val 777016996 ecr 777016996], length 0
2022-04-05 06:16:12.624712 IP (tos 0x0, ttl 64, id 7539, offset 0, flags [DF], proto TCP (6), length 54)
    127.0.0.1.9150 > 127.0.0.1.53640: Flags [P.], cksum 0xfe2a (incorrect -> 0x2d54), seq 1:3, ack 4, win 512, options [nop,nop,TS val 777016996 ecr 777016996], length 2
2022-04-05 06:16:12.624740 IP (tos 0x0, ttl 64, id 14850, offset 0, flags [DF], proto TCP (6), length 52)
    127.0.0.1.53640 > 127.0.0.1.9150: Flags [.], cksum 0xfe28 (incorrect -> 0x325c), seq 4, ack 3, win 512, options [nop,nop,TS val 777016996 ecr 777016996], length 0
2022-04-05 06:16:12.661678 IP (tos 0x0, ttl 64, id 14851, offset 0, flags [DF], proto TCP (6), length 62)
    127.0.0.1.53640 > 127.0.0.1.9150: Flags [P.], cksum 0xfe32 (incorrect -> 0x1553), seq 4:14, ack 3, win 512, options [nop,nop,TS val 777017033 ecr 777016996], length 10
2022-04-05 06:16:12.661712 IP (tos 0x0, ttl 64, id 7540, offset 0, flags [DF], proto TCP (6), length 52)
    127.0.0.1.9150 > 127.0.0.1.53640: Flags [.], cksum 0xfe28 (incorrect -> 0x3208), seq 3, ack 14, win 512, options [nop,nop,TS val 777017033 ecr 777017033], length 0
2022-04-05 06:16:12.762630 IP (tos 0x0, ttl 64, id 7541, offset 0, flags [DF], proto TCP (6), length 62)
    127.0.0.1.9150 > 127.0.0.1.53640: Flags [P.], cksum 0xfe32 (incorrect -> 0x2c90), seq 3:13, ack 14, win 512, options [nop,nop,TS val 777017134 ecr 777017033], length 10
2022-04-05 06:16:12.762644 IP (tos 0x0, ttl 64, id 14852, offset 0, flags [DF], proto TCP (6), length 52)
    127.0.0.1.53640 > 127.0.0.1.9150: Flags [.], cksum 0xfe28 (incorrect -> 0x3134), seq 14, ack 13, win 512, options [nop,nop,TS val 777017134 ecr 777017134], length 0
2022-04-05 06:16:12.768614 IP (tos 0x0, ttl 64, id 14853, offset 0, flags [DF], proto TCP (6), length 569)
    127.0.0.1.53640 > 127.0.0.1.9150: Flags [P.], cksum 0x002e (incorrect -> 0x9033), seq 14:531, ack 13, win 512, options [nop,nop,TS val 777017140 ecr 777017134], length 517
2022-04-05 06:16:12.768625 IP (tos 0x0, ttl 64, id 7542, offset 0, flags [DF], proto TCP (6), length 52)
    127.0.0.1.9150 > 127.0.0.1.53640: Flags [.], cksum 0xfe28 (incorrect -> 0x2f27), seq 13, ack 531, win 508, options [nop,nop,TS val 777017140 ecr 777017140], length 0
2022-04-05 06:16:12.863059 IP (tos 0x0, ttl 64, id 7543, offset 0, flags [DF], proto TCP (6), length 2865)
    127.0.0.1.9150 > 127.0.0.1.53640: Flags [P.], cksum 0x0926 (incorrect -> 0x4117), seq 13:2826, ack 531, win 512, options [nop,nop,TS val 777017234 ecr 777017140], length 2813
2022-04-05 06:16:12.863069 IP (tos 0x0, ttl 64, id 14854, offset 0, flags [DF], proto TCP (6), length 52)
    127.0.0.1.53640 > 127.0.0.1.9150: Flags [.], cksum 0xfe28 (incorrect -> 0x2379), seq 531, ack 2826, win 497, options [nop,nop,TS val 777017234 ecr 777017234], length 0
2022-04-05 06:16:12.864376 IP (tos 0x0, ttl 64, id 14855, offset 0, flags [DF], proto TCP (6), length 116)
    127.0.0.1.53640 > 127.0.0.1.9150: Flags [P.], cksum 0xfe68 (incorrect -> 0x17ef), seq 531:595, ack 2826, win 512, options [nop,nop,TS val 777017235 ecr 777017234], length 64
2022-04-05 06:16:12.864386 IP (tos 0x0, ttl 64, id 7544, offset 0, flags [DF], proto TCP (6), length 52)
    127.0.0.1.9150 > 127.0.0.1.53640: Flags [.], cksum 0xfe28 (incorrect -> 0x2328), seq 2826, ack 595, win 512, options [nop,nop,TS val 777017235 ecr 777017235], length 0
2022-04-05 06:16:12.864746 IP (tos 0x0, ttl 64, id 14856, offset 0, flags [DF], proto TCP (6), length 346)
    127.0.0.1.53640 > 127.0.0.1.9150: Flags [P.], cksum 0xff4e (incorrect -> 0xb184), seq 595:889, ack 2826, win 512, options [nop,nop,TS val 777017236 ecr 777017235], length 294
2022-04-05 06:16:12.864756 IP (tos 0x0, ttl 64, id 7545, offset 0, flags [DF], proto TCP (6), length 52)
    127.0.0.1.9150 > 127.0.0.1.53640: Flags [.], cksum 0xfe28 (incorrect -> 0x2202), seq 2826, ack 889, win 510, options [nop,nop,TS val 777017236 ecr 777017236], length 0
2022-04-05 06:16:12.953181 IP (tos 0x0, ttl 64, id 7546, offset 0, flags [DF], proto TCP (6), length 307)
    127.0.0.1.9150 > 127.0.0.1.53640: Flags [P.], cksum 0xff27 (incorrect -> 0x6cb8), seq 2826:3081, ack 889, win 512, options [nop,nop,TS val 777017324 ecr 777017236], length 255
2022-04-05 06:16:12.953197 IP (tos 0x0, ttl 64, id 14857, offset 0, flags [DF], proto TCP (6), length 52)
    127.0.0.1.53640 > 127.0.0.1.9150: Flags [.], cksum 0xfe28 (incorrect -> 0x2052), seq 889, ack 3081, win 511, options [nop,nop,TS val 777017324 ecr 777017324], length 0
2022-04-05 06:16:13.090395 IP (tos 0x0, ttl 64, id 7547, offset 0, flags [DF], proto TCP (6), length 1970)
    127.0.0.1.9150 > 127.0.0.1.53640: Flags [P.], cksum 0x05a7 (incorrect -> 0x1e4d), seq 3081:4999, ack 889, win 512, options [nop,nop,TS val 777017461 ecr 777017324], length 1918
2022-04-05 06:16:13.090406 IP (tos 0x0, ttl 64, id 14858, offset 0, flags [DF], proto TCP (6), length 52)
    127.0.0.1.53640 > 127.0.0.1.9150: Flags [.], cksum 0xfe28 (incorrect -> 0x17cc), seq 889, ack 4999, win 500, options [nop,nop,TS val 777017462 ecr 777017461], length 0
2022-04-05 06:16:13.093252 IP (tos 0x0, ttl 64, id 14859, offset 0, flags [DF], proto TCP (6), length 1049)
    127.0.0.1.53640 > 127.0.0.1.9150: Flags [P.], cksum 0x020e (incorrect -> 0xc764), seq 889:1886, ack 4999, win 512, options [nop,nop,TS val 777017464 ecr 777017461], length 997
2022-04-05 06:16:13.093262 IP (tos 0x0, ttl 64, id 7548, offset 0, flags [DF], proto TCP (6), length 52)
    127.0.0.1.9150 > 127.0.0.1.53640: Flags [.], cksum 0xfe28 (incorrect -> 0x13dd), seq 4999, ack 1886, win 505, options [nop,nop,TS val 777017464 ecr 777017464], length 0
2022-04-05 06:16:13.519509 IP (tos 0x0, ttl 64, id 7549, offset 0, flags [DF], proto TCP (6), length 3538)
    127.0.0.1.9150 > 127.0.0.1.53640: Flags [P.], cksum 0x0bc7 (incorrect -> 0x212d), seq 4999:8485, ack 1886, win 512, options [nop,nop,TS val 777017891 ecr 777017464], length 3486
2022-04-05 06:16:13.561396 IP (tos 0x0, ttl 64, id 14860, offset 0, flags [DF], proto TCP (6), length 52)
    127.0.0.1.53640 > 127.0.0.1.9150: Flags [.], cksum 0xfe28 (incorrect -> 0x02b9), seq 1886, ack 8485, win 512, options [nop,nop,TS val 777017932 ecr 777017891], length 0
2022-04-05 06:16:13.579045 IP (tos 0x0, ttl 64, id 7550, offset 0, flags [DF], proto TCP (6), length 2180)
    127.0.0.1.9150 > 127.0.0.1.53640: Flags [P.], cksum 0x0679 (incorrect -> 0x8eac), seq 8485:10613, ack 1886, win 512, options [nop,nop,TS val 777017950 ecr 777017932], length 2128
2022-04-05 06:16:13.579052 IP (tos 0x0, ttl 64, id 14861, offset 0, flags [DF], proto TCP (6), length 52)
    127.0.0.1.53640 > 127.0.0.1.9150: Flags [.], cksum 0xfe28 (incorrect -> 0xfa28), seq 1886, ack 10613, win 499, options [nop,nop,TS val 777017950 ecr 777017950], length 0
2022-04-05 06:16:13.979785 IP (tos 0x0, ttl 64, id 7551, offset 0, flags [DF], proto TCP (6), length 4100)
    127.0.0.1.9150 > 127.0.0.1.53640: Flags [P.], cksum 0x0df9 (incorrect -> 0xebe1), seq 10613:14661, ack 1886, win 512, options [nop,nop,TS val 777018351 ecr 777017950], length 4048
2022-04-05 06:16:13.979802 IP (tos 0x0, ttl 64, id 14862, offset 0, flags [DF], proto TCP (6), length 52)
    127.0.0.1.53640 > 127.0.0.1.9150: Flags [.], cksum 0xfe28 (incorrect -> 0xe73d), seq 1886, ack 14661, win 492, options [nop,nop,TS val 777018351 ecr 777018351], length 0
2022-04-05 06:16:13.979811 IP (tos 0x0, ttl 64, id 7552, offset 0, flags [DF], proto TCP (6), length 1980)
    127.0.0.1.9150 > 127.0.0.1.53640: Flags [P.], cksum 0x05b1 (incorrect -> 0xd13b), seq 14661:16589, ack 1886, win 512, options [nop,nop,TS val 777018351 ecr 777018351], length 1928
2022-04-05 06:16:13.979816 IP (tos 0x0, ttl 64, id 14863, offset 0, flags [DF], proto TCP (6), length 52)
    127.0.0.1.53640 > 127.0.0.1.9150: Flags [.], cksum 0xfe28 (incorrect -> 0xdfbd), seq 1886, ack 16589, win 484, options [nop,nop,TS val 777018351 ecr 777018351], length 0
2022-04-05 06:16:13.993592 IP (tos 0x0, ttl 64, id 7553, offset 0, flags [DF], proto TCP (6), length 3040)
    127.0.0.1.9150 > 127.0.0.1.53640: Flags [P.], cksum 0x09d5 (incorrect -> 0x3536), seq 16589:19577, ack 1886, win 512, options [nop,nop,TS val 777018365 ecr 777018351], length 2988
2022-04-05 06:16:13.993598 IP (tos 0x0, ttl 64, id 14864, offset 0, flags [DF], proto TCP (6), length 52)
    127.0.0.1.53640 > 127.0.0.1.9150: Flags [.], cksum 0xfe28 (incorrect -> 0xd3e9), seq 1886, ack 19577, win 496, options [nop,nop,TS val 777018365 ecr 777018365], length 0
2022-04-05 06:16:14.007529 IP (tos 0x0, ttl 64, id 7554, offset 0, flags [DF], proto TCP (6), length 2542)
    127.0.0.1.9150 > 127.0.0.1.53640: Flags [P.], cksum 0x07e3 (incorrect -> 0x437a), seq 19577:22067, ack 1886, win 512, options [nop,nop,TS val 777018379 ecr 777018365], length 2490
2022-04-05 06:16:14.007535 IP (tos 0x0, ttl 64, id 14865, offset 0, flags [DF], proto TCP (6), length 52)
    127.0.0.1.53640 > 127.0.0.1.9150: Flags [.], cksum 0xfe28 (incorrect -> 0xca11), seq 1886, ack 22067, win 498, options [nop,nop,TS val 777018379 ecr 777018379], length 0
2022-04-05 06:16:14.008780 IP (tos 0x0, ttl 64, id 7555, offset 0, flags [DF], proto TCP (6), length 4100)
    127.0.0.1.9150 > 127.0.0.1.53640: Flags [P.], cksum 0x0df9 (incorrect -> 0x7cd6), seq 22067:26115, ack 1886, win 512, options [nop,nop,TS val 777018380 ecr 777018379], length 4048
2022-04-05 06:16:14.008787 IP (tos 0x0, ttl 64, id 14866, offset 0, flags [DF], proto TCP (6), length 52)
    127.0.0.1.53640 > 127.0.0.1.9150: Flags [.], cksum 0xfe28 (incorrect -> 0xba45), seq 1886, ack 26115, win 492, options [nop,nop,TS val 777018380 ecr 777018380], length 0
2022-04-05 06:16:14.008792 IP (tos 0x0, ttl 64, id 7556, offset 0, flags [DF], proto TCP (6), length 3326)
    127.0.0.1.9150 > 127.0.0.1.53640: Flags [P.], cksum 0x0af3 (incorrect -> 0x7d39), seq 26115:29389, ack 1886, win 512, options [nop,nop,TS val 777018380 ecr 777018380], length 3274
2022-04-05 06:16:14.008796 IP (tos 0x0, ttl 64, id 14867, offset 0, flags [DF], proto TCP (6), length 52)
    127.0.0.1.53640 > 127.0.0.1.9150: Flags [.], cksum 0xfe28 (incorrect -> 0xad88), seq 1886, ack 29389, win 479, options [nop,nop,TS val 777018380 ecr 777018380], length 0
2022-04-05 06:16:14.010662 IP (tos 0x0, ttl 64, id 7557, offset 0, flags [DF], proto TCP (6), length 4036)
    127.0.0.1.9150 > 127.0.0.1.53640: Flags [P.], cksum 0x0db9 (incorrect -> 0x8333), seq 29389:33373, ack 1886, win 512, options [nop,nop,TS val 777018382 ecr 777018380], length 3984
2022-04-05 06:16:14.010668 IP (tos 0x0, ttl 64, id 14868, offset 0, flags [DF], proto TCP (6), length 52)
    127.0.0.1.53640 > 127.0.0.1.9150: Flags [.], cksum 0xfe28 (incorrect -> 0x9de7), seq 1886, ack 33373, win 492, options [nop,nop,TS val 777018382 ecr 777018382], length 0
2022-04-05 06:16:14.010856 IP (tos 0x0, ttl 64, id 7558, offset 0, flags [DF], proto TCP (6), length 3538)
    127.0.0.1.9150 > 127.0.0.1.53640: Flags [P.], cksum 0x0bc7 (incorrect -> 0xf2e7), seq 33373:36859, ack 1886, win 512, options [nop,nop,TS val 777018382 ecr 777018382], length 3486
2022-04-05 06:16:14.010868 IP (tos 0x0, ttl 64, id 14869, offset 0, flags [DF], proto TCP (6), length 52)
    127.0.0.1.53640 > 127.0.0.1.9150: Flags [.], cksum 0xfe28 (incorrect -> 0x9035), seq 1886, ack 36859, win 512, options [nop,nop,TS val 777018382 ecr 777018382], length 0
2022-04-05 06:16:14.011969 IP (tos 0x0, ttl 64, id 7559, offset 0, flags [DF], proto TCP (6), length 4036)
    127.0.0.1.9150 > 127.0.0.1.53640: Flags [P.], cksum 0x0db9 (incorrect -> 0x4778), seq 36859:40843, ack 1886, win 512, options [nop,nop,TS val 777018383 ecr 777018382], length 3984
2022-04-05 06:16:14.011982 IP (tos 0x0, ttl 64, id 14870, offset 0, flags [DF], proto TCP (6), length 52)
    127.0.0.1.53640 > 127.0.0.1.9150: Flags [.], cksum 0xfe28 (incorrect -> 0x80a3), seq 1886, ack 40843, win 512, options [nop,nop,TS val 777018383 ecr 777018383], length 0
2022-04-05 06:16:14.021557 IP (tos 0x0, ttl 64, id 7560, offset 0, flags [DF], proto TCP (6), length 4036)
    127.0.0.1.9150 > 127.0.0.1.53640: Flags [P.], cksum 0x0db9 (incorrect -> 0xade0), seq 40843:44827, ack 1886, win 512, options [nop,nop,TS val 777018393 ecr 777018383], length 3984
2022-04-05 06:16:14.041170 IP (tos 0x0, ttl 64, id 7561, offset 0, flags [DF], proto TCP (6), length 32820)
    127.0.0.1.9150 > 127.0.0.1.53640: Flags [.], cksum 0x7e29 (incorrect -> 0xe9e9), seq 44827:77595, ack 1886, win 512, options [nop,nop,TS val 777018412 ecr 777018383], length 32768
2022-04-05 06:16:14.041286 IP (tos 0x0, ttl 64, id 14871, offset 0, flags [DF], proto TCP (6), length 52)
    127.0.0.1.53640 > 127.0.0.1.9150: Flags [.], cksum 0xfe28 (incorrect -> 0xf170), seq 1886, ack 77595, win 379, options [nop,nop,TS val 777018412 ecr 777018393], length 0
2022-04-05 06:16:14.041300 IP (tos 0x0, ttl 64, id 7562, offset 0, flags [DF], proto TCP (6), length 17160)
    127.0.0.1.9150 > 127.0.0.1.53640: Flags [P.], cksum 0x40fd (incorrect -> 0x244d), seq 77595:94703, ack 1886, win 512, options [nop,nop,TS val 777018412 ecr 777018412], length 17108
2022-04-05 06:16:14.042431 IP (tos 0x0, ttl 64, id 14872, offset 0, flags [DF], proto TCP (6), length 52)
    127.0.0.1.53640 > 127.0.0.1.9150: Flags [.], cksum 0xfe28 (incorrect -> 0xae02), seq 1886, ack 94703, win 512, options [nop,nop,TS val 777018414 ecr 777018412], length 0
2022-04-05 06:16:14.050844 IP (tos 0x0, ttl 64, id 7563, offset 0, flags [DF], proto TCP (6), length 4100)
    127.0.0.1.9150 > 127.0.0.1.53640: Flags [P.], cksum 0x0df9 (incorrect -> 0xe601), seq 94703:98751, ack 1886, win 512, options [nop,nop,TS val 777018422 ecr 777018414], length 4048
2022-04-05 06:16:14.050869 IP (tos 0x0, ttl 64, id 14873, offset 0, flags [DF], proto TCP (6), length 52)
    127.0.0.1.53640 > 127.0.0.1.9150: Flags [.], cksum 0xfe28 (incorrect -> 0x9e20), seq 1886, ack 98751, win 512, options [nop,nop,TS val 777018422 ecr 777018422], length 0
2022-04-05 06:16:14.050872 IP (tos 0x0, ttl 64, id 7564, offset 0, flags [DF], proto TCP (6), length 984)
    127.0.0.1.9150 > 127.0.0.1.53640: Flags [P.], cksum 0x01cd (incorrect -> 0x3c71), seq 98751:99683, ack 1886, win 512, options [nop,nop,TS val 777018422 ecr 777018422], length 932
2022-04-05 06:16:14.050876 IP (tos 0x0, ttl 64, id 14874, offset 0, flags [DF], proto TCP (6), length 52)
    127.0.0.1.53640 > 127.0.0.1.9150: Flags [.], cksum 0xfe28 (incorrect -> 0x9a7c), seq 1886, ack 99683, win 512, options [nop,nop,TS val 777018422 ecr 777018422], length 0
2022-04-05 06:16:14.051066 IP (tos 0x0, ttl 64, id 7565, offset 0, flags [DF], proto TCP (6), length 4100)
    127.0.0.1.9150 > 127.0.0.1.53640: Flags [P.], cksum 0x0df9 (incorrect -> 0x55c2), seq 99683:103731, ack 1886, win 512, options [nop,nop,TS val 777018422 ecr 777018422], length 4048
2022-04-05 06:16:14.051080 IP (tos 0x0, ttl 64, id 14875, offset 0, flags [DF], proto TCP (6), length 52)
    127.0.0.1.53640 > 127.0.0.1.9150: Flags [.], cksum 0xfe28 (incorrect -> 0x8aac), seq 1886, ack 103731, win 512, options [nop,nop,TS val 777018422 ecr 777018422], length 0
2022-04-05 06:16:14.051084 IP (tos 0x0, ttl 64, id 7566, offset 0, flags [DF], proto TCP (6), length 2458)
    127.0.0.1.9150 > 127.0.0.1.53640: Flags [P.], cksum 0x078f (incorrect -> 0x502d), seq 103731:106137, ack 1886, win 512, options [nop,nop,TS val 777018422 ecr 777018422], length 2406
2022-04-05 06:16:14.051264 IP (tos 0x0, ttl 64, id 14876, offset 0, flags [DF], proto TCP (6), length 52)
    127.0.0.1.53640 > 127.0.0.1.9150: Flags [.], cksum 0xfe28 (incorrect -> 0x8146), seq 1886, ack 106137, win 512, options [nop,nop,TS val 777018422 ecr 777018422], length 0
2022-04-05 06:16:14.068784 IP (tos 0x0, ttl 64, id 7567, offset 0, flags [DF], proto TCP (6), length 4100)
    127.0.0.1.9150 > 127.0.0.1.53640: Flags [P.], cksum 0x0df9 (incorrect -> 0x7919), seq 106137:110185, ack 1886, win 512, options [nop,nop,TS val 777018440 ecr 777018422], length 4048
2022-04-05 06:16:14.068854 IP (tos 0x0, ttl 64, id 14877, offset 0, flags [DF], proto TCP (6), length 52)
    127.0.0.1.53640 > 127.0.0.1.9150: Flags [.], cksum 0xfe28 (incorrect -> 0x7152), seq 1886, ack 110185, win 512, options [nop,nop,TS val 777018440 ecr 777018440], length 0
2022-04-05 06:16:14.068863 IP (tos 0x0, ttl 64, id 7568, offset 0, flags [DF], proto TCP (6), length 7054)
    127.0.0.1.9150 > 127.0.0.1.53640: Flags [P.], cksum 0x1983 (incorrect -> 0x7c97), seq 110185:117187, ack 1886, win 512, options [nop,nop,TS val 777018440 ecr 777018440], length 7002
2022-04-05 06:16:14.068872 IP (tos 0x0, ttl 64, id 14878, offset 0, flags [DF], proto TCP (6), length 52)
    127.0.0.1.53640 > 127.0.0.1.9150: Flags [.], cksum 0xfe28 (incorrect -> 0x55f8), seq 1886, ack 117187, win 512, options [nop,nop,TS val 777018440 ecr 777018440], length 0
2022-04-05 06:16:14.070981 IP (tos 0x0, ttl 64, id 7569, offset 0, flags [DF], proto TCP (6), length 4100)
    127.0.0.1.9150 > 127.0.0.1.53640: Flags [P.], cksum 0x0df9 (incorrect -> 0x61e0), seq 117187:121235, ack 1886, win 512, options [nop,nop,TS val 777018442 ecr 777018440], length 4048
2022-04-05 06:16:14.071336 IP (tos 0x0, ttl 64, id 14879, offset 0, flags [DF], proto TCP (6), length 52)
    127.0.0.1.53640 > 127.0.0.1.9150: Flags [.], cksum 0xfe28 (incorrect -> 0x4624), seq 1886, ack 121235, win 512, options [nop,nop,TS val 777018442 ecr 777018442], length 0
2022-04-05 06:16:14.071341 IP (tos 0x0, ttl 64, id 7570, offset 0, flags [DF], proto TCP (6), length 486)
    127.0.0.1.9150 > 127.0.0.1.53640: Flags [P.], cksum 0xffda (incorrect -> 0xc933), seq 121235:121669, ack 1886, win 512, options [nop,nop,TS val 777018442 ecr 777018442], length 434
2022-04-05 06:16:14.071345 IP (tos 0x0, ttl 64, id 14880, offset 0, flags [DF], proto TCP (6), length 52)
    127.0.0.1.53640 > 127.0.0.1.9150: Flags [.], cksum 0xfe28 (incorrect -> 0x4472), seq 1886, ack 121669, win 512, options [nop,nop,TS val 777018442 ecr 777018442], length 0
2022-04-05 06:16:14.071409 IP (tos 0x0, ttl 64, id 7571, offset 0, flags [DF], proto TCP (6), length 4100)
    127.0.0.1.9150 > 127.0.0.1.53640: Flags [P.], cksum 0x0df9 (incorrect -> 0x813e), seq 121669:125717, ack 1886, win 512, options [nop,nop,TS val 777018443 ecr 777018442], length 4048
2022-04-05 06:16:14.071466 IP (tos 0x0, ttl 64, id 14881, offset 0, flags [DF], proto TCP (6), length 52)
    127.0.0.1.53640 > 127.0.0.1.9150: Flags [.], cksum 0xfe28 (incorrect -> 0x34a0), seq 1886, ack 125717, win 512, options [nop,nop,TS val 777018443 ecr 777018443], length 0
200, 5.789651393890381, 1.4789772033691406