2022-04-05 19:55:28.427661 IP (tos 0x0, ttl 64, id 54839, offset 0, flags [DF], proto TCP (6), length 60)
    127.0.0.1.54862 > 127.0.0.1.12150: Flags [S], cksum 0xfe30 (incorrect -> 0x4896), seq 253928238, win 65495, options [mss 65495,sackOK,TS val 270810930 ecr 0,nop,wscale 7], length 0
2022-04-05 19:55:28.427676 IP (tos 0x0, ttl 64, id 0, offset 0, flags [DF], proto TCP (6), length 60)
    127.0.0.1.12150 > 127.0.0.1.54862: Flags [S.], cksum 0xfe30 (incorrect -> 0xa2f3), seq 3314520247, ack 253928239, win 65483, options [mss 65495,sackOK,TS val 270810930 ecr 270810930,nop,wscale 7], length 0
2022-04-05 19:55:28.427688 IP (tos 0x0, ttl 64, id 54840, offset 0, flags [DF], proto TCP (6), length 52)
    127.0.0.1.54862 > 127.0.0.1.12150: Flags [.], cksum 0xfe28 (incorrect -> 0xc9af), seq 1, ack 1, win 512, options [nop,nop,TS val 270810930 ecr 270810930], length 0
2022-04-05 19:55:28.427801 IP (tos 0x0, ttl 64, id 54841, offset 0, flags [DF], proto TCP (6), length 55)
    127.0.0.1.54862 > 127.0.0.1.12150: Flags [P.], cksum 0xfe2b (incorrect -> 0xc4a3), seq 1:4, ack 1, win 512, options [nop,nop,TS val 270810930 ecr 270810930], length 3
2022-04-05 19:55:28.427814 IP (tos 0x0, ttl 64, id 27974, offset 0, flags [DF], proto TCP (6), length 52)
    127.0.0.1.12150 > 127.0.0.1.54862: Flags [.], cksum 0xfe28 (incorrect -> 0xc9ac), seq 1, ack 4, win 512, options [nop,nop,TS val 270810930 ecr 270810930], length 0
2022-04-05 19:55:28.427852 IP (tos 0x0, ttl 64, id 27975, offset 0, flags [DF], proto TCP (6), length 54)
    127.0.0.1.12150 > 127.0.0.1.54862: Flags [P.], cksum 0xfe2a (incorrect -> 0xc4a2), seq 1:3, ack 4, win 512, options [nop,nop,TS val 270810930 ecr 270810930], length 2
2022-04-05 19:55:28.427864 IP (tos 0x0, ttl 64, id 54842, offset 0, flags [DF], proto TCP (6), length 52)
    127.0.0.1.54862 > 127.0.0.1.12150: Flags [.], cksum 0xfe28 (incorrect -> 0xc9aa), seq 4, ack 3, win 512, options [nop,nop,TS val 270810930 ecr 270810930], length 0
2022-04-05 19:55:28.429489 IP (tos 0x0, ttl 64, id 54843, offset 0, flags [DF], proto TCP (6), length 62)
    127.0.0.1.54862 > 127.0.0.1.12150: Flags [P.], cksum 0xfe32 (incorrect -> 0xc9b4), seq 4:14, ack 3, win 512, options [nop,nop,TS val 270810932 ecr 270810930], length 10
2022-04-05 19:55:28.429509 IP (tos 0x0, ttl 64, id 27976, offset 0, flags [DF], proto TCP (6), length 52)
    127.0.0.1.12150 > 127.0.0.1.54862: Flags [.], cksum 0xfe28 (incorrect -> 0xc99c), seq 3, ack 14, win 512, options [nop,nop,TS val 270810932 ecr 270810932], length 0
2022-04-05 19:55:28.481373 IP (tos 0x0, ttl 64, id 27977, offset 0, flags [DF], proto TCP (6), length 62)
    127.0.0.1.12150 > 127.0.0.1.54862: Flags [P.], cksum 0xfe32 (incorrect -> 0xc455), seq 3:13, ack 14, win 512, options [nop,nop,TS val 270810984 ecr 270810932], length 10
2022-04-05 19:55:28.481387 IP (tos 0x0, ttl 64, id 54844, offset 0, flags [DF], proto TCP (6), length 52)
    127.0.0.1.54862 > 127.0.0.1.12150: Flags [.], cksum 0xfe28 (incorrect -> 0xc92a), seq 14, ack 13, win 512, options [nop,nop,TS val 270810984 ecr 270810984], length 0
2022-04-05 19:55:28.487309 IP (tos 0x0, ttl 64, id 54845, offset 0, flags [DF], proto TCP (6), length 569)
    127.0.0.1.54862 > 127.0.0.1.12150: Flags [P.], cksum 0x002e (incorrect -> 0xe75b), seq 14:531, ack 13, win 512, options [nop,nop,TS val 270810990 ecr 270810984], length 517
2022-04-05 19:55:28.487320 IP (tos 0x0, ttl 64, id 27978, offset 0, flags [DF], proto TCP (6), length 52)
    127.0.0.1.12150 > 127.0.0.1.54862: Flags [.], cksum 0xfe28 (incorrect -> 0xc71d), seq 13, ack 531, win 508, options [nop,nop,TS val 270810990 ecr 270810990], length 0
2022-04-05 19:55:28.542155 IP (tos 0x0, ttl 64, id 27979, offset 0, flags [DF], proto TCP (6), length 3538)
    127.0.0.1.12150 > 127.0.0.1.54862: Flags [P.], cksum 0x0bc7 (incorrect -> 0xf6ba), seq 13:3499, ack 531, win 512, options [nop,nop,TS val 270811045 ecr 270810990], length 3486
2022-04-05 19:55:28.542165 IP (tos 0x0, ttl 64, id 54846, offset 0, flags [DF], proto TCP (6), length 52)
    127.0.0.1.54862 > 127.0.0.1.12150: Flags [.], cksum 0xfe28 (incorrect -> 0xb91f), seq 531, ack 3499, win 494, options [nop,nop,TS val 270811045 ecr 270811045], length 0
2022-04-05 19:55:28.588501 IP (tos 0x0, ttl 64, id 27980, offset 0, flags [DF], proto TCP (6), length 781)
    127.0.0.1.12150 > 127.0.0.1.54862: Flags [P.], cksum 0x0102 (incorrect -> 0x1c54), seq 3499:4228, ack 531, win 512, options [nop,nop,TS val 270811091 ecr 270811045], length 729
2022-04-05 19:55:28.588510 IP (tos 0x0, ttl 64, id 54847, offset 0, flags [DF], proto TCP (6), length 52)
    127.0.0.1.54862 > 127.0.0.1.12150: Flags [.], cksum 0xfe28 (incorrect -> 0xb5df), seq 531, ack 4228, win 505, options [nop,nop,TS val 270811091 ecr 270811091], length 0
2022-04-05 19:55:28.588851 IP (tos 0x0, ttl 64, id 54848, offset 0, flags [DF], proto TCP (6), length 132)
    127.0.0.1.54862 > 127.0.0.1.12150: Flags [P.], cksum 0xfe78 (incorrect -> 0x3dd4), seq 531:611, ack 4228, win 512, options [nop,nop,TS val 270811091 ecr 270811091], length 80
2022-04-05 19:55:28.588860 IP (tos 0x0, ttl 64, id 27981, offset 0, flags [DF], proto TCP (6), length 52)
    127.0.0.1.12150 > 127.0.0.1.54862: Flags [.], cksum 0xfe28 (incorrect -> 0xb588), seq 4228, ack 611, win 512, options [nop,nop,TS val 270811091 ecr 270811091], length 0
2022-04-05 19:55:28.589225 IP (tos 0x0, ttl 64, id 54849, offset 0, flags [DF], proto TCP (6), length 362)
    127.0.0.1.54862 > 127.0.0.1.12150: Flags [P.], cksum 0xff5e (incorrect -> 0xc4ed), seq 611:921, ack 4228, win 512, options [nop,nop,TS val 270811092 ecr 270811091], length 310
2022-04-05 19:55:28.589235 IP (tos 0x0, ttl 64, id 27982, offset 0, flags [DF], proto TCP (6), length 52)
    127.0.0.1.12150 > 127.0.0.1.54862: Flags [.], cksum 0xfe28 (incorrect -> 0xb452), seq 4228, ack 921, win 510, options [nop,nop,TS val 270811092 ecr 270811092], length 0
2022-04-05 19:55:28.666838 IP (tos 0x0, ttl 64, id 27983, offset 0, flags [DF], proto TCP (6), length 594)
    127.0.0.1.12150 > 127.0.0.1.54862: Flags [P.], cksum 0x0047 (incorrect -> 0xa356), seq 4228:4770, ack 921, win 512, options [nop,nop,TS val 270811169 ecr 270811092], length 542
2022-04-05 19:55:28.666847 IP (tos 0x0, ttl 64, id 54850, offset 0, flags [DF], proto TCP (6), length 52)
    127.0.0.1.54862 > 127.0.0.1.12150: Flags [.], cksum 0xfe28 (incorrect -> 0xb19c), seq 921, ack 4770, win 508, options [nop,nop,TS val 270811169 ecr 270811169], length 0
2022-04-05 19:55:28.710252 IP (tos 0x0, ttl 64, id 27984, offset 0, flags [DF], proto TCP (6), length 3538)
    127.0.0.1.12150 > 127.0.0.1.54862: Flags [P.], cksum 0x0bc7 (incorrect -> 0x977d), seq 4770:8256, ack 921, win 512, options [nop,nop,TS val 270811213 ecr 270811169], length 3486
2022-04-05 19:55:28.710261 IP (tos 0x0, ttl 64, id 54851, offset 0, flags [DF], proto TCP (6), length 52)
    127.0.0.1.54862 > 127.0.0.1.12150: Flags [.], cksum 0xfe28 (incorrect -> 0xa3b4), seq 921, ack 8256, win 494, options [nop,nop,TS val 270811213 ecr 270811213], length 0
2022-04-05 19:55:28.724128 IP (tos 0x0, ttl 64, id 27985, offset 0, flags [DF], proto TCP (6), length 3114)
    127.0.0.1.12150 > 127.0.0.1.54862: Flags [P.], cksum 0x0a1f (incorrect -> 0xcabf), seq 8256:11318, ack 921, win 512, options [nop,nop,TS val 270811227 ecr 270811213], length 3062
2022-04-05 19:55:28.724136 IP (tos 0x0, ttl 64, id 54852, offset 0, flags [DF], proto TCP (6), length 52)
    127.0.0.1.54862 > 127.0.0.1.12150: Flags [.], cksum 0xfe28 (incorrect -> 0x97a0), seq 921, ack 11318, win 496, options [nop,nop,TS val 270811227 ecr 270811227], length 0
2022-04-05 19:55:28.727009 IP (tos 0x0, ttl 64, id 27986, offset 0, flags [DF], proto TCP (6), length 2330)
    127.0.0.1.12150 > 127.0.0.1.54862: Flags [P.], cksum 0x070f (incorrect -> 0x5166), seq 11318:13596, ack 921, win 512, options [nop,nop,TS val 270811229 ecr 270811227], length 2278
2022-04-05 19:55:28.727016 IP (tos 0x0, ttl 64, id 54853, offset 0, flags [DF], proto TCP (6), length 52)
    127.0.0.1.54862 > 127.0.0.1.12150: Flags [.], cksum 0xfe28 (incorrect -> 0x8eb3), seq 921, ack 13596, win 499, options [nop,nop,TS val 270811229 ecr 270811229], length 0
2022-04-05 19:55:28.741191 IP (tos 0x0, ttl 64, id 27987, offset 0, flags [DF], proto TCP (6), length 2044)
    127.0.0.1.12150 > 127.0.0.1.54862: Flags [P.], cksum 0x05f1 (incorrect -> 0x377e), seq 13596:15588, ack 921, win 512, options [nop,nop,TS val 270811244 ecr 270811229], length 1992
2022-04-05 19:55:28.741198 IP (tos 0x0, ttl 64, id 54854, offset 0, flags [DF], proto TCP (6), length 52)
    127.0.0.1.54862 > 127.0.0.1.12150: Flags [.], cksum 0xfe28 (incorrect -> 0x86cc), seq 921, ack 15588, win 500, options [nop,nop,TS val 270811244 ecr 270811244], length 0
2022-04-05 19:55:28.741309 IP (tos 0x0, ttl 64, id 27988, offset 0, flags [DF], proto TCP (6), length 3114)
    127.0.0.1.12150 > 127.0.0.1.54862: Flags [P.], cksum 0x0a1f (incorrect -> 0x0ac1), seq 15588:18650, ack 921, win 512, options [nop,nop,TS val 270811244 ecr 270811244], length 3062
2022-04-05 19:55:28.741317 IP (tos 0x0, ttl 64, id 54855, offset 0, flags [DF], proto TCP (6), length 52)
    127.0.0.1.54862 > 127.0.0.1.12150: Flags [.], cksum 0xfe28 (incorrect -> 0x7ada), seq 921, ack 18650, win 496, options [nop,nop,TS val 270811244 ecr 270811244], length 0
2022-04-05 19:55:28.748530 IP (tos 0x0, ttl 64, id 27989, offset 0, flags [DF], proto TCP (6), length 4100)
    127.0.0.1.12150 > 127.0.0.1.54862: Flags [P.], cksum 0x0df9 (incorrect -> 0x6fbb), seq 18650:22698, ack 921, win 512, options [nop,nop,TS val 270811251 ecr 270811244], length 4048
2022-04-05 19:55:28.748538 IP (tos 0x0, ttl 64, id 54856, offset 0, flags [DF], proto TCP (6), length 52)
    127.0.0.1.54862 > 127.0.0.1.12150: Flags [.], cksum 0xfe28 (incorrect -> 0x6b00), seq 921, ack 22698, win 492, options [nop,nop,TS val 270811251 ecr 270811251], length 0
2022-04-05 19:55:28.748545 IP (tos 0x0, ttl 64, id 27990, offset 0, flags [DF], proto TCP (6), length 380)
    127.0.0.1.12150 > 127.0.0.1.54862: Flags [P.], cksum 0xff70 (incorrect -> 0x2a6e), seq 22698:23026, ack 921, win 512, options [nop,nop,TS val 270811251 ecr 270811251], length 328
2022-04-05 19:55:28.748550 IP (tos 0x0, ttl 64, id 54857, offset 0, flags [DF], proto TCP (6), length 52)
    127.0.0.1.54862 > 127.0.0.1.12150: Flags [.], cksum 0xfe28 (incorrect -> 0x69ba), seq 921, ack 23026, win 490, options [nop,nop,TS val 270811251 ecr 270811251], length 0
2022-04-05 19:55:28.756759 IP (tos 0x0, ttl 64, id 27991, offset 0, flags [DF], proto TCP (6), length 4100)
    127.0.0.1.12150 > 127.0.0.1.54862: Flags [P.], cksum 0x0df9 (incorrect -> 0xf9be), seq 23026:27074, ack 921, win 512, options [nop,nop,TS val 270811259 ecr 270811251], length 4048
2022-04-05 19:55:28.798654 IP (tos 0x0, ttl 64, id 54858, offset 0, flags [DF], proto TCP (6), length 52)
    127.0.0.1.54862 > 127.0.0.1.12150: Flags [.], cksum 0xfe28 (incorrect -> 0x599a), seq 921, ack 27074, win 512, options [nop,nop,TS val 270811301 ecr 270811259], length 0
2022-04-05 19:55:28.798668 IP (tos 0x0, ttl 64, id 27992, offset 0, flags [DF], proto TCP (6), length 13296)
    127.0.0.1.12150 > 127.0.0.1.54862: Flags [P.], cksum 0x31e5 (incorrect -> 0xf53c), seq 27074:40318, ack 921, win 512, options [nop,nop,TS val 270811301 ecr 270811301], length 13244
2022-04-05 19:55:28.842660 IP (tos 0x0, ttl 64, id 54859, offset 0, flags [DF], proto TCP (6), length 52)
    127.0.0.1.54862 > 127.0.0.1.12150: Flags [.], cksum 0xfe28 (incorrect -> 0x2588), seq 921, ack 40318, win 512, options [nop,nop,TS val 270811345 ecr 270811301], length 0
2022-04-05 19:55:28.842680 IP (tos 0x0, ttl 64, id 27993, offset 0, flags [DF], proto TCP (6), length 32622)
    127.0.0.1.12150 > 127.0.0.1.54862: Flags [P.], cksum 0x7d63 (incorrect -> 0xcb01), seq 40318:72888, ack 921, win 512, options [nop,nop,TS val 270811345 ecr 270811345], length 32570
2022-04-05 19:55:28.886672 IP (tos 0x0, ttl 64, id 54860, offset 0, flags [DF], proto TCP (6), length 52)
    127.0.0.1.54862 > 127.0.0.1.12150: Flags [.], cksum 0xfe28 (incorrect -> 0xa5f5), seq 921, ack 72888, win 512, options [nop,nop,TS val 270811389 ecr 270811345], length 0
2022-04-05 19:55:28.886693 IP (tos 0x0, ttl 64, id 27994, offset 0, flags [DF], proto TCP (6), length 32480)
    127.0.0.1.12150 > 127.0.0.1.54862: Flags [P.], cksum 0x7cd5 (incorrect -> 0x8fff), seq 72888:105316, ack 921, win 512, options [nop,nop,TS val 270811389 ecr 270811389], length 32428
2022-04-05 19:55:28.887016 IP (tos 0x0, ttl 64, id 54861, offset 0, flags [DF], proto TCP (6), length 52)
    127.0.0.1.54862 > 127.0.0.1.12150: Flags [.], cksum 0xfe28 (incorrect -> 0x271d), seq 921, ack 105316, win 512, options [nop,nop,TS val 270811389 ecr 270811389], length 0
2022-04-05 19:55:28.888394 IP (tos 0x0, ttl 64, id 27995, offset 0, flags [DF], proto TCP (6), length 2454)
    127.0.0.1.12150 > 127.0.0.1.54862: Flags [P.], cksum 0x078b (incorrect -> 0xd976), seq 105316:107718, ack 921, win 512, options [nop,nop,TS val 270811391 ecr 270811389], length 2402
2022-04-05 19:55:28.888410 IP (tos 0x0, ttl 64, id 54862, offset 0, flags [DF], proto TCP (6), length 52)
    127.0.0.1.54862 > 127.0.0.1.12150: Flags [.], cksum 0xfe28 (incorrect -> 0x1db7), seq 921, ack 107718, win 512, options [nop,nop,TS val 270811391 ecr 270811391], length 0
2022-04-05 19:55:28.888557 IP (tos 0x0, ttl 64, id 27996, offset 0, flags [DF], proto TCP (6), length 3538)
    127.0.0.1.12150 > 127.0.0.1.54862: Flags [P.], cksum 0x0bc7 (incorrect -> 0xeb1f), seq 107718:111204, ack 921, win 512, options [nop,nop,TS val 270811391 ecr 270811391], length 3486
2022-04-05 19:55:28.888676 IP (tos 0x0, ttl 64, id 54863, offset 0, flags [DF], proto TCP (6), length 52)
    127.0.0.1.54862 > 127.0.0.1.12150: Flags [.], cksum 0xfe28 (incorrect -> 0x1019), seq 921, ack 111204, win 512, options [nop,nop,TS val 270811391 ecr 270811391], length 0
2022-04-05 19:55:28.895395 IP (tos 0x0, ttl 64, id 27997, offset 0, flags [DF], proto TCP (6), length 3980)
    127.0.0.1.12150 > 127.0.0.1.54862: Flags [P.], cksum 0x0d81 (incorrect -> 0x982a), seq 111204:115132, ack 921, win 512, options [nop,nop,TS val 270811398 ecr 270811391], length 3928
2022-04-05 19:55:28.895414 IP (tos 0x0, ttl 64, id 54864, offset 0, flags [DF], proto TCP (6), length 52)
    127.0.0.1.54862 > 127.0.0.1.12150: Flags [.], cksum 0xfe28 (incorrect -> 0x00b3), seq 921, ack 115132, win 512, options [nop,nop,TS val 270811398 ecr 270811398], length 0
2022-04-05 19:55:28.899676 IP (tos 0x0, ttl 64, id 27998, offset 0, flags [DF], proto TCP (6), length 3450)
    127.0.0.1.12150 > 127.0.0.1.54862: Flags [P.], cksum 0x0b6f (incorrect -> 0xd035), seq 115132:118530, ack 921, win 512, options [nop,nop,TS val 270811402 ecr 270811398], length 3398
2022-04-05 19:55:28.899700 IP (tos 0x0, ttl 64, id 54865, offset 0, flags [DF], proto TCP (6), length 52)
    127.0.0.1.54862 > 127.0.0.1.12150: Flags [.], cksum 0xfe28 (incorrect -> 0xf364), seq 921, ack 118530, win 512, options [nop,nop,TS val 270811402 ecr 270811402], length 0
2022-04-05 19:55:28.905243 IP (tos 0x0, ttl 64, id 27999, offset 0, flags [DF], proto TCP (6), length 3538)
    127.0.0.1.12150 > 127.0.0.1.54862: Flags [P.], cksum 0x0bc7 (incorrect -> 0x48d2), seq 118530:122016, ack 921, win 512, options [nop,nop,TS val 270811408 ecr 270811402], length 3486
2022-04-05 19:55:28.905259 IP (tos 0x0, ttl 64, id 54866, offset 0, flags [DF], proto TCP (6), length 52)
    127.0.0.1.54862 > 127.0.0.1.12150: Flags [.], cksum 0xfe28 (incorrect -> 0xe5ba), seq 921, ack 122016, win 512, options [nop,nop,TS val 270811408 ecr 270811408], length 0
2022-04-05 19:55:28.905426 IP (tos 0x0, ttl 64, id 28000, offset 0, flags [DF], proto TCP (6), length 4100)
    127.0.0.1.12150 > 127.0.0.1.54862: Flags [P.], cksum 0x0df9 (incorrect -> 0xc159), seq 122016:126064, ack 921, win 512, options [nop,nop,TS val 270811408 ecr 270811408], length 4048
2022-04-05 19:55:28.905588 IP (tos 0x0, ttl 64, id 54867, offset 0, flags [DF], proto TCP (6), length 52)
    127.0.0.1.54862 > 127.0.0.1.12150: Flags [.], cksum 0xfe28 (incorrect -> 0xd5ea), seq 921, ack 126064, win 512, options [nop,nop,TS val 270811408 ecr 270811408], length 0
200, 3.8510472774505615, 0.5975267887115479