2022-04-05 20:32:43.374330 IP (tos 0x0, ttl 64, id 25500, offset 0, flags [DF], proto TCP (6), length 60)
    127.0.0.1.48136 > 127.0.0.1.10950: Flags [S], cksum 0xfe30 (incorrect -> 0xca00), seq 4026877297, win 65495, options [mss 65495,sackOK,TS val 273045877 ecr 0,nop,wscale 7], length 0
2022-04-05 20:32:43.374342 IP (tos 0x0, ttl 64, id 0, offset 0, flags [DF], proto TCP (6), length 60)
    127.0.0.1.10950 > 127.0.0.1.48136: Flags [S.], cksum 0xfe30 (incorrect -> 0x2a69), seq 439557028, ack 4026877298, win 65483, options [mss 65495,sackOK,TS val 273045877 ecr 273045877,nop,wscale 7], length 0
2022-04-05 20:32:43.374351 IP (tos 0x0, ttl 64, id 25501, offset 0, flags [DF], proto TCP (6), length 52)
    127.0.0.1.48136 > 127.0.0.1.10950: Flags [.], cksum 0xfe28 (incorrect -> 0x5125), seq 1, ack 1, win 512, options [nop,nop,TS val 273045877 ecr 273045877], length 0
2022-04-05 20:32:43.374515 IP (tos 0x0, ttl 64, id 25502, offset 0, flags [DF], proto TCP (6), length 55)
    127.0.0.1.48136 > 127.0.0.1.10950: Flags [P.], cksum 0xfe2b (incorrect -> 0x4c19), seq 1:4, ack 1, win 512, options [nop,nop,TS val 273045877 ecr 273045877], length 3
2022-04-05 20:32:43.374521 IP (tos 0x0, ttl 64, id 32482, offset 0, flags [DF], proto TCP (6), length 52)
    127.0.0.1.10950 > 127.0.0.1.48136: Flags [.], cksum 0xfe28 (incorrect -> 0x5122), seq 1, ack 4, win 512, options [nop,nop,TS val 273045877 ecr 273045877], length 0
2022-04-05 20:32:43.374545 IP (tos 0x0, ttl 64, id 32483, offset 0, flags [DF], proto TCP (6), length 54)
    127.0.0.1.10950 > 127.0.0.1.48136: Flags [P.], cksum 0xfe2a (incorrect -> 0x4c18), seq 1:3, ack 4, win 512, options [nop,nop,TS val 273045877 ecr 273045877], length 2
2022-04-05 20:32:43.374552 IP (tos 0x0, ttl 64, id 25503, offset 0, flags [DF], proto TCP (6), length 52)
    127.0.0.1.48136 > 127.0.0.1.10950: Flags [.], cksum 0xfe28 (incorrect -> 0x5120), seq 4, ack 3, win 512, options [nop,nop,TS val 273045877 ecr 273045877], length 0
2022-04-05 20:32:43.376166 IP (tos 0x0, ttl 64, id 25504, offset 0, flags [DF], proto TCP (6), length 62)
    127.0.0.1.48136 > 127.0.0.1.10950: Flags [P.], cksum 0xfe32 (incorrect -> 0xc112), seq 4:14, ack 3, win 512, options [nop,nop,TS val 273045879 ecr 273045877], length 10
2022-04-05 20:32:43.376172 IP (tos 0x0, ttl 64, id 32484, offset 0, flags [DF], proto TCP (6), length 52)
    127.0.0.1.10950 > 127.0.0.1.48136: Flags [.], cksum 0xfe28 (incorrect -> 0x5112), seq 3, ack 14, win 512, options [nop,nop,TS val 273045879 ecr 273045879], length 0
2022-04-05 20:32:43.645856 IP (tos 0x0, ttl 64, id 32485, offset 0, flags [DF], proto TCP (6), length 62)
    127.0.0.1.10950 > 127.0.0.1.48136: Flags [P.], cksum 0xfe32 (incorrect -> 0x4af2), seq 3:13, ack 14, win 512, options [nop,nop,TS val 273046148 ecr 273045879], length 10
2022-04-05 20:32:43.645867 IP (tos 0x0, ttl 64, id 25505, offset 0, flags [DF], proto TCP (6), length 52)
    127.0.0.1.48136 > 127.0.0.1.10950: Flags [.], cksum 0xfe28 (incorrect -> 0x4eee), seq 14, ack 13, win 512, options [nop,nop,TS val 273046148 ecr 273046148], length 0
2022-04-05 20:32:43.653049 IP (tos 0x0, ttl 64, id 25506, offset 0, flags [DF], proto TCP (6), length 569)
    127.0.0.1.48136 > 127.0.0.1.10950: Flags [P.], cksum 0x002e (incorrect -> 0xe63f), seq 14:531, ack 13, win 512, options [nop,nop,TS val 273046155 ecr 273046148], length 517
2022-04-05 20:32:43.653059 IP (tos 0x0, ttl 64, id 32486, offset 0, flags [DF], proto TCP (6), length 52)
    127.0.0.1.10950 > 127.0.0.1.48136: Flags [.], cksum 0xfe28 (incorrect -> 0x4cdf), seq 13, ack 531, win 508, options [nop,nop,TS val 273046155 ecr 273046155], length 0
2022-04-05 20:32:43.924681 IP (tos 0x0, ttl 64, id 32487, offset 0, flags [DF], proto TCP (6), length 3538)
    127.0.0.1.10950 > 127.0.0.1.48136: Flags [P.], cksum 0x0bc7 (incorrect -> 0x087e), seq 13:3499, ack 531, win 512, options [nop,nop,TS val 273046427 ecr 273046155], length 3486
2022-04-05 20:32:43.924692 IP (tos 0x0, ttl 64, id 25507, offset 0, flags [DF], proto TCP (6), length 52)
    127.0.0.1.48136 > 127.0.0.1.10950: Flags [.], cksum 0xfe28 (incorrect -> 0x3d2f), seq 531, ack 3499, win 494, options [nop,nop,TS val 273046427 ecr 273046427], length 0
2022-04-05 20:32:44.036395 IP (tos 0x0, ttl 64, id 32488, offset 0, flags [DF], proto TCP (6), length 662)
    127.0.0.1.10950 > 127.0.0.1.48136: Flags [P.], cksum 0x008b (incorrect -> 0x1c95), seq 3499:4109, ack 531, win 512, options [nop,nop,TS val 273046539 ecr 273046427], length 610
2022-04-05 20:32:44.036403 IP (tos 0x0, ttl 64, id 25508, offset 0, flags [DF], proto TCP (6), length 52)
    127.0.0.1.48136 > 127.0.0.1.10950: Flags [.], cksum 0xfe28 (incorrect -> 0x39e2), seq 531, ack 4109, win 505, options [nop,nop,TS val 273046539 ecr 273046539], length 0
2022-04-05 20:32:44.188866 IP (tos 0x0, ttl 64, id 32489, offset 0, flags [DF], proto TCP (6), length 541)
    127.0.0.1.10950 > 127.0.0.1.48136: Flags [P.], cksum 0x0012 (incorrect -> 0x1853), seq 4109:4598, ack 531, win 512, options [nop,nop,TS val 273046691 ecr 273046539], length 489
2022-04-05 20:32:44.188874 IP (tos 0x0, ttl 64, id 25509, offset 0, flags [DF], proto TCP (6), length 52)
    127.0.0.1.48136 > 127.0.0.1.10950: Flags [.], cksum 0xfe28 (incorrect -> 0x36c8), seq 531, ack 4598, win 506, options [nop,nop,TS val 273046691 ecr 273046691], length 0
2022-04-05 20:32:44.189367 IP (tos 0x0, ttl 64, id 25510, offset 0, flags [DF], proto TCP (6), length 132)
    127.0.0.1.48136 > 127.0.0.1.10950: Flags [P.], cksum 0xfe78 (incorrect -> 0x6be2), seq 531:611, ack 4598, win 512, options [nop,nop,TS val 273046692 ecr 273046691], length 80
2022-04-05 20:32:44.189374 IP (tos 0x0, ttl 64, id 32490, offset 0, flags [DF], proto TCP (6), length 52)
    127.0.0.1.10950 > 127.0.0.1.48136: Flags [.], cksum 0xfe28 (incorrect -> 0x3670), seq 4598, ack 611, win 512, options [nop,nop,TS val 273046692 ecr 273046692], length 0
2022-04-05 20:32:44.189744 IP (tos 0x0, ttl 64, id 25511, offset 0, flags [DF], proto TCP (6), length 341)
    127.0.0.1.48136 > 127.0.0.1.10950: Flags [P.], cksum 0xff49 (incorrect -> 0xbdbf), seq 611:900, ack 4598, win 512, options [nop,nop,TS val 273046692 ecr 273046692], length 289
2022-04-05 20:32:44.189749 IP (tos 0x0, ttl 64, id 32491, offset 0, flags [DF], proto TCP (6), length 52)
    127.0.0.1.10950 > 127.0.0.1.48136: Flags [.], cksum 0xfe28 (incorrect -> 0x3551), seq 4598, ack 900, win 510, options [nop,nop,TS val 273046692 ecr 273046692], length 0
2022-04-05 20:32:44.462715 IP (tos 0x0, ttl 64, id 32492, offset 0, flags [DF], proto TCP (6), length 210)
    127.0.0.1.10950 > 127.0.0.1.48136: Flags [P.], cksum 0xfec6 (incorrect -> 0x81e9), seq 4598:4756, ack 900, win 512, options [nop,nop,TS val 273046965 ecr 273046692], length 158
2022-04-05 20:32:44.462726 IP (tos 0x0, ttl 64, id 25512, offset 0, flags [DF], proto TCP (6), length 52)
    127.0.0.1.48136 > 127.0.0.1.10950: Flags [.], cksum 0xfe28 (incorrect -> 0x3290), seq 900, ack 4756, win 511, options [nop,nop,TS val 273046965 ecr 273046965], length 0
2022-04-05 20:32:44.468324 IP (tos 0x0, ttl 64, id 32493, offset 0, flags [DF], proto TCP (6), length 3504)
    127.0.0.1.10950 > 127.0.0.1.48136: Flags [P.], cksum 0x0ba5 (incorrect -> 0x1ee8), seq 4756:8208, ack 900, win 512, options [nop,nop,TS val 273046971 ecr 273046965], length 3452
2022-04-05 20:32:44.468330 IP (tos 0x0, ttl 64, id 25513, offset 0, flags [DF], proto TCP (6), length 52)
    127.0.0.1.48136 > 127.0.0.1.10950: Flags [.], cksum 0xfe28 (incorrect -> 0x2519), seq 900, ack 8208, win 494, options [nop,nop,TS val 273046971 ecr 273046971], length 0
2022-04-05 20:32:44.468788 IP (tos 0x0, ttl 64, id 32494, offset 0, flags [DF], proto TCP (6), length 2044)
    127.0.0.1.10950 > 127.0.0.1.48136: Flags [P.], cksum 0x05f1 (incorrect -> 0x19fb), seq 8208:10200, ack 900, win 512, options [nop,nop,TS val 273046971 ecr 273046971], length 1992
2022-04-05 20:32:44.468793 IP (tos 0x0, ttl 64, id 25514, offset 0, flags [DF], proto TCP (6), length 52)
    127.0.0.1.48136 > 127.0.0.1.10950: Flags [.], cksum 0xfe28 (incorrect -> 0x1d4b), seq 900, ack 10200, win 500, options [nop,nop,TS val 273046971 ecr 273046971], length 0
2022-04-05 20:32:44.470134 IP (tos 0x0, ttl 64, id 32495, offset 0, flags [DF], proto TCP (6), length 2044)
    127.0.0.1.10950 > 127.0.0.1.48136: Flags [P.], cksum 0x05f1 (incorrect -> 0x83b7), seq 10200:12192, ack 900, win 512, options [nop,nop,TS val 273046973 ecr 273046971], length 1992
2022-04-05 20:32:44.470143 IP (tos 0x0, ttl 64, id 25515, offset 0, flags [DF], proto TCP (6), length 52)
    127.0.0.1.48136 > 127.0.0.1.10950: Flags [.], cksum 0xfe28 (incorrect -> 0x157f), seq 900, ack 12192, win 500, options [nop,nop,TS val 273046973 ecr 273046973], length 0
2022-04-05 20:32:44.480510 IP (tos 0x0, ttl 64, id 32496, offset 0, flags [DF], proto TCP (6), length 2542)
    127.0.0.1.10950 > 127.0.0.1.48136: Flags [P.], cksum 0x07e3 (incorrect -> 0x0034), seq 12192:14682, ack 900, win 512, options [nop,nop,TS val 273046983 ecr 273046973], length 2490
2022-04-05 20:32:44.480516 IP (tos 0x0, ttl 64, id 25516, offset 0, flags [DF], proto TCP (6), length 52)
    127.0.0.1.48136 > 127.0.0.1.10950: Flags [.], cksum 0xfe28 (incorrect -> 0x0bb3), seq 900, ack 14682, win 498, options [nop,nop,TS val 273046983 ecr 273046983], length 0
200, 6.901060581207275, 1.567551851272583