2022-04-05 11:04:54.958763 IP (tos 0x0, ttl 64, id 16593, offset 0, flags [DF], proto TCP (6), length 60)
    127.0.0.1.55624 > 127.0.0.1.11450: Flags [S], cksum 0xfe30 (incorrect -> 0x9484), seq 1479920977, win 65495, options [mss 65495,sackOK,TS val 238977461 ecr 0,nop,wscale 7], length 0
2022-04-05 11:04:54.958772 IP (tos 0x0, ttl 64, id 0, offset 0, flags [DF], proto TCP (6), length 60)
    127.0.0.1.11450 > 127.0.0.1.55624: Flags [S.], cksum 0xfe30 (incorrect -> 0x7bde), seq 1493118894, ack 1479920978, win 65483, options [mss 65495,sackOK,TS val 238977461 ecr 238977461,nop,wscale 7], length 0
2022-04-05 11:04:54.958780 IP (tos 0x0, ttl 64, id 16594, offset 0, flags [DF], proto TCP (6), length 52)
    127.0.0.1.55624 > 127.0.0.1.11450: Flags [.], cksum 0xfe28 (incorrect -> 0xa29a), seq 1, ack 1, win 512, options [nop,nop,TS val 238977461 ecr 238977461], length 0
2022-04-05 11:04:54.958872 IP (tos 0x0, ttl 64, id 16595, offset 0, flags [DF], proto TCP (6), length 55)
    127.0.0.1.55624 > 127.0.0.1.11450: Flags [P.], cksum 0xfe2b (incorrect -> 0x9d8e), seq 1:4, ack 1, win 512, options [nop,nop,TS val 238977461 ecr 238977461], length 3
2022-04-05 11:04:54.958886 IP (tos 0x0, ttl 64, id 62381, offset 0, flags [DF], proto TCP (6), length 52)
    127.0.0.1.11450 > 127.0.0.1.55624: Flags [.], cksum 0xfe28 (incorrect -> 0xa297), seq 1, ack 4, win 512, options [nop,nop,TS val 238977461 ecr 238977461], length 0
2022-04-05 11:04:54.958932 IP (tos 0x0, ttl 64, id 62382, offset 0, flags [DF], proto TCP (6), length 54)
    127.0.0.1.11450 > 127.0.0.1.55624: Flags [P.], cksum 0xfe2a (incorrect -> 0x9d8d), seq 1:3, ack 4, win 512, options [nop,nop,TS val 238977461 ecr 238977461], length 2
2022-04-05 11:04:54.958948 IP (tos 0x0, ttl 64, id 16596, offset 0, flags [DF], proto TCP (6), length 52)
    127.0.0.1.55624 > 127.0.0.1.11450: Flags [.], cksum 0xfe28 (incorrect -> 0xa295), seq 4, ack 3, win 512, options [nop,nop,TS val 238977461 ecr 238977461], length 0
2022-04-05 11:04:54.961998 IP (tos 0x0, ttl 64, id 16597, offset 0, flags [DF], proto TCP (6), length 62)
    127.0.0.1.55624 > 127.0.0.1.11450: Flags [P.], cksum 0xfe32 (incorrect -> 0xcae3), seq 4:14, ack 3, win 512, options [nop,nop,TS val 238977464 ecr 238977461], length 10
2022-04-05 11:04:54.962017 IP (tos 0x0, ttl 64, id 62383, offset 0, flags [DF], proto TCP (6), length 52)
    127.0.0.1.11450 > 127.0.0.1.55624: Flags [.], cksum 0xfe28 (incorrect -> 0xa285), seq 3, ack 14, win 512, options [nop,nop,TS val 238977464 ecr 238977464], length 0
2022-04-05 11:04:55.080648 IP (tos 0x0, ttl 64, id 62384, offset 0, flags [DF], proto TCP (6), length 62)
    127.0.0.1.11450 > 127.0.0.1.55624: Flags [P.], cksum 0xfe32 (incorrect -> 0x9cfb), seq 3:13, ack 14, win 512, options [nop,nop,TS val 238977583 ecr 238977464], length 10
2022-04-05 11:04:55.080658 IP (tos 0x0, ttl 64, id 16598, offset 0, flags [DF], proto TCP (6), length 52)
    127.0.0.1.55624 > 127.0.0.1.11450: Flags [.], cksum 0xfe28 (incorrect -> 0xa18d), seq 14, ack 13, win 512, options [nop,nop,TS val 238977583 ecr 238977583], length 0
2022-04-05 11:04:55.086071 IP (tos 0x0, ttl 64, id 16599, offset 0, flags [DF], proto TCP (6), length 569)
    127.0.0.1.55624 > 127.0.0.1.11450: Flags [P.], cksum 0x002e (incorrect -> 0xeb6b), seq 14:531, ack 13, win 512, options [nop,nop,TS val 238977589 ecr 238977583], length 517
2022-04-05 11:04:55.086081 IP (tos 0x0, ttl 64, id 62385, offset 0, flags [DF], proto TCP (6), length 52)
    127.0.0.1.11450 > 127.0.0.1.55624: Flags [.], cksum 0xfe28 (incorrect -> 0x9f80), seq 13, ack 531, win 508, options [nop,nop,TS val 238977589 ecr 238977589], length 0
200, 6.747745037078857, 0.8251774311065674