2022-04-05 06:16:14.979302 IP (tos 0x0, ttl 64, id 34139, offset 0, flags [DF], proto TCP (6), length 60)
    127.0.0.1.58320 > 127.0.0.1.11550: Flags [S], cksum 0xfe30 (incorrect -> 0xc5b2), seq 2405587927, win 65495, options [mss 65495,sackOK,TS val 777019350 ecr 0,nop,wscale 7], length 0
2022-04-05 06:16:14.979313 IP (tos 0x0, ttl 64, id 0, offset 0, flags [DF], proto TCP (6), length 60)
    127.0.0.1.11550 > 127.0.0.1.58320: Flags [S.], cksum 0xfe30 (incorrect -> 0xaacb), seq 2727471657, ack 2405587928, win 65483, options [mss 65495,sackOK,TS val 777019350 ecr 777019350,nop,wscale 7], length 0
2022-04-05 06:16:14.979321 IP (tos 0x0, ttl 64, id 34140, offset 0, flags [DF], proto TCP (6), length 52)
    127.0.0.1.58320 > 127.0.0.1.11550: Flags [.], cksum 0xfe28 (incorrect -> 0xd187), seq 1, ack 1, win 512, options [nop,nop,TS val 777019350 ecr 777019350], length 0
2022-04-05 06:16:14.979478 IP (tos 0x0, ttl 64, id 34141, offset 0, flags [DF], proto TCP (6), length 55)
    127.0.0.1.58320 > 127.0.0.1.11550: Flags [P.], cksum 0xfe2b (incorrect -> 0xcc7a), seq 1:4, ack 1, win 512, options [nop,nop,TS val 777019351 ecr 777019350], length 3
2022-04-05 06:16:14.979484 IP (tos 0x0, ttl 64, id 41905, offset 0, flags [DF], proto TCP (6), length 52)
    127.0.0.1.11550 > 127.0.0.1.58320: Flags [.], cksum 0xfe28 (incorrect -> 0xd182), seq 1, ack 4, win 512, options [nop,nop,TS val 777019351 ecr 777019351], length 0
2022-04-05 06:16:14.979507 IP (tos 0x0, ttl 64, id 41906, offset 0, flags [DF], proto TCP (6), length 54)
    127.0.0.1.11550 > 127.0.0.1.58320: Flags [P.], cksum 0xfe2a (incorrect -> 0xcc78), seq 1:3, ack 4, win 512, options [nop,nop,TS val 777019351 ecr 777019351], length 2
2022-04-05 06:16:14.979514 IP (tos 0x0, ttl 64, id 34142, offset 0, flags [DF], proto TCP (6), length 52)
    127.0.0.1.58320 > 127.0.0.1.11550: Flags [.], cksum 0xfe28 (incorrect -> 0xd180), seq 4, ack 3, win 512, options [nop,nop,TS val 777019351 ecr 777019351], length 0
2022-04-05 06:16:14.997213 IP (tos 0x0, ttl 64, id 34143, offset 0, flags [DF], proto TCP (6), length 62)
    127.0.0.1.58320 > 127.0.0.1.11550: Flags [P.], cksum 0xfe32 (incorrect -> 0xb7f5), seq 4:14, ack 3, win 512, options [nop,nop,TS val 777019368 ecr 777019351], length 10
2022-04-05 06:16:14.997224 IP (tos 0x0, ttl 64, id 41907, offset 0, flags [DF], proto TCP (6), length 52)
    127.0.0.1.11550 > 127.0.0.1.58320: Flags [.], cksum 0xfe28 (incorrect -> 0xd154), seq 3, ack 14, win 512, options [nop,nop,TS val 777019368 ecr 777019368], length 0
2022-04-05 06:16:15.253493 IP (tos 0x0, ttl 64, id 41908, offset 0, flags [DF], proto TCP (6), length 62)
    127.0.0.1.11550 > 127.0.0.1.58320: Flags [P.], cksum 0xfe32 (incorrect -> 0xcb40), seq 3:13, ack 14, win 512, options [nop,nop,TS val 777019625 ecr 777019368], length 10
2022-04-05 06:16:15.253500 IP (tos 0x0, ttl 64, id 34144, offset 0, flags [DF], proto TCP (6), length 52)
    127.0.0.1.58320 > 127.0.0.1.11550: Flags [.], cksum 0xfe28 (incorrect -> 0xcf48), seq 14, ack 13, win 512, options [nop,nop,TS val 777019625 ecr 777019625], length 0
2022-04-05 06:16:15.259340 IP (tos 0x0, ttl 64, id 34145, offset 0, flags [DF], proto TCP (6), length 569)
    127.0.0.1.58320 > 127.0.0.1.11550: Flags [P.], cksum 0x002e (incorrect -> 0x8a53), seq 14:531, ack 13, win 512, options [nop,nop,TS val 777019630 ecr 777019625], length 517
2022-04-05 06:16:15.259349 IP (tos 0x0, ttl 64, id 41909, offset 0, flags [DF], proto TCP (6), length 52)
    127.0.0.1.11550 > 127.0.0.1.58320: Flags [.], cksum 0xfe28 (incorrect -> 0xcd3d), seq 13, ack 531, win 508, options [nop,nop,TS val 777019630 ecr 777019630], length 0
2022-04-05 06:16:15.523777 IP (tos 0x0, ttl 64, id 41910, offset 0, flags [DF], proto TCP (6), length 3274)
    127.0.0.1.11550 > 127.0.0.1.58320: Flags [P.], cksum 0x0abf (incorrect -> 0x0004), seq 13:3235, ack 531, win 512, options [nop,nop,TS val 777019895 ecr 777019630], length 3222
2022-04-05 06:16:15.523786 IP (tos 0x0, ttl 64, id 34146, offset 0, flags [DF], proto TCP (6), length 52)
    127.0.0.1.58320 > 127.0.0.1.11550: Flags [.], cksum 0xfe28 (incorrect -> 0xbea2), seq 531, ack 3235, win 495, options [nop,nop,TS val 777019895 ecr 777019895], length 0
2022-04-05 06:16:15.524348 IP (tos 0x0, ttl 64, id 34147, offset 0, flags [DF], proto TCP (6), length 178)
    127.0.0.1.58320 > 127.0.0.1.11550: Flags [P.], cksum 0xfea6 (incorrect -> 0xfa24), seq 531:657, ack 3235, win 512, options [nop,nop,TS val 777019895 ecr 777019895], length 126
2022-04-05 06:16:15.524356 IP (tos 0x0, ttl 64, id 41911, offset 0, flags [DF], proto TCP (6), length 52)
    127.0.0.1.11550 > 127.0.0.1.58320: Flags [.], cksum 0xfe28 (incorrect -> 0xbe13), seq 3235, ack 657, win 512, options [nop,nop,TS val 777019895 ecr 777019895], length 0
2022-04-05 06:16:15.788608 IP (tos 0x0, ttl 64, id 41912, offset 0, flags [DF], proto TCP (6), length 310)
    127.0.0.1.11550 > 127.0.0.1.58320: Flags [P.], cksum 0xff2a (incorrect -> 0xf74c), seq 3235:3493, ack 657, win 512, options [nop,nop,TS val 777020160 ecr 777019895], length 258
2022-04-05 06:16:15.788617 IP (tos 0x0, ttl 64, id 34148, offset 0, flags [DF], proto TCP (6), length 52)
    127.0.0.1.58320 > 127.0.0.1.11550: Flags [.], cksum 0xfe28 (incorrect -> 0xbb01), seq 657, ack 3493, win 510, options [nop,nop,TS val 777020160 ecr 777020160], length 0
2022-04-05 06:16:15.789030 IP (tos 0x0, ttl 64, id 34149, offset 0, flags [DF], proto TCP (6), length 369)
    127.0.0.1.58320 > 127.0.0.1.11550: Flags [P.], cksum 0xff65 (incorrect -> 0x9b06), seq 657:974, ack 3493, win 512, options [nop,nop,TS val 777020160 ecr 777020160], length 317
2022-04-05 06:16:15.789037 IP (tos 0x0, ttl 64, id 41913, offset 0, flags [DF], proto TCP (6), length 52)
    127.0.0.1.11550 > 127.0.0.1.58320: Flags [.], cksum 0xfe28 (incorrect -> 0xb9c4), seq 3493, ack 974, win 510, options [nop,nop,TS val 777020160 ecr 777020160], length 0
2022-04-05 06:16:16.046852 IP (tos 0x0, ttl 64, id 41914, offset 0, flags [DF], proto TCP (6), length 510)
    127.0.0.1.11550 > 127.0.0.1.58320: Flags [P.], cksum 0xfff2 (incorrect -> 0xa7c6), seq 3493:3951, ack 974, win 512, options [nop,nop,TS val 777020418 ecr 777020160], length 458
2022-04-05 06:16:16.046871 IP (tos 0x0, ttl 64, id 41915, offset 0, flags [DF], proto TCP (6), length 52)
    127.0.0.1.11550 > 127.0.0.1.58320: Flags [F.], cksum 0xfe28 (incorrect -> 0xb6f5), seq 3951, ack 974, win 512, options [nop,nop,TS val 777020418 ecr 777020160], length 0
2022-04-05 06:16:16.047608 IP (tos 0x0, ttl 64, id 34150, offset 0, flags [DF], proto TCP (6), length 52)
    127.0.0.1.58320 > 127.0.0.1.11550: Flags [R.], cksum 0xfe28 (incorrect -> 0xb5ee), seq 974, ack 3952, win 512, options [nop,nop,TS val 777020419 ecr 777020418], length 0
2022-04-05 06:16:16.048612 IP (tos 0x0, ttl 64, id 32449, offset 0, flags [DF], proto TCP (6), length 60)
    127.0.0.1.58322 > 127.0.0.1.11550: Flags [S], cksum 0xfe30 (incorrect -> 0x1a5a), seq 846946279, win 65495, options [mss 65495,sackOK,TS val 777020420 ecr 0,nop,wscale 7], length 0
2022-04-05 06:16:16.048619 IP (tos 0x0, ttl 64, id 0, offset 0, flags [DF], proto TCP (6), length 60)
    127.0.0.1.11550 > 127.0.0.1.58322: Flags [S.], cksum 0xfe30 (incorrect -> 0x9de0), seq 2995861390, ack 846946280, win 65483, options [mss 65495,sackOK,TS val 777020420 ecr 777020420,nop,wscale 7], length 0
2022-04-05 06:16:16.048626 IP (tos 0x0, ttl 64, id 32450, offset 0, flags [DF], proto TCP (6), length 52)
    127.0.0.1.58322 > 127.0.0.1.11550: Flags [.], cksum 0xfe28 (incorrect -> 0xc49c), seq 1, ack 1, win 512, options [nop,nop,TS val 777020420 ecr 777020420], length 0
2022-04-05 06:16:16.048668 IP (tos 0x0, ttl 64, id 32451, offset 0, flags [DF], proto TCP (6), length 55)
    127.0.0.1.58322 > 127.0.0.1.11550: Flags [P.], cksum 0xfe2b (incorrect -> 0xbf90), seq 1:4, ack 1, win 512, options [nop,nop,TS val 777020420 ecr 777020420], length 3
2022-04-05 06:16:16.048671 IP (tos 0x0, ttl 64, id 3536, offset 0, flags [DF], proto TCP (6), length 52)
    127.0.0.1.11550 > 127.0.0.1.58322: Flags [.], cksum 0xfe28 (incorrect -> 0xc499), seq 1, ack 4, win 512, options [nop,nop,TS val 777020420 ecr 777020420], length 0
2022-04-05 06:16:16.048712 IP (tos 0x0, ttl 64, id 3537, offset 0, flags [DF], proto TCP (6), length 54)
    127.0.0.1.11550 > 127.0.0.1.58322: Flags [P.], cksum 0xfe2a (incorrect -> 0xbf8f), seq 1:3, ack 4, win 512, options [nop,nop,TS val 777020420 ecr 777020420], length 2
2022-04-05 06:16:16.048716 IP (tos 0x0, ttl 64, id 32452, offset 0, flags [DF], proto TCP (6), length 52)
    127.0.0.1.58322 > 127.0.0.1.11550: Flags [.], cksum 0xfe28 (incorrect -> 0xc497), seq 4, ack 3, win 512, options [nop,nop,TS val 777020420 ecr 777020420], length 0
2022-04-05 06:16:16.065711 IP (tos 0x0, ttl 64, id 32453, offset 0, flags [DF], proto TCP (6), length 62)
    127.0.0.1.58322 > 127.0.0.1.11550: Flags [P.], cksum 0xfe32 (incorrect -> 0xaa8a), seq 4:14, ack 3, win 512, options [nop,nop,TS val 777020437 ecr 777020420], length 10
2022-04-05 06:16:16.065719 IP (tos 0x0, ttl 64, id 3538, offset 0, flags [DF], proto TCP (6), length 52)
    127.0.0.1.11550 > 127.0.0.1.58322: Flags [.], cksum 0xfe28 (incorrect -> 0xc46b), seq 3, ack 14, win 512, options [nop,nop,TS val 777020437 ecr 777020437], length 0
2022-04-05 06:16:16.330503 IP (tos 0x0, ttl 64, id 3539, offset 0, flags [DF], proto TCP (6), length 62)
    127.0.0.1.11550 > 127.0.0.1.58322: Flags [P.], cksum 0xfe32 (incorrect -> 0xbe4f), seq 3:13, ack 14, win 512, options [nop,nop,TS val 777020702 ecr 777020437], length 10
2022-04-05 06:16:16.330512 IP (tos 0x0, ttl 64, id 32454, offset 0, flags [DF], proto TCP (6), length 52)
    127.0.0.1.58322 > 127.0.0.1.11550: Flags [.], cksum 0xfe28 (incorrect -> 0xc24f), seq 14, ack 13, win 512, options [nop,nop,TS val 777020702 ecr 777020702], length 0
2022-04-05 06:16:16.335724 IP (tos 0x0, ttl 64, id 32455, offset 0, flags [DF], proto TCP (6), length 569)
    127.0.0.1.58322 > 127.0.0.1.11550: Flags [P.], cksum 0x002e (incorrect -> 0xb0fb), seq 14:531, ack 13, win 512, options [nop,nop,TS val 777020707 ecr 777020702], length 517
2022-04-05 06:16:16.335733 IP (tos 0x0, ttl 64, id 3540, offset 0, flags [DF], proto TCP (6), length 52)
    127.0.0.1.11550 > 127.0.0.1.58322: Flags [.], cksum 0xfe28 (incorrect -> 0xc044), seq 13, ack 531, win 508, options [nop,nop,TS val 777020707 ecr 777020707], length 0
2022-04-05 06:16:16.611280 IP (tos 0x0, ttl 64, id 3541, offset 0, flags [DF], proto TCP (6), length 3342)
    127.0.0.1.11550 > 127.0.0.1.58322: Flags [P.], cksum 0x0b03 (incorrect -> 0xdd05), seq 13:3303, ack 531, win 512, options [nop,nop,TS val 777020982 ecr 777020707], length 3290
2022-04-05 06:16:16.611287 IP (tos 0x0, ttl 64, id 32456, offset 0, flags [DF], proto TCP (6), length 52)
    127.0.0.1.58322 > 127.0.0.1.11550: Flags [.], cksum 0xfe28 (incorrect -> 0xb151), seq 531, ack 3303, win 495, options [nop,nop,TS val 777020982 ecr 777020982], length 0
2022-04-05 06:16:16.611821 IP (tos 0x0, ttl 64, id 32457, offset 0, flags [DF], proto TCP (6), length 178)
    127.0.0.1.58322 > 127.0.0.1.11550: Flags [P.], cksum 0xfea6 (incorrect -> 0xf668), seq 531:657, ack 3303, win 512, options [nop,nop,TS val 777020983 ecr 777020982], length 126
2022-04-05 06:16:16.611829 IP (tos 0x0, ttl 64, id 3542, offset 0, flags [DF], proto TCP (6), length 52)
    127.0.0.1.11550 > 127.0.0.1.58322: Flags [.], cksum 0xfe28 (incorrect -> 0xb0c0), seq 3303, ack 657, win 512, options [nop,nop,TS val 777020983 ecr 777020983], length 0
2022-04-05 06:16:16.900322 IP (tos 0x0, ttl 64, id 3543, offset 0, flags [DF], proto TCP (6), length 310)
    127.0.0.1.11550 > 127.0.0.1.58322: Flags [P.], cksum 0xff2a (incorrect -> 0x8178), seq 3303:3561, ack 657, win 512, options [nop,nop,TS val 777021271 ecr 777020983], length 258
2022-04-05 06:16:16.900331 IP (tos 0x0, ttl 64, id 32458, offset 0, flags [DF], proto TCP (6), length 52)
    127.0.0.1.58322 > 127.0.0.1.11550: Flags [.], cksum 0xfe28 (incorrect -> 0xad80), seq 657, ack 3561, win 510, options [nop,nop,TS val 777021271 ecr 777021271], length 0
2022-04-05 06:16:16.900702 IP (tos 0x0, ttl 64, id 32459, offset 0, flags [DF], proto TCP (6), length 365)
    127.0.0.1.58322 > 127.0.0.1.11550: Flags [P.], cksum 0xff61 (incorrect -> 0x0069), seq 657:970, ack 3561, win 512, options [nop,nop,TS val 777021272 ecr 777021271], length 313
2022-04-05 06:16:16.900710 IP (tos 0x0, ttl 64, id 3544, offset 0, flags [DF], proto TCP (6), length 52)
    127.0.0.1.11550 > 127.0.0.1.58322: Flags [.], cksum 0xfe28 (incorrect -> 0xac45), seq 3561, ack 970, win 510, options [nop,nop,TS val 777021272 ecr 777021272], length 0
200, 8.08356261253357, 2.743419647216797