2022-04-05 19:20:00.281876 IP (tos 0x0, ttl 64, id 51044, offset 0, flags [DF], proto TCP (6), length 60)
    127.0.0.1.40828 > 127.0.0.1.11650: Flags [S], cksum 0xfe30 (incorrect -> 0x2d1c), seq 1618091857, win 65495, options [mss 65495,sackOK,TS val 268682784 ecr 0,nop,wscale 7], length 0
2022-04-05 19:20:00.281892 IP (tos 0x0, ttl 64, id 0, offset 0, flags [DF], proto TCP (6), length 60)
    127.0.0.1.11650 > 127.0.0.1.40828: Flags [S.], cksum 0xfe30 (incorrect -> 0x2f8e), seq 1265753075, ack 1618091858, win 65483, options [mss 65495,sackOK,TS val 268682784 ecr 268682784,nop,wscale 7], length 0
2022-04-05 19:20:00.281905 IP (tos 0x0, ttl 64, id 51045, offset 0, flags [DF], proto TCP (6), length 52)
    127.0.0.1.40828 > 127.0.0.1.11650: Flags [.], cksum 0xfe28 (incorrect -> 0x564a), seq 1, ack 1, win 512, options [nop,nop,TS val 268682784 ecr 268682784], length 0
2022-04-05 19:20:00.282020 IP (tos 0x0, ttl 64, id 51046, offset 0, flags [DF], proto TCP (6), length 55)
    127.0.0.1.40828 > 127.0.0.1.11650: Flags [P.], cksum 0xfe2b (incorrect -> 0x513e), seq 1:4, ack 1, win 512, options [nop,nop,TS val 268682784 ecr 268682784], length 3
2022-04-05 19:20:00.282040 IP (tos 0x0, ttl 64, id 28432, offset 0, flags [DF], proto TCP (6), length 52)
    127.0.0.1.11650 > 127.0.0.1.40828: Flags [.], cksum 0xfe28 (incorrect -> 0x5647), seq 1, ack 4, win 512, options [nop,nop,TS val 268682784 ecr 268682784], length 0
2022-04-05 19:20:00.282085 IP (tos 0x0, ttl 64, id 28433, offset 0, flags [DF], proto TCP (6), length 54)
    127.0.0.1.11650 > 127.0.0.1.40828: Flags [P.], cksum 0xfe2a (incorrect -> 0x513c), seq 1:3, ack 4, win 512, options [nop,nop,TS val 268682785 ecr 268682784], length 2
2022-04-05 19:20:00.282100 IP (tos 0x0, ttl 64, id 51047, offset 0, flags [DF], proto TCP (6), length 52)
    127.0.0.1.40828 > 127.0.0.1.11650: Flags [.], cksum 0xfe28 (incorrect -> 0x5643), seq 4, ack 3, win 512, options [nop,nop,TS val 268682785 ecr 268682785], length 0
2022-04-05 19:20:00.283588 IP (tos 0x0, ttl 64, id 51048, offset 0, flags [DF], proto TCP (6), length 62)
    127.0.0.1.40828 > 127.0.0.1.11650: Flags [P.], cksum 0xfe32 (incorrect -> 0xbbfd), seq 4:14, ack 3, win 512, options [nop,nop,TS val 268682786 ecr 268682785], length 10
2022-04-05 19:20:00.283598 IP (tos 0x0, ttl 64, id 28434, offset 0, flags [DF], proto TCP (6), length 52)
    127.0.0.1.11650 > 127.0.0.1.40828: Flags [.], cksum 0xfe28 (incorrect -> 0x5637), seq 3, ack 14, win 512, options [nop,nop,TS val 268682786 ecr 268682786], length 0
2022-04-05 19:20:00.360333 IP (tos 0x0, ttl 64, id 28435, offset 0, flags [DF], proto TCP (6), length 62)
    127.0.0.1.11650 > 127.0.0.1.40828: Flags [P.], cksum 0xfe32 (incorrect -> 0x50d7), seq 3:13, ack 14, win 512, options [nop,nop,TS val 268682863 ecr 268682786], length 10
2022-04-05 19:20:00.360343 IP (tos 0x0, ttl 64, id 51049, offset 0, flags [DF], proto TCP (6), length 52)
    127.0.0.1.40828 > 127.0.0.1.11650: Flags [.], cksum 0xfe28 (incorrect -> 0x5593), seq 14, ack 13, win 512, options [nop,nop,TS val 268682863 ecr 268682863], length 0
2022-04-05 19:20:00.366258 IP (tos 0x0, ttl 64, id 51050, offset 0, flags [DF], proto TCP (6), length 569)
    127.0.0.1.40828 > 127.0.0.1.11650: Flags [P.], cksum 0x002e (incorrect -> 0x136b), seq 14:531, ack 13, win 512, options [nop,nop,TS val 268682869 ecr 268682863], length 517
2022-04-05 19:20:00.366271 IP (tos 0x0, ttl 64, id 28436, offset 0, flags [DF], proto TCP (6), length 52)
    127.0.0.1.11650 > 127.0.0.1.40828: Flags [.], cksum 0xfe28 (incorrect -> 0x5386), seq 13, ack 531, win 508, options [nop,nop,TS val 268682869 ecr 268682869], length 0
2022-04-05 19:20:00.435749 IP (tos 0x0, ttl 64, id 28437, offset 0, flags [DF], proto TCP (6), length 2804)
    127.0.0.1.11650 > 127.0.0.1.40828: Flags [P.], cksum 0x08e9 (incorrect -> 0x357d), seq 13:2765, ack 531, win 512, options [nop,nop,TS val 268682938 ecr 268682869], length 2752
2022-04-05 19:20:00.435759 IP (tos 0x0, ttl 64, id 51051, offset 0, flags [DF], proto TCP (6), length 52)
    127.0.0.1.40828 > 127.0.0.1.11650: Flags [.], cksum 0xfe28 (incorrect -> 0x4847), seq 531, ack 2765, win 497, options [nop,nop,TS val 268682938 ecr 268682938], length 0
2022-04-05 19:20:00.437423 IP (tos 0x0, ttl 64, id 51052, offset 0, flags [DF], proto TCP (6), length 132)
    127.0.0.1.40828 > 127.0.0.1.11650: Flags [P.], cksum 0xfe78 (incorrect -> 0xc8b9), seq 531:611, ack 2765, win 512, options [nop,nop,TS val 268682940 ecr 268682938], length 80
2022-04-05 19:20:00.437433 IP (tos 0x0, ttl 64, id 28438, offset 0, flags [DF], proto TCP (6), length 52)
    127.0.0.1.11650 > 127.0.0.1.40828: Flags [.], cksum 0xfe28 (incorrect -> 0x47e4), seq 2765, ack 611, win 512, options [nop,nop,TS val 268682940 ecr 268682940], length 0
2022-04-05 19:20:00.437801 IP (tos 0x0, ttl 64, id 51053, offset 0, flags [DF], proto TCP (6), length 365)
    127.0.0.1.40828 > 127.0.0.1.11650: Flags [P.], cksum 0xff61 (incorrect -> 0x6e53), seq 611:924, ack 2765, win 512, options [nop,nop,TS val 268682940 ecr 268682940], length 313
2022-04-05 19:20:00.437811 IP (tos 0x0, ttl 64, id 28439, offset 0, flags [DF], proto TCP (6), length 52)
    127.0.0.1.11650 > 127.0.0.1.40828: Flags [.], cksum 0xfe28 (incorrect -> 0x46ad), seq 2765, ack 924, win 510, options [nop,nop,TS val 268682940 ecr 268682940], length 0
200, 3.8086771965026855, 0.936668872833252