2022-04-05 06:39:09.374340 IP (tos 0x0, ttl 64, id 43555, offset 0, flags [DF], proto TCP (6), length 60)
    127.0.0.1.50266 > 127.0.0.1.10250: Flags [S], cksum 0xfe30 (incorrect -> 0x6a23), seq 692865335, win 65495, options [mss 65495,sackOK,TS val 778393745 ecr 0,nop,wscale 7], length 0
2022-04-05 06:39:09.374353 IP (tos 0x0, ttl 64, id 0, offset 0, flags [DF], proto TCP (6), length 60)
    127.0.0.1.10250 > 127.0.0.1.50266: Flags [S.], cksum 0xfe30 (incorrect -> 0x9a86), seq 2372909873, ack 692865336, win 65483, options [mss 65495,sackOK,TS val 778393745 ecr 778393745,nop,wscale 7], length 0
2022-04-05 06:39:09.374364 IP (tos 0x0, ttl 64, id 43556, offset 0, flags [DF], proto TCP (6), length 52)
    127.0.0.1.50266 > 127.0.0.1.10250: Flags [.], cksum 0xfe28 (incorrect -> 0xc142), seq 1, ack 1, win 512, options [nop,nop,TS val 778393745 ecr 778393745], length 0
2022-04-05 06:39:09.374492 IP (tos 0x0, ttl 64, id 43557, offset 0, flags [DF], proto TCP (6), length 55)
    127.0.0.1.50266 > 127.0.0.1.10250: Flags [P.], cksum 0xfe2b (incorrect -> 0xbc35), seq 1:4, ack 1, win 512, options [nop,nop,TS val 778393746 ecr 778393745], length 3
2022-04-05 06:39:09.374504 IP (tos 0x0, ttl 64, id 49582, offset 0, flags [DF], proto TCP (6), length 52)
    127.0.0.1.10250 > 127.0.0.1.50266: Flags [.], cksum 0xfe28 (incorrect -> 0xc13d), seq 1, ack 4, win 512, options [nop,nop,TS val 778393746 ecr 778393746], length 0
2022-04-05 06:39:09.374556 IP (tos 0x0, ttl 64, id 49583, offset 0, flags [DF], proto TCP (6), length 54)
    127.0.0.1.10250 > 127.0.0.1.50266: Flags [P.], cksum 0xfe2a (incorrect -> 0xbc33), seq 1:3, ack 4, win 512, options [nop,nop,TS val 778393746 ecr 778393746], length 2
2022-04-05 06:39:09.374576 IP (tos 0x0, ttl 64, id 43558, offset 0, flags [DF], proto TCP (6), length 52)
    127.0.0.1.50266 > 127.0.0.1.10250: Flags [.], cksum 0xfe28 (incorrect -> 0xc13b), seq 4, ack 3, win 512, options [nop,nop,TS val 778393746 ecr 778393746], length 0
2022-04-05 06:39:09.389544 IP (tos 0x0, ttl 64, id 43559, offset 0, flags [DF], proto TCP (6), length 62)
    127.0.0.1.50266 > 127.0.0.1.10250: Flags [P.], cksum 0xfe32 (incorrect -> 0x2796), seq 4:14, ack 3, win 512, options [nop,nop,TS val 778393761 ecr 778393746], length 10
2022-04-05 06:39:09.389555 IP (tos 0x0, ttl 64, id 49584, offset 0, flags [DF], proto TCP (6), length 52)
    127.0.0.1.10250 > 127.0.0.1.50266: Flags [.], cksum 0xfe28 (incorrect -> 0xc113), seq 3, ack 14, win 512, options [nop,nop,TS val 778393761 ecr 778393761], length 0
2022-04-05 06:39:09.491756 IP (tos 0x0, ttl 64, id 49585, offset 0, flags [DF], proto TCP (6), length 62)
    127.0.0.1.10250 > 127.0.0.1.50266: Flags [P.], cksum 0xfe32 (incorrect -> 0xbb9a), seq 3:13, ack 14, win 512, options [nop,nop,TS val 778393863 ecr 778393761], length 10
2022-04-05 06:39:09.491768 IP (tos 0x0, ttl 64, id 43560, offset 0, flags [DF], proto TCP (6), length 52)
    127.0.0.1.50266 > 127.0.0.1.10250: Flags [.], cksum 0xfe28 (incorrect -> 0xc03d), seq 14, ack 13, win 512, options [nop,nop,TS val 778393863 ecr 778393863], length 0
2022-04-05 06:39:09.498016 IP (tos 0x0, ttl 64, id 43561, offset 0, flags [DF], proto TCP (6), length 569)
    127.0.0.1.50266 > 127.0.0.1.10250: Flags [P.], cksum 0x002e (incorrect -> 0x3025), seq 14:531, ack 13, win 512, options [nop,nop,TS val 778393869 ecr 778393863], length 517
2022-04-05 06:39:09.498027 IP (tos 0x0, ttl 64, id 49586, offset 0, flags [DF], proto TCP (6), length 52)
    127.0.0.1.10250 > 127.0.0.1.50266: Flags [.], cksum 0xfe28 (incorrect -> 0xbe30), seq 13, ack 531, win 508, options [nop,nop,TS val 778393869 ecr 778393869], length 0
200, 4.853975296020508, 0.9408750534057617