2022-04-05 21:55:25.630008 IP (tos 0x0, ttl 64, id 38400, offset 0, flags [DF], proto TCP (6), length 60)
    127.0.0.1.54308 > 127.0.0.1.11050: Flags [S], cksum 0xfe30 (incorrect -> 0xb532), seq 745033026, win 65495, options [mss 65495,sackOK,TS val 278008132 ecr 0,nop,wscale 7], length 0
2022-04-05 21:55:25.630019 IP (tos 0x0, ttl 64, id 0, offset 0, flags [DF], proto TCP (6), length 60)
    127.0.0.1.11050 > 127.0.0.1.54308: Flags [S.], cksum 0xfe30 (incorrect -> 0x8982), seq 145752357, ack 745033027, win 65483, options [mss 65495,sackOK,TS val 278008132 ecr 278008132,nop,wscale 7], length 0
2022-04-05 21:55:25.630028 IP (tos 0x0, ttl 64, id 38401, offset 0, flags [DF], proto TCP (6), length 52)
    127.0.0.1.54308 > 127.0.0.1.11050: Flags [.], cksum 0xfe28 (incorrect -> 0xb03e), seq 1, ack 1, win 512, options [nop,nop,TS val 278008132 ecr 278008132], length 0
2022-04-05 21:55:25.630211 IP (tos 0x0, ttl 64, id 38402, offset 0, flags [DF], proto TCP (6), length 55)
    127.0.0.1.54308 > 127.0.0.1.11050: Flags [P.], cksum 0xfe2b (incorrect -> 0xab31), seq 1:4, ack 1, win 512, options [nop,nop,TS val 278008133 ecr 278008132], length 3
2022-04-05 21:55:25.630219 IP (tos 0x0, ttl 64, id 53531, offset 0, flags [DF], proto TCP (6), length 52)
    127.0.0.1.11050 > 127.0.0.1.54308: Flags [.], cksum 0xfe28 (incorrect -> 0xb039), seq 1, ack 4, win 512, options [nop,nop,TS val 278008133 ecr 278008133], length 0
2022-04-05 21:55:25.630241 IP (tos 0x0, ttl 64, id 53532, offset 0, flags [DF], proto TCP (6), length 54)
    127.0.0.1.11050 > 127.0.0.1.54308: Flags [P.], cksum 0xfe2a (incorrect -> 0xab2f), seq 1:3, ack 4, win 512, options [nop,nop,TS val 278008133 ecr 278008133], length 2
2022-04-05 21:55:25.630249 IP (tos 0x0, ttl 64, id 38403, offset 0, flags [DF], proto TCP (6), length 52)
    127.0.0.1.54308 > 127.0.0.1.11050: Flags [.], cksum 0xfe28 (incorrect -> 0xb037), seq 4, ack 3, win 512, options [nop,nop,TS val 278008133 ecr 278008133], length 0
2022-04-05 21:55:25.632258 IP (tos 0x0, ttl 64, id 38404, offset 0, flags [DF], proto TCP (6), length 62)
    127.0.0.1.54308 > 127.0.0.1.11050: Flags [P.], cksum 0xfe32 (incorrect -> 0x0673), seq 4:14, ack 3, win 512, options [nop,nop,TS val 278008135 ecr 278008133], length 10
2022-04-05 21:55:25.632278 IP (tos 0x0, ttl 64, id 53533, offset 0, flags [DF], proto TCP (6), length 52)
    127.0.0.1.11050 > 127.0.0.1.54308: Flags [.], cksum 0xfe28 (incorrect -> 0xb029), seq 3, ack 14, win 512, options [nop,nop,TS val 278008135 ecr 278008135], length 0
2022-04-05 21:55:25.842101 IP (tos 0x0, ttl 64, id 53534, offset 0, flags [DF], proto TCP (6), length 62)
    127.0.0.1.11050 > 127.0.0.1.54308: Flags [P.], cksum 0xfe32 (incorrect -> 0xaa44), seq 3:13, ack 14, win 512, options [nop,nop,TS val 278008345 ecr 278008135], length 10
2022-04-05 21:55:25.842113 IP (tos 0x0, ttl 64, id 38405, offset 0, flags [DF], proto TCP (6), length 52)
    127.0.0.1.54308 > 127.0.0.1.11050: Flags [.], cksum 0xfe28 (incorrect -> 0xae7b), seq 14, ack 13, win 512, options [nop,nop,TS val 278008345 ecr 278008345], length 0
2022-04-05 21:55:25.848938 IP (tos 0x0, ttl 64, id 38406, offset 0, flags [DF], proto TCP (6), length 569)
    127.0.0.1.54308 > 127.0.0.1.11050: Flags [P.], cksum 0x002e (incorrect -> 0x33bc), seq 14:531, ack 13, win 512, options [nop,nop,TS val 278008351 ecr 278008345], length 517
2022-04-05 21:55:25.848944 IP (tos 0x0, ttl 64, id 53535, offset 0, flags [DF], proto TCP (6), length 52)
    127.0.0.1.11050 > 127.0.0.1.54308: Flags [.], cksum 0xfe28 (incorrect -> 0xac6e), seq 13, ack 531, win 508, options [nop,nop,TS val 278008351 ecr 278008351], length 0
2022-04-05 21:55:26.072859 IP (tos 0x0, ttl 64, id 53536, offset 0, flags [DF], proto TCP (6), length 3538)
    127.0.0.1.11050 > 127.0.0.1.54308: Flags [P.], cksum 0x0bc7 (incorrect -> 0x9031), seq 13:3499, ack 531, win 512, options [nop,nop,TS val 278008575 ecr 278008351], length 3486
2022-04-05 21:55:26.072878 IP (tos 0x0, ttl 64, id 38407, offset 0, flags [DF], proto TCP (6), length 52)
    127.0.0.1.54308 > 127.0.0.1.11050: Flags [.], cksum 0xfe28 (incorrect -> 0x9d1e), seq 531, ack 3499, win 494, options [nop,nop,TS val 278008575 ecr 278008575], length 0
2022-04-05 21:55:26.111298 IP (tos 0x0, ttl 64, id 53537, offset 0, flags [DF], proto TCP (6), length 659)
    127.0.0.1.11050 > 127.0.0.1.54308: Flags [P.], cksum 0x0088 (incorrect -> 0xe69b), seq 3499:4106, ack 531, win 512, options [nop,nop,TS val 278008614 ecr 278008575], length 607
2022-04-05 21:55:26.111309 IP (tos 0x0, ttl 64, id 38408, offset 0, flags [DF], proto TCP (6), length 52)
    127.0.0.1.54308 > 127.0.0.1.11050: Flags [.], cksum 0xfe28 (incorrect -> 0x9a66), seq 531, ack 4106, win 505, options [nop,nop,TS val 278008614 ecr 278008614], length 0
2022-04-05 21:55:26.111841 IP (tos 0x0, ttl 64, id 38409, offset 0, flags [DF], proto TCP (6), length 132)
    127.0.0.1.54308 > 127.0.0.1.11050: Flags [P.], cksum 0xfe78 (incorrect -> 0x4425), seq 531:611, ack 4106, win 512, options [nop,nop,TS val 278008614 ecr 278008614], length 80
2022-04-05 21:55:26.111849 IP (tos 0x0, ttl 64, id 53538, offset 0, flags [DF], proto TCP (6), length 52)
    127.0.0.1.11050 > 127.0.0.1.54308: Flags [.], cksum 0xfe28 (incorrect -> 0x9a0f), seq 4106, ack 611, win 512, options [nop,nop,TS val 278008614 ecr 278008614], length 0
2022-04-05 21:55:26.112390 IP (tos 0x0, ttl 64, id 38410, offset 0, flags [DF], proto TCP (6), length 332)
    127.0.0.1.54308 > 127.0.0.1.11050: Flags [P.], cksum 0xff40 (incorrect -> 0x9c27), seq 611:891, ack 4106, win 512, options [nop,nop,TS val 278008615 ecr 278008614], length 280
2022-04-05 21:55:26.112398 IP (tos 0x0, ttl 64, id 53539, offset 0, flags [DF], proto TCP (6), length 52)
    127.0.0.1.11050 > 127.0.0.1.54308: Flags [.], cksum 0xfe28 (incorrect -> 0x98f7), seq 4106, ack 891, win 510, options [nop,nop,TS val 278008615 ecr 278008615], length 0
2022-04-05 21:55:26.328497 IP (tos 0x0, ttl 64, id 53540, offset 0, flags [DF], proto TCP (6), length 594)
    127.0.0.1.11050 > 127.0.0.1.54308: Flags [P.], cksum 0x0047 (incorrect -> 0xb757), seq 4106:4648, ack 891, win 512, options [nop,nop,TS val 278008831 ecr 278008615], length 542
2022-04-05 21:55:26.328510 IP (tos 0x0, ttl 64, id 38411, offset 0, flags [DF], proto TCP (6), length 52)
    127.0.0.1.54308 > 127.0.0.1.11050: Flags [.], cksum 0xfe28 (incorrect -> 0x952b), seq 891, ack 4648, win 508, options [nop,nop,TS val 278008831 ecr 278008831], length 0
2022-04-05 21:55:26.431536 IP (tos 0x0, ttl 64, id 53541, offset 0, flags [DF], proto TCP (6), length 3538)
    127.0.0.1.11050 > 127.0.0.1.54308: Flags [P.], cksum 0x0bc7 (incorrect -> 0x091a), seq 4648:8134, ack 891, win 512, options [nop,nop,TS val 278008934 ecr 278008831], length 3486
2022-04-05 21:55:26.431545 IP (tos 0x0, ttl 64, id 38412, offset 0, flags [DF], proto TCP (6), length 52)
    127.0.0.1.54308 > 127.0.0.1.11050: Flags [.], cksum 0xfe28 (incorrect -> 0x86cd), seq 891, ack 8134, win 494, options [nop,nop,TS val 278008934 ecr 278008934], length 0
2022-04-05 21:55:26.459652 IP (tos 0x0, ttl 64, id 53542, offset 0, flags [DF], proto TCP (6), length 3040)
    127.0.0.1.11050 > 127.0.0.1.54308: Flags [P.], cksum 0x09d5 (incorrect -> 0xab94), seq 8134:11122, ack 891, win 512, options [nop,nop,TS val 278008962 ecr 278008934], length 2988
2022-04-05 21:55:26.459659 IP (tos 0x0, ttl 64, id 38413, offset 0, flags [DF], proto TCP (6), length 52)
    127.0.0.1.54308 > 127.0.0.1.11050: Flags [.], cksum 0xfe28 (incorrect -> 0x7ae7), seq 891, ack 11122, win 496, options [nop,nop,TS val 278008962 ecr 278008962], length 0
2022-04-05 21:55:26.471974 IP (tos 0x0, ttl 64, id 53543, offset 0, flags [DF], proto TCP (6), length 4036)
    127.0.0.1.11050 > 127.0.0.1.54308: Flags [P.], cksum 0x0db9 (incorrect -> 0xfd81), seq 11122:15106, ack 891, win 512, options [nop,nop,TS val 278008974 ecr 278008962], length 3984
2022-04-05 21:55:26.471980 IP (tos 0x0, ttl 64, id 38414, offset 0, flags [DF], proto TCP (6), length 52)
    127.0.0.1.54308 > 127.0.0.1.11050: Flags [.], cksum 0xfe28 (incorrect -> 0x6b43), seq 891, ack 15106, win 492, options [nop,nop,TS val 278008974 ecr 278008974], length 0
2022-04-05 21:55:26.476750 IP (tos 0x0, ttl 64, id 53544, offset 0, flags [DF], proto TCP (6), length 1048)
    127.0.0.1.11050 > 127.0.0.1.54308: Flags [P.], cksum 0x020d (incorrect -> 0x8d4c), seq 15106:16102, ack 891, win 512, options [nop,nop,TS val 278008979 ecr 278008974], length 996
2022-04-05 21:55:26.476755 IP (tos 0x0, ttl 64, id 38415, offset 0, flags [DF], proto TCP (6), length 52)
    127.0.0.1.54308 > 127.0.0.1.11050: Flags [.], cksum 0xfe28 (incorrect -> 0x6749), seq 891, ack 16102, win 504, options [nop,nop,TS val 278008979 ecr 278008979], length 0
2022-04-05 21:55:26.505221 IP (tos 0x0, ttl 64, id 53545, offset 0, flags [DF], proto TCP (6), length 3538)
    127.0.0.1.11050 > 127.0.0.1.54308: Flags [P.], cksum 0x0bc7 (incorrect -> 0x4d23), seq 16102:19588, ack 891, win 512, options [nop,nop,TS val 278009008 ecr 278008979], length 3486
2022-04-05 21:55:26.505227 IP (tos 0x0, ttl 64, id 38416, offset 0, flags [DF], proto TCP (6), length 52)
    127.0.0.1.54308 > 127.0.0.1.11050: Flags [.], cksum 0xfe28 (incorrect -> 0x597b), seq 891, ack 19588, win 494, options [nop,nop,TS val 278009008 ecr 278009008], length 0
2022-04-05 21:55:26.505359 IP (tos 0x0, ttl 64, id 53546, offset 0, flags [DF], proto TCP (6), length 3130)
    127.0.0.1.11050 > 127.0.0.1.54308: Flags [P.], cksum 0x0a2f (incorrect -> 0x140f), seq 19588:22666, ack 891, win 512, options [nop,nop,TS val 278009008 ecr 278009008], length 3078
2022-04-05 21:55:26.505364 IP (tos 0x0, ttl 64, id 38417, offset 0, flags [DF], proto TCP (6), length 52)
    127.0.0.1.54308 > 127.0.0.1.11050: Flags [.], cksum 0xfe28 (incorrect -> 0x4d74), seq 891, ack 22666, win 495, options [nop,nop,TS val 278009008 ecr 278009008], length 0
2022-04-05 21:55:26.507537 IP (tos 0x0, ttl 64, id 53547, offset 0, flags [DF], proto TCP (6), length 3040)
    127.0.0.1.11050 > 127.0.0.1.54308: Flags [P.], cksum 0x09d5 (incorrect -> 0xa418), seq 22666:25654, ack 891, win 512, options [nop,nop,TS val 278009010 ecr 278009008], length 2988
2022-04-05 21:55:26.507544 IP (tos 0x0, ttl 64, id 38418, offset 0, flags [DF], proto TCP (6), length 52)
    127.0.0.1.54308 > 127.0.0.1.11050: Flags [.], cksum 0xfe28 (incorrect -> 0x41c3), seq 891, ack 25654, win 496, options [nop,nop,TS val 278009010 ecr 278009010], length 0
2022-04-05 21:55:26.526456 IP (tos 0x0, ttl 64, id 53548, offset 0, flags [DF], proto TCP (6), length 2406)
    127.0.0.1.11050 > 127.0.0.1.54308: Flags [P.], cksum 0x075b (incorrect -> 0xe22d), seq 25654:28008, ack 891, win 512, options [nop,nop,TS val 278009029 ecr 278009010], length 2354
2022-04-05 21:55:26.526468 IP (tos 0x0, ttl 64, id 38419, offset 0, flags [DF], proto TCP (6), length 52)
    127.0.0.1.54308 > 127.0.0.1.11050: Flags [.], cksum 0xfe28 (incorrect -> 0x3869), seq 891, ack 28008, win 498, options [nop,nop,TS val 278009029 ecr 278009029], length 0
2022-04-05 21:55:26.545098 IP (tos 0x0, ttl 64, id 53549, offset 0, flags [DF], proto TCP (6), length 2972)
    127.0.0.1.11050 > 127.0.0.1.54308: Flags [P.], cksum 0x0991 (incorrect -> 0xf576), seq 28008:30928, ack 891, win 512, options [nop,nop,TS val 278009048 ecr 278009029], length 2920
2022-04-05 21:55:26.545110 IP (tos 0x0, ttl 64, id 38420, offset 0, flags [DF], proto TCP (6), length 52)
    127.0.0.1.54308 > 127.0.0.1.11050: Flags [.], cksum 0xfe28 (incorrect -> 0x2cdd), seq 891, ack 30928, win 496, options [nop,nop,TS val 278009048 ecr 278009048], length 0
2022-04-05 21:55:26.565133 IP (tos 0x0, ttl 64, id 53550, offset 0, flags [DF], proto TCP (6), length 2972)
    127.0.0.1.11050 > 127.0.0.1.54308: Flags [P.], cksum 0x0991 (incorrect -> 0x97d0), seq 30928:33848, ack 891, win 512, options [nop,nop,TS val 278009068 ecr 278009048], length 2920
2022-04-05 21:55:26.606662 IP (tos 0x0, ttl 64, id 38421, offset 0, flags [DF], proto TCP (6), length 52)
    127.0.0.1.54308 > 127.0.0.1.11050: Flags [.], cksum 0xfe28 (incorrect -> 0x2114), seq 891, ack 33848, win 512, options [nop,nop,TS val 278009109 ecr 278009068], length 0
2022-04-05 21:55:26.606675 IP (tos 0x0, ttl 64, id 53551, offset 0, flags [DF], proto TCP (6), length 13724)
    127.0.0.1.11050 > 127.0.0.1.54308: Flags [P.], cksum 0x3391 (incorrect -> 0xcb0f), seq 33848:47520, ack 891, win 512, options [nop,nop,TS val 278009109 ecr 278009109], length 13672
2022-04-05 21:55:26.650663 IP (tos 0x0, ttl 64, id 38422, offset 0, flags [DF], proto TCP (6), length 52)
    127.0.0.1.54308 > 127.0.0.1.11050: Flags [.], cksum 0xfe28 (incorrect -> 0xeb56), seq 891, ack 47520, win 512, options [nop,nop,TS val 278009153 ecr 278009109], length 0
2022-04-05 21:55:26.650673 IP (tos 0x0, ttl 64, id 53552, offset 0, flags [DF], proto TCP (6), length 12230)
    127.0.0.1.11050 > 127.0.0.1.54308: Flags [P.], cksum 0x2dbb (incorrect -> 0x381f), seq 47520:59698, ack 891, win 512, options [nop,nop,TS val 278009153 ecr 278009153], length 12178
2022-04-05 21:55:26.651495 IP (tos 0x0, ttl 64, id 38423, offset 0, flags [DF], proto TCP (6), length 52)
    127.0.0.1.54308 > 127.0.0.1.11050: Flags [.], cksum 0xfe28 (incorrect -> 0xbb97), seq 891, ack 59698, win 512, options [nop,nop,TS val 278009154 ecr 278009153], length 0
2022-04-05 21:55:26.683758 IP (tos 0x0, ttl 64, id 53553, offset 0, flags [DF], proto TCP (6), length 2474)
    127.0.0.1.11050 > 127.0.0.1.54308: Flags [P.], cksum 0x079f (incorrect -> 0x112f), seq 59698:62120, ack 891, win 512, options [nop,nop,TS val 278009186 ecr 278009154], length 2422
2022-04-05 21:55:26.683774 IP (tos 0x0, ttl 64, id 38424, offset 0, flags [DF], proto TCP (6), length 52)
    127.0.0.1.54308 > 127.0.0.1.11050: Flags [.], cksum 0xfe28 (incorrect -> 0xb1e0), seq 891, ack 62120, win 512, options [nop,nop,TS val 278009186 ecr 278009186], length 0
2022-04-05 21:55:26.695041 IP (tos 0x0, ttl 64, id 53554, offset 0, flags [DF], proto TCP (6), length 3470)
    127.0.0.1.11050 > 127.0.0.1.54308: Flags [P.], cksum 0x0b83 (incorrect -> 0xe396), seq 62120:65538, ack 891, win 512, options [nop,nop,TS val 278009197 ecr 278009186], length 3418
2022-04-05 21:55:26.695057 IP (tos 0x0, ttl 64, id 38425, offset 0, flags [DF], proto TCP (6), length 52)
    127.0.0.1.54308 > 127.0.0.1.11050: Flags [.], cksum 0xfe28 (incorrect -> 0xa470), seq 891, ack 65538, win 512, options [nop,nop,TS val 278009197 ecr 278009197], length 0
2022-04-05 21:55:26.695184 IP (tos 0x0, ttl 64, id 53555, offset 0, flags [DF], proto TCP (6), length 3402)
    127.0.0.1.11050 > 127.0.0.1.54308: Flags [P.], cksum 0x0b3f (incorrect -> 0xcd77), seq 65538:68888, ack 891, win 512, options [nop,nop,TS val 278009198 ecr 278009197], length 3350
2022-04-05 21:55:26.695198 IP (tos 0x0, ttl 64, id 38426, offset 0, flags [DF], proto TCP (6), length 52)
    127.0.0.1.54308 > 127.0.0.1.11050: Flags [.], cksum 0xfe28 (incorrect -> 0x9758), seq 891, ack 68888, win 512, options [nop,nop,TS val 278009198 ecr 278009198], length 0
2022-04-05 21:55:26.706330 IP (tos 0x0, ttl 64, id 53556, offset 0, flags [DF], proto TCP (6), length 4100)
    127.0.0.1.11050 > 127.0.0.1.54308: Flags [P.], cksum 0x0df9 (incorrect -> 0xad26), seq 68888:72936, ack 891, win 512, options [nop,nop,TS val 278009209 ecr 278009198], length 4048
2022-04-05 21:55:26.706755 IP (tos 0x0, ttl 64, id 38427, offset 0, flags [DF], proto TCP (6), length 52)
    127.0.0.1.54308 > 127.0.0.1.11050: Flags [.], cksum 0xfe28 (incorrect -> 0x8772), seq 891, ack 72936, win 512, options [nop,nop,TS val 278009209 ecr 278009209], length 0
2022-04-05 21:55:26.706762 IP (tos 0x0, ttl 64, id 53557, offset 0, flags [DF], proto TCP (6), length 3836)
    127.0.0.1.11050 > 127.0.0.1.54308: Flags [P.], cksum 0x0cf1 (incorrect -> 0xe8a0), seq 72936:76720, ack 891, win 512, options [nop,nop,TS val 278009209 ecr 278009209], length 3784
2022-04-05 21:55:26.706766 IP (tos 0x0, ttl 64, id 38428, offset 0, flags [DF], proto TCP (6), length 52)
    127.0.0.1.54308 > 127.0.0.1.11050: Flags [.], cksum 0xfe28 (incorrect -> 0x78aa), seq 891, ack 76720, win 512, options [nop,nop,TS val 278009209 ecr 278009209], length 0
2022-04-05 21:55:26.712401 IP (tos 0x0, ttl 64, id 53558, offset 0, flags [DF], proto TCP (6), length 4100)
    127.0.0.1.11050 > 127.0.0.1.54308: Flags [P.], cksum 0x0df9 (incorrect -> 0x8873), seq 76720:80768, ack 891, win 512, options [nop,nop,TS val 278009215 ecr 278009209], length 4048
2022-04-05 21:55:26.712416 IP (tos 0x0, ttl 64, id 38429, offset 0, flags [DF], proto TCP (6), length 52)
    127.0.0.1.54308 > 127.0.0.1.11050: Flags [.], cksum 0xfe28 (incorrect -> 0x68ce), seq 891, ack 80768, win 512, options [nop,nop,TS val 278009215 ecr 278009215], length 0
2022-04-05 21:55:26.712419 IP (tos 0x0, ttl 64, id 53559, offset 0, flags [DF], proto TCP (6), length 350)
    127.0.0.1.11050 > 127.0.0.1.54308: Flags [P.], cksum 0xff52 (incorrect -> 0xf9f7), seq 80768:81066, ack 891, win 512, options [nop,nop,TS val 278009215 ecr 278009215], length 298
2022-04-05 21:55:26.712424 IP (tos 0x0, ttl 64, id 38430, offset 0, flags [DF], proto TCP (6), length 52)
    127.0.0.1.54308 > 127.0.0.1.11050: Flags [.], cksum 0xfe28 (incorrect -> 0x67a4), seq 891, ack 81066, win 512, options [nop,nop,TS val 278009215 ecr 278009215], length 0
2022-04-05 21:55:26.741399 IP (tos 0x0, ttl 64, id 53560, offset 0, flags [DF], proto TCP (6), length 4100)
    127.0.0.1.11050 > 127.0.0.1.54308: Flags [P.], cksum 0x0df9 (incorrect -> 0xa105), seq 81066:85114, ack 891, win 512, options [nop,nop,TS val 278009244 ecr 278009215], length 4048
2022-04-05 21:55:26.741458 IP (tos 0x0, ttl 64, id 38431, offset 0, flags [DF], proto TCP (6), length 52)
    127.0.0.1.54308 > 127.0.0.1.11050: Flags [.], cksum 0xfe28 (incorrect -> 0x579a), seq 891, ack 85114, win 512, options [nop,nop,TS val 278009244 ecr 278009244], length 0
2022-04-05 21:55:26.741467 IP (tos 0x0, ttl 64, id 53561, offset 0, flags [DF], proto TCP (6), length 3338)
    127.0.0.1.11050 > 127.0.0.1.54308: Flags [P.], cksum 0x0aff (incorrect -> 0x110e), seq 85114:88400, ack 891, win 512, options [nop,nop,TS val 278009244 ecr 278009244], length 3286
2022-04-05 21:55:26.742242 IP (tos 0x0, ttl 64, id 38432, offset 0, flags [DF], proto TCP (6), length 52)
    127.0.0.1.54308 > 127.0.0.1.11050: Flags [.], cksum 0xfe28 (incorrect -> 0x4ac3), seq 891, ack 88400, win 512, options [nop,nop,TS val 278009245 ecr 278009244], length 0
2022-04-05 21:55:26.758672 IP (tos 0x0, ttl 64, id 53562, offset 0, flags [DF], proto TCP (6), length 3900)
    127.0.0.1.11050 > 127.0.0.1.54308: Flags [P.], cksum 0x0d31 (incorrect -> 0x4edd), seq 88400:92248, ack 891, win 512, options [nop,nop,TS val 278009261 ecr 278009245], length 3848
2022-04-05 21:55:26.758700 IP (tos 0x0, ttl 64, id 38433, offset 0, flags [DF], proto TCP (6), length 52)
    127.0.0.1.54308 > 127.0.0.1.11050: Flags [.], cksum 0xfe28 (incorrect -> 0x3b9a), seq 891, ack 92248, win 512, options [nop,nop,TS val 278009261 ecr 278009261], length 0
2022-04-05 21:55:26.775548 IP (tos 0x0, ttl 64, id 53563, offset 0, flags [DF], proto TCP (6), length 2542)
    127.0.0.1.11050 > 127.0.0.1.54308: Flags [P.], cksum 0x07e3 (incorrect -> 0x967e), seq 92248:94738, ack 891, win 512, options [nop,nop,TS val 278009278 ecr 278009261], length 2490
2022-04-05 21:55:26.775565 IP (tos 0x0, ttl 64, id 38434, offset 0, flags [DF], proto TCP (6), length 52)
    127.0.0.1.54308 > 127.0.0.1.11050: Flags [.], cksum 0xfe28 (incorrect -> 0x31be), seq 891, ack 94738, win 512, options [nop,nop,TS val 278009278 ecr 278009278], length 0
2022-04-05 21:55:26.775975 IP (tos 0x0, ttl 64, id 53564, offset 0, flags [DF], proto TCP (6), length 3402)
    127.0.0.1.11050 > 127.0.0.1.54308: Flags [P.], cksum 0x0b3f (incorrect -> 0x273c), seq 94738:98088, ack 891, win 512, options [nop,nop,TS val 278009278 ecr 278009278], length 3350
2022-04-05 21:55:26.776046 IP (tos 0x0, ttl 64, id 38435, offset 0, flags [DF], proto TCP (6), length 52)
    127.0.0.1.54308 > 127.0.0.1.11050: Flags [.], cksum 0xfe28 (incorrect -> 0x24a8), seq 891, ack 98088, win 512, options [nop,nop,TS val 278009278 ecr 278009278], length 0
2022-04-05 21:55:26.787290 IP (tos 0x0, ttl 64, id 53565, offset 0, flags [DF], proto TCP (6), length 4100)
    127.0.0.1.11050 > 127.0.0.1.54308: Flags [P.], cksum 0x0df9 (incorrect -> 0xfed7), seq 98088:102136, ack 891, win 512, options [nop,nop,TS val 278009290 ecr 278009278], length 4048
2022-04-05 21:55:26.788465 IP (tos 0x0, ttl 64, id 38436, offset 0, flags [DF], proto TCP (6), length 52)
    127.0.0.1.54308 > 127.0.0.1.11050: Flags [.], cksum 0xfe28 (incorrect -> 0x14bf), seq 891, ack 102136, win 512, options [nop,nop,TS val 278009291 ecr 278009290], length 0
2022-04-05 21:55:26.788478 IP (tos 0x0, ttl 64, id 53566, offset 0, flags [DF], proto TCP (6), length 916)
    127.0.0.1.11050 > 127.0.0.1.54308: Flags [P.], cksum 0x0189 (incorrect -> 0xf074), seq 102136:103000, ack 891, win 512, options [nop,nop,TS val 278009291 ecr 278009291], length 864
2022-04-05 21:55:26.788486 IP (tos 0x0, ttl 64, id 38437, offset 0, flags [DF], proto TCP (6), length 52)
    127.0.0.1.54308 > 127.0.0.1.11050: Flags [.], cksum 0xfe28 (incorrect -> 0x115e), seq 891, ack 103000, win 512, options [nop,nop,TS val 278009291 ecr 278009291], length 0
2022-04-05 21:55:26.806125 IP (tos 0x0, ttl 64, id 53567, offset 0, flags [DF], proto TCP (6), length 3470)
    127.0.0.1.11050 > 127.0.0.1.54308: Flags [P.], cksum 0x0b83 (incorrect -> 0x5cea), seq 103000:106418, ack 891, win 512, options [nop,nop,TS val 278009309 ecr 278009291], length 3418
2022-04-05 21:55:26.806170 IP (tos 0x0, ttl 64, id 38438, offset 0, flags [DF], proto TCP (6), length 52)
    127.0.0.1.54308 > 127.0.0.1.11050: Flags [.], cksum 0xfe28 (incorrect -> 0x03e0), seq 891, ack 106418, win 512, options [nop,nop,TS val 278009309 ecr 278009309], length 0
2022-04-05 21:55:26.806303 IP (tos 0x0, ttl 64, id 53568, offset 0, flags [DF], proto TCP (6), length 3900)
    127.0.0.1.11050 > 127.0.0.1.54308: Flags [P.], cksum 0x0d31 (incorrect -> 0xe5dc), seq 106418:110266, ack 891, win 512, options [nop,nop,TS val 278009309 ecr 278009309], length 3848
2022-04-05 21:55:26.806761 IP (tos 0x0, ttl 64, id 38439, offset 0, flags [DF], proto TCP (6), length 52)
    127.0.0.1.54308 > 127.0.0.1.11050: Flags [.], cksum 0xfe28 (incorrect -> 0xf4d7), seq 891, ack 110266, win 512, options [nop,nop,TS val 278009309 ecr 278009309], length 0
2022-04-05 21:55:26.806772 IP (tos 0x0, ttl 64, id 53569, offset 0, flags [DF], proto TCP (6), length 5394)
    127.0.0.1.11050 > 127.0.0.1.54308: Flags [P.], cksum 0x1307 (incorrect -> 0x1d1c), seq 110266:115608, ack 891, win 512, options [nop,nop,TS val 278009309 ecr 278009309], length 5342
2022-04-05 21:55:26.806778 IP (tos 0x0, ttl 64, id 38440, offset 0, flags [DF], proto TCP (6), length 52)
    127.0.0.1.54308 > 127.0.0.1.11050: Flags [.], cksum 0xfe28 (incorrect -> 0xdff9), seq 891, ack 115608, win 512, options [nop,nop,TS val 278009309 ecr 278009309], length 0
2022-04-05 21:55:26.824221 IP (tos 0x0, ttl 64, id 53570, offset 0, flags [DF], proto TCP (6), length 1048)
    127.0.0.1.11050 > 127.0.0.1.54308: Flags [P.], cksum 0x020d (incorrect -> 0x5e93), seq 115608:116604, ack 891, win 512, options [nop,nop,TS val 278009327 ecr 278009309], length 996
2022-04-05 21:55:26.824246 IP (tos 0x0, ttl 64, id 38441, offset 0, flags [DF], proto TCP (6), length 52)
    127.0.0.1.54308 > 127.0.0.1.11050: Flags [.], cksum 0xfe28 (incorrect -> 0xdbf1), seq 891, ack 116604, win 512, options [nop,nop,TS val 278009327 ecr 278009327], length 0
2022-04-05 21:55:26.829513 IP (tos 0x0, ttl 64, id 53571, offset 0, flags [DF], proto TCP (6), length 3470)
    127.0.0.1.11050 > 127.0.0.1.54308: Flags [P.], cksum 0x0b83 (incorrect -> 0xa9bb), seq 116604:120022, ack 891, win 512, options [nop,nop,TS val 278009332 ecr 278009327], length 3418
2022-04-05 21:55:26.829526 IP (tos 0x0, ttl 64, id 38442, offset 0, flags [DF], proto TCP (6), length 52)
    127.0.0.1.54308 > 127.0.0.1.11050: Flags [.], cksum 0xfe28 (incorrect -> 0xce8d), seq 891, ack 120022, win 512, options [nop,nop,TS val 278009332 ecr 278009332], length 0
2022-04-05 21:55:26.829813 IP (tos 0x0, ttl 64, id 53572, offset 0, flags [DF], proto TCP (6), length 3968)
    127.0.0.1.11050 > 127.0.0.1.54308: Flags [P.], cksum 0x0d75 (incorrect -> 0xf7c4), seq 120022:123938, ack 891, win 512, options [nop,nop,TS val 278009332 ecr 278009332], length 3916
2022-04-05 21:55:26.829857 IP (tos 0x0, ttl 64, id 38443, offset 0, flags [DF], proto TCP (6), length 52)
    127.0.0.1.54308 > 127.0.0.1.11050: Flags [.], cksum 0xfe28 (incorrect -> 0xbf41), seq 891, ack 123938, win 512, options [nop,nop,TS val 278009332 ecr 278009332], length 0
2022-04-05 21:55:26.830025 IP (tos 0x0, ttl 64, id 53573, offset 0, flags [DF], proto TCP (6), length 4100)
    127.0.0.1.11050 > 127.0.0.1.54308: Flags [P.], cksum 0x0df9 (incorrect -> 0x5c29), seq 123938:127986, ack 891, win 512, options [nop,nop,TS val 278009332 ecr 278009332], length 4048
2022-04-05 21:55:26.830586 IP (tos 0x0, ttl 64, id 38444, offset 0, flags [DF], proto TCP (6), length 52)
    127.0.0.1.54308 > 127.0.0.1.11050: Flags [.], cksum 0xfe28 (incorrect -> 0xaf70), seq 891, ack 127986, win 512, options [nop,nop,TS val 278009333 ecr 278009332], length 0
2022-04-05 21:55:26.830592 IP (tos 0x0, ttl 64, id 53574, offset 0, flags [DF], proto TCP (6), length 2274)
    127.0.0.1.11050 > 127.0.0.1.54308: Flags [P.], cksum 0x06d7 (incorrect -> 0x9ec0), seq 127986:130208, ack 891, win 512, options [nop,nop,TS val 278009333 ecr 278009333], length 2222
2022-04-05 21:55:26.830596 IP (tos 0x0, ttl 64, id 38445, offset 0, flags [DF], proto TCP (6), length 52)
    127.0.0.1.54308 > 127.0.0.1.11050: Flags [.], cksum 0xfe28 (incorrect -> 0xa6c1), seq 891, ack 130208, win 512, options [nop,nop,TS val 278009333 ecr 278009333], length 0
2022-04-05 21:55:26.861216 IP (tos 0x0, ttl 64, id 53575, offset 0, flags [DF], proto TCP (6), length 3470)
    127.0.0.1.11050 > 127.0.0.1.54308: Flags [P.], cksum 0x0b83 (incorrect -> 0x92bc), seq 130208:133626, ack 891, win 512, options [nop,nop,TS val 278009364 ecr 278009333], length 3418
2022-04-05 21:55:26.861291 IP (tos 0x0, ttl 64, id 38446, offset 0, flags [DF], proto TCP (6), length 52)
    127.0.0.1.54308 > 127.0.0.1.11050: Flags [.], cksum 0xfe28 (incorrect -> 0x9929), seq 891, ack 133626, win 512, options [nop,nop,TS val 278009364 ecr 278009364], length 0
2022-04-05 21:55:26.861510 IP (tos 0x0, ttl 64, id 53576, offset 0, flags [DF], proto TCP (6), length 3968)
    127.0.0.1.11050 > 127.0.0.1.54308: Flags [P.], cksum 0x0d75 (incorrect -> 0x6c6c), seq 133626:137542, ack 891, win 512, options [nop,nop,TS val 278009364 ecr 278009364], length 3916
2022-04-05 21:55:26.862062 IP (tos 0x0, ttl 64, id 38447, offset 0, flags [DF], proto TCP (6), length 52)
    127.0.0.1.54308 > 127.0.0.1.11050: Flags [.], cksum 0xfe28 (incorrect -> 0x89dc), seq 891, ack 137542, win 512, options [nop,nop,TS val 278009365 ecr 278009364], length 0
2022-04-05 21:55:26.862069 IP (tos 0x0, ttl 64, id 53577, offset 0, flags [DF], proto TCP (6), length 3968)
    127.0.0.1.11050 > 127.0.0.1.54308: Flags [P.], cksum 0x0d75 (incorrect -> 0x0d52), seq 137542:141458, ack 891, win 512, options [nop,nop,TS val 278009365 ecr 278009365], length 3916
2022-04-05 21:55:26.902685 IP (tos 0x0, ttl 64, id 38448, offset 0, flags [DF], proto TCP (6), length 52)
    127.0.0.1.54308 > 127.0.0.1.11050: Flags [.], cksum 0xfe28 (incorrect -> 0x7a67), seq 891, ack 141458, win 512, options [nop,nop,TS val 278009405 ecr 278009365], length 0
2022-04-05 21:55:26.902701 IP (tos 0x0, ttl 64, id 53578, offset 0, flags [DF], proto TCP (6), length 13656)
    127.0.0.1.11050 > 127.0.0.1.54308: Flags [P.], cksum 0x334d (incorrect -> 0x2857), seq 141458:155062, ack 891, win 512, options [nop,nop,TS val 278009405 ecr 278009405], length 13604
2022-04-05 21:55:26.946675 IP (tos 0x0, ttl 64, id 38449, offset 0, flags [DF], proto TCP (6), length 52)
    127.0.0.1.54308 > 127.0.0.1.11050: Flags [.], cksum 0xfe28 (incorrect -> 0x44ef), seq 891, ack 155062, win 512, options [nop,nop,TS val 278009449 ecr 278009405], length 0
2022-04-05 21:55:26.946686 IP (tos 0x0, ttl 64, id 53579, offset 0, flags [DF], proto TCP (6), length 16078)
    127.0.0.1.11050 > 127.0.0.1.54308: Flags [P.], cksum 0x3cc3 (incorrect -> 0x01c8), seq 155062:171088, ack 891, win 512, options [nop,nop,TS val 278009449 ecr 278009449], length 16026
2022-04-05 21:55:26.994654 IP (tos 0x0, ttl 64, id 38450, offset 0, flags [DF], proto TCP (6), length 52)
    127.0.0.1.54308 > 127.0.0.1.11050: Flags [.], cksum 0xfe28 (incorrect -> 0x05f9), seq 891, ack 171088, win 512, options [nop,nop,TS val 278009497 ecr 278009449], length 0
2022-04-05 21:55:26.994674 IP (tos 0x0, ttl 64, id 53580, offset 0, flags [DF], proto TCP (6), length 30712)
    127.0.0.1.11050 > 127.0.0.1.54308: Flags [P.], cksum 0x75ed (incorrect -> 0xd12f), seq 171088:201748, ack 891, win 512, options [nop,nop,TS val 278009497 ecr 278009497], length 30660
2022-04-05 21:55:27.038656 IP (tos 0x0, ttl 64, id 38451, offset 0, flags [DF], proto TCP (6), length 52)
    127.0.0.1.54308 > 127.0.0.1.11050: Flags [.], cksum 0xfe28 (incorrect -> 0x8dd8), seq 891, ack 201748, win 512, options [nop,nop,TS val 278009541 ecr 278009497], length 0
2022-04-05 21:55:27.038673 IP (tos 0x0, ttl 64, id 53581, offset 0, flags [DF], proto TCP (6), length 21024)
    127.0.0.1.11050 > 127.0.0.1.54308: Flags [P.], cksum 0x5015 (incorrect -> 0xdff3), seq 201748:222720, ack 891, win 512, options [nop,nop,TS val 278009541 ecr 278009541], length 20972
2022-04-05 21:55:27.039450 IP (tos 0x0, ttl 64, id 38452, offset 0, flags [DF], proto TCP (6), length 52)
    127.0.0.1.54308 > 127.0.0.1.11050: Flags [.], cksum 0xfe28 (incorrect -> 0x3bbf), seq 891, ack 222720, win 512, options [nop,nop,TS val 278009542 ecr 278009541], length 0
2022-04-05 21:55:27.044617 IP (tos 0x0, ttl 64, id 53582, offset 0, flags [DF], proto TCP (6), length 3436)
    127.0.0.1.11050 > 127.0.0.1.54308: Flags [P.], cksum 0x0b61 (incorrect -> 0x2189), seq 222720:226104, ack 891, win 512, options [nop,nop,TS val 278009547 ecr 278009542], length 3384
2022-04-05 21:55:27.044672 IP (tos 0x0, ttl 64, id 38453, offset 0, flags [DF], proto TCP (6), length 52)
    127.0.0.1.54308 > 127.0.0.1.11050: Flags [.], cksum 0xfe28 (incorrect -> 0x2e7c), seq 891, ack 226104, win 512, options [nop,nop,TS val 278009547 ecr 278009547], length 0
2022-04-05 21:55:27.044752 IP (tos 0x0, ttl 64, id 53583, offset 0, flags [DF], proto TCP (6), length 3436)
    127.0.0.1.11050 > 127.0.0.1.54308: Flags [P.], cksum 0x0b61 (incorrect -> 0x07f5), seq 226104:229488, ack 891, win 512, options [nop,nop,TS val 278009547 ecr 278009547], length 3384
2022-04-05 21:55:27.086659 IP (tos 0x0, ttl 64, id 38454, offset 0, flags [DF], proto TCP (6), length 52)
    127.0.0.1.54308 > 127.0.0.1.11050: Flags [.], cksum 0xfe28 (incorrect -> 0x211a), seq 891, ack 229488, win 512, options [nop,nop,TS val 278009589 ecr 278009547], length 0
200, 4.964880466461182, 1.6218740940093994