2022-04-05 11:30:59.802081 IP (tos 0x0, ttl 64, id 64699, offset 0, flags [DF], proto TCP (6), length 60)
    127.0.0.1.53072 > 127.0.0.1.11750: Flags [S], cksum 0xfe30 (incorrect -> 0xd48b), seq 4052360190, win 65495, options [mss 65495,sackOK,TS val 240542304 ecr 0,nop,wscale 7], length 0
2022-04-05 11:30:59.802096 IP (tos 0x0, ttl 64, id 0, offset 0, flags [DF], proto TCP (6), length 60)
    127.0.0.1.11750 > 127.0.0.1.53072: Flags [S.], cksum 0xfe30 (incorrect -> 0xaa3e), seq 1421763794, ack 4052360191, win 65483, options [mss 65495,sackOK,TS val 240542305 ecr 240542304,nop,wscale 7], length 0
2022-04-05 11:30:59.802108 IP (tos 0x0, ttl 64, id 64700, offset 0, flags [DF], proto TCP (6), length 52)
    127.0.0.1.53072 > 127.0.0.1.11750: Flags [.], cksum 0xfe28 (incorrect -> 0xd0f9), seq 1, ack 1, win 512, options [nop,nop,TS val 240542305 ecr 240542305], length 0
2022-04-05 11:30:59.802211 IP (tos 0x0, ttl 64, id 64701, offset 0, flags [DF], proto TCP (6), length 55)
    127.0.0.1.53072 > 127.0.0.1.11750: Flags [P.], cksum 0xfe2b (incorrect -> 0xcbed), seq 1:4, ack 1, win 512, options [nop,nop,TS val 240542305 ecr 240542305], length 3
2022-04-05 11:30:59.802227 IP (tos 0x0, ttl 64, id 22358, offset 0, flags [DF], proto TCP (6), length 52)
    127.0.0.1.11750 > 127.0.0.1.53072: Flags [.], cksum 0xfe28 (incorrect -> 0xd0f6), seq 1, ack 4, win 512, options [nop,nop,TS val 240542305 ecr 240542305], length 0
2022-04-05 11:30:59.802258 IP (tos 0x0, ttl 64, id 22359, offset 0, flags [DF], proto TCP (6), length 54)
    127.0.0.1.11750 > 127.0.0.1.53072: Flags [P.], cksum 0xfe2a (incorrect -> 0xcbec), seq 1:3, ack 4, win 512, options [nop,nop,TS val 240542305 ecr 240542305], length 2
2022-04-05 11:30:59.802269 IP (tos 0x0, ttl 64, id 64702, offset 0, flags [DF], proto TCP (6), length 52)
    127.0.0.1.53072 > 127.0.0.1.11750: Flags [.], cksum 0xfe28 (incorrect -> 0xd0f4), seq 4, ack 3, win 512, options [nop,nop,TS val 240542305 ecr 240542305], length 0
2022-04-05 11:30:59.803650 IP (tos 0x0, ttl 64, id 64703, offset 0, flags [DF], proto TCP (6), length 62)
    127.0.0.1.53072 > 127.0.0.1.11750: Flags [P.], cksum 0xfe32 (incorrect -> 0x6bc9), seq 4:14, ack 3, win 512, options [nop,nop,TS val 240542306 ecr 240542305], length 10
2022-04-05 11:30:59.803660 IP (tos 0x0, ttl 64, id 22360, offset 0, flags [DF], proto TCP (6), length 52)
    127.0.0.1.11750 > 127.0.0.1.53072: Flags [.], cksum 0xfe28 (incorrect -> 0xd0e8), seq 3, ack 14, win 512, options [nop,nop,TS val 240542306 ecr 240542306], length 0
2022-04-05 11:30:59.909452 IP (tos 0x0, ttl 64, id 22361, offset 0, flags [DF], proto TCP (6), length 62)
    127.0.0.1.11750 > 127.0.0.1.53072: Flags [P.], cksum 0xfe32 (incorrect -> 0xcb6b), seq 3:13, ack 14, win 512, options [nop,nop,TS val 240542412 ecr 240542306], length 10
2022-04-05 11:30:59.909461 IP (tos 0x0, ttl 64, id 64704, offset 0, flags [DF], proto TCP (6), length 52)
    127.0.0.1.53072 > 127.0.0.1.11750: Flags [.], cksum 0xfe28 (incorrect -> 0xd00a), seq 14, ack 13, win 512, options [nop,nop,TS val 240542412 ecr 240542412], length 0
2022-04-05 11:30:59.914883 IP (tos 0x0, ttl 64, id 64705, offset 0, flags [DF], proto TCP (6), length 569)
    127.0.0.1.53072 > 127.0.0.1.11750: Flags [P.], cksum 0x002e (incorrect -> 0x0b89), seq 14:531, ack 13, win 512, options [nop,nop,TS val 240542417 ecr 240542412], length 517
2022-04-05 11:30:59.914892 IP (tos 0x0, ttl 64, id 22362, offset 0, flags [DF], proto TCP (6), length 52)
    127.0.0.1.11750 > 127.0.0.1.53072: Flags [.], cksum 0xfe28 (incorrect -> 0xcdff), seq 13, ack 531, win 508, options [nop,nop,TS val 240542417 ecr 240542417], length 0
2022-04-05 11:31:00.058612 IP (tos 0x0, ttl 64, id 22363, offset 0, flags [DF], proto TCP (6), length 3538)
    127.0.0.1.11750 > 127.0.0.1.53072: Flags [P.], cksum 0x0bc7 (incorrect -> 0xc290), seq 13:3499, ack 531, win 512, options [nop,nop,TS val 240542561 ecr 240542417], length 3486
2022-04-05 11:31:00.058621 IP (tos 0x0, ttl 64, id 64706, offset 0, flags [DF], proto TCP (6), length 52)
    127.0.0.1.53072 > 127.0.0.1.11750: Flags [.], cksum 0xfe28 (incorrect -> 0xbf4f), seq 531, ack 3499, win 494, options [nop,nop,TS val 240542561 ecr 240542561], length 0
2022-04-05 11:31:00.131224 IP (tos 0x0, ttl 64, id 22364, offset 0, flags [DF], proto TCP (6), length 850)
    127.0.0.1.11750 > 127.0.0.1.53072: Flags [P.], cksum 0x0147 (incorrect -> 0xc6b4), seq 3499:4297, ack 531, win 512, options [nop,nop,TS val 240542634 ecr 240542561], length 798
2022-04-05 11:31:00.131232 IP (tos 0x0, ttl 64, id 64707, offset 0, flags [DF], proto TCP (6), length 52)
    127.0.0.1.53072 > 127.0.0.1.11750: Flags [.], cksum 0xfe28 (incorrect -> 0xbb95), seq 531, ack 4297, win 504, options [nop,nop,TS val 240542634 ecr 240542634], length 0
2022-04-05 11:31:00.177202 IP (tos 0x0, ttl 64, id 22365, offset 0, flags [DF], proto TCP (6), length 1336)
    127.0.0.1.11750 > 127.0.0.1.53072: Flags [P.], cksum 0x032d (incorrect -> 0x9ffd), seq 4297:5581, ack 531, win 512, options [nop,nop,TS val 240542680 ecr 240542634], length 1284
2022-04-05 11:31:00.177209 IP (tos 0x0, ttl 64, id 64708, offset 0, flags [DF], proto TCP (6), length 52)
    127.0.0.1.53072 > 127.0.0.1.11750: Flags [.], cksum 0xfe28 (incorrect -> 0xb637), seq 531, ack 5581, win 502, options [nop,nop,TS val 240542680 ecr 240542680], length 0
2022-04-05 11:31:00.177606 IP (tos 0x0, ttl 64, id 64709, offset 0, flags [DF], proto TCP (6), length 116)
    127.0.0.1.53072 > 127.0.0.1.11750: Flags [P.], cksum 0xfe68 (incorrect -> 0x3df8), seq 531:595, ack 5581, win 512, options [nop,nop,TS val 240542680 ecr 240542680], length 64
2022-04-05 11:31:00.177615 IP (tos 0x0, ttl 64, id 22366, offset 0, flags [DF], proto TCP (6), length 52)
    127.0.0.1.11750 > 127.0.0.1.53072: Flags [.], cksum 0xfe28 (incorrect -> 0xb5ed), seq 5581, ack 595, win 512, options [nop,nop,TS val 240542680 ecr 240542680], length 0
2022-04-05 11:31:00.177972 IP (tos 0x0, ttl 64, id 64710, offset 0, flags [DF], proto TCP (6), length 407)
    127.0.0.1.53072 > 127.0.0.1.11750: Flags [P.], cksum 0xff8b (incorrect -> 0x08b2), seq 595:950, ack 5581, win 512, options [nop,nop,TS val 240542680 ecr 240542680], length 355
2022-04-05 11:31:00.177981 IP (tos 0x0, ttl 64, id 22367, offset 0, flags [DF], proto TCP (6), length 52)
    127.0.0.1.11750 > 127.0.0.1.53072: Flags [.], cksum 0xfe28 (incorrect -> 0xb48c), seq 5581, ack 950, win 510, options [nop,nop,TS val 240542680 ecr 240542680], length 0
2022-04-05 11:31:00.336708 IP (tos 0x0, ttl 64, id 22368, offset 0, flags [DF], proto TCP (6), length 3256)
    127.0.0.1.11750 > 127.0.0.1.53072: Flags [P.], cksum 0x0aad (incorrect -> 0x0401), seq 5581:8785, ack 950, win 512, options [nop,nop,TS val 240542839 ecr 240542680], length 3204
2022-04-05 11:31:00.336724 IP (tos 0x0, ttl 64, id 64711, offset 0, flags [DF], proto TCP (6), length 52)
    127.0.0.1.53072 > 127.0.0.1.11750: Flags [.], cksum 0xfe28 (incorrect -> 0xa6d9), seq 950, ack 8785, win 495, options [nop,nop,TS val 240542839 ecr 240542839], length 0
2022-04-05 11:31:00.341672 IP (tos 0x0, ttl 64, id 22369, offset 0, flags [DF], proto TCP (6), length 1048)
    127.0.0.1.11750 > 127.0.0.1.53072: Flags [P.], cksum 0x020d (incorrect -> 0x5e7f), seq 8785:9781, ack 950, win 512, options [nop,nop,TS val 240542844 ecr 240542839], length 996
2022-04-05 11:31:00.341680 IP (tos 0x0, ttl 64, id 64712, offset 0, flags [DF], proto TCP (6), length 52)
    127.0.0.1.53072 > 127.0.0.1.11750: Flags [.], cksum 0xfe28 (incorrect -> 0xa2e2), seq 950, ack 9781, win 504, options [nop,nop,TS val 240542844 ecr 240542844], length 0
2022-04-05 11:31:00.345635 IP (tos 0x0, ttl 64, id 22370, offset 0, flags [DF], proto TCP (6), length 3538)
    127.0.0.1.11750 > 127.0.0.1.53072: Flags [P.], cksum 0x0bc7 (incorrect -> 0x010f), seq 9781:13267, ack 950, win 512, options [nop,nop,TS val 240542848 ecr 240542844], length 3486
2022-04-05 11:31:00.345642 IP (tos 0x0, ttl 64, id 64713, offset 0, flags [DF], proto TCP (6), length 52)
    127.0.0.1.53072 > 127.0.0.1.11750: Flags [.], cksum 0xfe28 (incorrect -> 0x9546), seq 950, ack 13267, win 494, options [nop,nop,TS val 240542848 ecr 240542848], length 0
2022-04-05 11:31:00.346688 IP (tos 0x0, ttl 64, id 22371, offset 0, flags [DF], proto TCP (6), length 1048)
    127.0.0.1.11750 > 127.0.0.1.53072: Flags [P.], cksum 0x020d (incorrect -> 0x3cbb), seq 13267:14263, ack 950, win 512, options [nop,nop,TS val 240542849 ecr 240542848], length 996
2022-04-05 11:31:00.346695 IP (tos 0x0, ttl 64, id 64714, offset 0, flags [DF], proto TCP (6), length 52)
    127.0.0.1.53072 > 127.0.0.1.11750: Flags [.], cksum 0xfe28 (incorrect -> 0x9156), seq 950, ack 14263, win 504, options [nop,nop,TS val 240542849 ecr 240542849], length 0
2022-04-05 11:31:00.363286 IP (tos 0x0, ttl 64, id 22372, offset 0, flags [DF], proto TCP (6), length 2542)
    127.0.0.1.11750 > 127.0.0.1.53072: Flags [P.], cksum 0x07e3 (incorrect -> 0x8e56), seq 14263:16753, ack 950, win 512, options [nop,nop,TS val 240542866 ecr 240542849], length 2490
2022-04-05 11:31:00.363298 IP (tos 0x0, ttl 64, id 64715, offset 0, flags [DF], proto TCP (6), length 52)
    127.0.0.1.53072 > 127.0.0.1.11750: Flags [.], cksum 0xfe28 (incorrect -> 0x8780), seq 950, ack 16753, win 498, options [nop,nop,TS val 240542866 ecr 240542866], length 0
2022-04-05 11:31:00.397611 IP (tos 0x0, ttl 64, id 22373, offset 0, flags [DF], proto TCP (6), length 3538)
    127.0.0.1.11750 > 127.0.0.1.53072: Flags [P.], cksum 0x0bc7 (incorrect -> 0xa65f), seq 16753:20239, ack 950, win 512, options [nop,nop,TS val 240542900 ecr 240542866], length 3486
2022-04-05 11:31:00.397619 IP (tos 0x0, ttl 64, id 64716, offset 0, flags [DF], proto TCP (6), length 52)
    127.0.0.1.53072 > 127.0.0.1.11750: Flags [.], cksum 0xfe28 (incorrect -> 0x79a2), seq 950, ack 20239, win 494, options [nop,nop,TS val 240542900 ecr 240542900], length 0
2022-04-05 11:31:00.397664 IP (tos 0x0, ttl 64, id 22374, offset 0, flags [DF], proto TCP (6), length 4100)
    127.0.0.1.11750 > 127.0.0.1.53072: Flags [P.], cksum 0x0df9 (incorrect -> 0x9378), seq 20239:24287, ack 950, win 512, options [nop,nop,TS val 240542900 ecr 240542900], length 4048
2022-04-05 11:31:00.397669 IP (tos 0x0, ttl 64, id 64717, offset 0, flags [DF], proto TCP (6), length 52)
    127.0.0.1.53072 > 127.0.0.1.11750: Flags [.], cksum 0xfe28 (incorrect -> 0x69e2), seq 950, ack 24287, win 478, options [nop,nop,TS val 240542900 ecr 240542900], length 0
2022-04-05 11:31:00.397676 IP (tos 0x0, ttl 64, id 22375, offset 0, flags [DF], proto TCP (6), length 2948)
    127.0.0.1.11750 > 127.0.0.1.53072: Flags [P.], cksum 0x0979 (incorrect -> 0x9d37), seq 24287:27183, ack 950, win 512, options [nop,nop,TS val 240542900 ecr 240542900], length 2896
2022-04-05 11:31:00.398092 IP (tos 0x0, ttl 64, id 64718, offset 0, flags [DF], proto TCP (6), length 52)
    127.0.0.1.53072 > 127.0.0.1.11750: Flags [.], cksum 0xfe28 (incorrect -> 0x5e6f), seq 950, ack 27183, win 512, options [nop,nop,TS val 240542901 ecr 240542900], length 0
2022-04-05 11:31:00.398098 IP (tos 0x0, ttl 64, id 22376, offset 0, flags [DF], proto TCP (6), length 1048)
    127.0.0.1.11750 > 127.0.0.1.53072: Flags [P.], cksum 0x020d (incorrect -> 0xaa09), seq 27183:28179, ack 950, win 512, options [nop,nop,TS val 240542901 ecr 240542901], length 996
2022-04-05 11:31:00.398104 IP (tos 0x0, ttl 64, id 64719, offset 0, flags [DF], proto TCP (6), length 52)
    127.0.0.1.53072 > 127.0.0.1.11750: Flags [.], cksum 0xfe28 (incorrect -> 0x5a8a), seq 950, ack 28179, win 512, options [nop,nop,TS val 240542901 ecr 240542901], length 0
2022-04-05 11:31:00.402687 IP (tos 0x0, ttl 64, id 22377, offset 0, flags [DF], proto TCP (6), length 4100)
    127.0.0.1.11750 > 127.0.0.1.53072: Flags [P.], cksum 0x0df9 (incorrect -> 0x9235), seq 28179:32227, ack 950, win 512, options [nop,nop,TS val 240542905 ecr 240542901], length 4048
2022-04-05 11:31:00.432192 IP (tos 0x0, ttl 64, id 22378, offset 0, flags [DF], proto TCP (6), length 32820)
    127.0.0.1.11750 > 127.0.0.1.53072: Flags [.], cksum 0x7e29 (incorrect -> 0x0ec6), seq 32227:64995, ack 950, win 512, options [nop,nop,TS val 240542935 ecr 240542901], length 32768
2022-04-05 11:31:00.432211 IP (tos 0x0, ttl 64, id 64720, offset 0, flags [DF], proto TCP (6), length 52)
    127.0.0.1.53072 > 127.0.0.1.11750: Flags [.], cksum 0xfe28 (incorrect -> 0xcb18), seq 950, ack 64995, win 379, options [nop,nop,TS val 240542935 ecr 240542905], length 0
2022-04-05 11:31:00.432217 IP (tos 0x0, ttl 64, id 22379, offset 0, flags [DF], proto TCP (6), length 2092)
    127.0.0.1.11750 > 127.0.0.1.53072: Flags [P.], cksum 0x0621 (incorrect -> 0xed93), seq 64995:67035, ack 950, win 512, options [nop,nop,TS val 240542935 ecr 240542935], length 2040
2022-04-05 11:31:00.433020 IP (tos 0x0, ttl 64, id 64721, offset 0, flags [DF], proto TCP (6), length 52)
    127.0.0.1.53072 > 127.0.0.1.11750: Flags [.], cksum 0xfe28 (incorrect -> 0xc27d), seq 950, ack 67035, win 512, options [nop,nop,TS val 240542935 ecr 240542935], length 0
2022-04-05 11:31:00.435153 IP (tos 0x0, ttl 64, id 22380, offset 0, flags [DF], proto TCP (6), length 4100)
    127.0.0.1.11750 > 127.0.0.1.53072: Flags [P.], cksum 0x0df9 (incorrect -> 0x1ec7), seq 67035:71083, ack 950, win 512, options [nop,nop,TS val 240542938 ecr 240542935], length 4048
2022-04-05 11:31:00.435201 IP (tos 0x0, ttl 64, id 64722, offset 0, flags [DF], proto TCP (6), length 52)
    127.0.0.1.53072 > 127.0.0.1.11750: Flags [.], cksum 0xfe28 (incorrect -> 0xb2a7), seq 950, ack 71083, win 512, options [nop,nop,TS val 240542938 ecr 240542938], length 0
2022-04-05 11:31:00.435207 IP (tos 0x0, ttl 64, id 22381, offset 0, flags [DF], proto TCP (6), length 3078)
    127.0.0.1.11750 > 127.0.0.1.53072: Flags [P.], cksum 0x09fb (incorrect -> 0x004c), seq 71083:74109, ack 950, win 512, options [nop,nop,TS val 240542938 ecr 240542938], length 3026
2022-04-05 11:31:00.435758 IP (tos 0x0, ttl 64, id 64723, offset 0, flags [DF], proto TCP (6), length 52)
    127.0.0.1.53072 > 127.0.0.1.11750: Flags [.], cksum 0xfe28 (incorrect -> 0xa6d5), seq 950, ack 74109, win 512, options [nop,nop,TS val 240542938 ecr 240542938], length 0
2022-04-05 11:31:00.440079 IP (tos 0x0, ttl 64, id 22382, offset 0, flags [DF], proto TCP (6), length 4100)
    127.0.0.1.11750 > 127.0.0.1.53072: Flags [P.], cksum 0x0df9 (incorrect -> 0x5d68), seq 74109:78157, ack 950, win 512, options [nop,nop,TS val 240542943 ecr 240542938], length 4048
2022-04-05 11:31:00.440095 IP (tos 0x0, ttl 64, id 64724, offset 0, flags [DF], proto TCP (6), length 52)
    127.0.0.1.53072 > 127.0.0.1.11750: Flags [.], cksum 0xfe28 (incorrect -> 0x96fb), seq 950, ack 78157, win 512, options [nop,nop,TS val 240542943 ecr 240542943], length 0
2022-04-05 11:31:00.440100 IP (tos 0x0, ttl 64, id 22383, offset 0, flags [DF], proto TCP (6), length 984)
    127.0.0.1.11750 > 127.0.0.1.53072: Flags [P.], cksum 0x01cd (incorrect -> 0x0259), seq 78157:79089, ack 950, win 512, options [nop,nop,TS val 240542943 ecr 240542943], length 932
2022-04-05 11:31:00.440106 IP (tos 0x0, ttl 64, id 64725, offset 0, flags [DF], proto TCP (6), length 52)
    127.0.0.1.53072 > 127.0.0.1.11750: Flags [.], cksum 0xfe28 (incorrect -> 0x9357), seq 950, ack 79089, win 512, options [nop,nop,TS val 240542943 ecr 240542943], length 0
2022-04-05 11:31:00.449770 IP (tos 0x0, ttl 64, id 22384, offset 0, flags [DF], proto TCP (6), length 3538)
    127.0.0.1.11750 > 127.0.0.1.53072: Flags [P.], cksum 0x0bc7 (incorrect -> 0x2cdf), seq 79089:82575, ack 950, win 512, options [nop,nop,TS val 240542952 ecr 240542943], length 3486
2022-04-05 11:31:00.450267 IP (tos 0x0, ttl 64, id 64726, offset 0, flags [DF], proto TCP (6), length 52)
    127.0.0.1.53072 > 127.0.0.1.11750: Flags [.], cksum 0xfe28 (incorrect -> 0x85a6), seq 950, ack 82575, win 512, options [nop,nop,TS val 240542953 ecr 240542952], length 0
2022-04-05 11:31:00.450279 IP (tos 0x0, ttl 64, id 22385, offset 0, flags [DF], proto TCP (6), length 8020)
    127.0.0.1.11750 > 127.0.0.1.53072: Flags [P.], cksum 0x1d49 (incorrect -> 0xd028), seq 82575:90543, ack 950, win 512, options [nop,nop,TS val 240542953 ecr 240542953], length 7968
2022-04-05 11:31:00.450286 IP (tos 0x0, ttl 64, id 64727, offset 0, flags [DF], proto TCP (6), length 52)
    127.0.0.1.53072 > 127.0.0.1.11750: Flags [.], cksum 0xfe28 (incorrect -> 0x6685), seq 950, ack 90543, win 512, options [nop,nop,TS val 240542953 ecr 240542953], length 0
2022-04-05 11:31:00.454527 IP (tos 0x0, ttl 64, id 22386, offset 0, flags [DF], proto TCP (6), length 4100)
    127.0.0.1.11750 > 127.0.0.1.53072: Flags [P.], cksum 0x0df9 (incorrect -> 0xf989), seq 90543:94591, ack 950, win 512, options [nop,nop,TS val 240542957 ecr 240542953], length 4048
2022-04-05 11:31:00.454554 IP (tos 0x0, ttl 64, id 64728, offset 0, flags [DF], proto TCP (6), length 52)
    127.0.0.1.53072 > 127.0.0.1.11750: Flags [.], cksum 0xfe28 (incorrect -> 0x56ad), seq 950, ack 94591, win 512, options [nop,nop,TS val 240542957 ecr 240542957], length 0
2022-04-05 11:31:00.454559 IP (tos 0x0, ttl 64, id 22387, offset 0, flags [DF], proto TCP (6), length 486)
    127.0.0.1.11750 > 127.0.0.1.53072: Flags [P.], cksum 0xffda (incorrect -> 0xaeee), seq 94591:95025, ack 950, win 512, options [nop,nop,TS val 240542957 ecr 240542957], length 434
2022-04-05 11:31:00.454565 IP (tos 0x0, ttl 64, id 64729, offset 0, flags [DF], proto TCP (6), length 52)
    127.0.0.1.53072 > 127.0.0.1.11750: Flags [.], cksum 0xfe28 (incorrect -> 0x54fb), seq 950, ack 95025, win 512, options [nop,nop,TS val 240542957 ecr 240542957], length 0
2022-04-05 11:31:00.454809 IP (tos 0x0, ttl 64, id 22388, offset 0, flags [DF], proto TCP (6), length 2980)
    127.0.0.1.11750 > 127.0.0.1.53072: Flags [P.], cksum 0x0999 (incorrect -> 0xb043), seq 95025:97953, ack 950, win 512, options [nop,nop,TS val 240542957 ecr 240542957], length 2928
2022-04-05 11:31:00.454823 IP (tos 0x0, ttl 64, id 64730, offset 0, flags [DF], proto TCP (6), length 52)
    127.0.0.1.53072 > 127.0.0.1.11750: Flags [.], cksum 0xfe28 (incorrect -> 0x498b), seq 950, ack 97953, win 512, options [nop,nop,TS val 240542957 ecr 240542957], length 0
2022-04-05 11:31:00.455055 IP (tos 0x0, ttl 64, id 22389, offset 0, flags [DF], proto TCP (6), length 3538)
    127.0.0.1.11750 > 127.0.0.1.53072: Flags [P.], cksum 0x0bc7 (incorrect -> 0x7b75), seq 97953:101439, ack 950, win 512, options [nop,nop,TS val 240542957 ecr 240542957], length 3486
2022-04-05 11:31:00.455404 IP (tos 0x0, ttl 64, id 64731, offset 0, flags [DF], proto TCP (6), length 52)
    127.0.0.1.53072 > 127.0.0.1.11750: Flags [.], cksum 0xfe28 (incorrect -> 0x3bec), seq 950, ack 101439, win 512, options [nop,nop,TS val 240542958 ecr 240542957], length 0
2022-04-05 11:31:00.459854 IP (tos 0x0, ttl 64, id 22390, offset 0, flags [DF], proto TCP (6), length 1282)
    127.0.0.1.11750 > 127.0.0.1.53072: Flags [P.], cksum 0x02f7 (incorrect -> 0x4786), seq 101439:102669, ack 950, win 512, options [nop,nop,TS val 240542962 ecr 240542958], length 1230
2022-04-05 11:31:00.459868 IP (tos 0x0, ttl 64, id 64732, offset 0, flags [DF], proto TCP (6), length 52)
    127.0.0.1.53072 > 127.0.0.1.11750: Flags [.], cksum 0xfe28 (incorrect -> 0x3715), seq 950, ack 102669, win 512, options [nop,nop,TS val 240542962 ecr 240542962], length 0
2022-04-05 11:31:00.468190 IP (tos 0x0, ttl 64, id 22391, offset 0, flags [DF], proto TCP (6), length 3406)
    127.0.0.1.11750 > 127.0.0.1.53072: Flags [P.], cksum 0x0b43 (incorrect -> 0x5a52), seq 102669:106023, ack 950, win 512, options [nop,nop,TS val 240542971 ecr 240542962], length 3354
2022-04-05 11:31:00.468204 IP (tos 0x0, ttl 64, id 64733, offset 0, flags [DF], proto TCP (6), length 52)
    127.0.0.1.53072 > 127.0.0.1.11750: Flags [.], cksum 0xfe28 (incorrect -> 0x29e9), seq 950, ack 106023, win 512, options [nop,nop,TS val 240542971 ecr 240542971], length 0
2022-04-05 11:31:00.473236 IP (tos 0x0, ttl 64, id 22392, offset 0, flags [DF], proto TCP (6), length 4036)
    127.0.0.1.11750 > 127.0.0.1.53072: Flags [P.], cksum 0x0db9 (incorrect -> 0xd78d), seq 106023:110007, ack 950, win 512, options [nop,nop,TS val 240542976 ecr 240542971], length 3984
2022-04-05 11:31:00.473249 IP (tos 0x0, ttl 64, id 64734, offset 0, flags [DF], proto TCP (6), length 52)
    127.0.0.1.53072 > 127.0.0.1.11750: Flags [.], cksum 0xfe28 (incorrect -> 0x1a4f), seq 950, ack 110007, win 512, options [nop,nop,TS val 240542976 ecr 240542976], length 0
2022-04-05 11:31:00.485779 IP (tos 0x0, ttl 64, id 22393, offset 0, flags [DF], proto TCP (6), length 4100)
    127.0.0.1.11750 > 127.0.0.1.53072: Flags [P.], cksum 0x0df9 (incorrect -> 0x10d4), seq 110007:114055, ack 950, win 512, options [nop,nop,TS val 240542988 ecr 240542976], length 4048
2022-04-05 11:31:00.485796 IP (tos 0x0, ttl 64, id 64735, offset 0, flags [DF], proto TCP (6), length 52)
    127.0.0.1.53072 > 127.0.0.1.11750: Flags [.], cksum 0xfe28 (incorrect -> 0x0a67), seq 950, ack 114055, win 512, options [nop,nop,TS val 240542988 ecr 240542988], length 0
2022-04-05 11:31:00.485801 IP (tos 0x0, ttl 64, id 22394, offset 0, flags [DF], proto TCP (6), length 2976)
    127.0.0.1.11750 > 127.0.0.1.53072: Flags [P.], cksum 0x0995 (incorrect -> 0x9790), seq 114055:116979, ack 950, win 512, options [nop,nop,TS val 240542988 ecr 240542988], length 2924
2022-04-05 11:31:00.486157 IP (tos 0x0, ttl 64, id 64736, offset 0, flags [DF], proto TCP (6), length 52)
    127.0.0.1.53072 > 127.0.0.1.11750: Flags [.], cksum 0xfe28 (incorrect -> 0xfef9), seq 950, ack 116979, win 512, options [nop,nop,TS val 240542989 ecr 240542988], length 0
2022-04-05 11:31:00.490694 IP (tos 0x0, ttl 64, id 22395, offset 0, flags [DF], proto TCP (6), length 1048)
    127.0.0.1.11750 > 127.0.0.1.53072: Flags [P.], cksum 0x020d (incorrect -> 0xec0e), seq 116979:117975, ack 950, win 512, options [nop,nop,TS val 240542993 ecr 240542989], length 996
2022-04-05 11:31:00.490708 IP (tos 0x0, ttl 64, id 64737, offset 0, flags [DF], proto TCP (6), length 52)
    127.0.0.1.53072 > 127.0.0.1.11750: Flags [.], cksum 0xfe28 (incorrect -> 0xfb0c), seq 950, ack 117975, win 512, options [nop,nop,TS val 240542993 ecr 240542993], length 0
200, 3.542792320251465, 0.7495553493499756