2022-04-05 07:39:09.741584 IP (tos 0x0, ttl 64, id 11113, offset 0, flags [DF], proto TCP (6), length 60)
    127.0.0.1.50190 > 127.0.0.1.11250: Flags [S], cksum 0xfe30 (incorrect -> 0x21d1), seq 1911510307, win 65495, options [mss 65495,sackOK,TS val 781994113 ecr 0,nop,wscale 7], length 0
2022-04-05 07:39:09.741595 IP (tos 0x0, ttl 64, id 0, offset 0, flags [DF], proto TCP (6), length 60)
    127.0.0.1.11250 > 127.0.0.1.50190: Flags [S.], cksum 0xfe30 (incorrect -> 0x67bf), seq 862261130, ack 1911510308, win 65483, options [mss 65495,sackOK,TS val 781994113 ecr 781994113,nop,wscale 7], length 0
2022-04-05 07:39:09.741604 IP (tos 0x0, ttl 64, id 11114, offset 0, flags [DF], proto TCP (6), length 52)
    127.0.0.1.50190 > 127.0.0.1.11250: Flags [.], cksum 0xfe28 (incorrect -> 0x8e7b), seq 1, ack 1, win 512, options [nop,nop,TS val 781994113 ecr 781994113], length 0
2022-04-05 07:39:09.741763 IP (tos 0x0, ttl 64, id 11115, offset 0, flags [DF], proto TCP (6), length 55)
    127.0.0.1.50190 > 127.0.0.1.11250: Flags [P.], cksum 0xfe2b (incorrect -> 0x896f), seq 1:4, ack 1, win 512, options [nop,nop,TS val 781994113 ecr 781994113], length 3
2022-04-05 07:39:09.741772 IP (tos 0x0, ttl 64, id 4629, offset 0, flags [DF], proto TCP (6), length 52)
    127.0.0.1.11250 > 127.0.0.1.50190: Flags [.], cksum 0xfe28 (incorrect -> 0x8e78), seq 1, ack 4, win 512, options [nop,nop,TS val 781994113 ecr 781994113], length 0
2022-04-05 07:39:09.741796 IP (tos 0x0, ttl 64, id 4630, offset 0, flags [DF], proto TCP (6), length 54)
    127.0.0.1.11250 > 127.0.0.1.50190: Flags [P.], cksum 0xfe2a (incorrect -> 0x896e), seq 1:3, ack 4, win 512, options [nop,nop,TS val 781994113 ecr 781994113], length 2
2022-04-05 07:39:09.741806 IP (tos 0x0, ttl 64, id 11116, offset 0, flags [DF], proto TCP (6), length 52)
    127.0.0.1.50190 > 127.0.0.1.11250: Flags [.], cksum 0xfe28 (incorrect -> 0x8e76), seq 4, ack 3, win 512, options [nop,nop,TS val 781994113 ecr 781994113], length 0
2022-04-05 07:39:09.743202 IP (tos 0x0, ttl 64, id 11117, offset 0, flags [DF], proto TCP (6), length 62)
    127.0.0.1.50190 > 127.0.0.1.11250: Flags [P.], cksum 0xfe32 (incorrect -> 0x502d), seq 4:14, ack 3, win 512, options [nop,nop,TS val 781994114 ecr 781994113], length 10
2022-04-05 07:39:09.743226 IP (tos 0x0, ttl 64, id 4631, offset 0, flags [DF], proto TCP (6), length 52)
    127.0.0.1.11250 > 127.0.0.1.50190: Flags [.], cksum 0xfe28 (incorrect -> 0x8e6a), seq 3, ack 14, win 512, options [nop,nop,TS val 781994114 ecr 781994114], length 0
2022-04-05 07:39:09.778526 IP (tos 0x0, ttl 64, id 4632, offset 0, flags [DF], proto TCP (6), length 62)
    127.0.0.1.11250 > 127.0.0.1.50190: Flags [P.], cksum 0xfe32 (incorrect -> 0x8933), seq 3:13, ack 14, win 512, options [nop,nop,TS val 781994150 ecr 781994114], length 10
2022-04-05 07:39:09.778539 IP (tos 0x0, ttl 64, id 11118, offset 0, flags [DF], proto TCP (6), length 52)
    127.0.0.1.50190 > 127.0.0.1.11250: Flags [.], cksum 0xfe28 (incorrect -> 0x8e18), seq 14, ack 13, win 512, options [nop,nop,TS val 781994150 ecr 781994150], length 0
2022-04-05 07:39:09.784313 IP (tos 0x0, ttl 64, id 11119, offset 0, flags [DF], proto TCP (6), length 569)
    127.0.0.1.50190 > 127.0.0.1.11250: Flags [P.], cksum 0x002e (incorrect -> 0xe0c1), seq 14:531, ack 13, win 512, options [nop,nop,TS val 781994155 ecr 781994150], length 517
2022-04-05 07:39:09.784327 IP (tos 0x0, ttl 64, id 4633, offset 0, flags [DF], proto TCP (6), length 52)
    127.0.0.1.11250 > 127.0.0.1.50190: Flags [.], cksum 0xfe28 (incorrect -> 0x8c0d), seq 13, ack 531, win 508, options [nop,nop,TS val 781994155 ecr 781994155], length 0
2022-04-05 07:39:09.859747 IP (tos 0x0, ttl 64, id 4634, offset 0, flags [DF], proto TCP (6), length 1512)
    127.0.0.1.11250 > 127.0.0.1.50190: Flags [P.], cksum 0x03dd (incorrect -> 0x451a), seq 13:1473, ack 531, win 512, options [nop,nop,TS val 781994231 ecr 781994155], length 1460
2022-04-05 07:39:09.859758 IP (tos 0x0, ttl 64, id 11120, offset 0, flags [DF], proto TCP (6), length 52)
    127.0.0.1.50190 > 127.0.0.1.11250: Flags [.], cksum 0xfe28 (incorrect -> 0x85c7), seq 531, ack 1473, win 502, options [nop,nop,TS val 781994231 ecr 781994231], length 0
2022-04-05 07:39:09.873771 IP (tos 0x0, ttl 64, id 4635, offset 0, flags [DF], proto TCP (6), length 2589)
    127.0.0.1.11250 > 127.0.0.1.50190: Flags [P.], cksum 0x0812 (incorrect -> 0x8705), seq 1473:4010, ack 531, win 512, options [nop,nop,TS val 781994245 ecr 781994231], length 2537
2022-04-05 07:39:09.873779 IP (tos 0x0, ttl 64, id 11121, offset 0, flags [DF], proto TCP (6), length 52)
    127.0.0.1.50190 > 127.0.0.1.11250: Flags [.], cksum 0xfe28 (incorrect -> 0x7bc6), seq 531, ack 4010, win 498, options [nop,nop,TS val 781994245 ecr 781994245], length 0
2022-04-05 07:39:09.876185 IP (tos 0x0, ttl 64, id 11122, offset 0, flags [DF], proto TCP (6), length 210)
    127.0.0.1.50190 > 127.0.0.1.11250: Flags [P.], cksum 0xfec6 (incorrect -> 0x5009), seq 531:689, ack 4010, win 512, options [nop,nop,TS val 781994247 ecr 781994245], length 158
2022-04-05 07:39:09.876196 IP (tos 0x0, ttl 64, id 4636, offset 0, flags [DF], proto TCP (6), length 52)
    127.0.0.1.11250 > 127.0.0.1.50190: Flags [.], cksum 0xfe28 (incorrect -> 0x7b17), seq 4010, ack 689, win 511, options [nop,nop,TS val 781994247 ecr 781994247], length 0
429, 4.823741436004639, 0.362060546875