2022-04-05 11:20:58.372370 IP (tos 0x0, ttl 64, id 57690, offset 0, flags [DF], proto TCP (6), length 60)
    127.0.0.1.36274 > 127.0.0.1.9450: Flags [S], cksum 0xfe30 (incorrect -> 0xe42c), seq 164719631, win 65495, options [mss 65495,sackOK,TS val 239940875 ecr 0,nop,wscale 7], length 0
2022-04-05 11:20:58.372379 IP (tos 0x0, ttl 64, id 0, offset 0, flags [DF], proto TCP (6), length 60)
    127.0.0.1.9450 > 127.0.0.1.36274: Flags [S.], cksum 0xfe30 (incorrect -> 0x8912), seq 4065994082, ack 164719632, win 65483, options [mss 65495,sackOK,TS val 239940875 ecr 239940875,nop,wscale 7], length 0
2022-04-05 11:20:58.372385 IP (tos 0x0, ttl 64, id 57691, offset 0, flags [DF], proto TCP (6), length 52)
    127.0.0.1.36274 > 127.0.0.1.9450: Flags [.], cksum 0xfe28 (incorrect -> 0xafce), seq 1, ack 1, win 512, options [nop,nop,TS val 239940875 ecr 239940875], length 0
2022-04-05 11:20:58.372473 IP (tos 0x0, ttl 64, id 57692, offset 0, flags [DF], proto TCP (6), length 55)
    127.0.0.1.36274 > 127.0.0.1.9450: Flags [P.], cksum 0xfe2b (incorrect -> 0xaac2), seq 1:4, ack 1, win 512, options [nop,nop,TS val 239940875 ecr 239940875], length 3
2022-04-05 11:20:58.372482 IP (tos 0x0, ttl 64, id 11879, offset 0, flags [DF], proto TCP (6), length 52)
    127.0.0.1.9450 > 127.0.0.1.36274: Flags [.], cksum 0xfe28 (incorrect -> 0xafcb), seq 1, ack 4, win 512, options [nop,nop,TS val 239940875 ecr 239940875], length 0
2022-04-05 11:20:58.372522 IP (tos 0x0, ttl 64, id 11880, offset 0, flags [DF], proto TCP (6), length 54)
    127.0.0.1.9450 > 127.0.0.1.36274: Flags [P.], cksum 0xfe2a (incorrect -> 0xaac1), seq 1:3, ack 4, win 512, options [nop,nop,TS val 239940875 ecr 239940875], length 2
2022-04-05 11:20:58.372537 IP (tos 0x0, ttl 64, id 57693, offset 0, flags [DF], proto TCP (6), length 52)
    127.0.0.1.36274 > 127.0.0.1.9450: Flags [.], cksum 0xfe28 (incorrect -> 0xafc9), seq 4, ack 3, win 512, options [nop,nop,TS val 239940875 ecr 239940875], length 0
2022-04-05 11:20:58.374276 IP (tos 0x0, ttl 64, id 57694, offset 0, flags [DF], proto TCP (6), length 62)
    127.0.0.1.36274 > 127.0.0.1.9450: Flags [P.], cksum 0xfe32 (incorrect -> 0x770b), seq 4:14, ack 3, win 512, options [nop,nop,TS val 239940877 ecr 239940875], length 10
2022-04-05 11:20:58.374288 IP (tos 0x0, ttl 64, id 11881, offset 0, flags [DF], proto TCP (6), length 52)
    127.0.0.1.9450 > 127.0.0.1.36274: Flags [.], cksum 0xfe28 (incorrect -> 0xafbb), seq 3, ack 14, win 512, options [nop,nop,TS val 239940877 ecr 239940877], length 0
2022-04-05 11:20:58.762425 IP (tos 0x0, ttl 64, id 11882, offset 0, flags [DF], proto TCP (6), length 62)
    127.0.0.1.9450 > 127.0.0.1.36274: Flags [P.], cksum 0xfe32 (incorrect -> 0xa924), seq 3:13, ack 14, win 512, options [nop,nop,TS val 239941265 ecr 239940877], length 10
2022-04-05 11:20:58.762441 IP (tos 0x0, ttl 64, id 57695, offset 0, flags [DF], proto TCP (6), length 52)
    127.0.0.1.36274 > 127.0.0.1.9450: Flags [.], cksum 0xfe28 (incorrect -> 0xaca9), seq 14, ack 13, win 512, options [nop,nop,TS val 239941265 ecr 239941265], length 0
2022-04-05 11:20:58.768086 IP (tos 0x0, ttl 64, id 57696, offset 0, flags [DF], proto TCP (6), length 569)
    127.0.0.1.36274 > 127.0.0.1.9450: Flags [P.], cksum 0x002e (incorrect -> 0x3839), seq 14:531, ack 13, win 512, options [nop,nop,TS val 239941271 ecr 239941265], length 517
2022-04-05 11:20:58.768094 IP (tos 0x0, ttl 64, id 11883, offset 0, flags [DF], proto TCP (6), length 52)
    127.0.0.1.9450 > 127.0.0.1.36274: Flags [.], cksum 0xfe28 (incorrect -> 0xaa9c), seq 13, ack 531, win 508, options [nop,nop,TS val 239941271 ecr 239941271], length 0
2022-04-05 11:20:59.176445 IP (tos 0x0, ttl 64, id 11884, offset 0, flags [DF], proto TCP (6), length 3538)
    127.0.0.1.9450 > 127.0.0.1.36274: Flags [P.], cksum 0x0bc7 (incorrect -> 0x52a8), seq 13:3499, ack 531, win 512, options [nop,nop,TS val 239941679 ecr 239941271], length 3486
2022-04-05 11:20:59.176456 IP (tos 0x0, ttl 64, id 57697, offset 0, flags [DF], proto TCP (6), length 52)
    127.0.0.1.36274 > 127.0.0.1.9450: Flags [.], cksum 0xfe28 (incorrect -> 0x99dc), seq 531, ack 3499, win 494, options [nop,nop,TS val 239941679 ecr 239941679], length 0
2022-04-05 11:20:59.373279 IP (tos 0x0, ttl 64, id 11885, offset 0, flags [DF], proto TCP (6), length 811)
    127.0.0.1.9450 > 127.0.0.1.36274: Flags [P.], cksum 0x0120 (incorrect -> 0xd3fd), seq 3499:4258, ack 531, win 512, options [nop,nop,TS val 239941876 ecr 239941679], length 759
2022-04-05 11:20:59.373287 IP (tos 0x0, ttl 64, id 57698, offset 0, flags [DF], proto TCP (6), length 52)
    127.0.0.1.36274 > 127.0.0.1.9450: Flags [.], cksum 0xfe28 (incorrect -> 0x9550), seq 531, ack 4258, win 505, options [nop,nop,TS val 239941876 ecr 239941876], length 0
2022-04-05 11:20:59.373843 IP (tos 0x0, ttl 64, id 57699, offset 0, flags [DF], proto TCP (6), length 132)
    127.0.0.1.36274 > 127.0.0.1.9450: Flags [P.], cksum 0xfe78 (incorrect -> 0x61c5), seq 531:611, ack 4258, win 512, options [nop,nop,TS val 239941876 ecr 239941876], length 80
2022-04-05 11:20:59.373850 IP (tos 0x0, ttl 64, id 11886, offset 0, flags [DF], proto TCP (6), length 52)
    127.0.0.1.9450 > 127.0.0.1.36274: Flags [.], cksum 0xfe28 (incorrect -> 0x94f9), seq 4258, ack 611, win 512, options [nop,nop,TS val 239941876 ecr 239941876], length 0
2022-04-05 11:20:59.374228 IP (tos 0x0, ttl 64, id 57700, offset 0, flags [DF], proto TCP (6), length 344)
    127.0.0.1.36274 > 127.0.0.1.9450: Flags [P.], cksum 0xff4c (incorrect -> 0x332e), seq 611:903, ack 4258, win 512, options [nop,nop,TS val 239941877 ecr 239941876], length 292
2022-04-05 11:20:59.374232 IP (tos 0x0, ttl 64, id 11887, offset 0, flags [DF], proto TCP (6), length 52)
    127.0.0.1.9450 > 127.0.0.1.36274: Flags [.], cksum 0xfe28 (incorrect -> 0x93d5), seq 4258, ack 903, win 510, options [nop,nop,TS val 239941877 ecr 239941877], length 0
2022-04-05 11:20:59.774570 IP (tos 0x0, ttl 64, id 11888, offset 0, flags [DF], proto TCP (6), length 594)
    127.0.0.1.9450 > 127.0.0.1.36274: Flags [P.], cksum 0x0047 (incorrect -> 0xcf3d), seq 4258:4800, ack 903, win 512, options [nop,nop,TS val 239942277 ecr 239941877], length 542
2022-04-05 11:20:59.774576 IP (tos 0x0, ttl 64, id 57701, offset 0, flags [DF], proto TCP (6), length 52)
    127.0.0.1.36274 > 127.0.0.1.9450: Flags [.], cksum 0xfe28 (incorrect -> 0x8e99), seq 903, ack 4800, win 508, options [nop,nop,TS val 239942277 ecr 239942277], length 0
2022-04-05 11:20:59.953440 IP (tos 0x0, ttl 64, id 11889, offset 0, flags [DF], proto TCP (6), length 314)
    127.0.0.1.9450 > 127.0.0.1.36274: Flags [P.], cksum 0xff2e (incorrect -> 0x844a), seq 4800:5062, ack 903, win 512, options [nop,nop,TS val 239942456 ecr 239942277], length 262
2022-04-05 11:20:59.953446 IP (tos 0x0, ttl 64, id 57702, offset 0, flags [DF], proto TCP (6), length 52)
    127.0.0.1.36274 > 127.0.0.1.9450: Flags [.], cksum 0xfe28 (incorrect -> 0x8c2f), seq 903, ack 5062, win 506, options [nop,nop,TS val 239942456 ecr 239942456], length 0
2022-04-05 11:20:59.955097 IP (tos 0x0, ttl 64, id 57703, offset 0, flags [DF], proto TCP (6), length 350)
    127.0.0.1.36274 > 127.0.0.1.9450: Flags [P.], cksum 0xff52 (incorrect -> 0x86a9), seq 903:1201, ack 5062, win 512, options [nop,nop,TS val 239942458 ecr 239942456], length 298
2022-04-05 11:20:59.955104 IP (tos 0x0, ttl 64, id 11890, offset 0, flags [DF], proto TCP (6), length 52)
    127.0.0.1.9450 > 127.0.0.1.36274: Flags [.], cksum 0xfe28 (incorrect -> 0x8afd), seq 5062, ack 1201, win 510, options [nop,nop,TS val 239942458 ecr 239942458], length 0
2022-04-05 11:21:00.518678 IP (tos 0x0, ttl 64, id 11891, offset 0, flags [DF], proto TCP (6), length 4100)
    127.0.0.1.9450 > 127.0.0.1.36274: Flags [P.], cksum 0x0df9 (incorrect -> 0x42fb), seq 5062:9110, ack 1201, win 512, options [nop,nop,TS val 239943021 ecr 239942458], length 4048
2022-04-05 11:21:00.562665 IP (tos 0x0, ttl 64, id 57704, offset 0, flags [DF], proto TCP (6), length 52)
    127.0.0.1.36274 > 127.0.0.1.9450: Flags [.], cksum 0xfe28 (incorrect -> 0x7699), seq 1201, ack 9110, win 512, options [nop,nop,TS val 239943065 ecr 239943021], length 0
2022-04-05 11:21:00.562673 IP (tos 0x0, ttl 64, id 11892, offset 0, flags [DF], proto TCP (6), length 5919)
    127.0.0.1.9450 > 127.0.0.1.36274: Flags [P.], cksum 0x1514 (incorrect -> 0x7a32), seq 9110:14977, ack 1201, win 512, options [nop,nop,TS val 239943065 ecr 239943065], length 5867
2022-04-05 11:21:00.562677 IP (tos 0x0, ttl 64, id 57705, offset 0, flags [DF], proto TCP (6), length 52)
    127.0.0.1.36274 > 127.0.0.1.9450: Flags [.], cksum 0xfe28 (incorrect -> 0x5f9d), seq 1201, ack 14977, win 485, options [nop,nop,TS val 239943065 ecr 239943065], length 0
200, 10.419258117675781, 2.5302836894989014