2022-04-05 20:59:14.722891 IP (tos 0x0, ttl 64, id 31573, offset 0, flags [DF], proto TCP (6), length 60)
    127.0.0.1.50996 > 127.0.0.1.11250: Flags [S], cksum 0xfe30 (incorrect -> 0x769f), seq 849936779, win 65495, options [mss 65495,sackOK,TS val 274637225 ecr 0,nop,wscale 7], length 0
2022-04-05 20:59:14.722901 IP (tos 0x0, ttl 64, id 0, offset 0, flags [DF], proto TCP (6), length 60)
    127.0.0.1.11250 > 127.0.0.1.50996: Flags [S.], cksum 0xfe30 (incorrect -> 0xb0d7), seq 1914151331, ack 849936780, win 65483, options [mss 65495,sackOK,TS val 274637225 ecr 274637225,nop,wscale 7], length 0
2022-04-05 20:59:14.722910 IP (tos 0x0, ttl 64, id 31574, offset 0, flags [DF], proto TCP (6), length 52)
    127.0.0.1.50996 > 127.0.0.1.11250: Flags [.], cksum 0xfe28 (incorrect -> 0xd793), seq 1, ack 1, win 512, options [nop,nop,TS val 274637225 ecr 274637225], length 0
2022-04-05 20:59:14.723031 IP (tos 0x0, ttl 64, id 31575, offset 0, flags [DF], proto TCP (6), length 55)
    127.0.0.1.50996 > 127.0.0.1.11250: Flags [P.], cksum 0xfe2b (incorrect -> 0xd287), seq 1:4, ack 1, win 512, options [nop,nop,TS val 274637225 ecr 274637225], length 3
2022-04-05 20:59:14.723046 IP (tos 0x0, ttl 64, id 25660, offset 0, flags [DF], proto TCP (6), length 52)
    127.0.0.1.11250 > 127.0.0.1.50996: Flags [.], cksum 0xfe28 (incorrect -> 0xd790), seq 1, ack 4, win 512, options [nop,nop,TS val 274637225 ecr 274637225], length 0
2022-04-05 20:59:14.723120 IP (tos 0x0, ttl 64, id 25661, offset 0, flags [DF], proto TCP (6), length 54)
    127.0.0.1.11250 > 127.0.0.1.50996: Flags [P.], cksum 0xfe2a (incorrect -> 0xd285), seq 1:3, ack 4, win 512, options [nop,nop,TS val 274637226 ecr 274637225], length 2
2022-04-05 20:59:14.723142 IP (tos 0x0, ttl 64, id 31576, offset 0, flags [DF], proto TCP (6), length 52)
    127.0.0.1.50996 > 127.0.0.1.11250: Flags [.], cksum 0xfe28 (incorrect -> 0xd78c), seq 4, ack 3, win 512, options [nop,nop,TS val 274637226 ecr 274637226], length 0
2022-04-05 20:59:14.725138 IP (tos 0x0, ttl 64, id 31577, offset 0, flags [DF], proto TCP (6), length 62)
    127.0.0.1.50996 > 127.0.0.1.11250: Flags [P.], cksum 0xfe32 (incorrect -> 0x3ea3), seq 4:14, ack 3, win 512, options [nop,nop,TS val 274637228 ecr 274637226], length 10
2022-04-05 20:59:14.725157 IP (tos 0x0, ttl 64, id 25662, offset 0, flags [DF], proto TCP (6), length 52)
    127.0.0.1.11250 > 127.0.0.1.50996: Flags [.], cksum 0xfe28 (incorrect -> 0xd77e), seq 3, ack 14, win 512, options [nop,nop,TS val 274637228 ecr 274637228], length 0
2022-04-05 20:59:14.775189 IP (tos 0x0, ttl 64, id 25663, offset 0, flags [DF], proto TCP (6), length 62)
    127.0.0.1.11250 > 127.0.0.1.50996: Flags [P.], cksum 0xfe32 (incorrect -> 0xd239), seq 3:13, ack 14, win 512, options [nop,nop,TS val 274637278 ecr 274637228], length 10
2022-04-05 20:59:14.775201 IP (tos 0x0, ttl 64, id 31578, offset 0, flags [DF], proto TCP (6), length 52)
    127.0.0.1.50996 > 127.0.0.1.11250: Flags [.], cksum 0xfe28 (incorrect -> 0xd710), seq 14, ack 13, win 512, options [nop,nop,TS val 274637278 ecr 274637278], length 0
2022-04-05 20:59:14.781912 IP (tos 0x0, ttl 64, id 31579, offset 0, flags [DF], proto TCP (6), length 569)
    127.0.0.1.50996 > 127.0.0.1.11250: Flags [P.], cksum 0x002e (incorrect -> 0x6783), seq 14:531, ack 13, win 512, options [nop,nop,TS val 274637284 ecr 274637278], length 517
2022-04-05 20:59:14.781923 IP (tos 0x0, ttl 64, id 25664, offset 0, flags [DF], proto TCP (6), length 52)
    127.0.0.1.11250 > 127.0.0.1.50996: Flags [.], cksum 0xfe28 (incorrect -> 0xd503), seq 13, ack 531, win 508, options [nop,nop,TS val 274637284 ecr 274637284], length 0
2022-04-05 20:59:14.828513 IP (tos 0x0, ttl 64, id 25665, offset 0, flags [DF], proto TCP (6), length 3538)
    127.0.0.1.11250 > 127.0.0.1.50996: Flags [P.], cksum 0x0bc7 (incorrect -> 0x5102), seq 13:3499, ack 531, win 512, options [nop,nop,TS val 274637331 ecr 274637284], length 3486
2022-04-05 20:59:14.828523 IP (tos 0x0, ttl 64, id 31580, offset 0, flags [DF], proto TCP (6), length 52)
    127.0.0.1.50996 > 127.0.0.1.11250: Flags [.], cksum 0xfe28 (incorrect -> 0xc715), seq 531, ack 3499, win 494, options [nop,nop,TS val 274637331 ecr 274637331], length 0
2022-04-05 20:59:14.852271 IP (tos 0x0, ttl 64, id 25666, offset 0, flags [DF], proto TCP (6), length 1840)
    127.0.0.1.11250 > 127.0.0.1.50996: Flags [P.], cksum 0x0525 (incorrect -> 0x7ced), seq 3499:5287, ack 531, win 512, options [nop,nop,TS val 274637355 ecr 274637331], length 1788
2022-04-05 20:59:14.852279 IP (tos 0x0, ttl 64, id 31581, offset 0, flags [DF], proto TCP (6), length 52)
    127.0.0.1.50996 > 127.0.0.1.11250: Flags [.], cksum 0xfe28 (incorrect -> 0xbfe2), seq 531, ack 5287, win 501, options [nop,nop,TS val 274637355 ecr 274637355], length 0
2022-04-05 20:59:14.854809 IP (tos 0x0, ttl 64, id 31582, offset 0, flags [DF], proto TCP (6), length 210)
    127.0.0.1.50996 > 127.0.0.1.11250: Flags [P.], cksum 0xfec6 (incorrect -> 0x92ab), seq 531:689, ack 5287, win 512, options [nop,nop,TS val 274637357 ecr 274637355], length 158
2022-04-05 20:59:14.854819 IP (tos 0x0, ttl 64, id 25667, offset 0, flags [DF], proto TCP (6), length 52)
    127.0.0.1.11250 > 127.0.0.1.50996: Flags [.], cksum 0xfe28 (incorrect -> 0xbf36), seq 5287, ack 689, win 511, options [nop,nop,TS val 274637357 ecr 274637357], length 0
200, 4.897783279418945, 0.37414002418518066