2022-04-05 09:57:17.312542 IP (tos 0x0, ttl 64, id 45358, offset 0, flags [DF], proto TCP (6), length 60)
    127.0.0.1.51938 > 127.0.0.1.9250: Flags [S], cksum 0xfe30 (incorrect -> 0xd278), seq 3040865365, win 65495, options [mss 65495,sackOK,TS val 790281684 ecr 0,nop,wscale 7], length 0
2022-04-05 09:57:17.312549 IP (tos 0x0, ttl 64, id 0, offset 0, flags [DF], proto TCP (6), length 60)
    127.0.0.1.9250 > 127.0.0.1.51938: Flags [S.], cksum 0xfe30 (incorrect -> 0xdd32), seq 3949337835, ack 3040865366, win 65483, options [mss 65495,sackOK,TS val 790281684 ecr 790281684,nop,wscale 7], length 0
2022-04-05 09:57:17.312556 IP (tos 0x0, ttl 64, id 45359, offset 0, flags [DF], proto TCP (6), length 52)
    127.0.0.1.51938 > 127.0.0.1.9250: Flags [.], cksum 0xfe28 (incorrect -> 0x03ef), seq 1, ack 1, win 512, options [nop,nop,TS val 790281684 ecr 790281684], length 0
2022-04-05 09:57:17.312710 IP (tos 0x0, ttl 64, id 45360, offset 0, flags [DF], proto TCP (6), length 55)
    127.0.0.1.51938 > 127.0.0.1.9250: Flags [P.], cksum 0xfe2b (incorrect -> 0xfee2), seq 1:4, ack 1, win 512, options [nop,nop,TS val 790281684 ecr 790281684], length 3
2022-04-05 09:57:17.312713 IP (tos 0x0, ttl 64, id 34951, offset 0, flags [DF], proto TCP (6), length 52)
    127.0.0.1.9250 > 127.0.0.1.51938: Flags [.], cksum 0xfe28 (incorrect -> 0x03ec), seq 1, ack 4, win 512, options [nop,nop,TS val 790281684 ecr 790281684], length 0
2022-04-05 09:57:17.312784 IP (tos 0x0, ttl 64, id 34952, offset 0, flags [DF], proto TCP (6), length 54)
    127.0.0.1.9250 > 127.0.0.1.51938: Flags [P.], cksum 0xfe2a (incorrect -> 0xfee1), seq 1:3, ack 4, win 512, options [nop,nop,TS val 790281684 ecr 790281684], length 2
2022-04-05 09:57:17.312788 IP (tos 0x0, ttl 64, id 45361, offset 0, flags [DF], proto TCP (6), length 52)
    127.0.0.1.51938 > 127.0.0.1.9250: Flags [.], cksum 0xfe28 (incorrect -> 0x03ea), seq 4, ack 3, win 512, options [nop,nop,TS val 790281684 ecr 790281684], length 0
2022-04-05 09:57:17.313822 IP (tos 0x0, ttl 64, id 45362, offset 0, flags [DF], proto TCP (6), length 62)
    127.0.0.1.51938 > 127.0.0.1.9250: Flags [P.], cksum 0xfe32 (incorrect -> 0xb64b), seq 4:14, ack 3, win 512, options [nop,nop,TS val 790281685 ecr 790281684], length 10
2022-04-05 09:57:17.313830 IP (tos 0x0, ttl 64, id 34953, offset 0, flags [DF], proto TCP (6), length 52)
    127.0.0.1.9250 > 127.0.0.1.51938: Flags [.], cksum 0xfe28 (incorrect -> 0x03de), seq 3, ack 14, win 512, options [nop,nop,TS val 790281685 ecr 790281685], length 0
2022-04-05 09:57:17.595833 IP (tos 0x0, ttl 64, id 34954, offset 0, flags [DF], proto TCP (6), length 62)
    127.0.0.1.9250 > 127.0.0.1.51938: Flags [P.], cksum 0xfe32 (incorrect -> 0xfdb0), seq 3:13, ack 14, win 512, options [nop,nop,TS val 790281967 ecr 790281685], length 10
2022-04-05 09:57:17.595838 IP (tos 0x0, ttl 64, id 45363, offset 0, flags [DF], proto TCP (6), length 52)
    127.0.0.1.51938 > 127.0.0.1.9250: Flags [.], cksum 0xfe28 (incorrect -> 0x01a0), seq 14, ack 13, win 512, options [nop,nop,TS val 790281967 ecr 790281967], length 0
2022-04-05 09:57:17.601347 IP (tos 0x0, ttl 64, id 45364, offset 0, flags [DF], proto TCP (6), length 569)
    127.0.0.1.51938 > 127.0.0.1.9250: Flags [P.], cksum 0x002e (incorrect -> 0x6033), seq 14:531, ack 13, win 512, options [nop,nop,TS val 790281972 ecr 790281967], length 517
2022-04-05 09:57:17.601355 IP (tos 0x0, ttl 64, id 34955, offset 0, flags [DF], proto TCP (6), length 52)
    127.0.0.1.9250 > 127.0.0.1.51938: Flags [.], cksum 0xfe28 (incorrect -> 0xff94), seq 13, ack 531, win 508, options [nop,nop,TS val 790281972 ecr 790281972], length 0
2022-04-05 09:57:17.791972 IP (tos 0x0, ttl 64, id 34956, offset 0, flags [DF], proto TCP (6), length 2948)
    127.0.0.1.9250 > 127.0.0.1.51938: Flags [P.], cksum 0x0979 (incorrect -> 0x2ca0), seq 13:2909, ack 531, win 512, options [nop,nop,TS val 790282163 ecr 790281972], length 2896
2022-04-05 09:57:17.791982 IP (tos 0x0, ttl 64, id 45365, offset 0, flags [DF], proto TCP (6), length 52)
    127.0.0.1.51938 > 127.0.0.1.9250: Flags [.], cksum 0xfe28 (incorrect -> 0xf2d2), seq 531, ack 2909, win 496, options [nop,nop,TS val 790282163 ecr 790282163], length 0
2022-04-05 09:57:17.815556 IP (tos 0x0, ttl 64, id 34957, offset 0, flags [DF], proto TCP (6), length 444)
    127.0.0.1.9250 > 127.0.0.1.51938: Flags [P.], cksum 0xffb0 (incorrect -> 0x6883), seq 2909:3301, ack 531, win 512, options [nop,nop,TS val 790282187 ecr 790282163], length 392
2022-04-05 09:57:17.815560 IP (tos 0x0, ttl 64, id 45366, offset 0, flags [DF], proto TCP (6), length 52)
    127.0.0.1.51938 > 127.0.0.1.9250: Flags [.], cksum 0xfe28 (incorrect -> 0xf110), seq 531, ack 3301, win 506, options [nop,nop,TS val 790282187 ecr 790282187], length 0
2022-04-05 09:57:17.816224 IP (tos 0x0, ttl 64, id 45367, offset 0, flags [DF], proto TCP (6), length 145)
    127.0.0.1.51938 > 127.0.0.1.9250: Flags [P.], cksum 0xfe85 (incorrect -> 0xc1bc), seq 531:624, ack 3301, win 512, options [nop,nop,TS val 790282187 ecr 790282187], length 93
2022-04-05 09:57:17.816236 IP (tos 0x0, ttl 64, id 34958, offset 0, flags [DF], proto TCP (6), length 52)
    127.0.0.1.9250 > 127.0.0.1.51938: Flags [.], cksum 0xfe28 (incorrect -> 0xf0ad), seq 3301, ack 624, win 512, options [nop,nop,TS val 790282187 ecr 790282187], length 0
2022-04-05 09:57:18.076862 IP (tos 0x0, ttl 64, id 34959, offset 0, flags [DF], proto TCP (6), length 103)
    127.0.0.1.9250 > 127.0.0.1.51938: Flags [P.], cksum 0xfe5b (incorrect -> 0xda89), seq 3301:3352, ack 624, win 512, options [nop,nop,TS val 790282448 ecr 790282187], length 51
2022-04-05 09:57:18.076874 IP (tos 0x0, ttl 64, id 45368, offset 0, flags [DF], proto TCP (6), length 52)
    127.0.0.1.51938 > 127.0.0.1.9250: Flags [.], cksum 0xfe28 (incorrect -> 0xee70), seq 624, ack 3352, win 512, options [nop,nop,TS val 790282448 ecr 790282448], length 0
2022-04-05 09:57:18.077432 IP (tos 0x0, ttl 64, id 45369, offset 0, flags [DF], proto TCP (6), length 375)
    127.0.0.1.51938 > 127.0.0.1.9250: Flags [P.], cksum 0xff6b (incorrect -> 0xa9d8), seq 624:947, ack 3352, win 512, options [nop,nop,TS val 790282449 ecr 790282448], length 323
2022-04-05 09:57:18.077440 IP (tos 0x0, ttl 64, id 34960, offset 0, flags [DF], proto TCP (6), length 52)
    127.0.0.1.9250 > 127.0.0.1.51938: Flags [.], cksum 0xfe28 (incorrect -> 0xed2d), seq 3352, ack 947, win 510, options [nop,nop,TS val 790282449 ecr 790282449], length 0
2022-04-05 09:57:18.335094 IP (tos 0x0, ttl 64, id 34961, offset 0, flags [DF], proto TCP (6), length 3446)
    127.0.0.1.9250 > 127.0.0.1.51938: Flags [P.], cksum 0x0b6b (incorrect -> 0x0828), seq 3352:6746, ack 947, win 512, options [nop,nop,TS val 790282706 ecr 790282449], length 3394
2022-04-05 09:57:18.377381 IP (tos 0x0, ttl 64, id 45370, offset 0, flags [DF], proto TCP (6), length 52)
    127.0.0.1.51938 > 127.0.0.1.9250: Flags [.], cksum 0xfe28 (incorrect -> 0xddbd), seq 947, ack 6746, win 512, options [nop,nop,TS val 790282748 ecr 790282706], length 0
2022-04-05 09:57:18.377389 IP (tos 0x0, ttl 64, id 34962, offset 0, flags [DF], proto TCP (6), length 12502)
    127.0.0.1.9250 > 127.0.0.1.51938: Flags [P.], cksum 0x2ecb (incorrect -> 0x20cc), seq 6746:19196, ack 947, win 512, options [nop,nop,TS val 790282748 ecr 790282748], length 12450
2022-04-05 09:57:18.377393 IP (tos 0x0, ttl 64, id 45371, offset 0, flags [DF], proto TCP (6), length 52)
    127.0.0.1.51938 > 127.0.0.1.9250: Flags [.], cksum 0xfe28 (incorrect -> 0xad26), seq 947, ack 19196, win 459, options [nop,nop,TS val 790282748 ecr 790282748], length 0
2022-04-05 09:57:18.382149 IP (tos 0x0, ttl 64, id 34963, offset 0, flags [DF], proto TCP (6), length 1584)
    127.0.0.1.9250 > 127.0.0.1.51938: Flags [P.], cksum 0x0425 (incorrect -> 0x52e4), seq 19196:20728, ack 947, win 512, options [nop,nop,TS val 790282753 ecr 790282748], length 1532
2022-04-05 09:57:18.382153 IP (tos 0x0, ttl 64, id 45372, offset 0, flags [DF], proto TCP (6), length 52)
    127.0.0.1.51938 > 127.0.0.1.9250: Flags [.], cksum 0xfe28 (incorrect -> 0xa6f5), seq 947, ack 20728, win 502, options [nop,nop,TS val 790282753 ecr 790282753], length 0
2022-04-05 09:57:18.429883 IP (tos 0x0, ttl 64, id 34964, offset 0, flags [DF], proto TCP (6), length 2948)
    127.0.0.1.9250 > 127.0.0.1.51938: Flags [P.], cksum 0x0979 (incorrect -> 0x3e48), seq 20728:23624, ack 947, win 512, options [nop,nop,TS val 790282801 ecr 790282753], length 2896
2022-04-05 09:57:18.429888 IP (tos 0x0, ttl 64, id 45373, offset 0, flags [DF], proto TCP (6), length 52)
    127.0.0.1.51938 > 127.0.0.1.9250: Flags [.], cksum 0xfe28 (incorrect -> 0x9b4b), seq 947, ack 23624, win 496, options [nop,nop,TS val 790282801 ecr 790282801], length 0
2022-04-05 09:57:18.434102 IP (tos 0x0, ttl 64, id 34965, offset 0, flags [DF], proto TCP (6), length 3446)
    127.0.0.1.9250 > 127.0.0.1.51938: Flags [P.], cksum 0x0b6b (incorrect -> 0x2b12), seq 23624:27018, ack 947, win 512, options [nop,nop,TS val 790282805 ecr 790282801], length 3394
2022-04-05 09:57:18.434107 IP (tos 0x0, ttl 64, id 45374, offset 0, flags [DF], proto TCP (6), length 52)
    127.0.0.1.51938 > 127.0.0.1.9250: Flags [.], cksum 0xfe28 (incorrect -> 0x8e03), seq 947, ack 27018, win 494, options [nop,nop,TS val 790282805 ecr 790282805], length 0
2022-04-05 09:57:18.437364 IP (tos 0x0, ttl 64, id 34966, offset 0, flags [DF], proto TCP (6), length 2948)
    127.0.0.1.9250 > 127.0.0.1.51938: Flags [P.], cksum 0x0979 (incorrect -> 0xe44f), seq 27018:29914, ack 947, win 512, options [nop,nop,TS val 790282808 ecr 790282805], length 2896
2022-04-05 09:57:18.437383 IP (tos 0x0, ttl 64, id 45375, offset 0, flags [DF], proto TCP (6), length 52)
    127.0.0.1.51938 > 127.0.0.1.9250: Flags [.], cksum 0xfe28 (incorrect -> 0x82ab), seq 947, ack 29914, win 496, options [nop,nop,TS val 790282808 ecr 790282808], length 0
2022-04-05 09:57:18.441239 IP (tos 0x0, ttl 64, id 34967, offset 0, flags [DF], proto TCP (6), length 4100)
    127.0.0.1.9250 > 127.0.0.1.51938: Flags [P.], cksum 0x0df9 (incorrect -> 0xd6f7), seq 29914:33962, ack 947, win 512, options [nop,nop,TS val 790282812 ecr 790282808], length 4048
2022-04-05 09:57:18.441243 IP (tos 0x0, ttl 64, id 45376, offset 0, flags [DF], proto TCP (6), length 52)
    127.0.0.1.51938 > 127.0.0.1.9250: Flags [.], cksum 0xfe28 (incorrect -> 0x72d7), seq 947, ack 33962, win 492, options [nop,nop,TS val 790282812 ecr 790282812], length 0
2022-04-05 09:57:18.441257 IP (tos 0x0, ttl 64, id 34968, offset 0, flags [DF], proto TCP (6), length 2976)
    127.0.0.1.9250 > 127.0.0.1.51938: Flags [P.], cksum 0x0995 (incorrect -> 0x67e6), seq 33962:36886, ack 947, win 512, options [nop,nop,TS val 790282812 ecr 790282812], length 2924
2022-04-05 09:57:18.441259 IP (tos 0x0, ttl 64, id 45377, offset 0, flags [DF], proto TCP (6), length 52)
    127.0.0.1.51938 > 127.0.0.1.9250: Flags [.], cksum 0xfe28 (incorrect -> 0x6767), seq 947, ack 36886, win 496, options [nop,nop,TS val 790282812 ecr 790282812], length 0
2022-04-05 09:57:18.441508 IP (tos 0x0, ttl 64, id 34969, offset 0, flags [DF], proto TCP (6), length 4036)
    127.0.0.1.9250 > 127.0.0.1.51938: Flags [P.], cksum 0x0db9 (incorrect -> 0xb01d), seq 36886:40870, ack 947, win 512, options [nop,nop,TS val 790282813 ecr 790282812], length 3984
2022-04-05 09:57:18.441512 IP (tos 0x0, ttl 64, id 45378, offset 0, flags [DF], proto TCP (6), length 52)
    127.0.0.1.51938 > 127.0.0.1.9250: Flags [.], cksum 0xfe28 (incorrect -> 0x57d9), seq 947, ack 40870, win 492, options [nop,nop,TS val 790282813 ecr 790282813], length 0
2022-04-05 09:57:18.445085 IP (tos 0x0, ttl 64, id 34970, offset 0, flags [DF], proto TCP (6), length 2044)
    127.0.0.1.9250 > 127.0.0.1.51938: Flags [P.], cksum 0x05f1 (incorrect -> 0xc2f6), seq 40870:42862, ack 947, win 512, options [nop,nop,TS val 790282816 ecr 790282813], length 1992
2022-04-05 09:57:18.445098 IP (tos 0x0, ttl 64, id 45379, offset 0, flags [DF], proto TCP (6), length 52)
    127.0.0.1.51938 > 127.0.0.1.9250: Flags [.], cksum 0xfe28 (incorrect -> 0x4ff7), seq 947, ack 42862, win 512, options [nop,nop,TS val 790282816 ecr 790282816], length 0
2022-04-05 09:57:18.451989 IP (tos 0x0, ttl 64, id 34971, offset 0, flags [DF], proto TCP (6), length 4036)
    127.0.0.1.9250 > 127.0.0.1.51938: Flags [P.], cksum 0x0db9 (incorrect -> 0x6fb1), seq 42862:46846, ack 947, win 512, options [nop,nop,TS val 790282823 ecr 790282816], length 3984
2022-04-05 09:57:18.452002 IP (tos 0x0, ttl 64, id 45380, offset 0, flags [DF], proto TCP (6), length 52)
    127.0.0.1.51938 > 127.0.0.1.9250: Flags [.], cksum 0xfe28 (incorrect -> 0x4059), seq 947, ack 46846, win 512, options [nop,nop,TS val 790282823 ecr 790282823], length 0
2022-04-05 09:57:18.461903 IP (tos 0x0, ttl 64, id 34972, offset 0, flags [DF], proto TCP (6), length 3538)
    127.0.0.1.9250 > 127.0.0.1.51938: Flags [P.], cksum 0x0bc7 (incorrect -> 0x359e), seq 46846:50332, ack 947, win 512, options [nop,nop,TS val 790282833 ecr 790282823], length 3486
2022-04-05 09:57:18.461913 IP (tos 0x0, ttl 64, id 45381, offset 0, flags [DF], proto TCP (6), length 52)
    127.0.0.1.51938 > 127.0.0.1.9250: Flags [.], cksum 0xfe28 (incorrect -> 0x32a7), seq 947, ack 50332, win 512, options [nop,nop,TS val 790282833 ecr 790282833], length 0
2022-04-05 09:57:18.477032 IP (tos 0x0, ttl 64, id 34973, offset 0, flags [DF], proto TCP (6), length 1048)
    127.0.0.1.9250 > 127.0.0.1.51938: Flags [P.], cksum 0x020d (incorrect -> 0x434e), seq 50332:51328, ack 947, win 512, options [nop,nop,TS val 790282848 ecr 790282833], length 996
2022-04-05 09:57:18.477052 IP (tos 0x0, ttl 64, id 45382, offset 0, flags [DF], proto TCP (6), length 52)
    127.0.0.1.51938 > 127.0.0.1.9250: Flags [.], cksum 0xfe28 (incorrect -> 0x2ea5), seq 947, ack 51328, win 512, options [nop,nop,TS val 790282848 ecr 790282848], length 0
2022-04-05 09:57:18.477948 IP (tos 0x0, ttl 64, id 34974, offset 0, flags [DF], proto TCP (6), length 1308)
    127.0.0.1.9250 > 127.0.0.1.51938: Flags [P.], cksum 0x0311 (incorrect -> 0xb51c), seq 51328:52584, ack 947, win 512, options [nop,nop,TS val 790282849 ecr 790282848], length 1256
2022-04-05 09:57:18.477957 IP (tos 0x0, ttl 64, id 45383, offset 0, flags [DF], proto TCP (6), length 52)
    127.0.0.1.51938 > 127.0.0.1.9250: Flags [.], cksum 0xfe28 (incorrect -> 0x29bb), seq 947, ack 52584, win 512, options [nop,nop,TS val 790282849 ecr 790282849], length 0
2022-04-05 09:57:18.542001 IP (tos 0x0, ttl 64, id 34975, offset 0, flags [DF], proto TCP (6), length 1500)
    127.0.0.1.9250 > 127.0.0.1.51938: Flags [P.], cksum 0x03d1 (incorrect -> 0x4567), seq 52584:54032, ack 947, win 512, options [nop,nop,TS val 790282913 ecr 790282849], length 1448
2022-04-05 09:57:18.542063 IP (tos 0x0, ttl 64, id 45384, offset 0, flags [DF], proto TCP (6), length 52)
    127.0.0.1.51938 > 127.0.0.1.9250: Flags [.], cksum 0xfe28 (incorrect -> 0x2393), seq 947, ack 54032, win 512, options [nop,nop,TS val 790282913 ecr 790282913], length 0
2022-04-05 09:57:18.558605 IP (tos 0x0, ttl 64, id 34976, offset 0, flags [DF], proto TCP (6), length 4100)
    127.0.0.1.9250 > 127.0.0.1.51938: Flags [P.], cksum 0x0df9 (incorrect -> 0x627a), seq 54032:58080, ack 947, win 512, options [nop,nop,TS val 790282930 ecr 790282913], length 4048
2022-04-05 09:57:18.558616 IP (tos 0x0, ttl 64, id 45385, offset 0, flags [DF], proto TCP (6), length 52)
    127.0.0.1.51938 > 127.0.0.1.9250: Flags [.], cksum 0xfe28 (incorrect -> 0x13a1), seq 947, ack 58080, win 512, options [nop,nop,TS val 790282930 ecr 790282930], length 0
2022-04-05 09:57:18.558639 IP (tos 0x0, ttl 64, id 34977, offset 0, flags [DF], proto TCP (6), length 2792)
    127.0.0.1.9250 > 127.0.0.1.51938: Flags [P.], cksum 0x08dd (incorrect -> 0x65d4), seq 58080:60820, ack 947, win 512, options [nop,nop,TS val 790282930 ecr 790282930], length 2740
2022-04-05 09:57:18.558646 IP (tos 0x0, ttl 64, id 45386, offset 0, flags [DF], proto TCP (6), length 52)
    127.0.0.1.51938 > 127.0.0.1.9250: Flags [.], cksum 0xfe28 (incorrect -> 0x08ed), seq 947, ack 60820, win 512, options [nop,nop,TS val 790282930 ecr 790282930], length 0
2022-04-05 09:57:18.558682 IP (tos 0x0, ttl 64, id 34978, offset 0, flags [DF], proto TCP (6), length 3898)
    127.0.0.1.9250 > 127.0.0.1.51938: Flags [P.], cksum 0x0d2f (incorrect -> 0x98c6), seq 60820:64666, ack 947, win 512, options [nop,nop,TS val 790282930 ecr 790282930], length 3846
2022-04-05 09:57:18.558689 IP (tos 0x0, ttl 64, id 45387, offset 0, flags [DF], proto TCP (6), length 52)
    127.0.0.1.51938 > 127.0.0.1.9250: Flags [.], cksum 0xfe28 (incorrect -> 0xf9e6), seq 947, ack 64666, win 512, options [nop,nop,TS val 790282930 ecr 790282930], length 0
2022-04-05 09:57:18.564190 IP (tos 0x0, ttl 64, id 34979, offset 0, flags [DF], proto TCP (6), length 3944)
    127.0.0.1.9250 > 127.0.0.1.51938: Flags [P.], cksum 0x0d5d (incorrect -> 0xb408), seq 64666:68558, ack 947, win 512, options [nop,nop,TS val 790282935 ecr 790282930], length 3892
2022-04-05 09:57:18.564200 IP (tos 0x0, ttl 64, id 45388, offset 0, flags [DF], proto TCP (6), length 52)
    127.0.0.1.51938 > 127.0.0.1.9250: Flags [.], cksum 0xfe28 (incorrect -> 0xeaa8), seq 947, ack 68558, win 512, options [nop,nop,TS val 790282935 ecr 790282935], length 0
2022-04-05 09:57:18.568713 IP (tos 0x0, ttl 64, id 34980, offset 0, flags [DF], proto TCP (6), length 4100)
    127.0.0.1.9250 > 127.0.0.1.51938: Flags [P.], cksum 0x0df9 (incorrect -> 0x9bb6), seq 68558:72606, ack 947, win 512, options [nop,nop,TS val 790282940 ecr 790282935], length 4048
2022-04-05 09:57:18.568795 IP (tos 0x0, ttl 64, id 45389, offset 0, flags [DF], proto TCP (6), length 52)
    127.0.0.1.51938 > 127.0.0.1.9250: Flags [.], cksum 0xfe28 (incorrect -> 0xdace), seq 947, ack 72606, win 512, options [nop,nop,TS val 790282940 ecr 790282940], length 0
2022-04-05 09:57:18.568805 IP (tos 0x0, ttl 64, id 34981, offset 0, flags [DF], proto TCP (6), length 3474)
    127.0.0.1.9250 > 127.0.0.1.51938: Flags [P.], cksum 0x0b87 (incorrect -> 0xcf98), seq 72606:76028, ack 947, win 512, options [nop,nop,TS val 790282940 ecr 790282940], length 3422
2022-04-05 09:57:18.568814 IP (tos 0x0, ttl 64, id 45390, offset 0, flags [DF], proto TCP (6), length 52)
    127.0.0.1.51938 > 127.0.0.1.9250: Flags [.], cksum 0xfe28 (incorrect -> 0xcd70), seq 947, ack 76028, win 512, options [nop,nop,TS val 790282940 ecr 790282940], length 0
2022-04-05 09:57:18.568871 IP (tos 0x0, ttl 64, id 34982, offset 0, flags [DF], proto TCP (6), length 4036)
    127.0.0.1.9250 > 127.0.0.1.51938: Flags [P.], cksum 0x0db9 (incorrect -> 0xf157), seq 76028:80012, ack 947, win 512, options [nop,nop,TS val 790282940 ecr 790282940], length 3984
2022-04-05 09:57:18.568882 IP (tos 0x0, ttl 64, id 45391, offset 0, flags [DF], proto TCP (6), length 52)
    127.0.0.1.51938 > 127.0.0.1.9250: Flags [.], cksum 0xfe28 (incorrect -> 0xbde0), seq 947, ack 80012, win 512, options [nop,nop,TS val 790282940 ecr 790282940], length 0
2022-04-05 09:57:18.574203 IP (tos 0x0, ttl 64, id 34983, offset 0, flags [DF], proto TCP (6), length 4100)
    127.0.0.1.9250 > 127.0.0.1.51938: Flags [P.], cksum 0x0df9 (incorrect -> 0xc429), seq 80012:84060, ack 947, win 512, options [nop,nop,TS val 790282945 ecr 790282940], length 4048
2022-04-05 09:57:18.574215 IP (tos 0x0, ttl 64, id 45392, offset 0, flags [DF], proto TCP (6), length 52)
    127.0.0.1.51938 > 127.0.0.1.9250: Flags [.], cksum 0xfe28 (incorrect -> 0xae06), seq 947, ack 84060, win 512, options [nop,nop,TS val 790282945 ecr 790282945], length 0
2022-04-05 09:57:18.574224 IP (tos 0x0, ttl 64, id 34984, offset 0, flags [DF], proto TCP (6), length 984)
    127.0.0.1.9250 > 127.0.0.1.51938: Flags [P.], cksum 0x01cd (incorrect -> 0x1402), seq 84060:84992, ack 947, win 512, options [nop,nop,TS val 790282945 ecr 790282945], length 932
2022-04-05 09:57:18.574231 IP (tos 0x0, ttl 64, id 45393, offset 0, flags [DF], proto TCP (6), length 52)
    127.0.0.1.51938 > 127.0.0.1.9250: Flags [.], cksum 0xfe28 (incorrect -> 0xaa62), seq 947, ack 84992, win 512, options [nop,nop,TS val 790282945 ecr 790282945], length 0
2022-04-05 09:57:18.574265 IP (tos 0x0, ttl 64, id 34985, offset 0, flags [DF], proto TCP (6), length 2542)
    127.0.0.1.9250 > 127.0.0.1.51938: Flags [P.], cksum 0x07e3 (incorrect -> 0xab7c), seq 84992:87482, ack 947, win 512, options [nop,nop,TS val 790282945 ecr 790282945], length 2490
2022-04-05 09:57:18.574325 IP (tos 0x0, ttl 64, id 45394, offset 0, flags [DF], proto TCP (6), length 52)
    127.0.0.1.51938 > 127.0.0.1.9250: Flags [.], cksum 0xfe28 (incorrect -> 0xa0a8), seq 947, ack 87482, win 512, options [nop,nop,TS val 790282945 ecr 790282945], length 0
2022-04-05 09:57:18.574473 IP (tos 0x0, ttl 64, id 34986, offset 0, flags [DF], proto TCP (6), length 3538)
    127.0.0.1.9250 > 127.0.0.1.51938: Flags [P.], cksum 0x0bc7 (incorrect -> 0xa606), seq 87482:90968, ack 947, win 512, options [nop,nop,TS val 790282946 ecr 790282945], length 3486
2022-04-05 09:57:18.574482 IP (tos 0x0, ttl 64, id 45395, offset 0, flags [DF], proto TCP (6), length 52)
    127.0.0.1.51938 > 127.0.0.1.9250: Flags [.], cksum 0xfe28 (incorrect -> 0x9308), seq 947, ack 90968, win 512, options [nop,nop,TS val 790282946 ecr 790282946], length 0
2022-04-05 09:57:18.577518 IP (tos 0x0, ttl 64, id 34987, offset 0, flags [DF], proto TCP (6), length 4100)
    127.0.0.1.9250 > 127.0.0.1.51938: Flags [P.], cksum 0x0df9 (incorrect -> 0x6d41), seq 90968:95016, ack 947, win 512, options [nop,nop,TS val 790282949 ecr 790282946], length 4048
2022-04-05 09:57:18.577537 IP (tos 0x0, ttl 64, id 45396, offset 0, flags [DF], proto TCP (6), length 52)
    127.0.0.1.51938 > 127.0.0.1.9250: Flags [.], cksum 0xfe28 (incorrect -> 0x8332), seq 947, ack 95016, win 512, options [nop,nop,TS val 790282949 ecr 790282949], length 0
2022-04-05 09:57:18.577552 IP (tos 0x0, ttl 64, id 34988, offset 0, flags [DF], proto TCP (6), length 3474)
    127.0.0.1.9250 > 127.0.0.1.51938: Flags [P.], cksum 0x0b87 (incorrect -> 0x7dc7), seq 95016:98438, ack 947, win 512, options [nop,nop,TS val 790282949 ecr 790282949], length 3422
2022-04-05 09:57:18.577562 IP (tos 0x0, ttl 64, id 45397, offset 0, flags [DF], proto TCP (6), length 52)
    127.0.0.1.51938 > 127.0.0.1.9250: Flags [.], cksum 0xfe28 (incorrect -> 0x75d4), seq 947, ack 98438, win 512, options [nop,nop,TS val 790282949 ecr 790282949], length 0
2022-04-05 09:57:18.580040 IP (tos 0x0, ttl 64, id 34989, offset 0, flags [DF], proto TCP (6), length 4036)
    127.0.0.1.9250 > 127.0.0.1.51938: Flags [P.], cksum 0x0db9 (incorrect -> 0x35b8), seq 98438:102422, ack 947, win 512, options [nop,nop,TS val 790282951 ecr 790282949], length 3984
2022-04-05 09:57:18.580101 IP (tos 0x0, ttl 64, id 45398, offset 0, flags [DF], proto TCP (6), length 52)
    127.0.0.1.51938 > 127.0.0.1.9250: Flags [.], cksum 0xfe28 (incorrect -> 0x6640), seq 947, ack 102422, win 512, options [nop,nop,TS val 790282951 ecr 790282951], length 0
2022-04-05 09:57:18.586988 IP (tos 0x0, ttl 64, id 34990, offset 0, flags [DF], proto TCP (6), length 2342)
    127.0.0.1.9250 > 127.0.0.1.51938: Flags [P.], cksum 0x071b (incorrect -> 0x738a), seq 102422:104712, ack 947, win 512, options [nop,nop,TS val 790282958 ecr 790282951], length 2290
2022-04-05 09:57:18.587000 IP (tos 0x0, ttl 64, id 45399, offset 0, flags [DF], proto TCP (6), length 52)
    127.0.0.1.51938 > 127.0.0.1.9250: Flags [.], cksum 0xfe28 (incorrect -> 0x5d40), seq 947, ack 104712, win 512, options [nop,nop,TS val 790282958 ecr 790282958], length 0
2022-04-05 09:57:18.650618 IP (tos 0x0, ttl 64, id 34991, offset 0, flags [DF], proto TCP (6), length 3446)
    127.0.0.1.9250 > 127.0.0.1.51938: Flags [P.], cksum 0x0b6b (incorrect -> 0x4cc9), seq 104712:108106, ack 947, win 512, options [nop,nop,TS val 790283022 ecr 790282958], length 3394
2022-04-05 09:57:18.650632 IP (tos 0x0, ttl 64, id 45400, offset 0, flags [DF], proto TCP (6), length 52)
    127.0.0.1.51938 > 127.0.0.1.9250: Flags [.], cksum 0xfe28 (incorrect -> 0x4f7e), seq 947, ack 108106, win 512, options [nop,nop,TS val 790283022 ecr 790283022], length 0
2022-04-05 09:57:18.673500 IP (tos 0x0, ttl 64, id 34992, offset 0, flags [DF], proto TCP (6), length 1546)
    127.0.0.1.9250 > 127.0.0.1.51938: Flags [P.], cksum 0x03ff (incorrect -> 0xa1eb), seq 108106:109600, ack 947, win 512, options [nop,nop,TS val 790283045 ecr 790283022], length 1494
2022-04-05 09:57:18.673509 IP (tos 0x0, ttl 64, id 45401, offset 0, flags [DF], proto TCP (6), length 52)
    127.0.0.1.51938 > 127.0.0.1.9250: Flags [.], cksum 0xfe28 (incorrect -> 0x497a), seq 947, ack 109600, win 512, options [nop,nop,TS val 790283045 ecr 790283045], length 0
2022-04-05 09:57:18.677439 IP (tos 0x0, ttl 64, id 34993, offset 0, flags [DF], proto TCP (6), length 4100)
    127.0.0.1.9250 > 127.0.0.1.51938: Flags [P.], cksum 0x0df9 (incorrect -> 0xfd4e), seq 109600:113648, ack 947, win 512, options [nop,nop,TS val 790283049 ecr 790283045], length 4048
2022-04-05 09:57:18.677453 IP (tos 0x0, ttl 64, id 45402, offset 0, flags [DF], proto TCP (6), length 52)
    127.0.0.1.51938 > 127.0.0.1.9250: Flags [.], cksum 0xfe28 (incorrect -> 0x39a2), seq 947, ack 113648, win 512, options [nop,nop,TS val 790283049 ecr 790283049], length 0
2022-04-05 09:57:18.677462 IP (tos 0x0, ttl 64, id 34994, offset 0, flags [DF], proto TCP (6), length 3198)
    127.0.0.1.9250 > 127.0.0.1.51938: Flags [P.], cksum 0x0a73 (incorrect -> 0x84ca), seq 113648:116794, ack 947, win 512, options [nop,nop,TS val 790283049 ecr 790283049], length 3146
2022-04-05 09:57:18.677468 IP (tos 0x0, ttl 64, id 45403, offset 0, flags [DF], proto TCP (6), length 52)
    127.0.0.1.51938 > 127.0.0.1.9250: Flags [.], cksum 0xfe28 (incorrect -> 0x2d58), seq 947, ack 116794, win 512, options [nop,nop,TS val 790283049 ecr 790283049], length 0
2022-04-05 09:57:18.677501 IP (tos 0x0, ttl 64, id 34995, offset 0, flags [DF], proto TCP (6), length 3898)
    127.0.0.1.9250 > 127.0.0.1.51938: Flags [P.], cksum 0x0d2f (incorrect -> 0x7d81), seq 116794:120640, ack 947, win 512, options [nop,nop,TS val 790283049 ecr 790283049], length 3846
2022-04-05 09:57:18.677563 IP (tos 0x0, ttl 64, id 45404, offset 0, flags [DF], proto TCP (6), length 52)
    127.0.0.1.51938 > 127.0.0.1.9250: Flags [.], cksum 0xfe28 (incorrect -> 0x1e52), seq 947, ack 120640, win 512, options [nop,nop,TS val 790283049 ecr 790283049], length 0
2022-04-05 09:57:18.686237 IP (tos 0x0, ttl 64, id 34996, offset 0, flags [DF], proto TCP (6), length 4100)
    127.0.0.1.9250 > 127.0.0.1.51938: Flags [P.], cksum 0x0df9 (incorrect -> 0x7fd4), seq 120640:124688, ack 947, win 512, options [nop,nop,TS val 790283057 ecr 790283049], length 4048
2022-04-05 09:57:18.686251 IP (tos 0x0, ttl 64, id 45405, offset 0, flags [DF], proto TCP (6), length 52)
    127.0.0.1.51938 > 127.0.0.1.9250: Flags [.], cksum 0xfe28 (incorrect -> 0x0e72), seq 947, ack 124688, win 512, options [nop,nop,TS val 790283057 ecr 790283057], length 0
2022-04-05 09:57:18.686260 IP (tos 0x0, ttl 64, id 34997, offset 0, flags [DF], proto TCP (6), length 2478)
    127.0.0.1.9250 > 127.0.0.1.51938: Flags [P.], cksum 0x07a3 (incorrect -> 0xfea4), seq 124688:127114, ack 947, win 512, options [nop,nop,TS val 790283057 ecr 790283057], length 2426
2022-04-05 09:57:18.686266 IP (tos 0x0, ttl 64, id 45406, offset 0, flags [DF], proto TCP (6), length 52)
    127.0.0.1.51938 > 127.0.0.1.9250: Flags [.], cksum 0xfe28 (incorrect -> 0x04f8), seq 947, ack 127114, win 512, options [nop,nop,TS val 790283057 ecr 790283057], length 0
2022-04-05 09:57:18.686298 IP (tos 0x0, ttl 64, id 34998, offset 0, flags [DF], proto TCP (6), length 3714)
    127.0.0.1.9250 > 127.0.0.1.51938: Flags [P.], cksum 0x0c77 (incorrect -> 0x58f8), seq 127114:130776, ack 947, win 512, options [nop,nop,TS val 790283057 ecr 790283057], length 3662
2022-04-05 09:57:18.686307 IP (tos 0x0, ttl 64, id 45407, offset 0, flags [DF], proto TCP (6), length 52)
    127.0.0.1.51938 > 127.0.0.1.9250: Flags [.], cksum 0xfe28 (incorrect -> 0xf6a9), seq 947, ack 130776, win 512, options [nop,nop,TS val 790283057 ecr 790283057], length 0
2022-04-05 09:57:18.687737 IP (tos 0x0, ttl 64, id 34999, offset 0, flags [DF], proto TCP (6), length 4100)
    127.0.0.1.9250 > 127.0.0.1.51938: Flags [P.], cksum 0x0df9 (incorrect -> 0x8139), seq 130776:134824, ack 947, win 512, options [nop,nop,TS val 790283059 ecr 790283057], length 4048
2022-04-05 09:57:18.687786 IP (tos 0x0, ttl 64, id 45408, offset 0, flags [DF], proto TCP (6), length 52)
    127.0.0.1.51938 > 127.0.0.1.9250: Flags [.], cksum 0xfe28 (incorrect -> 0xe6d5), seq 947, ack 134824, win 512, options [nop,nop,TS val 790283059 ecr 790283059], length 0
2022-04-05 09:57:18.687796 IP (tos 0x0, ttl 64, id 35000, offset 0, flags [DF], proto TCP (6), length 3788)
    127.0.0.1.9250 > 127.0.0.1.51938: Flags [P.], cksum 0x0cc1 (incorrect -> 0xa382), seq 134824:138560, ack 947, win 512, options [nop,nop,TS val 790283059 ecr 790283059], length 3736
2022-04-05 09:57:18.687802 IP (tos 0x0, ttl 64, id 45409, offset 0, flags [DF], proto TCP (6), length 52)
    127.0.0.1.51938 > 127.0.0.1.9250: Flags [.], cksum 0xfe28 (incorrect -> 0xd83d), seq 947, ack 138560, win 512, options [nop,nop,TS val 790283059 ecr 790283059], length 0
2022-04-05 09:57:18.687825 IP (tos 0x0, ttl 64, id 35001, offset 0, flags [DF], proto TCP (6), length 550)
    127.0.0.1.9250 > 127.0.0.1.51938: Flags [P.], cksum 0x001b (incorrect -> 0x7a19), seq 138560:139058, ack 947, win 512, options [nop,nop,TS val 790283059 ecr 790283059], length 498
2022-04-05 09:57:18.687831 IP (tos 0x0, ttl 64, id 45410, offset 0, flags [DF], proto TCP (6), length 52)
    127.0.0.1.51938 > 127.0.0.1.9250: Flags [.], cksum 0xfe28 (incorrect -> 0xd64b), seq 947, ack 139058, win 512, options [nop,nop,TS val 790283059 ecr 790283059], length 0
2022-04-05 09:57:18.693307 IP (tos 0x0, ttl 64, id 35002, offset 0, flags [DF], proto TCP (6), length 1546)
    127.0.0.1.9250 > 127.0.0.1.51938: Flags [P.], cksum 0x03ff (incorrect -> 0xc558), seq 139058:140552, ack 947, win 512, options [nop,nop,TS val 790283064 ecr 790283059], length 1494
2022-04-05 09:57:18.693325 IP (tos 0x0, ttl 64, id 45411, offset 0, flags [DF], proto TCP (6), length 52)
    127.0.0.1.51938 > 127.0.0.1.9250: Flags [.], cksum 0xfe28 (incorrect -> 0xd06b), seq 947, ack 140552, win 512, options [nop,nop,TS val 790283064 ecr 790283064], length 0
2022-04-05 09:57:18.693359 IP (tos 0x0, ttl 64, id 35003, offset 0, flags [DF], proto TCP (6), length 3538)
    127.0.0.1.9250 > 127.0.0.1.51938: Flags [P.], cksum 0x0bc7 (incorrect -> 0x3093), seq 140552:144038, ack 947, win 512, options [nop,nop,TS val 790283064 ecr 790283064], length 3486
2022-04-05 09:57:18.693409 IP (tos 0x0, ttl 64, id 45412, offset 0, flags [DF], proto TCP (6), length 52)
    127.0.0.1.51938 > 127.0.0.1.9250: Flags [.], cksum 0xfe28 (incorrect -> 0xc2cc), seq 947, ack 144038, win 512, options [nop,nop,TS val 790283065 ecr 790283064], length 0
2022-04-05 09:57:18.693477 IP (tos 0x0, ttl 64, id 35004, offset 0, flags [DF], proto TCP (6), length 4100)
    127.0.0.1.9250 > 127.0.0.1.51938: Flags [P.], cksum 0x0df9 (incorrect -> 0xb03a), seq 144038:148086, ack 947, win 512, options [nop,nop,TS val 790283065 ecr 790283065], length 4048
2022-04-05 09:57:18.693486 IP (tos 0x0, ttl 64, id 45413, offset 0, flags [DF], proto TCP (6), length 52)
    127.0.0.1.51938 > 127.0.0.1.9250: Flags [.], cksum 0xfe28 (incorrect -> 0xb2fb), seq 947, ack 148086, win 512, options [nop,nop,TS val 790283065 ecr 790283065], length 0
2022-04-05 09:57:18.693499 IP (tos 0x0, ttl 64, id 35005, offset 0, flags [DF], proto TCP (6), length 3972)
    127.0.0.1.9250 > 127.0.0.1.51938: Flags [P.], cksum 0x0d79 (incorrect -> 0x8545), seq 148086:152006, ack 947, win 512, options [nop,nop,TS val 790283065 ecr 790283065], length 3920
2022-04-05 09:57:18.693562 IP (tos 0x0, ttl 64, id 45414, offset 0, flags [DF], proto TCP (6), length 52)
    127.0.0.1.51938 > 127.0.0.1.9250: Flags [.], cksum 0xfe28 (incorrect -> 0xa3ab), seq 947, ack 152006, win 512, options [nop,nop,TS val 790283065 ecr 790283065], length 0
2022-04-05 09:57:18.697979 IP (tos 0x0, ttl 64, id 35006, offset 0, flags [DF], proto TCP (6), length 4100)
    127.0.0.1.9250 > 127.0.0.1.51938: Flags [P.], cksum 0x0df9 (incorrect -> 0xae62), seq 152006:156054, ack 947, win 512, options [nop,nop,TS val 790283069 ecr 790283065], length 4048
2022-04-05 09:57:18.697991 IP (tos 0x0, ttl 64, id 45415, offset 0, flags [DF], proto TCP (6), length 52)
    127.0.0.1.51938 > 127.0.0.1.9250: Flags [.], cksum 0xfe28 (incorrect -> 0x93d3), seq 947, ack 156054, win 512, options [nop,nop,TS val 790283069 ecr 790283069], length 0
2022-04-05 09:57:18.698007 IP (tos 0x0, ttl 64, id 35007, offset 0, flags [DF], proto TCP (6), length 486)
    127.0.0.1.9250 > 127.0.0.1.51938: Flags [P.], cksum 0xffda (incorrect -> 0x96f9), seq 156054:156488, ack 947, win 512, options [nop,nop,TS val 790283069 ecr 790283069], length 434
2022-04-05 09:57:18.698012 IP (tos 0x0, ttl 64, id 45416, offset 0, flags [DF], proto TCP (6), length 52)
    127.0.0.1.51938 > 127.0.0.1.9250: Flags [.], cksum 0xfe28 (incorrect -> 0x9221), seq 947, ack 156488, win 512, options [nop,nop,TS val 790283069 ecr 790283069], length 0
2022-04-05 09:57:18.698074 IP (tos 0x0, ttl 64, id 35008, offset 0, flags [DF], proto TCP (6), length 4100)
    127.0.0.1.9250 > 127.0.0.1.51938: Flags [P.], cksum 0x0df9 (incorrect -> 0xc48a), seq 156488:160536, ack 947, win 512, options [nop,nop,TS val 790283069 ecr 790283069], length 4048
2022-04-05 09:57:18.698084 IP (tos 0x0, ttl 64, id 45417, offset 0, flags [DF], proto TCP (6), length 52)
    127.0.0.1.51938 > 127.0.0.1.9250: Flags [.], cksum 0xfe28 (incorrect -> 0x8251), seq 947, ack 160536, win 512, options [nop,nop,TS val 790283069 ecr 790283069], length 0
2022-04-05 09:57:18.698092 IP (tos 0x0, ttl 64, id 35009, offset 0, flags [DF], proto TCP (6), length 3474)
    127.0.0.1.9250 > 127.0.0.1.51938: Flags [P.], cksum 0x0b87 (incorrect -> 0xae45), seq 160536:163958, ack 947, win 512, options [nop,nop,TS val 790283069 ecr 790283069], length 3422
2022-04-05 09:57:18.698099 IP (tos 0x0, ttl 64, id 45418, offset 0, flags [DF], proto TCP (6), length 52)
    127.0.0.1.51938 > 127.0.0.1.9250: Flags [.], cksum 0xfe28 (incorrect -> 0x74f3), seq 947, ack 163958, win 512, options [nop,nop,TS val 790283069 ecr 790283069], length 0
2022-04-05 09:57:18.698132 IP (tos 0x0, ttl 64, id 35010, offset 0, flags [DF], proto TCP (6), length 4036)
    127.0.0.1.9250 > 127.0.0.1.51938: Flags [P.], cksum 0x0db9 (incorrect -> 0x60e8), seq 163958:167942, ack 947, win 512, options [nop,nop,TS val 790283069 ecr 790283069], length 3984
2022-04-05 09:57:18.698178 IP (tos 0x0, ttl 64, id 45419, offset 0, flags [DF], proto TCP (6), length 52)
    127.0.0.1.51938 > 127.0.0.1.9250: Flags [.], cksum 0xfe28 (incorrect -> 0x6563), seq 947, ack 167942, win 512, options [nop,nop,TS val 790283069 ecr 790283069], length 0
200, 4.612935304641724, 1.5385856628417969