2022-04-05 21:44:57.366177 IP (tos 0x0, ttl 64, id 48083, offset 0, flags [DF], proto TCP (6), length 60)
    127.0.0.1.58274 > 127.0.0.1.10450: Flags [S], cksum 0xfe30 (incorrect -> 0x5a8f), seq 2520958741, win 65495, options [mss 65495,sackOK,TS val 277379869 ecr 0,nop,wscale 7], length 0
2022-04-05 21:44:57.366190 IP (tos 0x0, ttl 64, id 0, offset 0, flags [DF], proto TCP (6), length 60)
    127.0.0.1.10450 > 127.0.0.1.58274: Flags [S.], cksum 0xfe30 (incorrect -> 0xcbec), seq 1250146420, ack 2520958742, win 65483, options [mss 65495,sackOK,TS val 277379869 ecr 277379869,nop,wscale 7], length 0
2022-04-05 21:44:57.366200 IP (tos 0x0, ttl 64, id 48084, offset 0, flags [DF], proto TCP (6), length 52)
    127.0.0.1.58274 > 127.0.0.1.10450: Flags [.], cksum 0xfe28 (incorrect -> 0xf2a8), seq 1, ack 1, win 512, options [nop,nop,TS val 277379869 ecr 277379869], length 0
2022-04-05 21:44:57.366370 IP (tos 0x0, ttl 64, id 48085, offset 0, flags [DF], proto TCP (6), length 55)
    127.0.0.1.58274 > 127.0.0.1.10450: Flags [P.], cksum 0xfe2b (incorrect -> 0xed9c), seq 1:4, ack 1, win 512, options [nop,nop,TS val 277379869 ecr 277379869], length 3
2022-04-05 21:44:57.366377 IP (tos 0x0, ttl 64, id 43346, offset 0, flags [DF], proto TCP (6), length 52)
    127.0.0.1.10450 > 127.0.0.1.58274: Flags [.], cksum 0xfe28 (incorrect -> 0xf2a5), seq 1, ack 4, win 512, options [nop,nop,TS val 277379869 ecr 277379869], length 0
2022-04-05 21:44:57.366403 IP (tos 0x0, ttl 64, id 43347, offset 0, flags [DF], proto TCP (6), length 54)
    127.0.0.1.10450 > 127.0.0.1.58274: Flags [P.], cksum 0xfe2a (incorrect -> 0xed9b), seq 1:3, ack 4, win 512, options [nop,nop,TS val 277379869 ecr 277379869], length 2
2022-04-05 21:44:57.366412 IP (tos 0x0, ttl 64, id 48086, offset 0, flags [DF], proto TCP (6), length 52)
    127.0.0.1.58274 > 127.0.0.1.10450: Flags [.], cksum 0xfe28 (incorrect -> 0xf2a3), seq 4, ack 3, win 512, options [nop,nop,TS val 277379869 ecr 277379869], length 0
2022-04-05 21:44:57.368240 IP (tos 0x0, ttl 64, id 48087, offset 0, flags [DF], proto TCP (6), length 62)
    127.0.0.1.58274 > 127.0.0.1.10450: Flags [P.], cksum 0xfe32 (incorrect -> 0xc89f), seq 4:14, ack 3, win 512, options [nop,nop,TS val 277379871 ecr 277379869], length 10
2022-04-05 21:44:57.368261 IP (tos 0x0, ttl 64, id 43348, offset 0, flags [DF], proto TCP (6), length 52)
    127.0.0.1.10450 > 127.0.0.1.58274: Flags [.], cksum 0xfe28 (incorrect -> 0xf295), seq 3, ack 14, win 512, options [nop,nop,TS val 277379871 ecr 277379871], length 0
2022-04-05 21:44:57.413397 IP (tos 0x0, ttl 64, id 43349, offset 0, flags [DF], proto TCP (6), length 62)
    127.0.0.1.10450 > 127.0.0.1.58274: Flags [P.], cksum 0xfe32 (incorrect -> 0xed55), seq 3:13, ack 14, win 512, options [nop,nop,TS val 277379916 ecr 277379871], length 10
2022-04-05 21:44:57.413409 IP (tos 0x0, ttl 64, id 48088, offset 0, flags [DF], proto TCP (6), length 52)
    127.0.0.1.58274 > 127.0.0.1.10450: Flags [.], cksum 0xfe28 (incorrect -> 0xf231), seq 14, ack 13, win 512, options [nop,nop,TS val 277379916 ecr 277379916], length 0
2022-04-05 21:44:57.419497 IP (tos 0x0, ttl 64, id 48089, offset 0, flags [DF], proto TCP (6), length 569)
    127.0.0.1.58274 > 127.0.0.1.10450: Flags [P.], cksum 0x002e (incorrect -> 0xebe1), seq 14:531, ack 13, win 512, options [nop,nop,TS val 277379922 ecr 277379916], length 517
2022-04-05 21:44:57.419507 IP (tos 0x0, ttl 64, id 43350, offset 0, flags [DF], proto TCP (6), length 52)
    127.0.0.1.10450 > 127.0.0.1.58274: Flags [.], cksum 0xfe28 (incorrect -> 0xf024), seq 13, ack 531, win 508, options [nop,nop,TS val 277379922 ecr 277379922], length 0
2022-04-05 21:44:57.460752 IP (tos 0x0, ttl 64, id 43351, offset 0, flags [DF], proto TCP (6), length 3538)
    127.0.0.1.10450 > 127.0.0.1.58274: Flags [P.], cksum 0x0bc7 (incorrect -> 0xc212), seq 13:3499, ack 531, win 512, options [nop,nop,TS val 277379963 ecr 277379922], length 3486
2022-04-05 21:44:57.460760 IP (tos 0x0, ttl 64, id 48090, offset 0, flags [DF], proto TCP (6), length 52)
    127.0.0.1.58274 > 127.0.0.1.10450: Flags [.], cksum 0xfe28 (incorrect -> 0xe242), seq 531, ack 3499, win 494, options [nop,nop,TS val 277379963 ecr 277379963], length 0
200, 5.770674705505371, 0.3822777271270752