2022-04-05 23:12:32.740249 IP (tos 0x0, ttl 64, id 48325, offset 0, flags [DF], proto TCP (6), length 60)
    127.0.0.1.33548 > 127.0.0.1.10550: Flags [S], cksum 0xfe30 (incorrect -> 0x730e), seq 1431314077, win 65495, options [mss 65495,sackOK,TS val 282635243 ecr 0,nop,wscale 7], length 0
2022-04-05 23:12:32.740264 IP (tos 0x0, ttl 64, id 0, offset 0, flags [DF], proto TCP (6), length 60)
    127.0.0.1.10550 > 127.0.0.1.33548: Flags [S.], cksum 0xfe30 (incorrect -> 0xc5ed), seq 3419874432, ack 1431314078, win 65483, options [mss 65495,sackOK,TS val 282635243 ecr 282635243,nop,wscale 7], length 0
2022-04-05 23:12:32.740274 IP (tos 0x0, ttl 64, id 48326, offset 0, flags [DF], proto TCP (6), length 52)
    127.0.0.1.33548 > 127.0.0.1.10550: Flags [.], cksum 0xfe28 (incorrect -> 0xeca9), seq 1, ack 1, win 512, options [nop,nop,TS val 282635243 ecr 282635243], length 0
2022-04-05 23:12:32.740409 IP (tos 0x0, ttl 64, id 48327, offset 0, flags [DF], proto TCP (6), length 55)
    127.0.0.1.33548 > 127.0.0.1.10550: Flags [P.], cksum 0xfe2b (incorrect -> 0xe79d), seq 1:4, ack 1, win 512, options [nop,nop,TS val 282635243 ecr 282635243], length 3
2022-04-05 23:12:32.740427 IP (tos 0x0, ttl 64, id 6553, offset 0, flags [DF], proto TCP (6), length 52)
    127.0.0.1.10550 > 127.0.0.1.33548: Flags [.], cksum 0xfe28 (incorrect -> 0xeca6), seq 1, ack 4, win 512, options [nop,nop,TS val 282635243 ecr 282635243], length 0
2022-04-05 23:12:32.740473 IP (tos 0x0, ttl 64, id 6554, offset 0, flags [DF], proto TCP (6), length 54)
    127.0.0.1.10550 > 127.0.0.1.33548: Flags [P.], cksum 0xfe2a (incorrect -> 0xe79c), seq 1:3, ack 4, win 512, options [nop,nop,TS val 282635243 ecr 282635243], length 2
2022-04-05 23:12:32.740492 IP (tos 0x0, ttl 64, id 48328, offset 0, flags [DF], proto TCP (6), length 52)
    127.0.0.1.33548 > 127.0.0.1.10550: Flags [.], cksum 0xfe28 (incorrect -> 0xeca4), seq 4, ack 3, win 512, options [nop,nop,TS val 282635243 ecr 282635243], length 0
2022-04-05 23:12:32.742222 IP (tos 0x0, ttl 64, id 48329, offset 0, flags [DF], proto TCP (6), length 62)
    127.0.0.1.33548 > 127.0.0.1.10550: Flags [P.], cksum 0xfe32 (incorrect -> 0x666a), seq 4:14, ack 3, win 512, options [nop,nop,TS val 282635245 ecr 282635243], length 10
2022-04-05 23:12:32.742232 IP (tos 0x0, ttl 64, id 6555, offset 0, flags [DF], proto TCP (6), length 52)
    127.0.0.1.10550 > 127.0.0.1.33548: Flags [.], cksum 0xfe28 (incorrect -> 0xec96), seq 3, ack 14, win 512, options [nop,nop,TS val 282635245 ecr 282635245], length 0
2022-04-05 23:12:32.842940 IP (tos 0x0, ttl 64, id 6556, offset 0, flags [DF], proto TCP (6), length 62)
    127.0.0.1.10550 > 127.0.0.1.33548: Flags [P.], cksum 0xfe32 (incorrect -> 0xe71f), seq 3:13, ack 14, win 512, options [nop,nop,TS val 282635345 ecr 282635245], length 10
2022-04-05 23:12:32.842950 IP (tos 0x0, ttl 64, id 48330, offset 0, flags [DF], proto TCP (6), length 52)
    127.0.0.1.33548 > 127.0.0.1.10550: Flags [.], cksum 0xfe28 (incorrect -> 0xebc4), seq 14, ack 13, win 512, options [nop,nop,TS val 282635345 ecr 282635345], length 0
2022-04-05 23:12:32.849552 IP (tos 0x0, ttl 64, id 48331, offset 0, flags [DF], proto TCP (6), length 569)
    127.0.0.1.33548 > 127.0.0.1.10550: Flags [P.], cksum 0x002e (incorrect -> 0x2d2a), seq 14:531, ack 13, win 512, options [nop,nop,TS val 282635352 ecr 282635345], length 517
2022-04-05 23:12:32.849564 IP (tos 0x0, ttl 64, id 6557, offset 0, flags [DF], proto TCP (6), length 52)
    127.0.0.1.10550 > 127.0.0.1.33548: Flags [.], cksum 0xfe28 (incorrect -> 0xe9b5), seq 13, ack 531, win 508, options [nop,nop,TS val 282635352 ecr 282635352], length 0
2022-04-05 23:12:32.970858 IP (tos 0x0, ttl 64, id 6558, offset 0, flags [DF], proto TCP (6), length 3538)
    127.0.0.1.10550 > 127.0.0.1.33548: Flags [P.], cksum 0x0bc7 (incorrect -> 0x56aa), seq 13:3499, ack 531, win 512, options [nop,nop,TS val 282635473 ecr 282635352], length 3486
2022-04-05 23:12:32.970867 IP (tos 0x0, ttl 64, id 48332, offset 0, flags [DF], proto TCP (6), length 52)
    127.0.0.1.33548 > 127.0.0.1.10550: Flags [.], cksum 0xfe28 (incorrect -> 0xdb33), seq 531, ack 3499, win 494, options [nop,nop,TS val 282635473 ecr 282635473], length 0
2022-04-05 23:12:33.028424 IP (tos 0x0, ttl 64, id 6559, offset 0, flags [DF], proto TCP (6), length 341)
    127.0.0.1.10550 > 127.0.0.1.33548: Flags [P.], cksum 0xff49 (incorrect -> 0xeb59), seq 3499:3788, ack 531, win 512, options [nop,nop,TS val 282635531 ecr 282635473], length 289
2022-04-05 23:12:33.028431 IP (tos 0x0, ttl 64, id 48333, offset 0, flags [DF], proto TCP (6), length 52)
    127.0.0.1.33548 > 127.0.0.1.10550: Flags [.], cksum 0xfe28 (incorrect -> 0xd992), seq 531, ack 3788, win 506, options [nop,nop,TS val 282635531 ecr 282635531], length 0
2022-04-05 23:12:33.028743 IP (tos 0x0, ttl 64, id 48334, offset 0, flags [DF], proto TCP (6), length 132)
    127.0.0.1.33548 > 127.0.0.1.10550: Flags [P.], cksum 0xfe78 (incorrect -> 0x4f21), seq 531:611, ack 3788, win 512, options [nop,nop,TS val 282635531 ecr 282635531], length 80
2022-04-05 23:12:33.028751 IP (tos 0x0, ttl 64, id 6560, offset 0, flags [DF], proto TCP (6), length 52)
    127.0.0.1.10550 > 127.0.0.1.33548: Flags [.], cksum 0xfe28 (incorrect -> 0xd93c), seq 3788, ack 611, win 512, options [nop,nop,TS val 282635531 ecr 282635531], length 0
2022-04-05 23:12:33.029172 IP (tos 0x0, ttl 64, id 48335, offset 0, flags [DF], proto TCP (6), length 341)
    127.0.0.1.33548 > 127.0.0.1.10550: Flags [P.], cksum 0xff49 (incorrect -> 0x390f), seq 611:900, ack 3788, win 512, options [nop,nop,TS val 282635532 ecr 282635531], length 289
2022-04-05 23:12:33.029181 IP (tos 0x0, ttl 64, id 6561, offset 0, flags [DF], proto TCP (6), length 52)
    127.0.0.1.10550 > 127.0.0.1.33548: Flags [.], cksum 0xfe28 (incorrect -> 0xd81b), seq 3788, ack 900, win 510, options [nop,nop,TS val 282635532 ecr 282635532], length 0
2022-04-05 23:12:33.399367 IP (tos 0x0, ttl 64, id 6562, offset 0, flags [DF], proto TCP (6), length 2671)
    127.0.0.1.10550 > 127.0.0.1.33548: Flags [P.], cksum 0x0864 (incorrect -> 0xc5fa), seq 3788:6407, ack 900, win 512, options [nop,nop,TS val 282635902 ecr 282635532], length 2619
2022-04-05 23:12:33.399383 IP (tos 0x0, ttl 64, id 48336, offset 0, flags [DF], proto TCP (6), length 52)
    127.0.0.1.33548 > 127.0.0.1.10550: Flags [.], cksum 0xfe28 (incorrect -> 0xcb09), seq 900, ack 6407, win 497, options [nop,nop,TS val 282635902 ecr 282635902], length 0
2022-04-05 23:12:33.402931 IP (tos 0x0, ttl 64, id 48337, offset 0, flags [DF], proto TCP (6), length 1195)
    127.0.0.1.33548 > 127.0.0.1.10550: Flags [P.], cksum 0x02a0 (incorrect -> 0x70df), seq 900:2043, ack 6407, win 512, options [nop,nop,TS val 282635905 ecr 282635902], length 1143
2022-04-05 23:12:33.402942 IP (tos 0x0, ttl 64, id 6563, offset 0, flags [DF], proto TCP (6), length 52)
    127.0.0.1.10550 > 127.0.0.1.33548: Flags [.], cksum 0xfe28 (incorrect -> 0xc685), seq 6407, ack 2043, win 504, options [nop,nop,TS val 282635905 ecr 282635905], length 0
2022-04-05 23:12:33.775712 IP (tos 0x0, ttl 64, id 6564, offset 0, flags [DF], proto TCP (6), length 1440)
    127.0.0.1.10550 > 127.0.0.1.33548: Flags [P.], cksum 0x0395 (incorrect -> 0x8031), seq 6407:7795, ack 2043, win 512, options [nop,nop,TS val 282636278 ecr 282635905], length 1388
2022-04-05 23:12:33.818660 IP (tos 0x0, ttl 64, id 48338, offset 0, flags [DF], proto TCP (6), length 52)
    127.0.0.1.33548 > 127.0.0.1.10550: Flags [.], cksum 0xfe28 (incorrect -> 0xbdfc), seq 2043, ack 7795, win 512, options [nop,nop,TS val 282636321 ecr 282636278], length 0
2022-04-05 23:12:33.843224 IP (tos 0x0, ttl 64, id 6565, offset 0, flags [DF], proto TCP (6), length 3432)
    127.0.0.1.10550 > 127.0.0.1.33548: Flags [P.], cksum 0x0b5d (incorrect -> 0xded9), seq 7795:11175, ack 2043, win 512, options [nop,nop,TS val 282636346 ecr 282636321], length 3380
2022-04-05 23:12:33.843232 IP (tos 0x0, ttl 64, id 48339, offset 0, flags [DF], proto TCP (6), length 52)
    127.0.0.1.33548 > 127.0.0.1.10550: Flags [.], cksum 0xfe28 (incorrect -> 0xb07d), seq 2043, ack 11175, win 494, options [nop,nop,TS val 282636346 ecr 282636346], length 0
2022-04-05 23:12:33.880164 IP (tos 0x0, ttl 64, id 6566, offset 0, flags [DF], proto TCP (6), length 4100)
    127.0.0.1.10550 > 127.0.0.1.33548: Flags [P.], cksum 0x0df9 (incorrect -> 0xb985), seq 11175:15223, ack 2043, win 512, options [nop,nop,TS val 282636383 ecr 282636346], length 4048
2022-04-05 23:12:33.880172 IP (tos 0x0, ttl 64, id 48340, offset 0, flags [DF], proto TCP (6), length 52)
    127.0.0.1.33548 > 127.0.0.1.10550: Flags [.], cksum 0xfe28 (incorrect -> 0xa065), seq 2043, ack 15223, win 492, options [nop,nop,TS val 282636383 ecr 282636383], length 0
2022-04-05 23:12:33.880179 IP (tos 0x0, ttl 64, id 6567, offset 0, flags [DF], proto TCP (6), length 696)
    127.0.0.1.10550 > 127.0.0.1.33548: Flags [P.], cksum 0x00ad (incorrect -> 0x9f11), seq 15223:15867, ack 2043, win 512, options [nop,nop,TS val 282636383 ecr 282636383], length 644
2022-04-05 23:12:33.880183 IP (tos 0x0, ttl 64, id 48341, offset 0, flags [DF], proto TCP (6), length 52)
    127.0.0.1.33548 > 127.0.0.1.10550: Flags [.], cksum 0xfe28 (incorrect -> 0x9de4), seq 2043, ack 15867, win 489, options [nop,nop,TS val 282636383 ecr 282636383], length 0
2022-04-05 23:12:33.881596 IP (tos 0x0, ttl 64, id 6568, offset 0, flags [DF], proto TCP (6), length 3326)
    127.0.0.1.10550 > 127.0.0.1.33548: Flags [P.], cksum 0x0af3 (incorrect -> 0x7d25), seq 15867:19141, ack 2043, win 512, options [nop,nop,TS val 282636384 ecr 282636383], length 3274
2022-04-05 23:12:33.881603 IP (tos 0x0, ttl 64, id 48342, offset 0, flags [DF], proto TCP (6), length 52)
    127.0.0.1.33548 > 127.0.0.1.10550: Flags [.], cksum 0xfe28 (incorrect -> 0x9112), seq 2043, ack 19141, win 495, options [nop,nop,TS val 282636384 ecr 282636384], length 0
2022-04-05 23:12:33.899911 IP (tos 0x0, ttl 64, id 6569, offset 0, flags [DF], proto TCP (6), length 338)
    127.0.0.1.10550 > 127.0.0.1.33548: Flags [P.], cksum 0xff46 (incorrect -> 0xe096), seq 19141:19427, ack 2043, win 512, options [nop,nop,TS val 282636402 ecr 282636384], length 286
2022-04-05 23:12:33.899919 IP (tos 0x0, ttl 64, id 48343, offset 0, flags [DF], proto TCP (6), length 52)
    127.0.0.1.33548 > 127.0.0.1.10550: Flags [.], cksum 0xfe28 (incorrect -> 0x8fc5), seq 2043, ack 19427, win 506, options [nop,nop,TS val 282636402 ecr 282636402], length 0
2022-04-05 23:12:33.906684 IP (tos 0x0, ttl 64, id 6570, offset 0, flags [DF], proto TCP (6), length 3326)
    127.0.0.1.10550 > 127.0.0.1.33548: Flags [P.], cksum 0x0af3 (incorrect -> 0xdaa0), seq 19427:22701, ack 2043, win 512, options [nop,nop,TS val 282636409 ecr 282636402], length 3274
2022-04-05 23:12:33.906692 IP (tos 0x0, ttl 64, id 48344, offset 0, flags [DF], proto TCP (6), length 52)
    127.0.0.1.33548 > 127.0.0.1.10550: Flags [.], cksum 0xfe28 (incorrect -> 0x82f8), seq 2043, ack 22701, win 495, options [nop,nop,TS val 282636409 ecr 282636409], length 0
200, 5.91179895401001, 1.2538490295410156