2022-04-05 06:43:58.520451 IP (tos 0x0, ttl 64, id 10097, offset 0, flags [DF], proto TCP (6), length 60)
    127.0.0.1.57570 > 127.0.0.1.12150: Flags [S], cksum 0xfe30 (incorrect -> 0xc7bb), seq 228686294, win 65495, options [mss 65495,sackOK,TS val 778682892 ecr 0,nop,wscale 7], length 0
2022-04-05 06:43:58.520473 IP (tos 0x0, ttl 64, id 0, offset 0, flags [DF], proto TCP (6), length 60)
    127.0.0.1.12150 > 127.0.0.1.57570: Flags [S.], cksum 0xfe30 (incorrect -> 0xfbf7), seq 1924360341, ack 228686295, win 65483, options [mss 65495,sackOK,TS val 778682892 ecr 778682892,nop,wscale 7], length 0
2022-04-05 06:43:58.520489 IP (tos 0x0, ttl 64, id 10098, offset 0, flags [DF], proto TCP (6), length 52)
    127.0.0.1.57570 > 127.0.0.1.12150: Flags [.], cksum 0xfe28 (incorrect -> 0x22b4), seq 1, ack 1, win 512, options [nop,nop,TS val 778682892 ecr 778682892], length 0
2022-04-05 06:43:58.520636 IP (tos 0x0, ttl 64, id 10099, offset 0, flags [DF], proto TCP (6), length 55)
    127.0.0.1.57570 > 127.0.0.1.12150: Flags [P.], cksum 0xfe2b (incorrect -> 0x1da8), seq 1:4, ack 1, win 512, options [nop,nop,TS val 778682892 ecr 778682892], length 3
2022-04-05 06:43:58.520646 IP (tos 0x0, ttl 64, id 65237, offset 0, flags [DF], proto TCP (6), length 52)
    127.0.0.1.12150 > 127.0.0.1.57570: Flags [.], cksum 0xfe28 (incorrect -> 0x22b1), seq 1, ack 4, win 512, options [nop,nop,TS val 778682892 ecr 778682892], length 0
2022-04-05 06:43:58.520672 IP (tos 0x0, ttl 64, id 65238, offset 0, flags [DF], proto TCP (6), length 54)
    127.0.0.1.12150 > 127.0.0.1.57570: Flags [P.], cksum 0xfe2a (incorrect -> 0x1da7), seq 1:3, ack 4, win 512, options [nop,nop,TS val 778682892 ecr 778682892], length 2
2022-04-05 06:43:58.520685 IP (tos 0x0, ttl 64, id 10100, offset 0, flags [DF], proto TCP (6), length 52)
    127.0.0.1.57570 > 127.0.0.1.12150: Flags [.], cksum 0xfe28 (incorrect -> 0x22af), seq 4, ack 3, win 512, options [nop,nop,TS val 778682892 ecr 778682892], length 0
2022-04-05 06:43:58.533083 IP (tos 0x0, ttl 64, id 10101, offset 0, flags [DF], proto TCP (6), length 62)
    127.0.0.1.57570 > 127.0.0.1.12150: Flags [P.], cksum 0xfe32 (incorrect -> 0xaeb0), seq 4:14, ack 3, win 512, options [nop,nop,TS val 778682904 ecr 778682892], length 10
2022-04-05 06:43:58.533101 IP (tos 0x0, ttl 64, id 65239, offset 0, flags [DF], proto TCP (6), length 52)
    127.0.0.1.12150 > 127.0.0.1.57570: Flags [.], cksum 0xfe28 (incorrect -> 0x228d), seq 3, ack 14, win 512, options [nop,nop,TS val 778682904 ecr 778682904], length 0
2022-04-05 06:43:58.600438 IP (tos 0x0, ttl 64, id 65240, offset 0, flags [DF], proto TCP (6), length 62)
    127.0.0.1.12150 > 127.0.0.1.57570: Flags [P.], cksum 0xfe32 (incorrect -> 0x1d37), seq 3:13, ack 14, win 512, options [nop,nop,TS val 778682971 ecr 778682904], length 10
2022-04-05 06:43:58.600461 IP (tos 0x0, ttl 64, id 10102, offset 0, flags [DF], proto TCP (6), length 52)
    127.0.0.1.57570 > 127.0.0.1.12150: Flags [.], cksum 0xfe28 (incorrect -> 0x21fc), seq 14, ack 13, win 512, options [nop,nop,TS val 778682972 ecr 778682971], length 0
2022-04-05 06:43:58.606257 IP (tos 0x0, ttl 64, id 10103, offset 0, flags [DF], proto TCP (6), length 569)
    127.0.0.1.57570 > 127.0.0.1.12150: Flags [P.], cksum 0x002e (incorrect -> 0x1536), seq 14:531, ack 13, win 512, options [nop,nop,TS val 778682977 ecr 778682971], length 517
2022-04-05 06:43:58.606270 IP (tos 0x0, ttl 64, id 65241, offset 0, flags [DF], proto TCP (6), length 52)
    127.0.0.1.12150 > 127.0.0.1.57570: Flags [.], cksum 0xfe28 (incorrect -> 0x1ff0), seq 13, ack 531, win 508, options [nop,nop,TS val 778682977 ecr 778682977], length 0
403, 2.601670742034912, 0.3644285202026367