2022-04-05 22:28:24.792540 IP (tos 0x0, ttl 64, id 52837, offset 0, flags [DF], proto TCP (6), length 60)
    127.0.0.1.36816 > 127.0.0.1.10050: Flags [S], cksum 0xfe30 (incorrect -> 0x9af6), seq 3417693491, win 65495, options [mss 65495,sackOK,TS val 279987295 ecr 0,nop,wscale 7], length 0
2022-04-05 22:28:24.792554 IP (tos 0x0, ttl 64, id 0, offset 0, flags [DF], proto TCP (6), length 60)
    127.0.0.1.10050 > 127.0.0.1.36816: Flags [S.], cksum 0xfe30 (incorrect -> 0x1ad1), seq 1241899275, ack 3417693492, win 65483, options [mss 65495,sackOK,TS val 279987295 ecr 279987295,nop,wscale 7], length 0
2022-04-05 22:28:24.792566 IP (tos 0x0, ttl 64, id 52838, offset 0, flags [DF], proto TCP (6), length 52)
    127.0.0.1.36816 > 127.0.0.1.10050: Flags [.], cksum 0xfe28 (incorrect -> 0x418d), seq 1, ack 1, win 512, options [nop,nop,TS val 279987295 ecr 279987295], length 0
2022-04-05 22:28:24.792719 IP (tos 0x0, ttl 64, id 52839, offset 0, flags [DF], proto TCP (6), length 55)
    127.0.0.1.36816 > 127.0.0.1.10050: Flags [P.], cksum 0xfe2b (incorrect -> 0x3c81), seq 1:4, ack 1, win 512, options [nop,nop,TS val 279987295 ecr 279987295], length 3
2022-04-05 22:28:24.792726 IP (tos 0x0, ttl 64, id 7476, offset 0, flags [DF], proto TCP (6), length 52)
    127.0.0.1.10050 > 127.0.0.1.36816: Flags [.], cksum 0xfe28 (incorrect -> 0x418a), seq 1, ack 4, win 512, options [nop,nop,TS val 279987295 ecr 279987295], length 0
2022-04-05 22:28:24.792752 IP (tos 0x0, ttl 64, id 7477, offset 0, flags [DF], proto TCP (6), length 54)
    127.0.0.1.10050 > 127.0.0.1.36816: Flags [P.], cksum 0xfe2a (incorrect -> 0x3c80), seq 1:3, ack 4, win 512, options [nop,nop,TS val 279987295 ecr 279987295], length 2
2022-04-05 22:28:24.792760 IP (tos 0x0, ttl 64, id 52840, offset 0, flags [DF], proto TCP (6), length 52)
    127.0.0.1.36816 > 127.0.0.1.10050: Flags [.], cksum 0xfe28 (incorrect -> 0x4188), seq 4, ack 3, win 512, options [nop,nop,TS val 279987295 ecr 279987295], length 0
2022-04-05 22:28:24.807355 IP (tos 0x0, ttl 64, id 52841, offset 0, flags [DF], proto TCP (6), length 62)
    127.0.0.1.36816 > 127.0.0.1.10050: Flags [P.], cksum 0xfe32 (incorrect -> 0xbabf), seq 4:14, ack 3, win 512, options [nop,nop,TS val 279987310 ecr 279987295], length 10
2022-04-05 22:28:24.807365 IP (tos 0x0, ttl 64, id 7478, offset 0, flags [DF], proto TCP (6), length 52)
    127.0.0.1.10050 > 127.0.0.1.36816: Flags [.], cksum 0xfe28 (incorrect -> 0x4160), seq 3, ack 14, win 512, options [nop,nop,TS val 279987310 ecr 279987310], length 0
2022-04-05 22:28:25.203386 IP (tos 0x0, ttl 64, id 7479, offset 0, flags [DF], proto TCP (6), length 62)
    127.0.0.1.10050 > 127.0.0.1.36816: Flags [P.], cksum 0xfe32 (incorrect -> 0x3ac1), seq 3:13, ack 14, win 512, options [nop,nop,TS val 279987706 ecr 279987310], length 10
2022-04-05 22:28:25.203398 IP (tos 0x0, ttl 64, id 52842, offset 0, flags [DF], proto TCP (6), length 52)
    127.0.0.1.36816 > 127.0.0.1.10050: Flags [.], cksum 0xfe28 (incorrect -> 0x3e3e), seq 14, ack 13, win 512, options [nop,nop,TS val 279987706 ecr 279987706], length 0
2022-04-05 22:28:25.209484 IP (tos 0x0, ttl 64, id 52843, offset 0, flags [DF], proto TCP (6), length 569)
    127.0.0.1.36816 > 127.0.0.1.10050: Flags [P.], cksum 0x002e (incorrect -> 0xe9cf), seq 14:531, ack 13, win 512, options [nop,nop,TS val 279987712 ecr 279987706], length 517
2022-04-05 22:28:25.209494 IP (tos 0x0, ttl 64, id 7480, offset 0, flags [DF], proto TCP (6), length 52)
    127.0.0.1.10050 > 127.0.0.1.36816: Flags [.], cksum 0xfe28 (incorrect -> 0x3c31), seq 13, ack 531, win 508, options [nop,nop,TS val 279987712 ecr 279987712], length 0
2022-04-05 22:28:25.607862 IP (tos 0x0, ttl 64, id 7481, offset 0, flags [DF], proto TCP (6), length 3538)
    127.0.0.1.10050 > 127.0.0.1.36816: Flags [P.], cksum 0x0bc7 (incorrect -> 0x6f4f), seq 13:3499, ack 531, win 512, options [nop,nop,TS val 279988110 ecr 279987712], length 3486
2022-04-05 22:28:25.607880 IP (tos 0x0, ttl 64, id 52844, offset 0, flags [DF], proto TCP (6), length 52)
    127.0.0.1.36816 > 127.0.0.1.10050: Flags [.], cksum 0xfe28 (incorrect -> 0x2b85), seq 531, ack 3499, win 494, options [nop,nop,TS val 279988110 ecr 279988110], length 0
2022-04-05 22:28:25.756346 IP (tos 0x0, ttl 64, id 7482, offset 0, flags [DF], proto TCP (6), length 1494)
    127.0.0.1.10050 > 127.0.0.1.36816: Flags [P.], cksum 0x03cb (incorrect -> 0xbc64), seq 3499:4941, ack 531, win 512, options [nop,nop,TS val 279988259 ecr 279988110], length 1442
2022-04-05 22:28:25.756369 IP (tos 0x0, ttl 64, id 52845, offset 0, flags [DF], proto TCP (6), length 52)
    127.0.0.1.36816 > 127.0.0.1.10050: Flags [.], cksum 0xfe28 (incorrect -> 0x24b1), seq 531, ack 4941, win 502, options [nop,nop,TS val 279988259 ecr 279988259], length 0
2022-04-05 22:28:25.756794 IP (tos 0x0, ttl 64, id 52846, offset 0, flags [DF], proto TCP (6), length 116)
    127.0.0.1.36816 > 127.0.0.1.10050: Flags [P.], cksum 0xfe68 (incorrect -> 0x95df), seq 531:595, ack 4941, win 512, options [nop,nop,TS val 279988259 ecr 279988259], length 64
2022-04-05 22:28:25.756818 IP (tos 0x0, ttl 64, id 7483, offset 0, flags [DF], proto TCP (6), length 52)
    127.0.0.1.10050 > 127.0.0.1.36816: Flags [.], cksum 0xfe28 (incorrect -> 0x2467), seq 4941, ack 595, win 512, options [nop,nop,TS val 279988259 ecr 279988259], length 0
2022-04-05 22:28:25.757250 IP (tos 0x0, ttl 64, id 52847, offset 0, flags [DF], proto TCP (6), length 368)
    127.0.0.1.36816 > 127.0.0.1.10050: Flags [P.], cksum 0xff64 (incorrect -> 0xfee5), seq 595:911, ack 4941, win 512, options [nop,nop,TS val 279988260 ecr 279988259], length 316
2022-04-05 22:28:25.757268 IP (tos 0x0, ttl 64, id 7484, offset 0, flags [DF], proto TCP (6), length 52)
    127.0.0.1.10050 > 127.0.0.1.36816: Flags [.], cksum 0xfe28 (incorrect -> 0x232b), seq 4941, ack 911, win 510, options [nop,nop,TS val 279988260 ecr 279988260], length 0
2022-04-05 22:28:26.461850 IP (tos 0x0, ttl 64, id 7485, offset 0, flags [DF], proto TCP (6), length 3538)
    127.0.0.1.10050 > 127.0.0.1.36816: Flags [P.], cksum 0x0bc7 (incorrect -> 0x8880), seq 4941:8427, ack 911, win 512, options [nop,nop,TS val 279988964 ecr 279988260], length 3486
2022-04-05 22:28:26.461868 IP (tos 0x0, ttl 64, id 52848, offset 0, flags [DF], proto TCP (6), length 52)
    127.0.0.1.36816 > 127.0.0.1.10050: Flags [.], cksum 0xfe28 (incorrect -> 0x101d), seq 911, ack 8427, win 494, options [nop,nop,TS val 279988964 ecr 279988964], length 0
2022-04-05 22:28:26.573826 IP (tos 0x0, ttl 64, id 7486, offset 0, flags [DF], proto TCP (6), length 3470)
    127.0.0.1.10050 > 127.0.0.1.36816: Flags [P.], cksum 0x0b83 (incorrect -> 0x834d), seq 8427:11845, ack 911, win 512, options [nop,nop,TS val 279989076 ecr 279988964], length 3418
2022-04-05 22:28:26.573837 IP (tos 0x0, ttl 64, id 52849, offset 0, flags [DF], proto TCP (6), length 52)
    127.0.0.1.36816 > 127.0.0.1.10050: Flags [.], cksum 0xfe28 (incorrect -> 0x01e3), seq 911, ack 11845, win 494, options [nop,nop,TS val 279989076 ecr 279989076], length 0
2022-04-05 22:28:26.585869 IP (tos 0x0, ttl 64, id 7487, offset 0, flags [DF], proto TCP (6), length 1048)
    127.0.0.1.10050 > 127.0.0.1.36816: Flags [P.], cksum 0x020d (incorrect -> 0xed2d), seq 11845:12841, ack 911, win 512, options [nop,nop,TS val 279989088 ecr 279989076], length 996
2022-04-05 22:28:26.585876 IP (tos 0x0, ttl 64, id 52850, offset 0, flags [DF], proto TCP (6), length 52)
    127.0.0.1.36816 > 127.0.0.1.10050: Flags [.], cksum 0xfe28 (incorrect -> 0xfddc), seq 911, ack 12841, win 504, options [nop,nop,TS val 279989088 ecr 279989088], length 0
2022-04-05 22:28:26.589141 IP (tos 0x0, ttl 64, id 7488, offset 0, flags [DF], proto TCP (6), length 4100)
    127.0.0.1.10050 > 127.0.0.1.36816: Flags [P.], cksum 0x0df9 (incorrect -> 0xb598), seq 12841:16889, ack 911, win 512, options [nop,nop,TS val 279989092 ecr 279989088], length 4048
2022-04-05 22:28:26.589151 IP (tos 0x0, ttl 64, id 52851, offset 0, flags [DF], proto TCP (6), length 52)
    127.0.0.1.36816 > 127.0.0.1.10050: Flags [.], cksum 0xfe28 (incorrect -> 0xee10), seq 911, ack 16889, win 492, options [nop,nop,TS val 279989092 ecr 279989092], length 0
2022-04-05 22:28:26.589161 IP (tos 0x0, ttl 64, id 7489, offset 0, flags [DF], proto TCP (6), length 110)
    127.0.0.1.10050 > 127.0.0.1.36816: Flags [P.], cksum 0xfe62 (incorrect -> 0xcff8), seq 16889:16947, ack 911, win 512, options [nop,nop,TS val 279989092 ecr 279989092], length 58
2022-04-05 22:28:26.589167 IP (tos 0x0, ttl 64, id 52852, offset 0, flags [DF], proto TCP (6), length 52)
    127.0.0.1.36816 > 127.0.0.1.10050: Flags [.], cksum 0xfe28 (incorrect -> 0xedd6), seq 911, ack 16947, win 492, options [nop,nop,TS val 279989092 ecr 279989092], length 0
2022-04-05 22:28:26.623563 IP (tos 0x0, ttl 64, id 7490, offset 0, flags [DF], proto TCP (6), length 3350)
    127.0.0.1.10050 > 127.0.0.1.36816: Flags [P.], cksum 0x0b0b (incorrect -> 0x8b40), seq 16947:20245, ack 911, win 512, options [nop,nop,TS val 279989126 ecr 279989092], length 3298
2022-04-05 22:28:26.623571 IP (tos 0x0, ttl 64, id 52853, offset 0, flags [DF], proto TCP (6), length 52)
    127.0.0.1.36816 > 127.0.0.1.10050: Flags [.], cksum 0xfe28 (incorrect -> 0xe0ad), seq 911, ack 20245, win 495, options [nop,nop,TS val 279989126 ecr 279989126], length 0
2022-04-05 22:28:26.638910 IP (tos 0x0, ttl 64, id 7491, offset 0, flags [DF], proto TCP (6), length 3848)
    127.0.0.1.10050 > 127.0.0.1.36816: Flags [P.], cksum 0x0cfd (incorrect -> 0xb212), seq 20245:24041, ack 911, win 512, options [nop,nop,TS val 279989141 ecr 279989126], length 3796
2022-04-05 22:28:26.638916 IP (tos 0x0, ttl 64, id 52854, offset 0, flags [DF], proto TCP (6), length 52)
    127.0.0.1.36816 > 127.0.0.1.10050: Flags [.], cksum 0xfe28 (incorrect -> 0xd1bd), seq 911, ack 24041, win 493, options [nop,nop,TS val 279989141 ecr 279989141], length 0
2022-04-05 22:28:26.654207 IP (tos 0x0, ttl 64, id 7492, offset 0, flags [DF], proto TCP (6), length 3660)
    127.0.0.1.10050 > 127.0.0.1.36816: Flags [P.], cksum 0x0c41 (incorrect -> 0x8325), seq 24041:27649, ack 911, win 512, options [nop,nop,TS val 279989157 ecr 279989141], length 3608
2022-04-05 22:28:26.654213 IP (tos 0x0, ttl 64, id 52855, offset 0, flags [DF], proto TCP (6), length 52)
    127.0.0.1.36816 > 127.0.0.1.10050: Flags [.], cksum 0xfe28 (incorrect -> 0xc385), seq 911, ack 27649, win 493, options [nop,nop,TS val 279989157 ecr 279989157], length 0
2022-04-05 22:28:26.749109 IP (tos 0x0, ttl 64, id 7493, offset 0, flags [DF], proto TCP (6), length 4100)
    127.0.0.1.10050 > 127.0.0.1.36816: Flags [P.], cksum 0x0df9 (incorrect -> 0x3356), seq 27649:31697, ack 911, win 512, options [nop,nop,TS val 279989252 ecr 279989157], length 4048
2022-04-05 22:28:26.749117 IP (tos 0x0, ttl 64, id 52856, offset 0, flags [DF], proto TCP (6), length 52)
    127.0.0.1.36816 > 127.0.0.1.10050: Flags [.], cksum 0xfe28 (incorrect -> 0xb2f8), seq 911, ack 31697, win 492, options [nop,nop,TS val 279989252 ecr 279989252], length 0
2022-04-05 22:28:26.749124 IP (tos 0x0, ttl 64, id 7494, offset 0, flags [DF], proto TCP (6), length 2629)
    127.0.0.1.10050 > 127.0.0.1.36816: Flags [P.], cksum 0x083a (incorrect -> 0x05e8), seq 31697:34274, ack 911, win 512, options [nop,nop,TS val 279989252 ecr 279989252], length 2577
2022-04-05 22:28:26.749128 IP (tos 0x0, ttl 64, id 52857, offset 0, flags [DF], proto TCP (6), length 52)
    127.0.0.1.36816 > 127.0.0.1.10050: Flags [.], cksum 0xfe28 (incorrect -> 0xa8f1), seq 911, ack 34274, win 482, options [nop,nop,TS val 279989252 ecr 279989252], length 0
2022-04-05 22:28:26.749168 IP (tos 0x0, ttl 64, id 7495, offset 0, flags [DF], proto TCP (6), length 3769)
    127.0.0.1.10050 > 127.0.0.1.36816: Flags [P.], cksum 0x0cae (incorrect -> 0x9938), seq 34274:37991, ack 911, win 512, options [nop,nop,TS val 279989252 ecr 279989252], length 3717
2022-04-05 22:28:26.749418 IP (tos 0x0, ttl 64, id 52858, offset 0, flags [DF], proto TCP (6), length 52)
    127.0.0.1.36816 > 127.0.0.1.10050: Flags [.], cksum 0xfe28 (incorrect -> 0x9a4e), seq 911, ack 37991, win 512, options [nop,nop,TS val 279989252 ecr 279989252], length 0
2022-04-05 22:28:26.764401 IP (tos 0x0, ttl 64, id 7496, offset 0, flags [DF], proto TCP (6), length 1048)
    127.0.0.1.10050 > 127.0.0.1.36816: Flags [P.], cksum 0x020d (incorrect -> 0x3a35), seq 37991:38987, ack 911, win 512, options [nop,nop,TS val 279989267 ecr 279989252], length 996
2022-04-05 22:28:26.764418 IP (tos 0x0, ttl 64, id 52859, offset 0, flags [DF], proto TCP (6), length 52)
    127.0.0.1.36816 > 127.0.0.1.10050: Flags [.], cksum 0xfe28 (incorrect -> 0x964c), seq 911, ack 38987, win 512, options [nop,nop,TS val 279989267 ecr 279989267], length 0
2022-04-05 22:28:26.779773 IP (tos 0x0, ttl 64, id 7497, offset 0, flags [DF], proto TCP (6), length 1856)
    127.0.0.1.10050 > 127.0.0.1.36816: Flags [P.], cksum 0x0535 (incorrect -> 0x699a), seq 38987:40791, ack 911, win 512, options [nop,nop,TS val 279989282 ecr 279989267], length 1804
2022-04-05 22:28:26.779788 IP (tos 0x0, ttl 64, id 52860, offset 0, flags [DF], proto TCP (6), length 52)
    127.0.0.1.36816 > 127.0.0.1.10050: Flags [.], cksum 0xfe28 (incorrect -> 0x8f22), seq 911, ack 40791, win 512, options [nop,nop,TS val 279989282 ecr 279989282], length 0
2022-04-05 22:28:26.785535 IP (tos 0x0, ttl 64, id 7498, offset 0, flags [DF], proto TCP (6), length 3350)
    127.0.0.1.10050 > 127.0.0.1.36816: Flags [P.], cksum 0x0b0b (incorrect -> 0x4b23), seq 40791:44089, ack 911, win 512, options [nop,nop,TS val 279989288 ecr 279989282], length 3298
2022-04-05 22:28:26.785550 IP (tos 0x0, ttl 64, id 52861, offset 0, flags [DF], proto TCP (6), length 52)
    127.0.0.1.36816 > 127.0.0.1.10050: Flags [.], cksum 0xfe28 (incorrect -> 0x8234), seq 911, ack 44089, win 512, options [nop,nop,TS val 279989288 ecr 279989288], length 0
2022-04-05 22:28:26.785651 IP (tos 0x0, ttl 64, id 7499, offset 0, flags [DF], proto TCP (6), length 4100)
    127.0.0.1.10050 > 127.0.0.1.36816: Flags [P.], cksum 0x0df9 (incorrect -> 0xb7c7), seq 44089:48137, ack 911, win 512, options [nop,nop,TS val 279989288 ecr 279989288], length 4048
2022-04-05 22:28:26.826658 IP (tos 0x0, ttl 64, id 52862, offset 0, flags [DF], proto TCP (6), length 52)
    127.0.0.1.36816 > 127.0.0.1.10050: Flags [.], cksum 0xfe28 (incorrect -> 0x723b), seq 911, ack 48137, win 512, options [nop,nop,TS val 279989329 ecr 279989288], length 0
2022-04-05 22:28:26.826666 IP (tos 0x0, ttl 64, id 7500, offset 0, flags [DF], proto TCP (6), length 12926)
    127.0.0.1.10050 > 127.0.0.1.36816: Flags [P.], cksum 0x3073 (incorrect -> 0xafc8), seq 48137:61011, ack 911, win 512, options [nop,nop,TS val 279989329 ecr 279989329], length 12874
2022-04-05 22:28:26.870679 IP (tos 0x0, ttl 64, id 52863, offset 0, flags [DF], proto TCP (6), length 52)
    127.0.0.1.36816 > 127.0.0.1.10050: Flags [.], cksum 0xfe28 (incorrect -> 0x3f9c), seq 911, ack 61011, win 512, options [nop,nop,TS val 279989373 ecr 279989329], length 0
2022-04-05 22:28:26.890376 IP (tos 0x0, ttl 64, id 7501, offset 0, flags [DF], proto TCP (6), length 3350)
    127.0.0.1.10050 > 127.0.0.1.36816: Flags [P.], cksum 0x0b0b (incorrect -> 0xf08e), seq 61011:64309, ack 911, win 512, options [nop,nop,TS val 279989393 ecr 279989373], length 3298
2022-04-05 22:28:26.890509 IP (tos 0x0, ttl 64, id 52864, offset 0, flags [DF], proto TCP (6), length 52)
    127.0.0.1.36816 > 127.0.0.1.10050: Flags [.], cksum 0xfe28 (incorrect -> 0x3266), seq 911, ack 64309, win 512, options [nop,nop,TS val 279989393 ecr 279989393], length 0
2022-04-05 22:28:26.890547 IP (tos 0x0, ttl 64, id 7502, offset 0, flags [DF], proto TCP (6), length 3848)
    127.0.0.1.10050 > 127.0.0.1.36816: Flags [P.], cksum 0x0cfd (incorrect -> 0x9671), seq 64309:68105, ack 911, win 512, options [nop,nop,TS val 279989393 ecr 279989393], length 3796
2022-04-05 22:28:26.890558 IP (tos 0x0, ttl 64, id 52865, offset 0, flags [DF], proto TCP (6), length 52)
    127.0.0.1.36816 > 127.0.0.1.10050: Flags [.], cksum 0xfe28 (incorrect -> 0x2392), seq 911, ack 68105, win 512, options [nop,nop,TS val 279989393 ecr 279989393], length 0
2022-04-05 22:28:26.892550 IP (tos 0x0, ttl 64, id 7503, offset 0, flags [DF], proto TCP (6), length 4100)
    127.0.0.1.10050 > 127.0.0.1.36816: Flags [P.], cksum 0x0df9 (incorrect -> 0x5b1e), seq 68105:72153, ack 911, win 512, options [nop,nop,TS val 279989395 ecr 279989393], length 4048
2022-04-05 22:28:26.892614 IP (tos 0x0, ttl 64, id 52866, offset 0, flags [DF], proto TCP (6), length 52)
    127.0.0.1.36816 > 127.0.0.1.10050: Flags [.], cksum 0xfe28 (incorrect -> 0x13be), seq 911, ack 72153, win 512, options [nop,nop,TS val 279989395 ecr 279989395], length 0
2022-04-05 22:28:26.892621 IP (tos 0x0, ttl 64, id 7504, offset 0, flags [DF], proto TCP (6), length 10784)
    127.0.0.1.10050 > 127.0.0.1.36816: Flags [P.], cksum 0x2815 (incorrect -> 0xfaf7), seq 72153:82885, ack 911, win 512, options [nop,nop,TS val 279989395 ecr 279989395], length 10732
2022-04-05 22:28:26.893175 IP (tos 0x0, ttl 64, id 52867, offset 0, flags [DF], proto TCP (6), length 52)
    127.0.0.1.36816 > 127.0.0.1.10050: Flags [.], cksum 0xfe28 (incorrect -> 0xe9d0), seq 911, ack 82885, win 512, options [nop,nop,TS val 279989396 ecr 279989395], length 0
2022-04-05 22:28:26.893221 IP (tos 0x0, ttl 64, id 7505, offset 0, flags [DF], proto TCP (6), length 4100)
    127.0.0.1.10050 > 127.0.0.1.36816: Flags [P.], cksum 0x0df9 (incorrect -> 0x7ead), seq 82885:86933, ack 911, win 512, options [nop,nop,TS val 279989396 ecr 279989396], length 4048
2022-04-05 22:28:26.893239 IP (tos 0x0, ttl 64, id 52868, offset 0, flags [DF], proto TCP (6), length 52)
    127.0.0.1.36816 > 127.0.0.1.10050: Flags [.], cksum 0xfe28 (incorrect -> 0xd9ff), seq 911, ack 86933, win 512, options [nop,nop,TS val 279989396 ecr 279989396], length 0
2022-04-05 22:28:26.893243 IP (tos 0x0, ttl 64, id 7506, offset 0, flags [DF], proto TCP (6), length 486)
    127.0.0.1.10050 > 127.0.0.1.36816: Flags [P.], cksum 0xffda (incorrect -> 0x5d3d), seq 86933:87367, ack 911, win 512, options [nop,nop,TS val 279989396 ecr 279989396], length 434
2022-04-05 22:28:26.893427 IP (tos 0x0, ttl 64, id 52869, offset 0, flags [DF], proto TCP (6), length 52)
    127.0.0.1.36816 > 127.0.0.1.10050: Flags [.], cksum 0xfe28 (incorrect -> 0xd84d), seq 911, ack 87367, win 512, options [nop,nop,TS val 279989396 ecr 279989396], length 0
2022-04-05 22:28:26.905684 IP (tos 0x0, ttl 64, id 7507, offset 0, flags [DF], proto TCP (6), length 1546)
    127.0.0.1.10050 > 127.0.0.1.36816: Flags [P.], cksum 0x03ff (incorrect -> 0x4af3), seq 87367:88861, ack 911, win 512, options [nop,nop,TS val 279989408 ecr 279989396], length 1494
2022-04-05 22:28:26.905699 IP (tos 0x0, ttl 64, id 52870, offset 0, flags [DF], proto TCP (6), length 52)
    127.0.0.1.36816 > 127.0.0.1.10050: Flags [.], cksum 0xfe28 (incorrect -> 0xd25f), seq 911, ack 88861, win 512, options [nop,nop,TS val 279989408 ecr 279989408], length 0
2022-04-05 22:28:26.923128 IP (tos 0x0, ttl 64, id 7508, offset 0, flags [DF], proto TCP (6), length 3002)
    127.0.0.1.10050 > 127.0.0.1.36816: Flags [P.], cksum 0x09af (incorrect -> 0x24fa), seq 88861:91811, ack 911, win 512, options [nop,nop,TS val 279989426 ecr 279989408], length 2950
2022-04-05 22:28:26.923142 IP (tos 0x0, ttl 64, id 52871, offset 0, flags [DF], proto TCP (6), length 52)
    127.0.0.1.36816 > 127.0.0.1.10050: Flags [.], cksum 0xfe28 (incorrect -> 0xc6b5), seq 911, ack 91811, win 512, options [nop,nop,TS val 279989426 ecr 279989426], length 0
2022-04-05 22:28:26.966816 IP (tos 0x0, ttl 64, id 7509, offset 0, flags [DF], proto TCP (6), length 4100)
    127.0.0.1.10050 > 127.0.0.1.36816: Flags [P.], cksum 0x0df9 (incorrect -> 0xf36f), seq 91811:95859, ack 911, win 512, options [nop,nop,TS val 279989469 ecr 279989426], length 4048
2022-04-05 22:28:26.967033 IP (tos 0x0, ttl 64, id 52872, offset 0, flags [DF], proto TCP (6), length 52)
    127.0.0.1.36816 > 127.0.0.1.10050: Flags [.], cksum 0xfe28 (incorrect -> 0xb68f), seq 911, ack 95859, win 512, options [nop,nop,TS val 279989469 ecr 279989469], length 0
2022-04-05 22:28:26.967043 IP (tos 0x0, ttl 64, id 7510, offset 0, flags [DF], proto TCP (6), length 29200)
    127.0.0.1.10050 > 127.0.0.1.36816: Flags [P.], cksum 0x7005 (incorrect -> 0xd5ff), seq 95859:125007, ack 911, win 512, options [nop,nop,TS val 279989469 ecr 279989469], length 29148
200, 5.038872480392456, 2.3415398597717285