2022-04-05 12:48:46.403175 IP (tos 0x0, ttl 64, id 50106, offset 0, flags [DF], proto TCP (6), length 60)
    127.0.0.1.60598 > 127.0.0.1.12250: Flags [S], cksum 0xfe30 (incorrect -> 0x9e0f), seq 3451068870, win 65495, options [mss 65495,sackOK,TS val 245208906 ecr 0,nop,wscale 7], length 0
2022-04-05 12:48:46.403185 IP (tos 0x0, ttl 64, id 0, offset 0, flags [DF], proto TCP (6), length 60)
    127.0.0.1.12250 > 127.0.0.1.60598: Flags [S.], cksum 0xfe30 (incorrect -> 0x4100), seq 4037854837, ack 3451068871, win 65483, options [mss 65495,sackOK,TS val 245208906 ecr 245208906,nop,wscale 7], length 0
2022-04-05 12:48:46.403192 IP (tos 0x0, ttl 64, id 50107, offset 0, flags [DF], proto TCP (6), length 52)
    127.0.0.1.60598 > 127.0.0.1.12250: Flags [.], cksum 0xfe28 (incorrect -> 0x67bc), seq 1, ack 1, win 512, options [nop,nop,TS val 245208906 ecr 245208906], length 0
2022-04-05 12:48:46.403287 IP (tos 0x0, ttl 64, id 50108, offset 0, flags [DF], proto TCP (6), length 55)
    127.0.0.1.60598 > 127.0.0.1.12250: Flags [P.], cksum 0xfe2b (incorrect -> 0x62b0), seq 1:4, ack 1, win 512, options [nop,nop,TS val 245208906 ecr 245208906], length 3
2022-04-05 12:48:46.403301 IP (tos 0x0, ttl 64, id 44750, offset 0, flags [DF], proto TCP (6), length 52)
    127.0.0.1.12250 > 127.0.0.1.60598: Flags [.], cksum 0xfe28 (incorrect -> 0x67b9), seq 1, ack 4, win 512, options [nop,nop,TS val 245208906 ecr 245208906], length 0
2022-04-05 12:48:46.403351 IP (tos 0x0, ttl 64, id 44751, offset 0, flags [DF], proto TCP (6), length 54)
    127.0.0.1.12250 > 127.0.0.1.60598: Flags [P.], cksum 0xfe2a (incorrect -> 0x62af), seq 1:3, ack 4, win 512, options [nop,nop,TS val 245208906 ecr 245208906], length 2
2022-04-05 12:48:46.403371 IP (tos 0x0, ttl 64, id 50109, offset 0, flags [DF], proto TCP (6), length 52)
    127.0.0.1.60598 > 127.0.0.1.12250: Flags [.], cksum 0xfe28 (incorrect -> 0x67b7), seq 4, ack 3, win 512, options [nop,nop,TS val 245208906 ecr 245208906], length 0
2022-04-05 12:48:46.404461 IP (tos 0x0, ttl 64, id 50110, offset 0, flags [DF], proto TCP (6), length 62)
    127.0.0.1.60598 > 127.0.0.1.12250: Flags [P.], cksum 0xfe32 (incorrect -> 0xcec2), seq 4:14, ack 3, win 512, options [nop,nop,TS val 245208907 ecr 245208906], length 10
2022-04-05 12:48:46.404471 IP (tos 0x0, ttl 64, id 44752, offset 0, flags [DF], proto TCP (6), length 52)
    127.0.0.1.12250 > 127.0.0.1.60598: Flags [.], cksum 0xfe28 (incorrect -> 0x67ab), seq 3, ack 14, win 512, options [nop,nop,TS val 245208907 ecr 245208907], length 0
2022-04-05 12:48:46.500988 IP (tos 0x0, ttl 64, id 44753, offset 0, flags [DF], proto TCP (6), length 62)
    127.0.0.1.12250 > 127.0.0.1.60598: Flags [P.], cksum 0xfe32 (incorrect -> 0x6238), seq 3:13, ack 14, win 512, options [nop,nop,TS val 245209003 ecr 245208907], length 10
2022-04-05 12:48:46.500997 IP (tos 0x0, ttl 64, id 50111, offset 0, flags [DF], proto TCP (6), length 52)
    127.0.0.1.60598 > 127.0.0.1.12250: Flags [.], cksum 0xfe28 (incorrect -> 0x66e1), seq 14, ack 13, win 512, options [nop,nop,TS val 245209003 ecr 245209003], length 0
2022-04-05 12:48:46.507060 IP (tos 0x0, ttl 64, id 50112, offset 0, flags [DF], proto TCP (6), length 569)
    127.0.0.1.60598 > 127.0.0.1.12250: Flags [P.], cksum 0x002e (incorrect -> 0x2d3f), seq 14:531, ack 13, win 512, options [nop,nop,TS val 245209009 ecr 245209003], length 517
2022-04-05 12:48:46.507070 IP (tos 0x0, ttl 64, id 44754, offset 0, flags [DF], proto TCP (6), length 52)
    127.0.0.1.12250 > 127.0.0.1.60598: Flags [.], cksum 0xfe28 (incorrect -> 0x64d3), seq 13, ack 531, win 508, options [nop,nop,TS val 245209010 ecr 245209009], length 0
2022-04-05 12:48:46.622422 IP (tos 0x0, ttl 64, id 44755, offset 0, flags [DF], proto TCP (6), length 3538)
    127.0.0.1.12250 > 127.0.0.1.60598: Flags [P.], cksum 0x0bc7 (incorrect -> 0x786f), seq 13:3499, ack 531, win 512, options [nop,nop,TS val 245209125 ecr 245209009], length 3486
2022-04-05 12:48:46.622431 IP (tos 0x0, ttl 64, id 50113, offset 0, flags [DF], proto TCP (6), length 52)
    127.0.0.1.60598 > 127.0.0.1.12250: Flags [.], cksum 0xfe28 (incorrect -> 0x565c), seq 531, ack 3499, win 494, options [nop,nop,TS val 245209125 ecr 245209125], length 0
2022-04-05 12:48:46.699769 IP (tos 0x0, ttl 64, id 44756, offset 0, flags [DF], proto TCP (6), length 289)
    127.0.0.1.12250 > 127.0.0.1.60598: Flags [P.], cksum 0xff15 (incorrect -> 0xdc61), seq 3499:3736, ack 531, win 512, options [nop,nop,TS val 245209202 ecr 245209125], length 237
2022-04-05 12:48:46.699777 IP (tos 0x0, ttl 64, id 50114, offset 0, flags [DF], proto TCP (6), length 52)
    127.0.0.1.60598 > 127.0.0.1.12250: Flags [.], cksum 0xfe28 (incorrect -> 0x54c8), seq 531, ack 3736, win 507, options [nop,nop,TS val 245209202 ecr 245209202], length 0
2022-04-05 12:48:46.702247 IP (tos 0x0, ttl 64, id 50115, offset 0, flags [DF], proto TCP (6), length 210)
    127.0.0.1.60598 > 127.0.0.1.12250: Flags [P.], cksum 0xfec6 (incorrect -> 0x45aa), seq 531:689, ack 3736, win 512, options [nop,nop,TS val 245209205 ecr 245209202], length 158
2022-04-05 12:48:46.702257 IP (tos 0x0, ttl 64, id 44757, offset 0, flags [DF], proto TCP (6), length 52)
    127.0.0.1.12250 > 127.0.0.1.60598: Flags [.], cksum 0xfe28 (incorrect -> 0x5420), seq 3736, ack 689, win 511, options [nop,nop,TS val 245209205 ecr 245209205], length 0
2022-04-05 12:48:46.806241 IP (tos 0x0, ttl 64, id 44758, offset 0, flags [DF], proto TCP (6), length 394)
    127.0.0.1.12250 > 127.0.0.1.60598: Flags [P.], cksum 0xff7e (incorrect -> 0x7552), seq 3736:4078, ack 689, win 512, options [nop,nop,TS val 245209309 ecr 245209205], length 342
2022-04-05 12:48:46.806250 IP (tos 0x0, ttl 64, id 50116, offset 0, flags [DF], proto TCP (6), length 52)
    127.0.0.1.60598 > 127.0.0.1.12250: Flags [.], cksum 0xfe28 (incorrect -> 0x51fb), seq 689, ack 4078, win 510, options [nop,nop,TS val 245209309 ecr 245209309], length 0
2022-04-05 12:48:46.806719 IP (tos 0x0, ttl 64, id 50117, offset 0, flags [DF], proto TCP (6), length 379)
    127.0.0.1.60598 > 127.0.0.1.12250: Flags [P.], cksum 0xff6f (incorrect -> 0x9ecf), seq 689:1016, ack 4078, win 512, options [nop,nop,TS val 245209309 ecr 245209309], length 327
2022-04-05 12:48:46.806730 IP (tos 0x0, ttl 64, id 44759, offset 0, flags [DF], proto TCP (6), length 52)
    127.0.0.1.12250 > 127.0.0.1.60598: Flags [.], cksum 0xfe28 (incorrect -> 0x50b4), seq 4078, ack 1016, win 510, options [nop,nop,TS val 245209309 ecr 245209309], length 0
2022-04-05 12:48:46.928635 IP (tos 0x0, ttl 64, id 44760, offset 0, flags [DF], proto TCP (6), length 314)
    127.0.0.1.12250 > 127.0.0.1.60598: Flags [P.], cksum 0xff2e (incorrect -> 0x3391), seq 4078:4340, ack 1016, win 512, options [nop,nop,TS val 245209431 ecr 245209309], length 262
2022-04-05 12:48:46.930881 IP (tos 0x0, ttl 64, id 21047, offset 0, flags [DF], proto TCP (6), length 60)
    127.0.0.1.60600 > 127.0.0.1.12250: Flags [S], cksum 0xfe30 (incorrect -> 0x70ff), seq 3958910592, win 65495, options [mss 65495,sackOK,TS val 245209433 ecr 0,nop,wscale 7], length 0
2022-04-05 12:48:46.930894 IP (tos 0x0, ttl 64, id 0, offset 0, flags [DF], proto TCP (6), length 60)
    127.0.0.1.12250 > 127.0.0.1.60600: Flags [S.], cksum 0xfe30 (incorrect -> 0x0cd8), seq 215723856, ack 3958910593, win 65483, options [mss 65495,sackOK,TS val 245209433 ecr 245209433,nop,wscale 7], length 0
2022-04-05 12:48:46.930904 IP (tos 0x0, ttl 64, id 21048, offset 0, flags [DF], proto TCP (6), length 52)
    127.0.0.1.60600 > 127.0.0.1.12250: Flags [.], cksum 0xfe28 (incorrect -> 0x3394), seq 1, ack 1, win 512, options [nop,nop,TS val 245209433 ecr 245209433], length 0
2022-04-05 12:48:46.930999 IP (tos 0x0, ttl 64, id 21049, offset 0, flags [DF], proto TCP (6), length 55)
    127.0.0.1.60600 > 127.0.0.1.12250: Flags [P.], cksum 0xfe2b (incorrect -> 0x2e88), seq 1:4, ack 1, win 512, options [nop,nop,TS val 245209433 ecr 245209433], length 3
2022-04-05 12:48:46.931008 IP (tos 0x0, ttl 64, id 43646, offset 0, flags [DF], proto TCP (6), length 52)
    127.0.0.1.12250 > 127.0.0.1.60600: Flags [.], cksum 0xfe28 (incorrect -> 0x3391), seq 1, ack 4, win 512, options [nop,nop,TS val 245209433 ecr 245209433], length 0
2022-04-05 12:48:46.931029 IP (tos 0x0, ttl 64, id 43647, offset 0, flags [DF], proto TCP (6), length 54)
    127.0.0.1.12250 > 127.0.0.1.60600: Flags [P.], cksum 0xfe2a (incorrect -> 0x2e87), seq 1:3, ack 4, win 512, options [nop,nop,TS val 245209433 ecr 245209433], length 2
2022-04-05 12:48:46.931038 IP (tos 0x0, ttl 64, id 21050, offset 0, flags [DF], proto TCP (6), length 52)
    127.0.0.1.60600 > 127.0.0.1.12250: Flags [.], cksum 0xfe28 (incorrect -> 0x338f), seq 4, ack 3, win 512, options [nop,nop,TS val 245209433 ecr 245209433], length 0
2022-04-05 12:48:46.932591 IP (tos 0x0, ttl 64, id 21051, offset 0, flags [DF], proto TCP (6), length 62)
    127.0.0.1.60600 > 127.0.0.1.12250: Flags [P.], cksum 0xfe32 (incorrect -> 0x190a), seq 4:14, ack 3, win 512, options [nop,nop,TS val 245209435 ecr 245209433], length 10
2022-04-05 12:48:46.932612 IP (tos 0x0, ttl 64, id 43648, offset 0, flags [DF], proto TCP (6), length 52)
    127.0.0.1.12250 > 127.0.0.1.60600: Flags [.], cksum 0xfe28 (incorrect -> 0x3381), seq 3, ack 14, win 512, options [nop,nop,TS val 245209435 ecr 245209435], length 0
2022-04-05 12:48:46.970667 IP (tos 0x0, ttl 64, id 50118, offset 0, flags [DF], proto TCP (6), length 52)
    127.0.0.1.60598 > 127.0.0.1.12250: Flags [.], cksum 0xfe28 (incorrect -> 0x4e8e), seq 1016, ack 4340, win 512, options [nop,nop,TS val 245209473 ecr 245209431], length 0
2022-04-05 12:48:47.069700 IP (tos 0x0, ttl 64, id 43649, offset 0, flags [DF], proto TCP (6), length 62)
    127.0.0.1.12250 > 127.0.0.1.60600: Flags [P.], cksum 0xfe32 (incorrect -> 0x2de5), seq 3:13, ack 14, win 512, options [nop,nop,TS val 245209572 ecr 245209435], length 10
2022-04-05 12:48:47.069711 IP (tos 0x0, ttl 64, id 21052, offset 0, flags [DF], proto TCP (6), length 52)
    127.0.0.1.60600 > 127.0.0.1.12250: Flags [.], cksum 0xfe28 (incorrect -> 0x3265), seq 14, ack 13, win 512, options [nop,nop,TS val 245209572 ecr 245209572], length 0
2022-04-05 12:48:47.074949 IP (tos 0x0, ttl 64, id 21053, offset 0, flags [DF], proto TCP (6), length 569)
    127.0.0.1.60600 > 127.0.0.1.12250: Flags [P.], cksum 0x002e (incorrect -> 0xcbf6), seq 14:531, ack 13, win 512, options [nop,nop,TS val 245209577 ecr 245209572], length 517
2022-04-05 12:48:47.074958 IP (tos 0x0, ttl 64, id 43650, offset 0, flags [DF], proto TCP (6), length 52)
    127.0.0.1.12250 > 127.0.0.1.60600: Flags [.], cksum 0xfe28 (incorrect -> 0x305a), seq 13, ack 531, win 508, options [nop,nop,TS val 245209577 ecr 245209577], length 0
2022-04-05 12:48:47.200556 IP (tos 0x0, ttl 64, id 43651, offset 0, flags [DF], proto TCP (6), length 151)
    127.0.0.1.12250 > 127.0.0.1.60600: Flags [P.], cksum 0xfe8b (incorrect -> 0xc41a), seq 13:112, ack 531, win 512, options [nop,nop,TS val 245209703 ecr 245209577], length 99
2022-04-05 12:48:47.200567 IP (tos 0x0, ttl 64, id 21054, offset 0, flags [DF], proto TCP (6), length 52)
    127.0.0.1.60600 > 127.0.0.1.12250: Flags [.], cksum 0xfe28 (incorrect -> 0x2ef7), seq 531, ack 112, win 512, options [nop,nop,TS val 245209703 ecr 245209703], length 0
2022-04-05 12:48:47.201763 IP (tos 0x0, ttl 64, id 21055, offset 0, flags [DF], proto TCP (6), length 575)
    127.0.0.1.60600 > 127.0.0.1.12250: Flags [P.], cksum 0x0034 (incorrect -> 0x272a), seq 531:1054, ack 112, win 512, options [nop,nop,TS val 245209704 ecr 245209703], length 523
2022-04-05 12:48:47.201770 IP (tos 0x0, ttl 64, id 43652, offset 0, flags [DF], proto TCP (6), length 52)
    127.0.0.1.12250 > 127.0.0.1.60600: Flags [.], cksum 0xfe28 (incorrect -> 0x2cee), seq 112, ack 1054, win 508, options [nop,nop,TS val 245209704 ecr 245209704], length 0
2022-04-05 12:48:47.318930 IP (tos 0x0, ttl 64, id 43653, offset 0, flags [DF], proto TCP (6), length 3538)
    127.0.0.1.12250 > 127.0.0.1.60600: Flags [P.], cksum 0x0bc7 (incorrect -> 0x1b5f), seq 112:3598, ack 1054, win 512, options [nop,nop,TS val 245209821 ecr 245209704], length 3486
2022-04-05 12:48:47.318942 IP (tos 0x0, ttl 64, id 21056, offset 0, flags [DF], proto TCP (6), length 52)
    127.0.0.1.60600 > 127.0.0.1.12250: Flags [.], cksum 0xfe28 (incorrect -> 0x1e74), seq 1054, ack 3598, win 494, options [nop,nop,TS val 245209821 ecr 245209821], length 0
2022-04-05 12:48:47.407785 IP (tos 0x0, ttl 64, id 43654, offset 0, flags [DF], proto TCP (6), length 600)
    127.0.0.1.12250 > 127.0.0.1.60600: Flags [P.], cksum 0x004d (incorrect -> 0xc59e), seq 3598:4146, ack 1054, win 512, options [nop,nop,TS val 245209910 ecr 245209821], length 548
2022-04-05 12:48:47.407793 IP (tos 0x0, ttl 64, id 21057, offset 0, flags [DF], proto TCP (6), length 52)
    127.0.0.1.60600 > 127.0.0.1.12250: Flags [.], cksum 0xfe28 (incorrect -> 0x1b93), seq 1054, ack 4146, win 505, options [nop,nop,TS val 245209910 ecr 245209910], length 0
2022-04-05 12:48:47.408195 IP (tos 0x0, ttl 64, id 21058, offset 0, flags [DF], proto TCP (6), length 126)
    127.0.0.1.60600 > 127.0.0.1.12250: Flags [P.], cksum 0xfe72 (incorrect -> 0xf36e), seq 1054:1128, ack 4146, win 512, options [nop,nop,TS val 245209911 ecr 245209910], length 74
2022-04-05 12:48:47.408203 IP (tos 0x0, ttl 64, id 43655, offset 0, flags [DF], proto TCP (6), length 52)
    127.0.0.1.12250 > 127.0.0.1.60600: Flags [.], cksum 0xfe28 (incorrect -> 0x1b40), seq 4146, ack 1128, win 512, options [nop,nop,TS val 245209911 ecr 245209911], length 0
2022-04-05 12:48:47.408620 IP (tos 0x0, ttl 64, id 21059, offset 0, flags [DF], proto TCP (6), length 380)
    127.0.0.1.60600 > 127.0.0.1.12250: Flags [P.], cksum 0xff70 (incorrect -> 0x6833), seq 1128:1456, ack 4146, win 512, options [nop,nop,TS val 245209911 ecr 245209911], length 328
2022-04-05 12:48:47.408629 IP (tos 0x0, ttl 64, id 43656, offset 0, flags [DF], proto TCP (6), length 52)
    127.0.0.1.12250 > 127.0.0.1.60600: Flags [.], cksum 0xfe28 (incorrect -> 0x19fa), seq 4146, ack 1456, win 510, options [nop,nop,TS val 245209911 ecr 245209911], length 0
2022-04-05 12:48:47.521873 IP (tos 0x0, ttl 64, id 43657, offset 0, flags [DF], proto TCP (6), length 511)
    127.0.0.1.12250 > 127.0.0.1.60600: Flags [P.], cksum 0xfff3 (incorrect -> 0x04fc), seq 4146:4605, ack 1456, win 512, options [nop,nop,TS val 245210024 ecr 245209911], length 459
2022-04-05 12:48:47.562658 IP (tos 0x0, ttl 64, id 21060, offset 0, flags [DF], proto TCP (6), length 52)
    127.0.0.1.60600 > 127.0.0.1.12250: Flags [.], cksum 0xfe28 (incorrect -> 0x1722), seq 1456, ack 4605, win 512, options [nop,nop,TS val 245210065 ecr 245210024], length 0
200, 5.787465810775757, 1.3081867694854736