2022-04-05 19:12:34.704393 IP (tos 0x0, ttl 64, id 55654, offset 0, flags [DF], proto TCP (6), length 60)
    127.0.0.1.60100 > 127.0.0.1.10850: Flags [S], cksum 0xfe30 (incorrect -> 0xeb2b), seq 3046609027, win 65495, options [mss 65495,sackOK,TS val 268237207 ecr 0,nop,wscale 7], length 0
2022-04-05 19:12:34.704407 IP (tos 0x0, ttl 64, id 0, offset 0, flags [DF], proto TCP (6), length 60)
    127.0.0.1.10850 > 127.0.0.1.60100: Flags [S.], cksum 0xfe30 (incorrect -> 0xc772), seq 2907270358, ack 3046609028, win 65483, options [mss 65495,sackOK,TS val 268237207 ecr 268237207,nop,wscale 7], length 0
2022-04-05 19:12:34.704420 IP (tos 0x0, ttl 64, id 55655, offset 0, flags [DF], proto TCP (6), length 52)
    127.0.0.1.60100 > 127.0.0.1.10850: Flags [.], cksum 0xfe28 (incorrect -> 0xee2e), seq 1, ack 1, win 512, options [nop,nop,TS val 268237207 ecr 268237207], length 0
2022-04-05 19:12:34.704586 IP (tos 0x0, ttl 64, id 55656, offset 0, flags [DF], proto TCP (6), length 55)
    127.0.0.1.60100 > 127.0.0.1.10850: Flags [P.], cksum 0xfe2b (incorrect -> 0xe922), seq 1:4, ack 1, win 512, options [nop,nop,TS val 268237207 ecr 268237207], length 3
2022-04-05 19:12:34.704603 IP (tos 0x0, ttl 64, id 14939, offset 0, flags [DF], proto TCP (6), length 52)
    127.0.0.1.10850 > 127.0.0.1.60100: Flags [.], cksum 0xfe28 (incorrect -> 0xee2b), seq 1, ack 4, win 512, options [nop,nop,TS val 268237207 ecr 268237207], length 0
2022-04-05 19:12:34.704695 IP (tos 0x0, ttl 64, id 14940, offset 0, flags [DF], proto TCP (6), length 54)
    127.0.0.1.10850 > 127.0.0.1.60100: Flags [P.], cksum 0xfe2a (incorrect -> 0xe921), seq 1:3, ack 4, win 512, options [nop,nop,TS val 268237207 ecr 268237207], length 2
2022-04-05 19:12:34.704710 IP (tos 0x0, ttl 64, id 55657, offset 0, flags [DF], proto TCP (6), length 52)
    127.0.0.1.60100 > 127.0.0.1.10850: Flags [.], cksum 0xfe28 (incorrect -> 0xee29), seq 4, ack 3, win 512, options [nop,nop,TS val 268237207 ecr 268237207], length 0
2022-04-05 19:12:34.716218 IP (tos 0x0, ttl 64, id 55658, offset 0, flags [DF], proto TCP (6), length 62)
    127.0.0.1.60100 > 127.0.0.1.10850: Flags [P.], cksum 0xfe32 (incorrect -> 0x2a7e), seq 4:14, ack 3, win 512, options [nop,nop,TS val 268237219 ecr 268237207], length 10
2022-04-05 19:12:34.716229 IP (tos 0x0, ttl 64, id 14941, offset 0, flags [DF], proto TCP (6), length 52)
    127.0.0.1.10850 > 127.0.0.1.60100: Flags [.], cksum 0xfe28 (incorrect -> 0xee07), seq 3, ack 14, win 512, options [nop,nop,TS val 268237219 ecr 268237219], length 0
2022-04-05 19:12:34.787902 IP (tos 0x0, ttl 64, id 14942, offset 0, flags [DF], proto TCP (6), length 62)
    127.0.0.1.10850 > 127.0.0.1.60100: Flags [P.], cksum 0xfe32 (incorrect -> 0xe8ad), seq 3:13, ack 14, win 512, options [nop,nop,TS val 268237290 ecr 268237219], length 10
2022-04-05 19:12:34.787911 IP (tos 0x0, ttl 64, id 55659, offset 0, flags [DF], proto TCP (6), length 52)
    127.0.0.1.60100 > 127.0.0.1.10850: Flags [.], cksum 0xfe28 (incorrect -> 0xed6f), seq 14, ack 13, win 512, options [nop,nop,TS val 268237290 ecr 268237290], length 0
2022-04-05 19:12:34.795568 IP (tos 0x0, ttl 64, id 55660, offset 0, flags [DF], proto TCP (6), length 569)
    127.0.0.1.60100 > 127.0.0.1.10850: Flags [P.], cksum 0x002e (incorrect -> 0x8f29), seq 14:531, ack 13, win 512, options [nop,nop,TS val 268237298 ecr 268237290], length 517
2022-04-05 19:12:34.795580 IP (tos 0x0, ttl 64, id 14943, offset 0, flags [DF], proto TCP (6), length 52)
    127.0.0.1.10850 > 127.0.0.1.60100: Flags [.], cksum 0xfe28 (incorrect -> 0xeb5e), seq 13, ack 531, win 508, options [nop,nop,TS val 268237298 ecr 268237298], length 0
2022-04-05 19:12:34.868131 IP (tos 0x0, ttl 64, id 14944, offset 0, flags [DF], proto TCP (6), length 1500)
    127.0.0.1.10850 > 127.0.0.1.60100: Flags [P.], cksum 0x03d1 (incorrect -> 0x5f5c), seq 13:1461, ack 531, win 512, options [nop,nop,TS val 268237371 ecr 268237298], length 1448
2022-04-05 19:12:34.868140 IP (tos 0x0, ttl 64, id 55661, offset 0, flags [DF], proto TCP (6), length 52)
    127.0.0.1.60100 > 127.0.0.1.10850: Flags [.], cksum 0xfe28 (incorrect -> 0xe52a), seq 531, ack 1461, win 502, options [nop,nop,TS val 268237371 ecr 268237371], length 0
2022-04-05 19:12:34.885669 IP (tos 0x0, ttl 64, id 14945, offset 0, flags [DF], proto TCP (6), length 1973)
    127.0.0.1.10850 > 127.0.0.1.60100: Flags [P.], cksum 0x05aa (incorrect -> 0x9d9d), seq 1461:3382, ack 531, win 512, options [nop,nop,TS val 268237388 ecr 268237371], length 1921
2022-04-05 19:12:34.885677 IP (tos 0x0, ttl 64, id 55662, offset 0, flags [DF], proto TCP (6), length 52)
    127.0.0.1.60100 > 127.0.0.1.10850: Flags [.], cksum 0xfe28 (incorrect -> 0xdd89), seq 531, ack 3382, win 500, options [nop,nop,TS val 268237388 ecr 268237388], length 0
2022-04-05 19:12:34.886656 IP (tos 0x0, ttl 64, id 55663, offset 0, flags [DF], proto TCP (6), length 116)
    127.0.0.1.60100 > 127.0.0.1.10850: Flags [P.], cksum 0xfe68 (incorrect -> 0x10c5), seq 531:595, ack 3382, win 512, options [nop,nop,TS val 268237389 ecr 268237388], length 64
2022-04-05 19:12:34.886674 IP (tos 0x0, ttl 64, id 14946, offset 0, flags [DF], proto TCP (6), length 52)
    127.0.0.1.10850 > 127.0.0.1.60100: Flags [.], cksum 0xfe28 (incorrect -> 0xdd3b), seq 3382, ack 595, win 512, options [nop,nop,TS val 268237389 ecr 268237389], length 0
2022-04-05 19:12:34.887176 IP (tos 0x0, ttl 64, id 55664, offset 0, flags [DF], proto TCP (6), length 379)
    127.0.0.1.60100 > 127.0.0.1.10850: Flags [P.], cksum 0xff6f (incorrect -> 0x01e7), seq 595:922, ack 3382, win 512, options [nop,nop,TS val 268237390 ecr 268237389], length 327
2022-04-05 19:12:34.887196 IP (tos 0x0, ttl 64, id 14947, offset 0, flags [DF], proto TCP (6), length 52)
    127.0.0.1.10850 > 127.0.0.1.60100: Flags [.], cksum 0xfe28 (incorrect -> 0xdbf4), seq 3382, ack 922, win 510, options [nop,nop,TS val 268237390 ecr 268237390], length 0
2022-04-05 19:12:35.001440 IP (tos 0x0, ttl 64, id 14948, offset 0, flags [DF], proto TCP (6), length 323)
    127.0.0.1.10850 > 127.0.0.1.60100: Flags [P.], cksum 0xff37 (incorrect -> 0x619a), seq 3382:3653, ack 922, win 512, options [nop,nop,TS val 268237504 ecr 268237390], length 271
2022-04-05 19:12:35.001448 IP (tos 0x0, ttl 64, id 55665, offset 0, flags [DF], proto TCP (6), length 52)
    127.0.0.1.60100 > 127.0.0.1.10850: Flags [.], cksum 0xfe28 (incorrect -> 0xda01), seq 922, ack 3653, win 510, options [nop,nop,TS val 268237504 ecr 268237504], length 0
2022-04-05 19:12:35.040231 IP (tos 0x0, ttl 64, id 14949, offset 0, flags [DF], proto TCP (6), length 323)
    127.0.0.1.10850 > 127.0.0.1.60100: Flags [P.], cksum 0xff37 (incorrect -> 0x25ea), seq 3653:3924, ack 922, win 512, options [nop,nop,TS val 268237543 ecr 268237504], length 271
2022-04-05 19:12:35.040238 IP (tos 0x0, ttl 64, id 55666, offset 0, flags [DF], proto TCP (6), length 52)
    127.0.0.1.60100 > 127.0.0.1.10850: Flags [.], cksum 0xfe28 (incorrect -> 0xd8a6), seq 922, ack 3924, win 508, options [nop,nop,TS val 268237543 ecr 268237543], length 0
2022-04-05 19:12:35.057666 IP (tos 0x0, ttl 64, id 14950, offset 0, flags [DF], proto TCP (6), length 1486)
    127.0.0.1.10850 > 127.0.0.1.60100: Flags [P.], cksum 0x03c3 (incorrect -> 0xcdc5), seq 3924:5358, ack 922, win 512, options [nop,nop,TS val 268237560 ecr 268237543], length 1434
2022-04-05 19:12:35.057674 IP (tos 0x0, ttl 64, id 55667, offset 0, flags [DF], proto TCP (6), length 52)
    127.0.0.1.60100 > 127.0.0.1.10850: Flags [.], cksum 0xfe28 (incorrect -> 0xd2f0), seq 922, ack 5358, win 502, options [nop,nop,TS val 268237560 ecr 268237560], length 0
2022-04-05 19:12:35.060783 IP (tos 0x0, ttl 64, id 5325, offset 0, flags [DF], proto TCP (6), length 60)
    127.0.0.1.60102 > 127.0.0.1.10850: Flags [S], cksum 0xfe30 (incorrect -> 0x327c), seq 3086632298, win 65495, options [mss 65495,sackOK,TS val 268237563 ecr 0,nop,wscale 7], length 0
2022-04-05 19:12:35.060796 IP (tos 0x0, ttl 64, id 0, offset 0, flags [DF], proto TCP (6), length 60)
    127.0.0.1.10850 > 127.0.0.1.60102: Flags [S.], cksum 0xfe30 (incorrect -> 0xfe58), seq 1698481129, ack 3086632299, win 65483, options [mss 65495,sackOK,TS val 268237563 ecr 268237563,nop,wscale 7], length 0
2022-04-05 19:12:35.060806 IP (tos 0x0, ttl 64, id 5326, offset 0, flags [DF], proto TCP (6), length 52)
    127.0.0.1.60102 > 127.0.0.1.10850: Flags [.], cksum 0xfe28 (incorrect -> 0x2515), seq 1, ack 1, win 512, options [nop,nop,TS val 268237563 ecr 268237563], length 0
2022-04-05 19:12:35.060901 IP (tos 0x0, ttl 64, id 5327, offset 0, flags [DF], proto TCP (6), length 55)
    127.0.0.1.60102 > 127.0.0.1.10850: Flags [P.], cksum 0xfe2b (incorrect -> 0x2009), seq 1:4, ack 1, win 512, options [nop,nop,TS val 268237563 ecr 268237563], length 3
2022-04-05 19:12:35.060910 IP (tos 0x0, ttl 64, id 42705, offset 0, flags [DF], proto TCP (6), length 52)
    127.0.0.1.10850 > 127.0.0.1.60102: Flags [.], cksum 0xfe28 (incorrect -> 0x2512), seq 1, ack 4, win 512, options [nop,nop,TS val 268237563 ecr 268237563], length 0
2022-04-05 19:12:35.060929 IP (tos 0x0, ttl 64, id 42706, offset 0, flags [DF], proto TCP (6), length 54)
    127.0.0.1.10850 > 127.0.0.1.60102: Flags [P.], cksum 0xfe2a (incorrect -> 0x2008), seq 1:3, ack 4, win 512, options [nop,nop,TS val 268237563 ecr 268237563], length 2
2022-04-05 19:12:35.060938 IP (tos 0x0, ttl 64, id 5328, offset 0, flags [DF], proto TCP (6), length 52)
    127.0.0.1.60102 > 127.0.0.1.10850: Flags [.], cksum 0xfe28 (incorrect -> 0x2510), seq 4, ack 3, win 512, options [nop,nop,TS val 268237563 ecr 268237563], length 0
2022-04-05 19:12:35.071983 IP (tos 0x0, ttl 64, id 5329, offset 0, flags [DF], proto TCP (6), length 62)
    127.0.0.1.60102 > 127.0.0.1.10850: Flags [P.], cksum 0xfe32 (incorrect -> 0x6165), seq 4:14, ack 3, win 512, options [nop,nop,TS val 268237574 ecr 268237563], length 10
2022-04-05 19:12:35.071992 IP (tos 0x0, ttl 64, id 42707, offset 0, flags [DF], proto TCP (6), length 52)
    127.0.0.1.10850 > 127.0.0.1.60102: Flags [.], cksum 0xfe28 (incorrect -> 0x24f0), seq 3, ack 14, win 512, options [nop,nop,TS val 268237574 ecr 268237574], length 0
2022-04-05 19:12:35.163062 IP (tos 0x0, ttl 64, id 42708, offset 0, flags [DF], proto TCP (6), length 62)
    127.0.0.1.10850 > 127.0.0.1.60102: Flags [P.], cksum 0xfe32 (incorrect -> 0x1f82), seq 3:13, ack 14, win 512, options [nop,nop,TS val 268237665 ecr 268237574], length 10
2022-04-05 19:12:35.163070 IP (tos 0x0, ttl 64, id 5330, offset 0, flags [DF], proto TCP (6), length 52)
    127.0.0.1.60102 > 127.0.0.1.10850: Flags [.], cksum 0xfe28 (incorrect -> 0x242f), seq 14, ack 13, win 512, options [nop,nop,TS val 268237666 ecr 268237665], length 0
2022-04-05 19:12:35.168419 IP (tos 0x0, ttl 64, id 5331, offset 0, flags [DF], proto TCP (6), length 569)
    127.0.0.1.60102 > 127.0.0.1.10850: Flags [P.], cksum 0x002e (incorrect -> 0xeef5), seq 14:531, ack 13, win 512, options [nop,nop,TS val 268237671 ecr 268237665], length 517
2022-04-05 19:12:35.168432 IP (tos 0x0, ttl 64, id 42709, offset 0, flags [DF], proto TCP (6), length 52)
    127.0.0.1.10850 > 127.0.0.1.60102: Flags [.], cksum 0xfe28 (incorrect -> 0x2223), seq 13, ack 531, win 508, options [nop,nop,TS val 268237671 ecr 268237671], length 0
2022-04-05 19:12:35.238830 IP (tos 0x0, ttl 64, id 42710, offset 0, flags [DF], proto TCP (6), length 1500)
    127.0.0.1.10850 > 127.0.0.1.60102: Flags [P.], cksum 0x03d1 (incorrect -> 0xa0d3), seq 13:1461, ack 531, win 512, options [nop,nop,TS val 268237741 ecr 268237671], length 1448
2022-04-05 19:12:35.238838 IP (tos 0x0, ttl 64, id 5332, offset 0, flags [DF], proto TCP (6), length 52)
    127.0.0.1.60102 > 127.0.0.1.10850: Flags [.], cksum 0xfe28 (incorrect -> 0x1bf5), seq 531, ack 1461, win 502, options [nop,nop,TS val 268237741 ecr 268237741], length 0
2022-04-05 19:12:35.256238 IP (tos 0x0, ttl 64, id 42711, offset 0, flags [DF], proto TCP (6), length 1972)
    127.0.0.1.10850 > 127.0.0.1.60102: Flags [P.], cksum 0x05a9 (incorrect -> 0xf35a), seq 1461:3381, ack 531, win 512, options [nop,nop,TS val 268237759 ecr 268237741], length 1920
2022-04-05 19:12:35.256250 IP (tos 0x0, ttl 64, id 5333, offset 0, flags [DF], proto TCP (6), length 52)
    127.0.0.1.60102 > 127.0.0.1.10850: Flags [.], cksum 0xfe28 (incorrect -> 0x1453), seq 531, ack 3381, win 500, options [nop,nop,TS val 268237759 ecr 268237759], length 0
2022-04-05 19:12:35.256950 IP (tos 0x0, ttl 64, id 5334, offset 0, flags [DF], proto TCP (6), length 116)
    127.0.0.1.60102 > 127.0.0.1.10850: Flags [P.], cksum 0xfe68 (incorrect -> 0x2228), seq 531:595, ack 3381, win 512, options [nop,nop,TS val 268237759 ecr 268237759], length 64
2022-04-05 19:12:35.256977 IP (tos 0x0, ttl 64, id 42712, offset 0, flags [DF], proto TCP (6), length 52)
    127.0.0.1.10850 > 127.0.0.1.60102: Flags [.], cksum 0xfe28 (incorrect -> 0x1407), seq 3381, ack 595, win 512, options [nop,nop,TS val 268237759 ecr 268237759], length 0
2022-04-05 19:12:35.257447 IP (tos 0x0, ttl 64, id 5335, offset 0, flags [DF], proto TCP (6), length 383)
    127.0.0.1.60102 > 127.0.0.1.10850: Flags [P.], cksum 0xff73 (incorrect -> 0x64e7), seq 595:926, ack 3381, win 512, options [nop,nop,TS val 268237760 ecr 268237759], length 331
2022-04-05 19:12:35.257476 IP (tos 0x0, ttl 64, id 42713, offset 0, flags [DF], proto TCP (6), length 52)
    127.0.0.1.10850 > 127.0.0.1.60102: Flags [.], cksum 0xfe28 (incorrect -> 0x12bc), seq 3381, ack 926, win 510, options [nop,nop,TS val 268237760 ecr 268237760], length 0
2022-04-05 19:12:35.342188 IP (tos 0x0, ttl 64, id 42714, offset 0, flags [DF], proto TCP (6), length 594)
    127.0.0.1.10850 > 127.0.0.1.60102: Flags [P.], cksum 0x0047 (incorrect -> 0x2025), seq 3381:3923, ack 926, win 512, options [nop,nop,TS val 268237845 ecr 268237760], length 542
2022-04-05 19:12:35.342201 IP (tos 0x0, ttl 64, id 5336, offset 0, flags [DF], proto TCP (6), length 52)
    127.0.0.1.60102 > 127.0.0.1.10850: Flags [.], cksum 0xfe28 (incorrect -> 0x0ff6), seq 926, ack 3923, win 508, options [nop,nop,TS val 268237845 ecr 268237845], length 0
2022-04-05 19:12:35.384950 IP (tos 0x0, ttl 64, id 42715, offset 0, flags [DF], proto TCP (6), length 3345)
    127.0.0.1.10850 > 127.0.0.1.60102: Flags [P.], cksum 0x0b06 (incorrect -> 0x9294), seq 3923:7216, ack 926, win 512, options [nop,nop,TS val 268237887 ecr 268237845], length 3293
2022-04-05 19:12:35.384958 IP (tos 0x0, ttl 64, id 5337, offset 0, flags [DF], proto TCP (6), length 52)
    127.0.0.1.60102 > 127.0.0.1.10850: Flags [.], cksum 0xfe28 (incorrect -> 0x02d2), seq 926, ack 7216, win 495, options [nop,nop,TS val 268237887 ecr 268237887], length 0
2022-04-05 19:12:35.391126 IP (tos 0x0, ttl 64, id 42716, offset 0, flags [DF], proto TCP (6), length 3898)
    127.0.0.1.10850 > 127.0.0.1.60102: Flags [P.], cksum 0x0d2f (incorrect -> 0x62e6), seq 7216:11062, ack 926, win 512, options [nop,nop,TS val 268237894 ecr 268237887], length 3846
2022-04-05 19:12:35.391134 IP (tos 0x0, ttl 64, id 5338, offset 0, flags [DF], proto TCP (6), length 52)
    127.0.0.1.60102 > 127.0.0.1.10850: Flags [.], cksum 0xfe28 (incorrect -> 0xf3c0), seq 926, ack 11062, win 492, options [nop,nop,TS val 268237894 ecr 268237894], length 0
2022-04-05 19:12:35.400283 IP (tos 0x0, ttl 64, id 42717, offset 0, flags [DF], proto TCP (6), length 3944)
    127.0.0.1.10850 > 127.0.0.1.60102: Flags [P.], cksum 0x0d5d (incorrect -> 0xb1e0), seq 11062:14954, ack 926, win 512, options [nop,nop,TS val 268237903 ecr 268237894], length 3892
2022-04-05 19:12:35.400290 IP (tos 0x0, ttl 64, id 5339, offset 0, flags [DF], proto TCP (6), length 52)
    127.0.0.1.60102 > 127.0.0.1.10850: Flags [.], cksum 0xfe28 (incorrect -> 0xe47a), seq 926, ack 14954, win 492, options [nop,nop,TS val 268237903 ecr 268237903], length 0
2022-04-05 19:12:35.400611 IP (tos 0x0, ttl 64, id 42718, offset 0, flags [DF], proto TCP (6), length 1952)
    127.0.0.1.10850 > 127.0.0.1.60102: Flags [P.], cksum 0x0595 (incorrect -> 0xd94c), seq 14954:16854, ack 926, win 512, options [nop,nop,TS val 268237903 ecr 268237903], length 1900
2022-04-05 19:12:35.400618 IP (tos 0x0, ttl 64, id 5340, offset 0, flags [DF], proto TCP (6), length 52)
    127.0.0.1.60102 > 127.0.0.1.10850: Flags [.], cksum 0xfe28 (incorrect -> 0xdd06), seq 926, ack 16854, win 500, options [nop,nop,TS val 268237903 ecr 268237903], length 0
2022-04-05 19:12:35.419147 IP (tos 0x0, ttl 64, id 42719, offset 0, flags [DF], proto TCP (6), length 3446)
    127.0.0.1.10850 > 127.0.0.1.60102: Flags [P.], cksum 0x0b6b (incorrect -> 0x9d39), seq 16854:20248, ack 926, win 512, options [nop,nop,TS val 268237922 ecr 268237903], length 3394
2022-04-05 19:12:35.419164 IP (tos 0x0, ttl 64, id 5341, offset 0, flags [DF], proto TCP (6), length 52)
    127.0.0.1.60102 > 127.0.0.1.10850: Flags [.], cksum 0xfe28 (incorrect -> 0xcfa4), seq 926, ack 20248, win 494, options [nop,nop,TS val 268237922 ecr 268237922], length 0
2022-04-05 19:12:35.419947 IP (tos 0x0, ttl 64, id 42720, offset 0, flags [DF], proto TCP (6), length 4100)
    127.0.0.1.10850 > 127.0.0.1.60102: Flags [P.], cksum 0x0df9 (incorrect -> 0xe05c), seq 20248:24296, ack 926, win 512, options [nop,nop,TS val 268237922 ecr 268237922], length 4048
2022-04-05 19:12:35.419959 IP (tos 0x0, ttl 64, id 5342, offset 0, flags [DF], proto TCP (6), length 52)
    127.0.0.1.60102 > 127.0.0.1.10850: Flags [.], cksum 0xfe28 (incorrect -> 0xbfd6), seq 926, ack 24296, win 492, options [nop,nop,TS val 268237922 ecr 268237922], length 0
2022-04-05 19:12:35.419966 IP (tos 0x0, ttl 64, id 42721, offset 0, flags [DF], proto TCP (6), length 348)
    127.0.0.1.10850 > 127.0.0.1.60102: Flags [P.], cksum 0xff50 (incorrect -> 0x39bf), seq 24296:24592, ack 926, win 512, options [nop,nop,TS val 268237922 ecr 268237922], length 296
2022-04-05 19:12:35.419971 IP (tos 0x0, ttl 64, id 5343, offset 0, flags [DF], proto TCP (6), length 52)
    127.0.0.1.60102 > 127.0.0.1.10850: Flags [.], cksum 0xfe28 (incorrect -> 0xbeaf), seq 926, ack 24592, win 491, options [nop,nop,TS val 268237922 ecr 268237922], length 0
2022-04-05 19:12:35.420002 IP (tos 0x0, ttl 64, id 42722, offset 0, flags [DF], proto TCP (6), length 3446)
    127.0.0.1.10850 > 127.0.0.1.60102: Flags [P.], cksum 0x0b6b (incorrect -> 0x61ef), seq 24592:27986, ack 926, win 512, options [nop,nop,TS val 268237922 ecr 268237922], length 3394
2022-04-05 19:12:35.420496 IP (tos 0x0, ttl 64, id 5344, offset 0, flags [DF], proto TCP (6), length 52)
    127.0.0.1.60102 > 127.0.0.1.10850: Flags [.], cksum 0xfe28 (incorrect -> 0xb157), seq 926, ack 27986, win 512, options [nop,nop,TS val 268237923 ecr 268237922], length 0
2022-04-05 19:12:35.422447 IP (tos 0x0, ttl 64, id 42723, offset 0, flags [DF], proto TCP (6), length 4100)
    127.0.0.1.10850 > 127.0.0.1.60102: Flags [P.], cksum 0x0df9 (incorrect -> 0xe647), seq 27986:32034, ack 926, win 512, options [nop,nop,TS val 268237925 ecr 268237923], length 4048
2022-04-05 19:12:35.449214 IP (tos 0x0, ttl 64, id 42724, offset 0, flags [DF], proto TCP (6), length 32820)
    127.0.0.1.10850 > 127.0.0.1.60102: Flags [.], cksum 0x7e29 (incorrect -> 0x3998), seq 32034:64802, ack 926, win 512, options [nop,nop,TS val 268237952 ecr 268237923], length 32768
2022-04-05 19:12:35.449284 IP (tos 0x0, ttl 64, id 5345, offset 0, flags [DF], proto TCP (6), length 52)
    127.0.0.1.60102 > 127.0.0.1.10850: Flags [.], cksum 0xfe28 (incorrect -> 0x21ec), seq 926, ack 64802, win 379, options [nop,nop,TS val 268237952 ecr 268237925], length 0
2022-04-05 19:12:35.449298 IP (tos 0x0, ttl 64, id 42725, offset 0, flags [DF], proto TCP (6), length 6224)
    127.0.0.1.10850 > 127.0.0.1.60102: Flags [P.], cksum 0x1645 (incorrect -> 0xd3c3), seq 64802:70974, ack 926, win 512, options [nop,nop,TS val 268237952 ecr 268237952], length 6172
2022-04-05 19:12:35.450632 IP (tos 0x0, ttl 64, id 5346, offset 0, flags [DF], proto TCP (6), length 52)
    127.0.0.1.60102 > 127.0.0.1.10850: Flags [.], cksum 0xfe28 (incorrect -> 0x092f), seq 926, ack 70974, win 512, options [nop,nop,TS val 268237953 ecr 268237952], length 0
2022-04-05 19:12:35.450665 IP (tos 0x0, ttl 64, id 42726, offset 0, flags [DF], proto TCP (6), length 19106)
    127.0.0.1.10850 > 127.0.0.1.60102: Flags [P.], cksum 0x4897 (incorrect -> 0x7310), seq 70974:90028, ack 926, win 512, options [nop,nop,TS val 268237953 ecr 268237953], length 19054
2022-04-05 19:12:35.451177 IP (tos 0x0, ttl 64, id 5347, offset 0, flags [DF], proto TCP (6), length 52)
    127.0.0.1.60102 > 127.0.0.1.10850: Flags [.], cksum 0xfe28 (incorrect -> 0xbebe), seq 926, ack 90028, win 512, options [nop,nop,TS val 268237954 ecr 268237953], length 0
2022-04-05 19:12:35.454852 IP (tos 0x0, ttl 64, id 42727, offset 0, flags [DF], proto TCP (6), length 2542)
    127.0.0.1.10850 > 127.0.0.1.60102: Flags [P.], cksum 0x07e3 (incorrect -> 0x31de), seq 90028:92518, ack 926, win 512, options [nop,nop,TS val 268237957 ecr 268237954], length 2490
2022-04-05 19:12:35.454932 IP (tos 0x0, ttl 64, id 5348, offset 0, flags [DF], proto TCP (6), length 52)
    127.0.0.1.60102 > 127.0.0.1.10850: Flags [.], cksum 0xfe28 (incorrect -> 0xb4fd), seq 926, ack 92518, win 512, options [nop,nop,TS val 268237957 ecr 268237957], length 0
2022-04-05 19:12:35.465107 IP (tos 0x0, ttl 64, id 42728, offset 0, flags [DF], proto TCP (6), length 3538)
    127.0.0.1.10850 > 127.0.0.1.60102: Flags [P.], cksum 0x0bc7 (incorrect -> 0xc873), seq 92518:96004, ack 926, win 512, options [nop,nop,TS val 268237968 ecr 268237957], length 3486
2022-04-05 19:12:35.465172 IP (tos 0x0, ttl 64, id 5349, offset 0, flags [DF], proto TCP (6), length 52)
    127.0.0.1.60102 > 127.0.0.1.10850: Flags [.], cksum 0xfe28 (incorrect -> 0xa749), seq 926, ack 96004, win 512, options [nop,nop,TS val 268237968 ecr 268237968], length 0
2022-04-05 19:12:35.466827 IP (tos 0x0, ttl 64, id 42729, offset 0, flags [DF], proto TCP (6), length 4036)
    127.0.0.1.10850 > 127.0.0.1.60102: Flags [P.], cksum 0x0db9 (incorrect -> 0xd485), seq 96004:99988, ack 926, win 512, options [nop,nop,TS val 268237969 ecr 268237968], length 3984
2022-04-05 19:12:35.467262 IP (tos 0x0, ttl 64, id 5350, offset 0, flags [DF], proto TCP (6), length 52)
    127.0.0.1.60102 > 127.0.0.1.10850: Flags [.], cksum 0xfe28 (incorrect -> 0x97b6), seq 926, ack 99988, win 512, options [nop,nop,TS val 268237970 ecr 268237969], length 0
2022-04-05 19:12:35.473380 IP (tos 0x0, ttl 64, id 42730, offset 0, flags [DF], proto TCP (6), length 902)
    127.0.0.1.10850 > 127.0.0.1.60102: Flags [P.], cksum 0x017b (incorrect -> 0xd3cd), seq 99988:100838, ack 926, win 512, options [nop,nop,TS val 268237976 ecr 268237970], length 850
2022-04-05 19:12:35.473445 IP (tos 0x0, ttl 64, id 5351, offset 0, flags [DF], proto TCP (6), length 52)
    127.0.0.1.60102 > 127.0.0.1.10850: Flags [.], cksum 0xfe28 (incorrect -> 0x9457), seq 926, ack 100838, win 512, options [nop,nop,TS val 268237976 ecr 268237976], length 0
2022-04-05 19:12:35.480502 IP (tos 0x0, ttl 64, id 42731, offset 0, flags [DF], proto TCP (6), length 4100)
    127.0.0.1.10850 > 127.0.0.1.60102: Flags [P.], cksum 0x0df9 (incorrect -> 0x2567), seq 100838:104886, ack 926, win 512, options [nop,nop,TS val 268237983 ecr 268237976], length 4048
2022-04-05 19:12:35.480742 IP (tos 0x0, ttl 64, id 5352, offset 0, flags [DF], proto TCP (6), length 52)
    127.0.0.1.60102 > 127.0.0.1.10850: Flags [.], cksum 0xfe28 (incorrect -> 0x8479), seq 926, ack 104886, win 512, options [nop,nop,TS val 268237983 ecr 268237983], length 0
200, 2.8484368324279785, 0.8038144111633301