2022-04-05 04:47:41.633710 IP (tos 0x0, ttl 64, id 34500, offset 0, flags [DF], proto TCP (6), length 60)
    127.0.0.1.36948 > 127.0.0.1.9450: Flags [S], cksum 0xfe30 (incorrect -> 0x46f2), seq 2731685482, win 65495, options [mss 65495,sackOK,TS val 771706005 ecr 0,nop,wscale 7], length 0
2022-04-05 04:47:41.633721 IP (tos 0x0, ttl 64, id 0, offset 0, flags [DF], proto TCP (6), length 60)
    127.0.0.1.9450 > 127.0.0.1.36948: Flags [S.], cksum 0xfe30 (incorrect -> 0xcf90), seq 2181593791, ack 2731685483, win 65483, options [mss 65495,sackOK,TS val 771706005 ecr 771706005,nop,wscale 7], length 0
2022-04-05 04:47:41.633729 IP (tos 0x0, ttl 64, id 34501, offset 0, flags [DF], proto TCP (6), length 52)
    127.0.0.1.36948 > 127.0.0.1.9450: Flags [.], cksum 0xfe28 (incorrect -> 0xf64c), seq 1, ack 1, win 512, options [nop,nop,TS val 771706005 ecr 771706005], length 0
2022-04-05 04:47:41.633829 IP (tos 0x0, ttl 64, id 34502, offset 0, flags [DF], proto TCP (6), length 55)
    127.0.0.1.36948 > 127.0.0.1.9450: Flags [P.], cksum 0xfe2b (incorrect -> 0xf140), seq 1:4, ack 1, win 512, options [nop,nop,TS val 771706005 ecr 771706005], length 3
2022-04-05 04:47:41.633840 IP (tos 0x0, ttl 64, id 6180, offset 0, flags [DF], proto TCP (6), length 52)
    127.0.0.1.9450 > 127.0.0.1.36948: Flags [.], cksum 0xfe28 (incorrect -> 0xf649), seq 1, ack 4, win 512, options [nop,nop,TS val 771706005 ecr 771706005], length 0
2022-04-05 04:47:41.633898 IP (tos 0x0, ttl 64, id 6181, offset 0, flags [DF], proto TCP (6), length 54)
    127.0.0.1.9450 > 127.0.0.1.36948: Flags [P.], cksum 0xfe2a (incorrect -> 0xf13f), seq 1:3, ack 4, win 512, options [nop,nop,TS val 771706005 ecr 771706005], length 2
2022-04-05 04:47:41.633916 IP (tos 0x0, ttl 64, id 34503, offset 0, flags [DF], proto TCP (6), length 52)
    127.0.0.1.36948 > 127.0.0.1.9450: Flags [.], cksum 0xfe28 (incorrect -> 0xf647), seq 4, ack 3, win 512, options [nop,nop,TS val 771706005 ecr 771706005], length 0
2022-04-05 04:47:41.646051 IP (tos 0x0, ttl 64, id 34504, offset 0, flags [DF], proto TCP (6), length 62)
    127.0.0.1.36948 > 127.0.0.1.9450: Flags [P.], cksum 0xfe32 (incorrect -> 0xe81d), seq 4:14, ack 3, win 512, options [nop,nop,TS val 771706017 ecr 771706005], length 10
2022-04-05 04:47:41.646065 IP (tos 0x0, ttl 64, id 6182, offset 0, flags [DF], proto TCP (6), length 52)
    127.0.0.1.9450 > 127.0.0.1.36948: Flags [.], cksum 0xfe28 (incorrect -> 0xf625), seq 3, ack 14, win 512, options [nop,nop,TS val 771706017 ecr 771706017], length 0
2022-04-05 04:47:41.905109 IP (tos 0x0, ttl 64, id 6183, offset 0, flags [DF], proto TCP (6), length 62)
    127.0.0.1.9450 > 127.0.0.1.36948: Flags [P.], cksum 0xfe32 (incorrect -> 0xf00f), seq 3:13, ack 14, win 512, options [nop,nop,TS val 771706276 ecr 771706017], length 10
2022-04-05 04:47:41.905123 IP (tos 0x0, ttl 64, id 34505, offset 0, flags [DF], proto TCP (6), length 52)
    127.0.0.1.36948 > 127.0.0.1.9450: Flags [.], cksum 0xfe28 (incorrect -> 0xf415), seq 14, ack 13, win 512, options [nop,nop,TS val 771706276 ecr 771706276], length 0
2022-04-05 04:47:41.910782 IP (tos 0x0, ttl 64, id 34506, offset 0, flags [DF], proto TCP (6), length 569)
    127.0.0.1.36948 > 127.0.0.1.9450: Flags [P.], cksum 0x002e (incorrect -> 0x29b9), seq 14:531, ack 13, win 512, options [nop,nop,TS val 771706282 ecr 771706276], length 517
2022-04-05 04:47:41.910796 IP (tos 0x0, ttl 64, id 6184, offset 0, flags [DF], proto TCP (6), length 52)
    127.0.0.1.9450 > 127.0.0.1.36948: Flags [.], cksum 0xfe28 (incorrect -> 0xf208), seq 13, ack 531, win 508, options [nop,nop,TS val 771706282 ecr 771706282], length 0
2022-04-05 04:47:42.189474 IP (tos 0x0, ttl 64, id 6185, offset 0, flags [DF], proto TCP (6), length 2972)
    127.0.0.1.9450 > 127.0.0.1.36948: Flags [P.], cksum 0x0991 (incorrect -> 0x66ea), seq 13:2933, ack 531, win 512, options [nop,nop,TS val 771706561 ecr 771706282], length 2920
2022-04-05 04:47:42.189490 IP (tos 0x0, ttl 64, id 34507, offset 0, flags [DF], proto TCP (6), length 52)
    127.0.0.1.36948 > 127.0.0.1.9450: Flags [.], cksum 0xfe28 (incorrect -> 0xe47e), seq 531, ack 2933, win 496, options [nop,nop,TS val 771706561 ecr 771706561], length 0
2022-04-05 04:47:42.335462 IP (tos 0x0, ttl 64, id 6186, offset 0, flags [DF], proto TCP (6), length 716)
    127.0.0.1.9450 > 127.0.0.1.36948: Flags [P.], cksum 0x00c1 (incorrect -> 0x7753), seq 2933:3597, ack 531, win 512, options [nop,nop,TS val 771706707 ecr 771706561], length 664
2022-04-05 04:47:42.335493 IP (tos 0x0, ttl 64, id 34508, offset 0, flags [DF], proto TCP (6), length 52)
    127.0.0.1.36948 > 127.0.0.1.9450: Flags [.], cksum 0xfe28 (incorrect -> 0xe0b9), seq 531, ack 3597, win 505, options [nop,nop,TS val 771706707 ecr 771706707], length 0
2022-04-05 04:47:42.335968 IP (tos 0x0, ttl 64, id 34509, offset 0, flags [DF], proto TCP (6), length 132)
    127.0.0.1.36948 > 127.0.0.1.9450: Flags [P.], cksum 0xfe78 (incorrect -> 0xa675), seq 531:611, ack 3597, win 512, options [nop,nop,TS val 771706707 ecr 771706707], length 80
2022-04-05 04:47:42.335983 IP (tos 0x0, ttl 64, id 6187, offset 0, flags [DF], proto TCP (6), length 52)
    127.0.0.1.9450 > 127.0.0.1.36948: Flags [.], cksum 0xfe28 (incorrect -> 0xe062), seq 3597, ack 611, win 512, options [nop,nop,TS val 771706707 ecr 771706707], length 0
2022-04-05 04:47:42.336383 IP (tos 0x0, ttl 64, id 34510, offset 0, flags [DF], proto TCP (6), length 368)
    127.0.0.1.36948 > 127.0.0.1.9450: Flags [P.], cksum 0xff64 (incorrect -> 0xce9a), seq 611:927, ack 3597, win 512, options [nop,nop,TS val 771706707 ecr 771706707], length 316
2022-04-05 04:47:42.336394 IP (tos 0x0, ttl 64, id 6188, offset 0, flags [DF], proto TCP (6), length 52)
    127.0.0.1.9450 > 127.0.0.1.36948: Flags [.], cksum 0xfe28 (incorrect -> 0xdf28), seq 3597, ack 927, win 510, options [nop,nop,TS val 771706707 ecr 771706707], length 0
2022-04-05 04:47:42.591589 IP (tos 0x0, ttl 64, id 6189, offset 0, flags [DF], proto TCP (6), length 658)
    127.0.0.1.9450 > 127.0.0.1.36948: Flags [P.], cksum 0x0087 (incorrect -> 0x3dd5), seq 3597:4203, ack 927, win 512, options [nop,nop,TS val 771706963 ecr 771706707], length 606
2022-04-05 04:47:42.591627 IP (tos 0x0, ttl 64, id 34511, offset 0, flags [DF], proto TCP (6), length 52)
    127.0.0.1.36948 > 127.0.0.1.9450: Flags [.], cksum 0xfe28 (incorrect -> 0xdacc), seq 927, ack 4203, win 508, options [nop,nop,TS val 771706963 ecr 771706963], length 0
2022-04-05 04:47:42.749611 IP (tos 0x0, ttl 64, id 6190, offset 0, flags [DF], proto TCP (6), length 3470)
    127.0.0.1.9450 > 127.0.0.1.36948: Flags [P.], cksum 0x0b83 (incorrect -> 0xdaeb), seq 4203:7621, ack 927, win 512, options [nop,nop,TS val 771707121 ecr 771706963], length 3418
2022-04-05 04:47:42.749640 IP (tos 0x0, ttl 64, id 34512, offset 0, flags [DF], proto TCP (6), length 52)
    127.0.0.1.36948 > 127.0.0.1.9450: Flags [.], cksum 0xfe28 (incorrect -> 0xcc44), seq 927, ack 7621, win 494, options [nop,nop,TS val 771707121 ecr 771707121], length 0
2022-04-05 04:47:42.755307 IP (tos 0x0, ttl 64, id 6191, offset 0, flags [DF], proto TCP (6), length 356)
    127.0.0.1.9450 > 127.0.0.1.36948: Flags [P.], cksum 0xff58 (incorrect -> 0x2cb6), seq 7621:7925, ack 927, win 512, options [nop,nop,TS val 771707126 ecr 771707121], length 304
2022-04-05 04:47:42.755313 IP (tos 0x0, ttl 64, id 34513, offset 0, flags [DF], proto TCP (6), length 52)
    127.0.0.1.36948 > 127.0.0.1.9450: Flags [.], cksum 0xfe28 (incorrect -> 0xcafe), seq 927, ack 7925, win 506, options [nop,nop,TS val 771707126 ecr 771707126], length 0
2022-04-05 04:47:42.761871 IP (tos 0x0, ttl 64, id 6192, offset 0, flags [DF], proto TCP (6), length 1512)
    127.0.0.1.9450 > 127.0.0.1.36948: Flags [P.], cksum 0x03dd (incorrect -> 0x7d6a), seq 7925:9385, ack 927, win 512, options [nop,nop,TS val 771707133 ecr 771707126], length 1460
2022-04-05 04:47:42.761888 IP (tos 0x0, ttl 64, id 34514, offset 0, flags [DF], proto TCP (6), length 52)
    127.0.0.1.36948 > 127.0.0.1.9450: Flags [.], cksum 0xfe28 (incorrect -> 0xc540), seq 927, ack 9385, win 502, options [nop,nop,TS val 771707133 ecr 771707133], length 0
2022-04-05 04:47:42.769247 IP (tos 0x0, ttl 64, id 6193, offset 0, flags [DF], proto TCP (6), length 1049)
    127.0.0.1.9450 > 127.0.0.1.36948: Flags [P.], cksum 0x020e (incorrect -> 0x8269), seq 9385:10382, ack 927, win 512, options [nop,nop,TS val 771707140 ecr 771707133], length 997
2022-04-05 04:47:42.769253 IP (tos 0x0, ttl 64, id 34515, offset 0, flags [DF], proto TCP (6), length 52)
    127.0.0.1.36948 > 127.0.0.1.9450: Flags [.], cksum 0xfe28 (incorrect -> 0xc14b), seq 927, ack 10382, win 504, options [nop,nop,TS val 771707140 ecr 771707140], length 0
2022-04-05 04:47:42.779478 IP (tos 0x0, ttl 64, id 6194, offset 0, flags [DF], proto TCP (6), length 2855)
    127.0.0.1.9450 > 127.0.0.1.36948: Flags [P.], cksum 0x091c (incorrect -> 0x3f09), seq 10382:13185, ack 927, win 512, options [nop,nop,TS val 771707151 ecr 771707140], length 2803
2022-04-05 04:47:42.779484 IP (tos 0x0, ttl 64, id 34516, offset 0, flags [DF], proto TCP (6), length 52)
    127.0.0.1.36948 > 127.0.0.1.9450: Flags [.], cksum 0xfe28 (incorrect -> 0xb649), seq 927, ack 13185, win 497, options [nop,nop,TS val 771707151 ecr 771707151], length 0
200, 123.69551372528076, 1.2454628944396973