2022-04-05 06:36:47.314180 IP (tos 0x0, ttl 64, id 42033, offset 0, flags [DF], proto TCP (6), length 60)
    127.0.0.1.58794 > 127.0.0.1.10050: Flags [S], cksum 0xfe30 (incorrect -> 0x8155), seq 2522992469, win 65495, options [mss 65495,sackOK,TS val 778251685 ecr 0,nop,wscale 7], length 0
2022-04-05 06:36:47.314192 IP (tos 0x0, ttl 64, id 0, offset 0, flags [DF], proto TCP (6), length 60)
    127.0.0.1.10050 > 127.0.0.1.58794: Flags [S.], cksum 0xfe30 (incorrect -> 0xbe8a), seq 2602421151, ack 2522992470, win 65483, options [mss 65495,sackOK,TS val 778251685 ecr 778251685,nop,wscale 7], length 0
2022-04-05 06:36:47.314203 IP (tos 0x0, ttl 64, id 42034, offset 0, flags [DF], proto TCP (6), length 52)
    127.0.0.1.58794 > 127.0.0.1.10050: Flags [.], cksum 0xfe28 (incorrect -> 0xe546), seq 1, ack 1, win 512, options [nop,nop,TS val 778251685 ecr 778251685], length 0
2022-04-05 06:36:47.314335 IP (tos 0x0, ttl 64, id 42035, offset 0, flags [DF], proto TCP (6), length 55)
    127.0.0.1.58794 > 127.0.0.1.10050: Flags [P.], cksum 0xfe2b (incorrect -> 0xe03a), seq 1:4, ack 1, win 512, options [nop,nop,TS val 778251685 ecr 778251685], length 3
2022-04-05 06:36:47.314345 IP (tos 0x0, ttl 64, id 29455, offset 0, flags [DF], proto TCP (6), length 52)
    127.0.0.1.10050 > 127.0.0.1.58794: Flags [.], cksum 0xfe28 (incorrect -> 0xe543), seq 1, ack 4, win 512, options [nop,nop,TS val 778251685 ecr 778251685], length 0
2022-04-05 06:36:47.314374 IP (tos 0x0, ttl 64, id 29456, offset 0, flags [DF], proto TCP (6), length 54)
    127.0.0.1.10050 > 127.0.0.1.58794: Flags [P.], cksum 0xfe2a (incorrect -> 0xe039), seq 1:3, ack 4, win 512, options [nop,nop,TS val 778251685 ecr 778251685], length 2
2022-04-05 06:36:47.314383 IP (tos 0x0, ttl 64, id 42036, offset 0, flags [DF], proto TCP (6), length 52)
    127.0.0.1.58794 > 127.0.0.1.10050: Flags [.], cksum 0xfe28 (incorrect -> 0xe541), seq 4, ack 3, win 512, options [nop,nop,TS val 778251685 ecr 778251685], length 0
2022-04-05 06:36:47.315834 IP (tos 0x0, ttl 64, id 42037, offset 0, flags [DF], proto TCP (6), length 62)
    127.0.0.1.58794 > 127.0.0.1.10050: Flags [P.], cksum 0xfe32 (incorrect -> 0x9987), seq 4:14, ack 3, win 512, options [nop,nop,TS val 778251687 ecr 778251685], length 10
2022-04-05 06:36:47.315848 IP (tos 0x0, ttl 64, id 29457, offset 0, flags [DF], proto TCP (6), length 52)
    127.0.0.1.10050 > 127.0.0.1.58794: Flags [.], cksum 0xfe28 (incorrect -> 0xe533), seq 3, ack 14, win 512, options [nop,nop,TS val 778251687 ecr 778251687], length 0
2022-04-05 06:36:47.358927 IP (tos 0x0, ttl 64, id 29458, offset 0, flags [DF], proto TCP (6), length 62)
    127.0.0.1.10050 > 127.0.0.1.58794: Flags [P.], cksum 0xfe32 (incorrect -> 0xdff5), seq 3:13, ack 14, win 512, options [nop,nop,TS val 778251730 ecr 778251687], length 10
2022-04-05 06:36:47.358938 IP (tos 0x0, ttl 64, id 42038, offset 0, flags [DF], proto TCP (6), length 52)
    127.0.0.1.58794 > 127.0.0.1.10050: Flags [.], cksum 0xfe28 (incorrect -> 0xe4d3), seq 14, ack 13, win 512, options [nop,nop,TS val 778251730 ecr 778251730], length 0
2022-04-05 06:36:47.364496 IP (tos 0x0, ttl 64, id 42039, offset 0, flags [DF], proto TCP (6), length 569)
    127.0.0.1.58794 > 127.0.0.1.10050: Flags [P.], cksum 0x002e (incorrect -> 0x22f9), seq 14:531, ack 13, win 512, options [nop,nop,TS val 778251736 ecr 778251730], length 517
2022-04-05 06:36:47.364507 IP (tos 0x0, ttl 64, id 29459, offset 0, flags [DF], proto TCP (6), length 52)
    127.0.0.1.10050 > 127.0.0.1.58794: Flags [.], cksum 0xfe28 (incorrect -> 0xe2c6), seq 13, ack 531, win 508, options [nop,nop,TS val 778251736 ecr 778251736], length 0
2022-04-05 06:36:47.445072 IP (tos 0x0, ttl 64, id 29460, offset 0, flags [DF], proto TCP (6), length 3538)
    127.0.0.1.10050 > 127.0.0.1.58794: Flags [P.], cksum 0x0bc7 (incorrect -> 0x868e), seq 13:3499, ack 531, win 512, options [nop,nop,TS val 778251816 ecr 778251736], length 3486
2022-04-05 06:36:47.445084 IP (tos 0x0, ttl 64, id 42040, offset 0, flags [DF], proto TCP (6), length 52)
    127.0.0.1.58794 > 127.0.0.1.10050: Flags [.], cksum 0xfe28 (incorrect -> 0xd496), seq 531, ack 3499, win 494, options [nop,nop,TS val 778251816 ecr 778251816], length 0
2022-04-05 06:36:47.468006 IP (tos 0x0, ttl 64, id 29461, offset 0, flags [DF], proto TCP (6), length 3243)
    127.0.0.1.10050 > 127.0.0.1.58794: Flags [P.], cksum 0x0aa0 (incorrect -> 0x0372), seq 3499:6690, ack 531, win 512, options [nop,nop,TS val 778251839 ecr 778251816], length 3191
2022-04-05 06:36:47.468014 IP (tos 0x0, ttl 64, id 42041, offset 0, flags [DF], proto TCP (6), length 52)
    127.0.0.1.58794 > 127.0.0.1.10050: Flags [.], cksum 0xfe28 (incorrect -> 0xc7f0), seq 531, ack 6690, win 495, options [nop,nop,TS val 778251839 ecr 778251839], length 0
2022-04-05 06:36:47.468628 IP (tos 0x0, ttl 64, id 42042, offset 0, flags [DF], proto TCP (6), length 132)
    127.0.0.1.58794 > 127.0.0.1.10050: Flags [P.], cksum 0xfe78 (incorrect -> 0x41c5), seq 531:611, ack 6690, win 512, options [nop,nop,TS val 778251840 ecr 778251839], length 80
2022-04-05 06:36:47.468637 IP (tos 0x0, ttl 64, id 29462, offset 0, flags [DF], proto TCP (6), length 52)
    127.0.0.1.10050 > 127.0.0.1.58794: Flags [.], cksum 0xfe28 (incorrect -> 0xc78d), seq 6690, ack 611, win 512, options [nop,nop,TS val 778251840 ecr 778251840], length 0
2022-04-05 06:36:47.469160 IP (tos 0x0, ttl 64, id 42043, offset 0, flags [DF], proto TCP (6), length 383)
    127.0.0.1.58794 > 127.0.0.1.10050: Flags [P.], cksum 0xff73 (incorrect -> 0x5263), seq 611:942, ack 6690, win 512, options [nop,nop,TS val 778251840 ecr 778251840], length 331
2022-04-05 06:36:47.469170 IP (tos 0x0, ttl 64, id 29463, offset 0, flags [DF], proto TCP (6), length 52)
    127.0.0.1.10050 > 127.0.0.1.58794: Flags [.], cksum 0xfe28 (incorrect -> 0xc644), seq 6690, ack 942, win 510, options [nop,nop,TS val 778251840 ecr 778251840], length 0
200, 4.798267841339111, 0.4453420639038086