2022-04-05 08:05:16.818472 IP (tos 0x0, ttl 64, id 8887, offset 0, flags [DF], proto TCP (6), length 60)
    127.0.0.1.40912 > 127.0.0.1.9650: Flags [S], cksum 0xfe30 (incorrect -> 0x1708), seq 3931777154, win 65495, options [mss 65495,sackOK,TS val 783561190 ecr 0,nop,wscale 7], length 0
2022-04-05 08:05:16.818487 IP (tos 0x0, ttl 64, id 0, offset 0, flags [DF], proto TCP (6), length 60)
    127.0.0.1.9650 > 127.0.0.1.40912: Flags [S.], cksum 0xfe30 (incorrect -> 0x8656), seq 3488112681, ack 3931777155, win 65483, options [mss 65495,sackOK,TS val 783561190 ecr 783561190,nop,wscale 7], length 0
2022-04-05 08:05:16.818498 IP (tos 0x0, ttl 64, id 8888, offset 0, flags [DF], proto TCP (6), length 52)
    127.0.0.1.40912 > 127.0.0.1.9650: Flags [.], cksum 0xfe28 (incorrect -> 0xad12), seq 1, ack 1, win 512, options [nop,nop,TS val 783561190 ecr 783561190], length 0
2022-04-05 08:05:16.818627 IP (tos 0x0, ttl 64, id 8889, offset 0, flags [DF], proto TCP (6), length 55)
    127.0.0.1.40912 > 127.0.0.1.9650: Flags [P.], cksum 0xfe2b (incorrect -> 0xa806), seq 1:4, ack 1, win 512, options [nop,nop,TS val 783561190 ecr 783561190], length 3
2022-04-05 08:05:16.818643 IP (tos 0x0, ttl 64, id 41331, offset 0, flags [DF], proto TCP (6), length 52)
    127.0.0.1.9650 > 127.0.0.1.40912: Flags [.], cksum 0xfe28 (incorrect -> 0xad0f), seq 1, ack 4, win 512, options [nop,nop,TS val 783561190 ecr 783561190], length 0
2022-04-05 08:05:16.818703 IP (tos 0x0, ttl 64, id 41332, offset 0, flags [DF], proto TCP (6), length 54)
    127.0.0.1.9650 > 127.0.0.1.40912: Flags [P.], cksum 0xfe2a (incorrect -> 0xa805), seq 1:3, ack 4, win 512, options [nop,nop,TS val 783561190 ecr 783561190], length 2
2022-04-05 08:05:16.818727 IP (tos 0x0, ttl 64, id 8890, offset 0, flags [DF], proto TCP (6), length 52)
    127.0.0.1.40912 > 127.0.0.1.9650: Flags [.], cksum 0xfe28 (incorrect -> 0xad0d), seq 4, ack 3, win 512, options [nop,nop,TS val 783561190 ecr 783561190], length 0
2022-04-05 08:05:16.870264 IP (tos 0x0, ttl 64, id 8891, offset 0, flags [DF], proto TCP (6), length 62)
    127.0.0.1.40912 > 127.0.0.1.9650: Flags [P.], cksum 0xfe32 (incorrect -> 0x31e9), seq 4:14, ack 3, win 512, options [nop,nop,TS val 783561241 ecr 783561190], length 10
2022-04-05 08:05:16.870284 IP (tos 0x0, ttl 64, id 41333, offset 0, flags [DF], proto TCP (6), length 52)
    127.0.0.1.9650 > 127.0.0.1.40912: Flags [.], cksum 0xfe28 (incorrect -> 0xac9d), seq 3, ack 14, win 512, options [nop,nop,TS val 783561241 ecr 783561241], length 0
2022-04-05 08:05:16.939403 IP (tos 0x0, ttl 64, id 41334, offset 0, flags [DF], proto TCP (6), length 62)
    127.0.0.1.9650 > 127.0.0.1.40912: Flags [P.], cksum 0xfe32 (incorrect -> 0xa745), seq 3:13, ack 14, win 512, options [nop,nop,TS val 783561310 ecr 783561241], length 10
2022-04-05 08:05:16.939428 IP (tos 0x0, ttl 64, id 8892, offset 0, flags [DF], proto TCP (6), length 52)
    127.0.0.1.40912 > 127.0.0.1.9650: Flags [.], cksum 0xfe28 (incorrect -> 0xac08), seq 14, ack 13, win 512, options [nop,nop,TS val 783561311 ecr 783561310], length 0
2022-04-05 08:05:16.945457 IP (tos 0x0, ttl 64, id 8893, offset 0, flags [DF], proto TCP (6), length 569)
    127.0.0.1.40912 > 127.0.0.1.9650: Flags [P.], cksum 0x002e (incorrect -> 0xefce), seq 14:531, ack 13, win 512, options [nop,nop,TS val 783561317 ecr 783561310], length 517
2022-04-05 08:05:16.945467 IP (tos 0x0, ttl 64, id 41335, offset 0, flags [DF], proto TCP (6), length 52)
    127.0.0.1.9650 > 127.0.0.1.40912: Flags [.], cksum 0xfe28 (incorrect -> 0xa9fa), seq 13, ack 531, win 508, options [nop,nop,TS val 783561317 ecr 783561317], length 0
200, 6.828481912612915, 1.0476617813110352