2022-04-05 02:07:25.614247 IP (tos 0x0, ttl 64, id 693, offset 0, flags [DF], proto TCP (6), length 60)
    127.0.0.1.47180 > 127.0.0.1.10850: Flags [S], cksum 0xfe30 (incorrect -> 0x7abd), seq 3029499541, win 65495, options [mss 65495,sackOK,TS val 762089985 ecr 0,nop,wscale 7], length 0
2022-04-05 02:07:25.614260 IP (tos 0x0, ttl 64, id 0, offset 0, flags [DF], proto TCP (6), length 60)
    127.0.0.1.10850 > 127.0.0.1.47180: Flags [S.], cksum 0xfe30 (incorrect -> 0x4f42), seq 421417706, ack 3029499542, win 65483, options [mss 65495,sackOK,TS val 762089985 ecr 762089985,nop,wscale 7], length 0
2022-04-05 02:07:25.614270 IP (tos 0x0, ttl 64, id 694, offset 0, flags [DF], proto TCP (6), length 52)
    127.0.0.1.47180 > 127.0.0.1.10850: Flags [.], cksum 0xfe28 (incorrect -> 0x75fe), seq 1, ack 1, win 512, options [nop,nop,TS val 762089985 ecr 762089985], length 0
2022-04-05 02:07:25.614382 IP (tos 0x0, ttl 64, id 695, offset 0, flags [DF], proto TCP (6), length 55)
    127.0.0.1.47180 > 127.0.0.1.10850: Flags [P.], cksum 0xfe2b (incorrect -> 0x70f2), seq 1:4, ack 1, win 512, options [nop,nop,TS val 762089985 ecr 762089985], length 3
2022-04-05 02:07:25.614396 IP (tos 0x0, ttl 64, id 14647, offset 0, flags [DF], proto TCP (6), length 52)
    127.0.0.1.10850 > 127.0.0.1.47180: Flags [.], cksum 0xfe28 (incorrect -> 0x75fb), seq 1, ack 4, win 512, options [nop,nop,TS val 762089985 ecr 762089985], length 0
2022-04-05 02:07:25.614440 IP (tos 0x0, ttl 64, id 14648, offset 0, flags [DF], proto TCP (6), length 54)
    127.0.0.1.10850 > 127.0.0.1.47180: Flags [P.], cksum 0xfe2a (incorrect -> 0x70f0), seq 1:3, ack 4, win 512, options [nop,nop,TS val 762089986 ecr 762089985], length 2
2022-04-05 02:07:25.614454 IP (tos 0x0, ttl 64, id 696, offset 0, flags [DF], proto TCP (6), length 52)
    127.0.0.1.47180 > 127.0.0.1.10850: Flags [.], cksum 0xfe28 (incorrect -> 0x75f7), seq 4, ack 3, win 512, options [nop,nop,TS val 762089986 ecr 762089986], length 0
2022-04-05 02:07:25.616082 IP (tos 0x0, ttl 64, id 697, offset 0, flags [DF], proto TCP (6), length 62)
    127.0.0.1.47180 > 127.0.0.1.10850: Flags [P.], cksum 0xfe32 (incorrect -> 0x0baa), seq 4:14, ack 3, win 512, options [nop,nop,TS val 762089987 ecr 762089986], length 10
2022-04-05 02:07:25.616092 IP (tos 0x0, ttl 64, id 14649, offset 0, flags [DF], proto TCP (6), length 52)
    127.0.0.1.10850 > 127.0.0.1.47180: Flags [.], cksum 0xfe28 (incorrect -> 0x75eb), seq 3, ack 14, win 512, options [nop,nop,TS val 762089987 ecr 762089987], length 0
2022-04-05 02:07:25.655144 IP (tos 0x0, ttl 64, id 14650, offset 0, flags [DF], proto TCP (6), length 62)
    127.0.0.1.10850 > 127.0.0.1.47180: Flags [P.], cksum 0xfe32 (incorrect -> 0x70b1), seq 3:13, ack 14, win 512, options [nop,nop,TS val 762090026 ecr 762089987], length 10
2022-04-05 02:07:25.655154 IP (tos 0x0, ttl 64, id 698, offset 0, flags [DF], proto TCP (6), length 52)
    127.0.0.1.47180 > 127.0.0.1.10850: Flags [.], cksum 0xfe28 (incorrect -> 0x7593), seq 14, ack 13, win 512, options [nop,nop,TS val 762090026 ecr 762090026], length 0
2022-04-05 02:07:25.660945 IP (tos 0x0, ttl 64, id 699, offset 0, flags [DF], proto TCP (6), length 569)
    127.0.0.1.47180 > 127.0.0.1.10850: Flags [P.], cksum 0x002e (incorrect -> 0xb759), seq 14:531, ack 13, win 512, options [nop,nop,TS val 762090032 ecr 762090026], length 517
2022-04-05 02:07:25.660957 IP (tos 0x0, ttl 64, id 14651, offset 0, flags [DF], proto TCP (6), length 52)
    127.0.0.1.10850 > 127.0.0.1.47180: Flags [.], cksum 0xfe28 (incorrect -> 0x7386), seq 13, ack 531, win 508, options [nop,nop,TS val 762090032 ecr 762090032], length 0
2022-04-05 02:07:25.707123 IP (tos 0x0, ttl 64, id 14652, offset 0, flags [DF], proto TCP (6), length 3538)
    127.0.0.1.10850 > 127.0.0.1.47180: Flags [P.], cksum 0x0bc7 (incorrect -> 0x62e4), seq 13:3499, ack 531, win 512, options [nop,nop,TS val 762090078 ecr 762090032], length 3486
2022-04-05 02:07:25.707133 IP (tos 0x0, ttl 64, id 700, offset 0, flags [DF], proto TCP (6), length 52)
    127.0.0.1.47180 > 127.0.0.1.10850: Flags [.], cksum 0xfe28 (incorrect -> 0x659a), seq 531, ack 3499, win 494, options [nop,nop,TS val 762090078 ecr 762090078], length 0
2022-04-05 02:07:25.720955 IP (tos 0x0, ttl 64, id 14653, offset 0, flags [DF], proto TCP (6), length 1012)
    127.0.0.1.10850 > 127.0.0.1.47180: Flags [P.], cksum 0x01e9 (incorrect -> 0x8b05), seq 3499:4459, ack 531, win 512, options [nop,nop,TS val 762090092 ecr 762090078], length 960
2022-04-05 02:07:25.720962 IP (tos 0x0, ttl 64, id 701, offset 0, flags [DF], proto TCP (6), length 52)
    127.0.0.1.47180 > 127.0.0.1.10850: Flags [.], cksum 0xfe28 (incorrect -> 0x61b4), seq 531, ack 4459, win 504, options [nop,nop,TS val 762090092 ecr 762090092], length 0
2022-04-05 02:07:25.723398 IP (tos 0x0, ttl 64, id 702, offset 0, flags [DF], proto TCP (6), length 145)
    127.0.0.1.47180 > 127.0.0.1.10850: Flags [P.], cksum 0xfe85 (incorrect -> 0x17ba), seq 531:624, ack 4459, win 512, options [nop,nop,TS val 762090094 ecr 762090092], length 93
2022-04-05 02:07:25.723415 IP (tos 0x0, ttl 64, id 14654, offset 0, flags [DF], proto TCP (6), length 52)
    127.0.0.1.10850 > 127.0.0.1.47180: Flags [.], cksum 0xfe28 (incorrect -> 0x614a), seq 4459, ack 624, win 512, options [nop,nop,TS val 762090095 ecr 762090094], length 0
2022-04-05 02:07:25.783423 IP (tos 0x0, ttl 64, id 14655, offset 0, flags [DF], proto TCP (6), length 103)
    127.0.0.1.10850 > 127.0.0.1.47180: Flags [P.], cksum 0xfe5b (incorrect -> 0xe69e), seq 4459:4510, ack 624, win 512, options [nop,nop,TS val 762090155 ecr 762090094], length 51
2022-04-05 02:07:25.783435 IP (tos 0x0, ttl 64, id 703, offset 0, flags [DF], proto TCP (6), length 52)
    127.0.0.1.47180 > 127.0.0.1.10850: Flags [.], cksum 0xfe28 (incorrect -> 0x609e), seq 624, ack 4510, win 512, options [nop,nop,TS val 762090155 ecr 762090155], length 0
2022-04-05 02:07:25.783951 IP (tos 0x0, ttl 64, id 704, offset 0, flags [DF], proto TCP (6), length 352)
    127.0.0.1.47180 > 127.0.0.1.10850: Flags [P.], cksum 0xff54 (incorrect -> 0xcb41), seq 624:924, ack 4510, win 512, options [nop,nop,TS val 762090155 ecr 762090155], length 300
2022-04-05 02:07:25.784083 IP (tos 0x0, ttl 64, id 14656, offset 0, flags [DF], proto TCP (6), length 52)
    127.0.0.1.10850 > 127.0.0.1.47180: Flags [.], cksum 0xfe28 (incorrect -> 0x5f74), seq 4510, ack 924, win 510, options [nop,nop,TS val 762090155 ecr 762090155], length 0
200, 4.76156210899353, 0.6162424087524414