2022-04-05 22:21:40.970401 IP (tos 0x0, ttl 64, id 54698, offset 0, flags [DF], proto TCP (6), length 60)
    127.0.0.1.33156 > 127.0.0.1.12250: Flags [S], cksum 0xfe30 (incorrect -> 0x459b), seq 2045031304, win 65495, options [mss 65495,sackOK,TS val 279583473 ecr 0,nop,wscale 7], length 0
2022-04-05 22:21:40.970415 IP (tos 0x0, ttl 64, id 0, offset 0, flags [DF], proto TCP (6), length 60)
    127.0.0.1.12250 > 127.0.0.1.33156: Flags [S.], cksum 0xfe30 (incorrect -> 0x0089), seq 1036442539, ack 2045031305, win 65483, options [mss 65495,sackOK,TS val 279583473 ecr 279583473,nop,wscale 7], length 0
2022-04-05 22:21:40.970426 IP (tos 0x0, ttl 64, id 54699, offset 0, flags [DF], proto TCP (6), length 52)
    127.0.0.1.33156 > 127.0.0.1.12250: Flags [.], cksum 0xfe28 (incorrect -> 0x2745), seq 1, ack 1, win 512, options [nop,nop,TS val 279583473 ecr 279583473], length 0
2022-04-05 22:21:40.970534 IP (tos 0x0, ttl 64, id 54700, offset 0, flags [DF], proto TCP (6), length 55)
    127.0.0.1.33156 > 127.0.0.1.12250: Flags [P.], cksum 0xfe2b (incorrect -> 0x2239), seq 1:4, ack 1, win 512, options [nop,nop,TS val 279583473 ecr 279583473], length 3
2022-04-05 22:21:40.970549 IP (tos 0x0, ttl 64, id 62117, offset 0, flags [DF], proto TCP (6), length 52)
    127.0.0.1.12250 > 127.0.0.1.33156: Flags [.], cksum 0xfe28 (incorrect -> 0x2742), seq 1, ack 4, win 512, options [nop,nop,TS val 279583473 ecr 279583473], length 0
2022-04-05 22:21:40.970580 IP (tos 0x0, ttl 64, id 62118, offset 0, flags [DF], proto TCP (6), length 54)
    127.0.0.1.12250 > 127.0.0.1.33156: Flags [P.], cksum 0xfe2a (incorrect -> 0x2238), seq 1:3, ack 4, win 512, options [nop,nop,TS val 279583473 ecr 279583473], length 2
2022-04-05 22:21:40.970592 IP (tos 0x0, ttl 64, id 54701, offset 0, flags [DF], proto TCP (6), length 52)
    127.0.0.1.33156 > 127.0.0.1.12250: Flags [.], cksum 0xfe28 (incorrect -> 0x2740), seq 4, ack 3, win 512, options [nop,nop,TS val 279583473 ecr 279583473], length 0
2022-04-05 22:21:40.972684 IP (tos 0x0, ttl 64, id 54702, offset 0, flags [DF], proto TCP (6), length 62)
    127.0.0.1.33156 > 127.0.0.1.12250: Flags [P.], cksum 0xfe32 (incorrect -> 0x360b), seq 4:14, ack 3, win 512, options [nop,nop,TS val 279583475 ecr 279583473], length 10
2022-04-05 22:21:40.972702 IP (tos 0x0, ttl 64, id 62119, offset 0, flags [DF], proto TCP (6), length 52)
    127.0.0.1.12250 > 127.0.0.1.33156: Flags [.], cksum 0xfe28 (incorrect -> 0x2732), seq 3, ack 14, win 512, options [nop,nop,TS val 279583475 ecr 279583475], length 0
2022-04-05 22:21:41.044902 IP (tos 0x0, ttl 64, id 62120, offset 0, flags [DF], proto TCP (6), length 62)
    127.0.0.1.12250 > 127.0.0.1.33156: Flags [P.], cksum 0xfe32 (incorrect -> 0x21d7), seq 3:13, ack 14, win 512, options [nop,nop,TS val 279583547 ecr 279583475], length 10
2022-04-05 22:21:41.044915 IP (tos 0x0, ttl 64, id 54703, offset 0, flags [DF], proto TCP (6), length 52)
    127.0.0.1.33156 > 127.0.0.1.12250: Flags [.], cksum 0xfe28 (incorrect -> 0x2698), seq 14, ack 13, win 512, options [nop,nop,TS val 279583547 ecr 279583547], length 0
2022-04-05 22:21:41.050436 IP (tos 0x0, ttl 64, id 54704, offset 0, flags [DF], proto TCP (6), length 569)
    127.0.0.1.33156 > 127.0.0.1.12250: Flags [P.], cksum 0x002e (incorrect -> 0x0f78), seq 14:531, ack 13, win 512, options [nop,nop,TS val 279583553 ecr 279583547], length 517
2022-04-05 22:21:41.050445 IP (tos 0x0, ttl 64, id 62121, offset 0, flags [DF], proto TCP (6), length 52)
    127.0.0.1.12250 > 127.0.0.1.33156: Flags [.], cksum 0xfe28 (incorrect -> 0x248b), seq 13, ack 531, win 508, options [nop,nop,TS val 279583553 ecr 279583553], length 0
200, 5.794129848480225, 0.8505477905273438