2022-04-05 16:02:24.361029 IP (tos 0x0, ttl 64, id 58698, offset 0, flags [DF], proto TCP (6), length 60)
    127.0.0.1.35020 > 127.0.0.1.9850: Flags [S], cksum 0xfe30 (incorrect -> 0x251a), seq 2299790671, win 65495, options [mss 65495,sackOK,TS val 256826863 ecr 0,nop,wscale 7], length 0
2022-04-05 16:02:24.361040 IP (tos 0x0, ttl 64, id 0, offset 0, flags [DF], proto TCP (6), length 60)
    127.0.0.1.9850 > 127.0.0.1.35020: Flags [S.], cksum 0xfe30 (incorrect -> 0x75e8), seq 4024291856, ack 2299790672, win 65483, options [mss 65495,sackOK,TS val 256826863 ecr 256826863,nop,wscale 7], length 0
2022-04-05 16:02:24.361048 IP (tos 0x0, ttl 64, id 58699, offset 0, flags [DF], proto TCP (6), length 52)
    127.0.0.1.35020 > 127.0.0.1.9850: Flags [.], cksum 0xfe28 (incorrect -> 0x9ca4), seq 1, ack 1, win 512, options [nop,nop,TS val 256826863 ecr 256826863], length 0
2022-04-05 16:02:24.361133 IP (tos 0x0, ttl 64, id 58700, offset 0, flags [DF], proto TCP (6), length 55)
    127.0.0.1.35020 > 127.0.0.1.9850: Flags [P.], cksum 0xfe2b (incorrect -> 0x9797), seq 1:4, ack 1, win 512, options [nop,nop,TS val 256826864 ecr 256826863], length 3
2022-04-05 16:02:24.361138 IP (tos 0x0, ttl 64, id 40484, offset 0, flags [DF], proto TCP (6), length 52)
    127.0.0.1.9850 > 127.0.0.1.35020: Flags [.], cksum 0xfe28 (incorrect -> 0x9c9f), seq 1, ack 4, win 512, options [nop,nop,TS val 256826864 ecr 256826864], length 0
2022-04-05 16:02:24.361202 IP (tos 0x0, ttl 64, id 40485, offset 0, flags [DF], proto TCP (6), length 54)
    127.0.0.1.9850 > 127.0.0.1.35020: Flags [P.], cksum 0xfe2a (incorrect -> 0x9795), seq 1:3, ack 4, win 512, options [nop,nop,TS val 256826864 ecr 256826864], length 2
2022-04-05 16:02:24.361226 IP (tos 0x0, ttl 64, id 58701, offset 0, flags [DF], proto TCP (6), length 52)
    127.0.0.1.35020 > 127.0.0.1.9850: Flags [.], cksum 0xfe28 (incorrect -> 0x9c9d), seq 4, ack 3, win 512, options [nop,nop,TS val 256826864 ecr 256826864], length 0
2022-04-05 16:02:24.510719 IP (tos 0x0, ttl 64, id 58702, offset 0, flags [DF], proto TCP (6), length 62)
    127.0.0.1.35020 > 127.0.0.1.9850: Flags [P.], cksum 0xfe32 (incorrect -> 0xcc34), seq 4:14, ack 3, win 512, options [nop,nop,TS val 256827013 ecr 256826864], length 10
2022-04-05 16:02:24.510733 IP (tos 0x0, ttl 64, id 40486, offset 0, flags [DF], proto TCP (6), length 52)
    127.0.0.1.9850 > 127.0.0.1.35020: Flags [.], cksum 0xfe28 (incorrect -> 0x9b69), seq 3, ack 14, win 512, options [nop,nop,TS val 256827013 ecr 256827013], length 0
2022-04-05 16:02:32.345805 IP (tos 0x0, ttl 64, id 40487, offset 0, flags [DF], proto TCP (6), length 62)
    127.0.0.1.9850 > 127.0.0.1.35020: Flags [P.], cksum 0xfe32 (incorrect -> 0x77bb), seq 3:13, ack 14, win 512, options [nop,nop,TS val 256834848 ecr 256827013], length 10
2022-04-05 16:02:32.345816 IP (tos 0x0, ttl 64, id 58703, offset 0, flags [DF], proto TCP (6), length 52)
    127.0.0.1.35020 > 127.0.0.1.9850: Flags [.], cksum 0xfe28 (incorrect -> 0x5e29), seq 14, ack 13, win 512, options [nop,nop,TS val 256834848 ecr 256834848], length 0
2022-04-05 16:02:32.351294 IP (tos 0x0, ttl 64, id 58704, offset 0, flags [DF], proto TCP (6), length 569)
    127.0.0.1.35020 > 127.0.0.1.9850: Flags [P.], cksum 0x002e (incorrect -> 0x0e82), seq 14:531, ack 13, win 512, options [nop,nop,TS val 256834854 ecr 256834848], length 517
2022-04-05 16:02:32.351302 IP (tos 0x0, ttl 64, id 40488, offset 0, flags [DF], proto TCP (6), length 52)
    127.0.0.1.9850 > 127.0.0.1.35020: Flags [.], cksum 0xfe28 (incorrect -> 0x5c1c), seq 13, ack 531, win 508, options [nop,nop,TS val 256834854 ecr 256834854], length 0
2022-04-05 16:02:59.046275 IP (tos 0x0, ttl 64, id 40489, offset 0, flags [DF], proto TCP (6), length 3487)
    127.0.0.1.9850 > 127.0.0.1.35020: Flags [P.], cksum 0x0b94 (incorrect -> 0x3acc), seq 13:3448, ack 531, win 512, options [nop,nop,TS val 256861549 ecr 256834854], length 3435
2022-04-05 16:02:59.046289 IP (tos 0x0, ttl 64, id 58705, offset 0, flags [DF], proto TCP (6), length 52)
    127.0.0.1.35020 > 127.0.0.1.9850: Flags [.], cksum 0xfe28 (incorrect -> 0x7e30), seq 531, ack 3448, win 494, options [nop,nop,TS val 256861549 ecr 256861549], length 0
2022-04-05 16:02:59.046886 IP (tos 0x0, ttl 64, id 58706, offset 0, flags [DF], proto TCP (6), length 145)
    127.0.0.1.35020 > 127.0.0.1.9850: Flags [P.], cksum 0xfe85 (incorrect -> 0x8c00), seq 531:624, ack 3448, win 512, options [nop,nop,TS val 256861549 ecr 256861549], length 93
2022-04-05 16:02:59.046900 IP (tos 0x0, ttl 64, id 40490, offset 0, flags [DF], proto TCP (6), length 52)
    127.0.0.1.9850 > 127.0.0.1.35020: Flags [.], cksum 0xfe28 (incorrect -> 0x7dc1), seq 3448, ack 624, win 512, options [nop,nop,TS val 256861549 ecr 256861549], length 0
2022-04-05 16:03:05.386494 IP (tos 0x0, ttl 64, id 40491, offset 0, flags [DF], proto TCP (6), length 103)
    127.0.0.1.9850 > 127.0.0.1.35020: Flags [P.], cksum 0xfe5b (incorrect -> 0x147c), seq 3448:3499, ack 624, win 512, options [nop,nop,TS val 256867889 ecr 256861549], length 51
2022-04-05 16:03:05.386509 IP (tos 0x0, ttl 64, id 58707, offset 0, flags [DF], proto TCP (6), length 52)
    127.0.0.1.35020 > 127.0.0.1.9850: Flags [.], cksum 0xfe28 (incorrect -> 0x4c06), seq 624, ack 3499, win 512, options [nop,nop,TS val 256867889 ecr 256867889], length 0
2022-04-05 16:03:05.386959 IP (tos 0x0, ttl 64, id 58708, offset 0, flags [DF], proto TCP (6), length 391)
    127.0.0.1.35020 > 127.0.0.1.9850: Flags [P.], cksum 0xff7b (incorrect -> 0x1d1f), seq 624:963, ack 3499, win 512, options [nop,nop,TS val 256867889 ecr 256867889], length 339
2022-04-05 16:03:05.387049 IP (tos 0x0, ttl 64, id 40492, offset 0, flags [DF], proto TCP (6), length 52)
    127.0.0.1.9850 > 127.0.0.1.35020: Flags [.], cksum 0xfe28 (incorrect -> 0x4ab5), seq 3499, ack 963, win 510, options [nop,nop,TS val 256867889 ecr 256867889], length 0
200, 5.668080568313599, 45.715327978134155