2022-04-05 16:48:34.239470 IP (tos 0x0, ttl 64, id 39578, offset 0, flags [DF], proto TCP (6), length 60)
    127.0.0.1.54554 > 127.0.0.1.12150: Flags [S], cksum 0xfe30 (incorrect -> 0x4372), seq 215730660, win 65495, options [mss 65495,sackOK,TS val 259596742 ecr 0,nop,wscale 7], length 0
2022-04-05 16:48:34.239485 IP (tos 0x0, ttl 64, id 0, offset 0, flags [DF], proto TCP (6), length 60)
    127.0.0.1.12150 > 127.0.0.1.54554: Flags [S.], cksum 0xfe30 (incorrect -> 0x3e6f), seq 3900959546, ack 215730661, win 65483, options [mss 65495,sackOK,TS val 259596742 ecr 259596742,nop,wscale 7], length 0
2022-04-05 16:48:34.239495 IP (tos 0x0, ttl 64, id 39579, offset 0, flags [DF], proto TCP (6), length 52)
    127.0.0.1.54554 > 127.0.0.1.12150: Flags [.], cksum 0xfe28 (incorrect -> 0x652b), seq 1, ack 1, win 512, options [nop,nop,TS val 259596742 ecr 259596742], length 0
2022-04-05 16:48:34.239650 IP (tos 0x0, ttl 64, id 39580, offset 0, flags [DF], proto TCP (6), length 55)
    127.0.0.1.54554 > 127.0.0.1.12150: Flags [P.], cksum 0xfe2b (incorrect -> 0x601f), seq 1:4, ack 1, win 512, options [nop,nop,TS val 259596742 ecr 259596742], length 3
2022-04-05 16:48:34.239670 IP (tos 0x0, ttl 64, id 40514, offset 0, flags [DF], proto TCP (6), length 52)
    127.0.0.1.12150 > 127.0.0.1.54554: Flags [.], cksum 0xfe28 (incorrect -> 0x6528), seq 1, ack 4, win 512, options [nop,nop,TS val 259596742 ecr 259596742], length 0
2022-04-05 16:48:34.239699 IP (tos 0x0, ttl 64, id 40515, offset 0, flags [DF], proto TCP (6), length 54)
    127.0.0.1.12150 > 127.0.0.1.54554: Flags [P.], cksum 0xfe2a (incorrect -> 0x601e), seq 1:3, ack 4, win 512, options [nop,nop,TS val 259596742 ecr 259596742], length 2
2022-04-05 16:48:34.239710 IP (tos 0x0, ttl 64, id 39581, offset 0, flags [DF], proto TCP (6), length 52)
    127.0.0.1.54554 > 127.0.0.1.12150: Flags [.], cksum 0xfe28 (incorrect -> 0x6526), seq 4, ack 3, win 512, options [nop,nop,TS val 259596742 ecr 259596742], length 0
2022-04-05 16:48:34.241405 IP (tos 0x0, ttl 64, id 39582, offset 0, flags [DF], proto TCP (6), length 62)
    127.0.0.1.54554 > 127.0.0.1.12150: Flags [P.], cksum 0xfe32 (incorrect -> 0xafbd), seq 4:14, ack 3, win 512, options [nop,nop,TS val 259596744 ecr 259596742], length 10
2022-04-05 16:48:34.241423 IP (tos 0x0, ttl 64, id 40516, offset 0, flags [DF], proto TCP (6), length 52)
    127.0.0.1.12150 > 127.0.0.1.54554: Flags [.], cksum 0xfe28 (incorrect -> 0x6518), seq 3, ack 14, win 512, options [nop,nop,TS val 259596744 ecr 259596744], length 0
2022-04-05 16:48:34.516238 IP (tos 0x0, ttl 64, id 40517, offset 0, flags [DF], proto TCP (6), length 62)
    127.0.0.1.12150 > 127.0.0.1.54554: Flags [P.], cksum 0xfe32 (incorrect -> 0x5ef2), seq 3:13, ack 14, win 512, options [nop,nop,TS val 259597019 ecr 259596744], length 10
2022-04-05 16:48:34.516248 IP (tos 0x0, ttl 64, id 39583, offset 0, flags [DF], proto TCP (6), length 52)
    127.0.0.1.54554 > 127.0.0.1.12150: Flags [.], cksum 0xfe28 (incorrect -> 0x62e8), seq 14, ack 13, win 512, options [nop,nop,TS val 259597019 ecr 259597019], length 0
2022-04-05 16:48:34.522089 IP (tos 0x0, ttl 64, id 39584, offset 0, flags [DF], proto TCP (6), length 569)
    127.0.0.1.54554 > 127.0.0.1.12150: Flags [P.], cksum 0x002e (incorrect -> 0xcd1a), seq 14:531, ack 13, win 512, options [nop,nop,TS val 259597025 ecr 259597019], length 517
2022-04-05 16:48:34.522098 IP (tos 0x0, ttl 64, id 40518, offset 0, flags [DF], proto TCP (6), length 52)
    127.0.0.1.12150 > 127.0.0.1.54554: Flags [.], cksum 0xfe28 (incorrect -> 0x60db), seq 13, ack 531, win 508, options [nop,nop,TS val 259597025 ecr 259597025], length 0
2022-04-05 16:48:34.802832 IP (tos 0x0, ttl 64, id 40519, offset 0, flags [DF], proto TCP (6), length 3538)
    127.0.0.1.12150 > 127.0.0.1.54554: Flags [P.], cksum 0x0bc7 (incorrect -> 0xce94), seq 13:3499, ack 531, win 512, options [nop,nop,TS val 259597305 ecr 259597025], length 3486
2022-04-05 16:48:34.802840 IP (tos 0x0, ttl 64, id 39585, offset 0, flags [DF], proto TCP (6), length 52)
    127.0.0.1.54554 > 127.0.0.1.12150: Flags [.], cksum 0xfe28 (incorrect -> 0x511b), seq 531, ack 3499, win 494, options [nop,nop,TS val 259597305 ecr 259597305], length 0
2022-04-05 16:48:34.924333 IP (tos 0x0, ttl 64, id 40520, offset 0, flags [DF], proto TCP (6), length 781)
    127.0.0.1.12150 > 127.0.0.1.54554: Flags [P.], cksum 0x0102 (incorrect -> 0xd79a), seq 3499:4228, ack 531, win 512, options [nop,nop,TS val 259597427 ecr 259597305], length 729
2022-04-05 16:48:34.924342 IP (tos 0x0, ttl 64, id 39586, offset 0, flags [DF], proto TCP (6), length 52)
    127.0.0.1.54554 > 127.0.0.1.12150: Flags [.], cksum 0xfe28 (incorrect -> 0x4d43), seq 531, ack 4228, win 505, options [nop,nop,TS val 259597427 ecr 259597427], length 0
2022-04-05 16:48:34.924807 IP (tos 0x0, ttl 64, id 39587, offset 0, flags [DF], proto TCP (6), length 132)
    127.0.0.1.54554 > 127.0.0.1.12150: Flags [P.], cksum 0xfe78 (incorrect -> 0xc403), seq 531:611, ack 4228, win 512, options [nop,nop,TS val 259597427 ecr 259597427], length 80
2022-04-05 16:48:34.924814 IP (tos 0x0, ttl 64, id 40521, offset 0, flags [DF], proto TCP (6), length 52)
    127.0.0.1.12150 > 127.0.0.1.54554: Flags [.], cksum 0xfe28 (incorrect -> 0x4cec), seq 4228, ack 611, win 512, options [nop,nop,TS val 259597427 ecr 259597427], length 0
2022-04-05 16:48:34.925301 IP (tos 0x0, ttl 64, id 39588, offset 0, flags [DF], proto TCP (6), length 341)
    127.0.0.1.54554 > 127.0.0.1.12150: Flags [P.], cksum 0xff49 (incorrect -> 0x9873), seq 611:900, ack 4228, win 512, options [nop,nop,TS val 259597428 ecr 259597427], length 289
2022-04-05 16:48:34.925309 IP (tos 0x0, ttl 64, id 40522, offset 0, flags [DF], proto TCP (6), length 52)
    127.0.0.1.12150 > 127.0.0.1.54554: Flags [.], cksum 0xfe28 (incorrect -> 0x4bcb), seq 4228, ack 900, win 510, options [nop,nop,TS val 259597428 ecr 259597428], length 0
2022-04-05 16:48:35.200307 IP (tos 0x0, ttl 64, id 40523, offset 0, flags [DF], proto TCP (6), length 594)
    127.0.0.1.12150 > 127.0.0.1.54554: Flags [P.], cksum 0x0047 (incorrect -> 0x1746), seq 4228:4770, ack 900, win 512, options [nop,nop,TS val 259597703 ecr 259597428], length 542
2022-04-05 16:48:35.200315 IP (tos 0x0, ttl 64, id 39589, offset 0, flags [DF], proto TCP (6), length 52)
    127.0.0.1.54554 > 127.0.0.1.12150: Flags [.], cksum 0xfe28 (incorrect -> 0x4789), seq 900, ack 4770, win 508, options [nop,nop,TS val 259597703 ecr 259597703], length 0
2022-04-05 16:48:35.332310 IP (tos 0x0, ttl 64, id 40524, offset 0, flags [DF], proto TCP (6), length 3504)
    127.0.0.1.12150 > 127.0.0.1.54554: Flags [P.], cksum 0x0ba5 (incorrect -> 0x2c7c), seq 4770:8222, ack 900, win 512, options [nop,nop,TS val 259597835 ecr 259597703], length 3452
2022-04-05 16:48:35.332317 IP (tos 0x0, ttl 64, id 39590, offset 0, flags [DF], proto TCP (6), length 52)
    127.0.0.1.54554 > 127.0.0.1.12150: Flags [.], cksum 0xfe28 (incorrect -> 0x3913), seq 900, ack 8222, win 494, options [nop,nop,TS val 259597835 ecr 259597835], length 0
2022-04-05 16:48:35.340519 IP (tos 0x0, ttl 64, id 40525, offset 0, flags [DF], proto TCP (6), length 4036)
    127.0.0.1.12150 > 127.0.0.1.54554: Flags [P.], cksum 0x0db9 (incorrect -> 0xfc16), seq 8222:12206, ack 900, win 512, options [nop,nop,TS val 259597843 ecr 259597835], length 3984
2022-04-05 16:48:35.340524 IP (tos 0x0, ttl 64, id 39591, offset 0, flags [DF], proto TCP (6), length 52)
    127.0.0.1.54554 > 127.0.0.1.12150: Flags [.], cksum 0xfe28 (incorrect -> 0x2975), seq 900, ack 12206, win 492, options [nop,nop,TS val 259597843 ecr 259597843], length 0
2022-04-05 16:48:35.354454 IP (tos 0x0, ttl 64, id 40526, offset 0, flags [DF], proto TCP (6), length 1546)
    127.0.0.1.12150 > 127.0.0.1.54554: Flags [P.], cksum 0x03ff (incorrect -> 0xdfe0), seq 12206:13700, ack 900, win 512, options [nop,nop,TS val 259597857 ecr 259597843], length 1494
2022-04-05 16:48:35.354460 IP (tos 0x0, ttl 64, id 39592, offset 0, flags [DF], proto TCP (6), length 52)
    127.0.0.1.54554 > 127.0.0.1.12150: Flags [.], cksum 0xfe28 (incorrect -> 0x2379), seq 900, ack 13700, win 502, options [nop,nop,TS val 259597857 ecr 259597857], length 0
2022-04-05 16:48:35.370719 IP (tos 0x0, ttl 64, id 40527, offset 0, flags [DF], proto TCP (6), length 3538)
    127.0.0.1.12150 > 127.0.0.1.54554: Flags [P.], cksum 0x0bc7 (incorrect -> 0xd142), seq 13700:17186, ack 900, win 512, options [nop,nop,TS val 259597873 ecr 259597857], length 3486
2022-04-05 16:48:35.370725 IP (tos 0x0, ttl 64, id 39593, offset 0, flags [DF], proto TCP (6), length 52)
    127.0.0.1.54554 > 127.0.0.1.12150: Flags [.], cksum 0xfe28 (incorrect -> 0x15c3), seq 900, ack 17186, win 494, options [nop,nop,TS val 259597873 ecr 259597873], length 0
2022-04-05 16:48:35.384735 IP (tos 0x0, ttl 64, id 40528, offset 0, flags [DF], proto TCP (6), length 2236)
    127.0.0.1.12150 > 127.0.0.1.54554: Flags [P.], cksum 0x06b1 (incorrect -> 0xc9b7), seq 17186:19370, ack 900, win 512, options [nop,nop,TS val 259597887 ecr 259597873], length 2184
2022-04-05 16:48:35.384745 IP (tos 0x0, ttl 64, id 39594, offset 0, flags [DF], proto TCP (6), length 52)
    127.0.0.1.54554 > 127.0.0.1.12150: Flags [.], cksum 0xfe28 (incorrect -> 0x0d1a), seq 900, ack 19370, win 499, options [nop,nop,TS val 259597887 ecr 259597887], length 0
2022-04-05 16:48:35.449053 IP (tos 0x0, ttl 64, id 40529, offset 0, flags [DF], proto TCP (6), length 2972)
    127.0.0.1.12150 > 127.0.0.1.54554: Flags [P.], cksum 0x0991 (incorrect -> 0x3a10), seq 19370:22290, ack 900, win 512, options [nop,nop,TS val 259597951 ecr 259597887], length 2920
2022-04-05 16:48:35.449063 IP (tos 0x0, ttl 64, id 39595, offset 0, flags [DF], proto TCP (6), length 52)
    127.0.0.1.54554 > 127.0.0.1.12150: Flags [.], cksum 0xfe28 (incorrect -> 0x0135), seq 900, ack 22290, win 496, options [nop,nop,TS val 259597951 ecr 259597951], length 0
2022-04-05 16:48:35.455815 IP (tos 0x0, ttl 64, id 40530, offset 0, flags [DF], proto TCP (6), length 3470)
    127.0.0.1.12150 > 127.0.0.1.54554: Flags [P.], cksum 0x0b83 (incorrect -> 0xc627), seq 22290:25708, ack 900, win 512, options [nop,nop,TS val 259597958 ecr 259597951], length 3418
2022-04-05 16:48:35.455821 IP (tos 0x0, ttl 64, id 39596, offset 0, flags [DF], proto TCP (6), length 52)
    127.0.0.1.54554 > 127.0.0.1.12150: Flags [.], cksum 0xfe28 (incorrect -> 0xf3ce), seq 900, ack 25708, win 494, options [nop,nop,TS val 259597958 ecr 259597958], length 0
2022-04-05 16:48:35.458815 IP (tos 0x0, ttl 64, id 40531, offset 0, flags [DF], proto TCP (6), length 1546)
    127.0.0.1.12150 > 127.0.0.1.54554: Flags [P.], cksum 0x03ff (incorrect -> 0x600f), seq 25708:27202, ack 900, win 512, options [nop,nop,TS val 259597961 ecr 259597958], length 1494
2022-04-05 16:48:35.458820 IP (tos 0x0, ttl 64, id 39597, offset 0, flags [DF], proto TCP (6), length 52)
    127.0.0.1.54554 > 127.0.0.1.12150: Flags [.], cksum 0xfe28 (incorrect -> 0xedea), seq 900, ack 27202, win 502, options [nop,nop,TS val 259597961 ecr 259597961], length 0
2022-04-05 16:48:35.467378 IP (tos 0x0, ttl 64, id 40532, offset 0, flags [DF], proto TCP (6), length 2440)
    127.0.0.1.12150 > 127.0.0.1.54554: Flags [P.], cksum 0x077d (incorrect -> 0x7aa7), seq 27202:29590, ack 900, win 512, options [nop,nop,TS val 259597970 ecr 259597961], length 2388
2022-04-05 16:48:35.467383 IP (tos 0x0, ttl 64, id 39598, offset 0, flags [DF], proto TCP (6), length 52)
    127.0.0.1.54554 > 127.0.0.1.12150: Flags [.], cksum 0xfe28 (incorrect -> 0xe488), seq 900, ack 29590, win 498, options [nop,nop,TS val 259597970 ecr 259597970], length 0
2022-04-05 16:48:35.468580 IP (tos 0x0, ttl 64, id 40533, offset 0, flags [DF], proto TCP (6), length 2972)
    127.0.0.1.12150 > 127.0.0.1.54554: Flags [P.], cksum 0x0991 (incorrect -> 0x3475), seq 29590:32510, ack 900, win 512, options [nop,nop,TS val 259597971 ecr 259597970], length 2920
2022-04-05 16:48:35.468613 IP (tos 0x0, ttl 64, id 39599, offset 0, flags [DF], proto TCP (6), length 52)
    127.0.0.1.54554 > 127.0.0.1.12150: Flags [.], cksum 0xfe28 (incorrect -> 0xd910), seq 900, ack 32510, win 512, options [nop,nop,TS val 259597971 ecr 259597971], length 0
2022-04-05 16:48:35.479699 IP (tos 0x0, ttl 64, id 40534, offset 0, flags [DF], proto TCP (6), length 2972)
    127.0.0.1.12150 > 127.0.0.1.54554: Flags [P.], cksum 0x0991 (incorrect -> 0xb582), seq 32510:35430, ack 900, win 512, options [nop,nop,TS val 259597982 ecr 259597971], length 2920
2022-04-05 16:48:35.522654 IP (tos 0x0, ttl 64, id 39600, offset 0, flags [DF], proto TCP (6), length 52)
    127.0.0.1.54554 > 127.0.0.1.12150: Flags [.], cksum 0xfe28 (incorrect -> 0xcd67), seq 900, ack 35430, win 512, options [nop,nop,TS val 259598025 ecr 259597982], length 0
2022-04-05 16:48:35.522660 IP (tos 0x0, ttl 64, id 40535, offset 0, flags [DF], proto TCP (6), length 8812)
    127.0.0.1.12150 > 127.0.0.1.54554: Flags [P.], cksum 0x2061 (incorrect -> 0x8073), seq 35430:44190, ack 900, win 512, options [nop,nop,TS val 259598025 ecr 259598025], length 8760
2022-04-05 16:48:35.570656 IP (tos 0x0, ttl 64, id 39601, offset 0, flags [DF], proto TCP (6), length 52)
    127.0.0.1.54554 > 127.0.0.1.12150: Flags [.], cksum 0xfe28 (incorrect -> 0xaad4), seq 900, ack 44190, win 512, options [nop,nop,TS val 259598073 ecr 259598025], length 0
2022-04-05 16:48:35.570663 IP (tos 0x0, ttl 64, id 40536, offset 0, flags [DF], proto TCP (6), length 1512)
    127.0.0.1.12150 > 127.0.0.1.54554: Flags [P.], cksum 0x03dd (incorrect -> 0x32ef), seq 44190:45650, ack 900, win 512, options [nop,nop,TS val 259598073 ecr 259598073], length 1460
2022-04-05 16:48:35.570674 IP (tos 0x0, ttl 64, id 39602, offset 0, flags [DF], proto TCP (6), length 52)
    127.0.0.1.54554 > 127.0.0.1.12150: Flags [.], cksum 0xfe28 (incorrect -> 0xa4f0), seq 900, ack 45650, win 512, options [nop,nop,TS val 259598073 ecr 259598073], length 0
2022-04-05 16:48:35.575251 IP (tos 0x0, ttl 64, id 40537, offset 0, flags [DF], proto TCP (6), length 3470)
    127.0.0.1.12150 > 127.0.0.1.54554: Flags [P.], cksum 0x0b83 (incorrect -> 0xc3cc), seq 45650:49068, ack 900, win 512, options [nop,nop,TS val 259598078 ecr 259598073], length 3418
2022-04-05 16:48:35.575265 IP (tos 0x0, ttl 64, id 39603, offset 0, flags [DF], proto TCP (6), length 52)
    127.0.0.1.54554 > 127.0.0.1.12150: Flags [.], cksum 0xfe28 (incorrect -> 0x978c), seq 900, ack 49068, win 512, options [nop,nop,TS val 259598078 ecr 259598078], length 0
2022-04-05 16:48:35.578028 IP (tos 0x0, ttl 64, id 40538, offset 0, flags [DF], proto TCP (6), length 4100)
    127.0.0.1.12150 > 127.0.0.1.54554: Flags [P.], cksum 0x0df9 (incorrect -> 0xfb6e), seq 49068:53116, ack 900, win 512, options [nop,nop,TS val 259598080 ecr 259598078], length 4048
2022-04-05 16:48:35.578064 IP (tos 0x0, ttl 64, id 39604, offset 0, flags [DF], proto TCP (6), length 52)
    127.0.0.1.54554 > 127.0.0.1.12150: Flags [.], cksum 0xfe28 (incorrect -> 0x87b7), seq 900, ack 53116, win 512, options [nop,nop,TS val 259598081 ecr 259598080], length 0
2022-04-05 16:48:35.578070 IP (tos 0x0, ttl 64, id 40539, offset 0, flags [DF], proto TCP (6), length 7186)
    127.0.0.1.12150 > 127.0.0.1.54554: Flags [P.], cksum 0x1a07 (incorrect -> 0x96b1), seq 53116:60250, ack 900, win 512, options [nop,nop,TS val 259598081 ecr 259598081], length 7134
2022-04-05 16:48:35.578433 IP (tos 0x0, ttl 64, id 39605, offset 0, flags [DF], proto TCP (6), length 52)
    127.0.0.1.54554 > 127.0.0.1.12150: Flags [.], cksum 0xfe28 (incorrect -> 0x6bd8), seq 900, ack 60250, win 512, options [nop,nop,TS val 259598081 ecr 259598081], length 0
2022-04-05 16:48:35.588878 IP (tos 0x0, ttl 64, id 40540, offset 0, flags [DF], proto TCP (6), length 3968)
    127.0.0.1.12150 > 127.0.0.1.54554: Flags [P.], cksum 0x0d75 (incorrect -> 0x7255), seq 60250:64166, ack 900, win 512, options [nop,nop,TS val 259598091 ecr 259598081], length 3916
2022-04-05 16:48:35.588892 IP (tos 0x0, ttl 64, id 39606, offset 0, flags [DF], proto TCP (6), length 52)
    127.0.0.1.54554 > 127.0.0.1.12150: Flags [.], cksum 0xfe28 (incorrect -> 0x5c78), seq 900, ack 64166, win 512, options [nop,nop,TS val 259598091 ecr 259598091], length 0
2022-04-05 16:48:35.588964 IP (tos 0x0, ttl 64, id 40541, offset 0, flags [DF], proto TCP (6), length 3436)
    127.0.0.1.12150 > 127.0.0.1.54554: Flags [P.], cksum 0x0b61 (incorrect -> 0x53c8), seq 64166:67550, ack 900, win 512, options [nop,nop,TS val 259598091 ecr 259598091], length 3384
2022-04-05 16:48:35.588975 IP (tos 0x0, ttl 64, id 39607, offset 0, flags [DF], proto TCP (6), length 52)
    127.0.0.1.54554 > 127.0.0.1.12150: Flags [.], cksum 0xfe28 (incorrect -> 0x4f40), seq 900, ack 67550, win 512, options [nop,nop,TS val 259598091 ecr 259598091], length 0
2022-04-05 16:48:35.594111 IP (tos 0x0, ttl 64, id 40542, offset 0, flags [DF], proto TCP (6), length 1512)
    127.0.0.1.12150 > 127.0.0.1.54554: Flags [P.], cksum 0x03dd (incorrect -> 0xbbad), seq 67550:69010, ack 900, win 512, options [nop,nop,TS val 259598097 ecr 259598091], length 1460
2022-04-05 16:48:35.594319 IP (tos 0x0, ttl 64, id 39608, offset 0, flags [DF], proto TCP (6), length 52)
    127.0.0.1.54554 > 127.0.0.1.12150: Flags [.], cksum 0xfe28 (incorrect -> 0x4980), seq 900, ack 69010, win 512, options [nop,nop,TS val 259598097 ecr 259598097], length 0
2022-04-05 16:48:35.598345 IP (tos 0x0, ttl 64, id 40543, offset 0, flags [DF], proto TCP (6), length 2972)
    127.0.0.1.12150 > 127.0.0.1.54554: Flags [P.], cksum 0x0991 (incorrect -> 0x188c), seq 69010:71930, ack 900, win 512, options [nop,nop,TS val 259598101 ecr 259598097], length 2920
2022-04-05 16:48:35.598366 IP (tos 0x0, ttl 64, id 39609, offset 0, flags [DF], proto TCP (6), length 52)
    127.0.0.1.54554 > 127.0.0.1.12150: Flags [.], cksum 0xfe28 (incorrect -> 0x3e10), seq 900, ack 71930, win 512, options [nop,nop,TS val 259598101 ecr 259598101], length 0
2022-04-05 16:48:35.609381 IP (tos 0x0, ttl 64, id 40544, offset 0, flags [DF], proto TCP (6), length 2972)
    127.0.0.1.12150 > 127.0.0.1.54554: Flags [P.], cksum 0x0991 (incorrect -> 0xe217), seq 71930:74850, ack 900, win 512, options [nop,nop,TS val 259598112 ecr 259598101], length 2920
2022-04-05 16:48:35.650662 IP (tos 0x0, ttl 64, id 39610, offset 0, flags [DF], proto TCP (6), length 52)
    127.0.0.1.54554 > 127.0.0.1.12150: Flags [.], cksum 0xfe28 (incorrect -> 0x3269), seq 900, ack 74850, win 512, options [nop,nop,TS val 259598153 ecr 259598112], length 0
2022-04-05 16:48:35.650686 IP (tos 0x0, ttl 64, id 40545, offset 0, flags [DF], proto TCP (6), length 20990)
    127.0.0.1.12150 > 127.0.0.1.54554: Flags [P.], cksum 0x4ff3 (incorrect -> 0xaa40), seq 74850:95788, ack 900, win 512, options [nop,nop,TS val 259598153 ecr 259598153], length 20938
2022-04-05 16:48:35.694678 IP (tos 0x0, ttl 64, id 39611, offset 0, flags [DF], proto TCP (6), length 52)
    127.0.0.1.54554 > 127.0.0.1.12150: Flags [.], cksum 0xfe28 (incorrect -> 0xe049), seq 900, ack 95788, win 512, options [nop,nop,TS val 259598197 ecr 259598153], length 0
2022-04-05 16:48:35.694688 IP (tos 0x0, ttl 64, id 40546, offset 0, flags [DF], proto TCP (6), length 5394)
    127.0.0.1.12150 > 127.0.0.1.54554: Flags [P.], cksum 0x1307 (incorrect -> 0xa8fc), seq 95788:101130, ack 900, win 512, options [nop,nop,TS val 259598197 ecr 259598197], length 5342
2022-04-05 16:48:35.695008 IP (tos 0x0, ttl 64, id 39612, offset 0, flags [DF], proto TCP (6), length 52)
    127.0.0.1.54554 > 127.0.0.1.12150: Flags [.], cksum 0xfe28 (incorrect -> 0xcb3f), seq 900, ack 101130, win 512, options [nop,nop,TS val 259598197 ecr 259598197], length 0
2022-04-05 16:48:35.696513 IP (tos 0x0, ttl 64, id 40547, offset 0, flags [DF], proto TCP (6), length 2972)
    127.0.0.1.12150 > 127.0.0.1.54554: Flags [P.], cksum 0x0991 (incorrect -> 0x0313), seq 101130:104050, ack 900, win 512, options [nop,nop,TS val 259598199 ecr 259598197], length 2920
2022-04-05 16:48:35.696734 IP (tos 0x0, ttl 64, id 39613, offset 0, flags [DF], proto TCP (6), length 52)
    127.0.0.1.54554 > 127.0.0.1.12150: Flags [.], cksum 0xfe28 (incorrect -> 0xbfd3), seq 900, ack 104050, win 512, options [nop,nop,TS val 259598199 ecr 259598199], length 0
2022-04-05 16:48:35.699272 IP (tos 0x0, ttl 64, id 40548, offset 0, flags [DF], proto TCP (6), length 3470)
    127.0.0.1.12150 > 127.0.0.1.54554: Flags [P.], cksum 0x0b83 (incorrect -> 0x4a38), seq 104050:107468, ack 900, win 512, options [nop,nop,TS val 259598202 ecr 259598199], length 3418
2022-04-05 16:48:35.699285 IP (tos 0x0, ttl 64, id 39614, offset 0, flags [DF], proto TCP (6), length 52)
    127.0.0.1.54554 > 127.0.0.1.12150: Flags [.], cksum 0xfe28 (incorrect -> 0xb273), seq 900, ack 107468, win 512, options [nop,nop,TS val 259598202 ecr 259598202], length 0
2022-04-05 16:48:35.700266 IP (tos 0x0, ttl 64, id 40549, offset 0, flags [DF], proto TCP (6), length 2474)
    127.0.0.1.12150 > 127.0.0.1.54554: Flags [P.], cksum 0x079f (incorrect -> 0xa450), seq 107468:109890, ack 900, win 512, options [nop,nop,TS val 259598203 ecr 259598202], length 2422
2022-04-05 16:48:35.700382 IP (tos 0x0, ttl 64, id 39615, offset 0, flags [DF], proto TCP (6), length 52)
    127.0.0.1.54554 > 127.0.0.1.12150: Flags [.], cksum 0xfe28 (incorrect -> 0xa8fb), seq 900, ack 109890, win 512, options [nop,nop,TS val 259598203 ecr 259598203], length 0
2022-04-05 16:48:35.700517 IP (tos 0x0, ttl 64, id 40550, offset 0, flags [DF], proto TCP (6), length 4100)
    127.0.0.1.12150 > 127.0.0.1.54554: Flags [P.], cksum 0x0df9 (incorrect -> 0x7614), seq 109890:113938, ack 900, win 512, options [nop,nop,TS val 259598203 ecr 259598203], length 4048
2022-04-05 16:48:35.700593 IP (tos 0x0, ttl 64, id 39616, offset 0, flags [DF], proto TCP (6), length 52)
    127.0.0.1.54554 > 127.0.0.1.12150: Flags [.], cksum 0xfe28 (incorrect -> 0x992b), seq 900, ack 113938, win 512, options [nop,nop,TS val 259598203 ecr 259598203], length 0
2022-04-05 16:48:35.700599 IP (tos 0x0, ttl 64, id 40551, offset 0, flags [DF], proto TCP (6), length 11102)
    127.0.0.1.12150 > 127.0.0.1.54554: Flags [P.], cksum 0x2953 (incorrect -> 0x9b6b), seq 113938:124988, ack 900, win 512, options [nop,nop,TS val 259598203 ecr 259598203], length 11050
2022-04-05 16:48:35.700607 IP (tos 0x0, ttl 64, id 39617, offset 0, flags [DF], proto TCP (6), length 52)
    127.0.0.1.54554 > 127.0.0.1.12150: Flags [.], cksum 0xfe28 (incorrect -> 0x6e01), seq 900, ack 124988, win 512, options [nop,nop,TS val 259598203 ecr 259598203], length 0
2022-04-05 16:48:35.706181 IP (tos 0x0, ttl 64, id 40552, offset 0, flags [DF], proto TCP (6), length 550)
    127.0.0.1.12150 > 127.0.0.1.54554: Flags [P.], cksum 0x001b (incorrect -> 0x3783), seq 124988:125486, ack 900, win 512, options [nop,nop,TS val 259598209 ecr 259598203], length 498
2022-04-05 16:48:35.706195 IP (tos 0x0, ttl 64, id 39618, offset 0, flags [DF], proto TCP (6), length 52)
    127.0.0.1.54554 > 127.0.0.1.12150: Flags [.], cksum 0xfe28 (incorrect -> 0x6c03), seq 900, ack 125486, win 512, options [nop,nop,TS val 259598209 ecr 259598209], length 0
2022-04-05 16:48:35.707316 IP (tos 0x0, ttl 64, id 40553, offset 0, flags [DF], proto TCP (6), length 3436)
    127.0.0.1.12150 > 127.0.0.1.54554: Flags [P.], cksum 0x0b61 (incorrect -> 0x64a5), seq 125486:128870, ack 900, win 512, options [nop,nop,TS val 259598210 ecr 259598209], length 3384
2022-04-05 16:48:35.707440 IP (tos 0x0, ttl 64, id 39619, offset 0, flags [DF], proto TCP (6), length 52)
    127.0.0.1.54554 > 127.0.0.1.12150: Flags [.], cksum 0xfe28 (incorrect -> 0x5ec9), seq 900, ack 128870, win 512, options [nop,nop,TS val 259598210 ecr 259598210], length 0
2022-04-05 16:48:35.717523 IP (tos 0x0, ttl 64, id 40554, offset 0, flags [DF], proto TCP (6), length 1512)
    127.0.0.1.12150 > 127.0.0.1.54554: Flags [P.], cksum 0x03dd (incorrect -> 0x8ad3), seq 128870:130330, ack 900, win 512, options [nop,nop,TS val 259598220 ecr 259598210], length 1460
2022-04-05 16:48:35.717547 IP (tos 0x0, ttl 64, id 39620, offset 0, flags [DF], proto TCP (6), length 52)
    127.0.0.1.54554 > 127.0.0.1.12150: Flags [.], cksum 0xfe28 (incorrect -> 0x5901), seq 900, ack 130330, win 512, options [nop,nop,TS val 259598220 ecr 259598220], length 0
2022-04-05 16:48:35.717656 IP (tos 0x0, ttl 64, id 40555, offset 0, flags [DF], proto TCP (6), length 3470)
    127.0.0.1.12150 > 127.0.0.1.54554: Flags [P.], cksum 0x0b83 (incorrect -> 0x621b), seq 130330:133748, ack 900, win 512, options [nop,nop,TS val 259598220 ecr 259598220], length 3418
2022-04-05 16:48:35.717677 IP (tos 0x0, ttl 64, id 39621, offset 0, flags [DF], proto TCP (6), length 52)
    127.0.0.1.54554 > 127.0.0.1.12150: Flags [.], cksum 0xfe28 (incorrect -> 0x4ba7), seq 900, ack 133748, win 512, options [nop,nop,TS val 259598220 ecr 259598220], length 0
2022-04-05 16:48:35.725772 IP (tos 0x0, ttl 64, id 40556, offset 0, flags [DF], proto TCP (6), length 2474)
    127.0.0.1.12150 > 127.0.0.1.54554: Flags [P.], cksum 0x079f (incorrect -> 0xe121), seq 133748:136170, ack 900, win 512, options [nop,nop,TS val 259598228 ecr 259598220], length 2422
2022-04-05 16:48:35.725944 IP (tos 0x0, ttl 64, id 39622, offset 0, flags [DF], proto TCP (6), length 52)
    127.0.0.1.54554 > 127.0.0.1.12150: Flags [.], cksum 0xfe28 (incorrect -> 0x4221), seq 900, ack 136170, win 512, options [nop,nop,TS val 259598228 ecr 259598228], length 0
2022-04-05 16:48:35.725949 IP (tos 0x0, ttl 64, id 40557, offset 0, flags [DF], proto TCP (6), length 3470)
    127.0.0.1.12150 > 127.0.0.1.54554: Flags [P.], cksum 0x0b83 (incorrect -> 0xd279), seq 136170:139588, ack 900, win 512, options [nop,nop,TS val 259598228 ecr 259598228], length 3418
2022-04-05 16:48:35.725955 IP (tos 0x0, ttl 64, id 39623, offset 0, flags [DF], proto TCP (6), length 52)
    127.0.0.1.54554 > 127.0.0.1.12150: Flags [.], cksum 0xfe28 (incorrect -> 0x34c7), seq 900, ack 139588, win 512, options [nop,nop,TS val 259598228 ecr 259598228], length 0
200, 5.9713897705078125, 1.6034152507781982