2022-04-05 18:53:58.141535 IP (tos 0x0, ttl 64, id 49302, offset 0, flags [DF], proto TCP (6), length 60)
    127.0.0.1.58130 > 127.0.0.1.10450: Flags [S], cksum 0xfe30 (incorrect -> 0x4978), seq 3684572950, win 65495, options [mss 65495,sackOK,TS val 267120644 ecr 0,nop,wscale 7], length 0
2022-04-05 18:53:58.141551 IP (tos 0x0, ttl 64, id 0, offset 0, flags [DF], proto TCP (6), length 60)
    127.0.0.1.10450 > 127.0.0.1.58130: Flags [S.], cksum 0xfe30 (incorrect -> 0xb076), seq 2757883050, ack 3684572951, win 65483, options [mss 65495,sackOK,TS val 267120644 ecr 267120644,nop,wscale 7], length 0
2022-04-05 18:53:58.141563 IP (tos 0x0, ttl 64, id 49303, offset 0, flags [DF], proto TCP (6), length 52)
    127.0.0.1.58130 > 127.0.0.1.10450: Flags [.], cksum 0xfe28 (incorrect -> 0xd732), seq 1, ack 1, win 512, options [nop,nop,TS val 267120644 ecr 267120644], length 0
2022-04-05 18:53:58.141687 IP (tos 0x0, ttl 64, id 49304, offset 0, flags [DF], proto TCP (6), length 55)
    127.0.0.1.58130 > 127.0.0.1.10450: Flags [P.], cksum 0xfe2b (incorrect -> 0xd226), seq 1:4, ack 1, win 512, options [nop,nop,TS val 267120644 ecr 267120644], length 3
2022-04-05 18:53:58.141703 IP (tos 0x0, ttl 64, id 47563, offset 0, flags [DF], proto TCP (6), length 52)
    127.0.0.1.10450 > 127.0.0.1.58130: Flags [.], cksum 0xfe28 (incorrect -> 0xd72f), seq 1, ack 4, win 512, options [nop,nop,TS val 267120644 ecr 267120644], length 0
2022-04-05 18:53:58.141796 IP (tos 0x0, ttl 64, id 47564, offset 0, flags [DF], proto TCP (6), length 54)
    127.0.0.1.10450 > 127.0.0.1.58130: Flags [P.], cksum 0xfe2a (incorrect -> 0xd225), seq 1:3, ack 4, win 512, options [nop,nop,TS val 267120644 ecr 267120644], length 2
2022-04-05 18:53:58.141820 IP (tos 0x0, ttl 64, id 49305, offset 0, flags [DF], proto TCP (6), length 52)
    127.0.0.1.58130 > 127.0.0.1.10450: Flags [.], cksum 0xfe28 (incorrect -> 0xd72d), seq 4, ack 3, win 512, options [nop,nop,TS val 267120644 ecr 267120644], length 0
2022-04-05 18:53:58.143966 IP (tos 0x0, ttl 64, id 49306, offset 0, flags [DF], proto TCP (6), length 62)
    127.0.0.1.58130 > 127.0.0.1.10450: Flags [P.], cksum 0xfe32 (incorrect -> 0x3e44), seq 4:14, ack 3, win 512, options [nop,nop,TS val 267120646 ecr 267120644], length 10
2022-04-05 18:53:58.143987 IP (tos 0x0, ttl 64, id 47565, offset 0, flags [DF], proto TCP (6), length 52)
    127.0.0.1.10450 > 127.0.0.1.58130: Flags [.], cksum 0xfe28 (incorrect -> 0xd71f), seq 3, ack 14, win 512, options [nop,nop,TS val 267120646 ecr 267120646], length 0
2022-04-05 18:53:58.242046 IP (tos 0x0, ttl 64, id 47566, offset 0, flags [DF], proto TCP (6), length 62)
    127.0.0.1.10450 > 127.0.0.1.58130: Flags [P.], cksum 0xfe32 (incorrect -> 0xd1aa), seq 3:13, ack 14, win 512, options [nop,nop,TS val 267120744 ecr 267120646], length 10
2022-04-05 18:53:58.242068 IP (tos 0x0, ttl 64, id 49307, offset 0, flags [DF], proto TCP (6), length 52)
    127.0.0.1.58130 > 127.0.0.1.10450: Flags [.], cksum 0xfe28 (incorrect -> 0xd650), seq 14, ack 13, win 512, options [nop,nop,TS val 267120745 ecr 267120744], length 0
2022-04-05 18:53:58.248188 IP (tos 0x0, ttl 64, id 49308, offset 0, flags [DF], proto TCP (6), length 569)
    127.0.0.1.58130 > 127.0.0.1.10450: Flags [P.], cksum 0x002e (incorrect -> 0x427c), seq 14:531, ack 13, win 512, options [nop,nop,TS val 267120751 ecr 267120744], length 517
2022-04-05 18:53:58.248198 IP (tos 0x0, ttl 64, id 47567, offset 0, flags [DF], proto TCP (6), length 52)
    127.0.0.1.10450 > 127.0.0.1.58130: Flags [.], cksum 0xfe28 (incorrect -> 0xd442), seq 13, ack 531, win 508, options [nop,nop,TS val 267120751 ecr 267120751], length 0
200, 7.62447190284729, 0.6790065765380859