2022-04-05 14:32:52.718670 IP (tos 0x0, ttl 64, id 20165, offset 0, flags [DF], proto TCP (6), length 60)
    127.0.0.1.59066 > 127.0.0.1.9550: Flags [S], cksum 0xfe30 (incorrect -> 0x8be8), seq 3824672294, win 65495, options [mss 65495,sackOK,TS val 251455221 ecr 0,nop,wscale 7], length 0
2022-04-05 14:32:52.718683 IP (tos 0x0, ttl 64, id 0, offset 0, flags [DF], proto TCP (6), length 60)
    127.0.0.1.9550 > 127.0.0.1.59066: Flags [S.], cksum 0xfe30 (incorrect -> 0xa1aa), seq 1185983894, ack 3824672295, win 65483, options [mss 65495,sackOK,TS val 251455221 ecr 251455221,nop,wscale 7], length 0
2022-04-05 14:32:52.718695 IP (tos 0x0, ttl 64, id 20166, offset 0, flags [DF], proto TCP (6), length 52)
    127.0.0.1.59066 > 127.0.0.1.9550: Flags [.], cksum 0xfe28 (incorrect -> 0xc866), seq 1, ack 1, win 512, options [nop,nop,TS val 251455221 ecr 251455221], length 0
2022-04-05 14:32:52.718804 IP (tos 0x0, ttl 64, id 20167, offset 0, flags [DF], proto TCP (6), length 55)
    127.0.0.1.59066 > 127.0.0.1.9550: Flags [P.], cksum 0xfe2b (incorrect -> 0xc35a), seq 1:4, ack 1, win 512, options [nop,nop,TS val 251455221 ecr 251455221], length 3
2022-04-05 14:32:52.718815 IP (tos 0x0, ttl 64, id 26359, offset 0, flags [DF], proto TCP (6), length 52)
    127.0.0.1.9550 > 127.0.0.1.59066: Flags [.], cksum 0xfe28 (incorrect -> 0xc863), seq 1, ack 4, win 512, options [nop,nop,TS val 251455221 ecr 251455221], length 0
2022-04-05 14:32:52.718852 IP (tos 0x0, ttl 64, id 26360, offset 0, flags [DF], proto TCP (6), length 54)
    127.0.0.1.9550 > 127.0.0.1.59066: Flags [P.], cksum 0xfe2a (incorrect -> 0xc359), seq 1:3, ack 4, win 512, options [nop,nop,TS val 251455221 ecr 251455221], length 2
2022-04-05 14:32:52.718867 IP (tos 0x0, ttl 64, id 20168, offset 0, flags [DF], proto TCP (6), length 52)
    127.0.0.1.59066 > 127.0.0.1.9550: Flags [.], cksum 0xfe28 (incorrect -> 0xc861), seq 4, ack 3, win 512, options [nop,nop,TS val 251455221 ecr 251455221], length 0
2022-04-05 14:32:52.720536 IP (tos 0x0, ttl 64, id 20169, offset 0, flags [DF], proto TCP (6), length 62)
    127.0.0.1.59066 > 127.0.0.1.9550: Flags [P.], cksum 0xfe32 (incorrect -> 0x6e9a), seq 4:14, ack 3, win 512, options [nop,nop,TS val 251455223 ecr 251455221], length 10
2022-04-05 14:32:52.720552 IP (tos 0x0, ttl 64, id 26361, offset 0, flags [DF], proto TCP (6), length 52)
    127.0.0.1.9550 > 127.0.0.1.59066: Flags [.], cksum 0xfe28 (incorrect -> 0xc853), seq 3, ack 14, win 512, options [nop,nop,TS val 251455223 ecr 251455223], length 0
2022-04-05 14:32:53.035167 IP (tos 0x0, ttl 64, id 26362, offset 0, flags [DF], proto TCP (6), length 62)
    127.0.0.1.9550 > 127.0.0.1.59066: Flags [P.], cksum 0xfe32 (incorrect -> 0xc205), seq 3:13, ack 14, win 512, options [nop,nop,TS val 251455538 ecr 251455223], length 10
2022-04-05 14:32:53.035178 IP (tos 0x0, ttl 64, id 20170, offset 0, flags [DF], proto TCP (6), length 52)
    127.0.0.1.59066 > 127.0.0.1.9550: Flags [.], cksum 0xfe28 (incorrect -> 0xc5d3), seq 14, ack 13, win 512, options [nop,nop,TS val 251455538 ecr 251455538], length 0
2022-04-05 14:32:53.040883 IP (tos 0x0, ttl 64, id 20171, offset 0, flags [DF], proto TCP (6), length 569)
    127.0.0.1.59066 > 127.0.0.1.9550: Flags [P.], cksum 0x002e (incorrect -> 0x3f97), seq 14:531, ack 13, win 512, options [nop,nop,TS val 251455543 ecr 251455538], length 517
2022-04-05 14:32:53.040893 IP (tos 0x0, ttl 64, id 26363, offset 0, flags [DF], proto TCP (6), length 52)
    127.0.0.1.9550 > 127.0.0.1.59066: Flags [.], cksum 0xfe28 (incorrect -> 0xc3c8), seq 13, ack 531, win 508, options [nop,nop,TS val 251455543 ecr 251455543], length 0
2022-04-05 14:32:53.360632 IP (tos 0x0, ttl 64, id 26364, offset 0, flags [DF], proto TCP (6), length 3538)
    127.0.0.1.9550 > 127.0.0.1.59066: Flags [P.], cksum 0x0bc7 (incorrect -> 0x8cb1), seq 13:3499, ack 531, win 512, options [nop,nop,TS val 251455863 ecr 251455543], length 3486
2022-04-05 14:32:53.360642 IP (tos 0x0, ttl 64, id 20172, offset 0, flags [DF], proto TCP (6), length 52)
    127.0.0.1.59066 > 127.0.0.1.9550: Flags [.], cksum 0xfe28 (incorrect -> 0xb3b8), seq 531, ack 3499, win 494, options [nop,nop,TS val 251455863 ecr 251455863], length 0
2022-04-05 14:32:53.495171 IP (tos 0x0, ttl 64, id 26365, offset 0, flags [DF], proto TCP (6), length 1720)
    127.0.0.1.9550 > 127.0.0.1.59066: Flags [P.], cksum 0x04ad (incorrect -> 0x1159), seq 3499:5167, ack 531, win 512, options [nop,nop,TS val 251455998 ecr 251455863], length 1668
2022-04-05 14:32:53.495180 IP (tos 0x0, ttl 64, id 20173, offset 0, flags [DF], proto TCP (6), length 52)
    127.0.0.1.59066 > 127.0.0.1.9550: Flags [.], cksum 0xfe28 (incorrect -> 0xac1f), seq 531, ack 5167, win 501, options [nop,nop,TS val 251455998 ecr 251455998], length 0
2022-04-05 14:32:53.495677 IP (tos 0x0, ttl 64, id 20174, offset 0, flags [DF], proto TCP (6), length 132)
    127.0.0.1.59066 > 127.0.0.1.9550: Flags [P.], cksum 0xfe78 (incorrect -> 0x3c4b), seq 531:611, ack 5167, win 512, options [nop,nop,TS val 251455998 ecr 251455998], length 80
2022-04-05 14:32:53.495684 IP (tos 0x0, ttl 64, id 26366, offset 0, flags [DF], proto TCP (6), length 52)
    127.0.0.1.9550 > 127.0.0.1.59066: Flags [.], cksum 0xfe28 (incorrect -> 0xabc4), seq 5167, ack 611, win 512, options [nop,nop,TS val 251455998 ecr 251455998], length 0
2022-04-05 14:32:53.496056 IP (tos 0x0, ttl 64, id 20175, offset 0, flags [DF], proto TCP (6), length 311)
    127.0.0.1.59066 > 127.0.0.1.9550: Flags [P.], cksum 0xff2b (incorrect -> 0xbd35), seq 611:870, ack 5167, win 512, options [nop,nop,TS val 251455998 ecr 251455998], length 259
2022-04-05 14:32:53.496061 IP (tos 0x0, ttl 64, id 26367, offset 0, flags [DF], proto TCP (6), length 52)
    127.0.0.1.9550 > 127.0.0.1.59066: Flags [.], cksum 0xfe28 (incorrect -> 0xaac2), seq 5167, ack 870, win 510, options [nop,nop,TS val 251455999 ecr 251455998], length 0
2022-04-05 14:32:53.884993 IP (tos 0x0, ttl 64, id 26368, offset 0, flags [DF], proto TCP (6), length 610)
    127.0.0.1.9550 > 127.0.0.1.59066: Flags [P.], cksum 0x0057 (incorrect -> 0x18c0), seq 5167:5725, ack 870, win 512, options [nop,nop,TS val 251456387 ecr 251455998], length 558
2022-04-05 14:32:53.885003 IP (tos 0x0, ttl 64, id 20176, offset 0, flags [DF], proto TCP (6), length 52)
    127.0.0.1.59066 > 127.0.0.1.9550: Flags [.], cksum 0xfe28 (incorrect -> 0xa58d), seq 870, ack 5725, win 508, options [nop,nop,TS val 251456387 ecr 251456387], length 0
2022-04-05 14:32:53.897888 IP (tos 0x0, ttl 64, id 26369, offset 0, flags [DF], proto TCP (6), length 3538)
    127.0.0.1.9550 > 127.0.0.1.59066: Flags [P.], cksum 0x0bc7 (incorrect -> 0x15fa), seq 5725:9211, ack 870, win 512, options [nop,nop,TS val 251456400 ecr 251456387], length 3486
2022-04-05 14:32:53.897895 IP (tos 0x0, ttl 64, id 20177, offset 0, flags [DF], proto TCP (6), length 52)
    127.0.0.1.59066 > 127.0.0.1.9550: Flags [.], cksum 0xfe28 (incorrect -> 0x97e3), seq 870, ack 9211, win 494, options [nop,nop,TS val 251456400 ecr 251456400], length 0
2022-04-05 14:32:53.898732 IP (tos 0x0, ttl 64, id 26370, offset 0, flags [DF], proto TCP (6), length 1048)
    127.0.0.1.9550 > 127.0.0.1.59066: Flags [P.], cksum 0x020d (incorrect -> 0x37fb), seq 9211:10207, ack 870, win 512, options [nop,nop,TS val 251456401 ecr 251456400], length 996
2022-04-05 14:32:53.898738 IP (tos 0x0, ttl 64, id 20178, offset 0, flags [DF], proto TCP (6), length 52)
    127.0.0.1.59066 > 127.0.0.1.9550: Flags [.], cksum 0xfe28 (incorrect -> 0x93f3), seq 870, ack 10207, win 504, options [nop,nop,TS val 251456401 ecr 251456401], length 0
2022-04-05 14:32:53.912608 IP (tos 0x0, ttl 64, id 26371, offset 0, flags [DF], proto TCP (6), length 3040)
    127.0.0.1.9550 > 127.0.0.1.59066: Flags [P.], cksum 0x09d5 (incorrect -> 0x27c6), seq 10207:13195, ack 870, win 512, options [nop,nop,TS val 251456415 ecr 251456401], length 2988
2022-04-05 14:32:53.912615 IP (tos 0x0, ttl 64, id 20179, offset 0, flags [DF], proto TCP (6), length 52)
    127.0.0.1.59066 > 127.0.0.1.9550: Flags [.], cksum 0xfe28 (incorrect -> 0x8833), seq 870, ack 13195, win 496, options [nop,nop,TS val 251456415 ecr 251456415], length 0
2022-04-05 14:32:53.996427 IP (tos 0x0, ttl 64, id 26372, offset 0, flags [DF], proto TCP (6), length 3538)
    127.0.0.1.9550 > 127.0.0.1.59066: Flags [P.], cksum 0x0bc7 (incorrect -> 0x433e), seq 13195:16681, ack 870, win 512, options [nop,nop,TS val 251456499 ecr 251456415], length 3486
2022-04-05 14:32:53.996434 IP (tos 0x0, ttl 64, id 20180, offset 0, flags [DF], proto TCP (6), length 52)
    127.0.0.1.59066 > 127.0.0.1.9550: Flags [.], cksum 0xfe28 (incorrect -> 0x79ef), seq 870, ack 16681, win 494, options [nop,nop,TS val 251456499 ecr 251456499], length 0
2022-04-05 14:32:54.010204 IP (tos 0x0, ttl 64, id 26373, offset 0, flags [DF], proto TCP (6), length 201)
    127.0.0.1.9550 > 127.0.0.1.59066: Flags [P.], cksum 0xfebd (incorrect -> 0xb6d0), seq 16681:16830, ack 870, win 512, options [nop,nop,TS val 251456513 ecr 251456499], length 149
2022-04-05 14:32:54.010210 IP (tos 0x0, ttl 64, id 20181, offset 0, flags [DF], proto TCP (6), length 52)
    127.0.0.1.59066 > 127.0.0.1.9550: Flags [.], cksum 0xfe28 (incorrect -> 0x7931), seq 870, ack 16830, win 507, options [nop,nop,TS val 251456513 ecr 251456513], length 0
2022-04-05 14:32:54.048463 IP (tos 0x0, ttl 64, id 26374, offset 0, flags [DF], proto TCP (6), length 3446)
    127.0.0.1.9550 > 127.0.0.1.59066: Flags [P.], cksum 0x0b6b (incorrect -> 0xf05e), seq 16830:20224, ack 870, win 512, options [nop,nop,TS val 251456551 ecr 251456513], length 3394
2022-04-05 14:32:54.048470 IP (tos 0x0, ttl 64, id 20182, offset 0, flags [DF], proto TCP (6), length 52)
    127.0.0.1.59066 > 127.0.0.1.9550: Flags [.], cksum 0xfe28 (incorrect -> 0x6bb0), seq 870, ack 20224, win 494, options [nop,nop,TS val 251456551 ecr 251456551], length 0
2022-04-05 14:32:54.049049 IP (tos 0x0, ttl 64, id 26375, offset 0, flags [DF], proto TCP (6), length 2542)
    127.0.0.1.9550 > 127.0.0.1.59066: Flags [P.], cksum 0x07e3 (incorrect -> 0xbd3e), seq 20224:22714, ack 870, win 512, options [nop,nop,TS val 251456551 ecr 251456551], length 2490
2022-04-05 14:32:54.049055 IP (tos 0x0, ttl 64, id 20183, offset 0, flags [DF], proto TCP (6), length 52)
    127.0.0.1.59066 > 127.0.0.1.9550: Flags [.], cksum 0xfe28 (incorrect -> 0x61f2), seq 870, ack 22714, win 498, options [nop,nop,TS val 251456551 ecr 251456551], length 0
2022-04-05 14:32:54.052546 IP (tos 0x0, ttl 64, id 26376, offset 0, flags [DF], proto TCP (6), length 2044)
    127.0.0.1.9550 > 127.0.0.1.59066: Flags [P.], cksum 0x05f1 (incorrect -> 0x957b), seq 22714:24706, ack 870, win 512, options [nop,nop,TS val 251456555 ecr 251456551], length 1992
2022-04-05 14:32:54.052552 IP (tos 0x0, ttl 64, id 20184, offset 0, flags [DF], proto TCP (6), length 52)
    127.0.0.1.59066 > 127.0.0.1.9550: Flags [.], cksum 0xfe28 (incorrect -> 0x5a20), seq 870, ack 24706, win 500, options [nop,nop,TS val 251456555 ecr 251456555], length 0
2022-04-05 14:32:54.052690 IP (tos 0x0, ttl 64, id 26377, offset 0, flags [DF], proto TCP (6), length 3538)
    127.0.0.1.9550 > 127.0.0.1.59066: Flags [P.], cksum 0x0bc7 (incorrect -> 0x21aa), seq 24706:28192, ack 870, win 512, options [nop,nop,TS val 251456555 ecr 251456555], length 3486
2022-04-05 14:32:54.052695 IP (tos 0x0, ttl 64, id 20185, offset 0, flags [DF], proto TCP (6), length 52)
    127.0.0.1.59066 > 127.0.0.1.9550: Flags [.], cksum 0xfe28 (incorrect -> 0x4c88), seq 870, ack 28192, win 494, options [nop,nop,TS val 251456555 ecr 251456555], length 0
2022-04-05 14:32:54.060300 IP (tos 0x0, ttl 64, id 26378, offset 0, flags [DF], proto TCP (6), length 3760)
    127.0.0.1.9550 > 127.0.0.1.59066: Flags [P.], cksum 0x0ca5 (incorrect -> 0xaf9b), seq 28192:31900, ack 870, win 512, options [nop,nop,TS val 251456563 ecr 251456555], length 3708
2022-04-05 14:32:54.102661 IP (tos 0x0, ttl 64, id 20186, offset 0, flags [DF], proto TCP (6), length 52)
    127.0.0.1.59066 > 127.0.0.1.9550: Flags [.], cksum 0xfe28 (incorrect -> 0x3dc0), seq 870, ack 31900, win 512, options [nop,nop,TS val 251456605 ecr 251456563], length 0
2022-04-05 14:32:54.102669 IP (tos 0x0, ttl 64, id 26379, offset 0, flags [DF], proto TCP (6), length 4036)
    127.0.0.1.9550 > 127.0.0.1.59066: Flags [P.], cksum 0x0db9 (incorrect -> 0xe5bd), seq 31900:35884, ack 870, win 512, options [nop,nop,TS val 251456605 ecr 251456605], length 3984
2022-04-05 14:32:54.146664 IP (tos 0x0, ttl 64, id 20187, offset 0, flags [DF], proto TCP (6), length 52)
    127.0.0.1.59066 > 127.0.0.1.9550: Flags [.], cksum 0xfe28 (incorrect -> 0x2dda), seq 870, ack 35884, win 512, options [nop,nop,TS val 251456649 ecr 251456605], length 0
2022-04-05 14:32:54.146675 IP (tos 0x0, ttl 64, id 26380, offset 0, flags [DF], proto TCP (6), length 4036)
    127.0.0.1.9550 > 127.0.0.1.59066: Flags [P.], cksum 0x0db9 (incorrect -> 0x621e), seq 35884:39868, ack 870, win 512, options [nop,nop,TS val 251456649 ecr 251456649], length 3984
2022-04-05 14:32:54.190661 IP (tos 0x0, ttl 64, id 20188, offset 0, flags [DF], proto TCP (6), length 52)
    127.0.0.1.59066 > 127.0.0.1.9550: Flags [.], cksum 0xfe28 (incorrect -> 0x1df2), seq 870, ack 39868, win 512, options [nop,nop,TS val 251456693 ecr 251456649], length 0
2022-04-05 14:32:54.190674 IP (tos 0x0, ttl 64, id 26381, offset 0, flags [DF], proto TCP (6), length 5974)
    127.0.0.1.9550 > 127.0.0.1.59066: Flags [P.], cksum 0x154b (incorrect -> 0xeb97), seq 39868:45790, ack 870, win 512, options [nop,nop,TS val 251456693 ecr 251456693], length 5922
2022-04-05 14:32:54.225776 IP (tos 0x0, ttl 64, id 26382, offset 0, flags [DF], proto TCP (6), length 32820)
    127.0.0.1.9550 > 127.0.0.1.59066: Flags [.], cksum 0x7e29 (incorrect -> 0xcaa6), seq 45790:78558, ack 870, win 512, options [nop,nop,TS val 251456728 ecr 251456693], length 32768
2022-04-05 14:32:54.225789 IP (tos 0x0, ttl 64, id 20189, offset 0, flags [DF], proto TCP (6), length 52)
    127.0.0.1.59066 > 127.0.0.1.9550: Flags [.], cksum 0xfe28 (incorrect -> 0x8705), seq 870, ack 78558, win 379, options [nop,nop,TS val 251456728 ecr 251456693], length 0
2022-04-05 14:32:54.225799 IP (tos 0x0, ttl 64, id 26383, offset 0, flags [DF], proto TCP (6), length 3400)
    127.0.0.1.9550 > 127.0.0.1.59066: Flags [P.], cksum 0x0b3d (incorrect -> 0xf0cb), seq 78558:81906, ack 870, win 512, options [nop,nop,TS val 251456728 ecr 251456728], length 3348
2022-04-05 14:32:54.227289 IP (tos 0x0, ttl 64, id 20190, offset 0, flags [DF], proto TCP (6), length 52)
    127.0.0.1.59066 > 127.0.0.1.9550: Flags [.], cksum 0xfe28 (incorrect -> 0x7947), seq 870, ack 81906, win 512, options [nop,nop,TS val 251456730 ecr 251456728], length 0
2022-04-05 14:32:54.227298 IP (tos 0x0, ttl 64, id 26384, offset 0, flags [DF], proto TCP (6), length 3538)
    127.0.0.1.9550 > 127.0.0.1.59066: Flags [P.], cksum 0x0bc7 (incorrect -> 0x3d30), seq 81906:85392, ack 870, win 512, options [nop,nop,TS val 251456730 ecr 251456730], length 3486
2022-04-05 14:32:54.227447 IP (tos 0x0, ttl 64, id 20191, offset 0, flags [DF], proto TCP (6), length 52)
    127.0.0.1.59066 > 127.0.0.1.9550: Flags [.], cksum 0xfe28 (incorrect -> 0x6ba7), seq 870, ack 85392, win 512, options [nop,nop,TS val 251456730 ecr 251456730], length 0
2022-04-05 14:32:54.227844 IP (tos 0x0, ttl 64, id 26385, offset 0, flags [DF], proto TCP (6), length 550)
    127.0.0.1.9550 > 127.0.0.1.59066: Flags [P.], cksum 0x001b (incorrect -> 0xa944), seq 85392:85890, ack 870, win 512, options [nop,nop,TS val 251456730 ecr 251456730], length 498
2022-04-05 14:32:54.227877 IP (tos 0x0, ttl 64, id 20192, offset 0, flags [DF], proto TCP (6), length 52)
    127.0.0.1.59066 > 127.0.0.1.9550: Flags [.], cksum 0xfe28 (incorrect -> 0x69b5), seq 870, ack 85890, win 512, options [nop,nop,TS val 251456730 ecr 251456730], length 0
2022-04-05 14:32:54.252853 IP (tos 0x0, ttl 64, id 26386, offset 0, flags [DF], proto TCP (6), length 4036)
    127.0.0.1.9550 > 127.0.0.1.59066: Flags [P.], cksum 0x0db9 (incorrect -> 0x2fd0), seq 85890:89874, ack 870, win 512, options [nop,nop,TS val 251456755 ecr 251456730], length 3984
2022-04-05 14:32:54.253183 IP (tos 0x0, ttl 64, id 20193, offset 0, flags [DF], proto TCP (6), length 52)
    127.0.0.1.59066 > 127.0.0.1.9550: Flags [.], cksum 0xfe28 (incorrect -> 0x59f2), seq 870, ack 89874, win 512, options [nop,nop,TS val 251456756 ecr 251456755], length 0
2022-04-05 14:32:54.271677 IP (tos 0x0, ttl 64, id 26387, offset 0, flags [DF], proto TCP (6), length 3300)
    127.0.0.1.9550 > 127.0.0.1.59066: Flags [P.], cksum 0x0ad9 (incorrect -> 0xe5bc), seq 89874:93122, ack 870, win 512, options [nop,nop,TS val 251456774 ecr 251456756], length 3248
2022-04-05 14:32:54.271904 IP (tos 0x0, ttl 64, id 20194, offset 0, flags [DF], proto TCP (6), length 52)
    127.0.0.1.59066 > 127.0.0.1.9550: Flags [.], cksum 0xfe28 (incorrect -> 0x4d1d), seq 870, ack 93122, win 512, options [nop,nop,TS val 251456774 ecr 251456774], length 0
2022-04-05 14:32:54.273751 IP (tos 0x0, ttl 64, id 26388, offset 0, flags [DF], proto TCP (6), length 4036)
    127.0.0.1.9550 > 127.0.0.1.59066: Flags [P.], cksum 0x0db9 (incorrect -> 0x0eca), seq 93122:97106, ack 870, win 512, options [nop,nop,TS val 251456776 ecr 251456774], length 3984
2022-04-05 14:32:54.273922 IP (tos 0x0, ttl 64, id 20195, offset 0, flags [DF], proto TCP (6), length 52)
    127.0.0.1.59066 > 127.0.0.1.9550: Flags [.], cksum 0xfe28 (incorrect -> 0x3d89), seq 870, ack 97106, win 512, options [nop,nop,TS val 251456776 ecr 251456776], length 0
2022-04-05 14:32:54.282385 IP (tos 0x0, ttl 64, id 26389, offset 0, flags [DF], proto TCP (6), length 1546)
    127.0.0.1.9550 > 127.0.0.1.59066: Flags [P.], cksum 0x03ff (incorrect -> 0xf650), seq 97106:98600, ack 870, win 512, options [nop,nop,TS val 251456785 ecr 251456776], length 1494
2022-04-05 14:32:54.282411 IP (tos 0x0, ttl 64, id 20196, offset 0, flags [DF], proto TCP (6), length 52)
    127.0.0.1.59066 > 127.0.0.1.9550: Flags [.], cksum 0xfe28 (incorrect -> 0x37a1), seq 870, ack 98600, win 512, options [nop,nop,TS val 251456785 ecr 251456785], length 0
2022-04-05 14:32:54.285465 IP (tos 0x0, ttl 64, id 26390, offset 0, flags [DF], proto TCP (6), length 3040)
    127.0.0.1.9550 > 127.0.0.1.59066: Flags [P.], cksum 0x09d5 (incorrect -> 0x13da), seq 98600:101588, ack 870, win 512, options [nop,nop,TS val 251456788 ecr 251456785], length 2988
2022-04-05 14:32:54.285654 IP (tos 0x0, ttl 64, id 20197, offset 0, flags [DF], proto TCP (6), length 52)
    127.0.0.1.59066 > 127.0.0.1.9550: Flags [.], cksum 0xfe28 (incorrect -> 0x2bef), seq 870, ack 101588, win 512, options [nop,nop,TS val 251456788 ecr 251456788], length 0
2022-04-05 14:32:54.328202 IP (tos 0x0, ttl 64, id 26391, offset 0, flags [DF], proto TCP (6), length 2174)
    127.0.0.1.9550 > 127.0.0.1.59066: Flags [P.], cksum 0x0673 (incorrect -> 0x4fe1), seq 101588:103710, ack 870, win 512, options [nop,nop,TS val 251456831 ecr 251456788], length 2122
2022-04-05 14:32:54.328317 IP (tos 0x0, ttl 64, id 20198, offset 0, flags [DF], proto TCP (6), length 52)
    127.0.0.1.59066 > 127.0.0.1.9550: Flags [.], cksum 0xfe28 (incorrect -> 0x234f), seq 870, ack 103710, win 512, options [nop,nop,TS val 251456831 ecr 251456831], length 0
2022-04-05 14:32:54.353349 IP (tos 0x0, ttl 64, id 26392, offset 0, flags [DF], proto TCP (6), length 3538)
    127.0.0.1.9550 > 127.0.0.1.59066: Flags [P.], cksum 0x0bc7 (incorrect -> 0x89c2), seq 103710:107196, ack 870, win 512, options [nop,nop,TS val 251456856 ecr 251456831], length 3486
2022-04-05 14:32:54.353488 IP (tos 0x0, ttl 64, id 20199, offset 0, flags [DF], proto TCP (6), length 52)
    127.0.0.1.59066 > 127.0.0.1.9550: Flags [.], cksum 0xfe28 (incorrect -> 0x157f), seq 870, ack 107196, win 512, options [nop,nop,TS val 251456856 ecr 251456856], length 0
2022-04-05 14:32:54.364834 IP (tos 0x0, ttl 64, id 26393, offset 0, flags [DF], proto TCP (6), length 2044)
    127.0.0.1.9550 > 127.0.0.1.59066: Flags [P.], cksum 0x05f1 (incorrect -> 0xba2e), seq 107196:109188, ack 870, win 512, options [nop,nop,TS val 251456867 ecr 251456856], length 1992
2022-04-05 14:32:54.365010 IP (tos 0x0, ttl 64, id 20200, offset 0, flags [DF], proto TCP (6), length 52)
    127.0.0.1.59066 > 127.0.0.1.9550: Flags [.], cksum 0xfe28 (incorrect -> 0x0da1), seq 870, ack 109188, win 512, options [nop,nop,TS val 251456867 ecr 251456867], length 0
2022-04-05 14:32:54.365014 IP (tos 0x0, ttl 64, id 26394, offset 0, flags [DF], proto TCP (6), length 3538)
    127.0.0.1.9550 > 127.0.0.1.59066: Flags [P.], cksum 0x0bc7 (incorrect -> 0xb233), seq 109188:112674, ack 870, win 512, options [nop,nop,TS val 251456867 ecr 251456867], length 3486
2022-04-05 14:32:54.365187 IP (tos 0x0, ttl 64, id 20201, offset 0, flags [DF], proto TCP (6), length 52)
    127.0.0.1.59066 > 127.0.0.1.9550: Flags [.], cksum 0xfe28 (incorrect -> 0x0002), seq 870, ack 112674, win 512, options [nop,nop,TS val 251456868 ecr 251456867], length 0
2022-04-05 14:32:54.365244 IP (tos 0x0, ttl 64, id 26395, offset 0, flags [DF], proto TCP (6), length 4100)
    127.0.0.1.9550 > 127.0.0.1.59066: Flags [P.], cksum 0x0df9 (incorrect -> 0xe2da), seq 112674:116722, ack 870, win 512, options [nop,nop,TS val 251456868 ecr 251456868], length 4048
2022-04-05 14:32:54.365410 IP (tos 0x0, ttl 64, id 20202, offset 0, flags [DF], proto TCP (6), length 52)
    127.0.0.1.59066 > 127.0.0.1.9550: Flags [.], cksum 0xfe28 (incorrect -> 0xf030), seq 870, ack 116722, win 512, options [nop,nop,TS val 251456868 ecr 251456868], length 0
2022-04-05 14:32:54.365415 IP (tos 0x0, ttl 64, id 26396, offset 0, flags [DF], proto TCP (6), length 8086)
    127.0.0.1.9550 > 127.0.0.1.59066: Flags [P.], cksum 0x1d8b (incorrect -> 0xd008), seq 116722:124756, ack 870, win 512, options [nop,nop,TS val 251456868 ecr 251456868], length 8034
2022-04-05 14:32:54.365662 IP (tos 0x0, ttl 64, id 20203, offset 0, flags [DF], proto TCP (6), length 52)
    127.0.0.1.59066 > 127.0.0.1.9550: Flags [.], cksum 0xfe28 (incorrect -> 0xd0ce), seq 870, ack 124756, win 512, options [nop,nop,TS val 251456868 ecr 251456868], length 0
2022-04-05 14:32:54.366495 IP (tos 0x0, ttl 64, id 26397, offset 0, flags [DF], proto TCP (6), length 2542)
    127.0.0.1.9550 > 127.0.0.1.59066: Flags [P.], cksum 0x07e3 (incorrect -> 0xd9b3), seq 124756:127246, ack 870, win 512, options [nop,nop,TS val 251456869 ecr 251456868], length 2490
2022-04-05 14:32:54.366627 IP (tos 0x0, ttl 64, id 20204, offset 0, flags [DF], proto TCP (6), length 52)
    127.0.0.1.59066 > 127.0.0.1.9550: Flags [.], cksum 0xfe28 (incorrect -> 0xc712), seq 870, ack 127246, win 512, options [nop,nop,TS val 251456869 ecr 251456869], length 0
2022-04-05 14:32:54.366632 IP (tos 0x0, ttl 64, id 26398, offset 0, flags [DF], proto TCP (6), length 3538)
    127.0.0.1.9550 > 127.0.0.1.59066: Flags [P.], cksum 0x0bc7 (incorrect -> 0x1162), seq 127246:130732, ack 870, win 512, options [nop,nop,TS val 251456869 ecr 251456869], length 3486
2022-04-05 14:32:54.366727 IP (tos 0x0, ttl 64, id 20205, offset 0, flags [DF], proto TCP (6), length 52)
    127.0.0.1.59066 > 127.0.0.1.9550: Flags [.], cksum 0xfe28 (incorrect -> 0xb974), seq 870, ack 130732, win 512, options [nop,nop,TS val 251456869 ecr 251456869], length 0
200, 5.8414716720581055, 1.7324292659759521