2022-04-05 02:19:20.831628 IP (tos 0x0, ttl 64, id 9250, offset 0, flags [DF], proto TCP (6), length 60)
    127.0.0.1.51538 > 127.0.0.1.10450: Flags [S], cksum 0xfe30 (incorrect -> 0x54db), seq 300568013, win 65495, options [mss 65495,sackOK,TS val 762805203 ecr 0,nop,wscale 7], length 0
2022-04-05 02:19:20.831646 IP (tos 0x0, ttl 64, id 0, offset 0, flags [DF], proto TCP (6), length 60)
    127.0.0.1.10450 > 127.0.0.1.51538: Flags [S.], cksum 0xfe30 (incorrect -> 0xdda2), seq 537701852, ack 300568014, win 65483, options [mss 65495,sackOK,TS val 762805203 ecr 762805203,nop,wscale 7], length 0
2022-04-05 02:19:20.831660 IP (tos 0x0, ttl 64, id 9251, offset 0, flags [DF], proto TCP (6), length 52)
    127.0.0.1.51538 > 127.0.0.1.10450: Flags [.], cksum 0xfe28 (incorrect -> 0x045f), seq 1, ack 1, win 512, options [nop,nop,TS val 762805203 ecr 762805203], length 0
2022-04-05 02:19:20.831784 IP (tos 0x0, ttl 64, id 9252, offset 0, flags [DF], proto TCP (6), length 55)
    127.0.0.1.51538 > 127.0.0.1.10450: Flags [P.], cksum 0xfe2b (incorrect -> 0xff52), seq 1:4, ack 1, win 512, options [nop,nop,TS val 762805203 ecr 762805203], length 3
2022-04-05 02:19:20.831799 IP (tos 0x0, ttl 64, id 37353, offset 0, flags [DF], proto TCP (6), length 52)
    127.0.0.1.10450 > 127.0.0.1.51538: Flags [.], cksum 0xfe28 (incorrect -> 0x045c), seq 1, ack 4, win 512, options [nop,nop,TS val 762805203 ecr 762805203], length 0
2022-04-05 02:19:20.831836 IP (tos 0x0, ttl 64, id 37354, offset 0, flags [DF], proto TCP (6), length 54)
    127.0.0.1.10450 > 127.0.0.1.51538: Flags [P.], cksum 0xfe2a (incorrect -> 0xff51), seq 1:3, ack 4, win 512, options [nop,nop,TS val 762805203 ecr 762805203], length 2
2022-04-05 02:19:20.831850 IP (tos 0x0, ttl 64, id 9253, offset 0, flags [DF], proto TCP (6), length 52)
    127.0.0.1.51538 > 127.0.0.1.10450: Flags [.], cksum 0xfe28 (incorrect -> 0x045a), seq 4, ack 3, win 512, options [nop,nop,TS val 762805203 ecr 762805203], length 0
2022-04-05 02:19:20.862504 IP (tos 0x0, ttl 64, id 9254, offset 0, flags [DF], proto TCP (6), length 62)
    127.0.0.1.51538 > 127.0.0.1.10450: Flags [P.], cksum 0xfe32 (incorrect -> 0x2d1e), seq 4:14, ack 3, win 512, options [nop,nop,TS val 762805234 ecr 762805203], length 10
2022-04-05 02:19:20.862521 IP (tos 0x0, ttl 64, id 37355, offset 0, flags [DF], proto TCP (6), length 52)
    127.0.0.1.10450 > 127.0.0.1.51538: Flags [.], cksum 0xfe28 (incorrect -> 0x0412), seq 3, ack 14, win 512, options [nop,nop,TS val 762805234 ecr 762805234], length 0
2022-04-05 02:19:21.135292 IP (tos 0x0, ttl 64, id 37356, offset 0, flags [DF], proto TCP (6), length 62)
    127.0.0.1.10450 > 127.0.0.1.51538: Flags [P.], cksum 0xfe32 (incorrect -> 0xfdee), seq 3:13, ack 14, win 512, options [nop,nop,TS val 762805506 ecr 762805234], length 10
2022-04-05 02:19:21.135306 IP (tos 0x0, ttl 64, id 9255, offset 0, flags [DF], proto TCP (6), length 52)
    127.0.0.1.51538 > 127.0.0.1.10450: Flags [.], cksum 0xfe28 (incorrect -> 0x01e8), seq 14, ack 13, win 512, options [nop,nop,TS val 762805506 ecr 762805506], length 0
2022-04-05 02:19:21.141842 IP (tos 0x0, ttl 64, id 9256, offset 0, flags [DF], proto TCP (6), length 569)
    127.0.0.1.51538 > 127.0.0.1.10450: Flags [P.], cksum 0x002e (incorrect -> 0x7766), seq 14:531, ack 13, win 512, options [nop,nop,TS val 762805513 ecr 762805506], length 517
2022-04-05 02:19:21.141853 IP (tos 0x0, ttl 64, id 37357, offset 0, flags [DF], proto TCP (6), length 52)
    127.0.0.1.10450 > 127.0.0.1.51538: Flags [.], cksum 0xfe28 (incorrect -> 0xffd8), seq 13, ack 531, win 508, options [nop,nop,TS val 762805513 ecr 762805513], length 0
