2022-04-06 01:25:59.163168 IP (tos 0x0, ttl 64, id 29446, offset 0, flags [DF], proto TCP (6), length 60)
    127.0.0.1.45304 > 127.0.0.1.10650: Flags [S], cksum 0xfe30 (incorrect -> 0x074e), seq 2589322102, win 65495, options [mss 65495,sackOK,TS val 290641666 ecr 0,nop,wscale 7], length 0
2022-04-06 01:25:59.163180 IP (tos 0x0, ttl 64, id 0, offset 0, flags [DF], proto TCP (6), length 60)
    127.0.0.1.10650 > 127.0.0.1.45304: Flags [S.], cksum 0xfe30 (incorrect -> 0xa0c1), seq 2954415641, ack 2589322103, win 65483, options [mss 65495,sackOK,TS val 290641666 ecr 290641666,nop,wscale 7], length 0
2022-04-06 01:25:59.163190 IP (tos 0x0, ttl 64, id 29447, offset 0, flags [DF], proto TCP (6), length 52)
    127.0.0.1.45304 > 127.0.0.1.10650: Flags [.], cksum 0xfe28 (incorrect -> 0xc77d), seq 1, ack 1, win 512, options [nop,nop,TS val 290641666 ecr 290641666], length 0
2022-04-06 01:25:59.163313 IP (tos 0x0, ttl 64, id 29448, offset 0, flags [DF], proto TCP (6), length 55)
    127.0.0.1.45304 > 127.0.0.1.10650: Flags [P.], cksum 0xfe2b (incorrect -> 0xc271), seq 1:4, ack 1, win 512, options [nop,nop,TS val 290641666 ecr 290641666], length 3
2022-04-06 01:25:59.163330 IP (tos 0x0, ttl 64, id 15824, offset 0, flags [DF], proto TCP (6), length 52)
    127.0.0.1.10650 > 127.0.0.1.45304: Flags [.], cksum 0xfe28 (incorrect -> 0xc77a), seq 1, ack 4, win 512, options [nop,nop,TS val 290641666 ecr 290641666], length 0
2022-04-06 01:25:59.163376 IP (tos 0x0, ttl 64, id 15825, offset 0, flags [DF], proto TCP (6), length 54)
    127.0.0.1.10650 > 127.0.0.1.45304: Flags [P.], cksum 0xfe2a (incorrect -> 0xc270), seq 1:3, ack 4, win 512, options [nop,nop,TS val 290641666 ecr 290641666], length 2
2022-04-06 01:25:59.163394 IP (tos 0x0, ttl 64, id 29449, offset 0, flags [DF], proto TCP (6), length 52)
    127.0.0.1.45304 > 127.0.0.1.10650: Flags [.], cksum 0xfe28 (incorrect -> 0xc778), seq 4, ack 3, win 512, options [nop,nop,TS val 290641666 ecr 290641666], length 0
2022-04-06 01:25:59.186305 IP (tos 0x0, ttl 64, id 29450, offset 0, flags [DF], proto TCP (6), length 62)
    127.0.0.1.45304 > 127.0.0.1.10650: Flags [P.], cksum 0xfe32 (incorrect -> 0x1fc0), seq 4:14, ack 3, win 512, options [nop,nop,TS val 290641689 ecr 290641666], length 10
2022-04-06 01:25:59.186324 IP (tos 0x0, ttl 64, id 15826, offset 0, flags [DF], proto TCP (6), length 52)
    127.0.0.1.10650 > 127.0.0.1.45304: Flags [.], cksum 0xfe28 (incorrect -> 0xc740), seq 3, ack 14, win 512, options [nop,nop,TS val 290641689 ecr 290641689], length 0
2022-04-06 01:25:59.292369 IP (tos 0x0, ttl 64, id 15827, offset 0, flags [DF], proto TCP (6), length 62)
    127.0.0.1.10650 > 127.0.0.1.45304: Flags [P.], cksum 0xfe32 (incorrect -> 0xc1c3), seq 3:13, ack 14, win 512, options [nop,nop,TS val 290641795 ecr 290641689], length 10
2022-04-06 01:25:59.292378 IP (tos 0x0, ttl 64, id 29451, offset 0, flags [DF], proto TCP (6), length 52)
    127.0.0.1.45304 > 127.0.0.1.10650: Flags [.], cksum 0xfe28 (incorrect -> 0xc662), seq 14, ack 13, win 512, options [nop,nop,TS val 290641795 ecr 290641795], length 0
2022-04-06 01:25:59.298166 IP (tos 0x0, ttl 64, id 29452, offset 0, flags [DF], proto TCP (6), length 569)
    127.0.0.1.45304 > 127.0.0.1.10650: Flags [P.], cksum 0x002e (incorrect -> 0xce1c), seq 14:531, ack 13, win 512, options [nop,nop,TS val 290641801 ecr 290641795], length 517
2022-04-06 01:25:59.298184 IP (tos 0x0, ttl 64, id 15828, offset 0, flags [DF], proto TCP (6), length 52)
    127.0.0.1.10650 > 127.0.0.1.45304: Flags [.], cksum 0xfe28 (incorrect -> 0xc455), seq 13, ack 531, win 508, options [nop,nop,TS val 290641801 ecr 290641801], length 0
200, 19.02717399597168, 0.5491104125976562