2022-04-06 14:04:47.816093 IP (tos 0x0, ttl 64, id 27180, offset 0, flags [DF], proto TCP (6), length 60)
    127.0.0.1.50052 > 127.0.0.1.10950: Flags [S], cksum 0xfe30 (incorrect -> 0xf0bb), seq 2610836484, win 65495, options [mss 65495,sackOK,TS val 336170319 ecr 0,nop,wscale 7], length 0
2022-04-06 14:04:47.816114 IP (tos 0x0, ttl 64, id 0, offset 0, flags [DF], proto TCP (6), length 60)
    127.0.0.1.10950 > 127.0.0.1.50052: Flags [S.], cksum 0xfe30 (incorrect -> 0x664e), seq 1447137998, ack 2610836485, win 65483, options [mss 65495,sackOK,TS val 336170319 ecr 336170319,nop,wscale 7], length 0
2022-04-06 14:04:47.816129 IP (tos 0x0, ttl 64, id 27181, offset 0, flags [DF], proto TCP (6), length 52)
    127.0.0.1.50052 > 127.0.0.1.10950: Flags [.], cksum 0xfe28 (incorrect -> 0x8d0a), seq 1, ack 1, win 512, options [nop,nop,TS val 336170319 ecr 336170319], length 0
2022-04-06 14:04:47.816243 IP (tos 0x0, ttl 64, id 27182, offset 0, flags [DF], proto TCP (6), length 55)
    127.0.0.1.50052 > 127.0.0.1.10950: Flags [P.], cksum 0xfe2b (incorrect -> 0x87fe), seq 1:4, ack 1, win 512, options [nop,nop,TS val 336170319 ecr 336170319], length 3
2022-04-06 14:04:47.816253 IP (tos 0x0, ttl 64, id 6901, offset 0, flags [DF], proto TCP (6), length 52)
    127.0.0.1.10950 > 127.0.0.1.50052: Flags [.], cksum 0xfe28 (incorrect -> 0x8d07), seq 1, ack 4, win 512, options [nop,nop,TS val 336170319 ecr 336170319], length 0
2022-04-06 14:04:47.816302 IP (tos 0x0, ttl 64, id 6902, offset 0, flags [DF], proto TCP (6), length 54)
    127.0.0.1.10950 > 127.0.0.1.50052: Flags [P.], cksum 0xfe2a (incorrect -> 0x87fd), seq 1:3, ack 4, win 512, options [nop,nop,TS val 336170319 ecr 336170319], length 2
2022-04-06 14:04:47.816320 IP (tos 0x0, ttl 64, id 27183, offset 0, flags [DF], proto TCP (6), length 52)
    127.0.0.1.50052 > 127.0.0.1.10950: Flags [.], cksum 0xfe28 (incorrect -> 0x8d05), seq 4, ack 3, win 512, options [nop,nop,TS val 336170319 ecr 336170319], length 0
2022-04-06 14:04:47.818131 IP (tos 0x0, ttl 64, id 27184, offset 0, flags [DF], proto TCP (6), length 62)
    127.0.0.1.50052 > 127.0.0.1.10950: Flags [P.], cksum 0xfe32 (incorrect -> 0x33a4), seq 4:14, ack 3, win 512, options [nop,nop,TS val 336170321 ecr 336170319], length 10
2022-04-06 14:04:47.818138 IP (tos 0x0, ttl 64, id 6903, offset 0, flags [DF], proto TCP (6), length 52)
    127.0.0.1.10950 > 127.0.0.1.50052: Flags [.], cksum 0xfe28 (incorrect -> 0x8cf7), seq 3, ack 14, win 512, options [nop,nop,TS val 336170321 ecr 336170321], length 0
2022-04-06 14:04:47.918821 IP (tos 0x0, ttl 64, id 6904, offset 0, flags [DF], proto TCP (6), length 62)
    127.0.0.1.10950 > 127.0.0.1.50052: Flags [P.], cksum 0xfe32 (incorrect -> 0x8780), seq 3:13, ack 14, win 512, options [nop,nop,TS val 336170421 ecr 336170321], length 10
2022-04-06 14:04:47.918827 IP (tos 0x0, ttl 64, id 27185, offset 0, flags [DF], proto TCP (6), length 52)
    127.0.0.1.50052 > 127.0.0.1.10950: Flags [.], cksum 0xfe28 (incorrect -> 0x8c25), seq 14, ack 13, win 512, options [nop,nop,TS val 336170421 ecr 336170421], length 0
2022-04-06 14:04:47.924898 IP (tos 0x0, ttl 64, id 27186, offset 0, flags [DF], proto TCP (6), length 569)
    127.0.0.1.50052 > 127.0.0.1.10950: Flags [P.], cksum 0x002e (incorrect -> 0x7074), seq 14:531, ack 13, win 512, options [nop,nop,TS val 336170427 ecr 336170421], length 517
2022-04-06 14:04:47.924905 IP (tos 0x0, ttl 64, id 6905, offset 0, flags [DF], proto TCP (6), length 52)
    127.0.0.1.10950 > 127.0.0.1.50052: Flags [.], cksum 0xfe28 (incorrect -> 0x8a18), seq 13, ack 531, win 508, options [nop,nop,TS val 336170427 ecr 336170427], length 0
200, 11.214693307876587, 0.5250375270843506