2022-04-06 01:34:36.509992 IP (tos 0x0, ttl 64, id 57464, offset 0, flags [DF], proto TCP (6), length 60)
    127.0.0.1.47134 > 127.0.0.1.9650: Flags [S], cksum 0xfe30 (incorrect -> 0x5dc5), seq 3399908486, win 65495, options [mss 65495,sackOK,TS val 291159012 ecr 0,nop,wscale 7], length 0
2022-04-06 01:34:36.510003 IP (tos 0x0, ttl 64, id 0, offset 0, flags [DF], proto TCP (6), length 60)
    127.0.0.1.9650 > 127.0.0.1.47134: Flags [S.], cksum 0xfe30 (incorrect -> 0xfa54), seq 2849827919, ack 3399908487, win 65483, options [mss 65495,sackOK,TS val 291159012 ecr 291159012,nop,wscale 7], length 0
2022-04-06 01:34:36.510013 IP (tos 0x0, ttl 64, id 57465, offset 0, flags [DF], proto TCP (6), length 52)
    127.0.0.1.47134 > 127.0.0.1.9650: Flags [.], cksum 0xfe28 (incorrect -> 0x2111), seq 1, ack 1, win 512, options [nop,nop,TS val 291159012 ecr 291159012], length 0
2022-04-06 01:34:36.510114 IP (tos 0x0, ttl 64, id 57466, offset 0, flags [DF], proto TCP (6), length 55)
    127.0.0.1.47134 > 127.0.0.1.9650: Flags [P.], cksum 0xfe2b (incorrect -> 0x1c04), seq 1:4, ack 1, win 512, options [nop,nop,TS val 291159013 ecr 291159012], length 3
2022-04-06 01:34:36.510127 IP (tos 0x0, ttl 64, id 57132, offset 0, flags [DF], proto TCP (6), length 52)
    127.0.0.1.9650 > 127.0.0.1.47134: Flags [.], cksum 0xfe28 (incorrect -> 0x210c), seq 1, ack 4, win 512, options [nop,nop,TS val 291159013 ecr 291159013], length 0
2022-04-06 01:34:36.510203 IP (tos 0x0, ttl 64, id 57133, offset 0, flags [DF], proto TCP (6), length 54)
    127.0.0.1.9650 > 127.0.0.1.47134: Flags [P.], cksum 0xfe2a (incorrect -> 0x1c02), seq 1:3, ack 4, win 512, options [nop,nop,TS val 291159013 ecr 291159013], length 2
2022-04-06 01:34:36.510217 IP (tos 0x0, ttl 64, id 57467, offset 0, flags [DF], proto TCP (6), length 52)
    127.0.0.1.47134 > 127.0.0.1.9650: Flags [.], cksum 0xfe28 (incorrect -> 0x210a), seq 4, ack 3, win 512, options [nop,nop,TS val 291159013 ecr 291159013], length 0
2022-04-06 01:34:36.512433 IP (tos 0x0, ttl 64, id 57468, offset 0, flags [DF], proto TCP (6), length 62)
    127.0.0.1.47134 > 127.0.0.1.9650: Flags [P.], cksum 0xfe32 (incorrect -> 0xe2bf), seq 4:14, ack 3, win 512, options [nop,nop,TS val 291159015 ecr 291159013], length 10
2022-04-06 01:34:36.512447 IP (tos 0x0, ttl 64, id 57134, offset 0, flags [DF], proto TCP (6), length 52)
    127.0.0.1.9650 > 127.0.0.1.47134: Flags [.], cksum 0xfe28 (incorrect -> 0x20fc), seq 3, ack 14, win 512, options [nop,nop,TS val 291159015 ecr 291159015], length 0
2022-04-06 01:34:36.555657 IP (tos 0x0, ttl 64, id 57135, offset 0, flags [DF], proto TCP (6), length 62)
    127.0.0.1.9650 > 127.0.0.1.47134: Flags [P.], cksum 0xfe32 (incorrect -> 0x1bbe), seq 3:13, ack 14, win 512, options [nop,nop,TS val 291159058 ecr 291159015], length 10
2022-04-06 01:34:36.555666 IP (tos 0x0, ttl 64, id 57469, offset 0, flags [DF], proto TCP (6), length 52)
    127.0.0.1.47134 > 127.0.0.1.9650: Flags [.], cksum 0xfe28 (incorrect -> 0x209c), seq 14, ack 13, win 512, options [nop,nop,TS val 291159058 ecr 291159058], length 0
2022-04-06 01:34:36.562017 IP (tos 0x0, ttl 64, id 57470, offset 0, flags [DF], proto TCP (6), length 569)
    127.0.0.1.47134 > 127.0.0.1.9650: Flags [P.], cksum 0x002e (incorrect -> 0x2467), seq 14:531, ack 13, win 512, options [nop,nop,TS val 291159064 ecr 291159058], length 517
2022-04-06 01:34:36.562029 IP (tos 0x0, ttl 64, id 57136, offset 0, flags [DF], proto TCP (6), length 52)
    127.0.0.1.9650 > 127.0.0.1.47134: Flags [.], cksum 0xfe28 (incorrect -> 0x1e8f), seq 13, ack 531, win 508, options [nop,nop,TS val 291159064 ecr 291159064], length 0
2022-04-06 01:34:36.603804 IP (tos 0x0, ttl 64, id 57137, offset 0, flags [DF], proto TCP (6), length 3538)
    127.0.0.1.9650 > 127.0.0.1.47134: Flags [P.], cksum 0x0bc7 (incorrect -> 0xd16b), seq 13:3499, ack 531, win 512, options [nop,nop,TS val 291159106 ecr 291159064], length 3486
2022-04-06 01:34:36.603815 IP (tos 0x0, ttl 64, id 57471, offset 0, flags [DF], proto TCP (6), length 52)
    127.0.0.1.47134 > 127.0.0.1.9650: Flags [.], cksum 0xfe28 (incorrect -> 0x10ab), seq 531, ack 3499, win 494, options [nop,nop,TS val 291159106 ecr 291159106], length 0
2022-04-06 01:34:36.616374 IP (tos 0x0, ttl 64, id 57138, offset 0, flags [DF], proto TCP (6), length 567)
    127.0.0.1.9650 > 127.0.0.1.47134: Flags [P.], cksum 0x002c (incorrect -> 0x5749), seq 3499:4014, ack 531, win 512, options [nop,nop,TS val 291159119 ecr 291159106], length 515
2022-04-06 01:34:36.616382 IP (tos 0x0, ttl 64, id 57472, offset 0, flags [DF], proto TCP (6), length 52)
    127.0.0.1.47134 > 127.0.0.1.9650: Flags [.], cksum 0xfe28 (incorrect -> 0x0e83), seq 531, ack 4014, win 505, options [nop,nop,TS val 291159119 ecr 291159119], length 0
2022-04-06 01:34:36.618780 IP (tos 0x0, ttl 64, id 57473, offset 0, flags [DF], proto TCP (6), length 210)
    127.0.0.1.47134 > 127.0.0.1.9650: Flags [P.], cksum 0xfec6 (incorrect -> 0x9bf7), seq 531:689, ack 4014, win 512, options [nop,nop,TS val 291159121 ecr 291159119], length 158
2022-04-06 01:34:36.618789 IP (tos 0x0, ttl 64, id 57139, offset 0, flags [DF], proto TCP (6), length 52)
    127.0.0.1.9650 > 127.0.0.1.47134: Flags [.], cksum 0xfe28 (incorrect -> 0x0ddb), seq 4014, ack 689, win 511, options [nop,nop,TS val 291159121 ecr 291159121], length 0
200, 5.751293659210205, 0.5814182758331299