2022-04-06 00:22:56.810981 IP (tos 0x0, ttl 64, id 24964, offset 0, flags [DF], proto TCP (6), length 60)
    127.0.0.1.48598 > 127.0.0.1.10950: Flags [S], cksum 0xfe30 (incorrect -> 0x8485), seq 1929068186, win 65495, options [mss 65495,sackOK,TS val 286859313 ecr 0,nop,wscale 7], length 0
2022-04-06 00:22:56.810993 IP (tos 0x0, ttl 64, id 0, offset 0, flags [DF], proto TCP (6), length 60)
    127.0.0.1.10950 > 127.0.0.1.48598: Flags [S.], cksum 0xfe30 (incorrect -> 0x6c43), seq 2408666977, ack 1929068187, win 65483, options [mss 65495,sackOK,TS val 286859313 ecr 286859313,nop,wscale 7], length 0
2022-04-06 00:22:56.811002 IP (tos 0x0, ttl 64, id 24965, offset 0, flags [DF], proto TCP (6), length 52)
    127.0.0.1.48598 > 127.0.0.1.10950: Flags [.], cksum 0xfe28 (incorrect -> 0x92ff), seq 1, ack 1, win 512, options [nop,nop,TS val 286859313 ecr 286859313], length 0
2022-04-06 00:22:56.811100 IP (tos 0x0, ttl 64, id 24966, offset 0, flags [DF], proto TCP (6), length 55)
    127.0.0.1.48598 > 127.0.0.1.10950: Flags [P.], cksum 0xfe2b (incorrect -> 0x8df2), seq 1:4, ack 1, win 512, options [nop,nop,TS val 286859314 ecr 286859313], length 3
2022-04-06 00:22:56.811104 IP (tos 0x0, ttl 64, id 25791, offset 0, flags [DF], proto TCP (6), length 52)
    127.0.0.1.10950 > 127.0.0.1.48598: Flags [.], cksum 0xfe28 (incorrect -> 0x92fa), seq 1, ack 4, win 512, options [nop,nop,TS val 286859314 ecr 286859314], length 0
2022-04-06 00:22:56.811162 IP (tos 0x0, ttl 64, id 25792, offset 0, flags [DF], proto TCP (6), length 54)
    127.0.0.1.10950 > 127.0.0.1.48598: Flags [P.], cksum 0xfe2a (incorrect -> 0x8df0), seq 1:3, ack 4, win 512, options [nop,nop,TS val 286859314 ecr 286859314], length 2
2022-04-06 00:22:56.811176 IP (tos 0x0, ttl 64, id 24967, offset 0, flags [DF], proto TCP (6), length 52)
    127.0.0.1.48598 > 127.0.0.1.10950: Flags [.], cksum 0xfe28 (incorrect -> 0x92f8), seq 4, ack 3, win 512, options [nop,nop,TS val 286859314 ecr 286859314], length 0
2022-04-06 00:22:56.826076 IP (tos 0x0, ttl 64, id 24968, offset 0, flags [DF], proto TCP (6), length 62)
    127.0.0.1.48598 > 127.0.0.1.10950: Flags [P.], cksum 0xfe32 (incorrect -> 0xeb47), seq 4:14, ack 3, win 512, options [nop,nop,TS val 286859329 ecr 286859314], length 10
2022-04-06 00:22:56.826092 IP (tos 0x0, ttl 64, id 25793, offset 0, flags [DF], proto TCP (6), length 52)
    127.0.0.1.10950 > 127.0.0.1.48598: Flags [.], cksum 0xfe28 (incorrect -> 0x92d0), seq 3, ack 14, win 512, options [nop,nop,TS val 286859329 ecr 286859329], length 0
2022-04-06 00:22:56.870099 IP (tos 0x0, ttl 64, id 25794, offset 0, flags [DF], proto TCP (6), length 62)
    127.0.0.1.10950 > 127.0.0.1.48598: Flags [P.], cksum 0xfe32 (incorrect -> 0x8d91), seq 3:13, ack 14, win 512, options [nop,nop,TS val 286859373 ecr 286859329], length 10
2022-04-06 00:22:56.870107 IP (tos 0x0, ttl 64, id 24969, offset 0, flags [DF], proto TCP (6), length 52)
    127.0.0.1.48598 > 127.0.0.1.10950: Flags [.], cksum 0xfe28 (incorrect -> 0x926e), seq 14, ack 13, win 512, options [nop,nop,TS val 286859373 ecr 286859373], length 0
2022-04-06 00:22:56.876005 IP (tos 0x0, ttl 64, id 24970, offset 0, flags [DF], proto TCP (6), length 569)
    127.0.0.1.48598 > 127.0.0.1.10950: Flags [P.], cksum 0x002e (incorrect -> 0x9cd2), seq 14:531, ack 13, win 512, options [nop,nop,TS val 286859378 ecr 286859373], length 517
2022-04-06 00:22:56.876013 IP (tos 0x0, ttl 64, id 25795, offset 0, flags [DF], proto TCP (6), length 52)
    127.0.0.1.10950 > 127.0.0.1.48598: Flags [.], cksum 0xfe28 (incorrect -> 0x9063), seq 13, ack 531, win 508, options [nop,nop,TS val 286859378 ecr 286859378], length 0
2022-04-06 00:22:56.920948 IP (tos 0x0, ttl 64, id 25796, offset 0, flags [DF], proto TCP (6), length 3538)
    127.0.0.1.10950 > 127.0.0.1.48598: Flags [P.], cksum 0x0bc7 (incorrect -> 0x05ad), seq 13:3499, ack 531, win 512, options [nop,nop,TS val 286859423 ecr 286859378], length 3486
2022-04-06 00:22:56.920953 IP (tos 0x0, ttl 64, id 24971, offset 0, flags [DF], proto TCP (6), length 52)
    127.0.0.1.48598 > 127.0.0.1.10950: Flags [.], cksum 0xfe28 (incorrect -> 0x8279), seq 531, ack 3499, win 494, options [nop,nop,TS val 286859423 ecr 286859423], length 0
2022-04-06 00:22:56.937256 IP (tos 0x0, ttl 64, id 25797, offset 0, flags [DF], proto TCP (6), length 662)
    127.0.0.1.10950 > 127.0.0.1.48598: Flags [P.], cksum 0x008b (incorrect -> 0x8473), seq 3499:4109, ack 531, win 512, options [nop,nop,TS val 286859440 ecr 286859423], length 610
2022-04-06 00:22:56.937260 IP (tos 0x0, ttl 64, id 24972, offset 0, flags [DF], proto TCP (6), length 52)
    127.0.0.1.48598 > 127.0.0.1.10950: Flags [.], cksum 0xfe28 (incorrect -> 0x7fea), seq 531, ack 4109, win 505, options [nop,nop,TS val 286859440 ecr 286859440], length 0
200, 8.823535919189453, 0.33191704750061035