2022-04-06 05:50:16.707875 IP (tos 0x0, ttl 64, id 46819, offset 0, flags [DF], proto TCP (6), length 60)
    127.0.0.1.54838 > 127.0.0.1.11050: Flags [S], cksum 0xfe30 (incorrect -> 0x11e5), seq 2696395573, win 65495, options [mss 65495,sackOK,TS val 306499210 ecr 0,nop,wscale 7], length 0
2022-04-06 05:50:16.707888 IP (tos 0x0, ttl 64, id 0, offset 0, flags [DF], proto TCP (6), length 60)
    127.0.0.1.11050 > 127.0.0.1.54838: Flags [S.], cksum 0xfe30 (incorrect -> 0x451d), seq 738967528, ack 2696395574, win 65483, options [mss 65495,sackOK,TS val 306499210 ecr 306499210,nop,wscale 7], length 0
2022-04-06 05:50:16.707899 IP (tos 0x0, ttl 64, id 46820, offset 0, flags [DF], proto TCP (6), length 52)
    127.0.0.1.54838 > 127.0.0.1.11050: Flags [.], cksum 0xfe28 (incorrect -> 0x6bd9), seq 1, ack 1, win 512, options [nop,nop,TS val 306499210 ecr 306499210], length 0
2022-04-06 05:50:16.708028 IP (tos 0x0, ttl 64, id 46821, offset 0, flags [DF], proto TCP (6), length 55)
    127.0.0.1.54838 > 127.0.0.1.11050: Flags [P.], cksum 0xfe2b (incorrect -> 0x66cd), seq 1:4, ack 1, win 512, options [nop,nop,TS val 306499210 ecr 306499210], length 3
2022-04-06 05:50:16.708040 IP (tos 0x0, ttl 64, id 65462, offset 0, flags [DF], proto TCP (6), length 52)
    127.0.0.1.11050 > 127.0.0.1.54838: Flags [.], cksum 0xfe28 (incorrect -> 0x6bd6), seq 1, ack 4, win 512, options [nop,nop,TS val 306499210 ecr 306499210], length 0
2022-04-06 05:50:16.708076 IP (tos 0x0, ttl 64, id 65463, offset 0, flags [DF], proto TCP (6), length 54)
    127.0.0.1.11050 > 127.0.0.1.54838: Flags [P.], cksum 0xfe2a (incorrect -> 0x66cb), seq 1:3, ack 4, win 512, options [nop,nop,TS val 306499211 ecr 306499210], length 2
2022-04-06 05:50:16.708087 IP (tos 0x0, ttl 64, id 46822, offset 0, flags [DF], proto TCP (6), length 52)
    127.0.0.1.54838 > 127.0.0.1.11050: Flags [.], cksum 0xfe28 (incorrect -> 0x6bd2), seq 4, ack 3, win 512, options [nop,nop,TS val 306499211 ecr 306499211], length 0
2022-04-06 05:50:16.709358 IP (tos 0x0, ttl 64, id 46823, offset 0, flags [DF], proto TCP (6), length 62)
    127.0.0.1.54838 > 127.0.0.1.11050: Flags [P.], cksum 0xfe32 (incorrect -> 0xd18c), seq 4:14, ack 3, win 512, options [nop,nop,TS val 306499212 ecr 306499211], length 10
2022-04-06 05:50:16.709377 IP (tos 0x0, ttl 64, id 65464, offset 0, flags [DF], proto TCP (6), length 52)
    127.0.0.1.11050 > 127.0.0.1.54838: Flags [.], cksum 0xfe28 (incorrect -> 0x6bc6), seq 3, ack 14, win 512, options [nop,nop,TS val 306499212 ecr 306499212], length 0
2022-04-06 05:50:17.081971 IP (tos 0x0, ttl 64, id 65465, offset 0, flags [DF], proto TCP (6), length 62)
    127.0.0.1.11050 > 127.0.0.1.54838: Flags [P.], cksum 0xfe32 (incorrect -> 0x653f), seq 3:13, ack 14, win 512, options [nop,nop,TS val 306499584 ecr 306499212], length 10
2022-04-06 05:50:17.081982 IP (tos 0x0, ttl 64, id 46824, offset 0, flags [DF], proto TCP (6), length 52)
    127.0.0.1.54838 > 127.0.0.1.11050: Flags [.], cksum 0xfe28 (incorrect -> 0x68d4), seq 14, ack 13, win 512, options [nop,nop,TS val 306499584 ecr 306499584], length 0
2022-04-06 05:50:17.087871 IP (tos 0x0, ttl 64, id 46825, offset 0, flags [DF], proto TCP (6), length 569)
    127.0.0.1.54838 > 127.0.0.1.11050: Flags [P.], cksum 0x002e (incorrect -> 0x5c89), seq 14:531, ack 13, win 512, options [nop,nop,TS val 306499590 ecr 306499584], length 517
2022-04-06 05:50:17.087877 IP (tos 0x0, ttl 64, id 65466, offset 0, flags [DF], proto TCP (6), length 52)
    127.0.0.1.11050 > 127.0.0.1.54838: Flags [.], cksum 0xfe28 (incorrect -> 0x66c7), seq 13, ack 531, win 508, options [nop,nop,TS val 306499590 ecr 306499590], length 0
2022-04-06 05:50:17.457443 IP (tos 0x0, ttl 64, id 65467, offset 0, flags [DF], proto TCP (6), length 2804)
    127.0.0.1.11050 > 127.0.0.1.54838: Flags [P.], cksum 0x08e9 (incorrect -> 0x21c8), seq 13:2765, ack 531, win 512, options [nop,nop,TS val 306499960 ecr 306499590], length 2752
2022-04-06 05:50:17.457454 IP (tos 0x0, ttl 64, id 46826, offset 0, flags [DF], proto TCP (6), length 52)
    127.0.0.1.54838 > 127.0.0.1.11050: Flags [.], cksum 0xfe28 (incorrect -> 0x592e), seq 531, ack 2765, win 497, options [nop,nop,TS val 306499960 ecr 306499960], length 0
2022-04-06 05:50:17.458987 IP (tos 0x0, ttl 64, id 46827, offset 0, flags [DF], proto TCP (6), length 132)
    127.0.0.1.54838 > 127.0.0.1.11050: Flags [P.], cksum 0xfe78 (incorrect -> 0xd882), seq 531:611, ack 2765, win 512, options [nop,nop,TS val 306499961 ecr 306499960], length 80
2022-04-06 05:50:17.458995 IP (tos 0x0, ttl 64, id 65468, offset 0, flags [DF], proto TCP (6), length 52)
    127.0.0.1.11050 > 127.0.0.1.54838: Flags [.], cksum 0xfe28 (incorrect -> 0x58cd), seq 2765, ack 611, win 512, options [nop,nop,TS val 306499961 ecr 306499961], length 0
2022-04-06 05:50:17.459469 IP (tos 0x0, ttl 64, id 46828, offset 0, flags [DF], proto TCP (6), length 402)
    127.0.0.1.54838 > 127.0.0.1.11050: Flags [P.], cksum 0xff86 (incorrect -> 0xf6a9), seq 611:961, ack 2765, win 512, options [nop,nop,TS val 306499962 ecr 306499961], length 350
2022-04-06 05:50:17.459477 IP (tos 0x0, ttl 64, id 65469, offset 0, flags [DF], proto TCP (6), length 52)
    127.0.0.1.11050 > 127.0.0.1.54838: Flags [.], cksum 0xfe28 (incorrect -> 0x576f), seq 2765, ack 961, win 510, options [nop,nop,TS val 306499962 ecr 306499962], length 0
2022-04-06 05:50:18.135199 IP (tos 0x0, ttl 64, id 65470, offset 0, flags [DF], proto TCP (6), length 846)
    127.0.0.1.11050 > 127.0.0.1.54838: Flags [P.], cksum 0x0143 (incorrect -> 0xa3ec), seq 2765:3559, ack 961, win 512, options [nop,nop,TS val 306500638 ecr 306499962], length 794
2022-04-06 05:50:18.135218 IP (tos 0x0, ttl 64, id 46829, offset 0, flags [DF], proto TCP (6), length 52)
    127.0.0.1.54838 > 127.0.0.1.11050: Flags [.], cksum 0xfe28 (incorrect -> 0x4f11), seq 961, ack 3559, win 506, options [nop,nop,TS val 306500638 ecr 306500638], length 0
2022-04-06 05:50:18.137532 IP (tos 0x0, ttl 64, id 60238, offset 0, flags [DF], proto TCP (6), length 60)
    127.0.0.1.54840 > 127.0.0.1.11050: Flags [S], cksum 0xfe30 (incorrect -> 0x0088), seq 1725497561, win 65495, options [mss 65495,sackOK,TS val 306500640 ecr 0,nop,wscale 7], length 0
2022-04-06 05:50:18.137543 IP (tos 0x0, ttl 64, id 0, offset 0, flags [DF], proto TCP (6), length 60)
    127.0.0.1.11050 > 127.0.0.1.54840: Flags [S.], cksum 0xfe30 (incorrect -> 0x1bd3), seq 335997508, ack 1725497562, win 65483, options [mss 65495,sackOK,TS val 306500640 ecr 306500640,nop,wscale 7], length 0
2022-04-06 05:50:18.137551 IP (tos 0x0, ttl 64, id 60239, offset 0, flags [DF], proto TCP (6), length 52)
    127.0.0.1.54840 > 127.0.0.1.11050: Flags [.], cksum 0xfe28 (incorrect -> 0x428f), seq 1, ack 1, win 512, options [nop,nop,TS val 306500640 ecr 306500640], length 0
2022-04-06 05:50:18.137636 IP (tos 0x0, ttl 64, id 60240, offset 0, flags [DF], proto TCP (6), length 55)
    127.0.0.1.54840 > 127.0.0.1.11050: Flags [P.], cksum 0xfe2b (incorrect -> 0x3d83), seq 1:4, ack 1, win 512, options [nop,nop,TS val 306500640 ecr 306500640], length 3
2022-04-06 05:50:18.137642 IP (tos 0x0, ttl 64, id 19163, offset 0, flags [DF], proto TCP (6), length 52)
    127.0.0.1.11050 > 127.0.0.1.54840: Flags [.], cksum 0xfe28 (incorrect -> 0x428c), seq 1, ack 4, win 512, options [nop,nop,TS val 306500640 ecr 306500640], length 0
2022-04-06 05:50:18.137660 IP (tos 0x0, ttl 64, id 19164, offset 0, flags [DF], proto TCP (6), length 54)
    127.0.0.1.11050 > 127.0.0.1.54840: Flags [P.], cksum 0xfe2a (incorrect -> 0x3d82), seq 1:3, ack 4, win 512, options [nop,nop,TS val 306500640 ecr 306500640], length 2
2022-04-06 05:50:18.137666 IP (tos 0x0, ttl 64, id 60241, offset 0, flags [DF], proto TCP (6), length 52)
    127.0.0.1.54840 > 127.0.0.1.11050: Flags [.], cksum 0xfe28 (incorrect -> 0x428a), seq 4, ack 3, win 512, options [nop,nop,TS val 306500640 ecr 306500640], length 0
2022-04-06 05:50:18.138876 IP (tos 0x0, ttl 64, id 60242, offset 0, flags [DF], proto TCP (6), length 62)
    127.0.0.1.54840 > 127.0.0.1.11050: Flags [P.], cksum 0xfe32 (incorrect -> 0xa844), seq 4:14, ack 3, win 512, options [nop,nop,TS val 306500641 ecr 306500640], length 10
2022-04-06 05:50:18.138900 IP (tos 0x0, ttl 64, id 19165, offset 0, flags [DF], proto TCP (6), length 52)
    127.0.0.1.11050 > 127.0.0.1.54840: Flags [.], cksum 0xfe28 (incorrect -> 0x427e), seq 3, ack 14, win 512, options [nop,nop,TS val 306500641 ecr 306500641], length 0
2022-04-06 05:50:18.525810 IP (tos 0x0, ttl 64, id 19166, offset 0, flags [DF], proto TCP (6), length 62)
    127.0.0.1.11050 > 127.0.0.1.54840: Flags [P.], cksum 0xfe32 (incorrect -> 0x3be8), seq 3:13, ack 14, win 512, options [nop,nop,TS val 306501028 ecr 306500641], length 10
2022-04-06 05:50:18.525821 IP (tos 0x0, ttl 64, id 60243, offset 0, flags [DF], proto TCP (6), length 52)
    127.0.0.1.54840 > 127.0.0.1.11050: Flags [.], cksum 0xfe28 (incorrect -> 0x3f6e), seq 14, ack 13, win 512, options [nop,nop,TS val 306501028 ecr 306501028], length 0
2022-04-06 05:50:18.530957 IP (tos 0x0, ttl 64, id 60244, offset 0, flags [DF], proto TCP (6), length 569)
    127.0.0.1.54840 > 127.0.0.1.11050: Flags [P.], cksum 0x002e (incorrect -> 0xd869), seq 14:531, ack 13, win 512, options [nop,nop,TS val 306501033 ecr 306501028], length 517
2022-04-06 05:50:18.530963 IP (tos 0x0, ttl 64, id 19167, offset 0, flags [DF], proto TCP (6), length 52)
    127.0.0.1.11050 > 127.0.0.1.54840: Flags [.], cksum 0xfe28 (incorrect -> 0x3d63), seq 13, ack 531, win 508, options [nop,nop,TS val 306501033 ecr 306501033], length 0
2022-04-06 05:50:18.907014 IP (tos 0x0, ttl 64, id 19168, offset 0, flags [DF], proto TCP (6), length 2804)
    127.0.0.1.11050 > 127.0.0.1.54840: Flags [P.], cksum 0x08e9 (incorrect -> 0xf993), seq 13:2765, ack 531, win 512, options [nop,nop,TS val 306501409 ecr 306501033], length 2752
2022-04-06 05:50:18.907026 IP (tos 0x0, ttl 64, id 60245, offset 0, flags [DF], proto TCP (6), length 52)
    127.0.0.1.54840 > 127.0.0.1.11050: Flags [.], cksum 0xfe28 (incorrect -> 0x2fbe), seq 531, ack 2765, win 497, options [nop,nop,TS val 306501409 ecr 306501409], length 0
2022-04-06 05:50:18.908479 IP (tos 0x0, ttl 64, id 60246, offset 0, flags [DF], proto TCP (6), length 132)
    127.0.0.1.54840 > 127.0.0.1.11050: Flags [P.], cksum 0xfe78 (incorrect -> 0x3d94), seq 531:611, ack 2765, win 512, options [nop,nop,TS val 306501411 ecr 306501409], length 80
2022-04-06 05:50:18.908488 IP (tos 0x0, ttl 64, id 19169, offset 0, flags [DF], proto TCP (6), length 52)
    127.0.0.1.11050 > 127.0.0.1.54840: Flags [.], cksum 0xfe28 (incorrect -> 0x2f5b), seq 2765, ack 611, win 512, options [nop,nop,TS val 306501411 ecr 306501411], length 0
2022-04-06 05:50:18.908918 IP (tos 0x0, ttl 64, id 60247, offset 0, flags [DF], proto TCP (6), length 398)
    127.0.0.1.54840 > 127.0.0.1.11050: Flags [P.], cksum 0xff82 (incorrect -> 0x25fb), seq 611:957, ack 2765, win 512, options [nop,nop,TS val 306501411 ecr 306501411], length 346
2022-04-06 05:50:18.908925 IP (tos 0x0, ttl 64, id 19170, offset 0, flags [DF], proto TCP (6), length 52)
    127.0.0.1.11050 > 127.0.0.1.54840: Flags [.], cksum 0xfe28 (incorrect -> 0x2e03), seq 2765, ack 957, win 510, options [nop,nop,TS val 306501411 ecr 306501411], length 0
2022-04-06 05:50:19.620898 IP (tos 0x0, ttl 64, id 19171, offset 0, flags [DF], proto TCP (6), length 3538)
    127.0.0.1.11050 > 127.0.0.1.54840: Flags [P.], cksum 0x0bc7 (incorrect -> 0x4558), seq 2765:6251, ack 957, win 512, options [nop,nop,TS val 306502123 ecr 306501411], length 3486
2022-04-06 05:50:19.620909 IP (tos 0x0, ttl 64, id 60248, offset 0, flags [DF], proto TCP (6), length 52)
    127.0.0.1.54840 > 127.0.0.1.11050: Flags [.], cksum 0xfe28 (incorrect -> 0x1ae5), seq 957, ack 6251, win 494, options [nop,nop,TS val 306502123 ecr 306502123], length 0
2022-04-06 05:50:19.726626 IP (tos 0x0, ttl 64, id 19172, offset 0, flags [DF], proto TCP (6), length 3057)
    127.0.0.1.11050 > 127.0.0.1.54840: Flags [P.], cksum 0x09e6 (incorrect -> 0xbd5b), seq 6251:9256, ack 957, win 512, options [nop,nop,TS val 306502229 ecr 306502123], length 3005
2022-04-06 05:50:19.726649 IP (tos 0x0, ttl 64, id 60249, offset 0, flags [DF], proto TCP (6), length 52)
    127.0.0.1.54840 > 127.0.0.1.11050: Flags [.], cksum 0xfe28 (incorrect -> 0x0e52), seq 957, ack 9256, win 496, options [nop,nop,TS val 306502229 ecr 306502229], length 0
2022-04-06 05:50:19.736231 IP (tos 0x0, ttl 64, id 19173, offset 0, flags [DF], proto TCP (6), length 2044)
    127.0.0.1.11050 > 127.0.0.1.54840: Flags [P.], cksum 0x05f1 (incorrect -> 0x9c13), seq 9256:11248, ack 957, win 512, options [nop,nop,TS val 306502239 ecr 306502229], length 1992
2022-04-06 05:50:19.736239 IP (tos 0x0, ttl 64, id 60250, offset 0, flags [DF], proto TCP (6), length 52)
    127.0.0.1.54840 > 127.0.0.1.11050: Flags [.], cksum 0xfe28 (incorrect -> 0x0672), seq 957, ack 11248, win 500, options [nop,nop,TS val 306502239 ecr 306502239], length 0
2022-04-06 05:50:19.784541 IP (tos 0x0, ttl 64, id 19174, offset 0, flags [DF], proto TCP (6), length 3538)
    127.0.0.1.11050 > 127.0.0.1.54840: Flags [P.], cksum 0x0bc7 (incorrect -> 0x92c1), seq 11248:14734, ack 957, win 512, options [nop,nop,TS val 306502287 ecr 306502239], length 3486
2022-04-06 05:50:19.784548 IP (tos 0x0, ttl 64, id 60251, offset 0, flags [DF], proto TCP (6), length 52)
    127.0.0.1.54840 > 127.0.0.1.11050: Flags [.], cksum 0xfe28 (incorrect -> 0xf879), seq 957, ack 14734, win 494, options [nop,nop,TS val 306502287 ecr 306502287], length 0
2022-04-06 05:50:19.794235 IP (tos 0x0, ttl 64, id 19175, offset 0, flags [DF], proto TCP (6), length 4100)
    127.0.0.1.11050 > 127.0.0.1.54840: Flags [P.], cksum 0x0df9 (incorrect -> 0x9fa4), seq 14734:18782, ack 957, win 512, options [nop,nop,TS val 306502297 ecr 306502287], length 4048
2022-04-06 05:50:19.794241 IP (tos 0x0, ttl 64, id 60252, offset 0, flags [DF], proto TCP (6), length 52)
    127.0.0.1.54840 > 127.0.0.1.11050: Flags [.], cksum 0xfe28 (incorrect -> 0xe897), seq 957, ack 18782, win 492, options [nop,nop,TS val 306502297 ecr 306502297], length 0
2022-04-06 05:50:19.794247 IP (tos 0x0, ttl 64, id 19176, offset 0, flags [DF], proto TCP (6), length 486)
    127.0.0.1.11050 > 127.0.0.1.54840: Flags [P.], cksum 0xffda (incorrect -> 0x4c78), seq 18782:19216, ack 957, win 512, options [nop,nop,TS val 306502297 ecr 306502297], length 434
2022-04-06 05:50:19.794250 IP (tos 0x0, ttl 64, id 60253, offset 0, flags [DF], proto TCP (6), length 52)
    127.0.0.1.54840 > 127.0.0.1.11050: Flags [.], cksum 0xfe28 (incorrect -> 0xe6e7), seq 957, ack 19216, win 490, options [nop,nop,TS val 306502297 ecr 306502297], length 0
2022-04-06 05:50:19.819299 IP (tos 0x0, ttl 64, id 19177, offset 0, flags [DF], proto TCP (6), length 3538)
    127.0.0.1.11050 > 127.0.0.1.54840: Flags [P.], cksum 0x0bc7 (incorrect -> 0xe85c), seq 19216:22702, ack 957, win 512, options [nop,nop,TS val 306502322 ecr 306502297], length 3486
2022-04-06 05:50:19.819304 IP (tos 0x0, ttl 64, id 60254, offset 0, flags [DF], proto TCP (6), length 52)
    127.0.0.1.54840 > 127.0.0.1.11050: Flags [.], cksum 0xfe28 (incorrect -> 0xd913), seq 957, ack 22702, win 494, options [nop,nop,TS val 306502322 ecr 306502322], length 0
2022-04-06 05:50:19.883038 IP (tos 0x0, ttl 64, id 19178, offset 0, flags [DF], proto TCP (6), length 1288)
    127.0.0.1.11050 > 127.0.0.1.54840: Flags [P.], cksum 0x02fd (incorrect -> 0xd473), seq 22702:23938, ack 957, win 512, options [nop,nop,TS val 306502385 ecr 306502322], length 1236
2022-04-06 05:50:19.883049 IP (tos 0x0, ttl 64, id 60255, offset 0, flags [DF], proto TCP (6), length 52)
    127.0.0.1.54840 > 127.0.0.1.11050: Flags [.], cksum 0xfe28 (incorrect -> 0xd3b8), seq 957, ack 23938, win 503, options [nop,nop,TS val 306502385 ecr 306502385], length 0
2022-04-06 05:50:19.892748 IP (tos 0x0, ttl 64, id 19179, offset 0, flags [DF], proto TCP (6), length 3538)
    127.0.0.1.11050 > 127.0.0.1.54840: Flags [P.], cksum 0x0bc7 (incorrect -> 0x2bf0), seq 23938:27424, ack 957, win 512, options [nop,nop,TS val 306502395 ecr 306502385], length 3486
2022-04-06 05:50:19.892756 IP (tos 0x0, ttl 64, id 60256, offset 0, flags [DF], proto TCP (6), length 52)
    127.0.0.1.54840 > 127.0.0.1.11050: Flags [.], cksum 0xfe28 (incorrect -> 0xc60f), seq 957, ack 27424, win 494, options [nop,nop,TS val 306502395 ecr 306502395], length 0
200, 6.089528799057007, 3.3374507427215576