2022-04-06 12:07:42.499599 IP (tos 0x0, ttl 64, id 46692, offset 0, flags [DF], proto TCP (6), length 60)
    127.0.0.1.55254 > 127.0.0.1.11050: Flags [S], cksum 0xfe30 (incorrect -> 0xc9f4), seq 1194970506, win 65495, options [mss 65495,sackOK,TS val 329145002 ecr 0,nop,wscale 7], length 0
2022-04-06 12:07:42.499614 IP (tos 0x0, ttl 64, id 0, offset 0, flags [DF], proto TCP (6), length 60)
    127.0.0.1.11050 > 127.0.0.1.55254: Flags [S.], cksum 0xfe30 (incorrect -> 0xf06d), seq 467160929, ack 1194970507, win 65483, options [mss 65495,sackOK,TS val 329145002 ecr 329145002,nop,wscale 7], length 0
2022-04-06 12:07:42.499624 IP (tos 0x0, ttl 64, id 46693, offset 0, flags [DF], proto TCP (6), length 52)
    127.0.0.1.55254 > 127.0.0.1.11050: Flags [.], cksum 0xfe28 (incorrect -> 0x172a), seq 1, ack 1, win 512, options [nop,nop,TS val 329145002 ecr 329145002], length 0
2022-04-06 12:07:42.499720 IP (tos 0x0, ttl 64, id 46694, offset 0, flags [DF], proto TCP (6), length 55)
    127.0.0.1.55254 > 127.0.0.1.11050: Flags [P.], cksum 0xfe2b (incorrect -> 0x121e), seq 1:4, ack 1, win 512, options [nop,nop,TS val 329145002 ecr 329145002], length 3
2022-04-06 12:07:42.499735 IP (tos 0x0, ttl 64, id 62480, offset 0, flags [DF], proto TCP (6), length 52)
    127.0.0.1.11050 > 127.0.0.1.55254: Flags [.], cksum 0xfe28 (incorrect -> 0x1727), seq 1, ack 4, win 512, options [nop,nop,TS val 329145002 ecr 329145002], length 0
2022-04-06 12:07:42.499791 IP (tos 0x0, ttl 64, id 62481, offset 0, flags [DF], proto TCP (6), length 54)
    127.0.0.1.11050 > 127.0.0.1.55254: Flags [P.], cksum 0xfe2a (incorrect -> 0x121d), seq 1:3, ack 4, win 512, options [nop,nop,TS val 329145002 ecr 329145002], length 2
2022-04-06 12:07:42.499809 IP (tos 0x0, ttl 64, id 46695, offset 0, flags [DF], proto TCP (6), length 52)
    127.0.0.1.55254 > 127.0.0.1.11050: Flags [.], cksum 0xfe28 (incorrect -> 0x1725), seq 4, ack 3, win 512, options [nop,nop,TS val 329145002 ecr 329145002], length 0
2022-04-06 12:07:42.511550 IP (tos 0x0, ttl 64, id 46696, offset 0, flags [DF], proto TCP (6), length 62)
    127.0.0.1.55254 > 127.0.0.1.11050: Flags [P.], cksum 0xfe32 (incorrect -> 0xbdb9), seq 4:14, ack 3, win 512, options [nop,nop,TS val 329145014 ecr 329145002], length 10
2022-04-06 12:07:42.511560 IP (tos 0x0, ttl 64, id 62482, offset 0, flags [DF], proto TCP (6), length 52)
    127.0.0.1.11050 > 127.0.0.1.55254: Flags [.], cksum 0xfe28 (incorrect -> 0x1703), seq 3, ack 14, win 512, options [nop,nop,TS val 329145014 ecr 329145014], length 0
2022-04-06 12:07:42.566795 IP (tos 0x0, ttl 64, id 62483, offset 0, flags [DF], proto TCP (6), length 62)
    127.0.0.1.11050 > 127.0.0.1.55254: Flags [P.], cksum 0xfe32 (incorrect -> 0x11b9), seq 3:13, ack 14, win 512, options [nop,nop,TS val 329145069 ecr 329145014], length 10
2022-04-06 12:07:42.566805 IP (tos 0x0, ttl 64, id 46697, offset 0, flags [DF], proto TCP (6), length 52)
    127.0.0.1.55254 > 127.0.0.1.11050: Flags [.], cksum 0xfe28 (incorrect -> 0x168b), seq 14, ack 13, win 512, options [nop,nop,TS val 329145069 ecr 329145069], length 0
2022-04-06 12:07:42.572260 IP (tos 0x0, ttl 64, id 46698, offset 0, flags [DF], proto TCP (6), length 569)
    127.0.0.1.55254 > 127.0.0.1.11050: Flags [P.], cksum 0x002e (incorrect -> 0x734f), seq 14:531, ack 13, win 512, options [nop,nop,TS val 329145075 ecr 329145069], length 517
2022-04-06 12:07:42.572269 IP (tos 0x0, ttl 64, id 62484, offset 0, flags [DF], proto TCP (6), length 52)
    127.0.0.1.11050 > 127.0.0.1.55254: Flags [.], cksum 0xfe28 (incorrect -> 0x147e), seq 13, ack 531, win 508, options [nop,nop,TS val 329145075 ecr 329145075], length 0
2022-04-06 12:07:42.631576 IP (tos 0x0, ttl 64, id 62485, offset 0, flags [DF], proto TCP (6), length 3538)
    127.0.0.1.11050 > 127.0.0.1.55254: Flags [P.], cksum 0x0bc7 (incorrect -> 0xefdc), seq 13:3499, ack 531, win 512, options [nop,nop,TS val 329145134 ecr 329145075], length 3486
2022-04-06 12:07:42.631585 IP (tos 0x0, ttl 64, id 46699, offset 0, flags [DF], proto TCP (6), length 52)
    127.0.0.1.55254 > 127.0.0.1.11050: Flags [.], cksum 0xfe28 (incorrect -> 0x0678), seq 531, ack 3499, win 494, options [nop,nop,TS val 329145134 ecr 329145134], length 0
2022-04-06 12:07:42.631984 IP (tos 0x0, ttl 64, id 46700, offset 0, flags [DF], proto TCP (6), length 132)
    127.0.0.1.55254 > 127.0.0.1.11050: Flags [P.], cksum 0xfe78 (incorrect -> 0xb9b5), seq 531:611, ack 3499, win 494, options [nop,nop,TS val 329145134 ecr 329145134], length 80
2022-04-06 12:07:42.631992 IP (tos 0x0, ttl 64, id 62486, offset 0, flags [DF], proto TCP (6), length 52)
    127.0.0.1.11050 > 127.0.0.1.55254: Flags [.], cksum 0xfe28 (incorrect -> 0x0616), seq 3499, ack 611, win 512, options [nop,nop,TS val 329145134 ecr 329145134], length 0
2022-04-06 12:07:42.633543 IP (tos 0x0, ttl 64, id 46701, offset 0, flags [DF], proto TCP (6), length 370)
    127.0.0.1.55254 > 127.0.0.1.11050: Flags [P.], cksum 0xff66 (incorrect -> 0xaa54), seq 611:929, ack 3499, win 494, options [nop,nop,TS val 329145136 ecr 329145134], length 318
2022-04-06 12:07:42.633571 IP (tos 0x0, ttl 64, id 62487, offset 0, flags [DF], proto TCP (6), length 52)
    127.0.0.1.11050 > 127.0.0.1.55254: Flags [.], cksum 0xfe28 (incorrect -> 0x04d6), seq 3499, ack 929, win 510, options [nop,nop,TS val 329145136 ecr 329145136], length 0
200, 3.875117063522339, 0.34002184867858887