2022-04-06 00:16:07.167824 IP (tos 0x0, ttl 64, id 13436, offset 0, flags [DF], proto TCP (6), length 60)
    127.0.0.1.41070 > 127.0.0.1.11650: Flags [S], cksum 0xfe30 (incorrect -> 0x8599), seq 2141227966, win 65495, options [mss 65495,sackOK,TS val 286449670 ecr 0,nop,wscale 7], length 0
2022-04-06 00:16:07.167837 IP (tos 0x0, ttl 64, id 0, offset 0, flags [DF], proto TCP (6), length 60)
    127.0.0.1.11650 > 127.0.0.1.41070: Flags [S.], cksum 0xfe30 (incorrect -> 0x247d), seq 2985475595, ack 2141227967, win 65483, options [mss 65495,sackOK,TS val 286449670 ecr 286449670,nop,wscale 7], length 0
2022-04-06 00:16:07.167847 IP (tos 0x0, ttl 64, id 13437, offset 0, flags [DF], proto TCP (6), length 52)
    127.0.0.1.41070 > 127.0.0.1.11650: Flags [.], cksum 0xfe28 (incorrect -> 0x4b39), seq 1, ack 1, win 512, options [nop,nop,TS val 286449670 ecr 286449670], length 0
2022-04-06 00:16:07.168002 IP (tos 0x0, ttl 64, id 13438, offset 0, flags [DF], proto TCP (6), length 55)
    127.0.0.1.41070 > 127.0.0.1.11650: Flags [P.], cksum 0xfe2b (incorrect -> 0x462d), seq 1:4, ack 1, win 512, options [nop,nop,TS val 286449670 ecr 286449670], length 3
2022-04-06 00:16:07.168008 IP (tos 0x0, ttl 64, id 46088, offset 0, flags [DF], proto TCP (6), length 52)
    127.0.0.1.11650 > 127.0.0.1.41070: Flags [.], cksum 0xfe28 (incorrect -> 0x4b36), seq 1, ack 4, win 512, options [nop,nop,TS val 286449670 ecr 286449670], length 0
2022-04-06 00:16:07.168033 IP (tos 0x0, ttl 64, id 46089, offset 0, flags [DF], proto TCP (6), length 54)
    127.0.0.1.11650 > 127.0.0.1.41070: Flags [P.], cksum 0xfe2a (incorrect -> 0x462c), seq 1:3, ack 4, win 512, options [nop,nop,TS val 286449670 ecr 286449670], length 2
2022-04-06 00:16:07.168039 IP (tos 0x0, ttl 64, id 13439, offset 0, flags [DF], proto TCP (6), length 52)
    127.0.0.1.41070 > 127.0.0.1.11650: Flags [.], cksum 0xfe28 (incorrect -> 0x4b34), seq 4, ack 3, win 512, options [nop,nop,TS val 286449670 ecr 286449670], length 0
2022-04-06 00:16:07.170219 IP (tos 0x0, ttl 64, id 13440, offset 0, flags [DF], proto TCP (6), length 62)
    127.0.0.1.41070 > 127.0.0.1.11650: Flags [P.], cksum 0xfe32 (incorrect -> 0x8345), seq 4:14, ack 3, win 512, options [nop,nop,TS val 286449673 ecr 286449670], length 10
2022-04-06 00:16:07.170243 IP (tos 0x0, ttl 64, id 46090, offset 0, flags [DF], proto TCP (6), length 52)
    127.0.0.1.11650 > 127.0.0.1.41070: Flags [.], cksum 0xfe28 (incorrect -> 0x4b24), seq 3, ack 14, win 512, options [nop,nop,TS val 286449673 ecr 286449673], length 0
2022-04-06 00:16:07.498795 IP (tos 0x0, ttl 64, id 46091, offset 0, flags [DF], proto TCP (6), length 62)
    127.0.0.1.11650 > 127.0.0.1.41070: Flags [P.], cksum 0xfe32 (incorrect -> 0x44c9), seq 3:13, ack 14, win 512, options [nop,nop,TS val 286450001 ecr 286449673], length 10
2022-04-06 00:16:07.498817 IP (tos 0x0, ttl 64, id 13441, offset 0, flags [DF], proto TCP (6), length 52)
    127.0.0.1.41070 > 127.0.0.1.11650: Flags [.], cksum 0xfe28 (incorrect -> 0x488a), seq 14, ack 13, win 512, options [nop,nop,TS val 286450001 ecr 286450001], length 0
2022-04-06 00:16:07.504799 IP (tos 0x0, ttl 64, id 13442, offset 0, flags [DF], proto TCP (6), length 569)
    127.0.0.1.41070 > 127.0.0.1.11650: Flags [P.], cksum 0x002e (incorrect -> 0xd98b), seq 14:531, ack 13, win 512, options [nop,nop,TS val 286450007 ecr 286450001], length 517
2022-04-06 00:16:07.504806 IP (tos 0x0, ttl 64, id 46092, offset 0, flags [DF], proto TCP (6), length 52)
    127.0.0.1.11650 > 127.0.0.1.41070: Flags [.], cksum 0xfe28 (incorrect -> 0x467d), seq 13, ack 531, win 508, options [nop,nop,TS val 286450007 ecr 286450007], length 0
2022-04-06 00:16:07.830708 IP (tos 0x0, ttl 64, id 46093, offset 0, flags [DF], proto TCP (6), length 3538)
    127.0.0.1.11650 > 127.0.0.1.41070: Flags [P.], cksum 0x0bc7 (incorrect -> 0x7e30), seq 13:3499, ack 531, win 512, options [nop,nop,TS val 286450333 ecr 286450007], length 3486
2022-04-06 00:16:07.830725 IP (tos 0x0, ttl 64, id 13443, offset 0, flags [DF], proto TCP (6), length 52)
    127.0.0.1.41070 > 127.0.0.1.11650: Flags [.], cksum 0xfe28 (incorrect -> 0x3661), seq 531, ack 3499, win 494, options [nop,nop,TS val 286450333 ecr 286450333], length 0
2022-04-06 00:16:07.847951 IP (tos 0x0, ttl 64, id 46094, offset 0, flags [DF], proto TCP (6), length 662)
    127.0.0.1.11650 > 127.0.0.1.41070: Flags [P.], cksum 0x008b (incorrect -> 0xcdfe), seq 3499:4109, ack 531, win 512, options [nop,nop,TS val 286450350 ecr 286450333], length 610
2022-04-06 00:16:07.847964 IP (tos 0x0, ttl 64, id 13444, offset 0, flags [DF], proto TCP (6), length 52)
    127.0.0.1.41070 > 127.0.0.1.11650: Flags [.], cksum 0xfe28 (incorrect -> 0x33d2), seq 531, ack 4109, win 505, options [nop,nop,TS val 286450350 ecr 286450350], length 0
2022-04-06 00:16:07.976670 IP (tos 0x0, ttl 64, id 46095, offset 0, flags [DF], proto TCP (6), length 1058)
    127.0.0.1.11650 > 127.0.0.1.41070: Flags [P.], cksum 0x0217 (incorrect -> 0xfdf9), seq 4109:5115, ack 531, win 512, options [nop,nop,TS val 286450479 ecr 286450350], length 1006
2022-04-06 00:16:07.976679 IP (tos 0x0, ttl 64, id 13445, offset 0, flags [DF], proto TCP (6), length 52)
    127.0.0.1.41070 > 127.0.0.1.11650: Flags [.], cksum 0xfe28 (incorrect -> 0x2ee3), seq 531, ack 5115, win 504, options [nop,nop,TS val 286450479 ecr 286450479], length 0
2022-04-06 00:16:07.977199 IP (tos 0x0, ttl 64, id 13446, offset 0, flags [DF], proto TCP (6), length 132)
    127.0.0.1.41070 > 127.0.0.1.11650: Flags [P.], cksum 0xfe78 (incorrect -> 0x284b), seq 531:611, ack 5115, win 512, options [nop,nop,TS val 286450480 ecr 286450479], length 80
2022-04-06 00:16:07.977208 IP (tos 0x0, ttl 64, id 46096, offset 0, flags [DF], proto TCP (6), length 52)
    127.0.0.1.11650 > 127.0.0.1.41070: Flags [.], cksum 0xfe28 (incorrect -> 0x2e89), seq 5115, ack 611, win 512, options [nop,nop,TS val 286450480 ecr 286450480], length 0
2022-04-06 00:16:07.977659 IP (tos 0x0, ttl 64, id 13447, offset 0, flags [DF], proto TCP (6), length 368)
    127.0.0.1.41070 > 127.0.0.1.11650: Flags [P.], cksum 0xff64 (incorrect -> 0x8804), seq 611:927, ack 5115, win 512, options [nop,nop,TS val 286450480 ecr 286450480], length 316
2022-04-06 00:16:07.977664 IP (tos 0x0, ttl 64, id 46097, offset 0, flags [DF], proto TCP (6), length 52)
    127.0.0.1.11650 > 127.0.0.1.41070: Flags [.], cksum 0xfe28 (incorrect -> 0x2d4f), seq 5115, ack 927, win 510, options [nop,nop,TS val 286450480 ecr 286450480], length 0
2022-04-06 00:16:08.304889 IP (tos 0x0, ttl 64, id 46098, offset 0, flags [DF], proto TCP (6), length 594)
    127.0.0.1.11650 > 127.0.0.1.41070: Flags [P.], cksum 0x0047 (incorrect -> 0xadc0), seq 5115:5657, ack 927, win 512, options [nop,nop,TS val 286450807 ecr 286450480], length 542
2022-04-06 00:16:08.304905 IP (tos 0x0, ttl 64, id 13448, offset 0, flags [DF], proto TCP (6), length 52)
    127.0.0.1.41070 > 127.0.0.1.11650: Flags [.], cksum 0xfe28 (incorrect -> 0x28a5), seq 927, ack 5657, win 508, options [nop,nop,TS val 286450807 ecr 286450807], length 0
200, 7.014163970947266, 1.6179721355438232