2022-04-06 13:36:46.581520 IP (tos 0x0, ttl 64, id 37036, offset 0, flags [DF], proto TCP (6), length 60)
    127.0.0.1.47672 > 127.0.0.1.9950: Flags [S], cksum 0xfe30 (incorrect -> 0x3c4a), seq 2612043012, win 65495, options [mss 65495,sackOK,TS val 334489084 ecr 0,nop,wscale 7], length 0
2022-04-06 13:36:46.581533 IP (tos 0x0, ttl 64, id 0, offset 0, flags [DF], proto TCP (6), length 60)
    127.0.0.1.9950 > 127.0.0.1.47672: Flags [S.], cksum 0xfe30 (incorrect -> 0x424f), seq 3313384075, ack 2612043013, win 65483, options [mss 65495,sackOK,TS val 334489084 ecr 334489084,nop,wscale 7], length 0
2022-04-06 13:36:46.581544 IP (tos 0x0, ttl 64, id 37037, offset 0, flags [DF], proto TCP (6), length 52)
    127.0.0.1.47672 > 127.0.0.1.9950: Flags [.], cksum 0xfe28 (incorrect -> 0x690b), seq 1, ack 1, win 512, options [nop,nop,TS val 334489084 ecr 334489084], length 0
2022-04-06 13:36:46.581647 IP (tos 0x0, ttl 64, id 37038, offset 0, flags [DF], proto TCP (6), length 55)
    127.0.0.1.47672 > 127.0.0.1.9950: Flags [P.], cksum 0xfe2b (incorrect -> 0x63ff), seq 1:4, ack 1, win 512, options [nop,nop,TS val 334489084 ecr 334489084], length 3
2022-04-06 13:36:46.581661 IP (tos 0x0, ttl 64, id 38169, offset 0, flags [DF], proto TCP (6), length 52)
    127.0.0.1.9950 > 127.0.0.1.47672: Flags [.], cksum 0xfe28 (incorrect -> 0x6908), seq 1, ack 4, win 512, options [nop,nop,TS val 334489084 ecr 334489084], length 0
2022-04-06 13:36:46.581712 IP (tos 0x0, ttl 64, id 38170, offset 0, flags [DF], proto TCP (6), length 54)
    127.0.0.1.9950 > 127.0.0.1.47672: Flags [P.], cksum 0xfe2a (incorrect -> 0x63fe), seq 1:3, ack 4, win 512, options [nop,nop,TS val 334489084 ecr 334489084], length 2
2022-04-06 13:36:46.581728 IP (tos 0x0, ttl 64, id 37039, offset 0, flags [DF], proto TCP (6), length 52)
    127.0.0.1.47672 > 127.0.0.1.9950: Flags [.], cksum 0xfe28 (incorrect -> 0x6906), seq 4, ack 3, win 512, options [nop,nop,TS val 334489084 ecr 334489084], length 0
2022-04-06 13:36:46.583867 IP (tos 0x0, ttl 64, id 37040, offset 0, flags [DF], proto TCP (6), length 62)
    127.0.0.1.47672 > 127.0.0.1.9950: Flags [P.], cksum 0xfe32 (incorrect -> 0x0fa5), seq 4:14, ack 3, win 512, options [nop,nop,TS val 334489086 ecr 334489084], length 10
2022-04-06 13:36:46.583886 IP (tos 0x0, ttl 64, id 38171, offset 0, flags [DF], proto TCP (6), length 52)
    127.0.0.1.9950 > 127.0.0.1.47672: Flags [.], cksum 0xfe28 (incorrect -> 0x68f8), seq 3, ack 14, win 512, options [nop,nop,TS val 334489086 ecr 334489086], length 0
2022-04-06 13:36:46.858285 IP (tos 0x0, ttl 64, id 38172, offset 0, flags [DF], proto TCP (6), length 62)
    127.0.0.1.9950 > 127.0.0.1.47672: Flags [P.], cksum 0xfe32 (incorrect -> 0x62d2), seq 3:13, ack 14, win 512, options [nop,nop,TS val 334489361 ecr 334489086], length 10
2022-04-06 13:36:46.858298 IP (tos 0x0, ttl 64, id 37041, offset 0, flags [DF], proto TCP (6), length 52)
    127.0.0.1.47672 > 127.0.0.1.9950: Flags [.], cksum 0xfe28 (incorrect -> 0x66c8), seq 14, ack 13, win 512, options [nop,nop,TS val 334489361 ecr 334489361], length 0
2022-04-06 13:36:46.864012 IP (tos 0x0, ttl 64, id 37042, offset 0, flags [DF], proto TCP (6), length 569)
    127.0.0.1.47672 > 127.0.0.1.9950: Flags [P.], cksum 0x002e (incorrect -> 0x65f6), seq 14:531, ack 13, win 512, options [nop,nop,TS val 334489366 ecr 334489361], length 517
2022-04-06 13:36:46.864030 IP (tos 0x0, ttl 64, id 38173, offset 0, flags [DF], proto TCP (6), length 52)
    127.0.0.1.9950 > 127.0.0.1.47672: Flags [.], cksum 0xfe28 (incorrect -> 0x64bd), seq 13, ack 531, win 508, options [nop,nop,TS val 334489366 ecr 334489366], length 0
2022-04-06 13:36:47.140878 IP (tos 0x0, ttl 64, id 38174, offset 0, flags [DF], proto TCP (6), length 3538)
    127.0.0.1.9950 > 127.0.0.1.47672: Flags [P.], cksum 0x0bc7 (incorrect -> 0x4932), seq 13:3499, ack 531, win 512, options [nop,nop,TS val 334489643 ecr 334489366], length 3486
2022-04-06 13:36:47.140889 IP (tos 0x0, ttl 64, id 37043, offset 0, flags [DF], proto TCP (6), length 52)
    127.0.0.1.47672 > 127.0.0.1.9950: Flags [.], cksum 0xfe28 (incorrect -> 0x5503), seq 531, ack 3499, win 494, options [nop,nop,TS val 334489643 ecr 334489643], length 0
2022-04-06 13:36:47.141472 IP (tos 0x0, ttl 64, id 37044, offset 0, flags [DF], proto TCP (6), length 132)
    127.0.0.1.47672 > 127.0.0.1.9950: Flags [P.], cksum 0xfe78 (incorrect -> 0x8196), seq 531:611, ack 3499, win 494, options [nop,nop,TS val 334489644 ecr 334489643], length 80
2022-04-06 13:36:47.141478 IP (tos 0x0, ttl 64, id 38175, offset 0, flags [DF], proto TCP (6), length 52)
    127.0.0.1.9950 > 127.0.0.1.47672: Flags [.], cksum 0xfe28 (incorrect -> 0x549f), seq 3499, ack 611, win 512, options [nop,nop,TS val 334489644 ecr 334489644], length 0
2022-04-06 13:36:47.141926 IP (tos 0x0, ttl 64, id 37045, offset 0, flags [DF], proto TCP (6), length 359)
    127.0.0.1.47672 > 127.0.0.1.9950: Flags [P.], cksum 0xff5b (incorrect -> 0x86dc), seq 611:918, ack 3499, win 494, options [nop,nop,TS val 334489644 ecr 334489644], length 307
2022-04-06 13:36:47.141930 IP (tos 0x0, ttl 64, id 38176, offset 0, flags [DF], proto TCP (6), length 52)
    127.0.0.1.9950 > 127.0.0.1.47672: Flags [.], cksum 0xfe28 (incorrect -> 0x536e), seq 3499, ack 918, win 510, options [nop,nop,TS val 334489644 ecr 334489644], length 0
2022-04-06 13:36:47.272758 IP (tos 0x0, ttl 64, id 38177, offset 0, flags [DF], proto TCP (6), length 194)
    127.0.0.1.9950 > 127.0.0.1.47672: Flags [P.], cksum 0xfeb6 (incorrect -> 0x455e), seq 3499:3641, ack 918, win 512, options [nop,nop,TS val 334489775 ecr 334489644], length 142
2022-04-06 13:36:47.272769 IP (tos 0x0, ttl 64, id 37046, offset 0, flags [DF], proto TCP (6), length 52)
    127.0.0.1.47672 > 127.0.0.1.9950: Flags [.], cksum 0xfe28 (incorrect -> 0x51dd), seq 918, ack 3641, win 507, options [nop,nop,TS val 334489775 ecr 334489775], length 0
2022-04-06 13:36:47.442944 IP (tos 0x0, ttl 64, id 38178, offset 0, flags [DF], proto TCP (6), length 3538)
    127.0.0.1.9950 > 127.0.0.1.47672: Flags [P.], cksum 0x0bc7 (incorrect -> 0x5137), seq 3641:7127, ack 918, win 512, options [nop,nop,TS val 334489945 ecr 334489775], length 3486
2022-04-06 13:36:47.442971 IP (tos 0x0, ttl 64, id 37047, offset 0, flags [DF], proto TCP (6), length 52)
    127.0.0.1.47672 > 127.0.0.1.9950: Flags [.], cksum 0xfe28 (incorrect -> 0x42f8), seq 918, ack 7127, win 494, options [nop,nop,TS val 334489945 ecr 334489945], length 0
2022-04-06 13:36:47.446401 IP (tos 0x0, ttl 64, id 38179, offset 0, flags [DF], proto TCP (6), length 4036)
    127.0.0.1.9950 > 127.0.0.1.47672: Flags [P.], cksum 0x0db9 (incorrect -> 0x79e5), seq 7127:11111, ack 918, win 512, options [nop,nop,TS val 334489949 ecr 334489945], length 3984
2022-04-06 13:36:47.446410 IP (tos 0x0, ttl 64, id 37048, offset 0, flags [DF], proto TCP (6), length 52)
    127.0.0.1.47672 > 127.0.0.1.9950: Flags [.], cksum 0xfe28 (incorrect -> 0x3362), seq 918, ack 11111, win 492, options [nop,nop,TS val 334489949 ecr 334489949], length 0
2022-04-06 13:36:47.451979 IP (tos 0x0, ttl 64, id 38180, offset 0, flags [DF], proto TCP (6), length 1318)
    127.0.0.1.9950 > 127.0.0.1.47672: Flags [P.], cksum 0x031b (incorrect -> 0x989b), seq 11111:12377, ack 918, win 512, options [nop,nop,TS val 334489954 ecr 334489949], length 1266
2022-04-06 13:36:47.451983 IP (tos 0x0, ttl 64, id 37049, offset 0, flags [DF], proto TCP (6), length 52)
    127.0.0.1.47672 > 127.0.0.1.9950: Flags [.], cksum 0xfe28 (incorrect -> 0x2e5b), seq 918, ack 12377, win 503, options [nop,nop,TS val 334489954 ecr 334489954], length 0
2022-04-06 13:36:47.452044 IP (tos 0x0, ttl 64, id 38181, offset 0, flags [DF], proto TCP (6), length 2964)
    127.0.0.1.9950 > 127.0.0.1.47672: Flags [P.], cksum 0x0989 (incorrect -> 0x84c9), seq 12377:15289, ack 918, win 512, options [nop,nop,TS val 334489954 ecr 334489954], length 2912
2022-04-06 13:36:47.452048 IP (tos 0x0, ttl 64, id 37050, offset 0, flags [DF], proto TCP (6), length 52)
    127.0.0.1.47672 > 127.0.0.1.9950: Flags [.], cksum 0xfe28 (incorrect -> 0x2302), seq 918, ack 15289, win 496, options [nop,nop,TS val 334489954 ecr 334489954], length 0
2022-04-06 13:36:47.589871 IP (tos 0x0, ttl 64, id 38182, offset 0, flags [DF], proto TCP (6), length 3462)
    127.0.0.1.9950 > 127.0.0.1.47672: Flags [P.], cksum 0x0b7b (incorrect -> 0xf193), seq 15289:18699, ack 918, win 512, options [nop,nop,TS val 334490092 ecr 334489954], length 3410
2022-04-06 13:36:47.589876 IP (tos 0x0, ttl 64, id 37051, offset 0, flags [DF], proto TCP (6), length 52)
    127.0.0.1.47672 > 127.0.0.1.9950: Flags [.], cksum 0xfe28 (incorrect -> 0x149e), seq 918, ack 18699, win 494, options [nop,nop,TS val 334490092 ecr 334490092], length 0
2022-04-06 13:36:47.601333 IP (tos 0x0, ttl 64, id 38183, offset 0, flags [DF], proto TCP (6), length 3150)
    127.0.0.1.9950 > 127.0.0.1.47672: Flags [P.], cksum 0x0a43 (incorrect -> 0x060b), seq 18699:21797, ack 918, win 512, options [nop,nop,TS val 334490104 ecr 334490092], length 3098
2022-04-06 13:36:47.601338 IP (tos 0x0, ttl 64, id 37052, offset 0, flags [DF], proto TCP (6), length 52)
    127.0.0.1.47672 > 127.0.0.1.9950: Flags [.], cksum 0xfe28 (incorrect -> 0x086b), seq 918, ack 21797, win 495, options [nop,nop,TS val 334490104 ecr 334490104], length 0
2022-04-06 13:36:47.602170 IP (tos 0x0, ttl 64, id 38184, offset 0, flags [DF], proto TCP (6), length 1508)
    127.0.0.1.9950 > 127.0.0.1.47672: Flags [P.], cksum 0x03d9 (incorrect -> 0xafaf), seq 21797:23253, ack 918, win 512, options [nop,nop,TS val 334490105 ecr 334490104], length 1456
2022-04-06 13:36:47.602174 IP (tos 0x0, ttl 64, id 37053, offset 0, flags [DF], proto TCP (6), length 52)
    127.0.0.1.47672 > 127.0.0.1.9950: Flags [.], cksum 0xfe28 (incorrect -> 0x02b2), seq 918, ack 23253, win 502, options [nop,nop,TS val 334490105 ecr 334490105], length 0
2022-04-06 13:36:47.617765 IP (tos 0x0, ttl 64, id 38185, offset 0, flags [DF], proto TCP (6), length 3462)
    127.0.0.1.9950 > 127.0.0.1.47672: Flags [P.], cksum 0x0b7b (incorrect -> 0xe9e1), seq 23253:26663, ack 918, win 512, options [nop,nop,TS val 334490120 ecr 334490105], length 3410
2022-04-06 13:36:47.617774 IP (tos 0x0, ttl 64, id 37054, offset 0, flags [DF], proto TCP (6), length 52)
    127.0.0.1.47672 > 127.0.0.1.9950: Flags [.], cksum 0xfe28 (incorrect -> 0xf549), seq 918, ack 26663, win 494, options [nop,nop,TS val 334490120 ecr 334490120], length 0
2022-04-06 13:36:47.630002 IP (tos 0x0, ttl 64, id 38186, offset 0, flags [DF], proto TCP (6), length 3462)
    127.0.0.1.9950 > 127.0.0.1.47672: Flags [P.], cksum 0x0b7b (incorrect -> 0x62b0), seq 26663:30073, ack 918, win 512, options [nop,nop,TS val 334490132 ecr 334490120], length 3410
2022-04-06 13:36:47.630007 IP (tos 0x0, ttl 64, id 37055, offset 0, flags [DF], proto TCP (6), length 52)
    127.0.0.1.47672 > 127.0.0.1.9950: Flags [.], cksum 0xfe28 (incorrect -> 0xe7df), seq 918, ack 30073, win 494, options [nop,nop,TS val 334490132 ecr 334490132], length 0
2022-04-06 13:36:47.649987 IP (tos 0x0, ttl 64, id 38187, offset 0, flags [DF], proto TCP (6), length 3462)
    127.0.0.1.9950 > 127.0.0.1.47672: Flags [P.], cksum 0x0b7b (incorrect -> 0x19df), seq 30073:33483, ack 918, win 512, options [nop,nop,TS val 334490152 ecr 334490132], length 3410
2022-04-06 13:36:47.649991 IP (tos 0x0, ttl 64, id 37056, offset 0, flags [DF], proto TCP (6), length 52)
    127.0.0.1.47672 > 127.0.0.1.9950: Flags [.], cksum 0xfe28 (incorrect -> 0xda65), seq 918, ack 33483, win 494, options [nop,nop,TS val 334490152 ecr 334490152], length 0
200, 122.46110248565674, 1.5982301235198975