2022-04-06 10:23:27.102571 IP (tos 0x0, ttl 64, id 57147, offset 0, flags [DF], proto TCP (6), length 60)
    127.0.0.1.48206 > 127.0.0.1.9650: Flags [S], cksum 0xfe30 (incorrect -> 0xfdca), seq 3580469256, win 65495, options [mss 65495,sackOK,TS val 322889605 ecr 0,nop,wscale 7], length 0
2022-04-06 10:23:27.102579 IP (tos 0x0, ttl 64, id 0, offset 0, flags [DF], proto TCP (6), length 60)
    127.0.0.1.9650 > 127.0.0.1.48206: Flags [S.], cksum 0xfe30 (incorrect -> 0x8c49), seq 459365207, ack 3580469257, win 65483, options [mss 65495,sackOK,TS val 322889605 ecr 322889605,nop,wscale 7], length 0
2022-04-06 10:23:27.102587 IP (tos 0x0, ttl 64, id 57148, offset 0, flags [DF], proto TCP (6), length 52)
    127.0.0.1.48206 > 127.0.0.1.9650: Flags [.], cksum 0xfe28 (incorrect -> 0xb305), seq 1, ack 1, win 512, options [nop,nop,TS val 322889605 ecr 322889605], length 0
2022-04-06 10:23:27.102707 IP (tos 0x0, ttl 64, id 57149, offset 0, flags [DF], proto TCP (6), length 55)
    127.0.0.1.48206 > 127.0.0.1.9650: Flags [P.], cksum 0xfe2b (incorrect -> 0xadf9), seq 1:4, ack 1, win 512, options [nop,nop,TS val 322889605 ecr 322889605], length 3
2022-04-06 10:23:27.102712 IP (tos 0x0, ttl 64, id 18768, offset 0, flags [DF], proto TCP (6), length 52)
    127.0.0.1.9650 > 127.0.0.1.48206: Flags [.], cksum 0xfe28 (incorrect -> 0xb302), seq 1, ack 4, win 512, options [nop,nop,TS val 322889605 ecr 322889605], length 0
2022-04-06 10:23:27.102933 IP (tos 0x0, ttl 64, id 18769, offset 0, flags [DF], proto TCP (6), length 54)
    127.0.0.1.9650 > 127.0.0.1.48206: Flags [P.], cksum 0xfe2a (incorrect -> 0xadf8), seq 1:3, ack 4, win 512, options [nop,nop,TS val 322889605 ecr 322889605], length 2
2022-04-06 10:23:27.102962 IP (tos 0x0, ttl 64, id 57150, offset 0, flags [DF], proto TCP (6), length 52)
    127.0.0.1.48206 > 127.0.0.1.9650: Flags [.], cksum 0xfe28 (incorrect -> 0xb300), seq 4, ack 3, win 512, options [nop,nop,TS val 322889605 ecr 322889605], length 0
2022-04-06 10:23:27.114329 IP (tos 0x0, ttl 64, id 57151, offset 0, flags [DF], proto TCP (6), length 62)
    127.0.0.1.48206 > 127.0.0.1.9650: Flags [P.], cksum 0xfe32 (incorrect -> 0x714e), seq 4:14, ack 3, win 512, options [nop,nop,TS val 322889617 ecr 322889605], length 10
2022-04-06 10:23:27.114349 IP (tos 0x0, ttl 64, id 18770, offset 0, flags [DF], proto TCP (6), length 52)
    127.0.0.1.9650 > 127.0.0.1.48206: Flags [.], cksum 0xfe28 (incorrect -> 0xb2de), seq 3, ack 14, win 512, options [nop,nop,TS val 322889617 ecr 322889617], length 0
2022-04-06 10:23:27.202155 IP (tos 0x0, ttl 64, id 18771, offset 0, flags [DF], proto TCP (6), length 62)
    127.0.0.1.9650 > 127.0.0.1.48206: Flags [P.], cksum 0xfe32 (incorrect -> 0xad73), seq 3:13, ack 14, win 512, options [nop,nop,TS val 322889705 ecr 322889617], length 10
2022-04-06 10:23:27.202165 IP (tos 0x0, ttl 64, id 57152, offset 0, flags [DF], proto TCP (6), length 52)
    127.0.0.1.48206 > 127.0.0.1.9650: Flags [.], cksum 0xfe28 (incorrect -> 0xb224), seq 14, ack 13, win 512, options [nop,nop,TS val 322889705 ecr 322889705], length 0
2022-04-06 10:23:27.208397 IP (tos 0x0, ttl 64, id 57153, offset 0, flags [DF], proto TCP (6), length 569)
    127.0.0.1.48206 > 127.0.0.1.9650: Flags [P.], cksum 0x002e (incorrect -> 0x5672), seq 14:531, ack 13, win 512, options [nop,nop,TS val 322889711 ecr 322889705], length 517
2022-04-06 10:23:27.208407 IP (tos 0x0, ttl 64, id 18772, offset 0, flags [DF], proto TCP (6), length 52)
    127.0.0.1.9650 > 127.0.0.1.48206: Flags [.], cksum 0xfe28 (incorrect -> 0xb017), seq 13, ack 531, win 508, options [nop,nop,TS val 322889711 ecr 322889711], length 0
200, 6.866265296936035, 0.640643835067749