2022-04-06 01:58:56.257104 IP (tos 0x0, ttl 64, id 18105, offset 0, flags [DF], proto TCP (6), length 60)
    127.0.0.1.33418 > 127.0.0.1.12250: Flags [S], cksum 0xfe30 (incorrect -> 0xa248), seq 2676377685, win 65495, options [mss 65495,sackOK,TS val 292618760 ecr 0,nop,wscale 7], length 0
2022-04-06 01:58:56.257115 IP (tos 0x0, ttl 64, id 0, offset 0, flags [DF], proto TCP (6), length 60)
    127.0.0.1.12250 > 127.0.0.1.33418: Flags [S.], cksum 0xfe30 (incorrect -> 0x2dfb), seq 1364463483, ack 2676377686, win 65483, options [mss 65495,sackOK,TS val 292618760 ecr 292618760,nop,wscale 7], length 0
2022-04-06 01:58:56.257125 IP (tos 0x0, ttl 64, id 18106, offset 0, flags [DF], proto TCP (6), length 52)
    127.0.0.1.33418 > 127.0.0.1.12250: Flags [.], cksum 0xfe28 (incorrect -> 0x54b7), seq 1, ack 1, win 512, options [nop,nop,TS val 292618760 ecr 292618760], length 0
2022-04-06 01:58:56.257217 IP (tos 0x0, ttl 64, id 18107, offset 0, flags [DF], proto TCP (6), length 55)
    127.0.0.1.33418 > 127.0.0.1.12250: Flags [P.], cksum 0xfe2b (incorrect -> 0x4fab), seq 1:4, ack 1, win 512, options [nop,nop,TS val 292618760 ecr 292618760], length 3
2022-04-06 01:58:56.257232 IP (tos 0x0, ttl 64, id 52273, offset 0, flags [DF], proto TCP (6), length 52)
    127.0.0.1.12250 > 127.0.0.1.33418: Flags [.], cksum 0xfe28 (incorrect -> 0x54b4), seq 1, ack 4, win 512, options [nop,nop,TS val 292618760 ecr 292618760], length 0
2022-04-06 01:58:56.257294 IP (tos 0x0, ttl 64, id 52274, offset 0, flags [DF], proto TCP (6), length 54)
    127.0.0.1.12250 > 127.0.0.1.33418: Flags [P.], cksum 0xfe2a (incorrect -> 0x4faa), seq 1:3, ack 4, win 512, options [nop,nop,TS val 292618760 ecr 292618760], length 2
2022-04-06 01:58:56.257311 IP (tos 0x0, ttl 64, id 18108, offset 0, flags [DF], proto TCP (6), length 52)
    127.0.0.1.33418 > 127.0.0.1.12250: Flags [.], cksum 0xfe28 (incorrect -> 0x54b2), seq 4, ack 3, win 512, options [nop,nop,TS val 292618760 ecr 292618760], length 0
2022-04-06 01:58:56.258725 IP (tos 0x0, ttl 64, id 18109, offset 0, flags [DF], proto TCP (6), length 62)
    127.0.0.1.33418 > 127.0.0.1.12250: Flags [P.], cksum 0xfe32 (incorrect -> 0xb572), seq 4:14, ack 3, win 512, options [nop,nop,TS val 292618761 ecr 292618760], length 10
2022-04-06 01:58:56.258742 IP (tos 0x0, ttl 64, id 52275, offset 0, flags [DF], proto TCP (6), length 52)
    127.0.0.1.12250 > 127.0.0.1.33418: Flags [.], cksum 0xfe28 (incorrect -> 0x54a6), seq 3, ack 14, win 512, options [nop,nop,TS val 292618761 ecr 292618761], length 0
2022-04-06 01:58:56.386594 IP (tos 0x0, ttl 64, id 52276, offset 0, flags [DF], proto TCP (6), length 62)
    127.0.0.1.12250 > 127.0.0.1.33418: Flags [P.], cksum 0xfe32 (incorrect -> 0x4f13), seq 3:13, ack 14, win 512, options [nop,nop,TS val 292618889 ecr 292618761], length 10
2022-04-06 01:58:56.386607 IP (tos 0x0, ttl 64, id 18110, offset 0, flags [DF], proto TCP (6), length 52)
    127.0.0.1.33418 > 127.0.0.1.12250: Flags [.], cksum 0xfe28 (incorrect -> 0x539c), seq 14, ack 13, win 512, options [nop,nop,TS val 292618889 ecr 292618889], length 0
2022-04-06 01:58:56.392266 IP (tos 0x0, ttl 64, id 18111, offset 0, flags [DF], proto TCP (6), length 569)
    127.0.0.1.33418 > 127.0.0.1.12250: Flags [P.], cksum 0x002e (incorrect -> 0x588d), seq 14:531, ack 13, win 512, options [nop,nop,TS val 292618895 ecr 292618889], length 517
2022-04-06 01:58:56.392276 IP (tos 0x0, ttl 64, id 52277, offset 0, flags [DF], proto TCP (6), length 52)
    127.0.0.1.12250 > 127.0.0.1.33418: Flags [.], cksum 0xfe28 (incorrect -> 0x518f), seq 13, ack 531, win 508, options [nop,nop,TS val 292618895 ecr 292618895], length 0
200, 3.7664406299591064, 0.5274941921234131