2022-04-06 08:14:09.980783 IP (tos 0x0, ttl 64, id 59536, offset 0, flags [DF], proto TCP (6), length 60)
    127.0.0.1.56842 > 127.0.0.1.11450: Flags [S], cksum 0xfe30 (incorrect -> 0xae73), seq 507370368, win 65495, options [mss 65495,sackOK,TS val 315132483 ecr 0,nop,wscale 7], length 0
2022-04-06 08:14:09.980798 IP (tos 0x0, ttl 64, id 0, offset 0, flags [DF], proto TCP (6), length 60)
    127.0.0.1.11450 > 127.0.0.1.56842: Flags [S.], cksum 0xfe30 (incorrect -> 0xf12b), seq 1928834367, ack 507370369, win 65483, options [mss 65495,sackOK,TS val 315132483 ecr 315132483,nop,wscale 7], length 0
2022-04-06 08:14:09.980810 IP (tos 0x0, ttl 64, id 59537, offset 0, flags [DF], proto TCP (6), length 52)
    127.0.0.1.56842 > 127.0.0.1.11450: Flags [.], cksum 0xfe28 (incorrect -> 0x17e8), seq 1, ack 1, win 512, options [nop,nop,TS val 315132483 ecr 315132483], length 0
2022-04-06 08:14:09.980974 IP (tos 0x0, ttl 64, id 59538, offset 0, flags [DF], proto TCP (6), length 55)
    127.0.0.1.56842 > 127.0.0.1.11450: Flags [P.], cksum 0xfe2b (incorrect -> 0x12dc), seq 1:4, ack 1, win 512, options [nop,nop,TS val 315132483 ecr 315132483], length 3
2022-04-06 08:14:09.980983 IP (tos 0x0, ttl 64, id 55401, offset 0, flags [DF], proto TCP (6), length 52)
    127.0.0.1.11450 > 127.0.0.1.56842: Flags [.], cksum 0xfe28 (incorrect -> 0x17e5), seq 1, ack 4, win 512, options [nop,nop,TS val 315132483 ecr 315132483], length 0
2022-04-06 08:14:09.981011 IP (tos 0x0, ttl 64, id 55402, offset 0, flags [DF], proto TCP (6), length 54)
    127.0.0.1.11450 > 127.0.0.1.56842: Flags [P.], cksum 0xfe2a (incorrect -> 0x12db), seq 1:3, ack 4, win 512, options [nop,nop,TS val 315132483 ecr 315132483], length 2
2022-04-06 08:14:09.981020 IP (tos 0x0, ttl 64, id 59539, offset 0, flags [DF], proto TCP (6), length 52)
    127.0.0.1.56842 > 127.0.0.1.11450: Flags [.], cksum 0xfe28 (incorrect -> 0x17e3), seq 4, ack 3, win 512, options [nop,nop,TS val 315132483 ecr 315132483], length 0
2022-04-06 08:14:09.982187 IP (tos 0x0, ttl 64, id 59540, offset 0, flags [DF], proto TCP (6), length 62)
    127.0.0.1.56842 > 127.0.0.1.11450: Flags [P.], cksum 0xfe32 (incorrect -> 0xa570), seq 4:14, ack 3, win 512, options [nop,nop,TS val 315132485 ecr 315132483], length 10
2022-04-06 08:14:09.982209 IP (tos 0x0, ttl 64, id 55403, offset 0, flags [DF], proto TCP (6), length 52)
    127.0.0.1.11450 > 127.0.0.1.56842: Flags [.], cksum 0xfe28 (incorrect -> 0x17d5), seq 3, ack 14, win 512, options [nop,nop,TS val 315132485 ecr 315132485], length 0
2022-04-06 08:14:10.056428 IP (tos 0x0, ttl 64, id 55404, offset 0, flags [DF], proto TCP (6), length 62)
    127.0.0.1.11450 > 127.0.0.1.56842: Flags [P.], cksum 0xfe32 (incorrect -> 0x1278), seq 3:13, ack 14, win 512, options [nop,nop,TS val 315132559 ecr 315132485], length 10
2022-04-06 08:14:10.056438 IP (tos 0x0, ttl 64, id 59541, offset 0, flags [DF], proto TCP (6), length 52)
    127.0.0.1.56842 > 127.0.0.1.11450: Flags [.], cksum 0xfe28 (incorrect -> 0x1737), seq 14, ack 13, win 512, options [nop,nop,TS val 315132559 ecr 315132559], length 0
2022-04-06 08:14:10.062167 IP (tos 0x0, ttl 64, id 59542, offset 0, flags [DF], proto TCP (6), length 569)
    127.0.0.1.56842 > 127.0.0.1.11450: Flags [P.], cksum 0x002e (incorrect -> 0x91b3), seq 14:531, ack 13, win 512, options [nop,nop,TS val 315132565 ecr 315132559], length 517
2022-04-06 08:14:10.062180 IP (tos 0x0, ttl 64, id 55405, offset 0, flags [DF], proto TCP (6), length 52)
    127.0.0.1.11450 > 127.0.0.1.56842: Flags [.], cksum 0xfe28 (incorrect -> 0x152a), seq 13, ack 531, win 508, options [nop,nop,TS val 315132565 ecr 315132565], length 0
2022-04-06 08:14:10.180360 IP (tos 0x0, ttl 64, id 55406, offset 0, flags [DF], proto TCP (6), length 3538)
    127.0.0.1.11450 > 127.0.0.1.56842: Flags [P.], cksum 0x0bc7 (incorrect -> 0x51e0), seq 13:3499, ack 531, win 512, options [nop,nop,TS val 315132683 ecr 315132565], length 3486
2022-04-06 08:14:10.180370 IP (tos 0x0, ttl 64, id 59543, offset 0, flags [DF], proto TCP (6), length 52)
    127.0.0.1.56842 > 127.0.0.1.11450: Flags [.], cksum 0xfe28 (incorrect -> 0x06ae), seq 531, ack 3499, win 494, options [nop,nop,TS val 315132683 ecr 315132683], length 0
2022-04-06 08:14:10.210310 IP (tos 0x0, ttl 64, id 55407, offset 0, flags [DF], proto TCP (6), length 662)
    127.0.0.1.11450 > 127.0.0.1.56842: Flags [P.], cksum 0x008b (incorrect -> 0xaed3), seq 3499:4109, ack 531, win 512, options [nop,nop,TS val 315132713 ecr 315132683], length 610
2022-04-06 08:14:10.210318 IP (tos 0x0, ttl 64, id 59544, offset 0, flags [DF], proto TCP (6), length 52)
    127.0.0.1.56842 > 127.0.0.1.11450: Flags [.], cksum 0xfe28 (incorrect -> 0x0405), seq 531, ack 4109, win 505, options [nop,nop,TS val 315132713 ecr 315132713], length 0
2022-04-06 08:14:10.219530 IP (tos 0x0, ttl 64, id 55408, offset 0, flags [DF], proto TCP (6), length 1082)
    127.0.0.1.11450 > 127.0.0.1.56842: Flags [P.], cksum 0x022f (incorrect -> 0xf657), seq 4109:5139, ack 531, win 512, options [nop,nop,TS val 315132722 ecr 315132713], length 1030
2022-04-06 08:14:10.219538 IP (tos 0x0, ttl 64, id 59545, offset 0, flags [DF], proto TCP (6), length 52)
    127.0.0.1.56842 > 127.0.0.1.11450: Flags [.], cksum 0xfe28 (incorrect -> 0xffee), seq 531, ack 5139, win 503, options [nop,nop,TS val 315132722 ecr 315132722], length 0
2022-04-06 08:14:10.219979 IP (tos 0x0, ttl 64, id 59546, offset 0, flags [DF], proto TCP (6), length 132)
    127.0.0.1.56842 > 127.0.0.1.11450: Flags [P.], cksum 0xfe78 (incorrect -> 0x839e), seq 531:611, ack 5139, win 512, options [nop,nop,TS val 315132722 ecr 315132722], length 80
2022-04-06 08:14:10.219987 IP (tos 0x0, ttl 64, id 55409, offset 0, flags [DF], proto TCP (6), length 52)
    127.0.0.1.11450 > 127.0.0.1.56842: Flags [.], cksum 0xfe28 (incorrect -> 0xff95), seq 5139, ack 611, win 512, options [nop,nop,TS val 315132722 ecr 315132722], length 0
2022-04-06 08:14:10.220344 IP (tos 0x0, ttl 64, id 59547, offset 0, flags [DF], proto TCP (6), length 374)
    127.0.0.1.56842 > 127.0.0.1.11450: Flags [P.], cksum 0xff6a (incorrect -> 0x2e74), seq 611:933, ack 5139, win 512, options [nop,nop,TS val 315132723 ecr 315132722], length 322
2022-04-06 08:14:10.220353 IP (tos 0x0, ttl 64, id 55410, offset 0, flags [DF], proto TCP (6), length 52)
    127.0.0.1.11450 > 127.0.0.1.56842: Flags [.], cksum 0xfe28 (incorrect -> 0xfe53), seq 5139, ack 933, win 510, options [nop,nop,TS val 315132723 ecr 315132723], length 0
2022-04-06 08:14:10.303525 IP (tos 0x0, ttl 64, id 55411, offset 0, flags [DF], proto TCP (6), length 594)
    127.0.0.1.11450 > 127.0.0.1.56842: Flags [P.], cksum 0x0047 (incorrect -> 0x4ef6), seq 5139:5681, ack 933, win 512, options [nop,nop,TS val 315132806 ecr 315132723], length 542
2022-04-06 08:14:10.303533 IP (tos 0x0, ttl 64, id 59548, offset 0, flags [DF], proto TCP (6), length 52)
    127.0.0.1.56842 > 127.0.0.1.11450: Flags [.], cksum 0xfe28 (incorrect -> 0xfb91), seq 933, ack 5681, win 508, options [nop,nop,TS val 315132806 ecr 315132806], length 0
2022-04-06 08:14:12.341278 IP (tos 0x0, ttl 64, id 55412, offset 0, flags [DF], proto TCP (6), length 4100)
    127.0.0.1.11450 > 127.0.0.1.56842: Flags [P.], cksum 0x0df9 (incorrect -> 0x1264), seq 5681:9729, ack 933, win 512, options [nop,nop,TS val 315134844 ecr 315132806], length 4048
2022-04-06 08:14:12.341286 IP (tos 0x0, ttl 64, id 59549, offset 0, flags [DF], proto TCP (6), length 52)
    127.0.0.1.56842 > 127.0.0.1.11450: Flags [.], cksum 0xfe28 (incorrect -> 0xdbe5), seq 933, ack 9729, win 492, options [nop,nop,TS val 315134844 ecr 315134844], length 0
2022-04-06 08:14:12.341293 IP (tos 0x0, ttl 64, id 55413, offset 0, flags [DF], proto TCP (6), length 3262)
    127.0.0.1.11450 > 127.0.0.1.56842: Flags [P.], cksum 0x0ab3 (incorrect -> 0xd4c6), seq 9729:12939, ack 933, win 512, options [nop,nop,TS val 315134844 ecr 315134844], length 3210
2022-04-06 08:14:12.341297 IP (tos 0x0, ttl 64, id 59550, offset 0, flags [DF], proto TCP (6), length 52)
    127.0.0.1.56842 > 127.0.0.1.11450: Flags [.], cksum 0xfe28 (incorrect -> 0xcf68), seq 933, ack 12939, win 479, options [nop,nop,TS val 315134844 ecr 315134844], length 0
2022-04-06 08:14:12.350510 IP (tos 0x0, ttl 64, id 55414, offset 0, flags [DF], proto TCP (6), length 2542)
    127.0.0.1.11450 > 127.0.0.1.56842: Flags [P.], cksum 0x07e3 (incorrect -> 0xc7bd), seq 12939:15429, ack 933, win 512, options [nop,nop,TS val 315134853 ecr 315134844], length 2490
2022-04-06 08:14:12.350516 IP (tos 0x0, ttl 64, id 59551, offset 0, flags [DF], proto TCP (6), length 52)
    127.0.0.1.56842 > 127.0.0.1.11450: Flags [.], cksum 0xfe28 (incorrect -> 0xc589), seq 933, ack 15429, win 498, options [nop,nop,TS val 315134853 ecr 315134853], length 0
2022-04-06 08:14:12.359719 IP (tos 0x0, ttl 64, id 55415, offset 0, flags [DF], proto TCP (6), length 1546)
    127.0.0.1.11450 > 127.0.0.1.56842: Flags [P.], cksum 0x03ff (incorrect -> 0x38dc), seq 15429:16923, ack 933, win 512, options [nop,nop,TS val 315134862 ecr 315134853], length 1494
2022-04-06 08:14:12.359724 IP (tos 0x0, ttl 64, id 59552, offset 0, flags [DF], proto TCP (6), length 52)
    127.0.0.1.56842 > 127.0.0.1.11450: Flags [.], cksum 0xfe28 (incorrect -> 0xbf9d), seq 933, ack 16923, win 502, options [nop,nop,TS val 315134862 ecr 315134862], length 0
2022-04-06 08:14:12.368943 IP (tos 0x0, ttl 64, id 55416, offset 0, flags [DF], proto TCP (6), length 4100)
    127.0.0.1.11450 > 127.0.0.1.56842: Flags [P.], cksum 0x0df9 (incorrect -> 0x8148), seq 16923:20971, ack 933, win 512, options [nop,nop,TS val 315134871 ecr 315134862], length 4048
2022-04-06 08:14:12.368955 IP (tos 0x0, ttl 64, id 59553, offset 0, flags [DF], proto TCP (6), length 52)
    127.0.0.1.56842 > 127.0.0.1.11450: Flags [.], cksum 0xfe28 (incorrect -> 0xafc5), seq 933, ack 20971, win 492, options [nop,nop,TS val 315134871 ecr 315134871], length 0
2022-04-06 08:14:12.368962 IP (tos 0x0, ttl 64, id 55417, offset 0, flags [DF], proto TCP (6), length 3050)
    127.0.0.1.11450 > 127.0.0.1.56842: Flags [P.], cksum 0x09df (incorrect -> 0x3ce5), seq 20971:23969, ack 933, win 512, options [nop,nop,TS val 315134871 ecr 315134871], length 2998
2022-04-06 08:14:12.368965 IP (tos 0x0, ttl 64, id 59554, offset 0, flags [DF], proto TCP (6), length 52)
    127.0.0.1.56842 > 127.0.0.1.11450: Flags [.], cksum 0xfe28 (incorrect -> 0xa41b), seq 933, ack 23969, win 480, options [nop,nop,TS val 315134871 ecr 315134871], length 0
2022-04-06 08:14:12.369049 IP (tos 0x0, ttl 64, id 55418, offset 0, flags [DF], proto TCP (6), length 4100)
    127.0.0.1.11450 > 127.0.0.1.56842: Flags [P.], cksum 0x0df9 (incorrect -> 0x4447), seq 23969:28017, ack 933, win 512, options [nop,nop,TS val 315134871 ecr 315134871], length 4048
2022-04-06 08:14:12.369054 IP (tos 0x0, ttl 64, id 59555, offset 0, flags [DF], proto TCP (6), length 52)
    127.0.0.1.56842 > 127.0.0.1.11450: Flags [.], cksum 0xfe28 (incorrect -> 0x945b), seq 933, ack 28017, win 464, options [nop,nop,TS val 315134871 ecr 315134871], length 0
2022-04-06 08:14:12.369060 IP (tos 0x0, ttl 64, id 55419, offset 0, flags [DF], proto TCP (6), length 3798)
    127.0.0.1.11450 > 127.0.0.1.56842: Flags [P.], cksum 0x0ccb (incorrect -> 0x62b1), seq 28017:31763, ack 933, win 512, options [nop,nop,TS val 315134872 ecr 315134871], length 3746
2022-04-06 08:14:12.369063 IP (tos 0x0, ttl 64, id 59556, offset 0, flags [DF], proto TCP (6), length 52)
    127.0.0.1.56842 > 127.0.0.1.11450: Flags [.], cksum 0xfe28 (incorrect -> 0x85c5), seq 933, ack 31763, win 450, options [nop,nop,TS val 315134872 ecr 315134872], length 0
2022-04-06 08:14:12.369074 IP (tos 0x0, ttl 64, id 55420, offset 0, flags [DF], proto TCP (6), length 550)
    127.0.0.1.11450 > 127.0.0.1.56842: Flags [P.], cksum 0x001b (incorrect -> 0x858a), seq 31763:32261, ack 933, win 512, options [nop,nop,TS val 315134872 ecr 315134872], length 498
2022-04-06 08:14:12.369267 IP (tos 0x0, ttl 64, id 59557, offset 0, flags [DF], proto TCP (6), length 52)
    127.0.0.1.56842 > 127.0.0.1.11450: Flags [.], cksum 0xfe28 (incorrect -> 0x8395), seq 933, ack 32261, win 512, options [nop,nop,TS val 315134872 ecr 315134872], length 0
2022-04-06 08:14:12.369781 IP (tos 0x0, ttl 64, id 55421, offset 0, flags [DF], proto TCP (6), length 3538)
    127.0.0.1.11450 > 127.0.0.1.56842: Flags [P.], cksum 0x0bc7 (incorrect -> 0x6847), seq 32261:35747, ack 933, win 512, options [nop,nop,TS val 315134872 ecr 315134872], length 3486
2022-04-06 08:14:12.369823 IP (tos 0x0, ttl 64, id 59558, offset 0, flags [DF], proto TCP (6), length 52)
    127.0.0.1.56842 > 127.0.0.1.11450: Flags [.], cksum 0xfe28 (incorrect -> 0x75f7), seq 933, ack 35747, win 512, options [nop,nop,TS val 315134872 ecr 315134872], length 0
2022-04-06 08:14:12.378278 IP (tos 0x0, ttl 64, id 55422, offset 0, flags [DF], proto TCP (6), length 4036)
    127.0.0.1.11450 > 127.0.0.1.56842: Flags [P.], cksum 0x0db9 (incorrect -> 0xba3b), seq 35747:39731, ack 933, win 512, options [nop,nop,TS val 315134881 ecr 315134872], length 3984
2022-04-06 08:14:12.378356 IP (tos 0x0, ttl 64, id 59559, offset 0, flags [DF], proto TCP (6), length 52)
    127.0.0.1.56842 > 127.0.0.1.11450: Flags [.], cksum 0xfe28 (incorrect -> 0x6655), seq 933, ack 39731, win 512, options [nop,nop,TS val 315134881 ecr 315134881], length 0
2022-04-06 08:14:12.388267 IP (tos 0x0, ttl 64, id 55423, offset 0, flags [DF], proto TCP (6), length 3266)
    127.0.0.1.11450 > 127.0.0.1.56842: Flags [P.], cksum 0x0ab7 (incorrect -> 0x7ee2), seq 39731:42945, ack 933, win 512, options [nop,nop,TS val 315134891 ecr 315134881], length 3214
2022-04-06 08:14:12.388301 IP (tos 0x0, ttl 64, id 59560, offset 0, flags [DF], proto TCP (6), length 52)
    127.0.0.1.56842 > 127.0.0.1.11450: Flags [.], cksum 0xfe28 (incorrect -> 0x59b3), seq 933, ack 42945, win 512, options [nop,nop,TS val 315134891 ecr 315134891], length 0
2022-04-06 08:14:12.395271 IP (tos 0x0, ttl 64, id 55424, offset 0, flags [DF], proto TCP (6), length 980)
    127.0.0.1.11450 > 127.0.0.1.56842: Flags [P.], cksum 0x01c9 (incorrect -> 0x997b), seq 42945:43873, ack 933, win 512, options [nop,nop,TS val 315134898 ecr 315134891], length 928
2022-04-06 08:14:12.395400 IP (tos 0x0, ttl 64, id 59561, offset 0, flags [DF], proto TCP (6), length 52)
    127.0.0.1.56842 > 127.0.0.1.11450: Flags [.], cksum 0xfe28 (incorrect -> 0x5605), seq 933, ack 43873, win 512, options [nop,nop,TS val 315134898 ecr 315134898], length 0
2022-04-06 08:14:12.395406 IP (tos 0x0, ttl 64, id 55425, offset 0, flags [DF], proto TCP (6), length 6390)
    127.0.0.1.11450 > 127.0.0.1.56842: Flags [P.], cksum 0x16eb (incorrect -> 0xfb58), seq 43873:50211, ack 933, win 512, options [nop,nop,TS val 315134898 ecr 315134898], length 6338
2022-04-06 08:14:12.399557 IP (tos 0x0, ttl 64, id 55426, offset 0, flags [DF], proto TCP (6), length 32820)
    127.0.0.1.11450 > 127.0.0.1.56842: Flags [.], cksum 0x7e29 (incorrect -> 0x5752), seq 50211:82979, ack 933, win 512, options [nop,nop,TS val 315134902 ecr 315134898], length 32768
2022-04-06 08:14:12.399573 IP (tos 0x0, ttl 64, id 59562, offset 0, flags [DF], proto TCP (6), length 52)
    127.0.0.1.56842 > 127.0.0.1.11450: Flags [.], cksum 0xfe28 (incorrect -> 0xbdc3), seq 933, ack 82979, win 379, options [nop,nop,TS val 315134902 ecr 315134898], length 0
2022-04-06 08:14:12.399577 IP (tos 0x0, ttl 64, id 55427, offset 0, flags [DF], proto TCP (6), length 176)
    127.0.0.1.11450 > 127.0.0.1.56842: Flags [P.], cksum 0xfea4 (incorrect -> 0x8893), seq 82979:83103, ack 933, win 512, options [nop,nop,TS val 315134902 ecr 315134902], length 124
2022-04-06 08:14:12.399737 IP (tos 0x0, ttl 64, id 59563, offset 0, flags [DF], proto TCP (6), length 52)
    127.0.0.1.56842 > 127.0.0.1.11450: Flags [.], cksum 0xfe28 (incorrect -> 0xbcbe), seq 933, ack 83103, win 512, options [nop,nop,TS val 315134902 ecr 315134902], length 0
2022-04-06 08:14:12.406829 IP (tos 0x0, ttl 64, id 55428, offset 0, flags [DF], proto TCP (6), length 4100)
    127.0.0.1.11450 > 127.0.0.1.56842: Flags [P.], cksum 0x0df9 (incorrect -> 0x6e59), seq 83103:87151, ack 933, win 512, options [nop,nop,TS val 315134909 ecr 315134902], length 4048
2022-04-06 08:14:12.406863 IP (tos 0x0, ttl 64, id 59564, offset 0, flags [DF], proto TCP (6), length 52)
    127.0.0.1.56842 > 127.0.0.1.11450: Flags [.], cksum 0xfe28 (incorrect -> 0xace0), seq 933, ack 87151, win 512, options [nop,nop,TS val 315134909 ecr 315134909], length 0
2022-04-06 08:14:12.406867 IP (tos 0x0, ttl 64, id 55429, offset 0, flags [DF], proto TCP (6), length 744)
    127.0.0.1.11450 > 127.0.0.1.56842: Flags [P.], cksum 0x00dd (incorrect -> 0x8fce), seq 87151:87843, ack 933, win 512, options [nop,nop,TS val 315134909 ecr 315134909], length 692
2022-04-06 08:14:12.406875 IP (tos 0x0, ttl 64, id 59565, offset 0, flags [DF], proto TCP (6), length 52)
    127.0.0.1.56842 > 127.0.0.1.11450: Flags [.], cksum 0xfe28 (incorrect -> 0xaa2c), seq 933, ack 87843, win 512, options [nop,nop,TS val 315134909 ecr 315134909], length 0
2022-04-06 08:14:12.416189 IP (tos 0x0, ttl 64, id 55430, offset 0, flags [DF], proto TCP (6), length 4100)
    127.0.0.1.11450 > 127.0.0.1.56842: Flags [P.], cksum 0x0df9 (incorrect -> 0xf53e), seq 87843:91891, ack 933, win 512, options [nop,nop,TS val 315134919 ecr 315134909], length 4048
2022-04-06 08:14:12.416253 IP (tos 0x0, ttl 64, id 59566, offset 0, flags [DF], proto TCP (6), length 52)
    127.0.0.1.56842 > 127.0.0.1.11450: Flags [.], cksum 0xfe28 (incorrect -> 0x9a48), seq 933, ack 91891, win 512, options [nop,nop,TS val 315134919 ecr 315134919], length 0
2022-04-06 08:14:12.416258 IP (tos 0x0, ttl 64, id 55431, offset 0, flags [DF], proto TCP (6), length 3338)
    127.0.0.1.11450 > 127.0.0.1.56842: Flags [P.], cksum 0x0aff (incorrect -> 0x58cb), seq 91891:95177, ack 933, win 512, options [nop,nop,TS val 315134919 ecr 315134919], length 3286
2022-04-06 08:14:12.416273 IP (tos 0x0, ttl 64, id 59567, offset 0, flags [DF], proto TCP (6), length 52)
    127.0.0.1.56842 > 127.0.0.1.11450: Flags [.], cksum 0xfe28 (incorrect -> 0x8d72), seq 933, ack 95177, win 512, options [nop,nop,TS val 315134919 ecr 315134919], length 0
2022-04-06 08:14:12.423902 IP (tos 0x0, ttl 64, id 55432, offset 0, flags [DF], proto TCP (6), length 3934)
    127.0.0.1.11450 > 127.0.0.1.56842: Flags [P.], cksum 0x0d53 (incorrect -> 0x3d5c), seq 95177:99059, ack 933, win 512, options [nop,nop,TS val 315134926 ecr 315134919], length 3882
2022-04-06 08:14:12.423978 IP (tos 0x0, ttl 64, id 59568, offset 0, flags [DF], proto TCP (6), length 52)
    127.0.0.1.56842 > 127.0.0.1.11450: Flags [.], cksum 0xfe28 (incorrect -> 0x7e3a), seq 933, ack 99059, win 512, options [nop,nop,TS val 315134926 ecr 315134926], length 0
2022-04-06 08:14:12.423987 IP (tos 0x0, ttl 64, id 55433, offset 0, flags [DF], proto TCP (6), length 3436)
    127.0.0.1.11450 > 127.0.0.1.56842: Flags [P.], cksum 0x0b61 (incorrect -> 0x8884), seq 99059:102443, ack 933, win 512, options [nop,nop,TS val 315134926 ecr 315134926], length 3384
2022-04-06 08:14:12.424052 IP (tos 0x0, ttl 64, id 59569, offset 0, flags [DF], proto TCP (6), length 52)
    127.0.0.1.56842 > 127.0.0.1.11450: Flags [.], cksum 0xfe28 (incorrect -> 0x7102), seq 933, ack 102443, win 512, options [nop,nop,TS val 315134926 ecr 315134926], length 0
2022-04-06 08:14:12.424110 IP (tos 0x0, ttl 64, id 55434, offset 0, flags [DF], proto TCP (6), length 4100)
    127.0.0.1.11450 > 127.0.0.1.56842: Flags [P.], cksum 0x0df9 (incorrect -> 0x5219), seq 102443:106491, ack 933, win 512, options [nop,nop,TS val 315134927 ecr 315134926], length 4048
2022-04-06 08:14:12.424186 IP (tos 0x0, ttl 64, id 59570, offset 0, flags [DF], proto TCP (6), length 52)
    127.0.0.1.56842 > 127.0.0.1.11450: Flags [.], cksum 0xfe28 (incorrect -> 0x6130), seq 933, ack 106491, win 512, options [nop,nop,TS val 315134927 ecr 315134927], length 0
2022-04-06 08:14:12.424192 IP (tos 0x0, ttl 64, id 55435, offset 0, flags [DF], proto TCP (6), length 7752)
    127.0.0.1.11450 > 127.0.0.1.56842: Flags [P.], cksum 0x1c3d (incorrect -> 0xaa96), seq 106491:114191, ack 933, win 512, options [nop,nop,TS val 315134927 ecr 315134927], length 7700
2022-04-06 08:14:12.424265 IP (tos 0x0, ttl 64, id 59571, offset 0, flags [DF], proto TCP (6), length 52)
    127.0.0.1.56842 > 127.0.0.1.11450: Flags [.], cksum 0xfe28 (incorrect -> 0x431c), seq 933, ack 114191, win 512, options [nop,nop,TS val 315134927 ecr 315134927], length 0
2022-04-06 08:14:12.425496 IP (tos 0x0, ttl 64, id 55436, offset 0, flags [DF], proto TCP (6), length 550)
    127.0.0.1.11450 > 127.0.0.1.56842: Flags [P.], cksum 0x001b (incorrect -> 0x3fc7), seq 114191:114689, ack 933, win 512, options [nop,nop,TS val 315134928 ecr 315134927], length 498
2022-04-06 08:14:12.425507 IP (tos 0x0, ttl 64, id 59572, offset 0, flags [DF], proto TCP (6), length 52)
    127.0.0.1.56842 > 127.0.0.1.11450: Flags [.], cksum 0xfe28 (incorrect -> 0x4128), seq 933, ack 114689, win 512, options [nop,nop,TS val 315134928 ecr 315134928], length 0
2022-04-06 08:14:12.425914 IP (tos 0x0, ttl 64, id 55437, offset 0, flags [DF], proto TCP (6), length 3436)
    127.0.0.1.11450 > 127.0.0.1.56842: Flags [P.], cksum 0x0b61 (incorrect -> 0x9a84), seq 114689:118073, ack 933, win 512, options [nop,nop,TS val 315134928 ecr 315134928], length 3384
2022-04-06 08:14:12.425941 IP (tos 0x0, ttl 64, id 59573, offset 0, flags [DF], proto TCP (6), length 52)
    127.0.0.1.56842 > 127.0.0.1.11450: Flags [.], cksum 0xfe28 (incorrect -> 0x33f0), seq 933, ack 118073, win 512, options [nop,nop,TS val 315134928 ecr 315134928], length 0
2022-04-06 08:14:12.426248 IP (tos 0x0, ttl 64, id 55438, offset 0, flags [DF], proto TCP (6), length 1048)
    127.0.0.1.11450 > 127.0.0.1.56842: Flags [P.], cksum 0x020d (incorrect -> 0x5ea2), seq 118073:119069, ack 933, win 512, options [nop,nop,TS val 315134929 ecr 315134928], length 996
2022-04-06 08:14:12.426268 IP (tos 0x0, ttl 64, id 59574, offset 0, flags [DF], proto TCP (6), length 52)
    127.0.0.1.56842 > 127.0.0.1.11450: Flags [.], cksum 0xfe28 (incorrect -> 0x300a), seq 933, ack 119069, win 512, options [nop,nop,TS val 315134929 ecr 315134929], length 0
2022-04-06 08:14:12.426552 IP (tos 0x0, ttl 64, id 55439, offset 0, flags [DF], proto TCP (6), length 4100)
    127.0.0.1.11450 > 127.0.0.1.56842: Flags [P.], cksum 0x0df9 (incorrect -> 0x30ba), seq 119069:123117, ack 933, win 512, options [nop,nop,TS val 315134929 ecr 315134929], length 4048
2022-04-06 08:14:12.426652 IP (tos 0x0, ttl 64, id 59575, offset 0, flags [DF], proto TCP (6), length 52)
    127.0.0.1.56842 > 127.0.0.1.11450: Flags [.], cksum 0xfe28 (incorrect -> 0x203a), seq 933, ack 123117, win 512, options [nop,nop,TS val 315134929 ecr 315134929], length 0
429, 4.810763835906982, 2.4848833084106445