2022-04-06 02:52:05.126525 IP (tos 0x0, ttl 64, id 26553, offset 0, flags [DF], proto TCP (6), length 60)
    127.0.0.1.46664 > 127.0.0.1.9750: Flags [S], cksum 0xfe30 (incorrect -> 0xc549), seq 895859909, win 65495, options [mss 65495,sackOK,TS val 295807629 ecr 0,nop,wscale 7], length 0
2022-04-06 02:52:05.126538 IP (tos 0x0, ttl 64, id 0, offset 0, flags [DF], proto TCP (6), length 60)
    127.0.0.1.9750 > 127.0.0.1.46664: Flags [S.], cksum 0xfe30 (incorrect -> 0x89f3), seq 1183332506, ack 895859910, win 65483, options [mss 65495,sackOK,TS val 295807629 ecr 295807629,nop,wscale 7], length 0
2022-04-06 02:52:05.126547 IP (tos 0x0, ttl 64, id 26554, offset 0, flags [DF], proto TCP (6), length 52)
    127.0.0.1.46664 > 127.0.0.1.9750: Flags [.], cksum 0xfe28 (incorrect -> 0xb0af), seq 1, ack 1, win 512, options [nop,nop,TS val 295807629 ecr 295807629], length 0
2022-04-06 02:52:05.126667 IP (tos 0x0, ttl 64, id 26555, offset 0, flags [DF], proto TCP (6), length 55)
    127.0.0.1.46664 > 127.0.0.1.9750: Flags [P.], cksum 0xfe2b (incorrect -> 0xaba3), seq 1:4, ack 1, win 512, options [nop,nop,TS val 295807629 ecr 295807629], length 3
2022-04-06 02:52:05.126679 IP (tos 0x0, ttl 64, id 50198, offset 0, flags [DF], proto TCP (6), length 52)
    127.0.0.1.9750 > 127.0.0.1.46664: Flags [.], cksum 0xfe28 (incorrect -> 0xb0ac), seq 1, ack 4, win 512, options [nop,nop,TS val 295807629 ecr 295807629], length 0
2022-04-06 02:52:05.126725 IP (tos 0x0, ttl 64, id 50199, offset 0, flags [DF], proto TCP (6), length 54)
    127.0.0.1.9750 > 127.0.0.1.46664: Flags [P.], cksum 0xfe2a (incorrect -> 0xaba2), seq 1:3, ack 4, win 512, options [nop,nop,TS val 295807629 ecr 295807629], length 2
2022-04-06 02:52:05.126740 IP (tos 0x0, ttl 64, id 26556, offset 0, flags [DF], proto TCP (6), length 52)
    127.0.0.1.46664 > 127.0.0.1.9750: Flags [.], cksum 0xfe28 (incorrect -> 0xb0aa), seq 4, ack 3, win 512, options [nop,nop,TS val 295807629 ecr 295807629], length 0
2022-04-06 02:52:05.139276 IP (tos 0x0, ttl 64, id 26557, offset 0, flags [DF], proto TCP (6), length 62)
    127.0.0.1.46664 > 127.0.0.1.9750: Flags [P.], cksum 0xfe32 (incorrect -> 0xe8b1), seq 4:14, ack 3, win 512, options [nop,nop,TS val 295807642 ecr 295807629], length 10
2022-04-06 02:52:05.139290 IP (tos 0x0, ttl 64, id 50200, offset 0, flags [DF], proto TCP (6), length 52)
    127.0.0.1.9750 > 127.0.0.1.46664: Flags [.], cksum 0xfe28 (incorrect -> 0xb086), seq 3, ack 14, win 512, options [nop,nop,TS val 295807642 ecr 295807642], length 0
2022-04-06 02:52:05.244257 IP (tos 0x0, ttl 64, id 50201, offset 0, flags [DF], proto TCP (6), length 62)
    127.0.0.1.9750 > 127.0.0.1.46664: Flags [P.], cksum 0xfe32 (incorrect -> 0xab0a), seq 3:13, ack 14, win 512, options [nop,nop,TS val 295807747 ecr 295807642], length 10
2022-04-06 02:52:05.244264 IP (tos 0x0, ttl 64, id 26558, offset 0, flags [DF], proto TCP (6), length 52)
    127.0.0.1.46664 > 127.0.0.1.9750: Flags [.], cksum 0xfe28 (incorrect -> 0xafaa), seq 14, ack 13, win 512, options [nop,nop,TS val 295807747 ecr 295807747], length 0
2022-04-06 02:52:05.249836 IP (tos 0x0, ttl 64, id 26559, offset 0, flags [DF], proto TCP (6), length 569)
    127.0.0.1.46664 > 127.0.0.1.9750: Flags [P.], cksum 0x002e (incorrect -> 0xd87c), seq 14:531, ack 13, win 512, options [nop,nop,TS val 295807752 ecr 295807747], length 517
2022-04-06 02:52:05.249853 IP (tos 0x0, ttl 64, id 50202, offset 0, flags [DF], proto TCP (6), length 52)
    127.0.0.1.9750 > 127.0.0.1.46664: Flags [.], cksum 0xfe28 (incorrect -> 0xad9f), seq 13, ack 531, win 508, options [nop,nop,TS val 295807752 ecr 295807752], length 0
200, 127.37891888618469, 0.6538665294647217