2022-04-06 02:17:20.026395 IP (tos 0x0, ttl 64, id 51120, offset 0, flags [DF], proto TCP (6), length 60)
    127.0.0.1.60894 > 127.0.0.1.10850: Flags [S], cksum 0xfe30 (incorrect -> 0x59b7), seq 3516473677, win 65495, options [mss 65495,sackOK,TS val 293722529 ecr 0,nop,wscale 7], length 0
2022-04-06 02:17:20.026405 IP (tos 0x0, ttl 64, id 0, offset 0, flags [DF], proto TCP (6), length 60)
    127.0.0.1.10850 > 127.0.0.1.60894: Flags [S.], cksum 0xfe30 (incorrect -> 0x8c43), seq 2238143716, ack 3516473678, win 65483, options [mss 65495,sackOK,TS val 293722529 ecr 293722529,nop,wscale 7], length 0
2022-04-06 02:17:20.026413 IP (tos 0x0, ttl 64, id 51121, offset 0, flags [DF], proto TCP (6), length 52)
    127.0.0.1.60894 > 127.0.0.1.10850: Flags [.], cksum 0xfe28 (incorrect -> 0xb2ff), seq 1, ack 1, win 512, options [nop,nop,TS val 293722529 ecr 293722529], length 0
2022-04-06 02:17:20.026501 IP (tos 0x0, ttl 64, id 51122, offset 0, flags [DF], proto TCP (6), length 55)
    127.0.0.1.60894 > 127.0.0.1.10850: Flags [P.], cksum 0xfe2b (incorrect -> 0xadf3), seq 1:4, ack 1, win 512, options [nop,nop,TS val 293722529 ecr 293722529], length 3
2022-04-06 02:17:20.026506 IP (tos 0x0, ttl 64, id 974, offset 0, flags [DF], proto TCP (6), length 52)
    127.0.0.1.10850 > 127.0.0.1.60894: Flags [.], cksum 0xfe28 (incorrect -> 0xb2fc), seq 1, ack 4, win 512, options [nop,nop,TS val 293722529 ecr 293722529], length 0
2022-04-06 02:17:20.026597 IP (tos 0x0, ttl 64, id 975, offset 0, flags [DF], proto TCP (6), length 54)
    127.0.0.1.10850 > 127.0.0.1.60894: Flags [P.], cksum 0xfe2a (incorrect -> 0xadf2), seq 1:3, ack 4, win 512, options [nop,nop,TS val 293722529 ecr 293722529], length 2
2022-04-06 02:17:20.026618 IP (tos 0x0, ttl 64, id 51123, offset 0, flags [DF], proto TCP (6), length 52)
    127.0.0.1.60894 > 127.0.0.1.10850: Flags [.], cksum 0xfe28 (incorrect -> 0xb2fa), seq 4, ack 3, win 512, options [nop,nop,TS val 293722529 ecr 293722529], length 0
2022-04-06 02:17:20.047876 IP (tos 0x0, ttl 64, id 51124, offset 0, flags [DF], proto TCP (6), length 62)
    127.0.0.1.60894 > 127.0.0.1.10850: Flags [P.], cksum 0xfe32 (incorrect -> 0x591f), seq 4:14, ack 3, win 512, options [nop,nop,TS val 293722550 ecr 293722529], length 10
2022-04-06 02:17:20.047898 IP (tos 0x0, ttl 64, id 976, offset 0, flags [DF], proto TCP (6), length 52)
    127.0.0.1.10850 > 127.0.0.1.60894: Flags [.], cksum 0xfe28 (incorrect -> 0xb2c6), seq 3, ack 14, win 512, options [nop,nop,TS val 293722550 ecr 293722550], length 0
2022-04-06 02:17:31.133599 IP (tos 0x0, ttl 64, id 977, offset 0, flags [DF], proto TCP (6), length 62)
    127.0.0.1.10850 > 127.0.0.1.60894: Flags [P.], cksum 0xfe32 (incorrect -> 0x8265), seq 3:13, ack 14, win 512, options [nop,nop,TS val 293733636 ecr 293722550], length 10
2022-04-06 02:17:31.133615 IP (tos 0x0, ttl 64, id 51125, offset 0, flags [DF], proto TCP (6), length 52)
    127.0.0.1.60894 > 127.0.0.1.10850: Flags [.], cksum 0xfe28 (incorrect -> 0x5c20), seq 14, ack 13, win 512, options [nop,nop,TS val 293733636 ecr 293733636], length 0
2022-04-06 02:17:31.139233 IP (tos 0x0, ttl 64, id 51126, offset 0, flags [DF], proto TCP (6), length 569)
    127.0.0.1.60894 > 127.0.0.1.10850: Flags [P.], cksum 0x002e (incorrect -> 0xbac1), seq 14:531, ack 13, win 512, options [nop,nop,TS val 293733642 ecr 293733636], length 517
2022-04-06 02:17:31.139251 IP (tos 0x0, ttl 64, id 978, offset 0, flags [DF], proto TCP (6), length 52)
    127.0.0.1.10850 > 127.0.0.1.60894: Flags [.], cksum 0xfe28 (incorrect -> 0x5a13), seq 13, ack 531, win 508, options [nop,nop,TS val 293733642 ecr 293733642], length 0
2022-04-06 02:17:32.077957 IP (tos 0x0, ttl 64, id 979, offset 0, flags [DF], proto TCP (6), length 4100)
    127.0.0.1.10850 > 127.0.0.1.60894: Flags [P.], cksum 0x0df9 (incorrect -> 0x0872), seq 13:4061, ack 531, win 512, options [nop,nop,TS val 293734580 ecr 293733642], length 4048
2022-04-06 02:17:32.077984 IP (tos 0x0, ttl 64, id 51127, offset 0, flags [DF], proto TCP (6), length 52)
    127.0.0.1.60894 > 127.0.0.1.10850: Flags [.], cksum 0xfe28 (incorrect -> 0x42ff), seq 531, ack 4061, win 492, options [nop,nop,TS val 293734580 ecr 293734580], length 0
2022-04-06 02:17:32.077994 IP (tos 0x0, ttl 64, id 980, offset 0, flags [DF], proto TCP (6), length 486)
    127.0.0.1.10850 > 127.0.0.1.60894: Flags [P.], cksum 0xffda (incorrect -> 0x2d8f), seq 4061:4495, ack 531, win 512, options [nop,nop,TS val 293734580 ecr 293734580], length 434
2022-04-06 02:17:32.077997 IP (tos 0x0, ttl 64, id 51128, offset 0, flags [DF], proto TCP (6), length 52)
    127.0.0.1.60894 > 127.0.0.1.10850: Flags [.], cksum 0xfe28 (incorrect -> 0x414f), seq 531, ack 4495, win 490, options [nop,nop,TS val 293734580 ecr 293734580], length 0
2022-04-06 02:17:32.093349 IP (tos 0x0, ttl 64, id 981, offset 0, flags [DF], proto TCP (6), length 724)
    127.0.0.1.10850 > 127.0.0.1.60894: Flags [P.], cksum 0x00c9 (incorrect -> 0xdba4), seq 4495:5167, ack 531, win 512, options [nop,nop,TS val 293734596 ecr 293734580], length 672
2022-04-06 02:17:32.093355 IP (tos 0x0, ttl 64, id 51129, offset 0, flags [DF], proto TCP (6), length 52)
    127.0.0.1.60894 > 127.0.0.1.10850: Flags [.], cksum 0xfe28 (incorrect -> 0x3e80), seq 531, ack 5167, win 505, options [nop,nop,TS val 293734596 ecr 293734596], length 0
2022-04-06 02:17:32.093946 IP (tos 0x0, ttl 64, id 51130, offset 0, flags [DF], proto TCP (6), length 132)
    127.0.0.1.60894 > 127.0.0.1.10850: Flags [P.], cksum 0xfe78 (incorrect -> 0x7ba4), seq 531:611, ack 5167, win 512, options [nop,nop,TS val 293734596 ecr 293734596], length 80
2022-04-06 02:17:32.093953 IP (tos 0x0, ttl 64, id 982, offset 0, flags [DF], proto TCP (6), length 52)
    127.0.0.1.10850 > 127.0.0.1.60894: Flags [.], cksum 0xfe28 (incorrect -> 0x3e29), seq 5167, ack 611, win 512, options [nop,nop,TS val 293734596 ecr 293734596], length 0
2022-04-06 02:17:32.094470 IP (tos 0x0, ttl 64, id 51131, offset 0, flags [DF], proto TCP (6), length 314)
    127.0.0.1.60894 > 127.0.0.1.10850: Flags [P.], cksum 0xff2e (incorrect -> 0xf836), seq 611:873, ack 5167, win 512, options [nop,nop,TS val 293734597 ecr 293734596], length 262
2022-04-06 02:17:32.094474 IP (tos 0x0, ttl 64, id 983, offset 0, flags [DF], proto TCP (6), length 52)
    127.0.0.1.10850 > 127.0.0.1.60894: Flags [.], cksum 0xfe28 (incorrect -> 0x3d23), seq 5167, ack 873, win 510, options [nop,nop,TS val 293734597 ecr 293734597], length 0
2022-04-06 02:17:32.546048 IP (tos 0x0, ttl 64, id 984, offset 0, flags [DF], proto TCP (6), length 3100)
    127.0.0.1.10850 > 127.0.0.1.60894: Flags [P.], cksum 0x0a11 (incorrect -> 0x784a), seq 5167:8215, ack 873, win 512, options [nop,nop,TS val 293735048 ecr 293734597], length 3048
2022-04-06 02:17:32.546078 IP (tos 0x0, ttl 64, id 51132, offset 0, flags [DF], proto TCP (6), length 52)
    127.0.0.1.60894 > 127.0.0.1.10850: Flags [.], cksum 0xfe28 (incorrect -> 0x2dc2), seq 873, ack 8215, win 496, options [nop,nop,TS val 293735049 ecr 293735048], length 0
2022-04-06 02:17:32.561518 IP (tos 0x0, ttl 64, id 985, offset 0, flags [DF], proto TCP (6), length 1048)
    127.0.0.1.10850 > 127.0.0.1.60894: Flags [P.], cksum 0x020d (incorrect -> 0xedfe), seq 8215:9211, ack 873, win 512, options [nop,nop,TS val 293735064 ecr 293735049], length 996
2022-04-06 02:17:32.561534 IP (tos 0x0, ttl 64, id 51133, offset 0, flags [DF], proto TCP (6), length 52)
    127.0.0.1.60894 > 127.0.0.1.10850: Flags [.], cksum 0xfe28 (incorrect -> 0x29b7), seq 873, ack 9211, win 504, options [nop,nop,TS val 293735064 ecr 293735064], length 0
2022-04-06 02:17:32.666682 IP (tos 0x0, ttl 64, id 986, offset 0, flags [DF], proto TCP (6), length 3538)
    127.0.0.1.10850 > 127.0.0.1.60894: Flags [P.], cksum 0x0bc7 (incorrect -> 0xb515), seq 9211:12697, ack 873, win 512, options [nop,nop,TS val 293735169 ecr 293735064], length 3486
2022-04-06 02:17:32.666686 IP (tos 0x0, ttl 64, id 51134, offset 0, flags [DF], proto TCP (6), length 52)
    127.0.0.1.60894 > 127.0.0.1.10850: Flags [.], cksum 0xfe28 (incorrect -> 0x1b51), seq 873, ack 12697, win 494, options [nop,nop,TS val 293735169 ecr 293735169], length 0
2022-04-06 02:17:32.667175 IP (tos 0x0, ttl 64, id 987, offset 0, flags [DF], proto TCP (6), length 1048)
    127.0.0.1.10850 > 127.0.0.1.60894: Flags [P.], cksum 0x020d (incorrect -> 0x75c8), seq 12697:13693, ack 873, win 512, options [nop,nop,TS val 293735170 ecr 293735169], length 996
2022-04-06 02:17:32.667179 IP (tos 0x0, ttl 64, id 51135, offset 0, flags [DF], proto TCP (6), length 52)
    127.0.0.1.60894 > 127.0.0.1.10850: Flags [.], cksum 0xfe28 (incorrect -> 0x1761), seq 873, ack 13693, win 504, options [nop,nop,TS val 293735170 ecr 293735170], length 0
2022-04-06 02:17:32.682150 IP (tos 0x0, ttl 64, id 988, offset 0, flags [DF], proto TCP (6), length 2184)
    127.0.0.1.10850 > 127.0.0.1.60894: Flags [P.], cksum 0x067d (incorrect -> 0x0b08), seq 13693:15825, ack 873, win 512, options [nop,nop,TS val 293735185 ecr 293735170], length 2132
2022-04-06 02:17:32.682155 IP (tos 0x0, ttl 64, id 51136, offset 0, flags [DF], proto TCP (6), length 52)
    127.0.0.1.60894 > 127.0.0.1.10850: Flags [.], cksum 0xfe28 (incorrect -> 0x0ef4), seq 873, ack 15825, win 499, options [nop,nop,TS val 293735185 ecr 293735185], length 0
2022-04-06 02:17:32.908036 IP (tos 0x0, ttl 64, id 989, offset 0, flags [DF], proto TCP (6), length 3446)
    127.0.0.1.10850 > 127.0.0.1.60894: Flags [P.], cksum 0x0b6b (incorrect -> 0xb082), seq 15825:19219, ack 873, win 512, options [nop,nop,TS val 293735410 ecr 293735185], length 3394
2022-04-06 02:17:32.908042 IP (tos 0x0, ttl 64, id 51137, offset 0, flags [DF], proto TCP (6), length 52)
    127.0.0.1.60894 > 127.0.0.1.10850: Flags [.], cksum 0xfe28 (incorrect -> 0xfff4), seq 873, ack 19219, win 494, options [nop,nop,TS val 293735410 ecr 293735410], length 0
2022-04-06 02:17:32.923358 IP (tos 0x0, ttl 64, id 990, offset 0, flags [DF], proto TCP (6), length 4036)
    127.0.0.1.10850 > 127.0.0.1.60894: Flags [P.], cksum 0x0db9 (incorrect -> 0x6c1c), seq 19219:23203, ack 873, win 512, options [nop,nop,TS val 293735426 ecr 293735410], length 3984
2022-04-06 02:17:32.923362 IP (tos 0x0, ttl 64, id 51138, offset 0, flags [DF], proto TCP (6), length 52)
    127.0.0.1.60894 > 127.0.0.1.10850: Flags [.], cksum 0xfe28 (incorrect -> 0xf046), seq 873, ack 23203, win 492, options [nop,nop,TS val 293735426 ecr 293735426], length 0
2022-04-06 02:17:33.054394 IP (tos 0x0, ttl 64, id 991, offset 0, flags [DF], proto TCP (6), length 3308)
    127.0.0.1.10850 > 127.0.0.1.60894: Flags [P.], cksum 0x0ae1 (incorrect -> 0x8ca9), seq 23203:26459, ack 873, win 512, options [nop,nop,TS val 293735557 ecr 293735426], length 3256
2022-04-06 02:17:33.054407 IP (tos 0x0, ttl 64, id 51139, offset 0, flags [DF], proto TCP (6), length 52)
    127.0.0.1.60894 > 127.0.0.1.10850: Flags [.], cksum 0xfe28 (incorrect -> 0xe285), seq 873, ack 26459, win 495, options [nop,nop,TS val 293735557 ecr 293735557], length 0
2022-04-06 02:17:33.174577 IP (tos 0x0, ttl 64, id 992, offset 0, flags [DF], proto TCP (6), length 3040)
    127.0.0.1.10850 > 127.0.0.1.60894: Flags [P.], cksum 0x09d5 (incorrect -> 0xdd93), seq 26459:29447, ack 873, win 512, options [nop,nop,TS val 293735677 ecr 293735557], length 2988
2022-04-06 02:17:33.174589 IP (tos 0x0, ttl 64, id 51140, offset 0, flags [DF], proto TCP (6), length 52)
    127.0.0.1.60894 > 127.0.0.1.10850: Flags [.], cksum 0xfe28 (incorrect -> 0xd5e8), seq 873, ack 29447, win 496, options [nop,nop,TS val 293735677 ecr 293735677], length 0
2022-04-06 02:17:33.296269 IP (tos 0x0, ttl 64, id 993, offset 0, flags [DF], proto TCP (6), length 3538)
    127.0.0.1.10850 > 127.0.0.1.60894: Flags [P.], cksum 0x0bc7 (incorrect -> 0xaa36), seq 29447:32933, ack 873, win 512, options [nop,nop,TS val 293735799 ecr 293735677], length 3486
2022-04-06 02:17:33.296274 IP (tos 0x0, ttl 64, id 51141, offset 0, flags [DF], proto TCP (6), length 52)
    127.0.0.1.60894 > 127.0.0.1.10850: Flags [.], cksum 0xfe28 (incorrect -> 0xc758), seq 873, ack 32933, win 494, options [nop,nop,TS val 293735799 ecr 293735799], length 0
2022-04-06 02:17:33.561884 IP (tos 0x0, ttl 64, id 994, offset 0, flags [DF], proto TCP (6), length 3538)
    127.0.0.1.10850 > 127.0.0.1.60894: Flags [P.], cksum 0x0bc7 (incorrect -> 0xc029), seq 32933:36419, ack 873, win 512, options [nop,nop,TS val 293736064 ecr 293735799], length 3486
2022-04-06 02:17:33.561890 IP (tos 0x0, ttl 64, id 51142, offset 0, flags [DF], proto TCP (6), length 52)
    127.0.0.1.60894 > 127.0.0.1.10850: Flags [.], cksum 0xfe28 (incorrect -> 0xb7a8), seq 873, ack 36419, win 494, options [nop,nop,TS val 293736064 ecr 293736064], length 0
2022-04-06 02:17:33.577348 IP (tos 0x0, ttl 64, id 995, offset 0, flags [DF], proto TCP (6), length 2542)
    127.0.0.1.10850 > 127.0.0.1.60894: Flags [P.], cksum 0x07e3 (incorrect -> 0xb186), seq 36419:38909, ack 873, win 512, options [nop,nop,TS val 293736080 ecr 293736064], length 2490
2022-04-06 02:17:33.577353 IP (tos 0x0, ttl 64, id 51143, offset 0, flags [DF], proto TCP (6), length 52)
    127.0.0.1.60894 > 127.0.0.1.10850: Flags [.], cksum 0xfe28 (incorrect -> 0xadca), seq 873, ack 38909, win 498, options [nop,nop,TS val 293736080 ecr 293736080], length 0
2022-04-06 02:17:33.913324 IP (tos 0x0, ttl 64, id 996, offset 0, flags [DF], proto TCP (6), length 3276)
    127.0.0.1.10850 > 127.0.0.1.60894: Flags [P.], cksum 0x0ac1 (incorrect -> 0x64bf), seq 38909:42133, ack 873, win 512, options [nop,nop,TS val 293736416 ecr 293736080], length 3224
2022-04-06 02:17:33.913331 IP (tos 0x0, ttl 64, id 51144, offset 0, flags [DF], proto TCP (6), length 52)
    127.0.0.1.60894 > 127.0.0.1.10850: Flags [.], cksum 0xfe28 (incorrect -> 0x9e95), seq 873, ack 42133, win 495, options [nop,nop,TS val 293736416 ecr 293736416], length 0
2022-04-06 02:17:33.928660 IP (tos 0x0, ttl 64, id 997, offset 0, flags [DF], proto TCP (6), length 1546)
    127.0.0.1.10850 > 127.0.0.1.60894: Flags [P.], cksum 0x03ff (incorrect -> 0xf3c8), seq 42133:43627, ack 873, win 512, options [nop,nop,TS val 293736431 ecr 293736416], length 1494
2022-04-06 02:17:33.928665 IP (tos 0x0, ttl 64, id 51145, offset 0, flags [DF], proto TCP (6), length 52)
    127.0.0.1.60894 > 127.0.0.1.10850: Flags [.], cksum 0xfe28 (incorrect -> 0x989a), seq 873, ack 43627, win 502, options [nop,nop,TS val 293736431 ecr 293736431], length 0
2022-04-06 02:17:33.943952 IP (tos 0x0, ttl 64, id 998, offset 0, flags [DF], proto TCP (6), length 1546)
    127.0.0.1.10850 > 127.0.0.1.60894: Flags [P.], cksum 0x03ff (incorrect -> 0xa243), seq 43627:45121, ack 873, win 512, options [nop,nop,TS val 293736446 ecr 293736431], length 1494
2022-04-06 02:17:33.943957 IP (tos 0x0, ttl 64, id 51146, offset 0, flags [DF], proto TCP (6), length 52)
    127.0.0.1.60894 > 127.0.0.1.10850: Flags [.], cksum 0xfe28 (incorrect -> 0x92a6), seq 873, ack 45121, win 502, options [nop,nop,TS val 293736446 ecr 293736446], length 0
2022-04-06 02:17:34.034408 IP (tos 0x0, ttl 64, id 999, offset 0, flags [DF], proto TCP (6), length 1546)
    127.0.0.1.10850 > 127.0.0.1.60894: Flags [P.], cksum 0x03ff (incorrect -> 0xb925), seq 45121:46615, ack 873, win 512, options [nop,nop,TS val 293736537 ecr 293736446], length 1494
2022-04-06 02:17:34.034413 IP (tos 0x0, ttl 64, id 51147, offset 0, flags [DF], proto TCP (6), length 52)
    127.0.0.1.60894 > 127.0.0.1.10850: Flags [.], cksum 0xfe28 (incorrect -> 0x8c1a), seq 873, ack 46615, win 502, options [nop,nop,TS val 293736537 ecr 293736537], length 0
2022-04-06 02:17:34.054984 IP (tos 0x0, ttl 64, id 1000, offset 0, flags [DF], proto TCP (6), length 1048)
    127.0.0.1.10850 > 127.0.0.1.60894: Flags [P.], cksum 0x020d (incorrect -> 0xbbe2), seq 46615:47611, ack 873, win 512, options [nop,nop,TS val 293736557 ecr 293736537], length 996
2022-04-06 02:17:34.054988 IP (tos 0x0, ttl 64, id 51148, offset 0, flags [DF], proto TCP (6), length 52)
    127.0.0.1.60894 > 127.0.0.1.10850: Flags [.], cksum 0xfe28 (incorrect -> 0x880c), seq 873, ack 47611, win 504, options [nop,nop,TS val 293736557 ecr 293736557], length 0
2022-04-06 02:17:34.154802 IP (tos 0x0, ttl 64, id 1001, offset 0, flags [DF], proto TCP (6), length 1362)
    127.0.0.1.10850 > 127.0.0.1.60894: Flags [P.], cksum 0x0347 (incorrect -> 0x17ea), seq 47611:48921, ack 873, win 512, options [nop,nop,TS val 293736657 ecr 293736557], length 1310
2022-04-06 02:17:34.154815 IP (tos 0x0, ttl 64, id 51149, offset 0, flags [DF], proto TCP (6), length 52)
    127.0.0.1.60894 > 127.0.0.1.10850: Flags [.], cksum 0xfe28 (incorrect -> 0x8228), seq 873, ack 48921, win 502, options [nop,nop,TS val 293736657 ecr 293736657], length 0
2022-04-06 02:17:34.176176 IP (tos 0x0, ttl 64, id 1002, offset 0, flags [DF], proto TCP (6), length 1546)
    127.0.0.1.10850 > 127.0.0.1.60894: Flags [P.], cksum 0x03ff (incorrect -> 0xd6ec), seq 48921:50415, ack 873, win 512, options [nop,nop,TS val 293736679 ecr 293736657], length 1494
2022-04-06 02:17:34.176187 IP (tos 0x0, ttl 64, id 51150, offset 0, flags [DF], proto TCP (6), length 52)
    127.0.0.1.60894 > 127.0.0.1.10850: Flags [.], cksum 0xfe28 (incorrect -> 0x7c26), seq 873, ack 50415, win 502, options [nop,nop,TS val 293736679 ecr 293736679], length 0
2022-04-06 02:17:34.546976 IP (tos 0x0, ttl 64, id 1003, offset 0, flags [DF], proto TCP (6), length 1546)
    127.0.0.1.10850 > 127.0.0.1.60894: Flags [P.], cksum 0x03ff (incorrect -> 0x8681), seq 50415:51909, ack 873, win 512, options [nop,nop,TS val 293737049 ecr 293736679], length 1494
2022-04-06 02:17:34.546986 IP (tos 0x0, ttl 64, id 51151, offset 0, flags [DF], proto TCP (6), length 52)
    127.0.0.1.60894 > 127.0.0.1.10850: Flags [.], cksum 0xfe28 (incorrect -> 0x736c), seq 873, ack 51909, win 502, options [nop,nop,TS val 293737049 ecr 293737049], length 0
2022-04-06 02:17:34.786542 IP (tos 0x0, ttl 64, id 1004, offset 0, flags [DF], proto TCP (6), length 3538)
    127.0.0.1.10850 > 127.0.0.1.60894: Flags [P.], cksum 0x0bc7 (incorrect -> 0x8328), seq 51909:55395, ack 873, win 512, options [nop,nop,TS val 293737289 ecr 293737049], length 3486
2022-04-06 02:17:34.786548 IP (tos 0x0, ttl 64, id 51152, offset 0, flags [DF], proto TCP (6), length 52)
    127.0.0.1.60894 > 127.0.0.1.10850: Flags [.], cksum 0xfe28 (incorrect -> 0x63f6), seq 873, ack 55395, win 494, options [nop,nop,TS val 293737289 ecr 293737289], length 0
2022-04-06 02:17:34.801881 IP (tos 0x0, ttl 64, id 1005, offset 0, flags [DF], proto TCP (6), length 2044)
    127.0.0.1.10850 > 127.0.0.1.60894: Flags [P.], cksum 0x05f1 (incorrect -> 0x1ecc), seq 55395:57387, ack 873, win 512, options [nop,nop,TS val 293737304 ecr 293737289], length 1992
2022-04-06 02:17:34.801886 IP (tos 0x0, ttl 64, id 51153, offset 0, flags [DF], proto TCP (6), length 52)
    127.0.0.1.60894 > 127.0.0.1.10850: Flags [.], cksum 0xfe28 (incorrect -> 0x5c0a), seq 873, ack 57387, win 500, options [nop,nop,TS val 293737304 ecr 293737304], length 0
2022-04-06 02:17:34.910867 IP (tos 0x0, ttl 64, id 1006, offset 0, flags [DF], proto TCP (6), length 2542)
    127.0.0.1.10850 > 127.0.0.1.60894: Flags [P.], cksum 0x07e3 (incorrect -> 0xb55d), seq 57387:59877, ack 873, win 512, options [nop,nop,TS val 293737413 ecr 293737304], length 2490
2022-04-06 02:17:34.910887 IP (tos 0x0, ttl 64, id 51154, offset 0, flags [DF], proto TCP (6), length 52)
    127.0.0.1.60894 > 127.0.0.1.10850: Flags [.], cksum 0xfe28 (incorrect -> 0x5178), seq 873, ack 59877, win 498, options [nop,nop,TS val 293737413 ecr 293737413], length 0
2022-04-06 02:17:35.027848 IP (tos 0x0, ttl 64, id 1007, offset 0, flags [DF], proto TCP (6), length 2542)
    127.0.0.1.10850 > 127.0.0.1.60894: Flags [P.], cksum 0x07e3 (incorrect -> 0x10ee), seq 59877:62367, ack 873, win 512, options [nop,nop,TS val 293737530 ecr 293737413], length 2490
2022-04-06 02:17:35.027859 IP (tos 0x0, ttl 64, id 51155, offset 0, flags [DF], proto TCP (6), length 52)
    127.0.0.1.60894 > 127.0.0.1.10850: Flags [.], cksum 0xfe28 (incorrect -> 0x46d4), seq 873, ack 62367, win 498, options [nop,nop,TS val 293737530 ecr 293737530], length 0
2022-04-06 02:17:35.149198 IP (tos 0x0, ttl 64, id 1008, offset 0, flags [DF], proto TCP (6), length 3538)
    127.0.0.1.10850 > 127.0.0.1.60894: Flags [P.], cksum 0x0bc7 (incorrect -> 0xd7df), seq 62367:65853, ack 873, win 512, options [nop,nop,TS val 293737652 ecr 293737530], length 3486
2022-04-06 02:17:35.149203 IP (tos 0x0, ttl 64, id 51156, offset 0, flags [DF], proto TCP (6), length 52)
    127.0.0.1.60894 > 127.0.0.1.10850: Flags [.], cksum 0xfe28 (incorrect -> 0x3846), seq 873, ack 65853, win 494, options [nop,nop,TS val 293737652 ecr 293737652], length 0
2022-04-06 02:17:35.194724 IP (tos 0x0, ttl 64, id 1009, offset 0, flags [DF], proto TCP (6), length 2044)
    127.0.0.1.10850 > 127.0.0.1.60894: Flags [P.], cksum 0x05f1 (incorrect -> 0xd696), seq 65853:67845, ack 873, win 512, options [nop,nop,TS val 293737697 ecr 293737652], length 1992
2022-04-06 02:17:35.194733 IP (tos 0x0, ttl 64, id 51157, offset 0, flags [DF], proto TCP (6), length 52)
    127.0.0.1.60894 > 127.0.0.1.10850: Flags [.], cksum 0xfe28 (incorrect -> 0x301e), seq 873, ack 67845, win 500, options [nop,nop,TS val 293737697 ecr 293737697], length 0
2022-04-06 02:17:35.630568 IP (tos 0x0, ttl 64, id 1010, offset 0, flags [DF], proto TCP (6), length 3538)
    127.0.0.1.10850 > 127.0.0.1.60894: Flags [P.], cksum 0x0bc7 (incorrect -> 0xf98b), seq 67845:71331, ack 873, win 512, options [nop,nop,TS val 293738133 ecr 293737697], length 3486
2022-04-06 02:17:35.630578 IP (tos 0x0, ttl 64, id 51158, offset 0, flags [DF], proto TCP (6), length 52)
    127.0.0.1.60894 > 127.0.0.1.10850: Flags [.], cksum 0xfe28 (incorrect -> 0x1f1e), seq 873, ack 71331, win 494, options [nop,nop,TS val 293738133 ecr 293738133], length 0
2022-04-06 02:17:35.645954 IP (tos 0x0, ttl 64, id 1011, offset 0, flags [DF], proto TCP (6), length 4100)
    127.0.0.1.10850 > 127.0.0.1.60894: Flags [P.], cksum 0x0df9 (incorrect -> 0xe5d1), seq 71331:75379, ack 873, win 512, options [nop,nop,TS val 293738148 ecr 293738133], length 4048
2022-04-06 02:17:35.645959 IP (tos 0x0, ttl 64, id 51159, offset 0, flags [DF], proto TCP (6), length 52)
    127.0.0.1.60894 > 127.0.0.1.10850: Flags [.], cksum 0xfe28 (incorrect -> 0x0f32), seq 873, ack 75379, win 492, options [nop,nop,TS val 293738148 ecr 293738148], length 0
2022-04-06 02:17:35.645964 IP (tos 0x0, ttl 64, id 1012, offset 0, flags [DF], proto TCP (6), length 486)
    127.0.0.1.10850 > 127.0.0.1.60894: Flags [P.], cksum 0xffda (incorrect -> 0xd90d), seq 75379:75813, ack 873, win 512, options [nop,nop,TS val 293738148 ecr 293738148], length 434
2022-04-06 02:17:35.645966 IP (tos 0x0, ttl 64, id 51160, offset 0, flags [DF], proto TCP (6), length 52)
    127.0.0.1.60894 > 127.0.0.1.10850: Flags [.], cksum 0xfe28 (incorrect -> 0x0d82), seq 873, ack 75813, win 490, options [nop,nop,TS val 293738148 ecr 293738148], length 0
2022-04-06 02:17:35.752324 IP (tos 0x0, ttl 64, id 1013, offset 0, flags [DF], proto TCP (6), length 3538)
    127.0.0.1.10850 > 127.0.0.1.60894: Flags [P.], cksum 0x0bc7 (incorrect -> 0x68fa), seq 75813:79299, ack 873, win 512, options [nop,nop,TS val 293738255 ecr 293738148], length 3486
2022-04-06 02:17:35.752329 IP (tos 0x0, ttl 64, id 51161, offset 0, flags [DF], proto TCP (6), length 52)
    127.0.0.1.60894 > 127.0.0.1.10850: Flags [.], cksum 0xfe28 (incorrect -> 0xff09), seq 873, ack 79299, win 494, options [nop,nop,TS val 293738255 ecr 293738255], length 0
2022-04-06 02:17:35.767956 IP (tos 0x0, ttl 64, id 1014, offset 0, flags [DF], proto TCP (6), length 2044)
    127.0.0.1.10850 > 127.0.0.1.60894: Flags [P.], cksum 0x05f1 (incorrect -> 0x31fb), seq 79299:81291, ack 873, win 512, options [nop,nop,TS val 293738270 ecr 293738255], length 1992
2022-04-06 02:17:35.767960 IP (tos 0x0, ttl 64, id 51162, offset 0, flags [DF], proto TCP (6), length 52)
    127.0.0.1.60894 > 127.0.0.1.10850: Flags [.], cksum 0xfe28 (incorrect -> 0xf71d), seq 873, ack 81291, win 500, options [nop,nop,TS val 293738270 ecr 293738270], length 0
2022-04-06 02:17:35.878409 IP (tos 0x0, ttl 64, id 1015, offset 0, flags [DF], proto TCP (6), length 3538)
    127.0.0.1.10850 > 127.0.0.1.60894: Flags [P.], cksum 0x0bc7 (incorrect -> 0xb3bf), seq 81291:84777, ack 873, win 512, options [nop,nop,TS val 293738381 ecr 293738270], length 3486
2022-04-06 02:17:35.878414 IP (tos 0x0, ttl 64, id 51163, offset 0, flags [DF], proto TCP (6), length 52)
    127.0.0.1.60894 > 127.0.0.1.10850: Flags [.], cksum 0xfe28 (incorrect -> 0xe8a7), seq 873, ack 84777, win 494, options [nop,nop,TS val 293738381 ecr 293738381], length 0
2022-04-06 02:17:35.893877 IP (tos 0x0, ttl 64, id 1016, offset 0, flags [DF], proto TCP (6), length 550)
    127.0.0.1.10850 > 127.0.0.1.60894: Flags [P.], cksum 0x001b (incorrect -> 0xffc0), seq 84777:85275, ack 873, win 512, options [nop,nop,TS val 293738396 ecr 293738381], length 498
2022-04-06 02:17:35.893889 IP (tos 0x0, ttl 64, id 51164, offset 0, flags [DF], proto TCP (6), length 52)
    127.0.0.1.60894 > 127.0.0.1.10850: Flags [.], cksum 0xfe28 (incorrect -> 0xe68b), seq 873, ack 85275, win 506, options [nop,nop,TS val 293738396 ecr 293738396], length 0
2022-04-06 02:17:35.995586 IP (tos 0x0, ttl 64, id 1017, offset 0, flags [DF], proto TCP (6), length 1546)
    127.0.0.1.10850 > 127.0.0.1.60894: Flags [P.], cksum 0x03ff (incorrect -> 0xd287), seq 85275:86769, ack 873, win 512, options [nop,nop,TS val 293738498 ecr 293738396], length 1494
2022-04-06 02:17:35.995591 IP (tos 0x0, ttl 64, id 51165, offset 0, flags [DF], proto TCP (6), length 52)
    127.0.0.1.60894 > 127.0.0.1.10850: Flags [.], cksum 0xfe28 (incorrect -> 0xdfed), seq 873, ack 86769, win 502, options [nop,nop,TS val 293738498 ecr 293738498], length 0
2022-04-06 02:17:36.119223 IP (tos 0x0, ttl 64, id 1018, offset 0, flags [DF], proto TCP (6), length 3538)
    127.0.0.1.10850 > 127.0.0.1.60894: Flags [P.], cksum 0x0bc7 (incorrect -> 0xabec), seq 86769:90255, ack 873, win 512, options [nop,nop,TS val 293738622 ecr 293738498], length 3486
2022-04-06 02:17:36.119233 IP (tos 0x0, ttl 64, id 51166, offset 0, flags [DF], proto TCP (6), length 52)
    127.0.0.1.60894 > 127.0.0.1.10850: Flags [.], cksum 0xfe28 (incorrect -> 0xd15f), seq 873, ack 90255, win 494, options [nop,nop,TS val 293738622 ecr 293738622], length 0
2022-04-06 02:17:36.134726 IP (tos 0x0, ttl 64, id 1019, offset 0, flags [DF], proto TCP (6), length 2542)
    127.0.0.1.10850 > 127.0.0.1.60894: Flags [P.], cksum 0x07e3 (incorrect -> 0x949c), seq 90255:92745, ack 873, win 512, options [nop,nop,TS val 293738637 ecr 293738622], length 2490
2022-04-06 02:17:36.134830 IP (tos 0x0, ttl 64, id 51167, offset 0, flags [DF], proto TCP (6), length 52)
    127.0.0.1.60894 > 127.0.0.1.10850: Flags [.], cksum 0xfe28 (incorrect -> 0xc775), seq 873, ack 92745, win 512, options [nop,nop,TS val 293738637 ecr 293738637], length 0
2022-04-06 02:17:36.238537 IP (tos 0x0, ttl 64, id 1020, offset 0, flags [DF], proto TCP (6), length 3416)
    127.0.0.1.10850 > 127.0.0.1.60894: Flags [P.], cksum 0x0b4d (incorrect -> 0x9e43), seq 92745:96109, ack 873, win 512, options [nop,nop,TS val 293738741 ecr 293738637], length 3364
2022-04-06 02:17:36.238692 IP (tos 0x0, ttl 64, id 51168, offset 0, flags [DF], proto TCP (6), length 52)
    127.0.0.1.60894 > 127.0.0.1.10850: Flags [.], cksum 0xfe28 (incorrect -> 0xb981), seq 873, ack 96109, win 512, options [nop,nop,TS val 293738741 ecr 293738741], length 0
2022-04-06 02:17:36.253937 IP (tos 0x0, ttl 64, id 1021, offset 0, flags [DF], proto TCP (6), length 550)
    127.0.0.1.10850 > 127.0.0.1.60894: Flags [P.], cksum 0x001b (incorrect -> 0xa3b4), seq 96109:96607, ack 873, win 512, options [nop,nop,TS val 293738756 ecr 293738741], length 498
2022-04-06 02:17:36.253961 IP (tos 0x0, ttl 64, id 51169, offset 0, flags [DF], proto TCP (6), length 52)
    127.0.0.1.60894 > 127.0.0.1.10850: Flags [.], cksum 0xfe28 (incorrect -> 0xb771), seq 873, ack 96607, win 512, options [nop,nop,TS val 293738756 ecr 293738756], length 0
2022-04-06 02:17:36.269269 IP (tos 0x0, ttl 64, id 1022, offset 0, flags [DF], proto TCP (6), length 2044)
    127.0.0.1.10850 > 127.0.0.1.60894: Flags [P.], cksum 0x05f1 (incorrect -> 0x7923), seq 96607:98599, ack 873, win 512, options [nop,nop,TS val 293738772 ecr 293738756], length 1992
2022-04-06 02:17:36.269384 IP (tos 0x0, ttl 64, id 51170, offset 0, flags [DF], proto TCP (6), length 52)
    127.0.0.1.60894 > 127.0.0.1.10850: Flags [.], cksum 0xfe28 (incorrect -> 0xaf89), seq 873, ack 98599, win 512, options [nop,nop,TS val 293738772 ecr 293738772], length 0
2022-04-06 02:17:36.381573 IP (tos 0x0, ttl 64, id 1023, offset 0, flags [DF], proto TCP (6), length 3538)
    127.0.0.1.10850 > 127.0.0.1.60894: Flags [P.], cksum 0x0bc7 (incorrect -> 0xff0b), seq 98599:102085, ack 873, win 512, options [nop,nop,TS val 293738884 ecr 293738772], length 3486
2022-04-06 02:17:36.381709 IP (tos 0x0, ttl 64, id 51171, offset 0, flags [DF], proto TCP (6), length 52)
    127.0.0.1.60894 > 127.0.0.1.10850: Flags [.], cksum 0xfe28 (incorrect -> 0xa10b), seq 873, ack 102085, win 512, options [nop,nop,TS val 293738884 ecr 293738884], length 0
2022-04-06 02:17:36.396941 IP (tos 0x0, ttl 64, id 1024, offset 0, flags [DF], proto TCP (6), length 550)
    127.0.0.1.10850 > 127.0.0.1.60894: Flags [P.], cksum 0x001b (incorrect -> 0xcb06), seq 102085:102583, ack 873, win 512, options [nop,nop,TS val 293738899 ecr 293738884], length 498
2022-04-06 02:17:36.396956 IP (tos 0x0, ttl 64, id 51172, offset 0, flags [DF], proto TCP (6), length 52)
    127.0.0.1.60894 > 127.0.0.1.10850: Flags [.], cksum 0xfe28 (incorrect -> 0x9efb), seq 873, ack 102583, win 512, options [nop,nop,TS val 293738899 ecr 293738899], length 0
2022-04-06 02:17:36.479551 IP (tos 0x0, ttl 64, id 1025, offset 0, flags [DF], proto TCP (6), length 3538)
    127.0.0.1.10850 > 127.0.0.1.60894: Flags [P.], cksum 0x0bc7 (incorrect -> 0xc75e), seq 102583:106069, ack 873, win 512, options [nop,nop,TS val 293738982 ecr 293738899], length 3486
2022-04-06 02:17:36.480213 IP (tos 0x0, ttl 64, id 51173, offset 0, flags [DF], proto TCP (6), length 52)
    127.0.0.1.60894 > 127.0.0.1.10850: Flags [.], cksum 0xfe28 (incorrect -> 0x90b6), seq 873, ack 106069, win 512, options [nop,nop,TS val 293738983 ecr 293738982], length 0
2022-04-06 02:17:36.494976 IP (tos 0x0, ttl 64, id 1026, offset 0, flags [DF], proto TCP (6), length 2672)
    127.0.0.1.10850 > 127.0.0.1.60894: Flags [P.], cksum 0x0865 (incorrect -> 0x7e01), seq 106069:108689, ack 873, win 512, options [nop,nop,TS val 293738997 ecr 293738983], length 2620
2022-04-06 02:17:36.495128 IP (tos 0x0, ttl 64, id 51174, offset 0, flags [DF], proto TCP (6), length 52)
    127.0.0.1.60894 > 127.0.0.1.10850: Flags [.], cksum 0xfe28 (incorrect -> 0x865c), seq 873, ack 108689, win 512, options [nop,nop,TS val 293738998 ecr 293738997], length 0
2022-04-06 02:17:36.601461 IP (tos 0x0, ttl 64, id 1027, offset 0, flags [DF], proto TCP (6), length 3538)
    127.0.0.1.10850 > 127.0.0.1.60894: Flags [P.], cksum 0x0bc7 (incorrect -> 0x4434), seq 108689:112175, ack 873, win 512, options [nop,nop,TS val 293739104 ecr 293738998], length 3486
2022-04-06 02:17:36.601620 IP (tos 0x0, ttl 64, id 51175, offset 0, flags [DF], proto TCP (6), length 52)
    127.0.0.1.60894 > 127.0.0.1.10850: Flags [.], cksum 0xfe28 (incorrect -> 0x77e9), seq 873, ack 112175, win 512, options [nop,nop,TS val 293739104 ecr 293739104], length 0
2022-04-06 02:17:36.616837 IP (tos 0x0, ttl 64, id 1028, offset 0, flags [DF], proto TCP (6), length 3040)
    127.0.0.1.10850 > 127.0.0.1.60894: Flags [P.], cksum 0x09d5 (incorrect -> 0xafe5), seq 112175:115163, ack 873, win 512, options [nop,nop,TS val 293739119 ecr 293739104], length 2988
2022-04-06 02:17:36.616982 IP (tos 0x0, ttl 64, id 51176, offset 0, flags [DF], proto TCP (6), length 52)
    127.0.0.1.60894 > 127.0.0.1.10850: Flags [.], cksum 0xfe28 (incorrect -> 0x6c1f), seq 873, ack 115163, win 512, options [nop,nop,TS val 293739119 ecr 293739119], length 0
2022-04-06 02:17:37.087373 IP (tos 0x0, ttl 64, id 1029, offset 0, flags [DF], proto TCP (6), length 3538)
    127.0.0.1.10850 > 127.0.0.1.60894: Flags [P.], cksum 0x0bc7 (incorrect -> 0x1d6e), seq 115163:118649, ack 873, win 512, options [nop,nop,TS val 293739590 ecr 293739119], length 3486
2022-04-06 02:17:37.087378 IP (tos 0x0, ttl 64, id 51177, offset 0, flags [DF], proto TCP (6), length 52)
    127.0.0.1.60894 > 127.0.0.1.10850: Flags [.], cksum 0xfe28 (incorrect -> 0x5ae5), seq 873, ack 118649, win 494, options [nop,nop,TS val 293739590 ecr 293739590], length 0
2022-04-06 02:17:37.102847 IP (tos 0x0, ttl 64, id 1030, offset 0, flags [DF], proto TCP (6), length 4036)
    127.0.0.1.10850 > 127.0.0.1.60894: Flags [P.], cksum 0x0db9 (incorrect -> 0x95a3), seq 118649:122633, ack 873, win 512, options [nop,nop,TS val 293739605 ecr 293739590], length 3984
2022-04-06 02:17:37.102856 IP (tos 0x0, ttl 64, id 51178, offset 0, flags [DF], proto TCP (6), length 52)
    127.0.0.1.60894 > 127.0.0.1.10850: Flags [.], cksum 0xfe28 (incorrect -> 0x4b39), seq 873, ack 122633, win 492, options [nop,nop,TS val 293739605 ecr 293739605], length 0
2022-04-06 02:17:37.118135 IP (tos 0x0, ttl 64, id 1031, offset 0, flags [DF], proto TCP (6), length 2542)
    127.0.0.1.10850 > 127.0.0.1.60894: Flags [P.], cksum 0x07e3 (incorrect -> 0x189a), seq 122633:125123, ack 873, win 512, options [nop,nop,TS val 293739621 ecr 293739605], length 2490
2022-04-06 02:17:37.118139 IP (tos 0x0, ttl 64, id 51179, offset 0, flags [DF], proto TCP (6), length 52)
    127.0.0.1.60894 > 127.0.0.1.10850: Flags [.], cksum 0xfe28 (incorrect -> 0x4159), seq 873, ack 125123, win 498, options [nop,nop,TS val 293739621 ecr 293739621], length 0
2022-04-06 02:17:37.209085 IP (tos 0x0, ttl 64, id 1032, offset 0, flags [DF], proto TCP (6), length 3040)
    127.0.0.1.10850 > 127.0.0.1.60894: Flags [P.], cksum 0x09d5 (incorrect -> 0x6490), seq 125123:128111, ack 873, win 512, options [nop,nop,TS val 293739712 ecr 293739621], length 2988
2022-04-06 02:17:37.209090 IP (tos 0x0, ttl 64, id 51180, offset 0, flags [DF], proto TCP (6), length 52)
    127.0.0.1.60894 > 127.0.0.1.10850: Flags [.], cksum 0xfe28 (incorrect -> 0x34f9), seq 873, ack 128111, win 496, options [nop,nop,TS val 293739712 ecr 293739712], length 0
2022-04-06 02:17:37.329108 IP (tos 0x0, ttl 64, id 1033, offset 0, flags [DF], proto TCP (6), length 3538)
    127.0.0.1.10850 > 127.0.0.1.60894: Flags [P.], cksum 0x0bc7 (incorrect -> 0xcc68), seq 128111:131597, ack 873, win 512, options [nop,nop,TS val 293739832 ecr 293739712], length 3486
2022-04-06 02:17:37.329112 IP (tos 0x0, ttl 64, id 51181, offset 0, flags [DF], proto TCP (6), length 52)
    127.0.0.1.60894 > 127.0.0.1.10850: Flags [.], cksum 0xfe28 (incorrect -> 0x266d), seq 873, ack 131597, win 494, options [nop,nop,TS val 293739832 ecr 293739832], length 0
2022-04-06 02:17:37.344523 IP (tos 0x0, ttl 64, id 1034, offset 0, flags [DF], proto TCP (6), length 2044)
    127.0.0.1.10850 > 127.0.0.1.60894: Flags [P.], cksum 0x05f1 (incorrect -> 0x69ff), seq 131597:133589, ack 873, win 512, options [nop,nop,TS val 293739847 ecr 293739832], length 1992
2022-04-06 02:17:37.344530 IP (tos 0x0, ttl 64, id 51182, offset 0, flags [DF], proto TCP (6), length 52)
    127.0.0.1.60894 > 127.0.0.1.10850: Flags [.], cksum 0xfe28 (incorrect -> 0x1e81), seq 873, ack 133589, win 500, options [nop,nop,TS val 293739847 ecr 293739847], length 0
2022-04-06 02:17:37.693109 IP (tos 0x0, ttl 64, id 1035, offset 0, flags [DF], proto TCP (6), length 3538)
    127.0.0.1.10850 > 127.0.0.1.60894: Flags [P.], cksum 0x0bc7 (incorrect -> 0x6205), seq 133589:137075, ack 873, win 512, options [nop,nop,TS val 293740196 ecr 293739847], length 3486
2022-04-06 02:17:37.693120 IP (tos 0x0, ttl 64, id 51183, offset 0, flags [DF], proto TCP (6), length 52)
    127.0.0.1.60894 > 127.0.0.1.10850: Flags [.], cksum 0xfe28 (incorrect -> 0x0e2f), seq 873, ack 137075, win 494, options [nop,nop,TS val 293740196 ecr 293740196], length 0
2022-04-06 02:17:37.693158 IP (tos 0x0, ttl 64, id 1036, offset 0, flags [DF], proto TCP (6), length 4036)
    127.0.0.1.10850 > 127.0.0.1.60894: Flags [P.], cksum 0x0db9 (incorrect -> 0x4ce5), seq 137075:141059, ack 873, win 512, options [nop,nop,TS val 293740196 ecr 293740196], length 3984
2022-04-06 02:17:37.693161 IP (tos 0x0, ttl 64, id 51184, offset 0, flags [DF], proto TCP (6), length 52)
    127.0.0.1.60894 > 127.0.0.1.10850: Flags [.], cksum 0xfe28 (incorrect -> 0xfeae), seq 873, ack 141059, win 478, options [nop,nop,TS val 293740196 ecr 293740196], length 0
2022-04-06 02:17:37.708546 IP (tos 0x0, ttl 64, id 1037, offset 0, flags [DF], proto TCP (6), length 2542)
    127.0.0.1.10850 > 127.0.0.1.60894: Flags [P.], cksum 0x07e3 (incorrect -> 0x5d59), seq 141059:143549, ack 873, win 512, options [nop,nop,TS val 293740211 ecr 293740196], length 2490
2022-04-06 02:17:37.708553 IP (tos 0x0, ttl 64, id 51185, offset 0, flags [DF], proto TCP (6), length 52)
    127.0.0.1.60894 > 127.0.0.1.10850: Flags [.], cksum 0xfe28 (incorrect -> 0xf4c2), seq 873, ack 143549, win 498, options [nop,nop,TS val 293740211 ecr 293740211], length 0
2022-04-06 02:17:37.814544 IP (tos 0x0, ttl 64, id 1038, offset 0, flags [DF], proto TCP (6), length 3538)
    127.0.0.1.10850 > 127.0.0.1.60894: Flags [P.], cksum 0x0bc7 (incorrect -> 0x1d1f), seq 143549:147035, ack 873, win 512, options [nop,nop,TS val 293740317 ecr 293740211], length 3486
2022-04-06 02:17:37.814554 IP (tos 0x0, ttl 64, id 51186, offset 0, flags [DF], proto TCP (6), length 52)
    127.0.0.1.60894 > 127.0.0.1.10850: Flags [.], cksum 0xfe28 (incorrect -> 0xe654), seq 873, ack 147035, win 494, options [nop,nop,TS val 293740317 ecr 293740317], length 0
2022-04-06 02:17:37.829864 IP (tos 0x0, ttl 64, id 1039, offset 0, flags [DF], proto TCP (6), length 1048)
    127.0.0.1.10850 > 127.0.0.1.60894: Flags [P.], cksum 0x020d (incorrect -> 0x7343), seq 147035:148031, ack 873, win 512, options [nop,nop,TS val 293740332 ecr 293740317], length 996
2022-04-06 02:17:37.829871 IP (tos 0x0, ttl 64, id 51187, offset 0, flags [DF], proto TCP (6), length 52)
    127.0.0.1.60894 > 127.0.0.1.10850: Flags [.], cksum 0xfe28 (incorrect -> 0xe248), seq 873, ack 148031, win 504, options [nop,nop,TS val 293740332 ecr 293740332], length 0
2022-04-06 02:17:38.200552 IP (tos 0x0, ttl 64, id 1040, offset 0, flags [DF], proto TCP (6), length 3538)
    127.0.0.1.10850 > 127.0.0.1.60894: Flags [P.], cksum 0x0bc7 (incorrect -> 0x3153), seq 148031:151517, ack 873, win 512, options [nop,nop,TS val 293740703 ecr 293740332], length 3486
2022-04-06 02:17:38.200557 IP (tos 0x0, ttl 64, id 51188, offset 0, flags [DF], proto TCP (6), length 52)
    127.0.0.1.60894 > 127.0.0.1.10850: Flags [.], cksum 0xfe28 (incorrect -> 0xd1ce), seq 873, ack 151517, win 494, options [nop,nop,TS val 293740703 ecr 293740703], length 0
2022-04-06 02:17:38.215940 IP (tos 0x0, ttl 64, id 1041, offset 0, flags [DF], proto TCP (6), length 1048)
    127.0.0.1.10850 > 127.0.0.1.60894: Flags [P.], cksum 0x020d (incorrect -> 0xf43f), seq 151517:152513, ack 873, win 512, options [nop,nop,TS val 293740718 ecr 293740703], length 996
2022-04-06 02:17:38.215944 IP (tos 0x0, ttl 64, id 51189, offset 0, flags [DF], proto TCP (6), length 52)
    127.0.0.1.60894 > 127.0.0.1.10850: Flags [.], cksum 0xfe28 (incorrect -> 0xcdc2), seq 873, ack 152513, win 504, options [nop,nop,TS val 293740718 ecr 293740718], length 0
2022-04-06 02:17:38.298238 IP (tos 0x0, ttl 64, id 1042, offset 0, flags [DF], proto TCP (6), length 2542)
    127.0.0.1.10850 > 127.0.0.1.60894: Flags [P.], cksum 0x07e3 (incorrect -> 0x8baf), seq 152513:155003, ack 873, win 512, options [nop,nop,TS val 293740801 ecr 293740718], length 2490
2022-04-06 02:17:38.298242 IP (tos 0x0, ttl 64, id 51190, offset 0, flags [DF], proto TCP (6), length 52)
    127.0.0.1.60894 > 127.0.0.1.10850: Flags [.], cksum 0xfe28 (incorrect -> 0xc368), seq 873, ack 155003, win 498, options [nop,nop,TS val 293740801 ecr 293740801], length 0
2022-04-06 02:17:38.321959 IP (tos 0x0, ttl 64, id 1043, offset 0, flags [DF], proto TCP (6), length 3538)
    127.0.0.1.10850 > 127.0.0.1.60894: Flags [P.], cksum 0x0bc7 (incorrect -> 0x849f), seq 155003:158489, ack 873, win 512, options [nop,nop,TS val 293740824 ecr 293740801], length 3486
2022-04-06 02:17:38.321963 IP (tos 0x0, ttl 64, id 51191, offset 0, flags [DF], proto TCP (6), length 52)
    127.0.0.1.60894 > 127.0.0.1.10850: Flags [.], cksum 0xfe28 (incorrect -> 0xb5a0), seq 873, ack 158489, win 494, options [nop,nop,TS val 293740824 ecr 293740824], length 0
2022-04-06 02:17:38.419272 IP (tos 0x0, ttl 64, id 1044, offset 0, flags [DF], proto TCP (6), length 2044)
    127.0.0.1.10850 > 127.0.0.1.60894: Flags [P.], cksum 0x05f1 (incorrect -> 0x7efc), seq 158489:160481, ack 873, win 512, options [nop,nop,TS val 293740922 ecr 293740824], length 1992
2022-04-06 02:17:38.419280 IP (tos 0x0, ttl 64, id 51192, offset 0, flags [DF], proto TCP (6), length 52)
    127.0.0.1.60894 > 127.0.0.1.10850: Flags [.], cksum 0xfe28 (incorrect -> 0xad0e), seq 873, ack 160481, win 500, options [nop,nop,TS val 293740922 ecr 293740922], length 0
200, 5.856247663497925, 19.428009033203125