2022-04-06 05:21:49.991389 IP (tos 0x0, ttl 64, id 13176, offset 0, flags [DF], proto TCP (6), length 60)
    127.0.0.1.47600 > 127.0.0.1.9650: Flags [S], cksum 0xfe30 (incorrect -> 0xc7d2), seq 3556769459, win 65495, options [mss 65495,sackOK,TS val 304792494 ecr 0,nop,wscale 7], length 0
2022-04-06 05:21:49.991403 IP (tos 0x0, ttl 64, id 0, offset 0, flags [DF], proto TCP (6), length 60)
    127.0.0.1.9650 > 127.0.0.1.47600: Flags [S.], cksum 0xfe30 (incorrect -> 0x043f), seq 4136695588, ack 3556769460, win 65483, options [mss 65495,sackOK,TS val 304792494 ecr 304792494,nop,wscale 7], length 0
2022-04-06 05:21:49.991414 IP (tos 0x0, ttl 64, id 13177, offset 0, flags [DF], proto TCP (6), length 52)
    127.0.0.1.47600 > 127.0.0.1.9650: Flags [.], cksum 0xfe28 (incorrect -> 0x2afb), seq 1, ack 1, win 512, options [nop,nop,TS val 304792494 ecr 304792494], length 0
2022-04-06 05:21:49.991518 IP (tos 0x0, ttl 64, id 13178, offset 0, flags [DF], proto TCP (6), length 55)
    127.0.0.1.47600 > 127.0.0.1.9650: Flags [P.], cksum 0xfe2b (incorrect -> 0x25ef), seq 1:4, ack 1, win 512, options [nop,nop,TS val 304792494 ecr 304792494], length 3
2022-04-06 05:21:49.991533 IP (tos 0x0, ttl 64, id 53611, offset 0, flags [DF], proto TCP (6), length 52)
    127.0.0.1.9650 > 127.0.0.1.47600: Flags [.], cksum 0xfe28 (incorrect -> 0x2af8), seq 1, ack 4, win 512, options [nop,nop,TS val 304792494 ecr 304792494], length 0
2022-04-06 05:21:49.991589 IP (tos 0x0, ttl 64, id 53612, offset 0, flags [DF], proto TCP (6), length 54)
    127.0.0.1.9650 > 127.0.0.1.47600: Flags [P.], cksum 0xfe2a (incorrect -> 0x25ee), seq 1:3, ack 4, win 512, options [nop,nop,TS val 304792494 ecr 304792494], length 2
2022-04-06 05:21:49.991601 IP (tos 0x0, ttl 64, id 13179, offset 0, flags [DF], proto TCP (6), length 52)
    127.0.0.1.47600 > 127.0.0.1.9650: Flags [.], cksum 0xfe28 (incorrect -> 0x2af6), seq 4, ack 3, win 512, options [nop,nop,TS val 304792494 ecr 304792494], length 0
2022-04-06 05:21:49.993279 IP (tos 0x0, ttl 64, id 13180, offset 0, flags [DF], proto TCP (6), length 62)
    127.0.0.1.47600 > 127.0.0.1.9650: Flags [P.], cksum 0xfe32 (incorrect -> 0xf635), seq 4:14, ack 3, win 512, options [nop,nop,TS val 304792496 ecr 304792494], length 10
2022-04-06 05:21:49.993298 IP (tos 0x0, ttl 64, id 53613, offset 0, flags [DF], proto TCP (6), length 52)
    127.0.0.1.9650 > 127.0.0.1.47600: Flags [.], cksum 0xfe28 (incorrect -> 0x2ae8), seq 3, ack 14, win 512, options [nop,nop,TS val 304792496 ecr 304792496], length 0
2022-04-06 05:21:50.100141 IP (tos 0x0, ttl 64, id 53614, offset 0, flags [DF], proto TCP (6), length 62)
    127.0.0.1.9650 > 127.0.0.1.47600: Flags [P.], cksum 0xfe32 (incorrect -> 0x256a), seq 3:13, ack 14, win 512, options [nop,nop,TS val 304792603 ecr 304792496], length 10
2022-04-06 05:21:50.100153 IP (tos 0x0, ttl 64, id 13181, offset 0, flags [DF], proto TCP (6), length 52)
    127.0.0.1.47600 > 127.0.0.1.9650: Flags [.], cksum 0xfe28 (incorrect -> 0x2a08), seq 14, ack 13, win 512, options [nop,nop,TS val 304792603 ecr 304792603], length 0
2022-04-06 05:21:50.105895 IP (tos 0x0, ttl 64, id 13182, offset 0, flags [DF], proto TCP (6), length 569)
    127.0.0.1.47600 > 127.0.0.1.9650: Flags [P.], cksum 0x002e (incorrect -> 0x4f9a), seq 14:531, ack 13, win 512, options [nop,nop,TS val 304792608 ecr 304792603], length 517
2022-04-06 05:21:50.105905 IP (tos 0x0, ttl 64, id 53615, offset 0, flags [DF], proto TCP (6), length 52)
    127.0.0.1.9650 > 127.0.0.1.47600: Flags [.], cksum 0xfe28 (incorrect -> 0x27fd), seq 13, ack 531, win 508, options [nop,nop,TS val 304792608 ecr 304792608], length 0
2022-04-06 05:21:50.210106 IP (tos 0x0, ttl 64, id 53616, offset 0, flags [DF], proto TCP (6), length 3538)
    127.0.0.1.9650 > 127.0.0.1.47600: Flags [P.], cksum 0x0bc7 (incorrect -> 0xfeca), seq 13:3499, ack 531, win 512, options [nop,nop,TS val 304792713 ecr 304792608], length 3486
2022-04-06 05:21:50.210114 IP (tos 0x0, ttl 64, id 13183, offset 0, flags [DF], proto TCP (6), length 52)
    127.0.0.1.47600 > 127.0.0.1.9650: Flags [.], cksum 0xfe28 (incorrect -> 0x199b), seq 531, ack 3499, win 494, options [nop,nop,TS val 304792713 ecr 304792713], length 0
2022-04-06 05:21:50.242128 IP (tos 0x0, ttl 64, id 53617, offset 0, flags [DF], proto TCP (6), length 1334)
    127.0.0.1.9650 > 127.0.0.1.47600: Flags [P.], cksum 0x032b (incorrect -> 0x3fdd), seq 3499:4781, ack 531, win 512, options [nop,nop,TS val 304792745 ecr 304792713], length 1282
2022-04-06 05:21:50.242136 IP (tos 0x0, ttl 64, id 13184, offset 0, flags [DF], proto TCP (6), length 52)
    127.0.0.1.47600 > 127.0.0.1.9650: Flags [.], cksum 0xfe28 (incorrect -> 0x1451), seq 531, ack 4781, win 502, options [nop,nop,TS val 304792745 ecr 304792745], length 0
2022-04-06 05:21:50.242546 IP (tos 0x0, ttl 64, id 13185, offset 0, flags [DF], proto TCP (6), length 116)
    127.0.0.1.47600 > 127.0.0.1.9650: Flags [P.], cksum 0xfe68 (incorrect -> 0x7241), seq 531:595, ack 4781, win 512, options [nop,nop,TS val 304792745 ecr 304792745], length 64
2022-04-06 05:21:50.242554 IP (tos 0x0, ttl 64, id 53618, offset 0, flags [DF], proto TCP (6), length 52)
    127.0.0.1.9650 > 127.0.0.1.47600: Flags [.], cksum 0xfe28 (incorrect -> 0x1407), seq 4781, ack 595, win 512, options [nop,nop,TS val 304792745 ecr 304792745], length 0
2022-04-06 05:21:50.242933 IP (tos 0x0, ttl 64, id 13186, offset 0, flags [DF], proto TCP (6), length 337)
    127.0.0.1.47600 > 127.0.0.1.9650: Flags [P.], cksum 0xff45 (incorrect -> 0xe653), seq 595:880, ack 4781, win 512, options [nop,nop,TS val 304792745 ecr 304792745], length 285
2022-04-06 05:21:50.242944 IP (tos 0x0, ttl 64, id 53619, offset 0, flags [DF], proto TCP (6), length 52)
    127.0.0.1.9650 > 127.0.0.1.47600: Flags [.], cksum 0xfe28 (incorrect -> 0x12ec), seq 4781, ack 880, win 510, options [nop,nop,TS val 304792745 ecr 304792745], length 0
2022-04-06 05:21:50.555749 IP (tos 0x0, ttl 64, id 53620, offset 0, flags [DF], proto TCP (6), length 3538)
    127.0.0.1.9650 > 127.0.0.1.47600: Flags [P.], cksum 0x0bc7 (incorrect -> 0x53b0), seq 4781:8267, ack 880, win 512, options [nop,nop,TS val 304793058 ecr 304792745], length 3486
2022-04-06 05:21:50.555757 IP (tos 0x0, ttl 64, id 13187, offset 0, flags [DF], proto TCP (6), length 52)
    127.0.0.1.47600 > 127.0.0.1.9650: Flags [.], cksum 0xfe28 (incorrect -> 0x02ec), seq 880, ack 8267, win 494, options [nop,nop,TS val 304793058 ecr 304793058], length 0
2022-04-06 05:21:50.567588 IP (tos 0x0, ttl 64, id 53621, offset 0, flags [DF], proto TCP (6), length 4036)
    127.0.0.1.9650 > 127.0.0.1.47600: Flags [P.], cksum 0x0db9 (incorrect -> 0xa86d), seq 8267:12251, ack 880, win 512, options [nop,nop,TS val 304793070 ecr 304793058], length 3984
2022-04-06 05:21:50.567596 IP (tos 0x0, ttl 64, id 13188, offset 0, flags [DF], proto TCP (6), length 52)
    127.0.0.1.47600 > 127.0.0.1.9650: Flags [.], cksum 0xfe28 (incorrect -> 0xf345), seq 880, ack 12251, win 492, options [nop,nop,TS val 304793070 ecr 304793070], length 0
2022-04-06 05:21:50.579468 IP (tos 0x0, ttl 64, id 53622, offset 0, flags [DF], proto TCP (6), length 4036)
    127.0.0.1.9650 > 127.0.0.1.47600: Flags [P.], cksum 0x0db9 (incorrect -> 0x7de9), seq 12251:16235, ack 880, win 512, options [nop,nop,TS val 304793082 ecr 304793070], length 3984
2022-04-06 05:21:50.579475 IP (tos 0x0, ttl 64, id 13189, offset 0, flags [DF], proto TCP (6), length 52)
    127.0.0.1.47600 > 127.0.0.1.9650: Flags [.], cksum 0xfe28 (incorrect -> 0xe39d), seq 880, ack 16235, win 492, options [nop,nop,TS val 304793082 ecr 304793082], length 0
2022-04-06 05:21:50.585369 IP (tos 0x0, ttl 64, id 53623, offset 0, flags [DF], proto TCP (6), length 3538)
    127.0.0.1.9650 > 127.0.0.1.47600: Flags [P.], cksum 0x0bc7 (incorrect -> 0x9241), seq 16235:19721, ack 880, win 512, options [nop,nop,TS val 304793088 ecr 304793082], length 3486
2022-04-06 05:21:50.585375 IP (tos 0x0, ttl 64, id 13190, offset 0, flags [DF], proto TCP (6), length 52)
    127.0.0.1.47600 > 127.0.0.1.9650: Flags [.], cksum 0xfe28 (incorrect -> 0xd5f1), seq 880, ack 19721, win 494, options [nop,nop,TS val 304793088 ecr 304793088], length 0
2022-04-06 05:21:50.585424 IP (tos 0x0, ttl 64, id 53624, offset 0, flags [DF], proto TCP (6), length 4100)
    127.0.0.1.9650 > 127.0.0.1.47600: Flags [P.], cksum 0x0df9 (incorrect -> 0xf6f8), seq 19721:23769, ack 880, win 512, options [nop,nop,TS val 304793088 ecr 304793088], length 4048
2022-04-06 05:21:50.585429 IP (tos 0x0, ttl 64, id 13191, offset 0, flags [DF], proto TCP (6), length 52)
    127.0.0.1.47600 > 127.0.0.1.9650: Flags [.], cksum 0xfe28 (incorrect -> 0xc631), seq 880, ack 23769, win 478, options [nop,nop,TS val 304793088 ecr 304793088], length 0
2022-04-06 05:21:50.585436 IP (tos 0x0, ttl 64, id 53625, offset 0, flags [DF], proto TCP (6), length 3420)
    127.0.0.1.9650 > 127.0.0.1.47600: Flags [P.], cksum 0x0b51 (incorrect -> 0x22c1), seq 23769:27137, ack 880, win 512, options [nop,nop,TS val 304793088 ecr 304793088], length 3368
2022-04-06 05:21:50.585439 IP (tos 0x0, ttl 64, id 13192, offset 0, flags [DF], proto TCP (6), length 52)
    127.0.0.1.47600 > 127.0.0.1.9650: Flags [.], cksum 0xfe28 (incorrect -> 0xb916), seq 880, ack 27137, win 465, options [nop,nop,TS val 304793088 ecr 304793088], length 0
2022-04-06 05:21:50.591349 IP (tos 0x0, ttl 64, id 53626, offset 0, flags [DF], proto TCP (6), length 3538)
    127.0.0.1.9650 > 127.0.0.1.47600: Flags [P.], cksum 0x0bc7 (incorrect -> 0x8024), seq 27137:30623, ack 880, win 512, options [nop,nop,TS val 304793094 ecr 304793088], length 3486
2022-04-06 05:21:50.591356 IP (tos 0x0, ttl 64, id 13193, offset 0, flags [DF], proto TCP (6), length 52)
    127.0.0.1.47600 > 127.0.0.1.9650: Flags [.], cksum 0xfe28 (incorrect -> 0xab4f), seq 880, ack 30623, win 494, options [nop,nop,TS val 304793094 ecr 304793094], length 0
2022-04-06 05:21:50.595165 IP (tos 0x0, ttl 64, id 53627, offset 0, flags [DF], proto TCP (6), length 3538)
    127.0.0.1.9650 > 127.0.0.1.47600: Flags [P.], cksum 0x0bc7 (incorrect -> 0x4bd1), seq 30623:34109, ack 880, win 512, options [nop,nop,TS val 304793098 ecr 304793094], length 3486
2022-04-06 05:21:50.595172 IP (tos 0x0, ttl 64, id 13194, offset 0, flags [DF], proto TCP (6), length 52)
    127.0.0.1.47600 > 127.0.0.1.9650: Flags [.], cksum 0xfe28 (incorrect -> 0x9da9), seq 880, ack 34109, win 494, options [nop,nop,TS val 304793098 ecr 304793098], length 0
2022-04-06 05:21:50.597235 IP (tos 0x0, ttl 64, id 53628, offset 0, flags [DF], proto TCP (6), length 4100)
    127.0.0.1.9650 > 127.0.0.1.47600: Flags [P.], cksum 0x0df9 (incorrect -> 0x3267), seq 34109:38157, ack 880, win 512, options [nop,nop,TS val 304793100 ecr 304793098], length 4048
2022-04-06 05:21:50.597241 IP (tos 0x0, ttl 64, id 13195, offset 0, flags [DF], proto TCP (6), length 52)
    127.0.0.1.47600 > 127.0.0.1.9650: Flags [.], cksum 0xfe28 (incorrect -> 0x8dd7), seq 880, ack 38157, win 492, options [nop,nop,TS val 304793100 ecr 304793100], length 0
2022-04-06 05:21:50.597248 IP (tos 0x0, ttl 64, id 53629, offset 0, flags [DF], proto TCP (6), length 984)
    127.0.0.1.9650 > 127.0.0.1.47600: Flags [P.], cksum 0x01cd (incorrect -> 0xba0c), seq 38157:39089, ack 880, win 512, options [nop,nop,TS val 304793100 ecr 304793100], length 932
2022-04-06 05:21:50.597517 IP (tos 0x0, ttl 64, id 13196, offset 0, flags [DF], proto TCP (6), length 52)
    127.0.0.1.47600 > 127.0.0.1.9650: Flags [.], cksum 0xfe28 (incorrect -> 0x8a1f), seq 880, ack 39089, win 512, options [nop,nop,TS val 304793100 ecr 304793100], length 0
2022-04-06 05:21:50.609098 IP (tos 0x0, ttl 64, id 53630, offset 0, flags [DF], proto TCP (6), length 4036)
    127.0.0.1.9650 > 127.0.0.1.47600: Flags [P.], cksum 0x0db9 (incorrect -> 0x67ba), seq 39089:43073, ack 880, win 512, options [nop,nop,TS val 304793112 ecr 304793100], length 3984
2022-04-06 05:21:50.609115 IP (tos 0x0, ttl 64, id 13197, offset 0, flags [DF], proto TCP (6), length 52)
    127.0.0.1.47600 > 127.0.0.1.9650: Flags [.], cksum 0xfe28 (incorrect -> 0x7a77), seq 880, ack 43073, win 512, options [nop,nop,TS val 304793112 ecr 304793112], length 0
2022-04-06 05:21:50.615770 IP (tos 0x0, ttl 64, id 53631, offset 0, flags [DF], proto TCP (6), length 4100)
    127.0.0.1.9650 > 127.0.0.1.47600: Flags [P.], cksum 0x0df9 (incorrect -> 0x2b87), seq 43073:47121, ack 880, win 512, options [nop,nop,TS val 304793118 ecr 304793112], length 4048
2022-04-06 05:21:50.645751 IP (tos 0x0, ttl 64, id 53632, offset 0, flags [DF], proto TCP (6), length 32820)
    127.0.0.1.9650 > 127.0.0.1.47600: Flags [.], cksum 0x7e29 (incorrect -> 0x955c), seq 47121:79889, ack 880, win 512, options [nop,nop,TS val 304793148 ecr 304793112], length 32768
2022-04-06 05:21:50.645800 IP (tos 0x0, ttl 64, id 13198, offset 0, flags [DF], proto TCP (6), length 52)
    127.0.0.1.47600 > 127.0.0.1.9650: Flags [.], cksum 0xfe28 (incorrect -> 0xeb01), seq 880, ack 79889, win 379, options [nop,nop,TS val 304793148 ecr 304793118], length 0
2022-04-06 05:21:50.645813 IP (tos 0x0, ttl 64, id 53633, offset 0, flags [DF], proto TCP (6), length 2031)
    127.0.0.1.9650 > 127.0.0.1.47600: Flags [P.], cksum 0x05e4 (incorrect -> 0x0b3b), seq 79889:81868, ack 880, win 512, options [nop,nop,TS val 304793148 ecr 304793148], length 1979
2022-04-06 05:21:50.646426 IP (tos 0x0, ttl 64, id 13199, offset 0, flags [DF], proto TCP (6), length 52)
    127.0.0.1.47600 > 127.0.0.1.9650: Flags [.], cksum 0xfe28 (incorrect -> 0xe2a2), seq 880, ack 81868, win 512, options [nop,nop,TS val 304793149 ecr 304793148], length 0
2022-04-06 05:21:50.648465 IP (tos 0x0, ttl 64, id 53634, offset 0, flags [DF], proto TCP (6), length 4100)
    127.0.0.1.9650 > 127.0.0.1.47600: Flags [P.], cksum 0x0df9 (incorrect -> 0x98bf), seq 81868:85916, ack 880, win 512, options [nop,nop,TS val 304793151 ecr 304793149], length 4048
2022-04-06 05:21:50.648828 IP (tos 0x0, ttl 64, id 13200, offset 0, flags [DF], proto TCP (6), length 52)
    127.0.0.1.47600 > 127.0.0.1.9650: Flags [.], cksum 0xfe28 (incorrect -> 0xd2cd), seq 880, ack 85916, win 512, options [nop,nop,TS val 304793151 ecr 304793151], length 0
2022-04-06 05:21:50.648837 IP (tos 0x0, ttl 64, id 53635, offset 0, flags [DF], proto TCP (6), length 11442)
    127.0.0.1.9650 > 127.0.0.1.47600: Flags [P.], cksum 0x2aa7 (incorrect -> 0x3bf3), seq 85916:97306, ack 880, win 512, options [nop,nop,TS val 304793151 ecr 304793151], length 11390
2022-04-06 05:21:50.648843 IP (tos 0x0, ttl 64, id 13201, offset 0, flags [DF], proto TCP (6), length 52)
    127.0.0.1.47600 > 127.0.0.1.9650: Flags [.], cksum 0xfe28 (incorrect -> 0xa64f), seq 880, ack 97306, win 512, options [nop,nop,TS val 304793151 ecr 304793151], length 0
2022-04-06 05:21:50.651387 IP (tos 0x0, ttl 64, id 53636, offset 0, flags [DF], proto TCP (6), length 1546)
    127.0.0.1.9650 > 127.0.0.1.47600: Flags [P.], cksum 0x03ff (incorrect -> 0x336f), seq 97306:98800, ack 880, win 512, options [nop,nop,TS val 304793154 ecr 304793151], length 1494
2022-04-06 05:21:50.651403 IP (tos 0x0, ttl 64, id 13202, offset 0, flags [DF], proto TCP (6), length 52)
    127.0.0.1.47600 > 127.0.0.1.9650: Flags [.], cksum 0xfe28 (incorrect -> 0xa073), seq 880, ack 98800, win 512, options [nop,nop,TS val 304793154 ecr 304793154], length 0
2022-04-06 05:21:50.655440 IP (tos 0x0, ttl 64, id 53637, offset 0, flags [DF], proto TCP (6), length 4100)
    127.0.0.1.9650 > 127.0.0.1.47600: Flags [P.], cksum 0x0df9 (incorrect -> 0x04a6), seq 98800:102848, ack 880, win 512, options [nop,nop,TS val 304793158 ecr 304793154], length 4048
2022-04-06 05:21:50.655814 IP (tos 0x0, ttl 64, id 13203, offset 0, flags [DF], proto TCP (6), length 52)
    127.0.0.1.47600 > 127.0.0.1.9650: Flags [.], cksum 0xfe28 (incorrect -> 0x909b), seq 880, ack 102848, win 512, options [nop,nop,TS val 304793158 ecr 304793158], length 0
2022-04-06 05:21:50.655821 IP (tos 0x0, ttl 64, id 53638, offset 0, flags [DF], proto TCP (6), length 3474)
    127.0.0.1.9650 > 127.0.0.1.47600: Flags [P.], cksum 0x0b87 (incorrect -> 0xea72), seq 102848:106270, ack 880, win 512, options [nop,nop,TS val 304793158 ecr 304793158], length 3422
2022-04-06 05:21:50.655826 IP (tos 0x0, ttl 64, id 13204, offset 0, flags [DF], proto TCP (6), length 52)
    127.0.0.1.47600 > 127.0.0.1.9650: Flags [.], cksum 0xfe28 (incorrect -> 0x833d), seq 880, ack 106270, win 512, options [nop,nop,TS val 304793158 ecr 304793158], length 0
2022-04-06 05:21:50.661916 IP (tos 0x0, ttl 64, id 53639, offset 0, flags [DF], proto TCP (6), length 4100)
    127.0.0.1.9650 > 127.0.0.1.47600: Flags [P.], cksum 0x0df9 (incorrect -> 0xd7e0), seq 106270:110318, ack 880, win 512, options [nop,nop,TS val 304793164 ecr 304793158], length 4048
2022-04-06 05:21:50.661952 IP (tos 0x0, ttl 64, id 13205, offset 0, flags [DF], proto TCP (6), length 52)
    127.0.0.1.47600 > 127.0.0.1.9650: Flags [.], cksum 0xfe28 (incorrect -> 0x7361), seq 880, ack 110318, win 512, options [nop,nop,TS val 304793164 ecr 304793164], length 0
2022-04-06 05:21:50.661957 IP (tos 0x0, ttl 64, id 53640, offset 0, flags [DF], proto TCP (6), length 486)
    127.0.0.1.9650 > 127.0.0.1.47600: Flags [P.], cksum 0xffda (incorrect -> 0x0f9d), seq 110318:110752, ack 880, win 512, options [nop,nop,TS val 304793164 ecr 304793164], length 434
2022-04-06 05:21:50.661962 IP (tos 0x0, ttl 64, id 13206, offset 0, flags [DF], proto TCP (6), length 52)
    127.0.0.1.47600 > 127.0.0.1.9650: Flags [.], cksum 0xfe28 (incorrect -> 0x71af), seq 880, ack 110752, win 512, options [nop,nop,TS val 304793164 ecr 304793164], length 0
2022-04-06 05:21:50.663317 IP (tos 0x0, ttl 64, id 53641, offset 0, flags [DF], proto TCP (6), length 4036)
    127.0.0.1.9650 > 127.0.0.1.47600: Flags [P.], cksum 0x0db9 (incorrect -> 0xd2c9), seq 110752:114736, ack 880, win 512, options [nop,nop,TS val 304793166 ecr 304793164], length 3984
2022-04-06 05:21:50.663331 IP (tos 0x0, ttl 64, id 13207, offset 0, flags [DF], proto TCP (6), length 52)
    127.0.0.1.47600 > 127.0.0.1.9650: Flags [.], cksum 0xfe28 (incorrect -> 0x621b), seq 880, ack 114736, win 512, options [nop,nop,TS val 304793166 ecr 304793166], length 0
2022-04-06 05:21:50.675227 IP (tos 0x0, ttl 64, id 53642, offset 0, flags [DF], proto TCP (6), length 4036)
    127.0.0.1.9650 > 127.0.0.1.47600: Flags [P.], cksum 0x0db9 (incorrect -> 0x3d32), seq 114736:118720, ack 880, win 512, options [nop,nop,TS val 304793178 ecr 304793166], length 3984
200, 4.71602463722229, 0.717423677444458