2022-04-06 18:19:39.891629 IP (tos 0x0, ttl 64, id 19127, offset 0, flags [DF], proto TCP (6), length 60)
    127.0.0.1.54562 > 127.0.0.1.11550: Flags [S], cksum 0xfe30 (incorrect -> 0xa4bb), seq 779452835, win 65495, options [mss 65495,sackOK,TS val 351462394 ecr 0,nop,wscale 7], length 0
2022-04-06 18:19:39.891643 IP (tos 0x0, ttl 64, id 0, offset 0, flags [DF], proto TCP (6), length 60)
    127.0.0.1.11550 > 127.0.0.1.54562: Flags [S.], cksum 0xfe30 (incorrect -> 0x6fde), seq 1723716909, ack 779452836, win 65483, options [mss 65495,sackOK,TS val 351462394 ecr 351462394,nop,wscale 7], length 0
2022-04-06 18:19:39.891653 IP (tos 0x0, ttl 64, id 19128, offset 0, flags [DF], proto TCP (6), length 52)
    127.0.0.1.54562 > 127.0.0.1.11550: Flags [.], cksum 0xfe28 (incorrect -> 0x969a), seq 1, ack 1, win 512, options [nop,nop,TS val 351462394 ecr 351462394], length 0
2022-04-06 18:19:39.891740 IP (tos 0x0, ttl 64, id 19129, offset 0, flags [DF], proto TCP (6), length 55)
    127.0.0.1.54562 > 127.0.0.1.11550: Flags [P.], cksum 0xfe2b (incorrect -> 0x918e), seq 1:4, ack 1, win 512, options [nop,nop,TS val 351462394 ecr 351462394], length 3
2022-04-06 18:19:39.891751 IP (tos 0x0, ttl 64, id 45404, offset 0, flags [DF], proto TCP (6), length 52)
    127.0.0.1.11550 > 127.0.0.1.54562: Flags [.], cksum 0xfe28 (incorrect -> 0x9697), seq 1, ack 4, win 512, options [nop,nop,TS val 351462394 ecr 351462394], length 0
2022-04-06 18:19:39.891802 IP (tos 0x0, ttl 64, id 45405, offset 0, flags [DF], proto TCP (6), length 54)
    127.0.0.1.11550 > 127.0.0.1.54562: Flags [P.], cksum 0xfe2a (incorrect -> 0x918d), seq 1:3, ack 4, win 512, options [nop,nop,TS val 351462394 ecr 351462394], length 2
2022-04-06 18:19:39.891813 IP (tos 0x0, ttl 64, id 19130, offset 0, flags [DF], proto TCP (6), length 52)
    127.0.0.1.54562 > 127.0.0.1.11550: Flags [.], cksum 0xfe28 (incorrect -> 0x9695), seq 4, ack 3, win 512, options [nop,nop,TS val 351462394 ecr 351462394], length 0
2022-04-06 18:19:39.893467 IP (tos 0x0, ttl 64, id 19131, offset 0, flags [DF], proto TCP (6), length 62)
    127.0.0.1.54562 > 127.0.0.1.11550: Flags [P.], cksum 0xfe32 (incorrect -> 0xa5a2), seq 4:14, ack 3, win 512, options [nop,nop,TS val 351462396 ecr 351462394], length 10
2022-04-06 18:19:39.893486 IP (tos 0x0, ttl 64, id 45406, offset 0, flags [DF], proto TCP (6), length 52)
    127.0.0.1.11550 > 127.0.0.1.54562: Flags [.], cksum 0xfe28 (incorrect -> 0x9687), seq 3, ack 14, win 512, options [nop,nop,TS val 351462396 ecr 351462396], length 0
2022-04-06 18:19:39.949520 IP (tos 0x0, ttl 64, id 45407, offset 0, flags [DF], proto TCP (6), length 62)
    127.0.0.1.11550 > 127.0.0.1.54562: Flags [P.], cksum 0xfe32 (incorrect -> 0x913c), seq 3:13, ack 14, win 512, options [nop,nop,TS val 351462452 ecr 351462396], length 10
2022-04-06 18:19:39.949530 IP (tos 0x0, ttl 64, id 19132, offset 0, flags [DF], proto TCP (6), length 52)
    127.0.0.1.54562 > 127.0.0.1.11550: Flags [.], cksum 0xfe28 (incorrect -> 0x960d), seq 14, ack 13, win 512, options [nop,nop,TS val 351462452 ecr 351462452], length 0
2022-04-06 18:19:39.955091 IP (tos 0x0, ttl 64, id 19133, offset 0, flags [DF], proto TCP (6), length 569)
    127.0.0.1.54562 > 127.0.0.1.11550: Flags [P.], cksum 0x002e (incorrect -> 0x032d), seq 14:531, ack 13, win 512, options [nop,nop,TS val 351462458 ecr 351462452], length 517
2022-04-06 18:19:39.955101 IP (tos 0x0, ttl 64, id 45408, offset 0, flags [DF], proto TCP (6), length 52)
    127.0.0.1.11550 > 127.0.0.1.54562: Flags [.], cksum 0xfe28 (incorrect -> 0x9400), seq 13, ack 531, win 508, options [nop,nop,TS val 351462458 ecr 351462458], length 0
2022-04-06 18:19:40.011891 IP (tos 0x0, ttl 64, id 45409, offset 0, flags [DF], proto TCP (6), length 3538)
    127.0.0.1.11550 > 127.0.0.1.54562: Flags [P.], cksum 0x0bc7 (incorrect -> 0xff80), seq 13:3499, ack 531, win 512, options [nop,nop,TS val 351462514 ecr 351462458], length 3486
2022-04-06 18:19:40.011905 IP (tos 0x0, ttl 64, id 19134, offset 0, flags [DF], proto TCP (6), length 52)
    127.0.0.1.54562 > 127.0.0.1.11550: Flags [.], cksum 0xfe28 (incorrect -> 0x8600), seq 531, ack 3499, win 494, options [nop,nop,TS val 351462514 ecr 351462514], length 0
2022-04-06 18:19:40.022997 IP (tos 0x0, ttl 64, id 45410, offset 0, flags [DF], proto TCP (6), length 181)
    127.0.0.1.11550 > 127.0.0.1.54562: Flags [P.], cksum 0xfea9 (incorrect -> 0x7f38), seq 3499:3628, ack 531, win 512, options [nop,nop,TS val 351462525 ecr 351462514], length 129
2022-04-06 18:19:40.023011 IP (tos 0x0, ttl 64, id 19135, offset 0, flags [DF], proto TCP (6), length 52)
    127.0.0.1.54562 > 127.0.0.1.11550: Flags [.], cksum 0xfe28 (incorrect -> 0x855c), seq 531, ack 3628, win 507, options [nop,nop,TS val 351462525 ecr 351462525], length 0
2022-04-06 18:19:40.023198 IP (tos 0x0, ttl 64, id 19136, offset 0, flags [DF], proto TCP (6), length 132)
    127.0.0.1.54562 > 127.0.0.1.11550: Flags [P.], cksum 0xfe78 (incorrect -> 0x8040), seq 531:611, ack 3628, win 512, options [nop,nop,TS val 351462526 ecr 351462525], length 80
2022-04-06 18:19:40.023209 IP (tos 0x0, ttl 64, id 45411, offset 0, flags [DF], proto TCP (6), length 52)
    127.0.0.1.11550 > 127.0.0.1.54562: Flags [.], cksum 0xfe28 (incorrect -> 0x8505), seq 3628, ack 611, win 512, options [nop,nop,TS val 351462526 ecr 351462526], length 0
2022-04-06 18:19:40.023772 IP (tos 0x0, ttl 64, id 19137, offset 0, flags [DF], proto TCP (6), length 398)
    127.0.0.1.54562 > 127.0.0.1.11550: Flags [P.], cksum 0xff82 (incorrect -> 0xaf7c), seq 611:957, ack 3628, win 512, options [nop,nop,TS val 351462526 ecr 351462526], length 346
2022-04-06 18:19:40.023783 IP (tos 0x0, ttl 64, id 45412, offset 0, flags [DF], proto TCP (6), length 52)
    127.0.0.1.11550 > 127.0.0.1.54562: Flags [.], cksum 0xfe28 (incorrect -> 0x83ad), seq 3628, ack 957, win 510, options [nop,nop,TS val 351462526 ecr 351462526], length 0
403, 2.8287553787231445, 0.22765541076660156