2022-04-06 00:07:21.341887 IP (tos 0x0, ttl 64, id 29646, offset 0, flags [DF], proto TCP (6), length 60)
    127.0.0.1.46116 > 127.0.0.1.9950: Flags [S], cksum 0xfe30 (incorrect -> 0xc2ab), seq 3513578967, win 65495, options [mss 65495,sackOK,TS val 285923844 ecr 0,nop,wscale 7], length 0
2022-04-06 00:07:21.341901 IP (tos 0x0, ttl 64, id 0, offset 0, flags [DF], proto TCP (6), length 60)
    127.0.0.1.9950 > 127.0.0.1.46116: Flags [S.], cksum 0xfe30 (incorrect -> 0x7c08), seq 4196098419, ack 3513578968, win 65483, options [mss 65495,sackOK,TS val 285923844 ecr 285923844,nop,wscale 7], length 0
2022-04-06 00:07:21.341910 IP (tos 0x0, ttl 64, id 29647, offset 0, flags [DF], proto TCP (6), length 52)
    127.0.0.1.46116 > 127.0.0.1.9950: Flags [.], cksum 0xfe28 (incorrect -> 0xa2c4), seq 1, ack 1, win 512, options [nop,nop,TS val 285923844 ecr 285923844], length 0
2022-04-06 00:07:21.342003 IP (tos 0x0, ttl 64, id 29648, offset 0, flags [DF], proto TCP (6), length 55)
    127.0.0.1.46116 > 127.0.0.1.9950: Flags [P.], cksum 0xfe2b (incorrect -> 0x9db8), seq 1:4, ack 1, win 512, options [nop,nop,TS val 285923844 ecr 285923844], length 3
2022-04-06 00:07:21.342008 IP (tos 0x0, ttl 64, id 23752, offset 0, flags [DF], proto TCP (6), length 52)
    127.0.0.1.9950 > 127.0.0.1.46116: Flags [.], cksum 0xfe28 (incorrect -> 0xa2c1), seq 1, ack 4, win 512, options [nop,nop,TS val 285923844 ecr 285923844], length 0
2022-04-06 00:07:21.342087 IP (tos 0x0, ttl 64, id 23753, offset 0, flags [DF], proto TCP (6), length 54)
    127.0.0.1.9950 > 127.0.0.1.46116: Flags [P.], cksum 0xfe2a (incorrect -> 0x9db6), seq 1:3, ack 4, win 512, options [nop,nop,TS val 285923845 ecr 285923844], length 2
2022-04-06 00:07:21.342094 IP (tos 0x0, ttl 64, id 29649, offset 0, flags [DF], proto TCP (6), length 52)
    127.0.0.1.46116 > 127.0.0.1.9950: Flags [.], cksum 0xfe28 (incorrect -> 0xa2bd), seq 4, ack 3, win 512, options [nop,nop,TS val 285923845 ecr 285923845], length 0
2022-04-06 00:07:21.558254 IP (tos 0x0, ttl 64, id 29650, offset 0, flags [DF], proto TCP (6), length 62)
    127.0.0.1.46116 > 127.0.0.1.9950: Flags [P.], cksum 0xfe32 (incorrect -> 0x2b8a), seq 4:14, ack 3, win 512, options [nop,nop,TS val 285924061 ecr 285923845], length 10
2022-04-06 00:07:21.558272 IP (tos 0x0, ttl 64, id 23754, offset 0, flags [DF], proto TCP (6), length 52)
    127.0.0.1.9950 > 127.0.0.1.46116: Flags [.], cksum 0xfe28 (incorrect -> 0xa103), seq 3, ack 14, win 512, options [nop,nop,TS val 285924061 ecr 285924061], length 0
2022-04-06 00:07:21.680681 IP (tos 0x0, ttl 64, id 23755, offset 0, flags [DF], proto TCP (6), length 62)
    127.0.0.1.9950 > 127.0.0.1.46116: Flags [P.], cksum 0xfe32 (incorrect -> 0x9b76), seq 3:13, ack 14, win 512, options [nop,nop,TS val 285924183 ecr 285924061], length 10
2022-04-06 00:07:21.680695 IP (tos 0x0, ttl 64, id 29651, offset 0, flags [DF], proto TCP (6), length 52)
    127.0.0.1.46116 > 127.0.0.1.9950: Flags [.], cksum 0xfe28 (incorrect -> 0xa005), seq 14, ack 13, win 512, options [nop,nop,TS val 285924183 ecr 285924183], length 0
2022-04-06 00:07:21.686360 IP (tos 0x0, ttl 64, id 29652, offset 0, flags [DF], proto TCP (6), length 569)
    127.0.0.1.46116 > 127.0.0.1.9950: Flags [P.], cksum 0x002e (incorrect -> 0x06b6), seq 14:531, ack 13, win 512, options [nop,nop,TS val 285924189 ecr 285924183], length 517
2022-04-06 00:07:21.686371 IP (tos 0x0, ttl 64, id 23756, offset 0, flags [DF], proto TCP (6), length 52)
    127.0.0.1.9950 > 127.0.0.1.46116: Flags [.], cksum 0xfe28 (incorrect -> 0x9df8), seq 13, ack 531, win 508, options [nop,nop,TS val 285924189 ecr 285924189], length 0
