2022-04-06 10:28:10.038815 IP (tos 0x0, ttl 64, id 30440, offset 0, flags [DF], proto TCP (6), length 60)
    127.0.0.1.33418 > 127.0.0.1.11150: Flags [S], cksum 0xfe30 (incorrect -> 0x81ea), seq 3768906585, win 65495, options [mss 65495,sackOK,TS val 323172541 ecr 0,nop,wscale 7], length 0
2022-04-06 10:28:10.038827 IP (tos 0x0, ttl 64, id 0, offset 0, flags [DF], proto TCP (6), length 60)
    127.0.0.1.11150 > 127.0.0.1.33418: Flags [S.], cksum 0xfe30 (incorrect -> 0x0bf2), seq 861468314, ack 3768906586, win 65483, options [mss 65495,sackOK,TS val 323172541 ecr 323172541,nop,wscale 7], length 0
2022-04-06 10:28:10.038836 IP (tos 0x0, ttl 64, id 30441, offset 0, flags [DF], proto TCP (6), length 52)
    127.0.0.1.33418 > 127.0.0.1.11150: Flags [.], cksum 0xfe28 (incorrect -> 0x32ae), seq 1, ack 1, win 512, options [nop,nop,TS val 323172541 ecr 323172541], length 0
2022-04-06 10:28:10.038971 IP (tos 0x0, ttl 64, id 30442, offset 0, flags [DF], proto TCP (6), length 55)
    127.0.0.1.33418 > 127.0.0.1.11150: Flags [P.], cksum 0xfe2b (incorrect -> 0x2da2), seq 1:4, ack 1, win 512, options [nop,nop,TS val 323172541 ecr 323172541], length 3
2022-04-06 10:28:10.038979 IP (tos 0x0, ttl 64, id 7341, offset 0, flags [DF], proto TCP (6), length 52)
    127.0.0.1.11150 > 127.0.0.1.33418: Flags [.], cksum 0xfe28 (incorrect -> 0x32ab), seq 1, ack 4, win 512, options [nop,nop,TS val 323172541 ecr 323172541], length 0
2022-04-06 10:28:10.039001 IP (tos 0x0, ttl 64, id 7342, offset 0, flags [DF], proto TCP (6), length 54)
    127.0.0.1.11150 > 127.0.0.1.33418: Flags [P.], cksum 0xfe2a (incorrect -> 0x2da1), seq 1:3, ack 4, win 512, options [nop,nop,TS val 323172541 ecr 323172541], length 2
2022-04-06 10:28:10.039009 IP (tos 0x0, ttl 64, id 30443, offset 0, flags [DF], proto TCP (6), length 52)
    127.0.0.1.33418 > 127.0.0.1.11150: Flags [.], cksum 0xfe28 (incorrect -> 0x32a9), seq 4, ack 3, win 512, options [nop,nop,TS val 323172541 ecr 323172541], length 0
2022-04-06 10:28:10.039638 IP (tos 0x0, ttl 64, id 30444, offset 0, flags [DF], proto TCP (6), length 62)
    127.0.0.1.33418 > 127.0.0.1.11150: Flags [P.], cksum 0xfe32 (incorrect -> 0x9911), seq 4:14, ack 3, win 512, options [nop,nop,TS val 323172542 ecr 323172541], length 10
2022-04-06 10:28:10.039647 IP (tos 0x0, ttl 64, id 7343, offset 0, flags [DF], proto TCP (6), length 52)
    127.0.0.1.11150 > 127.0.0.1.33418: Flags [.], cksum 0xfe28 (incorrect -> 0x329d), seq 3, ack 14, win 512, options [nop,nop,TS val 323172542 ecr 323172542], length 0
2022-04-06 10:28:10.126627 IP (tos 0x0, ttl 64, id 7344, offset 0, flags [DF], proto TCP (6), length 62)
    127.0.0.1.11150 > 127.0.0.1.33418: Flags [P.], cksum 0xfe32 (incorrect -> 0x2d33), seq 3:13, ack 14, win 512, options [nop,nop,TS val 323172629 ecr 323172542], length 10
2022-04-06 10:28:10.126637 IP (tos 0x0, ttl 64, id 30445, offset 0, flags [DF], proto TCP (6), length 52)
    127.0.0.1.33418 > 127.0.0.1.11150: Flags [.], cksum 0xfe28 (incorrect -> 0x31e5), seq 14, ack 13, win 512, options [nop,nop,TS val 323172629 ecr 323172629], length 0
2022-04-06 10:28:10.132372 IP (tos 0x0, ttl 64, id 30446, offset 0, flags [DF], proto TCP (6), length 569)
    127.0.0.1.33418 > 127.0.0.1.11150: Flags [P.], cksum 0x002e (incorrect -> 0x2930), seq 14:531, ack 13, win 512, options [nop,nop,TS val 323172635 ecr 323172629], length 517
2022-04-06 10:28:10.132394 IP (tos 0x0, ttl 64, id 7345, offset 0, flags [DF], proto TCP (6), length 52)
    127.0.0.1.11150 > 127.0.0.1.33418: Flags [.], cksum 0xfe28 (incorrect -> 0x2fd8), seq 13, ack 531, win 508, options [nop,nop,TS val 323172635 ecr 323172635], length 0
2022-04-06 10:28:10.222550 IP (tos 0x0, ttl 64, id 7346, offset 0, flags [DF], proto TCP (6), length 3538)
    127.0.0.1.11150 > 127.0.0.1.33418: Flags [P.], cksum 0x0bc7 (incorrect -> 0x1c21), seq 13:3499, ack 531, win 512, options [nop,nop,TS val 323172725 ecr 323172635], length 3486
2022-04-06 10:28:10.222562 IP (tos 0x0, ttl 64, id 30447, offset 0, flags [DF], proto TCP (6), length 52)
    127.0.0.1.33418 > 127.0.0.1.11150: Flags [.], cksum 0xfe28 (incorrect -> 0x2194), seq 531, ack 3499, win 494, options [nop,nop,TS val 323172725 ecr 323172725], length 0
2022-04-06 10:28:10.238172 IP (tos 0x0, ttl 64, id 7347, offset 0, flags [DF], proto TCP (6), length 1048)
    127.0.0.1.11150 > 127.0.0.1.33418: Flags [P.], cksum 0x020d (incorrect -> 0xd866), seq 3499:4495, ack 531, win 512, options [nop,nop,TS val 323172741 ecr 323172725], length 996
2022-04-06 10:28:10.238187 IP (tos 0x0, ttl 64, id 30448, offset 0, flags [DF], proto TCP (6), length 52)
    127.0.0.1.33418 > 127.0.0.1.11150: Flags [.], cksum 0xfe28 (incorrect -> 0x1d86), seq 531, ack 4495, win 504, options [nop,nop,TS val 323172741 ecr 323172741], length 0
2022-04-06 10:28:10.297978 IP (tos 0x0, ttl 64, id 7348, offset 0, flags [DF], proto TCP (6), length 997)
    127.0.0.1.11150 > 127.0.0.1.33418: Flags [P.], cksum 0x01da (incorrect -> 0xb271), seq 4495:5440, ack 531, win 512, options [nop,nop,TS val 323172800 ecr 323172741], length 945
2022-04-06 10:28:10.297986 IP (tos 0x0, ttl 64, id 30449, offset 0, flags [DF], proto TCP (6), length 52)
    127.0.0.1.33418 > 127.0.0.1.11150: Flags [.], cksum 0xfe28 (incorrect -> 0x195f), seq 531, ack 5440, win 504, options [nop,nop,TS val 323172800 ecr 323172800], length 0
2022-04-06 10:28:10.298510 IP (tos 0x0, ttl 64, id 30450, offset 0, flags [DF], proto TCP (6), length 132)
    127.0.0.1.33418 > 127.0.0.1.11150: Flags [P.], cksum 0xfe78 (incorrect -> 0x063a), seq 531:611, ack 5440, win 512, options [nop,nop,TS val 323172801 ecr 323172800], length 80
2022-04-06 10:28:10.298520 IP (tos 0x0, ttl 64, id 7349, offset 0, flags [DF], proto TCP (6), length 52)
    127.0.0.1.11150 > 127.0.0.1.33418: Flags [.], cksum 0xfe28 (incorrect -> 0x1905), seq 5440, ack 611, win 512, options [nop,nop,TS val 323172801 ecr 323172801], length 0
2022-04-06 10:28:10.298874 IP (tos 0x0, ttl 64, id 30451, offset 0, flags [DF], proto TCP (6), length 328)
    127.0.0.1.33418 > 127.0.0.1.11150: Flags [P.], cksum 0xff3c (incorrect -> 0x076e), seq 611:887, ack 5440, win 512, options [nop,nop,TS val 323172801 ecr 323172801], length 276
2022-04-06 10:28:10.298883 IP (tos 0x0, ttl 64, id 7350, offset 0, flags [DF], proto TCP (6), length 52)
    127.0.0.1.11150 > 127.0.0.1.33418: Flags [.], cksum 0xfe28 (incorrect -> 0x17f3), seq 5440, ack 887, win 510, options [nop,nop,TS val 323172801 ecr 323172801], length 0
2022-04-06 10:28:10.553578 IP (tos 0x0, ttl 64, id 7351, offset 0, flags [DF], proto TCP (6), length 903)
    127.0.0.1.11150 > 127.0.0.1.33418: Flags [P.], cksum 0x017c (incorrect -> 0xb944), seq 5440:6291, ack 887, win 512, options [nop,nop,TS val 323173056 ecr 323172801], length 851
2022-04-06 10:28:10.553598 IP (tos 0x0, ttl 64, id 30452, offset 0, flags [DF], proto TCP (6), length 52)
    127.0.0.1.33418 > 127.0.0.1.11150: Flags [.], cksum 0xfe28 (incorrect -> 0x12a6), seq 887, ack 6291, win 506, options [nop,nop,TS val 323173056 ecr 323173056], length 0
2022-04-06 10:28:10.556111 IP (tos 0x0, ttl 64, id 30453, offset 0, flags [DF], proto TCP (6), length 427)
    127.0.0.1.33418 > 127.0.0.1.11150: Flags [P.], cksum 0xff9f (incorrect -> 0x6005), seq 887:1262, ack 6291, win 512, options [nop,nop,TS val 323173059 ecr 323173056], length 375
2022-04-06 10:28:10.556123 IP (tos 0x0, ttl 64, id 7352, offset 0, flags [DF], proto TCP (6), length 52)
    127.0.0.1.11150 > 127.0.0.1.33418: Flags [.], cksum 0xfe28 (incorrect -> 0x1125), seq 6291, ack 1262, win 510, options [nop,nop,TS val 323173059 ecr 323173059], length 0
2022-04-06 10:28:10.669949 IP (tos 0x0, ttl 64, id 7353, offset 0, flags [DF], proto TCP (6), length 775)
    127.0.0.1.11150 > 127.0.0.1.33418: Flags [P.], cksum 0x00fc (incorrect -> 0x6243), seq 6291:7014, ack 1262, win 512, options [nop,nop,TS val 323173172 ecr 323173059], length 723
2022-04-06 10:28:10.672158 IP (tos 0x0, ttl 64, id 30454, offset 0, flags [DF], proto TCP (6), length 426)
    127.0.0.1.33418 > 127.0.0.1.11150: Flags [P.], cksum 0xff9e (incorrect -> 0x0e5e), seq 1262:1636, ack 7014, win 512, options [nop,nop,TS val 323173175 ecr 323173172], length 374
2022-04-06 10:28:10.672170 IP (tos 0x0, ttl 64, id 7354, offset 0, flags [DF], proto TCP (6), length 52)
    127.0.0.1.11150 > 127.0.0.1.33418: Flags [.], cksum 0xfe28 (incorrect -> 0x0bf4), seq 7014, ack 1636, win 510, options [nop,nop,TS val 323173175 ecr 323173175], length 0
200, 3.9136037826538086, 1.454007863998413