2022-04-06 12:23:26.544561 IP (tos 0x0, ttl 64, id 39089, offset 0, flags [DF], proto TCP (6), length 60)
    127.0.0.1.54384 > 127.0.0.1.11750: Flags [S], cksum 0xfe30 (incorrect -> 0xe766), seq 1582510573, win 65495, options [mss 65495,sackOK,TS val 330089047 ecr 0,nop,wscale 7], length 0
2022-04-06 12:23:26.544569 IP (tos 0x0, ttl 64, id 0, offset 0, flags [DF], proto TCP (6), length 60)
    127.0.0.1.11750 > 127.0.0.1.54384: Flags [S.], cksum 0xfe30 (incorrect -> 0xb3be), seq 3743841912, ack 1582510574, win 65483, options [mss 65495,sackOK,TS val 330089047 ecr 330089047,nop,wscale 7], length 0
2022-04-06 12:23:26.544576 IP (tos 0x0, ttl 64, id 39090, offset 0, flags [DF], proto TCP (6), length 52)
    127.0.0.1.54384 > 127.0.0.1.11750: Flags [.], cksum 0xfe28 (incorrect -> 0xda7a), seq 1, ack 1, win 512, options [nop,nop,TS val 330089047 ecr 330089047], length 0
2022-04-06 12:23:26.544659 IP (tos 0x0, ttl 64, id 39091, offset 0, flags [DF], proto TCP (6), length 55)
    127.0.0.1.54384 > 127.0.0.1.11750: Flags [P.], cksum 0xfe2b (incorrect -> 0xd56e), seq 1:4, ack 1, win 512, options [nop,nop,TS val 330089047 ecr 330089047], length 3
2022-04-06 12:23:26.544662 IP (tos 0x0, ttl 64, id 23286, offset 0, flags [DF], proto TCP (6), length 52)
    127.0.0.1.11750 > 127.0.0.1.54384: Flags [.], cksum 0xfe28 (incorrect -> 0xda77), seq 1, ack 4, win 512, options [nop,nop,TS val 330089047 ecr 330089047], length 0
2022-04-06 12:23:26.544776 IP (tos 0x0, ttl 64, id 23287, offset 0, flags [DF], proto TCP (6), length 54)
    127.0.0.1.11750 > 127.0.0.1.54384: Flags [P.], cksum 0xfe2a (incorrect -> 0xd56d), seq 1:3, ack 4, win 512, options [nop,nop,TS val 330089047 ecr 330089047], length 2
2022-04-06 12:23:26.544802 IP (tos 0x0, ttl 64, id 39092, offset 0, flags [DF], proto TCP (6), length 52)
    127.0.0.1.54384 > 127.0.0.1.11750: Flags [.], cksum 0xfe28 (incorrect -> 0xda75), seq 4, ack 3, win 512, options [nop,nop,TS val 330089047 ecr 330089047], length 0
2022-04-06 12:23:26.566481 IP (tos 0x0, ttl 64, id 39093, offset 0, flags [DF], proto TCP (6), length 62)
    127.0.0.1.54384 > 127.0.0.1.11750: Flags [P.], cksum 0xfe32 (incorrect -> 0xc265), seq 4:14, ack 3, win 512, options [nop,nop,TS val 330089069 ecr 330089047], length 10
2022-04-06 12:23:26.566510 IP (tos 0x0, ttl 64, id 23288, offset 0, flags [DF], proto TCP (6), length 52)
    127.0.0.1.11750 > 127.0.0.1.54384: Flags [.], cksum 0xfe28 (incorrect -> 0xda3f), seq 3, ack 14, win 512, options [nop,nop,TS val 330089069 ecr 330089069], length 0
2022-04-06 12:23:26.832182 IP (tos 0x0, ttl 64, id 23289, offset 0, flags [DF], proto TCP (6), length 62)
    127.0.0.1.11750 > 127.0.0.1.54384: Flags [P.], cksum 0xfe32 (incorrect -> 0xd422), seq 3:13, ack 14, win 512, options [nop,nop,TS val 330089335 ecr 330089069], length 10
2022-04-06 12:23:26.832188 IP (tos 0x0, ttl 64, id 39094, offset 0, flags [DF], proto TCP (6), length 52)
    127.0.0.1.54384 > 127.0.0.1.11750: Flags [.], cksum 0xfe28 (incorrect -> 0xd821), seq 14, ack 13, win 512, options [nop,nop,TS val 330089335 ecr 330089335], length 0
2022-04-06 12:23:26.837559 IP (tos 0x0, ttl 64, id 39095, offset 0, flags [DF], proto TCP (6), length 569)
    127.0.0.1.54384 > 127.0.0.1.11750: Flags [P.], cksum 0x002e (incorrect -> 0xce20), seq 14:531, ack 13, win 512, options [nop,nop,TS val 330089340 ecr 330089335], length 517
2022-04-06 12:23:26.837578 IP (tos 0x0, ttl 64, id 23290, offset 0, flags [DF], proto TCP (6), length 52)
    127.0.0.1.11750 > 127.0.0.1.54384: Flags [.], cksum 0xfe28 (incorrect -> 0xd616), seq 13, ack 531, win 508, options [nop,nop,TS val 330089340 ecr 330089340], length 0
2022-04-06 12:23:27.090847 IP (tos 0x0, ttl 64, id 23291, offset 0, flags [DF], proto TCP (6), length 3538)
    127.0.0.1.11750 > 127.0.0.1.54384: Flags [P.], cksum 0x0bc7 (incorrect -> 0x31b4), seq 13:3499, ack 531, win 512, options [nop,nop,TS val 330089593 ecr 330089340], length 3486
2022-04-06 12:23:27.090854 IP (tos 0x0, ttl 64, id 39096, offset 0, flags [DF], proto TCP (6), length 52)
    127.0.0.1.54384 > 127.0.0.1.11750: Flags [.], cksum 0xfe28 (incorrect -> 0xc68c), seq 531, ack 3499, win 494, options [nop,nop,TS val 330089593 ecr 330089593], length 0
2022-04-06 12:23:27.190615 IP (tos 0x0, ttl 64, id 23292, offset 0, flags [DF], proto TCP (6), length 1266)
    127.0.0.1.11750 > 127.0.0.1.54384: Flags [P.], cksum 0x02e7 (incorrect -> 0x55e9), seq 3499:4713, ack 531, win 512, options [nop,nop,TS val 330089693 ecr 330089593], length 1214
2022-04-06 12:23:27.190619 IP (tos 0x0, ttl 64, id 39097, offset 0, flags [DF], proto TCP (6), length 52)
    127.0.0.1.54384 > 127.0.0.1.11750: Flags [.], cksum 0xfe28 (incorrect -> 0xc0fd), seq 531, ack 4713, win 503, options [nop,nop,TS val 330089693 ecr 330089693], length 0
2022-04-06 12:23:27.191011 IP (tos 0x0, ttl 64, id 39098, offset 0, flags [DF], proto TCP (6), length 132)
    127.0.0.1.54384 > 127.0.0.1.11750: Flags [P.], cksum 0xfe78 (incorrect -> 0x2f80), seq 531:611, ack 4713, win 512, options [nop,nop,TS val 330089693 ecr 330089693], length 80
2022-04-06 12:23:27.191016 IP (tos 0x0, ttl 64, id 23293, offset 0, flags [DF], proto TCP (6), length 52)
    127.0.0.1.11750 > 127.0.0.1.54384: Flags [.], cksum 0xfe28 (incorrect -> 0xc0a4), seq 4713, ack 611, win 512, options [nop,nop,TS val 330089693 ecr 330089693], length 0
2022-04-06 12:23:27.191370 IP (tos 0x0, ttl 64, id 39099, offset 0, flags [DF], proto TCP (6), length 311)
    127.0.0.1.54384 > 127.0.0.1.11750: Flags [P.], cksum 0xff2b (incorrect -> 0x1fd0), seq 611:870, ack 4713, win 512, options [nop,nop,TS val 330089694 ecr 330089693], length 259
2022-04-06 12:23:27.191374 IP (tos 0x0, ttl 64, id 23294, offset 0, flags [DF], proto TCP (6), length 52)
    127.0.0.1.11750 > 127.0.0.1.54384: Flags [.], cksum 0xfe28 (incorrect -> 0xbfa1), seq 4713, ack 870, win 510, options [nop,nop,TS val 330089694 ecr 330089694], length 0
2022-04-06 12:23:27.443528 IP (tos 0x0, ttl 64, id 23295, offset 0, flags [DF], proto TCP (6), length 323)
    127.0.0.1.11750 > 127.0.0.1.54384: Flags [P.], cksum 0xff37 (incorrect -> 0x6ae9), seq 4713:4984, ack 870, win 512, options [nop,nop,TS val 330089946 ecr 330089694], length 271
2022-04-06 12:23:27.443534 IP (tos 0x0, ttl 64, id 39100, offset 0, flags [DF], proto TCP (6), length 52)
    127.0.0.1.54384 > 127.0.0.1.11750: Flags [.], cksum 0xfe28 (incorrect -> 0xbc9a), seq 870, ack 4984, win 510, options [nop,nop,TS val 330089946 ecr 330089946], length 0
2022-04-06 12:23:27.549950 IP (tos 0x0, ttl 64, id 23296, offset 0, flags [DF], proto TCP (6), length 323)
    127.0.0.1.11750 > 127.0.0.1.54384: Flags [P.], cksum 0xff37 (incorrect -> 0xd339), seq 4984:5255, ack 870, win 512, options [nop,nop,TS val 330090052 ecr 330089946], length 271
2022-04-06 12:23:27.549958 IP (tos 0x0, ttl 64, id 39101, offset 0, flags [DF], proto TCP (6), length 52)
    127.0.0.1.54384 > 127.0.0.1.11750: Flags [.], cksum 0xfe28 (incorrect -> 0xbab9), seq 870, ack 5255, win 508, options [nop,nop,TS val 330090052 ecr 330090052], length 0
2022-04-06 12:23:27.581693 IP (tos 0x0, ttl 64, id 23297, offset 0, flags [DF], proto TCP (6), length 2948)
    127.0.0.1.11750 > 127.0.0.1.54384: Flags [P.], cksum 0x0979 (incorrect -> 0x5b0b), seq 5255:8151, ack 870, win 512, options [nop,nop,TS val 330090084 ecr 330090052], length 2896
2022-04-06 12:23:27.581698 IP (tos 0x0, ttl 64, id 39102, offset 0, flags [DF], proto TCP (6), length 52)
    127.0.0.1.54384 > 127.0.0.1.11750: Flags [.], cksum 0xfe28 (incorrect -> 0xaf35), seq 870, ack 8151, win 496, options [nop,nop,TS val 330090084 ecr 330090084], length 0
200, 125.31117796897888, 2.0874528884887695