2022-04-06 08:21:16.579812 IP (tos 0x0, ttl 64, id 17970, offset 0, flags [DF], proto TCP (6), length 60)
    127.0.0.1.41482 > 127.0.0.1.11650: Flags [S], cksum 0xfe30 (incorrect -> 0x8eab), seq 377600975, win 65495, options [mss 65495,sackOK,TS val 315559082 ecr 0,nop,wscale 7], length 0
2022-04-06 08:21:16.579837 IP (tos 0x0, ttl 64, id 0, offset 0, flags [DF], proto TCP (6), length 60)
    127.0.0.1.11650 > 127.0.0.1.41482: Flags [S.], cksum 0xfe30 (incorrect -> 0x6d76), seq 2759417149, ack 377600976, win 65483, options [mss 65495,sackOK,TS val 315559082 ecr 315559082,nop,wscale 7], length 0
2022-04-06 08:21:16.579848 IP (tos 0x0, ttl 64, id 17971, offset 0, flags [DF], proto TCP (6), length 52)
    127.0.0.1.41482 > 127.0.0.1.11650: Flags [.], cksum 0xfe28 (incorrect -> 0x9432), seq 1, ack 1, win 512, options [nop,nop,TS val 315559082 ecr 315559082], length 0
2022-04-06 08:21:16.580021 IP (tos 0x0, ttl 64, id 17972, offset 0, flags [DF], proto TCP (6), length 55)
    127.0.0.1.41482 > 127.0.0.1.11650: Flags [P.], cksum 0xfe2b (incorrect -> 0x8f26), seq 1:4, ack 1, win 512, options [nop,nop,TS val 315559082 ecr 315559082], length 3
2022-04-06 08:21:16.580029 IP (tos 0x0, ttl 64, id 7138, offset 0, flags [DF], proto TCP (6), length 52)
    127.0.0.1.11650 > 127.0.0.1.41482: Flags [.], cksum 0xfe28 (incorrect -> 0x942f), seq 1, ack 4, win 512, options [nop,nop,TS val 315559082 ecr 315559082], length 0
2022-04-06 08:21:16.580055 IP (tos 0x0, ttl 64, id 7139, offset 0, flags [DF], proto TCP (6), length 54)
    127.0.0.1.11650 > 127.0.0.1.41482: Flags [P.], cksum 0xfe2a (incorrect -> 0x8f25), seq 1:3, ack 4, win 512, options [nop,nop,TS val 315559082 ecr 315559082], length 2
2022-04-06 08:21:16.580064 IP (tos 0x0, ttl 64, id 17973, offset 0, flags [DF], proto TCP (6), length 52)
    127.0.0.1.41482 > 127.0.0.1.11650: Flags [.], cksum 0xfe28 (incorrect -> 0x942c), seq 4, ack 3, win 512, options [nop,nop,TS val 315559083 ecr 315559082], length 0
2022-04-06 08:21:16.581297 IP (tos 0x0, ttl 64, id 17974, offset 0, flags [DF], proto TCP (6), length 62)
    127.0.0.1.41482 > 127.0.0.1.11650: Flags [P.], cksum 0xfe32 (incorrect -> 0x54e3), seq 4:14, ack 3, win 512, options [nop,nop,TS val 315559084 ecr 315559082], length 10
2022-04-06 08:21:16.581319 IP (tos 0x0, ttl 64, id 7140, offset 0, flags [DF], proto TCP (6), length 52)
    127.0.0.1.11650 > 127.0.0.1.41482: Flags [.], cksum 0xfe28 (incorrect -> 0x941f), seq 3, ack 14, win 512, options [nop,nop,TS val 315559084 ecr 315559084], length 0
2022-04-06 08:21:16.661161 IP (tos 0x0, ttl 64, id 7141, offset 0, flags [DF], proto TCP (6), length 62)
    127.0.0.1.11650 > 127.0.0.1.41482: Flags [P.], cksum 0xfe32 (incorrect -> 0x8ebc), seq 3:13, ack 14, win 512, options [nop,nop,TS val 315559164 ecr 315559084], length 10
2022-04-06 08:21:16.661172 IP (tos 0x0, ttl 64, id 17975, offset 0, flags [DF], proto TCP (6), length 52)
    127.0.0.1.41482 > 127.0.0.1.11650: Flags [.], cksum 0xfe28 (incorrect -> 0x9375), seq 14, ack 13, win 512, options [nop,nop,TS val 315559164 ecr 315559164], length 0
2022-04-06 08:21:16.667463 IP (tos 0x0, ttl 64, id 17976, offset 0, flags [DF], proto TCP (6), length 569)
    127.0.0.1.41482 > 127.0.0.1.11650: Flags [P.], cksum 0x002e (incorrect -> 0x51b5), seq 14:531, ack 13, win 512, options [nop,nop,TS val 315559170 ecr 315559164], length 517
2022-04-06 08:21:16.667473 IP (tos 0x0, ttl 64, id 7142, offset 0, flags [DF], proto TCP (6), length 52)
    127.0.0.1.11650 > 127.0.0.1.41482: Flags [.], cksum 0xfe28 (incorrect -> 0x9168), seq 13, ack 531, win 508, options [nop,nop,TS val 315559170 ecr 315559170], length 0
2022-04-06 08:21:16.755691 IP (tos 0x0, ttl 64, id 7143, offset 0, flags [DF], proto TCP (6), length 3538)
    127.0.0.1.11650 > 127.0.0.1.41482: Flags [P.], cksum 0x0bc7 (incorrect -> 0x6edd), seq 13:3499, ack 531, win 512, options [nop,nop,TS val 315559258 ecr 315559170], length 3486
2022-04-06 08:21:16.755700 IP (tos 0x0, ttl 64, id 17977, offset 0, flags [DF], proto TCP (6), length 52)
    127.0.0.1.41482 > 127.0.0.1.11650: Flags [.], cksum 0xfe28 (incorrect -> 0x8328), seq 531, ack 3499, win 494, options [nop,nop,TS val 315559258 ecr 315559258], length 0
200, 4.871125936508179, 0.8609566688537598