2022-04-06 05:01:17.603207 IP (tos 0x0, ttl 64, id 119, offset 0, flags [DF], proto TCP (6), length 60)
    127.0.0.1.38930 > 127.0.0.1.11950: Flags [S], cksum 0xfe30 (incorrect -> 0x3228), seq 3963511576, win 65495, options [mss 65495,sackOK,TS val 303560106 ecr 0,nop,wscale 7], length 0
2022-04-06 05:01:17.603223 IP (tos 0x0, ttl 64, id 0, offset 0, flags [DF], proto TCP (6), length 60)
    127.0.0.1.11950 > 127.0.0.1.38930: Flags [S.], cksum 0xfe30 (incorrect -> 0xc906), seq 586301032, ack 3963511577, win 65483, options [mss 65495,sackOK,TS val 303560106 ecr 303560106,nop,wscale 7], length 0
2022-04-06 05:01:17.603235 IP (tos 0x0, ttl 64, id 120, offset 0, flags [DF], proto TCP (6), length 52)
    127.0.0.1.38930 > 127.0.0.1.11950: Flags [.], cksum 0xfe28 (incorrect -> 0xefc2), seq 1, ack 1, win 512, options [nop,nop,TS val 303560106 ecr 303560106], length 0
2022-04-06 05:01:17.603320 IP (tos 0x0, ttl 64, id 121, offset 0, flags [DF], proto TCP (6), length 55)
    127.0.0.1.38930 > 127.0.0.1.11950: Flags [P.], cksum 0xfe2b (incorrect -> 0xeab6), seq 1:4, ack 1, win 512, options [nop,nop,TS val 303560106 ecr 303560106], length 3
2022-04-06 05:01:17.603326 IP (tos 0x0, ttl 64, id 5953, offset 0, flags [DF], proto TCP (6), length 52)
    127.0.0.1.11950 > 127.0.0.1.38930: Flags [.], cksum 0xfe28 (incorrect -> 0xefbf), seq 1, ack 4, win 512, options [nop,nop,TS val 303560106 ecr 303560106], length 0
2022-04-06 05:01:17.603401 IP (tos 0x0, ttl 64, id 5954, offset 0, flags [DF], proto TCP (6), length 54)
    127.0.0.1.11950 > 127.0.0.1.38930: Flags [P.], cksum 0xfe2a (incorrect -> 0xeab5), seq 1:3, ack 4, win 512, options [nop,nop,TS val 303560106 ecr 303560106], length 2
2022-04-06 05:01:17.603408 IP (tos 0x0, ttl 64, id 122, offset 0, flags [DF], proto TCP (6), length 52)
    127.0.0.1.38930 > 127.0.0.1.11950: Flags [.], cksum 0xfe28 (incorrect -> 0xefbd), seq 4, ack 3, win 512, options [nop,nop,TS val 303560106 ecr 303560106], length 0
2022-04-06 05:01:17.605731 IP (tos 0x0, ttl 64, id 123, offset 0, flags [DF], proto TCP (6), length 62)
    127.0.0.1.38930 > 127.0.0.1.11950: Flags [P.], cksum 0xfe32 (incorrect -> 0xe607), seq 4:14, ack 3, win 512, options [nop,nop,TS val 303560108 ecr 303560106], length 10
2022-04-06 05:01:17.605753 IP (tos 0x0, ttl 64, id 5955, offset 0, flags [DF], proto TCP (6), length 52)
    127.0.0.1.11950 > 127.0.0.1.38930: Flags [.], cksum 0xfe28 (incorrect -> 0xefaf), seq 3, ack 14, win 512, options [nop,nop,TS val 303560108 ecr 303560108], length 0
2022-04-06 05:01:17.663650 IP (tos 0x0, ttl 64, id 5956, offset 0, flags [DF], proto TCP (6), length 62)
    127.0.0.1.11950 > 127.0.0.1.38930: Flags [P.], cksum 0xfe32 (incorrect -> 0xea62), seq 3:13, ack 14, win 512, options [nop,nop,TS val 303560166 ecr 303560108], length 10
2022-04-06 05:01:17.663662 IP (tos 0x0, ttl 64, id 124, offset 0, flags [DF], proto TCP (6), length 52)
    127.0.0.1.38930 > 127.0.0.1.11950: Flags [.], cksum 0xfe28 (incorrect -> 0xef31), seq 14, ack 13, win 512, options [nop,nop,TS val 303560166 ecr 303560166], length 0
2022-04-06 05:01:17.669173 IP (tos 0x0, ttl 64, id 125, offset 0, flags [DF], proto TCP (6), length 569)
    127.0.0.1.38930 > 127.0.0.1.11950: Flags [P.], cksum 0x002e (incorrect -> 0x8d5f), seq 14:531, ack 13, win 512, options [nop,nop,TS val 303560172 ecr 303560166], length 517
2022-04-06 05:01:17.669183 IP (tos 0x0, ttl 64, id 5957, offset 0, flags [DF], proto TCP (6), length 52)
    127.0.0.1.11950 > 127.0.0.1.38930: Flags [.], cksum 0xfe28 (incorrect -> 0xed24), seq 13, ack 531, win 508, options [nop,nop,TS val 303560172 ecr 303560172], length 0
2022-04-06 05:01:17.727209 IP (tos 0x0, ttl 64, id 5958, offset 0, flags [DF], proto TCP (6), length 3538)
    127.0.0.1.11950 > 127.0.0.1.38930: Flags [P.], cksum 0x0bc7 (incorrect -> 0x5881), seq 13:3499, ack 531, win 512, options [nop,nop,TS val 303560230 ecr 303560172], length 3486
2022-04-06 05:01:17.727219 IP (tos 0x0, ttl 64, id 126, offset 0, flags [DF], proto TCP (6), length 52)
    127.0.0.1.38930 > 127.0.0.1.11950: Flags [.], cksum 0xfe28 (incorrect -> 0xdf20), seq 531, ack 3499, win 494, options [nop,nop,TS val 303560230 ecr 303560230], length 0
2022-04-06 05:01:17.781310 IP (tos 0x0, ttl 64, id 5959, offset 0, flags [DF], proto TCP (6), length 958)
    127.0.0.1.11950 > 127.0.0.1.38930: Flags [P.], cksum 0x01b3 (incorrect -> 0x0a71), seq 3499:4405, ack 531, win 512, options [nop,nop,TS val 303560284 ecr 303560230], length 906
2022-04-06 05:01:17.781319 IP (tos 0x0, ttl 64, id 127, offset 0, flags [DF], proto TCP (6), length 52)
    127.0.0.1.38930 > 127.0.0.1.11950: Flags [.], cksum 0xfe28 (incorrect -> 0xdb20), seq 531, ack 4405, win 504, options [nop,nop,TS val 303560284 ecr 303560284], length 0
2022-04-06 05:01:17.781878 IP (tos 0x0, ttl 64, id 128, offset 0, flags [DF], proto TCP (6), length 132)
    127.0.0.1.38930 > 127.0.0.1.11950: Flags [P.], cksum 0xfe78 (incorrect -> 0x584b), seq 531:611, ack 4405, win 512, options [nop,nop,TS val 303560284 ecr 303560284], length 80
2022-04-06 05:01:17.781895 IP (tos 0x0, ttl 64, id 5960, offset 0, flags [DF], proto TCP (6), length 52)
    127.0.0.1.11950 > 127.0.0.1.38930: Flags [.], cksum 0xfe28 (incorrect -> 0xdac8), seq 4405, ack 611, win 512, options [nop,nop,TS val 303560284 ecr 303560284], length 0
2022-04-06 05:01:17.782487 IP (tos 0x0, ttl 64, id 129, offset 0, flags [DF], proto TCP (6), length 390)
    127.0.0.1.38930 > 127.0.0.1.11950: Flags [P.], cksum 0xff7a (incorrect -> 0x93ff), seq 611:949, ack 4405, win 512, options [nop,nop,TS val 303560285 ecr 303560284], length 338
2022-04-06 05:01:17.782504 IP (tos 0x0, ttl 64, id 5961, offset 0, flags [DF], proto TCP (6), length 52)
    127.0.0.1.11950 > 127.0.0.1.38930: Flags [.], cksum 0xfe28 (incorrect -> 0xd976), seq 4405, ack 949, win 510, options [nop,nop,TS val 303560285 ecr 303560285], length 0
2022-04-06 05:01:17.849930 IP (tos 0x0, ttl 64, id 5962, offset 0, flags [DF], proto TCP (6), length 323)
    127.0.0.1.11950 > 127.0.0.1.38930: Flags [P.], cksum 0xff37 (incorrect -> 0x4676), seq 4405:4676, ack 949, win 512, options [nop,nop,TS val 303560352 ecr 303560285], length 271
2022-04-06 05:01:17.849947 IP (tos 0x0, ttl 64, id 130, offset 0, flags [DF], proto TCP (6), length 52)
    127.0.0.1.38930 > 127.0.0.1.11950: Flags [.], cksum 0xfe28 (incorrect -> 0xd7e1), seq 949, ack 4676, win 510, options [nop,nop,TS val 303560352 ecr 303560352], length 0
2022-04-06 05:01:17.865297 IP (tos 0x0, ttl 64, id 5963, offset 0, flags [DF], proto TCP (6), length 323)
    127.0.0.1.11950 > 127.0.0.1.38930: Flags [P.], cksum 0xff37 (incorrect -> 0x20a1), seq 4676:4947, ack 949, win 512, options [nop,nop,TS val 303560368 ecr 303560352], length 271
2022-04-06 05:01:17.865305 IP (tos 0x0, ttl 64, id 131, offset 0, flags [DF], proto TCP (6), length 52)
    127.0.0.1.38930 > 127.0.0.1.11950: Flags [.], cksum 0xfe28 (incorrect -> 0xd6b4), seq 949, ack 4947, win 508, options [nop,nop,TS val 303560368 ecr 303560368], length 0
2022-04-06 05:01:18.441927 IP (tos 0x0, ttl 64, id 5964, offset 0, flags [DF], proto TCP (6), length 3074)
    127.0.0.1.11950 > 127.0.0.1.38930: Flags [P.], cksum 0x09f7 (incorrect -> 0x2361), seq 4947:7969, ack 949, win 512, options [nop,nop,TS val 303560944 ecr 303560368], length 3022
2022-04-06 05:01:18.441947 IP (tos 0x0, ttl 64, id 132, offset 0, flags [DF], proto TCP (6), length 52)
    127.0.0.1.38930 > 127.0.0.1.11950: Flags [.], cksum 0xfe28 (incorrect -> 0xc672), seq 949, ack 7969, win 496, options [nop,nop,TS val 303560944 ecr 303560944], length 0
2022-04-06 05:01:18.445224 IP (tos 0x0, ttl 64, id 133, offset 0, flags [DF], proto TCP (6), length 841)
    127.0.0.1.38930 > 127.0.0.1.11950: Flags [P.], cksum 0x013e (incorrect -> 0x0ebe), seq 949:1738, ack 7969, win 512, options [nop,nop,TS val 303560948 ecr 303560944], length 789
2022-04-06 05:01:18.445235 IP (tos 0x0, ttl 64, id 5965, offset 0, flags [DF], proto TCP (6), length 52)
    127.0.0.1.11950 > 127.0.0.1.38930: Flags [.], cksum 0xfe28 (incorrect -> 0xc34b), seq 7969, ack 1738, win 506, options [nop,nop,TS val 303560948 ecr 303560948], length 0
200, 3.5850157737731934, 1.5659151077270508