2022-04-06 14:31:21.900027 IP (tos 0x0, ttl 64, id 55334, offset 0, flags [DF], proto TCP (6), length 60)
    127.0.0.1.38088 > 127.0.0.1.9450: Flags [S], cksum 0xfe30 (incorrect -> 0x9714), seq 2374335841, win 65495, options [mss 65495,sackOK,TS val 337764402 ecr 0,nop,wscale 7], length 0
2022-04-06 14:31:21.900056 IP (tos 0x0, ttl 64, id 0, offset 0, flags [DF], proto TCP (6), length 60)
    127.0.0.1.9450 > 127.0.0.1.38088: Flags [S.], cksum 0xfe30 (incorrect -> 0x3ac1), seq 2435962568, ack 2374335842, win 65483, options [mss 65495,sackOK,TS val 337764402 ecr 337764402,nop,wscale 7], length 0
2022-04-06 14:31:21.900073 IP (tos 0x0, ttl 64, id 55335, offset 0, flags [DF], proto TCP (6), length 52)
    127.0.0.1.38088 > 127.0.0.1.9450: Flags [.], cksum 0xfe28 (incorrect -> 0x617c), seq 1, ack 1, win 512, options [nop,nop,TS val 337764403 ecr 337764402], length 0
2022-04-06 14:31:21.900248 IP (tos 0x0, ttl 64, id 55336, offset 0, flags [DF], proto TCP (6), length 55)
    127.0.0.1.38088 > 127.0.0.1.9450: Flags [P.], cksum 0xfe2b (incorrect -> 0x5c70), seq 1:4, ack 1, win 512, options [nop,nop,TS val 337764403 ecr 337764402], length 3
2022-04-06 14:31:21.900269 IP (tos 0x0, ttl 64, id 58403, offset 0, flags [DF], proto TCP (6), length 52)
    127.0.0.1.9450 > 127.0.0.1.38088: Flags [.], cksum 0xfe28 (incorrect -> 0x6178), seq 1, ack 4, win 512, options [nop,nop,TS val 337764403 ecr 337764403], length 0
2022-04-06 14:31:21.900308 IP (tos 0x0, ttl 64, id 58404, offset 0, flags [DF], proto TCP (6), length 54)
    127.0.0.1.9450 > 127.0.0.1.38088: Flags [P.], cksum 0xfe2a (incorrect -> 0x5c6e), seq 1:3, ack 4, win 512, options [nop,nop,TS val 337764403 ecr 337764403], length 2
2022-04-06 14:31:21.900323 IP (tos 0x0, ttl 64, id 55337, offset 0, flags [DF], proto TCP (6), length 52)
    127.0.0.1.38088 > 127.0.0.1.9450: Flags [.], cksum 0xfe28 (incorrect -> 0x6176), seq 4, ack 3, win 512, options [nop,nop,TS val 337764403 ecr 337764403], length 0
2022-04-06 14:31:21.902211 IP (tos 0x0, ttl 64, id 55338, offset 0, flags [DF], proto TCP (6), length 62)
    127.0.0.1.38088 > 127.0.0.1.9450: Flags [P.], cksum 0xfe32 (incorrect -> 0x3672), seq 4:14, ack 3, win 512, options [nop,nop,TS val 337764405 ecr 337764403], length 10
2022-04-06 14:31:21.902222 IP (tos 0x0, ttl 64, id 58405, offset 0, flags [DF], proto TCP (6), length 52)
    127.0.0.1.9450 > 127.0.0.1.38088: Flags [.], cksum 0xfe28 (incorrect -> 0x6168), seq 3, ack 14, win 512, options [nop,nop,TS val 337764405 ecr 337764405], length 0
2022-04-06 14:31:22.029943 IP (tos 0x0, ttl 64, id 58406, offset 0, flags [DF], proto TCP (6), length 62)
    127.0.0.1.9450 > 127.0.0.1.38088: Flags [P.], cksum 0xfe32 (incorrect -> 0x5bd6), seq 3:13, ack 14, win 512, options [nop,nop,TS val 337764532 ecr 337764405], length 10
2022-04-06 14:31:22.029959 IP (tos 0x0, ttl 64, id 55339, offset 0, flags [DF], proto TCP (6), length 52)
    127.0.0.1.38088 > 127.0.0.1.9450: Flags [.], cksum 0xfe28 (incorrect -> 0x6060), seq 14, ack 13, win 512, options [nop,nop,TS val 337764532 ecr 337764532], length 0
2022-04-06 14:31:22.035787 IP (tos 0x0, ttl 64, id 55340, offset 0, flags [DF], proto TCP (6), length 569)
    127.0.0.1.38088 > 127.0.0.1.9450: Flags [P.], cksum 0x002e (incorrect -> 0xd52a), seq 14:531, ack 13, win 512, options [nop,nop,TS val 337764538 ecr 337764532], length 517
2022-04-06 14:31:22.035797 IP (tos 0x0, ttl 64, id 58407, offset 0, flags [DF], proto TCP (6), length 52)
    127.0.0.1.9450 > 127.0.0.1.38088: Flags [.], cksum 0xfe28 (incorrect -> 0x5e53), seq 13, ack 531, win 508, options [nop,nop,TS val 337764538 ecr 337764538], length 0
200, 4.138154745101929, 0.7938222885131836