2022-04-06 03:13:15.366828 IP (tos 0x0, ttl 64, id 28389, offset 0, flags [DF], proto TCP (6), length 60)
    127.0.0.1.32796 > 127.0.0.1.10850: Flags [S], cksum 0xfe30 (incorrect -> 0x4126), seq 3973470564, win 65495, options [mss 65495,sackOK,TS val 297077869 ecr 0,nop,wscale 7], length 0
2022-04-06 03:13:15.366842 IP (tos 0x0, ttl 64, id 0, offset 0, flags [DF], proto TCP (6), length 60)
    127.0.0.1.10850 > 127.0.0.1.32796: Flags [S.], cksum 0xfe30 (incorrect -> 0xf074), seq 3892136588, ack 3973470565, win 65483, options [mss 65495,sackOK,TS val 297077869 ecr 297077869,nop,wscale 7], length 0
2022-04-06 03:13:15.366854 IP (tos 0x0, ttl 64, id 28390, offset 0, flags [DF], proto TCP (6), length 52)
    127.0.0.1.32796 > 127.0.0.1.10850: Flags [.], cksum 0xfe28 (incorrect -> 0x1731), seq 1, ack 1, win 512, options [nop,nop,TS val 297077869 ecr 297077869], length 0
2022-04-06 03:13:15.366954 IP (tos 0x0, ttl 64, id 28391, offset 0, flags [DF], proto TCP (6), length 55)
    127.0.0.1.32796 > 127.0.0.1.10850: Flags [P.], cksum 0xfe2b (incorrect -> 0x1225), seq 1:4, ack 1, win 512, options [nop,nop,TS val 297077869 ecr 297077869], length 3
2022-04-06 03:13:15.366958 IP (tos 0x0, ttl 64, id 3891, offset 0, flags [DF], proto TCP (6), length 52)
    127.0.0.1.10850 > 127.0.0.1.32796: Flags [.], cksum 0xfe28 (incorrect -> 0x172e), seq 1, ack 4, win 512, options [nop,nop,TS val 297077869 ecr 297077869], length 0
2022-04-06 03:13:15.367026 IP (tos 0x0, ttl 64, id 3892, offset 0, flags [DF], proto TCP (6), length 54)
    127.0.0.1.10850 > 127.0.0.1.32796: Flags [P.], cksum 0xfe2a (incorrect -> 0x1224), seq 1:3, ack 4, win 512, options [nop,nop,TS val 297077869 ecr 297077869], length 2
2022-04-06 03:13:15.367032 IP (tos 0x0, ttl 64, id 28392, offset 0, flags [DF], proto TCP (6), length 52)
    127.0.0.1.32796 > 127.0.0.1.10850: Flags [.], cksum 0xfe28 (incorrect -> 0x172c), seq 4, ack 3, win 512, options [nop,nop,TS val 297077869 ecr 297077869], length 0
2022-04-06 03:13:15.368975 IP (tos 0x0, ttl 64, id 28393, offset 0, flags [DF], proto TCP (6), length 62)
    127.0.0.1.32796 > 127.0.0.1.10850: Flags [P.], cksum 0xfe32 (incorrect -> 0xd8e1), seq 4:14, ack 3, win 512, options [nop,nop,TS val 297077871 ecr 297077869], length 10
2022-04-06 03:13:15.369006 IP (tos 0x0, ttl 64, id 3893, offset 0, flags [DF], proto TCP (6), length 52)
    127.0.0.1.10850 > 127.0.0.1.32796: Flags [.], cksum 0xfe28 (incorrect -> 0x171e), seq 3, ack 14, win 512, options [nop,nop,TS val 297077871 ecr 297077871], length 0
2022-04-06 03:13:15.464622 IP (tos 0x0, ttl 64, id 3894, offset 0, flags [DF], proto TCP (6), length 62)
    127.0.0.1.10850 > 127.0.0.1.32796: Flags [P.], cksum 0xfe32 (incorrect -> 0x11ab), seq 3:13, ack 14, win 512, options [nop,nop,TS val 297077967 ecr 297077871], length 10
2022-04-06 03:13:15.464641 IP (tos 0x0, ttl 64, id 28394, offset 0, flags [DF], proto TCP (6), length 52)
    127.0.0.1.32796 > 127.0.0.1.10850: Flags [.], cksum 0xfe28 (incorrect -> 0x1654), seq 14, ack 13, win 512, options [nop,nop,TS val 297077967 ecr 297077967], length 0
2022-04-06 03:13:15.470815 IP (tos 0x0, ttl 64, id 28395, offset 0, flags [DF], proto TCP (6), length 569)
    127.0.0.1.32796 > 127.0.0.1.10850: Flags [P.], cksum 0x002e (incorrect -> 0x693b), seq 14:531, ack 13, win 512, options [nop,nop,TS val 297077973 ecr 297077967], length 517
2022-04-06 03:13:15.470831 IP (tos 0x0, ttl 64, id 3895, offset 0, flags [DF], proto TCP (6), length 52)
    127.0.0.1.10850 > 127.0.0.1.32796: Flags [.], cksum 0xfe28 (incorrect -> 0x1447), seq 13, ack 531, win 508, options [nop,nop,TS val 297077973 ecr 297077973], length 0
200, 5.5448431968688965, 0.8079347610473633