2022-04-06 02:28:28.320880 IP (tos 0x0, ttl 64, id 36926, offset 0, flags [DF], proto TCP (6), length 60)
    127.0.0.1.49356 > 127.0.0.1.10150: Flags [S], cksum 0xfe30 (incorrect -> 0x20ab), seq 2803008030, win 65495, options [mss 65495,sackOK,TS val 294390823 ecr 0,nop,wscale 7], length 0
2022-04-06 02:28:28.320896 IP (tos 0x0, ttl 64, id 0, offset 0, flags [DF], proto TCP (6), length 60)
    127.0.0.1.10150 > 127.0.0.1.49356: Flags [S.], cksum 0xfe30 (incorrect -> 0xd6b3), seq 2076684407, ack 2803008031, win 65483, options [mss 65495,sackOK,TS val 294390823 ecr 294390823,nop,wscale 7], length 0
2022-04-06 02:28:28.320908 IP (tos 0x0, ttl 64, id 36927, offset 0, flags [DF], proto TCP (6), length 52)
    127.0.0.1.49356 > 127.0.0.1.10150: Flags [.], cksum 0xfe28 (incorrect -> 0xfd6f), seq 1, ack 1, win 512, options [nop,nop,TS val 294390823 ecr 294390823], length 0
2022-04-06 02:28:28.321074 IP (tos 0x0, ttl 64, id 36928, offset 0, flags [DF], proto TCP (6), length 55)
    127.0.0.1.49356 > 127.0.0.1.10150: Flags [P.], cksum 0xfe2b (incorrect -> 0xf862), seq 1:4, ack 1, win 512, options [nop,nop,TS val 294390824 ecr 294390823], length 3
2022-04-06 02:28:28.321082 IP (tos 0x0, ttl 64, id 36677, offset 0, flags [DF], proto TCP (6), length 52)
    127.0.0.1.10150 > 127.0.0.1.49356: Flags [.], cksum 0xfe28 (incorrect -> 0xfd6a), seq 1, ack 4, win 512, options [nop,nop,TS val 294390824 ecr 294390824], length 0
2022-04-06 02:28:28.321110 IP (tos 0x0, ttl 64, id 36678, offset 0, flags [DF], proto TCP (6), length 54)
    127.0.0.1.10150 > 127.0.0.1.49356: Flags [P.], cksum 0xfe2a (incorrect -> 0xf860), seq 1:3, ack 4, win 512, options [nop,nop,TS val 294390824 ecr 294390824], length 2
2022-04-06 02:28:28.321119 IP (tos 0x0, ttl 64, id 36929, offset 0, flags [DF], proto TCP (6), length 52)
    127.0.0.1.49356 > 127.0.0.1.10150: Flags [.], cksum 0xfe28 (incorrect -> 0xfd68), seq 4, ack 3, win 512, options [nop,nop,TS val 294390824 ecr 294390824], length 0
2022-04-06 02:28:28.322598 IP (tos 0x0, ttl 64, id 36930, offset 0, flags [DF], proto TCP (6), length 62)
    127.0.0.1.49356 > 127.0.0.1.10150: Flags [P.], cksum 0xfe32 (incorrect -> 0x7b67), seq 4:14, ack 3, win 512, options [nop,nop,TS val 294390825 ecr 294390824], length 10
2022-04-06 02:28:28.322622 IP (tos 0x0, ttl 64, id 36679, offset 0, flags [DF], proto TCP (6), length 52)
    127.0.0.1.10150 > 127.0.0.1.49356: Flags [.], cksum 0xfe28 (incorrect -> 0xfd5c), seq 3, ack 14, win 512, options [nop,nop,TS val 294390825 ecr 294390825], length 0
2022-04-06 02:28:28.375236 IP (tos 0x0, ttl 64, id 36680, offset 0, flags [DF], proto TCP (6), length 62)
    127.0.0.1.10150 > 127.0.0.1.49356: Flags [P.], cksum 0xfe32 (incorrect -> 0xf814), seq 3:13, ack 14, win 512, options [nop,nop,TS val 294390878 ecr 294390825], length 10
2022-04-06 02:28:28.375248 IP (tos 0x0, ttl 64, id 36931, offset 0, flags [DF], proto TCP (6), length 52)
    127.0.0.1.49356 > 127.0.0.1.10150: Flags [.], cksum 0xfe28 (incorrect -> 0xfce8), seq 14, ack 13, win 512, options [nop,nop,TS val 294390878 ecr 294390878], length 0
2022-04-06 02:28:28.381202 IP (tos 0x0, ttl 64, id 36932, offset 0, flags [DF], proto TCP (6), length 569)
    127.0.0.1.49356 > 127.0.0.1.10150: Flags [P.], cksum 0x002e (incorrect -> 0x409a), seq 14:531, ack 13, win 512, options [nop,nop,TS val 294390884 ecr 294390878], length 517
2022-04-06 02:28:28.381213 IP (tos 0x0, ttl 64, id 36681, offset 0, flags [DF], proto TCP (6), length 52)
    127.0.0.1.10150 > 127.0.0.1.49356: Flags [.], cksum 0xfe28 (incorrect -> 0xfadb), seq 13, ack 531, win 508, options [nop,nop,TS val 294390884 ecr 294390884], length 0
2022-04-06 02:28:28.436323 IP (tos 0x0, ttl 64, id 36682, offset 0, flags [DF], proto TCP (6), length 3285)
    127.0.0.1.10150 > 127.0.0.1.49356: Flags [P.], cksum 0x0aca (incorrect -> 0x455c), seq 13:3246, ack 531, win 512, options [nop,nop,TS val 294390939 ecr 294390884], length 3233
2022-04-06 02:28:28.436335 IP (tos 0x0, ttl 64, id 36933, offset 0, flags [DF], proto TCP (6), length 52)
    127.0.0.1.49356 > 127.0.0.1.10150: Flags [.], cksum 0xfe28 (incorrect -> 0xedd9), seq 531, ack 3246, win 495, options [nop,nop,TS val 294390939 ecr 294390939], length 0
2022-04-06 02:28:28.437008 IP (tos 0x0, ttl 64, id 36934, offset 0, flags [DF], proto TCP (6), length 116)
    127.0.0.1.49356 > 127.0.0.1.10150: Flags [P.], cksum 0xfe68 (incorrect -> 0x0803), seq 531:595, ack 3246, win 512, options [nop,nop,TS val 294390939 ecr 294390939], length 64
2022-04-06 02:28:28.437017 IP (tos 0x0, ttl 64, id 36683, offset 0, flags [DF], proto TCP (6), length 52)
    127.0.0.1.10150 > 127.0.0.1.49356: Flags [.], cksum 0xfe28 (incorrect -> 0xed88), seq 3246, ack 595, win 512, options [nop,nop,TS val 294390939 ecr 294390939], length 0
2022-04-06 02:28:28.437512 IP (tos 0x0, ttl 64, id 36935, offset 0, flags [DF], proto TCP (6), length 356)
    127.0.0.1.49356 > 127.0.0.1.10150: Flags [P.], cksum 0xff58 (incorrect -> 0x359a), seq 595:899, ack 3246, win 512, options [nop,nop,TS val 294390940 ecr 294390939], length 304
2022-04-06 02:28:28.437523 IP (tos 0x0, ttl 64, id 36684, offset 0, flags [DF], proto TCP (6), length 52)
    127.0.0.1.10150 > 127.0.0.1.49356: Flags [.], cksum 0xfe28 (incorrect -> 0xec58), seq 3246, ack 899, win 510, options [nop,nop,TS val 294390940 ecr 294390940], length 0
2022-04-06 02:28:28.497342 IP (tos 0x0, ttl 64, id 36685, offset 0, flags [DF], proto TCP (6), length 221)
    127.0.0.1.10150 > 127.0.0.1.49356: Flags [P.], cksum 0xfed1 (incorrect -> 0x52e0), seq 3246:3415, ack 899, win 512, options [nop,nop,TS val 294391000 ecr 294390940], length 169
2022-04-06 02:28:28.497353 IP (tos 0x0, ttl 64, id 36936, offset 0, flags [DF], proto TCP (6), length 52)
    127.0.0.1.49356 > 127.0.0.1.10150: Flags [.], cksum 0xfe28 (incorrect -> 0xeb36), seq 899, ack 3415, win 511, options [nop,nop,TS val 294391000 ecr 294391000], length 0
200, 5.719135522842407, 0.39249682426452637