2022-04-06 00:37:31.952214 IP (tos 0x0, ttl 64, id 59409, offset 0, flags [DF], proto TCP (6), length 60)
    127.0.0.1.47014 > 127.0.0.1.9650: Flags [S], cksum 0xfe30 (incorrect -> 0x2652), seq 3240034138, win 65495, options [mss 65495,sackOK,TS val 287734455 ecr 0,nop,wscale 7], length 0
2022-04-06 00:37:31.952233 IP (tos 0x0, ttl 64, id 0, offset 0, flags [DF], proto TCP (6), length 60)
    127.0.0.1.9650 > 127.0.0.1.47014: Flags [S.], cksum 0xfe30 (incorrect -> 0x5a3c), seq 4193732155, ack 3240034139, win 65483, options [mss 65495,sackOK,TS val 287734455 ecr 287734455,nop,wscale 7], length 0
2022-04-06 00:37:31.952247 IP (tos 0x0, ttl 64, id 59410, offset 0, flags [DF], proto TCP (6), length 52)
    127.0.0.1.47014 > 127.0.0.1.9650: Flags [.], cksum 0xfe28 (incorrect -> 0x80f8), seq 1, ack 1, win 512, options [nop,nop,TS val 287734455 ecr 287734455], length 0
2022-04-06 00:37:31.952364 IP (tos 0x0, ttl 64, id 59411, offset 0, flags [DF], proto TCP (6), length 55)
    127.0.0.1.47014 > 127.0.0.1.9650: Flags [P.], cksum 0xfe2b (incorrect -> 0x7bec), seq 1:4, ack 1, win 512, options [nop,nop,TS val 287734455 ecr 287734455], length 3
2022-04-06 00:37:31.952381 IP (tos 0x0, ttl 64, id 34539, offset 0, flags [DF], proto TCP (6), length 52)
    127.0.0.1.9650 > 127.0.0.1.47014: Flags [.], cksum 0xfe28 (incorrect -> 0x80f5), seq 1, ack 4, win 512, options [nop,nop,TS val 287734455 ecr 287734455], length 0
2022-04-06 00:37:31.952441 IP (tos 0x0, ttl 64, id 34540, offset 0, flags [DF], proto TCP (6), length 54)
    127.0.0.1.9650 > 127.0.0.1.47014: Flags [P.], cksum 0xfe2a (incorrect -> 0x7beb), seq 1:3, ack 4, win 512, options [nop,nop,TS val 287734455 ecr 287734455], length 2
2022-04-06 00:37:31.952459 IP (tos 0x0, ttl 64, id 59412, offset 0, flags [DF], proto TCP (6), length 52)
    127.0.0.1.47014 > 127.0.0.1.9650: Flags [.], cksum 0xfe28 (incorrect -> 0x80f3), seq 4, ack 3, win 512, options [nop,nop,TS val 287734455 ecr 287734455], length 0
2022-04-06 00:37:31.955006 IP (tos 0x0, ttl 64, id 59413, offset 0, flags [DF], proto TCP (6), length 62)
    127.0.0.1.47014 > 127.0.0.1.9650: Flags [P.], cksum 0xfe32 (incorrect -> 0x8eb0), seq 4:14, ack 3, win 512, options [nop,nop,TS val 287734457 ecr 287734455], length 10
2022-04-06 00:37:31.955026 IP (tos 0x0, ttl 64, id 34541, offset 0, flags [DF], proto TCP (6), length 52)
    127.0.0.1.9650 > 127.0.0.1.47014: Flags [.], cksum 0xfe28 (incorrect -> 0x80e5), seq 3, ack 14, win 512, options [nop,nop,TS val 287734457 ecr 287734457], length 0
2022-04-06 00:37:32.018263 IP (tos 0x0, ttl 64, id 34542, offset 0, flags [DF], proto TCP (6), length 62)
    127.0.0.1.9650 > 127.0.0.1.47014: Flags [P.], cksum 0xfe32 (incorrect -> 0x7b92), seq 3:13, ack 14, win 512, options [nop,nop,TS val 287734521 ecr 287734457], length 10
2022-04-06 00:37:32.018273 IP (tos 0x0, ttl 64, id 59414, offset 0, flags [DF], proto TCP (6), length 52)
    127.0.0.1.47014 > 127.0.0.1.9650: Flags [.], cksum 0xfe28 (incorrect -> 0x805b), seq 14, ack 13, win 512, options [nop,nop,TS val 287734521 ecr 287734521], length 0
2022-04-06 00:37:32.023986 IP (tos 0x0, ttl 64, id 59415, offset 0, flags [DF], proto TCP (6), length 569)
    127.0.0.1.47014 > 127.0.0.1.9650: Flags [P.], cksum 0x002e (incorrect -> 0xcb25), seq 14:531, ack 13, win 512, options [nop,nop,TS val 287734526 ecr 287734521], length 517
2022-04-06 00:37:32.023995 IP (tos 0x0, ttl 64, id 34543, offset 0, flags [DF], proto TCP (6), length 52)
    127.0.0.1.9650 > 127.0.0.1.47014: Flags [.], cksum 0xfe28 (incorrect -> 0x7e50), seq 13, ack 531, win 508, options [nop,nop,TS val 287734526 ecr 287734526], length 0
403, 6.805113315582275, 0.32210421562194824