2022-04-06 07:42:11.021253 IP (tos 0x0, ttl 64, id 58739, offset 0, flags [DF], proto TCP (6), length 60)
    127.0.0.1.37628 > 127.0.0.1.9450: Flags [S], cksum 0xfe30 (incorrect -> 0x3092), seq 3538501536, win 65495, options [mss 65495,sackOK,TS val 313213524 ecr 0,nop,wscale 7], length 0
2022-04-06 07:42:11.021269 IP (tos 0x0, ttl 64, id 0, offset 0, flags [DF], proto TCP (6), length 60)
    127.0.0.1.9450 > 127.0.0.1.37628: Flags [S.], cksum 0xfe30 (incorrect -> 0xd868), seq 2574412210, ack 3538501537, win 65483, options [mss 65495,sackOK,TS val 313213524 ecr 313213524,nop,wscale 7], length 0
2022-04-06 07:42:11.021283 IP (tos 0x0, ttl 64, id 58740, offset 0, flags [DF], proto TCP (6), length 52)
    127.0.0.1.37628 > 127.0.0.1.9450: Flags [.], cksum 0xfe28 (incorrect -> 0xff24), seq 1, ack 1, win 512, options [nop,nop,TS val 313213524 ecr 313213524], length 0
2022-04-06 07:42:11.021402 IP (tos 0x0, ttl 64, id 58741, offset 0, flags [DF], proto TCP (6), length 55)
    127.0.0.1.37628 > 127.0.0.1.9450: Flags [P.], cksum 0xfe2b (incorrect -> 0xfa18), seq 1:4, ack 1, win 512, options [nop,nop,TS val 313213524 ecr 313213524], length 3
2022-04-06 07:42:11.021417 IP (tos 0x0, ttl 64, id 296, offset 0, flags [DF], proto TCP (6), length 52)
    127.0.0.1.9450 > 127.0.0.1.37628: Flags [.], cksum 0xfe28 (incorrect -> 0xff21), seq 1, ack 4, win 512, options [nop,nop,TS val 313213524 ecr 313213524], length 0
2022-04-06 07:42:11.021501 IP (tos 0x0, ttl 64, id 297, offset 0, flags [DF], proto TCP (6), length 54)
    127.0.0.1.9450 > 127.0.0.1.37628: Flags [P.], cksum 0xfe2a (incorrect -> 0xfa17), seq 1:3, ack 4, win 512, options [nop,nop,TS val 313213524 ecr 313213524], length 2
2022-04-06 07:42:11.021521 IP (tos 0x0, ttl 64, id 58742, offset 0, flags [DF], proto TCP (6), length 52)
    127.0.0.1.37628 > 127.0.0.1.9450: Flags [.], cksum 0xfe28 (incorrect -> 0xff1f), seq 4, ack 3, win 512, options [nop,nop,TS val 313213524 ecr 313213524], length 0
2022-04-06 07:42:11.043789 IP (tos 0x0, ttl 64, id 58743, offset 0, flags [DF], proto TCP (6), length 62)
    127.0.0.1.37628 > 127.0.0.1.9450: Flags [P.], cksum 0xfe32 (incorrect -> 0x7c7f), seq 4:14, ack 3, win 512, options [nop,nop,TS val 313213546 ecr 313213524], length 10
2022-04-06 07:42:11.043804 IP (tos 0x0, ttl 64, id 298, offset 0, flags [DF], proto TCP (6), length 52)
    127.0.0.1.9450 > 127.0.0.1.37628: Flags [.], cksum 0xfe28 (incorrect -> 0xfee9), seq 3, ack 14, win 512, options [nop,nop,TS val 313213546 ecr 313213546], length 0
2022-04-06 07:42:11.134609 IP (tos 0x0, ttl 64, id 299, offset 0, flags [DF], proto TCP (6), length 62)
    127.0.0.1.9450 > 127.0.0.1.37628: Flags [P.], cksum 0xfe32 (incorrect -> 0xf97b), seq 3:13, ack 14, win 512, options [nop,nop,TS val 313213637 ecr 313213546], length 10
2022-04-06 07:42:11.134619 IP (tos 0x0, ttl 64, id 58744, offset 0, flags [DF], proto TCP (6), length 52)
    127.0.0.1.37628 > 127.0.0.1.9450: Flags [.], cksum 0xfe28 (incorrect -> 0xfe29), seq 14, ack 13, win 512, options [nop,nop,TS val 313213637 ecr 313213637], length 0
2022-04-06 07:42:11.140737 IP (tos 0x0, ttl 64, id 58745, offset 0, flags [DF], proto TCP (6), length 569)
    127.0.0.1.37628 > 127.0.0.1.9450: Flags [P.], cksum 0x002e (incorrect -> 0xd3b1), seq 14:531, ack 13, win 512, options [nop,nop,TS val 313213643 ecr 313213637], length 517
2022-04-06 07:42:11.140749 IP (tos 0x0, ttl 64, id 300, offset 0, flags [DF], proto TCP (6), length 52)
    127.0.0.1.9450 > 127.0.0.1.37628: Flags [.], cksum 0xfe28 (incorrect -> 0xfc1c), seq 13, ack 531, win 508, options [nop,nop,TS val 313213643 ecr 313213643], length 0
200, 3.589777708053589, 0.8235127925872803