2022-04-06 18:12:07.442375 IP (tos 0x0, ttl 64, id 54370, offset 0, flags [DF], proto TCP (6), length 60)
    127.0.0.1.60908 > 127.0.0.1.9350: Flags [S], cksum 0xfe30 (incorrect -> 0x8070), seq 3853632999, win 65495, options [mss 65495,sackOK,TS val 351009945 ecr 0,nop,wscale 7], length 0
2022-04-06 18:12:07.442386 IP (tos 0x0, ttl 64, id 0, offset 0, flags [DF], proto TCP (6), length 60)
    127.0.0.1.9350 > 127.0.0.1.60908: Flags [S.], cksum 0xfe30 (incorrect -> 0x7bff), seq 1771211092, ack 3853633000, win 65483, options [mss 65495,sackOK,TS val 351009945 ecr 351009945,nop,wscale 7], length 0
2022-04-06 18:12:07.442396 IP (tos 0x0, ttl 64, id 54371, offset 0, flags [DF], proto TCP (6), length 52)
    127.0.0.1.60908 > 127.0.0.1.9350: Flags [.], cksum 0xfe28 (incorrect -> 0xa2bb), seq 1, ack 1, win 512, options [nop,nop,TS val 351009945 ecr 351009945], length 0
2022-04-06 18:12:07.442488 IP (tos 0x0, ttl 64, id 54372, offset 0, flags [DF], proto TCP (6), length 55)
    127.0.0.1.60908 > 127.0.0.1.9350: Flags [P.], cksum 0xfe2b (incorrect -> 0x9daf), seq 1:4, ack 1, win 512, options [nop,nop,TS val 351009945 ecr 351009945], length 3
2022-04-06 18:12:07.442494 IP (tos 0x0, ttl 64, id 24571, offset 0, flags [DF], proto TCP (6), length 52)
    127.0.0.1.9350 > 127.0.0.1.60908: Flags [.], cksum 0xfe28 (incorrect -> 0xa2b8), seq 1, ack 4, win 512, options [nop,nop,TS val 351009945 ecr 351009945], length 0
2022-04-06 18:12:07.442567 IP (tos 0x0, ttl 64, id 24572, offset 0, flags [DF], proto TCP (6), length 54)
    127.0.0.1.9350 > 127.0.0.1.60908: Flags [P.], cksum 0xfe2a (incorrect -> 0x9dae), seq 1:3, ack 4, win 512, options [nop,nop,TS val 351009945 ecr 351009945], length 2
2022-04-06 18:12:07.442574 IP (tos 0x0, ttl 64, id 54373, offset 0, flags [DF], proto TCP (6), length 52)
    127.0.0.1.60908 > 127.0.0.1.9350: Flags [.], cksum 0xfe28 (incorrect -> 0xa2b6), seq 4, ack 3, win 512, options [nop,nop,TS val 351009945 ecr 351009945], length 0
2022-04-06 18:12:07.453898 IP (tos 0x0, ttl 64, id 54374, offset 0, flags [DF], proto TCP (6), length 62)
    127.0.0.1.60908 > 127.0.0.1.9350: Flags [P.], cksum 0xfe32 (incorrect -> 0x129e), seq 4:14, ack 3, win 512, options [nop,nop,TS val 351009956 ecr 351009945], length 10
2022-04-06 18:12:07.453918 IP (tos 0x0, ttl 64, id 24573, offset 0, flags [DF], proto TCP (6), length 52)
    127.0.0.1.9350 > 127.0.0.1.60908: Flags [.], cksum 0xfe28 (incorrect -> 0xa296), seq 3, ack 14, win 512, options [nop,nop,TS val 351009956 ecr 351009956], length 0
2022-04-06 18:12:07.520828 IP (tos 0x0, ttl 64, id 24574, offset 0, flags [DF], proto TCP (6), length 62)
    127.0.0.1.9350 > 127.0.0.1.60908: Flags [P.], cksum 0xfe32 (incorrect -> 0x9d40), seq 3:13, ack 14, win 512, options [nop,nop,TS val 351010023 ecr 351009956], length 10
2022-04-06 18:12:07.520848 IP (tos 0x0, ttl 64, id 54375, offset 0, flags [DF], proto TCP (6), length 52)
    127.0.0.1.60908 > 127.0.0.1.9350: Flags [.], cksum 0xfe28 (incorrect -> 0xa206), seq 14, ack 13, win 512, options [nop,nop,TS val 351010023 ecr 351010023], length 0
2022-04-06 18:12:07.526735 IP (tos 0x0, ttl 64, id 54376, offset 0, flags [DF], proto TCP (6), length 569)
    127.0.0.1.60908 > 127.0.0.1.9350: Flags [P.], cksum 0x002e (incorrect -> 0xc88f), seq 14:531, ack 13, win 512, options [nop,nop,TS val 351010029 ecr 351010023], length 517
2022-04-06 18:12:07.526745 IP (tos 0x0, ttl 64, id 24575, offset 0, flags [DF], proto TCP (6), length 52)
    127.0.0.1.9350 > 127.0.0.1.60908: Flags [.], cksum 0xfe28 (incorrect -> 0x9ff9), seq 13, ack 531, win 508, options [nop,nop,TS val 351010029 ecr 351010029], length 0
2022-04-06 18:12:07.590469 IP (tos 0x0, ttl 64, id 24576, offset 0, flags [DF], proto TCP (6), length 3538)
    127.0.0.1.9350 > 127.0.0.1.60908: Flags [P.], cksum 0x0bc7 (incorrect -> 0x7cd2), seq 13:3499, ack 531, win 512, options [nop,nop,TS val 351010093 ecr 351010029], length 3486
2022-04-06 18:12:07.590481 IP (tos 0x0, ttl 64, id 54377, offset 0, flags [DF], proto TCP (6), length 52)
    127.0.0.1.60908 > 127.0.0.1.9350: Flags [.], cksum 0xfe28 (incorrect -> 0x91e9), seq 531, ack 3499, win 494, options [nop,nop,TS val 351010093 ecr 351010093], length 0
2022-04-06 18:12:07.625072 IP (tos 0x0, ttl 64, id 24577, offset 0, flags [DF], proto TCP (6), length 1151)
    127.0.0.1.9350 > 127.0.0.1.60908: Flags [P.], cksum 0x0274 (incorrect -> 0xfde2), seq 3499:4598, ack 531, win 512, options [nop,nop,TS val 351010128 ecr 351010093], length 1099
2022-04-06 18:12:07.625081 IP (tos 0x0, ttl 64, id 54378, offset 0, flags [DF], proto TCP (6), length 52)
    127.0.0.1.60908 > 127.0.0.1.9350: Flags [.], cksum 0xfe28 (incorrect -> 0x8d4f), seq 531, ack 4598, win 503, options [nop,nop,TS val 351010128 ecr 351010128], length 0
2022-04-06 18:12:07.625515 IP (tos 0x0, ttl 64, id 54379, offset 0, flags [DF], proto TCP (6), length 132)
    127.0.0.1.60908 > 127.0.0.1.9350: Flags [P.], cksum 0xfe78 (incorrect -> 0x39c5), seq 531:611, ack 4598, win 512, options [nop,nop,TS val 351010128 ecr 351010128], length 80
2022-04-06 18:12:07.625524 IP (tos 0x0, ttl 64, id 24578, offset 0, flags [DF], proto TCP (6), length 52)
    127.0.0.1.9350 > 127.0.0.1.60908: Flags [.], cksum 0xfe28 (incorrect -> 0x8cf6), seq 4598, ack 611, win 512, options [nop,nop,TS val 351010128 ecr 351010128], length 0
2022-04-06 18:12:07.625894 IP (tos 0x0, ttl 64, id 54380, offset 0, flags [DF], proto TCP (6), length 362)
    127.0.0.1.60908 > 127.0.0.1.9350: Flags [P.], cksum 0xff5e (incorrect -> 0x53e3), seq 611:921, ack 4598, win 512, options [nop,nop,TS val 351010128 ecr 351010128], length 310
2022-04-06 18:12:07.625904 IP (tos 0x0, ttl 64, id 24579, offset 0, flags [DF], proto TCP (6), length 52)
    127.0.0.1.9350 > 127.0.0.1.60908: Flags [.], cksum 0xfe28 (incorrect -> 0x8bc2), seq 4598, ack 921, win 510, options [nop,nop,TS val 351010128 ecr 351010128], length 0
2022-04-06 18:12:07.704430 IP (tos 0x0, ttl 64, id 24580, offset 0, flags [DF], proto TCP (6), length 210)
    127.0.0.1.9350 > 127.0.0.1.60908: Flags [P.], cksum 0xfec6 (incorrect -> 0x09a0), seq 4598:4756, ack 921, win 512, options [nop,nop,TS val 351010207 ecr 351010128], length 158
2022-04-06 18:12:07.704439 IP (tos 0x0, ttl 64, id 54381, offset 0, flags [DF], proto TCP (6), length 52)
    127.0.0.1.60908 > 127.0.0.1.9350: Flags [.], cksum 0xfe28 (incorrect -> 0x8a85), seq 921, ack 4756, win 511, options [nop,nop,TS val 351010207 ecr 351010207], length 0
2022-04-06 18:12:07.806184 IP (tos 0x0, ttl 64, id 24581, offset 0, flags [DF], proto TCP (6), length 3538)
    127.0.0.1.9350 > 127.0.0.1.60908: Flags [P.], cksum 0x0bc7 (incorrect -> 0x05c0), seq 4756:8242, ack 921, win 512, options [nop,nop,TS val 351010309 ecr 351010207], length 3486
2022-04-06 18:12:07.806192 IP (tos 0x0, ttl 64, id 54382, offset 0, flags [DF], proto TCP (6), length 52)
    127.0.0.1.60908 > 127.0.0.1.9350: Flags [.], cksum 0xfe28 (incorrect -> 0x7c2c), seq 921, ack 8242, win 494, options [nop,nop,TS val 351010309 ecr 351010309], length 0
2022-04-06 18:12:07.806433 IP (tos 0x0, ttl 64, id 24582, offset 0, flags [DF], proto TCP (6), length 4036)
    127.0.0.1.9350 > 127.0.0.1.60908: Flags [P.], cksum 0x0db9 (incorrect -> 0x183b), seq 8242:12226, ack 921, win 512, options [nop,nop,TS val 351010309 ecr 351010309], length 3984
2022-04-06 18:12:07.806446 IP (tos 0x0, ttl 64, id 54383, offset 0, flags [DF], proto TCP (6), length 52)
    127.0.0.1.60908 > 127.0.0.1.9350: Flags [.], cksum 0xfe28 (incorrect -> 0x6c9e), seq 921, ack 12226, win 492, options [nop,nop,TS val 351010309 ecr 351010309], length 0
2022-04-06 18:12:07.822433 IP (tos 0x0, ttl 64, id 24583, offset 0, flags [DF], proto TCP (6), length 3334)
    127.0.0.1.9350 > 127.0.0.1.60908: Flags [P.], cksum 0x0afb (incorrect -> 0xfe93), seq 12226:15508, ack 921, win 512, options [nop,nop,TS val 351010325 ecr 351010309], length 3282
2022-04-06 18:12:07.822443 IP (tos 0x0, ttl 64, id 54384, offset 0, flags [DF], proto TCP (6), length 52)
    127.0.0.1.60908 > 127.0.0.1.9350: Flags [.], cksum 0xfe28 (incorrect -> 0x5fa9), seq 921, ack 15508, win 495, options [nop,nop,TS val 351010325 ecr 351010325], length 0
2022-04-06 18:12:07.823937 IP (tos 0x0, ttl 64, id 24584, offset 0, flags [DF], proto TCP (6), length 3436)
    127.0.0.1.9350 > 127.0.0.1.60908: Flags [P.], cksum 0x0b61 (incorrect -> 0x7dff), seq 15508:18892, ack 921, win 512, options [nop,nop,TS val 351010326 ecr 351010325], length 3384
2022-04-06 18:12:07.823948 IP (tos 0x0, ttl 64, id 54385, offset 0, flags [DF], proto TCP (6), length 52)
    127.0.0.1.60908 > 127.0.0.1.9350: Flags [.], cksum 0xfe28 (incorrect -> 0x5270), seq 921, ack 18892, win 494, options [nop,nop,TS val 351010326 ecr 351010326], length 0
2022-04-06 18:12:07.824055 IP (tos 0x0, ttl 64, id 24585, offset 0, flags [DF], proto TCP (6), length 4100)
    127.0.0.1.9350 > 127.0.0.1.60908: Flags [P.], cksum 0x0df9 (incorrect -> 0x51e4), seq 18892:22940, ack 921, win 512, options [nop,nop,TS val 351010326 ecr 351010326], length 4048
2022-04-06 18:12:07.824061 IP (tos 0x0, ttl 64, id 54386, offset 0, flags [DF], proto TCP (6), length 52)
    127.0.0.1.60908 > 127.0.0.1.9350: Flags [.], cksum 0xfe28 (incorrect -> 0x42af), seq 921, ack 22940, win 478, options [nop,nop,TS val 351010327 ecr 351010326], length 0
2022-04-06 18:12:07.824074 IP (tos 0x0, ttl 64, id 24586, offset 0, flags [DF], proto TCP (6), length 3938)
    127.0.0.1.9350 > 127.0.0.1.60908: Flags [P.], cksum 0x0d57 (incorrect -> 0x643b), seq 22940:26826, ack 921, win 512, options [nop,nop,TS val 351010327 ecr 351010327], length 3886
2022-04-06 18:12:07.824079 IP (tos 0x0, ttl 64, id 54387, offset 0, flags [DF], proto TCP (6), length 52)
    127.0.0.1.60908 > 127.0.0.1.9350: Flags [.], cksum 0xfe28 (incorrect -> 0x338f), seq 921, ack 26826, win 463, options [nop,nop,TS val 351010327 ecr 351010327], length 0
2022-04-06 18:12:07.824140 IP (tos 0x0, ttl 64, id 24587, offset 0, flags [DF], proto TCP (6), length 3832)
    127.0.0.1.9350 > 127.0.0.1.60908: Flags [P.], cksum 0x0ced (incorrect -> 0xc24a), seq 26826:30606, ack 921, win 512, options [nop,nop,TS val 351010327 ecr 351010327], length 3780
2022-04-06 18:12:07.824146 IP (tos 0x0, ttl 64, id 54388, offset 0, flags [DF], proto TCP (6), length 52)
    127.0.0.1.60908 > 127.0.0.1.9350: Flags [.], cksum 0xfe28 (incorrect -> 0x24d9), seq 921, ack 30606, win 449, options [nop,nop,TS val 351010327 ecr 351010327], length 0
2022-04-06 18:12:07.824482 IP (tos 0x0, ttl 64, id 24588, offset 0, flags [DF], proto TCP (6), length 3538)
    127.0.0.1.9350 > 127.0.0.1.60908: Flags [P.], cksum 0x0bc7 (incorrect -> 0xe2c7), seq 30606:34092, ack 921, win 512, options [nop,nop,TS val 351010327 ecr 351010327], length 3486
2022-04-06 18:12:07.825168 IP (tos 0x0, ttl 64, id 54389, offset 0, flags [DF], proto TCP (6), length 52)
    127.0.0.1.60908 > 127.0.0.1.9350: Flags [.], cksum 0xfe28 (incorrect -> 0x16fb), seq 921, ack 34092, win 512, options [nop,nop,TS val 351010328 ecr 351010327], length 0
2022-04-06 18:12:07.838853 IP (tos 0x0, ttl 64, id 24589, offset 0, flags [DF], proto TCP (6), length 4100)
    127.0.0.1.9350 > 127.0.0.1.60908: Flags [P.], cksum 0x0df9 (incorrect -> 0x50f6), seq 34092:38140, ack 921, win 512, options [nop,nop,TS val 351010341 ecr 351010328], length 4048
2022-04-06 18:12:07.845814 IP (tos 0x0, ttl 64, id 24590, offset 0, flags [DF], proto TCP (6), length 32820)
    127.0.0.1.9350 > 127.0.0.1.60908: Flags [.], cksum 0x7e29 (incorrect -> 0x329b), seq 38140:70908, ack 921, win 512, options [nop,nop,TS val 351010348 ecr 351010328], length 32768
2022-04-06 18:12:07.845834 IP (tos 0x0, ttl 64, id 54390, offset 0, flags [DF], proto TCP (6), length 52)
    127.0.0.1.60908 > 127.0.0.1.9350: Flags [.], cksum 0xfe28 (incorrect -> 0x878d), seq 921, ack 70908, win 379, options [nop,nop,TS val 351010348 ecr 351010341], length 0
2022-04-06 18:12:07.845840 IP (tos 0x0, ttl 64, id 24591, offset 0, flags [DF], proto TCP (6), length 608)
    127.0.0.1.9350 > 127.0.0.1.60908: Flags [P.], cksum 0x0055 (incorrect -> 0x83c3), seq 70908:71464, ack 921, win 512, options [nop,nop,TS val 351010348 ecr 351010348], length 556
2022-04-06 18:12:07.846627 IP (tos 0x0, ttl 64, id 54391, offset 0, flags [DF], proto TCP (6), length 52)
    127.0.0.1.60908 > 127.0.0.1.9350: Flags [.], cksum 0xfe28 (incorrect -> 0x84d4), seq 921, ack 71464, win 512, options [nop,nop,TS val 351010349 ecr 351010348], length 0
2022-04-06 18:12:07.852620 IP (tos 0x0, ttl 64, id 24592, offset 0, flags [DF], proto TCP (6), length 3538)
    127.0.0.1.9350 > 127.0.0.1.60908: Flags [P.], cksum 0x0bc7 (incorrect -> 0x9948), seq 71464:74950, ack 921, win 512, options [nop,nop,TS val 351010355 ecr 351010349], length 3486
2022-04-06 18:12:07.852638 IP (tos 0x0, ttl 64, id 54392, offset 0, flags [DF], proto TCP (6), length 52)
    127.0.0.1.60908 > 127.0.0.1.9350: Flags [.], cksum 0xfe28 (incorrect -> 0x7729), seq 921, ack 74950, win 512, options [nop,nop,TS val 351010355 ecr 351010355], length 0
2022-04-06 18:12:07.852734 IP (tos 0x0, ttl 64, id 24593, offset 0, flags [DF], proto TCP (6), length 3538)
    127.0.0.1.9350 > 127.0.0.1.60908: Flags [P.], cksum 0x0bc7 (incorrect -> 0x0b4e), seq 74950:78436, ack 921, win 512, options [nop,nop,TS val 351010355 ecr 351010355], length 3486
2022-04-06 18:12:07.867360 IP (tos 0x0, ttl 64, id 24594, offset 0, flags [DF], proto TCP (6), length 32820)
    127.0.0.1.9350 > 127.0.0.1.60908: Flags [.], cksum 0x7e29 (incorrect -> 0x22f4), seq 78436:111204, ack 921, win 512, options [nop,nop,TS val 351010370 ecr 351010355], length 32768
2022-04-06 18:12:07.867379 IP (tos 0x0, ttl 64, id 54393, offset 0, flags [DF], proto TCP (6), length 52)
    127.0.0.1.60908 > 127.0.0.1.9350: Flags [.], cksum 0xfe28 (incorrect -> 0xea00), seq 921, ack 111204, win 379, options [nop,nop,TS val 351010370 ecr 351010355], length 0
2022-04-06 18:12:07.867386 IP (tos 0x0, ttl 64, id 24595, offset 0, flags [DF], proto TCP (6), length 3320)
    127.0.0.1.9350 > 127.0.0.1.60908: Flags [P.], cksum 0x0aed (incorrect -> 0xad51), seq 111204:114472, ack 921, win 512, options [nop,nop,TS val 351010370 ecr 351010370], length 3268
2022-04-06 18:12:07.868151 IP (tos 0x0, ttl 64, id 54394, offset 0, flags [DF], proto TCP (6), length 52)
    127.0.0.1.60908 > 127.0.0.1.9350: Flags [.], cksum 0xfe28 (incorrect -> 0xdca7), seq 921, ack 114472, win 512, options [nop,nop,TS val 351010371 ecr 351010370], length 0
2022-04-06 18:12:07.868160 IP (tos 0x0, ttl 64, id 24596, offset 0, flags [DF], proto TCP (6), length 7668)
    127.0.0.1.9350 > 127.0.0.1.60908: Flags [P.], cksum 0x1be9 (incorrect -> 0xd3c4), seq 114472:122088, ack 921, win 512, options [nop,nop,TS val 351010371 ecr 351010371], length 7616
2022-04-06 18:12:07.868509 IP (tos 0x0, ttl 64, id 54395, offset 0, flags [DF], proto TCP (6), length 52)
    127.0.0.1.60908 > 127.0.0.1.9350: Flags [.], cksum 0xfe28 (incorrect -> 0xbee6), seq 921, ack 122088, win 512, options [nop,nop,TS val 351010371 ecr 351010371], length 0
2022-04-06 18:12:07.870361 IP (tos 0x0, ttl 64, id 24597, offset 0, flags [DF], proto TCP (6), length 4100)
    127.0.0.1.9350 > 127.0.0.1.60908: Flags [P.], cksum 0x0df9 (incorrect -> 0xa7c7), seq 122088:126136, ack 921, win 512, options [nop,nop,TS val 351010373 ecr 351010371], length 4048
2022-04-06 18:12:07.870382 IP (tos 0x0, ttl 64, id 54396, offset 0, flags [DF], proto TCP (6), length 52)
    127.0.0.1.60908 > 127.0.0.1.9350: Flags [.], cksum 0xfe28 (incorrect -> 0xaf12), seq 921, ack 126136, win 512, options [nop,nop,TS val 351010373 ecr 351010373], length 0
2022-04-06 18:12:07.870388 IP (tos 0x0, ttl 64, id 24598, offset 0, flags [DF], proto TCP (6), length 486)
    127.0.0.1.9350 > 127.0.0.1.60908: Flags [P.], cksum 0xffda (incorrect -> 0xb5ae), seq 126136:126570, ack 921, win 512, options [nop,nop,TS val 351010373 ecr 351010373], length 434
2022-04-06 18:12:07.870394 IP (tos 0x0, ttl 64, id 54397, offset 0, flags [DF], proto TCP (6), length 52)
    127.0.0.1.60908 > 127.0.0.1.9350: Flags [.], cksum 0xfe28 (incorrect -> 0xad60), seq 921, ack 126570, win 512, options [nop,nop,TS val 351010373 ecr 351010373], length 0
200, 3.89969801902771, 0.4410731792449951