2022-04-06 07:21:13.882480 IP (tos 0x0, ttl 64, id 61188, offset 0, flags [DF], proto TCP (6), length 60)
    127.0.0.1.33068 > 127.0.0.1.11150: Flags [S], cksum 0xfe30 (incorrect -> 0xbd48), seq 3288988603, win 65495, options [mss 65495,sackOK,TS val 311956385 ecr 0,nop,wscale 7], length 0
2022-04-06 07:21:13.882490 IP (tos 0x0, ttl 64, id 0, offset 0, flags [DF], proto TCP (6), length 60)
    127.0.0.1.11150 > 127.0.0.1.33068: Flags [S.], cksum 0xfe30 (incorrect -> 0xa732), seq 2529188119, ack 3288988604, win 65483, options [mss 65495,sackOK,TS val 311956385 ecr 311956385,nop,wscale 7], length 0
2022-04-06 07:21:13.882496 IP (tos 0x0, ttl 64, id 61189, offset 0, flags [DF], proto TCP (6), length 52)
    127.0.0.1.33068 > 127.0.0.1.11150: Flags [.], cksum 0xfe28 (incorrect -> 0xcdee), seq 1, ack 1, win 512, options [nop,nop,TS val 311956385 ecr 311956385], length 0
2022-04-06 07:21:13.882589 IP (tos 0x0, ttl 64, id 61190, offset 0, flags [DF], proto TCP (6), length 55)
    127.0.0.1.33068 > 127.0.0.1.11150: Flags [P.], cksum 0xfe2b (incorrect -> 0xc8e2), seq 1:4, ack 1, win 512, options [nop,nop,TS val 311956385 ecr 311956385], length 3
2022-04-06 07:21:13.882593 IP (tos 0x0, ttl 64, id 25997, offset 0, flags [DF], proto TCP (6), length 52)
    127.0.0.1.11150 > 127.0.0.1.33068: Flags [.], cksum 0xfe28 (incorrect -> 0xcdeb), seq 1, ack 4, win 512, options [nop,nop,TS val 311956385 ecr 311956385], length 0
2022-04-06 07:21:13.882664 IP (tos 0x0, ttl 64, id 25998, offset 0, flags [DF], proto TCP (6), length 54)
    127.0.0.1.11150 > 127.0.0.1.33068: Flags [P.], cksum 0xfe2a (incorrect -> 0xc8e1), seq 1:3, ack 4, win 512, options [nop,nop,TS val 311956385 ecr 311956385], length 2
2022-04-06 07:21:13.882680 IP (tos 0x0, ttl 64, id 61191, offset 0, flags [DF], proto TCP (6), length 52)
    127.0.0.1.33068 > 127.0.0.1.11150: Flags [.], cksum 0xfe28 (incorrect -> 0xcde9), seq 4, ack 3, win 512, options [nop,nop,TS val 311956385 ecr 311956385], length 0
2022-04-06 07:21:13.884918 IP (tos 0x0, ttl 64, id 61192, offset 0, flags [DF], proto TCP (6), length 62)
    127.0.0.1.33068 > 127.0.0.1.11150: Flags [P.], cksum 0xfe32 (incorrect -> 0x1820), seq 4:14, ack 3, win 512, options [nop,nop,TS val 311956387 ecr 311956385], length 10
2022-04-06 07:21:13.884943 IP (tos 0x0, ttl 64, id 25999, offset 0, flags [DF], proto TCP (6), length 52)
    127.0.0.1.11150 > 127.0.0.1.33068: Flags [.], cksum 0xfe28 (incorrect -> 0xcddb), seq 3, ack 14, win 512, options [nop,nop,TS val 311956387 ecr 311956387], length 0
2022-04-06 07:21:13.957894 IP (tos 0x0, ttl 64, id 26000, offset 0, flags [DF], proto TCP (6), length 62)
    127.0.0.1.11150 > 127.0.0.1.33068: Flags [P.], cksum 0xfe32 (incorrect -> 0xc87f), seq 3:13, ack 14, win 512, options [nop,nop,TS val 311956460 ecr 311956387], length 10
2022-04-06 07:21:13.957904 IP (tos 0x0, ttl 64, id 61193, offset 0, flags [DF], proto TCP (6), length 52)
    127.0.0.1.33068 > 127.0.0.1.11150: Flags [.], cksum 0xfe28 (incorrect -> 0xcd3f), seq 14, ack 13, win 512, options [nop,nop,TS val 311956460 ecr 311956460], length 0
2022-04-06 07:21:13.963660 IP (tos 0x0, ttl 64, id 61194, offset 0, flags [DF], proto TCP (6), length 569)
    127.0.0.1.33068 > 127.0.0.1.11150: Flags [P.], cksum 0x002e (incorrect -> 0xc182), seq 14:531, ack 13, win 512, options [nop,nop,TS val 311956466 ecr 311956460], length 517
2022-04-06 07:21:13.963668 IP (tos 0x0, ttl 64, id 26001, offset 0, flags [DF], proto TCP (6), length 52)
    127.0.0.1.11150 > 127.0.0.1.33068: Flags [.], cksum 0xfe28 (incorrect -> 0xcb32), seq 13, ack 531, win 508, options [nop,nop,TS val 311956466 ecr 311956466], length 0
2022-04-06 07:21:14.031037 IP (tos 0x0, ttl 64, id 26002, offset 0, flags [DF], proto TCP (6), length 3538)
    127.0.0.1.11150 > 127.0.0.1.33068: Flags [P.], cksum 0x0bc7 (incorrect -> 0x3f22), seq 13:3499, ack 531, win 512, options [nop,nop,TS val 311956533 ecr 311956466], length 3486
2022-04-06 07:21:14.031044 IP (tos 0x0, ttl 64, id 61195, offset 0, flags [DF], proto TCP (6), length 52)
    127.0.0.1.33068 > 127.0.0.1.11150: Flags [.], cksum 0xfe28 (incorrect -> 0xbd1c), seq 531, ack 3499, win 494, options [nop,nop,TS val 311956533 ecr 311956533], length 0
2022-04-06 07:21:14.095529 IP (tos 0x0, ttl 64, id 26003, offset 0, flags [DF], proto TCP (6), length 659)
    127.0.0.1.11150 > 127.0.0.1.33068: Flags [P.], cksum 0x0088 (incorrect -> 0x381b), seq 3499:4106, ack 531, win 512, options [nop,nop,TS val 311956598 ecr 311956533], length 607
2022-04-06 07:21:14.095546 IP (tos 0x0, ttl 64, id 61196, offset 0, flags [DF], proto TCP (6), length 52)
    127.0.0.1.33068 > 127.0.0.1.11150: Flags [.], cksum 0xfe28 (incorrect -> 0xba30), seq 531, ack 4106, win 505, options [nop,nop,TS val 311956598 ecr 311956598], length 0
2022-04-06 07:21:14.096143 IP (tos 0x0, ttl 64, id 61197, offset 0, flags [DF], proto TCP (6), length 132)
    127.0.0.1.33068 > 127.0.0.1.11150: Flags [P.], cksum 0xfe78 (incorrect -> 0xda8d), seq 531:611, ack 4106, win 512, options [nop,nop,TS val 311956599 ecr 311956598], length 80
2022-04-06 07:21:14.096153 IP (tos 0x0, ttl 64, id 26004, offset 0, flags [DF], proto TCP (6), length 52)
    127.0.0.1.11150 > 127.0.0.1.33068: Flags [.], cksum 0xfe28 (incorrect -> 0xb9d7), seq 4106, ack 611, win 512, options [nop,nop,TS val 311956599 ecr 311956599], length 0
2022-04-06 07:21:14.096799 IP (tos 0x0, ttl 64, id 61198, offset 0, flags [DF], proto TCP (6), length 380)
    127.0.0.1.33068 > 127.0.0.1.11150: Flags [P.], cksum 0xff70 (incorrect -> 0x4e6f), seq 611:939, ack 4106, win 512, options [nop,nop,TS val 311956599 ecr 311956599], length 328
2022-04-06 07:21:14.096808 IP (tos 0x0, ttl 64, id 26005, offset 0, flags [DF], proto TCP (6), length 52)
    127.0.0.1.11150 > 127.0.0.1.33068: Flags [.], cksum 0xfe28 (incorrect -> 0xb891), seq 4106, ack 939, win 510, options [nop,nop,TS val 311956599 ecr 311956599], length 0
2022-04-06 07:21:14.160583 IP (tos 0x0, ttl 64, id 26006, offset 0, flags [DF], proto TCP (6), length 594)
    127.0.0.1.11150 > 127.0.0.1.33068: Flags [P.], cksum 0x0047 (incorrect -> 0xb16d), seq 4106:4648, ack 939, win 512, options [nop,nop,TS val 311956663 ecr 311956599], length 542
2022-04-06 07:21:14.202673 IP (tos 0x0, ttl 64, id 61199, offset 0, flags [DF], proto TCP (6), length 52)
    127.0.0.1.33068 > 127.0.0.1.11150: Flags [.], cksum 0xfe28 (incorrect -> 0xb5c7), seq 939, ack 4648, win 512, options [nop,nop,TS val 311956705 ecr 311956663], length 0
2022-04-06 07:21:14.202688 IP (tos 0x0, ttl 64, id 26007, offset 0, flags [DF], proto TCP (6), length 8020)
    127.0.0.1.11150 > 127.0.0.1.33068: Flags [P.], cksum 0x1d49 (incorrect -> 0x4a0a), seq 4648:12616, ack 939, win 512, options [nop,nop,TS val 311956705 ecr 311956705], length 7968
2022-04-06 07:21:14.202696 IP (tos 0x0, ttl 64, id 61200, offset 0, flags [DF], proto TCP (6), length 52)
    127.0.0.1.33068 > 127.0.0.1.11150: Flags [.], cksum 0xfe28 (incorrect -> 0x96a1), seq 939, ack 12616, win 476, options [nop,nop,TS val 311956705 ecr 311956705], length 0
2022-04-06 07:21:14.217325 IP (tos 0x0, ttl 64, id 26008, offset 0, flags [DF], proto TCP (6), length 3216)
    127.0.0.1.11150 > 127.0.0.1.33068: Flags [P.], cksum 0x0a85 (incorrect -> 0x095d), seq 12616:15780, ack 939, win 512, options [nop,nop,TS val 311956720 ecr 311956705], length 3164
2022-04-06 07:21:14.217336 IP (tos 0x0, ttl 64, id 61201, offset 0, flags [DF], proto TCP (6), length 52)
    127.0.0.1.33068 > 127.0.0.1.11150: Flags [.], cksum 0xfe28 (incorrect -> 0x8a14), seq 939, ack 15780, win 495, options [nop,nop,TS val 311956720 ecr 311956720], length 0
2022-04-06 07:21:14.220845 IP (tos 0x0, ttl 64, id 26009, offset 0, flags [DF], proto TCP (6), length 4100)
    127.0.0.1.11150 > 127.0.0.1.33068: Flags [P.], cksum 0x0df9 (incorrect -> 0xc8a6), seq 15780:19828, ack 939, win 512, options [nop,nop,TS val 311956723 ecr 311956720], length 4048
2022-04-06 07:21:14.220850 IP (tos 0x0, ttl 64, id 61202, offset 0, flags [DF], proto TCP (6), length 52)
    127.0.0.1.33068 > 127.0.0.1.11150: Flags [.], cksum 0xfe28 (incorrect -> 0x7a41), seq 939, ack 19828, win 492, options [nop,nop,TS val 311956723 ecr 311956723], length 0
2022-04-06 07:21:14.220857 IP (tos 0x0, ttl 64, id 26010, offset 0, flags [DF], proto TCP (6), length 2746)
    127.0.0.1.11150 > 127.0.0.1.33068: Flags [P.], cksum 0x08af (incorrect -> 0x1936), seq 19828:22522, ack 939, win 512, options [nop,nop,TS val 311956723 ecr 311956723], length 2694
2022-04-06 07:21:14.220860 IP (tos 0x0, ttl 64, id 61203, offset 0, flags [DF], proto TCP (6), length 52)
    127.0.0.1.33068 > 127.0.0.1.11150: Flags [.], cksum 0xfe28 (incorrect -> 0x6fc6), seq 939, ack 22522, win 481, options [nop,nop,TS val 311956723 ecr 311956723], length 0
2022-04-06 07:21:14.223036 IP (tos 0x0, ttl 64, id 26011, offset 0, flags [DF], proto TCP (6), length 4100)
    127.0.0.1.11150 > 127.0.0.1.33068: Flags [P.], cksum 0x0df9 (incorrect -> 0xedf9), seq 22522:26570, ack 939, win 512, options [nop,nop,TS val 311956725 ecr 311956723], length 4048
2022-04-06 07:21:14.223042 IP (tos 0x0, ttl 64, id 61204, offset 0, flags [DF], proto TCP (6), length 52)
    127.0.0.1.33068 > 127.0.0.1.11150: Flags [.], cksum 0xfe28 (incorrect -> 0x5fe7), seq 939, ack 26570, win 492, options [nop,nop,TS val 311956725 ecr 311956725], length 0
2022-04-06 07:21:14.223048 IP (tos 0x0, ttl 64, id 26012, offset 0, flags [DF], proto TCP (6), length 3290)
    127.0.0.1.11150 > 127.0.0.1.33068: Flags [P.], cksum 0x0acf (incorrect -> 0x6d66), seq 26570:29808, ack 939, win 512, options [nop,nop,TS val 311956725 ecr 311956725], length 3238
2022-04-06 07:21:14.223051 IP (tos 0x0, ttl 64, id 61205, offset 0, flags [DF], proto TCP (6), length 52)
    127.0.0.1.33068 > 127.0.0.1.11150: Flags [.], cksum 0xfe28 (incorrect -> 0x534e), seq 939, ack 29808, win 479, options [nop,nop,TS val 311956725 ecr 311956725], length 0
2022-04-06 07:21:14.226189 IP (tos 0x0, ttl 64, id 26013, offset 0, flags [DF], proto TCP (6), length 3400)
    127.0.0.1.11150 > 127.0.0.1.33068: Flags [P.], cksum 0x0b3d (incorrect -> 0xdc33), seq 29808:33156, ack 939, win 512, options [nop,nop,TS val 311956729 ecr 311956725], length 3348
2022-04-06 07:21:14.226195 IP (tos 0x0, ttl 64, id 61206, offset 0, flags [DF], proto TCP (6), length 52)
    127.0.0.1.33068 > 127.0.0.1.11150: Flags [.], cksum 0xfe28 (incorrect -> 0x4623), seq 939, ack 33156, win 494, options [nop,nop,TS val 311956729 ecr 311956729], length 0
2022-04-06 07:21:14.236454 IP (tos 0x0, ttl 64, id 26014, offset 0, flags [DF], proto TCP (6), length 1500)
    127.0.0.1.11150 > 127.0.0.1.33068: Flags [P.], cksum 0x03d1 (incorrect -> 0x6835), seq 33156:34604, ack 939, win 512, options [nop,nop,TS val 311956739 ecr 311956729], length 1448
2022-04-06 07:21:14.236465 IP (tos 0x0, ttl 64, id 61207, offset 0, flags [DF], proto TCP (6), length 52)
    127.0.0.1.33068 > 127.0.0.1.11150: Flags [.], cksum 0xfe28 (incorrect -> 0x4055), seq 939, ack 34604, win 512, options [nop,nop,TS val 311956739 ecr 311956739], length 0
2022-04-06 07:21:14.237951 IP (tos 0x0, ttl 64, id 26015, offset 0, flags [DF], proto TCP (6), length 4100)
    127.0.0.1.11150 > 127.0.0.1.33068: Flags [P.], cksum 0x0df9 (incorrect -> 0xe954), seq 34604:38652, ack 939, win 512, options [nop,nop,TS val 311956740 ecr 311956739], length 4048
2022-04-06 07:21:14.238693 IP (tos 0x0, ttl 64, id 61208, offset 0, flags [DF], proto TCP (6), length 52)
    127.0.0.1.33068 > 127.0.0.1.11150: Flags [.], cksum 0xfe28 (incorrect -> 0x3082), seq 939, ack 38652, win 512, options [nop,nop,TS val 311956741 ecr 311956740], length 0
2022-04-06 07:21:14.238698 IP (tos 0x0, ttl 64, id 26016, offset 0, flags [DF], proto TCP (6), length 3244)
    127.0.0.1.11150 > 127.0.0.1.33068: Flags [P.], cksum 0x0aa1 (incorrect -> 0x6454), seq 38652:41844, ack 939, win 512, options [nop,nop,TS val 311956741 ecr 311956741], length 3192
2022-04-06 07:21:14.238701 IP (tos 0x0, ttl 64, id 61209, offset 0, flags [DF], proto TCP (6), length 52)
    127.0.0.1.33068 > 127.0.0.1.11150: Flags [.], cksum 0xfe28 (incorrect -> 0x2409), seq 939, ack 41844, win 512, options [nop,nop,TS val 311956741 ecr 311956741], length 0
2022-04-06 07:21:14.241572 IP (tos 0x0, ttl 64, id 26017, offset 0, flags [DF], proto TCP (6), length 4100)
    127.0.0.1.11150 > 127.0.0.1.33068: Flags [P.], cksum 0x0df9 (incorrect -> 0xd9c6), seq 41844:45892, ack 939, win 512, options [nop,nop,TS val 311956744 ecr 311956741], length 4048
2022-04-06 07:21:14.241637 IP (tos 0x0, ttl 64, id 61210, offset 0, flags [DF], proto TCP (6), length 52)
    127.0.0.1.33068 > 127.0.0.1.11150: Flags [.], cksum 0xfe28 (incorrect -> 0x1433), seq 939, ack 45892, win 512, options [nop,nop,TS val 311956744 ecr 311956744], length 0
2022-04-06 07:21:14.241644 IP (tos 0x0, ttl 64, id 26018, offset 0, flags [DF], proto TCP (6), length 1842)
    127.0.0.1.11150 > 127.0.0.1.33068: Flags [P.], cksum 0x0527 (incorrect -> 0x5160), seq 45892:47682, ack 939, win 512, options [nop,nop,TS val 311956744 ecr 311956744], length 1790
2022-04-06 07:21:14.241650 IP (tos 0x0, ttl 64, id 61211, offset 0, flags [DF], proto TCP (6), length 52)
    127.0.0.1.33068 > 127.0.0.1.11150: Flags [.], cksum 0xfe28 (incorrect -> 0x0d35), seq 939, ack 47682, win 512, options [nop,nop,TS val 311956744 ecr 311956744], length 0
2022-04-06 07:21:14.243802 IP (tos 0x0, ttl 64, id 26019, offset 0, flags [DF], proto TCP (6), length 4100)
    127.0.0.1.11150 > 127.0.0.1.33068: Flags [P.], cksum 0x0df9 (incorrect -> 0xceb4), seq 47682:51730, ack 939, win 512, options [nop,nop,TS val 311956746 ecr 311956744], length 4048
2022-04-06 07:21:14.243837 IP (tos 0x0, ttl 64, id 61212, offset 0, flags [DF], proto TCP (6), length 52)
    127.0.0.1.33068 > 127.0.0.1.11150: Flags [.], cksum 0xfe28 (incorrect -> 0xfd60), seq 939, ack 51730, win 512, options [nop,nop,TS val 311956746 ecr 311956746], length 0
2022-04-06 07:21:14.243841 IP (tos 0x0, ttl 64, id 26020, offset 0, flags [DF], proto TCP (6), length 800)
    127.0.0.1.11150 > 127.0.0.1.33068: Flags [P.], cksum 0x0115 (incorrect -> 0x11ed), seq 51730:52478, ack 939, win 512, options [nop,nop,TS val 311956746 ecr 311956746], length 748
2022-04-06 07:21:14.243845 IP (tos 0x0, ttl 64, id 61213, offset 0, flags [DF], proto TCP (6), length 52)
    127.0.0.1.33068 > 127.0.0.1.11150: Flags [.], cksum 0xfe28 (incorrect -> 0xfa74), seq 939, ack 52478, win 512, options [nop,nop,TS val 311956746 ecr 311956746], length 0
2022-04-06 07:21:14.252073 IP (tos 0x0, ttl 64, id 26021, offset 0, flags [DF], proto TCP (6), length 2542)
    127.0.0.1.11150 > 127.0.0.1.33068: Flags [P.], cksum 0x07e3 (incorrect -> 0x5709), seq 52478:54968, ack 939, win 512, options [nop,nop,TS val 311956755 ecr 311956746], length 2490
2022-04-06 07:21:14.252566 IP (tos 0x0, ttl 64, id 61214, offset 0, flags [DF], proto TCP (6), length 52)
    127.0.0.1.33068 > 127.0.0.1.11150: Flags [.], cksum 0xfe28 (incorrect -> 0xf0a8), seq 939, ack 54968, win 512, options [nop,nop,TS val 311956755 ecr 311956755], length 0
2022-04-06 07:21:14.252571 IP (tos 0x0, ttl 64, id 26022, offset 0, flags [DF], proto TCP (6), length 3308)
    127.0.0.1.11150 > 127.0.0.1.33068: Flags [P.], cksum 0x0ae1 (incorrect -> 0x2ee7), seq 54968:58224, ack 939, win 512, options [nop,nop,TS val 311956755 ecr 311956755], length 3256
2022-04-06 07:21:14.252575 IP (tos 0x0, ttl 64, id 61215, offset 0, flags [DF], proto TCP (6), length 52)
    127.0.0.1.33068 > 127.0.0.1.11150: Flags [.], cksum 0xfe28 (incorrect -> 0xe3f0), seq 939, ack 58224, win 512, options [nop,nop,TS val 311956755 ecr 311956755], length 0
2022-04-06 07:21:14.252879 IP (tos 0x0, ttl 64, id 26023, offset 0, flags [DF], proto TCP (6), length 3446)
    127.0.0.1.11150 > 127.0.0.1.33068: Flags [P.], cksum 0x0b6b (incorrect -> 0x9244), seq 58224:61618, ack 939, win 512, options [nop,nop,TS val 311956755 ecr 311956755], length 3394
2022-04-06 07:21:14.252890 IP (tos 0x0, ttl 64, id 61216, offset 0, flags [DF], proto TCP (6), length 52)
    127.0.0.1.33068 > 127.0.0.1.11150: Flags [.], cksum 0xfe28 (incorrect -> 0xd6ae), seq 939, ack 61618, win 512, options [nop,nop,TS val 311956755 ecr 311956755], length 0
2022-04-06 07:21:14.255041 IP (tos 0x0, ttl 64, id 26024, offset 0, flags [DF], proto TCP (6), length 3492)
    127.0.0.1.11150 > 127.0.0.1.33068: Flags [P.], cksum 0x0b99 (incorrect -> 0x49c8), seq 61618:65058, ack 939, win 512, options [nop,nop,TS val 311956757 ecr 311956755], length 3440
2022-04-06 07:21:14.255405 IP (tos 0x0, ttl 64, id 61217, offset 0, flags [DF], proto TCP (6), length 52)
    127.0.0.1.33068 > 127.0.0.1.11150: Flags [.], cksum 0xfe28 (incorrect -> 0xc939), seq 939, ack 65058, win 512, options [nop,nop,TS val 311956758 ecr 311956757], length 0
2022-04-06 07:21:14.255411 IP (tos 0x0, ttl 64, id 26025, offset 0, flags [DF], proto TCP (6), length 3400)
    127.0.0.1.11150 > 127.0.0.1.33068: Flags [P.], cksum 0x0b3d (incorrect -> 0x8d17), seq 65058:68406, ack 939, win 512, options [nop,nop,TS val 311956758 ecr 311956758], length 3348
2022-04-06 07:21:14.255415 IP (tos 0x0, ttl 64, id 61218, offset 0, flags [DF], proto TCP (6), length 52)
    127.0.0.1.33068 > 127.0.0.1.11150: Flags [.], cksum 0xfe28 (incorrect -> 0xbc24), seq 939, ack 68406, win 512, options [nop,nop,TS val 311956758 ecr 311956758], length 0
2022-04-06 07:21:14.262289 IP (tos 0x0, ttl 64, id 26026, offset 0, flags [DF], proto TCP (6), length 1546)
    127.0.0.1.11150 > 127.0.0.1.33068: Flags [P.], cksum 0x03ff (incorrect -> 0xc3d0), seq 68406:69900, ack 939, win 512, options [nop,nop,TS val 311956765 ecr 311956758], length 1494
2022-04-06 07:21:14.263047 IP (tos 0x0, ttl 64, id 61219, offset 0, flags [DF], proto TCP (6), length 52)
    127.0.0.1.33068 > 127.0.0.1.11150: Flags [.], cksum 0xfe28 (incorrect -> 0xb640), seq 939, ack 69900, win 512, options [nop,nop,TS val 311956765 ecr 311956765], length 0
2022-04-06 07:21:14.264218 IP (tos 0x0, ttl 64, id 26027, offset 0, flags [DF], proto TCP (6), length 4100)
    127.0.0.1.11150 > 127.0.0.1.33068: Flags [P.], cksum 0x0df9 (incorrect -> 0xdda9), seq 69900:73948, ack 939, win 512, options [nop,nop,TS val 311956767 ecr 311956765], length 4048
2022-04-06 07:21:14.264236 IP (tos 0x0, ttl 64, id 61220, offset 0, flags [DF], proto TCP (6), length 52)
    127.0.0.1.33068 > 127.0.0.1.11150: Flags [.], cksum 0xfe28 (incorrect -> 0xa66c), seq 939, ack 73948, win 512, options [nop,nop,TS val 311956767 ecr 311956767], length 0
2022-04-06 07:21:14.264240 IP (tos 0x0, ttl 64, id 26028, offset 0, flags [DF], proto TCP (6), length 2746)
    127.0.0.1.11150 > 127.0.0.1.33068: Flags [P.], cksum 0x08af (incorrect -> 0xf037), seq 73948:76642, ack 939, win 512, options [nop,nop,TS val 311956767 ecr 311956767], length 2694
2022-04-06 07:21:14.264243 IP (tos 0x0, ttl 64, id 61221, offset 0, flags [DF], proto TCP (6), length 52)
    127.0.0.1.33068 > 127.0.0.1.11150: Flags [.], cksum 0xfe28 (incorrect -> 0x9be6), seq 939, ack 76642, win 512, options [nop,nop,TS val 311956767 ecr 311956767], length 0
2022-04-06 07:21:14.264370 IP (tos 0x0, ttl 64, id 26029, offset 0, flags [DF], proto TCP (6), length 1546)
    127.0.0.1.11150 > 127.0.0.1.33068: Flags [P.], cksum 0x03ff (incorrect -> 0x0ae4), seq 76642:78136, ack 939, win 512, options [nop,nop,TS val 311956767 ecr 311956767], length 1494
2022-04-06 07:21:14.264381 IP (tos 0x0, ttl 64, id 61222, offset 0, flags [DF], proto TCP (6), length 52)
    127.0.0.1.33068 > 127.0.0.1.11150: Flags [.], cksum 0xfe28 (incorrect -> 0x9610), seq 939, ack 78136, win 512, options [nop,nop,TS val 311956767 ecr 311956767], length 0
2022-04-06 07:21:14.269615 IP (tos 0x0, ttl 64, id 26030, offset 0, flags [DF], proto TCP (6), length 4100)
    127.0.0.1.11150 > 127.0.0.1.33068: Flags [P.], cksum 0x0df9 (incorrect -> 0x2139), seq 78136:82184, ack 939, win 512, options [nop,nop,TS val 311956772 ecr 311956767], length 4048
2022-04-06 07:21:14.269647 IP (tos 0x0, ttl 64, id 61223, offset 0, flags [DF], proto TCP (6), length 52)
    127.0.0.1.33068 > 127.0.0.1.11150: Flags [.], cksum 0xfe28 (incorrect -> 0x8636), seq 939, ack 82184, win 512, options [nop,nop,TS val 311956772 ecr 311956772], length 0
2022-04-06 07:21:14.269654 IP (tos 0x0, ttl 64, id 26031, offset 0, flags [DF], proto TCP (6), length 3198)
    127.0.0.1.11150 > 127.0.0.1.33068: Flags [P.], cksum 0x0a73 (incorrect -> 0x3569), seq 82184:85330, ack 939, win 512, options [nop,nop,TS val 311956772 ecr 311956772], length 3146
2022-04-06 07:21:14.269660 IP (tos 0x0, ttl 64, id 61224, offset 0, flags [DF], proto TCP (6), length 52)
    127.0.0.1.33068 > 127.0.0.1.11150: Flags [.], cksum 0xfe28 (incorrect -> 0x79ec), seq 939, ack 85330, win 512, options [nop,nop,TS val 311956772 ecr 311956772], length 0
2022-04-06 07:21:14.269833 IP (tos 0x0, ttl 64, id 26032, offset 0, flags [DF], proto TCP (6), length 4100)
    127.0.0.1.11150 > 127.0.0.1.33068: Flags [P.], cksum 0x0df9 (incorrect -> 0x0c55), seq 85330:89378, ack 939, win 512, options [nop,nop,TS val 311956772 ecr 311956772], length 4048
2022-04-06 07:21:14.270262 IP (tos 0x0, ttl 64, id 61225, offset 0, flags [DF], proto TCP (6), length 52)
    127.0.0.1.33068 > 127.0.0.1.11150: Flags [.], cksum 0xfe28 (incorrect -> 0x6a1b), seq 939, ack 89378, win 512, options [nop,nop,TS val 311956773 ecr 311956772], length 0
2022-04-06 07:21:14.270266 IP (tos 0x0, ttl 64, id 26033, offset 0, flags [DF], proto TCP (6), length 2248)
    127.0.0.1.11150 > 127.0.0.1.33068: Flags [P.], cksum 0x06bd (incorrect -> 0x0c00), seq 89378:91574, ack 939, win 512, options [nop,nop,TS val 311956773 ecr 311956773], length 2196
2022-04-06 07:21:14.270269 IP (tos 0x0, ttl 64, id 61226, offset 0, flags [DF], proto TCP (6), length 52)
    127.0.0.1.33068 > 127.0.0.1.11150: Flags [.], cksum 0xfe28 (incorrect -> 0x6186), seq 939, ack 91574, win 512, options [nop,nop,TS val 311956773 ecr 311956773], length 0
2022-04-06 07:21:14.278306 IP (tos 0x0, ttl 64, id 26034, offset 0, flags [DF], proto TCP (6), length 3538)
    127.0.0.1.11150 > 127.0.0.1.33068: Flags [P.], cksum 0x0bc7 (incorrect -> 0x99b1), seq 91574:95060, ack 939, win 512, options [nop,nop,TS val 311956781 ecr 311956773], length 3486
2022-04-06 07:21:14.278318 IP (tos 0x0, ttl 64, id 61227, offset 0, flags [DF], proto TCP (6), length 52)
    127.0.0.1.33068 > 127.0.0.1.11150: Flags [.], cksum 0xfe28 (incorrect -> 0x53d8), seq 939, ack 95060, win 512, options [nop,nop,TS val 311956781 ecr 311956781], length 0
2022-04-06 07:21:14.279926 IP (tos 0x0, ttl 64, id 26035, offset 0, flags [DF], proto TCP (6), length 2044)
    127.0.0.1.11150 > 127.0.0.1.33068: Flags [P.], cksum 0x05f1 (incorrect -> 0xcaa7), seq 95060:97052, ack 939, win 512, options [nop,nop,TS val 311956782 ecr 311956781], length 1992
2022-04-06 07:21:14.279938 IP (tos 0x0, ttl 64, id 61228, offset 0, flags [DF], proto TCP (6), length 52)
    127.0.0.1.33068 > 127.0.0.1.11150: Flags [.], cksum 0xfe28 (incorrect -> 0x4c0e), seq 939, ack 97052, win 512, options [nop,nop,TS val 311956782 ecr 311956782], length 0
2022-04-06 07:21:14.285040 IP (tos 0x0, ttl 64, id 26036, offset 0, flags [DF], proto TCP (6), length 3760)
    127.0.0.1.11150 > 127.0.0.1.33068: Flags [P.], cksum 0x0ca5 (incorrect -> 0x879f), seq 97052:100760, ack 939, win 512, options [nop,nop,TS val 311956787 ecr 311956782], length 3708
2022-04-06 07:21:14.285053 IP (tos 0x0, ttl 64, id 61229, offset 0, flags [DF], proto TCP (6), length 52)
    127.0.0.1.33068 > 127.0.0.1.11150: Flags [.], cksum 0xfe28 (incorrect -> 0x3d88), seq 939, ack 100760, win 512, options [nop,nop,TS val 311956787 ecr 311956787], length 0
2022-04-06 07:21:14.286709 IP (tos 0x0, ttl 64, id 26037, offset 0, flags [DF], proto TCP (6), length 4100)
    127.0.0.1.11150 > 127.0.0.1.33068: Flags [P.], cksum 0x0df9 (incorrect -> 0xa79d), seq 100760:104808, ack 939, win 512, options [nop,nop,TS val 311956789 ecr 311956787], length 4048
2022-04-06 07:21:14.287434 IP (tos 0x0, ttl 64, id 61230, offset 0, flags [DF], proto TCP (6), length 52)
    127.0.0.1.33068 > 127.0.0.1.11150: Flags [.], cksum 0xfe28 (incorrect -> 0x2db3), seq 939, ack 104808, win 512, options [nop,nop,TS val 311956790 ecr 311956789], length 0
2022-04-06 07:21:14.287439 IP (tos 0x0, ttl 64, id 26038, offset 0, flags [DF], proto TCP (6), length 9626)
    127.0.0.1.11150 > 127.0.0.1.33068: Flags [P.], cksum 0x238f (incorrect -> 0xad50), seq 104808:114382, ack 939, win 512, options [nop,nop,TS val 311956790 ecr 311956790], length 9574
2022-04-06 07:21:14.318182 IP (tos 0x0, ttl 64, id 26039, offset 0, flags [DF], proto TCP (6), length 32820)
    127.0.0.1.11150 > 127.0.0.1.33068: Flags [.], cksum 0x7e29 (incorrect -> 0x2d8f), seq 114382:147150, ack 939, win 512, options [nop,nop,TS val 311956821 ecr 311956790], length 32768
2022-04-06 07:21:14.318826 IP (tos 0x0, ttl 64, id 61231, offset 0, flags [DF], proto TCP (6), length 52)
    127.0.0.1.33068 > 127.0.0.1.11150: Flags [.], cksum 0xfe28 (incorrect -> 0x88b1), seq 939, ack 147150, win 379, options [nop,nop,TS val 311956821 ecr 311956790], length 0
2022-04-06 07:21:14.318863 IP (tos 0x0, ttl 64, id 26040, offset 0, flags [DF], proto TCP (6), length 542)
    127.0.0.1.11150 > 127.0.0.1.33068: Flags [P.], cksum 0x0013 (incorrect -> 0xc5d1), seq 147150:147640, ack 939, win 512, options [nop,nop,TS val 311956821 ecr 311956821], length 490
2022-04-06 07:21:14.320773 IP (tos 0x0, ttl 64, id 61232, offset 0, flags [DF], proto TCP (6), length 52)
    127.0.0.1.33068 > 127.0.0.1.11150: Flags [.], cksum 0xfe28 (incorrect -> 0x8621), seq 939, ack 147640, win 512, options [nop,nop,TS val 311956823 ecr 311956821], length 0
2022-04-06 07:21:14.320785 IP (tos 0x0, ttl 64, id 26041, offset 0, flags [DF], proto TCP (6), length 9782)
    127.0.0.1.11150 > 127.0.0.1.33068: Flags [P.], cksum 0x242b (incorrect -> 0xb055), seq 147640:157370, ack 939, win 512, options [nop,nop,TS val 311956823 ecr 311956823], length 9730
2022-04-06 07:21:14.321252 IP (tos 0x0, ttl 64, id 61233, offset 0, flags [DF], proto TCP (6), length 52)
    127.0.0.1.33068 > 127.0.0.1.11150: Flags [.], cksum 0xfe28 (incorrect -> 0x601c), seq 939, ack 157370, win 512, options [nop,nop,TS val 311956824 ecr 311956823], length 0
2022-04-06 07:21:14.323179 IP (tos 0x0, ttl 64, id 26042, offset 0, flags [DF], proto TCP (6), length 4100)
    127.0.0.1.11150 > 127.0.0.1.33068: Flags [P.], cksum 0x0df9 (incorrect -> 0xdaca), seq 157370:161418, ack 939, win 512, options [nop,nop,TS val 311956826 ecr 311956824], length 4048
2022-04-06 07:21:14.323406 IP (tos 0x0, ttl 64, id 61234, offset 0, flags [DF], proto TCP (6), length 52)
    127.0.0.1.33068 > 127.0.0.1.11150: Flags [.], cksum 0xfe28 (incorrect -> 0x5047), seq 939, ack 161418, win 512, options [nop,nop,TS val 311956826 ecr 311956826], length 0
2022-04-06 07:21:14.323410 IP (tos 0x0, ttl 64, id 26043, offset 0, flags [DF], proto TCP (6), length 256)
    127.0.0.1.11150 > 127.0.0.1.33068: Flags [P.], cksum 0xfef4 (incorrect -> 0x01ea), seq 161418:161622, ack 939, win 512, options [nop,nop,TS val 311956826 ecr 311956826], length 204
2022-04-06 07:21:14.323425 IP (tos 0x0, ttl 64, id 61235, offset 0, flags [DF], proto TCP (6), length 52)
    127.0.0.1.33068 > 127.0.0.1.11150: Flags [.], cksum 0xfe28 (incorrect -> 0x4f7b), seq 939, ack 161622, win 512, options [nop,nop,TS val 311956826 ecr 311956826], length 0
2022-04-06 07:21:14.326805 IP (tos 0x0, ttl 64, id 26044, offset 0, flags [DF], proto TCP (6), length 1546)
    127.0.0.1.11150 > 127.0.0.1.33068: Flags [P.], cksum 0x03ff (incorrect -> 0x9e49), seq 161622:163116, ack 939, win 512, options [nop,nop,TS val 311956829 ecr 311956826], length 1494
2022-04-06 07:21:14.326827 IP (tos 0x0, ttl 64, id 61236, offset 0, flags [DF], proto TCP (6), length 52)
    127.0.0.1.33068 > 127.0.0.1.11150: Flags [.], cksum 0xfe28 (incorrect -> 0x499f), seq 939, ack 163116, win 512, options [nop,nop,TS val 311956829 ecr 311956829], length 0
2022-04-06 07:21:14.328427 IP (tos 0x0, ttl 64, id 26045, offset 0, flags [DF], proto TCP (6), length 3538)
    127.0.0.1.11150 > 127.0.0.1.33068: Flags [P.], cksum 0x0bc7 (incorrect -> 0x9a9f), seq 163116:166602, ack 939, win 512, options [nop,nop,TS val 311956831 ecr 311956829], length 3486
2022-04-06 07:21:14.328609 IP (tos 0x0, ttl 64, id 61237, offset 0, flags [DF], proto TCP (6), length 52)
    127.0.0.1.33068 > 127.0.0.1.11150: Flags [.], cksum 0xfe28 (incorrect -> 0x3bfd), seq 939, ack 166602, win 512, options [nop,nop,TS val 311956831 ecr 311956831], length 0
2022-04-06 07:21:14.330662 IP (tos 0x0, ttl 64, id 26046, offset 0, flags [DF], proto TCP (6), length 2044)
    127.0.0.1.11150 > 127.0.0.1.33068: Flags [P.], cksum 0x05f1 (incorrect -> 0x5a6f), seq 166602:168594, ack 939, win 512, options [nop,nop,TS val 311956833 ecr 311956831], length 1992
2022-04-06 07:21:14.330687 IP (tos 0x0, ttl 64, id 61238, offset 0, flags [DF], proto TCP (6), length 52)
    127.0.0.1.33068 > 127.0.0.1.11150: Flags [.], cksum 0xfe28 (incorrect -> 0x3431), seq 939, ack 168594, win 512, options [nop,nop,TS val 311956833 ecr 311956833], length 0
2022-04-06 07:21:14.335432 IP (tos 0x0, ttl 64, id 26047, offset 0, flags [DF], proto TCP (6), length 4100)
    127.0.0.1.11150 > 127.0.0.1.33068: Flags [P.], cksum 0x0df9 (incorrect -> 0x5bd6), seq 168594:172642, ack 939, win 512, options [nop,nop,TS val 311956838 ecr 311956833], length 4048
2022-04-06 07:21:14.335470 IP (tos 0x0, ttl 64, id 61239, offset 0, flags [DF], proto TCP (6), length 52)
    127.0.0.1.33068 > 127.0.0.1.11150: Flags [.], cksum 0xfe28 (incorrect -> 0x2457), seq 939, ack 172642, win 512, options [nop,nop,TS val 311956838 ecr 311956838], length 0
2022-04-06 07:21:14.335473 IP (tos 0x0, ttl 64, id 26048, offset 0, flags [DF], proto TCP (6), length 2018)
    127.0.0.1.11150 > 127.0.0.1.33068: Flags [P.], cksum 0x05d7 (incorrect -> 0x065a), seq 172642:174608, ack 939, win 512, options [nop,nop,TS val 311956838 ecr 311956838], length 1966
2022-04-06 07:21:14.335485 IP (tos 0x0, ttl 64, id 61240, offset 0, flags [DF], proto TCP (6), length 52)
    127.0.0.1.33068 > 127.0.0.1.11150: Flags [.], cksum 0xfe28 (incorrect -> 0x1ca9), seq 939, ack 174608, win 512, options [nop,nop,TS val 311956838 ecr 311956838], length 0
2022-04-06 07:21:14.337471 IP (tos 0x0, ttl 64, id 26049, offset 0, flags [DF], proto TCP (6), length 4100)
    127.0.0.1.11150 > 127.0.0.1.33068: Flags [P.], cksum 0x0df9 (incorrect -> 0xaba6), seq 174608:178656, ack 939, win 512, options [nop,nop,TS val 311956840 ecr 311956838], length 4048
2022-04-06 07:21:14.338265 IP (tos 0x0, ttl 64, id 61241, offset 0, flags [DF], proto TCP (6), length 52)
    127.0.0.1.33068 > 127.0.0.1.11150: Flags [.], cksum 0xfe28 (incorrect -> 0x0cd4), seq 939, ack 178656, win 512, options [nop,nop,TS val 311956841 ecr 311956840], length 0
2022-04-06 07:21:14.338280 IP (tos 0x0, ttl 64, id 26050, offset 0, flags [DF], proto TCP (6), length 6186)
    127.0.0.1.11150 > 127.0.0.1.33068: Flags [P.], cksum 0x161f (incorrect -> 0x470d), seq 178656:184790, ack 939, win 512, options [nop,nop,TS val 311956841 ecr 311956841], length 6134
2022-04-06 07:21:14.338307 IP (tos 0x0, ttl 64, id 61242, offset 0, flags [DF], proto TCP (6), length 52)
    127.0.0.1.33068 > 127.0.0.1.11150: Flags [.], cksum 0xfe28 (incorrect -> 0xf4dc), seq 939, ack 184790, win 512, options [nop,nop,TS val 311956841 ecr 311956841], length 0
2022-04-06 07:21:14.344529 IP (tos 0x0, ttl 64, id 26051, offset 0, flags [DF], proto TCP (6), length 2542)
    127.0.0.1.11150 > 127.0.0.1.33068: Flags [P.], cksum 0x07e3 (incorrect -> 0x6356), seq 184790:187280, ack 939, win 512, options [nop,nop,TS val 311956847 ecr 311956841], length 2490
2022-04-06 07:21:14.345212 IP (tos 0x0, ttl 64, id 61243, offset 0, flags [DF], proto TCP (6), length 52)
    127.0.0.1.33068 > 127.0.0.1.11150: Flags [.], cksum 0xfe28 (incorrect -> 0xeb15), seq 939, ack 187280, win 512, options [nop,nop,TS val 311956848 ecr 311956847], length 0
2022-04-06 07:21:14.346145 IP (tos 0x0, ttl 64, id 26052, offset 0, flags [DF], proto TCP (6), length 1546)
    127.0.0.1.11150 > 127.0.0.1.33068: Flags [P.], cksum 0x03ff (incorrect -> 0x4bfd), seq 187280:188774, ack 939, win 512, options [nop,nop,TS val 311956849 ecr 311956848], length 1494
2022-04-06 07:21:14.346158 IP (tos 0x0, ttl 64, id 61244, offset 0, flags [DF], proto TCP (6), length 52)
    127.0.0.1.33068 > 127.0.0.1.11150: Flags [.], cksum 0xfe28 (incorrect -> 0xe53c), seq 939, ack 188774, win 512, options [nop,nop,TS val 311956849 ecr 311956849], length 0
2022-04-06 07:21:14.347467 IP (tos 0x0, ttl 64, id 26053, offset 0, flags [DF], proto TCP (6), length 2542)
    127.0.0.1.11150 > 127.0.0.1.33068: Flags [P.], cksum 0x07e3 (incorrect -> 0xb517), seq 188774:191264, ack 939, win 512, options [nop,nop,TS val 311956850 ecr 311956849], length 2490
2022-04-06 07:21:14.347615 IP (tos 0x0, ttl 64, id 61245, offset 0, flags [DF], proto TCP (6), length 52)
    127.0.0.1.33068 > 127.0.0.1.11150: Flags [.], cksum 0xfe28 (incorrect -> 0xdb80), seq 939, ack 191264, win 512, options [nop,nop,TS val 311956850 ecr 311956850], length 0
2022-04-06 07:21:14.352014 IP (tos 0x0, ttl 64, id 26054, offset 0, flags [DF], proto TCP (6), length 4100)
    127.0.0.1.11150 > 127.0.0.1.33068: Flags [P.], cksum 0x0df9 (incorrect -> 0xb6cc), seq 191264:195312, ack 939, win 512, options [nop,nop,TS val 311956854 ecr 311956850], length 4048
2022-04-06 07:21:14.352079 IP (tos 0x0, ttl 64, id 61246, offset 0, flags [DF], proto TCP (6), length 52)
    127.0.0.1.33068 > 127.0.0.1.11150: Flags [.], cksum 0xfe28 (incorrect -> 0xcba7), seq 939, ack 195312, win 512, options [nop,nop,TS val 311956855 ecr 311956854], length 0
2022-04-06 07:21:14.352087 IP (tos 0x0, ttl 64, id 26055, offset 0, flags [DF], proto TCP (6), length 2478)
    127.0.0.1.11150 > 127.0.0.1.33068: Flags [P.], cksum 0x07a3 (incorrect -> 0xea26), seq 195312:197738, ack 939, win 512, options [nop,nop,TS val 311956855 ecr 311956855], length 2426
2022-04-06 07:21:14.352382 IP (tos 0x0, ttl 64, id 61247, offset 0, flags [DF], proto TCP (6), length 52)
    127.0.0.1.33068 > 127.0.0.1.11150: Flags [.], cksum 0xfe28 (incorrect -> 0xc22c), seq 939, ack 197738, win 512, options [nop,nop,TS val 311956855 ecr 311956855], length 0
2022-04-06 07:21:14.354028 IP (tos 0x0, ttl 64, id 26056, offset 0, flags [DF], proto TCP (6), length 4100)
    127.0.0.1.11150 > 127.0.0.1.33068: Flags [P.], cksum 0x0df9 (incorrect -> 0x7804), seq 197738:201786, ack 939, win 512, options [nop,nop,TS val 311956856 ecr 311956855], length 4048
2022-04-06 07:21:14.354235 IP (tos 0x0, ttl 64, id 61248, offset 0, flags [DF], proto TCP (6), length 52)
    127.0.0.1.33068 > 127.0.0.1.11150: Flags [.], cksum 0xfe28 (incorrect -> 0xb259), seq 939, ack 201786, win 512, options [nop,nop,TS val 311956857 ecr 311956856], length 0
2022-04-06 07:21:14.354244 IP (tos 0x0, ttl 64, id 26057, offset 0, flags [DF], proto TCP (6), length 7856)
    127.0.0.1.11150 > 127.0.0.1.33068: Flags [P.], cksum 0x1ca5 (incorrect -> 0xb8ac), seq 201786:209590, ack 939, win 512, options [nop,nop,TS val 311956857 ecr 311956857], length 7804
2022-04-06 07:21:14.354278 IP (tos 0x0, ttl 64, id 61249, offset 0, flags [DF], proto TCP (6), length 52)
    127.0.0.1.33068 > 127.0.0.1.11150: Flags [.], cksum 0xfe28 (incorrect -> 0x93dc), seq 939, ack 209590, win 512, options [nop,nop,TS val 311956857 ecr 311956857], length 0
2022-04-06 07:21:14.361490 IP (tos 0x0, ttl 64, id 26058, offset 0, flags [DF], proto TCP (6), length 4036)
    127.0.0.1.11150 > 127.0.0.1.33068: Flags [P.], cksum 0x0db9 (incorrect -> 0x23f0), seq 209590:213574, ack 939, win 512, options [nop,nop,TS val 311956864 ecr 311956857], length 3984
2022-04-06 07:21:14.362225 IP (tos 0x0, ttl 64, id 61250, offset 0, flags [DF], proto TCP (6), length 52)
    127.0.0.1.33068 > 127.0.0.1.11150: Flags [.], cksum 0xfe28 (incorrect -> 0x843d), seq 939, ack 213574, win 512, options [nop,nop,TS val 311956865 ecr 311956864], length 0
2022-04-06 07:21:14.363231 IP (tos 0x0, ttl 64, id 26059, offset 0, flags [DF], proto TCP (6), length 3040)
    127.0.0.1.11150 > 127.0.0.1.33068: Flags [P.], cksum 0x09d5 (incorrect -> 0x79ba), seq 213574:216562, ack 939, win 512, options [nop,nop,TS val 311956866 ecr 311956865], length 2988
2022-04-06 07:21:14.363257 IP (tos 0x0, ttl 64, id 61251, offset 0, flags [DF], proto TCP (6), length 52)
    127.0.0.1.33068 > 127.0.0.1.11150: Flags [.], cksum 0xfe28 (incorrect -> 0x788e), seq 939, ack 216562, win 512, options [nop,nop,TS val 311956866 ecr 311956866], length 0
2022-04-06 07:21:14.365065 IP (tos 0x0, ttl 64, id 26060, offset 0, flags [DF], proto TCP (6), length 2442)
    127.0.0.1.11150 > 127.0.0.1.33068: Flags [P.], cksum 0x077f (incorrect -> 0x95bd), seq 216562:218952, ack 939, win 512, options [nop,nop,TS val 311956868 ecr 311956866], length 2390
2022-04-06 07:21:14.365107 IP (tos 0x0, ttl 64, id 61252, offset 0, flags [DF], proto TCP (6), length 52)
    127.0.0.1.33068 > 127.0.0.1.11150: Flags [.], cksum 0xfe28 (incorrect -> 0x6f34), seq 939, ack 218952, win 512, options [nop,nop,TS val 311956868 ecr 311956868], length 0
2022-04-06 07:21:14.365207 IP (tos 0x0, ttl 64, id 26061, offset 0, flags [DF], proto TCP (6), length 3538)
    127.0.0.1.11150 > 127.0.0.1.33068: Flags [P.], cksum 0x0bc7 (incorrect -> 0xb9bf), seq 218952:222438, ack 939, win 512, options [nop,nop,TS val 311956868 ecr 311956868], length 3486
2022-04-06 07:21:14.365939 IP (tos 0x0, ttl 64, id 61253, offset 0, flags [DF], proto TCP (6), length 52)
    127.0.0.1.33068 > 127.0.0.1.11150: Flags [.], cksum 0xfe28 (incorrect -> 0x6196), seq 939, ack 222438, win 512, options [nop,nop,TS val 311956868 ecr 311956868], length 0
2022-04-06 07:21:14.368128 IP (tos 0x0, ttl 64, id 26062, offset 0, flags [DF], proto TCP (6), length 1048)
    127.0.0.1.11150 > 127.0.0.1.33068: Flags [P.], cksum 0x020d (incorrect -> 0x76aa), seq 222438:223434, ack 939, win 512, options [nop,nop,TS val 311956871 ecr 311956868], length 996
2022-04-06 07:21:14.368140 IP (tos 0x0, ttl 64, id 61254, offset 0, flags [DF], proto TCP (6), length 52)
    127.0.0.1.33068 > 127.0.0.1.11150: Flags [.], cksum 0xfe28 (incorrect -> 0x5dac), seq 939, ack 223434, win 512, options [nop,nop,TS val 311956871 ecr 311956871], length 0
2022-04-06 07:21:14.369242 IP (tos 0x0, ttl 64, id 26063, offset 0, flags [DF], proto TCP (6), length 3538)
    127.0.0.1.11150 > 127.0.0.1.33068: Flags [P.], cksum 0x0bc7 (incorrect -> 0x4552), seq 223434:226920, ack 939, win 512, options [nop,nop,TS val 311956872 ecr 311956871], length 3486
2022-04-06 07:21:14.369407 IP (tos 0x0, ttl 64, id 61255, offset 0, flags [DF], proto TCP (6), length 52)
    127.0.0.1.33068 > 127.0.0.1.11150: Flags [.], cksum 0xfe28 (incorrect -> 0x500c), seq 939, ack 226920, win 512, options [nop,nop,TS val 311956872 ecr 311956872], length 0
2022-04-06 07:21:14.371659 IP (tos 0x0, ttl 64, id 26064, offset 0, flags [DF], proto TCP (6), length 4100)
    127.0.0.1.11150 > 127.0.0.1.33068: Flags [P.], cksum 0x0df9 (incorrect -> 0xc40d), seq 226920:230968, ack 939, win 512, options [nop,nop,TS val 311956874 ecr 311956872], length 4048
2022-04-06 07:21:14.371903 IP (tos 0x0, ttl 64, id 61256, offset 0, flags [DF], proto TCP (6), length 52)
    127.0.0.1.33068 > 127.0.0.1.11150: Flags [.], cksum 0xfe28 (incorrect -> 0x4038), seq 939, ack 230968, win 512, options [nop,nop,TS val 311956874 ecr 311956874], length 0
200, 6.844746828079224, 0.574920654296875