2022-04-06 03:39:30.426569 IP (tos 0x0, ttl 64, id 5683, offset 0, flags [DF], proto TCP (6), length 60)
    127.0.0.1.46524 > 127.0.0.1.9950: Flags [S], cksum 0xfe30 (incorrect -> 0x58d3), seq 3189388715, win 65495, options [mss 65495,sackOK,TS val 298652929 ecr 0,nop,wscale 7], length 0
2022-04-06 03:39:30.426578 IP (tos 0x0, ttl 64, id 0, offset 0, flags [DF], proto TCP (6), length 60)
    127.0.0.1.9950 > 127.0.0.1.46524: Flags [S.], cksum 0xfe30 (incorrect -> 0x6a85), seq 2284863306, ack 3189388716, win 65483, options [mss 65495,sackOK,TS val 298652929 ecr 298652929,nop,wscale 7], length 0
2022-04-06 03:39:30.426586 IP (tos 0x0, ttl 64, id 5684, offset 0, flags [DF], proto TCP (6), length 52)
    127.0.0.1.46524 > 127.0.0.1.9950: Flags [.], cksum 0xfe28 (incorrect -> 0x9141), seq 1, ack 1, win 512, options [nop,nop,TS val 298652929 ecr 298652929], length 0
2022-04-06 03:39:30.426708 IP (tos 0x0, ttl 64, id 5685, offset 0, flags [DF], proto TCP (6), length 55)
    127.0.0.1.46524 > 127.0.0.1.9950: Flags [P.], cksum 0xfe2b (incorrect -> 0x8c35), seq 1:4, ack 1, win 512, options [nop,nop,TS val 298652929 ecr 298652929], length 3
2022-04-06 03:39:30.426712 IP (tos 0x0, ttl 64, id 37319, offset 0, flags [DF], proto TCP (6), length 52)
    127.0.0.1.9950 > 127.0.0.1.46524: Flags [.], cksum 0xfe28 (incorrect -> 0x913e), seq 1, ack 4, win 512, options [nop,nop,TS val 298652929 ecr 298652929], length 0
2022-04-06 03:39:30.426837 IP (tos 0x0, ttl 64, id 37320, offset 0, flags [DF], proto TCP (6), length 54)
    127.0.0.1.9950 > 127.0.0.1.46524: Flags [P.], cksum 0xfe2a (incorrect -> 0x8c34), seq 1:3, ack 4, win 512, options [nop,nop,TS val 298652929 ecr 298652929], length 2
2022-04-06 03:39:30.426862 IP (tos 0x0, ttl 64, id 5686, offset 0, flags [DF], proto TCP (6), length 52)
    127.0.0.1.46524 > 127.0.0.1.9950: Flags [.], cksum 0xfe28 (incorrect -> 0x913c), seq 4, ack 3, win 512, options [nop,nop,TS val 298652929 ecr 298652929], length 0
2022-04-06 03:39:30.428175 IP (tos 0x0, ttl 64, id 5687, offset 0, flags [DF], proto TCP (6), length 62)
    127.0.0.1.46524 > 127.0.0.1.9950: Flags [P.], cksum 0xfe32 (incorrect -> 0x6a3b), seq 4:14, ack 3, win 512, options [nop,nop,TS val 298652931 ecr 298652929], length 10
2022-04-06 03:39:30.428194 IP (tos 0x0, ttl 64, id 37321, offset 0, flags [DF], proto TCP (6), length 52)
    127.0.0.1.9950 > 127.0.0.1.46524: Flags [.], cksum 0xfe28 (incorrect -> 0x912e), seq 3, ack 14, win 512, options [nop,nop,TS val 298652931 ecr 298652931], length 0
2022-04-06 03:39:30.502748 IP (tos 0x0, ttl 64, id 37322, offset 0, flags [DF], proto TCP (6), length 62)
    127.0.0.1.9950 > 127.0.0.1.46524: Flags [P.], cksum 0xfe32 (incorrect -> 0x8bd1), seq 3:13, ack 14, win 512, options [nop,nop,TS val 298653005 ecr 298652931], length 10
2022-04-06 03:39:30.502754 IP (tos 0x0, ttl 64, id 5688, offset 0, flags [DF], proto TCP (6), length 52)
    127.0.0.1.46524 > 127.0.0.1.9950: Flags [.], cksum 0xfe28 (incorrect -> 0x9090), seq 14, ack 13, win 512, options [nop,nop,TS val 298653005 ecr 298653005], length 0
2022-04-06 03:39:30.508257 IP (tos 0x0, ttl 64, id 5689, offset 0, flags [DF], proto TCP (6), length 569)
    127.0.0.1.46524 > 127.0.0.1.9950: Flags [P.], cksum 0x002e (incorrect -> 0x2659), seq 14:531, ack 13, win 512, options [nop,nop,TS val 298653011 ecr 298653005], length 517
2022-04-06 03:39:30.508274 IP (tos 0x0, ttl 64, id 37323, offset 0, flags [DF], proto TCP (6), length 52)
    127.0.0.1.9950 > 127.0.0.1.46524: Flags [.], cksum 0xfe28 (incorrect -> 0x8e83), seq 13, ack 531, win 508, options [nop,nop,TS val 298653011 ecr 298653011], length 0
2022-04-06 03:39:30.579307 IP (tos 0x0, ttl 64, id 37324, offset 0, flags [DF], proto TCP (6), length 3538)
    127.0.0.1.9950 > 127.0.0.1.46524: Flags [P.], cksum 0x0bc7 (incorrect -> 0xc025), seq 13:3499, ack 531, win 512, options [nop,nop,TS val 298653082 ecr 298653011], length 3486
2022-04-06 03:39:30.579314 IP (tos 0x0, ttl 64, id 5690, offset 0, flags [DF], proto TCP (6), length 52)
    127.0.0.1.46524 > 127.0.0.1.9950: Flags [.], cksum 0xfe28 (incorrect -> 0x8065), seq 531, ack 3499, win 494, options [nop,nop,TS val 298653082 ecr 298653082], length 0
2022-04-06 03:39:30.597243 IP (tos 0x0, ttl 64, id 37325, offset 0, flags [DF], proto TCP (6), length 662)
    127.0.0.1.9950 > 127.0.0.1.46524: Flags [P.], cksum 0x008b (incorrect -> 0x5b88), seq 3499:4109, ack 531, win 512, options [nop,nop,TS val 298653100 ecr 298653082], length 610
2022-04-06 03:39:30.597249 IP (tos 0x0, ttl 64, id 5691, offset 0, flags [DF], proto TCP (6), length 52)
    127.0.0.1.46524 > 127.0.0.1.9950: Flags [.], cksum 0xfe28 (incorrect -> 0x7dd4), seq 531, ack 4109, win 505, options [nop,nop,TS val 298653100 ecr 298653100], length 0
2022-04-06 03:39:30.661556 IP (tos 0x0, ttl 64, id 37326, offset 0, flags [DF], proto TCP (6), length 738)
    127.0.0.1.9950 > 127.0.0.1.46524: Flags [P.], cksum 0x00d7 (incorrect -> 0x7732), seq 4109:4795, ack 531, win 512, options [nop,nop,TS val 298653164 ecr 298653100], length 686
2022-04-06 03:39:30.661561 IP (tos 0x0, ttl 64, id 5692, offset 0, flags [DF], proto TCP (6), length 52)
    127.0.0.1.46524 > 127.0.0.1.9950: Flags [.], cksum 0xfe28 (incorrect -> 0x7aa6), seq 531, ack 4795, win 505, options [nop,nop,TS val 298653164 ecr 298653164], length 0
2022-04-06 03:39:30.661983 IP (tos 0x0, ttl 64, id 5693, offset 0, flags [DF], proto TCP (6), length 132)
    127.0.0.1.46524 > 127.0.0.1.9950: Flags [P.], cksum 0xfe78 (incorrect -> 0x8239), seq 531:611, ack 4795, win 512, options [nop,nop,TS val 298653164 ecr 298653164], length 80
2022-04-06 03:39:30.661990 IP (tos 0x0, ttl 64, id 37327, offset 0, flags [DF], proto TCP (6), length 52)
    127.0.0.1.9950 > 127.0.0.1.46524: Flags [.], cksum 0xfe28 (incorrect -> 0x7a4f), seq 4795, ack 611, win 512, options [nop,nop,TS val 298653164 ecr 298653164], length 0
2022-04-06 03:39:30.662313 IP (tos 0x0, ttl 64, id 5694, offset 0, flags [DF], proto TCP (6), length 371)
    127.0.0.1.46524 > 127.0.0.1.9950: Flags [P.], cksum 0xff67 (incorrect -> 0x5f5c), seq 611:930, ack 4795, win 512, options [nop,nop,TS val 298653165 ecr 298653164], length 319
2022-04-06 03:39:30.662317 IP (tos 0x0, ttl 64, id 37328, offset 0, flags [DF], proto TCP (6), length 52)
    127.0.0.1.9950 > 127.0.0.1.46524: Flags [.], cksum 0xfe28 (incorrect -> 0x7910), seq 4795, ack 930, win 510, options [nop,nop,TS val 298653165 ecr 298653165], length 0
2022-04-06 03:39:30.739540 IP (tos 0x0, ttl 64, id 37329, offset 0, flags [DF], proto TCP (6), length 594)
    127.0.0.1.9950 > 127.0.0.1.46524: Flags [P.], cksum 0x0047 (incorrect -> 0xf2ee), seq 4795:5337, ack 930, win 512, options [nop,nop,TS val 298653242 ecr 298653165], length 542
2022-04-06 03:39:30.739547 IP (tos 0x0, ttl 64, id 5695, offset 0, flags [DF], proto TCP (6), length 52)
    127.0.0.1.46524 > 127.0.0.1.9950: Flags [.], cksum 0xfe28 (incorrect -> 0x765a), seq 930, ack 5337, win 508, options [nop,nop,TS val 298653242 ecr 298653242], length 0
2022-04-06 03:39:30.754358 IP (tos 0x0, ttl 64, id 37330, offset 0, flags [DF], proto TCP (6), length 3538)
    127.0.0.1.9950 > 127.0.0.1.46524: Flags [P.], cksum 0x0bc7 (incorrect -> 0x0fa4), seq 5337:8823, ack 930, win 512, options [nop,nop,TS val 298653257 ecr 298653242], length 3486
2022-04-06 03:39:30.754364 IP (tos 0x0, ttl 64, id 5696, offset 0, flags [DF], proto TCP (6), length 52)
    127.0.0.1.46524 > 127.0.0.1.9950: Flags [.], cksum 0xfe28 (incorrect -> 0x68ac), seq 930, ack 8823, win 494, options [nop,nop,TS val 298653257 ecr 298653257], length 0
2022-04-06 03:39:30.755816 IP (tos 0x0, ttl 64, id 37331, offset 0, flags [DF], proto TCP (6), length 4036)
    127.0.0.1.9950 > 127.0.0.1.46524: Flags [P.], cksum 0x0db9 (incorrect -> 0xd678), seq 8823:12807, ack 930, win 512, options [nop,nop,TS val 298653258 ecr 298653257], length 3984
2022-04-06 03:39:30.755820 IP (tos 0x0, ttl 64, id 5697, offset 0, flags [DF], proto TCP (6), length 52)
    127.0.0.1.46524 > 127.0.0.1.9950: Flags [.], cksum 0xfe28 (incorrect -> 0x591c), seq 930, ack 12807, win 492, options [nop,nop,TS val 298653258 ecr 298653258], length 0
2022-04-06 03:39:30.772109 IP (tos 0x0, ttl 64, id 37332, offset 0, flags [DF], proto TCP (6), length 4036)
    127.0.0.1.9950 > 127.0.0.1.46524: Flags [P.], cksum 0x0db9 (incorrect -> 0xa8b4), seq 12807:16791, ack 930, win 512, options [nop,nop,TS val 298653275 ecr 298653258], length 3984
2022-04-06 03:39:30.772115 IP (tos 0x0, ttl 64, id 5698, offset 0, flags [DF], proto TCP (6), length 52)
    127.0.0.1.46524 > 127.0.0.1.9950: Flags [.], cksum 0xfe28 (incorrect -> 0x496a), seq 930, ack 16791, win 492, options [nop,nop,TS val 298653275 ecr 298653275], length 0
2022-04-06 03:39:30.780016 IP (tos 0x0, ttl 64, id 37333, offset 0, flags [DF], proto TCP (6), length 3538)
    127.0.0.1.9950 > 127.0.0.1.46524: Flags [P.], cksum 0x0bc7 (incorrect -> 0x500d), seq 16791:20277, ack 930, win 512, options [nop,nop,TS val 298653282 ecr 298653275], length 3486
2022-04-06 03:39:30.780020 IP (tos 0x0, ttl 64, id 5699, offset 0, flags [DF], proto TCP (6), length 52)
    127.0.0.1.46524 > 127.0.0.1.9950: Flags [.], cksum 0xfe28 (incorrect -> 0x3bbc), seq 930, ack 20277, win 494, options [nop,nop,TS val 298653282 ecr 298653282], length 0
2022-04-06 03:39:30.782712 IP (tos 0x0, ttl 64, id 37334, offset 0, flags [DF], proto TCP (6), length 1048)
    127.0.0.1.9950 > 127.0.0.1.46524: Flags [P.], cksum 0x020d (incorrect -> 0x0249), seq 20277:21273, ack 930, win 512, options [nop,nop,TS val 298653285 ecr 298653282], length 996
2022-04-06 03:39:30.782717 IP (tos 0x0, ttl 64, id 5700, offset 0, flags [DF], proto TCP (6), length 52)
    127.0.0.1.46524 > 127.0.0.1.9950: Flags [.], cksum 0xfe28 (incorrect -> 0x37c8), seq 930, ack 21273, win 504, options [nop,nop,TS val 298653285 ecr 298653285], length 0
2022-04-06 03:39:30.782812 IP (tos 0x0, ttl 64, id 37335, offset 0, flags [DF], proto TCP (6), length 3538)
    127.0.0.1.9950 > 127.0.0.1.46524: Flags [P.], cksum 0x0bc7 (incorrect -> 0xb992), seq 21273:24759, ack 930, win 512, options [nop,nop,TS val 298653285 ecr 298653285], length 3486
2022-04-06 03:39:30.782817 IP (tos 0x0, ttl 64, id 5701, offset 0, flags [DF], proto TCP (6), length 52)
    127.0.0.1.46524 > 127.0.0.1.9950: Flags [.], cksum 0xfe28 (incorrect -> 0x2a34), seq 930, ack 24759, win 494, options [nop,nop,TS val 298653285 ecr 298653285], length 0
2022-04-06 03:39:30.785839 IP (tos 0x0, ttl 64, id 37336, offset 0, flags [DF], proto TCP (6), length 3538)
    127.0.0.1.9950 > 127.0.0.1.46524: Flags [P.], cksum 0x0bc7 (incorrect -> 0x27ad), seq 24759:28245, ack 930, win 512, options [nop,nop,TS val 298653288 ecr 298653285], length 3486
2022-04-06 03:39:30.819884 IP (tos 0x0, ttl 64, id 37337, offset 0, flags [DF], proto TCP (6), length 32820)
    127.0.0.1.9950 > 127.0.0.1.46524: Flags [.], cksum 0x7e29 (incorrect -> 0x6df6), seq 28245:61013, ack 930, win 512, options [nop,nop,TS val 298653322 ecr 298653285], length 32768
2022-04-06 03:39:30.819890 IP (tos 0x0, ttl 64, id 5702, offset 0, flags [DF], proto TCP (6), length 52)
    127.0.0.1.46524 > 127.0.0.1.9950: Flags [.], cksum 0xfe28 (incorrect -> 0x9ce0), seq 930, ack 61013, win 379, options [nop,nop,TS val 298653322 ecr 298653288], length 0
2022-04-06 03:39:30.819896 IP (tos 0x0, ttl 64, id 37338, offset 0, flags [DF], proto TCP (6), length 1262)
    127.0.0.1.9950 > 127.0.0.1.46524: Flags [P.], cksum 0x02e3 (incorrect -> 0xfd15), seq 61013:62223, ack 930, win 512, options [nop,nop,TS val 298653322 ecr 298653322], length 1210
2022-04-06 03:39:30.820778 IP (tos 0x0, ttl 64, id 5703, offset 0, flags [DF], proto TCP (6), length 52)
    127.0.0.1.46524 > 127.0.0.1.9950: Flags [.], cksum 0xfe28 (incorrect -> 0x977e), seq 930, ack 62223, win 512, options [nop,nop,TS val 298653323 ecr 298653322], length 0
2022-04-06 03:39:30.820820 IP (tos 0x0, ttl 64, id 37339, offset 0, flags [DF], proto TCP (6), length 4036)
    127.0.0.1.9950 > 127.0.0.1.46524: Flags [P.], cksum 0x0db9 (incorrect -> 0xa823), seq 62223:66207, ack 930, win 512, options [nop,nop,TS val 298653323 ecr 298653323], length 3984
2022-04-06 03:39:30.820850 IP (tos 0x0, ttl 64, id 5704, offset 0, flags [DF], proto TCP (6), length 52)
    127.0.0.1.46524 > 127.0.0.1.9950: Flags [.], cksum 0xfe28 (incorrect -> 0x87ed), seq 930, ack 66207, win 512, options [nop,nop,TS val 298653323 ecr 298653323], length 0
2022-04-06 03:39:30.822419 IP (tos 0x0, ttl 64, id 37340, offset 0, flags [DF], proto TCP (6), length 4036)
    127.0.0.1.9950 > 127.0.0.1.46524: Flags [P.], cksum 0x0db9 (incorrect -> 0x150d), seq 66207:70191, ack 930, win 512, options [nop,nop,TS val 298653325 ecr 298653323], length 3984
2022-04-06 03:39:30.833669 IP (tos 0x0, ttl 64, id 37341, offset 0, flags [DF], proto TCP (6), length 32820)
    127.0.0.1.9950 > 127.0.0.1.46524: Flags [.], cksum 0x7e29 (incorrect -> 0x83b8), seq 70191:102959, ack 930, win 512, options [nop,nop,TS val 298653336 ecr 298653323], length 32768
2022-04-06 03:39:30.833690 IP (tos 0x0, ttl 64, id 5705, offset 0, flags [DF], proto TCP (6), length 52)
    127.0.0.1.46524 > 127.0.0.1.9950: Flags [.], cksum 0xfe28 (incorrect -> 0xf8d2), seq 930, ack 102959, win 379, options [nop,nop,TS val 298653336 ecr 298653325], length 0
2022-04-06 03:39:30.833694 IP (tos 0x0, ttl 64, id 37342, offset 0, flags [DF], proto TCP (6), length 1646)
    127.0.0.1.9950 > 127.0.0.1.46524: Flags [P.], cksum 0x0463 (incorrect -> 0xcf3c), seq 102959:104553, ack 930, win 512, options [nop,nop,TS val 298653336 ecr 298653336], length 1594
2022-04-06 03:39:30.834369 IP (tos 0x0, ttl 64, id 5706, offset 0, flags [DF], proto TCP (6), length 52)
    127.0.0.1.46524 > 127.0.0.1.9950: Flags [.], cksum 0xfe28 (incorrect -> 0xf207), seq 930, ack 104553, win 512, options [nop,nop,TS val 298653337 ecr 298653336], length 0
2022-04-06 03:39:30.834496 IP (tos 0x0, ttl 64, id 37343, offset 0, flags [DF], proto TCP (6), length 3538)
    127.0.0.1.9950 > 127.0.0.1.46524: Flags [P.], cksum 0x0bc7 (incorrect -> 0x7fe9), seq 104553:108039, ack 930, win 512, options [nop,nop,TS val 298653337 ecr 298653337], length 3486
2022-04-06 03:39:30.834508 IP (tos 0x0, ttl 64, id 5707, offset 0, flags [DF], proto TCP (6), length 52)
    127.0.0.1.46524 > 127.0.0.1.9950: Flags [.], cksum 0xfe28 (incorrect -> 0xe468), seq 930, ack 108039, win 512, options [nop,nop,TS val 298653337 ecr 298653337], length 0
2022-04-06 03:39:30.835344 IP (tos 0x0, ttl 64, id 37344, offset 0, flags [DF], proto TCP (6), length 4036)
    127.0.0.1.9950 > 127.0.0.1.46524: Flags [P.], cksum 0x0db9 (incorrect -> 0x787d), seq 108039:112023, ack 930, win 512, options [nop,nop,TS val 298653338 ecr 298653337], length 3984
2022-04-06 03:39:30.835369 IP (tos 0x0, ttl 64, id 5708, offset 0, flags [DF], proto TCP (6), length 52)
    127.0.0.1.46524 > 127.0.0.1.9950: Flags [.], cksum 0xfe28 (incorrect -> 0xd4d6), seq 930, ack 112023, win 512, options [nop,nop,TS val 298653338 ecr 298653338], length 0
2022-04-06 03:39:30.836342 IP (tos 0x0, ttl 64, id 37345, offset 0, flags [DF], proto TCP (6), length 1048)
    127.0.0.1.9950 > 127.0.0.1.46524: Flags [P.], cksum 0x020d (incorrect -> 0x659f), seq 112023:113019, ack 930, win 512, options [nop,nop,TS val 298653339 ecr 298653338], length 996
2022-04-06 03:39:30.836352 IP (tos 0x0, ttl 64, id 5709, offset 0, flags [DF], proto TCP (6), length 52)
    127.0.0.1.46524 > 127.0.0.1.9950: Flags [.], cksum 0xfe28 (incorrect -> 0xd0f0), seq 930, ack 113019, win 512, options [nop,nop,TS val 298653339 ecr 298653339], length 0
2022-04-06 03:39:30.836754 IP (tos 0x0, ttl 64, id 37346, offset 0, flags [DF], proto TCP (6), length 3538)
    127.0.0.1.9950 > 127.0.0.1.46524: Flags [P.], cksum 0x0bc7 (incorrect -> 0xff60), seq 113019:116505, ack 930, win 512, options [nop,nop,TS val 298653339 ecr 298653339], length 3486
2022-04-06 03:39:30.836764 IP (tos 0x0, ttl 64, id 5710, offset 0, flags [DF], proto TCP (6), length 52)
    127.0.0.1.46524 > 127.0.0.1.9950: Flags [.], cksum 0xfe28 (incorrect -> 0xc352), seq 930, ack 116505, win 512, options [nop,nop,TS val 298653339 ecr 298653339], length 0
2022-04-06 03:39:30.837695 IP (tos 0x0, ttl 64, id 37347, offset 0, flags [DF], proto TCP (6), length 1546)
    127.0.0.1.9950 > 127.0.0.1.46524: Flags [P.], cksum 0x03ff (incorrect -> 0x959d), seq 116505:117999, ack 930, win 512, options [nop,nop,TS val 298653340 ecr 298653339], length 1494
2022-04-06 03:39:30.837706 IP (tos 0x0, ttl 64, id 5711, offset 0, flags [DF], proto TCP (6), length 52)
    127.0.0.1.46524 > 127.0.0.1.9950: Flags [.], cksum 0xfe28 (incorrect -> 0xbd7a), seq 930, ack 117999, win 512, options [nop,nop,TS val 298653340 ecr 298653340], length 0
2022-04-06 03:39:30.838459 IP (tos 0x0, ttl 64, id 37348, offset 0, flags [DF], proto TCP (6), length 3538)
    127.0.0.1.9950 > 127.0.0.1.46524: Flags [P.], cksum 0x0bc7 (incorrect -> 0x6d7a), seq 117999:121485, ack 930, win 512, options [nop,nop,TS val 298653341 ecr 298653340], length 3486
2022-04-06 03:39:30.838470 IP (tos 0x0, ttl 64, id 5712, offset 0, flags [DF], proto TCP (6), length 52)
    127.0.0.1.46524 > 127.0.0.1.9950: Flags [.], cksum 0xfe28 (incorrect -> 0xafda), seq 930, ack 121485, win 512, options [nop,nop,TS val 298653341 ecr 298653341], length 0
2022-04-06 03:39:30.840178 IP (tos 0x0, ttl 64, id 37349, offset 0, flags [DF], proto TCP (6), length 4036)
    127.0.0.1.9950 > 127.0.0.1.46524: Flags [P.], cksum 0x0db9 (incorrect -> 0x9fdf), seq 121485:125469, ack 930, win 512, options [nop,nop,TS val 298653343 ecr 298653341], length 3984
2022-04-06 03:39:30.840192 IP (tos 0x0, ttl 64, id 5713, offset 0, flags [DF], proto TCP (6), length 52)
    127.0.0.1.46524 > 127.0.0.1.9950: Flags [.], cksum 0xfe28 (incorrect -> 0xa046), seq 930, ack 125469, win 512, options [nop,nop,TS val 298653343 ecr 298653343], length 0
200, 123.09574246406555, 0.44586920738220215