2022-04-06 14:09:27.886409 IP (tos 0x0, ttl 64, id 63792, offset 0, flags [DF], proto TCP (6), length 60)
    127.0.0.1.48036 > 127.0.0.1.9750: Flags [S], cksum 0xfe30 (incorrect -> 0x1f9b), seq 1858271366, win 65495, options [mss 65495,sackOK,TS val 336450389 ecr 0,nop,wscale 7], length 0
2022-04-06 14:09:27.886422 IP (tos 0x0, ttl 64, id 0, offset 0, flags [DF], proto TCP (6), length 60)
    127.0.0.1.9750 > 127.0.0.1.48036: Flags [S.], cksum 0xfe30 (incorrect -> 0x5648), seq 3868392279, ack 1858271367, win 65483, options [mss 65495,sackOK,TS val 336450389 ecr 336450389,nop,wscale 7], length 0
2022-04-06 14:09:27.886434 IP (tos 0x0, ttl 64, id 63793, offset 0, flags [DF], proto TCP (6), length 52)
    127.0.0.1.48036 > 127.0.0.1.9750: Flags [.], cksum 0xfe28 (incorrect -> 0x7d04), seq 1, ack 1, win 512, options [nop,nop,TS val 336450389 ecr 336450389], length 0
2022-04-06 14:09:27.886524 IP (tos 0x0, ttl 64, id 63794, offset 0, flags [DF], proto TCP (6), length 55)
    127.0.0.1.48036 > 127.0.0.1.9750: Flags [P.], cksum 0xfe2b (incorrect -> 0x77f8), seq 1:4, ack 1, win 512, options [nop,nop,TS val 336450389 ecr 336450389], length 3
2022-04-06 14:09:27.886530 IP (tos 0x0, ttl 64, id 21053, offset 0, flags [DF], proto TCP (6), length 52)
    127.0.0.1.9750 > 127.0.0.1.48036: Flags [.], cksum 0xfe28 (incorrect -> 0x7d01), seq 1, ack 4, win 512, options [nop,nop,TS val 336450389 ecr 336450389], length 0
2022-04-06 14:09:27.886599 IP (tos 0x0, ttl 64, id 21054, offset 0, flags [DF], proto TCP (6), length 54)
    127.0.0.1.9750 > 127.0.0.1.48036: Flags [P.], cksum 0xfe2a (incorrect -> 0x77f7), seq 1:3, ack 4, win 512, options [nop,nop,TS val 336450389 ecr 336450389], length 2
2022-04-06 14:09:27.886605 IP (tos 0x0, ttl 64, id 63795, offset 0, flags [DF], proto TCP (6), length 52)
    127.0.0.1.48036 > 127.0.0.1.9750: Flags [.], cksum 0xfe28 (incorrect -> 0x7cff), seq 4, ack 3, win 512, options [nop,nop,TS val 336450389 ecr 336450389], length 0
2022-04-06 14:09:27.888366 IP (tos 0x0, ttl 64, id 63796, offset 0, flags [DF], proto TCP (6), length 62)
    127.0.0.1.48036 > 127.0.0.1.9750: Flags [P.], cksum 0xfe32 (incorrect -> 0x2e4f), seq 4:14, ack 3, win 512, options [nop,nop,TS val 336450391 ecr 336450389], length 10
2022-04-06 14:09:27.888375 IP (tos 0x0, ttl 64, id 21055, offset 0, flags [DF], proto TCP (6), length 52)
    127.0.0.1.9750 > 127.0.0.1.48036: Flags [.], cksum 0xfe28 (incorrect -> 0x7cf1), seq 3, ack 14, win 512, options [nop,nop,TS val 336450391 ecr 336450391], length 0
2022-04-06 14:09:27.950723 IP (tos 0x0, ttl 64, id 21056, offset 0, flags [DF], proto TCP (6), length 62)
    127.0.0.1.9750 > 127.0.0.1.48036: Flags [P.], cksum 0xfe32 (incorrect -> 0x77a0), seq 3:13, ack 14, win 512, options [nop,nop,TS val 336450453 ecr 336450391], length 10
2022-04-06 14:09:27.950733 IP (tos 0x0, ttl 64, id 63797, offset 0, flags [DF], proto TCP (6), length 52)
    127.0.0.1.48036 > 127.0.0.1.9750: Flags [.], cksum 0xfe28 (incorrect -> 0x7c6b), seq 14, ack 13, win 512, options [nop,nop,TS val 336450453 ecr 336450453], length 0
2022-04-06 14:09:27.956088 IP (tos 0x0, ttl 64, id 63798, offset 0, flags [DF], proto TCP (6), length 569)
    127.0.0.1.48036 > 127.0.0.1.9750: Flags [P.], cksum 0x002e (incorrect -> 0x8d3d), seq 14:531, ack 13, win 512, options [nop,nop,TS val 336450459 ecr 336450453], length 517
2022-04-06 14:09:27.956099 IP (tos 0x0, ttl 64, id 21057, offset 0, flags [DF], proto TCP (6), length 52)
    127.0.0.1.9750 > 127.0.0.1.48036: Flags [.], cksum 0xfe28 (incorrect -> 0x7a5e), seq 13, ack 531, win 508, options [nop,nop,TS val 336450459 ecr 336450459], length 0
200, 3.540599822998047, 0.4576563835144043