2022-04-06 03:51:23.350152 IP (tos 0x0, ttl 64, id 27998, offset 0, flags [DF], proto TCP (6), length 60)
    127.0.0.1.35880 > 127.0.0.1.9850: Flags [S], cksum 0xfe30 (incorrect -> 0xf06e), seq 2892363989, win 65495, options [mss 65495,sackOK,TS val 299365853 ecr 0,nop,wscale 7], length 0
2022-04-06 03:51:23.350162 IP (tos 0x0, ttl 64, id 0, offset 0, flags [DF], proto TCP (6), length 60)
    127.0.0.1.9850 > 127.0.0.1.35880: Flags [S.], cksum 0xfe30 (incorrect -> 0xa64a), seq 3398531032, ack 2892363990, win 65483, options [mss 65495,sackOK,TS val 299365853 ecr 299365853,nop,wscale 7], length 0
2022-04-06 03:51:23.350170 IP (tos 0x0, ttl 64, id 27999, offset 0, flags [DF], proto TCP (6), length 52)
    127.0.0.1.35880 > 127.0.0.1.9850: Flags [.], cksum 0xfe28 (incorrect -> 0xcd06), seq 1, ack 1, win 512, options [nop,nop,TS val 299365853 ecr 299365853], length 0
2022-04-06 03:51:23.350250 IP (tos 0x0, ttl 64, id 28000, offset 0, flags [DF], proto TCP (6), length 55)
    127.0.0.1.35880 > 127.0.0.1.9850: Flags [P.], cksum 0xfe2b (incorrect -> 0xc7fa), seq 1:4, ack 1, win 512, options [nop,nop,TS val 299365853 ecr 299365853], length 3
2022-04-06 03:51:23.350256 IP (tos 0x0, ttl 64, id 62616, offset 0, flags [DF], proto TCP (6), length 52)
    127.0.0.1.9850 > 127.0.0.1.35880: Flags [.], cksum 0xfe28 (incorrect -> 0xcd03), seq 1, ack 4, win 512, options [nop,nop,TS val 299365853 ecr 299365853], length 0
2022-04-06 03:51:23.350348 IP (tos 0x0, ttl 64, id 62617, offset 0, flags [DF], proto TCP (6), length 54)
    127.0.0.1.9850 > 127.0.0.1.35880: Flags [P.], cksum 0xfe2a (incorrect -> 0xc7f9), seq 1:3, ack 4, win 512, options [nop,nop,TS val 299365853 ecr 299365853], length 2
2022-04-06 03:51:23.350356 IP (tos 0x0, ttl 64, id 28001, offset 0, flags [DF], proto TCP (6), length 52)
    127.0.0.1.35880 > 127.0.0.1.9850: Flags [.], cksum 0xfe28 (incorrect -> 0xcd01), seq 4, ack 3, win 512, options [nop,nop,TS val 299365853 ecr 299365853], length 0
2022-04-06 03:51:23.351593 IP (tos 0x0, ttl 64, id 28002, offset 0, flags [DF], proto TCP (6), length 62)
    127.0.0.1.35880 > 127.0.0.1.9850: Flags [P.], cksum 0xfe32 (incorrect -> 0x9842), seq 4:14, ack 3, win 512, options [nop,nop,TS val 299365854 ecr 299365853], length 10
2022-04-06 03:51:23.351615 IP (tos 0x0, ttl 64, id 62618, offset 0, flags [DF], proto TCP (6), length 52)
    127.0.0.1.9850 > 127.0.0.1.35880: Flags [.], cksum 0xfe28 (incorrect -> 0xccf5), seq 3, ack 14, win 512, options [nop,nop,TS val 299365854 ecr 299365854], length 0
2022-04-06 03:51:23.406556 IP (tos 0x0, ttl 64, id 62619, offset 0, flags [DF], proto TCP (6), length 62)
    127.0.0.1.9850 > 127.0.0.1.35880: Flags [P.], cksum 0xfe32 (incorrect -> 0xc7ab), seq 3:13, ack 14, win 512, options [nop,nop,TS val 299365909 ecr 299365854], length 10
2022-04-06 03:51:23.406569 IP (tos 0x0, ttl 64, id 28003, offset 0, flags [DF], proto TCP (6), length 52)
    127.0.0.1.35880 > 127.0.0.1.9850: Flags [.], cksum 0xfe28 (incorrect -> 0xcc7d), seq 14, ack 13, win 512, options [nop,nop,TS val 299365909 ecr 299365909], length 0
2022-04-06 03:51:23.412055 IP (tos 0x0, ttl 64, id 28004, offset 0, flags [DF], proto TCP (6), length 569)
    127.0.0.1.35880 > 127.0.0.1.9850: Flags [P.], cksum 0x002e (incorrect -> 0x4fe3), seq 14:531, ack 13, win 512, options [nop,nop,TS val 299365914 ecr 299365909], length 517
2022-04-06 03:51:23.412076 IP (tos 0x0, ttl 64, id 62620, offset 0, flags [DF], proto TCP (6), length 52)
    127.0.0.1.9850 > 127.0.0.1.35880: Flags [.], cksum 0xfe28 (incorrect -> 0xca71), seq 13, ack 531, win 508, options [nop,nop,TS val 299365915 ecr 299365914], length 0
2022-04-06 03:51:23.490332 IP (tos 0x0, ttl 64, id 62621, offset 0, flags [DF], proto TCP (6), length 3538)
    127.0.0.1.9850 > 127.0.0.1.35880: Flags [P.], cksum 0x0bc7 (incorrect -> 0x04a9), seq 13:3499, ack 531, win 512, options [nop,nop,TS val 299365993 ecr 299365914], length 3486
2022-04-06 03:51:23.490345 IP (tos 0x0, ttl 64, id 28005, offset 0, flags [DF], proto TCP (6), length 52)
    127.0.0.1.35880 > 127.0.0.1.9850: Flags [.], cksum 0xfe28 (incorrect -> 0xbc44), seq 531, ack 3499, win 494, options [nop,nop,TS val 299365993 ecr 299365993], length 0
2022-04-06 03:51:23.519072 IP (tos 0x0, ttl 64, id 62622, offset 0, flags [DF], proto TCP (6), length 1334)
    127.0.0.1.9850 > 127.0.0.1.35880: Flags [P.], cksum 0x032b (incorrect -> 0xb01a), seq 3499:4781, ack 531, win 512, options [nop,nop,TS val 299366022 ecr 299365993], length 1282
2022-04-06 03:51:23.519081 IP (tos 0x0, ttl 64, id 28006, offset 0, flags [DF], proto TCP (6), length 52)
    127.0.0.1.35880 > 127.0.0.1.9850: Flags [.], cksum 0xfe28 (incorrect -> 0xb700), seq 531, ack 4781, win 502, options [nop,nop,TS val 299366022 ecr 299366022], length 0
2022-04-06 03:51:23.519497 IP (tos 0x0, ttl 64, id 28007, offset 0, flags [DF], proto TCP (6), length 116)
    127.0.0.1.35880 > 127.0.0.1.9850: Flags [P.], cksum 0xfe68 (incorrect -> 0xa08a), seq 531:595, ack 4781, win 512, options [nop,nop,TS val 299366022 ecr 299366022], length 64
2022-04-06 03:51:23.519507 IP (tos 0x0, ttl 64, id 62623, offset 0, flags [DF], proto TCP (6), length 52)
    127.0.0.1.9850 > 127.0.0.1.35880: Flags [.], cksum 0xfe28 (incorrect -> 0xb6b6), seq 4781, ack 595, win 512, options [nop,nop,TS val 299366022 ecr 299366022], length 0
2022-04-06 03:51:23.519883 IP (tos 0x0, ttl 64, id 28008, offset 0, flags [DF], proto TCP (6), length 322)
    127.0.0.1.35880 > 127.0.0.1.9850: Flags [P.], cksum 0xff36 (incorrect -> 0xe028), seq 595:865, ack 4781, win 512, options [nop,nop,TS val 299366022 ecr 299366022], length 270
2022-04-06 03:51:23.519891 IP (tos 0x0, ttl 64, id 62624, offset 0, flags [DF], proto TCP (6), length 52)
    127.0.0.1.9850 > 127.0.0.1.35880: Flags [.], cksum 0xfe28 (incorrect -> 0xb5aa), seq 4781, ack 865, win 510, options [nop,nop,TS val 299366022 ecr 299366022], length 0
2022-04-06 03:51:23.606876 IP (tos 0x0, ttl 64, id 62625, offset 0, flags [DF], proto TCP (6), length 3538)
    127.0.0.1.9850 > 127.0.0.1.35880: Flags [P.], cksum 0x0bc7 (incorrect -> 0xf9be), seq 4781:8267, ack 865, win 512, options [nop,nop,TS val 299366109 ecr 299366022], length 3486
2022-04-06 03:51:23.606886 IP (tos 0x0, ttl 64, id 28009, offset 0, flags [DF], proto TCP (6), length 52)
    127.0.0.1.35880 > 127.0.0.1.9850: Flags [.], cksum 0xfe28 (incorrect -> 0xa76e), seq 865, ack 8267, win 494, options [nop,nop,TS val 299366109 ecr 299366109], length 0
2022-04-06 03:51:23.635310 IP (tos 0x0, ttl 64, id 62626, offset 0, flags [DF], proto TCP (6), length 3538)
    127.0.0.1.9850 > 127.0.0.1.35880: Flags [P.], cksum 0x0bc7 (incorrect -> 0x352c), seq 8267:11753, ack 865, win 512, options [nop,nop,TS val 299366138 ecr 299366109], length 3486
2022-04-06 03:51:23.635326 IP (tos 0x0, ttl 64, id 28010, offset 0, flags [DF], proto TCP (6), length 52)
    127.0.0.1.35880 > 127.0.0.1.9850: Flags [.], cksum 0xfe28 (incorrect -> 0x9996), seq 865, ack 11753, win 494, options [nop,nop,TS val 299366138 ecr 299366138], length 0
2022-04-06 03:51:23.637306 IP (tos 0x0, ttl 64, id 62627, offset 0, flags [DF], proto TCP (6), length 840)
    127.0.0.1.9850 > 127.0.0.1.35880: Flags [P.], cksum 0x013d (incorrect -> 0x4547), seq 11753:12541, ack 865, win 512, options [nop,nop,TS val 299366140 ecr 299366138], length 788
2022-04-06 03:51:23.637317 IP (tos 0x0, ttl 64, id 28011, offset 0, flags [DF], proto TCP (6), length 52)
    127.0.0.1.35880 > 127.0.0.1.9850: Flags [.], cksum 0xfe28 (incorrect -> 0x9674), seq 865, ack 12541, win 504, options [nop,nop,TS val 299366140 ecr 299366140], length 0
2022-04-06 03:51:23.644589 IP (tos 0x0, ttl 64, id 62628, offset 0, flags [DF], proto TCP (6), length 1002)
    127.0.0.1.9850 > 127.0.0.1.35880: Flags [P.], cksum 0x01df (incorrect -> 0xb2ed), seq 12541:13491, ack 865, win 512, options [nop,nop,TS val 299366147 ecr 299366140], length 950
2022-04-06 03:51:23.644597 IP (tos 0x0, ttl 64, id 28012, offset 0, flags [DF], proto TCP (6), length 52)
    127.0.0.1.35880 > 127.0.0.1.9850: Flags [.], cksum 0xfe28 (incorrect -> 0x92b0), seq 865, ack 13491, win 504, options [nop,nop,TS val 299366147 ecr 299366147], length 0
2022-04-06 03:51:23.649008 IP (tos 0x0, ttl 64, id 62629, offset 0, flags [DF], proto TCP (6), length 3446)
    127.0.0.1.9850 > 127.0.0.1.35880: Flags [P.], cksum 0x0b6b (incorrect -> 0xbbe3), seq 13491:16885, ack 865, win 512, options [nop,nop,TS val 299366151 ecr 299366147], length 3394
2022-04-06 03:51:23.649016 IP (tos 0x0, ttl 64, id 28013, offset 0, flags [DF], proto TCP (6), length 52)
    127.0.0.1.35880 > 127.0.0.1.9850: Flags [.], cksum 0xfe28 (incorrect -> 0x8570), seq 865, ack 16885, win 494, options [nop,nop,TS val 299366151 ecr 299366151], length 0
2022-04-06 03:51:23.658666 IP (tos 0x0, ttl 64, id 62630, offset 0, flags [DF], proto TCP (6), length 1002)
    127.0.0.1.9850 > 127.0.0.1.35880: Flags [P.], cksum 0x01df (incorrect -> 0x0d30), seq 16885:17835, ack 865, win 512, options [nop,nop,TS val 299366161 ecr 299366151], length 950
2022-04-06 03:51:23.658673 IP (tos 0x0, ttl 64, id 28014, offset 0, flags [DF], proto TCP (6), length 52)
    127.0.0.1.35880 > 127.0.0.1.9850: Flags [.], cksum 0xfe28 (incorrect -> 0x819c), seq 865, ack 17835, win 504, options [nop,nop,TS val 299366161 ecr 299366161], length 0
2022-04-06 03:51:23.699100 IP (tos 0x0, ttl 64, id 62631, offset 0, flags [DF], proto TCP (6), length 3538)
    127.0.0.1.9850 > 127.0.0.1.35880: Flags [P.], cksum 0x0bc7 (incorrect -> 0x6eac), seq 17835:21321, ack 865, win 512, options [nop,nop,TS val 299366202 ecr 299366161], length 3486
2022-04-06 03:51:23.699109 IP (tos 0x0, ttl 64, id 28015, offset 0, flags [DF], proto TCP (6), length 52)
    127.0.0.1.35880 > 127.0.0.1.9850: Flags [.], cksum 0xfe28 (incorrect -> 0x73b6), seq 865, ack 21321, win 494, options [nop,nop,TS val 299366202 ecr 299366202], length 0
2022-04-06 03:51:23.715227 IP (tos 0x0, ttl 64, id 62632, offset 0, flags [DF], proto TCP (6), length 3538)
    127.0.0.1.9850 > 127.0.0.1.35880: Flags [P.], cksum 0x0bc7 (incorrect -> 0xe510), seq 21321:24807, ack 865, win 512, options [nop,nop,TS val 299366218 ecr 299366202], length 3486
2022-04-06 03:51:23.715235 IP (tos 0x0, ttl 64, id 28016, offset 0, flags [DF], proto TCP (6), length 52)
    127.0.0.1.35880 > 127.0.0.1.9850: Flags [.], cksum 0xfe28 (incorrect -> 0x65f8), seq 865, ack 24807, win 494, options [nop,nop,TS val 299366218 ecr 299366218], length 0
2022-04-06 03:51:23.724833 IP (tos 0x0, ttl 64, id 62633, offset 0, flags [DF], proto TCP (6), length 550)
    127.0.0.1.9850 > 127.0.0.1.35880: Flags [P.], cksum 0x001b (incorrect -> 0xfa7a), seq 24807:25305, ack 865, win 512, options [nop,nop,TS val 299366227 ecr 299366218], length 498
2022-04-06 03:51:23.724850 IP (tos 0x0, ttl 64, id 28017, offset 0, flags [DF], proto TCP (6), length 52)
    127.0.0.1.35880 > 127.0.0.1.9850: Flags [.], cksum 0xfe28 (incorrect -> 0x63e2), seq 865, ack 25305, win 512, options [nop,nop,TS val 299366227 ecr 299366227], length 0
2022-04-06 03:51:23.734861 IP (tos 0x0, ttl 64, id 62634, offset 0, flags [DF], proto TCP (6), length 3538)
    127.0.0.1.9850 > 127.0.0.1.35880: Flags [P.], cksum 0x0bc7 (incorrect -> 0x6867), seq 25305:28791, ack 865, win 512, options [nop,nop,TS val 299366237 ecr 299366227], length 3486
2022-04-06 03:51:23.778658 IP (tos 0x0, ttl 64, id 28018, offset 0, flags [DF], proto TCP (6), length 52)
    127.0.0.1.35880 > 127.0.0.1.9850: Flags [.], cksum 0xfe28 (incorrect -> 0x5604), seq 865, ack 28791, win 512, options [nop,nop,TS val 299366281 ecr 299366237], length 0
2022-04-06 03:51:23.778671 IP (tos 0x0, ttl 64, id 62635, offset 0, flags [DF], proto TCP (6), length 19285)
    127.0.0.1.9850 > 127.0.0.1.35880: Flags [P.], cksum 0x494a (incorrect -> 0x2836), seq 28791:48024, ack 865, win 512, options [nop,nop,TS val 299366281 ecr 299366281], length 19233
2022-04-06 03:51:23.826664 IP (tos 0x0, ttl 64, id 28019, offset 0, flags [DF], proto TCP (6), length 52)
    127.0.0.1.35880 > 127.0.0.1.9850: Flags [.], cksum 0xfe28 (incorrect -> 0x0a87), seq 865, ack 48024, win 512, options [nop,nop,TS val 299366329 ecr 299366281], length 0
2022-04-06 03:51:23.826683 IP (tos 0x0, ttl 64, id 62636, offset 0, flags [DF], proto TCP (6), length 32288)
    127.0.0.1.9850 > 127.0.0.1.35880: Flags [P.], cksum 0x7c15 (incorrect -> 0x2f67), seq 48024:80260, ack 865, win 512, options [nop,nop,TS val 299366329 ecr 299366329], length 32236
2022-04-06 03:51:23.870661 IP (tos 0x0, ttl 64, id 28020, offset 0, flags [DF], proto TCP (6), length 52)
    127.0.0.1.35880 > 127.0.0.1.9850: Flags [.], cksum 0xfe28 (incorrect -> 0x8c3e), seq 865, ack 80260, win 512, options [nop,nop,TS val 299366373 ecr 299366329], length 0
2022-04-06 03:51:23.870678 IP (tos 0x0, ttl 64, id 62637, offset 0, flags [DF], proto TCP (6), length 27608)
    127.0.0.1.9850 > 127.0.0.1.35880: Flags [P.], cksum 0x69cd (incorrect -> 0xa3fa), seq 80260:107816, ack 865, win 512, options [nop,nop,TS val 299366373 ecr 299366373], length 27556
2022-04-06 03:51:23.871210 IP (tos 0x0, ttl 64, id 28021, offset 0, flags [DF], proto TCP (6), length 52)
    127.0.0.1.35880 > 127.0.0.1.9850: Flags [.], cksum 0xfe28 (incorrect -> 0x206d), seq 865, ack 107816, win 512, options [nop,nop,TS val 299366374 ecr 299366373], length 0
2022-04-06 03:51:23.871570 IP (tos 0x0, ttl 64, id 62638, offset 0, flags [DF], proto TCP (6), length 3920)
    127.0.0.1.9850 > 127.0.0.1.35880: Flags [P.], cksum 0x0d45 (incorrect -> 0xafc8), seq 107816:111684, ack 865, win 512, options [nop,nop,TS val 299366374 ecr 299366374], length 3868
2022-04-06 03:51:23.871586 IP (tos 0x0, ttl 64, id 28022, offset 0, flags [DF], proto TCP (6), length 52)
    127.0.0.1.35880 > 127.0.0.1.9850: Flags [.], cksum 0xfe28 (incorrect -> 0x1150), seq 865, ack 111684, win 512, options [nop,nop,TS val 299366374 ecr 299366374], length 0
2022-04-06 03:51:23.873970 IP (tos 0x0, ttl 64, id 62639, offset 0, flags [DF], proto TCP (6), length 3538)
    127.0.0.1.9850 > 127.0.0.1.35880: Flags [P.], cksum 0x0bc7 (incorrect -> 0x89f8), seq 111684:115170, ack 865, win 512, options [nop,nop,TS val 299366376 ecr 299366374], length 3486
2022-04-06 03:51:23.873984 IP (tos 0x0, ttl 64, id 28023, offset 0, flags [DF], proto TCP (6), length 52)
    127.0.0.1.35880 > 127.0.0.1.9850: Flags [.], cksum 0xfe28 (incorrect -> 0x03ae), seq 865, ack 115170, win 512, options [nop,nop,TS val 299366376 ecr 299366376], length 0
2022-04-06 03:51:23.888204 IP (tos 0x0, ttl 64, id 62640, offset 0, flags [DF], proto TCP (6), length 3354)
    127.0.0.1.9850 > 127.0.0.1.35880: Flags [P.], cksum 0x0b0f (incorrect -> 0x4cca), seq 115170:118472, ack 865, win 512, options [nop,nop,TS val 299366391 ecr 299366376], length 3302
2022-04-06 03:51:23.888220 IP (tos 0x0, ttl 64, id 28024, offset 0, flags [DF], proto TCP (6), length 52)
    127.0.0.1.35880 > 127.0.0.1.9850: Flags [.], cksum 0xfe28 (incorrect -> 0xf6a9), seq 865, ack 118472, win 512, options [nop,nop,TS val 299366391 ecr 299366391], length 0
2022-04-06 03:51:23.901783 IP (tos 0x0, ttl 64, id 62641, offset 0, flags [DF], proto TCP (6), length 3852)
    127.0.0.1.9850 > 127.0.0.1.35880: Flags [P.], cksum 0x0d01 (incorrect -> 0x60fd), seq 118472:122272, ack 865, win 512, options [nop,nop,TS val 299366404 ecr 299366391], length 3800
2022-04-06 03:51:23.901804 IP (tos 0x0, ttl 64, id 28025, offset 0, flags [DF], proto TCP (6), length 52)
    127.0.0.1.35880 > 127.0.0.1.9850: Flags [.], cksum 0xfe28 (incorrect -> 0xe7b7), seq 865, ack 122272, win 512, options [nop,nop,TS val 299366404 ecr 299366404], length 0
2022-04-06 03:51:23.909638 IP (tos 0x0, ttl 64, id 62642, offset 0, flags [DF], proto TCP (6), length 3538)
    127.0.0.1.9850 > 127.0.0.1.35880: Flags [P.], cksum 0x0bc7 (incorrect -> 0x3222), seq 122272:125758, ack 865, win 512, options [nop,nop,TS val 299366412 ecr 299366404], length 3486
2022-04-06 03:51:23.910026 IP (tos 0x0, ttl 64, id 28026, offset 0, flags [DF], proto TCP (6), length 52)
    127.0.0.1.35880 > 127.0.0.1.9850: Flags [.], cksum 0xfe28 (incorrect -> 0xda09), seq 865, ack 125758, win 512, options [nop,nop,TS val 299366412 ecr 299366412], length 0
200, 3.7343368530273438, 0.6861295700073242