2022-04-06 22:16:48.319797 IP (tos 0x0, ttl 64, id 737, offset 0, flags [DF], proto TCP (6), length 60)
    127.0.0.1.46832 > 127.0.0.1.9150: Flags [S], cksum 0xfe30 (incorrect -> 0x5718), seq 3285992652, win 65495, options [mss 65495,sackOK,TS val 365690822 ecr 0,nop,wscale 7], length 0
2022-04-06 22:16:48.319807 IP (tos 0x0, ttl 64, id 0, offset 0, flags [DF], proto TCP (6), length 60)
    127.0.0.1.9150 > 127.0.0.1.46832: Flags [S.], cksum 0xfe30 (incorrect -> 0x0a1d), seq 981531875, ack 3285992653, win 65483, options [mss 65495,sackOK,TS val 365690822 ecr 365690822,nop,wscale 7], length 0
2022-04-06 22:16:48.319815 IP (tos 0x0, ttl 64, id 738, offset 0, flags [DF], proto TCP (6), length 52)
    127.0.0.1.46832 > 127.0.0.1.9150: Flags [.], cksum 0xfe28 (incorrect -> 0x30d9), seq 1, ack 1, win 512, options [nop,nop,TS val 365690822 ecr 365690822], length 0
2022-04-06 22:16:48.319982 IP (tos 0x0, ttl 64, id 739, offset 0, flags [DF], proto TCP (6), length 55)
    127.0.0.1.46832 > 127.0.0.1.9150: Flags [P.], cksum 0xfe2b (incorrect -> 0x2bcd), seq 1:4, ack 1, win 512, options [nop,nop,TS val 365690822 ecr 365690822], length 3
2022-04-06 22:16:48.319988 IP (tos 0x0, ttl 64, id 5054, offset 0, flags [DF], proto TCP (6), length 52)
    127.0.0.1.9150 > 127.0.0.1.46832: Flags [.], cksum 0xfe28 (incorrect -> 0x30d6), seq 1, ack 4, win 512, options [nop,nop,TS val 365690822 ecr 365690822], length 0
2022-04-06 22:16:48.320011 IP (tos 0x0, ttl 64, id 5055, offset 0, flags [DF], proto TCP (6), length 54)
    127.0.0.1.9150 > 127.0.0.1.46832: Flags [P.], cksum 0xfe2a (incorrect -> 0x2bcc), seq 1:3, ack 4, win 512, options [nop,nop,TS val 365690822 ecr 365690822], length 2
2022-04-06 22:16:48.320018 IP (tos 0x0, ttl 64, id 740, offset 0, flags [DF], proto TCP (6), length 52)
    127.0.0.1.46832 > 127.0.0.1.9150: Flags [.], cksum 0xfe28 (incorrect -> 0x30d4), seq 4, ack 3, win 512, options [nop,nop,TS val 365690822 ecr 365690822], length 0
2022-04-06 22:16:48.321473 IP (tos 0x0, ttl 64, id 741, offset 0, flags [DF], proto TCP (6), length 62)
    127.0.0.1.46832 > 127.0.0.1.9150: Flags [P.], cksum 0xfe32 (incorrect -> 0xe139), seq 4:14, ack 3, win 512, options [nop,nop,TS val 365690824 ecr 365690822], length 10
2022-04-06 22:16:48.321481 IP (tos 0x0, ttl 64, id 5056, offset 0, flags [DF], proto TCP (6), length 52)
    127.0.0.1.9150 > 127.0.0.1.46832: Flags [.], cksum 0xfe28 (incorrect -> 0x30c6), seq 3, ack 14, win 512, options [nop,nop,TS val 365690824 ecr 365690824], length 0
2022-04-06 22:16:48.480523 IP (tos 0x0, ttl 64, id 5057, offset 0, flags [DF], proto TCP (6), length 62)
    127.0.0.1.9150 > 127.0.0.1.46832: Flags [P.], cksum 0xfe32 (incorrect -> 0x2b14), seq 3:13, ack 14, win 512, options [nop,nop,TS val 365690983 ecr 365690824], length 10
2022-04-06 22:16:48.480529 IP (tos 0x0, ttl 64, id 742, offset 0, flags [DF], proto TCP (6), length 52)
    127.0.0.1.46832 > 127.0.0.1.9150: Flags [.], cksum 0xfe28 (incorrect -> 0x2f7e), seq 14, ack 13, win 512, options [nop,nop,TS val 365690983 ecr 365690983], length 0
2022-04-06 22:16:48.486885 IP (tos 0x0, ttl 64, id 743, offset 0, flags [DF], proto TCP (6), length 569)
    127.0.0.1.46832 > 127.0.0.1.9150: Flags [P.], cksum 0x002e (incorrect -> 0x5a24), seq 14:531, ack 13, win 512, options [nop,nop,TS val 365690989 ecr 365690983], length 517
2022-04-06 22:16:48.486894 IP (tos 0x0, ttl 64, id 5058, offset 0, flags [DF], proto TCP (6), length 52)
    127.0.0.1.9150 > 127.0.0.1.46832: Flags [.], cksum 0xfe28 (incorrect -> 0x2d71), seq 13, ack 531, win 508, options [nop,nop,TS val 365690989 ecr 365690989], length 0
2022-04-06 22:16:48.651814 IP (tos 0x0, ttl 64, id 5059, offset 0, flags [DF], proto TCP (6), length 3538)
    127.0.0.1.9150 > 127.0.0.1.46832: Flags [P.], cksum 0x0bc7 (incorrect -> 0xa268), seq 13:3499, ack 531, win 512, options [nop,nop,TS val 365691154 ecr 365690989], length 3486
2022-04-06 22:16:48.651821 IP (tos 0x0, ttl 64, id 744, offset 0, flags [DF], proto TCP (6), length 52)
    127.0.0.1.46832 > 127.0.0.1.9150: Flags [.], cksum 0xfe28 (incorrect -> 0x1e97), seq 531, ack 3499, win 494, options [nop,nop,TS val 365691154 ecr 365691154], length 0
2022-04-06 22:16:48.696298 IP (tos 0x0, ttl 64, id 5060, offset 0, flags [DF], proto TCP (6), length 1048)
    127.0.0.1.9150 > 127.0.0.1.46832: Flags [P.], cksum 0x020d (incorrect -> 0x1bd3), seq 3499:4495, ack 531, win 512, options [nop,nop,TS val 365691199 ecr 365691154], length 996
2022-04-06 22:16:48.696303 IP (tos 0x0, ttl 64, id 745, offset 0, flags [DF], proto TCP (6), length 52)
    127.0.0.1.46832 > 127.0.0.1.9150: Flags [.], cksum 0xfe28 (incorrect -> 0x1a4f), seq 531, ack 4495, win 504, options [nop,nop,TS val 365691199 ecr 365691199], length 0
2022-04-06 22:16:48.739827 IP (tos 0x0, ttl 64, id 5061, offset 0, flags [DF], proto TCP (6), length 2247)
    127.0.0.1.9150 > 127.0.0.1.46832: Flags [P.], cksum 0x06bc (incorrect -> 0xb8fe), seq 4495:6690, ack 531, win 512, options [nop,nop,TS val 365691242 ecr 365691199], length 2195
2022-04-06 22:16:48.739838 IP (tos 0x0, ttl 64, id 746, offset 0, flags [DF], proto TCP (6), length 52)
    127.0.0.1.46832 > 127.0.0.1.9150: Flags [.], cksum 0xfe28 (incorrect -> 0x116b), seq 531, ack 6690, win 499, options [nop,nop,TS val 365691242 ecr 365691242], length 0
2022-04-06 22:16:48.740782 IP (tos 0x0, ttl 64, id 747, offset 0, flags [DF], proto TCP (6), length 132)
    127.0.0.1.46832 > 127.0.0.1.9150: Flags [P.], cksum 0xfe78 (incorrect -> 0xac66), seq 531:611, ack 6690, win 512, options [nop,nop,TS val 365691243 ecr 365691242], length 80
2022-04-06 22:16:48.740789 IP (tos 0x0, ttl 64, id 5062, offset 0, flags [DF], proto TCP (6), length 52)
    127.0.0.1.9150 > 127.0.0.1.46832: Flags [.], cksum 0xfe28 (incorrect -> 0x110c), seq 6690, ack 611, win 512, options [nop,nop,TS val 365691243 ecr 365691243], length 0
2022-04-06 22:16:48.741291 IP (tos 0x0, ttl 64, id 748, offset 0, flags [DF], proto TCP (6), length 360)
    127.0.0.1.46832 > 127.0.0.1.9150: Flags [P.], cksum 0xff5c (incorrect -> 0x4829), seq 611:919, ack 6690, win 512, options [nop,nop,TS val 365691244 ecr 365691243], length 308
2022-04-06 22:16:48.741298 IP (tos 0x0, ttl 64, id 5063, offset 0, flags [DF], proto TCP (6), length 52)
    127.0.0.1.9150 > 127.0.0.1.46832: Flags [.], cksum 0xfe28 (incorrect -> 0x0fd8), seq 6690, ack 919, win 510, options [nop,nop,TS val 365691244 ecr 365691244], length 0
2022-04-06 22:16:49.040757 IP (tos 0x0, ttl 64, id 5064, offset 0, flags [DF], proto TCP (6), length 3538)
    127.0.0.1.9150 > 127.0.0.1.46832: Flags [P.], cksum 0x0bc7 (incorrect -> 0x006c), seq 6690:10176, ack 919, win 512, options [nop,nop,TS val 365691543 ecr 365691244], length 3486
2022-04-06 22:16:49.040765 IP (tos 0x0, ttl 64, id 749, offset 0, flags [DF], proto TCP (6), length 52)
    127.0.0.1.46832 > 127.0.0.1.9150: Flags [.], cksum 0xfe28 (incorrect -> 0xfff3), seq 919, ack 10176, win 494, options [nop,nop,TS val 365691543 ecr 365691543], length 0
2022-04-06 22:16:49.046873 IP (tos 0x0, ttl 64, id 5065, offset 0, flags [DF], proto TCP (6), length 1825)
    127.0.0.1.9150 > 127.0.0.1.46832: Flags [P.], cksum 0x0516 (incorrect -> 0x35ed), seq 10176:11949, ack 919, win 512, options [nop,nop,TS val 365691549 ecr 365691543], length 1773
2022-04-06 22:16:49.046879 IP (tos 0x0, ttl 64, id 750, offset 0, flags [DF], proto TCP (6), length 52)
    127.0.0.1.46832 > 127.0.0.1.9150: Flags [.], cksum 0xfe28 (incorrect -> 0xf8f3), seq 919, ack 11949, win 501, options [nop,nop,TS val 365691549 ecr 365691549], length 0
2022-04-06 22:16:49.088698 IP (tos 0x0, ttl 64, id 5066, offset 0, flags [DF], proto TCP (6), length 1470)
    127.0.0.1.9150 > 127.0.0.1.46832: Flags [P.], cksum 0x03b3 (incorrect -> 0x9511), seq 11949:13367, ack 919, win 512, options [nop,nop,TS val 365691591 ecr 365691549], length 1418
2022-04-06 22:16:49.088705 IP (tos 0x0, ttl 64, id 751, offset 0, flags [DF], proto TCP (6), length 52)
    127.0.0.1.46832 > 127.0.0.1.9150: Flags [.], cksum 0xfe28 (incorrect -> 0xf314), seq 919, ack 13367, win 502, options [nop,nop,TS val 365691591 ecr 365691591], length 0
2022-04-06 22:16:49.117862 IP (tos 0x0, ttl 64, id 5067, offset 0, flags [DF], proto TCP (6), length 3386)
    127.0.0.1.9150 > 127.0.0.1.46832: Flags [P.], cksum 0x0b2f (incorrect -> 0xadb2), seq 13367:16701, ack 919, win 512, options [nop,nop,TS val 365691620 ecr 365691591], length 3334
2022-04-06 22:16:49.117868 IP (tos 0x0, ttl 64, id 752, offset 0, flags [DF], proto TCP (6), length 52)
    127.0.0.1.46832 > 127.0.0.1.9150: Flags [.], cksum 0xfe28 (incorrect -> 0xe5dc), seq 919, ack 16701, win 494, options [nop,nop,TS val 365691620 ecr 365691620], length 0
2022-04-06 22:16:49.141158 IP (tos 0x0, ttl 64, id 5068, offset 0, flags [DF], proto TCP (6), length 2390)
    127.0.0.1.9150 > 127.0.0.1.46832: Flags [P.], cksum 0x074b (incorrect -> 0x58ab), seq 16701:19039, ack 919, win 512, options [nop,nop,TS val 365691644 ecr 365691620], length 2338
2022-04-06 22:16:49.141164 IP (tos 0x0, ttl 64, id 753, offset 0, flags [DF], proto TCP (6), length 52)
    127.0.0.1.46832 > 127.0.0.1.9150: Flags [.], cksum 0xfe28 (incorrect -> 0xdc86), seq 919, ack 19039, win 498, options [nop,nop,TS val 365691644 ecr 365691644], length 0
2022-04-06 22:16:49.141303 IP (tos 0x0, ttl 64, id 5069, offset 0, flags [DF], proto TCP (6), length 3386)
    127.0.0.1.9150 > 127.0.0.1.46832: Flags [P.], cksum 0x0b2f (incorrect -> 0x7404), seq 19039:22373, ack 919, win 512, options [nop,nop,TS val 365691644 ecr 365691644], length 3334
2022-04-06 22:16:49.141309 IP (tos 0x0, ttl 64, id 754, offset 0, flags [DF], proto TCP (6), length 52)
    127.0.0.1.46832 > 127.0.0.1.9150: Flags [.], cksum 0xfe28 (incorrect -> 0xcf84), seq 919, ack 22373, win 494, options [nop,nop,TS val 365691644 ecr 365691644], length 0
2022-04-06 22:16:49.162517 IP (tos 0x0, ttl 64, id 5070, offset 0, flags [DF], proto TCP (6), length 2390)
    127.0.0.1.9150 > 127.0.0.1.46832: Flags [P.], cksum 0x074b (incorrect -> 0xab79), seq 22373:24711, ack 919, win 512, options [nop,nop,TS val 365691665 ecr 365691644], length 2338
2022-04-06 22:16:49.162526 IP (tos 0x0, ttl 64, id 755, offset 0, flags [DF], proto TCP (6), length 52)
    127.0.0.1.46832 > 127.0.0.1.9150: Flags [.], cksum 0xfe28 (incorrect -> 0xc634), seq 919, ack 24711, win 498, options [nop,nop,TS val 365691665 ecr 365691665], length 0
2022-04-06 22:16:49.187514 IP (tos 0x0, ttl 64, id 5071, offset 0, flags [DF], proto TCP (6), length 3462)
    127.0.0.1.9150 > 127.0.0.1.46832: Flags [P.], cksum 0x0b7b (incorrect -> 0x1681), seq 24711:28121, ack 919, win 512, options [nop,nop,TS val 365691690 ecr 365691665], length 3410
2022-04-06 22:16:49.187519 IP (tos 0x0, ttl 64, id 756, offset 0, flags [DF], proto TCP (6), length 52)
    127.0.0.1.46832 > 127.0.0.1.9150: Flags [.], cksum 0xfe28 (incorrect -> 0xb8b4), seq 919, ack 28121, win 494, options [nop,nop,TS val 365691690 ecr 365691690], length 0
2022-04-06 22:16:49.194770 IP (tos 0x0, ttl 64, id 5072, offset 0, flags [DF], proto TCP (6), length 1892)
    127.0.0.1.9150 > 127.0.0.1.46832: Flags [P.], cksum 0x0559 (incorrect -> 0x63ad), seq 28121:29961, ack 919, win 512, options [nop,nop,TS val 365691697 ecr 365691690], length 1840
2022-04-06 22:16:49.194777 IP (tos 0x0, ttl 64, id 757, offset 0, flags [DF], proto TCP (6), length 52)
    127.0.0.1.46832 > 127.0.0.1.9150: Flags [.], cksum 0xfe28 (incorrect -> 0xb170), seq 919, ack 29961, win 500, options [nop,nop,TS val 365691697 ecr 365691697], length 0
2022-04-06 22:16:49.218850 IP (tos 0x0, ttl 64, id 5073, offset 0, flags [DF], proto TCP (6), length 3884)
    127.0.0.1.9150 > 127.0.0.1.46832: Flags [P.], cksum 0x0d21 (incorrect -> 0x7711), seq 29961:33793, ack 919, win 512, options [nop,nop,TS val 365691721 ecr 365691697], length 3832
2022-04-06 22:16:49.262661 IP (tos 0x0, ttl 64, id 758, offset 0, flags [DF], proto TCP (6), length 52)
    127.0.0.1.46832 > 127.0.0.1.9150: Flags [.], cksum 0xfe28 (incorrect -> 0xa210), seq 919, ack 33793, win 512, options [nop,nop,TS val 365691765 ecr 365691721], length 0
2022-04-06 22:16:49.262669 IP (tos 0x0, ttl 64, id 5074, offset 0, flags [DF], proto TCP (6), length 6402)
    127.0.0.1.9150 > 127.0.0.1.46832: Flags [P.], cksum 0x16f7 (incorrect -> 0x9b9a), seq 33793:40143, ack 919, win 512, options [nop,nop,TS val 365691765 ecr 365691765], length 6350
2022-04-06 22:16:49.306653 IP (tos 0x0, ttl 64, id 759, offset 0, flags [DF], proto TCP (6), length 52)
    127.0.0.1.46832 > 127.0.0.1.9150: Flags [.], cksum 0xfe28 (incorrect -> 0x88ea), seq 919, ack 40143, win 512, options [nop,nop,TS val 365691809 ecr 365691765], length 0
2022-04-06 22:16:49.393212 IP (tos 0x0, ttl 64, id 5075, offset 0, flags [DF], proto TCP (6), length 396)
    127.0.0.1.9150 > 127.0.0.1.46832: Flags [P.], cksum 0xff80 (incorrect -> 0xa5cd), seq 40143:40487, ack 919, win 512, options [nop,nop,TS val 365691896 ecr 365691809], length 344
2022-04-06 22:16:49.393230 IP (tos 0x0, ttl 64, id 760, offset 0, flags [DF], proto TCP (6), length 52)
    127.0.0.1.46832 > 127.0.0.1.9150: Flags [.], cksum 0xfe28 (incorrect -> 0x86b8), seq 919, ack 40487, win 512, options [nop,nop,TS val 365691896 ecr 365691896], length 0
2022-04-06 22:16:49.417887 IP (tos 0x0, ttl 64, id 5076, offset 0, flags [DF], proto TCP (6), length 1470)
    127.0.0.1.9150 > 127.0.0.1.46832: Flags [P.], cksum 0x03b3 (incorrect -> 0xffa5), seq 40487:41905, ack 919, win 512, options [nop,nop,TS val 365691920 ecr 365691896], length 1418
2022-04-06 22:16:49.417904 IP (tos 0x0, ttl 64, id 761, offset 0, flags [DF], proto TCP (6), length 52)
    127.0.0.1.46832 > 127.0.0.1.9150: Flags [.], cksum 0xfe28 (incorrect -> 0x80fe), seq 919, ack 41905, win 512, options [nop,nop,TS val 365691920 ecr 365691920], length 0
2022-04-06 22:16:49.438277 IP (tos 0x0, ttl 64, id 5077, offset 0, flags [DF], proto TCP (6), length 3462)
    127.0.0.1.9150 > 127.0.0.1.46832: Flags [P.], cksum 0x0b7b (incorrect -> 0xb737), seq 41905:45315, ack 919, win 512, options [nop,nop,TS val 365691941 ecr 365691920], length 3410
2022-04-06 22:16:49.438323 IP (tos 0x0, ttl 64, id 762, offset 0, flags [DF], proto TCP (6), length 52)
    127.0.0.1.46832 > 127.0.0.1.9150: Flags [.], cksum 0xfe28 (incorrect -> 0x7382), seq 919, ack 45315, win 512, options [nop,nop,TS val 365691941 ecr 365691941], length 0
2022-04-06 22:16:49.445426 IP (tos 0x0, ttl 64, id 5078, offset 0, flags [DF], proto TCP (6), length 2122)
    127.0.0.1.9150 > 127.0.0.1.46832: Flags [P.], cksum 0x063f (incorrect -> 0xaf1a), seq 45315:47385, ack 919, win 512, options [nop,nop,TS val 365691948 ecr 365691941], length 2070
2022-04-06 22:16:49.445608 IP (tos 0x0, ttl 64, id 763, offset 0, flags [DF], proto TCP (6), length 52)
    127.0.0.1.46832 > 127.0.0.1.9150: Flags [.], cksum 0xfe28 (incorrect -> 0x6b5e), seq 919, ack 47385, win 512, options [nop,nop,TS val 365691948 ecr 365691948], length 0
2022-04-06 22:16:49.476293 IP (tos 0x0, ttl 64, id 5079, offset 0, flags [DF], proto TCP (6), length 3344)
    127.0.0.1.9150 > 127.0.0.1.46832: Flags [P.], cksum 0x0b05 (incorrect -> 0xb17a), seq 47385:50677, ack 919, win 512, options [nop,nop,TS val 365691979 ecr 365691948], length 3292
2022-04-06 22:16:49.476477 IP (tos 0x0, ttl 64, id 764, offset 0, flags [DF], proto TCP (6), length 52)
    127.0.0.1.46832 > 127.0.0.1.9150: Flags [.], cksum 0xfe28 (incorrect -> 0x5e44), seq 919, ack 50677, win 512, options [nop,nop,TS val 365691979 ecr 365691979], length 0
200, 5.686594486236572, 1.3865091800689697