2022-04-06 08:52:10.986295 IP (tos 0x0, ttl 64, id 17845, offset 0, flags [DF], proto TCP (6), length 60)
    127.0.0.1.47190 > 127.0.0.1.9250: Flags [S], cksum 0xfe30 (incorrect -> 0x5a23), seq 1155754278, win 65495, options [mss 65495,sackOK,TS val 317413489 ecr 0,nop,wscale 7], length 0
2022-04-06 08:52:10.986320 IP (tos 0x0, ttl 64, id 0, offset 0, flags [DF], proto TCP (6), length 60)
    127.0.0.1.9250 > 127.0.0.1.47190: Flags [S.], cksum 0xfe30 (incorrect -> 0x9361), seq 141316852, ack 1155754279, win 65483, options [mss 65495,sackOK,TS val 317413489 ecr 317413489,nop,wscale 7], length 0
2022-04-06 08:52:10.986329 IP (tos 0x0, ttl 64, id 17846, offset 0, flags [DF], proto TCP (6), length 52)
    127.0.0.1.47190 > 127.0.0.1.9250: Flags [.], cksum 0xfe28 (incorrect -> 0xba1d), seq 1, ack 1, win 512, options [nop,nop,TS val 317413489 ecr 317413489], length 0
2022-04-06 08:52:10.986431 IP (tos 0x0, ttl 64, id 17847, offset 0, flags [DF], proto TCP (6), length 55)
    127.0.0.1.47190 > 127.0.0.1.9250: Flags [P.], cksum 0xfe2b (incorrect -> 0xb511), seq 1:4, ack 1, win 512, options [nop,nop,TS val 317413489 ecr 317413489], length 3
2022-04-06 08:52:10.986437 IP (tos 0x0, ttl 64, id 63671, offset 0, flags [DF], proto TCP (6), length 52)
    127.0.0.1.9250 > 127.0.0.1.47190: Flags [.], cksum 0xfe28 (incorrect -> 0xba1a), seq 1, ack 4, win 512, options [nop,nop,TS val 317413489 ecr 317413489], length 0
2022-04-06 08:52:10.986516 IP (tos 0x0, ttl 64, id 63672, offset 0, flags [DF], proto TCP (6), length 54)
    127.0.0.1.9250 > 127.0.0.1.47190: Flags [P.], cksum 0xfe2a (incorrect -> 0xb510), seq 1:3, ack 4, win 512, options [nop,nop,TS val 317413489 ecr 317413489], length 2
2022-04-06 08:52:10.986523 IP (tos 0x0, ttl 64, id 17848, offset 0, flags [DF], proto TCP (6), length 52)
    127.0.0.1.47190 > 127.0.0.1.9250: Flags [.], cksum 0xfe28 (incorrect -> 0xba18), seq 4, ack 3, win 512, options [nop,nop,TS val 317413489 ecr 317413489], length 0
2022-04-06 08:52:11.207559 IP (tos 0x0, ttl 64, id 17849, offset 0, flags [DF], proto TCP (6), length 62)
    127.0.0.1.47190 > 127.0.0.1.9250: Flags [P.], cksum 0xfe32 (incorrect -> 0x19fd), seq 4:14, ack 3, win 512, options [nop,nop,TS val 317413710 ecr 317413489], length 10
2022-04-06 08:52:11.207589 IP (tos 0x0, ttl 64, id 63673, offset 0, flags [DF], proto TCP (6), length 52)
    127.0.0.1.9250 > 127.0.0.1.47190: Flags [.], cksum 0xfe28 (incorrect -> 0xb854), seq 3, ack 14, win 512, options [nop,nop,TS val 317413710 ecr 317413710], length 0
2022-04-06 08:52:11.378801 IP (tos 0x0, ttl 64, id 63674, offset 0, flags [DF], proto TCP (6), length 62)
    127.0.0.1.9250 > 127.0.0.1.47190: Flags [P.], cksum 0xfe32 (incorrect -> 0xb296), seq 3:13, ack 14, win 512, options [nop,nop,TS val 317413881 ecr 317413710], length 10
2022-04-06 08:52:11.378830 IP (tos 0x0, ttl 64, id 17850, offset 0, flags [DF], proto TCP (6), length 52)
    127.0.0.1.47190 > 127.0.0.1.9250: Flags [.], cksum 0xfe28 (incorrect -> 0xb6f4), seq 14, ack 13, win 512, options [nop,nop,TS val 317413881 ecr 317413881], length 0
2022-04-06 08:52:11.384954 IP (tos 0x0, ttl 64, id 17851, offset 0, flags [DF], proto TCP (6), length 569)
    127.0.0.1.47190 > 127.0.0.1.9250: Flags [P.], cksum 0x002e (incorrect -> 0x950f), seq 14:531, ack 13, win 512, options [nop,nop,TS val 317413887 ecr 317413881], length 517
2022-04-06 08:52:11.384980 IP (tos 0x0, ttl 64, id 63675, offset 0, flags [DF], proto TCP (6), length 52)
    127.0.0.1.9250 > 127.0.0.1.47190: Flags [.], cksum 0xfe28 (incorrect -> 0xb4e7), seq 13, ack 531, win 508, options [nop,nop,TS val 317413887 ecr 317413887], length 0
