2022-04-06 07:42:47.910506 IP (tos 0x0, ttl 64, id 19799, offset 0, flags [DF], proto TCP (6), length 60)
    127.0.0.1.47888 > 127.0.0.1.9650: Flags [S], cksum 0xfe30 (incorrect -> 0xdc8b), seq 3793931127, win 65495, options [mss 65495,sackOK,TS val 313250413 ecr 0,nop,wscale 7], length 0
2022-04-06 07:42:47.910524 IP (tos 0x0, ttl 64, id 0, offset 0, flags [DF], proto TCP (6), length 60)
    127.0.0.1.9650 > 127.0.0.1.47888: Flags [S.], cksum 0xfe30 (incorrect -> 0x813d), seq 975780871, ack 3793931128, win 65483, options [mss 65495,sackOK,TS val 313250413 ecr 313250413,nop,wscale 7], length 0
2022-04-06 07:42:47.910537 IP (tos 0x0, ttl 64, id 19800, offset 0, flags [DF], proto TCP (6), length 52)
    127.0.0.1.47888 > 127.0.0.1.9650: Flags [.], cksum 0xfe28 (incorrect -> 0xa7f9), seq 1, ack 1, win 512, options [nop,nop,TS val 313250413 ecr 313250413], length 0
2022-04-06 07:42:47.910687 IP (tos 0x0, ttl 64, id 19801, offset 0, flags [DF], proto TCP (6), length 55)
    127.0.0.1.47888 > 127.0.0.1.9650: Flags [P.], cksum 0xfe2b (incorrect -> 0xa2ed), seq 1:4, ack 1, win 512, options [nop,nop,TS val 313250413 ecr 313250413], length 3
2022-04-06 07:42:47.910704 IP (tos 0x0, ttl 64, id 38732, offset 0, flags [DF], proto TCP (6), length 52)
    127.0.0.1.9650 > 127.0.0.1.47888: Flags [.], cksum 0xfe28 (incorrect -> 0xa7f6), seq 1, ack 4, win 512, options [nop,nop,TS val 313250413 ecr 313250413], length 0
2022-04-06 07:42:47.910752 IP (tos 0x0, ttl 64, id 38733, offset 0, flags [DF], proto TCP (6), length 54)
    127.0.0.1.9650 > 127.0.0.1.47888: Flags [P.], cksum 0xfe2a (incorrect -> 0xa2ec), seq 1:3, ack 4, win 512, options [nop,nop,TS val 313250413 ecr 313250413], length 2
2022-04-06 07:42:47.910768 IP (tos 0x0, ttl 64, id 19802, offset 0, flags [DF], proto TCP (6), length 52)
    127.0.0.1.47888 > 127.0.0.1.9650: Flags [.], cksum 0xfe28 (incorrect -> 0xa7f4), seq 4, ack 3, win 512, options [nop,nop,TS val 313250413 ecr 313250413], length 0
2022-04-06 07:42:47.912391 IP (tos 0x0, ttl 64, id 19803, offset 0, flags [DF], proto TCP (6), length 62)
    127.0.0.1.47888 > 127.0.0.1.9650: Flags [P.], cksum 0xfe32 (incorrect -> 0x12fa), seq 4:14, ack 3, win 512, options [nop,nop,TS val 313250415 ecr 313250413], length 10
2022-04-06 07:42:47.912409 IP (tos 0x0, ttl 64, id 38734, offset 0, flags [DF], proto TCP (6), length 52)
    127.0.0.1.9650 > 127.0.0.1.47888: Flags [.], cksum 0xfe28 (incorrect -> 0xa7e6), seq 3, ack 14, win 512, options [nop,nop,TS val 313250415 ecr 313250415], length 0
2022-04-06 07:42:48.100742 IP (tos 0x0, ttl 64, id 38735, offset 0, flags [DF], proto TCP (6), length 62)
    127.0.0.1.9650 > 127.0.0.1.47888: Flags [P.], cksum 0xfe32 (incorrect -> 0xa217), seq 3:13, ack 14, win 512, options [nop,nop,TS val 313250603 ecr 313250415], length 10
2022-04-06 07:42:48.100752 IP (tos 0x0, ttl 64, id 19804, offset 0, flags [DF], proto TCP (6), length 52)
    127.0.0.1.47888 > 127.0.0.1.9650: Flags [.], cksum 0xfe28 (incorrect -> 0xa664), seq 14, ack 13, win 512, options [nop,nop,TS val 313250603 ecr 313250603], length 0
2022-04-06 07:42:48.106766 IP (tos 0x0, ttl 64, id 19805, offset 0, flags [DF], proto TCP (6), length 569)
    127.0.0.1.47888 > 127.0.0.1.9650: Flags [P.], cksum 0x002e (incorrect -> 0xdb0b), seq 14:531, ack 13, win 512, options [nop,nop,TS val 313250609 ecr 313250603], length 517
2022-04-06 07:42:48.106773 IP (tos 0x0, ttl 64, id 38736, offset 0, flags [DF], proto TCP (6), length 52)
    127.0.0.1.9650 > 127.0.0.1.47888: Flags [.], cksum 0xfe28 (incorrect -> 0xa457), seq 13, ack 531, win 508, options [nop,nop,TS val 313250609 ecr 313250609], length 0
2022-04-06 07:42:48.295213 IP (tos 0x0, ttl 64, id 38737, offset 0, flags [DF], proto TCP (6), length 3538)
    127.0.0.1.9650 > 127.0.0.1.47888: Flags [P.], cksum 0x0bc7 (incorrect -> 0x74a5), seq 13:3499, ack 531, win 512, options [nop,nop,TS val 313250798 ecr 313250609], length 3486
2022-04-06 07:42:48.295221 IP (tos 0x0, ttl 64, id 19806, offset 0, flags [DF], proto TCP (6), length 52)
    127.0.0.1.47888 > 127.0.0.1.9650: Flags [.], cksum 0xfe28 (incorrect -> 0x954d), seq 531, ack 3499, win 494, options [nop,nop,TS val 313250798 ecr 313250798], length 0
2022-04-06 07:42:48.304440 IP (tos 0x0, ttl 64, id 38738, offset 0, flags [DF], proto TCP (6), length 662)
    127.0.0.1.9650 > 127.0.0.1.47888: Flags [P.], cksum 0x008b (incorrect -> 0x1038), seq 3499:4109, ack 531, win 512, options [nop,nop,TS val 313250807 ecr 313250798], length 610
2022-04-06 07:42:48.304446 IP (tos 0x0, ttl 64, id 19807, offset 0, flags [DF], proto TCP (6), length 52)
    127.0.0.1.47888 > 127.0.0.1.9650: Flags [.], cksum 0xfe28 (incorrect -> 0x92ce), seq 531, ack 4109, win 505, options [nop,nop,TS val 313250807 ecr 313250807], length 0
2022-04-06 07:42:48.382107 IP (tos 0x0, ttl 64, id 38739, offset 0, flags [DF], proto TCP (6), length 738)
    127.0.0.1.9650 > 127.0.0.1.47888: Flags [P.], cksum 0x00d7 (incorrect -> 0xc5c1), seq 4109:4795, ack 531, win 512, options [nop,nop,TS val 313250885 ecr 313250807], length 686
2022-04-06 07:42:48.382113 IP (tos 0x0, ttl 64, id 19808, offset 0, flags [DF], proto TCP (6), length 52)
    127.0.0.1.47888 > 127.0.0.1.9650: Flags [.], cksum 0xfe28 (incorrect -> 0x8f84), seq 531, ack 4795, win 505, options [nop,nop,TS val 313250885 ecr 313250885], length 0
2022-04-06 07:42:48.382465 IP (tos 0x0, ttl 64, id 19809, offset 0, flags [DF], proto TCP (6), length 132)
    127.0.0.1.47888 > 127.0.0.1.9650: Flags [P.], cksum 0xfe78 (incorrect -> 0xf85f), seq 531:611, ack 4795, win 512, options [nop,nop,TS val 313250885 ecr 313250885], length 80
2022-04-06 07:42:48.382472 IP (tos 0x0, ttl 64, id 38740, offset 0, flags [DF], proto TCP (6), length 52)
    127.0.0.1.9650 > 127.0.0.1.47888: Flags [.], cksum 0xfe28 (incorrect -> 0x8f2d), seq 4795, ack 611, win 512, options [nop,nop,TS val 313250885 ecr 313250885], length 0
2022-04-06 07:42:48.382872 IP (tos 0x0, ttl 64, id 19810, offset 0, flags [DF], proto TCP (6), length 334)
    127.0.0.1.47888 > 127.0.0.1.9650: Flags [P.], cksum 0xff42 (incorrect -> 0x6cbb), seq 611:893, ack 4795, win 512, options [nop,nop,TS val 313250885 ecr 313250885], length 282
2022-04-06 07:42:48.382880 IP (tos 0x0, ttl 64, id 38741, offset 0, flags [DF], proto TCP (6), length 52)
    127.0.0.1.9650 > 127.0.0.1.47888: Flags [.], cksum 0xfe28 (incorrect -> 0x8e15), seq 4795, ack 893, win 510, options [nop,nop,TS val 313250885 ecr 313250885], length 0
2022-04-06 07:42:48.569246 IP (tos 0x0, ttl 64, id 38742, offset 0, flags [DF], proto TCP (6), length 594)
    127.0.0.1.9650 > 127.0.0.1.47888: Flags [P.], cksum 0x0047 (incorrect -> 0xa77f), seq 4795:5337, ack 893, win 512, options [nop,nop,TS val 313251072 ecr 313250885], length 542
2022-04-06 07:42:48.569251 IP (tos 0x0, ttl 64, id 19811, offset 0, flags [DF], proto TCP (6), length 52)
    127.0.0.1.47888 > 127.0.0.1.9650: Flags [.], cksum 0xfe28 (incorrect -> 0x8a83), seq 893, ack 5337, win 508, options [nop,nop,TS val 313251072 ecr 313251072], length 0
2022-04-06 07:42:48.666904 IP (tos 0x0, ttl 64, id 38743, offset 0, flags [DF], proto TCP (6), length 3538)
    127.0.0.1.9650 > 127.0.0.1.47888: Flags [P.], cksum 0x0bc7 (incorrect -> 0x4032), seq 5337:8823, ack 893, win 512, options [nop,nop,TS val 313251169 ecr 313251072], length 3486
2022-04-06 07:42:48.666911 IP (tos 0x0, ttl 64, id 19812, offset 0, flags [DF], proto TCP (6), length 52)
    127.0.0.1.47888 > 127.0.0.1.9650: Flags [.], cksum 0xfe28 (incorrect -> 0x7c31), seq 893, ack 8823, win 494, options [nop,nop,TS val 313251169 ecr 313251169], length 0
2022-04-06 07:42:48.676146 IP (tos 0x0, ttl 64, id 38744, offset 0, flags [DF], proto TCP (6), length 4036)
    127.0.0.1.9650 > 127.0.0.1.47888: Flags [P.], cksum 0x0db9 (incorrect -> 0xcfaa), seq 8823:12807, ack 893, win 512, options [nop,nop,TS val 313251179 ecr 313251169], length 3984
2022-04-06 07:42:48.676153 IP (tos 0x0, ttl 64, id 19813, offset 0, flags [DF], proto TCP (6), length 52)
    127.0.0.1.47888 > 127.0.0.1.9650: Flags [.], cksum 0xfe28 (incorrect -> 0x6c8f), seq 893, ack 12807, win 492, options [nop,nop,TS val 313251179 ecr 313251179], length 0
2022-04-06 07:42:48.687132 IP (tos 0x0, ttl 64, id 38745, offset 0, flags [DF], proto TCP (6), length 4036)
    127.0.0.1.9650 > 127.0.0.1.47888: Flags [P.], cksum 0x0db9 (incorrect -> 0x46c1), seq 12807:16791, ack 893, win 512, options [nop,nop,TS val 313251190 ecr 313251179], length 3984
2022-04-06 07:42:48.687138 IP (tos 0x0, ttl 64, id 19814, offset 0, flags [DF], proto TCP (6), length 52)
    127.0.0.1.47888 > 127.0.0.1.9650: Flags [.], cksum 0xfe28 (incorrect -> 0x5ce9), seq 893, ack 16791, win 492, options [nop,nop,TS val 313251190 ecr 313251190], length 0
2022-04-06 07:42:48.701059 IP (tos 0x0, ttl 64, id 38746, offset 0, flags [DF], proto TCP (6), length 3078)
    127.0.0.1.9650 > 127.0.0.1.47888: Flags [P.], cksum 0x09fb (incorrect -> 0x1439), seq 16791:19817, ack 893, win 512, options [nop,nop,TS val 313251203 ecr 313251190], length 3026
2022-04-06 07:42:48.701066 IP (tos 0x0, ttl 64, id 19815, offset 0, flags [DF], proto TCP (6), length 52)
    127.0.0.1.47888 > 127.0.0.1.9650: Flags [.], cksum 0xfe28 (incorrect -> 0x50f8), seq 893, ack 19817, win 496, options [nop,nop,TS val 313251204 ecr 313251203], length 0
2022-04-06 07:42:48.753879 IP (tos 0x0, ttl 64, id 38747, offset 0, flags [DF], proto TCP (6), length 3446)
    127.0.0.1.9650 > 127.0.0.1.47888: Flags [P.], cksum 0x0b6b (incorrect -> 0x2a4d), seq 19817:23211, ack 893, win 512, options [nop,nop,TS val 313251256 ecr 313251204], length 3394
2022-04-06 07:42:48.753885 IP (tos 0x0, ttl 64, id 19816, offset 0, flags [DF], proto TCP (6), length 52)
    127.0.0.1.47888 > 127.0.0.1.9650: Flags [.], cksum 0xfe28 (incorrect -> 0x434f), seq 893, ack 23211, win 494, options [nop,nop,TS val 313251256 ecr 313251256], length 0
2022-04-06 07:42:48.754991 IP (tos 0x0, ttl 64, id 38748, offset 0, flags [DF], proto TCP (6), length 3446)
    127.0.0.1.9650 > 127.0.0.1.47888: Flags [P.], cksum 0x0b6b (incorrect -> 0x145d), seq 23211:26605, ack 893, win 512, options [nop,nop,TS val 313251257 ecr 313251256], length 3394
2022-04-06 07:42:48.754996 IP (tos 0x0, ttl 64, id 19817, offset 0, flags [DF], proto TCP (6), length 52)
    127.0.0.1.47888 > 127.0.0.1.9650: Flags [.], cksum 0xfe28 (incorrect -> 0x3618), seq 893, ack 26605, win 481, options [nop,nop,TS val 313251257 ecr 313251257], length 0
2022-04-06 07:42:48.755065 IP (tos 0x0, ttl 64, id 38749, offset 0, flags [DF], proto TCP (6), length 3944)
    127.0.0.1.9650 > 127.0.0.1.47888: Flags [P.], cksum 0x0d5d (incorrect -> 0xfb8b), seq 26605:30497, ack 893, win 512, options [nop,nop,TS val 313251258 ecr 313251257], length 3892
2022-04-06 07:42:48.802658 IP (tos 0x0, ttl 64, id 19818, offset 0, flags [DF], proto TCP (6), length 52)
    127.0.0.1.47888 > 127.0.0.1.9650: Flags [.], cksum 0xfe28 (incorrect -> 0x2694), seq 893, ack 30497, win 512, options [nop,nop,TS val 313251305 ecr 313251258], length 0
2022-04-06 07:42:48.802715 IP (tos 0x0, ttl 64, id 38750, offset 0, flags [DF], proto TCP (6), length 18332)
    127.0.0.1.9650 > 127.0.0.1.47888: Flags [P.], cksum 0x4591 (incorrect -> 0xdb18), seq 30497:48777, ack 893, win 512, options [nop,nop,TS val 313251305 ecr 313251305], length 18280
2022-04-06 07:42:48.846671 IP (tos 0x0, ttl 64, id 19819, offset 0, flags [DF], proto TCP (6), length 52)
    127.0.0.1.47888 > 127.0.0.1.9650: Flags [.], cksum 0xfe28 (incorrect -> 0xded0), seq 893, ack 48777, win 512, options [nop,nop,TS val 313251349 ecr 313251305], length 0
2022-04-06 07:42:48.857234 IP (tos 0x0, ttl 64, id 38751, offset 0, flags [DF], proto TCP (6), length 4100)
    127.0.0.1.9650 > 127.0.0.1.47888: Flags [P.], cksum 0x0df9 (incorrect -> 0xa2e2), seq 48777:52825, ack 893, win 512, options [nop,nop,TS val 313251360 ecr 313251349], length 4048
2022-04-06 07:42:48.857328 IP (tos 0x0, ttl 64, id 19820, offset 0, flags [DF], proto TCP (6), length 52)
    127.0.0.1.47888 > 127.0.0.1.9650: Flags [.], cksum 0xfe28 (incorrect -> 0xcebe), seq 893, ack 52825, win 512, options [nop,nop,TS val 313251360 ecr 313251360], length 0
2022-04-06 07:42:48.857334 IP (tos 0x0, ttl 64, id 38752, offset 0, flags [DF], proto TCP (6), length 8086)
    127.0.0.1.9650 > 127.0.0.1.47888: Flags [P.], cksum 0x1d8b (incorrect -> 0x7285), seq 52825:60859, ack 893, win 512, options [nop,nop,TS val 313251360 ecr 313251360], length 8034
2022-04-06 07:42:48.857829 IP (tos 0x0, ttl 64, id 19821, offset 0, flags [DF], proto TCP (6), length 52)
    127.0.0.1.47888 > 127.0.0.1.9650: Flags [.], cksum 0xfe28 (incorrect -> 0xaf5c), seq 893, ack 60859, win 512, options [nop,nop,TS val 313251360 ecr 313251360], length 0
2022-04-06 07:42:48.858911 IP (tos 0x0, ttl 64, id 38753, offset 0, flags [DF], proto TCP (6), length 2450)
    127.0.0.1.9650 > 127.0.0.1.47888: Flags [P.], cksum 0x0787 (incorrect -> 0x746a), seq 60859:63257, ack 893, win 512, options [nop,nop,TS val 313251361 ecr 313251360], length 2398
2022-04-06 07:42:48.858924 IP (tos 0x0, ttl 64, id 19822, offset 0, flags [DF], proto TCP (6), length 52)
    127.0.0.1.47888 > 127.0.0.1.9650: Flags [.], cksum 0xfe28 (incorrect -> 0xa5fc), seq 893, ack 63257, win 512, options [nop,nop,TS val 313251361 ecr 313251361], length 0
2022-04-06 07:42:48.861952 IP (tos 0x0, ttl 64, id 38754, offset 0, flags [DF], proto TCP (6), length 4100)
    127.0.0.1.9650 > 127.0.0.1.47888: Flags [P.], cksum 0x0df9 (incorrect -> 0x3371), seq 63257:67305, ack 893, win 512, options [nop,nop,TS val 313251364 ecr 313251361], length 4048
2022-04-06 07:42:48.862069 IP (tos 0x0, ttl 64, id 19823, offset 0, flags [DF], proto TCP (6), length 52)
    127.0.0.1.47888 > 127.0.0.1.9650: Flags [.], cksum 0xfe28 (incorrect -> 0x9625), seq 893, ack 67305, win 512, options [nop,nop,TS val 313251365 ecr 313251364], length 0
2022-04-06 07:42:48.862074 IP (tos 0x0, ttl 64, id 38755, offset 0, flags [DF], proto TCP (6), length 11978)
    127.0.0.1.9650 > 127.0.0.1.47888: Flags [P.], cksum 0x2cbf (incorrect -> 0x35b4), seq 67305:79231, ack 893, win 512, options [nop,nop,TS val 313251365 ecr 313251365], length 11926
2022-04-06 07:42:48.862517 IP (tos 0x0, ttl 64, id 19824, offset 0, flags [DF], proto TCP (6), length 52)
    127.0.0.1.47888 > 127.0.0.1.9650: Flags [.], cksum 0xfe28 (incorrect -> 0x678e), seq 893, ack 79231, win 512, options [nop,nop,TS val 313251365 ecr 313251365], length 0
2022-04-06 07:42:48.864249 IP (tos 0x0, ttl 64, id 38756, offset 0, flags [DF], proto TCP (6), length 550)
    127.0.0.1.9650 > 127.0.0.1.47888: Flags [P.], cksum 0x001b (incorrect -> 0xeab4), seq 79231:79729, ack 893, win 512, options [nop,nop,TS val 313251367 ecr 313251365], length 498
2022-04-06 07:42:48.864261 IP (tos 0x0, ttl 64, id 19825, offset 0, flags [DF], proto TCP (6), length 52)
    127.0.0.1.47888 > 127.0.0.1.9650: Flags [.], cksum 0xfe28 (incorrect -> 0x6598), seq 893, ack 79729, win 512, options [nop,nop,TS val 313251367 ecr 313251367], length 0
2022-04-06 07:42:48.864883 IP (tos 0x0, ttl 64, id 38757, offset 0, flags [DF], proto TCP (6), length 4100)
    127.0.0.1.9650 > 127.0.0.1.47888: Flags [P.], cksum 0x0df9 (incorrect -> 0xb138), seq 79729:83777, ack 893, win 512, options [nop,nop,TS val 313251367 ecr 313251367], length 4048
2022-04-06 07:42:48.864900 IP (tos 0x0, ttl 64, id 19826, offset 0, flags [DF], proto TCP (6), length 52)
    127.0.0.1.47888 > 127.0.0.1.9650: Flags [.], cksum 0xfe28 (incorrect -> 0x55c8), seq 893, ack 83777, win 512, options [nop,nop,TS val 313251367 ecr 313251367], length 0
2022-04-06 07:42:48.864903 IP (tos 0x0, ttl 64, id 38758, offset 0, flags [DF], proto TCP (6), length 1796)
    127.0.0.1.9650 > 127.0.0.1.47888: Flags [P.], cksum 0x04f9 (incorrect -> 0x12a8), seq 83777:85521, ack 893, win 512, options [nop,nop,TS val 313251367 ecr 313251367], length 1744
2022-04-06 07:42:48.865128 IP (tos 0x0, ttl 64, id 19827, offset 0, flags [DF], proto TCP (6), length 52)
    127.0.0.1.47888 > 127.0.0.1.9650: Flags [.], cksum 0xfe28 (incorrect -> 0x4ef7), seq 893, ack 85521, win 512, options [nop,nop,TS val 313251368 ecr 313251367], length 0
2022-04-06 07:42:48.865781 IP (tos 0x0, ttl 64, id 38759, offset 0, flags [DF], proto TCP (6), length 3446)
    127.0.0.1.9650 > 127.0.0.1.47888: Flags [P.], cksum 0x0b6b (incorrect -> 0xccb5), seq 85521:88915, ack 893, win 512, options [nop,nop,TS val 313251368 ecr 313251368], length 3394
2022-04-06 07:42:48.865794 IP (tos 0x0, ttl 64, id 19828, offset 0, flags [DF], proto TCP (6), length 52)
    127.0.0.1.47888 > 127.0.0.1.9650: Flags [.], cksum 0xfe28 (incorrect -> 0x41b4), seq 893, ack 88915, win 512, options [nop,nop,TS val 313251368 ecr 313251368], length 0
2022-04-06 07:42:48.871265 IP (tos 0x0, ttl 64, id 38760, offset 0, flags [DF], proto TCP (6), length 3354)
    127.0.0.1.9650 > 127.0.0.1.47888: Flags [P.], cksum 0x0b0f (incorrect -> 0x44af), seq 88915:92217, ack 893, win 512, options [nop,nop,TS val 313251374 ecr 313251368], length 3302
2022-04-06 07:42:48.871279 IP (tos 0x0, ttl 64, id 19829, offset 0, flags [DF], proto TCP (6), length 52)
    127.0.0.1.47888 > 127.0.0.1.9650: Flags [.], cksum 0xfe28 (incorrect -> 0x34c2), seq 893, ack 92217, win 512, options [nop,nop,TS val 313251374 ecr 313251374], length 0
2022-04-06 07:42:48.873677 IP (tos 0x0, ttl 64, id 38761, offset 0, flags [DF], proto TCP (6), length 4100)
    127.0.0.1.9650 > 127.0.0.1.47888: Flags [P.], cksum 0x0df9 (incorrect -> 0xb763), seq 92217:96265, ack 893, win 512, options [nop,nop,TS val 313251376 ecr 313251374], length 4048
2022-04-06 07:42:48.873720 IP (tos 0x0, ttl 64, id 19830, offset 0, flags [DF], proto TCP (6), length 52)
    127.0.0.1.47888 > 127.0.0.1.9650: Flags [.], cksum 0xfe28 (incorrect -> 0x24ee), seq 893, ack 96265, win 512, options [nop,nop,TS val 313251376 ecr 313251376], length 0
2022-04-06 07:42:48.873724 IP (tos 0x0, ttl 64, id 38762, offset 0, flags [DF], proto TCP (6), length 7182)
    127.0.0.1.9650 > 127.0.0.1.47888: Flags [P.], cksum 0x1a03 (incorrect -> 0xdbb7), seq 96265:103395, ack 893, win 512, options [nop,nop,TS val 313251376 ecr 313251376], length 7130
2022-04-06 07:42:48.874206 IP (tos 0x0, ttl 64, id 19831, offset 0, flags [DF], proto TCP (6), length 52)
    127.0.0.1.47888 > 127.0.0.1.9650: Flags [.], cksum 0xfe28 (incorrect -> 0x0913), seq 893, ack 103395, win 512, options [nop,nop,TS val 313251377 ecr 313251376], length 0
2022-04-06 07:42:48.882939 IP (tos 0x0, ttl 64, id 38763, offset 0, flags [DF], proto TCP (6), length 3354)
    127.0.0.1.9650 > 127.0.0.1.47888: Flags [P.], cksum 0x0b0f (incorrect -> 0x9bf4), seq 103395:106697, ack 893, win 512, options [nop,nop,TS val 313251385 ecr 313251377], length 3302
2022-04-06 07:42:48.882952 IP (tos 0x0, ttl 64, id 19832, offset 0, flags [DF], proto TCP (6), length 52)
    127.0.0.1.47888 > 127.0.0.1.9650: Flags [.], cksum 0xfe28 (incorrect -> 0xfc1b), seq 893, ack 106697, win 512, options [nop,nop,TS val 313251385 ecr 313251385], length 0
2022-04-06 07:42:48.926799 IP (tos 0x0, ttl 64, id 38764, offset 0, flags [DF], proto TCP (6), length 3446)
    127.0.0.1.9650 > 127.0.0.1.47888: Flags [P.], cksum 0x0b6b (incorrect -> 0x713b), seq 106697:110091, ack 893, win 512, options [nop,nop,TS val 313251429 ecr 313251385], length 3394
2022-04-06 07:42:48.927178 IP (tos 0x0, ttl 64, id 19833, offset 0, flags [DF], proto TCP (6), length 52)
    127.0.0.1.47888 > 127.0.0.1.9650: Flags [.], cksum 0xfe28 (incorrect -> 0xee80), seq 893, ack 110091, win 512, options [nop,nop,TS val 313251430 ecr 313251429], length 0
2022-04-06 07:42:48.927976 IP (tos 0x0, ttl 64, id 38765, offset 0, flags [DF], proto TCP (6), length 3944)
    127.0.0.1.9650 > 127.0.0.1.47888: Flags [P.], cksum 0x0d5d (incorrect -> 0xc3ef), seq 110091:113983, ack 893, win 512, options [nop,nop,TS val 313251430 ecr 313251430], length 3892
2022-04-06 07:42:48.928061 IP (tos 0x0, ttl 64, id 19834, offset 0, flags [DF], proto TCP (6), length 52)
    127.0.0.1.47888 > 127.0.0.1.9650: Flags [.], cksum 0xfe28 (incorrect -> 0xdf4a), seq 893, ack 113983, win 512, options [nop,nop,TS val 313251431 ecr 313251430], length 0
200, 6.840296030044556, 1.0433125495910645