2022-04-06 02:03:26.419786 IP (tos 0x0, ttl 64, id 6238, offset 0, flags [DF], proto TCP (6), length 60)
    127.0.0.1.45332 > 127.0.0.1.10650: Flags [S], cksum 0xfe30 (incorrect -> 0xcf58), seq 1750141658, win 65495, options [mss 65495,sackOK,TS val 292888922 ecr 0,nop,wscale 7], length 0
2022-04-06 02:03:26.419797 IP (tos 0x0, ttl 64, id 0, offset 0, flags [DF], proto TCP (6), length 60)
    127.0.0.1.10650 > 127.0.0.1.45332: Flags [S.], cksum 0xfe30 (incorrect -> 0x8594), seq 1056626677, ack 1750141659, win 65483, options [mss 65495,sackOK,TS val 292888922 ecr 292888922,nop,wscale 7], length 0
2022-04-06 02:03:26.419808 IP (tos 0x0, ttl 64, id 6239, offset 0, flags [DF], proto TCP (6), length 52)
    127.0.0.1.45332 > 127.0.0.1.10650: Flags [.], cksum 0xfe28 (incorrect -> 0xac50), seq 1, ack 1, win 512, options [nop,nop,TS val 292888922 ecr 292888922], length 0
2022-04-06 02:03:26.419900 IP (tos 0x0, ttl 64, id 6240, offset 0, flags [DF], proto TCP (6), length 55)
    127.0.0.1.45332 > 127.0.0.1.10650: Flags [P.], cksum 0xfe2b (incorrect -> 0xa744), seq 1:4, ack 1, win 512, options [nop,nop,TS val 292888922 ecr 292888922], length 3
2022-04-06 02:03:26.419909 IP (tos 0x0, ttl 64, id 34024, offset 0, flags [DF], proto TCP (6), length 52)
    127.0.0.1.10650 > 127.0.0.1.45332: Flags [.], cksum 0xfe28 (incorrect -> 0xac4d), seq 1, ack 4, win 512, options [nop,nop,TS val 292888922 ecr 292888922], length 0
2022-04-06 02:03:26.419953 IP (tos 0x0, ttl 64, id 34025, offset 0, flags [DF], proto TCP (6), length 54)
    127.0.0.1.10650 > 127.0.0.1.45332: Flags [P.], cksum 0xfe2a (incorrect -> 0xa743), seq 1:3, ack 4, win 512, options [nop,nop,TS val 292888922 ecr 292888922], length 2
2022-04-06 02:03:26.419963 IP (tos 0x0, ttl 64, id 6241, offset 0, flags [DF], proto TCP (6), length 52)
    127.0.0.1.45332 > 127.0.0.1.10650: Flags [.], cksum 0xfe28 (incorrect -> 0xac4b), seq 4, ack 3, win 512, options [nop,nop,TS val 292888922 ecr 292888922], length 0
200, 11.668858766555786, 2.078289031982422