2022-04-06 03:53:45.715837 IP (tos 0x0, ttl 64, id 34083, offset 0, flags [DF], proto TCP (6), length 60)
    127.0.0.1.38862 > 127.0.0.1.11950: Flags [S], cksum 0xfe30 (incorrect -> 0x11bf), seq 2300492499, win 65495, options [mss 65495,sackOK,TS val 299508218 ecr 0,nop,wscale 7], length 0
2022-04-06 03:53:45.715853 IP (tos 0x0, ttl 64, id 0, offset 0, flags [DF], proto TCP (6), length 60)
    127.0.0.1.11950 > 127.0.0.1.38862: Flags [S.], cksum 0xfe30 (incorrect -> 0x0f75), seq 3053787243, ack 2300492500, win 65483, options [mss 65495,sackOK,TS val 299508218 ecr 299508218,nop,wscale 7], length 0
2022-04-06 03:53:45.715866 IP (tos 0x0, ttl 64, id 34084, offset 0, flags [DF], proto TCP (6), length 52)
    127.0.0.1.38862 > 127.0.0.1.11950: Flags [.], cksum 0xfe28 (incorrect -> 0x3631), seq 1, ack 1, win 512, options [nop,nop,TS val 299508218 ecr 299508218], length 0
2022-04-06 03:53:45.715978 IP (tos 0x0, ttl 64, id 34085, offset 0, flags [DF], proto TCP (6), length 55)
    127.0.0.1.38862 > 127.0.0.1.11950: Flags [P.], cksum 0xfe2b (incorrect -> 0x3125), seq 1:4, ack 1, win 512, options [nop,nop,TS val 299508218 ecr 299508218], length 3
2022-04-06 03:53:45.715995 IP (tos 0x0, ttl 64, id 37008, offset 0, flags [DF], proto TCP (6), length 52)
    127.0.0.1.11950 > 127.0.0.1.38862: Flags [.], cksum 0xfe28 (incorrect -> 0x362e), seq 1, ack 4, win 512, options [nop,nop,TS val 299508218 ecr 299508218], length 0
2022-04-06 03:53:45.716034 IP (tos 0x0, ttl 64, id 37009, offset 0, flags [DF], proto TCP (6), length 54)
    127.0.0.1.11950 > 127.0.0.1.38862: Flags [P.], cksum 0xfe2a (incorrect -> 0x3124), seq 1:3, ack 4, win 512, options [nop,nop,TS val 299508218 ecr 299508218], length 2
2022-04-06 03:53:45.716048 IP (tos 0x0, ttl 64, id 34086, offset 0, flags [DF], proto TCP (6), length 52)
    127.0.0.1.38862 > 127.0.0.1.11950: Flags [.], cksum 0xfe28 (incorrect -> 0x362c), seq 4, ack 3, win 512, options [nop,nop,TS val 299508218 ecr 299508218], length 0
2022-04-06 03:53:45.733316 IP (tos 0x0, ttl 64, id 34087, offset 0, flags [DF], proto TCP (6), length 62)
    127.0.0.1.38862 > 127.0.0.1.11950: Flags [P.], cksum 0xfe32 (incorrect -> 0xcabe), seq 4:14, ack 3, win 512, options [nop,nop,TS val 299508236 ecr 299508218], length 10
2022-04-06 03:53:45.733325 IP (tos 0x0, ttl 64, id 37010, offset 0, flags [DF], proto TCP (6), length 52)
    127.0.0.1.11950 > 127.0.0.1.38862: Flags [.], cksum 0xfe28 (incorrect -> 0x35fe), seq 3, ack 14, win 512, options [nop,nop,TS val 299508236 ecr 299508236], length 0
2022-04-06 03:53:45.979799 IP (tos 0x0, ttl 64, id 37011, offset 0, flags [DF], proto TCP (6), length 62)
    127.0.0.1.11950 > 127.0.0.1.38862: Flags [P.], cksum 0xfe32 (incorrect -> 0x2ff5), seq 3:13, ack 14, win 512, options [nop,nop,TS val 299508482 ecr 299508236], length 10
2022-04-06 03:53:45.979810 IP (tos 0x0, ttl 64, id 34088, offset 0, flags [DF], proto TCP (6), length 52)
    127.0.0.1.38862 > 127.0.0.1.11950: Flags [.], cksum 0xfe28 (incorrect -> 0x3408), seq 14, ack 13, win 512, options [nop,nop,TS val 299508482 ecr 299508482], length 0
2022-04-06 03:53:45.985551 IP (tos 0x0, ttl 64, id 34089, offset 0, flags [DF], proto TCP (6), length 569)
    127.0.0.1.38862 > 127.0.0.1.11950: Flags [P.], cksum 0x002e (incorrect -> 0x7dd6), seq 14:531, ack 13, win 512, options [nop,nop,TS val 299508488 ecr 299508482], length 517
2022-04-06 03:53:45.985560 IP (tos 0x0, ttl 64, id 37012, offset 0, flags [DF], proto TCP (6), length 52)
    127.0.0.1.11950 > 127.0.0.1.38862: Flags [.], cksum 0xfe28 (incorrect -> 0x31fb), seq 13, ack 531, win 508, options [nop,nop,TS val 299508488 ecr 299508488], length 0
2022-04-06 03:53:46.246004 IP (tos 0x0, ttl 64, id 37013, offset 0, flags [DF], proto TCP (6), length 3274)
    127.0.0.1.11950 > 127.0.0.1.38862: Flags [P.], cksum 0x0abf (incorrect -> 0x49f5), seq 13:3235, ack 531, win 512, options [nop,nop,TS val 299508748 ecr 299508488], length 3222
2022-04-06 03:53:46.246016 IP (tos 0x0, ttl 64, id 34090, offset 0, flags [DF], proto TCP (6), length 52)
    127.0.0.1.38862 > 127.0.0.1.11950: Flags [.], cksum 0xfe28 (incorrect -> 0x236a), seq 531, ack 3235, win 495, options [nop,nop,TS val 299508748 ecr 299508748], length 0
2022-04-06 03:53:46.246677 IP (tos 0x0, ttl 64, id 34091, offset 0, flags [DF], proto TCP (6), length 178)
    127.0.0.1.38862 > 127.0.0.1.11950: Flags [P.], cksum 0xfea6 (incorrect -> 0x9f6d), seq 531:657, ack 3235, win 512, options [nop,nop,TS val 299508749 ecr 299508748], length 126
2022-04-06 03:53:46.246685 IP (tos 0x0, ttl 64, id 37014, offset 0, flags [DF], proto TCP (6), length 52)
    127.0.0.1.11950 > 127.0.0.1.38862: Flags [.], cksum 0xfe28 (incorrect -> 0x22d9), seq 3235, ack 657, win 512, options [nop,nop,TS val 299508749 ecr 299508749], length 0
2022-04-06 03:53:46.490816 IP (tos 0x0, ttl 64, id 37015, offset 0, flags [DF], proto TCP (6), length 310)
    127.0.0.1.11950 > 127.0.0.1.38862: Flags [P.], cksum 0xff2a (incorrect -> 0x2b49), seq 3235:3493, ack 657, win 512, options [nop,nop,TS val 299508993 ecr 299508749], length 258
2022-04-06 03:53:46.490837 IP (tos 0x0, ttl 64, id 34092, offset 0, flags [DF], proto TCP (6), length 52)
    127.0.0.1.38862 > 127.0.0.1.11950: Flags [.], cksum 0xfe28 (incorrect -> 0x1ff1), seq 657, ack 3493, win 510, options [nop,nop,TS val 299508993 ecr 299508993], length 0
2022-04-06 03:53:46.491398 IP (tos 0x0, ttl 64, id 34093, offset 0, flags [DF], proto TCP (6), length 303)
    127.0.0.1.38862 > 127.0.0.1.11950: Flags [P.], cksum 0xff23 (incorrect -> 0xcce8), seq 657:908, ack 3493, win 512, options [nop,nop,TS val 299508994 ecr 299508993], length 251
2022-04-06 03:53:46.491408 IP (tos 0x0, ttl 64, id 37016, offset 0, flags [DF], proto TCP (6), length 52)
    127.0.0.1.11950 > 127.0.0.1.38862: Flags [.], cksum 0xfe28 (incorrect -> 0x1ef3), seq 3493, ack 908, win 511, options [nop,nop,TS val 299508994 ecr 299508994], length 0
2022-04-06 03:53:46.823897 IP (tos 0x0, ttl 64, id 37017, offset 0, flags [DF], proto TCP (6), length 510)
    127.0.0.1.11950 > 127.0.0.1.38862: Flags [P.], cksum 0xfff2 (incorrect -> 0x472d), seq 3493:3951, ack 908, win 512, options [nop,nop,TS val 299509326 ecr 299508994], length 458
2022-04-06 03:53:46.823922 IP (tos 0x0, ttl 64, id 37018, offset 0, flags [DF], proto TCP (6), length 52)
    127.0.0.1.11950 > 127.0.0.1.38862: Flags [F.], cksum 0xfe28 (incorrect -> 0x1bdb), seq 3951, ack 908, win 512, options [nop,nop,TS val 299509326 ecr 299508994], length 0
2022-04-06 03:53:46.824803 IP (tos 0x0, ttl 64, id 34094, offset 0, flags [DF], proto TCP (6), length 52)
    127.0.0.1.38862 > 127.0.0.1.11950: Flags [R.], cksum 0xfe28 (incorrect -> 0x1a8a), seq 908, ack 3952, win 512, options [nop,nop,TS val 299509327 ecr 299509326], length 0
2022-04-06 03:53:46.825999 IP (tos 0x0, ttl 64, id 39273, offset 0, flags [DF], proto TCP (6), length 60)
    127.0.0.1.38864 > 127.0.0.1.11950: Flags [S], cksum 0xfe30 (incorrect -> 0xb4ec), seq 1250906589, win 65495, options [mss 65495,sackOK,TS val 299509328 ecr 0,nop,wscale 7], length 0
2022-04-06 03:53:46.826008 IP (tos 0x0, ttl 64, id 0, offset 0, flags [DF], proto TCP (6), length 60)
    127.0.0.1.11950 > 127.0.0.1.38864: Flags [S.], cksum 0xfe30 (incorrect -> 0x363f), seq 817829311, ack 1250906590, win 65483, options [mss 65495,sackOK,TS val 299509328 ecr 299509328,nop,wscale 7], length 0
2022-04-06 03:53:46.826016 IP (tos 0x0, ttl 64, id 39274, offset 0, flags [DF], proto TCP (6), length 52)
    127.0.0.1.38864 > 127.0.0.1.11950: Flags [.], cksum 0xfe28 (incorrect -> 0x5cfb), seq 1, ack 1, win 512, options [nop,nop,TS val 299509328 ecr 299509328], length 0
2022-04-06 03:53:46.826068 IP (tos 0x0, ttl 64, id 39275, offset 0, flags [DF], proto TCP (6), length 55)
    127.0.0.1.38864 > 127.0.0.1.11950: Flags [P.], cksum 0xfe2b (incorrect -> 0x57ee), seq 1:4, ack 1, win 512, options [nop,nop,TS val 299509329 ecr 299509328], length 3
2022-04-06 03:53:46.826073 IP (tos 0x0, ttl 64, id 59715, offset 0, flags [DF], proto TCP (6), length 52)
    127.0.0.1.11950 > 127.0.0.1.38864: Flags [.], cksum 0xfe28 (incorrect -> 0x5cf6), seq 1, ack 4, win 512, options [nop,nop,TS val 299509329 ecr 299509329], length 0
2022-04-06 03:53:46.826118 IP (tos 0x0, ttl 64, id 59716, offset 0, flags [DF], proto TCP (6), length 54)
    127.0.0.1.11950 > 127.0.0.1.38864: Flags [P.], cksum 0xfe2a (incorrect -> 0x57ec), seq 1:3, ack 4, win 512, options [nop,nop,TS val 299509329 ecr 299509329], length 2
2022-04-06 03:53:46.826125 IP (tos 0x0, ttl 64, id 39276, offset 0, flags [DF], proto TCP (6), length 52)
    127.0.0.1.38864 > 127.0.0.1.11950: Flags [.], cksum 0xfe28 (incorrect -> 0x5cf4), seq 4, ack 3, win 512, options [nop,nop,TS val 299509329 ecr 299509329], length 0
2022-04-06 03:53:46.842882 IP (tos 0x0, ttl 64, id 39277, offset 0, flags [DF], proto TCP (6), length 62)
    127.0.0.1.38864 > 127.0.0.1.11950: Flags [P.], cksum 0xfe32 (incorrect -> 0x42e8), seq 4:14, ack 3, win 512, options [nop,nop,TS val 299509345 ecr 299509329], length 10
2022-04-06 03:53:46.842901 IP (tos 0x0, ttl 64, id 59717, offset 0, flags [DF], proto TCP (6), length 52)
    127.0.0.1.11950 > 127.0.0.1.38864: Flags [.], cksum 0xfe28 (incorrect -> 0x5cca), seq 3, ack 14, win 512, options [nop,nop,TS val 299509345 ecr 299509345], length 0
2022-04-06 03:53:47.123282 IP (tos 0x0, ttl 64, id 59718, offset 0, flags [DF], proto TCP (6), length 62)
    127.0.0.1.11950 > 127.0.0.1.38864: Flags [P.], cksum 0xfe32 (incorrect -> 0x569e), seq 3:13, ack 14, win 512, options [nop,nop,TS val 299509626 ecr 299509345], length 10
2022-04-06 03:53:47.123294 IP (tos 0x0, ttl 64, id 39278, offset 0, flags [DF], proto TCP (6), length 52)
    127.0.0.1.38864 > 127.0.0.1.11950: Flags [.], cksum 0xfe28 (incorrect -> 0x5a8e), seq 14, ack 13, win 512, options [nop,nop,TS val 299509626 ecr 299509626], length 0
2022-04-06 03:53:47.128408 IP (tos 0x0, ttl 64, id 39279, offset 0, flags [DF], proto TCP (6), length 569)
    127.0.0.1.38864 > 127.0.0.1.11950: Flags [P.], cksum 0x002e (incorrect -> 0xedb1), seq 14:531, ack 13, win 512, options [nop,nop,TS val 299509631 ecr 299509626], length 517
2022-04-06 03:53:47.128417 IP (tos 0x0, ttl 64, id 59719, offset 0, flags [DF], proto TCP (6), length 52)
    127.0.0.1.11950 > 127.0.0.1.38864: Flags [.], cksum 0xfe28 (incorrect -> 0x5883), seq 13, ack 531, win 508, options [nop,nop,TS val 299509631 ecr 299509631], length 0
2022-04-06 03:53:47.434981 IP (tos 0x0, ttl 64, id 59720, offset 0, flags [DF], proto TCP (6), length 3342)
    127.0.0.1.11950 > 127.0.0.1.38864: Flags [P.], cksum 0x0b03 (incorrect -> 0xdd90), seq 13:3303, ack 531, win 512, options [nop,nop,TS val 299509937 ecr 299509631], length 3290
2022-04-06 03:53:47.434991 IP (tos 0x0, ttl 64, id 39280, offset 0, flags [DF], proto TCP (6), length 52)
    127.0.0.1.38864 > 127.0.0.1.11950: Flags [.], cksum 0xfe28 (incorrect -> 0x4952), seq 531, ack 3303, win 495, options [nop,nop,TS val 299509937 ecr 299509937], length 0
2022-04-06 03:53:47.435576 IP (tos 0x0, ttl 64, id 39281, offset 0, flags [DF], proto TCP (6), length 178)
    127.0.0.1.38864 > 127.0.0.1.11950: Flags [P.], cksum 0xfea6 (incorrect -> 0x097b), seq 531:657, ack 3303, win 512, options [nop,nop,TS val 299509938 ecr 299509937], length 126
2022-04-06 03:53:47.435585 IP (tos 0x0, ttl 64, id 59721, offset 0, flags [DF], proto TCP (6), length 52)
    127.0.0.1.11950 > 127.0.0.1.38864: Flags [.], cksum 0xfe28 (incorrect -> 0x48c1), seq 3303, ack 657, win 512, options [nop,nop,TS val 299509938 ecr 299509938], length 0
2022-04-06 03:53:47.743321 IP (tos 0x0, ttl 64, id 59722, offset 0, flags [DF], proto TCP (6), length 310)
    127.0.0.1.11950 > 127.0.0.1.38864: Flags [P.], cksum 0xff2a (incorrect -> 0x1daf), seq 3303:3561, ack 657, win 512, options [nop,nop,TS val 299510246 ecr 299509938], length 258
2022-04-06 03:53:47.743332 IP (tos 0x0, ttl 64, id 39282, offset 0, flags [DF], proto TCP (6), length 52)
    127.0.0.1.38864 > 127.0.0.1.11950: Flags [.], cksum 0xfe28 (incorrect -> 0x4559), seq 657, ack 3561, win 510, options [nop,nop,TS val 299510246 ecr 299510246], length 0
2022-04-06 03:53:47.743657 IP (tos 0x0, ttl 64, id 39283, offset 0, flags [DF], proto TCP (6), length 299)
    127.0.0.1.38864 > 127.0.0.1.11950: Flags [P.], cksum 0xff1f (incorrect -> 0xba33), seq 657:904, ack 3561, win 512, options [nop,nop,TS val 299510246 ecr 299510246], length 247
2022-04-06 03:53:47.743665 IP (tos 0x0, ttl 64, id 59723, offset 0, flags [DF], proto TCP (6), length 52)
    127.0.0.1.11950 > 127.0.0.1.38864: Flags [.], cksum 0xfe28 (incorrect -> 0x4461), seq 3561, ack 904, win 511, options [nop,nop,TS val 299510246 ecr 299510246], length 0
200, 4.063461065292358, 2.641324520111084