2022-04-06 03:04:39.143123 IP (tos 0x0, ttl 64, id 21289, offset 0, flags [DF], proto TCP (6), length 60)
    127.0.0.1.56526 > 127.0.0.1.11450: Flags [S], cksum 0xfe30 (incorrect -> 0xc21c), seq 254359448, win 65495, options [mss 65495,sackOK,TS val 296561646 ecr 0,nop,wscale 7], length 0
2022-04-06 03:04:39.143132 IP (tos 0x0, ttl 64, id 0, offset 0, flags [DF], proto TCP (6), length 60)
    127.0.0.1.11450 > 127.0.0.1.56526: Flags [S.], cksum 0xfe30 (incorrect -> 0x3948), seq 364852597, ack 254359449, win 65483, options [mss 65495,sackOK,TS val 296561646 ecr 296561646,nop,wscale 7], length 0
2022-04-06 03:04:39.143138 IP (tos 0x0, ttl 64, id 21290, offset 0, flags [DF], proto TCP (6), length 52)
    127.0.0.1.56526 > 127.0.0.1.11450: Flags [.], cksum 0xfe28 (incorrect -> 0x6004), seq 1, ack 1, win 512, options [nop,nop,TS val 296561646 ecr 296561646], length 0
2022-04-06 03:04:39.143218 IP (tos 0x0, ttl 64, id 21291, offset 0, flags [DF], proto TCP (6), length 55)
    127.0.0.1.56526 > 127.0.0.1.11450: Flags [P.], cksum 0xfe2b (incorrect -> 0x5af8), seq 1:4, ack 1, win 512, options [nop,nop,TS val 296561646 ecr 296561646], length 3
2022-04-06 03:04:39.143220 IP (tos 0x0, ttl 64, id 25236, offset 0, flags [DF], proto TCP (6), length 52)
    127.0.0.1.11450 > 127.0.0.1.56526: Flags [.], cksum 0xfe28 (incorrect -> 0x6001), seq 1, ack 4, win 512, options [nop,nop,TS val 296561646 ecr 296561646], length 0
2022-04-06 03:04:39.143281 IP (tos 0x0, ttl 64, id 25237, offset 0, flags [DF], proto TCP (6), length 54)
    127.0.0.1.11450 > 127.0.0.1.56526: Flags [P.], cksum 0xfe2a (incorrect -> 0x5af7), seq 1:3, ack 4, win 512, options [nop,nop,TS val 296561646 ecr 296561646], length 2
2022-04-06 03:04:39.143285 IP (tos 0x0, ttl 64, id 21292, offset 0, flags [DF], proto TCP (6), length 52)
    127.0.0.1.56526 > 127.0.0.1.11450: Flags [.], cksum 0xfe28 (incorrect -> 0x5fff), seq 4, ack 3, win 512, options [nop,nop,TS val 296561646 ecr 296561646], length 0
2022-04-06 03:04:39.160680 IP (tos 0x0, ttl 64, id 21293, offset 0, flags [DF], proto TCP (6), length 62)
    127.0.0.1.56526 > 127.0.0.1.11450: Flags [P.], cksum 0xfe32 (incorrect -> 0x20ef), seq 4:14, ack 3, win 512, options [nop,nop,TS val 296561663 ecr 296561646], length 10
2022-04-06 03:04:39.160685 IP (tos 0x0, ttl 64, id 25238, offset 0, flags [DF], proto TCP (6), length 52)
    127.0.0.1.11450 > 127.0.0.1.56526: Flags [.], cksum 0xfe28 (incorrect -> 0x5fd3), seq 3, ack 14, win 512, options [nop,nop,TS val 296561663 ecr 296561663], length 0
2022-04-06 03:04:39.357492 IP (tos 0x0, ttl 64, id 25239, offset 0, flags [DF], proto TCP (6), length 62)
    127.0.0.1.11450 > 127.0.0.1.56526: Flags [P.], cksum 0xfe32 (incorrect -> 0x59fb), seq 3:13, ack 14, win 512, options [nop,nop,TS val 296561860 ecr 296561663], length 10
2022-04-06 03:04:39.357497 IP (tos 0x0, ttl 64, id 21294, offset 0, flags [DF], proto TCP (6), length 52)
    127.0.0.1.56526 > 127.0.0.1.11450: Flags [.], cksum 0xfe28 (incorrect -> 0x5e3f), seq 14, ack 13, win 512, options [nop,nop,TS val 296561860 ecr 296561860], length 0
2022-04-06 03:04:39.362946 IP (tos 0x0, ttl 64, id 21295, offset 0, flags [DF], proto TCP (6), length 569)
    127.0.0.1.56526 > 127.0.0.1.11450: Flags [P.], cksum 0x002e (incorrect -> 0xecce), seq 14:531, ack 13, win 512, options [nop,nop,TS val 296561865 ecr 296561860], length 517
2022-04-06 03:04:39.362958 IP (tos 0x0, ttl 64, id 25240, offset 0, flags [DF], proto TCP (6), length 52)
    127.0.0.1.11450 > 127.0.0.1.56526: Flags [.], cksum 0xfe28 (incorrect -> 0x5c34), seq 13, ack 531, win 508, options [nop,nop,TS val 296561865 ecr 296561865], length 0
2022-04-06 03:04:39.565746 IP (tos 0x0, ttl 64, id 25241, offset 0, flags [DF], proto TCP (6), length 3538)
    127.0.0.1.11450 > 127.0.0.1.56526: Flags [P.], cksum 0x0bc7 (incorrect -> 0x02db), seq 13:3499, ack 531, win 512, options [nop,nop,TS val 296562068 ecr 296561865], length 3486
2022-04-06 03:04:39.565758 IP (tos 0x0, ttl 64, id 21296, offset 0, flags [DF], proto TCP (6), length 52)
    127.0.0.1.56526 > 127.0.0.1.11450: Flags [.], cksum 0xfe28 (incorrect -> 0x4d0e), seq 531, ack 3499, win 494, options [nop,nop,TS val 296562068 ecr 296562068], length 0
2022-04-06 03:04:39.647833 IP (tos 0x0, ttl 64, id 25242, offset 0, flags [DF], proto TCP (6), length 807)
    127.0.0.1.11450 > 127.0.0.1.56526: Flags [P.], cksum 0x011c (incorrect -> 0x67ca), seq 3499:4254, ack 531, win 512, options [nop,nop,TS val 296562150 ecr 296562068], length 755
2022-04-06 03:04:39.647848 IP (tos 0x0, ttl 64, id 21297, offset 0, flags [DF], proto TCP (6), length 52)
    127.0.0.1.56526 > 127.0.0.1.11450: Flags [.], cksum 0xfe28 (incorrect -> 0x496c), seq 531, ack 4254, win 505, options [nop,nop,TS val 296562150 ecr 296562150], length 0
2022-04-06 03:04:39.648295 IP (tos 0x0, ttl 64, id 21298, offset 0, flags [DF], proto TCP (6), length 116)
    127.0.0.1.56526 > 127.0.0.1.11450: Flags [P.], cksum 0xfe68 (incorrect -> 0x297f), seq 531:595, ack 4254, win 512, options [nop,nop,TS val 296562151 ecr 296562150], length 64
2022-04-06 03:04:39.648314 IP (tos 0x0, ttl 64, id 25243, offset 0, flags [DF], proto TCP (6), length 52)
    127.0.0.1.11450 > 127.0.0.1.56526: Flags [.], cksum 0xfe28 (incorrect -> 0x4923), seq 4254, ack 595, win 512, options [nop,nop,TS val 296562151 ecr 296562151], length 0
2022-04-06 03:04:39.648748 IP (tos 0x0, ttl 64, id 21299, offset 0, flags [DF], proto TCP (6), length 368)
    127.0.0.1.56526 > 127.0.0.1.11450: Flags [P.], cksum 0xff64 (incorrect -> 0xe780), seq 595:911, ack 4254, win 512, options [nop,nop,TS val 296562151 ecr 296562151], length 316
2022-04-06 03:04:39.648752 IP (tos 0x0, ttl 64, id 25244, offset 0, flags [DF], proto TCP (6), length 52)
    127.0.0.1.11450 > 127.0.0.1.56526: Flags [.], cksum 0xfe28 (incorrect -> 0x47e9), seq 4254, ack 911, win 510, options [nop,nop,TS val 296562151 ecr 296562151], length 0
2022-04-06 03:04:39.850560 IP (tos 0x0, ttl 64, id 25245, offset 0, flags [DF], proto TCP (6), length 607)
    127.0.0.1.11450 > 127.0.0.1.56526: Flags [P.], cksum 0x0054 (incorrect -> 0x7b8d), seq 4254:4809, ack 911, win 512, options [nop,nop,TS val 296562353 ecr 296562151], length 555
2022-04-06 03:04:39.850570 IP (tos 0x0, ttl 64, id 21300, offset 0, flags [DF], proto TCP (6), length 52)
    127.0.0.1.56526 > 127.0.0.1.11450: Flags [.], cksum 0xfe28 (incorrect -> 0x442c), seq 911, ack 4809, win 508, options [nop,nop,TS val 296562353 ecr 296562353], length 0
2022-04-06 03:04:39.852454 IP (tos 0x0, ttl 64, id 64116, offset 0, flags [DF], proto TCP (6), length 60)
    127.0.0.1.56528 > 127.0.0.1.11450: Flags [S], cksum 0xfe30 (incorrect -> 0x1909), seq 3725070085, win 65495, options [mss 65495,sackOK,TS val 296562355 ecr 0,nop,wscale 7], length 0
2022-04-06 03:04:39.852460 IP (tos 0x0, ttl 64, id 0, offset 0, flags [DF], proto TCP (6), length 60)
    127.0.0.1.11450 > 127.0.0.1.56528: Flags [S.], cksum 0xfe30 (incorrect -> 0x1a91), seq 4026977803, ack 3725070086, win 65483, options [mss 65495,sackOK,TS val 296562355 ecr 296562355,nop,wscale 7], length 0
2022-04-06 03:04:39.852466 IP (tos 0x0, ttl 64, id 64117, offset 0, flags [DF], proto TCP (6), length 52)
    127.0.0.1.56528 > 127.0.0.1.11450: Flags [.], cksum 0xfe28 (incorrect -> 0x414d), seq 1, ack 1, win 512, options [nop,nop,TS val 296562355 ecr 296562355], length 0
2022-04-06 03:04:39.852514 IP (tos 0x0, ttl 64, id 64118, offset 0, flags [DF], proto TCP (6), length 55)
    127.0.0.1.56528 > 127.0.0.1.11450: Flags [P.], cksum 0xfe2b (incorrect -> 0x3c41), seq 1:4, ack 1, win 512, options [nop,nop,TS val 296562355 ecr 296562355], length 3
2022-04-06 03:04:39.852516 IP (tos 0x0, ttl 64, id 50425, offset 0, flags [DF], proto TCP (6), length 52)
    127.0.0.1.11450 > 127.0.0.1.56528: Flags [.], cksum 0xfe28 (incorrect -> 0x414a), seq 1, ack 4, win 512, options [nop,nop,TS val 296562355 ecr 296562355], length 0
2022-04-06 03:04:39.852560 IP (tos 0x0, ttl 64, id 50426, offset 0, flags [DF], proto TCP (6), length 54)
    127.0.0.1.11450 > 127.0.0.1.56528: Flags [P.], cksum 0xfe2a (incorrect -> 0x3c40), seq 1:3, ack 4, win 512, options [nop,nop,TS val 296562355 ecr 296562355], length 2
2022-04-06 03:04:39.852564 IP (tos 0x0, ttl 64, id 64119, offset 0, flags [DF], proto TCP (6), length 52)
    127.0.0.1.56528 > 127.0.0.1.11450: Flags [.], cksum 0xfe28 (incorrect -> 0x4148), seq 4, ack 3, win 512, options [nop,nop,TS val 296562355 ecr 296562355], length 0
2022-04-06 03:04:39.853552 IP (tos 0x0, ttl 64, id 64120, offset 0, flags [DF], proto TCP (6), length 62)
    127.0.0.1.56528 > 127.0.0.1.11450: Flags [P.], cksum 0xfe32 (incorrect -> 0x027f), seq 4:14, ack 3, win 512, options [nop,nop,TS val 296562356 ecr 296562355], length 10
2022-04-06 03:04:39.853559 IP (tos 0x0, ttl 64, id 50427, offset 0, flags [DF], proto TCP (6), length 52)
    127.0.0.1.11450 > 127.0.0.1.56528: Flags [.], cksum 0xfe28 (incorrect -> 0x413c), seq 3, ack 14, win 512, options [nop,nop,TS val 296562356 ecr 296562356], length 0
2022-04-06 03:04:40.061316 IP (tos 0x0, ttl 64, id 50428, offset 0, flags [DF], proto TCP (6), length 62)
    127.0.0.1.11450 > 127.0.0.1.56528: Flags [P.], cksum 0xfe32 (incorrect -> 0x3b59), seq 3:13, ack 14, win 512, options [nop,nop,TS val 296562564 ecr 296562356], length 10
2022-04-06 03:04:40.061325 IP (tos 0x0, ttl 64, id 64121, offset 0, flags [DF], proto TCP (6), length 52)
    127.0.0.1.56528 > 127.0.0.1.11450: Flags [.], cksum 0xfe28 (incorrect -> 0x3f92), seq 14, ack 13, win 512, options [nop,nop,TS val 296562564 ecr 296562564], length 0
2022-04-06 03:04:40.066456 IP (tos 0x0, ttl 64, id 64122, offset 0, flags [DF], proto TCP (6), length 569)
    127.0.0.1.56528 > 127.0.0.1.11450: Flags [P.], cksum 0x002e (incorrect -> 0x6ae4), seq 14:531, ack 13, win 512, options [nop,nop,TS val 296562569 ecr 296562564], length 517
2022-04-06 03:04:40.066473 IP (tos 0x0, ttl 64, id 50429, offset 0, flags [DF], proto TCP (6), length 52)
    127.0.0.1.11450 > 127.0.0.1.56528: Flags [.], cksum 0xfe28 (incorrect -> 0x3d87), seq 13, ack 531, win 508, options [nop,nop,TS val 296562569 ecr 296562569], length 0
2022-04-06 03:04:40.265735 IP (tos 0x0, ttl 64, id 50430, offset 0, flags [DF], proto TCP (6), length 3538)
    127.0.0.1.11450 > 127.0.0.1.56528: Flags [P.], cksum 0x0bc7 (incorrect -> 0x5725), seq 13:3499, ack 531, win 512, options [nop,nop,TS val 296562768 ecr 296562569], length 3486
2022-04-06 03:04:40.265741 IP (tos 0x0, ttl 64, id 64123, offset 0, flags [DF], proto TCP (6), length 52)
    127.0.0.1.56528 > 127.0.0.1.11450: Flags [.], cksum 0xfe28 (incorrect -> 0x2e69), seq 531, ack 3499, win 494, options [nop,nop,TS val 296562768 ecr 296562768], length 0
200, 25.89995050430298, 1.7060575485229492