2022-04-06 14:33:42.583544 IP (tos 0x0, ttl 64, id 10542, offset 0, flags [DF], proto TCP (6), length 60)
    127.0.0.1.54154 > 127.0.0.1.11550: Flags [S], cksum 0xfe30 (incorrect -> 0x205e), seq 3267121756, win 65495, options [mss 65495,sackOK,TS val 337905086 ecr 0,nop,wscale 7], length 0
2022-04-06 14:33:42.583560 IP (tos 0x0, ttl 64, id 0, offset 0, flags [DF], proto TCP (6), length 60)
    127.0.0.1.11550 > 127.0.0.1.54154: Flags [S.], cksum 0xfe30 (incorrect -> 0xb60a), seq 1511781968, ack 3267121757, win 65483, options [mss 65495,sackOK,TS val 337905086 ecr 337905086,nop,wscale 7], length 0
2022-04-06 14:33:42.583574 IP (tos 0x0, ttl 64, id 10543, offset 0, flags [DF], proto TCP (6), length 52)
    127.0.0.1.54154 > 127.0.0.1.11550: Flags [.], cksum 0xfe28 (incorrect -> 0xdcc6), seq 1, ack 1, win 512, options [nop,nop,TS val 337905086 ecr 337905086], length 0
2022-04-06 14:33:42.583776 IP (tos 0x0, ttl 64, id 10544, offset 0, flags [DF], proto TCP (6), length 55)
    127.0.0.1.54154 > 127.0.0.1.11550: Flags [P.], cksum 0xfe2b (incorrect -> 0xd7ba), seq 1:4, ack 1, win 512, options [nop,nop,TS val 337905086 ecr 337905086], length 3
2022-04-06 14:33:42.583786 IP (tos 0x0, ttl 64, id 13056, offset 0, flags [DF], proto TCP (6), length 52)
    127.0.0.1.11550 > 127.0.0.1.54154: Flags [.], cksum 0xfe28 (incorrect -> 0xdcc3), seq 1, ack 4, win 512, options [nop,nop,TS val 337905086 ecr 337905086], length 0
2022-04-06 14:33:42.583822 IP (tos 0x0, ttl 64, id 13057, offset 0, flags [DF], proto TCP (6), length 54)
    127.0.0.1.11550 > 127.0.0.1.54154: Flags [P.], cksum 0xfe2a (incorrect -> 0xd7b9), seq 1:3, ack 4, win 512, options [nop,nop,TS val 337905086 ecr 337905086], length 2
2022-04-06 14:33:42.583832 IP (tos 0x0, ttl 64, id 10545, offset 0, flags [DF], proto TCP (6), length 52)
    127.0.0.1.54154 > 127.0.0.1.11550: Flags [.], cksum 0xfe28 (incorrect -> 0xdcc1), seq 4, ack 3, win 512, options [nop,nop,TS val 337905086 ecr 337905086], length 0
2022-04-06 14:33:42.585413 IP (tos 0x0, ttl 64, id 10546, offset 0, flags [DF], proto TCP (6), length 62)
    127.0.0.1.54154 > 127.0.0.1.11550: Flags [P.], cksum 0xfe32 (incorrect -> 0xa901), seq 4:14, ack 3, win 512, options [nop,nop,TS val 337905088 ecr 337905086], length 10
2022-04-06 14:33:42.585437 IP (tos 0x0, ttl 64, id 13058, offset 0, flags [DF], proto TCP (6), length 52)
    127.0.0.1.11550 > 127.0.0.1.54154: Flags [.], cksum 0xfe28 (incorrect -> 0xdcb3), seq 3, ack 14, win 512, options [nop,nop,TS val 337905088 ecr 337905088], length 0
2022-04-06 14:33:42.668734 IP (tos 0x0, ttl 64, id 13059, offset 0, flags [DF], proto TCP (6), length 62)
    127.0.0.1.11550 > 127.0.0.1.54154: Flags [P.], cksum 0xfe32 (incorrect -> 0xd74d), seq 3:13, ack 14, win 512, options [nop,nop,TS val 337905171 ecr 337905088], length 10
2022-04-06 14:33:42.668751 IP (tos 0x0, ttl 64, id 10547, offset 0, flags [DF], proto TCP (6), length 52)
    127.0.0.1.54154 > 127.0.0.1.11550: Flags [.], cksum 0xfe28 (incorrect -> 0xdc03), seq 14, ack 13, win 512, options [nop,nop,TS val 337905171 ecr 337905171], length 0
2022-04-06 14:33:42.674785 IP (tos 0x0, ttl 64, id 10548, offset 0, flags [DF], proto TCP (6), length 569)
    127.0.0.1.54154 > 127.0.0.1.11550: Flags [P.], cksum 0x002e (incorrect -> 0xa664), seq 14:531, ack 13, win 512, options [nop,nop,TS val 337905177 ecr 337905171], length 517
2022-04-06 14:33:42.674797 IP (tos 0x0, ttl 64, id 13060, offset 0, flags [DF], proto TCP (6), length 52)
    127.0.0.1.11550 > 127.0.0.1.54154: Flags [.], cksum 0xfe28 (incorrect -> 0xd9f6), seq 13, ack 531, win 508, options [nop,nop,TS val 337905177 ecr 337905177], length 0
2022-04-06 14:33:42.790796 IP (tos 0x0, ttl 64, id 13061, offset 0, flags [DF], proto TCP (6), length 3538)
    127.0.0.1.11550 > 127.0.0.1.54154: Flags [P.], cksum 0x0bc7 (incorrect -> 0x48f5), seq 13:3499, ack 531, win 512, options [nop,nop,TS val 337905293 ecr 337905177], length 3486
2022-04-06 14:33:42.790812 IP (tos 0x0, ttl 64, id 10549, offset 0, flags [DF], proto TCP (6), length 52)
    127.0.0.1.54154 > 127.0.0.1.11550: Flags [.], cksum 0xfe28 (incorrect -> 0xcb7e), seq 531, ack 3499, win 494, options [nop,nop,TS val 337905293 ecr 337905293], length 0
2022-04-06 14:33:42.814197 IP (tos 0x0, ttl 64, id 13062, offset 0, flags [DF], proto TCP (6), length 1334)
    127.0.0.1.11550 > 127.0.0.1.54154: Flags [P.], cksum 0x032b (incorrect -> 0x1791), seq 3499:4781, ack 531, win 512, options [nop,nop,TS val 337905317 ecr 337905293], length 1282
2022-04-06 14:33:42.814206 IP (tos 0x0, ttl 64, id 10550, offset 0, flags [DF], proto TCP (6), length 52)
    127.0.0.1.54154 > 127.0.0.1.11550: Flags [.], cksum 0xfe28 (incorrect -> 0xc644), seq 531, ack 4781, win 502, options [nop,nop,TS val 337905317 ecr 337905317], length 0
2022-04-06 14:33:42.814695 IP (tos 0x0, ttl 64, id 10551, offset 0, flags [DF], proto TCP (6), length 116)
    127.0.0.1.54154 > 127.0.0.1.11550: Flags [P.], cksum 0xfe68 (incorrect -> 0xa7fa), seq 531:595, ack 4781, win 512, options [nop,nop,TS val 337905317 ecr 337905317], length 64
2022-04-06 14:33:42.814706 IP (tos 0x0, ttl 64, id 13063, offset 0, flags [DF], proto TCP (6), length 52)
    127.0.0.1.11550 > 127.0.0.1.54154: Flags [.], cksum 0xfe28 (incorrect -> 0xc5fa), seq 4781, ack 595, win 512, options [nop,nop,TS val 337905317 ecr 337905317], length 0
2022-04-06 14:33:42.815222 IP (tos 0x0, ttl 64, id 10552, offset 0, flags [DF], proto TCP (6), length 305)
    127.0.0.1.54154 > 127.0.0.1.11550: Flags [P.], cksum 0xff25 (incorrect -> 0xab58), seq 595:848, ack 4781, win 512, options [nop,nop,TS val 337905318 ecr 337905317], length 253
2022-04-06 14:33:42.815232 IP (tos 0x0, ttl 64, id 13064, offset 0, flags [DF], proto TCP (6), length 52)
    127.0.0.1.11550 > 127.0.0.1.54154: Flags [.], cksum 0xfe28 (incorrect -> 0xc4fc), seq 4781, ack 848, win 511, options [nop,nop,TS val 337905318 ecr 337905318], length 0
2022-04-06 14:33:42.945203 IP (tos 0x0, ttl 64, id 13065, offset 0, flags [DF], proto TCP (6), length 3538)
    127.0.0.1.11550 > 127.0.0.1.54154: Flags [P.], cksum 0x0bc7 (incorrect -> 0x6f37), seq 4781:8267, ack 848, win 512, options [nop,nop,TS val 337905448 ecr 337905318], length 3486
2022-04-06 14:33:42.945214 IP (tos 0x0, ttl 64, id 10553, offset 0, flags [DF], proto TCP (6), length 52)
    127.0.0.1.54154 > 127.0.0.1.11550: Flags [.], cksum 0xfe28 (incorrect -> 0xb66b), seq 848, ack 8267, win 494, options [nop,nop,TS val 337905448 ecr 337905448], length 0
2022-04-06 14:33:42.959826 IP (tos 0x0, ttl 64, id 13066, offset 0, flags [DF], proto TCP (6), length 4036)
    127.0.0.1.11550 > 127.0.0.1.54154: Flags [P.], cksum 0x0db9 (incorrect -> 0x9107), seq 8267:12251, ack 848, win 512, options [nop,nop,TS val 337905462 ecr 337905448], length 3984
2022-04-06 14:33:42.959833 IP (tos 0x0, ttl 64, id 10554, offset 0, flags [DF], proto TCP (6), length 52)
    127.0.0.1.54154 > 127.0.0.1.11550: Flags [.], cksum 0xfe28 (incorrect -> 0xa6c1), seq 848, ack 12251, win 492, options [nop,nop,TS val 337905462 ecr 337905462], length 0
2022-04-06 14:33:42.961294 IP (tos 0x0, ttl 64, id 13067, offset 0, flags [DF], proto TCP (6), length 4036)
    127.0.0.1.11550 > 127.0.0.1.54154: Flags [P.], cksum 0x0db9 (incorrect -> 0xd153), seq 12251:16235, ack 848, win 512, options [nop,nop,TS val 337905464 ecr 337905462], length 3984
2022-04-06 14:33:42.961299 IP (tos 0x0, ttl 64, id 10555, offset 0, flags [DF], proto TCP (6), length 52)
    127.0.0.1.54154 > 127.0.0.1.11550: Flags [.], cksum 0xfe28 (incorrect -> 0x973d), seq 848, ack 16235, win 476, options [nop,nop,TS val 337905464 ecr 337905464], length 0
2022-04-06 14:33:42.964677 IP (tos 0x0, ttl 64, id 13068, offset 0, flags [DF], proto TCP (6), length 4100)
    127.0.0.1.11550 > 127.0.0.1.54154: Flags [P.], cksum 0x0df9 (incorrect -> 0x9055), seq 16235:20283, ack 848, win 512, options [nop,nop,TS val 337905467 ecr 337905464], length 4048
2022-04-06 14:33:42.964689 IP (tos 0x0, ttl 64, id 10556, offset 0, flags [DF], proto TCP (6), length 52)
    127.0.0.1.54154 > 127.0.0.1.11550: Flags [.], cksum 0xfe28 (incorrect -> 0x8757), seq 848, ack 20283, win 492, options [nop,nop,TS val 337905467 ecr 337905467], length 0
2022-04-06 14:33:42.964697 IP (tos 0x0, ttl 64, id 13069, offset 0, flags [DF], proto TCP (6), length 1926)
    127.0.0.1.11550 > 127.0.0.1.54154: Flags [P.], cksum 0x057b (incorrect -> 0xe342), seq 20283:22157, ack 848, win 512, options [nop,nop,TS val 337905467 ecr 337905467], length 1874
2022-04-06 14:33:42.964702 IP (tos 0x0, ttl 64, id 10557, offset 0, flags [DF], proto TCP (6), length 52)
    127.0.0.1.54154 > 127.0.0.1.11550: Flags [.], cksum 0xfe28 (incorrect -> 0x800d), seq 848, ack 22157, win 484, options [nop,nop,TS val 337905467 ecr 337905467], length 0
2022-04-06 14:33:42.969832 IP (tos 0x0, ttl 64, id 13070, offset 0, flags [DF], proto TCP (6), length 4100)
    127.0.0.1.11550 > 127.0.0.1.54154: Flags [P.], cksum 0x0df9 (incorrect -> 0x4862), seq 22157:26205, ack 848, win 512, options [nop,nop,TS val 337905472 ecr 337905467], length 4048
2022-04-06 14:33:42.969841 IP (tos 0x0, ttl 64, id 10558, offset 0, flags [DF], proto TCP (6), length 52)
    127.0.0.1.54154 > 127.0.0.1.11550: Flags [.], cksum 0xfe28 (incorrect -> 0x702b), seq 848, ack 26205, win 492, options [nop,nop,TS val 337905472 ecr 337905472], length 0
2022-04-06 14:33:42.969851 IP (tos 0x0, ttl 64, id 13071, offset 0, flags [DF], proto TCP (6), length 3474)
    127.0.0.1.11550 > 127.0.0.1.54154: Flags [P.], cksum 0x0b87 (incorrect -> 0x853b), seq 26205:29627, ack 848, win 512, options [nop,nop,TS val 337905472 ecr 337905472], length 3422
2022-04-06 14:33:42.969855 IP (tos 0x0, ttl 64, id 10559, offset 0, flags [DF], proto TCP (6), length 52)
    127.0.0.1.54154 > 127.0.0.1.11550: Flags [.], cksum 0xfe28 (incorrect -> 0x62db), seq 848, ack 29627, win 478, options [nop,nop,TS val 337905472 ecr 337905472], length 0
2022-04-06 14:33:42.979841 IP (tos 0x0, ttl 64, id 13072, offset 0, flags [DF], proto TCP (6), length 4100)
    127.0.0.1.11550 > 127.0.0.1.54154: Flags [P.], cksum 0x0df9 (incorrect -> 0x92ce), seq 29627:33675, ack 848, win 512, options [nop,nop,TS val 337905482 ecr 337905472], length 4048
2022-04-06 14:33:42.979849 IP (tos 0x0, ttl 64, id 10560, offset 0, flags [DF], proto TCP (6), length 52)
    127.0.0.1.54154 > 127.0.0.1.11550: Flags [.], cksum 0xfe28 (incorrect -> 0x52e9), seq 848, ack 33675, win 492, options [nop,nop,TS val 337905482 ecr 337905482], length 0
2022-04-06 14:33:42.979857 IP (tos 0x0, ttl 64, id 13073, offset 0, flags [DF], proto TCP (6), length 3972)
    127.0.0.1.11550 > 127.0.0.1.54154: Flags [P.], cksum 0x0d79 (incorrect -> 0x0469), seq 33675:37595, ack 848, win 512, options [nop,nop,TS val 337905482 ecr 337905482], length 3920
2022-04-06 14:33:42.980119 IP (tos 0x0, ttl 64, id 10561, offset 0, flags [DF], proto TCP (6), length 52)
    127.0.0.1.54154 > 127.0.0.1.11550: Flags [.], cksum 0xfe28 (incorrect -> 0x4384), seq 848, ack 37595, win 512, options [nop,nop,TS val 337905483 ecr 337905482], length 0
2022-04-06 14:33:42.980125 IP (tos 0x0, ttl 64, id 13074, offset 0, flags [DF], proto TCP (6), length 550)
    127.0.0.1.11550 > 127.0.0.1.54154: Flags [P.], cksum 0x001b (incorrect -> 0x3b23), seq 37595:38093, ack 848, win 512, options [nop,nop,TS val 337905483 ecr 337905483], length 498
2022-04-06 14:33:42.980130 IP (tos 0x0, ttl 64, id 10562, offset 0, flags [DF], proto TCP (6), length 52)
    127.0.0.1.54154 > 127.0.0.1.11550: Flags [.], cksum 0xfe28 (incorrect -> 0x4191), seq 848, ack 38093, win 512, options [nop,nop,TS val 337905483 ecr 337905483], length 0
2022-04-06 14:33:42.984096 IP (tos 0x0, ttl 64, id 13075, offset 0, flags [DF], proto TCP (6), length 3538)
    127.0.0.1.11550 > 127.0.0.1.54154: Flags [P.], cksum 0x0bc7 (incorrect -> 0xd86a), seq 38093:41579, ack 848, win 512, options [nop,nop,TS val 337905487 ecr 337905483], length 3486
2022-04-06 14:33:42.984112 IP (tos 0x0, ttl 64, id 10563, offset 0, flags [DF], proto TCP (6), length 52)
    127.0.0.1.54154 > 127.0.0.1.11550: Flags [.], cksum 0xfe28 (incorrect -> 0x33eb), seq 848, ack 41579, win 512, options [nop,nop,TS val 337905487 ecr 337905487], length 0
2022-04-06 14:33:42.984241 IP (tos 0x0, ttl 64, id 13076, offset 0, flags [DF], proto TCP (6), length 3847)
    127.0.0.1.11550 > 127.0.0.1.54154: Flags [P.], cksum 0x0cfc (incorrect -> 0xc2ff), seq 41579:45374, ack 848, win 512, options [nop,nop,TS val 337905487 ecr 337905487], length 3795
2022-04-06 14:33:42.984256 IP (tos 0x0, ttl 64, id 10564, offset 0, flags [DF], proto TCP (6), length 52)
    127.0.0.1.54154 > 127.0.0.1.11550: Flags [.], cksum 0xfe28 (incorrect -> 0x2518), seq 848, ack 45374, win 512, options [nop,nop,TS val 337905487 ecr 337905487], length 0
2022-04-06 14:33:42.988721 IP (tos 0x0, ttl 64, id 13077, offset 0, flags [DF], proto TCP (6), length 3538)
    127.0.0.1.11550 > 127.0.0.1.54154: Flags [P.], cksum 0x0bc7 (incorrect -> 0x2d8f), seq 45374:48860, ack 848, win 512, options [nop,nop,TS val 337905491 ecr 337905487], length 3486
2022-04-06 14:33:42.990989 IP (tos 0x0, ttl 64, id 10565, offset 0, flags [DF], proto TCP (6), length 52)
    127.0.0.1.54154 > 127.0.0.1.11550: Flags [.], cksum 0xfe28 (incorrect -> 0x1770), seq 848, ack 48860, win 512, options [nop,nop,TS val 337905493 ecr 337905491], length 0
2022-04-06 14:33:42.991005 IP (tos 0x0, ttl 64, id 13078, offset 0, flags [DF], proto TCP (6), length 15988)
    127.0.0.1.11550 > 127.0.0.1.54154: Flags [P.], cksum 0x3c69 (incorrect -> 0x18a2), seq 48860:64796, ack 848, win 512, options [nop,nop,TS val 337905493 ecr 337905493], length 15936
2022-04-06 14:33:43.013083 IP (tos 0x0, ttl 64, id 13079, offset 0, flags [DF], proto TCP (6), length 32820)
    127.0.0.1.11550 > 127.0.0.1.54154: Flags [.], cksum 0x7e29 (incorrect -> 0xb6ff), seq 64796:97564, ack 848, win 512, options [nop,nop,TS val 337905515 ecr 337905493], length 32768
2022-04-06 14:33:43.013150 IP (tos 0x0, ttl 64, id 10566, offset 0, flags [DF], proto TCP (6), length 52)
    127.0.0.1.54154 > 127.0.0.1.11550: Flags [.], cksum 0xfe28 (incorrect -> 0x599b), seq 848, ack 97564, win 379, options [nop,nop,TS val 337905516 ecr 337905493], length 0
2022-04-06 14:33:43.013159 IP (tos 0x0, ttl 64, id 13080, offset 0, flags [DF], proto TCP (6), length 2714)
    127.0.0.1.11550 > 127.0.0.1.54154: Flags [P.], cksum 0x088f (incorrect -> 0xdbc2), seq 97564:100226, ack 848, win 512, options [nop,nop,TS val 337905516 ecr 337905516], length 2662
2022-04-06 14:33:43.013889 IP (tos 0x0, ttl 64, id 10567, offset 0, flags [DF], proto TCP (6), length 52)
    127.0.0.1.54154 > 127.0.0.1.11550: Flags [.], cksum 0xfe28 (incorrect -> 0x4e99), seq 848, ack 100226, win 512, options [nop,nop,TS val 337905516 ecr 337905516], length 0
2022-04-06 14:33:43.027542 IP (tos 0x0, ttl 64, id 13081, offset 0, flags [DF], proto TCP (6), length 4100)
    127.0.0.1.11550 > 127.0.0.1.54154: Flags [P.], cksum 0x0df9 (incorrect -> 0xa7c3), seq 100226:104274, ack 848, win 512, options [nop,nop,TS val 337905530 ecr 337905516], length 4048
2022-04-06 14:33:43.027584 IP (tos 0x0, ttl 64, id 10568, offset 0, flags [DF], proto TCP (6), length 52)
    127.0.0.1.54154 > 127.0.0.1.11550: Flags [.], cksum 0xfe28 (incorrect -> 0x3ead), seq 848, ack 104274, win 512, options [nop,nop,TS val 337905530 ecr 337905530], length 0
2022-04-06 14:33:43.027590 IP (tos 0x0, ttl 64, id 13082, offset 0, flags [DF], proto TCP (6), length 3972)
    127.0.0.1.11550 > 127.0.0.1.54154: Flags [P.], cksum 0x0d79 (incorrect -> 0x63d5), seq 104274:108194, ack 848, win 512, options [nop,nop,TS val 337905530 ecr 337905530], length 3920
2022-04-06 14:33:43.027596 IP (tos 0x0, ttl 64, id 10569, offset 0, flags [DF], proto TCP (6), length 52)
    127.0.0.1.54154 > 127.0.0.1.11550: Flags [.], cksum 0xfe28 (incorrect -> 0x2f5d), seq 848, ack 108194, win 512, options [nop,nop,TS val 337905530 ecr 337905530], length 0
2022-04-06 14:33:43.028715 IP (tos 0x0, ttl 64, id 13083, offset 0, flags [DF], proto TCP (6), length 4100)
    127.0.0.1.11550 > 127.0.0.1.54154: Flags [P.], cksum 0x0df9 (incorrect -> 0x6c1a), seq 108194:112242, ack 848, win 512, options [nop,nop,TS val 337905531 ecr 337905530], length 4048
2022-04-06 14:33:43.029033 IP (tos 0x0, ttl 64, id 10570, offset 0, flags [DF], proto TCP (6), length 52)
    127.0.0.1.54154 > 127.0.0.1.11550: Flags [.], cksum 0xfe28 (incorrect -> 0x1f8b), seq 848, ack 112242, win 512, options [nop,nop,TS val 337905531 ecr 337905531], length 0
2022-04-06 14:33:43.029039 IP (tos 0x0, ttl 64, id 13084, offset 0, flags [DF], proto TCP (6), length 486)
    127.0.0.1.11550 > 127.0.0.1.54154: Flags [P.], cksum 0xffda (incorrect -> 0xffd5), seq 112242:112676, ack 848, win 512, options [nop,nop,TS val 337905531 ecr 337905531], length 434
2022-04-06 14:33:43.029045 IP (tos 0x0, ttl 64, id 10571, offset 0, flags [DF], proto TCP (6), length 52)
    127.0.0.1.54154 > 127.0.0.1.11550: Flags [.], cksum 0xfe28 (incorrect -> 0x1dd9), seq 848, ack 112676, win 512, options [nop,nop,TS val 337905531 ecr 337905531], length 0
2022-04-06 14:33:43.029352 IP (tos 0x0, ttl 64, id 13085, offset 0, flags [DF], proto TCP (6), length 2408)
    127.0.0.1.11550 > 127.0.0.1.54154: Flags [P.], cksum 0x075d (incorrect -> 0x068b), seq 112676:115032, ack 848, win 512, options [nop,nop,TS val 337905532 ecr 337905531], length 2356
2022-04-06 14:33:43.029366 IP (tos 0x0, ttl 64, id 10572, offset 0, flags [DF], proto TCP (6), length 52)
    127.0.0.1.54154 > 127.0.0.1.11550: Flags [.], cksum 0xfe28 (incorrect -> 0x14a3), seq 848, ack 115032, win 512, options [nop,nop,TS val 337905532 ecr 337905532], length 0
2022-04-06 14:33:43.031261 IP (tos 0x0, ttl 64, id 13086, offset 0, flags [DF], proto TCP (6), length 3538)
    127.0.0.1.11550 > 127.0.0.1.54154: Flags [P.], cksum 0x0bc7 (incorrect -> 0xa919), seq 115032:118518, ack 848, win 512, options [nop,nop,TS val 337905534 ecr 337905532], length 3486
2022-04-06 14:33:43.031281 IP (tos 0x0, ttl 64, id 10573, offset 0, flags [DF], proto TCP (6), length 52)
    127.0.0.1.54154 > 127.0.0.1.11550: Flags [.], cksum 0xfe28 (incorrect -> 0x0701), seq 848, ack 118518, win 512, options [nop,nop,TS val 337905534 ecr 337905534], length 0
200, 3.9688477516174316, 0.49439573287963867