2022-04-06 18:05:13.263845 IP (tos 0x0, ttl 64, id 47696, offset 0, flags [DF], proto TCP (6), length 60)
    127.0.0.1.47288 > 127.0.0.1.11350: Flags [S], cksum 0xfe30 (incorrect -> 0xd19d), seq 3575579802, win 65495, options [mss 65495,sackOK,TS val 350595766 ecr 0,nop,wscale 7], length 0
2022-04-06 18:05:13.263856 IP (tos 0x0, ttl 64, id 0, offset 0, flags [DF], proto TCP (6), length 60)
    127.0.0.1.11350 > 127.0.0.1.47288: Flags [S.], cksum 0xfe30 (incorrect -> 0xa8df), seq 3309151199, ack 3575579803, win 65483, options [mss 65495,sackOK,TS val 350595766 ecr 350595766,nop,wscale 7], length 0
2022-04-06 18:05:13.263863 IP (tos 0x0, ttl 64, id 47697, offset 0, flags [DF], proto TCP (6), length 52)
    127.0.0.1.47288 > 127.0.0.1.11350: Flags [.], cksum 0xfe28 (incorrect -> 0xcf9b), seq 1, ack 1, win 512, options [nop,nop,TS val 350595766 ecr 350595766], length 0
2022-04-06 18:05:13.264010 IP (tos 0x0, ttl 64, id 47698, offset 0, flags [DF], proto TCP (6), length 55)
    127.0.0.1.47288 > 127.0.0.1.11350: Flags [P.], cksum 0xfe2b (incorrect -> 0xca8f), seq 1:4, ack 1, win 512, options [nop,nop,TS val 350595766 ecr 350595766], length 3
2022-04-06 18:05:13.264016 IP (tos 0x0, ttl 64, id 39378, offset 0, flags [DF], proto TCP (6), length 52)
    127.0.0.1.11350 > 127.0.0.1.47288: Flags [.], cksum 0xfe28 (incorrect -> 0xcf98), seq 1, ack 4, win 512, options [nop,nop,TS val 350595766 ecr 350595766], length 0
2022-04-06 18:05:13.264039 IP (tos 0x0, ttl 64, id 39379, offset 0, flags [DF], proto TCP (6), length 54)
    127.0.0.1.11350 > 127.0.0.1.47288: Flags [P.], cksum 0xfe2a (incorrect -> 0xca8e), seq 1:3, ack 4, win 512, options [nop,nop,TS val 350595766 ecr 350595766], length 2
2022-04-06 18:05:13.264050 IP (tos 0x0, ttl 64, id 47699, offset 0, flags [DF], proto TCP (6), length 52)
    127.0.0.1.47288 > 127.0.0.1.11350: Flags [.], cksum 0xfe28 (incorrect -> 0xcf96), seq 4, ack 3, win 512, options [nop,nop,TS val 350595766 ecr 350595766], length 0
2022-04-06 18:05:13.275685 IP (tos 0x0, ttl 64, id 47700, offset 0, flags [DF], proto TCP (6), length 62)
    127.0.0.1.47288 > 127.0.0.1.11350: Flags [P.], cksum 0xfe32 (incorrect -> 0x8de4), seq 4:14, ack 3, win 512, options [nop,nop,TS val 350595778 ecr 350595766], length 10
2022-04-06 18:05:13.275700 IP (tos 0x0, ttl 64, id 39380, offset 0, flags [DF], proto TCP (6), length 52)
    127.0.0.1.11350 > 127.0.0.1.47288: Flags [.], cksum 0xfe28 (incorrect -> 0xcf74), seq 3, ack 14, win 512, options [nop,nop,TS val 350595778 ecr 350595778], length 0
2022-04-06 18:05:13.518949 IP (tos 0x0, ttl 64, id 39381, offset 0, flags [DF], proto TCP (6), length 62)
    127.0.0.1.11350 > 127.0.0.1.47288: Flags [P.], cksum 0xfe32 (incorrect -> 0xc96e), seq 3:13, ack 14, win 512, options [nop,nop,TS val 350596021 ecr 350595778], length 10
2022-04-06 18:05:13.518964 IP (tos 0x0, ttl 64, id 47701, offset 0, flags [DF], proto TCP (6), length 52)
    127.0.0.1.47288 > 127.0.0.1.11350: Flags [.], cksum 0xfe28 (incorrect -> 0xcd84), seq 14, ack 13, win 512, options [nop,nop,TS val 350596021 ecr 350596021], length 0
2022-04-06 18:05:13.525119 IP (tos 0x0, ttl 64, id 47702, offset 0, flags [DF], proto TCP (6), length 569)
    127.0.0.1.47288 > 127.0.0.1.11350: Flags [P.], cksum 0x002e (incorrect -> 0x37d4), seq 14:531, ack 13, win 512, options [nop,nop,TS val 350596028 ecr 350596021], length 517
2022-04-06 18:05:13.525130 IP (tos 0x0, ttl 64, id 39382, offset 0, flags [DF], proto TCP (6), length 52)
    127.0.0.1.11350 > 127.0.0.1.47288: Flags [.], cksum 0xfe28 (incorrect -> 0xcb75), seq 13, ack 531, win 508, options [nop,nop,TS val 350596028 ecr 350596028], length 0
2022-04-06 18:05:13.761389 IP (tos 0x0, ttl 64, id 39383, offset 0, flags [DF], proto TCP (6), length 3538)
    127.0.0.1.11350 > 127.0.0.1.47288: Flags [P.], cksum 0x0bc7 (incorrect -> 0x4a91), seq 13:3499, ack 531, win 512, options [nop,nop,TS val 350596264 ecr 350596028], length 3486
2022-04-06 18:05:13.761402 IP (tos 0x0, ttl 64, id 47703, offset 0, flags [DF], proto TCP (6), length 52)
    127.0.0.1.47288 > 127.0.0.1.11350: Flags [.], cksum 0xfe28 (incorrect -> 0xbc0d), seq 531, ack 3499, win 494, options [nop,nop,TS val 350596264 ecr 350596264], length 0
2022-04-06 18:05:13.863329 IP (tos 0x0, ttl 64, id 39384, offset 0, flags [DF], proto TCP (6), length 1266)
    127.0.0.1.11350 > 127.0.0.1.47288: Flags [P.], cksum 0x02e7 (incorrect -> 0x71ab), seq 3499:4713, ack 531, win 512, options [nop,nop,TS val 350596366 ecr 350596264], length 1214
2022-04-06 18:05:13.863339 IP (tos 0x0, ttl 64, id 47704, offset 0, flags [DF], proto TCP (6), length 52)
    127.0.0.1.47288 > 127.0.0.1.11350: Flags [.], cksum 0xfe28 (incorrect -> 0xb67a), seq 531, ack 4713, win 503, options [nop,nop,TS val 350596366 ecr 350596366], length 0
2022-04-06 18:05:13.863878 IP (tos 0x0, ttl 64, id 47705, offset 0, flags [DF], proto TCP (6), length 132)
    127.0.0.1.47288 > 127.0.0.1.11350: Flags [P.], cksum 0xfe78 (incorrect -> 0x15f3), seq 531:611, ack 4713, win 512, options [nop,nop,TS val 350596366 ecr 350596366], length 80
2022-04-06 18:05:13.863885 IP (tos 0x0, ttl 64, id 39385, offset 0, flags [DF], proto TCP (6), length 52)
    127.0.0.1.11350 > 127.0.0.1.47288: Flags [.], cksum 0xfe28 (incorrect -> 0xb621), seq 4713, ack 611, win 512, options [nop,nop,TS val 350596366 ecr 350596366], length 0
2022-04-06 18:05:13.864436 IP (tos 0x0, ttl 64, id 47706, offset 0, flags [DF], proto TCP (6), length 331)
    127.0.0.1.47288 > 127.0.0.1.11350: Flags [P.], cksum 0xff3f (incorrect -> 0xd281), seq 611:890, ack 4713, win 512, options [nop,nop,TS val 350596367 ecr 350596366], length 279
2022-04-06 18:05:13.864442 IP (tos 0x0, ttl 64, id 39386, offset 0, flags [DF], proto TCP (6), length 52)
    127.0.0.1.11350 > 127.0.0.1.47288: Flags [.], cksum 0xfe28 (incorrect -> 0xb50a), seq 4713, ack 890, win 510, options [nop,nop,TS val 350596367 ecr 350596367], length 0
2022-04-06 18:05:14.098976 IP (tos 0x0, ttl 64, id 39387, offset 0, flags [DF], proto TCP (6), length 594)
    127.0.0.1.11350 > 127.0.0.1.47288: Flags [P.], cksum 0x0047 (incorrect -> 0x8286), seq 4713:5255, ack 890, win 512, options [nop,nop,TS val 350596601 ecr 350596367], length 542
2022-04-06 18:05:14.098987 IP (tos 0x0, ttl 64, id 47707, offset 0, flags [DF], proto TCP (6), length 52)
    127.0.0.1.47288 > 127.0.0.1.11350: Flags [.], cksum 0xfe28 (incorrect -> 0xb11a), seq 890, ack 5255, win 508, options [nop,nop,TS val 350596601 ecr 350596601], length 0
2022-04-06 18:05:14.205503 IP (tos 0x0, ttl 64, id 39388, offset 0, flags [DF], proto TCP (6), length 3538)
    127.0.0.1.11350 > 127.0.0.1.47288: Flags [P.], cksum 0x0bc7 (incorrect -> 0x7956), seq 5255:8741, ack 890, win 512, options [nop,nop,TS val 350596708 ecr 350596601], length 3486
2022-04-06 18:05:14.205512 IP (tos 0x0, ttl 64, id 47708, offset 0, flags [DF], proto TCP (6), length 52)
    127.0.0.1.47288 > 127.0.0.1.11350: Flags [.], cksum 0xfe28 (incorrect -> 0xa2b4), seq 890, ack 8741, win 494, options [nop,nop,TS val 350596708 ecr 350596708], length 0
2022-04-06 18:05:14.229452 IP (tos 0x0, ttl 64, id 39389, offset 0, flags [DF], proto TCP (6), length 2256)
    127.0.0.1.11350 > 127.0.0.1.47288: Flags [P.], cksum 0x06c5 (incorrect -> 0x40a7), seq 8741:10945, ack 890, win 512, options [nop,nop,TS val 350596732 ecr 350596708], length 2204
2022-04-06 18:05:14.229459 IP (tos 0x0, ttl 64, id 47709, offset 0, flags [DF], proto TCP (6), length 52)
    127.0.0.1.47288 > 127.0.0.1.11350: Flags [.], cksum 0xfe28 (incorrect -> 0x99e3), seq 890, ack 10945, win 499, options [nop,nop,TS val 350596732 ecr 350596732], length 0
2022-04-06 18:05:14.232165 IP (tos 0x0, ttl 64, id 47710, offset 0, flags [DF], proto TCP (6), length 1402)
    127.0.0.1.47288 > 127.0.0.1.11350: Flags [P.], cksum 0x036f (incorrect -> 0x6bb6), seq 890:2240, ack 10945, win 512, options [nop,nop,TS val 350596735 ecr 350596732], length 1350
2022-04-06 18:05:14.232180 IP (tos 0x0, ttl 64, id 39390, offset 0, flags [DF], proto TCP (6), length 52)
    127.0.0.1.11350 > 127.0.0.1.47288: Flags [.], cksum 0xfe28 (incorrect -> 0x9494), seq 10945, ack 2240, win 502, options [nop,nop,TS val 350596735 ecr 350596735], length 0
200, 5.9275617599487305, 1.474113941192627