2022-04-06 11:56:29.697135 IP (tos 0x0, ttl 64, id 46954, offset 0, flags [DF], proto TCP (6), length 60)
    127.0.0.1.54360 > 127.0.0.1.11750: Flags [S], cksum 0xfe30 (incorrect -> 0xb233), seq 967522248, win 65495, options [mss 65495,sackOK,TS val 328472200 ecr 0,nop,wscale 7], length 0
2022-04-06 11:56:29.697158 IP (tos 0x0, ttl 64, id 0, offset 0, flags [DF], proto TCP (6), length 60)
    127.0.0.1.11750 > 127.0.0.1.54360: Flags [S.], cksum 0xfe30 (incorrect -> 0x63e6), seq 946531265, ack 967522249, win 65483, options [mss 65495,sackOK,TS val 328472200 ecr 328472200,nop,wscale 7], length 0
2022-04-06 11:56:29.697177 IP (tos 0x0, ttl 64, id 46955, offset 0, flags [DF], proto TCP (6), length 52)
    127.0.0.1.54360 > 127.0.0.1.11750: Flags [.], cksum 0xfe28 (incorrect -> 0x8aa2), seq 1, ack 1, win 512, options [nop,nop,TS val 328472200 ecr 328472200], length 0
2022-04-06 11:56:29.697302 IP (tos 0x0, ttl 64, id 46956, offset 0, flags [DF], proto TCP (6), length 55)
    127.0.0.1.54360 > 127.0.0.1.11750: Flags [P.], cksum 0xfe2b (incorrect -> 0x8596), seq 1:4, ack 1, win 512, options [nop,nop,TS val 328472200 ecr 328472200], length 3
2022-04-06 11:56:29.697321 IP (tos 0x0, ttl 64, id 63288, offset 0, flags [DF], proto TCP (6), length 52)
    127.0.0.1.11750 > 127.0.0.1.54360: Flags [.], cksum 0xfe28 (incorrect -> 0x8a9f), seq 1, ack 4, win 512, options [nop,nop,TS val 328472200 ecr 328472200], length 0
2022-04-06 11:56:29.697413 IP (tos 0x0, ttl 64, id 63289, offset 0, flags [DF], proto TCP (6), length 54)
    127.0.0.1.11750 > 127.0.0.1.54360: Flags [P.], cksum 0xfe2a (incorrect -> 0x8595), seq 1:3, ack 4, win 512, options [nop,nop,TS val 328472200 ecr 328472200], length 2
2022-04-06 11:56:29.697429 IP (tos 0x0, ttl 64, id 46957, offset 0, flags [DF], proto TCP (6), length 52)
    127.0.0.1.54360 > 127.0.0.1.11750: Flags [.], cksum 0xfe28 (incorrect -> 0x8a9d), seq 4, ack 3, win 512, options [nop,nop,TS val 328472200 ecr 328472200], length 0
2022-04-06 11:56:29.699259 IP (tos 0x0, ttl 64, id 46958, offset 0, flags [DF], proto TCP (6), length 62)
    127.0.0.1.54360 > 127.0.0.1.11750: Flags [P.], cksum 0xfe32 (incorrect -> 0x204f), seq 4:14, ack 3, win 512, options [nop,nop,TS val 328472202 ecr 328472200], length 10
2022-04-06 11:56:29.699269 IP (tos 0x0, ttl 64, id 63290, offset 0, flags [DF], proto TCP (6), length 52)
    127.0.0.1.11750 > 127.0.0.1.54360: Flags [.], cksum 0xfe28 (incorrect -> 0x8a8f), seq 3, ack 14, win 512, options [nop,nop,TS val 328472202 ecr 328472202], length 0
2022-04-06 11:56:29.789476 IP (tos 0x0, ttl 64, id 63291, offset 0, flags [DF], proto TCP (6), length 62)
    127.0.0.1.11750 > 127.0.0.1.54360: Flags [P.], cksum 0xfe32 (incorrect -> 0x8522), seq 3:13, ack 14, win 512, options [nop,nop,TS val 328472292 ecr 328472202], length 10
2022-04-06 11:56:29.789485 IP (tos 0x0, ttl 64, id 46959, offset 0, flags [DF], proto TCP (6), length 52)
    127.0.0.1.54360 > 127.0.0.1.11750: Flags [.], cksum 0xfe28 (incorrect -> 0x89d1), seq 14, ack 13, win 512, options [nop,nop,TS val 328472292 ecr 328472292], length 0
2022-04-06 11:56:29.795266 IP (tos 0x0, ttl 64, id 46960, offset 0, flags [DF], proto TCP (6), length 569)
    127.0.0.1.54360 > 127.0.0.1.11750: Flags [P.], cksum 0x002e (incorrect -> 0xd20f), seq 14:531, ack 13, win 512, options [nop,nop,TS val 328472298 ecr 328472292], length 517
2022-04-06 11:56:29.795276 IP (tos 0x0, ttl 64, id 63292, offset 0, flags [DF], proto TCP (6), length 52)
    127.0.0.1.11750 > 127.0.0.1.54360: Flags [.], cksum 0xfe28 (incorrect -> 0x87c4), seq 13, ack 531, win 508, options [nop,nop,TS val 328472298 ecr 328472298], length 0
200, 2.7951602935791016, 0.9669108390808105