2022-04-06 17:27:02.988653 IP (tos 0x0, ttl 64, id 41688, offset 0, flags [DF], proto TCP (6), length 60)
    127.0.0.1.50514 > 127.0.0.1.10950: Flags [S], cksum 0xfe30 (incorrect -> 0x4222), seq 3780276062, win 65495, options [mss 65495,sackOK,TS val 348305491 ecr 0,nop,wscale 7], length 0
2022-04-06 17:27:02.988665 IP (tos 0x0, ttl 64, id 0, offset 0, flags [DF], proto TCP (6), length 60)
    127.0.0.1.10950 > 127.0.0.1.50514: Flags [S.], cksum 0xfe30 (incorrect -> 0x856d), seq 1840021997, ack 3780276063, win 65483, options [mss 65495,sackOK,TS val 348305491 ecr 348305491,nop,wscale 7], length 0
2022-04-06 17:27:02.988674 IP (tos 0x0, ttl 64, id 41689, offset 0, flags [DF], proto TCP (6), length 52)
    127.0.0.1.50514 > 127.0.0.1.10950: Flags [.], cksum 0xfe28 (incorrect -> 0xac29), seq 1, ack 1, win 512, options [nop,nop,TS val 348305491 ecr 348305491], length 0
2022-04-06 17:27:02.988775 IP (tos 0x0, ttl 64, id 41690, offset 0, flags [DF], proto TCP (6), length 55)
    127.0.0.1.50514 > 127.0.0.1.10950: Flags [P.], cksum 0xfe2b (incorrect -> 0xa71d), seq 1:4, ack 1, win 512, options [nop,nop,TS val 348305491 ecr 348305491], length 3
2022-04-06 17:27:02.988792 IP (tos 0x0, ttl 64, id 28763, offset 0, flags [DF], proto TCP (6), length 52)
    127.0.0.1.10950 > 127.0.0.1.50514: Flags [.], cksum 0xfe28 (incorrect -> 0xac26), seq 1, ack 4, win 512, options [nop,nop,TS val 348305491 ecr 348305491], length 0
2022-04-06 17:27:02.988852 IP (tos 0x0, ttl 64, id 28764, offset 0, flags [DF], proto TCP (6), length 54)
    127.0.0.1.10950 > 127.0.0.1.50514: Flags [P.], cksum 0xfe2a (incorrect -> 0xa71c), seq 1:3, ack 4, win 512, options [nop,nop,TS val 348305491 ecr 348305491], length 2
2022-04-06 17:27:02.988868 IP (tos 0x0, ttl 64, id 41691, offset 0, flags [DF], proto TCP (6), length 52)
    127.0.0.1.50514 > 127.0.0.1.10950: Flags [.], cksum 0xfe28 (incorrect -> 0xac24), seq 4, ack 3, win 512, options [nop,nop,TS val 348305491 ecr 348305491], length 0
2022-04-06 17:27:02.990542 IP (tos 0x0, ttl 64, id 41692, offset 0, flags [DF], proto TCP (6), length 62)
    127.0.0.1.50514 > 127.0.0.1.10950: Flags [P.], cksum 0xfe32 (incorrect -> 0x4756), seq 4:14, ack 3, win 512, options [nop,nop,TS val 348305493 ecr 348305491], length 10
2022-04-06 17:27:02.990552 IP (tos 0x0, ttl 64, id 28765, offset 0, flags [DF], proto TCP (6), length 52)
    127.0.0.1.10950 > 127.0.0.1.50514: Flags [.], cksum 0xfe28 (incorrect -> 0xac16), seq 3, ack 14, win 512, options [nop,nop,TS val 348305493 ecr 348305493], length 0
2022-04-06 17:27:03.049769 IP (tos 0x0, ttl 64, id 28766, offset 0, flags [DF], proto TCP (6), length 62)
    127.0.0.1.10950 > 127.0.0.1.50514: Flags [P.], cksum 0xfe32 (incorrect -> 0xa6c8), seq 3:13, ack 14, win 512, options [nop,nop,TS val 348305552 ecr 348305493], length 10
2022-04-06 17:27:03.049777 IP (tos 0x0, ttl 64, id 41693, offset 0, flags [DF], proto TCP (6), length 52)
    127.0.0.1.50514 > 127.0.0.1.10950: Flags [.], cksum 0xfe28 (incorrect -> 0xab96), seq 14, ack 13, win 512, options [nop,nop,TS val 348305552 ecr 348305552], length 0
2022-04-06 17:27:03.055476 IP (tos 0x0, ttl 64, id 41694, offset 0, flags [DF], proto TCP (6), length 569)
    127.0.0.1.50514 > 127.0.0.1.10950: Flags [P.], cksum 0x002e (incorrect -> 0x8df5), seq 14:531, ack 13, win 512, options [nop,nop,TS val 348305558 ecr 348305552], length 517
2022-04-06 17:27:03.055486 IP (tos 0x0, ttl 64, id 28767, offset 0, flags [DF], proto TCP (6), length 52)
    127.0.0.1.10950 > 127.0.0.1.50514: Flags [.], cksum 0xfe28 (incorrect -> 0xa989), seq 13, ack 531, win 508, options [nop,nop,TS val 348305558 ecr 348305558], length 0
2022-04-06 17:27:03.101303 IP (tos 0x0, ttl 64, id 28768, offset 0, flags [DF], proto TCP (6), length 3538)
    127.0.0.1.10950 > 127.0.0.1.50514: Flags [P.], cksum 0x0bc7 (incorrect -> 0x8b2e), seq 13:3499, ack 531, win 512, options [nop,nop,TS val 348305604 ecr 348305558], length 3486
2022-04-06 17:27:03.101311 IP (tos 0x0, ttl 64, id 41695, offset 0, flags [DF], proto TCP (6), length 52)
    127.0.0.1.50514 > 127.0.0.1.10950: Flags [.], cksum 0xfe28 (incorrect -> 0x9b9d), seq 531, ack 3499, win 494, options [nop,nop,TS val 348305604 ecr 348305604], length 0
2022-04-06 17:27:03.115208 IP (tos 0x0, ttl 64, id 28769, offset 0, flags [DF], proto TCP (6), length 886)
    127.0.0.1.10950 > 127.0.0.1.50514: Flags [P.], cksum 0x016b (incorrect -> 0x1800), seq 3499:4333, ack 531, win 512, options [nop,nop,TS val 348305618 ecr 348305604], length 834
2022-04-06 17:27:03.115227 IP (tos 0x0, ttl 64, id 41696, offset 0, flags [DF], proto TCP (6), length 52)
    127.0.0.1.50514 > 127.0.0.1.10950: Flags [.], cksum 0xfe28 (incorrect -> 0x9835), seq 531, ack 4333, win 504, options [nop,nop,TS val 348305618 ecr 348305618], length 0
2022-04-06 17:27:03.128973 IP (tos 0x0, ttl 64, id 28770, offset 0, flags [DF], proto TCP (6), length 1300)
    127.0.0.1.10950 > 127.0.0.1.50514: Flags [P.], cksum 0x0309 (incorrect -> 0x95b7), seq 4333:5581, ack 531, win 512, options [nop,nop,TS val 348305631 ecr 348305618], length 1248
2022-04-06 17:27:03.128984 IP (tos 0x0, ttl 64, id 41697, offset 0, flags [DF], proto TCP (6), length 52)
    127.0.0.1.50514 > 127.0.0.1.10950: Flags [.], cksum 0xfe28 (incorrect -> 0x933c), seq 531, ack 5581, win 503, options [nop,nop,TS val 348305631 ecr 348305631], length 0
2022-04-06 17:27:03.129351 IP (tos 0x0, ttl 64, id 41698, offset 0, flags [DF], proto TCP (6), length 116)
    127.0.0.1.50514 > 127.0.0.1.10950: Flags [P.], cksum 0xfe68 (incorrect -> 0x0f02), seq 531:595, ack 5581, win 512, options [nop,nop,TS val 348305632 ecr 348305631], length 64
2022-04-06 17:27:03.129361 IP (tos 0x0, ttl 64, id 28771, offset 0, flags [DF], proto TCP (6), length 52)
    127.0.0.1.10950 > 127.0.0.1.50514: Flags [.], cksum 0xfe28 (incorrect -> 0x92f1), seq 5581, ack 595, win 512, options [nop,nop,TS val 348305632 ecr 348305632], length 0
2022-04-06 17:27:03.129831 IP (tos 0x0, ttl 64, id 41699, offset 0, flags [DF], proto TCP (6), length 371)
    127.0.0.1.50514 > 127.0.0.1.10950: Flags [P.], cksum 0xff67 (incorrect -> 0xf4fd), seq 595:914, ack 5581, win 512, options [nop,nop,TS val 348305632 ecr 348305632], length 319
2022-04-06 17:27:03.129846 IP (tos 0x0, ttl 64, id 28772, offset 0, flags [DF], proto TCP (6), length 52)
    127.0.0.1.10950 > 127.0.0.1.50514: Flags [.], cksum 0xfe28 (incorrect -> 0x91b4), seq 5581, ack 914, win 510, options [nop,nop,TS val 348305632 ecr 348305632], length 0
2022-04-06 17:27:03.230044 IP (tos 0x0, ttl 64, id 28773, offset 0, flags [DF], proto TCP (6), length 3538)
    127.0.0.1.10950 > 127.0.0.1.50514: Flags [P.], cksum 0x0bc7 (incorrect -> 0xbc45), seq 5581:9067, ack 914, win 512, options [nop,nop,TS val 348305732 ecr 348305632], length 3486
2022-04-06 17:27:03.230053 IP (tos 0x0, ttl 64, id 41700, offset 0, flags [DF], proto TCP (6), length 52)
    127.0.0.1.50514 > 127.0.0.1.10950: Flags [.], cksum 0xfe28 (incorrect -> 0x835e), seq 914, ack 9067, win 494, options [nop,nop,TS val 348305732 ecr 348305732], length 0
2022-04-06 17:27:03.230090 IP (tos 0x0, ttl 64, id 28774, offset 0, flags [DF], proto TCP (6), length 4100)
    127.0.0.1.10950 > 127.0.0.1.50514: Flags [P.], cksum 0x0df9 (incorrect -> 0x5fbd), seq 9067:13115, ack 914, win 512, options [nop,nop,TS val 348305733 ecr 348305732], length 4048
2022-04-06 17:27:03.230095 IP (tos 0x0, ttl 64, id 41701, offset 0, flags [DF], proto TCP (6), length 52)
    127.0.0.1.50514 > 127.0.0.1.10950: Flags [.], cksum 0xfe28 (incorrect -> 0x739c), seq 914, ack 13115, win 478, options [nop,nop,TS val 348305733 ecr 348305733], length 0
2022-04-06 17:27:03.230102 IP (tos 0x0, ttl 64, id 28775, offset 0, flags [DF], proto TCP (6), length 486)
    127.0.0.1.10950 > 127.0.0.1.50514: Flags [P.], cksum 0xffda (incorrect -> 0x71a1), seq 13115:13549, ack 914, win 512, options [nop,nop,TS val 348305733 ecr 348305733], length 434
2022-04-06 17:27:03.230107 IP (tos 0x0, ttl 64, id 41702, offset 0, flags [DF], proto TCP (6), length 52)
    127.0.0.1.50514 > 127.0.0.1.10950: Flags [.], cksum 0xfe28 (incorrect -> 0x71ec), seq 914, ack 13549, win 476, options [nop,nop,TS val 348305733 ecr 348305733], length 0
2022-04-06 17:27:03.232577 IP (tos 0x0, ttl 64, id 28776, offset 0, flags [DF], proto TCP (6), length 3372)
    127.0.0.1.10950 > 127.0.0.1.50514: Flags [P.], cksum 0x0b21 (incorrect -> 0xf562), seq 13549:16869, ack 914, win 512, options [nop,nop,TS val 348305735 ecr 348305733], length 3320
2022-04-06 17:27:03.232585 IP (tos 0x0, ttl 64, id 41703, offset 0, flags [DF], proto TCP (6), length 52)
    127.0.0.1.50514 > 127.0.0.1.10950: Flags [.], cksum 0xfe28 (incorrect -> 0x64dd), seq 914, ack 16869, win 495, options [nop,nop,TS val 348305735 ecr 348305735], length 0
2022-04-06 17:27:03.243951 IP (tos 0x0, ttl 64, id 28777, offset 0, flags [DF], proto TCP (6), length 1048)
    127.0.0.1.10950 > 127.0.0.1.50514: Flags [P.], cksum 0x020d (incorrect -> 0x499e), seq 16869:17865, ack 914, win 512, options [nop,nop,TS val 348305746 ecr 348305735], length 996
2022-04-06 17:27:03.243966 IP (tos 0x0, ttl 64, id 41704, offset 0, flags [DF], proto TCP (6), length 52)
    127.0.0.1.50514 > 127.0.0.1.10950: Flags [.], cksum 0xfe28 (incorrect -> 0x60da), seq 914, ack 17865, win 504, options [nop,nop,TS val 348305746 ecr 348305746], length 0
2022-04-06 17:27:03.245512 IP (tos 0x0, ttl 64, id 28778, offset 0, flags [DF], proto TCP (6), length 4100)
    127.0.0.1.10950 > 127.0.0.1.50514: Flags [P.], cksum 0x0df9 (incorrect -> 0xa4e5), seq 17865:21913, ack 914, win 512, options [nop,nop,TS val 348305748 ecr 348305746], length 4048
2022-04-06 17:27:03.245520 IP (tos 0x0, ttl 64, id 41705, offset 0, flags [DF], proto TCP (6), length 52)
    127.0.0.1.50514 > 127.0.0.1.10950: Flags [.], cksum 0xfe28 (incorrect -> 0x5112), seq 914, ack 21913, win 492, options [nop,nop,TS val 348305748 ecr 348305748], length 0
2022-04-06 17:27:03.245528 IP (tos 0x0, ttl 64, id 28779, offset 0, flags [DF], proto TCP (6), length 3414)
    127.0.0.1.10950 > 127.0.0.1.50514: Flags [P.], cksum 0x0b4b (incorrect -> 0x6017), seq 21913:25275, ack 914, win 512, options [nop,nop,TS val 348305748 ecr 348305748], length 3362
2022-04-06 17:27:03.245534 IP (tos 0x0, ttl 64, id 41706, offset 0, flags [DF], proto TCP (6), length 52)
    127.0.0.1.50514 > 127.0.0.1.10950: Flags [.], cksum 0xfe28 (incorrect -> 0x43fd), seq 914, ack 25275, win 479, options [nop,nop,TS val 348305748 ecr 348305748], length 0
2022-04-06 17:27:03.245664 IP (tos 0x0, ttl 64, id 28780, offset 0, flags [DF], proto TCP (6), length 4100)
    127.0.0.1.10950 > 127.0.0.1.50514: Flags [P.], cksum 0x0df9 (incorrect -> 0x6c99), seq 25275:29323, ack 914, win 512, options [nop,nop,TS val 348305748 ecr 348305748], length 4048
2022-04-06 17:27:03.260572 IP (tos 0x0, ttl 64, id 28781, offset 0, flags [DF], proto TCP (6), length 32820)
    127.0.0.1.10950 > 127.0.0.1.50514: Flags [.], cksum 0x7e29 (incorrect -> 0x6e81), seq 29323:62091, ack 914, win 512, options [nop,nop,TS val 348305763 ecr 348305748], length 32768
2022-04-06 17:27:03.260637 IP (tos 0x0, ttl 64, id 41707, offset 0, flags [DF], proto TCP (6), length 52)
    127.0.0.1.50514 > 127.0.0.1.10950: Flags [.], cksum 0xfe28 (incorrect -> 0xb481), seq 914, ack 62091, win 379, options [nop,nop,TS val 348305763 ecr 348305748], length 0
2022-04-06 17:27:03.260644 IP (tos 0x0, ttl 64, id 28782, offset 0, flags [DF], proto TCP (6), length 5386)
    127.0.0.1.10950 > 127.0.0.1.50514: Flags [P.], cksum 0x12ff (incorrect -> 0x407f), seq 62091:67425, ack 914, win 512, options [nop,nop,TS val 348305763 ecr 348305763], length 5334
2022-04-06 17:27:03.261547 IP (tos 0x0, ttl 64, id 41708, offset 0, flags [DF], proto TCP (6), length 52)
    127.0.0.1.50514 > 127.0.0.1.10950: Flags [.], cksum 0xfe28 (incorrect -> 0x9f16), seq 914, ack 67425, win 512, options [nop,nop,TS val 348305764 ecr 348305763], length 0
2022-04-06 17:27:03.261555 IP (tos 0x0, ttl 64, id 28783, offset 0, flags [DF], proto TCP (6), length 4036)
    127.0.0.1.10950 > 127.0.0.1.50514: Flags [P.], cksum 0x0db9 (incorrect -> 0xd9f8), seq 67425:71409, ack 914, win 512, options [nop,nop,TS val 348305764 ecr 348305764], length 3984
2022-04-06 17:27:03.262410 IP (tos 0x0, ttl 64, id 41709, offset 0, flags [DF], proto TCP (6), length 52)
    127.0.0.1.50514 > 127.0.0.1.10950: Flags [.], cksum 0xfe28 (incorrect -> 0x8f84), seq 914, ack 71409, win 512, options [nop,nop,TS val 348305765 ecr 348305764], length 0
2022-04-06 17:27:03.262420 IP (tos 0x0, ttl 64, id 28784, offset 0, flags [DF], proto TCP (6), length 15232)
    127.0.0.1.10950 > 127.0.0.1.50514: Flags [P.], cksum 0x3975 (incorrect -> 0xc054), seq 71409:86589, ack 914, win 512, options [nop,nop,TS val 348305765 ecr 348305765], length 15180
2022-04-06 17:27:03.263296 IP (tos 0x0, ttl 64, id 41710, offset 0, flags [DF], proto TCP (6), length 52)
    127.0.0.1.50514 > 127.0.0.1.10950: Flags [.], cksum 0xfe28 (incorrect -> 0x5436), seq 914, ack 86589, win 512, options [nop,nop,TS val 348305766 ecr 348305765], length 0
2022-04-06 17:27:03.263304 IP (tos 0x0, ttl 64, id 28785, offset 0, flags [DF], proto TCP (6), length 2542)
    127.0.0.1.10950 > 127.0.0.1.50514: Flags [P.], cksum 0x07e3 (incorrect -> 0xb872), seq 86589:89079, ack 914, win 512, options [nop,nop,TS val 348305766 ecr 348305766], length 2490
2022-04-06 17:27:03.263310 IP (tos 0x0, ttl 64, id 41711, offset 0, flags [DF], proto TCP (6), length 52)
    127.0.0.1.50514 > 127.0.0.1.10950: Flags [.], cksum 0xfe28 (incorrect -> 0x4a7b), seq 914, ack 89079, win 512, options [nop,nop,TS val 348305766 ecr 348305766], length 0
2022-04-06 17:27:03.271600 IP (tos 0x0, ttl 64, id 28786, offset 0, flags [DF], proto TCP (6), length 3130)
    127.0.0.1.10950 > 127.0.0.1.50514: Flags [P.], cksum 0x0a2f (incorrect -> 0x5041), seq 89079:92157, ack 914, win 512, options [nop,nop,TS val 348305774 ecr 348305766], length 3078
2022-04-06 17:27:03.271618 IP (tos 0x0, ttl 64, id 41712, offset 0, flags [DF], proto TCP (6), length 52)
    127.0.0.1.50514 > 127.0.0.1.10950: Flags [.], cksum 0xfe28 (incorrect -> 0x3e65), seq 914, ack 92157, win 512, options [nop,nop,TS val 348305774 ecr 348305774], length 0
2022-04-06 17:27:03.271705 IP (tos 0x0, ttl 64, id 28787, offset 0, flags [DF], proto TCP (6), length 3538)
    127.0.0.1.10950 > 127.0.0.1.50514: Flags [P.], cksum 0x0bc7 (incorrect -> 0x9663), seq 92157:95643, ack 914, win 512, options [nop,nop,TS val 348305774 ecr 348305774], length 3486
2022-04-06 17:27:03.272020 IP (tos 0x0, ttl 64, id 41713, offset 0, flags [DF], proto TCP (6), length 52)
    127.0.0.1.50514 > 127.0.0.1.10950: Flags [.], cksum 0xfe28 (incorrect -> 0x30c7), seq 914, ack 95643, win 512, options [nop,nop,TS val 348305774 ecr 348305774], length 0
2022-04-06 17:27:03.273275 IP (tos 0x0, ttl 64, id 28788, offset 0, flags [DF], proto TCP (6), length 4036)
    127.0.0.1.10950 > 127.0.0.1.50514: Flags [P.], cksum 0x0db9 (incorrect -> 0xe18f), seq 95643:99627, ack 914, win 512, options [nop,nop,TS val 348305776 ecr 348305774], length 3984
2022-04-06 17:27:03.273295 IP (tos 0x0, ttl 64, id 41714, offset 0, flags [DF], proto TCP (6), length 52)
    127.0.0.1.50514 > 127.0.0.1.10950: Flags [.], cksum 0xfe28 (incorrect -> 0x2133), seq 914, ack 99627, win 512, options [nop,nop,TS val 348305776 ecr 348305776], length 0
2022-04-06 17:27:03.273384 IP (tos 0x0, ttl 64, id 28789, offset 0, flags [DF], proto TCP (6), length 3106)
    127.0.0.1.10950 > 127.0.0.1.50514: Flags [P.], cksum 0x0a17 (incorrect -> 0xf2a7), seq 99627:102681, ack 914, win 512, options [nop,nop,TS val 348305776 ecr 348305776], length 3054
2022-04-06 17:27:03.273399 IP (tos 0x0, ttl 64, id 41715, offset 0, flags [DF], proto TCP (6), length 52)
    127.0.0.1.50514 > 127.0.0.1.10950: Flags [.], cksum 0xfe28 (incorrect -> 0x1545), seq 914, ack 102681, win 512, options [nop,nop,TS val 348305776 ecr 348305776], length 0
2022-04-06 17:27:03.273646 IP (tos 0x0, ttl 64, id 28790, offset 0, flags [DF], proto TCP (6), length 4100)
    127.0.0.1.10950 > 127.0.0.1.50514: Flags [P.], cksum 0x0df9 (incorrect -> 0x4ecb), seq 102681:106729, ack 914, win 512, options [nop,nop,TS val 348305776 ecr 348305776], length 4048
2022-04-06 17:27:03.273666 IP (tos 0x0, ttl 64, id 41716, offset 0, flags [DF], proto TCP (6), length 52)
    127.0.0.1.50514 > 127.0.0.1.10950: Flags [.], cksum 0xfe28 (incorrect -> 0x0575), seq 914, ack 106729, win 512, options [nop,nop,TS val 348305776 ecr 348305776], length 0
2022-04-06 17:27:03.273672 IP (tos 0x0, ttl 64, id 28791, offset 0, flags [DF], proto TCP (6), length 3972)
    127.0.0.1.10950 > 127.0.0.1.50514: Flags [P.], cksum 0x0d79 (incorrect -> 0x9138), seq 106729:110649, ack 914, win 512, options [nop,nop,TS val 348305776 ecr 348305776], length 3920
2022-04-06 17:27:03.273679 IP (tos 0x0, ttl 64, id 41717, offset 0, flags [DF], proto TCP (6), length 52)
    127.0.0.1.50514 > 127.0.0.1.10950: Flags [.], cksum 0xfe28 (incorrect -> 0xf624), seq 914, ack 110649, win 512, options [nop,nop,TS val 348305776 ecr 348305776], length 0
2022-04-06 17:27:03.273798 IP (tos 0x0, ttl 64, id 28792, offset 0, flags [DF], proto TCP (6), length 4100)
    127.0.0.1.10950 > 127.0.0.1.50514: Flags [P.], cksum 0x0df9 (incorrect -> 0xad8f), seq 110649:114697, ack 914, win 512, options [nop,nop,TS val 348305776 ecr 348305776], length 4048
2022-04-06 17:27:03.274367 IP (tos 0x0, ttl 64, id 41718, offset 0, flags [DF], proto TCP (6), length 52)
    127.0.0.1.50514 > 127.0.0.1.10950: Flags [.], cksum 0xfe28 (incorrect -> 0xe653), seq 914, ack 114697, win 512, options [nop,nop,TS val 348305777 ecr 348305776], length 0
200, 3.8240203857421875, 0.2917168140411377