2022-04-06 10:42:16.274489 IP (tos 0x0, ttl 64, id 17791, offset 0, flags [DF], proto TCP (6), length 60)
    127.0.0.1.47598 > 127.0.0.1.9750: Flags [S], cksum 0xfe30 (incorrect -> 0xd85a), seq 2696528191, win 65495, options [mss 65495,sackOK,TS val 324018777 ecr 0,nop,wscale 7], length 0
2022-04-06 10:42:16.274502 IP (tos 0x0, ttl 64, id 0, offset 0, flags [DF], proto TCP (6), length 60)
    127.0.0.1.9750 > 127.0.0.1.47598: Flags [S.], cksum 0xfe30 (incorrect -> 0xe51f), seq 2600739464, ack 2696528192, win 65483, options [mss 65495,sackOK,TS val 324018777 ecr 324018777,nop,wscale 7], length 0
2022-04-06 10:42:16.274512 IP (tos 0x0, ttl 64, id 17792, offset 0, flags [DF], proto TCP (6), length 52)
    127.0.0.1.47598 > 127.0.0.1.9750: Flags [.], cksum 0xfe28 (incorrect -> 0x0bdc), seq 1, ack 1, win 512, options [nop,nop,TS val 324018777 ecr 324018777], length 0
2022-04-06 10:42:16.274609 IP (tos 0x0, ttl 64, id 17793, offset 0, flags [DF], proto TCP (6), length 55)
    127.0.0.1.47598 > 127.0.0.1.9750: Flags [P.], cksum 0xfe2b (incorrect -> 0x06d0), seq 1:4, ack 1, win 512, options [nop,nop,TS val 324018777 ecr 324018777], length 3
2022-04-06 10:42:16.274620 IP (tos 0x0, ttl 64, id 58704, offset 0, flags [DF], proto TCP (6), length 52)
    127.0.0.1.9750 > 127.0.0.1.47598: Flags [.], cksum 0xfe28 (incorrect -> 0x0bd9), seq 1, ack 4, win 512, options [nop,nop,TS val 324018777 ecr 324018777], length 0
2022-04-06 10:42:16.274688 IP (tos 0x0, ttl 64, id 58705, offset 0, flags [DF], proto TCP (6), length 54)
    127.0.0.1.9750 > 127.0.0.1.47598: Flags [P.], cksum 0xfe2a (incorrect -> 0x06cf), seq 1:3, ack 4, win 512, options [nop,nop,TS val 324018777 ecr 324018777], length 2
2022-04-06 10:42:16.274701 IP (tos 0x0, ttl 64, id 17794, offset 0, flags [DF], proto TCP (6), length 52)
    127.0.0.1.47598 > 127.0.0.1.9750: Flags [.], cksum 0xfe28 (incorrect -> 0x0bd7), seq 4, ack 3, win 512, options [nop,nop,TS val 324018777 ecr 324018777], length 0
2022-04-06 10:42:16.276242 IP (tos 0x0, ttl 64, id 17795, offset 0, flags [DF], proto TCP (6), length 62)
    127.0.0.1.47598 > 127.0.0.1.9750: Flags [P.], cksum 0xfe32 (incorrect -> 0xfdb6), seq 4:14, ack 3, win 512, options [nop,nop,TS val 324018779 ecr 324018777], length 10
2022-04-06 10:42:16.276250 IP (tos 0x0, ttl 64, id 58706, offset 0, flags [DF], proto TCP (6), length 52)
    127.0.0.1.9750 > 127.0.0.1.47598: Flags [.], cksum 0xfe28 (incorrect -> 0x0bc9), seq 3, ack 14, win 512, options [nop,nop,TS val 324018779 ecr 324018779], length 0
2022-04-06 10:42:16.317840 IP (tos 0x0, ttl 64, id 58707, offset 0, flags [DF], proto TCP (6), length 62)
    127.0.0.1.9750 > 127.0.0.1.47598: Flags [P.], cksum 0xfe32 (incorrect -> 0x068d), seq 3:13, ack 14, win 512, options [nop,nop,TS val 324018820 ecr 324018779], length 10
2022-04-06 10:42:16.317848 IP (tos 0x0, ttl 64, id 17796, offset 0, flags [DF], proto TCP (6), length 52)
    127.0.0.1.47598 > 127.0.0.1.9750: Flags [.], cksum 0xfe28 (incorrect -> 0x0b6d), seq 14, ack 13, win 512, options [nop,nop,TS val 324018820 ecr 324018820], length 0
2022-04-06 10:42:16.323683 IP (tos 0x0, ttl 64, id 17797, offset 0, flags [DF], proto TCP (6), length 569)
    127.0.0.1.47598 > 127.0.0.1.9750: Flags [P.], cksum 0x002e (incorrect -> 0x1f9c), seq 14:531, ack 13, win 512, options [nop,nop,TS val 324018826 ecr 324018820], length 517
2022-04-06 10:42:16.323693 IP (tos 0x0, ttl 64, id 58708, offset 0, flags [DF], proto TCP (6), length 52)
    127.0.0.1.9750 > 127.0.0.1.47598: Flags [.], cksum 0xfe28 (incorrect -> 0x0960), seq 13, ack 531, win 508, options [nop,nop,TS val 324018826 ecr 324018826], length 0
2022-04-06 10:42:16.371804 IP (tos 0x0, ttl 64, id 58709, offset 0, flags [DF], proto TCP (6), length 3446)
    127.0.0.1.9750 > 127.0.0.1.47598: Flags [P.], cksum 0x0b6b (incorrect -> 0x2083), seq 13:3407, ack 531, win 512, options [nop,nop,TS val 324018874 ecr 324018826], length 3394
2022-04-06 10:42:16.371812 IP (tos 0x0, ttl 64, id 17798, offset 0, flags [DF], proto TCP (6), length 52)
    127.0.0.1.47598 > 127.0.0.1.9750: Flags [.], cksum 0xfe28 (incorrect -> 0xfbcb), seq 531, ack 3407, win 494, options [nop,nop,TS val 324018874 ecr 324018874], length 0
2022-04-06 10:42:16.385648 IP (tos 0x0, ttl 64, id 58710, offset 0, flags [DF], proto TCP (6), length 242)
    127.0.0.1.9750 > 127.0.0.1.47598: Flags [P.], cksum 0xfee6 (incorrect -> 0xe688), seq 3407:3597, ack 531, win 512, options [nop,nop,TS val 324018888 ecr 324018874], length 190
2022-04-06 10:42:16.385657 IP (tos 0x0, ttl 64, id 17799, offset 0, flags [DF], proto TCP (6), length 52)
    127.0.0.1.47598 > 127.0.0.1.9750: Flags [.], cksum 0xfe28 (incorrect -> 0xfae4), seq 531, ack 3597, win 507, options [nop,nop,TS val 324018888 ecr 324018888], length 0
2022-04-06 10:42:16.385814 IP (tos 0x0, ttl 64, id 17800, offset 0, flags [DF], proto TCP (6), length 132)
    127.0.0.1.47598 > 127.0.0.1.9750: Flags [P.], cksum 0xfe78 (incorrect -> 0x5912), seq 531:611, ack 3597, win 512, options [nop,nop,TS val 324018888 ecr 324018888], length 80
2022-04-06 10:42:16.385821 IP (tos 0x0, ttl 64, id 58711, offset 0, flags [DF], proto TCP (6), length 52)
    127.0.0.1.9750 > 127.0.0.1.47598: Flags [.], cksum 0xfe28 (incorrect -> 0xfa8f), seq 3597, ack 611, win 512, options [nop,nop,TS val 324018888 ecr 324018888], length 0
2022-04-06 10:42:16.386275 IP (tos 0x0, ttl 64, id 17801, offset 0, flags [DF], proto TCP (6), length 413)
    127.0.0.1.47598 > 127.0.0.1.9750: Flags [P.], cksum 0xff91 (incorrect -> 0xd41a), seq 611:972, ack 3597, win 512, options [nop,nop,TS val 324018889 ecr 324018888], length 361
2022-04-06 10:42:16.386283 IP (tos 0x0, ttl 64, id 58712, offset 0, flags [DF], proto TCP (6), length 52)
    127.0.0.1.9750 > 127.0.0.1.47598: Flags [.], cksum 0xfe28 (incorrect -> 0xf926), seq 3597, ack 972, win 510, options [nop,nop,TS val 324018889 ecr 324018889], length 0
2022-04-06 10:42:16.426295 IP (tos 0x0, ttl 64, id 58713, offset 0, flags [DF], proto TCP (6), length 355)
    127.0.0.1.9750 > 127.0.0.1.47598: Flags [P.], cksum 0xff57 (incorrect -> 0xc514), seq 3597:3900, ack 972, win 512, options [nop,nop,TS val 324018929 ecr 324018889], length 303
200, 4.530624866485596, 0.3102569580078125