2022-04-06 14:59:17.584293 IP (tos 0x0, ttl 64, id 39557, offset 0, flags [DF], proto TCP (6), length 60)
    127.0.0.1.46264 > 127.0.0.1.9150: Flags [S], cksum 0xfe30 (incorrect -> 0x2051), seq 1651404473, win 65495, options [mss 65495,sackOK,TS val 339440087 ecr 0,nop,wscale 7], length 0
2022-04-06 14:59:17.584310 IP (tos 0x0, ttl 64, id 0, offset 0, flags [DF], proto TCP (6), length 60)
    127.0.0.1.9150 > 127.0.0.1.46264: Flags [S.], cksum 0xfe30 (incorrect -> 0x44b1), seq 477247766, ack 1651404474, win 65483, options [mss 65495,sackOK,TS val 339440087 ecr 339440087,nop,wscale 7], length 0
2022-04-06 14:59:17.584323 IP (tos 0x0, ttl 64, id 39558, offset 0, flags [DF], proto TCP (6), length 52)
    127.0.0.1.46264 > 127.0.0.1.9150: Flags [.], cksum 0xfe28 (incorrect -> 0x6b6d), seq 1, ack 1, win 512, options [nop,nop,TS val 339440087 ecr 339440087], length 0
2022-04-06 14:59:17.584510 IP (tos 0x0, ttl 64, id 39559, offset 0, flags [DF], proto TCP (6), length 55)
    127.0.0.1.46264 > 127.0.0.1.9150: Flags [P.], cksum 0xfe2b (incorrect -> 0x6661), seq 1:4, ack 1, win 512, options [nop,nop,TS val 339440087 ecr 339440087], length 3
2022-04-06 14:59:17.584517 IP (tos 0x0, ttl 64, id 22177, offset 0, flags [DF], proto TCP (6), length 52)
    127.0.0.1.9150 > 127.0.0.1.46264: Flags [.], cksum 0xfe28 (incorrect -> 0x6b6a), seq 1, ack 4, win 512, options [nop,nop,TS val 339440087 ecr 339440087], length 0
2022-04-06 14:59:17.584545 IP (tos 0x0, ttl 64, id 22178, offset 0, flags [DF], proto TCP (6), length 54)
    127.0.0.1.9150 > 127.0.0.1.46264: Flags [P.], cksum 0xfe2a (incorrect -> 0x6660), seq 1:3, ack 4, win 512, options [nop,nop,TS val 339440087 ecr 339440087], length 2
2022-04-06 14:59:17.584554 IP (tos 0x0, ttl 64, id 39560, offset 0, flags [DF], proto TCP (6), length 52)
    127.0.0.1.46264 > 127.0.0.1.9150: Flags [.], cksum 0xfe28 (incorrect -> 0x6b68), seq 4, ack 3, win 512, options [nop,nop,TS val 339440087 ecr 339440087], length 0
2022-04-06 14:59:17.585877 IP (tos 0x0, ttl 64, id 39561, offset 0, flags [DF], proto TCP (6), length 62)
    127.0.0.1.46264 > 127.0.0.1.9150: Flags [P.], cksum 0xfe32 (incorrect -> 0x5a11), seq 4:14, ack 3, win 512, options [nop,nop,TS val 339440088 ecr 339440087], length 10
2022-04-06 14:59:17.585887 IP (tos 0x0, ttl 64, id 22179, offset 0, flags [DF], proto TCP (6), length 52)
    127.0.0.1.9150 > 127.0.0.1.46264: Flags [.], cksum 0xfe28 (incorrect -> 0x6b5c), seq 3, ack 14, win 512, options [nop,nop,TS val 339440088 ecr 339440088], length 0
2022-04-06 14:59:17.687304 IP (tos 0x0, ttl 64, id 22180, offset 0, flags [DF], proto TCP (6), length 62)
    127.0.0.1.9150 > 127.0.0.1.46264: Flags [P.], cksum 0xfe32 (incorrect -> 0x65e3), seq 3:13, ack 14, win 512, options [nop,nop,TS val 339440190 ecr 339440088], length 10
2022-04-06 14:59:17.687316 IP (tos 0x0, ttl 64, id 39562, offset 0, flags [DF], proto TCP (6), length 52)
    127.0.0.1.46264 > 127.0.0.1.9150: Flags [.], cksum 0xfe28 (incorrect -> 0x6a86), seq 14, ack 13, win 512, options [nop,nop,TS val 339440190 ecr 339440190], length 0
2022-04-06 14:59:17.699043 IP (tos 0x0, ttl 64, id 39563, offset 0, flags [DF], proto TCP (6), length 569)
    127.0.0.1.46264 > 127.0.0.1.9150: Flags [P.], cksum 0x002e (incorrect -> 0xde57), seq 14:531, ack 13, win 512, options [nop,nop,TS val 339440201 ecr 339440190], length 517
2022-04-06 14:59:17.699064 IP (tos 0x0, ttl 64, id 22181, offset 0, flags [DF], proto TCP (6), length 52)
    127.0.0.1.9150 > 127.0.0.1.46264: Flags [.], cksum 0xfe28 (incorrect -> 0x686f), seq 13, ack 531, win 508, options [nop,nop,TS val 339440201 ecr 339440201], length 0
200, 4.624473571777344, 0.3977820873260498