2022-04-06 22:09:44.864405 IP (tos 0x0, ttl 64, id 3517, offset 0, flags [DF], proto TCP (6), length 60)
    127.0.0.1.46468 > 127.0.0.1.10650: Flags [S], cksum 0xfe30 (incorrect -> 0x8152), seq 4274606426, win 65495, options [mss 65495,sackOK,TS val 365267367 ecr 0,nop,wscale 7], length 0
2022-04-06 22:09:44.864421 IP (tos 0x0, ttl 64, id 0, offset 0, flags [DF], proto TCP (6), length 60)
    127.0.0.1.10650 > 127.0.0.1.46468: Flags [S.], cksum 0xfe30 (incorrect -> 0x6adf), seq 2483872500, ack 4274606427, win 65483, options [mss 65495,sackOK,TS val 365267367 ecr 365267367,nop,wscale 7], length 0
2022-04-06 22:09:44.864434 IP (tos 0x0, ttl 64, id 3518, offset 0, flags [DF], proto TCP (6), length 52)
    127.0.0.1.46468 > 127.0.0.1.10650: Flags [.], cksum 0xfe28 (incorrect -> 0x919b), seq 1, ack 1, win 512, options [nop,nop,TS val 365267367 ecr 365267367], length 0
2022-04-06 22:09:44.864544 IP (tos 0x0, ttl 64, id 3519, offset 0, flags [DF], proto TCP (6), length 55)
    127.0.0.1.46468 > 127.0.0.1.10650: Flags [P.], cksum 0xfe2b (incorrect -> 0x8c8f), seq 1:4, ack 1, win 512, options [nop,nop,TS val 365267367 ecr 365267367], length 3
2022-04-06 22:09:44.864561 IP (tos 0x0, ttl 64, id 4829, offset 0, flags [DF], proto TCP (6), length 52)
    127.0.0.1.10650 > 127.0.0.1.46468: Flags [.], cksum 0xfe28 (incorrect -> 0x9198), seq 1, ack 4, win 512, options [nop,nop,TS val 365267367 ecr 365267367], length 0
2022-04-06 22:09:44.864599 IP (tos 0x0, ttl 64, id 4830, offset 0, flags [DF], proto TCP (6), length 54)
    127.0.0.1.10650 > 127.0.0.1.46468: Flags [P.], cksum 0xfe2a (incorrect -> 0x8c8e), seq 1:3, ack 4, win 512, options [nop,nop,TS val 365267367 ecr 365267367], length 2
2022-04-06 22:09:44.864613 IP (tos 0x0, ttl 64, id 3520, offset 0, flags [DF], proto TCP (6), length 52)
    127.0.0.1.46468 > 127.0.0.1.10650: Flags [.], cksum 0xfe28 (incorrect -> 0x9196), seq 4, ack 3, win 512, options [nop,nop,TS val 365267367 ecr 365267367], length 0
2022-04-06 22:09:44.865972 IP (tos 0x0, ttl 64, id 3521, offset 0, flags [DF], proto TCP (6), length 62)
    127.0.0.1.46468 > 127.0.0.1.10650: Flags [P.], cksum 0xfe32 (incorrect -> 0x2749), seq 4:14, ack 3, win 512, options [nop,nop,TS val 365267368 ecr 365267367], length 10
2022-04-06 22:09:44.865982 IP (tos 0x0, ttl 64, id 4831, offset 0, flags [DF], proto TCP (6), length 52)
    127.0.0.1.10650 > 127.0.0.1.46468: Flags [.], cksum 0xfe28 (incorrect -> 0x918a), seq 3, ack 14, win 512, options [nop,nop,TS val 365267368 ecr 365267368], length 0
2022-04-06 22:09:44.968677 IP (tos 0x0, ttl 64, id 4832, offset 0, flags [DF], proto TCP (6), length 62)
    127.0.0.1.10650 > 127.0.0.1.46468: Flags [P.], cksum 0xfe32 (incorrect -> 0x8c10), seq 3:13, ack 14, win 512, options [nop,nop,TS val 365267471 ecr 365267368], length 10
2022-04-06 22:09:44.968685 IP (tos 0x0, ttl 64, id 3522, offset 0, flags [DF], proto TCP (6), length 52)
    127.0.0.1.46468 > 127.0.0.1.10650: Flags [.], cksum 0xfe28 (incorrect -> 0x90b2), seq 14, ack 13, win 512, options [nop,nop,TS val 365267471 ecr 365267471], length 0
2022-04-06 22:09:44.974292 IP (tos 0x0, ttl 64, id 3523, offset 0, flags [DF], proto TCP (6), length 569)
    127.0.0.1.46468 > 127.0.0.1.10650: Flags [P.], cksum 0x002e (incorrect -> 0x0dbd), seq 14:531, ack 13, win 512, options [nop,nop,TS val 365267477 ecr 365267471], length 517
2022-04-06 22:09:44.974302 IP (tos 0x0, ttl 64, id 4833, offset 0, flags [DF], proto TCP (6), length 52)
    127.0.0.1.10650 > 127.0.0.1.46468: Flags [.], cksum 0xfe28 (incorrect -> 0x8ea5), seq 13, ack 531, win 508, options [nop,nop,TS val 365267477 ecr 365267477], length 0
2022-04-06 22:09:45.079155 IP (tos 0x0, ttl 64, id 4834, offset 0, flags [DF], proto TCP (6), length 3538)
    127.0.0.1.10650 > 127.0.0.1.46468: Flags [P.], cksum 0x0bc7 (incorrect -> 0x37a0), seq 13:3499, ack 531, win 512, options [nop,nop,TS val 365267582 ecr 365267477], length 3486
2022-04-06 22:09:45.079163 IP (tos 0x0, ttl 64, id 3524, offset 0, flags [DF], proto TCP (6), length 52)
    127.0.0.1.46468 > 127.0.0.1.10650: Flags [.], cksum 0xfe28 (incorrect -> 0x8043), seq 531, ack 3499, win 494, options [nop,nop,TS val 365267582 ecr 365267582], length 0
2022-04-06 22:09:45.112763 IP (tos 0x0, ttl 64, id 4835, offset 0, flags [DF], proto TCP (6), length 1012)
    127.0.0.1.10650 > 127.0.0.1.46468: Flags [P.], cksum 0x01e9 (incorrect -> 0x258b), seq 3499:4459, ack 531, win 512, options [nop,nop,TS val 365267615 ecr 365267582], length 960
2022-04-06 22:09:45.112772 IP (tos 0x0, ttl 64, id 3525, offset 0, flags [DF], proto TCP (6), length 52)
    127.0.0.1.46468 > 127.0.0.1.10650: Flags [.], cksum 0xfe28 (incorrect -> 0x7c37), seq 531, ack 4459, win 504, options [nop,nop,TS val 365267615 ecr 365267615], length 0
2022-04-06 22:09:45.113233 IP (tos 0x0, ttl 64, id 3526, offset 0, flags [DF], proto TCP (6), length 145)
    127.0.0.1.46468 > 127.0.0.1.10650: Flags [P.], cksum 0xfe85 (incorrect -> 0x4e1d), seq 531:624, ack 4459, win 512, options [nop,nop,TS val 365267616 ecr 365267615], length 93
2022-04-06 22:09:45.113241 IP (tos 0x0, ttl 64, id 4836, offset 0, flags [DF], proto TCP (6), length 52)
    127.0.0.1.10650 > 127.0.0.1.46468: Flags [.], cksum 0xfe28 (incorrect -> 0x7bd0), seq 4459, ack 624, win 512, options [nop,nop,TS val 365267616 ecr 365267616], length 0
2022-04-06 22:09:45.212977 IP (tos 0x0, ttl 64, id 4837, offset 0, flags [DF], proto TCP (6), length 103)
    127.0.0.1.10650 > 127.0.0.1.46468: Flags [P.], cksum 0xfe5b (incorrect -> 0x628f), seq 4459:4510, ack 624, win 512, options [nop,nop,TS val 365267715 ecr 365267616], length 51
2022-04-06 22:09:45.212985 IP (tos 0x0, ttl 64, id 3527, offset 0, flags [DF], proto TCP (6), length 52)
    127.0.0.1.46468 > 127.0.0.1.10650: Flags [.], cksum 0xfe28 (incorrect -> 0x7ad7), seq 624, ack 4510, win 512, options [nop,nop,TS val 365267715 ecr 365267715], length 0
2022-04-06 22:09:45.213347 IP (tos 0x0, ttl 64, id 3528, offset 0, flags [DF], proto TCP (6), length 374)
    127.0.0.1.46468 > 127.0.0.1.10650: Flags [P.], cksum 0xff6a (incorrect -> 0x370f), seq 624:946, ack 4510, win 512, options [nop,nop,TS val 365267716 ecr 365267715], length 322
2022-04-06 22:09:45.213356 IP (tos 0x0, ttl 64, id 4838, offset 0, flags [DF], proto TCP (6), length 52)
    127.0.0.1.10650 > 127.0.0.1.46468: Flags [.], cksum 0xfe28 (incorrect -> 0x7995), seq 4510, ack 946, win 510, options [nop,nop,TS val 365267716 ecr 365267716], length 0
2022-04-06 22:09:45.306001 IP (tos 0x0, ttl 64, id 4839, offset 0, flags [DF], proto TCP (6), length 429)
    127.0.0.1.10650 > 127.0.0.1.46468: Flags [P.], cksum 0xffa1 (incorrect -> 0xcd0b), seq 4510:4887, ack 946, win 512, options [nop,nop,TS val 365267808 ecr 365267716], length 377
2022-04-06 22:09:45.308398 IP (tos 0x0, ttl 64, id 9154, offset 0, flags [DF], proto TCP (6), length 60)
    127.0.0.1.46470 > 127.0.0.1.10650: Flags [S], cksum 0xfe30 (incorrect -> 0x60c2), seq 3759050471, win 65495, options [mss 65495,sackOK,TS val 365267811 ecr 0,nop,wscale 7], length 0
2022-04-06 22:09:45.308412 IP (tos 0x0, ttl 64, id 0, offset 0, flags [DF], proto TCP (6), length 60)
    127.0.0.1.10650 > 127.0.0.1.46470: Flags [S.], cksum 0xfe30 (incorrect -> 0x328f), seq 1986795161, ack 3759050472, win 65483, options [mss 65495,sackOK,TS val 365267811 ecr 365267811,nop,wscale 7], length 0
2022-04-06 22:09:45.308422 IP (tos 0x0, ttl 64, id 9155, offset 0, flags [DF], proto TCP (6), length 52)
    127.0.0.1.46470 > 127.0.0.1.10650: Flags [.], cksum 0xfe28 (incorrect -> 0x594b), seq 1, ack 1, win 512, options [nop,nop,TS val 365267811 ecr 365267811], length 0
2022-04-06 22:09:45.308515 IP (tos 0x0, ttl 64, id 9156, offset 0, flags [DF], proto TCP (6), length 55)
    127.0.0.1.46470 > 127.0.0.1.10650: Flags [P.], cksum 0xfe2b (incorrect -> 0x543f), seq 1:4, ack 1, win 512, options [nop,nop,TS val 365267811 ecr 365267811], length 3
2022-04-06 22:09:45.308523 IP (tos 0x0, ttl 64, id 58243, offset 0, flags [DF], proto TCP (6), length 52)
    127.0.0.1.10650 > 127.0.0.1.46470: Flags [.], cksum 0xfe28 (incorrect -> 0x5948), seq 1, ack 4, win 512, options [nop,nop,TS val 365267811 ecr 365267811], length 0
2022-04-06 22:09:45.308541 IP (tos 0x0, ttl 64, id 58244, offset 0, flags [DF], proto TCP (6), length 54)
    127.0.0.1.10650 > 127.0.0.1.46470: Flags [P.], cksum 0xfe2a (incorrect -> 0x543e), seq 1:3, ack 4, win 512, options [nop,nop,TS val 365267811 ecr 365267811], length 2
2022-04-06 22:09:45.308549 IP (tos 0x0, ttl 64, id 9157, offset 0, flags [DF], proto TCP (6), length 52)
    127.0.0.1.46470 > 127.0.0.1.10650: Flags [.], cksum 0xfe28 (incorrect -> 0x5946), seq 4, ack 3, win 512, options [nop,nop,TS val 365267811 ecr 365267811], length 0
2022-04-06 22:09:45.309597 IP (tos 0x0, ttl 64, id 9158, offset 0, flags [DF], proto TCP (6), length 62)
    127.0.0.1.46470 > 127.0.0.1.10650: Flags [P.], cksum 0xfe32 (incorrect -> 0xeef8), seq 4:14, ack 3, win 512, options [nop,nop,TS val 365267812 ecr 365267811], length 10
2022-04-06 22:09:45.309605 IP (tos 0x0, ttl 64, id 58245, offset 0, flags [DF], proto TCP (6), length 52)
    127.0.0.1.10650 > 127.0.0.1.46470: Flags [.], cksum 0xfe28 (incorrect -> 0x593a), seq 3, ack 14, win 512, options [nop,nop,TS val 365267812 ecr 365267812], length 0
2022-04-06 22:09:45.346659 IP (tos 0x0, ttl 64, id 3529, offset 0, flags [DF], proto TCP (6), length 52)
    127.0.0.1.46468 > 127.0.0.1.10650: Flags [.], cksum 0xfe28 (incorrect -> 0x7739), seq 946, ack 4887, win 512, options [nop,nop,TS val 365267849 ecr 365267808], length 0
2022-04-06 22:09:45.428220 IP (tos 0x0, ttl 64, id 58246, offset 0, flags [DF], proto TCP (6), length 62)
    127.0.0.1.10650 > 127.0.0.1.46470: Flags [P.], cksum 0xfe32 (incorrect -> 0x53b0), seq 3:13, ack 14, win 512, options [nop,nop,TS val 365267931 ecr 365267812], length 10
2022-04-06 22:09:45.428230 IP (tos 0x0, ttl 64, id 9159, offset 0, flags [DF], proto TCP (6), length 52)
    127.0.0.1.46470 > 127.0.0.1.10650: Flags [.], cksum 0xfe28 (incorrect -> 0x5842), seq 14, ack 13, win 512, options [nop,nop,TS val 365267931 ecr 365267931], length 0
2022-04-06 22:09:45.434302 IP (tos 0x0, ttl 64, id 9160, offset 0, flags [DF], proto TCP (6), length 569)
    127.0.0.1.46470 > 127.0.0.1.10650: Flags [P.], cksum 0x002e (incorrect -> 0xe810), seq 14:531, ack 13, win 512, options [nop,nop,TS val 365267937 ecr 365267931], length 517
2022-04-06 22:09:45.434312 IP (tos 0x0, ttl 64, id 58247, offset 0, flags [DF], proto TCP (6), length 52)
    127.0.0.1.10650 > 127.0.0.1.46470: Flags [.], cksum 0xfe28 (incorrect -> 0x5635), seq 13, ack 531, win 508, options [nop,nop,TS val 365267937 ecr 365267937], length 0
2022-04-06 22:09:45.608533 IP (tos 0x0, ttl 64, id 58248, offset 0, flags [DF], proto TCP (6), length 3538)
    127.0.0.1.10650 > 127.0.0.1.46470: Flags [P.], cksum 0x0bc7 (incorrect -> 0x08f9), seq 13:3499, ack 531, win 512, options [nop,nop,TS val 365268111 ecr 365267937], length 3486
2022-04-06 22:09:45.608545 IP (tos 0x0, ttl 64, id 9161, offset 0, flags [DF], proto TCP (6), length 52)
    127.0.0.1.46470 > 127.0.0.1.10650: Flags [.], cksum 0xfe28 (incorrect -> 0x4749), seq 531, ack 3499, win 494, options [nop,nop,TS val 365268111 ecr 365268111], length 0
2022-04-06 22:09:45.627003 IP (tos 0x0, ttl 64, id 58249, offset 0, flags [DF], proto TCP (6), length 1012)
    127.0.0.1.10650 > 127.0.0.1.46470: Flags [P.], cksum 0x01e9 (incorrect -> 0xc910), seq 3499:4459, ack 531, win 512, options [nop,nop,TS val 365268129 ecr 365268111], length 960
2022-04-06 22:09:45.627011 IP (tos 0x0, ttl 64, id 9162, offset 0, flags [DF], proto TCP (6), length 52)
    127.0.0.1.46470 > 127.0.0.1.10650: Flags [.], cksum 0xfe28 (incorrect -> 0x435b), seq 531, ack 4459, win 504, options [nop,nop,TS val 365268129 ecr 365268129], length 0
2022-04-06 22:09:45.627530 IP (tos 0x0, ttl 64, id 9163, offset 0, flags [DF], proto TCP (6), length 145)
    127.0.0.1.46470 > 127.0.0.1.10650: Flags [P.], cksum 0xfe85 (incorrect -> 0x2cc1), seq 531:624, ack 4459, win 512, options [nop,nop,TS val 365268130 ecr 365268129], length 93
2022-04-06 22:09:45.627538 IP (tos 0x0, ttl 64, id 58250, offset 0, flags [DF], proto TCP (6), length 52)
    127.0.0.1.10650 > 127.0.0.1.46470: Flags [.], cksum 0xfe28 (incorrect -> 0x42f4), seq 4459, ack 624, win 512, options [nop,nop,TS val 365268130 ecr 365268130], length 0
2022-04-06 22:09:45.804869 IP (tos 0x0, ttl 64, id 58251, offset 0, flags [DF], proto TCP (6), length 103)
    127.0.0.1.10650 > 127.0.0.1.46470: Flags [P.], cksum 0xfe5b (incorrect -> 0xe4d4), seq 4459:4510, ack 624, win 512, options [nop,nop,TS val 365268307 ecr 365268130], length 51
2022-04-06 22:09:45.804878 IP (tos 0x0, ttl 64, id 9164, offset 0, flags [DF], proto TCP (6), length 52)
    127.0.0.1.46470 > 127.0.0.1.10650: Flags [.], cksum 0xfe28 (incorrect -> 0x415f), seq 624, ack 4510, win 512, options [nop,nop,TS val 365268307 ecr 365268307], length 0
2022-04-06 22:09:45.805179 IP (tos 0x0, ttl 64, id 9165, offset 0, flags [DF], proto TCP (6), length 370)
    127.0.0.1.46470 > 127.0.0.1.10650: Flags [P.], cksum 0xff66 (incorrect -> 0x1ba3), seq 624:942, ack 4510, win 512, options [nop,nop,TS val 365268308 ecr 365268307], length 318
2022-04-06 22:09:45.805188 IP (tos 0x0, ttl 64, id 58252, offset 0, flags [DF], proto TCP (6), length 52)
    127.0.0.1.10650 > 127.0.0.1.46470: Flags [.], cksum 0xfe28 (incorrect -> 0x4021), seq 4510, ack 942, win 510, options [nop,nop,TS val 365268308 ecr 365268308], length 0
2022-04-06 22:09:45.988208 IP (tos 0x0, ttl 64, id 58253, offset 0, flags [DF], proto TCP (6), length 3538)
    127.0.0.1.10650 > 127.0.0.1.46470: Flags [P.], cksum 0x0bc7 (incorrect -> 0x713c), seq 4510:7996, ack 942, win 512, options [nop,nop,TS val 365268491 ecr 365268308], length 3486
2022-04-06 22:09:46.030657 IP (tos 0x0, ttl 64, id 9166, offset 0, flags [DF], proto TCP (6), length 52)
    127.0.0.1.46470 > 127.0.0.1.10650: Flags [.], cksum 0xfe28 (incorrect -> 0x30e9), seq 942, ack 7996, win 512, options [nop,nop,TS val 365268533 ecr 365268491], length 0
2022-04-06 22:09:46.030670 IP (tos 0x0, ttl 64, id 58254, offset 0, flags [DF], proto TCP (6), length 16984)
    127.0.0.1.10650 > 127.0.0.1.46470: Flags [P.], cksum 0x404d (incorrect -> 0x204a), seq 7996:24928, ack 942, win 512, options [nop,nop,TS val 365268533 ecr 365268533], length 16932
2022-04-06 22:09:46.030677 IP (tos 0x0, ttl 64, id 9167, offset 0, flags [DF], proto TCP (6), length 52)
    127.0.0.1.46470 > 127.0.0.1.10650: Flags [.], cksum 0xfe28 (incorrect -> 0xeee1), seq 942, ack 24928, win 441, options [nop,nop,TS val 365268533 ecr 365268533], length 0
200, 4.149068832397461, 1.1873197555541992