2022-04-06 09:03:18.133406 IP (tos 0x0, ttl 64, id 24644, offset 0, flags [DF], proto TCP (6), length 60)
    127.0.0.1.47158 > 127.0.0.1.9950: Flags [S], cksum 0xfe30 (incorrect -> 0x96a1), seq 3026226297, win 65495, options [mss 65495,sackOK,TS val 318080636 ecr 0,nop,wscale 7], length 0
2022-04-06 09:03:18.133424 IP (tos 0x0, ttl 64, id 0, offset 0, flags [DF], proto TCP (6), length 60)
    127.0.0.1.9950 > 127.0.0.1.47158: Flags [S.], cksum 0xfe30 (incorrect -> 0xe32f), seq 2416871916, ack 3026226298, win 65483, options [mss 65495,sackOK,TS val 318080636 ecr 318080636,nop,wscale 7], length 0
2022-04-06 09:03:18.133438 IP (tos 0x0, ttl 64, id 24645, offset 0, flags [DF], proto TCP (6), length 52)
    127.0.0.1.47158 > 127.0.0.1.9950: Flags [.], cksum 0xfe28 (incorrect -> 0x09ec), seq 1, ack 1, win 512, options [nop,nop,TS val 318080636 ecr 318080636], length 0
2022-04-06 09:03:18.133618 IP (tos 0x0, ttl 64, id 24646, offset 0, flags [DF], proto TCP (6), length 55)
    127.0.0.1.47158 > 127.0.0.1.9950: Flags [P.], cksum 0xfe2b (incorrect -> 0x04e0), seq 1:4, ack 1, win 512, options [nop,nop,TS val 318080636 ecr 318080636], length 3
2022-04-06 09:03:18.133627 IP (tos 0x0, ttl 64, id 2046, offset 0, flags [DF], proto TCP (6), length 52)
    127.0.0.1.9950 > 127.0.0.1.47158: Flags [.], cksum 0xfe28 (incorrect -> 0x09e9), seq 1, ack 4, win 512, options [nop,nop,TS val 318080636 ecr 318080636], length 0
2022-04-06 09:03:18.133663 IP (tos 0x0, ttl 64, id 2047, offset 0, flags [DF], proto TCP (6), length 54)
    127.0.0.1.9950 > 127.0.0.1.47158: Flags [P.], cksum 0xfe2a (incorrect -> 0x04df), seq 1:3, ack 4, win 512, options [nop,nop,TS val 318080636 ecr 318080636], length 2
2022-04-06 09:03:18.133674 IP (tos 0x0, ttl 64, id 24647, offset 0, flags [DF], proto TCP (6), length 52)
    127.0.0.1.47158 > 127.0.0.1.9950: Flags [.], cksum 0xfe28 (incorrect -> 0x09e7), seq 4, ack 3, win 512, options [nop,nop,TS val 318080636 ecr 318080636], length 0
2022-04-06 09:03:18.322555 IP (tos 0x0, ttl 64, id 24648, offset 0, flags [DF], proto TCP (6), length 62)
    127.0.0.1.47158 > 127.0.0.1.9950: Flags [P.], cksum 0xfe32 (incorrect -> 0xfb0b), seq 4:14, ack 3, win 512, options [nop,nop,TS val 318080825 ecr 318080636], length 10
2022-04-06 09:03:18.322582 IP (tos 0x0, ttl 64, id 2048, offset 0, flags [DF], proto TCP (6), length 52)
    127.0.0.1.9950 > 127.0.0.1.47158: Flags [.], cksum 0xfe28 (incorrect -> 0x0863), seq 3, ack 14, win 512, options [nop,nop,TS val 318080825 ecr 318080825], length 0
2022-04-06 09:03:18.378518 IP (tos 0x0, ttl 64, id 2049, offset 0, flags [DF], proto TCP (6), length 62)
    127.0.0.1.9950 > 127.0.0.1.47158: Flags [P.], cksum 0xfe32 (incorrect -> 0x0318), seq 3:13, ack 14, win 512, options [nop,nop,TS val 318080881 ecr 318080825], length 10
2022-04-06 09:03:18.378530 IP (tos 0x0, ttl 64, id 24649, offset 0, flags [DF], proto TCP (6), length 52)
    127.0.0.1.47158 > 127.0.0.1.9950: Flags [.], cksum 0xfe28 (incorrect -> 0x07e9), seq 14, ack 13, win 512, options [nop,nop,TS val 318080881 ecr 318080881], length 0
2022-04-06 09:03:18.384200 IP (tos 0x0, ttl 64, id 24650, offset 0, flags [DF], proto TCP (6), length 569)
    127.0.0.1.47158 > 127.0.0.1.9950: Flags [P.], cksum 0x002e (incorrect -> 0x2877), seq 14:531, ack 13, win 512, options [nop,nop,TS val 318080887 ecr 318080881], length 517
2022-04-06 09:03:18.384211 IP (tos 0x0, ttl 64, id 2050, offset 0, flags [DF], proto TCP (6), length 52)
    127.0.0.1.9950 > 127.0.0.1.47158: Flags [.], cksum 0xfe28 (incorrect -> 0x05dc), seq 13, ack 531, win 508, options [nop,nop,TS val 318080887 ecr 318080887], length 0
2022-04-06 09:03:18.507416 IP (tos 0x0, ttl 64, id 2051, offset 0, flags [DF], proto TCP (6), length 3538)
    127.0.0.1.9950 > 127.0.0.1.47158: Flags [P.], cksum 0x0bc7 (incorrect -> 0xeec8), seq 13:3499, ack 531, win 512, options [nop,nop,TS val 318081010 ecr 318080887], length 3486
2022-04-06 09:03:18.507436 IP (tos 0x0, ttl 64, id 24651, offset 0, flags [DF], proto TCP (6), length 52)
    127.0.0.1.47158 > 127.0.0.1.9950: Flags [.], cksum 0xfe28 (incorrect -> 0xf755), seq 531, ack 3499, win 494, options [nop,nop,TS val 318081010 ecr 318081010], length 0
2022-04-06 09:03:18.521331 IP (tos 0x0, ttl 64, id 2052, offset 0, flags [DF], proto TCP (6), length 150)
    127.0.0.1.9950 > 127.0.0.1.47158: Flags [P.], cksum 0xfe8a (incorrect -> 0x3588), seq 3499:3597, ack 531, win 512, options [nop,nop,TS val 318081024 ecr 318081010], length 98
2022-04-06 09:03:18.521340 IP (tos 0x0, ttl 64, id 24652, offset 0, flags [DF], proto TCP (6), length 52)
    127.0.0.1.47158 > 127.0.0.1.9950: Flags [.], cksum 0xfe28 (incorrect -> 0xf6ca), seq 531, ack 3597, win 507, options [nop,nop,TS val 318081024 ecr 318081024], length 0
2022-04-06 09:03:18.521455 IP (tos 0x0, ttl 64, id 24653, offset 0, flags [DF], proto TCP (6), length 132)
    127.0.0.1.47158 > 127.0.0.1.9950: Flags [P.], cksum 0xfe78 (incorrect -> 0xc266), seq 531:611, ack 3597, win 512, options [nop,nop,TS val 318081024 ecr 318081024], length 80
2022-04-06 09:03:18.521463 IP (tos 0x0, ttl 64, id 2053, offset 0, flags [DF], proto TCP (6), length 52)
    127.0.0.1.9950 > 127.0.0.1.47158: Flags [.], cksum 0xfe28 (incorrect -> 0xf675), seq 3597, ack 611, win 512, options [nop,nop,TS val 318081024 ecr 318081024], length 0
2022-04-06 09:03:18.521988 IP (tos 0x0, ttl 64, id 24654, offset 0, flags [DF], proto TCP (6), length 395)
    127.0.0.1.47158 > 127.0.0.1.9950: Flags [P.], cksum 0xff7f (incorrect -> 0x2421), seq 611:954, ack 3597, win 512, options [nop,nop,TS val 318081024 ecr 318081024], length 343
2022-04-06 09:03:18.521997 IP (tos 0x0, ttl 64, id 2054, offset 0, flags [DF], proto TCP (6), length 52)
    127.0.0.1.9950 > 127.0.0.1.47158: Flags [.], cksum 0xfe28 (incorrect -> 0xf520), seq 3597, ack 954, win 510, options [nop,nop,TS val 318081024 ecr 318081024], length 0
200, 4.411221742630005, 1.7614374160766602