2022-04-06 17:01:52.050579 IP (tos 0x0, ttl 64, id 13782, offset 0, flags [DF], proto TCP (6), length 60)
    127.0.0.1.34182 > 127.0.0.1.11150: Flags [S], cksum 0xfe30 (incorrect -> 0xc70e), seq 2165741539, win 65495, options [mss 65495,sackOK,TS val 346794553 ecr 0,nop,wscale 7], length 0
2022-04-06 17:01:52.050591 IP (tos 0x0, ttl 64, id 0, offset 0, flags [DF], proto TCP (6), length 60)
    127.0.0.1.11150 > 127.0.0.1.34182: Flags [S.], cksum 0xfe30 (incorrect -> 0xd790), seq 3947775301, ack 2165741540, win 65483, options [mss 65495,sackOK,TS val 346794553 ecr 346794553,nop,wscale 7], length 0
2022-04-06 17:01:52.050602 IP (tos 0x0, ttl 64, id 13783, offset 0, flags [DF], proto TCP (6), length 52)
    127.0.0.1.34182 > 127.0.0.1.11150: Flags [.], cksum 0xfe28 (incorrect -> 0xfe4c), seq 1, ack 1, win 512, options [nop,nop,TS val 346794553 ecr 346794553], length 0
2022-04-06 17:01:52.050716 IP (tos 0x0, ttl 64, id 13784, offset 0, flags [DF], proto TCP (6), length 55)
    127.0.0.1.34182 > 127.0.0.1.11150: Flags [P.], cksum 0xfe2b (incorrect -> 0xf940), seq 1:4, ack 1, win 512, options [nop,nop,TS val 346794553 ecr 346794553], length 3
2022-04-06 17:01:52.050732 IP (tos 0x0, ttl 64, id 22243, offset 0, flags [DF], proto TCP (6), length 52)
    127.0.0.1.11150 > 127.0.0.1.34182: Flags [.], cksum 0xfe28 (incorrect -> 0xfe49), seq 1, ack 4, win 512, options [nop,nop,TS val 346794553 ecr 346794553], length 0
2022-04-06 17:01:52.050819 IP (tos 0x0, ttl 64, id 22244, offset 0, flags [DF], proto TCP (6), length 54)
    127.0.0.1.11150 > 127.0.0.1.34182: Flags [P.], cksum 0xfe2a (incorrect -> 0xf93f), seq 1:3, ack 4, win 512, options [nop,nop,TS val 346794553 ecr 346794553], length 2
2022-04-06 17:01:52.050847 IP (tos 0x0, ttl 64, id 13785, offset 0, flags [DF], proto TCP (6), length 52)
    127.0.0.1.34182 > 127.0.0.1.11150: Flags [.], cksum 0xfe28 (incorrect -> 0xfe47), seq 4, ack 3, win 512, options [nop,nop,TS val 346794553 ecr 346794553], length 0
2022-04-06 17:01:52.052657 IP (tos 0x0, ttl 64, id 13786, offset 0, flags [DF], proto TCP (6), length 62)
    127.0.0.1.34182 > 127.0.0.1.11150: Flags [P.], cksum 0xfe32 (incorrect -> 0x95f0), seq 4:14, ack 3, win 512, options [nop,nop,TS val 346794555 ecr 346794553], length 10
2022-04-06 17:01:52.052673 IP (tos 0x0, ttl 64, id 22245, offset 0, flags [DF], proto TCP (6), length 52)
    127.0.0.1.11150 > 127.0.0.1.34182: Flags [.], cksum 0xfe28 (incorrect -> 0xfe39), seq 3, ack 14, win 512, options [nop,nop,TS val 346794555 ecr 346794555], length 0
2022-04-06 17:01:52.100064 IP (tos 0x0, ttl 64, id 22246, offset 0, flags [DF], proto TCP (6), length 62)
    127.0.0.1.11150 > 127.0.0.1.34182: Flags [P.], cksum 0xfe32 (incorrect -> 0xf8f7), seq 3:13, ack 14, win 512, options [nop,nop,TS val 346794602 ecr 346794555], length 10
2022-04-06 17:01:52.100085 IP (tos 0x0, ttl 64, id 13787, offset 0, flags [DF], proto TCP (6), length 52)
    127.0.0.1.34182 > 127.0.0.1.11150: Flags [.], cksum 0xfe28 (incorrect -> 0xfdd0), seq 14, ack 13, win 512, options [nop,nop,TS val 346794603 ecr 346794602], length 0
2022-04-06 17:01:52.105344 IP (tos 0x0, ttl 64, id 13788, offset 0, flags [DF], proto TCP (6), length 569)
    127.0.0.1.34182 > 127.0.0.1.11150: Flags [P.], cksum 0x002e (incorrect -> 0x3a08), seq 14:531, ack 13, win 512, options [nop,nop,TS val 346794608 ecr 346794602], length 517
2022-04-06 17:01:52.105367 IP (tos 0x0, ttl 64, id 22247, offset 0, flags [DF], proto TCP (6), length 52)
    127.0.0.1.11150 > 127.0.0.1.34182: Flags [.], cksum 0xfe28 (incorrect -> 0xfbc4), seq 13, ack 531, win 508, options [nop,nop,TS val 346794608 ecr 346794608], length 0
2022-04-06 17:01:52.147645 IP (tos 0x0, ttl 64, id 22248, offset 0, flags [DF], proto TCP (6), length 1480)
    127.0.0.1.11150 > 127.0.0.1.34182: Flags [P.], cksum 0x03bd (incorrect -> 0x891c), seq 13:1441, ack 531, win 512, options [nop,nop,TS val 346794650 ecr 346794608], length 1428
2022-04-06 17:01:52.147660 IP (tos 0x0, ttl 64, id 13789, offset 0, flags [DF], proto TCP (6), length 52)
    127.0.0.1.34182 > 127.0.0.1.11150: Flags [.], cksum 0xfe28 (incorrect -> 0xf5e2), seq 531, ack 1441, win 502, options [nop,nop,TS val 346794650 ecr 346794650], length 0
2022-04-06 17:01:52.164807 IP (tos 0x0, ttl 64, id 22249, offset 0, flags [DF], proto TCP (6), length 3406)
    127.0.0.1.11150 > 127.0.0.1.34182: Flags [P.], cksum 0x0b43 (incorrect -> 0x2370), seq 1441:4795, ack 531, win 512, options [nop,nop,TS val 346794667 ecr 346794650], length 3354
2022-04-06 17:01:52.164820 IP (tos 0x0, ttl 64, id 13790, offset 0, flags [DF], proto TCP (6), length 52)
    127.0.0.1.34182 > 127.0.0.1.11150: Flags [.], cksum 0xfe28 (incorrect -> 0xe8ae), seq 531, ack 4795, win 494, options [nop,nop,TS val 346794667 ecr 346794667], length 0
2022-04-06 17:01:52.182356 IP (tos 0x0, ttl 64, id 22250, offset 0, flags [DF], proto TCP (6), length 198)
    127.0.0.1.11150 > 127.0.0.1.34182: Flags [P.], cksum 0xfeba (incorrect -> 0x6e58), seq 4795:4941, ack 531, win 512, options [nop,nop,TS val 346794685 ecr 346794667], length 146
2022-04-06 17:01:52.182369 IP (tos 0x0, ttl 64, id 13791, offset 0, flags [DF], proto TCP (6), length 52)
    127.0.0.1.34182 > 127.0.0.1.11150: Flags [.], cksum 0xfe28 (incorrect -> 0xe7eb), seq 531, ack 4941, win 507, options [nop,nop,TS val 346794685 ecr 346794685], length 0
2022-04-06 17:01:52.182482 IP (tos 0x0, ttl 64, id 13792, offset 0, flags [DF], proto TCP (6), length 116)
    127.0.0.1.34182 > 127.0.0.1.11150: Flags [P.], cksum 0xfe68 (incorrect -> 0xa13e), seq 531:595, ack 4941, win 512, options [nop,nop,TS val 346794685 ecr 346794685], length 64
2022-04-06 17:01:52.182497 IP (tos 0x0, ttl 64, id 22251, offset 0, flags [DF], proto TCP (6), length 52)
    127.0.0.1.11150 > 127.0.0.1.34182: Flags [.], cksum 0xfe28 (incorrect -> 0xe7a6), seq 4941, ack 595, win 512, options [nop,nop,TS val 346794685 ecr 346794685], length 0
200, 3.773247480392456, 0.8518574237823486