2022-04-06 23:21:56.953054 IP (tos 0x0, ttl 64, id 55729, offset 0, flags [DF], proto TCP (6), length 60)
    127.0.0.1.35078 > 127.0.0.1.10550: Flags [S], cksum 0xfe30 (incorrect -> 0x0d37), seq 1196986191, win 65495, options [mss 65495,sackOK,TS val 369599455 ecr 0,nop,wscale 7], length 0
2022-04-06 23:21:56.953065 IP (tos 0x0, ttl 64, id 0, offset 0, flags [DF], proto TCP (6), length 60)
    127.0.0.1.10550 > 127.0.0.1.35078: Flags [S.], cksum 0xfe30 (incorrect -> 0x0b50), seq 3072823506, ack 1196986192, win 65483, options [mss 65495,sackOK,TS val 369599456 ecr 369599455,nop,wscale 7], length 0
2022-04-06 23:21:56.953074 IP (tos 0x0, ttl 64, id 55730, offset 0, flags [DF], proto TCP (6), length 52)
    127.0.0.1.35078 > 127.0.0.1.10550: Flags [.], cksum 0xfe28 (incorrect -> 0x320b), seq 1, ack 1, win 512, options [nop,nop,TS val 369599456 ecr 369599456], length 0
2022-04-06 23:21:56.953178 IP (tos 0x0, ttl 64, id 55731, offset 0, flags [DF], proto TCP (6), length 55)
    127.0.0.1.35078 > 127.0.0.1.10550: Flags [P.], cksum 0xfe2b (incorrect -> 0x2cff), seq 1:4, ack 1, win 512, options [nop,nop,TS val 369599456 ecr 369599456], length 3
2022-04-06 23:21:56.953194 IP (tos 0x0, ttl 64, id 8594, offset 0, flags [DF], proto TCP (6), length 52)
    127.0.0.1.10550 > 127.0.0.1.35078: Flags [.], cksum 0xfe28 (incorrect -> 0x3208), seq 1, ack 4, win 512, options [nop,nop,TS val 369599456 ecr 369599456], length 0
2022-04-06 23:21:56.953257 IP (tos 0x0, ttl 64, id 8595, offset 0, flags [DF], proto TCP (6), length 54)
    127.0.0.1.10550 > 127.0.0.1.35078: Flags [P.], cksum 0xfe2a (incorrect -> 0x2cfe), seq 1:3, ack 4, win 512, options [nop,nop,TS val 369599456 ecr 369599456], length 2
2022-04-06 23:21:56.953275 IP (tos 0x0, ttl 64, id 55732, offset 0, flags [DF], proto TCP (6), length 52)
    127.0.0.1.35078 > 127.0.0.1.10550: Flags [.], cksum 0xfe28 (incorrect -> 0x3206), seq 4, ack 3, win 512, options [nop,nop,TS val 369599456 ecr 369599456], length 0
2022-04-06 23:21:56.965268 IP (tos 0x0, ttl 64, id 55733, offset 0, flags [DF], proto TCP (6), length 62)
    127.0.0.1.35078 > 127.0.0.1.10550: Flags [P.], cksum 0xfe32 (incorrect -> 0xaf6f), seq 4:14, ack 3, win 512, options [nop,nop,TS val 369599468 ecr 369599456], length 10
2022-04-06 23:21:56.965289 IP (tos 0x0, ttl 64, id 8596, offset 0, flags [DF], proto TCP (6), length 52)
    127.0.0.1.10550 > 127.0.0.1.35078: Flags [.], cksum 0xfe28 (incorrect -> 0x31e4), seq 3, ack 14, win 512, options [nop,nop,TS val 369599468 ecr 369599468], length 0
2022-04-06 23:21:57.051366 IP (tos 0x0, ttl 64, id 8597, offset 0, flags [DF], proto TCP (6), length 62)
    127.0.0.1.10550 > 127.0.0.1.35078: Flags [P.], cksum 0xfe32 (incorrect -> 0x2c7b), seq 3:13, ack 14, win 512, options [nop,nop,TS val 369599554 ecr 369599468], length 10
2022-04-06 23:21:57.051377 IP (tos 0x0, ttl 64, id 55734, offset 0, flags [DF], proto TCP (6), length 52)
    127.0.0.1.35078 > 127.0.0.1.10550: Flags [.], cksum 0xfe28 (incorrect -> 0x312e), seq 14, ack 13, win 512, options [nop,nop,TS val 369599554 ecr 369599554], length 0
2022-04-06 23:21:57.057527 IP (tos 0x0, ttl 64, id 55735, offset 0, flags [DF], proto TCP (6), length 569)
    127.0.0.1.35078 > 127.0.0.1.10550: Flags [P.], cksum 0x002e (incorrect -> 0x4d40), seq 14:531, ack 13, win 512, options [nop,nop,TS val 369599560 ecr 369599554], length 517
2022-04-06 23:21:57.057538 IP (tos 0x0, ttl 64, id 8598, offset 0, flags [DF], proto TCP (6), length 52)
    127.0.0.1.10550 > 127.0.0.1.35078: Flags [.], cksum 0xfe28 (incorrect -> 0x2f21), seq 13, ack 531, win 508, options [nop,nop,TS val 369599560 ecr 369599560], length 0
200, 4.792219400405884, 0.7326347827911377