2022-04-06 16:24:48.240158 IP (tos 0x0, ttl 64, id 52147, offset 0, flags [DF], proto TCP (6), length 60)
    127.0.0.1.57320 > 127.0.0.1.11450: Flags [S], cksum 0xfe30 (incorrect -> 0x4f35), seq 667548767, win 65495, options [mss 65495,sackOK,TS val 344570743 ecr 0,nop,wscale 7], length 0
2022-04-06 16:24:48.240168 IP (tos 0x0, ttl 64, id 0, offset 0, flags [DF], proto TCP (6), length 60)
    127.0.0.1.11450 > 127.0.0.1.57320: Flags [S.], cksum 0xfe30 (incorrect -> 0xaaed), seq 3931892197, ack 667548768, win 65483, options [mss 65495,sackOK,TS val 344570743 ecr 344570743,nop,wscale 7], length 0
2022-04-06 16:24:48.240177 IP (tos 0x0, ttl 64, id 52148, offset 0, flags [DF], proto TCP (6), length 52)
    127.0.0.1.57320 > 127.0.0.1.11450: Flags [.], cksum 0xfe28 (incorrect -> 0xd1a9), seq 1, ack 1, win 512, options [nop,nop,TS val 344570743 ecr 344570743], length 0
2022-04-06 16:24:48.240268 IP (tos 0x0, ttl 64, id 52149, offset 0, flags [DF], proto TCP (6), length 55)
    127.0.0.1.57320 > 127.0.0.1.11450: Flags [P.], cksum 0xfe2b (incorrect -> 0xcc9d), seq 1:4, ack 1, win 512, options [nop,nop,TS val 344570743 ecr 344570743], length 3
2022-04-06 16:24:48.240282 IP (tos 0x0, ttl 64, id 2333, offset 0, flags [DF], proto TCP (6), length 52)
    127.0.0.1.11450 > 127.0.0.1.57320: Flags [.], cksum 0xfe28 (incorrect -> 0xd1a6), seq 1, ack 4, win 512, options [nop,nop,TS val 344570743 ecr 344570743], length 0
2022-04-06 16:24:48.240336 IP (tos 0x0, ttl 64, id 2334, offset 0, flags [DF], proto TCP (6), length 54)
    127.0.0.1.11450 > 127.0.0.1.57320: Flags [P.], cksum 0xfe2a (incorrect -> 0xcc9c), seq 1:3, ack 4, win 512, options [nop,nop,TS val 344570743 ecr 344570743], length 2
2022-04-06 16:24:48.240354 IP (tos 0x0, ttl 64, id 52150, offset 0, flags [DF], proto TCP (6), length 52)
    127.0.0.1.57320 > 127.0.0.1.11450: Flags [.], cksum 0xfe28 (incorrect -> 0xd1a4), seq 4, ack 3, win 512, options [nop,nop,TS val 344570743 ecr 344570743], length 0
2022-04-06 16:24:48.242166 IP (tos 0x0, ttl 64, id 52151, offset 0, flags [DF], proto TCP (6), length 62)
    127.0.0.1.57320 > 127.0.0.1.11450: Flags [P.], cksum 0xfe32 (incorrect -> 0x822a), seq 4:14, ack 3, win 512, options [nop,nop,TS val 344570745 ecr 344570743], length 10
2022-04-06 16:24:48.242186 IP (tos 0x0, ttl 64, id 2335, offset 0, flags [DF], proto TCP (6), length 52)
    127.0.0.1.11450 > 127.0.0.1.57320: Flags [.], cksum 0xfe28 (incorrect -> 0xd196), seq 3, ack 14, win 512, options [nop,nop,TS val 344570745 ecr 344570745], length 0
2022-04-06 16:24:48.311232 IP (tos 0x0, ttl 64, id 2336, offset 0, flags [DF], proto TCP (6), length 62)
    127.0.0.1.11450 > 127.0.0.1.57320: Flags [P.], cksum 0xfe32 (incorrect -> 0xcc3e), seq 3:13, ack 14, win 512, options [nop,nop,TS val 344570814 ecr 344570745], length 10
2022-04-06 16:24:48.311243 IP (tos 0x0, ttl 64, id 52152, offset 0, flags [DF], proto TCP (6), length 52)
    127.0.0.1.57320 > 127.0.0.1.11450: Flags [.], cksum 0xfe28 (incorrect -> 0xd102), seq 14, ack 13, win 512, options [nop,nop,TS val 344570814 ecr 344570814], length 0
2022-04-06 16:24:48.316880 IP (tos 0x0, ttl 64, id 52153, offset 0, flags [DF], proto TCP (6), length 569)
    127.0.0.1.57320 > 127.0.0.1.11450: Flags [P.], cksum 0x002e (incorrect -> 0x7a6b), seq 14:531, ack 13, win 512, options [nop,nop,TS val 344570819 ecr 344570814], length 517
2022-04-06 16:24:48.316890 IP (tos 0x0, ttl 64, id 2337, offset 0, flags [DF], proto TCP (6), length 52)
    127.0.0.1.11450 > 127.0.0.1.57320: Flags [.], cksum 0xfe28 (incorrect -> 0xcef7), seq 13, ack 531, win 508, options [nop,nop,TS val 344570819 ecr 344570819], length 0
200, 5.618318796157837, 0.7118692398071289