2022-04-06 13:43:56.351265 IP (tos 0x0, ttl 64, id 55615, offset 0, flags [DF], proto TCP (6), length 60)
    127.0.0.1.40636 > 127.0.0.1.10250: Flags [S], cksum 0xfe30 (incorrect -> 0x4a37), seq 3366317473, win 65495, options [mss 65495,sackOK,TS val 334918854 ecr 0,nop,wscale 7], length 0
2022-04-06 13:43:56.351277 IP (tos 0x0, ttl 64, id 0, offset 0, flags [DF], proto TCP (6), length 60)
    127.0.0.1.10250 > 127.0.0.1.40636: Flags [S.], cksum 0xfe30 (incorrect -> 0x6995), seq 1724313881, ack 3366317474, win 65483, options [mss 65495,sackOK,TS val 334918854 ecr 334918854,nop,wscale 7], length 0
2022-04-06 13:43:56.351288 IP (tos 0x0, ttl 64, id 55616, offset 0, flags [DF], proto TCP (6), length 52)
    127.0.0.1.40636 > 127.0.0.1.10250: Flags [.], cksum 0xfe28 (incorrect -> 0x9051), seq 1, ack 1, win 512, options [nop,nop,TS val 334918854 ecr 334918854], length 0
2022-04-06 13:43:56.351442 IP (tos 0x0, ttl 64, id 55617, offset 0, flags [DF], proto TCP (6), length 55)
    127.0.0.1.40636 > 127.0.0.1.10250: Flags [P.], cksum 0xfe2b (incorrect -> 0x8b45), seq 1:4, ack 1, win 512, options [nop,nop,TS val 334918854 ecr 334918854], length 3
2022-04-06 13:43:56.351451 IP (tos 0x0, ttl 64, id 18367, offset 0, flags [DF], proto TCP (6), length 52)
    127.0.0.1.10250 > 127.0.0.1.40636: Flags [.], cksum 0xfe28 (incorrect -> 0x904e), seq 1, ack 4, win 512, options [nop,nop,TS val 334918854 ecr 334918854], length 0
2022-04-06 13:43:56.351475 IP (tos 0x0, ttl 64, id 18368, offset 0, flags [DF], proto TCP (6), length 54)
    127.0.0.1.10250 > 127.0.0.1.40636: Flags [P.], cksum 0xfe2a (incorrect -> 0x8b44), seq 1:3, ack 4, win 512, options [nop,nop,TS val 334918854 ecr 334918854], length 2
2022-04-06 13:43:56.351484 IP (tos 0x0, ttl 64, id 55618, offset 0, flags [DF], proto TCP (6), length 52)
    127.0.0.1.40636 > 127.0.0.1.10250: Flags [.], cksum 0xfe28 (incorrect -> 0x904c), seq 4, ack 3, win 512, options [nop,nop,TS val 334918854 ecr 334918854], length 0
2022-04-06 13:43:56.372415 IP (tos 0x0, ttl 64, id 55619, offset 0, flags [DF], proto TCP (6), length 62)
    127.0.0.1.40636 > 127.0.0.1.10250: Flags [P.], cksum 0xfe32 (incorrect -> 0x4e9b), seq 4:14, ack 3, win 512, options [nop,nop,TS val 334918875 ecr 334918854], length 10
2022-04-06 13:43:56.372430 IP (tos 0x0, ttl 64, id 18369, offset 0, flags [DF], proto TCP (6), length 52)
    127.0.0.1.10250 > 127.0.0.1.40636: Flags [.], cksum 0xfe28 (incorrect -> 0x9018), seq 3, ack 14, win 512, options [nop,nop,TS val 334918875 ecr 334918875], length 0
2022-04-06 13:43:56.465712 IP (tos 0x0, ttl 64, id 18370, offset 0, flags [DF], proto TCP (6), length 62)
    127.0.0.1.10250 > 127.0.0.1.40636: Flags [P.], cksum 0xfe32 (incorrect -> 0x8aa8), seq 3:13, ack 14, win 512, options [nop,nop,TS val 334918968 ecr 334918875], length 10
2022-04-06 13:43:56.465725 IP (tos 0x0, ttl 64, id 55620, offset 0, flags [DF], proto TCP (6), length 52)
    127.0.0.1.40636 > 127.0.0.1.10250: Flags [.], cksum 0xfe28 (incorrect -> 0x8f54), seq 14, ack 13, win 512, options [nop,nop,TS val 334918968 ecr 334918968], length 0
2022-04-06 13:43:56.471312 IP (tos 0x0, ttl 64, id 55621, offset 0, flags [DF], proto TCP (6), length 569)
    127.0.0.1.40636 > 127.0.0.1.10250: Flags [P.], cksum 0x002e (incorrect -> 0x1900), seq 14:531, ack 13, win 512, options [nop,nop,TS val 334918974 ecr 334918968], length 517
2022-04-06 13:43:56.471322 IP (tos 0x0, ttl 64, id 18371, offset 0, flags [DF], proto TCP (6), length 52)
    127.0.0.1.10250 > 127.0.0.1.40636: Flags [.], cksum 0xfe28 (incorrect -> 0x8d47), seq 13, ack 531, win 508, options [nop,nop,TS val 334918974 ecr 334918974], length 0
2022-04-06 13:43:56.561942 IP (tos 0x0, ttl 64, id 18372, offset 0, flags [DF], proto TCP (6), length 1500)
    127.0.0.1.10250 > 127.0.0.1.40636: Flags [P.], cksum 0x03d1 (incorrect -> 0x7272), seq 13:1461, ack 531, win 512, options [nop,nop,TS val 334919064 ecr 334918974], length 1448
2022-04-06 13:43:56.561956 IP (tos 0x0, ttl 64, id 55622, offset 0, flags [DF], proto TCP (6), length 52)
    127.0.0.1.40636 > 127.0.0.1.10250: Flags [.], cksum 0xfe28 (incorrect -> 0x86f1), seq 531, ack 1461, win 502, options [nop,nop,TS val 334919064 ecr 334919064], length 0
2022-04-06 13:43:56.600804 IP (tos 0x0, ttl 64, id 18373, offset 0, flags [DF], proto TCP (6), length 2699)
    127.0.0.1.10250 > 127.0.0.1.40636: Flags [P.], cksum 0x0880 (incorrect -> 0xa2c8), seq 1461:4108, ack 531, win 512, options [nop,nop,TS val 334919103 ecr 334919064], length 2647
2022-04-06 13:43:56.600814 IP (tos 0x0, ttl 64, id 55623, offset 0, flags [DF], proto TCP (6), length 52)
    127.0.0.1.40636 > 127.0.0.1.10250: Flags [.], cksum 0xfe28 (incorrect -> 0x7c51), seq 531, ack 4108, win 497, options [nop,nop,TS val 334919103 ecr 334919103], length 0
2022-04-06 13:43:56.601321 IP (tos 0x0, ttl 64, id 55624, offset 0, flags [DF], proto TCP (6), length 132)
    127.0.0.1.40636 > 127.0.0.1.10250: Flags [P.], cksum 0xfe78 (incorrect -> 0x32b7), seq 531:611, ack 4108, win 512, options [nop,nop,TS val 334919104 ecr 334919103], length 80
2022-04-06 13:43:56.601330 IP (tos 0x0, ttl 64, id 18374, offset 0, flags [DF], proto TCP (6), length 52)
    127.0.0.1.10250 > 127.0.0.1.40636: Flags [.], cksum 0xfe28 (incorrect -> 0x7bf0), seq 4108, ack 611, win 512, options [nop,nop,TS val 334919104 ecr 334919104], length 0
2022-04-06 13:43:56.601802 IP (tos 0x0, ttl 64, id 55625, offset 0, flags [DF], proto TCP (6), length 350)
    127.0.0.1.40636 > 127.0.0.1.10250: Flags [P.], cksum 0xff52 (incorrect -> 0x45c3), seq 611:909, ack 4108, win 512, options [nop,nop,TS val 334919104 ecr 334919104], length 298
2022-04-06 13:43:56.601812 IP (tos 0x0, ttl 64, id 18375, offset 0, flags [DF], proto TCP (6), length 52)
    127.0.0.1.10250 > 127.0.0.1.40636: Flags [.], cksum 0xfe28 (incorrect -> 0x7ac8), seq 4108, ack 909, win 510, options [nop,nop,TS val 334919104 ecr 334919104], length 0
2022-04-06 13:43:56.694974 IP (tos 0x0, ttl 64, id 18376, offset 0, flags [DF], proto TCP (6), length 323)
    127.0.0.1.10250 > 127.0.0.1.40636: Flags [P.], cksum 0xff37 (incorrect -> 0xecb4), seq 4108:4379, ack 909, win 512, options [nop,nop,TS val 334919197 ecr 334919104], length 271
2022-04-06 13:43:56.694984 IP (tos 0x0, ttl 64, id 55626, offset 0, flags [DF], proto TCP (6), length 52)
    127.0.0.1.40636 > 127.0.0.1.10250: Flags [.], cksum 0xfe28 (incorrect -> 0x78ff), seq 909, ack 4379, win 510, options [nop,nop,TS val 334919197 ecr 334919197], length 0
2022-04-06 13:43:56.766466 IP (tos 0x0, ttl 64, id 18377, offset 0, flags [DF], proto TCP (6), length 323)
    127.0.0.1.10250 > 127.0.0.1.40636: Flags [P.], cksum 0xff37 (incorrect -> 0xca3c), seq 4379:4650, ack 909, win 512, options [nop,nop,TS val 334919269 ecr 334919197], length 271
2022-04-06 13:43:56.766475 IP (tos 0x0, ttl 64, id 55627, offset 0, flags [DF], proto TCP (6), length 52)
    127.0.0.1.40636 > 127.0.0.1.10250: Flags [.], cksum 0xfe28 (incorrect -> 0x7762), seq 909, ack 4650, win 508, options [nop,nop,TS val 334919269 ecr 334919269], length 0
2022-04-06 13:43:56.797605 IP (tos 0x0, ttl 64, id 18378, offset 0, flags [DF], proto TCP (6), length 1366)
    127.0.0.1.10250 > 127.0.0.1.40636: Flags [P.], cksum 0x034b (incorrect -> 0x25bc), seq 4650:5964, ack 909, win 512, options [nop,nop,TS val 334919300 ecr 334919269], length 1314
2022-04-06 13:43:56.797615 IP (tos 0x0, ttl 64, id 55628, offset 0, flags [DF], proto TCP (6), length 52)
    127.0.0.1.40636 > 127.0.0.1.10250: Flags [.], cksum 0xfe28 (incorrect -> 0x7208), seq 909, ack 5964, win 502, options [nop,nop,TS val 334919300 ecr 334919300], length 0
2022-04-06 13:43:56.800423 IP (tos 0x0, ttl 64, id 47047, offset 0, flags [DF], proto TCP (6), length 60)
    127.0.0.1.40638 > 127.0.0.1.10250: Flags [S], cksum 0xfe30 (incorrect -> 0x29d8), seq 2821860529, win 65495, options [mss 65495,sackOK,TS val 334919303 ecr 0,nop,wscale 7], length 0
2022-04-06 13:43:56.800441 IP (tos 0x0, ttl 64, id 0, offset 0, flags [DF], proto TCP (6), length 60)
    127.0.0.1.10250 > 127.0.0.1.40638: Flags [S.], cksum 0xfe30 (incorrect -> 0xa168), seq 4021620279, ack 2821860530, win 65483, options [mss 65495,sackOK,TS val 334919303 ecr 334919303,nop,wscale 7], length 0
2022-04-06 13:43:56.800451 IP (tos 0x0, ttl 64, id 47048, offset 0, flags [DF], proto TCP (6), length 52)
    127.0.0.1.40638 > 127.0.0.1.10250: Flags [.], cksum 0xfe28 (incorrect -> 0xc824), seq 1, ack 1, win 512, options [nop,nop,TS val 334919303 ecr 334919303], length 0
2022-04-06 13:43:56.800806 IP (tos 0x0, ttl 64, id 47049, offset 0, flags [DF], proto TCP (6), length 55)
    127.0.0.1.40638 > 127.0.0.1.10250: Flags [P.], cksum 0xfe2b (incorrect -> 0xc318), seq 1:4, ack 1, win 512, options [nop,nop,TS val 334919303 ecr 334919303], length 3
2022-04-06 13:43:56.800816 IP (tos 0x0, ttl 64, id 23399, offset 0, flags [DF], proto TCP (6), length 52)
    127.0.0.1.10250 > 127.0.0.1.40638: Flags [.], cksum 0xfe28 (incorrect -> 0xc821), seq 1, ack 4, win 512, options [nop,nop,TS val 334919303 ecr 334919303], length 0
2022-04-06 13:43:56.800840 IP (tos 0x0, ttl 64, id 23400, offset 0, flags [DF], proto TCP (6), length 54)
    127.0.0.1.10250 > 127.0.0.1.40638: Flags [P.], cksum 0xfe2a (incorrect -> 0xc317), seq 1:3, ack 4, win 512, options [nop,nop,TS val 334919303 ecr 334919303], length 2
2022-04-06 13:43:56.800849 IP (tos 0x0, ttl 64, id 47050, offset 0, flags [DF], proto TCP (6), length 52)
    127.0.0.1.40638 > 127.0.0.1.10250: Flags [.], cksum 0xfe28 (incorrect -> 0xc81f), seq 4, ack 3, win 512, options [nop,nop,TS val 334919303 ecr 334919303], length 0
2022-04-06 13:43:56.812816 IP (tos 0x0, ttl 64, id 47051, offset 0, flags [DF], proto TCP (6), length 62)
    127.0.0.1.40638 > 127.0.0.1.10250: Flags [P.], cksum 0xfe32 (incorrect -> 0x8677), seq 4:14, ack 3, win 512, options [nop,nop,TS val 334919315 ecr 334919303], length 10
2022-04-06 13:43:56.812840 IP (tos 0x0, ttl 64, id 23401, offset 0, flags [DF], proto TCP (6), length 52)
    127.0.0.1.10250 > 127.0.0.1.40638: Flags [.], cksum 0xfe28 (incorrect -> 0xc7fd), seq 3, ack 14, win 512, options [nop,nop,TS val 334919315 ecr 334919315], length 0
2022-04-06 13:43:56.906100 IP (tos 0x0, ttl 64, id 23402, offset 0, flags [DF], proto TCP (6), length 62)
    127.0.0.1.10250 > 127.0.0.1.40638: Flags [P.], cksum 0xfe32 (incorrect -> 0xc28c), seq 3:13, ack 14, win 512, options [nop,nop,TS val 334919409 ecr 334919315], length 10
2022-04-06 13:43:56.906117 IP (tos 0x0, ttl 64, id 47052, offset 0, flags [DF], proto TCP (6), length 52)
    127.0.0.1.40638 > 127.0.0.1.10250: Flags [.], cksum 0xfe28 (incorrect -> 0xc737), seq 14, ack 13, win 512, options [nop,nop,TS val 334919409 ecr 334919409], length 0
2022-04-06 13:43:56.915984 IP (tos 0x0, ttl 64, id 47053, offset 0, flags [DF], proto TCP (6), length 569)
    127.0.0.1.40638 > 127.0.0.1.10250: Flags [P.], cksum 0x002e (incorrect -> 0x130b), seq 14:531, ack 13, win 512, options [nop,nop,TS val 334919418 ecr 334919409], length 517
2022-04-06 13:43:56.916005 IP (tos 0x0, ttl 64, id 23403, offset 0, flags [DF], proto TCP (6), length 52)
    127.0.0.1.10250 > 127.0.0.1.40638: Flags [.], cksum 0xfe28 (incorrect -> 0xc524), seq 13, ack 531, win 508, options [nop,nop,TS val 334919418 ecr 334919418], length 0
2022-04-06 13:43:57.048864 IP (tos 0x0, ttl 64, id 23404, offset 0, flags [DF], proto TCP (6), length 3538)
    127.0.0.1.10250 > 127.0.0.1.40638: Flags [P.], cksum 0x0bc7 (incorrect -> 0x69da), seq 13:3499, ack 531, win 512, options [nop,nop,TS val 334919551 ecr 334919418], length 3486
2022-04-06 13:43:57.048879 IP (tos 0x0, ttl 64, id 47054, offset 0, flags [DF], proto TCP (6), length 52)
    127.0.0.1.40638 > 127.0.0.1.10250: Flags [.], cksum 0xfe28 (incorrect -> 0xb68a), seq 531, ack 3499, win 494, options [nop,nop,TS val 334919551 ecr 334919551], length 0
2022-04-06 13:43:57.083000 IP (tos 0x0, ttl 64, id 23405, offset 0, flags [DF], proto TCP (6), length 662)
    127.0.0.1.10250 > 127.0.0.1.40638: Flags [P.], cksum 0x008b (incorrect -> 0x8db5), seq 3499:4109, ack 531, win 512, options [nop,nop,TS val 334919585 ecr 334919551], length 610
2022-04-06 13:43:57.083009 IP (tos 0x0, ttl 64, id 47055, offset 0, flags [DF], proto TCP (6), length 52)
    127.0.0.1.40638 > 127.0.0.1.10250: Flags [.], cksum 0xfe28 (incorrect -> 0xb3d9), seq 531, ack 4109, win 505, options [nop,nop,TS val 334919585 ecr 334919585], length 0
2022-04-06 13:43:57.083539 IP (tos 0x0, ttl 64, id 47056, offset 0, flags [DF], proto TCP (6), length 132)
    127.0.0.1.40638 > 127.0.0.1.10250: Flags [P.], cksum 0xfe78 (incorrect -> 0xba34), seq 531:611, ack 4109, win 512, options [nop,nop,TS val 334919586 ecr 334919585], length 80
2022-04-06 13:43:57.083549 IP (tos 0x0, ttl 64, id 23406, offset 0, flags [DF], proto TCP (6), length 52)
    127.0.0.1.10250 > 127.0.0.1.40638: Flags [.], cksum 0xfe28 (incorrect -> 0xb380), seq 4109, ack 611, win 512, options [nop,nop,TS val 334919586 ecr 334919586], length 0
2022-04-06 13:43:57.084005 IP (tos 0x0, ttl 64, id 47057, offset 0, flags [DF], proto TCP (6), length 1291)
    127.0.0.1.40638 > 127.0.0.1.10250: Flags [P.], cksum 0x0300 (incorrect -> 0x36aa), seq 611:1850, ack 4109, win 512, options [nop,nop,TS val 334919586 ecr 334919586], length 1239
2022-04-06 13:43:57.084014 IP (tos 0x0, ttl 64, id 23407, offset 0, flags [DF], proto TCP (6), length 52)
    127.0.0.1.10250 > 127.0.0.1.40638: Flags [.], cksum 0xfe28 (incorrect -> 0xaeb2), seq 4109, ack 1850, win 503, options [nop,nop,TS val 334919586 ecr 334919586], length 0
2022-04-06 13:43:57.198312 IP (tos 0x0, ttl 64, id 23408, offset 0, flags [DF], proto TCP (6), length 594)
    127.0.0.1.10250 > 127.0.0.1.40638: Flags [P.], cksum 0x0047 (incorrect -> 0x305d), seq 4109:4651, ack 1850, win 512, options [nop,nop,TS val 334919701 ecr 334919586], length 542
2022-04-06 13:43:57.198322 IP (tos 0x0, ttl 64, id 47058, offset 0, flags [DF], proto TCP (6), length 52)
    127.0.0.1.40638 > 127.0.0.1.10250: Flags [.], cksum 0xfe28 (incorrect -> 0xaba9), seq 1850, ack 4651, win 508, options [nop,nop,TS val 334919701 ecr 334919701], length 0
2022-04-06 13:43:57.259598 IP (tos 0x0, ttl 64, id 23409, offset 0, flags [DF], proto TCP (6), length 1500)
    127.0.0.1.10250 > 127.0.0.1.40638: Flags [P.], cksum 0x03d1 (incorrect -> 0x46dd), seq 4651:6099, ack 1850, win 512, options [nop,nop,TS val 334919762 ecr 334919701], length 1448
2022-04-06 13:43:57.259606 IP (tos 0x0, ttl 64, id 47059, offset 0, flags [DF], proto TCP (6), length 52)
    127.0.0.1.40638 > 127.0.0.1.10250: Flags [.], cksum 0xfe28 (incorrect -> 0xa58d), seq 1850, ack 6099, win 502, options [nop,nop,TS val 334919762 ecr 334919762], length 0
2022-04-06 13:43:57.272226 IP (tos 0x0, ttl 64, id 23410, offset 0, flags [DF], proto TCP (6), length 3538)
    127.0.0.1.10250 > 127.0.0.1.40638: Flags [P.], cksum 0x0bc7 (incorrect -> 0x866d), seq 6099:9585, ack 1850, win 512, options [nop,nop,TS val 334919775 ecr 334919762], length 3486
2022-04-06 13:43:57.272235 IP (tos 0x0, ttl 64, id 47060, offset 0, flags [DF], proto TCP (6), length 52)
    127.0.0.1.40638 > 127.0.0.1.10250: Flags [.], cksum 0xfe28 (incorrect -> 0x97dd), seq 1850, ack 9585, win 494, options [nop,nop,TS val 334919775 ecr 334919775], length 0
2022-04-06 13:43:57.289772 IP (tos 0x0, ttl 64, id 23411, offset 0, flags [DF], proto TCP (6), length 917)
    127.0.0.1.10250 > 127.0.0.1.40638: Flags [P.], cksum 0x018a (incorrect -> 0xd313), seq 9585:10450, ack 1850, win 512, options [nop,nop,TS val 334919792 ecr 334919775], length 865
2022-04-06 13:43:57.289781 IP (tos 0x0, ttl 64, id 47061, offset 0, flags [DF], proto TCP (6), length 52)
    127.0.0.1.40638 > 127.0.0.1.10250: Flags [.], cksum 0xfe28 (incorrect -> 0x9450), seq 1850, ack 10450, win 504, options [nop,nop,TS val 334919792 ecr 334919792], length 0
2022-04-06 13:43:57.298947 IP (tos 0x0, ttl 64, id 23412, offset 0, flags [DF], proto TCP (6), length 3079)
    127.0.0.1.10250 > 127.0.0.1.40638: Flags [P.], cksum 0x09fc (incorrect -> 0xa50d), seq 10450:13477, ack 1850, win 512, options [nop,nop,TS val 334919801 ecr 334919792], length 3027
2022-04-06 13:43:57.298963 IP (tos 0x0, ttl 64, id 47062, offset 0, flags [DF], proto TCP (6), length 52)
    127.0.0.1.40638 > 127.0.0.1.10250: Flags [.], cksum 0xfe28 (incorrect -> 0x8873), seq 1850, ack 13477, win 496, options [nop,nop,TS val 334919801 ecr 334919801], length 0
2022-04-06 13:43:57.302427 IP (tos 0x0, ttl 64, id 23413, offset 0, flags [DF], proto TCP (6), length 4100)
    127.0.0.1.10250 > 127.0.0.1.40638: Flags [P.], cksum 0x0df9 (incorrect -> 0x1877), seq 13477:17525, ack 1850, win 512, options [nop,nop,TS val 334919805 ecr 334919801], length 4048
2022-04-06 13:43:57.302434 IP (tos 0x0, ttl 64, id 47063, offset 0, flags [DF], proto TCP (6), length 52)
    127.0.0.1.40638 > 127.0.0.1.10250: Flags [.], cksum 0xfe28 (incorrect -> 0x789f), seq 1850, ack 17525, win 492, options [nop,nop,TS val 334919805 ecr 334919805], length 0
2022-04-06 13:43:57.302441 IP (tos 0x0, ttl 64, id 23414, offset 0, flags [DF], proto TCP (6), length 150)
    127.0.0.1.10250 > 127.0.0.1.40638: Flags [P.], cksum 0xfe8a (incorrect -> 0xa41b), seq 17525:17623, ack 1850, win 512, options [nop,nop,TS val 334919805 ecr 334919805], length 98
2022-04-06 13:43:57.302446 IP (tos 0x0, ttl 64, id 47064, offset 0, flags [DF], proto TCP (6), length 52)
    127.0.0.1.40638 > 127.0.0.1.10250: Flags [.], cksum 0xfe28 (incorrect -> 0x783d), seq 1850, ack 17623, win 492, options [nop,nop,TS val 334919805 ecr 334919805], length 0
2022-04-06 13:43:57.315001 IP (tos 0x0, ttl 64, id 23415, offset 0, flags [DF], proto TCP (6), length 708)
    127.0.0.1.10250 > 127.0.0.1.40638: Flags [P.], cksum 0x00b9 (incorrect -> 0xab40), seq 17623:18279, ack 1850, win 512, options [nop,nop,TS val 334919817 ecr 334919805], length 656
2022-04-06 13:43:57.315009 IP (tos 0x0, ttl 64, id 47065, offset 0, flags [DF], proto TCP (6), length 52)
    127.0.0.1.40638 > 127.0.0.1.10250: Flags [.], cksum 0xfe28 (incorrect -> 0x7588), seq 1850, ack 18279, win 505, options [nop,nop,TS val 334919817 ecr 334919817], length 0
2022-04-06 13:43:57.316287 IP (tos 0x0, ttl 64, id 23416, offset 0, flags [DF], proto TCP (6), length 3052)
    127.0.0.1.10250 > 127.0.0.1.40638: Flags [P.], cksum 0x09e1 (incorrect -> 0x4a5d), seq 18279:21279, ack 1850, win 512, options [nop,nop,TS val 334919819 ecr 334919817], length 3000
2022-04-06 13:43:57.316307 IP (tos 0x0, ttl 64, id 47066, offset 0, flags [DF], proto TCP (6), length 52)
    127.0.0.1.40638 > 127.0.0.1.10250: Flags [.], cksum 0xfe28 (incorrect -> 0x69c5), seq 1850, ack 21279, win 512, options [nop,nop,TS val 334919819 ecr 334919819], length 0
2022-04-06 13:43:57.328934 IP (tos 0x0, ttl 64, id 23417, offset 0, flags [DF], proto TCP (6), length 2982)
    127.0.0.1.10250 > 127.0.0.1.40638: Flags [P.], cksum 0x099b (incorrect -> 0xfabc), seq 21279:24209, ack 1850, win 512, options [nop,nop,TS val 334919831 ecr 334919819], length 2930
2022-04-06 13:43:57.329111 IP (tos 0x0, ttl 64, id 47067, offset 0, flags [DF], proto TCP (6), length 52)
    127.0.0.1.40638 > 127.0.0.1.10250: Flags [.], cksum 0xfe28 (incorrect -> 0x5e3a), seq 1850, ack 24209, win 512, options [nop,nop,TS val 334919832 ecr 334919831], length 0
2022-04-06 13:43:57.339140 IP (tos 0x0, ttl 64, id 23418, offset 0, flags [DF], proto TCP (6), length 4100)
    127.0.0.1.10250 > 127.0.0.1.40638: Flags [P.], cksum 0x0df9 (incorrect -> 0x52bb), seq 24209:28257, ack 1850, win 512, options [nop,nop,TS val 334919842 ecr 334919832], length 4048
2022-04-06 13:43:57.382671 IP (tos 0x0, ttl 64, id 47068, offset 0, flags [DF], proto TCP (6), length 52)
    127.0.0.1.40638 > 127.0.0.1.10250: Flags [.], cksum 0xfe28 (incorrect -> 0x4e2a), seq 1850, ack 28257, win 512, options [nop,nop,TS val 334919885 ecr 334919842], length 0
2022-04-06 13:43:57.382688 IP (tos 0x0, ttl 64, id 23419, offset 0, flags [DF], proto TCP (6), length 29579)
    127.0.0.1.10250 > 127.0.0.1.40638: Flags [P.], cksum 0x7180 (incorrect -> 0xa87d), seq 28257:57784, ack 1850, win 512, options [nop,nop,TS val 334919885 ecr 334919885], length 29527
2022-04-06 13:43:57.405389 IP (tos 0x0, ttl 64, id 23420, offset 0, flags [DF], proto TCP (6), length 32820)
    127.0.0.1.10250 > 127.0.0.1.40638: Flags [.], cksum 0x7e29 (incorrect -> 0x2d4f), seq 57784:90552, ack 1850, win 512, options [nop,nop,TS val 334919908 ecr 334919885], length 32768
2022-04-06 13:43:57.405415 IP (tos 0x0, ttl 64, id 47069, offset 0, flags [DF], proto TCP (6), length 52)
    127.0.0.1.40638 > 127.0.0.1.10250: Flags [.], cksum 0xfe28 (incorrect -> 0x5b15), seq 1850, ack 90552, win 379, options [nop,nop,TS val 334919908 ecr 334919885], length 0
2022-04-06 13:43:57.405424 IP (tos 0x0, ttl 64, id 23421, offset 0, flags [DF], proto TCP (6), length 5747)
    127.0.0.1.10250 > 127.0.0.1.40638: Flags [P.], cksum 0x1468 (incorrect -> 0xb121), seq 90552:96247, ack 1850, win 512, options [nop,nop,TS val 334919908 ecr 334919908], length 5695
2022-04-06 13:43:57.406185 IP (tos 0x0, ttl 64, id 47070, offset 0, flags [DF], proto TCP (6), length 52)
    127.0.0.1.40638 > 127.0.0.1.10250: Flags [.], cksum 0xfe28 (incorrect -> 0x4439), seq 1850, ack 96247, win 512, options [nop,nop,TS val 334919909 ecr 334919908], length 0
2022-04-06 13:43:57.410824 IP (tos 0x0, ttl 64, id 23422, offset 0, flags [DF], proto TCP (6), length 4100)
    127.0.0.1.10250 > 127.0.0.1.40638: Flags [P.], cksum 0x0df9 (incorrect -> 0x65ed), seq 96247:100295, ack 1850, win 512, options [nop,nop,TS val 334919913 ecr 334919909], length 4048
2022-04-06 13:43:57.410995 IP (tos 0x0, ttl 64, id 47071, offset 0, flags [DF], proto TCP (6), length 52)
    127.0.0.1.40638 > 127.0.0.1.10250: Flags [.], cksum 0xfe28 (incorrect -> 0x3460), seq 1850, ack 100295, win 512, options [nop,nop,TS val 334919913 ecr 334919913], length 0
2022-04-06 13:43:57.411003 IP (tos 0x0, ttl 64, id 23423, offset 0, flags [DF], proto TCP (6), length 4146)
    127.0.0.1.10250 > 127.0.0.1.40638: Flags [P.], cksum 0x0e27 (incorrect -> 0xc028), seq 100295:104389, ack 1850, win 512, options [nop,nop,TS val 334919913 ecr 334919913], length 4094
2022-04-06 13:43:57.411082 IP (tos 0x0, ttl 64, id 47072, offset 0, flags [DF], proto TCP (6), length 52)
    127.0.0.1.40638 > 127.0.0.1.10250: Flags [.], cksum 0xfe28 (incorrect -> 0x2461), seq 1850, ack 104389, win 512, options [nop,nop,TS val 334919914 ecr 334919913], length 0
2022-04-06 13:43:57.414822 IP (tos 0x0, ttl 64, id 23424, offset 0, flags [DF], proto TCP (6), length 4100)
    127.0.0.1.10250 > 127.0.0.1.40638: Flags [P.], cksum 0x0df9 (incorrect -> 0x407e), seq 104389:108437, ack 1850, win 512, options [nop,nop,TS val 334919917 ecr 334919914], length 4048
2022-04-06 13:43:57.414965 IP (tos 0x0, ttl 64, id 47073, offset 0, flags [DF], proto TCP (6), length 52)
    127.0.0.1.40638 > 127.0.0.1.10250: Flags [.], cksum 0xfe28 (incorrect -> 0x148a), seq 1850, ack 108437, win 512, options [nop,nop,TS val 334919917 ecr 334919917], length 0
2022-04-06 13:43:57.414972 IP (tos 0x0, ttl 64, id 23425, offset 0, flags [DF], proto TCP (6), length 910)
    127.0.0.1.10250 > 127.0.0.1.40638: Flags [P.], cksum 0x0183 (incorrect -> 0x67d4), seq 108437:109295, ack 1850, win 512, options [nop,nop,TS val 334919917 ecr 334919917], length 858
2022-04-06 13:43:57.414978 IP (tos 0x0, ttl 64, id 47074, offset 0, flags [DF], proto TCP (6), length 52)
    127.0.0.1.40638 > 127.0.0.1.10250: Flags [.], cksum 0xfe28 (incorrect -> 0x1130), seq 1850, ack 109295, win 512, options [nop,nop,TS val 334919917 ecr 334919917], length 0
2022-04-06 13:43:57.436222 IP (tos 0x0, ttl 64, id 23426, offset 0, flags [DF], proto TCP (6), length 1324)
    127.0.0.1.10250 > 127.0.0.1.40638: Flags [P.], cksum 0x0321 (incorrect -> 0x6fd1), seq 109295:110567, ack 1850, win 512, options [nop,nop,TS val 334919939 ecr 334919917], length 1272
2022-04-06 13:43:57.436336 IP (tos 0x0, ttl 64, id 47075, offset 0, flags [DF], proto TCP (6), length 52)
    127.0.0.1.40638 > 127.0.0.1.10250: Flags [.], cksum 0xfe28 (incorrect -> 0x0c0c), seq 1850, ack 110567, win 512, options [nop,nop,TS val 334919939 ecr 334919939], length 0
2022-04-06 13:43:57.437315 IP (tos 0x0, ttl 64, id 55629, offset 0, flags [DF], proto TCP (6), length 52)
    127.0.0.1.40636 > 127.0.0.1.10250: Flags [F.], cksum 0xfe28 (incorrect -> 0x6f7d), seq 909, ack 5964, win 512, options [nop,nop,TS val 334919940 ecr 334919300], length 0
2022-04-06 13:43:57.437357 IP (tos 0x0, ttl 64, id 18379, offset 0, flags [DF], proto TCP (6), length 52)
    127.0.0.1.10250 > 127.0.0.1.40636: Flags [F.], cksum 0xfe28 (incorrect -> 0x6cfc), seq 5964, ack 910, win 512, options [nop,nop,TS val 334919940 ecr 334919940], length 0
2022-04-06 13:43:57.437372 IP (tos 0x0, ttl 64, id 55630, offset 0, flags [DF], proto TCP (6), length 52)
    127.0.0.1.40636 > 127.0.0.1.10250: Flags [.], cksum 0xfe28 (incorrect -> 0x6cfc), seq 910, ack 5965, win 512, options [nop,nop,TS val 334919940 ecr 334919940], length 0
2022-04-06 13:43:57.438378 IP (tos 0x0, ttl 64, id 47076, offset 0, flags [DF], proto TCP (6), length 52)
    127.0.0.1.40638 > 127.0.0.1.10250: Flags [F.], cksum 0xfe28 (incorrect -> 0x0c09), seq 1850, ack 110567, win 512, options [nop,nop,TS val 334919941 ecr 334919939], length 0
200, 4.129023551940918, 1.0930407047271729