2022-04-06 07:21:10.770605 IP (tos 0x0, ttl 64, id 30052, offset 0, flags [DF], proto TCP (6), length 60)
    127.0.0.1.36588 > 127.0.0.1.11850: Flags [S], cksum 0xfe30 (incorrect -> 0x0d1e), seq 4048255568, win 65495, options [mss 65495,sackOK,TS val 311953273 ecr 0,nop,wscale 7], length 0
2022-04-06 07:21:10.770614 IP (tos 0x0, ttl 64, id 0, offset 0, flags [DF], proto TCP (6), length 60)
    127.0.0.1.11850 > 127.0.0.1.36588: Flags [S.], cksum 0xfe30 (incorrect -> 0x47b0), seq 1065249753, ack 4048255569, win 65483, options [mss 65495,sackOK,TS val 311953273 ecr 311953273,nop,wscale 7], length 0
2022-04-06 07:21:10.770623 IP (tos 0x0, ttl 64, id 30053, offset 0, flags [DF], proto TCP (6), length 52)
    127.0.0.1.36588 > 127.0.0.1.11850: Flags [.], cksum 0xfe28 (incorrect -> 0x6e6c), seq 1, ack 1, win 512, options [nop,nop,TS val 311953273 ecr 311953273], length 0
2022-04-06 07:21:10.770750 IP (tos 0x0, ttl 64, id 30054, offset 0, flags [DF], proto TCP (6), length 55)
    127.0.0.1.36588 > 127.0.0.1.11850: Flags [P.], cksum 0xfe2b (incorrect -> 0x6960), seq 1:4, ack 1, win 512, options [nop,nop,TS val 311953273 ecr 311953273], length 3
2022-04-06 07:21:10.770764 IP (tos 0x0, ttl 64, id 30392, offset 0, flags [DF], proto TCP (6), length 52)
    127.0.0.1.11850 > 127.0.0.1.36588: Flags [.], cksum 0xfe28 (incorrect -> 0x6e69), seq 1, ack 4, win 512, options [nop,nop,TS val 311953273 ecr 311953273], length 0
2022-04-06 07:21:10.770819 IP (tos 0x0, ttl 64, id 30393, offset 0, flags [DF], proto TCP (6), length 54)
    127.0.0.1.11850 > 127.0.0.1.36588: Flags [P.], cksum 0xfe2a (incorrect -> 0x695f), seq 1:3, ack 4, win 512, options [nop,nop,TS val 311953273 ecr 311953273], length 2
2022-04-06 07:21:10.770835 IP (tos 0x0, ttl 64, id 30055, offset 0, flags [DF], proto TCP (6), length 52)
    127.0.0.1.36588 > 127.0.0.1.11850: Flags [.], cksum 0xfe28 (incorrect -> 0x6e67), seq 4, ack 3, win 512, options [nop,nop,TS val 311953273 ecr 311953273], length 0
2022-04-06 07:21:10.772779 IP (tos 0x0, ttl 64, id 30056, offset 0, flags [DF], proto TCP (6), length 62)
    127.0.0.1.36588 > 127.0.0.1.11850: Flags [P.], cksum 0xfe32 (incorrect -> 0x1759), seq 4:14, ack 3, win 512, options [nop,nop,TS val 311953275 ecr 311953273], length 10
2022-04-06 07:21:10.772796 IP (tos 0x0, ttl 64, id 30394, offset 0, flags [DF], proto TCP (6), length 52)
    127.0.0.1.11850 > 127.0.0.1.36588: Flags [.], cksum 0xfe28 (incorrect -> 0x6e59), seq 3, ack 14, win 512, options [nop,nop,TS val 311953275 ecr 311953275], length 0
2022-04-06 07:21:10.854248 IP (tos 0x0, ttl 64, id 30395, offset 0, flags [DF], proto TCP (6), length 62)
    127.0.0.1.11850 > 127.0.0.1.36588: Flags [P.], cksum 0xfe32 (incorrect -> 0x68f4), seq 3:13, ack 14, win 512, options [nop,nop,TS val 311953357 ecr 311953275], length 10
2022-04-06 07:21:10.854261 IP (tos 0x0, ttl 64, id 30057, offset 0, flags [DF], proto TCP (6), length 52)
    127.0.0.1.36588 > 127.0.0.1.11850: Flags [.], cksum 0xfe28 (incorrect -> 0x6dab), seq 14, ack 13, win 512, options [nop,nop,TS val 311953357 ecr 311953357], length 0
2022-04-06 07:21:10.860493 IP (tos 0x0, ttl 64, id 30058, offset 0, flags [DF], proto TCP (6), length 569)
    127.0.0.1.36588 > 127.0.0.1.11850: Flags [P.], cksum 0x002e (incorrect -> 0x06e6), seq 14:531, ack 13, win 512, options [nop,nop,TS val 311953363 ecr 311953357], length 517
2022-04-06 07:21:10.860505 IP (tos 0x0, ttl 64, id 30396, offset 0, flags [DF], proto TCP (6), length 52)
    127.0.0.1.11850 > 127.0.0.1.36588: Flags [.], cksum 0xfe28 (incorrect -> 0x6b9e), seq 13, ack 531, win 508, options [nop,nop,TS val 311953363 ecr 311953363], length 0
200, 3.727217197418213, 0.6746068000793457