2022-04-06 18:05:11.135404 IP (tos 0x0, ttl 64, id 31604, offset 0, flags [DF], proto TCP (6), length 60)
    127.0.0.1.59310 > 127.0.0.1.10750: Flags [S], cksum 0xfe30 (incorrect -> 0xa5a0), seq 2724019979, win 65495, options [mss 65495,sackOK,TS val 350593638 ecr 0,nop,wscale 7], length 0
2022-04-06 18:05:11.135415 IP (tos 0x0, ttl 64, id 0, offset 0, flags [DF], proto TCP (6), length 60)
    127.0.0.1.10750 > 127.0.0.1.59310: Flags [S.], cksum 0xfe30 (incorrect -> 0x174e), seq 3484878666, ack 2724019980, win 65483, options [mss 65495,sackOK,TS val 350593638 ecr 350593638,nop,wscale 7], length 0
2022-04-06 18:05:11.135425 IP (tos 0x0, ttl 64, id 31605, offset 0, flags [DF], proto TCP (6), length 52)
    127.0.0.1.59310 > 127.0.0.1.10750: Flags [.], cksum 0xfe28 (incorrect -> 0x3e0a), seq 1, ack 1, win 512, options [nop,nop,TS val 350593638 ecr 350593638], length 0
2022-04-06 18:05:11.135532 IP (tos 0x0, ttl 64, id 31606, offset 0, flags [DF], proto TCP (6), length 55)
    127.0.0.1.59310 > 127.0.0.1.10750: Flags [P.], cksum 0xfe2b (incorrect -> 0x38fe), seq 1:4, ack 1, win 512, options [nop,nop,TS val 350593638 ecr 350593638], length 3
2022-04-06 18:05:11.135545 IP (tos 0x0, ttl 64, id 27315, offset 0, flags [DF], proto TCP (6), length 52)
    127.0.0.1.10750 > 127.0.0.1.59310: Flags [.], cksum 0xfe28 (incorrect -> 0x3e07), seq 1, ack 4, win 512, options [nop,nop,TS val 350593638 ecr 350593638], length 0
2022-04-06 18:05:11.135602 IP (tos 0x0, ttl 64, id 27316, offset 0, flags [DF], proto TCP (6), length 54)
    127.0.0.1.10750 > 127.0.0.1.59310: Flags [P.], cksum 0xfe2a (incorrect -> 0x38fd), seq 1:3, ack 4, win 512, options [nop,nop,TS val 350593638 ecr 350593638], length 2
2022-04-06 18:05:11.135620 IP (tos 0x0, ttl 64, id 31607, offset 0, flags [DF], proto TCP (6), length 52)
    127.0.0.1.59310 > 127.0.0.1.10750: Flags [.], cksum 0xfe28 (incorrect -> 0x3e05), seq 4, ack 3, win 512, options [nop,nop,TS val 350593638 ecr 350593638], length 0
2022-04-06 18:05:11.155332 IP (tos 0x0, ttl 64, id 31608, offset 0, flags [DF], proto TCP (6), length 62)
    127.0.0.1.59310 > 127.0.0.1.10750: Flags [P.], cksum 0xfe32 (incorrect -> 0xcb7f), seq 4:14, ack 3, win 512, options [nop,nop,TS val 350593658 ecr 350593638], length 10
2022-04-06 18:05:11.155349 IP (tos 0x0, ttl 64, id 27317, offset 0, flags [DF], proto TCP (6), length 52)
    127.0.0.1.10750 > 127.0.0.1.59310: Flags [.], cksum 0xfe28 (incorrect -> 0x3dd3), seq 3, ack 14, win 512, options [nop,nop,TS val 350593658 ecr 350593658], length 0
2022-04-06 18:05:11.235954 IP (tos 0x0, ttl 64, id 27318, offset 0, flags [DF], proto TCP (6), length 62)
    127.0.0.1.10750 > 127.0.0.1.59310: Flags [P.], cksum 0xfe32 (incorrect -> 0x3870), seq 3:13, ack 14, win 512, options [nop,nop,TS val 350593738 ecr 350593658], length 10
2022-04-06 18:05:11.235964 IP (tos 0x0, ttl 64, id 31609, offset 0, flags [DF], proto TCP (6), length 52)
    127.0.0.1.59310 > 127.0.0.1.10750: Flags [.], cksum 0xfe28 (incorrect -> 0x3d29), seq 14, ack 13, win 512, options [nop,nop,TS val 350593738 ecr 350593738], length 0
2022-04-06 18:05:11.241462 IP (tos 0x0, ttl 64, id 31610, offset 0, flags [DF], proto TCP (6), length 569)
    127.0.0.1.59310 > 127.0.0.1.10750: Flags [P.], cksum 0x002e (incorrect -> 0xd23b), seq 14:531, ack 13, win 512, options [nop,nop,TS val 350593744 ecr 350593738], length 517
2022-04-06 18:05:11.241473 IP (tos 0x0, ttl 64, id 27319, offset 0, flags [DF], proto TCP (6), length 52)
    127.0.0.1.10750 > 127.0.0.1.59310: Flags [.], cksum 0xfe28 (incorrect -> 0x3b1c), seq 13, ack 531, win 508, options [nop,nop,TS val 350593744 ecr 350593744], length 0
200, 3.848051071166992, 0.6501383781433105