2022-04-06 15:06:02.751088 IP (tos 0x0, ttl 64, id 8880, offset 0, flags [DF], proto TCP (6), length 60)
    127.0.0.1.54464 > 127.0.0.1.12050: Flags [S], cksum 0xfe30 (incorrect -> 0x7451), seq 2961076887, win 65495, options [mss 65495,sackOK,TS val 339845254 ecr 0,nop,wscale 7], length 0
2022-04-06 15:06:02.751100 IP (tos 0x0, ttl 64, id 0, offset 0, flags [DF], proto TCP (6), length 60)
    127.0.0.1.12050 > 127.0.0.1.54464: Flags [S.], cksum 0xfe30 (incorrect -> 0x0610), seq 1968653341, ack 2961076888, win 65483, options [mss 65495,sackOK,TS val 339845254 ecr 339845254,nop,wscale 7], length 0
2022-04-06 15:06:02.751110 IP (tos 0x0, ttl 64, id 8881, offset 0, flags [DF], proto TCP (6), length 52)
    127.0.0.1.54464 > 127.0.0.1.12050: Flags [.], cksum 0xfe28 (incorrect -> 0x2ccc), seq 1, ack 1, win 512, options [nop,nop,TS val 339845254 ecr 339845254], length 0
2022-04-06 15:06:02.751207 IP (tos 0x0, ttl 64, id 8882, offset 0, flags [DF], proto TCP (6), length 55)
    127.0.0.1.54464 > 127.0.0.1.12050: Flags [P.], cksum 0xfe2b (incorrect -> 0x27c0), seq 1:4, ack 1, win 512, options [nop,nop,TS val 339845254 ecr 339845254], length 3
2022-04-06 15:06:02.751217 IP (tos 0x0, ttl 64, id 50522, offset 0, flags [DF], proto TCP (6), length 52)
    127.0.0.1.12050 > 127.0.0.1.54464: Flags [.], cksum 0xfe28 (incorrect -> 0x2cc9), seq 1, ack 4, win 512, options [nop,nop,TS val 339845254 ecr 339845254], length 0
2022-04-06 15:06:02.751273 IP (tos 0x0, ttl 64, id 50523, offset 0, flags [DF], proto TCP (6), length 54)
    127.0.0.1.12050 > 127.0.0.1.54464: Flags [P.], cksum 0xfe2a (incorrect -> 0x27bf), seq 1:3, ack 4, win 512, options [nop,nop,TS val 339845254 ecr 339845254], length 2
2022-04-06 15:06:02.751302 IP (tos 0x0, ttl 64, id 8883, offset 0, flags [DF], proto TCP (6), length 52)
    127.0.0.1.54464 > 127.0.0.1.12050: Flags [.], cksum 0xfe28 (incorrect -> 0x2cc7), seq 4, ack 3, win 512, options [nop,nop,TS val 339845254 ecr 339845254], length 0
2022-04-06 15:06:02.752434 IP (tos 0x0, ttl 64, id 8884, offset 0, flags [DF], proto TCP (6), length 62)
    127.0.0.1.54464 > 127.0.0.1.12050: Flags [P.], cksum 0xfe32 (incorrect -> 0xd366), seq 4:14, ack 3, win 512, options [nop,nop,TS val 339845255 ecr 339845254], length 10
2022-04-06 15:06:02.752450 IP (tos 0x0, ttl 64, id 50524, offset 0, flags [DF], proto TCP (6), length 52)
    127.0.0.1.12050 > 127.0.0.1.54464: Flags [.], cksum 0xfe28 (incorrect -> 0x2cbb), seq 3, ack 14, win 512, options [nop,nop,TS val 339845255 ecr 339845255], length 0
2022-04-06 15:06:02.859946 IP (tos 0x0, ttl 64, id 50525, offset 0, flags [DF], proto TCP (6), length 62)
    127.0.0.1.12050 > 127.0.0.1.54464: Flags [P.], cksum 0xfe32 (incorrect -> 0x273d), seq 3:13, ack 14, win 512, options [nop,nop,TS val 339845362 ecr 339845255], length 10
2022-04-06 15:06:02.859960 IP (tos 0x0, ttl 64, id 8885, offset 0, flags [DF], proto TCP (6), length 52)
    127.0.0.1.54464 > 127.0.0.1.12050: Flags [.], cksum 0xfe28 (incorrect -> 0x2bdb), seq 14, ack 13, win 512, options [nop,nop,TS val 339845362 ecr 339845362], length 0
2022-04-06 15:06:02.865665 IP (tos 0x0, ttl 64, id 8886, offset 0, flags [DF], proto TCP (6), length 569)
    127.0.0.1.54464 > 127.0.0.1.12050: Flags [P.], cksum 0x002e (incorrect -> 0xf4e5), seq 14:531, ack 13, win 512, options [nop,nop,TS val 339845368 ecr 339845362], length 517
2022-04-06 15:06:02.865682 IP (tos 0x0, ttl 64, id 50526, offset 0, flags [DF], proto TCP (6), length 52)
    127.0.0.1.12050 > 127.0.0.1.54464: Flags [.], cksum 0xfe28 (incorrect -> 0x29ce), seq 13, ack 531, win 508, options [nop,nop,TS val 339845368 ecr 339845368], length 0
200, 4.925399303436279, 0.45034050941467285