2022-04-06 15:58:31.383400 IP (tos 0x0, ttl 64, id 21331, offset 0, flags [DF], proto TCP (6), length 60)
    127.0.0.1.50302 > 127.0.0.1.10950: Flags [S], cksum 0xfe30 (incorrect -> 0x40e3), seq 735327158, win 65495, options [mss 65495,sackOK,TS val 342993886 ecr 0,nop,wscale 7], length 0
2022-04-06 15:58:31.383411 IP (tos 0x0, ttl 64, id 0, offset 0, flags [DF], proto TCP (6), length 60)
    127.0.0.1.10950 > 127.0.0.1.50302: Flags [S.], cksum 0xfe30 (incorrect -> 0xd8c3), seq 3740256474, ack 735327159, win 65483, options [mss 65495,sackOK,TS val 342993886 ecr 342993886,nop,wscale 7], length 0
2022-04-06 15:58:31.383420 IP (tos 0x0, ttl 64, id 21332, offset 0, flags [DF], proto TCP (6), length 52)
    127.0.0.1.50302 > 127.0.0.1.10950: Flags [.], cksum 0xfe28 (incorrect -> 0xff7f), seq 1, ack 1, win 512, options [nop,nop,TS val 342993886 ecr 342993886], length 0
2022-04-06 15:58:31.383525 IP (tos 0x0, ttl 64, id 21333, offset 0, flags [DF], proto TCP (6), length 55)
    127.0.0.1.50302 > 127.0.0.1.10950: Flags [P.], cksum 0xfe2b (incorrect -> 0xfa73), seq 1:4, ack 1, win 512, options [nop,nop,TS val 342993886 ecr 342993886], length 3
2022-04-06 15:58:31.383537 IP (tos 0x0, ttl 64, id 51880, offset 0, flags [DF], proto TCP (6), length 52)
    127.0.0.1.10950 > 127.0.0.1.50302: Flags [.], cksum 0xfe28 (incorrect -> 0xff7c), seq 1, ack 4, win 512, options [nop,nop,TS val 342993886 ecr 342993886], length 0
2022-04-06 15:58:31.383589 IP (tos 0x0, ttl 64, id 51881, offset 0, flags [DF], proto TCP (6), length 54)
    127.0.0.1.10950 > 127.0.0.1.50302: Flags [P.], cksum 0xfe2a (incorrect -> 0xfa72), seq 1:3, ack 4, win 512, options [nop,nop,TS val 342993886 ecr 342993886], length 2
2022-04-06 15:58:31.383604 IP (tos 0x0, ttl 64, id 21334, offset 0, flags [DF], proto TCP (6), length 52)
    127.0.0.1.50302 > 127.0.0.1.10950: Flags [.], cksum 0xfe28 (incorrect -> 0xff7a), seq 4, ack 3, win 512, options [nop,nop,TS val 342993886 ecr 342993886], length 0
2022-04-06 15:58:31.395415 IP (tos 0x0, ttl 64, id 21335, offset 0, flags [DF], proto TCP (6), length 62)
    127.0.0.1.50302 > 127.0.0.1.10950: Flags [P.], cksum 0xfe32 (incorrect -> 0x3bd0), seq 4:14, ack 3, win 512, options [nop,nop,TS val 342993898 ecr 342993886], length 10
2022-04-06 15:58:31.395433 IP (tos 0x0, ttl 64, id 51882, offset 0, flags [DF], proto TCP (6), length 52)
    127.0.0.1.10950 > 127.0.0.1.50302: Flags [.], cksum 0xfe28 (incorrect -> 0xff58), seq 3, ack 14, win 512, options [nop,nop,TS val 342993898 ecr 342993898], length 0
2022-04-06 15:58:31.652865 IP (tos 0x0, ttl 64, id 51883, offset 0, flags [DF], proto TCP (6), length 62)
    127.0.0.1.10950 > 127.0.0.1.50302: Flags [P.], cksum 0xfe32 (incorrect -> 0xf944), seq 3:13, ack 14, win 512, options [nop,nop,TS val 342994155 ecr 342993898], length 10
2022-04-06 15:58:31.652878 IP (tos 0x0, ttl 64, id 21336, offset 0, flags [DF], proto TCP (6), length 52)
    127.0.0.1.50302 > 127.0.0.1.10950: Flags [.], cksum 0xfe28 (incorrect -> 0xfd4c), seq 14, ack 13, win 512, options [nop,nop,TS val 342994155 ecr 342994155], length 0
2022-04-06 15:58:31.658829 IP (tos 0x0, ttl 64, id 21337, offset 0, flags [DF], proto TCP (6), length 569)
    127.0.0.1.50302 > 127.0.0.1.10950: Flags [P.], cksum 0x002e (incorrect -> 0x151d), seq 14:531, ack 13, win 512, options [nop,nop,TS val 342994161 ecr 342994155], length 517
2022-04-06 15:58:31.658838 IP (tos 0x0, ttl 64, id 51884, offset 0, flags [DF], proto TCP (6), length 52)
    127.0.0.1.10950 > 127.0.0.1.50302: Flags [.], cksum 0xfe28 (incorrect -> 0xfb3f), seq 13, ack 531, win 508, options [nop,nop,TS val 342994161 ecr 342994161], length 0
2022-04-06 15:58:31.969991 IP (tos 0x0, ttl 64, id 51885, offset 0, flags [DF], proto TCP (6), length 3421)
    127.0.0.1.10950 > 127.0.0.1.50302: Flags [P.], cksum 0x0b52 (incorrect -> 0x1148), seq 13:3382, ack 531, win 512, options [nop,nop,TS val 342994472 ecr 342994161], length 3369
2022-04-06 15:58:31.970006 IP (tos 0x0, ttl 64, id 21338, offset 0, flags [DF], proto TCP (6), length 52)
    127.0.0.1.50302 > 127.0.0.1.10950: Flags [.], cksum 0xfe28 (incorrect -> 0xebb6), seq 531, ack 3382, win 494, options [nop,nop,TS val 342994472 ecr 342994472], length 0
2022-04-06 15:58:31.970680 IP (tos 0x0, ttl 64, id 21339, offset 0, flags [DF], proto TCP (6), length 116)
    127.0.0.1.50302 > 127.0.0.1.10950: Flags [P.], cksum 0xfe68 (incorrect -> 0xa0d2), seq 531:595, ack 3382, win 512, options [nop,nop,TS val 342994473 ecr 342994472], length 64
2022-04-06 15:58:31.970687 IP (tos 0x0, ttl 64, id 51886, offset 0, flags [DF], proto TCP (6), length 52)
    127.0.0.1.10950 > 127.0.0.1.50302: Flags [.], cksum 0xfe28 (incorrect -> 0xeb62), seq 3382, ack 595, win 512, options [nop,nop,TS val 342994473 ecr 342994473], length 0
2022-04-06 15:58:31.971176 IP (tos 0x0, ttl 64, id 21340, offset 0, flags [DF], proto TCP (6), length 316)
    127.0.0.1.50302 > 127.0.0.1.10950: Flags [P.], cksum 0xff30 (incorrect -> 0xeae2), seq 595:859, ack 3382, win 512, options [nop,nop,TS val 342994474 ecr 342994473], length 264
2022-04-06 15:58:31.971182 IP (tos 0x0, ttl 64, id 51887, offset 0, flags [DF], proto TCP (6), length 52)
    127.0.0.1.10950 > 127.0.0.1.50302: Flags [.], cksum 0xfe28 (incorrect -> 0xea5a), seq 3382, ack 859, win 510, options [nop,nop,TS val 342994474 ecr 342994474], length 0
2022-04-06 15:58:32.259668 IP (tos 0x0, ttl 64, id 51888, offset 0, flags [DF], proto TCP (6), length 594)
    127.0.0.1.10950 > 127.0.0.1.50302: Flags [P.], cksum 0x0047 (incorrect -> 0xa4a8), seq 3382:3924, ack 859, win 512, options [nop,nop,TS val 342994762 ecr 342994474], length 542
2022-04-06 15:58:32.259683 IP (tos 0x0, ttl 64, id 21341, offset 0, flags [DF], proto TCP (6), length 52)
    127.0.0.1.50302 > 127.0.0.1.10950: Flags [.], cksum 0xfe28 (incorrect -> 0xe5fe), seq 859, ack 3924, win 508, options [nop,nop,TS val 342994762 ecr 342994762], length 0
2022-04-06 15:58:32.453803 IP (tos 0x0, ttl 64, id 51889, offset 0, flags [DF], proto TCP (6), length 1533)
    127.0.0.1.10950 > 127.0.0.1.50302: Flags [P.], cksum 0x03f2 (incorrect -> 0x59ba), seq 3924:5405, ack 859, win 512, options [nop,nop,TS val 342994956 ecr 342994762], length 1481
2022-04-06 15:58:32.453811 IP (tos 0x0, ttl 64, id 21342, offset 0, flags [DF], proto TCP (6), length 52)
    127.0.0.1.50302 > 127.0.0.1.10950: Flags [.], cksum 0xfe28 (incorrect -> 0xdeb7), seq 859, ack 5405, win 502, options [nop,nop,TS val 342994956 ecr 342994956], length 0
2022-04-06 15:58:32.499252 IP (tos 0x0, ttl 64, id 51890, offset 0, flags [DF], proto TCP (6), length 3209)
    127.0.0.1.10950 > 127.0.0.1.50302: Flags [P.], cksum 0x0a7e (incorrect -> 0xcfd7), seq 5405:8562, ack 859, win 512, options [nop,nop,TS val 342995002 ecr 342994956], length 3157
2022-04-06 15:58:32.499260 IP (tos 0x0, ttl 64, id 21343, offset 0, flags [DF], proto TCP (6), length 52)
    127.0.0.1.50302 > 127.0.0.1.10950: Flags [.], cksum 0xfe28 (incorrect -> 0xd20d), seq 859, ack 8562, win 495, options [nop,nop,TS val 342995002 ecr 342995002], length 0
2022-04-06 15:58:32.568319 IP (tos 0x0, ttl 64, id 51891, offset 0, flags [DF], proto TCP (6), length 3538)
    127.0.0.1.10950 > 127.0.0.1.50302: Flags [P.], cksum 0x0bc7 (incorrect -> 0x0697), seq 8562:12048, ack 859, win 512, options [nop,nop,TS val 342995071 ecr 342995002], length 3486
2022-04-06 15:58:32.568326 IP (tos 0x0, ttl 64, id 21344, offset 0, flags [DF], proto TCP (6), length 52)
    127.0.0.1.50302 > 127.0.0.1.10950: Flags [.], cksum 0xfe28 (incorrect -> 0xc3e6), seq 859, ack 12048, win 494, options [nop,nop,TS val 342995071 ecr 342995071], length 0
2022-04-06 15:58:32.570099 IP (tos 0x0, ttl 64, id 51892, offset 0, flags [DF], proto TCP (6), length 4100)
    127.0.0.1.10950 > 127.0.0.1.50302: Flags [P.], cksum 0x0df9 (incorrect -> 0x5c6e), seq 12048:16096, ack 859, win 512, options [nop,nop,TS val 342995073 ecr 342995071], length 4048
2022-04-06 15:58:32.570106 IP (tos 0x0, ttl 64, id 21345, offset 0, flags [DF], proto TCP (6), length 52)
    127.0.0.1.50302 > 127.0.0.1.10950: Flags [.], cksum 0xfe28 (incorrect -> 0xb414), seq 859, ack 16096, win 492, options [nop,nop,TS val 342995073 ecr 342995073], length 0
2022-04-06 15:58:32.570111 IP (tos 0x0, ttl 64, id 51893, offset 0, flags [DF], proto TCP (6), length 2572)
    127.0.0.1.10950 > 127.0.0.1.50302: Flags [P.], cksum 0x0801 (incorrect -> 0xd0f4), seq 16096:18616, ack 859, win 512, options [nop,nop,TS val 342995073 ecr 342995073], length 2520
2022-04-06 15:58:32.570114 IP (tos 0x0, ttl 64, id 21346, offset 0, flags [DF], proto TCP (6), length 52)
    127.0.0.1.50302 > 127.0.0.1.10950: Flags [.], cksum 0xfe28 (incorrect -> 0xaa46), seq 859, ack 18616, win 482, options [nop,nop,TS val 342995073 ecr 342995073], length 0
2022-04-06 15:58:32.586380 IP (tos 0x0, ttl 64, id 51894, offset 0, flags [DF], proto TCP (6), length 3538)
    127.0.0.1.10950 > 127.0.0.1.50302: Flags [P.], cksum 0x0bc7 (incorrect -> 0x9802), seq 18616:22102, ack 859, win 512, options [nop,nop,TS val 342995089 ecr 342995073], length 3486
2022-04-06 15:58:32.586386 IP (tos 0x0, ttl 64, id 21347, offset 0, flags [DF], proto TCP (6), length 52)
    127.0.0.1.50302 > 127.0.0.1.10950: Flags [.], cksum 0xfe28 (incorrect -> 0x9c7c), seq 859, ack 22102, win 494, options [nop,nop,TS val 342995089 ecr 342995089], length 0
2022-04-06 15:58:32.612886 IP (tos 0x0, ttl 64, id 51895, offset 0, flags [DF], proto TCP (6), length 3538)
    127.0.0.1.10950 > 127.0.0.1.50302: Flags [P.], cksum 0x0bc7 (incorrect -> 0x0447), seq 22102:25588, ack 859, win 512, options [nop,nop,TS val 342995115 ecr 342995089], length 3486
2022-04-06 15:58:32.612894 IP (tos 0x0, ttl 64, id 21348, offset 0, flags [DF], proto TCP (6), length 52)
    127.0.0.1.50302 > 127.0.0.1.10950: Flags [.], cksum 0xfe28 (incorrect -> 0x8eaa), seq 859, ack 25588, win 494, options [nop,nop,TS val 342995115 ecr 342995115], length 0
2022-04-06 15:58:32.614949 IP (tos 0x0, ttl 64, id 51896, offset 0, flags [DF], proto TCP (6), length 4036)
    127.0.0.1.10950 > 127.0.0.1.50302: Flags [P.], cksum 0x0db9 (incorrect -> 0xf5bb), seq 25588:29572, ack 859, win 512, options [nop,nop,TS val 342995117 ecr 342995115], length 3984
2022-04-06 15:58:32.614954 IP (tos 0x0, ttl 64, id 21349, offset 0, flags [DF], proto TCP (6), length 52)
    127.0.0.1.50302 > 127.0.0.1.10950: Flags [.], cksum 0xfe28 (incorrect -> 0x7f18), seq 859, ack 29572, win 492, options [nop,nop,TS val 342995117 ecr 342995117], length 0
2022-04-06 15:58:32.637381 IP (tos 0x0, ttl 64, id 51897, offset 0, flags [DF], proto TCP (6), length 680)
    127.0.0.1.10950 > 127.0.0.1.50302: Flags [P.], cksum 0x009d (incorrect -> 0x07b2), seq 29572:30200, ack 859, win 512, options [nop,nop,TS val 342995140 ecr 342995117], length 628
2022-04-06 15:58:32.637387 IP (tos 0x0, ttl 64, id 21350, offset 0, flags [DF], proto TCP (6), length 52)
    127.0.0.1.50302 > 127.0.0.1.10950: Flags [.], cksum 0xfe28 (incorrect -> 0x7c69), seq 859, ack 30200, win 505, options [nop,nop,TS val 342995140 ecr 342995140], length 0
2022-04-06 15:58:32.683854 IP (tos 0x0, ttl 64, id 51898, offset 0, flags [DF], proto TCP (6), length 3538)
    127.0.0.1.10950 > 127.0.0.1.50302: Flags [P.], cksum 0x0bc7 (incorrect -> 0x9560), seq 30200:33686, ack 859, win 512, options [nop,nop,TS val 342995186 ecr 342995140], length 3486
2022-04-06 15:58:32.683861 IP (tos 0x0, ttl 64, id 21351, offset 0, flags [DF], proto TCP (6), length 52)
    127.0.0.1.50302 > 127.0.0.1.10950: Flags [.], cksum 0xfe28 (incorrect -> 0x6e7a), seq 859, ack 33686, win 494, options [nop,nop,TS val 342995186 ecr 342995186], length 0
2022-04-06 15:58:32.690673 IP (tos 0x0, ttl 64, id 51899, offset 0, flags [DF], proto TCP (6), length 4036)
    127.0.0.1.10950 > 127.0.0.1.50302: Flags [P.], cksum 0x0db9 (incorrect -> 0x2f9f), seq 33686:37670, ack 859, win 512, options [nop,nop,TS val 342995193 ecr 342995186], length 3984
2022-04-06 15:58:32.734661 IP (tos 0x0, ttl 64, id 21352, offset 0, flags [DF], proto TCP (6), length 52)
    127.0.0.1.50302 > 127.0.0.1.10950: Flags [.], cksum 0xfe28 (incorrect -> 0x5e9e), seq 859, ack 37670, win 512, options [nop,nop,TS val 342995237 ecr 342995193], length 0
2022-04-06 15:58:32.734671 IP (tos 0x0, ttl 64, id 51900, offset 0, flags [DF], proto TCP (6), length 19236)
    127.0.0.1.10950 > 127.0.0.1.50302: Flags [P.], cksum 0x4919 (incorrect -> 0x185b), seq 37670:56854, ack 859, win 512, options [nop,nop,TS val 342995237 ecr 342995237], length 19184
2022-04-06 15:58:32.778657 IP (tos 0x0, ttl 64, id 21353, offset 0, flags [DF], proto TCP (6), length 52)
    127.0.0.1.50302 > 127.0.0.1.10950: Flags [.], cksum 0xfe28 (incorrect -> 0x1356), seq 859, ack 56854, win 512, options [nop,nop,TS val 342995281 ecr 342995237], length 0
2022-04-06 15:58:32.778666 IP (tos 0x0, ttl 64, id 51901, offset 0, flags [DF], proto TCP (6), length 19734)
    127.0.0.1.10950 > 127.0.0.1.50302: Flags [P.], cksum 0x4b0b (incorrect -> 0xccd5), seq 56854:76536, ack 859, win 512, options [nop,nop,TS val 342995281 ecr 342995281], length 19682
2022-04-06 15:58:32.822660 IP (tos 0x0, ttl 64, id 21354, offset 0, flags [DF], proto TCP (6), length 52)
    127.0.0.1.50302 > 127.0.0.1.10950: Flags [.], cksum 0xfe28 (incorrect -> 0xc61b), seq 859, ack 76536, win 512, options [nop,nop,TS val 342995325 ecr 342995281], length 0
2022-04-06 15:58:32.867218 IP (tos 0x0, ttl 64, id 51902, offset 0, flags [DF], proto TCP (6), length 4100)
    127.0.0.1.10950 > 127.0.0.1.50302: Flags [P.], cksum 0x0df9 (incorrect -> 0xb5b3), seq 76536:80584, ack 859, win 512, options [nop,nop,TS val 342995370 ecr 342995325], length 4048
2022-04-06 15:58:32.867356 IP (tos 0x0, ttl 64, id 21355, offset 0, flags [DF], proto TCP (6), length 52)
    127.0.0.1.50302 > 127.0.0.1.10950: Flags [.], cksum 0xfe28 (incorrect -> 0xb5c5), seq 859, ack 80584, win 512, options [nop,nop,TS val 342995370 ecr 342995370], length 0
2022-04-06 15:58:32.867360 IP (tos 0x0, ttl 64, id 51903, offset 0, flags [DF], proto TCP (6), length 486)
    127.0.0.1.10950 > 127.0.0.1.50302: Flags [P.], cksum 0xffda (incorrect -> 0x9fff), seq 80584:81018, ack 859, win 512, options [nop,nop,TS val 342995370 ecr 342995370], length 434
2022-04-06 15:58:32.867367 IP (tos 0x0, ttl 64, id 21356, offset 0, flags [DF], proto TCP (6), length 52)
    127.0.0.1.50302 > 127.0.0.1.10950: Flags [.], cksum 0xfe28 (incorrect -> 0xb413), seq 859, ack 81018, win 512, options [nop,nop,TS val 342995370 ecr 342995370], length 0
2022-04-06 15:58:32.867416 IP (tos 0x0, ttl 64, id 51904, offset 0, flags [DF], proto TCP (6), length 4100)
    127.0.0.1.10950 > 127.0.0.1.50302: Flags [P.], cksum 0x0df9 (incorrect -> 0x6469), seq 81018:85066, ack 859, win 512, options [nop,nop,TS val 342995370 ecr 342995370], length 4048
2022-04-06 15:58:32.867490 IP (tos 0x0, ttl 64, id 21357, offset 0, flags [DF], proto TCP (6), length 52)
    127.0.0.1.50302 > 127.0.0.1.10950: Flags [.], cksum 0xfe28 (incorrect -> 0xa443), seq 859, ack 85066, win 512, options [nop,nop,TS val 342995370 ecr 342995370], length 0
2022-04-06 15:58:32.867494 IP (tos 0x0, ttl 64, id 51905, offset 0, flags [DF], proto TCP (6), length 8454)
    127.0.0.1.10950 > 127.0.0.1.50302: Flags [P.], cksum 0x1efb (incorrect -> 0x0b69), seq 85066:93468, ack 859, win 512, options [nop,nop,TS val 342995370 ecr 342995370], length 8402
2022-04-06 15:58:32.867687 IP (tos 0x0, ttl 64, id 21358, offset 0, flags [DF], proto TCP (6), length 52)
    127.0.0.1.50302 > 127.0.0.1.10950: Flags [.], cksum 0xfe28 (incorrect -> 0x8371), seq 859, ack 93468, win 512, options [nop,nop,TS val 342995370 ecr 342995370], length 0
2022-04-06 15:58:32.875165 IP (tos 0x0, ttl 64, id 51906, offset 0, flags [DF], proto TCP (6), length 1990)
    127.0.0.1.10950 > 127.0.0.1.50302: Flags [P.], cksum 0x05bb (incorrect -> 0xd917), seq 93468:95406, ack 859, win 512, options [nop,nop,TS val 342995378 ecr 342995370], length 1938
2022-04-06 15:58:32.875311 IP (tos 0x0, ttl 64, id 21359, offset 0, flags [DF], proto TCP (6), length 52)
    127.0.0.1.50302 > 127.0.0.1.10950: Flags [.], cksum 0xfe28 (incorrect -> 0x7bcf), seq 859, ack 95406, win 512, options [nop,nop,TS val 342995378 ecr 342995378], length 0
2022-04-06 15:58:32.875384 IP (tos 0x0, ttl 64, id 51907, offset 0, flags [DF], proto TCP (6), length 4100)
    127.0.0.1.10950 > 127.0.0.1.50302: Flags [P.], cksum 0x0df9 (incorrect -> 0xf5aa), seq 95406:99454, ack 859, win 512, options [nop,nop,TS val 342995378 ecr 342995378], length 4048
2022-04-06 15:58:32.875452 IP (tos 0x0, ttl 64, id 21360, offset 0, flags [DF], proto TCP (6), length 52)
    127.0.0.1.50302 > 127.0.0.1.10950: Flags [.], cksum 0xfe28 (incorrect -> 0x6bff), seq 859, ack 99454, win 512, options [nop,nop,TS val 342995378 ecr 342995378], length 0
2022-04-06 15:58:32.875457 IP (tos 0x0, ttl 64, id 51908, offset 0, flags [DF], proto TCP (6), length 7588)
    127.0.0.1.10950 > 127.0.0.1.50302: Flags [P.], cksum 0x1b99 (incorrect -> 0x972e), seq 99454:106990, ack 859, win 512, options [nop,nop,TS val 342995378 ecr 342995378], length 7536
2022-04-06 15:58:32.875644 IP (tos 0x0, ttl 64, id 21361, offset 0, flags [DF], proto TCP (6), length 52)
    127.0.0.1.50302 > 127.0.0.1.10950: Flags [.], cksum 0xfe28 (incorrect -> 0x4e8f), seq 859, ack 106990, win 512, options [nop,nop,TS val 342995378 ecr 342995378], length 0
2022-04-06 15:58:32.878022 IP (tos 0x0, ttl 64, id 51909, offset 0, flags [DF], proto TCP (6), length 4100)
    127.0.0.1.10950 > 127.0.0.1.50302: Flags [P.], cksum 0x0df9 (incorrect -> 0x3bf1), seq 106990:111038, ack 859, win 512, options [nop,nop,TS val 342995380 ecr 342995378], length 4048
2022-04-06 15:58:32.878087 IP (tos 0x0, ttl 64, id 21362, offset 0, flags [DF], proto TCP (6), length 52)
    127.0.0.1.50302 > 127.0.0.1.10950: Flags [.], cksum 0xfe28 (incorrect -> 0x3eba), seq 859, ack 111038, win 512, options [nop,nop,TS val 342995381 ecr 342995380], length 0
2022-04-06 15:58:32.878094 IP (tos 0x0, ttl 64, id 51910, offset 0, flags [DF], proto TCP (6), length 1482)
    127.0.0.1.10950 > 127.0.0.1.50302: Flags [P.], cksum 0x03bf (incorrect -> 0x3c98), seq 111038:112468, ack 859, win 512, options [nop,nop,TS val 342995381 ecr 342995381], length 1430
2022-04-06 15:58:32.878516 IP (tos 0x0, ttl 64, id 21363, offset 0, flags [DF], proto TCP (6), length 52)
    127.0.0.1.50302 > 127.0.0.1.10950: Flags [.], cksum 0xfe28 (incorrect -> 0x3923), seq 859, ack 112468, win 512, options [nop,nop,TS val 342995381 ecr 342995381], length 0
2022-04-06 15:58:32.880133 IP (tos 0x0, ttl 64, id 51911, offset 0, flags [DF], proto TCP (6), length 4100)
    127.0.0.1.10950 > 127.0.0.1.50302: Flags [P.], cksum 0x0df9 (incorrect -> 0x1e15), seq 112468:116516, ack 859, win 512, options [nop,nop,TS val 342995383 ecr 342995381], length 4048
2022-04-06 15:58:32.880222 IP (tos 0x0, ttl 64, id 21364, offset 0, flags [DF], proto TCP (6), length 52)
    127.0.0.1.50302 > 127.0.0.1.10950: Flags [.], cksum 0xfe28 (incorrect -> 0x294f), seq 859, ack 116516, win 512, options [nop,nop,TS val 342995383 ecr 342995383], length 0
2022-04-06 15:58:32.880227 IP (tos 0x0, ttl 64, id 51912, offset 0, flags [DF], proto TCP (6), length 7902)
    127.0.0.1.10950 > 127.0.0.1.50302: Flags [P.], cksum 0x1cd3 (incorrect -> 0xc54b), seq 116516:124366, ack 859, win 512, options [nop,nop,TS val 342995383 ecr 342995383], length 7850
2022-04-06 15:58:32.880412 IP (tos 0x0, ttl 64, id 21365, offset 0, flags [DF], proto TCP (6), length 52)
    127.0.0.1.50302 > 127.0.0.1.10950: Flags [.], cksum 0xfe28 (incorrect -> 0x0aa5), seq 859, ack 124366, win 512, options [nop,nop,TS val 342995383 ecr 342995383], length 0
2022-04-06 15:58:32.881111 IP (tos 0x0, ttl 64, id 51913, offset 0, flags [DF], proto TCP (6), length 4100)
    127.0.0.1.10950 > 127.0.0.1.50302: Flags [P.], cksum 0x0df9 (incorrect -> 0x1ffe), seq 124366:128414, ack 859, win 512, options [nop,nop,TS val 342995384 ecr 342995383], length 4048
2022-04-06 15:58:32.881153 IP (tos 0x0, ttl 64, id 21366, offset 0, flags [DF], proto TCP (6), length 52)
    127.0.0.1.50302 > 127.0.0.1.10950: Flags [.], cksum 0xfe28 (incorrect -> 0xfad2), seq 859, ack 128414, win 512, options [nop,nop,TS val 342995384 ecr 342995384], length 0
2022-04-06 15:58:32.881157 IP (tos 0x0, ttl 64, id 51914, offset 0, flags [DF], proto TCP (6), length 3474)
    127.0.0.1.10950 > 127.0.0.1.50302: Flags [P.], cksum 0x0b87 (incorrect -> 0xa00e), seq 128414:131836, ack 859, win 512, options [nop,nop,TS val 342995384 ecr 342995384], length 3422
2022-04-06 15:58:32.881168 IP (tos 0x0, ttl 64, id 21367, offset 0, flags [DF], proto TCP (6), length 52)
    127.0.0.1.50302 > 127.0.0.1.10950: Flags [.], cksum 0xfe28 (incorrect -> 0xed74), seq 859, ack 131836, win 512, options [nop,nop,TS val 342995384 ecr 342995384], length 0
200, 8.003448963165283, 1.5969560146331787