2022-04-06 01:46:58.362840 IP (tos 0x0, ttl 64, id 20087, offset 0, flags [DF], proto TCP (6), length 60)
    127.0.0.1.38206 > 127.0.0.1.10350: Flags [S], cksum 0xfe30 (incorrect -> 0xb2e7), seq 2496605047, win 65495, options [mss 65495,sackOK,TS val 291900865 ecr 0,nop,wscale 7], length 0
2022-04-06 01:46:58.362849 IP (tos 0x0, ttl 64, id 0, offset 0, flags [DF], proto TCP (6), length 60)
    127.0.0.1.10350 > 127.0.0.1.38206: Flags [S.], cksum 0xfe30 (incorrect -> 0x1b63), seq 125137123, ack 2496605048, win 65483, options [mss 65495,sackOK,TS val 291900865 ecr 291900865,nop,wscale 7], length 0
2022-04-06 01:46:58.362857 IP (tos 0x0, ttl 64, id 20088, offset 0, flags [DF], proto TCP (6), length 52)
    127.0.0.1.38206 > 127.0.0.1.10350: Flags [.], cksum 0xfe28 (incorrect -> 0x421f), seq 1, ack 1, win 512, options [nop,nop,TS val 291900865 ecr 291900865], length 0
2022-04-06 01:46:58.362936 IP (tos 0x0, ttl 64, id 20089, offset 0, flags [DF], proto TCP (6), length 55)
    127.0.0.1.38206 > 127.0.0.1.10350: Flags [P.], cksum 0xfe2b (incorrect -> 0x3d13), seq 1:4, ack 1, win 512, options [nop,nop,TS val 291900865 ecr 291900865], length 3
2022-04-06 01:46:58.362941 IP (tos 0x0, ttl 64, id 27456, offset 0, flags [DF], proto TCP (6), length 52)
    127.0.0.1.10350 > 127.0.0.1.38206: Flags [.], cksum 0xfe28 (incorrect -> 0x421c), seq 1, ack 4, win 512, options [nop,nop,TS val 291900865 ecr 291900865], length 0
2022-04-06 01:46:58.363000 IP (tos 0x0, ttl 64, id 27457, offset 0, flags [DF], proto TCP (6), length 54)
    127.0.0.1.10350 > 127.0.0.1.38206: Flags [P.], cksum 0xfe2a (incorrect -> 0x3d12), seq 1:3, ack 4, win 512, options [nop,nop,TS val 291900865 ecr 291900865], length 2
2022-04-06 01:46:58.363005 IP (tos 0x0, ttl 64, id 20090, offset 0, flags [DF], proto TCP (6), length 52)
    127.0.0.1.38206 > 127.0.0.1.10350: Flags [.], cksum 0xfe28 (incorrect -> 0x421a), seq 4, ack 3, win 512, options [nop,nop,TS val 291900865 ecr 291900865], length 0
2022-04-06 01:46:58.373999 IP (tos 0x0, ttl 64, id 20091, offset 0, flags [DF], proto TCP (6), length 62)
    127.0.0.1.38206 > 127.0.0.1.10350: Flags [P.], cksum 0xfe32 (incorrect -> 0xe8af), seq 4:14, ack 3, win 512, options [nop,nop,TS val 291900876 ecr 291900865], length 10
2022-04-06 01:46:58.374022 IP (tos 0x0, ttl 64, id 27458, offset 0, flags [DF], proto TCP (6), length 52)
    127.0.0.1.10350 > 127.0.0.1.38206: Flags [.], cksum 0xfe28 (incorrect -> 0x41fa), seq 3, ack 14, win 512, options [nop,nop,TS val 291900876 ecr 291900876], length 0
2022-04-06 01:46:58.420000 IP (tos 0x0, ttl 64, id 27459, offset 0, flags [DF], proto TCP (6), length 62)
    127.0.0.1.10350 > 127.0.0.1.38206: Flags [P.], cksum 0xfe32 (incorrect -> 0x3cb9), seq 3:13, ack 14, win 512, options [nop,nop,TS val 291900922 ecr 291900876], length 10
2022-04-06 01:46:58.420012 IP (tos 0x0, ttl 64, id 20092, offset 0, flags [DF], proto TCP (6), length 52)
    127.0.0.1.38206 > 127.0.0.1.10350: Flags [.], cksum 0xfe28 (incorrect -> 0x4194), seq 14, ack 13, win 512, options [nop,nop,TS val 291900922 ecr 291900922], length 0
2022-04-06 01:46:58.425626 IP (tos 0x0, ttl 64, id 20093, offset 0, flags [DF], proto TCP (6), length 569)
    127.0.0.1.38206 > 127.0.0.1.10350: Flags [P.], cksum 0x002e (incorrect -> 0x781a), seq 14:531, ack 13, win 512, options [nop,nop,TS val 291900928 ecr 291900922], length 517
2022-04-06 01:46:58.425636 IP (tos 0x0, ttl 64, id 27460, offset 0, flags [DF], proto TCP (6), length 52)
    127.0.0.1.10350 > 127.0.0.1.38206: Flags [.], cksum 0xfe28 (incorrect -> 0x3f87), seq 13, ack 531, win 508, options [nop,nop,TS val 291900928 ecr 291900928], length 0
2022-04-06 01:46:58.468871 IP (tos 0x0, ttl 64, id 27461, offset 0, flags [DF], proto TCP (6), length 3538)
    127.0.0.1.10350 > 127.0.0.1.38206: Flags [P.], cksum 0x0bc7 (incorrect -> 0x2eff), seq 13:3499, ack 531, win 512, options [nop,nop,TS val 291900971 ecr 291900928], length 3486
2022-04-06 01:46:58.468879 IP (tos 0x0, ttl 64, id 20094, offset 0, flags [DF], proto TCP (6), length 52)
    127.0.0.1.38206 > 127.0.0.1.10350: Flags [.], cksum 0xfe28 (incorrect -> 0x31a1), seq 531, ack 3499, win 494, options [nop,nop,TS val 291900971 ecr 291900971], length 0
2022-04-06 01:46:58.469276 IP (tos 0x0, ttl 64, id 20095, offset 0, flags [DF], proto TCP (6), length 132)
    127.0.0.1.38206 > 127.0.0.1.10350: Flags [P.], cksum 0xfe78 (incorrect -> 0xdec4), seq 531:611, ack 3499, win 494, options [nop,nop,TS val 291900972 ecr 291900971], length 80
2022-04-06 01:46:58.469284 IP (tos 0x0, ttl 64, id 27462, offset 0, flags [DF], proto TCP (6), length 52)
    127.0.0.1.10350 > 127.0.0.1.38206: Flags [.], cksum 0xfe28 (incorrect -> 0x313d), seq 3499, ack 611, win 512, options [nop,nop,TS val 291900972 ecr 291900972], length 0
2022-04-06 01:46:58.469564 IP (tos 0x0, ttl 64, id 20096, offset 0, flags [DF], proto TCP (6), length 381)
    127.0.0.1.38206 > 127.0.0.1.10350: Flags [P.], cksum 0xff71 (incorrect -> 0xc84b), seq 611:940, ack 3499, win 494, options [nop,nop,TS val 291900972 ecr 291900972], length 329
2022-04-06 01:46:58.469572 IP (tos 0x0, ttl 64, id 27463, offset 0, flags [DF], proto TCP (6), length 52)
    127.0.0.1.10350 > 127.0.0.1.38206: Flags [.], cksum 0xfe28 (incorrect -> 0x2ff6), seq 3499, ack 940, win 510, options [nop,nop,TS val 291900972 ecr 291900972], length 0
2022-04-06 01:46:58.480980 IP (tos 0x0, ttl 64, id 27464, offset 0, flags [DF], proto TCP (6), length 194)
    127.0.0.1.10350 > 127.0.0.1.38206: Flags [P.], cksum 0xfeb6 (incorrect -> 0xda11), seq 3499:3641, ack 940, win 512, options [nop,nop,TS val 291900983 ecr 291900972], length 142
2022-04-06 01:46:58.480988 IP (tos 0x0, ttl 64, id 20097, offset 0, flags [DF], proto TCP (6), length 52)
    127.0.0.1.38206 > 127.0.0.1.10350: Flags [.], cksum 0xfe28 (incorrect -> 0x2f55), seq 940, ack 3641, win 507, options [nop,nop,TS val 291900983 ecr 291900983], length 0
200, 5.777558326721191, 0.24418282508850098