2022-04-06 11:20:08.358454 IP (tos 0x0, ttl 64, id 60817, offset 0, flags [DF], proto TCP (6), length 60)
    127.0.0.1.39326 > 127.0.0.1.11950: Flags [S], cksum 0xfe30 (incorrect -> 0x61a7), seq 3225126066, win 65495, options [mss 65495,sackOK,TS val 326290861 ecr 0,nop,wscale 7], length 0
2022-04-06 11:20:08.358472 IP (tos 0x0, ttl 64, id 0, offset 0, flags [DF], proto TCP (6), length 60)
    127.0.0.1.11950 > 127.0.0.1.39326: Flags [S.], cksum 0xfe30 (incorrect -> 0xf78a), seq 3695488178, ack 3225126067, win 65483, options [mss 65495,sackOK,TS val 326290861 ecr 326290861,nop,wscale 7], length 0
2022-04-06 11:20:08.358485 IP (tos 0x0, ttl 64, id 60818, offset 0, flags [DF], proto TCP (6), length 52)
    127.0.0.1.39326 > 127.0.0.1.11950: Flags [.], cksum 0xfe28 (incorrect -> 0x1e47), seq 1, ack 1, win 512, options [nop,nop,TS val 326290861 ecr 326290861], length 0
2022-04-06 11:20:08.358582 IP (tos 0x0, ttl 64, id 60819, offset 0, flags [DF], proto TCP (6), length 55)
    127.0.0.1.39326 > 127.0.0.1.11950: Flags [P.], cksum 0xfe2b (incorrect -> 0x193b), seq 1:4, ack 1, win 512, options [nop,nop,TS val 326290861 ecr 326290861], length 3
2022-04-06 11:20:08.358594 IP (tos 0x0, ttl 64, id 59171, offset 0, flags [DF], proto TCP (6), length 52)
    127.0.0.1.11950 > 127.0.0.1.39326: Flags [.], cksum 0xfe28 (incorrect -> 0x1e44), seq 1, ack 4, win 512, options [nop,nop,TS val 326290861 ecr 326290861], length 0
2022-04-06 11:20:08.358620 IP (tos 0x0, ttl 64, id 59172, offset 0, flags [DF], proto TCP (6), length 54)
    127.0.0.1.11950 > 127.0.0.1.39326: Flags [P.], cksum 0xfe2a (incorrect -> 0x193a), seq 1:3, ack 4, win 512, options [nop,nop,TS val 326290861 ecr 326290861], length 2
2022-04-06 11:20:08.358634 IP (tos 0x0, ttl 64, id 60820, offset 0, flags [DF], proto TCP (6), length 52)
    127.0.0.1.39326 > 127.0.0.1.11950: Flags [.], cksum 0xfe28 (incorrect -> 0x1e42), seq 4, ack 3, win 512, options [nop,nop,TS val 326290861 ecr 326290861], length 0
2022-04-06 11:20:08.359984 IP (tos 0x0, ttl 64, id 60821, offset 0, flags [DF], proto TCP (6), length 62)
    127.0.0.1.39326 > 127.0.0.1.11950: Flags [P.], cksum 0xfe32 (incorrect -> 0xc5fc), seq 4:14, ack 3, win 512, options [nop,nop,TS val 326290862 ecr 326290861], length 10
2022-04-06 11:20:08.360002 IP (tos 0x0, ttl 64, id 59173, offset 0, flags [DF], proto TCP (6), length 52)
    127.0.0.1.11950 > 127.0.0.1.39326: Flags [.], cksum 0xfe28 (incorrect -> 0x1e36), seq 3, ack 14, win 512, options [nop,nop,TS val 326290862 ecr 326290862], length 0
2022-04-06 11:20:08.442992 IP (tos 0x0, ttl 64, id 59174, offset 0, flags [DF], proto TCP (6), length 62)
    127.0.0.1.11950 > 127.0.0.1.39326: Flags [P.], cksum 0xfe32 (incorrect -> 0x18d0), seq 3:13, ack 14, win 512, options [nop,nop,TS val 326290945 ecr 326290862], length 10
2022-04-06 11:20:08.443006 IP (tos 0x0, ttl 64, id 60822, offset 0, flags [DF], proto TCP (6), length 52)
    127.0.0.1.39326 > 127.0.0.1.11950: Flags [.], cksum 0xfe28 (incorrect -> 0x1d86), seq 14, ack 13, win 512, options [nop,nop,TS val 326290945 ecr 326290945], length 0
2022-04-06 11:20:08.449006 IP (tos 0x0, ttl 64, id 60823, offset 0, flags [DF], proto TCP (6), length 569)
    127.0.0.1.39326 > 127.0.0.1.11950: Flags [P.], cksum 0x002e (incorrect -> 0xa1f9), seq 14:531, ack 13, win 512, options [nop,nop,TS val 326290951 ecr 326290945], length 517
2022-04-06 11:20:08.449022 IP (tos 0x0, ttl 64, id 59175, offset 0, flags [DF], proto TCP (6), length 52)
    127.0.0.1.11950 > 127.0.0.1.39326: Flags [.], cksum 0xfe28 (incorrect -> 0x1b79), seq 13, ack 531, win 508, options [nop,nop,TS val 326290951 ecr 326290951], length 0
2022-04-06 11:20:08.528953 IP (tos 0x0, ttl 64, id 59176, offset 0, flags [DF], proto TCP (6), length 3538)
    127.0.0.1.11950 > 127.0.0.1.39326: Flags [P.], cksum 0x0bc7 (incorrect -> 0xf721), seq 13:3499, ack 531, win 512, options [nop,nop,TS val 326291031 ecr 326290951], length 3486
2022-04-06 11:20:08.528973 IP (tos 0x0, ttl 64, id 60824, offset 0, flags [DF], proto TCP (6), length 52)
    127.0.0.1.39326 > 127.0.0.1.11950: Flags [.], cksum 0xfe28 (incorrect -> 0x0d49), seq 531, ack 3499, win 494, options [nop,nop,TS val 326291031 ecr 326291031], length 0
2022-04-06 11:20:08.548900 IP (tos 0x0, ttl 64, id 59177, offset 0, flags [DF], proto TCP (6), length 272)
    127.0.0.1.11950 > 127.0.0.1.39326: Flags [P.], cksum 0xff04 (incorrect -> 0xda6f), seq 3499:3719, ack 531, win 512, options [nop,nop,TS val 326291051 ecr 326291031], length 220
2022-04-06 11:20:08.548916 IP (tos 0x0, ttl 64, id 60825, offset 0, flags [DF], proto TCP (6), length 52)
    127.0.0.1.39326 > 127.0.0.1.11950: Flags [.], cksum 0xfe28 (incorrect -> 0x0c38), seq 531, ack 3719, win 507, options [nop,nop,TS val 326291051 ecr 326291051], length 0
2022-04-06 11:20:08.549045 IP (tos 0x0, ttl 64, id 60826, offset 0, flags [DF], proto TCP (6), length 132)
    127.0.0.1.39326 > 127.0.0.1.11950: Flags [P.], cksum 0xfe78 (incorrect -> 0x3684), seq 531:611, ack 3719, win 507, options [nop,nop,TS val 326291051 ecr 326291051], length 80
2022-04-06 11:20:08.549060 IP (tos 0x0, ttl 64, id 59178, offset 0, flags [DF], proto TCP (6), length 52)
    127.0.0.1.11950 > 127.0.0.1.39326: Flags [.], cksum 0xfe28 (incorrect -> 0x0be3), seq 3719, ack 611, win 512, options [nop,nop,TS val 326291051 ecr 326291051], length 0
2022-04-06 11:20:08.549659 IP (tos 0x0, ttl 64, id 60827, offset 0, flags [DF], proto TCP (6), length 405)
    127.0.0.1.39326 > 127.0.0.1.11950: Flags [P.], cksum 0xff89 (incorrect -> 0x4d3b), seq 611:964, ack 3719, win 507, options [nop,nop,TS val 326291052 ecr 326291051], length 353
2022-04-06 11:20:08.549677 IP (tos 0x0, ttl 64, id 59179, offset 0, flags [DF], proto TCP (6), length 52)
    127.0.0.1.11950 > 127.0.0.1.39326: Flags [.], cksum 0xfe28 (incorrect -> 0x0a82), seq 3719, ack 964, win 510, options [nop,nop,TS val 326291052 ecr 326291052], length 0
2022-04-06 11:20:09.189206 IP (tos 0x0, ttl 64, id 59180, offset 0, flags [DF], proto TCP (6), length 1736)
    127.0.0.1.11950 > 127.0.0.1.39326: Flags [P.], cksum 0x04bd (incorrect -> 0xe80b), seq 3719:5403, ack 964, win 512, options [nop,nop,TS val 326291692 ecr 326291052], length 1684
2022-04-06 11:20:09.189222 IP (tos 0x0, ttl 64, id 60828, offset 0, flags [DF], proto TCP (6), length 52)
    127.0.0.1.39326 > 127.0.0.1.11950: Flags [.], cksum 0xfe28 (incorrect -> 0xfef6), seq 964, ack 5403, win 501, options [nop,nop,TS val 326291692 ecr 326291692], length 0
2022-04-06 11:20:09.203209 IP (tos 0x0, ttl 64, id 59181, offset 0, flags [DF], proto TCP (6), length 3538)
    127.0.0.1.11950 > 127.0.0.1.39326: Flags [P.], cksum 0x0bc7 (incorrect -> 0x496a), seq 5403:8889, ack 964, win 512, options [nop,nop,TS val 326291706 ecr 326291692], length 3486
2022-04-06 11:20:09.203222 IP (tos 0x0, ttl 64, id 60829, offset 0, flags [DF], proto TCP (6), length 52)
    127.0.0.1.39326 > 127.0.0.1.11950: Flags [.], cksum 0xfe28 (incorrect -> 0xf143), seq 964, ack 8889, win 494, options [nop,nop,TS val 326291706 ecr 326291706], length 0
2022-04-06 11:20:09.250855 IP (tos 0x0, ttl 64, id 59182, offset 0, flags [DF], proto TCP (6), length 773)
    127.0.0.1.11950 > 127.0.0.1.39326: Flags [P.], cksum 0x00fa (incorrect -> 0x7e02), seq 8889:9610, ack 964, win 512, options [nop,nop,TS val 326291753 ecr 326291706], length 721
2022-04-06 11:20:09.250884 IP (tos 0x0, ttl 64, id 60830, offset 0, flags [DF], proto TCP (6), length 52)
    127.0.0.1.39326 > 127.0.0.1.11950: Flags [.], cksum 0xfe28 (incorrect -> 0xee09), seq 964, ack 9610, win 505, options [nop,nop,TS val 326291753 ecr 326291753], length 0
2022-04-06 11:20:09.294538 IP (tos 0x0, ttl 64, id 59183, offset 0, flags [DF], proto TCP (6), length 3438)
    127.0.0.1.11950 > 127.0.0.1.39326: Flags [P.], cksum 0x0b63 (incorrect -> 0xa52a), seq 9610:12996, ack 964, win 512, options [nop,nop,TS val 326291797 ecr 326291753], length 3386
2022-04-06 11:20:09.294552 IP (tos 0x0, ttl 64, id 60831, offset 0, flags [DF], proto TCP (6), length 52)
    127.0.0.1.39326 > 127.0.0.1.11950: Flags [.], cksum 0xfe28 (incorrect -> 0xe082), seq 964, ack 12996, win 494, options [nop,nop,TS val 326291797 ecr 326291797], length 0
2022-04-06 11:20:09.296113 IP (tos 0x0, ttl 64, id 59184, offset 0, flags [DF], proto TCP (6), length 2442)
    127.0.0.1.11950 > 127.0.0.1.39326: Flags [P.], cksum 0x077f (incorrect -> 0xe3d8), seq 12996:15386, ack 964, win 512, options [nop,nop,TS val 326291799 ecr 326291797], length 2390
2022-04-06 11:20:09.296121 IP (tos 0x0, ttl 64, id 60832, offset 0, flags [DF], proto TCP (6), length 52)
    127.0.0.1.39326 > 127.0.0.1.11950: Flags [.], cksum 0xfe28 (incorrect -> 0xd724), seq 964, ack 15386, win 498, options [nop,nop,TS val 326291799 ecr 326291799], length 0
2022-04-06 11:20:09.301507 IP (tos 0x0, ttl 64, id 59185, offset 0, flags [DF], proto TCP (6), length 2940)
    127.0.0.1.11950 > 127.0.0.1.39326: Flags [P.], cksum 0x0971 (incorrect -> 0x111f), seq 15386:18274, ack 964, win 512, options [nop,nop,TS val 326291804 ecr 326291799], length 2888
2022-04-06 11:20:09.301523 IP (tos 0x0, ttl 64, id 60833, offset 0, flags [DF], proto TCP (6), length 52)
    127.0.0.1.39326 > 127.0.0.1.11950: Flags [.], cksum 0xfe28 (incorrect -> 0xcbd4), seq 964, ack 18274, win 496, options [nop,nop,TS val 326291804 ecr 326291804], length 0
2022-04-06 11:20:09.304157 IP (tos 0x0, ttl 64, id 59186, offset 0, flags [DF], proto TCP (6), length 2940)
    127.0.0.1.11950 > 127.0.0.1.39326: Flags [P.], cksum 0x0971 (incorrect -> 0x70ff), seq 18274:21162, ack 964, win 512, options [nop,nop,TS val 326291807 ecr 326291804], length 2888
2022-04-06 11:20:09.304166 IP (tos 0x0, ttl 64, id 60834, offset 0, flags [DF], proto TCP (6), length 52)
    127.0.0.1.39326 > 127.0.0.1.11950: Flags [.], cksum 0xfe28 (incorrect -> 0xc086), seq 964, ack 21162, win 496, options [nop,nop,TS val 326291807 ecr 326291807], length 0
2022-04-06 11:20:09.312966 IP (tos 0x0, ttl 64, id 59187, offset 0, flags [DF], proto TCP (6), length 4100)
    127.0.0.1.11950 > 127.0.0.1.39326: Flags [P.], cksum 0x0df9 (incorrect -> 0xaa30), seq 21162:25210, ack 964, win 512, options [nop,nop,TS val 326291815 ecr 326291807], length 4048
2022-04-06 11:20:09.312975 IP (tos 0x0, ttl 64, id 60835, offset 0, flags [DF], proto TCP (6), length 52)
    127.0.0.1.39326 > 127.0.0.1.11950: Flags [.], cksum 0xfe28 (incorrect -> 0xb0aa), seq 964, ack 25210, win 492, options [nop,nop,TS val 326291815 ecr 326291815], length 0
2022-04-06 11:20:09.312983 IP (tos 0x0, ttl 64, id 59188, offset 0, flags [DF], proto TCP (6), length 2776)
    127.0.0.1.11950 > 127.0.0.1.39326: Flags [P.], cksum 0x08cd (incorrect -> 0x0891), seq 25210:27934, ack 964, win 512, options [nop,nop,TS val 326291815 ecr 326291815], length 2724
2022-04-06 11:20:09.312989 IP (tos 0x0, ttl 64, id 60836, offset 0, flags [DF], proto TCP (6), length 52)
    127.0.0.1.39326 > 127.0.0.1.11950: Flags [.], cksum 0xfe28 (incorrect -> 0xa611), seq 964, ack 27934, win 481, options [nop,nop,TS val 326291815 ecr 326291815], length 0
2022-04-06 11:20:09.314260 IP (tos 0x0, ttl 64, id 59189, offset 0, flags [DF], proto TCP (6), length 2442)
    127.0.0.1.11950 > 127.0.0.1.39326: Flags [P.], cksum 0x077f (incorrect -> 0xa024), seq 27934:30324, ack 964, win 512, options [nop,nop,TS val 326291817 ecr 326291815], length 2390
2022-04-06 11:20:09.314291 IP (tos 0x0, ttl 64, id 60837, offset 0, flags [DF], proto TCP (6), length 52)
    127.0.0.1.39326 > 127.0.0.1.11950: Flags [.], cksum 0xfe28 (incorrect -> 0x9c98), seq 964, ack 30324, win 512, options [nop,nop,TS val 326291817 ecr 326291817], length 0
2022-04-06 11:20:09.314449 IP (tos 0x0, ttl 64, id 59190, offset 0, flags [DF], proto TCP (6), length 3438)
    127.0.0.1.11950 > 127.0.0.1.39326: Flags [P.], cksum 0x0b63 (incorrect -> 0x3cdb), seq 30324:33710, ack 964, win 512, options [nop,nop,TS val 326291817 ecr 326291817], length 3386
2022-04-06 11:20:09.314480 IP (tos 0x0, ttl 64, id 60838, offset 0, flags [DF], proto TCP (6), length 52)
    127.0.0.1.39326 > 127.0.0.1.11950: Flags [.], cksum 0xfe28 (incorrect -> 0x8f5e), seq 964, ack 33710, win 512, options [nop,nop,TS val 326291817 ecr 326291817], length 0
2022-04-06 11:20:09.319922 IP (tos 0x0, ttl 64, id 59191, offset 0, flags [DF], proto TCP (6), length 2442)
    127.0.0.1.11950 > 127.0.0.1.39326: Flags [P.], cksum 0x077f (incorrect -> 0xa943), seq 33710:36100, ack 964, win 512, options [nop,nop,TS val 326291822 ecr 326291817], length 2390
2022-04-06 11:20:09.319975 IP (tos 0x0, ttl 64, id 60839, offset 0, flags [DF], proto TCP (6), length 52)
    127.0.0.1.39326 > 127.0.0.1.11950: Flags [.], cksum 0xfe28 (incorrect -> 0x85fe), seq 964, ack 36100, win 512, options [nop,nop,TS val 326291822 ecr 326291822], length 0
2022-04-06 11:20:09.324341 IP (tos 0x0, ttl 64, id 59192, offset 0, flags [DF], proto TCP (6), length 3438)
    127.0.0.1.11950 > 127.0.0.1.39326: Flags [P.], cksum 0x0b63 (incorrect -> 0x5cae), seq 36100:39486, ack 964, win 512, options [nop,nop,TS val 326291827 ecr 326291822], length 3386
2022-04-06 11:20:09.324587 IP (tos 0x0, ttl 64, id 60840, offset 0, flags [DF], proto TCP (6), length 52)
    127.0.0.1.39326 > 127.0.0.1.11950: Flags [.], cksum 0xfe28 (incorrect -> 0x78ba), seq 964, ack 39486, win 512, options [nop,nop,TS val 326291827 ecr 326291827], length 0
2022-04-06 11:20:09.345432 IP (tos 0x0, ttl 64, id 59193, offset 0, flags [DF], proto TCP (6), length 3648)
    127.0.0.1.11950 > 127.0.0.1.39326: Flags [P.], cksum 0x0c35 (incorrect -> 0x6fa9), seq 39486:43082, ack 964, win 512, options [nop,nop,TS val 326291848 ecr 326291827], length 3596
2022-04-06 11:20:09.345609 IP (tos 0x0, ttl 64, id 60841, offset 0, flags [DF], proto TCP (6), length 52)
    127.0.0.1.39326 > 127.0.0.1.11950: Flags [.], cksum 0xfe28 (incorrect -> 0x6a84), seq 964, ack 43082, win 512, options [nop,nop,TS val 326291848 ecr 326291848], length 0
2022-04-06 11:20:09.380125 IP (tos 0x0, ttl 64, id 59194, offset 0, flags [DF], proto TCP (6), length 3438)
    127.0.0.1.11950 > 127.0.0.1.39326: Flags [P.], cksum 0x0b63 (incorrect -> 0x75e3), seq 43082:46468, ack 964, win 512, options [nop,nop,TS val 326291883 ecr 326291848], length 3386
2022-04-06 11:20:09.380187 IP (tos 0x0, ttl 64, id 60842, offset 0, flags [DF], proto TCP (6), length 52)
    127.0.0.1.39326 > 127.0.0.1.11950: Flags [.], cksum 0xfe28 (incorrect -> 0x5d04), seq 964, ack 46468, win 512, options [nop,nop,TS val 326291883 ecr 326291883], length 0
2022-04-06 11:20:09.385115 IP (tos 0x0, ttl 64, id 59195, offset 0, flags [DF], proto TCP (6), length 3936)
    127.0.0.1.11950 > 127.0.0.1.39326: Flags [P.], cksum 0x0d55 (incorrect -> 0x1e23), seq 46468:50352, ack 964, win 512, options [nop,nop,TS val 326291888 ecr 326291883], length 3884
2022-04-06 11:20:09.385204 IP (tos 0x0, ttl 64, id 60843, offset 0, flags [DF], proto TCP (6), length 52)
    127.0.0.1.39326 > 127.0.0.1.11950: Flags [.], cksum 0xfe28 (incorrect -> 0x4dce), seq 964, ack 50352, win 512, options [nop,nop,TS val 326291888 ecr 326291888], length 0
2022-04-06 11:20:09.385213 IP (tos 0x0, ttl 64, id 59196, offset 0, flags [DF], proto TCP (6), length 3438)
    127.0.0.1.11950 > 127.0.0.1.39326: Flags [P.], cksum 0x0b63 (incorrect -> 0xff2d), seq 50352:53738, ack 964, win 512, options [nop,nop,TS val 326291888 ecr 326291888], length 3386
2022-04-06 11:20:09.385228 IP (tos 0x0, ttl 64, id 60844, offset 0, flags [DF], proto TCP (6), length 52)
    127.0.0.1.39326 > 127.0.0.1.11950: Flags [.], cksum 0xfe28 (incorrect -> 0x4094), seq 964, ack 53738, win 512, options [nop,nop,TS val 326291888 ecr 326291888], length 0
2022-04-06 11:20:09.394210 IP (tos 0x0, ttl 64, id 59197, offset 0, flags [DF], proto TCP (6), length 948)
    127.0.0.1.11950 > 127.0.0.1.39326: Flags [P.], cksum 0x01a9 (incorrect -> 0x1c0b), seq 53738:54634, ack 964, win 512, options [nop,nop,TS val 326291897 ecr 326291888], length 896
2022-04-06 11:20:09.394483 IP (tos 0x0, ttl 64, id 60845, offset 0, flags [DF], proto TCP (6), length 52)
    127.0.0.1.39326 > 127.0.0.1.11950: Flags [.], cksum 0xfe28 (incorrect -> 0x3d02), seq 964, ack 54634, win 512, options [nop,nop,TS val 326291897 ecr 326291897], length 0
2022-04-06 11:20:09.413479 IP (tos 0x0, ttl 64, id 59198, offset 0, flags [DF], proto TCP (6), length 3781)
    127.0.0.1.11950 > 127.0.0.1.39326: Flags [P.], cksum 0x0cba (incorrect -> 0x744e), seq 54634:58363, ack 964, win 512, options [nop,nop,TS val 326291916 ecr 326291897], length 3729
2022-04-06 11:20:09.413526 IP (tos 0x0, ttl 64, id 60846, offset 0, flags [DF], proto TCP (6), length 52)
    127.0.0.1.39326 > 127.0.0.1.11950: Flags [.], cksum 0xfe28 (incorrect -> 0x2e4b), seq 964, ack 58363, win 512, options [nop,nop,TS val 326291916 ecr 326291916], length 0
2022-04-06 11:20:09.917111 IP (tos 0x0, ttl 64, id 59199, offset 0, flags [DF], proto TCP (6), length 4100)
    127.0.0.1.11950 > 127.0.0.1.39326: Flags [P.], cksum 0x0df9 (incorrect -> 0xf948), seq 58363:62411, ack 964, win 512, options [nop,nop,TS val 326292420 ecr 326291916], length 4048
2022-04-06 11:20:09.917122 IP (tos 0x0, ttl 64, id 60847, offset 0, flags [DF], proto TCP (6), length 52)
    127.0.0.1.39326 > 127.0.0.1.11950: Flags [.], cksum 0xfe28 (incorrect -> 0x1a9f), seq 964, ack 62411, win 492, options [nop,nop,TS val 326292420 ecr 326292420], length 0
2022-04-06 11:20:09.917132 IP (tos 0x0, ttl 64, id 59200, offset 0, flags [DF], proto TCP (6), length 3474)
    127.0.0.1.11950 > 127.0.0.1.39326: Flags [P.], cksum 0x0b87 (incorrect -> 0x8ce4), seq 62411:65833, ack 964, win 512, options [nop,nop,TS val 326292420 ecr 326292420], length 3422
2022-04-06 11:20:09.917137 IP (tos 0x0, ttl 64, id 60848, offset 0, flags [DF], proto TCP (6), length 52)
    127.0.0.1.39326 > 127.0.0.1.11950: Flags [.], cksum 0xfe28 (incorrect -> 0x0d4f), seq 964, ack 65833, win 478, options [nop,nop,TS val 326292420 ecr 326292420], length 0
2022-04-06 11:20:09.921479 IP (tos 0x0, ttl 64, id 59201, offset 0, flags [DF], proto TCP (6), length 4036)
    127.0.0.1.11950 > 127.0.0.1.39326: Flags [P.], cksum 0x0db9 (incorrect -> 0x96d7), seq 65833:69817, ack 964, win 512, options [nop,nop,TS val 326292424 ecr 326292420], length 3984
2022-04-06 11:20:09.921488 IP (tos 0x0, ttl 64, id 60849, offset 0, flags [DF], proto TCP (6), length 52)
    127.0.0.1.39326 > 127.0.0.1.11950: Flags [.], cksum 0xfe28 (incorrect -> 0xfda8), seq 964, ack 69817, win 492, options [nop,nop,TS val 326292424 ecr 326292424], length 0
2022-04-06 11:20:09.930896 IP (tos 0x0, ttl 64, id 59202, offset 0, flags [DF], proto TCP (6), length 763)
    127.0.0.1.11950 > 127.0.0.1.39326: Flags [P.], cksum 0x00f0 (incorrect -> 0xf85b), seq 69817:70528, ack 964, win 512, options [nop,nop,TS val 326292433 ecr 326292424], length 711
2022-04-06 11:20:09.930904 IP (tos 0x0, ttl 64, id 60850, offset 0, flags [DF], proto TCP (6), length 52)
    127.0.0.1.39326 > 127.0.0.1.11950: Flags [.], cksum 0xfe28 (incorrect -> 0xfac2), seq 964, ack 70528, win 505, options [nop,nop,TS val 326292433 ecr 326292433], length 0
2022-04-06 11:20:09.935269 IP (tos 0x0, ttl 64, id 59203, offset 0, flags [DF], proto TCP (6), length 4100)
    127.0.0.1.11950 > 127.0.0.1.39326: Flags [P.], cksum 0x0df9 (incorrect -> 0x7a4c), seq 70528:74576, ack 964, win 512, options [nop,nop,TS val 326292438 ecr 326292433], length 4048
2022-04-06 11:20:09.935278 IP (tos 0x0, ttl 64, id 60851, offset 0, flags [DF], proto TCP (6), length 52)
    127.0.0.1.39326 > 127.0.0.1.11950: Flags [.], cksum 0xfe28 (incorrect -> 0xeaf5), seq 964, ack 74576, win 492, options [nop,nop,TS val 326292438 ecr 326292438], length 0
2022-04-06 11:20:09.935285 IP (tos 0x0, ttl 64, id 59204, offset 0, flags [DF], proto TCP (6), length 486)
    127.0.0.1.11950 > 127.0.0.1.39326: Flags [P.], cksum 0xffda (incorrect -> 0x2efe), seq 74576:75010, ack 964, win 512, options [nop,nop,TS val 326292438 ecr 326292438], length 434
2022-04-06 11:20:09.935290 IP (tos 0x0, ttl 64, id 60852, offset 0, flags [DF], proto TCP (6), length 52)
    127.0.0.1.39326 > 127.0.0.1.11950: Flags [.], cksum 0xfe28 (incorrect -> 0xe945), seq 964, ack 75010, win 490, options [nop,nop,TS val 326292438 ecr 326292438], length 0
2022-04-06 11:20:09.935323 IP (tos 0x0, ttl 64, id 59205, offset 0, flags [DF], proto TCP (6), length 3538)
    127.0.0.1.11950 > 127.0.0.1.39326: Flags [P.], cksum 0x0bc7 (incorrect -> 0xda2b), seq 75010:78496, ack 964, win 512, options [nop,nop,TS val 326292438 ecr 326292438], length 3486
2022-04-06 11:20:09.935327 IP (tos 0x0, ttl 64, id 60853, offset 0, flags [DF], proto TCP (6), length 52)
    127.0.0.1.39326 > 127.0.0.1.11950: Flags [.], cksum 0xfe28 (incorrect -> 0xdbb5), seq 964, ack 78496, win 476, options [nop,nop,TS val 326292438 ecr 326292438], length 0
2022-04-06 11:20:09.940951 IP (tos 0x0, ttl 64, id 59206, offset 0, flags [DF], proto TCP (6), length 3538)
    127.0.0.1.11950 > 127.0.0.1.39326: Flags [P.], cksum 0x0bc7 (incorrect -> 0xbd76), seq 78496:81982, ack 964, win 512, options [nop,nop,TS val 326292443 ecr 326292438], length 3486
2022-04-06 11:20:09.940959 IP (tos 0x0, ttl 64, id 60854, offset 0, flags [DF], proto TCP (6), length 52)
    127.0.0.1.39326 > 127.0.0.1.11950: Flags [.], cksum 0xfe28 (incorrect -> 0xcdfb), seq 964, ack 81982, win 494, options [nop,nop,TS val 326292443 ecr 326292443], length 0
2022-04-06 11:20:09.944790 IP (tos 0x0, ttl 64, id 59207, offset 0, flags [DF], proto TCP (6), length 3538)
    127.0.0.1.11950 > 127.0.0.1.39326: Flags [P.], cksum 0x0bc7 (incorrect -> 0x01d1), seq 81982:85468, ack 964, win 512, options [nop,nop,TS val 326292447 ecr 326292443], length 3486
2022-04-06 11:20:09.986666 IP (tos 0x0, ttl 64, id 60855, offset 0, flags [DF], proto TCP (6), length 52)
    127.0.0.1.39326 > 127.0.0.1.11950: Flags [.], cksum 0xfe28 (incorrect -> 0xc019), seq 964, ack 85468, win 512, options [nop,nop,TS val 326292489 ecr 326292447], length 0
2022-04-06 11:20:09.986675 IP (tos 0x0, ttl 64, id 59208, offset 0, flags [DF], proto TCP (6), length 3314)
    127.0.0.1.11950 > 127.0.0.1.39326: Flags [P.], cksum 0x0ae7 (incorrect -> 0x4b08), seq 85468:88730, ack 964, win 512, options [nop,nop,TS val 326292489 ecr 326292489], length 3262
2022-04-06 11:20:09.987063 IP (tos 0x0, ttl 64, id 60856, offset 0, flags [DF], proto TCP (6), length 52)
    127.0.0.1.39326 > 127.0.0.1.11950: Flags [.], cksum 0xfe28 (incorrect -> 0xb331), seq 964, ack 88730, win 512, options [nop,nop,TS val 326292489 ecr 326292489], length 0
2022-04-06 11:20:10.040600 IP (tos 0x0, ttl 64, id 59209, offset 0, flags [DF], proto TCP (6), length 4100)
    127.0.0.1.11950 > 127.0.0.1.39326: Flags [P.], cksum 0x0df9 (incorrect -> 0x962a), seq 88730:92778, ack 964, win 512, options [nop,nop,TS val 326292543 ecr 326292489], length 4048
2022-04-06 11:20:10.081708 IP (tos 0x0, ttl 64, id 59210, offset 0, flags [DF], proto TCP (6), length 32820)
    127.0.0.1.11950 > 127.0.0.1.39326: Flags [.], cksum 0x7e29 (incorrect -> 0x3fff), seq 92778:125546, ack 964, win 512, options [nop,nop,TS val 326292584 ecr 326292489], length 32768
2022-04-06 11:20:10.081718 IP (tos 0x0, ttl 64, id 60857, offset 0, flags [DF], proto TCP (6), length 52)
    127.0.0.1.39326 > 127.0.0.1.11950: Flags [.], cksum 0xfe28 (incorrect -> 0x2351), seq 964, ack 125546, win 379, options [nop,nop,TS val 326292584 ecr 326292543], length 0
2022-04-06 11:20:10.081727 IP (tos 0x0, ttl 64, id 59211, offset 0, flags [DF], proto TCP (6), length 2578)
    127.0.0.1.11950 > 127.0.0.1.39326: Flags [P.], cksum 0x0807 (incorrect -> 0x27c5), seq 125546:128072, ack 964, win 512, options [nop,nop,TS val 326292584 ecr 326292584], length 2526
2022-04-06 11:20:10.082493 IP (tos 0x0, ttl 64, id 60858, offset 0, flags [DF], proto TCP (6), length 52)
    127.0.0.1.39326 > 127.0.0.1.11950: Flags [.], cksum 0xfe28 (incorrect -> 0x18c4), seq 964, ack 128072, win 512, options [nop,nop,TS val 326292585 ecr 326292584], length 0
2022-04-06 11:20:10.082540 IP (tos 0x0, ttl 64, id 59212, offset 0, flags [DF], proto TCP (6), length 4036)
    127.0.0.1.11950 > 127.0.0.1.39326: Flags [P.], cksum 0x0db9 (incorrect -> 0x4737), seq 128072:132056, ack 964, win 512, options [nop,nop,TS val 326292585 ecr 326292585], length 3984
2022-04-06 11:20:10.082748 IP (tos 0x0, ttl 64, id 60859, offset 0, flags [DF], proto TCP (6), length 52)
    127.0.0.1.39326 > 127.0.0.1.11950: Flags [.], cksum 0xfe28 (incorrect -> 0x0933), seq 964, ack 132056, win 512, options [nop,nop,TS val 326292585 ecr 326292585], length 0
2022-04-06 11:20:10.084666 IP (tos 0x0, ttl 64, id 59213, offset 0, flags [DF], proto TCP (6), length 3538)
    127.0.0.1.11950 > 127.0.0.1.39326: Flags [P.], cksum 0x0bc7 (incorrect -> 0xde72), seq 132056:135542, ack 964, win 512, options [nop,nop,TS val 326292587 ecr 326292585], length 3486
2022-04-06 11:20:10.085243 IP (tos 0x0, ttl 64, id 60860, offset 0, flags [DF], proto TCP (6), length 52)
    127.0.0.1.39326 > 127.0.0.1.11950: Flags [.], cksum 0xfe28 (incorrect -> 0xfb8f), seq 964, ack 135542, win 512, options [nop,nop,TS val 326292588 ecr 326292587], length 0
2022-04-06 11:20:10.098349 IP (tos 0x0, ttl 64, id 59214, offset 0, flags [DF], proto TCP (6), length 1048)
    127.0.0.1.11950 > 127.0.0.1.39326: Flags [P.], cksum 0x020d (incorrect -> 0x9885), seq 135542:136538, ack 964, win 512, options [nop,nop,TS val 326292601 ecr 326292588], length 996
2022-04-06 11:20:10.098372 IP (tos 0x0, ttl 64, id 60861, offset 0, flags [DF], proto TCP (6), length 52)
    127.0.0.1.39326 > 127.0.0.1.11950: Flags [.], cksum 0xfe28 (incorrect -> 0xf790), seq 964, ack 136538, win 512, options [nop,nop,TS val 326292601 ecr 326292601], length 0
2022-04-06 11:20:10.110130 IP (tos 0x0, ttl 64, id 59215, offset 0, flags [DF], proto TCP (6), length 1982)
    127.0.0.1.11950 > 127.0.0.1.39326: Flags [P.], cksum 0x05b3 (incorrect -> 0x01e2), seq 136538:138468, ack 964, win 512, options [nop,nop,TS val 326292613 ecr 326292601], length 1930
2022-04-06 11:20:10.110169 IP (tos 0x0, ttl 64, id 60862, offset 0, flags [DF], proto TCP (6), length 52)
    127.0.0.1.39326 > 127.0.0.1.11950: Flags [.], cksum 0xfe28 (incorrect -> 0xefee), seq 964, ack 138468, win 512, options [nop,nop,TS val 326292613 ecr 326292613], length 0
2022-04-06 11:20:10.112653 IP (tos 0x0, ttl 64, id 59216, offset 0, flags [DF], proto TCP (6), length 3538)
    127.0.0.1.11950 > 127.0.0.1.39326: Flags [P.], cksum 0x0bc7 (incorrect -> 0xa7d9), seq 138468:141954, ack 964, win 512, options [nop,nop,TS val 326292615 ecr 326292613], length 3486
2022-04-06 11:20:10.112696 IP (tos 0x0, ttl 64, id 60863, offset 0, flags [DF], proto TCP (6), length 52)
    127.0.0.1.39326 > 127.0.0.1.11950: Flags [.], cksum 0xfe28 (incorrect -> 0xe24c), seq 964, ack 141954, win 512, options [nop,nop,TS val 326292615 ecr 326292615], length 0
2022-04-06 11:20:10.114506 IP (tos 0x0, ttl 64, id 59217, offset 0, flags [DF], proto TCP (6), length 3538)
    127.0.0.1.11950 > 127.0.0.1.39326: Flags [P.], cksum 0x0bc7 (incorrect -> 0xe835), seq 141954:145440, ack 964, win 512, options [nop,nop,TS val 326292617 ecr 326292615], length 3486
2022-04-06 11:20:10.143261 IP (tos 0x0, ttl 64, id 59218, offset 0, flags [DF], proto TCP (6), length 32820)
    127.0.0.1.11950 > 127.0.0.1.39326: Flags [.], cksum 0x7e29 (incorrect -> 0x0098), seq 145440:178208, ack 964, win 512, options [nop,nop,TS val 326292646 ecr 326292615], length 32768
2022-04-06 11:20:10.143273 IP (tos 0x0, ttl 64, id 60864, offset 0, flags [DF], proto TCP (6), length 52)
    127.0.0.1.39326 > 127.0.0.1.11950: Flags [.], cksum 0xfe28 (incorrect -> 0x5512), seq 964, ack 178208, win 379, options [nop,nop,TS val 326292646 ecr 326292617], length 0
2022-04-06 11:20:10.143283 IP (tos 0x0, ttl 64, id 59219, offset 0, flags [DF], proto TCP (6), length 152)
    127.0.0.1.11950 > 127.0.0.1.39326: Flags [P.], cksum 0xfe8c (incorrect -> 0x8450), seq 178208:178308, ack 964, win 512, options [nop,nop,TS val 326292646 ecr 326292646], length 100
2022-04-06 11:20:10.143841 IP (tos 0x0, ttl 64, id 60865, offset 0, flags [DF], proto TCP (6), length 52)
    127.0.0.1.39326 > 127.0.0.1.11950: Flags [.], cksum 0xfe28 (incorrect -> 0x540c), seq 964, ack 178308, win 512, options [nop,nop,TS val 326292646 ecr 326292646], length 0
2022-04-06 11:20:10.145439 IP (tos 0x0, ttl 64, id 59220, offset 0, flags [DF], proto TCP (6), length 4036)
    127.0.0.1.11950 > 127.0.0.1.39326: Flags [P.], cksum 0x0db9 (incorrect -> 0xb036), seq 178308:182292, ack 964, win 512, options [nop,nop,TS val 326292648 ecr 326292646], length 3984
2022-04-06 11:20:10.145457 IP (tos 0x0, ttl 64, id 60866, offset 0, flags [DF], proto TCP (6), length 52)
    127.0.0.1.39326 > 127.0.0.1.11950: Flags [.], cksum 0xfe28 (incorrect -> 0x4478), seq 964, ack 182292, win 512, options [nop,nop,TS val 326292648 ecr 326292648], length 0
2022-04-06 11:20:10.159279 IP (tos 0x0, ttl 64, id 59221, offset 0, flags [DF], proto TCP (6), length 4036)
    127.0.0.1.11950 > 127.0.0.1.39326: Flags [P.], cksum 0x0db9 (incorrect -> 0x8bc8), seq 182292:186276, ack 964, win 512, options [nop,nop,TS val 326292662 ecr 326292648], length 3984
2022-04-06 11:20:10.202663 IP (tos 0x0, ttl 64, id 60867, offset 0, flags [DF], proto TCP (6), length 52)
    127.0.0.1.39326 > 127.0.0.1.11950: Flags [.], cksum 0xfe28 (incorrect -> 0x34a1), seq 964, ack 186276, win 512, options [nop,nop,TS val 326292705 ecr 326292662], length 0
2022-04-06 11:20:10.202674 IP (tos 0x0, ttl 64, id 59222, offset 0, flags [DF], proto TCP (6), length 9224)
    127.0.0.1.11950 > 127.0.0.1.39326: Flags [P.], cksum 0x21fd (incorrect -> 0xd2ee), seq 186276:195448, ack 964, win 512, options [nop,nop,TS val 326292705 ecr 326292705], length 9172
2022-04-06 11:20:10.230876 IP (tos 0x0, ttl 64, id 59223, offset 0, flags [DF], proto TCP (6), length 32820)
    127.0.0.1.11950 > 127.0.0.1.39326: Flags [.], cksum 0x7e29 (incorrect -> 0x4c38), seq 195448:228216, ack 964, win 512, options [nop,nop,TS val 326292733 ecr 326292705], length 32768
2022-04-06 11:20:10.230901 IP (tos 0x0, ttl 64, id 60868, offset 0, flags [DF], proto TCP (6), length 52)
    127.0.0.1.39326 > 127.0.0.1.11950: Flags [.], cksum 0xfe28 (incorrect -> 0x910a), seq 964, ack 228216, win 379, options [nop,nop,TS val 326292733 ecr 326292705], length 0
2022-04-06 11:20:10.230908 IP (tos 0x0, ttl 64, id 59224, offset 0, flags [DF], proto TCP (6), length 2622)
    127.0.0.1.11950 > 127.0.0.1.39326: Flags [P.], cksum 0x0833 (incorrect -> 0x5e16), seq 228216:230786, ack 964, win 512, options [nop,nop,TS val 326292733 ecr 326292733], length 2570
2022-04-06 11:20:10.231272 IP (tos 0x0, ttl 64, id 60869, offset 0, flags [DF], proto TCP (6), length 52)
    127.0.0.1.39326 > 127.0.0.1.11950: Flags [.], cksum 0xfe28 (incorrect -> 0x865e), seq 964, ack 230786, win 512, options [nop,nop,TS val 326292734 ecr 326292733], length 0
2022-04-06 11:20:10.236327 IP (tos 0x0, ttl 64, id 59225, offset 0, flags [DF], proto TCP (6), length 4036)
    127.0.0.1.11950 > 127.0.0.1.39326: Flags [P.], cksum 0x0db9 (incorrect -> 0x0f55), seq 230786:234770, ack 964, win 512, options [nop,nop,TS val 326292739 ecr 326292734], length 3984
2022-04-06 11:20:10.236345 IP (tos 0x0, ttl 64, id 60870, offset 0, flags [DF], proto TCP (6), length 52)
    127.0.0.1.39326 > 127.0.0.1.11950: Flags [.], cksum 0xfe28 (incorrect -> 0x76c3), seq 964, ack 234770, win 512, options [nop,nop,TS val 326292739 ecr 326292739], length 0
2022-04-06 11:20:10.238962 IP (tos 0x0, ttl 64, id 59226, offset 0, flags [DF], proto TCP (6), length 1068)
    127.0.0.1.11950 > 127.0.0.1.39326: Flags [P.], cksum 0x0221 (incorrect -> 0x4514), seq 234770:235786, ack 964, win 512, options [nop,nop,TS val 326292741 ecr 326292739], length 1016
2022-04-06 11:20:10.238976 IP (tos 0x0, ttl 64, id 60871, offset 0, flags [DF], proto TCP (6), length 52)
    127.0.0.1.39326 > 127.0.0.1.11950: Flags [.], cksum 0xfe28 (incorrect -> 0x72c7), seq 964, ack 235786, win 512, options [nop,nop,TS val 326292741 ecr 326292741], length 0
2022-04-06 11:20:10.252799 IP (tos 0x0, ttl 64, id 59227, offset 0, flags [DF], proto TCP (6), length 1801)
    127.0.0.1.11950 > 127.0.0.1.39326: Flags [P.], cksum 0x04fe (incorrect -> 0xc296), seq 235786:237535, ack 964, win 512, options [nop,nop,TS val 326292755 ecr 326292741], length 1749
2022-04-06 11:20:10.252939 IP (tos 0x0, ttl 64, id 60872, offset 0, flags [DF], proto TCP (6), length 52)
    127.0.0.1.39326 > 127.0.0.1.11950: Flags [.], cksum 0xfe28 (incorrect -> 0x6bd6), seq 964, ack 237535, win 512, options [nop,nop,TS val 326292755 ecr 326292755], length 0
2022-04-06 11:20:10.280926 IP (tos 0x0, ttl 64, id 59228, offset 0, flags [DF], proto TCP (6), length 3538)
    127.0.0.1.11950 > 127.0.0.1.39326: Flags [P.], cksum 0x0bc7 (incorrect -> 0x6d96), seq 237535:241021, ack 964, win 512, options [nop,nop,TS val 326292783 ecr 326292755], length 3486
2022-04-06 11:20:10.280985 IP (tos 0x0, ttl 64, id 60873, offset 0, flags [DF], proto TCP (6), length 52)
    127.0.0.1.39326 > 127.0.0.1.11950: Flags [.], cksum 0xfe28 (incorrect -> 0x5e00), seq 964, ack 241021, win 512, options [nop,nop,TS val 326292783 ecr 326292783], length 0
2022-04-06 11:20:10.282286 IP (tos 0x0, ttl 64, id 59229, offset 0, flags [DF], proto TCP (6), length 4036)
    127.0.0.1.11950 > 127.0.0.1.39326: Flags [P.], cksum 0x0db9 (incorrect -> 0x0bfd), seq 241021:245005, ack 964, win 512, options [nop,nop,TS val 326292785 ecr 326292783], length 3984
2022-04-06 11:20:10.282302 IP (tos 0x0, ttl 64, id 60874, offset 0, flags [DF], proto TCP (6), length 52)
    127.0.0.1.39326 > 127.0.0.1.11950: Flags [.], cksum 0xfe28 (incorrect -> 0x4e6c), seq 964, ack 245005, win 512, options [nop,nop,TS val 326292785 ecr 326292785], length 0
2022-04-06 11:20:10.282362 IP (tos 0x0, ttl 64, id 59230, offset 0, flags [DF], proto TCP (6), length 3538)
    127.0.0.1.11950 > 127.0.0.1.39326: Flags [P.], cksum 0x0bc7 (incorrect -> 0xa43d), seq 245005:248491, ack 964, win 512, options [nop,nop,TS val 326292785 ecr 326292785], length 3486
2022-04-06 11:20:10.282379 IP (tos 0x0, ttl 64, id 60875, offset 0, flags [DF], proto TCP (6), length 52)
    127.0.0.1.39326 > 127.0.0.1.11950: Flags [.], cksum 0xfe28 (incorrect -> 0x40ce), seq 964, ack 248491, win 512, options [nop,nop,TS val 326292785 ecr 326292785], length 0
2022-04-06 11:20:10.283587 IP (tos 0x0, ttl 64, id 59231, offset 0, flags [DF], proto TCP (6), length 4036)
    127.0.0.1.11950 > 127.0.0.1.39326: Flags [P.], cksum 0x0db9 (incorrect -> 0xb2ed), seq 248491:252475, ack 964, win 512, options [nop,nop,TS val 326292786 ecr 326292785], length 3984
2022-04-06 11:20:10.283601 IP (tos 0x0, ttl 64, id 60876, offset 0, flags [DF], proto TCP (6), length 52)
    127.0.0.1.39326 > 127.0.0.1.11950: Flags [.], cksum 0xfe28 (incorrect -> 0x313c), seq 964, ack 252475, win 512, options [nop,nop,TS val 326292786 ecr 326292786], length 0
2022-04-06 11:20:10.283783 IP (tos 0x0, ttl 64, id 59232, offset 0, flags [DF], proto TCP (6), length 3538)
    127.0.0.1.11950 > 127.0.0.1.39326: Flags [P.], cksum 0x0bc7 (incorrect -> 0xda2e), seq 252475:255961, ack 964, win 512, options [nop,nop,TS val 326292786 ecr 326292786], length 3486
2022-04-06 11:20:10.284020 IP (tos 0x0, ttl 64, id 60877, offset 0, flags [DF], proto TCP (6), length 52)
    127.0.0.1.39326 > 127.0.0.1.11950: Flags [.], cksum 0xfe28 (incorrect -> 0x239e), seq 964, ack 255961, win 512, options [nop,nop,TS val 326292786 ecr 326292786], length 0
2022-04-06 11:20:10.285194 IP (tos 0x0, ttl 64, id 59233, offset 0, flags [DF], proto TCP (6), length 1048)
    127.0.0.1.11950 > 127.0.0.1.39326: Flags [P.], cksum 0x020d (incorrect -> 0x9a2a), seq 255961:256957, ack 964, win 512, options [nop,nop,TS val 326292788 ecr 326292786], length 996
2022-04-06 11:20:10.285209 IP (tos 0x0, ttl 64, id 60878, offset 0, flags [DF], proto TCP (6), length 52)
    127.0.0.1.39326 > 127.0.0.1.11950: Flags [.], cksum 0xfe28 (incorrect -> 0x1fb6), seq 964, ack 256957, win 512, options [nop,nop,TS val 326292788 ecr 326292788], length 0
2022-04-06 11:20:10.294794 IP (tos 0x0, ttl 64, id 59234, offset 0, flags [DF], proto TCP (6), length 4036)
    127.0.0.1.11950 > 127.0.0.1.39326: Flags [P.], cksum 0x0db9 (incorrect -> 0xe8be), seq 256957:260941, ack 964, win 512, options [nop,nop,TS val 326292797 ecr 326292788], length 3984
2022-04-06 11:20:10.294809 IP (tos 0x0, ttl 64, id 60879, offset 0, flags [DF], proto TCP (6), length 52)
    127.0.0.1.39326 > 127.0.0.1.11950: Flags [.], cksum 0xfe28 (incorrect -> 0x1014), seq 964, ack 260941, win 512, options [nop,nop,TS val 326292797 ecr 326292797], length 0
2022-04-06 11:20:10.301122 IP (tos 0x0, ttl 64, id 59235, offset 0, flags [DF], proto TCP (6), length 3538)
    127.0.0.1.11950 > 127.0.0.1.39326: Flags [P.], cksum 0x0bc7 (incorrect -> 0x6432), seq 260941:264427, ack 964, win 512, options [nop,nop,TS val 326292804 ecr 326292797], length 3486
2022-04-06 11:20:10.301141 IP (tos 0x0, ttl 64, id 60880, offset 0, flags [DF], proto TCP (6), length 52)
    127.0.0.1.39326 > 127.0.0.1.11950: Flags [.], cksum 0xfe28 (incorrect -> 0x0268), seq 964, ack 264427, win 512, options [nop,nop,TS val 326292804 ecr 326292804], length 0
2022-04-06 11:20:10.301187 IP (tos 0x0, ttl 64, id 59236, offset 0, flags [DF], proto TCP (6), length 4036)
    127.0.0.1.11950 > 127.0.0.1.39326: Flags [P.], cksum 0x0db9 (incorrect -> 0x1bf5), seq 264427:268411, ack 964, win 512, options [nop,nop,TS val 326292804 ecr 326292804], length 3984
2022-04-06 11:20:10.301199 IP (tos 0x0, ttl 64, id 60881, offset 0, flags [DF], proto TCP (6), length 52)
    127.0.0.1.39326 > 127.0.0.1.11950: Flags [.], cksum 0xfe28 (incorrect -> 0xf2d7), seq 964, ack 268411, win 512, options [nop,nop,TS val 326292804 ecr 326292804], length 0
2022-04-06 11:20:10.303579 IP (tos 0x0, ttl 64, id 59237, offset 0, flags [DF], proto TCP (6), length 4036)
    127.0.0.1.11950 > 127.0.0.1.39326: Flags [P.], cksum 0x0db9 (incorrect -> 0x2940), seq 268411:272395, ack 964, win 512, options [nop,nop,TS val 326292806 ecr 326292804], length 3984
2022-04-06 11:20:10.346661 IP (tos 0x0, ttl 64, id 60882, offset 0, flags [DF], proto TCP (6), length 52)
    127.0.0.1.39326 > 127.0.0.1.11950: Flags [.], cksum 0xfe28 (incorrect -> 0xe318), seq 964, ack 272395, win 512, options [nop,nop,TS val 326292849 ecr 326292806], length 0
2022-04-06 11:20:10.346671 IP (tos 0x0, ttl 64, id 59238, offset 0, flags [DF], proto TCP (6), length 14758)
    127.0.0.1.11950 > 127.0.0.1.39326: Flags [P.], cksum 0x379b (incorrect -> 0xe298), seq 272395:287101, ack 964, win 512, options [nop,nop,TS val 326292849 ecr 326292849], length 14706
2022-04-06 11:20:10.390660 IP (tos 0x0, ttl 64, id 60883, offset 0, flags [DF], proto TCP (6), length 52)
    127.0.0.1.39326 > 127.0.0.1.11950: Flags [.], cksum 0xfe28 (incorrect -> 0xa94f), seq 964, ack 287101, win 512, options [nop,nop,TS val 326292893 ecr 326292849], length 0
2022-04-06 11:20:10.390677 IP (tos 0x0, ttl 64, id 59239, offset 0, flags [DF], proto TCP (6), length 30928)
    127.0.0.1.11950 > 127.0.0.1.39326: Flags [P.], cksum 0x76c5 (incorrect -> 0x7130), seq 287101:317977, ack 964, win 512, options [nop,nop,TS val 326292893 ecr 326292893], length 30876
2022-04-06 11:20:10.422019 IP (tos 0x0, ttl 64, id 59240, offset 0, flags [DF], proto TCP (6), length 32820)
    127.0.0.1.11950 > 127.0.0.1.39326: Flags [.], cksum 0x7e29 (incorrect -> 0xedd4), seq 317977:350745, ack 964, win 512, options [nop,nop,TS val 326292924 ecr 326292893], length 32768
2022-04-06 11:20:10.422086 IP (tos 0x0, ttl 64, id 60884, offset 0, flags [DF], proto TCP (6), length 52)
    127.0.0.1.39326 > 127.0.0.1.11950: Flags [.], cksum 0xfe28 (incorrect -> 0xb0eb), seq 964, ack 350745, win 379, options [nop,nop,TS val 326292925 ecr 326292893], length 0
2022-04-06 11:20:10.422104 IP (tos 0x0, ttl 64, id 59241, offset 0, flags [DF], proto TCP (6), length 444)
    127.0.0.1.11950 > 127.0.0.1.39326: Flags [P.], cksum 0xffb0 (incorrect -> 0x0a34), seq 350745:351137, ack 964, win 512, options [nop,nop,TS val 326292925 ecr 326292925], length 392
2022-04-06 11:20:10.422471 IP (tos 0x0, ttl 64, id 60885, offset 0, flags [DF], proto TCP (6), length 52)
    127.0.0.1.39326 > 127.0.0.1.11950: Flags [.], cksum 0xfe28 (incorrect -> 0xaebe), seq 964, ack 351137, win 512, options [nop,nop,TS val 326292925 ecr 326292925], length 0
2022-04-06 11:20:10.426995 IP (tos 0x0, ttl 64, id 59242, offset 0, flags [DF], proto TCP (6), length 2131)
    127.0.0.1.11950 > 127.0.0.1.39326: Flags [P.], cksum 0x0648 (incorrect -> 0x4eb5), seq 351137:353216, ack 964, win 512, options [nop,nop,TS val 326292929 ecr 326292925], length 2079
2022-04-06 11:20:10.427361 IP (tos 0x0, ttl 64, id 60886, offset 0, flags [DF], proto TCP (6), length 52)
    127.0.0.1.39326 > 127.0.0.1.11950: Flags [.], cksum 0xfe28 (incorrect -> 0xa696), seq 964, ack 353216, win 512, options [nop,nop,TS val 326292930 ecr 326292929], length 0
2022-04-06 11:20:10.462865 IP (tos 0x0, ttl 64, id 59243, offset 0, flags [DF], proto TCP (6), length 3538)
    127.0.0.1.11950 > 127.0.0.1.39326: Flags [P.], cksum 0x0bc7 (incorrect -> 0x3fa6), seq 353216:356702, ack 964, win 512, options [nop,nop,TS val 326292965 ecr 326292930], length 3486
2022-04-06 11:20:10.463035 IP (tos 0x0, ttl 64, id 60887, offset 0, flags [DF], proto TCP (6), length 52)
    127.0.0.1.39326 > 127.0.0.1.11950: Flags [.], cksum 0xfe28 (incorrect -> 0x98b1), seq 964, ack 356702, win 512, options [nop,nop,TS val 326292965 ecr 326292965], length 0
2022-04-06 11:20:10.470902 IP (tos 0x0, ttl 64, id 59244, offset 0, flags [DF], proto TCP (6), length 4100)
    127.0.0.1.11950 > 127.0.0.1.39326: Flags [P.], cksum 0x0df9 (incorrect -> 0x14f7), seq 356702:360750, ack 964, win 512, options [nop,nop,TS val 326292973 ecr 326292965], length 4048
2022-04-06 11:20:10.470925 IP (tos 0x0, ttl 64, id 60888, offset 0, flags [DF], proto TCP (6), length 52)
    127.0.0.1.39326 > 127.0.0.1.11950: Flags [.], cksum 0xfe28 (incorrect -> 0x84d2), seq 964, ack 360750, win 1535, options [nop,nop,TS val 326292973 ecr 326292973], length 0
2022-04-06 11:20:10.470941 IP (tos 0x0, ttl 64, id 59245, offset 0, flags [DF], proto TCP (6), length 3474)
    127.0.0.1.11950 > 127.0.0.1.39326: Flags [P.], cksum 0x0b87 (incorrect -> 0x9ebe), seq 360750:364172, ack 964, win 512, options [nop,nop,TS val 326292973 ecr 326292973], length 3422
2022-04-06 11:20:10.470947 IP (tos 0x0, ttl 64, id 60889, offset 0, flags [DF], proto TCP (6), length 52)
    127.0.0.1.39326 > 127.0.0.1.11950: Flags [.], cksum 0xfe28 (incorrect -> 0x7374), seq 964, ack 364172, win 2559, options [nop,nop,TS val 326292973 ecr 326292973], length 0
2022-04-06 11:20:10.471000 IP (tos 0x0, ttl 64, id 59246, offset 0, flags [DF], proto TCP (6), length 4036)
    127.0.0.1.11950 > 127.0.0.1.39326: Flags [P.], cksum 0x0db9 (incorrect -> 0xa2b6), seq 364172:368156, ack 964, win 512, options [nop,nop,TS val 326292973 ecr 326292973], length 3984
2022-04-06 11:20:10.471004 IP (tos 0x0, ttl 64, id 60890, offset 0, flags [DF], proto TCP (6), length 52)
    127.0.0.1.39326 > 127.0.0.1.11950: Flags [.], cksum 0xfe28 (incorrect -> 0x5fe5), seq 964, ack 368156, win 3582, options [nop,nop,TS val 326292973 ecr 326292973], length 0
2022-04-06 11:20:10.471068 IP (tos 0x0, ttl 64, id 59247, offset 0, flags [DF], proto TCP (6), length 4036)
    127.0.0.1.11950 > 127.0.0.1.39326: Flags [P.], cksum 0x0db9 (incorrect -> 0x02da), seq 368156:372140, ack 964, win 512, options [nop,nop,TS val 326292974 ecr 326292973], length 3984
2022-04-06 11:20:10.471073 IP (tos 0x0, ttl 64, id 60891, offset 0, flags [DF], proto TCP (6), length 52)
    127.0.0.1.39326 > 127.0.0.1.11950: Flags [.], cksum 0xfe28 (incorrect -> 0x4c54), seq 964, ack 372140, win 4605, options [nop,nop,TS val 326292974 ecr 326292974], length 0
2022-04-06 11:20:10.473073 IP (tos 0x0, ttl 64, id 59248, offset 0, flags [DF], proto TCP (6), length 4100)
    127.0.0.1.11950 > 127.0.0.1.39326: Flags [P.], cksum 0x0df9 (incorrect -> 0x3cc5), seq 372140:376188, ack 964, win 512, options [nop,nop,TS val 326292976 ecr 326292974], length 4048
2022-04-06 11:20:10.473084 IP (tos 0x0, ttl 64, id 60892, offset 0, flags [DF], proto TCP (6), length 52)
    127.0.0.1.39326 > 127.0.0.1.11950: Flags [.], cksum 0xfe28 (incorrect -> 0x3881), seq 964, ack 376188, win 5628, options [nop,nop,TS val 326292976 ecr 326292976], length 0
2022-04-06 11:20:10.473092 IP (tos 0x0, ttl 64, id 59249, offset 0, flags [DF], proto TCP (6), length 486)
    127.0.0.1.11950 > 127.0.0.1.39326: Flags [P.], cksum 0xffda (incorrect -> 0xb06f), seq 376188:376622, ack 964, win 512, options [nop,nop,TS val 326292976 ecr 326292976], length 434
2022-04-06 11:20:10.473097 IP (tos 0x0, ttl 64, id 60893, offset 0, flags [DF], proto TCP (6), length 52)
    127.0.0.1.39326 > 127.0.0.1.11950: Flags [.], cksum 0xfe28 (incorrect -> 0x3690), seq 964, ack 376622, win 5691, options [nop,nop,TS val 326292976 ecr 326292976], length 0
2022-04-06 11:20:10.476724 IP (tos 0x0, ttl 64, id 59250, offset 0, flags [DF], proto TCP (6), length 4036)
    127.0.0.1.11950 > 127.0.0.1.39326: Flags [P.], cksum 0x0db9 (incorrect -> 0xbe67), seq 376622:380606, ack 964, win 512, options [nop,nop,TS val 326292979 ecr 326292976], length 3984
2022-04-06 11:20:10.476731 IP (tos 0x0, ttl 64, id 60894, offset 0, flags [DF], proto TCP (6), length 52)
    127.0.0.1.39326 > 127.0.0.1.11950: Flags [.], cksum 0xfe28 (incorrect -> 0x22fb), seq 964, ack 380606, win 6714, options [nop,nop,TS val 326292979 ecr 326292979], length 0
2022-04-06 11:20:10.483130 IP (tos 0x0, ttl 64, id 59251, offset 0, flags [DF], proto TCP (6), length 3538)
    127.0.0.1.11950 > 127.0.0.1.39326: Flags [P.], cksum 0x0bc7 (incorrect -> 0x3606), seq 380606:384092, ack 964, win 512, options [nop,nop,TS val 326292986 ecr 326292979], length 3486
2022-04-06 11:20:10.483140 IP (tos 0x0, ttl 64, id 60895, offset 0, flags [DF], proto TCP (6), length 52)
    127.0.0.1.39326 > 127.0.0.1.11950: Flags [.], cksum 0xfe28 (incorrect -> 0x114f), seq 964, ack 384092, win 7738, options [nop,nop,TS val 326292986 ecr 326292986], length 0
2022-04-06 11:20:10.483184 IP (tos 0x0, ttl 64, id 59252, offset 0, flags [DF], proto TCP (6), length 4036)
    127.0.0.1.11950 > 127.0.0.1.39326: Flags [P.], cksum 0x0db9 (incorrect -> 0x5ff2), seq 384092:388076, ack 964, win 512, options [nop,nop,TS val 326292986 ecr 326292986], length 3984
2022-04-06 11:20:10.483189 IP (tos 0x0, ttl 64, id 60896, offset 0, flags [DF], proto TCP (6), length 52)
    127.0.0.1.39326 > 127.0.0.1.11950: Flags [.], cksum 0xfe28 (incorrect -> 0xfdbf), seq 964, ack 388076, win 8761, options [nop,nop,TS val 326292986 ecr 326292986], length 0
2022-04-06 11:20:10.486424 IP (tos 0x0, ttl 64, id 59253, offset 0, flags [DF], proto TCP (6), length 4036)
    127.0.0.1.11950 > 127.0.0.1.39326: Flags [P.], cksum 0x0db9 (incorrect -> 0x1a92), seq 388076:392060, ack 964, win 512, options [nop,nop,TS val 326292989 ecr 326292986], length 3984
2022-04-06 11:20:10.486430 IP (tos 0x0, ttl 64, id 60897, offset 0, flags [DF], proto TCP (6), length 52)
    127.0.0.1.39326 > 127.0.0.1.11950: Flags [.], cksum 0xfe28 (incorrect -> 0xec7a), seq 964, ack 392060, win 9192, options [nop,nop,TS val 326292989 ecr 326292989], length 0
2022-04-06 11:20:10.488018 IP (tos 0x0, ttl 64, id 59254, offset 0, flags [DF], proto TCP (6), length 4100)
    127.0.0.1.11950 > 127.0.0.1.39326: Flags [P.], cksum 0x0df9 (incorrect -> 0x287a), seq 392060:396108, ack 964, win 512, options [nop,nop,TS val 326292990 ecr 326292989], length 4048
2022-04-06 11:20:10.530662 IP (tos 0x0, ttl 64, id 60898, offset 0, flags [DF], proto TCP (6), length 52)
    127.0.0.1.39326 > 127.0.0.1.11950: Flags [.], cksum 0xfe28 (incorrect -> 0xdc7d), seq 964, ack 396108, win 9192, options [nop,nop,TS val 326293033 ecr 326292990], length 0
2022-04-06 11:20:10.530670 IP (tos 0x0, ttl 64, id 59255, offset 0, flags [DF], proto TCP (6), length 6713)
    127.0.0.1.11950 > 127.0.0.1.39326: Flags [P.], cksum 0x182e (incorrect -> 0x48ff), seq 396108:402769, ack 964, win 512, options [nop,nop,TS val 326293033 ecr 326293033], length 6661
2022-04-06 11:20:10.574655 IP (tos 0x0, ttl 64, id 60899, offset 0, flags [DF], proto TCP (6), length 52)
    127.0.0.1.39326 > 127.0.0.1.11950: Flags [.], cksum 0xfe28 (incorrect -> 0xc221), seq 964, ack 402769, win 9192, options [nop,nop,TS val 326293077 ecr 326293033], length 0
200, 3.806562900543213, 2.2696263790130615