2022-04-06 07:56:02.384658 IP (tos 0x0, ttl 64, id 10604, offset 0, flags [DF], proto TCP (6), length 60)
    127.0.0.1.58648 > 127.0.0.1.10750: Flags [S], cksum 0xfe30 (incorrect -> 0x3573), seq 2354870924, win 65495, options [mss 65495,sackOK,TS val 314044887 ecr 0,nop,wscale 7], length 0
2022-04-06 07:56:02.384670 IP (tos 0x0, ttl 64, id 0, offset 0, flags [DF], proto TCP (6), length 60)
    127.0.0.1.10750 > 127.0.0.1.58648: Flags [S.], cksum 0xfe30 (incorrect -> 0xaf75), seq 432629664, ack 2354870925, win 65483, options [mss 65495,sackOK,TS val 314044887 ecr 314044887,nop,wscale 7], length 0
2022-04-06 07:56:02.384681 IP (tos 0x0, ttl 64, id 10605, offset 0, flags [DF], proto TCP (6), length 52)
    127.0.0.1.58648 > 127.0.0.1.10750: Flags [.], cksum 0xfe28 (incorrect -> 0xd631), seq 1, ack 1, win 512, options [nop,nop,TS val 314044887 ecr 314044887], length 0
2022-04-06 07:56:02.384780 IP (tos 0x0, ttl 64, id 10606, offset 0, flags [DF], proto TCP (6), length 55)
    127.0.0.1.58648 > 127.0.0.1.10750: Flags [P.], cksum 0xfe2b (incorrect -> 0xd125), seq 1:4, ack 1, win 512, options [nop,nop,TS val 314044887 ecr 314044887], length 3
2022-04-06 07:56:02.384783 IP (tos 0x0, ttl 64, id 49801, offset 0, flags [DF], proto TCP (6), length 52)
    127.0.0.1.10750 > 127.0.0.1.58648: Flags [.], cksum 0xfe28 (incorrect -> 0xd62e), seq 1, ack 4, win 512, options [nop,nop,TS val 314044887 ecr 314044887], length 0
2022-04-06 07:56:02.384900 IP (tos 0x0, ttl 64, id 49802, offset 0, flags [DF], proto TCP (6), length 54)
    127.0.0.1.10750 > 127.0.0.1.58648: Flags [P.], cksum 0xfe2a (incorrect -> 0xd124), seq 1:3, ack 4, win 512, options [nop,nop,TS val 314044887 ecr 314044887], length 2
2022-04-06 07:56:02.384924 IP (tos 0x0, ttl 64, id 10607, offset 0, flags [DF], proto TCP (6), length 52)
    127.0.0.1.58648 > 127.0.0.1.10750: Flags [.], cksum 0xfe28 (incorrect -> 0xd62c), seq 4, ack 3, win 512, options [nop,nop,TS val 314044887 ecr 314044887], length 0
2022-04-06 07:56:02.420616 IP (tos 0x0, ttl 64, id 10608, offset 0, flags [DF], proto TCP (6), length 62)
    127.0.0.1.58648 > 127.0.0.1.10750: Flags [P.], cksum 0xfe32 (incorrect -> 0x7711), seq 4:14, ack 3, win 512, options [nop,nop,TS val 314044923 ecr 314044887], length 10
2022-04-06 07:56:02.420635 IP (tos 0x0, ttl 64, id 49803, offset 0, flags [DF], proto TCP (6), length 52)
    127.0.0.1.10750 > 127.0.0.1.58648: Flags [.], cksum 0xfe28 (incorrect -> 0xd5da), seq 3, ack 14, win 512, options [nop,nop,TS val 314044923 ecr 314044923], length 0
200, 124.72830247879028, 0.8603603839874268