2022-04-06 23:03:31.930731 IP (tos 0x0, ttl 64, id 7558, offset 0, flags [DF], proto TCP (6), length 60)
    127.0.0.1.32976 > 127.0.0.1.9550: Flags [S], cksum 0xfe30 (incorrect -> 0x5e38), seq 1954347478, win 65495, options [mss 65495,sackOK,TS val 368494433 ecr 0,nop,wscale 7], length 0
2022-04-06 23:03:31.930743 IP (tos 0x0, ttl 64, id 0, offset 0, flags [DF], proto TCP (6), length 60)
    127.0.0.1.9550 > 127.0.0.1.32976: Flags [S.], cksum 0xfe30 (incorrect -> 0x9502), seq 2386582936, ack 1954347479, win 65483, options [mss 65495,sackOK,TS val 368494433 ecr 368494433,nop,wscale 7], length 0
2022-04-06 23:03:31.930753 IP (tos 0x0, ttl 64, id 7559, offset 0, flags [DF], proto TCP (6), length 52)
    127.0.0.1.32976 > 127.0.0.1.9550: Flags [.], cksum 0xfe28 (incorrect -> 0xbbbe), seq 1, ack 1, win 512, options [nop,nop,TS val 368494433 ecr 368494433], length 0
2022-04-06 23:03:31.930844 IP (tos 0x0, ttl 64, id 7560, offset 0, flags [DF], proto TCP (6), length 55)
    127.0.0.1.32976 > 127.0.0.1.9550: Flags [P.], cksum 0xfe2b (incorrect -> 0xb6b2), seq 1:4, ack 1, win 512, options [nop,nop,TS val 368494433 ecr 368494433], length 3
2022-04-06 23:03:31.930852 IP (tos 0x0, ttl 64, id 39017, offset 0, flags [DF], proto TCP (6), length 52)
    127.0.0.1.9550 > 127.0.0.1.32976: Flags [.], cksum 0xfe28 (incorrect -> 0xbbbb), seq 1, ack 4, win 512, options [nop,nop,TS val 368494433 ecr 368494433], length 0
2022-04-06 23:03:31.930906 IP (tos 0x0, ttl 64, id 39018, offset 0, flags [DF], proto TCP (6), length 54)
    127.0.0.1.9550 > 127.0.0.1.32976: Flags [P.], cksum 0xfe2a (incorrect -> 0xb6b1), seq 1:3, ack 4, win 512, options [nop,nop,TS val 368494433 ecr 368494433], length 2
2022-04-06 23:03:31.930923 IP (tos 0x0, ttl 64, id 7561, offset 0, flags [DF], proto TCP (6), length 52)
    127.0.0.1.32976 > 127.0.0.1.9550: Flags [.], cksum 0xfe28 (incorrect -> 0xbbb9), seq 4, ack 3, win 512, options [nop,nop,TS val 368494433 ecr 368494433], length 0
2022-04-06 23:03:31.932712 IP (tos 0x0, ttl 64, id 7562, offset 0, flags [DF], proto TCP (6), length 62)
    127.0.0.1.32976 > 127.0.0.1.9550: Flags [P.], cksum 0xfe32 (incorrect -> 0x209c), seq 4:14, ack 3, win 512, options [nop,nop,TS val 368494435 ecr 368494433], length 10
2022-04-06 23:03:31.932718 IP (tos 0x0, ttl 64, id 39019, offset 0, flags [DF], proto TCP (6), length 52)
    127.0.0.1.9550 > 127.0.0.1.32976: Flags [.], cksum 0xfe28 (incorrect -> 0xbbab), seq 3, ack 14, win 512, options [nop,nop,TS val 368494435 ecr 368494435], length 0
2022-04-06 23:03:32.009621 IP (tos 0x0, ttl 64, id 39020, offset 0, flags [DF], proto TCP (6), length 62)
    127.0.0.1.9550 > 127.0.0.1.32976: Flags [P.], cksum 0xfe32 (incorrect -> 0xb64b), seq 3:13, ack 14, win 512, options [nop,nop,TS val 368494512 ecr 368494435], length 10
2022-04-06 23:03:32.009637 IP (tos 0x0, ttl 64, id 7563, offset 0, flags [DF], proto TCP (6), length 52)
    127.0.0.1.32976 > 127.0.0.1.9550: Flags [.], cksum 0xfe28 (incorrect -> 0xbb07), seq 14, ack 13, win 512, options [nop,nop,TS val 368494512 ecr 368494512], length 0
2022-04-06 23:03:32.015673 IP (tos 0x0, ttl 64, id 7564, offset 0, flags [DF], proto TCP (6), length 569)
    127.0.0.1.32976 > 127.0.0.1.9550: Flags [P.], cksum 0x002e (incorrect -> 0x4735), seq 14:531, ack 13, win 512, options [nop,nop,TS val 368494518 ecr 368494512], length 517
2022-04-06 23:03:32.015691 IP (tos 0x0, ttl 64, id 39021, offset 0, flags [DF], proto TCP (6), length 52)
    127.0.0.1.9550 > 127.0.0.1.32976: Flags [.], cksum 0xfe28 (incorrect -> 0xb8fa), seq 13, ack 531, win 508, options [nop,nop,TS val 368494518 ecr 368494518], length 0
2022-04-06 23:03:32.103265 IP (tos 0x0, ttl 64, id 39022, offset 0, flags [DF], proto TCP (6), length 3538)
    127.0.0.1.9550 > 127.0.0.1.32976: Flags [P.], cksum 0x0bc7 (incorrect -> 0x4ce7), seq 13:3499, ack 531, win 512, options [nop,nop,TS val 368494606 ecr 368494518], length 3486
2022-04-06 23:03:32.103276 IP (tos 0x0, ttl 64, id 7565, offset 0, flags [DF], proto TCP (6), length 52)
    127.0.0.1.32976 > 127.0.0.1.9550: Flags [.], cksum 0xfe28 (incorrect -> 0xaaba), seq 531, ack 3499, win 494, options [nop,nop,TS val 368494606 ecr 368494606], length 0
2022-04-06 23:03:32.153717 IP (tos 0x0, ttl 64, id 39023, offset 0, flags [DF], proto TCP (6), length 781)
    127.0.0.1.9550 > 127.0.0.1.32976: Flags [P.], cksum 0x0102 (incorrect -> 0x6d53), seq 3499:4228, ack 531, win 512, options [nop,nop,TS val 368494656 ecr 368494606], length 729
2022-04-06 23:03:32.153724 IP (tos 0x0, ttl 64, id 7566, offset 0, flags [DF], proto TCP (6), length 52)
    127.0.0.1.32976 > 127.0.0.1.9550: Flags [.], cksum 0xfe28 (incorrect -> 0xa772), seq 531, ack 4228, win 505, options [nop,nop,TS val 368494656 ecr 368494656], length 0
2022-04-06 23:03:32.154198 IP (tos 0x0, ttl 64, id 7567, offset 0, flags [DF], proto TCP (6), length 132)
    127.0.0.1.32976 > 127.0.0.1.9550: Flags [P.], cksum 0xfe78 (incorrect -> 0xeaa5), seq 531:611, ack 4228, win 512, options [nop,nop,TS val 368494657 ecr 368494656], length 80
2022-04-06 23:03:32.154206 IP (tos 0x0, ttl 64, id 39024, offset 0, flags [DF], proto TCP (6), length 52)
    127.0.0.1.9550 > 127.0.0.1.32976: Flags [.], cksum 0xfe28 (incorrect -> 0xa719), seq 4228, ack 611, win 512, options [nop,nop,TS val 368494657 ecr 368494657], length 0
2022-04-06 23:03:32.154696 IP (tos 0x0, ttl 64, id 7568, offset 0, flags [DF], proto TCP (6), length 313)
    127.0.0.1.32976 > 127.0.0.1.9550: Flags [P.], cksum 0xff2d (incorrect -> 0x267b), seq 611:872, ack 4228, win 512, options [nop,nop,TS val 368494657 ecr 368494657], length 261
2022-04-06 23:03:32.154709 IP (tos 0x0, ttl 64, id 39025, offset 0, flags [DF], proto TCP (6), length 52)
    127.0.0.1.9550 > 127.0.0.1.32976: Flags [.], cksum 0xfe28 (incorrect -> 0xa616), seq 4228, ack 872, win 510, options [nop,nop,TS val 368494657 ecr 368494657], length 0
2022-04-06 23:03:32.222480 IP (tos 0x0, ttl 64, id 39026, offset 0, flags [DF], proto TCP (6), length 323)
    127.0.0.1.9550 > 127.0.0.1.32976: Flags [P.], cksum 0xff37 (incorrect -> 0xf6fb), seq 4228:4499, ack 872, win 512, options [nop,nop,TS val 368494725 ecr 368494657], length 271
2022-04-06 23:03:32.222487 IP (tos 0x0, ttl 64, id 7569, offset 0, flags [DF], proto TCP (6), length 52)
    127.0.0.1.32976 > 127.0.0.1.9550: Flags [.], cksum 0xfe28 (incorrect -> 0xa47f), seq 872, ack 4499, win 510, options [nop,nop,TS val 368494725 ecr 368494725], length 0
2022-04-06 23:03:32.263054 IP (tos 0x0, ttl 64, id 39027, offset 0, flags [DF], proto TCP (6), length 3311)
    127.0.0.1.9550 > 127.0.0.1.32976: Flags [P.], cksum 0x0ae4 (incorrect -> 0x733e), seq 4499:7758, ack 872, win 512, options [nop,nop,TS val 368494765 ecr 368494725], length 3259
2022-04-06 23:03:32.263063 IP (tos 0x0, ttl 64, id 7570, offset 0, flags [DF], proto TCP (6), length 52)
    127.0.0.1.32976 > 127.0.0.1.9550: Flags [.], cksum 0xfe28 (incorrect -> 0x9782), seq 872, ack 7758, win 495, options [nop,nop,TS val 368494766 ecr 368494765], length 0
2022-04-06 23:03:32.267194 IP (tos 0x0, ttl 64, id 39028, offset 0, flags [DF], proto TCP (6), length 1048)
    127.0.0.1.9550 > 127.0.0.1.32976: Flags [P.], cksum 0x020d (incorrect -> 0x9c76), seq 7758:8754, ack 872, win 512, options [nop,nop,TS val 368494770 ecr 368494766], length 996
2022-04-06 23:03:32.267198 IP (tos 0x0, ttl 64, id 7571, offset 0, flags [DF], proto TCP (6), length 52)
    127.0.0.1.32976 > 127.0.0.1.9550: Flags [.], cksum 0xfe28 (incorrect -> 0x938c), seq 872, ack 8754, win 504, options [nop,nop,TS val 368494770 ecr 368494770], length 0
2022-04-06 23:03:32.274856 IP (tos 0x0, ttl 64, id 39029, offset 0, flags [DF], proto TCP (6), length 4100)
    127.0.0.1.9550 > 127.0.0.1.32976: Flags [P.], cksum 0x0df9 (incorrect -> 0x99b1), seq 8754:12802, ack 872, win 512, options [nop,nop,TS val 368494777 ecr 368494770], length 4048
2022-04-06 23:03:32.274860 IP (tos 0x0, ttl 64, id 7572, offset 0, flags [DF], proto TCP (6), length 52)
    127.0.0.1.32976 > 127.0.0.1.9550: Flags [.], cksum 0xfe28 (incorrect -> 0x83ba), seq 872, ack 12802, win 492, options [nop,nop,TS val 368494777 ecr 368494777], length 0
2022-04-06 23:03:32.274865 IP (tos 0x0, ttl 64, id 39030, offset 0, flags [DF], proto TCP (6), length 486)
    127.0.0.1.9550 > 127.0.0.1.32976: Flags [P.], cksum 0xffda (incorrect -> 0xec16), seq 12802:13236, ack 872, win 512, options [nop,nop,TS val 368494777 ecr 368494777], length 434
2022-04-06 23:03:32.274867 IP (tos 0x0, ttl 64, id 7573, offset 0, flags [DF], proto TCP (6), length 52)
    127.0.0.1.32976 > 127.0.0.1.9550: Flags [.], cksum 0xfe28 (incorrect -> 0x820a), seq 872, ack 13236, win 490, options [nop,nop,TS val 368494777 ecr 368494777], length 0
2022-04-06 23:03:32.281350 IP (tos 0x0, ttl 64, id 39031, offset 0, flags [DF], proto TCP (6), length 3040)
    127.0.0.1.9550 > 127.0.0.1.32976: Flags [P.], cksum 0x09d5 (incorrect -> 0x1a08), seq 13236:16224, ack 872, win 512, options [nop,nop,TS val 368494784 ecr 368494777], length 2988
2022-04-06 23:03:32.281354 IP (tos 0x0, ttl 64, id 7574, offset 0, flags [DF], proto TCP (6), length 52)
    127.0.0.1.32976 > 127.0.0.1.9550: Flags [.], cksum 0xfe28 (incorrect -> 0x764a), seq 872, ack 16224, win 496, options [nop,nop,TS val 368494784 ecr 368494784], length 0
2022-04-06 23:03:32.282063 IP (tos 0x0, ttl 64, id 39032, offset 0, flags [DF], proto TCP (6), length 3198)
    127.0.0.1.9550 > 127.0.0.1.32976: Flags [P.], cksum 0x0a73 (incorrect -> 0xb6e2), seq 16224:19370, ack 872, win 512, options [nop,nop,TS val 368494785 ecr 368494784], length 3146
2022-04-06 23:03:32.282067 IP (tos 0x0, ttl 64, id 7575, offset 0, flags [DF], proto TCP (6), length 52)
    127.0.0.1.32976 > 127.0.0.1.9550: Flags [.], cksum 0xfe28 (incorrect -> 0x69ff), seq 872, ack 19370, win 495, options [nop,nop,TS val 368494785 ecr 368494785], length 0
2022-04-06 23:03:32.283606 IP (tos 0x0, ttl 64, id 39033, offset 0, flags [DF], proto TCP (6), length 4100)
    127.0.0.1.9550 > 127.0.0.1.32976: Flags [P.], cksum 0x0df9 (incorrect -> 0xbdb2), seq 19370:23418, ack 872, win 512, options [nop,nop,TS val 368494786 ecr 368494785], length 4048
2022-04-06 23:03:32.283610 IP (tos 0x0, ttl 64, id 7576, offset 0, flags [DF], proto TCP (6), length 52)
    127.0.0.1.32976 > 127.0.0.1.9550: Flags [.], cksum 0xfe28 (incorrect -> 0x5a30), seq 872, ack 23418, win 492, options [nop,nop,TS val 368494786 ecr 368494786], length 0
2022-04-06 23:03:32.283614 IP (tos 0x0, ttl 64, id 39034, offset 0, flags [DF], proto TCP (6), length 418)
    127.0.0.1.9550 > 127.0.0.1.32976: Flags [P.], cksum 0xff96 (incorrect -> 0xa0ab), seq 23418:23784, ack 872, win 512, options [nop,nop,TS val 368494786 ecr 368494786], length 366
2022-04-06 23:03:32.284745 IP (tos 0x0, ttl 64, id 7577, offset 0, flags [DF], proto TCP (6), length 52)
    127.0.0.1.32976 > 127.0.0.1.9550: Flags [.], cksum 0xfe28 (incorrect -> 0x58ad), seq 872, ack 23784, win 512, options [nop,nop,TS val 368494787 ecr 368494786], length 0
2022-04-06 23:03:32.284821 IP (tos 0x0, ttl 64, id 39035, offset 0, flags [DF], proto TCP (6), length 3470)
    127.0.0.1.9550 > 127.0.0.1.32976: Flags [P.], cksum 0x0b83 (incorrect -> 0xab6c), seq 23784:27202, ack 872, win 512, options [nop,nop,TS val 368494787 ecr 368494787], length 3418
2022-04-06 23:03:32.284834 IP (tos 0x0, ttl 64, id 7578, offset 0, flags [DF], proto TCP (6), length 52)
    127.0.0.1.32976 > 127.0.0.1.9550: Flags [.], cksum 0xfe28 (incorrect -> 0x4b52), seq 872, ack 27202, win 512, options [nop,nop,TS val 368494787 ecr 368494787], length 0
2022-04-06 23:03:32.286621 IP (tos 0x0, ttl 64, id 39036, offset 0, flags [DF], proto TCP (6), length 4100)
    127.0.0.1.9550 > 127.0.0.1.32976: Flags [P.], cksum 0x0df9 (incorrect -> 0xdbdb), seq 27202:31250, ack 872, win 512, options [nop,nop,TS val 368494789 ecr 368494787], length 4048
2022-04-06 23:03:32.306166 IP (tos 0x0, ttl 64, id 39037, offset 0, flags [DF], proto TCP (6), length 32820)
    127.0.0.1.9550 > 127.0.0.1.32976: Flags [.], cksum 0x7e29 (incorrect -> 0xe601), seq 31250:64018, ack 872, win 512, options [nop,nop,TS val 368494809 ecr 368494787], length 32768
2022-04-06 23:03:32.306187 IP (tos 0x0, ttl 64, id 7579, offset 0, flags [DF], proto TCP (6), length 52)
    127.0.0.1.32976 > 127.0.0.1.9550: Flags [.], cksum 0xfe28 (incorrect -> 0xbbee), seq 872, ack 64018, win 379, options [nop,nop,TS val 368494809 ecr 368494789], length 0
2022-04-06 23:03:32.306191 IP (tos 0x0, ttl 64, id 39038, offset 0, flags [DF], proto TCP (6), length 698)
    127.0.0.1.9550 > 127.0.0.1.32976: Flags [P.], cksum 0x00af (incorrect -> 0x761e), seq 64018:64664, ack 872, win 512, options [nop,nop,TS val 368494809 ecr 368494809], length 646
2022-04-06 23:03:32.306769 IP (tos 0x0, ttl 64, id 7580, offset 0, flags [DF], proto TCP (6), length 52)
    127.0.0.1.32976 > 127.0.0.1.9550: Flags [.], cksum 0xfe28 (incorrect -> 0xb8cf), seq 872, ack 64664, win 512, options [nop,nop,TS val 368494809 ecr 368494809], length 0
2022-04-06 23:03:32.307933 IP (tos 0x0, ttl 64, id 39039, offset 0, flags [DF], proto TCP (6), length 3968)
    127.0.0.1.9550 > 127.0.0.1.32976: Flags [P.], cksum 0x0d75 (incorrect -> 0x1993), seq 64664:68580, ack 872, win 512, options [nop,nop,TS val 368494810 ecr 368494809], length 3916
2022-04-06 23:03:32.308307 IP (tos 0x0, ttl 64, id 7581, offset 0, flags [DF], proto TCP (6), length 52)
    127.0.0.1.32976 > 127.0.0.1.9550: Flags [.], cksum 0xfe28 (incorrect -> 0xa980), seq 872, ack 68580, win 512, options [nop,nop,TS val 368494811 ecr 368494810], length 0
2022-04-06 23:03:32.312740 IP (tos 0x0, ttl 64, id 39040, offset 0, flags [DF], proto TCP (6), length 4100)
    127.0.0.1.9550 > 127.0.0.1.32976: Flags [P.], cksum 0x0df9 (incorrect -> 0xc06f), seq 68580:72628, ack 872, win 512, options [nop,nop,TS val 368494815 ecr 368494811], length 4048
2022-04-06 23:03:32.312806 IP (tos 0x0, ttl 64, id 7582, offset 0, flags [DF], proto TCP (6), length 52)
    127.0.0.1.32976 > 127.0.0.1.9550: Flags [.], cksum 0xfe28 (incorrect -> 0x99a7), seq 872, ack 72628, win 512, options [nop,nop,TS val 368494815 ecr 368494815], length 0
2022-04-06 23:03:32.312812 IP (tos 0x0, ttl 64, id 39041, offset 0, flags [DF], proto TCP (6), length 3802)
    127.0.0.1.9550 > 127.0.0.1.32976: Flags [P.], cksum 0x0ccf (incorrect -> 0xbbe6), seq 72628:76378, ack 872, win 512, options [nop,nop,TS val 368494815 ecr 368494815], length 3750
2022-04-06 23:03:32.312817 IP (tos 0x0, ttl 64, id 7583, offset 0, flags [DF], proto TCP (6), length 52)
    127.0.0.1.32976 > 127.0.0.1.9550: Flags [.], cksum 0xfe28 (incorrect -> 0x8b01), seq 872, ack 76378, win 512, options [nop,nop,TS val 368494815 ecr 368494815], length 0
2022-04-06 23:03:32.314430 IP (tos 0x0, ttl 64, id 39042, offset 0, flags [DF], proto TCP (6), length 4100)
    127.0.0.1.9550 > 127.0.0.1.32976: Flags [P.], cksum 0x0df9 (incorrect -> 0x3b5c), seq 76378:80426, ack 872, win 512, options [nop,nop,TS val 368494817 ecr 368494815], length 4048
2022-04-06 23:03:32.314447 IP (tos 0x0, ttl 64, id 7584, offset 0, flags [DF], proto TCP (6), length 52)
    127.0.0.1.32976 > 127.0.0.1.9550: Flags [.], cksum 0xfe28 (incorrect -> 0x7b2d), seq 872, ack 80426, win 512, options [nop,nop,TS val 368494817 ecr 368494817], length 0
2022-04-06 23:03:32.314450 IP (tos 0x0, ttl 64, id 39043, offset 0, flags [DF], proto TCP (6), length 882)
    127.0.0.1.9550 > 127.0.0.1.32976: Flags [P.], cksum 0x0167 (incorrect -> 0x5201), seq 80426:81256, ack 872, win 512, options [nop,nop,TS val 368494817 ecr 368494817], length 830
2022-04-06 23:03:32.314452 IP (tos 0x0, ttl 64, id 7585, offset 0, flags [DF], proto TCP (6), length 52)
    127.0.0.1.32976 > 127.0.0.1.9550: Flags [.], cksum 0xfe28 (incorrect -> 0x77ef), seq 872, ack 81256, win 512, options [nop,nop,TS val 368494817 ecr 368494817], length 0
2022-04-06 23:03:32.316254 IP (tos 0x0, ttl 64, id 39044, offset 0, flags [DF], proto TCP (6), length 3538)
    127.0.0.1.9550 > 127.0.0.1.32976: Flags [P.], cksum 0x0bc7 (incorrect -> 0xf222), seq 81256:84742, ack 872, win 512, options [nop,nop,TS val 368494819 ecr 368494817], length 3486
2022-04-06 23:03:32.316409 IP (tos 0x0, ttl 64, id 7586, offset 0, flags [DF], proto TCP (6), length 52)
    127.0.0.1.32976 > 127.0.0.1.9550: Flags [.], cksum 0xfe28 (incorrect -> 0x6a4d), seq 872, ack 84742, win 512, options [nop,nop,TS val 368494819 ecr 368494819], length 0
2022-04-06 23:03:32.316665 IP (tos 0x0, ttl 64, id 39045, offset 0, flags [DF], proto TCP (6), length 3832)
    127.0.0.1.9550 > 127.0.0.1.32976: Flags [P.], cksum 0x0ced (incorrect -> 0x126c), seq 84742:88522, ack 872, win 512, options [nop,nop,TS val 368494819 ecr 368494819], length 3780
2022-04-06 23:03:32.316676 IP (tos 0x0, ttl 64, id 7587, offset 0, flags [DF], proto TCP (6), length 52)
    127.0.0.1.32976 > 127.0.0.1.9550: Flags [.], cksum 0xfe28 (incorrect -> 0x5b89), seq 872, ack 88522, win 512, options [nop,nop,TS val 368494819 ecr 368494819], length 0
2022-04-06 23:03:32.316750 IP (tos 0x0, ttl 64, id 39046, offset 0, flags [DF], proto TCP (6), length 3040)
    127.0.0.1.9550 > 127.0.0.1.32976: Flags [P.], cksum 0x09d5 (incorrect -> 0x7879), seq 88522:91510, ack 872, win 512, options [nop,nop,TS val 368494819 ecr 368494819], length 2988
2022-04-06 23:03:32.316759 IP (tos 0x0, ttl 64, id 7588, offset 0, flags [DF], proto TCP (6), length 52)
    127.0.0.1.32976 > 127.0.0.1.9550: Flags [.], cksum 0xfe28 (incorrect -> 0x4fdd), seq 872, ack 91510, win 512, options [nop,nop,TS val 368494819 ecr 368494819], length 0
2022-04-06 23:03:32.317317 IP (tos 0x0, ttl 64, id 39047, offset 0, flags [DF], proto TCP (6), length 3538)
    127.0.0.1.9550 > 127.0.0.1.32976: Flags [P.], cksum 0x0bc7 (incorrect -> 0x24b7), seq 91510:94996, ack 872, win 512, options [nop,nop,TS val 368494820 ecr 368494819], length 3486
2022-04-06 23:03:32.317327 IP (tos 0x0, ttl 64, id 7589, offset 0, flags [DF], proto TCP (6), length 52)
    127.0.0.1.32976 > 127.0.0.1.9550: Flags [.], cksum 0xfe28 (incorrect -> 0x423d), seq 872, ack 94996, win 512, options [nop,nop,TS val 368494820 ecr 368494820], length 0
2022-04-06 23:03:32.317431 IP (tos 0x0, ttl 64, id 39048, offset 0, flags [DF], proto TCP (6), length 3266)
    127.0.0.1.9550 > 127.0.0.1.32976: Flags [P.], cksum 0x0ab7 (incorrect -> 0x09b7), seq 94996:98210, ack 872, win 512, options [nop,nop,TS val 368494820 ecr 368494820], length 3214
2022-04-06 23:03:32.317443 IP (tos 0x0, ttl 64, id 7590, offset 0, flags [DF], proto TCP (6), length 52)
    127.0.0.1.32976 > 127.0.0.1.9550: Flags [.], cksum 0xfe28 (incorrect -> 0x35af), seq 872, ack 98210, win 512, options [nop,nop,TS val 368494820 ecr 368494820], length 0
2022-04-06 23:03:32.319256 IP (tos 0x0, ttl 64, id 39049, offset 0, flags [DF], proto TCP (6), length 4036)
    127.0.0.1.9550 > 127.0.0.1.32976: Flags [P.], cksum 0x0db9 (incorrect -> 0x2917), seq 98210:102194, ack 872, win 512, options [nop,nop,TS val 368494822 ecr 368494820], length 3984
2022-04-06 23:03:32.319455 IP (tos 0x0, ttl 64, id 7591, offset 0, flags [DF], proto TCP (6), length 52)
    127.0.0.1.32976 > 127.0.0.1.9550: Flags [.], cksum 0xfe28 (incorrect -> 0x261b), seq 872, ack 102194, win 512, options [nop,nop,TS val 368494822 ecr 368494822], length 0
2022-04-06 23:03:32.320479 IP (tos 0x0, ttl 64, id 39050, offset 0, flags [DF], proto TCP (6), length 4100)
    127.0.0.1.9550 > 127.0.0.1.32976: Flags [P.], cksum 0x0df9 (incorrect -> 0xc6d1), seq 102194:106242, ack 872, win 512, options [nop,nop,TS val 368494823 ecr 368494822], length 4048
2022-04-06 23:03:32.320578 IP (tos 0x0, ttl 64, id 7592, offset 0, flags [DF], proto TCP (6), length 52)
    127.0.0.1.32976 > 127.0.0.1.9550: Flags [.], cksum 0xfe28 (incorrect -> 0x1649), seq 872, ack 106242, win 512, options [nop,nop,TS val 368494823 ecr 368494823], length 0
200, 126.04057717323303, 0.4861781597137451