2022-04-06 19:38:09.395280 IP (tos 0x0, ttl 64, id 9455, offset 0, flags [DF], proto TCP (6), length 60)
    127.0.0.1.50750 > 127.0.0.1.10950: Flags [S], cksum 0xfe30 (incorrect -> 0x638e), seq 1869592138, win 65495, options [mss 65495,sackOK,TS val 356171898 ecr 0,nop,wscale 7], length 0
2022-04-06 19:38:09.395291 IP (tos 0x0, ttl 64, id 0, offset 0, flags [DF], proto TCP (6), length 60)
    127.0.0.1.10950 > 127.0.0.1.50750: Flags [S.], cksum 0xfe30 (incorrect -> 0xe300), seq 1781088426, ack 1869592139, win 65483, options [mss 65495,sackOK,TS val 356171898 ecr 356171898,nop,wscale 7], length 0
2022-04-06 19:38:09.395301 IP (tos 0x0, ttl 64, id 9456, offset 0, flags [DF], proto TCP (6), length 52)
    127.0.0.1.50750 > 127.0.0.1.10950: Flags [.], cksum 0xfe28 (incorrect -> 0x09bd), seq 1, ack 1, win 512, options [nop,nop,TS val 356171898 ecr 356171898], length 0
2022-04-06 19:38:09.395392 IP (tos 0x0, ttl 64, id 9457, offset 0, flags [DF], proto TCP (6), length 55)
    127.0.0.1.50750 > 127.0.0.1.10950: Flags [P.], cksum 0xfe2b (incorrect -> 0x04b1), seq 1:4, ack 1, win 512, options [nop,nop,TS val 356171898 ecr 356171898], length 3
2022-04-06 19:38:09.395397 IP (tos 0x0, ttl 64, id 10985, offset 0, flags [DF], proto TCP (6), length 52)
    127.0.0.1.10950 > 127.0.0.1.50750: Flags [.], cksum 0xfe28 (incorrect -> 0x09ba), seq 1, ack 4, win 512, options [nop,nop,TS val 356171898 ecr 356171898], length 0
2022-04-06 19:38:09.395467 IP (tos 0x0, ttl 64, id 10986, offset 0, flags [DF], proto TCP (6), length 54)
    127.0.0.1.10950 > 127.0.0.1.50750: Flags [P.], cksum 0xfe2a (incorrect -> 0x04b0), seq 1:3, ack 4, win 512, options [nop,nop,TS val 356171898 ecr 356171898], length 2
2022-04-06 19:38:09.395473 IP (tos 0x0, ttl 64, id 9458, offset 0, flags [DF], proto TCP (6), length 52)
    127.0.0.1.50750 > 127.0.0.1.10950: Flags [.], cksum 0xfe28 (incorrect -> 0x09b8), seq 4, ack 3, win 512, options [nop,nop,TS val 356171898 ecr 356171898], length 0
2022-04-06 19:38:09.397220 IP (tos 0x0, ttl 64, id 9459, offset 0, flags [DF], proto TCP (6), length 62)
    127.0.0.1.50750 > 127.0.0.1.10950: Flags [P.], cksum 0xfe32 (incorrect -> 0x5d1e), seq 4:14, ack 3, win 512, options [nop,nop,TS val 356171900 ecr 356171898], length 10
2022-04-06 19:38:09.397245 IP (tos 0x0, ttl 64, id 10987, offset 0, flags [DF], proto TCP (6), length 52)
    127.0.0.1.10950 > 127.0.0.1.50750: Flags [.], cksum 0xfe28 (incorrect -> 0x09aa), seq 3, ack 14, win 512, options [nop,nop,TS val 356171900 ecr 356171900], length 0
2022-04-06 19:38:09.483243 IP (tos 0x0, ttl 64, id 10988, offset 0, flags [DF], proto TCP (6), length 62)
    127.0.0.1.10950 > 127.0.0.1.50750: Flags [P.], cksum 0xfe32 (incorrect -> 0x0441), seq 3:13, ack 14, win 512, options [nop,nop,TS val 356171986 ecr 356171900], length 10
2022-04-06 19:38:09.483261 IP (tos 0x0, ttl 64, id 9460, offset 0, flags [DF], proto TCP (6), length 52)
    127.0.0.1.50750 > 127.0.0.1.10950: Flags [.], cksum 0xfe28 (incorrect -> 0x08f4), seq 14, ack 13, win 512, options [nop,nop,TS val 356171986 ecr 356171986], length 0
2022-04-06 19:38:09.488701 IP (tos 0x0, ttl 64, id 9461, offset 0, flags [DF], proto TCP (6), length 569)
    127.0.0.1.50750 > 127.0.0.1.10950: Flags [P.], cksum 0x002e (incorrect -> 0x32f8), seq 14:531, ack 13, win 512, options [nop,nop,TS val 356171991 ecr 356171986], length 517
2022-04-06 19:38:09.488712 IP (tos 0x0, ttl 64, id 10989, offset 0, flags [DF], proto TCP (6), length 52)
    127.0.0.1.10950 > 127.0.0.1.50750: Flags [.], cksum 0xfe28 (incorrect -> 0x06e9), seq 13, ack 531, win 508, options [nop,nop,TS val 356171991 ecr 356171991], length 0
200, 3.8961470127105713, 1.1768546104431152