2022-04-06 18:05:11.093294 IP (tos 0x0, ttl 64, id 17156, offset 0, flags [DF], proto TCP (6), length 60)
    127.0.0.1.54548 > 127.0.0.1.11550: Flags [S], cksum 0xfe30 (incorrect -> 0x661d), seq 986379717, win 65495, options [mss 65495,sackOK,TS val 350593596 ecr 0,nop,wscale 7], length 0
2022-04-06 18:05:11.093313 IP (tos 0x0, ttl 64, id 0, offset 0, flags [DF], proto TCP (6), length 60)
    127.0.0.1.11550 > 127.0.0.1.54548: Flags [S.], cksum 0xfe30 (incorrect -> 0xde67), seq 2159759315, ack 986379718, win 65483, options [mss 65495,sackOK,TS val 350593596 ecr 350593596,nop,wscale 7], length 0
2022-04-06 18:05:11.093332 IP (tos 0x0, ttl 64, id 17157, offset 0, flags [DF], proto TCP (6), length 52)
    127.0.0.1.54548 > 127.0.0.1.11550: Flags [.], cksum 0xfe28 (incorrect -> 0x0524), seq 1, ack 1, win 512, options [nop,nop,TS val 350593596 ecr 350593596], length 0
2022-04-06 18:05:11.093507 IP (tos 0x0, ttl 64, id 17158, offset 0, flags [DF], proto TCP (6), length 55)
    127.0.0.1.54548 > 127.0.0.1.11550: Flags [P.], cksum 0xfe2b (incorrect -> 0x0018), seq 1:4, ack 1, win 512, options [nop,nop,TS val 350593596 ecr 350593596], length 3
2022-04-06 18:05:11.093516 IP (tos 0x0, ttl 64, id 57718, offset 0, flags [DF], proto TCP (6), length 52)
    127.0.0.1.11550 > 127.0.0.1.54548: Flags [.], cksum 0xfe28 (incorrect -> 0x0521), seq 1, ack 4, win 512, options [nop,nop,TS val 350593596 ecr 350593596], length 0
2022-04-06 18:05:11.093546 IP (tos 0x0, ttl 64, id 57719, offset 0, flags [DF], proto TCP (6), length 54)
    127.0.0.1.11550 > 127.0.0.1.54548: Flags [P.], cksum 0xfe2a (incorrect -> 0x0017), seq 1:3, ack 4, win 512, options [nop,nop,TS val 350593596 ecr 350593596], length 2
2022-04-06 18:05:11.093556 IP (tos 0x0, ttl 64, id 17159, offset 0, flags [DF], proto TCP (6), length 52)
    127.0.0.1.54548 > 127.0.0.1.11550: Flags [.], cksum 0xfe28 (incorrect -> 0x051f), seq 4, ack 3, win 512, options [nop,nop,TS val 350593596 ecr 350593596], length 0
2022-04-06 18:05:11.094913 IP (tos 0x0, ttl 64, id 17160, offset 0, flags [DF], proto TCP (6), length 62)
    127.0.0.1.54548 > 127.0.0.1.11550: Flags [P.], cksum 0xfe32 (incorrect -> 0x8a2c), seq 4:14, ack 3, win 512, options [nop,nop,TS val 350593597 ecr 350593596], length 10
2022-04-06 18:05:11.094932 IP (tos 0x0, ttl 64, id 57720, offset 0, flags [DF], proto TCP (6), length 52)
    127.0.0.1.11550 > 127.0.0.1.54548: Flags [.], cksum 0xfe28 (incorrect -> 0x0513), seq 3, ack 14, win 512, options [nop,nop,TS val 350593597 ecr 350593597], length 0
2022-04-06 18:05:11.241207 IP (tos 0x0, ttl 64, id 57721, offset 0, flags [DF], proto TCP (6), length 62)
    127.0.0.1.11550 > 127.0.0.1.54548: Flags [P.], cksum 0xfe32 (incorrect -> 0xff6c), seq 3:13, ack 14, win 512, options [nop,nop,TS val 350593744 ecr 350593597], length 10
2022-04-06 18:05:11.241220 IP (tos 0x0, ttl 64, id 17161, offset 0, flags [DF], proto TCP (6), length 52)
    127.0.0.1.54548 > 127.0.0.1.11550: Flags [.], cksum 0xfe28 (incorrect -> 0x03e3), seq 14, ack 13, win 512, options [nop,nop,TS val 350593744 ecr 350593744], length 0
2022-04-06 18:05:11.246889 IP (tos 0x0, ttl 64, id 17162, offset 0, flags [DF], proto TCP (6), length 569)
    127.0.0.1.54548 > 127.0.0.1.11550: Flags [P.], cksum 0x002e (incorrect -> 0x158f), seq 14:531, ack 13, win 512, options [nop,nop,TS val 350593749 ecr 350593744], length 517
2022-04-06 18:05:11.246908 IP (tos 0x0, ttl 64, id 57722, offset 0, flags [DF], proto TCP (6), length 52)
    127.0.0.1.11550 > 127.0.0.1.54548: Flags [.], cksum 0xfe28 (incorrect -> 0x01d8), seq 13, ack 531, win 508, options [nop,nop,TS val 350593749 ecr 350593749], length 0
2022-04-06 18:05:11.392937 IP (tos 0x0, ttl 64, id 57723, offset 0, flags [DF], proto TCP (6), length 3381)
    127.0.0.1.11550 > 127.0.0.1.54548: Flags [P.], cksum 0x0b2a (incorrect -> 0x36bb), seq 13:3342, ack 531, win 512, options [nop,nop,TS val 350593895 ecr 350593749], length 3329
2022-04-06 18:05:11.392949 IP (tos 0x0, ttl 64, id 17163, offset 0, flags [DF], proto TCP (6), length 52)
    127.0.0.1.54548 > 127.0.0.1.11550: Flags [.], cksum 0xfe28 (incorrect -> 0xf3c0), seq 531, ack 3342, win 494, options [nop,nop,TS val 350593895 ecr 350593895], length 0
2022-04-06 18:05:11.393420 IP (tos 0x0, ttl 64, id 17164, offset 0, flags [DF], proto TCP (6), length 145)
    127.0.0.1.54548 > 127.0.0.1.11550: Flags [P.], cksum 0xfe85 (incorrect -> 0x9b3b), seq 531:624, ack 3342, win 512, options [nop,nop,TS val 350593896 ecr 350593895], length 93
2022-04-06 18:05:11.393429 IP (tos 0x0, ttl 64, id 57724, offset 0, flags [DF], proto TCP (6), length 52)
    127.0.0.1.11550 > 127.0.0.1.54548: Flags [.], cksum 0xfe28 (incorrect -> 0xf34f), seq 3342, ack 624, win 512, options [nop,nop,TS val 350593896 ecr 350593896], length 0
2022-04-06 18:05:11.540277 IP (tos 0x0, ttl 64, id 57725, offset 0, flags [DF], proto TCP (6), length 310)
    127.0.0.1.11550 > 127.0.0.1.54548: Flags [P.], cksum 0xff2a (incorrect -> 0x421e), seq 3342:3600, ack 624, win 512, options [nop,nop,TS val 350594043 ecr 350593896], length 258
2022-04-06 18:05:11.540288 IP (tos 0x0, ttl 64, id 17165, offset 0, flags [DF], proto TCP (6), length 52)
    127.0.0.1.54548 > 127.0.0.1.11550: Flags [.], cksum 0xfe28 (incorrect -> 0xf129), seq 624, ack 3600, win 510, options [nop,nop,TS val 350594043 ecr 350594043], length 0
2022-04-06 18:05:11.540672 IP (tos 0x0, ttl 64, id 17166, offset 0, flags [DF], proto TCP (6), length 319)
    127.0.0.1.54548 > 127.0.0.1.11550: Flags [P.], cksum 0xff33 (incorrect -> 0xb0a6), seq 624:891, ack 3600, win 512, options [nop,nop,TS val 350594043 ecr 350594043], length 267
2022-04-06 18:05:11.540681 IP (tos 0x0, ttl 64, id 57726, offset 0, flags [DF], proto TCP (6), length 52)
    127.0.0.1.11550 > 127.0.0.1.54548: Flags [.], cksum 0xfe28 (incorrect -> 0xf01e), seq 3600, ack 891, win 510, options [nop,nop,TS val 350594043 ecr 350594043], length 0
2022-04-06 18:05:11.682594 IP (tos 0x0, ttl 64, id 57727, offset 0, flags [DF], proto TCP (6), length 220)
    127.0.0.1.11550 > 127.0.0.1.54548: Flags [P.], cksum 0xfed0 (incorrect -> 0xfcb2), seq 3600:3768, ack 891, win 512, options [nop,nop,TS val 350594185 ecr 350594043], length 168
2022-04-06 18:05:11.684381 IP (tos 0x0, ttl 64, id 41868, offset 0, flags [DF], proto TCP (6), length 60)
    127.0.0.1.54550 > 127.0.0.1.11550: Flags [S], cksum 0xfe30 (incorrect -> 0xd019), seq 390769912, win 65495, options [mss 65495,sackOK,TS val 350594187 ecr 0,nop,wscale 7], length 0
2022-04-06 18:05:11.684391 IP (tos 0x0, ttl 64, id 0, offset 0, flags [DF], proto TCP (6), length 60)
    127.0.0.1.11550 > 127.0.0.1.54550: Flags [S.], cksum 0xfe30 (incorrect -> 0x2aaa), seq 436523509, ack 390769913, win 65483, options [mss 65495,sackOK,TS val 350594187 ecr 350594187,nop,wscale 7], length 0
2022-04-06 18:05:11.684401 IP (tos 0x0, ttl 64, id 41869, offset 0, flags [DF], proto TCP (6), length 52)
    127.0.0.1.54550 > 127.0.0.1.11550: Flags [.], cksum 0xfe28 (incorrect -> 0x5166), seq 1, ack 1, win 512, options [nop,nop,TS val 350594187 ecr 350594187], length 0
2022-04-06 18:05:11.684484 IP (tos 0x0, ttl 64, id 41870, offset 0, flags [DF], proto TCP (6), length 55)
    127.0.0.1.54550 > 127.0.0.1.11550: Flags [P.], cksum 0xfe2b (incorrect -> 0x4c5a), seq 1:4, ack 1, win 512, options [nop,nop,TS val 350594187 ecr 350594187], length 3
2022-04-06 18:05:11.684491 IP (tos 0x0, ttl 64, id 33997, offset 0, flags [DF], proto TCP (6), length 52)
    127.0.0.1.11550 > 127.0.0.1.54550: Flags [.], cksum 0xfe28 (incorrect -> 0x5163), seq 1, ack 4, win 512, options [nop,nop,TS val 350594187 ecr 350594187], length 0
2022-04-06 18:05:11.684511 IP (tos 0x0, ttl 64, id 33998, offset 0, flags [DF], proto TCP (6), length 54)
    127.0.0.1.11550 > 127.0.0.1.54550: Flags [P.], cksum 0xfe2a (incorrect -> 0x4c59), seq 1:3, ack 4, win 512, options [nop,nop,TS val 350594187 ecr 350594187], length 2
2022-04-06 18:05:11.684519 IP (tos 0x0, ttl 64, id 41871, offset 0, flags [DF], proto TCP (6), length 52)
    127.0.0.1.54550 > 127.0.0.1.11550: Flags [.], cksum 0xfe28 (incorrect -> 0x5161), seq 4, ack 3, win 512, options [nop,nop,TS val 350594187 ecr 350594187], length 0
2022-04-06 18:05:11.722694 IP (tos 0x0, ttl 64, id 17167, offset 0, flags [DF], proto TCP (6), length 52)
    127.0.0.1.54548 > 127.0.0.1.11550: Flags [.], cksum 0xfe28 (incorrect -> 0xee30), seq 891, ack 3768, win 512, options [nop,nop,TS val 350594225 ecr 350594185], length 0
2022-04-06 18:05:11.734451 IP (tos 0x0, ttl 64, id 41872, offset 0, flags [DF], proto TCP (6), length 62)
    127.0.0.1.54550 > 127.0.0.1.11550: Flags [P.], cksum 0xfe32 (incorrect -> 0x2e18), seq 4:14, ack 3, win 512, options [nop,nop,TS val 350594237 ecr 350594187], length 10
2022-04-06 18:05:11.734462 IP (tos 0x0, ttl 64, id 33999, offset 0, flags [DF], proto TCP (6), length 52)
    127.0.0.1.11550 > 127.0.0.1.54550: Flags [.], cksum 0xfe28 (incorrect -> 0x50f3), seq 3, ack 14, win 512, options [nop,nop,TS val 350594237 ecr 350594237], length 0
2022-04-06 18:05:11.875878 IP (tos 0x0, ttl 64, id 34000, offset 0, flags [DF], proto TCP (6), length 62)
    127.0.0.1.11550 > 127.0.0.1.54550: Flags [P.], cksum 0xfe32 (incorrect -> 0x4b53), seq 3:13, ack 14, win 512, options [nop,nop,TS val 350594378 ecr 350594237], length 10
2022-04-06 18:05:11.875889 IP (tos 0x0, ttl 64, id 41873, offset 0, flags [DF], proto TCP (6), length 52)
    127.0.0.1.54550 > 127.0.0.1.11550: Flags [.], cksum 0xfe28 (incorrect -> 0x4fcf), seq 14, ack 13, win 512, options [nop,nop,TS val 350594378 ecr 350594378], length 0
2022-04-06 18:05:11.882024 IP (tos 0x0, ttl 64, id 41874, offset 0, flags [DF], proto TCP (6), length 569)
    127.0.0.1.54550 > 127.0.0.1.11550: Flags [P.], cksum 0x002e (incorrect -> 0x3f0a), seq 14:531, ack 13, win 512, options [nop,nop,TS val 350594384 ecr 350594378], length 517
2022-04-06 18:05:11.882038 IP (tos 0x0, ttl 64, id 34001, offset 0, flags [DF], proto TCP (6), length 52)
    127.0.0.1.11550 > 127.0.0.1.54550: Flags [.], cksum 0xfe28 (incorrect -> 0x4dc2), seq 13, ack 531, win 508, options [nop,nop,TS val 350594384 ecr 350594384], length 0
2022-04-06 18:05:12.035062 IP (tos 0x0, ttl 64, id 34002, offset 0, flags [DF], proto TCP (6), length 3381)
    127.0.0.1.11550 > 127.0.0.1.54550: Flags [P.], cksum 0x0b2a (incorrect -> 0xb099), seq 13:3342, ack 531, win 512, options [nop,nop,TS val 350594537 ecr 350594384], length 3329
2022-04-06 18:05:12.035072 IP (tos 0x0, ttl 64, id 41875, offset 0, flags [DF], proto TCP (6), length 52)
    127.0.0.1.54550 > 127.0.0.1.11550: Flags [.], cksum 0xfe28 (incorrect -> 0x3f9c), seq 531, ack 3342, win 494, options [nop,nop,TS val 350594538 ecr 350594537], length 0
2022-04-06 18:05:12.035596 IP (tos 0x0, ttl 64, id 41876, offset 0, flags [DF], proto TCP (6), length 145)
    127.0.0.1.54550 > 127.0.0.1.11550: Flags [P.], cksum 0xfe85 (incorrect -> 0xc4b8), seq 531:624, ack 3342, win 512, options [nop,nop,TS val 350594538 ecr 350594537], length 93
2022-04-06 18:05:12.035606 IP (tos 0x0, ttl 64, id 34003, offset 0, flags [DF], proto TCP (6), length 52)
    127.0.0.1.11550 > 127.0.0.1.54550: Flags [.], cksum 0xfe28 (incorrect -> 0x3f2c), seq 3342, ack 624, win 512, options [nop,nop,TS val 350594538 ecr 350594538], length 0
2022-04-06 18:05:12.236000 IP (tos 0x0, ttl 64, id 34004, offset 0, flags [DF], proto TCP (6), length 310)
    127.0.0.1.11550 > 127.0.0.1.54550: Flags [P.], cksum 0xff2a (incorrect -> 0x7699), seq 3342:3600, ack 624, win 512, options [nop,nop,TS val 350594738 ecr 350594538], length 258
2022-04-06 18:05:12.236011 IP (tos 0x0, ttl 64, id 41877, offset 0, flags [DF], proto TCP (6), length 52)
    127.0.0.1.54550 > 127.0.0.1.11550: Flags [.], cksum 0xfe28 (incorrect -> 0x3c9c), seq 624, ack 3600, win 510, options [nop,nop,TS val 350594738 ecr 350594738], length 0
2022-04-06 18:05:12.236335 IP (tos 0x0, ttl 64, id 41878, offset 0, flags [DF], proto TCP (6), length 315)
    127.0.0.1.54550 > 127.0.0.1.11550: Flags [P.], cksum 0xff2f (incorrect -> 0xd536), seq 624:887, ack 3600, win 512, options [nop,nop,TS val 350594739 ecr 350594738], length 263
2022-04-06 18:05:12.236344 IP (tos 0x0, ttl 64, id 34005, offset 0, flags [DF], proto TCP (6), length 52)
    127.0.0.1.11550 > 127.0.0.1.54550: Flags [.], cksum 0xfe28 (incorrect -> 0x3b93), seq 3600, ack 887, win 510, options [nop,nop,TS val 350594739 ecr 350594739], length 0
200, 3.7863497734069824, 1.4480721950531006