2022-04-06 07:07:14.421704 IP (tos 0x0, ttl 64, id 45953, offset 0, flags [DF], proto TCP (6), length 60)
    127.0.0.1.36578 > 127.0.0.1.11850: Flags [S], cksum 0xfe30 (incorrect -> 0xb4f1), seq 1264401279, win 65495, options [mss 65495,sackOK,TS val 311116924 ecr 0,nop,wscale 7], length 0
2022-04-06 07:07:14.421714 IP (tos 0x0, ttl 64, id 0, offset 0, flags [DF], proto TCP (6), length 60)
    127.0.0.1.11850 > 127.0.0.1.36578: Flags [S.], cksum 0xfe30 (incorrect -> 0xf593), seq 3694955540, ack 1264401280, win 65483, options [mss 65495,sackOK,TS val 311116924 ecr 311116924,nop,wscale 7], length 0
2022-04-06 07:07:14.421722 IP (tos 0x0, ttl 64, id 45954, offset 0, flags [DF], proto TCP (6), length 52)
    127.0.0.1.36578 > 127.0.0.1.11850: Flags [.], cksum 0xfe28 (incorrect -> 0x1c50), seq 1, ack 1, win 512, options [nop,nop,TS val 311116924 ecr 311116924], length 0
2022-04-06 07:07:14.421808 IP (tos 0x0, ttl 64, id 45955, offset 0, flags [DF], proto TCP (6), length 55)
    127.0.0.1.36578 > 127.0.0.1.11850: Flags [P.], cksum 0xfe2b (incorrect -> 0x1744), seq 1:4, ack 1, win 512, options [nop,nop,TS val 311116924 ecr 311116924], length 3
2022-04-06 07:07:14.421822 IP (tos 0x0, ttl 64, id 17541, offset 0, flags [DF], proto TCP (6), length 52)
    127.0.0.1.11850 > 127.0.0.1.36578: Flags [.], cksum 0xfe28 (incorrect -> 0x1c4d), seq 1, ack 4, win 512, options [nop,nop,TS val 311116924 ecr 311116924], length 0
2022-04-06 07:07:14.421861 IP (tos 0x0, ttl 64, id 17542, offset 0, flags [DF], proto TCP (6), length 54)
    127.0.0.1.11850 > 127.0.0.1.36578: Flags [P.], cksum 0xfe2a (incorrect -> 0x1743), seq 1:3, ack 4, win 512, options [nop,nop,TS val 311116924 ecr 311116924], length 2
2022-04-06 07:07:14.421874 IP (tos 0x0, ttl 64, id 45956, offset 0, flags [DF], proto TCP (6), length 52)
    127.0.0.1.36578 > 127.0.0.1.11850: Flags [.], cksum 0xfe28 (incorrect -> 0x1c4b), seq 4, ack 3, win 512, options [nop,nop,TS val 311116924 ecr 311116924], length 0
2022-04-06 07:07:14.423342 IP (tos 0x0, ttl 64, id 45957, offset 0, flags [DF], proto TCP (6), length 62)
    127.0.0.1.36578 > 127.0.0.1.11850: Flags [P.], cksum 0xfe32 (incorrect -> 0x8779), seq 4:14, ack 3, win 512, options [nop,nop,TS val 311116926 ecr 311116924], length 10
2022-04-06 07:07:14.423354 IP (tos 0x0, ttl 64, id 17543, offset 0, flags [DF], proto TCP (6), length 52)
    127.0.0.1.11850 > 127.0.0.1.36578: Flags [.], cksum 0xfe28 (incorrect -> 0x1c3d), seq 3, ack 14, win 512, options [nop,nop,TS val 311116926 ecr 311116926], length 0
2022-04-06 07:07:14.495251 IP (tos 0x0, ttl 64, id 17544, offset 0, flags [DF], proto TCP (6), length 62)
    127.0.0.1.11850 > 127.0.0.1.36578: Flags [P.], cksum 0xfe32 (incorrect -> 0x16e2), seq 3:13, ack 14, win 512, options [nop,nop,TS val 311116998 ecr 311116926], length 10
2022-04-06 07:07:14.495259 IP (tos 0x0, ttl 64, id 45958, offset 0, flags [DF], proto TCP (6), length 52)
    127.0.0.1.36578 > 127.0.0.1.11850: Flags [.], cksum 0xfe28 (incorrect -> 0x1ba3), seq 14, ack 13, win 512, options [nop,nop,TS val 311116998 ecr 311116998], length 0
2022-04-06 07:07:14.500623 IP (tos 0x0, ttl 64, id 45959, offset 0, flags [DF], proto TCP (6), length 569)
    127.0.0.1.36578 > 127.0.0.1.11850: Flags [P.], cksum 0x002e (incorrect -> 0x6d00), seq 14:531, ack 13, win 512, options [nop,nop,TS val 311117003 ecr 311116998], length 517
2022-04-06 07:07:14.500634 IP (tos 0x0, ttl 64, id 17545, offset 0, flags [DF], proto TCP (6), length 52)
    127.0.0.1.11850 > 127.0.0.1.36578: Flags [.], cksum 0xfe28 (incorrect -> 0x1998), seq 13, ack 531, win 508, options [nop,nop,TS val 311117003 ecr 311117003], length 0
2022-04-06 07:07:14.527321 IP (tos 0x0, ttl 64, id 17546, offset 0, flags [DF], proto TCP (6), length 3538)
    127.0.0.1.11850 > 127.0.0.1.36578: Flags [P.], cksum 0x0bc7 (incorrect -> 0x6fdb), seq 13:3499, ack 531, win 512, options [nop,nop,TS val 311117030 ecr 311117003], length 3486
2022-04-06 07:07:14.527328 IP (tos 0x0, ttl 64, id 45960, offset 0, flags [DF], proto TCP (6), length 52)
    127.0.0.1.36578 > 127.0.0.1.11850: Flags [.], cksum 0xfe28 (incorrect -> 0x0bd2), seq 531, ack 3499, win 494, options [nop,nop,TS val 311117030 ecr 311117030], length 0
2022-04-06 07:07:14.575645 IP (tos 0x0, ttl 64, id 17547, offset 0, flags [DF], proto TCP (6), length 662)
    127.0.0.1.11850 > 127.0.0.1.36578: Flags [P.], cksum 0x008b (incorrect -> 0x235c), seq 3499:4109, ack 531, win 512, options [nop,nop,TS val 311117078 ecr 311117030], length 610
2022-04-06 07:07:14.575652 IP (tos 0x0, ttl 64, id 45961, offset 0, flags [DF], proto TCP (6), length 52)
    127.0.0.1.36578 > 127.0.0.1.11850: Flags [.], cksum 0xfe28 (incorrect -> 0x0905), seq 531, ack 4109, win 505, options [nop,nop,TS val 311117078 ecr 311117078], length 0
2022-04-06 07:07:14.584640 IP (tos 0x0, ttl 64, id 17548, offset 0, flags [DF], proto TCP (6), length 738)
    127.0.0.1.11850 > 127.0.0.1.36578: Flags [P.], cksum 0x00d7 (incorrect -> 0x120a), seq 4109:4795, ack 531, win 512, options [nop,nop,TS val 311117087 ecr 311117078], length 686
2022-04-06 07:07:14.584646 IP (tos 0x0, ttl 64, id 45962, offset 0, flags [DF], proto TCP (6), length 52)
    127.0.0.1.36578 > 127.0.0.1.11850: Flags [.], cksum 0xfe28 (incorrect -> 0x0645), seq 531, ack 4795, win 505, options [nop,nop,TS val 311117087 ecr 311117087], length 0
2022-04-06 07:07:14.584993 IP (tos 0x0, ttl 64, id 45963, offset 0, flags [DF], proto TCP (6), length 132)
    127.0.0.1.36578 > 127.0.0.1.11850: Flags [P.], cksum 0xfe78 (incorrect -> 0x8ee7), seq 531:611, ack 4795, win 512, options [nop,nop,TS val 311117087 ecr 311117087], length 80
2022-04-06 07:07:14.585002 IP (tos 0x0, ttl 64, id 17549, offset 0, flags [DF], proto TCP (6), length 52)
    127.0.0.1.11850 > 127.0.0.1.36578: Flags [.], cksum 0xfe28 (incorrect -> 0x05ee), seq 4795, ack 611, win 512, options [nop,nop,TS val 311117087 ecr 311117087], length 0
2022-04-06 07:07:14.585343 IP (tos 0x0, ttl 64, id 45964, offset 0, flags [DF], proto TCP (6), length 336)
    127.0.0.1.36578 > 127.0.0.1.11850: Flags [P.], cksum 0xff44 (incorrect -> 0x70d5), seq 611:895, ack 4795, win 512, options [nop,nop,TS val 311117088 ecr 311117087], length 284
2022-04-06 07:07:14.585352 IP (tos 0x0, ttl 64, id 17550, offset 0, flags [DF], proto TCP (6), length 52)
    127.0.0.1.11850 > 127.0.0.1.36578: Flags [.], cksum 0xfe28 (incorrect -> 0x04d2), seq 4795, ack 895, win 510, options [nop,nop,TS val 311117088 ecr 311117088], length 0
2022-04-06 07:07:14.613855 IP (tos 0x0, ttl 64, id 17551, offset 0, flags [DF], proto TCP (6), length 594)
    127.0.0.1.11850 > 127.0.0.1.36578: Flags [P.], cksum 0x0047 (incorrect -> 0xf2fd), seq 4795:5337, ack 895, win 512, options [nop,nop,TS val 311117116 ecr 311117088], length 542
2022-04-06 07:07:14.613863 IP (tos 0x0, ttl 64, id 45965, offset 0, flags [DF], proto TCP (6), length 52)
    127.0.0.1.36578 > 127.0.0.1.11850: Flags [.], cksum 0xfe28 (incorrect -> 0x027e), seq 895, ack 5337, win 508, options [nop,nop,TS val 311117116 ecr 311117116], length 0
2022-04-06 07:07:14.641398 IP (tos 0x0, ttl 64, id 17552, offset 0, flags [DF], proto TCP (6), length 3538)
    127.0.0.1.11850 > 127.0.0.1.36578: Flags [P.], cksum 0x0bc7 (incorrect -> 0x1d1a), seq 5337:8823, ack 895, win 512, options [nop,nop,TS val 311117144 ecr 311117116], length 3486
2022-04-06 07:07:14.641405 IP (tos 0x0, ttl 64, id 45966, offset 0, flags [DF], proto TCP (6), length 52)
    127.0.0.1.36578 > 127.0.0.1.11850: Flags [.], cksum 0xfe28 (incorrect -> 0xf4b5), seq 895, ack 8823, win 494, options [nop,nop,TS val 311117144 ecr 311117144], length 0
2022-04-06 07:07:14.642652 IP (tos 0x0, ttl 64, id 17553, offset 0, flags [DF], proto TCP (6), length 4100)
    127.0.0.1.11850 > 127.0.0.1.36578: Flags [P.], cksum 0x0df9 (incorrect -> 0x8acb), seq 8823:12871, ack 895, win 512, options [nop,nop,TS val 311117145 ecr 311117144], length 4048
2022-04-06 07:07:14.642659 IP (tos 0x0, ttl 64, id 45967, offset 0, flags [DF], proto TCP (6), length 52)
    127.0.0.1.36578 > 127.0.0.1.11850: Flags [.], cksum 0xfe28 (incorrect -> 0xe4e5), seq 895, ack 12871, win 492, options [nop,nop,TS val 311117145 ecr 311117145], length 0
2022-04-06 07:07:14.642667 IP (tos 0x0, ttl 64, id 17554, offset 0, flags [DF], proto TCP (6), length 486)
    127.0.0.1.11850 > 127.0.0.1.36578: Flags [P.], cksum 0xffda (incorrect -> 0xdf9d), seq 12871:13305, ack 895, win 512, options [nop,nop,TS val 311117145 ecr 311117145], length 434
2022-04-06 07:07:14.642671 IP (tos 0x0, ttl 64, id 45968, offset 0, flags [DF], proto TCP (6), length 52)
    127.0.0.1.36578 > 127.0.0.1.11850: Flags [.], cksum 0xfe28 (incorrect -> 0xe335), seq 895, ack 13305, win 490, options [nop,nop,TS val 311117145 ecr 311117145], length 0
2022-04-06 07:07:14.643917 IP (tos 0x0, ttl 64, id 17555, offset 0, flags [DF], proto TCP (6), length 3538)
    127.0.0.1.11850 > 127.0.0.1.36578: Flags [P.], cksum 0x0bc7 (incorrect -> 0xa28a), seq 13305:16791, ack 895, win 512, options [nop,nop,TS val 311117146 ecr 311117145], length 3486
2022-04-06 07:07:14.643924 IP (tos 0x0, ttl 64, id 45969, offset 0, flags [DF], proto TCP (6), length 52)
    127.0.0.1.36578 > 127.0.0.1.11850: Flags [.], cksum 0xfe28 (incorrect -> 0xd591), seq 895, ack 16791, win 494, options [nop,nop,TS val 311117146 ecr 311117146], length 0
2022-04-06 07:07:14.655467 IP (tos 0x0, ttl 64, id 17556, offset 0, flags [DF], proto TCP (6), length 3078)
    127.0.0.1.11850 > 127.0.0.1.36578: Flags [P.], cksum 0x09fb (incorrect -> 0xb308), seq 16791:19817, ack 895, win 512, options [nop,nop,TS val 311117158 ecr 311117146], length 3026
2022-04-06 07:07:14.655475 IP (tos 0x0, ttl 64, id 45970, offset 0, flags [DF], proto TCP (6), length 52)
    127.0.0.1.36578 > 127.0.0.1.11850: Flags [.], cksum 0xfe28 (incorrect -> 0xc9a5), seq 895, ack 19817, win 496, options [nop,nop,TS val 311117158 ecr 311117158], length 0
2022-04-06 07:07:14.655891 IP (tos 0x0, ttl 64, id 17557, offset 0, flags [DF], proto TCP (6), length 4100)
    127.0.0.1.11850 > 127.0.0.1.36578: Flags [P.], cksum 0x0df9 (incorrect -> 0xeb6b), seq 19817:23865, ack 895, win 512, options [nop,nop,TS val 311117158 ecr 311117158], length 4048
2022-04-06 07:07:14.655900 IP (tos 0x0, ttl 64, id 45971, offset 0, flags [DF], proto TCP (6), length 52)
    127.0.0.1.36578 > 127.0.0.1.11850: Flags [.], cksum 0xfe28 (incorrect -> 0xb9d9), seq 895, ack 23865, win 492, options [nop,nop,TS val 311117158 ecr 311117158], length 0
2022-04-06 07:07:14.655909 IP (tos 0x0, ttl 64, id 17558, offset 0, flags [DF], proto TCP (6), length 3290)
    127.0.0.1.11850 > 127.0.0.1.36578: Flags [P.], cksum 0x0acf (incorrect -> 0x6687), seq 23865:27103, ack 895, win 512, options [nop,nop,TS val 311117158 ecr 311117158], length 3238
2022-04-06 07:07:14.657380 IP (tos 0x0, ttl 64, id 45972, offset 0, flags [DF], proto TCP (6), length 52)
    127.0.0.1.36578 > 127.0.0.1.11850: Flags [.], cksum 0xfe28 (incorrect -> 0xad1d), seq 895, ack 27103, win 512, options [nop,nop,TS val 311117160 ecr 311117158], length 0
2022-04-06 07:07:14.657388 IP (tos 0x0, ttl 64, id 17559, offset 0, flags [DF], proto TCP (6), length 8242)
    127.0.0.1.11850 > 127.0.0.1.36578: Flags [P.], cksum 0x1e27 (incorrect -> 0xfacb), seq 27103:35293, ack 895, win 512, options [nop,nop,TS val 311117160 ecr 311117160], length 8190
2022-04-06 07:07:14.670309 IP (tos 0x0, ttl 64, id 17560, offset 0, flags [DF], proto TCP (6), length 32820)
    127.0.0.1.11850 > 127.0.0.1.36578: Flags [.], cksum 0x7e29 (incorrect -> 0x89f0), seq 35293:68061, ack 895, win 512, options [nop,nop,TS val 311117173 ecr 311117160], length 32768
2022-04-06 07:07:14.670374 IP (tos 0x0, ttl 64, id 45973, offset 0, flags [DF], proto TCP (6), length 52)
    127.0.0.1.36578 > 127.0.0.1.11850: Flags [.], cksum 0xfe28 (incorrect -> 0x0d95), seq 895, ack 68061, win 379, options [nop,nop,TS val 311117173 ecr 311117160], length 0
2022-04-06 07:07:14.670387 IP (tos 0x0, ttl 64, id 17561, offset 0, flags [DF], proto TCP (6), length 4028)
    127.0.0.1.11850 > 127.0.0.1.36578: Flags [P.], cksum 0x0db1 (incorrect -> 0x6fd5), seq 68061:72037, ack 895, win 512, options [nop,nop,TS val 311117173 ecr 311117173], length 3976
2022-04-06 07:07:14.671930 IP (tos 0x0, ttl 64, id 45974, offset 0, flags [DF], proto TCP (6), length 52)
    127.0.0.1.36578 > 127.0.0.1.11850: Flags [.], cksum 0xfe28 (incorrect -> 0xfd79), seq 895, ack 72037, win 512, options [nop,nop,TS val 311117174 ecr 311117173], length 0
2022-04-06 07:07:14.671938 IP (tos 0x0, ttl 64, id 17562, offset 0, flags [DF], proto TCP (6), length 11138)
    127.0.0.1.11850 > 127.0.0.1.36578: Flags [P.], cksum 0x2977 (incorrect -> 0x6a59), seq 72037:83123, ack 895, win 512, options [nop,nop,TS val 311117174 ecr 311117174], length 11086
2022-04-06 07:07:14.671944 IP (tos 0x0, ttl 64, id 45975, offset 0, flags [DF], proto TCP (6), length 52)
    127.0.0.1.36578 > 127.0.0.1.11850: Flags [.], cksum 0xfe28 (incorrect -> 0xd22a), seq 895, ack 83123, win 512, options [nop,nop,TS val 311117174 ecr 311117174], length 0
2022-04-06 07:07:14.672293 IP (tos 0x0, ttl 64, id 17563, offset 0, flags [DF], proto TCP (6), length 4100)
    127.0.0.1.11850 > 127.0.0.1.36578: Flags [P.], cksum 0x0df9 (incorrect -> 0x7fba), seq 83123:87171, ack 895, win 512, options [nop,nop,TS val 311117175 ecr 311117174], length 4048
2022-04-06 07:07:14.672608 IP (tos 0x0, ttl 64, id 45976, offset 0, flags [DF], proto TCP (6), length 52)
    127.0.0.1.36578 > 127.0.0.1.11850: Flags [.], cksum 0xfe28 (incorrect -> 0xc258), seq 895, ack 87171, win 512, options [nop,nop,TS val 311117175 ecr 311117175], length 0
2022-04-06 07:07:14.672617 IP (tos 0x0, ttl 64, id 17564, offset 0, flags [DF], proto TCP (6), length 11572)
    127.0.0.1.11850 > 127.0.0.1.36578: Flags [P.], cksum 0x2b29 (incorrect -> 0xf795), seq 87171:98691, ack 895, win 512, options [nop,nop,TS val 311117175 ecr 311117175], length 11520
2022-04-06 07:07:14.672622 IP (tos 0x0, ttl 64, id 45977, offset 0, flags [DF], proto TCP (6), length 52)
    127.0.0.1.36578 > 127.0.0.1.11850: Flags [.], cksum 0xfe28 (incorrect -> 0x9558), seq 895, ack 98691, win 512, options [nop,nop,TS val 311117175 ecr 311117175], length 0
2022-04-06 07:07:14.684170 IP (tos 0x0, ttl 64, id 17565, offset 0, flags [DF], proto TCP (6), length 4100)
    127.0.0.1.11850 > 127.0.0.1.36578: Flags [P.], cksum 0x0df9 (incorrect -> 0x28b3), seq 98691:102739, ack 895, win 512, options [nop,nop,TS val 311117187 ecr 311117175], length 4048
2022-04-06 07:07:14.684676 IP (tos 0x0, ttl 64, id 45978, offset 0, flags [DF], proto TCP (6), length 52)
    127.0.0.1.36578 > 127.0.0.1.11850: Flags [.], cksum 0xfe28 (incorrect -> 0x8570), seq 895, ack 102739, win 512, options [nop,nop,TS val 311117187 ecr 311117187], length 0
2022-04-06 07:07:14.684685 IP (tos 0x0, ttl 64, id 17566, offset 0, flags [DF], proto TCP (6), length 11388)
    127.0.0.1.11850 > 127.0.0.1.36578: Flags [P.], cksum 0x2a71 (incorrect -> 0x303b), seq 102739:114075, ack 895, win 512, options [nop,nop,TS val 311117187 ecr 311117187], length 11336
200, 4.832778692245483, 0.2700474262237549