2022-04-06 21:00:50.719695 IP (tos 0x0, ttl 64, id 65178, offset 0, flags [DF], proto TCP (6), length 60)
    127.0.0.1.59538 > 127.0.0.1.10450: Flags [S], cksum 0xfe30 (incorrect -> 0x6845), seq 312228239, win 65495, options [mss 65495,sackOK,TS val 361133222 ecr 0,nop,wscale 7], length 0
2022-04-06 21:00:50.719710 IP (tos 0x0, ttl 64, id 0, offset 0, flags [DF], proto TCP (6), length 60)
    127.0.0.1.10450 > 127.0.0.1.59538: Flags [S.], cksum 0xfe30 (incorrect -> 0x85b8), seq 1956242369, ack 312228240, win 65483, options [mss 65495,sackOK,TS val 361133222 ecr 361133222,nop,wscale 7], length 0
2022-04-06 21:00:50.719721 IP (tos 0x0, ttl 64, id 65179, offset 0, flags [DF], proto TCP (6), length 52)
    127.0.0.1.59538 > 127.0.0.1.10450: Flags [.], cksum 0xfe28 (incorrect -> 0xac74), seq 1, ack 1, win 512, options [nop,nop,TS val 361133222 ecr 361133222], length 0
2022-04-06 21:00:50.719824 IP (tos 0x0, ttl 64, id 65180, offset 0, flags [DF], proto TCP (6), length 55)
    127.0.0.1.59538 > 127.0.0.1.10450: Flags [P.], cksum 0xfe2b (incorrect -> 0xa768), seq 1:4, ack 1, win 512, options [nop,nop,TS val 361133222 ecr 361133222], length 3
2022-04-06 21:00:50.719835 IP (tos 0x0, ttl 64, id 53565, offset 0, flags [DF], proto TCP (6), length 52)
    127.0.0.1.10450 > 127.0.0.1.59538: Flags [.], cksum 0xfe28 (incorrect -> 0xac71), seq 1, ack 4, win 512, options [nop,nop,TS val 361133222 ecr 361133222], length 0
2022-04-06 21:00:50.719899 IP (tos 0x0, ttl 64, id 53566, offset 0, flags [DF], proto TCP (6), length 54)
    127.0.0.1.10450 > 127.0.0.1.59538: Flags [P.], cksum 0xfe2a (incorrect -> 0xa767), seq 1:3, ack 4, win 512, options [nop,nop,TS val 361133222 ecr 361133222], length 2
2022-04-06 21:00:50.719911 IP (tos 0x0, ttl 64, id 65181, offset 0, flags [DF], proto TCP (6), length 52)
    127.0.0.1.59538 > 127.0.0.1.10450: Flags [.], cksum 0xfe28 (incorrect -> 0xac6f), seq 4, ack 3, win 512, options [nop,nop,TS val 361133222 ecr 361133222], length 0
2022-04-06 21:00:50.721587 IP (tos 0x0, ttl 64, id 65182, offset 0, flags [DF], proto TCP (6), length 62)
    127.0.0.1.59538 > 127.0.0.1.10450: Flags [P.], cksum 0xfe32 (incorrect -> 0x6e25), seq 4:14, ack 3, win 512, options [nop,nop,TS val 361133224 ecr 361133222], length 10
2022-04-06 21:00:50.721596 IP (tos 0x0, ttl 64, id 53567, offset 0, flags [DF], proto TCP (6), length 52)
    127.0.0.1.10450 > 127.0.0.1.59538: Flags [.], cksum 0xfe28 (incorrect -> 0xac61), seq 3, ack 14, win 512, options [nop,nop,TS val 361133224 ecr 361133224], length 0
2022-04-06 21:00:50.799538 IP (tos 0x0, ttl 64, id 53568, offset 0, flags [DF], proto TCP (6), length 62)
    127.0.0.1.10450 > 127.0.0.1.59538: Flags [P.], cksum 0xfe32 (incorrect -> 0xa700), seq 3:13, ack 14, win 512, options [nop,nop,TS val 361133302 ecr 361133224], length 10
2022-04-06 21:00:50.799553 IP (tos 0x0, ttl 64, id 65183, offset 0, flags [DF], proto TCP (6), length 52)
    127.0.0.1.59538 > 127.0.0.1.10450: Flags [.], cksum 0xfe28 (incorrect -> 0xabbb), seq 14, ack 13, win 512, options [nop,nop,TS val 361133302 ecr 361133302], length 0
2022-04-06 21:00:50.805366 IP (tos 0x0, ttl 64, id 65184, offset 0, flags [DF], proto TCP (6), length 569)
    127.0.0.1.59538 > 127.0.0.1.10450: Flags [P.], cksum 0x002e (incorrect -> 0xfc78), seq 14:531, ack 13, win 512, options [nop,nop,TS val 361133308 ecr 361133302], length 517
2022-04-06 21:00:50.805375 IP (tos 0x0, ttl 64, id 53569, offset 0, flags [DF], proto TCP (6), length 52)
    127.0.0.1.10450 > 127.0.0.1.59538: Flags [.], cksum 0xfe28 (incorrect -> 0xa9ae), seq 13, ack 531, win 508, options [nop,nop,TS val 361133308 ecr 361133308], length 0
429, 4.962132453918457, 0.5733041763305664