2022-04-06 10:55:24.355712 IP (tos 0x0, ttl 64, id 63080, offset 0, flags [DF], proto TCP (6), length 60)
    127.0.0.1.54306 > 127.0.0.1.11750: Flags [S], cksum 0xfe30 (incorrect -> 0x696e), seq 1239178888, win 65495, options [mss 65495,sackOK,TS val 324806858 ecr 0,nop,wscale 7], length 0
2022-04-06 10:55:24.355725 IP (tos 0x0, ttl 64, id 0, offset 0, flags [DF], proto TCP (6), length 60)
    127.0.0.1.11750 > 127.0.0.1.54306: Flags [S.], cksum 0xfe30 (incorrect -> 0x920d), seq 1944201043, ack 1239178889, win 65483, options [mss 65495,sackOK,TS val 324806858 ecr 324806858,nop,wscale 7], length 0
2022-04-06 10:55:24.355733 IP (tos 0x0, ttl 64, id 63081, offset 0, flags [DF], proto TCP (6), length 52)
    127.0.0.1.54306 > 127.0.0.1.11750: Flags [.], cksum 0xfe28 (incorrect -> 0xb8c9), seq 1, ack 1, win 512, options [nop,nop,TS val 324806858 ecr 324806858], length 0
2022-04-06 10:55:24.355931 IP (tos 0x0, ttl 64, id 63082, offset 0, flags [DF], proto TCP (6), length 55)
    127.0.0.1.54306 > 127.0.0.1.11750: Flags [P.], cksum 0xfe2b (incorrect -> 0xb3bd), seq 1:4, ack 1, win 512, options [nop,nop,TS val 324806858 ecr 324806858], length 3
2022-04-06 10:55:24.355938 IP (tos 0x0, ttl 64, id 59769, offset 0, flags [DF], proto TCP (6), length 52)
    127.0.0.1.11750 > 127.0.0.1.54306: Flags [.], cksum 0xfe28 (incorrect -> 0xb8c6), seq 1, ack 4, win 512, options [nop,nop,TS val 324806858 ecr 324806858], length 0
2022-04-06 10:55:24.355964 IP (tos 0x0, ttl 64, id 59770, offset 0, flags [DF], proto TCP (6), length 54)
    127.0.0.1.11750 > 127.0.0.1.54306: Flags [P.], cksum 0xfe2a (incorrect -> 0xb3bc), seq 1:3, ack 4, win 512, options [nop,nop,TS val 324806858 ecr 324806858], length 2
2022-04-06 10:55:24.355975 IP (tos 0x0, ttl 64, id 63083, offset 0, flags [DF], proto TCP (6), length 52)
    127.0.0.1.54306 > 127.0.0.1.11750: Flags [.], cksum 0xfe28 (incorrect -> 0xb8c4), seq 4, ack 3, win 512, options [nop,nop,TS val 324806858 ecr 324806858], length 0
2022-04-06 10:55:24.357041 IP (tos 0x0, ttl 64, id 63084, offset 0, flags [DF], proto TCP (6), length 62)
    127.0.0.1.54306 > 127.0.0.1.11750: Flags [P.], cksum 0xfe32 (incorrect -> 0x6b26), seq 4:14, ack 3, win 512, options [nop,nop,TS val 324806859 ecr 324806858], length 10
2022-04-06 10:55:24.357051 IP (tos 0x0, ttl 64, id 59771, offset 0, flags [DF], proto TCP (6), length 52)
    127.0.0.1.11750 > 127.0.0.1.54306: Flags [.], cksum 0xfe28 (incorrect -> 0xb8b8), seq 3, ack 14, win 512, options [nop,nop,TS val 324806859 ecr 324806859], length 0
2022-04-06 10:55:24.584733 IP (tos 0x0, ttl 64, id 59772, offset 0, flags [DF], proto TCP (6), length 62)
    127.0.0.1.11750 > 127.0.0.1.54306: Flags [P.], cksum 0xfe32 (incorrect -> 0xb2c1), seq 3:13, ack 14, win 512, options [nop,nop,TS val 324807087 ecr 324806859], length 10
2022-04-06 10:55:24.584742 IP (tos 0x0, ttl 64, id 63085, offset 0, flags [DF], proto TCP (6), length 52)
    127.0.0.1.54306 > 127.0.0.1.11750: Flags [.], cksum 0xfe28 (incorrect -> 0xb6e6), seq 14, ack 13, win 512, options [nop,nop,TS val 324807087 ecr 324807087], length 0
2022-04-06 10:55:24.590473 IP (tos 0x0, ttl 64, id 63086, offset 0, flags [DF], proto TCP (6), length 569)
    127.0.0.1.54306 > 127.0.0.1.11750: Flags [P.], cksum 0x002e (incorrect -> 0x4012), seq 14:531, ack 13, win 512, options [nop,nop,TS val 324807093 ecr 324807087], length 517
2022-04-06 10:55:24.590483 IP (tos 0x0, ttl 64, id 59773, offset 0, flags [DF], proto TCP (6), length 52)
    127.0.0.1.11750 > 127.0.0.1.54306: Flags [.], cksum 0xfe28 (incorrect -> 0xb4d9), seq 13, ack 531, win 508, options [nop,nop,TS val 324807093 ecr 324807093], length 0
2022-04-06 10:55:24.809405 IP (tos 0x0, ttl 64, id 59774, offset 0, flags [DF], proto TCP (6), length 3340)
    127.0.0.1.11750 > 127.0.0.1.54306: Flags [P.], cksum 0x0b01 (incorrect -> 0xfb9d), seq 13:3301, ack 531, win 512, options [nop,nop,TS val 324807312 ecr 324807093], length 3288
2022-04-06 10:55:24.809414 IP (tos 0x0, ttl 64, id 63087, offset 0, flags [DF], proto TCP (6), length 52)
    127.0.0.1.54306 > 127.0.0.1.11750: Flags [.], cksum 0xfe28 (incorrect -> 0xa658), seq 531, ack 3301, win 495, options [nop,nop,TS val 324807312 ecr 324807312], length 0
2022-04-06 10:55:24.809954 IP (tos 0x0, ttl 64, id 63088, offset 0, flags [DF], proto TCP (6), length 145)
    127.0.0.1.54306 > 127.0.0.1.11750: Flags [P.], cksum 0xfe85 (incorrect -> 0x9f83), seq 531:624, ack 3301, win 512, options [nop,nop,TS val 324807312 ecr 324807312], length 93
2022-04-06 10:55:24.809961 IP (tos 0x0, ttl 64, id 59775, offset 0, flags [DF], proto TCP (6), length 52)
    127.0.0.1.11750 > 127.0.0.1.54306: Flags [.], cksum 0xfe28 (incorrect -> 0xa5ea), seq 3301, ack 624, win 512, options [nop,nop,TS val 324807312 ecr 324807312], length 0
2022-04-06 10:55:25.047704 IP (tos 0x0, ttl 64, id 59776, offset 0, flags [DF], proto TCP (6), length 103)
    127.0.0.1.11750 > 127.0.0.1.54306: Flags [P.], cksum 0xfe5b (incorrect -> 0x1abb), seq 3301:3352, ack 624, win 512, options [nop,nop,TS val 324807550 ecr 324807312], length 51
2022-04-06 10:55:25.047714 IP (tos 0x0, ttl 64, id 63089, offset 0, flags [DF], proto TCP (6), length 52)
    127.0.0.1.54306 > 127.0.0.1.11750: Flags [.], cksum 0xfe28 (incorrect -> 0xa3db), seq 624, ack 3352, win 512, options [nop,nop,TS val 324807550 ecr 324807550], length 0
2022-04-06 10:55:25.048345 IP (tos 0x0, ttl 64, id 63090, offset 0, flags [DF], proto TCP (6), length 351)
    127.0.0.1.54306 > 127.0.0.1.11750: Flags [P.], cksum 0xff53 (incorrect -> 0x1af2), seq 624:923, ack 3352, win 512, options [nop,nop,TS val 324807551 ecr 324807550], length 299
2022-04-06 10:55:25.048352 IP (tos 0x0, ttl 64, id 59777, offset 0, flags [DF], proto TCP (6), length 52)
    127.0.0.1.11750 > 127.0.0.1.54306: Flags [.], cksum 0xfe28 (incorrect -> 0xa2b0), seq 3352, ack 923, win 510, options [nop,nop,TS val 324807551 ecr 324807551], length 0
2022-04-06 10:55:25.276291 IP (tos 0x0, ttl 64, id 59778, offset 0, flags [DF], proto TCP (6), length 3538)
    127.0.0.1.11750 > 127.0.0.1.54306: Flags [P.], cksum 0x0bc7 (incorrect -> 0x3b55), seq 3352:6838, ack 923, win 512, options [nop,nop,TS val 324807779 ecr 324807551], length 3486
2022-04-06 10:55:25.318653 IP (tos 0x0, ttl 64, id 63091, offset 0, flags [DF], proto TCP (6), length 52)
    127.0.0.1.54306 > 127.0.0.1.11750: Flags [.], cksum 0xfe28 (incorrect -> 0x931e), seq 923, ack 6838, win 512, options [nop,nop,TS val 324807821 ecr 324807779], length 0
2022-04-06 10:55:25.318661 IP (tos 0x0, ttl 64, id 59779, offset 0, flags [DF], proto TCP (6), length 11506)
    127.0.0.1.11750 > 127.0.0.1.54306: Flags [P.], cksum 0x2ae7 (incorrect -> 0x6086), seq 6838:18292, ack 923, win 512, options [nop,nop,TS val 324807821 ecr 324807821], length 11454
2022-04-06 10:55:25.318665 IP (tos 0x0, ttl 64, id 63092, offset 0, flags [DF], proto TCP (6), length 52)
    127.0.0.1.54306 > 127.0.0.1.11750: Flags [.], cksum 0xfe28 (incorrect -> 0x6667), seq 923, ack 18292, win 463, options [nop,nop,TS val 324807821 ecr 324807821], length 0
2022-04-06 10:55:25.328788 IP (tos 0x0, ttl 64, id 59780, offset 0, flags [DF], proto TCP (6), length 2488)
    127.0.0.1.11750 > 127.0.0.1.54306: Flags [P.], cksum 0x07ad (incorrect -> 0x24e0), seq 18292:20728, ack 923, win 512, options [nop,nop,TS val 324807831 ecr 324807821], length 2436
2022-04-06 10:55:25.328793 IP (tos 0x0, ttl 64, id 63093, offset 0, flags [DF], proto TCP (6), length 52)
    127.0.0.1.54306 > 127.0.0.1.11750: Flags [.], cksum 0xfe28 (incorrect -> 0x5cac), seq 923, ack 20728, win 498, options [nop,nop,TS val 324807831 ecr 324807831], length 0
2022-04-06 10:55:25.377522 IP (tos 0x0, ttl 64, id 59781, offset 0, flags [DF], proto TCP (6), length 3492)
    127.0.0.1.11750 > 127.0.0.1.54306: Flags [P.], cksum 0x0b99 (incorrect -> 0x5558), seq 20728:24168, ack 923, win 512, options [nop,nop,TS val 324807880 ecr 324807831], length 3440
2022-04-06 10:55:25.377530 IP (tos 0x0, ttl 64, id 63094, offset 0, flags [DF], proto TCP (6), length 52)
    127.0.0.1.54306 > 127.0.0.1.11750: Flags [.], cksum 0xfe28 (incorrect -> 0x4ede), seq 923, ack 24168, win 494, options [nop,nop,TS val 324807880 ecr 324807880], length 0
2022-04-06 10:55:25.394530 IP (tos 0x0, ttl 64, id 59782, offset 0, flags [DF], proto TCP (6), length 3040)
    127.0.0.1.11750 > 127.0.0.1.54306: Flags [P.], cksum 0x09d5 (incorrect -> 0xdfa3), seq 24168:27156, ack 923, win 512, options [nop,nop,TS val 324807897 ecr 324807880], length 2988
2022-04-06 10:55:25.394542 IP (tos 0x0, ttl 64, id 63095, offset 0, flags [DF], proto TCP (6), length 52)
    127.0.0.1.54306 > 127.0.0.1.11750: Flags [.], cksum 0xfe28 (incorrect -> 0x430e), seq 923, ack 27156, win 496, options [nop,nop,TS val 324807897 ecr 324807897], length 0
2022-04-06 10:55:25.399743 IP (tos 0x0, ttl 64, id 59783, offset 0, flags [DF], proto TCP (6), length 4100)
    127.0.0.1.11750 > 127.0.0.1.54306: Flags [P.], cksum 0x0df9 (incorrect -> 0x823d), seq 27156:31204, ack 923, win 512, options [nop,nop,TS val 324807902 ecr 324807897], length 4048
2022-04-06 10:55:25.399752 IP (tos 0x0, ttl 64, id 63096, offset 0, flags [DF], proto TCP (6), length 52)
    127.0.0.1.54306 > 127.0.0.1.11750: Flags [.], cksum 0xfe28 (incorrect -> 0x3338), seq 923, ack 31204, win 492, options [nop,nop,TS val 324807902 ecr 324807902], length 0
2022-04-06 10:55:25.399759 IP (tos 0x0, ttl 64, id 59784, offset 0, flags [DF], proto TCP (6), length 3474)
    127.0.0.1.11750 > 127.0.0.1.54306: Flags [P.], cksum 0x0b87 (incorrect -> 0x920e), seq 31204:34626, ack 923, win 512, options [nop,nop,TS val 324807902 ecr 324807902], length 3422
2022-04-06 10:55:25.399763 IP (tos 0x0, ttl 64, id 63097, offset 0, flags [DF], proto TCP (6), length 52)
    127.0.0.1.54306 > 127.0.0.1.11750: Flags [.], cksum 0xfe28 (incorrect -> 0x25e8), seq 923, ack 34626, win 478, options [nop,nop,TS val 324807902 ecr 324807902], length 0
2022-04-06 10:55:25.411552 IP (tos 0x0, ttl 64, id 59785, offset 0, flags [DF], proto TCP (6), length 4036)
    127.0.0.1.11750 > 127.0.0.1.54306: Flags [P.], cksum 0x0db9 (incorrect -> 0x4f34), seq 34626:38610, ack 923, win 512, options [nop,nop,TS val 324807914 ecr 324807902], length 3984
2022-04-06 10:55:25.411557 IP (tos 0x0, ttl 64, id 63098, offset 0, flags [DF], proto TCP (6), length 52)
    127.0.0.1.54306 > 127.0.0.1.11750: Flags [.], cksum 0xfe28 (incorrect -> 0x1632), seq 923, ack 38610, win 492, options [nop,nop,TS val 324807914 ecr 324807914], length 0
2022-04-06 10:55:25.422206 IP (tos 0x0, ttl 64, id 59786, offset 0, flags [DF], proto TCP (6), length 4100)
    127.0.0.1.11750 > 127.0.0.1.54306: Flags [P.], cksum 0x0df9 (incorrect -> 0xfab1), seq 38610:42658, ack 923, win 512, options [nop,nop,TS val 324807925 ecr 324807914], length 4048
2022-04-06 10:55:25.422212 IP (tos 0x0, ttl 64, id 63099, offset 0, flags [DF], proto TCP (6), length 52)
    127.0.0.1.54306 > 127.0.0.1.11750: Flags [.], cksum 0xfe28 (incorrect -> 0x064c), seq 923, ack 42658, win 492, options [nop,nop,TS val 324807925 ecr 324807925], length 0
2022-04-06 10:55:25.422219 IP (tos 0x0, ttl 64, id 59787, offset 0, flags [DF], proto TCP (6), length 2976)
    127.0.0.1.11750 > 127.0.0.1.54306: Flags [P.], cksum 0x0995 (incorrect -> 0x9ec9), seq 42658:45582, ack 923, win 512, options [nop,nop,TS val 324807925 ecr 324807925], length 2924
2022-04-06 10:55:25.422222 IP (tos 0x0, ttl 64, id 63100, offset 0, flags [DF], proto TCP (6), length 52)
    127.0.0.1.54306 > 127.0.0.1.11750: Flags [.], cksum 0xfe28 (incorrect -> 0xfaeb), seq 923, ack 45582, win 480, options [nop,nop,TS val 324807925 ecr 324807925], length 0
2022-04-06 10:55:25.428770 IP (tos 0x0, ttl 64, id 59788, offset 0, flags [DF], proto TCP (6), length 4100)
    127.0.0.1.11750 > 127.0.0.1.54306: Flags [P.], cksum 0x0df9 (incorrect -> 0xf888), seq 45582:49630, ack 923, win 512, options [nop,nop,TS val 324807931 ecr 324807925], length 4048
2022-04-06 10:55:25.428847 IP (tos 0x0, ttl 64, id 63101, offset 0, flags [DF], proto TCP (6), length 52)
    127.0.0.1.54306 > 127.0.0.1.11750: Flags [.], cksum 0xfe28 (incorrect -> 0xeaef), seq 923, ack 49630, win 512, options [nop,nop,TS val 324807931 ecr 324807931], length 0
2022-04-06 10:55:25.428876 IP (tos 0x0, ttl 64, id 59789, offset 0, flags [DF], proto TCP (6), length 1106)
    127.0.0.1.11750 > 127.0.0.1.54306: Flags [P.], cksum 0x0247 (incorrect -> 0x1e8a), seq 49630:50684, ack 923, win 512, options [nop,nop,TS val 324807931 ecr 324807931], length 1054
2022-04-06 10:55:25.428883 IP (tos 0x0, ttl 64, id 63102, offset 0, flags [DF], proto TCP (6), length 52)
    127.0.0.1.54306 > 127.0.0.1.11750: Flags [.], cksum 0xfe28 (incorrect -> 0xe6d1), seq 923, ack 50684, win 512, options [nop,nop,TS val 324807931 ecr 324807931], length 0
2022-04-06 10:55:25.441686 IP (tos 0x0, ttl 64, id 59790, offset 0, flags [DF], proto TCP (6), length 3538)
    127.0.0.1.11750 > 127.0.0.1.54306: Flags [P.], cksum 0x0bc7 (incorrect -> 0x5ae5), seq 50684:54170, ack 923, win 512, options [nop,nop,TS val 324807944 ecr 324807931], length 3486
2022-04-06 10:55:25.441797 IP (tos 0x0, ttl 64, id 63103, offset 0, flags [DF], proto TCP (6), length 52)
    127.0.0.1.54306 > 127.0.0.1.11750: Flags [.], cksum 0xfe28 (incorrect -> 0xd919), seq 923, ack 54170, win 512, options [nop,nop,TS val 324807944 ecr 324807944], length 0
2022-04-06 10:55:25.445714 IP (tos 0x0, ttl 64, id 59791, offset 0, flags [DF], proto TCP (6), length 1362)
    127.0.0.1.11750 > 127.0.0.1.54306: Flags [P.], cksum 0x0347 (incorrect -> 0x20b8), seq 54170:55480, ack 923, win 512, options [nop,nop,TS val 324807948 ecr 324807944], length 1310
2022-04-06 10:55:25.445755 IP (tos 0x0, ttl 64, id 63104, offset 0, flags [DF], proto TCP (6), length 52)
    127.0.0.1.54306 > 127.0.0.1.11750: Flags [.], cksum 0xfe28 (incorrect -> 0xd3f3), seq 923, ack 55480, win 512, options [nop,nop,TS val 324807948 ecr 324807948], length 0
2022-04-06 10:55:25.469724 IP (tos 0x0, ttl 64, id 59792, offset 0, flags [DF], proto TCP (6), length 4100)
    127.0.0.1.11750 > 127.0.0.1.54306: Flags [P.], cksum 0x0df9 (incorrect -> 0x7bb2), seq 55480:59528, ack 923, win 512, options [nop,nop,TS val 324807972 ecr 324807948], length 4048
2022-04-06 10:55:25.469758 IP (tos 0x0, ttl 64, id 63105, offset 0, flags [DF], proto TCP (6), length 52)
    127.0.0.1.54306 > 127.0.0.1.11750: Flags [.], cksum 0xfe28 (incorrect -> 0xc3f3), seq 923, ack 59528, win 512, options [nop,nop,TS val 324807972 ecr 324807972], length 0
2022-04-06 10:55:25.469763 IP (tos 0x0, ttl 64, id 59793, offset 0, flags [DF], proto TCP (6), length 3244)
    127.0.0.1.11750 > 127.0.0.1.54306: Flags [P.], cksum 0x0aa1 (incorrect -> 0xb3ab), seq 59528:62720, ack 923, win 512, options [nop,nop,TS val 324807972 ecr 324807972], length 3192
2022-04-06 10:55:25.469767 IP (tos 0x0, ttl 64, id 63106, offset 0, flags [DF], proto TCP (6), length 52)
    127.0.0.1.54306 > 127.0.0.1.11750: Flags [.], cksum 0xfe28 (incorrect -> 0xb77b), seq 923, ack 62720, win 512, options [nop,nop,TS val 324807972 ecr 324807972], length 0
2022-04-06 10:55:25.486951 IP (tos 0x0, ttl 64, id 59794, offset 0, flags [DF], proto TCP (6), length 3040)
    127.0.0.1.11750 > 127.0.0.1.54306: Flags [P.], cksum 0x09d5 (incorrect -> 0xe39f), seq 62720:65708, ack 923, win 512, options [nop,nop,TS val 324807989 ecr 324807972], length 2988
2022-04-06 10:55:25.486970 IP (tos 0x0, ttl 64, id 63107, offset 0, flags [DF], proto TCP (6), length 52)
    127.0.0.1.54306 > 127.0.0.1.11750: Flags [.], cksum 0xfe28 (incorrect -> 0xabad), seq 923, ack 65708, win 512, options [nop,nop,TS val 324807989 ecr 324807989], length 0
2022-04-06 10:55:25.493714 IP (tos 0x0, ttl 64, id 59795, offset 0, flags [DF], proto TCP (6), length 3538)
    127.0.0.1.11750 > 127.0.0.1.54306: Flags [P.], cksum 0x0bc7 (incorrect -> 0x99d5), seq 65708:69194, ack 923, win 512, options [nop,nop,TS val 324807996 ecr 324807989], length 3486
2022-04-06 10:55:25.493822 IP (tos 0x0, ttl 64, id 63108, offset 0, flags [DF], proto TCP (6), length 52)
    127.0.0.1.54306 > 127.0.0.1.11750: Flags [.], cksum 0xfe28 (incorrect -> 0x9e01), seq 923, ack 69194, win 512, options [nop,nop,TS val 324807996 ecr 324807996], length 0
2022-04-06 10:55:25.493913 IP (tos 0x0, ttl 64, id 59796, offset 0, flags [DF], proto TCP (6), length 4100)
    127.0.0.1.11750 > 127.0.0.1.54306: Flags [P.], cksum 0x0df9 (incorrect -> 0x7ca5), seq 69194:73242, ack 923, win 512, options [nop,nop,TS val 324807996 ecr 324807996], length 4048
2022-04-06 10:55:25.493934 IP (tos 0x0, ttl 64, id 63109, offset 0, flags [DF], proto TCP (6), length 52)
    127.0.0.1.54306 > 127.0.0.1.11750: Flags [.], cksum 0xfe28 (incorrect -> 0x8e31), seq 923, ack 73242, win 512, options [nop,nop,TS val 324807996 ecr 324807996], length 0
2022-04-06 10:55:25.493939 IP (tos 0x0, ttl 64, id 59797, offset 0, flags [DF], proto TCP (6), length 3972)
    127.0.0.1.11750 > 127.0.0.1.54306: Flags [P.], cksum 0x0d79 (incorrect -> 0x03a6), seq 73242:77162, ack 923, win 512, options [nop,nop,TS val 324807996 ecr 324807996], length 3920
2022-04-06 10:55:25.493946 IP (tos 0x0, ttl 64, id 63110, offset 0, flags [DF], proto TCP (6), length 52)
    127.0.0.1.54306 > 127.0.0.1.11750: Flags [.], cksum 0xfe28 (incorrect -> 0x7ee1), seq 923, ack 77162, win 512, options [nop,nop,TS val 324807996 ecr 324807996], length 0
2022-04-06 10:55:25.494188 IP (tos 0x0, ttl 64, id 59798, offset 0, flags [DF], proto TCP (6), length 2044)
    127.0.0.1.11750 > 127.0.0.1.54306: Flags [P.], cksum 0x05f1 (incorrect -> 0x025f), seq 77162:79154, ack 923, win 512, options [nop,nop,TS val 324807997 ecr 324807996], length 1992
2022-04-06 10:55:25.494198 IP (tos 0x0, ttl 64, id 63111, offset 0, flags [DF], proto TCP (6), length 52)
    127.0.0.1.54306 > 127.0.0.1.11750: Flags [.], cksum 0xfe28 (incorrect -> 0x7717), seq 923, ack 79154, win 512, options [nop,nop,TS val 324807997 ecr 324807997], length 0
2022-04-06 10:55:25.510763 IP (tos 0x0, ttl 64, id 59799, offset 0, flags [DF], proto TCP (6), length 550)
    127.0.0.1.11750 > 127.0.0.1.54306: Flags [P.], cksum 0x001b (incorrect -> 0xb917), seq 79154:79652, ack 923, win 512, options [nop,nop,TS val 324808013 ecr 324807997], length 498
2022-04-06 10:55:25.510781 IP (tos 0x0, ttl 64, id 63112, offset 0, flags [DF], proto TCP (6), length 52)
    127.0.0.1.54306 > 127.0.0.1.11750: Flags [.], cksum 0xfe28 (incorrect -> 0x7505), seq 923, ack 79652, win 512, options [nop,nop,TS val 324808013 ecr 324808013], length 0
2022-04-06 10:55:25.521648 IP (tos 0x0, ttl 64, id 59800, offset 0, flags [DF], proto TCP (6), length 4100)
    127.0.0.1.11750 > 127.0.0.1.54306: Flags [P.], cksum 0x0df9 (incorrect -> 0x4cbe), seq 79652:83700, ack 923, win 512, options [nop,nop,TS val 324808024 ecr 324808013], length 4048
2022-04-06 10:55:25.521780 IP (tos 0x0, ttl 64, id 63113, offset 0, flags [DF], proto TCP (6), length 52)
    127.0.0.1.54306 > 127.0.0.1.11750: Flags [.], cksum 0xfe28 (incorrect -> 0x651f), seq 923, ack 83700, win 512, options [nop,nop,TS val 324808024 ecr 324808024], length 0
2022-04-06 10:55:25.521811 IP (tos 0x0, ttl 64, id 59801, offset 0, flags [DF], proto TCP (6), length 11518)
    127.0.0.1.11750 > 127.0.0.1.54306: Flags [P.], cksum 0x2af3 (incorrect -> 0x7a11), seq 83700:95166, ack 923, win 512, options [nop,nop,TS val 324808024 ecr 324808024], length 11466
2022-04-06 10:55:25.562658 IP (tos 0x0, ttl 64, id 63114, offset 0, flags [DF], proto TCP (6), length 52)
    127.0.0.1.54306 > 127.0.0.1.11750: Flags [.], cksum 0xfe28 (incorrect -> 0x382c), seq 923, ack 95166, win 512, options [nop,nop,TS val 324808065 ecr 324808024], length 0
2022-04-06 10:55:25.562670 IP (tos 0x0, ttl 64, id 59802, offset 0, flags [DF], proto TCP (6), length 15390)
    127.0.0.1.11750 > 127.0.0.1.54306: Flags [P.], cksum 0x3a13 (incorrect -> 0xeb6b), seq 95166:110504, ack 923, win 512, options [nop,nop,TS val 324808065 ecr 324808065], length 15338
2022-04-06 10:55:25.602562 IP (tos 0x0, ttl 64, id 59803, offset 0, flags [DF], proto TCP (6), length 32820)
    127.0.0.1.11750 > 127.0.0.1.54306: Flags [.], cksum 0x7e29 (incorrect -> 0x3a25), seq 110504:143272, ack 923, win 512, options [nop,nop,TS val 324808105 ecr 324808065], length 32768
2022-04-06 10:55:25.602570 IP (tos 0x0, ttl 64, id 63115, offset 0, flags [DF], proto TCP (6), length 52)
    127.0.0.1.54306 > 127.0.0.1.11750: Flags [.], cksum 0xfe28 (incorrect -> 0x7c75), seq 923, ack 143272, win 379, options [nop,nop,TS val 324808105 ecr 324808065], length 0
2022-04-06 10:55:25.602577 IP (tos 0x0, ttl 64, id 59804, offset 0, flags [DF], proto TCP (6), length 152)
    127.0.0.1.11750 > 127.0.0.1.54306: Flags [P.], cksum 0xfe8c (incorrect -> 0xb371), seq 143272:143372, ack 923, win 512, options [nop,nop,TS val 324808105 ecr 324808105], length 100
2022-04-06 10:55:25.602700 IP (tos 0x0, ttl 64, id 63116, offset 0, flags [DF], proto TCP (6), length 52)
    127.0.0.1.54306 > 127.0.0.1.11750: Flags [.], cksum 0xfe28 (incorrect -> 0x7b64), seq 923, ack 143372, win 512, options [nop,nop,TS val 324808105 ecr 324808105], length 0
2022-04-06 10:55:25.611256 IP (tos 0x0, ttl 64, id 59805, offset 0, flags [DF], proto TCP (6), length 3538)
    127.0.0.1.11750 > 127.0.0.1.54306: Flags [P.], cksum 0x0bc7 (incorrect -> 0xa8fc), seq 143372:146858, ack 923, win 512, options [nop,nop,TS val 324808114 ecr 324808105], length 3486
2022-04-06 10:55:25.611314 IP (tos 0x0, ttl 64, id 63117, offset 0, flags [DF], proto TCP (6), length 52)
    127.0.0.1.54306 > 127.0.0.1.11750: Flags [.], cksum 0xfe28 (incorrect -> 0x6db4), seq 923, ack 146858, win 512, options [nop,nop,TS val 324808114 ecr 324808114], length 0
2022-04-06 10:55:25.611362 IP (tos 0x0, ttl 64, id 59806, offset 0, flags [DF], proto TCP (6), length 4100)
    127.0.0.1.11750 > 127.0.0.1.54306: Flags [P.], cksum 0x0df9 (incorrect -> 0x8ca5), seq 146858:150906, ack 923, win 512, options [nop,nop,TS val 324808114 ecr 324808114], length 4048
2022-04-06 10:55:25.611392 IP (tos 0x0, ttl 64, id 63118, offset 0, flags [DF], proto TCP (6), length 52)
    127.0.0.1.54306 > 127.0.0.1.11750: Flags [.], cksum 0xfe28 (incorrect -> 0x5de4), seq 923, ack 150906, win 512, options [nop,nop,TS val 324808114 ecr 324808114], length 0
2022-04-06 10:55:25.611398 IP (tos 0x0, ttl 64, id 59807, offset 0, flags [DF], proto TCP (6), length 3972)
    127.0.0.1.11750 > 127.0.0.1.54306: Flags [P.], cksum 0x0d79 (incorrect -> 0x5c5b), seq 150906:154826, ack 923, win 512, options [nop,nop,TS val 324808114 ecr 324808114], length 3920
2022-04-06 10:55:25.611458 IP (tos 0x0, ttl 64, id 63119, offset 0, flags [DF], proto TCP (6), length 52)
    127.0.0.1.54306 > 127.0.0.1.11750: Flags [.], cksum 0xfe28 (incorrect -> 0x4e94), seq 923, ack 154826, win 512, options [nop,nop,TS val 324808114 ecr 324808114], length 0
2022-04-06 10:55:25.614603 IP (tos 0x0, ttl 64, id 59808, offset 0, flags [DF], proto TCP (6), length 4100)
    127.0.0.1.11750 > 127.0.0.1.54306: Flags [P.], cksum 0x0df9 (incorrect -> 0x33a7), seq 154826:158874, ack 923, win 512, options [nop,nop,TS val 324808117 ecr 324808114], length 4048
2022-04-06 10:55:25.614629 IP (tos 0x0, ttl 64, id 63120, offset 0, flags [DF], proto TCP (6), length 52)
    127.0.0.1.54306 > 127.0.0.1.11750: Flags [.], cksum 0xfe28 (incorrect -> 0x3ebe), seq 923, ack 158874, win 512, options [nop,nop,TS val 324808117 ecr 324808117], length 0
2022-04-06 10:55:25.614632 IP (tos 0x0, ttl 64, id 59809, offset 0, flags [DF], proto TCP (6), length 984)
    127.0.0.1.11750 > 127.0.0.1.54306: Flags [P.], cksum 0x01cd (incorrect -> 0xdd0c), seq 158874:159806, ack 923, win 512, options [nop,nop,TS val 324808117 ecr 324808117], length 932
2022-04-06 10:55:25.614636 IP (tos 0x0, ttl 64, id 63121, offset 0, flags [DF], proto TCP (6), length 52)
    127.0.0.1.54306 > 127.0.0.1.11750: Flags [.], cksum 0xfe28 (incorrect -> 0x3b1a), seq 923, ack 159806, win 512, options [nop,nop,TS val 324808117 ecr 324808117], length 0
2022-04-06 10:55:25.619559 IP (tos 0x0, ttl 64, id 59810, offset 0, flags [DF], proto TCP (6), length 1546)
    127.0.0.1.11750 > 127.0.0.1.54306: Flags [P.], cksum 0x03ff (incorrect -> 0x7800), seq 159806:161300, ack 923, win 512, options [nop,nop,TS val 324808122 ecr 324808117], length 1494
2022-04-06 10:55:25.619589 IP (tos 0x0, ttl 64, id 63122, offset 0, flags [DF], proto TCP (6), length 52)
    127.0.0.1.54306 > 127.0.0.1.11750: Flags [.], cksum 0xfe28 (incorrect -> 0x353a), seq 923, ack 161300, win 512, options [nop,nop,TS val 324808122 ecr 324808122], length 0
2022-04-06 10:55:25.635284 IP (tos 0x0, ttl 64, id 59811, offset 0, flags [DF], proto TCP (6), length 4100)
    127.0.0.1.11750 > 127.0.0.1.54306: Flags [P.], cksum 0x0df9 (incorrect -> 0x52b1), seq 161300:165348, ack 923, win 512, options [nop,nop,TS val 324808138 ecr 324808122], length 4048
2022-04-06 10:55:25.635374 IP (tos 0x0, ttl 64, id 63123, offset 0, flags [DF], proto TCP (6), length 52)
    127.0.0.1.54306 > 127.0.0.1.11750: Flags [.], cksum 0xfe28 (incorrect -> 0x254a), seq 923, ack 165348, win 512, options [nop,nop,TS val 324808138 ecr 324808138], length 0
2022-04-06 10:55:25.635381 IP (tos 0x0, ttl 64, id 59812, offset 0, flags [DF], proto TCP (6), length 7458)
    127.0.0.1.11750 > 127.0.0.1.54306: Flags [P.], cksum 0x1b17 (incorrect -> 0xe932), seq 165348:172754, ack 923, win 512, options [nop,nop,TS val 324808138 ecr 324808138], length 7406
2022-04-06 10:55:25.635437 IP (tos 0x0, ttl 64, id 63124, offset 0, flags [DF], proto TCP (6), length 52)
    127.0.0.1.54306 > 127.0.0.1.11750: Flags [.], cksum 0xfe28 (incorrect -> 0x085c), seq 923, ack 172754, win 512, options [nop,nop,TS val 324808138 ecr 324808138], length 0
2022-04-06 10:55:25.636709 IP (tos 0x0, ttl 64, id 59813, offset 0, flags [DF], proto TCP (6), length 4100)
    127.0.0.1.11750 > 127.0.0.1.54306: Flags [P.], cksum 0x0df9 (incorrect -> 0x4493), seq 172754:176802, ack 923, win 512, options [nop,nop,TS val 324808139 ecr 324808138], length 4048
2022-04-06 10:55:25.636721 IP (tos 0x0, ttl 64, id 63125, offset 0, flags [DF], proto TCP (6), length 52)
    127.0.0.1.54306 > 127.0.0.1.11750: Flags [.], cksum 0xfe28 (incorrect -> 0xf889), seq 923, ack 176802, win 512, options [nop,nop,TS val 324808139 ecr 324808139], length 0
2022-04-06 10:55:25.636725 IP (tos 0x0, ttl 64, id 59814, offset 0, flags [DF], proto TCP (6), length 486)
    127.0.0.1.11750 > 127.0.0.1.54306: Flags [P.], cksum 0xffda (incorrect -> 0xfbc4), seq 176802:177236, ack 923, win 512, options [nop,nop,TS val 324808139 ecr 324808139], length 434
2022-04-06 10:55:25.636728 IP (tos 0x0, ttl 64, id 63126, offset 0, flags [DF], proto TCP (6), length 52)
    127.0.0.1.54306 > 127.0.0.1.11750: Flags [.], cksum 0xfe28 (incorrect -> 0xf6d7), seq 923, ack 177236, win 512, options [nop,nop,TS val 324808139 ecr 324808139], length 0
2022-04-06 10:55:25.638514 IP (tos 0x0, ttl 64, id 59815, offset 0, flags [DF], proto TCP (6), length 1048)
    127.0.0.1.11750 > 127.0.0.1.54306: Flags [P.], cksum 0x020d (incorrect -> 0x28ce), seq 177236:178232, ack 923, win 512, options [nop,nop,TS val 324808141 ecr 324808139], length 996
2022-04-06 10:55:25.638525 IP (tos 0x0, ttl 64, id 63127, offset 0, flags [DF], proto TCP (6), length 52)
    127.0.0.1.54306 > 127.0.0.1.11750: Flags [.], cksum 0xfe28 (incorrect -> 0xf2ef), seq 923, ack 178232, win 512, options [nop,nop,TS val 324808141 ecr 324808141], length 0
2022-04-06 10:55:25.655664 IP (tos 0x0, ttl 64, id 59816, offset 0, flags [DF], proto TCP (6), length 1048)
    127.0.0.1.11750 > 127.0.0.1.54306: Flags [P.], cksum 0x020d (incorrect -> 0x6884), seq 178232:179228, ack 923, win 512, options [nop,nop,TS val 324808158 ecr 324808141], length 996
2022-04-06 10:55:25.682203 IP (tos 0x0, ttl 64, id 59817, offset 0, flags [DF], proto TCP (6), length 32820)
    127.0.0.1.11750 > 127.0.0.1.54306: Flags [.], cksum 0x7e29 (incorrect -> 0x7d74), seq 179228:211996, ack 923, win 512, options [nop,nop,TS val 324808185 ecr 324808141], length 32768
2022-04-06 10:55:25.682231 IP (tos 0x0, ttl 64, id 63128, offset 0, flags [DF], proto TCP (6), length 52)
    127.0.0.1.54306 > 127.0.0.1.11750: Flags [.], cksum 0xfe28 (incorrect -> 0x6f53), seq 923, ack 211996, win 379, options [nop,nop,TS val 324808185 ecr 324808158], length 0
2022-04-06 10:55:25.682238 IP (tos 0x0, ttl 64, id 59818, offset 0, flags [DF], proto TCP (6), length 3728)
    127.0.0.1.11750 > 127.0.0.1.54306: Flags [P.], cksum 0x0c85 (incorrect -> 0xc1d4), seq 211996:215672, ack 923, win 512, options [nop,nop,TS val 324808185 ecr 324808185], length 3676
2022-04-06 10:55:25.682344 IP (tos 0x0, ttl 64, id 63129, offset 0, flags [DF], proto TCP (6), length 52)
    127.0.0.1.54306 > 127.0.0.1.11750: Flags [.], cksum 0xfe28 (incorrect -> 0x6057), seq 923, ack 215672, win 512, options [nop,nop,TS val 324808185 ecr 324808185], length 0
2022-04-06 10:55:25.687143 IP (tos 0x0, ttl 64, id 59819, offset 0, flags [DF], proto TCP (6), length 2044)
    127.0.0.1.11750 > 127.0.0.1.54306: Flags [P.], cksum 0x05f1 (incorrect -> 0xde2e), seq 215672:217664, ack 923, win 512, options [nop,nop,TS val 324808190 ecr 324808185], length 1992
2022-04-06 10:55:25.687192 IP (tos 0x0, ttl 64, id 63130, offset 0, flags [DF], proto TCP (6), length 52)
    127.0.0.1.54306 > 127.0.0.1.11750: Flags [.], cksum 0xfe28 (incorrect -> 0x5885), seq 923, ack 217664, win 512, options [nop,nop,TS val 324808190 ecr 324808190], length 0
200, 7.039256572723389, 1.493157148361206