2022-04-06 05:12:40.527733 IP (tos 0x0, ttl 64, id 12475, offset 0, flags [DF], proto TCP (6), length 60)
    127.0.0.1.47584 > 127.0.0.1.9650: Flags [S], cksum 0xfe30 (incorrect -> 0x81c4), seq 3006842873, win 65495, options [mss 65495,sackOK,TS val 304243030 ecr 0,nop,wscale 7], length 0
2022-04-06 05:12:40.527743 IP (tos 0x0, ttl 64, id 0, offset 0, flags [DF], proto TCP (6), length 60)
    127.0.0.1.9650 > 127.0.0.1.47584: Flags [S.], cksum 0xfe30 (incorrect -> 0xc3da), seq 472133192, ack 3006842874, win 65483, options [mss 65495,sackOK,TS val 304243030 ecr 304243030,nop,wscale 7], length 0
2022-04-06 05:12:40.527751 IP (tos 0x0, ttl 64, id 12476, offset 0, flags [DF], proto TCP (6), length 52)
    127.0.0.1.47584 > 127.0.0.1.9650: Flags [.], cksum 0xfe28 (incorrect -> 0xea96), seq 1, ack 1, win 512, options [nop,nop,TS val 304243030 ecr 304243030], length 0
2022-04-06 05:12:40.527863 IP (tos 0x0, ttl 64, id 12477, offset 0, flags [DF], proto TCP (6), length 55)
    127.0.0.1.47584 > 127.0.0.1.9650: Flags [P.], cksum 0xfe2b (incorrect -> 0xe58a), seq 1:4, ack 1, win 512, options [nop,nop,TS val 304243030 ecr 304243030], length 3
2022-04-06 05:12:40.527876 IP (tos 0x0, ttl 64, id 11807, offset 0, flags [DF], proto TCP (6), length 52)
    127.0.0.1.9650 > 127.0.0.1.47584: Flags [.], cksum 0xfe28 (incorrect -> 0xea93), seq 1, ack 4, win 512, options [nop,nop,TS val 304243030 ecr 304243030], length 0
2022-04-06 05:12:40.527904 IP (tos 0x0, ttl 64, id 11808, offset 0, flags [DF], proto TCP (6), length 54)
    127.0.0.1.9650 > 127.0.0.1.47584: Flags [P.], cksum 0xfe2a (incorrect -> 0xe589), seq 1:3, ack 4, win 512, options [nop,nop,TS val 304243030 ecr 304243030], length 2
2022-04-06 05:12:40.527914 IP (tos 0x0, ttl 64, id 12478, offset 0, flags [DF], proto TCP (6), length 52)
    127.0.0.1.47584 > 127.0.0.1.9650: Flags [.], cksum 0xfe28 (incorrect -> 0xea91), seq 4, ack 3, win 512, options [nop,nop,TS val 304243030 ecr 304243030], length 0
2022-04-06 05:12:40.539871 IP (tos 0x0, ttl 64, id 12479, offset 0, flags [DF], proto TCP (6), length 62)
    127.0.0.1.47584 > 127.0.0.1.9650: Flags [P.], cksum 0xfe32 (incorrect -> 0x7d74), seq 4:14, ack 3, win 512, options [nop,nop,TS val 304243042 ecr 304243030], length 10
2022-04-06 05:12:40.539888 IP (tos 0x0, ttl 64, id 11809, offset 0, flags [DF], proto TCP (6), length 52)
    127.0.0.1.9650 > 127.0.0.1.47584: Flags [.], cksum 0xfe28 (incorrect -> 0xea6f), seq 3, ack 14, win 512, options [nop,nop,TS val 304243042 ecr 304243042], length 0
2022-04-06 05:12:40.648175 IP (tos 0x0, ttl 64, id 11810, offset 0, flags [DF], proto TCP (6), length 62)
    127.0.0.1.9650 > 127.0.0.1.47584: Flags [P.], cksum 0xfe32 (incorrect -> 0xe4ef), seq 3:13, ack 14, win 512, options [nop,nop,TS val 304243151 ecr 304243042], length 10
2022-04-06 05:12:40.648184 IP (tos 0x0, ttl 64, id 12480, offset 0, flags [DF], proto TCP (6), length 52)
    127.0.0.1.47584 > 127.0.0.1.9650: Flags [.], cksum 0xfe28 (incorrect -> 0xe98b), seq 14, ack 13, win 512, options [nop,nop,TS val 304243151 ecr 304243151], length 0
2022-04-06 05:12:40.654030 IP (tos 0x0, ttl 64, id 12481, offset 0, flags [DF], proto TCP (6), length 569)
    127.0.0.1.47584 > 127.0.0.1.9650: Flags [P.], cksum 0x002e (incorrect -> 0xd12a), seq 14:531, ack 13, win 512, options [nop,nop,TS val 304243156 ecr 304243151], length 517
2022-04-06 05:12:40.654038 IP (tos 0x0, ttl 64, id 11811, offset 0, flags [DF], proto TCP (6), length 52)
    127.0.0.1.9650 > 127.0.0.1.47584: Flags [.], cksum 0xfe28 (incorrect -> 0xe780), seq 13, ack 531, win 508, options [nop,nop,TS val 304243156 ecr 304243156], length 0
200, 6.94659161567688, 0.4011657238006592