2022-04-06 14:45:10.104095 IP (tos 0x0, ttl 64, id 33772, offset 0, flags [DF], proto TCP (6), length 60)
    127.0.0.1.41776 > 127.0.0.1.11650: Flags [S], cksum 0xfe30 (incorrect -> 0x6f9c), seq 227895952, win 65495, options [mss 65495,sackOK,TS val 338592607 ecr 0,nop,wscale 7], length 0
2022-04-06 14:45:10.104107 IP (tos 0x0, ttl 64, id 0, offset 0, flags [DF], proto TCP (6), length 60)
    127.0.0.1.11650 > 127.0.0.1.41776: Flags [S.], cksum 0xfe30 (incorrect -> 0x2788), seq 2979921635, ack 227895953, win 65483, options [mss 65495,sackOK,TS val 338592607 ecr 338592607,nop,wscale 7], length 0
2022-04-06 14:45:10.104117 IP (tos 0x0, ttl 64, id 33773, offset 0, flags [DF], proto TCP (6), length 52)
    127.0.0.1.41776 > 127.0.0.1.11650: Flags [.], cksum 0xfe28 (incorrect -> 0x4e44), seq 1, ack 1, win 512, options [nop,nop,TS val 338592607 ecr 338592607], length 0
2022-04-06 14:45:10.104216 IP (tos 0x0, ttl 64, id 33774, offset 0, flags [DF], proto TCP (6), length 55)
    127.0.0.1.41776 > 127.0.0.1.11650: Flags [P.], cksum 0xfe2b (incorrect -> 0x4938), seq 1:4, ack 1, win 512, options [nop,nop,TS val 338592607 ecr 338592607], length 3
2022-04-06 14:45:10.104220 IP (tos 0x0, ttl 64, id 13496, offset 0, flags [DF], proto TCP (6), length 52)
    127.0.0.1.11650 > 127.0.0.1.41776: Flags [.], cksum 0xfe28 (incorrect -> 0x4e41), seq 1, ack 4, win 512, options [nop,nop,TS val 338592607 ecr 338592607], length 0
2022-04-06 14:45:10.104295 IP (tos 0x0, ttl 64, id 13497, offset 0, flags [DF], proto TCP (6), length 54)
    127.0.0.1.11650 > 127.0.0.1.41776: Flags [P.], cksum 0xfe2a (incorrect -> 0x4937), seq 1:3, ack 4, win 512, options [nop,nop,TS val 338592607 ecr 338592607], length 2
2022-04-06 14:45:10.104315 IP (tos 0x0, ttl 64, id 33775, offset 0, flags [DF], proto TCP (6), length 52)
    127.0.0.1.41776 > 127.0.0.1.11650: Flags [.], cksum 0xfe28 (incorrect -> 0x4e3f), seq 4, ack 3, win 512, options [nop,nop,TS val 338592607 ecr 338592607], length 0
2022-04-06 14:45:10.106016 IP (tos 0x0, ttl 64, id 33776, offset 0, flags [DF], proto TCP (6), length 62)
    127.0.0.1.41776 > 127.0.0.1.11650: Flags [P.], cksum 0xfe32 (incorrect -> 0xaef4), seq 4:14, ack 3, win 512, options [nop,nop,TS val 338592608 ecr 338592607], length 10
2022-04-06 14:45:10.106022 IP (tos 0x0, ttl 64, id 13498, offset 0, flags [DF], proto TCP (6), length 52)
    127.0.0.1.11650 > 127.0.0.1.41776: Flags [.], cksum 0xfe28 (incorrect -> 0x4e33), seq 3, ack 14, win 512, options [nop,nop,TS val 338592608 ecr 338592608], length 0
2022-04-06 14:45:10.188267 IP (tos 0x0, ttl 64, id 13499, offset 0, flags [DF], proto TCP (6), length 62)
    127.0.0.1.11650 > 127.0.0.1.41776: Flags [P.], cksum 0xfe32 (incorrect -> 0x48cd), seq 3:13, ack 14, win 512, options [nop,nop,TS val 338592691 ecr 338592608], length 10
2022-04-06 14:45:10.188276 IP (tos 0x0, ttl 64, id 33777, offset 0, flags [DF], proto TCP (6), length 52)
    127.0.0.1.41776 > 127.0.0.1.11650: Flags [.], cksum 0xfe28 (incorrect -> 0x4d83), seq 14, ack 13, win 512, options [nop,nop,TS val 338592691 ecr 338592691], length 0
2022-04-06 14:45:10.193983 IP (tos 0x0, ttl 64, id 33778, offset 0, flags [DF], proto TCP (6), length 569)
    127.0.0.1.41776 > 127.0.0.1.11650: Flags [P.], cksum 0x002e (incorrect -> 0xa27d), seq 14:531, ack 13, win 512, options [nop,nop,TS val 338592696 ecr 338592691], length 517
2022-04-06 14:45:10.193990 IP (tos 0x0, ttl 64, id 13500, offset 0, flags [DF], proto TCP (6), length 52)
    127.0.0.1.11650 > 127.0.0.1.41776: Flags [.], cksum 0xfe28 (incorrect -> 0x4b78), seq 13, ack 531, win 508, options [nop,nop,TS val 338592696 ecr 338592696], length 0
2022-04-06 14:45:10.276924 IP (tos 0x0, ttl 64, id 13501, offset 0, flags [DF], proto TCP (6), length 3538)
    127.0.0.1.11650 > 127.0.0.1.41776: Flags [P.], cksum 0x0bc7 (incorrect -> 0x30e3), seq 13:3499, ack 531, win 512, options [nop,nop,TS val 338592779 ecr 338592696], length 3486
2022-04-06 14:45:10.276933 IP (tos 0x0, ttl 64, id 33779, offset 0, flags [DF], proto TCP (6), length 52)
    127.0.0.1.41776 > 127.0.0.1.11650: Flags [.], cksum 0xfe28 (incorrect -> 0x3d42), seq 531, ack 3499, win 494, options [nop,nop,TS val 338592779 ecr 338592779], length 0
2022-04-06 14:45:10.317645 IP (tos 0x0, ttl 64, id 13502, offset 0, flags [DF], proto TCP (6), length 1217)
    127.0.0.1.11650 > 127.0.0.1.41776: Flags [P.], cksum 0x02b6 (incorrect -> 0x0ab1), seq 3499:4664, ack 531, win 512, options [nop,nop,TS val 338592820 ecr 338592779], length 1165
2022-04-06 14:45:10.317650 IP (tos 0x0, ttl 64, id 33780, offset 0, flags [DF], proto TCP (6), length 52)
    127.0.0.1.41776 > 127.0.0.1.11650: Flags [.], cksum 0xfe28 (incorrect -> 0x385a), seq 531, ack 4664, win 503, options [nop,nop,TS val 338592820 ecr 338592820], length 0
2022-04-06 14:45:10.318017 IP (tos 0x0, ttl 64, id 33781, offset 0, flags [DF], proto TCP (6), length 132)
    127.0.0.1.41776 > 127.0.0.1.11650: Flags [P.], cksum 0xfe78 (incorrect -> 0x1c15), seq 531:611, ack 4664, win 503, options [nop,nop,TS val 338592820 ecr 338592820], length 80
2022-04-06 14:45:10.318024 IP (tos 0x0, ttl 64, id 13503, offset 0, flags [DF], proto TCP (6), length 52)
    127.0.0.1.11650 > 127.0.0.1.41776: Flags [.], cksum 0xfe28 (incorrect -> 0x3801), seq 4664, ack 611, win 512, options [nop,nop,TS val 338592820 ecr 338592820], length 0
2022-04-06 14:45:10.318344 IP (tos 0x0, ttl 64, id 33782, offset 0, flags [DF], proto TCP (6), length 337)
    127.0.0.1.41776 > 127.0.0.1.11650: Flags [P.], cksum 0xff45 (incorrect -> 0x94be), seq 611:896, ack 4664, win 503, options [nop,nop,TS val 338592821 ecr 338592820], length 285
2022-04-06 14:45:10.318351 IP (tos 0x0, ttl 64, id 13504, offset 0, flags [DF], proto TCP (6), length 52)
    127.0.0.1.11650 > 127.0.0.1.41776: Flags [.], cksum 0xfe28 (incorrect -> 0x36e4), seq 4664, ack 896, win 510, options [nop,nop,TS val 338592821 ecr 338592821], length 0
2022-04-06 14:45:10.491345 IP (tos 0x0, ttl 64, id 13505, offset 0, flags [DF], proto TCP (6), length 483)
    127.0.0.1.11650 > 127.0.0.1.41776: Flags [P.], cksum 0xffd7 (incorrect -> 0x29ee), seq 4664:5095, ack 896, win 512, options [nop,nop,TS val 338592994 ecr 338592821], length 431
2022-04-06 14:45:10.491350 IP (tos 0x0, ttl 64, id 33783, offset 0, flags [DF], proto TCP (6), length 52)
    127.0.0.1.41776 > 127.0.0.1.11650: Flags [.], cksum 0xfe28 (incorrect -> 0x33df), seq 896, ack 5095, win 506, options [nop,nop,TS val 338592994 ecr 338592994], length 0
2022-04-06 14:45:10.492046 IP (tos 0x0, ttl 64, id 33784, offset 0, flags [DF], proto TCP (6), length 52)
    127.0.0.1.41776 > 127.0.0.1.11650: Flags [F.], cksum 0xfe28 (incorrect -> 0x33d8), seq 896, ack 5095, win 512, options [nop,nop,TS val 338592994 ecr 338592994], length 0
2022-04-06 14:45:10.492085 IP (tos 0x0, ttl 64, id 13506, offset 0, flags [DF], proto TCP (6), length 52)
    127.0.0.1.11650 > 127.0.0.1.41776: Flags [F.], cksum 0xfe28 (incorrect -> 0x33d6), seq 5095, ack 897, win 512, options [nop,nop,TS val 338592995 ecr 338592994], length 0
2022-04-06 14:45:10.492099 IP (tos 0x0, ttl 64, id 33785, offset 0, flags [DF], proto TCP (6), length 52)
    127.0.0.1.41776 > 127.0.0.1.11650: Flags [.], cksum 0xfe28 (incorrect -> 0x33d5), seq 897, ack 5096, win 512, options [nop,nop,TS val 338592995 ecr 338592995], length 0
2022-04-06 14:45:10.493035 IP (tos 0x0, ttl 64, id 50531, offset 0, flags [DF], proto TCP (6), length 60)
    127.0.0.1.41778 > 127.0.0.1.11650: Flags [S], cksum 0xfe30 (incorrect -> 0xd1ce), seq 790095189, win 65495, options [mss 65495,sackOK,TS val 338592995 ecr 0,nop,wscale 7], length 0
2022-04-06 14:45:10.493042 IP (tos 0x0, ttl 64, id 0, offset 0, flags [DF], proto TCP (6), length 60)
    127.0.0.1.11650 > 127.0.0.1.41778: Flags [S.], cksum 0xfe30 (incorrect -> 0xbb19), seq 67074463, ack 790095190, win 65483, options [mss 65495,sackOK,TS val 338592995 ecr 338592995,nop,wscale 7], length 0
2022-04-06 14:45:10.493047 IP (tos 0x0, ttl 64, id 50532, offset 0, flags [DF], proto TCP (6), length 52)
    127.0.0.1.41778 > 127.0.0.1.11650: Flags [.], cksum 0xfe28 (incorrect -> 0xe1d5), seq 1, ack 1, win 512, options [nop,nop,TS val 338592995 ecr 338592995], length 0
2022-04-06 14:45:10.493119 IP (tos 0x0, ttl 64, id 50533, offset 0, flags [DF], proto TCP (6), length 55)
    127.0.0.1.41778 > 127.0.0.1.11650: Flags [P.], cksum 0xfe2b (incorrect -> 0xdcc8), seq 1:4, ack 1, win 512, options [nop,nop,TS val 338592996 ecr 338592995], length 3
2022-04-06 14:45:10.493123 IP (tos 0x0, ttl 64, id 63019, offset 0, flags [DF], proto TCP (6), length 52)
    127.0.0.1.11650 > 127.0.0.1.41778: Flags [.], cksum 0xfe28 (incorrect -> 0xe1d0), seq 1, ack 4, win 512, options [nop,nop,TS val 338592996 ecr 338592996], length 0
2022-04-06 14:45:10.493140 IP (tos 0x0, ttl 64, id 63020, offset 0, flags [DF], proto TCP (6), length 54)
    127.0.0.1.11650 > 127.0.0.1.41778: Flags [P.], cksum 0xfe2a (incorrect -> 0xdcc6), seq 1:3, ack 4, win 512, options [nop,nop,TS val 338592996 ecr 338592996], length 2
2022-04-06 14:45:10.493145 IP (tos 0x0, ttl 64, id 50534, offset 0, flags [DF], proto TCP (6), length 52)
    127.0.0.1.41778 > 127.0.0.1.11650: Flags [.], cksum 0xfe28 (incorrect -> 0xe1ce), seq 4, ack 3, win 512, options [nop,nop,TS val 338592996 ecr 338592996], length 0
2022-04-06 14:45:10.494076 IP (tos 0x0, ttl 64, id 50535, offset 0, flags [DF], proto TCP (6), length 62)
    127.0.0.1.41778 > 127.0.0.1.11650: Flags [P.], cksum 0xfe32 (incorrect -> 0x4284), seq 4:14, ack 3, win 512, options [nop,nop,TS val 338592997 ecr 338592996], length 10
2022-04-06 14:45:10.494089 IP (tos 0x0, ttl 64, id 63021, offset 0, flags [DF], proto TCP (6), length 52)
    127.0.0.1.11650 > 127.0.0.1.41778: Flags [.], cksum 0xfe28 (incorrect -> 0xe1c2), seq 3, ack 14, win 512, options [nop,nop,TS val 338592997 ecr 338592997], length 0
2022-04-06 14:45:10.611251 IP (tos 0x0, ttl 64, id 63022, offset 0, flags [DF], proto TCP (6), length 62)
    127.0.0.1.11650 > 127.0.0.1.41778: Flags [P.], cksum 0xfe32 (incorrect -> 0xdc3a), seq 3:13, ack 14, win 512, options [nop,nop,TS val 338593114 ecr 338592997], length 10
2022-04-06 14:45:10.611264 IP (tos 0x0, ttl 64, id 50536, offset 0, flags [DF], proto TCP (6), length 52)
    127.0.0.1.41778 > 127.0.0.1.11650: Flags [.], cksum 0xfe28 (incorrect -> 0xe0ce), seq 14, ack 13, win 512, options [nop,nop,TS val 338593114 ecr 338593114], length 0
2022-04-06 14:45:10.617600 IP (tos 0x0, ttl 64, id 50537, offset 0, flags [DF], proto TCP (6), length 569)
    127.0.0.1.41778 > 127.0.0.1.11650: Flags [P.], cksum 0x002e (incorrect -> 0xbe08), seq 14:531, ack 13, win 512, options [nop,nop,TS val 338593120 ecr 338593114], length 517
2022-04-06 14:45:10.617606 IP (tos 0x0, ttl 64, id 63023, offset 0, flags [DF], proto TCP (6), length 52)
    127.0.0.1.11650 > 127.0.0.1.41778: Flags [.], cksum 0xfe28 (incorrect -> 0xdec1), seq 13, ack 531, win 508, options [nop,nop,TS val 338593120 ecr 338593120], length 0
2022-04-06 14:45:10.702447 IP (tos 0x0, ttl 64, id 63024, offset 0, flags [DF], proto TCP (6), length 3538)
    127.0.0.1.11650 > 127.0.0.1.41778: Flags [P.], cksum 0x0bc7 (incorrect -> 0xa353), seq 13:3499, ack 531, win 512, options [nop,nop,TS val 338593205 ecr 338593120], length 3486
2022-04-06 14:45:10.702453 IP (tos 0x0, ttl 64, id 50538, offset 0, flags [DF], proto TCP (6), length 52)
    127.0.0.1.41778 > 127.0.0.1.11650: Flags [.], cksum 0xfe28 (incorrect -> 0xd087), seq 531, ack 3499, win 494, options [nop,nop,TS val 338593205 ecr 338593205], length 0
2022-04-06 14:45:10.740870 IP (tos 0x0, ttl 64, id 63025, offset 0, flags [DF], proto TCP (6), length 1217)
    127.0.0.1.11650 > 127.0.0.1.41778: Flags [P.], cksum 0x02b6 (incorrect -> 0x62f5), seq 3499:4664, ack 531, win 512, options [nop,nop,TS val 338593243 ecr 338593205], length 1165
2022-04-06 14:45:10.740884 IP (tos 0x0, ttl 64, id 50539, offset 0, flags [DF], proto TCP (6), length 52)
    127.0.0.1.41778 > 127.0.0.1.11650: Flags [.], cksum 0xfe28 (incorrect -> 0xcba5), seq 531, ack 4664, win 503, options [nop,nop,TS val 338593243 ecr 338593243], length 0
2022-04-06 14:45:10.741550 IP (tos 0x0, ttl 64, id 50540, offset 0, flags [DF], proto TCP (6), length 132)
    127.0.0.1.41778 > 127.0.0.1.11650: Flags [P.], cksum 0xfe78 (incorrect -> 0xd777), seq 531:611, ack 4664, win 503, options [nop,nop,TS val 338593244 ecr 338593243], length 80
2022-04-06 14:45:10.741576 IP (tos 0x0, ttl 64, id 63026, offset 0, flags [DF], proto TCP (6), length 52)
    127.0.0.1.11650 > 127.0.0.1.41778: Flags [.], cksum 0xfe28 (incorrect -> 0xcb4a), seq 4664, ack 611, win 512, options [nop,nop,TS val 338593244 ecr 338593244], length 0
2022-04-06 14:45:10.742030 IP (tos 0x0, ttl 64, id 50541, offset 0, flags [DF], proto TCP (6), length 344)
    127.0.0.1.41778 > 127.0.0.1.11650: Flags [P.], cksum 0xff4c (incorrect -> 0x2412), seq 611:903, ack 4664, win 503, options [nop,nop,TS val 338593244 ecr 338593244], length 292
2022-04-06 14:45:10.742046 IP (tos 0x0, ttl 64, id 63027, offset 0, flags [DF], proto TCP (6), length 52)
    127.0.0.1.11650 > 127.0.0.1.41778: Flags [.], cksum 0xfe28 (incorrect -> 0xca28), seq 4664, ack 903, win 510, options [nop,nop,TS val 338593244 ecr 338593244], length 0
200, 123.34438824653625, 1.5491981506347656