2022-04-06 03:15:14.142848 IP (tos 0x0, ttl 64, id 12179, offset 0, flags [DF], proto TCP (6), length 60)
    127.0.0.1.36342 > 127.0.0.1.11850: Flags [S], cksum 0xfe30 (incorrect -> 0x2f0a), seq 2445599958, win 65495, options [mss 65495,sackOK,TS val 297196645 ecr 0,nop,wscale 7], length 0
2022-04-06 03:15:14.142854 IP (tos 0x0, ttl 64, id 0, offset 0, flags [DF], proto TCP (6), length 60)
    127.0.0.1.11850 > 127.0.0.1.36342: Flags [S.], cksum 0xfe30 (incorrect -> 0x9472), seq 2225154005, ack 2445599959, win 65483, options [mss 65495,sackOK,TS val 297196645 ecr 297196645,nop,wscale 7], length 0
2022-04-06 03:15:14.142860 IP (tos 0x0, ttl 64, id 12180, offset 0, flags [DF], proto TCP (6), length 52)
    127.0.0.1.36342 > 127.0.0.1.11850: Flags [.], cksum 0xfe28 (incorrect -> 0xbb2e), seq 1, ack 1, win 512, options [nop,nop,TS val 297196645 ecr 297196645], length 0
2022-04-06 03:15:14.142937 IP (tos 0x0, ttl 64, id 12181, offset 0, flags [DF], proto TCP (6), length 55)
    127.0.0.1.36342 > 127.0.0.1.11850: Flags [P.], cksum 0xfe2b (incorrect -> 0xb622), seq 1:4, ack 1, win 512, options [nop,nop,TS val 297196645 ecr 297196645], length 3
2022-04-06 03:15:14.142940 IP (tos 0x0, ttl 64, id 32744, offset 0, flags [DF], proto TCP (6), length 52)
    127.0.0.1.11850 > 127.0.0.1.36342: Flags [.], cksum 0xfe28 (incorrect -> 0xbb2b), seq 1, ack 4, win 512, options [nop,nop,TS val 297196645 ecr 297196645], length 0
2022-04-06 03:15:14.143012 IP (tos 0x0, ttl 64, id 32745, offset 0, flags [DF], proto TCP (6), length 54)
    127.0.0.1.11850 > 127.0.0.1.36342: Flags [P.], cksum 0xfe2a (incorrect -> 0xb621), seq 1:3, ack 4, win 512, options [nop,nop,TS val 297196645 ecr 297196645], length 2
2022-04-06 03:15:14.143017 IP (tos 0x0, ttl 64, id 12182, offset 0, flags [DF], proto TCP (6), length 52)
    127.0.0.1.36342 > 127.0.0.1.11850: Flags [.], cksum 0xfe28 (incorrect -> 0xbb29), seq 4, ack 3, win 512, options [nop,nop,TS val 297196645 ecr 297196645], length 0
2022-04-06 03:15:14.144321 IP (tos 0x0, ttl 64, id 12183, offset 0, flags [DF], proto TCP (6), length 62)
    127.0.0.1.36342 > 127.0.0.1.11850: Flags [P.], cksum 0xfe32 (incorrect -> 0xa9d1), seq 4:14, ack 3, win 512, options [nop,nop,TS val 297196647 ecr 297196645], length 10
2022-04-06 03:15:14.144327 IP (tos 0x0, ttl 64, id 32746, offset 0, flags [DF], proto TCP (6), length 52)
    127.0.0.1.11850 > 127.0.0.1.36342: Flags [.], cksum 0xfe28 (incorrect -> 0xbb1b), seq 3, ack 14, win 512, options [nop,nop,TS val 297196647 ecr 297196647], length 0
2022-04-06 03:15:14.277950 IP (tos 0x0, ttl 64, id 32747, offset 0, flags [DF], proto TCP (6), length 62)
    127.0.0.1.11850 > 127.0.0.1.36342: Flags [P.], cksum 0xfe32 (incorrect -> 0xb583), seq 3:13, ack 14, win 512, options [nop,nop,TS val 297196780 ecr 297196647], length 10
2022-04-06 03:15:14.277955 IP (tos 0x0, ttl 64, id 12184, offset 0, flags [DF], proto TCP (6), length 52)
    127.0.0.1.36342 > 127.0.0.1.11850: Flags [.], cksum 0xfe28 (incorrect -> 0xba07), seq 14, ack 13, win 512, options [nop,nop,TS val 297196780 ecr 297196780], length 0
2022-04-06 03:15:14.283640 IP (tos 0x0, ttl 64, id 12185, offset 0, flags [DF], proto TCP (6), length 569)
    127.0.0.1.36342 > 127.0.0.1.11850: Flags [P.], cksum 0x002e (incorrect -> 0xf069), seq 14:531, ack 13, win 512, options [nop,nop,TS val 297196786 ecr 297196780], length 517
2022-04-06 03:15:14.283656 IP (tos 0x0, ttl 64, id 32748, offset 0, flags [DF], proto TCP (6), length 52)
    127.0.0.1.11850 > 127.0.0.1.36342: Flags [.], cksum 0xfe28 (incorrect -> 0xb7fa), seq 13, ack 531, win 508, options [nop,nop,TS val 297196786 ecr 297196786], length 0
200, 124.29020595550537, 0.42150259017944336