2022-04-06 09:49:02.109917 IP (tos 0x0, ttl 64, id 23043, offset 0, flags [DF], proto TCP (6), length 60)
    127.0.0.1.47480 > 127.0.0.1.9750: Flags [S], cksum 0xfe30 (incorrect -> 0x6c76), seq 3276982374, win 65495, options [mss 65495,sackOK,TS val 320824612 ecr 0,nop,wscale 7], length 0
2022-04-06 09:49:02.109934 IP (tos 0x0, ttl 64, id 0, offset 0, flags [DF], proto TCP (6), length 60)
    127.0.0.1.9750 > 127.0.0.1.47480: Flags [S.], cksum 0xfe30 (incorrect -> 0xf8aa), seq 1830653541, ack 3276982375, win 65483, options [mss 65495,sackOK,TS val 320824612 ecr 320824612,nop,wscale 7], length 0
2022-04-06 09:49:02.109946 IP (tos 0x0, ttl 64, id 23044, offset 0, flags [DF], proto TCP (6), length 52)
    127.0.0.1.47480 > 127.0.0.1.9750: Flags [.], cksum 0xfe28 (incorrect -> 0x1f67), seq 1, ack 1, win 512, options [nop,nop,TS val 320824612 ecr 320824612], length 0
2022-04-06 09:49:02.110048 IP (tos 0x0, ttl 64, id 23045, offset 0, flags [DF], proto TCP (6), length 55)
    127.0.0.1.47480 > 127.0.0.1.9750: Flags [P.], cksum 0xfe2b (incorrect -> 0x1a5b), seq 1:4, ack 1, win 512, options [nop,nop,TS val 320824612 ecr 320824612], length 3
2022-04-06 09:49:02.110068 IP (tos 0x0, ttl 64, id 45375, offset 0, flags [DF], proto TCP (6), length 52)
    127.0.0.1.9750 > 127.0.0.1.47480: Flags [.], cksum 0xfe28 (incorrect -> 0x1f64), seq 1, ack 4, win 512, options [nop,nop,TS val 320824612 ecr 320824612], length 0
2022-04-06 09:49:02.110164 IP (tos 0x0, ttl 64, id 45376, offset 0, flags [DF], proto TCP (6), length 54)
    127.0.0.1.9750 > 127.0.0.1.47480: Flags [P.], cksum 0xfe2a (incorrect -> 0x1a59), seq 1:3, ack 4, win 512, options [nop,nop,TS val 320824613 ecr 320824612], length 2
2022-04-06 09:49:02.110190 IP (tos 0x0, ttl 64, id 23046, offset 0, flags [DF], proto TCP (6), length 52)
    127.0.0.1.47480 > 127.0.0.1.9750: Flags [.], cksum 0xfe28 (incorrect -> 0x1f60), seq 4, ack 3, win 512, options [nop,nop,TS val 320824613 ecr 320824613], length 0
2022-04-06 09:49:02.232024 IP (tos 0x0, ttl 64, id 23047, offset 0, flags [DF], proto TCP (6), length 62)
    127.0.0.1.47480 > 127.0.0.1.9750: Flags [P.], cksum 0xfe32 (incorrect -> 0x4a4e), seq 4:14, ack 3, win 512, options [nop,nop,TS val 320824734 ecr 320824613], length 10
2022-04-06 09:49:02.232037 IP (tos 0x0, ttl 64, id 45377, offset 0, flags [DF], proto TCP (6), length 52)
    127.0.0.1.9750 > 127.0.0.1.47480: Flags [.], cksum 0xfe28 (incorrect -> 0x1e64), seq 3, ack 14, win 512, options [nop,nop,TS val 320824734 ecr 320824734], length 0
2022-04-06 09:49:02.550975 IP (tos 0x0, ttl 64, id 45378, offset 0, flags [DF], proto TCP (6), length 62)
    127.0.0.1.9750 > 127.0.0.1.47480: Flags [P.], cksum 0xfe32 (incorrect -> 0x1812), seq 3:13, ack 14, win 512, options [nop,nop,TS val 320825053 ecr 320824734], length 10
2022-04-06 09:49:02.550989 IP (tos 0x0, ttl 64, id 23048, offset 0, flags [DF], proto TCP (6), length 52)
    127.0.0.1.47480 > 127.0.0.1.9750: Flags [.], cksum 0xfe28 (incorrect -> 0x1bdc), seq 14, ack 13, win 512, options [nop,nop,TS val 320825053 ecr 320825053], length 0
2022-04-06 09:49:02.556774 IP (tos 0x0, ttl 64, id 23049, offset 0, flags [DF], proto TCP (6), length 569)
    127.0.0.1.47480 > 127.0.0.1.9750: Flags [P.], cksum 0x002e (incorrect -> 0xe611), seq 14:531, ack 13, win 512, options [nop,nop,TS val 320825059 ecr 320825053], length 517
2022-04-06 09:49:02.556786 IP (tos 0x0, ttl 64, id 45379, offset 0, flags [DF], proto TCP (6), length 52)
    127.0.0.1.9750 > 127.0.0.1.47480: Flags [.], cksum 0xfe28 (incorrect -> 0x19cf), seq 13, ack 531, win 508, options [nop,nop,TS val 320825059 ecr 320825059], length 0
2022-04-06 09:49:02.877675 IP (tos 0x0, ttl 64, id 45380, offset 0, flags [DF], proto TCP (6), length 3492)
    127.0.0.1.9750 > 127.0.0.1.47480: Flags [P.], cksum 0x0b99 (incorrect -> 0x66ce), seq 13:3453, ack 531, win 512, options [nop,nop,TS val 320825380 ecr 320825059], length 3440
2022-04-06 09:49:02.877689 IP (tos 0x0, ttl 64, id 23050, offset 0, flags [DF], proto TCP (6), length 52)
    127.0.0.1.47480 > 127.0.0.1.9750: Flags [.], cksum 0xfe28 (incorrect -> 0x09eb), seq 531, ack 3453, win 494, options [nop,nop,TS val 320825380 ecr 320825380], length 0
2022-04-06 09:49:03.016694 IP (tos 0x0, ttl 64, id 45381, offset 0, flags [DF], proto TCP (6), length 857)
    127.0.0.1.9750 > 127.0.0.1.47480: Flags [P.], cksum 0x014e (incorrect -> 0x8404), seq 3453:4258, ack 531, win 512, options [nop,nop,TS val 320825519 ecr 320825380], length 805
2022-04-06 09:49:03.016710 IP (tos 0x0, ttl 64, id 23051, offset 0, flags [DF], proto TCP (6), length 52)
    127.0.0.1.47480 > 127.0.0.1.9750: Flags [.], cksum 0xfe28 (incorrect -> 0x05a6), seq 531, ack 4258, win 504, options [nop,nop,TS val 320825519 ecr 320825519], length 0
2022-04-06 09:49:03.017211 IP (tos 0x0, ttl 64, id 23052, offset 0, flags [DF], proto TCP (6), length 132)
    127.0.0.1.47480 > 127.0.0.1.9750: Flags [P.], cksum 0xfe78 (incorrect -> 0x13e0), seq 531:611, ack 4258, win 512, options [nop,nop,TS val 320825520 ecr 320825519], length 80
2022-04-06 09:49:03.017221 IP (tos 0x0, ttl 64, id 45382, offset 0, flags [DF], proto TCP (6), length 52)
    127.0.0.1.9750 > 127.0.0.1.47480: Flags [.], cksum 0xfe28 (incorrect -> 0x054c), seq 4258, ack 611, win 512, options [nop,nop,TS val 320825520 ecr 320825520], length 0
2022-04-06 09:49:03.017625 IP (tos 0x0, ttl 64, id 23053, offset 0, flags [DF], proto TCP (6), length 401)
    127.0.0.1.47480 > 127.0.0.1.9750: Flags [P.], cksum 0xff85 (incorrect -> 0xad35), seq 611:960, ack 4258, win 512, options [nop,nop,TS val 320825520 ecr 320825520], length 349
2022-04-06 09:49:03.017633 IP (tos 0x0, ttl 64, id 45383, offset 0, flags [DF], proto TCP (6), length 52)
    127.0.0.1.9750 > 127.0.0.1.47480: Flags [.], cksum 0xfe28 (incorrect -> 0x03f1), seq 4258, ack 960, win 510, options [nop,nop,TS val 320825520 ecr 320825520], length 0
2022-04-06 09:49:03.472314 IP (tos 0x0, ttl 64, id 45384, offset 0, flags [DF], proto TCP (6), length 594)
    127.0.0.1.9750 > 127.0.0.1.47480: Flags [P.], cksum 0x0047 (incorrect -> 0x6ee1), seq 4258:4800, ack 960, win 512, options [nop,nop,TS val 320825975 ecr 320825520], length 542
2022-04-06 09:49:03.472328 IP (tos 0x0, ttl 64, id 23054, offset 0, flags [DF], proto TCP (6), length 52)
    127.0.0.1.47480 > 127.0.0.1.9750: Flags [.], cksum 0xfe28 (incorrect -> 0xfe46), seq 960, ack 4800, win 508, options [nop,nop,TS val 320825975 ecr 320825975], length 0
2022-04-06 09:49:03.625726 IP (tos 0x0, ttl 64, id 45385, offset 0, flags [DF], proto TCP (6), length 314)
    127.0.0.1.9750 > 127.0.0.1.47480: Flags [P.], cksum 0xff2e (incorrect -> 0x1c50), seq 4800:5062, ack 960, win 512, options [nop,nop,TS val 320826128 ecr 320825975], length 262
2022-04-06 09:49:03.625738 IP (tos 0x0, ttl 64, id 23055, offset 0, flags [DF], proto TCP (6), length 52)
    127.0.0.1.47480 > 127.0.0.1.9750: Flags [.], cksum 0xfe28 (incorrect -> 0xfc10), seq 960, ack 5062, win 506, options [nop,nop,TS val 320826128 ecr 320826128], length 0
2022-04-06 09:49:03.627689 IP (tos 0x0, ttl 64, id 23056, offset 0, flags [DF], proto TCP (6), length 407)
    127.0.0.1.47480 > 127.0.0.1.9750: Flags [P.], cksum 0xff8b (incorrect -> 0x9af7), seq 960:1315, ack 5062, win 512, options [nop,nop,TS val 320826130 ecr 320826128], length 355
2022-04-06 09:49:03.627700 IP (tos 0x0, ttl 64, id 45386, offset 0, flags [DF], proto TCP (6), length 52)
    127.0.0.1.9750 > 127.0.0.1.47480: Flags [.], cksum 0xfe28 (incorrect -> 0xfaa5), seq 5062, ack 1315, win 510, options [nop,nop,TS val 320826130 ecr 320826130], length 0
2022-04-06 09:49:05.274570 IP (tos 0x0, ttl 64, id 45387, offset 0, flags [DF], proto TCP (6), length 3492)
    127.0.0.1.9750 > 127.0.0.1.47480: Flags [P.], cksum 0x0b99 (incorrect -> 0xd2a1), seq 5062:8502, ack 1315, win 512, options [nop,nop,TS val 320827777 ecr 320826130], length 3440
2022-04-06 09:49:05.314667 IP (tos 0x0, ttl 64, id 23057, offset 0, flags [DF], proto TCP (6), length 52)
    127.0.0.1.47480 > 127.0.0.1.9750: Flags [.], cksum 0xfe28 (incorrect -> 0xe02d), seq 1315, ack 8502, win 512, options [nop,nop,TS val 320827817 ecr 320827777], length 0
2022-04-06 09:49:05.314679 IP (tos 0x0, ttl 64, id 45388, offset 0, flags [DF], proto TCP (6), length 5032)
    127.0.0.1.9750 > 127.0.0.1.47480: Flags [P.], cksum 0x119d (incorrect -> 0xff9b), seq 8502:13482, ack 1315, win 512, options [nop,nop,TS val 320827817 ecr 320827817], length 4980
2022-04-06 09:49:05.314685 IP (tos 0x0, ttl 64, id 23058, offset 0, flags [DF], proto TCP (6), length 52)
    127.0.0.1.47480 > 127.0.0.1.9750: Flags [.], cksum 0xfe28 (incorrect -> 0xcca9), seq 1315, ack 13482, win 488, options [nop,nop,TS val 320827817 ecr 320827817], length 0
2022-04-06 09:49:05.319522 IP (tos 0x0, ttl 64, id 45389, offset 0, flags [DF], proto TCP (6), length 2764)
    127.0.0.1.9750 > 127.0.0.1.47480: Flags [P.], cksum 0x08c1 (incorrect -> 0xd4f1), seq 13482:16194, ack 1315, win 512, options [nop,nop,TS val 320827822 ecr 320827817], length 2712
2022-04-06 09:49:05.319528 IP (tos 0x0, ttl 64, id 23059, offset 0, flags [DF], proto TCP (6), length 52)
    127.0.0.1.47480 > 127.0.0.1.9750: Flags [.], cksum 0xfe28 (incorrect -> 0xc1fe), seq 1315, ack 16194, win 497, options [nop,nop,TS val 320827822 ecr 320827822], length 0
200, 3.5054073333740234, 3.7919576168060303