2022-04-06 13:13:15.455760 IP (tos 0x0, ttl 64, id 12577, offset 0, flags [DF], proto TCP (6), length 60)
    127.0.0.1.46110 > 127.0.0.1.9150: Flags [S], cksum 0xfe30 (incorrect -> 0x03d5), seq 1011664483, win 65495, options [mss 65495,sackOK,TS val 333077958 ecr 0,nop,wscale 7], length 0
2022-04-06 13:13:15.455771 IP (tos 0x0, ttl 64, id 0, offset 0, flags [DF], proto TCP (6), length 60)
    127.0.0.1.9150 > 127.0.0.1.46110: Flags [S.], cksum 0xfe30 (incorrect -> 0x860c), seq 2112327227, ack 1011664484, win 65483, options [mss 65495,sackOK,TS val 333077958 ecr 333077958,nop,wscale 7], length 0
2022-04-06 13:13:15.455781 IP (tos 0x0, ttl 64, id 12578, offset 0, flags [DF], proto TCP (6), length 52)
    127.0.0.1.46110 > 127.0.0.1.9150: Flags [.], cksum 0xfe28 (incorrect -> 0xacc8), seq 1, ack 1, win 512, options [nop,nop,TS val 333077958 ecr 333077958], length 0
2022-04-06 13:13:15.455879 IP (tos 0x0, ttl 64, id 12579, offset 0, flags [DF], proto TCP (6), length 55)
    127.0.0.1.46110 > 127.0.0.1.9150: Flags [P.], cksum 0xfe2b (incorrect -> 0xa7bc), seq 1:4, ack 1, win 512, options [nop,nop,TS val 333077958 ecr 333077958], length 3
2022-04-06 13:13:15.455892 IP (tos 0x0, ttl 64, id 63661, offset 0, flags [DF], proto TCP (6), length 52)
    127.0.0.1.9150 > 127.0.0.1.46110: Flags [.], cksum 0xfe28 (incorrect -> 0xacc5), seq 1, ack 4, win 512, options [nop,nop,TS val 333077958 ecr 333077958], length 0
2022-04-06 13:13:15.455970 IP (tos 0x0, ttl 64, id 63662, offset 0, flags [DF], proto TCP (6), length 54)
    127.0.0.1.9150 > 127.0.0.1.46110: Flags [P.], cksum 0xfe2a (incorrect -> 0xa7bb), seq 1:3, ack 4, win 512, options [nop,nop,TS val 333077958 ecr 333077958], length 2
2022-04-06 13:13:15.455989 IP (tos 0x0, ttl 64, id 12580, offset 0, flags [DF], proto TCP (6), length 52)
    127.0.0.1.46110 > 127.0.0.1.9150: Flags [.], cksum 0xfe28 (incorrect -> 0xacc3), seq 4, ack 3, win 512, options [nop,nop,TS val 333077958 ecr 333077958], length 0
2022-04-06 13:13:15.468178 IP (tos 0x0, ttl 64, id 12581, offset 0, flags [DF], proto TCP (6), length 62)
    127.0.0.1.46110 > 127.0.0.1.9150: Flags [P.], cksum 0xfe32 (incorrect -> 0x84d7), seq 4:14, ack 3, win 512, options [nop,nop,TS val 333077971 ecr 333077958], length 10
2022-04-06 13:13:15.468188 IP (tos 0x0, ttl 64, id 63663, offset 0, flags [DF], proto TCP (6), length 52)
    127.0.0.1.9150 > 127.0.0.1.46110: Flags [.], cksum 0xfe28 (incorrect -> 0xac9f), seq 3, ack 14, win 512, options [nop,nop,TS val 333077971 ecr 333077971], length 0
2022-04-06 13:13:15.552516 IP (tos 0x0, ttl 64, id 63664, offset 0, flags [DF], proto TCP (6), length 62)
    127.0.0.1.9150 > 127.0.0.1.46110: Flags [P.], cksum 0xfe32 (incorrect -> 0xa738), seq 3:13, ack 14, win 512, options [nop,nop,TS val 333078055 ecr 333077971], length 10
2022-04-06 13:13:15.552525 IP (tos 0x0, ttl 64, id 12582, offset 0, flags [DF], proto TCP (6), length 52)
    127.0.0.1.46110 > 127.0.0.1.9150: Flags [.], cksum 0xfe28 (incorrect -> 0xabed), seq 14, ack 13, win 512, options [nop,nop,TS val 333078055 ecr 333078055], length 0
2022-04-06 13:13:15.558936 IP (tos 0x0, ttl 64, id 12583, offset 0, flags [DF], proto TCP (6), length 569)
    127.0.0.1.46110 > 127.0.0.1.9150: Flags [P.], cksum 0x002e (incorrect -> 0x6d35), seq 14:531, ack 13, win 512, options [nop,nop,TS val 333078061 ecr 333078055], length 517
2022-04-06 13:13:15.558947 IP (tos 0x0, ttl 64, id 63665, offset 0, flags [DF], proto TCP (6), length 52)
    127.0.0.1.9150 > 127.0.0.1.46110: Flags [.], cksum 0xfe28 (incorrect -> 0xa9e0), seq 13, ack 531, win 508, options [nop,nop,TS val 333078061 ecr 333078061], length 0
2022-04-06 13:13:15.648138 IP (tos 0x0, ttl 64, id 63666, offset 0, flags [DF], proto TCP (6), length 3538)
    127.0.0.1.9150 > 127.0.0.1.46110: Flags [P.], cksum 0x0bc7 (incorrect -> 0xaeb2), seq 13:3499, ack 531, win 512, options [nop,nop,TS val 333078151 ecr 333078061], length 3486
2022-04-06 13:13:15.648149 IP (tos 0x0, ttl 64, id 12584, offset 0, flags [DF], proto TCP (6), length 52)
    127.0.0.1.46110 > 127.0.0.1.9150: Flags [.], cksum 0xfe28 (incorrect -> 0x9b9c), seq 531, ack 3499, win 494, options [nop,nop,TS val 333078151 ecr 333078151], length 0
2022-04-06 13:13:15.663549 IP (tos 0x0, ttl 64, id 63667, offset 0, flags [DF], proto TCP (6), length 1428)
    127.0.0.1.9150 > 127.0.0.1.46110: Flags [P.], cksum 0x0389 (incorrect -> 0xb52c), seq 3499:4875, ack 531, win 512, options [nop,nop,TS val 333078166 ecr 333078151], length 1376
2022-04-06 13:13:15.663557 IP (tos 0x0, ttl 64, id 12585, offset 0, flags [DF], proto TCP (6), length 52)
    127.0.0.1.46110 > 127.0.0.1.9150: Flags [.], cksum 0xfe28 (incorrect -> 0x9616), seq 531, ack 4875, win 502, options [nop,nop,TS val 333078166 ecr 333078166], length 0
2022-04-06 13:13:15.664095 IP (tos 0x0, ttl 64, id 12586, offset 0, flags [DF], proto TCP (6), length 178)
    127.0.0.1.46110 > 127.0.0.1.9150: Flags [P.], cksum 0xfea6 (incorrect -> 0x5563), seq 531:657, ack 4875, win 512, options [nop,nop,TS val 333078167 ecr 333078166], length 126
2022-04-06 13:13:15.664104 IP (tos 0x0, ttl 64, id 63668, offset 0, flags [DF], proto TCP (6), length 52)
    127.0.0.1.9150 > 127.0.0.1.46110: Flags [.], cksum 0xfe28 (incorrect -> 0x958c), seq 4875, ack 657, win 512, options [nop,nop,TS val 333078167 ecr 333078167], length 0
2022-04-06 13:13:15.751577 IP (tos 0x0, ttl 64, id 63669, offset 0, flags [DF], proto TCP (6), length 294)
    127.0.0.1.9150 > 127.0.0.1.46110: Flags [P.], cksum 0xff1a (incorrect -> 0x6b1b), seq 4875:5117, ack 657, win 512, options [nop,nop,TS val 333078254 ecr 333078167], length 242
2022-04-06 13:13:15.751589 IP (tos 0x0, ttl 64, id 12587, offset 0, flags [DF], proto TCP (6), length 52)
    127.0.0.1.46110 > 127.0.0.1.9150: Flags [.], cksum 0xfe28 (incorrect -> 0x93ed), seq 657, ack 5117, win 511, options [nop,nop,TS val 333078254 ecr 333078254], length 0
2022-04-06 13:13:15.752081 IP (tos 0x0, ttl 64, id 12588, offset 0, flags [DF], proto TCP (6), length 356)
    127.0.0.1.46110 > 127.0.0.1.9150: Flags [P.], cksum 0xff58 (incorrect -> 0x3be4), seq 657:961, ack 5117, win 512, options [nop,nop,TS val 333078255 ecr 333078254], length 304
2022-04-06 13:13:15.752091 IP (tos 0x0, ttl 64, id 63670, offset 0, flags [DF], proto TCP (6), length 52)
    127.0.0.1.9150 > 127.0.0.1.46110: Flags [.], cksum 0xfe28 (incorrect -> 0x92bc), seq 5117, ack 961, win 510, options [nop,nop,TS val 333078255 ecr 333078255], length 0
2022-04-06 13:13:15.977464 IP (tos 0x0, ttl 64, id 63671, offset 0, flags [DF], proto TCP (6), length 4100)
    127.0.0.1.9150 > 127.0.0.1.46110: Flags [P.], cksum 0x0df9 (incorrect -> 0xce6a), seq 5117:9165, ack 961, win 512, options [nop,nop,TS val 333078480 ecr 333078255], length 4048
2022-04-06 13:13:16.018669 IP (tos 0x0, ttl 64, id 12589, offset 0, flags [DF], proto TCP (6), length 52)
    127.0.0.1.46110 > 127.0.0.1.9150: Flags [.], cksum 0xfe28 (incorrect -> 0x80ff), seq 961, ack 9165, win 512, options [nop,nop,TS val 333078521 ecr 333078480], length 0
2022-04-06 13:13:16.018680 IP (tos 0x0, ttl 64, id 63672, offset 0, flags [DF], proto TCP (6), length 4659)
    127.0.0.1.9150 > 127.0.0.1.46110: Flags [P.], cksum 0x1028 (incorrect -> 0xa218), seq 9165:13772, ack 961, win 512, options [nop,nop,TS val 333078521 ecr 333078521], length 4607
2022-04-06 13:13:16.018687 IP (tos 0x0, ttl 64, id 12590, offset 0, flags [DF], proto TCP (6), length 52)
    127.0.0.1.46110 > 127.0.0.1.9150: Flags [.], cksum 0xfe28 (incorrect -> 0x6eed), seq 961, ack 13772, win 490, options [nop,nop,TS val 333078521 ecr 333078521], length 0
2022-04-06 13:13:16.023306 IP (tos 0x0, ttl 64, id 63673, offset 0, flags [DF], proto TCP (6), length 4100)
    127.0.0.1.9150 > 127.0.0.1.46110: Flags [P.], cksum 0x0df9 (incorrect -> 0x3afb), seq 13772:17820, ack 961, win 512, options [nop,nop,TS val 333078526 ecr 333078521], length 4048
2022-04-06 13:13:16.023315 IP (tos 0x0, ttl 64, id 12591, offset 0, flags [DF], proto TCP (6), length 52)
    127.0.0.1.46110 > 127.0.0.1.9150: Flags [.], cksum 0xfe28 (incorrect -> 0x5f11), seq 961, ack 17820, win 492, options [nop,nop,TS val 333078526 ecr 333078526], length 0
2022-04-06 13:13:16.023324 IP (tos 0x0, ttl 64, id 63674, offset 0, flags [DF], proto TCP (6), length 302)
    127.0.0.1.9150 > 127.0.0.1.46110: Flags [P.], cksum 0xff22 (incorrect -> 0x7ede), seq 17820:18070, ack 961, win 512, options [nop,nop,TS val 333078526 ecr 333078526], length 250
2022-04-06 13:13:16.023329 IP (tos 0x0, ttl 64, id 12592, offset 0, flags [DF], proto TCP (6), length 52)
    127.0.0.1.46110 > 127.0.0.1.9150: Flags [.], cksum 0xfe28 (incorrect -> 0x5e18), seq 961, ack 18070, win 491, options [nop,nop,TS val 333078526 ecr 333078526], length 0
2022-04-06 13:13:16.025897 IP (tos 0x0, ttl 64, id 63675, offset 0, flags [DF], proto TCP (6), length 3258)
    127.0.0.1.9150 > 127.0.0.1.46110: Flags [P.], cksum 0x0aaf (incorrect -> 0x2e7c), seq 18070:21276, ack 961, win 512, options [nop,nop,TS val 333078528 ecr 333078526], length 3206
2022-04-06 13:13:16.025905 IP (tos 0x0, ttl 64, id 12593, offset 0, flags [DF], proto TCP (6), length 52)
    127.0.0.1.46110 > 127.0.0.1.9150: Flags [.], cksum 0xfe28 (incorrect -> 0x518a), seq 961, ack 21276, win 495, options [nop,nop,TS val 333078528 ecr 333078528], length 0
2022-04-06 13:13:16.028799 IP (tos 0x0, ttl 64, id 63676, offset 0, flags [DF], proto TCP (6), length 1048)
    127.0.0.1.9150 > 127.0.0.1.46110: Flags [P.], cksum 0x020d (incorrect -> 0x5f35), seq 21276:22272, ack 961, win 512, options [nop,nop,TS val 333078531 ecr 333078528], length 996
2022-04-06 13:13:16.028807 IP (tos 0x0, ttl 64, id 12594, offset 0, flags [DF], proto TCP (6), length 52)
    127.0.0.1.46110 > 127.0.0.1.9150: Flags [.], cksum 0xfe28 (incorrect -> 0x4d97), seq 961, ack 22272, win 504, options [nop,nop,TS val 333078531 ecr 333078531], length 0
2022-04-06 13:13:16.037140 IP (tos 0x0, ttl 64, id 63677, offset 0, flags [DF], proto TCP (6), length 2935)
    127.0.0.1.9150 > 127.0.0.1.46110: Flags [P.], cksum 0x096c (incorrect -> 0x8ebd), seq 22272:25155, ack 961, win 512, options [nop,nop,TS val 333078540 ecr 333078531], length 2883
2022-04-06 13:13:16.037148 IP (tos 0x0, ttl 64, id 12595, offset 0, flags [DF], proto TCP (6), length 52)
    127.0.0.1.46110 > 127.0.0.1.9150: Flags [.], cksum 0xfe28 (incorrect -> 0x424a), seq 961, ack 25155, win 496, options [nop,nop,TS val 333078540 ecr 333078540], length 0
2022-04-06 13:13:16.037783 IP (tos 0x0, ttl 64, id 63678, offset 0, flags [DF], proto TCP (6), length 4100)
    127.0.0.1.9150 > 127.0.0.1.46110: Flags [P.], cksum 0x0df9 (incorrect -> 0x07bf), seq 25155:29203, ack 961, win 512, options [nop,nop,TS val 333078540 ecr 333078540], length 4048
2022-04-06 13:13:16.037792 IP (tos 0x0, ttl 64, id 12596, offset 0, flags [DF], proto TCP (6), length 52)
    127.0.0.1.46110 > 127.0.0.1.9150: Flags [.], cksum 0xfe28 (incorrect -> 0x327e), seq 961, ack 29203, win 492, options [nop,nop,TS val 333078540 ecr 333078540], length 0
2022-04-06 13:13:16.037802 IP (tos 0x0, ttl 64, id 63679, offset 0, flags [DF], proto TCP (6), length 2104)
    127.0.0.1.9150 > 127.0.0.1.46110: Flags [P.], cksum 0x062d (incorrect -> 0x0d43), seq 29203:31255, ack 961, win 512, options [nop,nop,TS val 333078540 ecr 333078540], length 2052
2022-04-06 13:13:16.037919 IP (tos 0x0, ttl 64, id 12597, offset 0, flags [DF], proto TCP (6), length 52)
    127.0.0.1.46110 > 127.0.0.1.9150: Flags [.], cksum 0xfe28 (incorrect -> 0x2a66), seq 961, ack 31255, win 512, options [nop,nop,TS val 333078540 ecr 333078540], length 0
2022-04-06 13:13:16.037928 IP (tos 0x0, ttl 64, id 63680, offset 0, flags [DF], proto TCP (6), length 3944)
    127.0.0.1.9150 > 127.0.0.1.46110: Flags [P.], cksum 0x0d5d (incorrect -> 0xe407), seq 31255:35147, ack 961, win 512, options [nop,nop,TS val 333078540 ecr 333078540], length 3892
2022-04-06 13:13:16.037935 IP (tos 0x0, ttl 64, id 12598, offset 0, flags [DF], proto TCP (6), length 52)
    127.0.0.1.46110 > 127.0.0.1.9150: Flags [.], cksum 0xfe28 (incorrect -> 0x1b32), seq 961, ack 35147, win 512, options [nop,nop,TS val 333078540 ecr 333078540], length 0
2022-04-06 13:13:16.039292 IP (tos 0x0, ttl 64, id 63681, offset 0, flags [DF], proto TCP (6), length 4100)
    127.0.0.1.9150 > 127.0.0.1.46110: Flags [P.], cksum 0x0df9 (incorrect -> 0x1914), seq 35147:39195, ack 961, win 512, options [nop,nop,TS val 333078542 ecr 333078540], length 4048
2022-04-06 13:13:16.039564 IP (tos 0x0, ttl 64, id 12599, offset 0, flags [DF], proto TCP (6), length 52)
    127.0.0.1.46110 > 127.0.0.1.9150: Flags [.], cksum 0xfe28 (incorrect -> 0x0b5e), seq 961, ack 39195, win 512, options [nop,nop,TS val 333078542 ecr 333078542], length 0
2022-04-06 13:13:16.039571 IP (tos 0x0, ttl 64, id 63682, offset 0, flags [DF], proto TCP (6), length 273)
    127.0.0.1.9150 > 127.0.0.1.46110: Flags [P.], cksum 0xff05 (incorrect -> 0x061a), seq 39195:39416, ack 961, win 512, options [nop,nop,TS val 333078542 ecr 333078542], length 221
2022-04-06 13:13:16.039578 IP (tos 0x0, ttl 64, id 12600, offset 0, flags [DF], proto TCP (6), length 52)
    127.0.0.1.46110 > 127.0.0.1.9150: Flags [.], cksum 0xfe28 (incorrect -> 0x0a81), seq 961, ack 39416, win 512, options [nop,nop,TS val 333078542 ecr 333078542], length 0
2022-04-06 13:13:16.043307 IP (tos 0x0, ttl 64, id 63683, offset 0, flags [DF], proto TCP (6), length 2948)
    127.0.0.1.9150 > 127.0.0.1.46110: Flags [P.], cksum 0x0979 (incorrect -> 0xc7fa), seq 39416:42312, ack 961, win 512, options [nop,nop,TS val 333078546 ecr 333078542], length 2896
2022-04-06 13:13:16.043324 IP (tos 0x0, ttl 64, id 12601, offset 0, flags [DF], proto TCP (6), length 52)
    127.0.0.1.46110 > 127.0.0.1.9150: Flags [.], cksum 0xfe28 (incorrect -> 0xff28), seq 961, ack 42312, win 512, options [nop,nop,TS val 333078546 ecr 333078546], length 0
2022-04-06 13:13:16.047405 IP (tos 0x0, ttl 64, id 63684, offset 0, flags [DF], proto TCP (6), length 4100)
    127.0.0.1.9150 > 127.0.0.1.46110: Flags [P.], cksum 0x0df9 (incorrect -> 0x6c2c), seq 42312:46360, ack 961, win 512, options [nop,nop,TS val 333078550 ecr 333078546], length 4048
2022-04-06 13:13:16.047473 IP (tos 0x0, ttl 64, id 12602, offset 0, flags [DF], proto TCP (6), length 52)
    127.0.0.1.46110 > 127.0.0.1.9150: Flags [.], cksum 0xfe28 (incorrect -> 0xef50), seq 961, ack 46360, win 512, options [nop,nop,TS val 333078550 ecr 333078550], length 0
2022-04-06 13:13:16.047482 IP (tos 0x0, ttl 64, id 63685, offset 0, flags [DF], proto TCP (6), length 4493)
    127.0.0.1.9150 > 127.0.0.1.46110: Flags [P.], cksum 0x0f82 (incorrect -> 0x9165), seq 46360:50801, ack 961, win 512, options [nop,nop,TS val 333078550 ecr 333078550], length 4441
2022-04-06 13:13:16.047845 IP (tos 0x0, ttl 64, id 12603, offset 0, flags [DF], proto TCP (6), length 52)
    127.0.0.1.46110 > 127.0.0.1.9150: Flags [.], cksum 0xfe28 (incorrect -> 0xddf7), seq 961, ack 50801, win 512, options [nop,nop,TS val 333078550 ecr 333078550], length 0
2022-04-06 13:13:16.051488 IP (tos 0x0, ttl 64, id 63686, offset 0, flags [DF], proto TCP (6), length 3310)
    127.0.0.1.9150 > 127.0.0.1.46110: Flags [P.], cksum 0x0ae3 (incorrect -> 0xc2a6), seq 50801:54059, ack 961, win 512, options [nop,nop,TS val 333078554 ecr 333078550], length 3258
2022-04-06 13:13:16.051709 IP (tos 0x0, ttl 64, id 12604, offset 0, flags [DF], proto TCP (6), length 52)
    127.0.0.1.46110 > 127.0.0.1.9150: Flags [.], cksum 0xfe28 (incorrect -> 0xd135), seq 961, ack 54059, win 512, options [nop,nop,TS val 333078554 ecr 333078554], length 0
2022-04-06 13:13:16.051718 IP (tos 0x0, ttl 64, id 63687, offset 0, flags [DF], proto TCP (6), length 4799)
    127.0.0.1.9150 > 127.0.0.1.46110: Flags [P.], cksum 0x10b4 (incorrect -> 0xbe75), seq 54059:58806, ack 961, win 512, options [nop,nop,TS val 333078554 ecr 333078554], length 4747
2022-04-06 13:13:16.094681 IP (tos 0x0, ttl 64, id 12605, offset 0, flags [DF], proto TCP (6), length 52)
    127.0.0.1.46110 > 127.0.0.1.9150: Flags [.], cksum 0xfe28 (incorrect -> 0xbe7f), seq 961, ack 58806, win 512, options [nop,nop,TS val 333078597 ecr 333078554], length 0
2022-04-06 13:13:16.117784 IP (tos 0x0, ttl 64, id 63688, offset 0, flags [DF], proto TCP (6), length 3079)
    127.0.0.1.9150 > 127.0.0.1.46110: Flags [P.], cksum 0x09fc (incorrect -> 0x1a49), seq 58806:61833, ack 961, win 512, options [nop,nop,TS val 333078620 ecr 333078597], length 3027
2022-04-06 13:13:16.117901 IP (tos 0x0, ttl 64, id 12606, offset 0, flags [DF], proto TCP (6), length 52)
    127.0.0.1.46110 > 127.0.0.1.9150: Flags [.], cksum 0xfe28 (incorrect -> 0xb253), seq 961, ack 61833, win 512, options [nop,nop,TS val 333078620 ecr 333078620], length 0
2022-04-06 13:13:16.124111 IP (tos 0x0, ttl 64, id 63689, offset 0, flags [DF], proto TCP (6), length 550)
    127.0.0.1.9150 > 127.0.0.1.46110: Flags [P.], cksum 0x001b (incorrect -> 0x533b), seq 61833:62331, ack 961, win 512, options [nop,nop,TS val 333078627 ecr 333078620], length 498
2022-04-06 13:13:16.124132 IP (tos 0x0, ttl 64, id 12607, offset 0, flags [DF], proto TCP (6), length 52)
    127.0.0.1.46110 > 127.0.0.1.9150: Flags [.], cksum 0xfe28 (incorrect -> 0xb053), seq 961, ack 62331, win 512, options [nop,nop,TS val 333078627 ecr 333078627], length 0
2022-04-06 13:13:16.131530 IP (tos 0x0, ttl 64, id 63690, offset 0, flags [DF], proto TCP (6), length 1264)
    127.0.0.1.9150 > 127.0.0.1.46110: Flags [P.], cksum 0x02e5 (incorrect -> 0x9b66), seq 62331:63543, ack 961, win 512, options [nop,nop,TS val 333078634 ecr 333078627], length 1212
2022-04-06 13:13:16.131547 IP (tos 0x0, ttl 64, id 12608, offset 0, flags [DF], proto TCP (6), length 52)
    127.0.0.1.46110 > 127.0.0.1.9150: Flags [.], cksum 0xfe28 (incorrect -> 0xab89), seq 961, ack 63543, win 512, options [nop,nop,TS val 333078634 ecr 333078634], length 0
2022-04-06 13:13:16.168862 IP (tos 0x0, ttl 64, id 63691, offset 0, flags [DF], proto TCP (6), length 458)
    127.0.0.1.9150 > 127.0.0.1.46110: Flags [P.], cksum 0xffbe (incorrect -> 0x265e), seq 63543:63949, ack 961, win 512, options [nop,nop,TS val 333078671 ecr 333078634], length 406
2022-04-06 13:13:16.168912 IP (tos 0x0, ttl 64, id 12609, offset 0, flags [DF], proto TCP (6), length 52)
    127.0.0.1.46110 > 127.0.0.1.9150: Flags [.], cksum 0xfe28 (incorrect -> 0xa9a9), seq 961, ack 63949, win 512, options [nop,nop,TS val 333078671 ecr 333078671], length 0
2022-04-06 13:13:16.357249 IP (tos 0x0, ttl 64, id 63692, offset 0, flags [DF], proto TCP (6), length 3079)
    127.0.0.1.9150 > 127.0.0.1.46110: Flags [P.], cksum 0x09fc (incorrect -> 0xb541), seq 63949:66976, ack 961, win 512, options [nop,nop,TS val 333078860 ecr 333078671], length 3027
2022-04-06 13:13:16.357374 IP (tos 0x0, ttl 64, id 12610, offset 0, flags [DF], proto TCP (6), length 52)
    127.0.0.1.46110 > 127.0.0.1.9150: Flags [.], cksum 0xfe28 (incorrect -> 0x9c5c), seq 961, ack 66976, win 512, options [nop,nop,TS val 333078860 ecr 333078860], length 0
2022-04-06 13:13:16.360456 IP (tos 0x0, ttl 64, id 63693, offset 0, flags [DF], proto TCP (6), length 2948)
    127.0.0.1.9150 > 127.0.0.1.46110: Flags [P.], cksum 0x0979 (incorrect -> 0xe6eb), seq 66976:69872, ack 961, win 512, options [nop,nop,TS val 333078863 ecr 333078860], length 2896
2022-04-06 13:13:16.360497 IP (tos 0x0, ttl 64, id 12611, offset 0, flags [DF], proto TCP (6), length 52)
    127.0.0.1.46110 > 127.0.0.1.9150: Flags [.], cksum 0xfe28 (incorrect -> 0x9106), seq 961, ack 69872, win 512, options [nop,nop,TS val 333078863 ecr 333078863], length 0
2022-04-06 13:13:16.360504 IP (tos 0x0, ttl 64, id 63694, offset 0, flags [DF], proto TCP (6), length 3096)
    127.0.0.1.9150 > 127.0.0.1.46110: Flags [P.], cksum 0x0a0d (incorrect -> 0x0e43), seq 69872:72916, ack 961, win 512, options [nop,nop,TS val 333078863 ecr 333078863], length 3044
2022-04-06 13:13:16.360807 IP (tos 0x0, ttl 64, id 12612, offset 0, flags [DF], proto TCP (6), length 52)
    127.0.0.1.46110 > 127.0.0.1.9150: Flags [.], cksum 0xfe28 (incorrect -> 0x8522), seq 961, ack 72916, win 512, options [nop,nop,TS val 333078863 ecr 333078863], length 0
2022-04-06 13:13:16.362392 IP (tos 0x0, ttl 64, id 63695, offset 0, flags [DF], proto TCP (6), length 1998)
    127.0.0.1.9150 > 127.0.0.1.46110: Flags [P.], cksum 0x05c3 (incorrect -> 0x8c86), seq 72916:74862, ack 961, win 512, options [nop,nop,TS val 333078865 ecr 333078863], length 1946
2022-04-06 13:13:16.362435 IP (tos 0x0, ttl 64, id 12613, offset 0, flags [DF], proto TCP (6), length 52)
    127.0.0.1.46110 > 127.0.0.1.9150: Flags [.], cksum 0xfe28 (incorrect -> 0x7d84), seq 961, ack 74862, win 512, options [nop,nop,TS val 333078865 ecr 333078865], length 0
2022-04-06 13:13:16.362442 IP (tos 0x0, ttl 64, id 63696, offset 0, flags [DF], proto TCP (6), length 3400)
    127.0.0.1.9150 > 127.0.0.1.46110: Flags [P.], cksum 0x0b3d (incorrect -> 0x4096), seq 74862:78210, ack 961, win 512, options [nop,nop,TS val 333078865 ecr 333078865], length 3348
2022-04-06 13:13:16.362448 IP (tos 0x0, ttl 64, id 12614, offset 0, flags [DF], proto TCP (6), length 52)
    127.0.0.1.46110 > 127.0.0.1.9150: Flags [.], cksum 0xfe28 (incorrect -> 0x7070), seq 961, ack 78210, win 512, options [nop,nop,TS val 333078865 ecr 333078865], length 0
2022-04-06 13:13:16.362699 IP (tos 0x0, ttl 64, id 63697, offset 0, flags [DF], proto TCP (6), length 3944)
    127.0.0.1.9150 > 127.0.0.1.46110: Flags [P.], cksum 0x0d5d (incorrect -> 0x77e0), seq 78210:82102, ack 961, win 512, options [nop,nop,TS val 333078865 ecr 333078865], length 3892
2022-04-06 13:13:16.362716 IP (tos 0x0, ttl 64, id 12615, offset 0, flags [DF], proto TCP (6), length 52)
    127.0.0.1.46110 > 127.0.0.1.9150: Flags [.], cksum 0xfe28 (incorrect -> 0x613c), seq 961, ack 82102, win 512, options [nop,nop,TS val 333078865 ecr 333078865], length 0
2022-04-06 13:13:16.363921 IP (tos 0x0, ttl 64, id 63698, offset 0, flags [DF], proto TCP (6), length 3446)
    127.0.0.1.9150 > 127.0.0.1.46110: Flags [P.], cksum 0x0b6b (incorrect -> 0x7b1d), seq 82102:85496, ack 961, win 512, options [nop,nop,TS val 333078866 ecr 333078865], length 3394
2022-04-06 13:13:16.363943 IP (tos 0x0, ttl 64, id 12616, offset 0, flags [DF], proto TCP (6), length 52)
    127.0.0.1.46110 > 127.0.0.1.9150: Flags [.], cksum 0xfe28 (incorrect -> 0x53f8), seq 961, ack 85496, win 512, options [nop,nop,TS val 333078866 ecr 333078866], length 0
2022-04-06 13:13:16.366739 IP (tos 0x0, ttl 64, id 63699, offset 0, flags [DF], proto TCP (6), length 1952)
    127.0.0.1.9150 > 127.0.0.1.46110: Flags [P.], cksum 0x0595 (incorrect -> 0xc637), seq 85496:87396, ack 961, win 512, options [nop,nop,TS val 333078869 ecr 333078866], length 1900
2022-04-06 13:13:16.366755 IP (tos 0x0, ttl 64, id 12617, offset 0, flags [DF], proto TCP (6), length 52)
    127.0.0.1.46110 > 127.0.0.1.9150: Flags [.], cksum 0xfe28 (incorrect -> 0x4c86), seq 961, ack 87396, win 512, options [nop,nop,TS val 333078869 ecr 333078869], length 0
2022-04-06 13:13:16.366976 IP (tos 0x0, ttl 64, id 63700, offset 0, flags [DF], proto TCP (6), length 3446)
    127.0.0.1.9150 > 127.0.0.1.46110: Flags [P.], cksum 0x0b6b (incorrect -> 0x9725), seq 87396:90790, ack 961, win 512, options [nop,nop,TS val 333078869 ecr 333078869], length 3394
2022-04-06 13:13:16.367489 IP (tos 0x0, ttl 64, id 12618, offset 0, flags [DF], proto TCP (6), length 52)
    127.0.0.1.46110 > 127.0.0.1.9150: Flags [.], cksum 0xfe28 (incorrect -> 0x3f43), seq 961, ack 90790, win 512, options [nop,nop,TS val 333078870 ecr 333078869], length 0
2022-04-06 13:13:16.368229 IP (tos 0x0, ttl 64, id 63701, offset 0, flags [DF], proto TCP (6), length 2450)
    127.0.0.1.9150 > 127.0.0.1.46110: Flags [P.], cksum 0x0787 (incorrect -> 0xcee6), seq 90790:93188, ack 961, win 512, options [nop,nop,TS val 333078871 ecr 333078870], length 2398
2022-04-06 13:13:16.368246 IP (tos 0x0, ttl 64, id 12619, offset 0, flags [DF], proto TCP (6), length 52)
    127.0.0.1.46110 > 127.0.0.1.9150: Flags [.], cksum 0xfe28 (incorrect -> 0x35e2), seq 961, ack 93188, win 512, options [nop,nop,TS val 333078871 ecr 333078871], length 0
2022-04-06 13:13:16.368434 IP (tos 0x0, ttl 64, id 63702, offset 0, flags [DF], proto TCP (6), length 3446)
    127.0.0.1.9150 > 127.0.0.1.46110: Flags [P.], cksum 0x0b6b (incorrect -> 0x42c7), seq 93188:96582, ack 961, win 512, options [nop,nop,TS val 333078871 ecr 333078871], length 3394
2022-04-06 13:13:16.368449 IP (tos 0x0, ttl 64, id 12620, offset 0, flags [DF], proto TCP (6), length 52)
    127.0.0.1.46110 > 127.0.0.1.9150: Flags [.], cksum 0xfe28 (incorrect -> 0x28a0), seq 961, ack 96582, win 512, options [nop,nop,TS val 333078871 ecr 333078871], length 0
2022-04-06 13:13:16.370784 IP (tos 0x0, ttl 64, id 63703, offset 0, flags [DF], proto TCP (6), length 2948)
    127.0.0.1.9150 > 127.0.0.1.46110: Flags [P.], cksum 0x0979 (incorrect -> 0x98cc), seq 96582:99478, ack 961, win 512, options [nop,nop,TS val 333078873 ecr 333078871], length 2896
2022-04-06 13:13:16.371089 IP (tos 0x0, ttl 64, id 12621, offset 0, flags [DF], proto TCP (6), length 52)
    127.0.0.1.46110 > 127.0.0.1.9150: Flags [.], cksum 0xfe28 (incorrect -> 0x1d4b), seq 961, ack 99478, win 512, options [nop,nop,TS val 333078874 ecr 333078873], length 0
2022-04-06 13:13:16.371133 IP (tos 0x0, ttl 64, id 63704, offset 0, flags [DF], proto TCP (6), length 3446)
    127.0.0.1.9150 > 127.0.0.1.46110: Flags [P.], cksum 0x0b6b (incorrect -> 0xa84f), seq 99478:102872, ack 961, win 512, options [nop,nop,TS val 333078874 ecr 333078874], length 3394
2022-04-06 13:13:16.371188 IP (tos 0x0, ttl 64, id 12622, offset 0, flags [DF], proto TCP (6), length 52)
    127.0.0.1.46110 > 127.0.0.1.9150: Flags [.], cksum 0xfe28 (incorrect -> 0x1008), seq 961, ack 102872, win 512, options [nop,nop,TS val 333078874 ecr 333078874], length 0
2022-04-06 13:13:16.379869 IP (tos 0x0, ttl 64, id 63705, offset 0, flags [DF], proto TCP (6), length 1454)
    127.0.0.1.9150 > 127.0.0.1.46110: Flags [P.], cksum 0x03a3 (incorrect -> 0x072e), seq 102872:104274, ack 961, win 512, options [nop,nop,TS val 333078882 ecr 333078874], length 1402
2022-04-06 13:13:16.379894 IP (tos 0x0, ttl 64, id 12623, offset 0, flags [DF], proto TCP (6), length 52)
    127.0.0.1.46110 > 127.0.0.1.9150: Flags [.], cksum 0xfe28 (incorrect -> 0x0a7e), seq 961, ack 104274, win 512, options [nop,nop,TS val 333078882 ecr 333078882], length 0
2022-04-06 13:13:16.383825 IP (tos 0x0, ttl 64, id 63706, offset 0, flags [DF], proto TCP (6), length 2948)
    127.0.0.1.9150 > 127.0.0.1.46110: Flags [P.], cksum 0x0979 (incorrect -> 0x9364), seq 104274:107170, ack 961, win 512, options [nop,nop,TS val 333078886 ecr 333078882], length 2896
2022-04-06 13:13:16.383842 IP (tos 0x0, ttl 64, id 12624, offset 0, flags [DF], proto TCP (6), length 52)
    127.0.0.1.46110 > 127.0.0.1.9150: Flags [.], cksum 0xfe28 (incorrect -> 0xff25), seq 961, ack 107170, win 512, options [nop,nop,TS val 333078886 ecr 333078886], length 0
2022-04-06 13:13:16.384794 IP (tos 0x0, ttl 64, id 63707, offset 0, flags [DF], proto TCP (6), length 3446)
    127.0.0.1.9150 > 127.0.0.1.46110: Flags [P.], cksum 0x0b6b (incorrect -> 0xabc2), seq 107170:110564, ack 961, win 512, options [nop,nop,TS val 333078887 ecr 333078886], length 3394
2022-04-06 13:13:16.384810 IP (tos 0x0, ttl 64, id 12625, offset 0, flags [DF], proto TCP (6), length 52)
    127.0.0.1.46110 > 127.0.0.1.9150: Flags [.], cksum 0xfe28 (incorrect -> 0xf1e1), seq 961, ack 110564, win 512, options [nop,nop,TS val 333078887 ecr 333078887], length 0
2022-04-06 13:13:16.386379 IP (tos 0x0, ttl 64, id 63708, offset 0, flags [DF], proto TCP (6), length 3446)
    127.0.0.1.9150 > 127.0.0.1.46110: Flags [P.], cksum 0x0b6b (incorrect -> 0x32c8), seq 110564:113958, ack 961, win 512, options [nop,nop,TS val 333078889 ecr 333078887], length 3394
2022-04-06 13:13:16.426670 IP (tos 0x0, ttl 64, id 12626, offset 0, flags [DF], proto TCP (6), length 52)
    127.0.0.1.46110 > 127.0.0.1.9150: Flags [.], cksum 0xfe28 (incorrect -> 0xe473), seq 961, ack 113958, win 512, options [nop,nop,TS val 333078929 ecr 333078889], length 0
200, 3.7741947174072266, 0.9782142639160156