2022-04-06 06:24:15.215506 IP (tos 0x0, ttl 64, id 63001, offset 0, flags [DF], proto TCP (6), length 60)
    127.0.0.1.47074 > 127.0.0.1.9750: Flags [S], cksum 0xfe30 (incorrect -> 0xd9e3), seq 3956191356, win 65495, options [mss 65495,sackOK,TS val 308537718 ecr 0,nop,wscale 7], length 0
2022-04-06 06:24:15.215514 IP (tos 0x0, ttl 64, id 0, offset 0, flags [DF], proto TCP (6), length 60)
    127.0.0.1.9750 > 127.0.0.1.47074: Flags [S.], cksum 0xfe30 (incorrect -> 0xa643), seq 1534647368, ack 3956191357, win 65483, options [mss 65495,sackOK,TS val 308537718 ecr 308537718,nop,wscale 7], length 0
2022-04-06 06:24:15.215522 IP (tos 0x0, ttl 64, id 63002, offset 0, flags [DF], proto TCP (6), length 52)
    127.0.0.1.47074 > 127.0.0.1.9750: Flags [.], cksum 0xfe28 (incorrect -> 0xccff), seq 1, ack 1, win 512, options [nop,nop,TS val 308537718 ecr 308537718], length 0
2022-04-06 06:24:15.215614 IP (tos 0x0, ttl 64, id 63003, offset 0, flags [DF], proto TCP (6), length 55)
    127.0.0.1.47074 > 127.0.0.1.9750: Flags [P.], cksum 0xfe2b (incorrect -> 0xc7f3), seq 1:4, ack 1, win 512, options [nop,nop,TS val 308537718 ecr 308537718], length 3
2022-04-06 06:24:15.215627 IP (tos 0x0, ttl 64, id 4279, offset 0, flags [DF], proto TCP (6), length 52)
    127.0.0.1.9750 > 127.0.0.1.47074: Flags [.], cksum 0xfe28 (incorrect -> 0xccfc), seq 1, ack 4, win 512, options [nop,nop,TS val 308537718 ecr 308537718], length 0
2022-04-06 06:24:15.215706 IP (tos 0x0, ttl 64, id 4280, offset 0, flags [DF], proto TCP (6), length 54)
    127.0.0.1.9750 > 127.0.0.1.47074: Flags [P.], cksum 0xfe2a (incorrect -> 0xc7f2), seq 1:3, ack 4, win 512, options [nop,nop,TS val 308537718 ecr 308537718], length 2
2022-04-06 06:24:15.215729 IP (tos 0x0, ttl 64, id 63004, offset 0, flags [DF], proto TCP (6), length 52)
    127.0.0.1.47074 > 127.0.0.1.9750: Flags [.], cksum 0xfe28 (incorrect -> 0xccfa), seq 4, ack 3, win 512, options [nop,nop,TS val 308537718 ecr 308537718], length 0
2022-04-06 06:24:15.227370 IP (tos 0x0, ttl 64, id 63005, offset 0, flags [DF], proto TCP (6), length 62)
    127.0.0.1.47074 > 127.0.0.1.9750: Flags [P.], cksum 0xfe32 (incorrect -> 0x738f), seq 4:14, ack 3, win 512, options [nop,nop,TS val 308537730 ecr 308537718], length 10
2022-04-06 06:24:15.227394 IP (tos 0x0, ttl 64, id 4281, offset 0, flags [DF], proto TCP (6), length 52)
    127.0.0.1.9750 > 127.0.0.1.47074: Flags [.], cksum 0xfe28 (incorrect -> 0xccd8), seq 3, ack 14, win 512, options [nop,nop,TS val 308537730 ecr 308537730], length 0
2022-04-06 06:24:15.301349 IP (tos 0x0, ttl 64, id 4282, offset 0, flags [DF], proto TCP (6), length 62)
    127.0.0.1.9750 > 127.0.0.1.47074: Flags [P.], cksum 0xfe32 (incorrect -> 0xc77b), seq 3:13, ack 14, win 512, options [nop,nop,TS val 308537804 ecr 308537730], length 10
2022-04-06 06:24:15.301367 IP (tos 0x0, ttl 64, id 63006, offset 0, flags [DF], proto TCP (6), length 52)
    127.0.0.1.47074 > 127.0.0.1.9750: Flags [.], cksum 0xfe28 (incorrect -> 0xcc3a), seq 14, ack 13, win 512, options [nop,nop,TS val 308537804 ecr 308537804], length 0
2022-04-06 06:24:15.307650 IP (tos 0x0, ttl 64, id 63007, offset 0, flags [DF], proto TCP (6), length 569)
    127.0.0.1.47074 > 127.0.0.1.9750: Flags [P.], cksum 0x002e (incorrect -> 0x0d33), seq 14:531, ack 13, win 512, options [nop,nop,TS val 308537810 ecr 308537804], length 517
2022-04-06 06:24:15.307657 IP (tos 0x0, ttl 64, id 4283, offset 0, flags [DF], proto TCP (6), length 52)
    127.0.0.1.9750 > 127.0.0.1.47074: Flags [.], cksum 0xfe28 (incorrect -> 0xca2d), seq 13, ack 531, win 508, options [nop,nop,TS val 308537810 ecr 308537810], length 0
200, 7.740259647369385, 0.5912935733795166