2022-04-06 05:49:52.505259 IP (tos 0x0, ttl 64, id 58320, offset 0, flags [DF], proto TCP (6), length 60)
    127.0.0.1.46788 > 127.0.0.1.9950: Flags [S], cksum 0xfe30 (incorrect -> 0x3fdd), seq 1075605537, win 65495, options [mss 65495,sackOK,TS val 306475008 ecr 0,nop,wscale 7], length 0
2022-04-06 05:49:52.505270 IP (tos 0x0, ttl 64, id 0, offset 0, flags [DF], proto TCP (6), length 60)
    127.0.0.1.9950 > 127.0.0.1.46788: Flags [S.], cksum 0xfe30 (incorrect -> 0x2078), seq 3951145369, ack 1075605538, win 65483, options [mss 65495,sackOK,TS val 306475008 ecr 306475008,nop,wscale 7], length 0
2022-04-06 05:49:52.505281 IP (tos 0x0, ttl 64, id 58321, offset 0, flags [DF], proto TCP (6), length 52)
    127.0.0.1.46788 > 127.0.0.1.9950: Flags [.], cksum 0xfe28 (incorrect -> 0x4734), seq 1, ack 1, win 512, options [nop,nop,TS val 306475008 ecr 306475008], length 0
2022-04-06 05:49:52.505388 IP (tos 0x0, ttl 64, id 58322, offset 0, flags [DF], proto TCP (6), length 55)
    127.0.0.1.46788 > 127.0.0.1.9950: Flags [P.], cksum 0xfe2b (incorrect -> 0x4228), seq 1:4, ack 1, win 512, options [nop,nop,TS val 306475008 ecr 306475008], length 3
2022-04-06 05:49:52.505393 IP (tos 0x0, ttl 64, id 34906, offset 0, flags [DF], proto TCP (6), length 52)
    127.0.0.1.9950 > 127.0.0.1.46788: Flags [.], cksum 0xfe28 (incorrect -> 0x4731), seq 1, ack 4, win 512, options [nop,nop,TS val 306475008 ecr 306475008], length 0
2022-04-06 05:49:52.505465 IP (tos 0x0, ttl 64, id 34907, offset 0, flags [DF], proto TCP (6), length 54)
    127.0.0.1.9950 > 127.0.0.1.46788: Flags [P.], cksum 0xfe2a (incorrect -> 0x4227), seq 1:3, ack 4, win 512, options [nop,nop,TS val 306475008 ecr 306475008], length 2
2022-04-06 05:49:52.505489 IP (tos 0x0, ttl 64, id 58323, offset 0, flags [DF], proto TCP (6), length 52)
    127.0.0.1.46788 > 127.0.0.1.9950: Flags [.], cksum 0xfe28 (incorrect -> 0x472f), seq 4, ack 3, win 512, options [nop,nop,TS val 306475008 ecr 306475008], length 0
2022-04-06 05:49:52.721857 IP (tos 0x0, ttl 64, id 58324, offset 0, flags [DF], proto TCP (6), length 62)
    127.0.0.1.46788 > 127.0.0.1.9950: Flags [P.], cksum 0xfe32 (incorrect -> 0x3997), seq 4:14, ack 3, win 512, options [nop,nop,TS val 306475224 ecr 306475008], length 10
2022-04-06 05:49:52.721881 IP (tos 0x0, ttl 64, id 34908, offset 0, flags [DF], proto TCP (6), length 52)
    127.0.0.1.9950 > 127.0.0.1.46788: Flags [.], cksum 0xfe28 (incorrect -> 0x4575), seq 3, ack 14, win 512, options [nop,nop,TS val 306475224 ecr 306475224], length 0
2022-04-06 05:49:53.119276 IP (tos 0x0, ttl 64, id 34909, offset 0, flags [DF], proto TCP (6), length 62)
    127.0.0.1.9950 > 127.0.0.1.46788: Flags [P.], cksum 0xfe32 (incorrect -> 0x3ed4), seq 3:13, ack 14, win 512, options [nop,nop,TS val 306475622 ecr 306475224], length 10
2022-04-06 05:49:53.119305 IP (tos 0x0, ttl 64, id 58325, offset 0, flags [DF], proto TCP (6), length 52)
    127.0.0.1.46788 > 127.0.0.1.9950: Flags [.], cksum 0xfe28 (incorrect -> 0x424f), seq 14, ack 13, win 512, options [nop,nop,TS val 306475622 ecr 306475622], length 0
2022-04-06 05:49:53.125711 IP (tos 0x0, ttl 64, id 58326, offset 0, flags [DF], proto TCP (6), length 569)
    127.0.0.1.46788 > 127.0.0.1.9950: Flags [P.], cksum 0x002e (incorrect -> 0xaa28), seq 14:531, ack 13, win 512, options [nop,nop,TS val 306475628 ecr 306475622], length 517
2022-04-06 05:49:53.125733 IP (tos 0x0, ttl 64, id 34910, offset 0, flags [DF], proto TCP (6), length 52)
    127.0.0.1.9950 > 127.0.0.1.46788: Flags [.], cksum 0xfe28 (incorrect -> 0x4042), seq 13, ack 531, win 508, options [nop,nop,TS val 306475628 ecr 306475628], length 0
2022-04-06 05:49:53.525687 IP (tos 0x0, ttl 64, id 34911, offset 0, flags [DF], proto TCP (6), length 3538)
    127.0.0.1.9950 > 127.0.0.1.46788: Flags [P.], cksum 0x0bc7 (incorrect -> 0x9855), seq 13:3499, ack 531, win 512, options [nop,nop,TS val 306476028 ecr 306475628], length 3486
2022-04-06 05:49:53.525713 IP (tos 0x0, ttl 64, id 58327, offset 0, flags [DF], proto TCP (6), length 52)
    127.0.0.1.46788 > 127.0.0.1.9950: Flags [.], cksum 0xfe28 (incorrect -> 0x2f92), seq 531, ack 3499, win 494, options [nop,nop,TS val 306476028 ecr 306476028], length 0
2022-04-06 05:49:53.551155 IP (tos 0x0, ttl 64, id 34912, offset 0, flags [DF], proto TCP (6), length 662)
    127.0.0.1.9950 > 127.0.0.1.46788: Flags [P.], cksum 0x008b (incorrect -> 0xb6ad), seq 3499:4109, ack 531, win 512, options [nop,nop,TS val 306476054 ecr 306476028], length 610
2022-04-06 05:49:53.551164 IP (tos 0x0, ttl 64, id 58328, offset 0, flags [DF], proto TCP (6), length 52)
    127.0.0.1.46788 > 127.0.0.1.9950: Flags [.], cksum 0xfe28 (incorrect -> 0x2cf1), seq 531, ack 4109, win 505, options [nop,nop,TS val 306476054 ecr 306476054], length 0
2022-04-06 05:49:53.666540 IP (tos 0x0, ttl 64, id 34913, offset 0, flags [DF], proto TCP (6), length 1090)
    127.0.0.1.9950 > 127.0.0.1.46788: Flags [P.], cksum 0x0237 (incorrect -> 0x9bff), seq 4109:5147, ack 531, win 512, options [nop,nop,TS val 306476169 ecr 306476054], length 1038
2022-04-06 05:49:53.666545 IP (tos 0x0, ttl 64, id 58329, offset 0, flags [DF], proto TCP (6), length 52)
    127.0.0.1.46788 > 127.0.0.1.9950: Flags [.], cksum 0xfe28 (incorrect -> 0x27ff), seq 531, ack 5147, win 503, options [nop,nop,TS val 306476169 ecr 306476169], length 0
2022-04-06 05:49:53.667031 IP (tos 0x0, ttl 64, id 58330, offset 0, flags [DF], proto TCP (6), length 132)
    127.0.0.1.46788 > 127.0.0.1.9950: Flags [P.], cksum 0xfe78 (incorrect -> 0xc769), seq 531:611, ack 5147, win 512, options [nop,nop,TS val 306476169 ecr 306476169], length 80
2022-04-06 05:49:53.667036 IP (tos 0x0, ttl 64, id 34914, offset 0, flags [DF], proto TCP (6), length 52)
    127.0.0.1.9950 > 127.0.0.1.46788: Flags [.], cksum 0xfe28 (incorrect -> 0x27a6), seq 5147, ack 611, win 512, options [nop,nop,TS val 306476169 ecr 306476169], length 0
2022-04-06 05:49:53.667353 IP (tos 0x0, ttl 64, id 58331, offset 0, flags [DF], proto TCP (6), length 330)
    127.0.0.1.46788 > 127.0.0.1.9950: Flags [P.], cksum 0xff3e (incorrect -> 0xecb5), seq 611:889, ack 5147, win 512, options [nop,nop,TS val 306476170 ecr 306476169], length 278
2022-04-06 05:49:53.667357 IP (tos 0x0, ttl 64, id 34915, offset 0, flags [DF], proto TCP (6), length 52)
    127.0.0.1.9950 > 127.0.0.1.46788: Flags [.], cksum 0xfe28 (incorrect -> 0x2690), seq 5147, ack 889, win 510, options [nop,nop,TS val 306476170 ecr 306476170], length 0
200, 123.45336651802063, 1.7057881355285645