2022-04-06 02:08:42.328922 IP (tos 0x0, ttl 64, id 15752, offset 0, flags [DF], proto TCP (6), length 60)
    127.0.0.1.38228 > 127.0.0.1.10350: Flags [S], cksum 0xfe30 (incorrect -> 0xf511), seq 702312056, win 65495, options [mss 65495,sackOK,TS val 293204831 ecr 0,nop,wscale 7], length 0
2022-04-06 02:08:42.328930 IP (tos 0x0, ttl 64, id 0, offset 0, flags [DF], proto TCP (6), length 60)
    127.0.0.1.10350 > 127.0.0.1.38228: Flags [S.], cksum 0xfe30 (incorrect -> 0x637f), seq 1666001255, ack 702312057, win 65483, options [mss 65495,sackOK,TS val 293204831 ecr 293204831,nop,wscale 7], length 0
2022-04-06 02:08:42.328937 IP (tos 0x0, ttl 64, id 15753, offset 0, flags [DF], proto TCP (6), length 52)
    127.0.0.1.38228 > 127.0.0.1.10350: Flags [.], cksum 0xfe28 (incorrect -> 0x8a3b), seq 1, ack 1, win 512, options [nop,nop,TS val 293204831 ecr 293204831], length 0
2022-04-06 02:08:42.329025 IP (tos 0x0, ttl 64, id 15754, offset 0, flags [DF], proto TCP (6), length 55)
    127.0.0.1.38228 > 127.0.0.1.10350: Flags [P.], cksum 0xfe2b (incorrect -> 0x852f), seq 1:4, ack 1, win 512, options [nop,nop,TS val 293204831 ecr 293204831], length 3
2022-04-06 02:08:42.329029 IP (tos 0x0, ttl 64, id 16619, offset 0, flags [DF], proto TCP (6), length 52)
    127.0.0.1.10350 > 127.0.0.1.38228: Flags [.], cksum 0xfe28 (incorrect -> 0x8a38), seq 1, ack 4, win 512, options [nop,nop,TS val 293204831 ecr 293204831], length 0
2022-04-06 02:08:42.329137 IP (tos 0x0, ttl 64, id 16620, offset 0, flags [DF], proto TCP (6), length 54)
    127.0.0.1.10350 > 127.0.0.1.38228: Flags [P.], cksum 0xfe2a (incorrect -> 0x852d), seq 1:3, ack 4, win 512, options [nop,nop,TS val 293204832 ecr 293204831], length 2
2022-04-06 02:08:42.329164 IP (tos 0x0, ttl 64, id 15755, offset 0, flags [DF], proto TCP (6), length 52)
    127.0.0.1.38228 > 127.0.0.1.10350: Flags [.], cksum 0xfe28 (incorrect -> 0x8a34), seq 4, ack 3, win 512, options [nop,nop,TS val 293204832 ecr 293204832], length 0
2022-04-06 02:08:42.379717 IP (tos 0x0, ttl 64, id 15756, offset 0, flags [DF], proto TCP (6), length 62)
    127.0.0.1.38228 > 127.0.0.1.10350: Flags [P.], cksum 0xfe32 (incorrect -> 0x0f11), seq 4:14, ack 3, win 512, options [nop,nop,TS val 293204882 ecr 293204832], length 10
2022-04-06 02:08:42.379735 IP (tos 0x0, ttl 64, id 16621, offset 0, flags [DF], proto TCP (6), length 52)
    127.0.0.1.10350 > 127.0.0.1.38228: Flags [.], cksum 0xfe28 (incorrect -> 0x89c6), seq 3, ack 14, win 512, options [nop,nop,TS val 293204882 ecr 293204882], length 0
2022-04-06 02:08:42.467497 IP (tos 0x0, ttl 64, id 16622, offset 0, flags [DF], proto TCP (6), length 62)
    127.0.0.1.10350 > 127.0.0.1.38228: Flags [P.], cksum 0xfe32 (incorrect -> 0x845b), seq 3:13, ack 14, win 512, options [nop,nop,TS val 293204970 ecr 293204882], length 10
2022-04-06 02:08:42.467509 IP (tos 0x0, ttl 64, id 15757, offset 0, flags [DF], proto TCP (6), length 52)
    127.0.0.1.38228 > 127.0.0.1.10350: Flags [.], cksum 0xfe28 (incorrect -> 0x890c), seq 14, ack 13, win 512, options [nop,nop,TS val 293204970 ecr 293204970], length 0
2022-04-06 02:08:42.473697 IP (tos 0x0, ttl 64, id 15758, offset 0, flags [DF], proto TCP (6), length 569)
    127.0.0.1.38228 > 127.0.0.1.10350: Flags [P.], cksum 0x002e (incorrect -> 0xc29f), seq 14:531, ack 13, win 512, options [nop,nop,TS val 293204976 ecr 293204970], length 517
2022-04-06 02:08:42.473716 IP (tos 0x0, ttl 64, id 16623, offset 0, flags [DF], proto TCP (6), length 52)
    127.0.0.1.10350 > 127.0.0.1.38228: Flags [.], cksum 0xfe28 (incorrect -> 0x86ff), seq 13, ack 531, win 508, options [nop,nop,TS val 293204976 ecr 293204976], length 0
200, 9.579339981079102, 0.9912915229797363