2022-04-06 09:23:31.130387 IP (tos 0x0, ttl 64, id 13517, offset 0, flags [DF], proto TCP (6), length 60)
    127.0.0.1.54112 > 127.0.0.1.12050: Flags [S], cksum 0xfe30 (incorrect -> 0xf6c8), seq 2643107186, win 65495, options [mss 65495,sackOK,TS val 319293633 ecr 0,nop,wscale 7], length 0
2022-04-06 09:23:31.130394 IP (tos 0x0, ttl 64, id 0, offset 0, flags [DF], proto TCP (6), length 60)
    127.0.0.1.12050 > 127.0.0.1.54112: Flags [S.], cksum 0xfe30 (incorrect -> 0xf83b), seq 2083022486, ack 2643107187, win 65483, options [mss 65495,sackOK,TS val 319293633 ecr 319293633,nop,wscale 7], length 0
2022-04-06 09:23:31.130401 IP (tos 0x0, ttl 64, id 13518, offset 0, flags [DF], proto TCP (6), length 52)
    127.0.0.1.54112 > 127.0.0.1.12050: Flags [.], cksum 0xfe28 (incorrect -> 0x1ef8), seq 1, ack 1, win 512, options [nop,nop,TS val 319293633 ecr 319293633], length 0
2022-04-06 09:23:31.130489 IP (tos 0x0, ttl 64, id 13519, offset 0, flags [DF], proto TCP (6), length 55)
    127.0.0.1.54112 > 127.0.0.1.12050: Flags [P.], cksum 0xfe2b (incorrect -> 0x19ec), seq 1:4, ack 1, win 512, options [nop,nop,TS val 319293633 ecr 319293633], length 3
2022-04-06 09:23:31.130498 IP (tos 0x0, ttl 64, id 19533, offset 0, flags [DF], proto TCP (6), length 52)
    127.0.0.1.12050 > 127.0.0.1.54112: Flags [.], cksum 0xfe28 (incorrect -> 0x1ef5), seq 1, ack 4, win 512, options [nop,nop,TS val 319293633 ecr 319293633], length 0
2022-04-06 09:23:31.130548 IP (tos 0x0, ttl 64, id 19534, offset 0, flags [DF], proto TCP (6), length 54)
    127.0.0.1.12050 > 127.0.0.1.54112: Flags [P.], cksum 0xfe2a (incorrect -> 0x19eb), seq 1:3, ack 4, win 512, options [nop,nop,TS val 319293633 ecr 319293633], length 2
2022-04-06 09:23:31.130564 IP (tos 0x0, ttl 64, id 13520, offset 0, flags [DF], proto TCP (6), length 52)
    127.0.0.1.54112 > 127.0.0.1.12050: Flags [.], cksum 0xfe28 (incorrect -> 0x1ef3), seq 4, ack 3, win 512, options [nop,nop,TS val 319293633 ecr 319293633], length 0
2022-04-06 09:23:31.132321 IP (tos 0x0, ttl 64, id 13521, offset 0, flags [DF], proto TCP (6), length 62)
    127.0.0.1.54112 > 127.0.0.1.12050: Flags [P.], cksum 0xfe32 (incorrect -> 0x84ec), seq 4:14, ack 3, win 512, options [nop,nop,TS val 319293635 ecr 319293633], length 10
2022-04-06 09:23:31.132329 IP (tos 0x0, ttl 64, id 19535, offset 0, flags [DF], proto TCP (6), length 52)
    127.0.0.1.12050 > 127.0.0.1.54112: Flags [.], cksum 0xfe28 (incorrect -> 0x1ee5), seq 3, ack 14, win 512, options [nop,nop,TS val 319293635 ecr 319293635], length 0
2022-04-06 09:23:31.227871 IP (tos 0x0, ttl 64, id 19536, offset 0, flags [DF], proto TCP (6), length 62)
    127.0.0.1.12050 > 127.0.0.1.54112: Flags [P.], cksum 0xfe32 (incorrect -> 0x1973), seq 3:13, ack 14, win 512, options [nop,nop,TS val 319293730 ecr 319293635], length 10
2022-04-06 09:23:31.227876 IP (tos 0x0, ttl 64, id 13522, offset 0, flags [DF], proto TCP (6), length 52)
    127.0.0.1.54112 > 127.0.0.1.12050: Flags [.], cksum 0xfe28 (incorrect -> 0x1e1d), seq 14, ack 13, win 512, options [nop,nop,TS val 319293730 ecr 319293730], length 0
2022-04-06 09:23:31.233336 IP (tos 0x0, ttl 64, id 13523, offset 0, flags [DF], proto TCP (6), length 569)
    127.0.0.1.54112 > 127.0.0.1.12050: Flags [P.], cksum 0x002e (incorrect -> 0xe3f3), seq 14:531, ack 13, win 512, options [nop,nop,TS val 319293736 ecr 319293730], length 517
2022-04-06 09:23:31.233353 IP (tos 0x0, ttl 64, id 19537, offset 0, flags [DF], proto TCP (6), length 52)
    127.0.0.1.12050 > 127.0.0.1.54112: Flags [.], cksum 0xfe28 (incorrect -> 0x1c10), seq 13, ack 531, win 508, options [nop,nop,TS val 319293736 ecr 319293736], length 0
2022-04-06 09:23:31.333393 IP (tos 0x0, ttl 64, id 19538, offset 0, flags [DF], proto TCP (6), length 2804)
    127.0.0.1.12050 > 127.0.0.1.54112: Flags [P.], cksum 0x08e9 (incorrect -> 0x69e6), seq 13:2765, ack 531, win 512, options [nop,nop,TS val 319293836 ecr 319293736], length 2752
2022-04-06 09:23:31.333401 IP (tos 0x0, ttl 64, id 13524, offset 0, flags [DF], proto TCP (6), length 52)
    127.0.0.1.54112 > 127.0.0.1.12050: Flags [.], cksum 0xfe28 (incorrect -> 0x1093), seq 531, ack 2765, win 497, options [nop,nop,TS val 319293836 ecr 319293836], length 0
2022-04-06 09:23:31.334953 IP (tos 0x0, ttl 64, id 13525, offset 0, flags [DF], proto TCP (6), length 132)
    127.0.0.1.54112 > 127.0.0.1.12050: Flags [P.], cksum 0xfe78 (incorrect -> 0x0573), seq 531:611, ack 2765, win 512, options [nop,nop,TS val 319293837 ecr 319293836], length 80
2022-04-06 09:23:31.334958 IP (tos 0x0, ttl 64, id 19539, offset 0, flags [DF], proto TCP (6), length 52)
    127.0.0.1.12050 > 127.0.0.1.54112: Flags [.], cksum 0xfe28 (incorrect -> 0x1032), seq 2765, ack 611, win 512, options [nop,nop,TS val 319293837 ecr 319293837], length 0
2022-04-06 09:23:31.335175 IP (tos 0x0, ttl 64, id 13526, offset 0, flags [DF], proto TCP (6), length 351)
    127.0.0.1.54112 > 127.0.0.1.12050: Flags [P.], cksum 0xff53 (incorrect -> 0xfb7f), seq 611:910, ack 2765, win 512, options [nop,nop,TS val 319293838 ecr 319293837], length 299
2022-04-06 09:23:31.335178 IP (tos 0x0, ttl 64, id 19540, offset 0, flags [DF], proto TCP (6), length 52)
    127.0.0.1.12050 > 127.0.0.1.54112: Flags [.], cksum 0xfe28 (incorrect -> 0x0f07), seq 2765, ack 910, win 510, options [nop,nop,TS val 319293838 ecr 319293838], length 0
2022-04-06 09:23:31.539777 IP (tos 0x0, ttl 64, id 19541, offset 0, flags [DF], proto TCP (6), length 846)
    127.0.0.1.12050 > 127.0.0.1.54112: Flags [P.], cksum 0x0143 (incorrect -> 0x099e), seq 2765:3559, ack 910, win 512, options [nop,nop,TS val 319294042 ecr 319293838], length 794
2022-04-06 09:23:31.539781 IP (tos 0x0, ttl 64, id 13527, offset 0, flags [DF], proto TCP (6), length 52)
    127.0.0.1.54112 > 127.0.0.1.12050: Flags [.], cksum 0xfe28 (incorrect -> 0x0a59), seq 910, ack 3559, win 506, options [nop,nop,TS val 319294042 ecr 319294042], length 0
2022-04-06 09:23:31.541201 IP (tos 0x0, ttl 64, id 2215, offset 0, flags [DF], proto TCP (6), length 60)
    127.0.0.1.54114 > 127.0.0.1.12050: Flags [S], cksum 0xfe30 (incorrect -> 0x8375), seq 831028011, win 65495, options [mss 65495,sackOK,TS val 319294044 ecr 0,nop,wscale 7], length 0
2022-04-06 09:23:31.541207 IP (tos 0x0, ttl 64, id 0, offset 0, flags [DF], proto TCP (6), length 60)
    127.0.0.1.12050 > 127.0.0.1.54114: Flags [S.], cksum 0xfe30 (incorrect -> 0x597d), seq 2641653530, ack 831028012, win 65483, options [mss 65495,sackOK,TS val 319294044 ecr 319294044,nop,wscale 7], length 0
2022-04-06 09:23:31.541212 IP (tos 0x0, ttl 64, id 2216, offset 0, flags [DF], proto TCP (6), length 52)
    127.0.0.1.54114 > 127.0.0.1.12050: Flags [.], cksum 0xfe28 (incorrect -> 0x8039), seq 1, ack 1, win 512, options [nop,nop,TS val 319294044 ecr 319294044], length 0
2022-04-06 09:23:31.541258 IP (tos 0x0, ttl 64, id 2217, offset 0, flags [DF], proto TCP (6), length 55)
    127.0.0.1.54114 > 127.0.0.1.12050: Flags [P.], cksum 0xfe2b (incorrect -> 0x7b2d), seq 1:4, ack 1, win 512, options [nop,nop,TS val 319294044 ecr 319294044], length 3
2022-04-06 09:23:31.541260 IP (tos 0x0, ttl 64, id 21933, offset 0, flags [DF], proto TCP (6), length 52)
    127.0.0.1.12050 > 127.0.0.1.54114: Flags [.], cksum 0xfe28 (incorrect -> 0x8036), seq 1, ack 4, win 512, options [nop,nop,TS val 319294044 ecr 319294044], length 0
2022-04-06 09:23:31.541304 IP (tos 0x0, ttl 64, id 21934, offset 0, flags [DF], proto TCP (6), length 54)
    127.0.0.1.12050 > 127.0.0.1.54114: Flags [P.], cksum 0xfe2a (incorrect -> 0x7b2c), seq 1:3, ack 4, win 512, options [nop,nop,TS val 319294044 ecr 319294044], length 2
2022-04-06 09:23:31.541307 IP (tos 0x0, ttl 64, id 2218, offset 0, flags [DF], proto TCP (6), length 52)
    127.0.0.1.54114 > 127.0.0.1.12050: Flags [.], cksum 0xfe28 (incorrect -> 0x8034), seq 4, ack 3, win 512, options [nop,nop,TS val 319294044 ecr 319294044], length 0
2022-04-06 09:23:31.542147 IP (tos 0x0, ttl 64, id 2219, offset 0, flags [DF], proto TCP (6), length 62)
    127.0.0.1.54114 > 127.0.0.1.12050: Flags [P.], cksum 0xfe32 (incorrect -> 0xe62e), seq 4:14, ack 3, win 512, options [nop,nop,TS val 319294045 ecr 319294044], length 10
2022-04-06 09:23:31.542153 IP (tos 0x0, ttl 64, id 21935, offset 0, flags [DF], proto TCP (6), length 52)
    127.0.0.1.12050 > 127.0.0.1.54114: Flags [.], cksum 0xfe28 (incorrect -> 0x8028), seq 3, ack 14, win 512, options [nop,nop,TS val 319294045 ecr 319294045], length 0
2022-04-06 09:23:31.669848 IP (tos 0x0, ttl 64, id 21936, offset 0, flags [DF], proto TCP (6), length 62)
    127.0.0.1.12050 > 127.0.0.1.54114: Flags [P.], cksum 0xfe32 (incorrect -> 0x7a96), seq 3:13, ack 14, win 512, options [nop,nop,TS val 319294172 ecr 319294045], length 10
2022-04-06 09:23:31.669853 IP (tos 0x0, ttl 64, id 2220, offset 0, flags [DF], proto TCP (6), length 52)
    127.0.0.1.54114 > 127.0.0.1.12050: Flags [.], cksum 0xfe28 (incorrect -> 0x7f20), seq 14, ack 13, win 512, options [nop,nop,TS val 319294172 ecr 319294172], length 0
2022-04-06 09:23:31.674916 IP (tos 0x0, ttl 64, id 2221, offset 0, flags [DF], proto TCP (6), length 569)
    127.0.0.1.54114 > 127.0.0.1.12050: Flags [P.], cksum 0x002e (incorrect -> 0x6ea2), seq 14:531, ack 13, win 512, options [nop,nop,TS val 319294177 ecr 319294172], length 517
2022-04-06 09:23:31.674922 IP (tos 0x0, ttl 64, id 21937, offset 0, flags [DF], proto TCP (6), length 52)
    127.0.0.1.12050 > 127.0.0.1.54114: Flags [.], cksum 0xfe28 (incorrect -> 0x7d15), seq 13, ack 531, win 508, options [nop,nop,TS val 319294177 ecr 319294177], length 0
2022-04-06 09:23:31.772561 IP (tos 0x0, ttl 64, id 21938, offset 0, flags [DF], proto TCP (6), length 2804)
    127.0.0.1.12050 > 127.0.0.1.54114: Flags [P.], cksum 0x08e9 (incorrect -> 0xdb29), seq 13:2765, ack 531, win 512, options [nop,nop,TS val 319294275 ecr 319294177], length 2752
2022-04-06 09:23:31.772570 IP (tos 0x0, ttl 64, id 2222, offset 0, flags [DF], proto TCP (6), length 52)
    127.0.0.1.54114 > 127.0.0.1.12050: Flags [.], cksum 0xfe28 (incorrect -> 0x719c), seq 531, ack 2765, win 497, options [nop,nop,TS val 319294275 ecr 319294275], length 0
2022-04-06 09:23:31.773941 IP (tos 0x0, ttl 64, id 2223, offset 0, flags [DF], proto TCP (6), length 132)
    127.0.0.1.54114 > 127.0.0.1.12050: Flags [P.], cksum 0xfe78 (incorrect -> 0xb710), seq 531:611, ack 2765, win 512, options [nop,nop,TS val 319294276 ecr 319294275], length 80
2022-04-06 09:23:31.773946 IP (tos 0x0, ttl 64, id 21939, offset 0, flags [DF], proto TCP (6), length 52)
    127.0.0.1.12050 > 127.0.0.1.54114: Flags [.], cksum 0xfe28 (incorrect -> 0x713b), seq 2765, ack 611, win 512, options [nop,nop,TS val 319294276 ecr 319294276], length 0
2022-04-06 09:23:31.774171 IP (tos 0x0, ttl 64, id 2224, offset 0, flags [DF], proto TCP (6), length 347)
    127.0.0.1.54114 > 127.0.0.1.12050: Flags [P.], cksum 0xff4f (incorrect -> 0x1ab3), seq 611:906, ack 2765, win 512, options [nop,nop,TS val 319294277 ecr 319294276], length 295
2022-04-06 09:23:31.774177 IP (tos 0x0, ttl 64, id 21940, offset 0, flags [DF], proto TCP (6), length 52)
    127.0.0.1.12050 > 127.0.0.1.54114: Flags [.], cksum 0xfe28 (incorrect -> 0x7014), seq 2765, ack 906, win 510, options [nop,nop,TS val 319294277 ecr 319294277], length 0
2022-04-06 09:23:32.038242 IP (tos 0x0, ttl 64, id 21941, offset 0, flags [DF], proto TCP (6), length 3538)
    127.0.0.1.12050 > 127.0.0.1.54114: Flags [P.], cksum 0x0bc7 (incorrect -> 0x2d13), seq 2765:6251, ack 906, win 512, options [nop,nop,TS val 319294541 ecr 319294277], length 3486
2022-04-06 09:23:32.038248 IP (tos 0x0, ttl 64, id 2225, offset 0, flags [DF], proto TCP (6), length 52)
    127.0.0.1.54114 > 127.0.0.1.12050: Flags [.], cksum 0xfe28 (incorrect -> 0x6076), seq 906, ack 6251, win 494, options [nop,nop,TS val 319294541 ecr 319294541], length 0
2022-04-06 09:23:32.073368 IP (tos 0x0, ttl 64, id 21942, offset 0, flags [DF], proto TCP (6), length 1608)
    127.0.0.1.12050 > 127.0.0.1.54114: Flags [P.], cksum 0x043d (incorrect -> 0x4a30), seq 6251:7807, ack 906, win 512, options [nop,nop,TS val 319294576 ecr 319294541], length 1556
2022-04-06 09:23:32.073375 IP (tos 0x0, ttl 64, id 2226, offset 0, flags [DF], proto TCP (6), length 52)
    127.0.0.1.54114 > 127.0.0.1.12050: Flags [.], cksum 0xfe28 (incorrect -> 0x5a15), seq 906, ack 7807, win 501, options [nop,nop,TS val 319294576 ecr 319294576], length 0
2022-04-06 09:23:32.137846 IP (tos 0x0, ttl 64, id 21943, offset 0, flags [DF], proto TCP (6), length 3538)
    127.0.0.1.12050 > 127.0.0.1.54114: Flags [P.], cksum 0x0bc7 (incorrect -> 0x492d), seq 7807:11293, ack 906, win 512, options [nop,nop,TS val 319294640 ecr 319294576], length 3486
2022-04-06 09:23:32.137851 IP (tos 0x0, ttl 64, id 2227, offset 0, flags [DF], proto TCP (6), length 52)
    127.0.0.1.54114 > 127.0.0.1.12050: Flags [.], cksum 0xfe28 (incorrect -> 0x4bfe), seq 906, ack 11293, win 494, options [nop,nop,TS val 319294640 ecr 319294640], length 0
2022-04-06 09:23:32.201930 IP (tos 0x0, ttl 64, id 21944, offset 0, flags [DF], proto TCP (6), length 3538)
    127.0.0.1.12050 > 127.0.0.1.54114: Flags [P.], cksum 0x0bc7 (incorrect -> 0x026e), seq 11293:14779, ack 906, win 512, options [nop,nop,TS val 319294704 ecr 319294640], length 3486
2022-04-06 09:23:32.201934 IP (tos 0x0, ttl 64, id 2228, offset 0, flags [DF], proto TCP (6), length 52)
    127.0.0.1.54114 > 127.0.0.1.12050: Flags [.], cksum 0xfe28 (incorrect -> 0x3de0), seq 906, ack 14779, win 494, options [nop,nop,TS val 319294704 ecr 319294704], length 0
2022-04-06 09:23:32.219056 IP (tos 0x0, ttl 64, id 21945, offset 0, flags [DF], proto TCP (6), length 550)
    127.0.0.1.12050 > 127.0.0.1.54114: Flags [P.], cksum 0x001b (incorrect -> 0x70ed), seq 14779:15277, ack 906, win 512, options [nop,nop,TS val 319294721 ecr 319294704], length 498
2022-04-06 09:23:32.219059 IP (tos 0x0, ttl 64, id 2229, offset 0, flags [DF], proto TCP (6), length 52)
    127.0.0.1.54114 > 127.0.0.1.12050: Flags [.], cksum 0xfe28 (incorrect -> 0x3bbf), seq 906, ack 15277, win 506, options [nop,nop,TS val 319294722 ecr 319294721], length 0
2022-04-06 09:23:32.247108 IP (tos 0x0, ttl 64, id 21946, offset 0, flags [DF], proto TCP (6), length 4036)
    127.0.0.1.12050 > 127.0.0.1.54114: Flags [P.], cksum 0x0db9 (incorrect -> 0x0da9), seq 15277:19261, ack 906, win 512, options [nop,nop,TS val 319294750 ecr 319294722], length 3984
2022-04-06 09:23:32.247112 IP (tos 0x0, ttl 64, id 2230, offset 0, flags [DF], proto TCP (6), length 52)
    127.0.0.1.54114 > 127.0.0.1.12050: Flags [.], cksum 0xfe28 (incorrect -> 0x2c04), seq 906, ack 19261, win 492, options [nop,nop,TS val 319294750 ecr 319294750], length 0
200, 38.04487586021423, 1.2378044128417969