2022-04-06 11:49:46.535945 IP (tos 0x0, ttl 64, id 26133, offset 0, flags [DF], proto TCP (6), length 60)
    127.0.0.1.34358 > 127.0.0.1.10550: Flags [S], cksum 0xfe30 (incorrect -> 0x0838), seq 1034180477, win 65495, options [mss 65495,sackOK,TS val 328069038 ecr 0,nop,wscale 7], length 0
2022-04-06 11:49:46.535957 IP (tos 0x0, ttl 64, id 0, offset 0, flags [DF], proto TCP (6), length 60)
    127.0.0.1.10550 > 127.0.0.1.34358: Flags [S.], cksum 0xfe30 (incorrect -> 0x4551), seq 4169910041, ack 1034180478, win 65483, options [mss 65495,sackOK,TS val 328069038 ecr 328069038,nop,wscale 7], length 0
2022-04-06 11:49:46.535968 IP (tos 0x0, ttl 64, id 26134, offset 0, flags [DF], proto TCP (6), length 52)
    127.0.0.1.34358 > 127.0.0.1.10550: Flags [.], cksum 0xfe28 (incorrect -> 0x6c0d), seq 1, ack 1, win 512, options [nop,nop,TS val 328069038 ecr 328069038], length 0
2022-04-06 11:49:46.536062 IP (tos 0x0, ttl 64, id 26135, offset 0, flags [DF], proto TCP (6), length 55)
    127.0.0.1.34358 > 127.0.0.1.10550: Flags [P.], cksum 0xfe2b (incorrect -> 0x6700), seq 1:4, ack 1, win 512, options [nop,nop,TS val 328069039 ecr 328069038], length 3
2022-04-06 11:49:46.536078 IP (tos 0x0, ttl 64, id 4373, offset 0, flags [DF], proto TCP (6), length 52)
    127.0.0.1.10550 > 127.0.0.1.34358: Flags [.], cksum 0xfe28 (incorrect -> 0x6c08), seq 1, ack 4, win 512, options [nop,nop,TS val 328069039 ecr 328069039], length 0
2022-04-06 11:49:46.536138 IP (tos 0x0, ttl 64, id 4374, offset 0, flags [DF], proto TCP (6), length 54)
    127.0.0.1.10550 > 127.0.0.1.34358: Flags [P.], cksum 0xfe2a (incorrect -> 0x66fe), seq 1:3, ack 4, win 512, options [nop,nop,TS val 328069039 ecr 328069039], length 2
2022-04-06 11:49:46.536156 IP (tos 0x0, ttl 64, id 26136, offset 0, flags [DF], proto TCP (6), length 52)
    127.0.0.1.34358 > 127.0.0.1.10550: Flags [.], cksum 0xfe28 (incorrect -> 0x6c06), seq 4, ack 3, win 512, options [nop,nop,TS val 328069039 ecr 328069039], length 0
2022-04-06 11:49:46.547904 IP (tos 0x0, ttl 64, id 26137, offset 0, flags [DF], proto TCP (6), length 62)
    127.0.0.1.34358 > 127.0.0.1.10550: Flags [P.], cksum 0xfe32 (incorrect -> 0x129c), seq 4:14, ack 3, win 512, options [nop,nop,TS val 328069050 ecr 328069039], length 10
2022-04-06 11:49:46.547924 IP (tos 0x0, ttl 64, id 4375, offset 0, flags [DF], proto TCP (6), length 52)
    127.0.0.1.10550 > 127.0.0.1.34358: Flags [.], cksum 0xfe28 (incorrect -> 0x6be6), seq 3, ack 14, win 512, options [nop,nop,TS val 328069050 ecr 328069050], length 0
2022-04-06 11:49:46.626106 IP (tos 0x0, ttl 64, id 4376, offset 0, flags [DF], proto TCP (6), length 62)
    127.0.0.1.10550 > 127.0.0.1.34358: Flags [P.], cksum 0xfe32 (incorrect -> 0x6684), seq 3:13, ack 14, win 512, options [nop,nop,TS val 328069129 ecr 328069050], length 10
2022-04-06 11:49:46.626117 IP (tos 0x0, ttl 64, id 26138, offset 0, flags [DF], proto TCP (6), length 52)
    127.0.0.1.34358 > 127.0.0.1.10550: Flags [.], cksum 0xfe28 (incorrect -> 0x6b3e), seq 14, ack 13, win 512, options [nop,nop,TS val 328069129 ecr 328069129], length 0
2022-04-06 11:49:46.631725 IP (tos 0x0, ttl 64, id 26139, offset 0, flags [DF], proto TCP (6), length 569)
    127.0.0.1.34358 > 127.0.0.1.10550: Flags [P.], cksum 0x002e (incorrect -> 0xd5ad), seq 14:531, ack 13, win 512, options [nop,nop,TS val 328069134 ecr 328069129], length 517
2022-04-06 11:49:46.631734 IP (tos 0x0, ttl 64, id 4377, offset 0, flags [DF], proto TCP (6), length 52)
    127.0.0.1.10550 > 127.0.0.1.34358: Flags [.], cksum 0xfe28 (incorrect -> 0x6933), seq 13, ack 531, win 508, options [nop,nop,TS val 328069134 ecr 328069134], length 0
200, 3.804395914077759, 0.44586634635925293