2022-04-06 11:11:29.974691 IP (tos 0x0, ttl 64, id 1844, offset 0, flags [DF], proto TCP (6), length 60)
    127.0.0.1.47378 > 127.0.0.1.9950: Flags [S], cksum 0xfe30 (incorrect -> 0xf2a0), seq 3467622040, win 65495, options [mss 65495,sackOK,TS val 325772477 ecr 0,nop,wscale 7], length 0
2022-04-06 11:11:29.974700 IP (tos 0x0, ttl 64, id 0, offset 0, flags [DF], proto TCP (6), length 60)
    127.0.0.1.9950 > 127.0.0.1.47378: Flags [S.], cksum 0xfe30 (incorrect -> 0x5fdd), seq 28285159, ack 3467622041, win 65483, options [mss 65495,sackOK,TS val 325772477 ecr 325772477,nop,wscale 7], length 0
2022-04-06 11:11:29.974709 IP (tos 0x0, ttl 64, id 1845, offset 0, flags [DF], proto TCP (6), length 52)
    127.0.0.1.47378 > 127.0.0.1.9950: Flags [.], cksum 0xfe28 (incorrect -> 0x8699), seq 1, ack 1, win 512, options [nop,nop,TS val 325772477 ecr 325772477], length 0
2022-04-06 11:11:29.974844 IP (tos 0x0, ttl 64, id 1846, offset 0, flags [DF], proto TCP (6), length 55)
    127.0.0.1.47378 > 127.0.0.1.9950: Flags [P.], cksum 0xfe2b (incorrect -> 0x818d), seq 1:4, ack 1, win 512, options [nop,nop,TS val 325772477 ecr 325772477], length 3
2022-04-06 11:11:29.974850 IP (tos 0x0, ttl 64, id 22349, offset 0, flags [DF], proto TCP (6), length 52)
    127.0.0.1.9950 > 127.0.0.1.47378: Flags [.], cksum 0xfe28 (incorrect -> 0x8696), seq 1, ack 4, win 512, options [nop,nop,TS val 325772477 ecr 325772477], length 0
2022-04-06 11:11:29.974872 IP (tos 0x0, ttl 64, id 22350, offset 0, flags [DF], proto TCP (6), length 54)
    127.0.0.1.9950 > 127.0.0.1.47378: Flags [P.], cksum 0xfe2a (incorrect -> 0x818c), seq 1:3, ack 4, win 512, options [nop,nop,TS val 325772477 ecr 325772477], length 2
2022-04-06 11:11:29.974879 IP (tos 0x0, ttl 64, id 1847, offset 0, flags [DF], proto TCP (6), length 52)
    127.0.0.1.47378 > 127.0.0.1.9950: Flags [.], cksum 0xfe28 (incorrect -> 0x8694), seq 4, ack 3, win 512, options [nop,nop,TS val 325772477 ecr 325772477], length 0
2022-04-06 11:11:29.976010 IP (tos 0x0, ttl 64, id 1848, offset 0, flags [DF], proto TCP (6), length 62)
    127.0.0.1.47378 > 127.0.0.1.9950: Flags [P.], cksum 0xfe32 (incorrect -> 0x38f6), seq 4:14, ack 3, win 512, options [nop,nop,TS val 325772478 ecr 325772477], length 10
2022-04-06 11:11:29.976022 IP (tos 0x0, ttl 64, id 22351, offset 0, flags [DF], proto TCP (6), length 52)
    127.0.0.1.9950 > 127.0.0.1.47378: Flags [.], cksum 0xfe28 (incorrect -> 0x8688), seq 3, ack 14, win 512, options [nop,nop,TS val 325772478 ecr 325772478], length 0
2022-04-06 11:11:30.164725 IP (tos 0x0, ttl 64, id 22352, offset 0, flags [DF], proto TCP (6), length 62)
    127.0.0.1.9950 > 127.0.0.1.47378: Flags [P.], cksum 0xfe32 (incorrect -> 0x80b8), seq 3:13, ack 14, win 512, options [nop,nop,TS val 325772667 ecr 325772478], length 10
2022-04-06 11:11:30.164735 IP (tos 0x0, ttl 64, id 1849, offset 0, flags [DF], proto TCP (6), length 52)
    127.0.0.1.47378 > 127.0.0.1.9950: Flags [.], cksum 0xfe28 (incorrect -> 0x8504), seq 14, ack 13, win 512, options [nop,nop,TS val 325772667 ecr 325772667], length 0
2022-04-06 11:11:30.170340 IP (tos 0x0, ttl 64, id 1850, offset 0, flags [DF], proto TCP (6), length 569)
    127.0.0.1.47378 > 127.0.0.1.9950: Flags [P.], cksum 0x002e (incorrect -> 0xe83a), seq 14:531, ack 13, win 512, options [nop,nop,TS val 325772673 ecr 325772667], length 517
2022-04-06 11:11:30.170349 IP (tos 0x0, ttl 64, id 22353, offset 0, flags [DF], proto TCP (6), length 52)
    127.0.0.1.9950 > 127.0.0.1.47378: Flags [.], cksum 0xfe28 (incorrect -> 0x82f7), seq 13, ack 531, win 508, options [nop,nop,TS val 325772673 ecr 325772673], length 0
2022-04-06 11:11:30.365774 IP (tos 0x0, ttl 64, id 22354, offset 0, flags [DF], proto TCP (6), length 3340)
    127.0.0.1.9950 > 127.0.0.1.47378: Flags [P.], cksum 0x0b01 (incorrect -> 0x9dce), seq 13:3301, ack 531, win 512, options [nop,nop,TS val 325772868 ecr 325772673], length 3288
2022-04-06 11:11:30.365782 IP (tos 0x0, ttl 64, id 1851, offset 0, flags [DF], proto TCP (6), length 52)
    127.0.0.1.47378 > 127.0.0.1.9950: Flags [.], cksum 0xfe28 (incorrect -> 0x74a6), seq 531, ack 3301, win 495, options [nop,nop,TS val 325772868 ecr 325772868], length 0
2022-04-06 11:11:30.366206 IP (tos 0x0, ttl 64, id 1852, offset 0, flags [DF], proto TCP (6), length 145)
    127.0.0.1.47378 > 127.0.0.1.9950: Flags [P.], cksum 0xfe85 (incorrect -> 0xc88d), seq 531:624, ack 3301, win 512, options [nop,nop,TS val 325772869 ecr 325772868], length 93
2022-04-06 11:11:30.366214 IP (tos 0x0, ttl 64, id 22355, offset 0, flags [DF], proto TCP (6), length 52)
    127.0.0.1.9950 > 127.0.0.1.47378: Flags [.], cksum 0xfe28 (incorrect -> 0x7436), seq 3301, ack 624, win 512, options [nop,nop,TS val 325772869 ecr 325772869], length 0
2022-04-06 11:11:30.554725 IP (tos 0x0, ttl 64, id 22356, offset 0, flags [DF], proto TCP (6), length 103)
    127.0.0.1.9950 > 127.0.0.1.47378: Flags [P.], cksum 0xfe5b (incorrect -> 0x65ec), seq 3301:3352, ack 624, win 512, options [nop,nop,TS val 325773057 ecr 325772869], length 51
2022-04-06 11:11:30.554733 IP (tos 0x0, ttl 64, id 1853, offset 0, flags [DF], proto TCP (6), length 52)
    127.0.0.1.47378 > 127.0.0.1.9950: Flags [.], cksum 0xfe28 (incorrect -> 0x728b), seq 624, ack 3352, win 512, options [nop,nop,TS val 325773057 ecr 325773057], length 0
2022-04-06 11:11:30.555049 IP (tos 0x0, ttl 64, id 1854, offset 0, flags [DF], proto TCP (6), length 329)
    127.0.0.1.47378 > 127.0.0.1.9950: Flags [P.], cksum 0xff3d (incorrect -> 0x0530), seq 624:901, ack 3352, win 512, options [nop,nop,TS val 325773057 ecr 325773057], length 277
2022-04-06 11:11:30.555056 IP (tos 0x0, ttl 64, id 22357, offset 0, flags [DF], proto TCP (6), length 52)
    127.0.0.1.9950 > 127.0.0.1.47378: Flags [.], cksum 0xfe28 (incorrect -> 0x7178), seq 3352, ack 901, win 510, options [nop,nop,TS val 325773057 ecr 325773057], length 0
2022-04-06 11:11:30.802704 IP (tos 0x0, ttl 64, id 22358, offset 0, flags [DF], proto TCP (6), length 3538)
    127.0.0.1.9950 > 127.0.0.1.47378: Flags [P.], cksum 0x0bc7 (incorrect -> 0xd148), seq 3352:6838, ack 901, win 512, options [nop,nop,TS val 325773305 ecr 325773057], length 3486
2022-04-06 11:11:30.846690 IP (tos 0x0, ttl 64, id 1855, offset 0, flags [DF], proto TCP (6), length 52)
    127.0.0.1.47378 > 127.0.0.1.9950: Flags [.], cksum 0xfe28 (incorrect -> 0x61bc), seq 901, ack 6838, win 512, options [nop,nop,TS val 325773349 ecr 325773305], length 0
2022-04-06 11:11:30.846702 IP (tos 0x0, ttl 64, id 22359, offset 0, flags [DF], proto TCP (6), length 10510)
    127.0.0.1.9950 > 127.0.0.1.47378: Flags [P.], cksum 0x2703 (incorrect -> 0x5768), seq 6838:17296, ack 901, win 512, options [nop,nop,TS val 325773349 ecr 325773349], length 10458
2022-04-06 11:11:30.846709 IP (tos 0x0, ttl 64, id 1856, offset 0, flags [DF], proto TCP (6), length 52)
    127.0.0.1.47378 > 127.0.0.1.9950: Flags [.], cksum 0xfe28 (incorrect -> 0x38e3), seq 901, ack 17296, win 467, options [nop,nop,TS val 325773349 ecr 325773349], length 0
2022-04-06 11:11:30.855241 IP (tos 0x0, ttl 64, id 22360, offset 0, flags [DF], proto TCP (6), length 3628)
    127.0.0.1.9950 > 127.0.0.1.47378: Flags [P.], cksum 0x0c21 (incorrect -> 0x03d6), seq 17296:20872, ack 901, win 512, options [nop,nop,TS val 325773358 ecr 325773349], length 3576
2022-04-06 11:11:30.855248 IP (tos 0x0, ttl 64, id 1857, offset 0, flags [DF], proto TCP (6), length 52)
    127.0.0.1.47378 > 127.0.0.1.9950: Flags [.], cksum 0xfe28 (incorrect -> 0x2abe), seq 901, ack 20872, win 494, options [nop,nop,TS val 325773358 ecr 325773358], length 0
2022-04-06 11:11:30.903833 IP (tos 0x0, ttl 64, id 22361, offset 0, flags [DF], proto TCP (6), length 4100)
    127.0.0.1.9950 > 127.0.0.1.47378: Flags [P.], cksum 0x0df9 (incorrect -> 0xb6ed), seq 20872:24920, ack 901, win 512, options [nop,nop,TS val 325773406 ecr 325773358], length 4048
2022-04-06 11:11:30.903841 IP (tos 0x0, ttl 64, id 1858, offset 0, flags [DF], proto TCP (6), length 52)
    127.0.0.1.47378 > 127.0.0.1.9950: Flags [.], cksum 0xfe28 (incorrect -> 0x1a90), seq 901, ack 24920, win 492, options [nop,nop,TS val 325773406 ecr 325773406], length 0
2022-04-06 11:11:30.903847 IP (tos 0x0, ttl 64, id 22362, offset 0, flags [DF], proto TCP (6), length 1482)
    127.0.0.1.9950 > 127.0.0.1.47378: Flags [P.], cksum 0x03bf (incorrect -> 0x3a04), seq 24920:26350, ack 901, win 512, options [nop,nop,TS val 325773406 ecr 325773406], length 1430
2022-04-06 11:11:30.903850 IP (tos 0x0, ttl 64, id 1859, offset 0, flags [DF], proto TCP (6), length 52)
    127.0.0.1.47378 > 127.0.0.1.9950: Flags [.], cksum 0xfe28 (incorrect -> 0x1500), seq 901, ack 26350, win 486, options [nop,nop,TS val 325773406 ecr 325773406], length 0
2022-04-06 11:11:30.906441 IP (tos 0x0, ttl 64, id 22363, offset 0, flags [DF], proto TCP (6), length 3538)
    127.0.0.1.9950 > 127.0.0.1.47378: Flags [P.], cksum 0x0bc7 (incorrect -> 0x5345), seq 26350:29836, ack 901, win 512, options [nop,nop,TS val 325773409 ecr 325773406], length 3486
2022-04-06 11:11:30.906447 IP (tos 0x0, ttl 64, id 1860, offset 0, flags [DF], proto TCP (6), length 52)
    127.0.0.1.47378 > 127.0.0.1.9950: Flags [.], cksum 0xfe28 (incorrect -> 0x0754), seq 901, ack 29836, win 494, options [nop,nop,TS val 325773409 ecr 325773409], length 0
2022-04-06 11:11:30.907740 IP (tos 0x0, ttl 64, id 22364, offset 0, flags [DF], proto TCP (6), length 4036)
    127.0.0.1.9950 > 127.0.0.1.47378: Flags [P.], cksum 0x0db9 (incorrect -> 0xba5d), seq 29836:33820, ack 901, win 512, options [nop,nop,TS val 325773410 ecr 325773409], length 3984
2022-04-06 11:11:30.907746 IP (tos 0x0, ttl 64, id 1861, offset 0, flags [DF], proto TCP (6), length 52)
    127.0.0.1.47378 > 127.0.0.1.9950: Flags [.], cksum 0xfe28 (incorrect -> 0xf7c3), seq 901, ack 33820, win 492, options [nop,nop,TS val 325773410 ecr 325773410], length 0
2022-04-06 11:11:30.909066 IP (tos 0x0, ttl 64, id 22365, offset 0, flags [DF], proto TCP (6), length 3040)
    127.0.0.1.9950 > 127.0.0.1.47378: Flags [P.], cksum 0x09d5 (incorrect -> 0xe1f4), seq 33820:36808, ack 901, win 512, options [nop,nop,TS val 325773412 ecr 325773410], length 2988
2022-04-06 11:11:30.909071 IP (tos 0x0, ttl 64, id 1862, offset 0, flags [DF], proto TCP (6), length 52)
    127.0.0.1.47378 > 127.0.0.1.9950: Flags [.], cksum 0xfe28 (incorrect -> 0xec0f), seq 901, ack 36808, win 496, options [nop,nop,TS val 325773412 ecr 325773412], length 0
2022-04-06 11:11:30.939017 IP (tos 0x0, ttl 64, id 22366, offset 0, flags [DF], proto TCP (6), length 3538)
    127.0.0.1.9950 > 127.0.0.1.47378: Flags [P.], cksum 0x0bc7 (incorrect -> 0x86fb), seq 36808:40294, ack 901, win 512, options [nop,nop,TS val 325773441 ecr 325773412], length 3486
2022-04-06 11:11:30.939024 IP (tos 0x0, ttl 64, id 1863, offset 0, flags [DF], proto TCP (6), length 52)
    127.0.0.1.47378 > 127.0.0.1.9950: Flags [.], cksum 0xfe28 (incorrect -> 0xde39), seq 901, ack 40294, win 494, options [nop,nop,TS val 325773441 ecr 325773441], length 0
2022-04-06 11:11:30.940314 IP (tos 0x0, ttl 64, id 22367, offset 0, flags [DF], proto TCP (6), length 3990)
    127.0.0.1.9950 > 127.0.0.1.47378: Flags [P.], cksum 0x0d8b (incorrect -> 0x9227), seq 40294:44232, ack 901, win 512, options [nop,nop,TS val 325773443 ecr 325773441], length 3938
2022-04-06 11:11:30.940330 IP (tos 0x0, ttl 64, id 1864, offset 0, flags [DF], proto TCP (6), length 52)
    127.0.0.1.47378 > 127.0.0.1.9950: Flags [.], cksum 0xfe28 (incorrect -> 0xcec1), seq 901, ack 44232, win 512, options [nop,nop,TS val 325773443 ecr 325773443], length 0
2022-04-06 11:11:30.942946 IP (tos 0x0, ttl 64, id 22368, offset 0, flags [DF], proto TCP (6), length 4036)
    127.0.0.1.9950 > 127.0.0.1.47378: Flags [P.], cksum 0x0db9 (incorrect -> 0x4bbf), seq 44232:48216, ack 901, win 512, options [nop,nop,TS val 325773445 ecr 325773443], length 3984
2022-04-06 11:11:30.942961 IP (tos 0x0, ttl 64, id 1865, offset 0, flags [DF], proto TCP (6), length 52)
    127.0.0.1.47378 > 127.0.0.1.9950: Flags [.], cksum 0xfe28 (incorrect -> 0xbf2d), seq 901, ack 48216, win 512, options [nop,nop,TS val 325773445 ecr 325773445], length 0
2022-04-06 11:11:30.944265 IP (tos 0x0, ttl 64, id 22369, offset 0, flags [DF], proto TCP (6), length 4100)
    127.0.0.1.9950 > 127.0.0.1.47378: Flags [P.], cksum 0x0df9 (incorrect -> 0x3a8f), seq 48216:52264, ack 901, win 512, options [nop,nop,TS val 325773447 ecr 325773445], length 4048
2022-04-06 11:11:30.944288 IP (tos 0x0, ttl 64, id 1866, offset 0, flags [DF], proto TCP (6), length 52)
    127.0.0.1.47378 > 127.0.0.1.9950: Flags [.], cksum 0xfe28 (incorrect -> 0xaf59), seq 901, ack 52264, win 512, options [nop,nop,TS val 325773447 ecr 325773447], length 0
2022-04-06 11:11:30.944292 IP (tos 0x0, ttl 64, id 22370, offset 0, flags [DF], proto TCP (6), length 984)
    127.0.0.1.9950 > 127.0.0.1.47378: Flags [P.], cksum 0x01cd (incorrect -> 0x8940), seq 52264:53196, ack 901, win 512, options [nop,nop,TS val 325773447 ecr 325773447], length 932
2022-04-06 11:11:30.944340 IP (tos 0x0, ttl 64, id 1867, offset 0, flags [DF], proto TCP (6), length 52)
    127.0.0.1.47378 > 127.0.0.1.9950: Flags [.], cksum 0xfe28 (incorrect -> 0xabb5), seq 901, ack 53196, win 512, options [nop,nop,TS val 325773447 ecr 325773447], length 0
2022-04-06 11:11:30.974283 IP (tos 0x0, ttl 64, id 22371, offset 0, flags [DF], proto TCP (6), length 2768)
    127.0.0.1.9950 > 127.0.0.1.47378: Flags [P.], cksum 0x08c5 (incorrect -> 0x32e5), seq 53196:55912, ack 901, win 512, options [nop,nop,TS val 325773477 ecr 325773447], length 2716
2022-04-06 11:11:30.974303 IP (tos 0x0, ttl 64, id 1868, offset 0, flags [DF], proto TCP (6), length 52)
    127.0.0.1.47378 > 127.0.0.1.9950: Flags [.], cksum 0xfe28 (incorrect -> 0xa0dd), seq 901, ack 55912, win 512, options [nop,nop,TS val 325773477 ecr 325773477], length 0
2022-04-06 11:11:31.008141 IP (tos 0x0, ttl 64, id 22372, offset 0, flags [DF], proto TCP (6), length 3538)
    127.0.0.1.9950 > 127.0.0.1.47378: Flags [P.], cksum 0x0bc7 (incorrect -> 0x2c21), seq 55912:59398, ack 901, win 512, options [nop,nop,TS val 325773511 ecr 325773477], length 3486
2022-04-06 11:11:31.008157 IP (tos 0x0, ttl 64, id 1869, offset 0, flags [DF], proto TCP (6), length 52)
    127.0.0.1.47378 > 127.0.0.1.9950: Flags [.], cksum 0xfe28 (incorrect -> 0x92fb), seq 901, ack 59398, win 512, options [nop,nop,TS val 325773511 ecr 325773511], length 0
2022-04-06 11:11:31.009424 IP (tos 0x0, ttl 64, id 22373, offset 0, flags [DF], proto TCP (6), length 4036)
    127.0.0.1.9950 > 127.0.0.1.47378: Flags [P.], cksum 0x0db9 (incorrect -> 0xa115), seq 59398:63382, ack 901, win 512, options [nop,nop,TS val 325773512 ecr 325773511], length 3984
2022-04-06 11:11:31.009435 IP (tos 0x0, ttl 64, id 1870, offset 0, flags [DF], proto TCP (6), length 52)
    127.0.0.1.47378 > 127.0.0.1.9950: Flags [.], cksum 0xfe28 (incorrect -> 0x8369), seq 901, ack 63382, win 512, options [nop,nop,TS val 325773512 ecr 325773512], length 0
2022-04-06 11:11:31.012040 IP (tos 0x0, ttl 64, id 22374, offset 0, flags [DF], proto TCP (6), length 4036)
    127.0.0.1.9950 > 127.0.0.1.47378: Flags [P.], cksum 0x0db9 (incorrect -> 0x6996), seq 63382:67366, ack 901, win 512, options [nop,nop,TS val 325773514 ecr 325773512], length 3984
2022-04-06 11:11:31.054667 IP (tos 0x0, ttl 64, id 1871, offset 0, flags [DF], proto TCP (6), length 52)
    127.0.0.1.47378 > 127.0.0.1.9950: Flags [.], cksum 0xfe28 (incorrect -> 0x73aa), seq 901, ack 67366, win 512, options [nop,nop,TS val 325773557 ecr 325773514], length 0
2022-04-06 11:11:31.054685 IP (tos 0x0, ttl 64, id 22375, offset 0, flags [DF], proto TCP (6), length 32410)
    127.0.0.1.9950 > 127.0.0.1.47378: Flags [P.], cksum 0x7c8f (incorrect -> 0xc259), seq 67366:99724, ack 901, win 512, options [nop,nop,TS val 325773557 ecr 325773557], length 32358
2022-04-06 11:11:31.098664 IP (tos 0x0, ttl 64, id 1872, offset 0, flags [DF], proto TCP (6), length 52)
    127.0.0.1.47378 > 127.0.0.1.9950: Flags [.], cksum 0xfe28 (incorrect -> 0xf4ec), seq 901, ack 99724, win 512, options [nop,nop,TS val 325773601 ecr 325773557], length 0
2022-04-06 11:11:31.098672 IP (tos 0x0, ttl 64, id 22376, offset 0, flags [DF], proto TCP (6), length 7340)
    127.0.0.1.9950 > 127.0.0.1.47378: Flags [P.], cksum 0x1aa1 (incorrect -> 0x3d9f), seq 99724:107012, ack 901, win 512, options [nop,nop,TS val 325773601 ecr 325773601], length 7288
2022-04-06 11:11:31.098741 IP (tos 0x0, ttl 64, id 1873, offset 0, flags [DF], proto TCP (6), length 52)
    127.0.0.1.47378 > 127.0.0.1.9950: Flags [.], cksum 0xfe28 (incorrect -> 0xd848), seq 901, ack 107012, win 512, options [nop,nop,TS val 325773601 ecr 325773601], length 0
2022-04-06 11:11:31.113342 IP (tos 0x0, ttl 64, id 22377, offset 0, flags [DF], proto TCP (6), length 3538)
    127.0.0.1.9950 > 127.0.0.1.47378: Flags [P.], cksum 0x0bc7 (incorrect -> 0xacc9), seq 107012:110498, ack 901, win 512, options [nop,nop,TS val 325773616 ecr 325773601], length 3486
2022-04-06 11:11:31.113359 IP (tos 0x0, ttl 64, id 1874, offset 0, flags [DF], proto TCP (6), length 52)
    127.0.0.1.47378 > 127.0.0.1.9950: Flags [.], cksum 0xfe28 (incorrect -> 0xca8c), seq 901, ack 110498, win 512, options [nop,nop,TS val 325773616 ecr 325773616], length 0
2022-04-06 11:11:31.114668 IP (tos 0x0, ttl 64, id 22378, offset 0, flags [DF], proto TCP (6), length 4036)
    127.0.0.1.9950 > 127.0.0.1.47378: Flags [P.], cksum 0x0db9 (incorrect -> 0x1b56), seq 110498:114482, ack 901, win 512, options [nop,nop,TS val 325773617 ecr 325773616], length 3984
2022-04-06 11:11:31.114685 IP (tos 0x0, ttl 64, id 1875, offset 0, flags [DF], proto TCP (6), length 52)
    127.0.0.1.47378 > 127.0.0.1.9950: Flags [.], cksum 0xfe28 (incorrect -> 0xbafa), seq 901, ack 114482, win 512, options [nop,nop,TS val 325773617 ecr 325773617], length 0
2022-04-06 11:11:31.117264 IP (tos 0x0, ttl 64, id 22379, offset 0, flags [DF], proto TCP (6), length 4036)
    127.0.0.1.9950 > 127.0.0.1.47378: Flags [P.], cksum 0x0db9 (incorrect -> 0x07b1), seq 114482:118466, ack 901, win 512, options [nop,nop,TS val 325773620 ecr 325773617], length 3984
2022-04-06 11:11:31.152736 IP (tos 0x0, ttl 64, id 22380, offset 0, flags [DF], proto TCP (6), length 32820)
    127.0.0.1.9950 > 127.0.0.1.47378: Flags [.], cksum 0x7e29 (incorrect -> 0x7b24), seq 118466:151234, ack 901, win 512, options [nop,nop,TS val 325773655 ecr 325773617], length 32768
2022-04-06 11:11:31.152743 IP (tos 0x0, ttl 64, id 1876, offset 0, flags [DF], proto TCP (6), length 52)
    127.0.0.1.47378 > 127.0.0.1.9950: Flags [.], cksum 0xfe28 (incorrect -> 0x2bc6), seq 901, ack 151234, win 379, options [nop,nop,TS val 325773655 ecr 325773620], length 0
2022-04-06 11:11:31.152750 IP (tos 0x0, ttl 64, id 22381, offset 0, flags [DF], proto TCP (6), length 2120)
    127.0.0.1.9950 > 127.0.0.1.47378: Flags [P.], cksum 0x063d (incorrect -> 0x8898), seq 151234:153302, ack 901, win 512, options [nop,nop,TS val 325773655 ecr 325773655], length 2068
2022-04-06 11:11:31.152854 IP (tos 0x0, ttl 64, id 1877, offset 0, flags [DF], proto TCP (6), length 52)
    127.0.0.1.47378 > 127.0.0.1.9950: Flags [.], cksum 0xfe28 (incorrect -> 0x230a), seq 901, ack 153302, win 512, options [nop,nop,TS val 325773655 ecr 325773655], length 0
2022-04-06 11:11:31.154684 IP (tos 0x0, ttl 64, id 22382, offset 0, flags [DF], proto TCP (6), length 4036)
    127.0.0.1.9950 > 127.0.0.1.47378: Flags [P.], cksum 0x0db9 (incorrect -> 0xc2c1), seq 153302:157286, ack 901, win 512, options [nop,nop,TS val 325773657 ecr 325773655], length 3984
2022-04-06 11:11:31.154700 IP (tos 0x0, ttl 64, id 1878, offset 0, flags [DF], proto TCP (6), length 52)
    127.0.0.1.47378 > 127.0.0.1.9950: Flags [.], cksum 0xfe28 (incorrect -> 0x1376), seq 901, ack 157286, win 512, options [nop,nop,TS val 325773657 ecr 325773657], length 0
2022-04-06 11:11:31.155657 IP (tos 0x0, ttl 64, id 22383, offset 0, flags [DF], proto TCP (6), length 4100)
    127.0.0.1.9950 > 127.0.0.1.47378: Flags [P.], cksum 0x0df9 (incorrect -> 0x6726), seq 157286:161334, ack 901, win 512, options [nop,nop,TS val 325773658 ecr 325773657], length 4048
2022-04-06 11:11:31.155672 IP (tos 0x0, ttl 64, id 1879, offset 0, flags [DF], proto TCP (6), length 52)
    127.0.0.1.47378 > 127.0.0.1.9950: Flags [.], cksum 0xfe28 (incorrect -> 0x03a4), seq 901, ack 161334, win 512, options [nop,nop,TS val 325773658 ecr 325773658], length 0
2022-04-06 11:11:31.155676 IP (tos 0x0, ttl 64, id 22384, offset 0, flags [DF], proto TCP (6), length 984)
    127.0.0.1.9950 > 127.0.0.1.47378: Flags [P.], cksum 0x01cd (incorrect -> 0x3544), seq 161334:162266, ack 901, win 512, options [nop,nop,TS val 325773658 ecr 325773658], length 932
2022-04-06 11:11:31.155680 IP (tos 0x0, ttl 64, id 1880, offset 0, flags [DF], proto TCP (6), length 52)
    127.0.0.1.47378 > 127.0.0.1.9950: Flags [.], cksum 0xfe28 (incorrect -> 0xffff), seq 901, ack 162266, win 512, options [nop,nop,TS val 325773658 ecr 325773658], length 0
2022-04-06 11:11:31.181936 IP (tos 0x0, ttl 64, id 22385, offset 0, flags [DF], proto TCP (6), length 3538)
    127.0.0.1.9950 > 127.0.0.1.47378: Flags [P.], cksum 0x0bc7 (incorrect -> 0x647b), seq 162266:165752, ack 901, win 512, options [nop,nop,TS val 325773684 ecr 325773658], length 3486
2022-04-06 11:11:31.181951 IP (tos 0x0, ttl 64, id 1881, offset 0, flags [DF], proto TCP (6), length 52)
    127.0.0.1.47378 > 127.0.0.1.9950: Flags [.], cksum 0xfe28 (incorrect -> 0xf22d), seq 901, ack 165752, win 512, options [nop,nop,TS val 325773684 ecr 325773684], length 0
2022-04-06 11:11:31.183325 IP (tos 0x0, ttl 64, id 22386, offset 0, flags [DF], proto TCP (6), length 3538)
    127.0.0.1.9950 > 127.0.0.1.47378: Flags [P.], cksum 0x0bc7 (incorrect -> 0x2c9e), seq 165752:169238, ack 901, win 512, options [nop,nop,TS val 325773686 ecr 325773684], length 3486
2022-04-06 11:11:31.220243 IP (tos 0x0, ttl 64, id 22387, offset 0, flags [DF], proto TCP (6), length 32820)
    127.0.0.1.9950 > 127.0.0.1.47378: Flags [.], cksum 0x7e29 (incorrect -> 0x79ab), seq 169238:202006, ack 901, win 512, options [nop,nop,TS val 325773723 ecr 325773684], length 32768
2022-04-06 11:11:31.220250 IP (tos 0x0, ttl 64, id 1882, offset 0, flags [DF], proto TCP (6), length 52)
    127.0.0.1.47378 > 127.0.0.1.9950: Flags [.], cksum 0xfe28 (incorrect -> 0x64eb), seq 901, ack 202006, win 379, options [nop,nop,TS val 325773723 ecr 325773686], length 0
2022-04-06 11:11:31.220257 IP (tos 0x0, ttl 64, id 22388, offset 0, flags [DF], proto TCP (6), length 3638)
    127.0.0.1.9950 > 127.0.0.1.47378: Flags [P.], cksum 0x0c2b (incorrect -> 0xcf44), seq 202006:205592, ack 901, win 512, options [nop,nop,TS val 325773723 ecr 325773723], length 3586
2022-04-06 11:11:31.220362 IP (tos 0x0, ttl 64, id 1883, offset 0, flags [DF], proto TCP (6), length 52)
    127.0.0.1.47378 > 127.0.0.1.9950: Flags [.], cksum 0xfe28 (incorrect -> 0x563f), seq 901, ack 205592, win 512, options [nop,nop,TS val 325773723 ecr 325773723], length 0
2022-04-06 11:11:31.221647 IP (tos 0x0, ttl 64, id 22389, offset 0, flags [DF], proto TCP (6), length 3672)
    127.0.0.1.9950 > 127.0.0.1.47378: Flags [P.], cksum 0x0c4d (incorrect -> 0x7e02), seq 205592:209212, ack 901, win 512, options [nop,nop,TS val 325773724 ecr 325773723], length 3620
2022-04-06 11:11:31.221662 IP (tos 0x0, ttl 64, id 1884, offset 0, flags [DF], proto TCP (6), length 52)
    127.0.0.1.47378 > 127.0.0.1.9950: Flags [.], cksum 0xfe28 (incorrect -> 0x4819), seq 901, ack 209212, win 512, options [nop,nop,TS val 325773724 ecr 325773724], length 0
2022-04-06 11:11:31.225653 IP (tos 0x0, ttl 64, id 22390, offset 0, flags [DF], proto TCP (6), length 3538)
    127.0.0.1.9950 > 127.0.0.1.47378: Flags [P.], cksum 0x0bc7 (incorrect -> 0x6f61), seq 209212:212698, ack 901, win 512, options [nop,nop,TS val 325773728 ecr 325773724], length 3486
2022-04-06 11:11:31.225671 IP (tos 0x0, ttl 64, id 1885, offset 0, flags [DF], proto TCP (6), length 52)
    127.0.0.1.47378 > 127.0.0.1.9950: Flags [.], cksum 0xfe28 (incorrect -> 0x3a73), seq 901, ack 212698, win 512, options [nop,nop,TS val 325773728 ecr 325773728], length 0
2022-04-06 11:11:31.226358 IP (tos 0x0, ttl 64, id 22391, offset 0, flags [DF], proto TCP (6), length 4036)
    127.0.0.1.9950 > 127.0.0.1.47378: Flags [P.], cksum 0x0db9 (incorrect -> 0x70f0), seq 212698:216682, ack 901, win 512, options [nop,nop,TS val 325773729 ecr 325773728], length 3984
2022-04-06 11:11:31.226369 IP (tos 0x0, ttl 64, id 1886, offset 0, flags [DF], proto TCP (6), length 52)
    127.0.0.1.47378 > 127.0.0.1.9950: Flags [.], cksum 0xfe28 (incorrect -> 0x2ae1), seq 901, ack 216682, win 512, options [nop,nop,TS val 325773729 ecr 325773729], length 0
2022-04-06 11:11:31.243982 IP (tos 0x0, ttl 64, id 22392, offset 0, flags [DF], proto TCP (6), length 4036)
    127.0.0.1.9950 > 127.0.0.1.47378: Flags [P.], cksum 0x0db9 (incorrect -> 0xd221), seq 216682:220666, ack 901, win 512, options [nop,nop,TS val 325773746 ecr 325773729], length 3984
2022-04-06 11:11:31.286657 IP (tos 0x0, ttl 64, id 1887, offset 0, flags [DF], proto TCP (6), length 52)
    127.0.0.1.47378 > 127.0.0.1.9950: Flags [.], cksum 0xfe28 (incorrect -> 0x1b04), seq 901, ack 220666, win 512, options [nop,nop,TS val 325773789 ecr 325773746], length 0
200, 6.760498285293579, 1.3610401153564453