2022-04-06 05:17:32.142176 IP (tos 0x0, ttl 64, id 33205, offset 0, flags [DF], proto TCP (6), length 60)
    127.0.0.1.36452 > 127.0.0.1.11850: Flags [S], cksum 0xfe30 (incorrect -> 0x9f43), seq 967300044, win 65495, options [mss 65495,sackOK,TS val 304534645 ecr 0,nop,wscale 7], length 0
2022-04-06 05:17:32.142191 IP (tos 0x0, ttl 64, id 0, offset 0, flags [DF], proto TCP (6), length 60)
    127.0.0.1.11850 > 127.0.0.1.36452: Flags [S.], cksum 0xfe30 (incorrect -> 0xdd30), seq 3681943547, ack 967300045, win 65483, options [mss 65495,sackOK,TS val 304534645 ecr 304534645,nop,wscale 7], length 0
2022-04-06 05:17:32.142201 IP (tos 0x0, ttl 64, id 33206, offset 0, flags [DF], proto TCP (6), length 52)
    127.0.0.1.36452 > 127.0.0.1.11850: Flags [.], cksum 0xfe28 (incorrect -> 0x03ed), seq 1, ack 1, win 512, options [nop,nop,TS val 304534645 ecr 304534645], length 0
2022-04-06 05:17:32.142293 IP (tos 0x0, ttl 64, id 33207, offset 0, flags [DF], proto TCP (6), length 55)
    127.0.0.1.36452 > 127.0.0.1.11850: Flags [P.], cksum 0xfe2b (incorrect -> 0xfee0), seq 1:4, ack 1, win 512, options [nop,nop,TS val 304534645 ecr 304534645], length 3
2022-04-06 05:17:32.142303 IP (tos 0x0, ttl 64, id 63220, offset 0, flags [DF], proto TCP (6), length 52)
    127.0.0.1.11850 > 127.0.0.1.36452: Flags [.], cksum 0xfe28 (incorrect -> 0x03ea), seq 1, ack 4, win 512, options [nop,nop,TS val 304534645 ecr 304534645], length 0
2022-04-06 05:17:32.142342 IP (tos 0x0, ttl 64, id 63221, offset 0, flags [DF], proto TCP (6), length 54)
    127.0.0.1.11850 > 127.0.0.1.36452: Flags [P.], cksum 0xfe2a (incorrect -> 0xfedf), seq 1:3, ack 4, win 512, options [nop,nop,TS val 304534645 ecr 304534645], length 2
2022-04-06 05:17:32.142353 IP (tos 0x0, ttl 64, id 33208, offset 0, flags [DF], proto TCP (6), length 52)
    127.0.0.1.36452 > 127.0.0.1.11850: Flags [.], cksum 0xfe28 (incorrect -> 0x03e8), seq 4, ack 3, win 512, options [nop,nop,TS val 304534645 ecr 304534645], length 0
2022-04-06 05:17:32.166871 IP (tos 0x0, ttl 64, id 33209, offset 0, flags [DF], proto TCP (6), length 62)
    127.0.0.1.36452 > 127.0.0.1.11850: Flags [P.], cksum 0xfe32 (incorrect -> 0xc4d0), seq 4:14, ack 3, win 512, options [nop,nop,TS val 304534669 ecr 304534645], length 10
2022-04-06 05:17:32.166884 IP (tos 0x0, ttl 64, id 63222, offset 0, flags [DF], proto TCP (6), length 52)
    127.0.0.1.11850 > 127.0.0.1.36452: Flags [.], cksum 0xfe28 (incorrect -> 0x03ae), seq 3, ack 14, win 512, options [nop,nop,TS val 304534669 ecr 304534669], length 0
2022-04-06 05:17:32.314230 IP (tos 0x0, ttl 64, id 63223, offset 0, flags [DF], proto TCP (6), length 62)
    127.0.0.1.11850 > 127.0.0.1.36452: Flags [P.], cksum 0xfe32 (incorrect -> 0xfe06), seq 3:13, ack 14, win 512, options [nop,nop,TS val 304534817 ecr 304534669], length 10
2022-04-06 05:17:32.314239 IP (tos 0x0, ttl 64, id 33210, offset 0, flags [DF], proto TCP (6), length 52)
    127.0.0.1.36452 > 127.0.0.1.11850: Flags [.], cksum 0xfe28 (incorrect -> 0x027c), seq 14, ack 13, win 512, options [nop,nop,TS val 304534817 ecr 304534817], length 0
2022-04-06 05:17:32.319863 IP (tos 0x0, ttl 64, id 33211, offset 0, flags [DF], proto TCP (6), length 569)
    127.0.0.1.36452 > 127.0.0.1.11850: Flags [P.], cksum 0x002e (incorrect -> 0xeb49), seq 14:531, ack 13, win 512, options [nop,nop,TS val 304534822 ecr 304534817], length 517
2022-04-06 05:17:32.319870 IP (tos 0x0, ttl 64, id 63224, offset 0, flags [DF], proto TCP (6), length 52)
    127.0.0.1.11850 > 127.0.0.1.36452: Flags [.], cksum 0xfe28 (incorrect -> 0x0071), seq 13, ack 531, win 508, options [nop,nop,TS val 304534822 ecr 304534822], length 0
2022-04-06 05:17:32.466031 IP (tos 0x0, ttl 64, id 63225, offset 0, flags [DF], proto TCP (6), length 3538)
    127.0.0.1.11850 > 127.0.0.1.36452: Flags [P.], cksum 0x0bc7 (incorrect -> 0xb962), seq 13:3499, ack 531, win 512, options [nop,nop,TS val 304534968 ecr 304534822], length 3486
2022-04-06 05:17:32.466038 IP (tos 0x0, ttl 64, id 33212, offset 0, flags [DF], proto TCP (6), length 52)
    127.0.0.1.36452 > 127.0.0.1.11850: Flags [.], cksum 0xfe28 (incorrect -> 0xf1bc), seq 531, ack 3499, win 494, options [nop,nop,TS val 304534968 ecr 304534968], length 0
2022-04-06 05:17:32.480107 IP (tos 0x0, ttl 64, id 63226, offset 0, flags [DF], proto TCP (6), length 807)
    127.0.0.1.11850 > 127.0.0.1.36452: Flags [P.], cksum 0x011c (incorrect -> 0x745f), seq 3499:4254, ack 531, win 512, options [nop,nop,TS val 304534983 ecr 304534968], length 755
2022-04-06 05:17:32.480113 IP (tos 0x0, ttl 64, id 33213, offset 0, flags [DF], proto TCP (6), length 52)
    127.0.0.1.36452 > 127.0.0.1.11850: Flags [.], cksum 0xfe28 (incorrect -> 0xeea0), seq 531, ack 4254, win 505, options [nop,nop,TS val 304534983 ecr 304534983], length 0
2022-04-06 05:17:32.480440 IP (tos 0x0, ttl 64, id 33214, offset 0, flags [DF], proto TCP (6), length 116)
    127.0.0.1.36452 > 127.0.0.1.11850: Flags [P.], cksum 0xfe68 (incorrect -> 0x9a33), seq 531:595, ack 4254, win 512, options [nop,nop,TS val 304534983 ecr 304534983], length 64
2022-04-06 05:17:32.480446 IP (tos 0x0, ttl 64, id 63227, offset 0, flags [DF], proto TCP (6), length 52)
    127.0.0.1.11850 > 127.0.0.1.36452: Flags [.], cksum 0xfe28 (incorrect -> 0xee59), seq 4254, ack 595, win 512, options [nop,nop,TS val 304534983 ecr 304534983], length 0
2022-04-06 05:17:32.480779 IP (tos 0x0, ttl 64, id 33215, offset 0, flags [DF], proto TCP (6), length 393)
    127.0.0.1.36452 > 127.0.0.1.11850: Flags [P.], cksum 0xff7d (incorrect -> 0x7171), seq 595:936, ack 4254, win 512, options [nop,nop,TS val 304534983 ecr 304534983], length 341
2022-04-06 05:17:32.480785 IP (tos 0x0, ttl 64, id 63228, offset 0, flags [DF], proto TCP (6), length 52)
    127.0.0.1.11850 > 127.0.0.1.36452: Flags [.], cksum 0xfe28 (incorrect -> 0xed06), seq 4254, ack 936, win 510, options [nop,nop,TS val 304534983 ecr 304534983], length 0
2022-04-06 05:17:32.686046 IP (tos 0x0, ttl 64, id 63229, offset 0, flags [DF], proto TCP (6), length 607)
    127.0.0.1.11850 > 127.0.0.1.36452: Flags [P.], cksum 0x0054 (incorrect -> 0xdf40), seq 4254:4809, ack 936, win 512, options [nop,nop,TS val 304535188 ecr 304534983], length 555
2022-04-06 05:17:32.686058 IP (tos 0x0, ttl 64, id 33216, offset 0, flags [DF], proto TCP (6), length 52)
    127.0.0.1.36452 > 127.0.0.1.11850: Flags [.], cksum 0xfe28 (incorrect -> 0xe943), seq 936, ack 4809, win 508, options [nop,nop,TS val 304535188 ecr 304535188], length 0
2022-04-06 05:17:32.688067 IP (tos 0x0, ttl 64, id 45855, offset 0, flags [DF], proto TCP (6), length 60)
    127.0.0.1.36454 > 127.0.0.1.11850: Flags [S], cksum 0xfe30 (incorrect -> 0x0742), seq 2571045394, win 65495, options [mss 65495,sackOK,TS val 304535191 ecr 0,nop,wscale 7], length 0
2022-04-06 05:17:32.688075 IP (tos 0x0, ttl 64, id 0, offset 0, flags [DF], proto TCP (6), length 60)
    127.0.0.1.11850 > 127.0.0.1.36454: Flags [S.], cksum 0xfe30 (incorrect -> 0xbb5f), seq 2458177690, ack 2571045395, win 65483, options [mss 65495,sackOK,TS val 304535191 ecr 304535191,nop,wscale 7], length 0
2022-04-06 05:17:32.688082 IP (tos 0x0, ttl 64, id 45856, offset 0, flags [DF], proto TCP (6), length 52)
    127.0.0.1.36454 > 127.0.0.1.11850: Flags [.], cksum 0xfe28 (incorrect -> 0xe21b), seq 1, ack 1, win 512, options [nop,nop,TS val 304535191 ecr 304535191], length 0
2022-04-06 05:17:32.688167 IP (tos 0x0, ttl 64, id 45857, offset 0, flags [DF], proto TCP (6), length 55)
    127.0.0.1.36454 > 127.0.0.1.11850: Flags [P.], cksum 0xfe2b (incorrect -> 0xdd0f), seq 1:4, ack 1, win 512, options [nop,nop,TS val 304535191 ecr 304535191], length 3
2022-04-06 05:17:32.688172 IP (tos 0x0, ttl 64, id 745, offset 0, flags [DF], proto TCP (6), length 52)
    127.0.0.1.11850 > 127.0.0.1.36454: Flags [.], cksum 0xfe28 (incorrect -> 0xe218), seq 1, ack 4, win 512, options [nop,nop,TS val 304535191 ecr 304535191], length 0
2022-04-06 05:17:32.688187 IP (tos 0x0, ttl 64, id 746, offset 0, flags [DF], proto TCP (6), length 54)
    127.0.0.1.11850 > 127.0.0.1.36454: Flags [P.], cksum 0xfe2a (incorrect -> 0xdd0e), seq 1:3, ack 4, win 512, options [nop,nop,TS val 304535191 ecr 304535191], length 2
2022-04-06 05:17:32.688193 IP (tos 0x0, ttl 64, id 45858, offset 0, flags [DF], proto TCP (6), length 52)
    127.0.0.1.36454 > 127.0.0.1.11850: Flags [.], cksum 0xfe28 (incorrect -> 0xe216), seq 4, ack 3, win 512, options [nop,nop,TS val 304535191 ecr 304535191], length 0
2022-04-06 05:17:32.700074 IP (tos 0x0, ttl 64, id 45859, offset 0, flags [DF], proto TCP (6), length 62)
    127.0.0.1.36454 > 127.0.0.1.11850: Flags [P.], cksum 0xfe32 (incorrect -> 0xa30b), seq 4:14, ack 3, win 512, options [nop,nop,TS val 304535203 ecr 304535191], length 10
2022-04-06 05:17:32.700080 IP (tos 0x0, ttl 64, id 747, offset 0, flags [DF], proto TCP (6), length 52)
    127.0.0.1.11850 > 127.0.0.1.36454: Flags [.], cksum 0xfe28 (incorrect -> 0xe1f4), seq 3, ack 14, win 512, options [nop,nop,TS val 304535203 ecr 304535203], length 0
2022-04-06 05:17:32.858852 IP (tos 0x0, ttl 64, id 748, offset 0, flags [DF], proto TCP (6), length 62)
    127.0.0.1.11850 > 127.0.0.1.36454: Flags [P.], cksum 0xfe32 (incorrect -> 0xdc43), seq 3:13, ack 14, win 512, options [nop,nop,TS val 304535361 ecr 304535203], length 10
2022-04-06 05:17:32.858859 IP (tos 0x0, ttl 64, id 45860, offset 0, flags [DF], proto TCP (6), length 52)
    127.0.0.1.36454 > 127.0.0.1.11850: Flags [.], cksum 0xfe28 (incorrect -> 0xe0ae), seq 14, ack 13, win 512, options [nop,nop,TS val 304535361 ecr 304535361], length 0
2022-04-06 05:17:32.863954 IP (tos 0x0, ttl 64, id 45861, offset 0, flags [DF], proto TCP (6), length 569)
    127.0.0.1.36454 > 127.0.0.1.11850: Flags [P.], cksum 0x002e (incorrect -> 0x80ba), seq 14:531, ack 13, win 512, options [nop,nop,TS val 304535366 ecr 304535361], length 517
2022-04-06 05:17:32.863961 IP (tos 0x0, ttl 64, id 749, offset 0, flags [DF], proto TCP (6), length 52)
    127.0.0.1.11850 > 127.0.0.1.36454: Flags [.], cksum 0xfe28 (incorrect -> 0xdea3), seq 13, ack 531, win 508, options [nop,nop,TS val 304535366 ecr 304535366], length 0
2022-04-06 05:17:32.985299 IP (tos 0x0, ttl 64, id 750, offset 0, flags [DF], proto TCP (6), length 3538)
    127.0.0.1.11850 > 127.0.0.1.36454: Flags [P.], cksum 0x0bc7 (incorrect -> 0xb872), seq 13:3499, ack 531, win 512, options [nop,nop,TS val 304535488 ecr 304535366], length 3486
2022-04-06 05:17:32.985310 IP (tos 0x0, ttl 64, id 45862, offset 0, flags [DF], proto TCP (6), length 52)
    127.0.0.1.36454 > 127.0.0.1.11850: Flags [.], cksum 0xfe28 (incorrect -> 0xd01f), seq 531, ack 3499, win 494, options [nop,nop,TS val 304535488 ecr 304535488], length 0
2022-04-06 05:17:33.041021 IP (tos 0x0, ttl 64, id 751, offset 0, flags [DF], proto TCP (6), length 807)
    127.0.0.1.11850 > 127.0.0.1.36454: Flags [P.], cksum 0x011c (incorrect -> 0x7370), seq 3499:4254, ack 531, win 512, options [nop,nop,TS val 304535543 ecr 304535488], length 755
2022-04-06 05:17:33.041028 IP (tos 0x0, ttl 64, id 45863, offset 0, flags [DF], proto TCP (6), length 52)
    127.0.0.1.36454 > 127.0.0.1.11850: Flags [.], cksum 0xfe28 (incorrect -> 0xccb3), seq 531, ack 4254, win 505, options [nop,nop,TS val 304535543 ecr 304535543], length 0
2022-04-06 05:17:33.041404 IP (tos 0x0, ttl 64, id 45864, offset 0, flags [DF], proto TCP (6), length 116)
    127.0.0.1.36454 > 127.0.0.1.11850: Flags [P.], cksum 0xfe68 (incorrect -> 0x7ed2), seq 531:595, ack 4254, win 512, options [nop,nop,TS val 304535544 ecr 304535543], length 64
2022-04-06 05:17:33.041411 IP (tos 0x0, ttl 64, id 752, offset 0, flags [DF], proto TCP (6), length 52)
    127.0.0.1.11850 > 127.0.0.1.36454: Flags [.], cksum 0xfe28 (incorrect -> 0xcc6a), seq 4254, ack 595, win 512, options [nop,nop,TS val 304535544 ecr 304535544], length 0
2022-04-06 05:17:33.041749 IP (tos 0x0, ttl 64, id 45865, offset 0, flags [DF], proto TCP (6), length 389)
    127.0.0.1.36454 > 127.0.0.1.11850: Flags [P.], cksum 0xff79 (incorrect -> 0xa0da), seq 595:932, ack 4254, win 512, options [nop,nop,TS val 304535544 ecr 304535544], length 337
2022-04-06 05:17:33.041755 IP (tos 0x0, ttl 64, id 753, offset 0, flags [DF], proto TCP (6), length 52)
    127.0.0.1.11850 > 127.0.0.1.36454: Flags [.], cksum 0xfe28 (incorrect -> 0xcb1b), seq 4254, ack 932, win 510, options [nop,nop,TS val 304535544 ecr 304535544], length 0
200, 9.891905307769775, 1.3225390911102295