2022-04-06 02:34:50.039141 IP (tos 0x0, ttl 64, id 52231, offset 0, flags [DF], proto TCP (6), length 60)
    127.0.0.1.58306 > 127.0.0.1.10750: Flags [S], cksum 0xfe30 (incorrect -> 0x0666), seq 3447881096, win 65495, options [mss 65495,sackOK,TS val 294772542 ecr 0,nop,wscale 7], length 0
2022-04-06 02:34:50.039153 IP (tos 0x0, ttl 64, id 0, offset 0, flags [DF], proto TCP (6), length 60)
    127.0.0.1.10750 > 127.0.0.1.58306: Flags [S.], cksum 0xfe30 (incorrect -> 0x75ea), seq 965240350, ack 3447881097, win 65483, options [mss 65495,sackOK,TS val 294772542 ecr 294772542,nop,wscale 7], length 0
2022-04-06 02:34:50.039163 IP (tos 0x0, ttl 64, id 52232, offset 0, flags [DF], proto TCP (6), length 52)
    127.0.0.1.58306 > 127.0.0.1.10750: Flags [.], cksum 0xfe28 (incorrect -> 0x9ca6), seq 1, ack 1, win 512, options [nop,nop,TS val 294772542 ecr 294772542], length 0
2022-04-06 02:34:50.039240 IP (tos 0x0, ttl 64, id 52233, offset 0, flags [DF], proto TCP (6), length 55)
    127.0.0.1.58306 > 127.0.0.1.10750: Flags [P.], cksum 0xfe2b (incorrect -> 0x979a), seq 1:4, ack 1, win 512, options [nop,nop,TS val 294772542 ecr 294772542], length 3
2022-04-06 02:34:50.039242 IP (tos 0x0, ttl 64, id 26893, offset 0, flags [DF], proto TCP (6), length 52)
    127.0.0.1.10750 > 127.0.0.1.58306: Flags [.], cksum 0xfe28 (incorrect -> 0x9ca3), seq 1, ack 4, win 512, options [nop,nop,TS val 294772542 ecr 294772542], length 0
2022-04-06 02:34:50.039321 IP (tos 0x0, ttl 64, id 26894, offset 0, flags [DF], proto TCP (6), length 54)
    127.0.0.1.10750 > 127.0.0.1.58306: Flags [P.], cksum 0xfe2a (incorrect -> 0x9799), seq 1:3, ack 4, win 512, options [nop,nop,TS val 294772542 ecr 294772542], length 2
2022-04-06 02:34:50.039325 IP (tos 0x0, ttl 64, id 52234, offset 0, flags [DF], proto TCP (6), length 52)
    127.0.0.1.58306 > 127.0.0.1.10750: Flags [.], cksum 0xfe28 (incorrect -> 0x9ca1), seq 4, ack 3, win 512, options [nop,nop,TS val 294772542 ecr 294772542], length 0
200, 126.57116842269897, 0.9470081329345703