2022-04-06 15:06:04.423465 IP (tos 0x0, ttl 64, id 12859, offset 0, flags [DF], proto TCP (6), length 60)
    127.0.0.1.57262 > 127.0.0.1.11450: Flags [S], cksum 0xfe30 (incorrect -> 0x1521), seq 2943665075, win 65495, options [mss 65495,sackOK,TS val 339846926 ecr 0,nop,wscale 7], length 0
2022-04-06 15:06:04.423473 IP (tos 0x0, ttl 64, id 0, offset 0, flags [DF], proto TCP (6), length 60)
    127.0.0.1.11450 > 127.0.0.1.57262: Flags [S.], cksum 0xfe30 (incorrect -> 0xb100), seq 2936011211, ack 2943665076, win 65483, options [mss 65495,sackOK,TS val 339846926 ecr 339846926,nop,wscale 7], length 0
2022-04-06 15:06:04.423480 IP (tos 0x0, ttl 64, id 12860, offset 0, flags [DF], proto TCP (6), length 52)
    127.0.0.1.57262 > 127.0.0.1.11450: Flags [.], cksum 0xfe28 (incorrect -> 0xd7bc), seq 1, ack 1, win 512, options [nop,nop,TS val 339846926 ecr 339846926], length 0
2022-04-06 15:06:04.423620 IP (tos 0x0, ttl 64, id 12861, offset 0, flags [DF], proto TCP (6), length 55)
    127.0.0.1.57262 > 127.0.0.1.11450: Flags [P.], cksum 0xfe2b (incorrect -> 0xd2b0), seq 1:4, ack 1, win 512, options [nop,nop,TS val 339846926 ecr 339846926], length 3
2022-04-06 15:06:04.423624 IP (tos 0x0, ttl 64, id 9969, offset 0, flags [DF], proto TCP (6), length 52)
    127.0.0.1.11450 > 127.0.0.1.57262: Flags [.], cksum 0xfe28 (incorrect -> 0xd7b9), seq 1, ack 4, win 512, options [nop,nop,TS val 339846926 ecr 339846926], length 0
2022-04-06 15:06:04.423695 IP (tos 0x0, ttl 64, id 9970, offset 0, flags [DF], proto TCP (6), length 54)
    127.0.0.1.11450 > 127.0.0.1.57262: Flags [P.], cksum 0xfe2a (incorrect -> 0xd2af), seq 1:3, ack 4, win 512, options [nop,nop,TS val 339846926 ecr 339846926], length 2
2022-04-06 15:06:04.423700 IP (tos 0x0, ttl 64, id 12862, offset 0, flags [DF], proto TCP (6), length 52)
    127.0.0.1.57262 > 127.0.0.1.11450: Flags [.], cksum 0xfe28 (incorrect -> 0xd7b7), seq 4, ack 3, win 512, options [nop,nop,TS val 339846926 ecr 339846926], length 0
2022-04-06 15:06:04.425193 IP (tos 0x0, ttl 64, id 12863, offset 0, flags [DF], proto TCP (6), length 62)
    127.0.0.1.57262 > 127.0.0.1.11450: Flags [P.], cksum 0xfe32 (incorrect -> 0x3e1f), seq 4:14, ack 3, win 512, options [nop,nop,TS val 339846928 ecr 339846926], length 10
2022-04-06 15:06:04.425207 IP (tos 0x0, ttl 64, id 9971, offset 0, flags [DF], proto TCP (6), length 52)
    127.0.0.1.11450 > 127.0.0.1.57262: Flags [.], cksum 0xfe28 (incorrect -> 0xd7a9), seq 3, ack 14, win 512, options [nop,nop,TS val 339846928 ecr 339846928], length 0
2022-04-06 15:06:04.573164 IP (tos 0x0, ttl 64, id 9972, offset 0, flags [DF], proto TCP (6), length 62)
    127.0.0.1.11450 > 127.0.0.1.57262: Flags [P.], cksum 0xfe32 (incorrect -> 0xd202), seq 3:13, ack 14, win 512, options [nop,nop,TS val 339847076 ecr 339846928], length 10
2022-04-06 15:06:04.573174 IP (tos 0x0, ttl 64, id 12864, offset 0, flags [DF], proto TCP (6), length 52)
    127.0.0.1.57262 > 127.0.0.1.11450: Flags [.], cksum 0xfe28 (incorrect -> 0xd677), seq 14, ack 13, win 512, options [nop,nop,TS val 339847076 ecr 339847076], length 0
2022-04-06 15:06:04.579117 IP (tos 0x0, ttl 64, id 12865, offset 0, flags [DF], proto TCP (6), length 569)
    127.0.0.1.57262 > 127.0.0.1.11450: Flags [P.], cksum 0x002e (incorrect -> 0xcabb), seq 14:531, ack 13, win 512, options [nop,nop,TS val 339847082 ecr 339847076], length 517
2022-04-06 15:06:04.579126 IP (tos 0x0, ttl 64, id 9973, offset 0, flags [DF], proto TCP (6), length 52)
    127.0.0.1.11450 > 127.0.0.1.57262: Flags [.], cksum 0xfe28 (incorrect -> 0xd46a), seq 13, ack 531, win 508, options [nop,nop,TS val 339847082 ecr 339847082], length 0
2022-04-06 15:06:04.754096 IP (tos 0x0, ttl 64, id 9974, offset 0, flags [DF], proto TCP (6), length 3538)
    127.0.0.1.11450 > 127.0.0.1.57262: Flags [P.], cksum 0x0bc7 (incorrect -> 0x5919), seq 13:3499, ack 531, win 512, options [nop,nop,TS val 339847257 ecr 339847082], length 3486
2022-04-06 15:06:04.754108 IP (tos 0x0, ttl 64, id 12866, offset 0, flags [DF], proto TCP (6), length 52)
    127.0.0.1.57262 > 127.0.0.1.11450: Flags [.], cksum 0xfe28 (incorrect -> 0xc57c), seq 531, ack 3499, win 494, options [nop,nop,TS val 339847257 ecr 339847257], length 0
2022-04-06 15:06:04.798578 IP (tos 0x0, ttl 64, id 9975, offset 0, flags [DF], proto TCP (6), length 1993)
    127.0.0.1.11450 > 127.0.0.1.57262: Flags [P.], cksum 0x05be (incorrect -> 0x3e26), seq 3499:5440, ack 531, win 512, options [nop,nop,TS val 339847301 ecr 339847257], length 1941
2022-04-06 15:06:04.798589 IP (tos 0x0, ttl 64, id 12867, offset 0, flags [DF], proto TCP (6), length 52)
    127.0.0.1.57262 > 127.0.0.1.11450: Flags [.], cksum 0xfe28 (incorrect -> 0xbd89), seq 531, ack 5440, win 500, options [nop,nop,TS val 339847301 ecr 339847301], length 0
2022-04-06 15:06:04.799249 IP (tos 0x0, ttl 64, id 12868, offset 0, flags [DF], proto TCP (6), length 132)
    127.0.0.1.57262 > 127.0.0.1.11450: Flags [P.], cksum 0xfe78 (incorrect -> 0x1b9b), seq 531:611, ack 5440, win 512, options [nop,nop,TS val 339847302 ecr 339847301], length 80
2022-04-06 15:06:04.799258 IP (tos 0x0, ttl 64, id 9976, offset 0, flags [DF], proto TCP (6), length 52)
    127.0.0.1.11450 > 127.0.0.1.57262: Flags [.], cksum 0xfe28 (incorrect -> 0xbd2b), seq 5440, ack 611, win 512, options [nop,nop,TS val 339847302 ecr 339847302], length 0
2022-04-06 15:06:04.799765 IP (tos 0x0, ttl 64, id 12869, offset 0, flags [DF], proto TCP (6), length 310)
    127.0.0.1.57262 > 127.0.0.1.11450: Flags [P.], cksum 0xff2a (incorrect -> 0x0e51), seq 611:869, ack 5440, win 512, options [nop,nop,TS val 339847302 ecr 339847302], length 258
2022-04-06 15:06:04.799770 IP (tos 0x0, ttl 64, id 9977, offset 0, flags [DF], proto TCP (6), length 52)
    127.0.0.1.11450 > 127.0.0.1.57262: Flags [.], cksum 0xfe28 (incorrect -> 0xbc2b), seq 5440, ack 869, win 510, options [nop,nop,TS val 339847302 ecr 339847302], length 0
2022-04-06 15:06:04.957965 IP (tos 0x0, ttl 64, id 9978, offset 0, flags [DF], proto TCP (6), length 903)
    127.0.0.1.11450 > 127.0.0.1.57262: Flags [P.], cksum 0x017c (incorrect -> 0x3ae1), seq 5440:6291, ack 869, win 512, options [nop,nop,TS val 339847460 ecr 339847302], length 851
2022-04-06 15:06:04.957980 IP (tos 0x0, ttl 64, id 12870, offset 0, flags [DF], proto TCP (6), length 52)
    127.0.0.1.57262 > 127.0.0.1.11450: Flags [.], cksum 0xfe28 (incorrect -> 0xb7a0), seq 869, ack 6291, win 506, options [nop,nop,TS val 339847460 ecr 339847460], length 0
2022-04-06 15:06:04.960855 IP (tos 0x0, ttl 64, id 12871, offset 0, flags [DF], proto TCP (6), length 409)
    127.0.0.1.57262 > 127.0.0.1.11450: Flags [P.], cksum 0xff8d (incorrect -> 0xf53e), seq 869:1226, ack 6291, win 512, options [nop,nop,TS val 339847463 ecr 339847460], length 357
2022-04-06 15:06:04.960864 IP (tos 0x0, ttl 64, id 9979, offset 0, flags [DF], proto TCP (6), length 52)
    127.0.0.1.11450 > 127.0.0.1.57262: Flags [.], cksum 0xfe28 (incorrect -> 0xb631), seq 6291, ack 1226, win 510, options [nop,nop,TS val 339847463 ecr 339847463], length 0
2022-04-06 15:06:05.080788 IP (tos 0x0, ttl 64, id 9980, offset 0, flags [DF], proto TCP (6), length 776)
    127.0.0.1.11450 > 127.0.0.1.57262: Flags [P.], cksum 0x00fd (incorrect -> 0xa37a), seq 6291:7015, ack 1226, win 512, options [nop,nop,TS val 339847583 ecr 339847463], length 724
2022-04-06 15:06:05.083838 IP (tos 0x0, ttl 64, id 12872, offset 0, flags [DF], proto TCP (6), length 408)
    127.0.0.1.57262 > 127.0.0.1.11450: Flags [P.], cksum 0xff8c (incorrect -> 0x3944), seq 1226:1582, ack 7015, win 512, options [nop,nop,TS val 339847586 ecr 339847583], length 356
2022-04-06 15:06:05.083851 IP (tos 0x0, ttl 64, id 9981, offset 0, flags [DF], proto TCP (6), length 52)
    127.0.0.1.11450 > 127.0.0.1.57262: Flags [.], cksum 0xfe28 (incorrect -> 0xb103), seq 7015, ack 1582, win 510, options [nop,nop,TS val 339847586 ecr 339847586], length 0
2022-04-06 15:06:05.581312 IP (tos 0x0, ttl 64, id 9982, offset 0, flags [DF], proto TCP (6), length 649)
    127.0.0.1.11450 > 127.0.0.1.57262: Flags [P.], cksum 0x007e (incorrect -> 0x5490), seq 7015:7612, ack 1582, win 512, options [nop,nop,TS val 339848084 ecr 339847586], length 597
200, 6.5948686599731445, 1.233659267425537