2022-04-06 20:36:59.069580 IP (tos 0x0, ttl 64, id 56542, offset 0, flags [DF], proto TCP (6), length 60)
    127.0.0.1.59468 > 127.0.0.1.10750: Flags [S], cksum 0xfe30 (incorrect -> 0x7b25), seq 3791728347, win 65495, options [mss 65495,sackOK,TS val 359701572 ecr 0,nop,wscale 7], length 0
2022-04-06 20:36:59.069596 IP (tos 0x0, ttl 64, id 0, offset 0, flags [DF], proto TCP (6), length 60)
    127.0.0.1.10750 > 127.0.0.1.59468: Flags [S.], cksum 0xfe30 (incorrect -> 0xc6ea), seq 3313253636, ack 3791728348, win 65483, options [mss 65495,sackOK,TS val 359701572 ecr 359701572,nop,wscale 7], length 0
2022-04-06 20:36:59.069608 IP (tos 0x0, ttl 64, id 56543, offset 0, flags [DF], proto TCP (6), length 52)
    127.0.0.1.59468 > 127.0.0.1.10750: Flags [.], cksum 0xfe28 (incorrect -> 0xeda6), seq 1, ack 1, win 512, options [nop,nop,TS val 359701572 ecr 359701572], length 0
2022-04-06 20:36:59.069711 IP (tos 0x0, ttl 64, id 56544, offset 0, flags [DF], proto TCP (6), length 55)
    127.0.0.1.59468 > 127.0.0.1.10750: Flags [P.], cksum 0xfe2b (incorrect -> 0xe89a), seq 1:4, ack 1, win 512, options [nop,nop,TS val 359701572 ecr 359701572], length 3
2022-04-06 20:36:59.069725 IP (tos 0x0, ttl 64, id 63157, offset 0, flags [DF], proto TCP (6), length 52)
    127.0.0.1.10750 > 127.0.0.1.59468: Flags [.], cksum 0xfe28 (incorrect -> 0xeda3), seq 1, ack 4, win 512, options [nop,nop,TS val 359701572 ecr 359701572], length 0
2022-04-06 20:36:59.069777 IP (tos 0x0, ttl 64, id 63158, offset 0, flags [DF], proto TCP (6), length 54)
    127.0.0.1.10750 > 127.0.0.1.59468: Flags [P.], cksum 0xfe2a (incorrect -> 0xe899), seq 1:3, ack 4, win 512, options [nop,nop,TS val 359701572 ecr 359701572], length 2
2022-04-06 20:36:59.069797 IP (tos 0x0, ttl 64, id 56545, offset 0, flags [DF], proto TCP (6), length 52)
    127.0.0.1.59468 > 127.0.0.1.10750: Flags [.], cksum 0xfe28 (incorrect -> 0xeda1), seq 4, ack 3, win 512, options [nop,nop,TS val 359701572 ecr 359701572], length 0
2022-04-06 20:36:59.092631 IP (tos 0x0, ttl 64, id 56546, offset 0, flags [DF], proto TCP (6), length 62)
    127.0.0.1.59468 > 127.0.0.1.10750: Flags [P.], cksum 0xfe32 (incorrect -> 0xce66), seq 4:14, ack 3, win 512, options [nop,nop,TS val 359701595 ecr 359701572], length 10
2022-04-06 20:36:59.092649 IP (tos 0x0, ttl 64, id 63159, offset 0, flags [DF], proto TCP (6), length 52)
    127.0.0.1.10750 > 127.0.0.1.59468: Flags [.], cksum 0xfe28 (incorrect -> 0xed69), seq 3, ack 14, win 512, options [nop,nop,TS val 359701595 ecr 359701595], length 0
2022-04-06 20:36:59.154428 IP (tos 0x0, ttl 64, id 63160, offset 0, flags [DF], proto TCP (6), length 62)
    127.0.0.1.10750 > 127.0.0.1.59468: Flags [P.], cksum 0xfe32 (incorrect -> 0xe818), seq 3:13, ack 14, win 512, options [nop,nop,TS val 359701657 ecr 359701595], length 10
2022-04-06 20:36:59.154436 IP (tos 0x0, ttl 64, id 56547, offset 0, flags [DF], proto TCP (6), length 52)
    127.0.0.1.59468 > 127.0.0.1.10750: Flags [.], cksum 0xfe28 (incorrect -> 0xece3), seq 14, ack 13, win 512, options [nop,nop,TS val 359701657 ecr 359701657], length 0
2022-04-06 20:36:59.160072 IP (tos 0x0, ttl 64, id 56548, offset 0, flags [DF], proto TCP (6), length 569)
    127.0.0.1.59468 > 127.0.0.1.10750: Flags [P.], cksum 0x002e (incorrect -> 0x0862), seq 14:531, ack 13, win 512, options [nop,nop,TS val 359701663 ecr 359701657], length 517
2022-04-06 20:36:59.160083 IP (tos 0x0, ttl 64, id 63161, offset 0, flags [DF], proto TCP (6), length 52)
    127.0.0.1.10750 > 127.0.0.1.59468: Flags [.], cksum 0xfe28 (incorrect -> 0xead6), seq 13, ack 531, win 508, options [nop,nop,TS val 359701663 ecr 359701663], length 0
200, 4.995464563369751, 0.6418704986572266