2022-04-06 21:15:41.379197 IP (tos 0x0, ttl 64, id 23534, offset 0, flags [DF], proto TCP (6), length 60)
    127.0.0.1.34960 > 127.0.0.1.10550: Flags [S], cksum 0xfe30 (incorrect -> 0x4c98), seq 555028272, win 65495, options [mss 65495,sackOK,TS val 362023882 ecr 0,nop,wscale 7], length 0
2022-04-06 21:15:41.379206 IP (tos 0x0, ttl 64, id 0, offset 0, flags [DF], proto TCP (6), length 60)
    127.0.0.1.10550 > 127.0.0.1.34960: Flags [S.], cksum 0xfe30 (incorrect -> 0xeea2), seq 4123150031, ack 555028273, win 65483, options [mss 65495,sackOK,TS val 362023882 ecr 362023882,nop,wscale 7], length 0
2022-04-06 21:15:41.379215 IP (tos 0x0, ttl 64, id 23535, offset 0, flags [DF], proto TCP (6), length 52)
    127.0.0.1.34960 > 127.0.0.1.10550: Flags [.], cksum 0xfe28 (incorrect -> 0x155f), seq 1, ack 1, win 512, options [nop,nop,TS val 362023882 ecr 362023882], length 0
2022-04-06 21:15:41.379312 IP (tos 0x0, ttl 64, id 23536, offset 0, flags [DF], proto TCP (6), length 55)
    127.0.0.1.34960 > 127.0.0.1.10550: Flags [P.], cksum 0xfe2b (incorrect -> 0x1053), seq 1:4, ack 1, win 512, options [nop,nop,TS val 362023882 ecr 362023882], length 3
2022-04-06 21:15:41.379326 IP (tos 0x0, ttl 64, id 1778, offset 0, flags [DF], proto TCP (6), length 52)
    127.0.0.1.10550 > 127.0.0.1.34960: Flags [.], cksum 0xfe28 (incorrect -> 0x155c), seq 1, ack 4, win 512, options [nop,nop,TS val 362023882 ecr 362023882], length 0
2022-04-06 21:15:41.379377 IP (tos 0x0, ttl 64, id 1779, offset 0, flags [DF], proto TCP (6), length 54)
    127.0.0.1.10550 > 127.0.0.1.34960: Flags [P.], cksum 0xfe2a (incorrect -> 0x1052), seq 1:3, ack 4, win 512, options [nop,nop,TS val 362023882 ecr 362023882], length 2
2022-04-06 21:15:41.379388 IP (tos 0x0, ttl 64, id 23537, offset 0, flags [DF], proto TCP (6), length 52)
    127.0.0.1.34960 > 127.0.0.1.10550: Flags [.], cksum 0xfe28 (incorrect -> 0x155a), seq 4, ack 3, win 512, options [nop,nop,TS val 362023882 ecr 362023882], length 0
200, 4.866657257080078, 0.7327609062194824