2022-04-06 17:15:24.368627 IP (tos 0x0, ttl 64, id 50335, offset 0, flags [DF], proto TCP (6), length 60)
    127.0.0.1.50494 > 127.0.0.1.10950: Flags [S], cksum 0xfe30 (incorrect -> 0x90a8), seq 95528340, win 65495, options [mss 65495,sackOK,TS val 347606871 ecr 0,nop,wscale 7], length 0
2022-04-06 17:15:24.368639 IP (tos 0x0, ttl 64, id 0, offset 0, flags [DF], proto TCP (6), length 60)
    127.0.0.1.10950 > 127.0.0.1.50494: Flags [S.], cksum 0xfe30 (incorrect -> 0xd3be), seq 1130059130, ack 95528341, win 65483, options [mss 65495,sackOK,TS val 347606871 ecr 347606871,nop,wscale 7], length 0
2022-04-06 17:15:24.368649 IP (tos 0x0, ttl 64, id 50336, offset 0, flags [DF], proto TCP (6), length 52)
    127.0.0.1.50494 > 127.0.0.1.10950: Flags [.], cksum 0xfe28 (incorrect -> 0xfa7a), seq 1, ack 1, win 512, options [nop,nop,TS val 347606871 ecr 347606871], length 0
2022-04-06 17:15:24.368737 IP (tos 0x0, ttl 64, id 50337, offset 0, flags [DF], proto TCP (6), length 55)
    127.0.0.1.50494 > 127.0.0.1.10950: Flags [P.], cksum 0xfe2b (incorrect -> 0xf56e), seq 1:4, ack 1, win 512, options [nop,nop,TS val 347606871 ecr 347606871], length 3
2022-04-06 17:15:24.368748 IP (tos 0x0, ttl 64, id 54728, offset 0, flags [DF], proto TCP (6), length 52)
    127.0.0.1.10950 > 127.0.0.1.50494: Flags [.], cksum 0xfe28 (incorrect -> 0xfa77), seq 1, ack 4, win 512, options [nop,nop,TS val 347606871 ecr 347606871], length 0
2022-04-06 17:15:24.368785 IP (tos 0x0, ttl 64, id 54729, offset 0, flags [DF], proto TCP (6), length 54)
    127.0.0.1.10950 > 127.0.0.1.50494: Flags [P.], cksum 0xfe2a (incorrect -> 0xf56d), seq 1:3, ack 4, win 512, options [nop,nop,TS val 347606871 ecr 347606871], length 2
2022-04-06 17:15:24.368801 IP (tos 0x0, ttl 64, id 50338, offset 0, flags [DF], proto TCP (6), length 52)
    127.0.0.1.50494 > 127.0.0.1.10950: Flags [.], cksum 0xfe28 (incorrect -> 0xfa75), seq 4, ack 3, win 512, options [nop,nop,TS val 347606871 ecr 347606871], length 0
2022-04-06 17:15:24.419759 IP (tos 0x0, ttl 64, id 50339, offset 0, flags [DF], proto TCP (6), length 62)
    127.0.0.1.50494 > 127.0.0.1.10950: Flags [P.], cksum 0xfe32 (incorrect -> 0x875d), seq 4:14, ack 3, win 512, options [nop,nop,TS val 347606922 ecr 347606871], length 10
2022-04-06 17:15:24.419772 IP (tos 0x0, ttl 64, id 54730, offset 0, flags [DF], proto TCP (6), length 52)
    127.0.0.1.10950 > 127.0.0.1.50494: Flags [.], cksum 0xfe28 (incorrect -> 0xfa05), seq 3, ack 14, win 512, options [nop,nop,TS val 347606922 ecr 347606922], length 0
200, 123.08209204673767, 1.1703472137451172