2022-04-06 15:06:01.731568 IP (tos 0x0, ttl 64, id 57146, offset 0, flags [DF], proto TCP (6), length 60)
    127.0.0.1.33972 > 127.0.0.1.11150: Flags [S], cksum 0xfe30 (incorrect -> 0xb529), seq 1870383694, win 65495, options [mss 65495,sackOK,TS val 339844234 ecr 0,nop,wscale 7], length 0
2022-04-06 15:06:01.731579 IP (tos 0x0, ttl 64, id 0, offset 0, flags [DF], proto TCP (6), length 60)
    127.0.0.1.11150 > 127.0.0.1.33972: Flags [S.], cksum 0xfe30 (incorrect -> 0xc687), seq 3917829195, ack 1870383695, win 65483, options [mss 65495,sackOK,TS val 339844234 ecr 339844234,nop,wscale 7], length 0
2022-04-06 15:06:01.731590 IP (tos 0x0, ttl 64, id 57147, offset 0, flags [DF], proto TCP (6), length 52)
    127.0.0.1.33972 > 127.0.0.1.11150: Flags [.], cksum 0xfe28 (incorrect -> 0xed43), seq 1, ack 1, win 512, options [nop,nop,TS val 339844234 ecr 339844234], length 0
2022-04-06 15:06:01.731693 IP (tos 0x0, ttl 64, id 57148, offset 0, flags [DF], proto TCP (6), length 55)
    127.0.0.1.33972 > 127.0.0.1.11150: Flags [P.], cksum 0xfe2b (incorrect -> 0xe837), seq 1:4, ack 1, win 512, options [nop,nop,TS val 339844234 ecr 339844234], length 3
2022-04-06 15:06:01.731708 IP (tos 0x0, ttl 64, id 18015, offset 0, flags [DF], proto TCP (6), length 52)
    127.0.0.1.11150 > 127.0.0.1.33972: Flags [.], cksum 0xfe28 (incorrect -> 0xed40), seq 1, ack 4, win 512, options [nop,nop,TS val 339844234 ecr 339844234], length 0
2022-04-06 15:06:01.731748 IP (tos 0x0, ttl 64, id 18016, offset 0, flags [DF], proto TCP (6), length 54)
    127.0.0.1.11150 > 127.0.0.1.33972: Flags [P.], cksum 0xfe2a (incorrect -> 0xe836), seq 1:3, ack 4, win 512, options [nop,nop,TS val 339844234 ecr 339844234], length 2
2022-04-06 15:06:01.731764 IP (tos 0x0, ttl 64, id 57149, offset 0, flags [DF], proto TCP (6), length 52)
    127.0.0.1.33972 > 127.0.0.1.11150: Flags [.], cksum 0xfe28 (incorrect -> 0xed3e), seq 4, ack 3, win 512, options [nop,nop,TS val 339844234 ecr 339844234], length 0
2022-04-06 15:06:01.797919 IP (tos 0x0, ttl 64, id 57150, offset 0, flags [DF], proto TCP (6), length 62)
    127.0.0.1.33972 > 127.0.0.1.11150: Flags [P.], cksum 0xfe32 (incorrect -> 0xaff7), seq 4:14, ack 3, win 512, options [nop,nop,TS val 339844300 ecr 339844234], length 10
2022-04-06 15:06:01.797938 IP (tos 0x0, ttl 64, id 18017, offset 0, flags [DF], proto TCP (6), length 52)
    127.0.0.1.11150 > 127.0.0.1.33972: Flags [.], cksum 0xfe28 (incorrect -> 0xecb0), seq 3, ack 14, win 512, options [nop,nop,TS val 339844300 ecr 339844300], length 0
200, 3.936267614364624, 1.0543372631072998