2022-04-06 10:18:59.927642 IP (tos 0x0, ttl 64, id 8496, offset 0, flags [DF], proto TCP (6), length 60)
    127.0.0.1.47288 > 127.0.0.1.9950: Flags [S], cksum 0xfe30 (incorrect -> 0xf5c7), seq 1891181265, win 65495, options [mss 65495,sackOK,TS val 322622430 ecr 0,nop,wscale 7], length 0
2022-04-06 10:18:59.927653 IP (tos 0x0, ttl 64, id 0, offset 0, flags [DF], proto TCP (6), length 60)
    127.0.0.1.9950 > 127.0.0.1.47288: Flags [S.], cksum 0xfe30 (incorrect -> 0x3884), seq 3688561226, ack 1891181266, win 65483, options [mss 65495,sackOK,TS val 322622430 ecr 322622430,nop,wscale 7], length 0
2022-04-06 10:18:59.927662 IP (tos 0x0, ttl 64, id 8497, offset 0, flags [DF], proto TCP (6), length 52)
    127.0.0.1.47288 > 127.0.0.1.9950: Flags [.], cksum 0xfe28 (incorrect -> 0x5f40), seq 1, ack 1, win 512, options [nop,nop,TS val 322622430 ecr 322622430], length 0
2022-04-06 10:18:59.927786 IP (tos 0x0, ttl 64, id 8498, offset 0, flags [DF], proto TCP (6), length 55)
    127.0.0.1.47288 > 127.0.0.1.9950: Flags [P.], cksum 0xfe2b (incorrect -> 0x5a34), seq 1:4, ack 1, win 512, options [nop,nop,TS val 322622430 ecr 322622430], length 3
2022-04-06 10:18:59.927799 IP (tos 0x0, ttl 64, id 30879, offset 0, flags [DF], proto TCP (6), length 52)
    127.0.0.1.9950 > 127.0.0.1.47288: Flags [.], cksum 0xfe28 (incorrect -> 0x5f3d), seq 1, ack 4, win 512, options [nop,nop,TS val 322622430 ecr 322622430], length 0
2022-04-06 10:18:59.927869 IP (tos 0x0, ttl 64, id 30880, offset 0, flags [DF], proto TCP (6), length 54)
    127.0.0.1.9950 > 127.0.0.1.47288: Flags [P.], cksum 0xfe2a (incorrect -> 0x5a33), seq 1:3, ack 4, win 512, options [nop,nop,TS val 322622430 ecr 322622430], length 2
2022-04-06 10:18:59.927888 IP (tos 0x0, ttl 64, id 8499, offset 0, flags [DF], proto TCP (6), length 52)
    127.0.0.1.47288 > 127.0.0.1.9950: Flags [.], cksum 0xfe28 (incorrect -> 0x5f3b), seq 4, ack 3, win 512, options [nop,nop,TS val 322622430 ecr 322622430], length 0
2022-04-06 10:18:59.929339 IP (tos 0x0, ttl 64, id 8500, offset 0, flags [DF], proto TCP (6), length 62)
    127.0.0.1.47288 > 127.0.0.1.9950: Flags [P.], cksum 0xfe32 (incorrect -> 0x8f65), seq 4:14, ack 3, win 512, options [nop,nop,TS val 322622432 ecr 322622430], length 10
2022-04-06 10:18:59.929362 IP (tos 0x0, ttl 64, id 30881, offset 0, flags [DF], proto TCP (6), length 52)
    127.0.0.1.9950 > 127.0.0.1.47288: Flags [.], cksum 0xfe28 (incorrect -> 0x5f2d), seq 3, ack 14, win 512, options [nop,nop,TS val 322622432 ecr 322622432], length 0
200, 3.856269598007202, 1.1707684993743896