2022-04-06 16:27:11.087699 IP (tos 0x0, ttl 64, id 50564, offset 0, flags [DF], proto TCP (6), length 60)
    127.0.0.1.57322 > 127.0.0.1.11450: Flags [S], cksum 0xfe30 (incorrect -> 0x6b96), seq 1006869953, win 65495, options [mss 65495,sackOK,TS val 344713590 ecr 0,nop,wscale 7], length 0
2022-04-06 16:27:11.087715 IP (tos 0x0, ttl 64, id 0, offset 0, flags [DF], proto TCP (6), length 60)
    127.0.0.1.11450 > 127.0.0.1.57322: Flags [S.], cksum 0xfe30 (incorrect -> 0xc7b4), seq 4161121748, ack 1006869954, win 65483, options [mss 65495,sackOK,TS val 344713590 ecr 344713590,nop,wscale 7], length 0
2022-04-06 16:27:11.087725 IP (tos 0x0, ttl 64, id 50565, offset 0, flags [DF], proto TCP (6), length 52)
    127.0.0.1.57322 > 127.0.0.1.11450: Flags [.], cksum 0xfe28 (incorrect -> 0xee70), seq 1, ack 1, win 512, options [nop,nop,TS val 344713590 ecr 344713590], length 0
2022-04-06 16:27:11.087818 IP (tos 0x0, ttl 64, id 50566, offset 0, flags [DF], proto TCP (6), length 55)
    127.0.0.1.57322 > 127.0.0.1.11450: Flags [P.], cksum 0xfe2b (incorrect -> 0xe964), seq 1:4, ack 1, win 512, options [nop,nop,TS val 344713590 ecr 344713590], length 3
2022-04-06 16:27:11.087823 IP (tos 0x0, ttl 64, id 34085, offset 0, flags [DF], proto TCP (6), length 52)
    127.0.0.1.11450 > 127.0.0.1.57322: Flags [.], cksum 0xfe28 (incorrect -> 0xee6d), seq 1, ack 4, win 512, options [nop,nop,TS val 344713590 ecr 344713590], length 0
2022-04-06 16:27:11.087904 IP (tos 0x0, ttl 64, id 34086, offset 0, flags [DF], proto TCP (6), length 54)
    127.0.0.1.11450 > 127.0.0.1.57322: Flags [P.], cksum 0xfe2a (incorrect -> 0xe963), seq 1:3, ack 4, win 512, options [nop,nop,TS val 344713590 ecr 344713590], length 2
2022-04-06 16:27:11.087921 IP (tos 0x0, ttl 64, id 50567, offset 0, flags [DF], proto TCP (6), length 52)
    127.0.0.1.57322 > 127.0.0.1.11450: Flags [.], cksum 0xfe28 (incorrect -> 0xee6b), seq 4, ack 3, win 512, options [nop,nop,TS val 344713590 ecr 344713590], length 0
2022-04-06 16:27:11.100412 IP (tos 0x0, ttl 64, id 50568, offset 0, flags [DF], proto TCP (6), length 62)
    127.0.0.1.57322 > 127.0.0.1.11450: Flags [P.], cksum 0xfe32 (incorrect -> 0xcf14), seq 4:14, ack 3, win 512, options [nop,nop,TS val 344713603 ecr 344713590], length 10
2022-04-06 16:27:11.100432 IP (tos 0x0, ttl 64, id 34087, offset 0, flags [DF], proto TCP (6), length 52)
    127.0.0.1.11450 > 127.0.0.1.57322: Flags [.], cksum 0xfe28 (incorrect -> 0xee47), seq 3, ack 14, win 512, options [nop,nop,TS val 344713603 ecr 344713603], length 0
2022-04-06 16:27:11.169546 IP (tos 0x0, ttl 64, id 34088, offset 0, flags [DF], proto TCP (6), length 62)
    127.0.0.1.11450 > 127.0.0.1.57322: Flags [P.], cksum 0xfe32 (incorrect -> 0xe8ef), seq 3:13, ack 14, win 512, options [nop,nop,TS val 344713672 ecr 344713603], length 10
2022-04-06 16:27:11.169558 IP (tos 0x0, ttl 64, id 50569, offset 0, flags [DF], proto TCP (6), length 52)
    127.0.0.1.57322 > 127.0.0.1.11450: Flags [.], cksum 0xfe28 (incorrect -> 0xedb3), seq 14, ack 13, win 512, options [nop,nop,TS val 344713672 ecr 344713672], length 0
2022-04-06 16:27:11.175404 IP (tos 0x0, ttl 64, id 50570, offset 0, flags [DF], proto TCP (6), length 569)
    127.0.0.1.57322 > 127.0.0.1.11450: Flags [P.], cksum 0x002e (incorrect -> 0xa215), seq 14:531, ack 13, win 512, options [nop,nop,TS val 344713678 ecr 344713672], length 517
2022-04-06 16:27:11.175414 IP (tos 0x0, ttl 64, id 34089, offset 0, flags [DF], proto TCP (6), length 52)
    127.0.0.1.11450 > 127.0.0.1.57322: Flags [.], cksum 0xfe28 (incorrect -> 0xeba6), seq 13, ack 531, win 508, options [nop,nop,TS val 344713678 ecr 344713678], length 0
2022-04-06 16:27:11.334989 IP (tos 0x0, ttl 64, id 34090, offset 0, flags [DF], proto TCP (6), length 3538)
    127.0.0.1.11450 > 127.0.0.1.57322: Flags [P.], cksum 0x0bc7 (incorrect -> 0x5114), seq 13:3499, ack 531, win 512, options [nop,nop,TS val 344713837 ecr 344713678], length 3486
2022-04-06 16:27:11.335003 IP (tos 0x0, ttl 64, id 50571, offset 0, flags [DF], proto TCP (6), length 52)
    127.0.0.1.57322 > 127.0.0.1.11450: Flags [.], cksum 0xfe28 (incorrect -> 0xdcd8), seq 531, ack 3499, win 494, options [nop,nop,TS val 344713837 ecr 344713837], length 0
2022-04-06 16:27:11.346979 IP (tos 0x0, ttl 64, id 34091, offset 0, flags [DF], proto TCP (6), length 1217)
    127.0.0.1.11450 > 127.0.0.1.57322: Flags [P.], cksum 0x02b6 (incorrect -> 0xc876), seq 3499:4664, ack 531, win 512, options [nop,nop,TS val 344713849 ecr 344713837], length 1165
2022-04-06 16:27:11.346987 IP (tos 0x0, ttl 64, id 50572, offset 0, flags [DF], proto TCP (6), length 52)
    127.0.0.1.57322 > 127.0.0.1.11450: Flags [.], cksum 0xfe28 (incorrect -> 0xd82a), seq 531, ack 4664, win 503, options [nop,nop,TS val 344713849 ecr 344713849], length 0
2022-04-06 16:27:11.347407 IP (tos 0x0, ttl 64, id 50573, offset 0, flags [DF], proto TCP (6), length 132)
    127.0.0.1.57322 > 127.0.0.1.11450: Flags [P.], cksum 0xfe78 (incorrect -> 0xb7a5), seq 531:611, ack 4664, win 503, options [nop,nop,TS val 344713850 ecr 344713849], length 80
2022-04-06 16:27:11.347415 IP (tos 0x0, ttl 64, id 34092, offset 0, flags [DF], proto TCP (6), length 52)
    127.0.0.1.11450 > 127.0.0.1.57322: Flags [.], cksum 0xfe28 (incorrect -> 0xd7cf), seq 4664, ack 611, win 512, options [nop,nop,TS val 344713850 ecr 344713850], length 0
2022-04-06 16:27:11.347854 IP (tos 0x0, ttl 64, id 50574, offset 0, flags [DF], proto TCP (6), length 425)
    127.0.0.1.57322 > 127.0.0.1.11450: Flags [P.], cksum 0xff9d (incorrect -> 0x1186), seq 611:984, ack 4664, win 503, options [nop,nop,TS val 344713850 ecr 344713850], length 373
2022-04-06 16:27:11.347859 IP (tos 0x0, ttl 64, id 34093, offset 0, flags [DF], proto TCP (6), length 52)
    127.0.0.1.11450 > 127.0.0.1.57322: Flags [.], cksum 0xfe28 (incorrect -> 0xd65c), seq 4664, ack 984, win 510, options [nop,nop,TS val 344713850 ecr 344713850], length 0
2022-04-06 16:27:11.541962 IP (tos 0x0, ttl 64, id 34094, offset 0, flags [DF], proto TCP (6), length 483)
    127.0.0.1.11450 > 127.0.0.1.57322: Flags [P.], cksum 0xffd7 (incorrect -> 0xcc53), seq 4664:5095, ack 984, win 512, options [nop,nop,TS val 344714044 ecr 344713850], length 431
2022-04-06 16:27:11.541973 IP (tos 0x0, ttl 64, id 50575, offset 0, flags [DF], proto TCP (6), length 52)
    127.0.0.1.57322 > 127.0.0.1.11450: Flags [.], cksum 0xfe28 (incorrect -> 0xd32d), seq 984, ack 5095, win 506, options [nop,nop,TS val 344714044 ecr 344714044], length 0
2022-04-06 16:27:11.542931 IP (tos 0x0, ttl 64, id 50576, offset 0, flags [DF], proto TCP (6), length 52)
    127.0.0.1.57322 > 127.0.0.1.11450: Flags [F.], cksum 0xfe28 (incorrect -> 0xd325), seq 984, ack 5095, win 512, options [nop,nop,TS val 344714045 ecr 344714044], length 0
2022-04-06 16:27:11.542971 IP (tos 0x0, ttl 64, id 34095, offset 0, flags [DF], proto TCP (6), length 52)
    127.0.0.1.11450 > 127.0.0.1.57322: Flags [F.], cksum 0xfe28 (incorrect -> 0xd323), seq 5095, ack 985, win 512, options [nop,nop,TS val 344714045 ecr 344714045], length 0
2022-04-06 16:27:11.542983 IP (tos 0x0, ttl 64, id 50577, offset 0, flags [DF], proto TCP (6), length 52)
    127.0.0.1.57322 > 127.0.0.1.11450: Flags [.], cksum 0xfe28 (incorrect -> 0xd323), seq 985, ack 5096, win 512, options [nop,nop,TS val 344714045 ecr 344714045], length 0
2022-04-06 16:27:11.544110 IP (tos 0x0, ttl 64, id 64077, offset 0, flags [DF], proto TCP (6), length 60)
    127.0.0.1.57324 > 127.0.0.1.11450: Flags [S], cksum 0xfe30 (incorrect -> 0x692f), seq 3689217659, win 65495, options [mss 65495,sackOK,TS val 344714047 ecr 0,nop,wscale 7], length 0
2022-04-06 16:27:11.544120 IP (tos 0x0, ttl 64, id 0, offset 0, flags [DF], proto TCP (6), length 60)
    127.0.0.1.11450 > 127.0.0.1.57324: Flags [S.], cksum 0xfe30 (incorrect -> 0xc9b8), seq 744977215, ack 3689217660, win 65483, options [mss 65495,sackOK,TS val 344714047 ecr 344714047,nop,wscale 7], length 0
2022-04-06 16:27:11.544126 IP (tos 0x0, ttl 64, id 64078, offset 0, flags [DF], proto TCP (6), length 52)
    127.0.0.1.57324 > 127.0.0.1.11450: Flags [.], cksum 0xfe28 (incorrect -> 0xf074), seq 1, ack 1, win 512, options [nop,nop,TS val 344714047 ecr 344714047], length 0
2022-04-06 16:27:11.544312 IP (tos 0x0, ttl 64, id 64079, offset 0, flags [DF], proto TCP (6), length 55)
    127.0.0.1.57324 > 127.0.0.1.11450: Flags [P.], cksum 0xfe2b (incorrect -> 0xeb68), seq 1:4, ack 1, win 512, options [nop,nop,TS val 344714047 ecr 344714047], length 3
2022-04-06 16:27:11.544316 IP (tos 0x0, ttl 64, id 29163, offset 0, flags [DF], proto TCP (6), length 52)
    127.0.0.1.11450 > 127.0.0.1.57324: Flags [.], cksum 0xfe28 (incorrect -> 0xf071), seq 1, ack 4, win 512, options [nop,nop,TS val 344714047 ecr 344714047], length 0
2022-04-06 16:27:11.545854 IP (tos 0x0, ttl 64, id 29164, offset 0, flags [DF], proto TCP (6), length 54)
    127.0.0.1.11450 > 127.0.0.1.57324: Flags [P.], cksum 0xfe2a (incorrect -> 0xeb66), seq 1:3, ack 4, win 512, options [nop,nop,TS val 344714048 ecr 344714047], length 2
2022-04-06 16:27:11.545864 IP (tos 0x0, ttl 64, id 64080, offset 0, flags [DF], proto TCP (6), length 52)
    127.0.0.1.57324 > 127.0.0.1.11450: Flags [.], cksum 0xfe28 (incorrect -> 0xf06d), seq 4, ack 3, win 512, options [nop,nop,TS val 344714048 ecr 344714048], length 0
2022-04-06 16:27:11.547093 IP (tos 0x0, ttl 64, id 64081, offset 0, flags [DF], proto TCP (6), length 62)
    127.0.0.1.57324 > 127.0.0.1.11450: Flags [P.], cksum 0xfe32 (incorrect -> 0xd121), seq 4:14, ack 3, win 512, options [nop,nop,TS val 344714050 ecr 344714048], length 10
2022-04-06 16:27:11.547109 IP (tos 0x0, ttl 64, id 29165, offset 0, flags [DF], proto TCP (6), length 52)
    127.0.0.1.11450 > 127.0.0.1.57324: Flags [.], cksum 0xfe28 (incorrect -> 0xf05f), seq 3, ack 14, win 512, options [nop,nop,TS val 344714050 ecr 344714050], length 0
2022-04-06 16:27:11.649152 IP (tos 0x0, ttl 64, id 29166, offset 0, flags [DF], proto TCP (6), length 62)
    127.0.0.1.11450 > 127.0.0.1.57324: Flags [P.], cksum 0xfe32 (incorrect -> 0xeae6), seq 3:13, ack 14, win 512, options [nop,nop,TS val 344714152 ecr 344714050], length 10
2022-04-06 16:27:11.649163 IP (tos 0x0, ttl 64, id 64082, offset 0, flags [DF], proto TCP (6), length 52)
    127.0.0.1.57324 > 127.0.0.1.11450: Flags [.], cksum 0xfe28 (incorrect -> 0xef89), seq 14, ack 13, win 512, options [nop,nop,TS val 344714152 ecr 344714152], length 0
2022-04-06 16:27:11.655823 IP (tos 0x0, ttl 64, id 64083, offset 0, flags [DF], proto TCP (6), length 569)
    127.0.0.1.57324 > 127.0.0.1.11450: Flags [P.], cksum 0x002e (incorrect -> 0xf278), seq 14:531, ack 13, win 512, options [nop,nop,TS val 344714158 ecr 344714152], length 517
2022-04-06 16:27:11.655833 IP (tos 0x0, ttl 64, id 29167, offset 0, flags [DF], proto TCP (6), length 52)
    127.0.0.1.11450 > 127.0.0.1.57324: Flags [.], cksum 0xfe28 (incorrect -> 0xed7c), seq 13, ack 531, win 508, options [nop,nop,TS val 344714158 ecr 344714158], length 0
2022-04-06 16:27:11.722118 IP (tos 0x0, ttl 64, id 29168, offset 0, flags [DF], proto TCP (6), length 3538)
    127.0.0.1.11450 > 127.0.0.1.57324: Flags [P.], cksum 0x0bc7 (incorrect -> 0x80b0), seq 13:3499, ack 531, win 512, options [nop,nop,TS val 344714225 ecr 344714158], length 3486
2022-04-06 16:27:11.722127 IP (tos 0x0, ttl 64, id 64084, offset 0, flags [DF], proto TCP (6), length 52)
    127.0.0.1.57324 > 127.0.0.1.11450: Flags [.], cksum 0xfe28 (incorrect -> 0xdf66), seq 531, ack 3499, win 494, options [nop,nop,TS val 344714225 ecr 344714225], length 0
2022-04-06 16:27:11.744945 IP (tos 0x0, ttl 64, id 29169, offset 0, flags [DF], proto TCP (6), length 1217)
    127.0.0.1.11450 > 127.0.0.1.57324: Flags [P.], cksum 0x02b6 (incorrect -> 0xa46e), seq 3499:4664, ack 531, win 512, options [nop,nop,TS val 344714247 ecr 344714225], length 1165
2022-04-06 16:27:11.744953 IP (tos 0x0, ttl 64, id 64085, offset 0, flags [DF], proto TCP (6), length 52)
    127.0.0.1.57324 > 127.0.0.1.11450: Flags [.], cksum 0xfe28 (incorrect -> 0xdaa4), seq 531, ack 4664, win 503, options [nop,nop,TS val 344714247 ecr 344714247], length 0
2022-04-06 16:27:11.745313 IP (tos 0x0, ttl 64, id 64086, offset 0, flags [DF], proto TCP (6), length 132)
    127.0.0.1.57324 > 127.0.0.1.11450: Flags [P.], cksum 0xfe78 (incorrect -> 0xf929), seq 531:611, ack 4664, win 503, options [nop,nop,TS val 344714248 ecr 344714247], length 80
2022-04-06 16:27:11.745323 IP (tos 0x0, ttl 64, id 29170, offset 0, flags [DF], proto TCP (6), length 52)
    127.0.0.1.11450 > 127.0.0.1.57324: Flags [.], cksum 0xfe28 (incorrect -> 0xda49), seq 4664, ack 611, win 512, options [nop,nop,TS val 344714248 ecr 344714248], length 0
2022-04-06 16:27:11.745750 IP (tos 0x0, ttl 64, id 64087, offset 0, flags [DF], proto TCP (6), length 432)
    127.0.0.1.57324 > 127.0.0.1.11450: Flags [P.], cksum 0xffa4 (incorrect -> 0x954b), seq 611:991, ack 4664, win 503, options [nop,nop,TS val 344714248 ecr 344714248], length 380
2022-04-06 16:27:11.745758 IP (tos 0x0, ttl 64, id 29171, offset 0, flags [DF], proto TCP (6), length 52)
    127.0.0.1.11450 > 127.0.0.1.57324: Flags [.], cksum 0xfe28 (incorrect -> 0xd8cf), seq 4664, ack 991, win 510, options [nop,nop,TS val 344714248 ecr 344714248], length 0
200, 6.552353858947754, 1.4806835651397705