2022-04-06 09:51:36.620813 IP (tos 0x0, ttl 64, id 7647, offset 0, flags [DF], proto TCP (6), length 60)
    127.0.0.1.56124 > 127.0.0.1.12150: Flags [S], cksum 0xfe30 (incorrect -> 0x59f9), seq 3191167307, win 65495, options [mss 65495,sackOK,TS val 320979123 ecr 0,nop,wscale 7], length 0
2022-04-06 09:51:36.620823 IP (tos 0x0, ttl 64, id 0, offset 0, flags [DF], proto TCP (6), length 60)
    127.0.0.1.12150 > 127.0.0.1.56124: Flags [S.], cksum 0xfe30 (incorrect -> 0x563d), seq 666241068, ack 3191167308, win 65483, options [mss 65495,sackOK,TS val 320979123 ecr 320979123,nop,wscale 7], length 0
2022-04-06 09:51:36.620829 IP (tos 0x0, ttl 64, id 7648, offset 0, flags [DF], proto TCP (6), length 52)
    127.0.0.1.56124 > 127.0.0.1.12150: Flags [.], cksum 0xfe28 (incorrect -> 0x7cf9), seq 1, ack 1, win 512, options [nop,nop,TS val 320979123 ecr 320979123], length 0
2022-04-06 09:51:36.620972 IP (tos 0x0, ttl 64, id 7649, offset 0, flags [DF], proto TCP (6), length 55)
    127.0.0.1.56124 > 127.0.0.1.12150: Flags [P.], cksum 0xfe2b (incorrect -> 0x77ed), seq 1:4, ack 1, win 512, options [nop,nop,TS val 320979123 ecr 320979123], length 3
2022-04-06 09:51:36.620977 IP (tos 0x0, ttl 64, id 61469, offset 0, flags [DF], proto TCP (6), length 52)
    127.0.0.1.12150 > 127.0.0.1.56124: Flags [.], cksum 0xfe28 (incorrect -> 0x7cf6), seq 1, ack 4, win 512, options [nop,nop,TS val 320979123 ecr 320979123], length 0
2022-04-06 09:51:36.620999 IP (tos 0x0, ttl 64, id 61470, offset 0, flags [DF], proto TCP (6), length 54)
    127.0.0.1.12150 > 127.0.0.1.56124: Flags [P.], cksum 0xfe2a (incorrect -> 0x77ec), seq 1:3, ack 4, win 512, options [nop,nop,TS val 320979123 ecr 320979123], length 2
2022-04-06 09:51:36.621005 IP (tos 0x0, ttl 64, id 7650, offset 0, flags [DF], proto TCP (6), length 52)
    127.0.0.1.56124 > 127.0.0.1.12150: Flags [.], cksum 0xfe28 (incorrect -> 0x7cf4), seq 4, ack 3, win 512, options [nop,nop,TS val 320979123 ecr 320979123], length 0
2022-04-06 09:51:36.657329 IP (tos 0x0, ttl 64, id 7651, offset 0, flags [DF], proto TCP (6), length 62)
    127.0.0.1.56124 > 127.0.0.1.12150: Flags [P.], cksum 0xfe32 (incorrect -> 0x70b0), seq 4:14, ack 3, win 512, options [nop,nop,TS val 320979160 ecr 320979123], length 10
2022-04-06 09:51:36.657347 IP (tos 0x0, ttl 64, id 61471, offset 0, flags [DF], proto TCP (6), length 52)
    127.0.0.1.12150 > 127.0.0.1.56124: Flags [.], cksum 0xfe28 (incorrect -> 0x7ca0), seq 3, ack 14, win 512, options [nop,nop,TS val 320979160 ecr 320979160], length 0
200, 7.650712251663208, 0.9284708499908447