2022-04-06 23:26:19.022460 IP (tos 0x0, ttl 64, id 4765, offset 0, flags [DF], proto TCP (6), length 60)
    127.0.0.1.51156 > 127.0.0.1.10950: Flags [S], cksum 0xfe30 (incorrect -> 0x1626), seq 677209411, win 65495, options [mss 65495,sackOK,TS val 369861525 ecr 0,nop,wscale 7], length 0
2022-04-06 23:26:19.022475 IP (tos 0x0, ttl 64, id 0, offset 0, flags [DF], proto TCP (6), length 60)
    127.0.0.1.10950 > 127.0.0.1.51156: Flags [S.], cksum 0xfe30 (incorrect -> 0xe4f8), seq 1607342009, ack 677209412, win 65483, options [mss 65495,sackOK,TS val 369861525 ecr 369861525,nop,wscale 7], length 0
2022-04-06 23:26:19.022486 IP (tos 0x0, ttl 64, id 4766, offset 0, flags [DF], proto TCP (6), length 52)
    127.0.0.1.51156 > 127.0.0.1.10950: Flags [.], cksum 0xfe28 (incorrect -> 0x0bb5), seq 1, ack 1, win 512, options [nop,nop,TS val 369861525 ecr 369861525], length 0
2022-04-06 23:26:19.022588 IP (tos 0x0, ttl 64, id 4767, offset 0, flags [DF], proto TCP (6), length 55)
    127.0.0.1.51156 > 127.0.0.1.10950: Flags [P.], cksum 0xfe2b (incorrect -> 0x06a9), seq 1:4, ack 1, win 512, options [nop,nop,TS val 369861525 ecr 369861525], length 3
2022-04-06 23:26:19.022594 IP (tos 0x0, ttl 64, id 55196, offset 0, flags [DF], proto TCP (6), length 52)
    127.0.0.1.10950 > 127.0.0.1.51156: Flags [.], cksum 0xfe28 (incorrect -> 0x0bb2), seq 1, ack 4, win 512, options [nop,nop,TS val 369861525 ecr 369861525], length 0
2022-04-06 23:26:19.022618 IP (tos 0x0, ttl 64, id 55197, offset 0, flags [DF], proto TCP (6), length 54)
    127.0.0.1.10950 > 127.0.0.1.51156: Flags [P.], cksum 0xfe2a (incorrect -> 0x06a8), seq 1:3, ack 4, win 512, options [nop,nop,TS val 369861525 ecr 369861525], length 2
2022-04-06 23:26:19.022629 IP (tos 0x0, ttl 64, id 4768, offset 0, flags [DF], proto TCP (6), length 52)
    127.0.0.1.51156 > 127.0.0.1.10950: Flags [.], cksum 0xfe28 (incorrect -> 0x0bb0), seq 4, ack 3, win 512, options [nop,nop,TS val 369861525 ecr 369861525], length 0
2022-04-06 23:26:19.036959 IP (tos 0x0, ttl 64, id 4769, offset 0, flags [DF], proto TCP (6), length 62)
    127.0.0.1.51156 > 127.0.0.1.10950: Flags [P.], cksum 0xfe32 (incorrect -> 0xa6a7), seq 4:14, ack 3, win 512, options [nop,nop,TS val 369861539 ecr 369861525], length 10
2022-04-06 23:26:19.036977 IP (tos 0x0, ttl 64, id 55198, offset 0, flags [DF], proto TCP (6), length 52)
    127.0.0.1.10950 > 127.0.0.1.51156: Flags [.], cksum 0xfe28 (incorrect -> 0x0b8a), seq 3, ack 14, win 512, options [nop,nop,TS val 369861539 ecr 369861539], length 0
2022-04-06 23:26:19.123435 IP (tos 0x0, ttl 64, id 55199, offset 0, flags [DF], proto TCP (6), length 62)
    127.0.0.1.10950 > 127.0.0.1.51156: Flags [P.], cksum 0xfe32 (incorrect -> 0x0620), seq 3:13, ack 14, win 512, options [nop,nop,TS val 369861626 ecr 369861539], length 10
2022-04-06 23:26:19.123447 IP (tos 0x0, ttl 64, id 4770, offset 0, flags [DF], proto TCP (6), length 52)
    127.0.0.1.51156 > 127.0.0.1.10950: Flags [.], cksum 0xfe28 (incorrect -> 0x0ad2), seq 14, ack 13, win 512, options [nop,nop,TS val 369861626 ecr 369861626], length 0
2022-04-06 23:26:19.129256 IP (tos 0x0, ttl 64, id 4771, offset 0, flags [DF], proto TCP (6), length 569)
    127.0.0.1.51156 > 127.0.0.1.10950: Flags [P.], cksum 0x002e (incorrect -> 0x3cb9), seq 14:531, ack 13, win 512, options [nop,nop,TS val 369861632 ecr 369861626], length 517
2022-04-06 23:26:19.129265 IP (tos 0x0, ttl 64, id 55200, offset 0, flags [DF], proto TCP (6), length 52)
    127.0.0.1.10950 > 127.0.0.1.51156: Flags [.], cksum 0xfe28 (incorrect -> 0x08c5), seq 13, ack 531, win 508, options [nop,nop,TS val 369861632 ecr 369861632], length 0
2022-04-06 23:26:19.212504 IP (tos 0x0, ttl 64, id 55201, offset 0, flags [DF], proto TCP (6), length 3538)
    127.0.0.1.10950 > 127.0.0.1.51156: Flags [P.], cksum 0x0bc7 (incorrect -> 0x7850), seq 13:3499, ack 531, win 512, options [nop,nop,TS val 369861715 ecr 369861632], length 3486
2022-04-06 23:26:19.212518 IP (tos 0x0, ttl 64, id 4772, offset 0, flags [DF], proto TCP (6), length 52)
    127.0.0.1.51156 > 127.0.0.1.10950: Flags [.], cksum 0xfe28 (incorrect -> 0xfa8e), seq 531, ack 3499, win 494, options [nop,nop,TS val 369861715 ecr 369861715], length 0
2022-04-06 23:26:19.239484 IP (tos 0x0, ttl 64, id 55202, offset 0, flags [DF], proto TCP (6), length 2134)
    127.0.0.1.10950 > 127.0.0.1.51156: Flags [P.], cksum 0x064b (incorrect -> 0xd13f), seq 3499:5581, ack 531, win 512, options [nop,nop,TS val 369861742 ecr 369861715], length 2082
2022-04-06 23:26:19.239507 IP (tos 0x0, ttl 64, id 4773, offset 0, flags [DF], proto TCP (6), length 52)
    127.0.0.1.51156 > 127.0.0.1.10950: Flags [.], cksum 0xfe28 (incorrect -> 0xf231), seq 531, ack 5581, win 499, options [nop,nop,TS val 369861742 ecr 369861742], length 0
2022-04-06 23:26:19.240300 IP (tos 0x0, ttl 64, id 4774, offset 0, flags [DF], proto TCP (6), length 116)
    127.0.0.1.51156 > 127.0.0.1.10950: Flags [P.], cksum 0xfe68 (incorrect -> 0x1634), seq 531:595, ack 5581, win 512, options [nop,nop,TS val 369861743 ecr 369861742], length 64
2022-04-06 23:26:19.240309 IP (tos 0x0, ttl 64, id 55203, offset 0, flags [DF], proto TCP (6), length 52)
    127.0.0.1.10950 > 127.0.0.1.51156: Flags [.], cksum 0xfe28 (incorrect -> 0xf1e2), seq 5581, ack 595, win 512, options [nop,nop,TS val 369861743 ecr 369861743], length 0
2022-04-06 23:26:19.240897 IP (tos 0x0, ttl 64, id 4775, offset 0, flags [DF], proto TCP (6), length 340)
    127.0.0.1.51156 > 127.0.0.1.10950: Flags [P.], cksum 0xff48 (incorrect -> 0x63ac), seq 595:883, ack 5581, win 512, options [nop,nop,TS val 369861743 ecr 369861743], length 288
2022-04-06 23:26:19.240905 IP (tos 0x0, ttl 64, id 55204, offset 0, flags [DF], proto TCP (6), length 52)
    127.0.0.1.10950 > 127.0.0.1.51156: Flags [.], cksum 0xfe28 (incorrect -> 0xf0c4), seq 5581, ack 883, win 510, options [nop,nop,TS val 369861743 ecr 369861743], length 0
2022-04-06 23:26:19.388014 IP (tos 0x0, ttl 64, id 55205, offset 0, flags [DF], proto TCP (6), length 4100)
    127.0.0.1.10950 > 127.0.0.1.51156: Flags [P.], cksum 0x0df9 (incorrect -> 0x017e), seq 5581:9629, ack 883, win 512, options [nop,nop,TS val 369861890 ecr 369861743], length 4048
2022-04-06 23:26:19.388027 IP (tos 0x0, ttl 64, id 4776, offset 0, flags [DF], proto TCP (6), length 52)
    127.0.0.1.51156 > 127.0.0.1.10950: Flags [.], cksum 0xfe28 (incorrect -> 0xdfe0), seq 883, ack 9629, win 492, options [nop,nop,TS val 369861890 ecr 369861890], length 0
2022-04-06 23:26:19.388034 IP (tos 0x0, ttl 64, id 55206, offset 0, flags [DF], proto TCP (6), length 130)
    127.0.0.1.10950 > 127.0.0.1.51156: Flags [P.], cksum 0xfe76 (incorrect -> 0x08b0), seq 9629:9707, ack 883, win 512, options [nop,nop,TS val 369861890 ecr 369861890], length 78
2022-04-06 23:26:19.388038 IP (tos 0x0, ttl 64, id 4777, offset 0, flags [DF], proto TCP (6), length 52)
    127.0.0.1.51156 > 127.0.0.1.10950: Flags [.], cksum 0xfe28 (incorrect -> 0xdf92), seq 883, ack 9707, win 492, options [nop,nop,TS val 369861890 ecr 369861890], length 0
2022-04-06 23:26:19.388995 IP (tos 0x0, ttl 64, id 55207, offset 0, flags [DF], proto TCP (6), length 4100)
    127.0.0.1.10950 > 127.0.0.1.51156: Flags [P.], cksum 0x0df9 (incorrect -> 0x6b50), seq 9707:13755, ack 883, win 512, options [nop,nop,TS val 369861891 ecr 369861890], length 4048
2022-04-06 23:26:19.389000 IP (tos 0x0, ttl 64, id 4778, offset 0, flags [DF], proto TCP (6), length 52)
    127.0.0.1.51156 > 127.0.0.1.10950: Flags [.], cksum 0xfe28 (incorrect -> 0xcfd0), seq 883, ack 13755, win 476, options [nop,nop,TS val 369861891 ecr 369861891], length 0
2022-04-06 23:26:19.389007 IP (tos 0x0, ttl 64, id 55208, offset 0, flags [DF], proto TCP (6), length 984)
    127.0.0.1.10950 > 127.0.0.1.51156: Flags [P.], cksum 0x01cd (incorrect -> 0xc2af), seq 13755:14687, ack 883, win 512, options [nop,nop,TS val 369861891 ecr 369861891], length 932
2022-04-06 23:26:19.389009 IP (tos 0x0, ttl 64, id 4779, offset 0, flags [DF], proto TCP (6), length 52)
    127.0.0.1.51156 > 127.0.0.1.10950: Flags [.], cksum 0xfe28 (incorrect -> 0xcc30), seq 883, ack 14687, win 472, options [nop,nop,TS val 369861891 ecr 369861891], length 0
2022-04-06 23:26:19.405008 IP (tos 0x0, ttl 64, id 55209, offset 0, flags [DF], proto TCP (6), length 1546)
    127.0.0.1.10950 > 127.0.0.1.51156: Flags [P.], cksum 0x03ff (incorrect -> 0x6d80), seq 14687:16181, ack 883, win 512, options [nop,nop,TS val 369861907 ecr 369861891], length 1494
2022-04-06 23:26:19.405015 IP (tos 0x0, ttl 64, id 4780, offset 0, flags [DF], proto TCP (6), length 52)
    127.0.0.1.51156 > 127.0.0.1.10950: Flags [.], cksum 0xfe28 (incorrect -> 0xc61c), seq 883, ack 16181, win 502, options [nop,nop,TS val 369861907 ecr 369861907], length 0
2022-04-06 23:26:19.405827 IP (tos 0x0, ttl 64, id 55210, offset 0, flags [DF], proto TCP (6), length 1790)
    127.0.0.1.10950 > 127.0.0.1.51156: Flags [P.], cksum 0x04f3 (incorrect -> 0xfcb1), seq 16181:17919, ack 883, win 512, options [nop,nop,TS val 369861908 ecr 369861907], length 1738
2022-04-06 23:26:19.405832 IP (tos 0x0, ttl 64, id 4781, offset 0, flags [DF], proto TCP (6), length 52)
    127.0.0.1.51156 > 127.0.0.1.10950: Flags [.], cksum 0xfe28 (incorrect -> 0xbf51), seq 883, ack 17919, win 501, options [nop,nop,TS val 369861908 ecr 369861908], length 0
2022-04-06 23:26:19.413803 IP (tos 0x0, ttl 64, id 55211, offset 0, flags [DF], proto TCP (6), length 4100)
    127.0.0.1.10950 > 127.0.0.1.51156: Flags [P.], cksum 0x0df9 (incorrect -> 0x46b3), seq 17919:21967, ack 883, win 512, options [nop,nop,TS val 369861916 ecr 369861908], length 4048
2022-04-06 23:26:19.413815 IP (tos 0x0, ttl 64, id 4782, offset 0, flags [DF], proto TCP (6), length 52)
    127.0.0.1.51156 > 127.0.0.1.10950: Flags [.], cksum 0xfe28 (incorrect -> 0xaf7a), seq 883, ack 21967, win 492, options [nop,nop,TS val 369861916 ecr 369861916], length 0
2022-04-06 23:26:19.413826 IP (tos 0x0, ttl 64, id 55212, offset 0, flags [DF], proto TCP (6), length 984)
    127.0.0.1.10950 > 127.0.0.1.51156: Flags [P.], cksum 0x01cd (incorrect -> 0x1e87), seq 21967:22899, ack 883, win 512, options [nop,nop,TS val 369861916 ecr 369861916], length 932
2022-04-06 23:26:19.413832 IP (tos 0x0, ttl 64, id 4783, offset 0, flags [DF], proto TCP (6), length 52)
    127.0.0.1.51156 > 127.0.0.1.10950: Flags [.], cksum 0xfe28 (incorrect -> 0xabda), seq 883, ack 22899, win 488, options [nop,nop,TS val 369861916 ecr 369861916], length 0
2022-04-06 23:26:19.413940 IP (tos 0x0, ttl 64, id 55213, offset 0, flags [DF], proto TCP (6), length 4100)
    127.0.0.1.10950 > 127.0.0.1.51156: Flags [P.], cksum 0x0df9 (incorrect -> 0x2cad), seq 22899:26947, ack 883, win 512, options [nop,nop,TS val 369861916 ecr 369861916], length 4048
2022-04-06 23:26:19.440546 IP (tos 0x0, ttl 64, id 55214, offset 0, flags [DF], proto TCP (6), length 32820)
    127.0.0.1.10950 > 127.0.0.1.51156: Flags [.], cksum 0x7e29 (incorrect -> 0x2bf7), seq 26947:59715, ack 883, win 512, options [nop,nop,TS val 369861943 ecr 369861916], length 32768
2022-04-06 23:26:19.440659 IP (tos 0x0, ttl 64, id 4784, offset 0, flags [DF], proto TCP (6), length 52)
    127.0.0.1.51156 > 127.0.0.1.10950: Flags [.], cksum 0xfe28 (incorrect -> 0x1c5c), seq 883, ack 59715, win 379, options [nop,nop,TS val 369861943 ecr 369861916], length 0
2022-04-06 23:26:19.440683 IP (tos 0x0, ttl 64, id 55215, offset 0, flags [DF], proto TCP (6), length 13098)
    127.0.0.1.10950 > 127.0.0.1.51156: Flags [P.], cksum 0x311f (incorrect -> 0xaa68), seq 59715:72761, ack 883, win 512, options [nop,nop,TS val 369861943 ecr 369861943], length 13046
2022-04-06 23:26:19.442152 IP (tos 0x0, ttl 64, id 4785, offset 0, flags [DF], proto TCP (6), length 52)
    127.0.0.1.51156 > 127.0.0.1.10950: Flags [.], cksum 0xfe28 (incorrect -> 0xe8c3), seq 883, ack 72761, win 512, options [nop,nop,TS val 369861945 ecr 369861943], length 0
2022-04-06 23:26:19.442162 IP (tos 0x0, ttl 64, id 55216, offset 0, flags [DF], proto TCP (6), length 8464)
    127.0.0.1.10950 > 127.0.0.1.51156: Flags [P.], cksum 0x1f05 (incorrect -> 0x7d7b), seq 72761:81173, ack 883, win 512, options [nop,nop,TS val 369861945 ecr 369861945], length 8412
2022-04-06 23:26:19.442167 IP (tos 0x0, ttl 64, id 4786, offset 0, flags [DF], proto TCP (6), length 52)
    127.0.0.1.51156 > 127.0.0.1.10950: Flags [.], cksum 0xfe28 (incorrect -> 0xc7e5), seq 883, ack 81173, win 512, options [nop,nop,TS val 369861945 ecr 369861945], length 0
2022-04-06 23:26:19.442597 IP (tos 0x0, ttl 64, id 55217, offset 0, flags [DF], proto TCP (6), length 4100)
    127.0.0.1.10950 > 127.0.0.1.51156: Flags [P.], cksum 0x0df9 (incorrect -> 0x459b), seq 81173:85221, ack 883, win 512, options [nop,nop,TS val 369861945 ecr 369861945], length 4048
2022-04-06 23:26:19.443302 IP (tos 0x0, ttl 64, id 4787, offset 0, flags [DF], proto TCP (6), length 52)
    127.0.0.1.51156 > 127.0.0.1.10950: Flags [.], cksum 0xfe28 (incorrect -> 0xb814), seq 883, ack 85221, win 512, options [nop,nop,TS val 369861946 ecr 369861945], length 0
2022-04-06 23:26:19.443310 IP (tos 0x0, ttl 64, id 55218, offset 0, flags [DF], proto TCP (6), length 804)
    127.0.0.1.10950 > 127.0.0.1.51156: Flags [P.], cksum 0x0119 (incorrect -> 0x9e84), seq 85221:85973, ack 883, win 512, options [nop,nop,TS val 369861946 ecr 369861946], length 752
2022-04-06 23:26:19.443314 IP (tos 0x0, ttl 64, id 4788, offset 0, flags [DF], proto TCP (6), length 52)
    127.0.0.1.51156 > 127.0.0.1.10950: Flags [.], cksum 0xfe28 (incorrect -> 0xb523), seq 883, ack 85973, win 512, options [nop,nop,TS val 369861946 ecr 369861946], length 0
2022-04-06 23:26:19.456281 IP (tos 0x0, ttl 64, id 55219, offset 0, flags [DF], proto TCP (6), length 3928)
    127.0.0.1.10950 > 127.0.0.1.51156: Flags [P.], cksum 0x0d4d (incorrect -> 0x7fa7), seq 85973:89849, ack 883, win 512, options [nop,nop,TS val 369861959 ecr 369861946], length 3876
2022-04-06 23:26:19.456297 IP (tos 0x0, ttl 64, id 4789, offset 0, flags [DF], proto TCP (6), length 52)
    127.0.0.1.51156 > 127.0.0.1.10950: Flags [.], cksum 0xfe28 (incorrect -> 0xa5e5), seq 883, ack 89849, win 512, options [nop,nop,TS val 369861959 ecr 369861959], length 0
2022-04-06 23:26:19.465928 IP (tos 0x0, ttl 64, id 55220, offset 0, flags [DF], proto TCP (6), length 4100)
    127.0.0.1.10950 > 127.0.0.1.51156: Flags [P.], cksum 0x0df9 (incorrect -> 0xd006), seq 89849:93897, ack 883, win 512, options [nop,nop,TS val 369861968 ecr 369861959], length 4048
200, 6.878546237945557, 0.4674990177154541