2022-04-06 08:03:41.975313 IP (tos 0x0, ttl 64, id 50440, offset 0, flags [DF], proto TCP (6), length 60)
    127.0.0.1.33144 > 127.0.0.1.11150: Flags [S], cksum 0xfe30 (incorrect -> 0x06c3), seq 127831229, win 65495, options [mss 65495,sackOK,TS val 314504478 ecr 0,nop,wscale 7], length 0
2022-04-06 08:03:41.975322 IP (tos 0x0, ttl 64, id 0, offset 0, flags [DF], proto TCP (6), length 60)
    127.0.0.1.11150 > 127.0.0.1.33144: Flags [S.], cksum 0xfe30 (incorrect -> 0x0188), seq 2651086676, ack 127831230, win 65483, options [mss 65495,sackOK,TS val 314504478 ecr 314504478,nop,wscale 7], length 0
2022-04-06 08:03:41.975330 IP (tos 0x0, ttl 64, id 50441, offset 0, flags [DF], proto TCP (6), length 52)
    127.0.0.1.33144 > 127.0.0.1.11150: Flags [.], cksum 0xfe28 (incorrect -> 0x2844), seq 1, ack 1, win 512, options [nop,nop,TS val 314504478 ecr 314504478], length 0
2022-04-06 08:03:41.975498 IP (tos 0x0, ttl 64, id 50442, offset 0, flags [DF], proto TCP (6), length 55)
    127.0.0.1.33144 > 127.0.0.1.11150: Flags [P.], cksum 0xfe2b (incorrect -> 0x2338), seq 1:4, ack 1, win 512, options [nop,nop,TS val 314504478 ecr 314504478], length 3
2022-04-06 08:03:41.975505 IP (tos 0x0, ttl 64, id 56535, offset 0, flags [DF], proto TCP (6), length 52)
    127.0.0.1.11150 > 127.0.0.1.33144: Flags [.], cksum 0xfe28 (incorrect -> 0x2841), seq 1, ack 4, win 512, options [nop,nop,TS val 314504478 ecr 314504478], length 0
2022-04-06 08:03:41.975535 IP (tos 0x0, ttl 64, id 56536, offset 0, flags [DF], proto TCP (6), length 54)
    127.0.0.1.11150 > 127.0.0.1.33144: Flags [P.], cksum 0xfe2a (incorrect -> 0x2337), seq 1:3, ack 4, win 512, options [nop,nop,TS val 314504478 ecr 314504478], length 2
2022-04-06 08:03:41.975544 IP (tos 0x0, ttl 64, id 50443, offset 0, flags [DF], proto TCP (6), length 52)
    127.0.0.1.33144 > 127.0.0.1.11150: Flags [.], cksum 0xfe28 (incorrect -> 0x283f), seq 4, ack 3, win 512, options [nop,nop,TS val 314504478 ecr 314504478], length 0
2022-04-06 08:03:41.976685 IP (tos 0x0, ttl 64, id 50444, offset 0, flags [DF], proto TCP (6), length 62)
    127.0.0.1.33144 > 127.0.0.1.11150: Flags [P.], cksum 0xfe32 (incorrect -> 0x1a20), seq 4:14, ack 3, win 512, options [nop,nop,TS val 314504479 ecr 314504478], length 10
2022-04-06 08:03:41.976705 IP (tos 0x0, ttl 64, id 56537, offset 0, flags [DF], proto TCP (6), length 52)
    127.0.0.1.11150 > 127.0.0.1.33144: Flags [.], cksum 0xfe28 (incorrect -> 0x2833), seq 3, ack 14, win 512, options [nop,nop,TS val 314504479 ecr 314504479], length 0
2022-04-06 08:03:42.064878 IP (tos 0x0, ttl 64, id 56538, offset 0, flags [DF], proto TCP (6), length 62)
    127.0.0.1.11150 > 127.0.0.1.33144: Flags [P.], cksum 0xfe32 (incorrect -> 0x22c8), seq 3:13, ack 14, win 512, options [nop,nop,TS val 314504567 ecr 314504479], length 10
2022-04-06 08:03:42.064891 IP (tos 0x0, ttl 64, id 50445, offset 0, flags [DF], proto TCP (6), length 52)
    127.0.0.1.33144 > 127.0.0.1.11150: Flags [.], cksum 0xfe28 (incorrect -> 0x2779), seq 14, ack 13, win 512, options [nop,nop,TS val 314504567 ecr 314504567], length 0
2022-04-06 08:03:42.071256 IP (tos 0x0, ttl 64, id 50446, offset 0, flags [DF], proto TCP (6), length 569)
    127.0.0.1.33144 > 127.0.0.1.11150: Flags [P.], cksum 0x002e (incorrect -> 0x945b), seq 14:531, ack 13, win 512, options [nop,nop,TS val 314504574 ecr 314504567], length 517
2022-04-06 08:03:42.071268 IP (tos 0x0, ttl 64, id 56539, offset 0, flags [DF], proto TCP (6), length 52)
    127.0.0.1.11150 > 127.0.0.1.33144: Flags [.], cksum 0xfe28 (incorrect -> 0x256a), seq 13, ack 531, win 508, options [nop,nop,TS val 314504574 ecr 314504574], length 0
200, 4.746761083602905, 0.38364744186401367