2022-04-06 05:25:17.512521 IP (tos 0x0, ttl 64, id 31483, offset 0, flags [DF], proto TCP (6), length 60)
    127.0.0.1.49160 > 127.0.0.1.10950: Flags [S], cksum 0xfe30 (incorrect -> 0xeb79), seq 308045536, win 65495, options [mss 65495,sackOK,TS val 305000015 ecr 0,nop,wscale 7], length 0
2022-04-06 05:25:17.512532 IP (tos 0x0, ttl 64, id 0, offset 0, flags [DF], proto TCP (6), length 60)
    127.0.0.1.10950 > 127.0.0.1.49160: Flags [S.], cksum 0xfe30 (incorrect -> 0xf08e), seq 560847099, ack 308045537, win 65483, options [mss 65495,sackOK,TS val 305000015 ecr 305000015,nop,wscale 7], length 0
2022-04-06 05:25:17.512541 IP (tos 0x0, ttl 64, id 31484, offset 0, flags [DF], proto TCP (6), length 52)
    127.0.0.1.49160 > 127.0.0.1.10950: Flags [.], cksum 0xfe28 (incorrect -> 0x174b), seq 1, ack 1, win 512, options [nop,nop,TS val 305000015 ecr 305000015], length 0
2022-04-06 05:25:17.512712 IP (tos 0x0, ttl 64, id 31485, offset 0, flags [DF], proto TCP (6), length 55)
    127.0.0.1.49160 > 127.0.0.1.10950: Flags [P.], cksum 0xfe2b (incorrect -> 0x123f), seq 1:4, ack 1, win 512, options [nop,nop,TS val 305000015 ecr 305000015], length 3
2022-04-06 05:25:17.512718 IP (tos 0x0, ttl 64, id 58242, offset 0, flags [DF], proto TCP (6), length 52)
    127.0.0.1.10950 > 127.0.0.1.49160: Flags [.], cksum 0xfe28 (incorrect -> 0x1748), seq 1, ack 4, win 512, options [nop,nop,TS val 305000015 ecr 305000015], length 0
2022-04-06 05:25:17.512741 IP (tos 0x0, ttl 64, id 58243, offset 0, flags [DF], proto TCP (6), length 54)
    127.0.0.1.10950 > 127.0.0.1.49160: Flags [P.], cksum 0xfe2a (incorrect -> 0x123e), seq 1:3, ack 4, win 512, options [nop,nop,TS val 305000015 ecr 305000015], length 2
2022-04-06 05:25:17.512748 IP (tos 0x0, ttl 64, id 31486, offset 0, flags [DF], proto TCP (6), length 52)
    127.0.0.1.49160 > 127.0.0.1.10950: Flags [.], cksum 0xfe28 (incorrect -> 0x1746), seq 4, ack 3, win 512, options [nop,nop,TS val 305000015 ecr 305000015], length 0
2022-04-06 05:25:17.524595 IP (tos 0x0, ttl 64, id 31487, offset 0, flags [DF], proto TCP (6), length 62)
    127.0.0.1.49160 > 127.0.0.1.10950: Flags [P.], cksum 0xfe32 (incorrect -> 0xd151), seq 4:14, ack 3, win 512, options [nop,nop,TS val 305000027 ecr 305000015], length 10
2022-04-06 05:25:17.524615 IP (tos 0x0, ttl 64, id 58244, offset 0, flags [DF], proto TCP (6), length 52)
    127.0.0.1.10950 > 127.0.0.1.49160: Flags [.], cksum 0xfe28 (incorrect -> 0x1724), seq 3, ack 14, win 512, options [nop,nop,TS val 305000027 ecr 305000027], length 0
2022-04-06 05:25:17.733989 IP (tos 0x0, ttl 64, id 58245, offset 0, flags [DF], proto TCP (6), length 62)
    127.0.0.1.10950 > 127.0.0.1.49160: Flags [P.], cksum 0xfe32 (incorrect -> 0x1140), seq 3:13, ack 14, win 512, options [nop,nop,TS val 305000236 ecr 305000027], length 10
2022-04-06 05:25:17.733999 IP (tos 0x0, ttl 64, id 31488, offset 0, flags [DF], proto TCP (6), length 52)
    127.0.0.1.49160 > 127.0.0.1.10950: Flags [.], cksum 0xfe28 (incorrect -> 0x1578), seq 14, ack 13, win 512, options [nop,nop,TS val 305000236 ecr 305000236], length 0
2022-04-06 05:25:17.740096 IP (tos 0x0, ttl 64, id 31489, offset 0, flags [DF], proto TCP (6), length 569)
    127.0.0.1.49160 > 127.0.0.1.10950: Flags [P.], cksum 0x002e (incorrect -> 0x3edc), seq 14:531, ack 13, win 512, options [nop,nop,TS val 305000243 ecr 305000236], length 517
2022-04-06 05:25:17.740104 IP (tos 0x0, ttl 64, id 58246, offset 0, flags [DF], proto TCP (6), length 52)
    127.0.0.1.10950 > 127.0.0.1.49160: Flags [.], cksum 0xfe28 (incorrect -> 0x1369), seq 13, ack 531, win 508, options [nop,nop,TS val 305000243 ecr 305000243], length 0
2022-04-06 05:25:17.984602 IP (tos 0x0, ttl 64, id 58247, offset 0, flags [DF], proto TCP (6), length 3538)
    127.0.0.1.10950 > 127.0.0.1.49160: Flags [P.], cksum 0x0bc7 (incorrect -> 0x3a99), seq 13:3499, ack 531, win 512, options [nop,nop,TS val 305000487 ecr 305000243], length 3486
2022-04-06 05:25:17.984614 IP (tos 0x0, ttl 64, id 31490, offset 0, flags [DF], proto TCP (6), length 52)
    127.0.0.1.49160 > 127.0.0.1.10950: Flags [.], cksum 0xfe28 (incorrect -> 0x03f1), seq 531, ack 3499, win 494, options [nop,nop,TS val 305000487 ecr 305000487], length 0
2022-04-06 05:25:18.047163 IP (tos 0x0, ttl 64, id 58248, offset 0, flags [DF], proto TCP (6), length 781)
    127.0.0.1.10950 > 127.0.0.1.49160: Flags [P.], cksum 0x0102 (incorrect -> 0x1b19), seq 3499:4228, ack 531, win 512, options [nop,nop,TS val 305000550 ecr 305000487], length 729
2022-04-06 05:25:18.047169 IP (tos 0x0, ttl 64, id 31491, offset 0, flags [DF], proto TCP (6), length 52)
    127.0.0.1.49160 > 127.0.0.1.10950: Flags [.], cksum 0xfe28 (incorrect -> 0x008f), seq 531, ack 4228, win 505, options [nop,nop,TS val 305000550 ecr 305000550], length 0
2022-04-06 05:25:18.047678 IP (tos 0x0, ttl 64, id 31492, offset 0, flags [DF], proto TCP (6), length 132)
    127.0.0.1.49160 > 127.0.0.1.10950: Flags [P.], cksum 0xfe78 (incorrect -> 0xb56b), seq 531:611, ack 4228, win 512, options [nop,nop,TS val 305000550 ecr 305000550], length 80
2022-04-06 05:25:18.047685 IP (tos 0x0, ttl 64, id 58249, offset 0, flags [DF], proto TCP (6), length 52)
    127.0.0.1.10950 > 127.0.0.1.49160: Flags [.], cksum 0xfe28 (incorrect -> 0x0038), seq 4228, ack 611, win 512, options [nop,nop,TS val 305000550 ecr 305000550], length 0
2022-04-06 05:25:18.048330 IP (tos 0x0, ttl 64, id 31493, offset 0, flags [DF], proto TCP (6), length 342)
    127.0.0.1.49160 > 127.0.0.1.10950: Flags [P.], cksum 0xff4a (incorrect -> 0xa2c8), seq 611:901, ack 4228, win 512, options [nop,nop,TS val 305000551 ecr 305000550], length 290
2022-04-06 05:25:18.048339 IP (tos 0x0, ttl 64, id 58250, offset 0, flags [DF], proto TCP (6), length 52)
    127.0.0.1.10950 > 127.0.0.1.49160: Flags [.], cksum 0xfe28 (incorrect -> 0xff15), seq 4228, ack 901, win 510, options [nop,nop,TS val 305000551 ecr 305000551], length 0
2022-04-06 05:25:18.270326 IP (tos 0x0, ttl 64, id 58251, offset 0, flags [DF], proto TCP (6), length 594)
    127.0.0.1.10950 > 127.0.0.1.49160: Flags [P.], cksum 0x0047 (incorrect -> 0xc84d), seq 4228:4770, ack 901, win 512, options [nop,nop,TS val 305000773 ecr 305000551], length 542
2022-04-06 05:25:18.270333 IP (tos 0x0, ttl 64, id 31494, offset 0, flags [DF], proto TCP (6), length 52)
    127.0.0.1.49160 > 127.0.0.1.10950: Flags [.], cksum 0xfe28 (incorrect -> 0xfb3d), seq 901, ack 4770, win 508, options [nop,nop,TS val 305000773 ecr 305000773], length 0
2022-04-06 05:25:18.371039 IP (tos 0x0, ttl 64, id 58252, offset 0, flags [DF], proto TCP (6), length 3538)
    127.0.0.1.10950 > 127.0.0.1.49160: Flags [P.], cksum 0x0bc7 (incorrect -> 0x140d), seq 4770:8256, ack 901, win 512, options [nop,nop,TS val 305000873 ecr 305000773], length 3486
2022-04-06 05:25:18.371047 IP (tos 0x0, ttl 64, id 31495, offset 0, flags [DF], proto TCP (6), length 52)
    127.0.0.1.49160 > 127.0.0.1.10950: Flags [.], cksum 0xfe28 (incorrect -> 0xece5), seq 901, ack 8256, win 494, options [nop,nop,TS val 305000873 ecr 305000873], length 0
2022-04-06 05:25:18.389500 IP (tos 0x0, ttl 64, id 58253, offset 0, flags [DF], proto TCP (6), length 2044)
    127.0.0.1.10950 > 127.0.0.1.49160: Flags [P.], cksum 0x05f1 (incorrect -> 0x3a1e), seq 8256:10248, ack 901, win 512, options [nop,nop,TS val 305000892 ecr 305000873], length 1992
2022-04-06 05:25:18.389506 IP (tos 0x0, ttl 64, id 31496, offset 0, flags [DF], proto TCP (6), length 52)
    127.0.0.1.49160 > 127.0.0.1.10950: Flags [.], cksum 0xfe28 (incorrect -> 0xe4f1), seq 901, ack 10248, win 500, options [nop,nop,TS val 305000892 ecr 305000892], length 0
2022-04-06 05:25:18.407471 IP (tos 0x0, ttl 64, id 58254, offset 0, flags [DF], proto TCP (6), length 3538)
    127.0.0.1.10950 > 127.0.0.1.49160: Flags [P.], cksum 0x0bc7 (incorrect -> 0xb168), seq 10248:13734, ack 901, win 512, options [nop,nop,TS val 305000910 ecr 305000892], length 3486
2022-04-06 05:25:18.407477 IP (tos 0x0, ttl 64, id 31497, offset 0, flags [DF], proto TCP (6), length 52)
    127.0.0.1.49160 > 127.0.0.1.10950: Flags [.], cksum 0xfe28 (incorrect -> 0xd735), seq 901, ack 13734, win 494, options [nop,nop,TS val 305000910 ecr 305000910], length 0
2022-04-06 05:25:18.425244 IP (tos 0x0, ttl 64, id 58255, offset 0, flags [DF], proto TCP (6), length 2542)
    127.0.0.1.10950 > 127.0.0.1.49160: Flags [P.], cksum 0x07e3 (incorrect -> 0x2fc6), seq 13734:16224, ack 901, win 512, options [nop,nop,TS val 305000928 ecr 305000910], length 2490
2022-04-06 05:25:18.425258 IP (tos 0x0, ttl 64, id 31498, offset 0, flags [DF], proto TCP (6), length 52)
    127.0.0.1.49160 > 127.0.0.1.10950: Flags [.], cksum 0xfe28 (incorrect -> 0xcd53), seq 901, ack 16224, win 498, options [nop,nop,TS val 305000928 ecr 305000928], length 0
2022-04-06 05:25:18.443381 IP (tos 0x0, ttl 64, id 58256, offset 0, flags [DF], proto TCP (6), length 2067)
    127.0.0.1.10950 > 127.0.0.1.49160: Flags [P.], cksum 0x0608 (incorrect -> 0x01be), seq 16224:18239, ack 901, win 512, options [nop,nop,TS val 305000946 ecr 305000928], length 2015
2022-04-06 05:25:18.443389 IP (tos 0x0, ttl 64, id 31499, offset 0, flags [DF], proto TCP (6), length 52)
    127.0.0.1.49160 > 127.0.0.1.10950: Flags [.], cksum 0xfe28 (incorrect -> 0xc54e), seq 901, ack 18239, win 500, options [nop,nop,TS val 305000946 ecr 305000946], length 0
2022-04-06 05:25:18.462427 IP (tos 0x0, ttl 64, id 58257, offset 0, flags [DF], proto TCP (6), length 2948)
    127.0.0.1.10950 > 127.0.0.1.49160: Flags [P.], cksum 0x0979 (incorrect -> 0xc616), seq 18239:21135, ack 901, win 512, options [nop,nop,TS val 305000965 ecr 305000946], length 2896
2022-04-06 05:25:18.462433 IP (tos 0x0, ttl 64, id 31500, offset 0, flags [DF], proto TCP (6), length 52)
    127.0.0.1.49160 > 127.0.0.1.10950: Flags [.], cksum 0xfe28 (incorrect -> 0xb9dc), seq 901, ack 21135, win 496, options [nop,nop,TS val 305000965 ecr 305000965], length 0
2022-04-06 05:25:18.479598 IP (tos 0x0, ttl 64, id 58258, offset 0, flags [DF], proto TCP (6), length 2948)
    127.0.0.1.10950 > 127.0.0.1.49160: Flags [P.], cksum 0x0979 (incorrect -> 0x881f), seq 21135:24031, ack 901, win 512, options [nop,nop,TS val 305000982 ecr 305000965], length 2896
2022-04-06 05:25:18.479608 IP (tos 0x0, ttl 64, id 31501, offset 0, flags [DF], proto TCP (6), length 52)
    127.0.0.1.49160 > 127.0.0.1.10950: Flags [.], cksum 0xfe28 (incorrect -> 0xae6a), seq 901, ack 24031, win 496, options [nop,nop,TS val 305000982 ecr 305000982], length 0
2022-04-06 05:25:18.497160 IP (tos 0x0, ttl 64, id 58259, offset 0, flags [DF], proto TCP (6), length 2948)
    127.0.0.1.10950 > 127.0.0.1.49160: Flags [P.], cksum 0x0979 (incorrect -> 0x62aa), seq 24031:26927, ack 901, win 512, options [nop,nop,TS val 305001000 ecr 305000982], length 2896
2022-04-06 05:25:18.497166 IP (tos 0x0, ttl 64, id 31502, offset 0, flags [DF], proto TCP (6), length 52)
    127.0.0.1.49160 > 127.0.0.1.10950: Flags [.], cksum 0xfe28 (incorrect -> 0xa2f6), seq 901, ack 26927, win 496, options [nop,nop,TS val 305001000 ecr 305001000], length 0
2022-04-06 05:25:18.519971 IP (tos 0x0, ttl 64, id 58260, offset 0, flags [DF], proto TCP (6), length 2948)
    127.0.0.1.10950 > 127.0.0.1.49160: Flags [P.], cksum 0x0979 (incorrect -> 0x7a75), seq 26927:29823, ack 901, win 512, options [nop,nop,TS val 305001022 ecr 305001000], length 2896
2022-04-06 05:25:18.519977 IP (tos 0x0, ttl 64, id 31503, offset 0, flags [DF], proto TCP (6), length 52)
    127.0.0.1.49160 > 127.0.0.1.10950: Flags [.], cksum 0xfe28 (incorrect -> 0x977a), seq 901, ack 29823, win 496, options [nop,nop,TS val 305001022 ecr 305001022], length 0
2022-04-06 05:25:18.535743 IP (tos 0x0, ttl 64, id 58261, offset 0, flags [DF], proto TCP (6), length 2948)
    127.0.0.1.10950 > 127.0.0.1.49160: Flags [P.], cksum 0x0979 (incorrect -> 0x8345), seq 29823:32719, ack 901, win 512, options [nop,nop,TS val 305001038 ecr 305001022], length 2896
2022-04-06 05:25:18.578652 IP (tos 0x0, ttl 64, id 31504, offset 0, flags [DF], proto TCP (6), length 52)
    127.0.0.1.49160 > 127.0.0.1.10950: Flags [.], cksum 0xfe28 (incorrect -> 0x8bcf), seq 901, ack 32719, win 512, options [nop,nop,TS val 305001081 ecr 305001038], length 0
2022-04-06 05:25:18.578659 IP (tos 0x0, ttl 64, id 58262, offset 0, flags [DF], proto TCP (6), length 8740)
    127.0.0.1.10950 > 127.0.0.1.49160: Flags [P.], cksum 0x2019 (incorrect -> 0x0eb9), seq 32719:41407, ack 901, win 512, options [nop,nop,TS val 305001081 ecr 305001081], length 8688
2022-04-06 05:25:18.622652 IP (tos 0x0, ttl 64, id 31505, offset 0, flags [DF], proto TCP (6), length 52)
    127.0.0.1.49160 > 127.0.0.1.10950: Flags [.], cksum 0xfe28 (incorrect -> 0x6988), seq 901, ack 41407, win 512, options [nop,nop,TS val 305001125 ecr 305001081], length 0
2022-04-06 05:25:18.622658 IP (tos 0x0, ttl 64, id 58263, offset 0, flags [DF], proto TCP (6), length 8740)
    127.0.0.1.10950 > 127.0.0.1.49160: Flags [P.], cksum 0x2019 (incorrect -> 0x9c2c), seq 41407:50095, ack 901, win 512, options [nop,nop,TS val 305001125 ecr 305001125], length 8688
2022-04-06 05:25:18.666655 IP (tos 0x0, ttl 64, id 31506, offset 0, flags [DF], proto TCP (6), length 52)
    127.0.0.1.49160 > 127.0.0.1.10950: Flags [.], cksum 0xfe28 (incorrect -> 0x4740), seq 901, ack 50095, win 512, options [nop,nop,TS val 305001169 ecr 305001125], length 0
2022-04-06 05:25:18.666661 IP (tos 0x0, ttl 64, id 58264, offset 0, flags [DF], proto TCP (6), length 2948)
    127.0.0.1.10950 > 127.0.0.1.49160: Flags [P.], cksum 0x0979 (incorrect -> 0x6a76), seq 50095:52991, ack 901, win 512, options [nop,nop,TS val 305001169 ecr 305001169], length 2896
2022-04-06 05:25:18.666677 IP (tos 0x0, ttl 64, id 31507, offset 0, flags [DF], proto TCP (6), length 52)
    127.0.0.1.49160 > 127.0.0.1.10950: Flags [.], cksum 0xfe28 (incorrect -> 0x3bc4), seq 901, ack 52991, win 512, options [nop,nop,TS val 305001169 ecr 305001169], length 0
2022-04-06 05:25:18.667678 IP (tos 0x0, ttl 64, id 58265, offset 0, flags [DF], proto TCP (6), length 4100)
    127.0.0.1.10950 > 127.0.0.1.49160: Flags [P.], cksum 0x0df9 (incorrect -> 0x2163), seq 52991:57039, ack 901, win 512, options [nop,nop,TS val 305001170 ecr 305001169], length 4048
2022-04-06 05:25:18.667708 IP (tos 0x0, ttl 64, id 31508, offset 0, flags [DF], proto TCP (6), length 52)
    127.0.0.1.49160 > 127.0.0.1.10950: Flags [.], cksum 0xfe28 (incorrect -> 0x2bf2), seq 901, ack 57039, win 512, options [nop,nop,TS val 305001170 ecr 305001170], length 0
2022-04-06 05:25:18.667712 IP (tos 0x0, ttl 64, id 58266, offset 0, flags [DF], proto TCP (6), length 1796)
    127.0.0.1.10950 > 127.0.0.1.49160: Flags [P.], cksum 0x04f9 (incorrect -> 0x5b48), seq 57039:58783, ack 901, win 512, options [nop,nop,TS val 305001170 ecr 305001170], length 1744
2022-04-06 05:25:18.667716 IP (tos 0x0, ttl 64, id 31509, offset 0, flags [DF], proto TCP (6), length 52)
    127.0.0.1.49160 > 127.0.0.1.10950: Flags [.], cksum 0xfe28 (incorrect -> 0x2522), seq 901, ack 58783, win 512, options [nop,nop,TS val 305001170 ecr 305001170], length 0
2022-04-06 05:25:18.679087 IP (tos 0x0, ttl 64, id 58267, offset 0, flags [DF], proto TCP (6), length 2948)
    127.0.0.1.10950 > 127.0.0.1.49160: Flags [P.], cksum 0x0979 (incorrect -> 0x8457), seq 58783:61679, ack 901, win 512, options [nop,nop,TS val 305001182 ecr 305001170], length 2896
2022-04-06 05:25:18.679102 IP (tos 0x0, ttl 64, id 31510, offset 0, flags [DF], proto TCP (6), length 52)
    127.0.0.1.49160 > 127.0.0.1.10950: Flags [.], cksum 0xfe28 (incorrect -> 0x19ba), seq 901, ack 61679, win 512, options [nop,nop,TS val 305001182 ecr 305001182], length 0
2022-04-06 05:25:18.682304 IP (tos 0x0, ttl 64, id 58268, offset 0, flags [DF], proto TCP (6), length 2948)
    127.0.0.1.10950 > 127.0.0.1.49160: Flags [P.], cksum 0x0979 (incorrect -> 0x5098), seq 61679:64575, ack 901, win 512, options [nop,nop,TS val 305001185 ecr 305001182], length 2896
2022-04-06 05:25:18.722656 IP (tos 0x0, ttl 64, id 31511, offset 0, flags [DF], proto TCP (6), length 52)
    127.0.0.1.49160 > 127.0.0.1.10950: Flags [.], cksum 0xfe28 (incorrect -> 0x0e3c), seq 901, ack 64575, win 512, options [nop,nop,TS val 305001225 ecr 305001185], length 0
2022-04-06 05:25:18.722664 IP (tos 0x0, ttl 64, id 58269, offset 0, flags [DF], proto TCP (6), length 11636)
    127.0.0.1.10950 > 127.0.0.1.49160: Flags [P.], cksum 0x2b69 (incorrect -> 0x0d4a), seq 64575:76159, ack 901, win 512, options [nop,nop,TS val 305001225 ecr 305001225], length 11584
2022-04-06 05:25:18.766663 IP (tos 0x0, ttl 64, id 31512, offset 0, flags [DF], proto TCP (6), length 52)
    127.0.0.1.49160 > 127.0.0.1.10950: Flags [.], cksum 0xfe28 (incorrect -> 0xe0a7), seq 901, ack 76159, win 512, options [nop,nop,TS val 305001269 ecr 305001225], length 0
2022-04-06 05:25:18.766671 IP (tos 0x0, ttl 64, id 58270, offset 0, flags [DF], proto TCP (6), length 14532)
    127.0.0.1.10950 > 127.0.0.1.49160: Flags [P.], cksum 0x36b9 (incorrect -> 0x8a9f), seq 76159:90639, ack 901, win 512, options [nop,nop,TS val 305001269 ecr 305001269], length 14480
2022-04-06 05:25:18.810654 IP (tos 0x0, ttl 64, id 31513, offset 0, flags [DF], proto TCP (6), length 52)
    127.0.0.1.49160 > 127.0.0.1.10950: Flags [.], cksum 0xfe28 (incorrect -> 0xa7bf), seq 901, ack 90639, win 512, options [nop,nop,TS val 305001313 ecr 305001269], length 0
2022-04-06 05:25:18.810663 IP (tos 0x0, ttl 64, id 58271, offset 0, flags [DF], proto TCP (6), length 17022)
    127.0.0.1.10950 > 127.0.0.1.49160: Flags [P.], cksum 0x4073 (incorrect -> 0x99a6), seq 90639:107609, ack 901, win 512, options [nop,nop,TS val 305001313 ecr 305001313], length 16970
2022-04-06 05:25:18.854655 IP (tos 0x0, ttl 64, id 31514, offset 0, flags [DF], proto TCP (6), length 52)
    127.0.0.1.49160 > 127.0.0.1.10950: Flags [.], cksum 0xfe28 (incorrect -> 0x651d), seq 901, ack 107609, win 512, options [nop,nop,TS val 305001357 ecr 305001313], length 0
2022-04-06 05:25:18.854666 IP (tos 0x0, ttl 64, id 58272, offset 0, flags [DF], proto TCP (6), length 19826)
    127.0.0.1.10950 > 127.0.0.1.49160: Flags [P.], cksum 0x4b67 (incorrect -> 0x62b4), seq 107609:127383, ack 901, win 512, options [nop,nop,TS val 305001357 ecr 305001357], length 19774
2022-04-06 05:25:18.898654 IP (tos 0x0, ttl 64, id 31515, offset 0, flags [DF], proto TCP (6), length 52)
    127.0.0.1.49160 > 127.0.0.1.10950: Flags [.], cksum 0xfe28 (incorrect -> 0x1787), seq 901, ack 127383, win 512, options [nop,nop,TS val 305001401 ecr 305001357], length 0
2022-04-06 05:25:18.898665 IP (tos 0x0, ttl 64, id 58273, offset 0, flags [DF], proto TCP (6), length 26116)
    127.0.0.1.10950 > 127.0.0.1.49160: Flags [P.], cksum 0x63f9 (incorrect -> 0x95e3), seq 127383:153447, ack 901, win 512, options [nop,nop,TS val 305001401 ecr 305001401], length 26064
2022-04-06 05:25:18.942686 IP (tos 0x0, ttl 64, id 31516, offset 0, flags [DF], proto TCP (6), length 52)
    127.0.0.1.49160 > 127.0.0.1.10950: Flags [.], cksum 0xfe28 (incorrect -> 0xb15e), seq 901, ack 153447, win 512, options [nop,nop,TS val 305001445 ecr 305001401], length 0
2022-04-06 05:25:18.942697 IP (tos 0x0, ttl 64, id 58274, offset 0, flags [DF], proto TCP (6), length 27518)
    127.0.0.1.10950 > 127.0.0.1.49160: Flags [P.], cksum 0x6973 (incorrect -> 0xa27e), seq 153447:180913, ack 901, win 512, options [nop,nop,TS val 305001445 ecr 305001445], length 27466
2022-04-06 05:25:18.986656 IP (tos 0x0, ttl 64, id 31517, offset 0, flags [DF], proto TCP (6), length 52)
    127.0.0.1.49160 > 127.0.0.1.10950: Flags [.], cksum 0xfe28 (incorrect -> 0x45bc), seq 901, ack 180913, win 512, options [nop,nop,TS val 305001489 ecr 305001445], length 0
200, 7.908512830734253, 1.4830677509307861