2022-04-06 21:53:53.139718 IP (tos 0x0, ttl 64, id 28363, offset 0, flags [DF], proto TCP (6), length 60)
    127.0.0.1.41156 > 127.0.0.1.10250: Flags [S], cksum 0xfe30 (incorrect -> 0x565d), seq 1688908410, win 65495, options [mss 65495,sackOK,TS val 364315642 ecr 0,nop,wscale 7], length 0
2022-04-06 21:53:53.139729 IP (tos 0x0, ttl 64, id 0, offset 0, flags [DF], proto TCP (6), length 60)
    127.0.0.1.10250 > 127.0.0.1.41156: Flags [S.], cksum 0xfe30 (incorrect -> 0x5c0c), seq 1802269998, ack 1688908411, win 65483, options [mss 65495,sackOK,TS val 364315642 ecr 364315642,nop,wscale 7], length 0
2022-04-06 21:53:53.139739 IP (tos 0x0, ttl 64, id 28364, offset 0, flags [DF], proto TCP (6), length 52)
    127.0.0.1.41156 > 127.0.0.1.10250: Flags [.], cksum 0xfe28 (incorrect -> 0x82c8), seq 1, ack 1, win 512, options [nop,nop,TS val 364315642 ecr 364315642], length 0
2022-04-06 21:53:53.139905 IP (tos 0x0, ttl 64, id 28365, offset 0, flags [DF], proto TCP (6), length 55)
    127.0.0.1.41156 > 127.0.0.1.10250: Flags [P.], cksum 0xfe2b (incorrect -> 0x7dbc), seq 1:4, ack 1, win 512, options [nop,nop,TS val 364315642 ecr 364315642], length 3
2022-04-06 21:53:53.139911 IP (tos 0x0, ttl 64, id 54656, offset 0, flags [DF], proto TCP (6), length 52)
    127.0.0.1.10250 > 127.0.0.1.41156: Flags [.], cksum 0xfe28 (incorrect -> 0x82c5), seq 1, ack 4, win 512, options [nop,nop,TS val 364315642 ecr 364315642], length 0
2022-04-06 21:53:53.139936 IP (tos 0x0, ttl 64, id 54657, offset 0, flags [DF], proto TCP (6), length 54)
    127.0.0.1.10250 > 127.0.0.1.41156: Flags [P.], cksum 0xfe2a (incorrect -> 0x7dbb), seq 1:3, ack 4, win 512, options [nop,nop,TS val 364315642 ecr 364315642], length 2
2022-04-06 21:53:53.139943 IP (tos 0x0, ttl 64, id 28366, offset 0, flags [DF], proto TCP (6), length 52)
    127.0.0.1.41156 > 127.0.0.1.10250: Flags [.], cksum 0xfe28 (incorrect -> 0x82c3), seq 4, ack 3, win 512, options [nop,nop,TS val 364315642 ecr 364315642], length 0
2022-04-06 21:53:53.163134 IP (tos 0x0, ttl 64, id 28367, offset 0, flags [DF], proto TCP (6), length 62)
    127.0.0.1.41156 > 127.0.0.1.10250: Flags [P.], cksum 0xfe32 (incorrect -> 0x91a1), seq 4:14, ack 3, win 512, options [nop,nop,TS val 364315666 ecr 364315642], length 10
2022-04-06 21:53:53.163145 IP (tos 0x0, ttl 64, id 54658, offset 0, flags [DF], proto TCP (6), length 52)
    127.0.0.1.10250 > 127.0.0.1.41156: Flags [.], cksum 0xfe28 (incorrect -> 0x8289), seq 3, ack 14, win 512, options [nop,nop,TS val 364315666 ecr 364315666], length 0
403, 5.9938390254974365, 0.683222770690918