2022-04-06 05:01:17.638881 IP (tos 0x0, ttl 64, id 3913, offset 0, flags [DF], proto TCP (6), length 60)
    127.0.0.1.47564 > 127.0.0.1.9650: Flags [S], cksum 0xfe30 (incorrect -> 0xc3d6), seq 1488145428, win 65495, options [mss 65495,sackOK,TS val 303560141 ecr 0,nop,wscale 7], length 0
2022-04-06 05:01:17.638892 IP (tos 0x0, ttl 64, id 0, offset 0, flags [DF], proto TCP (6), length 60)
    127.0.0.1.9650 > 127.0.0.1.47564: Flags [S.], cksum 0xfe30 (incorrect -> 0xae24), seq 603711948, ack 1488145429, win 65483, options [mss 65495,sackOK,TS val 303560141 ecr 303560141,nop,wscale 7], length 0
2022-04-06 05:01:17.638901 IP (tos 0x0, ttl 64, id 3914, offset 0, flags [DF], proto TCP (6), length 52)
    127.0.0.1.47564 > 127.0.0.1.9650: Flags [.], cksum 0xfe28 (incorrect -> 0xd4e0), seq 1, ack 1, win 512, options [nop,nop,TS val 303560141 ecr 303560141], length 0
2022-04-06 05:01:17.638995 IP (tos 0x0, ttl 64, id 3915, offset 0, flags [DF], proto TCP (6), length 55)
    127.0.0.1.47564 > 127.0.0.1.9650: Flags [P.], cksum 0xfe2b (incorrect -> 0xcfd4), seq 1:4, ack 1, win 512, options [nop,nop,TS val 303560141 ecr 303560141], length 3
2022-04-06 05:01:17.639009 IP (tos 0x0, ttl 64, id 59747, offset 0, flags [DF], proto TCP (6), length 52)
    127.0.0.1.9650 > 127.0.0.1.47564: Flags [.], cksum 0xfe28 (incorrect -> 0xd4dd), seq 1, ack 4, win 512, options [nop,nop,TS val 303560141 ecr 303560141], length 0
2022-04-06 05:01:17.639110 IP (tos 0x0, ttl 64, id 59748, offset 0, flags [DF], proto TCP (6), length 54)
    127.0.0.1.9650 > 127.0.0.1.47564: Flags [P.], cksum 0xfe2a (incorrect -> 0xcfd3), seq 1:3, ack 4, win 512, options [nop,nop,TS val 303560141 ecr 303560141], length 2
2022-04-06 05:01:17.639137 IP (tos 0x0, ttl 64, id 3916, offset 0, flags [DF], proto TCP (6), length 52)
    127.0.0.1.47564 > 127.0.0.1.9650: Flags [.], cksum 0xfe28 (incorrect -> 0xd4da), seq 4, ack 3, win 512, options [nop,nop,TS val 303560142 ecr 303560141], length 0
2022-04-06 05:01:17.640784 IP (tos 0x0, ttl 64, id 3917, offset 0, flags [DF], proto TCP (6), length 62)
    127.0.0.1.47564 > 127.0.0.1.9650: Flags [P.], cksum 0xfe32 (incorrect -> 0x4ea1), seq 4:14, ack 3, win 512, options [nop,nop,TS val 303560143 ecr 303560141], length 10
2022-04-06 05:01:17.640801 IP (tos 0x0, ttl 64, id 59749, offset 0, flags [DF], proto TCP (6), length 52)
    127.0.0.1.9650 > 127.0.0.1.47564: Flags [.], cksum 0xfe28 (incorrect -> 0xd4cd), seq 3, ack 14, win 512, options [nop,nop,TS val 303560143 ecr 303560143], length 0
2022-04-06 05:01:17.706579 IP (tos 0x0, ttl 64, id 59750, offset 0, flags [DF], proto TCP (6), length 62)
    127.0.0.1.9650 > 127.0.0.1.47564: Flags [P.], cksum 0xfe32 (incorrect -> 0xcf78), seq 3:13, ack 14, win 512, options [nop,nop,TS val 303560209 ecr 303560143], length 10
2022-04-06 05:01:17.706596 IP (tos 0x0, ttl 64, id 3918, offset 0, flags [DF], proto TCP (6), length 52)
    127.0.0.1.47564 > 127.0.0.1.9650: Flags [.], cksum 0xfe28 (incorrect -> 0xd43f), seq 14, ack 13, win 512, options [nop,nop,TS val 303560209 ecr 303560209], length 0
2022-04-06 05:01:17.712737 IP (tos 0x0, ttl 64, id 3919, offset 0, flags [DF], proto TCP (6), length 569)
    127.0.0.1.47564 > 127.0.0.1.9650: Flags [P.], cksum 0x002e (incorrect -> 0x38bf), seq 14:531, ack 13, win 512, options [nop,nop,TS val 303560215 ecr 303560209], length 517
2022-04-06 05:01:17.712750 IP (tos 0x0, ttl 64, id 59751, offset 0, flags [DF], proto TCP (6), length 52)
    127.0.0.1.9650 > 127.0.0.1.47564: Flags [.], cksum 0xfe28 (incorrect -> 0xd232), seq 13, ack 531, win 508, options [nop,nop,TS val 303560215 ecr 303560215], length 0
200, 3.676222085952759, 0.8733203411102295