2022-04-06 01:42:32.974870 IP (tos 0x0, ttl 64, id 46119, offset 0, flags [DF], proto TCP (6), length 60)
    127.0.0.1.38712 > 127.0.0.1.11950: Flags [S], cksum 0xfe30 (incorrect -> 0x2b5d), seq 875567127, win 65495, options [mss 65495,sackOK,TS val 291635477 ecr 0,nop,wscale 7], length 0
2022-04-06 01:42:32.974884 IP (tos 0x0, ttl 64, id 0, offset 0, flags [DF], proto TCP (6), length 60)
    127.0.0.1.11950 > 127.0.0.1.38712: Flags [S.], cksum 0xfe30 (incorrect -> 0xaabd), seq 3916924075, ack 875567128, win 65483, options [mss 65495,sackOK,TS val 291635477 ecr 291635477,nop,wscale 7], length 0
2022-04-06 01:42:32.974896 IP (tos 0x0, ttl 64, id 46120, offset 0, flags [DF], proto TCP (6), length 52)
    127.0.0.1.38712 > 127.0.0.1.11950: Flags [.], cksum 0xfe28 (incorrect -> 0xd179), seq 1, ack 1, win 512, options [nop,nop,TS val 291635477 ecr 291635477], length 0
2022-04-06 01:42:32.974984 IP (tos 0x0, ttl 64, id 46121, offset 0, flags [DF], proto TCP (6), length 55)
    127.0.0.1.38712 > 127.0.0.1.11950: Flags [P.], cksum 0xfe2b (incorrect -> 0xcc6d), seq 1:4, ack 1, win 512, options [nop,nop,TS val 291635477 ecr 291635477], length 3
2022-04-06 01:42:32.974990 IP (tos 0x0, ttl 64, id 55755, offset 0, flags [DF], proto TCP (6), length 52)
    127.0.0.1.11950 > 127.0.0.1.38712: Flags [.], cksum 0xfe28 (incorrect -> 0xd176), seq 1, ack 4, win 512, options [nop,nop,TS val 291635477 ecr 291635477], length 0
2022-04-06 01:42:32.975059 IP (tos 0x0, ttl 64, id 55756, offset 0, flags [DF], proto TCP (6), length 54)
    127.0.0.1.11950 > 127.0.0.1.38712: Flags [P.], cksum 0xfe2a (incorrect -> 0xcc6c), seq 1:3, ack 4, win 512, options [nop,nop,TS val 291635477 ecr 291635477], length 2
2022-04-06 01:42:32.975067 IP (tos 0x0, ttl 64, id 46122, offset 0, flags [DF], proto TCP (6), length 52)
    127.0.0.1.38712 > 127.0.0.1.11950: Flags [.], cksum 0xfe28 (incorrect -> 0xd173), seq 4, ack 3, win 512, options [nop,nop,TS val 291635478 ecr 291635477], length 0
2022-04-06 01:42:32.994829 IP (tos 0x0, ttl 64, id 46123, offset 0, flags [DF], proto TCP (6), length 62)
    127.0.0.1.38712 > 127.0.0.1.11950: Flags [P.], cksum 0xfe32 (incorrect -> 0x1d89), seq 4:14, ack 3, win 512, options [nop,nop,TS val 291635497 ecr 291635477], length 10
2022-04-06 01:42:32.994853 IP (tos 0x0, ttl 64, id 55757, offset 0, flags [DF], proto TCP (6), length 52)
    127.0.0.1.11950 > 127.0.0.1.38712: Flags [.], cksum 0xfe28 (incorrect -> 0xd142), seq 3, ack 14, win 512, options [nop,nop,TS val 291635497 ecr 291635497], length 0
2022-04-06 01:42:33.146141 IP (tos 0x0, ttl 64, id 55758, offset 0, flags [DF], proto TCP (6), length 62)
    127.0.0.1.11950 > 127.0.0.1.38712: Flags [P.], cksum 0xfe32 (incorrect -> 0xcb97), seq 3:13, ack 14, win 512, options [nop,nop,TS val 291635649 ecr 291635497], length 10
2022-04-06 01:42:33.146151 IP (tos 0x0, ttl 64, id 46124, offset 0, flags [DF], proto TCP (6), length 52)
    127.0.0.1.38712 > 127.0.0.1.11950: Flags [.], cksum 0xfe28 (incorrect -> 0xd008), seq 14, ack 13, win 512, options [nop,nop,TS val 291635649 ecr 291635649], length 0
2022-04-06 01:42:33.151607 IP (tos 0x0, ttl 64, id 46125, offset 0, flags [DF], proto TCP (6), length 569)
    127.0.0.1.38712 > 127.0.0.1.11950: Flags [P.], cksum 0x002e (incorrect -> 0x4c80), seq 14:531, ack 13, win 512, options [nop,nop,TS val 291635654 ecr 291635649], length 517
2022-04-06 01:42:33.151617 IP (tos 0x0, ttl 64, id 55759, offset 0, flags [DF], proto TCP (6), length 52)
    127.0.0.1.11950 > 127.0.0.1.38712: Flags [.], cksum 0xfe28 (incorrect -> 0xcdfd), seq 13, ack 531, win 508, options [nop,nop,TS val 291635654 ecr 291635654], length 0
2022-04-06 01:42:33.291235 IP (tos 0x0, ttl 64, id 55760, offset 0, flags [DF], proto TCP (6), length 3492)
    127.0.0.1.11950 > 127.0.0.1.38712: Flags [P.], cksum 0x0b99 (incorrect -> 0x2bf9), seq 13:3453, ack 531, win 512, options [nop,nop,TS val 291635794 ecr 291635654], length 3440
2022-04-06 01:42:33.291245 IP (tos 0x0, ttl 64, id 46126, offset 0, flags [DF], proto TCP (6), length 52)
    127.0.0.1.38712 > 127.0.0.1.11950: Flags [.], cksum 0xfe28 (incorrect -> 0xbf83), seq 531, ack 3453, win 494, options [nop,nop,TS val 291635794 ecr 291635794], length 0
2022-04-06 01:42:33.305403 IP (tos 0x0, ttl 64, id 55761, offset 0, flags [DF], proto TCP (6), length 708)
    127.0.0.1.11950 > 127.0.0.1.38712: Flags [P.], cksum 0x00b9 (incorrect -> 0x80ba), seq 3453:4109, ack 531, win 512, options [nop,nop,TS val 291635808 ecr 291635794], length 656
2022-04-06 01:42:33.305411 IP (tos 0x0, ttl 64, id 46127, offset 0, flags [DF], proto TCP (6), length 52)
    127.0.0.1.38712 > 127.0.0.1.11950: Flags [.], cksum 0xfe28 (incorrect -> 0xbccc), seq 531, ack 4109, win 505, options [nop,nop,TS val 291635808 ecr 291635808], length 0
2022-04-06 01:42:33.321594 IP (tos 0x0, ttl 64, id 55762, offset 0, flags [DF], proto TCP (6), length 1922)
    127.0.0.1.11950 > 127.0.0.1.38712: Flags [P.], cksum 0x0577 (incorrect -> 0xe909), seq 4109:5979, ack 531, win 512, options [nop,nop,TS val 291635824 ecr 291635808], length 1870
2022-04-06 01:42:33.321602 IP (tos 0x0, ttl 64, id 46128, offset 0, flags [DF], proto TCP (6), length 52)
    127.0.0.1.38712 > 127.0.0.1.11950: Flags [.], cksum 0xfe28 (incorrect -> 0xb563), seq 531, ack 5979, win 500, options [nop,nop,TS val 291635824 ecr 291635824], length 0
2022-04-06 01:42:33.322037 IP (tos 0x0, ttl 64, id 46129, offset 0, flags [DF], proto TCP (6), length 132)
    127.0.0.1.38712 > 127.0.0.1.11950: Flags [P.], cksum 0xfe78 (incorrect -> 0xb220), seq 531:611, ack 5979, win 512, options [nop,nop,TS val 291635824 ecr 291635824], length 80
2022-04-06 01:42:33.322047 IP (tos 0x0, ttl 64, id 55763, offset 0, flags [DF], proto TCP (6), length 52)
    127.0.0.1.11950 > 127.0.0.1.38712: Flags [.], cksum 0xfe28 (incorrect -> 0xb507), seq 5979, ack 611, win 512, options [nop,nop,TS val 291635824 ecr 291635824], length 0
2022-04-06 01:42:33.322352 IP (tos 0x0, ttl 64, id 46130, offset 0, flags [DF], proto TCP (6), length 295)
    127.0.0.1.38712 > 127.0.0.1.11950: Flags [P.], cksum 0xff1b (incorrect -> 0x346f), seq 611:854, ack 5979, win 512, options [nop,nop,TS val 291635825 ecr 291635824], length 243
2022-04-06 01:42:33.322361 IP (tos 0x0, ttl 64, id 55764, offset 0, flags [DF], proto TCP (6), length 52)
    127.0.0.1.11950 > 127.0.0.1.38712: Flags [.], cksum 0xfe28 (incorrect -> 0xb413), seq 5979, ack 854, win 511, options [nop,nop,TS val 291635825 ecr 291635825], length 0
2022-04-06 01:42:33.470407 IP (tos 0x0, ttl 64, id 55765, offset 0, flags [DF], proto TCP (6), length 339)
    127.0.0.1.11950 > 127.0.0.1.38712: Flags [P.], cksum 0xff47 (incorrect -> 0x92e2), seq 5979:6266, ack 854, win 512, options [nop,nop,TS val 291635973 ecr 291635825], length 287
2022-04-06 01:42:33.470417 IP (tos 0x0, ttl 64, id 46131, offset 0, flags [DF], proto TCP (6), length 52)
    127.0.0.1.38712 > 127.0.0.1.11950: Flags [.], cksum 0xfe28 (incorrect -> 0xb1cd), seq 854, ack 6266, win 510, options [nop,nop,TS val 291635973 ecr 291635973], length 0
2022-04-06 01:42:33.521917 IP (tos 0x0, ttl 64, id 55766, offset 0, flags [DF], proto TCP (6), length 339)
    127.0.0.1.11950 > 127.0.0.1.38712: Flags [P.], cksum 0xff47 (incorrect -> 0x9993), seq 6266:6553, ack 854, win 512, options [nop,nop,TS val 291636024 ecr 291635973], length 287
2022-04-06 01:42:33.521925 IP (tos 0x0, ttl 64, id 46132, offset 0, flags [DF], proto TCP (6), length 52)
    127.0.0.1.38712 > 127.0.0.1.11950: Flags [.], cksum 0xfe28 (incorrect -> 0xb04a), seq 854, ack 6553, win 508, options [nop,nop,TS val 291636024 ecr 291636024], length 0
2022-04-06 01:42:33.572350 IP (tos 0x0, ttl 64, id 55767, offset 0, flags [DF], proto TCP (6), length 435)
    127.0.0.1.11950 > 127.0.0.1.38712: Flags [P.], cksum 0xffa7 (incorrect -> 0x85e6), seq 6553:6936, ack 854, win 512, options [nop,nop,TS val 291636075 ecr 291636024], length 383
2022-04-06 01:42:33.572365 IP (tos 0x0, ttl 64, id 46133, offset 0, flags [DF], proto TCP (6), length 52)
    127.0.0.1.38712 > 127.0.0.1.11950: Flags [.], cksum 0xfe28 (incorrect -> 0xae67), seq 854, ack 6936, win 506, options [nop,nop,TS val 291636075 ecr 291636075], length 0
2022-04-06 01:42:33.574291 IP (tos 0x0, ttl 64, id 37106, offset 0, flags [DF], proto TCP (6), length 60)
    127.0.0.1.38714 > 127.0.0.1.11950: Flags [S], cksum 0xfe30 (incorrect -> 0x8b00), seq 3449494702, win 65495, options [mss 65495,sackOK,TS val 291636077 ecr 0,nop,wscale 7], length 0
2022-04-06 01:42:33.574300 IP (tos 0x0, ttl 64, id 0, offset 0, flags [DF], proto TCP (6), length 60)
    127.0.0.1.11950 > 127.0.0.1.38714: Flags [S.], cksum 0xfe30 (incorrect -> 0x10b6), seq 736115094, ack 3449494703, win 65483, options [mss 65495,sackOK,TS val 291636077 ecr 291636077,nop,wscale 7], length 0
2022-04-06 01:42:33.574308 IP (tos 0x0, ttl 64, id 37107, offset 0, flags [DF], proto TCP (6), length 52)
    127.0.0.1.38714 > 127.0.0.1.11950: Flags [.], cksum 0xfe28 (incorrect -> 0x3772), seq 1, ack 1, win 512, options [nop,nop,TS val 291636077 ecr 291636077], length 0
2022-04-06 01:42:33.574380 IP (tos 0x0, ttl 64, id 37108, offset 0, flags [DF], proto TCP (6), length 55)
    127.0.0.1.38714 > 127.0.0.1.11950: Flags [P.], cksum 0xfe2b (incorrect -> 0x3266), seq 1:4, ack 1, win 512, options [nop,nop,TS val 291636077 ecr 291636077], length 3
2022-04-06 01:42:33.574387 IP (tos 0x0, ttl 64, id 62459, offset 0, flags [DF], proto TCP (6), length 52)
    127.0.0.1.11950 > 127.0.0.1.38714: Flags [.], cksum 0xfe28 (incorrect -> 0x376f), seq 1, ack 4, win 512, options [nop,nop,TS val 291636077 ecr 291636077], length 0
2022-04-06 01:42:33.574406 IP (tos 0x0, ttl 64, id 62460, offset 0, flags [DF], proto TCP (6), length 54)
    127.0.0.1.11950 > 127.0.0.1.38714: Flags [P.], cksum 0xfe2a (incorrect -> 0x3265), seq 1:3, ack 4, win 512, options [nop,nop,TS val 291636077 ecr 291636077], length 2
2022-04-06 01:42:33.574414 IP (tos 0x0, ttl 64, id 37109, offset 0, flags [DF], proto TCP (6), length 52)
    127.0.0.1.38714 > 127.0.0.1.11950: Flags [.], cksum 0xfe28 (incorrect -> 0x376d), seq 4, ack 3, win 512, options [nop,nop,TS val 291636077 ecr 291636077], length 0
2022-04-06 01:42:33.575577 IP (tos 0x0, ttl 64, id 37110, offset 0, flags [DF], proto TCP (6), length 62)
    127.0.0.1.38714 > 127.0.0.1.11950: Flags [P.], cksum 0xfe32 (incorrect -> 0x8394), seq 4:14, ack 3, win 512, options [nop,nop,TS val 291636078 ecr 291636077], length 10
2022-04-06 01:42:33.575587 IP (tos 0x0, ttl 64, id 62461, offset 0, flags [DF], proto TCP (6), length 52)
    127.0.0.1.11950 > 127.0.0.1.38714: Flags [.], cksum 0xfe28 (incorrect -> 0x3761), seq 3, ack 14, win 512, options [nop,nop,TS val 291636078 ecr 291636078], length 0
2022-04-06 01:42:33.752800 IP (tos 0x0, ttl 64, id 62462, offset 0, flags [DF], proto TCP (6), length 62)
    127.0.0.1.11950 > 127.0.0.1.38714: Flags [P.], cksum 0xfe32 (incorrect -> 0x319d), seq 3:13, ack 14, win 512, options [nop,nop,TS val 291636255 ecr 291636078], length 10
2022-04-06 01:42:33.752815 IP (tos 0x0, ttl 64, id 37111, offset 0, flags [DF], proto TCP (6), length 52)
    127.0.0.1.38714 > 127.0.0.1.11950: Flags [.], cksum 0xfe28 (incorrect -> 0x35f5), seq 14, ack 13, win 512, options [nop,nop,TS val 291636255 ecr 291636255], length 0
2022-04-06 01:42:33.758049 IP (tos 0x0, ttl 64, id 37112, offset 0, flags [DF], proto TCP (6), length 569)
    127.0.0.1.38714 > 127.0.0.1.11950: Flags [P.], cksum 0x002e (incorrect -> 0xde6e), seq 14:531, ack 13, win 512, options [nop,nop,TS val 291636260 ecr 291636255], length 517
2022-04-06 01:42:33.758058 IP (tos 0x0, ttl 64, id 62463, offset 0, flags [DF], proto TCP (6), length 52)
    127.0.0.1.11950 > 127.0.0.1.38714: Flags [.], cksum 0xfe28 (incorrect -> 0x33ea), seq 13, ack 531, win 508, options [nop,nop,TS val 291636260 ecr 291636260], length 0
2022-04-06 01:42:33.899921 IP (tos 0x0, ttl 64, id 62464, offset 0, flags [DF], proto TCP (6), length 3538)
    127.0.0.1.11950 > 127.0.0.1.38714: Flags [P.], cksum 0x0bc7 (incorrect -> 0x5be2), seq 13:3499, ack 531, win 512, options [nop,nop,TS val 291636402 ecr 291636260], length 3486
2022-04-06 01:42:33.899931 IP (tos 0x0, ttl 64, id 37113, offset 0, flags [DF], proto TCP (6), length 52)
    127.0.0.1.38714 > 127.0.0.1.11950: Flags [.], cksum 0xfe28 (incorrect -> 0x253e), seq 531, ack 3499, win 494, options [nop,nop,TS val 291636402 ecr 291636402], length 0
2022-04-06 01:42:33.913921 IP (tos 0x0, ttl 64, id 62465, offset 0, flags [DF], proto TCP (6), length 662)
    127.0.0.1.11950 > 127.0.0.1.38714: Flags [P.], cksum 0x008b (incorrect -> 0x3b91), seq 3499:4109, ack 531, win 512, options [nop,nop,TS val 291636416 ecr 291636402], length 610
2022-04-06 01:42:33.913929 IP (tos 0x0, ttl 64, id 37114, offset 0, flags [DF], proto TCP (6), length 52)
    127.0.0.1.38714 > 127.0.0.1.11950: Flags [.], cksum 0xfe28 (incorrect -> 0x22b5), seq 531, ack 4109, win 505, options [nop,nop,TS val 291636416 ecr 291636416], length 0
2022-04-06 01:42:33.968674 IP (tos 0x0, ttl 64, id 62466, offset 0, flags [DF], proto TCP (6), length 1922)
    127.0.0.1.11950 > 127.0.0.1.38714: Flags [P.], cksum 0x0577 (incorrect -> 0x5d16), seq 4109:5979, ack 531, win 512, options [nop,nop,TS val 291636471 ecr 291636416], length 1870
2022-04-06 01:42:33.968683 IP (tos 0x0, ttl 64, id 37115, offset 0, flags [DF], proto TCP (6), length 52)
    127.0.0.1.38714 > 127.0.0.1.11950: Flags [.], cksum 0xfe28 (incorrect -> 0x1afe), seq 531, ack 5979, win 500, options [nop,nop,TS val 291636471 ecr 291636471], length 0
2022-04-06 01:42:33.969173 IP (tos 0x0, ttl 64, id 37116, offset 0, flags [DF], proto TCP (6), length 132)
    127.0.0.1.38714 > 127.0.0.1.11950: Flags [P.], cksum 0xfe78 (incorrect -> 0x4cb5), seq 531:611, ack 5979, win 512, options [nop,nop,TS val 291636472 ecr 291636471], length 80
2022-04-06 01:42:33.969182 IP (tos 0x0, ttl 64, id 62467, offset 0, flags [DF], proto TCP (6), length 52)
    127.0.0.1.11950 > 127.0.0.1.38714: Flags [.], cksum 0xfe28 (incorrect -> 0x1aa0), seq 5979, ack 611, win 512, options [nop,nop,TS val 291636472 ecr 291636472], length 0
2022-04-06 01:42:33.969477 IP (tos 0x0, ttl 64, id 37117, offset 0, flags [DF], proto TCP (6), length 291)
    127.0.0.1.38714 > 127.0.0.1.11950: Flags [P.], cksum 0xff17 (incorrect -> 0xebf3), seq 611:850, ack 5979, win 512, options [nop,nop,TS val 291636472 ecr 291636472], length 239
2022-04-06 01:42:33.969486 IP (tos 0x0, ttl 64, id 62468, offset 0, flags [DF], proto TCP (6), length 52)
    127.0.0.1.11950 > 127.0.0.1.38714: Flags [.], cksum 0xfe28 (incorrect -> 0x19b2), seq 5979, ack 850, win 511, options [nop,nop,TS val 291636472 ecr 291636472], length 0
2022-04-06 01:42:34.106531 IP (tos 0x0, ttl 64, id 62469, offset 0, flags [DF], proto TCP (6), length 626)
    127.0.0.1.11950 > 127.0.0.1.38714: Flags [P.], cksum 0x0067 (incorrect -> 0x67c3), seq 5979:6553, ack 850, win 512, options [nop,nop,TS val 291636609 ecr 291636472], length 574
2022-04-06 01:42:34.106541 IP (tos 0x0, ttl 64, id 37118, offset 0, flags [DF], proto TCP (6), length 52)
    127.0.0.1.38714 > 127.0.0.1.11950: Flags [.], cksum 0xfe28 (incorrect -> 0x1665), seq 850, ack 6553, win 508, options [nop,nop,TS val 291636609 ecr 291636609], length 0
200, 3.676820755004883, 1.3501055240631104