2022-04-06 20:28:13.699083 IP (tos 0x0, ttl 64, id 60127, offset 0, flags [DF], proto TCP (6), length 60)
    127.0.0.1.57170 > 127.0.0.1.12150: Flags [S], cksum 0xfe30 (incorrect -> 0x0881), seq 2325151918, win 65495, options [mss 65495,sackOK,TS val 359176202 ecr 0,nop,wscale 7], length 0
2022-04-06 20:28:13.699094 IP (tos 0x0, ttl 64, id 0, offset 0, flags [DF], proto TCP (6), length 60)
    127.0.0.1.12150 > 127.0.0.1.57170: Flags [S.], cksum 0xfe30 (incorrect -> 0x6072), seq 4152361750, ack 2325151919, win 65483, options [mss 65495,sackOK,TS val 359176202 ecr 359176202,nop,wscale 7], length 0
2022-04-06 20:28:13.699102 IP (tos 0x0, ttl 64, id 60128, offset 0, flags [DF], proto TCP (6), length 52)
    127.0.0.1.57170 > 127.0.0.1.12150: Flags [.], cksum 0xfe28 (incorrect -> 0x872e), seq 1, ack 1, win 512, options [nop,nop,TS val 359176202 ecr 359176202], length 0
2022-04-06 20:28:13.699243 IP (tos 0x0, ttl 64, id 60129, offset 0, flags [DF], proto TCP (6), length 55)
    127.0.0.1.57170 > 127.0.0.1.12150: Flags [P.], cksum 0xfe2b (incorrect -> 0x8222), seq 1:4, ack 1, win 512, options [nop,nop,TS val 359176202 ecr 359176202], length 3
2022-04-06 20:28:13.699250 IP (tos 0x0, ttl 64, id 43355, offset 0, flags [DF], proto TCP (6), length 52)
    127.0.0.1.12150 > 127.0.0.1.57170: Flags [.], cksum 0xfe28 (incorrect -> 0x872b), seq 1, ack 4, win 512, options [nop,nop,TS val 359176202 ecr 359176202], length 0
2022-04-06 20:28:13.699274 IP (tos 0x0, ttl 64, id 43356, offset 0, flags [DF], proto TCP (6), length 54)
    127.0.0.1.12150 > 127.0.0.1.57170: Flags [P.], cksum 0xfe2a (incorrect -> 0x8221), seq 1:3, ack 4, win 512, options [nop,nop,TS val 359176202 ecr 359176202], length 2
2022-04-06 20:28:13.699282 IP (tos 0x0, ttl 64, id 60130, offset 0, flags [DF], proto TCP (6), length 52)
    127.0.0.1.57170 > 127.0.0.1.12150: Flags [.], cksum 0xfe28 (incorrect -> 0x8729), seq 4, ack 3, win 512, options [nop,nop,TS val 359176202 ecr 359176202], length 0
2022-04-06 20:28:13.713289 IP (tos 0x0, ttl 64, id 60131, offset 0, flags [DF], proto TCP (6), length 62)
    127.0.0.1.57170 > 127.0.0.1.12150: Flags [P.], cksum 0xfe32 (incorrect -> 0x1ec6), seq 4:14, ack 3, win 512, options [nop,nop,TS val 359176216 ecr 359176202], length 10
2022-04-06 20:28:13.713298 IP (tos 0x0, ttl 64, id 43357, offset 0, flags [DF], proto TCP (6), length 52)
    127.0.0.1.12150 > 127.0.0.1.57170: Flags [.], cksum 0xfe28 (incorrect -> 0x8703), seq 3, ack 14, win 512, options [nop,nop,TS val 359176216 ecr 359176216], length 0
2022-04-06 20:28:13.822823 IP (tos 0x0, ttl 64, id 43358, offset 0, flags [DF], proto TCP (6), length 62)
    127.0.0.1.12150 > 127.0.0.1.57170: Flags [P.], cksum 0xfe32 (incorrect -> 0x8183), seq 3:13, ack 14, win 512, options [nop,nop,TS val 359176325 ecr 359176216], length 10
2022-04-06 20:28:13.822832 IP (tos 0x0, ttl 64, id 60132, offset 0, flags [DF], proto TCP (6), length 52)
    127.0.0.1.57170 > 127.0.0.1.12150: Flags [.], cksum 0xfe28 (incorrect -> 0x861f), seq 14, ack 13, win 512, options [nop,nop,TS val 359176325 ecr 359176325], length 0
2022-04-06 20:28:13.828490 IP (tos 0x0, ttl 64, id 60133, offset 0, flags [DF], proto TCP (6), length 569)
    127.0.0.1.57170 > 127.0.0.1.12150: Flags [P.], cksum 0x002e (incorrect -> 0xbffb), seq 14:531, ack 13, win 512, options [nop,nop,TS val 359176331 ecr 359176325], length 517
2022-04-06 20:28:13.828500 IP (tos 0x0, ttl 64, id 43359, offset 0, flags [DF], proto TCP (6), length 52)
    127.0.0.1.12150 > 127.0.0.1.57170: Flags [.], cksum 0xfe28 (incorrect -> 0x8412), seq 13, ack 531, win 508, options [nop,nop,TS val 359176331 ecr 359176331], length 0
2022-04-06 20:28:13.936553 IP (tos 0x0, ttl 64, id 43360, offset 0, flags [DF], proto TCP (6), length 3538)
    127.0.0.1.12150 > 127.0.0.1.57170: Flags [P.], cksum 0x0bc7 (incorrect -> 0xfbe0), seq 13:3499, ack 531, win 512, options [nop,nop,TS val 359176439 ecr 359176331], length 3486
2022-04-06 20:28:13.936561 IP (tos 0x0, ttl 64, id 60134, offset 0, flags [DF], proto TCP (6), length 52)
    127.0.0.1.57170 > 127.0.0.1.12150: Flags [.], cksum 0xfe28 (incorrect -> 0x75aa), seq 531, ack 3499, win 494, options [nop,nop,TS val 359176439 ecr 359176439], length 0
2022-04-06 20:28:13.970779 IP (tos 0x0, ttl 64, id 43361, offset 0, flags [DF], proto TCP (6), length 1494)
    127.0.0.1.12150 > 127.0.0.1.57170: Flags [P.], cksum 0x03cb (incorrect -> 0xe1f2), seq 3499:4941, ack 531, win 512, options [nop,nop,TS val 359176473 ecr 359176439], length 1442
2022-04-06 20:28:13.970787 IP (tos 0x0, ttl 64, id 60135, offset 0, flags [DF], proto TCP (6), length 52)
    127.0.0.1.57170 > 127.0.0.1.12150: Flags [.], cksum 0xfe28 (incorrect -> 0x6fbc), seq 531, ack 4941, win 502, options [nop,nop,TS val 359176473 ecr 359176473], length 0
2022-04-06 20:28:13.971323 IP (tos 0x0, ttl 64, id 60136, offset 0, flags [DF], proto TCP (6), length 116)
    127.0.0.1.57170 > 127.0.0.1.12150: Flags [P.], cksum 0xfe68 (incorrect -> 0xf1f7), seq 531:595, ack 4941, win 512, options [nop,nop,TS val 359176474 ecr 359176473], length 64
2022-04-06 20:28:13.971336 IP (tos 0x0, ttl 64, id 43362, offset 0, flags [DF], proto TCP (6), length 52)
    127.0.0.1.12150 > 127.0.0.1.57170: Flags [.], cksum 0xfe28 (incorrect -> 0x6f70), seq 4941, ack 595, win 512, options [nop,nop,TS val 359176474 ecr 359176474], length 0
2022-04-06 20:28:13.971896 IP (tos 0x0, ttl 64, id 60137, offset 0, flags [DF], proto TCP (6), length 390)
    127.0.0.1.57170 > 127.0.0.1.12150: Flags [P.], cksum 0xff7a (incorrect -> 0xcd35), seq 595:933, ack 4941, win 512, options [nop,nop,TS val 359176474 ecr 359176474], length 338
2022-04-06 20:28:13.971905 IP (tos 0x0, ttl 64, id 43363, offset 0, flags [DF], proto TCP (6), length 52)
    127.0.0.1.12150 > 127.0.0.1.57170: Flags [.], cksum 0xfe28 (incorrect -> 0x6e20), seq 4941, ack 933, win 510, options [nop,nop,TS val 359176474 ecr 359176474], length 0
2022-04-06 20:28:14.284242 IP (tos 0x0, ttl 64, id 43364, offset 0, flags [DF], proto TCP (6), length 3538)
    127.0.0.1.12150 > 127.0.0.1.57170: Flags [P.], cksum 0x0bc7 (incorrect -> 0x2142), seq 4941:8427, ack 933, win 512, options [nop,nop,TS val 359176787 ecr 359176474], length 3486
2022-04-06 20:28:14.284253 IP (tos 0x0, ttl 64, id 60138, offset 0, flags [DF], proto TCP (6), length 52)
    127.0.0.1.57170 > 127.0.0.1.12150: Flags [.], cksum 0xfe28 (incorrect -> 0x5e20), seq 933, ack 8427, win 494, options [nop,nop,TS val 359176787 ecr 359176787], length 0
2022-04-06 20:28:14.319939 IP (tos 0x0, ttl 64, id 43365, offset 0, flags [DF], proto TCP (6), length 3112)
    127.0.0.1.12150 > 127.0.0.1.57170: Flags [P.], cksum 0x0a1d (incorrect -> 0xfdc2), seq 8427:11487, ack 933, win 512, options [nop,nop,TS val 359176822 ecr 359176787], length 3060
2022-04-06 20:28:14.319952 IP (tos 0x0, ttl 64, id 60139, offset 0, flags [DF], proto TCP (6), length 52)
    127.0.0.1.57170 > 127.0.0.1.12150: Flags [.], cksum 0xfe28 (incorrect -> 0x51e4), seq 933, ack 11487, win 496, options [nop,nop,TS val 359176822 ecr 359176822], length 0
2022-04-06 20:28:14.379796 IP (tos 0x0, ttl 64, id 43366, offset 0, flags [DF], proto TCP (6), length 3538)
    127.0.0.1.12150 > 127.0.0.1.57170: Flags [P.], cksum 0x0bc7 (incorrect -> 0xc2b9), seq 11487:14973, ack 933, win 512, options [nop,nop,TS val 359176882 ecr 359176822], length 3486
2022-04-06 20:28:14.379805 IP (tos 0x0, ttl 64, id 60140, offset 0, flags [DF], proto TCP (6), length 52)
    127.0.0.1.57170 > 127.0.0.1.12150: Flags [.], cksum 0xfe28 (incorrect -> 0x43d0), seq 933, ack 14973, win 494, options [nop,nop,TS val 359176882 ecr 359176882], length 0
2022-04-06 20:28:14.387903 IP (tos 0x0, ttl 64, id 43367, offset 0, flags [DF], proto TCP (6), length 4036)
    127.0.0.1.12150 > 127.0.0.1.57170: Flags [P.], cksum 0x0db9 (incorrect -> 0xa2f1), seq 14973:18957, ack 933, win 512, options [nop,nop,TS val 359176890 ecr 359176882], length 3984
2022-04-06 20:28:14.387911 IP (tos 0x0, ttl 64, id 60141, offset 0, flags [DF], proto TCP (6), length 52)
    127.0.0.1.57170 > 127.0.0.1.12150: Flags [.], cksum 0xfe28 (incorrect -> 0x3432), seq 933, ack 18957, win 492, options [nop,nop,TS val 359176890 ecr 359176890], length 0
2022-04-06 20:28:14.396110 IP (tos 0x0, ttl 64, id 43368, offset 0, flags [DF], proto TCP (6), length 4036)
    127.0.0.1.12150 > 127.0.0.1.57170: Flags [P.], cksum 0x0db9 (incorrect -> 0x0041), seq 18957:22941, ack 933, win 512, options [nop,nop,TS val 359176899 ecr 359176890], length 3984
2022-04-06 20:28:14.396119 IP (tos 0x0, ttl 64, id 60142, offset 0, flags [DF], proto TCP (6), length 52)
    127.0.0.1.57170 > 127.0.0.1.12150: Flags [.], cksum 0xfe28 (incorrect -> 0x2490), seq 933, ack 22941, win 492, options [nop,nop,TS val 359176899 ecr 359176899], length 0
2022-04-06 20:28:14.413007 IP (tos 0x0, ttl 64, id 43369, offset 0, flags [DF], proto TCP (6), length 3538)
    127.0.0.1.12150 > 127.0.0.1.57170: Flags [P.], cksum 0x0bc7 (incorrect -> 0xafdd), seq 22941:26427, ack 933, win 512, options [nop,nop,TS val 359176915 ecr 359176899], length 3486
2022-04-06 20:28:14.413014 IP (tos 0x0, ttl 64, id 60143, offset 0, flags [DF], proto TCP (6), length 52)
    127.0.0.1.57170 > 127.0.0.1.12150: Flags [.], cksum 0xfe28 (incorrect -> 0x16d0), seq 933, ack 26427, win 494, options [nop,nop,TS val 359176915 ecr 359176915], length 0
2022-04-06 20:28:14.413107 IP (tos 0x0, ttl 64, id 43370, offset 0, flags [DF], proto TCP (6), length 4036)
    127.0.0.1.12150 > 127.0.0.1.57170: Flags [P.], cksum 0x0db9 (incorrect -> 0xbc9e), seq 26427:30411, ack 933, win 512, options [nop,nop,TS val 359176916 ecr 359176915], length 3984
2022-04-06 20:28:14.413113 IP (tos 0x0, ttl 64, id 60144, offset 0, flags [DF], proto TCP (6), length 52)
    127.0.0.1.57170 > 127.0.0.1.12150: Flags [.], cksum 0xfe28 (incorrect -> 0x0740), seq 933, ack 30411, win 492, options [nop,nop,TS val 359176916 ecr 359176916], length 0
2022-04-06 20:28:14.430433 IP (tos 0x0, ttl 64, id 43371, offset 0, flags [DF], proto TCP (6), length 4100)
    127.0.0.1.12150 > 127.0.0.1.57170: Flags [P.], cksum 0x0df9 (incorrect -> 0x059e), seq 30411:34459, ack 933, win 512, options [nop,nop,TS val 359176933 ecr 359176916], length 4048
2022-04-06 20:28:14.430441 IP (tos 0x0, ttl 64, id 60145, offset 0, flags [DF], proto TCP (6), length 52)
    127.0.0.1.57170 > 127.0.0.1.12150: Flags [.], cksum 0xfe28 (incorrect -> 0xf74d), seq 933, ack 34459, win 492, options [nop,nop,TS val 359176933 ecr 359176933], length 0
2022-04-06 20:28:14.430800 IP (tos 0x0, ttl 64, id 43372, offset 0, flags [DF], proto TCP (6), length 853)
    127.0.0.1.12150 > 127.0.0.1.57170: Flags [P.], cksum 0x014a (incorrect -> 0x4b9e), seq 34459:35260, ack 933, win 512, options [nop,nop,TS val 359176933 ecr 359176933], length 801
2022-04-06 20:28:14.430807 IP (tos 0x0, ttl 64, id 60146, offset 0, flags [DF], proto TCP (6), length 52)
    127.0.0.1.57170 > 127.0.0.1.12150: Flags [.], cksum 0xfe28 (incorrect -> 0xf420), seq 933, ack 35260, win 504, options [nop,nop,TS val 359176933 ecr 359176933], length 0
2022-04-06 20:28:14.486223 IP (tos 0x0, ttl 64, id 43373, offset 0, flags [DF], proto TCP (6), length 3538)
    127.0.0.1.12150 > 127.0.0.1.57170: Flags [P.], cksum 0x0bc7 (incorrect -> 0xef26), seq 35260:38746, ack 933, win 512, options [nop,nop,TS val 359176989 ecr 359176933], length 3486
2022-04-06 20:28:14.486244 IP (tos 0x0, ttl 64, id 60147, offset 0, flags [DF], proto TCP (6), length 52)
    127.0.0.1.57170 > 127.0.0.1.12150: Flags [.], cksum 0xfe28 (incorrect -> 0xe60a), seq 933, ack 38746, win 512, options [nop,nop,TS val 359176989 ecr 359176989], length 0
2022-04-06 20:28:14.486327 IP (tos 0x0, ttl 64, id 43374, offset 0, flags [DF], proto TCP (6), length 3538)
    127.0.0.1.12150 > 127.0.0.1.57170: Flags [P.], cksum 0x0bc7 (incorrect -> 0x11c9), seq 38746:42232, ack 933, win 512, options [nop,nop,TS val 359176989 ecr 359176989], length 3486
2022-04-06 20:28:14.526678 IP (tos 0x0, ttl 64, id 60148, offset 0, flags [DF], proto TCP (6), length 52)
    127.0.0.1.57170 > 127.0.0.1.12150: Flags [.], cksum 0xfe28 (incorrect -> 0xd844), seq 933, ack 42232, win 512, options [nop,nop,TS val 359177029 ecr 359176989], length 0
2022-04-06 20:28:14.526692 IP (tos 0x0, ttl 64, id 43375, offset 0, flags [DF], proto TCP (6), length 20797)
    127.0.0.1.12150 > 127.0.0.1.57170: Flags [P.], cksum 0x4f32 (incorrect -> 0x8f2e), seq 42232:62977, ack 933, win 512, options [nop,nop,TS val 359177029 ecr 359177029], length 20745
2022-04-06 20:28:14.570656 IP (tos 0x0, ttl 64, id 60149, offset 0, flags [DF], proto TCP (6), length 52)
    127.0.0.1.57170 > 127.0.0.1.12150: Flags [.], cksum 0xfe28 (incorrect -> 0x86e7), seq 933, ack 62977, win 512, options [nop,nop,TS val 359177073 ecr 359177029], length 0
2022-04-06 20:28:14.733102 IP (tos 0x0, ttl 64, id 43376, offset 0, flags [DF], proto TCP (6), length 3538)
    127.0.0.1.12150 > 127.0.0.1.57170: Flags [P.], cksum 0x0bc7 (incorrect -> 0x13b4), seq 62977:66463, ack 933, win 512, options [nop,nop,TS val 359177236 ecr 359177073], length 3486
2022-04-06 20:28:14.733133 IP (tos 0x0, ttl 64, id 60150, offset 0, flags [DF], proto TCP (6), length 52)
    127.0.0.1.57170 > 127.0.0.1.12150: Flags [.], cksum 0xfe28 (incorrect -> 0x77d7), seq 933, ack 66463, win 512, options [nop,nop,TS val 359177236 ecr 359177236], length 0
2022-04-06 20:28:14.735017 IP (tos 0x0, ttl 64, id 43377, offset 0, flags [DF], proto TCP (6), length 3538)
    127.0.0.1.12150 > 127.0.0.1.57170: Flags [P.], cksum 0x0bc7 (incorrect -> 0xab69), seq 66463:69949, ack 933, win 512, options [nop,nop,TS val 359177237 ecr 359177236], length 3486
2022-04-06 20:28:14.763035 IP (tos 0x0, ttl 64, id 43378, offset 0, flags [DF], proto TCP (6), length 32820)
    127.0.0.1.12150 > 127.0.0.1.57170: Flags [.], cksum 0x7e29 (incorrect -> 0xbec5), seq 69949:102717, ack 933, win 512, options [nop,nop,TS val 359177265 ecr 359177236], length 32768
2022-04-06 20:28:14.763049 IP (tos 0x0, ttl 64, id 60151, offset 0, flags [DF], proto TCP (6), length 52)
    127.0.0.1.57170 > 127.0.0.1.12150: Flags [.], cksum 0xfe28 (incorrect -> 0xea9f), seq 933, ack 102717, win 379, options [nop,nop,TS val 359177265 ecr 359177237], length 0
2022-04-06 20:28:14.763767 IP (tos 0x0, ttl 64, id 43379, offset 0, flags [DF], proto TCP (6), length 3638)
    127.0.0.1.12150 > 127.0.0.1.57170: Flags [P.], cksum 0x0c2b (incorrect -> 0x8390), seq 102717:106303, ack 933, win 512, options [nop,nop,TS val 359177266 ecr 359177265], length 3586
2022-04-06 20:28:14.763778 IP (tos 0x0, ttl 64, id 60152, offset 0, flags [DF], proto TCP (6), length 52)
    127.0.0.1.57170 > 127.0.0.1.12150: Flags [.], cksum 0xfe28 (incorrect -> 0xdbfa), seq 933, ack 106303, win 512, options [nop,nop,TS val 359177266 ecr 359177266], length 0
2022-04-06 20:28:14.763818 IP (tos 0x0, ttl 64, id 43380, offset 0, flags [DF], proto TCP (6), length 3538)
    127.0.0.1.12150 > 127.0.0.1.57170: Flags [P.], cksum 0x0bc7 (incorrect -> 0x8e7b), seq 106303:109789, ack 933, win 512, options [nop,nop,TS val 359177266 ecr 359177266], length 3486
2022-04-06 20:28:14.763827 IP (tos 0x0, ttl 64, id 60153, offset 0, flags [DF], proto TCP (6), length 52)
    127.0.0.1.57170 > 127.0.0.1.12150: Flags [.], cksum 0xfe28 (incorrect -> 0xce5c), seq 933, ack 109789, win 512, options [nop,nop,TS val 359177266 ecr 359177266], length 0
2022-04-06 20:28:14.767167 IP (tos 0x0, ttl 64, id 43381, offset 0, flags [DF], proto TCP (6), length 4100)
    127.0.0.1.12150 > 127.0.0.1.57170: Flags [P.], cksum 0x0df9 (incorrect -> 0xd2bf), seq 109789:113837, ack 933, win 512, options [nop,nop,TS val 359177270 ecr 359177266], length 4048
2022-04-06 20:28:14.767178 IP (tos 0x0, ttl 64, id 60154, offset 0, flags [DF], proto TCP (6), length 52)
    127.0.0.1.57170 > 127.0.0.1.12150: Flags [.], cksum 0xfe28 (incorrect -> 0xbe84), seq 933, ack 113837, win 512, options [nop,nop,TS val 359177270 ecr 359177270], length 0
2022-04-06 20:28:14.767188 IP (tos 0x0, ttl 64, id 43382, offset 0, flags [DF], proto TCP (6), length 486)
    127.0.0.1.12150 > 127.0.0.1.57170: Flags [P.], cksum 0xffda (incorrect -> 0x1939), seq 113837:114271, ack 933, win 512, options [nop,nop,TS val 359177270 ecr 359177270], length 434
2022-04-06 20:28:14.767204 IP (tos 0x0, ttl 64, id 60155, offset 0, flags [DF], proto TCP (6), length 52)
    127.0.0.1.57170 > 127.0.0.1.12150: Flags [.], cksum 0xfe28 (incorrect -> 0xbcd2), seq 933, ack 114271, win 512, options [nop,nop,TS val 359177270 ecr 359177270], length 0
2022-04-06 20:28:14.768162 IP (tos 0x0, ttl 64, id 43383, offset 0, flags [DF], proto TCP (6), length 3538)
    127.0.0.1.12150 > 127.0.0.1.57170: Flags [P.], cksum 0x0bc7 (incorrect -> 0x1966), seq 114271:117757, ack 933, win 512, options [nop,nop,TS val 359177271 ecr 359177270], length 3486
2022-04-06 20:28:14.768366 IP (tos 0x0, ttl 64, id 60156, offset 0, flags [DF], proto TCP (6), length 52)
    127.0.0.1.57170 > 127.0.0.1.12150: Flags [.], cksum 0xfe28 (incorrect -> 0xaf32), seq 933, ack 117757, win 512, options [nop,nop,TS val 359177271 ecr 359177271], length 0
2022-04-06 20:28:14.768407 IP (tos 0x0, ttl 64, id 43384, offset 0, flags [DF], proto TCP (6), length 4100)
    127.0.0.1.12150 > 127.0.0.1.57170: Flags [P.], cksum 0x0df9 (incorrect -> 0xe76a), seq 117757:121805, ack 933, win 512, options [nop,nop,TS val 359177271 ecr 359177271], length 4048
2022-04-06 20:28:14.768417 IP (tos 0x0, ttl 64, id 60157, offset 0, flags [DF], proto TCP (6), length 52)
    127.0.0.1.57170 > 127.0.0.1.12150: Flags [.], cksum 0xfe28 (incorrect -> 0x9f62), seq 933, ack 121805, win 512, options [nop,nop,TS val 359177271 ecr 359177271], length 0
2022-04-06 20:28:14.768425 IP (tos 0x0, ttl 64, id 43385, offset 0, flags [DF], proto TCP (6), length 486)
    127.0.0.1.12150 > 127.0.0.1.57170: Flags [P.], cksum 0xffda (incorrect -> 0x9a82), seq 121805:122239, ack 933, win 512, options [nop,nop,TS val 359177271 ecr 359177271], length 434
2022-04-06 20:28:14.768432 IP (tos 0x0, ttl 64, id 60158, offset 0, flags [DF], proto TCP (6), length 52)
    127.0.0.1.57170 > 127.0.0.1.12150: Flags [.], cksum 0xfe28 (incorrect -> 0x9db0), seq 933, ack 122239, win 512, options [nop,nop,TS val 359177271 ecr 359177271], length 0
200, 4.986052751541138, 1.1088075637817383