2022-04-06 17:04:17.674359 IP (tos 0x0, ttl 64, id 50916, offset 0, flags [DF], proto TCP (6), length 60)
    127.0.0.1.50504 > 127.0.0.1.10150: Flags [S], cksum 0xfe30 (incorrect -> 0x34f4), seq 4263327810, win 65495, options [mss 65495,sackOK,TS val 346940177 ecr 0,nop,wscale 7], length 0
2022-04-06 17:04:17.674374 IP (tos 0x0, ttl 64, id 0, offset 0, flags [DF], proto TCP (6), length 60)
    127.0.0.1.10150 > 127.0.0.1.50504: Flags [S.], cksum 0xfe30 (incorrect -> 0x96e0), seq 3993548870, ack 4263327811, win 65483, options [mss 65495,sackOK,TS val 346940177 ecr 346940177,nop,wscale 7], length 0
2022-04-06 17:04:17.674386 IP (tos 0x0, ttl 64, id 50917, offset 0, flags [DF], proto TCP (6), length 52)
    127.0.0.1.50504 > 127.0.0.1.10150: Flags [.], cksum 0xfe28 (incorrect -> 0xbd9c), seq 1, ack 1, win 512, options [nop,nop,TS val 346940177 ecr 346940177], length 0
2022-04-06 17:04:17.674478 IP (tos 0x0, ttl 64, id 50918, offset 0, flags [DF], proto TCP (6), length 55)
    127.0.0.1.50504 > 127.0.0.1.10150: Flags [P.], cksum 0xfe2b (incorrect -> 0xb890), seq 1:4, ack 1, win 512, options [nop,nop,TS val 346940177 ecr 346940177], length 3
2022-04-06 17:04:17.674484 IP (tos 0x0, ttl 64, id 53646, offset 0, flags [DF], proto TCP (6), length 52)
    127.0.0.1.10150 > 127.0.0.1.50504: Flags [.], cksum 0xfe28 (incorrect -> 0xbd99), seq 1, ack 4, win 512, options [nop,nop,TS val 346940177 ecr 346940177], length 0
2022-04-06 17:04:17.674553 IP (tos 0x0, ttl 64, id 53647, offset 0, flags [DF], proto TCP (6), length 54)
    127.0.0.1.10150 > 127.0.0.1.50504: Flags [P.], cksum 0xfe2a (incorrect -> 0xb88f), seq 1:3, ack 4, win 512, options [nop,nop,TS val 346940177 ecr 346940177], length 2
2022-04-06 17:04:17.674561 IP (tos 0x0, ttl 64, id 50919, offset 0, flags [DF], proto TCP (6), length 52)
    127.0.0.1.50504 > 127.0.0.1.10150: Flags [.], cksum 0xfe28 (incorrect -> 0xbd97), seq 4, ack 3, win 512, options [nop,nop,TS val 346940177 ecr 346940177], length 0
2022-04-06 17:04:17.676365 IP (tos 0x0, ttl 64, id 50920, offset 0, flags [DF], proto TCP (6), length 62)
    127.0.0.1.50504 > 127.0.0.1.10150: Flags [P.], cksum 0xfe32 (incorrect -> 0x6551), seq 4:14, ack 3, win 512, options [nop,nop,TS val 346940179 ecr 346940177], length 10
2022-04-06 17:04:17.676383 IP (tos 0x0, ttl 64, id 53648, offset 0, flags [DF], proto TCP (6), length 52)
    127.0.0.1.10150 > 127.0.0.1.50504: Flags [.], cksum 0xfe28 (incorrect -> 0xbd89), seq 3, ack 14, win 512, options [nop,nop,TS val 346940179 ecr 346940179], length 0
2022-04-06 17:04:17.766251 IP (tos 0x0, ttl 64, id 53649, offset 0, flags [DF], proto TCP (6), length 62)
    127.0.0.1.10150 > 127.0.0.1.50504: Flags [P.], cksum 0xfe32 (incorrect -> 0xb81c), seq 3:13, ack 14, win 512, options [nop,nop,TS val 346940269 ecr 346940179], length 10
2022-04-06 17:04:17.766263 IP (tos 0x0, ttl 64, id 50921, offset 0, flags [DF], proto TCP (6), length 52)
    127.0.0.1.50504 > 127.0.0.1.10150: Flags [.], cksum 0xfe28 (incorrect -> 0xbccb), seq 14, ack 13, win 512, options [nop,nop,TS val 346940269 ecr 346940269], length 0
2022-04-06 17:04:17.771751 IP (tos 0x0, ttl 64, id 50922, offset 0, flags [DF], proto TCP (6), length 569)
    127.0.0.1.50504 > 127.0.0.1.10150: Flags [P.], cksum 0x002e (incorrect -> 0xfcfa), seq 14:531, ack 13, win 512, options [nop,nop,TS val 346940274 ecr 346940269], length 517
2022-04-06 17:04:17.771762 IP (tos 0x0, ttl 64, id 53650, offset 0, flags [DF], proto TCP (6), length 52)
    127.0.0.1.10150 > 127.0.0.1.50504: Flags [.], cksum 0xfe28 (incorrect -> 0xbac0), seq 13, ack 531, win 508, options [nop,nop,TS val 346940274 ecr 346940274], length 0
2022-04-06 17:04:17.851001 IP (tos 0x0, ttl 64, id 53651, offset 0, flags [DF], proto TCP (6), length 3538)
    127.0.0.1.10150 > 127.0.0.1.50504: Flags [P.], cksum 0x0bc7 (incorrect -> 0x9f8e), seq 13:3499, ack 531, win 512, options [nop,nop,TS val 346940353 ecr 346940274], length 3486
2022-04-06 17:04:17.851011 IP (tos 0x0, ttl 64, id 50923, offset 0, flags [DF], proto TCP (6), length 52)
    127.0.0.1.50504 > 127.0.0.1.10150: Flags [.], cksum 0xfe28 (incorrect -> 0xac92), seq 531, ack 3499, win 494, options [nop,nop,TS val 346940353 ecr 346940353], length 0
2022-04-06 17:04:17.872896 IP (tos 0x0, ttl 64, id 53652, offset 0, flags [DF], proto TCP (6), length 272)
    127.0.0.1.10150 > 127.0.0.1.50504: Flags [P.], cksum 0xff04 (incorrect -> 0xa805), seq 3499:3719, ack 531, win 512, options [nop,nop,TS val 346940375 ecr 346940353], length 220
2022-04-06 17:04:17.872911 IP (tos 0x0, ttl 64, id 50924, offset 0, flags [DF], proto TCP (6), length 52)
    127.0.0.1.50504 > 127.0.0.1.10150: Flags [.], cksum 0xfe28 (incorrect -> 0xab7d), seq 531, ack 3719, win 507, options [nop,nop,TS val 346940375 ecr 346940375], length 0
2022-04-06 17:04:17.873040 IP (tos 0x0, ttl 64, id 50925, offset 0, flags [DF], proto TCP (6), length 132)
    127.0.0.1.50504 > 127.0.0.1.10150: Flags [P.], cksum 0xfe78 (incorrect -> 0x6588), seq 531:611, ack 3719, win 507, options [nop,nop,TS val 346940375 ecr 346940375], length 80
2022-04-06 17:04:17.873054 IP (tos 0x0, ttl 64, id 53653, offset 0, flags [DF], proto TCP (6), length 52)
    127.0.0.1.10150 > 127.0.0.1.50504: Flags [.], cksum 0xfe28 (incorrect -> 0xab28), seq 3719, ack 611, win 512, options [nop,nop,TS val 346940375 ecr 346940375], length 0
2022-04-06 17:04:17.873489 IP (tos 0x0, ttl 64, id 50926, offset 0, flags [DF], proto TCP (6), length 428)
    127.0.0.1.50504 > 127.0.0.1.10150: Flags [P.], cksum 0xffa0 (incorrect -> 0x933a), seq 611:987, ack 3719, win 507, options [nop,nop,TS val 346940376 ecr 346940375], length 376
2022-04-06 17:04:17.873499 IP (tos 0x0, ttl 64, id 53654, offset 0, flags [DF], proto TCP (6), length 52)
    127.0.0.1.10150 > 127.0.0.1.50504: Flags [.], cksum 0xfe28 (incorrect -> 0xa9b0), seq 3719, ack 987, win 510, options [nop,nop,TS val 346940376 ecr 346940376], length 0
2022-04-06 17:04:18.261567 IP (tos 0x0, ttl 64, id 53655, offset 0, flags [DF], proto TCP (6), length 1736)
    127.0.0.1.10150 > 127.0.0.1.50504: Flags [P.], cksum 0x04bd (incorrect -> 0x1dc0), seq 3719:5403, ack 987, win 512, options [nop,nop,TS val 346940764 ecr 346940376], length 1684
2022-04-06 17:04:18.261577 IP (tos 0x0, ttl 64, id 50927, offset 0, flags [DF], proto TCP (6), length 52)
    127.0.0.1.50504 > 127.0.0.1.10150: Flags [.], cksum 0xfe28 (incorrect -> 0xa01d), seq 987, ack 5403, win 501, options [nop,nop,TS val 346940764 ecr 346940764], length 0
2022-04-06 17:04:18.273461 IP (tos 0x0, ttl 64, id 53656, offset 0, flags [DF], proto TCP (6), length 3538)
    127.0.0.1.10150 > 127.0.0.1.50504: Flags [P.], cksum 0x0bc7 (incorrect -> 0xe894), seq 5403:8889, ack 987, win 512, options [nop,nop,TS val 346940776 ecr 346940764], length 3486
2022-04-06 17:04:18.273470 IP (tos 0x0, ttl 64, id 50928, offset 0, flags [DF], proto TCP (6), length 52)
    127.0.0.1.50504 > 127.0.0.1.10150: Flags [.], cksum 0xfe28 (incorrect -> 0x926e), seq 987, ack 8889, win 494, options [nop,nop,TS val 346940776 ecr 346940776], length 0
2022-04-06 17:04:18.276380 IP (tos 0x0, ttl 64, id 53657, offset 0, flags [DF], proto TCP (6), length 1546)
    127.0.0.1.10150 > 127.0.0.1.50504: Flags [P.], cksum 0x03ff (incorrect -> 0x76f6), seq 8889:10383, ack 987, win 512, options [nop,nop,TS val 346940779 ecr 346940776], length 1494
2022-04-06 17:04:18.276387 IP (tos 0x0, ttl 64, id 50929, offset 0, flags [DF], proto TCP (6), length 52)
    127.0.0.1.50504 > 127.0.0.1.10150: Flags [.], cksum 0xfe28 (incorrect -> 0x8c8a), seq 987, ack 10383, win 502, options [nop,nop,TS val 346940779 ecr 346940779], length 0
2022-04-06 17:04:18.283662 IP (tos 0x0, ttl 64, id 53658, offset 0, flags [DF], proto TCP (6), length 3538)
    127.0.0.1.10150 > 127.0.0.1.50504: Flags [P.], cksum 0x0bc7 (incorrect -> 0x8300), seq 10383:13869, ack 987, win 512, options [nop,nop,TS val 346940786 ecr 346940779], length 3486
2022-04-06 17:04:18.283670 IP (tos 0x0, ttl 64, id 50930, offset 0, flags [DF], proto TCP (6), length 52)
    127.0.0.1.50504 > 127.0.0.1.10150: Flags [.], cksum 0xfe28 (incorrect -> 0x7ee6), seq 987, ack 13869, win 494, options [nop,nop,TS val 346940786 ecr 346940786], length 0
2022-04-06 17:04:18.288322 IP (tos 0x0, ttl 64, id 53659, offset 0, flags [DF], proto TCP (6), length 4100)
    127.0.0.1.10150 > 127.0.0.1.50504: Flags [P.], cksum 0x0df9 (incorrect -> 0x5c0d), seq 13869:17917, ack 987, win 512, options [nop,nop,TS val 346940791 ecr 346940786], length 4048
2022-04-06 17:04:18.288329 IP (tos 0x0, ttl 64, id 50931, offset 0, flags [DF], proto TCP (6), length 52)
    127.0.0.1.50504 > 127.0.0.1.10150: Flags [.], cksum 0xfe28 (incorrect -> 0x6f0e), seq 987, ack 17917, win 492, options [nop,nop,TS val 346940791 ecr 346940791], length 0
2022-04-06 17:04:18.288335 IP (tos 0x0, ttl 64, id 53660, offset 0, flags [DF], proto TCP (6), length 182)
    127.0.0.1.10150 > 127.0.0.1.50504: Flags [P.], cksum 0xfeaa (incorrect -> 0x9b43), seq 17917:18047, ack 987, win 512, options [nop,nop,TS val 346940791 ecr 346940791], length 130
2022-04-06 17:04:18.288340 IP (tos 0x0, ttl 64, id 50932, offset 0, flags [DF], proto TCP (6), length 52)
    127.0.0.1.50504 > 127.0.0.1.10150: Flags [.], cksum 0xfe28 (incorrect -> 0x6e8d), seq 987, ack 18047, win 491, options [nop,nop,TS val 346940791 ecr 346940791], length 0
2022-04-06 17:04:18.290495 IP (tos 0x0, ttl 64, id 53661, offset 0, flags [DF], proto TCP (6), length 2466)
    127.0.0.1.10150 > 127.0.0.1.50504: Flags [P.], cksum 0x0797 (incorrect -> 0xb0e4), seq 18047:20461, ack 987, win 512, options [nop,nop,TS val 346940793 ecr 346940791], length 2414
2022-04-06 17:04:18.290503 IP (tos 0x0, ttl 64, id 50933, offset 0, flags [DF], proto TCP (6), length 52)
    127.0.0.1.50504 > 127.0.0.1.10150: Flags [.], cksum 0xfe28 (incorrect -> 0x6514), seq 987, ack 20461, win 498, options [nop,nop,TS val 346940793 ecr 346940793], length 0
2022-04-06 17:04:18.291157 IP (tos 0x0, ttl 64, id 53662, offset 0, flags [DF], proto TCP (6), length 4100)
    127.0.0.1.10150 > 127.0.0.1.50504: Flags [P.], cksum 0x0df9 (incorrect -> 0x6cb3), seq 20461:24509, ack 987, win 512, options [nop,nop,TS val 346940794 ecr 346940793], length 4048
2022-04-06 17:04:18.291164 IP (tos 0x0, ttl 64, id 50934, offset 0, flags [DF], proto TCP (6), length 52)
    127.0.0.1.50504 > 127.0.0.1.10150: Flags [.], cksum 0xfe28 (incorrect -> 0x5548), seq 987, ack 24509, win 492, options [nop,nop,TS val 346940794 ecr 346940794], length 0
2022-04-06 17:04:18.291171 IP (tos 0x0, ttl 64, id 53663, offset 0, flags [DF], proto TCP (6), length 188)
    127.0.0.1.10150 > 127.0.0.1.50504: Flags [P.], cksum 0xfeb0 (incorrect -> 0x160f), seq 24509:24645, ack 987, win 512, options [nop,nop,TS val 346940794 ecr 346940794], length 136
2022-04-06 17:04:18.291175 IP (tos 0x0, ttl 64, id 50935, offset 0, flags [DF], proto TCP (6), length 52)
    127.0.0.1.50504 > 127.0.0.1.10150: Flags [.], cksum 0xfe28 (incorrect -> 0x54c1), seq 987, ack 24645, win 491, options [nop,nop,TS val 346940794 ecr 346940794], length 0
2022-04-06 17:04:18.294732 IP (tos 0x0, ttl 64, id 53664, offset 0, flags [DF], proto TCP (6), length 3386)
    127.0.0.1.10150 > 127.0.0.1.50504: Flags [P.], cksum 0x0b2f (incorrect -> 0xdda3), seq 24645:27979, ack 987, win 512, options [nop,nop,TS val 346940797 ecr 346940794], length 3334
2022-04-06 17:04:18.294792 IP (tos 0x0, ttl 64, id 50936, offset 0, flags [DF], proto TCP (6), length 52)
    127.0.0.1.50504 > 127.0.0.1.10150: Flags [.], cksum 0xfe28 (incorrect -> 0x47a0), seq 987, ack 27979, win 512, options [nop,nop,TS val 346940797 ecr 346940797], length 0
2022-04-06 17:04:18.295080 IP (tos 0x0, ttl 64, id 53665, offset 0, flags [DF], proto TCP (6), length 3960)
    127.0.0.1.10150 > 127.0.0.1.50504: Flags [P.], cksum 0x0d6d (incorrect -> 0x1944), seq 27979:31887, ack 987, win 512, options [nop,nop,TS val 346940798 ecr 346940797], length 3908
2022-04-06 17:04:18.295123 IP (tos 0x0, ttl 64, id 50937, offset 0, flags [DF], proto TCP (6), length 52)
    127.0.0.1.50504 > 127.0.0.1.10150: Flags [.], cksum 0xfe28 (incorrect -> 0x385a), seq 987, ack 31887, win 512, options [nop,nop,TS val 346940798 ecr 346940798], length 0
2022-04-06 17:04:18.299535 IP (tos 0x0, ttl 64, id 53666, offset 0, flags [DF], proto TCP (6), length 1546)
    127.0.0.1.10150 > 127.0.0.1.50504: Flags [P.], cksum 0x03ff (incorrect -> 0x9836), seq 31887:33381, ack 987, win 512, options [nop,nop,TS val 346940802 ecr 346940798], length 1494
2022-04-06 17:04:18.299583 IP (tos 0x0, ttl 64, id 50938, offset 0, flags [DF], proto TCP (6), length 52)
    127.0.0.1.50504 > 127.0.0.1.10150: Flags [.], cksum 0xfe28 (incorrect -> 0x327c), seq 987, ack 33381, win 512, options [nop,nop,TS val 346940802 ecr 346940802], length 0
2022-04-06 17:04:18.301157 IP (tos 0x0, ttl 64, id 53667, offset 0, flags [DF], proto TCP (6), length 4100)
    127.0.0.1.10150 > 127.0.0.1.50504: Flags [P.], cksum 0x0df9 (incorrect -> 0x98e2), seq 33381:37429, ack 987, win 512, options [nop,nop,TS val 346940804 ecr 346940802], length 4048
2022-04-06 17:04:18.342662 IP (tos 0x0, ttl 64, id 50939, offset 0, flags [DF], proto TCP (6), length 52)
    127.0.0.1.50504 > 127.0.0.1.10150: Flags [.], cksum 0xfe28 (incorrect -> 0x227f), seq 987, ack 37429, win 512, options [nop,nop,TS val 346940845 ecr 346940804], length 0
2022-04-06 17:04:18.342675 IP (tos 0x0, ttl 64, id 53668, offset 0, flags [DF], proto TCP (6), length 21037)
    127.0.0.1.10150 > 127.0.0.1.50504: Flags [P.], cksum 0x5022 (incorrect -> 0xc299), seq 37429:58414, ack 987, win 512, options [nop,nop,TS val 346940845 ecr 346940845], length 20985
2022-04-06 17:04:18.386666 IP (tos 0x0, ttl 64, id 50940, offset 0, flags [DF], proto TCP (6), length 52)
    127.0.0.1.50504 > 127.0.0.1.10150: Flags [.], cksum 0xfe28 (incorrect -> 0xd030), seq 987, ack 58414, win 512, options [nop,nop,TS val 346940889 ecr 346940845], length 0
2022-04-06 17:04:19.824654 IP (tos 0x0, ttl 64, id 53669, offset 0, flags [DF], proto TCP (6), length 602)
    127.0.0.1.10150 > 127.0.0.1.50504: Flags [P.], cksum 0x004f (incorrect -> 0x05ad), seq 58414:58964, ack 987, win 512, options [nop,nop,TS val 346942327 ecr 346940889], length 550
2022-04-06 17:04:19.824666 IP (tos 0x0, ttl 64, id 50941, offset 0, flags [DF], proto TCP (6), length 52)
    127.0.0.1.50504 > 127.0.0.1.10150: Flags [.], cksum 0xfe28 (incorrect -> 0xc2a6), seq 987, ack 58964, win 508, options [nop,nop,TS val 346942327 ecr 346942327], length 0
2022-04-06 17:04:19.870646 IP (tos 0x0, ttl 64, id 53670, offset 0, flags [DF], proto TCP (6), length 3174)
    127.0.0.1.10150 > 127.0.0.1.50504: Flags [P.], cksum 0x0a5b (incorrect -> 0x0b1b), seq 58964:62086, ack 987, win 512, options [nop,nop,TS val 346942373 ecr 346942327], length 3122
2022-04-06 17:04:19.870847 IP (tos 0x0, ttl 64, id 50942, offset 0, flags [DF], proto TCP (6), length 52)
    127.0.0.1.50504 > 127.0.0.1.10150: Flags [.], cksum 0xfe28 (incorrect -> 0xb614), seq 987, ack 62086, win 512, options [nop,nop,TS val 346942373 ecr 346942373], length 0
2022-04-06 17:04:19.873496 IP (tos 0x0, ttl 64, id 53671, offset 0, flags [DF], proto TCP (6), length 3538)
    127.0.0.1.10150 > 127.0.0.1.50504: Flags [P.], cksum 0x0bc7 (incorrect -> 0x129b), seq 62086:65572, ack 987, win 512, options [nop,nop,TS val 346942376 ecr 346942373], length 3486
2022-04-06 17:04:19.873520 IP (tos 0x0, ttl 64, id 50943, offset 0, flags [DF], proto TCP (6), length 52)
    127.0.0.1.50504 > 127.0.0.1.10150: Flags [.], cksum 0xfe28 (incorrect -> 0xa870), seq 987, ack 65572, win 512, options [nop,nop,TS val 346942376 ecr 346942376], length 0
2022-04-06 17:04:19.884380 IP (tos 0x0, ttl 64, id 53672, offset 0, flags [DF], proto TCP (6), length 1048)
    127.0.0.1.10150 > 127.0.0.1.50504: Flags [P.], cksum 0x020d (incorrect -> 0x1ff3), seq 65572:66568, ack 987, win 512, options [nop,nop,TS val 346942387 ecr 346942376], length 996
2022-04-06 17:04:19.884394 IP (tos 0x0, ttl 64, id 50944, offset 0, flags [DF], proto TCP (6), length 52)
    127.0.0.1.50504 > 127.0.0.1.10150: Flags [.], cksum 0xfe28 (incorrect -> 0xa476), seq 987, ack 66568, win 512, options [nop,nop,TS val 346942387 ecr 346942387], length 0
2022-04-06 17:04:19.884567 IP (tos 0x0, ttl 64, id 53673, offset 0, flags [DF], proto TCP (6), length 3538)
    127.0.0.1.10150 > 127.0.0.1.50504: Flags [P.], cksum 0x0bc7 (incorrect -> 0xb3aa), seq 66568:70054, ack 987, win 512, options [nop,nop,TS val 346942387 ecr 346942387], length 3486
2022-04-06 17:04:19.884580 IP (tos 0x0, ttl 64, id 50945, offset 0, flags [DF], proto TCP (6), length 52)
    127.0.0.1.50504 > 127.0.0.1.10150: Flags [.], cksum 0xfe28 (incorrect -> 0x96d8), seq 987, ack 70054, win 512, options [nop,nop,TS val 346942387 ecr 346942387], length 0
2022-04-06 17:04:19.890622 IP (tos 0x0, ttl 64, id 53674, offset 0, flags [DF], proto TCP (6), length 4100)
    127.0.0.1.10150 > 127.0.0.1.50504: Flags [P.], cksum 0x0df9 (incorrect -> 0xfa4e), seq 70054:74102, ack 987, win 512, options [nop,nop,TS val 346942393 ecr 346942387], length 4048
2022-04-06 17:04:19.891151 IP (tos 0x0, ttl 64, id 50946, offset 0, flags [DF], proto TCP (6), length 52)
    127.0.0.1.50504 > 127.0.0.1.10150: Flags [.], cksum 0xfe28 (incorrect -> 0x86fb), seq 987, ack 74102, win 512, options [nop,nop,TS val 346942394 ecr 346942393], length 0
2022-04-06 17:04:19.891165 IP (tos 0x0, ttl 64, id 53675, offset 0, flags [DF], proto TCP (6), length 1760)
    127.0.0.1.10150 > 127.0.0.1.50504: Flags [P.], cksum 0x04d5 (incorrect -> 0xe468), seq 74102:75810, ack 987, win 512, options [nop,nop,TS val 346942394 ecr 346942394], length 1708
2022-04-06 17:04:19.891172 IP (tos 0x0, ttl 64, id 50947, offset 0, flags [DF], proto TCP (6), length 52)
    127.0.0.1.50504 > 127.0.0.1.10150: Flags [.], cksum 0xfe28 (incorrect -> 0x804e), seq 987, ack 75810, win 512, options [nop,nop,TS val 346942394 ecr 346942394], length 0
2022-04-06 17:04:19.894137 IP (tos 0x0, ttl 64, id 53676, offset 0, flags [DF], proto TCP (6), length 4036)
    127.0.0.1.10150 > 127.0.0.1.50504: Flags [P.], cksum 0x0db9 (incorrect -> 0xff01), seq 75810:79794, ack 987, win 512, options [nop,nop,TS val 346942397 ecr 346942394], length 3984
2022-04-06 17:04:19.894160 IP (tos 0x0, ttl 64, id 50948, offset 0, flags [DF], proto TCP (6), length 52)
    127.0.0.1.50504 > 127.0.0.1.10150: Flags [.], cksum 0xfe28 (incorrect -> 0x70b8), seq 987, ack 79794, win 512, options [nop,nop,TS val 346942397 ecr 346942397], length 0
2022-04-06 17:04:19.894239 IP (tos 0x0, ttl 64, id 53677, offset 0, flags [DF], proto TCP (6), length 3272)
    127.0.0.1.10150 > 127.0.0.1.50504: Flags [P.], cksum 0x0abd (incorrect -> 0xb91e), seq 79794:83014, ack 987, win 512, options [nop,nop,TS val 346942397 ecr 346942397], length 3220
2022-04-06 17:04:19.894251 IP (tos 0x0, ttl 64, id 50949, offset 0, flags [DF], proto TCP (6), length 52)
    127.0.0.1.50504 > 127.0.0.1.10150: Flags [.], cksum 0xfe28 (incorrect -> 0x6424), seq 987, ack 83014, win 512, options [nop,nop,TS val 346942397 ecr 346942397], length 0
2022-04-06 17:04:19.898550 IP (tos 0x0, ttl 64, id 53678, offset 0, flags [DF], proto TCP (6), length 4036)
    127.0.0.1.10150 > 127.0.0.1.50504: Flags [P.], cksum 0x0db9 (incorrect -> 0x663b), seq 83014:86998, ack 987, win 512, options [nop,nop,TS val 346942401 ecr 346942397], length 3984
2022-04-06 17:04:19.898564 IP (tos 0x0, ttl 64, id 50950, offset 0, flags [DF], proto TCP (6), length 52)
    127.0.0.1.50504 > 127.0.0.1.10150: Flags [.], cksum 0xfe28 (incorrect -> 0x548c), seq 987, ack 86998, win 512, options [nop,nop,TS val 346942401 ecr 346942401], length 0
2022-04-06 17:04:19.898649 IP (tos 0x0, ttl 64, id 53679, offset 0, flags [DF], proto TCP (6), length 4100)
    127.0.0.1.10150 > 127.0.0.1.50504: Flags [P.], cksum 0x0df9 (incorrect -> 0x52e4), seq 86998:91046, ack 987, win 512, options [nop,nop,TS val 346942401 ecr 346942401], length 4048
2022-04-06 17:04:19.899095 IP (tos 0x0, ttl 64, id 50951, offset 0, flags [DF], proto TCP (6), length 52)
    127.0.0.1.50504 > 127.0.0.1.10150: Flags [.], cksum 0xfe28 (incorrect -> 0x44bb), seq 987, ack 91046, win 512, options [nop,nop,TS val 346942402 ecr 346942401], length 0
2022-04-06 17:04:19.899107 IP (tos 0x0, ttl 64, id 53680, offset 0, flags [DF], proto TCP (6), length 984)
    127.0.0.1.10150 > 127.0.0.1.50504: Flags [P.], cksum 0x01cd (incorrect -> 0x735f), seq 91046:91978, ack 987, win 512, options [nop,nop,TS val 346942402 ecr 346942402], length 932
2022-04-06 17:04:19.899113 IP (tos 0x0, ttl 64, id 50952, offset 0, flags [DF], proto TCP (6), length 52)
    127.0.0.1.50504 > 127.0.0.1.10150: Flags [.], cksum 0xfe28 (incorrect -> 0x4116), seq 987, ack 91978, win 512, options [nop,nop,TS val 346942402 ecr 346942402], length 0
2022-04-06 17:04:19.911109 IP (tos 0x0, ttl 64, id 53681, offset 0, flags [DF], proto TCP (6), length 4036)
    127.0.0.1.10150 > 127.0.0.1.50504: Flags [P.], cksum 0x0db9 (incorrect -> 0x4016), seq 91978:95962, ack 987, win 512, options [nop,nop,TS val 346942414 ecr 346942402], length 3984
2022-04-06 17:04:19.911162 IP (tos 0x0, ttl 64, id 50953, offset 0, flags [DF], proto TCP (6), length 52)
    127.0.0.1.50504 > 127.0.0.1.10150: Flags [.], cksum 0xfe28 (incorrect -> 0x316e), seq 987, ack 95962, win 512, options [nop,nop,TS val 346942414 ecr 346942414], length 0
2022-04-06 17:04:19.912241 IP (tos 0x0, ttl 64, id 53682, offset 0, flags [DF], proto TCP (6), length 4036)
    127.0.0.1.10150 > 127.0.0.1.50504: Flags [P.], cksum 0x0db9 (incorrect -> 0x7f8a), seq 95962:99946, ack 987, win 512, options [nop,nop,TS val 346942415 ecr 346942414], length 3984
2022-04-06 17:04:19.920739 IP (tos 0x0, ttl 64, id 53683, offset 0, flags [DF], proto TCP (6), length 32820)
    127.0.0.1.10150 > 127.0.0.1.50504: Flags [.], cksum 0x7e29 (incorrect -> 0x7429), seq 99946:132714, ack 987, win 512, options [nop,nop,TS val 346942423 ecr 346942414], length 32768
2022-04-06 17:04:19.920757 IP (tos 0x0, ttl 64, id 50954, offset 0, flags [DF], proto TCP (6), length 52)
    127.0.0.1.50504 > 127.0.0.1.10150: Flags [.], cksum 0xfe28 (incorrect -> 0xa258), seq 987, ack 132714, win 379, options [nop,nop,TS val 346942423 ecr 346942415], length 0
2022-04-06 17:04:19.920763 IP (tos 0x0, ttl 64, id 53684, offset 0, flags [DF], proto TCP (6), length 2229)
    127.0.0.1.10150 > 127.0.0.1.50504: Flags [P.], cksum 0x06aa (incorrect -> 0x6cb5), seq 132714:134891, ack 987, win 512, options [nop,nop,TS val 346942423 ecr 346942423], length 2177
2022-04-06 17:04:19.921787 IP (tos 0x0, ttl 64, id 50955, offset 0, flags [DF], proto TCP (6), length 52)
    127.0.0.1.50504 > 127.0.0.1.10150: Flags [.], cksum 0xfe28 (incorrect -> 0x9949), seq 987, ack 134891, win 512, options [nop,nop,TS val 346942424 ecr 346942423], length 0
2022-04-06 17:04:19.922495 IP (tos 0x0, ttl 64, id 53685, offset 0, flags [DF], proto TCP (6), length 3538)
    127.0.0.1.10150 > 127.0.0.1.50504: Flags [P.], cksum 0x0bc7 (incorrect -> 0xff2e), seq 134891:138377, ack 987, win 512, options [nop,nop,TS val 346942425 ecr 346942424], length 3486
2022-04-06 17:04:19.922508 IP (tos 0x0, ttl 64, id 50956, offset 0, flags [DF], proto TCP (6), length 52)
    127.0.0.1.50504 > 127.0.0.1.10150: Flags [.], cksum 0xfe28 (incorrect -> 0x8ba8), seq 987, ack 138377, win 512, options [nop,nop,TS val 346942425 ecr 346942425], length 0
2022-04-06 17:04:19.922586 IP (tos 0x0, ttl 64, id 53686, offset 0, flags [DF], proto TCP (6), length 3969)
    127.0.0.1.10150 > 127.0.0.1.50504: Flags [P.], cksum 0x0d76 (incorrect -> 0x31ad), seq 138377:142294, ack 987, win 512, options [nop,nop,TS val 346942425 ecr 346942425], length 3917
2022-04-06 17:04:19.922833 IP (tos 0x0, ttl 64, id 50957, offset 0, flags [DF], proto TCP (6), length 52)
    127.0.0.1.50504 > 127.0.0.1.10150: Flags [.], cksum 0xfe28 (incorrect -> 0x7c5b), seq 987, ack 142294, win 512, options [nop,nop,TS val 346942425 ecr 346942425], length 0
2022-04-06 17:04:19.926600 IP (tos 0x0, ttl 64, id 53687, offset 0, flags [DF], proto TCP (6), length 4036)
    127.0.0.1.10150 > 127.0.0.1.50504: Flags [P.], cksum 0x0db9 (incorrect -> 0xc9ec), seq 142294:146278, ack 987, win 512, options [nop,nop,TS val 346942429 ecr 346942425], length 3984
2022-04-06 17:04:19.926615 IP (tos 0x0, ttl 64, id 50958, offset 0, flags [DF], proto TCP (6), length 52)
    127.0.0.1.50504 > 127.0.0.1.10150: Flags [.], cksum 0xfe28 (incorrect -> 0x6cc3), seq 987, ack 146278, win 512, options [nop,nop,TS val 346942429 ecr 346942429], length 0
2022-04-06 17:04:19.930246 IP (tos 0x0, ttl 64, id 53688, offset 0, flags [DF], proto TCP (6), length 4036)
    127.0.0.1.10150 > 127.0.0.1.50504: Flags [P.], cksum 0x0db9 (incorrect -> 0x8333), seq 146278:150262, ack 987, win 512, options [nop,nop,TS val 346942433 ecr 346942429], length 3984
2022-04-06 17:04:19.961606 IP (tos 0x0, ttl 64, id 53689, offset 0, flags [DF], proto TCP (6), length 32820)
    127.0.0.1.10150 > 127.0.0.1.50504: Flags [.], cksum 0x7e29 (incorrect -> 0x8f6f), seq 150262:183030, ack 987, win 512, options [nop,nop,TS val 346942464 ecr 346942429], length 32768
2022-04-06 17:04:19.961614 IP (tos 0x0, ttl 64, id 50959, offset 0, flags [DF], proto TCP (6), length 52)
    127.0.0.1.50504 > 127.0.0.1.10150: Flags [.], cksum 0xfe28 (incorrect -> 0xdd90), seq 987, ack 183030, win 379, options [nop,nop,TS val 346942464 ecr 346942433], length 0
2022-04-06 17:04:19.961621 IP (tos 0x0, ttl 64, id 53690, offset 0, flags [DF], proto TCP (6), length 406)
    127.0.0.1.10150 > 127.0.0.1.50504: Flags [P.], cksum 0xff8a (incorrect -> 0xe1c9), seq 183030:183384, ack 987, win 512, options [nop,nop,TS val 346942464 ecr 346942464], length 354
2022-04-06 17:04:19.962150 IP (tos 0x0, ttl 64, id 50960, offset 0, flags [DF], proto TCP (6), length 52)
    127.0.0.1.50504 > 127.0.0.1.10150: Flags [.], cksum 0xfe28 (incorrect -> 0xdb89), seq 987, ack 183384, win 512, options [nop,nop,TS val 346942465 ecr 346942464], length 0
2022-04-06 17:04:19.962162 IP (tos 0x0, ttl 64, id 53691, offset 0, flags [DF], proto TCP (6), length 3972)
    127.0.0.1.10150 > 127.0.0.1.50504: Flags [P.], cksum 0x0d79 (incorrect -> 0x8f92), seq 183384:187304, ack 987, win 512, options [nop,nop,TS val 346942465 ecr 346942465], length 3920
2022-04-06 17:04:19.962442 IP (tos 0x0, ttl 64, id 50961, offset 0, flags [DF], proto TCP (6), length 52)
    127.0.0.1.50504 > 127.0.0.1.10150: Flags [.], cksum 0xfe28 (incorrect -> 0xcc38), seq 987, ack 187304, win 512, options [nop,nop,TS val 346942465 ecr 346942465], length 0
2022-04-06 17:04:19.963438 IP (tos 0x0, ttl 64, id 53692, offset 0, flags [DF], proto TCP (6), length 1066)
    127.0.0.1.10150 > 127.0.0.1.50504: Flags [P.], cksum 0x021f (incorrect -> 0xa3e4), seq 187304:188318, ack 987, win 512, options [nop,nop,TS val 346942466 ecr 346942465], length 1014
2022-04-06 17:04:19.963554 IP (tos 0x0, ttl 64, id 50962, offset 0, flags [DF], proto TCP (6), length 52)
    127.0.0.1.50504 > 127.0.0.1.10150: Flags [.], cksum 0xfe28 (incorrect -> 0xc840), seq 987, ack 188318, win 512, options [nop,nop,TS val 346942466 ecr 346942466], length 0
2022-04-06 17:04:19.963651 IP (tos 0x0, ttl 64, id 53693, offset 0, flags [DF], proto TCP (6), length 4100)
    127.0.0.1.10150 > 127.0.0.1.50504: Flags [P.], cksum 0x0df9 (incorrect -> 0xa4aa), seq 188318:192366, ack 987, win 512, options [nop,nop,TS val 346942466 ecr 346942466], length 4048
2022-04-06 17:04:19.963755 IP (tos 0x0, ttl 64, id 50963, offset 0, flags [DF], proto TCP (6), length 52)
    127.0.0.1.50504 > 127.0.0.1.10150: Flags [.], cksum 0xfe28 (incorrect -> 0xb870), seq 987, ack 192366, win 512, options [nop,nop,TS val 346942466 ecr 346942466], length 0
2022-04-06 17:04:19.963761 IP (tos 0x0, ttl 64, id 53694, offset 0, flags [DF], proto TCP (6), length 3972)
    127.0.0.1.10150 > 127.0.0.1.50504: Flags [P.], cksum 0x0d79 (incorrect -> 0xae21), seq 192366:196286, ack 987, win 512, options [nop,nop,TS val 346942466 ecr 346942466], length 3920
2022-04-06 17:04:19.963766 IP (tos 0x0, ttl 64, id 50964, offset 0, flags [DF], proto TCP (6), length 52)
    127.0.0.1.50504 > 127.0.0.1.10150: Flags [.], cksum 0xfe28 (incorrect -> 0xa920), seq 987, ack 196286, win 512, options [nop,nop,TS val 346942466 ecr 346942466], length 0
2022-04-06 17:04:19.965909 IP (tos 0x0, ttl 64, id 53695, offset 0, flags [DF], proto TCP (6), length 3538)
    127.0.0.1.10150 > 127.0.0.1.50504: Flags [P.], cksum 0x0bc7 (incorrect -> 0x1172), seq 196286:199772, ack 987, win 512, options [nop,nop,TS val 346942468 ecr 346942466], length 3486
2022-04-06 17:04:19.965925 IP (tos 0x0, ttl 64, id 50965, offset 0, flags [DF], proto TCP (6), length 52)
    127.0.0.1.50504 > 127.0.0.1.10150: Flags [.], cksum 0xfe28 (incorrect -> 0x9b7e), seq 987, ack 199772, win 512, options [nop,nop,TS val 346942468 ecr 346942468], length 0
2022-04-06 17:04:19.966071 IP (tos 0x0, ttl 64, id 53696, offset 0, flags [DF], proto TCP (6), length 3538)
    127.0.0.1.10150 > 127.0.0.1.50504: Flags [P.], cksum 0x0bc7 (incorrect -> 0xd380), seq 199772:203258, ack 987, win 512, options [nop,nop,TS val 346942469 ecr 346942468], length 3486
2022-04-06 17:04:19.989265 IP (tos 0x0, ttl 64, id 53697, offset 0, flags [DF], proto TCP (6), length 32820)
    127.0.0.1.10150 > 127.0.0.1.50504: Flags [.], cksum 0x7e29 (incorrect -> 0xb4d0), seq 203258:236026, ack 987, win 512, options [nop,nop,TS val 346942492 ecr 346942468], length 32768
2022-04-06 17:04:19.989284 IP (tos 0x0, ttl 64, id 50966, offset 0, flags [DF], proto TCP (6), length 52)
    127.0.0.1.50504 > 127.0.0.1.10150: Flags [.], cksum 0xfe28 (incorrect -> 0x0e4c), seq 987, ack 236026, win 379, options [nop,nop,TS val 346942492 ecr 346942469], length 0
2022-04-06 17:04:19.989290 IP (tos 0x0, ttl 64, id 53698, offset 0, flags [DF], proto TCP (6), length 1322)
    127.0.0.1.10150 > 127.0.0.1.50504: Flags [P.], cksum 0x031f (incorrect -> 0x7322), seq 236026:237296, ack 987, win 512, options [nop,nop,TS val 346942492 ecr 346942492], length 1270
2022-04-06 17:04:19.989660 IP (tos 0x0, ttl 64, id 50967, offset 0, flags [DF], proto TCP (6), length 52)
    127.0.0.1.50504 > 127.0.0.1.10150: Flags [.], cksum 0xfe28 (incorrect -> 0x08ba), seq 987, ack 237296, win 512, options [nop,nop,TS val 346942492 ecr 346942492], length 0
2022-04-06 17:04:19.989722 IP (tos 0x0, ttl 64, id 53699, offset 0, flags [DF], proto TCP (6), length 4100)
    127.0.0.1.10150 > 127.0.0.1.50504: Flags [P.], cksum 0x0df9 (incorrect -> 0xd45f), seq 237296:241344, ack 987, win 512, options [nop,nop,TS val 346942492 ecr 346942492], length 4048
2022-04-06 17:04:19.989904 IP (tos 0x0, ttl 64, id 50968, offset 0, flags [DF], proto TCP (6), length 52)
    127.0.0.1.50504 > 127.0.0.1.10150: Flags [.], cksum 0xfe28 (incorrect -> 0xf8e9), seq 987, ack 241344, win 512, options [nop,nop,TS val 346942492 ecr 346942492], length 0
2022-04-06 17:04:19.989910 IP (tos 0x0, ttl 64, id 53700, offset 0, flags [DF], proto TCP (6), length 3063)
    127.0.0.1.10150 > 127.0.0.1.50504: Flags [P.], cksum 0x09ec (incorrect -> 0xe62b), seq 241344:244355, ack 987, win 512, options [nop,nop,TS val 346942492 ecr 346942492], length 3011
2022-04-06 17:04:19.989914 IP (tos 0x0, ttl 64, id 50969, offset 0, flags [DF], proto TCP (6), length 52)
    127.0.0.1.50504 > 127.0.0.1.10150: Flags [.], cksum 0xfe28 (incorrect -> 0xed26), seq 987, ack 244355, win 512, options [nop,nop,TS val 346942492 ecr 346942492], length 0
2022-04-06 17:04:19.995334 IP (tos 0x0, ttl 64, id 53701, offset 0, flags [DF], proto TCP (6), length 4036)
    127.0.0.1.10150 > 127.0.0.1.50504: Flags [P.], cksum 0x0db9 (incorrect -> 0x684f), seq 244355:248339, ack 987, win 512, options [nop,nop,TS val 346942498 ecr 346942492], length 3984
2022-04-06 17:04:19.995378 IP (tos 0x0, ttl 64, id 50970, offset 0, flags [DF], proto TCP (6), length 52)
    127.0.0.1.50504 > 127.0.0.1.10150: Flags [.], cksum 0xfe28 (incorrect -> 0xdd8a), seq 987, ack 248339, win 512, options [nop,nop,TS val 346942498 ecr 346942498], length 0
2022-04-06 17:04:19.999422 IP (tos 0x0, ttl 64, id 53702, offset 0, flags [DF], proto TCP (6), length 2044)
    127.0.0.1.10150 > 127.0.0.1.50504: Flags [P.], cksum 0x05f1 (incorrect -> 0x8a97), seq 248339:250331, ack 987, win 512, options [nop,nop,TS val 346942502 ecr 346942498], length 1992
2022-04-06 17:04:19.999436 IP (tos 0x0, ttl 64, id 50971, offset 0, flags [DF], proto TCP (6), length 52)
    127.0.0.1.50504 > 127.0.0.1.10150: Flags [.], cksum 0xfe28 (incorrect -> 0xd5ba), seq 987, ack 250331, win 512, options [nop,nop,TS val 346942502 ecr 346942502], length 0
2022-04-06 17:04:20.004707 IP (tos 0x0, ttl 64, id 53703, offset 0, flags [DF], proto TCP (6), length 4100)
    127.0.0.1.10150 > 127.0.0.1.50504: Flags [P.], cksum 0x0df9 (incorrect -> 0xb173), seq 250331:254379, ack 987, win 512, options [nop,nop,TS val 346942507 ecr 346942502], length 4048
2022-04-06 17:04:20.005044 IP (tos 0x0, ttl 64, id 50972, offset 0, flags [DF], proto TCP (6), length 52)
    127.0.0.1.50504 > 127.0.0.1.10150: Flags [.], cksum 0xfe28 (incorrect -> 0xc5e0), seq 987, ack 254379, win 512, options [nop,nop,TS val 346942507 ecr 346942507], length 0
2022-04-06 17:04:20.005049 IP (tos 0x0, ttl 64, id 53704, offset 0, flags [DF], proto TCP (6), length 68)
    127.0.0.1.10150 > 127.0.0.1.50504: Flags [P.], cksum 0xfe38 (incorrect -> 0x4dcb), seq 254379:254395, ack 987, win 512, options [nop,nop,TS val 346942507 ecr 346942507], length 16
2022-04-06 17:04:20.005054 IP (tos 0x0, ttl 64, id 50973, offset 0, flags [DF], proto TCP (6), length 52)
    127.0.0.1.50504 > 127.0.0.1.10150: Flags [.], cksum 0xfe28 (incorrect -> 0xc5d0), seq 987, ack 254395, win 512, options [nop,nop,TS val 346942507 ecr 346942507], length 0
2022-04-06 17:04:20.005724 IP (tos 0x0, ttl 64, id 53705, offset 0, flags [DF], proto TCP (6), length 3538)
    127.0.0.1.10150 > 127.0.0.1.50504: Flags [P.], cksum 0x0bc7 (incorrect -> 0xdb38), seq 254395:257881, ack 987, win 512, options [nop,nop,TS val 346942508 ecr 346942507], length 3486
2022-04-06 17:04:20.005772 IP (tos 0x0, ttl 64, id 50974, offset 0, flags [DF], proto TCP (6), length 52)
    127.0.0.1.50504 > 127.0.0.1.10150: Flags [.], cksum 0xfe28 (incorrect -> 0xb830), seq 987, ack 257881, win 512, options [nop,nop,TS val 346942508 ecr 346942508], length 0
2022-04-06 17:04:20.007568 IP (tos 0x0, ttl 64, id 53706, offset 0, flags [DF], proto TCP (6), length 3538)
    127.0.0.1.10150 > 127.0.0.1.50504: Flags [P.], cksum 0x0bc7 (incorrect -> 0x3cf5), seq 257881:261367, ack 987, win 512, options [nop,nop,TS val 346942510 ecr 346942508], length 3486
2022-04-06 17:04:20.017706 IP (tos 0x0, ttl 64, id 53707, offset 0, flags [DF], proto TCP (6), length 32820)
    127.0.0.1.10150 > 127.0.0.1.50504: Flags [.], cksum 0x7e29 (incorrect -> 0xb62f), seq 261367:294135, ack 987, win 512, options [nop,nop,TS val 346942520 ecr 346942508], length 32768
2022-04-06 17:04:20.017734 IP (tos 0x0, ttl 64, id 50975, offset 0, flags [DF], proto TCP (6), length 52)
    127.0.0.1.50504 > 127.0.0.1.10150: Flags [.], cksum 0xfe28 (incorrect -> 0x2b09), seq 987, ack 294135, win 379, options [nop,nop,TS val 346942520 ecr 346942510], length 0
2022-04-06 17:04:20.017741 IP (tos 0x0, ttl 64, id 53708, offset 0, flags [DF], proto TCP (6), length 3638)
    127.0.0.1.10150 > 127.0.0.1.50504: Flags [P.], cksum 0x0c2b (incorrect -> 0x8fca), seq 294135:297721, ack 987, win 512, options [nop,nop,TS val 346942520 ecr 346942520], length 3586
2022-04-06 17:04:20.018131 IP (tos 0x0, ttl 64, id 50976, offset 0, flags [DF], proto TCP (6), length 52)
    127.0.0.1.50504 > 127.0.0.1.10150: Flags [.], cksum 0xfe28 (incorrect -> 0x1c77), seq 987, ack 297721, win 512, options [nop,nop,TS val 346942521 ecr 346942520], length 0
2022-04-06 17:04:20.018191 IP (tos 0x0, ttl 64, id 53709, offset 0, flags [DF], proto TCP (6), length 4100)
    127.0.0.1.10150 > 127.0.0.1.50504: Flags [P.], cksum 0x0df9 (incorrect -> 0x5d70), seq 297721:301769, ack 987, win 512, options [nop,nop,TS val 346942521 ecr 346942521], length 4048
2022-04-06 17:04:20.018209 IP (tos 0x0, ttl 64, id 50977, offset 0, flags [DF], proto TCP (6), length 52)
    127.0.0.1.50504 > 127.0.0.1.10150: Flags [.], cksum 0xfe28 (incorrect -> 0x0ca6), seq 987, ack 301769, win 512, options [nop,nop,TS val 346942521 ecr 346942521], length 0
2022-04-06 17:04:20.018213 IP (tos 0x0, ttl 64, id 53710, offset 0, flags [DF], proto TCP (6), length 3474)
    127.0.0.1.10150 > 127.0.0.1.50504: Flags [P.], cksum 0x0b87 (incorrect -> 0xbb01), seq 301769:305191, ack 987, win 512, options [nop,nop,TS val 346942521 ecr 346942521], length 3422
2022-04-06 17:04:20.018389 IP (tos 0x0, ttl 64, id 50978, offset 0, flags [DF], proto TCP (6), length 52)
    127.0.0.1.50504 > 127.0.0.1.10150: Flags [.], cksum 0xfe28 (incorrect -> 0xff47), seq 987, ack 305191, win 512, options [nop,nop,TS val 346942521 ecr 346942521], length 0
2022-04-06 17:04:20.019744 IP (tos 0x0, ttl 64, id 53711, offset 0, flags [DF], proto TCP (6), length 1546)
    127.0.0.1.10150 > 127.0.0.1.50504: Flags [P.], cksum 0x03ff (incorrect -> 0xa2f6), seq 305191:306685, ack 987, win 512, options [nop,nop,TS val 346942522 ecr 346942521], length 1494
2022-04-06 17:04:20.019758 IP (tos 0x0, ttl 64, id 50979, offset 0, flags [DF], proto TCP (6), length 52)
    127.0.0.1.50504 > 127.0.0.1.10150: Flags [.], cksum 0xfe28 (incorrect -> 0xf96f), seq 987, ack 306685, win 512, options [nop,nop,TS val 346942522 ecr 346942522], length 0
2022-04-06 17:04:20.019855 IP (tos 0x0, ttl 64, id 53712, offset 0, flags [DF], proto TCP (6), length 3538)
    127.0.0.1.10150 > 127.0.0.1.50504: Flags [P.], cksum 0x0bc7 (incorrect -> 0xdb96), seq 306685:310171, ack 987, win 512, options [nop,nop,TS val 346942522 ecr 346942522], length 3486
2022-04-06 17:04:20.019868 IP (tos 0x0, ttl 64, id 50980, offset 0, flags [DF], proto TCP (6), length 52)
    127.0.0.1.50504 > 127.0.0.1.10150: Flags [.], cksum 0xfe28 (incorrect -> 0xebd1), seq 987, ack 310171, win 512, options [nop,nop,TS val 346942522 ecr 346942522], length 0
2022-04-06 17:04:20.021632 IP (tos 0x0, ttl 64, id 53713, offset 0, flags [DF], proto TCP (6), length 1048)
    127.0.0.1.10150 > 127.0.0.1.50504: Flags [P.], cksum 0x020d (incorrect -> 0x4072), seq 310171:311167, ack 987, win 512, options [nop,nop,TS val 346942524 ecr 346942522], length 996
2022-04-06 17:04:20.021643 IP (tos 0x0, ttl 64, id 50981, offset 0, flags [DF], proto TCP (6), length 52)
    127.0.0.1.50504 > 127.0.0.1.10150: Flags [.], cksum 0xfe28 (incorrect -> 0xe7e9), seq 987, ack 311167, win 512, options [nop,nop,TS val 346942524 ecr 346942524], length 0
2022-04-06 17:04:20.021817 IP (tos 0x0, ttl 64, id 53714, offset 0, flags [DF], proto TCP (6), length 3538)
    127.0.0.1.10150 > 127.0.0.1.50504: Flags [P.], cksum 0x0bc7 (incorrect -> 0xb2b7), seq 311167:314653, ack 987, win 512, options [nop,nop,TS val 346942524 ecr 346942524], length 3486
2022-04-06 17:04:20.021829 IP (tos 0x0, ttl 64, id 50982, offset 0, flags [DF], proto TCP (6), length 52)
    127.0.0.1.50504 > 127.0.0.1.10150: Flags [.], cksum 0xfe28 (incorrect -> 0xda4b), seq 987, ack 314653, win 512, options [nop,nop,TS val 346942524 ecr 346942524], length 0
2022-04-06 17:04:20.035633 IP (tos 0x0, ttl 64, id 53715, offset 0, flags [DF], proto TCP (6), length 3538)
    127.0.0.1.10150 > 127.0.0.1.50504: Flags [P.], cksum 0x0bc7 (incorrect -> 0x176f), seq 314653:318139, ack 987, win 512, options [nop,nop,TS val 346942538 ecr 346942524], length 3486
2022-04-06 17:04:20.064530 IP (tos 0x0, ttl 64, id 53716, offset 0, flags [DF], proto TCP (6), length 32820)
    127.0.0.1.10150 > 127.0.0.1.50504: Flags [.], cksum 0x7e29 (incorrect -> 0x2196), seq 318139:350907, ack 987, win 512, options [nop,nop,TS val 346942567 ecr 346942524], length 32768
2022-04-06 17:04:20.064559 IP (tos 0x0, ttl 64, id 50983, offset 0, flags [DF], proto TCP (6), length 52)
    127.0.0.1.50504 > 127.0.0.1.10150: Flags [.], cksum 0xfe28 (incorrect -> 0x4cf9), seq 987, ack 350907, win 379, options [nop,nop,TS val 346942567 ecr 346942538], length 0
2022-04-06 17:04:20.064566 IP (tos 0x0, ttl 64, id 53717, offset 0, flags [DF], proto TCP (6), length 502)
    127.0.0.1.10150 > 127.0.0.1.50504: Flags [P.], cksum 0xffea (incorrect -> 0x14e0), seq 350907:351357, ack 987, win 512, options [nop,nop,TS val 346942567 ecr 346942567], length 450
2022-04-06 17:04:20.065011 IP (tos 0x0, ttl 64, id 50984, offset 0, flags [DF], proto TCP (6), length 52)
    127.0.0.1.50504 > 127.0.0.1.10150: Flags [.], cksum 0xfe28 (incorrect -> 0x4a95), seq 987, ack 351357, win 512, options [nop,nop,TS val 346942567 ecr 346942567], length 0
2022-04-06 17:04:20.066083 IP (tos 0x0, ttl 64, id 53718, offset 0, flags [DF], proto TCP (6), length 4100)
    127.0.0.1.10150 > 127.0.0.1.50504: Flags [P.], cksum 0x0df9 (incorrect -> 0x659a), seq 351357:355405, ack 987, win 512, options [nop,nop,TS val 346942569 ecr 346942567], length 4048
2022-04-06 17:04:20.066283 IP (tos 0x0, ttl 64, id 50985, offset 0, flags [DF], proto TCP (6), length 52)
    127.0.0.1.50504 > 127.0.0.1.10150: Flags [.], cksum 0xfe28 (incorrect -> 0x3ac1), seq 987, ack 355405, win 512, options [nop,nop,TS val 346942569 ecr 346942569], length 0
2022-04-06 17:04:20.066288 IP (tos 0x0, ttl 64, id 53719, offset 0, flags [DF], proto TCP (6), length 486)
    127.0.0.1.10150 > 127.0.0.1.50504: Flags [P.], cksum 0xffda (incorrect -> 0xd095), seq 355405:355839, ack 987, win 512, options [nop,nop,TS val 346942569 ecr 346942569], length 434
2022-04-06 17:04:20.066292 IP (tos 0x0, ttl 64, id 50986, offset 0, flags [DF], proto TCP (6), length 52)
    127.0.0.1.50504 > 127.0.0.1.10150: Flags [.], cksum 0xfe28 (incorrect -> 0x390f), seq 987, ack 355839, win 512, options [nop,nop,TS val 346942569 ecr 346942569], length 0
2022-04-06 17:04:20.066348 IP (tos 0x0, ttl 64, id 53720, offset 0, flags [DF], proto TCP (6), length 4100)
    127.0.0.1.10150 > 127.0.0.1.50504: Flags [P.], cksum 0x0df9 (incorrect -> 0xb451), seq 355839:359887, ack 987, win 512, options [nop,nop,TS val 346942569 ecr 346942569], length 4048
2022-04-06 17:04:20.066398 IP (tos 0x0, ttl 64, id 50987, offset 0, flags [DF], proto TCP (6), length 52)
    127.0.0.1.50504 > 127.0.0.1.10150: Flags [.], cksum 0xfe28 (incorrect -> 0x293f), seq 987, ack 359887, win 512, options [nop,nop,TS val 346942569 ecr 346942569], length 0
2022-04-06 17:04:20.066405 IP (tos 0x0, ttl 64, id 53721, offset 0, flags [DF], proto TCP (6), length 7458)
    127.0.0.1.10150 > 127.0.0.1.50504: Flags [P.], cksum 0x1b17 (incorrect -> 0x3daa), seq 359887:367293, ack 987, win 512, options [nop,nop,TS val 346942569 ecr 346942569], length 7406
2022-04-06 17:04:20.066413 IP (tos 0x0, ttl 64, id 50988, offset 0, flags [DF], proto TCP (6), length 52)
    127.0.0.1.50504 > 127.0.0.1.10150: Flags [.], cksum 0xfe28 (incorrect -> 0x0c51), seq 987, ack 367293, win 512, options [nop,nop,TS val 346942569 ecr 346942569], length 0
2022-04-06 17:04:20.067618 IP (tos 0x0, ttl 64, id 53722, offset 0, flags [DF], proto TCP (6), length 4036)
    127.0.0.1.10150 > 127.0.0.1.50504: Flags [P.], cksum 0x0db9 (incorrect -> 0x6a25), seq 367293:371277, ack 987, win 512, options [nop,nop,TS val 346942570 ecr 346942569], length 3984
2022-04-06 17:04:20.067797 IP (tos 0x0, ttl 64, id 50989, offset 0, flags [DF], proto TCP (6), length 52)
    127.0.0.1.50504 > 127.0.0.1.10150: Flags [.], cksum 0xfe28 (incorrect -> 0xfcbe), seq 987, ack 371277, win 512, options [nop,nop,TS val 346942570 ecr 346942570], length 0
2022-04-06 17:04:20.067865 IP (tos 0x0, ttl 64, id 53723, offset 0, flags [DF], proto TCP (6), length 4100)
    127.0.0.1.10150 > 127.0.0.1.50504: Flags [P.], cksum 0x0df9 (incorrect -> 0x61f7), seq 371277:375325, ack 987, win 512, options [nop,nop,TS val 346942570 ecr 346942570], length 4048
2022-04-06 17:04:20.067897 IP (tos 0x0, ttl 64, id 50990, offset 0, flags [DF], proto TCP (6), length 52)
    127.0.0.1.50504 > 127.0.0.1.10150: Flags [.], cksum 0xfe28 (incorrect -> 0xecee), seq 987, ack 375325, win 512, options [nop,nop,TS val 346942570 ecr 346942570], length 0
2022-04-06 17:04:20.067903 IP (tos 0x0, ttl 64, id 53724, offset 0, flags [DF], proto TCP (6), length 7458)
    127.0.0.1.10150 > 127.0.0.1.50504: Flags [P.], cksum 0x1b17 (incorrect -> 0x7fc6), seq 375325:382731, ack 987, win 512, options [nop,nop,TS val 346942570 ecr 346942570], length 7406
2022-04-06 17:04:20.067910 IP (tos 0x0, ttl 64, id 50991, offset 0, flags [DF], proto TCP (6), length 52)
    127.0.0.1.50504 > 127.0.0.1.10150: Flags [.], cksum 0xfe28 (incorrect -> 0xd000), seq 987, ack 382731, win 512, options [nop,nop,TS val 346942570 ecr 346942570], length 0
2022-04-06 17:04:20.078515 IP (tos 0x0, ttl 64, id 53725, offset 0, flags [DF], proto TCP (6), length 1546)
    127.0.0.1.10150 > 127.0.0.1.50504: Flags [P.], cksum 0x03ff (incorrect -> 0x8dc1), seq 382731:384225, ack 987, win 512, options [nop,nop,TS val 346942581 ecr 346942570], length 1494
2022-04-06 17:04:20.078530 IP (tos 0x0, ttl 64, id 50992, offset 0, flags [DF], proto TCP (6), length 52)
    127.0.0.1.50504 > 127.0.0.1.10150: Flags [.], cksum 0xfe28 (incorrect -> 0xca14), seq 987, ack 384225, win 512, options [nop,nop,TS val 346942581 ecr 346942581], length 0
2022-04-06 17:04:20.080107 IP (tos 0x0, ttl 64, id 53726, offset 0, flags [DF], proto TCP (6), length 4100)
    127.0.0.1.10150 > 127.0.0.1.50504: Flags [P.], cksum 0x0df9 (incorrect -> 0x8798), seq 384225:388273, ack 987, win 512, options [nop,nop,TS val 346942583 ecr 346942581], length 4048
2022-04-06 17:04:20.080315 IP (tos 0x0, ttl 64, id 50993, offset 0, flags [DF], proto TCP (6), length 52)
    127.0.0.1.50504 > 127.0.0.1.10150: Flags [.], cksum 0xfe28 (incorrect -> 0xba40), seq 987, ack 388273, win 512, options [nop,nop,TS val 346942583 ecr 346942583], length 0
2022-04-06 17:04:20.080321 IP (tos 0x0, ttl 64, id 53727, offset 0, flags [DF], proto TCP (6), length 3304)
    127.0.0.1.10150 > 127.0.0.1.50504: Flags [P.], cksum 0x0add (incorrect -> 0xd11b), seq 388273:391525, ack 987, win 512, options [nop,nop,TS val 346942583 ecr 346942583], length 3252
2022-04-06 17:04:20.080326 IP (tos 0x0, ttl 64, id 50994, offset 0, flags [DF], proto TCP (6), length 52)
    127.0.0.1.50504 > 127.0.0.1.10150: Flags [.], cksum 0xfe28 (incorrect -> 0xad8c), seq 987, ack 391525, win 512, options [nop,nop,TS val 346942583 ecr 346942583], length 0
2022-04-06 17:04:20.081507 IP (tos 0x0, ttl 64, id 53728, offset 0, flags [DF], proto TCP (6), length 4036)
    127.0.0.1.10150 > 127.0.0.1.50504: Flags [P.], cksum 0x0db9 (incorrect -> 0x2b5f), seq 391525:395509, ack 987, win 512, options [nop,nop,TS val 346942584 ecr 346942583], length 3984
2022-04-06 17:04:20.081526 IP (tos 0x0, ttl 64, id 50995, offset 0, flags [DF], proto TCP (6), length 52)
    127.0.0.1.50504 > 127.0.0.1.10150: Flags [.], cksum 0xfe28 (incorrect -> 0x9dfa), seq 987, ack 395509, win 512, options [nop,nop,TS val 346942584 ecr 346942584], length 0
2022-04-06 17:04:20.089933 IP (tos 0x0, ttl 64, id 53729, offset 0, flags [DF], proto TCP (6), length 4100)
    127.0.0.1.10150 > 127.0.0.1.50504: Flags [P.], cksum 0x0df9 (incorrect -> 0x9083), seq 395509:399557, ack 987, win 512, options [nop,nop,TS val 346942592 ecr 346942584], length 4048
2022-04-06 17:04:20.089956 IP (tos 0x0, ttl 64, id 50996, offset 0, flags [DF], proto TCP (6), length 52)
    127.0.0.1.50504 > 127.0.0.1.10150: Flags [.], cksum 0xfe28 (incorrect -> 0x8e1a), seq 987, ack 399557, win 512, options [nop,nop,TS val 346942592 ecr 346942592], length 0
2022-04-06 17:04:20.089960 IP (tos 0x0, ttl 64, id 53730, offset 0, flags [DF], proto TCP (6), length 486)
    127.0.0.1.10150 > 127.0.0.1.50504: Flags [P.], cksum 0xffda (incorrect -> 0x07b2), seq 399557:399991, ack 987, win 512, options [nop,nop,TS val 346942592 ecr 346942592], length 434
2022-04-06 17:04:20.089964 IP (tos 0x0, ttl 64, id 50997, offset 0, flags [DF], proto TCP (6), length 52)
    127.0.0.1.50504 > 127.0.0.1.10150: Flags [.], cksum 0xfe28 (incorrect -> 0x8c68), seq 987, ack 399991, win 512, options [nop,nop,TS val 346942592 ecr 346942592], length 0
2022-04-06 17:04:20.090081 IP (tos 0x0, ttl 64, id 53731, offset 0, flags [DF], proto TCP (6), length 3122)
    127.0.0.1.10150 > 127.0.0.1.50504: Flags [P.], cksum 0x0a27 (incorrect -> 0x7307), seq 399991:403061, ack 987, win 512, options [nop,nop,TS val 346942593 ecr 346942592], length 3070
2022-04-06 17:04:20.090327 IP (tos 0x0, ttl 64, id 50998, offset 0, flags [DF], proto TCP (6), length 52)
    127.0.0.1.50504 > 127.0.0.1.10150: Flags [.], cksum 0xfe28 (incorrect -> 0x8068), seq 987, ack 403061, win 512, options [nop,nop,TS val 346942593 ecr 346942593], length 0
2022-04-06 17:04:20.090395 IP (tos 0x0, ttl 64, id 53732, offset 0, flags [DF], proto TCP (6), length 4100)
    127.0.0.1.10150 > 127.0.0.1.50504: Flags [P.], cksum 0x0df9 (incorrect -> 0x55be), seq 403061:407109, ack 987, win 512, options [nop,nop,TS val 346942593 ecr 346942593], length 4048
2022-04-06 17:04:20.090447 IP (tos 0x0, ttl 64, id 50999, offset 0, flags [DF], proto TCP (6), length 52)
    127.0.0.1.50504 > 127.0.0.1.10150: Flags [.], cksum 0xfe28 (incorrect -> 0x7098), seq 987, ack 407109, win 512, options [nop,nop,TS val 346942593 ecr 346942593], length 0
2022-04-06 17:04:20.090453 IP (tos 0x0, ttl 64, id 53733, offset 0, flags [DF], proto TCP (6), length 3972)
    127.0.0.1.10150 > 127.0.0.1.50504: Flags [P.], cksum 0x0d79 (incorrect -> 0x3053), seq 407109:411029, ack 987, win 512, options [nop,nop,TS val 346942593 ecr 346942593], length 3920
2022-04-06 17:04:20.090457 IP (tos 0x0, ttl 64, id 51000, offset 0, flags [DF], proto TCP (6), length 52)
    127.0.0.1.50504 > 127.0.0.1.10150: Flags [.], cksum 0xfe28 (incorrect -> 0x6148), seq 987, ack 411029, win 512, options [nop,nop,TS val 346942593 ecr 346942593], length 0
2022-04-06 17:04:20.090737 IP (tos 0x0, ttl 64, id 53734, offset 0, flags [DF], proto TCP (6), length 4100)
    127.0.0.1.10150 > 127.0.0.1.50504: Flags [P.], cksum 0x0df9 (incorrect -> 0xe3b3), seq 411029:415077, ack 987, win 512, options [nop,nop,TS val 346942593 ecr 346942593], length 4048
2022-04-06 17:04:20.090774 IP (tos 0x0, ttl 64, id 51001, offset 0, flags [DF], proto TCP (6), length 52)
    127.0.0.1.50504 > 127.0.0.1.10150: Flags [.], cksum 0xfe28 (incorrect -> 0x5178), seq 987, ack 415077, win 512, options [nop,nop,TS val 346942593 ecr 346942593], length 0
2022-04-06 17:04:20.090779 IP (tos 0x0, ttl 64, id 53735, offset 0, flags [DF], proto TCP (6), length 3972)
    127.0.0.1.10150 > 127.0.0.1.50504: Flags [P.], cksum 0x0d79 (incorrect -> 0x3a61), seq 415077:418997, ack 987, win 512, options [nop,nop,TS val 346942593 ecr 346942593], length 3920
2022-04-06 17:04:20.090790 IP (tos 0x0, ttl 64, id 51002, offset 0, flags [DF], proto TCP (6), length 52)
    127.0.0.1.50504 > 127.0.0.1.10150: Flags [.], cksum 0xfe28 (incorrect -> 0x4228), seq 987, ack 418997, win 512, options [nop,nop,TS val 346942593 ecr 346942593], length 0
2022-04-06 17:04:20.092456 IP (tos 0x0, ttl 64, id 53736, offset 0, flags [DF], proto TCP (6), length 2630)
    127.0.0.1.10150 > 127.0.0.1.50504: Flags [P.], cksum 0x083b (incorrect -> 0xab09), seq 418997:421575, ack 987, win 512, options [nop,nop,TS val 346942595 ecr 346942593], length 2578
2022-04-06 17:04:20.092635 IP (tos 0x0, ttl 64, id 51003, offset 0, flags [DF], proto TCP (6), length 52)
    127.0.0.1.50504 > 127.0.0.1.10150: Flags [.], cksum 0xfe28 (incorrect -> 0x3812), seq 987, ack 421575, win 512, options [nop,nop,TS val 346942595 ecr 346942595], length 0
2022-04-06 17:04:20.095886 IP (tos 0x0, ttl 64, id 53737, offset 0, flags [DF], proto TCP (6), length 4036)
    127.0.0.1.10150 > 127.0.0.1.50504: Flags [P.], cksum 0x0db9 (incorrect -> 0x74b2), seq 421575:425559, ack 987, win 512, options [nop,nop,TS val 346942598 ecr 346942595], length 3984
2022-04-06 17:04:20.095904 IP (tos 0x0, ttl 64, id 51004, offset 0, flags [DF], proto TCP (6), length 52)
    127.0.0.1.50504 > 127.0.0.1.10150: Flags [.], cksum 0xfe28 (incorrect -> 0x287c), seq 987, ack 425559, win 512, options [nop,nop,TS val 346942598 ecr 346942598], length 0
200, 4.7711851596832275, 2.5601840019226074