2022-04-06 08:43:26.603392 IP (tos 0x0, ttl 64, id 45351, offset 0, flags [DF], proto TCP (6), length 60)
    127.0.0.1.47182 > 127.0.0.1.9250: Flags [S], cksum 0xfe30 (incorrect -> 0x5e31), seq 1514229801, win 65495, options [mss 65495,sackOK,TS val 316889106 ecr 0,nop,wscale 7], length 0
2022-04-06 08:43:26.603400 IP (tos 0x0, ttl 64, id 0, offset 0, flags [DF], proto TCP (6), length 60)
    127.0.0.1.9250 > 127.0.0.1.47182: Flags [S.], cksum 0xfe30 (incorrect -> 0x9451), seq 4056771863, ack 1514229802, win 65483, options [mss 65495,sackOK,TS val 316889106 ecr 316889106,nop,wscale 7], length 0
2022-04-06 08:43:26.603407 IP (tos 0x0, ttl 64, id 45352, offset 0, flags [DF], proto TCP (6), length 52)
    127.0.0.1.47182 > 127.0.0.1.9250: Flags [.], cksum 0xfe28 (incorrect -> 0xbb0d), seq 1, ack 1, win 512, options [nop,nop,TS val 316889106 ecr 316889106], length 0
2022-04-06 08:43:26.603499 IP (tos 0x0, ttl 64, id 45353, offset 0, flags [DF], proto TCP (6), length 55)
    127.0.0.1.47182 > 127.0.0.1.9250: Flags [P.], cksum 0xfe2b (incorrect -> 0xb601), seq 1:4, ack 1, win 512, options [nop,nop,TS val 316889106 ecr 316889106], length 3
2022-04-06 08:43:26.603512 IP (tos 0x0, ttl 64, id 30034, offset 0, flags [DF], proto TCP (6), length 52)
    127.0.0.1.9250 > 127.0.0.1.47182: Flags [.], cksum 0xfe28 (incorrect -> 0xbb0a), seq 1, ack 4, win 512, options [nop,nop,TS val 316889106 ecr 316889106], length 0
2022-04-06 08:43:26.603546 IP (tos 0x0, ttl 64, id 30035, offset 0, flags [DF], proto TCP (6), length 54)
    127.0.0.1.9250 > 127.0.0.1.47182: Flags [P.], cksum 0xfe2a (incorrect -> 0xb600), seq 1:3, ack 4, win 512, options [nop,nop,TS val 316889106 ecr 316889106], length 2
2022-04-06 08:43:26.603559 IP (tos 0x0, ttl 64, id 45354, offset 0, flags [DF], proto TCP (6), length 52)
    127.0.0.1.47182 > 127.0.0.1.9250: Flags [.], cksum 0xfe28 (incorrect -> 0xbb08), seq 4, ack 3, win 512, options [nop,nop,TS val 316889106 ecr 316889106], length 0
2022-04-06 08:43:26.604577 IP (tos 0x0, ttl 64, id 45355, offset 0, flags [DF], proto TCP (6), length 62)
    127.0.0.1.47182 > 127.0.0.1.9250: Flags [P.], cksum 0xfe32 (incorrect -> 0xeb33), seq 4:14, ack 3, win 512, options [nop,nop,TS val 316889107 ecr 316889106], length 10
2022-04-06 08:43:26.604585 IP (tos 0x0, ttl 64, id 30036, offset 0, flags [DF], proto TCP (6), length 52)
    127.0.0.1.9250 > 127.0.0.1.47182: Flags [.], cksum 0xfe28 (incorrect -> 0xbafc), seq 3, ack 14, win 512, options [nop,nop,TS val 316889107 ecr 316889107], length 0
2022-04-06 08:43:26.730750 IP (tos 0x0, ttl 64, id 30037, offset 0, flags [DF], proto TCP (6), length 62)
    127.0.0.1.9250 > 127.0.0.1.47182: Flags [P.], cksum 0xfe32 (incorrect -> 0xb56b), seq 3:13, ack 14, win 512, options [nop,nop,TS val 316889233 ecr 316889107], length 10
2022-04-06 08:43:26.730757 IP (tos 0x0, ttl 64, id 45356, offset 0, flags [DF], proto TCP (6), length 52)
    127.0.0.1.47182 > 127.0.0.1.9250: Flags [.], cksum 0xfe28 (incorrect -> 0xb9f6), seq 14, ack 13, win 512, options [nop,nop,TS val 316889233 ecr 316889233], length 0
2022-04-06 08:43:26.736367 IP (tos 0x0, ttl 64, id 45357, offset 0, flags [DF], proto TCP (6), length 569)
    127.0.0.1.47182 > 127.0.0.1.9250: Flags [P.], cksum 0x002e (incorrect -> 0x517e), seq 14:531, ack 13, win 512, options [nop,nop,TS val 316889239 ecr 316889233], length 517
2022-04-06 08:43:26.736375 IP (tos 0x0, ttl 64, id 30038, offset 0, flags [DF], proto TCP (6), length 52)
    127.0.0.1.9250 > 127.0.0.1.47182: Flags [.], cksum 0xfe28 (incorrect -> 0xb7e9), seq 13, ack 531, win 508, options [nop,nop,TS val 316889239 ecr 316889239], length 0
200, 5.63179349899292, 0.9176032543182373