2022-04-06 13:39:09.575125 IP (tos 0x0, ttl 64, id 4894, offset 0, flags [DF], proto TCP (6), length 60)
    127.0.0.1.54050 > 127.0.0.1.11550: Flags [S], cksum 0xfe30 (incorrect -> 0xa92d), seq 683365720, win 65495, options [mss 65495,sackOK,TS val 334632078 ecr 0,nop,wscale 7], length 0
2022-04-06 13:39:09.575140 IP (tos 0x0, ttl 64, id 0, offset 0, flags [DF], proto TCP (6), length 60)
    127.0.0.1.11550 > 127.0.0.1.54050: Flags [S.], cksum 0xfe30 (incorrect -> 0x3ea9), seq 2756877740, ack 683365721, win 65483, options [mss 65495,sackOK,TS val 334632078 ecr 334632078,nop,wscale 7], length 0
2022-04-06 13:39:09.575153 IP (tos 0x0, ttl 64, id 4895, offset 0, flags [DF], proto TCP (6), length 52)
    127.0.0.1.54050 > 127.0.0.1.11550: Flags [.], cksum 0xfe28 (incorrect -> 0x6565), seq 1, ack 1, win 512, options [nop,nop,TS val 334632078 ecr 334632078], length 0
2022-04-06 13:39:09.575261 IP (tos 0x0, ttl 64, id 4896, offset 0, flags [DF], proto TCP (6), length 55)
    127.0.0.1.54050 > 127.0.0.1.11550: Flags [P.], cksum 0xfe2b (incorrect -> 0x6059), seq 1:4, ack 1, win 512, options [nop,nop,TS val 334632078 ecr 334632078], length 3
2022-04-06 13:39:09.575274 IP (tos 0x0, ttl 64, id 58898, offset 0, flags [DF], proto TCP (6), length 52)
    127.0.0.1.11550 > 127.0.0.1.54050: Flags [.], cksum 0xfe28 (incorrect -> 0x6562), seq 1, ack 4, win 512, options [nop,nop,TS val 334632078 ecr 334632078], length 0
2022-04-06 13:39:09.575303 IP (tos 0x0, ttl 64, id 58899, offset 0, flags [DF], proto TCP (6), length 54)
    127.0.0.1.11550 > 127.0.0.1.54050: Flags [P.], cksum 0xfe2a (incorrect -> 0x6058), seq 1:3, ack 4, win 512, options [nop,nop,TS val 334632078 ecr 334632078], length 2
2022-04-06 13:39:09.575316 IP (tos 0x0, ttl 64, id 4897, offset 0, flags [DF], proto TCP (6), length 52)
    127.0.0.1.54050 > 127.0.0.1.11550: Flags [.], cksum 0xfe28 (incorrect -> 0x6560), seq 4, ack 3, win 512, options [nop,nop,TS val 334632078 ecr 334632078], length 0
2022-04-06 13:39:09.597870 IP (tos 0x0, ttl 64, id 4898, offset 0, flags [DF], proto TCP (6), length 62)
    127.0.0.1.54050 > 127.0.0.1.11550: Flags [P.], cksum 0xfe32 (incorrect -> 0xba72), seq 4:14, ack 3, win 512, options [nop,nop,TS val 334632100 ecr 334632078], length 10
2022-04-06 13:39:09.597881 IP (tos 0x0, ttl 64, id 58900, offset 0, flags [DF], proto TCP (6), length 52)
    127.0.0.1.11550 > 127.0.0.1.54050: Flags [.], cksum 0xfe28 (incorrect -> 0x652a), seq 3, ack 14, win 512, options [nop,nop,TS val 334632100 ecr 334632100], length 0
2022-04-06 13:39:09.669641 IP (tos 0x0, ttl 64, id 58901, offset 0, flags [DF], proto TCP (6), length 62)
    127.0.0.1.11550 > 127.0.0.1.54050: Flags [P.], cksum 0xfe32 (incorrect -> 0x5fcf), seq 3:13, ack 14, win 512, options [nop,nop,TS val 334632172 ecr 334632100], length 10
2022-04-06 13:39:09.669651 IP (tos 0x0, ttl 64, id 4899, offset 0, flags [DF], proto TCP (6), length 52)
    127.0.0.1.54050 > 127.0.0.1.11550: Flags [.], cksum 0xfe28 (incorrect -> 0x6490), seq 14, ack 13, win 512, options [nop,nop,TS val 334632172 ecr 334632172], length 0
2022-04-06 13:39:09.675680 IP (tos 0x0, ttl 64, id 4900, offset 0, flags [DF], proto TCP (6), length 569)
    127.0.0.1.54050 > 127.0.0.1.11550: Flags [P.], cksum 0x002e (incorrect -> 0x946b), seq 14:531, ack 13, win 512, options [nop,nop,TS val 334632178 ecr 334632172], length 517
2022-04-06 13:39:09.675695 IP (tos 0x0, ttl 64, id 58902, offset 0, flags [DF], proto TCP (6), length 52)
    127.0.0.1.11550 > 127.0.0.1.54050: Flags [.], cksum 0xfe28 (incorrect -> 0x6283), seq 13, ack 531, win 508, options [nop,nop,TS val 334632178 ecr 334632178], length 0
2022-04-06 13:39:09.747388 IP (tos 0x0, ttl 64, id 58903, offset 0, flags [DF], proto TCP (6), length 151)
    127.0.0.1.11550 > 127.0.0.1.54050: Flags [P.], cksum 0xfe8b (incorrect -> 0x6c06), seq 13:112, ack 531, win 512, options [nop,nop,TS val 334632250 ecr 334632178], length 99
2022-04-06 13:39:09.747397 IP (tos 0x0, ttl 64, id 4901, offset 0, flags [DF], proto TCP (6), length 52)
    127.0.0.1.54050 > 127.0.0.1.11550: Flags [.], cksum 0xfe28 (incorrect -> 0x618c), seq 531, ack 112, win 512, options [nop,nop,TS val 334632250 ecr 334632250], length 0
2022-04-06 13:39:09.747531 IP (tos 0x0, ttl 64, id 4902, offset 0, flags [DF], proto TCP (6), length 575)
    127.0.0.1.54050 > 127.0.0.1.11550: Flags [P.], cksum 0x0034 (incorrect -> 0xba5a), seq 531:1054, ack 112, win 512, options [nop,nop,TS val 334632250 ecr 334632250], length 523
2022-04-06 13:39:09.747539 IP (tos 0x0, ttl 64, id 58904, offset 0, flags [DF], proto TCP (6), length 52)
    127.0.0.1.11550 > 127.0.0.1.54050: Flags [.], cksum 0xfe28 (incorrect -> 0x5f85), seq 112, ack 1054, win 508, options [nop,nop,TS val 334632250 ecr 334632250], length 0
2022-04-06 13:39:09.817824 IP (tos 0x0, ttl 64, id 58905, offset 0, flags [DF], proto TCP (6), length 3538)
    127.0.0.1.11550 > 127.0.0.1.54050: Flags [P.], cksum 0x0bc7 (incorrect -> 0x65d2), seq 112:3598, ack 1054, win 512, options [nop,nop,TS val 334632320 ecr 334632250], length 3486
2022-04-06 13:39:09.817832 IP (tos 0x0, ttl 64, id 4903, offset 0, flags [DF], proto TCP (6), length 52)
    127.0.0.1.54050 > 127.0.0.1.11550: Flags [.], cksum 0xfe28 (incorrect -> 0x5169), seq 1054, ack 3598, win 494, options [nop,nop,TS val 334632320 ecr 334632320], length 0
2022-04-06 13:39:09.819437 IP (tos 0x0, ttl 64, id 58906, offset 0, flags [DF], proto TCP (6), length 2044)
    127.0.0.1.11550 > 127.0.0.1.54050: Flags [P.], cksum 0x05f1 (incorrect -> 0x1f38), seq 3598:5590, ack 1054, win 512, options [nop,nop,TS val 334632322 ecr 334632320], length 1992
2022-04-06 13:39:09.819446 IP (tos 0x0, ttl 64, id 4904, offset 0, flags [DF], proto TCP (6), length 52)
    127.0.0.1.54050 > 127.0.0.1.11550: Flags [.], cksum 0xfe28 (incorrect -> 0x4997), seq 1054, ack 5590, win 500, options [nop,nop,TS val 334632322 ecr 334632322], length 0
2022-04-06 13:39:09.823525 IP (tos 0x0, ttl 64, id 58907, offset 0, flags [DF], proto TCP (6), length 2044)
    127.0.0.1.11550 > 127.0.0.1.54050: Flags [P.], cksum 0x05f1 (incorrect -> 0x669f), seq 5590:7582, ack 1054, win 512, options [nop,nop,TS val 334632326 ecr 334632322], length 1992
2022-04-06 13:39:09.823533 IP (tos 0x0, ttl 64, id 4905, offset 0, flags [DF], proto TCP (6), length 52)
    127.0.0.1.54050 > 127.0.0.1.11550: Flags [.], cksum 0xfe28 (incorrect -> 0x41c7), seq 1054, ack 7582, win 500, options [nop,nop,TS val 334632326 ecr 334632326], length 0
2022-04-06 13:39:09.834108 IP (tos 0x0, ttl 64, id 58908, offset 0, flags [DF], proto TCP (6), length 1022)
    127.0.0.1.11550 > 127.0.0.1.54050: Flags [P.], cksum 0x01f3 (incorrect -> 0x15a7), seq 7582:8552, ack 1054, win 512, options [nop,nop,TS val 334632337 ecr 334632326], length 970
2022-04-06 13:39:09.834116 IP (tos 0x0, ttl 64, id 4906, offset 0, flags [DF], proto TCP (6), length 52)
    127.0.0.1.54050 > 127.0.0.1.11550: Flags [.], cksum 0xfe28 (incorrect -> 0x3de3), seq 1054, ack 8552, win 504, options [nop,nop,TS val 334632337 ecr 334632337], length 0
2022-04-06 13:39:09.841846 IP (tos 0x0, ttl 64, id 58909, offset 0, flags [DF], proto TCP (6), length 1552)
    127.0.0.1.11550 > 127.0.0.1.54050: Flags [P.], cksum 0x0405 (incorrect -> 0x0f65), seq 8552:10052, ack 1054, win 512, options [nop,nop,TS val 334632344 ecr 334632337], length 1500
2022-04-06 13:39:09.841854 IP (tos 0x0, ttl 64, id 4907, offset 0, flags [DF], proto TCP (6), length 52)
    127.0.0.1.54050 > 127.0.0.1.11550: Flags [.], cksum 0xfe28 (incorrect -> 0x37fb), seq 1054, ack 10052, win 502, options [nop,nop,TS val 334632344 ecr 334632344], length 0
2022-04-06 13:39:09.909328 IP (tos 0x0, ttl 64, id 58910, offset 0, flags [DF], proto TCP (6), length 412)
    127.0.0.1.11550 > 127.0.0.1.54050: Flags [P.], cksum 0xff90 (incorrect -> 0x9a68), seq 10052:10412, ack 1054, win 512, options [nop,nop,TS val 334632412 ecr 334632344], length 360
2022-04-06 13:39:09.909337 IP (tos 0x0, ttl 64, id 4908, offset 0, flags [DF], proto TCP (6), length 52)
    127.0.0.1.54050 > 127.0.0.1.11550: Flags [.], cksum 0xfe28 (incorrect -> 0x3607), seq 1054, ack 10412, win 506, options [nop,nop,TS val 334632412 ecr 334632412], length 0
2022-04-06 13:39:09.909458 IP (tos 0x0, ttl 64, id 4909, offset 0, flags [DF], proto TCP (6), length 126)
    127.0.0.1.54050 > 127.0.0.1.11550: Flags [P.], cksum 0xfe72 (incorrect -> 0xde48), seq 1054:1128, ack 10412, win 512, options [nop,nop,TS val 334632412 ecr 334632412], length 74
2022-04-06 13:39:09.909465 IP (tos 0x0, ttl 64, id 58911, offset 0, flags [DF], proto TCP (6), length 52)
    127.0.0.1.11550 > 127.0.0.1.54050: Flags [.], cksum 0xfe28 (incorrect -> 0x35b7), seq 10412, ack 1128, win 512, options [nop,nop,TS val 334632412 ecr 334632412], length 0
2022-04-06 13:39:09.909880 IP (tos 0x0, ttl 64, id 4910, offset 0, flags [DF], proto TCP (6), length 409)
    127.0.0.1.54050 > 127.0.0.1.11550: Flags [P.], cksum 0xff8d (incorrect -> 0x9e6f), seq 1128:1485, ack 10412, win 512, options [nop,nop,TS val 334632412 ecr 334632412], length 357
2022-04-06 13:39:09.909889 IP (tos 0x0, ttl 64, id 58912, offset 0, flags [DF], proto TCP (6), length 52)
    127.0.0.1.11550 > 127.0.0.1.54050: Flags [.], cksum 0xfe28 (incorrect -> 0x3454), seq 10412, ack 1485, win 510, options [nop,nop,TS val 334632412 ecr 334632412], length 0
2022-04-06 13:39:09.977039 IP (tos 0x0, ttl 64, id 58913, offset 0, flags [DF], proto TCP (6), length 339)
    127.0.0.1.11550 > 127.0.0.1.54050: Flags [P.], cksum 0xff47 (incorrect -> 0xd4c8), seq 10412:10699, ack 1485, win 512, options [nop,nop,TS val 334632479 ecr 334632412], length 287
2022-04-06 13:39:10.018691 IP (tos 0x0, ttl 64, id 4911, offset 0, flags [DF], proto TCP (6), length 52)
    127.0.0.1.54050 > 127.0.0.1.11550: Flags [.], cksum 0xfe28 (incorrect -> 0x3283), seq 1485, ack 10699, win 512, options [nop,nop,TS val 334632521 ecr 334632479], length 0
2022-04-06 13:39:10.042920 IP (tos 0x0, ttl 64, id 58914, offset 0, flags [DF], proto TCP (6), length 339)
    127.0.0.1.11550 > 127.0.0.1.54050: Flags [P.], cksum 0xff47 (incorrect -> 0x942d), seq 10699:10986, ack 1485, win 512, options [nop,nop,TS val 334632545 ecr 334632521], length 287
2022-04-06 13:39:10.042945 IP (tos 0x0, ttl 64, id 4912, offset 0, flags [DF], proto TCP (6), length 52)
    127.0.0.1.54050 > 127.0.0.1.11550: Flags [.], cksum 0xfe28 (incorrect -> 0x310c), seq 1485, ack 10986, win 510, options [nop,nop,TS val 334632545 ecr 334632545], length 0
200, 4.887655019760132, 1.5901572704315186