2022-04-06 07:45:09.935161 IP (tos 0x0, ttl 64, id 17054, offset 0, flags [DF], proto TCP (6), length 60)
    127.0.0.1.49742 > 127.0.0.1.10150: Flags [S], cksum 0xfe30 (incorrect -> 0x0d79), seq 113590763, win 65495, options [mss 65495,sackOK,TS val 313392438 ecr 0,nop,wscale 7], length 0
2022-04-06 07:45:09.935172 IP (tos 0x0, ttl 64, id 0, offset 0, flags [DF], proto TCP (6), length 60)
    127.0.0.1.10150 > 127.0.0.1.49742: Flags [S.], cksum 0xfe30 (incorrect -> 0x5553), seq 1730494743, ack 113590764, win 65483, options [mss 65495,sackOK,TS val 313392438 ecr 313392438,nop,wscale 7], length 0
2022-04-06 07:45:09.935180 IP (tos 0x0, ttl 64, id 17055, offset 0, flags [DF], proto TCP (6), length 52)
    127.0.0.1.49742 > 127.0.0.1.10150: Flags [.], cksum 0xfe28 (incorrect -> 0x7c0f), seq 1, ack 1, win 512, options [nop,nop,TS val 313392438 ecr 313392438], length 0
2022-04-06 07:45:09.935282 IP (tos 0x0, ttl 64, id 17056, offset 0, flags [DF], proto TCP (6), length 55)
    127.0.0.1.49742 > 127.0.0.1.10150: Flags [P.], cksum 0xfe2b (incorrect -> 0x7703), seq 1:4, ack 1, win 512, options [nop,nop,TS val 313392438 ecr 313392438], length 3
2022-04-06 07:45:09.935296 IP (tos 0x0, ttl 64, id 34929, offset 0, flags [DF], proto TCP (6), length 52)
    127.0.0.1.10150 > 127.0.0.1.49742: Flags [.], cksum 0xfe28 (incorrect -> 0x7c0c), seq 1, ack 4, win 512, options [nop,nop,TS val 313392438 ecr 313392438], length 0
2022-04-06 07:45:09.935349 IP (tos 0x0, ttl 64, id 34930, offset 0, flags [DF], proto TCP (6), length 54)
    127.0.0.1.10150 > 127.0.0.1.49742: Flags [P.], cksum 0xfe2a (incorrect -> 0x7702), seq 1:3, ack 4, win 512, options [nop,nop,TS val 313392438 ecr 313392438], length 2
2022-04-06 07:45:09.935361 IP (tos 0x0, ttl 64, id 17057, offset 0, flags [DF], proto TCP (6), length 52)
    127.0.0.1.49742 > 127.0.0.1.10150: Flags [.], cksum 0xfe28 (incorrect -> 0x7c0a), seq 4, ack 3, win 512, options [nop,nop,TS val 313392438 ecr 313392438], length 0
2022-04-06 07:45:09.947260 IP (tos 0x0, ttl 64, id 17058, offset 0, flags [DF], proto TCP (6), length 62)
    127.0.0.1.49742 > 127.0.0.1.10150: Flags [P.], cksum 0xfe32 (incorrect -> 0x3a58), seq 4:14, ack 3, win 512, options [nop,nop,TS val 313392450 ecr 313392438], length 10
2022-04-06 07:45:09.947279 IP (tos 0x0, ttl 64, id 34931, offset 0, flags [DF], proto TCP (6), length 52)
    127.0.0.1.10150 > 127.0.0.1.49742: Flags [.], cksum 0xfe28 (incorrect -> 0x7be8), seq 3, ack 14, win 512, options [nop,nop,TS val 313392450 ecr 313392450], length 0
2022-04-06 07:45:10.040829 IP (tos 0x0, ttl 64, id 34932, offset 0, flags [DF], proto TCP (6), length 62)
    127.0.0.1.10150 > 127.0.0.1.49742: Flags [P.], cksum 0xfe32 (incorrect -> 0x7678), seq 3:13, ack 14, win 512, options [nop,nop,TS val 313392543 ecr 313392450], length 10
2022-04-06 07:45:10.040845 IP (tos 0x0, ttl 64, id 17059, offset 0, flags [DF], proto TCP (6), length 52)
    127.0.0.1.49742 > 127.0.0.1.10150: Flags [.], cksum 0xfe28 (incorrect -> 0x7b24), seq 14, ack 13, win 512, options [nop,nop,TS val 313392543 ecr 313392543], length 0
2022-04-06 07:45:10.047117 IP (tos 0x0, ttl 64, id 17060, offset 0, flags [DF], proto TCP (6), length 569)
    127.0.0.1.49742 > 127.0.0.1.10150: Flags [P.], cksum 0x002e (incorrect -> 0xd83d), seq 14:531, ack 13, win 512, options [nop,nop,TS val 313392550 ecr 313392543], length 517
2022-04-06 07:45:10.047141 IP (tos 0x0, ttl 64, id 34933, offset 0, flags [DF], proto TCP (6), length 52)
    127.0.0.1.10150 > 127.0.0.1.49742: Flags [.], cksum 0xfe28 (incorrect -> 0x7915), seq 13, ack 531, win 508, options [nop,nop,TS val 313392550 ecr 313392550], length 0
200, 5.829902172088623, 0.4226493835449219