2022-04-06 23:26:17.274040 IP (tos 0x0, ttl 64, id 53944, offset 0, flags [DF], proto TCP (6), length 60)
    127.0.0.1.33054 > 127.0.0.1.9350: Flags [S], cksum 0xfe30 (incorrect -> 0xda76), seq 5774531, win 65495, options [mss 65495,sackOK,TS val 369859776 ecr 0,nop,wscale 7], length 0
2022-04-06 23:26:17.274050 IP (tos 0x0, ttl 64, id 0, offset 0, flags [DF], proto TCP (6), length 60)
    127.0.0.1.9350 > 127.0.0.1.33054: Flags [S.], cksum 0xfe30 (incorrect -> 0xb2dc), seq 2476990757, ack 5774532, win 65483, options [mss 65495,sackOK,TS val 369859776 ecr 369859776,nop,wscale 7], length 0
2022-04-06 23:26:17.274057 IP (tos 0x0, ttl 64, id 53945, offset 0, flags [DF], proto TCP (6), length 52)
    127.0.0.1.33054 > 127.0.0.1.9350: Flags [.], cksum 0xfe28 (incorrect -> 0xd998), seq 1, ack 1, win 512, options [nop,nop,TS val 369859776 ecr 369859776], length 0
2022-04-06 23:26:17.274219 IP (tos 0x0, ttl 64, id 53946, offset 0, flags [DF], proto TCP (6), length 55)
    127.0.0.1.33054 > 127.0.0.1.9350: Flags [P.], cksum 0xfe2b (incorrect -> 0xd48b), seq 1:4, ack 1, win 512, options [nop,nop,TS val 369859777 ecr 369859776], length 3
2022-04-06 23:26:17.274227 IP (tos 0x0, ttl 64, id 14392, offset 0, flags [DF], proto TCP (6), length 52)
    127.0.0.1.9350 > 127.0.0.1.33054: Flags [.], cksum 0xfe28 (incorrect -> 0xd993), seq 1, ack 4, win 512, options [nop,nop,TS val 369859777 ecr 369859777], length 0
2022-04-06 23:26:17.274260 IP (tos 0x0, ttl 64, id 14393, offset 0, flags [DF], proto TCP (6), length 54)
    127.0.0.1.9350 > 127.0.0.1.33054: Flags [P.], cksum 0xfe2a (incorrect -> 0xd489), seq 1:3, ack 4, win 512, options [nop,nop,TS val 369859777 ecr 369859777], length 2
2022-04-06 23:26:17.274269 IP (tos 0x0, ttl 64, id 53947, offset 0, flags [DF], proto TCP (6), length 52)
    127.0.0.1.33054 > 127.0.0.1.9350: Flags [.], cksum 0xfe28 (incorrect -> 0xd991), seq 4, ack 3, win 512, options [nop,nop,TS val 369859777 ecr 369859777], length 0
2022-04-06 23:26:17.285458 IP (tos 0x0, ttl 64, id 53948, offset 0, flags [DF], proto TCP (6), length 62)
    127.0.0.1.33054 > 127.0.0.1.9350: Flags [P.], cksum 0xfe32 (incorrect -> 0x15e8), seq 4:14, ack 3, win 512, options [nop,nop,TS val 369859788 ecr 369859777], length 10
2022-04-06 23:26:17.285486 IP (tos 0x0, ttl 64, id 14394, offset 0, flags [DF], proto TCP (6), length 52)
    127.0.0.1.9350 > 127.0.0.1.33054: Flags [.], cksum 0xfe28 (incorrect -> 0xd971), seq 3, ack 14, win 512, options [nop,nop,TS val 369859788 ecr 369859788], length 0
2022-04-06 23:26:17.530273 IP (tos 0x0, ttl 64, id 14395, offset 0, flags [DF], proto TCP (6), length 62)
    127.0.0.1.9350 > 127.0.0.1.33054: Flags [P.], cksum 0xfe32 (incorrect -> 0xd369), seq 3:13, ack 14, win 512, options [nop,nop,TS val 369860033 ecr 369859788], length 10
2022-04-06 23:26:17.530287 IP (tos 0x0, ttl 64, id 53949, offset 0, flags [DF], proto TCP (6), length 52)
    127.0.0.1.33054 > 127.0.0.1.9350: Flags [.], cksum 0xfe28 (incorrect -> 0xd77d), seq 14, ack 13, win 512, options [nop,nop,TS val 369860033 ecr 369860033], length 0
2022-04-06 23:26:17.536498 IP (tos 0x0, ttl 64, id 53950, offset 0, flags [DF], proto TCP (6), length 569)
    127.0.0.1.33054 > 127.0.0.1.9350: Flags [P.], cksum 0x002e (incorrect -> 0xf58d), seq 14:531, ack 13, win 512, options [nop,nop,TS val 369860039 ecr 369860033], length 517
2022-04-06 23:26:17.536509 IP (tos 0x0, ttl 64, id 14396, offset 0, flags [DF], proto TCP (6), length 52)
    127.0.0.1.9350 > 127.0.0.1.33054: Flags [.], cksum 0xfe28 (incorrect -> 0xd570), seq 13, ack 531, win 508, options [nop,nop,TS val 369860039 ecr 369860039], length 0
2022-04-06 23:26:17.775573 IP (tos 0x0, ttl 64, id 14397, offset 0, flags [DF], proto TCP (6), length 2948)
    127.0.0.1.9350 > 127.0.0.1.33054: Flags [P.], cksum 0x0979 (incorrect -> 0x5063), seq 13:2909, ack 531, win 512, options [nop,nop,TS val 369860278 ecr 369860039], length 2896
2022-04-06 23:26:17.775588 IP (tos 0x0, ttl 64, id 53951, offset 0, flags [DF], proto TCP (6), length 52)
    127.0.0.1.33054 > 127.0.0.1.9350: Flags [.], cksum 0xfe28 (incorrect -> 0xc84e), seq 531, ack 2909, win 496, options [nop,nop,TS val 369860278 ecr 369860278], length 0
2022-04-06 23:26:17.902839 IP (tos 0x0, ttl 64, id 14398, offset 0, flags [DF], proto TCP (6), length 525)
    127.0.0.1.9350 > 127.0.0.1.33054: Flags [P.], cksum 0x0002 (incorrect -> 0xa369), seq 2909:3382, ack 531, win 512, options [nop,nop,TS val 369860405 ecr 369860278], length 473
2022-04-06 23:26:17.902850 IP (tos 0x0, ttl 64, id 53952, offset 0, flags [DF], proto TCP (6), length 52)
    127.0.0.1.33054 > 127.0.0.1.9350: Flags [.], cksum 0xfe28 (incorrect -> 0xc56d), seq 531, ack 3382, win 506, options [nop,nop,TS val 369860405 ecr 369860405], length 0
2022-04-06 23:26:17.903446 IP (tos 0x0, ttl 64, id 53953, offset 0, flags [DF], proto TCP (6), length 116)
    127.0.0.1.33054 > 127.0.0.1.9350: Flags [P.], cksum 0xfe68 (incorrect -> 0x3e10), seq 531:595, ack 3382, win 512, options [nop,nop,TS val 369860406 ecr 369860405], length 64
2022-04-06 23:26:17.903455 IP (tos 0x0, ttl 64, id 14399, offset 0, flags [DF], proto TCP (6), length 52)
    127.0.0.1.9350 > 127.0.0.1.33054: Flags [.], cksum 0xfe28 (incorrect -> 0xc525), seq 3382, ack 595, win 512, options [nop,nop,TS val 369860406 ecr 369860406], length 0
2022-04-06 23:26:17.904067 IP (tos 0x0, ttl 64, id 53954, offset 0, flags [DF], proto TCP (6), length 342)
    127.0.0.1.33054 > 127.0.0.1.9350: Flags [P.], cksum 0xff4a (incorrect -> 0xf7f0), seq 595:885, ack 3382, win 512, options [nop,nop,TS val 369860407 ecr 369860406], length 290
2022-04-06 23:26:17.904076 IP (tos 0x0, ttl 64, id 14400, offset 0, flags [DF], proto TCP (6), length 52)
    127.0.0.1.9350 > 127.0.0.1.33054: Flags [.], cksum 0xfe28 (incorrect -> 0xc403), seq 3382, ack 885, win 510, options [nop,nop,TS val 369860407 ecr 369860407], length 0
2022-04-06 23:26:18.145723 IP (tos 0x0, ttl 64, id 14401, offset 0, flags [DF], proto TCP (6), length 594)
    127.0.0.1.9350 > 127.0.0.1.33054: Flags [P.], cksum 0x0047 (incorrect -> 0x1436), seq 3382:3924, ack 885, win 512, options [nop,nop,TS val 369860648 ecr 369860407], length 542
2022-04-06 23:26:18.145735 IP (tos 0x0, ttl 64, id 53955, offset 0, flags [DF], proto TCP (6), length 52)
    127.0.0.1.33054 > 127.0.0.1.9350: Flags [.], cksum 0xfe28 (incorrect -> 0xc005), seq 885, ack 3924, win 508, options [nop,nop,TS val 369860648 ecr 369860648], length 0
2022-04-06 23:26:18.287683 IP (tos 0x0, ttl 64, id 14402, offset 0, flags [DF], proto TCP (6), length 1447)
    127.0.0.1.9350 > 127.0.0.1.33054: Flags [P.], cksum 0x039c (incorrect -> 0xed52), seq 3924:5319, ack 885, win 512, options [nop,nop,TS val 369860790 ecr 369860648], length 1395
2022-04-06 23:26:18.287695 IP (tos 0x0, ttl 64, id 53956, offset 0, flags [DF], proto TCP (6), length 52)
    127.0.0.1.33054 > 127.0.0.1.9350: Flags [.], cksum 0xfe28 (incorrect -> 0xb97c), seq 885, ack 5319, win 502, options [nop,nop,TS val 369860790 ecr 369860790], length 0
2022-04-06 23:26:18.387251 IP (tos 0x0, ttl 64, id 14403, offset 0, flags [DF], proto TCP (6), length 91)
    127.0.0.1.9350 > 127.0.0.1.33054: Flags [P.], cksum 0xfe4f (incorrect -> 0x53b1), seq 5319:5358, ack 885, win 512, options [nop,nop,TS val 369860890 ecr 369860790], length 39
2022-04-06 23:26:18.387259 IP (tos 0x0, ttl 64, id 53957, offset 0, flags [DF], proto TCP (6), length 52)
    127.0.0.1.33054 > 127.0.0.1.9350: Flags [.], cksum 0xfe28 (incorrect -> 0xb888), seq 885, ack 5358, win 507, options [nop,nop,TS val 369860890 ecr 369860890], length 0
2022-04-06 23:26:18.388713 IP (tos 0x0, ttl 64, id 15648, offset 0, flags [DF], proto TCP (6), length 60)
    127.0.0.1.33056 > 127.0.0.1.9350: Flags [S], cksum 0xfe30 (incorrect -> 0x67d5), seq 467169159, win 65495, options [mss 65495,sackOK,TS val 369860891 ecr 0,nop,wscale 7], length 0
2022-04-06 23:26:18.388722 IP (tos 0x0, ttl 64, id 0, offset 0, flags [DF], proto TCP (6), length 60)
    127.0.0.1.9350 > 127.0.0.1.33056: Flags [S.], cksum 0xfe30 (incorrect -> 0x445d), seq 3875112274, ack 467169160, win 65483, options [mss 65495,sackOK,TS val 369860891 ecr 369860891,nop,wscale 7], length 0
2022-04-06 23:26:18.388729 IP (tos 0x0, ttl 64, id 15649, offset 0, flags [DF], proto TCP (6), length 52)
    127.0.0.1.33056 > 127.0.0.1.9350: Flags [.], cksum 0xfe28 (incorrect -> 0x6b19), seq 1, ack 1, win 512, options [nop,nop,TS val 369860891 ecr 369860891], length 0
2022-04-06 23:26:18.388830 IP (tos 0x0, ttl 64, id 15650, offset 0, flags [DF], proto TCP (6), length 55)
    127.0.0.1.33056 > 127.0.0.1.9350: Flags [P.], cksum 0xfe2b (incorrect -> 0x660d), seq 1:4, ack 1, win 512, options [nop,nop,TS val 369860891 ecr 369860891], length 3
2022-04-06 23:26:18.388837 IP (tos 0x0, ttl 64, id 11246, offset 0, flags [DF], proto TCP (6), length 52)
    127.0.0.1.9350 > 127.0.0.1.33056: Flags [.], cksum 0xfe28 (incorrect -> 0x6b16), seq 1, ack 4, win 512, options [nop,nop,TS val 369860891 ecr 369860891], length 0
2022-04-06 23:26:18.388856 IP (tos 0x0, ttl 64, id 11247, offset 0, flags [DF], proto TCP (6), length 54)
    127.0.0.1.9350 > 127.0.0.1.33056: Flags [P.], cksum 0xfe2a (incorrect -> 0x660c), seq 1:3, ack 4, win 512, options [nop,nop,TS val 369860891 ecr 369860891], length 2
2022-04-06 23:26:18.388863 IP (tos 0x0, ttl 64, id 15651, offset 0, flags [DF], proto TCP (6), length 52)
    127.0.0.1.33056 > 127.0.0.1.9350: Flags [.], cksum 0xfe28 (incorrect -> 0x6b14), seq 4, ack 3, win 512, options [nop,nop,TS val 369860891 ecr 369860891], length 0
2022-04-06 23:26:18.410058 IP (tos 0x0, ttl 64, id 15652, offset 0, flags [DF], proto TCP (6), length 62)
    127.0.0.1.33056 > 127.0.0.1.9350: Flags [P.], cksum 0xfe32 (incorrect -> 0xa760), seq 4:14, ack 3, win 512, options [nop,nop,TS val 369860912 ecr 369860891], length 10
2022-04-06 23:26:18.410077 IP (tos 0x0, ttl 64, id 11248, offset 0, flags [DF], proto TCP (6), length 52)
    127.0.0.1.9350 > 127.0.0.1.33056: Flags [.], cksum 0xfe28 (incorrect -> 0x6adf), seq 3, ack 14, win 512, options [nop,nop,TS val 369860913 ecr 369860912], length 0
2022-04-06 23:26:18.652589 IP (tos 0x0, ttl 64, id 11249, offset 0, flags [DF], proto TCP (6), length 62)
    127.0.0.1.9350 > 127.0.0.1.33056: Flags [P.], cksum 0xfe32 (incorrect -> 0x64da), seq 3:13, ack 14, win 512, options [nop,nop,TS val 369861155 ecr 369860912], length 10
2022-04-06 23:26:18.652603 IP (tos 0x0, ttl 64, id 15653, offset 0, flags [DF], proto TCP (6), length 52)
    127.0.0.1.33056 > 127.0.0.1.9350: Flags [.], cksum 0xfe28 (incorrect -> 0x68f0), seq 14, ack 13, win 512, options [nop,nop,TS val 369861155 ecr 369861155], length 0
2022-04-06 23:26:18.658361 IP (tos 0x0, ttl 64, id 15654, offset 0, flags [DF], proto TCP (6), length 569)
    127.0.0.1.33056 > 127.0.0.1.9350: Flags [P.], cksum 0x002e (incorrect -> 0x39a4), seq 14:531, ack 13, win 512, options [nop,nop,TS val 369861161 ecr 369861155], length 517
2022-04-06 23:26:18.658371 IP (tos 0x0, ttl 64, id 11250, offset 0, flags [DF], proto TCP (6), length 52)
    127.0.0.1.9350 > 127.0.0.1.33056: Flags [.], cksum 0xfe28 (incorrect -> 0x66e3), seq 13, ack 531, win 508, options [nop,nop,TS val 369861161 ecr 369861161], length 0
2022-04-06 23:26:18.901260 IP (tos 0x0, ttl 64, id 11251, offset 0, flags [DF], proto TCP (6), length 3421)
    127.0.0.1.9350 > 127.0.0.1.33056: Flags [P.], cksum 0x0b52 (incorrect -> 0x3e1f), seq 13:3382, ack 531, win 512, options [nop,nop,TS val 369861404 ecr 369861161], length 3369
2022-04-06 23:26:18.901269 IP (tos 0x0, ttl 64, id 15655, offset 0, flags [DF], proto TCP (6), length 52)
    127.0.0.1.33056 > 127.0.0.1.9350: Flags [.], cksum 0xfe28 (incorrect -> 0x57e2), seq 531, ack 3382, win 494, options [nop,nop,TS val 369861404 ecr 369861404], length 0
2022-04-06 23:26:18.901914 IP (tos 0x0, ttl 64, id 15656, offset 0, flags [DF], proto TCP (6), length 116)
    127.0.0.1.33056 > 127.0.0.1.9350: Flags [P.], cksum 0xfe68 (incorrect -> 0x03f5), seq 531:595, ack 3382, win 512, options [nop,nop,TS val 369861404 ecr 369861404], length 64
2022-04-06 23:26:18.901924 IP (tos 0x0, ttl 64, id 11252, offset 0, flags [DF], proto TCP (6), length 52)
    127.0.0.1.9350 > 127.0.0.1.33056: Flags [.], cksum 0xfe28 (incorrect -> 0x5790), seq 3382, ack 595, win 512, options [nop,nop,TS val 369861404 ecr 369861404], length 0
2022-04-06 23:26:18.902277 IP (tos 0x0, ttl 64, id 15657, offset 0, flags [DF], proto TCP (6), length 346)
    127.0.0.1.33056 > 127.0.0.1.9350: Flags [P.], cksum 0xff4e (incorrect -> 0x6831), seq 595:889, ack 3382, win 512, options [nop,nop,TS val 369861405 ecr 369861404], length 294
2022-04-06 23:26:18.902282 IP (tos 0x0, ttl 64, id 11253, offset 0, flags [DF], proto TCP (6), length 52)
    127.0.0.1.9350 > 127.0.0.1.33056: Flags [.], cksum 0xfe28 (incorrect -> 0x566a), seq 3382, ack 889, win 510, options [nop,nop,TS val 369861405 ecr 369861405], length 0
2022-04-06 23:26:19.141451 IP (tos 0x0, ttl 64, id 11254, offset 0, flags [DF], proto TCP (6), length 594)
    127.0.0.1.9350 > 127.0.0.1.33056: Flags [P.], cksum 0x0047 (incorrect -> 0xfdb0), seq 3382:3924, ack 889, win 512, options [nop,nop,TS val 369861644 ecr 369861405], length 542
2022-04-06 23:26:19.141468 IP (tos 0x0, ttl 64, id 15658, offset 0, flags [DF], proto TCP (6), length 52)
    127.0.0.1.33056 > 127.0.0.1.9350: Flags [.], cksum 0xfe28 (incorrect -> 0x5270), seq 889, ack 3924, win 508, options [nop,nop,TS val 369861644 ecr 369861644], length 0
2022-04-06 23:26:19.242112 IP (tos 0x0, ttl 64, id 11255, offset 0, flags [DF], proto TCP (6), length 1983)
    127.0.0.1.9350 > 127.0.0.1.33056: Flags [P.], cksum 0x05b4 (incorrect -> 0x1213), seq 3924:5855, ack 889, win 512, options [nop,nop,TS val 369861745 ecr 369861644], length 1931
2022-04-06 23:26:19.242118 IP (tos 0x0, ttl 64, id 15659, offset 0, flags [DF], proto TCP (6), length 52)
    127.0.0.1.33056 > 127.0.0.1.9350: Flags [.], cksum 0xfe28 (incorrect -> 0x4a23), seq 889, ack 5855, win 500, options [nop,nop,TS val 369861745 ecr 369861745], length 0
2022-04-06 23:26:19.273213 IP (tos 0x0, ttl 64, id 11256, offset 0, flags [DF], proto TCP (6), length 1069)
    127.0.0.1.9350 > 127.0.0.1.33056: Flags [P.], cksum 0x0222 (incorrect -> 0x86aa), seq 5855:6872, ack 889, win 512, options [nop,nop,TS val 369861776 ecr 369861745], length 1017
2022-04-06 23:26:19.273219 IP (tos 0x0, ttl 64, id 15660, offset 0, flags [DF], proto TCP (6), length 52)
    127.0.0.1.33056 > 127.0.0.1.9350: Flags [.], cksum 0xfe28 (incorrect -> 0x45e8), seq 889, ack 6872, win 504, options [nop,nop,TS val 369861776 ecr 369861776], length 0
2022-04-06 23:26:19.293057 IP (tos 0x0, ttl 64, id 11257, offset 0, flags [DF], proto TCP (6), length 3194)
    127.0.0.1.9350 > 127.0.0.1.33056: Flags [P.], cksum 0x0a6f (incorrect -> 0xefa4), seq 6872:10014, ack 889, win 512, options [nop,nop,TS val 369861795 ecr 369861776], length 3142
2022-04-06 23:26:19.293065 IP (tos 0x0, ttl 64, id 15661, offset 0, flags [DF], proto TCP (6), length 52)
    127.0.0.1.33056 > 127.0.0.1.9350: Flags [.], cksum 0xfe28 (incorrect -> 0x3984), seq 889, ack 10014, win 495, options [nop,nop,TS val 369861796 ecr 369861795], length 0
2022-04-06 23:26:19.294808 IP (tos 0x0, ttl 64, id 11258, offset 0, flags [DF], proto TCP (6), length 1182)
    127.0.0.1.9350 > 127.0.0.1.33056: Flags [P.], cksum 0x0293 (incorrect -> 0xda23), seq 10014:11144, ack 889, win 512, options [nop,nop,TS val 369861797 ecr 369861796], length 1130
2022-04-06 23:26:19.294813 IP (tos 0x0, ttl 64, id 15662, offset 0, flags [DF], proto TCP (6), length 52)
    127.0.0.1.33056 > 127.0.0.1.9350: Flags [.], cksum 0xfe28 (incorrect -> 0x350f), seq 889, ack 11144, win 503, options [nop,nop,TS val 369861797 ecr 369861797], length 0
2022-04-06 23:26:19.311142 IP (tos 0x0, ttl 64, id 11259, offset 0, flags [DF], proto TCP (6), length 3320)
    127.0.0.1.9350 > 127.0.0.1.33056: Flags [P.], cksum 0x0aed (incorrect -> 0x4b85), seq 11144:14412, ack 889, win 512, options [nop,nop,TS val 369861814 ecr 369861797], length 3268
2022-04-06 23:26:19.311148 IP (tos 0x0, ttl 64, id 15663, offset 0, flags [DF], proto TCP (6), length 52)
    127.0.0.1.33056 > 127.0.0.1.9350: Flags [.], cksum 0xfe28 (incorrect -> 0x2831), seq 889, ack 14412, win 495, options [nop,nop,TS val 369861814 ecr 369861814], length 0
2022-04-06 23:26:19.344719 IP (tos 0x0, ttl 64, id 11260, offset 0, flags [DF], proto TCP (6), length 3538)
    127.0.0.1.9350 > 127.0.0.1.33056: Flags [P.], cksum 0x0bc7 (incorrect -> 0x1d9a), seq 14412:17898, ack 889, win 512, options [nop,nop,TS val 369861847 ecr 369861814], length 3486
2022-04-06 23:26:19.344731 IP (tos 0x0, ttl 64, id 15664, offset 0, flags [DF], proto TCP (6), length 52)
    127.0.0.1.33056 > 127.0.0.1.9350: Flags [.], cksum 0xfe28 (incorrect -> 0x1a52), seq 889, ack 17898, win 494, options [nop,nop,TS val 369861847 ecr 369861847], length 0
2022-04-06 23:26:19.353371 IP (tos 0x0, ttl 64, id 11261, offset 0, flags [DF], proto TCP (6), length 2974)
    127.0.0.1.9350 > 127.0.0.1.33056: Flags [P.], cksum 0x0993 (incorrect -> 0x2107), seq 17898:20820, ack 889, win 512, options [nop,nop,TS val 369861856 ecr 369861847], length 2922
2022-04-06 23:26:19.353376 IP (tos 0x0, ttl 64, id 15665, offset 0, flags [DF], proto TCP (6), length 52)
    127.0.0.1.33056 > 127.0.0.1.9350: Flags [.], cksum 0xfe28 (incorrect -> 0x0ed4), seq 889, ack 20820, win 496, options [nop,nop,TS val 369861856 ecr 369861856], length 0
2022-04-06 23:26:19.394318 IP (tos 0x0, ttl 64, id 11262, offset 0, flags [DF], proto TCP (6), length 4100)
    127.0.0.1.9350 > 127.0.0.1.33056: Flags [P.], cksum 0x0df9 (incorrect -> 0x8414), seq 20820:24868, ack 889, win 512, options [nop,nop,TS val 369861897 ecr 369861856], length 4048
2022-04-06 23:26:19.394326 IP (tos 0x0, ttl 64, id 15666, offset 0, flags [DF], proto TCP (6), length 52)
    127.0.0.1.33056 > 127.0.0.1.9350: Flags [.], cksum 0xfe28 (incorrect -> 0xfeb5), seq 889, ack 24868, win 492, options [nop,nop,TS val 369861897 ecr 369861897], length 0
2022-04-06 23:26:19.394332 IP (tos 0x0, ttl 64, id 11263, offset 0, flags [DF], proto TCP (6), length 938)
    127.0.0.1.9350 > 127.0.0.1.33056: Flags [P.], cksum 0x019f (incorrect -> 0x2660), seq 24868:25754, ack 889, win 512, options [nop,nop,TS val 369861897 ecr 369861897], length 886
2022-04-06 23:26:19.394336 IP (tos 0x0, ttl 64, id 15667, offset 0, flags [DF], proto TCP (6), length 52)
    127.0.0.1.33056 > 127.0.0.1.9350: Flags [.], cksum 0xfe28 (incorrect -> 0xfb43), seq 889, ack 25754, win 488, options [nop,nop,TS val 369861897 ecr 369861897], length 0
2022-04-06 23:26:19.394390 IP (tos 0x0, ttl 64, id 11264, offset 0, flags [DF], proto TCP (6), length 4100)
    127.0.0.1.9350 > 127.0.0.1.33056: Flags [P.], cksum 0x0df9 (incorrect -> 0xa68b), seq 25754:29802, ack 889, win 512, options [nop,nop,TS val 369861897 ecr 369861897], length 4048
2022-04-06 23:26:19.394393 IP (tos 0x0, ttl 64, id 15668, offset 0, flags [DF], proto TCP (6), length 52)
    127.0.0.1.33056 > 127.0.0.1.9350: Flags [.], cksum 0xfe28 (incorrect -> 0xeb83), seq 889, ack 29802, win 472, options [nop,nop,TS val 369861897 ecr 369861897], length 0
2022-04-06 23:26:19.394400 IP (tos 0x0, ttl 64, id 11265, offset 0, flags [DF], proto TCP (6), length 3650)
    127.0.0.1.9350 > 127.0.0.1.33056: Flags [P.], cksum 0x0c37 (incorrect -> 0x26c8), seq 29802:33400, ack 889, win 512, options [nop,nop,TS val 369861897 ecr 369861897], length 3598
2022-04-06 23:26:19.394806 IP (tos 0x0, ttl 64, id 15669, offset 0, flags [DF], proto TCP (6), length 52)
    127.0.0.1.33056 > 127.0.0.1.9350: Flags [.], cksum 0xfe28 (incorrect -> 0xdd4d), seq 889, ack 33400, win 512, options [nop,nop,TS val 369861897 ecr 369861897], length 0
2022-04-06 23:26:19.395176 IP (tos 0x0, ttl 64, id 11266, offset 0, flags [DF], proto TCP (6), length 4100)
    127.0.0.1.9350 > 127.0.0.1.33056: Flags [P.], cksum 0x0df9 (incorrect -> 0x152d), seq 33400:37448, ack 889, win 512, options [nop,nop,TS val 369861898 ecr 369861897], length 4048
2022-04-06 23:26:19.438655 IP (tos 0x0, ttl 64, id 15670, offset 0, flags [DF], proto TCP (6), length 52)
    127.0.0.1.33056 > 127.0.0.1.9350: Flags [.], cksum 0xfe28 (incorrect -> 0xcd50), seq 889, ack 37448, win 512, options [nop,nop,TS val 369861941 ecr 369861898], length 0
2022-04-06 23:26:19.438663 IP (tos 0x0, ttl 64, id 11267, offset 0, flags [DF], proto TCP (6), length 7136)
    127.0.0.1.9350 > 127.0.0.1.33056: Flags [P.], cksum 0x19d5 (incorrect -> 0xf335), seq 37448:44532, ack 889, win 512, options [nop,nop,TS val 369861941 ecr 369861941], length 7084
2022-04-06 23:26:19.482657 IP (tos 0x0, ttl 64, id 15671, offset 0, flags [DF], proto TCP (6), length 52)
    127.0.0.1.33056 > 127.0.0.1.9350: Flags [.], cksum 0xfe28 (incorrect -> 0xb14d), seq 889, ack 44532, win 512, options [nop,nop,TS val 369861985 ecr 369861941], length 0
2022-04-06 23:26:19.482667 IP (tos 0x0, ttl 64, id 11268, offset 0, flags [DF], proto TCP (6), length 14486)
    127.0.0.1.9350 > 127.0.0.1.33056: Flags [P.], cksum 0x368b (incorrect -> 0xebb0), seq 44532:58966, ack 889, win 512, options [nop,nop,TS val 369861985 ecr 369861985], length 14434
2022-04-06 23:26:19.494618 IP (tos 0x0, ttl 64, id 11269, offset 0, flags [DF], proto TCP (6), length 32820)
    127.0.0.1.9350 > 127.0.0.1.33056: Flags [.], cksum 0x7e29 (incorrect -> 0x3b13), seq 58966:91734, ack 889, win 512, options [nop,nop,TS val 369861997 ecr 369861985], length 32768
2022-04-06 23:26:19.494635 IP (tos 0x0, ttl 64, id 15672, offset 0, flags [DF], proto TCP (6), length 52)
    127.0.0.1.33056 > 127.0.0.1.9350: Flags [.], cksum 0xfe28 (incorrect -> 0xf937), seq 889, ack 91734, win 379, options [nop,nop,TS val 369861997 ecr 369861985], length 0
2022-04-06 23:26:19.494655 IP (tos 0x0, ttl 64, id 11270, offset 0, flags [DF], proto TCP (6), length 1676)
    127.0.0.1.9350 > 127.0.0.1.33056: Flags [P.], cksum 0x0481 (incorrect -> 0x355e), seq 91734:93358, ack 889, win 512, options [nop,nop,TS val 369861997 ecr 369861997], length 1624
2022-04-06 23:26:19.495503 IP (tos 0x0, ttl 64, id 15673, offset 0, flags [DF], proto TCP (6), length 52)
    127.0.0.1.33056 > 127.0.0.1.9350: Flags [.], cksum 0xfe28 (incorrect -> 0xf24d), seq 889, ack 93358, win 512, options [nop,nop,TS val 369861998 ecr 369861997], length 0
2022-04-06 23:26:19.511232 IP (tos 0x0, ttl 64, id 11271, offset 0, flags [DF], proto TCP (6), length 2044)
    127.0.0.1.9350 > 127.0.0.1.33056: Flags [P.], cksum 0x05f1 (incorrect -> 0x62ce), seq 93358:95350, ack 889, win 512, options [nop,nop,TS val 369862014 ecr 369861998], length 1992
2022-04-06 23:26:19.511259 IP (tos 0x0, ttl 64, id 15674, offset 0, flags [DF], proto TCP (6), length 52)
    127.0.0.1.33056 > 127.0.0.1.9350: Flags [.], cksum 0xfe28 (incorrect -> 0xea64), seq 889, ack 95350, win 512, options [nop,nop,TS val 369862014 ecr 369862014], length 0
2022-04-06 23:26:19.517457 IP (tos 0x0, ttl 64, id 11272, offset 0, flags [DF], proto TCP (6), length 3262)
    127.0.0.1.9350 > 127.0.0.1.33056: Flags [P.], cksum 0x0ab3 (incorrect -> 0xa188), seq 95350:98560, ack 889, win 512, options [nop,nop,TS val 369862020 ecr 369862014], length 3210
2022-04-06 23:26:19.517529 IP (tos 0x0, ttl 64, id 15675, offset 0, flags [DF], proto TCP (6), length 52)
    127.0.0.1.33056 > 127.0.0.1.9350: Flags [.], cksum 0xfe28 (incorrect -> 0xddce), seq 889, ack 98560, win 512, options [nop,nop,TS val 369862020 ecr 369862020], length 0
2022-04-06 23:26:19.517565 IP (tos 0x0, ttl 64, id 11273, offset 0, flags [DF], proto TCP (6), length 3898)
    127.0.0.1.9350 > 127.0.0.1.33056: Flags [P.], cksum 0x0d2f (incorrect -> 0xd0a1), seq 98560:102406, ack 889, win 512, options [nop,nop,TS val 369862020 ecr 369862020], length 3846
2022-04-06 23:26:19.517594 IP (tos 0x0, ttl 64, id 15676, offset 0, flags [DF], proto TCP (6), length 52)
    127.0.0.1.33056 > 127.0.0.1.9350: Flags [.], cksum 0xfe28 (incorrect -> 0xcec8), seq 889, ack 102406, win 512, options [nop,nop,TS val 369862020 ecr 369862020], length 0
2022-04-06 23:26:19.526748 IP (tos 0x0, ttl 64, id 11274, offset 0, flags [DF], proto TCP (6), length 1002)
    127.0.0.1.9350 > 127.0.0.1.33056: Flags [P.], cksum 0x01df (incorrect -> 0xac77), seq 102406:103356, ack 889, win 512, options [nop,nop,TS val 369862029 ecr 369862020], length 950
2022-04-06 23:26:19.526961 IP (tos 0x0, ttl 64, id 15677, offset 0, flags [DF], proto TCP (6), length 52)
    127.0.0.1.33056 > 127.0.0.1.9350: Flags [.], cksum 0xfe28 (incorrect -> 0xcb00), seq 889, ack 103356, win 512, options [nop,nop,TS val 369862029 ecr 369862029], length 0
2022-04-06 23:26:19.539101 IP (tos 0x0, ttl 64, id 11275, offset 0, flags [DF], proto TCP (6), length 3446)
    127.0.0.1.9350 > 127.0.0.1.33056: Flags [P.], cksum 0x0b6b (incorrect -> 0xa6d7), seq 103356:106750, ack 889, win 512, options [nop,nop,TS val 369862042 ecr 369862029], length 3394
2022-04-06 23:26:19.539231 IP (tos 0x0, ttl 64, id 15678, offset 0, flags [DF], proto TCP (6), length 52)
    127.0.0.1.33056 > 127.0.0.1.9350: Flags [.], cksum 0xfe28 (incorrect -> 0xbda4), seq 889, ack 106750, win 512, options [nop,nop,TS val 369862042 ecr 369862042], length 0
2022-04-06 23:26:19.541741 IP (tos 0x0, ttl 64, id 11276, offset 0, flags [DF], proto TCP (6), length 4100)
    127.0.0.1.9350 > 127.0.0.1.33056: Flags [P.], cksum 0x0df9 (incorrect -> 0x0eae), seq 106750:110798, ack 889, win 512, options [nop,nop,TS val 369862044 ecr 369862042], length 4048
2022-04-06 23:26:19.542036 IP (tos 0x0, ttl 64, id 15679, offset 0, flags [DF], proto TCP (6), length 52)
    127.0.0.1.33056 > 127.0.0.1.9350: Flags [.], cksum 0xfe28 (incorrect -> 0xadd0), seq 889, ack 110798, win 512, options [nop,nop,TS val 369862044 ecr 369862044], length 0
2022-04-06 23:26:19.542046 IP (tos 0x0, ttl 64, id 11277, offset 0, flags [DF], proto TCP (6), length 5282)
    127.0.0.1.9350 > 127.0.0.1.33056: Flags [P.], cksum 0x1297 (incorrect -> 0xa6e7), seq 110798:116028, ack 889, win 512, options [nop,nop,TS val 369862044 ecr 369862044], length 5230
2022-04-06 23:26:19.542085 IP (tos 0x0, ttl 64, id 15680, offset 0, flags [DF], proto TCP (6), length 52)
    127.0.0.1.33056 > 127.0.0.1.9350: Flags [.], cksum 0xfe28 (incorrect -> 0x9961), seq 889, ack 116028, win 512, options [nop,nop,TS val 369862045 ecr 369862044], length 0
2022-04-06 23:26:19.551879 IP (tos 0x0, ttl 64, id 11278, offset 0, flags [DF], proto TCP (6), length 3308)
    127.0.0.1.9350 > 127.0.0.1.33056: Flags [P.], cksum 0x0ae1 (incorrect -> 0x9e1b), seq 116028:119284, ack 889, win 512, options [nop,nop,TS val 369862054 ecr 369862045], length 3256
2022-04-06 23:26:19.551914 IP (tos 0x0, ttl 64, id 15681, offset 0, flags [DF], proto TCP (6), length 52)
    127.0.0.1.33056 > 127.0.0.1.9350: Flags [.], cksum 0xfe28 (incorrect -> 0x8c96), seq 889, ack 119284, win 512, options [nop,nop,TS val 369862054 ecr 369862054], length 0
2022-04-06 23:26:19.565675 IP (tos 0x0, ttl 64, id 11279, offset 0, flags [DF], proto TCP (6), length 3944)
    127.0.0.1.9350 > 127.0.0.1.33056: Flags [P.], cksum 0x0d5d (incorrect -> 0x3d7f), seq 119284:123176, ack 889, win 512, options [nop,nop,TS val 369862068 ecr 369862054], length 3892
2022-04-06 23:26:19.565888 IP (tos 0x0, ttl 64, id 15682, offset 0, flags [DF], proto TCP (6), length 52)
    127.0.0.1.33056 > 127.0.0.1.9350: Flags [.], cksum 0xfe28 (incorrect -> 0x7d46), seq 889, ack 123176, win 512, options [nop,nop,TS val 369862068 ecr 369862068], length 0
2022-04-06 23:26:19.567659 IP (tos 0x0, ttl 64, id 11280, offset 0, flags [DF], proto TCP (6), length 1002)
    127.0.0.1.9350 > 127.0.0.1.33056: Flags [P.], cksum 0x01df (incorrect -> 0x5b3c), seq 123176:124126, ack 889, win 512, options [nop,nop,TS val 369862070 ecr 369862068], length 950
2022-04-06 23:26:19.567680 IP (tos 0x0, ttl 64, id 15683, offset 0, flags [DF], proto TCP (6), length 52)
    127.0.0.1.33056 > 127.0.0.1.9350: Flags [.], cksum 0xfe28 (incorrect -> 0x798c), seq 889, ack 124126, win 512, options [nop,nop,TS val 369862070 ecr 369862070], length 0
2022-04-06 23:26:19.567820 IP (tos 0x0, ttl 64, id 11281, offset 0, flags [DF], proto TCP (6), length 4100)
    127.0.0.1.9350 > 127.0.0.1.33056: Flags [P.], cksum 0x0df9 (incorrect -> 0x5a80), seq 124126:128174, ack 889, win 512, options [nop,nop,TS val 369862070 ecr 369862070], length 4048
2022-04-06 23:26:19.567888 IP (tos 0x0, ttl 64, id 15684, offset 0, flags [DF], proto TCP (6), length 52)
    127.0.0.1.33056 > 127.0.0.1.9350: Flags [.], cksum 0xfe28 (incorrect -> 0x69bc), seq 889, ack 128174, win 512, options [nop,nop,TS val 369862070 ecr 369862070], length 0
2022-04-06 23:26:19.567895 IP (tos 0x0, ttl 64, id 11282, offset 0, flags [DF], proto TCP (6), length 7090)
    127.0.0.1.9350 > 127.0.0.1.33056: Flags [P.], cksum 0x19a7 (incorrect -> 0x0605), seq 128174:135212, ack 889, win 512, options [nop,nop,TS val 369862070 ecr 369862070], length 7038
2022-04-06 23:26:19.568115 IP (tos 0x0, ttl 64, id 15685, offset 0, flags [DF], proto TCP (6), length 52)
    127.0.0.1.33056 > 127.0.0.1.9350: Flags [.], cksum 0xfe28 (incorrect -> 0x4e3d), seq 889, ack 135212, win 512, options [nop,nop,TS val 369862071 ecr 369862070], length 0
2022-04-06 23:26:19.580249 IP (tos 0x0, ttl 64, id 11283, offset 0, flags [DF], proto TCP (6), length 4100)
    127.0.0.1.9350 > 127.0.0.1.33056: Flags [P.], cksum 0x0df9 (incorrect -> 0x518d), seq 135212:139260, ack 889, win 512, options [nop,nop,TS val 369862083 ecr 369862071], length 4048
2022-04-06 23:26:19.580290 IP (tos 0x0, ttl 64, id 15686, offset 0, flags [DF], proto TCP (6), length 52)
    127.0.0.1.33056 > 127.0.0.1.9350: Flags [.], cksum 0xfe28 (incorrect -> 0x3e54), seq 889, ack 139260, win 512, options [nop,nop,TS val 369862083 ecr 369862083], length 0
2022-04-06 23:26:19.580294 IP (tos 0x0, ttl 64, id 11284, offset 0, flags [DF], proto TCP (6), length 394)
    127.0.0.1.9350 > 127.0.0.1.33056: Flags [P.], cksum 0xff7e (incorrect -> 0xc0dd), seq 139260:139602, ack 889, win 512, options [nop,nop,TS val 369862083 ecr 369862083], length 342
2022-04-06 23:26:19.580305 IP (tos 0x0, ttl 64, id 15687, offset 0, flags [DF], proto TCP (6), length 52)
    127.0.0.1.33056 > 127.0.0.1.9350: Flags [.], cksum 0xfe28 (incorrect -> 0x3cfe), seq 889, ack 139602, win 512, options [nop,nop,TS val 369862083 ecr 369862083], length 0
2022-04-06 23:26:19.593184 IP (tos 0x0, ttl 64, id 11285, offset 0, flags [DF], proto TCP (6), length 4100)
    127.0.0.1.9350 > 127.0.0.1.33056: Flags [P.], cksum 0x0df9 (incorrect -> 0x0fc0), seq 139602:143650, ack 889, win 512, options [nop,nop,TS val 369862096 ecr 369862083], length 4048
2022-04-06 23:26:19.593483 IP (tos 0x0, ttl 64, id 15688, offset 0, flags [DF], proto TCP (6), length 52)
    127.0.0.1.33056 > 127.0.0.1.9350: Flags [.], cksum 0xfe28 (incorrect -> 0x2d14), seq 889, ack 143650, win 512, options [nop,nop,TS val 369862096 ecr 369862096], length 0
2022-04-06 23:26:19.593492 IP (tos 0x0, ttl 64, id 11286, offset 0, flags [DF], proto TCP (6), length 10438)
    127.0.0.1.9350 > 127.0.0.1.33056: Flags [P.], cksum 0x26bb (incorrect -> 0xd4d2), seq 143650:154036, ack 889, win 512, options [nop,nop,TS val 369862096 ecr 369862096], length 10386
2022-04-06 23:26:19.593652 IP (tos 0x0, ttl 64, id 15689, offset 0, flags [DF], proto TCP (6), length 52)
    127.0.0.1.33056 > 127.0.0.1.9350: Flags [.], cksum 0xfe28 (incorrect -> 0x0482), seq 889, ack 154036, win 512, options [nop,nop,TS val 369862096 ecr 369862096], length 0
2022-04-06 23:26:19.594175 IP (tos 0x0, ttl 64, id 11287, offset 0, flags [DF], proto TCP (6), length 4100)
    127.0.0.1.9350 > 127.0.0.1.33056: Flags [P.], cksum 0x0df9 (incorrect -> 0x40f4), seq 154036:158084, ack 889, win 512, options [nop,nop,TS val 369862097 ecr 369862096], length 4048
2022-04-06 23:26:19.594319 IP (tos 0x0, ttl 64, id 15690, offset 0, flags [DF], proto TCP (6), length 52)
    127.0.0.1.33056 > 127.0.0.1.9350: Flags [.], cksum 0xfe28 (incorrect -> 0xf4af), seq 889, ack 158084, win 512, options [nop,nop,TS val 369862097 ecr 369862097], length 0
2022-04-06 23:26:19.594323 IP (tos 0x0, ttl 64, id 11288, offset 0, flags [DF], proto TCP (6), length 348)
    127.0.0.1.9350 > 127.0.0.1.33056: Flags [P.], cksum 0xff50 (incorrect -> 0x5af7), seq 158084:158380, ack 889, win 512, options [nop,nop,TS val 369862097 ecr 369862097], length 296
2022-04-06 23:26:19.594327 IP (tos 0x0, ttl 64, id 15691, offset 0, flags [DF], proto TCP (6), length 52)
    127.0.0.1.33056 > 127.0.0.1.9350: Flags [.], cksum 0xfe28 (incorrect -> 0xf387), seq 889, ack 158380, win 512, options [nop,nop,TS val 369862097 ecr 369862097], length 0
2022-04-06 23:26:19.594376 IP (tos 0x0, ttl 64, id 11289, offset 0, flags [DF], proto TCP (6), length 4100)
    127.0.0.1.9350 > 127.0.0.1.33056: Flags [P.], cksum 0x0df9 (incorrect -> 0x01d7), seq 158380:162428, ack 889, win 512, options [nop,nop,TS val 369862097 ecr 369862097], length 4048
2022-04-06 23:26:19.594414 IP (tos 0x0, ttl 64, id 15692, offset 0, flags [DF], proto TCP (6), length 52)
    127.0.0.1.33056 > 127.0.0.1.9350: Flags [.], cksum 0xfe28 (incorrect -> 0xe3b7), seq 889, ack 162428, win 512, options [nop,nop,TS val 369862097 ecr 369862097], length 0
2022-04-06 23:26:19.594419 IP (tos 0x0, ttl 64, id 11290, offset 0, flags [DF], proto TCP (6), length 3290)
    127.0.0.1.9350 > 127.0.0.1.33056: Flags [P.], cksum 0x0acf (incorrect -> 0xce6c), seq 162428:165666, ack 889, win 512, options [nop,nop,TS val 369862097 ecr 369862097], length 3238
2022-04-06 23:26:19.594434 IP (tos 0x0, ttl 64, id 15693, offset 0, flags [DF], proto TCP (6), length 52)
    127.0.0.1.33056 > 127.0.0.1.9350: Flags [.], cksum 0xfe28 (incorrect -> 0xd711), seq 889, ack 165666, win 512, options [nop,nop,TS val 369862097 ecr 369862097], length 0
200, 5.158788442611694, 2.3749101161956787