2022-04-06 05:03:43.527216 IP (tos 0x0, ttl 64, id 47309, offset 0, flags [DF], proto TCP (6), length 60)
    127.0.0.1.38934 > 127.0.0.1.11950: Flags [S], cksum 0xfe30 (incorrect -> 0x1dc0), seq 1023208632, win 65495, options [mss 65495,sackOK,TS val 303706030 ecr 0,nop,wscale 7], length 0
2022-04-06 05:03:43.527225 IP (tos 0x0, ttl 64, id 0, offset 0, flags [DF], proto TCP (6), length 60)
    127.0.0.1.11950 > 127.0.0.1.38934: Flags [S.], cksum 0xfe30 (incorrect -> 0x2c4f), seq 3662861648, ack 1023208633, win 65483, options [mss 65495,sackOK,TS val 303706030 ecr 303706030,nop,wscale 7], length 0
2022-04-06 05:03:43.527233 IP (tos 0x0, ttl 64, id 47310, offset 0, flags [DF], proto TCP (6), length 52)
    127.0.0.1.38934 > 127.0.0.1.11950: Flags [.], cksum 0xfe28 (incorrect -> 0x530b), seq 1, ack 1, win 512, options [nop,nop,TS val 303706030 ecr 303706030], length 0
2022-04-06 05:03:43.527374 IP (tos 0x0, ttl 64, id 47311, offset 0, flags [DF], proto TCP (6), length 55)
    127.0.0.1.38934 > 127.0.0.1.11950: Flags [P.], cksum 0xfe2b (incorrect -> 0x4dff), seq 1:4, ack 1, win 512, options [nop,nop,TS val 303706030 ecr 303706030], length 3
2022-04-06 05:03:43.527381 IP (tos 0x0, ttl 64, id 59806, offset 0, flags [DF], proto TCP (6), length 52)
    127.0.0.1.11950 > 127.0.0.1.38934: Flags [.], cksum 0xfe28 (incorrect -> 0x5308), seq 1, ack 4, win 512, options [nop,nop,TS val 303706030 ecr 303706030], length 0
2022-04-06 05:03:43.527402 IP (tos 0x0, ttl 64, id 59807, offset 0, flags [DF], proto TCP (6), length 54)
    127.0.0.1.11950 > 127.0.0.1.38934: Flags [P.], cksum 0xfe2a (incorrect -> 0x4dfe), seq 1:3, ack 4, win 512, options [nop,nop,TS val 303706030 ecr 303706030], length 2
2022-04-06 05:03:43.527410 IP (tos 0x0, ttl 64, id 47312, offset 0, flags [DF], proto TCP (6), length 52)
    127.0.0.1.38934 > 127.0.0.1.11950: Flags [.], cksum 0xfe28 (incorrect -> 0x5306), seq 4, ack 3, win 512, options [nop,nop,TS val 303706030 ecr 303706030], length 0
2022-04-06 05:03:43.529250 IP (tos 0x0, ttl 64, id 47313, offset 0, flags [DF], proto TCP (6), length 62)
    127.0.0.1.38934 > 127.0.0.1.11950: Flags [P.], cksum 0xfe32 (incorrect -> 0x6394), seq 4:14, ack 3, win 512, options [nop,nop,TS val 303706032 ecr 303706030], length 10
2022-04-06 05:03:43.529276 IP (tos 0x0, ttl 64, id 59808, offset 0, flags [DF], proto TCP (6), length 52)
    127.0.0.1.11950 > 127.0.0.1.38934: Flags [.], cksum 0xfe28 (incorrect -> 0x52f8), seq 3, ack 14, win 512, options [nop,nop,TS val 303706032 ecr 303706032], length 0
2022-04-06 05:03:43.822446 IP (tos 0x0, ttl 64, id 59809, offset 0, flags [DF], proto TCP (6), length 62)
    127.0.0.1.11950 > 127.0.0.1.38934: Flags [P.], cksum 0xfe32 (incorrect -> 0x4cc0), seq 3:13, ack 14, win 512, options [nop,nop,TS val 303706325 ecr 303706032], length 10
2022-04-06 05:03:43.822458 IP (tos 0x0, ttl 64, id 47314, offset 0, flags [DF], proto TCP (6), length 52)
    127.0.0.1.38934 > 127.0.0.1.11950: Flags [.], cksum 0xfe28 (incorrect -> 0x50a4), seq 14, ack 13, win 512, options [nop,nop,TS val 303706325 ecr 303706325], length 0
2022-04-06 05:03:43.827935 IP (tos 0x0, ttl 64, id 47315, offset 0, flags [DF], proto TCP (6), length 569)
    127.0.0.1.38934 > 127.0.0.1.11950: Flags [P.], cksum 0x002e (incorrect -> 0x8a77), seq 14:531, ack 13, win 512, options [nop,nop,TS val 303706330 ecr 303706325], length 517
2022-04-06 05:03:43.827945 IP (tos 0x0, ttl 64, id 59810, offset 0, flags [DF], proto TCP (6), length 52)
    127.0.0.1.11950 > 127.0.0.1.38934: Flags [.], cksum 0xfe28 (incorrect -> 0x4e99), seq 13, ack 531, win 508, options [nop,nop,TS val 303706330 ecr 303706330], length 0
2022-04-06 05:03:44.109733 IP (tos 0x0, ttl 64, id 59811, offset 0, flags [DF], proto TCP (6), length 3538)
    127.0.0.1.11950 > 127.0.0.1.38934: Flags [P.], cksum 0x0bc7 (incorrect -> 0xe0c5), seq 13:3499, ack 531, win 512, options [nop,nop,TS val 303706612 ecr 303706330], length 3486
2022-04-06 05:03:44.109743 IP (tos 0x0, ttl 64, id 47316, offset 0, flags [DF], proto TCP (6), length 52)
    127.0.0.1.38934 > 127.0.0.1.11950: Flags [.], cksum 0xfe28 (incorrect -> 0x3ed5), seq 531, ack 3499, win 494, options [nop,nop,TS val 303706612 ecr 303706612], length 0
2022-04-06 05:03:51.564144 IP (tos 0x0, ttl 64, id 59812, offset 0, flags [DF], proto TCP (6), length 341)
    127.0.0.1.11950 > 127.0.0.1.38934: Flags [P.], cksum 0xff49 (incorrect -> 0xa5ed), seq 3499:3788, ack 531, win 512, options [nop,nop,TS val 303714067 ecr 303706612], length 289
2022-04-06 05:03:51.564151 IP (tos 0x0, ttl 64, id 47317, offset 0, flags [DF], proto TCP (6), length 52)
    127.0.0.1.38934 > 127.0.0.1.11950: Flags [.], cksum 0xfe28 (incorrect -> 0x036a), seq 531, ack 3788, win 506, options [nop,nop,TS val 303714067 ecr 303714067], length 0
2022-04-06 05:03:51.564595 IP (tos 0x0, ttl 64, id 47318, offset 0, flags [DF], proto TCP (6), length 132)
    127.0.0.1.38934 > 127.0.0.1.11950: Flags [P.], cksum 0xfe78 (incorrect -> 0xa416), seq 531:611, ack 3788, win 512, options [nop,nop,TS val 303714067 ecr 303714067], length 80
2022-04-06 05:03:51.564601 IP (tos 0x0, ttl 64, id 59813, offset 0, flags [DF], proto TCP (6), length 52)
    127.0.0.1.11950 > 127.0.0.1.38934: Flags [.], cksum 0xfe28 (incorrect -> 0x0314), seq 3788, ack 611, win 512, options [nop,nop,TS val 303714067 ecr 303714067], length 0
2022-04-06 05:03:51.564947 IP (tos 0x0, ttl 64, id 47319, offset 0, flags [DF], proto TCP (6), length 360)
    127.0.0.1.38934 > 127.0.0.1.11950: Flags [P.], cksum 0xff5c (incorrect -> 0x14aa), seq 611:919, ack 3788, win 512, options [nop,nop,TS val 303714067 ecr 303714067], length 308
2022-04-06 05:03:51.564951 IP (tos 0x0, ttl 64, id 59814, offset 0, flags [DF], proto TCP (6), length 52)
    127.0.0.1.11950 > 127.0.0.1.38934: Flags [.], cksum 0xfe28 (incorrect -> 0x01e2), seq 3788, ack 919, win 510, options [nop,nop,TS val 303714067 ecr 303714067], length 0
200, 5.787648439407349, 8.85709834098816