2022-04-06 07:32:12.818703 IP (tos 0x0, ttl 64, id 54812, offset 0, flags [DF], proto TCP (6), length 60)
    127.0.0.1.36094 > 127.0.0.1.9850: Flags [S], cksum 0xfe30 (incorrect -> 0x028e), seq 3790177238, win 65495, options [mss 65495,sackOK,TS val 312615321 ecr 0,nop,wscale 7], length 0
2022-04-06 07:32:12.818713 IP (tos 0x0, ttl 64, id 0, offset 0, flags [DF], proto TCP (6), length 60)
    127.0.0.1.9850 > 127.0.0.1.36094: Flags [S.], cksum 0xfe30 (incorrect -> 0x0ba3), seq 2248883359, ack 3790177239, win 65483, options [mss 65495,sackOK,TS val 312615321 ecr 312615321,nop,wscale 7], length 0
2022-04-06 07:32:12.818721 IP (tos 0x0, ttl 64, id 54813, offset 0, flags [DF], proto TCP (6), length 52)
    127.0.0.1.36094 > 127.0.0.1.9850: Flags [.], cksum 0xfe28 (incorrect -> 0x325f), seq 1, ack 1, win 512, options [nop,nop,TS val 312615321 ecr 312615321], length 0
2022-04-06 07:32:12.818833 IP (tos 0x0, ttl 64, id 54814, offset 0, flags [DF], proto TCP (6), length 55)
    127.0.0.1.36094 > 127.0.0.1.9850: Flags [P.], cksum 0xfe2b (incorrect -> 0x2d53), seq 1:4, ack 1, win 512, options [nop,nop,TS val 312615321 ecr 312615321], length 3
2022-04-06 07:32:12.818849 IP (tos 0x0, ttl 64, id 53370, offset 0, flags [DF], proto TCP (6), length 52)
    127.0.0.1.9850 > 127.0.0.1.36094: Flags [.], cksum 0xfe28 (incorrect -> 0x325c), seq 1, ack 4, win 512, options [nop,nop,TS val 312615321 ecr 312615321], length 0
2022-04-06 07:32:12.818883 IP (tos 0x0, ttl 64, id 53371, offset 0, flags [DF], proto TCP (6), length 54)
    127.0.0.1.9850 > 127.0.0.1.36094: Flags [P.], cksum 0xfe2a (incorrect -> 0x2d52), seq 1:3, ack 4, win 512, options [nop,nop,TS val 312615321 ecr 312615321], length 2
2022-04-06 07:32:12.818895 IP (tos 0x0, ttl 64, id 54815, offset 0, flags [DF], proto TCP (6), length 52)
    127.0.0.1.36094 > 127.0.0.1.9850: Flags [.], cksum 0xfe28 (incorrect -> 0x325a), seq 4, ack 3, win 512, options [nop,nop,TS val 312615321 ecr 312615321], length 0
2022-04-06 07:32:12.871066 IP (tos 0x0, ttl 64, id 54816, offset 0, flags [DF], proto TCP (6), length 62)
    127.0.0.1.36094 > 127.0.0.1.9850: Flags [P.], cksum 0xfe32 (incorrect -> 0xb734), seq 4:14, ack 3, win 512, options [nop,nop,TS val 312615373 ecr 312615321], length 10
2022-04-06 07:32:12.871076 IP (tos 0x0, ttl 64, id 53372, offset 0, flags [DF], proto TCP (6), length 52)
    127.0.0.1.9850 > 127.0.0.1.36094: Flags [.], cksum 0xfe28 (incorrect -> 0x31e7), seq 3, ack 14, win 512, options [nop,nop,TS val 312615374 ecr 312615373], length 0
2022-04-06 07:32:13.013973 IP (tos 0x0, ttl 64, id 53373, offset 0, flags [DF], proto TCP (6), length 62)
    127.0.0.1.9850 > 127.0.0.1.36094: Flags [P.], cksum 0xfe32 (incorrect -> 0x2c46), seq 3:13, ack 14, win 512, options [nop,nop,TS val 312615516 ecr 312615373], length 10
2022-04-06 07:32:13.013986 IP (tos 0x0, ttl 64, id 54817, offset 0, flags [DF], proto TCP (6), length 52)
    127.0.0.1.36094 > 127.0.0.1.9850: Flags [.], cksum 0xfe28 (incorrect -> 0x30c0), seq 14, ack 13, win 512, options [nop,nop,TS val 312615516 ecr 312615516], length 0
2022-04-06 07:32:13.020204 IP (tos 0x0, ttl 64, id 54818, offset 0, flags [DF], proto TCP (6), length 569)
    127.0.0.1.36094 > 127.0.0.1.9850: Flags [P.], cksum 0x002e (incorrect -> 0x6157), seq 14:531, ack 13, win 512, options [nop,nop,TS val 312615523 ecr 312615516], length 517
2022-04-06 07:32:13.020214 IP (tos 0x0, ttl 64, id 53374, offset 0, flags [DF], proto TCP (6), length 52)
    127.0.0.1.9850 > 127.0.0.1.36094: Flags [.], cksum 0xfe28 (incorrect -> 0x2eb1), seq 13, ack 531, win 508, options [nop,nop,TS val 312615523 ecr 312615523], length 0
2022-04-06 07:32:13.192191 IP (tos 0x0, ttl 64, id 53375, offset 0, flags [DF], proto TCP (6), length 3381)
    127.0.0.1.9850 > 127.0.0.1.36094: Flags [P.], cksum 0x0b2a (incorrect -> 0x6694), seq 13:3342, ack 531, win 512, options [nop,nop,TS val 312615695 ecr 312615523], length 3329
2022-04-06 07:32:13.192202 IP (tos 0x0, ttl 64, id 54819, offset 0, flags [DF], proto TCP (6), length 52)
    127.0.0.1.36094 > 127.0.0.1.9850: Flags [.], cksum 0xfe28 (incorrect -> 0x2066), seq 531, ack 3342, win 494, options [nop,nop,TS val 312615695 ecr 312615695], length 0
2022-04-06 07:32:13.192703 IP (tos 0x0, ttl 64, id 54820, offset 0, flags [DF], proto TCP (6), length 145)
    127.0.0.1.36094 > 127.0.0.1.9850: Flags [P.], cksum 0xfe85 (incorrect -> 0x2be6), seq 531:624, ack 3342, win 512, options [nop,nop,TS val 312615695 ecr 312615695], length 93
2022-04-06 07:32:13.192713 IP (tos 0x0, ttl 64, id 53376, offset 0, flags [DF], proto TCP (6), length 52)
    127.0.0.1.9850 > 127.0.0.1.36094: Flags [.], cksum 0xfe28 (incorrect -> 0x1ff7), seq 3342, ack 624, win 512, options [nop,nop,TS val 312615695 ecr 312615695], length 0
2022-04-06 07:32:13.341987 IP (tos 0x0, ttl 64, id 53377, offset 0, flags [DF], proto TCP (6), length 310)
    127.0.0.1.9850 > 127.0.0.1.36094: Flags [P.], cksum 0xff2a (incorrect -> 0x96db), seq 3342:3600, ack 624, win 512, options [nop,nop,TS val 312615844 ecr 312615695], length 258
2022-04-06 07:32:13.341998 IP (tos 0x0, ttl 64, id 54821, offset 0, flags [DF], proto TCP (6), length 52)
    127.0.0.1.36094 > 127.0.0.1.9850: Flags [.], cksum 0xfe28 (incorrect -> 0x1dcd), seq 624, ack 3600, win 510, options [nop,nop,TS val 312615844 ecr 312615844], length 0
2022-04-06 07:32:13.342447 IP (tos 0x0, ttl 64, id 54822, offset 0, flags [DF], proto TCP (6), length 382)
    127.0.0.1.36094 > 127.0.0.1.9850: Flags [P.], cksum 0xff72 (incorrect -> 0xa310), seq 624:954, ack 3600, win 512, options [nop,nop,TS val 312615845 ecr 312615844], length 330
2022-04-06 07:32:13.342457 IP (tos 0x0, ttl 64, id 53378, offset 0, flags [DF], proto TCP (6), length 52)
    127.0.0.1.9850 > 127.0.0.1.36094: Flags [.], cksum 0xfe28 (incorrect -> 0x1c81), seq 3600, ack 954, win 510, options [nop,nop,TS val 312615845 ecr 312615845], length 0
2022-04-06 07:32:13.482465 IP (tos 0x0, ttl 64, id 53379, offset 0, flags [DF], proto TCP (6), length 220)
    127.0.0.1.9850 > 127.0.0.1.36094: Flags [P.], cksum 0xfed0 (incorrect -> 0x0adf), seq 3600:3768, ack 954, win 512, options [nop,nop,TS val 312615985 ecr 312615845], length 168
2022-04-06 07:32:13.484229 IP (tos 0x0, ttl 64, id 16115, offset 0, flags [DF], proto TCP (6), length 60)
    127.0.0.1.36096 > 127.0.0.1.9850: Flags [S], cksum 0xfe30 (incorrect -> 0xab98), seq 735678016, win 65495, options [mss 65495,sackOK,TS val 312615987 ecr 0,nop,wscale 7], length 0
2022-04-06 07:32:13.484238 IP (tos 0x0, ttl 64, id 0, offset 0, flags [DF], proto TCP (6), length 60)
    127.0.0.1.9850 > 127.0.0.1.36096: Flags [S.], cksum 0xfe30 (incorrect -> 0x5870), seq 3309655816, ack 735678017, win 65483, options [mss 65495,sackOK,TS val 312615987 ecr 312615987,nop,wscale 7], length 0
2022-04-06 07:32:13.484246 IP (tos 0x0, ttl 64, id 16116, offset 0, flags [DF], proto TCP (6), length 52)
    127.0.0.1.36096 > 127.0.0.1.9850: Flags [.], cksum 0xfe28 (incorrect -> 0x7f2c), seq 1, ack 1, win 512, options [nop,nop,TS val 312615987 ecr 312615987], length 0
2022-04-06 07:32:13.484326 IP (tos 0x0, ttl 64, id 16117, offset 0, flags [DF], proto TCP (6), length 55)
    127.0.0.1.36096 > 127.0.0.1.9850: Flags [P.], cksum 0xfe2b (incorrect -> 0x7a20), seq 1:4, ack 1, win 512, options [nop,nop,TS val 312615987 ecr 312615987], length 3
2022-04-06 07:32:13.484333 IP (tos 0x0, ttl 64, id 39865, offset 0, flags [DF], proto TCP (6), length 52)
    127.0.0.1.9850 > 127.0.0.1.36096: Flags [.], cksum 0xfe28 (incorrect -> 0x7f29), seq 1, ack 4, win 512, options [nop,nop,TS val 312615987 ecr 312615987], length 0
2022-04-06 07:32:13.484353 IP (tos 0x0, ttl 64, id 39866, offset 0, flags [DF], proto TCP (6), length 54)
    127.0.0.1.9850 > 127.0.0.1.36096: Flags [P.], cksum 0xfe2a (incorrect -> 0x7a1f), seq 1:3, ack 4, win 512, options [nop,nop,TS val 312615987 ecr 312615987], length 2
2022-04-06 07:32:13.484361 IP (tos 0x0, ttl 64, id 16118, offset 0, flags [DF], proto TCP (6), length 52)
    127.0.0.1.36096 > 127.0.0.1.9850: Flags [.], cksum 0xfe28 (incorrect -> 0x7f27), seq 4, ack 3, win 512, options [nop,nop,TS val 312615987 ecr 312615987], length 0
2022-04-06 07:32:13.522668 IP (tos 0x0, ttl 64, id 54823, offset 0, flags [DF], proto TCP (6), length 52)
    127.0.0.1.36094 > 127.0.0.1.9850: Flags [.], cksum 0xfe28 (incorrect -> 0x1a97), seq 954, ack 3768, win 512, options [nop,nop,TS val 312616025 ecr 312615985], length 0
2022-04-06 07:32:13.534230 IP (tos 0x0, ttl 64, id 16119, offset 0, flags [DF], proto TCP (6), length 62)
    127.0.0.1.36096 > 127.0.0.1.9850: Flags [P.], cksum 0xfe32 (incorrect -> 0x5bde), seq 4:14, ack 3, win 512, options [nop,nop,TS val 312616037 ecr 312615987], length 10
2022-04-06 07:32:13.534239 IP (tos 0x0, ttl 64, id 39867, offset 0, flags [DF], proto TCP (6), length 52)
    127.0.0.1.9850 > 127.0.0.1.36096: Flags [.], cksum 0xfe28 (incorrect -> 0x7eb9), seq 3, ack 14, win 512, options [nop,nop,TS val 312616037 ecr 312616037], length 0
2022-04-06 07:32:13.703713 IP (tos 0x0, ttl 64, id 39868, offset 0, flags [DF], proto TCP (6), length 62)
    127.0.0.1.9850 > 127.0.0.1.36096: Flags [P.], cksum 0xfe32 (incorrect -> 0x78fd), seq 3:13, ack 14, win 512, options [nop,nop,TS val 312616206 ecr 312616037], length 10
2022-04-06 07:32:13.703723 IP (tos 0x0, ttl 64, id 16120, offset 0, flags [DF], proto TCP (6), length 52)
    127.0.0.1.36096 > 127.0.0.1.9850: Flags [.], cksum 0xfe28 (incorrect -> 0x7d5d), seq 14, ack 13, win 512, options [nop,nop,TS val 312616206 ecr 312616206], length 0
2022-04-06 07:32:13.708965 IP (tos 0x0, ttl 64, id 16121, offset 0, flags [DF], proto TCP (6), length 569)
    127.0.0.1.36096 > 127.0.0.1.9850: Flags [P.], cksum 0x002e (incorrect -> 0x726d), seq 14:531, ack 13, win 512, options [nop,nop,TS val 312616211 ecr 312616206], length 517
2022-04-06 07:32:13.708975 IP (tos 0x0, ttl 64, id 39869, offset 0, flags [DF], proto TCP (6), length 52)
    127.0.0.1.9850 > 127.0.0.1.36096: Flags [.], cksum 0xfe28 (incorrect -> 0x7b52), seq 13, ack 531, win 508, options [nop,nop,TS val 312616211 ecr 312616211], length 0
2022-04-06 07:32:13.859373 IP (tos 0x0, ttl 64, id 39870, offset 0, flags [DF], proto TCP (6), length 3381)
    127.0.0.1.9850 > 127.0.0.1.36096: Flags [P.], cksum 0x0b2a (incorrect -> 0x701a), seq 13:3342, ack 531, win 512, options [nop,nop,TS val 312616362 ecr 312616211], length 3329
2022-04-06 07:32:13.859384 IP (tos 0x0, ttl 64, id 16122, offset 0, flags [DF], proto TCP (6), length 52)
    127.0.0.1.36096 > 127.0.0.1.9850: Flags [.], cksum 0xfe28 (incorrect -> 0x6d31), seq 531, ack 3342, win 494, options [nop,nop,TS val 312616362 ecr 312616362], length 0
2022-04-06 07:32:13.859912 IP (tos 0x0, ttl 64, id 16123, offset 0, flags [DF], proto TCP (6), length 145)
    127.0.0.1.36096 > 127.0.0.1.9850: Flags [P.], cksum 0xfe85 (incorrect -> 0xab86), seq 531:624, ack 3342, win 512, options [nop,nop,TS val 312616362 ecr 312616362], length 93
2022-04-06 07:32:13.859922 IP (tos 0x0, ttl 64, id 39871, offset 0, flags [DF], proto TCP (6), length 52)
    127.0.0.1.9850 > 127.0.0.1.36096: Flags [.], cksum 0xfe28 (incorrect -> 0x6cc2), seq 3342, ack 624, win 512, options [nop,nop,TS val 312616362 ecr 312616362], length 0
200, 3.877368211746216, 1.5225932598114014