2022-04-06 02:08:36.674917 IP (tos 0x0, ttl 64, id 39121, offset 0, flags [DF], proto TCP (6), length 60)
    127.0.0.1.41154 > 127.0.0.1.11650: Flags [S], cksum 0xfe30 (incorrect -> 0x093e), seq 2880101905, win 65495, options [mss 65495,sackOK,TS val 293199177 ecr 0,nop,wscale 7], length 0
2022-04-06 02:08:36.674926 IP (tos 0x0, ttl 64, id 0, offset 0, flags [DF], proto TCP (6), length 60)
    127.0.0.1.11650 > 127.0.0.1.41154: Flags [S.], cksum 0xfe30 (incorrect -> 0x2dbe), seq 3228642374, ack 2880101906, win 65483, options [mss 65495,sackOK,TS val 293199177 ecr 293199177,nop,wscale 7], length 0
2022-04-06 02:08:36.674934 IP (tos 0x0, ttl 64, id 39122, offset 0, flags [DF], proto TCP (6), length 52)
    127.0.0.1.41154 > 127.0.0.1.11650: Flags [.], cksum 0xfe28 (incorrect -> 0x547a), seq 1, ack 1, win 512, options [nop,nop,TS val 293199177 ecr 293199177], length 0
2022-04-06 02:08:36.675021 IP (tos 0x0, ttl 64, id 39123, offset 0, flags [DF], proto TCP (6), length 55)
    127.0.0.1.41154 > 127.0.0.1.11650: Flags [P.], cksum 0xfe2b (incorrect -> 0x4f6e), seq 1:4, ack 1, win 512, options [nop,nop,TS val 293199177 ecr 293199177], length 3
2022-04-06 02:08:36.675032 IP (tos 0x0, ttl 64, id 62198, offset 0, flags [DF], proto TCP (6), length 52)
    127.0.0.1.11650 > 127.0.0.1.41154: Flags [.], cksum 0xfe28 (incorrect -> 0x5477), seq 1, ack 4, win 512, options [nop,nop,TS val 293199177 ecr 293199177], length 0
2022-04-06 02:08:36.675057 IP (tos 0x0, ttl 64, id 62199, offset 0, flags [DF], proto TCP (6), length 54)
    127.0.0.1.11650 > 127.0.0.1.41154: Flags [P.], cksum 0xfe2a (incorrect -> 0x4f6d), seq 1:3, ack 4, win 512, options [nop,nop,TS val 293199177 ecr 293199177], length 2
2022-04-06 02:08:36.675066 IP (tos 0x0, ttl 64, id 39124, offset 0, flags [DF], proto TCP (6), length 52)
    127.0.0.1.41154 > 127.0.0.1.11650: Flags [.], cksum 0xfe28 (incorrect -> 0x5474), seq 4, ack 3, win 512, options [nop,nop,TS val 293199178 ecr 293199177], length 0
2022-04-06 02:08:36.686729 IP (tos 0x0, ttl 64, id 39125, offset 0, flags [DF], proto TCP (6), length 62)
    127.0.0.1.41154 > 127.0.0.1.11650: Flags [P.], cksum 0xfe32 (incorrect -> 0xf571), seq 4:14, ack 3, win 512, options [nop,nop,TS val 293199189 ecr 293199177], length 10
2022-04-06 02:08:36.686742 IP (tos 0x0, ttl 64, id 62200, offset 0, flags [DF], proto TCP (6), length 52)
    127.0.0.1.11650 > 127.0.0.1.41154: Flags [.], cksum 0xfe28 (incorrect -> 0x5453), seq 3, ack 14, win 512, options [nop,nop,TS val 293199189 ecr 293199189], length 0
2022-04-06 02:08:36.787941 IP (tos 0x0, ttl 64, id 62201, offset 0, flags [DF], proto TCP (6), length 62)
    127.0.0.1.11650 > 127.0.0.1.41154: Flags [P.], cksum 0xfe32 (incorrect -> 0x4edb), seq 3:13, ack 14, win 512, options [nop,nop,TS val 293199290 ecr 293199189], length 10
2022-04-06 02:08:36.787950 IP (tos 0x0, ttl 64, id 39126, offset 0, flags [DF], proto TCP (6), length 52)
    127.0.0.1.41154 > 127.0.0.1.11650: Flags [.], cksum 0xfe28 (incorrect -> 0x537f), seq 14, ack 13, win 512, options [nop,nop,TS val 293199290 ecr 293199290], length 0
2022-04-06 02:08:36.800900 IP (tos 0x0, ttl 64, id 39127, offset 0, flags [DF], proto TCP (6), length 569)
    127.0.0.1.41154 > 127.0.0.1.11650: Flags [P.], cksum 0x002e (incorrect -> 0xabcd), seq 14:531, ack 13, win 512, options [nop,nop,TS val 293199303 ecr 293199290], length 517
2022-04-06 02:08:36.800911 IP (tos 0x0, ttl 64, id 62202, offset 0, flags [DF], proto TCP (6), length 52)
    127.0.0.1.11650 > 127.0.0.1.41154: Flags [.], cksum 0xfe28 (incorrect -> 0x5164), seq 13, ack 531, win 508, options [nop,nop,TS val 293199303 ecr 293199303], length 0
200, 3.900026321411133, 0.46477627754211426