2022-04-06 23:10:00.907066 IP (tos 0x0, ttl 64, id 1995, offset 0, flags [DF], proto TCP (6), length 60)
    127.0.0.1.48416 > 127.0.0.1.9250: Flags [S], cksum 0xfe30 (incorrect -> 0xe7a8), seq 1941390993, win 65495, options [mss 65495,sackOK,TS val 368883409 ecr 0,nop,wscale 7], length 0
2022-04-06 23:10:00.907077 IP (tos 0x0, ttl 64, id 0, offset 0, flags [DF], proto TCP (6), length 60)
    127.0.0.1.9250 > 127.0.0.1.48416: Flags [S.], cksum 0xfe30 (incorrect -> 0x6718), seq 1043297677, ack 1941390994, win 65483, options [mss 65495,sackOK,TS val 368883410 ecr 368883409,nop,wscale 7], length 0
2022-04-06 23:10:00.907086 IP (tos 0x0, ttl 64, id 1996, offset 0, flags [DF], proto TCP (6), length 52)
    127.0.0.1.48416 > 127.0.0.1.9250: Flags [.], cksum 0xfe28 (incorrect -> 0x8dd3), seq 1, ack 1, win 512, options [nop,nop,TS val 368883410 ecr 368883410], length 0
2022-04-06 23:10:00.907250 IP (tos 0x0, ttl 64, id 1997, offset 0, flags [DF], proto TCP (6), length 55)
    127.0.0.1.48416 > 127.0.0.1.9250: Flags [P.], cksum 0xfe2b (incorrect -> 0x88c7), seq 1:4, ack 1, win 512, options [nop,nop,TS val 368883410 ecr 368883410], length 3
2022-04-06 23:10:00.907257 IP (tos 0x0, ttl 64, id 16680, offset 0, flags [DF], proto TCP (6), length 52)
    127.0.0.1.9250 > 127.0.0.1.48416: Flags [.], cksum 0xfe28 (incorrect -> 0x8dd0), seq 1, ack 4, win 512, options [nop,nop,TS val 368883410 ecr 368883410], length 0
2022-04-06 23:10:00.907283 IP (tos 0x0, ttl 64, id 16681, offset 0, flags [DF], proto TCP (6), length 54)
    127.0.0.1.9250 > 127.0.0.1.48416: Flags [P.], cksum 0xfe2a (incorrect -> 0x88c6), seq 1:3, ack 4, win 512, options [nop,nop,TS val 368883410 ecr 368883410], length 2
2022-04-06 23:10:00.907291 IP (tos 0x0, ttl 64, id 1998, offset 0, flags [DF], proto TCP (6), length 52)
    127.0.0.1.48416 > 127.0.0.1.9250: Flags [.], cksum 0xfe28 (incorrect -> 0x8dce), seq 4, ack 3, win 512, options [nop,nop,TS val 368883410 ecr 368883410], length 0
2022-04-06 23:10:00.918313 IP (tos 0x0, ttl 64, id 1999, offset 0, flags [DF], proto TCP (6), length 62)
    127.0.0.1.48416 > 127.0.0.1.9250: Flags [P.], cksum 0xfe32 (incorrect -> 0x357f), seq 4:14, ack 3, win 512, options [nop,nop,TS val 368883421 ecr 368883410], length 10
2022-04-06 23:10:00.918333 IP (tos 0x0, ttl 64, id 16682, offset 0, flags [DF], proto TCP (6), length 52)
    127.0.0.1.9250 > 127.0.0.1.48416: Flags [.], cksum 0xfe28 (incorrect -> 0x8dae), seq 3, ack 14, win 512, options [nop,nop,TS val 368883421 ecr 368883421], length 0
2022-04-06 23:10:01.250616 IP (tos 0x0, ttl 64, id 16683, offset 0, flags [DF], proto TCP (6), length 62)
    127.0.0.1.9250 > 127.0.0.1.48416: Flags [P.], cksum 0xfe32 (incorrect -> 0x874f), seq 3:13, ack 14, win 512, options [nop,nop,TS val 368883753 ecr 368883421], length 10
2022-04-06 23:10:01.250628 IP (tos 0x0, ttl 64, id 2000, offset 0, flags [DF], proto TCP (6), length 52)
    127.0.0.1.48416 > 127.0.0.1.9250: Flags [.], cksum 0xfe28 (incorrect -> 0x8b0c), seq 14, ack 13, win 512, options [nop,nop,TS val 368883753 ecr 368883753], length 0
2022-04-06 23:10:01.257097 IP (tos 0x0, ttl 64, id 2001, offset 0, flags [DF], proto TCP (6), length 569)
    127.0.0.1.48416 > 127.0.0.1.9250: Flags [P.], cksum 0x002e (incorrect -> 0x29ec), seq 14:531, ack 13, win 512, options [nop,nop,TS val 368883760 ecr 368883753], length 517
2022-04-06 23:10:01.257106 IP (tos 0x0, ttl 64, id 16684, offset 0, flags [DF], proto TCP (6), length 52)
    127.0.0.1.9250 > 127.0.0.1.48416: Flags [.], cksum 0xfe28 (incorrect -> 0x88fd), seq 13, ack 531, win 508, options [nop,nop,TS val 368883760 ecr 368883760], length 0
2022-04-06 23:10:01.605678 IP (tos 0x0, ttl 64, id 16685, offset 0, flags [DF], proto TCP (6), length 3538)
    127.0.0.1.9250 > 127.0.0.1.48416: Flags [P.], cksum 0x0bc7 (incorrect -> 0x8ca7), seq 13:3499, ack 531, win 512, options [nop,nop,TS val 368884108 ecr 368883760], length 3486
2022-04-06 23:10:01.605687 IP (tos 0x0, ttl 64, id 2002, offset 0, flags [DF], proto TCP (6), length 52)
    127.0.0.1.48416 > 127.0.0.1.9250: Flags [.], cksum 0xfe28 (incorrect -> 0x78b5), seq 531, ack 3499, win 494, options [nop,nop,TS val 368884108 ecr 368884108], length 0
2022-04-06 23:10:01.624042 IP (tos 0x0, ttl 64, id 16686, offset 0, flags [DF], proto TCP (6), length 272)
    127.0.0.1.9250 > 127.0.0.1.48416: Flags [P.], cksum 0xff04 (incorrect -> 0x31ee), seq 3499:3719, ack 531, win 512, options [nop,nop,TS val 368884126 ecr 368884108], length 220
2022-04-06 23:10:01.624048 IP (tos 0x0, ttl 64, id 2003, offset 0, flags [DF], proto TCP (6), length 52)
    127.0.0.1.48416 > 127.0.0.1.9250: Flags [.], cksum 0xfe28 (incorrect -> 0x77a8), seq 531, ack 3719, win 507, options [nop,nop,TS val 368884126 ecr 368884126], length 0
2022-04-06 23:10:01.624114 IP (tos 0x0, ttl 64, id 2004, offset 0, flags [DF], proto TCP (6), length 132)
    127.0.0.1.48416 > 127.0.0.1.9250: Flags [P.], cksum 0xfe78 (incorrect -> 0xd718), seq 531:611, ack 3719, win 507, options [nop,nop,TS val 368884127 ecr 368884126], length 80
2022-04-06 23:10:01.624119 IP (tos 0x0, ttl 64, id 16687, offset 0, flags [DF], proto TCP (6), length 52)
    127.0.0.1.9250 > 127.0.0.1.48416: Flags [.], cksum 0xfe28 (incorrect -> 0x7751), seq 3719, ack 611, win 512, options [nop,nop,TS val 368884127 ecr 368884127], length 0
2022-04-06 23:10:01.624567 IP (tos 0x0, ttl 64, id 2005, offset 0, flags [DF], proto TCP (6), length 384)
    127.0.0.1.48416 > 127.0.0.1.9250: Flags [P.], cksum 0xff74 (incorrect -> 0xac19), seq 611:943, ack 3719, win 507, options [nop,nop,TS val 368884127 ecr 368884127], length 332
2022-04-06 23:10:01.624574 IP (tos 0x0, ttl 64, id 16688, offset 0, flags [DF], proto TCP (6), length 52)
    127.0.0.1.9250 > 127.0.0.1.48416: Flags [.], cksum 0xfe28 (incorrect -> 0x7607), seq 3719, ack 943, win 510, options [nop,nop,TS val 368884127 ecr 368884127], length 0
2022-04-06 23:10:03.510897 IP (tos 0x0, ttl 64, id 16689, offset 0, flags [DF], proto TCP (6), length 3538)
    127.0.0.1.9250 > 127.0.0.1.48416: Flags [P.], cksum 0x0bc7 (incorrect -> 0xf88e), seq 3719:7205, ack 943, win 512, options [nop,nop,TS val 368886013 ecr 368884127], length 3486
2022-04-06 23:10:03.510906 IP (tos 0x0, ttl 64, id 2006, offset 0, flags [DF], proto TCP (6), length 52)
    127.0.0.1.48416 > 127.0.0.1.9250: Flags [.], cksum 0xfe28 (incorrect -> 0x59bd), seq 943, ack 7205, win 494, options [nop,nop,TS val 368886013 ecr 368886013], length 0
2022-04-06 23:10:03.516525 IP (tos 0x0, ttl 64, id 16690, offset 0, flags [DF], proto TCP (6), length 4036)
    127.0.0.1.9250 > 127.0.0.1.48416: Flags [P.], cksum 0x0db9 (incorrect -> 0xe754), seq 7205:11189, ack 943, win 512, options [nop,nop,TS val 368886019 ecr 368886013], length 3984
2022-04-06 23:10:03.516534 IP (tos 0x0, ttl 64, id 2007, offset 0, flags [DF], proto TCP (6), length 52)
    127.0.0.1.48416 > 127.0.0.1.9250: Flags [.], cksum 0xfe28 (incorrect -> 0x4a23), seq 943, ack 11189, win 492, options [nop,nop,TS val 368886019 ecr 368886019], length 0
2022-04-06 23:10:03.524947 IP (tos 0x0, ttl 64, id 16691, offset 0, flags [DF], proto TCP (6), length 1546)
    127.0.0.1.9250 > 127.0.0.1.48416: Flags [P.], cksum 0x03ff (incorrect -> 0x9c22), seq 11189:12683, ack 943, win 512, options [nop,nop,TS val 368886027 ecr 368886019], length 1494
2022-04-06 23:10:03.524952 IP (tos 0x0, ttl 64, id 2008, offset 0, flags [DF], proto TCP (6), length 52)
    127.0.0.1.48416 > 127.0.0.1.9250: Flags [.], cksum 0xfe28 (incorrect -> 0x4433), seq 943, ack 12683, win 502, options [nop,nop,TS val 368886027 ecr 368886027], length 0
2022-04-06 23:10:03.528869 IP (tos 0x0, ttl 64, id 16692, offset 0, flags [DF], proto TCP (6), length 3538)
    127.0.0.1.9250 > 127.0.0.1.48416: Flags [P.], cksum 0x0bc7 (incorrect -> 0x783b), seq 12683:16169, ack 943, win 512, options [nop,nop,TS val 368886031 ecr 368886027], length 3486
2022-04-06 23:10:03.528875 IP (tos 0x0, ttl 64, id 2009, offset 0, flags [DF], proto TCP (6), length 52)
    127.0.0.1.48416 > 127.0.0.1.9250: Flags [.], cksum 0xfe28 (incorrect -> 0x3695), seq 943, ack 16169, win 494, options [nop,nop,TS val 368886031 ecr 368886031], length 0
2022-04-06 23:10:03.531365 IP (tos 0x0, ttl 64, id 16693, offset 0, flags [DF], proto TCP (6), length 1048)
    127.0.0.1.9250 > 127.0.0.1.48416: Flags [P.], cksum 0x020d (incorrect -> 0x1816), seq 16169:17165, ack 943, win 512, options [nop,nop,TS val 368886034 ecr 368886031], length 996
2022-04-06 23:10:03.531370 IP (tos 0x0, ttl 64, id 2010, offset 0, flags [DF], proto TCP (6), length 52)
    127.0.0.1.48416 > 127.0.0.1.9250: Flags [.], cksum 0xfe28 (incorrect -> 0x32a1), seq 943, ack 17165, win 504, options [nop,nop,TS val 368886034 ecr 368886034], length 0
2022-04-06 23:10:03.539099 IP (tos 0x0, ttl 64, id 16694, offset 0, flags [DF], proto TCP (6), length 2542)
    127.0.0.1.9250 > 127.0.0.1.48416: Flags [P.], cksum 0x07e3 (incorrect -> 0x9fa6), seq 17165:19655, ack 943, win 512, options [nop,nop,TS val 368886042 ecr 368886034], length 2490
2022-04-06 23:10:03.539105 IP (tos 0x0, ttl 64, id 2011, offset 0, flags [DF], proto TCP (6), length 52)
    127.0.0.1.48416 > 127.0.0.1.9250: Flags [.], cksum 0xfe28 (incorrect -> 0x28dd), seq 943, ack 19655, win 498, options [nop,nop,TS val 368886042 ecr 368886042], length 0
2022-04-06 23:10:04.343643 IP (tos 0x0, ttl 64, id 16695, offset 0, flags [DF], proto TCP (6), length 3538)
    127.0.0.1.9250 > 127.0.0.1.48416: Flags [P.], cksum 0x0bc7 (incorrect -> 0xd023), seq 19655:23141, ack 943, win 512, options [nop,nop,TS val 368886846 ecr 368886042], length 3486
2022-04-06 23:10:04.343651 IP (tos 0x0, ttl 64, id 2012, offset 0, flags [DF], proto TCP (6), length 52)
    127.0.0.1.48416 > 127.0.0.1.9250: Flags [.], cksum 0xfe28 (incorrect -> 0x14fb), seq 943, ack 23141, win 494, options [nop,nop,TS val 368886846 ecr 368886846], length 0
2022-04-06 23:10:04.344963 IP (tos 0x0, ttl 64, id 16696, offset 0, flags [DF], proto TCP (6), length 1546)
    127.0.0.1.9250 > 127.0.0.1.48416: Flags [P.], cksum 0x03ff (incorrect -> 0x9350), seq 23141:24635, ack 943, win 512, options [nop,nop,TS val 368886847 ecr 368886846], length 1494
2022-04-06 23:10:04.344968 IP (tos 0x0, ttl 64, id 2013, offset 0, flags [DF], proto TCP (6), length 52)
    127.0.0.1.48416 > 127.0.0.1.9250: Flags [.], cksum 0xfe28 (incorrect -> 0x0f1b), seq 943, ack 24635, win 502, options [nop,nop,TS val 368886847 ecr 368886847], length 0
2022-04-06 23:10:04.358432 IP (tos 0x0, ttl 64, id 16697, offset 0, flags [DF], proto TCP (6), length 2044)
    127.0.0.1.9250 > 127.0.0.1.48416: Flags [P.], cksum 0x05f1 (incorrect -> 0x01ab), seq 24635:26627, ack 943, win 512, options [nop,nop,TS val 368886861 ecr 368886847], length 1992
2022-04-06 23:10:04.358436 IP (tos 0x0, ttl 64, id 2014, offset 0, flags [DF], proto TCP (6), length 52)
    127.0.0.1.48416 > 127.0.0.1.9250: Flags [.], cksum 0xfe28 (incorrect -> 0x0739), seq 943, ack 26627, win 500, options [nop,nop,TS val 368886861 ecr 368886861], length 0
2022-04-06 23:10:04.359613 IP (tos 0x0, ttl 64, id 16698, offset 0, flags [DF], proto TCP (6), length 3538)
    127.0.0.1.9250 > 127.0.0.1.48416: Flags [P.], cksum 0x0bc7 (incorrect -> 0x066b), seq 26627:30113, ack 943, win 512, options [nop,nop,TS val 368886862 ecr 368886861], length 3486
2022-04-06 23:10:04.359617 IP (tos 0x0, ttl 64, id 2015, offset 0, flags [DF], proto TCP (6), length 52)
    127.0.0.1.48416 > 127.0.0.1.9250: Flags [.], cksum 0xfe28 (incorrect -> 0xf99e), seq 943, ack 30113, win 494, options [nop,nop,TS val 368886862 ecr 368886862], length 0
2022-04-06 23:10:04.363369 IP (tos 0x0, ttl 64, id 16699, offset 0, flags [DF], proto TCP (6), length 3040)
    127.0.0.1.9250 > 127.0.0.1.48416: Flags [P.], cksum 0x09d5 (incorrect -> 0x717b), seq 30113:33101, ack 943, win 512, options [nop,nop,TS val 368886866 ecr 368886862], length 2988
2022-04-06 23:10:04.363381 IP (tos 0x0, ttl 64, id 2016, offset 0, flags [DF], proto TCP (6), length 52)
    127.0.0.1.48416 > 127.0.0.1.9250: Flags [.], cksum 0xfe28 (incorrect -> 0xede8), seq 943, ack 33101, win 496, options [nop,nop,TS val 368886866 ecr 368886866], length 0
2022-04-06 23:10:04.372494 IP (tos 0x0, ttl 64, id 16700, offset 0, flags [DF], proto TCP (6), length 2542)
    127.0.0.1.9250 > 127.0.0.1.48416: Flags [P.], cksum 0x07e3 (incorrect -> 0xc7da), seq 33101:35591, ack 943, win 512, options [nop,nop,TS val 368886875 ecr 368886866], length 2490
2022-04-06 23:10:04.372505 IP (tos 0x0, ttl 64, id 2017, offset 0, flags [DF], proto TCP (6), length 52)
    127.0.0.1.48416 > 127.0.0.1.9250: Flags [.], cksum 0xfe28 (incorrect -> 0xe41a), seq 943, ack 35591, win 498, options [nop,nop,TS val 368886875 ecr 368886875], length 0
2022-04-06 23:10:05.087079 IP (tos 0x0, ttl 64, id 16701, offset 0, flags [DF], proto TCP (6), length 3538)
    127.0.0.1.9250 > 127.0.0.1.48416: Flags [P.], cksum 0x0bc7 (incorrect -> 0x0777), seq 35591:39077, ack 943, win 512, options [nop,nop,TS val 368887590 ecr 368886875], length 3486
2022-04-06 23:10:05.087088 IP (tos 0x0, ttl 64, id 2018, offset 0, flags [DF], proto TCP (6), length 52)
    127.0.0.1.48416 > 127.0.0.1.9250: Flags [.], cksum 0xfe28 (incorrect -> 0xd0ea), seq 943, ack 39077, win 494, options [nop,nop,TS val 368887590 ecr 368887590], length 0
2022-04-06 23:10:05.087687 IP (tos 0x0, ttl 64, id 16702, offset 0, flags [DF], proto TCP (6), length 1048)
    127.0.0.1.9250 > 127.0.0.1.48416: Flags [P.], cksum 0x020d (incorrect -> 0xd8d8), seq 39077:40073, ack 943, win 512, options [nop,nop,TS val 368887590 ecr 368887590], length 996
2022-04-06 23:10:05.087692 IP (tos 0x0, ttl 64, id 2019, offset 0, flags [DF], proto TCP (6), length 52)
    127.0.0.1.48416 > 127.0.0.1.9250: Flags [.], cksum 0xfe28 (incorrect -> 0xccfc), seq 943, ack 40073, win 504, options [nop,nop,TS val 368887590 ecr 368887590], length 0
2022-04-06 23:10:05.100206 IP (tos 0x0, ttl 64, id 16703, offset 0, flags [DF], proto TCP (6), length 4100)
    127.0.0.1.9250 > 127.0.0.1.48416: Flags [P.], cksum 0x0df9 (incorrect -> 0x8680), seq 40073:44121, ack 943, win 512, options [nop,nop,TS val 368887603 ecr 368887590], length 4048
2022-04-06 23:10:05.100215 IP (tos 0x0, ttl 64, id 2020, offset 0, flags [DF], proto TCP (6), length 52)
    127.0.0.1.48416 > 127.0.0.1.9250: Flags [.], cksum 0xfe28 (incorrect -> 0xbd1e), seq 943, ack 44121, win 492, options [nop,nop,TS val 368887603 ecr 368887603], length 0
2022-04-06 23:10:05.100224 IP (tos 0x0, ttl 64, id 16704, offset 0, flags [DF], proto TCP (6), length 486)
    127.0.0.1.9250 > 127.0.0.1.48416: Flags [P.], cksum 0xffda (incorrect -> 0x6e18), seq 44121:44555, ack 943, win 512, options [nop,nop,TS val 368887603 ecr 368887603], length 434
2022-04-06 23:10:05.100228 IP (tos 0x0, ttl 64, id 2021, offset 0, flags [DF], proto TCP (6), length 52)
    127.0.0.1.48416 > 127.0.0.1.9250: Flags [.], cksum 0xfe28 (incorrect -> 0xbb6e), seq 943, ack 44555, win 490, options [nop,nop,TS val 368887603 ecr 368887603], length 0
2022-04-06 23:10:05.101590 IP (tos 0x0, ttl 64, id 16705, offset 0, flags [DF], proto TCP (6), length 4100)
    127.0.0.1.9250 > 127.0.0.1.48416: Flags [P.], cksum 0x0df9 (incorrect -> 0x5de4), seq 44555:48603, ack 943, win 512, options [nop,nop,TS val 368887604 ecr 368887603], length 4048
2022-04-06 23:10:05.101594 IP (tos 0x0, ttl 64, id 2022, offset 0, flags [DF], proto TCP (6), length 52)
    127.0.0.1.48416 > 127.0.0.1.9250: Flags [.], cksum 0xfe28 (incorrect -> 0xab9a), seq 943, ack 48603, win 492, options [nop,nop,TS val 368887604 ecr 368887604], length 0
2022-04-06 23:10:05.101598 IP (tos 0x0, ttl 64, id 16706, offset 0, flags [DF], proto TCP (6), length 486)
    127.0.0.1.9250 > 127.0.0.1.48416: Flags [P.], cksum 0xffda (incorrect -> 0xdd65), seq 48603:49037, ack 943, win 512, options [nop,nop,TS val 368887604 ecr 368887604], length 434
2022-04-06 23:10:05.101601 IP (tos 0x0, ttl 64, id 2023, offset 0, flags [DF], proto TCP (6), length 52)
    127.0.0.1.48416 > 127.0.0.1.9250: Flags [.], cksum 0xfe28 (incorrect -> 0xa9ea), seq 943, ack 49037, win 490, options [nop,nop,TS val 368887604 ecr 368887604], length 0
2022-04-06 23:10:05.133122 IP (tos 0x0, ttl 64, id 16707, offset 0, flags [DF], proto TCP (6), length 2542)
    127.0.0.1.9250 > 127.0.0.1.48416: Flags [P.], cksum 0x07e3 (incorrect -> 0xa7ff), seq 49037:51527, ack 943, win 512, options [nop,nop,TS val 368887636 ecr 368887604], length 2490
2022-04-06 23:10:05.133127 IP (tos 0x0, ttl 64, id 2024, offset 0, flags [DF], proto TCP (6), length 52)
    127.0.0.1.48416 > 127.0.0.1.9250: Flags [.], cksum 0xfe28 (incorrect -> 0x9fe8), seq 943, ack 51527, win 498, options [nop,nop,TS val 368887636 ecr 368887636], length 0
2022-04-06 23:10:06.196582 IP (tos 0x0, ttl 64, id 16708, offset 0, flags [DF], proto TCP (6), length 4100)
    127.0.0.1.9250 > 127.0.0.1.48416: Flags [P.], cksum 0x0df9 (incorrect -> 0x3fe6), seq 51527:55575, ack 943, win 512, options [nop,nop,TS val 368888699 ecr 368887636], length 4048
2022-04-06 23:10:06.196588 IP (tos 0x0, ttl 64, id 2025, offset 0, flags [DF], proto TCP (6), length 52)
    127.0.0.1.48416 > 127.0.0.1.9250: Flags [.], cksum 0xfe28 (incorrect -> 0x87d0), seq 943, ack 55575, win 492, options [nop,nop,TS val 368888699 ecr 368888699], length 0
2022-04-06 23:10:06.196594 IP (tos 0x0, ttl 64, id 16709, offset 0, flags [DF], proto TCP (6), length 466)
    127.0.0.1.9250 > 127.0.0.1.48416: Flags [P.], cksum 0xffc6 (incorrect -> 0xa788), seq 55575:55989, ack 943, win 512, options [nop,nop,TS val 368888699 ecr 368888699], length 414
2022-04-06 23:10:06.196597 IP (tos 0x0, ttl 64, id 2026, offset 0, flags [DF], proto TCP (6), length 52)
    127.0.0.1.48416 > 127.0.0.1.9250: Flags [.], cksum 0xfe28 (incorrect -> 0x8634), seq 943, ack 55989, win 490, options [nop,nop,TS val 368888699 ecr 368888699], length 0
2022-04-06 23:10:06.210424 IP (tos 0x0, ttl 64, id 16710, offset 0, flags [DF], proto TCP (6), length 4100)
    127.0.0.1.9250 > 127.0.0.1.48416: Flags [P.], cksum 0x0df9 (incorrect -> 0x3a28), seq 55989:60037, ack 943, win 512, options [nop,nop,TS val 368888713 ecr 368888699], length 4048
2022-04-06 23:10:06.210429 IP (tos 0x0, ttl 64, id 2027, offset 0, flags [DF], proto TCP (6), length 52)
    127.0.0.1.48416 > 127.0.0.1.9250: Flags [.], cksum 0xfe28 (incorrect -> 0x7646), seq 943, ack 60037, win 492, options [nop,nop,TS val 368888713 ecr 368888713], length 0
2022-04-06 23:10:06.210435 IP (tos 0x0, ttl 64, id 16711, offset 0, flags [DF], proto TCP (6), length 486)
    127.0.0.1.9250 > 127.0.0.1.48416: Flags [P.], cksum 0xffda (incorrect -> 0xd7bd), seq 60037:60471, ack 943, win 512, options [nop,nop,TS val 368888713 ecr 368888713], length 434
2022-04-06 23:10:06.210438 IP (tos 0x0, ttl 64, id 2028, offset 0, flags [DF], proto TCP (6), length 52)
    127.0.0.1.48416 > 127.0.0.1.9250: Flags [.], cksum 0xfe28 (incorrect -> 0x7496), seq 943, ack 60471, win 490, options [nop,nop,TS val 368888713 ecr 368888713], length 0
2022-04-06 23:10:06.217848 IP (tos 0x0, ttl 64, id 16712, offset 0, flags [DF], proto TCP (6), length 3538)
    127.0.0.1.9250 > 127.0.0.1.48416: Flags [P.], cksum 0x0bc7 (incorrect -> 0x7e94), seq 60471:63957, ack 943, win 512, options [nop,nop,TS val 368888720 ecr 368888713], length 3486
2022-04-06 23:10:06.217853 IP (tos 0x0, ttl 64, id 2029, offset 0, flags [DF], proto TCP (6), length 52)
    127.0.0.1.48416 > 127.0.0.1.9250: Flags [.], cksum 0xfe28 (incorrect -> 0x66e6), seq 943, ack 63957, win 494, options [nop,nop,TS val 368888720 ecr 368888720], length 0
2022-04-06 23:10:06.225909 IP (tos 0x0, ttl 64, id 16713, offset 0, flags [DF], proto TCP (6), length 3558)
    127.0.0.1.9250 > 127.0.0.1.48416: Flags [P.], cksum 0x0bdb (incorrect -> 0xaba1), seq 63957:67463, ack 943, win 512, options [nop,nop,TS val 368888728 ecr 368888720], length 3506
2022-04-06 23:10:06.225914 IP (tos 0x0, ttl 64, id 2030, offset 0, flags [DF], proto TCP (6), length 52)
    127.0.0.1.48416 > 127.0.0.1.9250: Flags [.], cksum 0xfe28 (incorrect -> 0x5924), seq 943, ack 67463, win 494, options [nop,nop,TS val 368888728 ecr 368888728], length 0
2022-04-06 23:10:07.126544 IP (tos 0x0, ttl 64, id 16714, offset 0, flags [DF], proto TCP (6), length 4100)
    127.0.0.1.9250 > 127.0.0.1.48416: Flags [P.], cksum 0x0df9 (incorrect -> 0x7273), seq 67463:71511, ack 943, win 512, options [nop,nop,TS val 368889629 ecr 368888728], length 4048
2022-04-06 23:10:07.126551 IP (tos 0x0, ttl 64, id 2031, offset 0, flags [DF], proto TCP (6), length 52)
    127.0.0.1.48416 > 127.0.0.1.9250: Flags [.], cksum 0xfe28 (incorrect -> 0x424c), seq 943, ack 71511, win 492, options [nop,nop,TS val 368889629 ecr 368889629], length 0
2022-04-06 23:10:07.126558 IP (tos 0x0, ttl 64, id 16715, offset 0, flags [DF], proto TCP (6), length 486)
    127.0.0.1.9250 > 127.0.0.1.48416: Flags [P.], cksum 0xffda (incorrect -> 0xd3ec), seq 71511:71945, ack 943, win 512, options [nop,nop,TS val 368889629 ecr 368889629], length 434
2022-04-06 23:10:07.126560 IP (tos 0x0, ttl 64, id 2032, offset 0, flags [DF], proto TCP (6), length 52)
    127.0.0.1.48416 > 127.0.0.1.9250: Flags [.], cksum 0xfe28 (incorrect -> 0x409c), seq 943, ack 71945, win 490, options [nop,nop,TS val 368889629 ecr 368889629], length 0
2022-04-06 23:10:07.135073 IP (tos 0x0, ttl 64, id 16716, offset 0, flags [DF], proto TCP (6), length 4100)
    127.0.0.1.9250 > 127.0.0.1.48416: Flags [P.], cksum 0x0df9 (incorrect -> 0x2fef), seq 71945:75993, ack 943, win 512, options [nop,nop,TS val 368889638 ecr 368889629], length 4048
2022-04-06 23:10:07.135086 IP (tos 0x0, ttl 64, id 2033, offset 0, flags [DF], proto TCP (6), length 52)
    127.0.0.1.48416 > 127.0.0.1.9250: Flags [.], cksum 0xfe28 (incorrect -> 0x30b8), seq 943, ack 75993, win 492, options [nop,nop,TS val 368889638 ecr 368889638], length 0
2022-04-06 23:10:07.135092 IP (tos 0x0, ttl 64, id 16717, offset 0, flags [DF], proto TCP (6), length 486)
    127.0.0.1.9250 > 127.0.0.1.48416: Flags [P.], cksum 0xffda (incorrect -> 0x4dae), seq 75993:76427, ack 943, win 512, options [nop,nop,TS val 368889638 ecr 368889638], length 434
2022-04-06 23:10:07.135095 IP (tos 0x0, ttl 64, id 2034, offset 0, flags [DF], proto TCP (6), length 52)
    127.0.0.1.48416 > 127.0.0.1.9250: Flags [.], cksum 0xfe28 (incorrect -> 0x2f08), seq 943, ack 76427, win 490, options [nop,nop,TS val 368889638 ecr 368889638], length 0
2022-04-06 23:10:07.141349 IP (tos 0x0, ttl 64, id 16718, offset 0, flags [DF], proto TCP (6), length 4100)
    127.0.0.1.9250 > 127.0.0.1.48416: Flags [P.], cksum 0x0df9 (incorrect -> 0x0925), seq 76427:80475, ack 943, win 512, options [nop,nop,TS val 368889644 ecr 368889638], length 4048
2022-04-06 23:10:07.141357 IP (tos 0x0, ttl 64, id 2035, offset 0, flags [DF], proto TCP (6), length 52)
    127.0.0.1.48416 > 127.0.0.1.9250: Flags [.], cksum 0xfe28 (incorrect -> 0x1f2a), seq 943, ack 80475, win 492, options [nop,nop,TS val 368889644 ecr 368889644], length 0
2022-04-06 23:10:07.141362 IP (tos 0x0, ttl 64, id 16719, offset 0, flags [DF], proto TCP (6), length 486)
    127.0.0.1.9250 > 127.0.0.1.48416: Flags [P.], cksum 0xffda (incorrect -> 0x3142), seq 80475:80909, ack 943, win 512, options [nop,nop,TS val 368889644 ecr 368889644], length 434
2022-04-06 23:10:07.141365 IP (tos 0x0, ttl 64, id 2036, offset 0, flags [DF], proto TCP (6), length 52)
    127.0.0.1.48416 > 127.0.0.1.9250: Flags [.], cksum 0xfe28 (incorrect -> 0x1d7a), seq 943, ack 80909, win 490, options [nop,nop,TS val 368889644 ecr 368889644], length 0
2022-04-06 23:10:07.166541 IP (tos 0x0, ttl 64, id 16720, offset 0, flags [DF], proto TCP (6), length 2542)
    127.0.0.1.9250 > 127.0.0.1.48416: Flags [P.], cksum 0x07e3 (incorrect -> 0xe3f2), seq 80909:83399, ack 943, win 512, options [nop,nop,TS val 368889669 ecr 368889644], length 2490
2022-04-06 23:10:07.166549 IP (tos 0x0, ttl 64, id 2037, offset 0, flags [DF], proto TCP (6), length 52)
    127.0.0.1.48416 > 127.0.0.1.9250: Flags [.], cksum 0xfe28 (incorrect -> 0x1386), seq 943, ack 83399, win 498, options [nop,nop,TS val 368889669 ecr 368889669], length 0
2022-04-06 23:10:08.242740 IP (tos 0x0, ttl 64, id 16721, offset 0, flags [DF], proto TCP (6), length 3538)
    127.0.0.1.9250 > 127.0.0.1.48416: Flags [P.], cksum 0x0bc7 (incorrect -> 0xf01e), seq 83399:86885, ack 943, win 512, options [nop,nop,TS val 368890745 ecr 368889669], length 3486
2022-04-06 23:10:08.242753 IP (tos 0x0, ttl 64, id 2038, offset 0, flags [DF], proto TCP (6), length 52)
    127.0.0.1.48416 > 127.0.0.1.9250: Flags [.], cksum 0xfe28 (incorrect -> 0xfd83), seq 943, ack 86885, win 494, options [nop,nop,TS val 368890745 ecr 368890745], length 0
2022-04-06 23:10:08.242840 IP (tos 0x0, ttl 64, id 16722, offset 0, flags [DF], proto TCP (6), length 4036)
    127.0.0.1.9250 > 127.0.0.1.48416: Flags [P.], cksum 0x0db9 (incorrect -> 0x6993), seq 86885:90869, ack 943, win 512, options [nop,nop,TS val 368890745 ecr 368890745], length 3984
2022-04-06 23:10:08.242845 IP (tos 0x0, ttl 64, id 2039, offset 0, flags [DF], proto TCP (6), length 52)
    127.0.0.1.48416 > 127.0.0.1.9250: Flags [.], cksum 0xfe28 (incorrect -> 0xee03), seq 943, ack 90869, win 478, options [nop,nop,TS val 368890745 ecr 368890745], length 0
2022-04-06 23:10:08.252149 IP (tos 0x0, ttl 64, id 16723, offset 0, flags [DF], proto TCP (6), length 1048)
    127.0.0.1.9250 > 127.0.0.1.48416: Flags [P.], cksum 0x020d (incorrect -> 0x4026), seq 90869:91865, ack 943, win 512, options [nop,nop,TS val 368890755 ecr 368890745], length 996
2022-04-06 23:10:08.252158 IP (tos 0x0, ttl 64, id 2040, offset 0, flags [DF], proto TCP (6), length 52)
    127.0.0.1.48416 > 127.0.0.1.9250: Flags [.], cksum 0xfe28 (incorrect -> 0xe9f1), seq 943, ack 91865, win 504, options [nop,nop,TS val 368890755 ecr 368890755], length 0
2022-04-06 23:10:08.258201 IP (tos 0x0, ttl 64, id 16724, offset 0, flags [DF], proto TCP (6), length 3538)
    127.0.0.1.9250 > 127.0.0.1.48416: Flags [P.], cksum 0x0bc7 (incorrect -> 0x6911), seq 91865:95351, ack 943, win 512, options [nop,nop,TS val 368890761 ecr 368890755], length 3486
2022-04-06 23:10:08.258207 IP (tos 0x0, ttl 64, id 2041, offset 0, flags [DF], proto TCP (6), length 52)
    127.0.0.1.48416 > 127.0.0.1.9250: Flags [.], cksum 0xfe28 (incorrect -> 0xdc51), seq 943, ack 95351, win 494, options [nop,nop,TS val 368890761 ecr 368890761], length 0
2022-04-06 23:10:08.278155 IP (tos 0x0, ttl 64, id 16725, offset 0, flags [DF], proto TCP (6), length 3538)
    127.0.0.1.9250 > 127.0.0.1.48416: Flags [P.], cksum 0x0bc7 (incorrect -> 0xb1fd), seq 95351:98837, ack 943, win 512, options [nop,nop,TS val 368890781 ecr 368890761], length 3486
2022-04-06 23:10:08.278166 IP (tos 0x0, ttl 64, id 2042, offset 0, flags [DF], proto TCP (6), length 52)
    127.0.0.1.48416 > 127.0.0.1.9250: Flags [.], cksum 0xfe28 (incorrect -> 0xce8b), seq 943, ack 98837, win 494, options [nop,nop,TS val 368890781 ecr 368890781], length 0
2022-04-06 23:10:08.292080 IP (tos 0x0, ttl 64, id 16726, offset 0, flags [DF], proto TCP (6), length 550)
    127.0.0.1.9250 > 127.0.0.1.48416: Flags [P.], cksum 0x001b (incorrect -> 0x08e0), seq 98837:99335, ack 943, win 512, options [nop,nop,TS val 368890795 ecr 368890781], length 498
2022-04-06 23:10:08.292094 IP (tos 0x0, ttl 64, id 2043, offset 0, flags [DF], proto TCP (6), length 52)
    127.0.0.1.48416 > 127.0.0.1.9250: Flags [.], cksum 0xfe28 (incorrect -> 0xcc71), seq 943, ack 99335, win 506, options [nop,nop,TS val 368890795 ecr 368890795], length 0
2022-04-06 23:10:09.056146 IP (tos 0x0, ttl 64, id 16727, offset 0, flags [DF], proto TCP (6), length 3538)
    127.0.0.1.9250 > 127.0.0.1.48416: Flags [P.], cksum 0x0bc7 (incorrect -> 0x360c), seq 99335:102821, ack 943, win 512, options [nop,nop,TS val 368891559 ecr 368890795], length 3486
2022-04-06 23:10:09.056154 IP (tos 0x0, ttl 64, id 2044, offset 0, flags [DF], proto TCP (6), length 52)
    127.0.0.1.48416 > 127.0.0.1.9250: Flags [.], cksum 0xfe28 (incorrect -> 0xb8e7), seq 943, ack 102821, win 494, options [nop,nop,TS val 368891559 ecr 368891559], length 0
2022-04-06 23:10:09.065725 IP (tos 0x0, ttl 64, id 16728, offset 0, flags [DF], proto TCP (6), length 4036)
    127.0.0.1.9250 > 127.0.0.1.48416: Flags [P.], cksum 0x0db9 (incorrect -> 0x936a), seq 102821:106805, ack 943, win 512, options [nop,nop,TS val 368891568 ecr 368891559], length 3984
2022-04-06 23:10:09.065730 IP (tos 0x0, ttl 64, id 2045, offset 0, flags [DF], proto TCP (6), length 52)
    127.0.0.1.48416 > 127.0.0.1.9250: Flags [.], cksum 0xfe28 (incorrect -> 0xa947), seq 943, ack 106805, win 492, options [nop,nop,TS val 368891568 ecr 368891568], length 0
2022-04-06 23:10:09.071153 IP (tos 0x0, ttl 64, id 16729, offset 0, flags [DF], proto TCP (6), length 1546)
    127.0.0.1.9250 > 127.0.0.1.48416: Flags [P.], cksum 0x03ff (incorrect -> 0xd6cc), seq 106805:108299, ack 943, win 512, options [nop,nop,TS val 368891574 ecr 368891568], length 1494
2022-04-06 23:10:09.071157 IP (tos 0x0, ttl 64, id 2046, offset 0, flags [DF], proto TCP (6), length 52)
    127.0.0.1.48416 > 127.0.0.1.9250: Flags [.], cksum 0xfe28 (incorrect -> 0xa35b), seq 943, ack 108299, win 502, options [nop,nop,TS val 368891574 ecr 368891574], length 0
2022-04-06 23:10:09.075399 IP (tos 0x0, ttl 64, id 16730, offset 0, flags [DF], proto TCP (6), length 3538)
    127.0.0.1.9250 > 127.0.0.1.48416: Flags [P.], cksum 0x0bc7 (incorrect -> 0xfb5f), seq 108299:111785, ack 943, win 512, options [nop,nop,TS val 368891578 ecr 368891574], length 3486
2022-04-06 23:10:09.075405 IP (tos 0x0, ttl 64, id 2047, offset 0, flags [DF], proto TCP (6), length 52)
    127.0.0.1.48416 > 127.0.0.1.9250: Flags [.], cksum 0xfe28 (incorrect -> 0x95bd), seq 943, ack 111785, win 494, options [nop,nop,TS val 368891578 ecr 368891578], length 0
2022-04-06 23:10:09.085218 IP (tos 0x0, ttl 64, id 16731, offset 0, flags [DF], proto TCP (6), length 1048)
    127.0.0.1.9250 > 127.0.0.1.48416: Flags [P.], cksum 0x020d (incorrect -> 0xa37f), seq 111785:112781, ack 943, win 512, options [nop,nop,TS val 368891588 ecr 368891578], length 996
2022-04-06 23:10:09.085223 IP (tos 0x0, ttl 64, id 2048, offset 0, flags [DF], proto TCP (6), length 52)
    127.0.0.1.48416 > 127.0.0.1.9250: Flags [.], cksum 0xfe28 (incorrect -> 0x91bb), seq 943, ack 112781, win 504, options [nop,nop,TS val 368891588 ecr 368891588], length 0
2022-04-06 23:10:09.085274 IP (tos 0x0, ttl 64, id 16732, offset 0, flags [DF], proto TCP (6), length 2542)
    127.0.0.1.9250 > 127.0.0.1.48416: Flags [P.], cksum 0x07e3 (incorrect -> 0x710c), seq 112781:115271, ack 943, win 512, options [nop,nop,TS val 368891588 ecr 368891588], length 2490
2022-04-06 23:10:09.085278 IP (tos 0x0, ttl 64, id 2049, offset 0, flags [DF], proto TCP (6), length 52)
    127.0.0.1.48416 > 127.0.0.1.9250: Flags [.], cksum 0xfe28 (incorrect -> 0x8807), seq 943, ack 115271, win 498, options [nop,nop,TS val 368891588 ecr 368891588], length 0
2022-04-06 23:10:09.879097 IP (tos 0x0, ttl 64, id 16733, offset 0, flags [DF], proto TCP (6), length 3538)
    127.0.0.1.9250 > 127.0.0.1.48416: Flags [P.], cksum 0x0bc7 (incorrect -> 0xabcd), seq 115271:118757, ack 943, win 512, options [nop,nop,TS val 368892382 ecr 368891588], length 3486
2022-04-06 23:10:09.879102 IP (tos 0x0, ttl 64, id 2050, offset 0, flags [DF], proto TCP (6), length 52)
    127.0.0.1.48416 > 127.0.0.1.9250: Flags [.], cksum 0xfe28 (incorrect -> 0x7439), seq 943, ack 118757, win 494, options [nop,nop,TS val 368892382 ecr 368892382], length 0
2022-04-06 23:10:09.887044 IP (tos 0x0, ttl 64, id 16734, offset 0, flags [DF], proto TCP (6), length 4036)
    127.0.0.1.9250 > 127.0.0.1.48416: Flags [P.], cksum 0x0db9 (incorrect -> 0x3c49), seq 118757:122741, ack 943, win 512, options [nop,nop,TS val 368892389 ecr 368892382], length 3984
2022-04-06 23:10:09.887049 IP (tos 0x0, ttl 64, id 2051, offset 0, flags [DF], proto TCP (6), length 52)
    127.0.0.1.48416 > 127.0.0.1.9250: Flags [.], cksum 0xfe28 (incorrect -> 0x649d), seq 943, ack 122741, win 492, options [nop,nop,TS val 368892389 ecr 368892389], length 0
2022-04-06 23:10:09.893191 IP (tos 0x0, ttl 64, id 16735, offset 0, flags [DF], proto TCP (6), length 1546)
    127.0.0.1.9250 > 127.0.0.1.48416: Flags [P.], cksum 0x03ff (incorrect -> 0x367f), seq 122741:124235, ack 943, win 512, options [nop,nop,TS val 368892396 ecr 368892389], length 1494
2022-04-06 23:10:09.893196 IP (tos 0x0, ttl 64, id 2052, offset 0, flags [DF], proto TCP (6), length 52)
    127.0.0.1.48416 > 127.0.0.1.9250: Flags [.], cksum 0xfe28 (incorrect -> 0x5eaf), seq 943, ack 124235, win 502, options [nop,nop,TS val 368892396 ecr 368892396], length 0
2022-04-06 23:10:09.897808 IP (tos 0x0, ttl 64, id 16736, offset 0, flags [DF], proto TCP (6), length 3538)
    127.0.0.1.9250 > 127.0.0.1.48416: Flags [P.], cksum 0x0bc7 (incorrect -> 0x873c), seq 124235:127721, ack 943, win 512, options [nop,nop,TS val 368892400 ecr 368892396], length 3486
2022-04-06 23:10:09.897812 IP (tos 0x0, ttl 64, id 2053, offset 0, flags [DF], proto TCP (6), length 52)
    127.0.0.1.48416 > 127.0.0.1.9250: Flags [.], cksum 0xfe28 (incorrect -> 0x5111), seq 943, ack 127721, win 494, options [nop,nop,TS val 368892400 ecr 368892400], length 0
2022-04-06 23:10:09.897927 IP (tos 0x0, ttl 64, id 16737, offset 0, flags [DF], proto TCP (6), length 3538)
    127.0.0.1.9250 > 127.0.0.1.48416: Flags [P.], cksum 0x0bc7 (incorrect -> 0x7001), seq 127721:131207, ack 943, win 512, options [nop,nop,TS val 368892400 ecr 368892400], length 3486
2022-04-06 23:10:09.897931 IP (tos 0x0, ttl 64, id 2054, offset 0, flags [DF], proto TCP (6), length 52)
    127.0.0.1.48416 > 127.0.0.1.9250: Flags [.], cksum 0xfe28 (incorrect -> 0x4373), seq 943, ack 131207, win 494, options [nop,nop,TS val 368892400 ecr 368892400], length 0
2022-04-06 23:10:10.634921 IP (tos 0x0, ttl 64, id 16738, offset 0, flags [DF], proto TCP (6), length 3538)
    127.0.0.1.9250 > 127.0.0.1.48416: Flags [P.], cksum 0x0bc7 (incorrect -> 0x7e7e), seq 131207:134693, ack 943, win 512, options [nop,nop,TS val 368893137 ecr 368892400], length 3486
2022-04-06 23:10:10.634928 IP (tos 0x0, ttl 64, id 2055, offset 0, flags [DF], proto TCP (6), length 52)
    127.0.0.1.48416 > 127.0.0.1.9250: Flags [.], cksum 0xfe28 (incorrect -> 0x3013), seq 943, ack 134693, win 494, options [nop,nop,TS val 368893137 ecr 368893137], length 0
2022-04-06 23:10:10.636031 IP (tos 0x0, ttl 64, id 16739, offset 0, flags [DF], proto TCP (6), length 3538)
    127.0.0.1.9250 > 127.0.0.1.48416: Flags [P.], cksum 0x0bc7 (incorrect -> 0x8089), seq 134693:138179, ack 943, win 512, options [nop,nop,TS val 368893138 ecr 368893137], length 3486
2022-04-06 23:10:10.636035 IP (tos 0x0, ttl 64, id 2056, offset 0, flags [DF], proto TCP (6), length 52)
    127.0.0.1.48416 > 127.0.0.1.9250: Flags [.], cksum 0xfe28 (incorrect -> 0x2273), seq 943, ack 138179, win 494, options [nop,nop,TS val 368893138 ecr 368893138], length 0
2022-04-06 23:10:10.643483 IP (tos 0x0, ttl 64, id 16740, offset 0, flags [DF], proto TCP (6), length 2024)
    127.0.0.1.9250 > 127.0.0.1.48416: Flags [P.], cksum 0x05dd (incorrect -> 0x4d73), seq 138179:140151, ack 943, win 512, options [nop,nop,TS val 368893146 ecr 368893138], length 1972
2022-04-06 23:10:10.643488 IP (tos 0x0, ttl 64, id 2057, offset 0, flags [DF], proto TCP (6), length 52)
    127.0.0.1.48416 > 127.0.0.1.9250: Flags [.], cksum 0xfe28 (incorrect -> 0x1aa9), seq 943, ack 140151, win 500, options [nop,nop,TS val 368893146 ecr 368893146], length 0
2022-04-06 23:10:10.649159 IP (tos 0x0, ttl 64, id 16741, offset 0, flags [DF], proto TCP (6), length 2542)
    127.0.0.1.9250 > 127.0.0.1.48416: Flags [P.], cksum 0x07e3 (incorrect -> 0x981f), seq 140151:142641, ack 943, win 512, options [nop,nop,TS val 368893152 ecr 368893146], length 2490
2022-04-06 23:10:10.649163 IP (tos 0x0, ttl 64, id 2058, offset 0, flags [DF], proto TCP (6), length 52)
    127.0.0.1.48416 > 127.0.0.1.9250: Flags [.], cksum 0xfe28 (incorrect -> 0x10e5), seq 943, ack 142641, win 498, options [nop,nop,TS val 368893152 ecr 368893152], length 0
2022-04-06 23:10:10.656726 IP (tos 0x0, ttl 64, id 16742, offset 0, flags [DF], proto TCP (6), length 2044)
    127.0.0.1.9250 > 127.0.0.1.48416: Flags [P.], cksum 0x05f1 (incorrect -> 0xe093), seq 142641:144633, ack 943, win 512, options [nop,nop,TS val 368893159 ecr 368893152], length 1992
2022-04-06 23:10:10.656730 IP (tos 0x0, ttl 64, id 2059, offset 0, flags [DF], proto TCP (6), length 52)
    127.0.0.1.48416 > 127.0.0.1.9250: Flags [.], cksum 0xfe28 (incorrect -> 0x090d), seq 943, ack 144633, win 500, options [nop,nop,TS val 368893159 ecr 368893159], length 0
2022-04-06 23:10:10.663153 IP (tos 0x0, ttl 64, id 16743, offset 0, flags [DF], proto TCP (6), length 2562)
    127.0.0.1.9250 > 127.0.0.1.48416: Flags [P.], cksum 0x07f7 (incorrect -> 0xb53e), seq 144633:147143, ack 943, win 512, options [nop,nop,TS val 368893166 ecr 368893159], length 2510
2022-04-06 23:10:10.663158 IP (tos 0x0, ttl 64, id 2060, offset 0, flags [DF], proto TCP (6), length 52)
    127.0.0.1.48416 > 127.0.0.1.9250: Flags [.], cksum 0xfe28 (incorrect -> 0xff32), seq 943, ack 147143, win 498, options [nop,nop,TS val 368893166 ecr 368893166], length 0
2022-04-06 23:10:11.299427 IP (tos 0x0, ttl 64, id 16744, offset 0, flags [DF], proto TCP (6), length 3538)
    127.0.0.1.9250 > 127.0.0.1.48416: Flags [P.], cksum 0x0bc7 (incorrect -> 0x7fcf), seq 147143:150629, ack 943, win 512, options [nop,nop,TS val 368893802 ecr 368893166], length 3486
2022-04-06 23:10:11.299435 IP (tos 0x0, ttl 64, id 2061, offset 0, flags [DF], proto TCP (6), length 52)
    127.0.0.1.48416 > 127.0.0.1.9250: Flags [.], cksum 0xfe28 (incorrect -> 0xeca0), seq 943, ack 150629, win 494, options [nop,nop,TS val 368893802 ecr 368893802], length 0
2022-04-06 23:10:11.306210 IP (tos 0x0, ttl 64, id 16745, offset 0, flags [DF], proto TCP (6), length 4036)
    127.0.0.1.9250 > 127.0.0.1.48416: Flags [P.], cksum 0x0db9 (incorrect -> 0xc082), seq 150629:154613, ack 943, win 512, options [nop,nop,TS val 368893809 ecr 368893802], length 3984
2022-04-06 23:10:11.306215 IP (tos 0x0, ttl 64, id 2062, offset 0, flags [DF], proto TCP (6), length 52)
    127.0.0.1.48416 > 127.0.0.1.9250: Flags [.], cksum 0xfe28 (incorrect -> 0xdd04), seq 943, ack 154613, win 492, options [nop,nop,TS val 368893809 ecr 368893809], length 0
2022-04-06 23:10:11.313544 IP (tos 0x0, ttl 64, id 16746, offset 0, flags [DF], proto TCP (6), length 1546)
    127.0.0.1.9250 > 127.0.0.1.48416: Flags [P.], cksum 0x03ff (incorrect -> 0xaa89), seq 154613:156107, ack 943, win 512, options [nop,nop,TS val 368893816 ecr 368893809], length 1494
2022-04-06 23:10:11.313556 IP (tos 0x0, ttl 64, id 2063, offset 0, flags [DF], proto TCP (6), length 52)
    127.0.0.1.48416 > 127.0.0.1.9250: Flags [.], cksum 0xfe28 (incorrect -> 0xd716), seq 943, ack 156107, win 502, options [nop,nop,TS val 368893816 ecr 368893816], length 0
2022-04-06 23:10:11.314151 IP (tos 0x0, ttl 64, id 16747, offset 0, flags [DF], proto TCP (6), length 3538)
    127.0.0.1.9250 > 127.0.0.1.48416: Flags [P.], cksum 0x0bc7 (incorrect -> 0xdcbd), seq 156107:159593, ack 943, win 512, options [nop,nop,TS val 368893817 ecr 368893816], length 3486
2022-04-06 23:10:11.314159 IP (tos 0x0, ttl 64, id 2064, offset 0, flags [DF], proto TCP (6), length 52)
    127.0.0.1.48416 > 127.0.0.1.9250: Flags [.], cksum 0xfe28 (incorrect -> 0xc97e), seq 943, ack 159593, win 494, options [nop,nop,TS val 368893817 ecr 368893817], length 0
2022-04-06 23:10:11.320453 IP (tos 0x0, ttl 64, id 16748, offset 0, flags [DF], proto TCP (6), length 1048)
    127.0.0.1.9250 > 127.0.0.1.48416: Flags [P.], cksum 0x020d (incorrect -> 0x29e3), seq 159593:160589, ack 943, win 512, options [nop,nop,TS val 368893823 ecr 368893817], length 996
2022-04-06 23:10:11.320458 IP (tos 0x0, ttl 64, id 2065, offset 0, flags [DF], proto TCP (6), length 52)
    127.0.0.1.48416 > 127.0.0.1.9250: Flags [.], cksum 0xfe28 (incorrect -> 0xc584), seq 943, ack 160589, win 504, options [nop,nop,TS val 368893823 ecr 368893823], length 0
2022-04-06 23:10:11.327435 IP (tos 0x0, ttl 64, id 16749, offset 0, flags [DF], proto TCP (6), length 2542)
    127.0.0.1.9250 > 127.0.0.1.48416: Flags [P.], cksum 0x07e3 (incorrect -> 0x1051), seq 160589:163079, ack 943, win 512, options [nop,nop,TS val 368893830 ecr 368893823], length 2490
2022-04-06 23:10:11.327438 IP (tos 0x0, ttl 64, id 2066, offset 0, flags [DF], proto TCP (6), length 52)
    127.0.0.1.48416 > 127.0.0.1.9250: Flags [.], cksum 0xfe28 (incorrect -> 0xbbc2), seq 943, ack 163079, win 498, options [nop,nop,TS val 368893830 ecr 368893830], length 0
2022-04-06 23:10:11.709602 IP (tos 0x0, ttl 64, id 16750, offset 0, flags [DF], proto TCP (6), length 3538)
    127.0.0.1.9250 > 127.0.0.1.48416: Flags [P.], cksum 0x0bc7 (incorrect -> 0xc85c), seq 163079:166565, ack 943, win 512, options [nop,nop,TS val 368894212 ecr 368893830], length 3486
2022-04-06 23:10:11.709608 IP (tos 0x0, ttl 64, id 2067, offset 0, flags [DF], proto TCP (6), length 52)
    127.0.0.1.48416 > 127.0.0.1.9250: Flags [.], cksum 0xfe28 (incorrect -> 0xab2c), seq 943, ack 166565, win 494, options [nop,nop,TS val 368894212 ecr 368894212], length 0
2022-04-06 23:10:11.717964 IP (tos 0x0, ttl 64, id 16751, offset 0, flags [DF], proto TCP (6), length 4036)
    127.0.0.1.9250 > 127.0.0.1.48416: Flags [P.], cksum 0x0db9 (incorrect -> 0xc7ac), seq 166565:170549, ack 943, win 512, options [nop,nop,TS val 368894220 ecr 368894212], length 3984
2022-04-06 23:10:11.717969 IP (tos 0x0, ttl 64, id 2068, offset 0, flags [DF], proto TCP (6), length 52)
    127.0.0.1.48416 > 127.0.0.1.9250: Flags [.], cksum 0xfe28 (incorrect -> 0x9b8e), seq 943, ack 170549, win 492, options [nop,nop,TS val 368894220 ecr 368894220], length 0
2022-04-06 23:10:11.718404 IP (tos 0x0, ttl 64, id 16752, offset 0, flags [DF], proto TCP (6), length 3538)
    127.0.0.1.9250 > 127.0.0.1.48416: Flags [P.], cksum 0x0bc7 (incorrect -> 0x17f9), seq 170549:174035, ack 943, win 512, options [nop,nop,TS val 368894221 ecr 368894220], length 3486
2022-04-06 23:10:11.718416 IP (tos 0x0, ttl 64, id 2069, offset 0, flags [DF], proto TCP (6), length 52)
    127.0.0.1.48416 > 127.0.0.1.9250: Flags [.], cksum 0xfe28 (incorrect -> 0x8dec), seq 943, ack 174035, win 494, options [nop,nop,TS val 368894221 ecr 368894221], length 0
2022-04-06 23:10:11.723464 IP (tos 0x0, ttl 64, id 16753, offset 0, flags [DF], proto TCP (6), length 1546)
    127.0.0.1.9250 > 127.0.0.1.48416: Flags [P.], cksum 0x03ff (incorrect -> 0x8dd4), seq 174035:175529, ack 943, win 512, options [nop,nop,TS val 368894226 ecr 368894221], length 1494
2022-04-06 23:10:11.723472 IP (tos 0x0, ttl 64, id 2070, offset 0, flags [DF], proto TCP (6), length 52)
    127.0.0.1.48416 > 127.0.0.1.9250: Flags [.], cksum 0xfe28 (incorrect -> 0x8804), seq 943, ack 175529, win 502, options [nop,nop,TS val 368894226 ecr 368894226], length 0
2022-04-06 23:10:11.737572 IP (tos 0x0, ttl 64, id 16754, offset 0, flags [DF], proto TCP (6), length 3538)
    127.0.0.1.9250 > 127.0.0.1.48416: Flags [P.], cksum 0x0bc7 (incorrect -> 0x0050), seq 175529:179015, ack 943, win 512, options [nop,nop,TS val 368894240 ecr 368894226], length 3486
2022-04-06 23:10:11.737577 IP (tos 0x0, ttl 64, id 2071, offset 0, flags [DF], proto TCP (6), length 52)
    127.0.0.1.48416 > 127.0.0.1.9250: Flags [.], cksum 0xfe28 (incorrect -> 0x7a52), seq 943, ack 179015, win 494, options [nop,nop,TS val 368894240 ecr 368894240], length 0
2022-04-06 23:10:11.897330 IP (tos 0x0, ttl 64, id 16755, offset 0, flags [DF], proto TCP (6), length 3538)
    127.0.0.1.9250 > 127.0.0.1.48416: Flags [P.], cksum 0x0bc7 (incorrect -> 0xadd3), seq 179015:182501, ack 943, win 512, options [nop,nop,TS val 368894400 ecr 368894240], length 3486
2022-04-06 23:10:11.897335 IP (tos 0x0, ttl 64, id 2072, offset 0, flags [DF], proto TCP (6), length 52)
    127.0.0.1.48416 > 127.0.0.1.9250: Flags [.], cksum 0xfe28 (incorrect -> 0x6b74), seq 943, ack 182501, win 494, options [nop,nop,TS val 368894400 ecr 368894400], length 0
2022-04-06 23:10:11.898341 IP (tos 0x0, ttl 64, id 16756, offset 0, flags [DF], proto TCP (6), length 2044)
    127.0.0.1.9250 > 127.0.0.1.48416: Flags [P.], cksum 0x05f1 (incorrect -> 0x36a9), seq 182501:184493, ack 943, win 512, options [nop,nop,TS val 368894401 ecr 368894400], length 1992
2022-04-06 23:10:11.898345 IP (tos 0x0, ttl 64, id 2073, offset 0, flags [DF], proto TCP (6), length 52)
    127.0.0.1.48416 > 127.0.0.1.9250: Flags [.], cksum 0xfe28 (incorrect -> 0x63a4), seq 943, ack 184493, win 500, options [nop,nop,TS val 368894401 ecr 368894401], length 0
2022-04-06 23:10:11.906553 IP (tos 0x0, ttl 64, id 16757, offset 0, flags [DF], proto TCP (6), length 2044)
    127.0.0.1.9250 > 127.0.0.1.48416: Flags [P.], cksum 0x05f1 (incorrect -> 0x4ecd), seq 184493:186485, ack 943, win 512, options [nop,nop,TS val 368894409 ecr 368894401], length 1992
2022-04-06 23:10:11.906564 IP (tos 0x0, ttl 64, id 2074, offset 0, flags [DF], proto TCP (6), length 52)
    127.0.0.1.48416 > 127.0.0.1.9250: Flags [.], cksum 0xfe28 (incorrect -> 0x5bcc), seq 943, ack 186485, win 500, options [nop,nop,TS val 368894409 ecr 368894409], length 0
2022-04-06 23:10:11.906602 IP (tos 0x0, ttl 64, id 16758, offset 0, flags [DF], proto TCP (6), length 3538)
    127.0.0.1.9250 > 127.0.0.1.48416: Flags [P.], cksum 0x0bc7 (incorrect -> 0x6018), seq 186485:189971, ack 943, win 512, options [nop,nop,TS val 368894409 ecr 368894409], length 3486
2022-04-06 23:10:11.946647 IP (tos 0x0, ttl 64, id 2075, offset 0, flags [DF], proto TCP (6), length 52)
    127.0.0.1.48416 > 127.0.0.1.9250: Flags [.], cksum 0xfe28 (incorrect -> 0x4dfa), seq 943, ack 189971, win 512, options [nop,nop,TS val 368894449 ecr 368894409], length 0
2022-04-06 23:10:11.946654 IP (tos 0x0, ttl 64, id 16759, offset 0, flags [DF], proto TCP (6), length 5032)
    127.0.0.1.9250 > 127.0.0.1.48416: Flags [P.], cksum 0x119d (incorrect -> 0x8bc3), seq 189971:194951, ack 943, win 512, options [nop,nop,TS val 368894449 ecr 368894449], length 4980
2022-04-06 23:10:11.990654 IP (tos 0x0, ttl 64, id 2076, offset 0, flags [DF], proto TCP (6), length 52)
    127.0.0.1.48416 > 127.0.0.1.9250: Flags [.], cksum 0xfe28 (incorrect -> 0x3a32), seq 943, ack 194951, win 512, options [nop,nop,TS val 368894493 ecr 368894449], length 0
2022-04-06 23:10:12.275185 IP (tos 0x0, ttl 64, id 16760, offset 0, flags [DF], proto TCP (6), length 4100)
    127.0.0.1.9250 > 127.0.0.1.48416: Flags [P.], cksum 0x0df9 (incorrect -> 0x593e), seq 194951:198999, ack 943, win 512, options [nop,nop,TS val 368894778 ecr 368894493], length 4048
2022-04-06 23:10:12.275191 IP (tos 0x0, ttl 64, id 2077, offset 0, flags [DF], proto TCP (6), length 52)
    127.0.0.1.48416 > 127.0.0.1.9250: Flags [.], cksum 0xfe28 (incorrect -> 0x2810), seq 943, ack 198999, win 492, options [nop,nop,TS val 368894778 ecr 368894778], length 0
2022-04-06 23:10:12.275197 IP (tos 0x0, ttl 64, id 16761, offset 0, flags [DF], proto TCP (6), length 3474)
    127.0.0.1.9250 > 127.0.0.1.48416: Flags [P.], cksum 0x0b87 (incorrect -> 0x8102), seq 198999:202421, ack 943, win 512, options [nop,nop,TS val 368894778 ecr 368894778], length 3422
2022-04-06 23:10:12.275200 IP (tos 0x0, ttl 64, id 2078, offset 0, flags [DF], proto TCP (6), length 52)
    127.0.0.1.48416 > 127.0.0.1.9250: Flags [.], cksum 0xfe28 (incorrect -> 0x1ac0), seq 943, ack 202421, win 478, options [nop,nop,TS val 368894778 ecr 368894778], length 0
2022-04-06 23:10:12.275215 IP (tos 0x0, ttl 64, id 16762, offset 0, flags [DF], proto TCP (6), length 550)
    127.0.0.1.9250 > 127.0.0.1.48416: Flags [P.], cksum 0x001b (incorrect -> 0x3cf5), seq 202421:202919, ack 943, win 512, options [nop,nop,TS val 368894778 ecr 368894778], length 498
2022-04-06 23:10:12.275217 IP (tos 0x0, ttl 64, id 2079, offset 0, flags [DF], proto TCP (6), length 52)
    127.0.0.1.48416 > 127.0.0.1.9250: Flags [.], cksum 0xfe28 (incorrect -> 0x18d0), seq 943, ack 202919, win 476, options [nop,nop,TS val 368894778 ecr 368894778], length 0
2022-04-06 23:10:12.275389 IP (tos 0x0, ttl 64, id 16763, offset 0, flags [DF], proto TCP (6), length 3538)
    127.0.0.1.9250 > 127.0.0.1.48416: Flags [P.], cksum 0x0bc7 (incorrect -> 0xf349), seq 202919:206405, ack 943, win 512, options [nop,nop,TS val 368894778 ecr 368894778], length 3486
2022-04-06 23:10:12.275393 IP (tos 0x0, ttl 64, id 2080, offset 0, flags [DF], proto TCP (6), length 52)
    127.0.0.1.48416 > 127.0.0.1.9250: Flags [.], cksum 0xfe28 (incorrect -> 0x0b20), seq 943, ack 206405, win 494, options [nop,nop,TS val 368894778 ecr 368894778], length 0
2022-04-06 23:10:12.290223 IP (tos 0x0, ttl 64, id 16764, offset 0, flags [DF], proto TCP (6), length 1048)
    127.0.0.1.9250 > 127.0.0.1.48416: Flags [P.], cksum 0x020d (incorrect -> 0xf899), seq 206405:207401, ack 943, win 512, options [nop,nop,TS val 368894793 ecr 368894778], length 996
2022-04-06 23:10:12.290227 IP (tos 0x0, ttl 64, id 2081, offset 0, flags [DF], proto TCP (6), length 52)
    127.0.0.1.48416 > 127.0.0.1.9250: Flags [.], cksum 0xfe28 (incorrect -> 0x0714), seq 943, ack 207401, win 504, options [nop,nop,TS val 368894793 ecr 368894793], length 0
2022-04-06 23:10:12.301879 IP (tos 0x0, ttl 64, id 16765, offset 0, flags [DF], proto TCP (6), length 1048)
    127.0.0.1.9250 > 127.0.0.1.48416: Flags [P.], cksum 0x020d (incorrect -> 0x7b51), seq 207401:208397, ack 943, win 512, options [nop,nop,TS val 368894804 ecr 368894793], length 996
2022-04-06 23:10:12.301883 IP (tos 0x0, ttl 64, id 2082, offset 0, flags [DF], proto TCP (6), length 52)
    127.0.0.1.48416 > 127.0.0.1.9250: Flags [.], cksum 0xfe28 (incorrect -> 0x031a), seq 943, ack 208397, win 504, options [nop,nop,TS val 368894804 ecr 368894804], length 0
2022-04-06 23:10:12.304183 IP (tos 0x0, ttl 64, id 16766, offset 0, flags [DF], proto TCP (6), length 2542)
    127.0.0.1.9250 > 127.0.0.1.48416: Flags [P.], cksum 0x07e3 (incorrect -> 0xc83a), seq 208397:210887, ack 943, win 512, options [nop,nop,TS val 368894807 ecr 368894804], length 2490
2022-04-06 23:10:12.346661 IP (tos 0x0, ttl 64, id 2083, offset 0, flags [DF], proto TCP (6), length 52)
    127.0.0.1.48416 > 127.0.0.1.9250: Flags [.], cksum 0xfe28 (incorrect -> 0xf927), seq 943, ack 210887, win 512, options [nop,nop,TS val 368894849 ecr 368894807], length 0
2022-04-06 23:10:12.614326 IP (tos 0x0, ttl 64, id 16767, offset 0, flags [DF], proto TCP (6), length 3538)
    127.0.0.1.9250 > 127.0.0.1.48416: Flags [P.], cksum 0x0bc7 (incorrect -> 0x19ad), seq 210887:214373, ack 943, win 512, options [nop,nop,TS val 368895117 ecr 368894849], length 3486
2022-04-06 23:10:12.614332 IP (tos 0x0, ttl 64, id 2084, offset 0, flags [DF], proto TCP (6), length 52)
    127.0.0.1.48416 > 127.0.0.1.9250: Flags [.], cksum 0xfe28 (incorrect -> 0xe959), seq 943, ack 214373, win 494, options [nop,nop,TS val 368895117 ecr 368895117], length 0
2022-04-06 23:10:12.621941 IP (tos 0x0, ttl 64, id 16768, offset 0, flags [DF], proto TCP (6), length 4036)
    127.0.0.1.9250 > 127.0.0.1.48416: Flags [P.], cksum 0x0db9 (incorrect -> 0xb12a), seq 214373:218357, ack 943, win 512, options [nop,nop,TS val 368895124 ecr 368895117], length 3984
2022-04-06 23:10:12.621945 IP (tos 0x0, ttl 64, id 2085, offset 0, flags [DF], proto TCP (6), length 52)
    127.0.0.1.48416 > 127.0.0.1.9250: Flags [.], cksum 0xfe28 (incorrect -> 0xd9bd), seq 943, ack 218357, win 492, options [nop,nop,TS val 368895124 ecr 368895124], length 0
2022-04-06 23:10:12.628271 IP (tos 0x0, ttl 64, id 16769, offset 0, flags [DF], proto TCP (6), length 4036)
    127.0.0.1.9250 > 127.0.0.1.48416: Flags [P.], cksum 0x0db9 (incorrect -> 0x2605), seq 218357:222341, ack 943, win 512, options [nop,nop,TS val 368895131 ecr 368895124], length 3984
2022-04-06 23:10:12.628275 IP (tos 0x0, ttl 64, id 2086, offset 0, flags [DF], proto TCP (6), length 52)
    127.0.0.1.48416 > 127.0.0.1.9250: Flags [.], cksum 0xfe28 (incorrect -> 0xca1f), seq 943, ack 222341, win 492, options [nop,nop,TS val 368895131 ecr 368895131], length 0
2022-04-06 23:10:12.642280 IP (tos 0x0, ttl 64, id 16770, offset 0, flags [DF], proto TCP (6), length 1048)
    127.0.0.1.9250 > 127.0.0.1.48416: Flags [P.], cksum 0x020d (incorrect -> 0xa593), seq 222341:223337, ack 943, win 512, options [nop,nop,TS val 368895145 ecr 368895131], length 996
2022-04-06 23:10:12.642285 IP (tos 0x0, ttl 64, id 2087, offset 0, flags [DF], proto TCP (6), length 52)
    127.0.0.1.48416 > 127.0.0.1.9250: Flags [.], cksum 0xfe28 (incorrect -> 0xc613), seq 943, ack 223337, win 504, options [nop,nop,TS val 368895145 ecr 368895145], length 0
2022-04-06 23:10:12.666450 IP (tos 0x0, ttl 64, id 16771, offset 0, flags [DF], proto TCP (6), length 3538)
    127.0.0.1.9250 > 127.0.0.1.48416: Flags [P.], cksum 0x0bc7 (incorrect -> 0x42c1), seq 223337:226823, ack 943, win 512, options [nop,nop,TS val 368895169 ecr 368895145], length 3486
2022-04-06 23:10:12.666454 IP (tos 0x0, ttl 64, id 2088, offset 0, flags [DF], proto TCP (6), length 52)
    127.0.0.1.48416 > 127.0.0.1.9250: Flags [.], cksum 0xfe28 (incorrect -> 0xb84f), seq 943, ack 226823, win 494, options [nop,nop,TS val 368895169 ecr 368895169], length 0
2022-04-06 23:10:12.922606 IP (tos 0x0, ttl 64, id 16772, offset 0, flags [DF], proto TCP (6), length 4100)
    127.0.0.1.9250 > 127.0.0.1.48416: Flags [P.], cksum 0x0df9 (incorrect -> 0x7454), seq 226823:230871, ack 943, win 512, options [nop,nop,TS val 368895425 ecr 368895169], length 4048
2022-04-06 23:10:12.922613 IP (tos 0x0, ttl 64, id 2089, offset 0, flags [DF], proto TCP (6), length 52)
    127.0.0.1.48416 > 127.0.0.1.9250: Flags [.], cksum 0xfe28 (incorrect -> 0xa681), seq 943, ack 230871, win 492, options [nop,nop,TS val 368895425 ecr 368895425], length 0
2022-04-06 23:10:12.922777 IP (tos 0x0, ttl 64, id 16773, offset 0, flags [DF], proto TCP (6), length 2976)
    127.0.0.1.9250 > 127.0.0.1.48416: Flags [P.], cksum 0x0995 (incorrect -> 0x15f6), seq 230871:233795, ack 943, win 512, options [nop,nop,TS val 368895425 ecr 368895425], length 2924
2022-04-06 23:10:12.922781 IP (tos 0x0, ttl 64, id 2090, offset 0, flags [DF], proto TCP (6), length 52)
    127.0.0.1.48416 > 127.0.0.1.9250: Flags [.], cksum 0xfe28 (incorrect -> 0x9b11), seq 943, ack 233795, win 496, options [nop,nop,TS val 368895425 ecr 368895425], length 0
2022-04-06 23:10:12.929953 IP (tos 0x0, ttl 64, id 16774, offset 0, flags [DF], proto TCP (6), length 4100)
    127.0.0.1.9250 > 127.0.0.1.48416: Flags [P.], cksum 0x0df9 (incorrect -> 0x4dd1), seq 233795:237843, ack 943, win 512, options [nop,nop,TS val 368895432 ecr 368895425], length 4048
2022-04-06 23:10:12.929958 IP (tos 0x0, ttl 64, id 2091, offset 0, flags [DF], proto TCP (6), length 52)
    127.0.0.1.48416 > 127.0.0.1.9250: Flags [.], cksum 0xfe28 (incorrect -> 0x8b37), seq 943, ack 237843, win 492, options [nop,nop,TS val 368895432 ecr 368895432], length 0
2022-04-06 23:10:12.929971 IP (tos 0x0, ttl 64, id 16775, offset 0, flags [DF], proto TCP (6), length 1482)
    127.0.0.1.9250 > 127.0.0.1.48416: Flags [P.], cksum 0x03bf (incorrect -> 0x8a35), seq 237843:239273, ack 943, win 512, options [nop,nop,TS val 368895432 ecr 368895432], length 1430
2022-04-06 23:10:12.929974 IP (tos 0x0, ttl 64, id 2092, offset 0, flags [DF], proto TCP (6), length 52)
    127.0.0.1.48416 > 127.0.0.1.9250: Flags [.], cksum 0xfe28 (incorrect -> 0x8597), seq 943, ack 239273, win 502, options [nop,nop,TS val 368895432 ecr 368895432], length 0
2022-04-06 23:10:12.936253 IP (tos 0x0, ttl 64, id 16776, offset 0, flags [DF], proto TCP (6), length 1048)
    127.0.0.1.9250 > 127.0.0.1.48416: Flags [P.], cksum 0x020d (incorrect -> 0x1624), seq 239273:240269, ack 943, win 512, options [nop,nop,TS val 368895439 ecr 368895432], length 996
2022-04-06 23:10:12.936257 IP (tos 0x0, ttl 64, id 2093, offset 0, flags [DF], proto TCP (6), length 52)
    127.0.0.1.48416 > 127.0.0.1.9250: Flags [.], cksum 0xfe28 (incorrect -> 0x81a3), seq 943, ack 240269, win 504, options [nop,nop,TS val 368895439 ecr 368895439], length 0
2022-04-06 23:10:12.962992 IP (tos 0x0, ttl 64, id 16777, offset 0, flags [DF], proto TCP (6), length 2542)
    127.0.0.1.9250 > 127.0.0.1.48416: Flags [P.], cksum 0x07e3 (incorrect -> 0x4eb6), seq 240269:242759, ack 943, win 512, options [nop,nop,TS val 368895465 ecr 368895439], length 2490
2022-04-06 23:10:12.962995 IP (tos 0x0, ttl 64, id 2094, offset 0, flags [DF], proto TCP (6), length 52)
    127.0.0.1.48416 > 127.0.0.1.9250: Flags [.], cksum 0xfe28 (incorrect -> 0x77bb), seq 943, ack 242759, win 498, options [nop,nop,TS val 368895465 ecr 368895465], length 0
2022-04-06 23:10:13.227015 IP (tos 0x0, ttl 64, id 16778, offset 0, flags [DF], proto TCP (6), length 3538)
    127.0.0.1.9250 > 127.0.0.1.48416: Flags [P.], cksum 0x0bc7 (incorrect -> 0x9ec8), seq 242759:246245, ack 943, win 512, options [nop,nop,TS val 368895729 ecr 368895465], length 3486
2022-04-06 23:10:13.227023 IP (tos 0x0, ttl 64, id 2095, offset 0, flags [DF], proto TCP (6), length 52)
    127.0.0.1.48416 > 127.0.0.1.9250: Flags [.], cksum 0xfe28 (incorrect -> 0x6811), seq 943, ack 246245, win 494, options [nop,nop,TS val 368895729 ecr 368895729], length 0
2022-04-06 23:10:13.241075 IP (tos 0x0, ttl 64, id 16779, offset 0, flags [DF], proto TCP (6), length 4036)
    127.0.0.1.9250 > 127.0.0.1.48416: Flags [P.], cksum 0x0db9 (incorrect -> 0x128b), seq 246245:250229, ack 943, win 512, options [nop,nop,TS val 368895744 ecr 368895729], length 3984
2022-04-06 23:10:13.241088 IP (tos 0x0, ttl 64, id 2096, offset 0, flags [DF], proto TCP (6), length 52)
    127.0.0.1.48416 > 127.0.0.1.9250: Flags [.], cksum 0xfe28 (incorrect -> 0x5865), seq 943, ack 250229, win 492, options [nop,nop,TS val 368895744 ecr 368895744], length 0
2022-04-06 23:10:13.259439 IP (tos 0x0, ttl 64, id 16780, offset 0, flags [DF], proto TCP (6), length 3538)
    127.0.0.1.9250 > 127.0.0.1.48416: Flags [P.], cksum 0x0bc7 (incorrect -> 0xf882), seq 250229:253715, ack 943, win 512, options [nop,nop,TS val 368895762 ecr 368895744], length 3486
2022-04-06 23:10:13.259447 IP (tos 0x0, ttl 64, id 2097, offset 0, flags [DF], proto TCP (6), length 52)
    127.0.0.1.48416 > 127.0.0.1.9250: Flags [.], cksum 0xfe28 (incorrect -> 0x4aa1), seq 943, ack 253715, win 494, options [nop,nop,TS val 368895762 ecr 368895762], length 0
2022-04-06 23:10:13.266715 IP (tos 0x0, ttl 64, id 16781, offset 0, flags [DF], proto TCP (6), length 1048)
    127.0.0.1.9250 > 127.0.0.1.48416: Flags [P.], cksum 0x020d (incorrect -> 0x2553), seq 253715:254711, ack 943, win 512, options [nop,nop,TS val 368895769 ecr 368895762], length 996
2022-04-06 23:10:13.266719 IP (tos 0x0, ttl 64, id 2098, offset 0, flags [DF], proto TCP (6), length 52)
    127.0.0.1.48416 > 127.0.0.1.9250: Flags [.], cksum 0xfe28 (incorrect -> 0x46a5), seq 943, ack 254711, win 504, options [nop,nop,TS val 368895769 ecr 368895769], length 0
2022-04-06 23:10:13.273409 IP (tos 0x0, ttl 64, id 16782, offset 0, flags [DF], proto TCP (6), length 4036)
    127.0.0.1.9250 > 127.0.0.1.48416: Flags [P.], cksum 0x0db9 (incorrect -> 0xf3ec), seq 254711:258695, ack 943, win 512, options [nop,nop,TS val 368895776 ecr 368895769], length 3984
2022-04-06 23:10:13.273413 IP (tos 0x0, ttl 64, id 2099, offset 0, flags [DF], proto TCP (6), length 52)
    127.0.0.1.48416 > 127.0.0.1.9250: Flags [.], cksum 0xfe28 (incorrect -> 0x3713), seq 943, ack 258695, win 492, options [nop,nop,TS val 368895776 ecr 368895776], length 0
2022-04-06 23:10:13.550987 IP (tos 0x0, ttl 64, id 16783, offset 0, flags [DF], proto TCP (6), length 3538)
    127.0.0.1.9250 > 127.0.0.1.48416: Flags [P.], cksum 0x0bc7 (incorrect -> 0x38db), seq 258695:262181, ack 943, win 512, options [nop,nop,TS val 368896053 ecr 368895776], length 3486
2022-04-06 23:10:13.550992 IP (tos 0x0, ttl 64, id 2100, offset 0, flags [DF], proto TCP (6), length 52)
    127.0.0.1.48416 > 127.0.0.1.9250: Flags [.], cksum 0xfe28 (incorrect -> 0x2749), seq 943, ack 262181, win 494, options [nop,nop,TS val 368896053 ecr 368896053], length 0
2022-04-06 23:10:13.554830 IP (tos 0x0, ttl 64, id 16784, offset 0, flags [DF], proto TCP (6), length 4036)
    127.0.0.1.9250 > 127.0.0.1.48416: Flags [P.], cksum 0x0db9 (incorrect -> 0x6f54), seq 262181:266165, ack 943, win 512, options [nop,nop,TS val 368896057 ecr 368896053], length 3984
2022-04-06 23:10:13.554834 IP (tos 0x0, ttl 64, id 2101, offset 0, flags [DF], proto TCP (6), length 52)
    127.0.0.1.48416 > 127.0.0.1.9250: Flags [.], cksum 0xfe28 (incorrect -> 0x17b3), seq 943, ack 266165, win 492, options [nop,nop,TS val 368896057 ecr 368896057], length 0
2022-04-06 23:10:13.564983 IP (tos 0x0, ttl 64, id 16785, offset 0, flags [DF], proto TCP (6), length 1546)
    127.0.0.1.9250 > 127.0.0.1.48416: Flags [P.], cksum 0x03ff (incorrect -> 0x3bfe), seq 266165:267659, ack 943, win 512, options [nop,nop,TS val 368896067 ecr 368896057], length 1494
2022-04-06 23:10:13.564995 IP (tos 0x0, ttl 64, id 2102, offset 0, flags [DF], proto TCP (6), length 52)
    127.0.0.1.48416 > 127.0.0.1.9250: Flags [.], cksum 0xfe28 (incorrect -> 0x11bf), seq 943, ack 267659, win 502, options [nop,nop,TS val 368896067 ecr 368896067], length 0
2022-04-06 23:10:13.571057 IP (tos 0x0, ttl 64, id 16786, offset 0, flags [DF], proto TCP (6), length 3518)
    127.0.0.1.9250 > 127.0.0.1.48416: Flags [P.], cksum 0x0bb3 (incorrect -> 0x1938), seq 267659:271125, ack 943, win 512, options [nop,nop,TS val 368896073 ecr 368896067], length 3466
2022-04-06 23:10:13.571065 IP (tos 0x0, ttl 64, id 2103, offset 0, flags [DF], proto TCP (6), length 52)
    127.0.0.1.48416 > 127.0.0.1.9250: Flags [.], cksum 0xfe28 (incorrect -> 0x0430), seq 943, ack 271125, win 494, options [nop,nop,TS val 368896074 ecr 368896073], length 0
2022-04-06 23:10:13.575348 IP (tos 0x0, ttl 64, id 16787, offset 0, flags [DF], proto TCP (6), length 1048)
    127.0.0.1.9250 > 127.0.0.1.48416: Flags [P.], cksum 0x020d (incorrect -> 0xd4ee), seq 271125:272121, ack 943, win 512, options [nop,nop,TS val 368896078 ecr 368896074], length 996
2022-04-06 23:10:13.575360 IP (tos 0x0, ttl 64, id 2104, offset 0, flags [DF], proto TCP (6), length 52)
    127.0.0.1.48416 > 127.0.0.1.9250: Flags [.], cksum 0xfe28 (incorrect -> 0x0039), seq 943, ack 272121, win 504, options [nop,nop,TS val 368896078 ecr 368896078], length 0
2022-04-06 23:10:13.578860 IP (tos 0x0, ttl 64, id 16788, offset 0, flags [DF], proto TCP (6), length 2562)
    127.0.0.1.9250 > 127.0.0.1.48416: Flags [P.], cksum 0x07f7 (incorrect -> 0x4fb1), seq 272121:274631, ack 943, win 512, options [nop,nop,TS val 368896081 ecr 368896078], length 2510
2022-04-06 23:10:13.578867 IP (tos 0x0, ttl 64, id 2105, offset 0, flags [DF], proto TCP (6), length 52)
    127.0.0.1.48416 > 127.0.0.1.9250: Flags [.], cksum 0xfe28 (incorrect -> 0xf66a), seq 943, ack 274631, win 498, options [nop,nop,TS val 368896081 ecr 368896081], length 0
2022-04-06 23:10:13.747188 IP (tos 0x0, ttl 64, id 16789, offset 0, flags [DF], proto TCP (6), length 3538)
    127.0.0.1.9250 > 127.0.0.1.48416: Flags [P.], cksum 0x0bc7 (incorrect -> 0x6eac), seq 274631:278117, ack 943, win 512, options [nop,nop,TS val 368896250 ecr 368896081], length 3486
2022-04-06 23:10:13.747193 IP (tos 0x0, ttl 64, id 2106, offset 0, flags [DF], proto TCP (6), length 52)
    127.0.0.1.48416 > 127.0.0.1.9250: Flags [.], cksum 0xfe28 (incorrect -> 0xe77e), seq 943, ack 278117, win 494, options [nop,nop,TS val 368896250 ecr 368896250], length 0
2022-04-06 23:10:13.761842 IP (tos 0x0, ttl 64, id 16790, offset 0, flags [DF], proto TCP (6), length 4036)
    127.0.0.1.9250 > 127.0.0.1.48416: Flags [P.], cksum 0x0db9 (incorrect -> 0xa8ff), seq 278117:282101, ack 943, win 512, options [nop,nop,TS val 368896264 ecr 368896250], length 3984
2022-04-06 23:10:13.761983 IP (tos 0x0, ttl 64, id 2107, offset 0, flags [DF], proto TCP (6), length 52)
    127.0.0.1.48416 > 127.0.0.1.9250: Flags [.], cksum 0xfe28 (incorrect -> 0xd7c0), seq 943, ack 282101, win 512, options [nop,nop,TS val 368896264 ecr 368896264], length 0
2022-04-06 23:10:13.776034 IP (tos 0x0, ttl 64, id 16791, offset 0, flags [DF], proto TCP (6), length 4036)
    127.0.0.1.9250 > 127.0.0.1.48416: Flags [P.], cksum 0x0db9 (incorrect -> 0xee59), seq 282101:286085, ack 943, win 512, options [nop,nop,TS val 368896278 ecr 368896264], length 3984
2022-04-06 23:10:13.818655 IP (tos 0x0, ttl 64, id 2108, offset 0, flags [DF], proto TCP (6), length 52)
    127.0.0.1.48416 > 127.0.0.1.9250: Flags [.], cksum 0xfe28 (incorrect -> 0xc7e9), seq 943, ack 286085, win 512, options [nop,nop,TS val 368896321 ecr 368896278], length 0
2022-04-06 23:10:13.818662 IP (tos 0x0, ttl 64, id 16792, offset 0, flags [DF], proto TCP (6), length 4534)
    127.0.0.1.9250 > 127.0.0.1.48416: Flags [P.], cksum 0x0fab (incorrect -> 0xc960), seq 286085:290567, ack 943, win 512, options [nop,nop,TS val 368896321 ecr 368896321], length 4482
2022-04-06 23:10:13.862654 IP (tos 0x0, ttl 64, id 2109, offset 0, flags [DF], proto TCP (6), length 52)
    127.0.0.1.48416 > 127.0.0.1.9250: Flags [.], cksum 0xfe28 (incorrect -> 0xb610), seq 943, ack 290567, win 512, options [nop,nop,TS val 368896365 ecr 368896321], length 0
2022-04-06 23:10:13.862664 IP (tos 0x0, ttl 64, id 16793, offset 0, flags [DF], proto TCP (6), length 15988)
    127.0.0.1.9250 > 127.0.0.1.48416: Flags [P.], cksum 0x3c69 (incorrect -> 0x8dc9), seq 290567:306503, ack 943, win 512, options [nop,nop,TS val 368896365 ecr 368896365], length 15936
2022-04-06 23:10:13.906647 IP (tos 0x0, ttl 64, id 2110, offset 0, flags [DF], proto TCP (6), length 52)
    127.0.0.1.48416 > 127.0.0.1.9250: Flags [.], cksum 0xfe28 (incorrect -> 0x7778), seq 943, ack 306503, win 512, options [nop,nop,TS val 368896409 ecr 368896365], length 0
2022-04-06 23:10:13.962948 IP (tos 0x0, ttl 64, id 16794, offset 0, flags [DF], proto TCP (6), length 3538)
    127.0.0.1.9250 > 127.0.0.1.48416: Flags [P.], cksum 0x0bc7 (incorrect -> 0x0748), seq 306503:309989, ack 943, win 512, options [nop,nop,TS val 368896465 ecr 368896409], length 3486
2022-04-06 23:10:13.963008 IP (tos 0x0, ttl 64, id 2111, offset 0, flags [DF], proto TCP (6), length 52)
    127.0.0.1.48416 > 127.0.0.1.9250: Flags [.], cksum 0xfe28 (incorrect -> 0x693e), seq 943, ack 309989, win 512, options [nop,nop,TS val 368896465 ecr 368896465], length 0
2022-04-06 23:10:13.968647 IP (tos 0x0, ttl 64, id 16795, offset 0, flags [DF], proto TCP (6), length 4036)
    127.0.0.1.9250 > 127.0.0.1.48416: Flags [P.], cksum 0x0db9 (incorrect -> 0x1d9c), seq 309989:313973, ack 943, win 512, options [nop,nop,TS val 368896471 ecr 368896465], length 3984
2022-04-06 23:10:13.968939 IP (tos 0x0, ttl 64, id 2112, offset 0, flags [DF], proto TCP (6), length 52)
    127.0.0.1.48416 > 127.0.0.1.9250: Flags [.], cksum 0xfe28 (incorrect -> 0x59a2), seq 943, ack 313973, win 512, options [nop,nop,TS val 368896471 ecr 368896471], length 0
2022-04-06 23:10:13.968983 IP (tos 0x0, ttl 64, id 16796, offset 0, flags [DF], proto TCP (6), length 3538)
    127.0.0.1.9250 > 127.0.0.1.48416: Flags [P.], cksum 0x0bc7 (incorrect -> 0x32f1), seq 313973:317459, ack 943, win 512, options [nop,nop,TS val 368896471 ecr 368896471], length 3486
2022-04-06 23:10:13.968992 IP (tos 0x0, ttl 64, id 2113, offset 0, flags [DF], proto TCP (6), length 52)
    127.0.0.1.48416 > 127.0.0.1.9250: Flags [.], cksum 0xfe28 (incorrect -> 0x4c04), seq 943, ack 317459, win 512, options [nop,nop,TS val 368896471 ecr 368896471], length 0
2022-04-06 23:10:13.976942 IP (tos 0x0, ttl 64, id 16797, offset 0, flags [DF], proto TCP (6), length 4036)
    127.0.0.1.9250 > 127.0.0.1.48416: Flags [P.], cksum 0x0db9 (incorrect -> 0x8a30), seq 317459:321443, ack 943, win 512, options [nop,nop,TS val 368896479 ecr 368896471], length 3984
2022-04-06 23:10:13.977049 IP (tos 0x0, ttl 64, id 2114, offset 0, flags [DF], proto TCP (6), length 52)
    127.0.0.1.48416 > 127.0.0.1.9250: Flags [.], cksum 0xfe28 (incorrect -> 0x3c64), seq 943, ack 321443, win 512, options [nop,nop,TS val 368896479 ecr 368896479], length 0
2022-04-06 23:10:13.990907 IP (tos 0x0, ttl 64, id 16798, offset 0, flags [DF], proto TCP (6), length 1048)
    127.0.0.1.9250 > 127.0.0.1.48416: Flags [P.], cksum 0x020d (incorrect -> 0x3a22), seq 321443:322439, ack 943, win 512, options [nop,nop,TS val 368896493 ecr 368896479], length 996
2022-04-06 23:10:13.991008 IP (tos 0x0, ttl 64, id 2115, offset 0, flags [DF], proto TCP (6), length 52)
    127.0.0.1.48416 > 127.0.0.1.9250: Flags [.], cksum 0xfe28 (incorrect -> 0x3864), seq 943, ack 322439, win 512, options [nop,nop,TS val 368896493 ecr 368896493], length 0
2022-04-06 23:10:14.002817 IP (tos 0x0, ttl 64, id 16799, offset 0, flags [DF], proto TCP (6), length 3538)
    127.0.0.1.9250 > 127.0.0.1.48416: Flags [P.], cksum 0x0bc7 (incorrect -> 0xd94c), seq 322439:325925, ack 943, win 512, options [nop,nop,TS val 368896505 ecr 368896493], length 3486
2022-04-06 23:10:14.002848 IP (tos 0x0, ttl 64, id 2116, offset 0, flags [DF], proto TCP (6), length 52)
    127.0.0.1.48416 > 127.0.0.1.9250: Flags [.], cksum 0xfe28 (incorrect -> 0x2aae), seq 943, ack 325925, win 512, options [nop,nop,TS val 368896505 ecr 368896505], length 0
2022-04-06 23:10:14.005013 IP (tos 0x0, ttl 64, id 16800, offset 0, flags [DF], proto TCP (6), length 4100)
    127.0.0.1.9250 > 127.0.0.1.48416: Flags [P.], cksum 0x0df9 (incorrect -> 0x85a0), seq 325925:329973, ack 943, win 512, options [nop,nop,TS val 368896507 ecr 368896505], length 4048
2022-04-06 23:10:14.005400 IP (tos 0x0, ttl 64, id 2117, offset 0, flags [DF], proto TCP (6), length 52)
    127.0.0.1.48416 > 127.0.0.1.9250: Flags [.], cksum 0xfe28 (incorrect -> 0x1ad9), seq 943, ack 329973, win 512, options [nop,nop,TS val 368896508 ecr 368896507], length 0
2022-04-06 23:10:14.005412 IP (tos 0x0, ttl 64, id 16801, offset 0, flags [DF], proto TCP (6), length 486)
    127.0.0.1.9250 > 127.0.0.1.48416: Flags [P.], cksum 0xffda (incorrect -> 0x03bd), seq 329973:330407, ack 943, win 512, options [nop,nop,TS val 368896508 ecr 368896508], length 434
2022-04-06 23:10:14.005419 IP (tos 0x0, ttl 64, id 2118, offset 0, flags [DF], proto TCP (6), length 52)
    127.0.0.1.48416 > 127.0.0.1.9250: Flags [.], cksum 0xfe28 (incorrect -> 0x1926), seq 943, ack 330407, win 512, options [nop,nop,TS val 368896508 ecr 368896508], length 0
2022-04-06 23:10:14.015837 IP (tos 0x0, ttl 64, id 16802, offset 0, flags [DF], proto TCP (6), length 3538)
    127.0.0.1.9250 > 127.0.0.1.48416: Flags [P.], cksum 0x0bc7 (incorrect -> 0xb0a2), seq 330407:333893, ack 943, win 512, options [nop,nop,TS val 368896518 ecr 368896508], length 3486
2022-04-06 23:10:14.015860 IP (tos 0x0, ttl 64, id 2119, offset 0, flags [DF], proto TCP (6), length 52)
    127.0.0.1.48416 > 127.0.0.1.9250: Flags [.], cksum 0xfe28 (incorrect -> 0x0b74), seq 943, ack 333893, win 512, options [nop,nop,TS val 368896518 ecr 368896518], length 0
2022-04-06 23:10:14.018906 IP (tos 0x0, ttl 64, id 16803, offset 0, flags [DF], proto TCP (6), length 1048)
    127.0.0.1.9250 > 127.0.0.1.48416: Flags [P.], cksum 0x020d (incorrect -> 0x3a83), seq 333893:334889, ack 943, win 512, options [nop,nop,TS val 368896521 ecr 368896518], length 996
2022-04-06 23:10:14.018916 IP (tos 0x0, ttl 64, id 2120, offset 0, flags [DF], proto TCP (6), length 52)
    127.0.0.1.48416 > 127.0.0.1.9250: Flags [.], cksum 0xfe28 (incorrect -> 0x078a), seq 943, ack 334889, win 512, options [nop,nop,TS val 368896521 ecr 368896521], length 0
2022-04-06 23:10:14.037227 IP (tos 0x0, ttl 64, id 16804, offset 0, flags [DF], proto TCP (6), length 3538)
    127.0.0.1.9250 > 127.0.0.1.48416: Flags [P.], cksum 0x0bc7 (incorrect -> 0x1870), seq 334889:338375, ack 943, win 512, options [nop,nop,TS val 368896540 ecr 368896521], length 3486
2022-04-06 23:10:14.037382 IP (tos 0x0, ttl 64, id 2121, offset 0, flags [DF], proto TCP (6), length 52)
    127.0.0.1.48416 > 127.0.0.1.9250: Flags [.], cksum 0xfe28 (incorrect -> 0xf9c5), seq 943, ack 338375, win 512, options [nop,nop,TS val 368896540 ecr 368896540], length 0
2022-04-06 23:10:14.056438 IP (tos 0x0, ttl 64, id 16805, offset 0, flags [DF], proto TCP (6), length 3538)
    127.0.0.1.9250 > 127.0.0.1.48416: Flags [P.], cksum 0x0bc7 (incorrect -> 0x3e4b), seq 338375:341861, ack 943, win 512, options [nop,nop,TS val 368896559 ecr 368896540], length 3486
2022-04-06 23:10:14.098650 IP (tos 0x0, ttl 64, id 2122, offset 0, flags [DF], proto TCP (6), length 52)
    127.0.0.1.48416 > 127.0.0.1.9250: Flags [.], cksum 0xfe28 (incorrect -> 0xebd7), seq 943, ack 341861, win 512, options [nop,nop,TS val 368896601 ecr 368896559], length 0
2022-04-06 23:10:14.098659 IP (tos 0x0, ttl 64, id 16806, offset 0, flags [DF], proto TCP (6), length 12502)
    127.0.0.1.9250 > 127.0.0.1.48416: Flags [P.], cksum 0x2ecb (incorrect -> 0xc12f), seq 341861:354311, ack 943, win 512, options [nop,nop,TS val 368896601 ecr 368896601], length 12450
2022-04-06 23:10:14.142654 IP (tos 0x0, ttl 64, id 2123, offset 0, flags [DF], proto TCP (6), length 52)
    127.0.0.1.48416 > 127.0.0.1.9250: Flags [.], cksum 0xfe28 (incorrect -> 0xbadf), seq 943, ack 354311, win 512, options [nop,nop,TS val 368896645 ecr 368896601], length 0
2022-04-06 23:10:14.368690 IP (tos 0x0, ttl 64, id 16807, offset 0, flags [DF], proto TCP (6), length 3518)
    127.0.0.1.9250 > 127.0.0.1.48416: Flags [P.], cksum 0x0bb3 (incorrect -> 0xfc72), seq 354311:357777, ack 943, win 512, options [nop,nop,TS val 368896871 ecr 368896645], length 3466
2022-04-06 23:10:14.368697 IP (tos 0x0, ttl 64, id 2124, offset 0, flags [DF], proto TCP (6), length 52)
    127.0.0.1.48416 > 127.0.0.1.9250: Flags [.], cksum 0xfe28 (incorrect -> 0xab77), seq 943, ack 357777, win 494, options [nop,nop,TS val 368896871 ecr 368896871], length 0
2022-04-06 23:10:14.368782 IP (tos 0x0, ttl 64, id 16808, offset 0, flags [DF], proto TCP (6), length 4036)
    127.0.0.1.9250 > 127.0.0.1.48416: Flags [P.], cksum 0x0db9 (incorrect -> 0x5714), seq 357777:361761, ack 943, win 512, options [nop,nop,TS val 368896871 ecr 368896871], length 3984
2022-04-06 23:10:14.368785 IP (tos 0x0, ttl 64, id 2125, offset 0, flags [DF], proto TCP (6), length 52)
    127.0.0.1.48416 > 127.0.0.1.9250: Flags [.], cksum 0xfe28 (incorrect -> 0x9be9), seq 943, ack 361761, win 492, options [nop,nop,TS val 368896871 ecr 368896871], length 0
2022-04-06 23:10:14.368870 IP (tos 0x0, ttl 64, id 16809, offset 0, flags [DF], proto TCP (6), length 4036)
    127.0.0.1.9250 > 127.0.0.1.48416: Flags [P.], cksum 0x0db9 (incorrect -> 0xfe56), seq 361761:365745, ack 943, win 512, options [nop,nop,TS val 368896871 ecr 368896871], length 3984
2022-04-06 23:10:14.410656 IP (tos 0x0, ttl 64, id 2126, offset 0, flags [DF], proto TCP (6), length 52)
    127.0.0.1.48416 > 127.0.0.1.9250: Flags [.], cksum 0xfe28 (incorrect -> 0x8c1b), seq 943, ack 365745, win 512, options [nop,nop,TS val 368896913 ecr 368896871], length 0
2022-04-06 23:10:14.410662 IP (tos 0x0, ttl 64, id 16810, offset 0, flags [DF], proto TCP (6), length 3538)
    127.0.0.1.9250 > 127.0.0.1.48416: Flags [P.], cksum 0x0bc7 (incorrect -> 0xe252), seq 365745:369231, ack 943, win 512, options [nop,nop,TS val 368896913 ecr 368896913], length 3486
2022-04-06 23:10:14.410674 IP (tos 0x0, ttl 64, id 2127, offset 0, flags [DF], proto TCP (6), length 52)
    127.0.0.1.48416 > 127.0.0.1.9250: Flags [.], cksum 0xfe28 (incorrect -> 0x7e53), seq 943, ack 369231, win 512, options [nop,nop,TS val 368896913 ecr 368896913], length 0
2022-04-06 23:10:14.447436 IP (tos 0x0, ttl 64, id 16811, offset 0, flags [DF], proto TCP (6), length 1068)
    127.0.0.1.9250 > 127.0.0.1.48416: Flags [P.], cksum 0x0221 (incorrect -> 0x2b45), seq 369231:370247, ack 943, win 512, options [nop,nop,TS val 368896950 ecr 368896913], length 1016
2022-04-06 23:10:14.447446 IP (tos 0x0, ttl 64, id 2128, offset 0, flags [DF], proto TCP (6), length 52)
    127.0.0.1.48416 > 127.0.0.1.9250: Flags [.], cksum 0xfe28 (incorrect -> 0x7a11), seq 943, ack 370247, win 512, options [nop,nop,TS val 368896950 ecr 368896950], length 0
2022-04-06 23:10:14.590064 IP (tos 0x0, ttl 64, id 16812, offset 0, flags [DF], proto TCP (6), length 3538)
    127.0.0.1.9250 > 127.0.0.1.48416: Flags [P.], cksum 0x0bc7 (incorrect -> 0x9f77), seq 370247:373733, ack 943, win 512, options [nop,nop,TS val 368897093 ecr 368896950], length 3486
2022-04-06 23:10:14.590193 IP (tos 0x0, ttl 64, id 2129, offset 0, flags [DF], proto TCP (6), length 52)
    127.0.0.1.48416 > 127.0.0.1.9250: Flags [.], cksum 0xfe28 (incorrect -> 0x6b55), seq 943, ack 373733, win 512, options [nop,nop,TS val 368897093 ecr 368897093], length 0
2022-04-06 23:10:14.590345 IP (tos 0x0, ttl 64, id 16813, offset 0, flags [DF], proto TCP (6), length 1048)
    127.0.0.1.9250 > 127.0.0.1.48416: Flags [P.], cksum 0x020d (incorrect -> 0xcb1b), seq 373733:374729, ack 943, win 512, options [nop,nop,TS val 368897093 ecr 368897093], length 996
2022-04-06 23:10:14.590378 IP (tos 0x0, ttl 64, id 2130, offset 0, flags [DF], proto TCP (6), length 52)
    127.0.0.1.48416 > 127.0.0.1.9250: Flags [.], cksum 0xfe28 (incorrect -> 0x6771), seq 943, ack 374729, win 512, options [nop,nop,TS val 368897093 ecr 368897093], length 0
2022-04-06 23:10:14.594452 IP (tos 0x0, ttl 64, id 16814, offset 0, flags [DF], proto TCP (6), length 4100)
    127.0.0.1.9250 > 127.0.0.1.48416: Flags [P.], cksum 0x0df9 (incorrect -> 0x4104), seq 374729:378777, ack 943, win 512, options [nop,nop,TS val 368897097 ecr 368897093], length 4048
2022-04-06 23:10:14.634652 IP (tos 0x0, ttl 64, id 2131, offset 0, flags [DF], proto TCP (6), length 52)
    127.0.0.1.48416 > 127.0.0.1.9250: Flags [.], cksum 0xfe28 (incorrect -> 0x5771), seq 943, ack 378777, win 512, options [nop,nop,TS val 368897137 ecr 368897097], length 0
2022-04-06 23:10:14.634659 IP (tos 0x0, ttl 64, id 16815, offset 0, flags [DF], proto TCP (6), length 7458)
    127.0.0.1.9250 > 127.0.0.1.48416: Flags [P.], cksum 0x1b17 (incorrect -> 0xa327), seq 378777:386183, ack 943, win 512, options [nop,nop,TS val 368897137 ecr 368897137], length 7406
2022-04-06 23:10:14.678647 IP (tos 0x0, ttl 64, id 2132, offset 0, flags [DF], proto TCP (6), length 52)
    127.0.0.1.48416 > 127.0.0.1.9250: Flags [.], cksum 0xfe28 (incorrect -> 0x3a2f), seq 943, ack 386183, win 512, options [nop,nop,TS val 368897181 ecr 368897137], length 0
2022-04-06 23:10:14.785252 IP (tos 0x0, ttl 64, id 16816, offset 0, flags [DF], proto TCP (6), length 3538)
    127.0.0.1.9250 > 127.0.0.1.48416: Flags [P.], cksum 0x0bc7 (incorrect -> 0xb501), seq 386183:389669, ack 943, win 512, options [nop,nop,TS val 368897288 ecr 368897181], length 3486
2022-04-06 23:10:14.785384 IP (tos 0x0, ttl 64, id 2133, offset 0, flags [DF], proto TCP (6), length 52)
    127.0.0.1.48416 > 127.0.0.1.9250: Flags [.], cksum 0xfe28 (incorrect -> 0x2b8f), seq 943, ack 389669, win 512, options [nop,nop,TS val 368897288 ecr 368897288], length 0
2022-04-06 23:10:14.785481 IP (tos 0x0, ttl 64, id 16817, offset 0, flags [DF], proto TCP (6), length 4036)
    127.0.0.1.9250 > 127.0.0.1.48416: Flags [P.], cksum 0x0db9 (incorrect -> 0xf2ec), seq 389669:393653, ack 943, win 512, options [nop,nop,TS val 368897288 ecr 368897288], length 3984
2022-04-06 23:10:14.785496 IP (tos 0x0, ttl 64, id 2134, offset 0, flags [DF], proto TCP (6), length 52)
    127.0.0.1.48416 > 127.0.0.1.9250: Flags [.], cksum 0xfe28 (incorrect -> 0x1bff), seq 943, ack 393653, win 512, options [nop,nop,TS val 368897288 ecr 368897288], length 0
2022-04-06 23:10:14.793379 IP (tos 0x0, ttl 64, id 16818, offset 0, flags [DF], proto TCP (6), length 4036)
    127.0.0.1.9250 > 127.0.0.1.48416: Flags [P.], cksum 0x0db9 (incorrect -> 0xc9d5), seq 393653:397637, ack 943, win 512, options [nop,nop,TS val 368897296 ecr 368897288], length 3984
2022-04-06 23:10:14.834656 IP (tos 0x0, ttl 64, id 2135, offset 0, flags [DF], proto TCP (6), length 52)
    127.0.0.1.48416 > 127.0.0.1.9250: Flags [.], cksum 0xfe28 (incorrect -> 0x0c36), seq 943, ack 397637, win 512, options [nop,nop,TS val 368897337 ecr 368897296], length 0
2022-04-06 23:10:14.834662 IP (tos 0x0, ttl 64, id 16819, offset 0, flags [DF], proto TCP (6), length 4534)
    127.0.0.1.9250 > 127.0.0.1.48416: Flags [P.], cksum 0x0fab (incorrect -> 0xa3bd), seq 397637:402119, ack 943, win 512, options [nop,nop,TS val 368897337 ecr 368897337], length 4482
2022-04-06 23:10:14.878652 IP (tos 0x0, ttl 64, id 2136, offset 0, flags [DF], proto TCP (6), length 52)
    127.0.0.1.48416 > 127.0.0.1.9250: Flags [.], cksum 0xfe28 (incorrect -> 0xfa5e), seq 943, ack 402119, win 512, options [nop,nop,TS val 368897381 ecr 368897337], length 0
2022-04-06 23:10:15.048968 IP (tos 0x0, ttl 64, id 16820, offset 0, flags [DF], proto TCP (6), length 3538)
    127.0.0.1.9250 > 127.0.0.1.48416: Flags [P.], cksum 0x0bc7 (incorrect -> 0x6fcc), seq 402119:405605, ack 943, win 512, options [nop,nop,TS val 368897551 ecr 368897381], length 3486
2022-04-06 23:10:15.048974 IP (tos 0x0, ttl 64, id 2137, offset 0, flags [DF], proto TCP (6), length 52)
    127.0.0.1.48416 > 127.0.0.1.9250: Flags [.], cksum 0xfe28 (incorrect -> 0xeb52), seq 943, ack 405605, win 494, options [nop,nop,TS val 368897551 ecr 368897551], length 0
2022-04-06 23:10:15.051024 IP (tos 0x0, ttl 64, id 16821, offset 0, flags [DF], proto TCP (6), length 2542)
    127.0.0.1.9250 > 127.0.0.1.48416: Flags [P.], cksum 0x07e3 (incorrect -> 0xdb5f), seq 405605:408095, ack 943, win 512, options [nop,nop,TS val 368897553 ecr 368897551], length 2490
2022-04-06 23:10:15.051028 IP (tos 0x0, ttl 64, id 2138, offset 0, flags [DF], proto TCP (6), length 52)
    127.0.0.1.48416 > 127.0.0.1.9250: Flags [.], cksum 0xfe28 (incorrect -> 0xe190), seq 943, ack 408095, win 498, options [nop,nop,TS val 368897553 ecr 368897553], length 0
2022-04-06 23:10:15.052230 IP (tos 0x0, ttl 64, id 16822, offset 0, flags [DF], proto TCP (6), length 1048)
    127.0.0.1.9250 > 127.0.0.1.48416: Flags [P.], cksum 0x020d (incorrect -> 0x1f17), seq 408095:409091, ack 943, win 512, options [nop,nop,TS val 368897555 ecr 368897553], length 996
2022-04-06 23:10:15.052234 IP (tos 0x0, ttl 64, id 2139, offset 0, flags [DF], proto TCP (6), length 52)
    127.0.0.1.48416 > 127.0.0.1.9250: Flags [.], cksum 0xfe28 (incorrect -> 0xdda2), seq 943, ack 409091, win 504, options [nop,nop,TS val 368897555 ecr 368897555], length 0
2022-04-06 23:10:15.052776 IP (tos 0x0, ttl 64, id 16823, offset 0, flags [DF], proto TCP (6), length 3538)
    127.0.0.1.9250 > 127.0.0.1.48416: Flags [P.], cksum 0x0bc7 (incorrect -> 0x7875), seq 409091:412577, ack 943, win 512, options [nop,nop,TS val 368897555 ecr 368897555], length 3486
2022-04-06 23:10:15.052780 IP (tos 0x0, ttl 64, id 2140, offset 0, flags [DF], proto TCP (6), length 52)
    127.0.0.1.48416 > 127.0.0.1.9250: Flags [.], cksum 0xfe28 (incorrect -> 0xd00e), seq 943, ack 412577, win 494, options [nop,nop,TS val 368897555 ecr 368897555], length 0
2022-04-06 23:10:15.063405 IP (tos 0x0, ttl 64, id 16824, offset 0, flags [DF], proto TCP (6), length 3040)
    127.0.0.1.9250 > 127.0.0.1.48416: Flags [P.], cksum 0x09d5 (incorrect -> 0x5eec), seq 412577:415565, ack 943, win 512, options [nop,nop,TS val 368897566 ecr 368897555], length 2988
2022-04-06 23:10:15.063411 IP (tos 0x0, ttl 64, id 2141, offset 0, flags [DF], proto TCP (6), length 52)
    127.0.0.1.48416 > 127.0.0.1.9250: Flags [.], cksum 0xfe28 (incorrect -> 0xc44a), seq 943, ack 415565, win 496, options [nop,nop,TS val 368897566 ecr 368897566], length 0
2022-04-06 23:10:15.077503 IP (tos 0x0, ttl 64, id 16825, offset 0, flags [DF], proto TCP (6), length 2542)
    127.0.0.1.9250 > 127.0.0.1.48416: Flags [P.], cksum 0x07e3 (incorrect -> 0xbdf3), seq 415565:418055, ack 943, win 512, options [nop,nop,TS val 368897580 ecr 368897566], length 2490
2022-04-06 23:10:15.077506 IP (tos 0x0, ttl 64, id 2142, offset 0, flags [DF], proto TCP (6), length 52)
    127.0.0.1.48416 > 127.0.0.1.9250: Flags [.], cksum 0xfe28 (incorrect -> 0xba72), seq 943, ack 418055, win 498, options [nop,nop,TS val 368897580 ecr 368897580], length 0
200, 5.425824880599976, 14.94868803024292