2022-04-06 09:37:34.392901 IP (tos 0x0, ttl 64, id 2452, offset 0, flags [DF], proto TCP (6), length 60)
    127.0.0.1.54122 > 127.0.0.1.12050: Flags [S], cksum 0xfe30 (incorrect -> 0x61a4), seq 23064749, win 65495, options [mss 65495,sackOK,TS val 320136895 ecr 0,nop,wscale 7], length 0
2022-04-06 09:37:34.392914 IP (tos 0x0, ttl 64, id 0, offset 0, flags [DF], proto TCP (6), length 60)
    127.0.0.1.12050 > 127.0.0.1.54122: Flags [S.], cksum 0xfe30 (incorrect -> 0x71ac), seq 3502450011, ack 23064750, win 65483, options [mss 65495,sackOK,TS val 320136895 ecr 320136895,nop,wscale 7], length 0
2022-04-06 09:37:34.392923 IP (tos 0x0, ttl 64, id 2453, offset 0, flags [DF], proto TCP (6), length 52)
    127.0.0.1.54122 > 127.0.0.1.12050: Flags [.], cksum 0xfe28 (incorrect -> 0x9868), seq 1, ack 1, win 512, options [nop,nop,TS val 320136895 ecr 320136895], length 0
2022-04-06 09:37:34.393028 IP (tos 0x0, ttl 64, id 2454, offset 0, flags [DF], proto TCP (6), length 55)
    127.0.0.1.54122 > 127.0.0.1.12050: Flags [P.], cksum 0xfe2b (incorrect -> 0x935c), seq 1:4, ack 1, win 512, options [nop,nop,TS val 320136895 ecr 320136895], length 3
2022-04-06 09:37:34.393032 IP (tos 0x0, ttl 64, id 27079, offset 0, flags [DF], proto TCP (6), length 52)
    127.0.0.1.12050 > 127.0.0.1.54122: Flags [.], cksum 0xfe28 (incorrect -> 0x9865), seq 1, ack 4, win 512, options [nop,nop,TS val 320136895 ecr 320136895], length 0
2022-04-06 09:37:34.393123 IP (tos 0x0, ttl 64, id 27080, offset 0, flags [DF], proto TCP (6), length 54)
    127.0.0.1.12050 > 127.0.0.1.54122: Flags [P.], cksum 0xfe2a (incorrect -> 0x935a), seq 1:3, ack 4, win 512, options [nop,nop,TS val 320136896 ecr 320136895], length 2
2022-04-06 09:37:34.393127 IP (tos 0x0, ttl 64, id 2455, offset 0, flags [DF], proto TCP (6), length 52)
    127.0.0.1.54122 > 127.0.0.1.12050: Flags [.], cksum 0xfe28 (incorrect -> 0x9861), seq 4, ack 3, win 512, options [nop,nop,TS val 320136896 ecr 320136896], length 0
2022-04-06 09:37:34.394791 IP (tos 0x0, ttl 64, id 2456, offset 0, flags [DF], proto TCP (6), length 62)
    127.0.0.1.54122 > 127.0.0.1.12050: Flags [P.], cksum 0xfe32 (incorrect -> 0x3e97), seq 4:14, ack 3, win 512, options [nop,nop,TS val 320136897 ecr 320136896], length 10
2022-04-06 09:37:34.394799 IP (tos 0x0, ttl 64, id 27081, offset 0, flags [DF], proto TCP (6), length 52)
    127.0.0.1.12050 > 127.0.0.1.54122: Flags [.], cksum 0xfe28 (incorrect -> 0x9855), seq 3, ack 14, win 512, options [nop,nop,TS val 320136897 ecr 320136897], length 0
2022-04-06 09:37:34.485399 IP (tos 0x0, ttl 64, id 27082, offset 0, flags [DF], proto TCP (6), length 62)
    127.0.0.1.12050 > 127.0.0.1.54122: Flags [P.], cksum 0xfe32 (incorrect -> 0x92e7), seq 3:13, ack 14, win 512, options [nop,nop,TS val 320136988 ecr 320136897], length 10
2022-04-06 09:37:34.485413 IP (tos 0x0, ttl 64, id 2457, offset 0, flags [DF], proto TCP (6), length 52)
    127.0.0.1.54122 > 127.0.0.1.12050: Flags [.], cksum 0xfe28 (incorrect -> 0x9795), seq 14, ack 13, win 512, options [nop,nop,TS val 320136988 ecr 320136988], length 0
2022-04-06 09:37:34.491258 IP (tos 0x0, ttl 64, id 2458, offset 0, flags [DF], proto TCP (6), length 569)
    127.0.0.1.54122 > 127.0.0.1.12050: Flags [P.], cksum 0x002e (incorrect -> 0x6688), seq 14:531, ack 13, win 512, options [nop,nop,TS val 320136994 ecr 320136988], length 517
2022-04-06 09:37:34.491266 IP (tos 0x0, ttl 64, id 27083, offset 0, flags [DF], proto TCP (6), length 52)
    127.0.0.1.12050 > 127.0.0.1.54122: Flags [.], cksum 0xfe28 (incorrect -> 0x9588), seq 13, ack 531, win 508, options [nop,nop,TS val 320136994 ecr 320136994], length 0
2022-04-06 09:37:34.688030 IP (tos 0x0, ttl 64, id 27084, offset 0, flags [DF], proto TCP (6), length 3538)
    127.0.0.1.12050 > 127.0.0.1.54122: Flags [P.], cksum 0x0bc7 (incorrect -> 0xe61f), seq 13:3499, ack 531, win 512, options [nop,nop,TS val 320137190 ecr 320136994], length 3486
2022-04-06 09:37:34.688037 IP (tos 0x0, ttl 64, id 2459, offset 0, flags [DF], proto TCP (6), length 52)
    127.0.0.1.54122 > 127.0.0.1.12050: Flags [.], cksum 0xfe28 (incorrect -> 0x8670), seq 531, ack 3499, win 494, options [nop,nop,TS val 320137190 ecr 320137190], length 0
2022-04-06 09:37:34.730533 IP (tos 0x0, ttl 64, id 27085, offset 0, flags [DF], proto TCP (6), length 1720)
    127.0.0.1.12050 > 127.0.0.1.54122: Flags [P.], cksum 0x04ad (incorrect -> 0x05b3), seq 3499:5167, ack 531, win 512, options [nop,nop,TS val 320137233 ecr 320137190], length 1668
2022-04-06 09:37:34.730539 IP (tos 0x0, ttl 64, id 2460, offset 0, flags [DF], proto TCP (6), length 52)
    127.0.0.1.54122 > 127.0.0.1.12050: Flags [.], cksum 0xfe28 (incorrect -> 0x7f8f), seq 531, ack 5167, win 501, options [nop,nop,TS val 320137233 ecr 320137233], length 0
2022-04-06 09:37:34.730959 IP (tos 0x0, ttl 64, id 2461, offset 0, flags [DF], proto TCP (6), length 132)
    127.0.0.1.54122 > 127.0.0.1.12050: Flags [P.], cksum 0xfe78 (incorrect -> 0xf82b), seq 531:611, ack 5167, win 512, options [nop,nop,TS val 320137233 ecr 320137233], length 80
2022-04-06 09:37:34.730966 IP (tos 0x0, ttl 64, id 27086, offset 0, flags [DF], proto TCP (6), length 52)
    127.0.0.1.12050 > 127.0.0.1.54122: Flags [.], cksum 0xfe28 (incorrect -> 0x7f34), seq 5167, ack 611, win 512, options [nop,nop,TS val 320137233 ecr 320137233], length 0
2022-04-06 09:37:34.731296 IP (tos 0x0, ttl 64, id 2462, offset 0, flags [DF], proto TCP (6), length 354)
    127.0.0.1.54122 > 127.0.0.1.12050: Flags [P.], cksum 0xff56 (incorrect -> 0xf50f), seq 611:913, ack 5167, win 512, options [nop,nop,TS val 320137234 ecr 320137233], length 302
2022-04-06 09:37:34.731303 IP (tos 0x0, ttl 64, id 27087, offset 0, flags [DF], proto TCP (6), length 52)
    127.0.0.1.12050 > 127.0.0.1.54122: Flags [.], cksum 0xfe28 (incorrect -> 0x7e06), seq 5167, ack 913, win 510, options [nop,nop,TS val 320137234 ecr 320137234], length 0
2022-04-06 09:37:34.826914 IP (tos 0x0, ttl 64, id 27088, offset 0, flags [DF], proto TCP (6), length 610)
    127.0.0.1.12050 > 127.0.0.1.54122: Flags [P.], cksum 0x0057 (incorrect -> 0xc888), seq 5167:5725, ack 913, win 512, options [nop,nop,TS val 320137329 ecr 320137234], length 558
2022-04-06 09:37:34.826921 IP (tos 0x0, ttl 64, id 2463, offset 0, flags [DF], proto TCP (6), length 52)
    127.0.0.1.54122 > 127.0.0.1.12050: Flags [.], cksum 0xfe28 (incorrect -> 0x7b1c), seq 913, ack 5725, win 508, options [nop,nop,TS val 320137329 ecr 320137329], length 0
2022-04-06 09:37:34.907969 IP (tos 0x0, ttl 64, id 27089, offset 0, flags [DF], proto TCP (6), length 3538)
    127.0.0.1.12050 > 127.0.0.1.54122: Flags [P.], cksum 0x0bc7 (incorrect -> 0x8941), seq 5725:9211, ack 913, win 512, options [nop,nop,TS val 320137410 ecr 320137329], length 3486
2022-04-06 09:37:34.907979 IP (tos 0x0, ttl 64, id 2464, offset 0, flags [DF], proto TCP (6), length 52)
    127.0.0.1.54122 > 127.0.0.1.12050: Flags [.], cksum 0xfe28 (incorrect -> 0x6cea), seq 913, ack 9211, win 494, options [nop,nop,TS val 320137410 ecr 320137410], length 0
2022-04-06 09:37:34.916991 IP (tos 0x0, ttl 64, id 27090, offset 0, flags [DF], proto TCP (6), length 3176)
    127.0.0.1.12050 > 127.0.0.1.54122: Flags [P.], cksum 0x0a5d (incorrect -> 0x888b), seq 9211:12335, ack 913, win 512, options [nop,nop,TS val 320137419 ecr 320137410], length 3124
2022-04-06 09:37:34.916997 IP (tos 0x0, ttl 64, id 2465, offset 0, flags [DF], proto TCP (6), length 52)
    127.0.0.1.54122 > 127.0.0.1.12050: Flags [.], cksum 0xfe28 (incorrect -> 0x60a3), seq 913, ack 12335, win 495, options [nop,nop,TS val 320137419 ecr 320137419], length 0
2022-04-06 09:37:34.921557 IP (tos 0x0, ttl 64, id 27091, offset 0, flags [DF], proto TCP (6), length 843)
    127.0.0.1.12050 > 127.0.0.1.54122: Flags [P.], cksum 0x0140 (incorrect -> 0x7bfe), seq 12335:13126, ack 913, win 512, options [nop,nop,TS val 320137424 ecr 320137419], length 791
2022-04-06 09:37:34.921562 IP (tos 0x0, ttl 64, id 2466, offset 0, flags [DF], proto TCP (6), length 52)
    127.0.0.1.54122 > 127.0.0.1.12050: Flags [.], cksum 0xfe28 (incorrect -> 0x5d79), seq 913, ack 13126, win 504, options [nop,nop,TS val 320137424 ecr 320137424], length 0
2022-04-06 09:37:34.921684 IP (tos 0x0, ttl 64, id 27092, offset 0, flags [DF], proto TCP (6), length 1374)
    127.0.0.1.12050 > 127.0.0.1.54122: Flags [P.], cksum 0x0353 (incorrect -> 0xab4a), seq 13126:14448, ack 913, win 512, options [nop,nop,TS val 320137424 ecr 320137424], length 1322
2022-04-06 09:37:34.921689 IP (tos 0x0, ttl 64, id 2467, offset 0, flags [DF], proto TCP (6), length 52)
    127.0.0.1.54122 > 127.0.0.1.12050: Flags [.], cksum 0xfe28 (incorrect -> 0x5851), seq 913, ack 14448, win 502, options [nop,nop,TS val 320137424 ecr 320137424], length 0
2022-04-06 09:37:34.939825 IP (tos 0x0, ttl 64, id 27093, offset 0, flags [DF], proto TCP (6), length 3538)
    127.0.0.1.12050 > 127.0.0.1.54122: Flags [P.], cksum 0x0bc7 (incorrect -> 0x338e), seq 14448:17934, ack 913, win 512, options [nop,nop,TS val 320137442 ecr 320137424], length 3486
2022-04-06 09:37:34.939830 IP (tos 0x0, ttl 64, id 2468, offset 0, flags [DF], proto TCP (6), length 52)
    127.0.0.1.54122 > 127.0.0.1.12050: Flags [.], cksum 0xfe28 (incorrect -> 0x4a97), seq 913, ack 17934, win 494, options [nop,nop,TS val 320137442 ecr 320137442], length 0
2022-04-06 09:37:34.939929 IP (tos 0x0, ttl 64, id 27094, offset 0, flags [DF], proto TCP (6), length 4018)
    127.0.0.1.12050 > 127.0.0.1.54122: Flags [P.], cksum 0x0da7 (incorrect -> 0x4844), seq 17934:21900, ack 913, win 512, options [nop,nop,TS val 320137442 ecr 320137442], length 3966
2022-04-06 09:37:34.939931 IP (tos 0x0, ttl 64, id 2469, offset 0, flags [DF], proto TCP (6), length 52)
    127.0.0.1.54122 > 127.0.0.1.12050: Flags [.], cksum 0xfe28 (incorrect -> 0x3b29), seq 913, ack 21900, win 478, options [nop,nop,TS val 320137442 ecr 320137442], length 0
2022-04-06 09:37:34.940030 IP (tos 0x0, ttl 64, id 27095, offset 0, flags [DF], proto TCP (6), length 2902)
    127.0.0.1.12050 > 127.0.0.1.54122: Flags [P.], cksum 0x094b (incorrect -> 0x5b98), seq 21900:24750, ack 913, win 512, options [nop,nop,TS val 320137442 ecr 320137442], length 2850
2022-04-06 09:37:34.940034 IP (tos 0x0, ttl 64, id 2470, offset 0, flags [DF], proto TCP (6), length 52)
    127.0.0.1.54122 > 127.0.0.1.12050: Flags [.], cksum 0xfe28 (incorrect -> 0x3012), seq 913, ack 24750, win 467, options [nop,nop,TS val 320137442 ecr 320137442], length 0
2022-04-06 09:37:34.940049 IP (tos 0x0, ttl 64, id 27096, offset 0, flags [DF], proto TCP (6), length 1048)
    127.0.0.1.12050 > 127.0.0.1.54122: Flags [P.], cksum 0x020d (incorrect -> 0x636f), seq 24750:25746, ack 913, win 512, options [nop,nop,TS val 320137442 ecr 320137442], length 996
2022-04-06 09:37:34.940378 IP (tos 0x0, ttl 64, id 2471, offset 0, flags [DF], proto TCP (6), length 52)
    127.0.0.1.54122 > 127.0.0.1.12050: Flags [.], cksum 0xfe28 (incorrect -> 0x2c00), seq 913, ack 25746, win 512, options [nop,nop,TS val 320137443 ecr 320137442], length 0
2022-04-06 09:37:34.947293 IP (tos 0x0, ttl 64, id 27097, offset 0, flags [DF], proto TCP (6), length 3538)
    127.0.0.1.12050 > 127.0.0.1.54122: Flags [P.], cksum 0x0bc7 (incorrect -> 0x2358), seq 25746:29232, ack 913, win 512, options [nop,nop,TS val 320137450 ecr 320137443], length 3486
2022-04-06 09:37:34.947533 IP (tos 0x0, ttl 64, id 2472, offset 0, flags [DF], proto TCP (6), length 52)
    127.0.0.1.54122 > 127.0.0.1.12050: Flags [.], cksum 0xfe28 (incorrect -> 0x1e53), seq 913, ack 29232, win 512, options [nop,nop,TS val 320137450 ecr 320137450], length 0
2022-04-06 09:37:34.954123 IP (tos 0x0, ttl 64, id 27098, offset 0, flags [DF], proto TCP (6), length 4100)
    127.0.0.1.12050 > 127.0.0.1.54122: Flags [P.], cksum 0x0df9 (incorrect -> 0xd430), seq 29232:33280, ack 913, win 512, options [nop,nop,TS val 320137457 ecr 320137450], length 4048
2022-04-06 09:37:34.994464 IP (tos 0x0, ttl 64, id 27099, offset 0, flags [DF], proto TCP (6), length 32820)
    127.0.0.1.12050 > 127.0.0.1.54122: Flags [.], cksum 0x7e29 (incorrect -> 0x710b), seq 33280:66048, ack 913, win 512, options [nop,nop,TS val 320137497 ecr 320137450], length 32768
2022-04-06 09:37:34.994481 IP (tos 0x0, ttl 64, id 2473, offset 0, flags [DF], proto TCP (6), length 52)
    127.0.0.1.54122 > 127.0.0.1.12050: Flags [.], cksum 0xfe28 (incorrect -> 0x8ed1), seq 913, ack 66048, win 379, options [nop,nop,TS val 320137497 ecr 320137457], length 0
2022-04-06 09:37:34.994492 IP (tos 0x0, ttl 64, id 27100, offset 0, flags [DF], proto TCP (6), length 3098)
    127.0.0.1.12050 > 127.0.0.1.54122: Flags [P.], cksum 0x0a0f (incorrect -> 0x1b22), seq 66048:69094, ack 913, win 512, options [nop,nop,TS val 320137497 ecr 320137497], length 3046
2022-04-06 09:37:34.995987 IP (tos 0x0, ttl 64, id 2474, offset 0, flags [DF], proto TCP (6), length 52)
    127.0.0.1.54122 > 127.0.0.1.12050: Flags [.], cksum 0xfe28 (incorrect -> 0x823d), seq 913, ack 69094, win 512, options [nop,nop,TS val 320137498 ecr 320137497], length 0
2022-04-06 09:37:34.996139 IP (tos 0x0, ttl 64, id 27101, offset 0, flags [DF], proto TCP (6), length 4100)
    127.0.0.1.12050 > 127.0.0.1.54122: Flags [P.], cksum 0x0df9 (incorrect -> 0x6e6a), seq 69094:73142, ack 913, win 512, options [nop,nop,TS val 320137499 ecr 320137498], length 4048
2022-04-06 09:37:34.996435 IP (tos 0x0, ttl 64, id 2475, offset 0, flags [DF], proto TCP (6), length 52)
    127.0.0.1.54122 > 127.0.0.1.12050: Flags [.], cksum 0xfe28 (incorrect -> 0x726a), seq 913, ack 73142, win 512, options [nop,nop,TS val 320137499 ecr 320137499], length 0
2022-04-06 09:37:34.996440 IP (tos 0x0, ttl 64, id 27102, offset 0, flags [DF], proto TCP (6), length 3834)
    127.0.0.1.12050 > 127.0.0.1.54122: Flags [P.], cksum 0x0cef (incorrect -> 0x5035), seq 73142:76924, ack 913, win 512, options [nop,nop,TS val 320137499 ecr 320137499], length 3782
2022-04-06 09:37:34.996592 IP (tos 0x0, ttl 64, id 2476, offset 0, flags [DF], proto TCP (6), length 52)
    127.0.0.1.54122 > 127.0.0.1.12050: Flags [.], cksum 0xfe28 (incorrect -> 0x63a4), seq 913, ack 76924, win 512, options [nop,nop,TS val 320137499 ecr 320137499], length 0
2022-04-06 09:37:34.997590 IP (tos 0x0, ttl 64, id 27103, offset 0, flags [DF], proto TCP (6), length 4036)
    127.0.0.1.12050 > 127.0.0.1.54122: Flags [P.], cksum 0x0db9 (incorrect -> 0x87ef), seq 76924:80908, ack 913, win 512, options [nop,nop,TS val 320137500 ecr 320137499], length 3984
2022-04-06 09:37:34.997694 IP (tos 0x0, ttl 64, id 2477, offset 0, flags [DF], proto TCP (6), length 52)
    127.0.0.1.54122 > 127.0.0.1.12050: Flags [.], cksum 0xfe28 (incorrect -> 0x5412), seq 913, ack 80908, win 512, options [nop,nop,TS val 320137500 ecr 320137500], length 0
2022-04-06 09:37:34.998181 IP (tos 0x0, ttl 64, id 27104, offset 0, flags [DF], proto TCP (6), length 3262)
    127.0.0.1.12050 > 127.0.0.1.54122: Flags [P.], cksum 0x0ab3 (incorrect -> 0x230b), seq 80908:84118, ack 913, win 512, options [nop,nop,TS val 320137501 ecr 320137500], length 3210
2022-04-06 09:37:34.998320 IP (tos 0x0, ttl 64, id 2478, offset 0, flags [DF], proto TCP (6), length 52)
    127.0.0.1.54122 > 127.0.0.1.12050: Flags [.], cksum 0xfe28 (incorrect -> 0x4786), seq 913, ack 84118, win 512, options [nop,nop,TS val 320137501 ecr 320137501], length 0
2022-04-06 09:37:35.003986 IP (tos 0x0, ttl 64, id 27105, offset 0, flags [DF], proto TCP (6), length 1546)
    127.0.0.1.12050 > 127.0.0.1.54122: Flags [P.], cksum 0x03ff (incorrect -> 0xd27d), seq 84118:85612, ack 913, win 512, options [nop,nop,TS val 320137506 ecr 320137501], length 1494
2022-04-06 09:37:35.004114 IP (tos 0x0, ttl 64, id 2479, offset 0, flags [DF], proto TCP (6), length 52)
    127.0.0.1.54122 > 127.0.0.1.12050: Flags [.], cksum 0xfe28 (incorrect -> 0x41a5), seq 913, ack 85612, win 512, options [nop,nop,TS val 320137507 ecr 320137506], length 0
2022-04-06 09:37:35.012053 IP (tos 0x0, ttl 64, id 27106, offset 0, flags [DF], proto TCP (6), length 3898)
    127.0.0.1.12050 > 127.0.0.1.54122: Flags [P.], cksum 0x0d2f (incorrect -> 0x492e), seq 85612:89458, ack 913, win 512, options [nop,nop,TS val 320137514 ecr 320137507], length 3846
2022-04-06 09:37:35.012167 IP (tos 0x0, ttl 64, id 2480, offset 0, flags [DF], proto TCP (6), length 52)
    127.0.0.1.54122 > 127.0.0.1.12050: Flags [.], cksum 0xfe28 (incorrect -> 0x328f), seq 913, ack 89458, win 512, options [nop,nop,TS val 320137515 ecr 320137514], length 0
2022-04-06 09:37:35.014646 IP (tos 0x0, ttl 64, id 27107, offset 0, flags [DF], proto TCP (6), length 3538)
    127.0.0.1.12050 > 127.0.0.1.54122: Flags [P.], cksum 0x0bc7 (incorrect -> 0xb04e), seq 89458:92944, ack 913, win 512, options [nop,nop,TS val 320137517 ecr 320137515], length 3486
2022-04-06 09:37:35.014760 IP (tos 0x0, ttl 64, id 2481, offset 0, flags [DF], proto TCP (6), length 52)
    127.0.0.1.54122 > 127.0.0.1.12050: Flags [.], cksum 0xfe28 (incorrect -> 0x24ec), seq 913, ack 92944, win 512, options [nop,nop,TS val 320137517 ecr 320137517], length 0
2022-04-06 09:37:35.019761 IP (tos 0x0, ttl 64, id 27108, offset 0, flags [DF], proto TCP (6), length 818)
    127.0.0.1.12050 > 127.0.0.1.54122: Flags [P.], cksum 0x0127 (incorrect -> 0x3ca0), seq 92944:93710, ack 913, win 512, options [nop,nop,TS val 320137522 ecr 320137517], length 766
2022-04-06 09:37:35.019917 IP (tos 0x0, ttl 64, id 2482, offset 0, flags [DF], proto TCP (6), length 52)
    127.0.0.1.54122 > 127.0.0.1.12050: Flags [.], cksum 0xfe28 (incorrect -> 0x21e4), seq 913, ack 93710, win 512, options [nop,nop,TS val 320137522 ecr 320137522], length 0
2022-04-06 09:37:35.021242 IP (tos 0x0, ttl 64, id 27109, offset 0, flags [DF], proto TCP (6), length 3990)
    127.0.0.1.12050 > 127.0.0.1.54122: Flags [P.], cksum 0x0d8b (incorrect -> 0x0227), seq 93710:97648, ack 913, win 512, options [nop,nop,TS val 320137524 ecr 320137522], length 3938
2022-04-06 09:37:35.021393 IP (tos 0x0, ttl 64, id 2483, offset 0, flags [DF], proto TCP (6), length 52)
    127.0.0.1.54122 > 127.0.0.1.12050: Flags [.], cksum 0xfe28 (incorrect -> 0x127e), seq 913, ack 97648, win 512, options [nop,nop,TS val 320137524 ecr 320137524], length 0
2022-04-06 09:37:35.025077 IP (tos 0x0, ttl 64, id 27110, offset 0, flags [DF], proto TCP (6), length 3400)
    127.0.0.1.12050 > 127.0.0.1.54122: Flags [P.], cksum 0x0b3d (incorrect -> 0x7f50), seq 97648:100996, ack 913, win 512, options [nop,nop,TS val 320137528 ecr 320137524], length 3348
2022-04-06 09:37:35.025192 IP (tos 0x0, ttl 64, id 2484, offset 0, flags [DF], proto TCP (6), length 52)
    127.0.0.1.54122 > 127.0.0.1.12050: Flags [.], cksum 0xfe28 (incorrect -> 0x0562), seq 913, ack 100996, win 512, options [nop,nop,TS val 320137528 ecr 320137528], length 0
2022-04-06 09:37:35.025260 IP (tos 0x0, ttl 64, id 27111, offset 0, flags [DF], proto TCP (6), length 3538)
    127.0.0.1.12050 > 127.0.0.1.54122: Flags [P.], cksum 0x0bc7 (incorrect -> 0xa84a), seq 100996:104482, ack 913, win 512, options [nop,nop,TS val 320137528 ecr 320137528], length 3486
2022-04-06 09:37:35.025383 IP (tos 0x0, ttl 64, id 2485, offset 0, flags [DF], proto TCP (6), length 52)
    127.0.0.1.54122 > 127.0.0.1.12050: Flags [.], cksum 0xfe28 (incorrect -> 0xf7c3), seq 913, ack 104482, win 512, options [nop,nop,TS val 320137528 ecr 320137528], length 0
2022-04-06 09:37:35.025559 IP (tos 0x0, ttl 64, id 27112, offset 0, flags [DF], proto TCP (6), length 3852)
    127.0.0.1.12050 > 127.0.0.1.54122: Flags [P.], cksum 0x0d01 (incorrect -> 0x7aee), seq 104482:108282, ack 913, win 512, options [nop,nop,TS val 320137528 ecr 320137528], length 3800
2022-04-06 09:37:35.025842 IP (tos 0x0, ttl 64, id 2486, offset 0, flags [DF], proto TCP (6), length 52)
    127.0.0.1.54122 > 127.0.0.1.12050: Flags [.], cksum 0xfe28 (incorrect -> 0xe8eb), seq 913, ack 108282, win 512, options [nop,nop,TS val 320137528 ecr 320137528], length 0
2022-04-06 09:37:35.025847 IP (tos 0x0, ttl 64, id 27113, offset 0, flags [DF], proto TCP (6), length 4534)
    127.0.0.1.12050 > 127.0.0.1.54122: Flags [P.], cksum 0x0fab (incorrect -> 0x3a57), seq 108282:112764, ack 913, win 512, options [nop,nop,TS val 320137528 ecr 320137528], length 4482
2022-04-06 09:37:35.025940 IP (tos 0x0, ttl 64, id 2487, offset 0, flags [DF], proto TCP (6), length 52)
    127.0.0.1.54122 > 127.0.0.1.12050: Flags [.], cksum 0xfe28 (incorrect -> 0xd769), seq 913, ack 112764, win 512, options [nop,nop,TS val 320137528 ecr 320137528], length 0
2022-04-06 09:37:35.056224 IP (tos 0x0, ttl 64, id 27114, offset 0, flags [DF], proto TCP (6), length 3262)
    127.0.0.1.12050 > 127.0.0.1.54122: Flags [P.], cksum 0x0ab3 (incorrect -> 0x30cf), seq 112764:115974, ack 913, win 512, options [nop,nop,TS val 320137559 ecr 320137528], length 3210
2022-04-06 09:37:35.056842 IP (tos 0x0, ttl 64, id 2488, offset 0, flags [DF], proto TCP (6), length 52)
    127.0.0.1.54122 > 127.0.0.1.12050: Flags [.], cksum 0xfe28 (incorrect -> 0xcaa1), seq 913, ack 115974, win 512, options [nop,nop,TS val 320137559 ecr 320137559], length 0
200, 9.900524377822876, 0.7135288715362549