2022-04-06 15:58:27.211903 IP (tos 0x0, ttl 64, id 61769, offset 0, flags [DF], proto TCP (6), length 60)
    127.0.0.1.34350 > 127.0.0.1.10850: Flags [S], cksum 0xfe30 (incorrect -> 0xf885), seq 587912157, win 65495, options [mss 65495,sackOK,TS val 342989714 ecr 0,nop,wscale 7], length 0
2022-04-06 15:58:27.211912 IP (tos 0x0, ttl 64, id 0, offset 0, flags [DF], proto TCP (6), length 60)
    127.0.0.1.10850 > 127.0.0.1.34350: Flags [S.], cksum 0xfe30 (incorrect -> 0xf0b1), seq 1820191565, ack 587912158, win 65483, options [mss 65495,sackOK,TS val 342989714 ecr 342989714,nop,wscale 7], length 0
2022-04-06 15:58:27.211920 IP (tos 0x0, ttl 64, id 61770, offset 0, flags [DF], proto TCP (6), length 52)
    127.0.0.1.34350 > 127.0.0.1.10850: Flags [.], cksum 0xfe28 (incorrect -> 0x176e), seq 1, ack 1, win 512, options [nop,nop,TS val 342989714 ecr 342989714], length 0
2022-04-06 15:58:27.212036 IP (tos 0x0, ttl 64, id 61771, offset 0, flags [DF], proto TCP (6), length 55)
    127.0.0.1.34350 > 127.0.0.1.10850: Flags [P.], cksum 0xfe2b (incorrect -> 0x1262), seq 1:4, ack 1, win 512, options [nop,nop,TS val 342989714 ecr 342989714], length 3
2022-04-06 15:58:27.212049 IP (tos 0x0, ttl 64, id 10715, offset 0, flags [DF], proto TCP (6), length 52)
    127.0.0.1.10850 > 127.0.0.1.34350: Flags [.], cksum 0xfe28 (incorrect -> 0x176b), seq 1, ack 4, win 512, options [nop,nop,TS val 342989714 ecr 342989714], length 0
2022-04-06 15:58:27.212108 IP (tos 0x0, ttl 64, id 10716, offset 0, flags [DF], proto TCP (6), length 54)
    127.0.0.1.10850 > 127.0.0.1.34350: Flags [P.], cksum 0xfe2a (incorrect -> 0x1260), seq 1:3, ack 4, win 512, options [nop,nop,TS val 342989715 ecr 342989714], length 2
2022-04-06 15:58:27.212126 IP (tos 0x0, ttl 64, id 61772, offset 0, flags [DF], proto TCP (6), length 52)
    127.0.0.1.34350 > 127.0.0.1.10850: Flags [.], cksum 0xfe28 (incorrect -> 0x1767), seq 4, ack 3, win 512, options [nop,nop,TS val 342989715 ecr 342989715], length 0
2022-04-06 15:58:27.213449 IP (tos 0x0, ttl 64, id 61773, offset 0, flags [DF], proto TCP (6), length 62)
    127.0.0.1.34350 > 127.0.0.1.10850: Flags [P.], cksum 0xfe32 (incorrect -> 0xe3a7), seq 4:14, ack 3, win 512, options [nop,nop,TS val 342989716 ecr 342989715], length 10
2022-04-06 15:58:27.213470 IP (tos 0x0, ttl 64, id 10717, offset 0, flags [DF], proto TCP (6), length 52)
    127.0.0.1.10850 > 127.0.0.1.34350: Flags [.], cksum 0xfe28 (incorrect -> 0x175b), seq 3, ack 14, win 512, options [nop,nop,TS val 342989716 ecr 342989716], length 0
2022-04-06 15:58:27.325600 IP (tos 0x0, ttl 64, id 10718, offset 0, flags [DF], proto TCP (6), length 62)
    127.0.0.1.10850 > 127.0.0.1.34350: Flags [P.], cksum 0xfe32 (incorrect -> 0x11d8), seq 3:13, ack 14, win 512, options [nop,nop,TS val 342989828 ecr 342989716], length 10
2022-04-06 15:58:27.325611 IP (tos 0x0, ttl 64, id 61774, offset 0, flags [DF], proto TCP (6), length 52)
    127.0.0.1.34350 > 127.0.0.1.10850: Flags [.], cksum 0xfe28 (incorrect -> 0x1671), seq 14, ack 13, win 512, options [nop,nop,TS val 342989828 ecr 342989828], length 0
2022-04-06 15:58:27.331475 IP (tos 0x0, ttl 64, id 61775, offset 0, flags [DF], proto TCP (6), length 569)
    127.0.0.1.34350 > 127.0.0.1.10850: Flags [P.], cksum 0x002e (incorrect -> 0x9a41), seq 14:531, ack 13, win 512, options [nop,nop,TS val 342989834 ecr 342989828], length 517
2022-04-06 15:58:27.331487 IP (tos 0x0, ttl 64, id 10719, offset 0, flags [DF], proto TCP (6), length 52)
    127.0.0.1.10850 > 127.0.0.1.34350: Flags [.], cksum 0xfe28 (incorrect -> 0x1464), seq 13, ack 531, win 508, options [nop,nop,TS val 342989834 ecr 342989834], length 0
2022-04-06 15:58:27.415377 IP (tos 0x0, ttl 64, id 10720, offset 0, flags [DF], proto TCP (6), length 3538)
    127.0.0.1.10850 > 127.0.0.1.34350: Flags [P.], cksum 0x0bc7 (incorrect -> 0x2843), seq 13:3499, ack 531, win 512, options [nop,nop,TS val 342989918 ecr 342989834], length 3486
2022-04-06 15:58:27.415387 IP (tos 0x0, ttl 64, id 61776, offset 0, flags [DF], proto TCP (6), length 52)
    127.0.0.1.34350 > 127.0.0.1.10850: Flags [.], cksum 0xfe28 (incorrect -> 0x062c), seq 531, ack 3499, win 494, options [nop,nop,TS val 342989918 ecr 342989918], length 0
2022-04-06 15:58:27.446114 IP (tos 0x0, ttl 64, id 10721, offset 0, flags [DF], proto TCP (6), length 1334)
    127.0.0.1.10850 > 127.0.0.1.34350: Flags [P.], cksum 0x032b (incorrect -> 0xb9d8), seq 3499:4781, ack 531, win 512, options [nop,nop,TS val 342989949 ecr 342989918], length 1282
2022-04-06 15:58:27.446123 IP (tos 0x0, ttl 64, id 61777, offset 0, flags [DF], proto TCP (6), length 52)
    127.0.0.1.34350 > 127.0.0.1.10850: Flags [.], cksum 0xfe28 (incorrect -> 0x00e4), seq 531, ack 4781, win 502, options [nop,nop,TS val 342989949 ecr 342989949], length 0
2022-04-06 15:58:27.446510 IP (tos 0x0, ttl 64, id 61778, offset 0, flags [DF], proto TCP (6), length 116)
    127.0.0.1.34350 > 127.0.0.1.10850: Flags [P.], cksum 0xfe68 (incorrect -> 0x9931), seq 531:595, ack 4781, win 512, options [nop,nop,TS val 342989949 ecr 342989949], length 64
2022-04-06 15:58:27.446519 IP (tos 0x0, ttl 64, id 10722, offset 0, flags [DF], proto TCP (6), length 52)
    127.0.0.1.10850 > 127.0.0.1.34350: Flags [.], cksum 0xfe28 (incorrect -> 0x009a), seq 4781, ack 595, win 512, options [nop,nop,TS val 342989949 ecr 342989949], length 0
2022-04-06 15:58:27.446886 IP (tos 0x0, ttl 64, id 61779, offset 0, flags [DF], proto TCP (6), length 430)
    127.0.0.1.34350 > 127.0.0.1.10850: Flags [P.], cksum 0xffa2 (incorrect -> 0xec8d), seq 595:973, ack 4781, win 512, options [nop,nop,TS val 342989949 ecr 342989949], length 378
2022-04-06 15:58:27.446896 IP (tos 0x0, ttl 64, id 10723, offset 0, flags [DF], proto TCP (6), length 52)
    127.0.0.1.10850 > 127.0.0.1.34350: Flags [.], cksum 0xfe28 (incorrect -> 0xff21), seq 4781, ack 973, win 510, options [nop,nop,TS val 342989949 ecr 342989949], length 0
2022-04-06 15:58:27.568524 IP (tos 0x0, ttl 64, id 10724, offset 0, flags [DF], proto TCP (6), length 3538)
    127.0.0.1.10850 > 127.0.0.1.34350: Flags [P.], cksum 0x0bc7 (incorrect -> 0x282e), seq 4781:8267, ack 973, win 512, options [nop,nop,TS val 342990071 ecr 342989949], length 3486
2022-04-06 15:58:27.568534 IP (tos 0x0, ttl 64, id 61780, offset 0, flags [DF], proto TCP (6), length 52)
    127.0.0.1.34350 > 127.0.0.1.10850: Flags [.], cksum 0xfe28 (incorrect -> 0xf09f), seq 973, ack 8267, win 494, options [nop,nop,TS val 342990071 ecr 342990071], length 0
2022-04-06 15:58:27.579091 IP (tos 0x0, ttl 64, id 10725, offset 0, flags [DF], proto TCP (6), length 4036)
    127.0.0.1.10850 > 127.0.0.1.34350: Flags [P.], cksum 0x0db9 (incorrect -> 0x5b3a), seq 8267:12251, ack 973, win 512, options [nop,nop,TS val 342990082 ecr 342990071], length 3984
2022-04-06 15:58:27.579100 IP (tos 0x0, ttl 64, id 61781, offset 0, flags [DF], proto TCP (6), length 52)
    127.0.0.1.34350 > 127.0.0.1.10850: Flags [.], cksum 0xfe28 (incorrect -> 0xe0fb), seq 973, ack 12251, win 492, options [nop,nop,TS val 342990082 ecr 342990082], length 0
2022-04-06 15:58:27.580907 IP (tos 0x0, ttl 64, id 10726, offset 0, flags [DF], proto TCP (6), length 4100)
    127.0.0.1.10850 > 127.0.0.1.34350: Flags [P.], cksum 0x0df9 (incorrect -> 0x9f3a), seq 12251:16299, ack 973, win 512, options [nop,nop,TS val 342990083 ecr 342990082], length 4048
2022-04-06 15:58:27.580916 IP (tos 0x0, ttl 64, id 61782, offset 0, flags [DF], proto TCP (6), length 52)
    127.0.0.1.34350 > 127.0.0.1.10850: Flags [.], cksum 0xfe28 (incorrect -> 0xd129), seq 973, ack 16299, win 492, options [nop,nop,TS val 342990083 ecr 342990083], length 0
2022-04-06 15:58:27.580924 IP (tos 0x0, ttl 64, id 10727, offset 0, flags [DF], proto TCP (6), length 3036)
    127.0.0.1.10850 > 127.0.0.1.34350: Flags [P.], cksum 0x09d1 (incorrect -> 0x2432), seq 16299:19283, ack 973, win 512, options [nop,nop,TS val 342990083 ecr 342990083], length 2984
2022-04-06 15:58:27.580930 IP (tos 0x0, ttl 64, id 61783, offset 0, flags [DF], proto TCP (6), length 52)
    127.0.0.1.34350 > 127.0.0.1.10850: Flags [.], cksum 0xfe28 (incorrect -> 0xc58d), seq 973, ack 19283, win 480, options [nop,nop,TS val 342990083 ecr 342990083], length 0
2022-04-06 15:58:27.588640 IP (tos 0x0, ttl 64, id 10728, offset 0, flags [DF], proto TCP (6), length 1048)
    127.0.0.1.10850 > 127.0.0.1.34350: Flags [P.], cksum 0x020d (incorrect -> 0x0c4f), seq 19283:20279, ack 973, win 512, options [nop,nop,TS val 342990091 ecr 342990083], length 996
2022-04-06 15:58:27.588651 IP (tos 0x0, ttl 64, id 61784, offset 0, flags [DF], proto TCP (6), length 52)
    127.0.0.1.34350 > 127.0.0.1.10850: Flags [.], cksum 0xfe28 (incorrect -> 0xc181), seq 973, ack 20279, win 504, options [nop,nop,TS val 342990091 ecr 342990091], length 0
2022-04-06 15:58:27.598718 IP (tos 0x0, ttl 64, id 10729, offset 0, flags [DF], proto TCP (6), length 3802)
    127.0.0.1.10850 > 127.0.0.1.34350: Flags [P.], cksum 0x0ccf (incorrect -> 0xb82c), seq 20279:24029, ack 973, win 512, options [nop,nop,TS val 342990101 ecr 342990091], length 3750
2022-04-06 15:58:27.598728 IP (tos 0x0, ttl 64, id 61785, offset 0, flags [DF], proto TCP (6), length 52)
    127.0.0.1.34350 > 127.0.0.1.10850: Flags [.], cksum 0xfe28 (incorrect -> 0xb2d2), seq 973, ack 24029, win 493, options [nop,nop,TS val 342990101 ecr 342990101], length 0
2022-04-06 15:58:27.598993 IP (tos 0x0, ttl 64, id 10730, offset 0, flags [DF], proto TCP (6), length 3538)
    127.0.0.1.10850 > 127.0.0.1.34350: Flags [P.], cksum 0x0bc7 (incorrect -> 0x0200), seq 24029:27515, ack 973, win 512, options [nop,nop,TS val 342990101 ecr 342990101], length 3486
2022-04-06 15:58:27.599002 IP (tos 0x0, ttl 64, id 61786, offset 0, flags [DF], proto TCP (6), length 52)
    127.0.0.1.34350 > 127.0.0.1.10850: Flags [.], cksum 0xfe28 (incorrect -> 0xa533), seq 973, ack 27515, win 494, options [nop,nop,TS val 342990101 ecr 342990101], length 0
2022-04-06 15:58:27.600578 IP (tos 0x0, ttl 64, id 10731, offset 0, flags [DF], proto TCP (6), length 4036)
    127.0.0.1.10850 > 127.0.0.1.34350: Flags [P.], cksum 0x0db9 (incorrect -> 0x3f6f), seq 27515:31499, ack 973, win 512, options [nop,nop,TS val 342990103 ecr 342990101], length 3984
2022-04-06 15:58:27.600586 IP (tos 0x0, ttl 64, id 61787, offset 0, flags [DF], proto TCP (6), length 52)
    127.0.0.1.34350 > 127.0.0.1.10850: Flags [.], cksum 0xfe28 (incorrect -> 0x95a1), seq 973, ack 31499, win 492, options [nop,nop,TS val 342990103 ecr 342990103], length 0
2022-04-06 15:58:27.604474 IP (tos 0x0, ttl 64, id 10732, offset 0, flags [DF], proto TCP (6), length 4036)
    127.0.0.1.10850 > 127.0.0.1.34350: Flags [P.], cksum 0x0db9 (incorrect -> 0xd061), seq 31499:35483, ack 973, win 512, options [nop,nop,TS val 342990107 ecr 342990103], length 3984
2022-04-06 15:58:27.632702 IP (tos 0x0, ttl 64, id 10733, offset 0, flags [DF], proto TCP (6), length 32820)
    127.0.0.1.10850 > 127.0.0.1.34350: Flags [.], cksum 0x7e29 (incorrect -> 0xc012), seq 35483:68251, ack 973, win 512, options [nop,nop,TS val 342990135 ecr 342990103], length 32768
2022-04-06 15:58:27.632726 IP (tos 0x0, ttl 64, id 61788, offset 0, flags [DF], proto TCP (6), length 52)
    127.0.0.1.34350 > 127.0.0.1.10850: Flags [.], cksum 0xfe28 (incorrect -> 0x065e), seq 973, ack 68251, win 379, options [nop,nop,TS val 342990135 ecr 342990107], length 0
2022-04-06 15:58:27.632734 IP (tos 0x0, ttl 64, id 10734, offset 0, flags [DF], proto TCP (6), length 2673)
    127.0.0.1.10850 > 127.0.0.1.34350: Flags [P.], cksum 0x0866 (incorrect -> 0x5d9b), seq 68251:70872, ack 973, win 512, options [nop,nop,TS val 342990135 ecr 342990135], length 2621
2022-04-06 15:58:27.633792 IP (tos 0x0, ttl 64, id 61789, offset 0, flags [DF], proto TCP (6), length 52)
    127.0.0.1.34350 > 127.0.0.1.10850: Flags [.], cksum 0xfe28 (incorrect -> 0xfb7e), seq 973, ack 70872, win 512, options [nop,nop,TS val 342990136 ecr 342990135], length 0
2022-04-06 15:58:27.634226 IP (tos 0x0, ttl 64, id 10735, offset 0, flags [DF], proto TCP (6), length 4100)
    127.0.0.1.10850 > 127.0.0.1.34350: Flags [P.], cksum 0x0df9 (incorrect -> 0xe688), seq 70872:74920, ack 973, win 512, options [nop,nop,TS val 342990137 ecr 342990136], length 4048
2022-04-06 15:58:27.634245 IP (tos 0x0, ttl 64, id 61790, offset 0, flags [DF], proto TCP (6), length 52)
    127.0.0.1.34350 > 127.0.0.1.10850: Flags [.], cksum 0xfe28 (incorrect -> 0xebab), seq 973, ack 74920, win 512, options [nop,nop,TS val 342990137 ecr 342990137], length 0
2022-04-06 15:58:27.634250 IP (tos 0x0, ttl 64, id 10736, offset 0, flags [DF], proto TCP (6), length 486)
    127.0.0.1.10850 > 127.0.0.1.34350: Flags [P.], cksum 0xffda (incorrect -> 0xb1a3), seq 74920:75354, ack 973, win 512, options [nop,nop,TS val 342990137 ecr 342990137], length 434
2022-04-06 15:58:27.634256 IP (tos 0x0, ttl 64, id 61791, offset 0, flags [DF], proto TCP (6), length 52)
    127.0.0.1.34350 > 127.0.0.1.10850: Flags [.], cksum 0xfe28 (incorrect -> 0xe9f9), seq 973, ack 75354, win 512, options [nop,nop,TS val 342990137 ecr 342990137], length 0
2022-04-06 15:58:27.635385 IP (tos 0x0, ttl 64, id 10737, offset 0, flags [DF], proto TCP (6), length 3510)
    127.0.0.1.10850 > 127.0.0.1.34350: Flags [P.], cksum 0x0bab (incorrect -> 0x0bc0), seq 75354:78812, ack 973, win 512, options [nop,nop,TS val 342990138 ecr 342990137], length 3458
2022-04-06 15:58:27.635401 IP (tos 0x0, ttl 64, id 61792, offset 0, flags [DF], proto TCP (6), length 52)
    127.0.0.1.34350 > 127.0.0.1.10850: Flags [.], cksum 0xfe28 (incorrect -> 0xdc75), seq 973, ack 78812, win 512, options [nop,nop,TS val 342990138 ecr 342990138], length 0
2022-04-06 15:58:27.642675 IP (tos 0x0, ttl 64, id 10738, offset 0, flags [DF], proto TCP (6), length 1048)
    127.0.0.1.10850 > 127.0.0.1.34350: Flags [P.], cksum 0x020d (incorrect -> 0xb4af), seq 78812:79808, ack 973, win 512, options [nop,nop,TS val 342990145 ecr 342990138], length 996
2022-04-06 15:58:27.642705 IP (tos 0x0, ttl 64, id 61793, offset 0, flags [DF], proto TCP (6), length 52)
    127.0.0.1.34350 > 127.0.0.1.10850: Flags [.], cksum 0xfe28 (incorrect -> 0xd883), seq 973, ack 79808, win 512, options [nop,nop,TS val 342990145 ecr 342990145], length 0
2022-04-06 15:58:27.644119 IP (tos 0x0, ttl 64, id 10739, offset 0, flags [DF], proto TCP (6), length 3538)
    127.0.0.1.10850 > 127.0.0.1.34350: Flags [P.], cksum 0x0bc7 (incorrect -> 0xc371), seq 79808:83294, ack 973, win 512, options [nop,nop,TS val 342990147 ecr 342990145], length 3486
2022-04-06 15:58:27.644134 IP (tos 0x0, ttl 64, id 61794, offset 0, flags [DF], proto TCP (6), length 52)
    127.0.0.1.34350 > 127.0.0.1.10850: Flags [.], cksum 0xfe28 (incorrect -> 0xcae1), seq 973, ack 83294, win 512, options [nop,nop,TS val 342990147 ecr 342990147], length 0
2022-04-06 15:58:27.644356 IP (tos 0x0, ttl 64, id 10740, offset 0, flags [DF], proto TCP (6), length 4100)
    127.0.0.1.10850 > 127.0.0.1.34350: Flags [P.], cksum 0x0df9 (incorrect -> 0x5263), seq 83294:87342, ack 973, win 512, options [nop,nop,TS val 342990147 ecr 342990147], length 4048
2022-04-06 15:58:27.644686 IP (tos 0x0, ttl 64, id 61795, offset 0, flags [DF], proto TCP (6), length 52)
    127.0.0.1.34350 > 127.0.0.1.10850: Flags [.], cksum 0xfe28 (incorrect -> 0xbb11), seq 973, ack 87342, win 512, options [nop,nop,TS val 342990147 ecr 342990147], length 0
2022-04-06 15:58:27.644695 IP (tos 0x0, ttl 64, id 10741, offset 0, flags [DF], proto TCP (6), length 11362)
    127.0.0.1.10850 > 127.0.0.1.34350: Flags [P.], cksum 0x2a57 (incorrect -> 0xddf5), seq 87342:98652, ack 973, win 512, options [nop,nop,TS val 342990147 ecr 342990147], length 11310
2022-04-06 15:58:27.644914 IP (tos 0x0, ttl 64, id 61796, offset 0, flags [DF], proto TCP (6), length 52)
    127.0.0.1.34350 > 127.0.0.1.10850: Flags [.], cksum 0xfe28 (incorrect -> 0x8ee3), seq 973, ack 98652, win 512, options [nop,nop,TS val 342990147 ecr 342990147], length 0
2022-04-06 15:58:27.645598 IP (tos 0x0, ttl 64, id 10742, offset 0, flags [DF], proto TCP (6), length 4100)
    127.0.0.1.10850 > 127.0.0.1.34350: Flags [P.], cksum 0x0df9 (incorrect -> 0xf918), seq 98652:102700, ack 973, win 512, options [nop,nop,TS val 342990148 ecr 342990147], length 4048
2022-04-06 15:58:27.645621 IP (tos 0x0, ttl 64, id 61797, offset 0, flags [DF], proto TCP (6), length 52)
    127.0.0.1.34350 > 127.0.0.1.10850: Flags [.], cksum 0xfe28 (incorrect -> 0x7f11), seq 973, ack 102700, win 512, options [nop,nop,TS val 342990148 ecr 342990148], length 0
2022-04-06 15:58:27.645626 IP (tos 0x0, ttl 64, id 10743, offset 0, flags [DF], proto TCP (6), length 984)
    127.0.0.1.10850 > 127.0.0.1.34350: Flags [P.], cksum 0x01cd (incorrect -> 0x0d9b), seq 102700:103632, ack 973, win 512, options [nop,nop,TS val 342990148 ecr 342990148], length 932
2022-04-06 15:58:27.645632 IP (tos 0x0, ttl 64, id 61798, offset 0, flags [DF], proto TCP (6), length 52)
    127.0.0.1.34350 > 127.0.0.1.10850: Flags [.], cksum 0xfe28 (incorrect -> 0x7b6d), seq 973, ack 103632, win 512, options [nop,nop,TS val 342990148 ecr 342990148], length 0
2022-04-06 15:58:27.654178 IP (tos 0x0, ttl 64, id 10744, offset 0, flags [DF], proto TCP (6), length 2764)
    127.0.0.1.10850 > 127.0.0.1.34350: Flags [P.], cksum 0x08c1 (incorrect -> 0xbfb2), seq 103632:106344, ack 973, win 512, options [nop,nop,TS val 342990157 ecr 342990148], length 2712
2022-04-06 15:58:27.654196 IP (tos 0x0, ttl 64, id 61799, offset 0, flags [DF], proto TCP (6), length 52)
    127.0.0.1.34350 > 127.0.0.1.10850: Flags [.], cksum 0xfe28 (incorrect -> 0x70c3), seq 973, ack 106344, win 512, options [nop,nop,TS val 342990157 ecr 342990157], length 0
2022-04-06 15:58:27.664257 IP (tos 0x0, ttl 64, id 10745, offset 0, flags [DF], proto TCP (6), length 3492)
    127.0.0.1.10850 > 127.0.0.1.34350: Flags [P.], cksum 0x0b99 (incorrect -> 0xe9ad), seq 106344:109784, ack 973, win 512, options [nop,nop,TS val 342990167 ecr 342990157], length 3440
2022-04-06 15:58:27.664591 IP (tos 0x0, ttl 64, id 61800, offset 0, flags [DF], proto TCP (6), length 52)
    127.0.0.1.34350 > 127.0.0.1.10850: Flags [.], cksum 0xfe28 (incorrect -> 0x633f), seq 973, ack 109784, win 512, options [nop,nop,TS val 342990167 ecr 342990167], length 0
2022-04-06 15:58:27.665574 IP (tos 0x0, ttl 64, id 10746, offset 0, flags [DF], proto TCP (6), length 4036)
    127.0.0.1.10850 > 127.0.0.1.34350: Flags [P.], cksum 0x0db9 (incorrect -> 0x246f), seq 109784:113768, ack 973, win 512, options [nop,nop,TS val 342990168 ecr 342990167], length 3984
2022-04-06 15:58:27.665605 IP (tos 0x0, ttl 64, id 61801, offset 0, flags [DF], proto TCP (6), length 52)
    127.0.0.1.34350 > 127.0.0.1.10850: Flags [.], cksum 0xfe28 (incorrect -> 0x53ad), seq 973, ack 113768, win 512, options [nop,nop,TS val 342990168 ecr 342990168], length 0
2022-04-06 15:58:27.666748 IP (tos 0x0, ttl 64, id 10747, offset 0, flags [DF], proto TCP (6), length 4100)
    127.0.0.1.10850 > 127.0.0.1.34350: Flags [P.], cksum 0x0df9 (incorrect -> 0x6b4c), seq 113768:117816, ack 973, win 512, options [nop,nop,TS val 342990169 ecr 342990168], length 4048
2022-04-06 15:58:27.666882 IP (tos 0x0, ttl 64, id 61802, offset 0, flags [DF], proto TCP (6), length 52)
    127.0.0.1.34350 > 127.0.0.1.10850: Flags [.], cksum 0xfe28 (incorrect -> 0x43db), seq 973, ack 117816, win 512, options [nop,nop,TS val 342990169 ecr 342990169], length 0
200, 3.8374078273773193, 0.4941880702972412