2022-04-06 13:39:08.511237 IP (tos 0x0, ttl 64, id 35151, offset 0, flags [DF], proto TCP (6), length 60)
    127.0.0.1.46980 > 127.0.0.1.11350: Flags [S], cksum 0xfe30 (incorrect -> 0x1332), seq 1430576984, win 65495, options [mss 65495,sackOK,TS val 334631014 ecr 0,nop,wscale 7], length 0
2022-04-06 13:39:08.511249 IP (tos 0x0, ttl 64, id 0, offset 0, flags [DF], proto TCP (6), length 60)
    127.0.0.1.11350 > 127.0.0.1.46980: Flags [S.], cksum 0xfe30 (incorrect -> 0xabdd), seq 575217838, ack 1430576985, win 65483, options [mss 65495,sackOK,TS val 334631014 ecr 334631014,nop,wscale 7], length 0
2022-04-06 13:39:08.511259 IP (tos 0x0, ttl 64, id 35152, offset 0, flags [DF], proto TCP (6), length 52)
    127.0.0.1.46980 > 127.0.0.1.11350: Flags [.], cksum 0xfe28 (incorrect -> 0xd299), seq 1, ack 1, win 512, options [nop,nop,TS val 334631014 ecr 334631014], length 0
2022-04-06 13:39:08.511390 IP (tos 0x0, ttl 64, id 35153, offset 0, flags [DF], proto TCP (6), length 55)
    127.0.0.1.46980 > 127.0.0.1.11350: Flags [P.], cksum 0xfe2b (incorrect -> 0xcd8d), seq 1:4, ack 1, win 512, options [nop,nop,TS val 334631014 ecr 334631014], length 3
2022-04-06 13:39:08.511406 IP (tos 0x0, ttl 64, id 42923, offset 0, flags [DF], proto TCP (6), length 52)
    127.0.0.1.11350 > 127.0.0.1.46980: Flags [.], cksum 0xfe28 (incorrect -> 0xd296), seq 1, ack 4, win 512, options [nop,nop,TS val 334631014 ecr 334631014], length 0
2022-04-06 13:39:08.511475 IP (tos 0x0, ttl 64, id 42924, offset 0, flags [DF], proto TCP (6), length 54)
    127.0.0.1.11350 > 127.0.0.1.46980: Flags [P.], cksum 0xfe2a (incorrect -> 0xcd8c), seq 1:3, ack 4, win 512, options [nop,nop,TS val 334631014 ecr 334631014], length 2
2022-04-06 13:39:08.511494 IP (tos 0x0, ttl 64, id 35154, offset 0, flags [DF], proto TCP (6), length 52)
    127.0.0.1.46980 > 127.0.0.1.11350: Flags [.], cksum 0xfe28 (incorrect -> 0xd294), seq 4, ack 3, win 512, options [nop,nop,TS val 334631014 ecr 334631014], length 0
2022-04-06 13:39:08.513354 IP (tos 0x0, ttl 64, id 35155, offset 0, flags [DF], proto TCP (6), length 62)
    127.0.0.1.46980 > 127.0.0.1.11350: Flags [P.], cksum 0xfe32 (incorrect -> 0x958d), seq 4:14, ack 3, win 512, options [nop,nop,TS val 334631016 ecr 334631014], length 10
2022-04-06 13:39:08.513372 IP (tos 0x0, ttl 64, id 42925, offset 0, flags [DF], proto TCP (6), length 52)
    127.0.0.1.11350 > 127.0.0.1.46980: Flags [.], cksum 0xfe28 (incorrect -> 0xd286), seq 3, ack 14, win 512, options [nop,nop,TS val 334631016 ecr 334631016], length 0
2022-04-06 13:39:08.601976 IP (tos 0x0, ttl 64, id 42926, offset 0, flags [DF], proto TCP (6), length 62)
    127.0.0.1.11350 > 127.0.0.1.46980: Flags [P.], cksum 0xfe32 (incorrect -> 0xcd1b), seq 3:13, ack 14, win 512, options [nop,nop,TS val 334631104 ecr 334631016], length 10
2022-04-06 13:39:08.601988 IP (tos 0x0, ttl 64, id 35156, offset 0, flags [DF], proto TCP (6), length 52)
    127.0.0.1.46980 > 127.0.0.1.11350: Flags [.], cksum 0xfe28 (incorrect -> 0xd1cc), seq 14, ack 13, win 512, options [nop,nop,TS val 334631104 ecr 334631104], length 0
2022-04-06 13:39:08.608286 IP (tos 0x0, ttl 64, id 35157, offset 0, flags [DF], proto TCP (6), length 569)
    127.0.0.1.46980 > 127.0.0.1.11350: Flags [P.], cksum 0x002e (incorrect -> 0x1839), seq 14:531, ack 13, win 512, options [nop,nop,TS val 334631111 ecr 334631104], length 517
2022-04-06 13:39:08.608296 IP (tos 0x0, ttl 64, id 42927, offset 0, flags [DF], proto TCP (6), length 52)
    127.0.0.1.11350 > 127.0.0.1.46980: Flags [.], cksum 0xfe28 (incorrect -> 0xcfbd), seq 13, ack 531, win 508, options [nop,nop,TS val 334631111 ecr 334631111], length 0
200, 3.8128671646118164, 0.8574624061584473