2022-04-06 00:16:07.922762 IP (tos 0x0, ttl 64, id 21623, offset 0, flags [DF], proto TCP (6), length 60)
    127.0.0.1.46134 > 127.0.0.1.9950: Flags [S], cksum 0xfe30 (incorrect -> 0xadb4), seq 3947816925, win 65495, options [mss 65495,sackOK,TS val 286450425 ecr 0,nop,wscale 7], length 0
2022-04-06 00:16:07.922776 IP (tos 0x0, ttl 64, id 0, offset 0, flags [DF], proto TCP (6), length 60)
    127.0.0.1.9950 > 127.0.0.1.46134: Flags [S.], cksum 0xfe30 (incorrect -> 0x27bf), seq 2064586453, ack 3947816926, win 65483, options [mss 65495,sackOK,TS val 286450425 ecr 286450425,nop,wscale 7], length 0
2022-04-06 00:16:07.922786 IP (tos 0x0, ttl 64, id 21624, offset 0, flags [DF], proto TCP (6), length 52)
    127.0.0.1.46134 > 127.0.0.1.9950: Flags [.], cksum 0xfe28 (incorrect -> 0x4e7b), seq 1, ack 1, win 512, options [nop,nop,TS val 286450425 ecr 286450425], length 0
2022-04-06 00:16:07.922884 IP (tos 0x0, ttl 64, id 21625, offset 0, flags [DF], proto TCP (6), length 55)
    127.0.0.1.46134 > 127.0.0.1.9950: Flags [P.], cksum 0xfe2b (incorrect -> 0x496f), seq 1:4, ack 1, win 512, options [nop,nop,TS val 286450425 ecr 286450425], length 3
2022-04-06 00:16:07.922897 IP (tos 0x0, ttl 64, id 8535, offset 0, flags [DF], proto TCP (6), length 52)
    127.0.0.1.9950 > 127.0.0.1.46134: Flags [.], cksum 0xfe28 (incorrect -> 0x4e78), seq 1, ack 4, win 512, options [nop,nop,TS val 286450425 ecr 286450425], length 0
2022-04-06 00:16:07.922946 IP (tos 0x0, ttl 64, id 8536, offset 0, flags [DF], proto TCP (6), length 54)
    127.0.0.1.9950 > 127.0.0.1.46134: Flags [P.], cksum 0xfe2a (incorrect -> 0x496e), seq 1:3, ack 4, win 512, options [nop,nop,TS val 286450425 ecr 286450425], length 2
2022-04-06 00:16:07.922959 IP (tos 0x0, ttl 64, id 21626, offset 0, flags [DF], proto TCP (6), length 52)
    127.0.0.1.46134 > 127.0.0.1.9950: Flags [.], cksum 0xfe28 (incorrect -> 0x4e76), seq 4, ack 3, win 512, options [nop,nop,TS val 286450425 ecr 286450425], length 0
2022-04-06 00:16:07.925150 IP (tos 0x0, ttl 64, id 21627, offset 0, flags [DF], proto TCP (6), length 62)
    127.0.0.1.46134 > 127.0.0.1.9950: Flags [P.], cksum 0xfe32 (incorrect -> 0x0cd7), seq 4:14, ack 3, win 512, options [nop,nop,TS val 286450428 ecr 286450425], length 10
2022-04-06 00:16:07.925163 IP (tos 0x0, ttl 64, id 8537, offset 0, flags [DF], proto TCP (6), length 52)
    127.0.0.1.9950 > 127.0.0.1.46134: Flags [.], cksum 0xfe28 (incorrect -> 0x4e66), seq 3, ack 14, win 512, options [nop,nop,TS val 286450428 ecr 286450428], length 0
2022-04-06 00:16:07.971164 IP (tos 0x0, ttl 64, id 8538, offset 0, flags [DF], proto TCP (6), length 62)
    127.0.0.1.9950 > 127.0.0.1.46134: Flags [P.], cksum 0xfe32 (incorrect -> 0x4925), seq 3:13, ack 14, win 512, options [nop,nop,TS val 286450474 ecr 286450428], length 10
2022-04-06 00:16:07.971170 IP (tos 0x0, ttl 64, id 21628, offset 0, flags [DF], proto TCP (6), length 52)
    127.0.0.1.46134 > 127.0.0.1.9950: Flags [.], cksum 0xfe28 (incorrect -> 0x4e00), seq 14, ack 13, win 512, options [nop,nop,TS val 286450474 ecr 286450474], length 0
2022-04-06 00:16:07.976856 IP (tos 0x0, ttl 64, id 21629, offset 0, flags [DF], proto TCP (6), length 569)
    127.0.0.1.46134 > 127.0.0.1.9950: Flags [P.], cksum 0x002e (incorrect -> 0x2d63), seq 14:531, ack 13, win 512, options [nop,nop,TS val 286450479 ecr 286450474], length 517
2022-04-06 00:16:07.976862 IP (tos 0x0, ttl 64, id 8539, offset 0, flags [DF], proto TCP (6), length 52)
    127.0.0.1.9950 > 127.0.0.1.46134: Flags [.], cksum 0xfe28 (incorrect -> 0x4bf5), seq 13, ack 531, win 508, options [nop,nop,TS val 286450479 ecr 286450479], length 0
2022-04-06 00:16:08.026719 IP (tos 0x0, ttl 64, id 8540, offset 0, flags [DF], proto TCP (6), length 3538)
    127.0.0.1.9950 > 127.0.0.1.46134: Flags [P.], cksum 0x0bc7 (incorrect -> 0x0fdd), seq 13:3499, ack 531, win 512, options [nop,nop,TS val 286450529 ecr 286450479], length 3486
2022-04-06 00:16:08.026725 IP (tos 0x0, ttl 64, id 21630, offset 0, flags [DF], proto TCP (6), length 52)
    127.0.0.1.46134 > 127.0.0.1.9950: Flags [.], cksum 0xfe28 (incorrect -> 0x3e01), seq 531, ack 3499, win 494, options [nop,nop,TS val 286450529 ecr 286450529], length 0
2022-04-06 00:16:08.078697 IP (tos 0x0, ttl 64, id 8541, offset 0, flags [DF], proto TCP (6), length 661)
    127.0.0.1.9950 > 127.0.0.1.46134: Flags [P.], cksum 0x008a (incorrect -> 0x4390), seq 3499:4108, ack 531, win 512, options [nop,nop,TS val 286450581 ecr 286450529], length 609
2022-04-06 00:16:08.078702 IP (tos 0x0, ttl 64, id 21631, offset 0, flags [DF], proto TCP (6), length 52)
    127.0.0.1.46134 > 127.0.0.1.9950: Flags [.], cksum 0xfe28 (incorrect -> 0x3b2d), seq 531, ack 4108, win 505, options [nop,nop,TS val 286450581 ecr 286450581], length 0
2022-04-06 00:16:08.079146 IP (tos 0x0, ttl 64, id 21632, offset 0, flags [DF], proto TCP (6), length 132)
    127.0.0.1.46134 > 127.0.0.1.9950: Flags [P.], cksum 0xfe78 (incorrect -> 0x8d6b), seq 531:611, ack 4108, win 512, options [nop,nop,TS val 286450582 ecr 286450581], length 80
2022-04-06 00:16:08.079154 IP (tos 0x0, ttl 64, id 8542, offset 0, flags [DF], proto TCP (6), length 52)
    127.0.0.1.9950 > 127.0.0.1.46134: Flags [.], cksum 0xfe28 (incorrect -> 0x3ad4), seq 4108, ack 611, win 512, options [nop,nop,TS val 286450582 ecr 286450582], length 0
2022-04-06 00:16:08.079595 IP (tos 0x0, ttl 64, id 21633, offset 0, flags [DF], proto TCP (6), length 378)
    127.0.0.1.46134 > 127.0.0.1.9950: Flags [P.], cksum 0xff6e (incorrect -> 0x322b), seq 611:937, ack 4108, win 512, options [nop,nop,TS val 286450582 ecr 286450582], length 326
2022-04-06 00:16:08.079602 IP (tos 0x0, ttl 64, id 8543, offset 0, flags [DF], proto TCP (6), length 52)
    127.0.0.1.9950 > 127.0.0.1.46134: Flags [.], cksum 0xfe28 (incorrect -> 0x3990), seq 4108, ack 937, win 510, options [nop,nop,TS val 286450582 ecr 286450582], length 0
2022-04-06 00:16:08.126874 IP (tos 0x0, ttl 64, id 8544, offset 0, flags [DF], proto TCP (6), length 323)
    127.0.0.1.9950 > 127.0.0.1.46134: Flags [P.], cksum 0xff37 (incorrect -> 0x112b), seq 4108:4379, ack 937, win 512, options [nop,nop,TS val 286450629 ecr 286450582], length 271
2022-04-06 00:16:08.126880 IP (tos 0x0, ttl 64, id 21634, offset 0, flags [DF], proto TCP (6), length 52)
    127.0.0.1.46134 > 127.0.0.1.9950: Flags [.], cksum 0xfe28 (incorrect -> 0x3823), seq 937, ack 4379, win 510, options [nop,nop,TS val 286450629 ecr 286450629], length 0
2022-04-06 00:16:08.164557 IP (tos 0x0, ttl 64, id 8545, offset 0, flags [DF], proto TCP (6), length 323)
    127.0.0.1.9950 > 127.0.0.1.46134: Flags [P.], cksum 0xff37 (incorrect -> 0xcef5), seq 4379:4650, ack 937, win 512, options [nop,nop,TS val 286450667 ecr 286450629], length 271
2022-04-06 00:16:08.164563 IP (tos 0x0, ttl 64, id 21635, offset 0, flags [DF], proto TCP (6), length 52)
    127.0.0.1.46134 > 127.0.0.1.9950: Flags [.], cksum 0xfe28 (incorrect -> 0x36ca), seq 937, ack 4650, win 508, options [nop,nop,TS val 286450667 ecr 286450667], length 0
2022-04-06 00:16:08.216974 IP (tos 0x0, ttl 64, id 8546, offset 0, flags [DF], proto TCP (6), length 1398)
    127.0.0.1.9950 > 127.0.0.1.46134: Flags [P.], cksum 0x036b (incorrect -> 0xe621), seq 4650:5996, ack 937, win 512, options [nop,nop,TS val 286450719 ecr 286450667], length 1346
2022-04-06 00:16:08.216979 IP (tos 0x0, ttl 64, id 21636, offset 0, flags [DF], proto TCP (6), length 52)
    127.0.0.1.46134 > 127.0.0.1.9950: Flags [.], cksum 0xfe28 (incorrect -> 0x3126), seq 937, ack 5996, win 502, options [nop,nop,TS val 286450719 ecr 286450719], length 0
2022-04-06 00:16:08.219619 IP (tos 0x0, ttl 64, id 55676, offset 0, flags [DF], proto TCP (6), length 60)
    127.0.0.1.46136 > 127.0.0.1.9950: Flags [S], cksum 0xfe30 (incorrect -> 0x8ccc), seq 3330550885, win 65495, options [mss 65495,sackOK,TS val 286450722 ecr 0,nop,wscale 7], length 0
2022-04-06 00:16:08.219627 IP (tos 0x0, ttl 64, id 0, offset 0, flags [DF], proto TCP (6), length 60)
    127.0.0.1.9950 > 127.0.0.1.46136: Flags [S.], cksum 0xfe30 (incorrect -> 0xdde3), seq 3806320334, ack 3330550886, win 65483, options [mss 65495,sackOK,TS val 286450722 ecr 286450722,nop,wscale 7], length 0
2022-04-06 00:16:08.219633 IP (tos 0x0, ttl 64, id 55677, offset 0, flags [DF], proto TCP (6), length 52)
    127.0.0.1.46136 > 127.0.0.1.9950: Flags [.], cksum 0xfe28 (incorrect -> 0x04a0), seq 1, ack 1, win 512, options [nop,nop,TS val 286450722 ecr 286450722], length 0
2022-04-06 00:16:08.219716 IP (tos 0x0, ttl 64, id 55678, offset 0, flags [DF], proto TCP (6), length 55)
    127.0.0.1.46136 > 127.0.0.1.9950: Flags [P.], cksum 0xfe2b (incorrect -> 0xff93), seq 1:4, ack 1, win 512, options [nop,nop,TS val 286450722 ecr 286450722], length 3
2022-04-06 00:16:08.219721 IP (tos 0x0, ttl 64, id 22153, offset 0, flags [DF], proto TCP (6), length 52)
    127.0.0.1.9950 > 127.0.0.1.46136: Flags [.], cksum 0xfe28 (incorrect -> 0x049d), seq 1, ack 4, win 512, options [nop,nop,TS val 286450722 ecr 286450722], length 0
2022-04-06 00:16:08.219736 IP (tos 0x0, ttl 64, id 22154, offset 0, flags [DF], proto TCP (6), length 54)
    127.0.0.1.9950 > 127.0.0.1.46136: Flags [P.], cksum 0xfe2a (incorrect -> 0xff92), seq 1:3, ack 4, win 512, options [nop,nop,TS val 286450722 ecr 286450722], length 2
2022-04-06 00:16:08.219742 IP (tos 0x0, ttl 64, id 55679, offset 0, flags [DF], proto TCP (6), length 52)
    127.0.0.1.46136 > 127.0.0.1.9950: Flags [.], cksum 0xfe28 (incorrect -> 0x049b), seq 4, ack 3, win 512, options [nop,nop,TS val 286450722 ecr 286450722], length 0
2022-04-06 00:16:08.233051 IP (tos 0x0, ttl 64, id 55680, offset 0, flags [DF], proto TCP (6), length 62)
    127.0.0.1.46136 > 127.0.0.1.9950: Flags [P.], cksum 0xfe32 (incorrect -> 0xc2f1), seq 4:14, ack 3, win 512, options [nop,nop,TS val 286450735 ecr 286450722], length 10
2022-04-06 00:16:08.233059 IP (tos 0x0, ttl 64, id 22155, offset 0, flags [DF], proto TCP (6), length 52)
    127.0.0.1.9950 > 127.0.0.1.46136: Flags [.], cksum 0xfe28 (incorrect -> 0x0477), seq 3, ack 14, win 512, options [nop,nop,TS val 286450735 ecr 286450735], length 0
2022-04-06 00:16:08.280397 IP (tos 0x0, ttl 64, id 22156, offset 0, flags [DF], proto TCP (6), length 62)
    127.0.0.1.9950 > 127.0.0.1.46136: Flags [P.], cksum 0xfe32 (incorrect -> 0xff33), seq 3:13, ack 14, win 512, options [nop,nop,TS val 286450783 ecr 286450735], length 10
2022-04-06 00:16:08.280409 IP (tos 0x0, ttl 64, id 55681, offset 0, flags [DF], proto TCP (6), length 52)
    127.0.0.1.46136 > 127.0.0.1.9950: Flags [.], cksum 0xfe28 (incorrect -> 0x040d), seq 14, ack 13, win 512, options [nop,nop,TS val 286450783 ecr 286450783], length 0
2022-04-06 00:16:08.285622 IP (tos 0x0, ttl 64, id 55682, offset 0, flags [DF], proto TCP (6), length 569)
    127.0.0.1.46136 > 127.0.0.1.9950: Flags [P.], cksum 0x002e (incorrect -> 0x3c1c), seq 14:531, ack 13, win 512, options [nop,nop,TS val 286450788 ecr 286450783], length 517
2022-04-06 00:16:08.285629 IP (tos 0x0, ttl 64, id 22157, offset 0, flags [DF], proto TCP (6), length 52)
    127.0.0.1.9950 > 127.0.0.1.46136: Flags [.], cksum 0xfe28 (incorrect -> 0x0202), seq 13, ack 531, win 508, options [nop,nop,TS val 286450788 ecr 286450788], length 0
2022-04-06 00:16:08.347363 IP (tos 0x0, ttl 64, id 22158, offset 0, flags [DF], proto TCP (6), length 2948)
    127.0.0.1.9950 > 127.0.0.1.46136: Flags [P.], cksum 0x0979 (incorrect -> 0x9650), seq 13:2909, ack 531, win 512, options [nop,nop,TS val 286450850 ecr 286450788], length 2896
2022-04-06 00:16:08.347370 IP (tos 0x0, ttl 64, id 55683, offset 0, flags [DF], proto TCP (6), length 52)
    127.0.0.1.46136 > 127.0.0.1.9950: Flags [.], cksum 0xfe28 (incorrect -> 0xf641), seq 531, ack 2909, win 496, options [nop,nop,TS val 286450850 ecr 286450850], length 0
2022-04-06 00:16:08.367797 IP (tos 0x0, ttl 64, id 22159, offset 0, flags [DF], proto TCP (6), length 1250)
    127.0.0.1.9950 > 127.0.0.1.46136: Flags [P.], cksum 0x02d7 (incorrect -> 0x5538), seq 2909:4107, ack 531, win 512, options [nop,nop,TS val 286450870 ecr 286450850], length 1198
2022-04-06 00:16:08.367807 IP (tos 0x0, ttl 64, id 55684, offset 0, flags [DF], proto TCP (6), length 52)
    127.0.0.1.46136 > 127.0.0.1.9950: Flags [.], cksum 0xfe28 (incorrect -> 0xf164), seq 531, ack 4107, win 503, options [nop,nop,TS val 286450870 ecr 286450870], length 0
2022-04-06 00:16:08.368362 IP (tos 0x0, ttl 64, id 55685, offset 0, flags [DF], proto TCP (6), length 132)
    127.0.0.1.46136 > 127.0.0.1.9950: Flags [P.], cksum 0xfe78 (incorrect -> 0x20ee), seq 531:611, ack 4107, win 512, options [nop,nop,TS val 286450871 ecr 286450870], length 80
2022-04-06 00:16:08.368369 IP (tos 0x0, ttl 64, id 22160, offset 0, flags [DF], proto TCP (6), length 52)
    127.0.0.1.9950 > 127.0.0.1.46136: Flags [.], cksum 0xfe28 (incorrect -> 0xf109), seq 4107, ack 611, win 512, options [nop,nop,TS val 286450871 ecr 286450871], length 0
2022-04-06 00:16:08.368630 IP (tos 0x0, ttl 64, id 55686, offset 0, flags [DF], proto TCP (6), length 1351)
    127.0.0.1.46136 > 127.0.0.1.9950: Flags [P.], cksum 0x033c (incorrect -> 0xc3e2), seq 611:1910, ack 4107, win 512, options [nop,nop,TS val 286450871 ecr 286450871], length 1299
2022-04-06 00:16:08.368636 IP (tos 0x0, ttl 64, id 22161, offset 0, flags [DF], proto TCP (6), length 52)
    127.0.0.1.9950 > 127.0.0.1.46136: Flags [.], cksum 0xfe28 (incorrect -> 0xec00), seq 4107, ack 1910, win 502, options [nop,nop,TS val 286450871 ecr 286450871], length 0
2022-04-06 00:16:08.416905 IP (tos 0x0, ttl 64, id 22162, offset 0, flags [DF], proto TCP (6), length 594)
    127.0.0.1.9950 > 127.0.0.1.46136: Flags [P.], cksum 0x0047 (incorrect -> 0x83de), seq 4107:4649, ack 1910, win 512, options [nop,nop,TS val 286450919 ecr 286450871], length 542
2022-04-06 00:16:08.416911 IP (tos 0x0, ttl 64, id 55687, offset 0, flags [DF], proto TCP (6), length 52)
    127.0.0.1.46136 > 127.0.0.1.9950: Flags [.], cksum 0xfe28 (incorrect -> 0xe97c), seq 1910, ack 4649, win 508, options [nop,nop,TS val 286450919 ecr 286450919], length 0
2022-04-06 00:16:08.523348 IP (tos 0x0, ttl 64, id 22163, offset 0, flags [DF], proto TCP (6), length 3492)
    127.0.0.1.9950 > 127.0.0.1.46136: Flags [P.], cksum 0x0b99 (incorrect -> 0x14f1), seq 4649:8089, ack 1910, win 512, options [nop,nop,TS val 286451026 ecr 286450919], length 3440
2022-04-06 00:16:08.523355 IP (tos 0x0, ttl 64, id 55688, offset 0, flags [DF], proto TCP (6), length 52)
    127.0.0.1.46136 > 127.0.0.1.9950: Flags [.], cksum 0xfe28 (incorrect -> 0xdb44), seq 1910, ack 8089, win 494, options [nop,nop,TS val 286451026 ecr 286451026], length 0
2022-04-06 00:16:08.530154 IP (tos 0x0, ttl 64, id 22164, offset 0, flags [DF], proto TCP (6), length 4100)
    127.0.0.1.9950 > 127.0.0.1.46136: Flags [P.], cksum 0x0df9 (incorrect -> 0x7dcc), seq 8089:12137, ack 1910, win 512, options [nop,nop,TS val 286451033 ecr 286451026], length 4048
2022-04-06 00:16:08.530159 IP (tos 0x0, ttl 64, id 55689, offset 0, flags [DF], proto TCP (6), length 52)
    127.0.0.1.46136 > 127.0.0.1.9950: Flags [.], cksum 0xfe28 (incorrect -> 0xcb68), seq 1910, ack 12137, win 492, options [nop,nop,TS val 286451033 ecr 286451033], length 0
2022-04-06 00:16:08.530166 IP (tos 0x0, ttl 64, id 22165, offset 0, flags [DF], proto TCP (6), length 2251)
    127.0.0.1.9950 > 127.0.0.1.46136: Flags [P.], cksum 0x06c0 (incorrect -> 0x1a29), seq 12137:14336, ack 1910, win 512, options [nop,nop,TS val 286451033 ecr 286451033], length 2199
2022-04-06 00:16:08.530168 IP (tos 0x0, ttl 64, id 55690, offset 0, flags [DF], proto TCP (6), length 52)
    127.0.0.1.46136 > 127.0.0.1.9950: Flags [.], cksum 0xfe28 (incorrect -> 0xc2da), seq 1910, ack 14336, win 483, options [nop,nop,TS val 286451033 ecr 286451033], length 0
2022-04-06 00:16:08.538551 IP (tos 0x0, ttl 64, id 22166, offset 0, flags [DF], proto TCP (6), length 3247)
    127.0.0.1.9950 > 127.0.0.1.46136: Flags [P.], cksum 0x0aa4 (incorrect -> 0x7202), seq 14336:17531, ack 1910, win 512, options [nop,nop,TS val 286451041 ecr 286451033], length 3195
2022-04-06 00:16:08.538557 IP (tos 0x0, ttl 64, id 55691, offset 0, flags [DF], proto TCP (6), length 52)
    127.0.0.1.46136 > 127.0.0.1.9950: Flags [.], cksum 0xfe28 (incorrect -> 0xb643), seq 1910, ack 17531, win 495, options [nop,nop,TS val 286451041 ecr 286451041], length 0
2022-04-06 00:16:08.540698 IP (tos 0x0, ttl 64, id 22167, offset 0, flags [DF], proto TCP (6), length 3558)
    127.0.0.1.9950 > 127.0.0.1.46136: Flags [P.], cksum 0x0bdb (incorrect -> 0xa59a), seq 17531:21037, ack 1910, win 512, options [nop,nop,TS val 286451043 ecr 286451041], length 3506
2022-04-06 00:16:08.540703 IP (tos 0x0, ttl 64, id 55692, offset 0, flags [DF], proto TCP (6), length 52)
    127.0.0.1.46136 > 127.0.0.1.9950: Flags [.], cksum 0xfe28 (incorrect -> 0xa88e), seq 1910, ack 21037, win 494, options [nop,nop,TS val 286451043 ecr 286451043], length 0
2022-04-06 00:16:08.548394 IP (tos 0x0, ttl 64, id 22168, offset 0, flags [DF], proto TCP (6), length 3194)
    127.0.0.1.9950 > 127.0.0.1.46136: Flags [P.], cksum 0x0a6f (incorrect -> 0xf6fc), seq 21037:24179, ack 1910, win 512, options [nop,nop,TS val 286451051 ecr 286451043], length 3142
2022-04-06 00:16:08.548401 IP (tos 0x0, ttl 64, id 55693, offset 0, flags [DF], proto TCP (6), length 52)
    127.0.0.1.46136 > 127.0.0.1.9950: Flags [.], cksum 0xfe28 (incorrect -> 0x9c37), seq 1910, ack 24179, win 495, options [nop,nop,TS val 286451051 ecr 286451051], length 0
2022-04-06 00:16:08.548578 IP (tos 0x0, ttl 64, id 22169, offset 0, flags [DF], proto TCP (6), length 3027)
    127.0.0.1.9950 > 127.0.0.1.46136: Flags [P.], cksum 0x09c8 (incorrect -> 0x02d4), seq 24179:27154, ack 1910, win 512, options [nop,nop,TS val 286451051 ecr 286451051], length 2975
2022-04-06 00:16:08.548581 IP (tos 0x0, ttl 64, id 55694, offset 0, flags [DF], proto TCP (6), length 52)
    127.0.0.1.46136 > 127.0.0.1.9950: Flags [.], cksum 0xfe28 (incorrect -> 0x90a3), seq 1910, ack 27154, win 484, options [nop,nop,TS val 286451051 ecr 286451051], length 0
2022-04-06 00:16:08.548608 IP (tos 0x0, ttl 64, id 22170, offset 0, flags [DF], proto TCP (6), length 3864)
    127.0.0.1.9950 > 127.0.0.1.46136: Flags [P.], cksum 0x0d0d (incorrect -> 0x7fed), seq 27154:30966, ack 1910, win 512, options [nop,nop,TS val 286451051 ecr 286451051], length 3812
2022-04-06 00:16:08.548838 IP (tos 0x0, ttl 64, id 55695, offset 0, flags [DF], proto TCP (6), length 52)
    127.0.0.1.46136 > 127.0.0.1.9950: Flags [.], cksum 0xfe28 (incorrect -> 0x81a3), seq 1910, ack 30966, win 512, options [nop,nop,TS val 286451051 ecr 286451051], length 0
2022-04-06 00:16:08.552433 IP (tos 0x0, ttl 64, id 22171, offset 0, flags [DF], proto TCP (6), length 3088)
    127.0.0.1.9950 > 127.0.0.1.46136: Flags [P.], cksum 0x0a05 (incorrect -> 0xac7c), seq 30966:34002, ack 1910, win 512, options [nop,nop,TS val 286451055 ecr 286451051], length 3036
2022-04-06 00:16:08.552532 IP (tos 0x0, ttl 64, id 55696, offset 0, flags [DF], proto TCP (6), length 52)
    127.0.0.1.46136 > 127.0.0.1.9950: Flags [.], cksum 0xfe28 (incorrect -> 0x75bf), seq 1910, ack 34002, win 512, options [nop,nop,TS val 286451055 ecr 286451055], length 0
2022-04-06 00:16:08.555365 IP (tos 0x0, ttl 64, id 22172, offset 0, flags [DF], proto TCP (6), length 3842)
    127.0.0.1.9950 > 127.0.0.1.46136: Flags [P.], cksum 0x0cf7 (incorrect -> 0xcab9), seq 34002:37792, ack 1910, win 512, options [nop,nop,TS val 286451058 ecr 286451055], length 3790
2022-04-06 00:16:08.555501 IP (tos 0x0, ttl 64, id 55697, offset 0, flags [DF], proto TCP (6), length 52)
    127.0.0.1.46136 > 127.0.0.1.9950: Flags [.], cksum 0xfe28 (incorrect -> 0x66eb), seq 1910, ack 37792, win 512, options [nop,nop,TS val 286451058 ecr 286451058], length 0
2022-04-06 00:16:08.556678 IP (tos 0x0, ttl 64, id 22173, offset 0, flags [DF], proto TCP (6), length 2928)
    127.0.0.1.9950 > 127.0.0.1.46136: Flags [P.], cksum 0x0965 (incorrect -> 0x0e7f), seq 37792:40668, ack 1910, win 512, options [nop,nop,TS val 286451059 ecr 286451058], length 2876
2022-04-06 00:16:08.556691 IP (tos 0x0, ttl 64, id 55698, offset 0, flags [DF], proto TCP (6), length 52)
    127.0.0.1.46136 > 127.0.0.1.9950: Flags [.], cksum 0xfe28 (incorrect -> 0x5bad), seq 1910, ack 40668, win 512, options [nop,nop,TS val 286451059 ecr 286451059], length 0
2022-04-06 00:16:08.557946 IP (tos 0x0, ttl 64, id 22174, offset 0, flags [DF], proto TCP (6), length 2542)
    127.0.0.1.9950 > 127.0.0.1.46136: Flags [P.], cksum 0x07e3 (incorrect -> 0xbe3a), seq 40668:43158, ack 1910, win 512, options [nop,nop,TS val 286451060 ecr 286451059], length 2490
2022-04-06 00:16:08.557959 IP (tos 0x0, ttl 64, id 55699, offset 0, flags [DF], proto TCP (6), length 52)
    127.0.0.1.46136 > 127.0.0.1.9950: Flags [.], cksum 0xfe28 (incorrect -> 0x51f1), seq 1910, ack 43158, win 512, options [nop,nop,TS val 286451060 ecr 286451060], length 0
2022-04-06 00:16:08.558240 IP (tos 0x0, ttl 64, id 22175, offset 0, flags [DF], proto TCP (6), length 4100)
    127.0.0.1.9950 > 127.0.0.1.46136: Flags [P.], cksum 0x0df9 (incorrect -> 0x46df), seq 43158:47206, ack 1910, win 512, options [nop,nop,TS val 286451061 ecr 286451060], length 4048
2022-04-06 00:16:08.575347 IP (tos 0x0, ttl 64, id 22176, offset 0, flags [DF], proto TCP (6), length 32820)
    127.0.0.1.9950 > 127.0.0.1.46136: Flags [.], cksum 0x7e29 (incorrect -> 0x86e7), seq 47206:79974, ack 1910, win 512, options [nop,nop,TS val 286451078 ecr 286451060], length 32768
2022-04-06 00:16:08.575363 IP (tos 0x0, ttl 64, id 55700, offset 0, flags [DF], proto TCP (6), length 52)
    127.0.0.1.46136 > 127.0.0.1.9950: Flags [.], cksum 0xfe28 (incorrect -> 0xc292), seq 1910, ack 79974, win 379, options [nop,nop,TS val 286451078 ecr 286451061], length 0
2022-04-06 00:16:08.575368 IP (tos 0x0, ttl 64, id 22177, offset 0, flags [DF], proto TCP (6), length 3187)
    127.0.0.1.9950 > 127.0.0.1.46136: Flags [P.], cksum 0x0a68 (incorrect -> 0xae96), seq 79974:83109, ack 1910, win 512, options [nop,nop,TS val 286451078 ecr 286451078], length 3135
2022-04-06 00:16:08.576312 IP (tos 0x0, ttl 64, id 55701, offset 0, flags [DF], proto TCP (6), length 52)
    127.0.0.1.46136 > 127.0.0.1.9950: Flags [.], cksum 0xfe28 (incorrect -> 0xb5bc), seq 1910, ack 83109, win 512, options [nop,nop,TS val 286451079 ecr 286451078], length 0
2022-04-06 00:16:08.577143 IP (tos 0x0, ttl 64, id 22178, offset 0, flags [DF], proto TCP (6), length 2687)
    127.0.0.1.9950 > 127.0.0.1.46136: Flags [P.], cksum 0x0874 (incorrect -> 0x2914), seq 83109:85744, ack 1910, win 512, options [nop,nop,TS val 286451080 ecr 286451079], length 2635
2022-04-06 00:16:08.577242 IP (tos 0x0, ttl 64, id 55702, offset 0, flags [DF], proto TCP (6), length 52)
    127.0.0.1.46136 > 127.0.0.1.9950: Flags [.], cksum 0xfe28 (incorrect -> 0xab6e), seq 1910, ack 85744, win 512, options [nop,nop,TS val 286451080 ecr 286451080], length 0
2022-04-06 00:16:08.584799 IP (tos 0x0, ttl 64, id 22179, offset 0, flags [DF], proto TCP (6), length 2542)
    127.0.0.1.9950 > 127.0.0.1.46136: Flags [P.], cksum 0x07e3 (incorrect -> 0x4e30), seq 85744:88234, ack 1910, win 512, options [nop,nop,TS val 286451087 ecr 286451080], length 2490
2022-04-06 00:16:08.584813 IP (tos 0x0, ttl 64, id 55703, offset 0, flags [DF], proto TCP (6), length 52)
    127.0.0.1.46136 > 127.0.0.1.9950: Flags [.], cksum 0xfe28 (incorrect -> 0xa1a6), seq 1910, ack 88234, win 512, options [nop,nop,TS val 286451087 ecr 286451087], length 0
2022-04-06 00:16:08.587402 IP (tos 0x0, ttl 64, id 22180, offset 0, flags [DF], proto TCP (6), length 4100)
    127.0.0.1.9950 > 127.0.0.1.46136: Flags [P.], cksum 0x0df9 (incorrect -> 0x68f4), seq 88234:92282, ack 1910, win 512, options [nop,nop,TS val 286451090 ecr 286451087], length 4048
2022-04-06 00:16:08.587706 IP (tos 0x0, ttl 64, id 55704, offset 0, flags [DF], proto TCP (6), length 52)
    127.0.0.1.46136 > 127.0.0.1.9950: Flags [.], cksum 0xfe28 (incorrect -> 0x91d0), seq 1910, ack 92282, win 512, options [nop,nop,TS val 286451090 ecr 286451090], length 0
2022-04-06 00:16:08.587713 IP (tos 0x0, ttl 64, id 22181, offset 0, flags [DF], proto TCP (6), length 5922)
    127.0.0.1.9950 > 127.0.0.1.46136: Flags [P.], cksum 0x1517 (incorrect -> 0xda06), seq 92282:98152, ack 1910, win 512, options [nop,nop,TS val 286451090 ecr 286451090], length 5870
2022-04-06 00:16:08.587806 IP (tos 0x0, ttl 64, id 55705, offset 0, flags [DF], proto TCP (6), length 52)
    127.0.0.1.46136 > 127.0.0.1.9950: Flags [.], cksum 0xfe28 (incorrect -> 0x7ae2), seq 1910, ack 98152, win 512, options [nop,nop,TS val 286451090 ecr 286451090], length 0
2022-04-06 00:16:08.592914 IP (tos 0x0, ttl 64, id 22182, offset 0, flags [DF], proto TCP (6), length 2994)
    127.0.0.1.9950 > 127.0.0.1.46136: Flags [P.], cksum 0x09a7 (incorrect -> 0xd86c), seq 98152:101094, ack 1910, win 512, options [nop,nop,TS val 286451095 ecr 286451090], length 2942
2022-04-06 00:16:08.592928 IP (tos 0x0, ttl 64, id 55706, offset 0, flags [DF], proto TCP (6), length 52)
    127.0.0.1.46136 > 127.0.0.1.9950: Flags [.], cksum 0xfe28 (incorrect -> 0x6f5a), seq 1910, ack 101094, win 512, options [nop,nop,TS val 286451095 ecr 286451095], length 0
2022-04-06 00:16:08.593227 IP (tos 0x0, ttl 64, id 22183, offset 0, flags [DF], proto TCP (6), length 3168)
    127.0.0.1.9950 > 127.0.0.1.46136: Flags [P.], cksum 0x0a55 (incorrect -> 0x96f3), seq 101094:104210, ack 1910, win 512, options [nop,nop,TS val 286451096 ecr 286451095], length 3116
2022-04-06 00:16:08.593330 IP (tos 0x0, ttl 64, id 55707, offset 0, flags [DF], proto TCP (6), length 52)
    127.0.0.1.46136 > 127.0.0.1.9950: Flags [.], cksum 0xfe28 (incorrect -> 0x632c), seq 1910, ack 104210, win 512, options [nop,nop,TS val 286451096 ecr 286451096], length 0
2022-04-06 00:16:08.594706 IP (tos 0x0, ttl 64, id 22184, offset 0, flags [DF], proto TCP (6), length 4100)
    127.0.0.1.9950 > 127.0.0.1.46136: Flags [P.], cksum 0x0df9 (incorrect -> 0xc625), seq 104210:108258, ack 1910, win 512, options [nop,nop,TS val 286451097 ecr 286451096], length 4048
2022-04-06 00:16:08.594841 IP (tos 0x0, ttl 64, id 55708, offset 0, flags [DF], proto TCP (6), length 52)
    127.0.0.1.46136 > 127.0.0.1.9950: Flags [.], cksum 0xfe28 (incorrect -> 0x535a), seq 1910, ack 108258, win 512, options [nop,nop,TS val 286451097 ecr 286451097], length 0
2022-04-06 00:16:08.594846 IP (tos 0x0, ttl 64, id 22185, offset 0, flags [DF], proto TCP (6), length 4821)
    127.0.0.1.9950 > 127.0.0.1.46136: Flags [P.], cksum 0x10ca (incorrect -> 0xa338), seq 108258:113027, ack 1910, win 512, options [nop,nop,TS val 286451097 ecr 286451097], length 4769
2022-04-06 00:16:08.594952 IP (tos 0x0, ttl 64, id 55709, offset 0, flags [DF], proto TCP (6), length 52)
    127.0.0.1.46136 > 127.0.0.1.9950: Flags [.], cksum 0xfe28 (incorrect -> 0x40b9), seq 1910, ack 113027, win 512, options [nop,nop,TS val 286451097 ecr 286451097], length 0
200, 7.804733514785767, 0.6882145404815674