2022-04-06 09:05:42.905403 IP (tos 0x0, ttl 64, id 37145, offset 0, flags [DF], proto TCP (6), length 60)
    127.0.0.1.48058 > 127.0.0.1.9650: Flags [S], cksum 0xfe30 (incorrect -> 0x3833), seq 1573980569, win 65495, options [mss 65495,sackOK,TS val 318225408 ecr 0,nop,wscale 7], length 0
2022-04-06 09:05:42.905418 IP (tos 0x0, ttl 64, id 0, offset 0, flags [DF], proto TCP (6), length 60)
    127.0.0.1.9650 > 127.0.0.1.48058: Flags [S.], cksum 0xfe30 (incorrect -> 0xd0da), seq 2576809668, ack 1573980570, win 65483, options [mss 65495,sackOK,TS val 318225408 ecr 318225408,nop,wscale 7], length 0
2022-04-06 09:05:42.905429 IP (tos 0x0, ttl 64, id 37146, offset 0, flags [DF], proto TCP (6), length 52)
    127.0.0.1.48058 > 127.0.0.1.9650: Flags [.], cksum 0xfe28 (incorrect -> 0xf796), seq 1, ack 1, win 512, options [nop,nop,TS val 318225408 ecr 318225408], length 0
2022-04-06 09:05:42.905558 IP (tos 0x0, ttl 64, id 37147, offset 0, flags [DF], proto TCP (6), length 55)
    127.0.0.1.48058 > 127.0.0.1.9650: Flags [P.], cksum 0xfe2b (incorrect -> 0xf28a), seq 1:4, ack 1, win 512, options [nop,nop,TS val 318225408 ecr 318225408], length 3
2022-04-06 09:05:42.905572 IP (tos 0x0, ttl 64, id 63578, offset 0, flags [DF], proto TCP (6), length 52)
    127.0.0.1.9650 > 127.0.0.1.48058: Flags [.], cksum 0xfe28 (incorrect -> 0xf793), seq 1, ack 4, win 512, options [nop,nop,TS val 318225408 ecr 318225408], length 0
2022-04-06 09:05:42.905608 IP (tos 0x0, ttl 64, id 63579, offset 0, flags [DF], proto TCP (6), length 54)
    127.0.0.1.9650 > 127.0.0.1.48058: Flags [P.], cksum 0xfe2a (incorrect -> 0xf289), seq 1:3, ack 4, win 512, options [nop,nop,TS val 318225408 ecr 318225408], length 2
2022-04-06 09:05:42.905620 IP (tos 0x0, ttl 64, id 37148, offset 0, flags [DF], proto TCP (6), length 52)
    127.0.0.1.48058 > 127.0.0.1.9650: Flags [.], cksum 0xfe28 (incorrect -> 0xf791), seq 4, ack 3, win 512, options [nop,nop,TS val 318225408 ecr 318225408], length 0
2022-04-06 09:05:42.957106 IP (tos 0x0, ttl 64, id 37149, offset 0, flags [DF], proto TCP (6), length 62)
    127.0.0.1.48058 > 127.0.0.1.9650: Flags [P.], cksum 0xfe32 (incorrect -> 0x7c6c), seq 4:14, ack 3, win 512, options [nop,nop,TS val 318225460 ecr 318225408], length 10
2022-04-06 09:05:42.957116 IP (tos 0x0, ttl 64, id 63580, offset 0, flags [DF], proto TCP (6), length 52)
    127.0.0.1.9650 > 127.0.0.1.48058: Flags [.], cksum 0xfe28 (incorrect -> 0xf71f), seq 3, ack 14, win 512, options [nop,nop,TS val 318225460 ecr 318225460], length 0
2022-04-06 09:05:44.415817 IP (tos 0x0, ttl 64, id 63581, offset 0, flags [DF], proto TCP (6), length 62)
    127.0.0.1.9650 > 127.0.0.1.48058: Flags [P.], cksum 0xfe32 (incorrect -> 0xec5a), seq 3:13, ack 14, win 512, options [nop,nop,TS val 318226918 ecr 318225460], length 10
2022-04-06 09:05:44.415828 IP (tos 0x0, ttl 64, id 37150, offset 0, flags [DF], proto TCP (6), length 52)
    127.0.0.1.48058 > 127.0.0.1.9650: Flags [.], cksum 0xfe28 (incorrect -> 0xebb1), seq 14, ack 13, win 512, options [nop,nop,TS val 318226918 ecr 318226918], length 0
2022-04-06 09:05:44.421805 IP (tos 0x0, ttl 64, id 37151, offset 0, flags [DF], proto TCP (6), length 569)
    127.0.0.1.48058 > 127.0.0.1.9650: Flags [P.], cksum 0x002e (incorrect -> 0x271b), seq 14:531, ack 13, win 512, options [nop,nop,TS val 318226924 ecr 318226918], length 517
2022-04-06 09:05:44.421815 IP (tos 0x0, ttl 64, id 63582, offset 0, flags [DF], proto TCP (6), length 52)
    127.0.0.1.9650 > 127.0.0.1.48058: Flags [.], cksum 0xfe28 (incorrect -> 0xe9a4), seq 13, ack 531, win 508, options [nop,nop,TS val 318226924 ecr 318226924], length 0
2022-04-06 09:05:44.542253 IP (tos 0x0, ttl 64, id 63583, offset 0, flags [DF], proto TCP (6), length 3381)
    127.0.0.1.9650 > 127.0.0.1.48058: Flags [P.], cksum 0x0b2a (incorrect -> 0x69eb), seq 13:3342, ack 531, win 512, options [nop,nop,TS val 318227045 ecr 318226924], length 3329
2022-04-06 09:05:44.542264 IP (tos 0x0, ttl 64, id 37152, offset 0, flags [DF], proto TCP (6), length 52)
    127.0.0.1.48058 > 127.0.0.1.9650: Flags [.], cksum 0xfe28 (incorrect -> 0xdbbf), seq 531, ack 3342, win 494, options [nop,nop,TS val 318227045 ecr 318227045], length 0
2022-04-06 09:05:44.542878 IP (tos 0x0, ttl 64, id 37153, offset 0, flags [DF], proto TCP (6), length 145)
    127.0.0.1.48058 > 127.0.0.1.9650: Flags [P.], cksum 0xfe85 (incorrect -> 0xb891), seq 531:624, ack 3342, win 512, options [nop,nop,TS val 318227045 ecr 318227045], length 93
2022-04-06 09:05:44.542886 IP (tos 0x0, ttl 64, id 63584, offset 0, flags [DF], proto TCP (6), length 52)
    127.0.0.1.9650 > 127.0.0.1.48058: Flags [.], cksum 0xfe28 (incorrect -> 0xdb50), seq 3342, ack 624, win 512, options [nop,nop,TS val 318227045 ecr 318227045], length 0
2022-04-06 09:05:44.962483 IP (tos 0x0, ttl 64, id 63585, offset 0, flags [DF], proto TCP (6), length 310)
    127.0.0.1.9650 > 127.0.0.1.48058: Flags [P.], cksum 0xff2a (incorrect -> 0x7464), seq 3342:3600, ack 624, win 512, options [nop,nop,TS val 318227465 ecr 318227045], length 258
2022-04-06 09:05:44.962494 IP (tos 0x0, ttl 64, id 37154, offset 0, flags [DF], proto TCP (6), length 52)
    127.0.0.1.48058 > 127.0.0.1.9650: Flags [.], cksum 0xfe28 (incorrect -> 0xd708), seq 624, ack 3600, win 510, options [nop,nop,TS val 318227465 ecr 318227465], length 0
2022-04-06 09:05:44.962993 IP (tos 0x0, ttl 64, id 37155, offset 0, flags [DF], proto TCP (6), length 366)
    127.0.0.1.48058 > 127.0.0.1.9650: Flags [P.], cksum 0xff62 (incorrect -> 0x530c), seq 624:938, ack 3600, win 512, options [nop,nop,TS val 318227465 ecr 318227465], length 314
2022-04-06 09:05:44.963001 IP (tos 0x0, ttl 64, id 63586, offset 0, flags [DF], proto TCP (6), length 52)
    127.0.0.1.9650 > 127.0.0.1.48058: Flags [.], cksum 0xfe28 (incorrect -> 0xd5ce), seq 3600, ack 938, win 510, options [nop,nop,TS val 318227465 ecr 318227465], length 0
2022-04-06 09:05:45.055753 IP (tos 0x0, ttl 64, id 63587, offset 0, flags [DF], proto TCP (6), length 220)
    127.0.0.1.9650 > 127.0.0.1.48058: Flags [P.], cksum 0xfed0 (incorrect -> 0xecbc), seq 3600:3768, ack 938, win 512, options [nop,nop,TS val 318227558 ecr 318227465], length 168
2022-04-06 09:05:45.057927 IP (tos 0x0, ttl 64, id 21670, offset 0, flags [DF], proto TCP (6), length 60)
    127.0.0.1.48060 > 127.0.0.1.9650: Flags [S], cksum 0xfe30 (incorrect -> 0xa8b2), seq 1648069701, win 65495, options [mss 65495,sackOK,TS val 318227560 ecr 0,nop,wscale 7], length 0
2022-04-06 09:05:45.057939 IP (tos 0x0, ttl 64, id 0, offset 0, flags [DF], proto TCP (6), length 60)
    127.0.0.1.9650 > 127.0.0.1.48060: Flags [S.], cksum 0xfe30 (incorrect -> 0xb51e), seq 2165873430, ack 1648069702, win 65483, options [mss 65495,sackOK,TS val 318227560 ecr 318227560,nop,wscale 7], length 0
2022-04-06 09:05:45.057948 IP (tos 0x0, ttl 64, id 21671, offset 0, flags [DF], proto TCP (6), length 52)
    127.0.0.1.48060 > 127.0.0.1.9650: Flags [.], cksum 0xfe28 (incorrect -> 0xdbda), seq 1, ack 1, win 512, options [nop,nop,TS val 318227560 ecr 318227560], length 0
2022-04-06 09:05:45.058041 IP (tos 0x0, ttl 64, id 21672, offset 0, flags [DF], proto TCP (6), length 55)
    127.0.0.1.48060 > 127.0.0.1.9650: Flags [P.], cksum 0xfe2b (incorrect -> 0xd6ce), seq 1:4, ack 1, win 512, options [nop,nop,TS val 318227560 ecr 318227560], length 3
2022-04-06 09:05:45.058046 IP (tos 0x0, ttl 64, id 49880, offset 0, flags [DF], proto TCP (6), length 52)
    127.0.0.1.9650 > 127.0.0.1.48060: Flags [.], cksum 0xfe28 (incorrect -> 0xdbd7), seq 1, ack 4, win 512, options [nop,nop,TS val 318227560 ecr 318227560], length 0
2022-04-06 09:05:45.058063 IP (tos 0x0, ttl 64, id 49881, offset 0, flags [DF], proto TCP (6), length 54)
    127.0.0.1.9650 > 127.0.0.1.48060: Flags [P.], cksum 0xfe2a (incorrect -> 0xd6cc), seq 1:3, ack 4, win 512, options [nop,nop,TS val 318227561 ecr 318227560], length 2
2022-04-06 09:05:45.058070 IP (tos 0x0, ttl 64, id 21673, offset 0, flags [DF], proto TCP (6), length 52)
    127.0.0.1.48060 > 127.0.0.1.9650: Flags [.], cksum 0xfe28 (incorrect -> 0xdbd3), seq 4, ack 3, win 512, options [nop,nop,TS val 318227561 ecr 318227561], length 0
2022-04-06 09:05:45.098672 IP (tos 0x0, ttl 64, id 37156, offset 0, flags [DF], proto TCP (6), length 52)
    127.0.0.1.48058 > 127.0.0.1.9650: Flags [.], cksum 0xfe28 (incorrect -> 0xd43f), seq 938, ack 3768, win 512, options [nop,nop,TS val 318227601 ecr 318227558], length 0
2022-04-06 09:05:45.108620 IP (tos 0x0, ttl 64, id 21674, offset 0, flags [DF], proto TCP (6), length 62)
    127.0.0.1.48060 > 127.0.0.1.9650: Flags [P.], cksum 0xfe32 (incorrect -> 0x60b0), seq 4:14, ack 3, win 512, options [nop,nop,TS val 318227611 ecr 318227561], length 10
2022-04-06 09:05:45.108635 IP (tos 0x0, ttl 64, id 49882, offset 0, flags [DF], proto TCP (6), length 52)
    127.0.0.1.9650 > 127.0.0.1.48060: Flags [.], cksum 0xfe28 (incorrect -> 0xdb65), seq 3, ack 14, win 512, options [nop,nop,TS val 318227611 ecr 318227611], length 0
2022-04-06 09:05:45.209044 IP (tos 0x0, ttl 64, id 49883, offset 0, flags [DF], proto TCP (6), length 62)
    127.0.0.1.9650 > 127.0.0.1.48060: Flags [P.], cksum 0xfe32 (incorrect -> 0xd5ee), seq 3:13, ack 14, win 512, options [nop,nop,TS val 318227711 ecr 318227611], length 10
2022-04-06 09:05:45.209051 IP (tos 0x0, ttl 64, id 21675, offset 0, flags [DF], proto TCP (6), length 52)
    127.0.0.1.48060 > 127.0.0.1.9650: Flags [.], cksum 0xfe28 (incorrect -> 0xda93), seq 14, ack 13, win 512, options [nop,nop,TS val 318227711 ecr 318227711], length 0
2022-04-06 09:05:45.214232 IP (tos 0x0, ttl 64, id 21676, offset 0, flags [DF], proto TCP (6), length 569)
    127.0.0.1.48060 > 127.0.0.1.9650: Flags [P.], cksum 0x002e (incorrect -> 0x5f9e), seq 14:531, ack 13, win 512, options [nop,nop,TS val 318227717 ecr 318227711], length 517
2022-04-06 09:05:45.214241 IP (tos 0x0, ttl 64, id 49884, offset 0, flags [DF], proto TCP (6), length 52)
    127.0.0.1.9650 > 127.0.0.1.48060: Flags [.], cksum 0xfe28 (incorrect -> 0xd886), seq 13, ack 531, win 508, options [nop,nop,TS val 318227717 ecr 318227717], length 0
2022-04-06 09:05:45.349196 IP (tos 0x0, ttl 64, id 49885, offset 0, flags [DF], proto TCP (6), length 3381)
    127.0.0.1.9650 > 127.0.0.1.48060: Flags [P.], cksum 0x0b2a (incorrect -> 0x27df), seq 13:3342, ack 531, win 512, options [nop,nop,TS val 318227852 ecr 318227717], length 3329
2022-04-06 09:05:45.349203 IP (tos 0x0, ttl 64, id 21677, offset 0, flags [DF], proto TCP (6), length 52)
    127.0.0.1.48060 > 127.0.0.1.9650: Flags [.], cksum 0xfe28 (incorrect -> 0xca85), seq 531, ack 3342, win 494, options [nop,nop,TS val 318227852 ecr 318227852], length 0
2022-04-06 09:05:45.349905 IP (tos 0x0, ttl 64, id 21678, offset 0, flags [DF], proto TCP (6), length 145)
    127.0.0.1.48060 > 127.0.0.1.9650: Flags [P.], cksum 0xfe85 (incorrect -> 0x438b), seq 531:624, ack 3342, win 512, options [nop,nop,TS val 318227852 ecr 318227852], length 93
2022-04-06 09:05:45.349912 IP (tos 0x0, ttl 64, id 49886, offset 0, flags [DF], proto TCP (6), length 52)
    127.0.0.1.9650 > 127.0.0.1.48060: Flags [.], cksum 0xfe28 (incorrect -> 0xca16), seq 3342, ack 624, win 512, options [nop,nop,TS val 318227852 ecr 318227852], length 0
2022-04-06 09:05:45.459309 IP (tos 0x0, ttl 64, id 49887, offset 0, flags [DF], proto TCP (6), length 310)
    127.0.0.1.9650 > 127.0.0.1.48060: Flags [P.], cksum 0xff2a (incorrect -> 0x9360), seq 3342:3600, ack 624, win 512, options [nop,nop,TS val 318227962 ecr 318227852], length 258
2022-04-06 09:05:45.459316 IP (tos 0x0, ttl 64, id 21679, offset 0, flags [DF], proto TCP (6), length 52)
    127.0.0.1.48060 > 127.0.0.1.9650: Flags [.], cksum 0xfe28 (incorrect -> 0xc83a), seq 624, ack 3600, win 510, options [nop,nop,TS val 318227962 ecr 318227962], length 0
2022-04-06 09:05:45.459607 IP (tos 0x0, ttl 64, id 21680, offset 0, flags [DF], proto TCP (6), length 362)
    127.0.0.1.48060 > 127.0.0.1.9650: Flags [P.], cksum 0xff5e (incorrect -> 0x871a), seq 624:934, ack 3600, win 512, options [nop,nop,TS val 318227962 ecr 318227962], length 310
2022-04-06 09:05:45.459614 IP (tos 0x0, ttl 64, id 49888, offset 0, flags [DF], proto TCP (6), length 52)
    127.0.0.1.9650 > 127.0.0.1.48060: Flags [.], cksum 0xfe28 (incorrect -> 0xc704), seq 3600, ack 934, win 510, options [nop,nop,TS val 318227962 ecr 318227962], length 0
2022-04-06 09:05:45.562884 IP (tos 0x0, ttl 64, id 49889, offset 0, flags [DF], proto TCP (6), length 2848)
    127.0.0.1.9650 > 127.0.0.1.48060: Flags [P.], cksum 0x0915 (incorrect -> 0x247c), seq 3600:6396, ack 934, win 512, options [nop,nop,TS val 318228065 ecr 318227962], length 2796
2022-04-06 09:05:45.606655 IP (tos 0x0, ttl 64, id 21681, offset 0, flags [DF], proto TCP (6), length 52)
    127.0.0.1.48060 > 127.0.0.1.9650: Flags [.], cksum 0xfe28 (incorrect -> 0xbb1c), seq 934, ack 6396, win 512, options [nop,nop,TS val 318228109 ecr 318228065], length 0
2022-04-06 09:06:52.078759 IP (tos 0x0, ttl 64, id 49890, offset 0, flags [DF], proto TCP (6), length 2542)
    127.0.0.1.9650 > 127.0.0.1.48060: Flags [P.], cksum 0x07e3 (incorrect -> 0xe856), seq 6396:8886, ack 934, win 512, options [nop,nop,TS val 318294581 ecr 318228109], length 2490
2022-04-06 09:06:52.078770 IP (tos 0x0, ttl 64, id 21682, offset 0, flags [DF], proto TCP (6), length 52)
    127.0.0.1.48060 > 127.0.0.1.9650: Flags [.], cksum 0xfe28 (incorrect -> 0xa9f2), seq 934, ack 8886, win 498, options [nop,nop,TS val 318294581 ecr 318294581], length 0
2022-04-06 09:07:17.664473 IP (tos 0x0, ttl 64, id 49891, offset 0, flags [DF], proto TCP (6), length 2044)
    127.0.0.1.9650 > 127.0.0.1.48060: Flags [P.], cksum 0x05f1 (incorrect -> 0x847b), seq 8886:10878, ack 934, win 512, options [nop,nop,TS val 318320167 ecr 318294581], length 1992
2022-04-06 09:07:17.664485 IP (tos 0x0, ttl 64, id 21683, offset 0, flags [DF], proto TCP (6), length 52)
    127.0.0.1.48060 > 127.0.0.1.9650: Flags [.], cksum 0xfe28 (incorrect -> 0xda43), seq 934, ack 10878, win 500, options [nop,nop,TS val 318320167 ecr 318320167], length 0
2022-04-06 09:08:05.370321 IP (tos 0x0, ttl 64, id 63588, offset 0, flags [DF], proto TCP (6), length 83)
    127.0.0.1.9650 > 127.0.0.1.48058: Flags [P.], cksum 0xfe47 (incorrect -> 0x0b11), seq 3768:3799, ack 938, win 512, options [nop,nop,TS val 318367873 ecr 318227601], length 31
2022-04-06 09:08:05.370327 IP (tos 0x0, ttl 64, id 37157, offset 0, flags [DF], proto TCP (6), length 52)
    127.0.0.1.48058 > 127.0.0.1.9650: Flags [.], cksum 0xfe28 (incorrect -> 0x8c11), seq 938, ack 3799, win 512, options [nop,nop,TS val 318367873 ecr 318367873], length 0
2022-04-06 09:08:05.370354 IP (tos 0x0, ttl 64, id 63589, offset 0, flags [DF], proto TCP (6), length 52)
    127.0.0.1.9650 > 127.0.0.1.48058: Flags [F.], cksum 0xfe28 (incorrect -> 0x8c10), seq 3799, ack 938, win 512, options [nop,nop,TS val 318367873 ecr 318367873], length 0
2022-04-06 09:08:05.410660 IP (tos 0x0, ttl 64, id 37158, offset 0, flags [DF], proto TCP (6), length 52)
    127.0.0.1.48058 > 127.0.0.1.9650: Flags [.], cksum 0xfe28 (incorrect -> 0x8be8), seq 938, ack 3800, win 512, options [nop,nop,TS val 318367913 ecr 318367873], length 0
2022-04-06 09:09:53.196328 IP (tos 0x0, ttl 64, id 49892, offset 0, flags [DF], proto TCP (6), length 292)
    127.0.0.1.9650 > 127.0.0.1.48060: Flags [P.], cksum 0xff18 (incorrect -> 0x03c3), seq 10878:11118, ack 934, win 512, options [nop,nop,TS val 318475699 ecr 318320167], length 240
2022-04-06 09:09:53.196344 IP (tos 0x0, ttl 64, id 21684, offset 0, flags [DF], proto TCP (6), length 52)
    127.0.0.1.48060 > 127.0.0.1.9650: Flags [.], cksum 0xfe28 (incorrect -> 0x1a30), seq 934, ack 11118, win 507, options [nop,nop,TS val 318475699 ecr 318475699], length 0
2022-04-06 09:09:54.096512 IP (tos 0x0, ttl 64, id 49893, offset 0, flags [DF], proto TCP (6), length 2044)
    127.0.0.1.9650 > 127.0.0.1.48060: Flags [P.], cksum 0x05f1 (incorrect -> 0xbeb8), seq 11118:13110, ack 934, win 512, options [nop,nop,TS val 318476599 ecr 318475699], length 1992
2022-04-06 09:09:54.096531 IP (tos 0x0, ttl 64, id 21685, offset 0, flags [DF], proto TCP (6), length 52)
    127.0.0.1.48060 > 127.0.0.1.9650: Flags [.], cksum 0xfe28 (incorrect -> 0x0b67), seq 934, ack 13110, win 500, options [nop,nop,TS val 318476599 ecr 318476599], length 0
2022-04-06 09:09:56.300354 IP (tos 0x0, ttl 64, id 49894, offset 0, flags [DF], proto TCP (6), length 2044)
    127.0.0.1.9650 > 127.0.0.1.48060: Flags [P.], cksum 0x05f1 (incorrect -> 0x8b5c), seq 13110:15102, ack 934, win 512, options [nop,nop,TS val 318478803 ecr 318476599], length 1992
2022-04-06 09:09:56.300367 IP (tos 0x0, ttl 64, id 21686, offset 0, flags [DF], proto TCP (6), length 52)
    127.0.0.1.48060 > 127.0.0.1.9650: Flags [.], cksum 0xfe28 (incorrect -> 0xf266), seq 934, ack 15102, win 500, options [nop,nop,TS val 318478803 ecr 318478803], length 0
2022-04-06 09:09:57.150156 IP (tos 0x0, ttl 64, id 49895, offset 0, flags [DF], proto TCP (6), length 3538)
    127.0.0.1.9650 > 127.0.0.1.48060: Flags [P.], cksum 0x0bc7 (incorrect -> 0xa003), seq 15102:18588, ack 934, win 512, options [nop,nop,TS val 318479653 ecr 318478803], length 3486
2022-04-06 09:09:57.150167 IP (tos 0x0, ttl 64, id 21687, offset 0, flags [DF], proto TCP (6), length 52)
    127.0.0.1.48060 > 127.0.0.1.9650: Flags [.], cksum 0xfe28 (incorrect -> 0xde2a), seq 934, ack 18588, win 494, options [nop,nop,TS val 318479653 ecr 318479653], length 0
2022-04-06 09:09:57.151626 IP (tos 0x0, ttl 64, id 49896, offset 0, flags [DF], proto TCP (6), length 3538)
    127.0.0.1.9650 > 127.0.0.1.48060: Flags [P.], cksum 0x0bc7 (incorrect -> 0xad95), seq 18588:22074, ack 934, win 512, options [nop,nop,TS val 318479654 ecr 318479653], length 3486
2022-04-06 09:09:57.151630 IP (tos 0x0, ttl 64, id 21688, offset 0, flags [DF], proto TCP (6), length 52)
    127.0.0.1.48060 > 127.0.0.1.9650: Flags [.], cksum 0xfe28 (incorrect -> 0xd08a), seq 934, ack 22074, win 494, options [nop,nop,TS val 318479654 ecr 318479654], length 0
2022-04-06 09:09:57.167369 IP (tos 0x0, ttl 64, id 49897, offset 0, flags [DF], proto TCP (6), length 2542)
    127.0.0.1.9650 > 127.0.0.1.48060: Flags [P.], cksum 0x07e3 (incorrect -> 0xce87), seq 22074:24564, ack 934, win 512, options [nop,nop,TS val 318479670 ecr 318479654], length 2490
2022-04-06 09:09:57.167374 IP (tos 0x0, ttl 64, id 21689, offset 0, flags [DF], proto TCP (6), length 52)
    127.0.0.1.48060 > 127.0.0.1.9650: Flags [.], cksum 0xfe28 (incorrect -> 0xc6ac), seq 934, ack 24564, win 498, options [nop,nop,TS val 318479670 ecr 318479670], length 0
2022-04-06 09:09:57.173359 IP (tos 0x0, ttl 64, id 49898, offset 0, flags [DF], proto TCP (6), length 3538)
    127.0.0.1.9650 > 127.0.0.1.48060: Flags [P.], cksum 0x0bc7 (incorrect -> 0x4520), seq 24564:28050, ack 934, win 512, options [nop,nop,TS val 318479676 ecr 318479670], length 3486
2022-04-06 09:09:57.173367 IP (tos 0x0, ttl 64, id 21690, offset 0, flags [DF], proto TCP (6), length 52)
    127.0.0.1.48060 > 127.0.0.1.9650: Flags [.], cksum 0xfe28 (incorrect -> 0xb906), seq 934, ack 28050, win 494, options [nop,nop,TS val 318479676 ecr 318479676], length 0
2022-04-06 09:09:57.183209 IP (tos 0x0, ttl 64, id 49899, offset 0, flags [DF], proto TCP (6), length 550)
    127.0.0.1.9650 > 127.0.0.1.48060: Flags [P.], cksum 0x001b (incorrect -> 0xbd4e), seq 28050:28548, ack 934, win 512, options [nop,nop,TS val 318479686 ecr 318479676], length 498
2022-04-06 09:09:57.183214 IP (tos 0x0, ttl 64, id 21691, offset 0, flags [DF], proto TCP (6), length 52)
    127.0.0.1.48060 > 127.0.0.1.9650: Flags [.], cksum 0xfe28 (incorrect -> 0xb6f4), seq 934, ack 28548, win 506, options [nop,nop,TS val 318479686 ecr 318479686], length 0
2022-04-06 09:09:57.201387 IP (tos 0x0, ttl 64, id 49900, offset 0, flags [DF], proto TCP (6), length 2542)
    127.0.0.1.9650 > 127.0.0.1.48060: Flags [P.], cksum 0x07e3 (incorrect -> 0x07f9), seq 28548:31038, ack 934, win 512, options [nop,nop,TS val 318479704 ecr 318479686], length 2490
2022-04-06 09:09:57.201391 IP (tos 0x0, ttl 64, id 21692, offset 0, flags [DF], proto TCP (6), length 52)
    127.0.0.1.48060 > 127.0.0.1.9650: Flags [.], cksum 0xfe28 (incorrect -> 0xad1e), seq 934, ack 31038, win 498, options [nop,nop,TS val 318479704 ecr 318479704], length 0
2022-04-06 09:09:57.244323 IP (tos 0x0, ttl 64, id 49901, offset 0, flags [DF], proto TCP (6), length 2044)
    127.0.0.1.9650 > 127.0.0.1.48060: Flags [P.], cksum 0x05f1 (incorrect -> 0x85c9), seq 31038:33030, ack 934, win 512, options [nop,nop,TS val 318479747 ecr 318479704], length 1992
2022-04-06 09:09:57.244331 IP (tos 0x0, ttl 64, id 21693, offset 0, flags [DF], proto TCP (6), length 52)
    127.0.0.1.48060 > 127.0.0.1.9650: Flags [.], cksum 0xfe28 (incorrect -> 0xa4fe), seq 934, ack 33030, win 500, options [nop,nop,TS val 318479747 ecr 318479747], length 0
2022-04-06 09:09:57.265081 IP (tos 0x0, ttl 64, id 49902, offset 0, flags [DF], proto TCP (6), length 1670)
    127.0.0.1.9650 > 127.0.0.1.48060: Flags [P.], cksum 0x047b (incorrect -> 0xe42b), seq 33030:34648, ack 934, win 512, options [nop,nop,TS val 318479768 ecr 318479747], length 1618
2022-04-06 09:09:57.265088 IP (tos 0x0, ttl 64, id 21694, offset 0, flags [DF], proto TCP (6), length 52)
    127.0.0.1.48060 > 127.0.0.1.9650: Flags [.], cksum 0xfe28 (incorrect -> 0x9e81), seq 934, ack 34648, win 501, options [nop,nop,TS val 318479768 ecr 318479768], length 0
200, 5.132035255432129, 256.77117013931274