2022-04-06 03:15:51.530851 IP (tos 0x0, ttl 64, id 51583, offset 0, flags [DF], proto TCP (6), length 60)
    127.0.0.1.53882 > 127.0.0.1.11750: Flags [S], cksum 0xfe30 (incorrect -> 0x68e8), seq 169761906, win 65495, options [mss 65495,sackOK,TS val 297234033 ecr 0,nop,wscale 7], length 0
2022-04-06 03:15:51.530863 IP (tos 0x0, ttl 64, id 0, offset 0, flags [DF], proto TCP (6), length 60)
    127.0.0.1.11750 > 127.0.0.1.53882: Flags [S.], cksum 0xfe30 (incorrect -> 0x48d9), seq 2382303714, ack 169761907, win 65483, options [mss 65495,sackOK,TS val 297234033 ecr 297234033,nop,wscale 7], length 0
2022-04-06 03:15:51.530872 IP (tos 0x0, ttl 64, id 51584, offset 0, flags [DF], proto TCP (6), length 52)
    127.0.0.1.53882 > 127.0.0.1.11750: Flags [.], cksum 0xfe28 (incorrect -> 0x6f95), seq 1, ack 1, win 512, options [nop,nop,TS val 297234033 ecr 297234033], length 0
2022-04-06 03:15:51.530977 IP (tos 0x0, ttl 64, id 51585, offset 0, flags [DF], proto TCP (6), length 55)
    127.0.0.1.53882 > 127.0.0.1.11750: Flags [P.], cksum 0xfe2b (incorrect -> 0x6a89), seq 1:4, ack 1, win 512, options [nop,nop,TS val 297234033 ecr 297234033], length 3
2022-04-06 03:15:51.530980 IP (tos 0x0, ttl 64, id 62320, offset 0, flags [DF], proto TCP (6), length 52)
    127.0.0.1.11750 > 127.0.0.1.53882: Flags [.], cksum 0xfe28 (incorrect -> 0x6f92), seq 1, ack 4, win 512, options [nop,nop,TS val 297234033 ecr 297234033], length 0
2022-04-06 03:15:51.531083 IP (tos 0x0, ttl 64, id 62321, offset 0, flags [DF], proto TCP (6), length 54)
    127.0.0.1.11750 > 127.0.0.1.53882: Flags [P.], cksum 0xfe2a (incorrect -> 0x6a87), seq 1:3, ack 4, win 512, options [nop,nop,TS val 297234034 ecr 297234033], length 2
2022-04-06 03:15:51.531087 IP (tos 0x0, ttl 64, id 51586, offset 0, flags [DF], proto TCP (6), length 52)
    127.0.0.1.53882 > 127.0.0.1.11750: Flags [.], cksum 0xfe28 (incorrect -> 0x6f8e), seq 4, ack 3, win 512, options [nop,nop,TS val 297234034 ecr 297234034], length 0
2022-04-06 03:15:51.542608 IP (tos 0x0, ttl 64, id 51587, offset 0, flags [DF], proto TCP (6), length 62)
    127.0.0.1.53882 > 127.0.0.1.11750: Flags [P.], cksum 0xfe32 (incorrect -> 0xc4ab), seq 4:14, ack 3, win 512, options [nop,nop,TS val 297234045 ecr 297234034], length 10
2022-04-06 03:15:51.542622 IP (tos 0x0, ttl 64, id 62322, offset 0, flags [DF], proto TCP (6), length 52)
    127.0.0.1.11750 > 127.0.0.1.53882: Flags [.], cksum 0xfe28 (incorrect -> 0x6f6e), seq 3, ack 14, win 512, options [nop,nop,TS val 297234045 ecr 297234045], length 0
2022-04-06 03:15:51.685034 IP (tos 0x0, ttl 64, id 62323, offset 0, flags [DF], proto TCP (6), length 62)
    127.0.0.1.11750 > 127.0.0.1.53882: Flags [P.], cksum 0xfe32 (incorrect -> 0x69cd), seq 3:13, ack 14, win 512, options [nop,nop,TS val 297234187 ecr 297234045], length 10
2022-04-06 03:15:51.685047 IP (tos 0x0, ttl 64, id 51588, offset 0, flags [DF], proto TCP (6), length 52)
    127.0.0.1.53882 > 127.0.0.1.11750: Flags [.], cksum 0xfe28 (incorrect -> 0x6e48), seq 14, ack 13, win 512, options [nop,nop,TS val 297234187 ecr 297234187], length 0
2022-04-06 03:15:51.691424 IP (tos 0x0, ttl 64, id 51589, offset 0, flags [DF], proto TCP (6), length 569)
    127.0.0.1.53882 > 127.0.0.1.11750: Flags [P.], cksum 0x002e (incorrect -> 0x0c7e), seq 14:531, ack 13, win 512, options [nop,nop,TS val 297234194 ecr 297234187], length 517
2022-04-06 03:15:51.691440 IP (tos 0x0, ttl 64, id 62324, offset 0, flags [DF], proto TCP (6), length 52)
    127.0.0.1.11750 > 127.0.0.1.53882: Flags [.], cksum 0xfe28 (incorrect -> 0x6c39), seq 13, ack 531, win 508, options [nop,nop,TS val 297234194 ecr 297234194], length 0
2022-04-06 03:15:51.838301 IP (tos 0x0, ttl 64, id 62325, offset 0, flags [DF], proto TCP (6), length 151)
    127.0.0.1.11750 > 127.0.0.1.53882: Flags [P.], cksum 0xfe8b (incorrect -> 0x1cee), seq 13:112, ack 531, win 512, options [nop,nop,TS val 297234341 ecr 297234194], length 99
2022-04-06 03:15:51.838312 IP (tos 0x0, ttl 64, id 51590, offset 0, flags [DF], proto TCP (6), length 52)
    127.0.0.1.53882 > 127.0.0.1.11750: Flags [.], cksum 0xfe28 (incorrect -> 0x6aac), seq 531, ack 112, win 512, options [nop,nop,TS val 297234341 ecr 297234341], length 0
2022-04-06 03:15:51.838574 IP (tos 0x0, ttl 64, id 51591, offset 0, flags [DF], proto TCP (6), length 575)
    127.0.0.1.53882 > 127.0.0.1.11750: Flags [P.], cksum 0x0034 (incorrect -> 0xd22a), seq 531:1054, ack 112, win 512, options [nop,nop,TS val 297234341 ecr 297234341], length 523
2022-04-06 03:15:51.838580 IP (tos 0x0, ttl 64, id 62326, offset 0, flags [DF], proto TCP (6), length 52)
    127.0.0.1.11750 > 127.0.0.1.53882: Flags [.], cksum 0xfe28 (incorrect -> 0x68a5), seq 112, ack 1054, win 508, options [nop,nop,TS val 297234341 ecr 297234341], length 0
2022-04-06 03:15:51.969303 IP (tos 0x0, ttl 64, id 62327, offset 0, flags [DF], proto TCP (6), length 3538)
    127.0.0.1.11750 > 127.0.0.1.53882: Flags [P.], cksum 0x0bc7 (incorrect -> 0xd749), seq 112:3598, ack 1054, win 512, options [nop,nop,TS val 297234472 ecr 297234341], length 3486
2022-04-06 03:15:51.969311 IP (tos 0x0, ttl 64, id 51592, offset 0, flags [DF], proto TCP (6), length 52)
    127.0.0.1.53882 > 127.0.0.1.11750: Flags [.], cksum 0xfe28 (incorrect -> 0x5a0f), seq 1054, ack 3598, win 494, options [nop,nop,TS val 297234472 ecr 297234472], length 0
2022-04-06 03:15:51.999721 IP (tos 0x0, ttl 64, id 62328, offset 0, flags [DF], proto TCP (6), length 4036)
    127.0.0.1.11750 > 127.0.0.1.53882: Flags [P.], cksum 0x0db9 (incorrect -> 0xc6de), seq 3598:7582, ack 1054, win 512, options [nop,nop,TS val 297234502 ecr 297234472], length 3984
2022-04-06 03:15:51.999727 IP (tos 0x0, ttl 64, id 51593, offset 0, flags [DF], proto TCP (6), length 52)
    127.0.0.1.53882 > 127.0.0.1.11750: Flags [.], cksum 0xfe28 (incorrect -> 0x4a45), seq 1054, ack 7582, win 492, options [nop,nop,TS val 297234502 ecr 297234502], length 0
2022-04-06 03:15:52.016288 IP (tos 0x0, ttl 64, id 62329, offset 0, flags [DF], proto TCP (6), length 2882)
    127.0.0.1.11750 > 127.0.0.1.53882: Flags [P.], cksum 0x0937 (incorrect -> 0x6600), seq 7582:10412, ack 1054, win 512, options [nop,nop,TS val 297234519 ecr 297234502], length 2830
2022-04-06 03:15:52.016302 IP (tos 0x0, ttl 64, id 51594, offset 0, flags [DF], proto TCP (6), length 52)
    127.0.0.1.53882 > 127.0.0.1.11750: Flags [.], cksum 0xfe28 (incorrect -> 0x3f11), seq 1054, ack 10412, win 496, options [nop,nop,TS val 297234519 ecr 297234519], length 0
2022-04-06 03:15:52.016982 IP (tos 0x0, ttl 64, id 51595, offset 0, flags [DF], proto TCP (6), length 126)
    127.0.0.1.53882 > 127.0.0.1.11750: Flags [P.], cksum 0xfe72 (incorrect -> 0x61a4), seq 1054:1128, ack 10412, win 512, options [nop,nop,TS val 297234519 ecr 297234519], length 74
2022-04-06 03:15:52.016990 IP (tos 0x0, ttl 64, id 62330, offset 0, flags [DF], proto TCP (6), length 52)
    127.0.0.1.11750 > 127.0.0.1.53882: Flags [.], cksum 0xfe28 (incorrect -> 0x3eb7), seq 10412, ack 1128, win 512, options [nop,nop,TS val 297234519 ecr 297234519], length 0
2022-04-06 03:15:52.017410 IP (tos 0x0, ttl 64, id 51596, offset 0, flags [DF], proto TCP (6), length 321)
    127.0.0.1.53882 > 127.0.0.1.11750: Flags [P.], cksum 0xff35 (incorrect -> 0x2afe), seq 1128:1397, ack 10412, win 512, options [nop,nop,TS val 297234520 ecr 297234519], length 269
2022-04-06 03:15:52.017414 IP (tos 0x0, ttl 64, id 62331, offset 0, flags [DF], proto TCP (6), length 52)
    127.0.0.1.11750 > 127.0.0.1.53882: Flags [.], cksum 0xfe28 (incorrect -> 0x3daa), seq 10412, ack 1397, win 510, options [nop,nop,TS val 297234520 ecr 297234520], length 0
2022-04-06 03:15:52.163813 IP (tos 0x0, ttl 64, id 62332, offset 0, flags [DF], proto TCP (6), length 626)
    127.0.0.1.11750 > 127.0.0.1.53882: Flags [P.], cksum 0x0067 (incorrect -> 0xf43e), seq 10412:10986, ack 1397, win 512, options [nop,nop,TS val 297234666 ecr 297234520], length 574
2022-04-06 03:15:52.206661 IP (tos 0x0, ttl 64, id 51597, offset 0, flags [DF], proto TCP (6), length 52)
    127.0.0.1.53882 > 127.0.0.1.11750: Flags [.], cksum 0xfe28 (incorrect -> 0x3a1b), seq 1397, ack 10986, win 512, options [nop,nop,TS val 297234709 ecr 297234666], length 0
2022-04-06 03:15:52.616813 IP (tos 0x0, ttl 64, id 62333, offset 0, flags [DF], proto TCP (6), length 4100)
    127.0.0.1.11750 > 127.0.0.1.53882: Flags [P.], cksum 0x0df9 (incorrect -> 0x1b22), seq 10986:15034, ack 1397, win 512, options [nop,nop,TS val 297235119 ecr 297234709], length 4048
2022-04-06 03:15:52.616825 IP (tos 0x0, ttl 64, id 51598, offset 0, flags [DF], proto TCP (6), length 52)
    127.0.0.1.53882 > 127.0.0.1.11750: Flags [.], cksum 0xfe28 (incorrect -> 0x2700), seq 1397, ack 15034, win 492, options [nop,nop,TS val 297235119 ecr 297235119], length 0
2022-04-06 03:15:52.616896 IP (tos 0x0, ttl 64, id 62334, offset 0, flags [DF], proto TCP (6), length 3474)
    127.0.0.1.11750 > 127.0.0.1.53882: Flags [P.], cksum 0x0b87 (incorrect -> 0xaba6), seq 15034:18456, ack 1397, win 512, options [nop,nop,TS val 297235119 ecr 297235119], length 3422
2022-04-06 03:15:52.616899 IP (tos 0x0, ttl 64, id 51599, offset 0, flags [DF], proto TCP (6), length 52)
    127.0.0.1.53882 > 127.0.0.1.11750: Flags [.], cksum 0xfe28 (incorrect -> 0x19a0), seq 1397, ack 18456, win 494, options [nop,nop,TS val 297235119 ecr 297235119], length 0
2022-04-06 03:15:52.647975 IP (tos 0x0, ttl 64, id 62335, offset 0, flags [DF], proto TCP (6), length 2044)
    127.0.0.1.11750 > 127.0.0.1.53882: Flags [P.], cksum 0x05f1 (incorrect -> 0x4a69), seq 18456:20448, ack 1397, win 512, options [nop,nop,TS val 297235150 ecr 297235119], length 1992
2022-04-06 03:15:52.647990 IP (tos 0x0, ttl 64, id 51600, offset 0, flags [DF], proto TCP (6), length 52)
    127.0.0.1.53882 > 127.0.0.1.11750: Flags [.], cksum 0xfe28 (incorrect -> 0x1194), seq 1397, ack 20448, win 500, options [nop,nop,TS val 297235150 ecr 297235150], length 0
2022-04-06 03:15:52.652508 IP (tos 0x0, ttl 64, id 62336, offset 0, flags [DF], proto TCP (6), length 2044)
    127.0.0.1.11750 > 127.0.0.1.53882: Flags [P.], cksum 0x05f1 (incorrect -> 0x425c), seq 20448:22440, ack 1397, win 512, options [nop,nop,TS val 297235155 ecr 297235150], length 1992
2022-04-06 03:15:52.652518 IP (tos 0x0, ttl 64, id 51601, offset 0, flags [DF], proto TCP (6), length 52)
    127.0.0.1.53882 > 127.0.0.1.11750: Flags [.], cksum 0xfe28 (incorrect -> 0x09c2), seq 1397, ack 22440, win 500, options [nop,nop,TS val 297235155 ecr 297235155], length 0
2022-04-06 03:15:52.665185 IP (tos 0x0, ttl 64, id 62337, offset 0, flags [DF], proto TCP (6), length 3538)
    127.0.0.1.11750 > 127.0.0.1.53882: Flags [P.], cksum 0x0bc7 (incorrect -> 0xf61a), seq 22440:25926, ack 1397, win 512, options [nop,nop,TS val 297235168 ecr 297235155], length 3486
2022-04-06 03:15:52.665191 IP (tos 0x0, ttl 64, id 51602, offset 0, flags [DF], proto TCP (6), length 52)
    127.0.0.1.53882 > 127.0.0.1.11750: Flags [.], cksum 0xfe28 (incorrect -> 0xfc0f), seq 1397, ack 25926, win 494, options [nop,nop,TS val 297235168 ecr 297235168], length 0
200, 9.173566818237305, 1.419715166091919