2022-04-06 07:09:38.443908 IP (tos 0x0, ttl 64, id 3690, offset 0, flags [DF], proto TCP (6), length 60)
    127.0.0.1.39072 > 127.0.0.1.11950: Flags [S], cksum 0xfe30 (incorrect -> 0xb359), seq 2345975781, win 65495, options [mss 65495,sackOK,TS val 311260946 ecr 0,nop,wscale 7], length 0
2022-04-06 07:09:38.443918 IP (tos 0x0, ttl 64, id 0, offset 0, flags [DF], proto TCP (6), length 60)
    127.0.0.1.11950 > 127.0.0.1.39072: Flags [S.], cksum 0xfe30 (incorrect -> 0xcf90), seq 523975401, ack 2345975782, win 65483, options [mss 65495,sackOK,TS val 311260946 ecr 311260946,nop,wscale 7], length 0
2022-04-06 07:09:38.443926 IP (tos 0x0, ttl 64, id 3691, offset 0, flags [DF], proto TCP (6), length 52)
    127.0.0.1.39072 > 127.0.0.1.11950: Flags [.], cksum 0xfe28 (incorrect -> 0xf64c), seq 1, ack 1, win 512, options [nop,nop,TS val 311260946 ecr 311260946], length 0
2022-04-06 07:09:38.444070 IP (tos 0x0, ttl 64, id 3692, offset 0, flags [DF], proto TCP (6), length 55)
    127.0.0.1.39072 > 127.0.0.1.11950: Flags [P.], cksum 0xfe2b (incorrect -> 0xf13f), seq 1:4, ack 1, win 512, options [nop,nop,TS val 311260947 ecr 311260946], length 3
2022-04-06 07:09:38.444076 IP (tos 0x0, ttl 64, id 38334, offset 0, flags [DF], proto TCP (6), length 52)
    127.0.0.1.11950 > 127.0.0.1.39072: Flags [.], cksum 0xfe28 (incorrect -> 0xf647), seq 1, ack 4, win 512, options [nop,nop,TS val 311260947 ecr 311260947], length 0
2022-04-06 07:09:38.444098 IP (tos 0x0, ttl 64, id 38335, offset 0, flags [DF], proto TCP (6), length 54)
    127.0.0.1.11950 > 127.0.0.1.39072: Flags [P.], cksum 0xfe2a (incorrect -> 0xf13d), seq 1:3, ack 4, win 512, options [nop,nop,TS val 311260947 ecr 311260947], length 2
2022-04-06 07:09:38.444105 IP (tos 0x0, ttl 64, id 3693, offset 0, flags [DF], proto TCP (6), length 52)
    127.0.0.1.39072 > 127.0.0.1.11950: Flags [.], cksum 0xfe28 (incorrect -> 0xf645), seq 4, ack 3, win 512, options [nop,nop,TS val 311260947 ecr 311260947], length 0
2022-04-06 07:09:38.445317 IP (tos 0x0, ttl 64, id 3694, offset 0, flags [DF], proto TCP (6), length 62)
    127.0.0.1.39072 > 127.0.0.1.11950: Flags [P.], cksum 0xfe32 (incorrect -> 0x8bf8), seq 4:14, ack 3, win 512, options [nop,nop,TS val 311260948 ecr 311260947], length 10
2022-04-06 07:09:38.445331 IP (tos 0x0, ttl 64, id 38336, offset 0, flags [DF], proto TCP (6), length 52)
    127.0.0.1.11950 > 127.0.0.1.39072: Flags [.], cksum 0xfe28 (incorrect -> 0xf639), seq 3, ack 14, win 512, options [nop,nop,TS val 311260948 ecr 311260948], length 0
2022-04-06 07:09:38.513848 IP (tos 0x0, ttl 64, id 38337, offset 0, flags [DF], proto TCP (6), length 62)
    127.0.0.1.11950 > 127.0.0.1.39072: Flags [P.], cksum 0xfe32 (incorrect -> 0xf0e2), seq 3:13, ack 14, win 512, options [nop,nop,TS val 311261016 ecr 311260948], length 10
2022-04-06 07:09:38.513855 IP (tos 0x0, ttl 64, id 3695, offset 0, flags [DF], proto TCP (6), length 52)
    127.0.0.1.39072 > 127.0.0.1.11950: Flags [.], cksum 0xfe28 (incorrect -> 0xf5a7), seq 14, ack 13, win 512, options [nop,nop,TS val 311261016 ecr 311261016], length 0
2022-04-06 07:09:38.519351 IP (tos 0x0, ttl 64, id 3696, offset 0, flags [DF], proto TCP (6), length 569)
    127.0.0.1.39072 > 127.0.0.1.11950: Flags [P.], cksum 0x002e (incorrect -> 0x8406), seq 14:531, ack 13, win 512, options [nop,nop,TS val 311261022 ecr 311261016], length 517
2022-04-06 07:09:38.519359 IP (tos 0x0, ttl 64, id 38338, offset 0, flags [DF], proto TCP (6), length 52)
    127.0.0.1.11950 > 127.0.0.1.39072: Flags [.], cksum 0xfe28 (incorrect -> 0xf39a), seq 13, ack 531, win 508, options [nop,nop,TS val 311261022 ecr 311261022], length 0
2022-04-06 07:09:38.581422 IP (tos 0x0, ttl 64, id 38339, offset 0, flags [DF], proto TCP (6), length 3538)
    127.0.0.1.11950 > 127.0.0.1.39072: Flags [P.], cksum 0x0bc7 (incorrect -> 0xef4a), seq 13:3499, ack 531, win 512, options [nop,nop,TS val 311261084 ecr 311261022], length 3486
2022-04-06 07:09:38.581428 IP (tos 0x0, ttl 64, id 3697, offset 0, flags [DF], proto TCP (6), length 52)
    127.0.0.1.39072 > 127.0.0.1.11950: Flags [.], cksum 0xfe28 (incorrect -> 0xe58e), seq 531, ack 3499, win 494, options [nop,nop,TS val 311261084 ecr 311261084], length 0
2022-04-06 07:09:38.598719 IP (tos 0x0, ttl 64, id 38340, offset 0, flags [DF], proto TCP (6), length 1012)
    127.0.0.1.11950 > 127.0.0.1.39072: Flags [P.], cksum 0x01e9 (incorrect -> 0x24ee), seq 3499:4459, ack 531, win 512, options [nop,nop,TS val 311261101 ecr 311261084], length 960
2022-04-06 07:09:38.598725 IP (tos 0x0, ttl 64, id 3698, offset 0, flags [DF], proto TCP (6), length 52)
    127.0.0.1.39072 > 127.0.0.1.11950: Flags [.], cksum 0xfe28 (incorrect -> 0xe1a2), seq 531, ack 4459, win 504, options [nop,nop,TS val 311261101 ecr 311261101], length 0
2022-04-06 07:09:38.599225 IP (tos 0x0, ttl 64, id 3699, offset 0, flags [DF], proto TCP (6), length 145)
    127.0.0.1.39072 > 127.0.0.1.11950: Flags [P.], cksum 0xfe85 (incorrect -> 0xe319), seq 531:624, ack 4459, win 512, options [nop,nop,TS val 311261102 ecr 311261101], length 93
2022-04-06 07:09:38.599232 IP (tos 0x0, ttl 64, id 38341, offset 0, flags [DF], proto TCP (6), length 52)
    127.0.0.1.11950 > 127.0.0.1.39072: Flags [.], cksum 0xfe28 (incorrect -> 0xe13b), seq 4459, ack 624, win 512, options [nop,nop,TS val 311261102 ecr 311261102], length 0
200, 5.755367279052734, 0.6216859817504883