2022-04-06 06:15:03.594506 IP (tos 0x0, ttl 64, id 44105, offset 0, flags [DF], proto TCP (6), length 60)
    127.0.0.1.55808 > 127.0.0.1.12150: Flags [S], cksum 0xfe30 (incorrect -> 0x2000), seq 3347500535, win 65495, options [mss 65495,sackOK,TS val 307986097 ecr 0,nop,wscale 7], length 0
2022-04-06 06:15:03.594517 IP (tos 0x0, ttl 64, id 0, offset 0, flags [DF], proto TCP (6), length 60)
    127.0.0.1.12150 > 127.0.0.1.55808: Flags [S.], cksum 0xfe30 (incorrect -> 0xb25c), seq 2299351940, ack 3347500536, win 65483, options [mss 65495,sackOK,TS val 307986097 ecr 307986097,nop,wscale 7], length 0
2022-04-06 06:15:03.594529 IP (tos 0x0, ttl 64, id 44106, offset 0, flags [DF], proto TCP (6), length 52)
    127.0.0.1.55808 > 127.0.0.1.12150: Flags [.], cksum 0xfe28 (incorrect -> 0xd918), seq 1, ack 1, win 512, options [nop,nop,TS val 307986097 ecr 307986097], length 0
2022-04-06 06:15:03.594631 IP (tos 0x0, ttl 64, id 44107, offset 0, flags [DF], proto TCP (6), length 55)
    127.0.0.1.55808 > 127.0.0.1.12150: Flags [P.], cksum 0xfe2b (incorrect -> 0xd40c), seq 1:4, ack 1, win 512, options [nop,nop,TS val 307986097 ecr 307986097], length 3
2022-04-06 06:15:03.594653 IP (tos 0x0, ttl 64, id 25516, offset 0, flags [DF], proto TCP (6), length 52)
    127.0.0.1.12150 > 127.0.0.1.55808: Flags [.], cksum 0xfe28 (incorrect -> 0xd915), seq 1, ack 4, win 512, options [nop,nop,TS val 307986097 ecr 307986097], length 0
2022-04-06 06:15:03.594769 IP (tos 0x0, ttl 64, id 25517, offset 0, flags [DF], proto TCP (6), length 54)
    127.0.0.1.12150 > 127.0.0.1.55808: Flags [P.], cksum 0xfe2a (incorrect -> 0xd40b), seq 1:3, ack 4, win 512, options [nop,nop,TS val 307986097 ecr 307986097], length 2
2022-04-06 06:15:03.594798 IP (tos 0x0, ttl 64, id 44108, offset 0, flags [DF], proto TCP (6), length 52)
    127.0.0.1.55808 > 127.0.0.1.12150: Flags [.], cksum 0xfe28 (incorrect -> 0xd913), seq 4, ack 3, win 512, options [nop,nop,TS val 307986097 ecr 307986097], length 0
2022-04-06 06:15:03.606614 IP (tos 0x0, ttl 64, id 44109, offset 0, flags [DF], proto TCP (6), length 62)
    127.0.0.1.55808 > 127.0.0.1.12150: Flags [P.], cksum 0xfe32 (incorrect -> 0x44c0), seq 4:14, ack 3, win 512, options [nop,nop,TS val 307986109 ecr 307986097], length 10
2022-04-06 06:15:03.606633 IP (tos 0x0, ttl 64, id 25518, offset 0, flags [DF], proto TCP (6), length 52)
    127.0.0.1.12150 > 127.0.0.1.55808: Flags [.], cksum 0xfe28 (incorrect -> 0xd8f1), seq 3, ack 14, win 512, options [nop,nop,TS val 307986109 ecr 307986109], length 0
2022-04-06 06:15:03.691079 IP (tos 0x0, ttl 64, id 25519, offset 0, flags [DF], proto TCP (6), length 62)
    127.0.0.1.12150 > 127.0.0.1.55808: Flags [P.], cksum 0xfe32 (incorrect -> 0xd38a), seq 3:13, ack 14, win 512, options [nop,nop,TS val 307986193 ecr 307986109], length 10
2022-04-06 06:15:03.691099 IP (tos 0x0, ttl 64, id 44110, offset 0, flags [DF], proto TCP (6), length 52)
    127.0.0.1.55808 > 127.0.0.1.12150: Flags [.], cksum 0xfe28 (incorrect -> 0xd83e), seq 14, ack 13, win 512, options [nop,nop,TS val 307986194 ecr 307986193], length 0
2022-04-06 06:15:03.697114 IP (tos 0x0, ttl 64, id 44111, offset 0, flags [DF], proto TCP (6), length 569)
    127.0.0.1.55808 > 127.0.0.1.12150: Flags [P.], cksum 0x002e (incorrect -> 0x120b), seq 14:531, ack 13, win 512, options [nop,nop,TS val 307986200 ecr 307986193], length 517
2022-04-06 06:15:03.697125 IP (tos 0x0, ttl 64, id 25520, offset 0, flags [DF], proto TCP (6), length 52)
    127.0.0.1.12150 > 127.0.0.1.55808: Flags [.], cksum 0xfe28 (incorrect -> 0xd630), seq 13, ack 531, win 508, options [nop,nop,TS val 307986200 ecr 307986200], length 0
2022-04-06 06:15:03.779686 IP (tos 0x0, ttl 64, id 25521, offset 0, flags [DF], proto TCP (6), length 3096)
    127.0.0.1.12150 > 127.0.0.1.55808: Flags [P.], cksum 0x0a0d (incorrect -> 0x6958), seq 13:3057, ack 531, win 512, options [nop,nop,TS val 307986282 ecr 307986200], length 3044
2022-04-06 06:15:03.779696 IP (tos 0x0, ttl 64, id 44112, offset 0, flags [DF], proto TCP (6), length 52)
    127.0.0.1.55808 > 127.0.0.1.12150: Flags [.], cksum 0xfe28 (incorrect -> 0xc9b4), seq 531, ack 3057, win 496, options [nop,nop,TS val 307986282 ecr 307986282], length 0
2022-04-06 06:15:03.780235 IP (tos 0x0, ttl 64, id 44113, offset 0, flags [DF], proto TCP (6), length 132)
    127.0.0.1.55808 > 127.0.0.1.12150: Flags [P.], cksum 0xfe78 (incorrect -> 0xb391), seq 531:611, ack 3057, win 512, options [nop,nop,TS val 307986283 ecr 307986282], length 80
2022-04-06 06:15:03.780245 IP (tos 0x0, ttl 64, id 25522, offset 0, flags [DF], proto TCP (6), length 52)
    127.0.0.1.12150 > 127.0.0.1.55808: Flags [.], cksum 0xfe28 (incorrect -> 0xc952), seq 3057, ack 611, win 512, options [nop,nop,TS val 307986283 ecr 307986283], length 0
2022-04-06 06:15:03.780650 IP (tos 0x0, ttl 64, id 44114, offset 0, flags [DF], proto TCP (6), length 351)
    127.0.0.1.55808 > 127.0.0.1.12150: Flags [P.], cksum 0xff53 (incorrect -> 0x6f61), seq 611:910, ack 3057, win 512, options [nop,nop,TS val 307986283 ecr 307986283], length 299
2022-04-06 06:15:03.780660 IP (tos 0x0, ttl 64, id 25523, offset 0, flags [DF], proto TCP (6), length 52)
    127.0.0.1.12150 > 127.0.0.1.55808: Flags [.], cksum 0xfe28 (incorrect -> 0xc829), seq 3057, ack 910, win 510, options [nop,nop,TS val 307986283 ecr 307986283], length 0
2022-04-06 06:15:03.855530 IP (tos 0x0, ttl 64, id 25524, offset 0, flags [DF], proto TCP (6), length 323)
    127.0.0.1.12150 > 127.0.0.1.55808: Flags [P.], cksum 0xff37 (incorrect -> 0x9203), seq 3057:3328, ack 910, win 512, options [nop,nop,TS val 307986358 ecr 307986283], length 271
2022-04-06 06:15:03.898672 IP (tos 0x0, ttl 64, id 44115, offset 0, flags [DF], proto TCP (6), length 52)
    127.0.0.1.55808 > 127.0.0.1.12150: Flags [.], cksum 0xfe28 (incorrect -> 0xc657), seq 910, ack 3328, win 512, options [nop,nop,TS val 307986401 ecr 307986358], length 0
2022-04-06 06:15:03.898685 IP (tos 0x0, ttl 64, id 25525, offset 0, flags [DF], proto TCP (6), length 6797)
    127.0.0.1.12150 > 127.0.0.1.55808: Flags [P.], cksum 0x1882 (incorrect -> 0x311d), seq 3328:10073, ack 910, win 512, options [nop,nop,TS val 307986401 ecr 307986401], length 6745
2022-04-06 06:15:03.898692 IP (tos 0x0, ttl 64, id 44116, offset 0, flags [DF], proto TCP (6), length 52)
    127.0.0.1.55808 > 127.0.0.1.12150: Flags [.], cksum 0xfe28 (incorrect -> 0xabf2), seq 910, ack 10073, win 481, options [nop,nop,TS val 307986401 ecr 307986401], length 0
2022-04-06 06:15:03.898736 IP (tos 0x0, ttl 64, id 25526, offset 0, flags [DF], proto TCP (6), length 1048)
    127.0.0.1.12150 > 127.0.0.1.55808: Flags [P.], cksum 0x020d (incorrect -> 0xba59), seq 10073:11069, ack 910, win 512, options [nop,nop,TS val 307986401 ecr 307986401], length 996
2022-04-06 06:15:03.898742 IP (tos 0x0, ttl 64, id 44117, offset 0, flags [DF], proto TCP (6), length 52)
    127.0.0.1.55808 > 127.0.0.1.12150: Flags [.], cksum 0xfe28 (incorrect -> 0xa812), seq 910, ack 11069, win 477, options [nop,nop,TS val 307986401 ecr 307986401], length 0
2022-04-06 06:15:03.915198 IP (tos 0x0, ttl 64, id 25527, offset 0, flags [DF], proto TCP (6), length 4036)
    127.0.0.1.12150 > 127.0.0.1.55808: Flags [P.], cksum 0x0db9 (incorrect -> 0x4835), seq 11069:15053, ack 910, win 512, options [nop,nop,TS val 307986418 ecr 307986401], length 3984
2022-04-06 06:15:03.915215 IP (tos 0x0, ttl 64, id 44118, offset 0, flags [DF], proto TCP (6), length 52)
    127.0.0.1.55808 > 127.0.0.1.12150: Flags [.], cksum 0xfe28 (incorrect -> 0x9851), seq 910, ack 15053, win 492, options [nop,nop,TS val 307986418 ecr 307986418], length 0
2022-04-06 06:15:03.926082 IP (tos 0x0, ttl 64, id 25528, offset 0, flags [DF], proto TCP (6), length 4100)
    127.0.0.1.12150 > 127.0.0.1.55808: Flags [P.], cksum 0x0df9 (incorrect -> 0xd202), seq 15053:19101, ack 910, win 512, options [nop,nop,TS val 307986429 ecr 307986418], length 4048
2022-04-06 06:15:03.926090 IP (tos 0x0, ttl 64, id 44119, offset 0, flags [DF], proto TCP (6), length 52)
    127.0.0.1.55808 > 127.0.0.1.12150: Flags [.], cksum 0xfe28 (incorrect -> 0x886b), seq 910, ack 19101, win 492, options [nop,nop,TS val 307986429 ecr 307986429], length 0
2022-04-06 06:15:03.926098 IP (tos 0x0, ttl 64, id 25529, offset 0, flags [DF], proto TCP (6), length 984)
    127.0.0.1.12150 > 127.0.0.1.55808: Flags [P.], cksum 0x01cd (incorrect -> 0xdbec), seq 19101:20033, ack 910, win 512, options [nop,nop,TS val 307986429 ecr 307986429], length 932
2022-04-06 06:15:03.926103 IP (tos 0x0, ttl 64, id 44120, offset 0, flags [DF], proto TCP (6), length 52)
    127.0.0.1.55808 > 127.0.0.1.12150: Flags [.], cksum 0xfe28 (incorrect -> 0x84cb), seq 910, ack 20033, win 488, options [nop,nop,TS val 307986429 ecr 307986429], length 0
2022-04-06 06:15:03.926146 IP (tos 0x0, ttl 64, id 25530, offset 0, flags [DF], proto TCP (6), length 3096)
    127.0.0.1.12150 > 127.0.0.1.55808: Flags [P.], cksum 0x0a0d (incorrect -> 0xcbdc), seq 20033:23077, ack 910, win 512, options [nop,nop,TS val 307986429 ecr 307986429], length 3044
2022-04-06 06:15:03.926151 IP (tos 0x0, ttl 64, id 44121, offset 0, flags [DF], proto TCP (6), length 52)
    127.0.0.1.55808 > 127.0.0.1.12150: Flags [.], cksum 0xfe28 (incorrect -> 0x78f3), seq 910, ack 23077, win 476, options [nop,nop,TS val 307986429 ecr 307986429], length 0
2022-04-06 06:15:03.929202 IP (tos 0x0, ttl 64, id 25531, offset 0, flags [DF], proto TCP (6), length 4100)
    127.0.0.1.12150 > 127.0.0.1.55808: Flags [P.], cksum 0x0df9 (incorrect -> 0x585c), seq 23077:27125, ack 910, win 512, options [nop,nop,TS val 307986432 ecr 307986429], length 4048
2022-04-06 06:15:03.929212 IP (tos 0x0, ttl 64, id 44122, offset 0, flags [DF], proto TCP (6), length 52)
    127.0.0.1.55808 > 127.0.0.1.12150: Flags [.], cksum 0xfe28 (incorrect -> 0x690d), seq 910, ack 27125, win 492, options [nop,nop,TS val 307986432 ecr 307986432], length 0
2022-04-06 06:15:03.929221 IP (tos 0x0, ttl 64, id 25532, offset 0, flags [DF], proto TCP (6), length 3304)
    127.0.0.1.12150 > 127.0.0.1.55808: Flags [P.], cksum 0x0add (incorrect -> 0xc758), seq 27125:30377, ack 910, win 512, options [nop,nop,TS val 307986432 ecr 307986432], length 3252
2022-04-06 06:15:03.929226 IP (tos 0x0, ttl 64, id 44123, offset 0, flags [DF], proto TCP (6), length 52)
    127.0.0.1.55808 > 127.0.0.1.12150: Flags [.], cksum 0xfe28 (incorrect -> 0x5c66), seq 910, ack 30377, win 479, options [nop,nop,TS val 307986432 ecr 307986432], length 0
2022-04-06 06:15:03.929260 IP (tos 0x0, ttl 64, id 25533, offset 0, flags [DF], proto TCP (6), length 3470)
    127.0.0.1.12150 > 127.0.0.1.55808: Flags [P.], cksum 0x0b83 (incorrect -> 0xbbcf), seq 30377:33795, ack 910, win 512, options [nop,nop,TS val 307986432 ecr 307986432], length 3418
2022-04-06 06:15:03.929275 IP (tos 0x0, ttl 64, id 44124, offset 0, flags [DF], proto TCP (6), length 52)
    127.0.0.1.55808 > 127.0.0.1.12150: Flags [.], cksum 0xfe28 (incorrect -> 0x4eeb), seq 910, ack 33795, win 512, options [nop,nop,TS val 307986432 ecr 307986432], length 0
2022-04-06 06:15:03.940115 IP (tos 0x0, ttl 64, id 25534, offset 0, flags [DF], proto TCP (6), length 3968)
    127.0.0.1.12150 > 127.0.0.1.55808: Flags [P.], cksum 0x0d75 (incorrect -> 0x63c5), seq 33795:37711, ack 910, win 512, options [nop,nop,TS val 307986443 ecr 307986432], length 3916
2022-04-06 06:15:03.940782 IP (tos 0x0, ttl 64, id 44125, offset 0, flags [DF], proto TCP (6), length 52)
    127.0.0.1.55808 > 127.0.0.1.12150: Flags [.], cksum 0xfe28 (incorrect -> 0x3f89), seq 910, ack 37711, win 512, options [nop,nop,TS val 307986443 ecr 307986443], length 0
2022-04-06 06:15:03.951342 IP (tos 0x0, ttl 64, id 25535, offset 0, flags [DF], proto TCP (6), length 4100)
    127.0.0.1.12150 > 127.0.0.1.55808: Flags [P.], cksum 0x0df9 (incorrect -> 0xf76d), seq 37711:41759, ack 910, win 512, options [nop,nop,TS val 307986454 ecr 307986443], length 4048
2022-04-06 06:15:03.951474 IP (tos 0x0, ttl 64, id 44126, offset 0, flags [DF], proto TCP (6), length 52)
    127.0.0.1.55808 > 127.0.0.1.12150: Flags [.], cksum 0xfe28 (incorrect -> 0x2fa3), seq 910, ack 41759, win 512, options [nop,nop,TS val 307986454 ecr 307986454], length 0
2022-04-06 06:15:03.951482 IP (tos 0x0, ttl 64, id 25536, offset 0, flags [DF], proto TCP (6), length 6190)
    127.0.0.1.12150 > 127.0.0.1.55808: Flags [P.], cksum 0x1623 (incorrect -> 0x2101), seq 41759:47897, ack 910, win 512, options [nop,nop,TS val 307986454 ecr 307986454], length 6138
2022-04-06 06:15:03.951488 IP (tos 0x0, ttl 64, id 44127, offset 0, flags [DF], proto TCP (6), length 52)
    127.0.0.1.55808 > 127.0.0.1.12150: Flags [.], cksum 0xfe28 (incorrect -> 0x17a9), seq 910, ack 47897, win 512, options [nop,nop,TS val 307986454 ecr 307986454], length 0
2022-04-06 06:15:03.952880 IP (tos 0x0, ttl 64, id 25537, offset 0, flags [DF], proto TCP (6), length 3968)
    127.0.0.1.12150 > 127.0.0.1.55808: Flags [P.], cksum 0x0d75 (incorrect -> 0x9b68), seq 47897:51813, ack 910, win 512, options [nop,nop,TS val 307986455 ecr 307986454], length 3916
2022-04-06 06:15:03.952895 IP (tos 0x0, ttl 64, id 44128, offset 0, flags [DF], proto TCP (6), length 52)
    127.0.0.1.55808 > 127.0.0.1.12150: Flags [.], cksum 0xfe28 (incorrect -> 0x085b), seq 910, ack 51813, win 512, options [nop,nop,TS val 307986455 ecr 307986455], length 0
2022-04-06 06:15:03.953951 IP (tos 0x0, ttl 64, id 25538, offset 0, flags [DF], proto TCP (6), length 4100)
    127.0.0.1.12150 > 127.0.0.1.55808: Flags [P.], cksum 0x0df9 (incorrect -> 0xc36c), seq 51813:55861, ack 910, win 512, options [nop,nop,TS val 307986456 ecr 307986455], length 4048
2022-04-06 06:15:03.954223 IP (tos 0x0, ttl 64, id 44129, offset 0, flags [DF], proto TCP (6), length 52)
    127.0.0.1.55808 > 127.0.0.1.12150: Flags [.], cksum 0xfe28 (incorrect -> 0xf887), seq 910, ack 55861, win 512, options [nop,nop,TS val 307986457 ecr 307986456], length 0
2022-04-06 06:15:03.954230 IP (tos 0x0, ttl 64, id 25539, offset 0, flags [DF], proto TCP (6), length 350)
    127.0.0.1.12150 > 127.0.0.1.55808: Flags [P.], cksum 0xff52 (incorrect -> 0xda10), seq 55861:56159, ack 910, win 512, options [nop,nop,TS val 307986457 ecr 307986457], length 298
2022-04-06 06:15:03.954236 IP (tos 0x0, ttl 64, id 44130, offset 0, flags [DF], proto TCP (6), length 52)
    127.0.0.1.55808 > 127.0.0.1.12150: Flags [.], cksum 0xfe28 (incorrect -> 0xf75c), seq 910, ack 56159, win 512, options [nop,nop,TS val 307986457 ecr 307986457], length 0
2022-04-06 06:15:03.956547 IP (tos 0x0, ttl 64, id 25540, offset 0, flags [DF], proto TCP (6), length 3470)
    127.0.0.1.12150 > 127.0.0.1.55808: Flags [P.], cksum 0x0b83 (incorrect -> 0xc655), seq 56159:59577, ack 910, win 512, options [nop,nop,TS val 307986459 ecr 307986457], length 3418
2022-04-06 06:15:03.956564 IP (tos 0x0, ttl 64, id 44131, offset 0, flags [DF], proto TCP (6), length 52)
    127.0.0.1.55808 > 127.0.0.1.12150: Flags [.], cksum 0xfe28 (incorrect -> 0xe9fe), seq 910, ack 59577, win 512, options [nop,nop,TS val 307986459 ecr 307986459], length 0
2022-04-06 06:15:03.956633 IP (tos 0x0, ttl 64, id 25541, offset 0, flags [DF], proto TCP (6), length 4100)
    127.0.0.1.12150 > 127.0.0.1.55808: Flags [P.], cksum 0x0df9 (incorrect -> 0x25d2), seq 59577:63625, ack 910, win 512, options [nop,nop,TS val 307986459 ecr 307986459], length 4048
2022-04-06 06:15:03.956654 IP (tos 0x0, ttl 64, id 44132, offset 0, flags [DF], proto TCP (6), length 52)
    127.0.0.1.55808 > 127.0.0.1.12150: Flags [.], cksum 0xfe28 (incorrect -> 0xda2e), seq 910, ack 63625, win 512, options [nop,nop,TS val 307986459 ecr 307986459], length 0
2022-04-06 06:15:03.956665 IP (tos 0x0, ttl 64, id 25542, offset 0, flags [DF], proto TCP (6), length 3304)
    127.0.0.1.12150 > 127.0.0.1.55808: Flags [P.], cksum 0x0add (incorrect -> 0x5ac6), seq 63625:66877, ack 910, win 512, options [nop,nop,TS val 307986459 ecr 307986459], length 3252
2022-04-06 06:15:03.956708 IP (tos 0x0, ttl 64, id 44133, offset 0, flags [DF], proto TCP (6), length 52)
    127.0.0.1.55808 > 127.0.0.1.12150: Flags [.], cksum 0xfe28 (incorrect -> 0xcd7a), seq 910, ack 66877, win 512, options [nop,nop,TS val 307986459 ecr 307986459], length 0
2022-04-06 06:15:03.956714 IP (tos 0x0, ttl 64, id 25543, offset 0, flags [DF], proto TCP (6), length 3934)
    127.0.0.1.12150 > 127.0.0.1.55808: Flags [P.], cksum 0x0d53 (incorrect -> 0x7752), seq 66877:70759, ack 910, win 512, options [nop,nop,TS val 307986459 ecr 307986459], length 3882
2022-04-06 06:15:03.957205 IP (tos 0x0, ttl 64, id 44134, offset 0, flags [DF], proto TCP (6), length 52)
    127.0.0.1.55808 > 127.0.0.1.12150: Flags [.], cksum 0xfe28 (incorrect -> 0xbe4f), seq 910, ack 70759, win 512, options [nop,nop,TS val 307986460 ecr 307986459], length 0
2022-04-06 06:15:03.957612 IP (tos 0x0, ttl 64, id 25544, offset 0, flags [DF], proto TCP (6), length 4100)
    127.0.0.1.12150 > 127.0.0.1.55808: Flags [P.], cksum 0x0df9 (incorrect -> 0x7d8f), seq 70759:74807, ack 910, win 512, options [nop,nop,TS val 307986460 ecr 307986460], length 4048
2022-04-06 06:15:03.957655 IP (tos 0x0, ttl 64, id 44135, offset 0, flags [DF], proto TCP (6), length 52)
    127.0.0.1.55808 > 127.0.0.1.12150: Flags [.], cksum 0xfe28 (incorrect -> 0xae7e), seq 910, ack 74807, win 512, options [nop,nop,TS val 307986460 ecr 307986460], length 0
2022-04-06 06:15:03.957661 IP (tos 0x0, ttl 64, id 25545, offset 0, flags [DF], proto TCP (6), length 3802)
    127.0.0.1.12150 > 127.0.0.1.55808: Flags [P.], cksum 0x0ccf (incorrect -> 0xcbd6), seq 74807:78557, ack 910, win 512, options [nop,nop,TS val 307986460 ecr 307986460], length 3750
2022-04-06 06:15:03.957667 IP (tos 0x0, ttl 64, id 44136, offset 0, flags [DF], proto TCP (6), length 52)
    127.0.0.1.55808 > 127.0.0.1.12150: Flags [.], cksum 0xfe28 (incorrect -> 0x9fd8), seq 910, ack 78557, win 512, options [nop,nop,TS val 307986460 ecr 307986460], length 0
2022-04-06 06:15:03.957730 IP (tos 0x0, ttl 64, id 25546, offset 0, flags [DF], proto TCP (6), length 1512)
    127.0.0.1.12150 > 127.0.0.1.55808: Flags [P.], cksum 0x03dd (incorrect -> 0x05bf), seq 78557:80017, ack 910, win 512, options [nop,nop,TS val 307986460 ecr 307986460], length 1460
2022-04-06 06:15:03.957744 IP (tos 0x0, ttl 64, id 44137, offset 0, flags [DF], proto TCP (6), length 52)
    127.0.0.1.55808 > 127.0.0.1.12150: Flags [.], cksum 0xfe28 (incorrect -> 0x9a24), seq 910, ack 80017, win 512, options [nop,nop,TS val 307986460 ecr 307986460], length 0
2022-04-06 06:15:03.965205 IP (tos 0x0, ttl 64, id 25547, offset 0, flags [DF], proto TCP (6), length 4100)
    127.0.0.1.12150 > 127.0.0.1.55808: Flags [P.], cksum 0x0df9 (incorrect -> 0xf552), seq 80017:84065, ack 910, win 512, options [nop,nop,TS val 307986468 ecr 307986460], length 4048
2022-04-06 06:15:03.965533 IP (tos 0x0, ttl 64, id 44138, offset 0, flags [DF], proto TCP (6), length 52)
    127.0.0.1.55808 > 127.0.0.1.12150: Flags [.], cksum 0xfe28 (incorrect -> 0x8a44), seq 910, ack 84065, win 512, options [nop,nop,TS val 307986468 ecr 307986468], length 0
2022-04-06 06:15:03.965540 IP (tos 0x0, ttl 64, id 25548, offset 0, flags [DF], proto TCP (6), length 5262)
    127.0.0.1.12150 > 127.0.0.1.55808: Flags [P.], cksum 0x1283 (incorrect -> 0x6a74), seq 84065:89275, ack 910, win 512, options [nop,nop,TS val 307986468 ecr 307986468], length 5210
2022-04-06 06:15:03.965547 IP (tos 0x0, ttl 64, id 44139, offset 0, flags [DF], proto TCP (6), length 52)
    127.0.0.1.55808 > 127.0.0.1.12150: Flags [.], cksum 0xfe28 (incorrect -> 0x75ea), seq 910, ack 89275, win 512, options [nop,nop,TS val 307986468 ecr 307986468], length 0
2022-04-06 06:15:03.968807 IP (tos 0x0, ttl 64, id 25549, offset 0, flags [DF], proto TCP (6), length 3968)
    127.0.0.1.12150 > 127.0.0.1.55808: Flags [P.], cksum 0x0d75 (incorrect -> 0x333a), seq 89275:93191, ack 910, win 512, options [nop,nop,TS val 307986471 ecr 307986468], length 3916
2022-04-06 06:15:03.968824 IP (tos 0x0, ttl 64, id 44140, offset 0, flags [DF], proto TCP (6), length 52)
    127.0.0.1.55808 > 127.0.0.1.12150: Flags [.], cksum 0xfe28 (incorrect -> 0x6698), seq 910, ack 93191, win 512, options [nop,nop,TS val 307986471 ecr 307986471], length 0
2022-04-06 06:15:03.977138 IP (tos 0x0, ttl 64, id 25550, offset 0, flags [DF], proto TCP (6), length 3934)
    127.0.0.1.12150 > 127.0.0.1.55808: Flags [P.], cksum 0x0d53 (incorrect -> 0x5400), seq 93191:97073, ack 910, win 512, options [nop,nop,TS val 307986480 ecr 307986471], length 3882
2022-04-06 06:15:03.977214 IP (tos 0x0, ttl 64, id 44141, offset 0, flags [DF], proto TCP (6), length 52)
    127.0.0.1.55808 > 127.0.0.1.12150: Flags [.], cksum 0xfe28 (incorrect -> 0x575c), seq 910, ack 97073, win 512, options [nop,nop,TS val 307986480 ecr 307986480], length 0
2022-04-06 06:15:03.977229 IP (tos 0x0, ttl 64, id 25551, offset 0, flags [DF], proto TCP (6), length 3436)
    127.0.0.1.12150 > 127.0.0.1.55808: Flags [P.], cksum 0x0b61 (incorrect -> 0xbe30), seq 97073:100457, ack 910, win 512, options [nop,nop,TS val 307986480 ecr 307986480], length 3384
2022-04-06 06:15:03.978079 IP (tos 0x0, ttl 64, id 44142, offset 0, flags [DF], proto TCP (6), length 52)
    127.0.0.1.55808 > 127.0.0.1.12150: Flags [.], cksum 0xfe28 (incorrect -> 0x4a23), seq 910, ack 100457, win 512, options [nop,nop,TS val 307986481 ecr 307986480], length 0
2022-04-06 06:15:03.978088 IP (tos 0x0, ttl 64, id 25552, offset 0, flags [DF], proto TCP (6), length 4432)
    127.0.0.1.12150 > 127.0.0.1.55808: Flags [P.], cksum 0x0f45 (incorrect -> 0x36d3), seq 100457:104837, ack 910, win 512, options [nop,nop,TS val 307986481 ecr 307986481], length 4380
2022-04-06 06:15:03.978095 IP (tos 0x0, ttl 64, id 44143, offset 0, flags [DF], proto TCP (6), length 52)
    127.0.0.1.55808 > 127.0.0.1.12150: Flags [.], cksum 0xfe28 (incorrect -> 0x3906), seq 910, ack 104837, win 512, options [nop,nop,TS val 307986481 ecr 307986481], length 0
2022-04-06 06:15:03.978690 IP (tos 0x0, ttl 64, id 25553, offset 0, flags [DF], proto TCP (6), length 4100)
    127.0.0.1.12150 > 127.0.0.1.55808: Flags [P.], cksum 0x0df9 (incorrect -> 0x6205), seq 104837:108885, ack 910, win 512, options [nop,nop,TS val 307986481 ecr 307986481], length 4048
2022-04-06 06:15:03.979024 IP (tos 0x0, ttl 64, id 44144, offset 0, flags [DF], proto TCP (6), length 52)
    127.0.0.1.55808 > 127.0.0.1.12150: Flags [.], cksum 0xfe28 (incorrect -> 0x2936), seq 910, ack 108885, win 512, options [nop,nop,TS val 307986481 ecr 307986481], length 0
2022-04-06 06:15:03.979031 IP (tos 0x0, ttl 64, id 25554, offset 0, flags [DF], proto TCP (6), length 2840)
    127.0.0.1.12150 > 127.0.0.1.55808: Flags [P.], cksum 0x090d (incorrect -> 0x5119), seq 108885:111673, ack 910, win 512, options [nop,nop,TS val 307986481 ecr 307986481], length 2788
2022-04-06 06:15:03.979037 IP (tos 0x0, ttl 64, id 44145, offset 0, flags [DF], proto TCP (6), length 52)
    127.0.0.1.55808 > 127.0.0.1.12150: Flags [.], cksum 0xfe28 (incorrect -> 0x1e52), seq 910, ack 111673, win 512, options [nop,nop,TS val 307986481 ecr 307986481], length 0
2022-04-06 06:15:03.980489 IP (tos 0x0, ttl 64, id 25555, offset 0, flags [DF], proto TCP (6), length 1048)
    127.0.0.1.12150 > 127.0.0.1.55808: Flags [P.], cksum 0x020d (incorrect -> 0x2a24), seq 111673:112669, ack 910, win 512, options [nop,nop,TS val 307986483 ecr 307986481], length 996
2022-04-06 06:15:03.980505 IP (tos 0x0, ttl 64, id 44146, offset 0, flags [DF], proto TCP (6), length 52)
    127.0.0.1.55808 > 127.0.0.1.12150: Flags [.], cksum 0xfe28 (incorrect -> 0x1a6a), seq 910, ack 112669, win 512, options [nop,nop,TS val 307986483 ecr 307986483], length 0
2022-04-06 06:15:03.980577 IP (tos 0x0, ttl 64, id 25556, offset 0, flags [DF], proto TCP (6), length 4100)
    127.0.0.1.12150 > 127.0.0.1.55808: Flags [P.], cksum 0x0df9 (incorrect -> 0x0733), seq 112669:116717, ack 910, win 512, options [nop,nop,TS val 307986483 ecr 307986483], length 4048
2022-04-06 06:15:03.980597 IP (tos 0x0, ttl 64, id 44147, offset 0, flags [DF], proto TCP (6), length 52)
    127.0.0.1.55808 > 127.0.0.1.12150: Flags [.], cksum 0xfe28 (incorrect -> 0x0a9a), seq 910, ack 116717, win 512, options [nop,nop,TS val 307986483 ecr 307986483], length 0
200, 3.870374917984009, 0.4074287414550781