2022-04-06 22:05:22.839062 IP (tos 0x0, ttl 64, id 55345, offset 0, flags [DF], proto TCP (6), length 60)
    127.0.0.1.55938 > 127.0.0.1.11050: Flags [S], cksum 0xfe30 (incorrect -> 0xd281), seq 1621063509, win 65495, options [mss 65495,sackOK,TS val 365005341 ecr 0,nop,wscale 7], length 0
2022-04-06 22:05:22.839075 IP (tos 0x0, ttl 64, id 0, offset 0, flags [DF], proto TCP (6), length 60)
    127.0.0.1.11050 > 127.0.0.1.55938: Flags [S.], cksum 0xfe30 (incorrect -> 0x4522), seq 2490784004, ack 1621063510, win 65483, options [mss 65495,sackOK,TS val 365005342 ecr 365005341,nop,wscale 7], length 0
2022-04-06 22:05:22.839085 IP (tos 0x0, ttl 64, id 55346, offset 0, flags [DF], proto TCP (6), length 52)
    127.0.0.1.55938 > 127.0.0.1.11050: Flags [.], cksum 0xfe28 (incorrect -> 0x6bdd), seq 1, ack 1, win 512, options [nop,nop,TS val 365005342 ecr 365005342], length 0
2022-04-06 22:05:22.839299 IP (tos 0x0, ttl 64, id 55347, offset 0, flags [DF], proto TCP (6), length 55)
    127.0.0.1.55938 > 127.0.0.1.11050: Flags [P.], cksum 0xfe2b (incorrect -> 0x66d1), seq 1:4, ack 1, win 512, options [nop,nop,TS val 365005342 ecr 365005342], length 3
2022-04-06 22:05:22.839307 IP (tos 0x0, ttl 64, id 3459, offset 0, flags [DF], proto TCP (6), length 52)
    127.0.0.1.11050 > 127.0.0.1.55938: Flags [.], cksum 0xfe28 (incorrect -> 0x6bda), seq 1, ack 4, win 512, options [nop,nop,TS val 365005342 ecr 365005342], length 0
2022-04-06 22:05:22.839330 IP (tos 0x0, ttl 64, id 3460, offset 0, flags [DF], proto TCP (6), length 54)
    127.0.0.1.11050 > 127.0.0.1.55938: Flags [P.], cksum 0xfe2a (incorrect -> 0x66d0), seq 1:3, ack 4, win 512, options [nop,nop,TS val 365005342 ecr 365005342], length 2
2022-04-06 22:05:22.839337 IP (tos 0x0, ttl 64, id 55348, offset 0, flags [DF], proto TCP (6), length 52)
    127.0.0.1.55938 > 127.0.0.1.11050: Flags [.], cksum 0xfe28 (incorrect -> 0x6bd8), seq 4, ack 3, win 512, options [nop,nop,TS val 365005342 ecr 365005342], length 0
2022-04-06 22:05:22.850851 IP (tos 0x0, ttl 64, id 55349, offset 0, flags [DF], proto TCP (6), length 62)
    127.0.0.1.55938 > 127.0.0.1.11050: Flags [P.], cksum 0xfe32 (incorrect -> 0xc0f5), seq 4:14, ack 3, win 512, options [nop,nop,TS val 365005353 ecr 365005342], length 10
2022-04-06 22:05:22.850871 IP (tos 0x0, ttl 64, id 3461, offset 0, flags [DF], proto TCP (6), length 52)
    127.0.0.1.11050 > 127.0.0.1.55938: Flags [.], cksum 0xfe28 (incorrect -> 0x6bb8), seq 3, ack 14, win 512, options [nop,nop,TS val 365005353 ecr 365005353], length 0
2022-04-06 22:05:23.030685 IP (tos 0x0, ttl 64, id 3462, offset 0, flags [DF], proto TCP (6), length 62)
    127.0.0.1.11050 > 127.0.0.1.55938: Flags [P.], cksum 0xfe32 (incorrect -> 0x65f1), seq 3:13, ack 14, win 512, options [nop,nop,TS val 365005533 ecr 365005353], length 10
2022-04-06 22:05:23.030697 IP (tos 0x0, ttl 64, id 55350, offset 0, flags [DF], proto TCP (6), length 52)
    127.0.0.1.55938 > 127.0.0.1.11050: Flags [.], cksum 0xfe28 (incorrect -> 0x6a46), seq 14, ack 13, win 512, options [nop,nop,TS val 365005533 ecr 365005533], length 0
2022-04-06 22:05:23.036714 IP (tos 0x0, ttl 64, id 55351, offset 0, flags [DF], proto TCP (6), length 569)
    127.0.0.1.55938 > 127.0.0.1.11050: Flags [P.], cksum 0x002e (incorrect -> 0x67e6), seq 14:531, ack 13, win 512, options [nop,nop,TS val 365005539 ecr 365005533], length 517
2022-04-06 22:05:23.036725 IP (tos 0x0, ttl 64, id 3463, offset 0, flags [DF], proto TCP (6), length 52)
    127.0.0.1.11050 > 127.0.0.1.55938: Flags [.], cksum 0xfe28 (incorrect -> 0x6839), seq 13, ack 531, win 508, options [nop,nop,TS val 365005539 ecr 365005539], length 0
2022-04-06 22:05:23.217755 IP (tos 0x0, ttl 64, id 3464, offset 0, flags [DF], proto TCP (6), length 151)
    127.0.0.1.11050 > 127.0.0.1.55938: Flags [P.], cksum 0xfe8b (incorrect -> 0x8f44), seq 13:112, ack 531, win 512, options [nop,nop,TS val 365005720 ecr 365005539], length 99
2022-04-06 22:05:23.217764 IP (tos 0x0, ttl 64, id 55352, offset 0, flags [DF], proto TCP (6), length 52)
    127.0.0.1.55938 > 127.0.0.1.11050: Flags [.], cksum 0xfe28 (incorrect -> 0x6668), seq 531, ack 112, win 512, options [nop,nop,TS val 365005720 ecr 365005720], length 0
2022-04-06 22:05:23.217920 IP (tos 0x0, ttl 64, id 55353, offset 0, flags [DF], proto TCP (6), length 575)
    127.0.0.1.55938 > 127.0.0.1.11050: Flags [P.], cksum 0x0034 (incorrect -> 0xe784), seq 531:1054, ack 112, win 512, options [nop,nop,TS val 365005720 ecr 365005720], length 523
2022-04-06 22:05:23.217927 IP (tos 0x0, ttl 64, id 3465, offset 0, flags [DF], proto TCP (6), length 52)
    127.0.0.1.11050 > 127.0.0.1.55938: Flags [.], cksum 0xfe28 (incorrect -> 0x6461), seq 112, ack 1054, win 508, options [nop,nop,TS val 365005720 ecr 365005720], length 0
2022-04-06 22:05:23.448839 IP (tos 0x0, ttl 64, id 3466, offset 0, flags [DF], proto TCP (6), length 3538)
    127.0.0.1.11050 > 127.0.0.1.55938: Flags [P.], cksum 0x0bc7 (incorrect -> 0xa047), seq 112:3598, ack 1054, win 512, options [nop,nop,TS val 365005951 ecr 365005720], length 3486
2022-04-06 22:05:23.448849 IP (tos 0x0, ttl 64, id 55354, offset 0, flags [DF], proto TCP (6), length 52)
    127.0.0.1.55938 > 127.0.0.1.11050: Flags [.], cksum 0xfe28 (incorrect -> 0x5503), seq 1054, ack 3598, win 494, options [nop,nop,TS val 365005951 ecr 365005951], length 0
2022-04-06 22:05:23.474917 IP (tos 0x0, ttl 64, id 3467, offset 0, flags [DF], proto TCP (6), length 3538)
    127.0.0.1.11050 > 127.0.0.1.55938: Flags [P.], cksum 0x0bc7 (incorrect -> 0xcc4a), seq 3598:7084, ack 1054, win 512, options [nop,nop,TS val 365005977 ecr 365005951], length 3486
2022-04-06 22:05:23.474923 IP (tos 0x0, ttl 64, id 55355, offset 0, flags [DF], proto TCP (6), length 52)
    127.0.0.1.55938 > 127.0.0.1.11050: Flags [.], cksum 0xfe28 (incorrect -> 0x4731), seq 1054, ack 7084, win 494, options [nop,nop,TS val 365005977 ecr 365005977], length 0
2022-04-06 22:05:23.487556 IP (tos 0x0, ttl 64, id 3468, offset 0, flags [DF], proto TCP (6), length 550)
    127.0.0.1.11050 > 127.0.0.1.55938: Flags [P.], cksum 0x001b (incorrect -> 0x9bda), seq 7084:7582, ack 1054, win 512, options [nop,nop,TS val 365005990 ecr 365005977], length 498
2022-04-06 22:05:23.487565 IP (tos 0x0, ttl 64, id 55356, offset 0, flags [DF], proto TCP (6), length 52)
    127.0.0.1.55938 > 127.0.0.1.11050: Flags [.], cksum 0xfe28 (incorrect -> 0x4519), seq 1054, ack 7582, win 506, options [nop,nop,TS val 365005990 ecr 365005990], length 0
2022-04-06 22:05:23.586055 IP (tos 0x0, ttl 64, id 3469, offset 0, flags [DF], proto TCP (6), length 2882)
    127.0.0.1.11050 > 127.0.0.1.55938: Flags [P.], cksum 0x0937 (incorrect -> 0x2ef2), seq 7582:10412, ack 1054, win 512, options [nop,nop,TS val 365006088 ecr 365005990], length 2830
2022-04-06 22:05:23.586061 IP (tos 0x0, ttl 64, id 55357, offset 0, flags [DF], proto TCP (6), length 52)
    127.0.0.1.55938 > 127.0.0.1.11050: Flags [.], cksum 0xfe28 (incorrect -> 0x3950), seq 1054, ack 10412, win 496, options [nop,nop,TS val 365006089 ecr 365006088], length 0
2022-04-06 22:05:23.586693 IP (tos 0x0, ttl 64, id 55358, offset 0, flags [DF], proto TCP (6), length 126)
    127.0.0.1.55938 > 127.0.0.1.11050: Flags [P.], cksum 0xfe72 (incorrect -> 0x1661), seq 1054:1128, ack 10412, win 512, options [nop,nop,TS val 365006089 ecr 365006088], length 74
2022-04-06 22:05:23.586726 IP (tos 0x0, ttl 64, id 3470, offset 0, flags [DF], proto TCP (6), length 52)
    127.0.0.1.11050 > 127.0.0.1.55938: Flags [.], cksum 0xfe28 (incorrect -> 0x38f5), seq 10412, ack 1128, win 512, options [nop,nop,TS val 365006089 ecr 365006089], length 0
2022-04-06 22:05:23.587053 IP (tos 0x0, ttl 64, id 55359, offset 0, flags [DF], proto TCP (6), length 383)
    127.0.0.1.55938 > 127.0.0.1.11050: Flags [P.], cksum 0xff73 (incorrect -> 0xcb61), seq 1128:1459, ack 10412, win 512, options [nop,nop,TS val 365006089 ecr 365006089], length 331
2022-04-06 22:05:23.587075 IP (tos 0x0, ttl 64, id 3471, offset 0, flags [DF], proto TCP (6), length 52)
    127.0.0.1.11050 > 127.0.0.1.55938: Flags [.], cksum 0xfe28 (incorrect -> 0x37ab), seq 10412, ack 1459, win 510, options [nop,nop,TS val 365006090 ecr 365006089], length 0
2022-04-06 22:05:23.779045 IP (tos 0x0, ttl 64, id 3472, offset 0, flags [DF], proto TCP (6), length 626)
    127.0.0.1.11050 > 127.0.0.1.55938: Flags [P.], cksum 0x0067 (incorrect -> 0xa6d6), seq 10412:10986, ack 1459, win 512, options [nop,nop,TS val 365006281 ecr 365006089], length 574
2022-04-06 22:05:23.822675 IP (tos 0x0, ttl 64, id 55360, offset 0, flags [DF], proto TCP (6), length 52)
    127.0.0.1.55938 > 127.0.0.1.11050: Flags [.], cksum 0xfe28 (incorrect -> 0x33c0), seq 1459, ack 10986, win 512, options [nop,nop,TS val 365006325 ecr 365006281], length 0
200, 6.740126132965088, 3.115804433822632