2022-04-06 08:06:39.870370 IP (tos 0x0, ttl 64, id 25175, offset 0, flags [DF], proto TCP (6), length 60)
    127.0.0.1.39120 > 127.0.0.1.11950: Flags [S], cksum 0xfe30 (incorrect -> 0x0791), seq 1710054462, win 65495, options [mss 65495,sackOK,TS val 314682373 ecr 0,nop,wscale 7], length 0
2022-04-06 08:06:39.870383 IP (tos 0x0, ttl 64, id 0, offset 0, flags [DF], proto TCP (6), length 60)
    127.0.0.1.11950 > 127.0.0.1.39120: Flags [S.], cksum 0xfe30 (incorrect -> 0x6078), seq 3175492358, ack 1710054463, win 65483, options [mss 65495,sackOK,TS val 314682373 ecr 314682373,nop,wscale 7], length 0
2022-04-06 08:06:39.870392 IP (tos 0x0, ttl 64, id 25176, offset 0, flags [DF], proto TCP (6), length 52)
    127.0.0.1.39120 > 127.0.0.1.11950: Flags [.], cksum 0xfe28 (incorrect -> 0x8734), seq 1, ack 1, win 512, options [nop,nop,TS val 314682373 ecr 314682373], length 0
2022-04-06 08:06:39.870475 IP (tos 0x0, ttl 64, id 25177, offset 0, flags [DF], proto TCP (6), length 55)
    127.0.0.1.39120 > 127.0.0.1.11950: Flags [P.], cksum 0xfe2b (incorrect -> 0x8228), seq 1:4, ack 1, win 512, options [nop,nop,TS val 314682373 ecr 314682373], length 3
2022-04-06 08:06:39.870479 IP (tos 0x0, ttl 64, id 58713, offset 0, flags [DF], proto TCP (6), length 52)
    127.0.0.1.11950 > 127.0.0.1.39120: Flags [.], cksum 0xfe28 (incorrect -> 0x8731), seq 1, ack 4, win 512, options [nop,nop,TS val 314682373 ecr 314682373], length 0
2022-04-06 08:06:39.870555 IP (tos 0x0, ttl 64, id 58714, offset 0, flags [DF], proto TCP (6), length 54)
    127.0.0.1.11950 > 127.0.0.1.39120: Flags [P.], cksum 0xfe2a (incorrect -> 0x8227), seq 1:3, ack 4, win 512, options [nop,nop,TS val 314682373 ecr 314682373], length 2
2022-04-06 08:06:39.870559 IP (tos 0x0, ttl 64, id 25178, offset 0, flags [DF], proto TCP (6), length 52)
    127.0.0.1.39120 > 127.0.0.1.11950: Flags [.], cksum 0xfe28 (incorrect -> 0x872f), seq 4, ack 3, win 512, options [nop,nop,TS val 314682373 ecr 314682373], length 0
2022-04-06 08:06:39.872430 IP (tos 0x0, ttl 64, id 25179, offset 0, flags [DF], proto TCP (6), length 62)
    127.0.0.1.39120 > 127.0.0.1.11950: Flags [P.], cksum 0xfe32 (incorrect -> 0x3775), seq 4:14, ack 3, win 512, options [nop,nop,TS val 314682375 ecr 314682373], length 10
2022-04-06 08:06:39.872442 IP (tos 0x0, ttl 64, id 58715, offset 0, flags [DF], proto TCP (6), length 52)
    127.0.0.1.11950 > 127.0.0.1.39120: Flags [.], cksum 0xfe28 (incorrect -> 0x8721), seq 3, ack 14, win 512, options [nop,nop,TS val 314682375 ecr 314682375], length 0
2022-04-06 08:06:39.952454 IP (tos 0x0, ttl 64, id 58716, offset 0, flags [DF], proto TCP (6), length 62)
    127.0.0.1.11950 > 127.0.0.1.39120: Flags [P.], cksum 0xfe32 (incorrect -> 0x81be), seq 3:13, ack 14, win 512, options [nop,nop,TS val 314682455 ecr 314682375], length 10
2022-04-06 08:06:39.952461 IP (tos 0x0, ttl 64, id 25180, offset 0, flags [DF], proto TCP (6), length 52)
    127.0.0.1.39120 > 127.0.0.1.11950: Flags [.], cksum 0xfe28 (incorrect -> 0x8677), seq 14, ack 13, win 512, options [nop,nop,TS val 314682455 ecr 314682455], length 0
2022-04-06 08:06:39.958539 IP (tos 0x0, ttl 64, id 25181, offset 0, flags [DF], proto TCP (6), length 569)
    127.0.0.1.39120 > 127.0.0.1.11950: Flags [P.], cksum 0x002e (incorrect -> 0x0402), seq 14:531, ack 13, win 512, options [nop,nop,TS val 314682461 ecr 314682455], length 517
2022-04-06 08:06:39.958558 IP (tos 0x0, ttl 64, id 58717, offset 0, flags [DF], proto TCP (6), length 52)
    127.0.0.1.11950 > 127.0.0.1.39120: Flags [.], cksum 0xfe28 (incorrect -> 0x846a), seq 13, ack 531, win 508, options [nop,nop,TS val 314682461 ecr 314682461], length 0
200, 8.731059551239014, 0.9084169864654541