2022-04-06 16:52:45.106365 IP (tos 0x0, ttl 64, id 64538, offset 0, flags [DF], proto TCP (6), length 60)
    127.0.0.1.47860 > 127.0.0.1.9250: Flags [S], cksum 0xfe30 (incorrect -> 0xe7c8), seq 268374727, win 65495, options [mss 65495,sackOK,TS val 346247609 ecr 0,nop,wscale 7], length 0
2022-04-06 16:52:45.106380 IP (tos 0x0, ttl 64, id 0, offset 0, flags [DF], proto TCP (6), length 60)
    127.0.0.1.9250 > 127.0.0.1.47860: Flags [S.], cksum 0xfe30 (incorrect -> 0x9b5a), seq 3646557362, ack 268374728, win 65483, options [mss 65495,sackOK,TS val 346247609 ecr 346247609,nop,wscale 7], length 0
2022-04-06 16:52:45.106392 IP (tos 0x0, ttl 64, id 64539, offset 0, flags [DF], proto TCP (6), length 52)
    127.0.0.1.47860 > 127.0.0.1.9250: Flags [.], cksum 0xfe28 (incorrect -> 0xc216), seq 1, ack 1, win 512, options [nop,nop,TS val 346247609 ecr 346247609], length 0
2022-04-06 16:52:45.106527 IP (tos 0x0, ttl 64, id 64540, offset 0, flags [DF], proto TCP (6), length 55)
    127.0.0.1.47860 > 127.0.0.1.9250: Flags [P.], cksum 0xfe2b (incorrect -> 0xbd0a), seq 1:4, ack 1, win 512, options [nop,nop,TS val 346247609 ecr 346247609], length 3
2022-04-06 16:52:45.106535 IP (tos 0x0, ttl 64, id 225, offset 0, flags [DF], proto TCP (6), length 52)
    127.0.0.1.9250 > 127.0.0.1.47860: Flags [.], cksum 0xfe28 (incorrect -> 0xc213), seq 1, ack 4, win 512, options [nop,nop,TS val 346247609 ecr 346247609], length 0
2022-04-06 16:52:45.106560 IP (tos 0x0, ttl 64, id 226, offset 0, flags [DF], proto TCP (6), length 54)
    127.0.0.1.9250 > 127.0.0.1.47860: Flags [P.], cksum 0xfe2a (incorrect -> 0xbd09), seq 1:3, ack 4, win 512, options [nop,nop,TS val 346247609 ecr 346247609], length 2
2022-04-06 16:52:45.106569 IP (tos 0x0, ttl 64, id 64541, offset 0, flags [DF], proto TCP (6), length 52)
    127.0.0.1.47860 > 127.0.0.1.9250: Flags [.], cksum 0xfe28 (incorrect -> 0xc211), seq 4, ack 3, win 512, options [nop,nop,TS val 346247609 ecr 346247609], length 0
2022-04-06 16:52:45.109090 IP (tos 0x0, ttl 64, id 64542, offset 0, flags [DF], proto TCP (6), length 62)
    127.0.0.1.47860 > 127.0.0.1.9250: Flags [P.], cksum 0xfe32 (incorrect -> 0x6b02), seq 4:14, ack 3, win 512, options [nop,nop,TS val 346247612 ecr 346247609], length 10
2022-04-06 16:52:45.109109 IP (tos 0x0, ttl 64, id 227, offset 0, flags [DF], proto TCP (6), length 52)
    127.0.0.1.9250 > 127.0.0.1.47860: Flags [.], cksum 0xfe28 (incorrect -> 0xc201), seq 3, ack 14, win 512, options [nop,nop,TS val 346247612 ecr 346247612], length 0
2022-04-06 16:52:45.422191 IP (tos 0x0, ttl 64, id 228, offset 0, flags [DF], proto TCP (6), length 62)
    127.0.0.1.9250 > 127.0.0.1.47860: Flags [P.], cksum 0xfe32 (incorrect -> 0xbbb5), seq 3:13, ack 14, win 512, options [nop,nop,TS val 346247925 ecr 346247612], length 10
2022-04-06 16:52:45.422211 IP (tos 0x0, ttl 64, id 64543, offset 0, flags [DF], proto TCP (6), length 52)
    127.0.0.1.47860 > 127.0.0.1.9250: Flags [.], cksum 0xfe28 (incorrect -> 0xbf85), seq 14, ack 13, win 512, options [nop,nop,TS val 346247925 ecr 346247925], length 0
2022-04-06 16:52:45.428432 IP (tos 0x0, ttl 64, id 64544, offset 0, flags [DF], proto TCP (6), length 569)
    127.0.0.1.47860 > 127.0.0.1.9250: Flags [P.], cksum 0x002e (incorrect -> 0xc53c), seq 14:531, ack 13, win 512, options [nop,nop,TS val 346247931 ecr 346247925], length 517
2022-04-06 16:52:45.428442 IP (tos 0x0, ttl 64, id 229, offset 0, flags [DF], proto TCP (6), length 52)
    127.0.0.1.9250 > 127.0.0.1.47860: Flags [.], cksum 0xfe28 (incorrect -> 0xbd78), seq 13, ack 531, win 508, options [nop,nop,TS val 346247931 ecr 346247931], length 0
2022-04-06 16:52:45.725817 IP (tos 0x0, ttl 64, id 230, offset 0, flags [DF], proto TCP (6), length 3538)
    127.0.0.1.9250 > 127.0.0.1.47860: Flags [P.], cksum 0x0bc7 (incorrect -> 0x61b6), seq 13:3499, ack 531, win 512, options [nop,nop,TS val 346248228 ecr 346247931], length 3486
2022-04-06 16:52:45.725834 IP (tos 0x0, ttl 64, id 64545, offset 0, flags [DF], proto TCP (6), length 52)
    127.0.0.1.47860 > 127.0.0.1.9250: Flags [.], cksum 0xfe28 (incorrect -> 0xad96), seq 531, ack 3499, win 494, options [nop,nop,TS val 346248228 ecr 346248228], length 0
2022-04-06 16:52:45.871871 IP (tos 0x0, ttl 64, id 231, offset 0, flags [DF], proto TCP (6), length 1546)
    127.0.0.1.9250 > 127.0.0.1.47860: Flags [P.], cksum 0x03ff (incorrect -> 0x0af2), seq 3499:4993, ack 531, win 512, options [nop,nop,TS val 346248374 ecr 346248228], length 1494
2022-04-06 16:52:45.871887 IP (tos 0x0, ttl 64, id 64546, offset 0, flags [DF], proto TCP (6), length 52)
    127.0.0.1.47860 > 127.0.0.1.9250: Flags [.], cksum 0xfe28 (incorrect -> 0xa694), seq 531, ack 4993, win 502, options [nop,nop,TS val 346248374 ecr 346248374], length 0
2022-04-06 16:52:45.977375 IP (tos 0x0, ttl 64, id 232, offset 0, flags [DF], proto TCP (6), length 368)
    127.0.0.1.9250 > 127.0.0.1.47860: Flags [P.], cksum 0xff64 (incorrect -> 0xbca1), seq 4993:5309, ack 531, win 512, options [nop,nop,TS val 346248480 ecr 346248374], length 316
2022-04-06 16:52:45.977392 IP (tos 0x0, ttl 64, id 64547, offset 0, flags [DF], proto TCP (6), length 52)
    127.0.0.1.47860 > 127.0.0.1.9250: Flags [.], cksum 0xfe28 (incorrect -> 0xa480), seq 531, ack 5309, win 506, options [nop,nop,TS val 346248480 ecr 346248480], length 0
2022-04-06 16:52:45.977561 IP (tos 0x0, ttl 64, id 64548, offset 0, flags [DF], proto TCP (6), length 132)
    127.0.0.1.47860 > 127.0.0.1.9250: Flags [P.], cksum 0xfe78 (incorrect -> 0x4bf3), seq 531:611, ack 5309, win 506, options [nop,nop,TS val 346248480 ecr 346248480], length 80
2022-04-06 16:52:45.977570 IP (tos 0x0, ttl 64, id 233, offset 0, flags [DF], proto TCP (6), length 52)
    127.0.0.1.9250 > 127.0.0.1.47860: Flags [.], cksum 0xfe28 (incorrect -> 0xa42a), seq 5309, ack 611, win 512, options [nop,nop,TS val 346248480 ecr 346248480], length 0
2022-04-06 16:52:45.978050 IP (tos 0x0, ttl 64, id 64549, offset 0, flags [DF], proto TCP (6), length 334)
    127.0.0.1.47860 > 127.0.0.1.9250: Flags [P.], cksum 0xff42 (incorrect -> 0xaeb5), seq 611:893, ack 5309, win 506, options [nop,nop,TS val 346248480 ecr 346248480], length 282
2022-04-06 16:52:45.978056 IP (tos 0x0, ttl 64, id 234, offset 0, flags [DF], proto TCP (6), length 52)
    127.0.0.1.9250 > 127.0.0.1.47860: Flags [.], cksum 0xfe28 (incorrect -> 0xa312), seq 5309, ack 893, win 510, options [nop,nop,TS val 346248480 ecr 346248480], length 0
200, 2.8518435955047607, 1.7165300846099854