2022-04-06 10:07:47.017940 IP (tos 0x0, ttl 64, id 33101, offset 0, flags [DF], proto TCP (6), length 60)
    127.0.0.1.37626 > 127.0.0.1.10050: Flags [S], cksum 0xfe30 (incorrect -> 0x45cc), seq 4215976493, win 65495, options [mss 65495,sackOK,TS val 321949520 ecr 0,nop,wscale 7], length 0
2022-04-06 10:07:47.017948 IP (tos 0x0, ttl 64, id 0, offset 0, flags [DF], proto TCP (6), length 60)
    127.0.0.1.10050 > 127.0.0.1.37626: Flags [S.], cksum 0xfe30 (incorrect -> 0x1aa8), seq 2672814414, ack 4215976494, win 65483, options [mss 65495,sackOK,TS val 321949520 ecr 321949520,nop,wscale 7], length 0
2022-04-06 10:07:47.017956 IP (tos 0x0, ttl 64, id 33102, offset 0, flags [DF], proto TCP (6), length 52)
    127.0.0.1.37626 > 127.0.0.1.10050: Flags [.], cksum 0xfe28 (incorrect -> 0x4164), seq 1, ack 1, win 512, options [nop,nop,TS val 321949520 ecr 321949520], length 0
2022-04-06 10:07:47.018114 IP (tos 0x0, ttl 64, id 33103, offset 0, flags [DF], proto TCP (6), length 55)
    127.0.0.1.37626 > 127.0.0.1.10050: Flags [P.], cksum 0xfe2b (incorrect -> 0x3c57), seq 1:4, ack 1, win 512, options [nop,nop,TS val 321949521 ecr 321949520], length 3
2022-04-06 10:07:47.018119 IP (tos 0x0, ttl 64, id 65178, offset 0, flags [DF], proto TCP (6), length 52)
    127.0.0.1.10050 > 127.0.0.1.37626: Flags [.], cksum 0xfe28 (incorrect -> 0x415f), seq 1, ack 4, win 512, options [nop,nop,TS val 321949521 ecr 321949521], length 0
2022-04-06 10:07:47.018143 IP (tos 0x0, ttl 64, id 65179, offset 0, flags [DF], proto TCP (6), length 54)
    127.0.0.1.10050 > 127.0.0.1.37626: Flags [P.], cksum 0xfe2a (incorrect -> 0x3c55), seq 1:3, ack 4, win 512, options [nop,nop,TS val 321949521 ecr 321949521], length 2
2022-04-06 10:07:47.018148 IP (tos 0x0, ttl 64, id 33104, offset 0, flags [DF], proto TCP (6), length 52)
    127.0.0.1.37626 > 127.0.0.1.10050: Flags [.], cksum 0xfe28 (incorrect -> 0x415d), seq 4, ack 3, win 512, options [nop,nop,TS val 321949521 ecr 321949521], length 0
2022-04-06 10:07:47.031452 IP (tos 0x0, ttl 64, id 33105, offset 0, flags [DF], proto TCP (6), length 62)
    127.0.0.1.37626 > 127.0.0.1.10050: Flags [P.], cksum 0xfe32 (incorrect -> 0xaf76), seq 4:14, ack 3, win 512, options [nop,nop,TS val 321949534 ecr 321949521], length 10
2022-04-06 10:07:47.031465 IP (tos 0x0, ttl 64, id 65180, offset 0, flags [DF], proto TCP (6), length 52)
    127.0.0.1.10050 > 127.0.0.1.37626: Flags [.], cksum 0xfe28 (incorrect -> 0x4139), seq 3, ack 14, win 512, options [nop,nop,TS val 321949534 ecr 321949534], length 0
2022-04-06 10:07:47.637523 IP (tos 0x0, ttl 64, id 65181, offset 0, flags [DF], proto TCP (6), length 62)
    127.0.0.1.10050 > 127.0.0.1.37626: Flags [P.], cksum 0xfe32 (incorrect -> 0x39c8), seq 3:13, ack 14, win 512, options [nop,nop,TS val 321950140 ecr 321949534], length 10
2022-04-06 10:07:47.637535 IP (tos 0x0, ttl 64, id 33106, offset 0, flags [DF], proto TCP (6), length 52)
    127.0.0.1.37626 > 127.0.0.1.10050: Flags [.], cksum 0xfe28 (incorrect -> 0x3c73), seq 14, ack 13, win 512, options [nop,nop,TS val 321950140 ecr 321950140], length 0
2022-04-06 10:07:47.643637 IP (tos 0x0, ttl 64, id 33107, offset 0, flags [DF], proto TCP (6), length 569)
    127.0.0.1.37626 > 127.0.0.1.10050: Flags [P.], cksum 0x002e (incorrect -> 0xc43e), seq 14:531, ack 13, win 512, options [nop,nop,TS val 321950146 ecr 321950140], length 517
2022-04-06 10:07:47.643644 IP (tos 0x0, ttl 64, id 65182, offset 0, flags [DF], proto TCP (6), length 52)
    127.0.0.1.10050 > 127.0.0.1.37626: Flags [.], cksum 0xfe28 (incorrect -> 0x3a66), seq 13, ack 531, win 508, options [nop,nop,TS val 321950146 ecr 321950146], length 0
2022-04-06 10:07:48.248315 IP (tos 0x0, ttl 64, id 65183, offset 0, flags [DF], proto TCP (6), length 3538)
    127.0.0.1.10050 > 127.0.0.1.37626: Flags [P.], cksum 0x0bc7 (incorrect -> 0x10fc), seq 13:3499, ack 531, win 512, options [nop,nop,TS val 321950751 ecr 321950146], length 3486
2022-04-06 10:07:48.248326 IP (tos 0x0, ttl 64, id 33108, offset 0, flags [DF], proto TCP (6), length 52)
    127.0.0.1.37626 > 127.0.0.1.10050: Flags [.], cksum 0xfe28 (incorrect -> 0x281c), seq 531, ack 3499, win 494, options [nop,nop,TS val 321950751 ecr 321950751], length 0
2022-04-06 10:07:48.513760 IP (tos 0x0, ttl 64, id 65184, offset 0, flags [DF], proto TCP (6), length 850)
    127.0.0.1.10050 > 127.0.0.1.37626: Flags [P.], cksum 0x0147 (incorrect -> 0x2c17), seq 3499:4297, ack 531, win 512, options [nop,nop,TS val 321951016 ecr 321950751], length 798
2022-04-06 10:07:48.513772 IP (tos 0x0, ttl 64, id 33109, offset 0, flags [DF], proto TCP (6), length 52)
    127.0.0.1.37626 > 127.0.0.1.10050: Flags [.], cksum 0xfe28 (incorrect -> 0x22e2), seq 531, ack 4297, win 504, options [nop,nop,TS val 321951016 ecr 321951016], length 0
2022-04-06 10:07:48.779201 IP (tos 0x0, ttl 64, id 65185, offset 0, flags [DF], proto TCP (6), length 696)
    127.0.0.1.10050 > 127.0.0.1.37626: Flags [P.], cksum 0x00ad (incorrect -> 0xbb5f), seq 4297:4941, ack 531, win 512, options [nop,nop,TS val 321951282 ecr 321951016], length 644
2022-04-06 10:07:48.779214 IP (tos 0x0, ttl 64, id 33110, offset 0, flags [DF], proto TCP (6), length 52)
    127.0.0.1.37626 > 127.0.0.1.10050: Flags [.], cksum 0xfe28 (incorrect -> 0x1e49), seq 531, ack 4941, win 505, options [nop,nop,TS val 321951282 ecr 321951282], length 0
2022-04-06 10:07:48.779799 IP (tos 0x0, ttl 64, id 33111, offset 0, flags [DF], proto TCP (6), length 116)
    127.0.0.1.37626 > 127.0.0.1.10050: Flags [P.], cksum 0xfe68 (incorrect -> 0x4354), seq 531:595, ack 4941, win 512, options [nop,nop,TS val 321951282 ecr 321951282], length 64
2022-04-06 10:07:48.779805 IP (tos 0x0, ttl 64, id 65186, offset 0, flags [DF], proto TCP (6), length 52)
    127.0.0.1.10050 > 127.0.0.1.37626: Flags [.], cksum 0xfe28 (incorrect -> 0x1e02), seq 4941, ack 595, win 512, options [nop,nop,TS val 321951282 ecr 321951282], length 0
2022-04-06 10:07:48.780294 IP (tos 0x0, ttl 64, id 33112, offset 0, flags [DF], proto TCP (6), length 322)
    127.0.0.1.37626 > 127.0.0.1.10050: Flags [P.], cksum 0xff36 (incorrect -> 0xa9ee), seq 595:865, ack 4941, win 512, options [nop,nop,TS val 321951283 ecr 321951282], length 270
2022-04-06 10:07:48.780299 IP (tos 0x0, ttl 64, id 65187, offset 0, flags [DF], proto TCP (6), length 52)
    127.0.0.1.10050 > 127.0.0.1.37626: Flags [.], cksum 0xfe28 (incorrect -> 0x1cf4), seq 4941, ack 865, win 510, options [nop,nop,TS val 321951283 ecr 321951283], length 0
2022-04-06 10:07:49.727642 IP (tos 0x0, ttl 64, id 65188, offset 0, flags [DF], proto TCP (6), length 3538)
    127.0.0.1.10050 > 127.0.0.1.37626: Flags [P.], cksum 0x0bc7 (incorrect -> 0x0959), seq 4941:8427, ack 865, win 512, options [nop,nop,TS val 321952230 ecr 321951283], length 3486
2022-04-06 10:07:49.727652 IP (tos 0x0, ttl 64, id 33113, offset 0, flags [DF], proto TCP (6), length 52)
    127.0.0.1.37626 > 127.0.0.1.10050: Flags [.], cksum 0xfe28 (incorrect -> 0x0800), seq 865, ack 8427, win 494, options [nop,nop,TS val 321952230 ecr 321952230], length 0
2022-04-06 10:07:49.825278 IP (tos 0x0, ttl 64, id 65189, offset 0, flags [DF], proto TCP (6), length 3077)
    127.0.0.1.10050 > 127.0.0.1.37626: Flags [P.], cksum 0x09fa (incorrect -> 0x9428), seq 8427:11452, ack 865, win 512, options [nop,nop,TS val 321952328 ecr 321952230], length 3025
2022-04-06 10:07:49.825288 IP (tos 0x0, ttl 64, id 33114, offset 0, flags [DF], proto TCP (6), length 52)
    127.0.0.1.37626 > 127.0.0.1.10050: Flags [.], cksum 0xfe28 (incorrect -> 0xfb68), seq 865, ack 11452, win 496, options [nop,nop,TS val 321952328 ecr 321952328], length 0
2022-04-06 10:07:49.847050 IP (tos 0x0, ttl 64, id 65190, offset 0, flags [DF], proto TCP (6), length 3538)
    127.0.0.1.10050 > 127.0.0.1.37626: Flags [P.], cksum 0x0bc7 (incorrect -> 0x9ed7), seq 11452:14938, ack 865, win 512, options [nop,nop,TS val 321952349 ecr 321952328], length 3486
2022-04-06 10:07:49.847056 IP (tos 0x0, ttl 64, id 33115, offset 0, flags [DF], proto TCP (6), length 52)
    127.0.0.1.37626 > 127.0.0.1.10050: Flags [.], cksum 0xfe28 (incorrect -> 0xeda2), seq 865, ack 14938, win 494, options [nop,nop,TS val 321952349 ecr 321952349], length 0
2022-04-06 10:07:50.022739 IP (tos 0x0, ttl 64, id 65191, offset 0, flags [DF], proto TCP (6), length 3274)
    127.0.0.1.10050 > 127.0.0.1.37626: Flags [P.], cksum 0x0abf (incorrect -> 0x0b5d), seq 14938:18160, ack 865, win 512, options [nop,nop,TS val 321952525 ecr 321952349], length 3222
2022-04-06 10:07:50.022748 IP (tos 0x0, ttl 64, id 33116, offset 0, flags [DF], proto TCP (6), length 52)
    127.0.0.1.37626 > 127.0.0.1.10050: Flags [.], cksum 0xfe28 (incorrect -> 0xdfab), seq 865, ack 18160, win 495, options [nop,nop,TS val 321952525 ecr 321952525], length 0
2022-04-06 10:07:50.044339 IP (tos 0x0, ttl 64, id 65192, offset 0, flags [DF], proto TCP (6), length 3618)
    127.0.0.1.10050 > 127.0.0.1.37626: Flags [P.], cksum 0x0c17 (incorrect -> 0x78e8), seq 18160:21726, ack 865, win 512, options [nop,nop,TS val 321952547 ecr 321952525], length 3566
2022-04-06 10:07:50.044343 IP (tos 0x0, ttl 64, id 33117, offset 0, flags [DF], proto TCP (6), length 52)
    127.0.0.1.37626 > 127.0.0.1.10050: Flags [.], cksum 0xfe28 (incorrect -> 0xd192), seq 865, ack 21726, win 494, options [nop,nop,TS val 321952547 ecr 321952547], length 0
2022-04-06 10:07:50.089217 IP (tos 0x0, ttl 64, id 65193, offset 0, flags [DF], proto TCP (6), length 3274)
    127.0.0.1.10050 > 127.0.0.1.37626: Flags [P.], cksum 0x0abf (incorrect -> 0xaf8f), seq 21726:24948, ack 865, win 512, options [nop,nop,TS val 321952592 ecr 321952547], length 3222
2022-04-06 10:07:50.089222 IP (tos 0x0, ttl 64, id 33118, offset 0, flags [DF], proto TCP (6), length 52)
    127.0.0.1.37626 > 127.0.0.1.10050: Flags [.], cksum 0xfe28 (incorrect -> 0xc4a1), seq 865, ack 24948, win 495, options [nop,nop,TS val 321952592 ecr 321952592], length 0
2022-04-06 10:07:50.110894 IP (tos 0x0, ttl 64, id 65194, offset 0, flags [DF], proto TCP (6), length 550)
    127.0.0.1.10050 > 127.0.0.1.37626: Flags [P.], cksum 0x001b (incorrect -> 0xb82e), seq 24948:25446, ack 865, win 512, options [nop,nop,TS val 321952613 ecr 321952592], length 498
2022-04-06 10:07:50.110913 IP (tos 0x0, ttl 64, id 33119, offset 0, flags [DF], proto TCP (6), length 52)
    127.0.0.1.37626 > 127.0.0.1.10050: Flags [.], cksum 0xfe28 (incorrect -> 0xc27a), seq 865, ack 25446, win 506, options [nop,nop,TS val 321952613 ecr 321952613], length 0
2022-04-06 10:07:50.119922 IP (tos 0x0, ttl 64, id 65195, offset 0, flags [DF], proto TCP (6), length 2542)
    127.0.0.1.10050 > 127.0.0.1.37626: Flags [P.], cksum 0x07e3 (incorrect -> 0xde3f), seq 25446:27936, ack 865, win 512, options [nop,nop,TS val 321952622 ecr 321952613], length 2490
2022-04-06 10:07:50.119930 IP (tos 0x0, ttl 64, id 33120, offset 0, flags [DF], proto TCP (6), length 52)
    127.0.0.1.37626 > 127.0.0.1.10050: Flags [.], cksum 0xfe28 (incorrect -> 0xb8b6), seq 865, ack 27936, win 498, options [nop,nop,TS val 321952622 ecr 321952622], length 0
2022-04-06 10:07:50.131506 IP (tos 0x0, ttl 64, id 65196, offset 0, flags [DF], proto TCP (6), length 3274)
    127.0.0.1.10050 > 127.0.0.1.37626: Flags [P.], cksum 0x0abf (incorrect -> 0xeb06), seq 27936:31158, ack 865, win 512, options [nop,nop,TS val 321952634 ecr 321952622], length 3222
2022-04-06 10:07:50.131509 IP (tos 0x0, ttl 64, id 33121, offset 0, flags [DF], proto TCP (6), length 52)
    127.0.0.1.37626 > 127.0.0.1.10050: Flags [.], cksum 0xfe28 (incorrect -> 0xac0b), seq 865, ack 31158, win 495, options [nop,nop,TS val 321952634 ecr 321952634], length 0
2022-04-06 10:07:50.132671 IP (tos 0x0, ttl 64, id 65197, offset 0, flags [DF], proto TCP (6), length 3536)
    127.0.0.1.10050 > 127.0.0.1.37626: Flags [P.], cksum 0x0bc5 (incorrect -> 0x0876), seq 31158:34642, ack 865, win 512, options [nop,nop,TS val 321952635 ecr 321952634], length 3484
2022-04-06 10:07:50.132887 IP (tos 0x0, ttl 64, id 33122, offset 0, flags [DF], proto TCP (6), length 52)
    127.0.0.1.37626 > 127.0.0.1.10050: Flags [.], cksum 0xfe28 (incorrect -> 0x9e5c), seq 865, ack 34642, win 512, options [nop,nop,TS val 321952635 ecr 321952635], length 0
200, 9.847354412078857, 3.931093454360962