2022-04-06 19:51:51.671505 IP (tos 0x0, ttl 64, id 53674, offset 0, flags [DF], proto TCP (6), length 60)
    127.0.0.1.54700 > 127.0.0.1.11550: Flags [S], cksum 0xfe30 (incorrect -> 0x894d), seq 1943137874, win 65495, options [mss 65495,sackOK,TS val 356994174 ecr 0,nop,wscale 7], length 0
2022-04-06 19:51:51.671515 IP (tos 0x0, ttl 64, id 0, offset 0, flags [DF], proto TCP (6), length 60)
    127.0.0.1.11550 > 127.0.0.1.54700: Flags [S.], cksum 0xfe30 (incorrect -> 0xe7fa), seq 3479859229, ack 1943137875, win 65483, options [mss 65495,sackOK,TS val 356994174 ecr 356994174,nop,wscale 7], length 0
2022-04-06 19:51:51.671524 IP (tos 0x0, ttl 64, id 53675, offset 0, flags [DF], proto TCP (6), length 52)
    127.0.0.1.54700 > 127.0.0.1.11550: Flags [.], cksum 0xfe28 (incorrect -> 0x0eb7), seq 1, ack 1, win 512, options [nop,nop,TS val 356994174 ecr 356994174], length 0
2022-04-06 19:51:51.671680 IP (tos 0x0, ttl 64, id 53676, offset 0, flags [DF], proto TCP (6), length 55)
    127.0.0.1.54700 > 127.0.0.1.11550: Flags [P.], cksum 0xfe2b (incorrect -> 0x09ab), seq 1:4, ack 1, win 512, options [nop,nop,TS val 356994174 ecr 356994174], length 3
2022-04-06 19:51:51.671686 IP (tos 0x0, ttl 64, id 31850, offset 0, flags [DF], proto TCP (6), length 52)
    127.0.0.1.11550 > 127.0.0.1.54700: Flags [.], cksum 0xfe28 (incorrect -> 0x0eb4), seq 1, ack 4, win 512, options [nop,nop,TS val 356994174 ecr 356994174], length 0
2022-04-06 19:51:51.671709 IP (tos 0x0, ttl 64, id 31851, offset 0, flags [DF], proto TCP (6), length 54)
    127.0.0.1.11550 > 127.0.0.1.54700: Flags [P.], cksum 0xfe2a (incorrect -> 0x09aa), seq 1:3, ack 4, win 512, options [nop,nop,TS val 356994174 ecr 356994174], length 2
2022-04-06 19:51:51.671717 IP (tos 0x0, ttl 64, id 53677, offset 0, flags [DF], proto TCP (6), length 52)
    127.0.0.1.54700 > 127.0.0.1.11550: Flags [.], cksum 0xfe28 (incorrect -> 0x0eb2), seq 4, ack 3, win 512, options [nop,nop,TS val 356994174 ecr 356994174], length 0
2022-04-06 19:51:51.672488 IP (tos 0x0, ttl 64, id 53678, offset 0, flags [DF], proto TCP (6), length 62)
    127.0.0.1.54700 > 127.0.0.1.11550: Flags [P.], cksum 0xfe32 (incorrect -> 0x489a), seq 4:14, ack 3, win 512, options [nop,nop,TS val 356994175 ecr 356994174], length 10
2022-04-06 19:51:51.672497 IP (tos 0x0, ttl 64, id 31852, offset 0, flags [DF], proto TCP (6), length 52)
    127.0.0.1.11550 > 127.0.0.1.54700: Flags [.], cksum 0xfe28 (incorrect -> 0x0ea6), seq 3, ack 14, win 512, options [nop,nop,TS val 356994175 ecr 356994175], length 0
2022-04-06 19:51:51.950087 IP (tos 0x0, ttl 64, id 31853, offset 0, flags [DF], proto TCP (6), length 62)
    127.0.0.1.11550 > 127.0.0.1.54700: Flags [P.], cksum 0xfe32 (incorrect -> 0x087d), seq 3:13, ack 14, win 512, options [nop,nop,TS val 356994453 ecr 356994175], length 10
2022-04-06 19:51:51.950102 IP (tos 0x0, ttl 64, id 53679, offset 0, flags [DF], proto TCP (6), length 52)
    127.0.0.1.54700 > 127.0.0.1.11550: Flags [.], cksum 0xfe28 (incorrect -> 0x0c70), seq 14, ack 13, win 512, options [nop,nop,TS val 356994453 ecr 356994453], length 0
2022-04-06 19:51:51.955930 IP (tos 0x0, ttl 64, id 53680, offset 0, flags [DF], proto TCP (6), length 569)
    127.0.0.1.54700 > 127.0.0.1.11550: Flags [P.], cksum 0x002e (incorrect -> 0xa455), seq 14:531, ack 13, win 512, options [nop,nop,TS val 356994458 ecr 356994453], length 517
2022-04-06 19:51:51.955941 IP (tos 0x0, ttl 64, id 31854, offset 0, flags [DF], proto TCP (6), length 52)
    127.0.0.1.11550 > 127.0.0.1.54700: Flags [.], cksum 0xfe28 (incorrect -> 0x0a65), seq 13, ack 531, win 508, options [nop,nop,TS val 356994458 ecr 356994458], length 0
2022-04-06 19:51:52.239901 IP (tos 0x0, ttl 64, id 31855, offset 0, flags [DF], proto TCP (6), length 3538)
    127.0.0.1.11550 > 127.0.0.1.54700: Flags [P.], cksum 0x0bc7 (incorrect -> 0xd603), seq 13:3499, ack 531, win 512, options [nop,nop,TS val 356994742 ecr 356994458], length 3486
2022-04-06 19:51:52.239911 IP (tos 0x0, ttl 64, id 53681, offset 0, flags [DF], proto TCP (6), length 52)
    127.0.0.1.54700 > 127.0.0.1.11550: Flags [.], cksum 0xfe28 (incorrect -> 0xfa9c), seq 531, ack 3499, win 494, options [nop,nop,TS val 356994742 ecr 356994742], length 0
2022-04-06 19:51:52.378463 IP (tos 0x0, ttl 64, id 31856, offset 0, flags [DF], proto TCP (6), length 3244)
    127.0.0.1.11550 > 127.0.0.1.54700: Flags [P.], cksum 0x0aa1 (incorrect -> 0x380e), seq 3499:6691, ack 531, win 512, options [nop,nop,TS val 356994881 ecr 356994742], length 3192
2022-04-06 19:51:52.378471 IP (tos 0x0, ttl 64, id 53682, offset 0, flags [DF], proto TCP (6), length 52)
    127.0.0.1.54700 > 127.0.0.1.11550: Flags [.], cksum 0xfe28 (incorrect -> 0xed0d), seq 531, ack 6691, win 495, options [nop,nop,TS val 356994881 ecr 356994881], length 0
2022-04-06 19:51:52.379203 IP (tos 0x0, ttl 64, id 53683, offset 0, flags [DF], proto TCP (6), length 132)
    127.0.0.1.54700 > 127.0.0.1.11550: Flags [P.], cksum 0xfe78 (incorrect -> 0x7c0a), seq 531:611, ack 6691, win 512, options [nop,nop,TS val 356994882 ecr 356994881], length 80
2022-04-06 19:51:52.379211 IP (tos 0x0, ttl 64, id 31857, offset 0, flags [DF], proto TCP (6), length 52)
    127.0.0.1.11550 > 127.0.0.1.54700: Flags [.], cksum 0xfe28 (incorrect -> 0xecaa), seq 6691, ack 611, win 512, options [nop,nop,TS val 356994882 ecr 356994882], length 0
2022-04-06 19:51:52.379786 IP (tos 0x0, ttl 64, id 53684, offset 0, flags [DF], proto TCP (6), length 331)
    127.0.0.1.54700 > 127.0.0.1.11550: Flags [P.], cksum 0xff3f (incorrect -> 0x13c0), seq 611:890, ack 6691, win 512, options [nop,nop,TS val 356994882 ecr 356994882], length 279
2022-04-06 19:51:52.379792 IP (tos 0x0, ttl 64, id 31858, offset 0, flags [DF], proto TCP (6), length 52)
    127.0.0.1.11550 > 127.0.0.1.54700: Flags [.], cksum 0xfe28 (incorrect -> 0xeb95), seq 6691, ack 890, win 510, options [nop,nop,TS val 356994882 ecr 356994882], length 0
2022-04-06 19:51:52.700245 IP (tos 0x0, ttl 64, id 31859, offset 0, flags [DF], proto TCP (6), length 3538)
    127.0.0.1.11550 > 127.0.0.1.54700: Flags [P.], cksum 0x0bc7 (incorrect -> 0xea33), seq 6691:10177, ack 890, win 512, options [nop,nop,TS val 356995203 ecr 356994882], length 3486
2022-04-06 19:51:52.700253 IP (tos 0x0, ttl 64, id 53685, offset 0, flags [DF], proto TCP (6), length 52)
    127.0.0.1.54700 > 127.0.0.1.11550: Flags [.], cksum 0xfe28 (incorrect -> 0xdb85), seq 890, ack 10177, win 494, options [nop,nop,TS val 356995203 ecr 356995203], length 0
2022-04-06 19:51:52.706210 IP (tos 0x0, ttl 64, id 31860, offset 0, flags [DF], proto TCP (6), length 1509)
    127.0.0.1.11550 > 127.0.0.1.54700: Flags [P.], cksum 0x03da (incorrect -> 0x9501), seq 10177:11634, ack 890, win 512, options [nop,nop,TS val 356995209 ecr 356995203], length 1457
2022-04-06 19:51:52.706222 IP (tos 0x0, ttl 64, id 53686, offset 0, flags [DF], proto TCP (6), length 52)
    127.0.0.1.54700 > 127.0.0.1.11550: Flags [.], cksum 0xfe28 (incorrect -> 0xd5c0), seq 890, ack 11634, win 502, options [nop,nop,TS val 356995209 ecr 356995209], length 0
2022-04-06 19:51:52.708616 IP (tos 0x0, ttl 64, id 31861, offset 0, flags [DF], proto TCP (6), length 1482)
    127.0.0.1.11550 > 127.0.0.1.54700: Flags [P.], cksum 0x03bf (incorrect -> 0xa639), seq 11634:13064, ack 890, win 512, options [nop,nop,TS val 356995211 ecr 356995209], length 1430
2022-04-06 19:51:52.708622 IP (tos 0x0, ttl 64, id 53687, offset 0, flags [DF], proto TCP (6), length 52)
    127.0.0.1.54700 > 127.0.0.1.11550: Flags [.], cksum 0xfe28 (incorrect -> 0xd026), seq 890, ack 13064, win 502, options [nop,nop,TS val 356995211 ecr 356995211], length 0
2022-04-06 19:51:52.721589 IP (tos 0x0, ttl 64, id 31862, offset 0, flags [DF], proto TCP (6), length 2912)
    127.0.0.1.11550 > 127.0.0.1.54700: Flags [P.], cksum 0x0955 (incorrect -> 0x5a8f), seq 13064:15924, ack 890, win 512, options [nop,nop,TS val 356995224 ecr 356995211], length 2860
2022-04-06 19:51:52.721596 IP (tos 0x0, ttl 64, id 53688, offset 0, flags [DF], proto TCP (6), length 52)
    127.0.0.1.54700 > 127.0.0.1.11550: Flags [.], cksum 0xfe28 (incorrect -> 0xc4e6), seq 890, ack 15924, win 496, options [nop,nop,TS val 356995224 ecr 356995224], length 0
2022-04-06 19:51:52.736983 IP (tos 0x0, ttl 64, id 31863, offset 0, flags [DF], proto TCP (6), length 2912)
    127.0.0.1.11550 > 127.0.0.1.54700: Flags [P.], cksum 0x0955 (incorrect -> 0x5348), seq 15924:18784, ack 890, win 512, options [nop,nop,TS val 356995239 ecr 356995224], length 2860
2022-04-06 19:51:52.736989 IP (tos 0x0, ttl 64, id 53689, offset 0, flags [DF], proto TCP (6), length 52)
    127.0.0.1.54700 > 127.0.0.1.11550: Flags [.], cksum 0xfe28 (incorrect -> 0xb99c), seq 890, ack 18784, win 496, options [nop,nop,TS val 356995239 ecr 356995239], length 0
2022-04-06 19:51:52.820783 IP (tos 0x0, ttl 64, id 31864, offset 0, flags [DF], proto TCP (6), length 3410)
    127.0.0.1.11550 > 127.0.0.1.54700: Flags [P.], cksum 0x0b47 (incorrect -> 0x875a), seq 18784:22142, ack 890, win 512, options [nop,nop,TS val 356995323 ecr 356995239], length 3358
2022-04-06 19:51:52.820793 IP (tos 0x0, ttl 64, id 53690, offset 0, flags [DF], proto TCP (6), length 52)
    127.0.0.1.54700 > 127.0.0.1.11550: Flags [.], cksum 0xfe28 (incorrect -> 0xabd8), seq 890, ack 22142, win 494, options [nop,nop,TS val 356995323 ecr 356995323], length 0
2022-04-06 19:51:52.822194 IP (tos 0x0, ttl 64, id 31865, offset 0, flags [DF], proto TCP (6), length 3410)
    127.0.0.1.11550 > 127.0.0.1.54700: Flags [P.], cksum 0x0b47 (incorrect -> 0xf1a3), seq 22142:25500, ack 890, win 512, options [nop,nop,TS val 356995325 ecr 356995323], length 3358
2022-04-06 19:51:52.822201 IP (tos 0x0, ttl 64, id 53691, offset 0, flags [DF], proto TCP (6), length 52)
    127.0.0.1.54700 > 127.0.0.1.11550: Flags [.], cksum 0xfe28 (incorrect -> 0x9eb6), seq 890, ack 25500, win 494, options [nop,nop,TS val 356995325 ecr 356995325], length 0
2022-04-06 19:51:52.831180 IP (tos 0x0, ttl 64, id 31866, offset 0, flags [DF], proto TCP (6), length 3346)
    127.0.0.1.11550 > 127.0.0.1.54700: Flags [P.], cksum 0x0b07 (incorrect -> 0x2177), seq 25500:28794, ack 890, win 512, options [nop,nop,TS val 356995334 ecr 356995325], length 3294
2022-04-06 19:51:52.831187 IP (tos 0x0, ttl 64, id 53692, offset 0, flags [DF], proto TCP (6), length 52)
    127.0.0.1.54700 > 127.0.0.1.11550: Flags [.], cksum 0xfe28 (incorrect -> 0x91c5), seq 890, ack 28794, win 495, options [nop,nop,TS val 356995334 ecr 356995334], length 0
2022-04-06 19:51:52.836175 IP (tos 0x0, ttl 64, id 31867, offset 0, flags [DF], proto TCP (6), length 2912)
    127.0.0.1.11550 > 127.0.0.1.54700: Flags [P.], cksum 0x0955 (incorrect -> 0x5e42), seq 28794:31654, ack 890, win 512, options [nop,nop,TS val 356995339 ecr 356995334], length 2860
2022-04-06 19:51:52.836181 IP (tos 0x0, ttl 64, id 53693, offset 0, flags [DF], proto TCP (6), length 52)
    127.0.0.1.54700 > 127.0.0.1.11550: Flags [.], cksum 0xfe28 (incorrect -> 0x868e), seq 890, ack 31654, win 496, options [nop,nop,TS val 356995339 ecr 356995339], length 0
2022-04-06 19:51:52.836247 IP (tos 0x0, ttl 64, id 31868, offset 0, flags [DF], proto TCP (6), length 2912)
    127.0.0.1.11550 > 127.0.0.1.54700: Flags [P.], cksum 0x0955 (incorrect -> 0x74d7), seq 31654:34514, ack 890, win 512, options [nop,nop,TS val 356995339 ecr 356995339], length 2860
2022-04-06 19:51:52.836252 IP (tos 0x0, ttl 64, id 53694, offset 0, flags [DF], proto TCP (6), length 52)
    127.0.0.1.54700 > 127.0.0.1.11550: Flags [.], cksum 0xfe28 (incorrect -> 0x7b62), seq 890, ack 34514, win 496, options [nop,nop,TS val 356995339 ecr 356995339], length 0
200, 5.9247636795043945, 1.7272098064422607