2022-04-06 07:32:13.470609 IP (tos 0x0, ttl 64, id 53096, offset 0, flags [DF], proto TCP (6), length 60)
    127.0.0.1.46982 > 127.0.0.1.9950: Flags [S], cksum 0xfe30 (incorrect -> 0x1daf), seq 3359069423, win 65495, options [mss 65495,sackOK,TS val 312615973 ecr 0,nop,wscale 7], length 0
2022-04-06 07:32:13.470623 IP (tos 0x0, ttl 64, id 0, offset 0, flags [DF], proto TCP (6), length 60)
    127.0.0.1.9950 > 127.0.0.1.46982: Flags [S.], cksum 0xfe30 (incorrect -> 0x4baa), seq 1762472491, ack 3359069424, win 65483, options [mss 65495,sackOK,TS val 312615973 ecr 312615973,nop,wscale 7], length 0
2022-04-06 07:32:13.470634 IP (tos 0x0, ttl 64, id 53097, offset 0, flags [DF], proto TCP (6), length 52)
    127.0.0.1.46982 > 127.0.0.1.9950: Flags [.], cksum 0xfe28 (incorrect -> 0x7266), seq 1, ack 1, win 512, options [nop,nop,TS val 312615973 ecr 312615973], length 0
2022-04-06 07:32:13.470760 IP (tos 0x0, ttl 64, id 53098, offset 0, flags [DF], proto TCP (6), length 55)
    127.0.0.1.46982 > 127.0.0.1.9950: Flags [P.], cksum 0xfe2b (incorrect -> 0x6d5a), seq 1:4, ack 1, win 512, options [nop,nop,TS val 312615973 ecr 312615973], length 3
2022-04-06 07:32:13.470779 IP (tos 0x0, ttl 64, id 38254, offset 0, flags [DF], proto TCP (6), length 52)
    127.0.0.1.9950 > 127.0.0.1.46982: Flags [.], cksum 0xfe28 (incorrect -> 0x7263), seq 1, ack 4, win 512, options [nop,nop,TS val 312615973 ecr 312615973], length 0
2022-04-06 07:32:13.470835 IP (tos 0x0, ttl 64, id 38255, offset 0, flags [DF], proto TCP (6), length 54)
    127.0.0.1.9950 > 127.0.0.1.46982: Flags [P.], cksum 0xfe2a (incorrect -> 0x6d59), seq 1:3, ack 4, win 512, options [nop,nop,TS val 312615973 ecr 312615973], length 2
2022-04-06 07:32:13.470851 IP (tos 0x0, ttl 64, id 53099, offset 0, flags [DF], proto TCP (6), length 52)
    127.0.0.1.46982 > 127.0.0.1.9950: Flags [.], cksum 0xfe28 (incorrect -> 0x7261), seq 4, ack 3, win 512, options [nop,nop,TS val 312615973 ecr 312615973], length 0
2022-04-06 07:32:13.472524 IP (tos 0x0, ttl 64, id 53100, offset 0, flags [DF], proto TCP (6), length 62)
    127.0.0.1.46982 > 127.0.0.1.9950: Flags [P.], cksum 0xfe32 (incorrect -> 0x3ea1), seq 4:14, ack 3, win 512, options [nop,nop,TS val 312615975 ecr 312615973], length 10
2022-04-06 07:32:13.472543 IP (tos 0x0, ttl 64, id 38256, offset 0, flags [DF], proto TCP (6), length 52)
    127.0.0.1.9950 > 127.0.0.1.46982: Flags [.], cksum 0xfe28 (incorrect -> 0x7253), seq 3, ack 14, win 512, options [nop,nop,TS val 312615975 ecr 312615975], length 0
2022-04-06 07:32:23.418396 IP (tos 0x0, ttl 64, id 38257, offset 0, flags [DF], proto TCP (6), length 62)
    127.0.0.1.9950 > 127.0.0.1.46982: Flags [P.], cksum 0xfe32 (incorrect -> 0x4666), seq 3:13, ack 14, win 512, options [nop,nop,TS val 312625921 ecr 312615975], length 10
2022-04-06 07:32:23.418407 IP (tos 0x0, ttl 64, id 53101, offset 0, flags [DF], proto TCP (6), length 52)
    127.0.0.1.46982 > 127.0.0.1.9950: Flags [.], cksum 0xfe28 (incorrect -> 0x2495), seq 14, ack 13, win 512, options [nop,nop,TS val 312625921 ecr 312625921], length 0
2022-04-06 07:32:23.424172 IP (tos 0x0, ttl 64, id 53102, offset 0, flags [DF], proto TCP (6), length 569)
    127.0.0.1.46982 > 127.0.0.1.9950: Flags [P.], cksum 0x002e (incorrect -> 0x09ad), seq 14:531, ack 13, win 512, options [nop,nop,TS val 312625927 ecr 312625921], length 517
2022-04-06 07:32:23.424187 IP (tos 0x0, ttl 64, id 38258, offset 0, flags [DF], proto TCP (6), length 52)
    127.0.0.1.9950 > 127.0.0.1.46982: Flags [.], cksum 0xfe28 (incorrect -> 0x2288), seq 13, ack 531, win 508, options [nop,nop,TS val 312625927 ecr 312625927], length 0
2022-04-06 07:32:23.513303 IP (tos 0x0, ttl 64, id 38259, offset 0, flags [DF], proto TCP (6), length 3538)
    127.0.0.1.9950 > 127.0.0.1.46982: Flags [P.], cksum 0x0bc7 (incorrect -> 0x0990), seq 13:3499, ack 531, win 512, options [nop,nop,TS val 312626016 ecr 312625927], length 3486
2022-04-06 07:32:23.513320 IP (tos 0x0, ttl 64, id 53103, offset 0, flags [DF], proto TCP (6), length 52)
    127.0.0.1.46982 > 127.0.0.1.9950: Flags [.], cksum 0xfe28 (incorrect -> 0x1446), seq 531, ack 3499, win 494, options [nop,nop,TS val 312626016 ecr 312626016], length 0
2022-04-06 07:32:23.526278 IP (tos 0x0, ttl 64, id 38260, offset 0, flags [DF], proto TCP (6), length 1334)
    127.0.0.1.9950 > 127.0.0.1.46982: Flags [P.], cksum 0x032b (incorrect -> 0xd5af), seq 3499:4781, ack 531, win 512, options [nop,nop,TS val 312626029 ecr 312626016], length 1282
2022-04-06 07:32:23.526285 IP (tos 0x0, ttl 64, id 53104, offset 0, flags [DF], proto TCP (6), length 52)
    127.0.0.1.46982 > 127.0.0.1.9950: Flags [.], cksum 0xfe28 (incorrect -> 0x0f22), seq 531, ack 4781, win 502, options [nop,nop,TS val 312626029 ecr 312626029], length 0
2022-04-06 07:32:23.526704 IP (tos 0x0, ttl 64, id 53105, offset 0, flags [DF], proto TCP (6), length 116)
    127.0.0.1.46982 > 127.0.0.1.9950: Flags [P.], cksum 0xfe68 (incorrect -> 0x8a5d), seq 531:595, ack 4781, win 512, options [nop,nop,TS val 312626029 ecr 312626029], length 64
2022-04-06 07:32:23.526709 IP (tos 0x0, ttl 64, id 38261, offset 0, flags [DF], proto TCP (6), length 52)
    127.0.0.1.9950 > 127.0.0.1.46982: Flags [.], cksum 0xfe28 (incorrect -> 0x0ed8), seq 4781, ack 595, win 512, options [nop,nop,TS val 312626029 ecr 312626029], length 0
2022-04-06 07:32:23.526994 IP (tos 0x0, ttl 64, id 53106, offset 0, flags [DF], proto TCP (6), length 327)
    127.0.0.1.46982 > 127.0.0.1.9950: Flags [P.], cksum 0xff3b (incorrect -> 0x4414), seq 595:870, ack 4781, win 512, options [nop,nop,TS val 312626029 ecr 312626029], length 275
2022-04-06 07:32:23.526997 IP (tos 0x0, ttl 64, id 38262, offset 0, flags [DF], proto TCP (6), length 52)
    127.0.0.1.9950 > 127.0.0.1.46982: Flags [.], cksum 0xfe28 (incorrect -> 0x0dc7), seq 4781, ack 870, win 510, options [nop,nop,TS val 312626029 ecr 312626029], length 0
2022-04-06 07:32:23.595613 IP (tos 0x0, ttl 64, id 38263, offset 0, flags [DF], proto TCP (6), length 3538)
    127.0.0.1.9950 > 127.0.0.1.46982: Flags [P.], cksum 0x0bc7 (incorrect -> 0xa459), seq 4781:8267, ack 870, win 512, options [nop,nop,TS val 312626098 ecr 312626029], length 3486
2022-04-06 07:32:23.595618 IP (tos 0x0, ttl 64, id 53107, offset 0, flags [DF], proto TCP (6), length 52)
    127.0.0.1.46982 > 127.0.0.1.9950: Flags [.], cksum 0xfe28 (incorrect -> 0xffae), seq 870, ack 8267, win 494, options [nop,nop,TS val 312626098 ecr 312626098], length 0
2022-04-06 07:32:23.603166 IP (tos 0x0, ttl 64, id 38264, offset 0, flags [DF], proto TCP (6), length 4036)
    127.0.0.1.9950 > 127.0.0.1.46982: Flags [P.], cksum 0x0db9 (incorrect -> 0x4670), seq 8267:12251, ack 870, win 512, options [nop,nop,TS val 312626106 ecr 312626098], length 3984
2022-04-06 07:32:23.603170 IP (tos 0x0, ttl 64, id 53108, offset 0, flags [DF], proto TCP (6), length 52)
    127.0.0.1.46982 > 127.0.0.1.9950: Flags [.], cksum 0xfe28 (incorrect -> 0xf010), seq 870, ack 12251, win 492, options [nop,nop,TS val 312626106 ecr 312626106], length 0
2022-04-06 07:32:23.604457 IP (tos 0x0, ttl 64, id 38265, offset 0, flags [DF], proto TCP (6), length 4036)
    127.0.0.1.9950 > 127.0.0.1.46982: Flags [P.], cksum 0x0db9 (incorrect -> 0x569a), seq 12251:16235, ack 870, win 512, options [nop,nop,TS val 312626107 ecr 312626106], length 3984
2022-04-06 07:32:23.604461 IP (tos 0x0, ttl 64, id 53109, offset 0, flags [DF], proto TCP (6), length 52)
    127.0.0.1.46982 > 127.0.0.1.9950: Flags [.], cksum 0xfe28 (incorrect -> 0xe07e), seq 870, ack 16235, win 492, options [nop,nop,TS val 312626107 ecr 312626107], length 0
2022-04-06 07:32:23.610876 IP (tos 0x0, ttl 64, id 38266, offset 0, flags [DF], proto TCP (6), length 3220)
    127.0.0.1.9950 > 127.0.0.1.46982: Flags [P.], cksum 0x0a89 (incorrect -> 0x6d94), seq 16235:19403, ack 870, win 512, options [nop,nop,TS val 312626113 ecr 312626107], length 3168
2022-04-06 07:32:23.610880 IP (tos 0x0, ttl 64, id 53110, offset 0, flags [DF], proto TCP (6), length 52)
    127.0.0.1.46982 > 127.0.0.1.9950: Flags [.], cksum 0xfe28 (incorrect -> 0xd40f), seq 870, ack 19403, win 495, options [nop,nop,TS val 312626113 ecr 312626113], length 0
2022-04-06 07:32:23.613616 IP (tos 0x0, ttl 64, id 38267, offset 0, flags [DF], proto TCP (6), length 4100)
    127.0.0.1.9950 > 127.0.0.1.46982: Flags [P.], cksum 0x0df9 (incorrect -> 0x19c7), seq 19403:23451, ack 870, win 512, options [nop,nop,TS val 312626116 ecr 312626113], length 4048
2022-04-06 07:32:23.613620 IP (tos 0x0, ttl 64, id 53111, offset 0, flags [DF], proto TCP (6), length 52)
    127.0.0.1.46982 > 127.0.0.1.9950: Flags [.], cksum 0xfe28 (incorrect -> 0xc43c), seq 870, ack 23451, win 492, options [nop,nop,TS val 312626116 ecr 312626116], length 0
2022-04-06 07:32:23.613625 IP (tos 0x0, ttl 64, id 38268, offset 0, flags [DF], proto TCP (6), length 3384)
    127.0.0.1.9950 > 127.0.0.1.46982: Flags [P.], cksum 0x0b2d (incorrect -> 0xa95d), seq 23451:26783, ack 870, win 512, options [nop,nop,TS val 312626116 ecr 312626116], length 3332
2022-04-06 07:32:23.613628 IP (tos 0x0, ttl 64, id 53112, offset 0, flags [DF], proto TCP (6), length 52)
    127.0.0.1.46982 > 127.0.0.1.9950: Flags [.], cksum 0xfe28 (incorrect -> 0xb745), seq 870, ack 26783, win 479, options [nop,nop,TS val 312626116 ecr 312626116], length 0
2022-04-06 07:32:23.618168 IP (tos 0x0, ttl 64, id 38269, offset 0, flags [DF], proto TCP (6), length 4036)
    127.0.0.1.9950 > 127.0.0.1.46982: Flags [P.], cksum 0x0db9 (incorrect -> 0x3432), seq 26783:30767, ack 870, win 512, options [nop,nop,TS val 312626121 ecr 312626116], length 3984
2022-04-06 07:32:23.618172 IP (tos 0x0, ttl 64, id 53113, offset 0, flags [DF], proto TCP (6), length 52)
    127.0.0.1.46982 > 127.0.0.1.9950: Flags [.], cksum 0xfe28 (incorrect -> 0xa79e), seq 870, ack 30767, win 492, options [nop,nop,TS val 312626121 ecr 312626121], length 0
2022-04-06 07:32:23.618238 IP (tos 0x0, ttl 64, id 38270, offset 0, flags [DF], proto TCP (6), length 4100)
    127.0.0.1.9950 > 127.0.0.1.46982: Flags [P.], cksum 0x0df9 (incorrect -> 0x123a), seq 30767:34815, ack 870, win 512, options [nop,nop,TS val 312626121 ecr 312626121], length 4048
2022-04-06 07:32:23.618241 IP (tos 0x0, ttl 64, id 53114, offset 0, flags [DF], proto TCP (6), length 52)
    127.0.0.1.46982 > 127.0.0.1.9950: Flags [.], cksum 0xfe28 (incorrect -> 0x97ce), seq 870, ack 34815, win 492, options [nop,nop,TS val 312626121 ecr 312626121], length 0
2022-04-06 07:32:23.618245 IP (tos 0x0, ttl 64, id 38271, offset 0, flags [DF], proto TCP (6), length 486)
    127.0.0.1.9950 > 127.0.0.1.46982: Flags [P.], cksum 0xffda (incorrect -> 0x74a2), seq 34815:35249, ack 870, win 512, options [nop,nop,TS val 312626121 ecr 312626121], length 434
2022-04-06 07:32:23.618247 IP (tos 0x0, ttl 64, id 53115, offset 0, flags [DF], proto TCP (6), length 52)
    127.0.0.1.46982 > 127.0.0.1.9950: Flags [.], cksum 0xfe28 (incorrect -> 0x961e), seq 870, ack 35249, win 490, options [nop,nop,TS val 312626121 ecr 312626121], length 0
2022-04-06 07:32:23.621137 IP (tos 0x0, ttl 64, id 38272, offset 0, flags [DF], proto TCP (6), length 2044)
    127.0.0.1.9950 > 127.0.0.1.46982: Flags [P.], cksum 0x05f1 (incorrect -> 0x79e7), seq 35249:37241, ack 870, win 512, options [nop,nop,TS val 312626124 ecr 312626121], length 1992
2022-04-06 07:32:23.621141 IP (tos 0x0, ttl 64, id 53116, offset 0, flags [DF], proto TCP (6), length 52)
    127.0.0.1.46982 > 127.0.0.1.9950: Flags [.], cksum 0xfe28 (incorrect -> 0x8e46), seq 870, ack 37241, win 500, options [nop,nop,TS val 312626124 ecr 312626124], length 0
2022-04-06 07:32:23.621420 IP (tos 0x0, ttl 64, id 38273, offset 0, flags [DF], proto TCP (6), length 3538)
    127.0.0.1.9950 > 127.0.0.1.46982: Flags [P.], cksum 0x0bc7 (incorrect -> 0xc9e2), seq 37241:40727, ack 870, win 512, options [nop,nop,TS val 312626124 ecr 312626124], length 3486
2022-04-06 07:32:23.621431 IP (tos 0x0, ttl 64, id 53117, offset 0, flags [DF], proto TCP (6), length 52)
    127.0.0.1.46982 > 127.0.0.1.9950: Flags [.], cksum 0xfe28 (incorrect -> 0x809c), seq 870, ack 40727, win 512, options [nop,nop,TS val 312626124 ecr 312626124], length 0
2022-04-06 07:32:23.623470 IP (tos 0x0, ttl 64, id 38274, offset 0, flags [DF], proto TCP (6), length 4036)
    127.0.0.1.9950 > 127.0.0.1.46982: Flags [P.], cksum 0x0db9 (incorrect -> 0x343a), seq 40727:44711, ack 870, win 512, options [nop,nop,TS val 312626126 ecr 312626124], length 3984
2022-04-06 07:32:23.623491 IP (tos 0x0, ttl 64, id 53118, offset 0, flags [DF], proto TCP (6), length 52)
    127.0.0.1.46982 > 127.0.0.1.9950: Flags [.], cksum 0xfe28 (incorrect -> 0x7108), seq 870, ack 44711, win 512, options [nop,nop,TS val 312626126 ecr 312626126], length 0
2022-04-06 07:32:23.623601 IP (tos 0x0, ttl 64, id 38275, offset 0, flags [DF], proto TCP (6), length 3971)
    127.0.0.1.9950 > 127.0.0.1.46982: Flags [P.], cksum 0x0d78 (incorrect -> 0xe2c8), seq 44711:48630, ack 870, win 512, options [nop,nop,TS val 312626126 ecr 312626126], length 3919
2022-04-06 07:32:23.623627 IP (tos 0x0, ttl 64, id 53119, offset 0, flags [DF], proto TCP (6), length 52)
    127.0.0.1.46982 > 127.0.0.1.9950: Flags [.], cksum 0xfe28 (incorrect -> 0x61b9), seq 870, ack 48630, win 512, options [nop,nop,TS val 312626126 ecr 312626126], length 0
2022-04-06 07:32:23.626257 IP (tos 0x0, ttl 64, id 38276, offset 0, flags [DF], proto TCP (6), length 3538)
    127.0.0.1.9950 > 127.0.0.1.46982: Flags [P.], cksum 0x0bc7 (incorrect -> 0x6992), seq 48630:52116, ack 870, win 512, options [nop,nop,TS val 312626129 ecr 312626126], length 3486
2022-04-06 07:32:23.626692 IP (tos 0x0, ttl 64, id 53120, offset 0, flags [DF], proto TCP (6), length 52)
    127.0.0.1.46982 > 127.0.0.1.9950: Flags [.], cksum 0xfe28 (incorrect -> 0x5415), seq 870, ack 52116, win 512, options [nop,nop,TS val 312626129 ecr 312626129], length 0
2022-04-06 07:32:23.626742 IP (tos 0x0, ttl 64, id 38277, offset 0, flags [DF], proto TCP (6), length 4100)
    127.0.0.1.9950 > 127.0.0.1.46982: Flags [P.], cksum 0x0df9 (incorrect -> 0x477a), seq 52116:56164, ack 870, win 512, options [nop,nop,TS val 312626129 ecr 312626129], length 4048
2022-04-06 07:32:23.647204 IP (tos 0x0, ttl 64, id 38278, offset 0, flags [DF], proto TCP (6), length 32820)
    127.0.0.1.9950 > 127.0.0.1.46982: Flags [.], cksum 0x7e29 (incorrect -> 0x606e), seq 56164:88932, ack 870, win 512, options [nop,nop,TS val 312626150 ecr 312626129], length 32768
2022-04-06 07:32:23.647223 IP (tos 0x0, ttl 64, id 53121, offset 0, flags [DF], proto TCP (6), length 52)
    127.0.0.1.46982 > 127.0.0.1.9950: Flags [.], cksum 0xfe28 (incorrect -> 0xc4b4), seq 870, ack 88932, win 379, options [nop,nop,TS val 312626150 ecr 312626129], length 0
2022-04-06 07:32:23.647226 IP (tos 0x0, ttl 64, id 38279, offset 0, flags [DF], proto TCP (6), length 2518)
    127.0.0.1.9950 > 127.0.0.1.46982: Flags [P.], cksum 0x07cb (incorrect -> 0x9b95), seq 88932:91398, ack 870, win 512, options [nop,nop,TS val 312626150 ecr 312626150], length 2466
2022-04-06 07:32:23.647798 IP (tos 0x0, ttl 64, id 53122, offset 0, flags [DF], proto TCP (6), length 52)
    127.0.0.1.46982 > 127.0.0.1.9950: Flags [.], cksum 0xfe28 (incorrect -> 0xba78), seq 870, ack 91398, win 512, options [nop,nop,TS val 312626150 ecr 312626150], length 0
2022-04-06 07:32:23.647836 IP (tos 0x0, ttl 64, id 38280, offset 0, flags [DF], proto TCP (6), length 3538)
    127.0.0.1.9950 > 127.0.0.1.46982: Flags [P.], cksum 0x0bc7 (incorrect -> 0xcf1a), seq 91398:94884, ack 870, win 512, options [nop,nop,TS val 312626150 ecr 312626150], length 3486
2022-04-06 07:32:23.647846 IP (tos 0x0, ttl 64, id 53123, offset 0, flags [DF], proto TCP (6), length 52)
    127.0.0.1.46982 > 127.0.0.1.9950: Flags [.], cksum 0xfe28 (incorrect -> 0xacda), seq 870, ack 94884, win 512, options [nop,nop,TS val 312626150 ecr 312626150], length 0
2022-04-06 07:32:23.654027 IP (tos 0x0, ttl 64, id 38281, offset 0, flags [DF], proto TCP (6), length 4036)
    127.0.0.1.9950 > 127.0.0.1.46982: Flags [P.], cksum 0x0db9 (incorrect -> 0xf91d), seq 94884:98868, ack 870, win 512, options [nop,nop,TS val 312626156 ecr 312626150], length 3984
2022-04-06 07:32:23.654038 IP (tos 0x0, ttl 64, id 53124, offset 0, flags [DF], proto TCP (6), length 52)
    127.0.0.1.46982 > 127.0.0.1.9950: Flags [.], cksum 0xfe28 (incorrect -> 0x9d3e), seq 870, ack 98868, win 512, options [nop,nop,TS val 312626156 ecr 312626156], length 0
2022-04-06 07:32:23.656331 IP (tos 0x0, ttl 64, id 38282, offset 0, flags [DF], proto TCP (6), length 4036)
    127.0.0.1.9950 > 127.0.0.1.46982: Flags [P.], cksum 0x0db9 (incorrect -> 0x2952), seq 98868:102852, ack 870, win 512, options [nop,nop,TS val 312626159 ecr 312626156], length 3984
200, 4.509945392608643, 10.237600803375244