2022-04-06 20:23:52.062522 IP (tos 0x0, ttl 64, id 47051, offset 0, flags [DF], proto TCP (6), length 60)
    127.0.0.1.50770 > 127.0.0.1.10150: Flags [S], cksum 0xfe30 (incorrect -> 0x1feb), seq 2451112091, win 65495, options [mss 65495,sackOK,TS val 358914565 ecr 0,nop,wscale 7], length 0
2022-04-06 20:23:52.062532 IP (tos 0x0, ttl 64, id 0, offset 0, flags [DF], proto TCP (6), length 60)
    127.0.0.1.10150 > 127.0.0.1.50770: Flags [S.], cksum 0xfe30 (incorrect -> 0x7fb8), seq 2488753260, ack 2451112092, win 65483, options [mss 65495,sackOK,TS val 358914565 ecr 358914565,nop,wscale 7], length 0
2022-04-06 20:23:52.062541 IP (tos 0x0, ttl 64, id 47052, offset 0, flags [DF], proto TCP (6), length 52)
    127.0.0.1.50770 > 127.0.0.1.10150: Flags [.], cksum 0xfe28 (incorrect -> 0xa674), seq 1, ack 1, win 512, options [nop,nop,TS val 358914565 ecr 358914565], length 0
2022-04-06 20:23:52.062629 IP (tos 0x0, ttl 64, id 47053, offset 0, flags [DF], proto TCP (6), length 55)
    127.0.0.1.50770 > 127.0.0.1.10150: Flags [P.], cksum 0xfe2b (incorrect -> 0xa168), seq 1:4, ack 1, win 512, options [nop,nop,TS val 358914565 ecr 358914565], length 3
2022-04-06 20:23:52.062659 IP (tos 0x0, ttl 64, id 62906, offset 0, flags [DF], proto TCP (6), length 52)
    127.0.0.1.10150 > 127.0.0.1.50770: Flags [.], cksum 0xfe28 (incorrect -> 0xa671), seq 1, ack 4, win 512, options [nop,nop,TS val 358914565 ecr 358914565], length 0
2022-04-06 20:23:52.062689 IP (tos 0x0, ttl 64, id 62907, offset 0, flags [DF], proto TCP (6), length 54)
    127.0.0.1.10150 > 127.0.0.1.50770: Flags [P.], cksum 0xfe2a (incorrect -> 0xa167), seq 1:3, ack 4, win 512, options [nop,nop,TS val 358914565 ecr 358914565], length 2
2022-04-06 20:23:52.062703 IP (tos 0x0, ttl 64, id 47054, offset 0, flags [DF], proto TCP (6), length 52)
    127.0.0.1.50770 > 127.0.0.1.10150: Flags [.], cksum 0xfe28 (incorrect -> 0xa66f), seq 4, ack 3, win 512, options [nop,nop,TS val 358914565 ecr 358914565], length 0
2022-04-06 20:23:52.064241 IP (tos 0x0, ttl 64, id 47055, offset 0, flags [DF], proto TCP (6), length 62)
    127.0.0.1.50770 > 127.0.0.1.10150: Flags [P.], cksum 0xfe32 (incorrect -> 0x1660), seq 4:14, ack 3, win 512, options [nop,nop,TS val 358914567 ecr 358914565], length 10
2022-04-06 20:23:52.064258 IP (tos 0x0, ttl 64, id 62908, offset 0, flags [DF], proto TCP (6), length 52)
    127.0.0.1.10150 > 127.0.0.1.50770: Flags [.], cksum 0xfe28 (incorrect -> 0xa661), seq 3, ack 14, win 512, options [nop,nop,TS val 358914567 ecr 358914567], length 0
2022-04-06 20:23:52.171090 IP (tos 0x0, ttl 64, id 62909, offset 0, flags [DF], proto TCP (6), length 62)
    127.0.0.1.10150 > 127.0.0.1.50770: Flags [P.], cksum 0xfe32 (incorrect -> 0xa0e3), seq 3:13, ack 14, win 512, options [nop,nop,TS val 358914674 ecr 358914567], length 10
2022-04-06 20:23:52.171099 IP (tos 0x0, ttl 64, id 47056, offset 0, flags [DF], proto TCP (6), length 52)
    127.0.0.1.50770 > 127.0.0.1.10150: Flags [.], cksum 0xfe28 (incorrect -> 0xa581), seq 14, ack 13, win 512, options [nop,nop,TS val 358914674 ecr 358914674], length 0
2022-04-06 20:23:52.176911 IP (tos 0x0, ttl 64, id 47057, offset 0, flags [DF], proto TCP (6), length 569)
    127.0.0.1.50770 > 127.0.0.1.10150: Flags [P.], cksum 0x002e (incorrect -> 0xa744), seq 14:531, ack 13, win 512, options [nop,nop,TS val 358914679 ecr 358914674], length 517
2022-04-06 20:23:52.176923 IP (tos 0x0, ttl 64, id 62910, offset 0, flags [DF], proto TCP (6), length 52)
    127.0.0.1.10150 > 127.0.0.1.50770: Flags [.], cksum 0xfe28 (incorrect -> 0xa376), seq 13, ack 531, win 508, options [nop,nop,TS val 358914679 ecr 358914679], length 0
2022-04-06 20:23:52.286539 IP (tos 0x0, ttl 64, id 62911, offset 0, flags [DF], proto TCP (6), length 3446)
    127.0.0.1.10150 > 127.0.0.1.50770: Flags [P.], cksum 0x0b6b (incorrect -> 0xacf7), seq 13:3407, ack 531, win 512, options [nop,nop,TS val 358914789 ecr 358914679], length 3394
2022-04-06 20:23:52.286548 IP (tos 0x0, ttl 64, id 47058, offset 0, flags [DF], proto TCP (6), length 52)
    127.0.0.1.50770 > 127.0.0.1.10150: Flags [.], cksum 0xfe28 (incorrect -> 0x9566), seq 531, ack 3407, win 494, options [nop,nop,TS val 358914789 ecr 358914789], length 0
2022-04-06 20:23:52.317363 IP (tos 0x0, ttl 64, id 62912, offset 0, flags [DF], proto TCP (6), length 1243)
    127.0.0.1.10150 > 127.0.0.1.50770: Flags [P.], cksum 0x02d0 (incorrect -> 0xa276), seq 3407:4598, ack 531, win 512, options [nop,nop,TS val 358914820 ecr 358914789], length 1191
2022-04-06 20:23:52.317372 IP (tos 0x0, ttl 64, id 47059, offset 0, flags [DF], proto TCP (6), length 52)
    127.0.0.1.50770 > 127.0.0.1.10150: Flags [.], cksum 0xfe28 (incorrect -> 0x9078), seq 531, ack 4598, win 503, options [nop,nop,TS val 358914820 ecr 358914820], length 0
2022-04-06 20:23:52.317746 IP (tos 0x0, ttl 64, id 47060, offset 0, flags [DF], proto TCP (6), length 132)
    127.0.0.1.50770 > 127.0.0.1.10150: Flags [P.], cksum 0xfe78 (incorrect -> 0xc337), seq 531:611, ack 4598, win 512, options [nop,nop,TS val 358914820 ecr 358914820], length 80
2022-04-06 20:23:52.317755 IP (tos 0x0, ttl 64, id 62913, offset 0, flags [DF], proto TCP (6), length 52)
    127.0.0.1.10150 > 127.0.0.1.50770: Flags [.], cksum 0xfe28 (incorrect -> 0x901f), seq 4598, ack 611, win 512, options [nop,nop,TS val 358914820 ecr 358914820], length 0
2022-04-06 20:23:52.318100 IP (tos 0x0, ttl 64, id 47061, offset 0, flags [DF], proto TCP (6), length 374)
    127.0.0.1.50770 > 127.0.0.1.10150: Flags [P.], cksum 0xff6a (incorrect -> 0xa1a4), seq 611:933, ack 4598, win 512, options [nop,nop,TS val 358914821 ecr 358914820], length 322
2022-04-06 20:23:52.318108 IP (tos 0x0, ttl 64, id 62914, offset 0, flags [DF], proto TCP (6), length 52)
    127.0.0.1.10150 > 127.0.0.1.50770: Flags [.], cksum 0xfe28 (incorrect -> 0x8edd), seq 4598, ack 933, win 510, options [nop,nop,TS val 358914821 ecr 358914821], length 0
2022-04-06 20:23:52.448958 IP (tos 0x0, ttl 64, id 62915, offset 0, flags [DF], proto TCP (6), length 131)
    127.0.0.1.10150 > 127.0.0.1.50770: Flags [P.], cksum 0xfe77 (incorrect -> 0xfbe6), seq 4598:4677, ack 933, win 512, options [nop,nop,TS val 358914951 ecr 358914821], length 79
2022-04-06 20:23:52.490670 IP (tos 0x0, ttl 64, id 47062, offset 0, flags [DF], proto TCP (6), length 52)
    127.0.0.1.50770 > 127.0.0.1.10150: Flags [.], cksum 0xfe28 (incorrect -> 0x8d5e), seq 933, ack 4677, win 512, options [nop,nop,TS val 358914993 ecr 358914951], length 0
2022-04-06 20:23:52.509742 IP (tos 0x0, ttl 64, id 62916, offset 0, flags [DF], proto TCP (6), length 1579)
    127.0.0.1.10150 > 127.0.0.1.50770: Flags [P.], cksum 0x0420 (incorrect -> 0xc92a), seq 4677:6204, ack 933, win 512, options [nop,nop,TS val 358915012 ecr 358914993], length 1527
2022-04-06 20:23:52.509751 IP (tos 0x0, ttl 64, id 47063, offset 0, flags [DF], proto TCP (6), length 52)
    127.0.0.1.50770 > 127.0.0.1.10150: Flags [.], cksum 0xfe28 (incorrect -> 0x8721), seq 933, ack 6204, win 502, options [nop,nop,TS val 358915012 ecr 358915012], length 0
2022-04-06 20:23:52.534155 IP (tos 0x0, ttl 64, id 62917, offset 0, flags [DF], proto TCP (6), length 3538)
    127.0.0.1.10150 > 127.0.0.1.50770: Flags [P.], cksum 0x0bc7 (incorrect -> 0x1de5), seq 6204:9690, ack 933, win 512, options [nop,nop,TS val 358915037 ecr 358915012], length 3486
2022-04-06 20:23:52.534163 IP (tos 0x0, ttl 64, id 47064, offset 0, flags [DF], proto TCP (6), length 52)
    127.0.0.1.50770 > 127.0.0.1.10150: Flags [.], cksum 0xfe28 (incorrect -> 0x7959), seq 933, ack 9690, win 494, options [nop,nop,TS val 358915037 ecr 358915037], length 0
2022-04-06 20:23:52.544350 IP (tos 0x0, ttl 64, id 62918, offset 0, flags [DF], proto TCP (6), length 3538)
    127.0.0.1.10150 > 127.0.0.1.50770: Flags [P.], cksum 0x0bc7 (incorrect -> 0x9302), seq 9690:13176, ack 933, win 512, options [nop,nop,TS val 358915047 ecr 358915037], length 3486
2022-04-06 20:23:52.544358 IP (tos 0x0, ttl 64, id 47065, offset 0, flags [DF], proto TCP (6), length 52)
    127.0.0.1.50770 > 127.0.0.1.10150: Flags [.], cksum 0xfe28 (incorrect -> 0x6ba7), seq 933, ack 13176, win 494, options [nop,nop,TS val 358915047 ecr 358915047], length 0
2022-04-06 20:23:52.546081 IP (tos 0x0, ttl 64, id 62919, offset 0, flags [DF], proto TCP (6), length 3538)
    127.0.0.1.10150 > 127.0.0.1.50770: Flags [P.], cksum 0x0bc7 (incorrect -> 0x888e), seq 13176:16662, ack 933, win 512, options [nop,nop,TS val 358915049 ecr 358915047], length 3486
2022-04-06 20:23:52.546087 IP (tos 0x0, ttl 64, id 47066, offset 0, flags [DF], proto TCP (6), length 52)
    127.0.0.1.50770 > 127.0.0.1.10150: Flags [.], cksum 0xfe28 (incorrect -> 0x5e05), seq 933, ack 16662, win 494, options [nop,nop,TS val 358915049 ecr 358915049], length 0
2022-04-06 20:23:52.547741 IP (tos 0x0, ttl 64, id 62920, offset 0, flags [DF], proto TCP (6), length 3124)
    127.0.0.1.10150 > 127.0.0.1.50770: Flags [P.], cksum 0x0a29 (incorrect -> 0x383b), seq 16662:19734, ack 933, win 512, options [nop,nop,TS val 358915050 ecr 358915049], length 3072
2022-04-06 20:23:52.547747 IP (tos 0x0, ttl 64, id 47067, offset 0, flags [DF], proto TCP (6), length 52)
    127.0.0.1.50770 > 127.0.0.1.10150: Flags [.], cksum 0xfe28 (incorrect -> 0x5202), seq 933, ack 19734, win 495, options [nop,nop,TS val 358915050 ecr 358915050], length 0
2022-04-06 20:23:52.549504 IP (tos 0x0, ttl 64, id 62921, offset 0, flags [DF], proto TCP (6), length 1048)
    127.0.0.1.10150 > 127.0.0.1.50770: Flags [P.], cksum 0x020d (incorrect -> 0xf46d), seq 19734:20730, ack 933, win 512, options [nop,nop,TS val 358915052 ecr 358915050], length 996
2022-04-06 20:23:52.549510 IP (tos 0x0, ttl 64, id 47068, offset 0, flags [DF], proto TCP (6), length 52)
    127.0.0.1.50770 > 127.0.0.1.10150: Flags [.], cksum 0xfe28 (incorrect -> 0x4e11), seq 933, ack 20730, win 504, options [nop,nop,TS val 358915052 ecr 358915052], length 0
2022-04-06 20:23:52.551199 IP (tos 0x0, ttl 64, id 62922, offset 0, flags [DF], proto TCP (6), length 3944)
    127.0.0.1.10150 > 127.0.0.1.50770: Flags [P.], cksum 0x0d5d (incorrect -> 0xe078), seq 20730:24622, ack 933, win 512, options [nop,nop,TS val 358915054 ecr 358915052], length 3892
2022-04-06 20:23:52.551206 IP (tos 0x0, ttl 64, id 47069, offset 0, flags [DF], proto TCP (6), length 52)
    127.0.0.1.50770 > 127.0.0.1.10150: Flags [.], cksum 0xfe28 (incorrect -> 0x3ee5), seq 933, ack 24622, win 492, options [nop,nop,TS val 358915054 ecr 358915054], length 0
2022-04-06 20:23:52.552878 IP (tos 0x0, ttl 64, id 62923, offset 0, flags [DF], proto TCP (6), length 3538)
    127.0.0.1.10150 > 127.0.0.1.50770: Flags [P.], cksum 0x0bc7 (incorrect -> 0xafce), seq 24622:28108, ack 933, win 512, options [nop,nop,TS val 358915055 ecr 358915054], length 3486
2022-04-06 20:23:52.552895 IP (tos 0x0, ttl 64, id 47070, offset 0, flags [DF], proto TCP (6), length 52)
    127.0.0.1.50770 > 127.0.0.1.10150: Flags [.], cksum 0xfe28 (incorrect -> 0x3131), seq 933, ack 28108, win 512, options [nop,nop,TS val 358915055 ecr 358915055], length 0
2022-04-06 20:23:52.558573 IP (tos 0x0, ttl 64, id 62924, offset 0, flags [DF], proto TCP (6), length 4100)
    127.0.0.1.10150 > 127.0.0.1.50770: Flags [P.], cksum 0x0df9 (incorrect -> 0x43a3), seq 28108:32156, ack 933, win 512, options [nop,nop,TS val 358915061 ecr 358915055], length 4048
2022-04-06 20:23:52.598662 IP (tos 0x0, ttl 64, id 47071, offset 0, flags [DF], proto TCP (6), length 52)
    127.0.0.1.50770 > 127.0.0.1.10150: Flags [.], cksum 0xfe28 (incorrect -> 0x212d), seq 933, ack 32156, win 512, options [nop,nop,TS val 358915101 ecr 358915061], length 0
2022-04-06 20:23:52.598674 IP (tos 0x0, ttl 64, id 62925, offset 0, flags [DF], proto TCP (6), length 21570)
    127.0.0.1.10150 > 127.0.0.1.50770: Flags [P.], cksum 0x5237 (incorrect -> 0x5701), seq 32156:53674, ack 933, win 512, options [nop,nop,TS val 358915101 ecr 358915101], length 21518
2022-04-06 20:23:52.642665 IP (tos 0x0, ttl 64, id 47072, offset 0, flags [DF], proto TCP (6), length 52)
    127.0.0.1.50770 > 127.0.0.1.10150: Flags [.], cksum 0xfe28 (incorrect -> 0xccca), seq 933, ack 53674, win 512, options [nop,nop,TS val 358915145 ecr 358915101], length 0
2022-04-06 20:23:52.642680 IP (tos 0x0, ttl 64, id 62926, offset 0, flags [DF], proto TCP (6), length 25120)
    127.0.0.1.10150 > 127.0.0.1.50770: Flags [P.], cksum 0x6015 (incorrect -> 0x476c), seq 53674:78742, ack 933, win 512, options [nop,nop,TS val 358915145 ecr 358915145], length 25068
2022-04-06 20:23:52.676668 IP (tos 0x0, ttl 64, id 62927, offset 0, flags [DF], proto TCP (6), length 32820)
    127.0.0.1.10150 > 127.0.0.1.50770: Flags [.], cksum 0x7e29 (incorrect -> 0x138f), seq 78742:111510, ack 933, win 512, options [nop,nop,TS val 358915179 ecr 358915145], length 32768
2022-04-06 20:23:52.676677 IP (tos 0x0, ttl 64, id 47073, offset 0, flags [DF], proto TCP (6), length 52)
    127.0.0.1.50770 > 127.0.0.1.10150: Flags [.], cksum 0xfe28 (incorrect -> 0xeb14), seq 933, ack 111510, win 379, options [nop,nop,TS val 358915179 ecr 358915145], length 0
2022-04-06 20:23:52.676686 IP (tos 0x0, ttl 64, id 62928, offset 0, flags [DF], proto TCP (6), length 4046)
    127.0.0.1.10150 > 127.0.0.1.50770: Flags [P.], cksum 0x0dc3 (incorrect -> 0x28cd), seq 111510:115504, ack 933, win 512, options [nop,nop,TS val 358915179 ecr 358915179], length 3994
2022-04-06 20:23:52.677317 IP (tos 0x0, ttl 64, id 47074, offset 0, flags [DF], proto TCP (6), length 52)
    127.0.0.1.50770 > 127.0.0.1.10150: Flags [.], cksum 0xfe28 (incorrect -> 0xdad2), seq 933, ack 115504, win 512, options [nop,nop,TS val 358915180 ecr 358915179], length 0
2022-04-06 20:23:52.677322 IP (tos 0x0, ttl 64, id 62929, offset 0, flags [DF], proto TCP (6), length 348)
    127.0.0.1.10150 > 127.0.0.1.50770: Flags [P.], cksum 0xff50 (incorrect -> 0xa510), seq 115504:115800, ack 933, win 512, options [nop,nop,TS val 358915180 ecr 358915180], length 296
2022-04-06 20:23:52.677327 IP (tos 0x0, ttl 64, id 47075, offset 0, flags [DF], proto TCP (6), length 52)
    127.0.0.1.50770 > 127.0.0.1.10150: Flags [.], cksum 0xfe28 (incorrect -> 0xd9a9), seq 933, ack 115800, win 512, options [nop,nop,TS val 358915180 ecr 358915180], length 0
2022-04-06 20:23:52.677586 IP (tos 0x0, ttl 64, id 62930, offset 0, flags [DF], proto TCP (6), length 2044)
    127.0.0.1.10150 > 127.0.0.1.50770: Flags [P.], cksum 0x05f1 (incorrect -> 0xf7b0), seq 115800:117792, ack 933, win 512, options [nop,nop,TS val 358915180 ecr 358915180], length 1992
2022-04-06 20:23:52.677600 IP (tos 0x0, ttl 64, id 47076, offset 0, flags [DF], proto TCP (6), length 52)
    127.0.0.1.50770 > 127.0.0.1.10150: Flags [.], cksum 0xfe28 (incorrect -> 0xd1e1), seq 933, ack 117792, win 512, options [nop,nop,TS val 358915180 ecr 358915180], length 0
2022-04-06 20:23:52.704425 IP (tos 0x0, ttl 64, id 62931, offset 0, flags [DF], proto TCP (6), length 4036)
    127.0.0.1.10150 > 127.0.0.1.50770: Flags [P.], cksum 0x0db9 (incorrect -> 0x5f26), seq 117792:121776, ack 933, win 512, options [nop,nop,TS val 358915207 ecr 358915180], length 3984
2022-04-06 20:23:52.705295 IP (tos 0x0, ttl 64, id 47077, offset 0, flags [DF], proto TCP (6), length 52)
    127.0.0.1.50770 > 127.0.0.1.10150: Flags [.], cksum 0xfe28 (incorrect -> 0xc21a), seq 933, ack 121776, win 512, options [nop,nop,TS val 358915208 ecr 358915207], length 0
200, 4.96376895904541, 0.6928815841674805