2022-04-06 17:27:06.007119 IP (tos 0x0, ttl 64, id 56673, offset 0, flags [DF], proto TCP (6), length 60)
    127.0.0.1.57386 > 127.0.0.1.11450: Flags [S], cksum 0xfe30 (incorrect -> 0xb219), seq 2470192358, win 65495, options [mss 65495,sackOK,TS val 348308510 ecr 0,nop,wscale 7], length 0
2022-04-06 17:27:06.007128 IP (tos 0x0, ttl 64, id 0, offset 0, flags [DF], proto TCP (6), length 60)
    127.0.0.1.11450 > 127.0.0.1.57386: Flags [S.], cksum 0xfe30 (incorrect -> 0xf7d2), seq 741061941, ack 2470192359, win 65483, options [mss 65495,sackOK,TS val 348308510 ecr 348308510,nop,wscale 7], length 0
2022-04-06 17:27:06.007136 IP (tos 0x0, ttl 64, id 56674, offset 0, flags [DF], proto TCP (6), length 52)
    127.0.0.1.57386 > 127.0.0.1.11450: Flags [.], cksum 0xfe28 (incorrect -> 0x1e8f), seq 1, ack 1, win 512, options [nop,nop,TS val 348308510 ecr 348308510], length 0
2022-04-06 17:27:06.007224 IP (tos 0x0, ttl 64, id 56675, offset 0, flags [DF], proto TCP (6), length 55)
    127.0.0.1.57386 > 127.0.0.1.11450: Flags [P.], cksum 0xfe2b (incorrect -> 0x1983), seq 1:4, ack 1, win 512, options [nop,nop,TS val 348308510 ecr 348308510], length 3
2022-04-06 17:27:06.007237 IP (tos 0x0, ttl 64, id 21116, offset 0, flags [DF], proto TCP (6), length 52)
    127.0.0.1.11450 > 127.0.0.1.57386: Flags [.], cksum 0xfe28 (incorrect -> 0x1e8c), seq 1, ack 4, win 512, options [nop,nop,TS val 348308510 ecr 348308510], length 0
2022-04-06 17:27:06.007290 IP (tos 0x0, ttl 64, id 21117, offset 0, flags [DF], proto TCP (6), length 54)
    127.0.0.1.11450 > 127.0.0.1.57386: Flags [P.], cksum 0xfe2a (incorrect -> 0x1982), seq 1:3, ack 4, win 512, options [nop,nop,TS val 348308510 ecr 348308510], length 2
2022-04-06 17:27:06.007308 IP (tos 0x0, ttl 64, id 56676, offset 0, flags [DF], proto TCP (6), length 52)
    127.0.0.1.57386 > 127.0.0.1.11450: Flags [.], cksum 0xfe28 (incorrect -> 0x1e8a), seq 4, ack 3, win 512, options [nop,nop,TS val 348308510 ecr 348308510], length 0
2022-04-06 17:27:06.008810 IP (tos 0x0, ttl 64, id 56677, offset 0, flags [DF], proto TCP (6), length 62)
    127.0.0.1.57386 > 127.0.0.1.11450: Flags [P.], cksum 0xfe32 (incorrect -> 0x836d), seq 4:14, ack 3, win 512, options [nop,nop,TS val 348308511 ecr 348308510], length 10
2022-04-06 17:27:06.008827 IP (tos 0x0, ttl 64, id 21118, offset 0, flags [DF], proto TCP (6), length 52)
    127.0.0.1.11450 > 127.0.0.1.57386: Flags [.], cksum 0xfe28 (incorrect -> 0x1e7e), seq 3, ack 14, win 512, options [nop,nop,TS val 348308511 ecr 348308511], length 0
2022-04-06 17:27:06.093423 IP (tos 0x0, ttl 64, id 21119, offset 0, flags [DF], proto TCP (6), length 62)
    127.0.0.1.11450 > 127.0.0.1.57386: Flags [P.], cksum 0xfe32 (incorrect -> 0x1916), seq 3:13, ack 14, win 512, options [nop,nop,TS val 348308596 ecr 348308511], length 10
2022-04-06 17:27:06.093435 IP (tos 0x0, ttl 64, id 56678, offset 0, flags [DF], proto TCP (6), length 52)
    127.0.0.1.57386 > 127.0.0.1.11450: Flags [.], cksum 0xfe28 (incorrect -> 0x1dca), seq 14, ack 13, win 512, options [nop,nop,TS val 348308596 ecr 348308596], length 0
2022-04-06 17:27:06.099081 IP (tos 0x0, ttl 64, id 56679, offset 0, flags [DF], proto TCP (6), length 569)
    127.0.0.1.57386 > 127.0.0.1.11450: Flags [P.], cksum 0x002e (incorrect -> 0x2a51), seq 14:531, ack 13, win 512, options [nop,nop,TS val 348308602 ecr 348308596], length 517
2022-04-06 17:27:06.099090 IP (tos 0x0, ttl 64, id 21120, offset 0, flags [DF], proto TCP (6), length 52)
    127.0.0.1.11450 > 127.0.0.1.57386: Flags [.], cksum 0xfe28 (incorrect -> 0x1bbd), seq 13, ack 531, win 508, options [nop,nop,TS val 348308602 ecr 348308602], length 0
2022-04-06 17:27:06.174978 IP (tos 0x0, ttl 64, id 21121, offset 0, flags [DF], proto TCP (6), length 3538)
    127.0.0.1.11450 > 127.0.0.1.57386: Flags [P.], cksum 0x0bc7 (incorrect -> 0xc968), seq 13:3499, ack 531, win 512, options [nop,nop,TS val 348308677 ecr 348308602], length 3486
2022-04-06 17:27:06.174987 IP (tos 0x0, ttl 64, id 56680, offset 0, flags [DF], proto TCP (6), length 52)
    127.0.0.1.57386 > 127.0.0.1.11450: Flags [.], cksum 0xfe28 (incorrect -> 0x0d97), seq 531, ack 3499, win 494, options [nop,nop,TS val 348308677 ecr 348308677], length 0
2022-04-06 17:27:06.217271 IP (tos 0x0, ttl 64, id 21122, offset 0, flags [DF], proto TCP (6), length 781)
    127.0.0.1.11450 > 127.0.0.1.57386: Flags [P.], cksum 0x0102 (incorrect -> 0x0a01), seq 3499:4228, ack 531, win 512, options [nop,nop,TS val 348308720 ecr 348308677], length 729
2022-04-06 17:27:06.217279 IP (tos 0x0, ttl 64, id 56681, offset 0, flags [DF], proto TCP (6), length 52)
    127.0.0.1.57386 > 127.0.0.1.11450: Flags [.], cksum 0xfe28 (incorrect -> 0x0a5d), seq 531, ack 4228, win 505, options [nop,nop,TS val 348308720 ecr 348308720], length 0
2022-04-06 17:27:06.217633 IP (tos 0x0, ttl 64, id 56682, offset 0, flags [DF], proto TCP (6), length 132)
    127.0.0.1.57386 > 127.0.0.1.11450: Flags [P.], cksum 0xfe78 (incorrect -> 0xbd21), seq 531:611, ack 4228, win 512, options [nop,nop,TS val 348308720 ecr 348308720], length 80
2022-04-06 17:27:06.217641 IP (tos 0x0, ttl 64, id 21123, offset 0, flags [DF], proto TCP (6), length 52)
    127.0.0.1.11450 > 127.0.0.1.57386: Flags [.], cksum 0xfe28 (incorrect -> 0x0a06), seq 4228, ack 611, win 512, options [nop,nop,TS val 348308720 ecr 348308720], length 0
2022-04-06 17:27:06.218014 IP (tos 0x0, ttl 64, id 56683, offset 0, flags [DF], proto TCP (6), length 358)
    127.0.0.1.57386 > 127.0.0.1.11450: Flags [P.], cksum 0xff5a (incorrect -> 0x7dd8), seq 611:917, ack 4228, win 512, options [nop,nop,TS val 348308720 ecr 348308720], length 306
2022-04-06 17:27:06.218022 IP (tos 0x0, ttl 64, id 21124, offset 0, flags [DF], proto TCP (6), length 52)
    127.0.0.1.11450 > 127.0.0.1.57386: Flags [.], cksum 0xfe28 (incorrect -> 0x08d6), seq 4228, ack 917, win 510, options [nop,nop,TS val 348308720 ecr 348308720], length 0
2022-04-06 17:27:06.290697 IP (tos 0x0, ttl 64, id 21125, offset 0, flags [DF], proto TCP (6), length 323)
    127.0.0.1.11450 > 127.0.0.1.57386: Flags [P.], cksum 0xff37 (incorrect -> 0x3582), seq 4228:4499, ack 917, win 512, options [nop,nop,TS val 348308793 ecr 348308720], length 271
2022-04-06 17:27:06.290709 IP (tos 0x0, ttl 64, id 56684, offset 0, flags [DF], proto TCP (6), length 52)
    127.0.0.1.57386 > 127.0.0.1.11450: Flags [.], cksum 0xfe28 (incorrect -> 0x0735), seq 917, ack 4499, win 510, options [nop,nop,TS val 348308793 ecr 348308793], length 0
2022-04-06 17:27:06.333401 IP (tos 0x0, ttl 64, id 21126, offset 0, flags [DF], proto TCP (6), length 3311)
    127.0.0.1.11450 > 127.0.0.1.57386: Flags [P.], cksum 0x0ae4 (incorrect -> 0xdd05), seq 4499:7758, ack 917, win 512, options [nop,nop,TS val 348308836 ecr 348308793], length 3259
2022-04-06 17:27:06.333409 IP (tos 0x0, ttl 64, id 56685, offset 0, flags [DF], proto TCP (6), length 52)
    127.0.0.1.57386 > 127.0.0.1.11450: Flags [.], cksum 0xfe28 (incorrect -> 0xfa32), seq 917, ack 7758, win 495, options [nop,nop,TS val 348308836 ecr 348308836], length 0
2022-04-06 17:27:06.334646 IP (tos 0x0, ttl 64, id 21127, offset 0, flags [DF], proto TCP (6), length 3852)
    127.0.0.1.11450 > 127.0.0.1.57386: Flags [P.], cksum 0x0d01 (incorrect -> 0x5621), seq 7758:11558, ack 917, win 512, options [nop,nop,TS val 348308837 ecr 348308836], length 3800
2022-04-06 17:27:06.334652 IP (tos 0x0, ttl 64, id 56686, offset 0, flags [DF], proto TCP (6), length 52)
    127.0.0.1.57386 > 127.0.0.1.11450: Flags [.], cksum 0xfe28 (incorrect -> 0xeb5a), seq 917, ack 11558, win 493, options [nop,nop,TS val 348308837 ecr 348308837], length 0
2022-04-06 17:27:06.349094 IP (tos 0x0, ttl 64, id 21128, offset 0, flags [DF], proto TCP (6), length 2450)
    127.0.0.1.11450 > 127.0.0.1.57386: Flags [P.], cksum 0x0787 (incorrect -> 0x857d), seq 11558:13956, ack 917, win 512, options [nop,nop,TS val 348308852 ecr 348308837], length 2398
2022-04-06 17:27:06.349106 IP (tos 0x0, ttl 64, id 56687, offset 0, flags [DF], proto TCP (6), length 52)
    127.0.0.1.57386 > 127.0.0.1.11450: Flags [.], cksum 0xfe28 (incorrect -> 0xe1d9), seq 917, ack 13956, win 498, options [nop,nop,TS val 348308852 ecr 348308852], length 0
2022-04-06 17:27:06.354122 IP (tos 0x0, ttl 64, id 21129, offset 0, flags [DF], proto TCP (6), length 3492)
    127.0.0.1.11450 > 127.0.0.1.57386: Flags [P.], cksum 0x0b99 (incorrect -> 0x95b0), seq 13956:17396, ack 917, win 512, options [nop,nop,TS val 348308857 ecr 348308852], length 3440
2022-04-06 17:27:06.354128 IP (tos 0x0, ttl 64, id 56688, offset 0, flags [DF], proto TCP (6), length 52)
    127.0.0.1.57386 > 127.0.0.1.11450: Flags [.], cksum 0xfe28 (incorrect -> 0xd463), seq 917, ack 17396, win 494, options [nop,nop,TS val 348308857 ecr 348308857], length 0
2022-04-06 17:27:06.354246 IP (tos 0x0, ttl 64, id 21130, offset 0, flags [DF], proto TCP (6), length 4100)
    127.0.0.1.11450 > 127.0.0.1.57386: Flags [P.], cksum 0x0df9 (incorrect -> 0x079d), seq 17396:21444, ack 917, win 512, options [nop,nop,TS val 348308857 ecr 348308857], length 4048
2022-04-06 17:27:06.354251 IP (tos 0x0, ttl 64, id 56689, offset 0, flags [DF], proto TCP (6), length 52)
    127.0.0.1.57386 > 127.0.0.1.11450: Flags [.], cksum 0xfe28 (incorrect -> 0xc495), seq 917, ack 21444, win 492, options [nop,nop,TS val 348308857 ecr 348308857], length 0
2022-04-06 17:27:06.354257 IP (tos 0x0, ttl 64, id 21131, offset 0, flags [DF], proto TCP (6), length 3650)
    127.0.0.1.11450 > 127.0.0.1.57386: Flags [P.], cksum 0x0c37 (incorrect -> 0x7156), seq 21444:25042, ack 917, win 512, options [nop,nop,TS val 348308857 ecr 348308857], length 3598
2022-04-06 17:27:06.354262 IP (tos 0x0, ttl 64, id 56690, offset 0, flags [DF], proto TCP (6), length 52)
    127.0.0.1.57386 > 127.0.0.1.11450: Flags [.], cksum 0xfe28 (incorrect -> 0xb695), seq 917, ack 25042, win 478, options [nop,nop,TS val 348308857 ecr 348308857], length 0
2022-04-06 17:27:06.356575 IP (tos 0x0, ttl 64, id 21132, offset 0, flags [DF], proto TCP (6), length 4100)
    127.0.0.1.11450 > 127.0.0.1.57386: Flags [P.], cksum 0x0df9 (incorrect -> 0xe68f), seq 25042:29090, ack 917, win 512, options [nop,nop,TS val 348308859 ecr 348308857], length 4048
2022-04-06 17:27:06.356583 IP (tos 0x0, ttl 64, id 56691, offset 0, flags [DF], proto TCP (6), length 52)
    127.0.0.1.57386 > 127.0.0.1.11450: Flags [.], cksum 0xfe28 (incorrect -> 0xa6b3), seq 917, ack 29090, win 492, options [nop,nop,TS val 348308859 ecr 348308859], length 0
2022-04-06 17:27:06.356590 IP (tos 0x0, ttl 64, id 21133, offset 0, flags [DF], proto TCP (6), length 394)
    127.0.0.1.11450 > 127.0.0.1.57386: Flags [P.], cksum 0xff7e (incorrect -> 0x4384), seq 29090:29432, ack 917, win 512, options [nop,nop,TS val 348308859 ecr 348308859], length 342
2022-04-06 17:27:06.356617 IP (tos 0x0, ttl 64, id 56692, offset 0, flags [DF], proto TCP (6), length 52)
    127.0.0.1.57386 > 127.0.0.1.11450: Flags [.], cksum 0xfe28 (incorrect -> 0xa549), seq 917, ack 29432, win 512, options [nop,nop,TS val 348308859 ecr 348308859], length 0
2022-04-06 17:27:06.356621 IP (tos 0x0, ttl 64, id 21134, offset 0, flags [DF], proto TCP (6), length 550)
    127.0.0.1.11450 > 127.0.0.1.57386: Flags [P.], cksum 0x001b (incorrect -> 0x5827), seq 29432:29930, ack 917, win 512, options [nop,nop,TS val 348308859 ecr 348308859], length 498
2022-04-06 17:27:06.356625 IP (tos 0x0, ttl 64, id 56693, offset 0, flags [DF], proto TCP (6), length 52)
    127.0.0.1.57386 > 127.0.0.1.11450: Flags [.], cksum 0xfe28 (incorrect -> 0xa357), seq 917, ack 29930, win 512, options [nop,nop,TS val 348308859 ecr 348308859], length 0
2022-04-06 17:27:06.364644 IP (tos 0x0, ttl 64, id 21135, offset 0, flags [DF], proto TCP (6), length 3446)
    127.0.0.1.11450 > 127.0.0.1.57386: Flags [P.], cksum 0x0b6b (incorrect -> 0x09b0), seq 29930:33324, ack 917, win 512, options [nop,nop,TS val 348308867 ecr 348308859], length 3394
2022-04-06 17:27:06.364661 IP (tos 0x0, ttl 64, id 56694, offset 0, flags [DF], proto TCP (6), length 52)
    127.0.0.1.57386 > 127.0.0.1.11450: Flags [.], cksum 0xfe28 (incorrect -> 0x9605), seq 917, ack 33324, win 512, options [nop,nop,TS val 348308867 ecr 348308867], length 0
2022-04-06 17:27:06.369774 IP (tos 0x0, ttl 64, id 21136, offset 0, flags [DF], proto TCP (6), length 3852)
    127.0.0.1.11450 > 127.0.0.1.57386: Flags [P.], cksum 0x0d01 (incorrect -> 0x3f6f), seq 33324:37124, ack 917, win 512, options [nop,nop,TS val 348308872 ecr 348308867], length 3800
2022-04-06 17:27:06.369821 IP (tos 0x0, ttl 64, id 56695, offset 0, flags [DF], proto TCP (6), length 52)
    127.0.0.1.57386 > 127.0.0.1.11450: Flags [.], cksum 0xfe28 (incorrect -> 0x8723), seq 917, ack 37124, win 512, options [nop,nop,TS val 348308872 ecr 348308872], length 0
2022-04-06 17:27:06.369826 IP (tos 0x0, ttl 64, id 21137, offset 0, flags [DF], proto TCP (6), length 3944)
    127.0.0.1.11450 > 127.0.0.1.57386: Flags [P.], cksum 0x0d5d (incorrect -> 0x25fe), seq 37124:41016, ack 917, win 512, options [nop,nop,TS val 348308872 ecr 348308872], length 3892
2022-04-06 17:27:06.370206 IP (tos 0x0, ttl 64, id 56696, offset 0, flags [DF], proto TCP (6), length 52)
    127.0.0.1.57386 > 127.0.0.1.11450: Flags [.], cksum 0xfe28 (incorrect -> 0x77ee), seq 917, ack 41016, win 512, options [nop,nop,TS val 348308873 ecr 348308872], length 0
2022-04-06 17:27:06.376895 IP (tos 0x0, ttl 64, id 21138, offset 0, flags [DF], proto TCP (6), length 3944)
    127.0.0.1.11450 > 127.0.0.1.57386: Flags [P.], cksum 0x0d5d (incorrect -> 0xc756), seq 41016:44908, ack 917, win 512, options [nop,nop,TS val 348308879 ecr 348308873], length 3892
2022-04-06 17:27:06.385480 IP (tos 0x0, ttl 64, id 21139, offset 0, flags [DF], proto TCP (6), length 32820)
    127.0.0.1.11450 > 127.0.0.1.57386: Flags [.], cksum 0x7e29 (incorrect -> 0xb407), seq 44908:77676, ack 917, win 512, options [nop,nop,TS val 348308888 ecr 348308873], length 32768
2022-04-06 17:27:06.385504 IP (tos 0x0, ttl 64, id 56697, offset 0, flags [DF], proto TCP (6), length 52)
    127.0.0.1.57386 > 127.0.0.1.11450: Flags [.], cksum 0xfe28 (incorrect -> 0xe928), seq 917, ack 77676, win 379, options [nop,nop,TS val 348308888 ecr 348308879], length 0
2022-04-06 17:27:06.385510 IP (tos 0x0, ttl 64, id 21140, offset 0, flags [DF], proto TCP (6), length 5384)
    127.0.0.1.11450 > 127.0.0.1.57386: Flags [P.], cksum 0x12fd (incorrect -> 0x5521), seq 77676:83008, ack 917, win 512, options [nop,nop,TS val 348308888 ecr 348308888], length 5332
2022-04-06 17:27:06.386059 IP (tos 0x0, ttl 64, id 56698, offset 0, flags [DF], proto TCP (6), length 52)
    127.0.0.1.57386 > 127.0.0.1.11450: Flags [.], cksum 0xfe28 (incorrect -> 0xd3c6), seq 917, ack 83008, win 512, options [nop,nop,TS val 348308888 ecr 348308888], length 0
2022-04-06 17:27:06.390850 IP (tos 0x0, ttl 64, id 21141, offset 0, flags [DF], proto TCP (6), length 4100)
    127.0.0.1.11450 > 127.0.0.1.57386: Flags [P.], cksum 0x0df9 (incorrect -> 0x36dc), seq 83008:87056, ack 917, win 512, options [nop,nop,TS val 348308893 ecr 348308888], length 4048
2022-04-06 17:27:06.391153 IP (tos 0x0, ttl 64, id 56699, offset 0, flags [DF], proto TCP (6), length 52)
    127.0.0.1.57386 > 127.0.0.1.11450: Flags [.], cksum 0xfe28 (incorrect -> 0xc3eb), seq 917, ack 87056, win 512, options [nop,nop,TS val 348308894 ecr 348308893], length 0
2022-04-06 17:27:06.391160 IP (tos 0x0, ttl 64, id 21142, offset 0, flags [DF], proto TCP (6), length 3742)
    127.0.0.1.11450 > 127.0.0.1.57386: Flags [P.], cksum 0x0c93 (incorrect -> 0x08aa), seq 87056:90746, ack 917, win 512, options [nop,nop,TS val 348308894 ecr 348308894], length 3690
2022-04-06 17:27:06.391165 IP (tos 0x0, ttl 64, id 56700, offset 0, flags [DF], proto TCP (6), length 52)
    127.0.0.1.57386 > 127.0.0.1.11450: Flags [.], cksum 0xfe28 (incorrect -> 0xb580), seq 917, ack 90746, win 512, options [nop,nop,TS val 348308894 ecr 348308894], length 0
2022-04-06 17:27:06.392529 IP (tos 0x0, ttl 64, id 21143, offset 0, flags [DF], proto TCP (6), length 4100)
    127.0.0.1.11450 > 127.0.0.1.57386: Flags [P.], cksum 0x0df9 (incorrect -> 0x9b4b), seq 90746:94794, ack 917, win 512, options [nop,nop,TS val 348308895 ecr 348308894], length 4048
2022-04-06 17:27:06.392570 IP (tos 0x0, ttl 64, id 56701, offset 0, flags [DF], proto TCP (6), length 52)
    127.0.0.1.57386 > 127.0.0.1.11450: Flags [.], cksum 0xfe28 (incorrect -> 0xa5ae), seq 917, ack 94794, win 512, options [nop,nop,TS val 348308895 ecr 348308895], length 0
2022-04-06 17:27:06.392574 IP (tos 0x0, ttl 64, id 21144, offset 0, flags [DF], proto TCP (6), length 1842)
    127.0.0.1.11450 > 127.0.0.1.57386: Flags [P.], cksum 0x0527 (incorrect -> 0xa54d), seq 94794:96584, ack 917, win 512, options [nop,nop,TS val 348308895 ecr 348308895], length 1790
2022-04-06 17:27:06.392578 IP (tos 0x0, ttl 64, id 56702, offset 0, flags [DF], proto TCP (6), length 52)
    127.0.0.1.57386 > 127.0.0.1.11450: Flags [.], cksum 0xfe28 (incorrect -> 0x9eb0), seq 917, ack 96584, win 512, options [nop,nop,TS val 348308895 ecr 348308895], length 0
2022-04-06 17:27:06.396842 IP (tos 0x0, ttl 64, id 21145, offset 0, flags [DF], proto TCP (6), length 3538)
    127.0.0.1.11450 > 127.0.0.1.57386: Flags [P.], cksum 0x0bc7 (incorrect -> 0x26f7), seq 96584:100070, ack 917, win 512, options [nop,nop,TS val 348308899 ecr 348308895], length 3486
2022-04-06 17:27:06.396857 IP (tos 0x0, ttl 64, id 56703, offset 0, flags [DF], proto TCP (6), length 52)
    127.0.0.1.57386 > 127.0.0.1.11450: Flags [.], cksum 0xfe28 (incorrect -> 0x910a), seq 917, ack 100070, win 512, options [nop,nop,TS val 348308899 ecr 348308899], length 0
2022-04-06 17:27:06.398987 IP (tos 0x0, ttl 64, id 21146, offset 0, flags [DF], proto TCP (6), length 4036)
    127.0.0.1.11450 > 127.0.0.1.57386: Flags [P.], cksum 0x0db9 (incorrect -> 0x0e2b), seq 100070:104054, ack 917, win 512, options [nop,nop,TS val 348308901 ecr 348308899], length 3984
2022-04-06 17:27:06.399312 IP (tos 0x0, ttl 64, id 56704, offset 0, flags [DF], proto TCP (6), length 52)
    127.0.0.1.57386 > 127.0.0.1.11450: Flags [.], cksum 0xfe28 (incorrect -> 0x8175), seq 917, ack 104054, win 512, options [nop,nop,TS val 348308902 ecr 348308901], length 0
2022-04-06 17:27:06.399318 IP (tos 0x0, ttl 64, id 21147, offset 0, flags [DF], proto TCP (6), length 11506)
    127.0.0.1.11450 > 127.0.0.1.57386: Flags [P.], cksum 0x2ae7 (incorrect -> 0x4ed7), seq 104054:115508, ack 917, win 512, options [nop,nop,TS val 348308902 ecr 348308902], length 11454
2022-04-06 17:27:06.399415 IP (tos 0x0, ttl 64, id 56705, offset 0, flags [DF], proto TCP (6), length 52)
    127.0.0.1.57386 > 127.0.0.1.11450: Flags [.], cksum 0xfe28 (incorrect -> 0x54b6), seq 917, ack 115508, win 512, options [nop,nop,TS val 348308902 ecr 348308902], length 0
2022-04-06 17:27:06.399877 IP (tos 0x0, ttl 64, id 21148, offset 0, flags [DF], proto TCP (6), length 4100)
    127.0.0.1.11450 > 127.0.0.1.57386: Flags [P.], cksum 0x0df9 (incorrect -> 0x3880), seq 115508:119556, ack 917, win 512, options [nop,nop,TS val 348308902 ecr 348308902], length 4048
2022-04-06 17:27:06.399898 IP (tos 0x0, ttl 64, id 56706, offset 0, flags [DF], proto TCP (6), length 52)
    127.0.0.1.57386 > 127.0.0.1.11450: Flags [.], cksum 0xfe28 (incorrect -> 0x44e6), seq 917, ack 119556, win 512, options [nop,nop,TS val 348308902 ecr 348308902], length 0
2022-04-06 17:27:06.399902 IP (tos 0x0, ttl 64, id 21149, offset 0, flags [DF], proto TCP (6), length 486)
    127.0.0.1.11450 > 127.0.0.1.57386: Flags [P.], cksum 0xffda (incorrect -> 0x6e6b), seq 119556:119990, ack 917, win 512, options [nop,nop,TS val 348308902 ecr 348308902], length 434
2022-04-06 17:27:06.399906 IP (tos 0x0, ttl 64, id 56707, offset 0, flags [DF], proto TCP (6), length 52)
    127.0.0.1.57386 > 127.0.0.1.11450: Flags [.], cksum 0xfe28 (incorrect -> 0x4334), seq 917, ack 119990, win 512, options [nop,nop,TS val 348308902 ecr 348308902], length 0
200, 6.839416980743408, 0.4275195598602295