2022-04-06 07:29:54.064617 IP (tos 0x0, ttl 64, id 52777, offset 0, flags [DF], proto TCP (6), length 60)
    127.0.0.1.60030 > 127.0.0.1.9350: Flags [S], cksum 0xfe30 (incorrect -> 0xd26b), seq 275793898, win 65495, options [mss 65495,sackOK,TS val 312476567 ecr 0,nop,wscale 7], length 0
2022-04-06 07:29:54.064625 IP (tos 0x0, ttl 64, id 0, offset 0, flags [DF], proto TCP (6), length 60)
    127.0.0.1.9350 > 127.0.0.1.60030: Flags [S.], cksum 0xfe30 (incorrect -> 0x8d8a), seq 2885780131, ack 275793899, win 65483, options [mss 65495,sackOK,TS val 312476567 ecr 312476567,nop,wscale 7], length 0
2022-04-06 07:29:54.064632 IP (tos 0x0, ttl 64, id 52778, offset 0, flags [DF], proto TCP (6), length 52)
    127.0.0.1.60030 > 127.0.0.1.9350: Flags [.], cksum 0xfe28 (incorrect -> 0xb446), seq 1, ack 1, win 512, options [nop,nop,TS val 312476567 ecr 312476567], length 0
2022-04-06 07:29:54.064725 IP (tos 0x0, ttl 64, id 52779, offset 0, flags [DF], proto TCP (6), length 55)
    127.0.0.1.60030 > 127.0.0.1.9350: Flags [P.], cksum 0xfe2b (incorrect -> 0xaf3a), seq 1:4, ack 1, win 512, options [nop,nop,TS val 312476567 ecr 312476567], length 3
2022-04-06 07:29:54.064734 IP (tos 0x0, ttl 64, id 39811, offset 0, flags [DF], proto TCP (6), length 52)
    127.0.0.1.9350 > 127.0.0.1.60030: Flags [.], cksum 0xfe28 (incorrect -> 0xb443), seq 1, ack 4, win 512, options [nop,nop,TS val 312476567 ecr 312476567], length 0
2022-04-06 07:29:54.064760 IP (tos 0x0, ttl 64, id 39812, offset 0, flags [DF], proto TCP (6), length 54)
    127.0.0.1.9350 > 127.0.0.1.60030: Flags [P.], cksum 0xfe2a (incorrect -> 0xaf39), seq 1:3, ack 4, win 512, options [nop,nop,TS val 312476567 ecr 312476567], length 2
2022-04-06 07:29:54.064768 IP (tos 0x0, ttl 64, id 52780, offset 0, flags [DF], proto TCP (6), length 52)
    127.0.0.1.60030 > 127.0.0.1.9350: Flags [.], cksum 0xfe28 (incorrect -> 0xb441), seq 4, ack 3, win 512, options [nop,nop,TS val 312476567 ecr 312476567], length 0
2022-04-06 07:29:54.066027 IP (tos 0x0, ttl 64, id 52781, offset 0, flags [DF], proto TCP (6), length 62)
    127.0.0.1.60030 > 127.0.0.1.9350: Flags [P.], cksum 0xfe32 (incorrect -> 0x1cae), seq 4:14, ack 3, win 512, options [nop,nop,TS val 312476568 ecr 312476567], length 10
2022-04-06 07:29:54.066033 IP (tos 0x0, ttl 64, id 39813, offset 0, flags [DF], proto TCP (6), length 52)
    127.0.0.1.9350 > 127.0.0.1.60030: Flags [.], cksum 0xfe28 (incorrect -> 0xb435), seq 3, ack 14, win 512, options [nop,nop,TS val 312476568 ecr 312476568], length 0
2022-04-06 07:29:54.133622 IP (tos 0x0, ttl 64, id 39814, offset 0, flags [DF], proto TCP (6), length 62)
    127.0.0.1.9350 > 127.0.0.1.60030: Flags [P.], cksum 0xfe32 (incorrect -> 0xaede), seq 3:13, ack 14, win 512, options [nop,nop,TS val 312476636 ecr 312476568], length 10
2022-04-06 07:29:54.133627 IP (tos 0x0, ttl 64, id 52782, offset 0, flags [DF], proto TCP (6), length 52)
    127.0.0.1.60030 > 127.0.0.1.9350: Flags [.], cksum 0xfe28 (incorrect -> 0xb3a3), seq 14, ack 13, win 512, options [nop,nop,TS val 312476636 ecr 312476636], length 0
2022-04-06 07:29:54.139092 IP (tos 0x0, ttl 64, id 52783, offset 0, flags [DF], proto TCP (6), length 569)
    127.0.0.1.60030 > 127.0.0.1.9350: Flags [P.], cksum 0x002e (incorrect -> 0x946c), seq 14:531, ack 13, win 512, options [nop,nop,TS val 312476642 ecr 312476636], length 517
2022-04-06 07:29:54.139098 IP (tos 0x0, ttl 64, id 39815, offset 0, flags [DF], proto TCP (6), length 52)
    127.0.0.1.9350 > 127.0.0.1.60030: Flags [.], cksum 0xfe28 (incorrect -> 0xb196), seq 13, ack 531, win 508, options [nop,nop,TS val 312476642 ecr 312476642], length 0
2022-04-06 07:29:54.205981 IP (tos 0x0, ttl 64, id 39816, offset 0, flags [DF], proto TCP (6), length 3538)
    127.0.0.1.9350 > 127.0.0.1.60030: Flags [P.], cksum 0x0bc7 (incorrect -> 0x864e), seq 13:3499, ack 531, win 512, options [nop,nop,TS val 312476708 ecr 312476642], length 3486
2022-04-06 07:29:54.205991 IP (tos 0x0, ttl 64, id 52784, offset 0, flags [DF], proto TCP (6), length 52)
    127.0.0.1.60030 > 127.0.0.1.9350: Flags [.], cksum 0xfe28 (incorrect -> 0xa382), seq 531, ack 3499, win 494, options [nop,nop,TS val 312476708 ecr 312476708], length 0
2022-04-06 07:29:54.216297 IP (tos 0x0, ttl 64, id 39817, offset 0, flags [DF], proto TCP (6), length 886)
    127.0.0.1.9350 > 127.0.0.1.60030: Flags [P.], cksum 0x016b (incorrect -> 0x08d6), seq 3499:4333, ack 531, win 512, options [nop,nop,TS val 312476719 ecr 312476708], length 834
2022-04-06 07:29:54.216301 IP (tos 0x0, ttl 64, id 52785, offset 0, flags [DF], proto TCP (6), length 52)
    127.0.0.1.60030 > 127.0.0.1.9350: Flags [.], cksum 0xfe28 (incorrect -> 0xa020), seq 531, ack 4333, win 504, options [nop,nop,TS val 312476719 ecr 312476719], length 0
2022-04-06 07:29:54.225364 IP (tos 0x0, ttl 64, id 39818, offset 0, flags [DF], proto TCP (6), length 1300)
    127.0.0.1.9350 > 127.0.0.1.60030: Flags [P.], cksum 0x0309 (incorrect -> 0xaa9d), seq 4333:5581, ack 531, win 512, options [nop,nop,TS val 312476728 ecr 312476719], length 1248
2022-04-06 07:29:54.225367 IP (tos 0x0, ttl 64, id 52786, offset 0, flags [DF], proto TCP (6), length 52)
    127.0.0.1.60030 > 127.0.0.1.9350: Flags [.], cksum 0xfe28 (incorrect -> 0x9b2f), seq 531, ack 5581, win 503, options [nop,nop,TS val 312476728 ecr 312476728], length 0
2022-04-06 07:29:54.225893 IP (tos 0x0, ttl 64, id 52787, offset 0, flags [DF], proto TCP (6), length 116)
    127.0.0.1.60030 > 127.0.0.1.9350: Flags [P.], cksum 0xfe68 (incorrect -> 0xd174), seq 531:595, ack 5581, win 512, options [nop,nop,TS val 312476728 ecr 312476728], length 64
2022-04-06 07:29:54.225899 IP (tos 0x0, ttl 64, id 39819, offset 0, flags [DF], proto TCP (6), length 52)
    127.0.0.1.9350 > 127.0.0.1.60030: Flags [.], cksum 0xfe28 (incorrect -> 0x9ae6), seq 5581, ack 595, win 512, options [nop,nop,TS val 312476728 ecr 312476728], length 0
2022-04-06 07:29:54.226191 IP (tos 0x0, ttl 64, id 52788, offset 0, flags [DF], proto TCP (6), length 369)
    127.0.0.1.60030 > 127.0.0.1.9350: Flags [P.], cksum 0xff65 (incorrect -> 0xc87f), seq 595:912, ack 5581, win 512, options [nop,nop,TS val 312476729 ecr 312476728], length 317
2022-04-06 07:29:54.226197 IP (tos 0x0, ttl 64, id 39820, offset 0, flags [DF], proto TCP (6), length 52)
    127.0.0.1.9350 > 127.0.0.1.60030: Flags [.], cksum 0xfe28 (incorrect -> 0x99a9), seq 5581, ack 912, win 510, options [nop,nop,TS val 312476729 ecr 312476729], length 0
2022-04-06 07:29:54.369363 IP (tos 0x0, ttl 64, id 39821, offset 0, flags [DF], proto TCP (6), length 3538)
    127.0.0.1.9350 > 127.0.0.1.60030: Flags [P.], cksum 0x0bc7 (incorrect -> 0xa0f5), seq 5581:9067, ack 912, win 512, options [nop,nop,TS val 312476872 ecr 312476729], length 3486
2022-04-06 07:29:54.369368 IP (tos 0x0, ttl 64, id 52789, offset 0, flags [DF], proto TCP (6), length 52)
    127.0.0.1.60030 > 127.0.0.1.9350: Flags [.], cksum 0xfe28 (incorrect -> 0x8afd), seq 912, ack 9067, win 494, options [nop,nop,TS val 312476872 ecr 312476872], length 0
2022-04-06 07:29:54.369556 IP (tos 0x0, ttl 64, id 39822, offset 0, flags [DF], proto TCP (6), length 1048)
    127.0.0.1.9350 > 127.0.0.1.60030: Flags [P.], cksum 0x020d (incorrect -> 0x0351), seq 9067:10063, ack 912, win 512, options [nop,nop,TS val 312476872 ecr 312476872], length 996
2022-04-06 07:29:54.369563 IP (tos 0x0, ttl 64, id 52790, offset 0, flags [DF], proto TCP (6), length 52)
    127.0.0.1.60030 > 127.0.0.1.9350: Flags [.], cksum 0xfe28 (incorrect -> 0x870f), seq 912, ack 10063, win 504, options [nop,nop,TS val 312476872 ecr 312476872], length 0
2022-04-06 07:29:54.376504 IP (tos 0x0, ttl 64, id 39823, offset 0, flags [DF], proto TCP (6), length 3040)
    127.0.0.1.9350 > 127.0.0.1.60030: Flags [P.], cksum 0x09d5 (incorrect -> 0x28b2), seq 10063:13051, ack 912, win 512, options [nop,nop,TS val 312476879 ecr 312476872], length 2988
2022-04-06 07:29:54.376507 IP (tos 0x0, ttl 64, id 52791, offset 0, flags [DF], proto TCP (6), length 52)
    127.0.0.1.60030 > 127.0.0.1.9350: Flags [.], cksum 0xfe28 (incorrect -> 0x7b5d), seq 912, ack 13051, win 496, options [nop,nop,TS val 312476879 ecr 312476879], length 0
2022-04-06 07:29:54.379814 IP (tos 0x0, ttl 64, id 39824, offset 0, flags [DF], proto TCP (6), length 3712)
    127.0.0.1.9350 > 127.0.0.1.60030: Flags [P.], cksum 0x0c75 (incorrect -> 0x75b1), seq 13051:16711, ack 912, win 512, options [nop,nop,TS val 312476882 ecr 312476879], length 3660
2022-04-06 07:29:54.379821 IP (tos 0x0, ttl 64, id 52792, offset 0, flags [DF], proto TCP (6), length 52)
    127.0.0.1.60030 > 127.0.0.1.9350: Flags [.], cksum 0xfe28 (incorrect -> 0x6d0e), seq 912, ack 16711, win 493, options [nop,nop,TS val 312476882 ecr 312476882], length 0
2022-04-06 07:29:54.388626 IP (tos 0x0, ttl 64, id 39825, offset 0, flags [DF], proto TCP (6), length 4100)
    127.0.0.1.9350 > 127.0.0.1.60030: Flags [P.], cksum 0x0df9 (incorrect -> 0x455c), seq 16711:20759, ack 912, win 512, options [nop,nop,TS val 312476891 ecr 312476882], length 4048
2022-04-06 07:29:54.388630 IP (tos 0x0, ttl 64, id 52793, offset 0, flags [DF], proto TCP (6), length 52)
    127.0.0.1.60030 > 127.0.0.1.9350: Flags [.], cksum 0xfe28 (incorrect -> 0x5d2d), seq 912, ack 20759, win 492, options [nop,nop,TS val 312476891 ecr 312476891], length 0
2022-04-06 07:29:54.388634 IP (tos 0x0, ttl 64, id 39826, offset 0, flags [DF], proto TCP (6), length 3150)
    127.0.0.1.9350 > 127.0.0.1.60030: Flags [P.], cksum 0x0a43 (incorrect -> 0xe57e), seq 20759:23857, ack 912, win 512, options [nop,nop,TS val 312476891 ecr 312476891], length 3098
2022-04-06 07:29:54.388636 IP (tos 0x0, ttl 64, id 52794, offset 0, flags [DF], proto TCP (6), length 52)
    127.0.0.1.60030 > 127.0.0.1.9350: Flags [.], cksum 0xfe28 (incorrect -> 0x511f), seq 912, ack 23857, win 480, options [nop,nop,TS val 312476891 ecr 312476891], length 0
2022-04-06 07:29:54.389682 IP (tos 0x0, ttl 64, id 39827, offset 0, flags [DF], proto TCP (6), length 4100)
    127.0.0.1.9350 > 127.0.0.1.60030: Flags [P.], cksum 0x0df9 (incorrect -> 0x7129), seq 23857:27905, ack 912, win 512, options [nop,nop,TS val 312476892 ecr 312476891], length 4048
2022-04-06 07:29:54.389687 IP (tos 0x0, ttl 64, id 52795, offset 0, flags [DF], proto TCP (6), length 52)
    127.0.0.1.60030 > 127.0.0.1.9350: Flags [.], cksum 0xfe28 (incorrect -> 0x4141), seq 912, ack 27905, win 492, options [nop,nop,TS val 312476892 ecr 312476892], length 0
2022-04-06 07:29:54.389692 IP (tos 0x0, ttl 64, id 39828, offset 0, flags [DF], proto TCP (6), length 3312)
    127.0.0.1.9350 > 127.0.0.1.60030: Flags [P.], cksum 0x0ae5 (incorrect -> 0x7058), seq 27905:31165, ack 912, win 512, options [nop,nop,TS val 312476892 ecr 312476892], length 3260
2022-04-06 07:29:54.389714 IP (tos 0x0, ttl 64, id 52796, offset 0, flags [DF], proto TCP (6), length 52)
    127.0.0.1.60030 > 127.0.0.1.9350: Flags [.], cksum 0xfe28 (incorrect -> 0x3471), seq 912, ack 31165, win 512, options [nop,nop,TS val 312476892 ecr 312476892], length 0
2022-04-06 07:29:54.389716 IP (tos 0x0, ttl 64, id 39829, offset 0, flags [DF], proto TCP (6), length 886)
    127.0.0.1.9350 > 127.0.0.1.60030: Flags [P.], cksum 0x016b (incorrect -> 0xd996), seq 31165:31999, ack 912, win 512, options [nop,nop,TS val 312476892 ecr 312476892], length 834
2022-04-06 07:29:54.389719 IP (tos 0x0, ttl 64, id 52797, offset 0, flags [DF], proto TCP (6), length 52)
    127.0.0.1.60030 > 127.0.0.1.9350: Flags [.], cksum 0xfe28 (incorrect -> 0x312f), seq 912, ack 31999, win 512, options [nop,nop,TS val 312476892 ecr 312476892], length 0
2022-04-06 07:29:54.395893 IP (tos 0x0, ttl 64, id 39830, offset 0, flags [DF], proto TCP (6), length 4100)
    127.0.0.1.9350 > 127.0.0.1.60030: Flags [P.], cksum 0x0df9 (incorrect -> 0x86b8), seq 31999:36047, ack 912, win 512, options [nop,nop,TS val 312476898 ecr 312476892], length 4048
2022-04-06 07:29:54.409035 IP (tos 0x0, ttl 64, id 39831, offset 0, flags [DF], proto TCP (6), length 32820)
    127.0.0.1.9350 > 127.0.0.1.60030: Flags [.], cksum 0x7e29 (incorrect -> 0x6503), seq 36047:68815, ack 912, win 512, options [nop,nop,TS val 312476911 ecr 312476892], length 32768
2022-04-06 07:29:54.409072 IP (tos 0x0, ttl 64, id 52798, offset 0, flags [DF], proto TCP (6), length 52)
    127.0.0.1.60030 > 127.0.0.1.9350: Flags [.], cksum 0xfe28 (incorrect -> 0xa1c9), seq 912, ack 68815, win 379, options [nop,nop,TS val 312476912 ecr 312476898], length 0
2022-04-06 07:29:54.409076 IP (tos 0x0, ttl 64, id 39832, offset 0, flags [DF], proto TCP (6), length 2722)
    127.0.0.1.9350 > 127.0.0.1.60030: Flags [P.], cksum 0x0897 (incorrect -> 0x8a7a), seq 68815:71485, ack 912, win 512, options [nop,nop,TS val 312476912 ecr 312476912], length 2670
2022-04-06 07:29:54.410387 IP (tos 0x0, ttl 64, id 52799, offset 0, flags [DF], proto TCP (6), length 52)
    127.0.0.1.60030 > 127.0.0.1.9350: Flags [.], cksum 0xfe28 (incorrect -> 0x96c7), seq 912, ack 71485, win 512, options [nop,nop,TS val 312476913 ecr 312476912], length 0
2022-04-06 07:29:54.415046 IP (tos 0x0, ttl 64, id 39833, offset 0, flags [DF], proto TCP (6), length 3376)
    127.0.0.1.9350 > 127.0.0.1.60030: Flags [P.], cksum 0x0b25 (incorrect -> 0x28f9), seq 71485:74809, ack 912, win 512, options [nop,nop,TS val 312476917 ecr 312476913], length 3324
2022-04-06 07:29:54.415058 IP (tos 0x0, ttl 64, id 52800, offset 0, flags [DF], proto TCP (6), length 52)
    127.0.0.1.60030 > 127.0.0.1.9350: Flags [.], cksum 0xfe28 (incorrect -> 0x89c1), seq 912, ack 74809, win 512, options [nop,nop,TS val 312476918 ecr 312476917], length 0
2022-04-06 07:29:54.415156 IP (tos 0x0, ttl 64, id 39834, offset 0, flags [DF], proto TCP (6), length 2380)
    127.0.0.1.9350 > 127.0.0.1.60030: Flags [P.], cksum 0x0741 (incorrect -> 0x1f7a), seq 74809:77137, ack 912, win 512, options [nop,nop,TS val 312476918 ecr 312476918], length 2328
2022-04-06 07:29:54.415166 IP (tos 0x0, ttl 64, id 52801, offset 0, flags [DF], proto TCP (6), length 52)
    127.0.0.1.60030 > 127.0.0.1.9350: Flags [.], cksum 0xfe28 (incorrect -> 0x80a8), seq 912, ack 77137, win 512, options [nop,nop,TS val 312476918 ecr 312476918], length 0
2022-04-06 07:29:54.415287 IP (tos 0x0, ttl 64, id 39835, offset 0, flags [DF], proto TCP (6), length 4100)
    127.0.0.1.9350 > 127.0.0.1.60030: Flags [P.], cksum 0x0df9 (incorrect -> 0x3294), seq 77137:81185, ack 912, win 512, options [nop,nop,TS val 312476918 ecr 312476918], length 4048
2022-04-06 07:29:54.415316 IP (tos 0x0, ttl 64, id 52802, offset 0, flags [DF], proto TCP (6), length 52)
    127.0.0.1.60030 > 127.0.0.1.9350: Flags [.], cksum 0xfe28 (incorrect -> 0x70d8), seq 912, ack 81185, win 512, options [nop,nop,TS val 312476918 ecr 312476918], length 0
2022-04-06 07:29:54.415319 IP (tos 0x0, ttl 64, id 39836, offset 0, flags [DF], proto TCP (6), length 6138)
    127.0.0.1.9350 > 127.0.0.1.60030: Flags [P.], cksum 0x15ef (incorrect -> 0xf589), seq 81185:87271, ack 912, win 512, options [nop,nop,TS val 312476918 ecr 312476918], length 6086
2022-04-06 07:29:54.415322 IP (tos 0x0, ttl 64, id 52803, offset 0, flags [DF], proto TCP (6), length 52)
    127.0.0.1.60030 > 127.0.0.1.9350: Flags [.], cksum 0xfe28 (incorrect -> 0x5912), seq 912, ack 87271, win 512, options [nop,nop,TS val 312476918 ecr 312476918], length 0
2022-04-06 07:29:54.418492 IP (tos 0x0, ttl 64, id 39837, offset 0, flags [DF], proto TCP (6), length 3928)
    127.0.0.1.9350 > 127.0.0.1.60030: Flags [P.], cksum 0x0d4d (incorrect -> 0xb0e4), seq 87271:91147, ack 912, win 512, options [nop,nop,TS val 312476921 ecr 312476918], length 3876
2022-04-06 07:29:54.418829 IP (tos 0x0, ttl 64, id 52804, offset 0, flags [DF], proto TCP (6), length 52)
    127.0.0.1.60030 > 127.0.0.1.9350: Flags [.], cksum 0xfe28 (incorrect -> 0x49e8), seq 912, ack 91147, win 512, options [nop,nop,TS val 312476921 ecr 312476921], length 0
2022-04-06 07:29:54.418834 IP (tos 0x0, ttl 64, id 39838, offset 0, flags [DF], proto TCP (6), length 4372)
    127.0.0.1.9350 > 127.0.0.1.60030: Flags [P.], cksum 0x0f09 (incorrect -> 0xff8e), seq 91147:95467, ack 912, win 512, options [nop,nop,TS val 312476921 ecr 312476921], length 4320
2022-04-06 07:29:54.418837 IP (tos 0x0, ttl 64, id 52805, offset 0, flags [DF], proto TCP (6), length 52)
    127.0.0.1.60030 > 127.0.0.1.9350: Flags [.], cksum 0xfe28 (incorrect -> 0x3908), seq 912, ack 95467, win 512, options [nop,nop,TS val 312476921 ecr 312476921], length 0
2022-04-06 07:29:54.427130 IP (tos 0x0, ttl 64, id 39839, offset 0, flags [DF], proto TCP (6), length 4100)
    127.0.0.1.9350 > 127.0.0.1.60030: Flags [P.], cksum 0x0df9 (incorrect -> 0xa35e), seq 95467:99515, ack 912, win 512, options [nop,nop,TS val 312476930 ecr 312476921], length 4048
2022-04-06 07:29:54.427160 IP (tos 0x0, ttl 64, id 52806, offset 0, flags [DF], proto TCP (6), length 52)
    127.0.0.1.60030 > 127.0.0.1.9350: Flags [.], cksum 0xfe28 (incorrect -> 0x2926), seq 912, ack 99515, win 512, options [nop,nop,TS val 312476930 ecr 312476930], length 0
2022-04-06 07:29:54.427164 IP (tos 0x0, ttl 64, id 39840, offset 0, flags [DF], proto TCP (6), length 324)
    127.0.0.1.9350 > 127.0.0.1.60030: Flags [P.], cksum 0xff38 (incorrect -> 0x3e3e), seq 99515:99787, ack 912, win 512, options [nop,nop,TS val 312476930 ecr 312476930], length 272
2022-04-06 07:29:54.427169 IP (tos 0x0, ttl 64, id 52807, offset 0, flags [DF], proto TCP (6), length 52)
    127.0.0.1.60030 > 127.0.0.1.9350: Flags [.], cksum 0xfe28 (incorrect -> 0x2816), seq 912, ack 99787, win 512, options [nop,nop,TS val 312476930 ecr 312476930], length 0
2022-04-06 07:29:54.427378 IP (tos 0x0, ttl 64, id 39841, offset 0, flags [DF], proto TCP (6), length 3874)
    127.0.0.1.9350 > 127.0.0.1.60030: Flags [P.], cksum 0x0d17 (incorrect -> 0xbe87), seq 99787:103609, ack 912, win 512, options [nop,nop,TS val 312476930 ecr 312476930], length 3822
2022-04-06 07:29:54.427402 IP (tos 0x0, ttl 64, id 52808, offset 0, flags [DF], proto TCP (6), length 52)
    127.0.0.1.60030 > 127.0.0.1.9350: Flags [.], cksum 0xfe28 (incorrect -> 0x1928), seq 912, ack 103609, win 512, options [nop,nop,TS val 312476930 ecr 312476930], length 0
2022-04-06 07:29:54.427603 IP (tos 0x0, ttl 64, id 39842, offset 0, flags [DF], proto TCP (6), length 4100)
    127.0.0.1.9350 > 127.0.0.1.60030: Flags [P.], cksum 0x0df9 (incorrect -> 0x1185), seq 103609:107657, ack 912, win 512, options [nop,nop,TS val 312476930 ecr 312476930], length 4048
2022-04-06 07:29:54.428156 IP (tos 0x0, ttl 64, id 52809, offset 0, flags [DF], proto TCP (6), length 52)
    127.0.0.1.60030 > 127.0.0.1.9350: Flags [.], cksum 0xfe28 (incorrect -> 0x0957), seq 912, ack 107657, win 512, options [nop,nop,TS val 312476931 ecr 312476930], length 0
200, 125.29369115829468, 0.3879432678222656