2022-04-06 17:08:42.456887 IP (tos 0x0, ttl 64, id 45691, offset 0, flags [DF], proto TCP (6), length 60)
    127.0.0.1.41898 > 127.0.0.1.11650: Flags [S], cksum 0xfe30 (incorrect -> 0xd2f0), seq 2880241190, win 65495, options [mss 65495,sackOK,TS val 347204959 ecr 0,nop,wscale 7], length 0
2022-04-06 17:08:42.456896 IP (tos 0x0, ttl 64, id 0, offset 0, flags [DF], proto TCP (6), length 60)
    127.0.0.1.11650 > 127.0.0.1.41898: Flags [S.], cksum 0xfe30 (incorrect -> 0x0026), seq 2630038513, ack 2880241191, win 65483, options [mss 65495,sackOK,TS val 347204959 ecr 347204959,nop,wscale 7], length 0
2022-04-06 17:08:42.456904 IP (tos 0x0, ttl 64, id 45692, offset 0, flags [DF], proto TCP (6), length 52)
    127.0.0.1.41898 > 127.0.0.1.11650: Flags [.], cksum 0xfe28 (incorrect -> 0x26e2), seq 1, ack 1, win 512, options [nop,nop,TS val 347204959 ecr 347204959], length 0
2022-04-06 17:08:42.457028 IP (tos 0x0, ttl 64, id 45693, offset 0, flags [DF], proto TCP (6), length 55)
    127.0.0.1.41898 > 127.0.0.1.11650: Flags [P.], cksum 0xfe2b (incorrect -> 0x21d6), seq 1:4, ack 1, win 512, options [nop,nop,TS val 347204959 ecr 347204959], length 3
2022-04-06 17:08:42.457035 IP (tos 0x0, ttl 64, id 62749, offset 0, flags [DF], proto TCP (6), length 52)
    127.0.0.1.11650 > 127.0.0.1.41898: Flags [.], cksum 0xfe28 (incorrect -> 0x26df), seq 1, ack 4, win 512, options [nop,nop,TS val 347204959 ecr 347204959], length 0
2022-04-06 17:08:42.457056 IP (tos 0x0, ttl 64, id 62750, offset 0, flags [DF], proto TCP (6), length 54)
    127.0.0.1.11650 > 127.0.0.1.41898: Flags [P.], cksum 0xfe2a (incorrect -> 0x21d5), seq 1:3, ack 4, win 512, options [nop,nop,TS val 347204959 ecr 347204959], length 2
2022-04-06 17:08:42.457063 IP (tos 0x0, ttl 64, id 45694, offset 0, flags [DF], proto TCP (6), length 52)
    127.0.0.1.41898 > 127.0.0.1.11650: Flags [.], cksum 0xfe28 (incorrect -> 0x26dc), seq 4, ack 3, win 512, options [nop,nop,TS val 347204960 ecr 347204959], length 0
2022-04-06 17:08:42.468924 IP (tos 0x0, ttl 64, id 45695, offset 0, flags [DF], proto TCP (6), length 62)
    127.0.0.1.41898 > 127.0.0.1.11650: Flags [P.], cksum 0xfe32 (incorrect -> 0xe52a), seq 4:14, ack 3, win 512, options [nop,nop,TS val 347204971 ecr 347204959], length 10
2022-04-06 17:08:42.468934 IP (tos 0x0, ttl 64, id 62751, offset 0, flags [DF], proto TCP (6), length 52)
    127.0.0.1.11650 > 127.0.0.1.41898: Flags [.], cksum 0xfe28 (incorrect -> 0x26bb), seq 3, ack 14, win 512, options [nop,nop,TS val 347204971 ecr 347204971], length 0
2022-04-06 17:08:42.757426 IP (tos 0x0, ttl 64, id 62752, offset 0, flags [DF], proto TCP (6), length 62)
    127.0.0.1.11650 > 127.0.0.1.41898: Flags [P.], cksum 0xfe32 (incorrect -> 0x2087), seq 3:13, ack 14, win 512, options [nop,nop,TS val 347205260 ecr 347204971], length 10
2022-04-06 17:08:42.757439 IP (tos 0x0, ttl 64, id 45696, offset 0, flags [DF], proto TCP (6), length 52)
    127.0.0.1.41898 > 127.0.0.1.11650: Flags [.], cksum 0xfe28 (incorrect -> 0x246f), seq 14, ack 13, win 512, options [nop,nop,TS val 347205260 ecr 347205260], length 0
2022-04-06 17:08:42.763307 IP (tos 0x0, ttl 64, id 45697, offset 0, flags [DF], proto TCP (6), length 569)
    127.0.0.1.41898 > 127.0.0.1.11650: Flags [P.], cksum 0x002e (incorrect -> 0x6bf8), seq 14:531, ack 13, win 512, options [nop,nop,TS val 347205266 ecr 347205260], length 517
2022-04-06 17:08:42.763315 IP (tos 0x0, ttl 64, id 62753, offset 0, flags [DF], proto TCP (6), length 52)
    127.0.0.1.11650 > 127.0.0.1.41898: Flags [.], cksum 0xfe28 (incorrect -> 0x2262), seq 13, ack 531, win 508, options [nop,nop,TS val 347205266 ecr 347205266], length 0
2022-04-06 17:08:43.056029 IP (tos 0x0, ttl 64, id 62754, offset 0, flags [DF], proto TCP (6), length 3538)
    127.0.0.1.11650 > 127.0.0.1.41898: Flags [P.], cksum 0x0bc7 (incorrect -> 0x7ada), seq 13:3499, ack 531, win 512, options [nop,nop,TS val 347205558 ecr 347205266], length 3486
2022-04-06 17:08:43.056038 IP (tos 0x0, ttl 64, id 45698, offset 0, flags [DF], proto TCP (6), length 52)
    127.0.0.1.41898 > 127.0.0.1.11650: Flags [.], cksum 0xfe28 (incorrect -> 0x128a), seq 531, ack 3499, win 494, options [nop,nop,TS val 347205558 ecr 347205558], length 0
2022-04-06 17:08:43.187443 IP (tos 0x0, ttl 64, id 62755, offset 0, flags [DF], proto TCP (6), length 662)
    127.0.0.1.11650 > 127.0.0.1.41898: Flags [P.], cksum 0x008b (incorrect -> 0xc049), seq 3499:4109, ack 531, win 512, options [nop,nop,TS val 347205690 ecr 347205558], length 610
2022-04-06 17:08:43.187452 IP (tos 0x0, ttl 64, id 45699, offset 0, flags [DF], proto TCP (6), length 52)
    127.0.0.1.41898 > 127.0.0.1.11650: Flags [.], cksum 0xfe28 (incorrect -> 0x0f15), seq 531, ack 4109, win 505, options [nop,nop,TS val 347205690 ecr 347205690], length 0
2022-04-06 17:08:43.317817 IP (tos 0x0, ttl 64, id 62756, offset 0, flags [DF], proto TCP (6), length 656)
    127.0.0.1.11650 > 127.0.0.1.41898: Flags [P.], cksum 0x0085 (incorrect -> 0xadb4), seq 4109:4713, ack 531, win 512, options [nop,nop,TS val 347205820 ecr 347205690], length 604
2022-04-06 17:08:43.317824 IP (tos 0x0, ttl 64, id 45700, offset 0, flags [DF], proto TCP (6), length 52)
    127.0.0.1.41898 > 127.0.0.1.11650: Flags [.], cksum 0xfe28 (incorrect -> 0x0bb5), seq 531, ack 4713, win 505, options [nop,nop,TS val 347205820 ecr 347205820], length 0
2022-04-06 17:08:43.318212 IP (tos 0x0, ttl 64, id 45701, offset 0, flags [DF], proto TCP (6), length 132)
    127.0.0.1.41898 > 127.0.0.1.11650: Flags [P.], cksum 0xfe78 (incorrect -> 0x599a), seq 531:611, ack 4713, win 512, options [nop,nop,TS val 347205821 ecr 347205820], length 80
2022-04-06 17:08:43.318220 IP (tos 0x0, ttl 64, id 62757, offset 0, flags [DF], proto TCP (6), length 52)
    127.0.0.1.11650 > 127.0.0.1.41898: Flags [.], cksum 0xfe28 (incorrect -> 0x0b5c), seq 4713, ack 611, win 512, options [nop,nop,TS val 347205821 ecr 347205821], length 0
2022-04-06 17:08:43.318623 IP (tos 0x0, ttl 64, id 45702, offset 0, flags [DF], proto TCP (6), length 395)
    127.0.0.1.41898 > 127.0.0.1.11650: Flags [P.], cksum 0xff7f (incorrect -> 0x2ad2), seq 611:954, ack 4713, win 512, options [nop,nop,TS val 347205821 ecr 347205821], length 343
2022-04-06 17:08:43.318628 IP (tos 0x0, ttl 64, id 62758, offset 0, flags [DF], proto TCP (6), length 52)
    127.0.0.1.11650 > 127.0.0.1.41898: Flags [.], cksum 0xfe28 (incorrect -> 0x0a07), seq 4713, ack 954, win 510, options [nop,nop,TS val 347205821 ecr 347205821], length 0
2022-04-06 17:08:43.609669 IP (tos 0x0, ttl 64, id 62759, offset 0, flags [DF], proto TCP (6), length 594)
    127.0.0.1.11650 > 127.0.0.1.41898: Flags [P.], cksum 0x0047 (incorrect -> 0x902d), seq 4713:5255, ack 954, win 512, options [nop,nop,TS val 347206112 ecr 347205821], length 542
2022-04-06 17:08:43.609677 IP (tos 0x0, ttl 64, id 45703, offset 0, flags [DF], proto TCP (6), length 52)
    127.0.0.1.41898 > 127.0.0.1.11650: Flags [.], cksum 0xfe28 (incorrect -> 0x05a5), seq 954, ack 5255, win 508, options [nop,nop,TS val 347206112 ecr 347206112], length 0
2022-04-06 17:08:43.734704 IP (tos 0x0, ttl 64, id 62760, offset 0, flags [DF], proto TCP (6), length 3446)
    127.0.0.1.11650 > 127.0.0.1.41898: Flags [P.], cksum 0x0b6b (incorrect -> 0xa17b), seq 5255:8649, ack 954, win 512, options [nop,nop,TS val 347206237 ecr 347206112], length 3394
2022-04-06 17:08:43.734711 IP (tos 0x0, ttl 64, id 45704, offset 0, flags [DF], proto TCP (6), length 52)
    127.0.0.1.41898 > 127.0.0.1.11650: Flags [.], cksum 0xfe28 (incorrect -> 0xf776), seq 954, ack 8649, win 494, options [nop,nop,TS val 347206237 ecr 347206237], length 0
2022-04-06 17:08:43.770510 IP (tos 0x0, ttl 64, id 62761, offset 0, flags [DF], proto TCP (6), length 2913)
    127.0.0.1.11650 > 127.0.0.1.41898: Flags [P.], cksum 0x0956 (incorrect -> 0xb884), seq 8649:11510, ack 954, win 512, options [nop,nop,TS val 347206273 ecr 347206237], length 2861
2022-04-06 17:08:43.770516 IP (tos 0x0, ttl 64, id 45705, offset 0, flags [DF], proto TCP (6), length 52)
    127.0.0.1.41898 > 127.0.0.1.11650: Flags [.], cksum 0xfe28 (incorrect -> 0xebff), seq 954, ack 11510, win 496, options [nop,nop,TS val 347206273 ecr 347206273], length 0
2022-04-06 17:08:43.773349 IP (tos 0x0, ttl 64, id 45706, offset 0, flags [DF], proto TCP (6), length 1928)
    127.0.0.1.41898 > 127.0.0.1.11650: Flags [P.], cksum 0x057d (incorrect -> 0xd6bb), seq 954:2830, ack 11510, win 512, options [nop,nop,TS val 347206276 ecr 347206273], length 1876
2022-04-06 17:08:43.773359 IP (tos 0x0, ttl 64, id 62762, offset 0, flags [DF], proto TCP (6), length 52)
    127.0.0.1.11650 > 127.0.0.1.41898: Flags [.], cksum 0xfe28 (incorrect -> 0xe4a1), seq 11510, ack 2830, win 500, options [nop,nop,TS val 347206276 ecr 347206276], length 0
2022-04-06 17:08:44.116452 IP (tos 0x0, ttl 64, id 62763, offset 0, flags [DF], proto TCP (6), length 3538)
    127.0.0.1.11650 > 127.0.0.1.41898: Flags [P.], cksum 0x0bc7 (incorrect -> 0xb48e), seq 11510:14996, ack 2830, win 512, options [nop,nop,TS val 347206619 ecr 347206276], length 3486
2022-04-06 17:08:44.162660 IP (tos 0x0, ttl 64, id 45707, offset 0, flags [DF], proto TCP (6), length 52)
    127.0.0.1.41898 > 127.0.0.1.11650: Flags [.], cksum 0xfe28 (incorrect -> 0xd41b), seq 2830, ack 14996, win 512, options [nop,nop,TS val 347206665 ecr 347206619], length 0
2022-04-06 17:08:44.246710 IP (tos 0x0, ttl 64, id 62764, offset 0, flags [DF], proto TCP (6), length 4036)
    127.0.0.1.11650 > 127.0.0.1.41898: Flags [P.], cksum 0x0db9 (incorrect -> 0x2269), seq 14996:18980, ack 2830, win 512, options [nop,nop,TS val 347206749 ecr 347206665], length 3984
2022-04-06 17:08:44.246717 IP (tos 0x0, ttl 64, id 45708, offset 0, flags [DF], proto TCP (6), length 52)
    127.0.0.1.41898 > 127.0.0.1.11650: Flags [.], cksum 0xfe28 (incorrect -> 0xc3c9), seq 2830, ack 18980, win 492, options [nop,nop,TS val 347206749 ecr 347206749], length 0
2022-04-06 17:08:44.376971 IP (tos 0x0, ttl 64, id 62765, offset 0, flags [DF], proto TCP (6), length 3760)
    127.0.0.1.11650 > 127.0.0.1.41898: Flags [P.], cksum 0x0ca5 (incorrect -> 0x81be), seq 18980:22688, ack 2830, win 512, options [nop,nop,TS val 347206879 ecr 347206749], length 3708
2022-04-06 17:08:44.376977 IP (tos 0x0, ttl 64, id 45709, offset 0, flags [DF], proto TCP (6), length 52)
    127.0.0.1.41898 > 127.0.0.1.11650: Flags [.], cksum 0xfe28 (incorrect -> 0xb448), seq 2830, ack 22688, win 493, options [nop,nop,TS val 347206879 ecr 347206879], length 0
2022-04-06 17:08:44.510593 IP (tos 0x0, ttl 64, id 62766, offset 0, flags [DF], proto TCP (6), length 3852)
    127.0.0.1.11650 > 127.0.0.1.41898: Flags [P.], cksum 0x0d01 (incorrect -> 0x782b), seq 22688:26488, ack 2830, win 512, options [nop,nop,TS val 347207013 ecr 347206879], length 3800
2022-04-06 17:08:44.510599 IP (tos 0x0, ttl 64, id 45710, offset 0, flags [DF], proto TCP (6), length 52)
    127.0.0.1.41898 > 127.0.0.1.11650: Flags [.], cksum 0xfe28 (incorrect -> 0xa464), seq 2830, ack 26488, win 493, options [nop,nop,TS val 347207013 ecr 347207013], length 0
200, 5.939111232757568, 2.580483913421631