2022-04-07 11:57:25.316085 IP (tos 0x0, ttl 64, id 468, offset 0, flags [DF], proto TCP (6), length 60)
    127.0.0.1.39152 > 127.0.0.1.11650: Flags [S], cksum 0xfe30 (incorrect -> 0xbd8a), seq 638077381, win 65495, options [mss 65495,sackOK,TS val 3488844867 ecr 0,nop,wscale 7], length 0
2022-04-07 11:57:25.316105 IP (tos 0x0, ttl 64, id 0, offset 0, flags [DF], proto TCP (6), length 60)
    127.0.0.1.11650 > 127.0.0.1.39152: Flags [S.], cksum 0xfe30 (incorrect -> 0x9998), seq 2124957965, ack 638077382, win 65483, options [mss 65495,sackOK,TS val 3488844867 ecr 3488844867,nop,wscale 7], length 0
2022-04-07 11:57:25.316120 IP (tos 0x0, ttl 64, id 469, offset 0, flags [DF], proto TCP (6), length 52)
    127.0.0.1.39152 > 127.0.0.1.11650: Flags [.], cksum 0xfe28 (incorrect -> 0xc054), seq 1, ack 1, win 512, options [nop,nop,TS val 3488844867 ecr 3488844867], length 0
2022-04-07 11:57:25.316236 IP (tos 0x0, ttl 64, id 470, offset 0, flags [DF], proto TCP (6), length 55)
    127.0.0.1.39152 > 127.0.0.1.11650: Flags [P.], cksum 0xfe2b (incorrect -> 0xbb47), seq 1:4, ack 1, win 512, options [nop,nop,TS val 3488844868 ecr 3488844867], length 3
2022-04-07 11:57:25.316254 IP (tos 0x0, ttl 64, id 13022, offset 0, flags [DF], proto TCP (6), length 52)
    127.0.0.1.11650 > 127.0.0.1.39152: Flags [.], cksum 0xfe28 (incorrect -> 0xc04f), seq 1, ack 4, win 512, options [nop,nop,TS val 3488844868 ecr 3488844868], length 0
2022-04-07 11:57:25.316334 IP (tos 0x0, ttl 64, id 13023, offset 0, flags [DF], proto TCP (6), length 54)
    127.0.0.1.11650 > 127.0.0.1.39152: Flags [P.], cksum 0xfe2a (incorrect -> 0xbb45), seq 1:3, ack 4, win 512, options [nop,nop,TS val 3488844868 ecr 3488844868], length 2
2022-04-07 11:57:25.316359 IP (tos 0x0, ttl 64, id 471, offset 0, flags [DF], proto TCP (6), length 52)
    127.0.0.1.39152 > 127.0.0.1.11650: Flags [.], cksum 0xfe28 (incorrect -> 0xc04d), seq 4, ack 3, win 512, options [nop,nop,TS val 3488844868 ecr 3488844868], length 0
2022-04-07 11:57:25.318505 IP (tos 0x0, ttl 64, id 472, offset 0, flags [DF], proto TCP (6), length 62)
    127.0.0.1.39152 > 127.0.0.1.11650: Flags [P.], cksum 0xfe32 (incorrect -> 0x3a13), seq 4:14, ack 3, win 512, options [nop,nop,TS val 3488844870 ecr 3488844868], length 10
2022-04-07 11:57:25.318515 IP (tos 0x0, ttl 64, id 13024, offset 0, flags [DF], proto TCP (6), length 52)
    127.0.0.1.11650 > 127.0.0.1.39152: Flags [.], cksum 0xfe28 (incorrect -> 0xc03f), seq 3, ack 14, win 512, options [nop,nop,TS val 3488844870 ecr 3488844870], length 0
2022-04-07 11:57:25.402548 IP (tos 0x0, ttl 64, id 13025, offset 0, flags [DF], proto TCP (6), length 62)
    127.0.0.1.11650 > 127.0.0.1.39152: Flags [P.], cksum 0xfe32 (incorrect -> 0xbad8), seq 3:13, ack 14, win 512, options [nop,nop,TS val 3488844954 ecr 3488844870], length 10
2022-04-07 11:57:25.402557 IP (tos 0x0, ttl 64, id 473, offset 0, flags [DF], proto TCP (6), length 52)
    127.0.0.1.39152 > 127.0.0.1.11650: Flags [.], cksum 0xfe28 (incorrect -> 0xbf8d), seq 14, ack 13, win 512, options [nop,nop,TS val 3488844954 ecr 3488844954], length 0
2022-04-07 11:57:25.408334 IP (tos 0x0, ttl 64, id 474, offset 0, flags [DF], proto TCP (6), length 569)
    127.0.0.1.39152 > 127.0.0.1.11650: Flags [P.], cksum 0x002e (incorrect -> 0x9637), seq 14:531, ack 13, win 512, options [nop,nop,TS val 3488844960 ecr 3488844954], length 517
2022-04-07 11:57:25.408347 IP (tos 0x0, ttl 64, id 13026, offset 0, flags [DF], proto TCP (6), length 52)
    127.0.0.1.11650 > 127.0.0.1.39152: Flags [.], cksum 0xfe28 (incorrect -> 0xbd80), seq 13, ack 531, win 508, options [nop,nop,TS val 3488844960 ecr 3488844960], length 0
200, 4.691121339797974, 0.8004965782165527