2022-04-07 07:40:04.726293 IP (tos 0x0, ttl 64, id 64225, offset 0, flags [DF], proto TCP (6), length 60)
    127.0.0.1.37766 > 127.0.0.1.9850: Flags [S], cksum 0xfe30 (incorrect -> 0x5e00), seq 155149813, win 65495, options [mss 65495,sackOK,TS val 399487229 ecr 0,nop,wscale 7], length 0
2022-04-07 07:40:04.726306 IP (tos 0x0, ttl 64, id 0, offset 0, flags [DF], proto TCP (6), length 60)
    127.0.0.1.9850 > 127.0.0.1.37766: Flags [S.], cksum 0xfe30 (incorrect -> 0xc1b3), seq 204785478, ack 155149814, win 65483, options [mss 65495,sackOK,TS val 399487229 ecr 399487229,nop,wscale 7], length 0
2022-04-07 07:40:04.726315 IP (tos 0x0, ttl 64, id 64226, offset 0, flags [DF], proto TCP (6), length 52)
    127.0.0.1.37766 > 127.0.0.1.9850: Flags [.], cksum 0xfe28 (incorrect -> 0xe86f), seq 1, ack 1, win 512, options [nop,nop,TS val 399487229 ecr 399487229], length 0
2022-04-07 07:40:04.726413 IP (tos 0x0, ttl 64, id 64227, offset 0, flags [DF], proto TCP (6), length 55)
    127.0.0.1.37766 > 127.0.0.1.9850: Flags [P.], cksum 0xfe2b (incorrect -> 0xe363), seq 1:4, ack 1, win 512, options [nop,nop,TS val 399487229 ecr 399487229], length 3
2022-04-07 07:40:04.726415 IP (tos 0x0, ttl 64, id 5926, offset 0, flags [DF], proto TCP (6), length 52)
    127.0.0.1.9850 > 127.0.0.1.37766: Flags [.], cksum 0xfe28 (incorrect -> 0xe86c), seq 1, ack 4, win 512, options [nop,nop,TS val 399487229 ecr 399487229], length 0
2022-04-07 07:40:04.726498 IP (tos 0x0, ttl 64, id 5927, offset 0, flags [DF], proto TCP (6), length 54)
    127.0.0.1.9850 > 127.0.0.1.37766: Flags [P.], cksum 0xfe2a (incorrect -> 0xe362), seq 1:3, ack 4, win 512, options [nop,nop,TS val 399487229 ecr 399487229], length 2
2022-04-07 07:40:04.726502 IP (tos 0x0, ttl 64, id 64228, offset 0, flags [DF], proto TCP (6), length 52)
    127.0.0.1.37766 > 127.0.0.1.9850: Flags [.], cksum 0xfe28 (incorrect -> 0xe86a), seq 4, ack 3, win 512, options [nop,nop,TS val 399487229 ecr 399487229], length 0
2022-04-07 07:40:04.727491 IP (tos 0x0, ttl 64, id 64229, offset 0, flags [DF], proto TCP (6), length 62)
    127.0.0.1.37766 > 127.0.0.1.9850: Flags [P.], cksum 0xfe32 (incorrect -> 0x4ed3), seq 4:14, ack 3, win 512, options [nop,nop,TS val 399487230 ecr 399487229], length 10
2022-04-07 07:40:04.727514 IP (tos 0x0, ttl 64, id 5928, offset 0, flags [DF], proto TCP (6), length 52)
    127.0.0.1.9850 > 127.0.0.1.37766: Flags [.], cksum 0xfe28 (incorrect -> 0xe85e), seq 3, ack 14, win 512, options [nop,nop,TS val 399487230 ecr 399487230], length 0
2022-04-07 07:40:04.796849 IP (tos 0x0, ttl 64, id 5929, offset 0, flags [DF], proto TCP (6), length 62)
    127.0.0.1.9850 > 127.0.0.1.37766: Flags [P.], cksum 0xfe32 (incorrect -> 0xe306), seq 3:13, ack 14, win 512, options [nop,nop,TS val 399487299 ecr 399487230], length 10
2022-04-07 07:40:04.796858 IP (tos 0x0, ttl 64, id 64230, offset 0, flags [DF], proto TCP (6), length 52)
    127.0.0.1.37766 > 127.0.0.1.9850: Flags [.], cksum 0xfe28 (incorrect -> 0xe7ca), seq 14, ack 13, win 512, options [nop,nop,TS val 399487299 ecr 399487299], length 0
2022-04-07 07:40:04.802668 IP (tos 0x0, ttl 64, id 64231, offset 0, flags [DF], proto TCP (6), length 569)
    127.0.0.1.37766 > 127.0.0.1.9850: Flags [P.], cksum 0x002e (incorrect -> 0x85b0), seq 14:531, ack 13, win 512, options [nop,nop,TS val 399487305 ecr 399487299], length 517
2022-04-07 07:40:04.802685 IP (tos 0x0, ttl 64, id 5930, offset 0, flags [DF], proto TCP (6), length 52)
    127.0.0.1.9850 > 127.0.0.1.37766: Flags [.], cksum 0xfe28 (incorrect -> 0xe5bd), seq 13, ack 531, win 508, options [nop,nop,TS val 399487305 ecr 399487305], length 0
2022-04-07 07:40:04.883405 IP (tos 0x0, ttl 64, id 5931, offset 0, flags [DF], proto TCP (6), length 3138)
    127.0.0.1.9850 > 127.0.0.1.37766: Flags [P.], cksum 0x0a37 (incorrect -> 0x856d), seq 13:3099, ack 531, win 512, options [nop,nop,TS val 399487386 ecr 399487305], length 3086
2022-04-07 07:40:04.883410 IP (tos 0x0, ttl 64, id 64232, offset 0, flags [DF], proto TCP (6), length 52)
    127.0.0.1.37766 > 127.0.0.1.9850: Flags [.], cksum 0xfe28 (incorrect -> 0xd91a), seq 531, ack 3099, win 495, options [nop,nop,TS val 399487386 ecr 399487386], length 0
2022-04-07 07:40:04.906705 IP (tos 0x0, ttl 64, id 5932, offset 0, flags [DF], proto TCP (6), length 2393)
    127.0.0.1.9850 > 127.0.0.1.37766: Flags [P.], cksum 0x074e (incorrect -> 0x046c), seq 3099:5440, ack 531, win 512, options [nop,nop,TS val 399487409 ecr 399487386], length 2341
2022-04-07 07:40:04.906710 IP (tos 0x0, ttl 64, id 64233, offset 0, flags [DF], proto TCP (6), length 52)
    127.0.0.1.37766 > 127.0.0.1.9850: Flags [.], cksum 0xfe28 (incorrect -> 0xcfc4), seq 531, ack 5440, win 498, options [nop,nop,TS val 399487409 ecr 399487409], length 0
2022-04-07 07:40:04.907173 IP (tos 0x0, ttl 64, id 64234, offset 0, flags [DF], proto TCP (6), length 132)
    127.0.0.1.37766 > 127.0.0.1.9850: Flags [P.], cksum 0xfe78 (incorrect -> 0x2f01), seq 531:611, ack 5440, win 512, options [nop,nop,TS val 399487410 ecr 399487409], length 80
2022-04-07 07:40:04.907179 IP (tos 0x0, ttl 64, id 5933, offset 0, flags [DF], proto TCP (6), length 52)
    127.0.0.1.9850 > 127.0.0.1.37766: Flags [.], cksum 0xfe28 (incorrect -> 0xcf64), seq 5440, ack 611, win 512, options [nop,nop,TS val 399487410 ecr 399487410], length 0
2022-04-07 07:40:04.907516 IP (tos 0x0, ttl 64, id 64235, offset 0, flags [DF], proto TCP (6), length 316)
    127.0.0.1.37766 > 127.0.0.1.9850: Flags [P.], cksum 0xff30 (incorrect -> 0x22c7), seq 611:875, ack 5440, win 512, options [nop,nop,TS val 399487410 ecr 399487410], length 264
2022-04-07 07:40:04.907519 IP (tos 0x0, ttl 64, id 5934, offset 0, flags [DF], proto TCP (6), length 52)
    127.0.0.1.9850 > 127.0.0.1.37766: Flags [.], cksum 0xfe28 (incorrect -> 0xce5e), seq 5440, ack 875, win 510, options [nop,nop,TS val 399487410 ecr 399487410], length 0
2022-04-07 07:40:04.981312 IP (tos 0x0, ttl 64, id 5935, offset 0, flags [DF], proto TCP (6), length 903)
    127.0.0.1.9850 > 127.0.0.1.37766: Flags [P.], cksum 0x017c (incorrect -> 0xb338), seq 5440:6291, ack 875, win 512, options [nop,nop,TS val 399487484 ecr 399487410], length 851
2022-04-07 07:40:04.981323 IP (tos 0x0, ttl 64, id 64236, offset 0, flags [DF], proto TCP (6), length 52)
    127.0.0.1.37766 > 127.0.0.1.9850: Flags [.], cksum 0xfe28 (incorrect -> 0xca7b), seq 875, ack 6291, win 506, options [nop,nop,TS val 399487484 ecr 399487484], length 0
2022-04-07 07:40:04.983975 IP (tos 0x0, ttl 64, id 64237, offset 0, flags [DF], proto TCP (6), length 415)
    127.0.0.1.37766 > 127.0.0.1.9850: Flags [P.], cksum 0xff93 (incorrect -> 0xd28e), seq 875:1238, ack 6291, win 512, options [nop,nop,TS val 399487486 ecr 399487484], length 363
2022-04-07 07:40:04.983985 IP (tos 0x0, ttl 64, id 5936, offset 0, flags [DF], proto TCP (6), length 52)
    127.0.0.1.9850 > 127.0.0.1.37766: Flags [.], cksum 0xfe28 (incorrect -> 0xc908), seq 6291, ack 1238, win 510, options [nop,nop,TS val 399487486 ecr 399487486], length 0
2022-04-07 07:40:05.078353 IP (tos 0x0, ttl 64, id 5937, offset 0, flags [DF], proto TCP (6), length 775)
    127.0.0.1.9850 > 127.0.0.1.37766: Flags [P.], cksum 0x00fc (incorrect -> 0xaf61), seq 6291:7014, ack 1238, win 512, options [nop,nop,TS val 399487581 ecr 399487486], length 723
2022-04-07 07:40:05.080151 IP (tos 0x0, ttl 64, id 64238, offset 0, flags [DF], proto TCP (6), length 414)
    127.0.0.1.37766 > 127.0.0.1.9850: Flags [P.], cksum 0xff92 (incorrect -> 0xe77c), seq 1238:1600, ack 7014, win 512, options [nop,nop,TS val 399487583 ecr 399487581], length 362
2022-04-07 07:40:05.080160 IP (tos 0x0, ttl 64, id 5938, offset 0, flags [DF], proto TCP (6), length 52)
    127.0.0.1.9850 > 127.0.0.1.37766: Flags [.], cksum 0xfe28 (incorrect -> 0xc409), seq 7014, ack 1600, win 510, options [nop,nop,TS val 399487583 ecr 399487583], length 0
200, 11.529621839523315, 1.6357271671295166