2022-04-07 03:21:24.285420 IP (tos 0x0, ttl 64, id 8957, offset 0, flags [DF], proto TCP (6), length 60)
    127.0.0.1.41460 > 127.0.0.1.10250: Flags [S], cksum 0xfe30 (incorrect -> 0xa681), seq 707313714, win 65495, options [mss 65495,sackOK,TS val 383966788 ecr 0,nop,wscale 7], length 0
2022-04-07 03:21:24.285430 IP (tos 0x0, ttl 64, id 0, offset 0, flags [DF], proto TCP (6), length 60)
    127.0.0.1.10250 > 127.0.0.1.41460: Flags [S.], cksum 0xfe30 (incorrect -> 0x6049), seq 2341586298, ack 707313715, win 65483, options [mss 65495,sackOK,TS val 383966788 ecr 383966788,nop,wscale 7], length 0
2022-04-07 03:21:24.285438 IP (tos 0x0, ttl 64, id 8958, offset 0, flags [DF], proto TCP (6), length 52)
    127.0.0.1.41460 > 127.0.0.1.10250: Flags [.], cksum 0xfe28 (incorrect -> 0x8705), seq 1, ack 1, win 512, options [nop,nop,TS val 383966788 ecr 383966788], length 0
2022-04-07 03:21:24.285526 IP (tos 0x0, ttl 64, id 8959, offset 0, flags [DF], proto TCP (6), length 55)
    127.0.0.1.41460 > 127.0.0.1.10250: Flags [P.], cksum 0xfe2b (incorrect -> 0x81f9), seq 1:4, ack 1, win 512, options [nop,nop,TS val 383966788 ecr 383966788], length 3
2022-04-07 03:21:24.285536 IP (tos 0x0, ttl 64, id 11170, offset 0, flags [DF], proto TCP (6), length 52)
    127.0.0.1.10250 > 127.0.0.1.41460: Flags [.], cksum 0xfe28 (incorrect -> 0x8702), seq 1, ack 4, win 512, options [nop,nop,TS val 383966788 ecr 383966788], length 0
2022-04-07 03:21:24.285591 IP (tos 0x0, ttl 64, id 11171, offset 0, flags [DF], proto TCP (6), length 54)
    127.0.0.1.10250 > 127.0.0.1.41460: Flags [P.], cksum 0xfe2a (incorrect -> 0x81f8), seq 1:3, ack 4, win 512, options [nop,nop,TS val 383966788 ecr 383966788], length 2
2022-04-07 03:21:24.285607 IP (tos 0x0, ttl 64, id 8960, offset 0, flags [DF], proto TCP (6), length 52)
    127.0.0.1.41460 > 127.0.0.1.10250: Flags [.], cksum 0xfe28 (incorrect -> 0x8700), seq 4, ack 3, win 512, options [nop,nop,TS val 383966788 ecr 383966788], length 0
2022-04-07 03:21:24.296828 IP (tos 0x0, ttl 64, id 8961, offset 0, flags [DF], proto TCP (6), length 62)
    127.0.0.1.41460 > 127.0.0.1.10250: Flags [P.], cksum 0xfe32 (incorrect -> 0x2d96), seq 4:14, ack 3, win 512, options [nop,nop,TS val 383966799 ecr 383966788], length 10
2022-04-07 03:21:24.296835 IP (tos 0x0, ttl 64, id 11172, offset 0, flags [DF], proto TCP (6), length 52)
    127.0.0.1.10250 > 127.0.0.1.41460: Flags [.], cksum 0xfe28 (incorrect -> 0x86e0), seq 3, ack 14, win 512, options [nop,nop,TS val 383966799 ecr 383966799], length 0
2022-04-07 03:21:24.386531 IP (tos 0x0, ttl 64, id 11173, offset 0, flags [DF], proto TCP (6), length 62)
    127.0.0.1.10250 > 127.0.0.1.41460: Flags [P.], cksum 0xfe32 (incorrect -> 0x8173), seq 3:13, ack 14, win 512, options [nop,nop,TS val 383966889 ecr 383966799], length 10
2022-04-07 03:21:24.386537 IP (tos 0x0, ttl 64, id 8962, offset 0, flags [DF], proto TCP (6), length 52)
    127.0.0.1.41460 > 127.0.0.1.10250: Flags [.], cksum 0xfe28 (incorrect -> 0x8622), seq 14, ack 13, win 512, options [nop,nop,TS val 383966889 ecr 383966889], length 0
2022-04-07 03:21:24.392127 IP (tos 0x0, ttl 64, id 8963, offset 0, flags [DF], proto TCP (6), length 569)
    127.0.0.1.41460 > 127.0.0.1.10250: Flags [P.], cksum 0x002e (incorrect -> 0x35f6), seq 14:531, ack 13, win 512, options [nop,nop,TS val 383966895 ecr 383966889], length 517
2022-04-07 03:21:24.392136 IP (tos 0x0, ttl 64, id 11174, offset 0, flags [DF], proto TCP (6), length 52)
    127.0.0.1.10250 > 127.0.0.1.41460: Flags [.], cksum 0xfe28 (incorrect -> 0x8415), seq 13, ack 531, win 508, options [nop,nop,TS val 383966895 ecr 383966895], length 0
200, 5.919652462005615, 0.4747800827026367