2022-04-07 21:54:59.878634 IP (tos 0x0, ttl 64, id 64622, offset 0, flags [DF], proto TCP (6), length 60)
    127.0.0.1.40798 > 127.0.0.1.9950: Flags [S], cksum 0xfe30 (incorrect -> 0xd512), seq 3294066973, win 65495, options [mss 65495,sackOK,TS val 3524699430 ecr 0,nop,wscale 7], length 0
2022-04-07 21:54:59.878645 IP (tos 0x0, ttl 64, id 0, offset 0, flags [DF], proto TCP (6), length 60)
    127.0.0.1.9950 > 127.0.0.1.40798: Flags [S.], cksum 0xfe30 (incorrect -> 0x7452), seq 1226743903, ack 3294066974, win 65483, options [mss 65495,sackOK,TS val 3524699430 ecr 3524699430,nop,wscale 7], length 0
2022-04-07 21:54:59.878654 IP (tos 0x0, ttl 64, id 64623, offset 0, flags [DF], proto TCP (6), length 52)
    127.0.0.1.40798 > 127.0.0.1.9950: Flags [.], cksum 0xfe28 (incorrect -> 0x9b0e), seq 1, ack 1, win 512, options [nop,nop,TS val 3524699430 ecr 3524699430], length 0
2022-04-07 21:54:59.878753 IP (tos 0x0, ttl 64, id 64624, offset 0, flags [DF], proto TCP (6), length 55)
    127.0.0.1.40798 > 127.0.0.1.9950: Flags [P.], cksum 0xfe2b (incorrect -> 0x9602), seq 1:4, ack 1, win 512, options [nop,nop,TS val 3524699430 ecr 3524699430], length 3
2022-04-07 21:54:59.878759 IP (tos 0x0, ttl 64, id 22802, offset 0, flags [DF], proto TCP (6), length 52)
    127.0.0.1.9950 > 127.0.0.1.40798: Flags [.], cksum 0xfe28 (incorrect -> 0x9b0b), seq 1, ack 4, win 512, options [nop,nop,TS val 3524699430 ecr 3524699430], length 0
2022-04-07 21:54:59.878864 IP (tos 0x0, ttl 64, id 22803, offset 0, flags [DF], proto TCP (6), length 54)
    127.0.0.1.9950 > 127.0.0.1.40798: Flags [P.], cksum 0xfe2a (incorrect -> 0x9601), seq 1:3, ack 4, win 512, options [nop,nop,TS val 3524699430 ecr 3524699430], length 2
2022-04-07 21:54:59.878884 IP (tos 0x0, ttl 64, id 64625, offset 0, flags [DF], proto TCP (6), length 52)
    127.0.0.1.40798 > 127.0.0.1.9950: Flags [.], cksum 0xfe28 (incorrect -> 0x9b09), seq 4, ack 3, win 512, options [nop,nop,TS val 3524699430 ecr 3524699430], length 0
2022-04-07 21:54:59.880971 IP (tos 0x0, ttl 64, id 64626, offset 0, flags [DF], proto TCP (6), length 62)
    127.0.0.1.40798 > 127.0.0.1.9950: Flags [P.], cksum 0xfe32 (incorrect -> 0x3bbd), seq 4:14, ack 3, win 512, options [nop,nop,TS val 3524699432 ecr 3524699430], length 10
2022-04-07 21:54:59.880989 IP (tos 0x0, ttl 64, id 22804, offset 0, flags [DF], proto TCP (6), length 52)
    127.0.0.1.9950 > 127.0.0.1.40798: Flags [.], cksum 0xfe28 (incorrect -> 0x9afb), seq 3, ack 14, win 512, options [nop,nop,TS val 3524699432 ecr 3524699432], length 0
2022-04-07 21:54:59.922628 IP (tos 0x0, ttl 64, id 22805, offset 0, flags [DF], proto TCP (6), length 62)
    127.0.0.1.9950 > 127.0.0.1.40798: Flags [P.], cksum 0xfe32 (incorrect -> 0x95be), seq 3:13, ack 14, win 512, options [nop,nop,TS val 3524699474 ecr 3524699432], length 10
2022-04-07 21:54:59.922638 IP (tos 0x0, ttl 64, id 64627, offset 0, flags [DF], proto TCP (6), length 52)
    127.0.0.1.40798 > 127.0.0.1.9950: Flags [.], cksum 0xfe28 (incorrect -> 0x9a9d), seq 14, ack 13, win 512, options [nop,nop,TS val 3524699474 ecr 3524699474], length 0
2022-04-07 21:54:59.928532 IP (tos 0x0, ttl 64, id 64628, offset 0, flags [DF], proto TCP (6), length 569)
    127.0.0.1.40798 > 127.0.0.1.9950: Flags [P.], cksum 0x002e (incorrect -> 0x93fe), seq 14:531, ack 13, win 512, options [nop,nop,TS val 3524699480 ecr 3524699474], length 517
2022-04-07 21:54:59.928542 IP (tos 0x0, ttl 64, id 22806, offset 0, flags [DF], proto TCP (6), length 52)
    127.0.0.1.9950 > 127.0.0.1.40798: Flags [.], cksum 0xfe28 (incorrect -> 0x9890), seq 13, ack 531, win 508, options [nop,nop,TS val 3524699480 ecr 3524699480], length 0
2022-04-07 21:54:59.974062 IP (tos 0x0, ttl 64, id 22807, offset 0, flags [DF], proto TCP (6), length 3538)
    127.0.0.1.9950 > 127.0.0.1.40798: Flags [P.], cksum 0x0bc7 (incorrect -> 0x1834), seq 13:3499, ack 531, win 512, options [nop,nop,TS val 3524699525 ecr 3524699480], length 3486
2022-04-07 21:54:59.974070 IP (tos 0x0, ttl 64, id 64629, offset 0, flags [DF], proto TCP (6), length 52)
    127.0.0.1.40798 > 127.0.0.1.9950: Flags [.], cksum 0xfe28 (incorrect -> 0x8aa6), seq 531, ack 3499, win 494, options [nop,nop,TS val 3524699525 ecr 3524699525], length 0
2022-04-07 21:54:59.993577 IP (tos 0x0, ttl 64, id 22808, offset 0, flags [DF], proto TCP (6), length 1217)
    127.0.0.1.9950 > 127.0.0.1.40798: Flags [P.], cksum 0x02b6 (incorrect -> 0xb238), seq 3499:4664, ack 531, win 512, options [nop,nop,TS val 3524699545 ecr 3524699525], length 1165
2022-04-07 21:54:59.993585 IP (tos 0x0, ttl 64, id 64630, offset 0, flags [DF], proto TCP (6), length 52)
    127.0.0.1.40798 > 127.0.0.1.9950: Flags [.], cksum 0xfe28 (incorrect -> 0x85e8), seq 531, ack 4664, win 503, options [nop,nop,TS val 3524699545 ecr 3524699545], length 0
2022-04-07 21:54:59.993954 IP (tos 0x0, ttl 64, id 64631, offset 0, flags [DF], proto TCP (6), length 132)
    127.0.0.1.40798 > 127.0.0.1.9950: Flags [P.], cksum 0xfe78 (incorrect -> 0x3771), seq 531:611, ack 4664, win 503, options [nop,nop,TS val 3524699545 ecr 3524699545], length 80
2022-04-07 21:54:59.993962 IP (tos 0x0, ttl 64, id 22809, offset 0, flags [DF], proto TCP (6), length 52)
    127.0.0.1.9950 > 127.0.0.1.40798: Flags [.], cksum 0xfe28 (incorrect -> 0x858f), seq 4664, ack 611, win 512, options [nop,nop,TS val 3524699545 ecr 3524699545], length 0
2022-04-07 21:54:59.994343 IP (tos 0x0, ttl 64, id 64632, offset 0, flags [DF], proto TCP (6), length 345)
    127.0.0.1.40798 > 127.0.0.1.9950: Flags [P.], cksum 0xff4d (incorrect -> 0x9f51), seq 611:904, ack 4664, win 503, options [nop,nop,TS val 3524699546 ecr 3524699545], length 293
2022-04-07 21:54:59.994351 IP (tos 0x0, ttl 64, id 22810, offset 0, flags [DF], proto TCP (6), length 52)
    127.0.0.1.9950 > 127.0.0.1.40798: Flags [.], cksum 0xfe28 (incorrect -> 0x846a), seq 4664, ack 904, win 510, options [nop,nop,TS val 3524699546 ecr 3524699546], length 0
403, 5.85879373550415, 0.24745559692382812