2022-04-07 13:22:45.751471 IP (tos 0x0, ttl 64, id 19986, offset 0, flags [DF], proto TCP (6), length 60)
    127.0.0.1.53238 > 127.0.0.1.9350: Flags [S], cksum 0xfe30 (incorrect -> 0x3690), seq 3485783798, win 65495, options [mss 65495,sackOK,TS val 3493965303 ecr 0,nop,wscale 7], length 0
2022-04-07 13:22:45.751481 IP (tos 0x0, ttl 64, id 0, offset 0, flags [DF], proto TCP (6), length 60)
    127.0.0.1.9350 > 127.0.0.1.53238: Flags [S.], cksum 0xfe30 (incorrect -> 0x0f2b), seq 913863342, ack 3485783799, win 65483, options [mss 65495,sackOK,TS val 3493965303 ecr 3493965303,nop,wscale 7], length 0
2022-04-07 13:22:45.751491 IP (tos 0x0, ttl 64, id 19987, offset 0, flags [DF], proto TCP (6), length 52)
    127.0.0.1.53238 > 127.0.0.1.9350: Flags [.], cksum 0xfe28 (incorrect -> 0x35e7), seq 1, ack 1, win 512, options [nop,nop,TS val 3493965303 ecr 3493965303], length 0
2022-04-07 13:22:45.751608 IP (tos 0x0, ttl 64, id 19988, offset 0, flags [DF], proto TCP (6), length 55)
    127.0.0.1.53238 > 127.0.0.1.9350: Flags [P.], cksum 0xfe2b (incorrect -> 0x30db), seq 1:4, ack 1, win 512, options [nop,nop,TS val 3493965303 ecr 3493965303], length 3
2022-04-07 13:22:45.751623 IP (tos 0x0, ttl 64, id 4958, offset 0, flags [DF], proto TCP (6), length 52)
    127.0.0.1.9350 > 127.0.0.1.53238: Flags [.], cksum 0xfe28 (incorrect -> 0x35e4), seq 1, ack 4, win 512, options [nop,nop,TS val 3493965303 ecr 3493965303], length 0
2022-04-07 13:22:45.751657 IP (tos 0x0, ttl 64, id 4959, offset 0, flags [DF], proto TCP (6), length 54)
    127.0.0.1.9350 > 127.0.0.1.53238: Flags [P.], cksum 0xfe2a (incorrect -> 0x30da), seq 1:3, ack 4, win 512, options [nop,nop,TS val 3493965303 ecr 3493965303], length 2
2022-04-07 13:22:45.751670 IP (tos 0x0, ttl 64, id 19989, offset 0, flags [DF], proto TCP (6), length 52)
    127.0.0.1.53238 > 127.0.0.1.9350: Flags [.], cksum 0xfe28 (incorrect -> 0x35e2), seq 4, ack 3, win 512, options [nop,nop,TS val 3493965303 ecr 3493965303], length 0
2022-04-07 13:22:45.753985 IP (tos 0x0, ttl 64, id 19990, offset 0, flags [DF], proto TCP (6), length 62)
    127.0.0.1.53238 > 127.0.0.1.9350: Flags [P.], cksum 0xfe32 (incorrect -> 0x8018), seq 4:14, ack 3, win 512, options [nop,nop,TS val 3493965305 ecr 3493965303], length 10
2022-04-07 13:22:45.753995 IP (tos 0x0, ttl 64, id 4960, offset 0, flags [DF], proto TCP (6), length 52)
    127.0.0.1.9350 > 127.0.0.1.53238: Flags [.], cksum 0xfe28 (incorrect -> 0x35d4), seq 3, ack 14, win 512, options [nop,nop,TS val 3493965305 ecr 3493965305], length 0
2022-04-07 13:22:46.084779 IP (tos 0x0, ttl 64, id 4961, offset 0, flags [DF], proto TCP (6), length 62)
    127.0.0.1.9350 > 127.0.0.1.53238: Flags [P.], cksum 0xfe32 (incorrect -> 0x2f76), seq 3:13, ack 14, win 512, options [nop,nop,TS val 3493965636 ecr 3493965305], length 10
2022-04-07 13:22:46.084791 IP (tos 0x0, ttl 64, id 19991, offset 0, flags [DF], proto TCP (6), length 52)
    127.0.0.1.53238 > 127.0.0.1.9350: Flags [.], cksum 0xfe28 (incorrect -> 0x3334), seq 14, ack 13, win 512, options [nop,nop,TS val 3493965636 ecr 3493965636], length 0
2022-04-07 13:22:46.090230 IP (tos 0x0, ttl 64, id 19992, offset 0, flags [DF], proto TCP (6), length 569)
    127.0.0.1.53238 > 127.0.0.1.9350: Flags [P.], cksum 0x002e (incorrect -> 0x5d73), seq 14:531, ack 13, win 512, options [nop,nop,TS val 3493965642 ecr 3493965636], length 517
2022-04-07 13:22:46.090241 IP (tos 0x0, ttl 64, id 4962, offset 0, flags [DF], proto TCP (6), length 52)
    127.0.0.1.9350 > 127.0.0.1.53238: Flags [.], cksum 0xfe28 (incorrect -> 0x3127), seq 13, ack 531, win 508, options [nop,nop,TS val 3493965642 ecr 3493965642], length 0
2022-04-07 13:22:46.433008 IP (tos 0x0, ttl 64, id 4963, offset 0, flags [DF], proto TCP (6), length 3538)
    127.0.0.1.9350 > 127.0.0.1.53238: Flags [P.], cksum 0x0bc7 (incorrect -> 0xd798), seq 13:3499, ack 531, win 512, options [nop,nop,TS val 3493965984 ecr 3493965642], length 3486
2022-04-07 13:22:46.433026 IP (tos 0x0, ttl 64, id 19993, offset 0, flags [DF], proto TCP (6), length 52)
    127.0.0.1.53238 > 127.0.0.1.9350: Flags [.], cksum 0xfe28 (incorrect -> 0x20eb), seq 531, ack 3499, win 494, options [nop,nop,TS val 3493965984 ecr 3493965984], length 0
2022-04-07 13:22:46.565378 IP (tos 0x0, ttl 64, id 4964, offset 0, flags [DF], proto TCP (6), length 659)
    127.0.0.1.9350 > 127.0.0.1.53238: Flags [P.], cksum 0x0088 (incorrect -> 0x9fdf), seq 3499:4106, ack 531, win 512, options [nop,nop,TS val 3493966117 ecr 3493965984], length 607
2022-04-07 13:22:46.565390 IP (tos 0x0, ttl 64, id 19994, offset 0, flags [DF], proto TCP (6), length 52)
    127.0.0.1.53238 > 127.0.0.1.9350: Flags [.], cksum 0xfe28 (incorrect -> 0x1d77), seq 531, ack 4106, win 505, options [nop,nop,TS val 3493966117 ecr 3493966117], length 0
2022-04-07 13:22:46.565771 IP (tos 0x0, ttl 64, id 19995, offset 0, flags [DF], proto TCP (6), length 132)
    127.0.0.1.53238 > 127.0.0.1.9350: Flags [P.], cksum 0xfe78 (incorrect -> 0x1d0a), seq 531:611, ack 4106, win 512, options [nop,nop,TS val 3493966117 ecr 3493966117], length 80
2022-04-07 13:22:46.565779 IP (tos 0x0, ttl 64, id 4965, offset 0, flags [DF], proto TCP (6), length 52)
    127.0.0.1.9350 > 127.0.0.1.53238: Flags [.], cksum 0xfe28 (incorrect -> 0x1d20), seq 4106, ack 611, win 512, options [nop,nop,TS val 3493966117 ecr 3493966117], length 0
2022-04-07 13:22:46.566109 IP (tos 0x0, ttl 64, id 19996, offset 0, flags [DF], proto TCP (6), length 318)
    127.0.0.1.53238 > 127.0.0.1.9350: Flags [P.], cksum 0xff32 (incorrect -> 0x93a0), seq 611:877, ack 4106, win 512, options [nop,nop,TS val 3493966117 ecr 3493966117], length 266
2022-04-07 13:22:46.566114 IP (tos 0x0, ttl 64, id 4966, offset 0, flags [DF], proto TCP (6), length 52)
    127.0.0.1.9350 > 127.0.0.1.53238: Flags [.], cksum 0xfe28 (incorrect -> 0x1c18), seq 4106, ack 877, win 510, options [nop,nop,TS val 3493966117 ecr 3493966117], length 0
2022-04-07 13:22:46.914468 IP (tos 0x0, ttl 64, id 4967, offset 0, flags [DF], proto TCP (6), length 323)
    127.0.0.1.9350 > 127.0.0.1.53238: Flags [P.], cksum 0xff37 (incorrect -> 0x9ce9), seq 4106:4377, ack 877, win 512, options [nop,nop,TS val 3493966466 ecr 3493966117], length 271
2022-04-07 13:22:46.914478 IP (tos 0x0, ttl 64, id 19997, offset 0, flags [DF], proto TCP (6), length 52)
    127.0.0.1.53238 > 127.0.0.1.9350: Flags [.], cksum 0xfe28 (incorrect -> 0x184f), seq 877, ack 4377, win 510, options [nop,nop,TS val 3493966466 ecr 3493966466], length 0
2022-04-07 13:22:46.941773 IP (tos 0x0, ttl 64, id 4968, offset 0, flags [DF], proto TCP (6), length 3265)
    127.0.0.1.9350 > 127.0.0.1.53238: Flags [P.], cksum 0x0ab6 (incorrect -> 0x2c9a), seq 4377:7590, ack 877, win 512, options [nop,nop,TS val 3493966493 ecr 3493966466], length 3213
2022-04-07 13:22:46.941782 IP (tos 0x0, ttl 64, id 19998, offset 0, flags [DF], proto TCP (6), length 52)
    127.0.0.1.53238 > 127.0.0.1.9350: Flags [.], cksum 0xfe28 (incorrect -> 0x0b9b), seq 877, ack 7590, win 495, options [nop,nop,TS val 3493966493 ecr 3493966493], length 0
2022-04-07 13:22:46.943286 IP (tos 0x0, ttl 64, id 4969, offset 0, flags [DF], proto TCP (6), length 4100)
    127.0.0.1.9350 > 127.0.0.1.53238: Flags [P.], cksum 0x0df9 (incorrect -> 0x7ac3), seq 7590:11638, ack 877, win 512, options [nop,nop,TS val 3493966495 ecr 3493966493], length 4048
2022-04-07 13:22:46.943294 IP (tos 0x0, ttl 64, id 19999, offset 0, flags [DF], proto TCP (6), length 52)
    127.0.0.1.53238 > 127.0.0.1.9350: Flags [.], cksum 0xfe28 (incorrect -> 0xfbc9), seq 877, ack 11638, win 492, options [nop,nop,TS val 3493966495 ecr 3493966495], length 0
2022-04-07 13:22:46.943302 IP (tos 0x0, ttl 64, id 4970, offset 0, flags [DF], proto TCP (6), length 342)
    127.0.0.1.9350 > 127.0.0.1.53238: Flags [P.], cksum 0xff4a (incorrect -> 0x7517), seq 11638:11928, ack 877, win 512, options [nop,nop,TS val 3493966495 ecr 3493966495], length 290
2022-04-07 13:22:46.943306 IP (tos 0x0, ttl 64, id 20000, offset 0, flags [DF], proto TCP (6), length 52)
    127.0.0.1.53238 > 127.0.0.1.9350: Flags [.], cksum 0xfe28 (incorrect -> 0xfaa8), seq 877, ack 11928, win 491, options [nop,nop,TS val 3493966495 ecr 3493966495], length 0
2022-04-07 13:22:46.973882 IP (tos 0x0, ttl 64, id 4971, offset 0, flags [DF], proto TCP (6), length 1500)
    127.0.0.1.9350 > 127.0.0.1.53238: Flags [P.], cksum 0x03d1 (incorrect -> 0x716a), seq 11928:13376, ack 877, win 512, options [nop,nop,TS val 3493966525 ecr 3493966495], length 1448
2022-04-07 13:22:46.973896 IP (tos 0x0, ttl 64, id 20001, offset 0, flags [DF], proto TCP (6), length 52)
    127.0.0.1.53238 > 127.0.0.1.9350: Flags [.], cksum 0xfe28 (incorrect -> 0xf4b9), seq 877, ack 13376, win 502, options [nop,nop,TS val 3493966525 ecr 3493966525], length 0
2022-04-07 13:22:47.055703 IP (tos 0x0, ttl 64, id 4972, offset 0, flags [DF], proto TCP (6), length 3400)
    127.0.0.1.9350 > 127.0.0.1.53238: Flags [P.], cksum 0x0b3d (incorrect -> 0x5456), seq 13376:16724, ack 877, win 512, options [nop,nop,TS val 3493966607 ecr 3493966525], length 3348
2022-04-07 13:22:47.055711 IP (tos 0x0, ttl 64, id 20002, offset 0, flags [DF], proto TCP (6), length 52)
    127.0.0.1.53238 > 127.0.0.1.9350: Flags [.], cksum 0xfe28 (incorrect -> 0xe709), seq 877, ack 16724, win 494, options [nop,nop,TS val 3493966607 ecr 3493966607], length 0
2022-04-07 13:22:47.073219 IP (tos 0x0, ttl 64, id 4973, offset 0, flags [DF], proto TCP (6), length 550)
    127.0.0.1.9350 > 127.0.0.1.53238: Flags [P.], cksum 0x001b (incorrect -> 0x2c02), seq 16724:17222, ack 877, win 512, options [nop,nop,TS val 3493966624 ecr 3493966607], length 498
2022-04-07 13:22:47.073228 IP (tos 0x0, ttl 64, id 20003, offset 0, flags [DF], proto TCP (6), length 52)
    127.0.0.1.53238 > 127.0.0.1.9350: Flags [.], cksum 0xfe28 (incorrect -> 0xe4e8), seq 877, ack 17222, win 506, options [nop,nop,TS val 3493966625 ecr 3493966624], length 0
2022-04-07 13:22:47.074121 IP (tos 0x0, ttl 64, id 4974, offset 0, flags [DF], proto TCP (6), length 3538)
    127.0.0.1.9350 > 127.0.0.1.53238: Flags [P.], cksum 0x0bc7 (incorrect -> 0x8289), seq 17222:20708, ack 877, win 512, options [nop,nop,TS val 3493966625 ecr 3493966625], length 3486
2022-04-07 13:22:47.074127 IP (tos 0x0, ttl 64, id 20004, offset 0, flags [DF], proto TCP (6), length 52)
    127.0.0.1.53238 > 127.0.0.1.9350: Flags [.], cksum 0xfe28 (incorrect -> 0xd755), seq 877, ack 20708, win 494, options [nop,nop,TS val 3493966625 ecr 3493966625], length 0
2022-04-07 13:22:47.076849 IP (tos 0x0, ttl 64, id 4975, offset 0, flags [DF], proto TCP (6), length 3806)
    127.0.0.1.9350 > 127.0.0.1.53238: Flags [P.], cksum 0x0cd3 (incorrect -> 0xc8cf), seq 20708:24462, ack 877, win 512, options [nop,nop,TS val 3493966628 ecr 3493966625], length 3754
2022-04-07 13:22:47.076858 IP (tos 0x0, ttl 64, id 20005, offset 0, flags [DF], proto TCP (6), length 52)
    127.0.0.1.53238 > 127.0.0.1.9350: Flags [.], cksum 0xfe28 (incorrect -> 0xc8a6), seq 877, ack 24462, win 493, options [nop,nop,TS val 3493966628 ecr 3493966628], length 0
2022-04-07 13:22:47.078599 IP (tos 0x0, ttl 64, id 4976, offset 0, flags [DF], proto TCP (6), length 3446)
    127.0.0.1.9350 > 127.0.0.1.53238: Flags [P.], cksum 0x0b6b (incorrect -> 0x7309), seq 24462:27856, ack 877, win 512, options [nop,nop,TS val 3493966630 ecr 3493966628], length 3394
2022-04-07 13:22:47.078609 IP (tos 0x0, ttl 64, id 20006, offset 0, flags [DF], proto TCP (6), length 52)
    127.0.0.1.53238 > 127.0.0.1.9350: Flags [.], cksum 0xfe28 (incorrect -> 0xbb5f), seq 877, ack 27856, win 494, options [nop,nop,TS val 3493966630 ecr 3493966630], length 0
2022-04-07 13:22:47.080116 IP (tos 0x0, ttl 64, id 4977, offset 0, flags [DF], proto TCP (6), length 3400)
    127.0.0.1.9350 > 127.0.0.1.53238: Flags [P.], cksum 0x0b3d (incorrect -> 0x3153), seq 27856:31204, ack 877, win 512, options [nop,nop,TS val 3493966631 ecr 3493966630], length 3348
2022-04-07 13:22:47.080131 IP (tos 0x0, ttl 64, id 20007, offset 0, flags [DF], proto TCP (6), length 52)
    127.0.0.1.53238 > 127.0.0.1.9350: Flags [.], cksum 0xfe28 (incorrect -> 0xae37), seq 877, ack 31204, win 512, options [nop,nop,TS val 3493966631 ecr 3493966631], length 0
2022-04-07 13:22:47.098006 IP (tos 0x0, ttl 64, id 4978, offset 0, flags [DF], proto TCP (6), length 1500)
    127.0.0.1.9350 > 127.0.0.1.53238: Flags [P.], cksum 0x03d1 (incorrect -> 0x649d), seq 31204:32652, ack 877, win 512, options [nop,nop,TS val 3493966649 ecr 3493966631], length 1448
2022-04-07 13:22:47.098359 IP (tos 0x0, ttl 64, id 20008, offset 0, flags [DF], proto TCP (6), length 52)
    127.0.0.1.53238 > 127.0.0.1.9350: Flags [.], cksum 0xfe28 (incorrect -> 0xa86a), seq 877, ack 32652, win 512, options [nop,nop,TS val 3493966650 ecr 3493966649], length 0
2022-04-07 13:22:47.106965 IP (tos 0x0, ttl 64, id 4979, offset 0, flags [DF], proto TCP (6), length 2948)
    127.0.0.1.9350 > 127.0.0.1.53238: Flags [P.], cksum 0x0979 (incorrect -> 0xd482), seq 32652:35548, ack 877, win 512, options [nop,nop,TS val 3493966658 ecr 3493966650], length 2896
2022-04-07 13:22:47.106981 IP (tos 0x0, ttl 64, id 20009, offset 0, flags [DF], proto TCP (6), length 52)
    127.0.0.1.53238 > 127.0.0.1.9350: Flags [.], cksum 0xfe28 (incorrect -> 0x9d09), seq 877, ack 35548, win 512, options [nop,nop,TS val 3493966658 ecr 3493966658], length 0
2022-04-07 13:22:47.109208 IP (tos 0x0, ttl 64, id 4980, offset 0, flags [DF], proto TCP (6), length 1500)
    127.0.0.1.9350 > 127.0.0.1.53238: Flags [P.], cksum 0x03d1 (incorrect -> 0x3dac), seq 35548:36996, ack 877, win 512, options [nop,nop,TS val 3493966660 ecr 3493966658], length 1448
2022-04-07 13:22:47.109228 IP (tos 0x0, ttl 64, id 20010, offset 0, flags [DF], proto TCP (6), length 52)
    127.0.0.1.53238 > 127.0.0.1.9350: Flags [.], cksum 0xfe28 (incorrect -> 0x975c), seq 877, ack 36996, win 512, options [nop,nop,TS val 3493966661 ecr 3493966660], length 0
2022-04-07 13:22:47.119138 IP (tos 0x0, ttl 64, id 4981, offset 0, flags [DF], proto TCP (6), length 2948)
    127.0.0.1.9350 > 127.0.0.1.53238: Flags [P.], cksum 0x0979 (incorrect -> 0xc80e), seq 36996:39892, ack 877, win 512, options [nop,nop,TS val 3493966670 ecr 3493966661], length 2896
2022-04-07 13:22:47.119153 IP (tos 0x0, ttl 64, id 20011, offset 0, flags [DF], proto TCP (6), length 52)
    127.0.0.1.53238 > 127.0.0.1.9350: Flags [.], cksum 0xfe28 (incorrect -> 0x8bf9), seq 877, ack 39892, win 512, options [nop,nop,TS val 3493966670 ecr 3493966670], length 0
2022-04-07 13:22:47.140288 IP (tos 0x0, ttl 64, id 4982, offset 0, flags [DF], proto TCP (6), length 1500)
    127.0.0.1.9350 > 127.0.0.1.53238: Flags [P.], cksum 0x03d1 (incorrect -> 0xa3ac), seq 39892:41340, ack 877, win 512, options [nop,nop,TS val 3493966692 ecr 3493966670], length 1448
2022-04-07 13:22:47.140306 IP (tos 0x0, ttl 64, id 20012, offset 0, flags [DF], proto TCP (6), length 52)
    127.0.0.1.53238 > 127.0.0.1.9350: Flags [.], cksum 0xfe28 (incorrect -> 0x8625), seq 877, ack 41340, win 512, options [nop,nop,TS val 3493966692 ecr 3493966692], length 0
2022-04-07 13:22:47.179519 IP (tos 0x0, ttl 64, id 4983, offset 0, flags [DF], proto TCP (6), length 2948)
    127.0.0.1.9350 > 127.0.0.1.53238: Flags [P.], cksum 0x0979 (incorrect -> 0xfeef), seq 41340:44236, ack 877, win 512, options [nop,nop,TS val 3493966731 ecr 3493966692], length 2896
2022-04-07 13:22:47.179536 IP (tos 0x0, ttl 64, id 20013, offset 0, flags [DF], proto TCP (6), length 52)
    127.0.0.1.53238 > 127.0.0.1.9350: Flags [.], cksum 0xfe28 (incorrect -> 0x7a87), seq 877, ack 44236, win 512, options [nop,nop,TS val 3493966731 ecr 3493966731], length 0
2022-04-07 13:22:47.205600 IP (tos 0x0, ttl 64, id 4984, offset 0, flags [DF], proto TCP (6), length 3446)
    127.0.0.1.9350 > 127.0.0.1.53238: Flags [P.], cksum 0x0b6b (incorrect -> 0x5aca), seq 44236:47630, ack 877, win 512, options [nop,nop,TS val 3493966757 ecr 3493966731], length 3394
2022-04-07 13:22:47.206721 IP (tos 0x0, ttl 64, id 20014, offset 0, flags [DF], proto TCP (6), length 52)
    127.0.0.1.53238 > 127.0.0.1.9350: Flags [.], cksum 0xfe28 (incorrect -> 0x6d10), seq 877, ack 47630, win 512, options [nop,nop,TS val 3493966758 ecr 3493966757], length 0
2022-04-07 13:22:47.207483 IP (tos 0x0, ttl 64, id 4985, offset 0, flags [DF], proto TCP (6), length 3446)
    127.0.0.1.9350 > 127.0.0.1.53238: Flags [P.], cksum 0x0b6b (incorrect -> 0x4461), seq 47630:51024, ack 877, win 512, options [nop,nop,TS val 3493966759 ecr 3493966758], length 3394
2022-04-07 13:22:47.248146 IP (tos 0x0, ttl 64, id 4986, offset 0, flags [DF], proto TCP (6), length 32820)
    127.0.0.1.9350 > 127.0.0.1.53238: Flags [.], cksum 0x7e29 (incorrect -> 0xb12b), seq 51024:83792, ack 877, win 512, options [nop,nop,TS val 3493966799 ecr 3493966758], length 32768
2022-04-07 13:22:47.248156 IP (tos 0x0, ttl 64, id 20015, offset 0, flags [DF], proto TCP (6), length 52)
    127.0.0.1.53238 > 127.0.0.1.9350: Flags [.], cksum 0xfe28 (incorrect -> 0xe027), seq 877, ack 83792, win 379, options [nop,nop,TS val 3493966799 ecr 3493966759], length 0
2022-04-07 13:22:47.248164 IP (tos 0x0, ttl 64, id 4987, offset 0, flags [DF], proto TCP (6), length 2690)
    127.0.0.1.9350 > 127.0.0.1.53238: Flags [P.], cksum 0x0877 (incorrect -> 0x06e5), seq 83792:86430, ack 877, win 512, options [nop,nop,TS val 3493966799 ecr 3493966799], length 2638
2022-04-07 13:22:47.249347 IP (tos 0x0, ttl 64, id 20016, offset 0, flags [DF], proto TCP (6), length 52)
    127.0.0.1.53238 > 127.0.0.1.9350: Flags [.], cksum 0xfe28 (incorrect -> 0xd52a), seq 877, ack 86430, win 512, options [nop,nop,TS val 3493966801 ecr 3493966799], length 0
2022-04-07 13:22:47.249353 IP (tos 0x0, ttl 64, id 4988, offset 0, flags [DF], proto TCP (6), length 1796)
    127.0.0.1.9350 > 127.0.0.1.53238: Flags [P.], cksum 0x04f9 (incorrect -> 0x8d5c), seq 86430:88174, ack 877, win 512, options [nop,nop,TS val 3493966801 ecr 3493966801], length 1744
2022-04-07 13:22:47.249358 IP (tos 0x0, ttl 64, id 20017, offset 0, flags [DF], proto TCP (6), length 52)
    127.0.0.1.53238 > 127.0.0.1.9350: Flags [.], cksum 0xfe28 (incorrect -> 0xce58), seq 877, ack 88174, win 512, options [nop,nop,TS val 3493966801 ecr 3493966801], length 0
2022-04-07 13:22:47.267454 IP (tos 0x0, ttl 64, id 4989, offset 0, flags [DF], proto TCP (6), length 3446)
    127.0.0.1.9350 > 127.0.0.1.53238: Flags [P.], cksum 0x0b6b (incorrect -> 0x1e63), seq 88174:91568, ack 877, win 512, options [nop,nop,TS val 3493966819 ecr 3493966801], length 3394
2022-04-07 13:22:47.267471 IP (tos 0x0, ttl 64, id 20018, offset 0, flags [DF], proto TCP (6), length 52)
    127.0.0.1.53238 > 127.0.0.1.9350: Flags [.], cksum 0xfe28 (incorrect -> 0xc0f2), seq 877, ack 91568, win 512, options [nop,nop,TS val 3493966819 ecr 3493966819], length 0
2022-04-07 13:22:47.269251 IP (tos 0x0, ttl 64, id 4990, offset 0, flags [DF], proto TCP (6), length 1952)
    127.0.0.1.9350 > 127.0.0.1.53238: Flags [P.], cksum 0x0595 (incorrect -> 0xb500), seq 91568:93468, ack 877, win 512, options [nop,nop,TS val 3493966821 ecr 3493966819], length 1900
2022-04-07 13:22:47.269265 IP (tos 0x0, ttl 64, id 20019, offset 0, flags [DF], proto TCP (6), length 52)
    127.0.0.1.53238 > 127.0.0.1.9350: Flags [.], cksum 0xfe28 (incorrect -> 0xb982), seq 877, ack 93468, win 512, options [nop,nop,TS val 3493966821 ecr 3493966821], length 0
2022-04-07 13:22:47.313808 IP (tos 0x0, ttl 64, id 4991, offset 0, flags [DF], proto TCP (6), length 3446)
    127.0.0.1.9350 > 127.0.0.1.53238: Flags [P.], cksum 0x0b6b (incorrect -> 0xb3c4), seq 93468:96862, ack 877, win 512, options [nop,nop,TS val 3493966865 ecr 3493966821], length 3394
2022-04-07 13:22:47.314206 IP (tos 0x0, ttl 64, id 20020, offset 0, flags [DF], proto TCP (6), length 52)
    127.0.0.1.53238 > 127.0.0.1.9350: Flags [.], cksum 0xfe28 (incorrect -> 0xabe8), seq 877, ack 96862, win 512, options [nop,nop,TS val 3493966865 ecr 3493966865], length 0
2022-04-07 13:22:47.314475 IP (tos 0x0, ttl 64, id 4992, offset 0, flags [DF], proto TCP (6), length 3898)
    127.0.0.1.9350 > 127.0.0.1.53238: Flags [P.], cksum 0x0d2f (incorrect -> 0xac02), seq 96862:100708, ack 877, win 512, options [nop,nop,TS val 3493966866 ecr 3493966865], length 3846
2022-04-07 13:22:47.314489 IP (tos 0x0, ttl 64, id 20021, offset 0, flags [DF], proto TCP (6), length 52)
    127.0.0.1.53238 > 127.0.0.1.9350: Flags [.], cksum 0xfe28 (incorrect -> 0x9ce0), seq 877, ack 100708, win 512, options [nop,nop,TS val 3493966866 ecr 3493966866], length 0
2022-04-07 13:22:47.337412 IP (tos 0x0, ttl 64, id 4993, offset 0, flags [DF], proto TCP (6), length 1500)
    127.0.0.1.9350 > 127.0.0.1.53238: Flags [P.], cksum 0x03d1 (incorrect -> 0x4f9d), seq 100708:102156, ack 877, win 512, options [nop,nop,TS val 3493966889 ecr 3493966866], length 1448
2022-04-07 13:22:47.337435 IP (tos 0x0, ttl 64, id 20022, offset 0, flags [DF], proto TCP (6), length 52)
    127.0.0.1.53238 > 127.0.0.1.9350: Flags [.], cksum 0xfe28 (incorrect -> 0x970a), seq 877, ack 102156, win 512, options [nop,nop,TS val 3493966889 ecr 3493966889], length 0
2022-04-07 13:22:47.337955 IP (tos 0x0, ttl 64, id 4994, offset 0, flags [DF], proto TCP (6), length 3446)
    127.0.0.1.9350 > 127.0.0.1.53238: Flags [P.], cksum 0x0b6b (incorrect -> 0x78c7), seq 102156:105550, ack 877, win 512, options [nop,nop,TS val 3493966889 ecr 3493966889], length 3394
2022-04-07 13:22:47.338358 IP (tos 0x0, ttl 64, id 20023, offset 0, flags [DF], proto TCP (6), length 52)
    127.0.0.1.53238 > 127.0.0.1.9350: Flags [.], cksum 0xfe28 (incorrect -> 0x89c7), seq 877, ack 105550, win 512, options [nop,nop,TS val 3493966890 ecr 3493966889], length 0
2022-04-07 13:22:47.339943 IP (tos 0x0, ttl 64, id 4995, offset 0, flags [DF], proto TCP (6), length 2948)
    127.0.0.1.9350 > 127.0.0.1.53238: Flags [P.], cksum 0x0979 (incorrect -> 0x7c70), seq 105550:108446, ack 877, win 512, options [nop,nop,TS val 3493966891 ecr 3493966890], length 2896
2022-04-07 13:22:47.339959 IP (tos 0x0, ttl 64, id 20024, offset 0, flags [DF], proto TCP (6), length 52)
    127.0.0.1.53238 > 127.0.0.1.9350: Flags [.], cksum 0xfe28 (incorrect -> 0x7e74), seq 877, ack 108446, win 512, options [nop,nop,TS val 3493966891 ecr 3493966891], length 0
2022-04-07 13:22:47.342192 IP (tos 0x0, ttl 64, id 4996, offset 0, flags [DF], proto TCP (6), length 3898)
    127.0.0.1.9350 > 127.0.0.1.53238: Flags [P.], cksum 0x0d2f (incorrect -> 0x3d11), seq 108446:112292, ack 877, win 512, options [nop,nop,TS val 3493966893 ecr 3493966891], length 3846
2022-04-07 13:22:47.342211 IP (tos 0x0, ttl 64, id 20025, offset 0, flags [DF], proto TCP (6), length 52)
    127.0.0.1.53238 > 127.0.0.1.9350: Flags [.], cksum 0xfe28 (incorrect -> 0x6f6a), seq 877, ack 112292, win 512, options [nop,nop,TS val 3493966893 ecr 3493966893], length 0
2022-04-07 13:22:47.345817 IP (tos 0x0, ttl 64, id 4997, offset 0, flags [DF], proto TCP (6), length 4100)
    127.0.0.1.9350 > 127.0.0.1.53238: Flags [P.], cksum 0x0df9 (incorrect -> 0x2138), seq 112292:116340, ack 877, win 512, options [nop,nop,TS val 3493966897 ecr 3493966893], length 4048
2022-04-07 13:22:47.345841 IP (tos 0x0, ttl 64, id 20026, offset 0, flags [DF], proto TCP (6), length 52)
    127.0.0.1.53238 > 127.0.0.1.9350: Flags [.], cksum 0xfe28 (incorrect -> 0x5f92), seq 877, ack 116340, win 512, options [nop,nop,TS val 3493966897 ecr 3493966897], length 0
2022-04-07 13:22:47.345846 IP (tos 0x0, ttl 64, id 4998, offset 0, flags [DF], proto TCP (6), length 846)
    127.0.0.1.9350 > 127.0.0.1.53238: Flags [P.], cksum 0x0143 (incorrect -> 0x34e3), seq 116340:117134, ack 877, win 512, options [nop,nop,TS val 3493966897 ecr 3493966897], length 794
2022-04-07 13:22:47.345851 IP (tos 0x0, ttl 64, id 20027, offset 0, flags [DF], proto TCP (6), length 52)
    127.0.0.1.53238 > 127.0.0.1.9350: Flags [.], cksum 0xfe28 (incorrect -> 0x5c78), seq 877, ack 117134, win 512, options [nop,nop,TS val 3493966897 ecr 3493966897], length 0
2022-04-07 13:22:47.346214 IP (tos 0x0, ttl 64, id 4999, offset 0, flags [DF], proto TCP (6), length 3944)
    127.0.0.1.9350 > 127.0.0.1.53238: Flags [P.], cksum 0x0d5d (incorrect -> 0x7fe2), seq 117134:121026, ack 877, win 512, options [nop,nop,TS val 3493966897 ecr 3493966897], length 3892
2022-04-07 13:22:47.346230 IP (tos 0x0, ttl 64, id 20028, offset 0, flags [DF], proto TCP (6), length 52)
    127.0.0.1.53238 > 127.0.0.1.9350: Flags [.], cksum 0xfe28 (incorrect -> 0x4d43), seq 877, ack 121026, win 512, options [nop,nop,TS val 3493966898 ecr 3493966897], length 0
2022-04-07 13:22:47.347325 IP (tos 0x0, ttl 64, id 5000, offset 0, flags [DF], proto TCP (6), length 3944)
    127.0.0.1.9350 > 127.0.0.1.53238: Flags [P.], cksum 0x0d5d (incorrect -> 0x53e2), seq 121026:124918, ack 877, win 512, options [nop,nop,TS val 3493966899 ecr 3493966898], length 3892
2022-04-07 13:22:47.394797 IP (tos 0x0, ttl 64, id 20029, offset 0, flags [DF], proto TCP (6), length 52)
    127.0.0.1.53238 > 127.0.0.1.9350: Flags [.], cksum 0xfe28 (incorrect -> 0x3ddd), seq 877, ack 124918, win 512, options [nop,nop,TS val 3493966946 ecr 3493966899], length 0
2022-04-07 13:22:47.394821 IP (tos 0x0, ttl 64, id 5001, offset 0, flags [DF], proto TCP (6), length 24124)
    127.0.0.1.9350 > 127.0.0.1.53238: Flags [P.], cksum 0x5c31 (incorrect -> 0xd839), seq 124918:148990, ack 877, win 512, options [nop,nop,TS val 3493966946 ecr 3493966946], length 24072
2022-04-07 13:22:47.438823 IP (tos 0x0, ttl 64, id 20030, offset 0, flags [DF], proto TCP (6), length 52)
    127.0.0.1.53238 > 127.0.0.1.9350: Flags [.], cksum 0xfe28 (incorrect -> 0xdf79), seq 877, ack 148990, win 512, options [nop,nop,TS val 3493966990 ecr 3493966946], length 0
2022-04-07 13:22:47.438855 IP (tos 0x0, ttl 64, id 5002, offset 0, flags [DF], proto TCP (6), length 28514)
    127.0.0.1.9350 > 127.0.0.1.53238: Flags [P.], cksum 0x6d57 (incorrect -> 0x5c9b), seq 148990:177452, ack 877, win 512, options [nop,nop,TS val 3493966990 ecr 3493966990], length 28462
2022-04-07 13:22:47.482800 IP (tos 0x0, ttl 64, id 20031, offset 0, flags [DF], proto TCP (6), length 52)
    127.0.0.1.53238 > 127.0.0.1.9350: Flags [.], cksum 0xfe28 (incorrect -> 0x6ff3), seq 877, ack 177452, win 512, options [nop,nop,TS val 3493967034 ecr 3493966990], length 0
2022-04-07 13:22:47.482823 IP (tos 0x0, ttl 64, id 5003, offset 0, flags [DF], proto TCP (6), length 14080)
    127.0.0.1.9350 > 127.0.0.1.53238: Flags [P.], cksum 0x34f5 (incorrect -> 0xb636), seq 177452:191480, ack 877, win 512, options [nop,nop,TS val 3493967034 ecr 3493967034], length 14028
2022-04-07 13:22:47.483717 IP (tos 0x0, ttl 64, id 20032, offset 0, flags [DF], proto TCP (6), length 52)
    127.0.0.1.53238 > 127.0.0.1.9350: Flags [.], cksum 0xfe28 (incorrect -> 0x38fa), seq 877, ack 191480, win 512, options [nop,nop,TS val 3493967035 ecr 3493967034], length 0
2022-04-07 13:22:47.490658 IP (tos 0x0, ttl 64, id 5004, offset 0, flags [DF], proto TCP (6), length 4100)
    127.0.0.1.9350 > 127.0.0.1.53238: Flags [P.], cksum 0x0df9 (incorrect -> 0xe693), seq 191480:195528, ack 877, win 512, options [nop,nop,TS val 3493967042 ecr 3493967035], length 4048
2022-04-07 13:22:47.490694 IP (tos 0x0, ttl 64, id 20033, offset 0, flags [DF], proto TCP (6), length 52)
    127.0.0.1.53238 > 127.0.0.1.9350: Flags [.], cksum 0xfe28 (incorrect -> 0x291b), seq 877, ack 195528, win 512, options [nop,nop,TS val 3493967042 ecr 3493967042], length 0
2022-04-07 13:22:47.490715 IP (tos 0x0, ttl 64, id 5005, offset 0, flags [DF], proto TCP (6), length 3244)
    127.0.0.1.9350 > 127.0.0.1.53238: Flags [P.], cksum 0x0aa1 (incorrect -> 0x3904), seq 195528:198720, ack 877, win 512, options [nop,nop,TS val 3493967042 ecr 3493967042], length 3192
2022-04-07 13:22:47.490784 IP (tos 0x0, ttl 64, id 20034, offset 0, flags [DF], proto TCP (6), length 52)
    127.0.0.1.53238 > 127.0.0.1.9350: Flags [.], cksum 0xfe28 (incorrect -> 0x1ca3), seq 877, ack 198720, win 512, options [nop,nop,TS val 3493967042 ecr 3493967042], length 0
2022-04-07 13:22:47.498949 IP (tos 0x0, ttl 64, id 5006, offset 0, flags [DF], proto TCP (6), length 4100)
    127.0.0.1.9350 > 127.0.0.1.53238: Flags [P.], cksum 0x0df9 (incorrect -> 0xa663), seq 198720:202768, ack 877, win 512, options [nop,nop,TS val 3493967050 ecr 3493967042], length 4048
2022-04-07 13:22:47.498970 IP (tos 0x0, ttl 64, id 20035, offset 0, flags [DF], proto TCP (6), length 52)
    127.0.0.1.53238 > 127.0.0.1.9350: Flags [.], cksum 0xfe28 (incorrect -> 0x0cc3), seq 877, ack 202768, win 512, options [nop,nop,TS val 3493967050 ecr 3493967050], length 0
2022-04-07 13:22:47.498984 IP (tos 0x0, ttl 64, id 5007, offset 0, flags [DF], proto TCP (6), length 1796)
    127.0.0.1.9350 > 127.0.0.1.53238: Flags [P.], cksum 0x04f9 (incorrect -> 0xbddf), seq 202768:204512, ack 877, win 512, options [nop,nop,TS val 3493967050 ecr 3493967050], length 1744
2022-04-07 13:22:47.498991 IP (tos 0x0, ttl 64, id 20036, offset 0, flags [DF], proto TCP (6), length 52)
    127.0.0.1.53238 > 127.0.0.1.9350: Flags [.], cksum 0xfe28 (incorrect -> 0x05f3), seq 877, ack 204512, win 512, options [nop,nop,TS val 3493967050 ecr 3493967050], length 0
2022-04-07 13:22:47.503802 IP (tos 0x0, ttl 64, id 5008, offset 0, flags [DF], proto TCP (6), length 4100)
    127.0.0.1.9350 > 127.0.0.1.53238: Flags [P.], cksum 0x0df9 (incorrect -> 0xe59a), seq 204512:208560, ack 877, win 512, options [nop,nop,TS val 3493967055 ecr 3493967050], length 4048
2022-04-07 13:22:47.503816 IP (tos 0x0, ttl 64, id 20037, offset 0, flags [DF], proto TCP (6), length 52)
    127.0.0.1.53238 > 127.0.0.1.9350: Flags [.], cksum 0xfe28 (incorrect -> 0xf618), seq 877, ack 208560, win 512, options [nop,nop,TS val 3493967055 ecr 3493967055], length 0
2022-04-07 13:22:47.503827 IP (tos 0x0, ttl 64, id 5009, offset 0, flags [DF], proto TCP (6), length 348)
    127.0.0.1.9350 > 127.0.0.1.53238: Flags [P.], cksum 0xff50 (incorrect -> 0x3da6), seq 208560:208856, ack 877, win 512, options [nop,nop,TS val 3493967055 ecr 3493967055], length 296
2022-04-07 13:22:47.503834 IP (tos 0x0, ttl 64, id 20038, offset 0, flags [DF], proto TCP (6), length 52)
    127.0.0.1.53238 > 127.0.0.1.9350: Flags [.], cksum 0xfe28 (incorrect -> 0xf4f0), seq 877, ack 208856, win 512, options [nop,nop,TS val 3493967055 ecr 3493967055], length 0
2022-04-07 13:22:47.506450 IP (tos 0x0, ttl 64, id 5010, offset 0, flags [DF], proto TCP (6), length 3898)
    127.0.0.1.9350 > 127.0.0.1.53238: Flags [P.], cksum 0x0d2f (incorrect -> 0xbd22), seq 208856:212702, ack 877, win 512, options [nop,nop,TS val 3493967058 ecr 3493967055], length 3846
2022-04-07 13:22:47.506461 IP (tos 0x0, ttl 64, id 20039, offset 0, flags [DF], proto TCP (6), length 52)
    127.0.0.1.53238 > 127.0.0.1.9350: Flags [.], cksum 0xfe28 (incorrect -> 0xe5e4), seq 877, ack 212702, win 512, options [nop,nop,TS val 3493967058 ecr 3493967058], length 0
2022-04-07 13:22:47.508318 IP (tos 0x0, ttl 64, id 5011, offset 0, flags [DF], proto TCP (6), length 3801)
    127.0.0.1.9350 > 127.0.0.1.53238: Flags [P.], cksum 0x0cce (incorrect -> 0xbb09), seq 212702:216451, ack 877, win 512, options [nop,nop,TS val 3493967060 ecr 3493967058], length 3749
2022-04-07 13:22:47.509111 IP (tos 0x0, ttl 64, id 20040, offset 0, flags [DF], proto TCP (6), length 52)
    127.0.0.1.53238 > 127.0.0.1.9350: Flags [.], cksum 0xfe28 (incorrect -> 0xd73b), seq 877, ack 216451, win 512, options [nop,nop,TS val 3493967060 ecr 3493967060], length 0
2022-04-07 13:22:47.509201 IP (tos 0x0, ttl 64, id 5012, offset 0, flags [DF], proto TCP (6), length 3446)
    127.0.0.1.9350 > 127.0.0.1.53238: Flags [P.], cksum 0x0b6b (incorrect -> 0xa29d), seq 216451:219845, ack 877, win 512, options [nop,nop,TS val 3493967060 ecr 3493967060], length 3394
2022-04-07 13:22:47.509212 IP (tos 0x0, ttl 64, id 20041, offset 0, flags [DF], proto TCP (6), length 52)
    127.0.0.1.53238 > 127.0.0.1.9350: Flags [.], cksum 0xfe28 (incorrect -> 0xc9f9), seq 877, ack 219845, win 512, options [nop,nop,TS val 3493967060 ecr 3493967060], length 0
2022-04-07 13:22:47.521052 IP (tos 0x0, ttl 64, id 5013, offset 0, flags [DF], proto TCP (6), length 2450)
    127.0.0.1.9350 > 127.0.0.1.53238: Flags [P.], cksum 0x0787 (incorrect -> 0x6755), seq 219845:222243, ack 877, win 512, options [nop,nop,TS val 3493967072 ecr 3493967060], length 2398
2022-04-07 13:22:47.521064 IP (tos 0x0, ttl 64, id 20042, offset 0, flags [DF], proto TCP (6), length 52)
    127.0.0.1.53238 > 127.0.0.1.9350: Flags [.], cksum 0xfe28 (incorrect -> 0xc083), seq 877, ack 222243, win 512, options [nop,nop,TS val 3493967072 ecr 3493967072], length 0
2022-04-07 13:22:47.521419 IP (tos 0x0, ttl 64, id 5014, offset 0, flags [DF], proto TCP (6), length 3446)
    127.0.0.1.9350 > 127.0.0.1.53238: Flags [P.], cksum 0x0b6b (incorrect -> 0xf082), seq 222243:225637, ack 877, win 512, options [nop,nop,TS val 3493967073 ecr 3493967072], length 3394
2022-04-07 13:22:47.521437 IP (tos 0x0, ttl 64, id 20043, offset 0, flags [DF], proto TCP (6), length 52)
    127.0.0.1.53238 > 127.0.0.1.9350: Flags [.], cksum 0xfe28 (incorrect -> 0xb33f), seq 877, ack 225637, win 512, options [nop,nop,TS val 3493967073 ecr 3493967073], length 0
2022-04-07 13:22:47.522195 IP (tos 0x0, ttl 64, id 5015, offset 0, flags [DF], proto TCP (6), length 3944)
    127.0.0.1.9350 > 127.0.0.1.53238: Flags [P.], cksum 0x0d5d (incorrect -> 0x461b), seq 225637:229529, ack 877, win 512, options [nop,nop,TS val 3493967073 ecr 3493967073], length 3892
2022-04-07 13:22:47.522212 IP (tos 0x0, ttl 64, id 20044, offset 0, flags [DF], proto TCP (6), length 52)
    127.0.0.1.53238 > 127.0.0.1.9350: Flags [.], cksum 0xfe28 (incorrect -> 0xa40b), seq 877, ack 229529, win 512, options [nop,nop,TS val 3493967073 ecr 3493967073], length 0
2022-04-07 13:22:47.529473 IP (tos 0x0, ttl 64, id 5016, offset 0, flags [DF], proto TCP (6), length 1952)
    127.0.0.1.9350 > 127.0.0.1.53238: Flags [P.], cksum 0x0595 (incorrect -> 0xbd12), seq 229529:231429, ack 877, win 512, options [nop,nop,TS val 3493967081 ecr 3493967073], length 1900
2022-04-07 13:22:47.530240 IP (tos 0x0, ttl 64, id 20045, offset 0, flags [DF], proto TCP (6), length 52)
    127.0.0.1.53238 > 127.0.0.1.9350: Flags [.], cksum 0xfe28 (incorrect -> 0x9c8e), seq 877, ack 231429, win 512, options [nop,nop,TS val 3493967082 ecr 3493967081], length 0
2022-04-07 13:22:47.535228 IP (tos 0x0, ttl 64, id 5017, offset 0, flags [DF], proto TCP (6), length 3446)
    127.0.0.1.9350 > 127.0.0.1.53238: Flags [P.], cksum 0x0b6b (incorrect -> 0xb1e4), seq 231429:234823, ack 877, win 512, options [nop,nop,TS val 3493967087 ecr 3493967082], length 3394
2022-04-07 13:22:47.535241 IP (tos 0x0, ttl 64, id 20046, offset 0, flags [DF], proto TCP (6), length 52)
    127.0.0.1.53238 > 127.0.0.1.9350: Flags [.], cksum 0xfe28 (incorrect -> 0x8f41), seq 877, ack 234823, win 512, options [nop,nop,TS val 3493967087 ecr 3493967087], length 0
2022-04-07 13:22:47.536009 IP (tos 0x0, ttl 64, id 5018, offset 0, flags [DF], proto TCP (6), length 3944)
    127.0.0.1.9350 > 127.0.0.1.53238: Flags [P.], cksum 0x0d5d (incorrect -> 0x77bc), seq 234823:238715, ack 877, win 512, options [nop,nop,TS val 3493967087 ecr 3493967087], length 3892
2022-04-07 13:22:47.536020 IP (tos 0x0, ttl 64, id 20047, offset 0, flags [DF], proto TCP (6), length 52)
    127.0.0.1.53238 > 127.0.0.1.9350: Flags [.], cksum 0xfe28 (incorrect -> 0x800d), seq 877, ack 238715, win 512, options [nop,nop,TS val 3493967087 ecr 3493967087], length 0
2022-04-07 13:22:47.537467 IP (tos 0x0, ttl 64, id 5019, offset 0, flags [DF], proto TCP (6), length 3852)
    127.0.0.1.9350 > 127.0.0.1.53238: Flags [P.], cksum 0x0d01 (incorrect -> 0x1d74), seq 238715:242515, ack 877, win 512, options [nop,nop,TS val 3493967089 ecr 3493967087], length 3800
2022-04-07 13:22:47.537492 IP (tos 0x0, ttl 64, id 20048, offset 0, flags [DF], proto TCP (6), length 52)
    127.0.0.1.53238 > 127.0.0.1.9350: Flags [.], cksum 0xfe28 (incorrect -> 0x7131), seq 877, ack 242515, win 512, options [nop,nop,TS val 3493967089 ecr 3493967089], length 0
2022-04-07 13:22:47.543446 IP (tos 0x0, ttl 64, id 5020, offset 0, flags [DF], proto TCP (6), length 4100)
    127.0.0.1.9350 > 127.0.0.1.53238: Flags [P.], cksum 0x0df9 (incorrect -> 0xae09), seq 242515:246563, ack 877, win 512, options [nop,nop,TS val 3493967095 ecr 3493967089], length 4048
2022-04-07 13:22:47.543459 IP (tos 0x0, ttl 64, id 20049, offset 0, flags [DF], proto TCP (6), length 52)
    127.0.0.1.53238 > 127.0.0.1.9350: Flags [.], cksum 0xfe28 (incorrect -> 0x6155), seq 877, ack 246563, win 512, options [nop,nop,TS val 3493967095 ecr 3493967095], length 0
2022-04-07 13:22:47.543470 IP (tos 0x0, ttl 64, id 5021, offset 0, flags [DF], proto TCP (6), length 348)
    127.0.0.1.9350 > 127.0.0.1.53238: Flags [P.], cksum 0xff50 (incorrect -> 0xf319), seq 246563:246859, ack 877, win 512, options [nop,nop,TS val 3493967095 ecr 3493967095], length 296
2022-04-07 13:22:47.543477 IP (tos 0x0, ttl 64, id 20050, offset 0, flags [DF], proto TCP (6), length 52)
    127.0.0.1.53238 > 127.0.0.1.9350: Flags [.], cksum 0xfe28 (incorrect -> 0x602d), seq 877, ack 246859, win 512, options [nop,nop,TS val 3493967095 ecr 3493967095], length 0
2022-04-07 13:22:47.550773 IP (tos 0x0, ttl 64, id 5022, offset 0, flags [DF], proto TCP (6), length 1002)
    127.0.0.1.9350 > 127.0.0.1.53238: Flags [P.], cksum 0x01df (incorrect -> 0x8763), seq 246859:247809, ack 877, win 512, options [nop,nop,TS val 3493967102 ecr 3493967095], length 950
2022-04-07 13:22:47.550787 IP (tos 0x0, ttl 64, id 20051, offset 0, flags [DF], proto TCP (6), length 52)
    127.0.0.1.53238 > 127.0.0.1.9350: Flags [.], cksum 0xfe28 (incorrect -> 0x5c69), seq 877, ack 247809, win 512, options [nop,nop,TS val 3493967102 ecr 3493967102], length 0
200, 4.994241714477539, 2.2556824684143066