2022-04-07 16:02:21.966973 IP (tos 0x0, ttl 64, id 38711, offset 0, flags [DF], proto TCP (6), length 60)
    127.0.0.1.53440 > 127.0.0.1.9350: Flags [S], cksum 0xfe30 (incorrect -> 0xe8c9), seq 3107003101, win 65495, options [mss 65495,sackOK,TS val 3503541518 ecr 0,nop,wscale 7], length 0
2022-04-07 16:02:21.966989 IP (tos 0x0, ttl 64, id 0, offset 0, flags [DF], proto TCP (6), length 60)
    127.0.0.1.9350 > 127.0.0.1.53440: Flags [S.], cksum 0xfe30 (incorrect -> 0x117e), seq 3035333752, ack 3107003102, win 65483, options [mss 65495,sackOK,TS val 3503541518 ecr 3503541518,nop,wscale 7], length 0
2022-04-07 16:02:21.967000 IP (tos 0x0, ttl 64, id 38712, offset 0, flags [DF], proto TCP (6), length 52)
    127.0.0.1.53440 > 127.0.0.1.9350: Flags [.], cksum 0xfe28 (incorrect -> 0x383a), seq 1, ack 1, win 512, options [nop,nop,TS val 3503541518 ecr 3503541518], length 0
2022-04-07 16:02:21.967149 IP (tos 0x0, ttl 64, id 38713, offset 0, flags [DF], proto TCP (6), length 55)
    127.0.0.1.53440 > 127.0.0.1.9350: Flags [P.], cksum 0xfe2b (incorrect -> 0x332e), seq 1:4, ack 1, win 512, options [nop,nop,TS val 3503541518 ecr 3503541518], length 3
2022-04-07 16:02:21.967157 IP (tos 0x0, ttl 64, id 34991, offset 0, flags [DF], proto TCP (6), length 52)
    127.0.0.1.9350 > 127.0.0.1.53440: Flags [.], cksum 0xfe28 (incorrect -> 0x3837), seq 1, ack 4, win 512, options [nop,nop,TS val 3503541518 ecr 3503541518], length 0
2022-04-07 16:02:21.967179 IP (tos 0x0, ttl 64, id 34992, offset 0, flags [DF], proto TCP (6), length 54)
    127.0.0.1.9350 > 127.0.0.1.53440: Flags [P.], cksum 0xfe2a (incorrect -> 0x332d), seq 1:3, ack 4, win 512, options [nop,nop,TS val 3503541518 ecr 3503541518], length 2
2022-04-07 16:02:21.967188 IP (tos 0x0, ttl 64, id 38714, offset 0, flags [DF], proto TCP (6), length 52)
    127.0.0.1.53440 > 127.0.0.1.9350: Flags [.], cksum 0xfe28 (incorrect -> 0x3835), seq 4, ack 3, win 512, options [nop,nop,TS val 3503541518 ecr 3503541518], length 0
2022-04-07 16:02:21.968720 IP (tos 0x0, ttl 64, id 38715, offset 0, flags [DF], proto TCP (6), length 62)
    127.0.0.1.53440 > 127.0.0.1.9350: Flags [P.], cksum 0xfe32 (incorrect -> 0xa6c4), seq 4:14, ack 3, win 512, options [nop,nop,TS val 3503541520 ecr 3503541518], length 10
2022-04-07 16:02:21.968738 IP (tos 0x0, ttl 64, id 34993, offset 0, flags [DF], proto TCP (6), length 52)
    127.0.0.1.9350 > 127.0.0.1.53440: Flags [.], cksum 0xfe28 (incorrect -> 0x3827), seq 3, ack 14, win 512, options [nop,nop,TS val 3503541520 ecr 3503541520], length 0
2022-04-07 16:02:22.062717 IP (tos 0x0, ttl 64, id 34994, offset 0, flags [DF], proto TCP (6), length 62)
    127.0.0.1.9350 > 127.0.0.1.53440: Flags [P.], cksum 0xfe32 (incorrect -> 0x32b6), seq 3:13, ack 14, win 512, options [nop,nop,TS val 3503541614 ecr 3503541520], length 10
2022-04-07 16:02:22.062728 IP (tos 0x0, ttl 64, id 38716, offset 0, flags [DF], proto TCP (6), length 52)
    127.0.0.1.53440 > 127.0.0.1.9350: Flags [.], cksum 0xfe28 (incorrect -> 0x3761), seq 14, ack 13, win 512, options [nop,nop,TS val 3503541614 ecr 3503541614], length 0
2022-04-07 16:02:22.068089 IP (tos 0x0, ttl 64, id 38717, offset 0, flags [DF], proto TCP (6), length 569)
    127.0.0.1.53440 > 127.0.0.1.9350: Flags [P.], cksum 0x002e (incorrect -> 0xe349), seq 14:531, ack 13, win 512, options [nop,nop,TS val 3503541619 ecr 3503541614], length 517
2022-04-07 16:02:22.068098 IP (tos 0x0, ttl 64, id 34995, offset 0, flags [DF], proto TCP (6), length 52)
    127.0.0.1.9350 > 127.0.0.1.53440: Flags [.], cksum 0xfe28 (incorrect -> 0x3556), seq 13, ack 531, win 508, options [nop,nop,TS val 3503541619 ecr 3503541619], length 0
200, 3.8733270168304443, 0.9332385063171387