2022-04-07 21:54:57.794774 IP (tos 0x0, ttl 64, id 53704, offset 0, flags [DF], proto TCP (6), length 60)
    127.0.0.1.55854 > 127.0.0.1.11950: Flags [S], cksum 0xfe30 (incorrect -> 0x4b9f), seq 2065830218, win 65495, options [mss 65495,sackOK,TS val 3524697346 ecr 0,nop,wscale 7], length 0
2022-04-07 21:54:57.794790 IP (tos 0x0, ttl 64, id 0, offset 0, flags [DF], proto TCP (6), length 60)
    127.0.0.1.11950 > 127.0.0.1.55854: Flags [S.], cksum 0xfe30 (incorrect -> 0x9638), seq 3518592142, ack 2065830219, win 65483, options [mss 65495,sackOK,TS val 3524697346 ecr 3524697346,nop,wscale 7], length 0
2022-04-07 21:54:57.794809 IP (tos 0x0, ttl 64, id 53705, offset 0, flags [DF], proto TCP (6), length 52)
    127.0.0.1.55854 > 127.0.0.1.11950: Flags [.], cksum 0xfe28 (incorrect -> 0xbcf4), seq 1, ack 1, win 512, options [nop,nop,TS val 3524697346 ecr 3524697346], length 0
2022-04-07 21:54:57.794933 IP (tos 0x0, ttl 64, id 53706, offset 0, flags [DF], proto TCP (6), length 55)
    127.0.0.1.55854 > 127.0.0.1.11950: Flags [P.], cksum 0xfe2b (incorrect -> 0xb7e8), seq 1:4, ack 1, win 512, options [nop,nop,TS val 3524697346 ecr 3524697346], length 3
2022-04-07 21:54:57.794948 IP (tos 0x0, ttl 64, id 3483, offset 0, flags [DF], proto TCP (6), length 52)
    127.0.0.1.11950 > 127.0.0.1.55854: Flags [.], cksum 0xfe28 (incorrect -> 0xbcf1), seq 1, ack 4, win 512, options [nop,nop,TS val 3524697346 ecr 3524697346], length 0
2022-04-07 21:54:57.795006 IP (tos 0x0, ttl 64, id 3484, offset 0, flags [DF], proto TCP (6), length 54)
    127.0.0.1.11950 > 127.0.0.1.55854: Flags [P.], cksum 0xfe2a (incorrect -> 0xb7e7), seq 1:3, ack 4, win 512, options [nop,nop,TS val 3524697346 ecr 3524697346], length 2
2022-04-07 21:54:57.795023 IP (tos 0x0, ttl 64, id 53707, offset 0, flags [DF], proto TCP (6), length 52)
    127.0.0.1.55854 > 127.0.0.1.11950: Flags [.], cksum 0xfe28 (incorrect -> 0xbcef), seq 4, ack 3, win 512, options [nop,nop,TS val 3524697346 ecr 3524697346], length 0
2022-04-07 21:54:57.796862 IP (tos 0x0, ttl 64, id 53708, offset 0, flags [DF], proto TCP (6), length 62)
    127.0.0.1.55854 > 127.0.0.1.11950: Flags [P.], cksum 0xfe32 (incorrect -> 0xe5cf), seq 4:14, ack 3, win 512, options [nop,nop,TS val 3524697348 ecr 3524697346], length 10
2022-04-07 21:54:57.796878 IP (tos 0x0, ttl 64, id 3485, offset 0, flags [DF], proto TCP (6), length 52)
    127.0.0.1.11950 > 127.0.0.1.55854: Flags [.], cksum 0xfe28 (incorrect -> 0xbce1), seq 3, ack 14, win 512, options [nop,nop,TS val 3524697348 ecr 3524697348], length 0
2022-04-07 21:54:57.950422 IP (tos 0x0, ttl 64, id 3486, offset 0, flags [DF], proto TCP (6), length 62)
    127.0.0.1.11950 > 127.0.0.1.55854: Flags [P.], cksum 0xfe32 (incorrect -> 0xb734), seq 3:13, ack 14, win 512, options [nop,nop,TS val 3524697502 ecr 3524697348], length 10
2022-04-07 21:54:57.950441 IP (tos 0x0, ttl 64, id 53709, offset 0, flags [DF], proto TCP (6), length 52)
    127.0.0.1.55854 > 127.0.0.1.11950: Flags [.], cksum 0xfe28 (incorrect -> 0xbba3), seq 14, ack 13, win 512, options [nop,nop,TS val 3524697502 ecr 3524697502], length 0
200, 3.7557833194732666, 1.0543928146362305