2022-04-07 02:33:47.785555 IP (tos 0x0, ttl 64, id 56983, offset 0, flags [DF], proto TCP (6), length 60)
    127.0.0.1.48650 > 127.0.0.1.9250: Flags [S], cksum 0xfe30 (incorrect -> 0xc93b), seq 3475863204, win 65495, options [mss 65495,sackOK,TS val 381110288 ecr 0,nop,wscale 7], length 0
2022-04-07 02:33:47.785564 IP (tos 0x0, ttl 64, id 0, offset 0, flags [DF], proto TCP (6), length 60)
    127.0.0.1.9250 > 127.0.0.1.48650: Flags [S.], cksum 0xfe30 (incorrect -> 0xea5d), seq 4048522945, ack 3475863205, win 65483, options [mss 65495,sackOK,TS val 381110288 ecr 381110288,nop,wscale 7], length 0
2022-04-07 02:33:47.785571 IP (tos 0x0, ttl 64, id 56984, offset 0, flags [DF], proto TCP (6), length 52)
    127.0.0.1.48650 > 127.0.0.1.9250: Flags [.], cksum 0xfe28 (incorrect -> 0x111a), seq 1, ack 1, win 512, options [nop,nop,TS val 381110288 ecr 381110288], length 0
2022-04-07 02:33:47.785651 IP (tos 0x0, ttl 64, id 56985, offset 0, flags [DF], proto TCP (6), length 55)
    127.0.0.1.48650 > 127.0.0.1.9250: Flags [P.], cksum 0xfe2b (incorrect -> 0x0c0e), seq 1:4, ack 1, win 512, options [nop,nop,TS val 381110288 ecr 381110288], length 3
2022-04-07 02:33:47.785654 IP (tos 0x0, ttl 64, id 61650, offset 0, flags [DF], proto TCP (6), length 52)
    127.0.0.1.9250 > 127.0.0.1.48650: Flags [.], cksum 0xfe28 (incorrect -> 0x1117), seq 1, ack 4, win 512, options [nop,nop,TS val 381110288 ecr 381110288], length 0
2022-04-07 02:33:47.785721 IP (tos 0x0, ttl 64, id 61651, offset 0, flags [DF], proto TCP (6), length 54)
    127.0.0.1.9250 > 127.0.0.1.48650: Flags [P.], cksum 0xfe2a (incorrect -> 0x0c0d), seq 1:3, ack 4, win 512, options [nop,nop,TS val 381110288 ecr 381110288], length 2
2022-04-07 02:33:47.785725 IP (tos 0x0, ttl 64, id 56986, offset 0, flags [DF], proto TCP (6), length 52)
    127.0.0.1.48650 > 127.0.0.1.9250: Flags [.], cksum 0xfe28 (incorrect -> 0x1115), seq 4, ack 3, win 512, options [nop,nop,TS val 381110288 ecr 381110288], length 0
2022-04-07 02:33:47.786824 IP (tos 0x0, ttl 64, id 56987, offset 0, flags [DF], proto TCP (6), length 62)
    127.0.0.1.48650 > 127.0.0.1.9250: Flags [P.], cksum 0xfe32 (incorrect -> 0x4140), seq 4:14, ack 3, win 512, options [nop,nop,TS val 381110289 ecr 381110288], length 10
2022-04-07 02:33:47.786831 IP (tos 0x0, ttl 64, id 61652, offset 0, flags [DF], proto TCP (6), length 52)
    127.0.0.1.9250 > 127.0.0.1.48650: Flags [.], cksum 0xfe28 (incorrect -> 0x1109), seq 3, ack 14, win 512, options [nop,nop,TS val 381110289 ecr 381110289], length 0
2022-04-07 02:33:47.911075 IP (tos 0x0, ttl 64, id 61653, offset 0, flags [DF], proto TCP (6), length 62)
    127.0.0.1.9250 > 127.0.0.1.48650: Flags [P.], cksum 0xfe32 (incorrect -> 0x0b79), seq 3:13, ack 14, win 512, options [nop,nop,TS val 381110414 ecr 381110289], length 10
2022-04-07 02:33:47.911083 IP (tos 0x0, ttl 64, id 56988, offset 0, flags [DF], proto TCP (6), length 52)
    127.0.0.1.48650 > 127.0.0.1.9250: Flags [.], cksum 0xfe28 (incorrect -> 0x1005), seq 14, ack 13, win 512, options [nop,nop,TS val 381110414 ecr 381110414], length 0
2022-04-07 02:33:47.916712 IP (tos 0x0, ttl 64, id 56989, offset 0, flags [DF], proto TCP (6), length 569)
    127.0.0.1.48650 > 127.0.0.1.9250: Flags [P.], cksum 0x002e (incorrect -> 0xc871), seq 14:531, ack 13, win 512, options [nop,nop,TS val 381110419 ecr 381110414], length 517
2022-04-07 02:33:47.916721 IP (tos 0x0, ttl 64, id 61654, offset 0, flags [DF], proto TCP (6), length 52)
    127.0.0.1.9250 > 127.0.0.1.48650: Flags [.], cksum 0xfe28 (incorrect -> 0x0dfa), seq 13, ack 531, win 508, options [nop,nop,TS val 381110419 ecr 381110419], length 0
200, 5.507502317428589, 1.0394606590270996