2022-04-07 00:47:00.340654 IP (tos 0x0, ttl 64, id 7575, offset 0, flags [DF], proto TCP (6), length 60)
    127.0.0.1.51094 > 127.0.0.1.10150: Flags [S], cksum 0xfe30 (incorrect -> 0xb1c9), seq 928308822, win 65495, options [mss 65495,sackOK,TS val 374702843 ecr 0,nop,wscale 7], length 0
2022-04-07 00:47:00.340676 IP (tos 0x0, ttl 64, id 0, offset 0, flags [DF], proto TCP (6), length 60)
    127.0.0.1.10150 > 127.0.0.1.51094: Flags [S.], cksum 0xfe30 (incorrect -> 0xd316), seq 766056372, ack 928308823, win 65483, options [mss 65495,sackOK,TS val 374702843 ecr 374702843,nop,wscale 7], length 0
2022-04-07 00:47:00.340694 IP (tos 0x0, ttl 64, id 7576, offset 0, flags [DF], proto TCP (6), length 52)
    127.0.0.1.51094 > 127.0.0.1.10150: Flags [.], cksum 0xfe28 (incorrect -> 0xf9d2), seq 1, ack 1, win 512, options [nop,nop,TS val 374702843 ecr 374702843], length 0
2022-04-07 00:47:00.340869 IP (tos 0x0, ttl 64, id 7577, offset 0, flags [DF], proto TCP (6), length 55)
    127.0.0.1.51094 > 127.0.0.1.10150: Flags [P.], cksum 0xfe2b (incorrect -> 0xf4c6), seq 1:4, ack 1, win 512, options [nop,nop,TS val 374702843 ecr 374702843], length 3
2022-04-07 00:47:00.341066 IP (tos 0x0, ttl 64, id 6158, offset 0, flags [DF], proto TCP (6), length 52)
    127.0.0.1.10150 > 127.0.0.1.51094: Flags [.], cksum 0xfe28 (incorrect -> 0xf9cf), seq 1, ack 4, win 512, options [nop,nop,TS val 374702843 ecr 374702843], length 0
2022-04-07 00:47:00.341099 IP (tos 0x0, ttl 64, id 6159, offset 0, flags [DF], proto TCP (6), length 54)
    127.0.0.1.10150 > 127.0.0.1.51094: Flags [P.], cksum 0xfe2a (incorrect -> 0xf4c4), seq 1:3, ack 4, win 512, options [nop,nop,TS val 374702844 ecr 374702843], length 2
2022-04-07 00:47:00.341107 IP (tos 0x0, ttl 64, id 7578, offset 0, flags [DF], proto TCP (6), length 52)
    127.0.0.1.51094 > 127.0.0.1.10150: Flags [.], cksum 0xfe28 (incorrect -> 0xf9cb), seq 4, ack 3, win 512, options [nop,nop,TS val 374702844 ecr 374702844], length 0
2022-04-07 00:47:00.930186 IP (tos 0x0, ttl 64, id 7579, offset 0, flags [DF], proto TCP (6), length 62)
    127.0.0.1.51094 > 127.0.0.1.10150: Flags [P.], cksum 0xfe32 (incorrect -> 0x8d32), seq 4:14, ack 3, win 512, options [nop,nop,TS val 374703433 ecr 374702844], length 10
2022-04-07 00:47:00.930209 IP (tos 0x0, ttl 64, id 6160, offset 0, flags [DF], proto TCP (6), length 52)
    127.0.0.1.10150 > 127.0.0.1.51094: Flags [.], cksum 0xfe28 (incorrect -> 0xf527), seq 3, ack 14, win 512, options [nop,nop,TS val 374703433 ecr 374703433], length 0
2022-04-07 00:47:01.881259 IP (tos 0x0, ttl 64, id 6161, offset 0, flags [DF], proto TCP (6), length 62)
    127.0.0.1.10150 > 127.0.0.1.51094: Flags [P.], cksum 0xfe32 (incorrect -> 0xec5d), seq 3:13, ack 14, win 512, options [nop,nop,TS val 374704384 ecr 374703433], length 10
2022-04-07 00:47:01.881277 IP (tos 0x0, ttl 64, id 7580, offset 0, flags [DF], proto TCP (6), length 52)
    127.0.0.1.51094 > 127.0.0.1.10150: Flags [.], cksum 0xfe28 (incorrect -> 0xedaf), seq 14, ack 13, win 512, options [nop,nop,TS val 374704384 ecr 374704384], length 0
2022-04-07 00:47:01.887021 IP (tos 0x0, ttl 64, id 7581, offset 0, flags [DF], proto TCP (6), length 569)
    127.0.0.1.51094 > 127.0.0.1.10150: Flags [P.], cksum 0x002e (incorrect -> 0x5053), seq 14:531, ack 13, win 512, options [nop,nop,TS val 374704389 ecr 374704384], length 517
2022-04-07 00:47:01.887040 IP (tos 0x0, ttl 64, id 6162, offset 0, flags [DF], proto TCP (6), length 52)
    127.0.0.1.10150 > 127.0.0.1.51094: Flags [.], cksum 0xfe28 (incorrect -> 0xeba4), seq 13, ack 531, win 508, options [nop,nop,TS val 374704389 ecr 374704389], length 0
2022-04-07 00:47:02.179923 IP (tos 0x0, ttl 64, id 6163, offset 0, flags [DF], proto TCP (6), length 2044)
    127.0.0.1.10150 > 127.0.0.1.51094: Flags [P.], cksum 0x05f1 (incorrect -> 0x9528), seq 13:2005, ack 531, win 512, options [nop,nop,TS val 374704682 ecr 374704389], length 1992
2022-04-07 00:47:02.179933 IP (tos 0x0, ttl 64, id 7582, offset 0, flags [DF], proto TCP (6), length 52)
    127.0.0.1.51094 > 127.0.0.1.10150: Flags [.], cksum 0xfe28 (incorrect -> 0xe19a), seq 531, ack 2005, win 500, options [nop,nop,TS val 374704682 ecr 374704682], length 0
2022-04-07 00:47:02.196618 IP (tos 0x0, ttl 64, id 6164, offset 0, flags [DF], proto TCP (6), length 2506)
    127.0.0.1.10150 > 127.0.0.1.51094: Flags [P.], cksum 0x07bf (incorrect -> 0xbd78), seq 2005:4459, ack 531, win 512, options [nop,nop,TS val 374704699 ecr 374704682], length 2454
2022-04-07 00:47:02.196628 IP (tos 0x0, ttl 64, id 7583, offset 0, flags [DF], proto TCP (6), length 52)
    127.0.0.1.51094 > 127.0.0.1.10150: Flags [.], cksum 0xfe28 (incorrect -> 0xd7e4), seq 531, ack 4459, win 498, options [nop,nop,TS val 374704699 ecr 374704699], length 0
2022-04-07 00:47:02.197366 IP (tos 0x0, ttl 64, id 7584, offset 0, flags [DF], proto TCP (6), length 145)
    127.0.0.1.51094 > 127.0.0.1.10150: Flags [P.], cksum 0xfe85 (incorrect -> 0xb551), seq 531:624, ack 4459, win 512, options [nop,nop,TS val 374704700 ecr 374704699], length 93
2022-04-07 00:47:02.197380 IP (tos 0x0, ttl 64, id 6165, offset 0, flags [DF], proto TCP (6), length 52)
    127.0.0.1.10150 > 127.0.0.1.51094: Flags [.], cksum 0xfe28 (incorrect -> 0xd777), seq 4459, ack 624, win 512, options [nop,nop,TS val 374704700 ecr 374704700], length 0
2022-04-07 00:47:02.434653 IP (tos 0x0, ttl 64, id 6166, offset 0, flags [DF], proto TCP (6), length 103)
    127.0.0.1.10150 > 127.0.0.1.51094: Flags [P.], cksum 0xfe5b (incorrect -> 0xcd9a), seq 4459:4510, ack 624, win 512, options [nop,nop,TS val 374704937 ecr 374704700], length 51
2022-04-07 00:47:02.434673 IP (tos 0x0, ttl 64, id 7585, offset 0, flags [DF], proto TCP (6), length 52)
    127.0.0.1.51094 > 127.0.0.1.10150: Flags [.], cksum 0xfe28 (incorrect -> 0xd56a), seq 624, ack 4510, win 512, options [nop,nop,TS val 374704937 ecr 374704937], length 0
2022-04-07 00:47:02.435193 IP (tos 0x0, ttl 64, id 7586, offset 0, flags [DF], proto TCP (6), length 335)
    127.0.0.1.51094 > 127.0.0.1.10150: Flags [P.], cksum 0xff43 (incorrect -> 0xbf37), seq 624:907, ack 4510, win 512, options [nop,nop,TS val 374704938 ecr 374704937], length 283
2022-04-07 00:47:02.435216 IP (tos 0x0, ttl 64, id 6167, offset 0, flags [DF], proto TCP (6), length 52)
    127.0.0.1.10150 > 127.0.0.1.51094: Flags [.], cksum 0xfe28 (incorrect -> 0xd44f), seq 4510, ack 907, win 510, options [nop,nop,TS val 374704938 ecr 374704938], length 0
2022-04-07 00:47:02.690265 IP (tos 0x0, ttl 64, id 6168, offset 0, flags [DF], proto TCP (6), length 429)
    127.0.0.1.10150 > 127.0.0.1.51094: Flags [P.], cksum 0xffa1 (incorrect -> 0x8436), seq 4510:4887, ack 907, win 512, options [nop,nop,TS val 374705193 ecr 374704938], length 377
2022-04-07 00:47:02.692477 IP (tos 0x0, ttl 64, id 52399, offset 0, flags [DF], proto TCP (6), length 60)
    127.0.0.1.51096 > 127.0.0.1.10150: Flags [S], cksum 0xfe30 (incorrect -> 0x2de4), seq 4259549818, win 65495, options [mss 65495,sackOK,TS val 374705195 ecr 0,nop,wscale 7], length 0
2022-04-07 00:47:02.692485 IP (tos 0x0, ttl 64, id 0, offset 0, flags [DF], proto TCP (6), length 60)
    127.0.0.1.10150 > 127.0.0.1.51096: Flags [S.], cksum 0xfe30 (incorrect -> 0x9492), seq 3233822219, ack 4259549819, win 65483, options [mss 65495,sackOK,TS val 374705195 ecr 374705195,nop,wscale 7], length 0
2022-04-07 00:47:02.692492 IP (tos 0x0, ttl 64, id 52400, offset 0, flags [DF], proto TCP (6), length 52)
    127.0.0.1.51096 > 127.0.0.1.10150: Flags [.], cksum 0xfe28 (incorrect -> 0xbb4e), seq 1, ack 1, win 512, options [nop,nop,TS val 374705195 ecr 374705195], length 0
2022-04-07 00:47:02.692552 IP (tos 0x0, ttl 64, id 52401, offset 0, flags [DF], proto TCP (6), length 55)
    127.0.0.1.51096 > 127.0.0.1.10150: Flags [P.], cksum 0xfe2b (incorrect -> 0xb642), seq 1:4, ack 1, win 512, options [nop,nop,TS val 374705195 ecr 374705195], length 3
2022-04-07 00:47:02.692556 IP (tos 0x0, ttl 64, id 17367, offset 0, flags [DF], proto TCP (6), length 52)
    127.0.0.1.10150 > 127.0.0.1.51096: Flags [.], cksum 0xfe28 (incorrect -> 0xbb4b), seq 1, ack 4, win 512, options [nop,nop,TS val 374705195 ecr 374705195], length 0
2022-04-07 00:47:02.692609 IP (tos 0x0, ttl 64, id 17368, offset 0, flags [DF], proto TCP (6), length 54)
    127.0.0.1.10150 > 127.0.0.1.51096: Flags [P.], cksum 0xfe2a (incorrect -> 0xb641), seq 1:3, ack 4, win 512, options [nop,nop,TS val 374705195 ecr 374705195], length 2
2022-04-07 00:47:02.692613 IP (tos 0x0, ttl 64, id 52402, offset 0, flags [DF], proto TCP (6), length 52)
    127.0.0.1.51096 > 127.0.0.1.10150: Flags [.], cksum 0xfe28 (incorrect -> 0xbb49), seq 4, ack 3, win 512, options [nop,nop,TS val 374705195 ecr 374705195], length 0
2022-04-07 00:47:02.734666 IP (tos 0x0, ttl 64, id 7587, offset 0, flags [DF], proto TCP (6), length 52)
    127.0.0.1.51094 > 127.0.0.1.10150: Flags [.], cksum 0xfe28 (incorrect -> 0xd0aa), seq 907, ack 4887, win 512, options [nop,nop,TS val 374705237 ecr 374705193], length 0
2022-04-07 00:47:03.513368 IP (tos 0x0, ttl 64, id 52403, offset 0, flags [DF], proto TCP (6), length 62)
    127.0.0.1.51096 > 127.0.0.1.10150: Flags [P.], cksum 0xfe32 (incorrect -> 0x4dc8), seq 4:14, ack 3, win 512, options [nop,nop,TS val 374706016 ecr 374705195], length 10
2022-04-07 00:47:03.513380 IP (tos 0x0, ttl 64, id 17369, offset 0, flags [DF], proto TCP (6), length 52)
    127.0.0.1.10150 > 127.0.0.1.51096: Flags [.], cksum 0xfe28 (incorrect -> 0xb4d5), seq 3, ack 14, win 512, options [nop,nop,TS val 374706016 ecr 374706016], length 0
2022-04-07 00:47:03.844418 IP (tos 0x0, ttl 64, id 17370, offset 0, flags [DF], proto TCP (6), length 62)
    127.0.0.1.10150 > 127.0.0.1.51096: Flags [P.], cksum 0xfe32 (incorrect -> 0xae77), seq 3:13, ack 14, win 512, options [nop,nop,TS val 374706347 ecr 374706016], length 10
2022-04-07 00:47:03.844424 IP (tos 0x0, ttl 64, id 52404, offset 0, flags [DF], proto TCP (6), length 52)
    127.0.0.1.51096 > 127.0.0.1.10150: Flags [.], cksum 0xfe28 (incorrect -> 0xb235), seq 14, ack 13, win 512, options [nop,nop,TS val 374706347 ecr 374706347], length 0
2022-04-07 00:47:03.849636 IP (tos 0x0, ttl 64, id 52405, offset 0, flags [DF], proto TCP (6), length 569)
    127.0.0.1.51096 > 127.0.0.1.10150: Flags [P.], cksum 0x002e (incorrect -> 0x8f27), seq 14:531, ack 13, win 512, options [nop,nop,TS val 374706352 ecr 374706347], length 517
2022-04-07 00:47:03.849646 IP (tos 0x0, ttl 64, id 17371, offset 0, flags [DF], proto TCP (6), length 52)
    127.0.0.1.10150 > 127.0.0.1.51096: Flags [.], cksum 0xfe28 (incorrect -> 0xb02a), seq 13, ack 531, win 508, options [nop,nop,TS val 374706352 ecr 374706352], length 0
2022-04-07 00:47:04.032723 IP (tos 0x0, ttl 64, id 17372, offset 0, flags [DF], proto TCP (6), length 3538)
    127.0.0.1.10150 > 127.0.0.1.51096: Flags [P.], cksum 0x0bc7 (incorrect -> 0xa29a), seq 13:3499, ack 531, win 512, options [nop,nop,TS val 374706535 ecr 374706352], length 3486
2022-04-07 00:47:04.032729 IP (tos 0x0, ttl 64, id 52406, offset 0, flags [DF], proto TCP (6), length 52)
    127.0.0.1.51096 > 127.0.0.1.10150: Flags [.], cksum 0xfe28 (incorrect -> 0xa12c), seq 531, ack 3499, win 494, options [nop,nop,TS val 374706535 ecr 374706535], length 0
2022-04-07 00:47:04.049392 IP (tos 0x0, ttl 64, id 17373, offset 0, flags [DF], proto TCP (6), length 1012)
    127.0.0.1.10150 > 127.0.0.1.51096: Flags [P.], cksum 0x01e9 (incorrect -> 0x2dee), seq 3499:4459, ack 531, win 512, options [nop,nop,TS val 374706552 ecr 374706535], length 960
2022-04-07 00:47:04.049400 IP (tos 0x0, ttl 64, id 52407, offset 0, flags [DF], proto TCP (6), length 52)
    127.0.0.1.51096 > 127.0.0.1.10150: Flags [.], cksum 0xfe28 (incorrect -> 0x9d40), seq 531, ack 4459, win 504, options [nop,nop,TS val 374706552 ecr 374706552], length 0
2022-04-07 00:47:04.050011 IP (tos 0x0, ttl 64, id 52408, offset 0, flags [DF], proto TCP (6), length 145)
    127.0.0.1.51096 > 127.0.0.1.10150: Flags [P.], cksum 0xfe85 (incorrect -> 0x0ca2), seq 531:624, ack 4459, win 512, options [nop,nop,TS val 374706552 ecr 374706552], length 93
2022-04-07 00:47:04.050016 IP (tos 0x0, ttl 64, id 17374, offset 0, flags [DF], proto TCP (6), length 52)
    127.0.0.1.10150 > 127.0.0.1.51096: Flags [.], cksum 0xfe28 (incorrect -> 0x9cdb), seq 4459, ack 624, win 512, options [nop,nop,TS val 374706552 ecr 374706552], length 0
2022-04-07 00:47:04.136354 IP (tos 0x0, ttl 64, id 17375, offset 0, flags [DF], proto TCP (6), length 103)
    127.0.0.1.10150 > 127.0.0.1.51096: Flags [P.], cksum 0xfe5b (incorrect -> 0xccb4), seq 4459:4510, ack 624, win 512, options [nop,nop,TS val 374706639 ecr 374706552], length 51
2022-04-07 00:47:04.136360 IP (tos 0x0, ttl 64, id 52409, offset 0, flags [DF], proto TCP (6), length 52)
    127.0.0.1.51096 > 127.0.0.1.10150: Flags [.], cksum 0xfe28 (incorrect -> 0x9bfa), seq 624, ack 4510, win 512, options [nop,nop,TS val 374706639 ecr 374706639], length 0
2022-04-07 00:47:04.136627 IP (tos 0x0, ttl 64, id 52410, offset 0, flags [DF], proto TCP (6), length 331)
    127.0.0.1.51096 > 127.0.0.1.10150: Flags [P.], cksum 0xff3f (incorrect -> 0x0ec4), seq 624:903, ack 4510, win 512, options [nop,nop,TS val 374706639 ecr 374706639], length 279
2022-04-07 00:47:04.136633 IP (tos 0x0, ttl 64, id 17376, offset 0, flags [DF], proto TCP (6), length 52)
    127.0.0.1.10150 > 127.0.0.1.51096: Flags [.], cksum 0xfe28 (incorrect -> 0x9ae5), seq 4510, ack 903, win 510, options [nop,nop,TS val 374706639 ecr 374706639], length 0
2022-04-07 00:47:04.286074 IP (tos 0x0, ttl 64, id 17377, offset 0, flags [DF], proto TCP (6), length 3538)
    127.0.0.1.10150 > 127.0.0.1.51096: Flags [P.], cksum 0x0bc7 (incorrect -> 0x3d74), seq 4510:7996, ack 903, win 512, options [nop,nop,TS val 374706789 ecr 374706639], length 3486
2022-04-07 00:47:04.326653 IP (tos 0x0, ttl 64, id 52411, offset 0, flags [DF], proto TCP (6), length 52)
    127.0.0.1.51096 > 127.0.0.1.10150: Flags [.], cksum 0xfe28 (incorrect -> 0x8bf1), seq 903, ack 7996, win 512, options [nop,nop,TS val 374706829 ecr 374706789], length 0
2022-04-07 00:47:04.326658 IP (tos 0x0, ttl 64, id 17378, offset 0, flags [DF], proto TCP (6), length 910)
    127.0.0.1.10150 > 127.0.0.1.51096: Flags [P.], cksum 0x0183 (incorrect -> 0x4c7e), seq 7996:8854, ack 903, win 512, options [nop,nop,TS val 374706829 ecr 374706829], length 858
2022-04-07 00:47:04.326662 IP (tos 0x0, ttl 64, id 52412, offset 0, flags [DF], proto TCP (6), length 52)
    127.0.0.1.51096 > 127.0.0.1.10150: Flags [.], cksum 0xfe28 (incorrect -> 0x8875), seq 903, ack 8854, win 506, options [nop,nop,TS val 374706829 ecr 374706829], length 0
2022-04-07 00:47:04.526094 IP (tos 0x0, ttl 64, id 17379, offset 0, flags [DF], proto TCP (6), length 1500)
    127.0.0.1.10150 > 127.0.0.1.51096: Flags [P.], cksum 0x03d1 (incorrect -> 0x00fc), seq 8854:10302, ack 903, win 512, options [nop,nop,TS val 374707029 ecr 374706829], length 1448
2022-04-07 00:47:04.526100 IP (tos 0x0, ttl 64, id 52413, offset 0, flags [DF], proto TCP (6), length 52)
    127.0.0.1.51096 > 127.0.0.1.10150: Flags [.], cksum 0xfe28 (incorrect -> 0x8141), seq 903, ack 10302, win 502, options [nop,nop,TS val 374707029 ecr 374707029], length 0
2022-04-07 00:47:04.591130 IP (tos 0x0, ttl 64, id 17380, offset 0, flags [DF], proto TCP (6), length 2948)
    127.0.0.1.10150 > 127.0.0.1.51096: Flags [P.], cksum 0x0979 (incorrect -> 0x4c86), seq 10302:13198, ack 903, win 512, options [nop,nop,TS val 374707094 ecr 374707029], length 2896
2022-04-07 00:47:04.591135 IP (tos 0x0, ttl 64, id 52414, offset 0, flags [DF], proto TCP (6), length 52)
    127.0.0.1.51096 > 127.0.0.1.10150: Flags [.], cksum 0xfe28 (incorrect -> 0x7575), seq 903, ack 13198, win 496, options [nop,nop,TS val 374707094 ecr 374707094], length 0
200, 5.553174257278442, 4.345142602920532