2022-04-07 08:55:29.694261 IP (tos 0x0, ttl 64, id 53272, offset 0, flags [DF], proto TCP (6), length 60)
    127.0.0.1.35664 > 127.0.0.1.10550: Flags [S], cksum 0xfe30 (incorrect -> 0x35ff), seq 1338786038, win 65495, options [mss 65495,sackOK,TS val 404012197 ecr 0,nop,wscale 7], length 0
2022-04-07 08:55:29.694272 IP (tos 0x0, ttl 64, id 0, offset 0, flags [DF], proto TCP (6), length 60)
    127.0.0.1.10550 > 127.0.0.1.35664: Flags [S.], cksum 0xfe30 (incorrect -> 0x9266), seq 1326088143, ack 1338786039, win 65483, options [mss 65495,sackOK,TS val 404012197 ecr 404012197,nop,wscale 7], length 0
2022-04-07 08:55:29.694282 IP (tos 0x0, ttl 64, id 53273, offset 0, flags [DF], proto TCP (6), length 52)
    127.0.0.1.35664 > 127.0.0.1.10550: Flags [.], cksum 0xfe28 (incorrect -> 0xb922), seq 1, ack 1, win 512, options [nop,nop,TS val 404012197 ecr 404012197], length 0
2022-04-07 08:55:29.694362 IP (tos 0x0, ttl 64, id 53274, offset 0, flags [DF], proto TCP (6), length 55)
    127.0.0.1.35664 > 127.0.0.1.10550: Flags [P.], cksum 0xfe2b (incorrect -> 0xb416), seq 1:4, ack 1, win 512, options [nop,nop,TS val 404012197 ecr 404012197], length 3
2022-04-07 08:55:29.694368 IP (tos 0x0, ttl 64, id 50718, offset 0, flags [DF], proto TCP (6), length 52)
    127.0.0.1.10550 > 127.0.0.1.35664: Flags [.], cksum 0xfe28 (incorrect -> 0xb91f), seq 1, ack 4, win 512, options [nop,nop,TS val 404012197 ecr 404012197], length 0
2022-04-07 08:55:29.694446 IP (tos 0x0, ttl 64, id 50719, offset 0, flags [DF], proto TCP (6), length 54)
    127.0.0.1.10550 > 127.0.0.1.35664: Flags [P.], cksum 0xfe2a (incorrect -> 0xb415), seq 1:3, ack 4, win 512, options [nop,nop,TS val 404012197 ecr 404012197], length 2
2022-04-07 08:55:29.694456 IP (tos 0x0, ttl 64, id 53275, offset 0, flags [DF], proto TCP (6), length 52)
    127.0.0.1.35664 > 127.0.0.1.10550: Flags [.], cksum 0xfe28 (incorrect -> 0xb91d), seq 4, ack 3, win 512, options [nop,nop,TS val 404012197 ecr 404012197], length 0
2022-04-07 08:55:29.706813 IP (tos 0x0, ttl 64, id 53276, offset 0, flags [DF], proto TCP (6), length 62)
    127.0.0.1.35664 > 127.0.0.1.10550: Flags [P.], cksum 0xfe32 (incorrect -> 0x4521), seq 4:14, ack 3, win 512, options [nop,nop,TS val 404012209 ecr 404012197], length 10
2022-04-07 08:55:29.706823 IP (tos 0x0, ttl 64, id 50720, offset 0, flags [DF], proto TCP (6), length 52)
    127.0.0.1.10550 > 127.0.0.1.35664: Flags [.], cksum 0xfe28 (incorrect -> 0xb8fb), seq 3, ack 14, win 512, options [nop,nop,TS val 404012209 ecr 404012209], length 0
2022-04-07 08:55:29.765855 IP (tos 0x0, ttl 64, id 50721, offset 0, flags [DF], proto TCP (6), length 62)
    127.0.0.1.10550 > 127.0.0.1.35664: Flags [P.], cksum 0xfe32 (incorrect -> 0xb3ad), seq 3:13, ack 14, win 512, options [nop,nop,TS val 404012268 ecr 404012209], length 10
2022-04-07 08:55:29.765864 IP (tos 0x0, ttl 64, id 53277, offset 0, flags [DF], proto TCP (6), length 52)
    127.0.0.1.35664 > 127.0.0.1.10550: Flags [.], cksum 0xfe28 (incorrect -> 0xb87b), seq 14, ack 13, win 512, options [nop,nop,TS val 404012268 ecr 404012268], length 0
2022-04-07 08:55:29.771441 IP (tos 0x0, ttl 64, id 53278, offset 0, flags [DF], proto TCP (6), length 569)
    127.0.0.1.35664 > 127.0.0.1.10550: Flags [P.], cksum 0x002e (incorrect -> 0xc28c), seq 14:531, ack 13, win 512, options [nop,nop,TS val 404012274 ecr 404012268], length 517
2022-04-07 08:55:29.771453 IP (tos 0x0, ttl 64, id 50722, offset 0, flags [DF], proto TCP (6), length 52)
    127.0.0.1.10550 > 127.0.0.1.35664: Flags [.], cksum 0xfe28 (incorrect -> 0xb66e), seq 13, ack 531, win 508, options [nop,nop,TS val 404012274 ecr 404012274], length 0
2022-04-07 08:55:29.838054 IP (tos 0x0, ttl 64, id 50723, offset 0, flags [DF], proto TCP (6), length 3538)
    127.0.0.1.10550 > 127.0.0.1.35664: Flags [P.], cksum 0x0bc7 (incorrect -> 0x427d), seq 13:3499, ack 531, win 512, options [nop,nop,TS val 404012340 ecr 404012274], length 3486
2022-04-07 08:55:29.838064 IP (tos 0x0, ttl 64, id 53279, offset 0, flags [DF], proto TCP (6), length 52)
    127.0.0.1.35664 > 127.0.0.1.10550: Flags [.], cksum 0xfe28 (incorrect -> 0xa859), seq 531, ack 3499, win 494, options [nop,nop,TS val 404012341 ecr 404012340], length 0
403, 4.886545896530151, 0.28891611099243164