2022-04-07 10:47:32.168553 IP (tos 0x0, ttl 64, id 3961, offset 0, flags [DF], proto TCP (6), length 60)
    127.0.0.1.45700 > 127.0.0.1.10250: Flags [S], cksum 0xfe30 (incorrect -> 0xd2f9), seq 119356128, win 65495, options [mss 65495,sackOK,TS val 3484651720 ecr 0,nop,wscale 7], length 0
2022-04-07 10:47:32.168573 IP (tos 0x0, ttl 64, id 0, offset 0, flags [DF], proto TCP (6), length 60)
    127.0.0.1.10250 > 127.0.0.1.45700: Flags [S.], cksum 0xfe30 (incorrect -> 0x59b0), seq 1750904939, ack 119356129, win 65483, options [mss 65495,sackOK,TS val 3484651720 ecr 3484651720,nop,wscale 7], length 0
2022-04-07 10:47:32.168588 IP (tos 0x0, ttl 64, id 3962, offset 0, flags [DF], proto TCP (6), length 52)
    127.0.0.1.45700 > 127.0.0.1.10250: Flags [.], cksum 0xfe28 (incorrect -> 0x806c), seq 1, ack 1, win 512, options [nop,nop,TS val 3484651720 ecr 3484651720], length 0
2022-04-07 10:47:32.168754 IP (tos 0x0, ttl 64, id 3963, offset 0, flags [DF], proto TCP (6), length 55)
    127.0.0.1.45700 > 127.0.0.1.10250: Flags [P.], cksum 0xfe2b (incorrect -> 0x7b60), seq 1:4, ack 1, win 512, options [nop,nop,TS val 3484651720 ecr 3484651720], length 3
2022-04-07 10:47:32.168762 IP (tos 0x0, ttl 64, id 35584, offset 0, flags [DF], proto TCP (6), length 52)
    127.0.0.1.10250 > 127.0.0.1.45700: Flags [.], cksum 0xfe28 (incorrect -> 0x8069), seq 1, ack 4, win 512, options [nop,nop,TS val 3484651720 ecr 3484651720], length 0
2022-04-07 10:47:32.168789 IP (tos 0x0, ttl 64, id 35585, offset 0, flags [DF], proto TCP (6), length 54)
    127.0.0.1.10250 > 127.0.0.1.45700: Flags [P.], cksum 0xfe2a (incorrect -> 0x7b5f), seq 1:3, ack 4, win 512, options [nop,nop,TS val 3484651720 ecr 3484651720], length 2
2022-04-07 10:47:32.168797 IP (tos 0x0, ttl 64, id 3964, offset 0, flags [DF], proto TCP (6), length 52)
    127.0.0.1.45700 > 127.0.0.1.10250: Flags [.], cksum 0xfe28 (incorrect -> 0x8067), seq 4, ack 3, win 512, options [nop,nop,TS val 3484651720 ecr 3484651720], length 0
2022-04-07 10:47:32.169968 IP (tos 0x0, ttl 64, id 3965, offset 0, flags [DF], proto TCP (6), length 62)
    127.0.0.1.45700 > 127.0.0.1.10250: Flags [P.], cksum 0xfe32 (incorrect -> 0x161a), seq 4:14, ack 3, win 512, options [nop,nop,TS val 3484651721 ecr 3484651720], length 10
2022-04-07 10:47:32.169987 IP (tos 0x0, ttl 64, id 35586, offset 0, flags [DF], proto TCP (6), length 52)
    127.0.0.1.10250 > 127.0.0.1.45700: Flags [.], cksum 0xfe28 (incorrect -> 0x805b), seq 3, ack 14, win 512, options [nop,nop,TS val 3484651721 ecr 3484651721], length 0
2022-04-07 10:47:32.250021 IP (tos 0x0, ttl 64, id 35587, offset 0, flags [DF], proto TCP (6), length 62)
    127.0.0.1.10250 > 127.0.0.1.45700: Flags [P.], cksum 0xfe32 (incorrect -> 0x7af8), seq 3:13, ack 14, win 512, options [nop,nop,TS val 3484651801 ecr 3484651721], length 10
2022-04-07 10:47:32.250029 IP (tos 0x0, ttl 64, id 3966, offset 0, flags [DF], proto TCP (6), length 52)
    127.0.0.1.45700 > 127.0.0.1.10250: Flags [.], cksum 0xfe28 (incorrect -> 0x7fb1), seq 14, ack 13, win 512, options [nop,nop,TS val 3484651801 ecr 3484651801], length 0
2022-04-07 10:47:32.255473 IP (tos 0x0, ttl 64, id 3967, offset 0, flags [DF], proto TCP (6), length 569)
    127.0.0.1.45700 > 127.0.0.1.10250: Flags [P.], cksum 0x002e (incorrect -> 0x40af), seq 14:531, ack 13, win 512, options [nop,nop,TS val 3484651807 ecr 3484651801], length 517
2022-04-07 10:47:32.255482 IP (tos 0x0, ttl 64, id 35588, offset 0, flags [DF], proto TCP (6), length 52)
    127.0.0.1.10250 > 127.0.0.1.45700: Flags [.], cksum 0xfe28 (incorrect -> 0x7da4), seq 13, ack 531, win 508, options [nop,nop,TS val 3484651807 ecr 3484651807], length 0
200, 5.776137590408325, 0.8865818977355957