2022-04-07 00:44:41.891243 IP (tos 0x0, ttl 64, id 14110, offset 0, flags [DF], proto TCP (6), length 60)
    127.0.0.1.57816 > 127.0.0.1.11450: Flags [S], cksum 0xfe30 (incorrect -> 0xf6bc), seq 456372993, win 65495, options [mss 65495,sackOK,TS val 374564394 ecr 0,nop,wscale 7], length 0
2022-04-07 00:44:41.891253 IP (tos 0x0, ttl 64, id 0, offset 0, flags [DF], proto TCP (6), length 60)
    127.0.0.1.11450 > 127.0.0.1.57816: Flags [S.], cksum 0xfe30 (incorrect -> 0xbcf9), seq 2420124928, ack 456372994, win 65483, options [mss 65495,sackOK,TS val 374564394 ecr 374564394,nop,wscale 7], length 0
2022-04-07 00:44:41.891262 IP (tos 0x0, ttl 64, id 14111, offset 0, flags [DF], proto TCP (6), length 52)
    127.0.0.1.57816 > 127.0.0.1.11450: Flags [.], cksum 0xfe28 (incorrect -> 0xe3b5), seq 1, ack 1, win 512, options [nop,nop,TS val 374564394 ecr 374564394], length 0
2022-04-07 00:44:41.891361 IP (tos 0x0, ttl 64, id 14112, offset 0, flags [DF], proto TCP (6), length 55)
    127.0.0.1.57816 > 127.0.0.1.11450: Flags [P.], cksum 0xfe2b (incorrect -> 0xdea9), seq 1:4, ack 1, win 512, options [nop,nop,TS val 374564394 ecr 374564394], length 3
2022-04-07 00:44:41.891366 IP (tos 0x0, ttl 64, id 3217, offset 0, flags [DF], proto TCP (6), length 52)
    127.0.0.1.11450 > 127.0.0.1.57816: Flags [.], cksum 0xfe28 (incorrect -> 0xe3b2), seq 1, ack 4, win 512, options [nop,nop,TS val 374564394 ecr 374564394], length 0
2022-04-07 00:44:41.891448 IP (tos 0x0, ttl 64, id 3218, offset 0, flags [DF], proto TCP (6), length 54)
    127.0.0.1.11450 > 127.0.0.1.57816: Flags [P.], cksum 0xfe2a (incorrect -> 0xdea8), seq 1:3, ack 4, win 512, options [nop,nop,TS val 374564394 ecr 374564394], length 2
2022-04-07 00:44:41.891466 IP (tos 0x0, ttl 64, id 14113, offset 0, flags [DF], proto TCP (6), length 52)
    127.0.0.1.57816 > 127.0.0.1.11450: Flags [.], cksum 0xfe28 (incorrect -> 0xe3b0), seq 4, ack 3, win 512, options [nop,nop,TS val 374564394 ecr 374564394], length 0
2022-04-07 00:44:41.910616 IP (tos 0x0, ttl 64, id 14114, offset 0, flags [DF], proto TCP (6), length 62)
    127.0.0.1.57816 > 127.0.0.1.11450: Flags [P.], cksum 0xfe32 (incorrect -> 0xb6e8), seq 4:14, ack 3, win 512, options [nop,nop,TS val 374564413 ecr 374564394], length 10
2022-04-07 00:44:41.910635 IP (tos 0x0, ttl 64, id 3219, offset 0, flags [DF], proto TCP (6), length 52)
    127.0.0.1.11450 > 127.0.0.1.57816: Flags [.], cksum 0xfe28 (incorrect -> 0xe380), seq 3, ack 14, win 512, options [nop,nop,TS val 374564413 ecr 374564413], length 0
2022-04-07 00:44:42.083944 IP (tos 0x0, ttl 64, id 3220, offset 0, flags [DF], proto TCP (6), length 62)
    127.0.0.1.11450 > 127.0.0.1.57816: Flags [P.], cksum 0xfe32 (incorrect -> 0xddc0), seq 3:13, ack 14, win 512, options [nop,nop,TS val 374564586 ecr 374564413], length 10
2022-04-07 00:44:42.083957 IP (tos 0x0, ttl 64, id 14115, offset 0, flags [DF], proto TCP (6), length 52)
    127.0.0.1.57816 > 127.0.0.1.11450: Flags [.], cksum 0xfe28 (incorrect -> 0xe21c), seq 14, ack 13, win 512, options [nop,nop,TS val 374564586 ecr 374564586], length 0
2022-04-07 00:44:42.089842 IP (tos 0x0, ttl 64, id 14116, offset 0, flags [DF], proto TCP (6), length 569)
    127.0.0.1.57816 > 127.0.0.1.11450: Flags [P.], cksum 0x002e (incorrect -> 0x5880), seq 14:531, ack 13, win 512, options [nop,nop,TS val 374564592 ecr 374564586], length 517
2022-04-07 00:44:42.089859 IP (tos 0x0, ttl 64, id 3221, offset 0, flags [DF], proto TCP (6), length 52)
    127.0.0.1.11450 > 127.0.0.1.57816: Flags [.], cksum 0xfe28 (incorrect -> 0xe00f), seq 13, ack 531, win 508, options [nop,nop,TS val 374564592 ecr 374564592], length 0
2022-04-07 00:44:42.274059 IP (tos 0x0, ttl 64, id 3222, offset 0, flags [DF], proto TCP (6), length 2865)
    127.0.0.1.11450 > 127.0.0.1.57816: Flags [P.], cksum 0x0926 (incorrect -> 0x2cbb), seq 13:2826, ack 531, win 512, options [nop,nop,TS val 374564776 ecr 374564592], length 2813
2022-04-07 00:44:42.274071 IP (tos 0x0, ttl 64, id 14117, offset 0, flags [DF], proto TCP (6), length 52)
    127.0.0.1.57816 > 127.0.0.1.11450: Flags [.], cksum 0xfe28 (incorrect -> 0xd3ac), seq 531, ack 2826, win 497, options [nop,nop,TS val 374564777 ecr 374564776], length 0
2022-04-07 00:44:42.275487 IP (tos 0x0, ttl 64, id 14118, offset 0, flags [DF], proto TCP (6), length 116)
    127.0.0.1.57816 > 127.0.0.1.11450: Flags [P.], cksum 0xfe68 (incorrect -> 0xfd2b), seq 531:595, ack 2826, win 512, options [nop,nop,TS val 374564778 ecr 374564776], length 64
2022-04-07 00:44:42.275495 IP (tos 0x0, ttl 64, id 3223, offset 0, flags [DF], proto TCP (6), length 52)
    127.0.0.1.11450 > 127.0.0.1.57816: Flags [.], cksum 0xfe28 (incorrect -> 0xd35a), seq 2826, ack 595, win 512, options [nop,nop,TS val 374564778 ecr 374564778], length 0
2022-04-07 00:44:42.275822 IP (tos 0x0, ttl 64, id 14119, offset 0, flags [DF], proto TCP (6), length 398)
    127.0.0.1.57816 > 127.0.0.1.11450: Flags [P.], cksum 0xff82 (incorrect -> 0xcd80), seq 595:941, ack 2826, win 512, options [nop,nop,TS val 374564778 ecr 374564778], length 346
2022-04-07 00:44:42.275828 IP (tos 0x0, ttl 64, id 3224, offset 0, flags [DF], proto TCP (6), length 52)
    127.0.0.1.11450 > 127.0.0.1.57816: Flags [.], cksum 0xfe28 (incorrect -> 0xd202), seq 2826, ack 941, win 510, options [nop,nop,TS val 374564778 ecr 374564778], length 0
2022-04-07 00:44:42.394351 IP (tos 0x0, ttl 64, id 3225, offset 0, flags [DF], proto TCP (6), length 307)
    127.0.0.1.11450 > 127.0.0.1.57816: Flags [P.], cksum 0xff27 (incorrect -> 0x9a94), seq 2826:3081, ack 941, win 512, options [nop,nop,TS val 374564897 ecr 374564778], length 255
2022-04-07 00:44:42.394367 IP (tos 0x0, ttl 64, id 14120, offset 0, flags [DF], proto TCP (6), length 52)
    127.0.0.1.57816 > 127.0.0.1.11450: Flags [.], cksum 0xfe28 (incorrect -> 0xd014), seq 941, ack 3081, win 511, options [nop,nop,TS val 374564897 ecr 374564897], length 0
2022-04-07 00:44:42.815122 IP (tos 0x0, ttl 64, id 3226, offset 0, flags [DF], proto TCP (6), length 3538)
    127.0.0.1.11450 > 127.0.0.1.57816: Flags [P.], cksum 0x0bc7 (incorrect -> 0xe507), seq 3081:6567, ack 941, win 512, options [nop,nop,TS val 374565318 ecr 374564897], length 3486
2022-04-07 00:44:42.815130 IP (tos 0x0, ttl 64, id 14121, offset 0, flags [DF], proto TCP (6), length 52)
    127.0.0.1.57816 > 127.0.0.1.11450: Flags [.], cksum 0xfe28 (incorrect -> 0xbf3d), seq 941, ack 6567, win 494, options [nop,nop,TS val 374565318 ecr 374565318], length 0
2022-04-07 00:44:42.849830 IP (tos 0x0, ttl 64, id 3227, offset 0, flags [DF], proto TCP (6), length 1677)
    127.0.0.1.11450 > 127.0.0.1.57816: Flags [P.], cksum 0x0482 (incorrect -> 0x77dd), seq 6567:8192, ack 941, win 512, options [nop,nop,TS val 374565352 ecr 374565318], length 1625
2022-04-07 00:44:42.849837 IP (tos 0x0, ttl 64, id 14122, offset 0, flags [DF], proto TCP (6), length 52)
    127.0.0.1.57816 > 127.0.0.1.11450: Flags [.], cksum 0xfe28 (incorrect -> 0xb899), seq 941, ack 8192, win 501, options [nop,nop,TS val 374565352 ecr 374565352], length 0
200, 8.180059909820557, 1.7134661674499512