2022-04-07 11:23:43.958865 IP (tos 0x0, ttl 64, id 15918, offset 0, flags [DF], proto TCP (6), length 60)
    127.0.0.1.52002 > 127.0.0.1.11850: Flags [S], cksum 0xfe30 (incorrect -> 0x5a0b), seq 882000844, win 65495, options [mss 65495,sackOK,TS val 3486823510 ecr 0,nop,wscale 7], length 0
2022-04-07 11:23:43.958877 IP (tos 0x0, ttl 64, id 0, offset 0, flags [DF], proto TCP (6), length 60)
    127.0.0.1.11850 > 127.0.0.1.52002: Flags [S.], cksum 0xfe30 (incorrect -> 0xc8c2), seq 978309832, ack 882000845, win 65483, options [mss 65495,sackOK,TS val 3486823510 ecr 3486823510,nop,wscale 7], length 0
2022-04-07 11:23:43.958886 IP (tos 0x0, ttl 64, id 15919, offset 0, flags [DF], proto TCP (6), length 52)
    127.0.0.1.52002 > 127.0.0.1.11850: Flags [.], cksum 0xfe28 (incorrect -> 0xef7e), seq 1, ack 1, win 512, options [nop,nop,TS val 3486823510 ecr 3486823510], length 0
2022-04-07 11:23:43.958994 IP (tos 0x0, ttl 64, id 15920, offset 0, flags [DF], proto TCP (6), length 55)
    127.0.0.1.52002 > 127.0.0.1.11850: Flags [P.], cksum 0xfe2b (incorrect -> 0xea72), seq 1:4, ack 1, win 512, options [nop,nop,TS val 3486823510 ecr 3486823510], length 3
2022-04-07 11:23:43.959007 IP (tos 0x0, ttl 64, id 44471, offset 0, flags [DF], proto TCP (6), length 52)
    127.0.0.1.11850 > 127.0.0.1.52002: Flags [.], cksum 0xfe28 (incorrect -> 0xef7b), seq 1, ack 4, win 512, options [nop,nop,TS val 3486823510 ecr 3486823510], length 0
2022-04-07 11:23:43.959033 IP (tos 0x0, ttl 64, id 44472, offset 0, flags [DF], proto TCP (6), length 54)
    127.0.0.1.11850 > 127.0.0.1.52002: Flags [P.], cksum 0xfe2a (incorrect -> 0xea71), seq 1:3, ack 4, win 512, options [nop,nop,TS val 3486823510 ecr 3486823510], length 2
2022-04-07 11:23:43.959044 IP (tos 0x0, ttl 64, id 15921, offset 0, flags [DF], proto TCP (6), length 52)
    127.0.0.1.52002 > 127.0.0.1.11850: Flags [.], cksum 0xfe28 (incorrect -> 0xef79), seq 4, ack 3, win 512, options [nop,nop,TS val 3486823510 ecr 3486823510], length 0
2022-04-07 11:23:43.960415 IP (tos 0x0, ttl 64, id 15922, offset 0, flags [DF], proto TCP (6), length 62)
    127.0.0.1.52002 > 127.0.0.1.11850: Flags [P.], cksum 0xfe32 (incorrect -> 0xa1da), seq 4:14, ack 3, win 512, options [nop,nop,TS val 3486823512 ecr 3486823510], length 10
2022-04-07 11:23:43.960434 IP (tos 0x0, ttl 64, id 44473, offset 0, flags [DF], proto TCP (6), length 52)
    127.0.0.1.11850 > 127.0.0.1.52002: Flags [.], cksum 0xfe28 (incorrect -> 0xef6b), seq 3, ack 14, win 512, options [nop,nop,TS val 3486823512 ecr 3486823512], length 0
2022-04-07 11:23:44.145389 IP (tos 0x0, ttl 64, id 44474, offset 0, flags [DF], proto TCP (6), length 62)
    127.0.0.1.11850 > 127.0.0.1.52002: Flags [P.], cksum 0xfe32 (incorrect -> 0xe99f), seq 3:13, ack 14, win 512, options [nop,nop,TS val 3486823697 ecr 3486823512], length 10
2022-04-07 11:23:44.145399 IP (tos 0x0, ttl 64, id 15923, offset 0, flags [DF], proto TCP (6), length 52)
    127.0.0.1.52002 > 127.0.0.1.11850: Flags [.], cksum 0xfe28 (incorrect -> 0xedef), seq 14, ack 13, win 512, options [nop,nop,TS val 3486823697 ecr 3486823697], length 0
2022-04-07 11:23:44.151066 IP (tos 0x0, ttl 64, id 15924, offset 0, flags [DF], proto TCP (6), length 569)
    127.0.0.1.52002 > 127.0.0.1.11850: Flags [P.], cksum 0x002e (incorrect -> 0x9527), seq 14:531, ack 13, win 512, options [nop,nop,TS val 3486823702 ecr 3486823697], length 517
2022-04-07 11:23:44.151076 IP (tos 0x0, ttl 64, id 44475, offset 0, flags [DF], proto TCP (6), length 52)
    127.0.0.1.11850 > 127.0.0.1.52002: Flags [.], cksum 0xfe28 (incorrect -> 0xebe4), seq 13, ack 531, win 508, options [nop,nop,TS val 3486823702 ecr 3486823702], length 0
2022-04-07 11:23:44.318625 IP (tos 0x0, ttl 64, id 44476, offset 0, flags [DF], proto TCP (6), length 3340)
    127.0.0.1.11850 > 127.0.0.1.52002: Flags [P.], cksum 0x0b01 (incorrect -> 0xd695), seq 13:3301, ack 531, win 512, options [nop,nop,TS val 3486823870 ecr 3486823702], length 3288
2022-04-07 11:23:44.318635 IP (tos 0x0, ttl 64, id 15925, offset 0, flags [DF], proto TCP (6), length 52)
    127.0.0.1.52002 > 127.0.0.1.11850: Flags [.], cksum 0xfe28 (incorrect -> 0xddc9), seq 531, ack 3301, win 495, options [nop,nop,TS val 3486823870 ecr 3486823870], length 0
2022-04-07 11:23:44.319062 IP (tos 0x0, ttl 64, id 15926, offset 0, flags [DF], proto TCP (6), length 145)
    127.0.0.1.52002 > 127.0.0.1.11850: Flags [P.], cksum 0xfe85 (incorrect -> 0x4834), seq 531:624, ack 3301, win 512, options [nop,nop,TS val 3486823870 ecr 3486823870], length 93
2022-04-07 11:23:44.319072 IP (tos 0x0, ttl 64, id 44477, offset 0, flags [DF], proto TCP (6), length 52)
    127.0.0.1.11850 > 127.0.0.1.52002: Flags [.], cksum 0xfe28 (incorrect -> 0xdd5b), seq 3301, ack 624, win 512, options [nop,nop,TS val 3486823870 ecr 3486823870], length 0
2022-04-07 11:23:44.502292 IP (tos 0x0, ttl 64, id 44478, offset 0, flags [DF], proto TCP (6), length 103)
    127.0.0.1.11850 > 127.0.0.1.52002: Flags [P.], cksum 0xfe5b (incorrect -> 0xd1a1), seq 3301:3352, ack 624, win 512, options [nop,nop,TS val 3486824054 ecr 3486823870], length 51
2022-04-07 11:23:44.502301 IP (tos 0x0, ttl 64, id 15927, offset 0, flags [DF], proto TCP (6), length 52)
    127.0.0.1.52002 > 127.0.0.1.11850: Flags [.], cksum 0xfe28 (incorrect -> 0xdbb8), seq 624, ack 3352, win 512, options [nop,nop,TS val 3486824054 ecr 3486824054], length 0
2022-04-07 11:23:44.502638 IP (tos 0x0, ttl 64, id 15928, offset 0, flags [DF], proto TCP (6), length 396)
    127.0.0.1.52002 > 127.0.0.1.11850: Flags [P.], cksum 0xff80 (incorrect -> 0x7125), seq 624:968, ack 3352, win 512, options [nop,nop,TS val 3486824054 ecr 3486824054], length 344
2022-04-07 11:23:44.502647 IP (tos 0x0, ttl 64, id 44479, offset 0, flags [DF], proto TCP (6), length 52)
    127.0.0.1.11850 > 127.0.0.1.52002: Flags [.], cksum 0xfe28 (incorrect -> 0xda62), seq 3352, ack 968, win 510, options [nop,nop,TS val 3486824054 ecr 3486824054], length 0
2022-04-07 11:23:44.717697 IP (tos 0x0, ttl 64, id 44480, offset 0, flags [DF], proto TCP (6), length 4100)
    127.0.0.1.11850 > 127.0.0.1.52002: Flags [P.], cksum 0x0df9 (incorrect -> 0x21c6), seq 3352:7400, ack 968, win 512, options [nop,nop,TS val 3486824269 ecr 3486824054], length 4048
2022-04-07 11:23:44.758787 IP (tos 0x0, ttl 64, id 15929, offset 0, flags [DF], proto TCP (6), length 52)
    127.0.0.1.52002 > 127.0.0.1.11850: Flags [.], cksum 0xfe28 (incorrect -> 0xc8b9), seq 968, ack 7400, win 512, options [nop,nop,TS val 3486824310 ecr 3486824269], length 0
2022-04-07 11:23:44.758797 IP (tos 0x0, ttl 64, id 44481, offset 0, flags [DF], proto TCP (6), length 5466)
    127.0.0.1.11850 > 127.0.0.1.52002: Flags [P.], cksum 0x134f (incorrect -> 0x8358), seq 7400:12814, ack 968, win 512, options [nop,nop,TS val 3486824310 ecr 3486824310], length 5414
2022-04-07 11:23:44.758803 IP (tos 0x0, ttl 64, id 15930, offset 0, flags [DF], proto TCP (6), length 52)
    127.0.0.1.52002 > 127.0.0.1.11850: Flags [.], cksum 0xfe28 (incorrect -> 0xb384), seq 968, ack 12814, win 486, options [nop,nop,TS val 3486824310 ecr 3486824310], length 0
2022-04-07 11:23:44.764731 IP (tos 0x0, ttl 64, id 44482, offset 0, flags [DF], proto TCP (6), length 4100)
    127.0.0.1.11850 > 127.0.0.1.52002: Flags [P.], cksum 0x0df9 (incorrect -> 0xa165), seq 12814:16862, ack 968, win 512, options [nop,nop,TS val 3486824316 ecr 3486824310], length 4048
2022-04-07 11:23:44.764742 IP (tos 0x0, ttl 64, id 15931, offset 0, flags [DF], proto TCP (6), length 52)
    127.0.0.1.52002 > 127.0.0.1.11850: Flags [.], cksum 0xfe28 (incorrect -> 0xa3a2), seq 968, ack 16862, win 492, options [nop,nop,TS val 3486824316 ecr 3486824316], length 0
2022-04-07 11:23:44.764750 IP (tos 0x0, ttl 64, id 44483, offset 0, flags [DF], proto TCP (6), length 486)
    127.0.0.1.11850 > 127.0.0.1.52002: Flags [P.], cksum 0xffda (incorrect -> 0x642c), seq 16862:17296, ack 968, win 512, options [nop,nop,TS val 3486824316 ecr 3486824316], length 434
2022-04-07 11:23:44.764755 IP (tos 0x0, ttl 64, id 15932, offset 0, flags [DF], proto TCP (6), length 52)
    127.0.0.1.52002 > 127.0.0.1.11850: Flags [.], cksum 0xfe28 (incorrect -> 0xa1f2), seq 968, ack 17296, win 490, options [nop,nop,TS val 3486824316 ecr 3486824316], length 0
2022-04-07 11:23:44.765994 IP (tos 0x0, ttl 64, id 44484, offset 0, flags [DF], proto TCP (6), length 1048)
    127.0.0.1.11850 > 127.0.0.1.52002: Flags [P.], cksum 0x020d (incorrect -> 0x94f9), seq 17296:18292, ack 968, win 512, options [nop,nop,TS val 3486824317 ecr 3486824316], length 996
2022-04-07 11:23:44.766001 IP (tos 0x0, ttl 64, id 15933, offset 0, flags [DF], proto TCP (6), length 52)
    127.0.0.1.52002 > 127.0.0.1.11850: Flags [.], cksum 0xfe28 (incorrect -> 0x9dfe), seq 968, ack 18292, win 504, options [nop,nop,TS val 3486824317 ecr 3486824317], length 0
2022-04-07 11:23:44.778658 IP (tos 0x0, ttl 64, id 44485, offset 0, flags [DF], proto TCP (6), length 2632)
    127.0.0.1.11850 > 127.0.0.1.52002: Flags [P.], cksum 0x083d (incorrect -> 0xbf91), seq 18292:20872, ack 968, win 512, options [nop,nop,TS val 3486824330 ecr 3486824317], length 2580
2022-04-07 11:23:44.778666 IP (tos 0x0, ttl 64, id 15934, offset 0, flags [DF], proto TCP (6), length 52)
    127.0.0.1.52002 > 127.0.0.1.11850: Flags [.], cksum 0xfe28 (incorrect -> 0x93d7), seq 968, ack 20872, win 497, options [nop,nop,TS val 3486824330 ecr 3486824330], length 0
2022-04-07 11:23:44.817577 IP (tos 0x0, ttl 64, id 44486, offset 0, flags [DF], proto TCP (6), length 4100)
    127.0.0.1.11850 > 127.0.0.1.52002: Flags [P.], cksum 0x0df9 (incorrect -> 0x5e1c), seq 20872:24920, ack 968, win 512, options [nop,nop,TS val 3486824369 ecr 3486824330], length 4048
2022-04-07 11:23:44.817586 IP (tos 0x0, ttl 64, id 15935, offset 0, flags [DF], proto TCP (6), length 52)
    127.0.0.1.52002 > 127.0.0.1.11850: Flags [.], cksum 0xfe28 (incorrect -> 0x83be), seq 968, ack 24920, win 492, options [nop,nop,TS val 3486824369 ecr 3486824369], length 0
2022-04-07 11:23:44.817595 IP (tos 0x0, ttl 64, id 44487, offset 0, flags [DF], proto TCP (6), length 3474)
    127.0.0.1.11850 > 127.0.0.1.52002: Flags [P.], cksum 0x0b87 (incorrect -> 0x6810), seq 24920:28342, ack 968, win 512, options [nop,nop,TS val 3486824369 ecr 3486824369], length 3422
2022-04-07 11:23:44.817601 IP (tos 0x0, ttl 64, id 15936, offset 0, flags [DF], proto TCP (6), length 52)
    127.0.0.1.52002 > 127.0.0.1.11850: Flags [.], cksum 0xfe28 (incorrect -> 0x766e), seq 968, ack 28342, win 478, options [nop,nop,TS val 3486824369 ecr 3486824369], length 0
2022-04-07 11:23:44.831099 IP (tos 0x0, ttl 64, id 44488, offset 0, flags [DF], proto TCP (6), length 550)
    127.0.0.1.11850 > 127.0.0.1.52002: Flags [P.], cksum 0x001b (incorrect -> 0x2439), seq 28342:28840, ack 968, win 512, options [nop,nop,TS val 3486824382 ecr 3486824369], length 498
2022-04-07 11:23:44.831119 IP (tos 0x0, ttl 64, id 15937, offset 0, flags [DF], proto TCP (6), length 52)
    127.0.0.1.52002 > 127.0.0.1.11850: Flags [.], cksum 0xfe28 (incorrect -> 0x7440), seq 968, ack 28840, win 512, options [nop,nop,TS val 3486824382 ecr 3486824382], length 0
2022-04-07 11:23:44.845480 IP (tos 0x0, ttl 64, id 44489, offset 0, flags [DF], proto TCP (6), length 3040)
    127.0.0.1.11850 > 127.0.0.1.52002: Flags [P.], cksum 0x09d5 (incorrect -> 0xc49b), seq 28840:31828, ack 968, win 512, options [nop,nop,TS val 3486824397 ecr 3486824382], length 2988
2022-04-07 11:23:44.845497 IP (tos 0x0, ttl 64, id 15938, offset 0, flags [DF], proto TCP (6), length 52)
    127.0.0.1.52002 > 127.0.0.1.11850: Flags [.], cksum 0xfe28 (incorrect -> 0x6876), seq 968, ack 31828, win 512, options [nop,nop,TS val 3486824397 ecr 3486824397], length 0
2022-04-07 11:23:44.846802 IP (tos 0x0, ttl 64, id 44490, offset 0, flags [DF], proto TCP (6), length 2044)
    127.0.0.1.11850 > 127.0.0.1.52002: Flags [P.], cksum 0x05f1 (incorrect -> 0xdf93), seq 31828:33820, ack 968, win 512, options [nop,nop,TS val 3486824398 ecr 3486824397], length 1992
2022-04-07 11:23:44.846817 IP (tos 0x0, ttl 64, id 15939, offset 0, flags [DF], proto TCP (6), length 52)
    127.0.0.1.52002 > 127.0.0.1.11850: Flags [.], cksum 0xfe28 (incorrect -> 0x60ac), seq 968, ack 33820, win 512, options [nop,nop,TS val 3486824398 ecr 3486824398], length 0
2022-04-07 11:23:44.846978 IP (tos 0x0, ttl 64, id 44491, offset 0, flags [DF], proto TCP (6), length 4100)
    127.0.0.1.11850 > 127.0.0.1.52002: Flags [P.], cksum 0x0df9 (incorrect -> 0xa55d), seq 33820:37868, ack 968, win 512, options [nop,nop,TS val 3486824398 ecr 3486824398], length 4048
2022-04-07 11:23:44.847058 IP (tos 0x0, ttl 64, id 15940, offset 0, flags [DF], proto TCP (6), length 52)
    127.0.0.1.52002 > 127.0.0.1.11850: Flags [.], cksum 0xfe28 (incorrect -> 0x50dc), seq 968, ack 37868, win 512, options [nop,nop,TS val 3486824398 ecr 3486824398], length 0
2022-04-07 11:23:44.847065 IP (tos 0x0, ttl 64, id 44492, offset 0, flags [DF], proto TCP (6), length 3474)
    127.0.0.1.11850 > 127.0.0.1.52002: Flags [P.], cksum 0x0b87 (incorrect -> 0xbea2), seq 37868:41290, ack 968, win 512, options [nop,nop,TS val 3486824398 ecr 3486824398], length 3422
2022-04-07 11:23:44.847072 IP (tos 0x0, ttl 64, id 15941, offset 0, flags [DF], proto TCP (6), length 52)
    127.0.0.1.52002 > 127.0.0.1.11850: Flags [.], cksum 0xfe28 (incorrect -> 0x437e), seq 968, ack 41290, win 512, options [nop,nop,TS val 3486824398 ecr 3486824398], length 0
2022-04-07 11:23:44.849987 IP (tos 0x0, ttl 64, id 44493, offset 0, flags [DF], proto TCP (6), length 3040)
    127.0.0.1.11850 > 127.0.0.1.52002: Flags [P.], cksum 0x09d5 (incorrect -> 0x0e5c), seq 41290:44278, ack 968, win 512, options [nop,nop,TS val 3486824401 ecr 3486824398], length 2988
2022-04-07 11:23:44.850004 IP (tos 0x0, ttl 64, id 15942, offset 0, flags [DF], proto TCP (6), length 52)
    127.0.0.1.52002 > 127.0.0.1.11850: Flags [.], cksum 0xfe28 (incorrect -> 0x37cc), seq 968, ack 44278, win 512, options [nop,nop,TS val 3486824401 ecr 3486824401], length 0
2022-04-07 11:23:44.859159 IP (tos 0x0, ttl 64, id 44494, offset 0, flags [DF], proto TCP (6), length 4036)
    127.0.0.1.11850 > 127.0.0.1.52002: Flags [P.], cksum 0x0db9 (incorrect -> 0xa867), seq 44278:48262, ack 968, win 512, options [nop,nop,TS val 3486824410 ecr 3486824401], length 3984
2022-04-07 11:23:44.859178 IP (tos 0x0, ttl 64, id 15943, offset 0, flags [DF], proto TCP (6), length 52)
    127.0.0.1.52002 > 127.0.0.1.11850: Flags [.], cksum 0xfe28 (incorrect -> 0x282a), seq 968, ack 48262, win 512, options [nop,nop,TS val 3486824410 ecr 3486824410], length 0
2022-04-07 11:23:44.864528 IP (tos 0x0, ttl 64, id 44495, offset 0, flags [DF], proto TCP (6), length 3538)
    127.0.0.1.11850 > 127.0.0.1.52002: Flags [P.], cksum 0x0bc7 (incorrect -> 0x38a9), seq 48262:51748, ack 968, win 512, options [nop,nop,TS val 3486824416 ecr 3486824410], length 3486
2022-04-07 11:23:44.864543 IP (tos 0x0, ttl 64, id 15944, offset 0, flags [DF], proto TCP (6), length 52)
    127.0.0.1.52002 > 127.0.0.1.11850: Flags [.], cksum 0xfe28 (incorrect -> 0x1a80), seq 968, ack 51748, win 512, options [nop,nop,TS val 3486824416 ecr 3486824416], length 0
2022-04-07 11:23:44.872988 IP (tos 0x0, ttl 64, id 44496, offset 0, flags [DF], proto TCP (6), length 1048)
    127.0.0.1.11850 > 127.0.0.1.52002: Flags [P.], cksum 0x020d (incorrect -> 0xcbf7), seq 51748:52744, ack 968, win 512, options [nop,nop,TS val 3486824424 ecr 3486824416], length 996
2022-04-07 11:23:44.873046 IP (tos 0x0, ttl 64, id 15945, offset 0, flags [DF], proto TCP (6), length 52)
    127.0.0.1.52002 > 127.0.0.1.11850: Flags [.], cksum 0xfe28 (incorrect -> 0x168c), seq 968, ack 52744, win 512, options [nop,nop,TS val 3486824424 ecr 3486824424], length 0
2022-04-07 11:23:44.892659 IP (tos 0x0, ttl 64, id 44497, offset 0, flags [DF], proto TCP (6), length 300)
    127.0.0.1.11850 > 127.0.0.1.52002: Flags [P.], cksum 0xff20 (incorrect -> 0xf474), seq 52744:52992, ack 968, win 512, options [nop,nop,TS val 3486824444 ecr 3486824424], length 248
2022-04-07 11:23:44.892676 IP (tos 0x0, ttl 64, id 15946, offset 0, flags [DF], proto TCP (6), length 52)
    127.0.0.1.52002 > 127.0.0.1.11850: Flags [.], cksum 0xfe28 (incorrect -> 0x156c), seq 968, ack 52992, win 512, options [nop,nop,TS val 3486824444 ecr 3486824444], length 0
2022-04-07 11:23:44.914421 IP (tos 0x0, ttl 64, id 44498, offset 0, flags [DF], proto TCP (6), length 3538)
    127.0.0.1.11850 > 127.0.0.1.52002: Flags [P.], cksum 0x0bc7 (incorrect -> 0xec08), seq 52992:56478, ack 968, win 512, options [nop,nop,TS val 3486824466 ecr 3486824444], length 3486
2022-04-07 11:23:44.914486 IP (tos 0x0, ttl 64, id 15947, offset 0, flags [DF], proto TCP (6), length 52)
    127.0.0.1.52002 > 127.0.0.1.11850: Flags [.], cksum 0xfe28 (incorrect -> 0x07a2), seq 968, ack 56478, win 512, options [nop,nop,TS val 3486824466 ecr 3486824466], length 0
2022-04-07 11:23:44.914492 IP (tos 0x0, ttl 64, id 44499, offset 0, flags [DF], proto TCP (6), length 4036)
    127.0.0.1.11850 > 127.0.0.1.52002: Flags [P.], cksum 0x0db9 (incorrect -> 0xdbd4), seq 56478:60462, ack 968, win 512, options [nop,nop,TS val 3486824466 ecr 3486824466], length 3984
2022-04-07 11:23:44.914498 IP (tos 0x0, ttl 64, id 15948, offset 0, flags [DF], proto TCP (6), length 52)
    127.0.0.1.52002 > 127.0.0.1.11850: Flags [.], cksum 0xfe28 (incorrect -> 0xf811), seq 968, ack 60462, win 512, options [nop,nop,TS val 3486824466 ecr 3486824466], length 0
2022-04-07 11:23:44.914561 IP (tos 0x0, ttl 64, id 44500, offset 0, flags [DF], proto TCP (6), length 4036)
    127.0.0.1.11850 > 127.0.0.1.52002: Flags [P.], cksum 0x0db9 (incorrect -> 0x0214), seq 60462:64446, ack 968, win 512, options [nop,nop,TS val 3486824466 ecr 3486824466], length 3984
2022-04-07 11:23:44.954788 IP (tos 0x0, ttl 64, id 15949, offset 0, flags [DF], proto TCP (6), length 52)
    127.0.0.1.52002 > 127.0.0.1.11850: Flags [.], cksum 0xfe28 (incorrect -> 0xe859), seq 968, ack 64446, win 512, options [nop,nop,TS val 3486824506 ecr 3486824466], length 0
2022-04-07 11:23:44.954800 IP (tos 0x0, ttl 64, id 44501, offset 0, flags [DF], proto TCP (6), length 22688)
    127.0.0.1.11850 > 127.0.0.1.52002: Flags [P.], cksum 0x5695 (incorrect -> 0x5a9d), seq 64446:87082, ack 968, win 512, options [nop,nop,TS val 3486824506 ecr 3486824506], length 22636
2022-04-07 11:23:44.998795 IP (tos 0x0, ttl 64, id 15950, offset 0, flags [DF], proto TCP (6), length 52)
    127.0.0.1.52002 > 127.0.0.1.11850: Flags [.], cksum 0xfe28 (incorrect -> 0x8f99), seq 968, ack 87082, win 512, options [nop,nop,TS val 3486824550 ecr 3486824506], length 0
2022-04-07 11:23:44.998805 IP (tos 0x0, ttl 64, id 44502, offset 0, flags [DF], proto TCP (6), length 8302)
    127.0.0.1.11850 > 127.0.0.1.52002: Flags [P.], cksum 0x1e63 (incorrect -> 0x7ac3), seq 87082:95332, ack 968, win 512, options [nop,nop,TS val 3486824550 ecr 3486824550], length 8250
2022-04-07 11:23:44.998822 IP (tos 0x0, ttl 64, id 15951, offset 0, flags [DF], proto TCP (6), length 52)
    127.0.0.1.52002 > 127.0.0.1.11850: Flags [.], cksum 0xfe28 (incorrect -> 0x6f33), seq 968, ack 95332, win 512, options [nop,nop,TS val 3486824550 ecr 3486824550], length 0
2022-04-07 11:23:45.098260 IP (tos 0x0, ttl 64, id 44503, offset 0, flags [DF], proto TCP (6), length 4100)
    127.0.0.1.11850 > 127.0.0.1.52002: Flags [P.], cksum 0x0df9 (incorrect -> 0x871c), seq 95332:99380, ack 968, win 512, options [nop,nop,TS val 3486824650 ecr 3486824550], length 4048
2022-04-07 11:23:45.098284 IP (tos 0x0, ttl 64, id 15952, offset 0, flags [DF], proto TCP (6), length 52)
    127.0.0.1.52002 > 127.0.0.1.11850: Flags [.], cksum 0xfe28 (incorrect -> 0x5e9b), seq 968, ack 99380, win 512, options [nop,nop,TS val 3486824650 ecr 3486824650], length 0
2022-04-07 11:23:45.098290 IP (tos 0x0, ttl 64, id 44504, offset 0, flags [DF], proto TCP (6), length 3474)
    127.0.0.1.11850 > 127.0.0.1.52002: Flags [P.], cksum 0x0b87 (incorrect -> 0xd029), seq 99380:102802, ack 968, win 512, options [nop,nop,TS val 3486824650 ecr 3486824650], length 3422
2022-04-07 11:23:45.098351 IP (tos 0x0, ttl 64, id 15953, offset 0, flags [DF], proto TCP (6), length 52)
    127.0.0.1.52002 > 127.0.0.1.11850: Flags [.], cksum 0xfe28 (incorrect -> 0x513d), seq 968, ack 102802, win 512, options [nop,nop,TS val 3486824650 ecr 3486824650], length 0
2022-04-07 11:23:45.101225 IP (tos 0x0, ttl 64, id 44505, offset 0, flags [DF], proto TCP (6), length 1048)
    127.0.0.1.11850 > 127.0.0.1.52002: Flags [P.], cksum 0x020d (incorrect -> 0xac98), seq 102802:103798, ack 968, win 512, options [nop,nop,TS val 3486824652 ecr 3486824650], length 996
2022-04-07 11:23:45.101258 IP (tos 0x0, ttl 64, id 15954, offset 0, flags [DF], proto TCP (6), length 52)
    127.0.0.1.52002 > 127.0.0.1.11850: Flags [.], cksum 0xfe28 (incorrect -> 0x4d54), seq 968, ack 103798, win 512, options [nop,nop,TS val 3486824653 ecr 3486824652], length 0
2022-04-07 11:23:45.109982 IP (tos 0x0, ttl 64, id 44506, offset 0, flags [DF], proto TCP (6), length 4036)
    127.0.0.1.11850 > 127.0.0.1.52002: Flags [P.], cksum 0x0db9 (incorrect -> 0x8ef6), seq 103798:107782, ack 968, win 512, options [nop,nop,TS val 3486824661 ecr 3486824653], length 3984
2022-04-07 11:23:45.110023 IP (tos 0x0, ttl 64, id 15955, offset 0, flags [DF], proto TCP (6), length 52)
    127.0.0.1.52002 > 127.0.0.1.11850: Flags [.], cksum 0xfe28 (incorrect -> 0x3db3), seq 968, ack 107782, win 512, options [nop,nop,TS val 3486824661 ecr 3486824661], length 0
2022-04-07 11:23:45.112159 IP (tos 0x0, ttl 64, id 44507, offset 0, flags [DF], proto TCP (6), length 3538)
    127.0.0.1.11850 > 127.0.0.1.52002: Flags [P.], cksum 0x0bc7 (incorrect -> 0xf588), seq 107782:111268, ack 968, win 512, options [nop,nop,TS val 3486824663 ecr 3486824661], length 3486
2022-04-07 11:23:45.112172 IP (tos 0x0, ttl 64, id 15956, offset 0, flags [DF], proto TCP (6), length 52)
    127.0.0.1.52002 > 127.0.0.1.11850: Flags [.], cksum 0xfe28 (incorrect -> 0x3011), seq 968, ack 111268, win 512, options [nop,nop,TS val 3486824663 ecr 3486824663], length 0
2022-04-07 11:23:45.122448 IP (tos 0x0, ttl 64, id 44508, offset 0, flags [DF], proto TCP (6), length 550)
    127.0.0.1.11850 > 127.0.0.1.52002: Flags [P.], cksum 0x001b (incorrect -> 0xd755), seq 111268:111766, ack 968, win 512, options [nop,nop,TS val 3486824674 ecr 3486824663], length 498
2022-04-07 11:23:45.122464 IP (tos 0x0, ttl 64, id 15957, offset 0, flags [DF], proto TCP (6), length 52)
    127.0.0.1.52002 > 127.0.0.1.11850: Flags [.], cksum 0xfe28 (incorrect -> 0x2e09), seq 968, ack 111766, win 512, options [nop,nop,TS val 3486824674 ecr 3486824674], length 0
2022-04-07 11:23:45.122585 IP (tos 0x0, ttl 64, id 44509, offset 0, flags [DF], proto TCP (6), length 4100)
    127.0.0.1.11850 > 127.0.0.1.52002: Flags [P.], cksum 0x0df9 (incorrect -> 0x06f6), seq 111766:115814, ack 968, win 512, options [nop,nop,TS val 3486824674 ecr 3486824674], length 4048
2022-04-07 11:23:45.122604 IP (tos 0x0, ttl 64, id 15958, offset 0, flags [DF], proto TCP (6), length 52)
    127.0.0.1.52002 > 127.0.0.1.11850: Flags [.], cksum 0xfe28 (incorrect -> 0x1e39), seq 968, ack 115814, win 512, options [nop,nop,TS val 3486824674 ecr 3486824674], length 0
2022-04-07 11:23:45.122613 IP (tos 0x0, ttl 64, id 44510, offset 0, flags [DF], proto TCP (6), length 3474)
    127.0.0.1.11850 > 127.0.0.1.52002: Flags [P.], cksum 0x0b87 (incorrect -> 0xd2e0), seq 115814:119236, ack 968, win 512, options [nop,nop,TS val 3486824674 ecr 3486824674], length 3422
2022-04-07 11:23:45.123215 IP (tos 0x0, ttl 64, id 15959, offset 0, flags [DF], proto TCP (6), length 52)
    127.0.0.1.52002 > 127.0.0.1.11850: Flags [.], cksum 0xfe28 (incorrect -> 0x10db), seq 968, ack 119236, win 512, options [nop,nop,TS val 3486824674 ecr 3486824674], length 0
2022-04-07 11:23:45.126202 IP (tos 0x0, ttl 64, id 44511, offset 0, flags [DF], proto TCP (6), length 4100)
    127.0.0.1.11850 > 127.0.0.1.52002: Flags [P.], cksum 0x0df9 (incorrect -> 0xced3), seq 119236:123284, ack 968, win 512, options [nop,nop,TS val 3486824677 ecr 3486824674], length 4048
2022-04-07 11:23:45.126239 IP (tos 0x0, ttl 64, id 15960, offset 0, flags [DF], proto TCP (6), length 52)
    127.0.0.1.52002 > 127.0.0.1.11850: Flags [.], cksum 0xfe28 (incorrect -> 0x0104), seq 968, ack 123284, win 512, options [nop,nop,TS val 3486824678 ecr 3486824677], length 0
2022-04-07 11:23:45.126249 IP (tos 0x0, ttl 64, id 44512, offset 0, flags [DF], proto TCP (6), length 1482)
    127.0.0.1.11850 > 127.0.0.1.52002: Flags [P.], cksum 0x03bf (incorrect -> 0xfba5), seq 123284:124714, ack 968, win 512, options [nop,nop,TS val 3486824678 ecr 3486824678], length 1430
2022-04-07 11:23:45.126260 IP (tos 0x0, ttl 64, id 15961, offset 0, flags [DF], proto TCP (6), length 52)
    127.0.0.1.52002 > 127.0.0.1.11850: Flags [.], cksum 0xfe28 (incorrect -> 0xfb6c), seq 968, ack 124714, win 512, options [nop,nop,TS val 3486824678 ecr 3486824678], length 0
2022-04-07 11:23:45.145297 IP (tos 0x0, ttl 64, id 44513, offset 0, flags [DF], proto TCP (6), length 2542)
    127.0.0.1.11850 > 127.0.0.1.52002: Flags [P.], cksum 0x07e3 (incorrect -> 0xf0cd), seq 124714:127204, ack 968, win 512, options [nop,nop,TS val 3486824697 ecr 3486824678], length 2490
2022-04-07 11:23:45.145328 IP (tos 0x0, ttl 64, id 15962, offset 0, flags [DF], proto TCP (6), length 52)
    127.0.0.1.52002 > 127.0.0.1.11850: Flags [.], cksum 0xfe28 (incorrect -> 0xf18c), seq 968, ack 127204, win 512, options [nop,nop,TS val 3486824697 ecr 3486824697], length 0
2022-04-07 11:23:45.157832 IP (tos 0x0, ttl 64, id 44514, offset 0, flags [DF], proto TCP (6), length 3538)
    127.0.0.1.11850 > 127.0.0.1.52002: Flags [P.], cksum 0x0bc7 (incorrect -> 0x57f5), seq 127204:130690, ack 968, win 512, options [nop,nop,TS val 3486824709 ecr 3486824697], length 3486
2022-04-07 11:23:45.157851 IP (tos 0x0, ttl 64, id 15963, offset 0, flags [DF], proto TCP (6), length 52)
    127.0.0.1.52002 > 127.0.0.1.11850: Flags [.], cksum 0xfe28 (incorrect -> 0xe3d6), seq 968, ack 130690, win 512, options [nop,nop,TS val 3486824709 ecr 3486824709], length 0
2022-04-07 11:23:45.159118 IP (tos 0x0, ttl 64, id 44515, offset 0, flags [DF], proto TCP (6), length 4036)
    127.0.0.1.11850 > 127.0.0.1.52002: Flags [P.], cksum 0x0db9 (incorrect -> 0x332d), seq 130690:134674, ack 968, win 512, options [nop,nop,TS val 3486824710 ecr 3486824709], length 3984
2022-04-07 11:23:45.159181 IP (tos 0x0, ttl 64, id 15964, offset 0, flags [DF], proto TCP (6), length 52)
    127.0.0.1.52002 > 127.0.0.1.11850: Flags [.], cksum 0xfe28 (incorrect -> 0xd444), seq 968, ack 134674, win 512, options [nop,nop,TS val 3486824710 ecr 3486824710], length 0
2022-04-07 11:23:45.162913 IP (tos 0x0, ttl 64, id 44516, offset 0, flags [DF], proto TCP (6), length 1546)
    127.0.0.1.11850 > 127.0.0.1.52002: Flags [P.], cksum 0x03ff (incorrect -> 0x9acb), seq 134674:136168, ack 968, win 512, options [nop,nop,TS val 3486824714 ecr 3486824710], length 1494
2022-04-07 11:23:45.162941 IP (tos 0x0, ttl 64, id 15965, offset 0, flags [DF], proto TCP (6), length 52)
    127.0.0.1.52002 > 127.0.0.1.11850: Flags [.], cksum 0xfe28 (incorrect -> 0xce66), seq 968, ack 136168, win 512, options [nop,nop,TS val 3486824714 ecr 3486824714], length 0
2022-04-07 11:23:45.172965 IP (tos 0x0, ttl 64, id 44517, offset 0, flags [DF], proto TCP (6), length 1556)
    127.0.0.1.11850 > 127.0.0.1.52002: Flags [P.], cksum 0x0409 (incorrect -> 0xfd94), seq 136168:137672, ack 968, win 512, options [nop,nop,TS val 3486824724 ecr 3486824714], length 1504
2022-04-07 11:23:45.172985 IP (tos 0x0, ttl 64, id 15966, offset 0, flags [DF], proto TCP (6), length 52)
    127.0.0.1.52002 > 127.0.0.1.11850: Flags [.], cksum 0xfe28 (incorrect -> 0xc872), seq 968, ack 137672, win 512, options [nop,nop,TS val 3486824724 ecr 3486824724], length 0
2022-04-07 11:23:45.198251 IP (tos 0x0, ttl 64, id 44518, offset 0, flags [DF], proto TCP (6), length 4100)
    127.0.0.1.11850 > 127.0.0.1.52002: Flags [P.], cksum 0x0df9 (incorrect -> 0xe5f8), seq 137672:141720, ack 968, win 512, options [nop,nop,TS val 3486824750 ecr 3486824724], length 4048
2022-04-07 11:23:45.198320 IP (tos 0x0, ttl 64, id 15967, offset 0, flags [DF], proto TCP (6), length 52)
    127.0.0.1.52002 > 127.0.0.1.11850: Flags [.], cksum 0xfe28 (incorrect -> 0xb86e), seq 968, ack 141720, win 512, options [nop,nop,TS val 3486824750 ecr 3486824750], length 0
2022-04-07 11:23:45.198327 IP (tos 0x0, ttl 64, id 44519, offset 0, flags [DF], proto TCP (6), length 7458)
    127.0.0.1.11850 > 127.0.0.1.52002: Flags [P.], cksum 0x1b17 (incorrect -> 0x3498), seq 141720:149126, ack 968, win 512, options [nop,nop,TS val 3486824750 ecr 3486824750], length 7406
2022-04-07 11:23:45.198333 IP (tos 0x0, ttl 64, id 15968, offset 0, flags [DF], proto TCP (6), length 52)
    127.0.0.1.52002 > 127.0.0.1.11850: Flags [.], cksum 0xfe28 (incorrect -> 0x9b80), seq 968, ack 149126, win 512, options [nop,nop,TS val 3486824750 ecr 3486824750], length 0
2022-04-07 11:23:45.201336 IP (tos 0x0, ttl 64, id 44520, offset 0, flags [DF], proto TCP (6), length 1546)
    127.0.0.1.11850 > 127.0.0.1.52002: Flags [P.], cksum 0x03ff (incorrect -> 0x3046), seq 149126:150620, ack 968, win 512, options [nop,nop,TS val 3486824753 ecr 3486824750], length 1494
2022-04-07 11:23:45.201350 IP (tos 0x0, ttl 64, id 15969, offset 0, flags [DF], proto TCP (6), length 52)
    127.0.0.1.52002 > 127.0.0.1.11850: Flags [.], cksum 0xfe28 (incorrect -> 0x95a4), seq 968, ack 150620, win 512, options [nop,nop,TS val 3486824753 ecr 3486824753], length 0
2022-04-07 11:23:45.206018 IP (tos 0x0, ttl 64, id 44521, offset 0, flags [DF], proto TCP (6), length 3040)
    127.0.0.1.11850 > 127.0.0.1.52002: Flags [P.], cksum 0x09d5 (incorrect -> 0xa65c), seq 150620:153608, ack 968, win 512, options [nop,nop,TS val 3486824757 ecr 3486824753], length 2988
2022-04-07 11:23:45.206089 IP (tos 0x0, ttl 64, id 15970, offset 0, flags [DF], proto TCP (6), length 52)
    127.0.0.1.52002 > 127.0.0.1.11850: Flags [.], cksum 0xfe28 (incorrect -> 0x89f0), seq 968, ack 153608, win 512, options [nop,nop,TS val 3486824757 ecr 3486824757], length 0
2022-04-07 11:23:45.206364 IP (tos 0x0, ttl 64, id 44522, offset 0, flags [DF], proto TCP (6), length 4100)
    127.0.0.1.11850 > 127.0.0.1.52002: Flags [P.], cksum 0x0df9 (incorrect -> 0x5bb3), seq 153608:157656, ack 968, win 512, options [nop,nop,TS val 3486824758 ecr 3486824757], length 4048
2022-04-07 11:23:45.206446 IP (tos 0x0, ttl 64, id 15971, offset 0, flags [DF], proto TCP (6), length 52)
    127.0.0.1.52002 > 127.0.0.1.11850: Flags [.], cksum 0xfe28 (incorrect -> 0x7a1e), seq 968, ack 157656, win 512, options [nop,nop,TS val 3486824758 ecr 3486824758], length 0
2022-04-07 11:23:45.206453 IP (tos 0x0, ttl 64, id 44523, offset 0, flags [DF], proto TCP (6), length 11940)
    127.0.0.1.11850 > 127.0.0.1.52002: Flags [P.], cksum 0x2c99 (incorrect -> 0x4a8d), seq 157656:169544, ack 968, win 512, options [nop,nop,TS val 3486824758 ecr 3486824758], length 11888
2022-04-07 11:23:45.206499 IP (tos 0x0, ttl 64, id 15972, offset 0, flags [DF], proto TCP (6), length 52)
    127.0.0.1.52002 > 127.0.0.1.11850: Flags [.], cksum 0xfe28 (incorrect -> 0x4bae), seq 968, ack 169544, win 512, options [nop,nop,TS val 3486824758 ecr 3486824758], length 0
2022-04-07 11:23:45.206727 IP (tos 0x0, ttl 64, id 44524, offset 0, flags [DF], proto TCP (6), length 4100)
    127.0.0.1.11850 > 127.0.0.1.52002: Flags [P.], cksum 0x0df9 (incorrect -> 0xef9b), seq 169544:173592, ack 968, win 512, options [nop,nop,TS val 3486824758 ecr 3486824758], length 4048
2022-04-07 11:23:45.206776 IP (tos 0x0, ttl 64, id 15973, offset 0, flags [DF], proto TCP (6), length 52)
    127.0.0.1.52002 > 127.0.0.1.11850: Flags [.], cksum 0xfe28 (incorrect -> 0x3bde), seq 968, ack 173592, win 512, options [nop,nop,TS val 3486824758 ecr 3486824758], length 0
2022-04-07 11:23:45.206783 IP (tos 0x0, ttl 64, id 44525, offset 0, flags [DF], proto TCP (6), length 7458)
    127.0.0.1.11850 > 127.0.0.1.52002: Flags [P.], cksum 0x1b17 (incorrect -> 0xa0d9), seq 173592:180998, ack 968, win 512, options [nop,nop,TS val 3486824758 ecr 3486824758], length 7406
2022-04-07 11:23:45.206790 IP (tos 0x0, ttl 64, id 15974, offset 0, flags [DF], proto TCP (6), length 52)
    127.0.0.1.52002 > 127.0.0.1.11850: Flags [.], cksum 0xfe28 (incorrect -> 0x1ef0), seq 968, ack 180998, win 512, options [nop,nop,TS val 3486824758 ecr 3486824758], length 0
2022-04-07 11:23:45.212193 IP (tos 0x0, ttl 64, id 44526, offset 0, flags [DF], proto TCP (6), length 4100)
    127.0.0.1.11850 > 127.0.0.1.52002: Flags [P.], cksum 0x0df9 (incorrect -> 0x2bd1), seq 180998:185046, ack 968, win 512, options [nop,nop,TS val 3486824763 ecr 3486824758], length 4048
2022-04-07 11:23:45.212259 IP (tos 0x0, ttl 64, id 15975, offset 0, flags [DF], proto TCP (6), length 52)
    127.0.0.1.52002 > 127.0.0.1.11850: Flags [.], cksum 0xfe28 (incorrect -> 0x0f15), seq 968, ack 185046, win 512, options [nop,nop,TS val 3486824764 ecr 3486824763], length 0
2022-04-07 11:23:45.212265 IP (tos 0x0, ttl 64, id 44527, offset 0, flags [DF], proto TCP (6), length 466)
    127.0.0.1.11850 > 127.0.0.1.52002: Flags [P.], cksum 0xffc6 (incorrect -> 0xe104), seq 185046:185460, ack 968, win 512, options [nop,nop,TS val 3486824764 ecr 3486824764], length 414
2022-04-07 11:23:45.212270 IP (tos 0x0, ttl 64, id 15976, offset 0, flags [DF], proto TCP (6), length 52)
    127.0.0.1.52002 > 127.0.0.1.11850: Flags [.], cksum 0xfe28 (incorrect -> 0x0d76), seq 968, ack 185460, win 512, options [nop,nop,TS val 3486824764 ecr 3486824764], length 0
2022-04-07 11:23:45.214014 IP (tos 0x0, ttl 64, id 44528, offset 0, flags [DF], proto TCP (6), length 4100)
    127.0.0.1.11850 > 127.0.0.1.52002: Flags [P.], cksum 0x0df9 (incorrect -> 0x9ef4), seq 185460:189508, ack 968, win 512, options [nop,nop,TS val 3486824765 ecr 3486824764], length 4048
2022-04-07 11:23:45.214039 IP (tos 0x0, ttl 64, id 15977, offset 0, flags [DF], proto TCP (6), length 52)
    127.0.0.1.52002 > 127.0.0.1.11850: Flags [.], cksum 0xfe28 (incorrect -> 0xfda3), seq 968, ack 189508, win 512, options [nop,nop,TS val 3486824765 ecr 3486824765], length 0
2022-04-07 11:23:45.214045 IP (tos 0x0, ttl 64, id 44529, offset 0, flags [DF], proto TCP (6), length 2996)
    127.0.0.1.11850 > 127.0.0.1.52002: Flags [P.], cksum 0x09a9 (incorrect -> 0x6607), seq 189508:192452, ack 968, win 512, options [nop,nop,TS val 3486824765 ecr 3486824765], length 2944
2022-04-07 11:23:45.214051 IP (tos 0x0, ttl 64, id 15978, offset 0, flags [DF], proto TCP (6), length 52)
    127.0.0.1.52002 > 127.0.0.1.11850: Flags [.], cksum 0xfe28 (incorrect -> 0xf223), seq 968, ack 192452, win 512, options [nop,nop,TS val 3486824765 ecr 3486824765], length 0
2022-04-07 11:23:45.227699 IP (tos 0x0, ttl 64, id 44530, offset 0, flags [DF], proto TCP (6), length 4036)
    127.0.0.1.11850 > 127.0.0.1.52002: Flags [P.], cksum 0x0db9 (incorrect -> 0x862a), seq 192452:196436, ack 968, win 512, options [nop,nop,TS val 3486824779 ecr 3486824765], length 3984
2022-04-07 11:23:45.227724 IP (tos 0x0, ttl 64, id 15979, offset 0, flags [DF], proto TCP (6), length 52)
    127.0.0.1.52002 > 127.0.0.1.11850: Flags [.], cksum 0xfe28 (incorrect -> 0xe277), seq 968, ack 196436, win 512, options [nop,nop,TS val 3486824779 ecr 3486824779], length 0
2022-04-07 11:23:45.251476 IP (tos 0x0, ttl 64, id 44531, offset 0, flags [DF], proto TCP (6), length 3538)
    127.0.0.1.11850 > 127.0.0.1.52002: Flags [P.], cksum 0x0bc7 (incorrect -> 0x5539), seq 196436:199922, ack 968, win 512, options [nop,nop,TS val 3486824803 ecr 3486824779], length 3486
2022-04-07 11:23:45.251492 IP (tos 0x0, ttl 64, id 15980, offset 0, flags [DF], proto TCP (6), length 52)
    127.0.0.1.52002 > 127.0.0.1.11850: Flags [.], cksum 0xfe28 (incorrect -> 0xd4a9), seq 968, ack 199922, win 512, options [nop,nop,TS val 3486824803 ecr 3486824803], length 0
2022-04-07 11:23:45.251620 IP (tos 0x0, ttl 64, id 44532, offset 0, flags [DF], proto TCP (6), length 4036)
    127.0.0.1.11850 > 127.0.0.1.52002: Flags [P.], cksum 0x0db9 (incorrect -> 0x2706), seq 199922:203906, ack 968, win 512, options [nop,nop,TS val 3486824803 ecr 3486824803], length 3984
2022-04-07 11:23:45.251687 IP (tos 0x0, ttl 64, id 15981, offset 0, flags [DF], proto TCP (6), length 52)
    127.0.0.1.52002 > 127.0.0.1.11850: Flags [.], cksum 0xfe28 (incorrect -> 0xc519), seq 968, ack 203906, win 512, options [nop,nop,TS val 3486824803 ecr 3486824803], length 0
2022-04-07 11:23:45.252291 IP (tos 0x0, ttl 64, id 44533, offset 0, flags [DF], proto TCP (6), length 4036)
    127.0.0.1.11850 > 127.0.0.1.52002: Flags [P.], cksum 0x0db9 (incorrect -> 0x4475), seq 203906:207890, ack 968, win 512, options [nop,nop,TS val 3486824804 ecr 3486824803], length 3984
2022-04-07 11:23:45.280516 IP (tos 0x0, ttl 64, id 44534, offset 0, flags [DF], proto TCP (6), length 32820)
    127.0.0.1.11850 > 127.0.0.1.52002: Flags [.], cksum 0x7e29 (incorrect -> 0x0076), seq 207890:240658, ack 968, win 512, options [nop,nop,TS val 3486824832 ecr 3486824803], length 32768
2022-04-07 11:23:45.280545 IP (tos 0x0, ttl 64, id 15982, offset 0, flags [DF], proto TCP (6), length 52)
    127.0.0.1.52002 > 127.0.0.1.11850: Flags [.], cksum 0xfe28 (incorrect -> 0x35f0), seq 968, ack 240658, win 379, options [nop,nop,TS val 3486824832 ecr 3486824804], length 0
200, 3.9499878883361816, 1.3678085803985596