2022-04-07 19:48:50.922732 IP (tos 0x0, ttl 64, id 51192, offset 0, flags [DF], proto TCP (6), length 60)
    127.0.0.1.48122 > 127.0.0.1.10050: Flags [S], cksum 0xfe30 (incorrect -> 0x4dc8), seq 4026742379, win 65495, options [mss 65495,sackOK,TS val 3517130474 ecr 0,nop,wscale 7], length 0
2022-04-07 19:48:50.922749 IP (tos 0x0, ttl 64, id 0, offset 0, flags [DF], proto TCP (6), length 60)
    127.0.0.1.10050 > 127.0.0.1.48122: Flags [S.], cksum 0xfe30 (incorrect -> 0x0f69), seq 1776868323, ack 4026742380, win 65483, options [mss 65495,sackOK,TS val 3517130474 ecr 3517130474,nop,wscale 7], length 0
2022-04-07 19:48:50.922787 IP (tos 0x0, ttl 64, id 51193, offset 0, flags [DF], proto TCP (6), length 52)
    127.0.0.1.48122 > 127.0.0.1.10050: Flags [.], cksum 0xfe28 (incorrect -> 0x3625), seq 1, ack 1, win 512, options [nop,nop,TS val 3517130474 ecr 3517130474], length 0
2022-04-07 19:48:50.922899 IP (tos 0x0, ttl 64, id 51194, offset 0, flags [DF], proto TCP (6), length 55)
    127.0.0.1.48122 > 127.0.0.1.10050: Flags [P.], cksum 0xfe2b (incorrect -> 0x3119), seq 1:4, ack 1, win 512, options [nop,nop,TS val 3517130474 ecr 3517130474], length 3
2022-04-07 19:48:50.922919 IP (tos 0x0, ttl 64, id 32597, offset 0, flags [DF], proto TCP (6), length 52)
    127.0.0.1.10050 > 127.0.0.1.48122: Flags [.], cksum 0xfe28 (incorrect -> 0x3622), seq 1, ack 4, win 512, options [nop,nop,TS val 3517130474 ecr 3517130474], length 0
2022-04-07 19:48:50.923003 IP (tos 0x0, ttl 64, id 32598, offset 0, flags [DF], proto TCP (6), length 54)
    127.0.0.1.10050 > 127.0.0.1.48122: Flags [P.], cksum 0xfe2a (incorrect -> 0x3118), seq 1:3, ack 4, win 512, options [nop,nop,TS val 3517130474 ecr 3517130474], length 2
2022-04-07 19:48:50.923017 IP (tos 0x0, ttl 64, id 51195, offset 0, flags [DF], proto TCP (6), length 52)
    127.0.0.1.48122 > 127.0.0.1.10050: Flags [.], cksum 0xfe28 (incorrect -> 0x3620), seq 4, ack 3, win 512, options [nop,nop,TS val 3517130474 ecr 3517130474], length 0
2022-04-07 19:48:50.924745 IP (tos 0x0, ttl 64, id 51196, offset 0, flags [DF], proto TCP (6), length 62)
    127.0.0.1.48122 > 127.0.0.1.10050: Flags [P.], cksum 0xfe32 (incorrect -> 0x664a), seq 4:14, ack 3, win 512, options [nop,nop,TS val 3517130476 ecr 3517130474], length 10
2022-04-07 19:48:50.924755 IP (tos 0x0, ttl 64, id 32599, offset 0, flags [DF], proto TCP (6), length 52)
    127.0.0.1.10050 > 127.0.0.1.48122: Flags [.], cksum 0xfe28 (incorrect -> 0x3612), seq 3, ack 14, win 512, options [nop,nop,TS val 3517130476 ecr 3517130476], length 0
200, 2.8837389945983887, 0.9991426467895508