2022-04-07 09:43:48.263606 IP (tos 0x0, ttl 64, id 15727, offset 0, flags [DF], proto TCP (6), length 60)
    127.0.0.1.58682 > 127.0.0.1.12050: Flags [S], cksum 0xfe30 (incorrect -> 0xd4b7), seq 203117505, win 65495, options [mss 65495,sackOK,TS val 3480827815 ecr 0,nop,wscale 7], length 0
2022-04-07 09:43:48.263618 IP (tos 0x0, ttl 64, id 0, offset 0, flags [DF], proto TCP (6), length 60)
    127.0.0.1.12050 > 127.0.0.1.58682: Flags [S.], cksum 0xfe30 (incorrect -> 0x8e09), seq 294530554, ack 203117506, win 65483, options [mss 65495,sackOK,TS val 3480827815 ecr 3480827815,nop,wscale 7], length 0
2022-04-07 09:43:48.263627 IP (tos 0x0, ttl 64, id 15728, offset 0, flags [DF], proto TCP (6), length 52)
    127.0.0.1.58682 > 127.0.0.1.12050: Flags [.], cksum 0xfe28 (incorrect -> 0xb4c5), seq 1, ack 1, win 512, options [nop,nop,TS val 3480827815 ecr 3480827815], length 0
2022-04-07 09:43:48.263722 IP (tos 0x0, ttl 64, id 15729, offset 0, flags [DF], proto TCP (6), length 55)
    127.0.0.1.58682 > 127.0.0.1.12050: Flags [P.], cksum 0xfe2b (incorrect -> 0xafb9), seq 1:4, ack 1, win 512, options [nop,nop,TS val 3480827815 ecr 3480827815], length 3
2022-04-07 09:43:48.263726 IP (tos 0x0, ttl 64, id 17792, offset 0, flags [DF], proto TCP (6), length 52)
    127.0.0.1.12050 > 127.0.0.1.58682: Flags [.], cksum 0xfe28 (incorrect -> 0xb4c2), seq 1, ack 4, win 512, options [nop,nop,TS val 3480827815 ecr 3480827815], length 0
2022-04-07 09:43:48.263794 IP (tos 0x0, ttl 64, id 17793, offset 0, flags [DF], proto TCP (6), length 54)
    127.0.0.1.12050 > 127.0.0.1.58682: Flags [P.], cksum 0xfe2a (incorrect -> 0xafb8), seq 1:3, ack 4, win 512, options [nop,nop,TS val 3480827815 ecr 3480827815], length 2
2022-04-07 09:43:48.263798 IP (tos 0x0, ttl 64, id 15730, offset 0, flags [DF], proto TCP (6), length 52)
    127.0.0.1.58682 > 127.0.0.1.12050: Flags [.], cksum 0xfe28 (incorrect -> 0xb4c0), seq 4, ack 3, win 512, options [nop,nop,TS val 3480827815 ecr 3480827815], length 0
2022-04-07 09:43:48.265552 IP (tos 0x0, ttl 64, id 15731, offset 0, flags [DF], proto TCP (6), length 62)
    127.0.0.1.58682 > 127.0.0.1.12050: Flags [P.], cksum 0xfe32 (incorrect -> 0xb0be), seq 4:14, ack 3, win 512, options [nop,nop,TS val 3480827817 ecr 3480827815], length 10
2022-04-07 09:43:48.265563 IP (tos 0x0, ttl 64, id 17794, offset 0, flags [DF], proto TCP (6), length 52)
    127.0.0.1.12050 > 127.0.0.1.58682: Flags [.], cksum 0xfe28 (incorrect -> 0xb4b2), seq 3, ack 14, win 512, options [nop,nop,TS val 3480827817 ecr 3480827817], length 0
2022-04-07 09:43:48.339125 IP (tos 0x0, ttl 64, id 17795, offset 0, flags [DF], proto TCP (6), length 62)
    127.0.0.1.12050 > 127.0.0.1.58682: Flags [P.], cksum 0xfe32 (incorrect -> 0xaf56), seq 3:13, ack 14, win 512, options [nop,nop,TS val 3480827890 ecr 3480827817], length 10
2022-04-07 09:43:48.339131 IP (tos 0x0, ttl 64, id 15732, offset 0, flags [DF], proto TCP (6), length 52)
    127.0.0.1.58682 > 127.0.0.1.12050: Flags [.], cksum 0xfe28 (incorrect -> 0xb416), seq 14, ack 13, win 512, options [nop,nop,TS val 3480827890 ecr 3480827890], length 0
2022-04-07 09:43:48.344704 IP (tos 0x0, ttl 64, id 15733, offset 0, flags [DF], proto TCP (6), length 569)
    127.0.0.1.58682 > 127.0.0.1.12050: Flags [P.], cksum 0x002e (incorrect -> 0x00db), seq 14:531, ack 13, win 512, options [nop,nop,TS val 3480827896 ecr 3480827890], length 517
2022-04-07 09:43:48.344724 IP (tos 0x0, ttl 64, id 17796, offset 0, flags [DF], proto TCP (6), length 52)
    127.0.0.1.12050 > 127.0.0.1.58682: Flags [.], cksum 0xfe28 (incorrect -> 0xb209), seq 13, ack 531, win 508, options [nop,nop,TS val 3480827896 ecr 3480827896], length 0
2022-04-07 09:43:48.420231 IP (tos 0x0, ttl 64, id 17797, offset 0, flags [DF], proto TCP (6), length 3538)
    127.0.0.1.12050 > 127.0.0.1.58682: Flags [P.], cksum 0x0bc7 (incorrect -> 0x9825), seq 13:3499, ack 531, win 512, options [nop,nop,TS val 3480827972 ecr 3480827896], length 3486
2022-04-07 09:43:48.420236 IP (tos 0x0, ttl 64, id 15734, offset 0, flags [DF], proto TCP (6), length 52)
    127.0.0.1.58682 > 127.0.0.1.12050: Flags [.], cksum 0xfe28 (incorrect -> 0xa3e1), seq 531, ack 3499, win 494, options [nop,nop,TS val 3480827972 ecr 3480827972], length 0
2022-04-07 09:43:48.437304 IP (tos 0x0, ttl 64, id 17798, offset 0, flags [DF], proto TCP (6), length 64)
    127.0.0.1.12050 > 127.0.0.1.58682: Flags [P.], cksum 0xfe34 (incorrect -> 0x8dd8), seq 3499:3511, ack 531, win 512, options [nop,nop,TS val 3480827989 ecr 3480827972], length 12
2022-04-07 09:43:48.437308 IP (tos 0x0, ttl 64, id 15735, offset 0, flags [DF], proto TCP (6), length 52)
    127.0.0.1.58682 > 127.0.0.1.12050: Flags [.], cksum 0xfe28 (incorrect -> 0xa3a6), seq 531, ack 3511, win 507, options [nop,nop,TS val 3480827989 ecr 3480827989], length 0
2022-04-07 09:43:48.437545 IP (tos 0x0, ttl 64, id 15736, offset 0, flags [DF], proto TCP (6), length 178)
    127.0.0.1.58682 > 127.0.0.1.12050: Flags [P.], cksum 0xfea6 (incorrect -> 0xb49a), seq 531:657, ack 3511, win 512, options [nop,nop,TS val 3480827989 ecr 3480827989], length 126
2022-04-07 09:43:48.437549 IP (tos 0x0, ttl 64, id 17799, offset 0, flags [DF], proto TCP (6), length 52)
    127.0.0.1.12050 > 127.0.0.1.58682: Flags [.], cksum 0xfe28 (incorrect -> 0xa323), seq 3511, ack 657, win 512, options [nop,nop,TS val 3480827989 ecr 3480827989], length 0
2022-04-07 09:43:48.510493 IP (tos 0x0, ttl 64, id 17800, offset 0, flags [DF], proto TCP (6), length 103)
    127.0.0.1.12050 > 127.0.0.1.58682: Flags [P.], cksum 0xfe5b (incorrect -> 0xa9dd), seq 3511:3562, ack 657, win 512, options [nop,nop,TS val 3480828062 ecr 3480827989], length 51
2022-04-07 09:43:48.510497 IP (tos 0x0, ttl 64, id 15737, offset 0, flags [DF], proto TCP (6), length 52)
    127.0.0.1.58682 > 127.0.0.1.12050: Flags [.], cksum 0xfe28 (incorrect -> 0xa25e), seq 657, ack 3562, win 512, options [nop,nop,TS val 3480828062 ecr 3480828062], length 0
2022-04-07 09:43:48.510829 IP (tos 0x0, ttl 64, id 15738, offset 0, flags [DF], proto TCP (6), length 366)
    127.0.0.1.58682 > 127.0.0.1.12050: Flags [P.], cksum 0xff62 (incorrect -> 0x51f6), seq 657:971, ack 3562, win 512, options [nop,nop,TS val 3480828062 ecr 3480828062], length 314
2022-04-07 09:43:48.510834 IP (tos 0x0, ttl 64, id 17801, offset 0, flags [DF], proto TCP (6), length 52)
    127.0.0.1.12050 > 127.0.0.1.58682: Flags [.], cksum 0xfe28 (incorrect -> 0xa126), seq 3562, ack 971, win 510, options [nop,nop,TS val 3480828062 ecr 3480828062], length 0
2022-04-07 09:43:48.594203 IP (tos 0x0, ttl 64, id 17802, offset 0, flags [DF], proto TCP (6), length 4100)
    127.0.0.1.12050 > 127.0.0.1.58682: Flags [P.], cksum 0x0df9 (incorrect -> 0xffc8), seq 3562:7610, ack 971, win 512, options [nop,nop,TS val 3480828145 ecr 3480828062], length 4048
2022-04-07 09:43:48.634776 IP (tos 0x0, ttl 64, id 15739, offset 0, flags [DF], proto TCP (6), length 52)
    127.0.0.1.58682 > 127.0.0.1.12050: Flags [.], cksum 0xfe28 (incorrect -> 0x9085), seq 971, ack 7610, win 512, options [nop,nop,TS val 3480828186 ecr 3480828145], length 0
2022-04-07 09:43:48.634781 IP (tos 0x0, ttl 64, id 17803, offset 0, flags [DF], proto TCP (6), length 10604)
    127.0.0.1.12050 > 127.0.0.1.58682: Flags [P.], cksum 0x2761 (incorrect -> 0x4a35), seq 7610:18162, ack 971, win 512, options [nop,nop,TS val 3480828186 ecr 3480828186], length 10552
2022-04-07 09:43:48.634784 IP (tos 0x0, ttl 64, id 15740, offset 0, flags [DF], proto TCP (6), length 52)
    127.0.0.1.58682 > 127.0.0.1.12050: Flags [.], cksum 0xfe28 (incorrect -> 0x6752), seq 971, ack 18162, win 466, options [nop,nop,TS val 3480828186 ecr 3480828186], length 0
2022-04-07 09:43:48.639910 IP (tos 0x0, ttl 64, id 17804, offset 0, flags [DF], proto TCP (6), length 4100)
    127.0.0.1.12050 > 127.0.0.1.58682: Flags [P.], cksum 0x0df9 (incorrect -> 0x3823), seq 18162:22210, ack 971, win 512, options [nop,nop,TS val 3480828191 ecr 3480828186], length 4048
2022-04-07 09:43:48.639914 IP (tos 0x0, ttl 64, id 15741, offset 0, flags [DF], proto TCP (6), length 52)
    127.0.0.1.58682 > 127.0.0.1.12050: Flags [.], cksum 0xfe28 (incorrect -> 0x575e), seq 971, ack 22210, win 492, options [nop,nop,TS val 3480828191 ecr 3480828191], length 0
2022-04-07 09:43:48.639918 IP (tos 0x0, ttl 64, id 17805, offset 0, flags [DF], proto TCP (6), length 1980)
    127.0.0.1.12050 > 127.0.0.1.58682: Flags [P.], cksum 0x05b1 (incorrect -> 0x3de9), seq 22210:24138, ack 971, win 512, options [nop,nop,TS val 3480828191 ecr 3480828191], length 1928
2022-04-07 09:43:48.639920 IP (tos 0x0, ttl 64, id 15742, offset 0, flags [DF], proto TCP (6), length 52)
    127.0.0.1.58682 > 127.0.0.1.12050: Flags [.], cksum 0xfe28 (incorrect -> 0x4fde), seq 971, ack 24138, win 484, options [nop,nop,TS val 3480828191 ecr 3480828191], length 0
2022-04-07 09:43:48.639981 IP (tos 0x0, ttl 64, id 17806, offset 0, flags [DF], proto TCP (6), length 3334)
    127.0.0.1.12050 > 127.0.0.1.58682: Flags [P.], cksum 0x0afb (incorrect -> 0xf9c5), seq 24138:27420, ack 971, win 512, options [nop,nop,TS val 3480828191 ecr 3480828191], length 3282
2022-04-07 09:43:48.639983 IP (tos 0x0, ttl 64, id 15743, offset 0, flags [DF], proto TCP (6), length 52)
    127.0.0.1.58682 > 127.0.0.1.12050: Flags [.], cksum 0xfe28 (incorrect -> 0x4319), seq 971, ack 27420, win 471, options [nop,nop,TS val 3480828191 ecr 3480828191], length 0
2022-04-07 09:43:48.642141 IP (tos 0x0, ttl 64, id 17807, offset 0, flags [DF], proto TCP (6), length 4100)
    127.0.0.1.12050 > 127.0.0.1.58682: Flags [P.], cksum 0x0df9 (incorrect -> 0xfe19), seq 27420:31468, ack 971, win 512, options [nop,nop,TS val 3480828193 ecr 3480828191], length 4048
2022-04-07 09:43:48.642145 IP (tos 0x0, ttl 64, id 15744, offset 0, flags [DF], proto TCP (6), length 52)
    127.0.0.1.58682 > 127.0.0.1.12050: Flags [.], cksum 0xfe28 (incorrect -> 0x3330), seq 971, ack 31468, win 492, options [nop,nop,TS val 3480828193 ecr 3480828193], length 0
2022-04-07 09:43:48.642150 IP (tos 0x0, ttl 64, id 17808, offset 0, flags [DF], proto TCP (6), length 2410)
    127.0.0.1.12050 > 127.0.0.1.58682: Flags [P.], cksum 0x075f (incorrect -> 0x9788), seq 31468:33826, ack 971, win 512, options [nop,nop,TS val 3480828193 ecr 3480828193], length 2358
2022-04-07 09:43:48.642152 IP (tos 0x0, ttl 64, id 15745, offset 0, flags [DF], proto TCP (6), length 52)
    127.0.0.1.58682 > 127.0.0.1.12050: Flags [.], cksum 0xfe28 (incorrect -> 0x2a04), seq 971, ack 33826, win 482, options [nop,nop,TS val 3480828193 ecr 3480828193], length 0
2022-04-07 09:43:48.648984 IP (tos 0x0, ttl 64, id 17809, offset 0, flags [DF], proto TCP (6), length 4100)
    127.0.0.1.12050 > 127.0.0.1.58682: Flags [P.], cksum 0x0df9 (incorrect -> 0x9f1b), seq 33826:37874, ack 971, win 512, options [nop,nop,TS val 3480828200 ecr 3480828193], length 4048
2022-04-07 09:43:48.649724 IP (tos 0x0, ttl 64, id 15746, offset 0, flags [DF], proto TCP (6), length 52)
    127.0.0.1.58682 > 127.0.0.1.12050: Flags [.], cksum 0xfe28 (incorrect -> 0x1a07), seq 971, ack 37874, win 512, options [nop,nop,TS val 3480828201 ecr 3480828200], length 0
2022-04-07 09:43:48.649731 IP (tos 0x0, ttl 64, id 17810, offset 0, flags [DF], proto TCP (6), length 486)
    127.0.0.1.12050 > 127.0.0.1.58682: Flags [P.], cksum 0xffda (incorrect -> 0x9fd3), seq 37874:38308, ack 971, win 512, options [nop,nop,TS val 3480828201 ecr 3480828201], length 434
2022-04-07 09:43:48.649736 IP (tos 0x0, ttl 64, id 15747, offset 0, flags [DF], proto TCP (6), length 52)
    127.0.0.1.58682 > 127.0.0.1.12050: Flags [.], cksum 0xfe28 (incorrect -> 0x1854), seq 971, ack 38308, win 512, options [nop,nop,TS val 3480828201 ecr 3480828201], length 0
2022-04-07 09:43:48.656831 IP (tos 0x0, ttl 64, id 17811, offset 0, flags [DF], proto TCP (6), length 4100)
    127.0.0.1.12050 > 127.0.0.1.58682: Flags [P.], cksum 0x0df9 (incorrect -> 0xea3b), seq 38308:42356, ack 971, win 512, options [nop,nop,TS val 3480828208 ecr 3480828201], length 4048
2022-04-07 09:43:48.657046 IP (tos 0x0, ttl 64, id 15748, offset 0, flags [DF], proto TCP (6), length 52)
    127.0.0.1.58682 > 127.0.0.1.12050: Flags [.], cksum 0xfe28 (incorrect -> 0x0876), seq 971, ack 42356, win 512, options [nop,nop,TS val 3480828208 ecr 3480828208], length 0
2022-04-07 09:43:48.657053 IP (tos 0x0, ttl 64, id 17812, offset 0, flags [DF], proto TCP (6), length 23348)
    127.0.0.1.12050 > 127.0.0.1.58682: Flags [P.], cksum 0x5929 (incorrect -> 0x64fe), seq 42356:65652, ack 971, win 512, options [nop,nop,TS val 3480828208 ecr 3480828208], length 23296
2022-04-07 09:43:48.677651 IP (tos 0x0, ttl 64, id 17813, offset 0, flags [DF], proto TCP (6), length 32820)
    127.0.0.1.12050 > 127.0.0.1.58682: Flags [.], cksum 0x7e29 (incorrect -> 0xf289), seq 65652:98420, ack 971, win 512, options [nop,nop,TS val 3480828229 ecr 3480828208], length 32768
2022-04-07 09:43:48.677670 IP (tos 0x0, ttl 64, id 15749, offset 0, flags [DF], proto TCP (6), length 52)
    127.0.0.1.58682 > 127.0.0.1.12050: Flags [.], cksum 0xfe28 (incorrect -> 0x2de5), seq 971, ack 98420, win 379, options [nop,nop,TS val 3480828229 ecr 3480828208], length 0
2022-04-07 09:43:48.677675 IP (tos 0x0, ttl 64, id 17814, offset 0, flags [DF], proto TCP (6), length 2788)
    127.0.0.1.12050 > 127.0.0.1.58682: Flags [P.], cksum 0x08d9 (incorrect -> 0x37a8), seq 98420:101156, ack 971, win 512, options [nop,nop,TS val 3480828229 ecr 3480828229], length 2736
2022-04-07 09:43:48.678313 IP (tos 0x0, ttl 64, id 15750, offset 0, flags [DF], proto TCP (6), length 52)
    127.0.0.1.58682 > 127.0.0.1.12050: Flags [.], cksum 0xfe28 (incorrect -> 0x229a), seq 971, ack 101156, win 512, options [nop,nop,TS val 3480828230 ecr 3480828229], length 0
2022-04-07 09:43:48.678815 IP (tos 0x0, ttl 64, id 17815, offset 0, flags [DF], proto TCP (6), length 4100)
    127.0.0.1.12050 > 127.0.0.1.58682: Flags [P.], cksum 0x0df9 (incorrect -> 0xd5bf), seq 101156:105204, ack 971, win 512, options [nop,nop,TS val 3480828230 ecr 3480828230], length 4048
2022-04-07 09:43:48.679311 IP (tos 0x0, ttl 64, id 15751, offset 0, flags [DF], proto TCP (6), length 52)
    127.0.0.1.58682 > 127.0.0.1.12050: Flags [.], cksum 0xfe28 (incorrect -> 0x12c8), seq 971, ack 105204, win 512, options [nop,nop,TS val 3480828231 ecr 3480828230], length 0
2022-04-07 09:43:48.679315 IP (tos 0x0, ttl 64, id 17816, offset 0, flags [DF], proto TCP (6), length 486)
    127.0.0.1.12050 > 127.0.0.1.58682: Flags [P.], cksum 0xffda (incorrect -> 0x85b5), seq 105204:105638, ack 971, win 512, options [nop,nop,TS val 3480828231 ecr 3480828231], length 434
2022-04-07 09:43:48.679317 IP (tos 0x0, ttl 64, id 15752, offset 0, flags [DF], proto TCP (6), length 52)
    127.0.0.1.58682 > 127.0.0.1.12050: Flags [.], cksum 0xfe28 (incorrect -> 0x1115), seq 971, ack 105638, win 512, options [nop,nop,TS val 3480828231 ecr 3480828231], length 0
2022-04-07 09:43:48.679364 IP (tos 0x0, ttl 64, id 17817, offset 0, flags [DF], proto TCP (6), length 4100)
    127.0.0.1.12050 > 127.0.0.1.58682: Flags [P.], cksum 0x0df9 (incorrect -> 0x9df0), seq 105638:109686, ack 971, win 512, options [nop,nop,TS val 3480828231 ecr 3480828231], length 4048
2022-04-07 09:43:48.679420 IP (tos 0x0, ttl 64, id 15753, offset 0, flags [DF], proto TCP (6), length 52)
    127.0.0.1.58682 > 127.0.0.1.12050: Flags [.], cksum 0xfe28 (incorrect -> 0x0145), seq 971, ack 109686, win 512, options [nop,nop,TS val 3480828231 ecr 3480828231], length 0
2022-04-07 09:43:48.679424 IP (tos 0x0, ttl 64, id 17818, offset 0, flags [DF], proto TCP (6), length 11758)
    127.0.0.1.12050 > 127.0.0.1.58682: Flags [P.], cksum 0x2be3 (incorrect -> 0xdfd3), seq 109686:121392, ack 971, win 512, options [nop,nop,TS val 3480828231 ecr 3480828231], length 11706
2022-04-07 09:43:48.679811 IP (tos 0x0, ttl 64, id 15754, offset 0, flags [DF], proto TCP (6), length 52)
    127.0.0.1.58682 > 127.0.0.1.12050: Flags [.], cksum 0xfe28 (incorrect -> 0xd38a), seq 971, ack 121392, win 512, options [nop,nop,TS val 3480828231 ecr 3480828231], length 0
200, 131.9099292755127, 0.45397067070007324