2022-04-07 09:19:35.654899 IP (tos 0x0, ttl 64, id 38944, offset 0, flags [DF], proto TCP (6), length 60)
    127.0.0.1.46300 > 127.0.0.1.11550: Flags [S], cksum 0xfe30 (incorrect -> 0x153b), seq 1694766846, win 65495, options [mss 65495,sackOK,TS val 3479375206 ecr 0,nop,wscale 7], length 0
2022-04-07 09:19:35.654907 IP (tos 0x0, ttl 64, id 0, offset 0, flags [DF], proto TCP (6), length 60)
    127.0.0.1.11550 > 127.0.0.1.46300: Flags [S.], cksum 0xfe30 (incorrect -> 0x9cf3), seq 2114329970, ack 1694766847, win 65483, options [mss 65495,sackOK,TS val 3479375206 ecr 3479375206,nop,wscale 7], length 0
2022-04-07 09:19:35.654914 IP (tos 0x0, ttl 64, id 38945, offset 0, flags [DF], proto TCP (6), length 52)
    127.0.0.1.46300 > 127.0.0.1.11550: Flags [.], cksum 0xfe28 (incorrect -> 0xc3af), seq 1, ack 1, win 512, options [nop,nop,TS val 3479375206 ecr 3479375206], length 0
2022-04-07 09:19:35.655050 IP (tos 0x0, ttl 64, id 38946, offset 0, flags [DF], proto TCP (6), length 55)
    127.0.0.1.46300 > 127.0.0.1.11550: Flags [P.], cksum 0xfe2b (incorrect -> 0xbea3), seq 1:4, ack 1, win 512, options [nop,nop,TS val 3479375206 ecr 3479375206], length 3
2022-04-07 09:19:35.655054 IP (tos 0x0, ttl 64, id 58378, offset 0, flags [DF], proto TCP (6), length 52)
    127.0.0.1.11550 > 127.0.0.1.46300: Flags [.], cksum 0xfe28 (incorrect -> 0xc3ac), seq 1, ack 4, win 512, options [nop,nop,TS val 3479375206 ecr 3479375206], length 0
2022-04-07 09:19:35.655074 IP (tos 0x0, ttl 64, id 58379, offset 0, flags [DF], proto TCP (6), length 54)
    127.0.0.1.11550 > 127.0.0.1.46300: Flags [P.], cksum 0xfe2a (incorrect -> 0xbea2), seq 1:3, ack 4, win 512, options [nop,nop,TS val 3479375206 ecr 3479375206], length 2
2022-04-07 09:19:35.655080 IP (tos 0x0, ttl 64, id 38947, offset 0, flags [DF], proto TCP (6), length 52)
    127.0.0.1.46300 > 127.0.0.1.11550: Flags [.], cksum 0xfe28 (incorrect -> 0xc3aa), seq 4, ack 3, win 512, options [nop,nop,TS val 3479375206 ecr 3479375206], length 0
2022-04-07 09:19:35.656291 IP (tos 0x0, ttl 64, id 38948, offset 0, flags [DF], proto TCP (6), length 62)
    127.0.0.1.46300 > 127.0.0.1.11550: Flags [P.], cksum 0xfe32 (incorrect -> 0xc524), seq 4:14, ack 3, win 512, options [nop,nop,TS val 3479375208 ecr 3479375206], length 10
2022-04-07 09:19:35.656298 IP (tos 0x0, ttl 64, id 58380, offset 0, flags [DF], proto TCP (6), length 52)
    127.0.0.1.11550 > 127.0.0.1.46300: Flags [.], cksum 0xfe28 (incorrect -> 0xc39c), seq 3, ack 14, win 512, options [nop,nop,TS val 3479375208 ecr 3479375208], length 0
2022-04-07 09:19:35.764196 IP (tos 0x0, ttl 64, id 58381, offset 0, flags [DF], proto TCP (6), length 62)
    127.0.0.1.11550 > 127.0.0.1.46300: Flags [P.], cksum 0xfe32 (incorrect -> 0xbe1e), seq 3:13, ack 14, win 512, options [nop,nop,TS val 3479375315 ecr 3479375208], length 10
2022-04-07 09:19:35.764202 IP (tos 0x0, ttl 64, id 38949, offset 0, flags [DF], proto TCP (6), length 52)
    127.0.0.1.46300 > 127.0.0.1.11550: Flags [.], cksum 0xfe28 (incorrect -> 0xc2bc), seq 14, ack 13, win 512, options [nop,nop,TS val 3479375315 ecr 3479375315], length 0
2022-04-07 09:19:35.769623 IP (tos 0x0, ttl 64, id 38950, offset 0, flags [DF], proto TCP (6), length 569)
    127.0.0.1.46300 > 127.0.0.1.11550: Flags [P.], cksum 0x002e (incorrect -> 0x6e0e), seq 14:531, ack 13, win 512, options [nop,nop,TS val 3479375321 ecr 3479375315], length 517
2022-04-07 09:19:35.769630 IP (tos 0x0, ttl 64, id 58382, offset 0, flags [DF], proto TCP (6), length 52)
    127.0.0.1.11550 > 127.0.0.1.46300: Flags [.], cksum 0xfe28 (incorrect -> 0xc0af), seq 13, ack 531, win 508, options [nop,nop,TS val 3479375321 ecr 3479375321], length 0
2022-04-07 09:19:35.881925 IP (tos 0x0, ttl 64, id 58383, offset 0, flags [DF], proto TCP (6), length 3538)
    127.0.0.1.11550 > 127.0.0.1.46300: Flags [P.], cksum 0x0bc7 (incorrect -> 0x6fc1), seq 13:3499, ack 531, win 512, options [nop,nop,TS val 3479375433 ecr 3479375321], length 3486
2022-04-07 09:19:35.881931 IP (tos 0x0, ttl 64, id 38951, offset 0, flags [DF], proto TCP (6), length 52)
    127.0.0.1.46300 > 127.0.0.1.11550: Flags [.], cksum 0xfe28 (incorrect -> 0xb23f), seq 531, ack 3499, win 494, options [nop,nop,TS val 3479375433 ecr 3479375433], length 0
2022-04-07 09:19:35.917325 IP (tos 0x0, ttl 64, id 58384, offset 0, flags [DF], proto TCP (6), length 64)
    127.0.0.1.11550 > 127.0.0.1.46300: Flags [P.], cksum 0xfe34 (incorrect -> 0x104f), seq 3499:3511, ack 531, win 512, options [nop,nop,TS val 3479375469 ecr 3479375433], length 12
2022-04-07 09:19:35.917334 IP (tos 0x0, ttl 64, id 38952, offset 0, flags [DF], proto TCP (6), length 52)
    127.0.0.1.46300 > 127.0.0.1.11550: Flags [.], cksum 0xfe28 (incorrect -> 0xb1de), seq 531, ack 3511, win 507, options [nop,nop,TS val 3479375469 ecr 3479375469], length 0
2022-04-07 09:19:35.917621 IP (tos 0x0, ttl 64, id 38953, offset 0, flags [DF], proto TCP (6), length 178)
    127.0.0.1.46300 > 127.0.0.1.11550: Flags [P.], cksum 0xfea6 (incorrect -> 0x27e7), seq 531:657, ack 3511, win 512, options [nop,nop,TS val 3479375469 ecr 3479375469], length 126
2022-04-07 09:19:35.917627 IP (tos 0x0, ttl 64, id 58385, offset 0, flags [DF], proto TCP (6), length 52)
    127.0.0.1.11550 > 127.0.0.1.46300: Flags [.], cksum 0xfe28 (incorrect -> 0xb15b), seq 3511, ack 657, win 512, options [nop,nop,TS val 3479375469 ecr 3479375469], length 0
2022-04-07 09:19:36.025167 IP (tos 0x0, ttl 64, id 58386, offset 0, flags [DF], proto TCP (6), length 103)
    127.0.0.1.11550 > 127.0.0.1.46300: Flags [P.], cksum 0xfe5b (incorrect -> 0xb1b5), seq 3511:3562, ack 657, win 512, options [nop,nop,TS val 3479375576 ecr 3479375469], length 51
2022-04-07 09:19:36.025173 IP (tos 0x0, ttl 64, id 38954, offset 0, flags [DF], proto TCP (6), length 52)
    127.0.0.1.46300 > 127.0.0.1.11550: Flags [.], cksum 0xfe28 (incorrect -> 0xb052), seq 657, ack 3562, win 512, options [nop,nop,TS val 3479375576 ecr 3479375576], length 0
2022-04-07 09:19:36.025504 IP (tos 0x0, ttl 64, id 38955, offset 0, flags [DF], proto TCP (6), length 300)
    127.0.0.1.46300 > 127.0.0.1.11550: Flags [P.], cksum 0xff20 (incorrect -> 0xfb66), seq 657:905, ack 3562, win 512, options [nop,nop,TS val 3479375577 ecr 3479375576], length 248
2022-04-07 09:19:36.025510 IP (tos 0x0, ttl 64, id 58387, offset 0, flags [DF], proto TCP (6), length 52)
    127.0.0.1.11550 > 127.0.0.1.46300: Flags [.], cksum 0xfe28 (incorrect -> 0xaf59), seq 3562, ack 905, win 511, options [nop,nop,TS val 3479375577 ecr 3479375577], length 0
2022-04-07 09:19:36.135827 IP (tos 0x0, ttl 64, id 58388, offset 0, flags [DF], proto TCP (6), length 2948)
    127.0.0.1.11550 > 127.0.0.1.46300: Flags [P.], cksum 0x0979 (incorrect -> 0x0605), seq 3562:6458, ack 905, win 512, options [nop,nop,TS val 3479375687 ecr 3479375577], length 2896
2022-04-07 09:19:36.178778 IP (tos 0x0, ttl 64, id 38956, offset 0, flags [DF], proto TCP (6), length 52)
    127.0.0.1.46300 > 127.0.0.1.11550: Flags [.], cksum 0xfe28 (incorrect -> 0xa301), seq 905, ack 6458, win 512, options [nop,nop,TS val 3479375730 ecr 3479375687], length 0
2022-04-07 09:19:36.178784 IP (tos 0x0, ttl 64, id 58389, offset 0, flags [DF], proto TCP (6), length 7522)
    127.0.0.1.11550 > 127.0.0.1.46300: Flags [P.], cksum 0x1b57 (incorrect -> 0xd6b0), seq 6458:13928, ack 905, win 512, options [nop,nop,TS val 3479375730 ecr 3479375730], length 7470
2022-04-07 09:19:36.178788 IP (tos 0x0, ttl 64, id 38957, offset 0, flags [DF], proto TCP (6), length 52)
    127.0.0.1.46300 > 127.0.0.1.11550: Flags [.], cksum 0xfe28 (incorrect -> 0x85ca), seq 905, ack 13928, win 478, options [nop,nop,TS val 3479375730 ecr 3479375730], length 0
2022-04-07 09:19:36.179016 IP (tos 0x0, ttl 64, id 58390, offset 0, flags [DF], proto TCP (6), length 3538)
    127.0.0.1.11550 > 127.0.0.1.46300: Flags [P.], cksum 0x0bc7 (incorrect -> 0x59be), seq 13928:17414, ack 905, win 512, options [nop,nop,TS val 3479375730 ecr 3479375730], length 3486
2022-04-07 09:19:36.179021 IP (tos 0x0, ttl 64, id 38958, offset 0, flags [DF], proto TCP (6), length 52)
    127.0.0.1.46300 > 127.0.0.1.11550: Flags [.], cksum 0xfe28 (incorrect -> 0x781c), seq 905, ack 17414, win 494, options [nop,nop,TS val 3479375730 ecr 3479375730], length 0
2022-04-07 09:19:36.185304 IP (tos 0x0, ttl 64, id 58391, offset 0, flags [DF], proto TCP (6), length 680)
    127.0.0.1.11550 > 127.0.0.1.46300: Flags [P.], cksum 0x009d (incorrect -> 0x1ab7), seq 17414:18042, ack 905, win 512, options [nop,nop,TS val 3479375737 ecr 3479375730], length 628
2022-04-07 09:19:36.185312 IP (tos 0x0, ttl 64, id 38959, offset 0, flags [DF], proto TCP (6), length 52)
    127.0.0.1.46300 > 127.0.0.1.11550: Flags [.], cksum 0xfe28 (incorrect -> 0x758f), seq 905, ack 18042, win 505, options [nop,nop,TS val 3479375737 ecr 3479375737], length 0
2022-04-07 09:19:36.188184 IP (tos 0x0, ttl 64, id 58392, offset 0, flags [DF], proto TCP (6), length 4100)
    127.0.0.1.11550 > 127.0.0.1.46300: Flags [P.], cksum 0x0df9 (incorrect -> 0xe95d), seq 18042:22090, ack 905, win 512, options [nop,nop,TS val 3479375739 ecr 3479375737], length 4048
2022-04-07 09:19:36.188188 IP (tos 0x0, ttl 64, id 38960, offset 0, flags [DF], proto TCP (6), length 52)
    127.0.0.1.46300 > 127.0.0.1.11550: Flags [.], cksum 0xfe28 (incorrect -> 0x65c8), seq 905, ack 22090, win 492, options [nop,nop,TS val 3479375739 ecr 3479375739], length 0
2022-04-07 09:19:36.188193 IP (tos 0x0, ttl 64, id 58393, offset 0, flags [DF], proto TCP (6), length 3244)
    127.0.0.1.11550 > 127.0.0.1.46300: Flags [P.], cksum 0x0aa1 (incorrect -> 0xffd3), seq 22090:25282, ack 905, win 512, options [nop,nop,TS val 3479375739 ecr 3479375739], length 3192
2022-04-07 09:19:36.188195 IP (tos 0x0, ttl 64, id 38961, offset 0, flags [DF], proto TCP (6), length 52)
    127.0.0.1.46300 > 127.0.0.1.11550: Flags [.], cksum 0xfe28 (incorrect -> 0x595d), seq 905, ack 25282, win 479, options [nop,nop,TS val 3479375739 ecr 3479375739], length 0
2022-04-07 09:19:36.188268 IP (tos 0x0, ttl 64, id 58394, offset 0, flags [DF], proto TCP (6), length 4100)
    127.0.0.1.11550 > 127.0.0.1.46300: Flags [P.], cksum 0x0df9 (incorrect -> 0x8f75), seq 25282:29330, ack 905, win 512, options [nop,nop,TS val 3479375740 ecr 3479375739], length 4048
2022-04-07 09:19:36.188270 IP (tos 0x0, ttl 64, id 38962, offset 0, flags [DF], proto TCP (6), length 52)
    127.0.0.1.46300 > 127.0.0.1.11550: Flags [.], cksum 0xfe28 (incorrect -> 0x499b), seq 905, ack 29330, win 463, options [nop,nop,TS val 3479375740 ecr 3479375740], length 0
2022-04-07 09:19:36.188275 IP (tos 0x0, ttl 64, id 58395, offset 0, flags [DF], proto TCP (6), length 2976)
    127.0.0.1.11550 > 127.0.0.1.46300: Flags [P.], cksum 0x0995 (incorrect -> 0x6263), seq 29330:32254, ack 905, win 512, options [nop,nop,TS val 3479375740 ecr 3479375740], length 2924
2022-04-07 09:19:36.189401 IP (tos 0x0, ttl 64, id 38963, offset 0, flags [DF], proto TCP (6), length 52)
    127.0.0.1.46300 > 127.0.0.1.11550: Flags [.], cksum 0xfe28 (incorrect -> 0x3dfd), seq 905, ack 32254, win 512, options [nop,nop,TS val 3479375741 ecr 3479375740], length 0
2022-04-07 09:19:36.189406 IP (tos 0x0, ttl 64, id 58396, offset 0, flags [DF], proto TCP (6), length 3040)
    127.0.0.1.11550 > 127.0.0.1.46300: Flags [P.], cksum 0x09d5 (incorrect -> 0x6d5c), seq 32254:35242, ack 905, win 512, options [nop,nop,TS val 3479375741 ecr 3479375741], length 2988
2022-04-07 09:19:36.189410 IP (tos 0x0, ttl 64, id 38964, offset 0, flags [DF], proto TCP (6), length 52)
    127.0.0.1.46300 > 127.0.0.1.11550: Flags [.], cksum 0xfe28 (incorrect -> 0x3250), seq 905, ack 35242, win 512, options [nop,nop,TS val 3479375741 ecr 3479375741], length 0
2022-04-07 09:19:36.193308 IP (tos 0x0, ttl 64, id 58397, offset 0, flags [DF], proto TCP (6), length 2044)
    127.0.0.1.11550 > 127.0.0.1.46300: Flags [P.], cksum 0x05f1 (incorrect -> 0x2136), seq 35242:37234, ack 905, win 512, options [nop,nop,TS val 3479375745 ecr 3479375741], length 1992
2022-04-07 09:19:36.193804 IP (tos 0x0, ttl 64, id 38965, offset 0, flags [DF], proto TCP (6), length 52)
    127.0.0.1.46300 > 127.0.0.1.11550: Flags [.], cksum 0xfe28 (incorrect -> 0x2a80), seq 905, ack 37234, win 512, options [nop,nop,TS val 3479375745 ecr 3479375745], length 0
2022-04-07 09:19:36.197873 IP (tos 0x0, ttl 64, id 58398, offset 0, flags [DF], proto TCP (6), length 4036)
    127.0.0.1.11550 > 127.0.0.1.46300: Flags [P.], cksum 0x0db9 (incorrect -> 0xee27), seq 37234:41218, ack 905, win 512, options [nop,nop,TS val 3479375749 ecr 3479375745], length 3984
2022-04-07 09:19:36.197886 IP (tos 0x0, ttl 64, id 38966, offset 0, flags [DF], proto TCP (6), length 52)
    127.0.0.1.46300 > 127.0.0.1.11550: Flags [.], cksum 0xfe28 (incorrect -> 0x1ae8), seq 905, ack 41218, win 512, options [nop,nop,TS val 3479375749 ecr 3479375749], length 0
2022-04-07 09:19:36.210338 IP (tos 0x0, ttl 64, id 58399, offset 0, flags [DF], proto TCP (6), length 3438)
    127.0.0.1.11550 > 127.0.0.1.46300: Flags [P.], cksum 0x0b63 (incorrect -> 0x4da9), seq 41218:44604, ack 905, win 512, options [nop,nop,TS val 3479375762 ecr 3479375749], length 3386
2022-04-07 09:19:36.210350 IP (tos 0x0, ttl 64, id 38967, offset 0, flags [DF], proto TCP (6), length 52)
    127.0.0.1.46300 > 127.0.0.1.11550: Flags [.], cksum 0xfe28 (incorrect -> 0x0d94), seq 905, ack 44604, win 512, options [nop,nop,TS val 3479375762 ecr 3479375762], length 0
2022-04-07 09:19:36.227708 IP (tos 0x0, ttl 64, id 58400, offset 0, flags [DF], proto TCP (6), length 2450)
    127.0.0.1.11550 > 127.0.0.1.46300: Flags [P.], cksum 0x0787 (incorrect -> 0x0114), seq 44604:47002, ack 905, win 512, options [nop,nop,TS val 3479375779 ecr 3479375762], length 2398
2022-04-07 09:19:36.227721 IP (tos 0x0, ttl 64, id 38968, offset 0, flags [DF], proto TCP (6), length 52)
    127.0.0.1.46300 > 127.0.0.1.11550: Flags [.], cksum 0xfe28 (incorrect -> 0x0414), seq 905, ack 47002, win 512, options [nop,nop,TS val 3479375779 ecr 3479375779], length 0
2022-04-07 09:19:36.236204 IP (tos 0x0, ttl 64, id 58401, offset 0, flags [DF], proto TCP (6), length 4100)
    127.0.0.1.11550 > 127.0.0.1.46300: Flags [P.], cksum 0x0df9 (incorrect -> 0xfe2b), seq 47002:51050, ack 905, win 512, options [nop,nop,TS val 3479375787 ecr 3479375779], length 4048
2022-04-07 09:19:36.236241 IP (tos 0x0, ttl 64, id 38969, offset 0, flags [DF], proto TCP (6), length 52)
    127.0.0.1.46300 > 127.0.0.1.11550: Flags [.], cksum 0xfe28 (incorrect -> 0xf432), seq 905, ack 51050, win 512, options [nop,nop,TS val 3479375788 ecr 3479375787], length 0
2022-04-07 09:19:36.236245 IP (tos 0x0, ttl 64, id 58402, offset 0, flags [DF], proto TCP (6), length 7274)
    127.0.0.1.11550 > 127.0.0.1.46300: Flags [P.], cksum 0x1a5f (incorrect -> 0xe5c8), seq 51050:58272, ack 905, win 512, options [nop,nop,TS val 3479375788 ecr 3479375788], length 7222
2022-04-07 09:19:36.236507 IP (tos 0x0, ttl 64, id 38970, offset 0, flags [DF], proto TCP (6), length 52)
    127.0.0.1.46300 > 127.0.0.1.11550: Flags [.], cksum 0xfe28 (incorrect -> 0xd7fb), seq 905, ack 58272, win 512, options [nop,nop,TS val 3479375788 ecr 3479375788], length 0
2022-04-07 09:19:36.236511 IP (tos 0x0, ttl 64, id 58403, offset 0, flags [DF], proto TCP (6), length 4534)
    127.0.0.1.11550 > 127.0.0.1.46300: Flags [P.], cksum 0x0fab (incorrect -> 0xc1fa), seq 58272:62754, ack 905, win 512, options [nop,nop,TS val 3479375788 ecr 3479375788], length 4482
2022-04-07 09:19:36.236515 IP (tos 0x0, ttl 64, id 38971, offset 0, flags [DF], proto TCP (6), length 52)
    127.0.0.1.46300 > 127.0.0.1.11550: Flags [.], cksum 0xfe28 (incorrect -> 0xc679), seq 905, ack 62754, win 512, options [nop,nop,TS val 3479375788 ecr 3479375788], length 0
2022-04-07 09:19:36.239159 IP (tos 0x0, ttl 64, id 58404, offset 0, flags [DF], proto TCP (6), length 4100)
    127.0.0.1.11550 > 127.0.0.1.46300: Flags [P.], cksum 0x0df9 (incorrect -> 0x65ab), seq 62754:66802, ack 905, win 512, options [nop,nop,TS val 3479375790 ecr 3479375788], length 4048
2022-04-07 09:19:36.239251 IP (tos 0x0, ttl 64, id 38972, offset 0, flags [DF], proto TCP (6), length 52)
    127.0.0.1.46300 > 127.0.0.1.11550: Flags [.], cksum 0xfe28 (incorrect -> 0xb6a4), seq 905, ack 66802, win 512, options [nop,nop,TS val 3479375791 ecr 3479375790], length 0
2022-04-07 09:19:36.239257 IP (tos 0x0, ttl 64, id 58405, offset 0, flags [DF], proto TCP (6), length 14782)
    127.0.0.1.11550 > 127.0.0.1.46300: Flags [P.], cksum 0x37b3 (incorrect -> 0x7595), seq 66802:81532, ack 905, win 512, options [nop,nop,TS val 3479375791 ecr 3479375791], length 14730
2022-04-07 09:19:36.282785 IP (tos 0x0, ttl 64, id 38973, offset 0, flags [DF], proto TCP (6), length 52)
    127.0.0.1.46300 > 127.0.0.1.11550: Flags [.], cksum 0xfe28 (incorrect -> 0x7cee), seq 905, ack 81532, win 512, options [nop,nop,TS val 3479375834 ecr 3479375791], length 0
2022-04-07 09:19:36.282794 IP (tos 0x0, ttl 64, id 58406, offset 0, flags [DF], proto TCP (6), length 23442)
    127.0.0.1.11550 > 127.0.0.1.46300: Flags [P.], cksum 0x5987 (incorrect -> 0xf5de), seq 81532:104922, ack 905, win 512, options [nop,nop,TS val 3479375834 ecr 3479375834], length 23390
2022-04-07 09:19:36.326780 IP (tos 0x0, ttl 64, id 38974, offset 0, flags [DF], proto TCP (6), length 52)
    127.0.0.1.46300 > 127.0.0.1.11550: Flags [.], cksum 0xfe28 (incorrect -> 0x2139), seq 905, ack 104922, win 512, options [nop,nop,TS val 3479375878 ecr 3479375834], length 0
200, 122.2932550907135, 0.6774349212646484