2022-04-07 12:27:07.048908 IP (tos 0x0, ttl 64, id 17673, offset 0, flags [DF], proto TCP (6), length 60)
    127.0.0.1.34726 > 127.0.0.1.9150: Flags [S], cksum 0xfe30 (incorrect -> 0x1e0f), seq 2561499561, win 65495, options [mss 65495,sackOK,TS val 3490626600 ecr 0,nop,wscale 7], length 0
2022-04-07 12:27:07.048920 IP (tos 0x0, ttl 64, id 0, offset 0, flags [DF], proto TCP (6), length 60)
    127.0.0.1.9150 > 127.0.0.1.34726: Flags [S.], cksum 0xfe30 (incorrect -> 0x0912), seq 3740772808, ack 2561499562, win 65483, options [mss 65495,sackOK,TS val 3490626600 ecr 3490626600,nop,wscale 7], length 0
2022-04-07 12:27:07.048930 IP (tos 0x0, ttl 64, id 17674, offset 0, flags [DF], proto TCP (6), length 52)
    127.0.0.1.34726 > 127.0.0.1.9150: Flags [.], cksum 0xfe28 (incorrect -> 0x2fce), seq 1, ack 1, win 512, options [nop,nop,TS val 3490626600 ecr 3490626600], length 0
2022-04-07 12:27:07.049057 IP (tos 0x0, ttl 64, id 17675, offset 0, flags [DF], proto TCP (6), length 55)
    127.0.0.1.34726 > 127.0.0.1.9150: Flags [P.], cksum 0xfe2b (incorrect -> 0x2ac2), seq 1:4, ack 1, win 512, options [nop,nop,TS val 3490626600 ecr 3490626600], length 3
2022-04-07 12:27:07.049071 IP (tos 0x0, ttl 64, id 27452, offset 0, flags [DF], proto TCP (6), length 52)
    127.0.0.1.9150 > 127.0.0.1.34726: Flags [.], cksum 0xfe28 (incorrect -> 0x2fcb), seq 1, ack 4, win 512, options [nop,nop,TS val 3490626600 ecr 3490626600], length 0
2022-04-07 12:27:07.049108 IP (tos 0x0, ttl 64, id 27453, offset 0, flags [DF], proto TCP (6), length 54)
    127.0.0.1.9150 > 127.0.0.1.34726: Flags [P.], cksum 0xfe2a (incorrect -> 0x2ac1), seq 1:3, ack 4, win 512, options [nop,nop,TS val 3490626600 ecr 3490626600], length 2
2022-04-07 12:27:07.049126 IP (tos 0x0, ttl 64, id 17676, offset 0, flags [DF], proto TCP (6), length 52)
    127.0.0.1.34726 > 127.0.0.1.9150: Flags [.], cksum 0xfe28 (incorrect -> 0x2fc9), seq 4, ack 3, win 512, options [nop,nop,TS val 3490626600 ecr 3490626600], length 0
2022-04-07 12:27:07.050434 IP (tos 0x0, ttl 64, id 17677, offset 0, flags [DF], proto TCP (6), length 62)
    127.0.0.1.34726 > 127.0.0.1.9150: Flags [P.], cksum 0xfe32 (incorrect -> 0x58ac), seq 4:14, ack 3, win 512, options [nop,nop,TS val 3490626602 ecr 3490626600], length 10
2022-04-07 12:27:07.050444 IP (tos 0x0, ttl 64, id 27454, offset 0, flags [DF], proto TCP (6), length 52)
    127.0.0.1.9150 > 127.0.0.1.34726: Flags [.], cksum 0xfe28 (incorrect -> 0x2fbb), seq 3, ack 14, win 512, options [nop,nop,TS val 3490626602 ecr 3490626602], length 0
200, 3.872371196746826, 1.0095136165618896