2022-04-07 01:42:50.828933 IP (tos 0x0, ttl 64, id 4426, offset 0, flags [DF], proto TCP (6), length 60)
    127.0.0.1.42296 > 127.0.0.1.11650: Flags [S], cksum 0xfe30 (incorrect -> 0x4b83), seq 713051624, win 65495, options [mss 65495,sackOK,TS val 378053331 ecr 0,nop,wscale 7], length 0
2022-04-07 01:42:50.828945 IP (tos 0x0, ttl 64, id 0, offset 0, flags [DF], proto TCP (6), length 60)
    127.0.0.1.11650 > 127.0.0.1.42296: Flags [S.], cksum 0xfe30 (incorrect -> 0x01f3), seq 2596402541, ack 713051625, win 65483, options [mss 65495,sackOK,TS val 378053331 ecr 378053331,nop,wscale 7], length 0
2022-04-07 01:42:50.828954 IP (tos 0x0, ttl 64, id 4427, offset 0, flags [DF], proto TCP (6), length 52)
    127.0.0.1.42296 > 127.0.0.1.11650: Flags [.], cksum 0xfe28 (incorrect -> 0x28af), seq 1, ack 1, win 512, options [nop,nop,TS val 378053331 ecr 378053331], length 0
2022-04-07 01:42:50.829065 IP (tos 0x0, ttl 64, id 4428, offset 0, flags [DF], proto TCP (6), length 55)
    127.0.0.1.42296 > 127.0.0.1.11650: Flags [P.], cksum 0xfe2b (incorrect -> 0x23a2), seq 1:4, ack 1, win 512, options [nop,nop,TS val 378053332 ecr 378053331], length 3
2022-04-07 01:42:50.829083 IP (tos 0x0, ttl 64, id 794, offset 0, flags [DF], proto TCP (6), length 52)
    127.0.0.1.11650 > 127.0.0.1.42296: Flags [.], cksum 0xfe28 (incorrect -> 0x28aa), seq 1, ack 4, win 512, options [nop,nop,TS val 378053332 ecr 378053332], length 0
2022-04-07 01:42:50.829118 IP (tos 0x0, ttl 64, id 795, offset 0, flags [DF], proto TCP (6), length 54)
    127.0.0.1.11650 > 127.0.0.1.42296: Flags [P.], cksum 0xfe2a (incorrect -> 0x23a0), seq 1:3, ack 4, win 512, options [nop,nop,TS val 378053332 ecr 378053332], length 2
2022-04-07 01:42:50.829133 IP (tos 0x0, ttl 64, id 4429, offset 0, flags [DF], proto TCP (6), length 52)
    127.0.0.1.42296 > 127.0.0.1.11650: Flags [.], cksum 0xfe28 (incorrect -> 0x28a8), seq 4, ack 3, win 512, options [nop,nop,TS val 378053332 ecr 378053332], length 0
2022-04-07 01:42:50.860706 IP (tos 0x0, ttl 64, id 4430, offset 0, flags [DF], proto TCP (6), length 62)
    127.0.0.1.42296 > 127.0.0.1.11650: Flags [P.], cksum 0xfe32 (incorrect -> 0xe6ec), seq 4:14, ack 3, win 512, options [nop,nop,TS val 378053363 ecr 378053332], length 10
2022-04-07 01:42:50.860716 IP (tos 0x0, ttl 64, id 796, offset 0, flags [DF], proto TCP (6), length 52)
    127.0.0.1.11650 > 127.0.0.1.42296: Flags [.], cksum 0xfe28 (incorrect -> 0x2860), seq 3, ack 14, win 512, options [nop,nop,TS val 378053363 ecr 378053363], length 0
2022-04-07 01:42:50.997006 IP (tos 0x0, ttl 64, id 797, offset 0, flags [DF], proto TCP (6), length 62)
    127.0.0.1.11650 > 127.0.0.1.42296: Flags [P.], cksum 0xfe32 (incorrect -> 0x22c5), seq 3:13, ack 14, win 512, options [nop,nop,TS val 378053499 ecr 378053363], length 10
2022-04-07 01:42:50.997017 IP (tos 0x0, ttl 64, id 4431, offset 0, flags [DF], proto TCP (6), length 52)
    127.0.0.1.42296 > 127.0.0.1.11650: Flags [.], cksum 0xfe28 (incorrect -> 0x2746), seq 14, ack 13, win 512, options [nop,nop,TS val 378053499 ecr 378053499], length 0
200, 3.944962978363037, 0.9793031215667725