2022-04-07 14:18:20.043347 IP (tos 0x0, ttl 64, id 42360, offset 0, flags [DF], proto TCP (6), length 60)
    127.0.0.1.53154 > 127.0.0.1.10550: Flags [S], cksum 0xfe30 (incorrect -> 0x06f6), seq 867155331, win 65495, options [mss 65495,sackOK,TS val 3497299595 ecr 0,nop,wscale 7], length 0
2022-04-07 14:18:20.043359 IP (tos 0x0, ttl 64, id 0, offset 0, flags [DF], proto TCP (6), length 60)
    127.0.0.1.10550 > 127.0.0.1.53154: Flags [S.], cksum 0xfe30 (incorrect -> 0xb66e), seq 887536795, ack 867155332, win 65483, options [mss 65495,sackOK,TS val 3497299595 ecr 3497299595,nop,wscale 7], length 0
2022-04-07 14:18:20.043369 IP (tos 0x0, ttl 64, id 42361, offset 0, flags [DF], proto TCP (6), length 52)
    127.0.0.1.53154 > 127.0.0.1.10550: Flags [.], cksum 0xfe28 (incorrect -> 0xdd2a), seq 1, ack 1, win 512, options [nop,nop,TS val 3497299595 ecr 3497299595], length 0
2022-04-07 14:18:20.043481 IP (tos 0x0, ttl 64, id 42362, offset 0, flags [DF], proto TCP (6), length 55)
    127.0.0.1.53154 > 127.0.0.1.10550: Flags [P.], cksum 0xfe2b (incorrect -> 0xd81e), seq 1:4, ack 1, win 512, options [nop,nop,TS val 3497299595 ecr 3497299595], length 3
2022-04-07 14:18:20.043497 IP (tos 0x0, ttl 64, id 31232, offset 0, flags [DF], proto TCP (6), length 52)
    127.0.0.1.10550 > 127.0.0.1.53154: Flags [.], cksum 0xfe28 (incorrect -> 0xdd27), seq 1, ack 4, win 512, options [nop,nop,TS val 3497299595 ecr 3497299595], length 0
2022-04-07 14:18:20.043568 IP (tos 0x0, ttl 64, id 31233, offset 0, flags [DF], proto TCP (6), length 54)
    127.0.0.1.10550 > 127.0.0.1.53154: Flags [P.], cksum 0xfe2a (incorrect -> 0xd81d), seq 1:3, ack 4, win 512, options [nop,nop,TS val 3497299595 ecr 3497299595], length 2
2022-04-07 14:18:20.043595 IP (tos 0x0, ttl 64, id 42363, offset 0, flags [DF], proto TCP (6), length 52)
    127.0.0.1.53154 > 127.0.0.1.10550: Flags [.], cksum 0xfe28 (incorrect -> 0xdd25), seq 4, ack 3, win 512, options [nop,nop,TS val 3497299595 ecr 3497299595], length 0
2022-04-07 14:18:20.066455 IP (tos 0x0, ttl 64, id 42364, offset 0, flags [DF], proto TCP (6), length 62)
    127.0.0.1.53154 > 127.0.0.1.10550: Flags [P.], cksum 0xfe32 (incorrect -> 0x6aa0), seq 4:14, ack 3, win 512, options [nop,nop,TS val 3497299618 ecr 3497299595], length 10
2022-04-07 14:18:20.066471 IP (tos 0x0, ttl 64, id 31234, offset 0, flags [DF], proto TCP (6), length 52)
    127.0.0.1.10550 > 127.0.0.1.53154: Flags [.], cksum 0xfe28 (incorrect -> 0xdced), seq 3, ack 14, win 512, options [nop,nop,TS val 3497299618 ecr 3497299618], length 0
2022-04-07 14:18:20.129256 IP (tos 0x0, ttl 64, id 31235, offset 0, flags [DF], proto TCP (6), length 62)
    127.0.0.1.10550 > 127.0.0.1.53154: Flags [P.], cksum 0xfe32 (incorrect -> 0xd79b), seq 3:13, ack 14, win 512, options [nop,nop,TS val 3497299681 ecr 3497299618], length 10
2022-04-07 14:18:20.129272 IP (tos 0x0, ttl 64, id 42365, offset 0, flags [DF], proto TCP (6), length 52)
    127.0.0.1.53154 > 127.0.0.1.10550: Flags [.], cksum 0xfe28 (incorrect -> 0xdc65), seq 14, ack 13, win 512, options [nop,nop,TS val 3497299681 ecr 3497299681], length 0
2022-04-07 14:18:20.135428 IP (tos 0x0, ttl 64, id 42366, offset 0, flags [DF], proto TCP (6), length 569)
    127.0.0.1.53154 > 127.0.0.1.10550: Flags [P.], cksum 0x002e (incorrect -> 0x5451), seq 14:531, ack 13, win 512, options [nop,nop,TS val 3497299687 ecr 3497299681], length 517
2022-04-07 14:18:20.135455 IP (tos 0x0, ttl 64, id 31236, offset 0, flags [DF], proto TCP (6), length 52)
    127.0.0.1.10550 > 127.0.0.1.53154: Flags [.], cksum 0xfe28 (incorrect -> 0xda58), seq 13, ack 531, win 508, options [nop,nop,TS val 3497299687 ecr 3497299687], length 0
2022-04-07 14:18:20.200136 IP (tos 0x0, ttl 64, id 31237, offset 0, flags [DF], proto TCP (6), length 3538)
    127.0.0.1.10550 > 127.0.0.1.53154: Flags [P.], cksum 0x0bc7 (incorrect -> 0x3885), seq 13:3499, ack 531, win 512, options [nop,nop,TS val 3497299751 ecr 3497299687], length 3486
2022-04-07 14:18:20.200148 IP (tos 0x0, ttl 64, id 42367, offset 0, flags [DF], proto TCP (6), length 52)
    127.0.0.1.53154 > 127.0.0.1.10550: Flags [.], cksum 0xfe28 (incorrect -> 0xcc48), seq 531, ack 3499, win 494, options [nop,nop,TS val 3497299751 ecr 3497299751], length 0
2022-04-07 14:18:20.215200 IP (tos 0x0, ttl 64, id 31238, offset 0, flags [DF], proto TCP (6), length 662)
    127.0.0.1.10550 > 127.0.0.1.53154: Flags [P.], cksum 0x008b (incorrect -> 0xa80f), seq 3499:4109, ack 531, win 512, options [nop,nop,TS val 3497299766 ecr 3497299751], length 610
2022-04-07 14:18:20.215207 IP (tos 0x0, ttl 64, id 42368, offset 0, flags [DF], proto TCP (6), length 52)
    127.0.0.1.53154 > 127.0.0.1.10550: Flags [.], cksum 0xfe28 (incorrect -> 0xc9bd), seq 531, ack 4109, win 505, options [nop,nop,TS val 3497299766 ecr 3497299766], length 0
200, 3.796612501144409, 0.6253361701965332