2022-04-07 16:04:44.961319 IP (tos 0x0, ttl 64, id 38316, offset 0, flags [DF], proto TCP (6), length 60)
    127.0.0.1.35646 > 127.0.0.1.10150: Flags [S], cksum 0xfe30 (incorrect -> 0x1a28), seq 1084192222, win 65495, options [mss 65495,sackOK,TS val 3503684513 ecr 0,nop,wscale 7], length 0
2022-04-07 16:04:44.961329 IP (tos 0x0, ttl 64, id 0, offset 0, flags [DF], proto TCP (6), length 60)
    127.0.0.1.10150 > 127.0.0.1.35646: Flags [S.], cksum 0xfe30 (incorrect -> 0x56dc), seq 3933604952, ack 1084192223, win 65483, options [mss 65495,sackOK,TS val 3503684513 ecr 3503684513,nop,wscale 7], length 0
2022-04-07 16:04:44.961337 IP (tos 0x0, ttl 64, id 38317, offset 0, flags [DF], proto TCP (6), length 52)
    127.0.0.1.35646 > 127.0.0.1.10150: Flags [.], cksum 0xfe28 (incorrect -> 0x7d98), seq 1, ack 1, win 512, options [nop,nop,TS val 3503684513 ecr 3503684513], length 0
2022-04-07 16:04:44.961437 IP (tos 0x0, ttl 64, id 38318, offset 0, flags [DF], proto TCP (6), length 55)
    127.0.0.1.35646 > 127.0.0.1.10150: Flags [P.], cksum 0xfe2b (incorrect -> 0x788c), seq 1:4, ack 1, win 512, options [nop,nop,TS val 3503684513 ecr 3503684513], length 3
2022-04-07 16:04:44.961443 IP (tos 0x0, ttl 64, id 40519, offset 0, flags [DF], proto TCP (6), length 52)
    127.0.0.1.10150 > 127.0.0.1.35646: Flags [.], cksum 0xfe28 (incorrect -> 0x7d95), seq 1, ack 4, win 512, options [nop,nop,TS val 3503684513 ecr 3503684513], length 0
2022-04-07 16:04:44.961518 IP (tos 0x0, ttl 64, id 40520, offset 0, flags [DF], proto TCP (6), length 54)
    127.0.0.1.10150 > 127.0.0.1.35646: Flags [P.], cksum 0xfe2a (incorrect -> 0x788b), seq 1:3, ack 4, win 512, options [nop,nop,TS val 3503684513 ecr 3503684513], length 2
2022-04-07 16:04:44.961524 IP (tos 0x0, ttl 64, id 38319, offset 0, flags [DF], proto TCP (6), length 52)
    127.0.0.1.35646 > 127.0.0.1.10150: Flags [.], cksum 0xfe28 (incorrect -> 0x7d93), seq 4, ack 3, win 512, options [nop,nop,TS val 3503684513 ecr 3503684513], length 0
2022-04-07 16:04:44.962185 IP (tos 0x0, ttl 64, id 38320, offset 0, flags [DF], proto TCP (6), length 62)
    127.0.0.1.35646 > 127.0.0.1.10150: Flags [P.], cksum 0xfe32 (incorrect -> 0xe3fc), seq 4:14, ack 3, win 512, options [nop,nop,TS val 3503684513 ecr 3503684513], length 10
2022-04-07 16:04:44.962194 IP (tos 0x0, ttl 64, id 40521, offset 0, flags [DF], proto TCP (6), length 52)
    127.0.0.1.10150 > 127.0.0.1.35646: Flags [.], cksum 0xfe28 (incorrect -> 0x7d89), seq 3, ack 14, win 512, options [nop,nop,TS val 3503684513 ecr 3503684513], length 0
2022-04-07 16:04:45.024951 IP (tos 0x0, ttl 64, id 40522, offset 0, flags [DF], proto TCP (6), length 62)
    127.0.0.1.10150 > 127.0.0.1.35646: Flags [P.], cksum 0xfe32 (incorrect -> 0x7837), seq 3:13, ack 14, win 512, options [nop,nop,TS val 3503684576 ecr 3503684513], length 10
2022-04-07 16:04:45.024967 IP (tos 0x0, ttl 64, id 38321, offset 0, flags [DF], proto TCP (6), length 52)
    127.0.0.1.35646 > 127.0.0.1.10150: Flags [.], cksum 0xfe28 (incorrect -> 0x7d01), seq 14, ack 13, win 512, options [nop,nop,TS val 3503684576 ecr 3503684576], length 0
2022-04-07 16:04:45.030662 IP (tos 0x0, ttl 64, id 38322, offset 0, flags [DF], proto TCP (6), length 569)
    127.0.0.1.35646 > 127.0.0.1.10150: Flags [P.], cksum 0x002e (incorrect -> 0xc56a), seq 14:531, ack 13, win 512, options [nop,nop,TS val 3503684582 ecr 3503684576], length 517
2022-04-07 16:04:45.030674 IP (tos 0x0, ttl 64, id 40523, offset 0, flags [DF], proto TCP (6), length 52)
    127.0.0.1.10150 > 127.0.0.1.35646: Flags [.], cksum 0xfe28 (incorrect -> 0x7af4), seq 13, ack 531, win 508, options [nop,nop,TS val 3503684582 ecr 3503684582], length 0
2022-04-07 16:04:45.100403 IP (tos 0x0, ttl 64, id 40524, offset 0, flags [DF], proto TCP (6), length 3538)
    127.0.0.1.10150 > 127.0.0.1.35646: Flags [P.], cksum 0x0bc7 (incorrect -> 0x854d), seq 13:3499, ack 531, win 512, options [nop,nop,TS val 3503684652 ecr 3503684582], length 3486
2022-04-07 16:04:45.100413 IP (tos 0x0, ttl 64, id 38323, offset 0, flags [DF], proto TCP (6), length 52)
    127.0.0.1.35646 > 127.0.0.1.10150: Flags [.], cksum 0xfe28 (incorrect -> 0x6cd8), seq 531, ack 3499, win 494, options [nop,nop,TS val 3503684652 ecr 3503684652], length 0
2022-04-07 16:04:45.114017 IP (tos 0x0, ttl 64, id 40525, offset 0, flags [DF], proto TCP (6), length 1048)
    127.0.0.1.10150 > 127.0.0.1.35646: Flags [P.], cksum 0x020d (incorrect -> 0x87fa), seq 3499:4495, ack 531, win 512, options [nop,nop,TS val 3503684665 ecr 3503684652], length 996
2022-04-07 16:04:45.114024 IP (tos 0x0, ttl 64, id 38324, offset 0, flags [DF], proto TCP (6), length 52)
    127.0.0.1.35646 > 127.0.0.1.10150: Flags [.], cksum 0xfe28 (incorrect -> 0x68d0), seq 531, ack 4495, win 504, options [nop,nop,TS val 3503684665 ecr 3503684665], length 0
2022-04-07 16:04:45.117755 IP (tos 0x0, ttl 64, id 40526, offset 0, flags [DF], proto TCP (6), length 997)
    127.0.0.1.10150 > 127.0.0.1.35646: Flags [P.], cksum 0x01da (incorrect -> 0x28b1), seq 4495:5440, ack 531, win 512, options [nop,nop,TS val 3503684669 ecr 3503684665], length 945
2022-04-07 16:04:45.117761 IP (tos 0x0, ttl 64, id 38325, offset 0, flags [DF], proto TCP (6), length 52)
    127.0.0.1.35646 > 127.0.0.1.10150: Flags [.], cksum 0xfe28 (incorrect -> 0x6517), seq 531, ack 5440, win 504, options [nop,nop,TS val 3503684669 ecr 3503684669], length 0
2022-04-07 16:04:45.118256 IP (tos 0x0, ttl 64, id 38326, offset 0, flags [DF], proto TCP (6), length 132)
    127.0.0.1.35646 > 127.0.0.1.10150: Flags [P.], cksum 0xfe78 (incorrect -> 0x0020), seq 531:611, ack 5440, win 512, options [nop,nop,TS val 3503684670 ecr 3503684669], length 80
2022-04-07 16:04:45.118265 IP (tos 0x0, ttl 64, id 40527, offset 0, flags [DF], proto TCP (6), length 52)
    127.0.0.1.10150 > 127.0.0.1.35646: Flags [.], cksum 0xfe28 (incorrect -> 0x64bd), seq 5440, ack 611, win 512, options [nop,nop,TS val 3503684670 ecr 3503684670], length 0
2022-04-07 16:04:45.118725 IP (tos 0x0, ttl 64, id 38327, offset 0, flags [DF], proto TCP (6), length 359)
    127.0.0.1.35646 > 127.0.0.1.10150: Flags [P.], cksum 0xff5b (incorrect -> 0x156f), seq 611:918, ack 5440, win 512, options [nop,nop,TS val 3503684670 ecr 3503684670], length 307
2022-04-07 16:04:45.118733 IP (tos 0x0, ttl 64, id 40528, offset 0, flags [DF], proto TCP (6), length 52)
    127.0.0.1.10150 > 127.0.0.1.35646: Flags [.], cksum 0xfe28 (incorrect -> 0x638c), seq 5440, ack 918, win 510, options [nop,nop,TS val 3503684670 ecr 3503684670], length 0
200, 5.8499767780303955, 0.8132572174072266