2022-04-07 14:22:52.710691 IP (tos 0x0, ttl 64, id 13473, offset 0, flags [DF], proto TCP (6), length 60)
    127.0.0.1.45504 > 127.0.0.1.9750: Flags [S], cksum 0xfe30 (incorrect -> 0x3710), seq 1207988475, win 65495, options [mss 65495,sackOK,TS val 3497572262 ecr 0,nop,wscale 7], length 0
2022-04-07 14:22:52.710705 IP (tos 0x0, ttl 64, id 0, offset 0, flags [DF], proto TCP (6), length 60)
    127.0.0.1.9750 > 127.0.0.1.45504: Flags [S.], cksum 0xfe30 (incorrect -> 0xd02b), seq 3070175168, ack 1207988476, win 65483, options [mss 65495,sackOK,TS val 3497572262 ecr 3497572262,nop,wscale 7], length 0
2022-04-07 14:22:52.710717 IP (tos 0x0, ttl 64, id 13474, offset 0, flags [DF], proto TCP (6), length 52)
    127.0.0.1.45504 > 127.0.0.1.9750: Flags [.], cksum 0xfe28 (incorrect -> 0xf6e7), seq 1, ack 1, win 512, options [nop,nop,TS val 3497572262 ecr 3497572262], length 0
2022-04-07 14:22:52.710855 IP (tos 0x0, ttl 64, id 13475, offset 0, flags [DF], proto TCP (6), length 55)
    127.0.0.1.45504 > 127.0.0.1.9750: Flags [P.], cksum 0xfe2b (incorrect -> 0xf1db), seq 1:4, ack 1, win 512, options [nop,nop,TS val 3497572262 ecr 3497572262], length 3
2022-04-07 14:22:52.710872 IP (tos 0x0, ttl 64, id 30950, offset 0, flags [DF], proto TCP (6), length 52)
    127.0.0.1.9750 > 127.0.0.1.45504: Flags [.], cksum 0xfe28 (incorrect -> 0xf6e4), seq 1, ack 4, win 512, options [nop,nop,TS val 3497572262 ecr 3497572262], length 0
2022-04-07 14:22:52.710929 IP (tos 0x0, ttl 64, id 30951, offset 0, flags [DF], proto TCP (6), length 54)
    127.0.0.1.9750 > 127.0.0.1.45504: Flags [P.], cksum 0xfe2a (incorrect -> 0xf1da), seq 1:3, ack 4, win 512, options [nop,nop,TS val 3497572262 ecr 3497572262], length 2
2022-04-07 14:22:52.710940 IP (tos 0x0, ttl 64, id 13476, offset 0, flags [DF], proto TCP (6), length 52)
    127.0.0.1.45504 > 127.0.0.1.9750: Flags [.], cksum 0xfe28 (incorrect -> 0xf6e2), seq 4, ack 3, win 512, options [nop,nop,TS val 3497572262 ecr 3497572262], length 0
2022-04-07 14:22:52.712734 IP (tos 0x0, ttl 64, id 13477, offset 0, flags [DF], proto TCP (6), length 62)
    127.0.0.1.45504 > 127.0.0.1.9750: Flags [P.], cksum 0xfe32 (incorrect -> 0x3ca2), seq 4:14, ack 3, win 512, options [nop,nop,TS val 3497572264 ecr 3497572262], length 10
2022-04-07 14:22:52.712742 IP (tos 0x0, ttl 64, id 30952, offset 0, flags [DF], proto TCP (6), length 52)
    127.0.0.1.9750 > 127.0.0.1.45504: Flags [.], cksum 0xfe28 (incorrect -> 0xf6d4), seq 3, ack 14, win 512, options [nop,nop,TS val 3497572264 ecr 3497572264], length 0
2022-04-07 14:22:52.839404 IP (tos 0x0, ttl 64, id 30953, offset 0, flags [DF], proto TCP (6), length 62)
    127.0.0.1.9750 > 127.0.0.1.45504: Flags [P.], cksum 0xfe32 (incorrect -> 0xf142), seq 3:13, ack 14, win 512, options [nop,nop,TS val 3497572391 ecr 3497572264], length 10
2022-04-07 14:22:52.839412 IP (tos 0x0, ttl 64, id 13478, offset 0, flags [DF], proto TCP (6), length 52)
    127.0.0.1.45504 > 127.0.0.1.9750: Flags [.], cksum 0xfe28 (incorrect -> 0xf5cc), seq 14, ack 13, win 512, options [nop,nop,TS val 3497572391 ecr 3497572391], length 0
2022-04-07 14:22:52.845115 IP (tos 0x0, ttl 64, id 13479, offset 0, flags [DF], proto TCP (6), length 569)
    127.0.0.1.45504 > 127.0.0.1.9750: Flags [P.], cksum 0x002e (incorrect -> 0x0eb8), seq 14:531, ack 13, win 512, options [nop,nop,TS val 3497572396 ecr 3497572391], length 517
2022-04-07 14:22:52.845127 IP (tos 0x0, ttl 64, id 30954, offset 0, flags [DF], proto TCP (6), length 52)
    127.0.0.1.9750 > 127.0.0.1.45504: Flags [.], cksum 0xfe28 (incorrect -> 0xf3c1), seq 13, ack 531, win 508, options [nop,nop,TS val 3497572396 ecr 3497572396], length 0
2022-04-07 14:22:53.022830 IP (tos 0x0, ttl 64, id 30955, offset 0, flags [DF], proto TCP (6), length 3538)
    127.0.0.1.9750 > 127.0.0.1.45504: Flags [P.], cksum 0x0bc7 (incorrect -> 0x456e), seq 13:3499, ack 531, win 512, options [nop,nop,TS val 3497572574 ecr 3497572396], length 3486
2022-04-07 14:22:53.022840 IP (tos 0x0, ttl 64, id 13480, offset 0, flags [DF], proto TCP (6), length 52)
    127.0.0.1.45504 > 127.0.0.1.9750: Flags [.], cksum 0xfe28 (incorrect -> 0xe4cd), seq 531, ack 3499, win 494, options [nop,nop,TS val 3497572574 ecr 3497572574], length 0
2022-04-07 14:22:53.039893 IP (tos 0x0, ttl 64, id 30956, offset 0, flags [DF], proto TCP (6), length 1348)
    127.0.0.1.9750 > 127.0.0.1.45504: Flags [P.], cksum 0x0339 (incorrect -> 0x127d), seq 3499:4795, ack 531, win 512, options [nop,nop,TS val 3497572591 ecr 3497572574], length 1296
2022-04-07 14:22:53.039902 IP (tos 0x0, ttl 64, id 13481, offset 0, flags [DF], proto TCP (6), length 52)
    127.0.0.1.45504 > 127.0.0.1.9750: Flags [.], cksum 0xfe28 (incorrect -> 0xdf93), seq 531, ack 4795, win 502, options [nop,nop,TS val 3497572591 ecr 3497572591], length 0
2022-04-07 14:22:53.040359 IP (tos 0x0, ttl 64, id 13482, offset 0, flags [DF], proto TCP (6), length 132)
    127.0.0.1.45504 > 127.0.0.1.9750: Flags [P.], cksum 0xfe78 (incorrect -> 0x740c), seq 531:611, ack 4795, win 512, options [nop,nop,TS val 3497572592 ecr 3497572591], length 80
2022-04-07 14:22:53.040367 IP (tos 0x0, ttl 64, id 30957, offset 0, flags [DF], proto TCP (6), length 52)
    127.0.0.1.9750 > 127.0.0.1.45504: Flags [.], cksum 0xfe28 (incorrect -> 0xdf37), seq 4795, ack 611, win 512, options [nop,nop,TS val 3497572592 ecr 3497572592], length 0
2022-04-07 14:22:53.040787 IP (tos 0x0, ttl 64, id 13483, offset 0, flags [DF], proto TCP (6), length 407)
    127.0.0.1.45504 > 127.0.0.1.9750: Flags [P.], cksum 0xff8b (incorrect -> 0xb6a9), seq 611:966, ack 4795, win 512, options [nop,nop,TS val 3497572592 ecr 3497572592], length 355
2022-04-07 14:22:53.040795 IP (tos 0x0, ttl 64, id 30958, offset 0, flags [DF], proto TCP (6), length 52)
    127.0.0.1.9750 > 127.0.0.1.45504: Flags [.], cksum 0xfe28 (incorrect -> 0xddd6), seq 4795, ack 966, win 510, options [nop,nop,TS val 3497572592 ecr 3497572592], length 0
2022-04-07 14:22:53.171994 IP (tos 0x0, ttl 64, id 30959, offset 0, flags [DF], proto TCP (6), length 594)
    127.0.0.1.9750 > 127.0.0.1.45504: Flags [P.], cksum 0x0047 (incorrect -> 0xb4c3), seq 4795:5337, ack 966, win 512, options [nop,nop,TS val 3497572723 ecr 3497572592], length 542
2022-04-07 14:22:53.172001 IP (tos 0x0, ttl 64, id 13484, offset 0, flags [DF], proto TCP (6), length 52)
    127.0.0.1.45504 > 127.0.0.1.9750: Flags [.], cksum 0xfe28 (incorrect -> 0xdab4), seq 966, ack 5337, win 508, options [nop,nop,TS val 3497572723 ecr 3497572723], length 0
2022-04-07 14:22:53.285499 IP (tos 0x0, ttl 64, id 30960, offset 0, flags [DF], proto TCP (6), length 3538)
    127.0.0.1.9750 > 127.0.0.1.45504: Flags [P.], cksum 0x0bc7 (incorrect -> 0x9c75), seq 5337:8823, ack 966, win 512, options [nop,nop,TS val 3497572837 ecr 3497572723], length 3486
2022-04-07 14:22:53.285507 IP (tos 0x0, ttl 64, id 13485, offset 0, flags [DF], proto TCP (6), length 52)
    127.0.0.1.45504 > 127.0.0.1.9750: Flags [.], cksum 0xfe28 (incorrect -> 0xcc40), seq 966, ack 8823, win 494, options [nop,nop,TS val 3497572837 ecr 3497572837], length 0
2022-04-07 14:22:53.306144 IP (tos 0x0, ttl 64, id 30961, offset 0, flags [DF], proto TCP (6), length 4036)
    127.0.0.1.9750 > 127.0.0.1.45504: Flags [P.], cksum 0x0db9 (incorrect -> 0x2bb2), seq 8823:12807, ack 966, win 512, options [nop,nop,TS val 3497572857 ecr 3497572837], length 3984
2022-04-07 14:22:53.306151 IP (tos 0x0, ttl 64, id 13486, offset 0, flags [DF], proto TCP (6), length 52)
    127.0.0.1.45504 > 127.0.0.1.9750: Flags [.], cksum 0xfe28 (incorrect -> 0xbc8a), seq 966, ack 12807, win 492, options [nop,nop,TS val 3497572857 ecr 3497572857], length 0
2022-04-07 14:22:53.321280 IP (tos 0x0, ttl 64, id 30962, offset 0, flags [DF], proto TCP (6), length 3538)
    127.0.0.1.9750 > 127.0.0.1.45504: Flags [P.], cksum 0x0bc7 (incorrect -> 0xf533), seq 12807:16293, ack 966, win 512, options [nop,nop,TS val 3497572873 ecr 3497572857], length 3486
2022-04-07 14:22:53.321287 IP (tos 0x0, ttl 64, id 13487, offset 0, flags [DF], proto TCP (6), length 52)
    127.0.0.1.45504 > 127.0.0.1.9750: Flags [.], cksum 0xfe28 (incorrect -> 0xaeca), seq 966, ack 16293, win 494, options [nop,nop,TS val 3497572873 ecr 3497572873], length 0
2022-04-07 14:22:53.326736 IP (tos 0x0, ttl 64, id 30963, offset 0, flags [DF], proto TCP (6), length 4036)
    127.0.0.1.9750 > 127.0.0.1.45504: Flags [P.], cksum 0x0db9 (incorrect -> 0x5f43), seq 16293:20277, ack 966, win 512, options [nop,nop,TS val 3497572878 ecr 3497572873], length 3984
2022-04-07 14:22:53.326742 IP (tos 0x0, ttl 64, id 13488, offset 0, flags [DF], proto TCP (6), length 52)
    127.0.0.1.45504 > 127.0.0.1.9750: Flags [.], cksum 0xfe28 (incorrect -> 0x9f32), seq 966, ack 20277, win 492, options [nop,nop,TS val 3497572878 ecr 3497572878], length 0
2022-04-07 14:22:53.347344 IP (tos 0x0, ttl 64, id 30964, offset 0, flags [DF], proto TCP (6), length 1546)
    127.0.0.1.9750 > 127.0.0.1.45504: Flags [P.], cksum 0x03ff (incorrect -> 0xe109), seq 20277:21771, ack 966, win 512, options [nop,nop,TS val 3497572899 ecr 3497572878], length 1494
2022-04-07 14:22:53.347352 IP (tos 0x0, ttl 64, id 13489, offset 0, flags [DF], proto TCP (6), length 52)
    127.0.0.1.45504 > 127.0.0.1.9750: Flags [.], cksum 0xfe28 (incorrect -> 0x9928), seq 966, ack 21771, win 502, options [nop,nop,TS val 3497572899 ecr 3497572899], length 0
2022-04-07 14:22:53.368008 IP (tos 0x0, ttl 64, id 30965, offset 0, flags [DF], proto TCP (6), length 3538)
    127.0.0.1.9750 > 127.0.0.1.45504: Flags [P.], cksum 0x0bc7 (incorrect -> 0x8f57), seq 21771:25257, ack 966, win 512, options [nop,nop,TS val 3497572919 ecr 3497572899], length 3486
2022-04-07 14:22:53.368015 IP (tos 0x0, ttl 64, id 13490, offset 0, flags [DF], proto TCP (6), length 52)
    127.0.0.1.45504 > 127.0.0.1.9750: Flags [.], cksum 0xfe28 (incorrect -> 0x8b6a), seq 966, ack 25257, win 494, options [nop,nop,TS val 3497572919 ecr 3497572919], length 0
2022-04-07 14:22:53.388628 IP (tos 0x0, ttl 64, id 30966, offset 0, flags [DF], proto TCP (6), length 3824)
    127.0.0.1.9750 > 127.0.0.1.45504: Flags [P.], cksum 0x0ce5 (incorrect -> 0x344a), seq 25257:29029, ack 966, win 512, options [nop,nop,TS val 3497572940 ecr 3497572919], length 3772
2022-04-07 14:22:53.388635 IP (tos 0x0, ttl 64, id 13491, offset 0, flags [DF], proto TCP (6), length 52)
    127.0.0.1.45504 > 127.0.0.1.9750: Flags [.], cksum 0xfe28 (incorrect -> 0x7c85), seq 966, ack 29029, win 493, options [nop,nop,TS val 3497572940 ecr 3497572940], length 0
2022-04-07 14:22:53.398771 IP (tos 0x0, ttl 64, id 30967, offset 0, flags [DF], proto TCP (6), length 4100)
    127.0.0.1.9750 > 127.0.0.1.45504: Flags [P.], cksum 0x0df9 (incorrect -> 0x3374), seq 29029:33077, ack 966, win 512, options [nop,nop,TS val 3497572950 ecr 3497572940], length 4048
2022-04-07 14:22:53.442785 IP (tos 0x0, ttl 64, id 13492, offset 0, flags [DF], proto TCP (6), length 52)
    127.0.0.1.45504 > 127.0.0.1.9750: Flags [.], cksum 0xfe28 (incorrect -> 0x6c62), seq 966, ack 33077, win 512, options [nop,nop,TS val 3497572994 ecr 3497572950], length 0
2022-04-07 14:22:53.442795 IP (tos 0x0, ttl 64, id 30968, offset 0, flags [DF], proto TCP (6), length 9580)
    127.0.0.1.9750 > 127.0.0.1.45504: Flags [P.], cksum 0x2361 (incorrect -> 0xf173), seq 33077:42605, ack 966, win 512, options [nop,nop,TS val 3497572994 ecr 3497572994], length 9528
2022-04-07 14:22:53.486783 IP (tos 0x0, ttl 64, id 13493, offset 0, flags [DF], proto TCP (6), length 52)
    127.0.0.1.45504 > 127.0.0.1.9750: Flags [.], cksum 0xfe28 (incorrect -> 0x46d2), seq 966, ack 42605, win 512, options [nop,nop,TS val 3497573038 ecr 3497572994], length 0
2022-04-07 14:22:53.486796 IP (tos 0x0, ttl 64, id 30969, offset 0, flags [DF], proto TCP (6), length 16930)
    127.0.0.1.9750 > 127.0.0.1.45504: Flags [P.], cksum 0x4017 (incorrect -> 0x404a), seq 42605:59483, ack 966, win 512, options [nop,nop,TS val 3497573038 ecr 3497573038], length 16878
2022-04-07 14:22:53.530803 IP (tos 0x0, ttl 64, id 13494, offset 0, flags [DF], proto TCP (6), length 52)
    127.0.0.1.45504 > 127.0.0.1.9750: Flags [.], cksum 0xfe28 (incorrect -> 0x048c), seq 966, ack 59483, win 512, options [nop,nop,TS val 3497573082 ecr 3497573038], length 0
2022-04-07 14:22:53.530820 IP (tos 0x0, ttl 64, id 30970, offset 0, flags [DF], proto TCP (6), length 7246)
    127.0.0.1.9750 > 127.0.0.1.45504: Flags [P.], cksum 0x1a43 (incorrect -> 0xd746), seq 59483:66677, ack 966, win 512, options [nop,nop,TS val 3497573082 ecr 3497573082], length 7194
2022-04-07 14:22:53.530849 IP (tos 0x0, ttl 64, id 13495, offset 0, flags [DF], proto TCP (6), length 52)
    127.0.0.1.45504 > 127.0.0.1.9750: Flags [.], cksum 0xfe28 (incorrect -> 0xe845), seq 966, ack 66677, win 512, options [nop,nop,TS val 3497573082 ecr 3497573082], length 0
2022-04-07 14:22:53.533303 IP (tos 0x0, ttl 64, id 30971, offset 0, flags [DF], proto TCP (6), length 3944)
    127.0.0.1.9750 > 127.0.0.1.45504: Flags [P.], cksum 0x0d5d (incorrect -> 0xd499), seq 66677:70569, ack 966, win 512, options [nop,nop,TS val 3497573085 ecr 3497573082], length 3892
2022-04-07 14:22:53.533594 IP (tos 0x0, ttl 64, id 13496, offset 0, flags [DF], proto TCP (6), length 52)
    127.0.0.1.45504 > 127.0.0.1.9750: Flags [.], cksum 0xfe28 (incorrect -> 0xd90b), seq 966, ack 70569, win 512, options [nop,nop,TS val 3497573085 ecr 3497573085], length 0
2022-04-07 14:22:53.553943 IP (tos 0x0, ttl 64, id 30972, offset 0, flags [DF], proto TCP (6), length 3354)
    127.0.0.1.9750 > 127.0.0.1.45504: Flags [P.], cksum 0x0b0f (incorrect -> 0xb88e), seq 70569:73871, ack 966, win 512, options [nop,nop,TS val 3497573105 ecr 3497573085], length 3302
2022-04-07 14:22:53.553960 IP (tos 0x0, ttl 64, id 13497, offset 0, flags [DF], proto TCP (6), length 52)
    127.0.0.1.45504 > 127.0.0.1.9750: Flags [.], cksum 0xfe28 (incorrect -> 0xcbfd), seq 966, ack 73871, win 512, options [nop,nop,TS val 3497573105 ecr 3497573105], length 0
2022-04-07 14:22:53.568194 IP (tos 0x0, ttl 64, id 30973, offset 0, flags [DF], proto TCP (6), length 2948)
    127.0.0.1.9750 > 127.0.0.1.45504: Flags [P.], cksum 0x0979 (incorrect -> 0x78c7), seq 73871:76767, ack 966, win 512, options [nop,nop,TS val 3497573119 ecr 3497573105], length 2896
2022-04-07 14:22:53.568214 IP (tos 0x0, ttl 64, id 13498, offset 0, flags [DF], proto TCP (6), length 52)
    127.0.0.1.45504 > 127.0.0.1.9750: Flags [.], cksum 0xfe28 (incorrect -> 0xc091), seq 966, ack 76767, win 512, options [nop,nop,TS val 3497573119 ecr 3497573119], length 0
2022-04-07 14:22:53.573186 IP (tos 0x0, ttl 64, id 30974, offset 0, flags [DF], proto TCP (6), length 4100)
    127.0.0.1.9750 > 127.0.0.1.45504: Flags [P.], cksum 0x0df9 (incorrect -> 0xb00a), seq 76767:80815, ack 966, win 512, options [nop,nop,TS val 3497573124 ecr 3497573119], length 4048
2022-04-07 14:22:53.573225 IP (tos 0x0, ttl 64, id 13499, offset 0, flags [DF], proto TCP (6), length 52)
    127.0.0.1.45504 > 127.0.0.1.9750: Flags [.], cksum 0xfe28 (incorrect -> 0xb0b6), seq 966, ack 80815, win 512, options [nop,nop,TS val 3497573125 ecr 3497573124], length 0
2022-04-07 14:22:53.573231 IP (tos 0x0, ttl 64, id 30975, offset 0, flags [DF], proto TCP (6), length 3788)
    127.0.0.1.9750 > 127.0.0.1.45504: Flags [P.], cksum 0x0cc1 (incorrect -> 0xeb34), seq 80815:84551, ack 966, win 512, options [nop,nop,TS val 3497573125 ecr 3497573125], length 3736
2022-04-07 14:22:53.573237 IP (tos 0x0, ttl 64, id 13500, offset 0, flags [DF], proto TCP (6), length 52)
    127.0.0.1.45504 > 127.0.0.1.9750: Flags [.], cksum 0xfe28 (incorrect -> 0xa21d), seq 966, ack 84551, win 512, options [nop,nop,TS val 3497573125 ecr 3497573125], length 0
2022-04-07 14:22:53.574570 IP (tos 0x0, ttl 64, id 30976, offset 0, flags [DF], proto TCP (6), length 1546)
    127.0.0.1.9750 > 127.0.0.1.45504: Flags [P.], cksum 0x03ff (incorrect -> 0x31a2), seq 84551:86045, ack 966, win 512, options [nop,nop,TS val 3497573126 ecr 3497573125], length 1494
2022-04-07 14:22:53.574584 IP (tos 0x0, ttl 64, id 13501, offset 0, flags [DF], proto TCP (6), length 52)
    127.0.0.1.45504 > 127.0.0.1.9750: Flags [.], cksum 0xfe28 (incorrect -> 0x9c45), seq 966, ack 86045, win 512, options [nop,nop,TS val 3497573126 ecr 3497573126], length 0
2022-04-07 14:22:53.596555 IP (tos 0x0, ttl 64, id 30977, offset 0, flags [DF], proto TCP (6), length 3538)
    127.0.0.1.9750 > 127.0.0.1.45504: Flags [P.], cksum 0x0bc7 (incorrect -> 0x2f4b), seq 86045:89531, ack 966, win 512, options [nop,nop,TS val 3497573148 ecr 3497573126], length 3486
2022-04-07 14:22:53.596894 IP (tos 0x0, ttl 64, id 13502, offset 0, flags [DF], proto TCP (6), length 52)
    127.0.0.1.45504 > 127.0.0.1.9750: Flags [.], cksum 0xfe28 (incorrect -> 0x8e7b), seq 966, ack 89531, win 512, options [nop,nop,TS val 3497573148 ecr 3497573148], length 0
2022-04-07 14:22:53.598296 IP (tos 0x0, ttl 64, id 30978, offset 0, flags [DF], proto TCP (6), length 4100)
    127.0.0.1.9750 > 127.0.0.1.45504: Flags [P.], cksum 0x0df9 (incorrect -> 0x4dbb), seq 89531:93579, ack 966, win 512, options [nop,nop,TS val 3497573150 ecr 3497573148], length 4048
2022-04-07 14:22:53.598334 IP (tos 0x0, ttl 64, id 13503, offset 0, flags [DF], proto TCP (6), length 52)
    127.0.0.1.45504 > 127.0.0.1.9750: Flags [.], cksum 0xfe28 (incorrect -> 0x7ea7), seq 966, ack 93579, win 512, options [nop,nop,TS val 3497573150 ecr 3497573150], length 0
2022-04-07 14:22:53.598340 IP (tos 0x0, ttl 64, id 30979, offset 0, flags [DF], proto TCP (6), length 2608)
    127.0.0.1.9750 > 127.0.0.1.45504: Flags [P.], cksum 0x0825 (incorrect -> 0xbbb1), seq 93579:96135, ack 966, win 512, options [nop,nop,TS val 3497573150 ecr 3497573150], length 2556
2022-04-07 14:22:53.598345 IP (tos 0x0, ttl 64, id 13504, offset 0, flags [DF], proto TCP (6), length 52)
    127.0.0.1.45504 > 127.0.0.1.9750: Flags [.], cksum 0xfe28 (incorrect -> 0x74ab), seq 966, ack 96135, win 512, options [nop,nop,TS val 3497573150 ecr 3497573150], length 0
2022-04-07 14:22:53.610677 IP (tos 0x0, ttl 64, id 30980, offset 0, flags [DF], proto TCP (6), length 3446)
    127.0.0.1.9750 > 127.0.0.1.45504: Flags [P.], cksum 0x0b6b (incorrect -> 0x9c5a), seq 96135:99529, ack 966, win 512, options [nop,nop,TS val 3497573162 ecr 3497573150], length 3394
2022-04-07 14:22:53.610705 IP (tos 0x0, ttl 64, id 13505, offset 0, flags [DF], proto TCP (6), length 52)
    127.0.0.1.45504 > 127.0.0.1.9750: Flags [.], cksum 0xfe28 (incorrect -> 0x6751), seq 966, ack 99529, win 512, options [nop,nop,TS val 3497573162 ecr 3497573162], length 0
2022-04-07 14:22:53.618828 IP (tos 0x0, ttl 64, id 30981, offset 0, flags [DF], proto TCP (6), length 956)
    127.0.0.1.9750 > 127.0.0.1.45504: Flags [P.], cksum 0x01b1 (incorrect -> 0x8a3b), seq 99529:100433, ack 966, win 512, options [nop,nop,TS val 3497573170 ecr 3497573162], length 904
2022-04-07 14:22:53.618862 IP (tos 0x0, ttl 64, id 13506, offset 0, flags [DF], proto TCP (6), length 52)
    127.0.0.1.45504 > 127.0.0.1.9750: Flags [.], cksum 0xfe28 (incorrect -> 0x63b9), seq 966, ack 100433, win 512, options [nop,nop,TS val 3497573170 ecr 3497573170], length 0
2022-04-07 14:22:53.630332 IP (tos 0x0, ttl 64, id 30982, offset 0, flags [DF], proto TCP (6), length 3446)
    127.0.0.1.9750 > 127.0.0.1.45504: Flags [P.], cksum 0x0b6b (incorrect -> 0x33ad), seq 100433:103827, ack 966, win 512, options [nop,nop,TS val 3497573182 ecr 3497573170], length 3394
2022-04-07 14:22:53.630939 IP (tos 0x0, ttl 64, id 13507, offset 0, flags [DF], proto TCP (6), length 52)
    127.0.0.1.45504 > 127.0.0.1.9750: Flags [.], cksum 0xfe28 (incorrect -> 0x565f), seq 966, ack 103827, win 512, options [nop,nop,TS val 3497573182 ecr 3497573182], length 0
2022-04-07 14:22:53.633641 IP (tos 0x0, ttl 64, id 30983, offset 0, flags [DF], proto TCP (6), length 1952)
    127.0.0.1.9750 > 127.0.0.1.45504: Flags [P.], cksum 0x0595 (incorrect -> 0x37c1), seq 103827:105727, ack 966, win 512, options [nop,nop,TS val 3497573185 ecr 3497573182], length 1900
2022-04-07 14:22:53.633677 IP (tos 0x0, ttl 64, id 13508, offset 0, flags [DF], proto TCP (6), length 52)
    127.0.0.1.45504 > 127.0.0.1.9750: Flags [.], cksum 0xfe28 (incorrect -> 0x4eed), seq 966, ack 105727, win 512, options [nop,nop,TS val 3497573185 ecr 3497573185], length 0
2022-04-07 14:22:53.633723 IP (tos 0x0, ttl 64, id 30984, offset 0, flags [DF], proto TCP (6), length 3446)
    127.0.0.1.9750 > 127.0.0.1.45504: Flags [P.], cksum 0x0b6b (incorrect -> 0x9938), seq 105727:109121, ack 966, win 512, options [nop,nop,TS val 3497573185 ecr 3497573185], length 3394
2022-04-07 14:22:53.633742 IP (tos 0x0, ttl 64, id 13509, offset 0, flags [DF], proto TCP (6), length 52)
    127.0.0.1.45504 > 127.0.0.1.9750: Flags [.], cksum 0xfe28 (incorrect -> 0x41ab), seq 966, ack 109121, win 512, options [nop,nop,TS val 3497573185 ecr 3497573185], length 0
2022-04-07 14:22:53.639778 IP (tos 0x0, ttl 64, id 30985, offset 0, flags [DF], proto TCP (6), length 3446)
    127.0.0.1.9750 > 127.0.0.1.45504: Flags [P.], cksum 0x0b6b (incorrect -> 0x875f), seq 109121:112515, ack 966, win 512, options [nop,nop,TS val 3497573191 ecr 3497573185], length 3394
2022-04-07 14:22:53.682780 IP (tos 0x0, ttl 64, id 13510, offset 0, flags [DF], proto TCP (6), length 52)
    127.0.0.1.45504 > 127.0.0.1.9750: Flags [.], cksum 0xfe28 (incorrect -> 0x3432), seq 966, ack 112515, win 512, options [nop,nop,TS val 3497573234 ecr 3497573191], length 0
200, 4.834407567977905, 1.1351468563079834