2022-04-07 22:46:11.258606 IP (tos 0x0, ttl 64, id 23194, offset 0, flags [DF], proto TCP (6), length 60)
    127.0.0.1.43218 > 127.0.0.1.11350: Flags [S], cksum 0xfe30 (incorrect -> 0xa303), seq 982468678, win 65495, options [mss 65495,sackOK,TS val 3527770810 ecr 0,nop,wscale 7], length 0
2022-04-07 22:46:11.258615 IP (tos 0x0, ttl 64, id 0, offset 0, flags [DF], proto TCP (6), length 60)
    127.0.0.1.11350 > 127.0.0.1.43218: Flags [S.], cksum 0xfe30 (incorrect -> 0xd394), seq 1104754832, ack 982468679, win 65483, options [mss 65495,sackOK,TS val 3527770810 ecr 3527770810,nop,wscale 7], length 0
2022-04-07 22:46:11.258622 IP (tos 0x0, ttl 64, id 23195, offset 0, flags [DF], proto TCP (6), length 52)
    127.0.0.1.43218 > 127.0.0.1.11350: Flags [.], cksum 0xfe28 (incorrect -> 0xfa50), seq 1, ack 1, win 512, options [nop,nop,TS val 3527770810 ecr 3527770810], length 0
2022-04-07 22:46:11.258717 IP (tos 0x0, ttl 64, id 23196, offset 0, flags [DF], proto TCP (6), length 55)
    127.0.0.1.43218 > 127.0.0.1.11350: Flags [P.], cksum 0xfe2b (incorrect -> 0xf544), seq 1:4, ack 1, win 512, options [nop,nop,TS val 3527770810 ecr 3527770810], length 3
2022-04-07 22:46:11.258726 IP (tos 0x0, ttl 64, id 15039, offset 0, flags [DF], proto TCP (6), length 52)
    127.0.0.1.11350 > 127.0.0.1.43218: Flags [.], cksum 0xfe28 (incorrect -> 0xfa4d), seq 1, ack 4, win 512, options [nop,nop,TS val 3527770810 ecr 3527770810], length 0
2022-04-07 22:46:11.258754 IP (tos 0x0, ttl 64, id 15040, offset 0, flags [DF], proto TCP (6), length 54)
    127.0.0.1.11350 > 127.0.0.1.43218: Flags [P.], cksum 0xfe2a (incorrect -> 0xf543), seq 1:3, ack 4, win 512, options [nop,nop,TS val 3527770810 ecr 3527770810], length 2
2022-04-07 22:46:11.258773 IP (tos 0x0, ttl 64, id 23197, offset 0, flags [DF], proto TCP (6), length 52)
    127.0.0.1.43218 > 127.0.0.1.11350: Flags [.], cksum 0xfe28 (incorrect -> 0xfa4b), seq 4, ack 3, win 512, options [nop,nop,TS val 3527770810 ecr 3527770810], length 0
2022-04-07 22:46:11.270122 IP (tos 0x0, ttl 64, id 23198, offset 0, flags [DF], proto TCP (6), length 62)
    127.0.0.1.43218 > 127.0.0.1.11350: Flags [P.], cksum 0xfe32 (incorrect -> 0x603c), seq 4:14, ack 3, win 512, options [nop,nop,TS val 3527770821 ecr 3527770810], length 10
2022-04-07 22:46:11.270139 IP (tos 0x0, ttl 64, id 15041, offset 0, flags [DF], proto TCP (6), length 52)
    127.0.0.1.11350 > 127.0.0.1.43218: Flags [.], cksum 0xfe28 (incorrect -> 0xfa2b), seq 3, ack 14, win 512, options [nop,nop,TS val 3527770821 ecr 3527770821], length 0
2022-04-07 22:46:11.372997 IP (tos 0x0, ttl 64, id 15042, offset 0, flags [DF], proto TCP (6), length 62)
    127.0.0.1.11350 > 127.0.0.1.43218: Flags [P.], cksum 0xfe32 (incorrect -> 0xf4b1), seq 3:13, ack 14, win 512, options [nop,nop,TS val 3527770924 ecr 3527770821], length 10
2022-04-07 22:46:11.373007 IP (tos 0x0, ttl 64, id 23199, offset 0, flags [DF], proto TCP (6), length 52)
    127.0.0.1.43218 > 127.0.0.1.11350: Flags [.], cksum 0xfe28 (incorrect -> 0xf953), seq 14, ack 13, win 512, options [nop,nop,TS val 3527770924 ecr 3527770924], length 0
2022-04-07 22:46:11.378912 IP (tos 0x0, ttl 64, id 23200, offset 0, flags [DF], proto TCP (6), length 569)
    127.0.0.1.43218 > 127.0.0.1.11350: Flags [P.], cksum 0x002e (incorrect -> 0x285e), seq 14:531, ack 13, win 512, options [nop,nop,TS val 3527770930 ecr 3527770924], length 517
2022-04-07 22:46:11.378920 IP (tos 0x0, ttl 64, id 15043, offset 0, flags [DF], proto TCP (6), length 52)
    127.0.0.1.11350 > 127.0.0.1.43218: Flags [.], cksum 0xfe28 (incorrect -> 0xf746), seq 13, ack 531, win 508, options [nop,nop,TS val 3527770930 ecr 3527770930], length 0
200, 7.725275754928589, 1.0448949337005615