2022-04-07 20:06:46.583352 IP (tos 0x0, ttl 64, id 49165, offset 0, flags [DF], proto TCP (6), length 60)
    127.0.0.1.36016 > 127.0.0.1.10450: Flags [S], cksum 0xfe30 (incorrect -> 0x966e), seq 3537751751, win 65495, options [mss 65495,sackOK,TS val 3518206135 ecr 0,nop,wscale 7], length 0
2022-04-07 20:06:46.583369 IP (tos 0x0, ttl 64, id 0, offset 0, flags [DF], proto TCP (6), length 60)
    127.0.0.1.10450 > 127.0.0.1.36016: Flags [S.], cksum 0xfe30 (incorrect -> 0x6fce), seq 2438607573, ack 3537751752, win 65483, options [mss 65495,sackOK,TS val 3518206135 ecr 3518206135,nop,wscale 7], length 0
2022-04-07 20:06:46.583384 IP (tos 0x0, ttl 64, id 49166, offset 0, flags [DF], proto TCP (6), length 52)
    127.0.0.1.36016 > 127.0.0.1.10450: Flags [.], cksum 0xfe28 (incorrect -> 0x968a), seq 1, ack 1, win 512, options [nop,nop,TS val 3518206135 ecr 3518206135], length 0
2022-04-07 20:06:46.583498 IP (tos 0x0, ttl 64, id 49167, offset 0, flags [DF], proto TCP (6), length 55)
    127.0.0.1.36016 > 127.0.0.1.10450: Flags [P.], cksum 0xfe2b (incorrect -> 0x917e), seq 1:4, ack 1, win 512, options [nop,nop,TS val 3518206135 ecr 3518206135], length 3
2022-04-07 20:06:46.583504 IP (tos 0x0, ttl 64, id 39865, offset 0, flags [DF], proto TCP (6), length 52)
    127.0.0.1.10450 > 127.0.0.1.36016: Flags [.], cksum 0xfe28 (incorrect -> 0x9687), seq 1, ack 4, win 512, options [nop,nop,TS val 3518206135 ecr 3518206135], length 0
2022-04-07 20:06:46.583585 IP (tos 0x0, ttl 64, id 39866, offset 0, flags [DF], proto TCP (6), length 54)
    127.0.0.1.10450 > 127.0.0.1.36016: Flags [P.], cksum 0xfe2a (incorrect -> 0x917d), seq 1:3, ack 4, win 512, options [nop,nop,TS val 3518206135 ecr 3518206135], length 2
2022-04-07 20:06:46.583591 IP (tos 0x0, ttl 64, id 49168, offset 0, flags [DF], proto TCP (6), length 52)
    127.0.0.1.36016 > 127.0.0.1.10450: Flags [.], cksum 0xfe28 (incorrect -> 0x9685), seq 4, ack 3, win 512, options [nop,nop,TS val 3518206135 ecr 3518206135], length 0
2022-04-07 20:06:46.630391 IP (tos 0x0, ttl 64, id 49169, offset 0, flags [DF], proto TCP (6), length 62)
    127.0.0.1.36016 > 127.0.0.1.10450: Flags [P.], cksum 0xfe32 (incorrect -> 0x2371), seq 4:14, ack 3, win 512, options [nop,nop,TS val 3518206182 ecr 3518206135], length 10
2022-04-07 20:06:46.630402 IP (tos 0x0, ttl 64, id 39867, offset 0, flags [DF], proto TCP (6), length 52)
    127.0.0.1.10450 > 127.0.0.1.36016: Flags [.], cksum 0xfe28 (incorrect -> 0x961d), seq 3, ack 14, win 512, options [nop,nop,TS val 3518206182 ecr 3518206182], length 0
2022-04-07 20:06:46.741575 IP (tos 0x0, ttl 64, id 39868, offset 0, flags [DF], proto TCP (6), length 62)
    127.0.0.1.10450 > 127.0.0.1.36016: Flags [P.], cksum 0xfe32 (incorrect -> 0x909b), seq 3:13, ack 14, win 512, options [nop,nop,TS val 3518206293 ecr 3518206182], length 10
2022-04-07 20:06:46.741583 IP (tos 0x0, ttl 64, id 49170, offset 0, flags [DF], proto TCP (6), length 52)
    127.0.0.1.36016 > 127.0.0.1.10450: Flags [.], cksum 0xfe28 (incorrect -> 0x9535), seq 14, ack 13, win 512, options [nop,nop,TS val 3518206293 ecr 3518206293], length 0
2022-04-07 20:06:46.747291 IP (tos 0x0, ttl 64, id 49171, offset 0, flags [DF], proto TCP (6), length 569)
    127.0.0.1.36016 > 127.0.0.1.10450: Flags [P.], cksum 0x002e (incorrect -> 0x6e15), seq 14:531, ack 13, win 512, options [nop,nop,TS val 3518206299 ecr 3518206293], length 517
2022-04-07 20:06:46.747300 IP (tos 0x0, ttl 64, id 39869, offset 0, flags [DF], proto TCP (6), length 52)
    127.0.0.1.10450 > 127.0.0.1.36016: Flags [.], cksum 0xfe28 (incorrect -> 0x9328), seq 13, ack 531, win 508, options [nop,nop,TS val 3518206299 ecr 3518206299], length 0
2022-04-07 20:06:46.863863 IP (tos 0x0, ttl 64, id 39870, offset 0, flags [DF], proto TCP (6), length 3381)
    127.0.0.1.10450 > 127.0.0.1.36016: Flags [P.], cksum 0x0b2a (incorrect -> 0x55eb), seq 13:3342, ack 531, win 512, options [nop,nop,TS val 3518206415 ecr 3518206299], length 3329
2022-04-07 20:06:46.863871 IP (tos 0x0, ttl 64, id 49172, offset 0, flags [DF], proto TCP (6), length 52)
    127.0.0.1.36016 > 127.0.0.1.10450: Flags [.], cksum 0xfe28 (incorrect -> 0x854d), seq 531, ack 3342, win 494, options [nop,nop,TS val 3518206415 ecr 3518206415], length 0
2022-04-07 20:06:46.864323 IP (tos 0x0, ttl 64, id 49173, offset 0, flags [DF], proto TCP (6), length 145)
    127.0.0.1.36016 > 127.0.0.1.10450: Flags [P.], cksum 0xfe85 (incorrect -> 0xec8a), seq 531:624, ack 3342, win 512, options [nop,nop,TS val 3518206416 ecr 3518206415], length 93
2022-04-07 20:06:46.864332 IP (tos 0x0, ttl 64, id 39871, offset 0, flags [DF], proto TCP (6), length 52)
    127.0.0.1.10450 > 127.0.0.1.36016: Flags [.], cksum 0xfe28 (incorrect -> 0x84dc), seq 3342, ack 624, win 512, options [nop,nop,TS val 3518206416 ecr 3518206416], length 0
2022-04-07 20:06:46.995163 IP (tos 0x0, ttl 64, id 39872, offset 0, flags [DF], proto TCP (6), length 310)
    127.0.0.1.10450 > 127.0.0.1.36016: Flags [P.], cksum 0xff2a (incorrect -> 0x7ed6), seq 3342:3600, ack 624, win 512, options [nop,nop,TS val 3518206546 ecr 3518206416], length 258
2022-04-07 20:06:46.995173 IP (tos 0x0, ttl 64, id 49174, offset 0, flags [DF], proto TCP (6), length 52)
    127.0.0.1.36016 > 127.0.0.1.10450: Flags [.], cksum 0xfe28 (incorrect -> 0x82d8), seq 624, ack 3600, win 510, options [nop,nop,TS val 3518206546 ecr 3518206546], length 0
2022-04-07 20:06:46.995677 IP (tos 0x0, ttl 64, id 49175, offset 0, flags [DF], proto TCP (6), length 354)
    127.0.0.1.36016 > 127.0.0.1.10450: Flags [P.], cksum 0xff56 (incorrect -> 0xf2d4), seq 624:926, ack 3600, win 512, options [nop,nop,TS val 3518206547 ecr 3518206546], length 302
2022-04-07 20:06:46.995685 IP (tos 0x0, ttl 64, id 39873, offset 0, flags [DF], proto TCP (6), length 52)
    127.0.0.1.10450 > 127.0.0.1.36016: Flags [.], cksum 0xfe28 (incorrect -> 0x81a8), seq 3600, ack 926, win 510, options [nop,nop,TS val 3518206547 ecr 3518206547], length 0
2022-04-07 20:06:47.107347 IP (tos 0x0, ttl 64, id 39874, offset 0, flags [DF], proto TCP (6), length 220)
    127.0.0.1.10450 > 127.0.0.1.36016: Flags [P.], cksum 0xfed0 (incorrect -> 0xcd07), seq 3600:3768, ack 926, win 512, options [nop,nop,TS val 3518206659 ecr 3518206547], length 168
2022-04-07 20:06:47.109900 IP (tos 0x0, ttl 64, id 34529, offset 0, flags [DF], proto TCP (6), length 60)
    127.0.0.1.36018 > 127.0.0.1.10450: Flags [S], cksum 0xfe30 (incorrect -> 0xd5a5), seq 1854927310, win 65495, options [mss 65495,sackOK,TS val 3518206661 ecr 0,nop,wscale 7], length 0
2022-04-07 20:06:47.109914 IP (tos 0x0, ttl 64, id 0, offset 0, flags [DF], proto TCP (6), length 60)
    127.0.0.1.10450 > 127.0.0.1.36018: Flags [S.], cksum 0xfe30 (incorrect -> 0x339e), seq 1676007843, ack 1854927311, win 65483, options [mss 65495,sackOK,TS val 3518206661 ecr 3518206661,nop,wscale 7], length 0
2022-04-07 20:06:47.109925 IP (tos 0x0, ttl 64, id 34530, offset 0, flags [DF], proto TCP (6), length 52)
    127.0.0.1.36018 > 127.0.0.1.10450: Flags [.], cksum 0xfe28 (incorrect -> 0x5a5a), seq 1, ack 1, win 512, options [nop,nop,TS val 3518206661 ecr 3518206661], length 0
2022-04-07 20:06:47.110035 IP (tos 0x0, ttl 64, id 34531, offset 0, flags [DF], proto TCP (6), length 55)
    127.0.0.1.36018 > 127.0.0.1.10450: Flags [P.], cksum 0xfe2b (incorrect -> 0x554e), seq 1:4, ack 1, win 512, options [nop,nop,TS val 3518206661 ecr 3518206661], length 3
2022-04-07 20:06:47.110041 IP (tos 0x0, ttl 64, id 21230, offset 0, flags [DF], proto TCP (6), length 52)
    127.0.0.1.10450 > 127.0.0.1.36018: Flags [.], cksum 0xfe28 (incorrect -> 0x5a57), seq 1, ack 4, win 512, options [nop,nop,TS val 3518206661 ecr 3518206661], length 0
2022-04-07 20:06:47.110061 IP (tos 0x0, ttl 64, id 21231, offset 0, flags [DF], proto TCP (6), length 54)
    127.0.0.1.10450 > 127.0.0.1.36018: Flags [P.], cksum 0xfe2a (incorrect -> 0x554d), seq 1:3, ack 4, win 512, options [nop,nop,TS val 3518206661 ecr 3518206661], length 2
2022-04-07 20:06:47.110069 IP (tos 0x0, ttl 64, id 34532, offset 0, flags [DF], proto TCP (6), length 52)
    127.0.0.1.36018 > 127.0.0.1.10450: Flags [.], cksum 0xfe28 (incorrect -> 0x5a55), seq 4, ack 3, win 512, options [nop,nop,TS val 3518206661 ecr 3518206661], length 0
2022-04-07 20:06:47.154781 IP (tos 0x0, ttl 64, id 49176, offset 0, flags [DF], proto TCP (6), length 52)
    127.0.0.1.36016 > 127.0.0.1.10450: Flags [.], cksum 0xfe28 (incorrect -> 0x7fef), seq 926, ack 3768, win 512, options [nop,nop,TS val 3518206706 ecr 3518206659], length 0
2022-04-07 20:06:47.161615 IP (tos 0x0, ttl 64, id 34533, offset 0, flags [DF], proto TCP (6), length 62)
    127.0.0.1.36018 > 127.0.0.1.10450: Flags [P.], cksum 0xfe32 (incorrect -> 0x370a), seq 4:14, ack 3, win 512, options [nop,nop,TS val 3518206713 ecr 3518206661], length 10
2022-04-07 20:06:47.161636 IP (tos 0x0, ttl 64, id 21232, offset 0, flags [DF], proto TCP (6), length 52)
    127.0.0.1.10450 > 127.0.0.1.36018: Flags [.], cksum 0xfe28 (incorrect -> 0x59e3), seq 3, ack 14, win 512, options [nop,nop,TS val 3518206713 ecr 3518206713], length 0
2022-04-07 20:06:47.274179 IP (tos 0x0, ttl 64, id 21233, offset 0, flags [DF], proto TCP (6), length 62)
    127.0.0.1.10450 > 127.0.0.1.36018: Flags [P.], cksum 0xfe32 (incorrect -> 0x5460), seq 3:13, ack 14, win 512, options [nop,nop,TS val 3518206825 ecr 3518206713], length 10
2022-04-07 20:06:47.274203 IP (tos 0x0, ttl 64, id 34534, offset 0, flags [DF], proto TCP (6), length 52)
    127.0.0.1.36018 > 127.0.0.1.10450: Flags [.], cksum 0xfe28 (incorrect -> 0x58f9), seq 14, ack 13, win 512, options [nop,nop,TS val 3518206825 ecr 3518206825], length 0
2022-04-07 20:06:47.279733 IP (tos 0x0, ttl 64, id 34535, offset 0, flags [DF], proto TCP (6), length 569)
    127.0.0.1.36018 > 127.0.0.1.10450: Flags [P.], cksum 0x002e (incorrect -> 0x0fdf), seq 14:531, ack 13, win 512, options [nop,nop,TS val 3518206831 ecr 3518206825], length 517
2022-04-07 20:06:47.279744 IP (tos 0x0, ttl 64, id 21234, offset 0, flags [DF], proto TCP (6), length 52)
    127.0.0.1.10450 > 127.0.0.1.36018: Flags [.], cksum 0xfe28 (incorrect -> 0x56ec), seq 13, ack 531, win 508, options [nop,nop,TS val 3518206831 ecr 3518206831], length 0
2022-04-07 20:06:47.397765 IP (tos 0x0, ttl 64, id 21235, offset 0, flags [DF], proto TCP (6), length 3381)
    127.0.0.1.10450 > 127.0.0.1.36018: Flags [P.], cksum 0x0b2a (incorrect -> 0x8266), seq 13:3342, ack 531, win 512, options [nop,nop,TS val 3518206949 ecr 3518206831], length 3329
2022-04-07 20:06:47.397784 IP (tos 0x0, ttl 64, id 34536, offset 0, flags [DF], proto TCP (6), length 52)
    127.0.0.1.36018 > 127.0.0.1.10450: Flags [.], cksum 0xfe28 (incorrect -> 0x490d), seq 531, ack 3342, win 494, options [nop,nop,TS val 3518206949 ecr 3518206949], length 0
2022-04-07 20:06:47.398338 IP (tos 0x0, ttl 64, id 34537, offset 0, flags [DF], proto TCP (6), length 145)
    127.0.0.1.36018 > 127.0.0.1.10450: Flags [P.], cksum 0xfe85 (incorrect -> 0xfbc2), seq 531:624, ack 3342, win 512, options [nop,nop,TS val 3518206950 ecr 3518206949], length 93
2022-04-07 20:06:47.398347 IP (tos 0x0, ttl 64, id 21236, offset 0, flags [DF], proto TCP (6), length 52)
    127.0.0.1.10450 > 127.0.0.1.36018: Flags [.], cksum 0xfe28 (incorrect -> 0x489c), seq 3342, ack 624, win 512, options [nop,nop,TS val 3518206950 ecr 3518206950], length 0
2022-04-07 20:06:47.544213 IP (tos 0x0, ttl 64, id 21237, offset 0, flags [DF], proto TCP (6), length 310)
    127.0.0.1.10450 > 127.0.0.1.36018: Flags [P.], cksum 0xff2a (incorrect -> 0x3e29), seq 3342:3600, ack 624, win 512, options [nop,nop,TS val 3518207095 ecr 3518206950], length 258
2022-04-07 20:06:47.544223 IP (tos 0x0, ttl 64, id 34538, offset 0, flags [DF], proto TCP (6), length 52)
    127.0.0.1.36018 > 127.0.0.1.10450: Flags [.], cksum 0xfe28 (incorrect -> 0x467a), seq 624, ack 3600, win 510, options [nop,nop,TS val 3518207095 ecr 3518207095], length 0
2022-04-07 20:06:47.544597 IP (tos 0x0, ttl 64, id 34539, offset 0, flags [DF], proto TCP (6), length 350)
    127.0.0.1.36018 > 127.0.0.1.10450: Flags [P.], cksum 0xff52 (incorrect -> 0xd2a9), seq 624:922, ack 3600, win 512, options [nop,nop,TS val 3518207096 ecr 3518207095], length 298
2022-04-07 20:06:47.544605 IP (tos 0x0, ttl 64, id 21238, offset 0, flags [DF], proto TCP (6), length 52)
    127.0.0.1.10450 > 127.0.0.1.36018: Flags [.], cksum 0xfe28 (incorrect -> 0x454e), seq 3600, ack 922, win 510, options [nop,nop,TS val 3518207096 ecr 3518207096], length 0
2022-04-07 20:06:47.675361 IP (tos 0x0, ttl 64, id 21239, offset 0, flags [DF], proto TCP (6), length 2848)
    127.0.0.1.10450 > 127.0.0.1.36018: Flags [P.], cksum 0x0915 (incorrect -> 0x2585), seq 3600:6396, ack 922, win 512, options [nop,nop,TS val 3518207227 ecr 3518207096], length 2796
2022-04-07 20:06:47.718798 IP (tos 0x0, ttl 64, id 34540, offset 0, flags [DF], proto TCP (6), length 52)
    127.0.0.1.36018 > 127.0.0.1.10450: Flags [.], cksum 0xfe28 (incorrect -> 0x392f), seq 922, ack 6396, win 512, options [nop,nop,TS val 3518207270 ecr 3518207227], length 0
2022-04-07 20:06:47.718808 IP (tos 0x0, ttl 64, id 21240, offset 0, flags [DF], proto TCP (6), length 15780)
    127.0.0.1.10450 > 127.0.0.1.36018: Flags [P.], cksum 0x3b99 (incorrect -> 0x1b6a), seq 6396:22124, ack 922, win 512, options [nop,nop,TS val 3518207270 ecr 3518207270], length 15728
2022-04-07 20:06:47.718814 IP (tos 0x0, ttl 64, id 34541, offset 0, flags [DF], proto TCP (6), length 52)
    127.0.0.1.36018 > 127.0.0.1.10450: Flags [.], cksum 0xfe28 (incorrect -> 0xfbd5), seq 922, ack 22124, win 446, options [nop,nop,TS val 3518207270 ecr 3518207270], length 0
2022-04-07 20:06:47.736336 IP (tos 0x0, ttl 64, id 21241, offset 0, flags [DF], proto TCP (6), length 1500)
    127.0.0.1.10450 > 127.0.0.1.36018: Flags [P.], cksum 0x03d1 (incorrect -> 0xbb4b), seq 22124:23572, ack 922, win 512, options [nop,nop,TS val 3518207288 ecr 3518207270], length 1448
2022-04-07 20:06:47.736347 IP (tos 0x0, ttl 64, id 34542, offset 0, flags [DF], proto TCP (6), length 52)
    127.0.0.1.36018 > 127.0.0.1.10450: Flags [.], cksum 0xfe28 (incorrect -> 0xf5d1), seq 922, ack 23572, win 502, options [nop,nop,TS val 3518207288 ecr 3518207288], length 0
2022-04-07 20:06:47.741206 IP (tos 0x0, ttl 64, id 21242, offset 0, flags [DF], proto TCP (6), length 2948)
    127.0.0.1.10450 > 127.0.0.1.36018: Flags [P.], cksum 0x0979 (incorrect -> 0x5a3d), seq 23572:26468, ack 922, win 512, options [nop,nop,TS val 3518207292 ecr 3518207288], length 2896
2022-04-07 20:06:47.741213 IP (tos 0x0, ttl 64, id 34543, offset 0, flags [DF], proto TCP (6), length 52)
    127.0.0.1.36018 > 127.0.0.1.10450: Flags [.], cksum 0xfe28 (incorrect -> 0xea7f), seq 922, ack 26468, win 496, options [nop,nop,TS val 3518207292 ecr 3518207292], length 0
2022-04-07 20:06:47.745551 IP (tos 0x0, ttl 64, id 21243, offset 0, flags [DF], proto TCP (6), length 2948)
    127.0.0.1.10450 > 127.0.0.1.36018: Flags [P.], cksum 0x0979 (incorrect -> 0x926c), seq 26468:29364, ack 922, win 512, options [nop,nop,TS val 3518207297 ecr 3518207292], length 2896
2022-04-07 20:06:47.745559 IP (tos 0x0, ttl 64, id 34544, offset 0, flags [DF], proto TCP (6), length 52)
    127.0.0.1.36018 > 127.0.0.1.10450: Flags [.], cksum 0xfe28 (incorrect -> 0xdf25), seq 922, ack 29364, win 496, options [nop,nop,TS val 3518207297 ecr 3518207297], length 0
2022-04-07 20:06:47.745853 IP (tos 0x0, ttl 64, id 21244, offset 0, flags [DF], proto TCP (6), length 2948)
    127.0.0.1.10450 > 127.0.0.1.36018: Flags [P.], cksum 0x0979 (incorrect -> 0x695d), seq 29364:32260, ack 922, win 512, options [nop,nop,TS val 3518207297 ecr 3518207297], length 2896
2022-04-07 20:06:47.745857 IP (tos 0x0, ttl 64, id 34545, offset 0, flags [DF], proto TCP (6), length 52)
    127.0.0.1.36018 > 127.0.0.1.10450: Flags [.], cksum 0xfe28 (incorrect -> 0xd3e0), seq 922, ack 32260, win 485, options [nop,nop,TS val 3518207297 ecr 3518207297], length 0
2022-04-07 20:06:47.753544 IP (tos 0x0, ttl 64, id 21245, offset 0, flags [DF], proto TCP (6), length 2948)
    127.0.0.1.10450 > 127.0.0.1.36018: Flags [P.], cksum 0x0979 (incorrect -> 0x91cb), seq 32260:35156, ack 922, win 512, options [nop,nop,TS val 3518207305 ecr 3518207297], length 2896
2022-04-07 20:06:47.753551 IP (tos 0x0, ttl 64, id 34546, offset 0, flags [DF], proto TCP (6), length 52)
    127.0.0.1.36018 > 127.0.0.1.10450: Flags [.], cksum 0xfe28 (incorrect -> 0xc875), seq 922, ack 35156, win 496, options [nop,nop,TS val 3518207305 ecr 3518207305], length 0
2022-04-07 20:06:47.762855 IP (tos 0x0, ttl 64, id 21246, offset 0, flags [DF], proto TCP (6), length 2948)
    127.0.0.1.10450 > 127.0.0.1.36018: Flags [P.], cksum 0x0979 (incorrect -> 0x4042), seq 35156:38052, ack 922, win 512, options [nop,nop,TS val 3518207314 ecr 3518207305], length 2896
2022-04-07 20:06:47.762862 IP (tos 0x0, ttl 64, id 34547, offset 0, flags [DF], proto TCP (6), length 52)
    127.0.0.1.36018 > 127.0.0.1.10450: Flags [.], cksum 0xfe28 (incorrect -> 0xbd13), seq 922, ack 38052, win 496, options [nop,nop,TS val 3518207314 ecr 3518207314], length 0
2022-04-07 20:06:47.768045 IP (tos 0x0, ttl 64, id 21247, offset 0, flags [DF], proto TCP (6), length 3446)
    127.0.0.1.10450 > 127.0.0.1.36018: Flags [P.], cksum 0x0b6b (incorrect -> 0xb9a8), seq 38052:41446, ack 922, win 512, options [nop,nop,TS val 3518207319 ecr 3518207314], length 3394
200, 5.878882646560669, 1.2337524890899658