2022-04-07 12:35:54.802429 IP (tos 0x0, ttl 64, id 20316, offset 0, flags [DF], proto TCP (6), length 60)
    127.0.0.1.42566 > 127.0.0.1.11350: Flags [S], cksum 0xfe30 (incorrect -> 0x3557), seq 4232294912, win 65495, options [mss 65495,sackOK,TS val 3491154354 ecr 0,nop,wscale 7], length 0
2022-04-07 12:35:54.802448 IP (tos 0x0, ttl 64, id 0, offset 0, flags [DF], proto TCP (6), length 60)
    127.0.0.1.11350 > 127.0.0.1.42566: Flags [S.], cksum 0xfe30 (incorrect -> 0x9247), seq 2617142594, ack 4232294913, win 65483, options [mss 65495,sackOK,TS val 3491154354 ecr 3491154354,nop,wscale 7], length 0
2022-04-07 12:35:54.802462 IP (tos 0x0, ttl 64, id 20317, offset 0, flags [DF], proto TCP (6), length 52)
    127.0.0.1.42566 > 127.0.0.1.11350: Flags [.], cksum 0xfe28 (incorrect -> 0xb903), seq 1, ack 1, win 512, options [nop,nop,TS val 3491154354 ecr 3491154354], length 0
2022-04-07 12:35:54.802557 IP (tos 0x0, ttl 64, id 20318, offset 0, flags [DF], proto TCP (6), length 55)
    127.0.0.1.42566 > 127.0.0.1.11350: Flags [P.], cksum 0xfe2b (incorrect -> 0xb3f7), seq 1:4, ack 1, win 512, options [nop,nop,TS val 3491154354 ecr 3491154354], length 3
2022-04-07 12:35:54.802561 IP (tos 0x0, ttl 64, id 41492, offset 0, flags [DF], proto TCP (6), length 52)
    127.0.0.1.11350 > 127.0.0.1.42566: Flags [.], cksum 0xfe28 (incorrect -> 0xb900), seq 1, ack 4, win 512, options [nop,nop,TS val 3491154354 ecr 3491154354], length 0
2022-04-07 12:35:54.802632 IP (tos 0x0, ttl 64, id 41493, offset 0, flags [DF], proto TCP (6), length 54)
    127.0.0.1.11350 > 127.0.0.1.42566: Flags [P.], cksum 0xfe2a (incorrect -> 0xb3f6), seq 1:3, ack 4, win 512, options [nop,nop,TS val 3491154354 ecr 3491154354], length 2
2022-04-07 12:35:54.802635 IP (tos 0x0, ttl 64, id 20319, offset 0, flags [DF], proto TCP (6), length 52)
    127.0.0.1.42566 > 127.0.0.1.11350: Flags [.], cksum 0xfe28 (incorrect -> 0xb8fe), seq 4, ack 3, win 512, options [nop,nop,TS val 3491154354 ecr 3491154354], length 0
2022-04-07 12:35:54.805084 IP (tos 0x0, ttl 64, id 20320, offset 0, flags [DF], proto TCP (6), length 62)
    127.0.0.1.42566 > 127.0.0.1.11350: Flags [P.], cksum 0xfe32 (incorrect -> 0x9248), seq 4:14, ack 3, win 512, options [nop,nop,TS val 3491154356 ecr 3491154354], length 10
2022-04-07 12:35:54.805112 IP (tos 0x0, ttl 64, id 41494, offset 0, flags [DF], proto TCP (6), length 52)
    127.0.0.1.11350 > 127.0.0.1.42566: Flags [.], cksum 0xfe28 (incorrect -> 0xb8f0), seq 3, ack 14, win 512, options [nop,nop,TS val 3491154356 ecr 3491154356], length 0
2022-04-07 12:35:54.883079 IP (tos 0x0, ttl 64, id 41495, offset 0, flags [DF], proto TCP (6), length 62)
    127.0.0.1.11350 > 127.0.0.1.42566: Flags [P.], cksum 0xfe32 (incorrect -> 0xb38f), seq 3:13, ack 14, win 512, options [nop,nop,TS val 3491154434 ecr 3491154356], length 10
2022-04-07 12:35:54.883089 IP (tos 0x0, ttl 64, id 20321, offset 0, flags [DF], proto TCP (6), length 52)
    127.0.0.1.42566 > 127.0.0.1.11350: Flags [.], cksum 0xfe28 (incorrect -> 0xb84a), seq 14, ack 13, win 512, options [nop,nop,TS val 3491154434 ecr 3491154434], length 0
2022-04-07 12:35:54.888925 IP (tos 0x0, ttl 64, id 20322, offset 0, flags [DF], proto TCP (6), length 569)
    127.0.0.1.42566 > 127.0.0.1.11350: Flags [P.], cksum 0x002e (incorrect -> 0x06b9), seq 14:531, ack 13, win 512, options [nop,nop,TS val 3491154440 ecr 3491154434], length 517
2022-04-07 12:35:54.888945 IP (tos 0x0, ttl 64, id 41496, offset 0, flags [DF], proto TCP (6), length 52)
    127.0.0.1.11350 > 127.0.0.1.42566: Flags [.], cksum 0xfe28 (incorrect -> 0xb63d), seq 13, ack 531, win 508, options [nop,nop,TS val 3491154440 ecr 3491154440], length 0
2022-04-07 12:35:54.984260 IP (tos 0x0, ttl 64, id 41497, offset 0, flags [DF], proto TCP (6), length 3538)
    127.0.0.1.11350 > 127.0.0.1.42566: Flags [P.], cksum 0x0bc7 (incorrect -> 0x0dd8), seq 13:3499, ack 531, win 512, options [nop,nop,TS val 3491154536 ecr 3491154440], length 3486
2022-04-07 12:35:54.984272 IP (tos 0x0, ttl 64, id 20323, offset 0, flags [DF], proto TCP (6), length 52)
    127.0.0.1.42566 > 127.0.0.1.11350: Flags [.], cksum 0xfe28 (incorrect -> 0xa7ed), seq 531, ack 3499, win 494, options [nop,nop,TS val 3491154536 ecr 3491154536], length 0
2022-04-07 12:35:55.002852 IP (tos 0x0, ttl 64, id 41498, offset 0, flags [DF], proto TCP (6), length 1348)
    127.0.0.1.11350 > 127.0.0.1.42566: Flags [P.], cksum 0x0339 (incorrect -> 0xdcf1), seq 3499:4795, ack 531, win 512, options [nop,nop,TS val 3491154554 ecr 3491154536], length 1296
2022-04-07 12:35:55.002859 IP (tos 0x0, ttl 64, id 20324, offset 0, flags [DF], proto TCP (6), length 52)
    127.0.0.1.42566 > 127.0.0.1.11350: Flags [.], cksum 0xfe28 (incorrect -> 0xa2b1), seq 531, ack 4795, win 502, options [nop,nop,TS val 3491154554 ecr 3491154554], length 0
2022-04-07 12:35:55.003367 IP (tos 0x0, ttl 64, id 20325, offset 0, flags [DF], proto TCP (6), length 132)
    127.0.0.1.42566 > 127.0.0.1.11350: Flags [P.], cksum 0xfe78 (incorrect -> 0xbcf0), seq 531:611, ack 4795, win 512, options [nop,nop,TS val 3491154555 ecr 3491154554], length 80
2022-04-07 12:35:55.003374 IP (tos 0x0, ttl 64, id 41499, offset 0, flags [DF], proto TCP (6), length 52)
    127.0.0.1.11350 > 127.0.0.1.42566: Flags [.], cksum 0xfe28 (incorrect -> 0xa255), seq 4795, ack 611, win 512, options [nop,nop,TS val 3491154555 ecr 3491154555], length 0
2022-04-07 12:35:55.003867 IP (tos 0x0, ttl 64, id 20326, offset 0, flags [DF], proto TCP (6), length 331)
    127.0.0.1.42566 > 127.0.0.1.11350: Flags [P.], cksum 0xff3f (incorrect -> 0x9cdb), seq 611:890, ack 4795, win 512, options [nop,nop,TS val 3491154555 ecr 3491154555], length 279
2022-04-07 12:35:55.003871 IP (tos 0x0, ttl 64, id 41500, offset 0, flags [DF], proto TCP (6), length 52)
    127.0.0.1.11350 > 127.0.0.1.42566: Flags [.], cksum 0xfe28 (incorrect -> 0xa140), seq 4795, ack 890, win 510, options [nop,nop,TS val 3491154555 ecr 3491154555], length 0
2022-04-07 12:35:55.331818 IP (tos 0x0, ttl 64, id 41501, offset 0, flags [DF], proto TCP (6), length 3538)
    127.0.0.1.11350 > 127.0.0.1.42566: Flags [P.], cksum 0x0bc7 (incorrect -> 0x53a6), seq 4795:8281, ack 890, win 512, options [nop,nop,TS val 3491154883 ecr 3491154555], length 3486
2022-04-07 12:35:55.331828 IP (tos 0x0, ttl 64, id 20327, offset 0, flags [DF], proto TCP (6), length 52)
    127.0.0.1.42566 > 127.0.0.1.11350: Flags [.], cksum 0xfe28 (incorrect -> 0x9122), seq 890, ack 8281, win 494, options [nop,nop,TS val 3491154883 ecr 3491154883], length 0
2022-04-07 12:35:55.332905 IP (tos 0x0, ttl 64, id 41502, offset 0, flags [DF], proto TCP (6), length 3538)
    127.0.0.1.11350 > 127.0.0.1.42566: Flags [P.], cksum 0x0bc7 (incorrect -> 0x1b48), seq 8281:11767, ack 890, win 512, options [nop,nop,TS val 3491154884 ecr 3491154883], length 3486
2022-04-07 12:35:55.332910 IP (tos 0x0, ttl 64, id 20328, offset 0, flags [DF], proto TCP (6), length 52)
    127.0.0.1.42566 > 127.0.0.1.11350: Flags [.], cksum 0xfe28 (incorrect -> 0x8382), seq 890, ack 11767, win 494, options [nop,nop,TS val 3491154884 ecr 3491154884], length 0
2022-04-07 12:35:55.332941 IP (tos 0x0, ttl 64, id 41503, offset 0, flags [DF], proto TCP (6), length 4036)
    127.0.0.1.11350 > 127.0.0.1.42566: Flags [P.], cksum 0x0db9 (incorrect -> 0x3116), seq 11767:15751, ack 890, win 512, options [nop,nop,TS val 3491154884 ecr 3491154884], length 3984
2022-04-07 12:35:55.332944 IP (tos 0x0, ttl 64, id 20329, offset 0, flags [DF], proto TCP (6), length 52)
    127.0.0.1.42566 > 127.0.0.1.11350: Flags [.], cksum 0xfe28 (incorrect -> 0x7402), seq 890, ack 15751, win 478, options [nop,nop,TS val 3491154884 ecr 3491154884], length 0
2022-04-07 12:35:55.341245 IP (tos 0x0, ttl 64, id 41504, offset 0, flags [DF], proto TCP (6), length 2044)
    127.0.0.1.11350 > 127.0.0.1.42566: Flags [P.], cksum 0x05f1 (incorrect -> 0xeeef), seq 15751:17743, ack 890, win 512, options [nop,nop,TS val 3491154893 ecr 3491154884], length 1992
2022-04-07 12:35:55.341249 IP (tos 0x0, ttl 64, id 20330, offset 0, flags [DF], proto TCP (6), length 52)
    127.0.0.1.42566 > 127.0.0.1.11350: Flags [.], cksum 0xfe28 (incorrect -> 0x6c12), seq 890, ack 17743, win 500, options [nop,nop,TS val 3491154893 ecr 3491154893], length 0
2022-04-07 12:35:55.352955 IP (tos 0x0, ttl 64, id 41505, offset 0, flags [DF], proto TCP (6), length 3538)
    127.0.0.1.11350 > 127.0.0.1.42566: Flags [P.], cksum 0x0bc7 (incorrect -> 0x0b8c), seq 17743:21229, ack 890, win 512, options [nop,nop,TS val 3491154904 ecr 3491154893], length 3486
2022-04-07 12:35:55.352959 IP (tos 0x0, ttl 64, id 20331, offset 0, flags [DF], proto TCP (6), length 52)
    127.0.0.1.42566 > 127.0.0.1.11350: Flags [.], cksum 0xfe28 (incorrect -> 0x5e64), seq 890, ack 21229, win 494, options [nop,nop,TS val 3491154904 ecr 3491154904], length 0
2022-04-07 12:35:55.353395 IP (tos 0x0, ttl 64, id 41506, offset 0, flags [DF], proto TCP (6), length 4100)
    127.0.0.1.11350 > 127.0.0.1.42566: Flags [P.], cksum 0x0df9 (incorrect -> 0xd2da), seq 21229:25277, ack 890, win 512, options [nop,nop,TS val 3491154905 ecr 3491154904], length 4048
2022-04-07 12:35:55.353405 IP (tos 0x0, ttl 64, id 20332, offset 0, flags [DF], proto TCP (6), length 52)
    127.0.0.1.42566 > 127.0.0.1.11350: Flags [.], cksum 0xfe28 (incorrect -> 0x4e94), seq 890, ack 25277, win 492, options [nop,nop,TS val 3491154905 ecr 3491154905], length 0
2022-04-07 12:35:55.353413 IP (tos 0x0, ttl 64, id 41507, offset 0, flags [DF], proto TCP (6), length 3474)
    127.0.0.1.11350 > 127.0.0.1.42566: Flags [P.], cksum 0x0b87 (incorrect -> 0x1648), seq 25277:28699, ack 890, win 512, options [nop,nop,TS val 3491154905 ecr 3491154905], length 3422
2022-04-07 12:35:55.353417 IP (tos 0x0, ttl 64, id 20333, offset 0, flags [DF], proto TCP (6), length 52)
    127.0.0.1.42566 > 127.0.0.1.11350: Flags [.], cksum 0xfe28 (incorrect -> 0x4144), seq 890, ack 28699, win 478, options [nop,nop,TS val 3491154905 ecr 3491154905], length 0
2022-04-07 12:35:55.362363 IP (tos 0x0, ttl 64, id 41508, offset 0, flags [DF], proto TCP (6), length 2542)
    127.0.0.1.11350 > 127.0.0.1.42566: Flags [P.], cksum 0x07e3 (incorrect -> 0x7e79), seq 28699:31189, ack 890, win 512, options [nop,nop,TS val 3491154914 ecr 3491154905], length 2490
2022-04-07 12:35:55.362368 IP (tos 0x0, ttl 64, id 20334, offset 0, flags [DF], proto TCP (6), length 52)
    127.0.0.1.42566 > 127.0.0.1.11350: Flags [.], cksum 0xfe28 (incorrect -> 0x3764), seq 890, ack 31189, win 498, options [nop,nop,TS val 3491154914 ecr 3491154914], length 0
2022-04-07 12:35:55.374961 IP (tos 0x0, ttl 64, id 41509, offset 0, flags [DF], proto TCP (6), length 3538)
    127.0.0.1.11350 > 127.0.0.1.42566: Flags [P.], cksum 0x0bc7 (incorrect -> 0xe2c1), seq 31189:34675, ack 890, win 512, options [nop,nop,TS val 3491154926 ecr 3491154914], length 3486
2022-04-07 12:35:55.374967 IP (tos 0x0, ttl 64, id 20335, offset 0, flags [DF], proto TCP (6), length 52)
    127.0.0.1.42566 > 127.0.0.1.11350: Flags [.], cksum 0xfe28 (incorrect -> 0x29b2), seq 890, ack 34675, win 494, options [nop,nop,TS val 3491154926 ecr 3491154926], length 0
2022-04-07 12:35:55.376913 IP (tos 0x0, ttl 64, id 41510, offset 0, flags [DF], proto TCP (6), length 4036)
    127.0.0.1.11350 > 127.0.0.1.42566: Flags [P.], cksum 0x0db9 (incorrect -> 0x5e40), seq 34675:38659, ack 890, win 512, options [nop,nop,TS val 3491154928 ecr 3491154926], length 3984
2022-04-07 12:35:55.377467 IP (tos 0x0, ttl 64, id 20336, offset 0, flags [DF], proto TCP (6), length 52)
    127.0.0.1.42566 > 127.0.0.1.11350: Flags [.], cksum 0xfe28 (incorrect -> 0x1a0b), seq 890, ack 38659, win 512, options [nop,nop,TS val 3491154929 ecr 3491154928], length 0
2022-04-07 12:35:55.384364 IP (tos 0x0, ttl 64, id 41511, offset 0, flags [DF], proto TCP (6), length 4036)
    127.0.0.1.11350 > 127.0.0.1.42566: Flags [P.], cksum 0x0db9 (incorrect -> 0x73b2), seq 38659:42643, ack 890, win 512, options [nop,nop,TS val 3491154936 ecr 3491154929], length 3984
2022-04-07 12:35:55.426785 IP (tos 0x0, ttl 64, id 20337, offset 0, flags [DF], proto TCP (6), length 52)
    127.0.0.1.42566 > 127.0.0.1.11350: Flags [.], cksum 0xfe28 (incorrect -> 0x0a42), seq 890, ack 42643, win 512, options [nop,nop,TS val 3491154978 ecr 3491154936], length 0
2022-04-07 12:35:55.426799 IP (tos 0x0, ttl 64, id 41512, offset 0, flags [DF], proto TCP (6), length 25948)
    127.0.0.1.11350 > 127.0.0.1.42566: Flags [P.], cksum 0x6351 (incorrect -> 0xa77f), seq 42643:68539, ack 890, win 512, options [nop,nop,TS val 3491154978 ecr 3491154978], length 25896
2022-04-07 12:35:55.470782 IP (tos 0x0, ttl 64, id 20338, offset 0, flags [DF], proto TCP (6), length 52)
    127.0.0.1.42566 > 127.0.0.1.11350: Flags [.], cksum 0xfe28 (incorrect -> 0xa4c3), seq 890, ack 68539, win 512, options [nop,nop,TS val 3491155022 ecr 3491154978], length 0
2022-04-07 12:35:55.470797 IP (tos 0x0, ttl 64, id 41513, offset 0, flags [DF], proto TCP (6), length 30928)
    127.0.0.1.11350 > 127.0.0.1.42566: Flags [P.], cksum 0x76c5 (incorrect -> 0x50b4), seq 68539:99415, ack 890, win 512, options [nop,nop,TS val 3491155022 ecr 3491155022], length 30876
200, 124.07829856872559, 0.7711396217346191