2022-04-07 07:55:54.951260 IP (tos 0x0, ttl 64, id 6344, offset 0, flags [DF], proto TCP (6), length 60)
    127.0.0.1.35974 > 127.0.0.1.12250: Flags [S], cksum 0xfe30 (incorrect -> 0x0bf8), seq 4240196160, win 65495, options [mss 65495,sackOK,TS val 400437454 ecr 0,nop,wscale 7], length 0
2022-04-07 07:55:54.951271 IP (tos 0x0, ttl 64, id 0, offset 0, flags [DF], proto TCP (6), length 60)
    127.0.0.1.12250 > 127.0.0.1.35974: Flags [S.], cksum 0xfe30 (incorrect -> 0x404d), seq 892620229, ack 4240196161, win 65483, options [mss 65495,sackOK,TS val 400437454 ecr 400437454,nop,wscale 7], length 0
2022-04-07 07:55:54.951281 IP (tos 0x0, ttl 64, id 6345, offset 0, flags [DF], proto TCP (6), length 52)
    127.0.0.1.35974 > 127.0.0.1.12250: Flags [.], cksum 0xfe28 (incorrect -> 0x6709), seq 1, ack 1, win 512, options [nop,nop,TS val 400437454 ecr 400437454], length 0
2022-04-07 07:55:54.951439 IP (tos 0x0, ttl 64, id 6346, offset 0, flags [DF], proto TCP (6), length 55)
    127.0.0.1.35974 > 127.0.0.1.12250: Flags [P.], cksum 0xfe2b (incorrect -> 0x61fd), seq 1:4, ack 1, win 512, options [nop,nop,TS val 400437454 ecr 400437454], length 3
2022-04-07 07:55:54.951447 IP (tos 0x0, ttl 64, id 52445, offset 0, flags [DF], proto TCP (6), length 52)
    127.0.0.1.12250 > 127.0.0.1.35974: Flags [.], cksum 0xfe28 (incorrect -> 0x6706), seq 1, ack 4, win 512, options [nop,nop,TS val 400437454 ecr 400437454], length 0
2022-04-07 07:55:54.951472 IP (tos 0x0, ttl 64, id 52446, offset 0, flags [DF], proto TCP (6), length 54)
    127.0.0.1.12250 > 127.0.0.1.35974: Flags [P.], cksum 0xfe2a (incorrect -> 0x61fc), seq 1:3, ack 4, win 512, options [nop,nop,TS val 400437454 ecr 400437454], length 2
2022-04-07 07:55:54.951481 IP (tos 0x0, ttl 64, id 6347, offset 0, flags [DF], proto TCP (6), length 52)
    127.0.0.1.35974 > 127.0.0.1.12250: Flags [.], cksum 0xfe28 (incorrect -> 0x6704), seq 4, ack 3, win 512, options [nop,nop,TS val 400437454 ecr 400437454], length 0
2022-04-07 07:55:54.963361 IP (tos 0x0, ttl 64, id 6348, offset 0, flags [DF], proto TCP (6), length 62)
    127.0.0.1.35974 > 127.0.0.1.12250: Flags [P.], cksum 0xfe32 (incorrect -> 0x62f8), seq 4:14, ack 3, win 512, options [nop,nop,TS val 400437466 ecr 400437454], length 10
2022-04-07 07:55:54.963383 IP (tos 0x0, ttl 64, id 52447, offset 0, flags [DF], proto TCP (6), length 52)
    127.0.0.1.12250 > 127.0.0.1.35974: Flags [.], cksum 0xfe28 (incorrect -> 0x66e2), seq 3, ack 14, win 512, options [nop,nop,TS val 400437466 ecr 400437466], length 0
2022-04-07 07:55:55.192947 IP (tos 0x0, ttl 64, id 52448, offset 0, flags [DF], proto TCP (6), length 62)
    127.0.0.1.12250 > 127.0.0.1.35974: Flags [P.], cksum 0xfe32 (incorrect -> 0x60ea), seq 3:13, ack 14, win 512, options [nop,nop,TS val 400437695 ecr 400437466], length 10
2022-04-07 07:55:55.192961 IP (tos 0x0, ttl 64, id 6349, offset 0, flags [DF], proto TCP (6), length 52)
    127.0.0.1.35974 > 127.0.0.1.12250: Flags [.], cksum 0xfe28 (incorrect -> 0x650e), seq 14, ack 13, win 512, options [nop,nop,TS val 400437695 ecr 400437695], length 0
2022-04-07 07:55:55.198407 IP (tos 0x0, ttl 64, id 6350, offset 0, flags [DF], proto TCP (6), length 569)
    127.0.0.1.35974 > 127.0.0.1.12250: Flags [P.], cksum 0x002e (incorrect -> 0x23f8), seq 14:531, ack 13, win 512, options [nop,nop,TS val 400437701 ecr 400437695], length 517
2022-04-07 07:55:55.198417 IP (tos 0x0, ttl 64, id 52449, offset 0, flags [DF], proto TCP (6), length 52)
    127.0.0.1.12250 > 127.0.0.1.35974: Flags [.], cksum 0xfe28 (incorrect -> 0x6301), seq 13, ack 531, win 508, options [nop,nop,TS val 400437701 ecr 400437701], length 0
2022-04-07 07:55:55.433049 IP (tos 0x0, ttl 64, id 52450, offset 0, flags [DF], proto TCP (6), length 3538)
    127.0.0.1.12250 > 127.0.0.1.35974: Flags [P.], cksum 0x0bc7 (incorrect -> 0x3d84), seq 13:3499, ack 531, win 512, options [nop,nop,TS val 400437935 ecr 400437701], length 3486
2022-04-07 07:55:55.433060 IP (tos 0x0, ttl 64, id 6351, offset 0, flags [DF], proto TCP (6), length 52)
    127.0.0.1.35974 > 127.0.0.1.12250: Flags [.], cksum 0xfe28 (incorrect -> 0x539d), seq 531, ack 3499, win 494, options [nop,nop,TS val 400437935 ecr 400437935], length 0
2022-04-07 07:55:55.565606 IP (tos 0x0, ttl 64, id 52451, offset 0, flags [DF], proto TCP (6), length 64)
    127.0.0.1.12250 > 127.0.0.1.35974: Flags [P.], cksum 0xfe34 (incorrect -> 0x192a), seq 3499:3511, ack 531, win 512, options [nop,nop,TS val 400438068 ecr 400437935], length 12
2022-04-07 07:55:55.565624 IP (tos 0x0, ttl 64, id 6352, offset 0, flags [DF], proto TCP (6), length 52)
    127.0.0.1.35974 > 127.0.0.1.12250: Flags [.], cksum 0xfe28 (incorrect -> 0x527a), seq 531, ack 3511, win 507, options [nop,nop,TS val 400438068 ecr 400438068], length 0
2022-04-07 07:55:55.565931 IP (tos 0x0, ttl 64, id 6353, offset 0, flags [DF], proto TCP (6), length 178)
    127.0.0.1.35974 > 127.0.0.1.12250: Flags [P.], cksum 0xfea6 (incorrect -> 0x7d94), seq 531:657, ack 3511, win 512, options [nop,nop,TS val 400438068 ecr 400438068], length 126
2022-04-07 07:55:55.565940 IP (tos 0x0, ttl 64, id 52452, offset 0, flags [DF], proto TCP (6), length 52)
    127.0.0.1.12250 > 127.0.0.1.35974: Flags [.], cksum 0xfe28 (incorrect -> 0x51f7), seq 3511, ack 657, win 512, options [nop,nop,TS val 400438068 ecr 400438068], length 0
2022-04-07 07:55:55.811446 IP (tos 0x0, ttl 64, id 52453, offset 0, flags [DF], proto TCP (6), length 103)
    127.0.0.1.12250 > 127.0.0.1.35974: Flags [P.], cksum 0xfe5b (incorrect -> 0xa174), seq 3511:3562, ack 657, win 512, options [nop,nop,TS val 400438314 ecr 400438068], length 51
2022-04-07 07:55:55.811459 IP (tos 0x0, ttl 64, id 6354, offset 0, flags [DF], proto TCP (6), length 52)
    127.0.0.1.35974 > 127.0.0.1.12250: Flags [.], cksum 0xfe28 (incorrect -> 0x4fd8), seq 657, ack 3562, win 512, options [nop,nop,TS val 400438314 ecr 400438314], length 0
2022-04-07 07:55:55.811904 IP (tos 0x0, ttl 64, id 6355, offset 0, flags [DF], proto TCP (6), length 343)
    127.0.0.1.35974 > 127.0.0.1.12250: Flags [P.], cksum 0xff4b (incorrect -> 0x9030), seq 657:948, ack 3562, win 512, options [nop,nop,TS val 400438314 ecr 400438314], length 291
2022-04-07 07:55:55.811913 IP (tos 0x0, ttl 64, id 52454, offset 0, flags [DF], proto TCP (6), length 52)
    127.0.0.1.12250 > 127.0.0.1.35974: Flags [.], cksum 0xfe28 (incorrect -> 0x4eb7), seq 3562, ack 948, win 510, options [nop,nop,TS val 400438314 ecr 400438314], length 0
2022-04-07 07:55:56.042091 IP (tos 0x0, ttl 64, id 52455, offset 0, flags [DF], proto TCP (6), length 3538)
    127.0.0.1.12250 > 127.0.0.1.35974: Flags [P.], cksum 0x0bc7 (incorrect -> 0x2769), seq 3562:7048, ack 948, win 512, options [nop,nop,TS val 400438545 ecr 400438314], length 3486
2022-04-07 07:55:56.082660 IP (tos 0x0, ttl 64, id 6356, offset 0, flags [DF], proto TCP (6), length 52)
    127.0.0.1.35974 > 127.0.0.1.12250: Flags [.], cksum 0xfe28 (incorrect -> 0x3f21), seq 948, ack 7048, win 512, options [nop,nop,TS val 400438585 ecr 400438545], length 0
2022-04-07 07:55:56.082668 IP (tos 0x0, ttl 64, id 52456, offset 0, flags [DF], proto TCP (6), length 3354)
    127.0.0.1.12250 > 127.0.0.1.35974: Flags [P.], cksum 0x0b0f (incorrect -> 0x53f3), seq 7048:10350, ack 948, win 512, options [nop,nop,TS val 400438585 ecr 400438585], length 3302
2022-04-07 07:55:56.082674 IP (tos 0x0, ttl 64, id 6357, offset 0, flags [DF], proto TCP (6), length 52)
    127.0.0.1.35974 > 127.0.0.1.12250: Flags [.], cksum 0xfe28 (incorrect -> 0x3224), seq 948, ack 10350, win 495, options [nop,nop,TS val 400438585 ecr 400438585], length 0
2022-04-07 07:55:56.134242 IP (tos 0x0, ttl 64, id 52457, offset 0, flags [DF], proto TCP (6), length 2542)
    127.0.0.1.12250 > 127.0.0.1.35974: Flags [P.], cksum 0x07e3 (incorrect -> 0x9cba), seq 10350:12840, ack 948, win 512, options [nop,nop,TS val 400438637 ecr 400438585], length 2490
2022-04-07 07:55:56.134257 IP (tos 0x0, ttl 64, id 6358, offset 0, flags [DF], proto TCP (6), length 52)
    127.0.0.1.35974 > 127.0.0.1.12250: Flags [.], cksum 0xfe28 (incorrect -> 0x27ff), seq 948, ack 12840, win 498, options [nop,nop,TS val 400438637 ecr 400438637], length 0
2022-04-07 07:55:56.138879 IP (tos 0x0, ttl 64, id 52458, offset 0, flags [DF], proto TCP (6), length 3354)
    127.0.0.1.12250 > 127.0.0.1.35974: Flags [P.], cksum 0x0b0f (incorrect -> 0xd99f), seq 12840:16142, ack 948, win 512, options [nop,nop,TS val 400438641 ecr 400438637], length 3302
2022-04-07 07:55:56.138887 IP (tos 0x0, ttl 64, id 6359, offset 0, flags [DF], proto TCP (6), length 52)
    127.0.0.1.35974 > 127.0.0.1.12250: Flags [.], cksum 0xfe28 (incorrect -> 0x1b14), seq 948, ack 16142, win 495, options [nop,nop,TS val 400438641 ecr 400438641], length 0
2022-04-07 07:55:56.140524 IP (tos 0x0, ttl 64, id 52459, offset 0, flags [DF], proto TCP (6), length 3944)
    127.0.0.1.12250 > 127.0.0.1.35974: Flags [P.], cksum 0x0d5d (incorrect -> 0x8728), seq 16142:20034, ack 948, win 512, options [nop,nop,TS val 400438643 ecr 400438641], length 3892
2022-04-07 07:55:56.140531 IP (tos 0x0, ttl 64, id 6360, offset 0, flags [DF], proto TCP (6), length 52)
    127.0.0.1.35974 > 127.0.0.1.12250: Flags [.], cksum 0xfe28 (incorrect -> 0x0bdf), seq 948, ack 20034, win 492, options [nop,nop,TS val 400438643 ecr 400438643], length 0
2022-04-07 07:55:56.148140 IP (tos 0x0, ttl 64, id 52460, offset 0, flags [DF], proto TCP (6), length 3852)
    127.0.0.1.12250 > 127.0.0.1.35974: Flags [P.], cksum 0x0d01 (incorrect -> 0xae22), seq 20034:23834, ack 948, win 512, options [nop,nop,TS val 400438651 ecr 400438643], length 3800
2022-04-07 07:55:56.148148 IP (tos 0x0, ttl 64, id 6361, offset 0, flags [DF], proto TCP (6), length 52)
    127.0.0.1.35974 > 127.0.0.1.12250: Flags [.], cksum 0xfe28 (incorrect -> 0xfcf5), seq 948, ack 23834, win 493, options [nop,nop,TS val 400438651 ecr 400438651], length 0
2022-04-07 07:55:56.148183 IP (tos 0x0, ttl 64, id 52461, offset 0, flags [DF], proto TCP (6), length 4100)
    127.0.0.1.12250 > 127.0.0.1.35974: Flags [P.], cksum 0x0df9 (incorrect -> 0x7320), seq 23834:27882, ack 948, win 512, options [nop,nop,TS val 400438651 ecr 400438651], length 4048
2022-04-07 07:55:56.148187 IP (tos 0x0, ttl 64, id 6362, offset 0, flags [DF], proto TCP (6), length 52)
    127.0.0.1.35974 > 127.0.0.1.12250: Flags [.], cksum 0xfe28 (incorrect -> 0xed35), seq 948, ack 27882, win 477, options [nop,nop,TS val 400438651 ecr 400438651], length 0
2022-04-07 07:55:56.148193 IP (tos 0x0, ttl 64, id 52462, offset 0, flags [DF], proto TCP (6), length 984)
    127.0.0.1.12250 > 127.0.0.1.35974: Flags [P.], cksum 0x01cd (incorrect -> 0x1dca), seq 27882:28814, ack 948, win 512, options [nop,nop,TS val 400438651 ecr 400438651], length 932
2022-04-07 07:55:56.148196 IP (tos 0x0, ttl 64, id 6363, offset 0, flags [DF], proto TCP (6), length 52)
    127.0.0.1.35974 > 127.0.0.1.12250: Flags [.], cksum 0xfe28 (incorrect -> 0xe995), seq 948, ack 28814, win 473, options [nop,nop,TS val 400438651 ecr 400438651], length 0
200, 5.025564432144165, 1.469163179397583