2022-04-07 23:00:13.728468 IP (tos 0x0, ttl 64, id 61204, offset 0, flags [DF], proto TCP (6), length 60)
    127.0.0.1.36370 > 127.0.0.1.10150: Flags [S], cksum 0xfe30 (incorrect -> 0xd273), seq 2417821637, win 65495, options [mss 65495,sackOK,TS val 3528613280 ecr 0,nop,wscale 7], length 0
2022-04-07 23:00:13.728482 IP (tos 0x0, ttl 64, id 0, offset 0, flags [DF], proto TCP (6), length 60)
    127.0.0.1.10150 > 127.0.0.1.36370: Flags [S.], cksum 0xfe30 (incorrect -> 0x8de8), seq 777446972, ack 2417821638, win 65483, options [mss 65495,sackOK,TS val 3528613280 ecr 3528613280,nop,wscale 7], length 0
2022-04-07 23:00:13.728494 IP (tos 0x0, ttl 64, id 61205, offset 0, flags [DF], proto TCP (6), length 52)
    127.0.0.1.36370 > 127.0.0.1.10150: Flags [.], cksum 0xfe28 (incorrect -> 0xb4a4), seq 1, ack 1, win 512, options [nop,nop,TS val 3528613280 ecr 3528613280], length 0
2022-04-07 23:00:13.728611 IP (tos 0x0, ttl 64, id 61206, offset 0, flags [DF], proto TCP (6), length 55)
    127.0.0.1.36370 > 127.0.0.1.10150: Flags [P.], cksum 0xfe2b (incorrect -> 0xaf98), seq 1:4, ack 1, win 512, options [nop,nop,TS val 3528613280 ecr 3528613280], length 3
2022-04-07 23:00:13.728625 IP (tos 0x0, ttl 64, id 41514, offset 0, flags [DF], proto TCP (6), length 52)
    127.0.0.1.10150 > 127.0.0.1.36370: Flags [.], cksum 0xfe28 (incorrect -> 0xb4a1), seq 1, ack 4, win 512, options [nop,nop,TS val 3528613280 ecr 3528613280], length 0
2022-04-07 23:00:13.728649 IP (tos 0x0, ttl 64, id 41515, offset 0, flags [DF], proto TCP (6), length 54)
    127.0.0.1.10150 > 127.0.0.1.36370: Flags [P.], cksum 0xfe2a (incorrect -> 0xaf97), seq 1:3, ack 4, win 512, options [nop,nop,TS val 3528613280 ecr 3528613280], length 2
2022-04-07 23:00:13.728659 IP (tos 0x0, ttl 64, id 61207, offset 0, flags [DF], proto TCP (6), length 52)
    127.0.0.1.36370 > 127.0.0.1.10150: Flags [.], cksum 0xfe28 (incorrect -> 0xb49f), seq 4, ack 3, win 512, options [nop,nop,TS val 3528613280 ecr 3528613280], length 0
2022-04-07 23:00:13.731169 IP (tos 0x0, ttl 64, id 61208, offset 0, flags [DF], proto TCP (6), length 62)
    127.0.0.1.36370 > 127.0.0.1.10150: Flags [P.], cksum 0xfe32 (incorrect -> 0xb490), seq 4:14, ack 3, win 512, options [nop,nop,TS val 3528613282 ecr 3528613280], length 10
2022-04-07 23:00:13.731198 IP (tos 0x0, ttl 64, id 41516, offset 0, flags [DF], proto TCP (6), length 52)
    127.0.0.1.10150 > 127.0.0.1.36370: Flags [.], cksum 0xfe28 (incorrect -> 0xb491), seq 3, ack 14, win 512, options [nop,nop,TS val 3528613282 ecr 3528613282], length 0
2022-04-07 23:00:13.887131 IP (tos 0x0, ttl 64, id 41517, offset 0, flags [DF], proto TCP (6), length 62)
    127.0.0.1.10150 > 127.0.0.1.36370: Flags [P.], cksum 0xfe32 (incorrect -> 0xaee2), seq 3:13, ack 14, win 512, options [nop,nop,TS val 3528613438 ecr 3528613282], length 10
2022-04-07 23:00:13.887157 IP (tos 0x0, ttl 64, id 61209, offset 0, flags [DF], proto TCP (6), length 52)
    127.0.0.1.36370 > 127.0.0.1.10150: Flags [.], cksum 0xfe28 (incorrect -> 0xb34f), seq 14, ack 13, win 512, options [nop,nop,TS val 3528613438 ecr 3528613438], length 0
200, 6.8313148021698, 1.0368421077728271