2022-04-07 00:44:36.587813 IP (tos 0x0, ttl 64, id 37077, offset 0, flags [DF], proto TCP (6), length 60)
    127.0.0.1.55074 > 127.0.0.1.12050: Flags [S], cksum 0xfe30 (incorrect -> 0x5938), seq 2238251878, win 65495, options [mss 65495,sackOK,TS val 374559090 ecr 0,nop,wscale 7], length 0
2022-04-07 00:44:36.587824 IP (tos 0x0, ttl 64, id 0, offset 0, flags [DF], proto TCP (6), length 60)
    127.0.0.1.12050 > 127.0.0.1.55074: Flags [S.], cksum 0xfe30 (incorrect -> 0x5ac0), seq 3902451218, ack 2238251879, win 65483, options [mss 65495,sackOK,TS val 374559090 ecr 374559090,nop,wscale 7], length 0
2022-04-07 00:44:36.587833 IP (tos 0x0, ttl 64, id 37078, offset 0, flags [DF], proto TCP (6), length 52)
    127.0.0.1.55074 > 127.0.0.1.12050: Flags [.], cksum 0xfe28 (incorrect -> 0x817c), seq 1, ack 1, win 512, options [nop,nop,TS val 374559090 ecr 374559090], length 0
2022-04-07 00:44:36.587943 IP (tos 0x0, ttl 64, id 37079, offset 0, flags [DF], proto TCP (6), length 55)
    127.0.0.1.55074 > 127.0.0.1.12050: Flags [P.], cksum 0xfe2b (incorrect -> 0x7c70), seq 1:4, ack 1, win 512, options [nop,nop,TS val 374559090 ecr 374559090], length 3
2022-04-07 00:44:36.587958 IP (tos 0x0, ttl 64, id 26276, offset 0, flags [DF], proto TCP (6), length 52)
    127.0.0.1.12050 > 127.0.0.1.55074: Flags [.], cksum 0xfe28 (incorrect -> 0x8179), seq 1, ack 4, win 512, options [nop,nop,TS val 374559090 ecr 374559090], length 0
2022-04-07 00:44:36.587994 IP (tos 0x0, ttl 64, id 26277, offset 0, flags [DF], proto TCP (6), length 54)
    127.0.0.1.12050 > 127.0.0.1.55074: Flags [P.], cksum 0xfe2a (incorrect -> 0x7c6f), seq 1:3, ack 4, win 512, options [nop,nop,TS val 374559090 ecr 374559090], length 2
2022-04-07 00:44:36.588008 IP (tos 0x0, ttl 64, id 37080, offset 0, flags [DF], proto TCP (6), length 52)
    127.0.0.1.55074 > 127.0.0.1.12050: Flags [.], cksum 0xfe28 (incorrect -> 0x8177), seq 4, ack 3, win 512, options [nop,nop,TS val 374559090 ecr 374559090], length 0
2022-04-07 00:44:36.589497 IP (tos 0x0, ttl 64, id 37081, offset 0, flags [DF], proto TCP (6), length 62)
    127.0.0.1.55074 > 127.0.0.1.12050: Flags [P.], cksum 0xfe32 (incorrect -> 0xd9d3), seq 4:14, ack 3, win 512, options [nop,nop,TS val 374559092 ecr 374559090], length 10
2022-04-07 00:44:36.589506 IP (tos 0x0, ttl 64, id 26278, offset 0, flags [DF], proto TCP (6), length 52)
    127.0.0.1.12050 > 127.0.0.1.55074: Flags [.], cksum 0xfe28 (incorrect -> 0x8169), seq 3, ack 14, win 512, options [nop,nop,TS val 374559092 ecr 374559092], length 0
2022-04-07 00:44:36.682792 IP (tos 0x0, ttl 64, id 26279, offset 0, flags [DF], proto TCP (6), length 62)
    127.0.0.1.12050 > 127.0.0.1.55074: Flags [P.], cksum 0xfe32 (incorrect -> 0x7bf9), seq 3:13, ack 14, win 512, options [nop,nop,TS val 374559185 ecr 374559092], length 10
2022-04-07 00:44:36.682802 IP (tos 0x0, ttl 64, id 37082, offset 0, flags [DF], proto TCP (6), length 52)
    127.0.0.1.55074 > 127.0.0.1.12050: Flags [.], cksum 0xfe28 (incorrect -> 0x80a5), seq 14, ack 13, win 512, options [nop,nop,TS val 374559185 ecr 374559185], length 0
2022-04-07 00:44:36.688505 IP (tos 0x0, ttl 64, id 37083, offset 0, flags [DF], proto TCP (6), length 569)
    127.0.0.1.55074 > 127.0.0.1.12050: Flags [P.], cksum 0x002e (incorrect -> 0x4595), seq 14:531, ack 13, win 512, options [nop,nop,TS val 374559191 ecr 374559185], length 517
2022-04-07 00:44:36.688514 IP (tos 0x0, ttl 64, id 26280, offset 0, flags [DF], proto TCP (6), length 52)
    127.0.0.1.12050 > 127.0.0.1.55074: Flags [.], cksum 0xfe28 (incorrect -> 0x7e98), seq 13, ack 531, win 508, options [nop,nop,TS val 374559191 ecr 374559191], length 0
200, 2.872493267059326, 0.46123290061950684