2022-04-07 07:04:47.555000 IP (tos 0x0, ttl 64, id 26564, offset 0, flags [DF], proto TCP (6), length 60)
    127.0.0.1.60088 > 127.0.0.1.10750: Flags [S], cksum 0xfe30 (incorrect -> 0x1e2e), seq 4182288731, win 65495, options [mss 65495,sackOK,TS val 397370057 ecr 0,nop,wscale 7], length 0
2022-04-07 07:04:47.555011 IP (tos 0x0, ttl 64, id 0, offset 0, flags [DF], proto TCP (6), length 60)
    127.0.0.1.10750 > 127.0.0.1.60088: Flags [S.], cksum 0xfe30 (incorrect -> 0x9024), seq 2209189854, ack 4182288732, win 65483, options [mss 65495,sackOK,TS val 397370057 ecr 397370057,nop,wscale 7], length 0
2022-04-07 07:04:47.555020 IP (tos 0x0, ttl 64, id 26565, offset 0, flags [DF], proto TCP (6), length 52)
    127.0.0.1.60088 > 127.0.0.1.10750: Flags [.], cksum 0xfe28 (incorrect -> 0xb6e0), seq 1, ack 1, win 512, options [nop,nop,TS val 397370057 ecr 397370057], length 0
2022-04-07 07:04:47.555117 IP (tos 0x0, ttl 64, id 26566, offset 0, flags [DF], proto TCP (6), length 55)
    127.0.0.1.60088 > 127.0.0.1.10750: Flags [P.], cksum 0xfe2b (incorrect -> 0xb1d3), seq 1:4, ack 1, win 512, options [nop,nop,TS val 397370058 ecr 397370057], length 3
2022-04-07 07:04:47.555132 IP (tos 0x0, ttl 64, id 30859, offset 0, flags [DF], proto TCP (6), length 52)
    127.0.0.1.10750 > 127.0.0.1.60088: Flags [.], cksum 0xfe28 (incorrect -> 0xb6db), seq 1, ack 4, win 512, options [nop,nop,TS val 397370058 ecr 397370058], length 0
2022-04-07 07:04:47.555185 IP (tos 0x0, ttl 64, id 30860, offset 0, flags [DF], proto TCP (6), length 54)
    127.0.0.1.10750 > 127.0.0.1.60088: Flags [P.], cksum 0xfe2a (incorrect -> 0xb1d1), seq 1:3, ack 4, win 512, options [nop,nop,TS val 397370058 ecr 397370058], length 2
2022-04-07 07:04:47.555205 IP (tos 0x0, ttl 64, id 26567, offset 0, flags [DF], proto TCP (6), length 52)
    127.0.0.1.60088 > 127.0.0.1.10750: Flags [.], cksum 0xfe28 (incorrect -> 0xb6d9), seq 4, ack 3, win 512, options [nop,nop,TS val 397370058 ecr 397370058], length 0
2022-04-07 07:04:47.557024 IP (tos 0x0, ttl 64, id 26568, offset 0, flags [DF], proto TCP (6), length 62)
    127.0.0.1.60088 > 127.0.0.1.10750: Flags [P.], cksum 0xfe32 (incorrect -> 0xe23f), seq 4:14, ack 3, win 512, options [nop,nop,TS val 397370059 ecr 397370058], length 10
2022-04-07 07:04:47.557046 IP (tos 0x0, ttl 64, id 30861, offset 0, flags [DF], proto TCP (6), length 52)
    127.0.0.1.10750 > 127.0.0.1.60088: Flags [.], cksum 0xfe28 (incorrect -> 0xb6cd), seq 3, ack 14, win 512, options [nop,nop,TS val 397370059 ecr 397370059], length 0
2022-04-07 07:04:47.618760 IP (tos 0x0, ttl 64, id 30862, offset 0, flags [DF], proto TCP (6), length 62)
    127.0.0.1.10750 > 127.0.0.1.60088: Flags [P.], cksum 0xfe32 (incorrect -> 0xb17c), seq 3:13, ack 14, win 512, options [nop,nop,TS val 397370121 ecr 397370059], length 10
2022-04-07 07:04:47.618771 IP (tos 0x0, ttl 64, id 26569, offset 0, flags [DF], proto TCP (6), length 52)
    127.0.0.1.60088 > 127.0.0.1.10750: Flags [.], cksum 0xfe28 (incorrect -> 0xb647), seq 14, ack 13, win 512, options [nop,nop,TS val 397370121 ecr 397370121], length 0
2022-04-07 07:04:47.624318 IP (tos 0x0, ttl 64, id 26570, offset 0, flags [DF], proto TCP (6), length 569)
    127.0.0.1.60088 > 127.0.0.1.10750: Flags [P.], cksum 0x002e (incorrect -> 0x4e41), seq 14:531, ack 13, win 512, options [nop,nop,TS val 397370127 ecr 397370121], length 517
2022-04-07 07:04:47.624329 IP (tos 0x0, ttl 64, id 30863, offset 0, flags [DF], proto TCP (6), length 52)
    127.0.0.1.10750 > 127.0.0.1.60088: Flags [.], cksum 0xfe28 (incorrect -> 0xb43a), seq 13, ack 531, win 508, options [nop,nop,TS val 397370127 ecr 397370127], length 0
2022-04-07 07:04:47.650497 IP (tos 0x0, ttl 64, id 30864, offset 0, flags [DF], proto TCP (6), length 3538)
    127.0.0.1.10750 > 127.0.0.1.60088: Flags [P.], cksum 0x0bc7 (incorrect -> 0xb2db), seq 13:3499, ack 531, win 512, options [nop,nop,TS val 397370153 ecr 397370127], length 3486
2022-04-07 07:04:47.650506 IP (tos 0x0, ttl 64, id 26571, offset 0, flags [DF], proto TCP (6), length 52)
    127.0.0.1.60088 > 127.0.0.1.10750: Flags [.], cksum 0xfe28 (incorrect -> 0xa676), seq 531, ack 3499, win 494, options [nop,nop,TS val 397370153 ecr 397370153], length 0
200, 4.850921630859375, 1.069509744644165