2022-04-07 13:58:38.391636 IP (tos 0x0, ttl 64, id 13268, offset 0, flags [DF], proto TCP (6), length 60)
    127.0.0.1.56836 > 127.0.0.1.9250: Flags [S], cksum 0xfe30 (incorrect -> 0x4231), seq 1784433203, win 65495, options [mss 65495,sackOK,TS val 3496117943 ecr 0,nop,wscale 7], length 0
2022-04-07 13:58:38.391646 IP (tos 0x0, ttl 64, id 0, offset 0, flags [DF], proto TCP (6), length 60)
    127.0.0.1.9250 > 127.0.0.1.56836: Flags [S.], cksum 0xfe30 (incorrect -> 0xc03f), seq 801307407, ack 1784433204, win 65483, options [mss 65495,sackOK,TS val 3496117943 ecr 3496117943,nop,wscale 7], length 0
2022-04-07 13:58:38.391655 IP (tos 0x0, ttl 64, id 13269, offset 0, flags [DF], proto TCP (6), length 52)
    127.0.0.1.56836 > 127.0.0.1.9250: Flags [.], cksum 0xfe28 (incorrect -> 0xe6fb), seq 1, ack 1, win 512, options [nop,nop,TS val 3496117943 ecr 3496117943], length 0
2022-04-07 13:58:38.391778 IP (tos 0x0, ttl 64, id 13270, offset 0, flags [DF], proto TCP (6), length 55)
    127.0.0.1.56836 > 127.0.0.1.9250: Flags [P.], cksum 0xfe2b (incorrect -> 0xe1ef), seq 1:4, ack 1, win 512, options [nop,nop,TS val 3496117943 ecr 3496117943], length 3
2022-04-07 13:58:38.391791 IP (tos 0x0, ttl 64, id 14126, offset 0, flags [DF], proto TCP (6), length 52)
    127.0.0.1.9250 > 127.0.0.1.56836: Flags [.], cksum 0xfe28 (incorrect -> 0xe6f8), seq 1, ack 4, win 512, options [nop,nop,TS val 3496117943 ecr 3496117943], length 0
2022-04-07 13:58:38.391826 IP (tos 0x0, ttl 64, id 14127, offset 0, flags [DF], proto TCP (6), length 54)
    127.0.0.1.9250 > 127.0.0.1.56836: Flags [P.], cksum 0xfe2a (incorrect -> 0xe1ee), seq 1:3, ack 4, win 512, options [nop,nop,TS val 3496117943 ecr 3496117943], length 2
2022-04-07 13:58:38.391839 IP (tos 0x0, ttl 64, id 13271, offset 0, flags [DF], proto TCP (6), length 52)
    127.0.0.1.56836 > 127.0.0.1.9250: Flags [.], cksum 0xfe28 (incorrect -> 0xe6f6), seq 4, ack 3, win 512, options [nop,nop,TS val 3496117943 ecr 3496117943], length 0
2022-04-07 13:58:38.393397 IP (tos 0x0, ttl 64, id 13272, offset 0, flags [DF], proto TCP (6), length 62)
    127.0.0.1.56836 > 127.0.0.1.9250: Flags [P.], cksum 0xfe32 (incorrect -> 0x51fc), seq 4:14, ack 3, win 512, options [nop,nop,TS val 3496117945 ecr 3496117943], length 10
2022-04-07 13:58:38.393406 IP (tos 0x0, ttl 64, id 14128, offset 0, flags [DF], proto TCP (6), length 52)
    127.0.0.1.9250 > 127.0.0.1.56836: Flags [.], cksum 0xfe28 (incorrect -> 0xe6e8), seq 3, ack 14, win 512, options [nop,nop,TS val 3496117945 ecr 3496117945], length 0
2022-04-07 13:58:38.458059 IP (tos 0x0, ttl 64, id 14129, offset 0, flags [DF], proto TCP (6), length 62)
    127.0.0.1.9250 > 127.0.0.1.56836: Flags [P.], cksum 0xfe32 (incorrect -> 0xe195), seq 3:13, ack 14, win 512, options [nop,nop,TS val 3496118009 ecr 3496117945], length 10
2022-04-07 13:58:38.458067 IP (tos 0x0, ttl 64, id 13273, offset 0, flags [DF], proto TCP (6), length 52)
    127.0.0.1.56836 > 127.0.0.1.9250: Flags [.], cksum 0xfe28 (incorrect -> 0xe65e), seq 14, ack 13, win 512, options [nop,nop,TS val 3496118009 ecr 3496118009], length 0
2022-04-07 13:58:38.463753 IP (tos 0x0, ttl 64, id 13274, offset 0, flags [DF], proto TCP (6), length 569)
    127.0.0.1.56836 > 127.0.0.1.9250: Flags [P.], cksum 0x002e (incorrect -> 0xd6c9), seq 14:531, ack 13, win 512, options [nop,nop,TS val 3496118015 ecr 3496118009], length 517
2022-04-07 13:58:38.463763 IP (tos 0x0, ttl 64, id 14130, offset 0, flags [DF], proto TCP (6), length 52)
    127.0.0.1.9250 > 127.0.0.1.56836: Flags [.], cksum 0xfe28 (incorrect -> 0xe451), seq 13, ack 531, win 508, options [nop,nop,TS val 3496118015 ecr 3496118015], length 0
2022-04-07 13:58:38.534864 IP (tos 0x0, ttl 64, id 14131, offset 0, flags [DF], proto TCP (6), length 3538)
    127.0.0.1.9250 > 127.0.0.1.56836: Flags [P.], cksum 0x0bc7 (incorrect -> 0x7c3e), seq 13:3499, ack 531, win 512, options [nop,nop,TS val 3496118086 ecr 3496118015], length 3486
2022-04-07 13:58:38.534875 IP (tos 0x0, ttl 64, id 13275, offset 0, flags [DF], proto TCP (6), length 52)
    127.0.0.1.56836 > 127.0.0.1.9250: Flags [.], cksum 0xfe28 (incorrect -> 0xd633), seq 531, ack 3499, win 494, options [nop,nop,TS val 3496118086 ecr 3496118086], length 0
2022-04-07 13:58:38.555978 IP (tos 0x0, ttl 64, id 14132, offset 0, flags [DF], proto TCP (6), length 1348)
    127.0.0.1.9250 > 127.0.0.1.56836: Flags [P.], cksum 0x0339 (incorrect -> 0xcd17), seq 3499:4795, ack 531, win 512, options [nop,nop,TS val 3496118107 ecr 3496118086], length 1296
2022-04-07 13:58:38.555984 IP (tos 0x0, ttl 64, id 13276, offset 0, flags [DF], proto TCP (6), length 52)
    127.0.0.1.56836 > 127.0.0.1.9250: Flags [.], cksum 0xfe28 (incorrect -> 0xd0f1), seq 531, ack 4795, win 502, options [nop,nop,TS val 3496118107 ecr 3496118107], length 0
2022-04-07 13:58:38.556415 IP (tos 0x0, ttl 64, id 13277, offset 0, flags [DF], proto TCP (6), length 132)
    127.0.0.1.56836 > 127.0.0.1.9250: Flags [P.], cksum 0xfe78 (incorrect -> 0x3f81), seq 531:611, ack 4795, win 512, options [nop,nop,TS val 3496118108 ecr 3496118107], length 80
2022-04-07 13:58:38.556423 IP (tos 0x0, ttl 64, id 14133, offset 0, flags [DF], proto TCP (6), length 52)
    127.0.0.1.9250 > 127.0.0.1.56836: Flags [.], cksum 0xfe28 (incorrect -> 0xd095), seq 4795, ack 611, win 512, options [nop,nop,TS val 3496118108 ecr 3496118108], length 0
2022-04-07 13:58:38.556883 IP (tos 0x0, ttl 64, id 13278, offset 0, flags [DF], proto TCP (6), length 319)
    127.0.0.1.56836 > 127.0.0.1.9250: Flags [P.], cksum 0xff33 (incorrect -> 0x805e), seq 611:878, ack 4795, win 512, options [nop,nop,TS val 3496118108 ecr 3496118108], length 267
2022-04-07 13:58:38.556891 IP (tos 0x0, ttl 64, id 14134, offset 0, flags [DF], proto TCP (6), length 52)
    127.0.0.1.9250 > 127.0.0.1.56836: Flags [.], cksum 0xfe28 (incorrect -> 0xcf8c), seq 4795, ack 878, win 510, options [nop,nop,TS val 3496118108 ecr 3496118108], length 0
2022-04-07 13:58:38.620727 IP (tos 0x0, ttl 64, id 14135, offset 0, flags [DF], proto TCP (6), length 323)
    127.0.0.1.9250 > 127.0.0.1.56836: Flags [P.], cksum 0xff37 (incorrect -> 0x368a), seq 4795:5066, ack 878, win 512, options [nop,nop,TS val 3496118172 ecr 3496118108], length 271
2022-04-07 13:58:38.620734 IP (tos 0x0, ttl 64, id 13279, offset 0, flags [DF], proto TCP (6), length 52)
    127.0.0.1.56836 > 127.0.0.1.9250: Flags [.], cksum 0xfe28 (incorrect -> 0xcdfd), seq 878, ack 5066, win 510, options [nop,nop,TS val 3496118172 ecr 3496118172], length 0
2022-04-07 13:58:38.645078 IP (tos 0x0, ttl 64, id 14136, offset 0, flags [DF], proto TCP (6), length 323)
    127.0.0.1.9250 > 127.0.0.1.56836: Flags [P.], cksum 0xff37 (incorrect -> 0xd2a6), seq 5066:5337, ack 878, win 512, options [nop,nop,TS val 3496118196 ecr 3496118172], length 271
2022-04-07 13:58:38.645089 IP (tos 0x0, ttl 64, id 13280, offset 0, flags [DF], proto TCP (6), length 52)
    127.0.0.1.56836 > 127.0.0.1.9250: Flags [.], cksum 0xfe28 (incorrect -> 0xccc0), seq 878, ack 5337, win 508, options [nop,nop,TS val 3496118196 ecr 3496118196], length 0
2022-04-07 13:58:38.692788 IP (tos 0x0, ttl 64, id 14137, offset 0, flags [DF], proto TCP (6), length 3446)
    127.0.0.1.9250 > 127.0.0.1.56836: Flags [P.], cksum 0x0b6b (incorrect -> 0xe278), seq 5337:8731, ack 878, win 512, options [nop,nop,TS val 3496118244 ecr 3496118196], length 3394
2022-04-07 13:58:38.692795 IP (tos 0x0, ttl 64, id 13281, offset 0, flags [DF], proto TCP (6), length 52)
    127.0.0.1.56836 > 127.0.0.1.9250: Flags [.], cksum 0xfe28 (incorrect -> 0xbf2c), seq 878, ack 8731, win 494, options [nop,nop,TS val 3496118244 ecr 3496118244], length 0
2022-04-07 13:58:38.708334 IP (tos 0x0, ttl 64, id 14138, offset 0, flags [DF], proto TCP (6), length 4100)
    127.0.0.1.9250 > 127.0.0.1.56836: Flags [P.], cksum 0x0df9 (incorrect -> 0x8e83), seq 8731:12779, ack 878, win 512, options [nop,nop,TS val 3496118260 ecr 3496118244], length 4048
2022-04-07 13:58:38.708342 IP (tos 0x0, ttl 64, id 13282, offset 0, flags [DF], proto TCP (6), length 52)
    127.0.0.1.56836 > 127.0.0.1.9250: Flags [.], cksum 0xfe28 (incorrect -> 0xaf3e), seq 878, ack 12779, win 492, options [nop,nop,TS val 3496118260 ecr 3496118260], length 0
2022-04-07 13:58:38.708350 IP (tos 0x0, ttl 64, id 14139, offset 0, flags [DF], proto TCP (6), length 2294)
    127.0.0.1.9250 > 127.0.0.1.56836: Flags [P.], cksum 0x06eb (incorrect -> 0x09f4), seq 12779:15021, ack 878, win 512, options [nop,nop,TS val 3496118260 ecr 3496118260], length 2242
2022-04-07 13:58:38.708354 IP (tos 0x0, ttl 64, id 13283, offset 0, flags [DF], proto TCP (6), length 52)
    127.0.0.1.56836 > 127.0.0.1.9250: Flags [.], cksum 0xfe28 (incorrect -> 0xa685), seq 878, ack 15021, win 483, options [nop,nop,TS val 3496118260 ecr 3496118260], length 0
2022-04-07 13:58:38.708369 IP (tos 0x0, ttl 64, id 14140, offset 0, flags [DF], proto TCP (6), length 550)
    127.0.0.1.9250 > 127.0.0.1.56836: Flags [P.], cksum 0x001b (incorrect -> 0x8731), seq 15021:15519, ack 878, win 512, options [nop,nop,TS val 3496118260 ecr 3496118260], length 498
2022-04-07 13:58:38.708373 IP (tos 0x0, ttl 64, id 13284, offset 0, flags [DF], proto TCP (6), length 52)
    127.0.0.1.56836 > 127.0.0.1.9250: Flags [.], cksum 0xfe28 (incorrect -> 0xa495), seq 878, ack 15519, win 481, options [nop,nop,TS val 3496118260 ecr 3496118260], length 0
2022-04-07 13:58:38.713322 IP (tos 0x0, ttl 64, id 14141, offset 0, flags [DF], proto TCP (6), length 3538)
    127.0.0.1.9250 > 127.0.0.1.56836: Flags [P.], cksum 0x0bc7 (incorrect -> 0x29e9), seq 15519:19005, ack 878, win 512, options [nop,nop,TS val 3496118265 ecr 3496118260], length 3486
2022-04-07 13:58:38.713328 IP (tos 0x0, ttl 64, id 13285, offset 0, flags [DF], proto TCP (6), length 52)
    127.0.0.1.56836 > 127.0.0.1.9250: Flags [.], cksum 0xfe28 (incorrect -> 0x96e0), seq 878, ack 19005, win 494, options [nop,nop,TS val 3496118265 ecr 3496118265], length 0
2022-04-07 13:58:38.715942 IP (tos 0x0, ttl 64, id 14142, offset 0, flags [DF], proto TCP (6), length 4100)
    127.0.0.1.9250 > 127.0.0.1.56836: Flags [P.], cksum 0x0df9 (incorrect -> 0x4ecc), seq 19005:23053, ack 878, win 512, options [nop,nop,TS val 3496118267 ecr 3496118265], length 4048
2022-04-07 13:58:38.715948 IP (tos 0x0, ttl 64, id 13286, offset 0, flags [DF], proto TCP (6), length 52)
    127.0.0.1.56836 > 127.0.0.1.9250: Flags [.], cksum 0xfe28 (incorrect -> 0x870e), seq 878, ack 23053, win 492, options [nop,nop,TS val 3496118267 ecr 3496118267], length 0
2022-04-07 13:58:38.715954 IP (tos 0x0, ttl 64, id 14143, offset 0, flags [DF], proto TCP (6), length 256)
    127.0.0.1.9250 > 127.0.0.1.56836: Flags [P.], cksum 0xfef4 (incorrect -> 0x1ab4), seq 23053:23257, ack 878, win 512, options [nop,nop,TS val 3496118267 ecr 3496118267], length 204
2022-04-07 13:58:38.717529 IP (tos 0x0, ttl 64, id 13287, offset 0, flags [DF], proto TCP (6), length 52)
    127.0.0.1.56836 > 127.0.0.1.9250: Flags [.], cksum 0xfe28 (incorrect -> 0x862c), seq 878, ack 23257, win 512, options [nop,nop,TS val 3496118269 ecr 3496118267], length 0
2022-04-07 13:58:38.717536 IP (tos 0x0, ttl 64, id 14144, offset 0, flags [DF], proto TCP (6), length 3538)
    127.0.0.1.9250 > 127.0.0.1.56836: Flags [P.], cksum 0x0bc7 (incorrect -> 0x589d), seq 23257:26743, ack 878, win 512, options [nop,nop,TS val 3496118269 ecr 3496118269], length 3486
2022-04-07 13:58:38.717542 IP (tos 0x0, ttl 64, id 13288, offset 0, flags [DF], proto TCP (6), length 52)
    127.0.0.1.56836 > 127.0.0.1.9250: Flags [.], cksum 0xfe28 (incorrect -> 0x788c), seq 878, ack 26743, win 512, options [nop,nop,TS val 3496118269 ecr 3496118269], length 0
2022-04-07 13:58:38.723936 IP (tos 0x0, ttl 64, id 14145, offset 0, flags [DF], proto TCP (6), length 4100)
    127.0.0.1.9250 > 127.0.0.1.56836: Flags [P.], cksum 0x0df9 (incorrect -> 0x2938), seq 26743:30791, ack 878, win 512, options [nop,nop,TS val 3496118275 ecr 3496118269], length 4048
2022-04-07 13:58:38.739522 IP (tos 0x0, ttl 64, id 14146, offset 0, flags [DF], proto TCP (6), length 32820)
    127.0.0.1.9250 > 127.0.0.1.56836: Flags [.], cksum 0x7e29 (incorrect -> 0x245f), seq 30791:63559, ack 878, win 512, options [nop,nop,TS val 3496118291 ecr 3496118269], length 32768
2022-04-07 13:58:38.739643 IP (tos 0x0, ttl 64, id 13289, offset 0, flags [DF], proto TCP (6), length 52)
    127.0.0.1.56836 > 127.0.0.1.9250: Flags [.], cksum 0xfe28 (incorrect -> 0xe924), seq 878, ack 63559, win 379, options [nop,nop,TS val 3496118291 ecr 3496118275], length 0
2022-04-07 13:58:38.739652 IP (tos 0x0, ttl 64, id 14147, offset 0, flags [DF], proto TCP (6), length 15678)
    127.0.0.1.9250 > 127.0.0.1.56836: Flags [P.], cksum 0x3b33 (incorrect -> 0xe0e0), seq 63559:79185, ack 878, win 512, options [nop,nop,TS val 3496118291 ecr 3496118291], length 15626
2022-04-07 13:58:38.740950 IP (tos 0x0, ttl 64, id 13290, offset 0, flags [DF], proto TCP (6), length 52)
    127.0.0.1.56836 > 127.0.0.1.9250: Flags [.], cksum 0xfe28 (incorrect -> 0xab84), seq 878, ack 79185, win 512, options [nop,nop,TS val 3496118292 ecr 3496118291], length 0
2022-04-07 13:58:38.746916 IP (tos 0x0, ttl 64, id 14148, offset 0, flags [DF], proto TCP (6), length 4100)
    127.0.0.1.9250 > 127.0.0.1.56836: Flags [P.], cksum 0x0df9 (incorrect -> 0x4275), seq 79185:83233, ack 878, win 512, options [nop,nop,TS val 3496118298 ecr 3496118292], length 4048
2022-04-07 13:58:38.746937 IP (tos 0x0, ttl 64, id 13291, offset 0, flags [DF], proto TCP (6), length 52)
    127.0.0.1.56836 > 127.0.0.1.9250: Flags [.], cksum 0xfe28 (incorrect -> 0x9ba7), seq 878, ack 83233, win 512, options [nop,nop,TS val 3496118298 ecr 3496118298], length 0
2022-04-07 13:58:38.746942 IP (tos 0x0, ttl 64, id 14149, offset 0, flags [DF], proto TCP (6), length 3880)
    127.0.0.1.9250 > 127.0.0.1.56836: Flags [P.], cksum 0x0d1d (incorrect -> 0x461e), seq 83233:87061, ack 878, win 512, options [nop,nop,TS val 3496118298 ecr 3496118298], length 3828
2022-04-07 13:58:38.747417 IP (tos 0x0, ttl 64, id 13292, offset 0, flags [DF], proto TCP (6), length 52)
    127.0.0.1.56836 > 127.0.0.1.9250: Flags [.], cksum 0xfe28 (incorrect -> 0x8cb2), seq 878, ack 87061, win 512, options [nop,nop,TS val 3496118299 ecr 3496118298], length 0
2022-04-07 13:58:38.751299 IP (tos 0x0, ttl 64, id 14150, offset 0, flags [DF], proto TCP (6), length 4100)
    127.0.0.1.9250 > 127.0.0.1.56836: Flags [P.], cksum 0x0df9 (incorrect -> 0x7957), seq 87061:91109, ack 878, win 512, options [nop,nop,TS val 3496118303 ecr 3496118299], length 4048
2022-04-07 13:58:38.751431 IP (tos 0x0, ttl 64, id 13293, offset 0, flags [DF], proto TCP (6), length 52)
    127.0.0.1.56836 > 127.0.0.1.9250: Flags [.], cksum 0xfe28 (incorrect -> 0x7cd9), seq 878, ack 91109, win 512, options [nop,nop,TS val 3496118303 ecr 3496118303], length 0
2022-04-07 13:58:38.751437 IP (tos 0x0, ttl 64, id 14151, offset 0, flags [DF], proto TCP (6), length 4470)
    127.0.0.1.9250 > 127.0.0.1.56836: Flags [P.], cksum 0x0f6b (incorrect -> 0x76c5), seq 91109:95527, ack 878, win 512, options [nop,nop,TS val 3496118303 ecr 3496118303], length 4418
2022-04-07 13:58:38.751442 IP (tos 0x0, ttl 64, id 13294, offset 0, flags [DF], proto TCP (6), length 52)
    127.0.0.1.56836 > 127.0.0.1.9250: Flags [.], cksum 0xfe28 (incorrect -> 0x6b97), seq 878, ack 95527, win 512, options [nop,nop,TS val 3496118303 ecr 3496118303], length 0
2022-04-07 13:58:38.754835 IP (tos 0x0, ttl 64, id 14152, offset 0, flags [DF], proto TCP (6), length 1546)
    127.0.0.1.9250 > 127.0.0.1.56836: Flags [P.], cksum 0x03ff (incorrect -> 0x8dd6), seq 95527:97021, ack 878, win 512, options [nop,nop,TS val 3496118306 ecr 3496118303], length 1494
2022-04-07 13:58:38.754960 IP (tos 0x0, ttl 64, id 13295, offset 0, flags [DF], proto TCP (6), length 52)
    127.0.0.1.56836 > 127.0.0.1.9250: Flags [.], cksum 0xfe28 (incorrect -> 0x65bb), seq 878, ack 97021, win 512, options [nop,nop,TS val 3496118306 ecr 3496118306], length 0
2022-04-07 13:58:38.754967 IP (tos 0x0, ttl 64, id 14153, offset 0, flags [DF], proto TCP (6), length 11140)
    127.0.0.1.9250 > 127.0.0.1.56836: Flags [P.], cksum 0x2979 (incorrect -> 0xed5b), seq 97021:108109, ack 878, win 512, options [nop,nop,TS val 3496118306 ecr 3496118306], length 11088
2022-04-07 13:58:38.756101 IP (tos 0x0, ttl 64, id 13296, offset 0, flags [DF], proto TCP (6), length 52)
    127.0.0.1.56836 > 127.0.0.1.9250: Flags [.], cksum 0xfe28 (incorrect -> 0x3a6a), seq 878, ack 108109, win 512, options [nop,nop,TS val 3496118307 ecr 3496118306], length 0
2022-04-07 13:58:38.756108 IP (tos 0x0, ttl 64, id 14154, offset 0, flags [DF], proto TCP (6), length 7790)
    127.0.0.1.9250 > 127.0.0.1.56836: Flags [P.], cksum 0x1c63 (incorrect -> 0x0f7f), seq 108109:115847, ack 878, win 512, options [nop,nop,TS val 3496118307 ecr 3496118307], length 7738
2022-04-07 13:58:38.756363 IP (tos 0x0, ttl 64, id 13297, offset 0, flags [DF], proto TCP (6), length 52)
    127.0.0.1.56836 > 127.0.0.1.9250: Flags [.], cksum 0xfe28 (incorrect -> 0x1c2e), seq 878, ack 115847, win 512, options [nop,nop,TS val 3496118308 ecr 3496118307], length 0
2022-04-07 13:58:38.757397 IP (tos 0x0, ttl 64, id 14155, offset 0, flags [DF], proto TCP (6), length 4100)
    127.0.0.1.9250 > 127.0.0.1.56836: Flags [P.], cksum 0x0df9 (incorrect -> 0xfda9), seq 115847:119895, ack 878, win 512, options [nop,nop,TS val 3496118309 ecr 3496118308], length 4048
2022-04-07 13:58:38.757464 IP (tos 0x0, ttl 64, id 13298, offset 0, flags [DF], proto TCP (6), length 52)
    127.0.0.1.56836 > 127.0.0.1.9250: Flags [.], cksum 0xfe28 (incorrect -> 0x0c5b), seq 878, ack 119895, win 512, options [nop,nop,TS val 3496118309 ecr 3496118309], length 0
200, 4.835949182510376, 0.38833045959472656