2022-04-07 19:09:27.250114 IP (tos 0x0, ttl 64, id 38925, offset 0, flags [DF], proto TCP (6), length 60)
    127.0.0.1.35254 > 127.0.0.1.9150: Flags [S], cksum 0xfe30 (incorrect -> 0x532a), seq 804730907, win 65495, options [mss 65495,sackOK,TS val 3514766801 ecr 0,nop,wscale 7], length 0
2022-04-07 19:09:27.250126 IP (tos 0x0, ttl 64, id 0, offset 0, flags [DF], proto TCP (6), length 60)
    127.0.0.1.9150 > 127.0.0.1.35254: Flags [S.], cksum 0xfe30 (incorrect -> 0xd16b), seq 3709648203, ack 804730908, win 65483, options [mss 65495,sackOK,TS val 3514766801 ecr 3514766801,nop,wscale 7], length 0
2022-04-07 19:09:27.250134 IP (tos 0x0, ttl 64, id 38926, offset 0, flags [DF], proto TCP (6), length 52)
    127.0.0.1.35254 > 127.0.0.1.9150: Flags [.], cksum 0xfe28 (incorrect -> 0xf827), seq 1, ack 1, win 512, options [nop,nop,TS val 3514766801 ecr 3514766801], length 0
2022-04-07 19:09:27.250244 IP (tos 0x0, ttl 64, id 38927, offset 0, flags [DF], proto TCP (6), length 55)
    127.0.0.1.35254 > 127.0.0.1.9150: Flags [P.], cksum 0xfe2b (incorrect -> 0xf31a), seq 1:4, ack 1, win 512, options [nop,nop,TS val 3514766802 ecr 3514766801], length 3
2022-04-07 19:09:27.250257 IP (tos 0x0, ttl 64, id 6652, offset 0, flags [DF], proto TCP (6), length 52)
    127.0.0.1.9150 > 127.0.0.1.35254: Flags [.], cksum 0xfe28 (incorrect -> 0xf822), seq 1, ack 4, win 512, options [nop,nop,TS val 3514766802 ecr 3514766802], length 0
2022-04-07 19:09:27.250328 IP (tos 0x0, ttl 64, id 6653, offset 0, flags [DF], proto TCP (6), length 54)
    127.0.0.1.9150 > 127.0.0.1.35254: Flags [P.], cksum 0xfe2a (incorrect -> 0xf318), seq 1:3, ack 4, win 512, options [nop,nop,TS val 3514766802 ecr 3514766802], length 2
2022-04-07 19:09:27.250347 IP (tos 0x0, ttl 64, id 38928, offset 0, flags [DF], proto TCP (6), length 52)
    127.0.0.1.35254 > 127.0.0.1.9150: Flags [.], cksum 0xfe28 (incorrect -> 0xf820), seq 4, ack 3, win 512, options [nop,nop,TS val 3514766802 ecr 3514766802], length 0
2022-04-07 19:09:27.265935 IP (tos 0x0, ttl 64, id 38929, offset 0, flags [DF], proto TCP (6), length 62)
    127.0.0.1.35254 > 127.0.0.1.9150: Flags [P.], cksum 0xfe32 (incorrect -> 0xcf2f), seq 4:14, ack 3, win 512, options [nop,nop,TS val 3514766817 ecr 3514766802], length 10
2022-04-07 19:09:27.265953 IP (tos 0x0, ttl 64, id 6654, offset 0, flags [DF], proto TCP (6), length 52)
    127.0.0.1.9150 > 127.0.0.1.35254: Flags [.], cksum 0xfe28 (incorrect -> 0xf7f8), seq 3, ack 14, win 512, options [nop,nop,TS val 3514766817 ecr 3514766817], length 0
2022-04-07 19:09:27.382406 IP (tos 0x0, ttl 64, id 6655, offset 0, flags [DF], proto TCP (6), length 62)
    127.0.0.1.9150 > 127.0.0.1.35254: Flags [P.], cksum 0xfe32 (incorrect -> 0xf270), seq 3:13, ack 14, win 512, options [nop,nop,TS val 3514766934 ecr 3514766817], length 10
2022-04-07 19:09:27.382430 IP (tos 0x0, ttl 64, id 38930, offset 0, flags [DF], proto TCP (6), length 52)
    127.0.0.1.35254 > 127.0.0.1.9150: Flags [.], cksum 0xfe28 (incorrect -> 0xf704), seq 14, ack 13, win 512, options [nop,nop,TS val 3514766934 ecr 3514766934], length 0
2022-04-07 19:09:27.388283 IP (tos 0x0, ttl 64, id 38931, offset 0, flags [DF], proto TCP (6), length 569)
    127.0.0.1.35254 > 127.0.0.1.9150: Flags [P.], cksum 0x002e (incorrect -> 0xb02f), seq 14:531, ack 13, win 512, options [nop,nop,TS val 3514766940 ecr 3514766934], length 517
2022-04-07 19:09:27.388292 IP (tos 0x0, ttl 64, id 6656, offset 0, flags [DF], proto TCP (6), length 52)
    127.0.0.1.9150 > 127.0.0.1.35254: Flags [.], cksum 0xfe28 (incorrect -> 0xf4f7), seq 13, ack 531, win 508, options [nop,nop,TS val 3514766940 ecr 3514766940], length 0
2022-04-07 19:09:27.461044 IP (tos 0x0, ttl 64, id 6657, offset 0, flags [DF], proto TCP (6), length 3538)
    127.0.0.1.9150 > 127.0.0.1.35254: Flags [P.], cksum 0x0bc7 (incorrect -> 0xeeaa), seq 13:3499, ack 531, win 512, options [nop,nop,TS val 3514767012 ecr 3514766940], length 3486
2022-04-07 19:09:27.461060 IP (tos 0x0, ttl 64, id 38932, offset 0, flags [DF], proto TCP (6), length 52)
    127.0.0.1.35254 > 127.0.0.1.9150: Flags [.], cksum 0xfe28 (incorrect -> 0xe6d7), seq 531, ack 3499, win 494, options [nop,nop,TS val 3514767012 ecr 3514767012], length 0
2022-04-07 19:09:27.474604 IP (tos 0x0, ttl 64, id 6658, offset 0, flags [DF], proto TCP (6), length 886)
    127.0.0.1.9150 > 127.0.0.1.35254: Flags [P.], cksum 0x016b (incorrect -> 0x3b01), seq 3499:4333, ack 531, win 512, options [nop,nop,TS val 3514767026 ecr 3514767012], length 834
2022-04-07 19:09:27.474611 IP (tos 0x0, ttl 64, id 38933, offset 0, flags [DF], proto TCP (6), length 52)
    127.0.0.1.35254 > 127.0.0.1.9150: Flags [.], cksum 0xfe28 (incorrect -> 0xe36f), seq 531, ack 4333, win 504, options [nop,nop,TS val 3514767026 ecr 3514767026], length 0
2022-04-07 19:09:27.476509 IP (tos 0x0, ttl 64, id 6659, offset 0, flags [DF], proto TCP (6), length 660)
    127.0.0.1.9150 > 127.0.0.1.35254: Flags [P.], cksum 0x0089 (incorrect -> 0x9d33), seq 4333:4941, ack 531, win 512, options [nop,nop,TS val 3514767028 ecr 3514767026], length 608
2022-04-07 19:09:27.476515 IP (tos 0x0, ttl 64, id 38934, offset 0, flags [DF], proto TCP (6), length 52)
    127.0.0.1.35254 > 127.0.0.1.9150: Flags [.], cksum 0xfe28 (incorrect -> 0xe10a), seq 531, ack 4941, win 505, options [nop,nop,TS val 3514767028 ecr 3514767028], length 0
2022-04-07 19:09:27.476927 IP (tos 0x0, ttl 64, id 38935, offset 0, flags [DF], proto TCP (6), length 116)
    127.0.0.1.35254 > 127.0.0.1.9150: Flags [P.], cksum 0xfe68 (incorrect -> 0xee15), seq 531:595, ack 4941, win 512, options [nop,nop,TS val 3514767028 ecr 3514767028], length 64
2022-04-07 19:09:27.476935 IP (tos 0x0, ttl 64, id 6660, offset 0, flags [DF], proto TCP (6), length 52)
    127.0.0.1.9150 > 127.0.0.1.35254: Flags [.], cksum 0xfe28 (incorrect -> 0xe0c3), seq 4941, ack 595, win 512, options [nop,nop,TS val 3514767028 ecr 3514767028], length 0
2022-04-07 19:09:27.477382 IP (tos 0x0, ttl 64, id 38936, offset 0, flags [DF], proto TCP (6), length 321)
    127.0.0.1.35254 > 127.0.0.1.9150: Flags [P.], cksum 0xff35 (incorrect -> 0xbe95), seq 595:864, ack 4941, win 512, options [nop,nop,TS val 3514767029 ecr 3514767028], length 269
2022-04-07 19:09:27.477390 IP (tos 0x0, ttl 64, id 6661, offset 0, flags [DF], proto TCP (6), length 52)
    127.0.0.1.9150 > 127.0.0.1.35254: Flags [.], cksum 0xfe28 (incorrect -> 0xdfb6), seq 4941, ack 864, win 510, options [nop,nop,TS val 3514767029 ecr 3514767029], length 0
2022-04-07 19:09:27.746814 IP (tos 0x0, ttl 64, id 6662, offset 0, flags [DF], proto TCP (6), length 3484)
    127.0.0.1.9150 > 127.0.0.1.35254: Flags [P.], cksum 0x0b91 (incorrect -> 0xec1b), seq 4941:8373, ack 864, win 512, options [nop,nop,TS val 3514767298 ecr 3514767029], length 3432
2022-04-07 19:09:27.746833 IP (tos 0x0, ttl 64, id 38937, offset 0, flags [DF], proto TCP (6), length 52)
    127.0.0.1.35254 > 127.0.0.1.9150: Flags [.], cksum 0xfe28 (incorrect -> 0xd044), seq 864, ack 8373, win 494, options [nop,nop,TS val 3514767298 ecr 3514767298], length 0
2022-04-07 19:09:27.754960 IP (tos 0x0, ttl 64, id 6663, offset 0, flags [DF], proto TCP (6), length 4100)
    127.0.0.1.9150 > 127.0.0.1.35254: Flags [P.], cksum 0x0df9 (incorrect -> 0x020a), seq 8373:12421, ack 864, win 512, options [nop,nop,TS val 3514767306 ecr 3514767298], length 4048
2022-04-07 19:09:27.754988 IP (tos 0x0, ttl 64, id 38938, offset 0, flags [DF], proto TCP (6), length 52)
    127.0.0.1.35254 > 127.0.0.1.9150: Flags [.], cksum 0xfe28 (incorrect -> 0xc066), seq 864, ack 12421, win 492, options [nop,nop,TS val 3514767306 ecr 3514767306], length 0
2022-04-07 19:09:27.754999 IP (tos 0x0, ttl 64, id 6664, offset 0, flags [DF], proto TCP (6), length 580)
    127.0.0.1.9150 > 127.0.0.1.35254: Flags [P.], cksum 0x0039 (incorrect -> 0xbaec), seq 12421:12949, ack 864, win 512, options [nop,nop,TS val 3514767306 ecr 3514767306], length 528
2022-04-07 19:09:27.755005 IP (tos 0x0, ttl 64, id 38939, offset 0, flags [DF], proto TCP (6), length 52)
    127.0.0.1.35254 > 127.0.0.1.9150: Flags [.], cksum 0xfe28 (incorrect -> 0xbe58), seq 864, ack 12949, win 490, options [nop,nop,TS val 3514767306 ecr 3514767306], length 0
2022-04-07 19:09:27.760067 IP (tos 0x0, ttl 64, id 6665, offset 0, flags [DF], proto TCP (6), length 2044)
    127.0.0.1.9150 > 127.0.0.1.35254: Flags [P.], cksum 0x05f1 (incorrect -> 0x36ef), seq 12949:14941, ack 864, win 512, options [nop,nop,TS val 3514767311 ecr 3514767306], length 1992
2022-04-07 19:09:27.760087 IP (tos 0x0, ttl 64, id 38940, offset 0, flags [DF], proto TCP (6), length 52)
    127.0.0.1.35254 > 127.0.0.1.9150: Flags [.], cksum 0xfe28 (incorrect -> 0xb67c), seq 864, ack 14941, win 500, options [nop,nop,TS val 3514767311 ecr 3514767311], length 0
2022-04-07 19:09:27.775569 IP (tos 0x0, ttl 64, id 6666, offset 0, flags [DF], proto TCP (6), length 3353)
    127.0.0.1.9150 > 127.0.0.1.35254: Flags [P.], cksum 0x0b0e (incorrect -> 0x4458), seq 14941:18242, ack 864, win 512, options [nop,nop,TS val 3514767327 ecr 3514767311], length 3301
2022-04-07 19:09:27.775580 IP (tos 0x0, ttl 64, id 38941, offset 0, flags [DF], proto TCP (6), length 52)
    127.0.0.1.35254 > 127.0.0.1.9150: Flags [.], cksum 0xfe28 (incorrect -> 0xa97c), seq 864, ack 18242, win 495, options [nop,nop,TS val 3514767327 ecr 3514767327], length 0
2022-04-07 19:09:27.830621 IP (tos 0x0, ttl 64, id 6667, offset 0, flags [DF], proto TCP (6), length 3538)
    127.0.0.1.9150 > 127.0.0.1.35254: Flags [P.], cksum 0x0bc7 (incorrect -> 0xe113), seq 18242:21728, ack 864, win 512, options [nop,nop,TS val 3514767382 ecr 3514767327], length 3486
2022-04-07 19:09:27.830634 IP (tos 0x0, ttl 64, id 38942, offset 0, flags [DF], proto TCP (6), length 52)
    127.0.0.1.35254 > 127.0.0.1.9150: Flags [.], cksum 0xfe28 (incorrect -> 0x9b71), seq 864, ack 21728, win 494, options [nop,nop,TS val 3514767382 ecr 3514767382], length 0
2022-04-07 19:09:27.838615 IP (tos 0x0, ttl 64, id 6668, offset 0, flags [DF], proto TCP (6), length 4100)
    127.0.0.1.9150 > 127.0.0.1.35254: Flags [P.], cksum 0x0df9 (incorrect -> 0xa387), seq 21728:25776, ack 864, win 512, options [nop,nop,TS val 3514767390 ecr 3514767382], length 4048
2022-04-07 19:09:27.838623 IP (tos 0x0, ttl 64, id 38943, offset 0, flags [DF], proto TCP (6), length 52)
    127.0.0.1.35254 > 127.0.0.1.9150: Flags [.], cksum 0xfe28 (incorrect -> 0x8b93), seq 864, ack 25776, win 492, options [nop,nop,TS val 3514767390 ecr 3514767390], length 0
2022-04-07 19:09:27.838630 IP (tos 0x0, ttl 64, id 6669, offset 0, flags [DF], proto TCP (6), length 3009)
    127.0.0.1.9150 > 127.0.0.1.35254: Flags [P.], cksum 0x09b6 (incorrect -> 0x9eef), seq 25776:28733, ack 864, win 512, options [nop,nop,TS val 3514767390 ecr 3514767390], length 2957
2022-04-07 19:09:27.838634 IP (tos 0x0, ttl 64, id 38944, offset 0, flags [DF], proto TCP (6), length 52)
    127.0.0.1.35254 > 127.0.0.1.9150: Flags [.], cksum 0xfe28 (incorrect -> 0x8012), seq 864, ack 28733, win 480, options [nop,nop,TS val 3514767390 ecr 3514767390], length 0
2022-04-07 19:09:27.838686 IP (tos 0x0, ttl 64, id 6670, offset 0, flags [DF], proto TCP (6), length 4036)
    127.0.0.1.9150 > 127.0.0.1.35254: Flags [P.], cksum 0x0db9 (incorrect -> 0x7166), seq 28733:32717, ack 864, win 512, options [nop,nop,TS val 3514767390 ecr 3514767390], length 3984
2022-04-07 19:09:27.838691 IP (tos 0x0, ttl 64, id 38945, offset 0, flags [DF], proto TCP (6), length 52)
    127.0.0.1.35254 > 127.0.0.1.9150: Flags [.], cksum 0xfe28 (incorrect -> 0x7091), seq 864, ack 32717, win 465, options [nop,nop,TS val 3514767390 ecr 3514767390], length 0
2022-04-07 19:09:27.841230 IP (tos 0x0, ttl 64, id 6671, offset 0, flags [DF], proto TCP (6), length 3617)
    127.0.0.1.9150 > 127.0.0.1.35254: Flags [P.], cksum 0x0c16 (incorrect -> 0x9152), seq 32717:36282, ack 864, win 512, options [nop,nop,TS val 3514767393 ecr 3514767390], length 3565
2022-04-07 19:09:27.841369 IP (tos 0x0, ttl 64, id 38946, offset 0, flags [DF], proto TCP (6), length 52)
    127.0.0.1.35254 > 127.0.0.1.9150: Flags [.], cksum 0xfe28 (incorrect -> 0x626f), seq 864, ack 36282, win 512, options [nop,nop,TS val 3514767393 ecr 3514767393], length 0
2022-04-07 19:09:27.846029 IP (tos 0x0, ttl 64, id 6672, offset 0, flags [DF], proto TCP (6), length 4100)
    127.0.0.1.9150 > 127.0.0.1.35254: Flags [P.], cksum 0x0df9 (incorrect -> 0x946b), seq 36282:40330, ack 864, win 512, options [nop,nop,TS val 3514767397 ecr 3514767393], length 4048
2022-04-07 19:09:27.886787 IP (tos 0x0, ttl 64, id 38947, offset 0, flags [DF], proto TCP (6), length 52)
    127.0.0.1.35254 > 127.0.0.1.9150: Flags [.], cksum 0xfe28 (incorrect -> 0x526e), seq 864, ack 40330, win 512, options [nop,nop,TS val 3514767438 ecr 3514767397], length 0
2022-04-07 19:09:27.886796 IP (tos 0x0, ttl 64, id 6673, offset 0, flags [DF], proto TCP (6), length 6316)
    127.0.0.1.9150 > 127.0.0.1.35254: Flags [P.], cksum 0x16a1 (incorrect -> 0x6b11), seq 40330:46594, ack 864, win 512, options [nop,nop,TS val 3514767438 ecr 3514767438], length 6264
2022-04-07 19:09:27.934805 IP (tos 0x0, ttl 64, id 38948, offset 0, flags [DF], proto TCP (6), length 52)
    127.0.0.1.35254 > 127.0.0.1.9150: Flags [.], cksum 0xfe28 (incorrect -> 0x399d), seq 864, ack 46594, win 512, options [nop,nop,TS val 3514767486 ecr 3514767438], length 0
2022-04-07 19:09:27.934819 IP (tos 0x0, ttl 64, id 6674, offset 0, flags [DF], proto TCP (6), length 18000)
    127.0.0.1.9150 > 127.0.0.1.35254: Flags [P.], cksum 0x4445 (incorrect -> 0xd0df), seq 46594:64542, ack 864, win 512, options [nop,nop,TS val 3514767486 ecr 3514767486], length 17948
2022-04-07 19:09:27.982788 IP (tos 0x0, ttl 64, id 38949, offset 0, flags [DF], proto TCP (6), length 52)
    127.0.0.1.35254 > 127.0.0.1.9150: Flags [.], cksum 0xfe28 (incorrect -> 0xf320), seq 864, ack 64542, win 512, options [nop,nop,TS val 3514767534 ecr 3514767486], length 0
2022-04-07 19:09:28.283579 IP (tos 0x0, ttl 64, id 6675, offset 0, flags [DF], proto TCP (6), length 3538)
    127.0.0.1.9150 > 127.0.0.1.35254: Flags [P.], cksum 0x0bc7 (incorrect -> 0x87ec), seq 64542:68028, ack 864, win 512, options [nop,nop,TS val 3514767835 ecr 3514767534], length 3486
2022-04-07 19:09:28.283599 IP (tos 0x0, ttl 64, id 38950, offset 0, flags [DF], proto TCP (6), length 52)
    127.0.0.1.35254 > 127.0.0.1.9150: Flags [.], cksum 0xfe28 (incorrect -> 0xe30a), seq 864, ack 68028, win 494, options [nop,nop,TS val 3514767835 ecr 3514767835], length 0
2022-04-07 19:09:28.289266 IP (tos 0x0, ttl 64, id 6676, offset 0, flags [DF], proto TCP (6), length 3538)
    127.0.0.1.9150 > 127.0.0.1.35254: Flags [P.], cksum 0x0bc7 (incorrect -> 0x0612), seq 68028:71514, ack 864, win 512, options [nop,nop,TS val 3514767841 ecr 3514767835], length 3486
2022-04-07 19:09:28.334807 IP (tos 0x0, ttl 64, id 38951, offset 0, flags [DF], proto TCP (6), length 52)
    127.0.0.1.35254 > 127.0.0.1.9150: Flags [.], cksum 0xfe28 (incorrect -> 0xd521), seq 864, ack 71514, win 512, options [nop,nop,TS val 3514767886 ecr 3514767841], length 0
2022-04-07 19:09:28.334824 IP (tos 0x0, ttl 64, id 6677, offset 0, flags [DF], proto TCP (6), length 19744)
    127.0.0.1.9150 > 127.0.0.1.35254: Flags [P.], cksum 0x4b15 (incorrect -> 0xe91a), seq 71514:91206, ack 864, win 512, options [nop,nop,TS val 3514767886 ecr 3514767886], length 19692
2022-04-07 19:09:28.382793 IP (tos 0x0, ttl 64, id 38952, offset 0, flags [DF], proto TCP (6), length 52)
    127.0.0.1.35254 > 127.0.0.1.9150: Flags [.], cksum 0xfe28 (incorrect -> 0x87d8), seq 864, ack 91206, win 512, options [nop,nop,TS val 3514767934 ecr 3514767886], length 0
2022-04-07 19:09:28.382981 IP (tos 0x0, ttl 64, id 6678, offset 0, flags [DF], proto TCP (6), length 4100)
    127.0.0.1.9150 > 127.0.0.1.35254: Flags [P.], cksum 0x0df9 (incorrect -> 0x024d), seq 91206:95254, ack 864, win 512, options [nop,nop,TS val 3514767934 ecr 3514767934], length 4048
2022-04-07 19:09:28.383134 IP (tos 0x0, ttl 64, id 38953, offset 0, flags [DF], proto TCP (6), length 52)
    127.0.0.1.35254 > 127.0.0.1.9150: Flags [.], cksum 0xfe28 (incorrect -> 0x77d8), seq 864, ack 95254, win 512, options [nop,nop,TS val 3514767934 ecr 3514767934], length 0
2022-04-07 19:09:28.383143 IP (tos 0x0, ttl 64, id 6679, offset 0, flags [DF], proto TCP (6), length 10000)
    127.0.0.1.9150 > 127.0.0.1.35254: Flags [P.], cksum 0x2505 (incorrect -> 0x73e6), seq 95254:105202, ack 864, win 512, options [nop,nop,TS val 3514767934 ecr 3514767934], length 9948
2022-04-07 19:09:28.383480 IP (tos 0x0, ttl 64, id 38954, offset 0, flags [DF], proto TCP (6), length 52)
    127.0.0.1.35254 > 127.0.0.1.9150: Flags [.], cksum 0xfe28 (incorrect -> 0x50fb), seq 864, ack 105202, win 512, options [nop,nop,TS val 3514767935 ecr 3514767934], length 0
2022-04-07 19:09:28.383489 IP (tos 0x0, ttl 64, id 6680, offset 0, flags [DF], proto TCP (6), length 11008)
    127.0.0.1.9150 > 127.0.0.1.35254: Flags [P.], cksum 0x28f5 (incorrect -> 0x7f31), seq 105202:116158, ack 864, win 512, options [nop,nop,TS val 3514767935 ecr 3514767935], length 10956
2022-04-07 19:09:28.383494 IP (tos 0x0, ttl 64, id 38955, offset 0, flags [DF], proto TCP (6), length 52)
    127.0.0.1.35254 > 127.0.0.1.9150: Flags [.], cksum 0xfe28 (incorrect -> 0x262e), seq 864, ack 116158, win 512, options [nop,nop,TS val 3514767935 ecr 3514767935], length 0
2022-04-07 19:09:28.395486 IP (tos 0x0, ttl 64, id 6681, offset 0, flags [DF], proto TCP (6), length 3040)
    127.0.0.1.9150 > 127.0.0.1.35254: Flags [P.], cksum 0x09d5 (incorrect -> 0xe771), seq 116158:119146, ack 864, win 512, options [nop,nop,TS val 3514767947 ecr 3514767935], length 2988
2022-04-07 19:09:28.395691 IP (tos 0x0, ttl 64, id 38956, offset 0, flags [DF], proto TCP (6), length 52)
    127.0.0.1.35254 > 127.0.0.1.9150: Flags [.], cksum 0xfe28 (incorrect -> 0x1a6a), seq 864, ack 119146, win 512, options [nop,nop,TS val 3514767947 ecr 3514767947], length 0
200, 2.5012807846069336, 1.198681116104126