2022-04-07 10:13:48.698181 IP (tos 0x0, ttl 64, id 41649, offset 0, flags [DF], proto TCP (6), length 60)
    127.0.0.1.48180 > 127.0.0.1.10350: Flags [S], cksum 0xfe30 (incorrect -> 0xdd15), seq 1639754846, win 65495, options [mss 65495,sackOK,TS val 3482628249 ecr 0,nop,wscale 7], length 0
2022-04-07 10:13:48.698191 IP (tos 0x0, ttl 64, id 0, offset 0, flags [DF], proto TCP (6), length 60)
    127.0.0.1.10350 > 127.0.0.1.48180: Flags [S.], cksum 0xfe30 (incorrect -> 0x48a8), seq 3756930123, ack 1639754847, win 65483, options [mss 65495,sackOK,TS val 3482628249 ecr 3482628249,nop,wscale 7], length 0
2022-04-07 10:13:48.698199 IP (tos 0x0, ttl 64, id 41650, offset 0, flags [DF], proto TCP (6), length 52)
    127.0.0.1.48180 > 127.0.0.1.10350: Flags [.], cksum 0xfe28 (incorrect -> 0x6f64), seq 1, ack 1, win 512, options [nop,nop,TS val 3482628249 ecr 3482628249], length 0
2022-04-07 10:13:48.698337 IP (tos 0x0, ttl 64, id 41651, offset 0, flags [DF], proto TCP (6), length 55)
    127.0.0.1.48180 > 127.0.0.1.10350: Flags [P.], cksum 0xfe2b (incorrect -> 0x6a57), seq 1:4, ack 1, win 512, options [nop,nop,TS val 3482628250 ecr 3482628249], length 3
2022-04-07 10:13:48.698344 IP (tos 0x0, ttl 64, id 55177, offset 0, flags [DF], proto TCP (6), length 52)
    127.0.0.1.10350 > 127.0.0.1.48180: Flags [.], cksum 0xfe28 (incorrect -> 0x6f5f), seq 1, ack 4, win 512, options [nop,nop,TS val 3482628250 ecr 3482628250], length 0
2022-04-07 10:13:48.698374 IP (tos 0x0, ttl 64, id 55178, offset 0, flags [DF], proto TCP (6), length 54)
    127.0.0.1.10350 > 127.0.0.1.48180: Flags [P.], cksum 0xfe2a (incorrect -> 0x6a55), seq 1:3, ack 4, win 512, options [nop,nop,TS val 3482628250 ecr 3482628250], length 2
2022-04-07 10:13:48.698382 IP (tos 0x0, ttl 64, id 41652, offset 0, flags [DF], proto TCP (6), length 52)
    127.0.0.1.48180 > 127.0.0.1.10350: Flags [.], cksum 0xfe28 (incorrect -> 0x6f5d), seq 4, ack 3, win 512, options [nop,nop,TS val 3482628250 ecr 3482628250], length 0
2022-04-07 10:13:48.699614 IP (tos 0x0, ttl 64, id 41653, offset 0, flags [DF], proto TCP (6), length 62)
    127.0.0.1.48180 > 127.0.0.1.10350: Flags [P.], cksum 0xfe32 (incorrect -> 0xb5ee), seq 4:14, ack 3, win 512, options [nop,nop,TS val 3482628251 ecr 3482628250], length 10
2022-04-07 10:13:48.699622 IP (tos 0x0, ttl 64, id 55179, offset 0, flags [DF], proto TCP (6), length 52)
    127.0.0.1.10350 > 127.0.0.1.48180: Flags [.], cksum 0xfe28 (incorrect -> 0x6f51), seq 3, ack 14, win 512, options [nop,nop,TS val 3482628251 ecr 3482628251], length 0
2022-04-07 10:13:48.782905 IP (tos 0x0, ttl 64, id 55180, offset 0, flags [DF], proto TCP (6), length 62)
    127.0.0.1.10350 > 127.0.0.1.48180: Flags [P.], cksum 0xfe32 (incorrect -> 0x69eb), seq 3:13, ack 14, win 512, options [nop,nop,TS val 3482628334 ecr 3482628251], length 10
2022-04-07 10:13:48.782914 IP (tos 0x0, ttl 64, id 41654, offset 0, flags [DF], proto TCP (6), length 52)
    127.0.0.1.48180 > 127.0.0.1.10350: Flags [.], cksum 0xfe28 (incorrect -> 0x6ea1), seq 14, ack 13, win 512, options [nop,nop,TS val 3482628334 ecr 3482628334], length 0
2022-04-07 10:13:48.788455 IP (tos 0x0, ttl 64, id 41655, offset 0, flags [DF], proto TCP (6), length 569)
    127.0.0.1.48180 > 127.0.0.1.10350: Flags [P.], cksum 0x002e (incorrect -> 0x42ce), seq 14:531, ack 13, win 512, options [nop,nop,TS val 3482628340 ecr 3482628334], length 517
2022-04-07 10:13:48.788465 IP (tos 0x0, ttl 64, id 55181, offset 0, flags [DF], proto TCP (6), length 52)
    127.0.0.1.10350 > 127.0.0.1.48180: Flags [.], cksum 0xfe28 (incorrect -> 0x6c94), seq 13, ack 531, win 508, options [nop,nop,TS val 3482628340 ecr 3482628340], length 0
200, 4.797268390655518, 1.0688529014587402