2022-04-07 04:01:00.283832 IP (tos 0x0, ttl 64, id 21198, offset 0, flags [DF], proto TCP (6), length 60)
    127.0.0.1.59920 > 127.0.0.1.10750: Flags [S], cksum 0xfe30 (incorrect -> 0x0262), seq 3648465296, win 65495, options [mss 65495,sackOK,TS val 386342786 ecr 0,nop,wscale 7], length 0
2022-04-07 04:01:00.283847 IP (tos 0x0, ttl 64, id 0, offset 0, flags [DF], proto TCP (6), length 60)
    127.0.0.1.10750 > 127.0.0.1.59920: Flags [S.], cksum 0xfe30 (incorrect -> 0xd08f), seq 320989218, ack 3648465297, win 65483, options [mss 65495,sackOK,TS val 386342786 ecr 386342786,nop,wscale 7], length 0
2022-04-07 04:01:00.283860 IP (tos 0x0, ttl 64, id 21199, offset 0, flags [DF], proto TCP (6), length 52)
    127.0.0.1.59920 > 127.0.0.1.10750: Flags [.], cksum 0xfe28 (incorrect -> 0xf74b), seq 1, ack 1, win 512, options [nop,nop,TS val 386342786 ecr 386342786], length 0
2022-04-07 04:01:00.283966 IP (tos 0x0, ttl 64, id 21200, offset 0, flags [DF], proto TCP (6), length 55)
    127.0.0.1.59920 > 127.0.0.1.10750: Flags [P.], cksum 0xfe2b (incorrect -> 0xf23f), seq 1:4, ack 1, win 512, options [nop,nop,TS val 386342786 ecr 386342786], length 3
2022-04-07 04:01:00.283981 IP (tos 0x0, ttl 64, id 29204, offset 0, flags [DF], proto TCP (6), length 52)
    127.0.0.1.10750 > 127.0.0.1.59920: Flags [.], cksum 0xfe28 (incorrect -> 0xf748), seq 1, ack 4, win 512, options [nop,nop,TS val 386342786 ecr 386342786], length 0
2022-04-07 04:01:00.284023 IP (tos 0x0, ttl 64, id 29205, offset 0, flags [DF], proto TCP (6), length 54)
    127.0.0.1.10750 > 127.0.0.1.59920: Flags [P.], cksum 0xfe2a (incorrect -> 0xf23e), seq 1:3, ack 4, win 512, options [nop,nop,TS val 386342786 ecr 386342786], length 2
2022-04-07 04:01:00.284039 IP (tos 0x0, ttl 64, id 21201, offset 0, flags [DF], proto TCP (6), length 52)
    127.0.0.1.59920 > 127.0.0.1.10750: Flags [.], cksum 0xfe28 (incorrect -> 0xf746), seq 4, ack 3, win 512, options [nop,nop,TS val 386342786 ecr 386342786], length 0
2022-04-07 04:01:00.285610 IP (tos 0x0, ttl 64, id 21202, offset 0, flags [DF], proto TCP (6), length 62)
    127.0.0.1.59920 > 127.0.0.1.10750: Flags [P.], cksum 0xfe32 (incorrect -> 0xa9a7), seq 4:14, ack 3, win 512, options [nop,nop,TS val 386342788 ecr 386342786], length 10
2022-04-07 04:01:00.285631 IP (tos 0x0, ttl 64, id 29206, offset 0, flags [DF], proto TCP (6), length 52)
    127.0.0.1.10750 > 127.0.0.1.59920: Flags [.], cksum 0xfe28 (incorrect -> 0xf738), seq 3, ack 14, win 512, options [nop,nop,TS val 386342788 ecr 386342788], length 0
2022-04-07 04:01:00.477728 IP (tos 0x0, ttl 64, id 29207, offset 0, flags [DF], proto TCP (6), length 62)
    127.0.0.1.10750 > 127.0.0.1.59920: Flags [P.], cksum 0xfe32 (incorrect -> 0xf165), seq 3:13, ack 14, win 512, options [nop,nop,TS val 386342980 ecr 386342788], length 10
2022-04-07 04:01:00.477744 IP (tos 0x0, ttl 64, id 21203, offset 0, flags [DF], proto TCP (6), length 52)
    127.0.0.1.59920 > 127.0.0.1.10750: Flags [.], cksum 0xfe28 (incorrect -> 0xf5ae), seq 14, ack 13, win 512, options [nop,nop,TS val 386342980 ecr 386342980], length 0
2022-04-07 04:01:00.483655 IP (tos 0x0, ttl 64, id 21204, offset 0, flags [DF], proto TCP (6), length 569)
    127.0.0.1.59920 > 127.0.0.1.10750: Flags [P.], cksum 0x002e (incorrect -> 0x084f), seq 14:531, ack 13, win 512, options [nop,nop,TS val 386342986 ecr 386342980], length 517
2022-04-07 04:01:00.483675 IP (tos 0x0, ttl 64, id 29208, offset 0, flags [DF], proto TCP (6), length 52)
    127.0.0.1.10750 > 127.0.0.1.59920: Flags [.], cksum 0xfe28 (incorrect -> 0xf3a1), seq 13, ack 531, win 508, options [nop,nop,TS val 386342986 ecr 386342986], length 0
2022-04-07 04:01:00.690824 IP (tos 0x0, ttl 64, id 29209, offset 0, flags [DF], proto TCP (6), length 3340)
    127.0.0.1.10750 > 127.0.0.1.59920: Flags [P.], cksum 0x0b01 (incorrect -> 0x8056), seq 13:3301, ack 531, win 512, options [nop,nop,TS val 386343193 ecr 386342986], length 3288
2022-04-07 04:01:00.690839 IP (tos 0x0, ttl 64, id 21205, offset 0, flags [DF], proto TCP (6), length 52)
    127.0.0.1.59920 > 127.0.0.1.10750: Flags [.], cksum 0xfe28 (incorrect -> 0xe538), seq 531, ack 3301, win 495, options [nop,nop,TS val 386343193 ecr 386343193], length 0
2022-04-07 04:01:00.691496 IP (tos 0x0, ttl 64, id 21206, offset 0, flags [DF], proto TCP (6), length 145)
    127.0.0.1.59920 > 127.0.0.1.10750: Flags [P.], cksum 0xfe85 (incorrect -> 0xdf99), seq 531:624, ack 3301, win 512, options [nop,nop,TS val 386343194 ecr 386343193], length 93
2022-04-07 04:01:00.691506 IP (tos 0x0, ttl 64, id 29210, offset 0, flags [DF], proto TCP (6), length 52)
    127.0.0.1.10750 > 127.0.0.1.59920: Flags [.], cksum 0xfe28 (incorrect -> 0xe4c8), seq 3301, ack 624, win 512, options [nop,nop,TS val 386343194 ecr 386343194], length 0
2022-04-07 04:01:00.883269 IP (tos 0x0, ttl 64, id 29211, offset 0, flags [DF], proto TCP (6), length 103)
    127.0.0.1.10750 > 127.0.0.1.59920: Flags [P.], cksum 0xfe5b (incorrect -> 0x167a), seq 3301:3352, ack 624, win 512, options [nop,nop,TS val 386343386 ecr 386343194], length 51
2022-04-07 04:01:00.883280 IP (tos 0x0, ttl 64, id 21207, offset 0, flags [DF], proto TCP (6), length 52)
    127.0.0.1.59920 > 127.0.0.1.10750: Flags [.], cksum 0xfe28 (incorrect -> 0xe315), seq 624, ack 3352, win 512, options [nop,nop,TS val 386343386 ecr 386343386], length 0
2022-04-07 04:01:00.883816 IP (tos 0x0, ttl 64, id 21208, offset 0, flags [DF], proto TCP (6), length 316)
    127.0.0.1.59920 > 127.0.0.1.10750: Flags [P.], cksum 0xff30 (incorrect -> 0x1036), seq 624:888, ack 3352, win 512, options [nop,nop,TS val 386343386 ecr 386343386], length 264
2022-04-07 04:01:00.883941 IP (tos 0x0, ttl 64, id 29212, offset 0, flags [DF], proto TCP (6), length 52)
    127.0.0.1.10750 > 127.0.0.1.59920: Flags [.], cksum 0xfe28 (incorrect -> 0xe20f), seq 3352, ack 888, win 510, options [nop,nop,TS val 386343386 ecr 386343386], length 0
2022-04-07 04:01:01.161615 IP (tos 0x0, ttl 64, id 29213, offset 0, flags [DF], proto TCP (6), length 3538)
    127.0.0.1.10750 > 127.0.0.1.59920: Flags [P.], cksum 0x0bc7 (incorrect -> 0xafe8), seq 3352:6838, ack 888, win 512, options [nop,nop,TS val 386343664 ecr 386343386], length 3486
2022-04-07 04:01:01.202653 IP (tos 0x0, ttl 64, id 21209, offset 0, flags [DF], proto TCP (6), length 52)
    127.0.0.1.59920 > 127.0.0.1.10750: Flags [.], cksum 0xfe28 (incorrect -> 0xd21a), seq 888, ack 6838, win 512, options [nop,nop,TS val 386343705 ecr 386343664], length 0
2022-04-07 04:01:01.202663 IP (tos 0x0, ttl 64, id 29214, offset 0, flags [DF], proto TCP (6), length 11506)
    127.0.0.1.10750 > 127.0.0.1.59920: Flags [P.], cksum 0x2ae7 (incorrect -> 0x5b35), seq 6838:18292, ack 888, win 512, options [nop,nop,TS val 386343705 ecr 386343705], length 11454
2022-04-07 04:01:01.202669 IP (tos 0x0, ttl 64, id 21210, offset 0, flags [DF], proto TCP (6), length 52)
    127.0.0.1.59920 > 127.0.0.1.10750: Flags [.], cksum 0xfe28 (incorrect -> 0xa564), seq 888, ack 18292, win 463, options [nop,nop,TS val 386343705 ecr 386343705], length 0
2022-04-07 04:01:01.231981 IP (tos 0x0, ttl 64, id 29215, offset 0, flags [DF], proto TCP (6), length 4100)
    127.0.0.1.10750 > 127.0.0.1.59920: Flags [P.], cksum 0x0df9 (incorrect -> 0xb81c), seq 18292:22340, ack 888, win 512, options [nop,nop,TS val 386343734 ecr 386343705], length 4048
2022-04-07 04:01:01.231994 IP (tos 0x0, ttl 64, id 21211, offset 0, flags [DF], proto TCP (6), length 52)
    127.0.0.1.59920 > 127.0.0.1.10750: Flags [.], cksum 0xfe28 (incorrect -> 0x953d), seq 888, ack 22340, win 492, options [nop,nop,TS val 386343734 ecr 386343734], length 0
2022-04-07 04:01:01.233546 IP (tos 0x0, ttl 64, id 29216, offset 0, flags [DF], proto TCP (6), length 1926)
    127.0.0.1.10750 > 127.0.0.1.59920: Flags [P.], cksum 0x057b (incorrect -> 0x5ea7), seq 22340:24214, ack 888, win 512, options [nop,nop,TS val 386343736 ecr 386343734], length 1874
2022-04-07 04:01:01.233553 IP (tos 0x0, ttl 64, id 21212, offset 0, flags [DF], proto TCP (6), length 52)
    127.0.0.1.59920 > 127.0.0.1.10750: Flags [.], cksum 0xfe28 (incorrect -> 0x8ddf), seq 888, ack 24214, win 500, options [nop,nop,TS val 386343736 ecr 386343736], length 0
2022-04-07 04:01:01.233655 IP (tos 0x0, ttl 64, id 29217, offset 0, flags [DF], proto TCP (6), length 4100)
    127.0.0.1.10750 > 127.0.0.1.59920: Flags [P.], cksum 0x0df9 (incorrect -> 0xeeb7), seq 24214:28262, ack 888, win 512, options [nop,nop,TS val 386343736 ecr 386343736], length 4048
2022-04-07 04:01:01.233663 IP (tos 0x0, ttl 64, id 21213, offset 0, flags [DF], proto TCP (6), length 52)
    127.0.0.1.59920 > 127.0.0.1.10750: Flags [.], cksum 0xfe28 (incorrect -> 0x7e17), seq 888, ack 28262, win 492, options [nop,nop,TS val 386343736 ecr 386343736], length 0
2022-04-07 04:01:01.233681 IP (tos 0x0, ttl 64, id 29218, offset 0, flags [DF], proto TCP (6), length 3474)
    127.0.0.1.10750 > 127.0.0.1.59920: Flags [P.], cksum 0x0b87 (incorrect -> 0x2635), seq 28262:31684, ack 888, win 512, options [nop,nop,TS val 386343736 ecr 386343736], length 3422
2022-04-07 04:01:01.233686 IP (tos 0x0, ttl 64, id 21214, offset 0, flags [DF], proto TCP (6), length 52)
    127.0.0.1.59920 > 127.0.0.1.10750: Flags [.], cksum 0xfe28 (incorrect -> 0x70b7), seq 888, ack 31684, win 494, options [nop,nop,TS val 386343736 ecr 386343736], length 0
2022-04-07 04:01:01.259977 IP (tos 0x0, ttl 64, id 29219, offset 0, flags [DF], proto TCP (6), length 4100)
    127.0.0.1.10750 > 127.0.0.1.59920: Flags [P.], cksum 0x0df9 (incorrect -> 0xeeb2), seq 31684:35732, ack 888, win 512, options [nop,nop,TS val 386343762 ecr 386343736], length 4048
2022-04-07 04:01:01.259985 IP (tos 0x0, ttl 64, id 21215, offset 0, flags [DF], proto TCP (6), length 52)
    127.0.0.1.59920 > 127.0.0.1.10750: Flags [.], cksum 0xfe28 (incorrect -> 0x60b5), seq 888, ack 35732, win 492, options [nop,nop,TS val 386343762 ecr 386343762], length 0
2022-04-07 04:01:01.260008 IP (tos 0x0, ttl 64, id 29220, offset 0, flags [DF], proto TCP (6), length 3474)
    127.0.0.1.10750 > 127.0.0.1.59920: Flags [P.], cksum 0x0b87 (incorrect -> 0x46f5), seq 35732:39154, ack 888, win 512, options [nop,nop,TS val 386343762 ecr 386343762], length 3422
2022-04-07 04:01:01.260014 IP (tos 0x0, ttl 64, id 21216, offset 0, flags [DF], proto TCP (6), length 52)
    127.0.0.1.59920 > 127.0.0.1.10750: Flags [.], cksum 0xfe28 (incorrect -> 0x5355), seq 888, ack 39154, win 494, options [nop,nop,TS val 386343762 ecr 386343762], length 0
2022-04-07 04:01:01.272756 IP (tos 0x0, ttl 64, id 29221, offset 0, flags [DF], proto TCP (6), length 4100)
    127.0.0.1.10750 > 127.0.0.1.59920: Flags [P.], cksum 0x0df9 (incorrect -> 0x5310), seq 39154:43202, ack 888, win 512, options [nop,nop,TS val 386343775 ecr 386343762], length 4048
2022-04-07 04:01:01.272768 IP (tos 0x0, ttl 64, id 21217, offset 0, flags [DF], proto TCP (6), length 52)
    127.0.0.1.59920 > 127.0.0.1.10750: Flags [.], cksum 0xfe28 (incorrect -> 0x436d), seq 888, ack 43202, win 492, options [nop,nop,TS val 386343775 ecr 386343775], length 0
2022-04-07 04:01:01.272794 IP (tos 0x0, ttl 64, id 29222, offset 0, flags [DF], proto TCP (6), length 984)
    127.0.0.1.10750 > 127.0.0.1.59920: Flags [P.], cksum 0x01cd (incorrect -> 0xbf71), seq 43202:44134, ack 888, win 512, options [nop,nop,TS val 386343775 ecr 386343775], length 932
2022-04-07 04:01:01.272802 IP (tos 0x0, ttl 64, id 21218, offset 0, flags [DF], proto TCP (6), length 52)
    127.0.0.1.59920 > 127.0.0.1.10750: Flags [.], cksum 0xfe28 (incorrect -> 0x3fb5), seq 888, ack 44134, win 512, options [nop,nop,TS val 386343775 ecr 386343775], length 0
2022-04-07 04:01:01.272874 IP (tos 0x0, ttl 64, id 29223, offset 0, flags [DF], proto TCP (6), length 4100)
    127.0.0.1.10750 > 127.0.0.1.59920: Flags [P.], cksum 0x0df9 (incorrect -> 0x2ec3), seq 44134:48182, ack 888, win 512, options [nop,nop,TS val 386343775 ecr 386343775], length 4048
2022-04-07 04:01:01.272888 IP (tos 0x0, ttl 64, id 21219, offset 0, flags [DF], proto TCP (6), length 52)
    127.0.0.1.59920 > 127.0.0.1.10750: Flags [.], cksum 0xfe28 (incorrect -> 0x2fe5), seq 888, ack 48182, win 512, options [nop,nop,TS val 386343775 ecr 386343775], length 0
2022-04-07 04:01:01.272899 IP (tos 0x0, ttl 64, id 29224, offset 0, flags [DF], proto TCP (6), length 3474)
    127.0.0.1.10750 > 127.0.0.1.59920: Flags [P.], cksum 0x0b87 (incorrect -> 0x2e68), seq 48182:51604, ack 888, win 512, options [nop,nop,TS val 386343775 ecr 386343775], length 3422
2022-04-07 04:01:01.272909 IP (tos 0x0, ttl 64, id 21220, offset 0, flags [DF], proto TCP (6), length 52)
    127.0.0.1.59920 > 127.0.0.1.10750: Flags [.], cksum 0xfe28 (incorrect -> 0x2287), seq 888, ack 51604, win 512, options [nop,nop,TS val 386343775 ecr 386343775], length 0
2022-04-07 04:01:01.274393 IP (tos 0x0, ttl 64, id 29225, offset 0, flags [DF], proto TCP (6), length 3928)
    127.0.0.1.10750 > 127.0.0.1.59920: Flags [P.], cksum 0x0d4d (incorrect -> 0x2725), seq 51604:55480, ack 888, win 512, options [nop,nop,TS val 386343777 ecr 386343775], length 3876
2022-04-07 04:01:01.274450 IP (tos 0x0, ttl 64, id 21221, offset 0, flags [DF], proto TCP (6), length 52)
    127.0.0.1.59920 > 127.0.0.1.10750: Flags [.], cksum 0xfe28 (incorrect -> 0x135f), seq 888, ack 55480, win 512, options [nop,nop,TS val 386343777 ecr 386343777], length 0
2022-04-07 04:01:01.332453 IP (tos 0x0, ttl 64, id 29226, offset 0, flags [DF], proto TCP (6), length 4100)
    127.0.0.1.10750 > 127.0.0.1.59920: Flags [P.], cksum 0x0df9 (incorrect -> 0x47f2), seq 55480:59528, ack 888, win 512, options [nop,nop,TS val 386343835 ecr 386343777], length 4048
2022-04-07 04:01:01.332469 IP (tos 0x0, ttl 64, id 21222, offset 0, flags [DF], proto TCP (6), length 52)
    127.0.0.1.59920 > 127.0.0.1.10750: Flags [.], cksum 0xfe28 (incorrect -> 0x031b), seq 888, ack 59528, win 512, options [nop,nop,TS val 386343835 ecr 386343835], length 0
2022-04-07 04:01:01.332481 IP (tos 0x0, ttl 64, id 29227, offset 0, flags [DF], proto TCP (6), length 3474)
    127.0.0.1.10750 > 127.0.0.1.59920: Flags [P.], cksum 0x0b87 (incorrect -> 0x1db6), seq 59528:62950, ack 888, win 512, options [nop,nop,TS val 386343835 ecr 386343835], length 3422
2022-04-07 04:01:01.332489 IP (tos 0x0, ttl 64, id 21223, offset 0, flags [DF], proto TCP (6), length 52)
    127.0.0.1.59920 > 127.0.0.1.10750: Flags [.], cksum 0xfe28 (incorrect -> 0xf5bc), seq 888, ack 62950, win 512, options [nop,nop,TS val 386343835 ecr 386343835], length 0
2022-04-07 04:01:01.332530 IP (tos 0x0, ttl 64, id 29228, offset 0, flags [DF], proto TCP (6), length 4036)
    127.0.0.1.10750 > 127.0.0.1.59920: Flags [P.], cksum 0x0db9 (incorrect -> 0x64e7), seq 62950:66934, ack 888, win 512, options [nop,nop,TS val 386343835 ecr 386343835], length 3984
2022-04-07 04:01:01.332540 IP (tos 0x0, ttl 64, id 21224, offset 0, flags [DF], proto TCP (6), length 52)
    127.0.0.1.59920 > 127.0.0.1.10750: Flags [.], cksum 0xfe28 (incorrect -> 0xe62c), seq 888, ack 66934, win 512, options [nop,nop,TS val 386343835 ecr 386343835], length 0
2022-04-07 04:01:01.336420 IP (tos 0x0, ttl 64, id 29229, offset 0, flags [DF], proto TCP (6), length 4100)
    127.0.0.1.10750 > 127.0.0.1.59920: Flags [P.], cksum 0x0df9 (incorrect -> 0xa958), seq 66934:70982, ack 888, win 512, options [nop,nop,TS val 386343839 ecr 386343835], length 4048
2022-04-07 04:01:01.336580 IP (tos 0x0, ttl 64, id 21225, offset 0, flags [DF], proto TCP (6), length 52)
    127.0.0.1.59920 > 127.0.0.1.10750: Flags [.], cksum 0xfe28 (incorrect -> 0xd654), seq 888, ack 70982, win 512, options [nop,nop,TS val 386343839 ecr 386343839], length 0
2022-04-07 04:01:01.336594 IP (tos 0x0, ttl 64, id 29230, offset 0, flags [DF], proto TCP (6), length 486)
    127.0.0.1.10750 > 127.0.0.1.59920: Flags [P.], cksum 0xffda (incorrect -> 0x2af8), seq 70982:71416, ack 888, win 512, options [nop,nop,TS val 386343839 ecr 386343839], length 434
2022-04-07 04:01:01.336603 IP (tos 0x0, ttl 64, id 21226, offset 0, flags [DF], proto TCP (6), length 52)
    127.0.0.1.59920 > 127.0.0.1.10750: Flags [.], cksum 0xfe28 (incorrect -> 0xd4a2), seq 888, ack 71416, win 512, options [nop,nop,TS val 386343839 ecr 386343839], length 0
2022-04-07 04:01:01.359340 IP (tos 0x0, ttl 64, id 29231, offset 0, flags [DF], proto TCP (6), length 3538)
    127.0.0.1.10750 > 127.0.0.1.59920: Flags [P.], cksum 0x0bc7 (incorrect -> 0x380c), seq 71416:74902, ack 888, win 512, options [nop,nop,TS val 386343862 ecr 386343839], length 3486
2022-04-07 04:01:01.359359 IP (tos 0x0, ttl 64, id 21227, offset 0, flags [DF], proto TCP (6), length 52)
    127.0.0.1.59920 > 127.0.0.1.10750: Flags [.], cksum 0xfe28 (incorrect -> 0xc6d6), seq 888, ack 74902, win 512, options [nop,nop,TS val 386343862 ecr 386343862], length 0
2022-04-07 04:01:01.360682 IP (tos 0x0, ttl 64, id 29232, offset 0, flags [DF], proto TCP (6), length 4036)
    127.0.0.1.10750 > 127.0.0.1.59920: Flags [P.], cksum 0x0db9 (incorrect -> 0x7455), seq 74902:78886, ack 888, win 512, options [nop,nop,TS val 386343863 ecr 386343862], length 3984
2022-04-07 04:01:01.360697 IP (tos 0x0, ttl 64, id 21228, offset 0, flags [DF], proto TCP (6), length 52)
    127.0.0.1.59920 > 127.0.0.1.10750: Flags [.], cksum 0xfe28 (incorrect -> 0xb744), seq 888, ack 78886, win 512, options [nop,nop,TS val 386343863 ecr 386343863], length 0
2022-04-07 04:01:01.360748 IP (tos 0x0, ttl 64, id 29233, offset 0, flags [DF], proto TCP (6), length 4100)
    127.0.0.1.10750 > 127.0.0.1.59920: Flags [P.], cksum 0x0df9 (incorrect -> 0x99d5), seq 78886:82934, ack 888, win 512, options [nop,nop,TS val 386343863 ecr 386343863], length 4048
2022-04-07 04:01:01.360760 IP (tos 0x0, ttl 64, id 21229, offset 0, flags [DF], proto TCP (6), length 52)
    127.0.0.1.59920 > 127.0.0.1.10750: Flags [.], cksum 0xfe28 (incorrect -> 0xa774), seq 888, ack 82934, win 512, options [nop,nop,TS val 386343863 ecr 386343863], length 0
2022-04-07 04:01:01.360770 IP (tos 0x0, ttl 64, id 29234, offset 0, flags [DF], proto TCP (6), length 3474)
    127.0.0.1.10750 > 127.0.0.1.59920: Flags [P.], cksum 0x0b87 (incorrect -> 0x2edd), seq 82934:86356, ack 888, win 512, options [nop,nop,TS val 386343863 ecr 386343863], length 3422
2022-04-07 04:01:01.360822 IP (tos 0x0, ttl 64, id 21230, offset 0, flags [DF], proto TCP (6), length 52)
    127.0.0.1.59920 > 127.0.0.1.10750: Flags [.], cksum 0xfe28 (incorrect -> 0x9a16), seq 888, ack 86356, win 512, options [nop,nop,TS val 386343863 ecr 386343863], length 0
2022-04-07 04:01:01.363306 IP (tos 0x0, ttl 64, id 29235, offset 0, flags [DF], proto TCP (6), length 1048)
    127.0.0.1.10750 > 127.0.0.1.59920: Flags [P.], cksum 0x020d (incorrect -> 0xf633), seq 86356:87352, ack 888, win 512, options [nop,nop,TS val 386343866 ecr 386343863], length 996
2022-04-07 04:01:01.363368 IP (tos 0x0, ttl 64, id 21231, offset 0, flags [DF], proto TCP (6), length 52)
    127.0.0.1.59920 > 127.0.0.1.10750: Flags [.], cksum 0xfe28 (incorrect -> 0x962c), seq 888, ack 87352, win 512, options [nop,nop,TS val 386343866 ecr 386343866], length 0
2022-04-07 04:01:01.365426 IP (tos 0x0, ttl 64, id 29236, offset 0, flags [DF], proto TCP (6), length 3538)
    127.0.0.1.10750 > 127.0.0.1.59920: Flags [P.], cksum 0x0bc7 (incorrect -> 0x12a3), seq 87352:90838, ack 888, win 512, options [nop,nop,TS val 386343868 ecr 386343866], length 3486
2022-04-07 04:01:01.365471 IP (tos 0x0, ttl 64, id 21232, offset 0, flags [DF], proto TCP (6), length 52)
    127.0.0.1.59920 > 127.0.0.1.10750: Flags [.], cksum 0xfe28 (incorrect -> 0x888a), seq 888, ack 90838, win 512, options [nop,nop,TS val 386343868 ecr 386343868], length 0
2022-04-07 04:01:01.365485 IP (tos 0x0, ttl 64, id 29237, offset 0, flags [DF], proto TCP (6), length 3538)
    127.0.0.1.10750 > 127.0.0.1.59920: Flags [P.], cksum 0x0bc7 (incorrect -> 0x1182), seq 90838:94324, ack 888, win 512, options [nop,nop,TS val 386343868 ecr 386343868], length 3486
2022-04-07 04:01:01.406659 IP (tos 0x0, ttl 64, id 21233, offset 0, flags [DF], proto TCP (6), length 52)
    127.0.0.1.59920 > 127.0.0.1.10750: Flags [.], cksum 0xfe28 (incorrect -> 0x7ac3), seq 888, ack 94324, win 512, options [nop,nop,TS val 386343909 ecr 386343868], length 0
2022-04-07 04:01:01.406668 IP (tos 0x0, ttl 64, id 29238, offset 0, flags [DF], proto TCP (6), length 1752)
    127.0.0.1.10750 > 127.0.0.1.59920: Flags [P.], cksum 0x04cd (incorrect -> 0x5d13), seq 94324:96024, ack 888, win 512, options [nop,nop,TS val 386343909 ecr 386343909], length 1700
2022-04-07 04:01:01.406706 IP (tos 0x0, ttl 64, id 21234, offset 0, flags [DF], proto TCP (6), length 52)
    127.0.0.1.59920 > 127.0.0.1.10750: Flags [.], cksum 0xfe28 (incorrect -> 0x73f6), seq 888, ack 96024, win 512, options [nop,nop,TS val 386343909 ecr 386343909], length 0
2022-04-07 04:01:01.434553 IP (tos 0x0, ttl 64, id 29239, offset 0, flags [DF], proto TCP (6), length 4100)
    127.0.0.1.10750 > 127.0.0.1.59920: Flags [P.], cksum 0x0df9 (incorrect -> 0xce82), seq 96024:100072, ack 888, win 512, options [nop,nop,TS val 386343937 ecr 386343909], length 4048
2022-04-07 04:01:01.464452 IP (tos 0x0, ttl 64, id 29240, offset 0, flags [DF], proto TCP (6), length 32820)
    127.0.0.1.10750 > 127.0.0.1.59920: Flags [.], cksum 0x7e29 (incorrect -> 0xa859), seq 100072:132840, ack 888, win 512, options [nop,nop,TS val 386343967 ecr 386343909], length 32768
2022-04-07 04:01:01.464460 IP (tos 0x0, ttl 64, id 21235, offset 0, flags [DF], proto TCP (6), length 52)
    127.0.0.1.59920 > 127.0.0.1.10750: Flags [.], cksum 0xfe28 (incorrect -> 0xe454), seq 888, ack 132840, win 379, options [nop,nop,TS val 386343967 ecr 386343937], length 0
2022-04-07 04:01:01.464470 IP (tos 0x0, ttl 64, id 29241, offset 0, flags [DF], proto TCP (6), length 1926)
    127.0.0.1.10750 > 127.0.0.1.59920: Flags [P.], cksum 0x057b (incorrect -> 0x4df2), seq 132840:134714, ack 888, win 512, options [nop,nop,TS val 386343967 ecr 386343967], length 1874
2022-04-07 04:01:01.464623 IP (tos 0x0, ttl 64, id 21236, offset 0, flags [DF], proto TCP (6), length 52)
    127.0.0.1.59920 > 127.0.0.1.10750: Flags [.], cksum 0xfe28 (incorrect -> 0xdc5f), seq 888, ack 134714, win 512, options [nop,nop,TS val 386343967 ecr 386343967], length 0
2022-04-07 04:01:01.475375 IP (tos 0x0, ttl 64, id 29242, offset 0, flags [DF], proto TCP (6), length 4036)
    127.0.0.1.10750 > 127.0.0.1.59920: Flags [P.], cksum 0x0db9 (incorrect -> 0xd2be), seq 134714:138698, ack 888, win 512, options [nop,nop,TS val 386343978 ecr 386343967], length 3984
2022-04-07 04:01:01.475391 IP (tos 0x0, ttl 64, id 21237, offset 0, flags [DF], proto TCP (6), length 52)
    127.0.0.1.59920 > 127.0.0.1.10750: Flags [.], cksum 0xfe28 (incorrect -> 0xccb9), seq 888, ack 138698, win 512, options [nop,nop,TS val 386343978 ecr 386343978], length 0
2022-04-07 04:01:01.492132 IP (tos 0x0, ttl 64, id 29243, offset 0, flags [DF], proto TCP (6), length 4036)
    127.0.0.1.10750 > 127.0.0.1.59920: Flags [P.], cksum 0x0db9 (incorrect -> 0xa847), seq 138698:142682, ack 888, win 512, options [nop,nop,TS val 386343995 ecr 386343978], length 3984
2022-04-07 04:01:01.519993 IP (tos 0x0, ttl 64, id 29244, offset 0, flags [DF], proto TCP (6), length 32820)
    127.0.0.1.10750 > 127.0.0.1.59920: Flags [.], cksum 0x7e29 (incorrect -> 0xf55f), seq 142682:175450, ack 888, win 512, options [nop,nop,TS val 386344022 ecr 386343978], length 32768
2022-04-07 04:01:01.520014 IP (tos 0x0, ttl 64, id 21238, offset 0, flags [DF], proto TCP (6), length 52)
    127.0.0.1.59920 > 127.0.0.1.10750: Flags [.], cksum 0xfe28 (incorrect -> 0x3d71), seq 888, ack 175450, win 379, options [nop,nop,TS val 386344022 ecr 386343995], length 0
2022-04-07 04:01:01.520021 IP (tos 0x0, ttl 64, id 29245, offset 0, flags [DF], proto TCP (6), length 152)
    127.0.0.1.10750 > 127.0.0.1.59920: Flags [P.], cksum 0xfe8c (incorrect -> 0x11c8), seq 175450:175550, ack 888, win 512, options [nop,nop,TS val 386344022 ecr 386344022], length 100
2022-04-07 04:01:01.520189 IP (tos 0x0, ttl 64, id 21239, offset 0, flags [DF], proto TCP (6), length 52)
    127.0.0.1.59920 > 127.0.0.1.10750: Flags [.], cksum 0xfe28 (incorrect -> 0x3c6c), seq 888, ack 175550, win 512, options [nop,nop,TS val 386344023 ecr 386344022], length 0
2022-04-07 04:01:01.522031 IP (tos 0x0, ttl 64, id 29246, offset 0, flags [DF], proto TCP (6), length 4100)
    127.0.0.1.10750 > 127.0.0.1.59920: Flags [P.], cksum 0x0df9 (incorrect -> 0xcbe4), seq 175550:179598, ack 888, win 512, options [nop,nop,TS val 386344024 ecr 386344023], length 4048
2022-04-07 04:01:01.522084 IP (tos 0x0, ttl 64, id 21240, offset 0, flags [DF], proto TCP (6), length 52)
    127.0.0.1.59920 > 127.0.0.1.10750: Flags [.], cksum 0xfe28 (incorrect -> 0x2c98), seq 888, ack 179598, win 512, options [nop,nop,TS val 386344025 ecr 386344024], length 0
2022-04-07 04:01:01.522093 IP (tos 0x0, ttl 64, id 29247, offset 0, flags [DF], proto TCP (6), length 2956)
    127.0.0.1.10750 > 127.0.0.1.59920: Flags [P.], cksum 0x0981 (incorrect -> 0xa929), seq 179598:182502, ack 888, win 512, options [nop,nop,TS val 386344025 ecr 386344025], length 2904
2022-04-07 04:01:01.522100 IP (tos 0x0, ttl 64, id 21241, offset 0, flags [DF], proto TCP (6), length 52)
    127.0.0.1.59920 > 127.0.0.1.10750: Flags [.], cksum 0xfe28 (incorrect -> 0x213f), seq 888, ack 182502, win 512, options [nop,nop,TS val 386344025 ecr 386344025], length 0
2022-04-07 04:01:01.550010 IP (tos 0x0, ttl 64, id 29248, offset 0, flags [DF], proto TCP (6), length 4100)
    127.0.0.1.10750 > 127.0.0.1.59920: Flags [P.], cksum 0x0df9 (incorrect -> 0x1365), seq 182502:186550, ack 888, win 512, options [nop,nop,TS val 386344052 ecr 386344025], length 4048
2022-04-07 04:01:01.550092 IP (tos 0x0, ttl 64, id 21242, offset 0, flags [DF], proto TCP (6), length 52)
    127.0.0.1.59920 > 127.0.0.1.10750: Flags [.], cksum 0xfe28 (incorrect -> 0x1138), seq 888, ack 186550, win 512, options [nop,nop,TS val 386344053 ecr 386344052], length 0
2022-04-07 04:01:01.550099 IP (tos 0x0, ttl 64, id 29249, offset 0, flags [DF], proto TCP (6), length 486)
    127.0.0.1.10750 > 127.0.0.1.59920: Flags [P.], cksum 0xffda (incorrect -> 0xf4c8), seq 186550:186984, ack 888, win 512, options [nop,nop,TS val 386344053 ecr 386344053], length 434
2022-04-07 04:01:01.550104 IP (tos 0x0, ttl 64, id 21243, offset 0, flags [DF], proto TCP (6), length 52)
    127.0.0.1.59920 > 127.0.0.1.10750: Flags [.], cksum 0xfe28 (incorrect -> 0x0f85), seq 888, ack 186984, win 512, options [nop,nop,TS val 386344053 ecr 386344053], length 0
2022-04-07 04:01:01.550261 IP (tos 0x0, ttl 64, id 29250, offset 0, flags [DF], proto TCP (6), length 4100)
    127.0.0.1.10750 > 127.0.0.1.59920: Flags [P.], cksum 0x0df9 (incorrect -> 0x32a2), seq 186984:191032, ack 888, win 512, options [nop,nop,TS val 386344053 ecr 386344053], length 4048
2022-04-07 04:01:01.550380 IP (tos 0x0, ttl 64, id 21244, offset 0, flags [DF], proto TCP (6), length 52)
    127.0.0.1.59920 > 127.0.0.1.10750: Flags [.], cksum 0xfe28 (incorrect -> 0xffb4), seq 888, ack 191032, win 512, options [nop,nop,TS val 386344053 ecr 386344053], length 0
2022-04-07 04:01:01.550392 IP (tos 0x0, ttl 64, id 29251, offset 0, flags [DF], proto TCP (6), length 15414)
    127.0.0.1.10750 > 127.0.0.1.59920: Flags [P.], cksum 0x3a2b (incorrect -> 0x571f), seq 191032:206394, ack 888, win 512, options [nop,nop,TS val 386344053 ecr 386344053], length 15362
2022-04-07 04:01:01.550451 IP (tos 0x0, ttl 64, id 21245, offset 0, flags [DF], proto TCP (6), length 52)
    127.0.0.1.59920 > 127.0.0.1.10750: Flags [.], cksum 0xfe28 (incorrect -> 0xc3b2), seq 888, ack 206394, win 512, options [nop,nop,TS val 386344053 ecr 386344053], length 0
2022-04-07 04:01:01.556985 IP (tos 0x0, ttl 64, id 29252, offset 0, flags [DF], proto TCP (6), length 1048)
    127.0.0.1.10750 > 127.0.0.1.59920: Flags [P.], cksum 0x020d (incorrect -> 0x2133), seq 206394:207390, ack 888, win 512, options [nop,nop,TS val 386344059 ecr 386344053], length 996
2022-04-07 04:01:01.557000 IP (tos 0x0, ttl 64, id 21246, offset 0, flags [DF], proto TCP (6), length 52)
    127.0.0.1.59920 > 127.0.0.1.10750: Flags [.], cksum 0xfe28 (incorrect -> 0xbfc2), seq 888, ack 207390, win 512, options [nop,nop,TS val 386344059 ecr 386344059], length 0
2022-04-07 04:01:01.567790 IP (tos 0x0, ttl 64, id 29253, offset 0, flags [DF], proto TCP (6), length 3538)
    127.0.0.1.10750 > 127.0.0.1.59920: Flags [P.], cksum 0x0bc7 (incorrect -> 0x5853), seq 207390:210876, ack 888, win 512, options [nop,nop,TS val 386344070 ecr 386344059], length 3486
2022-04-07 04:01:01.567809 IP (tos 0x0, ttl 64, id 21247, offset 0, flags [DF], proto TCP (6), length 52)
    127.0.0.1.59920 > 127.0.0.1.10750: Flags [.], cksum 0xfe28 (incorrect -> 0xb20e), seq 888, ack 210876, win 512, options [nop,nop,TS val 386344070 ecr 386344070], length 0
2022-04-07 04:01:01.578999 IP (tos 0x0, ttl 64, id 29254, offset 0, flags [DF], proto TCP (6), length 4036)
    127.0.0.1.10750 > 127.0.0.1.59920: Flags [P.], cksum 0x0db9 (incorrect -> 0x3f14), seq 210876:214860, ack 888, win 512, options [nop,nop,TS val 386344081 ecr 386344070], length 3984
2022-04-07 04:01:01.579053 IP (tos 0x0, ttl 64, id 21248, offset 0, flags [DF], proto TCP (6), length 52)
    127.0.0.1.59920 > 127.0.0.1.10750: Flags [.], cksum 0xfe28 (incorrect -> 0xa268), seq 888, ack 214860, win 512, options [nop,nop,TS val 386344081 ecr 386344081], length 0
2022-04-07 04:01:01.579064 IP (tos 0x0, ttl 64, id 29255, offset 0, flags [DF], proto TCP (6), length 3518)
    127.0.0.1.10750 > 127.0.0.1.59920: Flags [P.], cksum 0x0bb3 (incorrect -> 0x205c), seq 214860:218326, ack 888, win 512, options [nop,nop,TS val 386344082 ecr 386344081], length 3466
2022-04-07 04:01:01.579143 IP (tos 0x0, ttl 64, id 21249, offset 0, flags [DF], proto TCP (6), length 52)
    127.0.0.1.59920 > 127.0.0.1.10750: Flags [.], cksum 0xfe28 (incorrect -> 0x94dc), seq 888, ack 218326, win 512, options [nop,nop,TS val 386344082 ecr 386344082], length 0
2022-04-07 04:01:01.579226 IP (tos 0x0, ttl 64, id 29256, offset 0, flags [DF], proto TCP (6), length 4100)
    127.0.0.1.10750 > 127.0.0.1.59920: Flags [P.], cksum 0x0df9 (incorrect -> 0xfb33), seq 218326:222374, ack 888, win 512, options [nop,nop,TS val 386344082 ecr 386344082], length 4048
2022-04-07 04:01:01.579307 IP (tos 0x0, ttl 64, id 21250, offset 0, flags [DF], proto TCP (6), length 52)
    127.0.0.1.59920 > 127.0.0.1.10750: Flags [.], cksum 0xfe28 (incorrect -> 0x850c), seq 888, ack 222374, win 512, options [nop,nop,TS val 386344082 ecr 386344082], length 0
200, 4.087646484375, 1.3608336448669434