2022-04-07 01:37:58.663252 IP (tos 0x0, ttl 64, id 834, offset 0, flags [DF], proto TCP (6), length 60)
    127.0.0.1.55090 > 127.0.0.1.11750: Flags [S], cksum 0xfe30 (incorrect -> 0x07e7), seq 1586405473, win 65495, options [mss 65495,sackOK,TS val 377761166 ecr 0,nop,wscale 7], length 0
2022-04-07 01:37:58.663263 IP (tos 0x0, ttl 64, id 0, offset 0, flags [DF], proto TCP (6), length 60)
    127.0.0.1.11750 > 127.0.0.1.55090: Flags [S.], cksum 0xfe30 (incorrect -> 0x69b3), seq 3169819948, ack 1586405474, win 65483, options [mss 65495,sackOK,TS val 377761166 ecr 377761166,nop,wscale 7], length 0
2022-04-07 01:37:58.663272 IP (tos 0x0, ttl 64, id 835, offset 0, flags [DF], proto TCP (6), length 52)
    127.0.0.1.55090 > 127.0.0.1.11750: Flags [.], cksum 0xfe28 (incorrect -> 0x906f), seq 1, ack 1, win 512, options [nop,nop,TS val 377761166 ecr 377761166], length 0
2022-04-07 01:37:58.663432 IP (tos 0x0, ttl 64, id 836, offset 0, flags [DF], proto TCP (6), length 55)
    127.0.0.1.55090 > 127.0.0.1.11750: Flags [P.], cksum 0xfe2b (incorrect -> 0x8b63), seq 1:4, ack 1, win 512, options [nop,nop,TS val 377761166 ecr 377761166], length 3
2022-04-07 01:37:58.663440 IP (tos 0x0, ttl 64, id 21582, offset 0, flags [DF], proto TCP (6), length 52)
    127.0.0.1.11750 > 127.0.0.1.55090: Flags [.], cksum 0xfe28 (incorrect -> 0x906c), seq 1, ack 4, win 512, options [nop,nop,TS val 377761166 ecr 377761166], length 0
2022-04-07 01:37:58.663470 IP (tos 0x0, ttl 64, id 21583, offset 0, flags [DF], proto TCP (6), length 54)
    127.0.0.1.11750 > 127.0.0.1.55090: Flags [P.], cksum 0xfe2a (incorrect -> 0x8b62), seq 1:3, ack 4, win 512, options [nop,nop,TS val 377761166 ecr 377761166], length 2
2022-04-07 01:37:58.663480 IP (tos 0x0, ttl 64, id 837, offset 0, flags [DF], proto TCP (6), length 52)
    127.0.0.1.55090 > 127.0.0.1.11750: Flags [.], cksum 0xfe28 (incorrect -> 0x906a), seq 4, ack 3, win 512, options [nop,nop,TS val 377761166 ecr 377761166], length 0
2022-04-07 01:37:58.675219 IP (tos 0x0, ttl 64, id 838, offset 0, flags [DF], proto TCP (6), length 62)
    127.0.0.1.55090 > 127.0.0.1.11750: Flags [P.], cksum 0xfe32 (incorrect -> 0xbbc5), seq 4:14, ack 3, win 512, options [nop,nop,TS val 377761178 ecr 377761166], length 10
2022-04-07 01:37:58.675244 IP (tos 0x0, ttl 64, id 21584, offset 0, flags [DF], proto TCP (6), length 52)
    127.0.0.1.11750 > 127.0.0.1.55090: Flags [.], cksum 0xfe28 (incorrect -> 0x9048), seq 3, ack 14, win 512, options [nop,nop,TS val 377761178 ecr 377761178], length 0
2022-04-07 01:37:58.940896 IP (tos 0x0, ttl 64, id 21585, offset 0, flags [DF], proto TCP (6), length 62)
    127.0.0.1.11750 > 127.0.0.1.55090: Flags [P.], cksum 0xfe32 (incorrect -> 0x8a2c), seq 3:13, ack 14, win 512, options [nop,nop,TS val 377761443 ecr 377761178], length 10
2022-04-07 01:37:58.940911 IP (tos 0x0, ttl 64, id 839, offset 0, flags [DF], proto TCP (6), length 52)
    127.0.0.1.55090 > 127.0.0.1.11750: Flags [.], cksum 0xfe28 (incorrect -> 0x8e2c), seq 14, ack 13, win 512, options [nop,nop,TS val 377761443 ecr 377761443], length 0
2022-04-07 01:37:58.947765 IP (tos 0x0, ttl 64, id 840, offset 0, flags [DF], proto TCP (6), length 569)
    127.0.0.1.55090 > 127.0.0.1.11750: Flags [P.], cksum 0x002e (incorrect -> 0xfa49), seq 14:531, ack 13, win 512, options [nop,nop,TS val 377761450 ecr 377761443], length 517
2022-04-07 01:37:58.947776 IP (tos 0x0, ttl 64, id 21586, offset 0, flags [DF], proto TCP (6), length 52)
    127.0.0.1.11750 > 127.0.0.1.55090: Flags [.], cksum 0xfe28 (incorrect -> 0x8c1d), seq 13, ack 531, win 508, options [nop,nop,TS val 377761450 ecr 377761450], length 0
2022-04-07 01:37:59.218921 IP (tos 0x0, ttl 64, id 21587, offset 0, flags [DF], proto TCP (6), length 3538)
    127.0.0.1.11750 > 127.0.0.1.55090: Flags [P.], cksum 0x0bc7 (incorrect -> 0x7ae0), seq 13:3499, ack 531, win 512, options [nop,nop,TS val 377761721 ecr 377761450], length 3486
2022-04-07 01:37:59.218931 IP (tos 0x0, ttl 64, id 841, offset 0, flags [DF], proto TCP (6), length 52)
    127.0.0.1.55090 > 127.0.0.1.11750: Flags [.], cksum 0xfe28 (incorrect -> 0x7c6f), seq 531, ack 3499, win 494, options [nop,nop,TS val 377761721 ecr 377761721], length 0
2022-04-07 01:37:59.327990 IP (tos 0x0, ttl 64, id 21588, offset 0, flags [DF], proto TCP (6), length 811)
    127.0.0.1.11750 > 127.0.0.1.55090: Flags [P.], cksum 0x0120 (incorrect -> 0xa94a), seq 3499:4258, ack 531, win 512, options [nop,nop,TS val 377761830 ecr 377761721], length 759
2022-04-07 01:37:59.327999 IP (tos 0x0, ttl 64, id 842, offset 0, flags [DF], proto TCP (6), length 52)
    127.0.0.1.55090 > 127.0.0.1.11750: Flags [.], cksum 0xfe28 (incorrect -> 0x7893), seq 531, ack 4258, win 505, options [nop,nop,TS val 377761830 ecr 377761830], length 0
2022-04-07 01:37:59.328509 IP (tos 0x0, ttl 64, id 843, offset 0, flags [DF], proto TCP (6), length 132)
    127.0.0.1.55090 > 127.0.0.1.11750: Flags [P.], cksum 0xfe78 (incorrect -> 0x0ac8), seq 531:611, ack 4258, win 512, options [nop,nop,TS val 377761831 ecr 377761830], length 80
2022-04-07 01:37:59.328519 IP (tos 0x0, ttl 64, id 21589, offset 0, flags [DF], proto TCP (6), length 52)
    127.0.0.1.11750 > 127.0.0.1.55090: Flags [.], cksum 0xfe28 (incorrect -> 0x783a), seq 4258, ack 611, win 512, options [nop,nop,TS val 377761831 ecr 377761831], length 0
2022-04-07 01:37:59.328985 IP (tos 0x0, ttl 64, id 844, offset 0, flags [DF], proto TCP (6), length 296)
    127.0.0.1.55090 > 127.0.0.1.11750: Flags [P.], cksum 0xff1c (incorrect -> 0xf507), seq 611:855, ack 4258, win 512, options [nop,nop,TS val 377761831 ecr 377761831], length 244
2022-04-07 01:37:59.328995 IP (tos 0x0, ttl 64, id 21590, offset 0, flags [DF], proto TCP (6), length 52)
    127.0.0.1.11750 > 127.0.0.1.55090: Flags [.], cksum 0xfe28 (incorrect -> 0x7747), seq 4258, ack 855, win 511, options [nop,nop,TS val 377761831 ecr 377761831], length 0
2022-04-07 01:37:59.643169 IP (tos 0x0, ttl 64, id 21591, offset 0, flags [DF], proto TCP (6), length 594)
    127.0.0.1.11750 > 127.0.0.1.55090: Flags [P.], cksum 0x0047 (incorrect -> 0x0060), seq 4258:4800, ack 855, win 512, options [nop,nop,TS val 377762146 ecr 377761831], length 542
2022-04-07 01:37:59.643180 IP (tos 0x0, ttl 64, id 845, offset 0, flags [DF], proto TCP (6), length 52)
    127.0.0.1.55090 > 127.0.0.1.11750: Flags [.], cksum 0xfe28 (incorrect -> 0x72b6), seq 855, ack 4800, win 508, options [nop,nop,TS val 377762146 ecr 377762146], length 0
2022-04-07 01:37:59.714396 IP (tos 0x0, ttl 64, id 21592, offset 0, flags [DF], proto TCP (6), length 314)
    127.0.0.1.11750 > 127.0.0.1.55090: Flags [P.], cksum 0xff2e (incorrect -> 0x0436), seq 4800:5062, ack 855, win 512, options [nop,nop,TS val 377762217 ecr 377762146], length 262
2022-04-07 01:37:59.714403 IP (tos 0x0, ttl 64, id 846, offset 0, flags [DF], proto TCP (6), length 52)
    127.0.0.1.55090 > 127.0.0.1.11750: Flags [.], cksum 0xfe28 (incorrect -> 0x7124), seq 855, ack 5062, win 506, options [nop,nop,TS val 377762217 ecr 377762217], length 0
2022-04-07 01:37:59.716618 IP (tos 0x0, ttl 64, id 847, offset 0, flags [DF], proto TCP (6), length 302)
    127.0.0.1.55090 > 127.0.0.1.11750: Flags [P.], cksum 0xff22 (incorrect -> 0x57e1), seq 855:1105, ack 5062, win 512, options [nop,nop,TS val 377762219 ecr 377762217], length 250
2022-04-07 01:37:59.716629 IP (tos 0x0, ttl 64, id 21593, offset 0, flags [DF], proto TCP (6), length 52)
    127.0.0.1.11750 > 127.0.0.1.55090: Flags [.], cksum 0xfe28 (incorrect -> 0x7021), seq 5062, ack 1105, win 511, options [nop,nop,TS val 377762219 ecr 377762219], length 0
200, 4.978943109512329, 1.7499544620513916