2022-04-07 17:12:22.413954 IP (tos 0x0, ttl 64, id 52678, offset 0, flags [DF], proto TCP (6), length 60)
    127.0.0.1.53388 > 127.0.0.1.10550: Flags [S], cksum 0xfe30 (incorrect -> 0xeb8c), seq 2992439859, win 65495, options [mss 65495,sackOK,TS val 3507741965 ecr 0,nop,wscale 7], length 0
2022-04-07 17:12:22.413965 IP (tos 0x0, ttl 64, id 0, offset 0, flags [DF], proto TCP (6), length 60)
    127.0.0.1.10550 > 127.0.0.1.53388: Flags [S.], cksum 0xfe30 (incorrect -> 0xaeea), seq 2289368582, ack 2992439860, win 65483, options [mss 65495,sackOK,TS val 3507741965 ecr 3507741965,nop,wscale 7], length 0
2022-04-07 17:12:22.413974 IP (tos 0x0, ttl 64, id 52679, offset 0, flags [DF], proto TCP (6), length 52)
    127.0.0.1.53388 > 127.0.0.1.10550: Flags [.], cksum 0xfe28 (incorrect -> 0xd5a6), seq 1, ack 1, win 512, options [nop,nop,TS val 3507741965 ecr 3507741965], length 0
2022-04-07 17:12:22.414076 IP (tos 0x0, ttl 64, id 52680, offset 0, flags [DF], proto TCP (6), length 55)
    127.0.0.1.53388 > 127.0.0.1.10550: Flags [P.], cksum 0xfe2b (incorrect -> 0xd09a), seq 1:4, ack 1, win 512, options [nop,nop,TS val 3507741965 ecr 3507741965], length 3
2022-04-07 17:12:22.414089 IP (tos 0x0, ttl 64, id 19002, offset 0, flags [DF], proto TCP (6), length 52)
    127.0.0.1.10550 > 127.0.0.1.53388: Flags [.], cksum 0xfe28 (incorrect -> 0xd5a3), seq 1, ack 4, win 512, options [nop,nop,TS val 3507741965 ecr 3507741965], length 0
2022-04-07 17:12:22.414148 IP (tos 0x0, ttl 64, id 19003, offset 0, flags [DF], proto TCP (6), length 54)
    127.0.0.1.10550 > 127.0.0.1.53388: Flags [P.], cksum 0xfe2a (incorrect -> 0xd099), seq 1:3, ack 4, win 512, options [nop,nop,TS val 3507741965 ecr 3507741965], length 2
2022-04-07 17:12:22.414164 IP (tos 0x0, ttl 64, id 52681, offset 0, flags [DF], proto TCP (6), length 52)
    127.0.0.1.53388 > 127.0.0.1.10550: Flags [.], cksum 0xfe28 (incorrect -> 0xd5a1), seq 4, ack 3, win 512, options [nop,nop,TS val 3507741965 ecr 3507741965], length 0
2022-04-07 17:12:22.426919 IP (tos 0x0, ttl 64, id 52682, offset 0, flags [DF], proto TCP (6), length 62)
    127.0.0.1.53388 > 127.0.0.1.10550: Flags [P.], cksum 0xfe32 (incorrect -> 0x3200), seq 4:14, ack 3, win 512, options [nop,nop,TS val 3507741978 ecr 3507741965], length 10
2022-04-07 17:12:22.426933 IP (tos 0x0, ttl 64, id 19004, offset 0, flags [DF], proto TCP (6), length 52)
    127.0.0.1.10550 > 127.0.0.1.53388: Flags [.], cksum 0xfe28 (incorrect -> 0xd57d), seq 3, ack 14, win 512, options [nop,nop,TS val 3507741978 ecr 3507741978], length 0
2022-04-07 17:12:22.472875 IP (tos 0x0, ttl 64, id 19005, offset 0, flags [DF], proto TCP (6), length 62)
    127.0.0.1.10550 > 127.0.0.1.53388: Flags [P.], cksum 0xfe32 (incorrect -> 0xd03c), seq 3:13, ack 14, win 512, options [nop,nop,TS val 3507742024 ecr 3507741978], length 10
2022-04-07 17:12:22.472886 IP (tos 0x0, ttl 64, id 52683, offset 0, flags [DF], proto TCP (6), length 52)
    127.0.0.1.53388 > 127.0.0.1.10550: Flags [.], cksum 0xfe28 (incorrect -> 0xd517), seq 14, ack 13, win 512, options [nop,nop,TS val 3507742024 ecr 3507742024], length 0
2022-04-07 17:12:22.478496 IP (tos 0x0, ttl 64, id 52684, offset 0, flags [DF], proto TCP (6), length 569)
    127.0.0.1.53388 > 127.0.0.1.10550: Flags [P.], cksum 0x002e (incorrect -> 0x29a4), seq 14:531, ack 13, win 512, options [nop,nop,TS val 3507742030 ecr 3507742024], length 517
2022-04-07 17:12:22.478506 IP (tos 0x0, ttl 64, id 19006, offset 0, flags [DF], proto TCP (6), length 52)
    127.0.0.1.10550 > 127.0.0.1.53388: Flags [.], cksum 0xfe28 (incorrect -> 0xd30a), seq 13, ack 531, win 508, options [nop,nop,TS val 3507742030 ecr 3507742030], length 0
2022-04-07 17:12:22.515390 IP (tos 0x0, ttl 64, id 19007, offset 0, flags [DF], proto TCP (6), length 3492)
    127.0.0.1.10550 > 127.0.0.1.53388: Flags [P.], cksum 0x0b99 (incorrect -> 0x9895), seq 13:3453, ack 531, win 512, options [nop,nop,TS val 3507742067 ecr 3507742030], length 3440
2022-04-07 17:12:22.515407 IP (tos 0x0, ttl 64, id 52685, offset 0, flags [DF], proto TCP (6), length 52)
    127.0.0.1.53388 > 127.0.0.1.10550: Flags [.], cksum 0xfe28 (incorrect -> 0xc55e), seq 531, ack 3453, win 494, options [nop,nop,TS val 3507742067 ecr 3507742067], length 0
2022-04-07 17:12:22.529059 IP (tos 0x0, ttl 64, id 19008, offset 0, flags [DF], proto TCP (6), length 587)
    127.0.0.1.10550 > 127.0.0.1.53388: Flags [P.], cksum 0x0040 (incorrect -> 0x91a3), seq 3453:3988, ack 531, win 512, options [nop,nop,TS val 3507742080 ecr 3507742067], length 535
2022-04-07 17:12:22.529073 IP (tos 0x0, ttl 64, id 52686, offset 0, flags [DF], proto TCP (6), length 52)
    127.0.0.1.53388 > 127.0.0.1.10550: Flags [.], cksum 0xfe28 (incorrect -> 0xc322), seq 531, ack 3988, win 505, options [nop,nop,TS val 3507742080 ecr 3507742080], length 0
2022-04-07 17:12:22.529727 IP (tos 0x0, ttl 64, id 52687, offset 0, flags [DF], proto TCP (6), length 132)
    127.0.0.1.53388 > 127.0.0.1.10550: Flags [P.], cksum 0xfe78 (incorrect -> 0x722c), seq 531:611, ack 3988, win 512, options [nop,nop,TS val 3507742081 ecr 3507742080], length 80
2022-04-07 17:12:22.529743 IP (tos 0x0, ttl 64, id 19009, offset 0, flags [DF], proto TCP (6), length 52)
    127.0.0.1.10550 > 127.0.0.1.53388: Flags [.], cksum 0xfe28 (incorrect -> 0xc2c9), seq 3988, ack 611, win 512, options [nop,nop,TS val 3507742081 ecr 3507742081], length 0
2022-04-07 17:12:22.530168 IP (tos 0x0, ttl 64, id 52688, offset 0, flags [DF], proto TCP (6), length 338)
    127.0.0.1.53388 > 127.0.0.1.10550: Flags [P.], cksum 0xff46 (incorrect -> 0x1380), seq 611:897, ack 3988, win 512, options [nop,nop,TS val 3507742081 ecr 3507742081], length 286
2022-04-07 17:12:22.530177 IP (tos 0x0, ttl 64, id 19010, offset 0, flags [DF], proto TCP (6), length 52)
    127.0.0.1.10550 > 127.0.0.1.53388: Flags [.], cksum 0xfe28 (incorrect -> 0xc1ad), seq 3988, ack 897, win 510, options [nop,nop,TS val 3507742081 ecr 3507742081], length 0
2022-04-07 17:12:22.580322 IP (tos 0x0, ttl 64, id 19011, offset 0, flags [DF], proto TCP (6), length 594)
    127.0.0.1.10550 > 127.0.0.1.53388: Flags [P.], cksum 0x0047 (incorrect -> 0x0e83), seq 3988:4530, ack 897, win 512, options [nop,nop,TS val 3507742132 ecr 3507742081], length 542
2022-04-07 17:12:22.580333 IP (tos 0x0, ttl 64, id 52689, offset 0, flags [DF], proto TCP (6), length 52)
    127.0.0.1.53388 > 127.0.0.1.10550: Flags [.], cksum 0xfe28 (incorrect -> 0xbf2b), seq 897, ack 4530, win 508, options [nop,nop,TS val 3507742132 ecr 3507742132], length 0
2022-04-07 17:12:22.624582 IP (tos 0x0, ttl 64, id 19012, offset 0, flags [DF], proto TCP (6), length 3538)
    127.0.0.1.10550 > 127.0.0.1.53388: Flags [P.], cksum 0x0bc7 (incorrect -> 0x1ff8), seq 4530:8016, ack 897, win 512, options [nop,nop,TS val 3507742176 ecr 3507742132], length 3486
2022-04-07 17:12:22.624591 IP (tos 0x0, ttl 64, id 52690, offset 0, flags [DF], proto TCP (6), length 52)
    127.0.0.1.53388 > 127.0.0.1.10550: Flags [.], cksum 0xfe28 (incorrect -> 0xb143), seq 897, ack 8016, win 494, options [nop,nop,TS val 3507742176 ecr 3507742176], length 0
2022-04-07 17:12:22.624761 IP (tos 0x0, ttl 64, id 19013, offset 0, flags [DF], proto TCP (6), length 4100)
    127.0.0.1.10550 > 127.0.0.1.53388: Flags [P.], cksum 0x0df9 (incorrect -> 0x7214), seq 8016:12064, ack 897, win 512, options [nop,nop,TS val 3507742176 ecr 3507742176], length 4048
2022-04-07 17:12:22.624769 IP (tos 0x0, ttl 64, id 52691, offset 0, flags [DF], proto TCP (6), length 52)
    127.0.0.1.53388 > 127.0.0.1.10550: Flags [.], cksum 0xfe28 (incorrect -> 0xa175), seq 897, ack 12064, win 492, options [nop,nop,TS val 3507742176 ecr 3507742176], length 0
2022-04-07 17:12:22.624776 IP (tos 0x0, ttl 64, id 19014, offset 0, flags [DF], proto TCP (6), length 984)
    127.0.0.1.10550 > 127.0.0.1.53388: Flags [P.], cksum 0x01cd (incorrect -> 0x3b49), seq 12064:12996, ack 897, win 512, options [nop,nop,TS val 3507742176 ecr 3507742176], length 932
2022-04-07 17:12:22.624781 IP (tos 0x0, ttl 64, id 52692, offset 0, flags [DF], proto TCP (6), length 52)
    127.0.0.1.53388 > 127.0.0.1.10550: Flags [.], cksum 0xfe28 (incorrect -> 0x9dd5), seq 897, ack 12996, win 488, options [nop,nop,TS val 3507742176 ecr 3507742176], length 0
2022-04-07 17:12:22.627519 IP (tos 0x0, ttl 64, id 19015, offset 0, flags [DF], proto TCP (6), length 2266)
    127.0.0.1.10550 > 127.0.0.1.53388: Flags [P.], cksum 0x06cf (incorrect -> 0x1356), seq 12996:15210, ack 897, win 512, options [nop,nop,TS val 3507742179 ecr 3507742176], length 2214
2022-04-07 17:12:22.627526 IP (tos 0x0, ttl 64, id 52693, offset 0, flags [DF], proto TCP (6), length 52)
    127.0.0.1.53388 > 127.0.0.1.10550: Flags [.], cksum 0xfe28 (incorrect -> 0x951e), seq 897, ack 15210, win 499, options [nop,nop,TS val 3507742179 ecr 3507742179], length 0
2022-04-07 17:12:22.638248 IP (tos 0x0, ttl 64, id 19016, offset 0, flags [DF], proto TCP (6), length 4100)
    127.0.0.1.10550 > 127.0.0.1.53388: Flags [P.], cksum 0x0df9 (incorrect -> 0xa1eb), seq 15210:19258, ack 897, win 512, options [nop,nop,TS val 3507742190 ecr 3507742179], length 4048
2022-04-07 17:12:22.638255 IP (tos 0x0, ttl 64, id 52694, offset 0, flags [DF], proto TCP (6), length 52)
    127.0.0.1.53388 > 127.0.0.1.10550: Flags [.], cksum 0xfe28 (incorrect -> 0x853f), seq 897, ack 19258, win 492, options [nop,nop,TS val 3507742190 ecr 3507742190], length 0
2022-04-07 17:12:22.638262 IP (tos 0x0, ttl 64, id 19017, offset 0, flags [DF], proto TCP (6), length 3198)
    127.0.0.1.10550 > 127.0.0.1.53388: Flags [P.], cksum 0x0a73 (incorrect -> 0x4cc1), seq 19258:22404, ack 897, win 512, options [nop,nop,TS val 3507742190 ecr 3507742190], length 3146
2022-04-07 17:12:22.638267 IP (tos 0x0, ttl 64, id 52695, offset 0, flags [DF], proto TCP (6), length 52)
    127.0.0.1.53388 > 127.0.0.1.10550: Flags [.], cksum 0xfe28 (incorrect -> 0x7902), seq 897, ack 22404, win 479, options [nop,nop,TS val 3507742190 ecr 3507742190], length 0
2022-04-07 17:12:22.638322 IP (tos 0x0, ttl 64, id 19018, offset 0, flags [DF], proto TCP (6), length 1500)
    127.0.0.1.10550 > 127.0.0.1.53388: Flags [P.], cksum 0x03d1 (incorrect -> 0x7c2e), seq 22404:23852, ack 897, win 512, options [nop,nop,TS val 3507742190 ecr 3507742190], length 1448
2022-04-07 17:12:22.638327 IP (tos 0x0, ttl 64, id 52696, offset 0, flags [DF], proto TCP (6), length 52)
    127.0.0.1.53388 > 127.0.0.1.10550: Flags [.], cksum 0xfe28 (incorrect -> 0x735f), seq 897, ack 23852, win 474, options [nop,nop,TS val 3507742190 ecr 3507742190], length 0
2022-04-07 17:12:22.638396 IP (tos 0x0, ttl 64, id 19019, offset 0, flags [DF], proto TCP (6), length 3446)
    127.0.0.1.10550 > 127.0.0.1.53388: Flags [P.], cksum 0x0b6b (incorrect -> 0xf494), seq 23852:27246, ack 897, win 512, options [nop,nop,TS val 3507742190 ecr 3507742190], length 3394
2022-04-07 17:12:22.639647 IP (tos 0x0, ttl 64, id 52697, offset 0, flags [DF], proto TCP (6), length 52)
    127.0.0.1.53388 > 127.0.0.1.10550: Flags [.], cksum 0xfe28 (incorrect -> 0x65f6), seq 897, ack 27246, win 512, options [nop,nop,TS val 3507742191 ecr 3507742190], length 0
2022-04-07 17:12:22.639656 IP (tos 0x0, ttl 64, id 19020, offset 0, flags [DF], proto TCP (6), length 7292)
    127.0.0.1.10550 > 127.0.0.1.53388: Flags [P.], cksum 0x1a71 (incorrect -> 0x8241), seq 27246:34486, ack 897, win 512, options [nop,nop,TS val 3507742191 ecr 3507742191], length 7240
2022-04-07 17:12:22.653037 IP (tos 0x0, ttl 64, id 19021, offset 0, flags [DF], proto TCP (6), length 32820)
    127.0.0.1.10550 > 127.0.0.1.53388: Flags [.], cksum 0x7e29 (incorrect -> 0xef7e), seq 34486:67254, ack 897, win 512, options [nop,nop,TS val 3507742204 ecr 3507742191], length 32768
2022-04-07 17:12:22.653095 IP (tos 0x0, ttl 64, id 52698, offset 0, flags [DF], proto TCP (6), length 52)
    127.0.0.1.53388 > 127.0.0.1.10550: Flags [.], cksum 0xfe28 (incorrect -> 0xca24), seq 897, ack 67254, win 379, options [nop,nop,TS val 3507742204 ecr 3507742191], length 0
2022-04-07 17:12:22.653103 IP (tos 0x0, ttl 64, id 19022, offset 0, flags [DF], proto TCP (6), length 7330)
    127.0.0.1.10550 > 127.0.0.1.53388: Flags [P.], cksum 0x1a97 (incorrect -> 0xd3bf), seq 67254:74532, ack 897, win 512, options [nop,nop,TS val 3507742204 ecr 3507742204], length 7278
2022-04-07 17:12:22.654363 IP (tos 0x0, ttl 64, id 52699, offset 0, flags [DF], proto TCP (6), length 52)
    127.0.0.1.53388 > 127.0.0.1.10550: Flags [.], cksum 0xfe28 (incorrect -> 0xad22), seq 897, ack 74532, win 512, options [nop,nop,TS val 3507742206 ecr 3507742204], length 0
2022-04-07 17:12:22.654416 IP (tos 0x0, ttl 64, id 19023, offset 0, flags [DF], proto TCP (6), length 3040)
    127.0.0.1.10550 > 127.0.0.1.53388: Flags [P.], cksum 0x09d5 (incorrect -> 0x68bf), seq 74532:77520, ack 897, win 512, options [nop,nop,TS val 3507742206 ecr 3507742206], length 2988
2022-04-07 17:12:22.654439 IP (tos 0x0, ttl 64, id 52700, offset 0, flags [DF], proto TCP (6), length 52)
    127.0.0.1.53388 > 127.0.0.1.10550: Flags [.], cksum 0xfe28 (incorrect -> 0xa174), seq 897, ack 77520, win 512, options [nop,nop,TS val 3507742206 ecr 3507742206], length 0
2022-04-07 17:12:22.654896 IP (tos 0x0, ttl 64, id 19024, offset 0, flags [DF], proto TCP (6), length 3354)
    127.0.0.1.10550 > 127.0.0.1.53388: Flags [P.], cksum 0x0b0f (incorrect -> 0x8ccf), seq 77520:80822, ack 897, win 512, options [nop,nop,TS val 3507742206 ecr 3507742206], length 3302
2022-04-07 17:12:22.654933 IP (tos 0x0, ttl 64, id 52701, offset 0, flags [DF], proto TCP (6), length 52)
    127.0.0.1.53388 > 127.0.0.1.10550: Flags [.], cksum 0xfe28 (incorrect -> 0x948e), seq 897, ack 80822, win 512, options [nop,nop,TS val 3507742206 ecr 3507742206], length 0
2022-04-07 17:12:22.654940 IP (tos 0x0, ttl 64, id 19025, offset 0, flags [DF], proto TCP (6), length 4036)
    127.0.0.1.10550 > 127.0.0.1.53388: Flags [P.], cksum 0x0db9 (incorrect -> 0xe380), seq 80822:84806, ack 897, win 512, options [nop,nop,TS val 3507742206 ecr 3507742206], length 3984
2022-04-07 17:12:22.655309 IP (tos 0x0, ttl 64, id 52702, offset 0, flags [DF], proto TCP (6), length 52)
    127.0.0.1.53388 > 127.0.0.1.10550: Flags [.], cksum 0xfe28 (incorrect -> 0x84fd), seq 897, ack 84806, win 512, options [nop,nop,TS val 3507742207 ecr 3507742206], length 0
2022-04-07 17:12:22.655316 IP (tos 0x0, ttl 64, id 19026, offset 0, flags [DF], proto TCP (6), length 4036)
    127.0.0.1.10550 > 127.0.0.1.53388: Flags [P.], cksum 0x0db9 (incorrect -> 0x713f), seq 84806:88790, ack 897, win 512, options [nop,nop,TS val 3507742207 ecr 3507742207], length 3984
2022-04-07 17:12:22.666178 IP (tos 0x0, ttl 64, id 19027, offset 0, flags [DF], proto TCP (6), length 32820)
    127.0.0.1.10550 > 127.0.0.1.53388: Flags [.], cksum 0x7e29 (incorrect -> 0x2dfe), seq 88790:121558, ack 897, win 512, options [nop,nop,TS val 3507742217 ecr 3507742207], length 32768
2022-04-07 17:12:22.666218 IP (tos 0x0, ttl 64, id 52703, offset 0, flags [DF], proto TCP (6), length 52)
    127.0.0.1.53388 > 127.0.0.1.10550: Flags [.], cksum 0xfe28 (incorrect -> 0xf561), seq 897, ack 121558, win 512, options [nop,nop,TS val 3507742217 ecr 3507742207], length 0
2022-04-07 17:12:22.666225 IP (tos 0x0, ttl 64, id 19028, offset 0, flags [DF], proto TCP (6), length 4702)
    127.0.0.1.10550 > 127.0.0.1.53388: Flags [P.], cksum 0x1053 (incorrect -> 0xb34b), seq 121558:126208, ack 897, win 512, options [nop,nop,TS val 3507742218 ecr 3507742217], length 4650
2022-04-07 17:12:22.666230 IP (tos 0x0, ttl 64, id 52704, offset 0, flags [DF], proto TCP (6), length 52)
    127.0.0.1.53388 > 127.0.0.1.10550: Flags [.], cksum 0xfe28 (incorrect -> 0xdf2c), seq 897, ack 126208, win 1535, options [nop,nop,TS val 3507742218 ecr 3507742218], length 0
200, 2.7068567276000977, 0.2722806930541992