2022-04-07 20:36:36.430661 IP (tos 0x0, ttl 64, id 15077, offset 0, flags [DF], proto TCP (6), length 60)
    127.0.0.1.48198 > 127.0.0.1.10050: Flags [S], cksum 0xfe30 (incorrect -> 0x28df), seq 175605509, win 65495, options [mss 65495,sackOK,TS val 3519995982 ecr 0,nop,wscale 7], length 0
2022-04-07 20:36:36.430671 IP (tos 0x0, ttl 64, id 0, offset 0, flags [DF], proto TCP (6), length 60)
    127.0.0.1.10050 > 127.0.0.1.48198: Flags [S.], cksum 0xfe30 (incorrect -> 0xe86a), seq 421754158, ack 175605510, win 65483, options [mss 65495,sackOK,TS val 3519995982 ecr 3519995982,nop,wscale 7], length 0
2022-04-07 20:36:36.430679 IP (tos 0x0, ttl 64, id 15078, offset 0, flags [DF], proto TCP (6), length 52)
    127.0.0.1.48198 > 127.0.0.1.10050: Flags [.], cksum 0xfe28 (incorrect -> 0x0f27), seq 1, ack 1, win 512, options [nop,nop,TS val 3519995982 ecr 3519995982], length 0
2022-04-07 20:36:36.430794 IP (tos 0x0, ttl 64, id 15079, offset 0, flags [DF], proto TCP (6), length 55)
    127.0.0.1.48198 > 127.0.0.1.10050: Flags [P.], cksum 0xfe2b (incorrect -> 0x0a1b), seq 1:4, ack 1, win 512, options [nop,nop,TS val 3519995982 ecr 3519995982], length 3
2022-04-07 20:36:36.430804 IP (tos 0x0, ttl 64, id 3526, offset 0, flags [DF], proto TCP (6), length 52)
    127.0.0.1.10050 > 127.0.0.1.48198: Flags [.], cksum 0xfe28 (incorrect -> 0x0f24), seq 1, ack 4, win 512, options [nop,nop,TS val 3519995982 ecr 3519995982], length 0
2022-04-07 20:36:36.431826 IP (tos 0x0, ttl 64, id 3527, offset 0, flags [DF], proto TCP (6), length 54)
    127.0.0.1.10050 > 127.0.0.1.48198: Flags [P.], cksum 0xfe2a (incorrect -> 0x0a19), seq 1:3, ack 4, win 512, options [nop,nop,TS val 3519995983 ecr 3519995982], length 2
2022-04-07 20:36:36.431836 IP (tos 0x0, ttl 64, id 15080, offset 0, flags [DF], proto TCP (6), length 52)
    127.0.0.1.48198 > 127.0.0.1.10050: Flags [.], cksum 0xfe28 (incorrect -> 0x0f20), seq 4, ack 3, win 512, options [nop,nop,TS val 3519995983 ecr 3519995983], length 0
2022-04-07 20:36:36.433471 IP (tos 0x0, ttl 64, id 15081, offset 0, flags [DF], proto TCP (6), length 62)
    127.0.0.1.48198 > 127.0.0.1.10050: Flags [P.], cksum 0xfe32 (incorrect -> 0x3a85), seq 4:14, ack 3, win 512, options [nop,nop,TS val 3519995985 ecr 3519995983], length 10
2022-04-07 20:36:36.433480 IP (tos 0x0, ttl 64, id 3528, offset 0, flags [DF], proto TCP (6), length 52)
    127.0.0.1.10050 > 127.0.0.1.48198: Flags [.], cksum 0xfe28 (incorrect -> 0x0f12), seq 3, ack 14, win 512, options [nop,nop,TS val 3519995985 ecr 3519995985], length 0
2022-04-07 20:36:36.513883 IP (tos 0x0, ttl 64, id 3529, offset 0, flags [DF], proto TCP (6), length 62)
    127.0.0.1.10050 > 127.0.0.1.48198: Flags [P.], cksum 0xfe32 (incorrect -> 0x09af), seq 3:13, ack 14, win 512, options [nop,nop,TS val 3519996065 ecr 3519995985], length 10
2022-04-07 20:36:36.513897 IP (tos 0x0, ttl 64, id 15082, offset 0, flags [DF], proto TCP (6), length 52)
    127.0.0.1.48198 > 127.0.0.1.10050: Flags [.], cksum 0xfe28 (incorrect -> 0x0e68), seq 14, ack 13, win 512, options [nop,nop,TS val 3519996065 ecr 3519996065], length 0
2022-04-07 20:36:36.519847 IP (tos 0x0, ttl 64, id 15083, offset 0, flags [DF], proto TCP (6), length 569)
    127.0.0.1.48198 > 127.0.0.1.10050: Flags [P.], cksum 0x002e (incorrect -> 0x825c), seq 14:531, ack 13, win 512, options [nop,nop,TS val 3519996071 ecr 3519996065], length 517
2022-04-07 20:36:36.519858 IP (tos 0x0, ttl 64, id 3530, offset 0, flags [DF], proto TCP (6), length 52)
    127.0.0.1.10050 > 127.0.0.1.48198: Flags [.], cksum 0xfe28 (incorrect -> 0x0c5b), seq 13, ack 531, win 508, options [nop,nop,TS val 3519996071 ecr 3519996071], length 0
200, 5.63971734046936, 0.7404351234436035