2022-04-07 21:43:14.222976 IP (tos 0x0, ttl 64, id 57636, offset 0, flags [DF], proto TCP (6), length 60)
    127.0.0.1.49598 > 127.0.0.1.9650: Flags [S], cksum 0xfe30 (incorrect -> 0x0b65), seq 56600338, win 65495, options [mss 65495,sackOK,TS val 3523993774 ecr 0,nop,wscale 7], length 0
2022-04-07 21:43:14.222987 IP (tos 0x0, ttl 64, id 0, offset 0, flags [DF], proto TCP (6), length 60)
    127.0.0.1.9650 > 127.0.0.1.49598: Flags [S.], cksum 0xfe30 (incorrect -> 0x2d01), seq 69281667, ack 56600339, win 65483, options [mss 65495,sackOK,TS val 3523993774 ecr 3523993774,nop,wscale 7], length 0
2022-04-07 21:43:14.222997 IP (tos 0x0, ttl 64, id 57637, offset 0, flags [DF], proto TCP (6), length 52)
    127.0.0.1.49598 > 127.0.0.1.9650: Flags [.], cksum 0xfe28 (incorrect -> 0x53bd), seq 1, ack 1, win 512, options [nop,nop,TS val 3523993774 ecr 3523993774], length 0
2022-04-07 21:43:14.223133 IP (tos 0x0, ttl 64, id 57638, offset 0, flags [DF], proto TCP (6), length 55)
    127.0.0.1.49598 > 127.0.0.1.9650: Flags [P.], cksum 0xfe2b (incorrect -> 0x4eb1), seq 1:4, ack 1, win 512, options [nop,nop,TS val 3523993774 ecr 3523993774], length 3
2022-04-07 21:43:14.223141 IP (tos 0x0, ttl 64, id 17804, offset 0, flags [DF], proto TCP (6), length 52)
    127.0.0.1.9650 > 127.0.0.1.49598: Flags [.], cksum 0xfe28 (incorrect -> 0x53ba), seq 1, ack 4, win 512, options [nop,nop,TS val 3523993774 ecr 3523993774], length 0
2022-04-07 21:43:14.223161 IP (tos 0x0, ttl 64, id 17805, offset 0, flags [DF], proto TCP (6), length 54)
    127.0.0.1.9650 > 127.0.0.1.49598: Flags [P.], cksum 0xfe2a (incorrect -> 0x4eb0), seq 1:3, ack 4, win 512, options [nop,nop,TS val 3523993774 ecr 3523993774], length 2
2022-04-07 21:43:14.223169 IP (tos 0x0, ttl 64, id 57639, offset 0, flags [DF], proto TCP (6), length 52)
    127.0.0.1.49598 > 127.0.0.1.9650: Flags [.], cksum 0xfe28 (incorrect -> 0x53b8), seq 4, ack 3, win 512, options [nop,nop,TS val 3523993774 ecr 3523993774], length 0
2022-04-07 21:43:14.240789 IP (tos 0x0, ttl 64, id 57640, offset 0, flags [DF], proto TCP (6), length 62)
    127.0.0.1.49598 > 127.0.0.1.9650: Flags [P.], cksum 0xfe32 (incorrect -> 0xe84a), seq 4:14, ack 3, win 512, options [nop,nop,TS val 3523993792 ecr 3523993774], length 10
2022-04-07 21:43:14.240811 IP (tos 0x0, ttl 64, id 17806, offset 0, flags [DF], proto TCP (6), length 52)
    127.0.0.1.9650 > 127.0.0.1.49598: Flags [.], cksum 0xfe28 (incorrect -> 0x538a), seq 3, ack 14, win 512, options [nop,nop,TS val 3523993792 ecr 3523993792], length 0
2022-04-07 21:43:14.549304 IP (tos 0x0, ttl 64, id 17807, offset 0, flags [DF], proto TCP (6), length 62)
    127.0.0.1.9650 > 127.0.0.1.49598: Flags [P.], cksum 0xfe32 (incorrect -> 0x4d42), seq 3:13, ack 14, win 512, options [nop,nop,TS val 3523994101 ecr 3523993792], length 10
2022-04-07 21:43:14.549333 IP (tos 0x0, ttl 64, id 57641, offset 0, flags [DF], proto TCP (6), length 52)
    127.0.0.1.49598 > 127.0.0.1.9650: Flags [.], cksum 0xfe28 (incorrect -> 0x5116), seq 14, ack 13, win 512, options [nop,nop,TS val 3523994101 ecr 3523994101], length 0
2022-04-07 21:43:14.555086 IP (tos 0x0, ttl 64, id 57642, offset 0, flags [DF], proto TCP (6), length 569)
    127.0.0.1.49598 > 127.0.0.1.9650: Flags [P.], cksum 0x002e (incorrect -> 0x236b), seq 14:531, ack 13, win 512, options [nop,nop,TS val 3523994106 ecr 3523994101], length 517
2022-04-07 21:43:14.555106 IP (tos 0x0, ttl 64, id 17808, offset 0, flags [DF], proto TCP (6), length 52)
    127.0.0.1.9650 > 127.0.0.1.49598: Flags [.], cksum 0xfe28 (incorrect -> 0x4f0b), seq 13, ack 531, win 508, options [nop,nop,TS val 3523994106 ecr 3523994106], length 0
2022-04-07 21:43:14.939519 IP (tos 0x0, ttl 64, id 17809, offset 0, flags [DF], proto TCP (6), length 3274)
    127.0.0.1.9650 > 127.0.0.1.49598: Flags [P.], cksum 0x0abf (incorrect -> 0xac73), seq 13:3235, ack 531, win 512, options [nop,nop,TS val 3523994491 ecr 3523994106], length 3222
2022-04-07 21:43:14.939535 IP (tos 0x0, ttl 64, id 57643, offset 0, flags [DF], proto TCP (6), length 52)
    127.0.0.1.49598 > 127.0.0.1.9650: Flags [.], cksum 0xfe28 (incorrect -> 0x3f80), seq 531, ack 3235, win 495, options [nop,nop,TS val 3523994491 ecr 3523994491], length 0
2022-04-07 21:43:14.940093 IP (tos 0x0, ttl 64, id 57644, offset 0, flags [DF], proto TCP (6), length 178)
    127.0.0.1.49598 > 127.0.0.1.9650: Flags [P.], cksum 0xfea6 (incorrect -> 0x66ed), seq 531:657, ack 3235, win 512, options [nop,nop,TS val 3523994491 ecr 3523994491], length 126
2022-04-07 21:43:14.940103 IP (tos 0x0, ttl 64, id 17810, offset 0, flags [DF], proto TCP (6), length 52)
    127.0.0.1.9650 > 127.0.0.1.49598: Flags [.], cksum 0xfe28 (incorrect -> 0x3ef1), seq 3235, ack 657, win 512, options [nop,nop,TS val 3523994491 ecr 3523994491], length 0
2022-04-07 21:43:15.254404 IP (tos 0x0, ttl 64, id 17811, offset 0, flags [DF], proto TCP (6), length 310)
    127.0.0.1.9650 > 127.0.0.1.49598: Flags [P.], cksum 0xff2a (incorrect -> 0x6a38), seq 3235:3493, ack 657, win 512, options [nop,nop,TS val 3523994806 ecr 3523994491], length 258
2022-04-07 21:43:15.254420 IP (tos 0x0, ttl 64, id 57645, offset 0, flags [DF], proto TCP (6), length 52)
    127.0.0.1.49598 > 127.0.0.1.9650: Flags [.], cksum 0xfe28 (incorrect -> 0x3b7b), seq 657, ack 3493, win 510, options [nop,nop,TS val 3523994806 ecr 3523994806], length 0
2022-04-07 21:43:15.254909 IP (tos 0x0, ttl 64, id 57646, offset 0, flags [DF], proto TCP (6), length 327)
    127.0.0.1.49598 > 127.0.0.1.9650: Flags [P.], cksum 0xff3b (incorrect -> 0xffce), seq 657:932, ack 3493, win 512, options [nop,nop,TS val 3523994806 ecr 3523994806], length 275
2022-04-07 21:43:15.254918 IP (tos 0x0, ttl 64, id 17812, offset 0, flags [DF], proto TCP (6), length 52)
    127.0.0.1.9650 > 127.0.0.1.49598: Flags [.], cksum 0xfe28 (incorrect -> 0x3a68), seq 3493, ack 932, win 510, options [nop,nop,TS val 3523994806 ecr 3523994806], length 0
2022-04-07 21:43:15.554333 IP (tos 0x0, ttl 64, id 17813, offset 0, flags [DF], proto TCP (6), length 510)
    127.0.0.1.9650 > 127.0.0.1.49598: Flags [P.], cksum 0xfff2 (incorrect -> 0xfe3a), seq 3493:3951, ack 932, win 512, options [nop,nop,TS val 3523995106 ecr 3523994806], length 458
2022-04-07 21:43:15.554375 IP (tos 0x0, ttl 64, id 17814, offset 0, flags [DF], proto TCP (6), length 52)
    127.0.0.1.9650 > 127.0.0.1.49598: Flags [F.], cksum 0xfe28 (incorrect -> 0x376f), seq 3951, ack 932, win 512, options [nop,nop,TS val 3523995106 ecr 3523994806], length 0
2022-04-07 21:43:15.555504 IP (tos 0x0, ttl 64, id 57647, offset 0, flags [DF], proto TCP (6), length 52)
    127.0.0.1.49598 > 127.0.0.1.9650: Flags [R.], cksum 0xfe28 (incorrect -> 0x363e), seq 932, ack 3952, win 512, options [nop,nop,TS val 3523995107 ecr 3523995106], length 0
2022-04-07 21:43:15.556632 IP (tos 0x0, ttl 64, id 47920, offset 0, flags [DF], proto TCP (6), length 60)
    127.0.0.1.49602 > 127.0.0.1.9650: Flags [S], cksum 0xfe30 (incorrect -> 0x14a1), seq 2346717211, win 65495, options [mss 65495,sackOK,TS val 3523995108 ecr 0,nop,wscale 7], length 0
2022-04-07 21:43:15.556642 IP (tos 0x0, ttl 64, id 0, offset 0, flags [DF], proto TCP (6), length 60)
    127.0.0.1.9650 > 127.0.0.1.49602: Flags [S.], cksum 0xfe30 (incorrect -> 0x4066), seq 2783213152, ack 2346717212, win 65483, options [mss 65495,sackOK,TS val 3523995108 ecr 3523995108,nop,wscale 7], length 0
2022-04-07 21:43:15.556653 IP (tos 0x0, ttl 64, id 47921, offset 0, flags [DF], proto TCP (6), length 52)
    127.0.0.1.49602 > 127.0.0.1.9650: Flags [.], cksum 0xfe28 (incorrect -> 0x6722), seq 1, ack 1, win 512, options [nop,nop,TS val 3523995108 ecr 3523995108], length 0
2022-04-07 21:43:15.556711 IP (tos 0x0, ttl 64, id 47922, offset 0, flags [DF], proto TCP (6), length 55)
    127.0.0.1.49602 > 127.0.0.1.9650: Flags [P.], cksum 0xfe2b (incorrect -> 0x6216), seq 1:4, ack 1, win 512, options [nop,nop,TS val 3523995108 ecr 3523995108], length 3
2022-04-07 21:43:15.556716 IP (tos 0x0, ttl 64, id 37885, offset 0, flags [DF], proto TCP (6), length 52)
    127.0.0.1.9650 > 127.0.0.1.49602: Flags [.], cksum 0xfe28 (incorrect -> 0x671f), seq 1, ack 4, win 512, options [nop,nop,TS val 3523995108 ecr 3523995108], length 0
2022-04-07 21:43:15.556781 IP (tos 0x0, ttl 64, id 37886, offset 0, flags [DF], proto TCP (6), length 54)
    127.0.0.1.9650 > 127.0.0.1.49602: Flags [P.], cksum 0xfe2a (incorrect -> 0x6215), seq 1:3, ack 4, win 512, options [nop,nop,TS val 3523995108 ecr 3523995108], length 2
2022-04-07 21:43:15.556786 IP (tos 0x0, ttl 64, id 47923, offset 0, flags [DF], proto TCP (6), length 52)
    127.0.0.1.49602 > 127.0.0.1.9650: Flags [.], cksum 0xfe28 (incorrect -> 0x671d), seq 4, ack 3, win 512, options [nop,nop,TS val 3523995108 ecr 3523995108], length 0
2022-04-07 21:43:15.573899 IP (tos 0x0, ttl 64, id 47924, offset 0, flags [DF], proto TCP (6), length 62)
    127.0.0.1.49602 > 127.0.0.1.9650: Flags [P.], cksum 0xfe32 (incorrect -> 0xfb2e), seq 4:14, ack 3, win 512, options [nop,nop,TS val 3523995125 ecr 3523995108], length 10
2022-04-07 21:43:15.573911 IP (tos 0x0, ttl 64, id 37887, offset 0, flags [DF], proto TCP (6), length 52)
    127.0.0.1.9650 > 127.0.0.1.49602: Flags [.], cksum 0xfe28 (incorrect -> 0x66f1), seq 3, ack 14, win 512, options [nop,nop,TS val 3523995125 ecr 3523995125], length 0
2022-04-07 21:43:15.869933 IP (tos 0x0, ttl 64, id 37888, offset 0, flags [DF], proto TCP (6), length 62)
    127.0.0.1.9650 > 127.0.0.1.49602: Flags [P.], cksum 0xfe32 (incorrect -> 0x60b6), seq 3:13, ack 14, win 512, options [nop,nop,TS val 3523995421 ecr 3523995125], length 10
2022-04-07 21:43:15.869942 IP (tos 0x0, ttl 64, id 47925, offset 0, flags [DF], proto TCP (6), length 52)
    127.0.0.1.49602 > 127.0.0.1.9650: Flags [.], cksum 0xfe28 (incorrect -> 0x6497), seq 14, ack 13, win 512, options [nop,nop,TS val 3523995421 ecr 3523995421], length 0
2022-04-07 21:43:15.875112 IP (tos 0x0, ttl 64, id 47926, offset 0, flags [DF], proto TCP (6), length 569)
    127.0.0.1.49602 > 127.0.0.1.9650: Flags [P.], cksum 0x002e (incorrect -> 0xcc85), seq 14:531, ack 13, win 512, options [nop,nop,TS val 3523995426 ecr 3523995421], length 517
2022-04-07 21:43:15.875121 IP (tos 0x0, ttl 64, id 37889, offset 0, flags [DF], proto TCP (6), length 52)
    127.0.0.1.9650 > 127.0.0.1.49602: Flags [.], cksum 0xfe28 (incorrect -> 0x628c), seq 13, ack 531, win 508, options [nop,nop,TS val 3523995426 ecr 3523995426], length 0
2022-04-07 21:43:16.170831 IP (tos 0x0, ttl 64, id 37890, offset 0, flags [DF], proto TCP (6), length 3342)
    127.0.0.1.9650 > 127.0.0.1.49602: Flags [P.], cksum 0x0b03 (incorrect -> 0x2bf9), seq 13:3303, ack 531, win 512, options [nop,nop,TS val 3523995722 ecr 3523995426], length 3290
2022-04-07 21:43:16.170841 IP (tos 0x0, ttl 64, id 47927, offset 0, flags [DF], proto TCP (6), length 52)
    127.0.0.1.49602 > 127.0.0.1.9650: Flags [.], cksum 0xfe28 (incorrect -> 0x536f), seq 531, ack 3303, win 495, options [nop,nop,TS val 3523995722 ecr 3523995722], length 0
2022-04-07 21:43:16.171316 IP (tos 0x0, ttl 64, id 47928, offset 0, flags [DF], proto TCP (6), length 178)
    127.0.0.1.49602 > 127.0.0.1.9650: Flags [P.], cksum 0xfea6 (incorrect -> 0xdc37), seq 531:657, ack 3303, win 512, options [nop,nop,TS val 3523995723 ecr 3523995722], length 126
2022-04-07 21:43:16.171324 IP (tos 0x0, ttl 64, id 37891, offset 0, flags [DF], proto TCP (6), length 52)
    127.0.0.1.9650 > 127.0.0.1.49602: Flags [.], cksum 0xfe28 (incorrect -> 0x52de), seq 3303, ack 657, win 512, options [nop,nop,TS val 3523995723 ecr 3523995723], length 0
200, 4.069580316543579, 2.973747491836548