2022-04-07 01:19:47.542250 IP (tos 0x0, ttl 64, id 4056, offset 0, flags [DF], proto TCP (6), length 60)
    127.0.0.1.39634 > 127.0.0.1.10350: Flags [S], cksum 0xfe30 (incorrect -> 0x477e), seq 2107845071, win 65495, options [mss 65495,sackOK,TS val 376670045 ecr 0,nop,wscale 7], length 0
2022-04-07 01:19:47.542268 IP (tos 0x0, ttl 64, id 0, offset 0, flags [DF], proto TCP (6), length 60)
    127.0.0.1.10350 > 127.0.0.1.39634: Flags [S.], cksum 0xfe30 (incorrect -> 0x5155), seq 787884381, ack 2107845072, win 65483, options [mss 65495,sackOK,TS val 376670045 ecr 376670045,nop,wscale 7], length 0
2022-04-07 01:19:47.542281 IP (tos 0x0, ttl 64, id 4057, offset 0, flags [DF], proto TCP (6), length 52)
    127.0.0.1.39634 > 127.0.0.1.10350: Flags [.], cksum 0xfe28 (incorrect -> 0x7811), seq 1, ack 1, win 512, options [nop,nop,TS val 376670045 ecr 376670045], length 0
2022-04-07 01:19:47.542389 IP (tos 0x0, ttl 64, id 4058, offset 0, flags [DF], proto TCP (6), length 55)
    127.0.0.1.39634 > 127.0.0.1.10350: Flags [P.], cksum 0xfe2b (incorrect -> 0x7305), seq 1:4, ack 1, win 512, options [nop,nop,TS val 376670045 ecr 376670045], length 3
2022-04-07 01:19:47.542405 IP (tos 0x0, ttl 64, id 45891, offset 0, flags [DF], proto TCP (6), length 52)
    127.0.0.1.10350 > 127.0.0.1.39634: Flags [.], cksum 0xfe28 (incorrect -> 0x780e), seq 1, ack 4, win 512, options [nop,nop,TS val 376670045 ecr 376670045], length 0
2022-04-07 01:19:47.542444 IP (tos 0x0, ttl 64, id 45892, offset 0, flags [DF], proto TCP (6), length 54)
    127.0.0.1.10350 > 127.0.0.1.39634: Flags [P.], cksum 0xfe2a (incorrect -> 0x7304), seq 1:3, ack 4, win 512, options [nop,nop,TS val 376670045 ecr 376670045], length 2
2022-04-07 01:19:47.542457 IP (tos 0x0, ttl 64, id 4059, offset 0, flags [DF], proto TCP (6), length 52)
    127.0.0.1.39634 > 127.0.0.1.10350: Flags [.], cksum 0xfe28 (incorrect -> 0x780c), seq 4, ack 3, win 512, options [nop,nop,TS val 376670045 ecr 376670045], length 0
2022-04-07 01:19:47.593079 IP (tos 0x0, ttl 64, id 4060, offset 0, flags [DF], proto TCP (6), length 62)
    127.0.0.1.39634 > 127.0.0.1.10350: Flags [P.], cksum 0xfe32 (incorrect -> 0xfce7), seq 4:14, ack 3, win 512, options [nop,nop,TS val 376670096 ecr 376670045], length 10
2022-04-07 01:19:47.593099 IP (tos 0x0, ttl 64, id 45893, offset 0, flags [DF], proto TCP (6), length 52)
    127.0.0.1.10350 > 127.0.0.1.39634: Flags [.], cksum 0xfe28 (incorrect -> 0x779c), seq 3, ack 14, win 512, options [nop,nop,TS val 376670096 ecr 376670096], length 0
2022-04-07 01:19:47.665116 IP (tos 0x0, ttl 64, id 45894, offset 0, flags [DF], proto TCP (6), length 62)
    127.0.0.1.10350 > 127.0.0.1.39634: Flags [P.], cksum 0xfe32 (incorrect -> 0x7241), seq 3:13, ack 14, win 512, options [nop,nop,TS val 376670168 ecr 376670096], length 10
2022-04-07 01:19:47.665137 IP (tos 0x0, ttl 64, id 4061, offset 0, flags [DF], proto TCP (6), length 52)
    127.0.0.1.39634 > 127.0.0.1.10350: Flags [.], cksum 0xfe28 (incorrect -> 0x7702), seq 14, ack 13, win 512, options [nop,nop,TS val 376670168 ecr 376670168], length 0
200, 10.834422826766968, 0.8141055107116699