2022-04-07 01:40:49.744309 IP (tos 0x0, ttl 64, id 50346, offset 0, flags [DF], proto TCP (6), length 60)
    127.0.0.1.37772 > 127.0.0.1.11850: Flags [S], cksum 0xfe30 (incorrect -> 0x3fe2), seq 3540884189, win 65495, options [mss 65495,sackOK,TS val 377932247 ecr 0,nop,wscale 7], length 0
2022-04-07 01:40:49.744320 IP (tos 0x0, ttl 64, id 0, offset 0, flags [DF], proto TCP (6), length 60)
    127.0.0.1.11850 > 127.0.0.1.37772: Flags [S.], cksum 0xfe30 (incorrect -> 0x0942), seq 2944181952, ack 3540884190, win 65483, options [mss 65495,sackOK,TS val 377932247 ecr 377932247,nop,wscale 7], length 0
2022-04-07 01:40:49.744329 IP (tos 0x0, ttl 64, id 50347, offset 0, flags [DF], proto TCP (6), length 52)
    127.0.0.1.37772 > 127.0.0.1.11850: Flags [.], cksum 0xfe28 (incorrect -> 0x2ffe), seq 1, ack 1, win 512, options [nop,nop,TS val 377932247 ecr 377932247], length 0
2022-04-07 01:40:49.744420 IP (tos 0x0, ttl 64, id 50348, offset 0, flags [DF], proto TCP (6), length 55)
    127.0.0.1.37772 > 127.0.0.1.11850: Flags [P.], cksum 0xfe2b (incorrect -> 0x2af2), seq 1:4, ack 1, win 512, options [nop,nop,TS val 377932247 ecr 377932247], length 3
2022-04-07 01:40:49.744430 IP (tos 0x0, ttl 64, id 35630, offset 0, flags [DF], proto TCP (6), length 52)
    127.0.0.1.11850 > 127.0.0.1.37772: Flags [.], cksum 0xfe28 (incorrect -> 0x2ffb), seq 1, ack 4, win 512, options [nop,nop,TS val 377932247 ecr 377932247], length 0
2022-04-07 01:40:49.744475 IP (tos 0x0, ttl 64, id 35631, offset 0, flags [DF], proto TCP (6), length 54)
    127.0.0.1.11850 > 127.0.0.1.37772: Flags [P.], cksum 0xfe2a (incorrect -> 0x2af1), seq 1:3, ack 4, win 512, options [nop,nop,TS val 377932247 ecr 377932247], length 2
2022-04-07 01:40:49.744499 IP (tos 0x0, ttl 64, id 50349, offset 0, flags [DF], proto TCP (6), length 52)
    127.0.0.1.37772 > 127.0.0.1.11850: Flags [.], cksum 0xfe28 (incorrect -> 0x2ff9), seq 4, ack 3, win 512, options [nop,nop,TS val 377932247 ecr 377932247], length 0
2022-04-07 01:40:49.756144 IP (tos 0x0, ttl 64, id 50350, offset 0, flags [DF], proto TCP (6), length 62)
    127.0.0.1.37772 > 127.0.0.1.11850: Flags [P.], cksum 0xfe32 (incorrect -> 0x9fdc), seq 4:14, ack 3, win 512, options [nop,nop,TS val 377932259 ecr 377932247], length 10
2022-04-07 01:40:49.756158 IP (tos 0x0, ttl 64, id 35632, offset 0, flags [DF], proto TCP (6), length 52)
    127.0.0.1.11850 > 127.0.0.1.37772: Flags [.], cksum 0xfe28 (incorrect -> 0x2fd7), seq 3, ack 14, win 512, options [nop,nop,TS val 377932259 ecr 377932259], length 0
2022-04-07 01:40:49.822031 IP (tos 0x0, ttl 64, id 35633, offset 0, flags [DF], proto TCP (6), length 62)
    127.0.0.1.11850 > 127.0.0.1.37772: Flags [P.], cksum 0xfe32 (incorrect -> 0x2a83), seq 3:13, ack 14, win 512, options [nop,nop,TS val 377932324 ecr 377932259], length 10
2022-04-07 01:40:49.822057 IP (tos 0x0, ttl 64, id 50351, offset 0, flags [DF], proto TCP (6), length 52)
    127.0.0.1.37772 > 127.0.0.1.11850: Flags [.], cksum 0xfe28 (incorrect -> 0x2f4b), seq 14, ack 13, win 512, options [nop,nop,TS val 377932324 ecr 377932324], length 0
2022-04-07 01:40:49.827746 IP (tos 0x0, ttl 64, id 50352, offset 0, flags [DF], proto TCP (6), length 569)
    127.0.0.1.37772 > 127.0.0.1.11850: Flags [P.], cksum 0x002e (incorrect -> 0xf839), seq 14:531, ack 13, win 512, options [nop,nop,TS val 377932330 ecr 377932324], length 517
2022-04-07 01:40:49.827758 IP (tos 0x0, ttl 64, id 35634, offset 0, flags [DF], proto TCP (6), length 52)
    127.0.0.1.11850 > 127.0.0.1.37772: Flags [.], cksum 0xfe28 (incorrect -> 0x2d3e), seq 13, ack 531, win 508, options [nop,nop,TS val 377932330 ecr 377932330], length 0
2022-04-07 01:40:49.899890 IP (tos 0x0, ttl 64, id 35635, offset 0, flags [DF], proto TCP (6), length 1500)
    127.0.0.1.11850 > 127.0.0.1.37772: Flags [P.], cksum 0x03d1 (incorrect -> 0xa86a), seq 13:1461, ack 531, win 512, options [nop,nop,TS val 377932402 ecr 377932330], length 1448
2022-04-07 01:40:49.899906 IP (tos 0x0, ttl 64, id 50353, offset 0, flags [DF], proto TCP (6), length 52)
    127.0.0.1.37772 > 127.0.0.1.11850: Flags [.], cksum 0xfe28 (incorrect -> 0x270c), seq 531, ack 1461, win 502, options [nop,nop,TS val 377932402 ecr 377932402], length 0
2022-04-07 01:40:49.920912 IP (tos 0x0, ttl 64, id 35636, offset 0, flags [DF], proto TCP (6), length 3189)
    127.0.0.1.11850 > 127.0.0.1.37772: Flags [P.], cksum 0x0a6a (incorrect -> 0x84d3), seq 1461:4598, ack 531, win 512, options [nop,nop,TS val 377932423 ecr 377932402], length 3137
2022-04-07 01:40:49.920923 IP (tos 0x0, ttl 64, id 50354, offset 0, flags [DF], proto TCP (6), length 52)
    127.0.0.1.37772 > 127.0.0.1.11850: Flags [.], cksum 0xfe28 (incorrect -> 0x1aa8), seq 531, ack 4598, win 495, options [nop,nop,TS val 377932423 ecr 377932423], length 0
2022-04-07 01:40:49.921304 IP (tos 0x0, ttl 64, id 50355, offset 0, flags [DF], proto TCP (6), length 132)
    127.0.0.1.37772 > 127.0.0.1.11850: Flags [P.], cksum 0xfe78 (incorrect -> 0xc04e), seq 531:611, ack 4598, win 512, options [nop,nop,TS val 377932424 ecr 377932423], length 80
2022-04-07 01:40:49.921315 IP (tos 0x0, ttl 64, id 35637, offset 0, flags [DF], proto TCP (6), length 52)
    127.0.0.1.11850 > 127.0.0.1.37772: Flags [.], cksum 0xfe28 (incorrect -> 0x1a45), seq 4598, ack 611, win 512, options [nop,nop,TS val 377932424 ecr 377932424], length 0
2022-04-07 01:40:49.921552 IP (tos 0x0, ttl 64, id 50356, offset 0, flags [DF], proto TCP (6), length 403)
    127.0.0.1.37772 > 127.0.0.1.11850: Flags [P.], cksum 0xff87 (incorrect -> 0x3c78), seq 611:962, ack 4598, win 512, options [nop,nop,TS val 377932424 ecr 377932424], length 351
2022-04-07 01:40:49.921563 IP (tos 0x0, ttl 64, id 35638, offset 0, flags [DF], proto TCP (6), length 52)
    127.0.0.1.11850 > 127.0.0.1.37772: Flags [.], cksum 0xfe28 (incorrect -> 0x18e8), seq 4598, ack 962, win 510, options [nop,nop,TS val 377932424 ecr 377932424], length 0
2022-04-07 01:40:50.002210 IP (tos 0x0, ttl 64, id 35639, offset 0, flags [DF], proto TCP (6), length 210)
    127.0.0.1.11850 > 127.0.0.1.37772: Flags [P.], cksum 0xfec6 (incorrect -> 0xdd38), seq 4598:4756, ack 962, win 512, options [nop,nop,TS val 377932505 ecr 377932424], length 158
2022-04-07 01:40:50.002240 IP (tos 0x0, ttl 64, id 50357, offset 0, flags [DF], proto TCP (6), length 52)
    127.0.0.1.37772 > 127.0.0.1.11850: Flags [.], cksum 0xfe28 (incorrect -> 0x17a7), seq 962, ack 4756, win 511, options [nop,nop,TS val 377932505 ecr 377932505], length 0
2022-04-07 01:40:50.044518 IP (tos 0x0, ttl 64, id 35640, offset 0, flags [DF], proto TCP (6), length 3538)
    127.0.0.1.11850 > 127.0.0.1.37772: Flags [P.], cksum 0x0bc7 (incorrect -> 0x91be), seq 4756:8242, ack 962, win 512, options [nop,nop,TS val 377932547 ecr 377932505], length 3486
2022-04-07 01:40:50.044540 IP (tos 0x0, ttl 64, id 50358, offset 0, flags [DF], proto TCP (6), length 52)
    127.0.0.1.37772 > 127.0.0.1.11850: Flags [.], cksum 0xfe28 (incorrect -> 0x09c6), seq 962, ack 8242, win 494, options [nop,nop,TS val 377932547 ecr 377932547], length 0
2022-04-07 01:40:50.065516 IP (tos 0x0, ttl 64, id 35641, offset 0, flags [DF], proto TCP (6), length 4036)
    127.0.0.1.11850 > 127.0.0.1.37772: Flags [P.], cksum 0x0db9 (incorrect -> 0x942c), seq 8242:12226, ack 962, win 512, options [nop,nop,TS val 377932568 ecr 377932547], length 3984
2022-04-07 01:40:50.065526 IP (tos 0x0, ttl 64, id 50359, offset 0, flags [DF], proto TCP (6), length 52)
    127.0.0.1.37772 > 127.0.0.1.11850: Flags [.], cksum 0xfe28 (incorrect -> 0xfa0d), seq 962, ack 12226, win 492, options [nop,nop,TS val 377932568 ecr 377932568], length 0
2022-04-07 01:40:50.097721 IP (tos 0x0, ttl 64, id 35642, offset 0, flags [DF], proto TCP (6), length 3538)
    127.0.0.1.11850 > 127.0.0.1.37772: Flags [P.], cksum 0x0bc7 (incorrect -> 0xce19), seq 12226:15712, ack 962, win 512, options [nop,nop,TS val 377932600 ecr 377932568], length 3486
2022-04-07 01:40:50.097731 IP (tos 0x0, ttl 64, id 50360, offset 0, flags [DF], proto TCP (6), length 52)
    127.0.0.1.37772 > 127.0.0.1.11850: Flags [.], cksum 0xfe28 (incorrect -> 0xec2d), seq 962, ack 15712, win 494, options [nop,nop,TS val 377932600 ecr 377932600], length 0
2022-04-07 01:40:50.118845 IP (tos 0x0, ttl 64, id 35643, offset 0, flags [DF], proto TCP (6), length 550)
    127.0.0.1.11850 > 127.0.0.1.37772: Flags [P.], cksum 0x001b (incorrect -> 0xcd53), seq 15712:16210, ack 962, win 512, options [nop,nop,TS val 377932621 ecr 377932600], length 498
2022-04-07 01:40:50.118855 IP (tos 0x0, ttl 64, id 50361, offset 0, flags [DF], proto TCP (6), length 52)
    127.0.0.1.37772 > 127.0.0.1.11850: Flags [.], cksum 0xfe28 (incorrect -> 0xea05), seq 962, ack 16210, win 506, options [nop,nop,TS val 377932621 ecr 377932621], length 0
2022-04-07 01:40:50.130572 IP (tos 0x0, ttl 64, id 35644, offset 0, flags [DF], proto TCP (6), length 3576)
    127.0.0.1.11850 > 127.0.0.1.37772: Flags [P.], cksum 0x0bed (incorrect -> 0x929e), seq 16210:19734, ack 962, win 512, options [nop,nop,TS val 377932633 ecr 377932621], length 3524
2022-04-07 01:40:50.130582 IP (tos 0x0, ttl 64, id 50362, offset 0, flags [DF], proto TCP (6), length 52)
    127.0.0.1.37772 > 127.0.0.1.11850: Flags [.], cksum 0xfe28 (incorrect -> 0xdc35), seq 962, ack 19734, win 494, options [nop,nop,TS val 377932633 ecr 377932633], length 0
2022-04-07 01:40:50.139986 IP (tos 0x0, ttl 64, id 35645, offset 0, flags [DF], proto TCP (6), length 4036)
    127.0.0.1.11850 > 127.0.0.1.37772: Flags [P.], cksum 0x0db9 (incorrect -> 0x4d1c), seq 19734:23718, ack 962, win 512, options [nop,nop,TS val 377932642 ecr 377932633], length 3984
2022-04-07 01:40:50.139996 IP (tos 0x0, ttl 64, id 50363, offset 0, flags [DF], proto TCP (6), length 52)
    127.0.0.1.37772 > 127.0.0.1.11850: Flags [.], cksum 0xfe28 (incorrect -> 0xcc95), seq 962, ack 23718, win 492, options [nop,nop,TS val 377932642 ecr 377932642], length 0
2022-04-07 01:40:50.162779 IP (tos 0x0, ttl 64, id 35646, offset 0, flags [DF], proto TCP (6), length 3538)
    127.0.0.1.11850 > 127.0.0.1.37772: Flags [P.], cksum 0x0bc7 (incorrect -> 0xaa98), seq 23718:27204, ack 962, win 512, options [nop,nop,TS val 377932665 ecr 377932642], length 3486
2022-04-07 01:40:50.162789 IP (tos 0x0, ttl 64, id 50364, offset 0, flags [DF], proto TCP (6), length 52)
    127.0.0.1.37772 > 127.0.0.1.11850: Flags [.], cksum 0xfe28 (incorrect -> 0xbec7), seq 962, ack 27204, win 494, options [nop,nop,TS val 377932665 ecr 377932665], length 0
2022-04-07 01:40:50.176491 IP (tos 0x0, ttl 64, id 35647, offset 0, flags [DF], proto TCP (6), length 550)
    127.0.0.1.11850 > 127.0.0.1.37772: Flags [P.], cksum 0x001b (incorrect -> 0x0321), seq 27204:27702, ack 962, win 512, options [nop,nop,TS val 377932679 ecr 377932665], length 498
2022-04-07 01:40:50.176518 IP (tos 0x0, ttl 64, id 50365, offset 0, flags [DF], proto TCP (6), length 52)
    127.0.0.1.37772 > 127.0.0.1.11850: Flags [.], cksum 0xfe28 (incorrect -> 0xbca7), seq 962, ack 27702, win 512, options [nop,nop,TS val 377932679 ecr 377932679], length 0
2022-04-07 01:40:50.183912 IP (tos 0x0, ttl 64, id 35648, offset 0, flags [DF], proto TCP (6), length 4036)
    127.0.0.1.11850 > 127.0.0.1.37772: Flags [P.], cksum 0x0db9 (incorrect -> 0x0153), seq 27702:31686, ack 962, win 512, options [nop,nop,TS val 377932686 ecr 377932679], length 3984
2022-04-07 01:40:50.226671 IP (tos 0x0, ttl 64, id 50366, offset 0, flags [DF], proto TCP (6), length 52)
    127.0.0.1.37772 > 127.0.0.1.11850: Flags [.], cksum 0xfe28 (incorrect -> 0xacde), seq 962, ack 31686, win 512, options [nop,nop,TS val 377932729 ecr 377932686], length 0
2022-04-07 01:40:50.228402 IP (tos 0x0, ttl 64, id 35649, offset 0, flags [DF], proto TCP (6), length 4036)
    127.0.0.1.11850 > 127.0.0.1.37772: Flags [P.], cksum 0x0db9 (incorrect -> 0xe556), seq 31686:35670, ack 962, win 512, options [nop,nop,TS val 377932731 ecr 377932729], length 3984
2022-04-07 01:40:50.270653 IP (tos 0x0, ttl 64, id 50367, offset 0, flags [DF], proto TCP (6), length 52)
    127.0.0.1.37772 > 127.0.0.1.11850: Flags [.], cksum 0xfe28 (incorrect -> 0x9cf5), seq 962, ack 35670, win 512, options [nop,nop,TS val 377932773 ecr 377932731], length 0
2022-04-07 01:40:50.270660 IP (tos 0x0, ttl 64, id 35650, offset 0, flags [DF], proto TCP (6), length 7522)
    127.0.0.1.11850 > 127.0.0.1.37772: Flags [P.], cksum 0x1b57 (incorrect -> 0x34ff), seq 35670:43140, ack 962, win 512, options [nop,nop,TS val 377932773 ecr 377932773], length 7470
2022-04-07 01:40:50.314650 IP (tos 0x0, ttl 64, id 50368, offset 0, flags [DF], proto TCP (6), length 52)
    127.0.0.1.37772 > 127.0.0.1.11850: Flags [.], cksum 0xfe28 (incorrect -> 0x7f71), seq 962, ack 43140, win 512, options [nop,nop,TS val 377932817 ecr 377932773], length 0
2022-04-07 01:40:50.314659 IP (tos 0x0, ttl 64, id 35651, offset 0, flags [DF], proto TCP (6), length 14884)
    127.0.0.1.11850 > 127.0.0.1.37772: Flags [P.], cksum 0x3819 (incorrect -> 0x7cf9), seq 43140:57972, ack 962, win 512, options [nop,nop,TS val 377932817 ecr 377932817], length 14832
2022-04-07 01:40:50.358650 IP (tos 0x0, ttl 64, id 50369, offset 0, flags [DF], proto TCP (6), length 52)
    127.0.0.1.37772 > 127.0.0.1.11850: Flags [.], cksum 0xfe28 (incorrect -> 0x4529), seq 962, ack 57972, win 512, options [nop,nop,TS val 377932861 ecr 377932817], length 0
2022-04-07 01:40:50.358658 IP (tos 0x0, ttl 64, id 35652, offset 0, flags [DF], proto TCP (6), length 19780)
    127.0.0.1.11850 > 127.0.0.1.37772: Flags [P.], cksum 0x4b39 (incorrect -> 0xabc5), seq 57972:77700, ack 962, win 512, options [nop,nop,TS val 377932861 ecr 377932861], length 19728
2022-04-07 01:40:50.402651 IP (tos 0x0, ttl 64, id 50370, offset 0, flags [DF], proto TCP (6), length 52)
    127.0.0.1.37772 > 127.0.0.1.11850: Flags [.], cksum 0xfe28 (incorrect -> 0xf7c0), seq 962, ack 77700, win 512, options [nop,nop,TS val 377932905 ecr 377932861], length 0
2022-04-07 01:40:50.402658 IP (tos 0x0, ttl 64, id 35653, offset 0, flags [DF], proto TCP (6), length 7246)
    127.0.0.1.11850 > 127.0.0.1.37772: Flags [P.], cksum 0x1a43 (incorrect -> 0x8d9b), seq 77700:84894, ack 962, win 512, options [nop,nop,TS val 377932905 ecr 377932905], length 7194
2022-04-07 01:40:50.402670 IP (tos 0x0, ttl 64, id 50371, offset 0, flags [DF], proto TCP (6), length 52)
    127.0.0.1.37772 > 127.0.0.1.11850: Flags [.], cksum 0xfe28 (incorrect -> 0xdb7a), seq 962, ack 84894, win 512, options [nop,nop,TS val 377932905 ecr 377932905], length 0
2022-04-07 01:40:50.424508 IP (tos 0x0, ttl 64, id 35654, offset 0, flags [DF], proto TCP (6), length 3944)
    127.0.0.1.11850 > 127.0.0.1.37772: Flags [P.], cksum 0x0d5d (incorrect -> 0x1ab9), seq 84894:88786, ack 962, win 512, options [nop,nop,TS val 377932927 ecr 377932905], length 3892
2022-04-07 01:40:50.424795 IP (tos 0x0, ttl 64, id 50372, offset 0, flags [DF], proto TCP (6), length 52)
    127.0.0.1.37772 > 127.0.0.1.11850: Flags [.], cksum 0xfe28 (incorrect -> 0xcc1a), seq 962, ack 88786, win 512, options [nop,nop,TS val 377932927 ecr 377932927], length 0
2022-04-07 01:40:50.425823 IP (tos 0x0, ttl 64, id 35655, offset 0, flags [DF], proto TCP (6), length 3898)
    127.0.0.1.11850 > 127.0.0.1.37772: Flags [P.], cksum 0x0d2f (incorrect -> 0xf61a), seq 88786:92632, ack 962, win 512, options [nop,nop,TS val 377932928 ecr 377932927], length 3846
2022-04-07 01:40:50.425835 IP (tos 0x0, ttl 64, id 50373, offset 0, flags [DF], proto TCP (6), length 52)
    127.0.0.1.37772 > 127.0.0.1.11850: Flags [.], cksum 0xfe28 (incorrect -> 0xbd12), seq 962, ack 92632, win 512, options [nop,nop,TS val 377932928 ecr 377932928], length 0
2022-04-07 01:40:50.447258 IP (tos 0x0, ttl 64, id 35656, offset 0, flags [DF], proto TCP (6), length 3446)
    127.0.0.1.11850 > 127.0.0.1.37772: Flags [P.], cksum 0x0b6b (incorrect -> 0x61d9), seq 92632:96026, ack 962, win 512, options [nop,nop,TS val 377932950 ecr 377932928], length 3394
2022-04-07 01:40:50.447272 IP (tos 0x0, ttl 64, id 50374, offset 0, flags [DF], proto TCP (6), length 52)
    127.0.0.1.37772 > 127.0.0.1.11850: Flags [.], cksum 0xfe28 (incorrect -> 0xafa4), seq 962, ack 96026, win 512, options [nop,nop,TS val 377932950 ecr 377932950], length 0
2022-04-07 01:40:50.468336 IP (tos 0x0, ttl 64, id 35657, offset 0, flags [DF], proto TCP (6), length 550)
    127.0.0.1.11850 > 127.0.0.1.37772: Flags [P.], cksum 0x001b (incorrect -> 0x7d65), seq 96026:96524, ack 962, win 512, options [nop,nop,TS val 377932971 ecr 377932950], length 498
2022-04-07 01:40:50.468347 IP (tos 0x0, ttl 64, id 50375, offset 0, flags [DF], proto TCP (6), length 52)
    127.0.0.1.37772 > 127.0.0.1.11850: Flags [.], cksum 0xfe28 (incorrect -> 0xad88), seq 962, ack 96524, win 512, options [nop,nop,TS val 377932971 ecr 377932971], length 0
2022-04-07 01:40:50.483047 IP (tos 0x0, ttl 64, id 35658, offset 0, flags [DF], proto TCP (6), length 3944)
    127.0.0.1.11850 > 127.0.0.1.37772: Flags [P.], cksum 0x0d5d (incorrect -> 0xb1e2), seq 96524:100416, ack 962, win 512, options [nop,nop,TS val 377932985 ecr 377932971], length 3892
2022-04-07 01:40:50.483064 IP (tos 0x0, ttl 64, id 50376, offset 0, flags [DF], proto TCP (6), length 52)
    127.0.0.1.37772 > 127.0.0.1.11850: Flags [.], cksum 0xfe28 (incorrect -> 0x9e37), seq 962, ack 100416, win 512, options [nop,nop,TS val 377932986 ecr 377932985], length 0
2022-04-07 01:40:50.489750 IP (tos 0x0, ttl 64, id 35659, offset 0, flags [DF], proto TCP (6), length 3898)
    127.0.0.1.11850 > 127.0.0.1.37772: Flags [P.], cksum 0x0d2f (incorrect -> 0xae16), seq 100416:104262, ack 962, win 512, options [nop,nop,TS val 377932992 ecr 377932986], length 3846
2022-04-07 01:40:50.490113 IP (tos 0x0, ttl 64, id 50377, offset 0, flags [DF], proto TCP (6), length 52)
    127.0.0.1.37772 > 127.0.0.1.11850: Flags [.], cksum 0xfe28 (incorrect -> 0x8f23), seq 962, ack 104262, win 512, options [nop,nop,TS val 377932993 ecr 377932992], length 0
2022-04-07 01:40:50.511674 IP (tos 0x0, ttl 64, id 35660, offset 0, flags [DF], proto TCP (6), length 3446)
    127.0.0.1.11850 > 127.0.0.1.37772: Flags [P.], cksum 0x0b6b (incorrect -> 0x7a26), seq 104262:107656, ack 962, win 512, options [nop,nop,TS val 377933014 ecr 377932993], length 3394
2022-04-07 01:40:50.511690 IP (tos 0x0, ttl 64, id 50378, offset 0, flags [DF], proto TCP (6), length 52)
    127.0.0.1.37772 > 127.0.0.1.11850: Flags [.], cksum 0xfe28 (incorrect -> 0x81b6), seq 962, ack 107656, win 512, options [nop,nop,TS val 377933014 ecr 377933014], length 0
2022-04-07 01:40:50.523297 IP (tos 0x0, ttl 64, id 35661, offset 0, flags [DF], proto TCP (6), length 550)
    127.0.0.1.11850 > 127.0.0.1.37772: Flags [P.], cksum 0x001b (incorrect -> 0x6366), seq 107656:108154, ack 962, win 512, options [nop,nop,TS val 377933026 ecr 377933014], length 498
2022-04-07 01:40:50.523319 IP (tos 0x0, ttl 64, id 50379, offset 0, flags [DF], proto TCP (6), length 52)
    127.0.0.1.37772 > 127.0.0.1.11850: Flags [.], cksum 0xfe28 (incorrect -> 0x7fac), seq 962, ack 108154, win 512, options [nop,nop,TS val 377933026 ecr 377933026], length 0
2022-04-07 01:40:50.542215 IP (tos 0x0, ttl 64, id 35662, offset 0, flags [DF], proto TCP (6), length 3538)
    127.0.0.1.11850 > 127.0.0.1.37772: Flags [P.], cksum 0x0bc7 (incorrect -> 0xb27b), seq 108154:111640, ack 962, win 512, options [nop,nop,TS val 377933045 ecr 377933026], length 3486
2022-04-07 01:40:50.542227 IP (tos 0x0, ttl 64, id 50380, offset 0, flags [DF], proto TCP (6), length 52)
    127.0.0.1.37772 > 127.0.0.1.11850: Flags [.], cksum 0xfe28 (incorrect -> 0x71e8), seq 962, ack 111640, win 512, options [nop,nop,TS val 377933045 ecr 377933045], length 0
2022-04-07 01:40:50.565334 IP (tos 0x0, ttl 64, id 35663, offset 0, flags [DF], proto TCP (6), length 3806)
    127.0.0.1.11850 > 127.0.0.1.37772: Flags [P.], cksum 0x0cd3 (incorrect -> 0x0397), seq 111640:115394, ack 962, win 512, options [nop,nop,TS val 377933068 ecr 377933045], length 3754
2022-04-07 01:40:50.565345 IP (tos 0x0, ttl 64, id 50381, offset 0, flags [DF], proto TCP (6), length 52)
    127.0.0.1.37772 > 127.0.0.1.11850: Flags [.], cksum 0xfe28 (incorrect -> 0x6310), seq 962, ack 115394, win 512, options [nop,nop,TS val 377933068 ecr 377933068], length 0
2022-04-07 01:40:50.565399 IP (tos 0x0, ttl 64, id 35664, offset 0, flags [DF], proto TCP (6), length 3400)
    127.0.0.1.11850 > 127.0.0.1.37772: Flags [P.], cksum 0x0b3d (incorrect -> 0x4f21), seq 115394:118742, ack 962, win 512, options [nop,nop,TS val 377933068 ecr 377933068], length 3348
2022-04-07 01:40:50.565407 IP (tos 0x0, ttl 64, id 50382, offset 0, flags [DF], proto TCP (6), length 52)
    127.0.0.1.37772 > 127.0.0.1.11850: Flags [.], cksum 0xfe28 (incorrect -> 0x55fc), seq 962, ack 118742, win 512, options [nop,nop,TS val 377933068 ecr 377933068], length 0
200, 32.99751114845276, 0.8792462348937988