2022-04-07 01:30:49.135596 IP (tos 0x0, ttl 64, id 41541, offset 0, flags [DF], proto TCP (6), length 60)
    127.0.0.1.55228 > 127.0.0.1.11550: Flags [S], cksum 0xfe30 (incorrect -> 0x85e6), seq 485290528, win 65495, options [mss 65495,sackOK,TS val 377331638 ecr 0,nop,wscale 7], length 0
2022-04-07 01:30:49.135609 IP (tos 0x0, ttl 64, id 0, offset 0, flags [DF], proto TCP (6), length 60)
    127.0.0.1.11550 > 127.0.0.1.55228: Flags [S.], cksum 0xfe30 (incorrect -> 0x6c49), seq 3722610049, ack 485290529, win 65483, options [mss 65495,sackOK,TS val 377331638 ecr 377331638,nop,wscale 7], length 0
2022-04-07 01:30:49.135619 IP (tos 0x0, ttl 64, id 41542, offset 0, flags [DF], proto TCP (6), length 52)
    127.0.0.1.55228 > 127.0.0.1.11550: Flags [.], cksum 0xfe28 (incorrect -> 0x9305), seq 1, ack 1, win 512, options [nop,nop,TS val 377331638 ecr 377331638], length 0
2022-04-07 01:30:49.135743 IP (tos 0x0, ttl 64, id 41543, offset 0, flags [DF], proto TCP (6), length 55)
    127.0.0.1.55228 > 127.0.0.1.11550: Flags [P.], cksum 0xfe2b (incorrect -> 0x8df9), seq 1:4, ack 1, win 512, options [nop,nop,TS val 377331638 ecr 377331638], length 3
2022-04-07 01:30:49.135760 IP (tos 0x0, ttl 64, id 13083, offset 0, flags [DF], proto TCP (6), length 52)
    127.0.0.1.11550 > 127.0.0.1.55228: Flags [.], cksum 0xfe28 (incorrect -> 0x9302), seq 1, ack 4, win 512, options [nop,nop,TS val 377331638 ecr 377331638], length 0
2022-04-07 01:30:49.135804 IP (tos 0x0, ttl 64, id 13084, offset 0, flags [DF], proto TCP (6), length 54)
    127.0.0.1.11550 > 127.0.0.1.55228: Flags [P.], cksum 0xfe2a (incorrect -> 0x8df8), seq 1:3, ack 4, win 512, options [nop,nop,TS val 377331638 ecr 377331638], length 2
2022-04-07 01:30:49.135821 IP (tos 0x0, ttl 64, id 41544, offset 0, flags [DF], proto TCP (6), length 52)
    127.0.0.1.55228 > 127.0.0.1.11550: Flags [.], cksum 0xfe28 (incorrect -> 0x9300), seq 4, ack 3, win 512, options [nop,nop,TS val 377331638 ecr 377331638], length 0
2022-04-07 01:30:49.147621 IP (tos 0x0, ttl 64, id 41545, offset 0, flags [DF], proto TCP (6), length 62)
    127.0.0.1.55228 > 127.0.0.1.11550: Flags [P.], cksum 0xfe32 (incorrect -> 0x514e), seq 4:14, ack 3, win 512, options [nop,nop,TS val 377331650 ecr 377331638], length 10
2022-04-07 01:30:49.147631 IP (tos 0x0, ttl 64, id 13085, offset 0, flags [DF], proto TCP (6), length 52)
    127.0.0.1.11550 > 127.0.0.1.55228: Flags [.], cksum 0xfe28 (incorrect -> 0x92de), seq 3, ack 14, win 512, options [nop,nop,TS val 377331650 ecr 377331650], length 0
200, 3.8388705253601074, 1.0138895511627197