2022-04-07 17:46:24.345466 IP (tos 0x0, ttl 64, id 23450, offset 0, flags [DF], proto TCP (6), length 60)
    127.0.0.1.43094 > 127.0.0.1.11250: Flags [S], cksum 0xfe30 (incorrect -> 0x714f), seq 3742256334, win 65495, options [mss 65495,sackOK,TS val 3509783897 ecr 0,nop,wscale 7], length 0
2022-04-07 17:46:24.345487 IP (tos 0x0, ttl 64, id 0, offset 0, flags [DF], proto TCP (6), length 60)
    127.0.0.1.11250 > 127.0.0.1.43094: Flags [S.], cksum 0xfe30 (incorrect -> 0x18a3), seq 1849560028, ack 3742256335, win 65483, options [mss 65495,sackOK,TS val 3509783897 ecr 3509783897,nop,wscale 7], length 0
2022-04-07 17:46:24.345499 IP (tos 0x0, ttl 64, id 23451, offset 0, flags [DF], proto TCP (6), length 52)
    127.0.0.1.43094 > 127.0.0.1.11250: Flags [.], cksum 0xfe28 (incorrect -> 0x3f5f), seq 1, ack 1, win 512, options [nop,nop,TS val 3509783897 ecr 3509783897], length 0
2022-04-07 17:46:24.345624 IP (tos 0x0, ttl 64, id 23452, offset 0, flags [DF], proto TCP (6), length 55)
    127.0.0.1.43094 > 127.0.0.1.11250: Flags [P.], cksum 0xfe2b (incorrect -> 0x3a53), seq 1:4, ack 1, win 512, options [nop,nop,TS val 3509783897 ecr 3509783897], length 3
2022-04-07 17:46:24.345640 IP (tos 0x0, ttl 64, id 14832, offset 0, flags [DF], proto TCP (6), length 52)
    127.0.0.1.11250 > 127.0.0.1.43094: Flags [.], cksum 0xfe28 (incorrect -> 0x3f5c), seq 1, ack 4, win 512, options [nop,nop,TS val 3509783897 ecr 3509783897], length 0
2022-04-07 17:46:24.345673 IP (tos 0x0, ttl 64, id 14833, offset 0, flags [DF], proto TCP (6), length 54)
    127.0.0.1.11250 > 127.0.0.1.43094: Flags [P.], cksum 0xfe2a (incorrect -> 0x3a52), seq 1:3, ack 4, win 512, options [nop,nop,TS val 3509783897 ecr 3509783897], length 2
2022-04-07 17:46:24.345684 IP (tos 0x0, ttl 64, id 23453, offset 0, flags [DF], proto TCP (6), length 52)
    127.0.0.1.43094 > 127.0.0.1.11250: Flags [.], cksum 0xfe28 (incorrect -> 0x3f5a), seq 4, ack 3, win 512, options [nop,nop,TS val 3509783897 ecr 3509783897], length 0
2022-04-07 17:46:24.376955 IP (tos 0x0, ttl 64, id 23454, offset 0, flags [DF], proto TCP (6), length 62)
    127.0.0.1.43094 > 127.0.0.1.11250: Flags [P.], cksum 0xfe32 (incorrect -> 0x8b63), seq 4:14, ack 3, win 512, options [nop,nop,TS val 3509783928 ecr 3509783897], length 10
2022-04-07 17:46:24.376962 IP (tos 0x0, ttl 64, id 14834, offset 0, flags [DF], proto TCP (6), length 52)
    127.0.0.1.11250 > 127.0.0.1.43094: Flags [.], cksum 0xfe28 (incorrect -> 0x3f12), seq 3, ack 14, win 512, options [nop,nop,TS val 3509783928 ecr 3509783928], length 0
2022-04-07 17:46:24.513584 IP (tos 0x0, ttl 64, id 14835, offset 0, flags [DF], proto TCP (6), length 62)
    127.0.0.1.11250 > 127.0.0.1.43094: Flags [P.], cksum 0xfe32 (incorrect -> 0x3976), seq 3:13, ack 14, win 512, options [nop,nop,TS val 3509784065 ecr 3509783928], length 10
2022-04-07 17:46:24.513590 IP (tos 0x0, ttl 64, id 23455, offset 0, flags [DF], proto TCP (6), length 52)
    127.0.0.1.43094 > 127.0.0.1.11250: Flags [.], cksum 0xfe28 (incorrect -> 0x3df6), seq 14, ack 13, win 512, options [nop,nop,TS val 3509784065 ecr 3509784065], length 0
2022-04-07 17:46:24.519215 IP (tos 0x0, ttl 64, id 23456, offset 0, flags [DF], proto TCP (6), length 569)
    127.0.0.1.43094 > 127.0.0.1.11250: Flags [P.], cksum 0x002e (incorrect -> 0x4f07), seq 14:531, ack 13, win 512, options [nop,nop,TS val 3509784070 ecr 3509784065], length 517
2022-04-07 17:46:24.519220 IP (tos 0x0, ttl 64, id 14836, offset 0, flags [DF], proto TCP (6), length 52)
    127.0.0.1.11250 > 127.0.0.1.43094: Flags [.], cksum 0xfe28 (incorrect -> 0x3beb), seq 13, ack 531, win 508, options [nop,nop,TS val 3509784070 ecr 3509784070], length 0
2022-04-07 17:46:24.758347 IP (tos 0x0, ttl 64, id 14837, offset 0, flags [DF], proto TCP (6), length 1500)
    127.0.0.1.11250 > 127.0.0.1.43094: Flags [P.], cksum 0x03d1 (incorrect -> 0xd0a1), seq 13:1461, ack 531, win 512, options [nop,nop,TS val 3509784310 ecr 3509784070], length 1448
2022-04-07 17:46:24.758353 IP (tos 0x0, ttl 64, id 23457, offset 0, flags [DF], proto TCP (6), length 52)
    127.0.0.1.43094 > 127.0.0.1.11250: Flags [.], cksum 0xfe28 (incorrect -> 0x3469), seq 531, ack 1461, win 502, options [nop,nop,TS val 3509784310 ecr 3509784310], length 0
2022-04-07 17:46:24.777135 IP (tos 0x0, ttl 64, id 14838, offset 0, flags [DF], proto TCP (6), length 1500)
    127.0.0.1.11250 > 127.0.0.1.43094: Flags [P.], cksum 0x03d1 (incorrect -> 0xfe53), seq 1461:2909, ack 531, win 512, options [nop,nop,TS val 3509784328 ecr 3509784310], length 1448
2022-04-07 17:46:24.777140 IP (tos 0x0, ttl 64, id 23458, offset 0, flags [DF], proto TCP (6), length 52)
    127.0.0.1.43094 > 127.0.0.1.11250: Flags [.], cksum 0xfe28 (incorrect -> 0x2e9d), seq 531, ack 2909, win 502, options [nop,nop,TS val 3509784328 ecr 3509784328], length 0
2022-04-07 17:46:25.146523 IP (tos 0x0, ttl 64, id 14839, offset 0, flags [DF], proto TCP (6), length 3122)
    127.0.0.1.11250 > 127.0.0.1.43094: Flags [P.], cksum 0x0a27 (incorrect -> 0x4334), seq 2909:5979, ack 531, win 512, options [nop,nop,TS val 3509784698 ecr 3509784328], length 3070
2022-04-07 17:46:25.146530 IP (tos 0x0, ttl 64, id 23459, offset 0, flags [DF], proto TCP (6), length 52)
    127.0.0.1.43094 > 127.0.0.1.11250: Flags [.], cksum 0xfe28 (incorrect -> 0x1fc1), seq 531, ack 5979, win 496, options [nop,nop,TS val 3509784698 ecr 3509784698], length 0
2022-04-07 17:46:25.147072 IP (tos 0x0, ttl 64, id 23460, offset 0, flags [DF], proto TCP (6), length 132)
    127.0.0.1.43094 > 127.0.0.1.11250: Flags [P.], cksum 0xfe78 (incorrect -> 0x1871), seq 531:611, ack 5979, win 512, options [nop,nop,TS val 3509784698 ecr 3509784698], length 80
2022-04-07 17:46:25.147078 IP (tos 0x0, ttl 64, id 14840, offset 0, flags [DF], proto TCP (6), length 52)
    127.0.0.1.11250 > 127.0.0.1.43094: Flags [.], cksum 0xfe28 (incorrect -> 0x1f61), seq 5979, ack 611, win 512, options [nop,nop,TS val 3509784698 ecr 3509784698], length 0
2022-04-07 17:46:25.147426 IP (tos 0x0, ttl 64, id 23461, offset 0, flags [DF], proto TCP (6), length 395)
    127.0.0.1.43094 > 127.0.0.1.11250: Flags [P.], cksum 0xff7f (incorrect -> 0x2da4), seq 611:954, ack 5979, win 512, options [nop,nop,TS val 3509784699 ecr 3509784698], length 343
2022-04-07 17:46:25.147429 IP (tos 0x0, ttl 64, id 14841, offset 0, flags [DF], proto TCP (6), length 52)
    127.0.0.1.11250 > 127.0.0.1.43094: Flags [.], cksum 0xfe28 (incorrect -> 0x1e0a), seq 5979, ack 954, win 510, options [nop,nop,TS val 3509784699 ecr 3509784699], length 0
2022-04-07 17:46:25.312938 IP (tos 0x0, ttl 64, id 14842, offset 0, flags [DF], proto TCP (6), length 339)
    127.0.0.1.11250 > 127.0.0.1.43094: Flags [P.], cksum 0xff47 (incorrect -> 0xb534), seq 5979:6266, ack 954, win 512, options [nop,nop,TS val 3509784864 ecr 3509784699], length 287
2022-04-07 17:46:25.312946 IP (tos 0x0, ttl 64, id 23462, offset 0, flags [DF], proto TCP (6), length 52)
    127.0.0.1.43094 > 127.0.0.1.11250: Flags [.], cksum 0xfe28 (incorrect -> 0x1ba1), seq 954, ack 6266, win 510, options [nop,nop,TS val 3509784864 ecr 3509784864], length 0
2022-04-07 17:46:25.372596 IP (tos 0x0, ttl 64, id 14843, offset 0, flags [DF], proto TCP (6), length 722)
    127.0.0.1.11250 > 127.0.0.1.43094: Flags [P.], cksum 0x00c7 (incorrect -> 0xc9b6), seq 6266:6936, ack 954, win 512, options [nop,nop,TS val 3509784924 ecr 3509784864], length 670
2022-04-07 17:46:25.372601 IP (tos 0x0, ttl 64, id 23463, offset 0, flags [DF], proto TCP (6), length 52)
    127.0.0.1.43094 > 127.0.0.1.11250: Flags [.], cksum 0xfe28 (incorrect -> 0x1890), seq 954, ack 6936, win 505, options [nop,nop,TS val 3509784924 ecr 3509784924], length 0
2022-04-07 17:46:25.374254 IP (tos 0x0, ttl 64, id 17509, offset 0, flags [DF], proto TCP (6), length 60)
    127.0.0.1.43096 > 127.0.0.1.11250: Flags [S], cksum 0xfe30 (incorrect -> 0xe9c5), seq 2807236620, win 65495, options [mss 65495,sackOK,TS val 3509784926 ecr 0,nop,wscale 7], length 0
2022-04-07 17:46:25.374260 IP (tos 0x0, ttl 64, id 0, offset 0, flags [DF], proto TCP (6), length 60)
    127.0.0.1.11250 > 127.0.0.1.43096: Flags [S.], cksum 0xfe30 (incorrect -> 0x4b37), seq 1311600074, ack 2807236621, win 65483, options [mss 65495,sackOK,TS val 3509784926 ecr 3509784926,nop,wscale 7], length 0
2022-04-07 17:46:25.374265 IP (tos 0x0, ttl 64, id 17510, offset 0, flags [DF], proto TCP (6), length 52)
    127.0.0.1.43096 > 127.0.0.1.11250: Flags [.], cksum 0xfe28 (incorrect -> 0x71f3), seq 1, ack 1, win 512, options [nop,nop,TS val 3509784926 ecr 3509784926], length 0
2022-04-07 17:46:25.374305 IP (tos 0x0, ttl 64, id 17511, offset 0, flags [DF], proto TCP (6), length 55)
    127.0.0.1.43096 > 127.0.0.1.11250: Flags [P.], cksum 0xfe2b (incorrect -> 0x6ce7), seq 1:4, ack 1, win 512, options [nop,nop,TS val 3509784926 ecr 3509784926], length 3
2022-04-07 17:46:25.374308 IP (tos 0x0, ttl 64, id 56161, offset 0, flags [DF], proto TCP (6), length 52)
    127.0.0.1.11250 > 127.0.0.1.43096: Flags [.], cksum 0xfe28 (incorrect -> 0x71f0), seq 1, ack 4, win 512, options [nop,nop,TS val 3509784926 ecr 3509784926], length 0
2022-04-07 17:46:25.374344 IP (tos 0x0, ttl 64, id 56162, offset 0, flags [DF], proto TCP (6), length 54)
    127.0.0.1.11250 > 127.0.0.1.43096: Flags [P.], cksum 0xfe2a (incorrect -> 0x6ce6), seq 1:3, ack 4, win 512, options [nop,nop,TS val 3509784926 ecr 3509784926], length 2
2022-04-07 17:46:25.374348 IP (tos 0x0, ttl 64, id 17512, offset 0, flags [DF], proto TCP (6), length 52)
    127.0.0.1.43096 > 127.0.0.1.11250: Flags [.], cksum 0xfe28 (incorrect -> 0x71ee), seq 4, ack 3, win 512, options [nop,nop,TS val 3509784926 ecr 3509784926], length 0
2022-04-07 17:46:25.375247 IP (tos 0x0, ttl 64, id 17513, offset 0, flags [DF], proto TCP (6), length 62)
    127.0.0.1.43096 > 127.0.0.1.11250: Flags [P.], cksum 0xfe32 (incorrect -> 0xbe15), seq 4:14, ack 3, win 512, options [nop,nop,TS val 3509784927 ecr 3509784926], length 10
2022-04-07 17:46:25.375253 IP (tos 0x0, ttl 64, id 56163, offset 0, flags [DF], proto TCP (6), length 52)
    127.0.0.1.11250 > 127.0.0.1.43096: Flags [.], cksum 0xfe28 (incorrect -> 0x71e2), seq 3, ack 14, win 512, options [nop,nop,TS val 3509784927 ecr 3509784927], length 0
200, 124.3266270160675, 1.8878443241119385