2022-04-07 16:39:20.637972 IP (tos 0x0, ttl 64, id 57965, offset 0, flags [DF], proto TCP (6), length 60)
    127.0.0.1.39440 > 127.0.0.1.11650: Flags [S], cksum 0xfe30 (incorrect -> 0x9f01), seq 259154248, win 65495, options [mss 65495,sackOK,TS val 3505760189 ecr 0,nop,wscale 7], length 0
2022-04-07 16:39:20.637987 IP (tos 0x0, ttl 64, id 0, offset 0, flags [DF], proto TCP (6), length 60)
    127.0.0.1.11650 > 127.0.0.1.39440: Flags [S.], cksum 0xfe30 (incorrect -> 0x6441), seq 3861699546, ack 259154249, win 65483, options [mss 65495,sackOK,TS val 3505760189 ecr 3505760189,nop,wscale 7], length 0
2022-04-07 16:39:20.637999 IP (tos 0x0, ttl 64, id 57966, offset 0, flags [DF], proto TCP (6), length 52)
    127.0.0.1.39440 > 127.0.0.1.11650: Flags [.], cksum 0xfe28 (incorrect -> 0x8afd), seq 1, ack 1, win 512, options [nop,nop,TS val 3505760189 ecr 3505760189], length 0
2022-04-07 16:39:20.638116 IP (tos 0x0, ttl 64, id 57967, offset 0, flags [DF], proto TCP (6), length 55)
    127.0.0.1.39440 > 127.0.0.1.11650: Flags [P.], cksum 0xfe2b (incorrect -> 0x85f1), seq 1:4, ack 1, win 512, options [nop,nop,TS val 3505760189 ecr 3505760189], length 3
2022-04-07 16:39:20.638131 IP (tos 0x0, ttl 64, id 10872, offset 0, flags [DF], proto TCP (6), length 52)
    127.0.0.1.11650 > 127.0.0.1.39440: Flags [.], cksum 0xfe28 (incorrect -> 0x8afa), seq 1, ack 4, win 512, options [nop,nop,TS val 3505760189 ecr 3505760189], length 0
2022-04-07 16:39:20.638204 IP (tos 0x0, ttl 64, id 10873, offset 0, flags [DF], proto TCP (6), length 54)
    127.0.0.1.11650 > 127.0.0.1.39440: Flags [P.], cksum 0xfe2a (incorrect -> 0x85f0), seq 1:3, ack 4, win 512, options [nop,nop,TS val 3505760189 ecr 3505760189], length 2
2022-04-07 16:39:20.638234 IP (tos 0x0, ttl 64, id 57968, offset 0, flags [DF], proto TCP (6), length 52)
    127.0.0.1.39440 > 127.0.0.1.11650: Flags [.], cksum 0xfe28 (incorrect -> 0x8af8), seq 4, ack 3, win 512, options [nop,nop,TS val 3505760189 ecr 3505760189], length 0
2022-04-07 16:39:20.649380 IP (tos 0x0, ttl 64, id 57969, offset 0, flags [DF], proto TCP (6), length 62)
    127.0.0.1.39440 > 127.0.0.1.11650: Flags [P.], cksum 0xfe32 (incorrect -> 0xd524), seq 4:14, ack 3, win 512, options [nop,nop,TS val 3505760201 ecr 3505760189], length 10
2022-04-07 16:39:20.649408 IP (tos 0x0, ttl 64, id 10874, offset 0, flags [DF], proto TCP (6), length 52)
    127.0.0.1.11650 > 127.0.0.1.39440: Flags [.], cksum 0xfe28 (incorrect -> 0x8ad6), seq 3, ack 14, win 512, options [nop,nop,TS val 3505760201 ecr 3505760201], length 0
2022-04-07 16:39:20.722393 IP (tos 0x0, ttl 64, id 10875, offset 0, flags [DF], proto TCP (6), length 62)
    127.0.0.1.11650 > 127.0.0.1.39440: Flags [P.], cksum 0xfe32 (incorrect -> 0x857a), seq 3:13, ack 14, win 512, options [nop,nop,TS val 3505760274 ecr 3505760201], length 10
2022-04-07 16:39:20.722418 IP (tos 0x0, ttl 64, id 57970, offset 0, flags [DF], proto TCP (6), length 52)
    127.0.0.1.39440 > 127.0.0.1.11650: Flags [.], cksum 0xfe28 (incorrect -> 0x8a3a), seq 14, ack 13, win 512, options [nop,nop,TS val 3505760274 ecr 3505760274], length 0
2022-04-07 16:39:20.728020 IP (tos 0x0, ttl 64, id 57971, offset 0, flags [DF], proto TCP (6), length 569)
    127.0.0.1.39440 > 127.0.0.1.11650: Flags [P.], cksum 0x002e (incorrect -> 0x362a), seq 14:531, ack 13, win 512, options [nop,nop,TS val 3505760279 ecr 3505760274], length 517
2022-04-07 16:39:20.728043 IP (tos 0x0, ttl 64, id 10876, offset 0, flags [DF], proto TCP (6), length 52)
    127.0.0.1.11650 > 127.0.0.1.39440: Flags [.], cksum 0xfe28 (incorrect -> 0x882f), seq 13, ack 531, win 508, options [nop,nop,TS val 3505760279 ecr 3505760279], length 0
2022-04-07 16:39:20.803920 IP (tos 0x0, ttl 64, id 10877, offset 0, flags [DF], proto TCP (6), length 3538)
    127.0.0.1.11650 > 127.0.0.1.39440: Flags [P.], cksum 0x0bc7 (incorrect -> 0xb07f), seq 13:3499, ack 531, win 512, options [nop,nop,TS val 3505760355 ecr 3505760279], length 3486
2022-04-07 16:39:20.803938 IP (tos 0x0, ttl 64, id 57972, offset 0, flags [DF], proto TCP (6), length 52)
    127.0.0.1.39440 > 127.0.0.1.11650: Flags [.], cksum 0xfe28 (incorrect -> 0x7a07), seq 531, ack 3499, win 494, options [nop,nop,TS val 3505760355 ecr 3505760355], length 0
2022-04-07 16:39:20.855804 IP (tos 0x0, ttl 64, id 10878, offset 0, flags [DF], proto TCP (6), length 659)
    127.0.0.1.11650 > 127.0.0.1.39440: Flags [P.], cksum 0x0088 (incorrect -> 0xc5a8), seq 3499:4106, ack 531, win 512, options [nop,nop,TS val 3505760407 ecr 3505760355], length 607
2022-04-07 16:39:20.855820 IP (tos 0x0, ttl 64, id 57973, offset 0, flags [DF], proto TCP (6), length 52)
    127.0.0.1.39440 > 127.0.0.1.11650: Flags [.], cksum 0xfe28 (incorrect -> 0x7735), seq 531, ack 4106, win 505, options [nop,nop,TS val 3505760407 ecr 3505760407], length 0
2022-04-07 16:39:20.856189 IP (tos 0x0, ttl 64, id 57974, offset 0, flags [DF], proto TCP (6), length 132)
    127.0.0.1.39440 > 127.0.0.1.11650: Flags [P.], cksum 0xfe78 (incorrect -> 0x8d23), seq 531:611, ack 4106, win 512, options [nop,nop,TS val 3505760407 ecr 3505760407], length 80
2022-04-07 16:39:20.856207 IP (tos 0x0, ttl 64, id 10879, offset 0, flags [DF], proto TCP (6), length 52)
    127.0.0.1.11650 > 127.0.0.1.39440: Flags [.], cksum 0xfe28 (incorrect -> 0x76de), seq 4106, ack 611, win 512, options [nop,nop,TS val 3505760407 ecr 3505760407], length 0
2022-04-07 16:39:20.856523 IP (tos 0x0, ttl 64, id 57975, offset 0, flags [DF], proto TCP (6), length 309)
    127.0.0.1.39440 > 127.0.0.1.11650: Flags [P.], cksum 0xff29 (incorrect -> 0x3b23), seq 611:868, ack 4106, win 512, options [nop,nop,TS val 3505760408 ecr 3505760407], length 257
2022-04-07 16:39:20.856539 IP (tos 0x0, ttl 64, id 10880, offset 0, flags [DF], proto TCP (6), length 52)
    127.0.0.1.11650 > 127.0.0.1.39440: Flags [.], cksum 0xfe28 (incorrect -> 0x75dd), seq 4106, ack 868, win 510, options [nop,nop,TS val 3505760408 ecr 3505760408], length 0
2022-04-07 16:39:20.949323 IP (tos 0x0, ttl 64, id 10881, offset 0, flags [DF], proto TCP (6), length 3084)
    127.0.0.1.11650 > 127.0.0.1.39440: Flags [P.], cksum 0x0a01 (incorrect -> 0x721c), seq 4106:7138, ack 868, win 512, options [nop,nop,TS val 3505760501 ecr 3505760408], length 3032
2022-04-07 16:39:20.949341 IP (tos 0x0, ttl 64, id 57976, offset 0, flags [DF], proto TCP (6), length 52)
    127.0.0.1.39440 > 127.0.0.1.11650: Flags [.], cksum 0xfe28 (incorrect -> 0x6959), seq 868, ack 7138, win 496, options [nop,nop,TS val 3505760501 ecr 3505760501], length 0
2022-04-07 16:39:20.951274 IP (tos 0x0, ttl 64, id 10882, offset 0, flags [DF], proto TCP (6), length 4100)
    127.0.0.1.11650 > 127.0.0.1.39440: Flags [P.], cksum 0x0df9 (incorrect -> 0x6a8d), seq 7138:11186, ack 868, win 512, options [nop,nop,TS val 3505760503 ecr 3505760501], length 4048
2022-04-07 16:39:20.951288 IP (tos 0x0, ttl 64, id 57977, offset 0, flags [DF], proto TCP (6), length 52)
    127.0.0.1.39440 > 127.0.0.1.11650: Flags [.], cksum 0xfe28 (incorrect -> 0x5989), seq 868, ack 11186, win 492, options [nop,nop,TS val 3505760503 ecr 3505760503], length 0
2022-04-07 16:39:20.951296 IP (tos 0x0, ttl 64, id 10883, offset 0, flags [DF], proto TCP (6), length 3474)
    127.0.0.1.11650 > 127.0.0.1.39440: Flags [P.], cksum 0x0b87 (incorrect -> 0x979a), seq 11186:14608, ack 868, win 512, options [nop,nop,TS val 3505760503 ecr 3505760503], length 3422
2022-04-07 16:39:20.951302 IP (tos 0x0, ttl 64, id 57978, offset 0, flags [DF], proto TCP (6), length 52)
    127.0.0.1.39440 > 127.0.0.1.11650: Flags [.], cksum 0xfe28 (incorrect -> 0x4c39), seq 868, ack 14608, win 478, options [nop,nop,TS val 3505760503 ecr 3505760503], length 0
2022-04-07 16:39:20.956113 IP (tos 0x0, ttl 64, id 10884, offset 0, flags [DF], proto TCP (6), length 1546)
    127.0.0.1.11650 > 127.0.0.1.39440: Flags [P.], cksum 0x03ff (incorrect -> 0x1609), seq 14608:16102, ack 868, win 512, options [nop,nop,TS val 3505760507 ecr 3505760503], length 1494
2022-04-07 16:39:20.956135 IP (tos 0x0, ttl 64, id 57979, offset 0, flags [DF], proto TCP (6), length 52)
    127.0.0.1.39440 > 127.0.0.1.11650: Flags [.], cksum 0xfe28 (incorrect -> 0x4643), seq 868, ack 16102, win 502, options [nop,nop,TS val 3505760507 ecr 3505760507], length 0
2022-04-07 16:39:20.965608 IP (tos 0x0, ttl 64, id 10885, offset 0, flags [DF], proto TCP (6), length 2044)
    127.0.0.1.11650 > 127.0.0.1.39440: Flags [P.], cksum 0x05f1 (incorrect -> 0xd3bf), seq 16102:18094, ack 868, win 512, options [nop,nop,TS val 3505760517 ecr 3505760507], length 1992
2022-04-07 16:39:20.965626 IP (tos 0x0, ttl 64, id 57980, offset 0, flags [DF], proto TCP (6), length 52)
    127.0.0.1.39440 > 127.0.0.1.11650: Flags [.], cksum 0xfe28 (incorrect -> 0x3e69), seq 868, ack 18094, win 500, options [nop,nop,TS val 3505760517 ecr 3505760517], length 0
2022-04-07 16:39:20.965691 IP (tos 0x0, ttl 64, id 10886, offset 0, flags [DF], proto TCP (6), length 3538)
    127.0.0.1.11650 > 127.0.0.1.39440: Flags [P.], cksum 0x0bc7 (incorrect -> 0x2b1d), seq 18094:21580, ack 868, win 512, options [nop,nop,TS val 3505760517 ecr 3505760517], length 3486
2022-04-07 16:39:20.965704 IP (tos 0x0, ttl 64, id 57981, offset 0, flags [DF], proto TCP (6), length 52)
    127.0.0.1.39440 > 127.0.0.1.11650: Flags [.], cksum 0xfe28 (incorrect -> 0x30d1), seq 868, ack 21580, win 494, options [nop,nop,TS val 3505760517 ecr 3505760517], length 0
2022-04-07 16:39:20.968670 IP (tos 0x0, ttl 64, id 10887, offset 0, flags [DF], proto TCP (6), length 3130)
    127.0.0.1.11650 > 127.0.0.1.39440: Flags [P.], cksum 0x0a2f (incorrect -> 0x6a85), seq 21580:24658, ack 868, win 512, options [nop,nop,TS val 3505760520 ecr 3505760517], length 3078
2022-04-07 16:39:20.968683 IP (tos 0x0, ttl 64, id 57982, offset 0, flags [DF], proto TCP (6), length 52)
    127.0.0.1.39440 > 127.0.0.1.11650: Flags [.], cksum 0xfe28 (incorrect -> 0x24c4), seq 868, ack 24658, win 495, options [nop,nop,TS val 3505760520 ecr 3505760520], length 0
2022-04-07 16:39:20.968896 IP (tos 0x0, ttl 64, id 10888, offset 0, flags [DF], proto TCP (6), length 4100)
    127.0.0.1.11650 > 127.0.0.1.39440: Flags [P.], cksum 0x0df9 (incorrect -> 0xd5d8), seq 24658:28706, ack 868, win 512, options [nop,nop,TS val 3505760520 ecr 3505760520], length 4048
2022-04-07 16:39:20.968908 IP (tos 0x0, ttl 64, id 57983, offset 0, flags [DF], proto TCP (6), length 52)
    127.0.0.1.39440 > 127.0.0.1.11650: Flags [.], cksum 0xfe28 (incorrect -> 0x14f7), seq 868, ack 28706, win 492, options [nop,nop,TS val 3505760520 ecr 3505760520], length 0
2022-04-07 16:39:20.968918 IP (tos 0x0, ttl 64, id 10889, offset 0, flags [DF], proto TCP (6), length 3270)
    127.0.0.1.11650 > 127.0.0.1.39440: Flags [P.], cksum 0x0abb (incorrect -> 0x57b1), seq 28706:31924, ack 868, win 512, options [nop,nop,TS val 3505760520 ecr 3505760520], length 3218
2022-04-07 16:39:20.968940 IP (tos 0x0, ttl 64, id 57984, offset 0, flags [DF], proto TCP (6), length 52)
    127.0.0.1.39440 > 127.0.0.1.11650: Flags [.], cksum 0xfe28 (incorrect -> 0x0851), seq 868, ack 31924, win 512, options [nop,nop,TS val 3505760520 ecr 3505760520], length 0
2022-04-07 16:39:20.974914 IP (tos 0x0, ttl 64, id 10890, offset 0, flags [DF], proto TCP (6), length 3470)
    127.0.0.1.11650 > 127.0.0.1.39440: Flags [P.], cksum 0x0b83 (incorrect -> 0xb84b), seq 31924:35342, ack 868, win 512, options [nop,nop,TS val 3505760526 ecr 3505760520], length 3418
2022-04-07 16:39:20.974954 IP (tos 0x0, ttl 64, id 57985, offset 0, flags [DF], proto TCP (6), length 52)
    127.0.0.1.39440 > 127.0.0.1.11650: Flags [.], cksum 0xfe28 (incorrect -> 0xfaea), seq 868, ack 35342, win 512, options [nop,nop,TS val 3505760526 ecr 3505760526], length 0
2022-04-07 16:39:20.981984 IP (tos 0x0, ttl 64, id 10891, offset 0, flags [DF], proto TCP (6), length 1478)
    127.0.0.1.11650 > 127.0.0.1.39440: Flags [P.], cksum 0x03bb (incorrect -> 0x4377), seq 35342:36768, ack 868, win 512, options [nop,nop,TS val 3505760533 ecr 3505760526], length 1426
2022-04-07 16:39:20.982020 IP (tos 0x0, ttl 64, id 57986, offset 0, flags [DF], proto TCP (6), length 52)
    127.0.0.1.39440 > 127.0.0.1.11650: Flags [.], cksum 0xfe28 (incorrect -> 0xf54a), seq 868, ack 36768, win 512, options [nop,nop,TS val 3505760533 ecr 3505760533], length 0
2022-04-07 16:39:20.997701 IP (tos 0x0, ttl 64, id 10892, offset 0, flags [DF], proto TCP (6), length 4100)
    127.0.0.1.11650 > 127.0.0.1.39440: Flags [P.], cksum 0x0df9 (incorrect -> 0x0b91), seq 36768:40816, ack 868, win 512, options [nop,nop,TS val 3505760549 ecr 3505760533], length 4048
2022-04-07 16:39:21.038788 IP (tos 0x0, ttl 64, id 57987, offset 0, flags [DF], proto TCP (6), length 52)
    127.0.0.1.39440 > 127.0.0.1.11650: Flags [.], cksum 0xfe28 (incorrect -> 0xe531), seq 868, ack 40816, win 512, options [nop,nop,TS val 3505760590 ecr 3505760549], length 0
2022-04-07 16:39:21.038804 IP (tos 0x0, ttl 64, id 10893, offset 0, flags [DF], proto TCP (6), length 28724)
    127.0.0.1.11650 > 127.0.0.1.39440: Flags [P.], cksum 0x6e29 (incorrect -> 0x653f), seq 40816:69488, ack 868, win 512, options [nop,nop,TS val 3505760590 ecr 3505760590], length 28672
2022-04-07 16:39:21.082794 IP (tos 0x0, ttl 64, id 57988, offset 0, flags [DF], proto TCP (6), length 52)
    127.0.0.1.39440 > 127.0.0.1.11650: Flags [.], cksum 0xfe28 (incorrect -> 0x74dc), seq 868, ack 69488, win 512, options [nop,nop,TS val 3505760634 ecr 3505760590], length 0
2022-04-07 16:39:21.082809 IP (tos 0x0, ttl 64, id 10894, offset 0, flags [DF], proto TCP (6), length 10838)
    127.0.0.1.11650 > 127.0.0.1.39440: Flags [P.], cksum 0x284b (incorrect -> 0xdcb9), seq 69488:80274, ack 868, win 512, options [nop,nop,TS val 3505760634 ecr 3505760634], length 10786
2022-04-07 16:39:21.082835 IP (tos 0x0, ttl 64, id 57989, offset 0, flags [DF], proto TCP (6), length 52)
    127.0.0.1.39440 > 127.0.0.1.11650: Flags [.], cksum 0xfe28 (incorrect -> 0x4a8e), seq 868, ack 80274, win 512, options [nop,nop,TS val 3505760634 ecr 3505760634], length 0
2022-04-07 16:39:21.082909 IP (tos 0x0, ttl 64, id 10895, offset 0, flags [DF], proto TCP (6), length 2972)
    127.0.0.1.11650 > 127.0.0.1.39440: Flags [P.], cksum 0x0991 (incorrect -> 0xbd9c), seq 80274:83194, ack 868, win 512, options [nop,nop,TS val 3505760634 ecr 3505760634], length 2920
2022-04-07 16:39:21.082949 IP (tos 0x0, ttl 64, id 57990, offset 0, flags [DF], proto TCP (6), length 52)
    127.0.0.1.39440 > 127.0.0.1.11650: Flags [.], cksum 0xfe28 (incorrect -> 0x3f26), seq 868, ack 83194, win 512, options [nop,nop,TS val 3505760634 ecr 3505760634], length 0
2022-04-07 16:39:21.087745 IP (tos 0x0, ttl 64, id 10896, offset 0, flags [DF], proto TCP (6), length 3538)
    127.0.0.1.11650 > 127.0.0.1.39440: Flags [P.], cksum 0x0bc7 (incorrect -> 0xee9f), seq 83194:86680, ack 868, win 512, options [nop,nop,TS val 3505760639 ecr 3505760634], length 3486
2022-04-07 16:39:21.088270 IP (tos 0x0, ttl 64, id 57991, offset 0, flags [DF], proto TCP (6), length 52)
    127.0.0.1.39440 > 127.0.0.1.11650: Flags [.], cksum 0xfe28 (incorrect -> 0x317d), seq 868, ack 86680, win 512, options [nop,nop,TS val 3505760640 ecr 3505760639], length 0
2022-04-07 16:39:21.098861 IP (tos 0x0, ttl 64, id 10897, offset 0, flags [DF], proto TCP (6), length 946)
    127.0.0.1.11650 > 127.0.0.1.39440: Flags [P.], cksum 0x01a7 (incorrect -> 0x8e09), seq 86680:87574, ack 868, win 512, options [nop,nop,TS val 3505760650 ecr 3505760640], length 894
2022-04-07 16:39:21.098883 IP (tos 0x0, ttl 64, id 57992, offset 0, flags [DF], proto TCP (6), length 52)
    127.0.0.1.39440 > 127.0.0.1.11650: Flags [.], cksum 0xfe28 (incorrect -> 0x2dea), seq 868, ack 87574, win 512, options [nop,nop,TS val 3505760650 ecr 3505760650], length 0
2022-04-07 16:39:21.109541 IP (tos 0x0, ttl 64, id 10898, offset 0, flags [DF], proto TCP (6), length 3538)
    127.0.0.1.11650 > 127.0.0.1.39440: Flags [P.], cksum 0x0bc7 (incorrect -> 0x4bd8), seq 87574:91060, ack 868, win 512, options [nop,nop,TS val 3505760661 ecr 3505760650], length 3486
2022-04-07 16:39:21.109557 IP (tos 0x0, ttl 64, id 57993, offset 0, flags [DF], proto TCP (6), length 52)
    127.0.0.1.39440 > 127.0.0.1.11650: Flags [.], cksum 0xfe28 (incorrect -> 0x2036), seq 868, ack 91060, win 512, options [nop,nop,TS val 3505760661 ecr 3505760661], length 0
2022-04-07 16:39:21.115107 IP (tos 0x0, ttl 64, id 10899, offset 0, flags [DF], proto TCP (6), length 1048)
    127.0.0.1.11650 > 127.0.0.1.39440: Flags [P.], cksum 0x020d (incorrect -> 0x9a10), seq 91060:92056, ack 868, win 512, options [nop,nop,TS val 3505760666 ecr 3505760661], length 996
2022-04-07 16:39:21.115124 IP (tos 0x0, ttl 64, id 57994, offset 0, flags [DF], proto TCP (6), length 52)
    127.0.0.1.39440 > 127.0.0.1.11650: Flags [.], cksum 0xfe28 (incorrect -> 0x1c48), seq 868, ack 92056, win 512, options [nop,nop,TS val 3505760666 ecr 3505760666], length 0
2022-04-07 16:39:21.122620 IP (tos 0x0, ttl 64, id 10900, offset 0, flags [DF], proto TCP (6), length 3368)
    127.0.0.1.11650 > 127.0.0.1.39440: Flags [P.], cksum 0x0b1d (incorrect -> 0x5fa3), seq 92056:95372, ack 868, win 512, options [nop,nop,TS val 3505760674 ecr 3505760666], length 3316
2022-04-07 16:39:21.122636 IP (tos 0x0, ttl 64, id 57995, offset 0, flags [DF], proto TCP (6), length 52)
    127.0.0.1.39440 > 127.0.0.1.11650: Flags [.], cksum 0xfe28 (incorrect -> 0x0f44), seq 868, ack 95372, win 512, options [nop,nop,TS val 3505760674 ecr 3505760674], length 0
2022-04-07 16:39:21.125766 IP (tos 0x0, ttl 64, id 10901, offset 0, flags [DF], proto TCP (6), length 1048)
    127.0.0.1.11650 > 127.0.0.1.39440: Flags [P.], cksum 0x020d (incorrect -> 0xbe63), seq 95372:96368, ack 868, win 512, options [nop,nop,TS val 3505760677 ecr 3505760674], length 996
2022-04-07 16:39:21.125785 IP (tos 0x0, ttl 64, id 57996, offset 0, flags [DF], proto TCP (6), length 52)
    127.0.0.1.39440 > 127.0.0.1.11650: Flags [.], cksum 0xfe28 (incorrect -> 0x0b5a), seq 868, ack 96368, win 512, options [nop,nop,TS val 3505760677 ecr 3505760677], length 0
2022-04-07 16:39:21.131370 IP (tos 0x0, ttl 64, id 10902, offset 0, flags [DF], proto TCP (6), length 1546)
    127.0.0.1.11650 > 127.0.0.1.39440: Flags [P.], cksum 0x03ff (incorrect -> 0xbc25), seq 96368:97862, ack 868, win 512, options [nop,nop,TS val 3505760683 ecr 3505760677], length 1494
2022-04-07 16:39:21.131386 IP (tos 0x0, ttl 64, id 57997, offset 0, flags [DF], proto TCP (6), length 52)
    127.0.0.1.39440 > 127.0.0.1.11650: Flags [.], cksum 0xfe28 (incorrect -> 0x0578), seq 868, ack 97862, win 512, options [nop,nop,TS val 3505760683 ecr 3505760683], length 0
2022-04-07 16:39:21.133326 IP (tos 0x0, ttl 64, id 10903, offset 0, flags [DF], proto TCP (6), length 3538)
    127.0.0.1.11650 > 127.0.0.1.39440: Flags [P.], cksum 0x0bc7 (incorrect -> 0x20b7), seq 97862:101348, ack 868, win 512, options [nop,nop,TS val 3505760685 ecr 3505760683], length 3486
2022-04-07 16:39:21.134095 IP (tos 0x0, ttl 64, id 57998, offset 0, flags [DF], proto TCP (6), length 52)
    127.0.0.1.39440 > 127.0.0.1.11650: Flags [.], cksum 0xfe28 (incorrect -> 0xf7d5), seq 868, ack 101348, win 512, options [nop,nop,TS val 3505760685 ecr 3505760685], length 0
2022-04-07 16:39:21.134611 IP (tos 0x0, ttl 64, id 10904, offset 0, flags [DF], proto TCP (6), length 4036)
    127.0.0.1.11650 > 127.0.0.1.39440: Flags [P.], cksum 0x0db9 (incorrect -> 0x795e), seq 101348:105332, ack 868, win 512, options [nop,nop,TS val 3505760686 ecr 3505760685], length 3984
2022-04-07 16:39:21.134625 IP (tos 0x0, ttl 64, id 57999, offset 0, flags [DF], proto TCP (6), length 52)
    127.0.0.1.39440 > 127.0.0.1.11650: Flags [.], cksum 0xfe28 (incorrect -> 0xe843), seq 868, ack 105332, win 512, options [nop,nop,TS val 3505760686 ecr 3505760686], length 0
2022-04-07 16:39:21.134755 IP (tos 0x0, ttl 64, id 10905, offset 0, flags [DF], proto TCP (6), length 4100)
    127.0.0.1.11650 > 127.0.0.1.39440: Flags [P.], cksum 0x0df9 (incorrect -> 0x6415), seq 105332:109380, ack 868, win 512, options [nop,nop,TS val 3505760686 ecr 3505760686], length 4048
2022-04-07 16:39:21.135202 IP (tos 0x0, ttl 64, id 58000, offset 0, flags [DF], proto TCP (6), length 52)
    127.0.0.1.39440 > 127.0.0.1.11650: Flags [.], cksum 0xfe28 (incorrect -> 0xd873), seq 868, ack 109380, win 512, options [nop,nop,TS val 3505760686 ecr 3505760686], length 0
2022-04-07 16:39:21.135209 IP (tos 0x0, ttl 64, id 10906, offset 0, flags [DF], proto TCP (6), length 2036)
    127.0.0.1.11650 > 127.0.0.1.39440: Flags [P.], cksum 0x05e9 (incorrect -> 0x265d), seq 109380:111364, ack 868, win 512, options [nop,nop,TS val 3505760686 ecr 3505760686], length 1984
2022-04-07 16:39:21.135215 IP (tos 0x0, ttl 64, id 58001, offset 0, flags [DF], proto TCP (6), length 52)
    127.0.0.1.39440 > 127.0.0.1.11650: Flags [.], cksum 0xfe28 (incorrect -> 0xd0b3), seq 868, ack 111364, win 512, options [nop,nop,TS val 3505760686 ecr 3505760686], length 0
2022-04-07 16:39:21.148119 IP (tos 0x0, ttl 64, id 10907, offset 0, flags [DF], proto TCP (6), length 2870)
    127.0.0.1.11650 > 127.0.0.1.39440: Flags [P.], cksum 0x092b (incorrect -> 0xb572), seq 111364:114182, ack 868, win 512, options [nop,nop,TS val 3505760699 ecr 3505760686], length 2818
2022-04-07 16:39:21.149899 IP (tos 0x0, ttl 64, id 58002, offset 0, flags [DF], proto TCP (6), length 52)
    127.0.0.1.39440 > 127.0.0.1.11650: Flags [.], cksum 0xfe28 (incorrect -> 0xc595), seq 868, ack 114182, win 512, options [nop,nop,TS val 3505760701 ecr 3505760699], length 0
2022-04-07 16:39:21.149926 IP (tos 0x0, ttl 64, id 10908, offset 0, flags [DF], proto TCP (6), length 9514)
    127.0.0.1.11650 > 127.0.0.1.39440: Flags [P.], cksum 0x231f (incorrect -> 0xb3e4), seq 114182:123644, ack 868, win 512, options [nop,nop,TS val 3505760701 ecr 3505760701], length 9462
2022-04-07 16:39:21.149936 IP (tos 0x0, ttl 64, id 58003, offset 0, flags [DF], proto TCP (6), length 52)
    127.0.0.1.39440 > 127.0.0.1.11650: Flags [.], cksum 0xfe28 (incorrect -> 0xa09d), seq 868, ack 123644, win 512, options [nop,nop,TS val 3505760701 ecr 3505760701], length 0
2022-04-07 16:39:21.151938 IP (tos 0x0, ttl 64, id 10909, offset 0, flags [DF], proto TCP (6), length 4100)
    127.0.0.1.11650 > 127.0.0.1.39440: Flags [P.], cksum 0x0df9 (incorrect -> 0x9861), seq 123644:127692, ack 868, win 512, options [nop,nop,TS val 3505760703 ecr 3505760701], length 4048
2022-04-07 16:39:21.152435 IP (tos 0x0, ttl 64, id 58004, offset 0, flags [DF], proto TCP (6), length 52)
    127.0.0.1.39440 > 127.0.0.1.11650: Flags [.], cksum 0xfe28 (incorrect -> 0x90c8), seq 868, ack 127692, win 512, options [nop,nop,TS val 3505760704 ecr 3505760703], length 0
2022-04-07 16:39:21.152442 IP (tos 0x0, ttl 64, id 10910, offset 0, flags [DF], proto TCP (6), length 2670)
    127.0.0.1.11650 > 127.0.0.1.39440: Flags [P.], cksum 0x0863 (incorrect -> 0xaaa3), seq 127692:130310, ack 868, win 512, options [nop,nop,TS val 3505760704 ecr 3505760704], length 2618
2022-04-07 16:39:21.152448 IP (tos 0x0, ttl 64, id 58005, offset 0, flags [DF], proto TCP (6), length 52)
    127.0.0.1.39440 > 127.0.0.1.11650: Flags [.], cksum 0xfe28 (incorrect -> 0x868d), seq 868, ack 130310, win 512, options [nop,nop,TS val 3505760704 ecr 3505760704], length 0
2022-04-07 16:39:21.165031 IP (tos 0x0, ttl 64, id 10911, offset 0, flags [DF], proto TCP (6), length 3368)
    127.0.0.1.11650 > 127.0.0.1.39440: Flags [P.], cksum 0x0b1d (incorrect -> 0x03d9), seq 130310:133626, ack 868, win 512, options [nop,nop,TS val 3505760716 ecr 3505760704], length 3316
2022-04-07 16:39:21.165727 IP (tos 0x0, ttl 64, id 58006, offset 0, flags [DF], proto TCP (6), length 52)
    127.0.0.1.39440 > 127.0.0.1.11650: Flags [.], cksum 0xfe28 (incorrect -> 0x7980), seq 868, ack 133626, win 512, options [nop,nop,TS val 3505760717 ecr 3505760716], length 0
2022-04-07 16:39:21.165739 IP (tos 0x0, ttl 64, id 10912, offset 0, flags [DF], proto TCP (6), length 3538)
    127.0.0.1.11650 > 127.0.0.1.39440: Flags [P.], cksum 0x0bc7 (incorrect -> 0x9823), seq 133626:137112, ack 868, win 512, options [nop,nop,TS val 3505760717 ecr 3505760717], length 3486
2022-04-07 16:39:21.165746 IP (tos 0x0, ttl 64, id 58007, offset 0, flags [DF], proto TCP (6), length 52)
    127.0.0.1.39440 > 127.0.0.1.11650: Flags [.], cksum 0xfe28 (incorrect -> 0x6be1), seq 868, ack 137112, win 512, options [nop,nop,TS val 3505760717 ecr 3505760717], length 0
2022-04-07 16:39:21.168067 IP (tos 0x0, ttl 64, id 10913, offset 0, flags [DF], proto TCP (6), length 4100)
    127.0.0.1.11650 > 127.0.0.1.39440: Flags [P.], cksum 0x0df9 (incorrect -> 0x69a7), seq 137112:141160, ack 868, win 512, options [nop,nop,TS val 3505760719 ecr 3505760717], length 4048
2022-04-07 16:39:21.168094 IP (tos 0x0, ttl 64, id 58008, offset 0, flags [DF], proto TCP (6), length 52)
    127.0.0.1.39440 > 127.0.0.1.11650: Flags [.], cksum 0xfe28 (incorrect -> 0x5c0d), seq 868, ack 141160, win 512, options [nop,nop,TS val 3505760719 ecr 3505760719], length 0
2022-04-07 16:39:21.168100 IP (tos 0x0, ttl 64, id 10914, offset 0, flags [DF], proto TCP (6), length 486)
    127.0.0.1.11650 > 127.0.0.1.39440: Flags [P.], cksum 0xffda (incorrect -> 0x0686), seq 141160:141594, ack 868, win 512, options [nop,nop,TS val 3505760719 ecr 3505760719], length 434
2022-04-07 16:39:21.168106 IP (tos 0x0, ttl 64, id 58009, offset 0, flags [DF], proto TCP (6), length 52)
    127.0.0.1.39440 > 127.0.0.1.11650: Flags [.], cksum 0xfe28 (incorrect -> 0x5a5b), seq 868, ack 141594, win 512, options [nop,nop,TS val 3505760719 ecr 3505760719], length 0
2022-04-07 16:39:21.171197 IP (tos 0x0, ttl 64, id 10915, offset 0, flags [DF], proto TCP (6), length 3538)
    127.0.0.1.11650 > 127.0.0.1.39440: Flags [P.], cksum 0x0bc7 (incorrect -> 0x4968), seq 141594:145080, ack 868, win 512, options [nop,nop,TS val 3505760722 ecr 3505760719], length 3486
2022-04-07 16:39:21.171213 IP (tos 0x0, ttl 64, id 58010, offset 0, flags [DF], proto TCP (6), length 52)
    127.0.0.1.39440 > 127.0.0.1.11650: Flags [.], cksum 0xfe28 (incorrect -> 0x4cb7), seq 868, ack 145080, win 512, options [nop,nop,TS val 3505760722 ecr 3505760722], length 0
2022-04-07 16:39:21.187124 IP (tos 0x0, ttl 64, id 10916, offset 0, flags [DF], proto TCP (6), length 1048)
    127.0.0.1.11650 > 127.0.0.1.39440: Flags [P.], cksum 0x020d (incorrect -> 0x518f), seq 145080:146076, ack 868, win 512, options [nop,nop,TS val 3505760738 ecr 3505760722], length 996
2022-04-07 16:39:21.187148 IP (tos 0x0, ttl 64, id 58011, offset 0, flags [DF], proto TCP (6), length 52)
    127.0.0.1.39440 > 127.0.0.1.11650: Flags [.], cksum 0xfe28 (incorrect -> 0x48b3), seq 868, ack 146076, win 512, options [nop,nop,TS val 3505760738 ecr 3505760738], length 0
2022-04-07 16:39:21.188122 IP (tos 0x0, ttl 64, id 10917, offset 0, flags [DF], proto TCP (6), length 4036)
    127.0.0.1.11650 > 127.0.0.1.39440: Flags [P.], cksum 0x0db9 (incorrect -> 0x4445), seq 146076:150060, ack 868, win 512, options [nop,nop,TS val 3505760739 ecr 3505760738], length 3984
2022-04-07 16:39:21.189012 IP (tos 0x0, ttl 64, id 58012, offset 0, flags [DF], proto TCP (6), length 52)
    127.0.0.1.39440 > 127.0.0.1.11650: Flags [.], cksum 0xfe28 (incorrect -> 0x3920), seq 868, ack 150060, win 512, options [nop,nop,TS val 3505760740 ecr 3505760739], length 0
2022-04-07 16:39:21.211136 IP (tos 0x0, ttl 64, id 10918, offset 0, flags [DF], proto TCP (6), length 4036)
    127.0.0.1.11650 > 127.0.0.1.39440: Flags [P.], cksum 0x0db9 (incorrect -> 0xde60), seq 150060:154044, ack 868, win 512, options [nop,nop,TS val 3505760762 ecr 3505760740], length 3984
2022-04-07 16:39:21.258786 IP (tos 0x0, ttl 64, id 58013, offset 0, flags [DF], proto TCP (6), length 52)
    127.0.0.1.39440 > 127.0.0.1.11650: Flags [.], cksum 0xfe28 (incorrect -> 0x2933), seq 868, ack 154044, win 512, options [nop,nop,TS val 3505760810 ecr 3505760762], length 0
2022-04-07 16:39:21.258800 IP (tos 0x0, ttl 64, id 10919, offset 0, flags [DF], proto TCP (6), length 15376)
    127.0.0.1.11650 > 127.0.0.1.39440: Flags [P.], cksum 0x3a05 (incorrect -> 0xd766), seq 154044:169368, ack 868, win 512, options [nop,nop,TS val 3505760810 ecr 3505760810], length 15324
2022-04-07 16:39:21.302829 IP (tos 0x0, ttl 64, id 58014, offset 0, flags [DF], proto TCP (6), length 52)
    127.0.0.1.39440 > 127.0.0.1.11650: Flags [.], cksum 0xfe28 (incorrect -> 0xecfa), seq 868, ack 169368, win 512, options [nop,nop,TS val 3505760854 ecr 3505760810], length 0
2022-04-07 16:39:21.302839 IP (tos 0x0, ttl 64, id 10920, offset 0, flags [DF], proto TCP (6), length 7714)
    127.0.0.1.11650 > 127.0.0.1.39440: Flags [P.], cksum 0x1c17 (incorrect -> 0x6e01), seq 169368:177030, ack 868, win 512, options [nop,nop,TS val 3505760854 ecr 3505760854], length 7662
2022-04-07 16:39:21.303707 IP (tos 0x0, ttl 64, id 58015, offset 0, flags [DF], proto TCP (6), length 52)
    127.0.0.1.39440 > 127.0.0.1.11650: Flags [.], cksum 0xfe28 (incorrect -> 0xcedf), seq 868, ack 177030, win 512, options [nop,nop,TS val 3505760855 ecr 3505760854], length 0
2022-04-07 16:39:21.305000 IP (tos 0x0, ttl 64, id 10921, offset 0, flags [DF], proto TCP (6), length 4036)
    127.0.0.1.11650 > 127.0.0.1.39440: Flags [P.], cksum 0x0db9 (incorrect -> 0x316f), seq 177030:181014, ack 868, win 512, options [nop,nop,TS val 3505760856 ecr 3505760855], length 3984
2022-04-07 16:39:21.305046 IP (tos 0x0, ttl 64, id 58016, offset 0, flags [DF], proto TCP (6), length 52)
    127.0.0.1.39440 > 127.0.0.1.11650: Flags [.], cksum 0xfe28 (incorrect -> 0xbf4c), seq 868, ack 181014, win 512, options [nop,nop,TS val 3505760856 ecr 3505760856], length 0
2022-04-07 16:39:21.310923 IP (tos 0x0, ttl 64, id 10922, offset 0, flags [DF], proto TCP (6), length 4036)
    127.0.0.1.11650 > 127.0.0.1.39440: Flags [P.], cksum 0x0db9 (incorrect -> 0x32b4), seq 181014:184998, ack 868, win 512, options [nop,nop,TS val 3505760862 ecr 3505760856], length 3984
2022-04-07 16:39:21.349721 IP (tos 0x0, ttl 64, id 10923, offset 0, flags [DF], proto TCP (6), length 32820)
    127.0.0.1.11650 > 127.0.0.1.39440: Flags [.], cksum 0x7e29 (incorrect -> 0xc715), seq 184998:217766, ack 868, win 512, options [nop,nop,TS val 3505760901 ecr 3505760856], length 32768
2022-04-07 16:39:21.349733 IP (tos 0x0, ttl 64, id 58017, offset 0, flags [DF], proto TCP (6), length 52)
    127.0.0.1.39440 > 127.0.0.1.11650: Flags [.], cksum 0xfe28 (incorrect -> 0x300e), seq 868, ack 217766, win 379, options [nop,nop,TS val 3505760901 ecr 3505760862], length 0
2022-04-07 16:39:21.349755 IP (tos 0x0, ttl 64, id 10924, offset 0, flags [DF], proto TCP (6), length 132)
    127.0.0.1.11650 > 127.0.0.1.39440: Flags [P.], cksum 0xfe78 (incorrect -> 0x603e), seq 217766:217846, ack 868, win 512, options [nop,nop,TS val 3505760901 ecr 3505760901], length 80
2022-04-07 16:39:21.351377 IP (tos 0x0, ttl 64, id 58018, offset 0, flags [DF], proto TCP (6), length 52)
    127.0.0.1.39440 > 127.0.0.1.11650: Flags [.], cksum 0xfe28 (incorrect -> 0x2f10), seq 868, ack 217846, win 512, options [nop,nop,TS val 3505760903 ecr 3505760901], length 0
2022-04-07 16:39:21.360607 IP (tos 0x0, ttl 64, id 10925, offset 0, flags [DF], proto TCP (6), length 2542)
    127.0.0.1.11650 > 127.0.0.1.39440: Flags [P.], cksum 0x07e3 (incorrect -> 0xf6db), seq 217846:220336, ack 868, win 512, options [nop,nop,TS val 3505760912 ecr 3505760903], length 2490
2022-04-07 16:39:21.360634 IP (tos 0x0, ttl 64, id 58019, offset 0, flags [DF], proto TCP (6), length 52)
    127.0.0.1.39440 > 127.0.0.1.11650: Flags [.], cksum 0xfe28 (incorrect -> 0x2542), seq 868, ack 220336, win 512, options [nop,nop,TS val 3505760912 ecr 3505760912], length 0
2022-04-07 16:39:21.362663 IP (tos 0x0, ttl 64, id 10926, offset 0, flags [DF], proto TCP (6), length 3060)
    127.0.0.1.11650 > 127.0.0.1.39440: Flags [P.], cksum 0x09e9 (incorrect -> 0xe48b), seq 220336:223344, ack 868, win 512, options [nop,nop,TS val 3505760914 ecr 3505760912], length 3008
2022-04-07 16:39:21.362679 IP (tos 0x0, ttl 64, id 58020, offset 0, flags [DF], proto TCP (6), length 52)
    127.0.0.1.39440 > 127.0.0.1.11650: Flags [.], cksum 0xfe28 (incorrect -> 0x197e), seq 868, ack 223344, win 512, options [nop,nop,TS val 3505760914 ecr 3505760914], length 0
2022-04-07 16:39:21.362853 IP (tos 0x0, ttl 64, id 10927, offset 0, flags [DF], proto TCP (6), length 4100)
    127.0.0.1.11650 > 127.0.0.1.39440: Flags [P.], cksum 0x0df9 (incorrect -> 0x7498), seq 223344:227392, ack 868, win 512, options [nop,nop,TS val 3505760914 ecr 3505760914], length 4048
2022-04-07 16:39:21.362878 IP (tos 0x0, ttl 64, id 58021, offset 0, flags [DF], proto TCP (6), length 52)
    127.0.0.1.39440 > 127.0.0.1.11650: Flags [.], cksum 0xfe28 (incorrect -> 0x09ae), seq 868, ack 227392, win 512, options [nop,nop,TS val 3505760914 ecr 3505760914], length 0
2022-04-07 16:39:21.362885 IP (tos 0x0, ttl 64, id 10928, offset 0, flags [DF], proto TCP (6), length 3972)
    127.0.0.1.11650 > 127.0.0.1.39440: Flags [P.], cksum 0x0d79 (incorrect -> 0x051e), seq 227392:231312, ack 868, win 512, options [nop,nop,TS val 3505760914 ecr 3505760914], length 3920
2022-04-07 16:39:21.362891 IP (tos 0x0, ttl 64, id 58022, offset 0, flags [DF], proto TCP (6), length 52)
    127.0.0.1.39440 > 127.0.0.1.11650: Flags [.], cksum 0xfe28 (incorrect -> 0xfa5d), seq 868, ack 231312, win 512, options [nop,nop,TS val 3505760914 ecr 3505760914], length 0
2022-04-07 16:39:21.368185 IP (tos 0x0, ttl 64, id 10929, offset 0, flags [DF], proto TCP (6), length 2044)
    127.0.0.1.11650 > 127.0.0.1.39440: Flags [P.], cksum 0x05f1 (incorrect -> 0xb5ae), seq 231312:233304, ack 868, win 512, options [nop,nop,TS val 3505760919 ecr 3505760914], length 1992
2022-04-07 16:39:21.368992 IP (tos 0x0, ttl 64, id 58023, offset 0, flags [DF], proto TCP (6), length 52)
    127.0.0.1.39440 > 127.0.0.1.11650: Flags [.], cksum 0xfe28 (incorrect -> 0xf28a), seq 868, ack 233304, win 512, options [nop,nop,TS val 3505760920 ecr 3505760919], length 0
2022-04-07 16:39:21.387530 IP (tos 0x0, ttl 64, id 10930, offset 0, flags [DF], proto TCP (6), length 3570)
    127.0.0.1.11650 > 127.0.0.1.39440: Flags [P.], cksum 0x0be7 (incorrect -> 0x0a6a), seq 233304:236822, ack 868, win 512, options [nop,nop,TS val 3505760939 ecr 3505760920], length 3518
2022-04-07 16:39:21.387555 IP (tos 0x0, ttl 64, id 58024, offset 0, flags [DF], proto TCP (6), length 52)
    127.0.0.1.39440 > 127.0.0.1.11650: Flags [.], cksum 0xfe28 (incorrect -> 0xe4a5), seq 868, ack 236822, win 512, options [nop,nop,TS val 3505760939 ecr 3505760939], length 0
2022-04-07 16:39:21.387616 IP (tos 0x0, ttl 64, id 10931, offset 0, flags [DF], proto TCP (6), length 4100)
    127.0.0.1.11650 > 127.0.0.1.39440: Flags [P.], cksum 0x0df9 (incorrect -> 0x6d41), seq 236822:240870, ack 868, win 512, options [nop,nop,TS val 3505760939 ecr 3505760939], length 4048
2022-04-07 16:39:21.387655 IP (tos 0x0, ttl 64, id 58025, offset 0, flags [DF], proto TCP (6), length 52)
    127.0.0.1.39440 > 127.0.0.1.11650: Flags [.], cksum 0xfe28 (incorrect -> 0xd4d5), seq 868, ack 240870, win 512, options [nop,nop,TS val 3505760939 ecr 3505760939], length 0
200, 3.987933397293091, 1.0367822647094727