2022-04-07 08:02:11.452365 IP (tos 0x0, ttl 64, id 39841, offset 0, flags [DF], proto TCP (6), length 60)
    127.0.0.1.38144 > 127.0.0.1.11850: Flags [S], cksum 0xfe30 (incorrect -> 0xffbe), seq 4085617163, win 65495, options [mss 65495,sackOK,TS val 400813955 ecr 0,nop,wscale 7], length 0
2022-04-07 08:02:11.452375 IP (tos 0x0, ttl 64, id 0, offset 0, flags [DF], proto TCP (6), length 60)
    127.0.0.1.11850 > 127.0.0.1.38144: Flags [S.], cksum 0xfe30 (incorrect -> 0x86c6), seq 3938223823, ack 4085617164, win 65483, options [mss 65495,sackOK,TS val 400813955 ecr 400813955,nop,wscale 7], length 0
2022-04-07 08:02:11.452384 IP (tos 0x0, ttl 64, id 39842, offset 0, flags [DF], proto TCP (6), length 52)
    127.0.0.1.38144 > 127.0.0.1.11850: Flags [.], cksum 0xfe28 (incorrect -> 0xad82), seq 1, ack 1, win 512, options [nop,nop,TS val 400813955 ecr 400813955], length 0
2022-04-07 08:02:11.452479 IP (tos 0x0, ttl 64, id 39843, offset 0, flags [DF], proto TCP (6), length 55)
    127.0.0.1.38144 > 127.0.0.1.11850: Flags [P.], cksum 0xfe2b (incorrect -> 0xa876), seq 1:4, ack 1, win 512, options [nop,nop,TS val 400813955 ecr 400813955], length 3
2022-04-07 08:02:11.452494 IP (tos 0x0, ttl 64, id 41674, offset 0, flags [DF], proto TCP (6), length 52)
    127.0.0.1.11850 > 127.0.0.1.38144: Flags [.], cksum 0xfe28 (incorrect -> 0xad7f), seq 1, ack 4, win 512, options [nop,nop,TS val 400813955 ecr 400813955], length 0
2022-04-07 08:02:11.452529 IP (tos 0x0, ttl 64, id 41675, offset 0, flags [DF], proto TCP (6), length 54)
    127.0.0.1.11850 > 127.0.0.1.38144: Flags [P.], cksum 0xfe2a (incorrect -> 0xa875), seq 1:3, ack 4, win 512, options [nop,nop,TS val 400813955 ecr 400813955], length 2
2022-04-07 08:02:11.452546 IP (tos 0x0, ttl 64, id 39844, offset 0, flags [DF], proto TCP (6), length 52)
    127.0.0.1.38144 > 127.0.0.1.11850: Flags [.], cksum 0xfe28 (incorrect -> 0xad7d), seq 4, ack 3, win 512, options [nop,nop,TS val 400813955 ecr 400813955], length 0
2022-04-07 08:02:11.463648 IP (tos 0x0, ttl 64, id 39845, offset 0, flags [DF], proto TCP (6), length 62)
    127.0.0.1.38144 > 127.0.0.1.11850: Flags [P.], cksum 0xfe32 (incorrect -> 0x07f3), seq 4:14, ack 3, win 512, options [nop,nop,TS val 400813966 ecr 400813955], length 10
2022-04-07 08:02:11.463669 IP (tos 0x0, ttl 64, id 41676, offset 0, flags [DF], proto TCP (6), length 52)
    127.0.0.1.11850 > 127.0.0.1.38144: Flags [.], cksum 0xfe28 (incorrect -> 0xad5d), seq 3, ack 14, win 512, options [nop,nop,TS val 400813966 ecr 400813966], length 0
2022-04-07 08:02:11.570071 IP (tos 0x0, ttl 64, id 41677, offset 0, flags [DF], proto TCP (6), length 62)
    127.0.0.1.11850 > 127.0.0.1.38144: Flags [P.], cksum 0xfe32 (incorrect -> 0xa7df), seq 3:13, ack 14, win 512, options [nop,nop,TS val 400814073 ecr 400813966], length 10
2022-04-07 08:02:11.570087 IP (tos 0x0, ttl 64, id 39846, offset 0, flags [DF], proto TCP (6), length 52)
    127.0.0.1.38144 > 127.0.0.1.11850: Flags [.], cksum 0xfe28 (incorrect -> 0xac7d), seq 14, ack 13, win 512, options [nop,nop,TS val 400814073 ecr 400814073], length 0
2022-04-07 08:02:11.576723 IP (tos 0x0, ttl 64, id 39847, offset 0, flags [DF], proto TCP (6), length 569)
    127.0.0.1.38144 > 127.0.0.1.11850: Flags [P.], cksum 0x002e (incorrect -> 0xa8c2), seq 14:531, ack 13, win 512, options [nop,nop,TS val 400814079 ecr 400814073], length 517
2022-04-07 08:02:11.576732 IP (tos 0x0, ttl 64, id 41678, offset 0, flags [DF], proto TCP (6), length 52)
    127.0.0.1.11850 > 127.0.0.1.38144: Flags [.], cksum 0xfe28 (incorrect -> 0xaa70), seq 13, ack 531, win 508, options [nop,nop,TS val 400814079 ecr 400814079], length 0
2022-04-07 08:02:11.685679 IP (tos 0x0, ttl 64, id 41679, offset 0, flags [DF], proto TCP (6), length 3538)
    127.0.0.1.11850 > 127.0.0.1.38144: Flags [P.], cksum 0x0bc7 (incorrect -> 0x463b), seq 13:3499, ack 531, win 512, options [nop,nop,TS val 400814188 ecr 400814079], length 3486
2022-04-07 08:02:11.685688 IP (tos 0x0, ttl 64, id 39848, offset 0, flags [DF], proto TCP (6), length 52)
    127.0.0.1.38144 > 127.0.0.1.11850: Flags [.], cksum 0xfe28 (incorrect -> 0x9c06), seq 531, ack 3499, win 494, options [nop,nop,TS val 400814188 ecr 400814188], length 0
2022-04-07 08:02:11.762756 IP (tos 0x0, ttl 64, id 41680, offset 0, flags [DF], proto TCP (6), length 781)
    127.0.0.1.11850 > 127.0.0.1.38144: Flags [P.], cksum 0x0102 (incorrect -> 0x913a), seq 3499:4228, ack 531, win 512, options [nop,nop,TS val 400814265 ecr 400814188], length 729
2022-04-07 08:02:11.762767 IP (tos 0x0, ttl 64, id 39849, offset 0, flags [DF], proto TCP (6), length 52)
    127.0.0.1.38144 > 127.0.0.1.11850: Flags [.], cksum 0xfe28 (incorrect -> 0x9888), seq 531, ack 4228, win 505, options [nop,nop,TS val 400814265 ecr 400814265], length 0
2022-04-07 08:02:11.763171 IP (tos 0x0, ttl 64, id 39850, offset 0, flags [DF], proto TCP (6), length 132)
    127.0.0.1.38144 > 127.0.0.1.11850: Flags [P.], cksum 0xfe78 (incorrect -> 0x565d), seq 531:611, ack 4228, win 512, options [nop,nop,TS val 400814266 ecr 400814265], length 80
2022-04-07 08:02:11.763180 IP (tos 0x0, ttl 64, id 41681, offset 0, flags [DF], proto TCP (6), length 52)
    127.0.0.1.11850 > 127.0.0.1.38144: Flags [.], cksum 0xfe28 (incorrect -> 0x982f), seq 4228, ack 611, win 512, options [nop,nop,TS val 400814266 ecr 400814266], length 0
2022-04-07 08:02:11.763542 IP (tos 0x0, ttl 64, id 39851, offset 0, flags [DF], proto TCP (6), length 294)
    127.0.0.1.38144 > 127.0.0.1.11850: Flags [P.], cksum 0xff1a (incorrect -> 0x0b4c), seq 611:853, ack 4228, win 512, options [nop,nop,TS val 400814266 ecr 400814266], length 242
2022-04-07 08:02:11.763548 IP (tos 0x0, ttl 64, id 41682, offset 0, flags [DF], proto TCP (6), length 52)
    127.0.0.1.11850 > 127.0.0.1.38144: Flags [.], cksum 0xfe28 (incorrect -> 0x973e), seq 4228, ack 853, win 511, options [nop,nop,TS val 400814266 ecr 400814266], length 0
2022-04-07 08:02:11.869121 IP (tos 0x0, ttl 64, id 41683, offset 0, flags [DF], proto TCP (6), length 3084)
    127.0.0.1.11850 > 127.0.0.1.38144: Flags [P.], cksum 0x0a01 (incorrect -> 0x2af9), seq 4228:7260, ack 853, win 512, options [nop,nop,TS val 400814372 ecr 400814266], length 3032
2022-04-07 08:02:11.869130 IP (tos 0x0, ttl 64, id 39852, offset 0, flags [DF], proto TCP (6), length 52)
    127.0.0.1.38144 > 127.0.0.1.11850: Flags [.], cksum 0xfe28 (incorrect -> 0x8aa1), seq 853, ack 7260, win 496, options [nop,nop,TS val 400814372 ecr 400814372], length 0
2022-04-07 08:02:11.903794 IP (tos 0x0, ttl 64, id 41684, offset 0, flags [DF], proto TCP (6), length 3538)
    127.0.0.1.11850 > 127.0.0.1.38144: Flags [P.], cksum 0x0bc7 (incorrect -> 0x881c), seq 7260:10746, ack 853, win 512, options [nop,nop,TS val 400814406 ecr 400814372], length 3486
2022-04-07 08:02:11.903801 IP (tos 0x0, ttl 64, id 39853, offset 0, flags [DF], proto TCP (6), length 52)
    127.0.0.1.38144 > 127.0.0.1.11850: Flags [.], cksum 0xfe28 (incorrect -> 0x7cc1), seq 853, ack 10746, win 494, options [nop,nop,TS val 400814406 ecr 400814406], length 0
2022-04-07 08:02:11.905233 IP (tos 0x0, ttl 64, id 41685, offset 0, flags [DF], proto TCP (6), length 550)
    127.0.0.1.11850 > 127.0.0.1.38144: Flags [P.], cksum 0x001b (incorrect -> 0x971b), seq 10746:11244, ack 853, win 512, options [nop,nop,TS val 400814408 ecr 400814406], length 498
2022-04-07 08:02:11.905238 IP (tos 0x0, ttl 64, id 39854, offset 0, flags [DF], proto TCP (6), length 52)
    127.0.0.1.38144 > 127.0.0.1.11850: Flags [.], cksum 0xfe28 (incorrect -> 0x7abf), seq 853, ack 11244, win 506, options [nop,nop,TS val 400814408 ecr 400814408], length 0
2022-04-07 08:02:11.905318 IP (tos 0x0, ttl 64, id 41686, offset 0, flags [DF], proto TCP (6), length 3538)
    127.0.0.1.11850 > 127.0.0.1.38144: Flags [P.], cksum 0x0bc7 (incorrect -> 0x287d), seq 11244:14730, ack 853, win 512, options [nop,nop,TS val 400814408 ecr 400814408], length 3486
2022-04-07 08:02:11.905323 IP (tos 0x0, ttl 64, id 39855, offset 0, flags [DF], proto TCP (6), length 52)
    127.0.0.1.38144 > 127.0.0.1.11850: Flags [.], cksum 0xfe28 (incorrect -> 0x6d2d), seq 853, ack 14730, win 494, options [nop,nop,TS val 400814408 ecr 400814408], length 0
2022-04-07 08:02:11.907196 IP (tos 0x0, ttl 64, id 41687, offset 0, flags [DF], proto TCP (6), length 4036)
    127.0.0.1.11850 > 127.0.0.1.38144: Flags [P.], cksum 0x0db9 (incorrect -> 0x516d), seq 14730:18714, ack 853, win 512, options [nop,nop,TS val 400814410 ecr 400814408], length 3984
2022-04-07 08:02:11.907202 IP (tos 0x0, ttl 64, id 39856, offset 0, flags [DF], proto TCP (6), length 52)
    127.0.0.1.38144 > 127.0.0.1.11850: Flags [.], cksum 0xfe28 (incorrect -> 0x5d9b), seq 853, ack 18714, win 492, options [nop,nop,TS val 400814410 ecr 400814410], length 0
2022-04-07 08:02:11.921365 IP (tos 0x0, ttl 64, id 41688, offset 0, flags [DF], proto TCP (6), length 4100)
    127.0.0.1.11850 > 127.0.0.1.38144: Flags [P.], cksum 0x0df9 (incorrect -> 0x73d9), seq 18714:22762, ack 853, win 512, options [nop,nop,TS val 400814424 ecr 400814410], length 4048
2022-04-07 08:02:11.921371 IP (tos 0x0, ttl 64, id 39857, offset 0, flags [DF], proto TCP (6), length 52)
    127.0.0.1.38144 > 127.0.0.1.11850: Flags [.], cksum 0xfe28 (incorrect -> 0x4daf), seq 853, ack 22762, win 492, options [nop,nop,TS val 400814424 ecr 400814424], length 0
2022-04-07 08:02:11.921378 IP (tos 0x0, ttl 64, id 41689, offset 0, flags [DF], proto TCP (6), length 2830)
    127.0.0.1.11850 > 127.0.0.1.38144: Flags [P.], cksum 0x0903 (incorrect -> 0xfcb4), seq 22762:25540, ack 853, win 512, options [nop,nop,TS val 400814424 ecr 400814424], length 2778
2022-04-07 08:02:11.921381 IP (tos 0x0, ttl 64, id 39858, offset 0, flags [DF], proto TCP (6), length 52)
    127.0.0.1.38144 > 127.0.0.1.11850: Flags [.], cksum 0xfe28 (incorrect -> 0x42e0), seq 853, ack 25540, win 481, options [nop,nop,TS val 400814424 ecr 400814424], length 0
2022-04-07 08:02:11.921439 IP (tos 0x0, ttl 64, id 41690, offset 0, flags [DF], proto TCP (6), length 2948)
    127.0.0.1.11850 > 127.0.0.1.38144: Flags [P.], cksum 0x0979 (incorrect -> 0xb4f8), seq 25540:28436, ack 853, win 512, options [nop,nop,TS val 400814424 ecr 400814424], length 2896
2022-04-07 08:02:11.921443 IP (tos 0x0, ttl 64, id 39859, offset 0, flags [DF], proto TCP (6), length 52)
    127.0.0.1.38144 > 127.0.0.1.11850: Flags [.], cksum 0xfe28 (incorrect -> 0x379b), seq 853, ack 28436, win 470, options [nop,nop,TS val 400814424 ecr 400814424], length 0
2022-04-07 08:02:11.950154 IP (tos 0x0, ttl 64, id 41691, offset 0, flags [DF], proto TCP (6), length 3446)
    127.0.0.1.11850 > 127.0.0.1.38144: Flags [P.], cksum 0x0b6b (incorrect -> 0x884e), seq 28436:31830, ack 853, win 512, options [nop,nop,TS val 400814453 ecr 400814424], length 3394
2022-04-07 08:02:11.950172 IP (tos 0x0, ttl 64, id 39860, offset 0, flags [DF], proto TCP (6), length 52)
    127.0.0.1.38144 > 127.0.0.1.11850: Flags [.], cksum 0xfe28 (incorrect -> 0x29f5), seq 853, ack 31830, win 512, options [nop,nop,TS val 400814453 ecr 400814453], length 0
2022-04-07 08:02:11.951595 IP (tos 0x0, ttl 64, id 41692, offset 0, flags [DF], proto TCP (6), length 550)
    127.0.0.1.11850 > 127.0.0.1.38144: Flags [P.], cksum 0x001b (incorrect -> 0x780e), seq 31830:32328, ack 853, win 512, options [nop,nop,TS val 400814454 ecr 400814453], length 498
2022-04-07 08:02:11.951607 IP (tos 0x0, ttl 64, id 39861, offset 0, flags [DF], proto TCP (6), length 52)
    127.0.0.1.38144 > 127.0.0.1.11850: Flags [.], cksum 0xfe28 (incorrect -> 0x2801), seq 853, ack 32328, win 512, options [nop,nop,TS val 400814454 ecr 400814454], length 0
2022-04-07 08:02:11.953113 IP (tos 0x0, ttl 64, id 41693, offset 0, flags [DF], proto TCP (6), length 2948)
    127.0.0.1.11850 > 127.0.0.1.38144: Flags [P.], cksum 0x0979 (incorrect -> 0x9b1c), seq 32328:35224, ack 853, win 512, options [nop,nop,TS val 400814456 ecr 400814454], length 2896
2022-04-07 08:02:11.953130 IP (tos 0x0, ttl 64, id 39862, offset 0, flags [DF], proto TCP (6), length 52)
    127.0.0.1.38144 > 127.0.0.1.11850: Flags [.], cksum 0xfe28 (incorrect -> 0x1cad), seq 853, ack 35224, win 512, options [nop,nop,TS val 400814456 ecr 400814456], length 0
2022-04-07 08:02:11.953210 IP (tos 0x0, ttl 64, id 41694, offset 0, flags [DF], proto TCP (6), length 3538)
    127.0.0.1.11850 > 127.0.0.1.38144: Flags [P.], cksum 0x0bc7 (incorrect -> 0x6125), seq 35224:38710, ack 853, win 512, options [nop,nop,TS val 400814456 ecr 400814456], length 3486
2022-04-07 08:02:11.953626 IP (tos 0x0, ttl 64, id 39863, offset 0, flags [DF], proto TCP (6), length 52)
    127.0.0.1.38144 > 127.0.0.1.11850: Flags [.], cksum 0xfe28 (incorrect -> 0x0f0f), seq 853, ack 38710, win 512, options [nop,nop,TS val 400814456 ecr 400814456], length 0
2022-04-07 08:02:11.955690 IP (tos 0x0, ttl 64, id 41695, offset 0, flags [DF], proto TCP (6), length 3354)
    127.0.0.1.11850 > 127.0.0.1.38144: Flags [P.], cksum 0x0b0f (incorrect -> 0x0181), seq 38710:42012, ack 853, win 512, options [nop,nop,TS val 400814458 ecr 400814456], length 3302
2022-04-07 08:02:11.955719 IP (tos 0x0, ttl 64, id 39864, offset 0, flags [DF], proto TCP (6), length 52)
    127.0.0.1.38144 > 127.0.0.1.11850: Flags [.], cksum 0xfe28 (incorrect -> 0x0225), seq 853, ack 42012, win 512, options [nop,nop,TS val 400814458 ecr 400814458], length 0
2022-04-07 08:02:11.955797 IP (tos 0x0, ttl 64, id 41696, offset 0, flags [DF], proto TCP (6), length 3400)
    127.0.0.1.11850 > 127.0.0.1.38144: Flags [P.], cksum 0x0b3d (incorrect -> 0x8024), seq 42012:45360, ack 853, win 512, options [nop,nop,TS val 400814458 ecr 400814458], length 3348
2022-04-07 08:02:11.955810 IP (tos 0x0, ttl 64, id 39865, offset 0, flags [DF], proto TCP (6), length 52)
    127.0.0.1.38144 > 127.0.0.1.11850: Flags [.], cksum 0xfe28 (incorrect -> 0xf510), seq 853, ack 45360, win 512, options [nop,nop,TS val 400814458 ecr 400814458], length 0
2022-04-07 08:02:11.955938 IP (tos 0x0, ttl 64, id 41697, offset 0, flags [DF], proto TCP (6), length 4100)
    127.0.0.1.11850 > 127.0.0.1.38144: Flags [P.], cksum 0x0df9 (incorrect -> 0x376d), seq 45360:49408, ack 853, win 512, options [nop,nop,TS val 400814458 ecr 400814458], length 4048
2022-04-07 08:02:11.993346 IP (tos 0x0, ttl 64, id 41698, offset 0, flags [DF], proto TCP (6), length 32820)
    127.0.0.1.11850 > 127.0.0.1.38144: Flags [.], cksum 0x7e29 (incorrect -> 0x6ecb), seq 49408:82176, ack 853, win 512, options [nop,nop,TS val 400814496 ecr 400814458], length 32768
2022-04-07 08:02:11.993359 IP (tos 0x0, ttl 64, id 39866, offset 0, flags [DF], proto TCP (6), length 52)
    127.0.0.1.38144 > 127.0.0.1.11850: Flags [.], cksum 0xfe28 (incorrect -> 0x659f), seq 853, ack 82176, win 379, options [nop,nop,TS val 400814496 ecr 400814458], length 0
2022-04-07 08:02:11.993371 IP (tos 0x0, ttl 64, id 41699, offset 0, flags [DF], proto TCP (6), length 838)
    127.0.0.1.11850 > 127.0.0.1.38144: Flags [P.], cksum 0x013b (incorrect -> 0x4085), seq 82176:82962, ack 853, win 512, options [nop,nop,TS val 400814496 ecr 400814496], length 786
2022-04-07 08:02:11.993942 IP (tos 0x0, ttl 64, id 39867, offset 0, flags [DF], proto TCP (6), length 52)
    127.0.0.1.38144 > 127.0.0.1.11850: Flags [.], cksum 0xfe28 (incorrect -> 0x61e2), seq 853, ack 82962, win 512, options [nop,nop,TS val 400814496 ecr 400814496], length 0
2022-04-07 08:02:11.993951 IP (tos 0x0, ttl 64, id 41700, offset 0, flags [DF], proto TCP (6), length 4036)
    127.0.0.1.11850 > 127.0.0.1.38144: Flags [P.], cksum 0x0db9 (incorrect -> 0xf19b), seq 82962:86946, ack 853, win 512, options [nop,nop,TS val 400814496 ecr 400814496], length 3984
2022-04-07 08:02:11.994080 IP (tos 0x0, ttl 64, id 39868, offset 0, flags [DF], proto TCP (6), length 52)
    127.0.0.1.38144 > 127.0.0.1.11850: Flags [.], cksum 0xfe28 (incorrect -> 0x5251), seq 853, ack 86946, win 512, options [nop,nop,TS val 400814497 ecr 400814496], length 0
2022-04-07 08:02:11.995353 IP (tos 0x0, ttl 64, id 41701, offset 0, flags [DF], proto TCP (6), length 550)
    127.0.0.1.11850 > 127.0.0.1.38144: Flags [P.], cksum 0x001b (incorrect -> 0xdb9b), seq 86946:87444, ack 853, win 512, options [nop,nop,TS val 400814498 ecr 400814497], length 498
2022-04-07 08:02:11.995382 IP (tos 0x0, ttl 64, id 39869, offset 0, flags [DF], proto TCP (6), length 52)
    127.0.0.1.38144 > 127.0.0.1.11850: Flags [.], cksum 0xfe28 (incorrect -> 0x505c), seq 853, ack 87444, win 512, options [nop,nop,TS val 400814498 ecr 400814498], length 0
2022-04-07 08:02:11.995442 IP (tos 0x0, ttl 64, id 41702, offset 0, flags [DF], proto TCP (6), length 3354)
    127.0.0.1.11850 > 127.0.0.1.38144: Flags [P.], cksum 0x0b0f (incorrect -> 0x1c74), seq 87444:90746, ack 853, win 512, options [nop,nop,TS val 400814498 ecr 400814498], length 3302
2022-04-07 08:02:11.995466 IP (tos 0x0, ttl 64, id 39870, offset 0, flags [DF], proto TCP (6), length 52)
    127.0.0.1.38144 > 127.0.0.1.11850: Flags [.], cksum 0xfe28 (incorrect -> 0x4376), seq 853, ack 90746, win 512, options [nop,nop,TS val 400814498 ecr 400814498], length 0
2022-04-07 08:02:11.995486 IP (tos 0x0, ttl 64, id 41703, offset 0, flags [DF], proto TCP (6), length 3944)
    127.0.0.1.11850 > 127.0.0.1.38144: Flags [P.], cksum 0x0d5d (incorrect -> 0xb6b3), seq 90746:94638, ack 853, win 512, options [nop,nop,TS val 400814498 ecr 400814498], length 3892
2022-04-07 08:02:11.995510 IP (tos 0x0, ttl 64, id 39871, offset 0, flags [DF], proto TCP (6), length 52)
    127.0.0.1.38144 > 127.0.0.1.11850: Flags [.], cksum 0xfe28 (incorrect -> 0x3442), seq 853, ack 94638, win 512, options [nop,nop,TS val 400814498 ecr 400814498], length 0
2022-04-07 08:02:11.996377 IP (tos 0x0, ttl 64, id 41704, offset 0, flags [DF], proto TCP (6), length 1048)
    127.0.0.1.11850 > 127.0.0.1.38144: Flags [P.], cksum 0x020d (incorrect -> 0x6d5d), seq 94638:95634, ack 853, win 512, options [nop,nop,TS val 400814499 ecr 400814498], length 996
2022-04-07 08:02:11.996401 IP (tos 0x0, ttl 64, id 39872, offset 0, flags [DF], proto TCP (6), length 52)
    127.0.0.1.38144 > 127.0.0.1.11850: Flags [.], cksum 0xfe28 (incorrect -> 0x305c), seq 853, ack 95634, win 512, options [nop,nop,TS val 400814499 ecr 400814499], length 0
2022-04-07 08:02:11.997913 IP (tos 0x0, ttl 64, id 41705, offset 0, flags [DF], proto TCP (6), length 3354)
    127.0.0.1.11850 > 127.0.0.1.38144: Flags [P.], cksum 0x0b0f (incorrect -> 0x8d31), seq 95634:98936, ack 853, win 512, options [nop,nop,TS val 400814500 ecr 400814499], length 3302
2022-04-07 08:02:11.997944 IP (tos 0x0, ttl 64, id 39873, offset 0, flags [DF], proto TCP (6), length 52)
    127.0.0.1.38144 > 127.0.0.1.11850: Flags [.], cksum 0xfe28 (incorrect -> 0x2374), seq 853, ack 98936, win 512, options [nop,nop,TS val 400814500 ecr 400814500], length 0
2022-04-07 08:02:11.997962 IP (tos 0x0, ttl 64, id 41706, offset 0, flags [DF], proto TCP (6), length 3446)
    127.0.0.1.11850 > 127.0.0.1.38144: Flags [P.], cksum 0x0b6b (incorrect -> 0xe3d3), seq 98936:102330, ack 853, win 512, options [nop,nop,TS val 400814500 ecr 400814500], length 3394
2022-04-07 08:02:11.998175 IP (tos 0x0, ttl 64, id 39874, offset 0, flags [DF], proto TCP (6), length 52)
    127.0.0.1.38144 > 127.0.0.1.11850: Flags [.], cksum 0xfe28 (incorrect -> 0x1631), seq 853, ack 102330, win 512, options [nop,nop,TS val 400814501 ecr 400814500], length 0
2022-04-07 08:02:11.999188 IP (tos 0x0, ttl 64, id 41707, offset 0, flags [DF], proto TCP (6), length 4100)
    127.0.0.1.11850 > 127.0.0.1.38144: Flags [P.], cksum 0x0df9 (incorrect -> 0x6e0b), seq 102330:106378, ack 853, win 512, options [nop,nop,TS val 400814502 ecr 400814501], length 4048
2022-04-07 08:02:11.999217 IP (tos 0x0, ttl 64, id 39875, offset 0, flags [DF], proto TCP (6), length 52)
    127.0.0.1.38144 > 127.0.0.1.11850: Flags [.], cksum 0xfe28 (incorrect -> 0x065e), seq 853, ack 106378, win 512, options [nop,nop,TS val 400814502 ecr 400814502], length 0
2022-04-07 08:02:11.999223 IP (tos 0x0, ttl 64, id 41708, offset 0, flags [DF], proto TCP (6), length 302)
    127.0.0.1.11850 > 127.0.0.1.38144: Flags [P.], cksum 0xff22 (incorrect -> 0x729c), seq 106378:106628, ack 853, win 512, options [nop,nop,TS val 400814502 ecr 400814502], length 250
2022-04-07 08:02:11.999228 IP (tos 0x0, ttl 64, id 39876, offset 0, flags [DF], proto TCP (6), length 52)
    127.0.0.1.38144 > 127.0.0.1.11850: Flags [.], cksum 0xfe28 (incorrect -> 0x0564), seq 853, ack 106628, win 512, options [nop,nop,TS val 400814502 ecr 400814502], length 0
2022-04-07 08:02:11.999263 IP (tos 0x0, ttl 64, id 41709, offset 0, flags [DF], proto TCP (6), length 3446)
    127.0.0.1.11850 > 127.0.0.1.38144: Flags [P.], cksum 0x0b6b (incorrect -> 0x0b14), seq 106628:110022, ack 853, win 512, options [nop,nop,TS val 400814502 ecr 400814502], length 3394
2022-04-07 08:02:11.999382 IP (tos 0x0, ttl 64, id 39877, offset 0, flags [DF], proto TCP (6), length 52)
    127.0.0.1.38144 > 127.0.0.1.11850: Flags [.], cksum 0xfe28 (incorrect -> 0xf821), seq 853, ack 110022, win 512, options [nop,nop,TS val 400814502 ecr 400814502], length 0
2022-04-07 08:02:11.999395 IP (tos 0x0, ttl 64, id 41710, offset 0, flags [DF], proto TCP (6), length 4036)
    127.0.0.1.11850 > 127.0.0.1.38144: Flags [P.], cksum 0x0db9 (incorrect -> 0x7b4f), seq 110022:114006, ack 853, win 512, options [nop,nop,TS val 400814502 ecr 400814502], length 3984
2022-04-07 08:02:11.999420 IP (tos 0x0, ttl 64, id 39878, offset 0, flags [DF], proto TCP (6), length 52)
    127.0.0.1.38144 > 127.0.0.1.11850: Flags [.], cksum 0xfe28 (incorrect -> 0xe891), seq 853, ack 114006, win 512, options [nop,nop,TS val 400814502 ecr 400814502], length 0
2022-04-07 08:02:12.001574 IP (tos 0x0, ttl 64, id 41711, offset 0, flags [DF], proto TCP (6), length 4100)
    127.0.0.1.11850 > 127.0.0.1.38144: Flags [P.], cksum 0x0df9 (incorrect -> 0x32ef), seq 114006:118054, ack 853, win 512, options [nop,nop,TS val 400814504 ecr 400814502], length 4048
2022-04-07 08:02:12.001611 IP (tos 0x0, ttl 64, id 39879, offset 0, flags [DF], proto TCP (6), length 52)
    127.0.0.1.38144 > 127.0.0.1.11850: Flags [.], cksum 0xfe28 (incorrect -> 0xd8bd), seq 853, ack 118054, win 512, options [nop,nop,TS val 400814504 ecr 400814504], length 0
2022-04-07 08:02:12.001618 IP (tos 0x0, ttl 64, id 41712, offset 0, flags [DF], proto TCP (6), length 210)
    127.0.0.1.11850 > 127.0.0.1.38144: Flags [P.], cksum 0xfec6 (incorrect -> 0x0edb), seq 118054:118212, ack 853, win 512, options [nop,nop,TS val 400814504 ecr 400814504], length 158
2022-04-07 08:02:12.001623 IP (tos 0x0, ttl 64, id 39880, offset 0, flags [DF], proto TCP (6), length 52)
    127.0.0.1.38144 > 127.0.0.1.11850: Flags [.], cksum 0xfe28 (incorrect -> 0xd81f), seq 853, ack 118212, win 512, options [nop,nop,TS val 400814504 ecr 400814504], length 0
200, 5.90497350692749, 0.5998640060424805