2022-04-07 15:54:58.012561 IP (tos 0x0, ttl 64, id 59760, offset 0, flags [DF], proto TCP (6), length 60)
    127.0.0.1.49230 > 127.0.0.1.10650: Flags [S], cksum 0xfe30 (incorrect -> 0xcd5e), seq 476423339, win 65495, options [mss 65495,sackOK,TS val 3503097564 ecr 0,nop,wscale 7], length 0
2022-04-07 15:54:58.012576 IP (tos 0x0, ttl 64, id 0, offset 0, flags [DF], proto TCP (6), length 60)
    127.0.0.1.10650 > 127.0.0.1.49230: Flags [S.], cksum 0xfe30 (incorrect -> 0x5118), seq 3153520800, ack 476423340, win 65483, options [mss 65495,sackOK,TS val 3503097564 ecr 3503097564,nop,wscale 7], length 0
2022-04-07 15:54:58.012586 IP (tos 0x0, ttl 64, id 59761, offset 0, flags [DF], proto TCP (6), length 52)
    127.0.0.1.49230 > 127.0.0.1.10650: Flags [.], cksum 0xfe28 (incorrect -> 0x77d4), seq 1, ack 1, win 512, options [nop,nop,TS val 3503097564 ecr 3503097564], length 0
2022-04-07 15:54:58.012970 IP (tos 0x0, ttl 64, id 59762, offset 0, flags [DF], proto TCP (6), length 55)
    127.0.0.1.49230 > 127.0.0.1.10650: Flags [P.], cksum 0xfe2b (incorrect -> 0x72c8), seq 1:4, ack 1, win 512, options [nop,nop,TS val 3503097564 ecr 3503097564], length 3
2022-04-07 15:54:58.012987 IP (tos 0x0, ttl 64, id 50547, offset 0, flags [DF], proto TCP (6), length 52)
    127.0.0.1.10650 > 127.0.0.1.49230: Flags [.], cksum 0xfe28 (incorrect -> 0x77d1), seq 1, ack 4, win 512, options [nop,nop,TS val 3503097564 ecr 3503097564], length 0
2022-04-07 15:54:58.013025 IP (tos 0x0, ttl 64, id 50548, offset 0, flags [DF], proto TCP (6), length 54)
    127.0.0.1.10650 > 127.0.0.1.49230: Flags [P.], cksum 0xfe2a (incorrect -> 0x72c7), seq 1:3, ack 4, win 512, options [nop,nop,TS val 3503097564 ecr 3503097564], length 2
2022-04-07 15:54:58.013038 IP (tos 0x0, ttl 64, id 59763, offset 0, flags [DF], proto TCP (6), length 52)
    127.0.0.1.49230 > 127.0.0.1.10650: Flags [.], cksum 0xfe28 (incorrect -> 0x77cf), seq 4, ack 3, win 512, options [nop,nop,TS val 3503097564 ecr 3503097564], length 0
2022-04-07 15:54:58.014380 IP (tos 0x0, ttl 64, id 59764, offset 0, flags [DF], proto TCP (6), length 62)
    127.0.0.1.49230 > 127.0.0.1.10650: Flags [P.], cksum 0xfe32 (incorrect -> 0x9ee8), seq 4:14, ack 3, win 512, options [nop,nop,TS val 3503097566 ecr 3503097564], length 10
2022-04-07 15:54:58.014399 IP (tos 0x0, ttl 64, id 50549, offset 0, flags [DF], proto TCP (6), length 52)
    127.0.0.1.10650 > 127.0.0.1.49230: Flags [.], cksum 0xfe28 (incorrect -> 0x77c1), seq 3, ack 14, win 512, options [nop,nop,TS val 3503097566 ecr 3503097566], length 0
2022-04-07 15:54:58.110750 IP (tos 0x0, ttl 64, id 50550, offset 0, flags [DF], proto TCP (6), length 62)
    127.0.0.1.10650 > 127.0.0.1.49230: Flags [P.], cksum 0xfe32 (incorrect -> 0x724e), seq 3:13, ack 14, win 512, options [nop,nop,TS val 3503097662 ecr 3503097566], length 10
2022-04-07 15:54:58.110777 IP (tos 0x0, ttl 64, id 59765, offset 0, flags [DF], proto TCP (6), length 52)
    127.0.0.1.49230 > 127.0.0.1.10650: Flags [.], cksum 0xfe28 (incorrect -> 0x76f7), seq 14, ack 13, win 512, options [nop,nop,TS val 3503097662 ecr 3503097662], length 0
2022-04-07 15:54:58.116506 IP (tos 0x0, ttl 64, id 59766, offset 0, flags [DF], proto TCP (6), length 569)
    127.0.0.1.49230 > 127.0.0.1.10650: Flags [P.], cksum 0x002e (incorrect -> 0x2925), seq 14:531, ack 13, win 512, options [nop,nop,TS val 3503097668 ecr 3503097662], length 517
2022-04-07 15:54:58.116524 IP (tos 0x0, ttl 64, id 50551, offset 0, flags [DF], proto TCP (6), length 52)
    127.0.0.1.10650 > 127.0.0.1.49230: Flags [.], cksum 0xfe28 (incorrect -> 0x74ea), seq 13, ack 531, win 508, options [nop,nop,TS val 3503097668 ecr 3503097668], length 0
2022-04-07 15:54:58.233456 IP (tos 0x0, ttl 64, id 50552, offset 0, flags [DF], proto TCP (6), length 3538)
    127.0.0.1.10650 > 127.0.0.1.49230: Flags [P.], cksum 0x0bc7 (incorrect -> 0x34f4), seq 13:3499, ack 531, win 512, options [nop,nop,TS val 3503097785 ecr 3503097668], length 3486
2022-04-07 15:54:58.233472 IP (tos 0x0, ttl 64, id 59767, offset 0, flags [DF], proto TCP (6), length 52)
    127.0.0.1.49230 > 127.0.0.1.10650: Flags [.], cksum 0xfe28 (incorrect -> 0x6670), seq 531, ack 3499, win 494, options [nop,nop,TS val 3503097785 ecr 3503097785], length 0
2022-04-07 15:54:58.254961 IP (tos 0x0, ttl 64, id 50553, offset 0, flags [DF], proto TCP (6), length 64)
    127.0.0.1.10650 > 127.0.0.1.49230: Flags [P.], cksum 0xfe34 (incorrect -> 0x1155), seq 3499:3511, ack 531, win 512, options [nop,nop,TS val 3503097806 ecr 3503097785], length 12
2022-04-07 15:54:58.254969 IP (tos 0x0, ttl 64, id 59768, offset 0, flags [DF], proto TCP (6), length 52)
    127.0.0.1.49230 > 127.0.0.1.10650: Flags [.], cksum 0xfe28 (incorrect -> 0x662d), seq 531, ack 3511, win 507, options [nop,nop,TS val 3503097806 ecr 3503097806], length 0
2022-04-07 15:54:58.255234 IP (tos 0x0, ttl 64, id 59769, offset 0, flags [DF], proto TCP (6), length 178)
    127.0.0.1.49230 > 127.0.0.1.10650: Flags [P.], cksum 0xfea6 (incorrect -> 0x59ae), seq 531:657, ack 3511, win 512, options [nop,nop,TS val 3503097807 ecr 3503097806], length 126
2022-04-07 15:54:58.255241 IP (tos 0x0, ttl 64, id 50554, offset 0, flags [DF], proto TCP (6), length 52)
    127.0.0.1.10650 > 127.0.0.1.49230: Flags [.], cksum 0xfe28 (incorrect -> 0x65a8), seq 3511, ack 657, win 512, options [nop,nop,TS val 3503097807 ecr 3503097807], length 0
2022-04-07 15:54:58.352929 IP (tos 0x0, ttl 64, id 50555, offset 0, flags [DF], proto TCP (6), length 103)
    127.0.0.1.10650 > 127.0.0.1.49230: Flags [P.], cksum 0xfe5b (incorrect -> 0x1f93), seq 3511:3562, ack 657, win 512, options [nop,nop,TS val 3503097904 ecr 3503097807], length 51
2022-04-07 15:54:58.352938 IP (tos 0x0, ttl 64, id 59770, offset 0, flags [DF], proto TCP (6), length 52)
    127.0.0.1.49230 > 127.0.0.1.10650: Flags [.], cksum 0xfe28 (incorrect -> 0x64b3), seq 657, ack 3562, win 512, options [nop,nop,TS val 3503097904 ecr 3503097904], length 0
2022-04-07 15:54:58.353337 IP (tos 0x0, ttl 64, id 59771, offset 0, flags [DF], proto TCP (6), length 296)
    127.0.0.1.49230 > 127.0.0.1.10650: Flags [P.], cksum 0xff1c (incorrect -> 0x5af5), seq 657:901, ack 3562, win 512, options [nop,nop,TS val 3503097905 ecr 3503097904], length 244
2022-04-07 15:54:58.353345 IP (tos 0x0, ttl 64, id 50556, offset 0, flags [DF], proto TCP (6), length 52)
    127.0.0.1.10650 > 127.0.0.1.49230: Flags [.], cksum 0xfe28 (incorrect -> 0x63be), seq 3562, ack 901, win 511, options [nop,nop,TS val 3503097905 ecr 3503097905], length 0
2022-04-07 15:54:58.455317 IP (tos 0x0, ttl 64, id 50557, offset 0, flags [DF], proto TCP (6), length 3538)
    127.0.0.1.10650 > 127.0.0.1.49230: Flags [P.], cksum 0x0bc7 (incorrect -> 0x6ffa), seq 3562:7048, ack 901, win 512, options [nop,nop,TS val 3503098007 ecr 3503097905], length 3486
2022-04-07 15:54:58.498466 IP (tos 0x0, ttl 64, id 50558, offset 0, flags [DF], proto TCP (6), length 32820)
    127.0.0.1.10650 > 127.0.0.1.49230: Flags [.], cksum 0x7e29 (incorrect -> 0x9557), seq 7048:39816, ack 901, win 512, options [nop,nop,TS val 3503098050 ecr 3503097905], length 32768
2022-04-07 15:54:58.498475 IP (tos 0x0, ttl 64, id 59772, offset 0, flags [DF], proto TCP (6), length 52)
    127.0.0.1.49230 > 127.0.0.1.10650: Flags [.], cksum 0xfe28 (incorrect -> 0xd5ac), seq 901, ack 39816, win 379, options [nop,nop,TS val 3503098050 ecr 3503098007], length 0
2022-04-07 15:54:58.498483 IP (tos 0x0, ttl 64, id 50559, offset 0, flags [DF], proto TCP (6), length 310)
    127.0.0.1.10650 > 127.0.0.1.49230: Flags [P.], cksum 0xff2a (incorrect -> 0x9614), seq 39816:40074, ack 901, win 512, options [nop,nop,TS val 3503098050 ecr 3503098050], length 258
2022-04-07 15:54:58.520653 IP (tos 0x0, ttl 64, id 50560, offset 0, flags [DF], proto TCP (6), length 32820)
    127.0.0.1.10650 > 127.0.0.1.49230: Flags [.], cksum 0x7e29 (incorrect -> 0x539b), seq 40074:72842, ack 901, win 512, options [nop,nop,TS val 3503098072 ecr 3503098050], length 32768
2022-04-07 15:54:58.520661 IP (tos 0x0, ttl 64, id 59773, offset 0, flags [DF], proto TCP (6), length 52)
    127.0.0.1.49230 > 127.0.0.1.10650: Flags [.], cksum 0xfe28 (incorrect -> 0x5469), seq 901, ack 72842, win 379, options [nop,nop,TS val 3503098072 ecr 3503098050], length 0
2022-04-07 15:54:58.520669 IP (tos 0x0, ttl 64, id 50561, offset 0, flags [DF], proto TCP (6), length 996)
    127.0.0.1.10650 > 127.0.0.1.49230: Flags [P.], cksum 0x01d9 (incorrect -> 0x6be8), seq 72842:73786, ack 901, win 512, options [nop,nop,TS val 3503098072 ecr 3503098072], length 944
2022-04-07 15:54:58.541537 IP (tos 0x0, ttl 64, id 50562, offset 0, flags [DF], proto TCP (6), length 32820)
    127.0.0.1.10650 > 127.0.0.1.49230: Flags [.], cksum 0x7e29 (incorrect -> 0xe216), seq 73786:106554, ack 901, win 512, options [nop,nop,TS val 3503098093 ecr 3503098072], length 32768
2022-04-07 15:54:58.541547 IP (tos 0x0, ttl 64, id 59774, offset 0, flags [DF], proto TCP (6), length 52)
    127.0.0.1.49230 > 127.0.0.1.10650: Flags [.], cksum 0xfe28 (incorrect -> 0xd08d), seq 901, ack 106554, win 379, options [nop,nop,TS val 3503098093 ecr 3503098072], length 0
2022-04-07 15:54:58.541556 IP (tos 0x0, ttl 64, id 50563, offset 0, flags [DF], proto TCP (6), length 1716)
    127.0.0.1.10650 > 127.0.0.1.49230: Flags [P.], cksum 0x04a9 (incorrect -> 0x4aa0), seq 106554:108218, ack 901, win 512, options [nop,nop,TS val 3503098093 ecr 3503098093], length 1664
2022-04-07 15:54:58.582787 IP (tos 0x0, ttl 64, id 59775, offset 0, flags [DF], proto TCP (6), length 52)
    127.0.0.1.49230 > 127.0.0.1.10650: Flags [.], cksum 0xfe28 (incorrect -> 0xc94a), seq 901, ack 108218, win 512, options [nop,nop,TS val 3503098134 ecr 3503098093], length 0
2022-04-07 15:54:58.582798 IP (tos 0x0, ttl 64, id 50564, offset 0, flags [DF], proto TCP (6), length 18867)
    127.0.0.1.10650 > 127.0.0.1.49230: Flags [P.], cksum 0x47a8 (incorrect -> 0x8608), seq 108218:127033, ack 901, win 512, options [nop,nop,TS val 3503098134 ecr 3503098134], length 18815
200, 6.102683782577515, 0.5789940357208252