2022-04-07 21:16:12.622223 IP (tos 0x0, ttl 64, id 65390, offset 0, flags [DF], proto TCP (6), length 60)
    127.0.0.1.39692 > 127.0.0.1.11650: Flags [S], cksum 0xfe30 (incorrect -> 0x00bf), seq 3372730731, win 65495, options [mss 65495,sackOK,TS val 3522372173 ecr 0,nop,wscale 7], length 0
2022-04-07 21:16:12.622230 IP (tos 0x0, ttl 64, id 0, offset 0, flags [DF], proto TCP (6), length 60)
    127.0.0.1.11650 > 127.0.0.1.39692: Flags [S.], cksum 0xfe30 (incorrect -> 0xe1ae), seq 717291528, ack 3372730732, win 65483, options [mss 65495,sackOK,TS val 3522372174 ecr 3522372173,nop,wscale 7], length 0
2022-04-07 21:16:12.622235 IP (tos 0x0, ttl 64, id 65391, offset 0, flags [DF], proto TCP (6), length 52)
    127.0.0.1.39692 > 127.0.0.1.11650: Flags [.], cksum 0xfe28 (incorrect -> 0x086a), seq 1, ack 1, win 512, options [nop,nop,TS val 3522372174 ecr 3522372174], length 0
2022-04-07 21:16:12.622318 IP (tos 0x0, ttl 64, id 65392, offset 0, flags [DF], proto TCP (6), length 55)
    127.0.0.1.39692 > 127.0.0.1.11650: Flags [P.], cksum 0xfe2b (incorrect -> 0x035e), seq 1:4, ack 1, win 512, options [nop,nop,TS val 3522372174 ecr 3522372174], length 3
2022-04-07 21:16:12.622321 IP (tos 0x0, ttl 64, id 9454, offset 0, flags [DF], proto TCP (6), length 52)
    127.0.0.1.11650 > 127.0.0.1.39692: Flags [.], cksum 0xfe28 (incorrect -> 0x0867), seq 1, ack 4, win 512, options [nop,nop,TS val 3522372174 ecr 3522372174], length 0
2022-04-07 21:16:12.622372 IP (tos 0x0, ttl 64, id 9455, offset 0, flags [DF], proto TCP (6), length 54)
    127.0.0.1.11650 > 127.0.0.1.39692: Flags [P.], cksum 0xfe2a (incorrect -> 0x035d), seq 1:3, ack 4, win 512, options [nop,nop,TS val 3522372174 ecr 3522372174], length 2
2022-04-07 21:16:12.622376 IP (tos 0x0, ttl 64, id 65393, offset 0, flags [DF], proto TCP (6), length 52)
    127.0.0.1.39692 > 127.0.0.1.11650: Flags [.], cksum 0xfe28 (incorrect -> 0x0865), seq 4, ack 3, win 512, options [nop,nop,TS val 3522372174 ecr 3522372174], length 0
2022-04-07 21:16:12.634002 IP (tos 0x0, ttl 64, id 65394, offset 0, flags [DF], proto TCP (6), length 62)
    127.0.0.1.39692 > 127.0.0.1.11650: Flags [P.], cksum 0xfe32 (incorrect -> 0x64c5), seq 4:14, ack 3, win 512, options [nop,nop,TS val 3522372185 ecr 3522372174], length 10
2022-04-07 21:16:12.634008 IP (tos 0x0, ttl 64, id 9456, offset 0, flags [DF], proto TCP (6), length 52)
    127.0.0.1.11650 > 127.0.0.1.39692: Flags [.], cksum 0xfe28 (incorrect -> 0x0845), seq 3, ack 14, win 512, options [nop,nop,TS val 3522372185 ecr 3522372185], length 0
2022-04-07 21:16:12.756767 IP (tos 0x0, ttl 64, id 9457, offset 0, flags [DF], proto TCP (6), length 62)
    127.0.0.1.11650 > 127.0.0.1.39692: Flags [P.], cksum 0xfe32 (incorrect -> 0x02b7), seq 3:13, ack 14, win 512, options [nop,nop,TS val 3522372308 ecr 3522372185], length 10
2022-04-07 21:16:12.756772 IP (tos 0x0, ttl 64, id 65395, offset 0, flags [DF], proto TCP (6), length 52)
    127.0.0.1.39692 > 127.0.0.1.11650: Flags [.], cksum 0xfe28 (incorrect -> 0x0745), seq 14, ack 13, win 512, options [nop,nop,TS val 3522372308 ecr 3522372308], length 0
2022-04-07 21:16:12.762176 IP (tos 0x0, ttl 64, id 65396, offset 0, flags [DF], proto TCP (6), length 569)
    127.0.0.1.39692 > 127.0.0.1.11650: Flags [P.], cksum 0x002e (incorrect -> 0x4ac4), seq 14:531, ack 13, win 512, options [nop,nop,TS val 3522372313 ecr 3522372308], length 517
2022-04-07 21:16:12.762189 IP (tos 0x0, ttl 64, id 9458, offset 0, flags [DF], proto TCP (6), length 52)
    127.0.0.1.11650 > 127.0.0.1.39692: Flags [.], cksum 0xfe28 (incorrect -> 0x053a), seq 13, ack 531, win 508, options [nop,nop,TS val 3522372313 ecr 3522372313], length 0
2022-04-07 21:16:12.865233 IP (tos 0x0, ttl 64, id 9459, offset 0, flags [DF], proto TCP (6), length 3538)
    127.0.0.1.11650 > 127.0.0.1.39692: Flags [P.], cksum 0x0bc7 (incorrect -> 0x4cff), seq 13:3499, ack 531, win 512, options [nop,nop,TS val 3522372416 ecr 3522372313], length 3486
2022-04-07 21:16:12.865249 IP (tos 0x0, ttl 64, id 65397, offset 0, flags [DF], proto TCP (6), length 52)
    127.0.0.1.39692 > 127.0.0.1.11650: Flags [.], cksum 0xfe28 (incorrect -> 0xf6da), seq 531, ack 3499, win 494, options [nop,nop,TS val 3522372417 ecr 3522372416], length 0
2022-04-07 21:16:12.896090 IP (tos 0x0, ttl 64, id 9460, offset 0, flags [DF], proto TCP (6), length 541)
    127.0.0.1.11650 > 127.0.0.1.39692: Flags [P.], cksum 0x0012 (incorrect -> 0xa021), seq 3499:3988, ack 531, win 512, options [nop,nop,TS val 3522372447 ecr 3522372417], length 489
2022-04-07 21:16:12.896099 IP (tos 0x0, ttl 64, id 65398, offset 0, flags [DF], proto TCP (6), length 52)
    127.0.0.1.39692 > 127.0.0.1.11650: Flags [.], cksum 0xfe28 (incorrect -> 0xf4a8), seq 531, ack 3988, win 506, options [nop,nop,TS val 3522372447 ecr 3522372447], length 0
2022-04-07 21:16:12.896523 IP (tos 0x0, ttl 64, id 65399, offset 0, flags [DF], proto TCP (6), length 132)
    127.0.0.1.39692 > 127.0.0.1.11650: Flags [P.], cksum 0xfe78 (incorrect -> 0x0b1c), seq 531:611, ack 3988, win 512, options [nop,nop,TS val 3522372448 ecr 3522372447], length 80
2022-04-07 21:16:12.896950 IP (tos 0x0, ttl 64, id 9461, offset 0, flags [DF], proto TCP (6), length 52)
    127.0.0.1.11650 > 127.0.0.1.39692: Flags [.], cksum 0xfe28 (incorrect -> 0xf450), seq 3988, ack 611, win 512, options [nop,nop,TS val 3522372448 ecr 3522372448], length 0
2022-04-07 21:16:12.896960 IP (tos 0x0, ttl 64, id 65400, offset 0, flags [DF], proto TCP (6), length 390)
    127.0.0.1.39692 > 127.0.0.1.11650: Flags [P.], cksum 0xff7a (incorrect -> 0xd56b), seq 611:949, ack 3988, win 512, options [nop,nop,TS val 3522372448 ecr 3522372448], length 338
2022-04-07 21:16:12.896964 IP (tos 0x0, ttl 64, id 9462, offset 0, flags [DF], proto TCP (6), length 52)
    127.0.0.1.11650 > 127.0.0.1.39692: Flags [.], cksum 0xfe28 (incorrect -> 0xf300), seq 3988, ack 949, win 510, options [nop,nop,TS val 3522372448 ecr 3522372448], length 0
2022-04-07 21:16:13.049531 IP (tos 0x0, ttl 64, id 9463, offset 0, flags [DF], proto TCP (6), length 3084)
    127.0.0.1.11650 > 127.0.0.1.39692: Flags [P.], cksum 0x0a01 (incorrect -> 0x6d23), seq 3988:7020, ack 949, win 512, options [nop,nop,TS val 3522372601 ecr 3522372448], length 3032
2022-04-07 21:16:13.049539 IP (tos 0x0, ttl 64, id 65401, offset 0, flags [DF], proto TCP (6), length 52)
    127.0.0.1.39692 > 127.0.0.1.11650: Flags [.], cksum 0xfe28 (incorrect -> 0xe604), seq 949, ack 7020, win 496, options [nop,nop,TS val 3522372601 ecr 3522372601], length 0
2022-04-07 21:16:13.070596 IP (tos 0x0, ttl 64, id 9464, offset 0, flags [DF], proto TCP (6), length 1048)
    127.0.0.1.11650 > 127.0.0.1.39692: Flags [P.], cksum 0x020d (incorrect -> 0x5ab6), seq 7020:8016, ack 949, win 512, options [nop,nop,TS val 3522372622 ecr 3522372601], length 996
2022-04-07 21:16:13.070601 IP (tos 0x0, ttl 64, id 65402, offset 0, flags [DF], proto TCP (6), length 52)
    127.0.0.1.39692 > 127.0.0.1.11650: Flags [.], cksum 0xfe28 (incorrect -> 0xe1ee), seq 949, ack 8016, win 504, options [nop,nop,TS val 3522372622 ecr 3522372622], length 0
2022-04-07 21:16:13.072812 IP (tos 0x0, ttl 64, id 9465, offset 0, flags [DF], proto TCP (6), length 4100)
    127.0.0.1.11650 > 127.0.0.1.39692: Flags [P.], cksum 0x0df9 (incorrect -> 0x774b), seq 8016:12064, ack 949, win 512, options [nop,nop,TS val 3522372624 ecr 3522372622], length 4048
2022-04-07 21:16:13.072817 IP (tos 0x0, ttl 64, id 65403, offset 0, flags [DF], proto TCP (6), length 52)
    127.0.0.1.39692 > 127.0.0.1.11650: Flags [.], cksum 0xfe28 (incorrect -> 0xd226), seq 949, ack 12064, win 492, options [nop,nop,TS val 3522372624 ecr 3522372624], length 0
2022-04-07 21:16:13.072822 IP (tos 0x0, ttl 64, id 9466, offset 0, flags [DF], proto TCP (6), length 1980)
    127.0.0.1.11650 > 127.0.0.1.39692: Flags [P.], cksum 0x05b1 (incorrect -> 0x237f), seq 12064:13992, ack 949, win 512, options [nop,nop,TS val 3522372624 ecr 3522372624], length 1928
2022-04-07 21:16:13.072824 IP (tos 0x0, ttl 64, id 65404, offset 0, flags [DF], proto TCP (6), length 52)
    127.0.0.1.39692 > 127.0.0.1.11650: Flags [.], cksum 0xfe28 (incorrect -> 0xcaa6), seq 949, ack 13992, win 484, options [nop,nop,TS val 3522372624 ecr 3522372624], length 0
2022-04-07 21:16:13.113046 IP (tos 0x0, ttl 64, id 9467, offset 0, flags [DF], proto TCP (6), length 3538)
    127.0.0.1.11650 > 127.0.0.1.39692: Flags [P.], cksum 0x0bc7 (incorrect -> 0x3cca), seq 13992:17478, ack 949, win 512, options [nop,nop,TS val 3522372664 ecr 3522372624], length 3486
2022-04-07 21:16:13.113053 IP (tos 0x0, ttl 64, id 65405, offset 0, flags [DF], proto TCP (6), length 52)
    127.0.0.1.39692 > 127.0.0.1.11650: Flags [.], cksum 0xfe28 (incorrect -> 0xbcae), seq 949, ack 17478, win 494, options [nop,nop,TS val 3522372664 ecr 3522372664], length 0
2022-04-07 21:16:13.114255 IP (tos 0x0, ttl 64, id 9468, offset 0, flags [DF], proto TCP (6), length 3538)
    127.0.0.1.11650 > 127.0.0.1.39692: Flags [P.], cksum 0x0bc7 (incorrect -> 0xed7d), seq 17478:20964, ack 949, win 512, options [nop,nop,TS val 3522372666 ecr 3522372664], length 3486
2022-04-07 21:16:13.114259 IP (tos 0x0, ttl 64, id 65406, offset 0, flags [DF], proto TCP (6), length 52)
    127.0.0.1.39692 > 127.0.0.1.11650: Flags [.], cksum 0xfe28 (incorrect -> 0xaf0c), seq 949, ack 20964, win 494, options [nop,nop,TS val 3522372666 ecr 3522372666], length 0
2022-04-07 21:16:13.115013 IP (tos 0x0, ttl 64, id 9469, offset 0, flags [DF], proto TCP (6), length 4100)
    127.0.0.1.11650 > 127.0.0.1.39692: Flags [P.], cksum 0x0df9 (incorrect -> 0x07f4), seq 20964:25012, ack 949, win 512, options [nop,nop,TS val 3522372666 ecr 3522372666], length 4048
2022-04-07 21:16:13.115026 IP (tos 0x0, ttl 64, id 65407, offset 0, flags [DF], proto TCP (6), length 52)
    127.0.0.1.39692 > 127.0.0.1.11650: Flags [.], cksum 0xfe28 (incorrect -> 0x9f4c), seq 949, ack 25012, win 478, options [nop,nop,TS val 3522372666 ecr 3522372666], length 0
2022-04-07 21:16:13.115034 IP (tos 0x0, ttl 64, id 9470, offset 0, flags [DF], proto TCP (6), length 390)
    127.0.0.1.11650 > 127.0.0.1.39692: Flags [P.], cksum 0xff7a (incorrect -> 0x01be), seq 25012:25350, ack 949, win 512, options [nop,nop,TS val 3522372666 ecr 3522372666], length 338
2022-04-07 21:16:13.115036 IP (tos 0x0, ttl 64, id 65408, offset 0, flags [DF], proto TCP (6), length 52)
    127.0.0.1.39692 > 127.0.0.1.11650: Flags [.], cksum 0xfe28 (incorrect -> 0x9dfb), seq 949, ack 25350, win 477, options [nop,nop,TS val 3522372666 ecr 3522372666], length 0
2022-04-07 21:16:13.134370 IP (tos 0x0, ttl 64, id 9471, offset 0, flags [DF], proto TCP (6), length 1976)
    127.0.0.1.11650 > 127.0.0.1.39692: Flags [P.], cksum 0x05ad (incorrect -> 0xb087), seq 25350:27274, ack 949, win 512, options [nop,nop,TS val 3522372686 ecr 3522372666], length 1924
2022-04-07 21:16:13.134382 IP (tos 0x0, ttl 64, id 65409, offset 0, flags [DF], proto TCP (6), length 52)
    127.0.0.1.39692 > 127.0.0.1.11650: Flags [.], cksum 0xfe28 (incorrect -> 0x962c), seq 949, ack 27274, win 512, options [nop,nop,TS val 3522372686 ecr 3522372686], length 0
2022-04-07 21:16:13.142709 IP (tos 0x0, ttl 64, id 9472, offset 0, flags [DF], proto TCP (6), length 3470)
    127.0.0.1.11650 > 127.0.0.1.39692: Flags [P.], cksum 0x0b83 (incorrect -> 0xf0a8), seq 27274:30692, ack 949, win 512, options [nop,nop,TS val 3522372694 ecr 3522372686], length 3418
2022-04-07 21:16:13.142722 IP (tos 0x0, ttl 64, id 65410, offset 0, flags [DF], proto TCP (6), length 52)
    127.0.0.1.39692 > 127.0.0.1.11650: Flags [.], cksum 0xfe28 (incorrect -> 0x88c2), seq 949, ack 30692, win 512, options [nop,nop,TS val 3522372694 ecr 3522372694], length 0
2022-04-07 21:16:13.153993 IP (tos 0x0, ttl 64, id 9473, offset 0, flags [DF], proto TCP (6), length 3470)
    127.0.0.1.11650 > 127.0.0.1.39692: Flags [P.], cksum 0x0b83 (incorrect -> 0x580f), seq 30692:34110, ack 949, win 512, options [nop,nop,TS val 3522372705 ecr 3522372694], length 3418
2022-04-07 21:16:13.194773 IP (tos 0x0, ttl 64, id 65411, offset 0, flags [DF], proto TCP (6), length 52)
    127.0.0.1.39692 > 127.0.0.1.11650: Flags [.], cksum 0xfe28 (incorrect -> 0x7b29), seq 949, ack 34110, win 512, options [nop,nop,TS val 3522372746 ecr 3522372705], length 0
2022-04-07 21:16:13.194779 IP (tos 0x0, ttl 64, id 9474, offset 0, flags [DF], proto TCP (6), length 7522)
    127.0.0.1.11650 > 127.0.0.1.39692: Flags [P.], cksum 0x1b57 (incorrect -> 0x0081), seq 34110:41580, ack 949, win 512, options [nop,nop,TS val 3522372746 ecr 3522372746], length 7470
2022-04-07 21:16:13.238789 IP (tos 0x0, ttl 64, id 65412, offset 0, flags [DF], proto TCP (6), length 52)
    127.0.0.1.39692 > 127.0.0.1.11650: Flags [.], cksum 0xfe28 (incorrect -> 0x5da6), seq 949, ack 41580, win 512, options [nop,nop,TS val 3522372790 ecr 3522372746], length 0
2022-04-07 21:16:13.238795 IP (tos 0x0, ttl 64, id 9475, offset 0, flags [DF], proto TCP (6), length 13498)
    127.0.0.1.11650 > 127.0.0.1.39692: Flags [P.], cksum 0x32af (incorrect -> 0x988d), seq 41580:55026, ack 949, win 512, options [nop,nop,TS val 3522372790 ecr 3522372790], length 13446
2022-04-07 21:16:13.282785 IP (tos 0x0, ttl 64, id 65413, offset 0, flags [DF], proto TCP (6), length 52)
    127.0.0.1.39692 > 127.0.0.1.11650: Flags [.], cksum 0xfe28 (incorrect -> 0x28c8), seq 949, ack 55026, win 512, options [nop,nop,TS val 3522372834 ecr 3522372790], length 0
2022-04-07 21:16:13.282793 IP (tos 0x0, ttl 64, id 9476, offset 0, flags [DF], proto TCP (6), length 13996)
    127.0.0.1.11650 > 127.0.0.1.39692: Flags [P.], cksum 0x34a1 (incorrect -> 0x3788), seq 55026:68970, ack 949, win 512, options [nop,nop,TS val 3522372834 ecr 3522372834], length 13944
2022-04-07 21:16:13.326778 IP (tos 0x0, ttl 64, id 65414, offset 0, flags [DF], proto TCP (6), length 52)
    127.0.0.1.39692 > 127.0.0.1.11650: Flags [.], cksum 0xfe28 (incorrect -> 0xf1f7), seq 949, ack 68970, win 512, options [nop,nop,TS val 3522372878 ecr 3522372834], length 0
2022-04-07 21:16:13.326787 IP (tos 0x0, ttl 64, id 9477, offset 0, flags [DF], proto TCP (6), length 19952)
    127.0.0.1.11650 > 127.0.0.1.39692: Flags [P.], cksum 0x4be5 (incorrect -> 0xce5f), seq 68970:88870, ack 949, win 512, options [nop,nop,TS val 3522372878 ecr 3522372878], length 19900
2022-04-07 21:16:13.370780 IP (tos 0x0, ttl 64, id 65415, offset 0, flags [DF], proto TCP (6), length 52)
    127.0.0.1.39692 > 127.0.0.1.11650: Flags [.], cksum 0xfe28 (incorrect -> 0xa3e3), seq 949, ack 88870, win 512, options [nop,nop,TS val 3522372922 ecr 3522372878], length 0
2022-04-07 21:16:13.370790 IP (tos 0x0, ttl 64, id 9478, offset 0, flags [DF], proto TCP (6), length 27960)
    127.0.0.1.11650 > 127.0.0.1.39692: Flags [P.], cksum 0x6b2d (incorrect -> 0x1024), seq 88870:116778, ack 949, win 512, options [nop,nop,TS val 3522372922 ecr 3522372922], length 27908
2022-04-07 21:16:13.414776 IP (tos 0x0, ttl 64, id 65416, offset 0, flags [DF], proto TCP (6), length 52)
    127.0.0.1.39692 > 127.0.0.1.11650: Flags [.], cksum 0xfe28 (incorrect -> 0x3687), seq 949, ack 116778, win 512, options [nop,nop,TS val 3522372966 ecr 3522372922], length 0
200, 13.37299108505249, 0.8473622798919678