2022-04-07 12:13:03.086118 IP (tos 0x0, ttl 64, id 7399, offset 0, flags [DF], proto TCP (6), length 60)
    127.0.0.1.52054 > 127.0.0.1.11850: Flags [S], cksum 0xfe30 (incorrect -> 0xcd0f), seq 3865376636, win 65495, options [mss 65495,sackOK,TS val 3489782637 ecr 0,nop,wscale 7], length 0
2022-04-07 12:13:03.086131 IP (tos 0x0, ttl 64, id 0, offset 0, flags [DF], proto TCP (6), length 60)
    127.0.0.1.11850 > 127.0.0.1.52054: Flags [S.], cksum 0xfe30 (incorrect -> 0xef26), seq 3344722711, ack 3865376637, win 65483, options [mss 65495,sackOK,TS val 3489782637 ecr 3489782637,nop,wscale 7], length 0
2022-04-07 12:13:03.086142 IP (tos 0x0, ttl 64, id 7400, offset 0, flags [DF], proto TCP (6), length 52)
    127.0.0.1.52054 > 127.0.0.1.11850: Flags [.], cksum 0xfe28 (incorrect -> 0x15e3), seq 1, ack 1, win 512, options [nop,nop,TS val 3489782637 ecr 3489782637], length 0
2022-04-07 12:13:03.086238 IP (tos 0x0, ttl 64, id 7401, offset 0, flags [DF], proto TCP (6), length 55)
    127.0.0.1.52054 > 127.0.0.1.11850: Flags [P.], cksum 0xfe2b (incorrect -> 0x10d6), seq 1:4, ack 1, win 512, options [nop,nop,TS val 3489782638 ecr 3489782637], length 3
2022-04-07 12:13:03.086253 IP (tos 0x0, ttl 64, id 63043, offset 0, flags [DF], proto TCP (6), length 52)
    127.0.0.1.11850 > 127.0.0.1.52054: Flags [.], cksum 0xfe28 (incorrect -> 0x15de), seq 1, ack 4, win 512, options [nop,nop,TS val 3489782638 ecr 3489782638], length 0
2022-04-07 12:13:03.086291 IP (tos 0x0, ttl 64, id 63044, offset 0, flags [DF], proto TCP (6), length 54)
    127.0.0.1.11850 > 127.0.0.1.52054: Flags [P.], cksum 0xfe2a (incorrect -> 0x10d4), seq 1:3, ack 4, win 512, options [nop,nop,TS val 3489782638 ecr 3489782638], length 2
2022-04-07 12:13:03.086301 IP (tos 0x0, ttl 64, id 7402, offset 0, flags [DF], proto TCP (6), length 52)
    127.0.0.1.52054 > 127.0.0.1.11850: Flags [.], cksum 0xfe28 (incorrect -> 0x15dc), seq 4, ack 3, win 512, options [nop,nop,TS val 3489782638 ecr 3489782638], length 0
2022-04-07 12:13:03.088470 IP (tos 0x0, ttl 64, id 7403, offset 0, flags [DF], proto TCP (6), length 62)
    127.0.0.1.52054 > 127.0.0.1.11850: Flags [P.], cksum 0xfe32 (incorrect -> 0x602a), seq 4:14, ack 3, win 512, options [nop,nop,TS val 3489782640 ecr 3489782638], length 10
2022-04-07 12:13:03.088490 IP (tos 0x0, ttl 64, id 63045, offset 0, flags [DF], proto TCP (6), length 52)
    127.0.0.1.11850 > 127.0.0.1.52054: Flags [.], cksum 0xfe28 (incorrect -> 0x15ce), seq 3, ack 14, win 512, options [nop,nop,TS val 3489782640 ecr 3489782640], length 0
2022-04-07 12:13:03.300233 IP (tos 0x0, ttl 64, id 63046, offset 0, flags [DF], proto TCP (6), length 62)
    127.0.0.1.11850 > 127.0.0.1.52054: Flags [P.], cksum 0xfe32 (incorrect -> 0x0fe7), seq 3:13, ack 14, win 512, options [nop,nop,TS val 3489782852 ecr 3489782640], length 10
2022-04-07 12:13:03.300240 IP (tos 0x0, ttl 64, id 7404, offset 0, flags [DF], proto TCP (6), length 52)
    127.0.0.1.52054 > 127.0.0.1.11850: Flags [.], cksum 0xfe28 (incorrect -> 0x141c), seq 14, ack 13, win 512, options [nop,nop,TS val 3489782852 ecr 3489782852], length 0
2022-04-07 12:13:03.305615 IP (tos 0x0, ttl 64, id 7405, offset 0, flags [DF], proto TCP (6), length 569)
    127.0.0.1.52054 > 127.0.0.1.11850: Flags [P.], cksum 0x002e (incorrect -> 0x0cde), seq 14:531, ack 13, win 512, options [nop,nop,TS val 3489782857 ecr 3489782852], length 517
2022-04-07 12:13:03.305624 IP (tos 0x0, ttl 64, id 63047, offset 0, flags [DF], proto TCP (6), length 52)
    127.0.0.1.11850 > 127.0.0.1.52054: Flags [.], cksum 0xfe28 (incorrect -> 0x1211), seq 13, ack 531, win 508, options [nop,nop,TS val 3489782857 ecr 3489782857], length 0
2022-04-07 12:13:03.520482 IP (tos 0x0, ttl 64, id 63048, offset 0, flags [DF], proto TCP (6), length 3538)
    127.0.0.1.11850 > 127.0.0.1.52054: Flags [P.], cksum 0x0bc7 (incorrect -> 0x5e33), seq 13:3499, ack 531, win 512, options [nop,nop,TS val 3489783072 ecr 3489782857], length 3486
2022-04-07 12:13:03.520490 IP (tos 0x0, ttl 64, id 7406, offset 0, flags [DF], proto TCP (6), length 52)
    127.0.0.1.52054 > 127.0.0.1.11850: Flags [.], cksum 0xfe28 (incorrect -> 0x02d3), seq 531, ack 3499, win 494, options [nop,nop,TS val 3489783072 ecr 3489783072], length 0
2022-04-07 12:13:03.613867 IP (tos 0x0, ttl 64, id 63049, offset 0, flags [DF], proto TCP (6), length 662)
    127.0.0.1.11850 > 127.0.0.1.52054: Flags [P.], cksum 0x008b (incorrect -> 0xc941), seq 3499:4109, ack 531, win 512, options [nop,nop,TS val 3489783165 ecr 3489783072], length 610
2022-04-07 12:13:03.613875 IP (tos 0x0, ttl 64, id 7407, offset 0, flags [DF], proto TCP (6), length 52)
    127.0.0.1.52054 > 127.0.0.1.11850: Flags [.], cksum 0xfe28 (incorrect -> 0xffab), seq 531, ack 4109, win 505, options [nop,nop,TS val 3489783165 ecr 3489783165], length 0
2022-04-07 12:13:03.614441 IP (tos 0x0, ttl 64, id 7408, offset 0, flags [DF], proto TCP (6), length 132)
    127.0.0.1.52054 > 127.0.0.1.11850: Flags [P.], cksum 0xfe78 (incorrect -> 0xf683), seq 531:611, ack 4109, win 512, options [nop,nop,TS val 3489783166 ecr 3489783165], length 80
2022-04-07 12:13:03.614450 IP (tos 0x0, ttl 64, id 63050, offset 0, flags [DF], proto TCP (6), length 52)
    127.0.0.1.11850 > 127.0.0.1.52054: Flags [.], cksum 0xfe28 (incorrect -> 0xff52), seq 4109, ack 611, win 512, options [nop,nop,TS val 3489783166 ecr 3489783166], length 0
2022-04-07 12:13:03.614980 IP (tos 0x0, ttl 64, id 7409, offset 0, flags [DF], proto TCP (6), length 427)
    127.0.0.1.52054 > 127.0.0.1.11850: Flags [P.], cksum 0xff9f (incorrect -> 0xd108), seq 611:986, ack 4109, win 512, options [nop,nop,TS val 3489783166 ecr 3489783166], length 375
2022-04-07 12:13:03.614988 IP (tos 0x0, ttl 64, id 63051, offset 0, flags [DF], proto TCP (6), length 52)
    127.0.0.1.11850 > 127.0.0.1.52054: Flags [.], cksum 0xfe28 (incorrect -> 0xfddd), seq 4109, ack 986, win 510, options [nop,nop,TS val 3489783166 ecr 3489783166], length 0
2022-04-07 12:13:03.852583 IP (tos 0x0, ttl 64, id 63052, offset 0, flags [DF], proto TCP (6), length 323)
    127.0.0.1.11850 > 127.0.0.1.52054: Flags [P.], cksum 0xff37 (incorrect -> 0x877a), seq 4109:4380, ack 986, win 512, options [nop,nop,TS val 3489783404 ecr 3489783166], length 271
2022-04-07 12:13:03.852591 IP (tos 0x0, ttl 64, id 7410, offset 0, flags [DF], proto TCP (6), length 52)
    127.0.0.1.52054 > 127.0.0.1.11850: Flags [.], cksum 0xfe28 (incorrect -> 0xfaf2), seq 986, ack 4380, win 510, options [nop,nop,TS val 3489783404 ecr 3489783404], length 0
2022-04-07 12:13:03.946610 IP (tos 0x0, ttl 64, id 63053, offset 0, flags [DF], proto TCP (6), length 323)
    127.0.0.1.11850 > 127.0.0.1.52054: Flags [P.], cksum 0xff37 (incorrect -> 0x4883), seq 4380:4651, ack 986, win 512, options [nop,nop,TS val 3489783498 ecr 3489783404], length 271
2022-04-07 12:13:03.946617 IP (tos 0x0, ttl 64, id 7411, offset 0, flags [DF], proto TCP (6), length 52)
    127.0.0.1.52054 > 127.0.0.1.11850: Flags [.], cksum 0xfe28 (incorrect -> 0xf929), seq 986, ack 4651, win 508, options [nop,nop,TS val 3489783498 ecr 3489783498], length 0
2022-04-07 12:13:04.053744 IP (tos 0x0, ttl 64, id 63054, offset 0, flags [DF], proto TCP (6), length 1342)
    127.0.0.1.11850 > 127.0.0.1.52054: Flags [P.], cksum 0x0333 (incorrect -> 0xb872), seq 4651:5941, ack 986, win 512, options [nop,nop,TS val 3489783605 ecr 3489783498], length 1290
2022-04-07 12:13:04.053771 IP (tos 0x0, ttl 64, id 7412, offset 0, flags [DF], proto TCP (6), length 52)
    127.0.0.1.52054 > 127.0.0.1.11850: Flags [.], cksum 0xfe28 (incorrect -> 0xf34f), seq 986, ack 5941, win 502, options [nop,nop,TS val 3489783605 ecr 3489783605], length 0
2022-04-07 12:13:04.056364 IP (tos 0x0, ttl 64, id 27553, offset 0, flags [DF], proto TCP (6), length 60)
    127.0.0.1.52058 > 127.0.0.1.11850: Flags [S], cksum 0xfe30 (incorrect -> 0xbeb8), seq 147578782, win 65495, options [mss 65495,sackOK,TS val 3489783608 ecr 0,nop,wscale 7], length 0
2022-04-07 12:13:04.056373 IP (tos 0x0, ttl 64, id 0, offset 0, flags [DF], proto TCP (6), length 60)
    127.0.0.1.11850 > 127.0.0.1.52058: Flags [S.], cksum 0xfe30 (incorrect -> 0x2c4f), seq 1573422433, ack 147578783, win 65483, options [mss 65495,sackOK,TS val 3489783608 ecr 3489783608,nop,wscale 7], length 0
2022-04-07 12:13:04.056380 IP (tos 0x0, ttl 64, id 27554, offset 0, flags [DF], proto TCP (6), length 52)
    127.0.0.1.52058 > 127.0.0.1.11850: Flags [.], cksum 0xfe28 (incorrect -> 0x530b), seq 1, ack 1, win 512, options [nop,nop,TS val 3489783608 ecr 3489783608], length 0
2022-04-07 12:13:04.056425 IP (tos 0x0, ttl 64, id 27555, offset 0, flags [DF], proto TCP (6), length 55)
    127.0.0.1.52058 > 127.0.0.1.11850: Flags [P.], cksum 0xfe2b (incorrect -> 0x4dff), seq 1:4, ack 1, win 512, options [nop,nop,TS val 3489783608 ecr 3489783608], length 3
2022-04-07 12:13:04.056429 IP (tos 0x0, ttl 64, id 53943, offset 0, flags [DF], proto TCP (6), length 52)
    127.0.0.1.11850 > 127.0.0.1.52058: Flags [.], cksum 0xfe28 (incorrect -> 0x5308), seq 1, ack 4, win 512, options [nop,nop,TS val 3489783608 ecr 3489783608], length 0
2022-04-07 12:13:04.056473 IP (tos 0x0, ttl 64, id 53944, offset 0, flags [DF], proto TCP (6), length 54)
    127.0.0.1.11850 > 127.0.0.1.52058: Flags [P.], cksum 0xfe2a (incorrect -> 0x4dfe), seq 1:3, ack 4, win 512, options [nop,nop,TS val 3489783608 ecr 3489783608], length 2
2022-04-07 12:13:04.056478 IP (tos 0x0, ttl 64, id 27556, offset 0, flags [DF], proto TCP (6), length 52)
    127.0.0.1.52058 > 127.0.0.1.11850: Flags [.], cksum 0xfe28 (incorrect -> 0x5306), seq 4, ack 3, win 512, options [nop,nop,TS val 3489783608 ecr 3489783608], length 0
2022-04-07 12:13:04.058358 IP (tos 0x0, ttl 64, id 27557, offset 0, flags [DF], proto TCP (6), length 62)
    127.0.0.1.52058 > 127.0.0.1.11850: Flags [P.], cksum 0xfe32 (incorrect -> 0x9d54), seq 4:14, ack 3, win 512, options [nop,nop,TS val 3489783610 ecr 3489783608], length 10
2022-04-07 12:13:04.058373 IP (tos 0x0, ttl 64, id 53945, offset 0, flags [DF], proto TCP (6), length 52)
    127.0.0.1.11850 > 127.0.0.1.52058: Flags [.], cksum 0xfe28 (incorrect -> 0x52f8), seq 3, ack 14, win 512, options [nop,nop,TS val 3489783610 ecr 3489783610], length 0
2022-04-07 12:13:04.269340 IP (tos 0x0, ttl 64, id 53946, offset 0, flags [DF], proto TCP (6), length 62)
    127.0.0.1.11850 > 127.0.0.1.52058: Flags [P.], cksum 0xfe32 (incorrect -> 0x4d12), seq 3:13, ack 14, win 512, options [nop,nop,TS val 3489783821 ecr 3489783610], length 10
2022-04-07 12:13:04.269350 IP (tos 0x0, ttl 64, id 27558, offset 0, flags [DF], proto TCP (6), length 52)
    127.0.0.1.52058 > 127.0.0.1.11850: Flags [.], cksum 0xfe28 (incorrect -> 0x5148), seq 14, ack 13, win 512, options [nop,nop,TS val 3489783821 ecr 3489783821], length 0
2022-04-07 12:13:04.274292 IP (tos 0x0, ttl 64, id 27559, offset 0, flags [DF], proto TCP (6), length 569)
    127.0.0.1.52058 > 127.0.0.1.11850: Flags [P.], cksum 0x002e (incorrect -> 0x8417), seq 14:531, ack 13, win 512, options [nop,nop,TS val 3489783826 ecr 3489783821], length 517
2022-04-07 12:13:04.274300 IP (tos 0x0, ttl 64, id 53947, offset 0, flags [DF], proto TCP (6), length 52)
    127.0.0.1.11850 > 127.0.0.1.52058: Flags [.], cksum 0xfe28 (incorrect -> 0x4f3d), seq 13, ack 531, win 508, options [nop,nop,TS val 3489783826 ecr 3489783826], length 0
2022-04-07 12:13:04.487315 IP (tos 0x0, ttl 64, id 53948, offset 0, flags [DF], proto TCP (6), length 3538)
    127.0.0.1.11850 > 127.0.0.1.52058: Flags [P.], cksum 0x0bc7 (incorrect -> 0x2ad0), seq 13:3499, ack 531, win 512, options [nop,nop,TS val 3489784039 ecr 3489783826], length 3486
2022-04-07 12:13:04.487321 IP (tos 0x0, ttl 64, id 27560, offset 0, flags [DF], proto TCP (6), length 52)
    127.0.0.1.52058 > 127.0.0.1.11850: Flags [.], cksum 0xfe28 (incorrect -> 0x4003), seq 531, ack 3499, win 494, options [nop,nop,TS val 3489784039 ecr 3489784039], length 0
2022-04-07 12:13:04.567595 IP (tos 0x0, ttl 64, id 53949, offset 0, flags [DF], proto TCP (6), length 661)
    127.0.0.1.11850 > 127.0.0.1.52058: Flags [P.], cksum 0x008a (incorrect -> 0x0b49), seq 3499:4108, ack 531, win 512, options [nop,nop,TS val 3489784119 ecr 3489784039], length 609
2022-04-07 12:13:04.567602 IP (tos 0x0, ttl 64, id 27561, offset 0, flags [DF], proto TCP (6), length 52)
    127.0.0.1.52058 > 127.0.0.1.11850: Flags [.], cksum 0xfe28 (incorrect -> 0x3cf7), seq 531, ack 4108, win 505, options [nop,nop,TS val 3489784119 ecr 3489784119], length 0
2022-04-07 12:13:04.568034 IP (tos 0x0, ttl 64, id 27562, offset 0, flags [DF], proto TCP (6), length 132)
    127.0.0.1.52058 > 127.0.0.1.11850: Flags [P.], cksum 0xfe78 (incorrect -> 0x14ed), seq 531:611, ack 4108, win 512, options [nop,nop,TS val 3489784119 ecr 3489784119], length 80
2022-04-07 12:13:04.568042 IP (tos 0x0, ttl 64, id 53950, offset 0, flags [DF], proto TCP (6), length 52)
    127.0.0.1.11850 > 127.0.0.1.52058: Flags [.], cksum 0xfe28 (incorrect -> 0x3ca0), seq 4108, ack 611, win 512, options [nop,nop,TS val 3489784119 ecr 3489784119], length 0
2022-04-07 12:13:04.568350 IP (tos 0x0, ttl 64, id 27563, offset 0, flags [DF], proto TCP (6), length 1344)
    127.0.0.1.52058 > 127.0.0.1.11850: Flags [P.], cksum 0x0335 (incorrect -> 0x45a9), seq 611:1903, ack 4108, win 512, options [nop,nop,TS val 3489784120 ecr 3489784119], length 1292
2022-04-07 12:13:04.568357 IP (tos 0x0, ttl 64, id 53951, offset 0, flags [DF], proto TCP (6), length 52)
    127.0.0.1.11850 > 127.0.0.1.52058: Flags [.], cksum 0xfe28 (incorrect -> 0x379c), seq 4108, ack 1903, win 502, options [nop,nop,TS val 3489784120 ecr 3489784120], length 0
2022-04-07 12:13:04.781581 IP (tos 0x0, ttl 64, id 53952, offset 0, flags [DF], proto TCP (6), length 594)
    127.0.0.1.11850 > 127.0.0.1.52058: Flags [P.], cksum 0x0047 (incorrect -> 0x9788), seq 4108:4650, ack 1903, win 512, options [nop,nop,TS val 3489784333 ecr 3489784120], length 542
2022-04-07 12:13:04.781590 IP (tos 0x0, ttl 64, id 27564, offset 0, flags [DF], proto TCP (6), length 52)
    127.0.0.1.52058 > 127.0.0.1.11850: Flags [.], cksum 0xfe28 (incorrect -> 0x33ce), seq 1903, ack 4650, win 508, options [nop,nop,TS val 3489784333 ecr 3489784333], length 0
2022-04-07 12:13:04.952762 IP (tos 0x0, ttl 64, id 53953, offset 0, flags [DF], proto TCP (6), length 3538)
    127.0.0.1.11850 > 127.0.0.1.52058: Flags [P.], cksum 0x0bc7 (incorrect -> 0x314c), seq 4650:8136, ack 1903, win 512, options [nop,nop,TS val 3489784504 ecr 3489784333], length 3486
2022-04-07 12:13:04.952769 IP (tos 0x0, ttl 64, id 27565, offset 0, flags [DF], proto TCP (6), length 52)
    127.0.0.1.52058 > 127.0.0.1.11850: Flags [.], cksum 0xfe28 (incorrect -> 0x24e8), seq 1903, ack 8136, win 494, options [nop,nop,TS val 3489784504 ecr 3489784504], length 0
2022-04-07 12:13:04.974483 IP (tos 0x0, ttl 64, id 53954, offset 0, flags [DF], proto TCP (6), length 1048)
    127.0.0.1.11850 > 127.0.0.1.52058: Flags [P.], cksum 0x020d (incorrect -> 0x9c3e), seq 8136:9132, ack 1903, win 512, options [nop,nop,TS val 3489784526 ecr 3489784504], length 996
2022-04-07 12:13:04.974492 IP (tos 0x0, ttl 64, id 27566, offset 0, flags [DF], proto TCP (6), length 52)
    127.0.0.1.52058 > 127.0.0.1.11850: Flags [.], cksum 0xfe28 (incorrect -> 0x20ce), seq 1903, ack 9132, win 504, options [nop,nop,TS val 3489784526 ecr 3489784526], length 0
2022-04-07 12:13:04.975115 IP (tos 0x0, ttl 64, id 53955, offset 0, flags [DF], proto TCP (6), length 1966)
    127.0.0.1.11850 > 127.0.0.1.52058: Flags [P.], cksum 0x05a3 (incorrect -> 0x8d96), seq 9132:11046, ack 1903, win 512, options [nop,nop,TS val 3489784526 ecr 3489784526], length 1914
2022-04-07 12:13:04.975123 IP (tos 0x0, ttl 64, id 27567, offset 0, flags [DF], proto TCP (6), length 52)
    127.0.0.1.52058 > 127.0.0.1.11850: Flags [.], cksum 0xfe28 (incorrect -> 0x1958), seq 1903, ack 11046, win 500, options [nop,nop,TS val 3489784526 ecr 3489784526], length 0
2022-04-07 12:13:04.996212 IP (tos 0x0, ttl 64, id 53956, offset 0, flags [DF], proto TCP (6), length 1320)
    127.0.0.1.11850 > 127.0.0.1.52058: Flags [P.], cksum 0x031d (incorrect -> 0xad49), seq 11046:12314, ack 1903, win 512, options [nop,nop,TS val 3489784547 ecr 3489784526], length 1268
2022-04-07 12:13:04.996219 IP (tos 0x0, ttl 64, id 27568, offset 0, flags [DF], proto TCP (6), length 52)
    127.0.0.1.52058 > 127.0.0.1.11850: Flags [.], cksum 0xfe28 (incorrect -> 0x1437), seq 1903, ack 12314, win 503, options [nop,nop,TS val 3489784547 ecr 3489784547], length 0
2022-04-07 12:13:05.046539 IP (tos 0x0, ttl 64, id 53957, offset 0, flags [DF], proto TCP (6), length 3470)
    127.0.0.1.11850 > 127.0.0.1.52058: Flags [P.], cksum 0x0b83 (incorrect -> 0xe0cc), seq 12314:15732, ack 1903, win 512, options [nop,nop,TS val 3489784598 ecr 3489784547], length 3418
2022-04-07 12:13:05.046545 IP (tos 0x0, ttl 64, id 27569, offset 0, flags [DF], proto TCP (6), length 52)
    127.0.0.1.52058 > 127.0.0.1.11850: Flags [.], cksum 0xfe28 (incorrect -> 0x0680), seq 1903, ack 15732, win 494, options [nop,nop,TS val 3489784598 ecr 3489784598], length 0
2022-04-07 12:13:05.058902 IP (tos 0x0, ttl 64, id 53958, offset 0, flags [DF], proto TCP (6), length 1074)
    127.0.0.1.11850 > 127.0.0.1.52058: Flags [P.], cksum 0x0227 (incorrect -> 0xeb09), seq 15732:16754, ack 1903, win 512, options [nop,nop,TS val 3489784610 ecr 3489784598], length 1022
2022-04-07 12:13:05.058907 IP (tos 0x0, ttl 64, id 27570, offset 0, flags [DF], proto TCP (6), length 52)
    127.0.0.1.52058 > 127.0.0.1.11850: Flags [.], cksum 0xfe28 (incorrect -> 0x0260), seq 1903, ack 16754, win 504, options [nop,nop,TS val 3489784610 ecr 3489784610], length 0
2022-04-07 12:13:05.059002 IP (tos 0x0, ttl 64, id 53959, offset 0, flags [DF], proto TCP (6), length 2681)
    127.0.0.1.11850 > 127.0.0.1.52058: Flags [P.], cksum 0x086e (incorrect -> 0x509b), seq 16754:19383, ack 1903, win 512, options [nop,nop,TS val 3489784610 ecr 3489784610], length 2629
2022-04-07 12:13:05.059006 IP (tos 0x0, ttl 64, id 27571, offset 0, flags [DF], proto TCP (6), length 52)
    127.0.0.1.52058 > 127.0.0.1.11850: Flags [.], cksum 0xfe28 (incorrect -> 0xf825), seq 1903, ack 19383, win 493, options [nop,nop,TS val 3489784610 ecr 3489784610], length 0
2022-04-07 12:13:05.059234 IP (tos 0x0, ttl 64, id 53960, offset 0, flags [DF], proto TCP (6), length 3788)
    127.0.0.1.11850 > 127.0.0.1.52058: Flags [P.], cksum 0x0cc1 (incorrect -> 0x203e), seq 19383:23119, ack 1903, win 512, options [nop,nop,TS val 3489784611 ecr 3489784610], length 3736
2022-04-07 12:13:05.059238 IP (tos 0x0, ttl 64, id 27572, offset 0, flags [DF], proto TCP (6), length 52)
    127.0.0.1.52058 > 127.0.0.1.11850: Flags [.], cksum 0xfe28 (incorrect -> 0xe999), seq 1903, ack 23119, win 479, options [nop,nop,TS val 3489784611 ecr 3489784611], length 0
2022-04-07 12:13:05.068241 IP (tos 0x0, ttl 64, id 53961, offset 0, flags [DF], proto TCP (6), length 1341)
    127.0.0.1.11850 > 127.0.0.1.52058: Flags [P.], cksum 0x0332 (incorrect -> 0x836f), seq 23119:24408, ack 1903, win 512, options [nop,nop,TS val 3489784620 ecr 3489784611], length 1289
2022-04-07 12:13:05.068248 IP (tos 0x0, ttl 64, id 27573, offset 0, flags [DF], proto TCP (6), length 52)
    127.0.0.1.52058 > 127.0.0.1.11850: Flags [.], cksum 0xfe28 (incorrect -> 0xe467), seq 1903, ack 24408, win 502, options [nop,nop,TS val 3489784620 ecr 3489784620], length 0
2022-04-07 12:13:05.070592 IP (tos 0x0, ttl 64, id 53962, offset 0, flags [DF], proto TCP (6), length 3165)
    127.0.0.1.11850 > 127.0.0.1.52058: Flags [P.], cksum 0x0a52 (incorrect -> 0xfdb3), seq 24408:27521, ack 1903, win 512, options [nop,nop,TS val 3489784622 ecr 3489784620], length 3113
2022-04-07 12:13:05.070685 IP (tos 0x0, ttl 64, id 27574, offset 0, flags [DF], proto TCP (6), length 52)
    127.0.0.1.52058 > 127.0.0.1.11850: Flags [.], cksum 0xfe28 (incorrect -> 0xd830), seq 1903, ack 27521, win 512, options [nop,nop,TS val 3489784622 ecr 3489784622], length 0
2022-04-07 12:13:05.089963 IP (tos 0x0, ttl 64, id 53963, offset 0, flags [DF], proto TCP (6), length 2343)
    127.0.0.1.11850 > 127.0.0.1.52058: Flags [P.], cksum 0x071c (incorrect -> 0xe539), seq 27521:29812, ack 1903, win 512, options [nop,nop,TS val 3489784641 ecr 3489784622], length 2291
2022-04-07 12:13:05.090082 IP (tos 0x0, ttl 64, id 27575, offset 0, flags [DF], proto TCP (6), length 52)
    127.0.0.1.52058 > 127.0.0.1.11850: Flags [.], cksum 0xfe28 (incorrect -> 0xcf17), seq 1903, ack 29812, win 512, options [nop,nop,TS val 3489784641 ecr 3489784641], length 0
2022-04-07 12:13:05.126974 IP (tos 0x0, ttl 64, id 53964, offset 0, flags [DF], proto TCP (6), length 3212)
    127.0.0.1.11850 > 127.0.0.1.52058: Flags [P.], cksum 0x0a81 (incorrect -> 0x1916), seq 29812:32972, ack 1903, win 512, options [nop,nop,TS val 3489784678 ecr 3489784641], length 3160
2022-04-07 12:13:05.127099 IP (tos 0x0, ttl 64, id 27576, offset 0, flags [DF], proto TCP (6), length 52)
    127.0.0.1.52058 > 127.0.0.1.11850: Flags [.], cksum 0xfe28 (incorrect -> 0xc275), seq 1903, ack 32972, win 512, options [nop,nop,TS val 3489784678 ecr 3489784678], length 0
2022-04-07 12:13:05.127141 IP (tos 0x0, ttl 64, id 53965, offset 0, flags [DF], proto TCP (6), length 2044)
    127.0.0.1.11850 > 127.0.0.1.52058: Flags [P.], cksum 0x05f1 (incorrect -> 0xa459), seq 32972:34964, ack 1903, win 512, options [nop,nop,TS val 3489784678 ecr 3489784678], length 1992
2022-04-07 12:13:05.127151 IP (tos 0x0, ttl 64, id 27577, offset 0, flags [DF], proto TCP (6), length 52)
    127.0.0.1.52058 > 127.0.0.1.11850: Flags [.], cksum 0xfe28 (incorrect -> 0xbaad), seq 1903, ack 34964, win 512, options [nop,nop,TS val 3489784678 ecr 3489784678], length 0
2022-04-07 12:13:05.141741 IP (tos 0x0, ttl 64, id 53966, offset 0, flags [DF], proto TCP (6), length 4100)
    127.0.0.1.11850 > 127.0.0.1.52058: Flags [P.], cksum 0x0df9 (incorrect -> 0x519b), seq 34964:39012, ack 1903, win 512, options [nop,nop,TS val 3489784693 ecr 3489784678], length 4048
2022-04-07 12:13:05.182776 IP (tos 0x0, ttl 64, id 27578, offset 0, flags [DF], proto TCP (6), length 52)
    127.0.0.1.52058 > 127.0.0.1.11850: Flags [.], cksum 0xfe28 (incorrect -> 0xaa96), seq 1903, ack 39012, win 512, options [nop,nop,TS val 3489784734 ecr 3489784693], length 0
2022-04-07 12:13:05.182785 IP (tos 0x0, ttl 64, id 53967, offset 0, flags [DF], proto TCP (6), length 20470)
    127.0.0.1.11850 > 127.0.0.1.52058: Flags [P.], cksum 0x4deb (incorrect -> 0x4c05), seq 39012:59430, ack 1903, win 512, options [nop,nop,TS val 3489784734 ecr 3489784734], length 20418
2022-04-07 12:13:05.226777 IP (tos 0x0, ttl 64, id 27579, offset 0, flags [DF], proto TCP (6), length 52)
    127.0.0.1.52058 > 127.0.0.1.11850: Flags [.], cksum 0xfe28 (incorrect -> 0x5a7f), seq 1903, ack 59430, win 512, options [nop,nop,TS val 3489784778 ecr 3489784734], length 0
2022-04-07 12:13:05.226787 IP (tos 0x0, ttl 64, id 53968, offset 0, flags [DF], proto TCP (6), length 23173)
    127.0.0.1.11850 > 127.0.0.1.52058: Flags [P.], cksum 0x587a (incorrect -> 0x86e5), seq 59430:82551, ack 1903, win 512, options [nop,nop,TS val 3489784778 ecr 3489784778], length 23121
2022-04-07 12:13:05.270782 IP (tos 0x0, ttl 64, id 27580, offset 0, flags [DF], proto TCP (6), length 52)
    127.0.0.1.52058 > 127.0.0.1.11850: Flags [.], cksum 0xfe28 (incorrect -> 0xffd5), seq 1903, ack 82551, win 512, options [nop,nop,TS val 3489784822 ecr 3489784778], length 0
2022-04-07 12:13:05.270794 IP (tos 0x0, ttl 64, id 53969, offset 0, flags [DF], proto TCP (6), length 25367)
    127.0.0.1.11850 > 127.0.0.1.52058: Flags [P.], cksum 0x610c (incorrect -> 0xada3), seq 82551:107866, ack 1903, win 512, options [nop,nop,TS val 3489784822 ecr 3489784822], length 25315
2022-04-07 12:13:05.314776 IP (tos 0x0, ttl 64, id 27581, offset 0, flags [DF], proto TCP (6), length 52)
    127.0.0.1.52058 > 127.0.0.1.11850: Flags [.], cksum 0xfe28 (incorrect -> 0x9c9a), seq 1903, ack 107866, win 512, options [nop,nop,TS val 3489784866 ecr 3489784822], length 0
2022-04-07 12:13:05.314781 IP (tos 0x0, ttl 64, id 53970, offset 0, flags [DF], proto TCP (6), length 3538)
    127.0.0.1.11850 > 127.0.0.1.52058: Flags [P.], cksum 0x0bc7 (incorrect -> 0x0e63), seq 107866:111352, ack 1903, win 512, options [nop,nop,TS val 3489784866 ecr 3489784866], length 3486
2022-04-07 12:13:05.314789 IP (tos 0x0, ttl 64, id 27582, offset 0, flags [DF], proto TCP (6), length 52)
    127.0.0.1.52058 > 127.0.0.1.11850: Flags [.], cksum 0xfe28 (incorrect -> 0x8ed0), seq 1903, ack 111352, win 512, options [nop,nop,TS val 3489784866 ecr 3489784866], length 0
200, 6.072027683258057, 2.3113250732421875