2022-04-07 14:05:10.927844 IP (tos 0x0, ttl 64, id 21328, offset 0, flags [DF], proto TCP (6), length 60)
    127.0.0.1.53292 > 127.0.0.1.9350: Flags [S], cksum 0xfe30 (incorrect -> 0xcb12), seq 2023277355, win 65495, options [mss 65495,sackOK,TS val 3496510479 ecr 0,nop,wscale 7], length 0
2022-04-07 14:05:10.927854 IP (tos 0x0, ttl 64, id 0, offset 0, flags [DF], proto TCP (6), length 60)
    127.0.0.1.9350 > 127.0.0.1.53292: Flags [S.], cksum 0xfe30 (incorrect -> 0x562e), seq 1524221325, ack 2023277356, win 65483, options [mss 65495,sackOK,TS val 3496510479 ecr 3496510479,nop,wscale 7], length 0
2022-04-07 14:05:10.927863 IP (tos 0x0, ttl 64, id 21329, offset 0, flags [DF], proto TCP (6), length 52)
    127.0.0.1.53292 > 127.0.0.1.9350: Flags [.], cksum 0xfe28 (incorrect -> 0x7cea), seq 1, ack 1, win 512, options [nop,nop,TS val 3496510479 ecr 3496510479], length 0
2022-04-07 14:05:10.927991 IP (tos 0x0, ttl 64, id 21330, offset 0, flags [DF], proto TCP (6), length 55)
    127.0.0.1.53292 > 127.0.0.1.9350: Flags [P.], cksum 0xfe2b (incorrect -> 0x77de), seq 1:4, ack 1, win 512, options [nop,nop,TS val 3496510479 ecr 3496510479], length 3
2022-04-07 14:05:10.927996 IP (tos 0x0, ttl 64, id 60612, offset 0, flags [DF], proto TCP (6), length 52)
    127.0.0.1.9350 > 127.0.0.1.53292: Flags [.], cksum 0xfe28 (incorrect -> 0x7ce7), seq 1, ack 4, win 512, options [nop,nop,TS val 3496510479 ecr 3496510479], length 0
2022-04-07 14:05:10.928016 IP (tos 0x0, ttl 64, id 60613, offset 0, flags [DF], proto TCP (6), length 54)
    127.0.0.1.9350 > 127.0.0.1.53292: Flags [P.], cksum 0xfe2a (incorrect -> 0x77dd), seq 1:3, ack 4, win 512, options [nop,nop,TS val 3496510479 ecr 3496510479], length 2
2022-04-07 14:05:10.928022 IP (tos 0x0, ttl 64, id 21331, offset 0, flags [DF], proto TCP (6), length 52)
    127.0.0.1.53292 > 127.0.0.1.9350: Flags [.], cksum 0xfe28 (incorrect -> 0x7ce5), seq 4, ack 3, win 512, options [nop,nop,TS val 3496510479 ecr 3496510479], length 0
2022-04-07 14:05:10.929401 IP (tos 0x0, ttl 64, id 21332, offset 0, flags [DF], proto TCP (6), length 62)
    127.0.0.1.53292 > 127.0.0.1.9350: Flags [P.], cksum 0xfe32 (incorrect -> 0x1297), seq 4:14, ack 3, win 512, options [nop,nop,TS val 3496510481 ecr 3496510479], length 10
2022-04-07 14:05:10.929425 IP (tos 0x0, ttl 64, id 60614, offset 0, flags [DF], proto TCP (6), length 52)
    127.0.0.1.9350 > 127.0.0.1.53292: Flags [.], cksum 0xfe28 (incorrect -> 0x7cd7), seq 3, ack 14, win 512, options [nop,nop,TS val 3496510481 ecr 3496510481], length 0
2022-04-07 14:05:11.148339 IP (tos 0x0, ttl 64, id 60615, offset 0, flags [DF], proto TCP (6), length 62)
    127.0.0.1.9350 > 127.0.0.1.53292: Flags [P.], cksum 0xfe32 (incorrect -> 0x76e9), seq 3:13, ack 14, win 512, options [nop,nop,TS val 3496510700 ecr 3496510481], length 10
2022-04-07 14:05:11.148359 IP (tos 0x0, ttl 64, id 21333, offset 0, flags [DF], proto TCP (6), length 52)
    127.0.0.1.53292 > 127.0.0.1.9350: Flags [.], cksum 0xfe28 (incorrect -> 0x7b17), seq 14, ack 13, win 512, options [nop,nop,TS val 3496510700 ecr 3496510700], length 0
2022-04-07 14:05:11.154573 IP (tos 0x0, ttl 64, id 21334, offset 0, flags [DF], proto TCP (6), length 569)
    127.0.0.1.53292 > 127.0.0.1.9350: Flags [P.], cksum 0x002e (incorrect -> 0x2da4), seq 14:531, ack 13, win 512, options [nop,nop,TS val 3496510706 ecr 3496510700], length 517
2022-04-07 14:05:11.154583 IP (tos 0x0, ttl 64, id 60616, offset 0, flags [DF], proto TCP (6), length 52)
    127.0.0.1.9350 > 127.0.0.1.53292: Flags [.], cksum 0xfe28 (incorrect -> 0x790a), seq 13, ack 531, win 508, options [nop,nop,TS val 3496510706 ecr 3496510706], length 0
2022-04-07 14:05:11.395575 IP (tos 0x0, ttl 64, id 60617, offset 0, flags [DF], proto TCP (6), length 3538)
    127.0.0.1.9350 > 127.0.0.1.53292: Flags [P.], cksum 0x0bc7 (incorrect -> 0xdc3b), seq 13:3499, ack 531, win 512, options [nop,nop,TS val 3496510947 ecr 3496510706], length 3486
2022-04-07 14:05:11.395592 IP (tos 0x0, ttl 64, id 21335, offset 0, flags [DF], proto TCP (6), length 52)
    127.0.0.1.53292 > 127.0.0.1.9350: Flags [.], cksum 0xfe28 (incorrect -> 0x6998), seq 531, ack 3499, win 494, options [nop,nop,TS val 3496510947 ecr 3496510947], length 0
2022-04-07 14:05:11.489404 IP (tos 0x0, ttl 64, id 60618, offset 0, flags [DF], proto TCP (6), length 1012)
    127.0.0.1.9350 > 127.0.0.1.53292: Flags [P.], cksum 0x01e9 (incorrect -> 0xf742), seq 3499:4459, ack 531, win 512, options [nop,nop,TS val 3496511041 ecr 3496510947], length 960
2022-04-07 14:05:11.489416 IP (tos 0x0, ttl 64, id 21336, offset 0, flags [DF], proto TCP (6), length 52)
    127.0.0.1.53292 > 127.0.0.1.9350: Flags [.], cksum 0xfe28 (incorrect -> 0x6512), seq 531, ack 4459, win 504, options [nop,nop,TS val 3496511041 ecr 3496511041], length 0
2022-04-07 14:05:11.490104 IP (tos 0x0, ttl 64, id 21337, offset 0, flags [DF], proto TCP (6), length 145)
    127.0.0.1.53292 > 127.0.0.1.9350: Flags [P.], cksum 0xfe85 (incorrect -> 0xf5d6), seq 531:624, ack 4459, win 512, options [nop,nop,TS val 3496511041 ecr 3496511041], length 93
2022-04-07 14:05:11.490112 IP (tos 0x0, ttl 64, id 60619, offset 0, flags [DF], proto TCP (6), length 52)
    127.0.0.1.9350 > 127.0.0.1.53292: Flags [.], cksum 0xfe28 (incorrect -> 0x64ad), seq 4459, ack 624, win 512, options [nop,nop,TS val 3496511041 ecr 3496511041], length 0
2022-04-07 14:05:11.779833 IP (tos 0x0, ttl 64, id 60620, offset 0, flags [DF], proto TCP (6), length 103)
    127.0.0.1.9350 > 127.0.0.1.53292: Flags [P.], cksum 0xfe5b (incorrect -> 0xe31c), seq 4459:4510, ack 624, win 512, options [nop,nop,TS val 3496511331 ecr 3496511041], length 51
2022-04-07 14:05:11.779850 IP (tos 0x0, ttl 64, id 21338, offset 0, flags [DF], proto TCP (6), length 52)
    127.0.0.1.53292 > 127.0.0.1.9350: Flags [.], cksum 0xfe28 (incorrect -> 0x6236), seq 624, ack 4510, win 512, options [nop,nop,TS val 3496511331 ecr 3496511331], length 0
2022-04-07 14:05:11.780432 IP (tos 0x0, ttl 64, id 21339, offset 0, flags [DF], proto TCP (6), length 371)
    127.0.0.1.53292 > 127.0.0.1.9350: Flags [P.], cksum 0xff67 (incorrect -> 0xa094), seq 624:943, ack 4510, win 512, options [nop,nop,TS val 3496511332 ecr 3496511331], length 319
2022-04-07 14:05:11.780440 IP (tos 0x0, ttl 64, id 60621, offset 0, flags [DF], proto TCP (6), length 52)
    127.0.0.1.9350 > 127.0.0.1.53292: Flags [.], cksum 0xfe28 (incorrect -> 0x60f7), seq 4510, ack 943, win 510, options [nop,nop,TS val 3496511332 ecr 3496511332], length 0
2022-04-07 14:05:12.082007 IP (tos 0x0, ttl 64, id 60622, offset 0, flags [DF], proto TCP (6), length 429)
    127.0.0.1.9350 > 127.0.0.1.53292: Flags [P.], cksum 0xffa1 (incorrect -> 0xbf69), seq 4510:4887, ack 943, win 512, options [nop,nop,TS val 3496511633 ecr 3496511332], length 377
2022-04-07 14:05:12.084245 IP (tos 0x0, ttl 64, id 3841, offset 0, flags [DF], proto TCP (6), length 60)
    127.0.0.1.53294 > 127.0.0.1.9350: Flags [S], cksum 0xfe30 (incorrect -> 0xa82d), seq 2112478264, win 65495, options [mss 65495,sackOK,TS val 3496511636 ecr 0,nop,wscale 7], length 0
2022-04-07 14:05:12.084256 IP (tos 0x0, ttl 64, id 0, offset 0, flags [DF], proto TCP (6), length 60)
    127.0.0.1.9350 > 127.0.0.1.53294: Flags [S.], cksum 0xfe30 (incorrect -> 0x7262), seq 2726050380, ack 2112478265, win 65483, options [mss 65495,sackOK,TS val 3496511636 ecr 3496511636,nop,wscale 7], length 0
2022-04-07 14:05:12.084265 IP (tos 0x0, ttl 64, id 3842, offset 0, flags [DF], proto TCP (6), length 52)
    127.0.0.1.53294 > 127.0.0.1.9350: Flags [.], cksum 0xfe28 (incorrect -> 0x991e), seq 1, ack 1, win 512, options [nop,nop,TS val 3496511636 ecr 3496511636], length 0
2022-04-07 14:05:12.084323 IP (tos 0x0, ttl 64, id 3843, offset 0, flags [DF], proto TCP (6), length 55)
    127.0.0.1.53294 > 127.0.0.1.9350: Flags [P.], cksum 0xfe2b (incorrect -> 0x9412), seq 1:4, ack 1, win 512, options [nop,nop,TS val 3496511636 ecr 3496511636], length 3
2022-04-07 14:05:12.084326 IP (tos 0x0, ttl 64, id 33244, offset 0, flags [DF], proto TCP (6), length 52)
    127.0.0.1.9350 > 127.0.0.1.53294: Flags [.], cksum 0xfe28 (incorrect -> 0x991b), seq 1, ack 4, win 512, options [nop,nop,TS val 3496511636 ecr 3496511636], length 0
2022-04-07 14:05:12.084383 IP (tos 0x0, ttl 64, id 33245, offset 0, flags [DF], proto TCP (6), length 54)
    127.0.0.1.9350 > 127.0.0.1.53294: Flags [P.], cksum 0xfe2a (incorrect -> 0x9411), seq 1:3, ack 4, win 512, options [nop,nop,TS val 3496511636 ecr 3496511636], length 2
2022-04-07 14:05:12.084387 IP (tos 0x0, ttl 64, id 3844, offset 0, flags [DF], proto TCP (6), length 52)
    127.0.0.1.53294 > 127.0.0.1.9350: Flags [.], cksum 0xfe28 (incorrect -> 0x9919), seq 4, ack 3, win 512, options [nop,nop,TS val 3496511636 ecr 3496511636], length 0
2022-04-07 14:05:12.085576 IP (tos 0x0, ttl 64, id 3845, offset 0, flags [DF], proto TCP (6), length 62)
    127.0.0.1.53294 > 127.0.0.1.9350: Flags [P.], cksum 0xfe32 (incorrect -> 0x2ecc), seq 4:14, ack 3, win 512, options [nop,nop,TS val 3496511637 ecr 3496511636], length 10
2022-04-07 14:05:12.085599 IP (tos 0x0, ttl 64, id 33246, offset 0, flags [DF], proto TCP (6), length 52)
    127.0.0.1.9350 > 127.0.0.1.53294: Flags [.], cksum 0xfe28 (incorrect -> 0x990d), seq 3, ack 14, win 512, options [nop,nop,TS val 3496511637 ecr 3496511637], length 0
2022-04-07 14:05:12.122783 IP (tos 0x0, ttl 64, id 21340, offset 0, flags [DF], proto TCP (6), length 52)
    127.0.0.1.53292 > 127.0.0.1.9350: Flags [.], cksum 0xfe28 (incorrect -> 0x5cf9), seq 943, ack 4887, win 512, options [nop,nop,TS val 3496511674 ecr 3496511633], length 0
2022-04-07 14:05:12.333878 IP (tos 0x0, ttl 64, id 33247, offset 0, flags [DF], proto TCP (6), length 62)
    127.0.0.1.9350 > 127.0.0.1.53294: Flags [P.], cksum 0xfe32 (incorrect -> 0x9302), seq 3:13, ack 14, win 512, options [nop,nop,TS val 3496511885 ecr 3496511637], length 10
2022-04-07 14:05:12.333890 IP (tos 0x0, ttl 64, id 3846, offset 0, flags [DF], proto TCP (6), length 52)
    127.0.0.1.53294 > 127.0.0.1.9350: Flags [.], cksum 0xfe28 (incorrect -> 0x9713), seq 14, ack 13, win 512, options [nop,nop,TS val 3496511885 ecr 3496511885], length 0
2022-04-07 14:05:12.339144 IP (tos 0x0, ttl 64, id 3847, offset 0, flags [DF], proto TCP (6), length 569)
    127.0.0.1.53294 > 127.0.0.1.9350: Flags [P.], cksum 0x002e (incorrect -> 0x73be), seq 14:531, ack 13, win 512, options [nop,nop,TS val 3496511890 ecr 3496511885], length 517
2022-04-07 14:05:12.339152 IP (tos 0x0, ttl 64, id 33248, offset 0, flags [DF], proto TCP (6), length 52)
    127.0.0.1.9350 > 127.0.0.1.53294: Flags [.], cksum 0xfe28 (incorrect -> 0x9508), seq 13, ack 531, win 508, options [nop,nop,TS val 3496511890 ecr 3496511890], length 0
2022-04-07 14:05:12.624778 IP (tos 0x0, ttl 64, id 33249, offset 0, flags [DF], proto TCP (6), length 3538)
    127.0.0.1.9350 > 127.0.0.1.53294: Flags [P.], cksum 0x0bc7 (incorrect -> 0x4941), seq 13:3499, ack 531, win 512, options [nop,nop,TS val 3496512176 ecr 3496511890], length 3486
2022-04-07 14:05:12.624796 IP (tos 0x0, ttl 64, id 3848, offset 0, flags [DF], proto TCP (6), length 52)
    127.0.0.1.53294 > 127.0.0.1.9350: Flags [.], cksum 0xfe28 (incorrect -> 0x853c), seq 531, ack 3499, win 494, options [nop,nop,TS val 3496512176 ecr 3496512176], length 0
2022-04-07 14:05:12.718478 IP (tos 0x0, ttl 64, id 33250, offset 0, flags [DF], proto TCP (6), length 1012)
    127.0.0.1.9350 > 127.0.0.1.53294: Flags [P.], cksum 0x01e9 (incorrect -> 0x25a2), seq 3499:4459, ack 531, win 512, options [nop,nop,TS val 3496512270 ecr 3496512176], length 960
2022-04-07 14:05:12.718484 IP (tos 0x0, ttl 64, id 3849, offset 0, flags [DF], proto TCP (6), length 52)
    127.0.0.1.53294 > 127.0.0.1.9350: Flags [.], cksum 0xfe28 (incorrect -> 0x80b6), seq 531, ack 4459, win 504, options [nop,nop,TS val 3496512270 ecr 3496512270], length 0
2022-04-07 14:05:12.719130 IP (tos 0x0, ttl 64, id 3850, offset 0, flags [DF], proto TCP (6), length 145)
    127.0.0.1.53294 > 127.0.0.1.9350: Flags [P.], cksum 0xfe85 (incorrect -> 0xc416), seq 531:624, ack 4459, win 512, options [nop,nop,TS val 3496512270 ecr 3496512270], length 93
2022-04-07 14:05:12.719137 IP (tos 0x0, ttl 64, id 33251, offset 0, flags [DF], proto TCP (6), length 52)
    127.0.0.1.9350 > 127.0.0.1.53294: Flags [.], cksum 0xfe28 (incorrect -> 0x8051), seq 4459, ack 624, win 512, options [nop,nop,TS val 3496512270 ecr 3496512270], length 0
2022-04-07 14:05:12.972440 IP (tos 0x0, ttl 64, id 33252, offset 0, flags [DF], proto TCP (6), length 103)
    127.0.0.1.9350 > 127.0.0.1.53294: Flags [P.], cksum 0xfe5b (incorrect -> 0x5ed4), seq 4459:4510, ack 624, win 512, options [nop,nop,TS val 3496512524 ecr 3496512270], length 51
2022-04-07 14:05:12.972448 IP (tos 0x0, ttl 64, id 3851, offset 0, flags [DF], proto TCP (6), length 52)
    127.0.0.1.53294 > 127.0.0.1.9350: Flags [.], cksum 0xfe28 (incorrect -> 0x7e22), seq 624, ack 4510, win 512, options [nop,nop,TS val 3496512524 ecr 3496512524], length 0
2022-04-07 14:05:12.972881 IP (tos 0x0, ttl 64, id 3852, offset 0, flags [DF], proto TCP (6), length 367)
    127.0.0.1.53294 > 127.0.0.1.9350: Flags [P.], cksum 0xff63 (incorrect -> 0x6a4e), seq 624:939, ack 4510, win 512, options [nop,nop,TS val 3496512524 ecr 3496512524], length 315
2022-04-07 14:05:12.972887 IP (tos 0x0, ttl 64, id 33253, offset 0, flags [DF], proto TCP (6), length 52)
    127.0.0.1.9350 > 127.0.0.1.53294: Flags [.], cksum 0xfe28 (incorrect -> 0x7ce9), seq 4510, ack 939, win 510, options [nop,nop,TS val 3496512524 ecr 3496512524], length 0
200, 7.678534507751465, 2.4104719161987305