2022-04-07 19:21:19.972305 IP (tos 0x0, ttl 64, id 12210, offset 0, flags [DF], proto TCP (6), length 60)
    127.0.0.1.57218 > 127.0.0.1.9250: Flags [S], cksum 0xfe30 (incorrect -> 0x68c5), seq 3717349014, win 65495, options [mss 65495,sackOK,TS val 3515479524 ecr 0,nop,wscale 7], length 0
2022-04-07 19:21:19.972318 IP (tos 0x0, ttl 64, id 0, offset 0, flags [DF], proto TCP (6), length 60)
    127.0.0.1.9250 > 127.0.0.1.57218: Flags [S.], cksum 0xfe30 (incorrect -> 0x8f43), seq 2487778757, ack 3717349015, win 65483, options [mss 65495,sackOK,TS val 3515479524 ecr 3515479524,nop,wscale 7], length 0
2022-04-07 19:21:19.972327 IP (tos 0x0, ttl 64, id 12211, offset 0, flags [DF], proto TCP (6), length 52)
    127.0.0.1.57218 > 127.0.0.1.9250: Flags [.], cksum 0xfe28 (incorrect -> 0xb5ff), seq 1, ack 1, win 512, options [nop,nop,TS val 3515479524 ecr 3515479524], length 0
2022-04-07 19:21:19.972452 IP (tos 0x0, ttl 64, id 12212, offset 0, flags [DF], proto TCP (6), length 55)
    127.0.0.1.57218 > 127.0.0.1.9250: Flags [P.], cksum 0xfe2b (incorrect -> 0xb0f3), seq 1:4, ack 1, win 512, options [nop,nop,TS val 3515479524 ecr 3515479524], length 3
2022-04-07 19:21:19.972466 IP (tos 0x0, ttl 64, id 55729, offset 0, flags [DF], proto TCP (6), length 52)
    127.0.0.1.9250 > 127.0.0.1.57218: Flags [.], cksum 0xfe28 (incorrect -> 0xb5fc), seq 1, ack 4, win 512, options [nop,nop,TS val 3515479524 ecr 3515479524], length 0
2022-04-07 19:21:19.972535 IP (tos 0x0, ttl 64, id 55730, offset 0, flags [DF], proto TCP (6), length 54)
    127.0.0.1.9250 > 127.0.0.1.57218: Flags [P.], cksum 0xfe2a (incorrect -> 0xb0f2), seq 1:3, ack 4, win 512, options [nop,nop,TS val 3515479524 ecr 3515479524], length 2
2022-04-07 19:21:19.972552 IP (tos 0x0, ttl 64, id 12213, offset 0, flags [DF], proto TCP (6), length 52)
    127.0.0.1.57218 > 127.0.0.1.9250: Flags [.], cksum 0xfe28 (incorrect -> 0xb5fa), seq 4, ack 3, win 512, options [nop,nop,TS val 3515479524 ecr 3515479524], length 0
2022-04-07 19:21:19.974217 IP (tos 0x0, ttl 64, id 12214, offset 0, flags [DF], proto TCP (6), length 62)
    127.0.0.1.57218 > 127.0.0.1.9250: Flags [P.], cksum 0xfe32 (incorrect -> 0x8bf7), seq 4:14, ack 3, win 512, options [nop,nop,TS val 3515479525 ecr 3515479524], length 10
2022-04-07 19:21:19.974230 IP (tos 0x0, ttl 64, id 55731, offset 0, flags [DF], proto TCP (6), length 52)
    127.0.0.1.9250 > 127.0.0.1.57218: Flags [.], cksum 0xfe28 (incorrect -> 0xb5ed), seq 3, ack 14, win 512, options [nop,nop,TS val 3515479526 ecr 3515479525], length 0
2022-04-07 19:21:20.086084 IP (tos 0x0, ttl 64, id 55732, offset 0, flags [DF], proto TCP (6), length 62)
    127.0.0.1.9250 > 127.0.0.1.57218: Flags [P.], cksum 0xfe32 (incorrect -> 0xb06b), seq 3:13, ack 14, win 512, options [nop,nop,TS val 3515479637 ecr 3515479525], length 10
2022-04-07 19:21:20.086096 IP (tos 0x0, ttl 64, id 12215, offset 0, flags [DF], proto TCP (6), length 52)
    127.0.0.1.57218 > 127.0.0.1.9250: Flags [.], cksum 0xfe28 (incorrect -> 0xb504), seq 14, ack 13, win 512, options [nop,nop,TS val 3515479637 ecr 3515479637], length 0
2022-04-07 19:21:20.091414 IP (tos 0x0, ttl 64, id 12216, offset 0, flags [DF], proto TCP (6), length 569)
    127.0.0.1.57218 > 127.0.0.1.9250: Flags [P.], cksum 0x002e (incorrect -> 0xb996), seq 14:531, ack 13, win 512, options [nop,nop,TS val 3515479643 ecr 3515479637], length 517
2022-04-07 19:21:20.091425 IP (tos 0x0, ttl 64, id 55733, offset 0, flags [DF], proto TCP (6), length 52)
    127.0.0.1.9250 > 127.0.0.1.57218: Flags [.], cksum 0xfe28 (incorrect -> 0xb2f7), seq 13, ack 531, win 508, options [nop,nop,TS val 3515479643 ecr 3515479643], length 0
200, 5.800713062286377, 0.5348498821258545