2022-04-07 11:21:23.095744 IP (tos 0x0, ttl 64, id 6376, offset 0, flags [DF], proto TCP (6), length 60)
    127.0.0.1.34624 > 127.0.0.1.9150: Flags [S], cksum 0xfe30 (incorrect -> 0xc0bc), seq 29394076, win 65495, options [mss 65495,sackOK,TS val 3486682647 ecr 0,nop,wscale 7], length 0
2022-04-07 11:21:23.095755 IP (tos 0x0, ttl 64, id 0, offset 0, flags [DF], proto TCP (6), length 60)
    127.0.0.1.9150 > 127.0.0.1.34624: Flags [S.], cksum 0xfe30 (incorrect -> 0xeded), seq 3278811504, ack 29394077, win 65483, options [mss 65495,sackOK,TS val 3486682647 ecr 3486682647,nop,wscale 7], length 0
2022-04-07 11:21:23.095763 IP (tos 0x0, ttl 64, id 6377, offset 0, flags [DF], proto TCP (6), length 52)
    127.0.0.1.34624 > 127.0.0.1.9150: Flags [.], cksum 0xfe28 (incorrect -> 0x14aa), seq 1, ack 1, win 512, options [nop,nop,TS val 3486682647 ecr 3486682647], length 0
2022-04-07 11:21:23.095906 IP (tos 0x0, ttl 64, id 6378, offset 0, flags [DF], proto TCP (6), length 55)
    127.0.0.1.34624 > 127.0.0.1.9150: Flags [P.], cksum 0xfe2b (incorrect -> 0x0f9e), seq 1:4, ack 1, win 512, options [nop,nop,TS val 3486682647 ecr 3486682647], length 3
2022-04-07 11:21:23.095913 IP (tos 0x0, ttl 64, id 19800, offset 0, flags [DF], proto TCP (6), length 52)
    127.0.0.1.9150 > 127.0.0.1.34624: Flags [.], cksum 0xfe28 (incorrect -> 0x14a7), seq 1, ack 4, win 512, options [nop,nop,TS val 3486682647 ecr 3486682647], length 0
2022-04-07 11:21:23.095962 IP (tos 0x0, ttl 64, id 19801, offset 0, flags [DF], proto TCP (6), length 54)
    127.0.0.1.9150 > 127.0.0.1.34624: Flags [P.], cksum 0xfe2a (incorrect -> 0x0f9d), seq 1:3, ack 4, win 512, options [nop,nop,TS val 3486682647 ecr 3486682647], length 2
2022-04-07 11:21:23.095970 IP (tos 0x0, ttl 64, id 6379, offset 0, flags [DF], proto TCP (6), length 52)
    127.0.0.1.34624 > 127.0.0.1.9150: Flags [.], cksum 0xfe28 (incorrect -> 0x14a5), seq 4, ack 3, win 512, options [nop,nop,TS val 3486682647 ecr 3486682647], length 0
2022-04-07 11:21:23.106739 IP (tos 0x0, ttl 64, id 6380, offset 0, flags [DF], proto TCP (6), length 62)
    127.0.0.1.34624 > 127.0.0.1.9150: Flags [P.], cksum 0xfe32 (incorrect -> 0xbb3a), seq 4:14, ack 3, win 512, options [nop,nop,TS val 3486682658 ecr 3486682647], length 10
2022-04-07 11:21:23.106748 IP (tos 0x0, ttl 64, id 19802, offset 0, flags [DF], proto TCP (6), length 52)
    127.0.0.1.9150 > 127.0.0.1.34624: Flags [.], cksum 0xfe28 (incorrect -> 0x1485), seq 3, ack 14, win 512, options [nop,nop,TS val 3486682658 ecr 3486682658], length 0
2022-04-07 11:21:23.250295 IP (tos 0x0, ttl 64, id 19803, offset 0, flags [DF], proto TCP (6), length 62)
    127.0.0.1.9150 > 127.0.0.1.34624: Flags [P.], cksum 0xfe32 (incorrect -> 0x0ee2), seq 3:13, ack 14, win 512, options [nop,nop,TS val 3486682802 ecr 3486682658], length 10
2022-04-07 11:21:23.250304 IP (tos 0x0, ttl 64, id 6381, offset 0, flags [DF], proto TCP (6), length 52)
    127.0.0.1.34624 > 127.0.0.1.9150: Flags [.], cksum 0xfe28 (incorrect -> 0x135b), seq 14, ack 13, win 512, options [nop,nop,TS val 3486682802 ecr 3486682802], length 0
2022-04-07 11:21:23.255804 IP (tos 0x0, ttl 64, id 6382, offset 0, flags [DF], proto TCP (6), length 569)
    127.0.0.1.34624 > 127.0.0.1.9150: Flags [P.], cksum 0x002e (incorrect -> 0x2791), seq 14:531, ack 13, win 512, options [nop,nop,TS val 3486682807 ecr 3486682802], length 517
2022-04-07 11:21:23.255814 IP (tos 0x0, ttl 64, id 19804, offset 0, flags [DF], proto TCP (6), length 52)
    127.0.0.1.9150 > 127.0.0.1.34624: Flags [.], cksum 0xfe28 (incorrect -> 0x1150), seq 13, ack 531, win 508, options [nop,nop,TS val 3486682807 ecr 3486682807], length 0
200, 6.601217269897461, 0.6732432842254639