2022-04-07 19:51:34.872618 IP (tos 0x0, ttl 64, id 30479, offset 0, flags [DF], proto TCP (6), length 60)
    127.0.0.1.53564 > 127.0.0.1.10550: Flags [S], cksum 0xfe30 (incorrect -> 0x796d), seq 2079319859, win 65495, options [mss 65495,sackOK,TS val 3517294424 ecr 0,nop,wscale 7], length 0
2022-04-07 19:51:34.872630 IP (tos 0x0, ttl 64, id 0, offset 0, flags [DF], proto TCP (6), length 60)
    127.0.0.1.10550 > 127.0.0.1.53564: Flags [S.], cksum 0xfe30 (incorrect -> 0xbb59), seq 2154677410, ack 2079319860, win 65483, options [mss 65495,sackOK,TS val 3517294424 ecr 3517294424,nop,wscale 7], length 0
2022-04-07 19:51:34.872638 IP (tos 0x0, ttl 64, id 30480, offset 0, flags [DF], proto TCP (6), length 52)
    127.0.0.1.53564 > 127.0.0.1.10550: Flags [.], cksum 0xfe28 (incorrect -> 0xe215), seq 1, ack 1, win 512, options [nop,nop,TS val 3517294424 ecr 3517294424], length 0
2022-04-07 19:51:34.872761 IP (tos 0x0, ttl 64, id 30481, offset 0, flags [DF], proto TCP (6), length 55)
    127.0.0.1.53564 > 127.0.0.1.10550: Flags [P.], cksum 0xfe2b (incorrect -> 0xdd09), seq 1:4, ack 1, win 512, options [nop,nop,TS val 3517294424 ecr 3517294424], length 3
2022-04-07 19:51:34.872776 IP (tos 0x0, ttl 64, id 21097, offset 0, flags [DF], proto TCP (6), length 52)
    127.0.0.1.10550 > 127.0.0.1.53564: Flags [.], cksum 0xfe28 (incorrect -> 0xe212), seq 1, ack 4, win 512, options [nop,nop,TS val 3517294424 ecr 3517294424], length 0
2022-04-07 19:51:34.872852 IP (tos 0x0, ttl 64, id 21098, offset 0, flags [DF], proto TCP (6), length 54)
    127.0.0.1.10550 > 127.0.0.1.53564: Flags [P.], cksum 0xfe2a (incorrect -> 0xdd08), seq 1:3, ack 4, win 512, options [nop,nop,TS val 3517294424 ecr 3517294424], length 2
2022-04-07 19:51:34.872882 IP (tos 0x0, ttl 64, id 30482, offset 0, flags [DF], proto TCP (6), length 52)
    127.0.0.1.53564 > 127.0.0.1.10550: Flags [.], cksum 0xfe28 (incorrect -> 0xe210), seq 4, ack 3, win 512, options [nop,nop,TS val 3517294424 ecr 3517294424], length 0
2022-04-07 19:51:34.874315 IP (tos 0x0, ttl 64, id 30483, offset 0, flags [DF], proto TCP (6), length 62)
    127.0.0.1.53564 > 127.0.0.1.10550: Flags [P.], cksum 0xfe32 (incorrect -> 0x89ca), seq 4:14, ack 3, win 512, options [nop,nop,TS val 3517294426 ecr 3517294424], length 10
2022-04-07 19:51:34.874330 IP (tos 0x0, ttl 64, id 21099, offset 0, flags [DF], proto TCP (6), length 52)
    127.0.0.1.10550 > 127.0.0.1.53564: Flags [.], cksum 0xfe28 (incorrect -> 0xe202), seq 3, ack 14, win 512, options [nop,nop,TS val 3517294426 ecr 3517294426], length 0
2022-04-07 19:51:34.998748 IP (tos 0x0, ttl 64, id 21100, offset 0, flags [DF], proto TCP (6), length 62)
    127.0.0.1.10550 > 127.0.0.1.53564: Flags [P.], cksum 0xfe32 (incorrect -> 0xdc73), seq 3:13, ack 14, win 512, options [nop,nop,TS val 3517294550 ecr 3517294426], length 10
2022-04-07 19:51:34.998756 IP (tos 0x0, ttl 64, id 30484, offset 0, flags [DF], proto TCP (6), length 52)
    127.0.0.1.53564 > 127.0.0.1.10550: Flags [.], cksum 0xfe28 (incorrect -> 0xe100), seq 14, ack 13, win 512, options [nop,nop,TS val 3517294550 ecr 3517294550], length 0
2022-04-07 19:51:35.004627 IP (tos 0x0, ttl 64, id 30485, offset 0, flags [DF], proto TCP (6), length 569)
    127.0.0.1.53564 > 127.0.0.1.10550: Flags [P.], cksum 0x002e (incorrect -> 0xcff3), seq 14:531, ack 13, win 512, options [nop,nop,TS val 3517294556 ecr 3517294550], length 517
2022-04-07 19:51:35.004636 IP (tos 0x0, ttl 64, id 21101, offset 0, flags [DF], proto TCP (6), length 52)
    127.0.0.1.10550 > 127.0.0.1.53564: Flags [.], cksum 0xfe28 (incorrect -> 0xdef3), seq 13, ack 531, win 508, options [nop,nop,TS val 3517294556 ecr 3517294556], length 0
2022-04-07 19:51:35.179211 IP (tos 0x0, ttl 64, id 21102, offset 0, flags [DF], proto TCP (6), length 3538)
    127.0.0.1.10550 > 127.0.0.1.53564: Flags [P.], cksum 0x0bc7 (incorrect -> 0xec35), seq 13:3499, ack 531, win 512, options [nop,nop,TS val 3517294730 ecr 3517294556], length 3486
2022-04-07 19:51:35.179222 IP (tos 0x0, ttl 64, id 30486, offset 0, flags [DF], proto TCP (6), length 52)
    127.0.0.1.53564 > 127.0.0.1.10550: Flags [.], cksum 0xfe28 (incorrect -> 0xd007), seq 531, ack 3499, win 494, options [nop,nop,TS val 3517294730 ecr 3517294730], length 0
2022-04-07 19:51:35.214235 IP (tos 0x0, ttl 64, id 21103, offset 0, flags [DF], proto TCP (6), length 272)
    127.0.0.1.10550 > 127.0.0.1.53564: Flags [P.], cksum 0xff04 (incorrect -> 0xe8ae), seq 3499:3719, ack 531, win 512, options [nop,nop,TS val 3517294766 ecr 3517294730], length 220
2022-04-07 19:51:35.214243 IP (tos 0x0, ttl 64, id 30487, offset 0, flags [DF], proto TCP (6), length 52)
    127.0.0.1.53564 > 127.0.0.1.10550: Flags [.], cksum 0xfe28 (incorrect -> 0xced6), seq 531, ack 3719, win 507, options [nop,nop,TS val 3517294766 ecr 3517294766], length 0
2022-04-07 19:51:35.214348 IP (tos 0x0, ttl 64, id 30488, offset 0, flags [DF], proto TCP (6), length 132)
    127.0.0.1.53564 > 127.0.0.1.10550: Flags [P.], cksum 0xfe78 (incorrect -> 0x9bb3), seq 531:611, ack 3719, win 507, options [nop,nop,TS val 3517294766 ecr 3517294766], length 80
2022-04-07 19:51:35.214355 IP (tos 0x0, ttl 64, id 21104, offset 0, flags [DF], proto TCP (6), length 52)
    127.0.0.1.10550 > 127.0.0.1.53564: Flags [.], cksum 0xfe28 (incorrect -> 0xce81), seq 3719, ack 611, win 512, options [nop,nop,TS val 3517294766 ecr 3517294766], length 0
2022-04-07 19:51:35.214911 IP (tos 0x0, ttl 64, id 30489, offset 0, flags [DF], proto TCP (6), length 393)
    127.0.0.1.53564 > 127.0.0.1.10550: Flags [P.], cksum 0xff7d (incorrect -> 0xcb91), seq 611:952, ack 3719, win 507, options [nop,nop,TS val 3517294766 ecr 3517294766], length 341
2022-04-07 19:51:35.214920 IP (tos 0x0, ttl 64, id 21105, offset 0, flags [DF], proto TCP (6), length 52)
    127.0.0.1.10550 > 127.0.0.1.53564: Flags [.], cksum 0xfe28 (incorrect -> 0xcd2e), seq 3719, ack 952, win 510, options [nop,nop,TS val 3517294766 ecr 3517294766], length 0
2022-04-07 19:51:35.665894 IP (tos 0x0, ttl 64, id 21106, offset 0, flags [DF], proto TCP (6), length 1736)
    127.0.0.1.10550 > 127.0.0.1.53564: Flags [P.], cksum 0x04bd (incorrect -> 0xec2b), seq 3719:5403, ack 952, win 512, options [nop,nop,TS val 3517295217 ecr 3517294766], length 1684
2022-04-07 19:51:35.665907 IP (tos 0x0, ttl 64, id 30490, offset 0, flags [DF], proto TCP (6), length 52)
    127.0.0.1.53564 > 127.0.0.1.10550: Flags [.], cksum 0xfe28 (incorrect -> 0xc31d), seq 952, ack 5403, win 501, options [nop,nop,TS val 3517295217 ecr 3517295217], length 0
2022-04-07 19:51:35.798621 IP (tos 0x0, ttl 64, id 21107, offset 0, flags [DF], proto TCP (6), length 2044)
    127.0.0.1.10550 > 127.0.0.1.53564: Flags [P.], cksum 0x05f1 (incorrect -> 0xc393), seq 5403:7395, ack 952, win 512, options [nop,nop,TS val 3517295350 ecr 3517295217], length 1992
2022-04-07 19:51:35.798632 IP (tos 0x0, ttl 64, id 30491, offset 0, flags [DF], proto TCP (6), length 52)
    127.0.0.1.53564 > 127.0.0.1.10550: Flags [.], cksum 0xfe28 (incorrect -> 0xba4c), seq 952, ack 7395, win 500, options [nop,nop,TS val 3517295350 ecr 3517295350], length 0
2022-04-07 19:51:35.830895 IP (tos 0x0, ttl 64, id 21108, offset 0, flags [DF], proto TCP (6), length 1546)
    127.0.0.1.10550 > 127.0.0.1.53564: Flags [P.], cksum 0x03ff (incorrect -> 0x8962), seq 7395:8889, ack 952, win 512, options [nop,nop,TS val 3517295382 ecr 3517295350], length 1494
2022-04-07 19:51:35.830907 IP (tos 0x0, ttl 64, id 30492, offset 0, flags [DF], proto TCP (6), length 52)
    127.0.0.1.53564 > 127.0.0.1.10550: Flags [.], cksum 0xfe28 (incorrect -> 0xb434), seq 952, ack 8889, win 502, options [nop,nop,TS val 3517295382 ecr 3517295382], length 0
2022-04-07 19:51:35.918417 IP (tos 0x0, ttl 64, id 21109, offset 0, flags [DF], proto TCP (6), length 4036)
    127.0.0.1.10550 > 127.0.0.1.53564: Flags [P.], cksum 0x0db9 (incorrect -> 0xa770), seq 8889:12873, ack 952, win 512, options [nop,nop,TS val 3517295470 ecr 3517295382], length 3984
2022-04-07 19:51:35.918426 IP (tos 0x0, ttl 64, id 30493, offset 0, flags [DF], proto TCP (6), length 52)
    127.0.0.1.53564 > 127.0.0.1.10550: Flags [.], cksum 0xfe28 (incorrect -> 0xa3fe), seq 952, ack 12873, win 492, options [nop,nop,TS val 3517295470 ecr 3517295470], length 0
2022-04-07 19:51:35.949595 IP (tos 0x0, ttl 64, id 21110, offset 0, flags [DF], proto TCP (6), length 3686)
    127.0.0.1.10550 > 127.0.0.1.53564: Flags [P.], cksum 0x0c5b (incorrect -> 0x4e16), seq 12873:16507, ack 952, win 512, options [nop,nop,TS val 3517295501 ecr 3517295470], length 3634
2022-04-07 19:51:35.949600 IP (tos 0x0, ttl 64, id 30494, offset 0, flags [DF], proto TCP (6), length 52)
    127.0.0.1.53564 > 127.0.0.1.10550: Flags [.], cksum 0xfe28 (incorrect -> 0x958d), seq 952, ack 16507, win 493, options [nop,nop,TS val 3517295501 ecr 3517295501], length 0
2022-04-07 19:51:35.951617 IP (tos 0x0, ttl 64, id 21111, offset 0, flags [DF], proto TCP (6), length 2492)
    127.0.0.1.10550 > 127.0.0.1.53564: Flags [P.], cksum 0x07b1 (incorrect -> 0x8474), seq 16507:18947, ack 952, win 512, options [nop,nop,TS val 3517295503 ecr 3517295501], length 2440
2022-04-07 19:51:35.951622 IP (tos 0x0, ttl 64, id 30495, offset 0, flags [DF], proto TCP (6), length 52)
    127.0.0.1.53564 > 127.0.0.1.10550: Flags [.], cksum 0xfe28 (incorrect -> 0x8bfc), seq 952, ack 18947, win 498, options [nop,nop,TS val 3517295503 ecr 3517295503], length 0
2022-04-07 19:51:35.983033 IP (tos 0x0, ttl 64, id 21112, offset 0, flags [DF], proto TCP (6), length 2442)
    127.0.0.1.10550 > 127.0.0.1.53564: Flags [P.], cksum 0x077f (incorrect -> 0x7788), seq 18947:21337, ack 952, win 512, options [nop,nop,TS val 3517295534 ecr 3517295503], length 2390
2022-04-07 19:51:35.983040 IP (tos 0x0, ttl 64, id 30496, offset 0, flags [DF], proto TCP (6), length 52)
    127.0.0.1.53564 > 127.0.0.1.10550: Flags [.], cksum 0xfe28 (incorrect -> 0x8268), seq 952, ack 21337, win 498, options [nop,nop,TS val 3517295534 ecr 3517295534], length 0
2022-04-07 19:51:36.015303 IP (tos 0x0, ttl 64, id 21113, offset 0, flags [DF], proto TCP (6), length 2442)
    127.0.0.1.10550 > 127.0.0.1.53564: Flags [P.], cksum 0x077f (incorrect -> 0x020e), seq 21337:23727, ack 952, win 512, options [nop,nop,TS val 3517295567 ecr 3517295534], length 2390
2022-04-07 19:51:36.015313 IP (tos 0x0, ttl 64, id 30497, offset 0, flags [DF], proto TCP (6), length 52)
    127.0.0.1.53564 > 127.0.0.1.10550: Flags [.], cksum 0xfe28 (incorrect -> 0x78d0), seq 952, ack 23727, win 498, options [nop,nop,TS val 3517295567 ecr 3517295567], length 0
2022-04-07 19:51:36.197301 IP (tos 0x0, ttl 64, id 21114, offset 0, flags [DF], proto TCP (6), length 3438)
    127.0.0.1.10550 > 127.0.0.1.53564: Flags [P.], cksum 0x0b63 (incorrect -> 0xc799), seq 23727:27113, ack 952, win 512, options [nop,nop,TS val 3517295749 ecr 3517295567], length 3386
2022-04-07 19:51:36.197315 IP (tos 0x0, ttl 64, id 30498, offset 0, flags [DF], proto TCP (6), length 52)
    127.0.0.1.53564 > 127.0.0.1.10550: Flags [.], cksum 0xfe28 (incorrect -> 0x6a2e), seq 952, ack 27113, win 494, options [nop,nop,TS val 3517295749 ecr 3517295749], length 0
2022-04-07 19:51:36.273764 IP (tos 0x0, ttl 64, id 21115, offset 0, flags [DF], proto TCP (6), length 3438)
    127.0.0.1.10550 > 127.0.0.1.53564: Flags [P.], cksum 0x0b63 (incorrect -> 0x3add), seq 27113:30499, ack 952, win 512, options [nop,nop,TS val 3517295825 ecr 3517295749], length 3386
2022-04-07 19:51:36.314783 IP (tos 0x0, ttl 64, id 30499, offset 0, flags [DF], proto TCP (6), length 52)
    127.0.0.1.53564 > 127.0.0.1.10550: Flags [.], cksum 0xfe28 (incorrect -> 0x5c21), seq 952, ack 30499, win 512, options [nop,nop,TS val 3517295866 ecr 3517295825], length 0
2022-04-07 19:51:36.314790 IP (tos 0x0, ttl 64, id 21116, offset 0, flags [DF], proto TCP (6), length 948)
    127.0.0.1.10550 > 127.0.0.1.53564: Flags [P.], cksum 0x01a9 (incorrect -> 0xac55), seq 30499:31395, ack 952, win 512, options [nop,nop,TS val 3517295866 ecr 3517295866], length 896
2022-04-07 19:51:36.314813 IP (tos 0x0, ttl 64, id 30500, offset 0, flags [DF], proto TCP (6), length 52)
    127.0.0.1.53564 > 127.0.0.1.10550: Flags [.], cksum 0xfe28 (incorrect -> 0x5878), seq 952, ack 31395, win 512, options [nop,nop,TS val 3517295866 ecr 3517295866], length 0
2022-04-07 19:51:36.337503 IP (tos 0x0, ttl 64, id 21117, offset 0, flags [DF], proto TCP (6), length 2940)
    127.0.0.1.10550 > 127.0.0.1.53564: Flags [P.], cksum 0x0971 (incorrect -> 0xb1a0), seq 31395:34283, ack 952, win 512, options [nop,nop,TS val 3517295889 ecr 3517295866], length 2888
2022-04-07 19:51:36.337534 IP (tos 0x0, ttl 64, id 30501, offset 0, flags [DF], proto TCP (6), length 52)
    127.0.0.1.53564 > 127.0.0.1.10550: Flags [.], cksum 0xfe28 (incorrect -> 0x4d02), seq 952, ack 34283, win 512, options [nop,nop,TS val 3517295889 ecr 3517295889], length 0
2022-04-07 19:51:36.369126 IP (tos 0x0, ttl 64, id 21118, offset 0, flags [DF], proto TCP (6), length 3438)
    127.0.0.1.10550 > 127.0.0.1.53564: Flags [P.], cksum 0x0b63 (incorrect -> 0xcd81), seq 34283:37669, ack 952, win 512, options [nop,nop,TS val 3517295920 ecr 3517295889], length 3386
2022-04-07 19:51:36.410780 IP (tos 0x0, ttl 64, id 30502, offset 0, flags [DF], proto TCP (6), length 52)
    127.0.0.1.53564 > 127.0.0.1.10550: Flags [.], cksum 0xfe28 (incorrect -> 0x3f60), seq 952, ack 37669, win 512, options [nop,nop,TS val 3517295962 ecr 3517295920], length 0
2022-04-07 19:51:36.410787 IP (tos 0x0, ttl 64, id 21119, offset 0, flags [DF], proto TCP (6), length 5330)
    127.0.0.1.10550 > 127.0.0.1.53564: Flags [P.], cksum 0x12c7 (incorrect -> 0x23d7), seq 37669:42947, ack 952, win 512, options [nop,nop,TS val 3517295962 ecr 3517295962], length 5278
2022-04-07 19:51:36.458789 IP (tos 0x0, ttl 64, id 30503, offset 0, flags [DF], proto TCP (6), length 52)
    127.0.0.1.53564 > 127.0.0.1.10550: Flags [.], cksum 0xfe28 (incorrect -> 0x2a68), seq 952, ack 42947, win 512, options [nop,nop,TS val 3517296010 ecr 3517295962], length 0
2022-04-07 19:51:36.509912 IP (tos 0x0, ttl 64, id 21120, offset 0, flags [DF], proto TCP (6), length 3438)
    127.0.0.1.10550 > 127.0.0.1.53564: Flags [P.], cksum 0x0b63 (incorrect -> 0xf21a), seq 42947:46333, ack 952, win 512, options [nop,nop,TS val 3517296061 ecr 3517296010], length 3386
2022-04-07 19:51:36.509991 IP (tos 0x0, ttl 64, id 30504, offset 0, flags [DF], proto TCP (6), length 52)
    127.0.0.1.53564 > 127.0.0.1.10550: Flags [.], cksum 0xfe28 (incorrect -> 0x1c98), seq 952, ack 46333, win 512, options [nop,nop,TS val 3517296061 ecr 3517296061], length 0
2022-04-07 19:51:36.542423 IP (tos 0x0, ttl 64, id 21121, offset 0, flags [DF], proto TCP (6), length 4100)
    127.0.0.1.10550 > 127.0.0.1.53564: Flags [P.], cksum 0x0df9 (incorrect -> 0x2159), seq 46333:50381, ack 952, win 512, options [nop,nop,TS val 3517296094 ecr 3517296061], length 4048
2022-04-07 19:51:36.542685 IP (tos 0x0, ttl 64, id 30505, offset 0, flags [DF], proto TCP (6), length 52)
    127.0.0.1.53564 > 127.0.0.1.10550: Flags [.], cksum 0xfe28 (incorrect -> 0x0c86), seq 952, ack 50381, win 512, options [nop,nop,TS val 3517296094 ecr 3517296094], length 0
2022-04-07 19:51:36.542689 IP (tos 0x0, ttl 64, id 21122, offset 0, flags [DF], proto TCP (6), length 386)
    127.0.0.1.10550 > 127.0.0.1.53564: Flags [P.], cksum 0xff76 (incorrect -> 0x6c5f), seq 50381:50715, ack 952, win 512, options [nop,nop,TS val 3517296094 ecr 3517296094], length 334
2022-04-07 19:51:36.542693 IP (tos 0x0, ttl 64, id 30506, offset 0, flags [DF], proto TCP (6), length 52)
    127.0.0.1.53564 > 127.0.0.1.10550: Flags [.], cksum 0xfe28 (incorrect -> 0x0b38), seq 952, ack 50715, win 512, options [nop,nop,TS val 3517296094 ecr 3517296094], length 0
2022-04-07 19:51:36.614329 IP (tos 0x0, ttl 64, id 21123, offset 0, flags [DF], proto TCP (6), length 3438)
    127.0.0.1.10550 > 127.0.0.1.53564: Flags [P.], cksum 0x0b63 (incorrect -> 0xacc0), seq 50715:54101, ack 952, win 512, options [nop,nop,TS val 3517296166 ecr 3517296094], length 3386
2022-04-07 19:51:36.614381 IP (tos 0x0, ttl 64, id 30507, offset 0, flags [DF], proto TCP (6), length 52)
    127.0.0.1.53564 > 127.0.0.1.10550: Flags [.], cksum 0xfe28 (incorrect -> 0xfd6d), seq 952, ack 54101, win 512, options [nop,nop,TS val 3517296166 ecr 3517296166], length 0
2022-04-07 19:51:36.646054 IP (tos 0x0, ttl 64, id 21124, offset 0, flags [DF], proto TCP (6), length 1944)
    127.0.0.1.10550 > 127.0.0.1.53564: Flags [P.], cksum 0x058d (incorrect -> 0x9156), seq 54101:55993, ack 952, win 512, options [nop,nop,TS val 3517296197 ecr 3517296166], length 1892
2022-04-07 19:51:36.646295 IP (tos 0x0, ttl 64, id 30508, offset 0, flags [DF], proto TCP (6), length 52)
    127.0.0.1.53564 > 127.0.0.1.10550: Flags [.], cksum 0xfe28 (incorrect -> 0xf5ca), seq 952, ack 55993, win 512, options [nop,nop,TS val 3517296198 ecr 3517296197], length 0
2022-04-07 19:51:36.719449 IP (tos 0x0, ttl 64, id 21125, offset 0, flags [DF], proto TCP (6), length 3045)
    127.0.0.1.10550 > 127.0.0.1.53564: Flags [P.], cksum 0x09da (incorrect -> 0x89b5), seq 55993:58986, ack 952, win 512, options [nop,nop,TS val 3517296271 ecr 3517296198], length 2993
2022-04-07 19:51:36.719601 IP (tos 0x0, ttl 64, id 30509, offset 0, flags [DF], proto TCP (6), length 52)
    127.0.0.1.53564 > 127.0.0.1.10550: Flags [.], cksum 0xfe28 (incorrect -> 0xe986), seq 952, ack 58986, win 512, options [nop,nop,TS val 3517296271 ecr 3517296271], length 0
2022-04-07 19:51:36.755166 IP (tos 0x0, ttl 64, id 21126, offset 0, flags [DF], proto TCP (6), length 1234)
    127.0.0.1.10550 > 127.0.0.1.53564: Flags [P.], cksum 0x02c7 (incorrect -> 0xe0f8), seq 58986:60168, ack 952, win 512, options [nop,nop,TS val 3517296306 ecr 3517296271], length 1182
2022-04-07 19:51:36.755247 IP (tos 0x0, ttl 64, id 30510, offset 0, flags [DF], proto TCP (6), length 52)
    127.0.0.1.53564 > 127.0.0.1.10550: Flags [.], cksum 0xfe28 (incorrect -> 0xe4a1), seq 952, ack 60168, win 512, options [nop,nop,TS val 3517296307 ecr 3517296306], length 0
2022-04-07 19:51:36.939613 IP (tos 0x0, ttl 64, id 21127, offset 0, flags [DF], proto TCP (6), length 2442)
    127.0.0.1.10550 > 127.0.0.1.53564: Flags [P.], cksum 0x077f (incorrect -> 0xae40), seq 60168:62558, ack 952, win 512, options [nop,nop,TS val 3517296491 ecr 3517296307], length 2390
2022-04-07 19:51:36.939649 IP (tos 0x0, ttl 64, id 30511, offset 0, flags [DF], proto TCP (6), length 52)
    127.0.0.1.53564 > 127.0.0.1.10550: Flags [.], cksum 0xfe28 (incorrect -> 0xd9da), seq 952, ack 62558, win 512, options [nop,nop,TS val 3517296491 ecr 3517296491], length 0
2022-04-07 19:51:36.973796 IP (tos 0x0, ttl 64, id 21128, offset 0, flags [DF], proto TCP (6), length 3438)
    127.0.0.1.10550 > 127.0.0.1.53564: Flags [P.], cksum 0x0b63 (incorrect -> 0xf049), seq 62558:65944, ack 952, win 512, options [nop,nop,TS val 3517296525 ecr 3517296491], length 3386
2022-04-07 19:51:36.973839 IP (tos 0x0, ttl 64, id 30512, offset 0, flags [DF], proto TCP (6), length 52)
    127.0.0.1.53564 > 127.0.0.1.10550: Flags [.], cksum 0xfe28 (incorrect -> 0xcc5c), seq 952, ack 65944, win 512, options [nop,nop,TS val 3517296525 ecr 3517296525], length 0
2022-04-07 19:51:37.004964 IP (tos 0x0, ttl 64, id 21129, offset 0, flags [DF], proto TCP (6), length 550)
    127.0.0.1.10550 > 127.0.0.1.53564: Flags [P.], cksum 0x001b (incorrect -> 0x6381), seq 65944:66442, ack 952, win 512, options [nop,nop,TS val 3517296556 ecr 3517296525], length 498
2022-04-07 19:51:37.005004 IP (tos 0x0, ttl 64, id 30513, offset 0, flags [DF], proto TCP (6), length 52)
    127.0.0.1.53564 > 127.0.0.1.10550: Flags [.], cksum 0xfe28 (incorrect -> 0xca2c), seq 952, ack 66442, win 512, options [nop,nop,TS val 3517296556 ecr 3517296556], length 0
2022-04-07 19:51:37.006200 IP (tos 0x0, ttl 64, id 21130, offset 0, flags [DF], proto TCP (6), length 1446)
    127.0.0.1.10550 > 127.0.0.1.53564: Flags [P.], cksum 0x039b (incorrect -> 0x8b65), seq 66442:67836, ack 952, win 512, options [nop,nop,TS val 3517296557 ecr 3517296556], length 1394
2022-04-07 19:51:37.006212 IP (tos 0x0, ttl 64, id 30514, offset 0, flags [DF], proto TCP (6), length 52)
    127.0.0.1.53564 > 127.0.0.1.10550: Flags [.], cksum 0xfe28 (incorrect -> 0xc4b8), seq 952, ack 67836, win 512, options [nop,nop,TS val 3517296557 ecr 3517296557], length 0
2022-04-07 19:51:37.039702 IP (tos 0x0, ttl 64, id 21131, offset 0, flags [DF], proto TCP (6), length 2492)
    127.0.0.1.10550 > 127.0.0.1.53564: Flags [P.], cksum 0x07b1 (incorrect -> 0xc9af), seq 67836:70276, ack 952, win 512, options [nop,nop,TS val 3517296591 ecr 3517296557], length 2440
2022-04-07 19:51:37.039744 IP (tos 0x0, ttl 64, id 30515, offset 0, flags [DF], proto TCP (6), length 52)
    127.0.0.1.53564 > 127.0.0.1.10550: Flags [.], cksum 0xfe28 (incorrect -> 0xbaec), seq 952, ack 70276, win 512, options [nop,nop,TS val 3517296591 ecr 3517296591], length 0
2022-04-07 19:51:37.076199 IP (tos 0x0, ttl 64, id 21132, offset 0, flags [DF], proto TCP (6), length 2170)
    127.0.0.1.10550 > 127.0.0.1.53564: Flags [P.], cksum 0x066f (incorrect -> 0x9b84), seq 70276:72394, ack 952, win 512, options [nop,nop,TS val 3517296627 ecr 3517296591], length 2118
2022-04-07 19:51:37.076530 IP (tos 0x0, ttl 64, id 30516, offset 0, flags [DF], proto TCP (6), length 52)
    127.0.0.1.53564 > 127.0.0.1.10550: Flags [.], cksum 0xfe28 (incorrect -> 0xb25d), seq 952, ack 72394, win 512, options [nop,nop,TS val 3517296628 ecr 3517296627], length 0
2022-04-07 19:51:37.110791 IP (tos 0x0, ttl 64, id 21133, offset 0, flags [DF], proto TCP (6), length 3438)
    127.0.0.1.10550 > 127.0.0.1.53564: Flags [P.], cksum 0x0b63 (incorrect -> 0xc38f), seq 72394:75780, ack 952, win 512, options [nop,nop,TS val 3517296662 ecr 3517296628], length 3386
2022-04-07 19:51:37.110826 IP (tos 0x0, ttl 64, id 30517, offset 0, flags [DF], proto TCP (6), length 52)
    127.0.0.1.53564 > 127.0.0.1.10550: Flags [.], cksum 0xfe28 (incorrect -> 0xa4de), seq 952, ack 75780, win 512, options [nop,nop,TS val 3517296662 ecr 3517296662], length 0
2022-04-07 19:51:37.143856 IP (tos 0x0, ttl 64, id 21134, offset 0, flags [DF], proto TCP (6), length 4100)
    127.0.0.1.10550 > 127.0.0.1.53564: Flags [P.], cksum 0x0df9 (incorrect -> 0xd737), seq 75780:79828, ack 952, win 512, options [nop,nop,TS val 3517296695 ecr 3517296662], length 4048
2022-04-07 19:51:37.143878 IP (tos 0x0, ttl 64, id 30518, offset 0, flags [DF], proto TCP (6), length 52)
    127.0.0.1.53564 > 127.0.0.1.10550: Flags [.], cksum 0xfe28 (incorrect -> 0x94cc), seq 952, ack 79828, win 512, options [nop,nop,TS val 3517296695 ecr 3517296695], length 0
2022-04-07 19:51:37.143881 IP (tos 0x0, ttl 64, id 21135, offset 0, flags [DF], proto TCP (6), length 336)
    127.0.0.1.10550 > 127.0.0.1.53564: Flags [P.], cksum 0xff44 (incorrect -> 0xcdb6), seq 79828:80112, ack 952, win 512, options [nop,nop,TS val 3517296695 ecr 3517296695], length 284
2022-04-07 19:51:37.143884 IP (tos 0x0, ttl 64, id 30519, offset 0, flags [DF], proto TCP (6), length 52)
    127.0.0.1.53564 > 127.0.0.1.10550: Flags [.], cksum 0xfe28 (incorrect -> 0x93b0), seq 952, ack 80112, win 512, options [nop,nop,TS val 3517296695 ecr 3517296695], length 0
2022-04-07 19:51:37.161925 IP (tos 0x0, ttl 64, id 21136, offset 0, flags [DF], proto TCP (6), length 3488)
    127.0.0.1.10550 > 127.0.0.1.53564: Flags [P.], cksum 0x0b95 (incorrect -> 0x185f), seq 80112:83548, ack 952, win 512, options [nop,nop,TS val 3517296713 ecr 3517296695], length 3436
2022-04-07 19:51:37.162262 IP (tos 0x0, ttl 64, id 30520, offset 0, flags [DF], proto TCP (6), length 52)
    127.0.0.1.53564 > 127.0.0.1.10550: Flags [.], cksum 0xfe28 (incorrect -> 0x861f), seq 952, ack 83548, win 512, options [nop,nop,TS val 3517296714 ecr 3517296713], length 0
2022-04-07 19:51:37.176378 IP (tos 0x0, ttl 64, id 21137, offset 0, flags [DF], proto TCP (6), length 1944)
    127.0.0.1.10550 > 127.0.0.1.53564: Flags [P.], cksum 0x058d (incorrect -> 0xa3ca), seq 83548:85440, ack 952, win 512, options [nop,nop,TS val 3517296728 ecr 3517296714], length 1892
2022-04-07 19:51:37.176391 IP (tos 0x0, ttl 64, id 30521, offset 0, flags [DF], proto TCP (6), length 52)
    127.0.0.1.53564 > 127.0.0.1.10550: Flags [.], cksum 0xfe28 (incorrect -> 0x7e9e), seq 952, ack 85440, win 512, options [nop,nop,TS val 3517296728 ecr 3517296728], length 0
2022-04-07 19:51:37.217354 IP (tos 0x0, ttl 64, id 21138, offset 0, flags [DF], proto TCP (6), length 3438)
    127.0.0.1.10550 > 127.0.0.1.53564: Flags [P.], cksum 0x0b63 (incorrect -> 0x013b), seq 85440:88826, ack 952, win 512, options [nop,nop,TS val 3517296769 ecr 3517296728], length 3386
2022-04-07 19:51:37.217368 IP (tos 0x0, ttl 64, id 30522, offset 0, flags [DF], proto TCP (6), length 52)
    127.0.0.1.53564 > 127.0.0.1.10550: Flags [.], cksum 0xfe28 (incorrect -> 0x7112), seq 952, ack 88826, win 512, options [nop,nop,TS val 3517296769 ecr 3517296769], length 0
2022-04-07 19:51:37.250592 IP (tos 0x0, ttl 64, id 21139, offset 0, flags [DF], proto TCP (6), length 152)
    127.0.0.1.10550 > 127.0.0.1.53564: Flags [P.], cksum 0xfe8c (incorrect -> 0x3374), seq 88826:88926, ack 952, win 512, options [nop,nop,TS val 3517296802 ecr 3517296769], length 100
2022-04-07 19:51:37.250626 IP (tos 0x0, ttl 64, id 30523, offset 0, flags [DF], proto TCP (6), length 52)
    127.0.0.1.53564 > 127.0.0.1.10550: Flags [.], cksum 0xfe28 (incorrect -> 0x706c), seq 952, ack 88926, win 512, options [nop,nop,TS val 3517296802 ecr 3517296802], length 0
2022-04-07 19:51:37.402715 IP (tos 0x0, ttl 64, id 21140, offset 0, flags [DF], proto TCP (6), length 3040)
    127.0.0.1.10550 > 127.0.0.1.53564: Flags [P.], cksum 0x09d5 (incorrect -> 0x834a), seq 88926:91914, ack 952, win 512, options [nop,nop,TS val 3517296954 ecr 3517296802], length 2988
2022-04-07 19:51:37.402747 IP (tos 0x0, ttl 64, id 30524, offset 0, flags [DF], proto TCP (6), length 52)
    127.0.0.1.53564 > 127.0.0.1.10550: Flags [.], cksum 0xfe28 (incorrect -> 0x6390), seq 952, ack 91914, win 512, options [nop,nop,TS val 3517296954 ecr 3517296954], length 0
2022-04-07 19:51:37.435729 IP (tos 0x0, ttl 64, id 21141, offset 0, flags [DF], proto TCP (6), length 2542)
    127.0.0.1.10550 > 127.0.0.1.53564: Flags [P.], cksum 0x07e3 (incorrect -> 0xc2e0), seq 91914:94404, ack 952, win 512, options [nop,nop,TS val 3517296987 ecr 3517296954], length 2490
2022-04-07 19:51:37.435747 IP (tos 0x0, ttl 64, id 30525, offset 0, flags [DF], proto TCP (6), length 52)
    127.0.0.1.53564 > 127.0.0.1.10550: Flags [.], cksum 0xfe28 (incorrect -> 0x5994), seq 952, ack 94404, win 512, options [nop,nop,TS val 3517296987 ecr 3517296987], length 0
2022-04-07 19:51:37.489428 IP (tos 0x0, ttl 64, id 21142, offset 0, flags [DF], proto TCP (6), length 4100)
    127.0.0.1.10550 > 127.0.0.1.53564: Flags [P.], cksum 0x0df9 (incorrect -> 0xd8a7), seq 94404:98452, ack 952, win 512, options [nop,nop,TS val 3517297041 ecr 3517296987], length 4048
2022-04-07 19:51:37.489451 IP (tos 0x0, ttl 64, id 30526, offset 0, flags [DF], proto TCP (6), length 52)
    127.0.0.1.53564 > 127.0.0.1.10550: Flags [.], cksum 0xfe28 (incorrect -> 0x4958), seq 952, ack 98452, win 512, options [nop,nop,TS val 3517297041 ecr 3517297041], length 0
2022-04-07 19:51:37.489455 IP (tos 0x0, ttl 64, id 21143, offset 0, flags [DF], proto TCP (6), length 2974)
    127.0.0.1.10550 > 127.0.0.1.53564: Flags [P.], cksum 0x0993 (incorrect -> 0x7e36), seq 98452:101374, ack 952, win 512, options [nop,nop,TS val 3517297041 ecr 3517297041], length 2922
2022-04-07 19:51:37.489667 IP (tos 0x0, ttl 64, id 30527, offset 0, flags [DF], proto TCP (6), length 52)
    127.0.0.1.53564 > 127.0.0.1.10550: Flags [.], cksum 0xfe28 (incorrect -> 0x3dee), seq 952, ack 101374, win 512, options [nop,nop,TS val 3517297041 ecr 3517297041], length 0
2022-04-07 19:51:37.522187 IP (tos 0x0, ttl 64, id 21144, offset 0, flags [DF], proto TCP (6), length 2442)
    127.0.0.1.10550 > 127.0.0.1.53564: Flags [P.], cksum 0x077f (incorrect -> 0x8d51), seq 101374:103764, ack 952, win 512, options [nop,nop,TS val 3517297073 ecr 3517297041], length 2390
2022-04-07 19:51:37.522201 IP (tos 0x0, ttl 64, id 30528, offset 0, flags [DF], proto TCP (6), length 52)
    127.0.0.1.53564 > 127.0.0.1.10550: Flags [.], cksum 0xfe28 (incorrect -> 0x3458), seq 952, ack 103764, win 512, options [nop,nop,TS val 3517297073 ecr 3517297073], length 0
2022-04-07 19:51:37.526513 IP (tos 0x0, ttl 64, id 21145, offset 0, flags [DF], proto TCP (6), length 3240)
    127.0.0.1.10550 > 127.0.0.1.53564: Flags [P.], cksum 0x0a9d (incorrect -> 0x5524), seq 103764:106952, ack 952, win 512, options [nop,nop,TS val 3517297078 ecr 3517297073], length 3188
2022-04-07 19:51:37.526627 IP (tos 0x0, ttl 64, id 30529, offset 0, flags [DF], proto TCP (6), length 52)
    127.0.0.1.53564 > 127.0.0.1.10550: Flags [.], cksum 0xfe28 (incorrect -> 0x27da), seq 952, ack 106952, win 512, options [nop,nop,TS val 3517297078 ecr 3517297078], length 0
2022-04-07 19:51:37.557808 IP (tos 0x0, ttl 64, id 21146, offset 0, flags [DF], proto TCP (6), length 2940)
    127.0.0.1.10550 > 127.0.0.1.53564: Flags [P.], cksum 0x0971 (incorrect -> 0x4888), seq 106952:109840, ack 952, win 512, options [nop,nop,TS val 3517297109 ecr 3517297078], length 2888
2022-04-07 19:51:37.557837 IP (tos 0x0, ttl 64, id 30530, offset 0, flags [DF], proto TCP (6), length 52)
    127.0.0.1.53564 > 127.0.0.1.10550: Flags [.], cksum 0xfe28 (incorrect -> 0x1c54), seq 952, ack 109840, win 512, options [nop,nop,TS val 3517297109 ecr 3517297109], length 0
2022-04-07 19:51:37.557887 IP (tos 0x0, ttl 64, id 21147, offset 0, flags [DF], proto TCP (6), length 3438)
    127.0.0.1.10550 > 127.0.0.1.53564: Flags [P.], cksum 0x0b63 (incorrect -> 0x19a4), seq 109840:113226, ack 952, win 512, options [nop,nop,TS val 3517297109 ecr 3517297109], length 3386
2022-04-07 19:51:37.557897 IP (tos 0x0, ttl 64, id 30531, offset 0, flags [DF], proto TCP (6), length 52)
    127.0.0.1.53564 > 127.0.0.1.10550: Flags [.], cksum 0xfe28 (incorrect -> 0x0f1a), seq 952, ack 113226, win 512, options [nop,nop,TS val 3517297109 ecr 3517297109], length 0
2022-04-07 19:51:37.559093 IP (tos 0x0, ttl 64, id 21148, offset 0, flags [DF], proto TCP (6), length 2392)
    127.0.0.1.10550 > 127.0.0.1.53564: Flags [P.], cksum 0x074d (incorrect -> 0xdba3), seq 113226:115566, ack 952, win 512, options [nop,nop,TS val 3517297110 ecr 3517297109], length 2340
2022-04-07 19:51:37.559104 IP (tos 0x0, ttl 64, id 30532, offset 0, flags [DF], proto TCP (6), length 52)
    127.0.0.1.53564 > 127.0.0.1.10550: Flags [.], cksum 0xfe28 (incorrect -> 0x05f4), seq 952, ack 115566, win 512, options [nop,nop,TS val 3517297110 ecr 3517297110], length 0
2022-04-07 19:51:37.639748 IP (tos 0x0, ttl 64, id 21149, offset 0, flags [DF], proto TCP (6), length 3334)
    127.0.0.1.10550 > 127.0.0.1.53564: Flags [P.], cksum 0x0afb (incorrect -> 0x3d48), seq 115566:118848, ack 952, win 512, options [nop,nop,TS val 3517297191 ecr 3517297110], length 3282
2022-04-07 19:51:37.639984 IP (tos 0x0, ttl 64, id 30533, offset 0, flags [DF], proto TCP (6), length 52)
    127.0.0.1.53564 > 127.0.0.1.10550: Flags [.], cksum 0xfe28 (incorrect -> 0xf87f), seq 952, ack 118848, win 512, options [nop,nop,TS val 3517297191 ecr 3517297191], length 0
2022-04-07 19:51:37.647535 IP (tos 0x0, ttl 64, id 21150, offset 0, flags [DF], proto TCP (6), length 3338)
    127.0.0.1.10550 > 127.0.0.1.53564: Flags [P.], cksum 0x0aff (incorrect -> 0xbf1e), seq 118848:122134, ack 952, win 512, options [nop,nop,TS val 3517297199 ecr 3517297191], length 3286
2022-04-07 19:51:37.647661 IP (tos 0x0, ttl 64, id 30534, offset 0, flags [DF], proto TCP (6), length 52)
    127.0.0.1.53564 > 127.0.0.1.10550: Flags [.], cksum 0xfe28 (incorrect -> 0xeb99), seq 952, ack 122134, win 512, options [nop,nop,TS val 3517297199 ecr 3517297199], length 0
2022-04-07 19:51:37.672826 IP (tos 0x0, ttl 64, id 21151, offset 0, flags [DF], proto TCP (6), length 2542)
    127.0.0.1.10550 > 127.0.0.1.53564: Flags [P.], cksum 0x07e3 (incorrect -> 0x44fe), seq 122134:124624, ack 952, win 512, options [nop,nop,TS val 3517297224 ecr 3517297199], length 2490
2022-04-07 19:51:37.672899 IP (tos 0x0, ttl 64, id 30535, offset 0, flags [DF], proto TCP (6), length 52)
    127.0.0.1.53564 > 127.0.0.1.10550: Flags [.], cksum 0xfe28 (incorrect -> 0xe1ad), seq 952, ack 124624, win 512, options [nop,nop,TS val 3517297224 ecr 3517297224], length 0
2022-04-07 19:51:37.700396 IP (tos 0x0, ttl 64, id 21152, offset 0, flags [DF], proto TCP (6), length 3416)
    127.0.0.1.10550 > 127.0.0.1.53564: Flags [P.], cksum 0x0b4d (incorrect -> 0xd1d8), seq 124624:127988, ack 952, win 512, options [nop,nop,TS val 3517297252 ecr 3517297224], length 3364
2022-04-07 19:51:37.700541 IP (tos 0x0, ttl 64, id 30536, offset 0, flags [DF], proto TCP (6), length 52)
    127.0.0.1.53564 > 127.0.0.1.10550: Flags [.], cksum 0xfe28 (incorrect -> 0xd451), seq 952, ack 127988, win 512, options [nop,nop,TS val 3517297252 ecr 3517297252], length 0
2022-04-07 19:51:37.705712 IP (tos 0x0, ttl 64, id 21153, offset 0, flags [DF], proto TCP (6), length 2635)
    127.0.0.1.10550 > 127.0.0.1.53564: Flags [P.], cksum 0x0840 (incorrect -> 0x56d5), seq 127988:130571, ack 952, win 512, options [nop,nop,TS val 3517297257 ecr 3517297252], length 2583
2022-04-07 19:51:37.705757 IP (tos 0x0, ttl 64, id 30537, offset 0, flags [DF], proto TCP (6), length 52)
    127.0.0.1.53564 > 127.0.0.1.10550: Flags [.], cksum 0xfe28 (incorrect -> 0xca30), seq 952, ack 130571, win 512, options [nop,nop,TS val 3517297257 ecr 3517297257], length 0
2022-04-07 19:51:37.738473 IP (tos 0x0, ttl 64, id 21154, offset 0, flags [DF], proto TCP (6), length 4036)
    127.0.0.1.10550 > 127.0.0.1.53564: Flags [P.], cksum 0x0db9 (incorrect -> 0x836d), seq 130571:134555, ack 952, win 512, options [nop,nop,TS val 3517297290 ecr 3517297257], length 3984
2022-04-07 19:51:37.738503 IP (tos 0x0, ttl 64, id 30538, offset 0, flags [DF], proto TCP (6), length 52)
    127.0.0.1.53564 > 127.0.0.1.10550: Flags [.], cksum 0xfe28 (incorrect -> 0xba5e), seq 952, ack 134555, win 512, options [nop,nop,TS val 3517297290 ecr 3517297290], length 0
2022-04-07 19:51:37.771390 IP (tos 0x0, ttl 64, id 21155, offset 0, flags [DF], proto TCP (6), length 2721)
    127.0.0.1.10550 > 127.0.0.1.53564: Flags [P.], cksum 0x0896 (incorrect -> 0x57cd), seq 134555:137224, ack 952, win 512, options [nop,nop,TS val 3517297323 ecr 3517297290], length 2669
2022-04-07 19:51:37.771535 IP (tos 0x0, ttl 64, id 30539, offset 0, flags [DF], proto TCP (6), length 52)
    127.0.0.1.53564 > 127.0.0.1.10550: Flags [.], cksum 0xfe28 (incorrect -> 0xafaf), seq 952, ack 137224, win 512, options [nop,nop,TS val 3517297323 ecr 3517297323], length 0
2022-04-07 19:51:37.804459 IP (tos 0x0, ttl 64, id 21156, offset 0, flags [DF], proto TCP (6), length 3061)
    127.0.0.1.10550 > 127.0.0.1.53564: Flags [P.], cksum 0x09ea (incorrect -> 0x2af4), seq 137224:140233, ack 952, win 512, options [nop,nop,TS val 3517297356 ecr 3517297323], length 3009
2022-04-07 19:51:37.804586 IP (tos 0x0, ttl 64, id 30540, offset 0, flags [DF], proto TCP (6), length 52)
    127.0.0.1.53564 > 127.0.0.1.10550: Flags [.], cksum 0xfe28 (incorrect -> 0xa3ac), seq 952, ack 140233, win 512, options [nop,nop,TS val 3517297356 ecr 3517297356], length 0
2022-04-07 19:51:37.827325 IP (tos 0x0, ttl 64, id 21157, offset 0, flags [DF], proto TCP (6), length 3219)
    127.0.0.1.10550 > 127.0.0.1.53564: Flags [P.], cksum 0x0a88 (incorrect -> 0x5708), seq 140233:143400, ack 952, win 512, options [nop,nop,TS val 3517297379 ecr 3517297356], length 3167
2022-04-07 19:51:37.827435 IP (tos 0x0, ttl 64, id 30541, offset 0, flags [DF], proto TCP (6), length 52)
    127.0.0.1.53564 > 127.0.0.1.10550: Flags [.], cksum 0xfe28 (incorrect -> 0x971f), seq 952, ack 143400, win 512, options [nop,nop,TS val 3517297379 ecr 3517297379], length 0
2022-04-07 19:51:37.837141 IP (tos 0x0, ttl 64, id 21158, offset 0, flags [DF], proto TCP (6), length 1048)
    127.0.0.1.10550 > 127.0.0.1.53564: Flags [P.], cksum 0x020d (incorrect -> 0xe480), seq 143400:144396, ack 952, win 512, options [nop,nop,TS val 3517297388 ecr 3517297379], length 996
2022-04-07 19:51:37.837154 IP (tos 0x0, ttl 64, id 30542, offset 0, flags [DF], proto TCP (6), length 52)
    127.0.0.1.53564 > 127.0.0.1.10550: Flags [.], cksum 0xfe28 (incorrect -> 0x9329), seq 952, ack 144396, win 512, options [nop,nop,TS val 3517297388 ecr 3517297388], length 0
2022-04-07 19:51:37.880010 IP (tos 0x0, ttl 64, id 21159, offset 0, flags [DF], proto TCP (6), length 3538)
    127.0.0.1.10550 > 127.0.0.1.53564: Flags [P.], cksum 0x0bc7 (incorrect -> 0xccfd), seq 144396:147882, ack 952, win 512, options [nop,nop,TS val 3517297431 ecr 3517297388], length 3486
2022-04-07 19:51:37.880086 IP (tos 0x0, ttl 64, id 30543, offset 0, flags [DF], proto TCP (6), length 52)
    127.0.0.1.53564 > 127.0.0.1.10550: Flags [.], cksum 0xfe28 (incorrect -> 0x8535), seq 952, ack 147882, win 512, options [nop,nop,TS val 3517297431 ecr 3517297431], length 0
2022-04-07 19:51:37.912307 IP (tos 0x0, ttl 64, id 21160, offset 0, flags [DF], proto TCP (6), length 550)
    127.0.0.1.10550 > 127.0.0.1.53564: Flags [P.], cksum 0x001b (incorrect -> 0x7aa5), seq 147882:148380, ack 952, win 512, options [nop,nop,TS val 3517297464 ecr 3517297431], length 498
2022-04-07 19:51:37.912320 IP (tos 0x0, ttl 64, id 30544, offset 0, flags [DF], proto TCP (6), length 52)
    127.0.0.1.53564 > 127.0.0.1.10550: Flags [.], cksum 0xfe28 (incorrect -> 0x8301), seq 952, ack 148380, win 512, options [nop,nop,TS val 3517297464 ecr 3517297464], length 0
2022-04-07 19:51:37.949940 IP (tos 0x0, ttl 64, id 21161, offset 0, flags [DF], proto TCP (6), length 3538)
    127.0.0.1.10550 > 127.0.0.1.53564: Flags [P.], cksum 0x0bc7 (incorrect -> 0x6257), seq 148380:151866, ack 952, win 512, options [nop,nop,TS val 3517297501 ecr 3517297464], length 3486
2022-04-07 19:51:37.949996 IP (tos 0x0, ttl 64, id 30545, offset 0, flags [DF], proto TCP (6), length 52)
    127.0.0.1.53564 > 127.0.0.1.10550: Flags [.], cksum 0xfe28 (incorrect -> 0x7519), seq 952, ack 151866, win 512, options [nop,nop,TS val 3517297501 ecr 3517297501], length 0
2022-04-07 19:51:37.950001 IP (tos 0x0, ttl 64, id 21162, offset 0, flags [DF], proto TCP (6), length 3972)
    127.0.0.1.10550 > 127.0.0.1.53564: Flags [P.], cksum 0x0d79 (incorrect -> 0x6723), seq 151866:155786, ack 952, win 512, options [nop,nop,TS val 3517297501 ecr 3517297501], length 3920
2022-04-07 19:51:37.950183 IP (tos 0x0, ttl 64, id 30546, offset 0, flags [DF], proto TCP (6), length 52)
    127.0.0.1.53564 > 127.0.0.1.10550: Flags [.], cksum 0xfe28 (incorrect -> 0x65c9), seq 952, ack 155786, win 512, options [nop,nop,TS val 3517297501 ecr 3517297501], length 0
2022-04-07 19:51:37.982544 IP (tos 0x0, ttl 64, id 21163, offset 0, flags [DF], proto TCP (6), length 2044)
    127.0.0.1.10550 > 127.0.0.1.53564: Flags [P.], cksum 0x05f1 (incorrect -> 0x87b8), seq 155786:157778, ack 952, win 512, options [nop,nop,TS val 3517297534 ecr 3517297501], length 1992
2022-04-07 19:51:37.982557 IP (tos 0x0, ttl 64, id 30547, offset 0, flags [DF], proto TCP (6), length 52)
    127.0.0.1.53564 > 127.0.0.1.10550: Flags [.], cksum 0xfe28 (incorrect -> 0x5dbf), seq 952, ack 157778, win 512, options [nop,nop,TS val 3517297534 ecr 3517297534], length 0
2022-04-07 19:51:38.037404 IP (tos 0x0, ttl 64, id 21164, offset 0, flags [DF], proto TCP (6), length 3538)
    127.0.0.1.10550 > 127.0.0.1.53564: Flags [P.], cksum 0x0bc7 (incorrect -> 0x95c4), seq 157778:161264, ack 952, win 512, options [nop,nop,TS val 3517297589 ecr 3517297534], length 3486
2022-04-07 19:51:38.037511 IP (tos 0x0, ttl 64, id 30548, offset 0, flags [DF], proto TCP (6), length 52)
    127.0.0.1.53564 > 127.0.0.1.10550: Flags [.], cksum 0xfe28 (incorrect -> 0x4fb3), seq 952, ack 161264, win 512, options [nop,nop,TS val 3517297589 ecr 3517297589], length 0
2022-04-07 19:51:38.070039 IP (tos 0x0, ttl 64, id 21165, offset 0, flags [DF], proto TCP (6), length 2292)
    127.0.0.1.10550 > 127.0.0.1.53564: Flags [P.], cksum 0x06e9 (incorrect -> 0x1c88), seq 161264:163504, ack 952, win 512, options [nop,nop,TS val 3517297621 ecr 3517297589], length 2240
2022-04-07 19:51:38.070056 IP (tos 0x0, ttl 64, id 30549, offset 0, flags [DF], proto TCP (6), length 52)
    127.0.0.1.53564 > 127.0.0.1.10550: Flags [.], cksum 0xfe28 (incorrect -> 0x46b3), seq 952, ack 163504, win 512, options [nop,nop,TS val 3517297621 ecr 3517297621], length 0
2022-04-07 19:51:38.125412 IP (tos 0x0, ttl 64, id 21166, offset 0, flags [DF], proto TCP (6), length 3288)
    127.0.0.1.10550 > 127.0.0.1.53564: Flags [P.], cksum 0x0acd (incorrect -> 0x0647), seq 163504:166740, ack 952, win 512, options [nop,nop,TS val 3517297677 ecr 3517297621], length 3236
2022-04-07 19:51:38.125600 IP (tos 0x0, ttl 64, id 30550, offset 0, flags [DF], proto TCP (6), length 52)
    127.0.0.1.53564 > 127.0.0.1.10550: Flags [.], cksum 0xfe28 (incorrect -> 0x399f), seq 952, ack 166740, win 512, options [nop,nop,TS val 3517297677 ecr 3517297677], length 0
2022-04-07 19:51:38.158687 IP (tos 0x0, ttl 64, id 21167, offset 0, flags [DF], proto TCP (6), length 3040)
    127.0.0.1.10550 > 127.0.0.1.53564: Flags [P.], cksum 0x09d5 (incorrect -> 0xb4db), seq 166740:169728, ack 952, win 512, options [nop,nop,TS val 3517297710 ecr 3517297677], length 2988
2022-04-07 19:51:38.158712 IP (tos 0x0, ttl 64, id 30551, offset 0, flags [DF], proto TCP (6), length 52)
    127.0.0.1.53564 > 127.0.0.1.10550: Flags [.], cksum 0xfe28 (incorrect -> 0x2db1), seq 952, ack 169728, win 512, options [nop,nop,TS val 3517297710 ecr 3517297710], length 0
2022-04-07 19:51:38.208179 IP (tos 0x0, ttl 64, id 21168, offset 0, flags [DF], proto TCP (6), length 3140)
    127.0.0.1.10550 > 127.0.0.1.53564: Flags [P.], cksum 0x0a39 (incorrect -> 0x7b23), seq 169728:172816, ack 952, win 512, options [nop,nop,TS val 3517297759 ecr 3517297710], length 3088
2022-04-07 19:51:38.208401 IP (tos 0x0, ttl 64, id 30552, offset 0, flags [DF], proto TCP (6), length 52)
    127.0.0.1.53564 > 127.0.0.1.10550: Flags [.], cksum 0xfe28 (incorrect -> 0x213e), seq 952, ack 172816, win 512, options [nop,nop,TS val 3517297760 ecr 3517297759], length 0
2022-04-07 19:51:38.241377 IP (tos 0x0, ttl 64, id 21169, offset 0, flags [DF], proto TCP (6), length 3040)
    127.0.0.1.10550 > 127.0.0.1.53564: Flags [P.], cksum 0x09d5 (incorrect -> 0x3356), seq 172816:175804, ack 952, win 512, options [nop,nop,TS val 3517297793 ecr 3517297760], length 2988
2022-04-07 19:51:38.241390 IP (tos 0x0, ttl 64, id 30553, offset 0, flags [DF], proto TCP (6), length 52)
    127.0.0.1.53564 > 127.0.0.1.10550: Flags [.], cksum 0xfe28 (incorrect -> 0x154f), seq 952, ack 175804, win 512, options [nop,nop,TS val 3517297793 ecr 3517297793], length 0
2022-04-07 19:51:38.293606 IP (tos 0x0, ttl 64, id 21170, offset 0, flags [DF], proto TCP (6), length 3538)
    127.0.0.1.10550 > 127.0.0.1.53564: Flags [P.], cksum 0x0bc7 (incorrect -> 0x189c), seq 175804:179290, ack 952, win 512, options [nop,nop,TS val 3517297845 ecr 3517297793], length 3486
2022-04-07 19:51:38.293620 IP (tos 0x0, ttl 64, id 30554, offset 0, flags [DF], proto TCP (6), length 52)
    127.0.0.1.53564 > 127.0.0.1.10550: Flags [.], cksum 0xfe28 (incorrect -> 0x0749), seq 952, ack 179290, win 512, options [nop,nop,TS val 3517297845 ecr 3517297845], length 0
2022-04-07 19:51:38.295304 IP (tos 0x0, ttl 64, id 21171, offset 0, flags [DF], proto TCP (6), length 3411)
    127.0.0.1.10550 > 127.0.0.1.53564: Flags [P.], cksum 0x0b48 (incorrect -> 0x75c8), seq 179290:182649, ack 952, win 512, options [nop,nop,TS val 3517297847 ecr 3517297845], length 3359
2022-04-07 19:51:38.295427 IP (tos 0x0, ttl 64, id 30555, offset 0, flags [DF], proto TCP (6), length 52)
    127.0.0.1.53564 > 127.0.0.1.10550: Flags [.], cksum 0xfe28 (incorrect -> 0xfa25), seq 952, ack 182649, win 512, options [nop,nop,TS val 3517297847 ecr 3517297847], length 0
2022-04-07 19:51:38.295463 IP (tos 0x0, ttl 64, id 21172, offset 0, flags [DF], proto TCP (6), length 3538)
    127.0.0.1.10550 > 127.0.0.1.53564: Flags [P.], cksum 0x0bc7 (incorrect -> 0x16df), seq 182649:186135, ack 952, win 512, options [nop,nop,TS val 3517297847 ecr 3517297847], length 3486
2022-04-07 19:51:38.295473 IP (tos 0x0, ttl 64, id 30556, offset 0, flags [DF], proto TCP (6), length 52)
    127.0.0.1.53564 > 127.0.0.1.10550: Flags [.], cksum 0xfe28 (incorrect -> 0xec87), seq 952, ack 186135, win 512, options [nop,nop,TS val 3517297847 ecr 3517297847], length 0
2022-04-07 19:51:38.326490 IP (tos 0x0, ttl 64, id 21173, offset 0, flags [DF], proto TCP (6), length 1546)
    127.0.0.1.10550 > 127.0.0.1.53564: Flags [P.], cksum 0x03ff (incorrect -> 0x556c), seq 186135:187629, ack 952, win 512, options [nop,nop,TS val 3517297878 ecr 3517297847], length 1494
2022-04-07 19:51:38.326502 IP (tos 0x0, ttl 64, id 30557, offset 0, flags [DF], proto TCP (6), length 52)
    127.0.0.1.53564 > 127.0.0.1.10550: Flags [.], cksum 0xfe28 (incorrect -> 0xe673), seq 952, ack 187629, win 512, options [nop,nop,TS val 3517297878 ecr 3517297878], length 0
2022-04-07 19:51:38.366536 IP (tos 0x0, ttl 64, id 21174, offset 0, flags [DF], proto TCP (6), length 4100)
    127.0.0.1.10550 > 127.0.0.1.53564: Flags [P.], cksum 0x0df9 (incorrect -> 0xd8ff), seq 187629:191677, ack 952, win 512, options [nop,nop,TS val 3517297918 ecr 3517297878], length 4048
2022-04-07 19:51:38.366647 IP (tos 0x0, ttl 64, id 30558, offset 0, flags [DF], proto TCP (6), length 52)
    127.0.0.1.53564 > 127.0.0.1.10550: Flags [.], cksum 0xfe28 (incorrect -> 0xd653), seq 952, ack 191677, win 512, options [nop,nop,TS val 3517297918 ecr 3517297918], length 0
2022-04-07 19:51:38.366652 IP (tos 0x0, ttl 64, id 21175, offset 0, flags [DF], proto TCP (6), length 3130)
    127.0.0.1.10550 > 127.0.0.1.53564: Flags [P.], cksum 0x0a2f (incorrect -> 0xa1a6), seq 191677:194755, ack 952, win 512, options [nop,nop,TS val 3517297918 ecr 3517297918], length 3078
2022-04-07 19:51:38.366655 IP (tos 0x0, ttl 64, id 30559, offset 0, flags [DF], proto TCP (6), length 52)
    127.0.0.1.53564 > 127.0.0.1.10550: Flags [.], cksum 0xfe28 (incorrect -> 0xca4d), seq 952, ack 194755, win 512, options [nop,nop,TS val 3517297918 ecr 3517297918], length 0
2022-04-07 19:51:38.399548 IP (tos 0x0, ttl 64, id 21176, offset 0, flags [DF], proto TCP (6), length 2024)
    127.0.0.1.10550 > 127.0.0.1.53564: Flags [P.], cksum 0x05dd (incorrect -> 0xb0d7), seq 194755:196727, ack 952, win 512, options [nop,nop,TS val 3517297951 ecr 3517297918], length 1972
2022-04-07 19:51:38.399578 IP (tos 0x0, ttl 64, id 30560, offset 0, flags [DF], proto TCP (6), length 52)
    127.0.0.1.53564 > 127.0.0.1.10550: Flags [.], cksum 0xfe28 (incorrect -> 0xc257), seq 952, ack 196727, win 512, options [nop,nop,TS val 3517297951 ecr 3517297951], length 0
2022-04-07 19:51:38.454903 IP (tos 0x0, ttl 64, id 21177, offset 0, flags [DF], proto TCP (6), length 2492)
    127.0.0.1.10550 > 127.0.0.1.53564: Flags [P.], cksum 0x07b1 (incorrect -> 0x709a), seq 196727:199167, ack 952, win 512, options [nop,nop,TS val 3517298006 ecr 3517297951], length 2440
2022-04-07 19:51:38.454955 IP (tos 0x0, ttl 64, id 30561, offset 0, flags [DF], proto TCP (6), length 52)
    127.0.0.1.53564 > 127.0.0.1.10550: Flags [.], cksum 0xfe28 (incorrect -> 0xb861), seq 952, ack 199167, win 512, options [nop,nop,TS val 3517298006 ecr 3517298006], length 0
2022-04-07 19:51:38.455105 IP (tos 0x0, ttl 64, id 21178, offset 0, flags [DF], proto TCP (6), length 3438)
    127.0.0.1.10550 > 127.0.0.1.53564: Flags [P.], cksum 0x0b63 (incorrect -> 0x22fb), seq 199167:202553, ack 952, win 512, options [nop,nop,TS val 3517298006 ecr 3517298006], length 3386
2022-04-07 19:51:38.455118 IP (tos 0x0, ttl 64, id 30562, offset 0, flags [DF], proto TCP (6), length 52)
    127.0.0.1.53564 > 127.0.0.1.10550: Flags [.], cksum 0xfe28 (incorrect -> 0xab27), seq 952, ack 202553, win 512, options [nop,nop,TS val 3517298006 ecr 3517298006], length 0
2022-04-07 19:51:38.475335 IP (tos 0x0, ttl 64, id 21179, offset 0, flags [DF], proto TCP (6), length 4036)
    127.0.0.1.10550 > 127.0.0.1.53564: Flags [P.], cksum 0x0db9 (incorrect -> 0x2024), seq 202553:206537, ack 952, win 512, options [nop,nop,TS val 3517298027 ecr 3517298006], length 3984
2022-04-07 19:51:38.475352 IP (tos 0x0, ttl 64, id 30563, offset 0, flags [DF], proto TCP (6), length 52)
    127.0.0.1.53564 > 127.0.0.1.10550: Flags [.], cksum 0xfe28 (incorrect -> 0x9b6d), seq 952, ack 206537, win 512, options [nop,nop,TS val 3517298027 ecr 3517298027], length 0
2022-04-07 19:51:38.552232 IP (tos 0x0, ttl 64, id 21180, offset 0, flags [DF], proto TCP (6), length 1844)
    127.0.0.1.10550 > 127.0.0.1.53564: Flags [P.], cksum 0x0529 (incorrect -> 0x8a78), seq 206537:208329, ack 952, win 512, options [nop,nop,TS val 3517298104 ecr 3517298027], length 1792
2022-04-07 19:51:38.552257 IP (tos 0x0, ttl 64, id 30564, offset 0, flags [DF], proto TCP (6), length 52)
    127.0.0.1.53564 > 127.0.0.1.10550: Flags [.], cksum 0xfe28 (incorrect -> 0x93d3), seq 952, ack 208329, win 512, options [nop,nop,TS val 3517298104 ecr 3517298104], length 0
2022-04-07 19:51:38.553622 IP (tos 0x0, ttl 64, id 21181, offset 0, flags [DF], proto TCP (6), length 4100)
    127.0.0.1.10550 > 127.0.0.1.53564: Flags [P.], cksum 0x0df9 (incorrect -> 0x3d87), seq 208329:212377, ack 952, win 512, options [nop,nop,TS val 3517298105 ecr 3517298104], length 4048
2022-04-07 19:51:38.553655 IP (tos 0x0, ttl 64, id 30565, offset 0, flags [DF], proto TCP (6), length 52)
    127.0.0.1.53564 > 127.0.0.1.10550: Flags [.], cksum 0xfe28 (incorrect -> 0x8401), seq 952, ack 212377, win 512, options [nop,nop,TS val 3517298105 ecr 3517298105], length 0
2022-04-07 19:51:38.553659 IP (tos 0x0, ttl 64, id 21182, offset 0, flags [DF], proto TCP (6), length 2348)
    127.0.0.1.10550 > 127.0.0.1.53564: Flags [P.], cksum 0x0721 (incorrect -> 0x914e), seq 212377:214673, ack 952, win 512, options [nop,nop,TS val 3517298105 ecr 3517298105], length 2296
2022-04-07 19:51:38.553868 IP (tos 0x0, ttl 64, id 30566, offset 0, flags [DF], proto TCP (6), length 52)
    127.0.0.1.53564 > 127.0.0.1.10550: Flags [.], cksum 0xfe28 (incorrect -> 0x7b09), seq 952, ack 214673, win 512, options [nop,nop,TS val 3517298105 ecr 3517298105], length 0
2022-04-07 19:51:38.636597 IP (tos 0x0, ttl 64, id 21183, offset 0, flags [DF], proto TCP (6), length 2071)
    127.0.0.1.10550 > 127.0.0.1.53564: Flags [P.], cksum 0x060c (incorrect -> 0x803f), seq 214673:216692, ack 952, win 512, options [nop,nop,TS val 3517298188 ecr 3517298105], length 2019
2022-04-07 19:51:38.636612 IP (tos 0x0, ttl 64, id 30567, offset 0, flags [DF], proto TCP (6), length 52)
    127.0.0.1.53564 > 127.0.0.1.10550: Flags [.], cksum 0xfe28 (incorrect -> 0x7280), seq 952, ack 216692, win 512, options [nop,nop,TS val 3517298188 ecr 3517298188], length 0
2022-04-07 19:51:38.638193 IP (tos 0x0, ttl 64, id 21184, offset 0, flags [DF], proto TCP (6), length 3538)
    127.0.0.1.10550 > 127.0.0.1.53564: Flags [P.], cksum 0x0bc7 (incorrect -> 0x090e), seq 216692:220178, ack 952, win 512, options [nop,nop,TS val 3517298189 ecr 3517298188], length 3486
2022-04-07 19:51:38.638204 IP (tos 0x0, ttl 64, id 30568, offset 0, flags [DF], proto TCP (6), length 52)
    127.0.0.1.53564 > 127.0.0.1.10550: Flags [.], cksum 0xfe28 (incorrect -> 0x64e0), seq 952, ack 220178, win 512, options [nop,nop,TS val 3517298189 ecr 3517298189], length 0
2022-04-07 19:51:38.669450 IP (tos 0x0, ttl 64, id 21185, offset 0, flags [DF], proto TCP (6), length 3906)
    127.0.0.1.10550 > 127.0.0.1.53564: Flags [P.], cksum 0x0d37 (incorrect -> 0xe4b0), seq 220178:224032, ack 952, win 512, options [nop,nop,TS val 3517298221 ecr 3517298189], length 3854
2022-04-07 19:51:38.669671 IP (tos 0x0, ttl 64, id 30569, offset 0, flags [DF], proto TCP (6), length 52)
    127.0.0.1.53564 > 127.0.0.1.10550: Flags [.], cksum 0xfe28 (incorrect -> 0x5592), seq 952, ack 224032, win 512, options [nop,nop,TS val 3517298221 ecr 3517298221], length 0
2022-04-07 19:51:38.711222 IP (tos 0x0, ttl 64, id 21186, offset 0, flags [DF], proto TCP (6), length 3538)
    127.0.0.1.10550 > 127.0.0.1.53564: Flags [P.], cksum 0x0bc7 (incorrect -> 0xa540), seq 224032:227518, ack 952, win 512, options [nop,nop,TS val 3517298262 ecr 3517298221], length 3486
2022-04-07 19:51:38.711238 IP (tos 0x0, ttl 64, id 30570, offset 0, flags [DF], proto TCP (6), length 52)
    127.0.0.1.53564 > 127.0.0.1.10550: Flags [.], cksum 0xfe28 (incorrect -> 0x47a1), seq 952, ack 227518, win 512, options [nop,nop,TS val 3517298263 ecr 3517298262], length 0
2022-04-07 19:51:38.712350 IP (tos 0x0, ttl 64, id 21187, offset 0, flags [DF], proto TCP (6), length 4100)
    127.0.0.1.10550 > 127.0.0.1.53564: Flags [P.], cksum 0x0df9 (incorrect -> 0xad58), seq 227518:231566, ack 952, win 512, options [nop,nop,TS val 3517298264 ecr 3517298263], length 4048
2022-04-07 19:51:38.712490 IP (tos 0x0, ttl 64, id 30571, offset 0, flags [DF], proto TCP (6), length 52)
    127.0.0.1.53564 > 127.0.0.1.10550: Flags [.], cksum 0xfe28 (incorrect -> 0x37ce), seq 952, ack 231566, win 512, options [nop,nop,TS val 3517298264 ecr 3517298264], length 0
2022-04-07 19:51:38.712494 IP (tos 0x0, ttl 64, id 21188, offset 0, flags [DF], proto TCP (6), length 2698)
    127.0.0.1.10550 > 127.0.0.1.53564: Flags [P.], cksum 0x087f (incorrect -> 0xf5a2), seq 231566:234212, ack 952, win 512, options [nop,nop,TS val 3517298264 ecr 3517298264], length 2646
2022-04-07 19:51:38.712497 IP (tos 0x0, ttl 64, id 30572, offset 0, flags [DF], proto TCP (6), length 52)
    127.0.0.1.53564 > 127.0.0.1.10550: Flags [.], cksum 0xfe28 (incorrect -> 0x2d78), seq 952, ack 234212, win 512, options [nop,nop,TS val 3517298264 ecr 3517298264], length 0
2022-04-07 19:51:38.744299 IP (tos 0x0, ttl 64, id 21189, offset 0, flags [DF], proto TCP (6), length 3914)
    127.0.0.1.10550 > 127.0.0.1.53564: Flags [P.], cksum 0x0d3f (incorrect -> 0xfc01), seq 234212:238074, ack 952, win 512, options [nop,nop,TS val 3517298296 ecr 3517298264], length 3862
2022-04-07 19:51:38.744331 IP (tos 0x0, ttl 64, id 30573, offset 0, flags [DF], proto TCP (6), length 52)
    127.0.0.1.53564 > 127.0.0.1.10550: Flags [.], cksum 0xfe28 (incorrect -> 0x1e22), seq 952, ack 238074, win 512, options [nop,nop,TS val 3517298296 ecr 3517298296], length 0
2022-04-07 19:51:38.779765 IP (tos 0x0, ttl 64, id 21190, offset 0, flags [DF], proto TCP (6), length 3040)
    127.0.0.1.10550 > 127.0.0.1.53564: Flags [P.], cksum 0x09d5 (incorrect -> 0x0c30), seq 238074:241062, ack 952, win 512, options [nop,nop,TS val 3517298331 ecr 3517298296], length 2988
2022-04-07 19:51:38.779794 IP (tos 0x0, ttl 64, id 30574, offset 0, flags [DF], proto TCP (6), length 52)
    127.0.0.1.53564 > 127.0.0.1.10550: Flags [.], cksum 0xfe28 (incorrect -> 0x1230), seq 952, ack 241062, win 512, options [nop,nop,TS val 3517298331 ecr 3517298331], length 0
2022-04-07 19:51:38.785985 IP (tos 0x0, ttl 64, id 21191, offset 0, flags [DF], proto TCP (6), length 3538)
    127.0.0.1.10550 > 127.0.0.1.53564: Flags [P.], cksum 0x0bc7 (incorrect -> 0x68c3), seq 241062:244548, ack 952, win 512, options [nop,nop,TS val 3517298337 ecr 3517298331], length 3486
2022-04-07 19:51:38.785997 IP (tos 0x0, ttl 64, id 30575, offset 0, flags [DF], proto TCP (6), length 52)
    127.0.0.1.53564 > 127.0.0.1.10550: Flags [.], cksum 0xfe28 (incorrect -> 0x0486), seq 952, ack 244548, win 512, options [nop,nop,TS val 3517298337 ecr 3517298337], length 0
2022-04-07 19:51:38.787179 IP (tos 0x0, ttl 64, id 21192, offset 0, flags [DF], proto TCP (6), length 3800)
    127.0.0.1.10550 > 127.0.0.1.53564: Flags [P.], cksum 0x0ccd (incorrect -> 0x3e69), seq 244548:248296, ack 952, win 512, options [nop,nop,TS val 3517298338 ecr 3517298337], length 3748
2022-04-07 19:51:38.787300 IP (tos 0x0, ttl 64, id 30576, offset 0, flags [DF], proto TCP (6), length 52)
    127.0.0.1.53564 > 127.0.0.1.10550: Flags [.], cksum 0xfe28 (incorrect -> 0xf5de), seq 952, ack 248296, win 512, options [nop,nop,TS val 3517298339 ecr 3517298338], length 0
2022-04-07 19:51:38.812219 IP (tos 0x0, ttl 64, id 21193, offset 0, flags [DF], proto TCP (6), length 1546)
    127.0.0.1.10550 > 127.0.0.1.53564: Flags [P.], cksum 0x03ff (incorrect -> 0x37fb), seq 248296:249790, ack 952, win 512, options [nop,nop,TS val 3517298363 ecr 3517298339], length 1494
2022-04-07 19:51:38.812232 IP (tos 0x0, ttl 64, id 30577, offset 0, flags [DF], proto TCP (6), length 52)
    127.0.0.1.53564 > 127.0.0.1.10550: Flags [.], cksum 0xfe28 (incorrect -> 0xefd6), seq 952, ack 249790, win 512, options [nop,nop,TS val 3517298364 ecr 3517298363], length 0
2022-04-07 19:51:38.844665 IP (tos 0x0, ttl 64, id 21194, offset 0, flags [DF], proto TCP (6), length 2044)
    127.0.0.1.10550 > 127.0.0.1.53564: Flags [P.], cksum 0x05f1 (incorrect -> 0x5de7), seq 249790:251782, ack 952, win 512, options [nop,nop,TS val 3517298396 ecr 3517298364], length 1992
2022-04-07 19:51:38.844677 IP (tos 0x0, ttl 64, id 30578, offset 0, flags [DF], proto TCP (6), length 52)
    127.0.0.1.53564 > 127.0.0.1.10550: Flags [.], cksum 0xfe28 (incorrect -> 0xe7cd), seq 952, ack 251782, win 512, options [nop,nop,TS val 3517298396 ecr 3517298396], length 0
2022-04-07 19:51:38.877552 IP (tos 0x0, ttl 64, id 21195, offset 0, flags [DF], proto TCP (6), length 3040)
    127.0.0.1.10550 > 127.0.0.1.53564: Flags [P.], cksum 0x09d5 (incorrect -> 0x8e2a), seq 251782:254770, ack 952, win 512, options [nop,nop,TS val 3517298429 ecr 3517298396], length 2988
2022-04-07 19:51:38.877565 IP (tos 0x0, ttl 64, id 30579, offset 0, flags [DF], proto TCP (6), length 52)
    127.0.0.1.53564 > 127.0.0.1.10550: Flags [.], cksum 0xfe28 (incorrect -> 0xdbdf), seq 952, ack 254770, win 512, options [nop,nop,TS val 3517298429 ecr 3517298429], length 0
2022-04-07 19:51:38.974995 IP (tos 0x0, ttl 64, id 21196, offset 0, flags [DF], proto TCP (6), length 4100)
    127.0.0.1.10550 > 127.0.0.1.53564: Flags [P.], cksum 0x0df9 (incorrect -> 0xfe2f), seq 254770:258818, ack 952, win 512, options [nop,nop,TS val 3517298526 ecr 3517298429], length 4048
2022-04-07 19:51:38.975134 IP (tos 0x0, ttl 64, id 30580, offset 0, flags [DF], proto TCP (6), length 52)
    127.0.0.1.53564 > 127.0.0.1.10550: Flags [.], cksum 0xfe28 (incorrect -> 0xcb4d), seq 952, ack 258818, win 512, options [nop,nop,TS val 3517298526 ecr 3517298526], length 0
2022-04-07 19:51:38.975141 IP (tos 0x0, ttl 64, id 21197, offset 0, flags [DF], proto TCP (6), length 6598)
    127.0.0.1.10550 > 127.0.0.1.53564: Flags [P.], cksum 0x17bb (incorrect -> 0x7046), seq 258818:265364, ack 952, win 512, options [nop,nop,TS val 3517298526 ecr 3517298526], length 6546
2022-04-07 19:51:39.022782 IP (tos 0x0, ttl 64, id 30581, offset 0, flags [DF], proto TCP (6), length 52)
    127.0.0.1.53564 > 127.0.0.1.10550: Flags [.], cksum 0xfe28 (incorrect -> 0xb18b), seq 952, ack 265364, win 512, options [nop,nop,TS val 3517298574 ecr 3517298526], length 0
2022-04-07 19:51:39.022788 IP (tos 0x0, ttl 64, id 21198, offset 0, flags [DF], proto TCP (6), length 1048)
    127.0.0.1.10550 > 127.0.0.1.53564: Flags [P.], cksum 0x020d (incorrect -> 0xdaf4), seq 265364:266360, ack 952, win 512, options [nop,nop,TS val 3517298574 ecr 3517298574], length 996
2022-04-07 19:51:39.022807 IP (tos 0x0, ttl 64, id 30582, offset 0, flags [DF], proto TCP (6), length 52)
    127.0.0.1.53564 > 127.0.0.1.10550: Flags [.], cksum 0xfe28 (incorrect -> 0xad77), seq 952, ack 266360, win 512, options [nop,nop,TS val 3517298574 ecr 3517298574], length 0
2022-04-07 19:51:39.041168 IP (tos 0x0, ttl 64, id 21199, offset 0, flags [DF], proto TCP (6), length 4100)
    127.0.0.1.10550 > 127.0.0.1.53564: Flags [P.], cksum 0x0df9 (incorrect -> 0xfb1a), seq 266360:270408, ack 952, win 512, options [nop,nop,TS val 3517298592 ecr 3517298574], length 4048
2022-04-07 19:51:39.041185 IP (tos 0x0, ttl 64, id 30583, offset 0, flags [DF], proto TCP (6), length 52)
    127.0.0.1.53564 > 127.0.0.1.10550: Flags [.], cksum 0xfe28 (incorrect -> 0x9d83), seq 952, ack 270408, win 512, options [nop,nop,TS val 3517298592 ecr 3517298592], length 0
2022-04-07 19:51:39.041189 IP (tos 0x0, ttl 64, id 21200, offset 0, flags [DF], proto TCP (6), length 2976)
    127.0.0.1.10550 > 127.0.0.1.53564: Flags [P.], cksum 0x0995 (incorrect -> 0x1fca), seq 270408:273332, ack 952, win 512, options [nop,nop,TS val 3517298592 ecr 3517298592], length 2924
2022-04-07 19:51:39.041192 IP (tos 0x0, ttl 64, id 30584, offset 0, flags [DF], proto TCP (6), length 52)
    127.0.0.1.53564 > 127.0.0.1.10550: Flags [.], cksum 0xfe28 (incorrect -> 0x9217), seq 952, ack 273332, win 512, options [nop,nop,TS val 3517298592 ecr 3517298592], length 0
2022-04-07 19:51:39.177223 IP (tos 0x0, ttl 64, id 21201, offset 0, flags [DF], proto TCP (6), length 3538)
    127.0.0.1.10550 > 127.0.0.1.53564: Flags [P.], cksum 0x0bc7 (incorrect -> 0x793a), seq 273332:276818, ack 952, win 512, options [nop,nop,TS val 3517298728 ecr 3517298592], length 3486
2022-04-07 19:51:39.177321 IP (tos 0x0, ttl 64, id 30585, offset 0, flags [DF], proto TCP (6), length 52)
    127.0.0.1.53564 > 127.0.0.1.10550: Flags [.], cksum 0xfe28 (incorrect -> 0x8368), seq 952, ack 276818, win 512, options [nop,nop,TS val 3517298729 ecr 3517298728], length 0
2022-04-07 19:51:39.177328 IP (tos 0x0, ttl 64, id 21202, offset 0, flags [DF], proto TCP (6), length 4036)
    127.0.0.1.10550 > 127.0.0.1.53564: Flags [P.], cksum 0x0db9 (incorrect -> 0x168f), seq 276818:280802, ack 952, win 512, options [nop,nop,TS val 3517298729 ecr 3517298729], length 3984
2022-04-07 19:51:39.177752 IP (tos 0x0, ttl 64, id 30586, offset 0, flags [DF], proto TCP (6), length 52)
    127.0.0.1.53564 > 127.0.0.1.10550: Flags [.], cksum 0xfe28 (incorrect -> 0x73d7), seq 952, ack 280802, win 512, options [nop,nop,TS val 3517298729 ecr 3517298729], length 0
2022-04-07 19:51:39.177896 IP (tos 0x0, ttl 64, id 21203, offset 0, flags [DF], proto TCP (6), length 4036)
    127.0.0.1.10550 > 127.0.0.1.53564: Flags [P.], cksum 0x0db9 (incorrect -> 0x925d), seq 280802:284786, ack 952, win 512, options [nop,nop,TS val 3517298729 ecr 3517298729], length 3984
2022-04-07 19:51:39.218782 IP (tos 0x0, ttl 64, id 30587, offset 0, flags [DF], proto TCP (6), length 52)
    127.0.0.1.53564 > 127.0.0.1.10550: Flags [.], cksum 0xfe28 (incorrect -> 0x641e), seq 952, ack 284786, win 512, options [nop,nop,TS val 3517298770 ecr 3517298729], length 0
2022-04-07 19:51:39.218788 IP (tos 0x0, ttl 64, id 21204, offset 0, flags [DF], proto TCP (6), length 4036)
    127.0.0.1.10550 > 127.0.0.1.53564: Flags [P.], cksum 0x0db9 (incorrect -> 0x1906), seq 284786:288770, ack 952, win 512, options [nop,nop,TS val 3517298770 ecr 3517298770], length 3984
2022-04-07 19:51:39.262782 IP (tos 0x0, ttl 64, id 30588, offset 0, flags [DF], proto TCP (6), length 52)
    127.0.0.1.53564 > 127.0.0.1.10550: Flags [.], cksum 0xfe28 (incorrect -> 0x5439), seq 952, ack 288770, win 512, options [nop,nop,TS val 3517298814 ecr 3517298770], length 0
2022-04-07 19:51:39.262788 IP (tos 0x0, ttl 64, id 21205, offset 0, flags [DF], proto TCP (6), length 3538)
    127.0.0.1.10550 > 127.0.0.1.53564: Flags [P.], cksum 0x0bc7 (incorrect -> 0xdb6e), seq 288770:292256, ack 952, win 512, options [nop,nop,TS val 3517298814 ecr 3517298814], length 3486
2022-04-07 19:51:39.262805 IP (tos 0x0, ttl 64, id 30589, offset 0, flags [DF], proto TCP (6), length 52)
    127.0.0.1.53564 > 127.0.0.1.10550: Flags [.], cksum 0xfe28 (incorrect -> 0x466f), seq 952, ack 292256, win 512, options [nop,nop,TS val 3517298814 ecr 3517298814], length 0
2022-04-07 19:51:39.297172 IP (tos 0x0, ttl 64, id 21206, offset 0, flags [DF], proto TCP (6), length 3538)
    127.0.0.1.10550 > 127.0.0.1.53564: Flags [P.], cksum 0x0bc7 (incorrect -> 0x9c4c), seq 292256:295742, ack 952, win 512, options [nop,nop,TS val 3517298848 ecr 3517298814], length 3486
2022-04-07 19:51:39.338790 IP (tos 0x0, ttl 64, id 30590, offset 0, flags [DF], proto TCP (6), length 52)
    127.0.0.1.53564 > 127.0.0.1.10550: Flags [.], cksum 0xfe28 (incorrect -> 0x3863), seq 952, ack 295742, win 512, options [nop,nop,TS val 3517298890 ecr 3517298848], length 0
2022-04-07 19:51:39.338795 IP (tos 0x0, ttl 64, id 21207, offset 0, flags [DF], proto TCP (6), length 3040)
    127.0.0.1.10550 > 127.0.0.1.53564: Flags [P.], cksum 0x09d5 (incorrect -> 0xeb6b), seq 295742:298730, ack 952, win 512, options [nop,nop,TS val 3517298890 ecr 3517298890], length 2988
2022-04-07 19:51:39.338977 IP (tos 0x0, ttl 64, id 30591, offset 0, flags [DF], proto TCP (6), length 52)
    127.0.0.1.53564 > 127.0.0.1.10550: Flags [.], cksum 0xfe28 (incorrect -> 0x2c8d), seq 952, ack 298730, win 512, options [nop,nop,TS val 3517298890 ecr 3517298890], length 0
2022-04-07 19:51:39.403501 IP (tos 0x0, ttl 64, id 21208, offset 0, flags [DF], proto TCP (6), length 4016)
    127.0.0.1.10550 > 127.0.0.1.53564: Flags [P.], cksum 0x0da5 (incorrect -> 0xc3ff), seq 298730:302694, ack 952, win 512, options [nop,nop,TS val 3517298955 ecr 3517298890], length 3964
2022-04-07 19:51:39.446797 IP (tos 0x0, ttl 64, id 30592, offset 0, flags [DF], proto TCP (6), length 52)
    127.0.0.1.53564 > 127.0.0.1.10550: Flags [.], cksum 0xfe28 (incorrect -> 0x1c64), seq 952, ack 302694, win 512, options [nop,nop,TS val 3517298998 ecr 3517298955], length 0
2022-04-07 19:51:39.486748 IP (tos 0x0, ttl 64, id 21209, offset 0, flags [DF], proto TCP (6), length 4100)
    127.0.0.1.10550 > 127.0.0.1.53564: Flags [P.], cksum 0x0df9 (incorrect -> 0x2e1e), seq 302694:306742, ack 952, win 512, options [nop,nop,TS val 3517299038 ecr 3517298998], length 4048
2022-04-07 19:51:39.526778 IP (tos 0x0, ttl 64, id 30593, offset 0, flags [DF], proto TCP (6), length 52)
    127.0.0.1.53564 > 127.0.0.1.10550: Flags [.], cksum 0xfe28 (incorrect -> 0x0bf1), seq 952, ack 306742, win 512, options [nop,nop,TS val 3517299078 ecr 3517299038], length 0
2022-04-07 19:51:39.526786 IP (tos 0x0, ttl 64, id 21210, offset 0, flags [DF], proto TCP (6), length 5486)
    127.0.0.1.10550 > 127.0.0.1.53564: Flags [P.], cksum 0x1363 (incorrect -> 0x28fb), seq 306742:312176, ack 952, win 512, options [nop,nop,TS val 3517299078 ecr 3517299078], length 5434
2022-04-07 19:51:39.570772 IP (tos 0x0, ttl 64, id 30594, offset 0, flags [DF], proto TCP (6), length 52)
    127.0.0.1.53564 > 127.0.0.1.10550: Flags [.], cksum 0xfe28 (incorrect -> 0xf662), seq 952, ack 312176, win 512, options [nop,nop,TS val 3517299122 ecr 3517299078], length 0
2022-04-07 19:51:39.603343 IP (tos 0x0, ttl 64, id 21211, offset 0, flags [DF], proto TCP (6), length 3538)
    127.0.0.1.10550 > 127.0.0.1.53564: Flags [P.], cksum 0x0bc7 (incorrect -> 0xd7c9), seq 312176:315662, ack 952, win 512, options [nop,nop,TS val 3517299155 ecr 3517299122], length 3486
2022-04-07 19:51:39.603616 IP (tos 0x0, ttl 64, id 30595, offset 0, flags [DF], proto TCP (6), length 52)
    127.0.0.1.53564 > 127.0.0.1.10550: Flags [.], cksum 0xfe28 (incorrect -> 0xe856), seq 952, ack 315662, win 512, options [nop,nop,TS val 3517299155 ecr 3517299155], length 0
2022-04-07 19:51:39.636160 IP (tos 0x0, ttl 64, id 21212, offset 0, flags [DF], proto TCP (6), length 3040)
    127.0.0.1.10550 > 127.0.0.1.53564: Flags [P.], cksum 0x09d5 (incorrect -> 0xf88b), seq 315662:318650, ack 952, win 512, options [nop,nop,TS val 3517299187 ecr 3517299155], length 2988
2022-04-07 19:51:39.636174 IP (tos 0x0, ttl 64, id 30596, offset 0, flags [DF], proto TCP (6), length 52)
    127.0.0.1.53564 > 127.0.0.1.10550: Flags [.], cksum 0xfe28 (incorrect -> 0xdc6a), seq 952, ack 318650, win 512, options [nop,nop,TS val 3517299187 ecr 3517299187], length 0
2022-04-07 19:51:39.696934 IP (tos 0x0, ttl 64, id 21213, offset 0, flags [DF], proto TCP (6), length 1048)
    127.0.0.1.10550 > 127.0.0.1.53564: Flags [P.], cksum 0x020d (incorrect -> 0xe267), seq 318650:319646, ack 952, win 512, options [nop,nop,TS val 3517299248 ecr 3517299187], length 996
2022-04-07 19:51:39.696950 IP (tos 0x0, ttl 64, id 30597, offset 0, flags [DF], proto TCP (6), length 52)
    127.0.0.1.53564 > 127.0.0.1.10550: Flags [.], cksum 0xfe28 (incorrect -> 0xd80c), seq 952, ack 319646, win 512, options [nop,nop,TS val 3517299248 ecr 3517299248], length 0
2022-04-07 19:51:39.735790 IP (tos 0x0, ttl 64, id 21214, offset 0, flags [DF], proto TCP (6), length 4100)
    127.0.0.1.10550 > 127.0.0.1.53564: Flags [P.], cksum 0x0df9 (incorrect -> 0x1e18), seq 319646:323694, ack 952, win 512, options [nop,nop,TS val 3517299287 ecr 3517299248], length 4048
2022-04-07 19:51:39.735830 IP (tos 0x0, ttl 64, id 30598, offset 0, flags [DF], proto TCP (6), length 52)
    127.0.0.1.53564 > 127.0.0.1.10550: Flags [.], cksum 0xfe28 (incorrect -> 0xc7ee), seq 952, ack 323694, win 512, options [nop,nop,TS val 3517299287 ecr 3517299287], length 0
2022-04-07 19:51:39.735835 IP (tos 0x0, ttl 64, id 21215, offset 0, flags [DF], proto TCP (6), length 486)
    127.0.0.1.10550 > 127.0.0.1.53564: Flags [P.], cksum 0xffda (incorrect -> 0x847b), seq 323694:324128, ack 952, win 512, options [nop,nop,TS val 3517299287 ecr 3517299287], length 434
2022-04-07 19:51:39.735842 IP (tos 0x0, ttl 64, id 30599, offset 0, flags [DF], proto TCP (6), length 52)
    127.0.0.1.53564 > 127.0.0.1.10550: Flags [.], cksum 0xfe28 (incorrect -> 0xc63c), seq 952, ack 324128, win 512, options [nop,nop,TS val 3517299287 ecr 3517299287], length 0
2022-04-07 19:51:39.739882 IP (tos 0x0, ttl 64, id 21216, offset 0, flags [DF], proto TCP (6), length 2542)
    127.0.0.1.10550 > 127.0.0.1.53564: Flags [P.], cksum 0x07e3 (incorrect -> 0xe97b), seq 324128:326618, ack 952, win 512, options [nop,nop,TS val 3517299291 ecr 3517299287], length 2490
2022-04-07 19:51:39.740075 IP (tos 0x0, ttl 64, id 30600, offset 0, flags [DF], proto TCP (6), length 52)
    127.0.0.1.53564 > 127.0.0.1.10550: Flags [.], cksum 0xfe28 (incorrect -> 0xbc7a), seq 952, ack 326618, win 512, options [nop,nop,TS val 3517299291 ecr 3517299291], length 0
2022-04-07 19:51:39.770246 IP (tos 0x0, ttl 64, id 21217, offset 0, flags [DF], proto TCP (6), length 3040)
    127.0.0.1.10550 > 127.0.0.1.53564: Flags [P.], cksum 0x09d5 (incorrect -> 0x8877), seq 326618:329606, ack 952, win 512, options [nop,nop,TS val 3517299322 ecr 3517299291], length 2988
2022-04-07 19:51:39.770321 IP (tos 0x0, ttl 64, id 30601, offset 0, flags [DF], proto TCP (6), length 52)
    127.0.0.1.53564 > 127.0.0.1.10550: Flags [.], cksum 0xfe28 (incorrect -> 0xb090), seq 952, ack 329606, win 512, options [nop,nop,TS val 3517299322 ecr 3517299322], length 0
2022-04-07 19:51:39.803472 IP (tos 0x0, ttl 64, id 21218, offset 0, flags [DF], proto TCP (6), length 4036)
    127.0.0.1.10550 > 127.0.0.1.53564: Flags [P.], cksum 0x0db9 (incorrect -> 0x0a2c), seq 329606:333590, ack 952, win 512, options [nop,nop,TS val 3517299355 ecr 3517299322], length 3984
2022-04-07 19:51:39.803486 IP (tos 0x0, ttl 64, id 30602, offset 0, flags [DF], proto TCP (6), length 52)
    127.0.0.1.53564 > 127.0.0.1.10550: Flags [.], cksum 0xfe28 (incorrect -> 0xa0be), seq 952, ack 333590, win 512, options [nop,nop,TS val 3517299355 ecr 3517299355], length 0
2022-04-07 19:51:39.839760 IP (tos 0x0, ttl 64, id 21219, offset 0, flags [DF], proto TCP (6), length 3538)
    127.0.0.1.10550 > 127.0.0.1.53564: Flags [P.], cksum 0x0bc7 (incorrect -> 0xfacc), seq 333590:337076, ack 952, win 512, options [nop,nop,TS val 3517299391 ecr 3517299355], length 3486
2022-04-07 19:51:39.839773 IP (tos 0x0, ttl 64, id 30603, offset 0, flags [DF], proto TCP (6), length 52)
    127.0.0.1.53564 > 127.0.0.1.10550: Flags [.], cksum 0xfe28 (incorrect -> 0x92d8), seq 952, ack 337076, win 512, options [nop,nop,TS val 3517299391 ecr 3517299391], length 0
2022-04-07 19:51:39.873769 IP (tos 0x0, ttl 64, id 21220, offset 0, flags [DF], proto TCP (6), length 550)
    127.0.0.1.10550 > 127.0.0.1.53564: Flags [P.], cksum 0x001b (incorrect -> 0x44ff), seq 337076:337574, ack 952, win 512, options [nop,nop,TS val 3517299425 ecr 3517299391], length 498
2022-04-07 19:51:39.873782 IP (tos 0x0, ttl 64, id 30604, offset 0, flags [DF], proto TCP (6), length 52)
    127.0.0.1.53564 > 127.0.0.1.10550: Flags [.], cksum 0xfe28 (incorrect -> 0x90a2), seq 952, ack 337574, win 512, options [nop,nop,TS val 3517299425 ecr 3517299425], length 0
2022-04-07 19:51:39.893606 IP (tos 0x0, ttl 64, id 21221, offset 0, flags [DF], proto TCP (6), length 4100)
    127.0.0.1.10550 > 127.0.0.1.53564: Flags [P.], cksum 0x0df9 (incorrect -> 0xc6e7), seq 337574:341622, ack 952, win 512, options [nop,nop,TS val 3517299445 ecr 3517299425], length 4048
2022-04-07 19:51:39.893624 IP (tos 0x0, ttl 64, id 30605, offset 0, flags [DF], proto TCP (6), length 52)
    127.0.0.1.53564 > 127.0.0.1.10550: Flags [.], cksum 0xfe28 (incorrect -> 0x80aa), seq 952, ack 341622, win 512, options [nop,nop,TS val 3517299445 ecr 3517299445], length 0
2022-04-07 19:51:39.893628 IP (tos 0x0, ttl 64, id 21222, offset 0, flags [DF], proto TCP (6), length 3474)
    127.0.0.1.10550 > 127.0.0.1.53564: Flags [P.], cksum 0x0b87 (incorrect -> 0xbfe9), seq 341622:345044, ack 952, win 512, options [nop,nop,TS val 3517299445 ecr 3517299445], length 3422
2022-04-07 19:51:39.893631 IP (tos 0x0, ttl 64, id 30606, offset 0, flags [DF], proto TCP (6), length 52)
    127.0.0.1.53564 > 127.0.0.1.10550: Flags [.], cksum 0xfe28 (incorrect -> 0x734c), seq 952, ack 345044, win 512, options [nop,nop,TS val 3517299445 ecr 3517299445], length 0
2022-04-07 19:51:39.927094 IP (tos 0x0, ttl 64, id 21223, offset 0, flags [DF], proto TCP (6), length 2044)
    127.0.0.1.10550 > 127.0.0.1.53564: Flags [P.], cksum 0x05f1 (incorrect -> 0xaa49), seq 345044:347036, ack 952, win 512, options [nop,nop,TS val 3517299478 ecr 3517299445], length 1992
2022-04-07 19:51:39.927262 IP (tos 0x0, ttl 64, id 30607, offset 0, flags [DF], proto TCP (6), length 52)
    127.0.0.1.53564 > 127.0.0.1.10550: Flags [.], cksum 0xfe28 (incorrect -> 0x6b41), seq 952, ack 347036, win 512, options [nop,nop,TS val 3517299479 ecr 3517299478], length 0
2022-04-07 19:51:39.933478 IP (tos 0x0, ttl 64, id 21224, offset 0, flags [DF], proto TCP (6), length 4100)
    127.0.0.1.10550 > 127.0.0.1.53564: Flags [P.], cksum 0x0df9 (incorrect -> 0xf653), seq 347036:351084, ack 952, win 512, options [nop,nop,TS val 3517299485 ecr 3517299479], length 4048
2022-04-07 19:51:39.933493 IP (tos 0x0, ttl 64, id 30608, offset 0, flags [DF], proto TCP (6), length 52)
    127.0.0.1.53564 > 127.0.0.1.10550: Flags [.], cksum 0xfe28 (incorrect -> 0x5b64), seq 952, ack 351084, win 512, options [nop,nop,TS val 3517299485 ecr 3517299485], length 0
2022-04-07 19:51:39.933496 IP (tos 0x0, ttl 64, id 21225, offset 0, flags [DF], proto TCP (6), length 2976)
    127.0.0.1.10550 > 127.0.0.1.53564: Flags [P.], cksum 0x0995 (incorrect -> 0x1d84), seq 351084:354008, ack 952, win 512, options [nop,nop,TS val 3517299485 ecr 3517299485], length 2924
2022-04-07 19:51:39.933500 IP (tos 0x0, ttl 64, id 30609, offset 0, flags [DF], proto TCP (6), length 52)
    127.0.0.1.53564 > 127.0.0.1.10550: Flags [.], cksum 0xfe28 (incorrect -> 0x4ff8), seq 952, ack 354008, win 512, options [nop,nop,TS val 3517299485 ecr 3517299485], length 0
2022-04-07 19:51:39.984645 IP (tos 0x0, ttl 64, id 21226, offset 0, flags [DF], proto TCP (6), length 2044)
    127.0.0.1.10550 > 127.0.0.1.53564: Flags [P.], cksum 0x05f1 (incorrect -> 0x2d77), seq 354008:356000, ack 952, win 512, options [nop,nop,TS val 3517299536 ecr 3517299485], length 1992
2022-04-07 19:51:39.984662 IP (tos 0x0, ttl 64, id 30610, offset 0, flags [DF], proto TCP (6), length 52)
    127.0.0.1.53564 > 127.0.0.1.10550: Flags [.], cksum 0xfe28 (incorrect -> 0x47ca), seq 952, ack 356000, win 512, options [nop,nop,TS val 3517299536 ecr 3517299536], length 0
2022-04-07 19:51:39.986211 IP (tos 0x0, ttl 64, id 21227, offset 0, flags [DF], proto TCP (6), length 3538)
    127.0.0.1.10550 > 127.0.0.1.53564: Flags [P.], cksum 0x0bc7 (incorrect -> 0xdc71), seq 356000:359486, ack 952, win 512, options [nop,nop,TS val 3517299537 ecr 3517299536], length 3486
2022-04-07 19:51:39.986222 IP (tos 0x0, ttl 64, id 30611, offset 0, flags [DF], proto TCP (6), length 52)
    127.0.0.1.53564 > 127.0.0.1.10550: Flags [.], cksum 0xfe28 (incorrect -> 0x3a29), seq 952, ack 359486, win 512, options [nop,nop,TS val 3517299538 ecr 3517299537], length 0
2022-04-07 19:51:40.018855 IP (tos 0x0, ttl 64, id 21228, offset 0, flags [DF], proto TCP (6), length 1048)
    127.0.0.1.10550 > 127.0.0.1.53564: Flags [P.], cksum 0x020d (incorrect -> 0x9597), seq 359486:360482, ack 952, win 512, options [nop,nop,TS val 3517299570 ecr 3517299538], length 996
2022-04-07 19:51:40.018876 IP (tos 0x0, ttl 64, id 30612, offset 0, flags [DF], proto TCP (6), length 52)
    127.0.0.1.53564 > 127.0.0.1.10550: Flags [.], cksum 0xfe28 (incorrect -> 0x3604), seq 952, ack 360482, win 512, options [nop,nop,TS val 3517299570 ecr 3517299570], length 0
2022-04-07 19:51:40.037147 IP (tos 0x0, ttl 64, id 21229, offset 0, flags [DF], proto TCP (6), length 3538)
    127.0.0.1.10550 > 127.0.0.1.53564: Flags [P.], cksum 0x0bc7 (incorrect -> 0xba4c), seq 360482:363968, ack 952, win 512, options [nop,nop,TS val 3517299588 ecr 3517299570], length 3486
2022-04-07 19:51:40.037430 IP (tos 0x0, ttl 64, id 30613, offset 0, flags [DF], proto TCP (6), length 52)
    127.0.0.1.53564 > 127.0.0.1.10550: Flags [.], cksum 0xfe28 (incorrect -> 0x2841), seq 952, ack 363968, win 512, options [nop,nop,TS val 3517299589 ecr 3517299588], length 0
2022-04-07 19:51:40.052087 IP (tos 0x0, ttl 64, id 21230, offset 0, flags [DF], proto TCP (6), length 3040)
    127.0.0.1.10550 > 127.0.0.1.53564: Flags [P.], cksum 0x09d5 (incorrect -> 0xac48), seq 363968:366956, ack 952, win 512, options [nop,nop,TS val 3517299603 ecr 3517299589], length 2988
2022-04-07 19:51:40.052103 IP (tos 0x0, ttl 64, id 30614, offset 0, flags [DF], proto TCP (6), length 52)
    127.0.0.1.53564 > 127.0.0.1.10550: Flags [.], cksum 0xfe28 (incorrect -> 0x1c78), seq 952, ack 366956, win 512, options [nop,nop,TS val 3517299603 ecr 3517299603], length 0
2022-04-07 19:51:40.085913 IP (tos 0x0, ttl 64, id 21231, offset 0, flags [DF], proto TCP (6), length 3040)
    127.0.0.1.10550 > 127.0.0.1.53564: Flags [P.], cksum 0x09d5 (incorrect -> 0x9122), seq 366956:369944, ack 952, win 512, options [nop,nop,TS val 3517299637 ecr 3517299603], length 2988
2022-04-07 19:51:40.126798 IP (tos 0x0, ttl 64, id 30615, offset 0, flags [DF], proto TCP (6), length 52)
    127.0.0.1.53564 > 127.0.0.1.10550: Flags [.], cksum 0xfe28 (incorrect -> 0x105f), seq 952, ack 369944, win 512, options [nop,nop,TS val 3517299678 ecr 3517299637], length 0
2022-04-07 19:51:40.126804 IP (tos 0x0, ttl 64, id 21232, offset 0, flags [DF], proto TCP (6), length 4016)
    127.0.0.1.10550 > 127.0.0.1.53564: Flags [P.], cksum 0x0da5 (incorrect -> 0xedc3), seq 369944:373908, ack 952, win 512, options [nop,nop,TS val 3517299678 ecr 3517299678], length 3964
2022-04-07 19:51:40.174828 IP (tos 0x0, ttl 64, id 30616, offset 0, flags [DF], proto TCP (6), length 52)
    127.0.0.1.53564 > 127.0.0.1.10550: Flags [.], cksum 0xfe28 (incorrect -> 0x008a), seq 952, ack 373908, win 512, options [nop,nop,TS val 3517299726 ecr 3517299678], length 0
2022-04-07 19:51:40.174834 IP (tos 0x0, ttl 64, id 21233, offset 0, flags [DF], proto TCP (6), length 5032)
    127.0.0.1.10550 > 127.0.0.1.53564: Flags [P.], cksum 0x119d (incorrect -> 0xd143), seq 373908:378888, ack 952, win 512, options [nop,nop,TS val 3517299726 ecr 3517299726], length 4980
2022-04-07 19:51:40.218778 IP (tos 0x0, ttl 64, id 30617, offset 0, flags [DF], proto TCP (6), length 52)
    127.0.0.1.53564 > 127.0.0.1.10550: Flags [.], cksum 0xfe28 (incorrect -> 0xecb9), seq 952, ack 378888, win 512, options [nop,nop,TS val 3517299770 ecr 3517299726], length 0
2022-04-07 19:51:40.245950 IP (tos 0x0, ttl 64, id 21234, offset 0, flags [DF], proto TCP (6), length 3538)
    127.0.0.1.10550 > 127.0.0.1.53564: Flags [P.], cksum 0x0bc7 (incorrect -> 0x1f2f), seq 378888:382374, ack 952, win 512, options [nop,nop,TS val 3517299797 ecr 3517299770], length 3486
2022-04-07 19:51:40.245965 IP (tos 0x0, ttl 64, id 30618, offset 0, flags [DF], proto TCP (6), length 52)
    127.0.0.1.53564 > 127.0.0.1.10550: Flags [.], cksum 0xfe28 (incorrect -> 0xdeb9), seq 952, ack 382374, win 512, options [nop,nop,TS val 3517299797 ecr 3517299797], length 0
2022-04-07 19:51:40.279173 IP (tos 0x0, ttl 64, id 21235, offset 0, flags [DF], proto TCP (6), length 2044)
    127.0.0.1.10550 > 127.0.0.1.53564: Flags [P.], cksum 0x05f1 (incorrect -> 0x64e1), seq 382374:384366, ack 952, win 512, options [nop,nop,TS val 3517299830 ecr 3517299797], length 1992
2022-04-07 19:51:40.279189 IP (tos 0x0, ttl 64, id 30619, offset 0, flags [DF], proto TCP (6), length 52)
    127.0.0.1.53564 > 127.0.0.1.10550: Flags [.], cksum 0xfe28 (incorrect -> 0xd6af), seq 952, ack 384366, win 512, options [nop,nop,TS val 3517299830 ecr 3517299830], length 0
2022-04-07 19:51:40.358392 IP (tos 0x0, ttl 64, id 21236, offset 0, flags [DF], proto TCP (6), length 3538)
    127.0.0.1.10550 > 127.0.0.1.53564: Flags [P.], cksum 0x0bc7 (incorrect -> 0xeecd), seq 384366:387852, ack 952, win 512, options [nop,nop,TS val 3517299910 ecr 3517299830], length 3486
2022-04-07 19:51:40.358409 IP (tos 0x0, ttl 64, id 30620, offset 0, flags [DF], proto TCP (6), length 52)
    127.0.0.1.53564 > 127.0.0.1.10550: Flags [.], cksum 0xfe28 (incorrect -> 0xc871), seq 952, ack 387852, win 512, options [nop,nop,TS val 3517299910 ecr 3517299910], length 0
2022-04-07 19:51:40.392044 IP (tos 0x0, ttl 64, id 21237, offset 0, flags [DF], proto TCP (6), length 1566)
    127.0.0.1.10550 > 127.0.0.1.53564: Flags [P.], cksum 0x0413 (incorrect -> 0xe49e), seq 387852:389366, ack 952, win 512, options [nop,nop,TS val 3517299943 ecr 3517299910], length 1514
2022-04-07 19:51:40.392060 IP (tos 0x0, ttl 64, id 30621, offset 0, flags [DF], proto TCP (6), length 52)
    127.0.0.1.53564 > 127.0.0.1.10550: Flags [.], cksum 0xfe28 (incorrect -> 0xc245), seq 952, ack 389366, win 512, options [nop,nop,TS val 3517299943 ecr 3517299943], length 0
2022-04-07 19:51:40.418589 IP (tos 0x0, ttl 64, id 21238, offset 0, flags [DF], proto TCP (6), length 3538)
    127.0.0.1.10550 > 127.0.0.1.53564: Flags [P.], cksum 0x0bc7 (incorrect -> 0x17d6), seq 389366:392852, ack 952, win 512, options [nop,nop,TS val 3517299970 ecr 3517299943], length 3486
2022-04-07 19:51:40.418601 IP (tos 0x0, ttl 64, id 30622, offset 0, flags [DF], proto TCP (6), length 52)
    127.0.0.1.53564 > 127.0.0.1.10550: Flags [.], cksum 0xfe28 (incorrect -> 0xb471), seq 952, ack 392852, win 512, options [nop,nop,TS val 3517299970 ecr 3517299970], length 0
2022-04-07 19:51:40.425048 IP (tos 0x0, ttl 64, id 21239, offset 0, flags [DF], proto TCP (6), length 2044)
    127.0.0.1.10550 > 127.0.0.1.53564: Flags [P.], cksum 0x05f1 (incorrect -> 0xf23a), seq 392852:394844, ack 952, win 512, options [nop,nop,TS val 3517299976 ecr 3517299970], length 1992
2022-04-07 19:51:40.425238 IP (tos 0x0, ttl 64, id 30623, offset 0, flags [DF], proto TCP (6), length 52)
    127.0.0.1.53564 > 127.0.0.1.10550: Flags [.], cksum 0xfe28 (incorrect -> 0xac9c), seq 952, ack 394844, win 512, options [nop,nop,TS val 3517299977 ecr 3517299976], length 0
2022-04-07 19:51:40.545640 IP (tos 0x0, ttl 64, id 21240, offset 0, flags [DF], proto TCP (6), length 3538)
    127.0.0.1.10550 > 127.0.0.1.53564: Flags [P.], cksum 0x0bc7 (incorrect -> 0x7bb1), seq 394844:398330, ack 952, win 512, options [nop,nop,TS val 3517300097 ecr 3517299977], length 3486
2022-04-07 19:51:40.545656 IP (tos 0x0, ttl 64, id 30624, offset 0, flags [DF], proto TCP (6), length 52)
    127.0.0.1.53564 > 127.0.0.1.10550: Flags [.], cksum 0xfe28 (incorrect -> 0x9e0d), seq 952, ack 398330, win 512, options [nop,nop,TS val 3517300097 ecr 3517300097], length 0
2022-04-07 19:51:40.579331 IP (tos 0x0, ttl 64, id 21241, offset 0, flags [DF], proto TCP (6), length 550)
    127.0.0.1.10550 > 127.0.0.1.53564: Flags [P.], cksum 0x001b (incorrect -> 0x0ae3), seq 398330:398828, ack 952, win 512, options [nop,nop,TS val 3517300131 ecr 3517300097], length 498
2022-04-07 19:51:40.579344 IP (tos 0x0, ttl 64, id 30625, offset 0, flags [DF], proto TCP (6), length 52)
    127.0.0.1.53564 > 127.0.0.1.10550: Flags [.], cksum 0xfe28 (incorrect -> 0x9bd7), seq 952, ack 398828, win 512, options [nop,nop,TS val 3517300131 ecr 3517300131], length 0
2022-04-07 19:51:40.653814 IP (tos 0x0, ttl 64, id 21242, offset 0, flags [DF], proto TCP (6), length 3538)
    127.0.0.1.10550 > 127.0.0.1.53564: Flags [P.], cksum 0x0bc7 (incorrect -> 0xa8d0), seq 398828:402314, ack 952, win 512, options [nop,nop,TS val 3517300205 ecr 3517300131], length 3486
2022-04-07 19:51:40.653870 IP (tos 0x0, ttl 64, id 30626, offset 0, flags [DF], proto TCP (6), length 52)
    127.0.0.1.53564 > 127.0.0.1.10550: Flags [.], cksum 0xfe28 (incorrect -> 0x8da5), seq 952, ack 402314, win 512, options [nop,nop,TS val 3517300205 ecr 3517300205], length 0
2022-04-07 19:51:40.687418 IP (tos 0x0, ttl 64, id 21243, offset 0, flags [DF], proto TCP (6), length 550)
    127.0.0.1.10550 > 127.0.0.1.53564: Flags [P.], cksum 0x001b (incorrect -> 0xc302), seq 402314:402812, ack 952, win 512, options [nop,nop,TS val 3517300239 ecr 3517300205], length 498
2022-04-07 19:51:40.687474 IP (tos 0x0, ttl 64, id 30627, offset 0, flags [DF], proto TCP (6), length 52)
    127.0.0.1.53564 > 127.0.0.1.10550: Flags [.], cksum 0xfe28 (incorrect -> 0x8b6f), seq 952, ack 402812, win 512, options [nop,nop,TS val 3517300239 ecr 3517300239], length 0
2022-04-07 19:51:40.877105 IP (tos 0x0, ttl 64, id 21244, offset 0, flags [DF], proto TCP (6), length 3538)
    127.0.0.1.10550 > 127.0.0.1.53564: Flags [P.], cksum 0x0bc7 (incorrect -> 0x8a22), seq 402812:406298, ack 952, win 512, options [nop,nop,TS val 3517300428 ecr 3517300239], length 3486
2022-04-07 19:51:40.877149 IP (tos 0x0, ttl 64, id 30628, offset 0, flags [DF], proto TCP (6), length 52)
    127.0.0.1.53564 > 127.0.0.1.10550: Flags [.], cksum 0xfe28 (incorrect -> 0x7c57), seq 952, ack 406298, win 512, options [nop,nop,TS val 3517300428 ecr 3517300428], length 0
2022-04-07 19:51:40.911568 IP (tos 0x0, ttl 64, id 21245, offset 0, flags [DF], proto TCP (6), length 2044)
    127.0.0.1.10550 > 127.0.0.1.53564: Flags [P.], cksum 0x05f1 (incorrect -> 0xdd3a), seq 406298:408290, ack 952, win 512, options [nop,nop,TS val 3517300463 ecr 3517300428], length 1992
2022-04-07 19:51:40.911586 IP (tos 0x0, ttl 64, id 30629, offset 0, flags [DF], proto TCP (6), length 52)
    127.0.0.1.53564 > 127.0.0.1.10550: Flags [.], cksum 0xfe28 (incorrect -> 0x7449), seq 952, ack 408290, win 512, options [nop,nop,TS val 3517300463 ecr 3517300463], length 0
2022-04-07 19:51:40.945505 IP (tos 0x0, ttl 64, id 21246, offset 0, flags [DF], proto TCP (6), length 2542)
    127.0.0.1.10550 > 127.0.0.1.53564: Flags [P.], cksum 0x07e3 (incorrect -> 0x60c7), seq 408290:410780, ack 952, win 512, options [nop,nop,TS val 3517300497 ecr 3517300463], length 2490
2022-04-07 19:51:40.945524 IP (tos 0x0, ttl 64, id 30630, offset 0, flags [DF], proto TCP (6), length 52)
    127.0.0.1.53564 > 127.0.0.1.10550: Flags [.], cksum 0xfe28 (incorrect -> 0x6a4b), seq 952, ack 410780, win 512, options [nop,nop,TS val 3517300497 ecr 3517300497], length 0
2022-04-07 19:51:41.038232 IP (tos 0x0, ttl 64, id 21247, offset 0, flags [DF], proto TCP (6), length 2542)
    127.0.0.1.10550 > 127.0.0.1.53564: Flags [P.], cksum 0x07e3 (incorrect -> 0xd45c), seq 410780:413270, ack 952, win 512, options [nop,nop,TS val 3517300590 ecr 3517300497], length 2490
2022-04-07 19:51:41.078797 IP (tos 0x0, ttl 64, id 30631, offset 0, flags [DF], proto TCP (6), length 52)
    127.0.0.1.53564 > 127.0.0.1.10550: Flags [.], cksum 0xfe28 (incorrect -> 0x5faf), seq 952, ack 413270, win 512, options [nop,nop,TS val 3517300630 ecr 3517300590], length 0
2022-04-07 19:51:41.129758 IP (tos 0x0, ttl 64, id 21248, offset 0, flags [DF], proto TCP (6), length 3040)
    127.0.0.1.10550 > 127.0.0.1.53564: Flags [P.], cksum 0x09d5 (incorrect -> 0xd44f), seq 413270:416258, ack 952, win 512, options [nop,nop,TS val 3517300681 ecr 3517300630], length 2988
2022-04-07 19:51:41.170785 IP (tos 0x0, ttl 64, id 30632, offset 0, flags [DF], proto TCP (6), length 52)
    127.0.0.1.53564 > 127.0.0.1.10550: Flags [.], cksum 0xfe28 (incorrect -> 0x534c), seq 952, ack 416258, win 512, options [nop,nop,TS val 3517300722 ecr 3517300681], length 0
2022-04-07 19:51:41.204382 IP (tos 0x0, ttl 64, id 21249, offset 0, flags [DF], proto TCP (6), length 2044)
    127.0.0.1.10550 > 127.0.0.1.53564: Flags [P.], cksum 0x05f1 (incorrect -> 0x381c), seq 416258:418250, ack 952, win 512, options [nop,nop,TS val 3517300756 ecr 3517300722], length 1992
2022-04-07 19:51:41.204411 IP (tos 0x0, ttl 64, id 30633, offset 0, flags [DF], proto TCP (6), length 52)
    127.0.0.1.53564 > 127.0.0.1.10550: Flags [.], cksum 0xfe28 (incorrect -> 0x4b17), seq 952, ack 418250, win 512, options [nop,nop,TS val 3517300756 ecr 3517300756], length 0
2022-04-07 19:51:41.411207 IP (tos 0x0, ttl 64, id 21250, offset 0, flags [DF], proto TCP (6), length 3538)
    127.0.0.1.10550 > 127.0.0.1.53564: Flags [P.], cksum 0x0bc7 (incorrect -> 0x175d), seq 418250:421736, ack 952, win 512, options [nop,nop,TS val 3517300962 ecr 3517300756], length 3486
2022-04-07 19:51:41.411213 IP (tos 0x0, ttl 64, id 30634, offset 0, flags [DF], proto TCP (6), length 52)
    127.0.0.1.53564 > 127.0.0.1.10550: Flags [.], cksum 0xfe28 (incorrect -> 0x3bef), seq 952, ack 421736, win 494, options [nop,nop,TS val 3517300962 ecr 3517300962], length 0
2022-04-07 19:51:41.507626 IP (tos 0x0, ttl 64, id 21251, offset 0, flags [DF], proto TCP (6), length 3040)
    127.0.0.1.10550 > 127.0.0.1.53564: Flags [P.], cksum 0x09d5 (incorrect -> 0xd74b), seq 421736:424724, ack 952, win 512, options [nop,nop,TS val 3517301059 ecr 3517300962], length 2988
2022-04-07 19:51:41.507632 IP (tos 0x0, ttl 64, id 30635, offset 0, flags [DF], proto TCP (6), length 52)
    127.0.0.1.53564 > 127.0.0.1.10550: Flags [.], cksum 0xfe28 (incorrect -> 0x2f7f), seq 952, ack 424724, win 496, options [nop,nop,TS val 3517301059 ecr 3517301059], length 0
2022-04-07 19:51:41.713768 IP (tos 0x0, ttl 64, id 21252, offset 0, flags [DF], proto TCP (6), length 550)
    127.0.0.1.10550 > 127.0.0.1.53564: Flags [P.], cksum 0x001b (incorrect -> 0x9f8a), seq 424724:425222, ack 952, win 512, options [nop,nop,TS val 3517301265 ecr 3517301059], length 498
2022-04-07 19:51:41.713782 IP (tos 0x0, ttl 64, id 30636, offset 0, flags [DF], proto TCP (6), length 52)
    127.0.0.1.53564 > 127.0.0.1.10550: Flags [.], cksum 0xfe28 (incorrect -> 0x2be7), seq 952, ack 425222, win 506, options [nop,nop,TS val 3517301265 ecr 3517301265], length 0
2022-04-07 19:51:41.787886 IP (tos 0x0, ttl 64, id 21253, offset 0, flags [DF], proto TCP (6), length 1546)
    127.0.0.1.10550 > 127.0.0.1.53564: Flags [P.], cksum 0x03ff (incorrect -> 0x130c), seq 425222:426716, ack 952, win 512, options [nop,nop,TS val 3517301339 ecr 3517301265], length 1494
2022-04-07 19:51:41.787894 IP (tos 0x0, ttl 64, id 30637, offset 0, flags [DF], proto TCP (6), length 52)
    127.0.0.1.53564 > 127.0.0.1.10550: Flags [.], cksum 0xfe28 (incorrect -> 0x2581), seq 952, ack 426716, win 502, options [nop,nop,TS val 3517301339 ecr 3517301339], length 0
2022-04-07 19:51:41.873531 IP (tos 0x0, ttl 64, id 21254, offset 0, flags [DF], proto TCP (6), length 3538)
    127.0.0.1.10550 > 127.0.0.1.53564: Flags [P.], cksum 0x0bc7 (incorrect -> 0x053b), seq 426716:430202, ack 952, win 512, options [nop,nop,TS val 3517301425 ecr 3517301339], length 3486
2022-04-07 19:51:41.873538 IP (tos 0x0, ttl 64, id 30638, offset 0, flags [DF], proto TCP (6), length 52)
    127.0.0.1.53564 > 127.0.0.1.10550: Flags [.], cksum 0xfe28 (incorrect -> 0x173f), seq 952, ack 430202, win 494, options [nop,nop,TS val 3517301425 ecr 3517301425], length 0
2022-04-07 19:51:41.905138 IP (tos 0x0, ttl 64, id 21255, offset 0, flags [DF], proto TCP (6), length 550)
    127.0.0.1.10550 > 127.0.0.1.53564: Flags [P.], cksum 0x001b (incorrect -> 0xb288), seq 430202:430700, ack 952, win 512, options [nop,nop,TS val 3517301456 ecr 3517301425], length 498
2022-04-07 19:51:41.905143 IP (tos 0x0, ttl 64, id 30639, offset 0, flags [DF], proto TCP (6), length 52)
    127.0.0.1.53564 > 127.0.0.1.10550: Flags [.], cksum 0xfe28 (incorrect -> 0x1503), seq 952, ack 430700, win 506, options [nop,nop,TS val 3517301456 ecr 3517301456], length 0
2022-04-07 19:51:41.937555 IP (tos 0x0, ttl 64, id 21256, offset 0, flags [DF], proto TCP (6), length 2542)
    127.0.0.1.10550 > 127.0.0.1.53564: Flags [P.], cksum 0x07e3 (incorrect -> 0x0e37), seq 430700:433190, ack 952, win 512, options [nop,nop,TS val 3517301489 ecr 3517301456], length 2490
2022-04-07 19:51:41.937560 IP (tos 0x0, ttl 64, id 30640, offset 0, flags [DF], proto TCP (6), length 52)
    127.0.0.1.53564 > 127.0.0.1.10550: Flags [.], cksum 0xfe28 (incorrect -> 0x0b0f), seq 952, ack 433190, win 498, options [nop,nop,TS val 3517301489 ecr 3517301489], length 0
2022-04-07 19:51:41.999515 IP (tos 0x0, ttl 64, id 21257, offset 0, flags [DF], proto TCP (6), length 3538)
    127.0.0.1.10550 > 127.0.0.1.53564: Flags [P.], cksum 0x0bc7 (incorrect -> 0xe74f), seq 433190:436676, ack 952, win 512, options [nop,nop,TS val 3517301551 ecr 3517301489], length 3486
2022-04-07 19:51:41.999531 IP (tos 0x0, ttl 64, id 30641, offset 0, flags [DF], proto TCP (6), length 52)
    127.0.0.1.53564 > 127.0.0.1.10550: Flags [.], cksum 0xfe28 (incorrect -> 0xfcf8), seq 952, ack 436676, win 494, options [nop,nop,TS val 3517301551 ecr 3517301551], length 0
2022-04-07 19:51:42.031455 IP (tos 0x0, ttl 64, id 21258, offset 0, flags [DF], proto TCP (6), length 550)
    127.0.0.1.10550 > 127.0.0.1.53564: Flags [P.], cksum 0x001b (incorrect -> 0x18ce), seq 436676:437174, ack 952, win 512, options [nop,nop,TS val 3517301583 ecr 3517301551], length 498
2022-04-07 19:51:42.031472 IP (tos 0x0, ttl 64, id 30642, offset 0, flags [DF], proto TCP (6), length 52)
    127.0.0.1.53564 > 127.0.0.1.10550: Flags [.], cksum 0xfe28 (incorrect -> 0xfaba), seq 952, ack 437174, win 506, options [nop,nop,TS val 3517301583 ecr 3517301583], length 0
2022-04-07 19:51:42.063548 IP (tos 0x0, ttl 64, id 21259, offset 0, flags [DF], proto TCP (6), length 4036)
    127.0.0.1.10550 > 127.0.0.1.53564: Flags [P.], cksum 0x0db9 (incorrect -> 0x57e6), seq 437174:441158, ack 952, win 512, options [nop,nop,TS val 3517301615 ecr 3517301583], length 3984
2022-04-07 19:51:42.106789 IP (tos 0x0, ttl 64, id 30643, offset 0, flags [DF], proto TCP (6), length 52)
    127.0.0.1.53564 > 127.0.0.1.10550: Flags [.], cksum 0xfe28 (incorrect -> 0xeab9), seq 952, ack 441158, win 512, options [nop,nop,TS val 3517301658 ecr 3517301615], length 0
2022-04-07 19:51:42.106795 IP (tos 0x0, ttl 64, id 21260, offset 0, flags [DF], proto TCP (6), length 3538)
    127.0.0.1.10550 > 127.0.0.1.53564: Flags [P.], cksum 0x0bc7 (incorrect -> 0x28ca), seq 441158:444644, ack 952, win 512, options [nop,nop,TS val 3517301658 ecr 3517301658], length 3486
2022-04-07 19:51:42.106990 IP (tos 0x0, ttl 64, id 30644, offset 0, flags [DF], proto TCP (6), length 52)
    127.0.0.1.53564 > 127.0.0.1.10550: Flags [.], cksum 0xfe28 (incorrect -> 0xdcf0), seq 952, ack 444644, win 512, options [nop,nop,TS val 3517301658 ecr 3517301658], length 0
2022-04-07 19:51:42.127942 IP (tos 0x0, ttl 64, id 21261, offset 0, flags [DF], proto TCP (6), length 550)
    127.0.0.1.10550 > 127.0.0.1.53564: Flags [P.], cksum 0x001b (incorrect -> 0xc3ae), seq 444644:445142, ack 952, win 512, options [nop,nop,TS val 3517301679 ecr 3517301658], length 498
2022-04-07 19:51:42.127976 IP (tos 0x0, ttl 64, id 30645, offset 0, flags [DF], proto TCP (6), length 52)
    127.0.0.1.53564 > 127.0.0.1.10550: Flags [.], cksum 0xfe28 (incorrect -> 0xdad4), seq 952, ack 445142, win 512, options [nop,nop,TS val 3517301679 ecr 3517301679], length 0
2022-04-07 19:51:42.159604 IP (tos 0x0, ttl 64, id 21262, offset 0, flags [DF], proto TCP (6), length 4036)
    127.0.0.1.10550 > 127.0.0.1.53564: Flags [P.], cksum 0x0db9 (incorrect -> 0xd760), seq 445142:449126, ack 952, win 512, options [nop,nop,TS val 3517301711 ecr 3517301679], length 3984
200, 5.886815786361694, 7.746684312820435