2022-04-07 14:15:52.951946 IP (tos 0x0, ttl 64, id 57752, offset 0, flags [DF], proto TCP (6), length 60)
    127.0.0.1.48450 > 127.0.0.1.10350: Flags [S], cksum 0xfe30 (incorrect -> 0xb0d1), seq 4137394809, win 65495, options [mss 65495,sackOK,TS val 3497152503 ecr 0,nop,wscale 7], length 0
2022-04-07 14:15:52.951959 IP (tos 0x0, ttl 64, id 0, offset 0, flags [DF], proto TCP (6), length 60)
    127.0.0.1.10350 > 127.0.0.1.48450: Flags [S.], cksum 0xfe30 (incorrect -> 0x99a6), seq 671207098, ack 4137394810, win 65483, options [mss 65495,sackOK,TS val 3497152503 ecr 3497152503,nop,wscale 7], length 0
2022-04-07 14:15:52.951968 IP (tos 0x0, ttl 64, id 57753, offset 0, flags [DF], proto TCP (6), length 52)
    127.0.0.1.48450 > 127.0.0.1.10350: Flags [.], cksum 0xfe28 (incorrect -> 0xc062), seq 1, ack 1, win 512, options [nop,nop,TS val 3497152503 ecr 3497152503], length 0
2022-04-07 14:15:52.952103 IP (tos 0x0, ttl 64, id 57754, offset 0, flags [DF], proto TCP (6), length 55)
    127.0.0.1.48450 > 127.0.0.1.10350: Flags [P.], cksum 0xfe2b (incorrect -> 0xbb56), seq 1:4, ack 1, win 512, options [nop,nop,TS val 3497152503 ecr 3497152503], length 3
2022-04-07 14:15:52.952115 IP (tos 0x0, ttl 64, id 2615, offset 0, flags [DF], proto TCP (6), length 52)
    127.0.0.1.10350 > 127.0.0.1.48450: Flags [.], cksum 0xfe28 (incorrect -> 0xc05f), seq 1, ack 4, win 512, options [nop,nop,TS val 3497152503 ecr 3497152503], length 0
2022-04-07 14:15:52.952779 IP (tos 0x0, ttl 64, id 2616, offset 0, flags [DF], proto TCP (6), length 54)
    127.0.0.1.10350 > 127.0.0.1.48450: Flags [P.], cksum 0xfe2a (incorrect -> 0xbb54), seq 1:3, ack 4, win 512, options [nop,nop,TS val 3497152504 ecr 3497152503], length 2
2022-04-07 14:15:52.952792 IP (tos 0x0, ttl 64, id 57755, offset 0, flags [DF], proto TCP (6), length 52)
    127.0.0.1.48450 > 127.0.0.1.10350: Flags [.], cksum 0xfe28 (incorrect -> 0xc05b), seq 4, ack 3, win 512, options [nop,nop,TS val 3497152504 ecr 3497152504], length 0
2022-04-07 14:15:52.986404 IP (tos 0x0, ttl 64, id 57756, offset 0, flags [DF], proto TCP (6), length 62)
    127.0.0.1.48450 > 127.0.0.1.10350: Flags [P.], cksum 0xfe32 (incorrect -> 0xa142), seq 4:14, ack 3, win 512, options [nop,nop,TS val 3497152538 ecr 3497152504], length 10
2022-04-07 14:15:52.986422 IP (tos 0x0, ttl 64, id 2617, offset 0, flags [DF], proto TCP (6), length 52)
    127.0.0.1.10350 > 127.0.0.1.48450: Flags [.], cksum 0xfe28 (incorrect -> 0xc00d), seq 3, ack 14, win 512, options [nop,nop,TS val 3497152538 ecr 3497152538], length 0
200, 7.902500629425049, 0.5790550708770752