2022-04-07 08:23:19.870205 IP (tos 0x0, ttl 64, id 64438, offset 0, flags [DF], proto TCP (6), length 60)
    127.0.0.1.58284 > 127.0.0.1.12150: Flags [S], cksum 0xfe30 (incorrect -> 0x7bd8), seq 3459420311, win 65495, options [mss 65495,sackOK,TS val 402082373 ecr 0,nop,wscale 7], length 0
2022-04-07 08:23:19.870216 IP (tos 0x0, ttl 64, id 0, offset 0, flags [DF], proto TCP (6), length 60)
    127.0.0.1.12150 > 127.0.0.1.58284: Flags [S.], cksum 0xfe30 (incorrect -> 0x2799), seq 1151577434, ack 3459420312, win 65483, options [mss 65495,sackOK,TS val 402082373 ecr 402082373,nop,wscale 7], length 0
2022-04-07 08:23:19.870224 IP (tos 0x0, ttl 64, id 64439, offset 0, flags [DF], proto TCP (6), length 52)
    127.0.0.1.58284 > 127.0.0.1.12150: Flags [.], cksum 0xfe28 (incorrect -> 0x4e55), seq 1, ack 1, win 512, options [nop,nop,TS val 402082373 ecr 402082373], length 0
2022-04-07 08:23:19.870328 IP (tos 0x0, ttl 64, id 64440, offset 0, flags [DF], proto TCP (6), length 55)
    127.0.0.1.58284 > 127.0.0.1.12150: Flags [P.], cksum 0xfe2b (incorrect -> 0x4949), seq 1:4, ack 1, win 512, options [nop,nop,TS val 402082373 ecr 402082373], length 3
2022-04-07 08:23:19.870331 IP (tos 0x0, ttl 64, id 26184, offset 0, flags [DF], proto TCP (6), length 52)
    127.0.0.1.12150 > 127.0.0.1.58284: Flags [.], cksum 0xfe28 (incorrect -> 0x4e52), seq 1, ack 4, win 512, options [nop,nop,TS val 402082373 ecr 402082373], length 0
2022-04-07 08:23:19.870414 IP (tos 0x0, ttl 64, id 26185, offset 0, flags [DF], proto TCP (6), length 54)
    127.0.0.1.12150 > 127.0.0.1.58284: Flags [P.], cksum 0xfe2a (incorrect -> 0x4948), seq 1:3, ack 4, win 512, options [nop,nop,TS val 402082373 ecr 402082373], length 2
2022-04-07 08:23:19.870418 IP (tos 0x0, ttl 64, id 64441, offset 0, flags [DF], proto TCP (6), length 52)
    127.0.0.1.58284 > 127.0.0.1.12150: Flags [.], cksum 0xfe28 (incorrect -> 0x4e50), seq 4, ack 3, win 512, options [nop,nop,TS val 402082373 ecr 402082373], length 0
2022-04-07 08:23:19.871950 IP (tos 0x0, ttl 64, id 64442, offset 0, flags [DF], proto TCP (6), length 62)
    127.0.0.1.58284 > 127.0.0.1.12150: Flags [P.], cksum 0xfe32 (incorrect -> 0x219a), seq 4:14, ack 3, win 512, options [nop,nop,TS val 402082374 ecr 402082373], length 10
2022-04-07 08:23:19.871965 IP (tos 0x0, ttl 64, id 26186, offset 0, flags [DF], proto TCP (6), length 52)
    127.0.0.1.12150 > 127.0.0.1.58284: Flags [.], cksum 0xfe28 (incorrect -> 0x4e44), seq 3, ack 14, win 512, options [nop,nop,TS val 402082374 ecr 402082374], length 0
2022-04-07 08:23:19.936255 IP (tos 0x0, ttl 64, id 26187, offset 0, flags [DF], proto TCP (6), length 62)
    127.0.0.1.12150 > 127.0.0.1.58284: Flags [P.], cksum 0xfe32 (incorrect -> 0x48f0), seq 3:13, ack 14, win 512, options [nop,nop,TS val 402082439 ecr 402082374], length 10
2022-04-07 08:23:19.936262 IP (tos 0x0, ttl 64, id 64443, offset 0, flags [DF], proto TCP (6), length 52)
    127.0.0.1.58284 > 127.0.0.1.12150: Flags [.], cksum 0xfe28 (incorrect -> 0x4db8), seq 14, ack 13, win 512, options [nop,nop,TS val 402082439 ecr 402082439], length 0
2022-04-07 08:23:19.942244 IP (tos 0x0, ttl 64, id 64444, offset 0, flags [DF], proto TCP (6), length 569)
    127.0.0.1.58284 > 127.0.0.1.12150: Flags [P.], cksum 0x002e (incorrect -> 0xc4d8), seq 14:531, ack 13, win 512, options [nop,nop,TS val 402082445 ecr 402082439], length 517
2022-04-07 08:23:19.942262 IP (tos 0x0, ttl 64, id 26188, offset 0, flags [DF], proto TCP (6), length 52)
    127.0.0.1.12150 > 127.0.0.1.58284: Flags [.], cksum 0xfe28 (incorrect -> 0x4bab), seq 13, ack 531, win 508, options [nop,nop,TS val 402082445 ecr 402082445], length 0
2022-04-07 08:23:20.021373 IP (tos 0x0, ttl 64, id 26189, offset 0, flags [DF], proto TCP (6), length 2863)
    127.0.0.1.12150 > 127.0.0.1.58284: Flags [P.], cksum 0x0924 (incorrect -> 0x8ee2), seq 13:2824, ack 531, win 512, options [nop,nop,TS val 402082524 ecr 402082445], length 2811
2022-04-07 08:23:20.021398 IP (tos 0x0, ttl 64, id 64445, offset 0, flags [DF], proto TCP (6), length 52)
    127.0.0.1.58284 > 127.0.0.1.12150: Flags [.], cksum 0xfe28 (incorrect -> 0x401d), seq 531, ack 2824, win 497, options [nop,nop,TS val 402082524 ecr 402082524], length 0
2022-04-07 08:23:20.023021 IP (tos 0x0, ttl 64, id 64446, offset 0, flags [DF], proto TCP (6), length 116)
    127.0.0.1.58284 > 127.0.0.1.12150: Flags [P.], cksum 0xfe68 (incorrect -> 0x1aaf), seq 531:595, ack 2824, win 512, options [nop,nop,TS val 402082525 ecr 402082524], length 64
2022-04-07 08:23:20.023029 IP (tos 0x0, ttl 64, id 26190, offset 0, flags [DF], proto TCP (6), length 52)
    127.0.0.1.12150 > 127.0.0.1.58284: Flags [.], cksum 0xfe28 (incorrect -> 0x3fcc), seq 2824, ack 595, win 512, options [nop,nop,TS val 402082525 ecr 402082525], length 0
2022-04-07 08:23:20.023506 IP (tos 0x0, ttl 64, id 64447, offset 0, flags [DF], proto TCP (6), length 342)
    127.0.0.1.58284 > 127.0.0.1.12150: Flags [P.], cksum 0xff4a (incorrect -> 0x69c4), seq 595:885, ack 2824, win 512, options [nop,nop,TS val 402082526 ecr 402082525], length 290
2022-04-07 08:23:20.023510 IP (tos 0x0, ttl 64, id 26191, offset 0, flags [DF], proto TCP (6), length 52)
    127.0.0.1.12150 > 127.0.0.1.58284: Flags [.], cksum 0xfe28 (incorrect -> 0x3eaa), seq 2824, ack 885, win 510, options [nop,nop,TS val 402082526 ecr 402082526], length 0
2022-04-07 08:23:20.126648 IP (tos 0x0, ttl 64, id 26192, offset 0, flags [DF], proto TCP (6), length 307)
    127.0.0.1.12150 > 127.0.0.1.58284: Flags [P.], cksum 0xff27 (incorrect -> 0x4685), seq 2824:3079, ack 885, win 512, options [nop,nop,TS val 402082629 ecr 402082526], length 255
2022-04-07 08:23:20.126653 IP (tos 0x0, ttl 64, id 64448, offset 0, flags [DF], proto TCP (6), length 52)
    127.0.0.1.58284 > 127.0.0.1.12150: Flags [.], cksum 0xfe28 (incorrect -> 0x3cdc), seq 885, ack 3079, win 511, options [nop,nop,TS val 402082629 ecr 402082629], length 0
2022-04-07 08:23:20.501782 IP (tos 0x0, ttl 64, id 26193, offset 0, flags [DF], proto TCP (6), length 3538)
    127.0.0.1.12150 > 127.0.0.1.58284: Flags [P.], cksum 0x0bc7 (incorrect -> 0x5f7d), seq 3079:6565, ack 885, win 512, options [nop,nop,TS val 402083004 ecr 402082629], length 3486
2022-04-07 08:23:20.501795 IP (tos 0x0, ttl 64, id 64449, offset 0, flags [DF], proto TCP (6), length 52)
    127.0.0.1.58284 > 127.0.0.1.12150: Flags [.], cksum 0xfe28 (incorrect -> 0x2c61), seq 885, ack 6565, win 494, options [nop,nop,TS val 402083004 ecr 402083004], length 0
2022-04-07 08:23:20.520536 IP (tos 0x0, ttl 64, id 26194, offset 0, flags [DF], proto TCP (6), length 1048)
    127.0.0.1.12150 > 127.0.0.1.58284: Flags [P.], cksum 0x020d (incorrect -> 0xe1e1), seq 6565:7561, ack 885, win 512, options [nop,nop,TS val 402083023 ecr 402083004], length 996
2022-04-07 08:23:20.520548 IP (tos 0x0, ttl 64, id 64450, offset 0, flags [DF], proto TCP (6), length 52)
    127.0.0.1.58284 > 127.0.0.1.12150: Flags [.], cksum 0xfe28 (incorrect -> 0x284d), seq 885, ack 7561, win 504, options [nop,nop,TS val 402083023 ecr 402083023], length 0
2022-04-07 08:23:20.539137 IP (tos 0x0, ttl 64, id 26195, offset 0, flags [DF], proto TCP (6), length 1451)
    127.0.0.1.12150 > 127.0.0.1.58284: Flags [P.], cksum 0x03a0 (incorrect -> 0x4362), seq 7561:8960, ack 885, win 512, options [nop,nop,TS val 402083042 ecr 402083023], length 1399
2022-04-07 08:23:20.539143 IP (tos 0x0, ttl 64, id 64451, offset 0, flags [DF], proto TCP (6), length 52)
    127.0.0.1.58284 > 127.0.0.1.12150: Flags [.], cksum 0xfe28 (incorrect -> 0x22b2), seq 885, ack 8960, win 502, options [nop,nop,TS val 402083042 ecr 402083042], length 0
2022-04-07 08:23:21.133347 IP (tos 0x0, ttl 64, id 26196, offset 0, flags [DF], proto TCP (6), length 4100)
    127.0.0.1.12150 > 127.0.0.1.58284: Flags [P.], cksum 0x0df9 (incorrect -> 0xc144), seq 8960:13008, ack 885, win 512, options [nop,nop,TS val 402083636 ecr 402083042], length 4048
2022-04-07 08:23:21.133356 IP (tos 0x0, ttl 64, id 64452, offset 0, flags [DF], proto TCP (6), length 52)
    127.0.0.1.58284 > 127.0.0.1.12150: Flags [.], cksum 0xfe28 (incorrect -> 0x0e48), seq 885, ack 13008, win 492, options [nop,nop,TS val 402083636 ecr 402083636], length 0
2022-04-07 08:23:21.133409 IP (tos 0x0, ttl 64, id 26197, offset 0, flags [DF], proto TCP (6), length 984)
    127.0.0.1.12150 > 127.0.0.1.58284: Flags [P.], cksum 0x01cd (incorrect -> 0x557b), seq 13008:13940, ack 885, win 512, options [nop,nop,TS val 402083636 ecr 402083636], length 932
2022-04-07 08:23:21.133413 IP (tos 0x0, ttl 64, id 64453, offset 0, flags [DF], proto TCP (6), length 52)
    127.0.0.1.58284 > 127.0.0.1.12150: Flags [.], cksum 0xfe28 (incorrect -> 0x0a98), seq 885, ack 13940, win 504, options [nop,nop,TS val 402083636 ecr 402083636], length 0
2022-04-07 08:23:21.133636 IP (tos 0x0, ttl 64, id 26198, offset 0, flags [DF], proto TCP (6), length 3538)
    127.0.0.1.12150 > 127.0.0.1.58284: Flags [P.], cksum 0x0bc7 (incorrect -> 0xf242), seq 13940:17426, ack 885, win 512, options [nop,nop,TS val 402083636 ecr 402083636], length 3486
2022-04-07 08:23:21.133640 IP (tos 0x0, ttl 64, id 64454, offset 0, flags [DF], proto TCP (6), length 52)
    127.0.0.1.58284 > 127.0.0.1.12150: Flags [.], cksum 0xfe28 (incorrect -> 0xfd03), seq 885, ack 17426, win 494, options [nop,nop,TS val 402083636 ecr 402083636], length 0
2022-04-07 08:23:21.149270 IP (tos 0x0, ttl 64, id 26199, offset 0, flags [DF], proto TCP (6), length 3040)
    127.0.0.1.12150 > 127.0.0.1.58284: Flags [P.], cksum 0x09d5 (incorrect -> 0x3dbe), seq 17426:20414, ack 885, win 512, options [nop,nop,TS val 402083652 ecr 402083636], length 2988
2022-04-07 08:23:21.149275 IP (tos 0x0, ttl 64, id 64455, offset 0, flags [DF], proto TCP (6), length 52)
    127.0.0.1.58284 > 127.0.0.1.12150: Flags [.], cksum 0xfe28 (incorrect -> 0xf135), seq 885, ack 20414, win 496, options [nop,nop,TS val 402083652 ecr 402083652], length 0
2022-04-07 08:23:21.151942 IP (tos 0x0, ttl 64, id 26200, offset 0, flags [DF], proto TCP (6), length 4100)
    127.0.0.1.12150 > 127.0.0.1.58284: Flags [P.], cksum 0x0df9 (incorrect -> 0x5342), seq 20414:24462, ack 885, win 512, options [nop,nop,TS val 402083654 ecr 402083652], length 4048
2022-04-07 08:23:21.151946 IP (tos 0x0, ttl 64, id 64456, offset 0, flags [DF], proto TCP (6), length 52)
    127.0.0.1.58284 > 127.0.0.1.12150: Flags [.], cksum 0xfe28 (incorrect -> 0xe165), seq 885, ack 24462, win 492, options [nop,nop,TS val 402083654 ecr 402083654], length 0
2022-04-07 08:23:21.151975 IP (tos 0x0, ttl 64, id 26201, offset 0, flags [DF], proto TCP (6), length 2812)
    127.0.0.1.12150 > 127.0.0.1.58284: Flags [P.], cksum 0x08f1 (incorrect -> 0xcd41), seq 24462:27222, ack 885, win 512, options [nop,nop,TS val 402083654 ecr 402083654], length 2760
2022-04-07 08:23:21.151978 IP (tos 0x0, ttl 64, id 64457, offset 0, flags [DF], proto TCP (6), length 52)
    127.0.0.1.58284 > 127.0.0.1.12150: Flags [.], cksum 0xfe28 (incorrect -> 0xd698), seq 885, ack 27222, win 497, options [nop,nop,TS val 402083654 ecr 402083654], length 0
2022-04-07 08:23:21.152057 IP (tos 0x0, ttl 64, id 26202, offset 0, flags [DF], proto TCP (6), length 3538)
    127.0.0.1.12150 > 127.0.0.1.58284: Flags [P.], cksum 0x0bc7 (incorrect -> 0x797e), seq 27222:30708, ack 885, win 512, options [nop,nop,TS val 402083654 ecr 402083654], length 3486
2022-04-07 08:23:21.152061 IP (tos 0x0, ttl 64, id 64458, offset 0, flags [DF], proto TCP (6), length 52)
    127.0.0.1.58284 > 127.0.0.1.12150: Flags [.], cksum 0xfe28 (incorrect -> 0xc8fc), seq 885, ack 30708, win 494, options [nop,nop,TS val 402083655 ecr 402083654], length 0
2022-04-07 08:23:21.152340 IP (tos 0x0, ttl 64, id 26203, offset 0, flags [DF], proto TCP (6), length 4100)
    127.0.0.1.12150 > 127.0.0.1.58284: Flags [P.], cksum 0x0df9 (incorrect -> 0x9361), seq 30708:34756, ack 885, win 512, options [nop,nop,TS val 402083655 ecr 402083655], length 4048
2022-04-07 08:23:21.170898 IP (tos 0x0, ttl 64, id 26204, offset 0, flags [DF], proto TCP (6), length 32820)
    127.0.0.1.12150 > 127.0.0.1.58284: Flags [.], cksum 0x7e29 (incorrect -> 0x97c7), seq 34756:67524, ack 885, win 512, options [nop,nop,TS val 402083673 ecr 402083655], length 32768
2022-04-07 08:23:21.170921 IP (tos 0x0, ttl 64, id 64459, offset 0, flags [DF], proto TCP (6), length 52)
    127.0.0.1.58284 > 127.0.0.1.12150: Flags [.], cksum 0xfe28 (incorrect -> 0x398c), seq 885, ack 67524, win 379, options [nop,nop,TS val 402083673 ecr 402083655], length 0
2022-04-07 08:23:21.171507 IP (tos 0x0, ttl 64, id 26205, offset 0, flags [DF], proto TCP (6), length 1040)
    127.0.0.1.12150 > 127.0.0.1.58284: Flags [P.], cksum 0x0205 (incorrect -> 0x032d), seq 67524:68512, ack 885, win 512, options [nop,nop,TS val 402083674 ecr 402083673], length 988
2022-04-07 08:23:21.171515 IP (tos 0x0, ttl 64, id 64460, offset 0, flags [DF], proto TCP (6), length 52)
    127.0.0.1.58284 > 127.0.0.1.12150: Flags [.], cksum 0xfe28 (incorrect -> 0x3517), seq 885, ack 68512, win 512, options [nop,nop,TS val 402083674 ecr 402083674], length 0
2022-04-07 08:23:21.171565 IP (tos 0x0, ttl 64, id 26206, offset 0, flags [DF], proto TCP (6), length 4100)
    127.0.0.1.12150 > 127.0.0.1.58284: Flags [P.], cksum 0x0df9 (incorrect -> 0xb613), seq 68512:72560, ack 885, win 512, options [nop,nop,TS val 402083674 ecr 402083674], length 4048
2022-04-07 08:23:21.171681 IP (tos 0x0, ttl 64, id 64461, offset 0, flags [DF], proto TCP (6), length 52)
    127.0.0.1.58284 > 127.0.0.1.12150: Flags [.], cksum 0xfe28 (incorrect -> 0x2547), seq 885, ack 72560, win 512, options [nop,nop,TS val 402083674 ecr 402083674], length 0
2022-04-07 08:23:21.171689 IP (tos 0x0, ttl 64, id 26207, offset 0, flags [DF], proto TCP (6), length 984)
    127.0.0.1.12150 > 127.0.0.1.58284: Flags [P.], cksum 0x01cd (incorrect -> 0xa4b3), seq 72560:73492, ack 885, win 512, options [nop,nop,TS val 402083674 ecr 402083674], length 932
2022-04-07 08:23:21.171695 IP (tos 0x0, ttl 64, id 64462, offset 0, flags [DF], proto TCP (6), length 52)
    127.0.0.1.58284 > 127.0.0.1.12150: Flags [.], cksum 0xfe28 (incorrect -> 0x21a3), seq 885, ack 73492, win 512, options [nop,nop,TS val 402083674 ecr 402083674], length 0
2022-04-07 08:23:21.209845 IP (tos 0x0, ttl 64, id 26208, offset 0, flags [DF], proto TCP (6), length 4100)
    127.0.0.1.12150 > 127.0.0.1.58284: Flags [P.], cksum 0x0df9 (incorrect -> 0x5c41), seq 73492:77540, ack 885, win 512, options [nop,nop,TS val 402083712 ecr 402083674], length 4048
2022-04-07 08:23:21.209856 IP (tos 0x0, ttl 64, id 64463, offset 0, flags [DF], proto TCP (6), length 52)
    127.0.0.1.58284 > 127.0.0.1.12150: Flags [.], cksum 0xfe28 (incorrect -> 0x1187), seq 885, ack 77540, win 512, options [nop,nop,TS val 402083712 ecr 402083712], length 0
2022-04-07 08:23:21.209878 IP (tos 0x0, ttl 64, id 26209, offset 0, flags [DF], proto TCP (6), length 984)
    127.0.0.1.12150 > 127.0.0.1.58284: Flags [P.], cksum 0x01cd (incorrect -> 0x1aca), seq 77540:78472, ack 885, win 512, options [nop,nop,TS val 402083712 ecr 402083712], length 932
2022-04-07 08:23:21.209888 IP (tos 0x0, ttl 64, id 64464, offset 0, flags [DF], proto TCP (6), length 52)
    127.0.0.1.58284 > 127.0.0.1.12150: Flags [.], cksum 0xfe28 (incorrect -> 0x0de3), seq 885, ack 78472, win 512, options [nop,nop,TS val 402083712 ecr 402083712], length 0
2022-04-07 08:23:21.209947 IP (tos 0x0, ttl 64, id 26210, offset 0, flags [DF], proto TCP (6), length 4100)
    127.0.0.1.12150 > 127.0.0.1.58284: Flags [P.], cksum 0x0df9 (incorrect -> 0x03c9), seq 78472:82520, ack 885, win 512, options [nop,nop,TS val 402083712 ecr 402083712], length 4048
2022-04-07 08:23:21.209955 IP (tos 0x0, ttl 64, id 64465, offset 0, flags [DF], proto TCP (6), length 52)
    127.0.0.1.58284 > 127.0.0.1.12150: Flags [.], cksum 0xfe28 (incorrect -> 0xfe12), seq 885, ack 82520, win 512, options [nop,nop,TS val 402083712 ecr 402083712], length 0
2022-04-07 08:23:21.209979 IP (tos 0x0, ttl 64, id 26211, offset 0, flags [DF], proto TCP (6), length 3474)
    127.0.0.1.12150 > 127.0.0.1.58284: Flags [P.], cksum 0x0b87 (incorrect -> 0x3e56), seq 82520:85942, ack 885, win 512, options [nop,nop,TS val 402083712 ecr 402083712], length 3422
2022-04-07 08:23:21.210347 IP (tos 0x0, ttl 64, id 64466, offset 0, flags [DF], proto TCP (6), length 52)
    127.0.0.1.58284 > 127.0.0.1.12150: Flags [.], cksum 0xfe28 (incorrect -> 0xf0b3), seq 885, ack 85942, win 512, options [nop,nop,TS val 402083713 ecr 402083712], length 0
2022-04-07 08:23:21.210380 IP (tos 0x0, ttl 64, id 26212, offset 0, flags [DF], proto TCP (6), length 1546)
    127.0.0.1.12150 > 127.0.0.1.58284: Flags [P.], cksum 0x03ff (incorrect -> 0x4d73), seq 85942:87436, ack 885, win 512, options [nop,nop,TS val 402083713 ecr 402083713], length 1494
2022-04-07 08:23:21.210388 IP (tos 0x0, ttl 64, id 64467, offset 0, flags [DF], proto TCP (6), length 52)
    127.0.0.1.58284 > 127.0.0.1.12150: Flags [.], cksum 0xfe28 (incorrect -> 0xeadc), seq 885, ack 87436, win 512, options [nop,nop,TS val 402083713 ecr 402083713], length 0
2022-04-07 08:23:21.222403 IP (tos 0x0, ttl 64, id 26213, offset 0, flags [DF], proto TCP (6), length 4100)
    127.0.0.1.12150 > 127.0.0.1.58284: Flags [P.], cksum 0x0df9 (incorrect -> 0x8aa1), seq 87436:91484, ack 885, win 512, options [nop,nop,TS val 402083725 ecr 402083713], length 4048
2022-04-07 08:23:21.222502 IP (tos 0x0, ttl 64, id 64468, offset 0, flags [DF], proto TCP (6), length 52)
    127.0.0.1.58284 > 127.0.0.1.12150: Flags [.], cksum 0xfe28 (incorrect -> 0xdaf4), seq 885, ack 91484, win 512, options [nop,nop,TS val 402083725 ecr 402083725], length 0
2022-04-07 08:23:21.222526 IP (tos 0x0, ttl 64, id 26214, offset 0, flags [DF], proto TCP (6), length 5466)
    127.0.0.1.12150 > 127.0.0.1.58284: Flags [P.], cksum 0x134f (incorrect -> 0xf0c6), seq 91484:96898, ack 885, win 512, options [nop,nop,TS val 402083725 ecr 402083725], length 5414
2022-04-07 08:23:21.222535 IP (tos 0x0, ttl 64, id 64469, offset 0, flags [DF], proto TCP (6), length 52)
    127.0.0.1.58284 > 127.0.0.1.12150: Flags [.], cksum 0xfe28 (incorrect -> 0xc5ce), seq 885, ack 96898, win 512, options [nop,nop,TS val 402083725 ecr 402083725], length 0
2022-04-07 08:23:21.222548 IP (tos 0x0, ttl 64, id 26215, offset 0, flags [DF], proto TCP (6), length 4100)
    127.0.0.1.12150 > 127.0.0.1.58284: Flags [P.], cksum 0x0df9 (incorrect -> 0x5af9), seq 96898:100946, ack 885, win 512, options [nop,nop,TS val 402083725 ecr 402083725], length 4048
2022-04-07 08:23:21.222583 IP (tos 0x0, ttl 64, id 64470, offset 0, flags [DF], proto TCP (6), length 52)
    127.0.0.1.58284 > 127.0.0.1.12150: Flags [.], cksum 0xfe28 (incorrect -> 0xb5fe), seq 885, ack 100946, win 512, options [nop,nop,TS val 402083725 ecr 402083725], length 0
2022-04-07 08:23:21.222590 IP (tos 0x0, ttl 64, id 26216, offset 0, flags [DF], proto TCP (6), length 486)
    127.0.0.1.12150 > 127.0.0.1.58284: Flags [P.], cksum 0xffda (incorrect -> 0x58b8), seq 100946:101380, ack 885, win 512, options [nop,nop,TS val 402083725 ecr 402083725], length 434
2022-04-07 08:23:21.222594 IP (tos 0x0, ttl 64, id 64471, offset 0, flags [DF], proto TCP (6), length 52)
    127.0.0.1.58284 > 127.0.0.1.12150: Flags [.], cksum 0xfe28 (incorrect -> 0xb44c), seq 885, ack 101380, win 512, options [nop,nop,TS val 402083725 ecr 402083725], length 0
2022-04-07 08:23:21.222698 IP (tos 0x0, ttl 64, id 26217, offset 0, flags [DF], proto TCP (6), length 4100)
    127.0.0.1.12150 > 127.0.0.1.58284: Flags [P.], cksum 0x0df9 (incorrect -> 0xfce1), seq 101380:105428, ack 885, win 512, options [nop,nop,TS val 402083725 ecr 402083725], length 4048
2022-04-07 08:23:21.223103 IP (tos 0x0, ttl 64, id 64472, offset 0, flags [DF], proto TCP (6), length 52)
    127.0.0.1.58284 > 127.0.0.1.12150: Flags [.], cksum 0xfe28 (incorrect -> 0xa47b), seq 885, ack 105428, win 512, options [nop,nop,TS val 402083726 ecr 402083725], length 0
2022-04-07 08:23:21.223115 IP (tos 0x0, ttl 64, id 26218, offset 0, flags [DF], proto TCP (6), length 2478)
    127.0.0.1.12150 > 127.0.0.1.58284: Flags [P.], cksum 0x07a3 (incorrect -> 0xeef8), seq 105428:107854, ack 885, win 512, options [nop,nop,TS val 402083726 ecr 402083726], length 2426
2022-04-07 08:23:21.223122 IP (tos 0x0, ttl 64, id 64473, offset 0, flags [DF], proto TCP (6), length 52)
    127.0.0.1.58284 > 127.0.0.1.12150: Flags [.], cksum 0xfe28 (incorrect -> 0x9b00), seq 885, ack 107854, win 512, options [nop,nop,TS val 402083726 ecr 402083726], length 0
2022-04-07 08:23:21.223160 IP (tos 0x0, ttl 64, id 26219, offset 0, flags [DF], proto TCP (6), length 4100)
    127.0.0.1.12150 > 127.0.0.1.58284: Flags [P.], cksum 0x0df9 (incorrect -> 0x32c4), seq 107854:111902, ack 885, win 512, options [nop,nop,TS val 402083726 ecr 402083726], length 4048
2022-04-07 08:23:21.223167 IP (tos 0x0, ttl 64, id 64474, offset 0, flags [DF], proto TCP (6), length 52)
    127.0.0.1.58284 > 127.0.0.1.12150: Flags [.], cksum 0xfe28 (incorrect -> 0x8b30), seq 885, ack 111902, win 512, options [nop,nop,TS val 402083726 ecr 402083726], length 0
2022-04-07 08:23:21.223173 IP (tos 0x0, ttl 64, id 26220, offset 0, flags [DF], proto TCP (6), length 486)
    127.0.0.1.12150 > 127.0.0.1.58284: Flags [P.], cksum 0xffda (incorrect -> 0xdf5a), seq 111902:112336, ack 885, win 512, options [nop,nop,TS val 402083726 ecr 402083726], length 434
2022-04-07 08:23:21.223178 IP (tos 0x0, ttl 64, id 64475, offset 0, flags [DF], proto TCP (6), length 52)
    127.0.0.1.58284 > 127.0.0.1.12150: Flags [.], cksum 0xfe28 (incorrect -> 0x897e), seq 885, ack 112336, win 512, options [nop,nop,TS val 402083726 ecr 402083726], length 0
2022-04-07 08:23:21.223209 IP (tos 0x0, ttl 64, id 26221, offset 0, flags [DF], proto TCP (6), length 4100)
    127.0.0.1.12150 > 127.0.0.1.58284: Flags [P.], cksum 0x0df9 (incorrect -> 0xc109), seq 112336:116384, ack 885, win 512, options [nop,nop,TS val 402083726 ecr 402083726], length 4048
2022-04-07 08:23:21.223216 IP (tos 0x0, ttl 64, id 64476, offset 0, flags [DF], proto TCP (6), length 52)
    127.0.0.1.58284 > 127.0.0.1.12150: Flags [.], cksum 0xfe28 (incorrect -> 0x79ae), seq 885, ack 116384, win 512, options [nop,nop,TS val 402083726 ecr 402083726], length 0
2022-04-07 08:23:21.223222 IP (tos 0x0, ttl 64, id 26222, offset 0, flags [DF], proto TCP (6), length 486)
    127.0.0.1.12150 > 127.0.0.1.58284: Flags [P.], cksum 0xffda (incorrect -> 0xebe0), seq 116384:116818, ack 885, win 512, options [nop,nop,TS val 402083726 ecr 402083726], length 434
2022-04-07 08:23:21.223227 IP (tos 0x0, ttl 64, id 64477, offset 0, flags [DF], proto TCP (6), length 52)
    127.0.0.1.58284 > 127.0.0.1.12150: Flags [.], cksum 0xfe28 (incorrect -> 0x77fc), seq 885, ack 116818, win 512, options [nop,nop,TS val 402083726 ecr 402083726], length 0
2022-04-07 08:23:21.225378 IP (tos 0x0, ttl 64, id 26223, offset 0, flags [DF], proto TCP (6), length 4100)
    127.0.0.1.12150 > 127.0.0.1.58284: Flags [P.], cksum 0x0df9 (incorrect -> 0x3da5), seq 116818:120866, ack 885, win 512, options [nop,nop,TS val 402083728 ecr 402083726], length 4048
2022-04-07 08:23:21.225683 IP (tos 0x0, ttl 64, id 64478, offset 0, flags [DF], proto TCP (6), length 52)
    127.0.0.1.58284 > 127.0.0.1.12150: Flags [.], cksum 0xfe28 (incorrect -> 0x6828), seq 885, ack 120866, win 512, options [nop,nop,TS val 402083728 ecr 402083728], length 0
2022-04-07 08:23:21.225692 IP (tos 0x0, ttl 64, id 26224, offset 0, flags [DF], proto TCP (6), length 486)
    127.0.0.1.12150 > 127.0.0.1.58284: Flags [P.], cksum 0xffda (incorrect -> 0x8326), seq 120866:121300, ack 885, win 512, options [nop,nop,TS val 402083728 ecr 402083728], length 434
2022-04-07 08:23:21.225698 IP (tos 0x0, ttl 64, id 64479, offset 0, flags [DF], proto TCP (6), length 52)
    127.0.0.1.58284 > 127.0.0.1.12150: Flags [.], cksum 0xfe28 (incorrect -> 0x6676), seq 885, ack 121300, win 512, options [nop,nop,TS val 402083728 ecr 402083728], length 0
2022-04-07 08:23:21.228416 IP (tos 0x0, ttl 64, id 26225, offset 0, flags [DF], proto TCP (6), length 3538)
    127.0.0.1.12150 > 127.0.0.1.58284: Flags [P.], cksum 0x0bc7 (incorrect -> 0xabc1), seq 121300:124786, ack 885, win 512, options [nop,nop,TS val 402083731 ecr 402083728], length 3486
2022-04-07 08:23:21.228456 IP (tos 0x0, ttl 64, id 64480, offset 0, flags [DF], proto TCP (6), length 52)
    127.0.0.1.58284 > 127.0.0.1.12150: Flags [.], cksum 0xfe28 (incorrect -> 0x58d2), seq 885, ack 124786, win 512, options [nop,nop,TS val 402083731 ecr 402083731], length 0
2022-04-07 08:23:21.230117 IP (tos 0x0, ttl 64, id 26226, offset 0, flags [DF], proto TCP (6), length 3538)
    127.0.0.1.12150 > 127.0.0.1.58284: Flags [P.], cksum 0x0bc7 (incorrect -> 0x7d7e), seq 124786:128272, ack 885, win 512, options [nop,nop,TS val 402083733 ecr 402083731], length 3486
2022-04-07 08:23:21.270653 IP (tos 0x0, ttl 64, id 64481, offset 0, flags [DF], proto TCP (6), length 52)
    127.0.0.1.58284 > 127.0.0.1.12150: Flags [.], cksum 0xfe28 (incorrect -> 0x4b08), seq 885, ack 128272, win 512, options [nop,nop,TS val 402083773 ecr 402083733], length 0
200, 18.69206953048706, 1.4070384502410889