2022-04-07 20:24:25.009308 IP (tos 0x0, ttl 64, id 8230, offset 0, flags [DF], proto TCP (6), length 60)
    127.0.0.1.59080 > 127.0.0.1.10850: Flags [S], cksum 0xfe30 (incorrect -> 0xbfc9), seq 4286248604, win 65495, options [mss 65495,sackOK,TS val 3519264561 ecr 0,nop,wscale 7], length 0
2022-04-07 20:24:25.009322 IP (tos 0x0, ttl 64, id 0, offset 0, flags [DF], proto TCP (6), length 60)
    127.0.0.1.10850 > 127.0.0.1.59080: Flags [S.], cksum 0xfe30 (incorrect -> 0xc394), seq 1128214523, ack 4286248605, win 65483, options [mss 65495,sackOK,TS val 3519264561 ecr 3519264561,nop,wscale 7], length 0
2022-04-07 20:24:25.009332 IP (tos 0x0, ttl 64, id 8231, offset 0, flags [DF], proto TCP (6), length 52)
    127.0.0.1.59080 > 127.0.0.1.10850: Flags [.], cksum 0xfe28 (incorrect -> 0xea50), seq 1, ack 1, win 512, options [nop,nop,TS val 3519264561 ecr 3519264561], length 0
2022-04-07 20:24:25.009474 IP (tos 0x0, ttl 64, id 8232, offset 0, flags [DF], proto TCP (6), length 55)
    127.0.0.1.59080 > 127.0.0.1.10850: Flags [P.], cksum 0xfe2b (incorrect -> 0xe544), seq 1:4, ack 1, win 512, options [nop,nop,TS val 3519264561 ecr 3519264561], length 3
2022-04-07 20:24:25.009488 IP (tos 0x0, ttl 64, id 27489, offset 0, flags [DF], proto TCP (6), length 52)
    127.0.0.1.10850 > 127.0.0.1.59080: Flags [.], cksum 0xfe28 (incorrect -> 0xea4d), seq 1, ack 4, win 512, options [nop,nop,TS val 3519264561 ecr 3519264561], length 0
2022-04-07 20:24:25.009575 IP (tos 0x0, ttl 64, id 27490, offset 0, flags [DF], proto TCP (6), length 54)
    127.0.0.1.10850 > 127.0.0.1.59080: Flags [P.], cksum 0xfe2a (incorrect -> 0xe543), seq 1:3, ack 4, win 512, options [nop,nop,TS val 3519264561 ecr 3519264561], length 2
2022-04-07 20:24:25.009597 IP (tos 0x0, ttl 64, id 8233, offset 0, flags [DF], proto TCP (6), length 52)
    127.0.0.1.59080 > 127.0.0.1.10850: Flags [.], cksum 0xfe28 (incorrect -> 0xea4b), seq 4, ack 3, win 512, options [nop,nop,TS val 3519264561 ecr 3519264561], length 0
2022-04-07 20:24:25.011076 IP (tos 0x0, ttl 64, id 8234, offset 0, flags [DF], proto TCP (6), length 62)
    127.0.0.1.59080 > 127.0.0.1.10850: Flags [P.], cksum 0xfe32 (incorrect -> 0x59c5), seq 4:14, ack 3, win 512, options [nop,nop,TS val 3519264562 ecr 3519264561], length 10
2022-04-07 20:24:25.011096 IP (tos 0x0, ttl 64, id 27491, offset 0, flags [DF], proto TCP (6), length 52)
    127.0.0.1.10850 > 127.0.0.1.59080: Flags [.], cksum 0xfe28 (incorrect -> 0xea3f), seq 3, ack 14, win 512, options [nop,nop,TS val 3519264562 ecr 3519264562], length 0
200, 3.8312411308288574, 0.412412166595459