2022-04-07 03:42:46.134248 IP (tos 0x0, ttl 64, id 44426, offset 0, flags [DF], proto TCP (6), length 60)
    127.0.0.1.33352 > 127.0.0.1.9350: Flags [S], cksum 0xfe30 (incorrect -> 0xeee5), seq 143666506, win 65495, options [mss 65495,sackOK,TS val 385248637 ecr 0,nop,wscale 7], length 0
2022-04-07 03:42:46.134260 IP (tos 0x0, ttl 64, id 0, offset 0, flags [DF], proto TCP (6), length 60)
    127.0.0.1.9350 > 127.0.0.1.33352: Flags [S.], cksum 0xfe30 (incorrect -> 0x203e), seq 4116731086, ack 143666507, win 65483, options [mss 65495,sackOK,TS val 385248637 ecr 385248637,nop,wscale 7], length 0
2022-04-07 03:42:46.134268 IP (tos 0x0, ttl 64, id 44427, offset 0, flags [DF], proto TCP (6), length 52)
    127.0.0.1.33352 > 127.0.0.1.9350: Flags [.], cksum 0xfe28 (incorrect -> 0x46fa), seq 1, ack 1, win 512, options [nop,nop,TS val 385248637 ecr 385248637], length 0
2022-04-07 03:42:46.134348 IP (tos 0x0, ttl 64, id 44428, offset 0, flags [DF], proto TCP (6), length 55)
    127.0.0.1.33352 > 127.0.0.1.9350: Flags [P.], cksum 0xfe2b (incorrect -> 0x41ee), seq 1:4, ack 1, win 512, options [nop,nop,TS val 385248637 ecr 385248637], length 3
2022-04-07 03:42:46.134351 IP (tos 0x0, ttl 64, id 42346, offset 0, flags [DF], proto TCP (6), length 52)
    127.0.0.1.9350 > 127.0.0.1.33352: Flags [.], cksum 0xfe28 (incorrect -> 0x46f7), seq 1, ack 4, win 512, options [nop,nop,TS val 385248637 ecr 385248637], length 0
2022-04-07 03:42:46.134417 IP (tos 0x0, ttl 64, id 42347, offset 0, flags [DF], proto TCP (6), length 54)
    127.0.0.1.9350 > 127.0.0.1.33352: Flags [P.], cksum 0xfe2a (incorrect -> 0x41ed), seq 1:3, ack 4, win 512, options [nop,nop,TS val 385248637 ecr 385248637], length 2
2022-04-07 03:42:46.134421 IP (tos 0x0, ttl 64, id 44429, offset 0, flags [DF], proto TCP (6), length 52)
    127.0.0.1.33352 > 127.0.0.1.9350: Flags [.], cksum 0xfe28 (incorrect -> 0x46f5), seq 4, ack 3, win 512, options [nop,nop,TS val 385248637 ecr 385248637], length 0
2022-04-07 03:42:46.161994 IP (tos 0x0, ttl 64, id 44430, offset 0, flags [DF], proto TCP (6), length 62)
    127.0.0.1.33352 > 127.0.0.1.9350: Flags [P.], cksum 0xfe32 (incorrect -> 0x07db), seq 4:14, ack 3, win 512, options [nop,nop,TS val 385248664 ecr 385248637], length 10
2022-04-07 03:42:46.162003 IP (tos 0x0, ttl 64, id 42348, offset 0, flags [DF], proto TCP (6), length 52)
    127.0.0.1.9350 > 127.0.0.1.33352: Flags [.], cksum 0xfe28 (incorrect -> 0x46b5), seq 3, ack 14, win 512, options [nop,nop,TS val 385248664 ecr 385248664], length 0
2022-04-07 03:42:46.233088 IP (tos 0x0, ttl 64, id 42349, offset 0, flags [DF], proto TCP (6), length 62)
    127.0.0.1.9350 > 127.0.0.1.33352: Flags [P.], cksum 0xfe32 (incorrect -> 0x415a), seq 3:13, ack 14, win 512, options [nop,nop,TS val 385248736 ecr 385248664], length 10
2022-04-07 03:42:46.233094 IP (tos 0x0, ttl 64, id 44431, offset 0, flags [DF], proto TCP (6), length 52)
    127.0.0.1.33352 > 127.0.0.1.9350: Flags [.], cksum 0xfe28 (incorrect -> 0x461b), seq 14, ack 13, win 512, options [nop,nop,TS val 385248736 ecr 385248736], length 0
2022-04-07 03:42:46.239532 IP (tos 0x0, ttl 64, id 44432, offset 0, flags [DF], proto TCP (6), length 569)
    127.0.0.1.33352 > 127.0.0.1.9350: Flags [P.], cksum 0x002e (incorrect -> 0xf117), seq 14:531, ack 13, win 512, options [nop,nop,TS val 385248742 ecr 385248736], length 517
2022-04-07 03:42:46.239565 IP (tos 0x0, ttl 64, id 42350, offset 0, flags [DF], proto TCP (6), length 52)
    127.0.0.1.9350 > 127.0.0.1.33352: Flags [.], cksum 0xfe28 (incorrect -> 0x440e), seq 13, ack 531, win 508, options [nop,nop,TS val 385248742 ecr 385248742], length 0
200, 14.93501591682434, 0.9355514049530029