2022-04-07 20:46:54.266060 IP (tos 0x0, ttl 64, id 64601, offset 0, flags [DF], proto TCP (6), length 60)
    127.0.0.1.49534 > 127.0.0.1.10650: Flags [S], cksum 0xfe30 (incorrect -> 0x2ef0), seq 1044699170, win 65495, options [mss 65495,sackOK,TS val 3520613817 ecr 0,nop,wscale 7], length 0
2022-04-07 20:46:54.266066 IP (tos 0x0, ttl 64, id 0, offset 0, flags [DF], proto TCP (6), length 60)
    127.0.0.1.10650 > 127.0.0.1.49534: Flags [S.], cksum 0xfe30 (incorrect -> 0x77a6), seq 2732324054, ack 1044699171, win 65483, options [mss 65495,sackOK,TS val 3520613817 ecr 3520613817,nop,wscale 7], length 0
2022-04-07 20:46:54.266071 IP (tos 0x0, ttl 64, id 64602, offset 0, flags [DF], proto TCP (6), length 52)
    127.0.0.1.49534 > 127.0.0.1.10650: Flags [.], cksum 0xfe28 (incorrect -> 0x9e62), seq 1, ack 1, win 512, options [nop,nop,TS val 3520613817 ecr 3520613817], length 0
2022-04-07 20:46:54.266145 IP (tos 0x0, ttl 64, id 64603, offset 0, flags [DF], proto TCP (6), length 55)
    127.0.0.1.49534 > 127.0.0.1.10650: Flags [P.], cksum 0xfe2b (incorrect -> 0x9956), seq 1:4, ack 1, win 512, options [nop,nop,TS val 3520613817 ecr 3520613817], length 3
2022-04-07 20:46:54.266148 IP (tos 0x0, ttl 64, id 41592, offset 0, flags [DF], proto TCP (6), length 52)
    127.0.0.1.10650 > 127.0.0.1.49534: Flags [.], cksum 0xfe28 (incorrect -> 0x9e5f), seq 1, ack 4, win 512, options [nop,nop,TS val 3520613817 ecr 3520613817], length 0
2022-04-07 20:46:54.266209 IP (tos 0x0, ttl 64, id 41593, offset 0, flags [DF], proto TCP (6), length 54)
    127.0.0.1.10650 > 127.0.0.1.49534: Flags [P.], cksum 0xfe2a (incorrect -> 0x9955), seq 1:3, ack 4, win 512, options [nop,nop,TS val 3520613817 ecr 3520613817], length 2
2022-04-07 20:46:54.266213 IP (tos 0x0, ttl 64, id 64604, offset 0, flags [DF], proto TCP (6), length 52)
    127.0.0.1.49534 > 127.0.0.1.10650: Flags [.], cksum 0xfe28 (incorrect -> 0x9e5d), seq 4, ack 3, win 512, options [nop,nop,TS val 3520613817 ecr 3520613817], length 0
2022-04-07 20:46:54.267287 IP (tos 0x0, ttl 64, id 64605, offset 0, flags [DF], proto TCP (6), length 62)
    127.0.0.1.49534 > 127.0.0.1.10650: Flags [P.], cksum 0xfe32 (incorrect -> 0xce87), seq 4:14, ack 3, win 512, options [nop,nop,TS val 3520613819 ecr 3520613817], length 10
2022-04-07 20:46:54.267293 IP (tos 0x0, ttl 64, id 41594, offset 0, flags [DF], proto TCP (6), length 52)
    127.0.0.1.10650 > 127.0.0.1.49534: Flags [.], cksum 0xfe28 (incorrect -> 0x9e4f), seq 3, ack 14, win 512, options [nop,nop,TS val 3520613819 ecr 3520613819], length 0
2022-04-07 20:46:54.746644 IP (tos 0x0, ttl 64, id 41595, offset 0, flags [DF], proto TCP (6), length 62)
    127.0.0.1.10650 > 127.0.0.1.49534: Flags [P.], cksum 0xfe32 (incorrect -> 0x975d), seq 3:13, ack 14, win 512, options [nop,nop,TS val 3520614298 ecr 3520613819], length 10
2022-04-07 20:46:54.746651 IP (tos 0x0, ttl 64, id 64606, offset 0, flags [DF], proto TCP (6), length 52)
    127.0.0.1.49534 > 127.0.0.1.10650: Flags [.], cksum 0xfe28 (incorrect -> 0x9a87), seq 14, ack 13, win 512, options [nop,nop,TS val 3520614298 ecr 3520614298], length 0
2022-04-07 20:46:54.752213 IP (tos 0x0, ttl 64, id 64607, offset 0, flags [DF], proto TCP (6), length 569)
    127.0.0.1.49534 > 127.0.0.1.10650: Flags [P.], cksum 0x002e (incorrect -> 0xe502), seq 14:531, ack 13, win 512, options [nop,nop,TS val 3520614303 ecr 3520614298], length 517
2022-04-07 20:46:54.752220 IP (tos 0x0, ttl 64, id 41596, offset 0, flags [DF], proto TCP (6), length 52)
    127.0.0.1.10650 > 127.0.0.1.49534: Flags [.], cksum 0xfe28 (incorrect -> 0x987c), seq 13, ack 531, win 508, options [nop,nop,TS val 3520614303 ecr 3520614303], length 0
