2022-04-07 19:30:13.282348 IP (tos 0x0, ttl 64, id 16946, offset 0, flags [DF], proto TCP (6), length 60)
    127.0.0.1.59030 > 127.0.0.1.10850: Flags [S], cksum 0xfe30 (incorrect -> 0xe597), seq 1550979658, win 65495, options [mss 65495,sackOK,TS val 3516012834 ecr 0,nop,wscale 7], length 0
2022-04-07 19:30:13.282361 IP (tos 0x0, ttl 64, id 0, offset 0, flags [DF], proto TCP (6), length 60)
    127.0.0.1.10850 > 127.0.0.1.59030: Flags [S.], cksum 0xfe30 (incorrect -> 0x8680), seq 1512184379, ack 1550979659, win 65483, options [mss 65495,sackOK,TS val 3516012834 ecr 3516012834,nop,wscale 7], length 0
2022-04-07 19:30:13.282372 IP (tos 0x0, ttl 64, id 16947, offset 0, flags [DF], proto TCP (6), length 52)
    127.0.0.1.59030 > 127.0.0.1.10850: Flags [.], cksum 0xfe28 (incorrect -> 0xad3c), seq 1, ack 1, win 512, options [nop,nop,TS val 3516012834 ecr 3516012834], length 0
2022-04-07 19:30:13.282469 IP (tos 0x0, ttl 64, id 16948, offset 0, flags [DF], proto TCP (6), length 55)
    127.0.0.1.59030 > 127.0.0.1.10850: Flags [P.], cksum 0xfe2b (incorrect -> 0xa830), seq 1:4, ack 1, win 512, options [nop,nop,TS val 3516012834 ecr 3516012834], length 3
2022-04-07 19:30:13.282475 IP (tos 0x0, ttl 64, id 28827, offset 0, flags [DF], proto TCP (6), length 52)
    127.0.0.1.10850 > 127.0.0.1.59030: Flags [.], cksum 0xfe28 (incorrect -> 0xad39), seq 1, ack 4, win 512, options [nop,nop,TS val 3516012834 ecr 3516012834], length 0
2022-04-07 19:30:13.282557 IP (tos 0x0, ttl 64, id 28828, offset 0, flags [DF], proto TCP (6), length 54)
    127.0.0.1.10850 > 127.0.0.1.59030: Flags [P.], cksum 0xfe2a (incorrect -> 0xa82f), seq 1:3, ack 4, win 512, options [nop,nop,TS val 3516012834 ecr 3516012834], length 2
2022-04-07 19:30:13.282564 IP (tos 0x0, ttl 64, id 16949, offset 0, flags [DF], proto TCP (6), length 52)
    127.0.0.1.59030 > 127.0.0.1.10850: Flags [.], cksum 0xfe28 (incorrect -> 0xad37), seq 4, ack 3, win 512, options [nop,nop,TS val 3516012834 ecr 3516012834], length 0
2022-04-07 19:30:13.283918 IP (tos 0x0, ttl 64, id 16950, offset 0, flags [DF], proto TCP (6), length 62)
    127.0.0.1.59030 > 127.0.0.1.10850: Flags [P.], cksum 0xfe32 (incorrect -> 0xf442), seq 4:14, ack 3, win 512, options [nop,nop,TS val 3516012835 ecr 3516012834], length 10
2022-04-07 19:30:13.283935 IP (tos 0x0, ttl 64, id 28829, offset 0, flags [DF], proto TCP (6), length 52)
    127.0.0.1.10850 > 127.0.0.1.59030: Flags [.], cksum 0xfe28 (incorrect -> 0xad2b), seq 3, ack 14, win 512, options [nop,nop,TS val 3516012835 ecr 3516012835], length 0
2022-04-07 19:30:13.353972 IP (tos 0x0, ttl 64, id 28830, offset 0, flags [DF], proto TCP (6), length 62)
    127.0.0.1.10850 > 127.0.0.1.59030: Flags [P.], cksum 0xfe32 (incorrect -> 0xa7d2), seq 3:13, ack 14, win 512, options [nop,nop,TS val 3516012905 ecr 3516012835], length 10
2022-04-07 19:30:13.353983 IP (tos 0x0, ttl 64, id 16951, offset 0, flags [DF], proto TCP (6), length 52)
    127.0.0.1.59030 > 127.0.0.1.10850: Flags [.], cksum 0xfe28 (incorrect -> 0xac95), seq 14, ack 13, win 512, options [nop,nop,TS val 3516012905 ecr 3516012905], length 0
2022-04-07 19:30:13.359631 IP (tos 0x0, ttl 64, id 16952, offset 0, flags [DF], proto TCP (6), length 569)
    127.0.0.1.59030 > 127.0.0.1.10850: Flags [P.], cksum 0x002e (incorrect -> 0xaab0), seq 14:531, ack 13, win 512, options [nop,nop,TS val 3516012911 ecr 3516012905], length 517
2022-04-07 19:30:13.359641 IP (tos 0x0, ttl 64, id 28831, offset 0, flags [DF], proto TCP (6), length 52)
    127.0.0.1.10850 > 127.0.0.1.59030: Flags [.], cksum 0xfe28 (incorrect -> 0xaa88), seq 13, ack 531, win 508, options [nop,nop,TS val 3516012911 ecr 3516012911], length 0
2022-04-07 19:30:13.427288 IP (tos 0x0, ttl 64, id 28832, offset 0, flags [DF], proto TCP (6), length 3215)
    127.0.0.1.10850 > 127.0.0.1.59030: Flags [P.], cksum 0x0a84 (incorrect -> 0x082d), seq 13:3176, ack 531, win 512, options [nop,nop,TS val 3516012979 ecr 3516012911], length 3163
2022-04-07 19:30:13.427297 IP (tos 0x0, ttl 64, id 16953, offset 0, flags [DF], proto TCP (6), length 52)
    127.0.0.1.59030 > 127.0.0.1.10850: Flags [.], cksum 0xfe28 (incorrect -> 0x9db2), seq 531, ack 3176, win 495, options [nop,nop,TS val 3516012979 ecr 3516012979], length 0
2022-04-07 19:30:13.427773 IP (tos 0x0, ttl 64, id 16954, offset 0, flags [DF], proto TCP (6), length 116)
    127.0.0.1.59030 > 127.0.0.1.10850: Flags [P.], cksum 0xfe68 (incorrect -> 0x37ff), seq 531:595, ack 3176, win 512, options [nop,nop,TS val 3516012979 ecr 3516012979], length 64
2022-04-07 19:30:13.427781 IP (tos 0x0, ttl 64, id 28833, offset 0, flags [DF], proto TCP (6), length 52)
    127.0.0.1.10850 > 127.0.0.1.59030: Flags [.], cksum 0xfe28 (incorrect -> 0x9d61), seq 3176, ack 595, win 512, options [nop,nop,TS val 3516012979 ecr 3516012979], length 0
2022-04-07 19:30:13.428127 IP (tos 0x0, ttl 64, id 16955, offset 0, flags [DF], proto TCP (6), length 404)
    127.0.0.1.59030 > 127.0.0.1.10850: Flags [P.], cksum 0xff88 (incorrect -> 0xb545), seq 595:947, ack 3176, win 512, options [nop,nop,TS val 3516012979 ecr 3516012979], length 352
2022-04-07 19:30:13.428135 IP (tos 0x0, ttl 64, id 28834, offset 0, flags [DF], proto TCP (6), length 52)
    127.0.0.1.10850 > 127.0.0.1.59030: Flags [.], cksum 0xfe28 (incorrect -> 0x9c03), seq 3176, ack 947, win 510, options [nop,nop,TS val 3516012979 ecr 3516012979], length 0
200, 6.256796836853027, 0.7934410572052002