2022-04-07 06:41:58.310815 IP (tos 0x0, ttl 64, id 21871, offset 0, flags [DF], proto TCP (6), length 60)
    127.0.0.1.36086 > 127.0.0.1.10850: Flags [S], cksum 0xfe30 (incorrect -> 0x99cb), seq 1590823492, win 65495, options [mss 65495,sackOK,TS val 396000813 ecr 0,nop,wscale 7], length 0
2022-04-07 06:41:58.310826 IP (tos 0x0, ttl 64, id 0, offset 0, flags [DF], proto TCP (6), length 60)
    127.0.0.1.10850 > 127.0.0.1.36086: Flags [S.], cksum 0xfe30 (incorrect -> 0x0c93), seq 3328979199, ack 1590823493, win 65483, options [mss 65495,sackOK,TS val 396000813 ecr 396000813,nop,wscale 7], length 0
2022-04-07 06:41:58.310834 IP (tos 0x0, ttl 64, id 21872, offset 0, flags [DF], proto TCP (6), length 52)
    127.0.0.1.36086 > 127.0.0.1.10850: Flags [.], cksum 0xfe28 (incorrect -> 0x334f), seq 1, ack 1, win 512, options [nop,nop,TS val 396000813 ecr 396000813], length 0
2022-04-07 06:41:58.310923 IP (tos 0x0, ttl 64, id 21873, offset 0, flags [DF], proto TCP (6), length 55)
    127.0.0.1.36086 > 127.0.0.1.10850: Flags [P.], cksum 0xfe2b (incorrect -> 0x2e43), seq 1:4, ack 1, win 512, options [nop,nop,TS val 396000813 ecr 396000813], length 3
2022-04-07 06:41:58.310936 IP (tos 0x0, ttl 64, id 1566, offset 0, flags [DF], proto TCP (6), length 52)
    127.0.0.1.10850 > 127.0.0.1.36086: Flags [.], cksum 0xfe28 (incorrect -> 0x334c), seq 1, ack 4, win 512, options [nop,nop,TS val 396000813 ecr 396000813], length 0
2022-04-07 06:41:58.310970 IP (tos 0x0, ttl 64, id 1567, offset 0, flags [DF], proto TCP (6), length 54)
    127.0.0.1.10850 > 127.0.0.1.36086: Flags [P.], cksum 0xfe2a (incorrect -> 0x2e42), seq 1:3, ack 4, win 512, options [nop,nop,TS val 396000813 ecr 396000813], length 2
2022-04-07 06:41:58.310982 IP (tos 0x0, ttl 64, id 21874, offset 0, flags [DF], proto TCP (6), length 52)
    127.0.0.1.36086 > 127.0.0.1.10850: Flags [.], cksum 0xfe28 (incorrect -> 0x334a), seq 4, ack 3, win 512, options [nop,nop,TS val 396000813 ecr 396000813], length 0
2022-04-07 06:41:58.322407 IP (tos 0x0, ttl 64, id 21875, offset 0, flags [DF], proto TCP (6), length 62)
    127.0.0.1.36086 > 127.0.0.1.10850: Flags [P.], cksum 0xfe32 (incorrect -> 0x9f2d), seq 4:14, ack 3, win 512, options [nop,nop,TS val 396000825 ecr 396000813], length 10
2022-04-07 06:41:58.322423 IP (tos 0x0, ttl 64, id 1568, offset 0, flags [DF], proto TCP (6), length 52)
    127.0.0.1.10850 > 127.0.0.1.36086: Flags [.], cksum 0xfe28 (incorrect -> 0x3328), seq 3, ack 14, win 512, options [nop,nop,TS val 396000825 ecr 396000825], length 0
2022-04-07 06:41:58.364869 IP (tos 0x0, ttl 64, id 1569, offset 0, flags [DF], proto TCP (6), length 62)
    127.0.0.1.10850 > 127.0.0.1.36086: Flags [P.], cksum 0xfe32 (incorrect -> 0x2deb), seq 3:13, ack 14, win 512, options [nop,nop,TS val 396000867 ecr 396000825], length 10
2022-04-07 06:41:58.364880 IP (tos 0x0, ttl 64, id 21876, offset 0, flags [DF], proto TCP (6), length 52)
    127.0.0.1.36086 > 127.0.0.1.10850: Flags [.], cksum 0xfe28 (incorrect -> 0x32ca), seq 14, ack 13, win 512, options [nop,nop,TS val 396000867 ecr 396000867], length 0
2022-04-07 06:41:58.370521 IP (tos 0x0, ttl 64, id 21877, offset 0, flags [DF], proto TCP (6), length 569)
    127.0.0.1.36086 > 127.0.0.1.10850: Flags [P.], cksum 0x002e (incorrect -> 0xadc7), seq 14:531, ack 13, win 512, options [nop,nop,TS val 396000873 ecr 396000867], length 517
2022-04-07 06:41:58.370532 IP (tos 0x0, ttl 64, id 1570, offset 0, flags [DF], proto TCP (6), length 52)
    127.0.0.1.10850 > 127.0.0.1.36086: Flags [.], cksum 0xfe28 (incorrect -> 0x30bd), seq 13, ack 531, win 508, options [nop,nop,TS val 396000873 ecr 396000873], length 0
2022-04-07 06:41:58.414854 IP (tos 0x0, ttl 64, id 1571, offset 0, flags [DF], proto TCP (6), length 3086)
    127.0.0.1.10850 > 127.0.0.1.36086: Flags [P.], cksum 0x0a03 (incorrect -> 0x89f0), seq 13:3047, ack 531, win 512, options [nop,nop,TS val 396000917 ecr 396000873], length 3034
2022-04-07 06:41:58.414862 IP (tos 0x0, ttl 64, id 21878, offset 0, flags [DF], proto TCP (6), length 52)
    127.0.0.1.36086 > 127.0.0.1.10850: Flags [.], cksum 0xfe28 (incorrect -> 0x2497), seq 531, ack 3047, win 496, options [nop,nop,TS val 396000917 ecr 396000917], length 0
2022-04-07 06:41:58.415348 IP (tos 0x0, ttl 64, id 21879, offset 0, flags [DF], proto TCP (6), length 132)
    127.0.0.1.36086 > 127.0.0.1.10850: Flags [P.], cksum 0xfe78 (incorrect -> 0x5e8b), seq 531:611, ack 3047, win 512, options [nop,nop,TS val 396000918 ecr 396000917], length 80
2022-04-07 06:41:58.415357 IP (tos 0x0, ttl 64, id 1572, offset 0, flags [DF], proto TCP (6), length 52)
    127.0.0.1.10850 > 127.0.0.1.36086: Flags [.], cksum 0xfe28 (incorrect -> 0x2435), seq 3047, ack 611, win 512, options [nop,nop,TS val 396000918 ecr 396000918], length 0
2022-04-07 06:41:58.415702 IP (tos 0x0, ttl 64, id 21880, offset 0, flags [DF], proto TCP (6), length 412)
    127.0.0.1.36086 > 127.0.0.1.10850: Flags [P.], cksum 0xff90 (incorrect -> 0x0a38), seq 611:971, ack 3047, win 512, options [nop,nop,TS val 396000918 ecr 396000918], length 360
2022-04-07 06:41:58.415711 IP (tos 0x0, ttl 64, id 1573, offset 0, flags [DF], proto TCP (6), length 52)
    127.0.0.1.10850 > 127.0.0.1.36086: Flags [.], cksum 0xfe28 (incorrect -> 0x22cf), seq 3047, ack 971, win 510, options [nop,nop,TS val 396000918 ecr 396000918], length 0
200, 4.829741954803467, 0.3339271545410156