2022-04-07 00:39:20.999536 IP (tos 0x0, ttl 64, id 21549, offset 0, flags [DF], proto TCP (6), length 60)
    127.0.0.1.33086 > 127.0.0.1.9550: Flags [S], cksum 0xfe30 (incorrect -> 0x9a6f), seq 2890320834, win 65495, options [mss 65495,sackOK,TS val 374243502 ecr 0,nop,wscale 7], length 0
2022-04-07 00:39:20.999557 IP (tos 0x0, ttl 64, id 0, offset 0, flags [DF], proto TCP (6), length 60)
    127.0.0.1.9550 > 127.0.0.1.33086: Flags [S.], cksum 0xfe30 (incorrect -> 0xbc83), seq 20071864, ack 2890320835, win 65483, options [mss 65495,sackOK,TS val 374243502 ecr 374243502,nop,wscale 7], length 0
2022-04-07 00:39:20.999572 IP (tos 0x0, ttl 64, id 21550, offset 0, flags [DF], proto TCP (6), length 52)
    127.0.0.1.33086 > 127.0.0.1.9550: Flags [.], cksum 0xfe28 (incorrect -> 0xe33f), seq 1, ack 1, win 512, options [nop,nop,TS val 374243502 ecr 374243502], length 0
2022-04-07 00:39:20.999732 IP (tos 0x0, ttl 64, id 21551, offset 0, flags [DF], proto TCP (6), length 55)
    127.0.0.1.33086 > 127.0.0.1.9550: Flags [P.], cksum 0xfe2b (incorrect -> 0xde33), seq 1:4, ack 1, win 512, options [nop,nop,TS val 374243502 ecr 374243502], length 3
2022-04-07 00:39:20.999742 IP (tos 0x0, ttl 64, id 52577, offset 0, flags [DF], proto TCP (6), length 52)
    127.0.0.1.9550 > 127.0.0.1.33086: Flags [.], cksum 0xfe28 (incorrect -> 0xe33c), seq 1, ack 4, win 512, options [nop,nop,TS val 374243502 ecr 374243502], length 0
2022-04-07 00:39:20.999769 IP (tos 0x0, ttl 64, id 52578, offset 0, flags [DF], proto TCP (6), length 54)
    127.0.0.1.9550 > 127.0.0.1.33086: Flags [P.], cksum 0xfe2a (incorrect -> 0xde32), seq 1:3, ack 4, win 512, options [nop,nop,TS val 374243502 ecr 374243502], length 2
2022-04-07 00:39:20.999777 IP (tos 0x0, ttl 64, id 21552, offset 0, flags [DF], proto TCP (6), length 52)
    127.0.0.1.33086 > 127.0.0.1.9550: Flags [.], cksum 0xfe28 (incorrect -> 0xe33a), seq 4, ack 3, win 512, options [nop,nop,TS val 374243502 ecr 374243502], length 0
2022-04-07 00:39:21.001200 IP (tos 0x0, ttl 64, id 21553, offset 0, flags [DF], proto TCP (6), length 62)
    127.0.0.1.33086 > 127.0.0.1.9550: Flags [P.], cksum 0xfe32 (incorrect -> 0x94aa), seq 4:14, ack 3, win 512, options [nop,nop,TS val 374243504 ecr 374243502], length 10
2022-04-07 00:39:21.001220 IP (tos 0x0, ttl 64, id 52579, offset 0, flags [DF], proto TCP (6), length 52)
    127.0.0.1.9550 > 127.0.0.1.33086: Flags [.], cksum 0xfe28 (incorrect -> 0xe32c), seq 3, ack 14, win 512, options [nop,nop,TS val 374243504 ecr 374243504], length 0
2022-04-07 00:39:21.089279 IP (tos 0x0, ttl 64, id 52580, offset 0, flags [DF], proto TCP (6), length 62)
    127.0.0.1.9550 > 127.0.0.1.33086: Flags [P.], cksum 0xfe32 (incorrect -> 0xddc1), seq 3:13, ack 14, win 512, options [nop,nop,TS val 374243592 ecr 374243504], length 10
2022-04-07 00:39:21.089289 IP (tos 0x0, ttl 64, id 21554, offset 0, flags [DF], proto TCP (6), length 52)
    127.0.0.1.33086 > 127.0.0.1.9550: Flags [.], cksum 0xfe28 (incorrect -> 0xe272), seq 14, ack 13, win 512, options [nop,nop,TS val 374243592 ecr 374243592], length 0
2022-04-07 00:39:21.094945 IP (tos 0x0, ttl 64, id 21555, offset 0, flags [DF], proto TCP (6), length 569)
    127.0.0.1.33086 > 127.0.0.1.9550: Flags [P.], cksum 0x002e (incorrect -> 0x3b4d), seq 14:531, ack 13, win 512, options [nop,nop,TS val 374243597 ecr 374243592], length 517
2022-04-07 00:39:21.094957 IP (tos 0x0, ttl 64, id 52581, offset 0, flags [DF], proto TCP (6), length 52)
    127.0.0.1.9550 > 127.0.0.1.33086: Flags [.], cksum 0xfe28 (incorrect -> 0xe067), seq 13, ack 531, win 508, options [nop,nop,TS val 374243597 ecr 374243597], length 0
200, 4.693510055541992, 0.6050698757171631