2022-04-07 16:18:26.484755 IP (tos 0x0, ttl 64, id 37992, offset 0, flags [DF], proto TCP (6), length 60)
    127.0.0.1.45608 > 127.0.0.1.9750: Flags [S], cksum 0xfe30 (incorrect -> 0x041d), seq 2087362980, win 65495, options [mss 65495,sackOK,TS val 3504506036 ecr 0,nop,wscale 7], length 0
2022-04-07 16:18:26.484769 IP (tos 0x0, ttl 64, id 0, offset 0, flags [DF], proto TCP (6), length 60)
    127.0.0.1.9750 > 127.0.0.1.45608: Flags [S.], cksum 0xfe30 (incorrect -> 0xcca8), seq 2039703620, ack 2087362981, win 65483, options [mss 65495,sackOK,TS val 3504506036 ecr 3504506036,nop,wscale 7], length 0
2022-04-07 16:18:26.484781 IP (tos 0x0, ttl 64, id 37993, offset 0, flags [DF], proto TCP (6), length 52)
    127.0.0.1.45608 > 127.0.0.1.9750: Flags [.], cksum 0xfe28 (incorrect -> 0xf364), seq 1, ack 1, win 512, options [nop,nop,TS val 3504506036 ecr 3504506036], length 0
2022-04-07 16:18:26.484908 IP (tos 0x0, ttl 64, id 37994, offset 0, flags [DF], proto TCP (6), length 55)
    127.0.0.1.45608 > 127.0.0.1.9750: Flags [P.], cksum 0xfe2b (incorrect -> 0xee58), seq 1:4, ack 1, win 512, options [nop,nop,TS val 3504506036 ecr 3504506036], length 3
2022-04-07 16:18:26.484921 IP (tos 0x0, ttl 64, id 53364, offset 0, flags [DF], proto TCP (6), length 52)
    127.0.0.1.9750 > 127.0.0.1.45608: Flags [.], cksum 0xfe28 (incorrect -> 0xf361), seq 1, ack 4, win 512, options [nop,nop,TS val 3504506036 ecr 3504506036], length 0
2022-04-07 16:18:26.484957 IP (tos 0x0, ttl 64, id 53365, offset 0, flags [DF], proto TCP (6), length 54)
    127.0.0.1.9750 > 127.0.0.1.45608: Flags [P.], cksum 0xfe2a (incorrect -> 0xee57), seq 1:3, ack 4, win 512, options [nop,nop,TS val 3504506036 ecr 3504506036], length 2
2022-04-07 16:18:26.484969 IP (tos 0x0, ttl 64, id 37995, offset 0, flags [DF], proto TCP (6), length 52)
    127.0.0.1.45608 > 127.0.0.1.9750: Flags [.], cksum 0xfe28 (incorrect -> 0xf35f), seq 4, ack 3, win 512, options [nop,nop,TS val 3504506036 ecr 3504506036], length 0
2022-04-07 16:18:26.496255 IP (tos 0x0, ttl 64, id 37996, offset 0, flags [DF], proto TCP (6), length 62)
    127.0.0.1.45608 > 127.0.0.1.9750: Flags [P.], cksum 0xfe32 (incorrect -> 0x4bb2), seq 4:14, ack 3, win 512, options [nop,nop,TS val 3504506048 ecr 3504506036], length 10
2022-04-07 16:18:26.496273 IP (tos 0x0, ttl 64, id 53366, offset 0, flags [DF], proto TCP (6), length 52)
    127.0.0.1.9750 > 127.0.0.1.45608: Flags [.], cksum 0xfe28 (incorrect -> 0xf33d), seq 3, ack 14, win 512, options [nop,nop,TS val 3504506048 ecr 3504506048], length 0
2022-04-07 16:18:26.558380 IP (tos 0x0, ttl 64, id 53367, offset 0, flags [DF], proto TCP (6), length 62)
    127.0.0.1.9750 > 127.0.0.1.45608: Flags [P.], cksum 0xfe32 (incorrect -> 0xedec), seq 3:13, ack 14, win 512, options [nop,nop,TS val 3504506110 ecr 3504506048], length 10
2022-04-07 16:18:26.558388 IP (tos 0x0, ttl 64, id 37997, offset 0, flags [DF], proto TCP (6), length 52)
    127.0.0.1.45608 > 127.0.0.1.9750: Flags [.], cksum 0xfe28 (incorrect -> 0xf2b7), seq 14, ack 13, win 512, options [nop,nop,TS val 3504506110 ecr 3504506110], length 0
2022-04-07 16:18:26.564111 IP (tos 0x0, ttl 64, id 37998, offset 0, flags [DF], proto TCP (6), length 569)
    127.0.0.1.45608 > 127.0.0.1.9750: Flags [P.], cksum 0x002e (incorrect -> 0x6b87), seq 14:531, ack 13, win 512, options [nop,nop,TS val 3504506115 ecr 3504506110], length 517
2022-04-07 16:18:26.564118 IP (tos 0x0, ttl 64, id 53368, offset 0, flags [DF], proto TCP (6), length 52)
    127.0.0.1.9750 > 127.0.0.1.45608: Flags [.], cksum 0xfe28 (incorrect -> 0xf0ac), seq 13, ack 531, win 508, options [nop,nop,TS val 3504506115 ecr 3504506115], length 0
2022-04-07 16:18:26.626335 IP (tos 0x0, ttl 64, id 53369, offset 0, flags [DF], proto TCP (6), length 3538)
    127.0.0.1.9750 > 127.0.0.1.45608: Flags [P.], cksum 0x0bc7 (incorrect -> 0x6ea5), seq 13:3499, ack 531, win 512, options [nop,nop,TS val 3504506178 ecr 3504506115], length 3486
2022-04-07 16:18:26.626342 IP (tos 0x0, ttl 64, id 37999, offset 0, flags [DF], proto TCP (6), length 52)
    127.0.0.1.45608 > 127.0.0.1.9750: Flags [.], cksum 0xfe28 (incorrect -> 0xe29e), seq 531, ack 3499, win 494, options [nop,nop,TS val 3504506178 ecr 3504506178], length 0
200, 4.488701820373535, 0.3539869785308838