2022-04-07 04:28:28.729306 IP (tos 0x0, ttl 64, id 26581, offset 0, flags [DF], proto TCP (6), length 60)
    127.0.0.1.41528 > 127.0.0.1.10250: Flags [S], cksum 0xfe30 (incorrect -> 0xee85), seq 334505321, win 65495, options [mss 65495,sackOK,TS val 387991232 ecr 0,nop,wscale 7], length 0
2022-04-07 04:28:28.729316 IP (tos 0x0, ttl 64, id 0, offset 0, flags [DF], proto TCP (6), length 60)
    127.0.0.1.10250 > 127.0.0.1.41528: Flags [S.], cksum 0xfe30 (incorrect -> 0xc98a), seq 1240628515, ack 334505322, win 65483, options [mss 65495,sackOK,TS val 387991232 ecr 387991232,nop,wscale 7], length 0
2022-04-07 04:28:28.729324 IP (tos 0x0, ttl 64, id 26582, offset 0, flags [DF], proto TCP (6), length 52)
    127.0.0.1.41528 > 127.0.0.1.10250: Flags [.], cksum 0xfe28 (incorrect -> 0xf046), seq 1, ack 1, win 512, options [nop,nop,TS val 387991232 ecr 387991232], length 0
2022-04-07 04:28:28.729465 IP (tos 0x0, ttl 64, id 26583, offset 0, flags [DF], proto TCP (6), length 55)
    127.0.0.1.41528 > 127.0.0.1.10250: Flags [P.], cksum 0xfe2b (incorrect -> 0xeb3a), seq 1:4, ack 1, win 512, options [nop,nop,TS val 387991232 ecr 387991232], length 3
2022-04-07 04:28:28.729475 IP (tos 0x0, ttl 64, id 49247, offset 0, flags [DF], proto TCP (6), length 52)
    127.0.0.1.10250 > 127.0.0.1.41528: Flags [.], cksum 0xfe28 (incorrect -> 0xf043), seq 1, ack 4, win 512, options [nop,nop,TS val 387991232 ecr 387991232], length 0
2022-04-07 04:28:28.729526 IP (tos 0x0, ttl 64, id 49248, offset 0, flags [DF], proto TCP (6), length 54)
    127.0.0.1.10250 > 127.0.0.1.41528: Flags [P.], cksum 0xfe2a (incorrect -> 0xeb39), seq 1:3, ack 4, win 512, options [nop,nop,TS val 387991232 ecr 387991232], length 2
2022-04-07 04:28:28.729536 IP (tos 0x0, ttl 64, id 26584, offset 0, flags [DF], proto TCP (6), length 52)
    127.0.0.1.41528 > 127.0.0.1.10250: Flags [.], cksum 0xfe28 (incorrect -> 0xf041), seq 4, ack 3, win 512, options [nop,nop,TS val 387991232 ecr 387991232], length 0
200, 6.478468656539917, 0.7054555416107178