2022-04-07 08:16:08.764064 IP (tos 0x0, ttl 64, id 36269, offset 0, flags [DF], proto TCP (6), length 60)
    127.0.0.1.47012 > 127.0.0.1.10650: Flags [S], cksum 0xfe30 (incorrect -> 0x5fab), seq 1868353928, win 65495, options [mss 65495,sackOK,TS val 401651266 ecr 0,nop,wscale 7], length 0
2022-04-07 08:16:08.764075 IP (tos 0x0, ttl 64, id 0, offset 0, flags [DF], proto TCP (6), length 60)
    127.0.0.1.10650 > 127.0.0.1.47012: Flags [S.], cksum 0xfe30 (incorrect -> 0x5b73), seq 3534840653, ack 1868353929, win 65483, options [mss 65495,sackOK,TS val 401651267 ecr 401651266,nop,wscale 7], length 0
2022-04-07 08:16:08.764083 IP (tos 0x0, ttl 64, id 36270, offset 0, flags [DF], proto TCP (6), length 52)
    127.0.0.1.47012 > 127.0.0.1.10650: Flags [.], cksum 0xfe28 (incorrect -> 0x822e), seq 1, ack 1, win 512, options [nop,nop,TS val 401651267 ecr 401651267], length 0
2022-04-07 08:16:08.764171 IP (tos 0x0, ttl 64, id 36271, offset 0, flags [DF], proto TCP (6), length 55)
    127.0.0.1.47012 > 127.0.0.1.10650: Flags [P.], cksum 0xfe2b (incorrect -> 0x7d22), seq 1:4, ack 1, win 512, options [nop,nop,TS val 401651267 ecr 401651267], length 3
2022-04-07 08:16:08.764177 IP (tos 0x0, ttl 64, id 3815, offset 0, flags [DF], proto TCP (6), length 52)
    127.0.0.1.10650 > 127.0.0.1.47012: Flags [.], cksum 0xfe28 (incorrect -> 0x822b), seq 1, ack 4, win 512, options [nop,nop,TS val 401651267 ecr 401651267], length 0
2022-04-07 08:16:08.764271 IP (tos 0x0, ttl 64, id 3816, offset 0, flags [DF], proto TCP (6), length 54)
    127.0.0.1.10650 > 127.0.0.1.47012: Flags [P.], cksum 0xfe2a (incorrect -> 0x7d21), seq 1:3, ack 4, win 512, options [nop,nop,TS val 401651267 ecr 401651267], length 2
2022-04-07 08:16:08.764285 IP (tos 0x0, ttl 64, id 36272, offset 0, flags [DF], proto TCP (6), length 52)
    127.0.0.1.47012 > 127.0.0.1.10650: Flags [.], cksum 0xfe28 (incorrect -> 0x8229), seq 4, ack 3, win 512, options [nop,nop,TS val 401651267 ecr 401651267], length 0
2022-04-07 08:16:08.766402 IP (tos 0x0, ttl 64, id 36273, offset 0, flags [DF], proto TCP (6), length 62)
    127.0.0.1.47012 > 127.0.0.1.10650: Flags [P.], cksum 0xfe32 (incorrect -> 0x29e3), seq 4:14, ack 3, win 512, options [nop,nop,TS val 401651269 ecr 401651267], length 10
2022-04-07 08:16:08.766411 IP (tos 0x0, ttl 64, id 3817, offset 0, flags [DF], proto TCP (6), length 52)
    127.0.0.1.10650 > 127.0.0.1.47012: Flags [.], cksum 0xfe28 (incorrect -> 0x821b), seq 3, ack 14, win 512, options [nop,nop,TS val 401651269 ecr 401651269], length 0
2022-04-07 08:16:08.874089 IP (tos 0x0, ttl 64, id 3818, offset 0, flags [DF], proto TCP (6), length 62)
    127.0.0.1.10650 > 127.0.0.1.47012: Flags [P.], cksum 0xfe32 (incorrect -> 0x7c9c), seq 3:13, ack 14, win 512, options [nop,nop,TS val 401651377 ecr 401651269], length 10
2022-04-07 08:16:08.874101 IP (tos 0x0, ttl 64, id 36274, offset 0, flags [DF], proto TCP (6), length 52)
    127.0.0.1.47012 > 127.0.0.1.10650: Flags [.], cksum 0xfe28 (incorrect -> 0x8139), seq 14, ack 13, win 512, options [nop,nop,TS val 401651377 ecr 401651377], length 0
2022-04-07 08:16:08.879862 IP (tos 0x0, ttl 64, id 36275, offset 0, flags [DF], proto TCP (6), length 569)
    127.0.0.1.47012 > 127.0.0.1.10650: Flags [P.], cksum 0x002e (incorrect -> 0xdd71), seq 14:531, ack 13, win 512, options [nop,nop,TS val 401651382 ecr 401651377], length 517
2022-04-07 08:16:08.879872 IP (tos 0x0, ttl 64, id 3819, offset 0, flags [DF], proto TCP (6), length 52)
    127.0.0.1.10650 > 127.0.0.1.47012: Flags [.], cksum 0xfe28 (incorrect -> 0x7f2e), seq 13, ack 531, win 508, options [nop,nop,TS val 401651382 ecr 401651382], length 0
2022-04-07 08:16:08.957965 IP (tos 0x0, ttl 64, id 3820, offset 0, flags [DF], proto TCP (6), length 3538)
    127.0.0.1.10650 > 127.0.0.1.47012: Flags [P.], cksum 0x0bc7 (incorrect -> 0x0faf), seq 13:3499, ack 531, win 512, options [nop,nop,TS val 401651460 ecr 401651382], length 3486
2022-04-07 08:16:08.957974 IP (tos 0x0, ttl 64, id 36276, offset 0, flags [DF], proto TCP (6), length 52)
    127.0.0.1.47012 > 127.0.0.1.10650: Flags [.], cksum 0xfe28 (incorrect -> 0x7102), seq 531, ack 3499, win 494, options [nop,nop,TS val 401651460 ecr 401651460], length 0
2022-04-07 08:16:08.979055 IP (tos 0x0, ttl 64, id 3821, offset 0, flags [DF], proto TCP (6), length 272)
    127.0.0.1.10650 > 127.0.0.1.47012: Flags [P.], cksum 0xff04 (incorrect -> 0x4f9c), seq 3499:3719, ack 531, win 512, options [nop,nop,TS val 401651481 ecr 401651460], length 220
2022-04-07 08:16:08.979064 IP (tos 0x0, ttl 64, id 36277, offset 0, flags [DF], proto TCP (6), length 52)
    127.0.0.1.47012 > 127.0.0.1.10650: Flags [.], cksum 0xfe28 (incorrect -> 0x6fee), seq 531, ack 3719, win 507, options [nop,nop,TS val 401651482 ecr 401651481], length 0
2022-04-07 08:16:08.979128 IP (tos 0x0, ttl 64, id 36278, offset 0, flags [DF], proto TCP (6), length 132)
    127.0.0.1.47012 > 127.0.0.1.10650: Flags [P.], cksum 0xfe78 (incorrect -> 0x34e6), seq 531:611, ack 3719, win 507, options [nop,nop,TS val 401651482 ecr 401651481], length 80
2022-04-07 08:16:08.979136 IP (tos 0x0, ttl 64, id 3822, offset 0, flags [DF], proto TCP (6), length 52)
    127.0.0.1.10650 > 127.0.0.1.47012: Flags [.], cksum 0xfe28 (incorrect -> 0x6f98), seq 3719, ack 611, win 512, options [nop,nop,TS val 401651482 ecr 401651482], length 0
2022-04-07 08:16:08.979471 IP (tos 0x0, ttl 64, id 36279, offset 0, flags [DF], proto TCP (6), length 391)
    127.0.0.1.47012 > 127.0.0.1.10650: Flags [P.], cksum 0xff7b (incorrect -> 0x4873), seq 611:950, ack 3719, win 507, options [nop,nop,TS val 401651482 ecr 401651482], length 339
2022-04-07 08:16:08.979481 IP (tos 0x0, ttl 64, id 3823, offset 0, flags [DF], proto TCP (6), length 52)
    127.0.0.1.10650 > 127.0.0.1.47012: Flags [.], cksum 0xfe28 (incorrect -> 0x6e47), seq 3719, ack 950, win 510, options [nop,nop,TS val 401651482 ecr 401651482], length 0
2022-04-07 08:16:09.586039 IP (tos 0x0, ttl 64, id 3824, offset 0, flags [DF], proto TCP (6), length 1736)
    127.0.0.1.10650 > 127.0.0.1.47012: Flags [P.], cksum 0x04bd (incorrect -> 0x82ad), seq 3719:5403, ack 950, win 512, options [nop,nop,TS val 401652088 ecr 401651482], length 1684
2022-04-07 08:16:09.586050 IP (tos 0x0, ttl 64, id 36280, offset 0, flags [DF], proto TCP (6), length 52)
    127.0.0.1.47012 > 127.0.0.1.10650: Flags [.], cksum 0xfe28 (incorrect -> 0x6300), seq 950, ack 5403, win 501, options [nop,nop,TS val 401652088 ecr 401652088], length 0
2022-04-07 08:16:09.683220 IP (tos 0x0, ttl 64, id 3825, offset 0, flags [DF], proto TCP (6), length 3538)
    127.0.0.1.10650 > 127.0.0.1.47012: Flags [P.], cksum 0x0bc7 (incorrect -> 0xf7a3), seq 5403:8889, ack 950, win 512, options [nop,nop,TS val 401652186 ecr 401652088], length 3486
2022-04-07 08:16:09.683231 IP (tos 0x0, ttl 64, id 36281, offset 0, flags [DF], proto TCP (6), length 52)
    127.0.0.1.47012 > 127.0.0.1.10650: Flags [.], cksum 0xfe28 (incorrect -> 0x54a5), seq 950, ack 8889, win 494, options [nop,nop,TS val 401652186 ecr 401652186], length 0
2022-04-07 08:16:09.685783 IP (tos 0x0, ttl 64, id 3826, offset 0, flags [DF], proto TCP (6), length 4100)
    127.0.0.1.10650 > 127.0.0.1.47012: Flags [P.], cksum 0x0df9 (incorrect -> 0x14c4), seq 8889:12937, ack 950, win 512, options [nop,nop,TS val 401652188 ecr 401652186], length 4048
2022-04-07 08:16:09.685797 IP (tos 0x0, ttl 64, id 36282, offset 0, flags [DF], proto TCP (6), length 52)
    127.0.0.1.47012 > 127.0.0.1.10650: Flags [.], cksum 0xfe28 (incorrect -> 0x44d3), seq 950, ack 12937, win 492, options [nop,nop,TS val 401652188 ecr 401652188], length 0
2022-04-07 08:16:09.685890 IP (tos 0x0, ttl 64, id 3827, offset 0, flags [DF], proto TCP (6), length 486)
    127.0.0.1.10650 > 127.0.0.1.47012: Flags [P.], cksum 0xffda (incorrect -> 0xa048), seq 12937:13371, ack 950, win 512, options [nop,nop,TS val 401652188 ecr 401652188], length 434
2022-04-07 08:16:09.685897 IP (tos 0x0, ttl 64, id 36283, offset 0, flags [DF], proto TCP (6), length 52)
    127.0.0.1.47012 > 127.0.0.1.10650: Flags [.], cksum 0xfe28 (incorrect -> 0x4313), seq 950, ack 13371, win 506, options [nop,nop,TS val 401652188 ecr 401652188], length 0
2022-04-07 08:16:09.698392 IP (tos 0x0, ttl 64, id 3828, offset 0, flags [DF], proto TCP (6), length 4100)
    127.0.0.1.10650 > 127.0.0.1.47012: Flags [P.], cksum 0x0df9 (incorrect -> 0x9318), seq 13371:17419, ack 950, win 512, options [nop,nop,TS val 401652201 ecr 401652188], length 4048
2022-04-07 08:16:09.698401 IP (tos 0x0, ttl 64, id 36284, offset 0, flags [DF], proto TCP (6), length 52)
    127.0.0.1.47012 > 127.0.0.1.10650: Flags [.], cksum 0xfe28 (incorrect -> 0x3337), seq 950, ack 17419, win 492, options [nop,nop,TS val 401652201 ecr 401652201], length 0
2022-04-07 08:16:09.698747 IP (tos 0x0, ttl 64, id 3829, offset 0, flags [DF], proto TCP (6), length 182)
    127.0.0.1.10650 > 127.0.0.1.47012: Flags [P.], cksum 0xfeaa (incorrect -> 0x2de2), seq 17419:17549, ack 950, win 512, options [nop,nop,TS val 401652201 ecr 401652201], length 130
2022-04-07 08:16:09.698754 IP (tos 0x0, ttl 64, id 36285, offset 0, flags [DF], proto TCP (6), length 52)
    127.0.0.1.47012 > 127.0.0.1.10650: Flags [.], cksum 0xfe28 (incorrect -> 0x32a6), seq 950, ack 17549, win 507, options [nop,nop,TS val 401652201 ecr 401652201], length 0
2022-04-07 08:16:09.705195 IP (tos 0x0, ttl 64, id 3830, offset 0, flags [DF], proto TCP (6), length 4100)
    127.0.0.1.10650 > 127.0.0.1.47012: Flags [P.], cksum 0x0df9 (incorrect -> 0x8289), seq 17549:21597, ack 950, win 512, options [nop,nop,TS val 401652208 ecr 401652201], length 4048
2022-04-07 08:16:09.705203 IP (tos 0x0, ttl 64, id 36286, offset 0, flags [DF], proto TCP (6), length 52)
    127.0.0.1.47012 > 127.0.0.1.10650: Flags [.], cksum 0xfe28 (incorrect -> 0x22d7), seq 950, ack 21597, win 492, options [nop,nop,TS val 401652208 ecr 401652208], length 0
2022-04-07 08:16:09.705254 IP (tos 0x0, ttl 64, id 3831, offset 0, flags [DF], proto TCP (6), length 908)
    127.0.0.1.10650 > 127.0.0.1.47012: Flags [P.], cksum 0x0181 (incorrect -> 0x9992), seq 21597:22453, ack 950, win 512, options [nop,nop,TS val 401652208 ecr 401652208], length 856
2022-04-07 08:16:09.705259 IP (tos 0x0, ttl 64, id 36287, offset 0, flags [DF], proto TCP (6), length 52)
    127.0.0.1.47012 > 127.0.0.1.10650: Flags [.], cksum 0xfe28 (incorrect -> 0x1f73), seq 950, ack 22453, win 504, options [nop,nop,TS val 401652208 ecr 401652208], length 0
2022-04-07 08:16:09.705468 IP (tos 0x0, ttl 64, id 3832, offset 0, flags [DF], proto TCP (6), length 3386)
    127.0.0.1.10650 > 127.0.0.1.47012: Flags [P.], cksum 0x0b2f (incorrect -> 0x835a), seq 22453:25787, ack 950, win 512, options [nop,nop,TS val 401652208 ecr 401652208], length 3334
2022-04-07 08:16:09.705476 IP (tos 0x0, ttl 64, id 36288, offset 0, flags [DF], proto TCP (6), length 52)
    127.0.0.1.47012 > 127.0.0.1.10650: Flags [.], cksum 0xfe28 (incorrect -> 0x1277), seq 950, ack 25787, win 494, options [nop,nop,TS val 401652208 ecr 401652208], length 0
2022-04-07 08:16:09.705535 IP (tos 0x0, ttl 64, id 3833, offset 0, flags [DF], proto TCP (6), length 3960)
    127.0.0.1.10650 > 127.0.0.1.47012: Flags [P.], cksum 0x0d6d (incorrect -> 0x0cc9), seq 25787:29695, ack 950, win 512, options [nop,nop,TS val 401652208 ecr 401652208], length 3908
2022-04-07 08:16:09.705562 IP (tos 0x0, ttl 64, id 36289, offset 0, flags [DF], proto TCP (6), length 52)
    127.0.0.1.47012 > 127.0.0.1.10650: Flags [.], cksum 0xfe28 (incorrect -> 0x0321), seq 950, ack 29695, win 512, options [nop,nop,TS val 401652208 ecr 401652208], length 0
2022-04-07 08:16:09.708750 IP (tos 0x0, ttl 64, id 3834, offset 0, flags [DF], proto TCP (6), length 2466)
    127.0.0.1.10650 > 127.0.0.1.47012: Flags [P.], cksum 0x0797 (incorrect -> 0x2189), seq 29695:32109, ack 950, win 512, options [nop,nop,TS val 401652211 ecr 401652208], length 2414
2022-04-07 08:16:09.708940 IP (tos 0x0, ttl 64, id 36290, offset 0, flags [DF], proto TCP (6), length 52)
    127.0.0.1.47012 > 127.0.0.1.10650: Flags [.], cksum 0xfe28 (incorrect -> 0xf9ac), seq 950, ack 32109, win 512, options [nop,nop,TS val 401652211 ecr 401652211], length 0
2022-04-07 08:16:09.719174 IP (tos 0x0, ttl 64, id 3835, offset 0, flags [DF], proto TCP (6), length 3462)
    127.0.0.1.10650 > 127.0.0.1.47012: Flags [P.], cksum 0x0b7b (incorrect -> 0x1f4b), seq 32109:35519, ack 950, win 512, options [nop,nop,TS val 401652222 ecr 401652211], length 3410
2022-04-07 08:16:09.719207 IP (tos 0x0, ttl 64, id 36291, offset 0, flags [DF], proto TCP (6), length 52)
    127.0.0.1.47012 > 127.0.0.1.10650: Flags [.], cksum 0xfe28 (incorrect -> 0xec44), seq 950, ack 35519, win 512, options [nop,nop,TS val 401652222 ecr 401652222], length 0
2022-04-07 08:16:09.733089 IP (tos 0x0, ttl 64, id 3836, offset 0, flags [DF], proto TCP (6), length 3388)
    127.0.0.1.10650 > 127.0.0.1.47012: Flags [P.], cksum 0x0b31 (incorrect -> 0x95b0), seq 35519:38855, ack 950, win 512, options [nop,nop,TS val 401652236 ecr 401652222], length 3336
2022-04-07 08:16:09.733130 IP (tos 0x0, ttl 64, id 36292, offset 0, flags [DF], proto TCP (6), length 52)
    127.0.0.1.47012 > 127.0.0.1.10650: Flags [.], cksum 0xfe28 (incorrect -> 0xdf20), seq 950, ack 38855, win 512, options [nop,nop,TS val 401652236 ecr 401652236], length 0
2022-04-07 08:16:09.773620 IP (tos 0x0, ttl 64, id 3837, offset 0, flags [DF], proto TCP (6), length 3538)
    127.0.0.1.10650 > 127.0.0.1.47012: Flags [P.], cksum 0x0bc7 (incorrect -> 0xf93f), seq 38855:42341, ack 950, win 512, options [nop,nop,TS val 401652276 ecr 401652236], length 3486
2022-04-07 08:16:09.773667 IP (tos 0x0, ttl 64, id 36293, offset 0, flags [DF], proto TCP (6), length 52)
    127.0.0.1.47012 > 127.0.0.1.10650: Flags [.], cksum 0xfe28 (incorrect -> 0xd132), seq 950, ack 42341, win 512, options [nop,nop,TS val 401652276 ecr 401652276], length 0
2022-04-07 08:16:09.773711 IP (tos 0x0, ttl 64, id 3838, offset 0, flags [DF], proto TCP (6), length 3386)
    127.0.0.1.10650 > 127.0.0.1.47012: Flags [P.], cksum 0x0b2f (incorrect -> 0x91c3), seq 42341:45675, ack 950, win 512, options [nop,nop,TS val 401652276 ecr 401652276], length 3334
2022-04-07 08:16:09.773735 IP (tos 0x0, ttl 64, id 36294, offset 0, flags [DF], proto TCP (6), length 52)
    127.0.0.1.47012 > 127.0.0.1.10650: Flags [.], cksum 0xfe28 (incorrect -> 0xc42c), seq 950, ack 45675, win 512, options [nop,nop,TS val 401652276 ecr 401652276], length 0
2022-04-07 08:16:09.785051 IP (tos 0x0, ttl 64, id 3839, offset 0, flags [DF], proto TCP (6), length 3960)
    127.0.0.1.10650 > 127.0.0.1.47012: Flags [P.], cksum 0x0d6d (incorrect -> 0x73a3), seq 45675:49583, ack 950, win 512, options [nop,nop,TS val 401652287 ecr 401652276], length 3908
2022-04-07 08:16:09.785087 IP (tos 0x0, ttl 64, id 36295, offset 0, flags [DF], proto TCP (6), length 52)
    127.0.0.1.47012 > 127.0.0.1.10650: Flags [.], cksum 0xfe28 (incorrect -> 0xb4d1), seq 950, ack 49583, win 512, options [nop,nop,TS val 401652288 ecr 401652287], length 0
2022-04-07 08:16:09.785852 IP (tos 0x0, ttl 64, id 3840, offset 0, flags [DF], proto TCP (6), length 3462)
    127.0.0.1.10650 > 127.0.0.1.47012: Flags [P.], cksum 0x0b7b (incorrect -> 0x51c4), seq 49583:52993, ack 950, win 512, options [nop,nop,TS val 401652288 ecr 401652288], length 3410
2022-04-07 08:16:09.786173 IP (tos 0x0, ttl 64, id 36296, offset 0, flags [DF], proto TCP (6), length 52)
    127.0.0.1.47012 > 127.0.0.1.10650: Flags [.], cksum 0xfe28 (incorrect -> 0xa77d), seq 950, ack 52993, win 512, options [nop,nop,TS val 401652289 ecr 401652288], length 0
2022-04-07 08:16:09.794928 IP (tos 0x0, ttl 64, id 3841, offset 0, flags [DF], proto TCP (6), length 1968)
    127.0.0.1.10650 > 127.0.0.1.47012: Flags [P.], cksum 0x05a5 (incorrect -> 0xb49d), seq 52993:54909, ack 950, win 512, options [nop,nop,TS val 401652297 ecr 401652289], length 1916
2022-04-07 08:16:09.794957 IP (tos 0x0, ttl 64, id 36297, offset 0, flags [DF], proto TCP (6), length 52)
    127.0.0.1.47012 > 127.0.0.1.10650: Flags [.], cksum 0xfe28 (incorrect -> 0x9ff0), seq 950, ack 54909, win 512, options [nop,nop,TS val 401652297 ecr 401652297], length 0
2022-04-07 08:16:09.798934 IP (tos 0x0, ttl 64, id 3842, offset 0, flags [DF], proto TCP (6), length 3486)
    127.0.0.1.10650 > 127.0.0.1.47012: Flags [P.], cksum 0x0b93 (incorrect -> 0xe82d), seq 54909:58343, ack 950, win 512, options [nop,nop,TS val 401652301 ecr 401652297], length 3434
2022-04-07 08:16:09.799089 IP (tos 0x0, ttl 64, id 36298, offset 0, flags [DF], proto TCP (6), length 52)
    127.0.0.1.47012 > 127.0.0.1.10650: Flags [.], cksum 0xfe28 (incorrect -> 0x927d), seq 950, ack 58343, win 512, options [nop,nop,TS val 401652302 ecr 401652301], length 0
2022-04-07 08:16:10.347452 IP (tos 0x0, ttl 64, id 3843, offset 0, flags [DF], proto TCP (6), length 602)
    127.0.0.1.10650 > 127.0.0.1.47012: Flags [P.], cksum 0x004f (incorrect -> 0x7823), seq 58343:58893, ack 950, win 512, options [nop,nop,TS val 401652850 ecr 401652302], length 550
2022-04-07 08:16:10.347470 IP (tos 0x0, ttl 64, id 36299, offset 0, flags [DF], proto TCP (6), length 52)
    127.0.0.1.47012 > 127.0.0.1.10650: Flags [.], cksum 0xfe28 (incorrect -> 0x8c12), seq 950, ack 58893, win 508, options [nop,nop,TS val 401652850 ecr 401652850], length 0
2022-04-07 08:16:10.348581 IP (tos 0x0, ttl 64, id 3844, offset 0, flags [DF], proto TCP (6), length 3174)
    127.0.0.1.10650 > 127.0.0.1.47012: Flags [P.], cksum 0x0a5b (incorrect -> 0x4400), seq 58893:62015, ack 950, win 512, options [nop,nop,TS val 401652851 ecr 401652850], length 3122
2022-04-07 08:16:10.348588 IP (tos 0x0, ttl 64, id 36300, offset 0, flags [DF], proto TCP (6), length 52)
    127.0.0.1.47012 > 127.0.0.1.10650: Flags [.], cksum 0xfe28 (incorrect -> 0x7feb), seq 950, ack 62015, win 495, options [nop,nop,TS val 401652851 ecr 401652851], length 0
2022-04-07 08:16:10.348706 IP (tos 0x0, ttl 64, id 3845, offset 0, flags [DF], proto TCP (6), length 3424)
    127.0.0.1.10650 > 127.0.0.1.47012: Flags [P.], cksum 0x0b55 (incorrect -> 0x726e), seq 62015:65387, ack 950, win 512, options [nop,nop,TS val 401652851 ecr 401652851], length 3372
2022-04-07 08:16:10.348713 IP (tos 0x0, ttl 64, id 36301, offset 0, flags [DF], proto TCP (6), length 52)
    127.0.0.1.47012 > 127.0.0.1.10650: Flags [.], cksum 0xfe28 (incorrect -> 0x72c0), seq 950, ack 65387, win 494, options [nop,nop,TS val 401652851 ecr 401652851], length 0
2022-04-07 08:16:10.362374 IP (tos 0x0, ttl 64, id 3846, offset 0, flags [DF], proto TCP (6), length 1546)
    127.0.0.1.10650 > 127.0.0.1.47012: Flags [P.], cksum 0x03ff (incorrect -> 0x4d76), seq 65387:66881, ack 950, win 512, options [nop,nop,TS val 401652865 ecr 401652851], length 1494
2022-04-07 08:16:10.362383 IP (tos 0x0, ttl 64, id 36302, offset 0, flags [DF], proto TCP (6), length 52)
    127.0.0.1.47012 > 127.0.0.1.10650: Flags [.], cksum 0xfe28 (incorrect -> 0x6cc6), seq 950, ack 66881, win 502, options [nop,nop,TS val 401652865 ecr 401652865], length 0
2022-04-07 08:16:10.366402 IP (tos 0x0, ttl 64, id 3847, offset 0, flags [DF], proto TCP (6), length 3424)
    127.0.0.1.10650 > 127.0.0.1.47012: Flags [P.], cksum 0x0b55 (incorrect -> 0x1a17), seq 66881:70253, ack 950, win 512, options [nop,nop,TS val 401652869 ecr 401652865], length 3372
2022-04-07 08:16:10.366410 IP (tos 0x0, ttl 64, id 36303, offset 0, flags [DF], proto TCP (6), length 52)
    127.0.0.1.47012 > 127.0.0.1.10650: Flags [.], cksum 0xfe28 (incorrect -> 0x5f9a), seq 950, ack 70253, win 494, options [nop,nop,TS val 401652869 ecr 401652869], length 0
2022-04-07 08:16:10.366480 IP (tos 0x0, ttl 64, id 3848, offset 0, flags [DF], proto TCP (6), length 3048)
    127.0.0.1.10650 > 127.0.0.1.47012: Flags [P.], cksum 0x09dd (incorrect -> 0x777b), seq 70253:73249, ack 950, win 512, options [nop,nop,TS val 401652869 ecr 401652869], length 2996
2022-04-07 08:16:10.366485 IP (tos 0x0, ttl 64, id 36304, offset 0, flags [DF], proto TCP (6), length 52)
    127.0.0.1.47012 > 127.0.0.1.10650: Flags [.], cksum 0xfe28 (incorrect -> 0x53f1), seq 950, ack 73249, win 483, options [nop,nop,TS val 401652869 ecr 401652869], length 0
2022-04-07 08:16:10.368782 IP (tos 0x0, ttl 64, id 3849, offset 0, flags [DF], proto TCP (6), length 2542)
    127.0.0.1.10650 > 127.0.0.1.47012: Flags [P.], cksum 0x07e3 (incorrect -> 0x9476), seq 73249:75739, ack 950, win 512, options [nop,nop,TS val 401652871 ecr 401652869], length 2490
2022-04-07 08:16:10.368789 IP (tos 0x0, ttl 64, id 36305, offset 0, flags [DF], proto TCP (6), length 52)
    127.0.0.1.47012 > 127.0.0.1.10650: Flags [.], cksum 0xfe28 (incorrect -> 0x4a24), seq 950, ack 75739, win 498, options [nop,nop,TS val 401652871 ecr 401652871], length 0
2022-04-07 08:16:10.370256 IP (tos 0x0, ttl 64, id 3850, offset 0, flags [DF], proto TCP (6), length 3922)
    127.0.0.1.10650 > 127.0.0.1.47012: Flags [P.], cksum 0x0d47 (incorrect -> 0xd033), seq 75739:79609, ack 950, win 512, options [nop,nop,TS val 401652873 ecr 401652871], length 3870
2022-04-07 08:16:10.370263 IP (tos 0x0, ttl 64, id 36306, offset 0, flags [DF], proto TCP (6), length 52)
    127.0.0.1.47012 > 127.0.0.1.10650: Flags [.], cksum 0xfe28 (incorrect -> 0x3b08), seq 950, ack 79609, win 492, options [nop,nop,TS val 401652873 ecr 401652873], length 0
2022-04-07 08:16:10.376371 IP (tos 0x0, ttl 64, id 3851, offset 0, flags [DF], proto TCP (6), length 3424)
    127.0.0.1.10650 > 127.0.0.1.47012: Flags [P.], cksum 0x0b55 (incorrect -> 0x75e8), seq 79609:82981, ack 950, win 512, options [nop,nop,TS val 401652879 ecr 401652873], length 3372
2022-04-07 08:16:10.376388 IP (tos 0x0, ttl 64, id 36307, offset 0, flags [DF], proto TCP (6), length 52)
    127.0.0.1.47012 > 127.0.0.1.10650: Flags [.], cksum 0xfe28 (incorrect -> 0x2dbc), seq 950, ack 82981, win 512, options [nop,nop,TS val 401652879 ecr 401652879], length 0
2022-04-07 08:16:10.378048 IP (tos 0x0, ttl 64, id 3852, offset 0, flags [DF], proto TCP (6), length 3922)
    127.0.0.1.10650 > 127.0.0.1.47012: Flags [P.], cksum 0x0d47 (incorrect -> 0x442c), seq 82981:86851, ack 950, win 512, options [nop,nop,TS val 401652880 ecr 401652879], length 3870
2022-04-07 08:16:10.378303 IP (tos 0x0, ttl 64, id 36308, offset 0, flags [DF], proto TCP (6), length 52)
    127.0.0.1.47012 > 127.0.0.1.10650: Flags [.], cksum 0xfe28 (incorrect -> 0x1e9b), seq 950, ack 86851, win 512, options [nop,nop,TS val 401652881 ecr 401652880], length 0
2022-04-07 08:16:10.379070 IP (tos 0x0, ttl 64, id 3853, offset 0, flags [DF], proto TCP (6), length 3922)
    127.0.0.1.10650 > 127.0.0.1.47012: Flags [P.], cksum 0x0d47 (incorrect -> 0x04b5), seq 86851:90721, ack 950, win 512, options [nop,nop,TS val 401652882 ecr 401652881], length 3870
2022-04-07 08:16:10.422669 IP (tos 0x0, ttl 64, id 36309, offset 0, flags [DF], proto TCP (6), length 52)
    127.0.0.1.47012 > 127.0.0.1.10650: Flags [.], cksum 0xfe28 (incorrect -> 0x0f4f), seq 950, ack 90721, win 512, options [nop,nop,TS val 401652925 ecr 401652882], length 0
2022-04-07 08:16:10.422680 IP (tos 0x0, ttl 64, id 3854, offset 0, flags [DF], proto TCP (6), length 14721)
    127.0.0.1.10650 > 127.0.0.1.47012: Flags [P.], cksum 0x3776 (incorrect -> 0x6eb8), seq 90721:105390, ack 950, win 512, options [nop,nop,TS val 401652925 ecr 401652925], length 14669
2022-04-07 08:16:10.466665 IP (tos 0x0, ttl 64, id 36310, offset 0, flags [DF], proto TCP (6), length 52)
    127.0.0.1.47012 > 127.0.0.1.10650: Flags [.], cksum 0xfe28 (incorrect -> 0xd5aa), seq 950, ack 105390, win 512, options [nop,nop,TS val 401652969 ecr 401652925], length 0
2022-04-07 08:16:10.466677 IP (tos 0x0, ttl 64, id 3855, offset 0, flags [DF], proto TCP (6), length 5876)
    127.0.0.1.10650 > 127.0.0.1.47012: Flags [P.], cksum 0x14e9 (incorrect -> 0x7351), seq 105390:111214, ack 950, win 512, options [nop,nop,TS val 401652969 ecr 401652969], length 5824
2022-04-07 08:16:10.466721 IP (tos 0x0, ttl 64, id 36311, offset 0, flags [DF], proto TCP (6), length 52)
    127.0.0.1.47012 > 127.0.0.1.10650: Flags [.], cksum 0xfe28 (incorrect -> 0xbebe), seq 950, ack 111214, win 512, options [nop,nop,TS val 401652969 ecr 401652969], length 0
2022-04-07 08:16:10.470364 IP (tos 0x0, ttl 64, id 3856, offset 0, flags [DF], proto TCP (6), length 4100)
    127.0.0.1.10650 > 127.0.0.1.47012: Flags [P.], cksum 0x0df9 (incorrect -> 0xc008), seq 111214:115262, ack 950, win 512, options [nop,nop,TS val 401652973 ecr 401652969], length 4048
2022-04-07 08:16:10.470602 IP (tos 0x0, ttl 64, id 36312, offset 0, flags [DF], proto TCP (6), length 52)
    127.0.0.1.47012 > 127.0.0.1.10650: Flags [.], cksum 0xfe28 (incorrect -> 0xaee6), seq 950, ack 115262, win 512, options [nop,nop,TS val 401652973 ecr 401652973], length 0
2022-04-07 08:16:10.470608 IP (tos 0x0, ttl 64, id 3857, offset 0, flags [DF], proto TCP (6), length 3783)
    127.0.0.1.10650 > 127.0.0.1.47012: Flags [P.], cksum 0x0cbc (incorrect -> 0xf036), seq 115262:118993, ack 950, win 512, options [nop,nop,TS val 401652973 ecr 401652973], length 3731
2022-04-07 08:16:10.470622 IP (tos 0x0, ttl 64, id 36313, offset 0, flags [DF], proto TCP (6), length 52)
    127.0.0.1.47012 > 127.0.0.1.10650: Flags [.], cksum 0xfe28 (incorrect -> 0xa053), seq 950, ack 118993, win 512, options [nop,nop,TS val 401652973 ecr 401652973], length 0
2022-04-07 08:16:10.473270 IP (tos 0x0, ttl 64, id 3858, offset 0, flags [DF], proto TCP (6), length 4100)
    127.0.0.1.10650 > 127.0.0.1.47012: Flags [P.], cksum 0x0df9 (incorrect -> 0x42cb), seq 118993:123041, ack 950, win 512, options [nop,nop,TS val 401652976 ecr 401652973], length 4048
2022-04-07 08:16:10.473386 IP (tos 0x0, ttl 64, id 36314, offset 0, flags [DF], proto TCP (6), length 52)
    127.0.0.1.47012 > 127.0.0.1.10650: Flags [.], cksum 0xfe28 (incorrect -> 0x907d), seq 950, ack 123041, win 512, options [nop,nop,TS val 401652976 ecr 401652976], length 0
2022-04-07 08:16:10.473392 IP (tos 0x0, ttl 64, id 3859, offset 0, flags [DF], proto TCP (6), length 2990)
    127.0.0.1.10650 > 127.0.0.1.47012: Flags [P.], cksum 0x09a3 (incorrect -> 0x3840), seq 123041:125979, ack 950, win 512, options [nop,nop,TS val 401652976 ecr 401652976], length 2938
2022-04-07 08:16:10.473397 IP (tos 0x0, ttl 64, id 36315, offset 0, flags [DF], proto TCP (6), length 52)
    127.0.0.1.47012 > 127.0.0.1.10650: Flags [.], cksum 0xfe28 (incorrect -> 0x8503), seq 950, ack 125979, win 512, options [nop,nop,TS val 401652976 ecr 401652976], length 0
2022-04-07 08:16:10.482461 IP (tos 0x0, ttl 64, id 3860, offset 0, flags [DF], proto TCP (6), length 4100)
    127.0.0.1.10650 > 127.0.0.1.47012: Flags [P.], cksum 0x0df9 (incorrect -> 0x0090), seq 125979:130027, ack 950, win 512, options [nop,nop,TS val 401652985 ecr 401652976], length 4048
2022-04-07 08:16:10.482652 IP (tos 0x0, ttl 64, id 36316, offset 0, flags [DF], proto TCP (6), length 52)
    127.0.0.1.47012 > 127.0.0.1.10650: Flags [.], cksum 0xfe28 (incorrect -> 0x7521), seq 950, ack 130027, win 512, options [nop,nop,TS val 401652985 ecr 401652985], length 0
2022-04-07 08:16:10.482659 IP (tos 0x0, ttl 64, id 3861, offset 0, flags [DF], proto TCP (6), length 2962)
    127.0.0.1.10650 > 127.0.0.1.47012: Flags [P.], cksum 0x0987 (incorrect -> 0x0d60), seq 130027:132937, ack 950, win 512, options [nop,nop,TS val 401652985 ecr 401652985], length 2910
2022-04-07 08:16:10.482667 IP (tos 0x0, ttl 64, id 36317, offset 0, flags [DF], proto TCP (6), length 52)
    127.0.0.1.47012 > 127.0.0.1.10650: Flags [.], cksum 0xfe28 (incorrect -> 0x69c3), seq 950, ack 132937, win 512, options [nop,nop,TS val 401652985 ecr 401652985], length 0
2022-04-07 08:16:10.484182 IP (tos 0x0, ttl 64, id 3862, offset 0, flags [DF], proto TCP (6), length 941)
    127.0.0.1.10650 > 127.0.0.1.47012: Flags [P.], cksum 0x01a2 (incorrect -> 0x9b33), seq 132937:133826, ack 950, win 512, options [nop,nop,TS val 401652987 ecr 401652985], length 889
2022-04-07 08:16:10.484392 IP (tos 0x0, ttl 64, id 36318, offset 0, flags [DF], proto TCP (6), length 52)
    127.0.0.1.47012 > 127.0.0.1.10650: Flags [.], cksum 0xfe28 (incorrect -> 0x6646), seq 950, ack 133826, win 512, options [nop,nop,TS val 401652987 ecr 401652987], length 0
2022-04-07 08:16:10.486739 IP (tos 0x0, ttl 64, id 3863, offset 0, flags [DF], proto TCP (6), length 3500)
    127.0.0.1.10650 > 127.0.0.1.47012: Flags [P.], cksum 0x0ba1 (incorrect -> 0xa500), seq 133826:137274, ack 950, win 512, options [nop,nop,TS val 401652989 ecr 401652987], length 3448
2022-04-07 08:16:10.486755 IP (tos 0x0, ttl 64, id 36319, offset 0, flags [DF], proto TCP (6), length 52)
    127.0.0.1.47012 > 127.0.0.1.10650: Flags [.], cksum 0xfe28 (incorrect -> 0x58ca), seq 950, ack 137274, win 512, options [nop,nop,TS val 401652989 ecr 401652989], length 0
2022-04-07 08:16:10.486798 IP (tos 0x0, ttl 64, id 3864, offset 0, flags [DF], proto TCP (6), length 2447)
    127.0.0.1.10650 > 127.0.0.1.47012: Flags [P.], cksum 0x0784 (incorrect -> 0xcfd7), seq 137274:139669, ack 950, win 512, options [nop,nop,TS val 401652989 ecr 401652989], length 2395
2022-04-07 08:16:10.486957 IP (tos 0x0, ttl 64, id 36320, offset 0, flags [DF], proto TCP (6), length 52)
    127.0.0.1.47012 > 127.0.0.1.10650: Flags [.], cksum 0xfe28 (incorrect -> 0x4f6f), seq 950, ack 139669, win 512, options [nop,nop,TS val 401652989 ecr 401652989], length 0
2022-04-07 08:16:10.487124 IP (tos 0x0, ttl 64, id 3865, offset 0, flags [DF], proto TCP (6), length 3538)
    127.0.0.1.10650 > 127.0.0.1.47012: Flags [P.], cksum 0x0bc7 (incorrect -> 0x1bd7), seq 139669:143155, ack 950, win 512, options [nop,nop,TS val 401652990 ecr 401652989], length 3486
2022-04-07 08:16:10.487139 IP (tos 0x0, ttl 64, id 36321, offset 0, flags [DF], proto TCP (6), length 52)
    127.0.0.1.47012 > 127.0.0.1.10650: Flags [.], cksum 0xfe28 (incorrect -> 0x41cf), seq 950, ack 143155, win 512, options [nop,nop,TS val 401652990 ecr 401652990], length 0
2022-04-07 08:16:10.487182 IP (tos 0x0, ttl 64, id 3866, offset 0, flags [DF], proto TCP (6), length 3884)
    127.0.0.1.10650 > 127.0.0.1.47012: Flags [P.], cksum 0x0d21 (incorrect -> 0x33c4), seq 143155:146987, ack 950, win 512, options [nop,nop,TS val 401652990 ecr 401652990], length 3832
2022-04-07 08:16:10.487193 IP (tos 0x0, ttl 64, id 36322, offset 0, flags [DF], proto TCP (6), length 52)
    127.0.0.1.47012 > 127.0.0.1.10650: Flags [.], cksum 0xfe28 (incorrect -> 0x32d7), seq 950, ack 146987, win 512, options [nop,nop,TS val 401652990 ecr 401652990], length 0
2022-04-07 08:16:10.488590 IP (tos 0x0, ttl 64, id 3867, offset 0, flags [DF], proto TCP (6), length 4100)
    127.0.0.1.10650 > 127.0.0.1.47012: Flags [P.], cksum 0x0df9 (incorrect -> 0xd89d), seq 146987:151035, ack 950, win 512, options [nop,nop,TS val 401652991 ecr 401652990], length 4048
2022-04-07 08:16:10.488662 IP (tos 0x0, ttl 64, id 36323, offset 0, flags [DF], proto TCP (6), length 52)
    127.0.0.1.47012 > 127.0.0.1.10650: Flags [.], cksum 0xfe28 (incorrect -> 0x2305), seq 950, ack 151035, win 512, options [nop,nop,TS val 401652991 ecr 401652991], length 0
2022-04-07 08:16:10.488669 IP (tos 0x0, ttl 64, id 3868, offset 0, flags [DF], proto TCP (6), length 12533)
    127.0.0.1.10650 > 127.0.0.1.47012: Flags [P.], cksum 0x2eea (incorrect -> 0xb5e1), seq 151035:163516, ack 950, win 512, options [nop,nop,TS val 401652991 ecr 401652991], length 12481
2022-04-07 08:16:10.488970 IP (tos 0x0, ttl 64, id 36324, offset 0, flags [DF], proto TCP (6), length 52)
    127.0.0.1.47012 > 127.0.0.1.10650: Flags [.], cksum 0xfe28 (incorrect -> 0xf243), seq 950, ack 163516, win 512, options [nop,nop,TS val 401652991 ecr 401652991], length 0
2022-04-07 08:16:10.491671 IP (tos 0x0, ttl 64, id 3869, offset 0, flags [DF], proto TCP (6), length 3884)
    127.0.0.1.10650 > 127.0.0.1.47012: Flags [P.], cksum 0x0d21 (incorrect -> 0x4a58), seq 163516:167348, ack 950, win 512, options [nop,nop,TS val 401652994 ecr 401652991], length 3832
2022-04-07 08:16:10.491705 IP (tos 0x0, ttl 64, id 36325, offset 0, flags [DF], proto TCP (6), length 52)
    127.0.0.1.47012 > 127.0.0.1.10650: Flags [.], cksum 0xfe28 (incorrect -> 0xe345), seq 950, ack 167348, win 512, options [nop,nop,TS val 401652994 ecr 401652994], length 0
2022-04-07 08:16:10.493531 IP (tos 0x0, ttl 64, id 3870, offset 0, flags [DF], proto TCP (6), length 2542)
    127.0.0.1.10650 > 127.0.0.1.47012: Flags [P.], cksum 0x07e3 (incorrect -> 0xf356), seq 167348:169838, ack 950, win 512, options [nop,nop,TS val 401652996 ecr 401652994], length 2490
2022-04-07 08:16:10.493544 IP (tos 0x0, ttl 64, id 36326, offset 0, flags [DF], proto TCP (6), length 52)
    127.0.0.1.47012 > 127.0.0.1.10650: Flags [.], cksum 0xfe28 (incorrect -> 0xd987), seq 950, ack 169838, win 512, options [nop,nop,TS val 401652996 ecr 401652996], length 0
2022-04-07 08:16:10.495663 IP (tos 0x0, ttl 64, id 3871, offset 0, flags [DF], proto TCP (6), length 4100)
    127.0.0.1.10650 > 127.0.0.1.47012: Flags [P.], cksum 0x0df9 (incorrect -> 0x520a), seq 169838:173886, ack 950, win 512, options [nop,nop,TS val 401652998 ecr 401652996], length 4048
2022-04-07 08:16:10.495905 IP (tos 0x0, ttl 64, id 36327, offset 0, flags [DF], proto TCP (6), length 52)
    127.0.0.1.47012 > 127.0.0.1.10650: Flags [.], cksum 0xfe28 (incorrect -> 0xc9b3), seq 950, ack 173886, win 512, options [nop,nop,TS val 401652998 ecr 401652998], length 0
2022-04-07 08:16:10.495911 IP (tos 0x0, ttl 64, id 3872, offset 0, flags [DF], proto TCP (6), length 3820)
    127.0.0.1.10650 > 127.0.0.1.47012: Flags [P.], cksum 0x0ce1 (incorrect -> 0x9837), seq 173886:177654, ack 950, win 512, options [nop,nop,TS val 401652998 ecr 401652998], length 3768
2022-04-07 08:16:10.495916 IP (tos 0x0, ttl 64, id 36328, offset 0, flags [DF], proto TCP (6), length 52)
    127.0.0.1.47012 > 127.0.0.1.10650: Flags [.], cksum 0xfe28 (incorrect -> 0xbafb), seq 950, ack 177654, win 512, options [nop,nop,TS val 401652998 ecr 401652998], length 0
2022-04-07 08:16:10.500441 IP (tos 0x0, ttl 64, id 3873, offset 0, flags [DF], proto TCP (6), length 4100)
    127.0.0.1.10650 > 127.0.0.1.47012: Flags [P.], cksum 0x0df9 (incorrect -> 0xbc2c), seq 177654:181702, ack 950, win 512, options [nop,nop,TS val 401653003 ecr 401652998], length 4048
2022-04-07 08:16:10.500670 IP (tos 0x0, ttl 64, id 36329, offset 0, flags [DF], proto TCP (6), length 52)
    127.0.0.1.47012 > 127.0.0.1.10650: Flags [.], cksum 0xfe28 (incorrect -> 0xab21), seq 950, ack 181702, win 512, options [nop,nop,TS val 401653003 ecr 401653003], length 0
2022-04-07 08:16:10.501228 IP (tos 0x0, ttl 64, id 3874, offset 0, flags [DF], proto TCP (6), length 334)
    127.0.0.1.10650 > 127.0.0.1.47012: Flags [P.], cksum 0xff42 (incorrect -> 0xbaad), seq 181702:181984, ack 950, win 512, options [nop,nop,TS val 401653004 ecr 401653003], length 282
2022-04-07 08:16:10.501255 IP (tos 0x0, ttl 64, id 36330, offset 0, flags [DF], proto TCP (6), length 52)
    127.0.0.1.47012 > 127.0.0.1.10650: Flags [.], cksum 0xfe28 (incorrect -> 0xa920), seq 950, ack 181984, win 741, options [nop,nop,TS val 401653004 ecr 401653004], length 0
2022-04-07 08:16:10.504842 IP (tos 0x0, ttl 64, id 3875, offset 0, flags [DF], proto TCP (6), length 3386)
    127.0.0.1.10650 > 127.0.0.1.47012: Flags [P.], cksum 0x0b2f (incorrect -> 0xe1fa), seq 181984:185318, ack 950, win 512, options [nop,nop,TS val 401653007 ecr 401653004], length 3334
2022-04-07 08:16:10.504849 IP (tos 0x0, ttl 64, id 36331, offset 0, flags [DF], proto TCP (6), length 52)
    127.0.0.1.47012 > 127.0.0.1.10650: Flags [.], cksum 0xfe28 (incorrect -> 0x9814), seq 950, ack 185318, win 1765, options [nop,nop,TS val 401653007 ecr 401653007], length 0
2022-04-07 08:16:10.506785 IP (tos 0x0, ttl 64, id 3876, offset 0, flags [DF], proto TCP (6), length 4100)
    127.0.0.1.10650 > 127.0.0.1.47012: Flags [P.], cksum 0x0df9 (incorrect -> 0xec33), seq 185318:189366, ack 950, win 512, options [nop,nop,TS val 401653009 ecr 401653007], length 4048
2022-04-07 08:16:10.506793 IP (tos 0x0, ttl 64, id 36332, offset 0, flags [DF], proto TCP (6), length 52)
    127.0.0.1.47012 > 127.0.0.1.10650: Flags [.], cksum 0xfe28 (incorrect -> 0x8441), seq 950, ack 189366, win 2788, options [nop,nop,TS val 401653009 ecr 401653009], length 0
2022-04-07 08:16:10.506800 IP (tos 0x0, ttl 64, id 3877, offset 0, flags [DF], proto TCP (6), length 1828)
    127.0.0.1.10650 > 127.0.0.1.47012: Flags [P.], cksum 0x0519 (incorrect -> 0x37f0), seq 189366:191142, ack 950, win 512, options [nop,nop,TS val 401653009 ecr 401653009], length 1776
2022-04-07 08:16:10.506804 IP (tos 0x0, ttl 64, id 36333, offset 0, flags [DF], proto TCP (6), length 52)
    127.0.0.1.47012 > 127.0.0.1.10650: Flags [.], cksum 0xfe28 (incorrect -> 0x7952), seq 950, ack 191142, win 3811, options [nop,nop,TS val 401653009 ecr 401653009], length 0
2022-04-07 08:16:10.506864 IP (tos 0x0, ttl 64, id 3878, offset 0, flags [DF], proto TCP (6), length 4100)
    127.0.0.1.10650 > 127.0.0.1.47012: Flags [P.], cksum 0x0df9 (incorrect -> 0xa023), seq 191142:195190, ack 950, win 512, options [nop,nop,TS val 401653009 ecr 401653009], length 4048
2022-04-07 08:16:10.506869 IP (tos 0x0, ttl 64, id 36334, offset 0, flags [DF], proto TCP (6), length 52)
    127.0.0.1.47012 > 127.0.0.1.10650: Flags [.], cksum 0xfe28 (incorrect -> 0x6583), seq 950, ack 195190, win 4834, options [nop,nop,TS val 401653009 ecr 401653009], length 0
2022-04-07 08:16:10.506874 IP (tos 0x0, ttl 64, id 3879, offset 0, flags [DF], proto TCP (6), length 832)
    127.0.0.1.10650 > 127.0.0.1.47012: Flags [P.], cksum 0x0135 (incorrect -> 0x312b), seq 195190:195970, ack 950, win 512, options [nop,nop,TS val 401653009 ecr 401653009], length 780
2022-04-07 08:16:10.506877 IP (tos 0x0, ttl 64, id 36335, offset 0, flags [DF], proto TCP (6), length 52)
    127.0.0.1.47012 > 127.0.0.1.10650: Flags [.], cksum 0xfe28 (incorrect -> 0x6192), seq 950, ack 195970, win 5063, options [nop,nop,TS val 401653009 ecr 401653009], length 0
2022-04-07 08:16:10.506906 IP (tos 0x0, ttl 64, id 3880, offset 0, flags [DF], proto TCP (6), length 3538)
    127.0.0.1.10650 > 127.0.0.1.47012: Flags [P.], cksum 0x0bc7 (incorrect -> 0xd035), seq 195970:199456, ack 950, win 512, options [nop,nop,TS val 401653009 ecr 401653009], length 3486
2022-04-07 08:16:10.506910 IP (tos 0x0, ttl 64, id 36336, offset 0, flags [DF], proto TCP (6), length 52)
    127.0.0.1.47012 > 127.0.0.1.10650: Flags [.], cksum 0xfe28 (incorrect -> 0x4ff5), seq 950, ack 199456, win 6086, options [nop,nop,TS val 401653009 ecr 401653009], length 0
2022-04-07 08:16:10.512617 IP (tos 0x0, ttl 64, id 3881, offset 0, flags [DF], proto TCP (6), length 3884)
    127.0.0.1.10650 > 127.0.0.1.47012: Flags [P.], cksum 0x0d21 (incorrect -> 0x3e14), seq 199456:203288, ack 950, win 512, options [nop,nop,TS val 401653015 ecr 401653009], length 3832
2022-04-07 08:16:10.512625 IP (tos 0x0, ttl 64, id 36337, offset 0, flags [DF], proto TCP (6), length 52)
    127.0.0.1.47012 > 127.0.0.1.10650: Flags [.], cksum 0xfe28 (incorrect -> 0x3cf1), seq 950, ack 203288, win 7110, options [nop,nop,TS val 401653015 ecr 401653015], length 0
2022-04-07 08:16:10.518737 IP (tos 0x0, ttl 64, id 3882, offset 0, flags [DF], proto TCP (6), length 4100)
    127.0.0.1.10650 > 127.0.0.1.47012: Flags [P.], cksum 0x0df9 (incorrect -> 0x69ad), seq 203288:207336, ack 950, win 512, options [nop,nop,TS val 401653021 ecr 401653015], length 4048
2022-04-07 08:16:10.518743 IP (tos 0x0, ttl 64, id 36338, offset 0, flags [DF], proto TCP (6), length 52)
    127.0.0.1.47012 > 127.0.0.1.10650: Flags [.], cksum 0xfe28 (incorrect -> 0x2916), seq 950, ack 207336, win 8133, options [nop,nop,TS val 401653021 ecr 401653021], length 0
2022-04-07 08:16:10.518750 IP (tos 0x0, ttl 64, id 3883, offset 0, flags [DF], proto TCP (6), length 334)
    127.0.0.1.10650 > 127.0.0.1.47012: Flags [P.], cksum 0xff42 (incorrect -> 0xdc91), seq 207336:207618, ack 950, win 512, options [nop,nop,TS val 401653021 ecr 401653021], length 282
2022-04-07 08:16:10.518933 IP (tos 0x0, ttl 64, id 36339, offset 0, flags [DF], proto TCP (6), length 52)
    127.0.0.1.47012 > 127.0.0.1.10650: Flags [.], cksum 0xfe28 (incorrect -> 0x27fc), seq 950, ack 207618, win 8133, options [nop,nop,TS val 401653021 ecr 401653021], length 0
2022-04-07 08:16:10.524935 IP (tos 0x0, ttl 64, id 3884, offset 0, flags [DF], proto TCP (6), length 4100)
    127.0.0.1.10650 > 127.0.0.1.47012: Flags [P.], cksum 0x0df9 (incorrect -> 0x3239), seq 207618:211666, ack 950, win 512, options [nop,nop,TS val 401653027 ecr 401653021], length 4048
2022-04-07 08:16:10.524952 IP (tos 0x0, ttl 64, id 36340, offset 0, flags [DF], proto TCP (6), length 52)
    127.0.0.1.47012 > 127.0.0.1.10650: Flags [.], cksum 0xfe28 (incorrect -> 0x1421), seq 950, ack 211666, win 9156, options [nop,nop,TS val 401653027 ecr 401653027], length 0
2022-04-07 08:16:10.524962 IP (tos 0x0, ttl 64, id 3885, offset 0, flags [DF], proto TCP (6), length 683)
    127.0.0.1.10650 > 127.0.0.1.47012: Flags [P.], cksum 0x00a0 (incorrect -> 0x0fac), seq 211666:212297, ack 950, win 512, options [nop,nop,TS val 401653027 ecr 401653027], length 631
2022-04-07 08:16:10.524967 IP (tos 0x0, ttl 64, id 36341, offset 0, flags [DF], proto TCP (6), length 52)
    127.0.0.1.47012 > 127.0.0.1.10650: Flags [.], cksum 0xfe28 (incorrect -> 0x10c5), seq 950, ack 212297, win 9385, options [nop,nop,TS val 401653027 ecr 401653027], length 0
2022-04-07 08:16:10.532737 IP (tos 0x0, ttl 64, id 3886, offset 0, flags [DF], proto TCP (6), length 3538)
    127.0.0.1.10650 > 127.0.0.1.47012: Flags [P.], cksum 0x0bc7 (incorrect -> 0x0489), seq 212297:215783, ack 950, win 512, options [nop,nop,TS val 401653035 ecr 401653027], length 3486
2022-04-07 08:16:10.532745 IP (tos 0x0, ttl 64, id 36342, offset 0, flags [DF], proto TCP (6), length 52)
    127.0.0.1.47012 > 127.0.0.1.10650: Flags [.], cksum 0xfe28 (incorrect -> 0xff17), seq 950, ack 215783, win 10408, options [nop,nop,TS val 401653035 ecr 401653035], length 0
2022-04-07 08:16:10.546815 IP (tos 0x0, ttl 64, id 3887, offset 0, flags [DF], proto TCP (6), length 3846)
    127.0.0.1.10650 > 127.0.0.1.47012: Flags [P.], cksum 0x0cfb (incorrect -> 0x6006), seq 215783:219577, ack 950, win 512, options [nop,nop,TS val 401653049 ecr 401653035], length 3794
2022-04-07 08:16:10.546825 IP (tos 0x0, ttl 64, id 36343, offset 0, flags [DF], proto TCP (6), length 52)
    127.0.0.1.47012 > 127.0.0.1.10650: Flags [.], cksum 0xfe28 (incorrect -> 0xec29), seq 950, ack 219577, win 11432, options [nop,nop,TS val 401653049 ecr 401653049], length 0
2022-04-07 08:16:10.558491 IP (tos 0x0, ttl 64, id 3888, offset 0, flags [DF], proto TCP (6), length 4100)
    127.0.0.1.10650 > 127.0.0.1.47012: Flags [P.], cksum 0x0df9 (incorrect -> 0xf948), seq 219577:223625, ack 950, win 512, options [nop,nop,TS val 401653061 ecr 401653049], length 4048
2022-04-07 08:16:10.558499 IP (tos 0x0, ttl 64, id 36344, offset 0, flags [DF], proto TCP (6), length 52)
    127.0.0.1.47012 > 127.0.0.1.10650: Flags [.], cksum 0xfe28 (incorrect -> 0xd842), seq 950, ack 223625, win 12455, options [nop,nop,TS val 401653061 ecr 401653061], length 0
2022-04-07 08:16:10.558505 IP (tos 0x0, ttl 64, id 3889, offset 0, flags [DF], proto TCP (6), length 1092)
    127.0.0.1.10650 > 127.0.0.1.47012: Flags [P.], cksum 0x0239 (incorrect -> 0x693c), seq 223625:224665, ack 950, win 512, options [nop,nop,TS val 401653061 ecr 401653061], length 1040
2022-04-07 08:16:10.558735 IP (tos 0x0, ttl 64, id 36345, offset 0, flags [DF], proto TCP (6), length 52)
    127.0.0.1.47012 > 127.0.0.1.10650: Flags [.], cksum 0xfe28 (incorrect -> 0xd432), seq 950, ack 224665, win 12455, options [nop,nop,TS val 401653061 ecr 401653061], length 0
2022-04-07 08:16:10.558742 IP (tos 0x0, ttl 64, id 3890, offset 0, flags [DF], proto TCP (6), length 3846)
    127.0.0.1.10650 > 127.0.0.1.47012: Flags [P.], cksum 0x0cfb (incorrect -> 0x3c9f), seq 224665:228459, ack 950, win 512, options [nop,nop,TS val 401653061 ecr 401653061], length 3794
2022-04-07 08:16:10.558746 IP (tos 0x0, ttl 64, id 36346, offset 0, flags [DF], proto TCP (6), length 52)
    127.0.0.1.47012 > 127.0.0.1.10650: Flags [.], cksum 0xfe28 (incorrect -> 0xc161), seq 950, ack 228459, win 13478, options [nop,nop,TS val 401653061 ecr 401653061], length 0
2022-04-07 08:16:10.560440 IP (tos 0x0, ttl 64, id 3891, offset 0, flags [DF], proto TCP (6), length 4036)
    127.0.0.1.10650 > 127.0.0.1.47012: Flags [P.], cksum 0x0db9 (incorrect -> 0xe5a5), seq 228459:232443, ack 950, win 512, options [nop,nop,TS val 401653063 ecr 401653061], length 3984
2022-04-07 08:16:10.560446 IP (tos 0x0, ttl 64, id 36347, offset 0, flags [DF], proto TCP (6), length 52)
    127.0.0.1.47012 > 127.0.0.1.10650: Flags [.], cksum 0xfe28 (incorrect -> 0xadce), seq 950, ack 232443, win 14501, options [nop,nop,TS val 401653063 ecr 401653063], length 0
2022-04-07 08:16:10.560476 IP (tos 0x0, ttl 64, id 3892, offset 0, flags [DF], proto TCP (6), length 3136)
    127.0.0.1.10650 > 127.0.0.1.47012: Flags [P.], cksum 0x0a35 (incorrect -> 0xad09), seq 232443:235527, ack 950, win 512, options [nop,nop,TS val 401653063 ecr 401653063], length 3084
2022-04-07 08:16:10.560480 IP (tos 0x0, ttl 64, id 36348, offset 0, flags [DF], proto TCP (6), length 52)
    127.0.0.1.47012 > 127.0.0.1.10650: Flags [.], cksum 0xfe28 (incorrect -> 0xa08d), seq 950, ack 235527, win 14810, options [nop,nop,TS val 401653063 ecr 401653063], length 0
2022-04-07 08:16:10.562412 IP (tos 0x0, ttl 64, id 3893, offset 0, flags [DF], proto TCP (6), length 4100)
    127.0.0.1.10650 > 127.0.0.1.47012: Flags [P.], cksum 0x0df9 (incorrect -> 0xd7cc), seq 235527:239575, ack 950, win 512, options [nop,nop,TS val 401653065 ecr 401653063], length 4048
2022-04-07 08:16:10.562420 IP (tos 0x0, ttl 64, id 36349, offset 0, flags [DF], proto TCP (6), length 52)
    127.0.0.1.47012 > 127.0.0.1.10650: Flags [.], cksum 0xfe28 (incorrect -> 0x90ad), seq 950, ack 239575, win 14822, options [nop,nop,TS val 401653065 ecr 401653065], length 0
2022-04-07 08:16:10.562426 IP (tos 0x0, ttl 64, id 3894, offset 0, flags [DF], proto TCP (6), length 486)
    127.0.0.1.10650 > 127.0.0.1.47012: Flags [P.], cksum 0xffda (incorrect -> 0xedf0), seq 239575:240009, ack 950, win 512, options [nop,nop,TS val 401653065 ecr 401653065], length 434
2022-04-07 08:16:10.562507 IP (tos 0x0, ttl 64, id 36350, offset 0, flags [DF], proto TCP (6), length 52)
    127.0.0.1.47012 > 127.0.0.1.10650: Flags [.], cksum 0xfe28 (incorrect -> 0x8efb), seq 950, ack 240009, win 14822, options [nop,nop,TS val 401653065 ecr 401653065], length 0
2022-04-07 08:16:10.562514 IP (tos 0x0, ttl 64, id 3895, offset 0, flags [DF], proto TCP (6), length 10395)
    127.0.0.1.10650 > 127.0.0.1.47012: Flags [P.], cksum 0x2690 (incorrect -> 0xc865), seq 240009:250352, ack 950, win 512, options [nop,nop,TS val 401653065 ecr 401653065], length 10343
2022-04-07 08:16:10.562683 IP (tos 0x0, ttl 64, id 36351, offset 0, flags [DF], proto TCP (6), length 52)
    127.0.0.1.47012 > 127.0.0.1.10650: Flags [.], cksum 0xfe28 (incorrect -> 0x6694), seq 950, ack 250352, win 14822, options [nop,nop,TS val 401653065 ecr 401653065], length 0
2022-04-07 08:16:10.562738 IP (tos 0x0, ttl 64, id 3896, offset 0, flags [DF], proto TCP (6), length 4100)
    127.0.0.1.10650 > 127.0.0.1.47012: Flags [P.], cksum 0x0df9 (incorrect -> 0x663b), seq 250352:254400, ack 950, win 512, options [nop,nop,TS val 401653065 ecr 401653065], length 4048
2022-04-07 08:16:10.562758 IP (tos 0x0, ttl 64, id 36352, offset 0, flags [DF], proto TCP (6), length 52)
    127.0.0.1.47012 > 127.0.0.1.10650: Flags [.], cksum 0xfe28 (incorrect -> 0x56c4), seq 950, ack 254400, win 14822, options [nop,nop,TS val 401653065 ecr 401653065], length 0
2022-04-07 08:16:10.562762 IP (tos 0x0, ttl 64, id 3897, offset 0, flags [DF], proto TCP (6), length 3246)
    127.0.0.1.10650 > 127.0.0.1.47012: Flags [P.], cksum 0x0aa3 (incorrect -> 0xb532), seq 254400:257594, ack 950, win 512, options [nop,nop,TS val 401653065 ecr 401653065], length 3194
2022-04-07 08:16:10.562767 IP (tos 0x0, ttl 64, id 36353, offset 0, flags [DF], proto TCP (6), length 52)
    127.0.0.1.47012 > 127.0.0.1.10650: Flags [.], cksum 0xfe28 (incorrect -> 0x4a4a), seq 950, ack 257594, win 14822, options [nop,nop,TS val 401653065 ecr 401653065], length 0
2022-04-07 08:16:10.566721 IP (tos 0x0, ttl 64, id 3898, offset 0, flags [DF], proto TCP (6), length 1546)
    127.0.0.1.10650 > 127.0.0.1.47012: Flags [P.], cksum 0x03ff (incorrect -> 0xe1e0), seq 257594:259088, ack 950, win 512, options [nop,nop,TS val 401653069 ecr 401653065], length 1494
2022-04-07 08:16:10.566732 IP (tos 0x0, ttl 64, id 36354, offset 0, flags [DF], proto TCP (6), length 52)
    127.0.0.1.47012 > 127.0.0.1.10650: Flags [.], cksum 0xfe28 (incorrect -> 0x4462), seq 950, ack 259088, win 14832, options [nop,nop,TS val 401653069 ecr 401653069], length 0
2022-04-07 08:16:10.568653 IP (tos 0x0, ttl 64, id 3899, offset 0, flags [DF], proto TCP (6), length 1394)
    127.0.0.1.10650 > 127.0.0.1.47012: Flags [P.], cksum 0x0367 (incorrect -> 0x8cc4), seq 259088:260430, ack 950, win 512, options [nop,nop,TS val 401653071 ecr 401653069], length 1342
2022-04-07 08:16:10.568660 IP (tos 0x0, ttl 64, id 36355, offset 0, flags [DF], proto TCP (6), length 52)
    127.0.0.1.47012 > 127.0.0.1.10650: Flags [.], cksum 0xfe28 (incorrect -> 0x3f20), seq 950, ack 260430, win 14832, options [nop,nop,TS val 401653071 ecr 401653071], length 0
2022-04-07 08:16:10.572277 IP (tos 0x0, ttl 64, id 3900, offset 0, flags [DF], proto TCP (6), length 2006)
    127.0.0.1.10650 > 127.0.0.1.47012: Flags [P.], cksum 0x05cb (incorrect -> 0x1900), seq 260430:262384, ack 950, win 512, options [nop,nop,TS val 401653075 ecr 401653071], length 1954
2022-04-07 08:16:10.572600 IP (tos 0x0, ttl 64, id 36356, offset 0, flags [DF], proto TCP (6), length 52)
    127.0.0.1.47012 > 127.0.0.1.10650: Flags [.], cksum 0xfe28 (incorrect -> 0x3776), seq 950, ack 262384, win 14832, options [nop,nop,TS val 401653075 ecr 401653075], length 0
2022-04-07 08:16:10.573909 IP (tos 0x0, ttl 64, id 3901, offset 0, flags [DF], proto TCP (6), length 4100)
    127.0.0.1.10650 > 127.0.0.1.47012: Flags [P.], cksum 0x0df9 (incorrect -> 0xe19e), seq 262384:266432, ack 950, win 512, options [nop,nop,TS val 401653076 ecr 401653075], length 4048
2022-04-07 08:16:10.574071 IP (tos 0x0, ttl 64, id 36357, offset 0, flags [DF], proto TCP (6), length 52)
    127.0.0.1.47012 > 127.0.0.1.10650: Flags [.], cksum 0xfe28 (incorrect -> 0x27a3), seq 950, ack 266432, win 14832, options [nop,nop,TS val 401653077 ecr 401653076], length 0
2022-04-07 08:16:10.574085 IP (tos 0x0, ttl 64, id 3902, offset 0, flags [DF], proto TCP (6), length 6770)
    127.0.0.1.10650 > 127.0.0.1.47012: Flags [P.], cksum 0x1867 (incorrect -> 0x4956), seq 266432:273150, ack 950, win 512, options [nop,nop,TS val 401653077 ecr 401653077], length 6718
2022-04-07 08:16:10.574093 IP (tos 0x0, ttl 64, id 36358, offset 0, flags [DF], proto TCP (6), length 52)
    127.0.0.1.47012 > 127.0.0.1.10650: Flags [.], cksum 0xfe28 (incorrect -> 0x0d64), seq 950, ack 273150, win 14832, options [nop,nop,TS val 401653077 ecr 401653077], length 0
2022-04-07 08:16:10.583075 IP (tos 0x0, ttl 64, id 3903, offset 0, flags [DF], proto TCP (6), length 4100)
    127.0.0.1.10650 > 127.0.0.1.47012: Flags [P.], cksum 0x0df9 (incorrect -> 0xb5c4), seq 273150:277198, ack 950, win 512, options [nop,nop,TS val 401653086 ecr 401653077], length 4048
2022-04-07 08:16:10.583130 IP (tos 0x0, ttl 64, id 36359, offset 0, flags [DF], proto TCP (6), length 52)
    127.0.0.1.47012 > 127.0.0.1.10650: Flags [.], cksum 0xfe28 (incorrect -> 0xfd81), seq 950, ack 277198, win 14832, options [nop,nop,TS val 401653086 ecr 401653086], length 0
2022-04-07 08:16:10.583137 IP (tos 0x0, ttl 64, id 3904, offset 0, flags [DF], proto TCP (6), length 7237)
    127.0.0.1.10650 > 127.0.0.1.47012: Flags [P.], cksum 0x1a3a (incorrect -> 0x0f8c), seq 277198:284383, ack 950, win 512, options [nop,nop,TS val 401653086 ecr 401653086], length 7185
2022-04-07 08:16:10.583334 IP (tos 0x0, ttl 64, id 36360, offset 0, flags [DF], proto TCP (6), length 52)
    127.0.0.1.47012 > 127.0.0.1.10650: Flags [.], cksum 0xfe28 (incorrect -> 0xe170), seq 950, ack 284383, win 14832, options [nop,nop,TS val 401653086 ecr 401653086], length 0
2022-04-07 08:16:10.584252 IP (tos 0x0, ttl 64, id 3905, offset 0, flags [DF], proto TCP (6), length 2352)
    127.0.0.1.10650 > 127.0.0.1.47012: Flags [P.], cksum 0x0725 (incorrect -> 0x216a), seq 284383:286683, ack 950, win 512, options [nop,nop,TS val 401653087 ecr 401653086], length 2300
2022-04-07 08:16:10.584268 IP (tos 0x0, ttl 64, id 36361, offset 0, flags [DF], proto TCP (6), length 52)
    127.0.0.1.47012 > 127.0.0.1.10650: Flags [.], cksum 0xfe28 (incorrect -> 0xd872), seq 950, ack 286683, win 14832, options [nop,nop,TS val 401653087 ecr 401653087], length 0
2022-04-07 08:16:10.586969 IP (tos 0x0, ttl 64, id 3906, offset 0, flags [DF], proto TCP (6), length 4100)
    127.0.0.1.10650 > 127.0.0.1.47012: Flags [P.], cksum 0x0df9 (incorrect -> 0xe9c6), seq 286683:290731, ack 950, win 512, options [nop,nop,TS val 401653089 ecr 401653087], length 4048
2022-04-07 08:16:10.587009 IP (tos 0x0, ttl 64, id 36362, offset 0, flags [DF], proto TCP (6), length 52)
    127.0.0.1.47012 > 127.0.0.1.10650: Flags [.], cksum 0xfe28 (incorrect -> 0xc89e), seq 950, ack 290731, win 14832, options [nop,nop,TS val 401653089 ecr 401653089], length 0
2022-04-07 08:16:10.587014 IP (tos 0x0, ttl 64, id 3907, offset 0, flags [DF], proto TCP (6), length 3284)
    127.0.0.1.10650 > 127.0.0.1.47012: Flags [P.], cksum 0x0ac9 (incorrect -> 0xaeb3), seq 290731:293963, ack 950, win 512, options [nop,nop,TS val 401653089 ecr 401653089], length 3232
2022-04-07 08:16:10.587019 IP (tos 0x0, ttl 64, id 36363, offset 0, flags [DF], proto TCP (6), length 52)
    127.0.0.1.47012 > 127.0.0.1.10650: Flags [.], cksum 0xfe28 (incorrect -> 0xbbfe), seq 950, ack 293963, win 14832, options [nop,nop,TS val 401653089 ecr 401653089], length 0
2022-04-07 08:16:10.587682 IP (tos 0x0, ttl 64, id 3908, offset 0, flags [DF], proto TCP (6), length 4036)
    127.0.0.1.10650 > 127.0.0.1.47012: Flags [P.], cksum 0x0db9 (incorrect -> 0x90ae), seq 293963:297947, ack 950, win 512, options [nop,nop,TS val 401653090 ecr 401653089], length 3984
2022-04-07 08:16:10.587864 IP (tos 0x0, ttl 64, id 36364, offset 0, flags [DF], proto TCP (6), length 52)
    127.0.0.1.47012 > 127.0.0.1.10650: Flags [.], cksum 0xfe28 (incorrect -> 0xac6c), seq 950, ack 297947, win 14832, options [nop,nop,TS val 401653090 ecr 401653090], length 0
2022-04-07 08:16:10.593161 IP (tos 0x0, ttl 64, id 3909, offset 0, flags [DF], proto TCP (6), length 4100)
    127.0.0.1.10650 > 127.0.0.1.47012: Flags [P.], cksum 0x0df9 (incorrect -> 0x292e), seq 297947:301995, ack 950, win 512, options [nop,nop,TS val 401653096 ecr 401653090], length 4048
2022-04-07 08:16:10.593663 IP (tos 0x0, ttl 64, id 36365, offset 0, flags [DF], proto TCP (6), length 52)
    127.0.0.1.47012 > 127.0.0.1.10650: Flags [.], cksum 0xfe28 (incorrect -> 0x9c90), seq 950, ack 301995, win 14832, options [nop,nop,TS val 401653096 ecr 401653096], length 0
2022-04-07 08:16:10.593675 IP (tos 0x0, ttl 64, id 3910, offset 0, flags [DF], proto TCP (6), length 296)
    127.0.0.1.10650 > 127.0.0.1.47012: Flags [P.], cksum 0xff1c (incorrect -> 0xfcff), seq 301995:302239, ack 950, win 512, options [nop,nop,TS val 401653096 ecr 401653096], length 244
2022-04-07 08:16:10.593809 IP (tos 0x0, ttl 64, id 36366, offset 0, flags [DF], proto TCP (6), length 52)
    127.0.0.1.47012 > 127.0.0.1.10650: Flags [.], cksum 0xfe28 (incorrect -> 0x9b9c), seq 950, ack 302239, win 14832, options [nop,nop,TS val 401653096 ecr 401653096], length 0
2022-04-07 08:16:10.593818 IP (tos 0x0, ttl 64, id 3911, offset 0, flags [DF], proto TCP (6), length 11254)
    127.0.0.1.10650 > 127.0.0.1.47012: Flags [P.], cksum 0x29eb (incorrect -> 0x066a), seq 302239:313441, ack 950, win 512, options [nop,nop,TS val 401653096 ecr 401653096], length 11202
2022-04-07 08:16:10.594010 IP (tos 0x0, ttl 64, id 36367, offset 0, flags [DF], proto TCP (6), length 52)
    127.0.0.1.47012 > 127.0.0.1.10650: Flags [.], cksum 0xfe28 (incorrect -> 0x6fda), seq 950, ack 313441, win 14832, options [nop,nop,TS val 401653096 ecr 401653096], length 0
2022-04-07 08:16:10.594138 IP (tos 0x0, ttl 64, id 3912, offset 0, flags [DF], proto TCP (6), length 4100)
    127.0.0.1.10650 > 127.0.0.1.47012: Flags [P.], cksum 0x0df9 (incorrect -> 0xcabe), seq 313441:317489, ack 950, win 512, options [nop,nop,TS val 401653097 ecr 401653096], length 4048
2022-04-07 08:16:10.594159 IP (tos 0x0, ttl 64, id 36368, offset 0, flags [DF], proto TCP (6), length 52)
    127.0.0.1.47012 > 127.0.0.1.10650: Flags [.], cksum 0xfe28 (incorrect -> 0x6008), seq 950, ack 317489, win 14832, options [nop,nop,TS val 401653097 ecr 401653097], length 0
2022-04-07 08:16:10.594163 IP (tos 0x0, ttl 64, id 3913, offset 0, flags [DF], proto TCP (6), length 372)
    127.0.0.1.10650 > 127.0.0.1.47012: Flags [P.], cksum 0xff68 (incorrect -> 0xfb09), seq 317489:317809, ack 950, win 512, options [nop,nop,TS val 401653097 ecr 401653097], length 320
2022-04-07 08:16:10.594168 IP (tos 0x0, ttl 64, id 36369, offset 0, flags [DF], proto TCP (6), length 52)
    127.0.0.1.47012 > 127.0.0.1.10650: Flags [.], cksum 0xfe28 (incorrect -> 0x5ec8), seq 950, ack 317809, win 14832, options [nop,nop,TS val 401653097 ecr 401653097], length 0
2022-04-07 08:16:10.595945 IP (tos 0x0, ttl 64, id 3914, offset 0, flags [DF], proto TCP (6), length 3538)
    127.0.0.1.10650 > 127.0.0.1.47012: Flags [P.], cksum 0x0bc7 (incorrect -> 0x1503), seq 317809:321295, ack 950, win 512, options [nop,nop,TS val 401653098 ecr 401653097], length 3486
2022-04-07 08:16:10.595959 IP (tos 0x0, ttl 64, id 36370, offset 0, flags [DF], proto TCP (6), length 52)
    127.0.0.1.47012 > 127.0.0.1.10650: Flags [.], cksum 0xfe28 (incorrect -> 0x5128), seq 950, ack 321295, win 14832, options [nop,nop,TS val 401653098 ecr 401653098], length 0
2022-04-07 08:16:10.597143 IP (tos 0x0, ttl 64, id 3915, offset 0, flags [DF], proto TCP (6), length 4036)
    127.0.0.1.10650 > 127.0.0.1.47012: Flags [P.], cksum 0x0db9 (incorrect -> 0x9eac), seq 321295:325279, ack 950, win 512, options [nop,nop,TS val 401653100 ecr 401653098], length 3984
2022-04-07 08:16:10.597215 IP (tos 0x0, ttl 64, id 36371, offset 0, flags [DF], proto TCP (6), length 52)
    127.0.0.1.47012 > 127.0.0.1.10650: Flags [.], cksum 0xfe28 (incorrect -> 0x4194), seq 950, ack 325279, win 14832, options [nop,nop,TS val 401653100 ecr 401653100], length 0
2022-04-07 08:16:10.597222 IP (tos 0x0, ttl 64, id 3916, offset 0, flags [DF], proto TCP (6), length 7218)
    127.0.0.1.10650 > 127.0.0.1.47012: Flags [P.], cksum 0x1a27 (incorrect -> 0x185e), seq 325279:332445, ack 950, win 512, options [nop,nop,TS val 401653100 ecr 401653100], length 7166
2022-04-07 08:16:10.597394 IP (tos 0x0, ttl 64, id 36372, offset 0, flags [DF], proto TCP (6), length 52)
    127.0.0.1.47012 > 127.0.0.1.10650: Flags [.], cksum 0xfe28 (incorrect -> 0x2596), seq 950, ack 332445, win 14832, options [nop,nop,TS val 401653100 ecr 401653100], length 0
2022-04-07 08:16:10.600843 IP (tos 0x0, ttl 64, id 3917, offset 0, flags [DF], proto TCP (6), length 2850)
    127.0.0.1.10650 > 127.0.0.1.47012: Flags [P.], cksum 0x0917 (incorrect -> 0x37a7), seq 332445:335243, ack 950, win 512, options [nop,nop,TS val 401653103 ecr 401653100], length 2798
2022-04-07 08:16:10.600857 IP (tos 0x0, ttl 64, id 36373, offset 0, flags [DF], proto TCP (6), length 52)
    127.0.0.1.47012 > 127.0.0.1.10650: Flags [.], cksum 0xfe28 (incorrect -> 0x1aa2), seq 950, ack 335243, win 14832, options [nop,nop,TS val 401653103 ecr 401653103], length 0
2022-04-07 08:16:10.607093 IP (tos 0x0, ttl 64, id 3918, offset 0, flags [DF], proto TCP (6), length 4036)
    127.0.0.1.10650 > 127.0.0.1.47012: Flags [P.], cksum 0x0db9 (incorrect -> 0x48fb), seq 335243:339227, ack 950, win 512, options [nop,nop,TS val 401653110 ecr 401653103], length 3984
2022-04-07 08:16:10.607139 IP (tos 0x0, ttl 64, id 36374, offset 0, flags [DF], proto TCP (6), length 52)
    127.0.0.1.47012 > 127.0.0.1.10650: Flags [.], cksum 0xfe28 (incorrect -> 0x0b04), seq 950, ack 339227, win 14832, options [nop,nop,TS val 401653110 ecr 401653110], length 0
2022-04-07 08:16:10.607144 IP (tos 0x0, ttl 64, id 3919, offset 0, flags [DF], proto TCP (6), length 3348)
    127.0.0.1.10650 > 127.0.0.1.47012: Flags [P.], cksum 0x0b09 (incorrect -> 0xeaca), seq 339227:342523, ack 950, win 512, options [nop,nop,TS val 401653110 ecr 401653110], length 3296
2022-04-07 08:16:10.607149 IP (tos 0x0, ttl 64, id 36375, offset 0, flags [DF], proto TCP (6), length 52)
    127.0.0.1.47012 > 127.0.0.1.10650: Flags [.], cksum 0xfe28 (incorrect -> 0xfe23), seq 950, ack 342523, win 14832, options [nop,nop,TS val 401653110 ecr 401653110], length 0
2022-04-07 08:16:10.609081 IP (tos 0x0, ttl 64, id 3920, offset 0, flags [DF], proto TCP (6), length 4100)
    127.0.0.1.10650 > 127.0.0.1.47012: Flags [P.], cksum 0x0df9 (incorrect -> 0xa03a), seq 342523:346571, ack 950, win 512, options [nop,nop,TS val 401653112 ecr 401653110], length 4048
2022-04-07 08:16:10.609323 IP (tos 0x0, ttl 64, id 36376, offset 0, flags [DF], proto TCP (6), length 52)
    127.0.0.1.47012 > 127.0.0.1.10650: Flags [.], cksum 0xfe28 (incorrect -> 0xee4f), seq 950, ack 346571, win 14832, options [nop,nop,TS val 401653112 ecr 401653112], length 0
2022-04-07 08:16:10.609332 IP (tos 0x0, ttl 64, id 3921, offset 0, flags [DF], proto TCP (6), length 7268)
    127.0.0.1.10650 > 127.0.0.1.47012: Flags [P.], cksum 0x1a59 (incorrect -> 0x4f38), seq 346571:353787, ack 950, win 512, options [nop,nop,TS val 401653112 ecr 401653112], length 7216
2022-04-07 08:16:10.609337 IP (tos 0x0, ttl 64, id 36377, offset 0, flags [DF], proto TCP (6), length 52)
    127.0.0.1.47012 > 127.0.0.1.10650: Flags [.], cksum 0xfe28 (incorrect -> 0xd21f), seq 950, ack 353787, win 14832, options [nop,nop,TS val 401653112 ecr 401653112], length 0
2022-04-07 08:16:10.609378 IP (tos 0x0, ttl 64, id 3922, offset 0, flags [DF], proto TCP (6), length 3846)
    127.0.0.1.10650 > 127.0.0.1.47012: Flags [P.], cksum 0x0cfb (incorrect -> 0xe2e8), seq 353787:357581, ack 950, win 512, options [nop,nop,TS val 401653112 ecr 401653112], length 3794
2022-04-07 08:16:10.609394 IP (tos 0x0, ttl 64, id 36378, offset 0, flags [DF], proto TCP (6), length 52)
    127.0.0.1.47012 > 127.0.0.1.10650: Flags [.], cksum 0xfe28 (incorrect -> 0xc34d), seq 950, ack 357581, win 14832, options [nop,nop,TS val 401653112 ecr 401653112], length 0
2022-04-07 08:16:10.609922 IP (tos 0x0, ttl 64, id 3923, offset 0, flags [DF], proto TCP (6), length 4100)
    127.0.0.1.10650 > 127.0.0.1.47012: Flags [P.], cksum 0x0df9 (incorrect -> 0x437e), seq 357581:361629, ack 950, win 512, options [nop,nop,TS val 401653112 ecr 401653112], length 4048
2022-04-07 08:16:10.610144 IP (tos 0x0, ttl 64, id 36379, offset 0, flags [DF], proto TCP (6), length 52)
    127.0.0.1.47012 > 127.0.0.1.10650: Flags [.], cksum 0xfe28 (incorrect -> 0xb37c), seq 950, ack 361629, win 14832, options [nop,nop,TS val 401653113 ecr 401653112], length 0
2022-04-07 08:16:10.610149 IP (tos 0x0, ttl 64, id 3924, offset 0, flags [DF], proto TCP (6), length 486)
    127.0.0.1.10650 > 127.0.0.1.47012: Flags [P.], cksum 0xffda (incorrect -> 0x3050), seq 361629:362063, ack 950, win 512, options [nop,nop,TS val 401653113 ecr 401653113], length 434
2022-04-07 08:16:10.610154 IP (tos 0x0, ttl 64, id 36380, offset 0, flags [DF], proto TCP (6), length 52)
    127.0.0.1.47012 > 127.0.0.1.10650: Flags [.], cksum 0xfe28 (incorrect -> 0xb1c9), seq 950, ack 362063, win 14832, options [nop,nop,TS val 401653113 ecr 401653113], length 0
2022-04-07 08:16:10.614681 IP (tos 0x0, ttl 64, id 3925, offset 0, flags [DF], proto TCP (6), length 2352)
    127.0.0.1.10650 > 127.0.0.1.47012: Flags [P.], cksum 0x0725 (incorrect -> 0x2c91), seq 362063:364363, ack 950, win 512, options [nop,nop,TS val 401653117 ecr 401653113], length 2300
2022-04-07 08:16:10.614699 IP (tos 0x0, ttl 64, id 36381, offset 0, flags [DF], proto TCP (6), length 52)
    127.0.0.1.47012 > 127.0.0.1.10650: Flags [.], cksum 0xfe28 (incorrect -> 0xa8c5), seq 950, ack 364363, win 14832, options [nop,nop,TS val 401653117 ecr 401653117], length 0
2022-04-07 08:16:10.615275 IP (tos 0x0, ttl 64, id 3926, offset 0, flags [DF], proto TCP (6), length 3538)
    127.0.0.1.10650 > 127.0.0.1.47012: Flags [P.], cksum 0x0bc7 (incorrect -> 0x693c), seq 364363:367849, ack 950, win 512, options [nop,nop,TS val 401653118 ecr 401653117], length 3486
2022-04-07 08:16:10.615320 IP (tos 0x0, ttl 64, id 36382, offset 0, flags [DF], proto TCP (6), length 52)
    127.0.0.1.47012 > 127.0.0.1.10650: Flags [.], cksum 0xfe28 (incorrect -> 0x9b25), seq 950, ack 367849, win 14832, options [nop,nop,TS val 401653118 ecr 401653118], length 0
2022-04-07 08:16:10.615326 IP (tos 0x0, ttl 64, id 3927, offset 0, flags [DF], proto TCP (6), length 3846)
    127.0.0.1.10650 > 127.0.0.1.47012: Flags [P.], cksum 0x0cfb (incorrect -> 0x89ed), seq 367849:371643, ack 950, win 512, options [nop,nop,TS val 401653118 ecr 401653118], length 3794
2022-04-07 08:16:10.615331 IP (tos 0x0, ttl 64, id 36383, offset 0, flags [DF], proto TCP (6), length 52)
    127.0.0.1.47012 > 127.0.0.1.10650: Flags [.], cksum 0xfe28 (incorrect -> 0x8c53), seq 950, ack 371643, win 14832, options [nop,nop,TS val 401653118 ecr 401653118], length 0
2022-04-07 08:16:10.615431 IP (tos 0x0, ttl 64, id 3928, offset 0, flags [DF], proto TCP (6), length 4036)
    127.0.0.1.10650 > 127.0.0.1.47012: Flags [P.], cksum 0x0db9 (incorrect -> 0x85e6), seq 371643:375627, ack 950, win 512, options [nop,nop,TS val 401653118 ecr 401653118], length 3984
2022-04-07 08:16:10.615451 IP (tos 0x0, ttl 64, id 36384, offset 0, flags [DF], proto TCP (6), length 52)
    127.0.0.1.47012 > 127.0.0.1.10650: Flags [.], cksum 0xfe28 (incorrect -> 0x7cc3), seq 950, ack 375627, win 14832, options [nop,nop,TS val 401653118 ecr 401653118], length 0
2022-04-07 08:16:10.623267 IP (tos 0x0, ttl 64, id 3929, offset 0, flags [DF], proto TCP (6), length 4100)
    127.0.0.1.10650 > 127.0.0.1.47012: Flags [P.], cksum 0x0df9 (incorrect -> 0x7faa), seq 375627:379675, ack 950, win 512, options [nop,nop,TS val 401653126 ecr 401653118], length 4048
2022-04-07 08:16:10.623707 IP (tos 0x0, ttl 64, id 36385, offset 0, flags [DF], proto TCP (6), length 52)
    127.0.0.1.47012 > 127.0.0.1.10650: Flags [.], cksum 0xfe28 (incorrect -> 0x6ce3), seq 950, ack 379675, win 14832, options [nop,nop,TS val 401653126 ecr 401653126], length 0
2022-04-07 08:16:10.623717 IP (tos 0x0, ttl 64, id 3930, offset 0, flags [DF], proto TCP (6), length 5238)
    127.0.0.1.10650 > 127.0.0.1.47012: Flags [P.], cksum 0x126b (incorrect -> 0x7a7b), seq 379675:384861, ack 950, win 512, options [nop,nop,TS val 401653126 ecr 401653126], length 5186
2022-04-07 08:16:10.623723 IP (tos 0x0, ttl 64, id 36386, offset 0, flags [DF], proto TCP (6), length 52)
    127.0.0.1.47012 > 127.0.0.1.10650: Flags [.], cksum 0xfe28 (incorrect -> 0x58a1), seq 950, ack 384861, win 14832, options [nop,nop,TS val 401653126 ecr 401653126], length 0
2022-04-07 08:16:10.625798 IP (tos 0x0, ttl 64, id 3931, offset 0, flags [DF], proto TCP (6), length 2850)
    127.0.0.1.10650 > 127.0.0.1.47012: Flags [P.], cksum 0x0917 (incorrect -> 0xd281), seq 384861:387659, ack 950, win 512, options [nop,nop,TS val 401653128 ecr 401653126], length 2798
2022-04-07 08:16:10.625813 IP (tos 0x0, ttl 64, id 36387, offset 0, flags [DF], proto TCP (6), length 52)
    127.0.0.1.47012 > 127.0.0.1.10650: Flags [.], cksum 0xfe28 (incorrect -> 0x4daf), seq 950, ack 387659, win 14832, options [nop,nop,TS val 401653128 ecr 401653128], length 0
2022-04-07 08:16:10.628496 IP (tos 0x0, ttl 64, id 3932, offset 0, flags [DF], proto TCP (6), length 3538)
    127.0.0.1.10650 > 127.0.0.1.47012: Flags [P.], cksum 0x0bc7 (incorrect -> 0x0675), seq 387659:391145, ack 950, win 512, options [nop,nop,TS val 401653131 ecr 401653128], length 3486
2022-04-07 08:16:10.628512 IP (tos 0x0, ttl 64, id 36388, offset 0, flags [DF], proto TCP (6), length 52)
    127.0.0.1.47012 > 127.0.0.1.10650: Flags [.], cksum 0xfe28 (incorrect -> 0x400b), seq 950, ack 391145, win 14832, options [nop,nop,TS val 401653131 ecr 401653131], length 0
2022-04-07 08:16:10.632392 IP (tos 0x0, ttl 64, id 3933, offset 0, flags [DF], proto TCP (6), length 4036)
    127.0.0.1.10650 > 127.0.0.1.47012: Flags [P.], cksum 0x0db9 (incorrect -> 0xe785), seq 391145:395129, ack 950, win 512, options [nop,nop,TS val 401653135 ecr 401653131], length 3984
2022-04-07 08:16:10.632787 IP (tos 0x0, ttl 64, id 36389, offset 0, flags [DF], proto TCP (6), length 52)
    127.0.0.1.47012 > 127.0.0.1.10650: Flags [.], cksum 0xfe28 (incorrect -> 0x3073), seq 950, ack 395129, win 14832, options [nop,nop,TS val 401653135 ecr 401653135], length 0
2022-04-07 08:16:10.632796 IP (tos 0x0, ttl 64, id 3934, offset 0, flags [DF], proto TCP (6), length 11506)
    127.0.0.1.10650 > 127.0.0.1.47012: Flags [P.], cksum 0x2ae7 (incorrect -> 0xabc2), seq 395129:406583, ack 950, win 512, options [nop,nop,TS val 401653135 ecr 401653135], length 11454
2022-04-07 08:16:10.632803 IP (tos 0x0, ttl 64, id 36390, offset 0, flags [DF], proto TCP (6), length 52)
    127.0.0.1.47012 > 127.0.0.1.10650: Flags [.], cksum 0xfe28 (incorrect -> 0x03b5), seq 950, ack 406583, win 14832, options [nop,nop,TS val 401653135 ecr 401653135], length 0
2022-04-07 08:16:10.634558 IP (tos 0x0, ttl 64, id 3935, offset 0, flags [DF], proto TCP (6), length 4100)
    127.0.0.1.10650 > 127.0.0.1.47012: Flags [P.], cksum 0x0df9 (incorrect -> 0xaa1c), seq 406583:410631, ack 950, win 512, options [nop,nop,TS val 401653137 ecr 401653135], length 4048
2022-04-07 08:16:10.634783 IP (tos 0x0, ttl 64, id 36391, offset 0, flags [DF], proto TCP (6), length 52)
    127.0.0.1.47012 > 127.0.0.1.10650: Flags [.], cksum 0xfe28 (incorrect -> 0xf3e0), seq 950, ack 410631, win 14832, options [nop,nop,TS val 401653137 ecr 401653137], length 0
2022-04-07 08:16:10.634791 IP (tos 0x0, ttl 64, id 3936, offset 0, flags [DF], proto TCP (6), length 7386)
    127.0.0.1.10650 > 127.0.0.1.47012: Flags [P.], cksum 0x1acf (incorrect -> 0x4fe7), seq 410631:417965, ack 950, win 512, options [nop,nop,TS val 401653137 ecr 401653137], length 7334
2022-04-07 08:16:10.634797 IP (tos 0x0, ttl 64, id 36392, offset 0, flags [DF], proto TCP (6), length 52)
    127.0.0.1.47012 > 127.0.0.1.10650: Flags [.], cksum 0xfe28 (incorrect -> 0xd73a), seq 950, ack 417965, win 14832, options [nop,nop,TS val 401653137 ecr 401653137], length 0
2022-04-07 08:16:10.636644 IP (tos 0x0, ttl 64, id 3937, offset 0, flags [DF], proto TCP (6), length 4100)
    127.0.0.1.10650 > 127.0.0.1.47012: Flags [P.], cksum 0x0df9 (incorrect -> 0x2698), seq 417965:422013, ack 950, win 512, options [nop,nop,TS val 401653139 ecr 401653137], length 4048
2022-04-07 08:16:10.637008 IP (tos 0x0, ttl 64, id 36393, offset 0, flags [DF], proto TCP (6), length 52)
    127.0.0.1.47012 > 127.0.0.1.10650: Flags [.], cksum 0xfe28 (incorrect -> 0xc766), seq 950, ack 422013, win 14832, options [nop,nop,TS val 401653139 ecr 401653139], length 0
2022-04-07 08:16:10.637020 IP (tos 0x0, ttl 64, id 3938, offset 0, flags [DF], proto TCP (6), length 486)
    127.0.0.1.10650 > 127.0.0.1.47012: Flags [P.], cksum 0xffda (incorrect -> 0xb499), seq 422013:422447, ack 950, win 512, options [nop,nop,TS val 401653139 ecr 401653139], length 434
2022-04-07 08:16:10.637136 IP (tos 0x0, ttl 64, id 36394, offset 0, flags [DF], proto TCP (6), length 52)
    127.0.0.1.47012 > 127.0.0.1.10650: Flags [.], cksum 0xfe28 (incorrect -> 0xc5b3), seq 950, ack 422447, win 14832, options [nop,nop,TS val 401653140 ecr 401653139], length 0
2022-04-07 08:16:10.637144 IP (tos 0x0, ttl 64, id 3939, offset 0, flags [DF], proto TCP (6), length 11225)
    127.0.0.1.10650 > 127.0.0.1.47012: Flags [P.], cksum 0x29ce (incorrect -> 0x329e), seq 422447:433620, ack 950, win 512, options [nop,nop,TS val 401653140 ecr 401653140], length 11173
2022-04-07 08:16:10.637360 IP (tos 0x0, ttl 64, id 36395, offset 0, flags [DF], proto TCP (6), length 52)
    127.0.0.1.47012 > 127.0.0.1.10650: Flags [.], cksum 0xfe28 (incorrect -> 0x9a0d), seq 950, ack 433620, win 14832, options [nop,nop,TS val 401653140 ecr 401653140], length 0
2022-04-07 08:16:10.642403 IP (tos 0x0, ttl 64, id 3940, offset 0, flags [DF], proto TCP (6), length 4100)
    127.0.0.1.10650 > 127.0.0.1.47012: Flags [P.], cksum 0x0df9 (incorrect -> 0x398e), seq 433620:437668, ack 950, win 512, options [nop,nop,TS val 401653145 ecr 401653140], length 4048
2022-04-07 08:16:10.642421 IP (tos 0x0, ttl 64, id 36396, offset 0, flags [DF], proto TCP (6), length 52)
    127.0.0.1.47012 > 127.0.0.1.10650: Flags [.], cksum 0xfe28 (incorrect -> 0x8a33), seq 950, ack 437668, win 14832, options [nop,nop,TS val 401653145 ecr 401653145], length 0
2022-04-07 08:16:10.642426 IP (tos 0x0, ttl 64, id 3941, offset 0, flags [DF], proto TCP (6), length 296)
    127.0.0.1.10650 > 127.0.0.1.47012: Flags [P.], cksum 0xff1c (incorrect -> 0x660a), seq 437668:437912, ack 950, win 512, options [nop,nop,TS val 401653145 ecr 401653145], length 244
2022-04-07 08:16:10.642430 IP (tos 0x0, ttl 64, id 36397, offset 0, flags [DF], proto TCP (6), length 52)
    127.0.0.1.47012 > 127.0.0.1.10650: Flags [.], cksum 0xfe28 (incorrect -> 0x893f), seq 950, ack 437912, win 14832, options [nop,nop,TS val 401653145 ecr 401653145], length 0
2022-04-07 08:16:10.648312 IP (tos 0x0, ttl 64, id 3942, offset 0, flags [DF], proto TCP (6), length 3538)
    127.0.0.1.10650 > 127.0.0.1.47012: Flags [P.], cksum 0x0bc7 (incorrect -> 0xc431), seq 437912:441398, ack 950, win 512, options [nop,nop,TS val 401653151 ecr 401653145], length 3486
2022-04-07 08:16:10.648333 IP (tos 0x0, ttl 64, id 36398, offset 0, flags [DF], proto TCP (6), length 52)
    127.0.0.1.47012 > 127.0.0.1.10650: Flags [.], cksum 0xfe28 (incorrect -> 0x7b95), seq 950, ack 441398, win 14832, options [nop,nop,TS val 401653151 ecr 401653151], length 0
2022-04-07 08:16:10.648403 IP (tos 0x0, ttl 64, id 3943, offset 0, flags [DF], proto TCP (6), length 3815)
    127.0.0.1.10650 > 127.0.0.1.47012: Flags [P.], cksum 0x0cdc (incorrect -> 0xbed4), seq 441398:445161, ack 950, win 512, options [nop,nop,TS val 401653151 ecr 401653151], length 3763
2022-04-07 08:16:10.648585 IP (tos 0x0, ttl 64, id 36399, offset 0, flags [DF], proto TCP (6), length 52)
    127.0.0.1.47012 > 127.0.0.1.10650: Flags [.], cksum 0xfe28 (incorrect -> 0x6ce2), seq 950, ack 445161, win 14832, options [nop,nop,TS val 401653151 ecr 401653151], length 0
2022-04-07 08:16:10.654322 IP (tos 0x0, ttl 64, id 3944, offset 0, flags [DF], proto TCP (6), length 4036)
    127.0.0.1.10650 > 127.0.0.1.47012: Flags [P.], cksum 0x0db9 (incorrect -> 0x7cb6), seq 445161:449145, ack 950, win 512, options [nop,nop,TS val 401653157 ecr 401653151], length 3984
2022-04-07 08:16:10.654371 IP (tos 0x0, ttl 64, id 36400, offset 0, flags [DF], proto TCP (6), length 52)
    127.0.0.1.47012 > 127.0.0.1.10650: Flags [.], cksum 0xfe28 (incorrect -> 0x5d46), seq 950, ack 449145, win 14832, options [nop,nop,TS val 401653157 ecr 401653157], length 0
2022-04-07 08:16:10.654379 IP (tos 0x0, ttl 64, id 3945, offset 0, flags [DF], proto TCP (6), length 3348)
    127.0.0.1.10650 > 127.0.0.1.47012: Flags [P.], cksum 0x0b09 (incorrect -> 0x57ed), seq 449145:452441, ack 950, win 512, options [nop,nop,TS val 401653157 ecr 401653157], length 3296
2022-04-07 08:16:10.654390 IP (tos 0x0, ttl 64, id 36401, offset 0, flags [DF], proto TCP (6), length 52)
    127.0.0.1.47012 > 127.0.0.1.10650: Flags [.], cksum 0xfe28 (incorrect -> 0x5066), seq 950, ack 452441, win 14832, options [nop,nop,TS val 401653157 ecr 401653157], length 0
2022-04-07 08:16:10.654464 IP (tos 0x0, ttl 64, id 3946, offset 0, flags [DF], proto TCP (6), length 4100)
    127.0.0.1.10650 > 127.0.0.1.47012: Flags [P.], cksum 0x0df9 (incorrect -> 0xf5f8), seq 452441:456489, ack 950, win 512, options [nop,nop,TS val 401653157 ecr 401653157], length 4048
2022-04-07 08:16:10.654502 IP (tos 0x0, ttl 64, id 36402, offset 0, flags [DF], proto TCP (6), length 52)
    127.0.0.1.47012 > 127.0.0.1.10650: Flags [.], cksum 0xfe28 (incorrect -> 0x4096), seq 950, ack 456489, win 14832, options [nop,nop,TS val 401653157 ecr 401653157], length 0
2022-04-07 08:16:10.654508 IP (tos 0x0, ttl 64, id 3947, offset 0, flags [DF], proto TCP (6), length 3674)
    127.0.0.1.10650 > 127.0.0.1.47012: Flags [P.], cksum 0x0c4f (incorrect -> 0x7ee7), seq 456489:460111, ack 950, win 512, options [nop,nop,TS val 401653157 ecr 401653157], length 3622
2022-04-07 08:16:10.654615 IP (tos 0x0, ttl 64, id 36403, offset 0, flags [DF], proto TCP (6), length 52)
    127.0.0.1.47012 > 127.0.0.1.10650: Flags [.], cksum 0xfe28 (incorrect -> 0x3270), seq 950, ack 460111, win 14832, options [nop,nop,TS val 401653157 ecr 401653157], length 0
2022-04-07 08:16:10.655172 IP (tos 0x0, ttl 64, id 3948, offset 0, flags [DF], proto TCP (6), length 4100)
    127.0.0.1.10650 > 127.0.0.1.47012: Flags [P.], cksum 0x0df9 (incorrect -> 0xb0c2), seq 460111:464159, ack 950, win 512, options [nop,nop,TS val 401653158 ecr 401653157], length 4048
2022-04-07 08:16:10.655264 IP (tos 0x0, ttl 64, id 36404, offset 0, flags [DF], proto TCP (6), length 52)
    127.0.0.1.47012 > 127.0.0.1.10650: Flags [.], cksum 0xfe28 (incorrect -> 0x229e), seq 950, ack 464159, win 14832, options [nop,nop,TS val 401653158 ecr 401653158], length 0
2022-04-07 08:16:10.655270 IP (tos 0x0, ttl 64, id 3949, offset 0, flags [DF], proto TCP (6), length 3782)
    127.0.0.1.10650 > 127.0.0.1.47012: Flags [P.], cksum 0x0cbb (incorrect -> 0x088e), seq 464159:467889, ack 950, win 512, options [nop,nop,TS val 401653158 ecr 401653158], length 3730
2022-04-07 08:16:10.655275 IP (tos 0x0, ttl 64, id 36405, offset 0, flags [DF], proto TCP (6), length 52)
    127.0.0.1.47012 > 127.0.0.1.10650: Flags [.], cksum 0xfe28 (incorrect -> 0x140c), seq 950, ack 467889, win 14832, options [nop,nop,TS val 401653158 ecr 401653158], length 0
2022-04-07 08:16:10.655315 IP (tos 0x0, ttl 64, id 3950, offset 0, flags [DF], proto TCP (6), length 4036)
    127.0.0.1.10650 > 127.0.0.1.47012: Flags [P.], cksum 0x0db9 (incorrect -> 0xae70), seq 467889:471873, ack 950, win 512, options [nop,nop,TS val 401653158 ecr 401653158], length 3984
2022-04-07 08:16:10.655327 IP (tos 0x0, ttl 64, id 36406, offset 0, flags [DF], proto TCP (6), length 52)
    127.0.0.1.47012 > 127.0.0.1.10650: Flags [.], cksum 0xfe28 (incorrect -> 0x047c), seq 950, ack 471873, win 14832, options [nop,nop,TS val 401653158 ecr 401653158], length 0
2022-04-07 08:16:10.656260 IP (tos 0x0, ttl 64, id 3951, offset 0, flags [DF], proto TCP (6), length 4100)
    127.0.0.1.10650 > 127.0.0.1.47012: Flags [P.], cksum 0x0df9 (incorrect -> 0xba70), seq 471873:475921, ack 950, win 512, options [nop,nop,TS val 401653159 ecr 401653158], length 4048
2022-04-07 08:16:10.656285 IP (tos 0x0, ttl 64, id 36407, offset 0, flags [DF], proto TCP (6), length 52)
    127.0.0.1.47012 > 127.0.0.1.10650: Flags [.], cksum 0xfe28 (incorrect -> 0xf4a9), seq 950, ack 475921, win 14832, options [nop,nop,TS val 401653159 ecr 401653159], length 0
2022-04-07 08:16:10.656290 IP (tos 0x0, ttl 64, id 3952, offset 0, flags [DF], proto TCP (6), length 2288)
    127.0.0.1.10650 > 127.0.0.1.47012: Flags [P.], cksum 0x06e5 (incorrect -> 0x31ea), seq 475921:478157, ack 950, win 512, options [nop,nop,TS val 401653159 ecr 401653159], length 2236
2022-04-07 08:16:10.656488 IP (tos 0x0, ttl 64, id 36408, offset 0, flags [DF], proto TCP (6), length 52)
    127.0.0.1.47012 > 127.0.0.1.10650: Flags [.], cksum 0xfe28 (incorrect -> 0xebed), seq 950, ack 478157, win 14832, options [nop,nop,TS val 401653159 ecr 401653159], length 0
2022-04-07 08:16:10.666157 IP (tos 0x0, ttl 64, id 3953, offset 0, flags [DF], proto TCP (6), length 4100)
    127.0.0.1.10650 > 127.0.0.1.47012: Flags [P.], cksum 0x0df9 (incorrect -> 0x1fc4), seq 478157:482205, ack 950, win 512, options [nop,nop,TS val 401653169 ecr 401653159], length 4048
2022-04-07 08:16:10.666264 IP (tos 0x0, ttl 64, id 36409, offset 0, flags [DF], proto TCP (6), length 52)
    127.0.0.1.47012 > 127.0.0.1.10650: Flags [.], cksum 0xfe28 (incorrect -> 0xdc09), seq 950, ack 482205, win 14832, options [nop,nop,TS val 401653169 ecr 401653169], length 0
2022-04-07 08:16:10.666273 IP (tos 0x0, ttl 64, id 3954, offset 0, flags [DF], proto TCP (6), length 3284)
    127.0.0.1.10650 > 127.0.0.1.47012: Flags [P.], cksum 0x0ac9 (incorrect -> 0xfdb3), seq 482205:485437, ack 950, win 512, options [nop,nop,TS val 401653169 ecr 401653169], length 3232
2022-04-07 08:16:10.666279 IP (tos 0x0, ttl 64, id 36410, offset 0, flags [DF], proto TCP (6), length 52)
    127.0.0.1.47012 > 127.0.0.1.10650: Flags [.], cksum 0xfe28 (incorrect -> 0xcf69), seq 950, ack 485437, win 14832, options [nop,nop,TS val 401653169 ecr 401653169], length 0
2022-04-07 08:16:10.668309 IP (tos 0x0, ttl 64, id 3955, offset 0, flags [DF], proto TCP (6), length 4100)
    127.0.0.1.10650 > 127.0.0.1.47012: Flags [P.], cksum 0x0df9 (incorrect -> 0x8465), seq 485437:489485, ack 950, win 512, options [nop,nop,TS val 401653171 ecr 401653169], length 4048
2022-04-07 08:16:10.668366 IP (tos 0x0, ttl 64, id 36411, offset 0, flags [DF], proto TCP (6), length 52)
    127.0.0.1.47012 > 127.0.0.1.10650: Flags [.], cksum 0xfe28 (incorrect -> 0xbf95), seq 950, ack 489485, win 14832, options [nop,nop,TS val 401653171 ecr 401653171], length 0
2022-04-07 08:16:10.668372 IP (tos 0x0, ttl 64, id 3956, offset 0, flags [DF], proto TCP (6), length 7458)
    127.0.0.1.10650 > 127.0.0.1.47012: Flags [P.], cksum 0x1b17 (incorrect -> 0xf34a), seq 489485:496891, ack 950, win 512, options [nop,nop,TS val 401653171 ecr 401653171], length 7406
2022-04-07 08:16:10.668508 IP (tos 0x0, ttl 64, id 36412, offset 0, flags [DF], proto TCP (6), length 52)
    127.0.0.1.47012 > 127.0.0.1.10650: Flags [.], cksum 0xfe28 (incorrect -> 0xa2a7), seq 950, ack 496891, win 14832, options [nop,nop,TS val 401653171 ecr 401653171], length 0
2022-04-07 08:16:10.670125 IP (tos 0x0, ttl 64, id 3957, offset 0, flags [DF], proto TCP (6), length 4036)
    127.0.0.1.10650 > 127.0.0.1.47012: Flags [P.], cksum 0x0db9 (incorrect -> 0x636d), seq 496891:500875, ack 950, win 512, options [nop,nop,TS val 401653173 ecr 401653171], length 3984
2022-04-07 08:16:10.670140 IP (tos 0x0, ttl 64, id 36413, offset 0, flags [DF], proto TCP (6), length 52)
    127.0.0.1.47012 > 127.0.0.1.10650: Flags [.], cksum 0xfe28 (incorrect -> 0x9313), seq 950, ack 500875, win 14832, options [nop,nop,TS val 401653173 ecr 401653173], length 0
2022-04-07 08:16:10.670725 IP (tos 0x0, ttl 64, id 3958, offset 0, flags [DF], proto TCP (6), length 3538)
    127.0.0.1.10650 > 127.0.0.1.47012: Flags [P.], cksum 0x0bc7 (incorrect -> 0x45ba), seq 500875:504361, ack 950, win 512, options [nop,nop,TS val 401653173 ecr 401653173], length 3486
2022-04-07 08:16:10.670740 IP (tos 0x0, ttl 64, id 36414, offset 0, flags [DF], proto TCP (6), length 52)
    127.0.0.1.47012 > 127.0.0.1.10650: Flags [.], cksum 0xfe28 (incorrect -> 0x8575), seq 950, ack 504361, win 14832, options [nop,nop,TS val 401653173 ecr 401653173], length 0
2022-04-07 08:16:10.672612 IP (tos 0x0, ttl 64, id 3959, offset 0, flags [DF], proto TCP (6), length 2542)
    127.0.0.1.10650 > 127.0.0.1.47012: Flags [P.], cksum 0x07e3 (incorrect -> 0x56e3), seq 504361:506851, ack 950, win 512, options [nop,nop,TS val 401653175 ecr 401653173], length 2490
2022-04-07 08:16:10.672770 IP (tos 0x0, ttl 64, id 36415, offset 0, flags [DF], proto TCP (6), length 52)
    127.0.0.1.47012 > 127.0.0.1.10650: Flags [.], cksum 0xfe28 (incorrect -> 0x7bb7), seq 950, ack 506851, win 14832, options [nop,nop,TS val 401653175 ecr 401653175], length 0
2022-04-07 08:16:10.674588 IP (tos 0x0, ttl 64, id 3960, offset 0, flags [DF], proto TCP (6), length 4100)
    127.0.0.1.10650 > 127.0.0.1.47012: Flags [P.], cksum 0x0df9 (incorrect -> 0x2351), seq 506851:510899, ack 950, win 512, options [nop,nop,TS val 401653177 ecr 401653175], length 4048
2022-04-07 08:16:10.674867 IP (tos 0x0, ttl 64, id 36416, offset 0, flags [DF], proto TCP (6), length 52)
    127.0.0.1.47012 > 127.0.0.1.10650: Flags [.], cksum 0xfe28 (incorrect -> 0x6be3), seq 950, ack 510899, win 14832, options [nop,nop,TS val 401653177 ecr 401653177], length 0
2022-04-07 08:16:10.674882 IP (tos 0x0, ttl 64, id 3961, offset 0, flags [DF], proto TCP (6), length 7956)
    127.0.0.1.10650 > 127.0.0.1.47012: Flags [P.], cksum 0x1d09 (incorrect -> 0x65a1), seq 510899:518803, ack 950, win 512, options [nop,nop,TS val 401653177 ecr 401653177], length 7904
2022-04-07 08:16:10.674890 IP (tos 0x0, ttl 64, id 36417, offset 0, flags [DF], proto TCP (6), length 52)
    127.0.0.1.47012 > 127.0.0.1.10650: Flags [.], cksum 0xfe28 (incorrect -> 0x4d03), seq 950, ack 518803, win 14832, options [nop,nop,TS val 401653177 ecr 401653177], length 0
2022-04-07 08:16:10.676557 IP (tos 0x0, ttl 64, id 3962, offset 0, flags [DF], proto TCP (6), length 4036)
    127.0.0.1.10650 > 127.0.0.1.47012: Flags [P.], cksum 0x0db9 (incorrect -> 0x3a88), seq 518803:522787, ack 950, win 512, options [nop,nop,TS val 401653179 ecr 401653177], length 3984
2022-04-07 08:16:10.676587 IP (tos 0x0, ttl 64, id 36418, offset 0, flags [DF], proto TCP (6), length 52)
    127.0.0.1.47012 > 127.0.0.1.10650: Flags [.], cksum 0xfe28 (incorrect -> 0x3d6f), seq 950, ack 522787, win 14832, options [nop,nop,TS val 401653179 ecr 401653179], length 0
2022-04-07 08:16:10.684097 IP (tos 0x0, ttl 64, id 3963, offset 0, flags [DF], proto TCP (6), length 4100)
    127.0.0.1.10650 > 127.0.0.1.47012: Flags [P.], cksum 0x0df9 (incorrect -> 0x9694), seq 522787:526835, ack 950, win 512, options [nop,nop,TS val 401653187 ecr 401653179], length 4048
2022-04-07 08:16:10.684348 IP (tos 0x0, ttl 64, id 36419, offset 0, flags [DF], proto TCP (6), length 52)
    127.0.0.1.47012 > 127.0.0.1.10650: Flags [.], cksum 0xfe28 (incorrect -> 0x2d8f), seq 950, ack 526835, win 14832, options [nop,nop,TS val 401653187 ecr 401653187], length 0
2022-04-07 08:16:10.684353 IP (tos 0x0, ttl 64, id 3964, offset 0, flags [DF], proto TCP (6), length 486)
    127.0.0.1.10650 > 127.0.0.1.47012: Flags [P.], cksum 0xffda (incorrect -> 0x2b66), seq 526835:527269, ack 950, win 512, options [nop,nop,TS val 401653187 ecr 401653187], length 434
2022-04-07 08:16:10.684358 IP (tos 0x0, ttl 64, id 36420, offset 0, flags [DF], proto TCP (6), length 52)
    127.0.0.1.47012 > 127.0.0.1.10650: Flags [.], cksum 0xfe28 (incorrect -> 0x2bdd), seq 950, ack 527269, win 14832, options [nop,nop,TS val 401653187 ecr 401653187], length 0
2022-04-07 08:16:10.688600 IP (tos 0x0, ttl 64, id 3965, offset 0, flags [DF], proto TCP (6), length 3538)
    127.0.0.1.10650 > 127.0.0.1.47012: Flags [P.], cksum 0x0bc7 (incorrect -> 0xe478), seq 527269:530755, ack 950, win 512, options [nop,nop,TS val 401653191 ecr 401653187], length 3486
2022-04-07 08:16:10.688618 IP (tos 0x0, ttl 64, id 36421, offset 0, flags [DF], proto TCP (6), length 52)
    127.0.0.1.47012 > 127.0.0.1.10650: Flags [.], cksum 0xfe28 (incorrect -> 0x1e37), seq 950, ack 530755, win 14832, options [nop,nop,TS val 401653191 ecr 401653191], length 0
2022-04-07 08:16:10.690976 IP (tos 0x0, ttl 64, id 3966, offset 0, flags [DF], proto TCP (6), length 4036)
    127.0.0.1.10650 > 127.0.0.1.47012: Flags [P.], cksum 0x0db9 (incorrect -> 0x2b1e), seq 530755:534739, ack 950, win 512, options [nop,nop,TS val 401653193 ecr 401653191], length 3984
2022-04-07 08:16:10.690992 IP (tos 0x0, ttl 64, id 36422, offset 0, flags [DF], proto TCP (6), length 52)
    127.0.0.1.47012 > 127.0.0.1.10650: Flags [.], cksum 0xfe28 (incorrect -> 0x0ea3), seq 950, ack 534739, win 14832, options [nop,nop,TS val 401653193 ecr 401653193], length 0
2022-04-07 08:16:10.691067 IP (tos 0x0, ttl 64, id 3967, offset 0, flags [DF], proto TCP (6), length 4100)
    127.0.0.1.10650 > 127.0.0.1.47012: Flags [P.], cksum 0x0df9 (incorrect -> 0x0db1), seq 534739:538787, ack 950, win 512, options [nop,nop,TS val 401653194 ecr 401653193], length 4048
2022-04-07 08:16:10.691102 IP (tos 0x0, ttl 64, id 36423, offset 0, flags [DF], proto TCP (6), length 52)
    127.0.0.1.47012 > 127.0.0.1.10650: Flags [.], cksum 0xfe28 (incorrect -> 0xfed0), seq 950, ack 538787, win 14832, options [nop,nop,TS val 401653194 ecr 401653194], length 0
200, 3.902106285095215, 1.9594237804412842