2022-04-07 10:47:30.020211 IP (tos 0x0, ttl 64, id 44497, offset 0, flags [DF], proto TCP (6), length 60)
    127.0.0.1.56278 > 127.0.0.1.9550: Flags [S], cksum 0xfe30 (incorrect -> 0xc363), seq 3390859589, win 65495, options [mss 65495,sackOK,TS val 3484649571 ecr 0,nop,wscale 7], length 0
2022-04-07 10:47:30.020226 IP (tos 0x0, ttl 64, id 0, offset 0, flags [DF], proto TCP (6), length 60)
    127.0.0.1.9550 > 127.0.0.1.56278: Flags [S.], cksum 0xfe30 (incorrect -> 0x0f01), seq 3273496871, ack 3390859590, win 65483, options [mss 65495,sackOK,TS val 3484649572 ecr 3484649571,nop,wscale 7], length 0
2022-04-07 10:47:30.020239 IP (tos 0x0, ttl 64, id 44498, offset 0, flags [DF], proto TCP (6), length 52)
    127.0.0.1.56278 > 127.0.0.1.9550: Flags [.], cksum 0xfe28 (incorrect -> 0x35bc), seq 1, ack 1, win 512, options [nop,nop,TS val 3484649572 ecr 3484649572], length 0
2022-04-07 10:47:30.020434 IP (tos 0x0, ttl 64, id 44499, offset 0, flags [DF], proto TCP (6), length 55)
    127.0.0.1.56278 > 127.0.0.1.9550: Flags [P.], cksum 0xfe2b (incorrect -> 0x30b0), seq 1:4, ack 1, win 512, options [nop,nop,TS val 3484649572 ecr 3484649572], length 3
2022-04-07 10:47:30.020442 IP (tos 0x0, ttl 64, id 14396, offset 0, flags [DF], proto TCP (6), length 52)
    127.0.0.1.9550 > 127.0.0.1.56278: Flags [.], cksum 0xfe28 (incorrect -> 0x35b9), seq 1, ack 4, win 512, options [nop,nop,TS val 3484649572 ecr 3484649572], length 0
2022-04-07 10:47:30.020481 IP (tos 0x0, ttl 64, id 14397, offset 0, flags [DF], proto TCP (6), length 54)
    127.0.0.1.9550 > 127.0.0.1.56278: Flags [P.], cksum 0xfe2a (incorrect -> 0x30af), seq 1:3, ack 4, win 512, options [nop,nop,TS val 3484649572 ecr 3484649572], length 2
2022-04-07 10:47:30.020491 IP (tos 0x0, ttl 64, id 44500, offset 0, flags [DF], proto TCP (6), length 52)
    127.0.0.1.56278 > 127.0.0.1.9550: Flags [.], cksum 0xfe28 (incorrect -> 0x35b7), seq 4, ack 3, win 512, options [nop,nop,TS val 3484649572 ecr 3484649572], length 0
2022-04-07 10:47:30.022197 IP (tos 0x0, ttl 64, id 44501, offset 0, flags [DF], proto TCP (6), length 62)
    127.0.0.1.56278 > 127.0.0.1.9550: Flags [P.], cksum 0xfe32 (incorrect -> 0xa5aa), seq 4:14, ack 3, win 512, options [nop,nop,TS val 3484649573 ecr 3484649572], length 10
2022-04-07 10:47:30.022210 IP (tos 0x0, ttl 64, id 14398, offset 0, flags [DF], proto TCP (6), length 52)
    127.0.0.1.9550 > 127.0.0.1.56278: Flags [.], cksum 0xfe28 (incorrect -> 0x35ab), seq 3, ack 14, win 512, options [nop,nop,TS val 3484649573 ecr 3484649573], length 0
2022-04-07 10:47:30.123267 IP (tos 0x0, ttl 64, id 14399, offset 0, flags [DF], proto TCP (6), length 62)
    127.0.0.1.9550 > 127.0.0.1.56278: Flags [P.], cksum 0xfe32 (incorrect -> 0x3033), seq 3:13, ack 14, win 512, options [nop,nop,TS val 3484649674 ecr 3484649573], length 10
2022-04-07 10:47:30.123290 IP (tos 0x0, ttl 64, id 44502, offset 0, flags [DF], proto TCP (6), length 52)
    127.0.0.1.56278 > 127.0.0.1.9550: Flags [.], cksum 0xfe28 (incorrect -> 0x34d6), seq 14, ack 13, win 512, options [nop,nop,TS val 3484649675 ecr 3484649674], length 0
2022-04-07 10:47:30.129051 IP (tos 0x0, ttl 64, id 44503, offset 0, flags [DF], proto TCP (6), length 569)
    127.0.0.1.56278 > 127.0.0.1.9550: Flags [P.], cksum 0x002e (incorrect -> 0xbae2), seq 14:531, ack 13, win 512, options [nop,nop,TS val 3484649680 ecr 3484649674], length 517
2022-04-07 10:47:30.129062 IP (tos 0x0, ttl 64, id 14400, offset 0, flags [DF], proto TCP (6), length 52)
    127.0.0.1.9550 > 127.0.0.1.56278: Flags [.], cksum 0xfe28 (incorrect -> 0x32ca), seq 13, ack 531, win 508, options [nop,nop,TS val 3484649680 ecr 3484649680], length 0
2022-04-07 10:47:30.226759 IP (tos 0x0, ttl 64, id 14401, offset 0, flags [DF], proto TCP (6), length 3538)
    127.0.0.1.9550 > 127.0.0.1.56278: Flags [P.], cksum 0x0bc7 (incorrect -> 0x6fee), seq 13:3499, ack 531, win 512, options [nop,nop,TS val 3484649778 ecr 3484649680], length 3486
2022-04-07 10:47:30.226778 IP (tos 0x0, ttl 64, id 44504, offset 0, flags [DF], proto TCP (6), length 52)
    127.0.0.1.56278 > 127.0.0.1.9550: Flags [.], cksum 0xfe28 (incorrect -> 0x2476), seq 531, ack 3499, win 494, options [nop,nop,TS val 3484649778 ecr 3484649778], length 0
2022-04-07 10:47:30.239447 IP (tos 0x0, ttl 64, id 14402, offset 0, flags [DF], proto TCP (6), length 1151)
    127.0.0.1.9550 > 127.0.0.1.56278: Flags [P.], cksum 0x0274 (incorrect -> 0xc770), seq 3499:4598, ack 531, win 512, options [nop,nop,TS val 3484649791 ecr 3484649778], length 1099
2022-04-07 10:47:30.239456 IP (tos 0x0, ttl 64, id 44505, offset 0, flags [DF], proto TCP (6), length 52)
    127.0.0.1.56278 > 127.0.0.1.9550: Flags [.], cksum 0xfe28 (incorrect -> 0x2008), seq 531, ack 4598, win 503, options [nop,nop,TS val 3484649791 ecr 3484649791], length 0
2022-04-07 10:47:30.239891 IP (tos 0x0, ttl 64, id 44506, offset 0, flags [DF], proto TCP (6), length 132)
    127.0.0.1.56278 > 127.0.0.1.9550: Flags [P.], cksum 0xfe78 (incorrect -> 0xa652), seq 531:611, ack 4598, win 512, options [nop,nop,TS val 3484649791 ecr 3484649791], length 80
2022-04-07 10:47:30.239901 IP (tos 0x0, ttl 64, id 14403, offset 0, flags [DF], proto TCP (6), length 52)
    127.0.0.1.9550 > 127.0.0.1.56278: Flags [.], cksum 0xfe28 (incorrect -> 0x1faf), seq 4598, ack 611, win 512, options [nop,nop,TS val 3484649791 ecr 3484649791], length 0
2022-04-07 10:47:30.240323 IP (tos 0x0, ttl 64, id 44507, offset 0, flags [DF], proto TCP (6), length 395)
    127.0.0.1.56278 > 127.0.0.1.9550: Flags [P.], cksum 0xff7f (incorrect -> 0x1138), seq 611:954, ack 4598, win 512, options [nop,nop,TS val 3484649792 ecr 3484649791], length 343
2022-04-07 10:47:30.240332 IP (tos 0x0, ttl 64, id 14404, offset 0, flags [DF], proto TCP (6), length 52)
    127.0.0.1.9550 > 127.0.0.1.56278: Flags [.], cksum 0xfe28 (incorrect -> 0x1e58), seq 4598, ack 954, win 510, options [nop,nop,TS val 3484649792 ecr 3484649792], length 0
2022-04-07 10:47:30.343795 IP (tos 0x0, ttl 64, id 14405, offset 0, flags [DF], proto TCP (6), length 210)
    127.0.0.1.9550 > 127.0.0.1.56278: Flags [P.], cksum 0xfec6 (incorrect -> 0x762f), seq 4598:4756, ack 954, win 512, options [nop,nop,TS val 3484649895 ecr 3484649792], length 158
2022-04-07 10:47:30.343804 IP (tos 0x0, ttl 64, id 44508, offset 0, flags [DF], proto TCP (6), length 52)
    127.0.0.1.56278 > 127.0.0.1.9550: Flags [.], cksum 0xfe28 (incorrect -> 0x1ceb), seq 954, ack 4756, win 511, options [nop,nop,TS val 3484649895 ecr 3484649895], length 0
2022-04-07 10:47:30.413600 IP (tos 0x0, ttl 64, id 14406, offset 0, flags [DF], proto TCP (6), length 2972)
    127.0.0.1.9550 > 127.0.0.1.56278: Flags [P.], cksum 0x0991 (incorrect -> 0xd194), seq 4756:7676, ack 954, win 512, options [nop,nop,TS val 3484649965 ecr 3484649895], length 2920
2022-04-07 10:47:30.413609 IP (tos 0x0, ttl 64, id 44509, offset 0, flags [DF], proto TCP (6), length 52)
    127.0.0.1.56278 > 127.0.0.1.9550: Flags [.], cksum 0xfe28 (incorrect -> 0x1106), seq 954, ack 7676, win 496, options [nop,nop,TS val 3484649965 ecr 3484649965], length 0
2022-04-07 10:47:30.424818 IP (tos 0x0, ttl 64, id 14407, offset 0, flags [DF], proto TCP (6), length 3538)
    127.0.0.1.9550 > 127.0.0.1.56278: Flags [P.], cksum 0x0bc7 (incorrect -> 0x2c8a), seq 7676:11162, ack 954, win 512, options [nop,nop,TS val 3484649976 ecr 3484649965], length 3486
2022-04-07 10:47:30.424827 IP (tos 0x0, ttl 64, id 44510, offset 0, flags [DF], proto TCP (6), length 52)
    127.0.0.1.56278 > 127.0.0.1.9550: Flags [.], cksum 0xfe28 (incorrect -> 0x0354), seq 954, ack 11162, win 494, options [nop,nop,TS val 3484649976 ecr 3484649976], length 0
2022-04-07 10:47:30.425007 IP (tos 0x0, ttl 64, id 14408, offset 0, flags [DF], proto TCP (6), length 3040)
    127.0.0.1.9550 > 127.0.0.1.56278: Flags [P.], cksum 0x09d5 (incorrect -> 0xce31), seq 11162:14150, ack 954, win 512, options [nop,nop,TS val 3484649976 ecr 3484649976], length 2988
2022-04-07 10:47:30.425014 IP (tos 0x0, ttl 64, id 44511, offset 0, flags [DF], proto TCP (6), length 52)
    127.0.0.1.56278 > 127.0.0.1.9550: Flags [.], cksum 0xfe28 (incorrect -> 0xf7a5), seq 954, ack 14150, win 496, options [nop,nop,TS val 3484649976 ecr 3484649976], length 0
2022-04-07 10:47:30.425951 IP (tos 0x0, ttl 64, id 14409, offset 0, flags [DF], proto TCP (6), length 1048)
    127.0.0.1.9550 > 127.0.0.1.56278: Flags [P.], cksum 0x020d (incorrect -> 0xf075), seq 14150:15146, ack 954, win 512, options [nop,nop,TS val 3484649977 ecr 3484649976], length 996
2022-04-07 10:47:30.425958 IP (tos 0x0, ttl 64, id 44512, offset 0, flags [DF], proto TCP (6), length 52)
    127.0.0.1.56278 > 127.0.0.1.9550: Flags [.], cksum 0xfe28 (incorrect -> 0xf3b7), seq 954, ack 15146, win 504, options [nop,nop,TS val 3484649977 ecr 3484649977], length 0
2022-04-07 10:47:30.438297 IP (tos 0x0, ttl 64, id 14410, offset 0, flags [DF], proto TCP (6), length 3538)
    127.0.0.1.9550 > 127.0.0.1.56278: Flags [P.], cksum 0x0bc7 (incorrect -> 0x1891), seq 15146:18632, ack 954, win 512, options [nop,nop,TS val 3484649990 ecr 3484649977], length 3486
2022-04-07 10:47:30.438305 IP (tos 0x0, ttl 64, id 44513, offset 0, flags [DF], proto TCP (6), length 52)
    127.0.0.1.56278 > 127.0.0.1.9550: Flags [.], cksum 0xfe28 (incorrect -> 0xe609), seq 954, ack 18632, win 494, options [nop,nop,TS val 3484649990 ecr 3484649990], length 0
2022-04-07 10:47:30.446186 IP (tos 0x0, ttl 64, id 14411, offset 0, flags [DF], proto TCP (6), length 776)
    127.0.0.1.9550 > 127.0.0.1.56278: Flags [P.], cksum 0x00fd (incorrect -> 0x06e1), seq 18632:19356, ack 954, win 512, options [nop,nop,TS val 3484649997 ecr 3484649990], length 724
2022-04-07 10:47:30.446197 IP (tos 0x0, ttl 64, id 44514, offset 0, flags [DF], proto TCP (6), length 52)
    127.0.0.1.56278 > 127.0.0.1.9550: Flags [.], cksum 0xfe28 (incorrect -> 0xe31c), seq 954, ack 19356, win 505, options [nop,nop,TS val 3484649997 ecr 3484649997], length 0
2022-04-07 10:47:30.447664 IP (tos 0x0, ttl 64, id 14412, offset 0, flags [DF], proto TCP (6), length 4100)
    127.0.0.1.9550 > 127.0.0.1.56278: Flags [P.], cksum 0x0df9 (incorrect -> 0xb399), seq 19356:23404, ack 954, win 512, options [nop,nop,TS val 3484649999 ecr 3484649997], length 4048
2022-04-07 10:47:30.447672 IP (tos 0x0, ttl 64, id 44515, offset 0, flags [DF], proto TCP (6), length 52)
    127.0.0.1.56278 > 127.0.0.1.9550: Flags [.], cksum 0xfe28 (incorrect -> 0xd355), seq 954, ack 23404, win 492, options [nop,nop,TS val 3484649999 ecr 3484649999], length 0
2022-04-07 10:47:30.447681 IP (tos 0x0, ttl 64, id 14413, offset 0, flags [DF], proto TCP (6), length 2976)
    127.0.0.1.9550 > 127.0.0.1.56278: Flags [P.], cksum 0x0995 (incorrect -> 0x5e88), seq 23404:26328, ack 954, win 512, options [nop,nop,TS val 3484649999 ecr 3484649999], length 2924
2022-04-07 10:47:30.448660 IP (tos 0x0, ttl 64, id 44516, offset 0, flags [DF], proto TCP (6), length 52)
    127.0.0.1.56278 > 127.0.0.1.9550: Flags [.], cksum 0xfe28 (incorrect -> 0xc7d4), seq 954, ack 26328, win 512, options [nop,nop,TS val 3484650000 ecr 3484649999], length 0
2022-04-07 10:47:30.450790 IP (tos 0x0, ttl 64, id 14414, offset 0, flags [DF], proto TCP (6), length 2542)
    127.0.0.1.9550 > 127.0.0.1.56278: Flags [P.], cksum 0x07e3 (incorrect -> 0x0089), seq 26328:28818, ack 954, win 512, options [nop,nop,TS val 3484650002 ecr 3484650000], length 2490
2022-04-07 10:47:30.450853 IP (tos 0x0, ttl 64, id 44517, offset 0, flags [DF], proto TCP (6), length 52)
    127.0.0.1.56278 > 127.0.0.1.9550: Flags [.], cksum 0xfe28 (incorrect -> 0xbe15), seq 954, ack 28818, win 512, options [nop,nop,TS val 3484650002 ecr 3484650002], length 0
2022-04-07 10:47:30.461020 IP (tos 0x0, ttl 64, id 14415, offset 0, flags [DF], proto TCP (6), length 810)
    127.0.0.1.9550 > 127.0.0.1.56278: Flags [P.], cksum 0x011f (incorrect -> 0xef5e), seq 28818:29576, ack 954, win 512, options [nop,nop,TS val 3484650012 ecr 3484650002], length 758
2022-04-07 10:47:30.461087 IP (tos 0x0, ttl 64, id 44518, offset 0, flags [DF], proto TCP (6), length 52)
    127.0.0.1.56278 > 127.0.0.1.9550: Flags [.], cksum 0xfe28 (incorrect -> 0xbb0b), seq 954, ack 29576, win 512, options [nop,nop,TS val 3484650012 ecr 3484650012], length 0
2022-04-07 10:47:30.465185 IP (tos 0x0, ttl 64, id 14416, offset 0, flags [DF], proto TCP (6), length 3504)
    127.0.0.1.9550 > 127.0.0.1.56278: Flags [P.], cksum 0x0ba5 (incorrect -> 0xa6a2), seq 29576:33028, ack 954, win 512, options [nop,nop,TS val 3484650016 ecr 3484650012], length 3452
2022-04-07 10:47:30.465201 IP (tos 0x0, ttl 64, id 44519, offset 0, flags [DF], proto TCP (6), length 52)
    127.0.0.1.56278 > 127.0.0.1.9550: Flags [.], cksum 0xfe28 (incorrect -> 0xad87), seq 954, ack 33028, win 512, options [nop,nop,TS val 3484650016 ecr 3484650016], length 0
2022-04-07 10:47:30.469778 IP (tos 0x0, ttl 64, id 14417, offset 0, flags [DF], proto TCP (6), length 3900)
    127.0.0.1.9550 > 127.0.0.1.56278: Flags [P.], cksum 0x0d31 (incorrect -> 0xb038), seq 33028:36876, ack 954, win 512, options [nop,nop,TS val 3484650021 ecr 3484650016], length 3848
2022-04-07 10:47:30.469818 IP (tos 0x0, ttl 64, id 44520, offset 0, flags [DF], proto TCP (6), length 52)
    127.0.0.1.56278 > 127.0.0.1.9550: Flags [.], cksum 0xfe28 (incorrect -> 0x9e75), seq 954, ack 36876, win 512, options [nop,nop,TS val 3484650021 ecr 3484650021], length 0
2022-04-07 10:47:30.469824 IP (tos 0x0, ttl 64, id 14418, offset 0, flags [DF], proto TCP (6), length 3538)
    127.0.0.1.9550 > 127.0.0.1.56278: Flags [P.], cksum 0x0bc7 (incorrect -> 0x1f2e), seq 36876:40362, ack 954, win 512, options [nop,nop,TS val 3484650021 ecr 3484650021], length 3486
2022-04-07 10:47:30.470369 IP (tos 0x0, ttl 64, id 44521, offset 0, flags [DF], proto TCP (6), length 52)
    127.0.0.1.56278 > 127.0.0.1.9550: Flags [.], cksum 0xfe28 (incorrect -> 0x90d6), seq 954, ack 40362, win 512, options [nop,nop,TS val 3484650022 ecr 3484650021], length 0
2022-04-07 10:47:30.472826 IP (tos 0x0, ttl 64, id 14419, offset 0, flags [DF], proto TCP (6), length 3900)
    127.0.0.1.9550 > 127.0.0.1.56278: Flags [P.], cksum 0x0d31 (incorrect -> 0x2c8e), seq 40362:44210, ack 954, win 512, options [nop,nop,TS val 3484650024 ecr 3484650022], length 3848
2022-04-07 10:47:30.472845 IP (tos 0x0, ttl 64, id 44522, offset 0, flags [DF], proto TCP (6), length 52)
    127.0.0.1.56278 > 127.0.0.1.9550: Flags [.], cksum 0xfe28 (incorrect -> 0x81c9), seq 954, ack 44210, win 512, options [nop,nop,TS val 3484650024 ecr 3484650024], length 0
2022-04-07 10:47:30.476070 IP (tos 0x0, ttl 64, id 14420, offset 0, flags [DF], proto TCP (6), length 1048)
    127.0.0.1.9550 > 127.0.0.1.56278: Flags [P.], cksum 0x020d (incorrect -> 0x00c6), seq 44210:45206, ack 954, win 512, options [nop,nop,TS val 3484650027 ecr 3484650024], length 996
2022-04-07 10:47:30.476083 IP (tos 0x0, ttl 64, id 44523, offset 0, flags [DF], proto TCP (6), length 52)
    127.0.0.1.56278 > 127.0.0.1.9550: Flags [.], cksum 0xfe28 (incorrect -> 0x7ddf), seq 954, ack 45206, win 512, options [nop,nop,TS val 3484650027 ecr 3484650027], length 0
2022-04-07 10:47:30.483717 IP (tos 0x0, ttl 64, id 14421, offset 0, flags [DF], proto TCP (6), length 3402)
    127.0.0.1.9550 > 127.0.0.1.56278: Flags [P.], cksum 0x0b3f (incorrect -> 0x8bc1), seq 45206:48556, ack 954, win 512, options [nop,nop,TS val 3484650035 ecr 3484650027], length 3350
2022-04-07 10:47:30.483766 IP (tos 0x0, ttl 64, id 44524, offset 0, flags [DF], proto TCP (6), length 52)
    127.0.0.1.56278 > 127.0.0.1.9550: Flags [.], cksum 0xfe28 (incorrect -> 0x70b9), seq 954, ack 48556, win 512, options [nop,nop,TS val 3484650035 ecr 3484650035], length 0
2022-04-07 10:47:30.485076 IP (tos 0x0, ttl 64, id 14422, offset 0, flags [DF], proto TCP (6), length 3470)
    127.0.0.1.9550 > 127.0.0.1.56278: Flags [P.], cksum 0x0b83 (incorrect -> 0xead0), seq 48556:51974, ack 954, win 512, options [nop,nop,TS val 3484650036 ecr 3484650035], length 3418
2022-04-07 10:47:30.485101 IP (tos 0x0, ttl 64, id 44525, offset 0, flags [DF], proto TCP (6), length 52)
    127.0.0.1.56278 > 127.0.0.1.9550: Flags [.], cksum 0xfe28 (incorrect -> 0x635d), seq 954, ack 51974, win 512, options [nop,nop,TS val 3484650036 ecr 3484650036], length 0
2022-04-07 10:47:30.493751 IP (tos 0x0, ttl 64, id 14423, offset 0, flags [DF], proto TCP (6), length 4036)
    127.0.0.1.9550 > 127.0.0.1.56278: Flags [P.], cksum 0x0db9 (incorrect -> 0x39ec), seq 51974:55958, ack 954, win 512, options [nop,nop,TS val 3484650045 ecr 3484650036], length 3984
2022-04-07 10:47:30.494167 IP (tos 0x0, ttl 64, id 44526, offset 0, flags [DF], proto TCP (6), length 52)
    127.0.0.1.56278 > 127.0.0.1.9550: Flags [.], cksum 0xfe28 (incorrect -> 0x53bb), seq 954, ack 55958, win 512, options [nop,nop,TS val 3484650045 ecr 3484650045], length 0
2022-04-07 10:47:30.494175 IP (tos 0x0, ttl 64, id 14424, offset 0, flags [DF], proto TCP (6), length 3538)
    127.0.0.1.9550 > 127.0.0.1.56278: Flags [P.], cksum 0x0bc7 (incorrect -> 0x9905), seq 55958:59444, ack 954, win 512, options [nop,nop,TS val 3484650045 ecr 3484650045], length 3486
2022-04-07 10:47:30.494181 IP (tos 0x0, ttl 64, id 44527, offset 0, flags [DF], proto TCP (6), length 52)
    127.0.0.1.56278 > 127.0.0.1.9550: Flags [.], cksum 0xfe28 (incorrect -> 0x461d), seq 954, ack 59444, win 512, options [nop,nop,TS val 3484650045 ecr 3484650045], length 0
2022-04-07 10:47:30.501295 IP (tos 0x0, ttl 64, id 14425, offset 0, flags [DF], proto TCP (6), length 4100)
    127.0.0.1.9550 > 127.0.0.1.56278: Flags [P.], cksum 0x0df9 (incorrect -> 0x6401), seq 59444:63492, ack 954, win 512, options [nop,nop,TS val 3484650053 ecr 3484650045], length 4048
2022-04-07 10:47:30.541286 IP (tos 0x0, ttl 64, id 14426, offset 0, flags [DF], proto TCP (6), length 32820)
    127.0.0.1.9550 > 127.0.0.1.56278: Flags [.], cksum 0x7e29 (incorrect -> 0x0f01), seq 63492:96260, ack 954, win 512, options [nop,nop,TS val 3484650093 ecr 3484650045], length 32768
2022-04-07 10:47:30.541298 IP (tos 0x0, ttl 64, id 44528, offset 0, flags [DF], proto TCP (6), length 52)
    127.0.0.1.56278 > 127.0.0.1.9550: Flags [.], cksum 0xfe28 (incorrect -> 0xb699), seq 954, ack 96260, win 379, options [nop,nop,TS val 3484650093 ecr 3484650053], length 0
2022-04-07 10:47:30.541309 IP (tos 0x0, ttl 64, id 14427, offset 0, flags [DF], proto TCP (6), length 3252)
    127.0.0.1.9550 > 127.0.0.1.56278: Flags [P.], cksum 0x0aa9 (incorrect -> 0x8cbb), seq 96260:99460, ack 954, win 512, options [nop,nop,TS val 3484650093 ecr 3484650093], length 3200
2022-04-07 10:47:30.542077 IP (tos 0x0, ttl 64, id 44529, offset 0, flags [DF], proto TCP (6), length 52)
    127.0.0.1.56278 > 127.0.0.1.9550: Flags [.], cksum 0xfe28 (incorrect -> 0xa96c), seq 954, ack 99460, win 512, options [nop,nop,TS val 3484650093 ecr 3484650093], length 0
2022-04-07 10:47:30.542084 IP (tos 0x0, ttl 64, id 14428, offset 0, flags [DF], proto TCP (6), length 2274)
    127.0.0.1.9550 > 127.0.0.1.56278: Flags [P.], cksum 0x06d7 (incorrect -> 0xec37), seq 99460:101682, ack 954, win 512, options [nop,nop,TS val 3484650093 ecr 3484650093], length 2222
2022-04-07 10:47:30.542089 IP (tos 0x0, ttl 64, id 44530, offset 0, flags [DF], proto TCP (6), length 52)
    127.0.0.1.56278 > 127.0.0.1.9550: Flags [.], cksum 0xfe28 (incorrect -> 0xa0be), seq 954, ack 101682, win 512, options [nop,nop,TS val 3484650093 ecr 3484650093], length 0
2022-04-07 10:47:30.546372 IP (tos 0x0, ttl 64, id 14429, offset 0, flags [DF], proto TCP (6), length 4100)
    127.0.0.1.9550 > 127.0.0.1.56278: Flags [P.], cksum 0x0df9 (incorrect -> 0x8360), seq 101682:105730, ack 954, win 512, options [nop,nop,TS val 3484650098 ecr 3484650093], length 4048
2022-04-07 10:47:30.546747 IP (tos 0x0, ttl 64, id 44531, offset 0, flags [DF], proto TCP (6), length 52)
    127.0.0.1.56278 > 127.0.0.1.9550: Flags [.], cksum 0xfe28 (incorrect -> 0x90e4), seq 954, ack 105730, win 512, options [nop,nop,TS val 3484650098 ecr 3484650098], length 0
2022-04-07 10:47:30.546754 IP (tos 0x0, ttl 64, id 14430, offset 0, flags [DF], proto TCP (6), length 486)
    127.0.0.1.9550 > 127.0.0.1.56278: Flags [P.], cksum 0xffda (incorrect -> 0x7571), seq 105730:106164, ack 954, win 512, options [nop,nop,TS val 3484650098 ecr 3484650098], length 434
2022-04-07 10:47:30.546759 IP (tos 0x0, ttl 64, id 44532, offset 0, flags [DF], proto TCP (6), length 52)
    127.0.0.1.56278 > 127.0.0.1.9550: Flags [.], cksum 0xfe28 (incorrect -> 0x8f32), seq 954, ack 106164, win 512, options [nop,nop,TS val 3484650098 ecr 3484650098], length 0
2022-04-07 10:47:30.548887 IP (tos 0x0, ttl 64, id 14431, offset 0, flags [DF], proto TCP (6), length 844)
    127.0.0.1.9550 > 127.0.0.1.56278: Flags [P.], cksum 0x0141 (incorrect -> 0xc1c0), seq 106164:106956, ack 954, win 512, options [nop,nop,TS val 3484650100 ecr 3484650098], length 792
2022-04-07 10:47:30.548952 IP (tos 0x0, ttl 64, id 44533, offset 0, flags [DF], proto TCP (6), length 52)
    127.0.0.1.56278 > 127.0.0.1.9550: Flags [.], cksum 0xfe28 (incorrect -> 0x8c16), seq 954, ack 106956, win 512, options [nop,nop,TS val 3484650100 ecr 3484650100], length 0
2022-04-07 10:47:30.551964 IP (tos 0x0, ttl 64, id 14432, offset 0, flags [DF], proto TCP (6), length 2972)
    127.0.0.1.9550 > 127.0.0.1.56278: Flags [P.], cksum 0x0991 (incorrect -> 0xa2b2), seq 106956:109876, ack 954, win 512, options [nop,nop,TS val 3484650103 ecr 3484650100], length 2920
2022-04-07 10:47:30.551984 IP (tos 0x0, ttl 64, id 44534, offset 0, flags [DF], proto TCP (6), length 52)
    127.0.0.1.56278 > 127.0.0.1.9550: Flags [.], cksum 0xfe28 (incorrect -> 0x80a8), seq 954, ack 109876, win 512, options [nop,nop,TS val 3484650103 ecr 3484650103], length 0
2022-04-07 10:47:30.557973 IP (tos 0x0, ttl 64, id 14433, offset 0, flags [DF], proto TCP (6), length 3538)
    127.0.0.1.9550 > 127.0.0.1.56278: Flags [P.], cksum 0x0bc7 (incorrect -> 0x71c9), seq 109876:113362, ack 954, win 512, options [nop,nop,TS val 3484650109 ecr 3484650103], length 3486
2022-04-07 10:47:30.557999 IP (tos 0x0, ttl 64, id 44535, offset 0, flags [DF], proto TCP (6), length 52)
    127.0.0.1.56278 > 127.0.0.1.9550: Flags [.], cksum 0xfe28 (incorrect -> 0x72fe), seq 954, ack 113362, win 512, options [nop,nop,TS val 3484650109 ecr 3484650109], length 0
2022-04-07 10:47:30.560363 IP (tos 0x0, ttl 64, id 14434, offset 0, flags [DF], proto TCP (6), length 4036)
    127.0.0.1.9550 > 127.0.0.1.56278: Flags [P.], cksum 0x0db9 (incorrect -> 0x4f24), seq 113362:117346, ack 954, win 512, options [nop,nop,TS val 3484650112 ecr 3484650109], length 3984
2022-04-07 10:47:30.560440 IP (tos 0x0, ttl 64, id 44536, offset 0, flags [DF], proto TCP (6), length 52)
    127.0.0.1.56278 > 127.0.0.1.9550: Flags [.], cksum 0xfe28 (incorrect -> 0x6368), seq 954, ack 117346, win 512, options [nop,nop,TS val 3484650112 ecr 3484650112], length 0
200, 3.654723644256592, 0.5685393810272217