2022-04-07 22:08:42.479077 IP (tos 0x0, ttl 64, id 24774, offset 0, flags [DF], proto TCP (6), length 60)
    127.0.0.1.52642 > 127.0.0.1.11850: Flags [S], cksum 0xfe30 (incorrect -> 0xa288), seq 897677177, win 65495, options [mss 65495,sackOK,TS val 3525522030 ecr 0,nop,wscale 7], length 0
2022-04-07 22:08:42.479088 IP (tos 0x0, ttl 64, id 0, offset 0, flags [DF], proto TCP (6), length 60)
    127.0.0.1.11850 > 127.0.0.1.52642: Flags [S.], cksum 0xfe30 (incorrect -> 0x3887), seq 953756817, ack 897677178, win 65483, options [mss 65495,sackOK,TS val 3525522030 ecr 3525522030,nop,wscale 7], length 0
2022-04-07 22:08:42.479096 IP (tos 0x0, ttl 64, id 24775, offset 0, flags [DF], proto TCP (6), length 52)
    127.0.0.1.52642 > 127.0.0.1.11850: Flags [.], cksum 0xfe28 (incorrect -> 0x5f43), seq 1, ack 1, win 512, options [nop,nop,TS val 3525522030 ecr 3525522030], length 0
2022-04-07 22:08:42.479247 IP (tos 0x0, ttl 64, id 24776, offset 0, flags [DF], proto TCP (6), length 55)
    127.0.0.1.52642 > 127.0.0.1.11850: Flags [P.], cksum 0xfe2b (incorrect -> 0x5a36), seq 1:4, ack 1, win 512, options [nop,nop,TS val 3525522031 ecr 3525522030], length 3
2022-04-07 22:08:42.479254 IP (tos 0x0, ttl 64, id 25580, offset 0, flags [DF], proto TCP (6), length 52)
    127.0.0.1.11850 > 127.0.0.1.52642: Flags [.], cksum 0xfe28 (incorrect -> 0x5f3e), seq 1, ack 4, win 512, options [nop,nop,TS val 3525522031 ecr 3525522031], length 0
2022-04-07 22:08:42.479275 IP (tos 0x0, ttl 64, id 25581, offset 0, flags [DF], proto TCP (6), length 54)
    127.0.0.1.11850 > 127.0.0.1.52642: Flags [P.], cksum 0xfe2a (incorrect -> 0x5a34), seq 1:3, ack 4, win 512, options [nop,nop,TS val 3525522031 ecr 3525522031], length 2
2022-04-07 22:08:42.479284 IP (tos 0x0, ttl 64, id 24777, offset 0, flags [DF], proto TCP (6), length 52)
    127.0.0.1.52642 > 127.0.0.1.11850: Flags [.], cksum 0xfe28 (incorrect -> 0x5f3c), seq 4, ack 3, win 512, options [nop,nop,TS val 3525522031 ecr 3525522031], length 0
2022-04-07 22:08:42.506305 IP (tos 0x0, ttl 64, id 24778, offset 0, flags [DF], proto TCP (6), length 62)
    127.0.0.1.52642 > 127.0.0.1.11850: Flags [P.], cksum 0xfe32 (incorrect -> 0x9b82), seq 4:14, ack 3, win 512, options [nop,nop,TS val 3525522058 ecr 3525522031], length 10
2022-04-07 22:08:42.506325 IP (tos 0x0, ttl 64, id 25582, offset 0, flags [DF], proto TCP (6), length 52)
    127.0.0.1.11850 > 127.0.0.1.52642: Flags [.], cksum 0xfe28 (incorrect -> 0x5efc), seq 3, ack 14, win 512, options [nop,nop,TS val 3525522058 ecr 3525522058], length 0
2022-04-07 22:08:42.687015 IP (tos 0x0, ttl 64, id 25583, offset 0, flags [DF], proto TCP (6), length 62)
    127.0.0.1.11850 > 127.0.0.1.52642: Flags [P.], cksum 0xfe32 (incorrect -> 0x5935), seq 3:13, ack 14, win 512, options [nop,nop,TS val 3525522238 ecr 3525522058], length 10
2022-04-07 22:08:42.687034 IP (tos 0x0, ttl 64, id 24779, offset 0, flags [DF], proto TCP (6), length 52)
    127.0.0.1.52642 > 127.0.0.1.11850: Flags [.], cksum 0xfe28 (incorrect -> 0x5d8a), seq 14, ack 13, win 512, options [nop,nop,TS val 3525522238 ecr 3525522238], length 0
2022-04-07 22:08:42.693234 IP (tos 0x0, ttl 64, id 24780, offset 0, flags [DF], proto TCP (6), length 569)
    127.0.0.1.52642 > 127.0.0.1.11850: Flags [P.], cksum 0x002e (incorrect -> 0x2979), seq 14:531, ack 13, win 512, options [nop,nop,TS val 3525522245 ecr 3525522238], length 517
2022-04-07 22:08:42.693247 IP (tos 0x0, ttl 64, id 25584, offset 0, flags [DF], proto TCP (6), length 52)
    127.0.0.1.11850 > 127.0.0.1.52642: Flags [.], cksum 0xfe28 (incorrect -> 0x5b7b), seq 13, ack 531, win 508, options [nop,nop,TS val 3525522245 ecr 3525522245], length 0
2022-04-07 22:08:42.879165 IP (tos 0x0, ttl 64, id 25585, offset 0, flags [DF], proto TCP (6), length 3420)
    127.0.0.1.11850 > 127.0.0.1.52642: Flags [P.], cksum 0x0b51 (incorrect -> 0x4949), seq 13:3381, ack 531, win 512, options [nop,nop,TS val 3525522430 ecr 3525522245], length 3368
2022-04-07 22:08:42.879176 IP (tos 0x0, ttl 64, id 24781, offset 0, flags [DF], proto TCP (6), length 52)
    127.0.0.1.52642 > 127.0.0.1.11850: Flags [.], cksum 0xfe28 (incorrect -> 0x4cef), seq 531, ack 3381, win 494, options [nop,nop,TS val 3525522430 ecr 3525522430], length 0
2022-04-07 22:08:42.879944 IP (tos 0x0, ttl 64, id 24782, offset 0, flags [DF], proto TCP (6), length 116)
    127.0.0.1.52642 > 127.0.0.1.11850: Flags [P.], cksum 0xfe68 (incorrect -> 0xabfd), seq 531:595, ack 3381, win 512, options [nop,nop,TS val 3525522431 ecr 3525522430], length 64
2022-04-07 22:08:42.879953 IP (tos 0x0, ttl 64, id 25586, offset 0, flags [DF], proto TCP (6), length 52)
    127.0.0.1.11850 > 127.0.0.1.52642: Flags [.], cksum 0xfe28 (incorrect -> 0x4c9b), seq 3381, ack 595, win 512, options [nop,nop,TS val 3525522431 ecr 3525522431], length 0
2022-04-07 22:08:42.880466 IP (tos 0x0, ttl 64, id 24783, offset 0, flags [DF], proto TCP (6), length 336)
    127.0.0.1.52642 > 127.0.0.1.11850: Flags [P.], cksum 0xff44 (incorrect -> 0xd1f3), seq 595:879, ack 3381, win 512, options [nop,nop,TS val 3525522432 ecr 3525522431], length 284
2022-04-07 22:08:42.880472 IP (tos 0x0, ttl 64, id 25587, offset 0, flags [DF], proto TCP (6), length 52)
    127.0.0.1.11850 > 127.0.0.1.52642: Flags [.], cksum 0xfe28 (incorrect -> 0x4b7f), seq 3381, ack 879, win 510, options [nop,nop,TS val 3525522432 ecr 3525522432], length 0
2022-04-07 22:08:42.982860 IP (tos 0x0, ttl 64, id 25588, offset 0, flags [DF], proto TCP (6), length 594)
    127.0.0.1.11850 > 127.0.0.1.52642: Flags [P.], cksum 0x0047 (incorrect -> 0x6ed5), seq 3381:3923, ack 879, win 512, options [nop,nop,TS val 3525522534 ecr 3525522432], length 542
2022-04-07 22:08:42.982872 IP (tos 0x0, ttl 64, id 24784, offset 0, flags [DF], proto TCP (6), length 52)
    127.0.0.1.52642 > 127.0.0.1.11850: Flags [.], cksum 0xfe28 (incorrect -> 0x4897), seq 879, ack 3923, win 508, options [nop,nop,TS val 3525522534 ecr 3525522534], length 0
2022-04-07 22:08:42.995481 IP (tos 0x0, ttl 64, id 25589, offset 0, flags [DF], proto TCP (6), length 1486)
    127.0.0.1.11850 > 127.0.0.1.52642: Flags [P.], cksum 0x03c3 (incorrect -> 0x77e4), seq 3923:5357, ack 879, win 512, options [nop,nop,TS val 3525522547 ecr 3525522534], length 1434
2022-04-07 22:08:42.995488 IP (tos 0x0, ttl 64, id 24785, offset 0, flags [DF], proto TCP (6), length 52)
    127.0.0.1.52642 > 127.0.0.1.11850: Flags [.], cksum 0xfe28 (incorrect -> 0x42e9), seq 879, ack 5357, win 502, options [nop,nop,TS val 3525522547 ecr 3525522547], length 0
2022-04-07 22:08:42.998526 IP (tos 0x0, ttl 64, id 7052, offset 0, flags [DF], proto TCP (6), length 60)
    127.0.0.1.52646 > 127.0.0.1.11850: Flags [S], cksum 0xfe30 (incorrect -> 0xbccf), seq 2503801706, win 65495, options [mss 65495,sackOK,TS val 3525522550 ecr 0,nop,wscale 7], length 0
2022-04-07 22:08:42.998538 IP (tos 0x0, ttl 64, id 0, offset 0, flags [DF], proto TCP (6), length 60)
    127.0.0.1.11850 > 127.0.0.1.52646: Flags [S.], cksum 0xfe30 (incorrect -> 0x21fa), seq 37851637, ack 2503801707, win 65483, options [mss 65495,sackOK,TS val 3525522550 ecr 3525522550,nop,wscale 7], length 0
2022-04-07 22:08:42.998549 IP (tos 0x0, ttl 64, id 7053, offset 0, flags [DF], proto TCP (6), length 52)
    127.0.0.1.52646 > 127.0.0.1.11850: Flags [.], cksum 0xfe28 (incorrect -> 0x48b6), seq 1, ack 1, win 512, options [nop,nop,TS val 3525522550 ecr 3525522550], length 0
2022-04-07 22:08:42.998647 IP (tos 0x0, ttl 64, id 7054, offset 0, flags [DF], proto TCP (6), length 55)
    127.0.0.1.52646 > 127.0.0.1.11850: Flags [P.], cksum 0xfe2b (incorrect -> 0x43aa), seq 1:4, ack 1, win 512, options [nop,nop,TS val 3525522550 ecr 3525522550], length 3
2022-04-07 22:08:42.998654 IP (tos 0x0, ttl 64, id 698, offset 0, flags [DF], proto TCP (6), length 52)
    127.0.0.1.11850 > 127.0.0.1.52646: Flags [.], cksum 0xfe28 (incorrect -> 0x48b3), seq 1, ack 4, win 512, options [nop,nop,TS val 3525522550 ecr 3525522550], length 0
2022-04-07 22:08:42.998674 IP (tos 0x0, ttl 64, id 699, offset 0, flags [DF], proto TCP (6), length 54)
    127.0.0.1.11850 > 127.0.0.1.52646: Flags [P.], cksum 0xfe2a (incorrect -> 0x43a9), seq 1:3, ack 4, win 512, options [nop,nop,TS val 3525522550 ecr 3525522550], length 2
2022-04-07 22:08:42.998682 IP (tos 0x0, ttl 64, id 7055, offset 0, flags [DF], proto TCP (6), length 52)
    127.0.0.1.52646 > 127.0.0.1.11850: Flags [.], cksum 0xfe28 (incorrect -> 0x48b1), seq 4, ack 3, win 512, options [nop,nop,TS val 3525522550 ecr 3525522550], length 0
2022-04-07 22:08:43.028671 IP (tos 0x0, ttl 64, id 7056, offset 0, flags [DF], proto TCP (6), length 62)
    127.0.0.1.52646 > 127.0.0.1.11850: Flags [P.], cksum 0xfe32 (incorrect -> 0x71cf), seq 4:14, ack 3, win 512, options [nop,nop,TS val 3525522580 ecr 3525522550], length 10
2022-04-07 22:08:43.028685 IP (tos 0x0, ttl 64, id 700, offset 0, flags [DF], proto TCP (6), length 52)
    127.0.0.1.11850 > 127.0.0.1.52646: Flags [.], cksum 0xfe28 (incorrect -> 0x486b), seq 3, ack 14, win 512, options [nop,nop,TS val 3525522580 ecr 3525522580], length 0
2022-04-07 22:08:43.114830 IP (tos 0x0, ttl 64, id 701, offset 0, flags [DF], proto TCP (6), length 62)
    127.0.0.1.11850 > 127.0.0.1.52646: Flags [P.], cksum 0xfe32 (incorrect -> 0x4302), seq 3:13, ack 14, win 512, options [nop,nop,TS val 3525522666 ecr 3525522580], length 10
2022-04-07 22:08:43.114841 IP (tos 0x0, ttl 64, id 7057, offset 0, flags [DF], proto TCP (6), length 52)
    127.0.0.1.52646 > 127.0.0.1.11850: Flags [.], cksum 0xfe28 (incorrect -> 0x47b5), seq 14, ack 13, win 512, options [nop,nop,TS val 3525522666 ecr 3525522666], length 0
2022-04-07 22:08:43.121472 IP (tos 0x0, ttl 64, id 7058, offset 0, flags [DF], proto TCP (6), length 569)
    127.0.0.1.52646 > 127.0.0.1.11850: Flags [P.], cksum 0x002e (incorrect -> 0x87b0), seq 14:531, ack 13, win 512, options [nop,nop,TS val 3525522673 ecr 3525522666], length 517
2022-04-07 22:08:43.121482 IP (tos 0x0, ttl 64, id 702, offset 0, flags [DF], proto TCP (6), length 52)
    127.0.0.1.11850 > 127.0.0.1.52646: Flags [.], cksum 0xfe28 (incorrect -> 0x45a6), seq 13, ack 531, win 508, options [nop,nop,TS val 3525522673 ecr 3525522673], length 0
2022-04-07 22:08:43.252525 IP (tos 0x0, ttl 64, id 703, offset 0, flags [DF], proto TCP (6), length 3538)
    127.0.0.1.11850 > 127.0.0.1.52646: Flags [P.], cksum 0x0bc7 (incorrect -> 0x399d), seq 13:3499, ack 531, win 512, options [nop,nop,TS val 3525522804 ecr 3525522673], length 3486
2022-04-07 22:08:43.252536 IP (tos 0x0, ttl 64, id 7059, offset 0, flags [DF], proto TCP (6), length 52)
    127.0.0.1.52646 > 127.0.0.1.11850: Flags [.], cksum 0xfe28 (incorrect -> 0x3710), seq 531, ack 3499, win 494, options [nop,nop,TS val 3525522804 ecr 3525522804], length 0
2022-04-07 22:08:43.280850 IP (tos 0x0, ttl 64, id 704, offset 0, flags [DF], proto TCP (6), length 1273)
    127.0.0.1.11850 > 127.0.0.1.52646: Flags [P.], cksum 0x02ee (incorrect -> 0x039a), seq 3499:4720, ack 531, win 512, options [nop,nop,TS val 3525522832 ecr 3525522804], length 1221
2022-04-07 22:08:43.280858 IP (tos 0x0, ttl 64, id 7060, offset 0, flags [DF], proto TCP (6), length 52)
    127.0.0.1.52646 > 127.0.0.1.11850: Flags [.], cksum 0xfe28 (incorrect -> 0x320a), seq 531, ack 4720, win 503, options [nop,nop,TS val 3525522832 ecr 3525522832], length 0
2022-04-07 22:08:43.281390 IP (tos 0x0, ttl 64, id 7061, offset 0, flags [DF], proto TCP (6), length 116)
    127.0.0.1.52646 > 127.0.0.1.11850: Flags [P.], cksum 0xfe68 (incorrect -> 0x847a), seq 531:595, ack 4720, win 512, options [nop,nop,TS val 3525522833 ecr 3525522832], length 64
2022-04-07 22:08:43.281398 IP (tos 0x0, ttl 64, id 705, offset 0, flags [DF], proto TCP (6), length 52)
    127.0.0.1.11850 > 127.0.0.1.52646: Flags [.], cksum 0xfe28 (incorrect -> 0x31bf), seq 4720, ack 595, win 512, options [nop,nop,TS val 3525522833 ecr 3525522833], length 0
2022-04-07 22:08:43.281698 IP (tos 0x0, ttl 64, id 7062, offset 0, flags [DF], proto TCP (6), length 340)
    127.0.0.1.52646 > 127.0.0.1.11850: Flags [P.], cksum 0xff48 (incorrect -> 0xea41), seq 595:883, ack 4720, win 512, options [nop,nop,TS val 3525522833 ecr 3525522833], length 288
2022-04-07 22:08:43.281711 IP (tos 0x0, ttl 64, id 706, offset 0, flags [DF], proto TCP (6), length 52)
    127.0.0.1.11850 > 127.0.0.1.52646: Flags [.], cksum 0xfe28 (incorrect -> 0x30a1), seq 4720, ack 883, win 510, options [nop,nop,TS val 3525522833 ecr 3525522833], length 0
2022-04-07 22:08:43.380315 IP (tos 0x0, ttl 64, id 707, offset 0, flags [DF], proto TCP (6), length 594)
    127.0.0.1.11850 > 127.0.0.1.52646: Flags [P.], cksum 0x0047 (incorrect -> 0x9e1b), seq 4720:5262, ack 883, win 512, options [nop,nop,TS val 3525522932 ecr 3525522833], length 542
2022-04-07 22:08:43.380324 IP (tos 0x0, ttl 64, id 7063, offset 0, flags [DF], proto TCP (6), length 52)
    127.0.0.1.52646 > 127.0.0.1.11850: Flags [.], cksum 0xfe28 (incorrect -> 0x2dbf), seq 883, ack 5262, win 508, options [nop,nop,TS val 3525522932 ecr 3525522932], length 0
2022-04-07 22:08:43.571076 IP (tos 0x0, ttl 64, id 708, offset 0, flags [DF], proto TCP (6), length 1984)
    127.0.0.1.11850 > 127.0.0.1.52646: Flags [P.], cksum 0x05b5 (incorrect -> 0x4306), seq 5262:7194, ack 883, win 512, options [nop,nop,TS val 3525523122 ecr 3525522932], length 1932
2022-04-07 22:08:43.571085 IP (tos 0x0, ttl 64, id 7064, offset 0, flags [DF], proto TCP (6), length 52)
    127.0.0.1.52646 > 127.0.0.1.11850: Flags [.], cksum 0xfe28 (incorrect -> 0x24bf), seq 883, ack 7194, win 500, options [nop,nop,TS val 3525523122 ecr 3525523122], length 0
2022-04-07 22:08:43.586957 IP (tos 0x0, ttl 64, id 709, offset 0, flags [DF], proto TCP (6), length 1065)
    127.0.0.1.11850 > 127.0.0.1.52646: Flags [P.], cksum 0x021e (incorrect -> 0x9268), seq 7194:8207, ack 883, win 512, options [nop,nop,TS val 3525523138 ecr 3525523122], length 1013
2022-04-07 22:08:43.586965 IP (tos 0x0, ttl 64, id 7065, offset 0, flags [DF], proto TCP (6), length 52)
    127.0.0.1.52646 > 127.0.0.1.11850: Flags [.], cksum 0xfe28 (incorrect -> 0x20a6), seq 883, ack 8207, win 504, options [nop,nop,TS val 3525523138 ecr 3525523138], length 0
2022-04-07 22:08:43.708346 IP (tos 0x0, ttl 64, id 710, offset 0, flags [DF], proto TCP (6), length 3538)
    127.0.0.1.11850 > 127.0.0.1.52646: Flags [P.], cksum 0x0bc7 (incorrect -> 0x44a0), seq 8207:11693, ack 883, win 512, options [nop,nop,TS val 3525523260 ecr 3525523138], length 3486
2022-04-07 22:08:43.708355 IP (tos 0x0, ttl 64, id 7066, offset 0, flags [DF], proto TCP (6), length 52)
    127.0.0.1.52646 > 127.0.0.1.11850: Flags [.], cksum 0xfe28 (incorrect -> 0x121e), seq 883, ack 11693, win 494, options [nop,nop,TS val 3525523260 ecr 3525523260], length 0
2022-04-07 22:08:43.753433 IP (tos 0x0, ttl 64, id 711, offset 0, flags [DF], proto TCP (6), length 344)
    127.0.0.1.11850 > 127.0.0.1.52646: Flags [P.], cksum 0xff4c (incorrect -> 0xf907), seq 11693:11985, ack 883, win 512, options [nop,nop,TS val 3525523305 ecr 3525523260], length 292
2022-04-07 22:08:43.753448 IP (tos 0x0, ttl 64, id 7067, offset 0, flags [DF], proto TCP (6), length 52)
    127.0.0.1.52646 > 127.0.0.1.11850: Flags [.], cksum 0xfe28 (incorrect -> 0x1094), seq 883, ack 11985, win 506, options [nop,nop,TS val 3525523305 ecr 3525523305], length 0
2022-04-07 22:08:43.764730 IP (tos 0x0, ttl 64, id 712, offset 0, flags [DF], proto TCP (6), length 4096)
    127.0.0.1.11850 > 127.0.0.1.52646: Flags [P.], cksum 0x0df5 (incorrect -> 0xc988), seq 11985:16029, ack 883, win 512, options [nop,nop,TS val 3525523316 ecr 3525523305], length 4044
2022-04-07 22:08:43.764741 IP (tos 0x0, ttl 64, id 7068, offset 0, flags [DF], proto TCP (6), length 52)
    127.0.0.1.52646 > 127.0.0.1.11850: Flags [.], cksum 0xfe28 (incorrect -> 0x00c0), seq 883, ack 16029, win 492, options [nop,nop,TS val 3525523316 ecr 3525523316], length 0
2022-04-07 22:08:43.764772 IP (tos 0x0, ttl 64, id 713, offset 0, flags [DF], proto TCP (6), length 3040)
    127.0.0.1.11850 > 127.0.0.1.52646: Flags [P.], cksum 0x09d5 (incorrect -> 0xb13a), seq 16029:19017, ack 883, win 512, options [nop,nop,TS val 3525523316 ecr 3525523316], length 2988
2022-04-07 22:08:43.764776 IP (tos 0x0, ttl 64, id 7069, offset 0, flags [DF], proto TCP (6), length 52)
    127.0.0.1.52646 > 127.0.0.1.11850: Flags [.], cksum 0xfe28 (incorrect -> 0xf51f), seq 883, ack 19017, win 480, options [nop,nop,TS val 3525523316 ecr 3525523316], length 0
2022-04-07 22:08:43.769237 IP (tos 0x0, ttl 64, id 714, offset 0, flags [DF], proto TCP (6), length 4100)
    127.0.0.1.11850 > 127.0.0.1.52646: Flags [P.], cksum 0x0df9 (incorrect -> 0xf4f6), seq 19017:23065, ack 883, win 512, options [nop,nop,TS val 3525523321 ecr 3525523316], length 4048
2022-04-07 22:08:43.769244 IP (tos 0x0, ttl 64, id 7070, offset 0, flags [DF], proto TCP (6), length 52)
    127.0.0.1.52646 > 127.0.0.1.11850: Flags [.], cksum 0xfe28 (incorrect -> 0xe539), seq 883, ack 23065, win 492, options [nop,nop,TS val 3525523321 ecr 3525523321], length 0
2022-04-07 22:08:43.769250 IP (tos 0x0, ttl 64, id 715, offset 0, flags [DF], proto TCP (6), length 278)
    127.0.0.1.11850 > 127.0.0.1.52646: Flags [P.], cksum 0xff0a (incorrect -> 0x40db), seq 23065:23291, ack 883, win 512, options [nop,nop,TS val 3525523321 ecr 3525523321], length 226
2022-04-07 22:08:43.769288 IP (tos 0x0, ttl 64, id 7071, offset 0, flags [DF], proto TCP (6), length 52)
    127.0.0.1.52646 > 127.0.0.1.11850: Flags [.], cksum 0xfe28 (incorrect -> 0xe443), seq 883, ack 23291, win 512, options [nop,nop,TS val 3525523321 ecr 3525523321], length 0
2022-04-07 22:08:43.777955 IP (tos 0x0, ttl 64, id 716, offset 0, flags [DF], proto TCP (6), length 4100)
    127.0.0.1.11850 > 127.0.0.1.52646: Flags [P.], cksum 0x0df9 (incorrect -> 0x5fb9), seq 23291:27339, ack 883, win 512, options [nop,nop,TS val 3525523329 ecr 3525523321], length 4048
2022-04-07 22:08:43.790781 IP (tos 0x0, ttl 64, id 717, offset 0, flags [DF], proto TCP (6), length 32820)
    127.0.0.1.11850 > 127.0.0.1.52646: Flags [.], cksum 0x7e29 (incorrect -> 0x995b), seq 27339:60107, ack 883, win 512, options [nop,nop,TS val 3525523342 ecr 3525523321], length 32768
2022-04-07 22:08:43.790822 IP (tos 0x0, ttl 64, id 7072, offset 0, flags [DF], proto TCP (6), length 52)
    127.0.0.1.52646 > 127.0.0.1.11850: Flags [.], cksum 0xfe28 (incorrect -> 0x54db), seq 883, ack 60107, win 379, options [nop,nop,TS val 3525523342 ecr 3525523329], length 0
2022-04-07 22:08:43.790831 IP (tos 0x0, ttl 64, id 718, offset 0, flags [DF], proto TCP (6), length 3484)
    127.0.0.1.11850 > 127.0.0.1.52646: Flags [P.], cksum 0x0b91 (incorrect -> 0xf3c3), seq 60107:63539, ack 883, win 512, options [nop,nop,TS val 3525523342 ecr 3525523342], length 3432
2022-04-07 22:08:43.791822 IP (tos 0x0, ttl 64, id 7073, offset 0, flags [DF], proto TCP (6), length 52)
    127.0.0.1.52646 > 127.0.0.1.11850: Flags [.], cksum 0xfe28 (incorrect -> 0x46e0), seq 883, ack 63539, win 512, options [nop,nop,TS val 3525523343 ecr 3525523342], length 0
2022-04-07 22:08:43.791833 IP (tos 0x0, ttl 64, id 719, offset 0, flags [DF], proto TCP (6), length 22285)
    127.0.0.1.11850 > 127.0.0.1.52646: Flags [P.], cksum 0x5502 (incorrect -> 0x1a53), seq 63539:85772, ack 883, win 512, options [nop,nop,TS val 3525523343 ecr 3525523343], length 22233
2022-04-07 22:08:43.792260 IP (tos 0x0, ttl 64, id 7074, offset 0, flags [DF], proto TCP (6), length 52)
    127.0.0.1.52646 > 127.0.0.1.11850: Flags [.], cksum 0xfe28 (incorrect -> 0xf004), seq 883, ack 85772, win 512, options [nop,nop,TS val 3525523344 ecr 3525523343], length 0
2022-04-07 22:08:43.793166 IP (tos 0x0, ttl 64, id 720, offset 0, flags [DF], proto TCP (6), length 4100)
    127.0.0.1.11850 > 127.0.0.1.52646: Flags [P.], cksum 0x0df9 (incorrect -> 0x93ae), seq 85772:89820, ack 883, win 512, options [nop,nop,TS val 3525523344 ecr 3525523344], length 4048
2022-04-07 22:08:43.793341 IP (tos 0x0, ttl 64, id 7075, offset 0, flags [DF], proto TCP (6), length 52)
    127.0.0.1.52646 > 127.0.0.1.11850: Flags [.], cksum 0xfe28 (incorrect -> 0xe032), seq 883, ack 89820, win 512, options [nop,nop,TS val 3525523345 ecr 3525523344], length 0
2022-04-07 22:08:43.793353 IP (tos 0x0, ttl 64, id 721, offset 0, flags [DF], proto TCP (6), length 74)
    127.0.0.1.11850 > 127.0.0.1.52646: Flags [P.], cksum 0xfe3e (incorrect -> 0xc47e), seq 89820:89842, ack 883, win 512, options [nop,nop,TS val 3525523345 ecr 3525523345], length 22
2022-04-07 22:08:43.793359 IP (tos 0x0, ttl 64, id 7076, offset 0, flags [DF], proto TCP (6), length 52)
    127.0.0.1.52646 > 127.0.0.1.11850: Flags [.], cksum 0xfe28 (incorrect -> 0xe01b), seq 883, ack 89842, win 512, options [nop,nop,TS val 3525523345 ecr 3525523345], length 0
2022-04-07 22:08:43.794615 IP (tos 0x0, ttl 64, id 722, offset 0, flags [DF], proto TCP (6), length 4100)
    127.0.0.1.11850 > 127.0.0.1.52646: Flags [P.], cksum 0x0df9 (incorrect -> 0xebbc), seq 89842:93890, ack 883, win 512, options [nop,nop,TS val 3525523346 ecr 3525523345], length 4048
2022-04-07 22:08:43.794941 IP (tos 0x0, ttl 64, id 7077, offset 0, flags [DF], proto TCP (6), length 52)
    127.0.0.1.52646 > 127.0.0.1.11850: Flags [.], cksum 0xfe28 (incorrect -> 0xd049), seq 883, ack 93890, win 512, options [nop,nop,TS val 3525523346 ecr 3525523346], length 0
2022-04-07 22:08:43.794951 IP (tos 0x0, ttl 64, id 723, offset 0, flags [DF], proto TCP (6), length 2869)
    127.0.0.1.11850 > 127.0.0.1.52646: Flags [P.], cksum 0x092a (incorrect -> 0x78c5), seq 93890:96707, ack 883, win 512, options [nop,nop,TS val 3525523346 ecr 3525523346], length 2817
2022-04-07 22:08:43.794966 IP (tos 0x0, ttl 64, id 7078, offset 0, flags [DF], proto TCP (6), length 52)
    127.0.0.1.52646 > 127.0.0.1.11850: Flags [.], cksum 0xfe28 (incorrect -> 0xc548), seq 883, ack 96707, win 512, options [nop,nop,TS val 3525523346 ecr 3525523346], length 0
2022-04-07 22:08:43.803374 IP (tos 0x0, ttl 64, id 724, offset 0, flags [DF], proto TCP (6), length 4100)
    127.0.0.1.11850 > 127.0.0.1.52646: Flags [P.], cksum 0x0df9 (incorrect -> 0x4a18), seq 96707:100755, ack 883, win 512, options [nop,nop,TS val 3525523355 ecr 3525523346], length 4048
2022-04-07 22:08:43.803433 IP (tos 0x0, ttl 64, id 7079, offset 0, flags [DF], proto TCP (6), length 52)
    127.0.0.1.52646 > 127.0.0.1.11850: Flags [.], cksum 0xfe28 (incorrect -> 0xb566), seq 883, ack 100755, win 512, options [nop,nop,TS val 3525523355 ecr 3525523355], length 0
2022-04-07 22:08:43.803446 IP (tos 0x0, ttl 64, id 725, offset 0, flags [DF], proto TCP (6), length 6924)
    127.0.0.1.11850 > 127.0.0.1.52646: Flags [P.], cksum 0x1901 (incorrect -> 0xe57b), seq 100755:107627, ack 883, win 512, options [nop,nop,TS val 3525523355 ecr 3525523355], length 6872
2022-04-07 22:08:43.803752 IP (tos 0x0, ttl 64, id 7080, offset 0, flags [DF], proto TCP (6), length 52)
    127.0.0.1.52646 > 127.0.0.1.11850: Flags [.], cksum 0xfe28 (incorrect -> 0x9a8e), seq 883, ack 107627, win 512, options [nop,nop,TS val 3525523355 ecr 3525523355], length 0
2022-04-07 22:08:43.803772 IP (tos 0x0, ttl 64, id 726, offset 0, flags [DF], proto TCP (6), length 23831)
    127.0.0.1.11850 > 127.0.0.1.52646: Flags [P.], cksum 0x5b0c (incorrect -> 0x37eb), seq 107627:131406, ack 883, win 512, options [nop,nop,TS val 3525523355 ecr 3525523355], length 23779
2022-04-07 22:08:43.804323 IP (tos 0x0, ttl 64, id 7081, offset 0, flags [DF], proto TCP (6), length 52)
    127.0.0.1.52646 > 127.0.0.1.11850: Flags [.], cksum 0xfe28 (incorrect -> 0x3daa), seq 883, ack 131406, win 512, options [nop,nop,TS val 3525523356 ecr 3525523355], length 0
200, 6.061523914337158, 1.3810842037200928