2022-04-07 03:21:23.180654 IP (tos 0x0, ttl 64, id 47276, offset 0, flags [DF], proto TCP (6), length 60)
    127.0.0.1.35712 > 127.0.0.1.10850: Flags [S], cksum 0xfe30 (incorrect -> 0x9534), seq 3714004661, win 65495, options [mss 65495,sackOK,TS val 383965683 ecr 0,nop,wscale 7], length 0
2022-04-07 03:21:23.180664 IP (tos 0x0, ttl 64, id 0, offset 0, flags [DF], proto TCP (6), length 60)
    127.0.0.1.10850 > 127.0.0.1.35712: Flags [S.], cksum 0xfe30 (incorrect -> 0xc60d), seq 4031376897, ack 3714004662, win 65483, options [mss 65495,sackOK,TS val 383965683 ecr 383965683,nop,wscale 7], length 0
2022-04-07 03:21:23.180672 IP (tos 0x0, ttl 64, id 47277, offset 0, flags [DF], proto TCP (6), length 52)
    127.0.0.1.35712 > 127.0.0.1.10850: Flags [.], cksum 0xfe28 (incorrect -> 0xecc9), seq 1, ack 1, win 512, options [nop,nop,TS val 383965683 ecr 383965683], length 0
2022-04-07 03:21:23.180760 IP (tos 0x0, ttl 64, id 47278, offset 0, flags [DF], proto TCP (6), length 55)
    127.0.0.1.35712 > 127.0.0.1.10850: Flags [P.], cksum 0xfe2b (incorrect -> 0xe7bd), seq 1:4, ack 1, win 512, options [nop,nop,TS val 383965683 ecr 383965683], length 3
2022-04-07 03:21:23.180765 IP (tos 0x0, ttl 64, id 16095, offset 0, flags [DF], proto TCP (6), length 52)
    127.0.0.1.10850 > 127.0.0.1.35712: Flags [.], cksum 0xfe28 (incorrect -> 0xecc6), seq 1, ack 4, win 512, options [nop,nop,TS val 383965683 ecr 383965683], length 0
2022-04-07 03:21:23.180832 IP (tos 0x0, ttl 64, id 16096, offset 0, flags [DF], proto TCP (6), length 54)
    127.0.0.1.10850 > 127.0.0.1.35712: Flags [P.], cksum 0xfe2a (incorrect -> 0xe7bc), seq 1:3, ack 4, win 512, options [nop,nop,TS val 383965683 ecr 383965683], length 2
2022-04-07 03:21:23.180838 IP (tos 0x0, ttl 64, id 47279, offset 0, flags [DF], proto TCP (6), length 52)
    127.0.0.1.35712 > 127.0.0.1.10850: Flags [.], cksum 0xfe28 (incorrect -> 0xecc4), seq 4, ack 3, win 512, options [nop,nop,TS val 383965683 ecr 383965683], length 0
2022-04-07 03:21:23.191899 IP (tos 0x0, ttl 64, id 47280, offset 0, flags [DF], proto TCP (6), length 62)
    127.0.0.1.35712 > 127.0.0.1.10850: Flags [P.], cksum 0xfe32 (incorrect -> 0x150b), seq 4:14, ack 3, win 512, options [nop,nop,TS val 383965694 ecr 383965683], length 10
2022-04-07 03:21:23.191908 IP (tos 0x0, ttl 64, id 16097, offset 0, flags [DF], proto TCP (6), length 52)
    127.0.0.1.10850 > 127.0.0.1.35712: Flags [.], cksum 0xfe28 (incorrect -> 0xeca4), seq 3, ack 14, win 512, options [nop,nop,TS val 383965694 ecr 383965694], length 0
2022-04-07 03:21:23.268260 IP (tos 0x0, ttl 64, id 16098, offset 0, flags [DF], proto TCP (6), length 62)
    127.0.0.1.10850 > 127.0.0.1.35712: Flags [P.], cksum 0xfe32 (incorrect -> 0xe744), seq 3:13, ack 14, win 512, options [nop,nop,TS val 383965771 ecr 383965694], length 10
2022-04-07 03:21:23.268267 IP (tos 0x0, ttl 64, id 47281, offset 0, flags [DF], proto TCP (6), length 52)
    127.0.0.1.35712 > 127.0.0.1.10850: Flags [.], cksum 0xfe28 (incorrect -> 0xec00), seq 14, ack 13, win 512, options [nop,nop,TS val 383965771 ecr 383965771], length 0
2022-04-07 03:21:23.273844 IP (tos 0x0, ttl 64, id 47282, offset 0, flags [DF], proto TCP (6), length 569)
    127.0.0.1.35712 > 127.0.0.1.10850: Flags [P.], cksum 0x002e (incorrect -> 0xdd5c), seq 14:531, ack 13, win 512, options [nop,nop,TS val 383965776 ecr 383965771], length 517
2022-04-07 03:21:23.273856 IP (tos 0x0, ttl 64, id 16099, offset 0, flags [DF], proto TCP (6), length 52)
    127.0.0.1.10850 > 127.0.0.1.35712: Flags [.], cksum 0xfe28 (incorrect -> 0xe9f5), seq 13, ack 531, win 508, options [nop,nop,TS val 383965776 ecr 383965776], length 0
200, 4.823958873748779, 0.6519138813018799