2022-04-07 16:37:02.307294 IP (tos 0x0, ttl 64, id 39422, offset 0, flags [DF], proto TCP (6), length 60)
    127.0.0.1.35714 > 127.0.0.1.10150: Flags [S], cksum 0xfe30 (incorrect -> 0x313b), seq 1820107466, win 65495, options [mss 65495,sackOK,TS val 3505621859 ecr 0,nop,wscale 7], length 0
2022-04-07 16:37:02.307307 IP (tos 0x0, ttl 64, id 0, offset 0, flags [DF], proto TCP (6), length 60)
    127.0.0.1.10150 > 127.0.0.1.35714: Flags [S.], cksum 0xfe30 (incorrect -> 0xad22), seq 2289934142, ack 1820107467, win 65483, options [mss 65495,sackOK,TS val 3505621859 ecr 3505621859,nop,wscale 7], length 0
2022-04-07 16:37:02.307317 IP (tos 0x0, ttl 64, id 39423, offset 0, flags [DF], proto TCP (6), length 52)
    127.0.0.1.35714 > 127.0.0.1.10150: Flags [.], cksum 0xfe28 (incorrect -> 0xd3de), seq 1, ack 1, win 512, options [nop,nop,TS val 3505621859 ecr 3505621859], length 0
2022-04-07 16:37:02.307425 IP (tos 0x0, ttl 64, id 39424, offset 0, flags [DF], proto TCP (6), length 55)
    127.0.0.1.35714 > 127.0.0.1.10150: Flags [P.], cksum 0xfe2b (incorrect -> 0xced2), seq 1:4, ack 1, win 512, options [nop,nop,TS val 3505621859 ecr 3505621859], length 3
2022-04-07 16:37:02.307435 IP (tos 0x0, ttl 64, id 34055, offset 0, flags [DF], proto TCP (6), length 52)
    127.0.0.1.10150 > 127.0.0.1.35714: Flags [.], cksum 0xfe28 (incorrect -> 0xd3db), seq 1, ack 4, win 512, options [nop,nop,TS val 3505621859 ecr 3505621859], length 0
2022-04-07 16:37:02.307489 IP (tos 0x0, ttl 64, id 34056, offset 0, flags [DF], proto TCP (6), length 54)
    127.0.0.1.10150 > 127.0.0.1.35714: Flags [P.], cksum 0xfe2a (incorrect -> 0xced1), seq 1:3, ack 4, win 512, options [nop,nop,TS val 3505621859 ecr 3505621859], length 2
2022-04-07 16:37:02.307505 IP (tos 0x0, ttl 64, id 39425, offset 0, flags [DF], proto TCP (6), length 52)
    127.0.0.1.35714 > 127.0.0.1.10150: Flags [.], cksum 0xfe28 (incorrect -> 0xd3d9), seq 4, ack 3, win 512, options [nop,nop,TS val 3505621859 ecr 3505621859], length 0
2022-04-07 16:37:02.309249 IP (tos 0x0, ttl 64, id 39426, offset 0, flags [DF], proto TCP (6), length 62)
    127.0.0.1.35714 > 127.0.0.1.10150: Flags [P.], cksum 0xfe32 (incorrect -> 0x958f), seq 4:14, ack 3, win 512, options [nop,nop,TS val 3505621861 ecr 3505621859], length 10
2022-04-07 16:37:02.309266 IP (tos 0x0, ttl 64, id 34057, offset 0, flags [DF], proto TCP (6), length 52)
    127.0.0.1.10150 > 127.0.0.1.35714: Flags [.], cksum 0xfe28 (incorrect -> 0xd3cb), seq 3, ack 14, win 512, options [nop,nop,TS val 3505621861 ecr 3505621861], length 0
2022-04-07 16:37:02.364280 IP (tos 0x0, ttl 64, id 34058, offset 0, flags [DF], proto TCP (6), length 62)
    127.0.0.1.10150 > 127.0.0.1.35714: Flags [P.], cksum 0xfe32 (incorrect -> 0xce81), seq 3:13, ack 14, win 512, options [nop,nop,TS val 3505621916 ecr 3505621861], length 10
2022-04-07 16:37:02.364289 IP (tos 0x0, ttl 64, id 39427, offset 0, flags [DF], proto TCP (6), length 52)
    127.0.0.1.35714 > 127.0.0.1.10150: Flags [.], cksum 0xfe28 (incorrect -> 0xd353), seq 14, ack 13, win 512, options [nop,nop,TS val 3505621916 ecr 3505621916], length 0
2022-04-07 16:37:02.370086 IP (tos 0x0, ttl 64, id 39428, offset 0, flags [DF], proto TCP (6), length 569)
    127.0.0.1.35714 > 127.0.0.1.10150: Flags [P.], cksum 0x002e (incorrect -> 0x70ab), seq 14:531, ack 13, win 512, options [nop,nop,TS val 3505621921 ecr 3505621916], length 517
2022-04-07 16:37:02.370103 IP (tos 0x0, ttl 64, id 34059, offset 0, flags [DF], proto TCP (6), length 52)
    127.0.0.1.10150 > 127.0.0.1.35714: Flags [.], cksum 0xfe28 (incorrect -> 0xd148), seq 13, ack 531, win 508, options [nop,nop,TS val 3505621921 ecr 3505621921], length 0
2022-04-07 16:37:02.436993 IP (tos 0x0, ttl 64, id 34060, offset 0, flags [DF], proto TCP (6), length 3538)
    127.0.0.1.10150 > 127.0.0.1.35714: Flags [P.], cksum 0x0bc7 (incorrect -> 0xff19), seq 13:3499, ack 531, win 512, options [nop,nop,TS val 3505621988 ecr 3505621921], length 3486
2022-04-07 16:37:02.437007 IP (tos 0x0, ttl 64, id 39429, offset 0, flags [DF], proto TCP (6), length 52)
    127.0.0.1.35714 > 127.0.0.1.10150: Flags [.], cksum 0xfe28 (incorrect -> 0xc332), seq 531, ack 3499, win 494, options [nop,nop,TS val 3505621988 ecr 3505621988], length 0
2022-04-07 16:37:02.449370 IP (tos 0x0, ttl 64, id 34061, offset 0, flags [DF], proto TCP (6), length 567)
    127.0.0.1.10150 > 127.0.0.1.35714: Flags [P.], cksum 0x002c (incorrect -> 0xadbc), seq 3499:4014, ack 531, win 512, options [nop,nop,TS val 3505622001 ecr 3505621988], length 515
2022-04-07 16:37:02.449376 IP (tos 0x0, ttl 64, id 39430, offset 0, flags [DF], proto TCP (6), length 52)
    127.0.0.1.35714 > 127.0.0.1.10150: Flags [.], cksum 0xfe28 (incorrect -> 0xc10a), seq 531, ack 4014, win 505, options [nop,nop,TS val 3505622001 ecr 3505622001], length 0
2022-04-07 16:37:02.452053 IP (tos 0x0, ttl 64, id 39431, offset 0, flags [DF], proto TCP (6), length 210)
    127.0.0.1.35714 > 127.0.0.1.10150: Flags [P.], cksum 0xfec6 (incorrect -> 0xdf9c), seq 531:689, ack 4014, win 512, options [nop,nop,TS val 3505622003 ecr 3505622001], length 158
2022-04-07 16:37:02.452061 IP (tos 0x0, ttl 64, id 34062, offset 0, flags [DF], proto TCP (6), length 52)
    127.0.0.1.10150 > 127.0.0.1.35714: Flags [.], cksum 0xfe28 (incorrect -> 0xc062), seq 4014, ack 689, win 511, options [nop,nop,TS val 3505622003 ecr 3505622003], length 0
200, 7.909923315048218, 0.7239747047424316