2022-04-07 04:07:50.053244 IP (tos 0x0, ttl 64, id 48090, offset 0, flags [DF], proto TCP (6), length 60)
    127.0.0.1.39782 > 127.0.0.1.10350: Flags [S], cksum 0xfe30 (incorrect -> 0x3689), seq 1665956638, win 65495, options [mss 65495,sackOK,TS val 386752556 ecr 0,nop,wscale 7], length 0
2022-04-07 04:07:50.053255 IP (tos 0x0, ttl 64, id 0, offset 0, flags [DF], proto TCP (6), length 60)
    127.0.0.1.10350 > 127.0.0.1.39782: Flags [S.], cksum 0xfe30 (incorrect -> 0x0180), seq 3248421931, ack 1665956639, win 65483, options [mss 65495,sackOK,TS val 386752556 ecr 386752556,nop,wscale 7], length 0
2022-04-07 04:07:50.053264 IP (tos 0x0, ttl 64, id 48091, offset 0, flags [DF], proto TCP (6), length 52)
    127.0.0.1.39782 > 127.0.0.1.10350: Flags [.], cksum 0xfe28 (incorrect -> 0x283c), seq 1, ack 1, win 512, options [nop,nop,TS val 386752556 ecr 386752556], length 0
2022-04-07 04:07:50.053370 IP (tos 0x0, ttl 64, id 48092, offset 0, flags [DF], proto TCP (6), length 55)
    127.0.0.1.39782 > 127.0.0.1.10350: Flags [P.], cksum 0xfe2b (incorrect -> 0x2330), seq 1:4, ack 1, win 512, options [nop,nop,TS val 386752556 ecr 386752556], length 3
2022-04-07 04:07:50.053383 IP (tos 0x0, ttl 64, id 11423, offset 0, flags [DF], proto TCP (6), length 52)
    127.0.0.1.10350 > 127.0.0.1.39782: Flags [.], cksum 0xfe28 (incorrect -> 0x2839), seq 1, ack 4, win 512, options [nop,nop,TS val 386752556 ecr 386752556], length 0
2022-04-07 04:07:50.053419 IP (tos 0x0, ttl 64, id 11424, offset 0, flags [DF], proto TCP (6), length 54)
    127.0.0.1.10350 > 127.0.0.1.39782: Flags [P.], cksum 0xfe2a (incorrect -> 0x232f), seq 1:3, ack 4, win 512, options [nop,nop,TS val 386752556 ecr 386752556], length 2
2022-04-07 04:07:50.053430 IP (tos 0x0, ttl 64, id 48093, offset 0, flags [DF], proto TCP (6), length 52)
    127.0.0.1.39782 > 127.0.0.1.10350: Flags [.], cksum 0xfe28 (incorrect -> 0x2837), seq 4, ack 3, win 512, options [nop,nop,TS val 386752556 ecr 386752556], length 0
2022-04-07 04:07:50.066684 IP (tos 0x0, ttl 64, id 48094, offset 0, flags [DF], proto TCP (6), length 62)
    127.0.0.1.39782 > 127.0.0.1.10350: Flags [P.], cksum 0xfe32 (incorrect -> 0x96bb), seq 4:14, ack 3, win 512, options [nop,nop,TS val 386752569 ecr 386752556], length 10
2022-04-07 04:07:50.066698 IP (tos 0x0, ttl 64, id 11425, offset 0, flags [DF], proto TCP (6), length 52)
    127.0.0.1.10350 > 127.0.0.1.39782: Flags [.], cksum 0xfe28 (incorrect -> 0x2813), seq 3, ack 14, win 512, options [nop,nop,TS val 386752569 ecr 386752569], length 0
2022-04-07 04:07:50.119491 IP (tos 0x0, ttl 64, id 11426, offset 0, flags [DF], proto TCP (6), length 62)
    127.0.0.1.10350 > 127.0.0.1.39782: Flags [P.], cksum 0xfe32 (incorrect -> 0x22cb), seq 3:13, ack 14, win 512, options [nop,nop,TS val 386752622 ecr 386752569], length 10
2022-04-07 04:07:50.119506 IP (tos 0x0, ttl 64, id 48095, offset 0, flags [DF], proto TCP (6), length 52)
    127.0.0.1.39782 > 127.0.0.1.10350: Flags [.], cksum 0xfe28 (incorrect -> 0x279f), seq 14, ack 13, win 512, options [nop,nop,TS val 386752622 ecr 386752622], length 0
2022-04-07 04:07:50.124988 IP (tos 0x0, ttl 64, id 48096, offset 0, flags [DF], proto TCP (6), length 569)
    127.0.0.1.39782 > 127.0.0.1.10350: Flags [P.], cksum 0x002e (incorrect -> 0x0d12), seq 14:531, ack 13, win 512, options [nop,nop,TS val 386752627 ecr 386752622], length 517
2022-04-07 04:07:50.125005 IP (tos 0x0, ttl 64, id 11427, offset 0, flags [DF], proto TCP (6), length 52)
    127.0.0.1.10350 > 127.0.0.1.39782: Flags [.], cksum 0xfe28 (incorrect -> 0x2594), seq 13, ack 531, win 508, options [nop,nop,TS val 386752627 ecr 386752627], length 0
200, 3.842135429382324, 0.6263973712921143