2022-04-07 06:37:33.483337 IP (tos 0x0, ttl 64, id 6000, offset 0, flags [DF], proto TCP (6), length 60)
    127.0.0.1.48004 > 127.0.0.1.11350: Flags [S], cksum 0xfe30 (incorrect -> 0x9eda), seq 765071466, win 65495, options [mss 65495,sackOK,TS val 395735986 ecr 0,nop,wscale 7], length 0
2022-04-07 06:37:33.483351 IP (tos 0x0, ttl 64, id 0, offset 0, flags [DF], proto TCP (6), length 60)
    127.0.0.1.11350 > 127.0.0.1.48004: Flags [S.], cksum 0xfe30 (incorrect -> 0x7a18), seq 2033066054, ack 765071467, win 65483, options [mss 65495,sackOK,TS val 395735986 ecr 395735986,nop,wscale 7], length 0
2022-04-07 06:37:33.483363 IP (tos 0x0, ttl 64, id 6001, offset 0, flags [DF], proto TCP (6), length 52)
    127.0.0.1.48004 > 127.0.0.1.11350: Flags [.], cksum 0xfe28 (incorrect -> 0xa0d4), seq 1, ack 1, win 512, options [nop,nop,TS val 395735986 ecr 395735986], length 0
2022-04-07 06:37:33.483517 IP (tos 0x0, ttl 64, id 6002, offset 0, flags [DF], proto TCP (6), length 55)
    127.0.0.1.48004 > 127.0.0.1.11350: Flags [P.], cksum 0xfe2b (incorrect -> 0x9bc8), seq 1:4, ack 1, win 512, options [nop,nop,TS val 395735986 ecr 395735986], length 3
2022-04-07 06:37:33.483524 IP (tos 0x0, ttl 64, id 22983, offset 0, flags [DF], proto TCP (6), length 52)
    127.0.0.1.11350 > 127.0.0.1.48004: Flags [.], cksum 0xfe28 (incorrect -> 0xa0d1), seq 1, ack 4, win 512, options [nop,nop,TS val 395735986 ecr 395735986], length 0
2022-04-07 06:37:33.483553 IP (tos 0x0, ttl 64, id 22984, offset 0, flags [DF], proto TCP (6), length 54)
    127.0.0.1.11350 > 127.0.0.1.48004: Flags [P.], cksum 0xfe2a (incorrect -> 0x9bc7), seq 1:3, ack 4, win 512, options [nop,nop,TS val 395735986 ecr 395735986], length 2
2022-04-07 06:37:33.483562 IP (tos 0x0, ttl 64, id 6003, offset 0, flags [DF], proto TCP (6), length 52)
    127.0.0.1.48004 > 127.0.0.1.11350: Flags [.], cksum 0xfe28 (incorrect -> 0xa0cf), seq 4, ack 3, win 512, options [nop,nop,TS val 395735986 ecr 395735986], length 0
2022-04-07 06:37:33.485229 IP (tos 0x0, ttl 64, id 6004, offset 0, flags [DF], proto TCP (6), length 62)
    127.0.0.1.48004 > 127.0.0.1.11350: Flags [P.], cksum 0xfe32 (incorrect -> 0x5175), seq 4:14, ack 3, win 512, options [nop,nop,TS val 395735988 ecr 395735986], length 10
2022-04-07 06:37:33.485238 IP (tos 0x0, ttl 64, id 22985, offset 0, flags [DF], proto TCP (6), length 52)
    127.0.0.1.11350 > 127.0.0.1.48004: Flags [.], cksum 0xfe28 (incorrect -> 0xa0c1), seq 3, ack 14, win 512, options [nop,nop,TS val 395735988 ecr 395735988], length 0
2022-04-07 06:37:33.583214 IP (tos 0x0, ttl 64, id 22986, offset 0, flags [DF], proto TCP (6), length 62)
    127.0.0.1.11350 > 127.0.0.1.48004: Flags [P.], cksum 0xfe32 (incorrect -> 0x9b4c), seq 3:13, ack 14, win 512, options [nop,nop,TS val 395736086 ecr 395735988], length 10
2022-04-07 06:37:33.583224 IP (tos 0x0, ttl 64, id 6005, offset 0, flags [DF], proto TCP (6), length 52)
    127.0.0.1.48004 > 127.0.0.1.11350: Flags [.], cksum 0xfe28 (incorrect -> 0x9ff3), seq 14, ack 13, win 512, options [nop,nop,TS val 395736086 ecr 395736086], length 0
2022-04-07 06:37:33.589068 IP (tos 0x0, ttl 64, id 6006, offset 0, flags [DF], proto TCP (6), length 569)
    127.0.0.1.48004 > 127.0.0.1.11350: Flags [P.], cksum 0x002e (incorrect -> 0x2c98), seq 14:531, ack 13, win 512, options [nop,nop,TS val 395736092 ecr 395736086], length 517
2022-04-07 06:37:33.589078 IP (tos 0x0, ttl 64, id 22987, offset 0, flags [DF], proto TCP (6), length 52)
    127.0.0.1.11350 > 127.0.0.1.48004: Flags [.], cksum 0xfe28 (incorrect -> 0x9de6), seq 13, ack 531, win 508, options [nop,nop,TS val 395736092 ecr 395736092], length 0
200, 4.685722589492798, 0.6975483894348145