2022-04-07 09:04:22.008206 IP (tos 0x0, ttl 64, id 35678, offset 0, flags [DF], proto TCP (6), length 60)
    127.0.0.1.56516 > 127.0.0.1.9250: Flags [S], cksum 0xfe30 (incorrect -> 0x4681), seq 3104924603, win 65495, options [mss 65495,sackOK,TS val 3478461559 ecr 0,nop,wscale 7], length 0
2022-04-07 09:04:22.008236 IP (tos 0x0, ttl 64, id 0, offset 0, flags [DF], proto TCP (6), length 60)
    127.0.0.1.9250 > 127.0.0.1.56516: Flags [S.], cksum 0xfe30 (incorrect -> 0x0461), seq 2432746828, ack 3104924604, win 65483, options [mss 65495,sackOK,TS val 3478461560 ecr 3478461559,nop,wscale 7], length 0
2022-04-07 09:04:22.008254 IP (tos 0x0, ttl 64, id 35679, offset 0, flags [DF], proto TCP (6), length 52)
    127.0.0.1.56516 > 127.0.0.1.9250: Flags [.], cksum 0xfe28 (incorrect -> 0x2b1c), seq 1, ack 1, win 512, options [nop,nop,TS val 3478461560 ecr 3478461560], length 0
2022-04-07 09:04:22.008456 IP (tos 0x0, ttl 64, id 35680, offset 0, flags [DF], proto TCP (6), length 55)
    127.0.0.1.56516 > 127.0.0.1.9250: Flags [P.], cksum 0xfe2b (incorrect -> 0x2610), seq 1:4, ack 1, win 512, options [nop,nop,TS val 3478461560 ecr 3478461560], length 3
2022-04-07 09:04:22.008465 IP (tos 0x0, ttl 64, id 62868, offset 0, flags [DF], proto TCP (6), length 52)
    127.0.0.1.9250 > 127.0.0.1.56516: Flags [.], cksum 0xfe28 (incorrect -> 0x2b19), seq 1, ack 4, win 512, options [nop,nop,TS val 3478461560 ecr 3478461560], length 0
2022-04-07 09:04:22.008498 IP (tos 0x0, ttl 64, id 62869, offset 0, flags [DF], proto TCP (6), length 54)
    127.0.0.1.9250 > 127.0.0.1.56516: Flags [P.], cksum 0xfe2a (incorrect -> 0x260f), seq 1:3, ack 4, win 512, options [nop,nop,TS val 3478461560 ecr 3478461560], length 2
2022-04-07 09:04:22.008507 IP (tos 0x0, ttl 64, id 35681, offset 0, flags [DF], proto TCP (6), length 52)
    127.0.0.1.56516 > 127.0.0.1.9250: Flags [.], cksum 0xfe28 (incorrect -> 0x2b17), seq 4, ack 3, win 512, options [nop,nop,TS val 3478461560 ecr 3478461560], length 0
2022-04-07 09:04:22.049387 IP (tos 0x0, ttl 64, id 35682, offset 0, flags [DF], proto TCP (6), length 62)
    127.0.0.1.56516 > 127.0.0.1.9250: Flags [P.], cksum 0xfe32 (incorrect -> 0xdd50), seq 4:14, ack 3, win 512, options [nop,nop,TS val 3478461601 ecr 3478461560], length 10
2022-04-07 09:04:22.049408 IP (tos 0x0, ttl 64, id 62870, offset 0, flags [DF], proto TCP (6), length 52)
    127.0.0.1.9250 > 127.0.0.1.56516: Flags [.], cksum 0xfe28 (incorrect -> 0x2abb), seq 3, ack 14, win 512, options [nop,nop,TS val 3478461601 ecr 3478461601], length 0
2022-04-07 09:04:22.194715 IP (tos 0x0, ttl 64, id 62871, offset 0, flags [DF], proto TCP (6), length 62)
    127.0.0.1.9250 > 127.0.0.1.56516: Flags [P.], cksum 0xfe32 (incorrect -> 0x2517), seq 3:13, ack 14, win 512, options [nop,nop,TS val 3478461746 ecr 3478461601], length 10
2022-04-07 09:04:22.194731 IP (tos 0x0, ttl 64, id 35683, offset 0, flags [DF], proto TCP (6), length 52)
    127.0.0.1.56516 > 127.0.0.1.9250: Flags [.], cksum 0xfe28 (incorrect -> 0x298f), seq 14, ack 13, win 512, options [nop,nop,TS val 3478461746 ecr 3478461746], length 0
2022-04-07 09:04:22.200351 IP (tos 0x0, ttl 64, id 35684, offset 0, flags [DF], proto TCP (6), length 569)
    127.0.0.1.56516 > 127.0.0.1.9250: Flags [P.], cksum 0x002e (incorrect -> 0x07e4), seq 14:531, ack 13, win 512, options [nop,nop,TS val 3478461752 ecr 3478461746], length 517
2022-04-07 09:04:22.200368 IP (tos 0x0, ttl 64, id 62872, offset 0, flags [DF], proto TCP (6), length 52)
    127.0.0.1.9250 > 127.0.0.1.56516: Flags [.], cksum 0xfe28 (incorrect -> 0x2782), seq 13, ack 531, win 508, options [nop,nop,TS val 3478461752 ecr 3478461752], length 0
