2022-04-07 22:34:41.958989 IP (tos 0x0, ttl 64, id 24084, offset 0, flags [DF], proto TCP (6), length 60)
    127.0.0.1.43202 > 127.0.0.1.11350: Flags [S], cksum 0xfe30 (incorrect -> 0xfb29), seq 531206068, win 65495, options [mss 65495,sackOK,TS val 3527081510 ecr 0,nop,wscale 7], length 0
2022-04-07 22:34:41.958999 IP (tos 0x0, ttl 64, id 0, offset 0, flags [DF], proto TCP (6), length 60)
    127.0.0.1.11350 > 127.0.0.1.43202: Flags [S.], cksum 0xfe30 (incorrect -> 0x70a3), seq 3183279202, ack 531206069, win 65483, options [mss 65495,sackOK,TS val 3527081510 ecr 3527081510,nop,wscale 7], length 0
2022-04-07 22:34:41.959009 IP (tos 0x0, ttl 64, id 24085, offset 0, flags [DF], proto TCP (6), length 52)
    127.0.0.1.43202 > 127.0.0.1.11350: Flags [.], cksum 0xfe28 (incorrect -> 0x975f), seq 1, ack 1, win 512, options [nop,nop,TS val 3527081510 ecr 3527081510], length 0
2022-04-07 22:34:41.959105 IP (tos 0x0, ttl 64, id 24086, offset 0, flags [DF], proto TCP (6), length 55)
    127.0.0.1.43202 > 127.0.0.1.11350: Flags [P.], cksum 0xfe2b (incorrect -> 0x9253), seq 1:4, ack 1, win 512, options [nop,nop,TS val 3527081510 ecr 3527081510], length 3
2022-04-07 22:34:41.959111 IP (tos 0x0, ttl 64, id 27081, offset 0, flags [DF], proto TCP (6), length 52)
    127.0.0.1.11350 > 127.0.0.1.43202: Flags [.], cksum 0xfe28 (incorrect -> 0x975c), seq 1, ack 4, win 512, options [nop,nop,TS val 3527081510 ecr 3527081510], length 0
2022-04-07 22:34:41.959207 IP (tos 0x0, ttl 64, id 27082, offset 0, flags [DF], proto TCP (6), length 54)
    127.0.0.1.11350 > 127.0.0.1.43202: Flags [P.], cksum 0xfe2a (incorrect -> 0x9252), seq 1:3, ack 4, win 512, options [nop,nop,TS val 3527081510 ecr 3527081510], length 2
2022-04-07 22:34:41.959235 IP (tos 0x0, ttl 64, id 24087, offset 0, flags [DF], proto TCP (6), length 52)
    127.0.0.1.43202 > 127.0.0.1.11350: Flags [.], cksum 0xfe28 (incorrect -> 0x975a), seq 4, ack 3, win 512, options [nop,nop,TS val 3527081510 ecr 3527081510], length 0
2022-04-07 22:34:41.960864 IP (tos 0x0, ttl 64, id 24088, offset 0, flags [DF], proto TCP (6), length 62)
    127.0.0.1.43202 > 127.0.0.1.11350: Flags [P.], cksum 0xfe32 (incorrect -> 0xf819), seq 4:14, ack 3, win 512, options [nop,nop,TS val 3527081512 ecr 3527081510], length 10
2022-04-07 22:34:41.960879 IP (tos 0x0, ttl 64, id 27083, offset 0, flags [DF], proto TCP (6), length 52)
    127.0.0.1.11350 > 127.0.0.1.43202: Flags [.], cksum 0xfe28 (incorrect -> 0x974c), seq 3, ack 14, win 512, options [nop,nop,TS val 3527081512 ecr 3527081512], length 0
2022-04-07 22:34:42.113375 IP (tos 0x0, ttl 64, id 27084, offset 0, flags [DF], proto TCP (6), length 62)
    127.0.0.1.11350 > 127.0.0.1.43202: Flags [P.], cksum 0xfe32 (incorrect -> 0x91a0), seq 3:13, ack 14, win 512, options [nop,nop,TS val 3527081665 ecr 3527081512], length 10
2022-04-07 22:34:42.113406 IP (tos 0x0, ttl 64, id 24089, offset 0, flags [DF], proto TCP (6), length 52)
    127.0.0.1.43202 > 127.0.0.1.11350: Flags [.], cksum 0xfe28 (incorrect -> 0x9610), seq 14, ack 13, win 512, options [nop,nop,TS val 3527081665 ecr 3527081665], length 0
200, 5.888707160949707, 0.6228728294372559