2022-04-07 13:42:41.445698 IP (tos 0x0, ttl 64, id 63514, offset 0, flags [DF], proto TCP (6), length 60)
    127.0.0.1.48426 > 127.0.0.1.10350: Flags [S], cksum 0xfe30 (incorrect -> 0xe524), seq 1957122979, win 65495, options [mss 65495,sackOK,TS val 3495160997 ecr 0,nop,wscale 7], length 0
2022-04-07 13:42:41.445709 IP (tos 0x0, ttl 64, id 0, offset 0, flags [DF], proto TCP (6), length 60)
    127.0.0.1.10350 > 127.0.0.1.48426: Flags [S.], cksum 0xfe30 (incorrect -> 0x7d33), seq 2966813212, ack 1957122980, win 65483, options [mss 65495,sackOK,TS val 3495160997 ecr 3495160997,nop,wscale 7], length 0
2022-04-07 13:42:41.445719 IP (tos 0x0, ttl 64, id 63515, offset 0, flags [DF], proto TCP (6), length 52)
    127.0.0.1.48426 > 127.0.0.1.10350: Flags [.], cksum 0xfe28 (incorrect -> 0xa3ef), seq 1, ack 1, win 512, options [nop,nop,TS val 3495160997 ecr 3495160997], length 0
2022-04-07 13:42:41.445827 IP (tos 0x0, ttl 64, id 63516, offset 0, flags [DF], proto TCP (6), length 55)
    127.0.0.1.48426 > 127.0.0.1.10350: Flags [P.], cksum 0xfe2b (incorrect -> 0x9ee3), seq 1:4, ack 1, win 512, options [nop,nop,TS val 3495160997 ecr 3495160997], length 3
2022-04-07 13:42:41.445830 IP (tos 0x0, ttl 64, id 34111, offset 0, flags [DF], proto TCP (6), length 52)
    127.0.0.1.10350 > 127.0.0.1.48426: Flags [.], cksum 0xfe28 (incorrect -> 0xa3ec), seq 1, ack 4, win 512, options [nop,nop,TS val 3495160997 ecr 3495160997], length 0
2022-04-07 13:42:41.445943 IP (tos 0x0, ttl 64, id 34112, offset 0, flags [DF], proto TCP (6), length 54)
    127.0.0.1.10350 > 127.0.0.1.48426: Flags [P.], cksum 0xfe2a (incorrect -> 0x9ee2), seq 1:3, ack 4, win 512, options [nop,nop,TS val 3495160997 ecr 3495160997], length 2
2022-04-07 13:42:41.445960 IP (tos 0x0, ttl 64, id 63517, offset 0, flags [DF], proto TCP (6), length 52)
    127.0.0.1.48426 > 127.0.0.1.10350: Flags [.], cksum 0xfe28 (incorrect -> 0xa3ea), seq 4, ack 3, win 512, options [nop,nop,TS val 3495160997 ecr 3495160997], length 0
2022-04-07 13:42:41.447917 IP (tos 0x0, ttl 64, id 63518, offset 0, flags [DF], proto TCP (6), length 62)
    127.0.0.1.48426 > 127.0.0.1.10350: Flags [P.], cksum 0xfe32 (incorrect -> 0x564b), seq 4:14, ack 3, win 512, options [nop,nop,TS val 3495160999 ecr 3495160997], length 10
2022-04-07 13:42:41.447935 IP (tos 0x0, ttl 64, id 34113, offset 0, flags [DF], proto TCP (6), length 52)
    127.0.0.1.10350 > 127.0.0.1.48426: Flags [.], cksum 0xfe28 (incorrect -> 0xa3dc), seq 3, ack 14, win 512, options [nop,nop,TS val 3495160999 ecr 3495160999], length 0
2022-04-07 13:42:41.633413 IP (tos 0x0, ttl 64, id 34114, offset 0, flags [DF], proto TCP (6), length 62)
    127.0.0.1.10350 > 127.0.0.1.48426: Flags [P.], cksum 0xfe32 (incorrect -> 0x9e0f), seq 3:13, ack 14, win 512, options [nop,nop,TS val 3495161185 ecr 3495160999], length 10
2022-04-07 13:42:41.633422 IP (tos 0x0, ttl 64, id 63519, offset 0, flags [DF], proto TCP (6), length 52)
    127.0.0.1.48426 > 127.0.0.1.10350: Flags [.], cksum 0xfe28 (incorrect -> 0xa25e), seq 14, ack 13, win 512, options [nop,nop,TS val 3495161185 ecr 3495161185], length 0
2022-04-07 13:42:41.639489 IP (tos 0x0, ttl 64, id 63520, offset 0, flags [DF], proto TCP (6), length 569)
    127.0.0.1.48426 > 127.0.0.1.10350: Flags [P.], cksum 0x002e (incorrect -> 0x2fa4), seq 14:531, ack 13, win 512, options [nop,nop,TS val 3495161191 ecr 3495161185], length 517
2022-04-07 13:42:41.639508 IP (tos 0x0, ttl 64, id 34115, offset 0, flags [DF], proto TCP (6), length 52)
    127.0.0.1.10350 > 127.0.0.1.48426: Flags [.], cksum 0xfe28 (incorrect -> 0xa051), seq 13, ack 531, win 508, options [nop,nop,TS val 3495161191 ecr 3495161191], length 0
