2022-04-07 17:33:44.246636 IP (tos 0x0, ttl 64, id 48742, offset 0, flags [DF], proto TCP (6), length 60)
    127.0.0.1.34376 > 127.0.0.1.11150: Flags [S], cksum 0xfe30 (incorrect -> 0xc1fb), seq 3461335169, win 65495, options [mss 65495,sackOK,TS val 3509023798 ecr 0,nop,wscale 7], length 0
2022-04-07 17:33:44.246648 IP (tos 0x0, ttl 64, id 0, offset 0, flags [DF], proto TCP (6), length 60)
    127.0.0.1.11150 > 127.0.0.1.34376: Flags [S.], cksum 0xfe30 (incorrect -> 0x793c), seq 107150585, ack 3461335170, win 65483, options [mss 65495,sackOK,TS val 3509023798 ecr 3509023798,nop,wscale 7], length 0
2022-04-07 17:33:44.246658 IP (tos 0x0, ttl 64, id 48743, offset 0, flags [DF], proto TCP (6), length 52)
    127.0.0.1.34376 > 127.0.0.1.11150: Flags [.], cksum 0xfe28 (incorrect -> 0x9ff8), seq 1, ack 1, win 512, options [nop,nop,TS val 3509023798 ecr 3509023798], length 0
2022-04-07 17:33:44.246784 IP (tos 0x0, ttl 64, id 48744, offset 0, flags [DF], proto TCP (6), length 55)
    127.0.0.1.34376 > 127.0.0.1.11150: Flags [P.], cksum 0xfe2b (incorrect -> 0x9aec), seq 1:4, ack 1, win 512, options [nop,nop,TS val 3509023798 ecr 3509023798], length 3
2022-04-07 17:33:44.246799 IP (tos 0x0, ttl 64, id 54136, offset 0, flags [DF], proto TCP (6), length 52)
    127.0.0.1.11150 > 127.0.0.1.34376: Flags [.], cksum 0xfe28 (incorrect -> 0x9ff5), seq 1, ack 4, win 512, options [nop,nop,TS val 3509023798 ecr 3509023798], length 0
2022-04-07 17:33:44.246831 IP (tos 0x0, ttl 64, id 54137, offset 0, flags [DF], proto TCP (6), length 54)
    127.0.0.1.11150 > 127.0.0.1.34376: Flags [P.], cksum 0xfe2a (incorrect -> 0x9aeb), seq 1:3, ack 4, win 512, options [nop,nop,TS val 3509023798 ecr 3509023798], length 2
2022-04-07 17:33:44.246842 IP (tos 0x0, ttl 64, id 48745, offset 0, flags [DF], proto TCP (6), length 52)
    127.0.0.1.34376 > 127.0.0.1.11150: Flags [.], cksum 0xfe28 (incorrect -> 0x9ff3), seq 4, ack 3, win 512, options [nop,nop,TS val 3509023798 ecr 3509023798], length 0
2022-04-07 17:33:44.248378 IP (tos 0x0, ttl 64, id 48746, offset 0, flags [DF], proto TCP (6), length 62)
    127.0.0.1.34376 > 127.0.0.1.11150: Flags [P.], cksum 0xfe32 (incorrect -> 0xdc52), seq 4:14, ack 3, win 512, options [nop,nop,TS val 3509023800 ecr 3509023798], length 10
2022-04-07 17:33:44.248386 IP (tos 0x0, ttl 64, id 54138, offset 0, flags [DF], proto TCP (6), length 52)
    127.0.0.1.11150 > 127.0.0.1.34376: Flags [.], cksum 0xfe28 (incorrect -> 0x9fe5), seq 3, ack 14, win 512, options [nop,nop,TS val 3509023800 ecr 3509023800], length 0
2022-04-07 17:33:44.440312 IP (tos 0x0, ttl 64, id 54139, offset 0, flags [DF], proto TCP (6), length 62)
    127.0.0.1.11150 > 127.0.0.1.34376: Flags [P.], cksum 0xfe32 (incorrect -> 0x9a12), seq 3:13, ack 14, win 512, options [nop,nop,TS val 3509023992 ecr 3509023800], length 10
2022-04-07 17:33:44.440330 IP (tos 0x0, ttl 64, id 48747, offset 0, flags [DF], proto TCP (6), length 52)
    127.0.0.1.34376 > 127.0.0.1.11150: Flags [.], cksum 0xfe28 (incorrect -> 0x9e5b), seq 14, ack 13, win 512, options [nop,nop,TS val 3509023992 ecr 3509023992], length 0
2022-04-07 17:33:44.445916 IP (tos 0x0, ttl 64, id 48748, offset 0, flags [DF], proto TCP (6), length 569)
    127.0.0.1.34376 > 127.0.0.1.11150: Flags [P.], cksum 0x002e (incorrect -> 0xab8d), seq 14:531, ack 13, win 512, options [nop,nop,TS val 3509023997 ecr 3509023992], length 517
2022-04-07 17:33:44.445925 IP (tos 0x0, ttl 64, id 54140, offset 0, flags [DF], proto TCP (6), length 52)
    127.0.0.1.11150 > 127.0.0.1.34376: Flags [.], cksum 0xfe28 (incorrect -> 0x9c50), seq 13, ack 531, win 508, options [nop,nop,TS val 3509023997 ecr 3509023997], length 0
2022-04-07 17:33:44.619434 IP (tos 0x0, ttl 64, id 54141, offset 0, flags [DF], proto TCP (6), length 3419)
    127.0.0.1.11150 > 127.0.0.1.34376: Flags [P.], cksum 0x0b50 (incorrect -> 0xc98b), seq 13:3380, ack 531, win 512, options [nop,nop,TS val 3509024171 ecr 3509023997], length 3367
2022-04-07 17:33:44.619444 IP (tos 0x0, ttl 64, id 48749, offset 0, flags [DF], proto TCP (6), length 52)
    127.0.0.1.34376 > 127.0.0.1.11150: Flags [.], cksum 0xfe28 (incorrect -> 0x8ddb), seq 531, ack 3380, win 494, options [nop,nop,TS val 3509024171 ecr 3509024171], length 0
2022-04-07 17:33:44.623747 IP (tos 0x0, ttl 64, id 48750, offset 0, flags [DF], proto TCP (6), length 116)
    127.0.0.1.34376 > 127.0.0.1.11150: Flags [P.], cksum 0xfe68 (incorrect -> 0x4a4f), seq 531:595, ack 3380, win 512, options [nop,nop,TS val 3509024175 ecr 3509024171], length 64
2022-04-07 17:33:44.623768 IP (tos 0x0, ttl 64, id 54142, offset 0, flags [DF], proto TCP (6), length 52)
    127.0.0.1.11150 > 127.0.0.1.34376: Flags [.], cksum 0xfe28 (incorrect -> 0x8d81), seq 3380, ack 595, win 512, options [nop,nop,TS val 3509024175 ecr 3509024175], length 0
2022-04-07 17:33:44.624355 IP (tos 0x0, ttl 64, id 48751, offset 0, flags [DF], proto TCP (6), length 373)
    127.0.0.1.34376 > 127.0.0.1.11150: Flags [P.], cksum 0xff69 (incorrect -> 0x4035), seq 595:916, ack 3380, win 512, options [nop,nop,TS val 3509024176 ecr 3509024175], length 321
2022-04-07 17:33:44.624363 IP (tos 0x0, ttl 64, id 54143, offset 0, flags [DF], proto TCP (6), length 52)
    127.0.0.1.11150 > 127.0.0.1.34376: Flags [.], cksum 0xfe28 (incorrect -> 0x8c40), seq 3380, ack 916, win 510, options [nop,nop,TS val 3509024176 ecr 3509024176], length 0
2022-04-07 17:33:44.834016 IP (tos 0x0, ttl 64, id 54144, offset 0, flags [DF], proto TCP (6), length 594)
    127.0.0.1.11150 > 127.0.0.1.34376: Flags [P.], cksum 0x0047 (incorrect -> 0xbf5e), seq 3380:3922, ack 916, win 512, options [nop,nop,TS val 3509024385 ecr 3509024176], length 542
2022-04-07 17:33:44.874782 IP (tos 0x0, ttl 64, id 48752, offset 0, flags [DF], proto TCP (6), length 52)
    127.0.0.1.34376 > 127.0.0.1.11150: Flags [.], cksum 0xfe28 (incorrect -> 0x8855), seq 916, ack 3922, win 512, options [nop,nop,TS val 3509024426 ecr 3509024385], length 0
2022-04-07 17:33:44.897775 IP (tos 0x0, ttl 64, id 54145, offset 0, flags [DF], proto TCP (6), length 1486)
    127.0.0.1.11150 > 127.0.0.1.34376: Flags [P.], cksum 0x03c3 (incorrect -> 0xdf6c), seq 3922:5356, ack 916, win 512, options [nop,nop,TS val 3509024449 ecr 3509024426], length 1434
2022-04-07 17:33:44.897786 IP (tos 0x0, ttl 64, id 48753, offset 0, flags [DF], proto TCP (6), length 52)
    127.0.0.1.34376 > 127.0.0.1.11150: Flags [.], cksum 0xfe28 (incorrect -> 0x826e), seq 916, ack 5356, win 502, options [nop,nop,TS val 3509024449 ecr 3509024449], length 0
2022-04-07 17:33:44.900954 IP (tos 0x0, ttl 64, id 41583, offset 0, flags [DF], proto TCP (6), length 60)
    127.0.0.1.34378 > 127.0.0.1.11150: Flags [S], cksum 0xfe30 (incorrect -> 0x625d), seq 878952316, win 65495, options [mss 65495,sackOK,TS val 3509024452 ecr 0,nop,wscale 7], length 0
2022-04-07 17:33:44.900962 IP (tos 0x0, ttl 64, id 0, offset 0, flags [DF], proto TCP (6), length 60)
    127.0.0.1.11150 > 127.0.0.1.34378: Flags [S.], cksum 0xfe30 (incorrect -> 0x894c), seq 2409890171, ack 878952317, win 65483, options [mss 65495,sackOK,TS val 3509024452 ecr 3509024452,nop,wscale 7], length 0
2022-04-07 17:33:44.900969 IP (tos 0x0, ttl 64, id 41584, offset 0, flags [DF], proto TCP (6), length 52)
    127.0.0.1.34378 > 127.0.0.1.11150: Flags [.], cksum 0xfe28 (incorrect -> 0xb008), seq 1, ack 1, win 512, options [nop,nop,TS val 3509024452 ecr 3509024452], length 0
2022-04-07 17:33:44.901055 IP (tos 0x0, ttl 64, id 41585, offset 0, flags [DF], proto TCP (6), length 55)
    127.0.0.1.34378 > 127.0.0.1.11150: Flags [P.], cksum 0xfe2b (incorrect -> 0xaafc), seq 1:4, ack 1, win 512, options [nop,nop,TS val 3509024452 ecr 3509024452], length 3
2022-04-07 17:33:44.901060 IP (tos 0x0, ttl 64, id 40529, offset 0, flags [DF], proto TCP (6), length 52)
    127.0.0.1.11150 > 127.0.0.1.34378: Flags [.], cksum 0xfe28 (incorrect -> 0xb005), seq 1, ack 4, win 512, options [nop,nop,TS val 3509024452 ecr 3509024452], length 0
2022-04-07 17:33:44.901076 IP (tos 0x0, ttl 64, id 40530, offset 0, flags [DF], proto TCP (6), length 54)
    127.0.0.1.11150 > 127.0.0.1.34378: Flags [P.], cksum 0xfe2a (incorrect -> 0xaafb), seq 1:3, ack 4, win 512, options [nop,nop,TS val 3509024452 ecr 3509024452], length 2
2022-04-07 17:33:44.901082 IP (tos 0x0, ttl 64, id 41586, offset 0, flags [DF], proto TCP (6), length 52)
    127.0.0.1.34378 > 127.0.0.1.11150: Flags [.], cksum 0xfe28 (incorrect -> 0xb003), seq 4, ack 3, win 512, options [nop,nop,TS val 3509024452 ecr 3509024452], length 0
2022-04-07 17:33:44.921619 IP (tos 0x0, ttl 64, id 41587, offset 0, flags [DF], proto TCP (6), length 62)
    127.0.0.1.34378 > 127.0.0.1.11150: Flags [P.], cksum 0xfe32 (incorrect -> 0xec4e), seq 4:14, ack 3, win 512, options [nop,nop,TS val 3509024473 ecr 3509024452], length 10
2022-04-07 17:33:44.921633 IP (tos 0x0, ttl 64, id 40531, offset 0, flags [DF], proto TCP (6), length 52)
    127.0.0.1.11150 > 127.0.0.1.34378: Flags [.], cksum 0xfe28 (incorrect -> 0xafcf), seq 3, ack 14, win 512, options [nop,nop,TS val 3509024473 ecr 3509024473], length 0
2022-04-07 17:33:45.180306 IP (tos 0x0, ttl 64, id 40532, offset 0, flags [DF], proto TCP (6), length 62)
    127.0.0.1.11150 > 127.0.0.1.34378: Flags [P.], cksum 0xfe32 (incorrect -> 0xa9b9), seq 3:13, ack 14, win 512, options [nop,nop,TS val 3509024732 ecr 3509024473], length 10
2022-04-07 17:33:45.180318 IP (tos 0x0, ttl 64, id 41588, offset 0, flags [DF], proto TCP (6), length 52)
    127.0.0.1.34378 > 127.0.0.1.11150: Flags [.], cksum 0xfe28 (incorrect -> 0xadbf), seq 14, ack 13, win 512, options [nop,nop,TS val 3509024732 ecr 3509024732], length 0
2022-04-07 17:33:45.185380 IP (tos 0x0, ttl 64, id 41589, offset 0, flags [DF], proto TCP (6), length 569)
    127.0.0.1.34378 > 127.0.0.1.11150: Flags [P.], cksum 0x002e (incorrect -> 0x07a6), seq 14:531, ack 13, win 512, options [nop,nop,TS val 3509024737 ecr 3509024732], length 517
2022-04-07 17:33:45.185388 IP (tos 0x0, ttl 64, id 40533, offset 0, flags [DF], proto TCP (6), length 52)
    127.0.0.1.11150 > 127.0.0.1.34378: Flags [.], cksum 0xfe28 (incorrect -> 0xabb4), seq 13, ack 531, win 508, options [nop,nop,TS val 3509024737 ecr 3509024737], length 0
2022-04-07 17:33:45.355717 IP (tos 0x0, ttl 64, id 40534, offset 0, flags [DF], proto TCP (6), length 1512)
    127.0.0.1.11150 > 127.0.0.1.34378: Flags [P.], cksum 0x03dd (incorrect -> 0x251c), seq 13:1473, ack 531, win 512, options [nop,nop,TS val 3509024907 ecr 3509024737], length 1460
2022-04-07 17:33:45.355724 IP (tos 0x0, ttl 64, id 41590, offset 0, flags [DF], proto TCP (6), length 52)
    127.0.0.1.34378 > 127.0.0.1.11150: Flags [.], cksum 0xfe28 (incorrect -> 0xa4b2), seq 531, ack 1473, win 502, options [nop,nop,TS val 3509024907 ecr 3509024907], length 0
2022-04-07 17:33:45.396884 IP (tos 0x0, ttl 64, id 40535, offset 0, flags [DF], proto TCP (6), length 1960)
    127.0.0.1.11150 > 127.0.0.1.34378: Flags [P.], cksum 0x059d (incorrect -> 0x812f), seq 1473:3381, ack 531, win 512, options [nop,nop,TS val 3509024948 ecr 3509024907], length 1908
2022-04-07 17:33:45.396913 IP (tos 0x0, ttl 64, id 41591, offset 0, flags [DF], proto TCP (6), length 52)
    127.0.0.1.34378 > 127.0.0.1.11150: Flags [.], cksum 0xfe28 (incorrect -> 0x9cee), seq 531, ack 3381, win 500, options [nop,nop,TS val 3509024948 ecr 3509024948], length 0
2022-04-07 17:33:45.397326 IP (tos 0x0, ttl 64, id 41592, offset 0, flags [DF], proto TCP (6), length 116)
    127.0.0.1.34378 > 127.0.0.1.11150: Flags [P.], cksum 0xfe68 (incorrect -> 0x9036), seq 531:595, ack 3381, win 512, options [nop,nop,TS val 3509024949 ecr 3509024948], length 64
2022-04-07 17:33:45.397343 IP (tos 0x0, ttl 64, id 40536, offset 0, flags [DF], proto TCP (6), length 52)
    127.0.0.1.11150 > 127.0.0.1.34378: Flags [.], cksum 0xfe28 (incorrect -> 0x9ca0), seq 3381, ack 595, win 512, options [nop,nop,TS val 3509024949 ecr 3509024949], length 0
2022-04-07 17:33:45.397590 IP (tos 0x0, ttl 64, id 41593, offset 0, flags [DF], proto TCP (6), length 377)
    127.0.0.1.34378 > 127.0.0.1.11150: Flags [P.], cksum 0xff6d (incorrect -> 0x111b), seq 595:920, ack 3381, win 512, options [nop,nop,TS val 3509024949 ecr 3509024949], length 325
2022-04-07 17:33:45.397604 IP (tos 0x0, ttl 64, id 40537, offset 0, flags [DF], proto TCP (6), length 52)
    127.0.0.1.11150 > 127.0.0.1.34378: Flags [.], cksum 0xfe28 (incorrect -> 0x9b5d), seq 3381, ack 920, win 510, options [nop,nop,TS val 3509024949 ecr 3509024949], length 0
2022-04-07 17:33:45.567210 IP (tos 0x0, ttl 64, id 40538, offset 0, flags [DF], proto TCP (6), length 594)
    127.0.0.1.11150 > 127.0.0.1.34378: Flags [P.], cksum 0x0047 (incorrect -> 0x75d8), seq 3381:3923, ack 920, win 512, options [nop,nop,TS val 3509025118 ecr 3509024949], length 542
2022-04-07 17:33:45.567226 IP (tos 0x0, ttl 64, id 41594, offset 0, flags [DF], proto TCP (6), length 52)
    127.0.0.1.34378 > 127.0.0.1.11150: Flags [.], cksum 0xfe28 (incorrect -> 0x97ef), seq 920, ack 3923, win 508, options [nop,nop,TS val 3509025118 ecr 3509025118], length 0
2022-04-07 17:33:45.635052 IP (tos 0x0, ttl 64, id 40539, offset 0, flags [DF], proto TCP (6), length 1983)
    127.0.0.1.11150 > 127.0.0.1.34378: Flags [P.], cksum 0x05b4 (incorrect -> 0x8124), seq 3923:5854, ack 920, win 512, options [nop,nop,TS val 3509025186 ecr 3509025118], length 1931
2022-04-07 17:33:45.635059 IP (tos 0x0, ttl 64, id 41595, offset 0, flags [DF], proto TCP (6), length 52)
    127.0.0.1.34378 > 127.0.0.1.11150: Flags [.], cksum 0xfe28 (incorrect -> 0x8fe4), seq 920, ack 5854, win 500, options [nop,nop,TS val 3509025186 ecr 3509025186], length 0
2022-04-07 17:33:45.671425 IP (tos 0x0, ttl 64, id 40540, offset 0, flags [DF], proto TCP (6), length 1014)
    127.0.0.1.11150 > 127.0.0.1.34378: Flags [P.], cksum 0x01eb (incorrect -> 0x8dfe), seq 5854:6816, ack 920, win 512, options [nop,nop,TS val 3509025223 ecr 3509025186], length 962
2022-04-07 17:33:45.671432 IP (tos 0x0, ttl 64, id 41596, offset 0, flags [DF], proto TCP (6), length 52)
    127.0.0.1.34378 > 127.0.0.1.11150: Flags [.], cksum 0xfe28 (incorrect -> 0x8bd4), seq 920, ack 6816, win 504, options [nop,nop,TS val 3509025223 ecr 3509025223], length 0
2022-04-07 17:33:45.678972 IP (tos 0x0, ttl 64, id 40541, offset 0, flags [DF], proto TCP (6), length 3618)
    127.0.0.1.11150 > 127.0.0.1.34378: Flags [P.], cksum 0x0c17 (incorrect -> 0x16d7), seq 6816:10382, ack 920, win 512, options [nop,nop,TS val 3509025230 ecr 3509025223], length 3566
2022-04-07 17:33:45.678987 IP (tos 0x0, ttl 64, id 41597, offset 0, flags [DF], proto TCP (6), length 52)
    127.0.0.1.34378 > 127.0.0.1.11150: Flags [.], cksum 0xfe28 (incorrect -> 0x7de2), seq 920, ack 10382, win 494, options [nop,nop,TS val 3509025230 ecr 3509025230], length 0
2022-04-07 17:33:45.729784 IP (tos 0x0, ttl 64, id 40542, offset 0, flags [DF], proto TCP (6), length 1374)
    127.0.0.1.11150 > 127.0.0.1.34378: Flags [P.], cksum 0x0353 (incorrect -> 0xf486), seq 10382:11704, ack 920, win 512, options [nop,nop,TS val 3509025281 ecr 3509025230], length 1322
2022-04-07 17:33:45.729793 IP (tos 0x0, ttl 64, id 41598, offset 0, flags [DF], proto TCP (6), length 52)
    127.0.0.1.34378 > 127.0.0.1.11150: Flags [.], cksum 0xfe28 (incorrect -> 0x784a), seq 920, ack 11704, win 502, options [nop,nop,TS val 3509025281 ecr 3509025281], length 0
2022-04-07 17:33:45.779461 IP (tos 0x0, ttl 64, id 40543, offset 0, flags [DF], proto TCP (6), length 3538)
    127.0.0.1.11150 > 127.0.0.1.34378: Flags [P.], cksum 0x0bc7 (incorrect -> 0x683b), seq 11704:15190, ack 920, win 512, options [nop,nop,TS val 3509025331 ecr 3509025281], length 3486
2022-04-07 17:33:45.779467 IP (tos 0x0, ttl 64, id 41599, offset 0, flags [DF], proto TCP (6), length 52)
    127.0.0.1.34378 > 127.0.0.1.11150: Flags [.], cksum 0xfe28 (incorrect -> 0x6a50), seq 920, ack 15190, win 494, options [nop,nop,TS val 3509025331 ecr 3509025331], length 0
2022-04-07 17:33:45.789106 IP (tos 0x0, ttl 64, id 40544, offset 0, flags [DF], proto TCP (6), length 3538)
    127.0.0.1.11150 > 127.0.0.1.34378: Flags [P.], cksum 0x0bc7 (incorrect -> 0xb533), seq 15190:18676, ack 920, win 512, options [nop,nop,TS val 3509025340 ecr 3509025331], length 3486
2022-04-07 17:33:45.789112 IP (tos 0x0, ttl 64, id 41600, offset 0, flags [DF], proto TCP (6), length 52)
    127.0.0.1.34378 > 127.0.0.1.11150: Flags [.], cksum 0xfe28 (incorrect -> 0x5ca0), seq 920, ack 18676, win 494, options [nop,nop,TS val 3509025340 ecr 3509025340], length 0
2022-04-07 17:33:45.789185 IP (tos 0x0, ttl 64, id 40545, offset 0, flags [DF], proto TCP (6), length 1048)
    127.0.0.1.11150 > 127.0.0.1.34378: Flags [P.], cksum 0x020d (incorrect -> 0x6733), seq 18676:19672, ack 920, win 512, options [nop,nop,TS val 3509025340 ecr 3509025340], length 996
2022-04-07 17:33:45.789191 IP (tos 0x0, ttl 64, id 41601, offset 0, flags [DF], proto TCP (6), length 52)
    127.0.0.1.34378 > 127.0.0.1.11150: Flags [.], cksum 0xfe28 (incorrect -> 0x58b2), seq 920, ack 19672, win 504, options [nop,nop,TS val 3509025340 ecr 3509025340], length 0
2022-04-07 17:33:45.813642 IP (tos 0x0, ttl 64, id 40546, offset 0, flags [DF], proto TCP (6), length 3332)
    127.0.0.1.11150 > 127.0.0.1.34378: Flags [P.], cksum 0x0af9 (incorrect -> 0x321a), seq 19672:22952, ack 920, win 512, options [nop,nop,TS val 3509025365 ecr 3509025340], length 3280
2022-04-07 17:33:45.813648 IP (tos 0x0, ttl 64, id 41602, offset 0, flags [DF], proto TCP (6), length 52)
    127.0.0.1.34378 > 127.0.0.1.11150: Flags [.], cksum 0xfe28 (incorrect -> 0x4bb9), seq 920, ack 22952, win 495, options [nop,nop,TS val 3509025365 ecr 3509025365], length 0
2022-04-07 17:33:45.819992 IP (tos 0x0, ttl 64, id 40547, offset 0, flags [DF], proto TCP (6), length 4100)
    127.0.0.1.11150 > 127.0.0.1.34378: Flags [P.], cksum 0x0df9 (incorrect -> 0xd8a7), seq 22952:27000, ack 920, win 512, options [nop,nop,TS val 3509025371 ecr 3509025365], length 4048
2022-04-07 17:33:45.819999 IP (tos 0x0, ttl 64, id 41603, offset 0, flags [DF], proto TCP (6), length 52)
    127.0.0.1.34378 > 127.0.0.1.11150: Flags [.], cksum 0xfe28 (incorrect -> 0x3be0), seq 920, ack 27000, win 492, options [nop,nop,TS val 3509025371 ecr 3509025371], length 0
2022-04-07 17:33:45.820004 IP (tos 0x0, ttl 64, id 40548, offset 0, flags [DF], proto TCP (6), length 486)
    127.0.0.1.11150 > 127.0.0.1.34378: Flags [P.], cksum 0xffda (incorrect -> 0x2dbe), seq 27000:27434, ack 920, win 512, options [nop,nop,TS val 3509025371 ecr 3509025371], length 434
2022-04-07 17:33:45.820166 IP (tos 0x0, ttl 64, id 41604, offset 0, flags [DF], proto TCP (6), length 52)
    127.0.0.1.34378 > 127.0.0.1.11150: Flags [.], cksum 0xfe28 (incorrect -> 0x3a1a), seq 920, ack 27434, win 512, options [nop,nop,TS val 3509025371 ecr 3509025371], length 0
2022-04-07 17:33:45.826300 IP (tos 0x0, ttl 64, id 40549, offset 0, flags [DF], proto TCP (6), length 3368)
    127.0.0.1.11150 > 127.0.0.1.34378: Flags [P.], cksum 0x0b1d (incorrect -> 0x5936), seq 27434:30750, ack 920, win 512, options [nop,nop,TS val 3509025378 ecr 3509025371], length 3316
2022-04-07 17:33:45.826331 IP (tos 0x0, ttl 64, id 41605, offset 0, flags [DF], proto TCP (6), length 52)
    127.0.0.1.34378 > 127.0.0.1.11150: Flags [.], cksum 0xfe28 (incorrect -> 0x2d18), seq 920, ack 30750, win 512, options [nop,nop,TS val 3509025378 ecr 3509025378], length 0
2022-04-07 17:33:45.849467 IP (tos 0x0, ttl 64, id 40550, offset 0, flags [DF], proto TCP (6), length 1048)
    127.0.0.1.11150 > 127.0.0.1.34378: Flags [P.], cksum 0x020d (incorrect -> 0x678f), seq 30750:31746, ack 920, win 512, options [nop,nop,TS val 3509025401 ecr 3509025378], length 996
2022-04-07 17:33:45.849496 IP (tos 0x0, ttl 64, id 41606, offset 0, flags [DF], proto TCP (6), length 52)
    127.0.0.1.34378 > 127.0.0.1.11150: Flags [.], cksum 0xfe28 (incorrect -> 0x2906), seq 920, ack 31746, win 512, options [nop,nop,TS val 3509025401 ecr 3509025401], length 0
2022-04-07 17:33:45.856702 IP (tos 0x0, ttl 64, id 40551, offset 0, flags [DF], proto TCP (6), length 3900)
    127.0.0.1.11150 > 127.0.0.1.34378: Flags [P.], cksum 0x0d31 (incorrect -> 0x4b80), seq 31746:35594, ack 920, win 512, options [nop,nop,TS val 3509025408 ecr 3509025401], length 3848
2022-04-07 17:33:45.856988 IP (tos 0x0, ttl 64, id 41607, offset 0, flags [DF], proto TCP (6), length 52)
    127.0.0.1.34378 > 127.0.0.1.11150: Flags [.], cksum 0xfe28 (incorrect -> 0x19f0), seq 920, ack 35594, win 512, options [nop,nop,TS val 3509025408 ecr 3509025408], length 0
2022-04-07 17:33:45.861130 IP (tos 0x0, ttl 64, id 40552, offset 0, flags [DF], proto TCP (6), length 2474)
    127.0.0.1.11150 > 127.0.0.1.34378: Flags [P.], cksum 0x079f (incorrect -> 0x9943), seq 35594:38016, ack 920, win 512, options [nop,nop,TS val 3509025412 ecr 3509025408], length 2422
2022-04-07 17:33:45.861182 IP (tos 0x0, ttl 64, id 41608, offset 0, flags [DF], proto TCP (6), length 52)
    127.0.0.1.34378 > 127.0.0.1.11150: Flags [.], cksum 0xfe28 (incorrect -> 0x1072), seq 920, ack 38016, win 512, options [nop,nop,TS val 3509025412 ecr 3509025412], length 0
2022-04-07 17:33:45.882251 IP (tos 0x0, ttl 64, id 40553, offset 0, flags [DF], proto TCP (6), length 1546)
    127.0.0.1.11150 > 127.0.0.1.34378: Flags [P.], cksum 0x03ff (incorrect -> 0x5a89), seq 38016:39510, ack 920, win 512, options [nop,nop,TS val 3509025434 ecr 3509025412], length 1494
2022-04-07 17:33:45.882283 IP (tos 0x0, ttl 64, id 41609, offset 0, flags [DF], proto TCP (6), length 52)
    127.0.0.1.34378 > 127.0.0.1.11150: Flags [.], cksum 0xfe28 (incorrect -> 0x0a70), seq 920, ack 39510, win 512, options [nop,nop,TS val 3509025434 ecr 3509025434], length 0
2022-04-07 17:33:45.885262 IP (tos 0x0, ttl 64, id 40554, offset 0, flags [DF], proto TCP (6), length 2542)
    127.0.0.1.11150 > 127.0.0.1.34378: Flags [P.], cksum 0x07e3 (incorrect -> 0x263c), seq 39510:42000, ack 920, win 512, options [nop,nop,TS val 3509025437 ecr 3509025434], length 2490
2022-04-07 17:33:45.885289 IP (tos 0x0, ttl 64, id 41610, offset 0, flags [DF], proto TCP (6), length 52)
    127.0.0.1.34378 > 127.0.0.1.11150: Flags [.], cksum 0xfe28 (incorrect -> 0x00b0), seq 920, ack 42000, win 512, options [nop,nop,TS val 3509025437 ecr 3509025437], length 0
2022-04-07 17:33:45.892159 IP (tos 0x0, ttl 64, id 40555, offset 0, flags [DF], proto TCP (6), length 1546)
    127.0.0.1.11150 > 127.0.0.1.34378: Flags [P.], cksum 0x03ff (incorrect -> 0xd424), seq 42000:43494, ack 920, win 512, options [nop,nop,TS val 3509025443 ecr 3509025437], length 1494
2022-04-07 17:33:45.892188 IP (tos 0x0, ttl 64, id 41611, offset 0, flags [DF], proto TCP (6), length 52)
    127.0.0.1.34378 > 127.0.0.1.11150: Flags [.], cksum 0xfe28 (incorrect -> 0xfacd), seq 920, ack 43494, win 512, options [nop,nop,TS val 3509025443 ecr 3509025443], length 0
2022-04-07 17:33:45.910597 IP (tos 0x0, ttl 64, id 40556, offset 0, flags [DF], proto TCP (6), length 3538)
    127.0.0.1.11150 > 127.0.0.1.34378: Flags [P.], cksum 0x0bc7 (incorrect -> 0x47cf), seq 43494:46980, ack 920, win 512, options [nop,nop,TS val 3509025462 ecr 3509025443], length 3486
2022-04-07 17:33:45.910822 IP (tos 0x0, ttl 64, id 41612, offset 0, flags [DF], proto TCP (6), length 52)
    127.0.0.1.34378 > 127.0.0.1.11150: Flags [.], cksum 0xfe28 (incorrect -> 0xed09), seq 920, ack 46980, win 512, options [nop,nop,TS val 3509025462 ecr 3509025462], length 0
2022-04-07 17:33:45.918235 IP (tos 0x0, ttl 64, id 40557, offset 0, flags [DF], proto TCP (6), length 4100)
    127.0.0.1.11150 > 127.0.0.1.34378: Flags [P.], cksum 0x0df9 (incorrect -> 0xf9ea), seq 46980:51028, ack 920, win 512, options [nop,nop,TS val 3509025470 ecr 3509025462], length 4048
2022-04-07 17:33:45.958783 IP (tos 0x0, ttl 64, id 41613, offset 0, flags [DF], proto TCP (6), length 52)
    127.0.0.1.34378 > 127.0.0.1.11150: Flags [.], cksum 0xfe28 (incorrect -> 0xdd01), seq 920, ack 51028, win 512, options [nop,nop,TS val 3509025510 ecr 3509025470], length 0
2022-04-07 17:33:45.958792 IP (tos 0x0, ttl 64, id 40558, offset 0, flags [DF], proto TCP (6), length 10672)
    127.0.0.1.11150 > 127.0.0.1.34378: Flags [P.], cksum 0x27a5 (incorrect -> 0xd43a), seq 51028:61648, ack 920, win 512, options [nop,nop,TS val 3509025510 ecr 3509025510], length 10620
2022-04-07 17:33:46.002784 IP (tos 0x0, ttl 64, id 41614, offset 0, flags [DF], proto TCP (6), length 52)
    127.0.0.1.34378 > 127.0.0.1.11150: Flags [.], cksum 0xfe28 (incorrect -> 0xb331), seq 920, ack 61648, win 512, options [nop,nop,TS val 3509025554 ecr 3509025510], length 0
2022-04-07 17:33:46.002791 IP (tos 0x0, ttl 64, id 40559, offset 0, flags [DF], proto TCP (6), length 12026)
    127.0.0.1.11150 > 127.0.0.1.34378: Flags [P.], cksum 0x2cef (incorrect -> 0xeac0), seq 61648:73622, ack 920, win 512, options [nop,nop,TS val 3509025554 ecr 3509025554], length 11974
2022-04-07 17:33:46.046780 IP (tos 0x0, ttl 64, id 41615, offset 0, flags [DF], proto TCP (6), length 52)
    127.0.0.1.34378 > 127.0.0.1.11150: Flags [.], cksum 0xfe28 (incorrect -> 0x8413), seq 920, ack 73622, win 512, options [nop,nop,TS val 3509025598 ecr 3509025554], length 0
2022-04-07 17:33:46.046792 IP (tos 0x0, ttl 64, id 40560, offset 0, flags [DF], proto TCP (6), length 16576)
    127.0.0.1.11150 > 127.0.0.1.34378: Flags [P.], cksum 0x3eb5 (incorrect -> 0x6fa1), seq 73622:90146, ack 920, win 512, options [nop,nop,TS val 3509025598 ecr 3509025598], length 16524
2022-04-07 17:33:46.090775 IP (tos 0x0, ttl 64, id 41616, offset 0, flags [DF], proto TCP (6), length 52)
    127.0.0.1.34378 > 127.0.0.1.11150: Flags [.], cksum 0xfe28 (incorrect -> 0x432f), seq 920, ack 90146, win 512, options [nop,nop,TS val 3509025642 ecr 3509025598], length 0
2022-04-07 17:33:46.090785 IP (tos 0x0, ttl 64, id 40561, offset 0, flags [DF], proto TCP (6), length 18500)
    127.0.0.1.11150 > 127.0.0.1.34378: Flags [P.], cksum 0x4639 (incorrect -> 0x5719), seq 90146:108594, ack 920, win 512, options [nop,nop,TS val 3509025642 ecr 3509025642], length 18448
2022-04-07 17:33:46.134780 IP (tos 0x0, ttl 64, id 41617, offset 0, flags [DF], proto TCP (6), length 52)
    127.0.0.1.34378 > 127.0.0.1.11150: Flags [.], cksum 0xfe28 (incorrect -> 0xfac6), seq 920, ack 108594, win 512, options [nop,nop,TS val 3509025686 ecr 3509025642], length 0
2022-04-07 17:33:46.134787 IP (tos 0x0, ttl 64, id 40562, offset 0, flags [DF], proto TCP (6), length 15218)
    127.0.0.1.11150 > 127.0.0.1.34378: Flags [P.], cksum 0x3967 (incorrect -> 0xa2c1), seq 108594:123760, ack 920, win 512, options [nop,nop,TS val 3509025686 ecr 3509025686], length 15166
2022-04-07 17:33:46.135023 IP (tos 0x0, ttl 64, id 41618, offset 0, flags [DF], proto TCP (6), length 52)
    127.0.0.1.34378 > 127.0.0.1.11150: Flags [.], cksum 0xfe28 (incorrect -> 0xbf5c), seq 920, ack 123760, win 512, options [nop,nop,TS val 3509025686 ecr 3509025686], length 0
2022-04-07 17:33:46.146546 IP (tos 0x0, ttl 64, id 40563, offset 0, flags [DF], proto TCP (6), length 2406)
    127.0.0.1.11150 > 127.0.0.1.34378: Flags [P.], cksum 0x075b (incorrect -> 0x2ffb), seq 123760:126114, ack 920, win 512, options [nop,nop,TS val 3509025698 ecr 3509025686], length 2354
2022-04-07 17:33:46.146573 IP (tos 0x0, ttl 64, id 41619, offset 0, flags [DF], proto TCP (6), length 52)
    127.0.0.1.34378 > 127.0.0.1.11150: Flags [.], cksum 0xfe28 (incorrect -> 0xb612), seq 920, ack 126114, win 512, options [nop,nop,TS val 3509025698 ecr 3509025698], length 0
200, 7.259443521499634, 1.981445074081421