2022-04-07 02:07:30.885974 IP (tos 0x0, ttl 64, id 3003, offset 0, flags [DF], proto TCP (6), length 60)
    127.0.0.1.47112 > 127.0.0.1.9150: Flags [S], cksum 0xfe30 (incorrect -> 0x1a09), seq 1596501022, win 65495, options [mss 65495,sackOK,TS val 379533388 ecr 0,nop,wscale 7], length 0
2022-04-07 02:07:30.885989 IP (tos 0x0, ttl 64, id 0, offset 0, flags [DF], proto TCP (6), length 60)
    127.0.0.1.9150 > 127.0.0.1.47112: Flags [S.], cksum 0xfe30 (incorrect -> 0xdedb), seq 2891857886, ack 1596501023, win 65483, options [mss 65495,sackOK,TS val 379533388 ecr 379533388,nop,wscale 7], length 0
2022-04-07 02:07:30.886000 IP (tos 0x0, ttl 64, id 3004, offset 0, flags [DF], proto TCP (6), length 52)
    127.0.0.1.47112 > 127.0.0.1.9150: Flags [.], cksum 0xfe28 (incorrect -> 0x0598), seq 1, ack 1, win 512, options [nop,nop,TS val 379533388 ecr 379533388], length 0
2022-04-07 02:07:30.886162 IP (tos 0x0, ttl 64, id 3005, offset 0, flags [DF], proto TCP (6), length 55)
    127.0.0.1.47112 > 127.0.0.1.9150: Flags [P.], cksum 0xfe2b (incorrect -> 0x008b), seq 1:4, ack 1, win 512, options [nop,nop,TS val 379533389 ecr 379533388], length 3
2022-04-07 02:07:30.886170 IP (tos 0x0, ttl 64, id 36924, offset 0, flags [DF], proto TCP (6), length 52)
    127.0.0.1.9150 > 127.0.0.1.47112: Flags [.], cksum 0xfe28 (incorrect -> 0x0593), seq 1, ack 4, win 512, options [nop,nop,TS val 379533389 ecr 379533389], length 0
2022-04-07 02:07:30.886196 IP (tos 0x0, ttl 64, id 36925, offset 0, flags [DF], proto TCP (6), length 54)
    127.0.0.1.9150 > 127.0.0.1.47112: Flags [P.], cksum 0xfe2a (incorrect -> 0x0089), seq 1:3, ack 4, win 512, options [nop,nop,TS val 379533389 ecr 379533389], length 2
2022-04-07 02:07:30.886203 IP (tos 0x0, ttl 64, id 3006, offset 0, flags [DF], proto TCP (6), length 52)
    127.0.0.1.47112 > 127.0.0.1.9150: Flags [.], cksum 0xfe28 (incorrect -> 0x0591), seq 4, ack 3, win 512, options [nop,nop,TS val 379533389 ecr 379533389], length 0
2022-04-07 02:07:30.887405 IP (tos 0x0, ttl 64, id 3007, offset 0, flags [DF], proto TCP (6), length 62)
    127.0.0.1.47112 > 127.0.0.1.9150: Flags [P.], cksum 0xfe32 (incorrect -> 0x6b8b), seq 4:14, ack 3, win 512, options [nop,nop,TS val 379533390 ecr 379533389], length 10
2022-04-07 02:07:30.887422 IP (tos 0x0, ttl 64, id 36926, offset 0, flags [DF], proto TCP (6), length 52)
    127.0.0.1.9150 > 127.0.0.1.47112: Flags [.], cksum 0xfe28 (incorrect -> 0x0585), seq 3, ack 14, win 512, options [nop,nop,TS val 379533390 ecr 379533390], length 0
2022-04-07 02:07:30.937962 IP (tos 0x0, ttl 64, id 36927, offset 0, flags [DF], proto TCP (6), length 62)
    127.0.0.1.9150 > 127.0.0.1.47112: Flags [P.], cksum 0xfe32 (incorrect -> 0x0040), seq 3:13, ack 14, win 512, options [nop,nop,TS val 379533440 ecr 379533390], length 10
2022-04-07 02:07:30.937972 IP (tos 0x0, ttl 64, id 3008, offset 0, flags [DF], proto TCP (6), length 52)
    127.0.0.1.47112 > 127.0.0.1.9150: Flags [.], cksum 0xfe28 (incorrect -> 0x0517), seq 14, ack 13, win 512, options [nop,nop,TS val 379533440 ecr 379533440], length 0
2022-04-07 02:07:30.943537 IP (tos 0x0, ttl 64, id 3009, offset 0, flags [DF], proto TCP (6), length 569)
    127.0.0.1.47112 > 127.0.0.1.9150: Flags [P.], cksum 0x002e (incorrect -> 0xde78), seq 14:531, ack 13, win 512, options [nop,nop,TS val 379533446 ecr 379533440], length 517
2022-04-07 02:07:30.943545 IP (tos 0x0, ttl 64, id 36928, offset 0, flags [DF], proto TCP (6), length 52)
    127.0.0.1.9150 > 127.0.0.1.47112: Flags [.], cksum 0xfe28 (incorrect -> 0x030a), seq 13, ack 531, win 508, options [nop,nop,TS val 379533446 ecr 379533446], length 0
2022-04-07 02:07:30.993252 IP (tos 0x0, ttl 64, id 36929, offset 0, flags [DF], proto TCP (6), length 2803)
    127.0.0.1.9150 > 127.0.0.1.47112: Flags [P.], cksum 0x08e8 (incorrect -> 0xbfb0), seq 13:2764, ack 531, win 512, options [nop,nop,TS val 379533496 ecr 379533446], length 2751
2022-04-07 02:07:30.993260 IP (tos 0x0, ttl 64, id 3010, offset 0, flags [DF], proto TCP (6), length 52)
    127.0.0.1.47112 > 127.0.0.1.9150: Flags [.], cksum 0xfe28 (incorrect -> 0xf7f1), seq 531, ack 2764, win 497, options [nop,nop,TS val 379533496 ecr 379533496], length 0
2022-04-07 02:07:30.994547 IP (tos 0x0, ttl 64, id 3011, offset 0, flags [DF], proto TCP (6), length 132)
    127.0.0.1.47112 > 127.0.0.1.9150: Flags [P.], cksum 0xfe78 (incorrect -> 0x2698), seq 531:611, ack 2764, win 512, options [nop,nop,TS val 379533497 ecr 379533496], length 80
2022-04-07 02:07:30.994554 IP (tos 0x0, ttl 64, id 36930, offset 0, flags [DF], proto TCP (6), length 52)
    127.0.0.1.9150 > 127.0.0.1.47112: Flags [.], cksum 0xfe28 (incorrect -> 0xf790), seq 2764, ack 611, win 512, options [nop,nop,TS val 379533497 ecr 379533497], length 0
2022-04-07 02:07:30.994854 IP (tos 0x0, ttl 64, id 3012, offset 0, flags [DF], proto TCP (6), length 348)
    127.0.0.1.47112 > 127.0.0.1.9150: Flags [P.], cksum 0xff50 (incorrect -> 0x9aab), seq 611:907, ack 2764, win 512, options [nop,nop,TS val 379533497 ecr 379533497], length 296
2022-04-07 02:07:30.994861 IP (tos 0x0, ttl 64, id 36931, offset 0, flags [DF], proto TCP (6), length 52)
    127.0.0.1.9150 > 127.0.0.1.47112: Flags [.], cksum 0xfe28 (incorrect -> 0xf66a), seq 2764, ack 907, win 510, options [nop,nop,TS val 379533497 ecr 379533497], length 0
200, 7.470893144607544, 0.8176908493041992