2022-04-07 15:59:59.002055 IP (tos 0x0, ttl 64, id 19197, offset 0, flags [DF], proto TCP (6), length 60)
    127.0.0.1.47670 > 127.0.0.1.10050: Flags [S], cksum 0xfe30 (incorrect -> 0xd744), seq 2282725321, win 65495, options [mss 65495,sackOK,TS val 3503398553 ecr 0,nop,wscale 7], length 0
2022-04-07 15:59:59.002063 IP (tos 0x0, ttl 64, id 0, offset 0, flags [DF], proto TCP (6), length 60)
    127.0.0.1.10050 > 127.0.0.1.47670: Flags [S.], cksum 0xfe30 (incorrect -> 0x2d3d), seq 495328529, ack 2282725322, win 65483, options [mss 65495,sackOK,TS val 3503398553 ecr 3503398553,nop,wscale 7], length 0
2022-04-07 15:59:59.002071 IP (tos 0x0, ttl 64, id 19198, offset 0, flags [DF], proto TCP (6), length 52)
    127.0.0.1.47670 > 127.0.0.1.10050: Flags [.], cksum 0xfe28 (incorrect -> 0x53f9), seq 1, ack 1, win 512, options [nop,nop,TS val 3503398553 ecr 3503398553], length 0
2022-04-07 15:59:59.002159 IP (tos 0x0, ttl 64, id 19199, offset 0, flags [DF], proto TCP (6), length 55)
    127.0.0.1.47670 > 127.0.0.1.10050: Flags [P.], cksum 0xfe2b (incorrect -> 0x4eed), seq 1:4, ack 1, win 512, options [nop,nop,TS val 3503398553 ecr 3503398553], length 3
2022-04-07 15:59:59.002171 IP (tos 0x0, ttl 64, id 50146, offset 0, flags [DF], proto TCP (6), length 52)
    127.0.0.1.10050 > 127.0.0.1.47670: Flags [.], cksum 0xfe28 (incorrect -> 0x53f6), seq 1, ack 4, win 512, options [nop,nop,TS val 3503398553 ecr 3503398553], length 0
2022-04-07 15:59:59.002233 IP (tos 0x0, ttl 64, id 50147, offset 0, flags [DF], proto TCP (6), length 54)
    127.0.0.1.10050 > 127.0.0.1.47670: Flags [P.], cksum 0xfe2a (incorrect -> 0x4eec), seq 1:3, ack 4, win 512, options [nop,nop,TS val 3503398553 ecr 3503398553], length 2
2022-04-07 15:59:59.002253 IP (tos 0x0, ttl 64, id 19200, offset 0, flags [DF], proto TCP (6), length 52)
    127.0.0.1.47670 > 127.0.0.1.10050: Flags [.], cksum 0xfe28 (incorrect -> 0x53f3), seq 4, ack 3, win 512, options [nop,nop,TS val 3503398554 ecr 3503398553], length 0
2022-04-07 15:59:59.305843 IP (tos 0x0, ttl 64, id 19201, offset 0, flags [DF], proto TCP (6), length 62)
    127.0.0.1.47670 > 127.0.0.1.10050: Flags [P.], cksum 0xfe32 (incorrect -> 0x9eec), seq 4:14, ack 3, win 512, options [nop,nop,TS val 3503398857 ecr 3503398553], length 10
2022-04-07 15:59:59.305868 IP (tos 0x0, ttl 64, id 50148, offset 0, flags [DF], proto TCP (6), length 52)
    127.0.0.1.10050 > 127.0.0.1.47670: Flags [.], cksum 0xfe28 (incorrect -> 0x518a), seq 3, ack 14, win 512, options [nop,nop,TS val 3503398857 ecr 3503398857], length 0
2022-04-07 15:59:59.463729 IP (tos 0x0, ttl 64, id 50149, offset 0, flags [DF], proto TCP (6), length 62)
    127.0.0.1.10050 > 127.0.0.1.47670: Flags [P.], cksum 0xfe32 (incorrect -> 0x4bd9), seq 3:13, ack 14, win 512, options [nop,nop,TS val 3503399015 ecr 3503398857], length 10
2022-04-07 15:59:59.463748 IP (tos 0x0, ttl 64, id 19202, offset 0, flags [DF], proto TCP (6), length 52)
    127.0.0.1.47670 > 127.0.0.1.10050: Flags [.], cksum 0xfe28 (incorrect -> 0x5044), seq 14, ack 13, win 512, options [nop,nop,TS val 3503399015 ecr 3503399015], length 0
2022-04-07 15:59:59.469759 IP (tos 0x0, ttl 64, id 19203, offset 0, flags [DF], proto TCP (6), length 569)
    127.0.0.1.47670 > 127.0.0.1.10050: Flags [P.], cksum 0x002e (incorrect -> 0x9170), seq 14:531, ack 13, win 512, options [nop,nop,TS val 3503399021 ecr 3503399015], length 517
2022-04-07 15:59:59.469770 IP (tos 0x0, ttl 64, id 50150, offset 0, flags [DF], proto TCP (6), length 52)
    127.0.0.1.10050 > 127.0.0.1.47670: Flags [.], cksum 0xfe28 (incorrect -> 0x4e37), seq 13, ack 531, win 508, options [nop,nop,TS val 3503399021 ecr 3503399021], length 0
2022-04-07 15:59:59.627397 IP (tos 0x0, ttl 64, id 50151, offset 0, flags [DF], proto TCP (6), length 1512)
    127.0.0.1.10050 > 127.0.0.1.47670: Flags [P.], cksum 0x03dd (incorrect -> 0x2b0a), seq 13:1473, ack 531, win 512, options [nop,nop,TS val 3503399179 ecr 3503399021], length 1460
2022-04-07 15:59:59.627408 IP (tos 0x0, ttl 64, id 19204, offset 0, flags [DF], proto TCP (6), length 52)
    127.0.0.1.47670 > 127.0.0.1.10050: Flags [.], cksum 0xfe28 (incorrect -> 0x474d), seq 531, ack 1473, win 502, options [nop,nop,TS val 3503399179 ecr 3503399179], length 0
2022-04-07 15:59:59.750411 IP (tos 0x0, ttl 64, id 50152, offset 0, flags [DF], proto TCP (6), length 1512)
    127.0.0.1.10050 > 127.0.0.1.47670: Flags [P.], cksum 0x03dd (incorrect -> 0xa3aa), seq 1473:2933, ack 531, win 512, options [nop,nop,TS val 3503399302 ecr 3503399179], length 1460
2022-04-07 15:59:59.750422 IP (tos 0x0, ttl 64, id 19205, offset 0, flags [DF], proto TCP (6), length 52)
    127.0.0.1.47670 > 127.0.0.1.10050: Flags [.], cksum 0xfe28 (incorrect -> 0x40a3), seq 531, ack 2933, win 502, options [nop,nop,TS val 3503399302 ecr 3503399302], length 0
2022-04-07 16:00:00.738010 IP (tos 0x0, ttl 64, id 50153, offset 0, flags [DF], proto TCP (6), length 3098)
    127.0.0.1.10050 > 127.0.0.1.47670: Flags [P.], cksum 0x0a0f (incorrect -> 0x09bd), seq 2933:5979, ack 531, win 512, options [nop,nop,TS val 3503400289 ecr 3503399302], length 3046
2022-04-07 16:00:00.738020 IP (tos 0x0, ttl 64, id 19206, offset 0, flags [DF], proto TCP (6), length 52)
    127.0.0.1.47670 > 127.0.0.1.10050: Flags [.], cksum 0xfe28 (incorrect -> 0x2d0d), seq 531, ack 5979, win 496, options [nop,nop,TS val 3503400289 ecr 3503400289], length 0
2022-04-07 16:00:00.738500 IP (tos 0x0, ttl 64, id 19207, offset 0, flags [DF], proto TCP (6), length 132)
    127.0.0.1.47670 > 127.0.0.1.10050: Flags [P.], cksum 0xfe78 (incorrect -> 0x64e7), seq 531:611, ack 5979, win 512, options [nop,nop,TS val 3503400290 ecr 3503400289], length 80
2022-04-07 16:00:00.738509 IP (tos 0x0, ttl 64, id 50154, offset 0, flags [DF], proto TCP (6), length 52)
    127.0.0.1.10050 > 127.0.0.1.47670: Flags [.], cksum 0xfe28 (incorrect -> 0x2cab), seq 5979, ack 611, win 512, options [nop,nop,TS val 3503400290 ecr 3503400290], length 0
2022-04-07 16:00:00.738888 IP (tos 0x0, ttl 64, id 19208, offset 0, flags [DF], proto TCP (6), length 352)
    127.0.0.1.47670 > 127.0.0.1.10050: Flags [P.], cksum 0xff54 (incorrect -> 0xd9f6), seq 611:911, ack 5979, win 512, options [nop,nop,TS val 3503400290 ecr 3503400290], length 300
2022-04-07 16:00:00.738895 IP (tos 0x0, ttl 64, id 50155, offset 0, flags [DF], proto TCP (6), length 52)
    127.0.0.1.10050 > 127.0.0.1.47670: Flags [.], cksum 0xfe28 (incorrect -> 0x2b81), seq 5979, ack 911, win 510, options [nop,nop,TS val 3503400290 ecr 3503400290], length 0
2022-04-07 16:00:00.917839 IP (tos 0x0, ttl 64, id 50156, offset 0, flags [DF], proto TCP (6), length 626)
    127.0.0.1.10050 > 127.0.0.1.47670: Flags [P.], cksum 0x0067 (incorrect -> 0x0419), seq 5979:6553, ack 911, win 512, options [nop,nop,TS val 3503400469 ecr 3503400290], length 574
2022-04-07 16:00:00.917861 IP (tos 0x0, ttl 64, id 19209, offset 0, flags [DF], proto TCP (6), length 52)
    127.0.0.1.47670 > 127.0.0.1.10050: Flags [.], cksum 0xfe28 (incorrect -> 0x27df), seq 911, ack 6553, win 508, options [nop,nop,TS val 3503400469 ecr 3503400469], length 0
2022-04-07 16:00:00.964858 IP (tos 0x0, ttl 64, id 50157, offset 0, flags [DF], proto TCP (6), length 435)
    127.0.0.1.10050 > 127.0.0.1.47670: Flags [P.], cksum 0xffa7 (incorrect -> 0x1bf3), seq 6553:6936, ack 911, win 512, options [nop,nop,TS val 3503400516 ecr 3503400469], length 383
2022-04-07 16:00:00.964867 IP (tos 0x0, ttl 64, id 19210, offset 0, flags [DF], proto TCP (6), length 52)
    127.0.0.1.47670 > 127.0.0.1.10050: Flags [.], cksum 0xfe28 (incorrect -> 0x2604), seq 911, ack 6936, win 506, options [nop,nop,TS val 3503400516 ecr 3503400516], length 0
2022-04-07 16:00:00.967228 IP (tos 0x0, ttl 64, id 11771, offset 0, flags [DF], proto TCP (6), length 60)
    127.0.0.1.47672 > 127.0.0.1.10050: Flags [S], cksum 0xfe30 (incorrect -> 0xc392), seq 1528355010, win 65495, options [mss 65495,sackOK,TS val 3503400519 ecr 0,nop,wscale 7], length 0
2022-04-07 16:00:00.967241 IP (tos 0x0, ttl 64, id 0, offset 0, flags [DF], proto TCP (6), length 60)
    127.0.0.1.10050 > 127.0.0.1.47672: Flags [S.], cksum 0xfe30 (incorrect -> 0x4f01), seq 1766691877, ack 1528355011, win 65483, options [mss 65495,sackOK,TS val 3503400519 ecr 3503400519,nop,wscale 7], length 0
2022-04-07 16:00:00.967251 IP (tos 0x0, ttl 64, id 11772, offset 0, flags [DF], proto TCP (6), length 52)
    127.0.0.1.47672 > 127.0.0.1.10050: Flags [.], cksum 0xfe28 (incorrect -> 0x75bd), seq 1, ack 1, win 512, options [nop,nop,TS val 3503400519 ecr 3503400519], length 0
2022-04-07 16:00:00.967313 IP (tos 0x0, ttl 64, id 11773, offset 0, flags [DF], proto TCP (6), length 55)
    127.0.0.1.47672 > 127.0.0.1.10050: Flags [P.], cksum 0xfe2b (incorrect -> 0x70b1), seq 1:4, ack 1, win 512, options [nop,nop,TS val 3503400519 ecr 3503400519], length 3
2022-04-07 16:00:00.967317 IP (tos 0x0, ttl 64, id 23339, offset 0, flags [DF], proto TCP (6), length 52)
    127.0.0.1.10050 > 127.0.0.1.47672: Flags [.], cksum 0xfe28 (incorrect -> 0x75ba), seq 1, ack 4, win 512, options [nop,nop,TS val 3503400519 ecr 3503400519], length 0
2022-04-07 16:00:00.967372 IP (tos 0x0, ttl 64, id 23340, offset 0, flags [DF], proto TCP (6), length 54)
    127.0.0.1.10050 > 127.0.0.1.47672: Flags [P.], cksum 0xfe2a (incorrect -> 0x70b0), seq 1:3, ack 4, win 512, options [nop,nop,TS val 3503400519 ecr 3503400519], length 2
2022-04-07 16:00:00.967378 IP (tos 0x0, ttl 64, id 11774, offset 0, flags [DF], proto TCP (6), length 52)
    127.0.0.1.47672 > 127.0.0.1.10050: Flags [.], cksum 0xfe28 (incorrect -> 0x75b8), seq 4, ack 3, win 512, options [nop,nop,TS val 3503400519 ecr 3503400519], length 0
2022-04-07 16:00:00.968357 IP (tos 0x0, ttl 64, id 11775, offset 0, flags [DF], proto TCP (6), length 62)
    127.0.0.1.47672 > 127.0.0.1.10050: Flags [P.], cksum 0xfe32 (incorrect -> 0xc1df), seq 4:14, ack 3, win 512, options [nop,nop,TS val 3503400520 ecr 3503400519], length 10
2022-04-07 16:00:00.968382 IP (tos 0x0, ttl 64, id 23341, offset 0, flags [DF], proto TCP (6), length 52)
    127.0.0.1.10050 > 127.0.0.1.47672: Flags [.], cksum 0xfe28 (incorrect -> 0x75ac), seq 3, ack 14, win 512, options [nop,nop,TS val 3503400520 ecr 3503400520], length 0
2022-04-07 16:00:01.135877 IP (tos 0x0, ttl 64, id 23342, offset 0, flags [DF], proto TCP (6), length 62)
    127.0.0.1.10050 > 127.0.0.1.47672: Flags [P.], cksum 0xfe32 (incorrect -> 0x6ff2), seq 3:13, ack 14, win 512, options [nop,nop,TS val 3503400687 ecr 3503400520], length 10
2022-04-07 16:00:01.135890 IP (tos 0x0, ttl 64, id 11776, offset 0, flags [DF], proto TCP (6), length 52)
    127.0.0.1.47672 > 127.0.0.1.10050: Flags [.], cksum 0xfe28 (incorrect -> 0x7454), seq 14, ack 13, win 512, options [nop,nop,TS val 3503400687 ecr 3503400687], length 0
2022-04-07 16:00:01.141190 IP (tos 0x0, ttl 64, id 11777, offset 0, flags [DF], proto TCP (6), length 569)
    127.0.0.1.47672 > 127.0.0.1.10050: Flags [P.], cksum 0x002e (incorrect -> 0x4a46), seq 14:531, ack 13, win 512, options [nop,nop,TS val 3503400692 ecr 3503400687], length 517
2022-04-07 16:00:01.141199 IP (tos 0x0, ttl 64, id 23343, offset 0, flags [DF], proto TCP (6), length 52)
    127.0.0.1.10050 > 127.0.0.1.47672: Flags [.], cksum 0xfe28 (incorrect -> 0x7249), seq 13, ack 531, win 508, options [nop,nop,TS val 3503400692 ecr 3503400692], length 0
200, 3.704965829849243, 2.577022075653076