2022-04-07 04:39:42.988162 IP (tos 0x0, ttl 64, id 40794, offset 0, flags [DF], proto TCP (6), length 60)
    127.0.0.1.59920 > 127.0.0.1.10450: Flags [S], cksum 0xfe30 (incorrect -> 0x574c), seq 815271293, win 65495, options [mss 65495,sackOK,TS val 388665491 ecr 0,nop,wscale 7], length 0
2022-04-07 04:39:42.988174 IP (tos 0x0, ttl 64, id 0, offset 0, flags [DF], proto TCP (6), length 60)
    127.0.0.1.10450 > 127.0.0.1.59920: Flags [S.], cksum 0xfe30 (incorrect -> 0x4ef5), seq 919480774, ack 815271294, win 65483, options [mss 65495,sackOK,TS val 388665491 ecr 388665491,nop,wscale 7], length 0
2022-04-07 04:39:42.988183 IP (tos 0x0, ttl 64, id 40795, offset 0, flags [DF], proto TCP (6), length 52)
    127.0.0.1.59920 > 127.0.0.1.10450: Flags [.], cksum 0xfe28 (incorrect -> 0x75b1), seq 1, ack 1, win 512, options [nop,nop,TS val 388665491 ecr 388665491], length 0
2022-04-07 04:39:42.988281 IP (tos 0x0, ttl 64, id 40796, offset 0, flags [DF], proto TCP (6), length 55)
    127.0.0.1.59920 > 127.0.0.1.10450: Flags [P.], cksum 0xfe2b (incorrect -> 0x70a5), seq 1:4, ack 1, win 512, options [nop,nop,TS val 388665491 ecr 388665491], length 3
2022-04-07 04:39:42.988293 IP (tos 0x0, ttl 64, id 28177, offset 0, flags [DF], proto TCP (6), length 52)
    127.0.0.1.10450 > 127.0.0.1.59920: Flags [.], cksum 0xfe28 (incorrect -> 0x75ae), seq 1, ack 4, win 512, options [nop,nop,TS val 388665491 ecr 388665491], length 0
2022-04-07 04:39:42.988331 IP (tos 0x0, ttl 64, id 28178, offset 0, flags [DF], proto TCP (6), length 54)
    127.0.0.1.10450 > 127.0.0.1.59920: Flags [P.], cksum 0xfe2a (incorrect -> 0x70a4), seq 1:3, ack 4, win 512, options [nop,nop,TS val 388665491 ecr 388665491], length 2
2022-04-07 04:39:42.988346 IP (tos 0x0, ttl 64, id 40797, offset 0, flags [DF], proto TCP (6), length 52)
    127.0.0.1.59920 > 127.0.0.1.10450: Flags [.], cksum 0xfe28 (incorrect -> 0x75ac), seq 4, ack 3, win 512, options [nop,nop,TS val 388665491 ecr 388665491], length 0
2022-04-07 04:39:43.000638 IP (tos 0x0, ttl 64, id 40798, offset 0, flags [DF], proto TCP (6), length 62)
    127.0.0.1.59920 > 127.0.0.1.10450: Flags [P.], cksum 0xfe32 (incorrect -> 0xdb9b), seq 4:14, ack 3, win 512, options [nop,nop,TS val 388665503 ecr 388665491], length 10
2022-04-07 04:39:43.000647 IP (tos 0x0, ttl 64, id 28179, offset 0, flags [DF], proto TCP (6), length 52)
    127.0.0.1.10450 > 127.0.0.1.59920: Flags [.], cksum 0xfe28 (incorrect -> 0x758a), seq 3, ack 14, win 512, options [nop,nop,TS val 388665503 ecr 388665503], length 0
2022-04-07 04:39:43.042990 IP (tos 0x0, ttl 64, id 28180, offset 0, flags [DF], proto TCP (6), length 62)
    127.0.0.1.10450 > 127.0.0.1.59920: Flags [P.], cksum 0xfe32 (incorrect -> 0x704d), seq 3:13, ack 14, win 512, options [nop,nop,TS val 388665545 ecr 388665503], length 10
2022-04-07 04:39:43.043000 IP (tos 0x0, ttl 64, id 40799, offset 0, flags [DF], proto TCP (6), length 52)
    127.0.0.1.59920 > 127.0.0.1.10450: Flags [.], cksum 0xfe28 (incorrect -> 0x752c), seq 14, ack 13, win 512, options [nop,nop,TS val 388665545 ecr 388665545], length 0
2022-04-07 04:39:43.048670 IP (tos 0x0, ttl 64, id 40800, offset 0, flags [DF], proto TCP (6), length 569)
    127.0.0.1.59920 > 127.0.0.1.10450: Flags [P.], cksum 0x002e (incorrect -> 0x430c), seq 14:531, ack 13, win 512, options [nop,nop,TS val 388665551 ecr 388665545], length 517
2022-04-07 04:39:43.048681 IP (tos 0x0, ttl 64, id 28181, offset 0, flags [DF], proto TCP (6), length 52)
    127.0.0.1.10450 > 127.0.0.1.59920: Flags [.], cksum 0xfe28 (incorrect -> 0x731f), seq 13, ack 531, win 508, options [nop,nop,TS val 388665551 ecr 388665551], length 0
2022-04-07 04:39:43.101683 IP (tos 0x0, ttl 64, id 28182, offset 0, flags [DF], proto TCP (6), length 2804)
    127.0.0.1.10450 > 127.0.0.1.59920: Flags [P.], cksum 0x08e9 (incorrect -> 0xef02), seq 13:2765, ack 531, win 512, options [nop,nop,TS val 388665604 ecr 388665551], length 2752
2022-04-07 04:39:43.101693 IP (tos 0x0, ttl 64, id 40801, offset 0, flags [DF], proto TCP (6), length 52)
    127.0.0.1.59920 > 127.0.0.1.10450: Flags [.], cksum 0xfe28 (incorrect -> 0x6800), seq 531, ack 2765, win 497, options [nop,nop,TS val 388665604 ecr 388665604], length 0
2022-04-07 04:39:43.103008 IP (tos 0x0, ttl 64, id 40802, offset 0, flags [DF], proto TCP (6), length 132)
    127.0.0.1.59920 > 127.0.0.1.10450: Flags [P.], cksum 0xfe78 (incorrect -> 0xe6f0), seq 531:611, ack 2765, win 512, options [nop,nop,TS val 388665605 ecr 388665604], length 80
2022-04-07 04:39:43.103017 IP (tos 0x0, ttl 64, id 28183, offset 0, flags [DF], proto TCP (6), length 52)
    127.0.0.1.10450 > 127.0.0.1.59920: Flags [.], cksum 0xfe28 (incorrect -> 0x679f), seq 2765, ack 611, win 512, options [nop,nop,TS val 388665605 ecr 388665605], length 0
2022-04-07 04:39:43.103389 IP (tos 0x0, ttl 64, id 40803, offset 0, flags [DF], proto TCP (6), length 340)
    127.0.0.1.59920 > 127.0.0.1.10450: Flags [P.], cksum 0xff48 (incorrect -> 0x4a8f), seq 611:899, ack 2765, win 512, options [nop,nop,TS val 388665606 ecr 388665605], length 288
2022-04-07 04:39:43.103398 IP (tos 0x0, ttl 64, id 28184, offset 0, flags [DF], proto TCP (6), length 52)
    127.0.0.1.10450 > 127.0.0.1.59920: Flags [.], cksum 0xfe28 (incorrect -> 0x667f), seq 2765, ack 899, win 510, options [nop,nop,TS val 388665606 ecr 388665606], length 0
200, 5.804367303848267, 0.7672955989837646