2022-04-07 20:28:47.011009 IP (tos 0x0, ttl 64, id 30807, offset 0, flags [DF], proto TCP (6), length 60)
    127.0.0.1.59334 > 127.0.0.1.12050: Flags [S], cksum 0xfe30 (incorrect -> 0x71d3), seq 3563612802, win 65495, options [mss 65495,sackOK,TS val 3519526562 ecr 0,nop,wscale 7], length 0
2022-04-07 20:28:47.011019 IP (tos 0x0, ttl 64, id 0, offset 0, flags [DF], proto TCP (6), length 60)
    127.0.0.1.12050 > 127.0.0.1.59334: Flags [S.], cksum 0xfe30 (incorrect -> 0xc741), seq 4073860943, ack 3563612803, win 65483, options [mss 65495,sackOK,TS val 3519526562 ecr 3519526562,nop,wscale 7], length 0
2022-04-07 20:28:47.011027 IP (tos 0x0, ttl 64, id 30808, offset 0, flags [DF], proto TCP (6), length 52)
    127.0.0.1.59334 > 127.0.0.1.12050: Flags [.], cksum 0xfe28 (incorrect -> 0xedfd), seq 1, ack 1, win 512, options [nop,nop,TS val 3519526562 ecr 3519526562], length 0
2022-04-07 20:28:47.011208 IP (tos 0x0, ttl 64, id 30809, offset 0, flags [DF], proto TCP (6), length 55)
    127.0.0.1.59334 > 127.0.0.1.12050: Flags [P.], cksum 0xfe2b (incorrect -> 0xe8f1), seq 1:4, ack 1, win 512, options [nop,nop,TS val 3519526562 ecr 3519526562], length 3
2022-04-07 20:28:47.011217 IP (tos 0x0, ttl 64, id 16532, offset 0, flags [DF], proto TCP (6), length 52)
    127.0.0.1.12050 > 127.0.0.1.59334: Flags [.], cksum 0xfe28 (incorrect -> 0xedfa), seq 1, ack 4, win 512, options [nop,nop,TS val 3519526562 ecr 3519526562], length 0
2022-04-07 20:28:47.011250 IP (tos 0x0, ttl 64, id 16533, offset 0, flags [DF], proto TCP (6), length 54)
    127.0.0.1.12050 > 127.0.0.1.59334: Flags [P.], cksum 0xfe2a (incorrect -> 0xe8ef), seq 1:3, ack 4, win 512, options [nop,nop,TS val 3519526563 ecr 3519526562], length 2
2022-04-07 20:28:47.011259 IP (tos 0x0, ttl 64, id 30810, offset 0, flags [DF], proto TCP (6), length 52)
    127.0.0.1.59334 > 127.0.0.1.12050: Flags [.], cksum 0xfe28 (incorrect -> 0xedf6), seq 4, ack 3, win 512, options [nop,nop,TS val 3519526563 ecr 3519526563], length 0
2022-04-07 20:28:47.013057 IP (tos 0x0, ttl 64, id 30811, offset 0, flags [DF], proto TCP (6), length 62)
    127.0.0.1.59334 > 127.0.0.1.12050: Flags [P.], cksum 0xfe32 (incorrect -> 0x0eac), seq 4:14, ack 3, win 512, options [nop,nop,TS val 3519526564 ecr 3519526563], length 10
2022-04-07 20:28:47.013083 IP (tos 0x0, ttl 64, id 16534, offset 0, flags [DF], proto TCP (6), length 52)
    127.0.0.1.12050 > 127.0.0.1.59334: Flags [.], cksum 0xfe28 (incorrect -> 0xedea), seq 3, ack 14, win 512, options [nop,nop,TS val 3519526564 ecr 3519526564], length 0
2022-04-07 20:28:47.053291 IP (tos 0x0, ttl 64, id 16535, offset 0, flags [DF], proto TCP (6), length 62)
    127.0.0.1.12050 > 127.0.0.1.59334: Flags [P.], cksum 0xfe32 (incorrect -> 0xe8ae), seq 3:13, ack 14, win 512, options [nop,nop,TS val 3519526605 ecr 3519526564], length 10
2022-04-07 20:28:47.053304 IP (tos 0x0, ttl 64, id 30812, offset 0, flags [DF], proto TCP (6), length 52)
    127.0.0.1.59334 > 127.0.0.1.12050: Flags [.], cksum 0xfe28 (incorrect -> 0xed8e), seq 14, ack 13, win 512, options [nop,nop,TS val 3519526605 ecr 3519526605], length 0
2022-04-07 20:28:47.059800 IP (tos 0x0, ttl 64, id 30813, offset 0, flags [DF], proto TCP (6), length 569)
    127.0.0.1.59334 > 127.0.0.1.12050: Flags [P.], cksum 0x002e (incorrect -> 0xda37), seq 14:531, ack 13, win 512, options [nop,nop,TS val 3519526611 ecr 3519526605], length 517
2022-04-07 20:28:47.059824 IP (tos 0x0, ttl 64, id 16536, offset 0, flags [DF], proto TCP (6), length 52)
    127.0.0.1.12050 > 127.0.0.1.59334: Flags [.], cksum 0xfe28 (incorrect -> 0xeb81), seq 13, ack 531, win 508, options [nop,nop,TS val 3519526611 ecr 3519526611], length 0
2022-04-07 20:28:47.119286 IP (tos 0x0, ttl 64, id 16537, offset 0, flags [DF], proto TCP (6), length 3538)
    127.0.0.1.12050 > 127.0.0.1.59334: Flags [P.], cksum 0x0bc7 (incorrect -> 0x9cde), seq 13:3499, ack 531, win 512, options [nop,nop,TS val 3519526671 ecr 3519526611], length 3486
2022-04-07 20:28:47.119300 IP (tos 0x0, ttl 64, id 30814, offset 0, flags [DF], proto TCP (6), length 52)
    127.0.0.1.59334 > 127.0.0.1.12050: Flags [.], cksum 0xfe28 (incorrect -> 0xdd79), seq 531, ack 3499, win 494, options [nop,nop,TS val 3519526671 ecr 3519526671], length 0
2022-04-07 20:28:47.128568 IP (tos 0x0, ttl 64, id 16538, offset 0, flags [DF], proto TCP (6), length 1217)
    127.0.0.1.12050 > 127.0.0.1.59334: Flags [P.], cksum 0x02b6 (incorrect -> 0x0448), seq 3499:4664, ack 531, win 512, options [nop,nop,TS val 3519526680 ecr 3519526671], length 1165
2022-04-07 20:28:47.128576 IP (tos 0x0, ttl 64, id 30815, offset 0, flags [DF], proto TCP (6), length 52)
    127.0.0.1.59334 > 127.0.0.1.12050: Flags [.], cksum 0xfe28 (incorrect -> 0xd8d1), seq 531, ack 4664, win 503, options [nop,nop,TS val 3519526680 ecr 3519526680], length 0
2022-04-07 20:28:47.129020 IP (tos 0x0, ttl 64, id 30816, offset 0, flags [DF], proto TCP (6), length 132)
    127.0.0.1.59334 > 127.0.0.1.12050: Flags [P.], cksum 0xfe78 (incorrect -> 0xb8f6), seq 531:611, ack 4664, win 503, options [nop,nop,TS val 3519526680 ecr 3519526680], length 80
2022-04-07 20:28:47.129032 IP (tos 0x0, ttl 64, id 16539, offset 0, flags [DF], proto TCP (6), length 52)
    127.0.0.1.12050 > 127.0.0.1.59334: Flags [.], cksum 0xfe28 (incorrect -> 0xd878), seq 4664, ack 611, win 512, options [nop,nop,TS val 3519526680 ecr 3519526680], length 0
2022-04-07 20:28:47.129448 IP (tos 0x0, ttl 64, id 30817, offset 0, flags [DF], proto TCP (6), length 343)
    127.0.0.1.59334 > 127.0.0.1.12050: Flags [P.], cksum 0xff4b (incorrect -> 0xbb5c), seq 611:902, ack 4664, win 503, options [nop,nop,TS val 3519526681 ecr 3519526680], length 291
2022-04-07 20:28:47.129458 IP (tos 0x0, ttl 64, id 16540, offset 0, flags [DF], proto TCP (6), length 52)
    127.0.0.1.12050 > 127.0.0.1.59334: Flags [.], cksum 0xfe28 (incorrect -> 0xd755), seq 4664, ack 902, win 510, options [nop,nop,TS val 3519526681 ecr 3519526681], length 0
2022-04-07 20:28:47.225681 IP (tos 0x0, ttl 64, id 16541, offset 0, flags [DF], proto TCP (6), length 507)
    127.0.0.1.12050 > 127.0.0.1.59334: Flags [P.], cksum 0xffef (incorrect -> 0x866e), seq 4664:5119, ack 902, win 512, options [nop,nop,TS val 3519526777 ecr 3519526681], length 455
2022-04-07 20:28:47.225696 IP (tos 0x0, ttl 64, id 30818, offset 0, flags [DF], proto TCP (6), length 52)
    127.0.0.1.59334 > 127.0.0.1.12050: Flags [.], cksum 0xfe28 (incorrect -> 0xd4d2), seq 902, ack 5119, win 506, options [nop,nop,TS val 3519526777 ecr 3519526777], length 0
2022-04-07 20:28:47.227009 IP (tos 0x0, ttl 64, id 30819, offset 0, flags [DF], proto TCP (6), length 52)
    127.0.0.1.59334 > 127.0.0.1.12050: Flags [R.], cksum 0xfe28 (incorrect -> 0xd4c7), seq 902, ack 5119, win 512, options [nop,nop,TS val 3519526778 ecr 3519526777], length 0
2022-04-07 20:28:47.228406 IP (tos 0x0, ttl 64, id 53287, offset 0, flags [DF], proto TCP (6), length 60)
    127.0.0.1.59336 > 127.0.0.1.12050: Flags [S], cksum 0xfe30 (incorrect -> 0xc493), seq 1205969773, win 65495, options [mss 65495,sackOK,TS val 3519526780 ecr 0,nop,wscale 7], length 0
2022-04-07 20:28:47.228415 IP (tos 0x0, ttl 64, id 0, offset 0, flags [DF], proto TCP (6), length 60)
    127.0.0.1.12050 > 127.0.0.1.59336: Flags [S.], cksum 0xfe30 (incorrect -> 0x6dfd), seq 369211211, ack 1205969774, win 65483, options [mss 65495,sackOK,TS val 3519526780 ecr 3519526780,nop,wscale 7], length 0
2022-04-07 20:28:47.228424 IP (tos 0x0, ttl 64, id 53288, offset 0, flags [DF], proto TCP (6), length 52)
    127.0.0.1.59336 > 127.0.0.1.12050: Flags [.], cksum 0xfe28 (incorrect -> 0x94b9), seq 1, ack 1, win 512, options [nop,nop,TS val 3519526780 ecr 3519526780], length 0
2022-04-07 20:28:47.228518 IP (tos 0x0, ttl 64, id 53289, offset 0, flags [DF], proto TCP (6), length 55)
    127.0.0.1.59336 > 127.0.0.1.12050: Flags [P.], cksum 0xfe2b (incorrect -> 0x8fad), seq 1:4, ack 1, win 512, options [nop,nop,TS val 3519526780 ecr 3519526780], length 3
2022-04-07 20:28:47.228525 IP (tos 0x0, ttl 64, id 54028, offset 0, flags [DF], proto TCP (6), length 52)
    127.0.0.1.12050 > 127.0.0.1.59336: Flags [.], cksum 0xfe28 (incorrect -> 0x94b6), seq 1, ack 4, win 512, options [nop,nop,TS val 3519526780 ecr 3519526780], length 0
2022-04-07 20:28:47.228542 IP (tos 0x0, ttl 64, id 54029, offset 0, flags [DF], proto TCP (6), length 54)
    127.0.0.1.12050 > 127.0.0.1.59336: Flags [P.], cksum 0xfe2a (incorrect -> 0x8fac), seq 1:3, ack 4, win 512, options [nop,nop,TS val 3519526780 ecr 3519526780], length 2
2022-04-07 20:28:47.228550 IP (tos 0x0, ttl 64, id 53290, offset 0, flags [DF], proto TCP (6), length 52)
    127.0.0.1.59336 > 127.0.0.1.12050: Flags [.], cksum 0xfe28 (incorrect -> 0x94b4), seq 4, ack 3, win 512, options [nop,nop,TS val 3519526780 ecr 3519526780], length 0
2022-04-07 20:28:47.229799 IP (tos 0x0, ttl 64, id 53291, offset 0, flags [DF], proto TCP (6), length 62)
    127.0.0.1.59336 > 127.0.0.1.12050: Flags [P.], cksum 0xfe32 (incorrect -> 0xb569), seq 4:14, ack 3, win 512, options [nop,nop,TS val 3519526781 ecr 3519526780], length 10
2022-04-07 20:28:47.229821 IP (tos 0x0, ttl 64, id 54030, offset 0, flags [DF], proto TCP (6), length 52)
    127.0.0.1.12050 > 127.0.0.1.59336: Flags [.], cksum 0xfe28 (incorrect -> 0x94a8), seq 3, ack 14, win 512, options [nop,nop,TS val 3519526781 ecr 3519526781], length 0
2022-04-07 20:28:47.316405 IP (tos 0x0, ttl 64, id 54031, offset 0, flags [DF], proto TCP (6), length 62)
    127.0.0.1.12050 > 127.0.0.1.59336: Flags [P.], cksum 0xfe32 (incorrect -> 0x8f3e), seq 3:13, ack 14, win 512, options [nop,nop,TS val 3519526868 ecr 3519526781], length 10
2022-04-07 20:28:47.316414 IP (tos 0x0, ttl 64, id 53292, offset 0, flags [DF], proto TCP (6), length 52)
    127.0.0.1.59336 > 127.0.0.1.12050: Flags [.], cksum 0xfe28 (incorrect -> 0x93f0), seq 14, ack 13, win 512, options [nop,nop,TS val 3519526868 ecr 3519526868], length 0
2022-04-07 20:28:47.323160 IP (tos 0x0, ttl 64, id 53293, offset 0, flags [DF], proto TCP (6), length 569)
    127.0.0.1.59336 > 127.0.0.1.12050: Flags [P.], cksum 0x002e (incorrect -> 0xd650), seq 14:531, ack 13, win 512, options [nop,nop,TS val 3519526874 ecr 3519526868], length 517
2022-04-07 20:28:47.323169 IP (tos 0x0, ttl 64, id 54032, offset 0, flags [DF], proto TCP (6), length 52)
    127.0.0.1.12050 > 127.0.0.1.59336: Flags [.], cksum 0xfe28 (incorrect -> 0x91e3), seq 13, ack 531, win 508, options [nop,nop,TS val 3519526874 ecr 3519526874], length 0
2022-04-07 20:28:47.381359 IP (tos 0x0, ttl 64, id 54033, offset 0, flags [DF], proto TCP (6), length 3538)
    127.0.0.1.12050 > 127.0.0.1.59336: Flags [P.], cksum 0x0bc7 (incorrect -> 0xcd0d), seq 13:3499, ack 531, win 512, options [nop,nop,TS val 3519526933 ecr 3519526874], length 3486
2022-04-07 20:28:47.381393 IP (tos 0x0, ttl 64, id 53294, offset 0, flags [DF], proto TCP (6), length 52)
    127.0.0.1.59336 > 127.0.0.1.12050: Flags [.], cksum 0xfe28 (incorrect -> 0x83dd), seq 531, ack 3499, win 494, options [nop,nop,TS val 3519526933 ecr 3519526933], length 0
2022-04-07 20:28:47.396057 IP (tos 0x0, ttl 64, id 54034, offset 0, flags [DF], proto TCP (6), length 1217)
    127.0.0.1.12050 > 127.0.0.1.59336: Flags [P.], cksum 0x02b6 (incorrect -> 0xd240), seq 3499:4664, ack 531, win 512, options [nop,nop,TS val 3519526947 ecr 3519526933], length 1165
2022-04-07 20:28:47.396072 IP (tos 0x0, ttl 64, id 53295, offset 0, flags [DF], proto TCP (6), length 52)
    127.0.0.1.59336 > 127.0.0.1.12050: Flags [.], cksum 0xfe28 (incorrect -> 0x7f2b), seq 531, ack 4664, win 503, options [nop,nop,TS val 3519526947 ecr 3519526947], length 0
2022-04-07 20:28:47.396607 IP (tos 0x0, ttl 64, id 53296, offset 0, flags [DF], proto TCP (6), length 132)
    127.0.0.1.59336 > 127.0.0.1.12050: Flags [P.], cksum 0xfe78 (incorrect -> 0xf0e3), seq 531:611, ack 4664, win 503, options [nop,nop,TS val 3519526948 ecr 3519526947], length 80
2022-04-07 20:28:47.396617 IP (tos 0x0, ttl 64, id 54035, offset 0, flags [DF], proto TCP (6), length 52)
    127.0.0.1.12050 > 127.0.0.1.59336: Flags [.], cksum 0xfe28 (incorrect -> 0x7ed0), seq 4664, ack 611, win 512, options [nop,nop,TS val 3519526948 ecr 3519526948], length 0
2022-04-07 20:28:47.397173 IP (tos 0x0, ttl 64, id 53297, offset 0, flags [DF], proto TCP (6), length 350)
    127.0.0.1.59336 > 127.0.0.1.12050: Flags [P.], cksum 0xff52 (incorrect -> 0xc6f2), seq 611:909, ack 4664, win 503, options [nop,nop,TS val 3519526948 ecr 3519526948], length 298
2022-04-07 20:28:47.397182 IP (tos 0x0, ttl 64, id 54036, offset 0, flags [DF], proto TCP (6), length 52)
    127.0.0.1.12050 > 127.0.0.1.59336: Flags [.], cksum 0xfe28 (incorrect -> 0x7da8), seq 4664, ack 909, win 510, options [nop,nop,TS val 3519526948 ecr 3519526948], length 0
2022-04-07 20:28:48.129099 IP (tos 0x0, ttl 64, id 54037, offset 0, flags [DF], proto TCP (6), length 3538)
    127.0.0.1.12050 > 127.0.0.1.59336: Flags [P.], cksum 0x0bc7 (incorrect -> 0x0e1a), seq 4664:8150, ack 909, win 512, options [nop,nop,TS val 3519527680 ecr 3519526948], length 3486
2022-04-07 20:28:48.129119 IP (tos 0x0, ttl 64, id 53298, offset 0, flags [DF], proto TCP (6), length 52)
    127.0.0.1.59336 > 127.0.0.1.12050: Flags [.], cksum 0xfe28 (incorrect -> 0x6a62), seq 909, ack 8150, win 494, options [nop,nop,TS val 3519527680 ecr 3519527680], length 0
2022-04-07 20:28:48.135102 IP (tos 0x0, ttl 64, id 54038, offset 0, flags [DF], proto TCP (6), length 331)
    127.0.0.1.12050 > 127.0.0.1.59336: Flags [P.], cksum 0xff3f (incorrect -> 0x075f), seq 8150:8429, ack 909, win 512, options [nop,nop,TS val 3519527686 ecr 3519527680], length 279
2022-04-07 20:28:48.135111 IP (tos 0x0, ttl 64, id 53299, offset 0, flags [DF], proto TCP (6), length 52)
    127.0.0.1.59336 > 127.0.0.1.12050: Flags [.], cksum 0xfe28 (incorrect -> 0x6933), seq 909, ack 8429, win 506, options [nop,nop,TS val 3519527686 ecr 3519527686], length 0
2022-04-07 20:28:48.136547 IP (tos 0x0, ttl 64, id 54039, offset 0, flags [DF], proto TCP (6), length 2811)
    127.0.0.1.12050 > 127.0.0.1.59336: Flags [P.], cksum 0x08f0 (incorrect -> 0x8140), seq 8429:11188, ack 909, win 512, options [nop,nop,TS val 3519527688 ecr 3519527686], length 2759
2022-04-07 20:28:48.136554 IP (tos 0x0, ttl 64, id 53300, offset 0, flags [DF], proto TCP (6), length 52)
    127.0.0.1.59336 > 127.0.0.1.12050: Flags [.], cksum 0xfe28 (incorrect -> 0x5e71), seq 909, ack 11188, win 497, options [nop,nop,TS val 3519527688 ecr 3519527688], length 0
2022-04-07 20:28:48.142270 IP (tos 0x0, ttl 64, id 54040, offset 0, flags [DF], proto TCP (6), length 1949)
    127.0.0.1.12050 > 127.0.0.1.59336: Flags [P.], cksum 0x0592 (incorrect -> 0x9aff), seq 11188:13085, ack 909, win 512, options [nop,nop,TS val 3519527694 ecr 3519527688], length 1897
2022-04-07 20:28:48.142276 IP (tos 0x0, ttl 64, id 53301, offset 0, flags [DF], proto TCP (6), length 52)
    127.0.0.1.59336 > 127.0.0.1.12050: Flags [.], cksum 0xfe28 (incorrect -> 0x56f9), seq 909, ack 13085, win 500, options [nop,nop,TS val 3519527694 ecr 3519527694], length 0
2022-04-07 20:28:48.142390 IP (tos 0x0, ttl 64, id 54041, offset 0, flags [DF], proto TCP (6), length 3482)
    127.0.0.1.12050 > 127.0.0.1.59336: Flags [P.], cksum 0x0b8f (incorrect -> 0x8d5b), seq 13085:16515, ack 909, win 512, options [nop,nop,TS val 3519527694 ecr 3519527694], length 3430
2022-04-07 20:28:48.142395 IP (tos 0x0, ttl 64, id 53302, offset 0, flags [DF], proto TCP (6), length 52)
    127.0.0.1.59336 > 127.0.0.1.12050: Flags [.], cksum 0xfe28 (incorrect -> 0x49a0), seq 909, ack 16515, win 487, options [nop,nop,TS val 3519527694 ecr 3519527694], length 0
2022-04-07 20:28:48.143974 IP (tos 0x0, ttl 64, id 54042, offset 0, flags [DF], proto TCP (6), length 1546)
    127.0.0.1.12050 > 127.0.0.1.59336: Flags [P.], cksum 0x03ff (incorrect -> 0x27f1), seq 16515:18009, ack 909, win 512, options [nop,nop,TS val 3519527695 ecr 3519527694], length 1494
2022-04-07 20:28:48.143981 IP (tos 0x0, ttl 64, id 53303, offset 0, flags [DF], proto TCP (6), length 52)
    127.0.0.1.59336 > 127.0.0.1.12050: Flags [.], cksum 0xfe28 (incorrect -> 0x43b9), seq 909, ack 18009, win 502, options [nop,nop,TS val 3519527695 ecr 3519527695], length 0
2022-04-07 20:28:48.144379 IP (tos 0x0, ttl 64, id 54043, offset 0, flags [DF], proto TCP (6), length 3025)
    127.0.0.1.12050 > 127.0.0.1.59336: Flags [P.], cksum 0x09c6 (incorrect -> 0xfcf7), seq 18009:20982, ack 909, win 512, options [nop,nop,TS val 3519527696 ecr 3519527695], length 2973
2022-04-07 20:28:48.144384 IP (tos 0x0, ttl 64, id 53304, offset 0, flags [DF], proto TCP (6), length 52)
    127.0.0.1.59336 > 127.0.0.1.12050: Flags [.], cksum 0xfe28 (incorrect -> 0x3820), seq 909, ack 20982, win 496, options [nop,nop,TS val 3519527696 ecr 3519527696], length 0
2022-04-07 20:28:48.159117 IP (tos 0x0, ttl 64, id 54044, offset 0, flags [DF], proto TCP (6), length 2999)
    127.0.0.1.12050 > 127.0.0.1.59336: Flags [P.], cksum 0x09ac (incorrect -> 0x3561), seq 20982:23929, ack 909, win 512, options [nop,nop,TS val 3519527710 ecr 3519527696], length 2947
2022-04-07 20:28:48.159123 IP (tos 0x0, ttl 64, id 53305, offset 0, flags [DF], proto TCP (6), length 52)
    127.0.0.1.59336 > 127.0.0.1.12050: Flags [.], cksum 0xfe28 (incorrect -> 0x2c81), seq 909, ack 23929, win 496, options [nop,nop,TS val 3519527710 ecr 3519527710], length 0
200, 4.712890625, 1.3266470432281494