2022-04-07 06:04:46.420946 IP (tos 0x0, ttl 64, id 35539, offset 0, flags [DF], proto TCP (6), length 60)
    127.0.0.1.51444 > 127.0.0.1.10150: Flags [S], cksum 0xfe30 (incorrect -> 0x0c5c), seq 2755536761, win 65495, options [mss 65495,sackOK,TS val 393768923 ecr 0,nop,wscale 7], length 0
2022-04-07 06:04:46.420957 IP (tos 0x0, ttl 64, id 0, offset 0, flags [DF], proto TCP (6), length 60)
    127.0.0.1.10150 > 127.0.0.1.51444: Flags [S.], cksum 0xfe30 (incorrect -> 0x7413), seq 1319158351, ack 2755536762, win 65483, options [mss 65495,sackOK,TS val 393768923 ecr 393768923,nop,wscale 7], length 0
2022-04-07 06:04:46.420967 IP (tos 0x0, ttl 64, id 35540, offset 0, flags [DF], proto TCP (6), length 52)
    127.0.0.1.51444 > 127.0.0.1.10150: Flags [.], cksum 0xfe28 (incorrect -> 0x9acf), seq 1, ack 1, win 512, options [nop,nop,TS val 393768923 ecr 393768923], length 0
2022-04-07 06:04:46.421065 IP (tos 0x0, ttl 64, id 35541, offset 0, flags [DF], proto TCP (6), length 55)
    127.0.0.1.51444 > 127.0.0.1.10150: Flags [P.], cksum 0xfe2b (incorrect -> 0x95c2), seq 1:4, ack 1, win 512, options [nop,nop,TS val 393768924 ecr 393768923], length 3
2022-04-07 06:04:46.421068 IP (tos 0x0, ttl 64, id 56646, offset 0, flags [DF], proto TCP (6), length 52)
    127.0.0.1.10150 > 127.0.0.1.51444: Flags [.], cksum 0xfe28 (incorrect -> 0x9aca), seq 1, ack 4, win 512, options [nop,nop,TS val 393768924 ecr 393768924], length 0
2022-04-07 06:04:46.421166 IP (tos 0x0, ttl 64, id 56647, offset 0, flags [DF], proto TCP (6), length 54)
    127.0.0.1.10150 > 127.0.0.1.51444: Flags [P.], cksum 0xfe2a (incorrect -> 0x95c0), seq 1:3, ack 4, win 512, options [nop,nop,TS val 393768924 ecr 393768924], length 2
2022-04-07 06:04:46.421170 IP (tos 0x0, ttl 64, id 35542, offset 0, flags [DF], proto TCP (6), length 52)
    127.0.0.1.51444 > 127.0.0.1.10150: Flags [.], cksum 0xfe28 (incorrect -> 0x9ac8), seq 4, ack 3, win 512, options [nop,nop,TS val 393768924 ecr 393768924], length 0
2022-04-07 06:04:46.484696 IP (tos 0x0, ttl 64, id 35543, offset 0, flags [DF], proto TCP (6), length 62)
    127.0.0.1.51444 > 127.0.0.1.10150: Flags [P.], cksum 0xfe32 (incorrect -> 0x1f98), seq 4:14, ack 3, win 512, options [nop,nop,TS val 393768987 ecr 393768924], length 10
2022-04-07 06:04:46.484702 IP (tos 0x0, ttl 64, id 56648, offset 0, flags [DF], proto TCP (6), length 52)
    127.0.0.1.10150 > 127.0.0.1.51444: Flags [.], cksum 0xfe28 (incorrect -> 0x9a40), seq 3, ack 14, win 512, options [nop,nop,TS val 393768987 ecr 393768987], length 0
2022-04-07 06:04:46.695944 IP (tos 0x0, ttl 64, id 56649, offset 0, flags [DF], proto TCP (6), length 62)
    127.0.0.1.10150 > 127.0.0.1.51444: Flags [P.], cksum 0xfe32 (incorrect -> 0x945a), seq 3:13, ack 14, win 512, options [nop,nop,TS val 393769198 ecr 393768987], length 10
2022-04-07 06:04:46.695952 IP (tos 0x0, ttl 64, id 35544, offset 0, flags [DF], proto TCP (6), length 52)
    127.0.0.1.51444 > 127.0.0.1.10150: Flags [.], cksum 0xfe28 (incorrect -> 0x9890), seq 14, ack 13, win 512, options [nop,nop,TS val 393769198 ecr 393769198], length 0
2022-04-07 06:04:46.702039 IP (tos 0x0, ttl 64, id 35545, offset 0, flags [DF], proto TCP (6), length 569)
    127.0.0.1.51444 > 127.0.0.1.10150: Flags [P.], cksum 0x002e (incorrect -> 0x5984), seq 14:531, ack 13, win 512, options [nop,nop,TS val 393769204 ecr 393769198], length 517
2022-04-07 06:04:46.702046 IP (tos 0x0, ttl 64, id 56650, offset 0, flags [DF], proto TCP (6), length 52)
    127.0.0.1.10150 > 127.0.0.1.51444: Flags [.], cksum 0xfe28 (incorrect -> 0x9683), seq 13, ack 531, win 508, options [nop,nop,TS val 393769204 ecr 393769204], length 0
2022-04-07 06:04:46.907053 IP (tos 0x0, ttl 64, id 56651, offset 0, flags [DF], proto TCP (6), length 3381)
    127.0.0.1.10150 > 127.0.0.1.51444: Flags [P.], cksum 0x0b2a (incorrect -> 0x15f8), seq 13:3342, ack 531, win 512, options [nop,nop,TS val 393769409 ecr 393769204], length 3329
2022-04-07 06:04:46.907062 IP (tos 0x0, ttl 64, id 35546, offset 0, flags [DF], proto TCP (6), length 52)
    127.0.0.1.51444 > 127.0.0.1.10150: Flags [.], cksum 0xfe28 (incorrect -> 0x87f6), seq 531, ack 3342, win 494, options [nop,nop,TS val 393769409 ecr 393769409], length 0
2022-04-07 06:04:46.908084 IP (tos 0x0, ttl 64, id 35547, offset 0, flags [DF], proto TCP (6), length 145)
    127.0.0.1.51444 > 127.0.0.1.10150: Flags [P.], cksum 0xfe85 (incorrect -> 0xaa9c), seq 531:624, ack 3342, win 512, options [nop,nop,TS val 393769411 ecr 393769409], length 93
2022-04-07 06:04:46.908091 IP (tos 0x0, ttl 64, id 56652, offset 0, flags [DF], proto TCP (6), length 52)
    127.0.0.1.10150 > 127.0.0.1.51444: Flags [.], cksum 0xfe28 (incorrect -> 0x8783), seq 3342, ack 624, win 512, options [nop,nop,TS val 393769411 ecr 393769411], length 0
2022-04-07 06:04:47.110961 IP (tos 0x0, ttl 64, id 56653, offset 0, flags [DF], proto TCP (6), length 310)
    127.0.0.1.10150 > 127.0.0.1.51444: Flags [P.], cksum 0xff2a (incorrect -> 0xc750), seq 3342:3600, ack 624, win 512, options [nop,nop,TS val 393769613 ecr 393769411], length 258
2022-04-07 06:04:47.110975 IP (tos 0x0, ttl 64, id 35548, offset 0, flags [DF], proto TCP (6), length 52)
    127.0.0.1.51444 > 127.0.0.1.10150: Flags [.], cksum 0xfe28 (incorrect -> 0x84ef), seq 624, ack 3600, win 510, options [nop,nop,TS val 393769613 ecr 393769613], length 0
2022-04-07 06:04:47.111647 IP (tos 0x0, ttl 64, id 35549, offset 0, flags [DF], proto TCP (6), length 378)
    127.0.0.1.51444 > 127.0.0.1.10150: Flags [P.], cksum 0xff6e (incorrect -> 0x754f), seq 624:950, ack 3600, win 512, options [nop,nop,TS val 393769614 ecr 393769613], length 326
2022-04-07 06:04:47.111654 IP (tos 0x0, ttl 64, id 56654, offset 0, flags [DF], proto TCP (6), length 52)
    127.0.0.1.10150 > 127.0.0.1.51444: Flags [.], cksum 0xfe28 (incorrect -> 0x83a7), seq 3600, ack 950, win 510, options [nop,nop,TS val 393769614 ecr 393769614], length 0
2022-04-07 06:04:47.315888 IP (tos 0x0, ttl 64, id 56655, offset 0, flags [DF], proto TCP (6), length 220)
    127.0.0.1.10150 > 127.0.0.1.51444: Flags [P.], cksum 0xfed0 (incorrect -> 0xcd3b), seq 3600:3768, ack 950, win 512, options [nop,nop,TS val 393769818 ecr 393769614], length 168
2022-04-07 06:04:47.318147 IP (tos 0x0, ttl 64, id 12570, offset 0, flags [DF], proto TCP (6), length 60)
    127.0.0.1.51446 > 127.0.0.1.10150: Flags [S], cksum 0xfe30 (incorrect -> 0x0478), seq 1341161511, win 65495, options [mss 65495,sackOK,TS val 393769821 ecr 0,nop,wscale 7], length 0
2022-04-07 06:04:47.318158 IP (tos 0x0, ttl 64, id 0, offset 0, flags [DF], proto TCP (6), length 60)
    127.0.0.1.10150 > 127.0.0.1.51446: Flags [S.], cksum 0xfe30 (incorrect -> 0x38a7), seq 1773655870, ack 1341161512, win 65483, options [mss 65495,sackOK,TS val 393769821 ecr 393769821,nop,wscale 7], length 0
2022-04-07 06:04:47.318166 IP (tos 0x0, ttl 64, id 12571, offset 0, flags [DF], proto TCP (6), length 52)
    127.0.0.1.51446 > 127.0.0.1.10150: Flags [.], cksum 0xfe28 (incorrect -> 0x5f63), seq 1, ack 1, win 512, options [nop,nop,TS val 393769821 ecr 393769821], length 0
2022-04-07 06:04:47.318224 IP (tos 0x0, ttl 64, id 12572, offset 0, flags [DF], proto TCP (6), length 55)
    127.0.0.1.51446 > 127.0.0.1.10150: Flags [P.], cksum 0xfe2b (incorrect -> 0x5a57), seq 1:4, ack 1, win 512, options [nop,nop,TS val 393769821 ecr 393769821], length 3
2022-04-07 06:04:47.318227 IP (tos 0x0, ttl 64, id 63712, offset 0, flags [DF], proto TCP (6), length 52)
    127.0.0.1.10150 > 127.0.0.1.51446: Flags [.], cksum 0xfe28 (incorrect -> 0x5f60), seq 1, ack 4, win 512, options [nop,nop,TS val 393769821 ecr 393769821], length 0
2022-04-07 06:04:47.318275 IP (tos 0x0, ttl 64, id 63713, offset 0, flags [DF], proto TCP (6), length 54)
    127.0.0.1.10150 > 127.0.0.1.51446: Flags [P.], cksum 0xfe2a (incorrect -> 0x5a56), seq 1:3, ack 4, win 512, options [nop,nop,TS val 393769821 ecr 393769821], length 2
2022-04-07 06:04:47.318279 IP (tos 0x0, ttl 64, id 12573, offset 0, flags [DF], proto TCP (6), length 52)
    127.0.0.1.51446 > 127.0.0.1.10150: Flags [.], cksum 0xfe28 (incorrect -> 0x5f5e), seq 4, ack 3, win 512, options [nop,nop,TS val 393769821 ecr 393769821], length 0
2022-04-07 06:04:47.358655 IP (tos 0x0, ttl 64, id 35550, offset 0, flags [DF], proto TCP (6), length 52)
    127.0.0.1.51444 > 127.0.0.1.10150: Flags [.], cksum 0xfe28 (incorrect -> 0x813a), seq 950, ack 3768, win 512, options [nop,nop,TS val 393769861 ecr 393769818], length 0
2022-04-07 06:04:47.368960 IP (tos 0x0, ttl 64, id 12574, offset 0, flags [DF], proto TCP (6), length 62)
    127.0.0.1.51446 > 127.0.0.1.10150: Flags [P.], cksum 0xfe32 (incorrect -> 0xe43a), seq 4:14, ack 3, win 512, options [nop,nop,TS val 393769871 ecr 393769821], length 10
2022-04-07 06:04:47.368985 IP (tos 0x0, ttl 64, id 63714, offset 0, flags [DF], proto TCP (6), length 52)
    127.0.0.1.10150 > 127.0.0.1.51446: Flags [.], cksum 0xfe28 (incorrect -> 0x5ef0), seq 3, ack 14, win 512, options [nop,nop,TS val 393769871 ecr 393769871], length 0
200, 122.9493408203125, 2.0655646324157715