2022-04-07 09:23:59.654722 IP (tos 0x0, ttl 64, id 64278, offset 0, flags [DF], proto TCP (6), length 60)
    127.0.0.1.39134 > 127.0.0.1.11450: Flags [S], cksum 0xfe30 (incorrect -> 0x2329), seq 1499867596, win 65495, options [mss 65495,sackOK,TS val 3479639206 ecr 0,nop,wscale 7], length 0
2022-04-07 09:23:59.654736 IP (tos 0x0, ttl 64, id 0, offset 0, flags [DF], proto TCP (6), length 60)
    127.0.0.1.11450 > 127.0.0.1.39134: Flags [S.], cksum 0xfe30 (incorrect -> 0x74ba), seq 1118209973, ack 1499867597, win 65483, options [mss 65495,sackOK,TS val 3479639206 ecr 3479639206,nop,wscale 7], length 0
2022-04-07 09:23:59.654747 IP (tos 0x0, ttl 64, id 64279, offset 0, flags [DF], proto TCP (6), length 52)
    127.0.0.1.39134 > 127.0.0.1.11450: Flags [.], cksum 0xfe28 (incorrect -> 0x9b76), seq 1, ack 1, win 512, options [nop,nop,TS val 3479639206 ecr 3479639206], length 0
2022-04-07 09:23:59.654892 IP (tos 0x0, ttl 64, id 64280, offset 0, flags [DF], proto TCP (6), length 55)
    127.0.0.1.39134 > 127.0.0.1.11450: Flags [P.], cksum 0xfe2b (incorrect -> 0x966a), seq 1:4, ack 1, win 512, options [nop,nop,TS val 3479639206 ecr 3479639206], length 3
2022-04-07 09:23:59.654906 IP (tos 0x0, ttl 64, id 49383, offset 0, flags [DF], proto TCP (6), length 52)
    127.0.0.1.11450 > 127.0.0.1.39134: Flags [.], cksum 0xfe28 (incorrect -> 0x9b73), seq 1, ack 4, win 512, options [nop,nop,TS val 3479639206 ecr 3479639206], length 0
2022-04-07 09:23:59.654944 IP (tos 0x0, ttl 64, id 49384, offset 0, flags [DF], proto TCP (6), length 54)
    127.0.0.1.11450 > 127.0.0.1.39134: Flags [P.], cksum 0xfe2a (incorrect -> 0x9669), seq 1:3, ack 4, win 512, options [nop,nop,TS val 3479639206 ecr 3479639206], length 2
2022-04-07 09:23:59.654960 IP (tos 0x0, ttl 64, id 64281, offset 0, flags [DF], proto TCP (6), length 52)
    127.0.0.1.39134 > 127.0.0.1.11450: Flags [.], cksum 0xfe28 (incorrect -> 0x9b71), seq 4, ack 3, win 512, options [nop,nop,TS val 3479639206 ecr 3479639206], length 0
2022-04-07 09:23:59.657533 IP (tos 0x0, ttl 64, id 64282, offset 0, flags [DF], proto TCP (6), length 62)
    127.0.0.1.39134 > 127.0.0.1.11450: Flags [P.], cksum 0xfe32 (incorrect -> 0xe5be), seq 4:14, ack 3, win 512, options [nop,nop,TS val 3479639209 ecr 3479639206], length 10
2022-04-07 09:23:59.657543 IP (tos 0x0, ttl 64, id 49385, offset 0, flags [DF], proto TCP (6), length 52)
    127.0.0.1.11450 > 127.0.0.1.39134: Flags [.], cksum 0xfe28 (incorrect -> 0x9b61), seq 3, ack 14, win 512, options [nop,nop,TS val 3479639209 ecr 3479639209], length 0
2022-04-07 09:23:59.749799 IP (tos 0x0, ttl 64, id 49386, offset 0, flags [DF], proto TCP (6), length 62)
    127.0.0.1.11450 > 127.0.0.1.39134: Flags [P.], cksum 0xfe32 (incorrect -> 0x95f2), seq 3:13, ack 14, win 512, options [nop,nop,TS val 3479639301 ecr 3479639209], length 10
2022-04-07 09:23:59.749808 IP (tos 0x0, ttl 64, id 64283, offset 0, flags [DF], proto TCP (6), length 52)
    127.0.0.1.39134 > 127.0.0.1.11450: Flags [.], cksum 0xfe28 (incorrect -> 0x9a9f), seq 14, ack 13, win 512, options [nop,nop,TS val 3479639301 ecr 3479639301], length 0
2022-04-07 09:23:59.755558 IP (tos 0x0, ttl 64, id 64284, offset 0, flags [DF], proto TCP (6), length 569)
    127.0.0.1.39134 > 127.0.0.1.11450: Flags [P.], cksum 0x002e (incorrect -> 0xa86f), seq 14:531, ack 13, win 512, options [nop,nop,TS val 3479639307 ecr 3479639301], length 517
2022-04-07 09:23:59.755572 IP (tos 0x0, ttl 64, id 49387, offset 0, flags [DF], proto TCP (6), length 52)
    127.0.0.1.11450 > 127.0.0.1.39134: Flags [.], cksum 0xfe28 (incorrect -> 0x9892), seq 13, ack 531, win 508, options [nop,nop,TS val 3479639307 ecr 3479639307], length 0
2022-04-07 09:23:59.858967 IP (tos 0x0, ttl 64, id 49388, offset 0, flags [DF], proto TCP (6), length 1500)
    127.0.0.1.11450 > 127.0.0.1.39134: Flags [P.], cksum 0x03d1 (incorrect -> 0xddda), seq 13:1461, ack 531, win 512, options [nop,nop,TS val 3479639410 ecr 3479639307], length 1448
2022-04-07 09:23:59.858993 IP (tos 0x0, ttl 64, id 64285, offset 0, flags [DF], proto TCP (6), length 52)
    127.0.0.1.39134 > 127.0.0.1.11450: Flags [.], cksum 0xfe28 (incorrect -> 0x9222), seq 531, ack 1461, win 502, options [nop,nop,TS val 3479639410 ecr 3479639410], length 0
2022-04-07 09:23:59.888264 IP (tos 0x0, ttl 64, id 49389, offset 0, flags [DF], proto TCP (6), length 2699)
    127.0.0.1.11450 > 127.0.0.1.39134: Flags [P.], cksum 0x0880 (incorrect -> 0x5f1c), seq 1461:4108, ack 531, win 512, options [nop,nop,TS val 3479639440 ecr 3479639410], length 2647
2022-04-07 09:23:59.888272 IP (tos 0x0, ttl 64, id 64286, offset 0, flags [DF], proto TCP (6), length 52)
    127.0.0.1.39134 > 127.0.0.1.11450: Flags [.], cksum 0xfe28 (incorrect -> 0x8794), seq 531, ack 4108, win 497, options [nop,nop,TS val 3479639440 ecr 3479639440], length 0
2022-04-07 09:23:59.888919 IP (tos 0x0, ttl 64, id 64287, offset 0, flags [DF], proto TCP (6), length 132)
    127.0.0.1.39134 > 127.0.0.1.11450: Flags [P.], cksum 0xfe78 (incorrect -> 0xa20b), seq 531:611, ack 4108, win 512, options [nop,nop,TS val 3479639440 ecr 3479639440], length 80
2022-04-07 09:23:59.888928 IP (tos 0x0, ttl 64, id 49390, offset 0, flags [DF], proto TCP (6), length 52)
    127.0.0.1.11450 > 127.0.0.1.39134: Flags [.], cksum 0xfe28 (incorrect -> 0x8735), seq 4108, ack 611, win 512, options [nop,nop,TS val 3479639440 ecr 3479639440], length 0
2022-04-07 09:23:59.889533 IP (tos 0x0, ttl 64, id 64288, offset 0, flags [DF], proto TCP (6), length 358)
    127.0.0.1.39134 > 127.0.0.1.11450: Flags [P.], cksum 0xff5a (incorrect -> 0x30ee), seq 611:917, ack 4108, win 512, options [nop,nop,TS val 3479639441 ecr 3479639440], length 306
2022-04-07 09:23:59.889551 IP (tos 0x0, ttl 64, id 49391, offset 0, flags [DF], proto TCP (6), length 52)
    127.0.0.1.11450 > 127.0.0.1.39134: Flags [.], cksum 0xfe28 (incorrect -> 0x8603), seq 4108, ack 917, win 510, options [nop,nop,TS val 3479639441 ecr 3479639441], length 0
2022-04-07 09:23:59.987921 IP (tos 0x0, ttl 64, id 49392, offset 0, flags [DF], proto TCP (6), length 323)
    127.0.0.1.11450 > 127.0.0.1.39134: Flags [P.], cksum 0xff37 (incorrect -> 0x3eb6), seq 4108:4379, ack 917, win 512, options [nop,nop,TS val 3479639539 ecr 3479639441], length 271
2022-04-07 09:23:59.987936 IP (tos 0x0, ttl 64, id 64289, offset 0, flags [DF], proto TCP (6), length 52)
    127.0.0.1.39134 > 127.0.0.1.11450: Flags [.], cksum 0xfe28 (incorrect -> 0x8430), seq 917, ack 4379, win 510, options [nop,nop,TS val 3479639539 ecr 3479639539], length 0
2022-04-07 09:24:00.056011 IP (tos 0x0, ttl 64, id 49393, offset 0, flags [DF], proto TCP (6), length 323)
    127.0.0.1.11450 > 127.0.0.1.39134: Flags [P.], cksum 0xff37 (incorrect -> 0xb1e3), seq 4379:4650, ack 917, win 512, options [nop,nop,TS val 3479639607 ecr 3479639539], length 271
2022-04-07 09:24:00.056022 IP (tos 0x0, ttl 64, id 64290, offset 0, flags [DF], proto TCP (6), length 52)
    127.0.0.1.39134 > 127.0.0.1.11450: Flags [.], cksum 0xfe28 (incorrect -> 0x829b), seq 917, ack 4650, win 508, options [nop,nop,TS val 3479639607 ecr 3479639607], length 0
2022-04-07 09:24:00.083307 IP (tos 0x0, ttl 64, id 49394, offset 0, flags [DF], proto TCP (6), length 3538)
    127.0.0.1.11450 > 127.0.0.1.39134: Flags [P.], cksum 0x0bc7 (incorrect -> 0x613c), seq 4650:8136, ack 917, win 512, options [nop,nop,TS val 3479639635 ecr 3479639607], length 3486
2022-04-07 09:24:00.083314 IP (tos 0x0, ttl 64, id 64291, offset 0, flags [DF], proto TCP (6), length 52)
    127.0.0.1.39134 > 127.0.0.1.11450: Flags [.], cksum 0xfe28 (incorrect -> 0x74d3), seq 917, ack 8136, win 494, options [nop,nop,TS val 3479639635 ecr 3479639635], length 0
2022-04-07 09:24:00.087486 IP (tos 0x0, ttl 64, id 49395, offset 0, flags [DF], proto TCP (6), length 3538)
    127.0.0.1.11450 > 127.0.0.1.39134: Flags [P.], cksum 0x0bc7 (incorrect -> 0xdd83), seq 8136:11622, ack 917, win 512, options [nop,nop,TS val 3479639639 ecr 3479639635], length 3486
2022-04-07 09:24:00.087494 IP (tos 0x0, ttl 64, id 64292, offset 0, flags [DF], proto TCP (6), length 52)
    127.0.0.1.39134 > 127.0.0.1.11450: Flags [.], cksum 0xfe28 (incorrect -> 0x672d), seq 917, ack 11622, win 494, options [nop,nop,TS val 3479639639 ecr 3479639639], length 0
2022-04-07 09:24:00.100426 IP (tos 0x0, ttl 64, id 49396, offset 0, flags [DF], proto TCP (6), length 219)
    127.0.0.1.11450 > 127.0.0.1.39134: Flags [P.], cksum 0xfecf (incorrect -> 0x8c04), seq 11622:11789, ack 917, win 512, options [nop,nop,TS val 3479639652 ecr 3479639639], length 167
2022-04-07 09:24:00.100436 IP (tos 0x0, ttl 64, id 64293, offset 0, flags [DF], proto TCP (6), length 52)
    127.0.0.1.39134 > 127.0.0.1.11450: Flags [.], cksum 0xfe28 (incorrect -> 0x665f), seq 917, ack 11789, win 507, options [nop,nop,TS val 3479639652 ecr 3479639652], length 0
2022-04-07 09:24:00.117364 IP (tos 0x0, ttl 64, id 49397, offset 0, flags [DF], proto TCP (6), length 684)
    127.0.0.1.11450 > 127.0.0.1.39134: Flags [P.], cksum 0x00a1 (incorrect -> 0x52df), seq 11789:12421, ack 917, win 512, options [nop,nop,TS val 3479639669 ecr 3479639652], length 632
2022-04-07 09:24:00.117378 IP (tos 0x0, ttl 64, id 64294, offset 0, flags [DF], proto TCP (6), length 52)
    127.0.0.1.39134 > 127.0.0.1.11450: Flags [.], cksum 0xfe28 (incorrect -> 0x63c7), seq 917, ack 12421, win 505, options [nop,nop,TS val 3479639669 ecr 3479639669], length 0
2022-04-07 09:24:00.162603 IP (tos 0x0, ttl 64, id 49398, offset 0, flags [DF], proto TCP (6), length 2998)
    127.0.0.1.11450 > 127.0.0.1.39134: Flags [P.], cksum 0x09ab (incorrect -> 0x4b85), seq 12421:15367, ack 917, win 512, options [nop,nop,TS val 3479639714 ecr 3479639669], length 2946
2022-04-07 09:24:00.162615 IP (tos 0x0, ttl 64, id 64295, offset 0, flags [DF], proto TCP (6), length 52)
    127.0.0.1.39134 > 127.0.0.1.11450: Flags [.], cksum 0xfe28 (incorrect -> 0x57f4), seq 917, ack 15367, win 496, options [nop,nop,TS val 3479639714 ecr 3479639714], length 0
2022-04-07 09:24:00.170662 IP (tos 0x0, ttl 64, id 49399, offset 0, flags [DF], proto TCP (6), length 3228)
    127.0.0.1.11450 > 127.0.0.1.39134: Flags [P.], cksum 0x0a91 (incorrect -> 0x9404), seq 15367:18543, ack 917, win 512, options [nop,nop,TS val 3479639722 ecr 3479639714], length 3176
2022-04-07 09:24:00.170675 IP (tos 0x0, ttl 64, id 64296, offset 0, flags [DF], proto TCP (6), length 52)
    127.0.0.1.39134 > 127.0.0.1.11450: Flags [.], cksum 0xfe28 (incorrect -> 0x4b7d), seq 917, ack 18543, win 495, options [nop,nop,TS val 3479639722 ecr 3479639722], length 0
2022-04-07 09:24:00.172445 IP (tos 0x0, ttl 64, id 49400, offset 0, flags [DF], proto TCP (6), length 3647)
    127.0.0.1.11450 > 127.0.0.1.39134: Flags [P.], cksum 0x0c34 (incorrect -> 0x2ce1), seq 18543:22138, ack 917, win 512, options [nop,nop,TS val 3479639724 ecr 3479639722], length 3595
2022-04-07 09:24:00.218787 IP (tos 0x0, ttl 64, id 64297, offset 0, flags [DF], proto TCP (6), length 52)
    127.0.0.1.39134 > 127.0.0.1.11450: Flags [.], cksum 0xfe28 (incorrect -> 0x3d2f), seq 917, ack 22138, win 512, options [nop,nop,TS val 3479639770 ecr 3479639724], length 0
2022-04-07 09:24:00.218799 IP (tos 0x0, ttl 64, id 49401, offset 0, flags [DF], proto TCP (6), length 11841)
    127.0.0.1.11450 > 127.0.0.1.39134: Flags [P.], cksum 0x2c36 (incorrect -> 0x4cdd), seq 22138:33927, ack 917, win 512, options [nop,nop,TS val 3479639770 ecr 3479639770], length 11789
2022-04-07 09:24:00.266808 IP (tos 0x0, ttl 64, id 64298, offset 0, flags [DF], proto TCP (6), length 52)
    127.0.0.1.39134 > 127.0.0.1.11450: Flags [.], cksum 0xfe28 (incorrect -> 0x0ec4), seq 917, ack 33927, win 512, options [nop,nop,TS val 3479639818 ecr 3479639770], length 0
2022-04-07 09:24:00.266823 IP (tos 0x0, ttl 64, id 49402, offset 0, flags [DF], proto TCP (6), length 16146)
    127.0.0.1.11450 > 127.0.0.1.39134: Flags [P.], cksum 0x3d07 (incorrect -> 0xf988), seq 33927:50021, ack 917, win 512, options [nop,nop,TS val 3479639818 ecr 3479639818], length 16094
2022-04-07 09:24:00.310785 IP (tos 0x0, ttl 64, id 64299, offset 0, flags [DF], proto TCP (6), length 52)
    127.0.0.1.39134 > 127.0.0.1.11450: Flags [.], cksum 0xfe28 (incorrect -> 0xcf89), seq 917, ack 50021, win 512, options [nop,nop,TS val 3479639862 ecr 3479639818], length 0
2022-04-07 09:24:00.310800 IP (tos 0x0, ttl 64, id 49403, offset 0, flags [DF], proto TCP (6), length 6239)
    127.0.0.1.11450 > 127.0.0.1.39134: Flags [P.], cksum 0x1654 (incorrect -> 0x8d31), seq 50021:56208, ack 917, win 512, options [nop,nop,TS val 3479639862 ecr 3479639862], length 6187
2022-04-07 09:24:00.312328 IP (tos 0x0, ttl 64, id 64300, offset 0, flags [DF], proto TCP (6), length 52)
    127.0.0.1.39134 > 127.0.0.1.11450: Flags [.], cksum 0xfe28 (incorrect -> 0xb730), seq 917, ack 56208, win 512, options [nop,nop,TS val 3479639864 ecr 3479639862], length 0
2022-04-07 09:24:00.378921 IP (tos 0x0, ttl 64, id 49404, offset 0, flags [DF], proto TCP (6), length 3227)
    127.0.0.1.11450 > 127.0.0.1.39134: Flags [P.], cksum 0x0a90 (incorrect -> 0x88b1), seq 56208:59383, ack 917, win 512, options [nop,nop,TS val 3479639930 ecr 3479639864], length 3175
2022-04-07 09:24:00.379156 IP (tos 0x0, ttl 64, id 64301, offset 0, flags [DF], proto TCP (6), length 52)
    127.0.0.1.39134 > 127.0.0.1.11450: Flags [.], cksum 0xfe28 (incorrect -> 0xaa43), seq 917, ack 59383, win 512, options [nop,nop,TS val 3479639930 ecr 3479639930], length 0
2022-04-07 09:24:00.382355 IP (tos 0x0, ttl 64, id 49405, offset 0, flags [DF], proto TCP (6), length 2945)
    127.0.0.1.11450 > 127.0.0.1.39134: Flags [P.], cksum 0x0976 (incorrect -> 0xb131), seq 59383:62276, ack 917, win 512, options [nop,nop,TS val 3479639934 ecr 3479639930], length 2893
2022-04-07 09:24:00.382500 IP (tos 0x0, ttl 64, id 64302, offset 0, flags [DF], proto TCP (6), length 52)
    127.0.0.1.39134 > 127.0.0.1.11450: Flags [.], cksum 0xfe28 (incorrect -> 0x9eee), seq 917, ack 62276, win 512, options [nop,nop,TS val 3479639934 ecr 3479639934], length 0
2022-04-07 09:24:00.383705 IP (tos 0x0, ttl 64, id 49406, offset 0, flags [DF], proto TCP (6), length 1643)
    127.0.0.1.11450 > 127.0.0.1.39134: Flags [P.], cksum 0x0460 (incorrect -> 0xe8ab), seq 62276:63867, ack 917, win 512, options [nop,nop,TS val 3479639935 ecr 3479639934], length 1591
2022-04-07 09:24:00.383756 IP (tos 0x0, ttl 64, id 64303, offset 0, flags [DF], proto TCP (6), length 52)
    127.0.0.1.39134 > 127.0.0.1.11450: Flags [.], cksum 0xfe28 (incorrect -> 0x98b5), seq 917, ack 63867, win 512, options [nop,nop,TS val 3479639935 ecr 3479639935], length 0
2022-04-07 09:24:00.395801 IP (tos 0x0, ttl 64, id 49407, offset 0, flags [DF], proto TCP (6), length 3143)
    127.0.0.1.11450 > 127.0.0.1.39134: Flags [P.], cksum 0x0a3c (incorrect -> 0x39de), seq 63867:66958, ack 917, win 512, options [nop,nop,TS val 3479639947 ecr 3479639935], length 3091
2022-04-07 09:24:00.395945 IP (tos 0x0, ttl 64, id 64304, offset 0, flags [DF], proto TCP (6), length 52)
    127.0.0.1.39134 > 127.0.0.1.11450: Flags [.], cksum 0xfe28 (incorrect -> 0x8c8a), seq 917, ack 66958, win 512, options [nop,nop,TS val 3479639947 ecr 3479639947], length 0
2022-04-07 09:24:00.409177 IP (tos 0x0, ttl 64, id 49408, offset 0, flags [DF], proto TCP (6), length 3399)
    127.0.0.1.11450 > 127.0.0.1.39134: Flags [P.], cksum 0x0b3c (incorrect -> 0xe1be), seq 66958:70305, ack 917, win 512, options [nop,nop,TS val 3479639960 ecr 3479639947], length 3347
2022-04-07 09:24:00.409381 IP (tos 0x0, ttl 64, id 64305, offset 0, flags [DF], proto TCP (6), length 52)
    127.0.0.1.39134 > 127.0.0.1.11450: Flags [.], cksum 0xfe28 (incorrect -> 0x7f5c), seq 917, ack 70305, win 512, options [nop,nop,TS val 3479639961 ecr 3479639960], length 0
2022-04-07 09:24:00.412761 IP (tos 0x0, ttl 64, id 49409, offset 0, flags [DF], proto TCP (6), length 1048)
    127.0.0.1.11450 > 127.0.0.1.39134: Flags [P.], cksum 0x020d (incorrect -> 0x6978), seq 70305:71301, ack 917, win 512, options [nop,nop,TS val 3479639964 ecr 3479639961], length 996
2022-04-07 09:24:00.412775 IP (tos 0x0, ttl 64, id 64306, offset 0, flags [DF], proto TCP (6), length 52)
    127.0.0.1.39134 > 127.0.0.1.11450: Flags [.], cksum 0xfe28 (incorrect -> 0x7b71), seq 917, ack 71301, win 512, options [nop,nop,TS val 3479639964 ecr 3479639964], length 0
2022-04-07 09:24:00.432623 IP (tos 0x0, ttl 64, id 49410, offset 0, flags [DF], proto TCP (6), length 3207)
    127.0.0.1.11450 > 127.0.0.1.39134: Flags [P.], cksum 0x0a7c (incorrect -> 0x29b0), seq 71301:74456, ack 917, win 512, options [nop,nop,TS val 3479639984 ecr 3479639964], length 3155
2022-04-07 09:24:00.432737 IP (tos 0x0, ttl 64, id 64307, offset 0, flags [DF], proto TCP (6), length 52)
    127.0.0.1.39134 > 127.0.0.1.11450: Flags [.], cksum 0xfe28 (incorrect -> 0x6ef6), seq 917, ack 74456, win 512, options [nop,nop,TS val 3479639984 ecr 3479639984], length 0
2022-04-07 09:24:00.436245 IP (tos 0x0, ttl 64, id 49411, offset 0, flags [DF], proto TCP (6), length 3568)
    127.0.0.1.11450 > 127.0.0.1.39134: Flags [P.], cksum 0x0be5 (incorrect -> 0x6f89), seq 74456:77972, ack 917, win 512, options [nop,nop,TS val 3479639988 ecr 3479639984], length 3516
2022-04-07 09:24:00.436356 IP (tos 0x0, ttl 64, id 64308, offset 0, flags [DF], proto TCP (6), length 52)
    127.0.0.1.39134 > 127.0.0.1.11450: Flags [.], cksum 0xfe28 (incorrect -> 0x6132), seq 917, ack 77972, win 512, options [nop,nop,TS val 3479639988 ecr 3479639988], length 0
2022-04-07 09:24:00.438387 IP (tos 0x0, ttl 64, id 49412, offset 0, flags [DF], proto TCP (6), length 4036)
    127.0.0.1.11450 > 127.0.0.1.39134: Flags [P.], cksum 0x0db9 (incorrect -> 0x9dbf), seq 77972:81956, ack 917, win 512, options [nop,nop,TS val 3479639990 ecr 3479639988], length 3984
2022-04-07 09:24:00.438406 IP (tos 0x0, ttl 64, id 64309, offset 0, flags [DF], proto TCP (6), length 52)
    127.0.0.1.39134 > 127.0.0.1.11450: Flags [.], cksum 0xfe28 (incorrect -> 0x519e), seq 917, ack 81956, win 512, options [nop,nop,TS val 3479639990 ecr 3479639990], length 0
2022-04-07 09:24:00.449834 IP (tos 0x0, ttl 64, id 49413, offset 0, flags [DF], proto TCP (6), length 3591)
    127.0.0.1.11450 > 127.0.0.1.39134: Flags [P.], cksum 0x0bfc (incorrect -> 0xdfad), seq 81956:85495, ack 917, win 512, options [nop,nop,TS val 3479640001 ecr 3479639990], length 3539
2022-04-07 09:24:00.449970 IP (tos 0x0, ttl 64, id 64310, offset 0, flags [DF], proto TCP (6), length 52)
    127.0.0.1.39134 > 127.0.0.1.11450: Flags [.], cksum 0xfe28 (incorrect -> 0x43b5), seq 917, ack 85495, win 512, options [nop,nop,TS val 3479640001 ecr 3479640001], length 0
2022-04-07 09:24:00.466736 IP (tos 0x0, ttl 64, id 49414, offset 0, flags [DF], proto TCP (6), length 4004)
    127.0.0.1.11450 > 127.0.0.1.39134: Flags [P.], cksum 0x0d99 (incorrect -> 0xd9dd), seq 85495:89447, ack 917, win 512, options [nop,nop,TS val 3479640018 ecr 3479640001], length 3952
2022-04-07 09:24:00.466866 IP (tos 0x0, ttl 64, id 64311, offset 0, flags [DF], proto TCP (6), length 52)
    127.0.0.1.39134 > 127.0.0.1.11450: Flags [.], cksum 0xfe28 (incorrect -> 0x3423), seq 917, ack 89447, win 512, options [nop,nop,TS val 3479640018 ecr 3479640018], length 0
2022-04-07 09:24:00.483702 IP (tos 0x0, ttl 64, id 49415, offset 0, flags [DF], proto TCP (6), length 3104)
    127.0.0.1.11450 > 127.0.0.1.39134: Flags [P.], cksum 0x0a15 (incorrect -> 0xa083), seq 89447:92499, ack 917, win 512, options [nop,nop,TS val 3479640035 ecr 3479640018], length 3052
2022-04-07 09:24:00.484060 IP (tos 0x0, ttl 64, id 64312, offset 0, flags [DF], proto TCP (6), length 52)
    127.0.0.1.39134 > 127.0.0.1.11450: Flags [.], cksum 0xfe28 (incorrect -> 0x2815), seq 917, ack 92499, win 512, options [nop,nop,TS val 3479640035 ecr 3479640035], length 0
2022-04-07 09:24:00.490840 IP (tos 0x0, ttl 64, id 49416, offset 0, flags [DF], proto TCP (6), length 550)
    127.0.0.1.11450 > 127.0.0.1.39134: Flags [P.], cksum 0x001b (incorrect -> 0x0e2f), seq 92499:92997, ack 917, win 512, options [nop,nop,TS val 3479640042 ecr 3479640035], length 498
2022-04-07 09:24:00.490862 IP (tos 0x0, ttl 64, id 64313, offset 0, flags [DF], proto TCP (6), length 52)
    127.0.0.1.39134 > 127.0.0.1.11450: Flags [.], cksum 0xfe28 (incorrect -> 0x2615), seq 917, ack 92997, win 512, options [nop,nop,TS val 3479640042 ecr 3479640042], length 0
2022-04-07 09:24:00.492441 IP (tos 0x0, ttl 64, id 49417, offset 0, flags [DF], proto TCP (6), length 3226)
    127.0.0.1.11450 > 127.0.0.1.39134: Flags [P.], cksum 0x0a8f (incorrect -> 0x12a0), seq 92997:96171, ack 917, win 512, options [nop,nop,TS val 3479640044 ecr 3479640042], length 3174
2022-04-07 09:24:00.492611 IP (tos 0x0, ttl 64, id 64314, offset 0, flags [DF], proto TCP (6), length 52)
    127.0.0.1.39134 > 127.0.0.1.11450: Flags [.], cksum 0xfe28 (incorrect -> 0x19ab), seq 917, ack 96171, win 512, options [nop,nop,TS val 3479640044 ecr 3479640044], length 0
2022-04-07 09:24:00.498298 IP (tos 0x0, ttl 64, id 49418, offset 0, flags [DF], proto TCP (6), length 3832)
    127.0.0.1.11450 > 127.0.0.1.39134: Flags [P.], cksum 0x0ced (incorrect -> 0xae7c), seq 96171:99951, ack 917, win 512, options [nop,nop,TS val 3479640050 ecr 3479640044], length 3780
2022-04-07 09:24:00.498318 IP (tos 0x0, ttl 64, id 64315, offset 0, flags [DF], proto TCP (6), length 52)
    127.0.0.1.39134 > 127.0.0.1.11450: Flags [.], cksum 0xfe28 (incorrect -> 0x0adb), seq 917, ack 99951, win 512, options [nop,nop,TS val 3479640050 ecr 3479640050], length 0
2022-04-07 09:24:00.500817 IP (tos 0x0, ttl 64, id 49419, offset 0, flags [DF], proto TCP (6), length 2044)
    127.0.0.1.11450 > 127.0.0.1.39134: Flags [P.], cksum 0x05f1 (incorrect -> 0xbefa), seq 99951:101943, ack 917, win 512, options [nop,nop,TS val 3479640052 ecr 3479640050], length 1992
2022-04-07 09:24:00.500855 IP (tos 0x0, ttl 64, id 64316, offset 0, flags [DF], proto TCP (6), length 52)
    127.0.0.1.39134 > 127.0.0.1.11450: Flags [.], cksum 0xfe28 (incorrect -> 0x030f), seq 917, ack 101943, win 512, options [nop,nop,TS val 3479640052 ecr 3479640052], length 0
2022-04-07 09:24:00.533699 IP (tos 0x0, ttl 64, id 49420, offset 0, flags [DF], proto TCP (6), length 2271)
    127.0.0.1.11450 > 127.0.0.1.39134: Flags [P.], cksum 0x06d4 (incorrect -> 0xc515), seq 101943:104162, ack 917, win 512, options [nop,nop,TS val 3479640085 ecr 3479640052], length 2219
2022-04-07 09:24:00.533720 IP (tos 0x0, ttl 64, id 64317, offset 0, flags [DF], proto TCP (6), length 52)
    127.0.0.1.39134 > 127.0.0.1.11450: Flags [.], cksum 0xfe28 (incorrect -> 0xfa21), seq 917, ack 104162, win 512, options [nop,nop,TS val 3479640085 ecr 3479640085], length 0
2022-04-07 09:24:00.541703 IP (tos 0x0, ttl 64, id 49421, offset 0, flags [DF], proto TCP (6), length 3538)
    127.0.0.1.11450 > 127.0.0.1.39134: Flags [P.], cksum 0x0bc7 (incorrect -> 0xddb1), seq 104162:107648, ack 917, win 512, options [nop,nop,TS val 3479640093 ecr 3479640085], length 3486
2022-04-07 09:24:00.541719 IP (tos 0x0, ttl 64, id 64318, offset 0, flags [DF], proto TCP (6), length 52)
    127.0.0.1.39134 > 127.0.0.1.11450: Flags [.], cksum 0xfe28 (incorrect -> 0xec73), seq 917, ack 107648, win 512, options [nop,nop,TS val 3479640093 ecr 3479640093], length 0
2022-04-07 09:24:00.544151 IP (tos 0x0, ttl 64, id 49422, offset 0, flags [DF], proto TCP (6), length 3928)
    127.0.0.1.11450 > 127.0.0.1.39134: Flags [P.], cksum 0x0d4d (incorrect -> 0x9eb6), seq 107648:111524, ack 917, win 512, options [nop,nop,TS val 3479640095 ecr 3479640093], length 3876
2022-04-07 09:24:00.544423 IP (tos 0x0, ttl 64, id 64319, offset 0, flags [DF], proto TCP (6), length 52)
    127.0.0.1.39134 > 127.0.0.1.11450: Flags [.], cksum 0xfe28 (incorrect -> 0xdd4a), seq 917, ack 111524, win 512, options [nop,nop,TS val 3479640096 ecr 3479640095], length 0
2022-04-07 09:24:00.550719 IP (tos 0x0, ttl 64, id 49423, offset 0, flags [DF], proto TCP (6), length 3475)
    127.0.0.1.11450 > 127.0.0.1.39134: Flags [P.], cksum 0x0b88 (incorrect -> 0xc023), seq 111524:114947, ack 917, win 512, options [nop,nop,TS val 3479640102 ecr 3479640096], length 3423
2022-04-07 09:24:00.550956 IP (tos 0x0, ttl 64, id 64320, offset 0, flags [DF], proto TCP (6), length 52)
    127.0.0.1.39134 > 127.0.0.1.11450: Flags [.], cksum 0xfe28 (incorrect -> 0xcfde), seq 917, ack 114947, win 512, options [nop,nop,TS val 3479640102 ecr 3479640102], length 0
2022-04-07 09:24:00.557873 IP (tos 0x0, ttl 64, id 49424, offset 0, flags [DF], proto TCP (6), length 3492)
    127.0.0.1.11450 > 127.0.0.1.39134: Flags [P.], cksum 0x0b99 (incorrect -> 0x7646), seq 114947:118387, ack 917, win 512, options [nop,nop,TS val 3479640109 ecr 3479640102], length 3440
2022-04-07 09:24:00.557889 IP (tos 0x0, ttl 64, id 64321, offset 0, flags [DF], proto TCP (6), length 52)
    127.0.0.1.39134 > 127.0.0.1.11450: Flags [.], cksum 0xfe28 (incorrect -> 0xc260), seq 917, ack 118387, win 512, options [nop,nop,TS val 3479640109 ecr 3479640109], length 0
200, 4.146779298782349, 1.2005126476287842