2022-04-07 18:37:43.506660 IP (tos 0x0, ttl 64, id 11875, offset 0, flags [DF], proto TCP (6), length 60)
    127.0.0.1.53244 > 127.0.0.1.11750: Flags [S], cksum 0xfe30 (incorrect -> 0x226d), seq 1171656487, win 65495, options [mss 65495,sackOK,TS val 3512863058 ecr 0,nop,wscale 7], length 0
2022-04-07 18:37:43.506672 IP (tos 0x0, ttl 64, id 0, offset 0, flags [DF], proto TCP (6), length 60)
    127.0.0.1.11750 > 127.0.0.1.53244: Flags [S.], cksum 0xfe30 (incorrect -> 0x91af), seq 2312318000, ack 1171656488, win 65483, options [mss 65495,sackOK,TS val 3512863058 ecr 3512863058,nop,wscale 7], length 0
2022-04-07 18:37:43.506682 IP (tos 0x0, ttl 64, id 11876, offset 0, flags [DF], proto TCP (6), length 52)
    127.0.0.1.53244 > 127.0.0.1.11750: Flags [.], cksum 0xfe28 (incorrect -> 0xb86b), seq 1, ack 1, win 512, options [nop,nop,TS val 3512863058 ecr 3512863058], length 0
2022-04-07 18:37:43.506805 IP (tos 0x0, ttl 64, id 11877, offset 0, flags [DF], proto TCP (6), length 55)
    127.0.0.1.53244 > 127.0.0.1.11750: Flags [P.], cksum 0xfe2b (incorrect -> 0xb35f), seq 1:4, ack 1, win 512, options [nop,nop,TS val 3512863058 ecr 3512863058], length 3
2022-04-07 18:37:43.506809 IP (tos 0x0, ttl 64, id 21312, offset 0, flags [DF], proto TCP (6), length 52)
    127.0.0.1.11750 > 127.0.0.1.53244: Flags [.], cksum 0xfe28 (incorrect -> 0xb868), seq 1, ack 4, win 512, options [nop,nop,TS val 3512863058 ecr 3512863058], length 0
2022-04-07 18:37:43.506912 IP (tos 0x0, ttl 64, id 21313, offset 0, flags [DF], proto TCP (6), length 54)
    127.0.0.1.11750 > 127.0.0.1.53244: Flags [P.], cksum 0xfe2a (incorrect -> 0xb35e), seq 1:3, ack 4, win 512, options [nop,nop,TS val 3512863058 ecr 3512863058], length 2
2022-04-07 18:37:43.506925 IP (tos 0x0, ttl 64, id 11878, offset 0, flags [DF], proto TCP (6), length 52)
    127.0.0.1.53244 > 127.0.0.1.11750: Flags [.], cksum 0xfe28 (incorrect -> 0xb866), seq 4, ack 3, win 512, options [nop,nop,TS val 3512863058 ecr 3512863058], length 0
2022-04-07 18:37:43.519151 IP (tos 0x0, ttl 64, id 11879, offset 0, flags [DF], proto TCP (6), length 62)
    127.0.0.1.53244 > 127.0.0.1.11750: Flags [P.], cksum 0xfe32 (incorrect -> 0x2413), seq 4:14, ack 3, win 512, options [nop,nop,TS val 3512863070 ecr 3512863058], length 10
2022-04-07 18:37:43.519165 IP (tos 0x0, ttl 64, id 21314, offset 0, flags [DF], proto TCP (6), length 52)
    127.0.0.1.11750 > 127.0.0.1.53244: Flags [.], cksum 0xfe28 (incorrect -> 0xb844), seq 3, ack 14, win 512, options [nop,nop,TS val 3512863070 ecr 3512863070], length 0
2022-04-07 18:37:54.521129 IP (tos 0x0, ttl 64, id 21315, offset 0, flags [DF], proto TCP (6), length 62)
    127.0.0.1.11750 > 127.0.0.1.53244: Flags [P.], cksum 0xfe32 (incorrect -> 0x8837), seq 3:13, ack 14, win 512, options [nop,nop,TS val 3512874072 ecr 3512863070], length 10
2022-04-07 18:37:54.521143 IP (tos 0x0, ttl 64, id 11880, offset 0, flags [DF], proto TCP (6), length 52)
    127.0.0.1.53244 > 127.0.0.1.11750: Flags [.], cksum 0xfe28 (incorrect -> 0x6246), seq 14, ack 13, win 512, options [nop,nop,TS val 3512874072 ecr 3512874072], length 0
2022-04-07 18:37:54.526934 IP (tos 0x0, ttl 64, id 11881, offset 0, flags [DF], proto TCP (6), length 569)
    127.0.0.1.53244 > 127.0.0.1.11750: Flags [P.], cksum 0x002e (incorrect -> 0x3f6b), seq 14:531, ack 13, win 512, options [nop,nop,TS val 3512874078 ecr 3512874072], length 517
2022-04-07 18:37:54.526949 IP (tos 0x0, ttl 64, id 21316, offset 0, flags [DF], proto TCP (6), length 52)
    127.0.0.1.11750 > 127.0.0.1.53244: Flags [.], cksum 0xfe28 (incorrect -> 0x6039), seq 13, ack 531, win 508, options [nop,nop,TS val 3512874078 ecr 3512874078], length 0
2022-04-07 18:37:54.584564 IP (tos 0x0, ttl 64, id 21317, offset 0, flags [DF], proto TCP (6), length 3097)
    127.0.0.1.11750 > 127.0.0.1.53244: Flags [P.], cksum 0x0a0e (incorrect -> 0x3370), seq 13:3058, ack 531, win 512, options [nop,nop,TS val 3512874136 ecr 3512874078], length 3045
2022-04-07 18:37:54.584581 IP (tos 0x0, ttl 64, id 11882, offset 0, flags [DF], proto TCP (6), length 52)
    127.0.0.1.53244 > 127.0.0.1.11750: Flags [.], cksum 0xfe28 (incorrect -> 0x53ec), seq 531, ack 3058, win 496, options [nop,nop,TS val 3512874136 ecr 3512874136], length 0
2022-04-07 18:37:54.585258 IP (tos 0x0, ttl 64, id 11883, offset 0, flags [DF], proto TCP (6), length 132)
    127.0.0.1.53244 > 127.0.0.1.11750: Flags [P.], cksum 0xfe78 (incorrect -> 0x00f6), seq 531:611, ack 3058, win 512, options [nop,nop,TS val 3512874137 ecr 3512874136], length 80
2022-04-07 18:37:54.585265 IP (tos 0x0, ttl 64, id 21318, offset 0, flags [DF], proto TCP (6), length 52)
    127.0.0.1.11750 > 127.0.0.1.53244: Flags [.], cksum 0xfe28 (incorrect -> 0x538a), seq 3058, ack 611, win 512, options [nop,nop,TS val 3512874137 ecr 3512874137], length 0
2022-04-07 18:37:54.585677 IP (tos 0x0, ttl 64, id 11884, offset 0, flags [DF], proto TCP (6), length 393)
    127.0.0.1.53244 > 127.0.0.1.11750: Flags [P.], cksum 0xff7d (incorrect -> 0x1bb0), seq 611:952, ack 3058, win 512, options [nop,nop,TS val 3512874137 ecr 3512874137], length 341
2022-04-07 18:37:54.585680 IP (tos 0x0, ttl 64, id 21319, offset 0, flags [DF], proto TCP (6), length 52)
    127.0.0.1.11750 > 127.0.0.1.53244: Flags [.], cksum 0xfe28 (incorrect -> 0x5237), seq 3058, ack 952, win 510, options [nop,nop,TS val 3512874137 ecr 3512874137], length 0
2022-04-07 18:37:54.653864 IP (tos 0x0, ttl 64, id 21320, offset 0, flags [DF], proto TCP (6), length 594)
    127.0.0.1.11750 > 127.0.0.1.53244: Flags [P.], cksum 0x0047 (incorrect -> 0x8eb5), seq 3058:3600, ack 952, win 512, options [nop,nop,TS val 3512874205 ecr 3512874137], length 542
2022-04-07 18:37:54.653871 IP (tos 0x0, ttl 64, id 11885, offset 0, flags [DF], proto TCP (6), length 52)
    127.0.0.1.53244 > 127.0.0.1.11750: Flags [.], cksum 0xfe28 (incorrect -> 0x4f93), seq 952, ack 3600, win 508, options [nop,nop,TS val 3512874205 ecr 3512874205], length 0
2022-04-07 18:37:54.670804 IP (tos 0x0, ttl 64, id 21321, offset 0, flags [DF], proto TCP (6), length 3538)
    127.0.0.1.11750 > 127.0.0.1.53244: Flags [P.], cksum 0x0bc7 (incorrect -> 0x304d), seq 3600:7086, ack 952, win 512, options [nop,nop,TS val 3512874222 ecr 3512874205], length 3486
2022-04-07 18:37:54.670808 IP (tos 0x0, ttl 64, id 11886, offset 0, flags [DF], proto TCP (6), length 52)
    127.0.0.1.53244 > 127.0.0.1.11750: Flags [.], cksum 0xfe28 (incorrect -> 0x41e1), seq 952, ack 7086, win 494, options [nop,nop,TS val 3512874222 ecr 3512874222], length 0
2022-04-07 18:37:54.680102 IP (tos 0x0, ttl 64, id 21322, offset 0, flags [DF], proto TCP (6), length 910)
    127.0.0.1.11750 > 127.0.0.1.53244: Flags [P.], cksum 0x0183 (incorrect -> 0xa5c3), seq 7086:7944, ack 952, win 512, options [nop,nop,TS val 3512874231 ecr 3512874222], length 858
2022-04-07 18:37:54.680108 IP (tos 0x0, ttl 64, id 11887, offset 0, flags [DF], proto TCP (6), length 52)
    127.0.0.1.53244 > 127.0.0.1.11750: Flags [.], cksum 0xfe28 (incorrect -> 0x3e6b), seq 952, ack 7944, win 504, options [nop,nop,TS val 3512874231 ecr 3512874231], length 0
2022-04-07 18:37:54.681563 IP (tos 0x0, ttl 64, id 21323, offset 0, flags [DF], proto TCP (6), length 3538)
    127.0.0.1.11750 > 127.0.0.1.53244: Flags [P.], cksum 0x0bc7 (incorrect -> 0x0596), seq 7944:11430, ack 952, win 512, options [nop,nop,TS val 3512874233 ecr 3512874231], length 3486
2022-04-07 18:37:54.681567 IP (tos 0x0, ttl 64, id 11888, offset 0, flags [DF], proto TCP (6), length 52)
    127.0.0.1.53244 > 127.0.0.1.11750: Flags [.], cksum 0xfe28 (incorrect -> 0x30d3), seq 952, ack 11430, win 494, options [nop,nop,TS val 3512874233 ecr 3512874233], length 0
2022-04-07 18:37:54.683360 IP (tos 0x0, ttl 64, id 21324, offset 0, flags [DF], proto TCP (6), length 4100)
    127.0.0.1.11750 > 127.0.0.1.53244: Flags [P.], cksum 0x0df9 (incorrect -> 0xa5cc), seq 11430:15478, ack 952, win 512, options [nop,nop,TS val 3512874235 ecr 3512874233], length 4048
2022-04-07 18:37:54.683364 IP (tos 0x0, ttl 64, id 11889, offset 0, flags [DF], proto TCP (6), length 52)
    127.0.0.1.53244 > 127.0.0.1.11750: Flags [.], cksum 0xfe28 (incorrect -> 0x2101), seq 952, ack 15478, win 492, options [nop,nop,TS val 3512874235 ecr 3512874235], length 0
2022-04-07 18:37:54.683368 IP (tos 0x0, ttl 64, id 21325, offset 0, flags [DF], proto TCP (6), length 486)
    127.0.0.1.11750 > 127.0.0.1.53244: Flags [P.], cksum 0xffda (incorrect -> 0xaa69), seq 15478:15912, ack 952, win 512, options [nop,nop,TS val 3512874235 ecr 3512874235], length 434
2022-04-07 18:37:54.683370 IP (tos 0x0, ttl 64, id 11890, offset 0, flags [DF], proto TCP (6), length 52)
    127.0.0.1.53244 > 127.0.0.1.11750: Flags [.], cksum 0xfe28 (incorrect -> 0x1f51), seq 952, ack 15912, win 490, options [nop,nop,TS val 3512874235 ecr 3512874235], length 0
2022-04-07 18:37:54.689378 IP (tos 0x0, ttl 64, id 21326, offset 0, flags [DF], proto TCP (6), length 3538)
    127.0.0.1.11750 > 127.0.0.1.53244: Flags [P.], cksum 0x0bc7 (incorrect -> 0xa241), seq 15912:19398, ack 952, win 512, options [nop,nop,TS val 3512874241 ecr 3512874235], length 3486
2022-04-07 18:37:54.689381 IP (tos 0x0, ttl 64, id 11891, offset 0, flags [DF], proto TCP (6), length 52)
    127.0.0.1.53244 > 127.0.0.1.11750: Flags [.], cksum 0xfe28 (incorrect -> 0x11a3), seq 952, ack 19398, win 494, options [nop,nop,TS val 3512874241 ecr 3512874241], length 0
2022-04-07 18:37:54.699705 IP (tos 0x0, ttl 64, id 21327, offset 0, flags [DF], proto TCP (6), length 3538)
    127.0.0.1.11750 > 127.0.0.1.53244: Flags [P.], cksum 0x0bc7 (incorrect -> 0x15f9), seq 19398:22884, ack 952, win 512, options [nop,nop,TS val 3512874251 ecr 3512874241], length 3486
2022-04-07 18:37:54.699709 IP (tos 0x0, ttl 64, id 11892, offset 0, flags [DF], proto TCP (6), length 52)
    127.0.0.1.53244 > 127.0.0.1.11750: Flags [.], cksum 0xfe28 (incorrect -> 0x03f1), seq 952, ack 22884, win 494, options [nop,nop,TS val 3512874251 ecr 3512874251], length 0
2022-04-07 18:37:54.701131 IP (tos 0x0, ttl 64, id 21328, offset 0, flags [DF], proto TCP (6), length 4100)
    127.0.0.1.11750 > 127.0.0.1.53244: Flags [P.], cksum 0x0df9 (incorrect -> 0x30fc), seq 22884:26932, ack 952, win 512, options [nop,nop,TS val 3512874252 ecr 3512874251], length 4048
2022-04-07 18:37:54.701136 IP (tos 0x0, ttl 64, id 11893, offset 0, flags [DF], proto TCP (6), length 52)
    127.0.0.1.53244 > 127.0.0.1.11750: Flags [.], cksum 0xfe28 (incorrect -> 0xf420), seq 952, ack 26932, win 492, options [nop,nop,TS val 3512874252 ecr 3512874252], length 0
2022-04-07 18:37:54.701141 IP (tos 0x0, ttl 64, id 21329, offset 0, flags [DF], proto TCP (6), length 3474)
    127.0.0.1.11750 > 127.0.0.1.53244: Flags [P.], cksum 0x0b87 (incorrect -> 0xa890), seq 26932:30354, ack 952, win 512, options [nop,nop,TS val 3512874252 ecr 3512874252], length 3422
2022-04-07 18:37:54.701143 IP (tos 0x0, ttl 64, id 11894, offset 0, flags [DF], proto TCP (6), length 52)
    127.0.0.1.53244 > 127.0.0.1.11750: Flags [.], cksum 0xfe28 (incorrect -> 0xe6d0), seq 952, ack 30354, win 478, options [nop,nop,TS val 3512874252 ecr 3512874252], length 0
2022-04-07 18:37:54.701170 IP (tos 0x0, ttl 64, id 21330, offset 0, flags [DF], proto TCP (6), length 4036)
    127.0.0.1.11750 > 127.0.0.1.53244: Flags [P.], cksum 0x0db9 (incorrect -> 0x1bd2), seq 30354:34338, ack 952, win 512, options [nop,nop,TS val 3512874252 ecr 3512874252], length 3984
2022-04-07 18:37:54.701172 IP (tos 0x0, ttl 64, id 11895, offset 0, flags [DF], proto TCP (6), length 52)
    127.0.0.1.53244 > 127.0.0.1.11750: Flags [.], cksum 0xfe28 (incorrect -> 0xd74f), seq 952, ack 34338, win 463, options [nop,nop,TS val 3512874252 ecr 3512874252], length 0
2022-04-07 18:37:54.709034 IP (tos 0x0, ttl 64, id 21331, offset 0, flags [DF], proto TCP (6), length 2044)
    127.0.0.1.11750 > 127.0.0.1.53244: Flags [P.], cksum 0x05f1 (incorrect -> 0xc17b), seq 34338:36330, ack 952, win 512, options [nop,nop,TS val 3512874260 ecr 3512874252], length 1992
2022-04-07 18:37:54.709045 IP (tos 0x0, ttl 64, id 11896, offset 0, flags [DF], proto TCP (6), length 52)
    127.0.0.1.53244 > 127.0.0.1.11750: Flags [.], cksum 0xfe28 (incorrect -> 0xcf46), seq 952, ack 36330, win 512, options [nop,nop,TS val 3512874260 ecr 3512874260], length 0
2022-04-07 18:37:54.722378 IP (tos 0x0, ttl 64, id 21332, offset 0, flags [DF], proto TCP (6), length 2044)
    127.0.0.1.11750 > 127.0.0.1.53244: Flags [P.], cksum 0x05f1 (incorrect -> 0xffbb), seq 36330:38322, ack 952, win 512, options [nop,nop,TS val 3512874274 ecr 3512874260], length 1992
2022-04-07 18:37:54.741352 IP (tos 0x0, ttl 64, id 21333, offset 0, flags [DF], proto TCP (6), length 32820)
    127.0.0.1.11750 > 127.0.0.1.53244: Flags [.], cksum 0x7e29 (incorrect -> 0x689c), seq 38322:71090, ack 952, win 512, options [nop,nop,TS val 3512874293 ecr 3512874260], length 32768
2022-04-07 18:37:54.741368 IP (tos 0x0, ttl 64, id 11897, offset 0, flags [DF], proto TCP (6), length 52)
    127.0.0.1.53244 > 127.0.0.1.11750: Flags [.], cksum 0xfe28 (incorrect -> 0x47d4), seq 952, ack 71090, win 379, options [nop,nop,TS val 3512874293 ecr 3512874274], length 0
2022-04-07 18:37:54.741371 IP (tos 0x0, ttl 64, id 21334, offset 0, flags [DF], proto TCP (6), length 1924)
    127.0.0.1.11750 > 127.0.0.1.53244: Flags [P.], cksum 0x0579 (incorrect -> 0xece9), seq 71090:72962, ack 952, win 512, options [nop,nop,TS val 3512874293 ecr 3512874293], length 1872
2022-04-07 18:37:54.742106 IP (tos 0x0, ttl 64, id 11898, offset 0, flags [DF], proto TCP (6), length 52)
    127.0.0.1.53244 > 127.0.0.1.11750: Flags [.], cksum 0xfe28 (incorrect -> 0x3fec), seq 952, ack 72962, win 512, options [nop,nop,TS val 3512874293 ecr 3512874293], length 0
2022-04-07 18:37:54.743543 IP (tos 0x0, ttl 64, id 21335, offset 0, flags [DF], proto TCP (6), length 4100)
    127.0.0.1.11750 > 127.0.0.1.53244: Flags [P.], cksum 0x0df9 (incorrect -> 0x0241), seq 72962:77010, ack 952, win 512, options [nop,nop,TS val 3512874295 ecr 3512874293], length 4048
2022-04-07 18:37:54.743562 IP (tos 0x0, ttl 64, id 11899, offset 0, flags [DF], proto TCP (6), length 52)
    127.0.0.1.53244 > 127.0.0.1.11750: Flags [.], cksum 0xfe28 (incorrect -> 0x3018), seq 952, ack 77010, win 512, options [nop,nop,TS val 3512874295 ecr 3512874295], length 0
2022-04-07 18:37:54.743564 IP (tos 0x0, ttl 64, id 21336, offset 0, flags [DF], proto TCP (6), length 486)
    127.0.0.1.11750 > 127.0.0.1.53244: Flags [P.], cksum 0xffda (incorrect -> 0x97f3), seq 77010:77444, ack 952, win 512, options [nop,nop,TS val 3512874295 ecr 3512874295], length 434
2022-04-07 18:37:54.743566 IP (tos 0x0, ttl 64, id 11900, offset 0, flags [DF], proto TCP (6), length 52)
    127.0.0.1.53244 > 127.0.0.1.11750: Flags [.], cksum 0xfe28 (incorrect -> 0x2e66), seq 952, ack 77444, win 512, options [nop,nop,TS val 3512874295 ecr 3512874295], length 0
2022-04-07 18:37:54.744563 IP (tos 0x0, ttl 64, id 21337, offset 0, flags [DF], proto TCP (6), length 4100)
    127.0.0.1.11750 > 127.0.0.1.53244: Flags [P.], cksum 0x0df9 (incorrect -> 0xe434), seq 77444:81492, ack 952, win 512, options [nop,nop,TS val 3512874296 ecr 3512874295], length 4048
2022-04-07 18:37:54.744573 IP (tos 0x0, ttl 64, id 11901, offset 0, flags [DF], proto TCP (6), length 52)
    127.0.0.1.53244 > 127.0.0.1.11750: Flags [.], cksum 0xfe28 (incorrect -> 0x1e94), seq 952, ack 81492, win 512, options [nop,nop,TS val 3512874296 ecr 3512874296], length 0
2022-04-07 18:37:54.744575 IP (tos 0x0, ttl 64, id 21338, offset 0, flags [DF], proto TCP (6), length 1482)
    127.0.0.1.11750 > 127.0.0.1.53244: Flags [P.], cksum 0x03bf (incorrect -> 0xbfd2), seq 81492:82922, ack 952, win 512, options [nop,nop,TS val 3512874296 ecr 3512874296], length 1430
2022-04-07 18:37:54.744578 IP (tos 0x0, ttl 64, id 11902, offset 0, flags [DF], proto TCP (6), length 52)
    127.0.0.1.53244 > 127.0.0.1.11750: Flags [.], cksum 0xfe28 (incorrect -> 0x18fe), seq 952, ack 82922, win 512, options [nop,nop,TS val 3512874296 ecr 3512874296], length 0
2022-04-07 18:37:54.761233 IP (tos 0x0, ttl 64, id 21339, offset 0, flags [DF], proto TCP (6), length 2044)
    127.0.0.1.11750 > 127.0.0.1.53244: Flags [P.], cksum 0x05f1 (incorrect -> 0x6f6e), seq 82922:84914, ack 952, win 512, options [nop,nop,TS val 3512874313 ecr 3512874296], length 1992
2022-04-07 18:37:54.761501 IP (tos 0x0, ttl 64, id 11903, offset 0, flags [DF], proto TCP (6), length 52)
    127.0.0.1.53244 > 127.0.0.1.11750: Flags [.], cksum 0xfe28 (incorrect -> 0x1114), seq 952, ack 84914, win 512, options [nop,nop,TS val 3512874313 ecr 3512874313], length 0
2022-04-07 18:37:54.767390 IP (tos 0x0, ttl 64, id 21340, offset 0, flags [DF], proto TCP (6), length 4100)
    127.0.0.1.11750 > 127.0.0.1.53244: Flags [P.], cksum 0x0df9 (incorrect -> 0x03d9), seq 84914:88962, ack 952, win 512, options [nop,nop,TS val 3512874319 ecr 3512874313], length 4048
2022-04-07 18:37:54.767448 IP (tos 0x0, ttl 64, id 11904, offset 0, flags [DF], proto TCP (6), length 52)
    127.0.0.1.53244 > 127.0.0.1.11750: Flags [.], cksum 0xfe28 (incorrect -> 0x0138), seq 952, ack 88962, win 512, options [nop,nop,TS val 3512874319 ecr 3512874319], length 0
2022-04-07 18:37:54.767452 IP (tos 0x0, ttl 64, id 21341, offset 0, flags [DF], proto TCP (6), length 7388)
    127.0.0.1.11750 > 127.0.0.1.53244: Flags [P.], cksum 0x1ad1 (incorrect -> 0xaedb), seq 88962:96298, ack 952, win 512, options [nop,nop,TS val 3512874319 ecr 3512874319], length 7336
2022-04-07 18:37:54.767455 IP (tos 0x0, ttl 64, id 11905, offset 0, flags [DF], proto TCP (6), length 52)
    127.0.0.1.53244 > 127.0.0.1.11750: Flags [.], cksum 0xfe28 (incorrect -> 0xe48f), seq 952, ack 96298, win 512, options [nop,nop,TS val 3512874319 ecr 3512874319], length 0
2022-04-07 18:37:54.771729 IP (tos 0x0, ttl 64, id 21342, offset 0, flags [DF], proto TCP (6), length 2994)
    127.0.0.1.11750 > 127.0.0.1.53244: Flags [P.], cksum 0x09a7 (incorrect -> 0x8747), seq 96298:99240, ack 952, win 512, options [nop,nop,TS val 3512874323 ecr 3512874319], length 2942
2022-04-07 18:37:54.771740 IP (tos 0x0, ttl 64, id 11906, offset 0, flags [DF], proto TCP (6), length 52)
    127.0.0.1.53244 > 127.0.0.1.11750: Flags [.], cksum 0xfe28 (incorrect -> 0xd909), seq 952, ack 99240, win 512, options [nop,nop,TS val 3512874323 ecr 3512874323], length 0
2022-04-07 18:37:54.776586 IP (tos 0x0, ttl 64, id 21343, offset 0, flags [DF], proto TCP (6), length 1546)
    127.0.0.1.11750 > 127.0.0.1.53244: Flags [P.], cksum 0x03ff (incorrect -> 0x6110), seq 99240:100734, ack 952, win 512, options [nop,nop,TS val 3512874328 ecr 3512874323], length 1494
2022-04-07 18:37:54.777141 IP (tos 0x0, ttl 64, id 11907, offset 0, flags [DF], proto TCP (6), length 52)
    127.0.0.1.53244 > 127.0.0.1.11750: Flags [.], cksum 0xfe28 (incorrect -> 0xd329), seq 952, ack 100734, win 512, options [nop,nop,TS val 3512874328 ecr 3512874328], length 0
2022-04-07 18:37:54.784030 IP (tos 0x0, ttl 64, id 21344, offset 0, flags [DF], proto TCP (6), length 3538)
    127.0.0.1.11750 > 127.0.0.1.53244: Flags [P.], cksum 0x0bc7 (incorrect -> 0x56c3), seq 100734:104220, ack 952, win 512, options [nop,nop,TS val 3512874335 ecr 3512874328], length 3486
2022-04-07 18:37:54.784055 IP (tos 0x0, ttl 64, id 11908, offset 0, flags [DF], proto TCP (6), length 52)
    127.0.0.1.53244 > 127.0.0.1.11750: Flags [.], cksum 0xfe28 (incorrect -> 0xc57d), seq 952, ack 104220, win 512, options [nop,nop,TS val 3512874335 ecr 3512874335], length 0
2022-04-07 18:37:54.784120 IP (tos 0x0, ttl 64, id 21345, offset 0, flags [DF], proto TCP (6), length 4100)
    127.0.0.1.11750 > 127.0.0.1.53244: Flags [P.], cksum 0x0df9 (incorrect -> 0xf9c5), seq 104220:108268, ack 952, win 512, options [nop,nop,TS val 3512874335 ecr 3512874335], length 4048
2022-04-07 18:37:54.784660 IP (tos 0x0, ttl 64, id 11909, offset 0, flags [DF], proto TCP (6), length 52)
    127.0.0.1.53244 > 127.0.0.1.11750: Flags [.], cksum 0xfe28 (incorrect -> 0xb5ac), seq 952, ack 108268, win 512, options [nop,nop,TS val 3512874336 ecr 3512874335], length 0
2022-04-07 18:37:54.784666 IP (tos 0x0, ttl 64, id 21346, offset 0, flags [DF], proto TCP (6), length 3972)
    127.0.0.1.11750 > 127.0.0.1.53244: Flags [P.], cksum 0x0d79 (incorrect -> 0x46b6), seq 108268:112188, ack 952, win 512, options [nop,nop,TS val 3512874336 ecr 3512874336], length 3920
2022-04-07 18:37:54.784672 IP (tos 0x0, ttl 64, id 11910, offset 0, flags [DF], proto TCP (6), length 52)
    127.0.0.1.53244 > 127.0.0.1.11750: Flags [.], cksum 0xfe28 (incorrect -> 0xa65b), seq 952, ack 112188, win 512, options [nop,nop,TS val 3512874336 ecr 3512874336], length 0
2022-04-07 18:37:54.786831 IP (tos 0x0, ttl 64, id 21347, offset 0, flags [DF], proto TCP (6), length 2044)
    127.0.0.1.11750 > 127.0.0.1.53244: Flags [P.], cksum 0x05f1 (incorrect -> 0x1eec), seq 112188:114180, ack 952, win 512, options [nop,nop,TS val 3512874338 ecr 3512874336], length 1992
2022-04-07 18:37:54.786842 IP (tos 0x0, ttl 64, id 11911, offset 0, flags [DF], proto TCP (6), length 52)
    127.0.0.1.53244 > 127.0.0.1.11750: Flags [.], cksum 0xfe28 (incorrect -> 0x9e8f), seq 952, ack 114180, win 512, options [nop,nop,TS val 3512874338 ecr 3512874338], length 0
2022-04-07 18:37:54.793283 IP (tos 0x0, ttl 64, id 21348, offset 0, flags [DF], proto TCP (6), length 910)
    127.0.0.1.11750 > 127.0.0.1.53244: Flags [P.], cksum 0x0183 (incorrect -> 0x5f20), seq 114180:115038, ack 952, win 512, options [nop,nop,TS val 3512874345 ecr 3512874338], length 858
2022-04-07 18:37:54.793301 IP (tos 0x0, ttl 64, id 11912, offset 0, flags [DF], proto TCP (6), length 52)
    127.0.0.1.53244 > 127.0.0.1.11750: Flags [.], cksum 0xfe28 (incorrect -> 0x9b27), seq 952, ack 115038, win 512, options [nop,nop,TS val 3512874345 ecr 3512874345], length 0
2022-04-07 18:37:54.798145 IP (tos 0x0, ttl 64, id 21349, offset 0, flags [DF], proto TCP (6), length 1048)
    127.0.0.1.11750 > 127.0.0.1.53244: Flags [P.], cksum 0x020d (incorrect -> 0xb0fd), seq 115038:116034, ack 952, win 512, options [nop,nop,TS val 3512874349 ecr 3512874345], length 996
2022-04-07 18:37:54.798157 IP (tos 0x0, ttl 64, id 11913, offset 0, flags [DF], proto TCP (6), length 52)
    127.0.0.1.53244 > 127.0.0.1.11750: Flags [.], cksum 0xfe28 (incorrect -> 0x973b), seq 952, ack 116034, win 512, options [nop,nop,TS val 3512874349 ecr 3512874349], length 0
200, 6.632044315338135, 11.366186380386353