2022-04-07 07:53:30.887809 IP (tos 0x0, ttl 64, id 53649, offset 0, flags [DF], proto TCP (6), length 60)
    127.0.0.1.46984 > 127.0.0.1.10650: Flags [S], cksum 0xfe30 (incorrect -> 0xd72f), seq 1947340211, win 65495, options [mss 65495,sackOK,TS val 400293390 ecr 0,nop,wscale 7], length 0
2022-04-07 07:53:30.887822 IP (tos 0x0, ttl 64, id 0, offset 0, flags [DF], proto TCP (6), length 60)
    127.0.0.1.10650 > 127.0.0.1.46984: Flags [S.], cksum 0xfe30 (incorrect -> 0x65ce), seq 2928979165, ack 1947340212, win 65483, options [mss 65495,sackOK,TS val 400293390 ecr 400293390,nop,wscale 7], length 0
2022-04-07 07:53:30.887833 IP (tos 0x0, ttl 64, id 53650, offset 0, flags [DF], proto TCP (6), length 52)
    127.0.0.1.46984 > 127.0.0.1.10650: Flags [.], cksum 0xfe28 (incorrect -> 0x8c8a), seq 1, ack 1, win 512, options [nop,nop,TS val 400293390 ecr 400293390], length 0
2022-04-07 07:53:30.887939 IP (tos 0x0, ttl 64, id 53651, offset 0, flags [DF], proto TCP (6), length 55)
    127.0.0.1.46984 > 127.0.0.1.10650: Flags [P.], cksum 0xfe2b (incorrect -> 0x877e), seq 1:4, ack 1, win 512, options [nop,nop,TS val 400293390 ecr 400293390], length 3
2022-04-07 07:53:30.887953 IP (tos 0x0, ttl 64, id 16806, offset 0, flags [DF], proto TCP (6), length 52)
    127.0.0.1.10650 > 127.0.0.1.46984: Flags [.], cksum 0xfe28 (incorrect -> 0x8c87), seq 1, ack 4, win 512, options [nop,nop,TS val 400293390 ecr 400293390], length 0
2022-04-07 07:53:30.887991 IP (tos 0x0, ttl 64, id 16807, offset 0, flags [DF], proto TCP (6), length 54)
    127.0.0.1.10650 > 127.0.0.1.46984: Flags [P.], cksum 0xfe2a (incorrect -> 0x877d), seq 1:3, ack 4, win 512, options [nop,nop,TS val 400293390 ecr 400293390], length 2
2022-04-07 07:53:30.888006 IP (tos 0x0, ttl 64, id 53652, offset 0, flags [DF], proto TCP (6), length 52)
    127.0.0.1.46984 > 127.0.0.1.10650: Flags [.], cksum 0xfe28 (incorrect -> 0x8c85), seq 4, ack 3, win 512, options [nop,nop,TS val 400293390 ecr 400293390], length 0
2022-04-07 07:53:30.889565 IP (tos 0x0, ttl 64, id 53653, offset 0, flags [DF], proto TCP (6), length 62)
    127.0.0.1.46984 > 127.0.0.1.10650: Flags [P.], cksum 0xfe32 (incorrect -> 0x0a83), seq 4:14, ack 3, win 512, options [nop,nop,TS val 400293392 ecr 400293390], length 10
2022-04-07 07:53:30.889583 IP (tos 0x0, ttl 64, id 16808, offset 0, flags [DF], proto TCP (6), length 52)
    127.0.0.1.10650 > 127.0.0.1.46984: Flags [.], cksum 0xfe28 (incorrect -> 0x8c77), seq 3, ack 14, win 512, options [nop,nop,TS val 400293392 ecr 400293392], length 0
2022-04-07 07:53:30.974598 IP (tos 0x0, ttl 64, id 16809, offset 0, flags [DF], proto TCP (6), length 62)
    127.0.0.1.10650 > 127.0.0.1.46984: Flags [P.], cksum 0xfe32 (incorrect -> 0x870f), seq 3:13, ack 14, win 512, options [nop,nop,TS val 400293477 ecr 400293392], length 10
2022-04-07 07:53:30.974615 IP (tos 0x0, ttl 64, id 53654, offset 0, flags [DF], proto TCP (6), length 52)
    127.0.0.1.46984 > 127.0.0.1.10650: Flags [.], cksum 0xfe28 (incorrect -> 0x8bc3), seq 14, ack 13, win 512, options [nop,nop,TS val 400293477 ecr 400293477], length 0
2022-04-07 07:53:30.980497 IP (tos 0x0, ttl 64, id 53655, offset 0, flags [DF], proto TCP (6), length 569)
    127.0.0.1.46984 > 127.0.0.1.10650: Flags [P.], cksum 0x002e (incorrect -> 0xa2a0), seq 14:531, ack 13, win 512, options [nop,nop,TS val 400293483 ecr 400293477], length 517
2022-04-07 07:53:30.980512 IP (tos 0x0, ttl 64, id 16810, offset 0, flags [DF], proto TCP (6), length 52)
    127.0.0.1.10650 > 127.0.0.1.46984: Flags [.], cksum 0xfe28 (incorrect -> 0x89b6), seq 13, ack 531, win 508, options [nop,nop,TS val 400293483 ecr 400293483], length 0
200, 3.7670888900756836, 0.4136955738067627