2022-04-07 20:32:14.124649 IP (tos 0x0, ttl 64, id 65088, offset 0, flags [DF], proto TCP (6), length 60)
    127.0.0.1.52552 > 127.0.0.1.11850: Flags [S], cksum 0xfe30 (incorrect -> 0x000a), seq 1979591919, win 65495, options [mss 65495,sackOK,TS val 3519733676 ecr 0,nop,wscale 7], length 0
2022-04-07 20:32:14.124663 IP (tos 0x0, ttl 64, id 0, offset 0, flags [DF], proto TCP (6), length 60)
    127.0.0.1.11850 > 127.0.0.1.52552: Flags [S.], cksum 0xfe30 (incorrect -> 0x1efb), seq 3699200788, ack 1979591920, win 65483, options [mss 65495,sackOK,TS val 3519733676 ecr 3519733676,nop,wscale 7], length 0
2022-04-07 20:32:14.124674 IP (tos 0x0, ttl 64, id 65089, offset 0, flags [DF], proto TCP (6), length 52)
    127.0.0.1.52552 > 127.0.0.1.11850: Flags [.], cksum 0xfe28 (incorrect -> 0x45b7), seq 1, ack 1, win 512, options [nop,nop,TS val 3519733676 ecr 3519733676], length 0
2022-04-07 20:32:14.124773 IP (tos 0x0, ttl 64, id 65090, offset 0, flags [DF], proto TCP (6), length 55)
    127.0.0.1.52552 > 127.0.0.1.11850: Flags [P.], cksum 0xfe2b (incorrect -> 0x40ab), seq 1:4, ack 1, win 512, options [nop,nop,TS val 3519733676 ecr 3519733676], length 3
2022-04-07 20:32:14.124779 IP (tos 0x0, ttl 64, id 17224, offset 0, flags [DF], proto TCP (6), length 52)
    127.0.0.1.11850 > 127.0.0.1.52552: Flags [.], cksum 0xfe28 (incorrect -> 0x45b4), seq 1, ack 4, win 512, options [nop,nop,TS val 3519733676 ecr 3519733676], length 0
2022-04-07 20:32:14.124879 IP (tos 0x0, ttl 64, id 17225, offset 0, flags [DF], proto TCP (6), length 54)
    127.0.0.1.11850 > 127.0.0.1.52552: Flags [P.], cksum 0xfe2a (incorrect -> 0x40aa), seq 1:3, ack 4, win 512, options [nop,nop,TS val 3519733676 ecr 3519733676], length 2
2022-04-07 20:32:14.124908 IP (tos 0x0, ttl 64, id 65091, offset 0, flags [DF], proto TCP (6), length 52)
    127.0.0.1.52552 > 127.0.0.1.11850: Flags [.], cksum 0xfe28 (incorrect -> 0x45b2), seq 4, ack 3, win 512, options [nop,nop,TS val 3519733676 ecr 3519733676], length 0
2022-04-07 20:32:14.137107 IP (tos 0x0, ttl 64, id 65092, offset 0, flags [DF], proto TCP (6), length 62)
    127.0.0.1.52552 > 127.0.0.1.11850: Flags [P.], cksum 0xfe32 (incorrect -> 0xd164), seq 4:14, ack 3, win 512, options [nop,nop,TS val 3519733688 ecr 3519733676], length 10
2022-04-07 20:32:14.137133 IP (tos 0x0, ttl 64, id 17226, offset 0, flags [DF], proto TCP (6), length 52)
    127.0.0.1.11850 > 127.0.0.1.52552: Flags [.], cksum 0xfe28 (incorrect -> 0x4590), seq 3, ack 14, win 512, options [nop,nop,TS val 3519733688 ecr 3519733688], length 0
2022-04-07 20:32:14.254719 IP (tos 0x0, ttl 64, id 17227, offset 0, flags [DF], proto TCP (6), length 62)
    127.0.0.1.11850 > 127.0.0.1.52552: Flags [P.], cksum 0xfe32 (incorrect -> 0x4007), seq 3:13, ack 14, win 512, options [nop,nop,TS val 3519733806 ecr 3519733688], length 10
2022-04-07 20:32:14.254730 IP (tos 0x0, ttl 64, id 65093, offset 0, flags [DF], proto TCP (6), length 52)
    127.0.0.1.52552 > 127.0.0.1.11850: Flags [.], cksum 0xfe28 (incorrect -> 0x449a), seq 14, ack 13, win 512, options [nop,nop,TS val 3519733806 ecr 3519733806], length 0
2022-04-07 20:32:14.260458 IP (tos 0x0, ttl 64, id 65094, offset 0, flags [DF], proto TCP (6), length 569)
    127.0.0.1.52552 > 127.0.0.1.11850: Flags [P.], cksum 0x002e (incorrect -> 0xeb85), seq 14:531, ack 13, win 512, options [nop,nop,TS val 3519733812 ecr 3519733806], length 517
2022-04-07 20:32:14.260467 IP (tos 0x0, ttl 64, id 17228, offset 0, flags [DF], proto TCP (6), length 52)
    127.0.0.1.11850 > 127.0.0.1.52552: Flags [.], cksum 0xfe28 (incorrect -> 0x428d), seq 13, ack 531, win 508, options [nop,nop,TS val 3519733812 ecr 3519733812], length 0
403, 6.549107551574707, 0.35372114181518555