2022-04-07 15:40:50.346732 IP (tos 0x0, ttl 64, id 4462, offset 0, flags [DF], proto TCP (6), length 60)
    127.0.0.1.48998 > 127.0.0.1.9650: Flags [S], cksum 0xfe30 (incorrect -> 0xcc2c), seq 3240621353, win 65495, options [mss 65495,sackOK,TS val 3502249898 ecr 0,nop,wscale 7], length 0
2022-04-07 15:40:50.346743 IP (tos 0x0, ttl 64, id 0, offset 0, flags [DF], proto TCP (6), length 60)
    127.0.0.1.9650 > 127.0.0.1.48998: Flags [S.], cksum 0xfe30 (incorrect -> 0x93dc), seq 2225785653, ack 3240621354, win 65483, options [mss 65495,sackOK,TS val 3502249898 ecr 3502249898,nop,wscale 7], length 0
2022-04-07 15:40:50.346753 IP (tos 0x0, ttl 64, id 4463, offset 0, flags [DF], proto TCP (6), length 52)
    127.0.0.1.48998 > 127.0.0.1.9650: Flags [.], cksum 0xfe28 (incorrect -> 0xba98), seq 1, ack 1, win 512, options [nop,nop,TS val 3502249898 ecr 3502249898], length 0
2022-04-07 15:40:50.346891 IP (tos 0x0, ttl 64, id 4464, offset 0, flags [DF], proto TCP (6), length 55)
    127.0.0.1.48998 > 127.0.0.1.9650: Flags [P.], cksum 0xfe2b (incorrect -> 0xb58c), seq 1:4, ack 1, win 512, options [nop,nop,TS val 3502249898 ecr 3502249898], length 3
2022-04-07 15:40:50.346908 IP (tos 0x0, ttl 64, id 25482, offset 0, flags [DF], proto TCP (6), length 52)
    127.0.0.1.9650 > 127.0.0.1.48998: Flags [.], cksum 0xfe28 (incorrect -> 0xba95), seq 1, ack 4, win 512, options [nop,nop,TS val 3502249898 ecr 3502249898], length 0
2022-04-07 15:40:50.346957 IP (tos 0x0, ttl 64, id 25483, offset 0, flags [DF], proto TCP (6), length 54)
    127.0.0.1.9650 > 127.0.0.1.48998: Flags [P.], cksum 0xfe2a (incorrect -> 0xb58b), seq 1:3, ack 4, win 512, options [nop,nop,TS val 3502249898 ecr 3502249898], length 2
2022-04-07 15:40:50.346972 IP (tos 0x0, ttl 64, id 4465, offset 0, flags [DF], proto TCP (6), length 52)
    127.0.0.1.48998 > 127.0.0.1.9650: Flags [.], cksum 0xfe28 (incorrect -> 0xba93), seq 4, ack 3, win 512, options [nop,nop,TS val 3502249898 ecr 3502249898], length 0
2022-04-07 15:40:50.348460 IP (tos 0x0, ttl 64, id 4466, offset 0, flags [DF], proto TCP (6), length 62)
    127.0.0.1.48998 > 127.0.0.1.9650: Flags [P.], cksum 0xfe32 (incorrect -> 0x12f0), seq 4:14, ack 3, win 512, options [nop,nop,TS val 3502249900 ecr 3502249898], length 10
2022-04-07 15:40:50.348467 IP (tos 0x0, ttl 64, id 25484, offset 0, flags [DF], proto TCP (6), length 52)
    127.0.0.1.9650 > 127.0.0.1.48998: Flags [.], cksum 0xfe28 (incorrect -> 0xba85), seq 3, ack 14, win 512, options [nop,nop,TS val 3502249900 ecr 3502249900], length 0
2022-04-07 15:40:50.391732 IP (tos 0x0, ttl 64, id 25485, offset 0, flags [DF], proto TCP (6), length 62)
    127.0.0.1.9650 > 127.0.0.1.48998: Flags [P.], cksum 0xfe32 (incorrect -> 0xb547), seq 3:13, ack 14, win 512, options [nop,nop,TS val 3502249943 ecr 3502249900], length 10
2022-04-07 15:40:50.391741 IP (tos 0x0, ttl 64, id 4467, offset 0, flags [DF], proto TCP (6), length 52)
    127.0.0.1.48998 > 127.0.0.1.9650: Flags [.], cksum 0xfe28 (incorrect -> 0xba25), seq 14, ack 13, win 512, options [nop,nop,TS val 3502249943 ecr 3502249943], length 0
2022-04-07 15:40:50.397727 IP (tos 0x0, ttl 64, id 4468, offset 0, flags [DF], proto TCP (6), length 569)
    127.0.0.1.48998 > 127.0.0.1.9650: Flags [P.], cksum 0x002e (incorrect -> 0x3478), seq 14:531, ack 13, win 512, options [nop,nop,TS val 3502249949 ecr 3502249943], length 517
2022-04-07 15:40:50.397736 IP (tos 0x0, ttl 64, id 25486, offset 0, flags [DF], proto TCP (6), length 52)
    127.0.0.1.9650 > 127.0.0.1.48998: Flags [.], cksum 0xfe28 (incorrect -> 0xb818), seq 13, ack 531, win 508, options [nop,nop,TS val 3502249949 ecr 3502249949], length 0
2022-04-07 15:40:50.443572 IP (tos 0x0, ttl 64, id 25487, offset 0, flags [DF], proto TCP (6), length 1500)
    127.0.0.1.9650 > 127.0.0.1.48998: Flags [P.], cksum 0x03d1 (incorrect -> 0xfd5e), seq 13:1461, ack 531, win 512, options [nop,nop,TS val 3502249995 ecr 3502249949], length 1448
2022-04-07 15:40:50.443580 IP (tos 0x0, ttl 64, id 4469, offset 0, flags [DF], proto TCP (6), length 52)
    127.0.0.1.48998 > 127.0.0.1.9650: Flags [.], cksum 0xfe28 (incorrect -> 0xb21a), seq 531, ack 1461, win 502, options [nop,nop,TS val 3502249995 ecr 3502249995], length 0
2022-04-07 15:40:50.462848 IP (tos 0x0, ttl 64, id 25488, offset 0, flags [DF], proto TCP (6), length 3195)
    127.0.0.1.9650 > 127.0.0.1.48998: Flags [P.], cksum 0x0a70 (incorrect -> 0x5e51), seq 1461:4604, ack 531, win 512, options [nop,nop,TS val 3502250014 ecr 3502249995], length 3143
2022-04-07 15:40:50.462863 IP (tos 0x0, ttl 64, id 4470, offset 0, flags [DF], proto TCP (6), length 52)
    127.0.0.1.48998 > 127.0.0.1.9650: Flags [.], cksum 0xfe28 (incorrect -> 0xa5b4), seq 531, ack 4604, win 495, options [nop,nop,TS val 3502250014 ecr 3502250014], length 0
2022-04-07 15:40:50.463316 IP (tos 0x0, ttl 64, id 4471, offset 0, flags [DF], proto TCP (6), length 132)
    127.0.0.1.48998 > 127.0.0.1.9650: Flags [P.], cksum 0xfe78 (incorrect -> 0x15f1), seq 531:611, ack 4604, win 512, options [nop,nop,TS val 3502250015 ecr 3502250014], length 80
2022-04-07 15:40:50.463328 IP (tos 0x0, ttl 64, id 25489, offset 0, flags [DF], proto TCP (6), length 52)
    127.0.0.1.9650 > 127.0.0.1.48998: Flags [.], cksum 0xfe28 (incorrect -> 0xa551), seq 4604, ack 611, win 512, options [nop,nop,TS val 3502250015 ecr 3502250015], length 0
2022-04-07 15:40:50.463589 IP (tos 0x0, ttl 64, id 4472, offset 0, flags [DF], proto TCP (6), length 403)
    127.0.0.1.48998 > 127.0.0.1.9650: Flags [P.], cksum 0xff87 (incorrect -> 0x8dce), seq 611:962, ack 4604, win 512, options [nop,nop,TS val 3502250015 ecr 3502250015], length 351
2022-04-07 15:40:50.463594 IP (tos 0x0, ttl 64, id 25490, offset 0, flags [DF], proto TCP (6), length 52)
    127.0.0.1.9650 > 127.0.0.1.48998: Flags [.], cksum 0xfe28 (incorrect -> 0xa3f4), seq 4604, ack 962, win 510, options [nop,nop,TS val 3502250015 ecr 3502250015], length 0
2022-04-07 15:40:50.511980 IP (tos 0x0, ttl 64, id 25491, offset 0, flags [DF], proto TCP (6), length 210)
    127.0.0.1.9650 > 127.0.0.1.48998: Flags [P.], cksum 0xfec6 (incorrect -> 0x6a1b), seq 4604:4762, ack 962, win 512, options [nop,nop,TS val 3502250063 ecr 3502250015], length 158
2022-04-07 15:40:50.511988 IP (tos 0x0, ttl 64, id 4473, offset 0, flags [DF], proto TCP (6), length 52)
    127.0.0.1.48998 > 127.0.0.1.9650: Flags [.], cksum 0xfe28 (incorrect -> 0xa2f5), seq 962, ack 4762, win 511, options [nop,nop,TS val 3502250063 ecr 3502250063], length 0
200, 4.651417970657349, 0.23518610000610352