2022-04-07 04:44:22.443613 IP (tos 0x0, ttl 64, id 47879, offset 0, flags [DF], proto TCP (6), length 60)
    127.0.0.1.38988 > 127.0.0.1.9450: Flags [S], cksum 0xfe30 (incorrect -> 0x8f0f), seq 1908123295, win 65495, options [mss 65495,sackOK,TS val 388944946 ecr 0,nop,wscale 7], length 0
2022-04-07 04:44:22.443624 IP (tos 0x0, ttl 64, id 0, offset 0, flags [DF], proto TCP (6), length 60)
    127.0.0.1.9450 > 127.0.0.1.38988: Flags [S.], cksum 0xfe30 (incorrect -> 0xcc22), seq 1098225169, ack 1908123296, win 65483, options [mss 65495,sackOK,TS val 388944946 ecr 388944946,nop,wscale 7], length 0
2022-04-07 04:44:22.443634 IP (tos 0x0, ttl 64, id 47880, offset 0, flags [DF], proto TCP (6), length 52)
    127.0.0.1.38988 > 127.0.0.1.9450: Flags [.], cksum 0xfe28 (incorrect -> 0xf2de), seq 1, ack 1, win 512, options [nop,nop,TS val 388944946 ecr 388944946], length 0
2022-04-07 04:44:22.443743 IP (tos 0x0, ttl 64, id 47881, offset 0, flags [DF], proto TCP (6), length 55)
    127.0.0.1.38988 > 127.0.0.1.9450: Flags [P.], cksum 0xfe2b (incorrect -> 0xedd2), seq 1:4, ack 1, win 512, options [nop,nop,TS val 388944946 ecr 388944946], length 3
2022-04-07 04:44:22.443745 IP (tos 0x0, ttl 64, id 4288, offset 0, flags [DF], proto TCP (6), length 52)
    127.0.0.1.9450 > 127.0.0.1.38988: Flags [.], cksum 0xfe28 (incorrect -> 0xf2db), seq 1, ack 4, win 512, options [nop,nop,TS val 388944946 ecr 388944946], length 0
2022-04-07 04:44:22.443809 IP (tos 0x0, ttl 64, id 4289, offset 0, flags [DF], proto TCP (6), length 54)
    127.0.0.1.9450 > 127.0.0.1.38988: Flags [P.], cksum 0xfe2a (incorrect -> 0xedd1), seq 1:3, ack 4, win 512, options [nop,nop,TS val 388944946 ecr 388944946], length 2
2022-04-07 04:44:22.443812 IP (tos 0x0, ttl 64, id 47882, offset 0, flags [DF], proto TCP (6), length 52)
    127.0.0.1.38988 > 127.0.0.1.9450: Flags [.], cksum 0xfe28 (incorrect -> 0xf2d9), seq 4, ack 3, win 512, options [nop,nop,TS val 388944946 ecr 388944946], length 0
2022-04-07 04:44:22.457171 IP (tos 0x0, ttl 64, id 47883, offset 0, flags [DF], proto TCP (6), length 62)
    127.0.0.1.38988 > 127.0.0.1.9450: Flags [P.], cksum 0xfe32 (incorrect -> 0x781c), seq 4:14, ack 3, win 512, options [nop,nop,TS val 388944960 ecr 388944946], length 10
2022-04-07 04:44:22.457176 IP (tos 0x0, ttl 64, id 4290, offset 0, flags [DF], proto TCP (6), length 52)
    127.0.0.1.9450 > 127.0.0.1.38988: Flags [.], cksum 0xfe28 (incorrect -> 0xf2b3), seq 3, ack 14, win 512, options [nop,nop,TS val 388944960 ecr 388944960], length 0
2022-04-07 04:44:22.534793 IP (tos 0x0, ttl 64, id 4291, offset 0, flags [DF], proto TCP (6), length 62)
    127.0.0.1.9450 > 127.0.0.1.38988: Flags [P.], cksum 0xfe32 (incorrect -> 0xed53), seq 3:13, ack 14, win 512, options [nop,nop,TS val 388945037 ecr 388944960], length 10
2022-04-07 04:44:22.534799 IP (tos 0x0, ttl 64, id 47884, offset 0, flags [DF], proto TCP (6), length 52)
    127.0.0.1.38988 > 127.0.0.1.9450: Flags [.], cksum 0xfe28 (incorrect -> 0xf20f), seq 14, ack 13, win 512, options [nop,nop,TS val 388945037 ecr 388945037], length 0
2022-04-07 04:44:22.540434 IP (tos 0x0, ttl 64, id 47885, offset 0, flags [DF], proto TCP (6), length 569)
    127.0.0.1.38988 > 127.0.0.1.9450: Flags [P.], cksum 0x002e (incorrect -> 0x1c85), seq 14:531, ack 13, win 512, options [nop,nop,TS val 388945043 ecr 388945037], length 517
2022-04-07 04:44:22.540454 IP (tos 0x0, ttl 64, id 4292, offset 0, flags [DF], proto TCP (6), length 52)
    127.0.0.1.9450 > 127.0.0.1.38988: Flags [.], cksum 0xfe28 (incorrect -> 0xf002), seq 13, ack 531, win 508, options [nop,nop,TS val 388945043 ecr 388945043], length 0
2022-04-07 04:44:22.618725 IP (tos 0x0, ttl 64, id 4293, offset 0, flags [DF], proto TCP (6), length 3538)
    127.0.0.1.9450 > 127.0.0.1.38988: Flags [P.], cksum 0x0bc7 (incorrect -> 0x00af), seq 13:3499, ack 531, win 512, options [nop,nop,TS val 388945121 ecr 388945043], length 3486
2022-04-07 04:44:22.618730 IP (tos 0x0, ttl 64, id 47886, offset 0, flags [DF], proto TCP (6), length 52)
    127.0.0.1.38988 > 127.0.0.1.9450: Flags [.], cksum 0xfe28 (incorrect -> 0xe1d6), seq 531, ack 3499, win 494, options [nop,nop,TS val 388945121 ecr 388945121], length 0
2022-04-07 04:44:22.650225 IP (tos 0x0, ttl 64, id 4294, offset 0, flags [DF], proto TCP (6), length 2134)
    127.0.0.1.9450 > 127.0.0.1.38988: Flags [P.], cksum 0x064b (incorrect -> 0x49fa), seq 3499:5581, ack 531, win 512, options [nop,nop,TS val 388945153 ecr 388945121], length 2082
2022-04-07 04:44:22.650230 IP (tos 0x0, ttl 64, id 47887, offset 0, flags [DF], proto TCP (6), length 52)
    127.0.0.1.38988 > 127.0.0.1.9450: Flags [.], cksum 0xfe28 (incorrect -> 0xd96f), seq 531, ack 5581, win 499, options [nop,nop,TS val 388945153 ecr 388945153], length 0
2022-04-07 04:44:22.650578 IP (tos 0x0, ttl 64, id 47888, offset 0, flags [DF], proto TCP (6), length 116)
    127.0.0.1.38988 > 127.0.0.1.9450: Flags [P.], cksum 0xfe68 (incorrect -> 0x3921), seq 531:595, ack 5581, win 512, options [nop,nop,TS val 388945153 ecr 388945153], length 64
2022-04-07 04:44:22.650583 IP (tos 0x0, ttl 64, id 4295, offset 0, flags [DF], proto TCP (6), length 52)
    127.0.0.1.9450 > 127.0.0.1.38988: Flags [.], cksum 0xfe28 (incorrect -> 0xd922), seq 5581, ack 595, win 512, options [nop,nop,TS val 388945153 ecr 388945153], length 0
2022-04-07 04:44:22.650841 IP (tos 0x0, ttl 64, id 47889, offset 0, flags [DF], proto TCP (6), length 346)
    127.0.0.1.38988 > 127.0.0.1.9450: Flags [P.], cksum 0xff4e (incorrect -> 0x162c), seq 595:889, ack 5581, win 512, options [nop,nop,TS val 388945153 ecr 388945153], length 294
2022-04-07 04:44:22.650845 IP (tos 0x0, ttl 64, id 4296, offset 0, flags [DF], proto TCP (6), length 52)
    127.0.0.1.9450 > 127.0.0.1.38988: Flags [.], cksum 0xfe28 (incorrect -> 0xd7fe), seq 5581, ack 889, win 510, options [nop,nop,TS val 388945153 ecr 388945153], length 0
2022-04-07 04:44:22.743967 IP (tos 0x0, ttl 64, id 4297, offset 0, flags [DF], proto TCP (6), length 3538)
    127.0.0.1.9450 > 127.0.0.1.38988: Flags [P.], cksum 0x0bc7 (incorrect -> 0xa5bd), seq 5581:9067, ack 889, win 512, options [nop,nop,TS val 388945246 ecr 388945153], length 3486
2022-04-07 04:44:22.743972 IP (tos 0x0, ttl 64, id 47890, offset 0, flags [DF], proto TCP (6), length 52)
    127.0.0.1.38988 > 127.0.0.1.9450: Flags [.], cksum 0xfe28 (incorrect -> 0xc9b6), seq 889, ack 9067, win 494, options [nop,nop,TS val 388945246 ecr 388945246], length 0
2022-04-07 04:44:22.744079 IP (tos 0x0, ttl 64, id 4298, offset 0, flags [DF], proto TCP (6), length 4036)
    127.0.0.1.9450 > 127.0.0.1.38988: Flags [P.], cksum 0x0db9 (incorrect -> 0xcae8), seq 9067:13051, ack 889, win 512, options [nop,nop,TS val 388945247 ecr 388945246], length 3984
2022-04-07 04:44:22.744083 IP (tos 0x0, ttl 64, id 47891, offset 0, flags [DF], proto TCP (6), length 52)
    127.0.0.1.38988 > 127.0.0.1.9450: Flags [.], cksum 0xfe28 (incorrect -> 0xba26), seq 889, ack 13051, win 492, options [nop,nop,TS val 388945247 ecr 388945247], length 0
2022-04-07 04:44:22.751382 IP (tos 0x0, ttl 64, id 4299, offset 0, flags [DF], proto TCP (6), length 4036)
    127.0.0.1.9450 > 127.0.0.1.38988: Flags [P.], cksum 0x0db9 (incorrect -> 0xf438), seq 13051:17035, ack 889, win 512, options [nop,nop,TS val 388945254 ecr 388945247], length 3984
2022-04-07 04:44:22.751386 IP (tos 0x0, ttl 64, id 47892, offset 0, flags [DF], proto TCP (6), length 52)
    127.0.0.1.38988 > 127.0.0.1.9450: Flags [.], cksum 0xfe28 (incorrect -> 0xaa88), seq 889, ack 17035, win 492, options [nop,nop,TS val 388945254 ecr 388945254], length 0
2022-04-07 04:44:22.765750 IP (tos 0x0, ttl 64, id 4300, offset 0, flags [DF], proto TCP (6), length 1450)
    127.0.0.1.9450 > 127.0.0.1.38988: Flags [P.], cksum 0x039f (incorrect -> 0xf267), seq 17035:18433, ack 889, win 512, options [nop,nop,TS val 388945268 ecr 388945254], length 1398
2022-04-07 04:44:22.765761 IP (tos 0x0, ttl 64, id 47893, offset 0, flags [DF], proto TCP (6), length 52)
    127.0.0.1.38988 > 127.0.0.1.9450: Flags [.], cksum 0xfe28 (incorrect -> 0xa4ec), seq 889, ack 18433, win 502, options [nop,nop,TS val 388945268 ecr 388945268], length 0
2022-04-07 04:44:22.776007 IP (tos 0x0, ttl 64, id 4301, offset 0, flags [DF], proto TCP (6), length 3538)
    127.0.0.1.9450 > 127.0.0.1.38988: Flags [P.], cksum 0x0bc7 (incorrect -> 0xaf93), seq 18433:21919, ack 889, win 512, options [nop,nop,TS val 388945278 ecr 388945268], length 3486
2022-04-07 04:44:22.776024 IP (tos 0x0, ttl 64, id 47894, offset 0, flags [DF], proto TCP (6), length 52)
    127.0.0.1.38988 > 127.0.0.1.9450: Flags [.], cksum 0xfe28 (incorrect -> 0x9742), seq 889, ack 21919, win 494, options [nop,nop,TS val 388945278 ecr 388945278], length 0
2022-04-07 04:44:22.776118 IP (tos 0x0, ttl 64, id 4302, offset 0, flags [DF], proto TCP (6), length 4100)
    127.0.0.1.9450 > 127.0.0.1.38988: Flags [P.], cksum 0x0df9 (incorrect -> 0xbaef), seq 21919:25967, ack 889, win 512, options [nop,nop,TS val 388945279 ecr 388945278], length 4048
2022-04-07 04:44:22.776121 IP (tos 0x0, ttl 64, id 47895, offset 0, flags [DF], proto TCP (6), length 52)
    127.0.0.1.38988 > 127.0.0.1.9450: Flags [.], cksum 0xfe28 (incorrect -> 0x8780), seq 889, ack 25967, win 478, options [nop,nop,TS val 388945279 ecr 388945279], length 0
2022-04-07 04:44:22.776126 IP (tos 0x0, ttl 64, id 4303, offset 0, flags [DF], proto TCP (6), length 3542)
    127.0.0.1.9450 > 127.0.0.1.38988: Flags [P.], cksum 0x0bcb (incorrect -> 0xdf12), seq 25967:29457, ack 889, win 512, options [nop,nop,TS val 388945279 ecr 388945279], length 3490
2022-04-07 04:44:22.776128 IP (tos 0x0, ttl 64, id 47896, offset 0, flags [DF], proto TCP (6), length 52)
    127.0.0.1.38988 > 127.0.0.1.9450: Flags [.], cksum 0xfe28 (incorrect -> 0x79ec), seq 889, ack 29457, win 464, options [nop,nop,TS val 388945279 ecr 388945279], length 0
2022-04-07 04:44:22.776151 IP (tos 0x0, ttl 64, id 4304, offset 0, flags [DF], proto TCP (6), length 3040)
    127.0.0.1.9450 > 127.0.0.1.38988: Flags [P.], cksum 0x09d5 (incorrect -> 0x0fb0), seq 29457:32445, ack 889, win 512, options [nop,nop,TS val 388945279 ecr 388945279], length 2988
2022-04-07 04:44:22.776153 IP (tos 0x0, ttl 64, id 47897, offset 0, flags [DF], proto TCP (6), length 52)
    127.0.0.1.38988 > 127.0.0.1.9450: Flags [.], cksum 0xfe28 (incorrect -> 0x6e4b), seq 889, ack 32445, win 453, options [nop,nop,TS val 388945279 ecr 388945279], length 0
2022-04-07 04:44:22.777275 IP (tos 0x0, ttl 64, id 4305, offset 0, flags [DF], proto TCP (6), length 3442)
    127.0.0.1.9450 > 127.0.0.1.38988: Flags [P.], cksum 0x0b67 (incorrect -> 0x2c98), seq 32445:35835, ack 889, win 512, options [nop,nop,TS val 388945280 ecr 388945279], length 3390
2022-04-07 04:44:22.777289 IP (tos 0x0, ttl 64, id 47898, offset 0, flags [DF], proto TCP (6), length 52)
    127.0.0.1.38988 > 127.0.0.1.9450: Flags [.], cksum 0xfe28 (incorrect -> 0x60d0), seq 889, ack 35835, win 512, options [nop,nop,TS val 388945280 ecr 388945280], length 0
2022-04-07 04:44:22.783778 IP (tos 0x0, ttl 64, id 4306, offset 0, flags [DF], proto TCP (6), length 3904)
    127.0.0.1.9450 > 127.0.0.1.38988: Flags [P.], cksum 0x0d35 (incorrect -> 0xdf06), seq 35835:39687, ack 889, win 512, options [nop,nop,TS val 388945286 ecr 388945280], length 3852
2022-04-07 04:44:22.784314 IP (tos 0x0, ttl 64, id 47899, offset 0, flags [DF], proto TCP (6), length 52)
    127.0.0.1.38988 > 127.0.0.1.9450: Flags [.], cksum 0xfe28 (incorrect -> 0x51b7), seq 889, ack 39687, win 512, options [nop,nop,TS val 388945287 ecr 388945286], length 0
2022-04-07 04:44:22.797849 IP (tos 0x0, ttl 64, id 4307, offset 0, flags [DF], proto TCP (6), length 4036)
    127.0.0.1.9450 > 127.0.0.1.38988: Flags [P.], cksum 0x0db9 (incorrect -> 0x3ec3), seq 39687:43671, ack 889, win 512, options [nop,nop,TS val 388945300 ecr 388945287], length 3984
2022-04-07 04:44:22.797862 IP (tos 0x0, ttl 64, id 47900, offset 0, flags [DF], proto TCP (6), length 52)
    127.0.0.1.38988 > 127.0.0.1.9450: Flags [.], cksum 0xfe28 (incorrect -> 0x420c), seq 889, ack 43671, win 512, options [nop,nop,TS val 388945300 ecr 388945300], length 0
2022-04-07 04:44:22.807843 IP (tos 0x0, ttl 64, id 4308, offset 0, flags [DF], proto TCP (6), length 3142)
    127.0.0.1.9450 > 127.0.0.1.38988: Flags [P.], cksum 0x0a3b (incorrect -> 0xb298), seq 43671:46761, ack 889, win 512, options [nop,nop,TS val 388945310 ecr 388945300], length 3090
2022-04-07 04:44:22.807856 IP (tos 0x0, ttl 64, id 47901, offset 0, flags [DF], proto TCP (6), length 52)
    127.0.0.1.38988 > 127.0.0.1.9450: Flags [.], cksum 0xfe28 (incorrect -> 0x35e6), seq 889, ack 46761, win 512, options [nop,nop,TS val 388945310 ecr 388945310], length 0
2022-04-07 04:44:22.807974 IP (tos 0x0, ttl 64, id 4309, offset 0, flags [DF], proto TCP (6), length 4036)
    127.0.0.1.9450 > 127.0.0.1.38988: Flags [P.], cksum 0x0db9 (incorrect -> 0xf982), seq 46761:50745, ack 889, win 512, options [nop,nop,TS val 388945310 ecr 388945310], length 3984
2022-04-07 04:44:22.807986 IP (tos 0x0, ttl 64, id 47902, offset 0, flags [DF], proto TCP (6), length 52)
    127.0.0.1.38988 > 127.0.0.1.9450: Flags [.], cksum 0xfe28 (incorrect -> 0x2656), seq 889, ack 50745, win 512, options [nop,nop,TS val 388945310 ecr 388945310], length 0
2022-04-07 04:44:22.808179 IP (tos 0x0, ttl 64, id 4310, offset 0, flags [DF], proto TCP (6), length 4036)
    127.0.0.1.9450 > 127.0.0.1.38988: Flags [P.], cksum 0x0db9 (incorrect -> 0x6b4e), seq 50745:54729, ack 889, win 512, options [nop,nop,TS val 388945311 ecr 388945310], length 3984
2022-04-07 04:44:22.816061 IP (tos 0x0, ttl 64, id 4311, offset 0, flags [DF], proto TCP (6), length 32820)
    127.0.0.1.9450 > 127.0.0.1.38988: Flags [.], cksum 0x7e29 (incorrect -> 0xe804), seq 54729:87497, ack 889, win 512, options [nop,nop,TS val 388945318 ecr 388945310], length 32768
2022-04-07 04:44:22.816081 IP (tos 0x0, ttl 64, id 47903, offset 0, flags [DF], proto TCP (6), length 52)
    127.0.0.1.38988 > 127.0.0.1.9450: Flags [.], cksum 0xfe28 (incorrect -> 0x9740), seq 889, ack 87497, win 379, options [nop,nop,TS val 388945319 ecr 388945311], length 0
2022-04-07 04:44:22.816085 IP (tos 0x0, ttl 64, id 4312, offset 0, flags [DF], proto TCP (6), length 4478)
    127.0.0.1.9450 > 127.0.0.1.38988: Flags [P.], cksum 0x0f73 (incorrect -> 0x2e02), seq 87497:91923, ack 889, win 512, options [nop,nop,TS val 388945319 ecr 388945319], length 4426
2022-04-07 04:44:22.817164 IP (tos 0x0, ttl 64, id 47904, offset 0, flags [DF], proto TCP (6), length 52)
    127.0.0.1.38988 > 127.0.0.1.9450: Flags [.], cksum 0xfe28 (incorrect -> 0x8568), seq 889, ack 91923, win 512, options [nop,nop,TS val 388945320 ecr 388945319], length 0
2022-04-07 04:44:22.829479 IP (tos 0x0, ttl 64, id 4313, offset 0, flags [DF], proto TCP (6), length 3940)
    127.0.0.1.9450 > 127.0.0.1.38988: Flags [P.], cksum 0x0d59 (incorrect -> 0x7970), seq 91923:95811, ack 889, win 512, options [nop,nop,TS val 388945332 ecr 388945320], length 3888
2022-04-07 04:44:22.829492 IP (tos 0x0, ttl 64, id 47905, offset 0, flags [DF], proto TCP (6), length 52)
    127.0.0.1.38988 > 127.0.0.1.9450: Flags [.], cksum 0xfe28 (incorrect -> 0x761f), seq 889, ack 95811, win 512, options [nop,nop,TS val 388945332 ecr 388945332], length 0
2022-04-07 04:44:22.840215 IP (tos 0x0, ttl 64, id 4314, offset 0, flags [DF], proto TCP (6), length 4100)
    127.0.0.1.9450 > 127.0.0.1.38988: Flags [P.], cksum 0x0df9 (incorrect -> 0xa678), seq 95811:99859, ack 889, win 512, options [nop,nop,TS val 388945343 ecr 388945332], length 4048
2022-04-07 04:44:22.840271 IP (tos 0x0, ttl 64, id 47906, offset 0, flags [DF], proto TCP (6), length 52)
    127.0.0.1.38988 > 127.0.0.1.9450: Flags [.], cksum 0xfe28 (incorrect -> 0x6639), seq 889, ack 99859, win 512, options [nop,nop,TS val 388945343 ecr 388945343], length 0
2022-04-07 04:44:22.840276 IP (tos 0x0, ttl 64, id 4315, offset 0, flags [DF], proto TCP (6), length 4206)
    127.0.0.1.9450 > 127.0.0.1.38988: Flags [P.], cksum 0x0e63 (incorrect -> 0x86f6), seq 99859:104013, ack 889, win 512, options [nop,nop,TS val 388945343 ecr 388945343], length 4154
2022-04-07 04:44:22.840278 IP (tos 0x0, ttl 64, id 47907, offset 0, flags [DF], proto TCP (6), length 52)
    127.0.0.1.38988 > 127.0.0.1.9450: Flags [.], cksum 0xfe28 (incorrect -> 0x55ff), seq 889, ack 104013, win 512, options [nop,nop,TS val 388945343 ecr 388945343], length 0
2022-04-07 04:44:22.840422 IP (tos 0x0, ttl 64, id 4316, offset 0, flags [DF], proto TCP (6), length 3060)
200, 142.23646759986877, 0.4038081169128418