2022-04-07 09:08:44.255318 IP (tos 0x0, ttl 64, id 43313, offset 0, flags [DF], proto TCP (6), length 60)
    127.0.0.1.48382 > 127.0.0.1.9650: Flags [S], cksum 0xfe30 (incorrect -> 0x8e62), seq 3971679738, win 65495, options [mss 65495,sackOK,TS val 3478723807 ecr 0,nop,wscale 7], length 0
2022-04-07 09:08:44.255338 IP (tos 0x0, ttl 64, id 0, offset 0, flags [DF], proto TCP (6), length 60)
    127.0.0.1.9650 > 127.0.0.1.48382: Flags [S.], cksum 0xfe30 (incorrect -> 0x63d4), seq 528031447, ack 3971679739, win 65483, options [mss 65495,sackOK,TS val 3478723807 ecr 3478723807,nop,wscale 7], length 0
2022-04-07 09:08:44.255353 IP (tos 0x0, ttl 64, id 43314, offset 0, flags [DF], proto TCP (6), length 52)
    127.0.0.1.48382 > 127.0.0.1.9650: Flags [.], cksum 0xfe28 (incorrect -> 0x8a90), seq 1, ack 1, win 512, options [nop,nop,TS val 3478723807 ecr 3478723807], length 0
2022-04-07 09:08:44.255477 IP (tos 0x0, ttl 64, id 43315, offset 0, flags [DF], proto TCP (6), length 55)
    127.0.0.1.48382 > 127.0.0.1.9650: Flags [P.], cksum 0xfe2b (incorrect -> 0x8584), seq 1:4, ack 1, win 512, options [nop,nop,TS val 3478723807 ecr 3478723807], length 3
2022-04-07 09:08:44.255492 IP (tos 0x0, ttl 64, id 64749, offset 0, flags [DF], proto TCP (6), length 52)
    127.0.0.1.9650 > 127.0.0.1.48382: Flags [.], cksum 0xfe28 (incorrect -> 0x8a8d), seq 1, ack 4, win 512, options [nop,nop,TS val 3478723807 ecr 3478723807], length 0
2022-04-07 09:08:44.255559 IP (tos 0x0, ttl 64, id 64750, offset 0, flags [DF], proto TCP (6), length 54)
    127.0.0.1.9650 > 127.0.0.1.48382: Flags [P.], cksum 0xfe2a (incorrect -> 0x8583), seq 1:3, ack 4, win 512, options [nop,nop,TS val 3478723807 ecr 3478723807], length 2
2022-04-07 09:08:44.255569 IP (tos 0x0, ttl 64, id 43316, offset 0, flags [DF], proto TCP (6), length 52)
    127.0.0.1.48382 > 127.0.0.1.9650: Flags [.], cksum 0xfe28 (incorrect -> 0x8a8b), seq 4, ack 3, win 512, options [nop,nop,TS val 3478723807 ecr 3478723807], length 0
2022-04-07 09:08:44.257508 IP (tos 0x0, ttl 64, id 43317, offset 0, flags [DF], proto TCP (6), length 62)
    127.0.0.1.48382 > 127.0.0.1.9650: Flags [P.], cksum 0xfe32 (incorrect -> 0xab92), seq 4:14, ack 3, win 512, options [nop,nop,TS val 3478723809 ecr 3478723807], length 10
2022-04-07 09:08:44.257527 IP (tos 0x0, ttl 64, id 64751, offset 0, flags [DF], proto TCP (6), length 52)
    127.0.0.1.9650 > 127.0.0.1.48382: Flags [.], cksum 0xfe28 (incorrect -> 0x8a7d), seq 3, ack 14, win 512, options [nop,nop,TS val 3478723809 ecr 3478723809], length 0
2022-04-07 09:08:44.308492 IP (tos 0x0, ttl 64, id 64752, offset 0, flags [DF], proto TCP (6), length 62)
    127.0.0.1.9650 > 127.0.0.1.48382: Flags [P.], cksum 0xfe32 (incorrect -> 0x8537), seq 3:13, ack 14, win 512, options [nop,nop,TS val 3478723860 ecr 3478723809], length 10
2022-04-07 09:08:44.308503 IP (tos 0x0, ttl 64, id 43318, offset 0, flags [DF], proto TCP (6), length 52)
    127.0.0.1.48382 > 127.0.0.1.9650: Flags [.], cksum 0xfe28 (incorrect -> 0x8a0d), seq 14, ack 13, win 512, options [nop,nop,TS val 3478723860 ecr 3478723860], length 0
2022-04-07 09:08:44.314559 IP (tos 0x0, ttl 64, id 43319, offset 0, flags [DF], proto TCP (6), length 569)
    127.0.0.1.48382 > 127.0.0.1.9650: Flags [P.], cksum 0x002e (incorrect -> 0x0492), seq 14:531, ack 13, win 512, options [nop,nop,TS val 3478723866 ecr 3478723860], length 517
2022-04-07 09:08:44.314568 IP (tos 0x0, ttl 64, id 64753, offset 0, flags [DF], proto TCP (6), length 52)
    127.0.0.1.9650 > 127.0.0.1.48382: Flags [.], cksum 0xfe28 (incorrect -> 0x8800), seq 13, ack 531, win 508, options [nop,nop,TS val 3478723866 ecr 3478723866], length 0
2022-04-07 09:08:44.365035 IP (tos 0x0, ttl 64, id 64754, offset 0, flags [DF], proto TCP (6), length 1508)
    127.0.0.1.9650 > 127.0.0.1.48382: Flags [P.], cksum 0x03d9 (incorrect -> 0x0e71), seq 13:1469, ack 531, win 512, options [nop,nop,TS val 3478723916 ecr 3478723866], length 1456
2022-04-07 09:08:44.365041 IP (tos 0x0, ttl 64, id 43320, offset 0, flags [DF], proto TCP (6), length 52)
    127.0.0.1.48382 > 127.0.0.1.9650: Flags [.], cksum 0xfe28 (incorrect -> 0x81f2), seq 531, ack 1469, win 502, options [nop,nop,TS val 3478723916 ecr 3478723916], length 0
2022-04-07 09:08:44.391358 IP (tos 0x0, ttl 64, id 64755, offset 0, flags [DF], proto TCP (6), length 3356)
    127.0.0.1.9650 > 127.0.0.1.48382: Flags [P.], cksum 0x0b11 (incorrect -> 0x6265), seq 1469:4773, ack 531, win 512, options [nop,nop,TS val 3478723943 ecr 3478723916], length 3304
2022-04-07 09:08:44.391364 IP (tos 0x0, ttl 64, id 43321, offset 0, flags [DF], proto TCP (6), length 52)
    127.0.0.1.48382 > 127.0.0.1.9650: Flags [.], cksum 0xfe28 (incorrect -> 0x74db), seq 531, ack 4773, win 495, options [nop,nop,TS val 3478723943 ecr 3478723943], length 0
2022-04-07 09:08:44.391691 IP (tos 0x0, ttl 64, id 43322, offset 0, flags [DF], proto TCP (6), length 132)
    127.0.0.1.48382 > 127.0.0.1.9650: Flags [P.], cksum 0xfe78 (incorrect -> 0x1002), seq 531:611, ack 4773, win 495, options [nop,nop,TS val 3478723943 ecr 3478723943], length 80
2022-04-07 09:08:44.391698 IP (tos 0x0, ttl 64, id 64756, offset 0, flags [DF], proto TCP (6), length 52)
    127.0.0.1.9650 > 127.0.0.1.48382: Flags [.], cksum 0xfe28 (incorrect -> 0x747a), seq 4773, ack 611, win 512, options [nop,nop,TS val 3478723943 ecr 3478723943], length 0
2022-04-07 09:08:44.392103 IP (tos 0x0, ttl 64, id 43323, offset 0, flags [DF], proto TCP (6), length 327)
    127.0.0.1.48382 > 127.0.0.1.9650: Flags [P.], cksum 0xff3b (incorrect -> 0xb80f), seq 611:886, ack 4773, win 495, options [nop,nop,TS val 3478723943 ecr 3478723943], length 275
2022-04-07 09:08:44.392111 IP (tos 0x0, ttl 64, id 64757, offset 0, flags [DF], proto TCP (6), length 52)
    127.0.0.1.9650 > 127.0.0.1.48382: Flags [.], cksum 0xfe28 (incorrect -> 0x7369), seq 4773, ack 886, win 510, options [nop,nop,TS val 3478723943 ecr 3478723943], length 0
200, 5.847118854522705, 0.3002657890319824