2022-04-07 03:21:22.205478 IP (tos 0x0, ttl 64, id 59429, offset 0, flags [DF], proto TCP (6), length 60)
    127.0.0.1.57800 > 127.0.0.1.12150: Flags [S], cksum 0xfe30 (incorrect -> 0x0015), seq 2684400038, win 65495, options [mss 65495,sackOK,TS val 383964708 ecr 0,nop,wscale 7], length 0
2022-04-07 03:21:22.205488 IP (tos 0x0, ttl 64, id 0, offset 0, flags [DF], proto TCP (6), length 60)
    127.0.0.1.12150 > 127.0.0.1.57800: Flags [S.], cksum 0xfe30 (incorrect -> 0xbc15), seq 172182704, ack 2684400039, win 65483, options [mss 65495,sackOK,TS val 383964708 ecr 383964708,nop,wscale 7], length 0
2022-04-07 03:21:22.205496 IP (tos 0x0, ttl 64, id 59430, offset 0, flags [DF], proto TCP (6), length 52)
    127.0.0.1.57800 > 127.0.0.1.12150: Flags [.], cksum 0xfe28 (incorrect -> 0xe2d1), seq 1, ack 1, win 512, options [nop,nop,TS val 383964708 ecr 383964708], length 0
2022-04-07 03:21:22.205585 IP (tos 0x0, ttl 64, id 59431, offset 0, flags [DF], proto TCP (6), length 55)
    127.0.0.1.57800 > 127.0.0.1.12150: Flags [P.], cksum 0xfe2b (incorrect -> 0xddc5), seq 1:4, ack 1, win 512, options [nop,nop,TS val 383964708 ecr 383964708], length 3
2022-04-07 03:21:22.205597 IP (tos 0x0, ttl 64, id 55440, offset 0, flags [DF], proto TCP (6), length 52)
    127.0.0.1.12150 > 127.0.0.1.57800: Flags [.], cksum 0xfe28 (incorrect -> 0xe2ce), seq 1, ack 4, win 512, options [nop,nop,TS val 383964708 ecr 383964708], length 0
2022-04-07 03:21:22.205624 IP (tos 0x0, ttl 64, id 55441, offset 0, flags [DF], proto TCP (6), length 54)
    127.0.0.1.12150 > 127.0.0.1.57800: Flags [P.], cksum 0xfe2a (incorrect -> 0xddc4), seq 1:3, ack 4, win 512, options [nop,nop,TS val 383964708 ecr 383964708], length 2
2022-04-07 03:21:22.205635 IP (tos 0x0, ttl 64, id 59432, offset 0, flags [DF], proto TCP (6), length 52)
    127.0.0.1.57800 > 127.0.0.1.12150: Flags [.], cksum 0xfe28 (incorrect -> 0xe2cc), seq 4, ack 3, win 512, options [nop,nop,TS val 383964708 ecr 383964708], length 0
2022-04-07 03:21:22.207047 IP (tos 0x0, ttl 64, id 59433, offset 0, flags [DF], proto TCP (6), length 62)
    127.0.0.1.57800 > 127.0.0.1.12150: Flags [P.], cksum 0xfe32 (incorrect -> 0x705c), seq 4:14, ack 3, win 512, options [nop,nop,TS val 383964709 ecr 383964708], length 10
2022-04-07 03:21:22.207070 IP (tos 0x0, ttl 64, id 55442, offset 0, flags [DF], proto TCP (6), length 52)
    127.0.0.1.12150 > 127.0.0.1.57800: Flags [.], cksum 0xfe28 (incorrect -> 0xe2c0), seq 3, ack 14, win 512, options [nop,nop,TS val 383964709 ecr 383964709], length 0
2022-04-07 03:21:22.310569 IP (tos 0x0, ttl 64, id 55443, offset 0, flags [DF], proto TCP (6), length 62)
    127.0.0.1.12150 > 127.0.0.1.57800: Flags [P.], cksum 0xfe32 (incorrect -> 0xdd45), seq 3:13, ack 14, win 512, options [nop,nop,TS val 383964813 ecr 383964709], length 10
2022-04-07 03:21:22.310580 IP (tos 0x0, ttl 64, id 59434, offset 0, flags [DF], proto TCP (6), length 52)
    127.0.0.1.57800 > 127.0.0.1.12150: Flags [.], cksum 0xfe28 (incorrect -> 0xe1e6), seq 14, ack 13, win 512, options [nop,nop,TS val 383964813 ecr 383964813], length 0
2022-04-07 03:21:22.315945 IP (tos 0x0, ttl 64, id 59435, offset 0, flags [DF], proto TCP (6), length 569)
    127.0.0.1.57800 > 127.0.0.1.12150: Flags [P.], cksum 0x002e (incorrect -> 0x670f), seq 14:531, ack 13, win 512, options [nop,nop,TS val 383964818 ecr 383964813], length 517
2022-04-07 03:21:22.315956 IP (tos 0x0, ttl 64, id 55444, offset 0, flags [DF], proto TCP (6), length 52)
    127.0.0.1.12150 > 127.0.0.1.57800: Flags [.], cksum 0xfe28 (incorrect -> 0xdfdb), seq 13, ack 531, win 508, options [nop,nop,TS val 383964818 ecr 383964818], length 0
2022-04-07 03:21:22.438976 IP (tos 0x0, ttl 64, id 55445, offset 0, flags [DF], proto TCP (6), length 3538)
    127.0.0.1.12150 > 127.0.0.1.57800: Flags [P.], cksum 0x0bc7 (incorrect -> 0x6b08), seq 13:3499, ack 531, win 512, options [nop,nop,TS val 383964941 ecr 383964818], length 3486
2022-04-07 03:21:22.438992 IP (tos 0x0, ttl 64, id 59436, offset 0, flags [DF], proto TCP (6), length 52)
    127.0.0.1.57800 > 127.0.0.1.12150: Flags [.], cksum 0xfe28 (incorrect -> 0xd155), seq 531, ack 3499, win 494, options [nop,nop,TS val 383964941 ecr 383964941], length 0
2022-04-07 03:21:22.475108 IP (tos 0x0, ttl 64, id 55446, offset 0, flags [DF], proto TCP (6), length 662)
    127.0.0.1.12150 > 127.0.0.1.57800: Flags [P.], cksum 0x008b (incorrect -> 0xb035), seq 3499:4109, ack 531, win 512, options [nop,nop,TS val 383964978 ecr 383964941], length 610
2022-04-07 03:21:22.475117 IP (tos 0x0, ttl 64, id 59437, offset 0, flags [DF], proto TCP (6), length 52)
    127.0.0.1.57800 > 127.0.0.1.12150: Flags [.], cksum 0xfe28 (incorrect -> 0xce9e), seq 531, ack 4109, win 505, options [nop,nop,TS val 383964978 ecr 383964978], length 0
2022-04-07 03:21:22.548335 IP (tos 0x0, ttl 64, id 55447, offset 0, flags [DF], proto TCP (6), length 1082)
    127.0.0.1.12150 > 127.0.0.1.57800: Flags [P.], cksum 0x022f (incorrect -> 0x724d), seq 4109:5139, ack 531, win 512, options [nop,nop,TS val 383965051 ecr 383964978], length 1030
2022-04-07 03:21:22.548344 IP (tos 0x0, ttl 64, id 59438, offset 0, flags [DF], proto TCP (6), length 52)
    127.0.0.1.57800 > 127.0.0.1.12150: Flags [.], cksum 0xfe28 (incorrect -> 0xca08), seq 531, ack 5139, win 503, options [nop,nop,TS val 383965051 ecr 383965051], length 0
2022-04-07 03:21:22.549079 IP (tos 0x0, ttl 64, id 59439, offset 0, flags [DF], proto TCP (6), length 132)
    127.0.0.1.57800 > 127.0.0.1.12150: Flags [P.], cksum 0xfe78 (incorrect -> 0x7e6e), seq 531:611, ack 5139, win 512, options [nop,nop,TS val 383965052 ecr 383965051], length 80
2022-04-07 03:21:22.549095 IP (tos 0x0, ttl 64, id 55448, offset 0, flags [DF], proto TCP (6), length 52)
    127.0.0.1.12150 > 127.0.0.1.57800: Flags [.], cksum 0xfe28 (incorrect -> 0xc9ad), seq 5139, ack 611, win 512, options [nop,nop,TS val 383965052 ecr 383965052], length 0
2022-04-07 03:21:22.549475 IP (tos 0x0, ttl 64, id 59440, offset 0, flags [DF], proto TCP (6), length 344)
    127.0.0.1.57800 > 127.0.0.1.12150: Flags [P.], cksum 0xff4c (incorrect -> 0xdb1e), seq 611:903, ack 5139, win 512, options [nop,nop,TS val 383965052 ecr 383965052], length 292
2022-04-07 03:21:22.549481 IP (tos 0x0, ttl 64, id 55449, offset 0, flags [DF], proto TCP (6), length 52)
    127.0.0.1.12150 > 127.0.0.1.57800: Flags [.], cksum 0xfe28 (incorrect -> 0xc88b), seq 5139, ack 903, win 510, options [nop,nop,TS val 383965052 ecr 383965052], length 0
2022-04-07 03:21:22.658174 IP (tos 0x0, ttl 64, id 55450, offset 0, flags [DF], proto TCP (6), length 594)
    127.0.0.1.12150 > 127.0.0.1.57800: Flags [P.], cksum 0x0047 (incorrect -> 0xcff1), seq 5139:5681, ack 903, win 512, options [nop,nop,TS val 383965161 ecr 383965052], length 542
2022-04-07 03:21:22.658183 IP (tos 0x0, ttl 64, id 59441, offset 0, flags [DF], proto TCP (6), length 52)
    127.0.0.1.57800 > 127.0.0.1.12150: Flags [.], cksum 0xfe28 (incorrect -> 0xc595), seq 903, ack 5681, win 508, options [nop,nop,TS val 383965161 ecr 383965161], length 0
2022-04-07 03:21:24.652407 IP (tos 0x0, ttl 64, id 55451, offset 0, flags [DF], proto TCP (6), length 3538)
    127.0.0.1.12150 > 127.0.0.1.57800: Flags [P.], cksum 0x0bc7 (incorrect -> 0x7f57), seq 5681:9167, ack 903, win 512, options [nop,nop,TS val 383967155 ecr 383965161], length 3486
2022-04-07 03:21:24.652417 IP (tos 0x0, ttl 64, id 59442, offset 0, flags [DF], proto TCP (6), length 52)
    127.0.0.1.57800 > 127.0.0.1.12150: Flags [.], cksum 0xfe28 (incorrect -> 0xa871), seq 903, ack 9167, win 494, options [nop,nop,TS val 383967155 ecr 383967155], length 0
2022-04-07 03:21:24.699061 IP (tos 0x0, ttl 64, id 55452, offset 0, flags [DF], proto TCP (6), length 3538)
    127.0.0.1.12150 > 127.0.0.1.57800: Flags [P.], cksum 0x0bc7 (incorrect -> 0xa3ee), seq 9167:12653, ack 903, win 512, options [nop,nop,TS val 383967201 ecr 383967155], length 3486
2022-04-07 03:21:24.699067 IP (tos 0x0, ttl 64, id 59443, offset 0, flags [DF], proto TCP (6), length 52)
    127.0.0.1.57800 > 127.0.0.1.12150: Flags [.], cksum 0xfe28 (incorrect -> 0x9a76), seq 903, ack 12653, win 494, options [nop,nop,TS val 383967202 ecr 383967201], length 0
2022-04-07 03:21:24.715257 IP (tos 0x0, ttl 64, id 55453, offset 0, flags [DF], proto TCP (6), length 550)
    127.0.0.1.12150 > 127.0.0.1.57800: Flags [P.], cksum 0x001b (incorrect -> 0x38cc), seq 12653:13151, ack 903, win 512, options [nop,nop,TS val 383967218 ecr 383967202], length 498
2022-04-07 03:21:24.715263 IP (tos 0x0, ttl 64, id 59444, offset 0, flags [DF], proto TCP (6), length 52)
    127.0.0.1.57800 > 127.0.0.1.12150: Flags [.], cksum 0xfe28 (incorrect -> 0x9857), seq 903, ack 13151, win 506, options [nop,nop,TS val 383967218 ecr 383967218], length 0
2022-04-07 03:21:24.743247 IP (tos 0x0, ttl 64, id 55454, offset 0, flags [DF], proto TCP (6), length 3538)
    127.0.0.1.12150 > 127.0.0.1.57800: Flags [P.], cksum 0x0bc7 (incorrect -> 0x54da), seq 13151:16637, ack 903, win 512, options [nop,nop,TS val 383967246 ecr 383967218], length 3486
2022-04-07 03:21:24.743254 IP (tos 0x0, ttl 64, id 59445, offset 0, flags [DF], proto TCP (6), length 52)
    127.0.0.1.57800 > 127.0.0.1.12150: Flags [.], cksum 0xfe28 (incorrect -> 0x8a8d), seq 903, ack 16637, win 494, options [nop,nop,TS val 383967246 ecr 383967246], length 0
2022-04-07 03:21:24.753847 IP (tos 0x0, ttl 64, id 55455, offset 0, flags [DF], proto TCP (6), length 550)
    127.0.0.1.12150 > 127.0.0.1.57800: Flags [P.], cksum 0x001b (incorrect -> 0xf1cd), seq 16637:17135, ack 903, win 512, options [nop,nop,TS val 383967256 ecr 383967246], length 498
2022-04-07 03:21:24.753853 IP (tos 0x0, ttl 64, id 59446, offset 0, flags [DF], proto TCP (6), length 52)
    127.0.0.1.57800 > 127.0.0.1.12150: Flags [.], cksum 0xfe28 (incorrect -> 0x887b), seq 903, ack 17135, win 506, options [nop,nop,TS val 383967256 ecr 383967256], length 0
2022-04-07 03:21:24.771957 IP (tos 0x0, ttl 64, id 55456, offset 0, flags [DF], proto TCP (6), length 3506)
    127.0.0.1.12150 > 127.0.0.1.57800: Flags [P.], cksum 0x0ba7 (incorrect -> 0x69f2), seq 17135:20589, ack 903, win 512, options [nop,nop,TS val 383967274 ecr 383967256], length 3454
2022-04-07 03:21:24.771963 IP (tos 0x0, ttl 64, id 59447, offset 0, flags [DF], proto TCP (6), length 52)
    127.0.0.1.57800 > 127.0.0.1.12150: Flags [.], cksum 0xfe28 (incorrect -> 0x7ae5), seq 903, ack 20589, win 494, options [nop,nop,TS val 383967274 ecr 383967274], length 0
2022-04-07 03:21:24.782480 IP (tos 0x0, ttl 64, id 55457, offset 0, flags [DF], proto TCP (6), length 550)
    127.0.0.1.12150 > 127.0.0.1.57800: Flags [P.], cksum 0x001b (incorrect -> 0xfd43), seq 20589:21087, ack 903, win 512, options [nop,nop,TS val 383967285 ecr 383967274], length 498
2022-04-07 03:21:24.782491 IP (tos 0x0, ttl 64, id 59448, offset 0, flags [DF], proto TCP (6), length 52)
    127.0.0.1.57800 > 127.0.0.1.12150: Flags [.], cksum 0xfe28 (incorrect -> 0x78d1), seq 903, ack 21087, win 506, options [nop,nop,TS val 383967285 ecr 383967285], length 0
2022-04-07 03:21:24.802934 IP (tos 0x0, ttl 64, id 55458, offset 0, flags [DF], proto TCP (6), length 3326)
    127.0.0.1.12150 > 127.0.0.1.57800: Flags [P.], cksum 0x0af3 (incorrect -> 0x739a), seq 21087:24361, ack 903, win 512, options [nop,nop,TS val 383967305 ecr 383967285], length 3274
2022-04-07 03:21:24.802947 IP (tos 0x0, ttl 64, id 59449, offset 0, flags [DF], proto TCP (6), length 52)
    127.0.0.1.57800 > 127.0.0.1.12150: Flags [.], cksum 0xfe28 (incorrect -> 0x6bea), seq 903, ack 24361, win 495, options [nop,nop,TS val 383967305 ecr 383967305], length 0
2022-04-07 03:21:24.827747 IP (tos 0x0, ttl 64, id 55459, offset 0, flags [DF], proto TCP (6), length 550)
    127.0.0.1.12150 > 127.0.0.1.57800: Flags [P.], cksum 0x001b (incorrect -> 0x36d1), seq 24361:24859, ack 903, win 512, options [nop,nop,TS val 383967330 ecr 383967305], length 498
2022-04-07 03:21:24.827757 IP (tos 0x0, ttl 64, id 59450, offset 0, flags [DF], proto TCP (6), length 52)
    127.0.0.1.57800 > 127.0.0.1.12150: Flags [.], cksum 0xfe28 (incorrect -> 0x69bb), seq 903, ack 24859, win 506, options [nop,nop,TS val 383967330 ecr 383967330], length 0
2022-04-07 03:21:24.855214 IP (tos 0x0, ttl 64, id 55460, offset 0, flags [DF], proto TCP (6), length 3538)
    127.0.0.1.12150 > 127.0.0.1.57800: Flags [P.], cksum 0x0bc7 (incorrect -> 0xcfc0), seq 24859:28345, ack 903, win 512, options [nop,nop,TS val 383967358 ecr 383967330], length 3486
2022-04-07 03:21:24.898660 IP (tos 0x0, ttl 64, id 59451, offset 0, flags [DF], proto TCP (6), length 52)
    127.0.0.1.57800 > 127.0.0.1.12150: Flags [.], cksum 0xfe28 (incorrect -> 0x5bb4), seq 903, ack 28345, win 512, options [nop,nop,TS val 383967401 ecr 383967358], length 0
2022-04-07 03:21:24.898669 IP (tos 0x0, ttl 64, id 55461, offset 0, flags [DF], proto TCP (6), length 4534)
    127.0.0.1.12150 > 127.0.0.1.57800: Flags [P.], cksum 0x0fab (incorrect -> 0xde3f), seq 28345:32827, ack 903, win 512, options [nop,nop,TS val 383967401 ecr 383967401], length 4482
2022-04-07 03:21:24.946657 IP (tos 0x0, ttl 64, id 59452, offset 0, flags [DF], proto TCP (6), length 52)
    127.0.0.1.57800 > 127.0.0.1.12150: Flags [.], cksum 0xfe28 (incorrect -> 0x49d7), seq 903, ack 32827, win 512, options [nop,nop,TS val 383967449 ecr 383967401], length 0
2022-04-07 03:21:24.946664 IP (tos 0x0, ttl 64, id 55462, offset 0, flags [DF], proto TCP (6), length 4036)
    127.0.0.1.12150 > 127.0.0.1.57800: Flags [P.], cksum 0x0db9 (incorrect -> 0xfa06), seq 32827:36811, ack 903, win 512, options [nop,nop,TS val 383967449 ecr 383967449], length 3984
2022-04-07 03:21:24.946706 IP (tos 0x0, ttl 64, id 59453, offset 0, flags [DF], proto TCP (6), length 52)
    127.0.0.1.57800 > 127.0.0.1.12150: Flags [.], cksum 0xfe28 (incorrect -> 0x3a17), seq 903, ack 36811, win 512, options [nop,nop,TS val 383967449 ecr 383967449], length 0
2022-04-07 03:21:24.972824 IP (tos 0x0, ttl 64, id 55463, offset 0, flags [DF], proto TCP (6), length 3262)
    127.0.0.1.12150 > 127.0.0.1.57800: Flags [P.], cksum 0x0ab3 (incorrect -> 0x00fb), seq 36811:40021, ack 903, win 512, options [nop,nop,TS val 383967475 ecr 383967449], length 3210
2022-04-07 03:21:24.973078 IP (tos 0x0, ttl 64, id 59454, offset 0, flags [DF], proto TCP (6), length 52)
    127.0.0.1.57800 > 127.0.0.1.12150: Flags [.], cksum 0xfe28 (incorrect -> 0x2d59), seq 903, ack 40021, win 512, options [nop,nop,TS val 383967475 ecr 383967475], length 0
2022-04-07 03:21:25.009942 IP (tos 0x0, ttl 64, id 55464, offset 0, flags [DF], proto TCP (6), length 3326)
    127.0.0.1.12150 > 127.0.0.1.57800: Flags [P.], cksum 0x0af3 (incorrect -> 0xbf3a), seq 40021:43295, ack 903, win 512, options [nop,nop,TS val 383967512 ecr 383967475], length 3274
2022-04-07 03:21:25.010008 IP (tos 0x0, ttl 64, id 59455, offset 0, flags [DF], proto TCP (6), length 52)
    127.0.0.1.57800 > 127.0.0.1.12150: Flags [.], cksum 0xfe28 (incorrect -> 0x2045), seq 903, ack 43295, win 512, options [nop,nop,TS val 383967512 ecr 383967512], length 0
2022-04-07 03:21:25.020488 IP (tos 0x0, ttl 64, id 55465, offset 0, flags [DF], proto TCP (6), length 550)
    127.0.0.1.12150 > 127.0.0.1.57800: Flags [P.], cksum 0x001b (incorrect -> 0x3c5c), seq 43295:43793, ack 903, win 512, options [nop,nop,TS val 383967523 ecr 383967512], length 498
2022-04-07 03:21:25.020537 IP (tos 0x0, ttl 64, id 59456, offset 0, flags [DF], proto TCP (6), length 52)
    127.0.0.1.57800 > 127.0.0.1.12150: Flags [.], cksum 0xfe28 (incorrect -> 0x1e3d), seq 903, ack 43793, win 512, options [nop,nop,TS val 383967523 ecr 383967523], length 0
2022-04-07 03:21:25.047848 IP (tos 0x0, ttl 64, id 55466, offset 0, flags [DF], proto TCP (6), length 3326)
    127.0.0.1.12150 > 127.0.0.1.57800: Flags [P.], cksum 0x0af3 (incorrect -> 0x85ef), seq 43793:47067, ack 903, win 512, options [nop,nop,TS val 383967550 ecr 383967523], length 3274
2022-04-07 03:21:25.047898 IP (tos 0x0, ttl 64, id 59457, offset 0, flags [DF], proto TCP (6), length 52)
    127.0.0.1.57800 > 127.0.0.1.12150: Flags [.], cksum 0xfe28 (incorrect -> 0x113d), seq 903, ack 47067, win 512, options [nop,nop,TS val 383967550 ecr 383967550], length 0
2022-04-07 03:21:25.058573 IP (tos 0x0, ttl 64, id 55467, offset 0, flags [DF], proto TCP (6), length 550)
    127.0.0.1.12150 > 127.0.0.1.57800: Flags [P.], cksum 0x001b (incorrect -> 0xa3e3), seq 47067:47565, ack 903, win 512, options [nop,nop,TS val 383967561 ecr 383967550], length 498
2022-04-07 03:21:25.058774 IP (tos 0x0, ttl 64, id 59458, offset 0, flags [DF], proto TCP (6), length 52)
    127.0.0.1.57800 > 127.0.0.1.12150: Flags [.], cksum 0xfe28 (incorrect -> 0x0f35), seq 903, ack 47565, win 512, options [nop,nop,TS val 383967561 ecr 383967561], length 0
2022-04-07 03:21:25.083106 IP (tos 0x0, ttl 64, id 55468, offset 0, flags [DF], proto TCP (6), length 3114)
    127.0.0.1.12150 > 127.0.0.1.57800: Flags [P.], cksum 0x0a1f (incorrect -> 0x4736), seq 47565:50627, ack 903, win 512, options [nop,nop,TS val 383967586 ecr 383967561], length 3062
2022-04-07 03:21:25.083149 IP (tos 0x0, ttl 64, id 59459, offset 0, flags [DF], proto TCP (6), length 52)
    127.0.0.1.57800 > 127.0.0.1.12150: Flags [.], cksum 0xfe28 (incorrect -> 0x030d), seq 903, ack 50627, win 512, options [nop,nop,TS val 383967586 ecr 383967586], length 0
2022-04-07 03:21:25.093528 IP (tos 0x0, ttl 64, id 55469, offset 0, flags [DF], proto TCP (6), length 550)
    127.0.0.1.12150 > 127.0.0.1.57800: Flags [P.], cksum 0x001b (incorrect -> 0x7522), seq 50627:51125, ack 903, win 512, options [nop,nop,TS val 383967596 ecr 383967586], length 498
2022-04-07 03:21:25.093544 IP (tos 0x0, ttl 64, id 59460, offset 0, flags [DF], proto TCP (6), length 52)
    127.0.0.1.57800 > 127.0.0.1.12150: Flags [.], cksum 0xfe28 (incorrect -> 0x0107), seq 903, ack 51125, win 512, options [nop,nop,TS val 383967596 ecr 383967596], length 0
2022-04-07 03:21:25.121594 IP (tos 0x0, ttl 64, id 55470, offset 0, flags [DF], proto TCP (6), length 3326)
    127.0.0.1.12150 > 127.0.0.1.57800: Flags [P.], cksum 0x0af3 (incorrect -> 0xcd65), seq 51125:54399, ack 903, win 512, options [nop,nop,TS val 383967624 ecr 383967596], length 3274
2022-04-07 03:21:25.121656 IP (tos 0x0, ttl 64, id 59461, offset 0, flags [DF], proto TCP (6), length 52)
    127.0.0.1.57800 > 127.0.0.1.12150: Flags [.], cksum 0xfe28 (incorrect -> 0xf404), seq 903, ack 54399, win 512, options [nop,nop,TS val 383967624 ecr 383967624], length 0
2022-04-07 03:21:25.132085 IP (tos 0x0, ttl 64, id 55471, offset 0, flags [DF], proto TCP (6), length 550)
    127.0.0.1.12150 > 127.0.0.1.57800: Flags [P.], cksum 0x001b (incorrect -> 0x7c4f), seq 54399:54897, ack 903, win 512, options [nop,nop,TS val 383967635 ecr 383967624], length 498
2022-04-07 03:21:25.132111 IP (tos 0x0, ttl 64, id 59462, offset 0, flags [DF], proto TCP (6), length 52)
    127.0.0.1.57800 > 127.0.0.1.12150: Flags [.], cksum 0xfe28 (incorrect -> 0xf1fc), seq 903, ack 54897, win 512, options [nop,nop,TS val 383967635 ecr 383967635], length 0
2022-04-07 03:21:25.147153 IP (tos 0x0, ttl 64, id 55472, offset 0, flags [DF], proto TCP (6), length 3326)
    127.0.0.1.12150 > 127.0.0.1.57800: Flags [P.], cksum 0x0af3 (incorrect -> 0x0232), seq 54897:58171, ack 903, win 512, options [nop,nop,TS val 383967650 ecr 383967635], length 3274
2022-04-07 03:21:25.147184 IP (tos 0x0, ttl 64, id 59463, offset 0, flags [DF], proto TCP (6), length 52)
    127.0.0.1.57800 > 127.0.0.1.12150: Flags [.], cksum 0xfe28 (incorrect -> 0xe514), seq 903, ack 58171, win 512, options [nop,nop,TS val 383967650 ecr 383967650], length 0
2022-04-07 03:21:25.157656 IP (tos 0x0, ttl 64, id 55473, offset 0, flags [DF], proto TCP (6), length 550)
    127.0.0.1.12150 > 127.0.0.1.57800: Flags [P.], cksum 0x001b (incorrect -> 0xf56e), seq 58171:58669, ack 903, win 512, options [nop,nop,TS val 383967660 ecr 383967650], length 498
2022-04-07 03:21:25.157751 IP (tos 0x0, ttl 64, id 59464, offset 0, flags [DF], proto TCP (6), length 52)
    127.0.0.1.57800 > 127.0.0.1.12150: Flags [.], cksum 0xfe28 (incorrect -> 0xe30e), seq 903, ack 58669, win 512, options [nop,nop,TS val 383967660 ecr 383967660], length 0
2022-04-07 03:21:25.192551 IP (tos 0x0, ttl 64, id 55474, offset 0, flags [DF], proto TCP (6), length 3114)
    127.0.0.1.12150 > 127.0.0.1.57800: Flags [P.], cksum 0x0a1f (incorrect -> 0xe77d), seq 58669:61731, ack 903, win 512, options [nop,nop,TS val 383967695 ecr 383967660], length 3062
2022-04-07 03:21:25.192695 IP (tos 0x0, ttl 64, id 59465, offset 0, flags [DF], proto TCP (6), length 52)
    127.0.0.1.57800 > 127.0.0.1.12150: Flags [.], cksum 0xfe28 (incorrect -> 0xd6d2), seq 903, ack 61731, win 512, options [nop,nop,TS val 383967695 ecr 383967695], length 0
2022-04-07 03:21:25.203028 IP (tos 0x0, ttl 64, id 55475, offset 0, flags [DF], proto TCP (6), length 550)
    127.0.0.1.12150 > 127.0.0.1.57800: Flags [P.], cksum 0x001b (incorrect -> 0x64c7), seq 61731:62229, ack 903, win 512, options [nop,nop,TS val 383967705 ecr 383967695], length 498
2022-04-07 03:21:25.203058 IP (tos 0x0, ttl 64, id 59466, offset 0, flags [DF], proto TCP (6), length 52)
    127.0.0.1.57800 > 127.0.0.1.12150: Flags [.], cksum 0xfe28 (incorrect -> 0xd4cc), seq 903, ack 62229, win 512, options [nop,nop,TS val 383967705 ecr 383967705], length 0
2022-04-07 03:21:25.232294 IP (tos 0x0, ttl 64, id 55476, offset 0, flags [DF], proto TCP (6), length 3326)
    127.0.0.1.12150 > 127.0.0.1.57800: Flags [P.], cksum 0x0af3 (incorrect -> 0xb72a), seq 62229:65503, ack 903, win 512, options [nop,nop,TS val 383967735 ecr 383967705], length 3274
2022-04-07 03:21:25.232351 IP (tos 0x0, ttl 64, id 59467, offset 0, flags [DF], proto TCP (6), length 52)
    127.0.0.1.57800 > 127.0.0.1.12150: Flags [.], cksum 0xfe28 (incorrect -> 0xc7c6), seq 903, ack 65503, win 512, options [nop,nop,TS val 383967735 ecr 383967735], length 0
2022-04-07 03:21:25.242747 IP (tos 0x0, ttl 64, id 55477, offset 0, flags [DF], proto TCP (6), length 550)
    127.0.0.1.12150 > 127.0.0.1.57800: Flags [P.], cksum 0x001b (incorrect -> 0xd03e), seq 65503:66001, ack 903, win 512, options [nop,nop,TS val 383967745 ecr 383967735], length 498
2022-04-07 03:21:25.242760 IP (tos 0x0, ttl 64, id 59468, offset 0, flags [DF], proto TCP (6), length 52)
    127.0.0.1.57800 > 127.0.0.1.12150: Flags [.], cksum 0xfe28 (incorrect -> 0xc5c0), seq 903, ack 66001, win 512, options [nop,nop,TS val 383967745 ecr 383967745], length 0
2022-04-07 03:21:25.256888 IP (tos 0x0, ttl 64, id 55478, offset 0, flags [DF], proto TCP (6), length 3326)
    127.0.0.1.12150 > 127.0.0.1.57800: Flags [P.], cksum 0x0af3 (incorrect -> 0xd4af), seq 66001:69275, ack 903, win 512, options [nop,nop,TS val 383967759 ecr 383967745], length 3274
2022-04-07 03:21:25.257002 IP (tos 0x0, ttl 64, id 59469, offset 0, flags [DF], proto TCP (6), length 52)
    127.0.0.1.57800 > 127.0.0.1.12150: Flags [.], cksum 0xfe28 (incorrect -> 0xb8da), seq 903, ack 69275, win 512, options [nop,nop,TS val 383967759 ecr 383967759], length 0
2022-04-07 03:21:25.292335 IP (tos 0x0, ttl 64, id 55479, offset 0, flags [DF], proto TCP (6), length 3326)
    127.0.0.1.12150 > 127.0.0.1.57800: Flags [P.], cksum 0x0af3 (incorrect -> 0x93df), seq 69275:72549, ack 903, win 512, options [nop,nop,TS val 383967795 ecr 383967759], length 3274
2022-04-07 03:21:25.334662 IP (tos 0x0, ttl 64, id 59470, offset 0, flags [DF], proto TCP (6), length 52)
    127.0.0.1.57800 > 127.0.0.1.12150: Flags [.], cksum 0xfe28 (incorrect -> 0xab9e), seq 903, ack 72549, win 512, options [nop,nop,TS val 383967837 ecr 383967795], length 0
2022-04-07 03:21:25.334672 IP (tos 0x0, ttl 64, id 55480, offset 0, flags [DF], proto TCP (6), length 338)
    127.0.0.1.12150 > 127.0.0.1.57800: Flags [P.], cksum 0xff46 (incorrect -> 0x504b), seq 72549:72835, ack 903, win 512, options [nop,nop,TS val 383967837 ecr 383967837], length 286
2022-04-07 03:21:25.334711 IP (tos 0x0, ttl 64, id 59471, offset 0, flags [DF], proto TCP (6), length 52)
    127.0.0.1.57800 > 127.0.0.1.12150: Flags [.], cksum 0xfe28 (incorrect -> 0xaa56), seq 903, ack 72835, win 512, options [nop,nop,TS val 383967837 ecr 383967837], length 0
2022-04-07 03:21:25.345336 IP (tos 0x0, ttl 64, id 55481, offset 0, flags [DF], proto TCP (6), length 3824)
    127.0.0.1.12150 > 127.0.0.1.57800: Flags [P.], cksum 0x0ce5 (incorrect -> 0x5cd6), seq 72835:76607, ack 903, win 512, options [nop,nop,TS val 383967848 ecr 383967837], length 3772
2022-04-07 03:21:25.386658 IP (tos 0x0, ttl 64, id 59472, offset 0, flags [DF], proto TCP (6), length 52)
    127.0.0.1.57800 > 127.0.0.1.12150: Flags [.], cksum 0xfe28 (incorrect -> 0x9b5b), seq 903, ack 76607, win 512, options [nop,nop,TS val 383967889 ecr 383967848], length 0
2022-04-07 03:21:25.387770 IP (tos 0x0, ttl 64, id 55482, offset 0, flags [DF], proto TCP (6), length 3824)
    127.0.0.1.12150 > 127.0.0.1.57800: Flags [P.], cksum 0x0ce5 (incorrect -> 0xb123), seq 76607:80379, ack 903, win 512, options [nop,nop,TS val 383967890 ecr 383967889], length 3772
2022-04-07 03:21:25.430660 IP (tos 0x0, ttl 64, id 59473, offset 0, flags [DF], proto TCP (6), length 52)
    127.0.0.1.57800 > 127.0.0.1.12150: Flags [.], cksum 0xfe28 (incorrect -> 0x8c49), seq 903, ack 80379, win 512, options [nop,nop,TS val 383967933 ecr 383967890], length 0
2022-04-07 03:21:25.430667 IP (tos 0x0, ttl 64, id 55483, offset 0, flags [DF], proto TCP (6), length 3612)
    127.0.0.1.12150 > 127.0.0.1.57800: Flags [P.], cksum 0x0c11 (incorrect -> 0xa0ee), seq 80379:83939, ack 903, win 512, options [nop,nop,TS val 383967933 ecr 383967933], length 3560
2022-04-07 03:21:25.430697 IP (tos 0x0, ttl 64, id 59474, offset 0, flags [DF], proto TCP (6), length 52)
    127.0.0.1.57800 > 127.0.0.1.12150: Flags [.], cksum 0xfe28 (incorrect -> 0x7e36), seq 903, ack 83939, win 512, options [nop,nop,TS val 383967933 ecr 383967933], length 0
2022-04-07 03:21:25.458429 IP (tos 0x0, ttl 64, id 55484, offset 0, flags [DF], proto TCP (6), length 3824)
    127.0.0.1.12150 > 127.0.0.1.57800: Flags [P.], cksum 0x0ce5 (incorrect -> 0x49a3), seq 83939:87711, ack 903, win 512, options [nop,nop,TS val 383967961 ecr 383967933], length 3772
2022-04-07 03:21:25.498653 IP (tos 0x0, ttl 64, id 59475, offset 0, flags [DF], proto TCP (6), length 52)
    127.0.0.1.57800 > 127.0.0.1.12150: Flags [.], cksum 0xfe28 (incorrect -> 0x6f1a), seq 903, ack 87711, win 512, options [nop,nop,TS val 383968001 ecr 383967961], length 0
2022-04-07 03:21:25.498657 IP (tos 0x0, ttl 64, id 55485, offset 0, flags [DF], proto TCP (6), length 3824)
    127.0.0.1.12150 > 127.0.0.1.57800: Flags [P.], cksum 0x0ce5 (incorrect -> 0x6b9f), seq 87711:91483, ack 903, win 512, options [nop,nop,TS val 383968001 ecr 383968001], length 3772
2022-04-07 03:21:25.542661 IP (tos 0x0, ttl 64, id 59476, offset 0, flags [DF], proto TCP (6), length 52)
    127.0.0.1.57800 > 127.0.0.1.12150: Flags [.], cksum 0xfe28 (incorrect -> 0x600a), seq 903, ack 91483, win 512, options [nop,nop,TS val 383968045 ecr 383968001], length 0
2022-04-07 03:21:25.542667 IP (tos 0x0, ttl 64, id 55486, offset 0, flags [DF], proto TCP (6), length 3824)
    127.0.0.1.12150 > 127.0.0.1.57800: Flags [P.], cksum 0x0ce5 (incorrect -> 0x8fc1), seq 91483:95255, ack 903, win 512, options [nop,nop,TS val 383968045 ecr 383968045], length 3772
2022-04-07 03:21:25.586677 IP (tos 0x0, ttl 64, id 59477, offset 0, flags [DF], proto TCP (6), length 52)
    127.0.0.1.57800 > 127.0.0.1.12150: Flags [.], cksum 0xfe28 (incorrect -> 0x50f6), seq 903, ack 95255, win 512, options [nop,nop,TS val 383968089 ecr 383968045], length 0
2022-04-07 03:21:25.586690 IP (tos 0x0, ttl 64, id 55487, offset 0, flags [DF], proto TCP (6), length 3114)
    127.0.0.1.12150 > 127.0.0.1.57800: Flags [P.], cksum 0x0a1f (incorrect -> 0x8f3b), seq 95255:98317, ack 903, win 512, options [nop,nop,TS val 383968089 ecr 383968089], length 3062
2022-04-07 03:21:25.586699 IP (tos 0x0, ttl 64, id 59478, offset 0, flags [DF], proto TCP (6), length 52)
    127.0.0.1.57800 > 127.0.0.1.12150: Flags [.], cksum 0xfe28 (incorrect -> 0x40d5), seq 903, ack 98317, win 1535, options [nop,nop,TS val 383968089 ecr 383968089], length 0
2022-04-07 03:21:25.597296 IP (tos 0x0, ttl 64, id 55488, offset 0, flags [DF], proto TCP (6), length 3824)
    127.0.0.1.12150 > 127.0.0.1.57800: Flags [P.], cksum 0x0ce5 (incorrect -> 0x1e26), seq 98317:102089, ack 903, win 512, options [nop,nop,TS val 383968100 ecr 383968089], length 3772
2022-04-07 03:21:25.597302 IP (tos 0x0, ttl 64, id 59479, offset 0, flags [DF], proto TCP (6), length 52)
    127.0.0.1.57800 > 127.0.0.1.12150: Flags [.], cksum 0xfe28 (incorrect -> 0x2e03), seq 903, ack 102089, win 2559, options [nop,nop,TS val 383968100 ecr 383968100], length 0
2022-04-07 03:21:25.620490 IP (tos 0x0, ttl 64, id 55489, offset 0, flags [DF], proto TCP (6), length 3538)
    127.0.0.1.12150 > 127.0.0.1.57800: Flags [P.], cksum 0x0bc7 (incorrect -> 0xee08), seq 102089:105575, ack 903, win 512, options [nop,nop,TS val 383968123 ecr 383968100], length 3486
2022-04-07 03:21:25.620496 IP (tos 0x0, ttl 64, id 59480, offset 0, flags [DF], proto TCP (6), length 52)
    127.0.0.1.57800 > 127.0.0.1.12150: Flags [.], cksum 0xfe28 (incorrect -> 0x1c38), seq 903, ack 105575, win 3582, options [nop,nop,TS val 383968123 ecr 383968123], length 0
2022-04-07 03:21:25.631003 IP (tos 0x0, ttl 64, id 55490, offset 0, flags [DF], proto TCP (6), length 550)
    127.0.0.1.12150 > 127.0.0.1.57800: Flags [P.], cksum 0x001b (incorrect -> 0x178e), seq 105575:106073, ack 903, win 512, options [nop,nop,TS val 383968133 ecr 383968123], length 498
2022-04-07 03:21:25.631018 IP (tos 0x0, ttl 64, id 59481, offset 0, flags [DF], proto TCP (6), length 52)
    127.0.0.1.57800 > 127.0.0.1.12150: Flags [.], cksum 0xfe28 (incorrect -> 0x19f7), seq 903, ack 106073, win 3641, options [nop,nop,TS val 383968133 ecr 383968133], length 0
2022-04-07 03:21:25.704753 IP (tos 0x0, ttl 64, id 55491, offset 0, flags [DF], proto TCP (6), length 2902)
    127.0.0.1.12150 > 127.0.0.1.57800: Flags [P.], cksum 0x094b (incorrect -> 0x008f), seq 106073:108923, ack 903, win 512, options [nop,nop,TS val 383968207 ecr 383968133], length 2850
2022-04-07 03:21:25.704768 IP (tos 0x0, ttl 64, id 59482, offset 0, flags [DF], proto TCP (6), length 52)
    127.0.0.1.57800 > 127.0.0.1.12150: Flags [.], cksum 0xfe28 (incorrect -> 0x0a42), seq 903, ack 108923, win 4664, options [nop,nop,TS val 383968207 ecr 383968207], length 0
2022-04-07 03:21:25.715276 IP (tos 0x0, ttl 64, id 55492, offset 0, flags [DF], proto TCP (6), length 550)
    127.0.0.1.12150 > 127.0.0.1.57800: Flags [P.], cksum 0x001b (incorrect -> 0xd364), seq 108923:109421, ack 903, win 512, options [nop,nop,TS val 383968218 ecr 383968207], length 498
2022-04-07 03:21:25.715291 IP (tos 0x0, ttl 64, id 59483, offset 0, flags [DF], proto TCP (6), length 52)
    127.0.0.1.57800 > 127.0.0.1.12150: Flags [.], cksum 0xfe28 (incorrect -> 0x07ff), seq 903, ack 109421, win 4723, options [nop,nop,TS val 383968218 ecr 383968218], length 0
2022-04-07 03:21:25.723705 IP (tos 0x0, ttl 64, id 55493, offset 0, flags [DF], proto TCP (6), length 3824)
    127.0.0.1.12150 > 127.0.0.1.57800: Flags [P.], cksum 0x0ce5 (incorrect -> 0xe10b), seq 109421:113193, ack 903, win 512, options [nop,nop,TS val 383968226 ecr 383968218], length 3772
2022-04-07 03:21:25.723723 IP (tos 0x0, ttl 64, id 59484, offset 0, flags [DF], proto TCP (6), length 52)
    127.0.0.1.57800 > 127.0.0.1.12150: Flags [.], cksum 0xfe28 (incorrect -> 0xf533), seq 903, ack 113193, win 5746, options [nop,nop,TS val 383968226 ecr 383968226], length 0
2022-04-07 03:21:25.725869 IP (tos 0x0, ttl 64, id 55494, offset 0, flags [DF], proto TCP (6), length 3824)
    127.0.0.1.12150 > 127.0.0.1.57800: Flags [P.], cksum 0x0ce5 (incorrect -> 0x04ab), seq 113193:116965, ack 903, win 512, options [nop,nop,TS val 383968228 ecr 383968226], length 3772
2022-04-07 03:21:25.725883 IP (tos 0x0, ttl 64, id 59485, offset 0, flags [DF], proto TCP (6), length 52)
    127.0.0.1.57800 > 127.0.0.1.12150: Flags [.], cksum 0xfe28 (incorrect -> 0xe274), seq 903, ack 116965, win 6769, options [nop,nop,TS val 383968228 ecr 383968228], length 0
2022-04-07 03:21:25.768432 IP (tos 0x0, ttl 64, id 55495, offset 0, flags [DF], proto TCP (6), length 3114)
    127.0.0.1.12150 > 127.0.0.1.57800: Flags [P.], cksum 0x0a1f (incorrect -> 0x7e6b), seq 116965:120027, ack 903, win 512, options [nop,nop,TS val 383968271 ecr 383968228], length 3062
2022-04-07 03:21:25.768445 IP (tos 0x0, ttl 64, id 59486, offset 0, flags [DF], proto TCP (6), length 52)
    127.0.0.1.57800 > 127.0.0.1.12150: Flags [.], cksum 0xfe28 (incorrect -> 0xd229), seq 903, ack 120027, win 7792, options [nop,nop,TS val 383968271 ecr 383968271], length 0
2022-04-07 03:21:25.778945 IP (tos 0x0, ttl 64, id 55496, offset 0, flags [DF], proto TCP (6), length 550)
    127.0.0.1.12150 > 127.0.0.1.57800: Flags [P.], cksum 0x001b (incorrect -> 0x85c6), seq 120027:120525, ack 903, win 512, options [nop,nop,TS val 383968281 ecr 383968271], length 498
2022-04-07 03:21:25.778959 IP (tos 0x0, ttl 64, id 59487, offset 0, flags [DF], proto TCP (6), length 52)
    127.0.0.1.57800 > 127.0.0.1.12150: Flags [.], cksum 0xfe28 (incorrect -> 0xcfe8), seq 903, ack 120525, win 7851, options [nop,nop,TS val 383968281 ecr 383968281], length 0
2022-04-07 03:21:25.816317 IP (tos 0x0, ttl 64, id 55497, offset 0, flags [DF], proto TCP (6), length 3326)
    127.0.0.1.12150 > 127.0.0.1.57800: Flags [P.], cksum 0x0af3 (incorrect -> 0xafaf), seq 120525:123799, ack 903, win 512, options [nop,nop,TS val 383968319 ecr 383968281], length 3274
2022-04-07 03:21:25.816330 IP (tos 0x0, ttl 64, id 59488, offset 0, flags [DF], proto TCP (6), length 52)
    127.0.0.1.57800 > 127.0.0.1.12150: Flags [.], cksum 0xfe28 (incorrect -> 0xbed3), seq 903, ack 123799, win 8874, options [nop,nop,TS val 383968319 ecr 383968319], length 0
2022-04-07 03:21:25.826814 IP (tos 0x0, ttl 64, id 55498, offset 0, flags [DF], proto TCP (6), length 550)
    127.0.0.1.12150 > 127.0.0.1.57800: Flags [P.], cksum 0x001b (incorrect -> 0xe194), seq 123799:124297, ack 903, win 512, options [nop,nop,TS val 383968329 ecr 383968319], length 498
2022-04-07 03:21:25.826827 IP (tos 0x0, ttl 64, id 59489, offset 0, flags [DF], proto TCP (6), length 52)
    127.0.0.1.57800 > 127.0.0.1.12150: Flags [.], cksum 0xfe28 (incorrect -> 0xbc92), seq 903, ack 124297, win 8933, options [nop,nop,TS val 383968329 ecr 383968329], length 0
2022-04-07 03:21:25.850393 IP (tos 0x0, ttl 64, id 55499, offset 0, flags [DF], proto TCP (6), length 3326)
    127.0.0.1.12150 > 127.0.0.1.57800: Flags [P.], cksum 0x0af3 (incorrect -> 0x4cf1), seq 124297:127571, ack 903, win 512, options [nop,nop,TS val 383968353 ecr 383968329], length 3274
2022-04-07 03:21:25.850408 IP (tos 0x0, ttl 64, id 59490, offset 0, flags [DF], proto TCP (6), length 52)
    127.0.0.1.57800 > 127.0.0.1.12150: Flags [.], cksum 0xfe28 (incorrect -> 0xab99), seq 903, ack 127571, win 9956, options [nop,nop,TS val 383968353 ecr 383968353], length 0
2022-04-07 03:21:25.886903 IP (tos 0x0, ttl 64, id 55500, offset 0, flags [DF], proto TCP (6), length 3220)
    127.0.0.1.12150 > 127.0.0.1.57800: Flags [P.], cksum 0x0a89 (incorrect -> 0xe1de), seq 127571:130739, ack 903, win 512, options [nop,nop,TS val 383968389 ecr 383968353], length 3168
2022-04-07 03:21:25.886916 IP (tos 0x0, ttl 64, id 59491, offset 0, flags [DF], proto TCP (6), length 52)
    127.0.0.1.57800 > 127.0.0.1.12150: Flags [.], cksum 0xfe28 (incorrect -> 0x9af1), seq 903, ack 130739, win 10980, options [nop,nop,TS val 383968389 ecr 383968389], length 0
2022-04-07 03:21:25.897452 IP (tos 0x0, ttl 64, id 55501, offset 0, flags [DF], proto TCP (6), length 550)
    127.0.0.1.12150 > 127.0.0.1.57800: Flags [P.], cksum 0x001b (incorrect -> 0xc982), seq 130739:131237, ack 903, win 512, options [nop,nop,TS val 383968400 ecr 383968389], length 498
2022-04-07 03:21:25.897471 IP (tos 0x0, ttl 64, id 59492, offset 0, flags [DF], proto TCP (6), length 52)
    127.0.0.1.57800 > 127.0.0.1.12150: Flags [.], cksum 0xfe28 (incorrect -> 0x98ae), seq 903, ack 131237, win 11039, options [nop,nop,TS val 383968400 ecr 383968400], length 0
2022-04-07 03:21:25.926540 IP (tos 0x0, ttl 64, id 55502, offset 0, flags [DF], proto TCP (6), length 3358)
    127.0.0.1.12150 > 127.0.0.1.57800: Flags [P.], cksum 0x0b13 (incorrect -> 0x4f9a), seq 131237:134543, ack 903, win 512, options [nop,nop,TS val 383968429 ecr 383968400], length 3306
2022-04-07 03:21:25.926554 IP (tos 0x0, ttl 64, id 59493, offset 0, flags [DF], proto TCP (6), length 52)
    127.0.0.1.57800 > 127.0.0.1.12150: Flags [.], cksum 0xfe28 (incorrect -> 0x878b), seq 903, ack 134543, win 12062, options [nop,nop,TS val 383968429 ecr 383968429], length 0
2022-04-07 03:21:25.937092 IP (tos 0x0, ttl 64, id 55503, offset 0, flags [DF], proto TCP (6), length 550)
    127.0.0.1.12150 > 127.0.0.1.57800: Flags [P.], cksum 0x001b (incorrect -> 0xa1fc), seq 134543:135041, ack 903, win 512, options [nop,nop,TS val 383968440 ecr 383968429], length 498
2022-04-07 03:21:25.937107 IP (tos 0x0, ttl 64, id 59494, offset 0, flags [DF], proto TCP (6), length 52)
    127.0.0.1.57800 > 127.0.0.1.12150: Flags [.], cksum 0xfe28 (incorrect -> 0x8548), seq 903, ack 135041, win 12121, options [nop,nop,TS val 383968440 ecr 383968440], length 0
2022-04-07 03:21:25.971362 IP (tos 0x0, ttl 64, id 55504, offset 0, flags [DF], proto TCP (6), length 3326)
    127.0.0.1.12150 > 127.0.0.1.57800: Flags [P.], cksum 0x0af3 (incorrect -> 0x461d), seq 135041:138315, ack 903, win 512, options [nop,nop,TS val 383968474 ecr 383968440], length 3274
2022-04-07 03:21:25.971377 IP (tos 0x0, ttl 64, id 59495, offset 0, flags [DF], proto TCP (6), length 52)
    127.0.0.1.57800 > 127.0.0.1.12150: Flags [.], cksum 0xfe28 (incorrect -> 0x743b), seq 903, ack 138315, win 13144, options [nop,nop,TS val 383968474 ecr 383968474], length 0
2022-04-07 03:21:25.978284 IP (tos 0x0, ttl 64, id 55505, offset 0, flags [DF], proto TCP (6), length 550)
    127.0.0.1.12150 > 127.0.0.1.57800: Flags [P.], cksum 0x001b (incorrect -> 0x4049), seq 138315:138813, ack 903, win 512, options [nop,nop,TS val 383968481 ecr 383968474], length 498
2022-04-07 03:21:25.978364 IP (tos 0x0, ttl 64, id 59496, offset 0, flags [DF], proto TCP (6), length 52)
    127.0.0.1.57800 > 127.0.0.1.12150: Flags [.], cksum 0xfe28 (incorrect -> 0x723b), seq 903, ack 138813, win 13144, options [nop,nop,TS val 383968481 ecr 383968481], length 0
2022-04-07 03:21:25.981957 IP (tos 0x0, ttl 64, id 55506, offset 0, flags [DF], proto TCP (6), length 3612)
    127.0.0.1.12150 > 127.0.0.1.57800: Flags [P.], cksum 0x0c11 (incorrect -> 0x5735), seq 138813:142373, ack 903, win 512, options [nop,nop,TS val 383968484 ecr 383968481], length 3560
2022-04-07 03:21:25.981970 IP (tos 0x0, ttl 64, id 59497, offset 0, flags [DF], proto TCP (6), length 52)
    127.0.0.1.57800 > 127.0.0.1.12150: Flags [.], cksum 0xfe28 (incorrect -> 0x604e), seq 903, ack 142373, win 14167, options [nop,nop,TS val 383968484 ecr 383968484], length 0
2022-04-07 03:21:26.021330 IP (tos 0x0, ttl 64, id 55507, offset 0, flags [DF], proto TCP (6), length 3326)
    127.0.0.1.12150 > 127.0.0.1.57800: Flags [P.], cksum 0x0af3 (incorrect -> 0xa7c4), seq 142373:145647, ack 903, win 512, options [nop,nop,TS val 383968524 ecr 383968484], length 3274
2022-04-07 03:21:26.021350 IP (tos 0x0, ttl 64, id 59498, offset 0, flags [DF], proto TCP (6), length 52)
    127.0.0.1.57800 > 127.0.0.1.12150: Flags [.], cksum 0xfe28 (incorrect -> 0x4f35), seq 903, ack 145647, win 15190, options [nop,nop,TS val 383968524 ecr 383968524], length 0
2022-04-07 03:21:26.031822 IP (tos 0x0, ttl 64, id 55508, offset 0, flags [DF], proto TCP (6), length 550)
    127.0.0.1.12150 > 127.0.0.1.57800: Flags [P.], cksum 0x001b (incorrect -> 0x4076), seq 145647:146145, ack 903, win 512, options [nop,nop,TS val 383968534 ecr 383968524], length 498
2022-04-07 03:21:26.031861 IP (tos 0x0, ttl 64, id 59499, offset 0, flags [DF], proto TCP (6), length 52)
    127.0.0.1.57800 > 127.0.0.1.12150: Flags [.], cksum 0xfe28 (incorrect -> 0x4d2f), seq 903, ack 146145, win 15190, options [nop,nop,TS val 383968534 ecr 383968534], length 0
2022-04-07 03:21:26.070693 IP (tos 0x0, ttl 64, id 55509, offset 0, flags [DF], proto TCP (6), length 3326)
    127.0.0.1.12150 > 127.0.0.1.57800: Flags [P.], cksum 0x0af3 (incorrect -> 0xe65c), seq 146145:149419, ack 903, win 512, options [nop,nop,TS val 383968573 ecr 383968534], length 3274
2022-04-07 03:21:26.070709 IP (tos 0x0, ttl 64, id 59500, offset 0, flags [DF], proto TCP (6), length 52)
    127.0.0.1.57800 > 127.0.0.1.12150: Flags [.], cksum 0xfe28 (incorrect -> 0x3f85), seq 903, ack 149419, win 15336, options [nop,nop,TS val 383968573 ecr 383968573], length 0
2022-04-07 03:21:26.081213 IP (tos 0x0, ttl 64, id 55510, offset 0, flags [DF], proto TCP (6), length 550)
    127.0.0.1.12150 > 127.0.0.1.57800: Flags [P.], cksum 0x001b (incorrect -> 0xe808), seq 149419:149917, ack 903, win 512, options [nop,nop,TS val 383968584 ecr 383968573], length 498
2022-04-07 03:21:26.081257 IP (tos 0x0, ttl 64, id 59501, offset 0, flags [DF], proto TCP (6), length 52)
    127.0.0.1.57800 > 127.0.0.1.12150: Flags [.], cksum 0xfe28 (incorrect -> 0x3d7d), seq 903, ack 149917, win 15336, options [nop,nop,TS val 383968584 ecr 383968584], length 0
2022-04-07 03:21:26.113806 IP (tos 0x0, ttl 64, id 55511, offset 0, flags [DF], proto TCP (6), length 3114)
    127.0.0.1.12150 > 127.0.0.1.57800: Flags [P.], cksum 0x0a1f (incorrect -> 0xac42), seq 149917:152979, ack 903, win 512, options [nop,nop,TS val 383968616 ecr 383968584], length 3062
2022-04-07 03:21:26.113821 IP (tos 0x0, ttl 64, id 59502, offset 0, flags [DF], proto TCP (6), length 52)
    127.0.0.1.57800 > 127.0.0.1.12150: Flags [.], cksum 0xfe28 (incorrect -> 0x3146), seq 903, ack 152979, win 15337, options [nop,nop,TS val 383968616 ecr 383968616], length 0
2022-04-07 03:21:26.115413 IP (tos 0x0, ttl 64, id 55512, offset 0, flags [DF], proto TCP (6), length 550)
    127.0.0.1.12150 > 127.0.0.1.57800: Flags [P.], cksum 0x001b (incorrect -> 0x2c1e), seq 152979:153477, ack 903, win 512, options [nop,nop,TS val 383968618 ecr 383968616], length 498
2022-04-07 03:21:26.115452 IP (tos 0x0, ttl 64, id 59503, offset 0, flags [DF], proto TCP (6), length 52)
    127.0.0.1.57800 > 127.0.0.1.12150: Flags [.], cksum 0xfe28 (incorrect -> 0x2f50), seq 903, ack 153477, win 15337, options [nop,nop,TS val 383968618 ecr 383968618], length 0
2022-04-07 03:21:26.124340 IP (tos 0x0, ttl 64, id 55513, offset 0, flags [DF], proto TCP (6), length 3538)
    127.0.0.1.12150 > 127.0.0.1.57800: Flags [P.], cksum 0x0bc7 (incorrect -> 0xc524), seq 153477:156963, ack 903, win 512, options [nop,nop,TS val 383968627 ecr 383968618], length 3486
2022-04-07 03:21:26.124395 IP (tos 0x0, ttl 64, id 59504, offset 0, flags [DF], proto TCP (6), length 52)
    127.0.0.1.57800 > 127.0.0.1.12150: Flags [.], cksum 0xfe28 (incorrect -> 0x21a0), seq 903, ack 156963, win 15337, options [nop,nop,TS val 383968627 ecr 383968627], length 0
2022-04-07 03:21:26.144799 IP (tos 0x0, ttl 64, id 55514, offset 0, flags [DF], proto TCP (6), length 3538)
    127.0.0.1.12150 > 127.0.0.1.57800: Flags [P.], cksum 0x0bc7 (incorrect -> 0x4892), seq 156963:160449, ack 903, win 512, options [nop,nop,TS val 383968647 ecr 383968627], length 3486
2022-04-07 03:21:26.186656 IP (tos 0x0, ttl 64, id 59505, offset 0, flags [DF], proto TCP (6), length 52)
    127.0.0.1.57800 > 127.0.0.1.12150: Flags [.], cksum 0xfe28 (incorrect -> 0x13b0), seq 903, ack 160449, win 15337, options [nop,nop,TS val 383968689 ecr 383968647], length 0
2022-04-07 03:21:26.186664 IP (tos 0x0, ttl 64, id 55515, offset 0, flags [DF], proto TCP (6), length 13498)
    127.0.0.1.12150 > 127.0.0.1.57800: Flags [P.], cksum 0x32af (incorrect -> 0xe47d), seq 160449:173895, ack 903, win 512, options [nop,nop,TS val 383968689 ecr 383968689], length 13446
2022-04-07 03:21:26.230682 IP (tos 0x0, ttl 64, id 59506, offset 0, flags [DF], proto TCP (6), length 52)
    127.0.0.1.57800 > 127.0.0.1.12150: Flags [.], cksum 0xfe28 (incorrect -> 0xded3), seq 903, ack 173895, win 15337, options [nop,nop,TS val 383968733 ecr 383968689], length 0
2022-04-07 03:21:26.230692 IP (tos 0x0, ttl 64, id 55516, offset 0, flags [DF], proto TCP (6), length 6526)
    127.0.0.1.12150 > 127.0.0.1.57800: Flags [P.], cksum 0x1773 (incorrect -> 0x5c09), seq 173895:180369, ack 903, win 512, options [nop,nop,TS val 383968733 ecr 383968733], length 6474
2022-04-07 03:21:26.230818 IP (tos 0x0, ttl 64, id 59507, offset 0, flags [DF], proto TCP (6), length 52)
    127.0.0.1.57800 > 127.0.0.1.12150: Flags [.], cksum 0xfe28 (incorrect -> 0xc55d), seq 903, ack 180369, win 15337, options [nop,nop,TS val 383968733 ecr 383968733], length 0
2022-04-07 03:21:26.263798 IP (tos 0x0, ttl 64, id 55517, offset 0, flags [DF], proto TCP (6), length 4036)
    127.0.0.1.12150 > 127.0.0.1.57800: Flags [P.], cksum 0x0db9 (incorrect -> 0x19b8), seq 180369:184353, ack 903, win 512, options [nop,nop,TS val 383968766 ecr 383968733], length 3984
2022-04-07 03:21:26.263917 IP (tos 0x0, ttl 64, id 59508, offset 0, flags [DF], proto TCP (6), length 52)
    127.0.0.1.57800 > 127.0.0.1.12150: Flags [.], cksum 0xfe28 (incorrect -> 0xb58b), seq 903, ack 184353, win 15337, options [nop,nop,TS val 383968766 ecr 383968766], length 0
2022-04-07 03:21:26.272681 IP (tos 0x0, ttl 64, id 55518, offset 0, flags [DF], proto TCP (6), length 4036)
    127.0.0.1.12150 > 127.0.0.1.57800: Flags [P.], cksum 0x0db9 (incorrect -> 0x5290), seq 184353:188337, ack 903, win 512, options [nop,nop,TS val 383968775 ecr 383968766], length 3984
2022-04-07 03:21:26.314655 IP (tos 0x0, ttl 64, id 59509, offset 0, flags [DF], proto TCP (6), length 52)
    127.0.0.1.57800 > 127.0.0.1.12150: Flags [.], cksum 0xfe28 (incorrect -> 0xa5bf), seq 903, ack 188337, win 15337, options [nop,nop,TS val 383968817 ecr 383968775], length 0
2022-04-07 03:21:26.314662 IP (tos 0x0, ttl 64, id 55519, offset 0, flags [DF], proto TCP (6), length 7522)
    127.0.0.1.12150 > 127.0.0.1.57800: Flags [P.], cksum 0x1b57 (incorrect -> 0x9017), seq 188337:195807, ack 903, win 512, options [nop,nop,TS val 383968817 ecr 383968817], length 7470
2022-04-07 03:21:26.358652 IP (tos 0x0, ttl 64, id 59510, offset 0, flags [DF], proto TCP (6), length 52)
    127.0.0.1.57800 > 127.0.0.1.12150: Flags [.], cksum 0xfe28 (incorrect -> 0x883b), seq 903, ack 195807, win 15337, options [nop,nop,TS val 383968861 ecr 383968817], length 0
429, 3.8152899742126465, 4.33392071723938