2022-04-07 23:29:27.234680 IP (tos 0x0, ttl 64, id 11423, offset 0, flags [DF], proto TCP (6), length 60)
    127.0.0.1.53554 > 127.0.0.1.11750: Flags [S], cksum 0xfe30 (incorrect -> 0x8cf4), seq 3396405203, win 65495, options [mss 65495,sackOK,TS val 3530366786 ecr 0,nop,wscale 7], length 0
2022-04-07 23:29:27.234696 IP (tos 0x0, ttl 64, id 0, offset 0, flags [DF], proto TCP (6), length 60)
    127.0.0.1.11750 > 127.0.0.1.53554: Flags [S.], cksum 0xfe30 (incorrect -> 0x28cf), seq 3176183071, ack 3396405204, win 65483, options [mss 65495,sackOK,TS val 3530366786 ecr 3530366786,nop,wscale 7], length 0
2022-04-07 23:29:27.234709 IP (tos 0x0, ttl 64, id 11424, offset 0, flags [DF], proto TCP (6), length 52)
    127.0.0.1.53554 > 127.0.0.1.11750: Flags [.], cksum 0xfe28 (incorrect -> 0x4f8b), seq 1, ack 1, win 512, options [nop,nop,TS val 3530366786 ecr 3530366786], length 0
2022-04-07 23:29:27.234845 IP (tos 0x0, ttl 64, id 11425, offset 0, flags [DF], proto TCP (6), length 55)
    127.0.0.1.53554 > 127.0.0.1.11750: Flags [P.], cksum 0xfe2b (incorrect -> 0x4a7f), seq 1:4, ack 1, win 512, options [nop,nop,TS val 3530366786 ecr 3530366786], length 3
2022-04-07 23:29:27.234859 IP (tos 0x0, ttl 64, id 41518, offset 0, flags [DF], proto TCP (6), length 52)
    127.0.0.1.11750 > 127.0.0.1.53554: Flags [.], cksum 0xfe28 (incorrect -> 0x4f88), seq 1, ack 4, win 512, options [nop,nop,TS val 3530366786 ecr 3530366786], length 0
2022-04-07 23:29:27.234929 IP (tos 0x0, ttl 64, id 41519, offset 0, flags [DF], proto TCP (6), length 54)
    127.0.0.1.11750 > 127.0.0.1.53554: Flags [P.], cksum 0xfe2a (incorrect -> 0x4a7e), seq 1:3, ack 4, win 512, options [nop,nop,TS val 3530366786 ecr 3530366786], length 2
2022-04-07 23:29:27.234936 IP (tos 0x0, ttl 64, id 11426, offset 0, flags [DF], proto TCP (6), length 52)
    127.0.0.1.53554 > 127.0.0.1.11750: Flags [.], cksum 0xfe28 (incorrect -> 0x4f86), seq 4, ack 3, win 512, options [nop,nop,TS val 3530366786 ecr 3530366786], length 0
2022-04-07 23:29:27.241950 IP (tos 0x0, ttl 64, id 11427, offset 0, flags [DF], proto TCP (6), length 62)
    127.0.0.1.53554 > 127.0.0.1.11750: Flags [P.], cksum 0xfe32 (incorrect -> 0x0de3), seq 4:14, ack 3, win 512, options [nop,nop,TS val 3530366793 ecr 3530366786], length 10
2022-04-07 23:29:27.241961 IP (tos 0x0, ttl 64, id 41520, offset 0, flags [DF], proto TCP (6), length 52)
    127.0.0.1.11750 > 127.0.0.1.53554: Flags [.], cksum 0xfe28 (incorrect -> 0x4f6e), seq 3, ack 14, win 512, options [nop,nop,TS val 3530366793 ecr 3530366793], length 0
2022-04-07 23:29:27.292976 IP (tos 0x0, ttl 64, id 41521, offset 0, flags [DF], proto TCP (6), length 62)
    127.0.0.1.11750 > 127.0.0.1.53554: Flags [P.], cksum 0xfe32 (incorrect -> 0x4a28), seq 3:13, ack 14, win 512, options [nop,nop,TS val 3530366844 ecr 3530366793], length 10
2022-04-07 23:29:27.292995 IP (tos 0x0, ttl 64, id 11428, offset 0, flags [DF], proto TCP (6), length 52)
    127.0.0.1.53554 > 127.0.0.1.11750: Flags [.], cksum 0xfe28 (incorrect -> 0x4efe), seq 14, ack 13, win 512, options [nop,nop,TS val 3530366844 ecr 3530366844], length 0
2022-04-07 23:29:27.299784 IP (tos 0x0, ttl 64, id 11429, offset 0, flags [DF], proto TCP (6), length 569)
    127.0.0.1.53554 > 127.0.0.1.11750: Flags [P.], cksum 0x002e (incorrect -> 0x49c4), seq 14:531, ack 13, win 512, options [nop,nop,TS val 3530366851 ecr 3530366844], length 517
2022-04-07 23:29:27.299794 IP (tos 0x0, ttl 64, id 41522, offset 0, flags [DF], proto TCP (6), length 52)
    127.0.0.1.11750 > 127.0.0.1.53554: Flags [.], cksum 0xfe28 (incorrect -> 0x4cef), seq 13, ack 531, win 508, options [nop,nop,TS val 3530366851 ecr 3530366851], length 0
2022-04-07 23:29:27.369902 IP (tos 0x0, ttl 64, id 41523, offset 0, flags [DF], proto TCP (6), length 3538)
    127.0.0.1.11750 > 127.0.0.1.53554: Flags [P.], cksum 0x0bc7 (incorrect -> 0x140c), seq 13:3499, ack 531, win 512, options [nop,nop,TS val 3530366921 ecr 3530366851], length 3486
2022-04-07 23:29:27.369914 IP (tos 0x0, ttl 64, id 11430, offset 0, flags [DF], proto TCP (6), length 52)
    127.0.0.1.53554 > 127.0.0.1.11750: Flags [.], cksum 0xfe28 (incorrect -> 0x3ed3), seq 531, ack 3499, win 494, options [nop,nop,TS val 3530366921 ecr 3530366921], length 0
2022-04-07 23:29:27.417875 IP (tos 0x0, ttl 64, id 41524, offset 0, flags [DF], proto TCP (6), length 660)
    127.0.0.1.11750 > 127.0.0.1.53554: Flags [P.], cksum 0x0089 (incorrect -> 0xb5f2), seq 3499:4107, ack 531, win 512, options [nop,nop,TS val 3530366969 ecr 3530366921], length 608
2022-04-07 23:29:27.417886 IP (tos 0x0, ttl 64, id 11431, offset 0, flags [DF], proto TCP (6), length 52)
    127.0.0.1.53554 > 127.0.0.1.11750: Flags [.], cksum 0xfe28 (incorrect -> 0x3c08), seq 531, ack 4107, win 505, options [nop,nop,TS val 3530366969 ecr 3530366969], length 0
2022-04-07 23:29:27.418470 IP (tos 0x0, ttl 64, id 11432, offset 0, flags [DF], proto TCP (6), length 132)
    127.0.0.1.53554 > 127.0.0.1.11750: Flags [P.], cksum 0xfe78 (incorrect -> 0x1c53), seq 531:611, ack 4107, win 512, options [nop,nop,TS val 3530366970 ecr 3530366969], length 80
2022-04-07 23:29:27.418480 IP (tos 0x0, ttl 64, id 41525, offset 0, flags [DF], proto TCP (6), length 52)
    127.0.0.1.11750 > 127.0.0.1.53554: Flags [.], cksum 0xfe28 (incorrect -> 0x3baf), seq 4107, ack 611, win 512, options [nop,nop,TS val 3530366970 ecr 3530366970], length 0
2022-04-07 23:29:27.419039 IP (tos 0x0, ttl 64, id 11433, offset 0, flags [DF], proto TCP (6), length 338)
    127.0.0.1.53554 > 127.0.0.1.11750: Flags [P.], cksum 0xff46 (incorrect -> 0x7758), seq 611:897, ack 4107, win 512, options [nop,nop,TS val 3530366970 ecr 3530366970], length 286
2022-04-07 23:29:27.419055 IP (tos 0x0, ttl 64, id 41526, offset 0, flags [DF], proto TCP (6), length 52)
    127.0.0.1.11750 > 127.0.0.1.53554: Flags [.], cksum 0xfe28 (incorrect -> 0x3a93), seq 4107, ack 897, win 510, options [nop,nop,TS val 3530366970 ecr 3530366970], length 0
2022-04-07 23:29:27.498830 IP (tos 0x0, ttl 64, id 41527, offset 0, flags [DF], proto TCP (6), length 594)
    127.0.0.1.11750 > 127.0.0.1.53554: Flags [P.], cksum 0x0047 (incorrect -> 0xbbe3), seq 4107:4649, ack 897, win 512, options [nop,nop,TS val 3530367050 ecr 3530366970], length 542
2022-04-07 23:29:27.498840 IP (tos 0x0, ttl 64, id 11434, offset 0, flags [DF], proto TCP (6), length 52)
    127.0.0.1.53554 > 127.0.0.1.11750: Flags [.], cksum 0xfe28 (incorrect -> 0x37d7), seq 897, ack 4649, win 508, options [nop,nop,TS val 3530367050 ecr 3530367050], length 0
