2022-04-07 19:35:46.908681 IP (tos 0x0, ttl 64, id 62332, offset 0, flags [DF], proto TCP (6), length 60)
    127.0.0.1.39660 > 127.0.0.1.11450: Flags [S], cksum 0xfe30 (incorrect -> 0x0451), seq 4022702672, win 65495, options [mss 65495,sackOK,TS val 3516346460 ecr 0,nop,wscale 7], length 0
2022-04-07 19:35:46.908695 IP (tos 0x0, ttl 64, id 0, offset 0, flags [DF], proto TCP (6), length 60)
    127.0.0.1.11450 > 127.0.0.1.39660: Flags [S.], cksum 0xfe30 (incorrect -> 0x36b5), seq 1651599665, ack 4022702673, win 65483, options [mss 65495,sackOK,TS val 3516346460 ecr 3516346460,nop,wscale 7], length 0
2022-04-07 19:35:46.908706 IP (tos 0x0, ttl 64, id 62333, offset 0, flags [DF], proto TCP (6), length 52)
    127.0.0.1.39660 > 127.0.0.1.11450: Flags [.], cksum 0xfe28 (incorrect -> 0x5d71), seq 1, ack 1, win 512, options [nop,nop,TS val 3516346460 ecr 3516346460], length 0
2022-04-07 19:35:46.908805 IP (tos 0x0, ttl 64, id 62334, offset 0, flags [DF], proto TCP (6), length 55)
    127.0.0.1.39660 > 127.0.0.1.11450: Flags [P.], cksum 0xfe2b (incorrect -> 0x5865), seq 1:4, ack 1, win 512, options [nop,nop,TS val 3516346460 ecr 3516346460], length 3
2022-04-07 19:35:46.908811 IP (tos 0x0, ttl 64, id 3690, offset 0, flags [DF], proto TCP (6), length 52)
    127.0.0.1.11450 > 127.0.0.1.39660: Flags [.], cksum 0xfe28 (incorrect -> 0x5d6e), seq 1, ack 4, win 512, options [nop,nop,TS val 3516346460 ecr 3516346460], length 0
2022-04-07 19:35:46.908882 IP (tos 0x0, ttl 64, id 3691, offset 0, flags [DF], proto TCP (6), length 54)
    127.0.0.1.11450 > 127.0.0.1.39660: Flags [P.], cksum 0xfe2a (incorrect -> 0x5864), seq 1:3, ack 4, win 512, options [nop,nop,TS val 3516346460 ecr 3516346460], length 2
2022-04-07 19:35:46.908890 IP (tos 0x0, ttl 64, id 62335, offset 0, flags [DF], proto TCP (6), length 52)
    127.0.0.1.39660 > 127.0.0.1.11450: Flags [.], cksum 0xfe28 (incorrect -> 0x5d6c), seq 4, ack 3, win 512, options [nop,nop,TS val 3516346460 ecr 3516346460], length 0
2022-04-07 19:35:46.910502 IP (tos 0x0, ttl 64, id 62336, offset 0, flags [DF], proto TCP (6), length 62)
    127.0.0.1.39660 > 127.0.0.1.11450: Flags [P.], cksum 0xfe32 (incorrect -> 0x2917), seq 4:14, ack 3, win 512, options [nop,nop,TS val 3516346462 ecr 3516346460], length 10
2022-04-07 19:35:46.910512 IP (tos 0x0, ttl 64, id 3692, offset 0, flags [DF], proto TCP (6), length 52)
    127.0.0.1.11450 > 127.0.0.1.39660: Flags [.], cksum 0xfe28 (incorrect -> 0x5d5e), seq 3, ack 14, win 512, options [nop,nop,TS val 3516346462 ecr 3516346462], length 0
2022-04-07 19:35:47.012470 IP (tos 0x0, ttl 64, id 3693, offset 0, flags [DF], proto TCP (6), length 62)
    127.0.0.1.11450 > 127.0.0.1.39660: Flags [P.], cksum 0xfe32 (incorrect -> 0x57e5), seq 3:13, ack 14, win 512, options [nop,nop,TS val 3516346564 ecr 3516346462], length 10
2022-04-07 19:35:47.012488 IP (tos 0x0, ttl 64, id 62337, offset 0, flags [DF], proto TCP (6), length 52)
    127.0.0.1.39660 > 127.0.0.1.11450: Flags [.], cksum 0xfe28 (incorrect -> 0x5c88), seq 14, ack 13, win 512, options [nop,nop,TS val 3516346564 ecr 3516346564], length 0
2022-04-07 19:35:47.018462 IP (tos 0x0, ttl 64, id 62338, offset 0, flags [DF], proto TCP (6), length 569)
    127.0.0.1.39660 > 127.0.0.1.11450: Flags [P.], cksum 0x002e (incorrect -> 0x4b3f), seq 14:531, ack 13, win 512, options [nop,nop,TS val 3516346570 ecr 3516346564], length 517
2022-04-07 19:35:47.018473 IP (tos 0x0, ttl 64, id 3694, offset 0, flags [DF], proto TCP (6), length 52)
    127.0.0.1.11450 > 127.0.0.1.39660: Flags [.], cksum 0xfe28 (incorrect -> 0x5a7b), seq 13, ack 531, win 508, options [nop,nop,TS val 3516346570 ecr 3516346570], length 0
200, 3.753016233444214, 0.8926787376403809