2022-04-07 19:40:09.022745 IP (tos 0x0, ttl 64, id 17382, offset 0, flags [DF], proto TCP (6), length 60)
    127.0.0.1.53742 > 127.0.0.1.9350: Flags [S], cksum 0xfe30 (incorrect -> 0x58e1), seq 1360965043, win 65495, options [mss 65495,sackOK,TS val 3516608574 ecr 0,nop,wscale 7], length 0
2022-04-07 19:40:09.022760 IP (tos 0x0, ttl 64, id 0, offset 0, flags [DF], proto TCP (6), length 60)
    127.0.0.1.9350 > 127.0.0.1.53742: Flags [S.], cksum 0xfe30 (incorrect -> 0xa38f), seq 3986671058, ack 1360965044, win 65483, options [mss 65495,sackOK,TS val 3516608574 ecr 3516608574,nop,wscale 7], length 0
2022-04-07 19:40:09.022787 IP (tos 0x0, ttl 64, id 17383, offset 0, flags [DF], proto TCP (6), length 52)
    127.0.0.1.53742 > 127.0.0.1.9350: Flags [.], cksum 0xfe28 (incorrect -> 0xca4b), seq 1, ack 1, win 512, options [nop,nop,TS val 3516608574 ecr 3516608574], length 0
2022-04-07 19:40:09.022897 IP (tos 0x0, ttl 64, id 17384, offset 0, flags [DF], proto TCP (6), length 55)
    127.0.0.1.53742 > 127.0.0.1.9350: Flags [P.], cksum 0xfe2b (incorrect -> 0xc53f), seq 1:4, ack 1, win 512, options [nop,nop,TS val 3516608574 ecr 3516608574], length 3
2022-04-07 19:40:09.022903 IP (tos 0x0, ttl 64, id 48854, offset 0, flags [DF], proto TCP (6), length 52)
    127.0.0.1.9350 > 127.0.0.1.53742: Flags [.], cksum 0xfe28 (incorrect -> 0xca48), seq 1, ack 4, win 512, options [nop,nop,TS val 3516608574 ecr 3516608574], length 0
2022-04-07 19:40:09.022971 IP (tos 0x0, ttl 64, id 48855, offset 0, flags [DF], proto TCP (6), length 54)
    127.0.0.1.9350 > 127.0.0.1.53742: Flags [P.], cksum 0xfe2a (incorrect -> 0xc53e), seq 1:3, ack 4, win 512, options [nop,nop,TS val 3516608574 ecr 3516608574], length 2
2022-04-07 19:40:09.022998 IP (tos 0x0, ttl 64, id 17385, offset 0, flags [DF], proto TCP (6), length 52)
    127.0.0.1.53742 > 127.0.0.1.9350: Flags [.], cksum 0xfe28 (incorrect -> 0xca46), seq 4, ack 3, win 512, options [nop,nop,TS val 3516608574 ecr 3516608574], length 0
2022-04-07 19:40:09.219849 IP (tos 0x0, ttl 64, id 17386, offset 0, flags [DF], proto TCP (6), length 62)
    127.0.0.1.53742 > 127.0.0.1.9350: Flags [P.], cksum 0xfe32 (incorrect -> 0x0343), seq 4:14, ack 3, win 512, options [nop,nop,TS val 3516608771 ecr 3516608574], length 10
2022-04-07 19:40:09.219862 IP (tos 0x0, ttl 64, id 48856, offset 0, flags [DF], proto TCP (6), length 52)
    127.0.0.1.9350 > 127.0.0.1.53742: Flags [.], cksum 0xfe28 (incorrect -> 0xc8b2), seq 3, ack 14, win 512, options [nop,nop,TS val 3516608771 ecr 3516608771], length 0
2022-04-07 19:40:09.433099 IP (tos 0x0, ttl 64, id 48857, offset 0, flags [DF], proto TCP (6), length 62)
    127.0.0.1.9350 > 127.0.0.1.53742: Flags [P.], cksum 0xfe32 (incorrect -> 0xc2ca), seq 3:13, ack 14, win 512, options [nop,nop,TS val 3516608984 ecr 3516608771], length 10
2022-04-07 19:40:09.433113 IP (tos 0x0, ttl 64, id 17387, offset 0, flags [DF], proto TCP (6), length 52)
    127.0.0.1.53742 > 127.0.0.1.9350: Flags [.], cksum 0xfe28 (incorrect -> 0xc6fe), seq 14, ack 13, win 512, options [nop,nop,TS val 3516608984 ecr 3516608984], length 0
2022-04-07 19:40:09.438980 IP (tos 0x0, ttl 64, id 17388, offset 0, flags [DF], proto TCP (6), length 569)
    127.0.0.1.53742 > 127.0.0.1.9350: Flags [P.], cksum 0x002e (incorrect -> 0x6a9b), seq 14:531, ack 13, win 512, options [nop,nop,TS val 3516608990 ecr 3516608984], length 517
2022-04-07 19:40:09.438996 IP (tos 0x0, ttl 64, id 48858, offset 0, flags [DF], proto TCP (6), length 52)
    127.0.0.1.9350 > 127.0.0.1.53742: Flags [.], cksum 0xfe28 (incorrect -> 0xc4f1), seq 13, ack 531, win 508, options [nop,nop,TS val 3516608990 ecr 3516608990], length 0
