2022-04-07 16:29:53.295934 IP (tos 0x0, ttl 64, id 65158, offset 0, flags [DF], proto TCP (6), length 60)
    127.0.0.1.59090 > 127.0.0.1.12050: Flags [S], cksum 0xfe30 (incorrect -> 0x4490), seq 1188683318, win 65495, options [mss 65495,sackOK,TS val 3505192847 ecr 0,nop,wscale 7], length 0
2022-04-07 16:29:53.295942 IP (tos 0x0, ttl 64, id 0, offset 0, flags [DF], proto TCP (6), length 60)
    127.0.0.1.12050 > 127.0.0.1.59090: Flags [S.], cksum 0xfe30 (incorrect -> 0x18c8), seq 856041536, ack 1188683319, win 65483, options [mss 65495,sackOK,TS val 3505192847 ecr 3505192847,nop,wscale 7], length 0
2022-04-07 16:29:53.295948 IP (tos 0x0, ttl 64, id 65159, offset 0, flags [DF], proto TCP (6), length 52)
    127.0.0.1.59090 > 127.0.0.1.12050: Flags [.], cksum 0xfe28 (incorrect -> 0x3f84), seq 1, ack 1, win 512, options [nop,nop,TS val 3505192847 ecr 3505192847], length 0
2022-04-07 16:29:53.296035 IP (tos 0x0, ttl 64, id 65160, offset 0, flags [DF], proto TCP (6), length 55)
    127.0.0.1.59090 > 127.0.0.1.12050: Flags [P.], cksum 0xfe2b (incorrect -> 0x3a78), seq 1:4, ack 1, win 512, options [nop,nop,TS val 3505192847 ecr 3505192847], length 3
2022-04-07 16:29:53.296045 IP (tos 0x0, ttl 64, id 5881, offset 0, flags [DF], proto TCP (6), length 52)
    127.0.0.1.12050 > 127.0.0.1.59090: Flags [.], cksum 0xfe28 (incorrect -> 0x3f81), seq 1, ack 4, win 512, options [nop,nop,TS val 3505192847 ecr 3505192847], length 0
2022-04-07 16:29:53.296109 IP (tos 0x0, ttl 64, id 5882, offset 0, flags [DF], proto TCP (6), length 54)
    127.0.0.1.12050 > 127.0.0.1.59090: Flags [P.], cksum 0xfe2a (incorrect -> 0x3a77), seq 1:3, ack 4, win 512, options [nop,nop,TS val 3505192847 ecr 3505192847], length 2
2022-04-07 16:29:53.296121 IP (tos 0x0, ttl 64, id 65161, offset 0, flags [DF], proto TCP (6), length 52)
    127.0.0.1.59090 > 127.0.0.1.12050: Flags [.], cksum 0xfe28 (incorrect -> 0x3f7f), seq 4, ack 3, win 512, options [nop,nop,TS val 3505192847 ecr 3505192847], length 0
2022-04-07 16:29:53.296771 IP (tos 0x0, ttl 64, id 65162, offset 0, flags [DF], proto TCP (6), length 62)
    127.0.0.1.59090 > 127.0.0.1.12050: Flags [P.], cksum 0xfe32 (incorrect -> 0x2e28), seq 4:14, ack 3, win 512, options [nop,nop,TS val 3505192848 ecr 3505192847], length 10
2022-04-07 16:29:53.296786 IP (tos 0x0, ttl 64, id 5883, offset 0, flags [DF], proto TCP (6), length 52)
    127.0.0.1.12050 > 127.0.0.1.59090: Flags [.], cksum 0xfe28 (incorrect -> 0x3f73), seq 3, ack 14, win 512, options [nop,nop,TS val 3505192848 ecr 3505192848], length 0
2022-04-07 16:29:53.388232 IP (tos 0x0, ttl 64, id 5884, offset 0, flags [DF], proto TCP (6), length 62)
    127.0.0.1.12050 > 127.0.0.1.59090: Flags [P.], cksum 0xfe32 (incorrect -> 0x3a04), seq 3:13, ack 14, win 512, options [nop,nop,TS val 3505192940 ecr 3505192848], length 10
2022-04-07 16:29:53.388241 IP (tos 0x0, ttl 64, id 65163, offset 0, flags [DF], proto TCP (6), length 52)
    127.0.0.1.59090 > 127.0.0.1.12050: Flags [.], cksum 0xfe28 (incorrect -> 0x3eb1), seq 14, ack 13, win 512, options [nop,nop,TS val 3505192940 ecr 3505192940], length 0
2022-04-07 16:29:53.393807 IP (tos 0x0, ttl 64, id 65164, offset 0, flags [DF], proto TCP (6), length 569)
    127.0.0.1.59090 > 127.0.0.1.12050: Flags [P.], cksum 0x002e (incorrect -> 0x5185), seq 14:531, ack 13, win 512, options [nop,nop,TS val 3505192945 ecr 3505192940], length 517
2022-04-07 16:29:53.393815 IP (tos 0x0, ttl 64, id 5885, offset 0, flags [DF], proto TCP (6), length 52)
    127.0.0.1.12050 > 127.0.0.1.59090: Flags [.], cksum 0xfe28 (incorrect -> 0x3ca6), seq 13, ack 531, win 508, options [nop,nop,TS val 3505192945 ecr 3505192945], length 0
200, 5.943586111068726, 0.3744328022003174