2022-04-07 01:42:50.392302 IP (tos 0x0, ttl 64, id 45753, offset 0, flags [DF], proto TCP (6), length 60)
    127.0.0.1.51404 > 127.0.0.1.10950: Flags [S], cksum 0xfe30 (incorrect -> 0xeac2), seq 2683705870, win 65495, options [mss 65495,sackOK,TS val 378052895 ecr 0,nop,wscale 7], length 0
2022-04-07 01:42:50.392324 IP (tos 0x0, ttl 64, id 0, offset 0, flags [DF], proto TCP (6), length 60)
    127.0.0.1.10950 > 127.0.0.1.51404: Flags [S.], cksum 0xfe30 (incorrect -> 0xde84), seq 2036456239, ack 2683705871, win 65483, options [mss 65495,sackOK,TS val 378052895 ecr 378052895,nop,wscale 7], length 0
2022-04-07 01:42:50.392340 IP (tos 0x0, ttl 64, id 45754, offset 0, flags [DF], proto TCP (6), length 52)
    127.0.0.1.51404 > 127.0.0.1.10950: Flags [.], cksum 0xfe28 (incorrect -> 0x0541), seq 1, ack 1, win 512, options [nop,nop,TS val 378052895 ecr 378052895], length 0
2022-04-07 01:42:50.392431 IP (tos 0x0, ttl 64, id 45755, offset 0, flags [DF], proto TCP (6), length 55)
    127.0.0.1.51404 > 127.0.0.1.10950: Flags [P.], cksum 0xfe2b (incorrect -> 0x0035), seq 1:4, ack 1, win 512, options [nop,nop,TS val 378052895 ecr 378052895], length 3
2022-04-07 01:42:50.392438 IP (tos 0x0, ttl 64, id 49955, offset 0, flags [DF], proto TCP (6), length 52)
    127.0.0.1.10950 > 127.0.0.1.51404: Flags [.], cksum 0xfe28 (incorrect -> 0x053e), seq 1, ack 4, win 512, options [nop,nop,TS val 378052895 ecr 378052895], length 0
2022-04-07 01:42:50.392506 IP (tos 0x0, ttl 64, id 49956, offset 0, flags [DF], proto TCP (6), length 54)
    127.0.0.1.10950 > 127.0.0.1.51404: Flags [P.], cksum 0xfe2a (incorrect -> 0x0034), seq 1:3, ack 4, win 512, options [nop,nop,TS val 378052895 ecr 378052895], length 2
2022-04-07 01:42:50.392514 IP (tos 0x0, ttl 64, id 45756, offset 0, flags [DF], proto TCP (6), length 52)
    127.0.0.1.51404 > 127.0.0.1.10950: Flags [.], cksum 0xfe28 (incorrect -> 0x053c), seq 4, ack 3, win 512, options [nop,nop,TS val 378052895 ecr 378052895], length 0
2022-04-07 01:42:50.393182 IP (tos 0x0, ttl 64, id 45757, offset 0, flags [DF], proto TCP (6), length 62)
    127.0.0.1.51404 > 127.0.0.1.10950: Flags [P.], cksum 0xfe32 (incorrect -> 0xf91b), seq 4:14, ack 3, win 512, options [nop,nop,TS val 378052896 ecr 378052895], length 10
2022-04-07 01:42:50.393192 IP (tos 0x0, ttl 64, id 49957, offset 0, flags [DF], proto TCP (6), length 52)
    127.0.0.1.10950 > 127.0.0.1.51404: Flags [.], cksum 0xfe28 (incorrect -> 0x0530), seq 3, ack 14, win 512, options [nop,nop,TS val 378052896 ecr 378052896], length 0
2022-04-07 01:42:50.517871 IP (tos 0x0, ttl 64, id 49958, offset 0, flags [DF], proto TCP (6), length 62)
    127.0.0.1.10950 > 127.0.0.1.51404: Flags [P.], cksum 0xfe32 (incorrect -> 0xffa0), seq 3:13, ack 14, win 512, options [nop,nop,TS val 378053020 ecr 378052896], length 10
2022-04-07 01:42:50.517879 IP (tos 0x0, ttl 64, id 45758, offset 0, flags [DF], proto TCP (6), length 52)
    127.0.0.1.51404 > 127.0.0.1.10950: Flags [.], cksum 0xfe28 (incorrect -> 0x042e), seq 14, ack 13, win 512, options [nop,nop,TS val 378053020 ecr 378053020], length 0
2022-04-07 01:42:50.524467 IP (tos 0x0, ttl 64, id 45759, offset 0, flags [DF], proto TCP (6), length 569)
    127.0.0.1.51404 > 127.0.0.1.10950: Flags [P.], cksum 0x002e (incorrect -> 0x2029), seq 14:531, ack 13, win 512, options [nop,nop,TS val 378053027 ecr 378053020], length 517
2022-04-07 01:42:50.524477 IP (tos 0x0, ttl 64, id 49959, offset 0, flags [DF], proto TCP (6), length 52)
    127.0.0.1.10950 > 127.0.0.1.51404: Flags [.], cksum 0xfe28 (incorrect -> 0x021f), seq 13, ack 531, win 508, options [nop,nop,TS val 378053027 ecr 378053027], length 0
200, 3.5204694271087646, 0.7330009937286377