2022-04-07 22:43:22.466398 IP (tos 0x0, ttl 64, id 35726, offset 0, flags [DF], proto TCP (6), length 60)
    127.0.0.1.43498 > 127.0.0.1.11250: Flags [S], cksum 0xfe30 (incorrect -> 0x5d42), seq 1699345907, win 65495, options [mss 65495,sackOK,TS val 3527602018 ecr 0,nop,wscale 7], length 0
2022-04-07 22:43:22.466419 IP (tos 0x0, ttl 64, id 0, offset 0, flags [DF], proto TCP (6), length 60)
    127.0.0.1.11250 > 127.0.0.1.43498: Flags [S.], cksum 0xfe30 (incorrect -> 0x5958), seq 783553419, ack 1699345908, win 65483, options [mss 65495,sackOK,TS val 3527602018 ecr 3527602018,nop,wscale 7], length 0
2022-04-07 22:43:22.466434 IP (tos 0x0, ttl 64, id 35727, offset 0, flags [DF], proto TCP (6), length 52)
    127.0.0.1.43498 > 127.0.0.1.11250: Flags [.], cksum 0xfe28 (incorrect -> 0x8014), seq 1, ack 1, win 512, options [nop,nop,TS val 3527602018 ecr 3527602018], length 0
2022-04-07 22:43:22.466570 IP (tos 0x0, ttl 64, id 35728, offset 0, flags [DF], proto TCP (6), length 55)
    127.0.0.1.43498 > 127.0.0.1.11250: Flags [P.], cksum 0xfe2b (incorrect -> 0x7b08), seq 1:4, ack 1, win 512, options [nop,nop,TS val 3527602018 ecr 3527602018], length 3
2022-04-07 22:43:22.466588 IP (tos 0x0, ttl 64, id 14241, offset 0, flags [DF], proto TCP (6), length 52)
    127.0.0.1.11250 > 127.0.0.1.43498: Flags [.], cksum 0xfe28 (incorrect -> 0x8011), seq 1, ack 4, win 512, options [nop,nop,TS val 3527602018 ecr 3527602018], length 0
2022-04-07 22:43:22.466633 IP (tos 0x0, ttl 64, id 14242, offset 0, flags [DF], proto TCP (6), length 54)
    127.0.0.1.11250 > 127.0.0.1.43498: Flags [P.], cksum 0xfe2a (incorrect -> 0x7b07), seq 1:3, ack 4, win 512, options [nop,nop,TS val 3527602018 ecr 3527602018], length 2
2022-04-07 22:43:22.466648 IP (tos 0x0, ttl 64, id 35729, offset 0, flags [DF], proto TCP (6), length 52)
    127.0.0.1.43498 > 127.0.0.1.11250: Flags [.], cksum 0xfe28 (incorrect -> 0x800f), seq 4, ack 3, win 512, options [nop,nop,TS val 3527602018 ecr 3527602018], length 0
2022-04-07 22:43:22.468872 IP (tos 0x0, ttl 64, id 35730, offset 0, flags [DF], proto TCP (6), length 62)
    127.0.0.1.43498 > 127.0.0.1.11250: Flags [P.], cksum 0xfe32 (incorrect -> 0x7c0d), seq 4:14, ack 3, win 512, options [nop,nop,TS val 3527602020 ecr 3527602018], length 10
2022-04-07 22:43:22.468891 IP (tos 0x0, ttl 64, id 14243, offset 0, flags [DF], proto TCP (6), length 52)
    127.0.0.1.11250 > 127.0.0.1.43498: Flags [.], cksum 0xfe28 (incorrect -> 0x8001), seq 3, ack 14, win 512, options [nop,nop,TS val 3527602020 ecr 3527602020], length 0
2022-04-07 22:43:22.562643 IP (tos 0x0, ttl 64, id 14244, offset 0, flags [DF], proto TCP (6), length 62)
    127.0.0.1.11250 > 127.0.0.1.43498: Flags [P.], cksum 0xfe32 (incorrect -> 0x7a90), seq 3:13, ack 14, win 512, options [nop,nop,TS val 3527602114 ecr 3527602020], length 10
2022-04-07 22:43:22.562651 IP (tos 0x0, ttl 64, id 35731, offset 0, flags [DF], proto TCP (6), length 52)
    127.0.0.1.43498 > 127.0.0.1.11250: Flags [.], cksum 0xfe28 (incorrect -> 0x7f3b), seq 14, ack 13, win 512, options [nop,nop,TS val 3527602114 ecr 3527602114], length 0
2022-04-07 22:43:22.568314 IP (tos 0x0, ttl 64, id 35732, offset 0, flags [DF], proto TCP (6), length 569)
    127.0.0.1.43498 > 127.0.0.1.11250: Flags [P.], cksum 0x002e (incorrect -> 0x4b66), seq 14:531, ack 13, win 512, options [nop,nop,TS val 3527602120 ecr 3527602114], length 517
2022-04-07 22:43:22.568321 IP (tos 0x0, ttl 64, id 14245, offset 0, flags [DF], proto TCP (6), length 52)
    127.0.0.1.11250 > 127.0.0.1.43498: Flags [.], cksum 0xfe28 (incorrect -> 0x7d2e), seq 13, ack 531, win 508, options [nop,nop,TS val 3527602120 ecr 3527602120], length 0
200, 123.29047966003418, 0.5471653938293457