2022-04-07 21:33:57.651636 IP (tos 0x0, ttl 64, id 389, offset 0, flags [DF], proto TCP (6), length 60)
    127.0.0.1.45888 > 127.0.0.1.9750: Flags [S], cksum 0xfe30 (incorrect -> 0x77c7), seq 3606115163, win 65495, options [mss 65495,sackOK,TS val 3523437203 ecr 0,nop,wscale 7], length 0
2022-04-07 21:33:57.651649 IP (tos 0x0, ttl 64, id 0, offset 0, flags [DF], proto TCP (6), length 60)
    127.0.0.1.9750 > 127.0.0.1.45888: Flags [S.], cksum 0xfe30 (incorrect -> 0xa355), seq 30580227, ack 3606115164, win 65483, options [mss 65495,sackOK,TS val 3523437203 ecr 3523437203,nop,wscale 7], length 0
2022-04-07 21:33:57.651660 IP (tos 0x0, ttl 64, id 390, offset 0, flags [DF], proto TCP (6), length 52)
    127.0.0.1.45888 > 127.0.0.1.9750: Flags [.], cksum 0xfe28 (incorrect -> 0xca11), seq 1, ack 1, win 512, options [nop,nop,TS val 3523437203 ecr 3523437203], length 0
2022-04-07 21:33:57.651768 IP (tos 0x0, ttl 64, id 391, offset 0, flags [DF], proto TCP (6), length 55)
    127.0.0.1.45888 > 127.0.0.1.9750: Flags [P.], cksum 0xfe2b (incorrect -> 0xc505), seq 1:4, ack 1, win 512, options [nop,nop,TS val 3523437203 ecr 3523437203], length 3
2022-04-07 21:33:57.651782 IP (tos 0x0, ttl 64, id 27746, offset 0, flags [DF], proto TCP (6), length 52)
    127.0.0.1.9750 > 127.0.0.1.45888: Flags [.], cksum 0xfe28 (incorrect -> 0xca0e), seq 1, ack 4, win 512, options [nop,nop,TS val 3523437203 ecr 3523437203], length 0
2022-04-07 21:33:57.651812 IP (tos 0x0, ttl 64, id 27747, offset 0, flags [DF], proto TCP (6), length 54)
    127.0.0.1.9750 > 127.0.0.1.45888: Flags [P.], cksum 0xfe2a (incorrect -> 0xc504), seq 1:3, ack 4, win 512, options [nop,nop,TS val 3523437203 ecr 3523437203], length 2
2022-04-07 21:33:57.651828 IP (tos 0x0, ttl 64, id 392, offset 0, flags [DF], proto TCP (6), length 52)
    127.0.0.1.45888 > 127.0.0.1.9750: Flags [.], cksum 0xfe28 (incorrect -> 0xca0c), seq 4, ack 3, win 512, options [nop,nop,TS val 3523437203 ecr 3523437203], length 0
2022-04-07 21:33:57.655055 IP (tos 0x0, ttl 64, id 393, offset 0, flags [DF], proto TCP (6), length 62)
    127.0.0.1.45888 > 127.0.0.1.9750: Flags [P.], cksum 0xfe32 (incorrect -> 0x7040), seq 4:14, ack 3, win 512, options [nop,nop,TS val 3523437206 ecr 3523437203], length 10
2022-04-07 21:33:57.655071 IP (tos 0x0, ttl 64, id 27748, offset 0, flags [DF], proto TCP (6), length 52)
    127.0.0.1.9750 > 127.0.0.1.45888: Flags [.], cksum 0xfe28 (incorrect -> 0xc9fc), seq 3, ack 14, win 512, options [nop,nop,TS val 3523437206 ecr 3523437206], length 0
2022-04-07 21:34:17.757106 IP (tos 0x0, ttl 64, id 27749, offset 0, flags [DF], proto TCP (6), length 62)
    127.0.0.1.9750 > 127.0.0.1.45888: Flags [P.], cksum 0xfe32 (incorrect -> 0x7663), seq 3:13, ack 14, win 512, options [nop,nop,TS val 3523457308 ecr 3523437206], length 10
2022-04-07 21:34:17.757118 IP (tos 0x0, ttl 64, id 394, offset 0, flags [DF], proto TCP (6), length 52)
    127.0.0.1.45888 > 127.0.0.1.9750: Flags [.], cksum 0xfe28 (incorrect -> 0x2ce6), seq 14, ack 13, win 512, options [nop,nop,TS val 3523457308 ecr 3523457308], length 0
2022-04-07 21:34:17.762861 IP (tos 0x0, ttl 64, id 395, offset 0, flags [DF], proto TCP (6), length 569)
    127.0.0.1.45888 > 127.0.0.1.9750: Flags [P.], cksum 0x002e (incorrect -> 0xe834), seq 14:531, ack 13, win 512, options [nop,nop,TS val 3523457314 ecr 3523457308], length 517
2022-04-07 21:34:17.762870 IP (tos 0x0, ttl 64, id 27750, offset 0, flags [DF], proto TCP (6), length 52)
    127.0.0.1.9750 > 127.0.0.1.45888: Flags [.], cksum 0xfe28 (incorrect -> 0x2ad9), seq 13, ack 531, win 508, options [nop,nop,TS val 3523457314 ecr 3523457314], length 0
2022-04-07 21:34:17.933428 IP (tos 0x0, ttl 64, id 27751, offset 0, flags [DF], proto TCP (6), length 3538)
    127.0.0.1.9750 > 127.0.0.1.45888: Flags [P.], cksum 0x0bc7 (incorrect -> 0xfa76), seq 13:3499, ack 531, win 512, options [nop,nop,TS val 3523457485 ecr 3523457314], length 3486
2022-04-07 21:34:17.933437 IP (tos 0x0, ttl 64, id 396, offset 0, flags [DF], proto TCP (6), length 52)
    127.0.0.1.45888 > 127.0.0.1.9750: Flags [.], cksum 0xfe28 (incorrect -> 0x1bf3), seq 531, ack 3499, win 494, options [nop,nop,TS val 3523457485 ecr 3523457485], length 0
2022-04-07 21:34:18.010138 IP (tos 0x0, ttl 64, id 27752, offset 0, flags [DF], proto TCP (6), length 1720)
    127.0.0.1.9750 > 127.0.0.1.45888: Flags [P.], cksum 0x04ad (incorrect -> 0xc126), seq 3499:5167, ack 531, win 512, options [nop,nop,TS val 3523457561 ecr 3523457485], length 1668
2022-04-07 21:34:18.010143 IP (tos 0x0, ttl 64, id 397, offset 0, flags [DF], proto TCP (6), length 52)
    127.0.0.1.45888 > 127.0.0.1.9750: Flags [.], cksum 0xfe28 (incorrect -> 0x14d0), seq 531, ack 5167, win 501, options [nop,nop,TS val 3523457561 ecr 3523457561], length 0
2022-04-07 21:34:18.010532 IP (tos 0x0, ttl 64, id 398, offset 0, flags [DF], proto TCP (6), length 132)
    127.0.0.1.45888 > 127.0.0.1.9750: Flags [P.], cksum 0xfe78 (incorrect -> 0xf989), seq 531:611, ack 5167, win 512, options [nop,nop,TS val 3523457562 ecr 3523457561], length 80
2022-04-07 21:34:18.010802 IP (tos 0x0, ttl 64, id 399, offset 0, flags [DF], proto TCP (6), length 330)
    127.0.0.1.45888 > 127.0.0.1.9750: Flags [P.], cksum 0xff3e (incorrect -> 0x4c07), seq 611:889, ack 5167, win 512, options [nop,nop,TS val 3523457562 ecr 3523457561], length 278
2022-04-07 21:34:18.010891 IP (tos 0x0, ttl 64, id 27753, offset 0, flags [DF], proto TCP (6), length 52)
    127.0.0.1.9750 > 127.0.0.1.45888: Flags [.], cksum 0xfe28 (incorrect -> 0x1473), seq 5167, ack 611, win 512, options [nop,nop,TS val 3523457562 ecr 3523457562], length 0
2022-04-07 21:34:18.010901 IP (tos 0x0, ttl 64, id 27754, offset 0, flags [DF], proto TCP (6), length 52)
    127.0.0.1.9750 > 127.0.0.1.45888: Flags [.], cksum 0xfe28 (incorrect -> 0x135f), seq 5167, ack 889, win 510, options [nop,nop,TS val 3523457562 ecr 3523457562], length 0
2022-04-07 21:34:18.418948 IP (tos 0x0, ttl 64, id 27755, offset 0, flags [DF], proto TCP (6), length 3100)
    127.0.0.1.9750 > 127.0.0.1.45888: Flags [P.], cksum 0x0a11 (incorrect -> 0xb560), seq 5167:8215, ack 889, win 512, options [nop,nop,TS val 3523457970 ecr 3523457562], length 3048
2022-04-07 21:34:18.418964 IP (tos 0x0, ttl 64, id 400, offset 0, flags [DF], proto TCP (6), length 52)
    127.0.0.1.45888 > 127.0.0.1.9750: Flags [.], cksum 0xfe28 (incorrect -> 0x0455), seq 889, ack 8215, win 496, options [nop,nop,TS val 3523457970 ecr 3523457970], length 0
2022-04-07 21:34:18.418994 IP (tos 0x0, ttl 64, id 27756, offset 0, flags [DF], proto TCP (6), length 1843)
    127.0.0.1.9750 > 127.0.0.1.45888: Flags [P.], cksum 0x0528 (incorrect -> 0x757d), seq 8215:10006, ack 889, win 512, options [nop,nop,TS val 3523457970 ecr 3523457970], length 1791
2022-04-07 21:34:18.418997 IP (tos 0x0, ttl 64, id 401, offset 0, flags [DF], proto TCP (6), length 52)
    127.0.0.1.45888 > 127.0.0.1.9750: Flags [.], cksum 0xfe28 (incorrect -> 0xfd5c), seq 889, ack 10006, win 489, options [nop,nop,TS val 3523457970 ecr 3523457970], length 0
2022-04-07 21:34:18.420068 IP (tos 0x0, ttl 64, id 27757, offset 0, flags [DF], proto TCP (6), length 3538)
    127.0.0.1.9750 > 127.0.0.1.45888: Flags [P.], cksum 0x0bc7 (incorrect -> 0xabec), seq 10006:13492, ack 889, win 512, options [nop,nop,TS val 3523457971 ecr 3523457970], length 3486
2022-04-07 21:34:18.420074 IP (tos 0x0, ttl 64, id 402, offset 0, flags [DF], proto TCP (6), length 52)
    127.0.0.1.45888 > 127.0.0.1.9750: Flags [.], cksum 0xfe28 (incorrect -> 0xefb7), seq 889, ack 13492, win 494, options [nop,nop,TS val 3523457971 ecr 3523457971], length 0
2022-04-07 21:34:18.424518 IP (tos 0x0, ttl 64, id 27758, offset 0, flags [DF], proto TCP (6), length 1048)
    127.0.0.1.9750 > 127.0.0.1.45888: Flags [P.], cksum 0x020d (incorrect -> 0xb463), seq 13492:14488, ack 889, win 512, options [nop,nop,TS val 3523457976 ecr 3523457971], length 996
2022-04-07 21:34:18.424524 IP (tos 0x0, ttl 64, id 403, offset 0, flags [DF], proto TCP (6), length 52)
    127.0.0.1.45888 > 127.0.0.1.9750: Flags [.], cksum 0xfe28 (incorrect -> 0xebbf), seq 889, ack 14488, win 504, options [nop,nop,TS val 3523457976 ecr 3523457976], length 0
2022-04-07 21:34:18.431636 IP (tos 0x0, ttl 64, id 27759, offset 0, flags [DF], proto TCP (6), length 1546)
    127.0.0.1.9750 > 127.0.0.1.45888: Flags [P.], cksum 0x03ff (incorrect -> 0xd3a5), seq 14488:15982, ack 889, win 512, options [nop,nop,TS val 3523457983 ecr 3523457976], length 1494
2022-04-07 21:34:18.431642 IP (tos 0x0, ttl 64, id 404, offset 0, flags [DF], proto TCP (6), length 52)
    127.0.0.1.45888 > 127.0.0.1.9750: Flags [.], cksum 0xfe28 (incorrect -> 0xe5dd), seq 889, ack 15982, win 502, options [nop,nop,TS val 3523457983 ecr 3523457983], length 0
2022-04-07 21:34:18.446210 IP (tos 0x0, ttl 64, id 27760, offset 0, flags [DF], proto TCP (6), length 640)
    127.0.0.1.9750 > 127.0.0.1.45888: Flags [P.], cksum 0x0075 (incorrect -> 0xfc6e), seq 15982:16570, ack 889, win 512, options [nop,nop,TS val 3523457997 ecr 3523457983], length 588
2022-04-07 21:34:18.446216 IP (tos 0x0, ttl 64, id 405, offset 0, flags [DF], proto TCP (6), length 52)
    127.0.0.1.45888 > 127.0.0.1.9750: Flags [.], cksum 0xfe28 (incorrect -> 0xe372), seq 889, ack 16570, win 505, options [nop,nop,TS val 3523457997 ecr 3523457997], length 0
2022-04-07 21:34:18.466594 IP (tos 0x0, ttl 64, id 27761, offset 0, flags [DF], proto TCP (6), length 3446)
    127.0.0.1.9750 > 127.0.0.1.45888: Flags [P.], cksum 0x0b6b (incorrect -> 0x1408), seq 16570:19964, ack 889, win 512, options [nop,nop,TS val 3523458018 ecr 3523457997], length 3394
2022-04-07 21:34:18.466600 IP (tos 0x0, ttl 64, id 406, offset 0, flags [DF], proto TCP (6), length 52)
    127.0.0.1.45888 > 127.0.0.1.9750: Flags [.], cksum 0xfe28 (incorrect -> 0xd611), seq 889, ack 19964, win 494, options [nop,nop,TS val 3523458018 ecr 3523458018], length 0
2022-04-07 21:34:18.466834 IP (tos 0x0, ttl 64, id 27762, offset 0, flags [DF], proto TCP (6), length 4100)
    127.0.0.1.9750 > 127.0.0.1.45888: Flags [P.], cksum 0x0df9 (incorrect -> 0x6040), seq 19964:24012, ack 889, win 512, options [nop,nop,TS val 3523458018 ecr 3523458018], length 4048
2022-04-07 21:34:18.466839 IP (tos 0x0, ttl 64, id 407, offset 0, flags [DF], proto TCP (6), length 52)
    127.0.0.1.45888 > 127.0.0.1.9750: Flags [.], cksum 0xfe28 (incorrect -> 0xc643), seq 889, ack 24012, win 492, options [nop,nop,TS val 3523458018 ecr 3523458018], length 0
2022-04-07 21:34:18.466845 IP (tos 0x0, ttl 64, id 27763, offset 0, flags [DF], proto TCP (6), length 3742)
    127.0.0.1.9750 > 127.0.0.1.45888: Flags [P.], cksum 0x0c93 (incorrect -> 0x6343), seq 24012:27702, ack 889, win 512, options [nop,nop,TS val 3523458018 ecr 3523458018], length 3690
2022-04-07 21:34:18.466847 IP (tos 0x0, ttl 64, id 408, offset 0, flags [DF], proto TCP (6), length 52)
    127.0.0.1.45888 > 127.0.0.1.9750: Flags [.], cksum 0xfe28 (incorrect -> 0xb7e8), seq 889, ack 27702, win 477, options [nop,nop,TS val 3523458018 ecr 3523458018], length 0
2022-04-07 21:34:18.475314 IP (tos 0x0, ttl 64, id 27764, offset 0, flags [DF], proto TCP (6), length 4100)
    127.0.0.1.9750 > 127.0.0.1.45888: Flags [P.], cksum 0x0df9 (incorrect -> 0x1cdf), seq 27702:31750, ack 889, win 512, options [nop,nop,TS val 3523458027 ecr 3523458018], length 4048
2022-04-07 21:34:18.475320 IP (tos 0x0, ttl 64, id 409, offset 0, flags [DF], proto TCP (6), length 52)
    127.0.0.1.45888 > 127.0.0.1.9750: Flags [.], cksum 0xfe28 (incorrect -> 0xa7f7), seq 889, ack 31750, win 492, options [nop,nop,TS val 3523458027 ecr 3523458027], length 0
2022-04-07 21:34:18.475326 IP (tos 0x0, ttl 64, id 27765, offset 0, flags [DF], proto TCP (6), length 2248)
    127.0.0.1.9750 > 127.0.0.1.45888: Flags [P.], cksum 0x06bd (incorrect -> 0xae66), seq 31750:33946, ack 889, win 512, options [nop,nop,TS val 3523458027 ecr 3523458027], length 2196
2022-04-07 21:34:18.475757 IP (tos 0x0, ttl 64, id 410, offset 0, flags [DF], proto TCP (6), length 52)
    127.0.0.1.45888 > 127.0.0.1.9750: Flags [.], cksum 0xfe28 (incorrect -> 0x9f4f), seq 889, ack 33946, win 512, options [nop,nop,TS val 3523458027 ecr 3523458027], length 0
2022-04-07 21:34:18.480078 IP (tos 0x0, ttl 64, id 27766, offset 0, flags [DF], proto TCP (6), length 3538)
    127.0.0.1.9750 > 127.0.0.1.45888: Flags [P.], cksum 0x0bc7 (incorrect -> 0x9be8), seq 33946:37432, ack 889, win 512, options [nop,nop,TS val 3523458031 ecr 3523458027], length 3486
2022-04-07 21:34:18.480200 IP (tos 0x0, ttl 64, id 411, offset 0, flags [DF], proto TCP (6), length 52)
    127.0.0.1.45888 > 127.0.0.1.9750: Flags [.], cksum 0xfe28 (incorrect -> 0x91a9), seq 889, ack 37432, win 512, options [nop,nop,TS val 3523458031 ecr 3523458031], length 0
2022-04-07 21:34:18.523416 IP (tos 0x0, ttl 64, id 27767, offset 0, flags [DF], proto TCP (6), length 3538)
    127.0.0.1.9750 > 127.0.0.1.45888: Flags [P.], cksum 0x0bc7 (incorrect -> 0x33c4), seq 37432:40918, ack 889, win 512, options [nop,nop,TS val 3523458075 ecr 3523458031], length 3486
2022-04-07 21:34:18.566779 IP (tos 0x0, ttl 64, id 412, offset 0, flags [DF], proto TCP (6), length 52)
    127.0.0.1.45888 > 127.0.0.1.9750: Flags [.], cksum 0xfe28 (incorrect -> 0x8388), seq 889, ack 40918, win 512, options [nop,nop,TS val 3523458118 ecr 3523458075], length 0
2022-04-07 21:34:18.566791 IP (tos 0x0, ttl 64, id 27768, offset 0, flags [DF], proto TCP (6), length 24622)
    127.0.0.1.9750 > 127.0.0.1.45888: Flags [P.], cksum 0x5e23 (incorrect -> 0xafb0), seq 40918:65488, ack 889, win 512, options [nop,nop,TS val 3523458118 ecr 3523458118], length 24570
2022-04-07 21:34:18.588589 IP (tos 0x0, ttl 64, id 27769, offset 0, flags [DF], proto TCP (6), length 32820)
    127.0.0.1.9750 > 127.0.0.1.45888: Flags [.], cksum 0x7e29 (incorrect -> 0x5c5a), seq 65488:98256, ack 889, win 512, options [nop,nop,TS val 3523458140 ecr 3523458118], length 32768
2022-04-07 21:34:18.588704 IP (tos 0x0, ttl 64, id 413, offset 0, flags [DF], proto TCP (6), length 52)
    127.0.0.1.45888 > 127.0.0.1.9750: Flags [.], cksum 0xfe28 (incorrect -> 0xa3d1), seq 889, ack 98256, win 379, options [nop,nop,TS val 3523458140 ecr 3523458118], length 0
2022-04-07 21:34:18.588739 IP (tos 0x0, ttl 64, id 27770, offset 0, flags [DF], proto TCP (6), length 1990)
    127.0.0.1.9750 > 127.0.0.1.45888: Flags [P.], cksum 0x05bb (incorrect -> 0xead8), seq 98256:100194, ack 889, win 512, options [nop,nop,TS val 3523458140 ecr 3523458140], length 1938
2022-04-07 21:34:18.590439 IP (tos 0x0, ttl 64, id 414, offset 0, flags [DF], proto TCP (6), length 52)
    127.0.0.1.45888 > 127.0.0.1.9750: Flags [.], cksum 0xfe28 (incorrect -> 0x9ba2), seq 889, ack 100194, win 512, options [nop,nop,TS val 3523458142 ecr 3523458140], length 0
2022-04-07 21:34:18.594909 IP (tos 0x0, ttl 64, id 27771, offset 0, flags [DF], proto TCP (6), length 2044)
    127.0.0.1.9750 > 127.0.0.1.45888: Flags [P.], cksum 0x05f1 (incorrect -> 0x83f5), seq 100194:102186, ack 889, win 512, options [nop,nop,TS val 3523458146 ecr 3523458142], length 1992
2022-04-07 21:34:18.595130 IP (tos 0x0, ttl 64, id 415, offset 0, flags [DF], proto TCP (6), length 52)
    127.0.0.1.45888 > 127.0.0.1.9750: Flags [.], cksum 0xfe28 (incorrect -> 0x93d0), seq 889, ack 102186, win 512, options [nop,nop,TS val 3523458146 ecr 3523458146], length 0
2022-04-07 21:34:18.604201 IP (tos 0x0, ttl 64, id 27772, offset 0, flags [DF], proto TCP (6), length 3806)
    127.0.0.1.9750 > 127.0.0.1.45888: Flags [P.], cksum 0x0cd3 (incorrect -> 0xe860), seq 102186:105940, ack 889, win 512, options [nop,nop,TS val 3523458155 ecr 3523458146], length 3754
2022-04-07 21:34:18.604549 IP (tos 0x0, ttl 64, id 416, offset 0, flags [DF], proto TCP (6), length 52)
    127.0.0.1.45888 > 127.0.0.1.9750: Flags [.], cksum 0xfe28 (incorrect -> 0x8513), seq 889, ack 105940, win 512, options [nop,nop,TS val 3523458156 ecr 3523458155], length 0
2022-04-07 21:34:18.652215 IP (tos 0x0, ttl 64, id 27773, offset 0, flags [DF], proto TCP (6), length 4100)
    127.0.0.1.9750 > 127.0.0.1.45888: Flags [P.], cksum 0x0df9 (incorrect -> 0xa558), seq 105940:109988, ack 889, win 512, options [nop,nop,TS val 3523458203 ecr 3523458156], length 4048
2022-04-07 21:34:18.652714 IP (tos 0x0, ttl 64, id 417, offset 0, flags [DF], proto TCP (6), length 52)
    127.0.0.1.45888 > 127.0.0.1.9750: Flags [.], cksum 0xfe28 (incorrect -> 0x74e3), seq 889, ack 109988, win 512, options [nop,nop,TS val 3523458204 ecr 3523458203], length 0
2022-04-07 21:34:18.652722 IP (tos 0x0, ttl 64, id 27774, offset 0, flags [DF], proto TCP (6), length 7090)
    127.0.0.1.9750 > 127.0.0.1.45888: Flags [P.], cksum 0x19a7 (incorrect -> 0x2fab), seq 109988:117026, ack 889, win 512, options [nop,nop,TS val 3523458204 ecr 3523458204], length 7038
2022-04-07 21:34:18.653033 IP (tos 0x0, ttl 64, id 418, offset 0, flags [DF], proto TCP (6), length 52)
    127.0.0.1.45888 > 127.0.0.1.9750: Flags [.], cksum 0xfe28 (incorrect -> 0x5964), seq 889, ack 117026, win 512, options [nop,nop,TS val 3523458204 ecr 3523458204], length 0
2022-04-07 21:34:18.653766 IP (tos 0x0, ttl 64, id 27775, offset 0, flags [DF], proto TCP (6), length 4100)
    127.0.0.1.9750 > 127.0.0.1.45888: Flags [P.], cksum 0x0df9 (incorrect -> 0xfc13), seq 117026:121074, ack 889, win 512, options [nop,nop,TS val 3523458205 ecr 3523458204], length 4048
2022-04-07 21:34:18.654010 IP (tos 0x0, ttl 64, id 419, offset 0, flags [DF], proto TCP (6), length 52)
    127.0.0.1.45888 > 127.0.0.1.9750: Flags [.], cksum 0xfe28 (incorrect -> 0x4992), seq 889, ack 121074, win 512, options [nop,nop,TS val 3523458205 ecr 3523458205], length 0
2022-04-07 21:34:18.654017 IP (tos 0x0, ttl 64, id 27776, offset 0, flags [DF], proto TCP (6), length 7956)
    127.0.0.1.9750 > 127.0.0.1.45888: Flags [P.], cksum 0x1d09 (incorrect -> 0x0b3f), seq 121074:128978, ack 889, win 512, options [nop,nop,TS val 3523458205 ecr 3523458205], length 7904
2022-04-07 21:34:18.654206 IP (tos 0x0, ttl 64, id 420, offset 0, flags [DF], proto TCP (6), length 52)
    127.0.0.1.45888 > 127.0.0.1.9750: Flags [.], cksum 0xfe28 (incorrect -> 0x2ab2), seq 889, ack 128978, win 512, options [nop,nop,TS val 3523458205 ecr 3523458205], length 0
200, 4.601751804351807, 21.07609987258911