2022-04-07 07:11:59.082799 IP (tos 0x0, ttl 64, id 15924, offset 0, flags [DF], proto TCP (6), length 60)
    127.0.0.1.51976 > 127.0.0.1.10950: Flags [S], cksum 0xfe30 (incorrect -> 0x1cb3), seq 2883223934, win 65495, options [mss 65495,sackOK,TS val 397801585 ecr 0,nop,wscale 7], length 0
2022-04-07 07:11:59.082808 IP (tos 0x0, ttl 64, id 0, offset 0, flags [DF], proto TCP (6), length 60)
    127.0.0.1.10950 > 127.0.0.1.51976: Flags [S.], cksum 0xfe30 (incorrect -> 0xaf9f), seq 2144394518, ack 2883223935, win 65483, options [mss 65495,sackOK,TS val 397801585 ecr 397801585,nop,wscale 7], length 0
2022-04-07 07:11:59.082815 IP (tos 0x0, ttl 64, id 15925, offset 0, flags [DF], proto TCP (6), length 52)
    127.0.0.1.51976 > 127.0.0.1.10950: Flags [.], cksum 0xfe28 (incorrect -> 0xd65b), seq 1, ack 1, win 512, options [nop,nop,TS val 397801585 ecr 397801585], length 0
2022-04-07 07:11:59.082903 IP (tos 0x0, ttl 64, id 15926, offset 0, flags [DF], proto TCP (6), length 55)
    127.0.0.1.51976 > 127.0.0.1.10950: Flags [P.], cksum 0xfe2b (incorrect -> 0xd14f), seq 1:4, ack 1, win 512, options [nop,nop,TS val 397801585 ecr 397801585], length 3
2022-04-07 07:11:59.082908 IP (tos 0x0, ttl 64, id 26758, offset 0, flags [DF], proto TCP (6), length 52)
    127.0.0.1.10950 > 127.0.0.1.51976: Flags [.], cksum 0xfe28 (incorrect -> 0xd658), seq 1, ack 4, win 512, options [nop,nop,TS val 397801585 ecr 397801585], length 0
2022-04-07 07:11:59.082972 IP (tos 0x0, ttl 64, id 26759, offset 0, flags [DF], proto TCP (6), length 54)
    127.0.0.1.10950 > 127.0.0.1.51976: Flags [P.], cksum 0xfe2a (incorrect -> 0xd14e), seq 1:3, ack 4, win 512, options [nop,nop,TS val 397801585 ecr 397801585], length 2
2022-04-07 07:11:59.082978 IP (tos 0x0, ttl 64, id 15927, offset 0, flags [DF], proto TCP (6), length 52)
    127.0.0.1.51976 > 127.0.0.1.10950: Flags [.], cksum 0xfe28 (incorrect -> 0xd656), seq 4, ack 3, win 512, options [nop,nop,TS val 397801585 ecr 397801585], length 0
2022-04-07 07:11:59.084406 IP (tos 0x0, ttl 64, id 15928, offset 0, flags [DF], proto TCP (6), length 62)
    127.0.0.1.51976 > 127.0.0.1.10950: Flags [P.], cksum 0xfe32 (incorrect -> 0x04ce), seq 4:14, ack 3, win 512, options [nop,nop,TS val 397801587 ecr 397801585], length 10
2022-04-07 07:11:59.084414 IP (tos 0x0, ttl 64, id 26760, offset 0, flags [DF], proto TCP (6), length 52)
    127.0.0.1.10950 > 127.0.0.1.51976: Flags [.], cksum 0xfe28 (incorrect -> 0xd648), seq 3, ack 14, win 512, options [nop,nop,TS val 397801587 ecr 397801587], length 0
2022-04-07 07:11:59.189111 IP (tos 0x0, ttl 64, id 26761, offset 0, flags [DF], proto TCP (6), length 62)
    127.0.0.1.10950 > 127.0.0.1.51976: Flags [P.], cksum 0xfe32 (incorrect -> 0xd0cc), seq 3:13, ack 14, win 512, options [nop,nop,TS val 397801692 ecr 397801587], length 10
2022-04-07 07:11:59.189122 IP (tos 0x0, ttl 64, id 15929, offset 0, flags [DF], proto TCP (6), length 52)
    127.0.0.1.51976 > 127.0.0.1.10950: Flags [.], cksum 0xfe28 (incorrect -> 0xd56c), seq 14, ack 13, win 512, options [nop,nop,TS val 397801692 ecr 397801692], length 0
2022-04-07 07:11:59.194625 IP (tos 0x0, ttl 64, id 15930, offset 0, flags [DF], proto TCP (6), length 569)
    127.0.0.1.51976 > 127.0.0.1.10950: Flags [P.], cksum 0x002e (incorrect -> 0x35b0), seq 14:531, ack 13, win 512, options [nop,nop,TS val 397801697 ecr 397801692], length 517
2022-04-07 07:11:59.194653 IP (tos 0x0, ttl 64, id 26762, offset 0, flags [DF], proto TCP (6), length 52)
    127.0.0.1.10950 > 127.0.0.1.51976: Flags [.], cksum 0xfe28 (incorrect -> 0xd361), seq 13, ack 531, win 508, options [nop,nop,TS val 397801697 ecr 397801697], length 0
2022-04-07 07:11:59.301589 IP (tos 0x0, ttl 64, id 26763, offset 0, flags [DF], proto TCP (6), length 3538)
    127.0.0.1.10950 > 127.0.0.1.51976: Flags [P.], cksum 0x0bc7 (incorrect -> 0xc260), seq 13:3499, ack 531, win 512, options [nop,nop,TS val 397801804 ecr 397801697], length 3486
2022-04-07 07:11:59.301598 IP (tos 0x0, ttl 64, id 15931, offset 0, flags [DF], proto TCP (6), length 52)
    127.0.0.1.51976 > 127.0.0.1.10950: Flags [.], cksum 0xfe28 (incorrect -> 0xc4fb), seq 531, ack 3499, win 494, options [nop,nop,TS val 397801804 ecr 397801804], length 0
2022-04-07 07:11:59.334845 IP (tos 0x0, ttl 64, id 26764, offset 0, flags [DF], proto TCP (6), length 341)
    127.0.0.1.10950 > 127.0.0.1.51976: Flags [P.], cksum 0xff49 (incorrect -> 0xa1d9), seq 3499:3788, ack 531, win 512, options [nop,nop,TS val 397801837 ecr 397801804], length 289
2022-04-07 07:11:59.334865 IP (tos 0x0, ttl 64, id 15932, offset 0, flags [DF], proto TCP (6), length 52)
    127.0.0.1.51976 > 127.0.0.1.10950: Flags [.], cksum 0xfe28 (incorrect -> 0xc38c), seq 531, ack 3788, win 506, options [nop,nop,TS val 397801837 ecr 397801837], length 0
2022-04-07 07:11:59.335396 IP (tos 0x0, ttl 64, id 15933, offset 0, flags [DF], proto TCP (6), length 132)
    127.0.0.1.51976 > 127.0.0.1.10950: Flags [P.], cksum 0xfe78 (incorrect -> 0x2788), seq 531:611, ack 3788, win 512, options [nop,nop,TS val 397801838 ecr 397801837], length 80
2022-04-07 07:11:59.335405 IP (tos 0x0, ttl 64, id 26765, offset 0, flags [DF], proto TCP (6), length 52)
    127.0.0.1.10950 > 127.0.0.1.51976: Flags [.], cksum 0xfe28 (incorrect -> 0xc334), seq 3788, ack 611, win 512, options [nop,nop,TS val 397801838 ecr 397801838], length 0
2022-04-07 07:11:59.335972 IP (tos 0x0, ttl 64, id 15934, offset 0, flags [DF], proto TCP (6), length 320)
    127.0.0.1.51976 > 127.0.0.1.10950: Flags [P.], cksum 0xff34 (incorrect -> 0x8b5a), seq 611:879, ack 3788, win 512, options [nop,nop,TS val 397801838 ecr 397801838], length 268
2022-04-07 07:11:59.335981 IP (tos 0x0, ttl 64, id 26766, offset 0, flags [DF], proto TCP (6), length 52)
    127.0.0.1.10950 > 127.0.0.1.51976: Flags [.], cksum 0xfe28 (incorrect -> 0xc22a), seq 3788, ack 879, win 510, options [nop,nop,TS val 397801838 ecr 397801838], length 0
2022-04-07 07:11:59.924291 IP (tos 0x0, ttl 64, id 26767, offset 0, flags [DF], proto TCP (6), length 2695)
    127.0.0.1.10950 > 127.0.0.1.51976: Flags [P.], cksum 0x087c (incorrect -> 0x7d86), seq 3788:6431, ack 879, win 512, options [nop,nop,TS val 397802427 ecr 397801838], length 2643
2022-04-07 07:11:59.924307 IP (tos 0x0, ttl 64, id 15935, offset 0, flags [DF], proto TCP (6), length 52)
    127.0.0.1.51976 > 127.0.0.1.10950: Flags [.], cksum 0xfe28 (incorrect -> 0xb34a), seq 879, ack 6431, win 497, options [nop,nop,TS val 397802427 ecr 397802427], length 0
2022-04-07 07:11:59.927473 IP (tos 0x0, ttl 64, id 15936, offset 0, flags [DF], proto TCP (6), length 1174)
    127.0.0.1.51976 > 127.0.0.1.10950: Flags [P.], cksum 0x028b (incorrect -> 0xbb82), seq 879:2001, ack 6431, win 512, options [nop,nop,TS val 397802430 ecr 397802427], length 1122
2022-04-07 07:11:59.927484 IP (tos 0x0, ttl 64, id 26768, offset 0, flags [DF], proto TCP (6), length 52)
    127.0.0.1.10950 > 127.0.0.1.51976: Flags [.], cksum 0xfe28 (incorrect -> 0xaedb), seq 6431, ack 2001, win 504, options [nop,nop,TS val 397802430 ecr 397802430], length 0
200, 5.857368469238281, 1.3783612251281738