2022-04-07 06:33:54.092036 IP (tos 0x0, ttl 64, id 62226, offset 0, flags [DF], proto TCP (6), length 60)
    127.0.0.1.46916 > 127.0.0.1.10650: Flags [S], cksum 0xfe30 (incorrect -> 0xf02f), seq 332609755, win 65495, options [mss 65495,sackOK,TS val 395516594 ecr 0,nop,wscale 7], length 0
2022-04-07 06:33:54.092051 IP (tos 0x0, ttl 64, id 0, offset 0, flags [DF], proto TCP (6), length 60)
    127.0.0.1.10650 > 127.0.0.1.46916: Flags [S.], cksum 0xfe30 (incorrect -> 0xbf47), seq 1601150766, ack 332609756, win 65483, options [mss 65495,sackOK,TS val 395516594 ecr 395516594,nop,wscale 7], length 0
2022-04-07 06:33:54.092063 IP (tos 0x0, ttl 64, id 62227, offset 0, flags [DF], proto TCP (6), length 52)
    127.0.0.1.46916 > 127.0.0.1.10650: Flags [.], cksum 0xfe28 (incorrect -> 0xe602), seq 1, ack 1, win 512, options [nop,nop,TS val 395516595 ecr 395516594], length 0
2022-04-07 06:33:54.092161 IP (tos 0x0, ttl 64, id 62228, offset 0, flags [DF], proto TCP (6), length 55)
    127.0.0.1.46916 > 127.0.0.1.10650: Flags [P.], cksum 0xfe2b (incorrect -> 0xe0f6), seq 1:4, ack 1, win 512, options [nop,nop,TS val 395516595 ecr 395516594], length 3
2022-04-07 06:33:54.092169 IP (tos 0x0, ttl 64, id 12362, offset 0, flags [DF], proto TCP (6), length 52)
    127.0.0.1.10650 > 127.0.0.1.46916: Flags [.], cksum 0xfe28 (incorrect -> 0xe5fe), seq 1, ack 4, win 512, options [nop,nop,TS val 395516595 ecr 395516595], length 0
2022-04-07 06:33:54.092269 IP (tos 0x0, ttl 64, id 12363, offset 0, flags [DF], proto TCP (6), length 54)
    127.0.0.1.10650 > 127.0.0.1.46916: Flags [P.], cksum 0xfe2a (incorrect -> 0xe0f4), seq 1:3, ack 4, win 512, options [nop,nop,TS val 395516595 ecr 395516595], length 2
2022-04-07 06:33:54.092301 IP (tos 0x0, ttl 64, id 62229, offset 0, flags [DF], proto TCP (6), length 52)
    127.0.0.1.46916 > 127.0.0.1.10650: Flags [.], cksum 0xfe28 (incorrect -> 0xe5fc), seq 4, ack 3, win 512, options [nop,nop,TS val 395516595 ecr 395516595], length 0
2022-04-07 06:33:54.094675 IP (tos 0x0, ttl 64, id 62230, offset 0, flags [DF], proto TCP (6), length 62)
    127.0.0.1.46916 > 127.0.0.1.10650: Flags [P.], cksum 0xfe32 (incorrect -> 0xfb78), seq 4:14, ack 3, win 512, options [nop,nop,TS val 395516597 ecr 395516595], length 10
2022-04-07 06:33:54.094691 IP (tos 0x0, ttl 64, id 12364, offset 0, flags [DF], proto TCP (6), length 52)
    127.0.0.1.10650 > 127.0.0.1.46916: Flags [.], cksum 0xfe28 (incorrect -> 0xe5ee), seq 3, ack 14, win 512, options [nop,nop,TS val 395516597 ecr 395516597], length 0
2022-04-07 06:33:54.200121 IP (tos 0x0, ttl 64, id 12365, offset 0, flags [DF], proto TCP (6), length 62)
    127.0.0.1.10650 > 127.0.0.1.46916: Flags [P.], cksum 0xfe32 (incorrect -> 0xe071), seq 3:13, ack 14, win 512, options [nop,nop,TS val 395516703 ecr 395516597], length 10
2022-04-07 06:33:54.200142 IP (tos 0x0, ttl 64, id 62231, offset 0, flags [DF], proto TCP (6), length 52)
    127.0.0.1.46916 > 127.0.0.1.10650: Flags [.], cksum 0xfe28 (incorrect -> 0xe510), seq 14, ack 13, win 512, options [nop,nop,TS val 395516703 ecr 395516703], length 0
2022-04-07 06:33:54.206184 IP (tos 0x0, ttl 64, id 62232, offset 0, flags [DF], proto TCP (6), length 569)
    127.0.0.1.46916 > 127.0.0.1.10650: Flags [P.], cksum 0x002e (incorrect -> 0x3066), seq 14:531, ack 13, win 512, options [nop,nop,TS val 395516709 ecr 395516703], length 517
2022-04-07 06:33:54.206195 IP (tos 0x0, ttl 64, id 12366, offset 0, flags [DF], proto TCP (6), length 52)
    127.0.0.1.10650 > 127.0.0.1.46916: Flags [.], cksum 0xfe28 (incorrect -> 0xe303), seq 13, ack 531, win 508, options [nop,nop,TS val 395516709 ecr 395516709], length 0
200, 2.708621025085449, 1.1135342121124268