2022-04-07 02:43:24.270566 IP (tos 0x0, ttl 64, id 51001, offset 0, flags [DF], proto TCP (6), length 60)
    127.0.0.1.40304 > 127.0.0.1.11950: Flags [S], cksum 0xfe30 (incorrect -> 0xf6c4), seq 3018436223, win 65495, options [mss 65495,sackOK,TS val 381686773 ecr 0,nop,wscale 7], length 0
2022-04-07 02:43:24.270578 IP (tos 0x0, ttl 64, id 0, offset 0, flags [DF], proto TCP (6), length 60)
    127.0.0.1.11950 > 127.0.0.1.40304: Flags [S.], cksum 0xfe30 (incorrect -> 0xf39d), seq 3830510619, ack 3018436224, win 65483, options [mss 65495,sackOK,TS val 381686773 ecr 381686773,nop,wscale 7], length 0
2022-04-07 02:43:24.270588 IP (tos 0x0, ttl 64, id 51002, offset 0, flags [DF], proto TCP (6), length 52)
    127.0.0.1.40304 > 127.0.0.1.11950: Flags [.], cksum 0xfe28 (incorrect -> 0x1a5a), seq 1, ack 1, win 512, options [nop,nop,TS val 381686773 ecr 381686773], length 0
2022-04-07 02:43:24.270722 IP (tos 0x0, ttl 64, id 51003, offset 0, flags [DF], proto TCP (6), length 55)
    127.0.0.1.40304 > 127.0.0.1.11950: Flags [P.], cksum 0xfe2b (incorrect -> 0x154e), seq 1:4, ack 1, win 512, options [nop,nop,TS val 381686773 ecr 381686773], length 3
2022-04-07 02:43:24.270729 IP (tos 0x0, ttl 64, id 25181, offset 0, flags [DF], proto TCP (6), length 52)
    127.0.0.1.11950 > 127.0.0.1.40304: Flags [.], cksum 0xfe28 (incorrect -> 0x1a57), seq 1, ack 4, win 512, options [nop,nop,TS val 381686773 ecr 381686773], length 0
2022-04-07 02:43:24.270762 IP (tos 0x0, ttl 64, id 25182, offset 0, flags [DF], proto TCP (6), length 54)
    127.0.0.1.11950 > 127.0.0.1.40304: Flags [P.], cksum 0xfe2a (incorrect -> 0x154d), seq 1:3, ack 4, win 512, options [nop,nop,TS val 381686773 ecr 381686773], length 2
2022-04-07 02:43:24.270775 IP (tos 0x0, ttl 64, id 51004, offset 0, flags [DF], proto TCP (6), length 52)
    127.0.0.1.40304 > 127.0.0.1.11950: Flags [.], cksum 0xfe28 (incorrect -> 0x1a55), seq 4, ack 3, win 512, options [nop,nop,TS val 381686773 ecr 381686773], length 0
2022-04-07 02:43:24.301186 IP (tos 0x0, ttl 64, id 51005, offset 0, flags [DF], proto TCP (6), length 62)
    127.0.0.1.40304 > 127.0.0.1.11950: Flags [P.], cksum 0xfe32 (incorrect -> 0xc06b), seq 4:14, ack 3, win 512, options [nop,nop,TS val 381686804 ecr 381686773], length 10
2022-04-07 02:43:24.301196 IP (tos 0x0, ttl 64, id 25183, offset 0, flags [DF], proto TCP (6), length 52)
    127.0.0.1.11950 > 127.0.0.1.40304: Flags [.], cksum 0xfe28 (incorrect -> 0x1a0d), seq 3, ack 14, win 512, options [nop,nop,TS val 381686804 ecr 381686804], length 0
2022-04-07 02:44:59.763887 IP (tos 0x0, ttl 64, id 25184, offset 0, flags [DF], proto TCP (6), length 62)
    127.0.0.1.11950 > 127.0.0.1.40304: Flags [P.], cksum 0xfe32 (incorrect -> 0xa012), seq 3:13, ack 14, win 512, options [nop,nop,TS val 381782266 ecr 381686804], length 10
2022-04-07 02:44:59.763903 IP (tos 0x0, ttl 64, id 51006, offset 0, flags [DF], proto TCP (6), length 52)
    127.0.0.1.40304 > 127.0.0.1.11950: Flags [.], cksum 0xfe28 (incorrect -> 0x3034), seq 14, ack 13, win 512, options [nop,nop,TS val 381782266 ecr 381782266], length 0
2022-04-07 02:44:59.770238 IP (tos 0x0, ttl 64, id 51007, offset 0, flags [DF], proto TCP (6), length 569)
    127.0.0.1.40304 > 127.0.0.1.11950: Flags [P.], cksum 0x002e (incorrect -> 0xcef9), seq 14:531, ack 13, win 512, options [nop,nop,TS val 381782273 ecr 381782266], length 517
2022-04-07 02:44:59.770279 IP (tos 0x0, ttl 64, id 25185, offset 0, flags [DF], proto TCP (6), length 52)
    127.0.0.1.11950 > 127.0.0.1.40304: Flags [.], cksum 0xfe28 (incorrect -> 0x2e25), seq 13, ack 531, win 508, options [nop,nop,TS val 381782273 ecr 381782273], length 0
2022-04-07 02:45:00.034365 IP (tos 0x0, ttl 64, id 25186, offset 0, flags [DF], proto TCP (6), length 3538)
    127.0.0.1.11950 > 127.0.0.1.40304: Flags [P.], cksum 0x0bc7 (incorrect -> 0xdd9b), seq 13:3499, ack 531, win 512, options [nop,nop,TS val 381782537 ecr 381782273], length 3486
2022-04-07 02:45:00.034378 IP (tos 0x0, ttl 64, id 51008, offset 0, flags [DF], proto TCP (6), length 52)
    127.0.0.1.40304 > 127.0.0.1.11950: Flags [.], cksum 0xfe28 (incorrect -> 0x1e85), seq 531, ack 3499, win 494, options [nop,nop,TS val 381782537 ecr 381782537], length 0
2022-04-07 02:45:00.134509 IP (tos 0x0, ttl 64, id 25187, offset 0, flags [DF], proto TCP (6), length 1720)
    127.0.0.1.11950 > 127.0.0.1.40304: Flags [P.], cksum 0x04ad (incorrect -> 0xcf3b), seq 3499:5167, ack 531, win 512, options [nop,nop,TS val 381782637 ecr 381782537], length 1668
2022-04-07 02:45:00.134522 IP (tos 0x0, ttl 64, id 51009, offset 0, flags [DF], proto TCP (6), length 52)
    127.0.0.1.40304 > 127.0.0.1.11950: Flags [.], cksum 0xfe28 (incorrect -> 0x1732), seq 531, ack 5167, win 501, options [nop,nop,TS val 381782637 ecr 381782637], length 0
2022-04-07 02:45:00.135261 IP (tos 0x0, ttl 64, id 51010, offset 0, flags [DF], proto TCP (6), length 132)
    127.0.0.1.40304 > 127.0.0.1.11950: Flags [P.], cksum 0xfe78 (incorrect -> 0xd3c4), seq 531:611, ack 5167, win 512, options [nop,nop,TS val 381782638 ecr 381782637], length 80
2022-04-07 02:45:00.135305 IP (tos 0x0, ttl 64, id 25188, offset 0, flags [DF], proto TCP (6), length 52)
    127.0.0.1.11950 > 127.0.0.1.40304: Flags [.], cksum 0xfe28 (incorrect -> 0x16d5), seq 5167, ack 611, win 512, options [nop,nop,TS val 381782638 ecr 381782638], length 0
2022-04-07 02:45:00.136294 IP (tos 0x0, ttl 64, id 51011, offset 0, flags [DF], proto TCP (6), length 383)
    127.0.0.1.40304 > 127.0.0.1.11950: Flags [P.], cksum 0xff73 (incorrect -> 0xbb5e), seq 611:942, ack 5167, win 512, options [nop,nop,TS val 381782639 ecr 381782638], length 331
2022-04-07 02:45:00.136310 IP (tos 0x0, ttl 64, id 25189, offset 0, flags [DF], proto TCP (6), length 52)
    127.0.0.1.11950 > 127.0.0.1.40304: Flags [.], cksum 0xfe28 (incorrect -> 0x158a), seq 5167, ack 942, win 510, options [nop,nop,TS val 381782639 ecr 381782639], length 0
2022-04-07 02:45:00.382696 IP (tos 0x0, ttl 64, id 25190, offset 0, flags [DF], proto TCP (6), length 610)
    127.0.0.1.11950 > 127.0.0.1.40304: Flags [P.], cksum 0x0057 (incorrect -> 0x3ffb), seq 5167:5725, ack 942, win 512, options [nop,nop,TS val 381782885 ecr 381782639], length 558
2022-04-07 02:45:00.382711 IP (tos 0x0, ttl 64, id 51012, offset 0, flags [DF], proto TCP (6), length 52)
    127.0.0.1.40304 > 127.0.0.1.11950: Flags [.], cksum 0xfe28 (incorrect -> 0x1172), seq 942, ack 5725, win 508, options [nop,nop,TS val 381782885 ecr 381782885], length 0
2022-04-07 02:45:00.538157 IP (tos 0x0, ttl 64, id 25191, offset 0, flags [DF], proto TCP (6), length 3538)
    127.0.0.1.11950 > 127.0.0.1.40304: Flags [P.], cksum 0x0bc7 (incorrect -> 0x0261), seq 5725:9211, ack 942, win 512, options [nop,nop,TS val 381783041 ecr 381782885], length 3486
2022-04-07 02:45:00.538171 IP (tos 0x0, ttl 64, id 51013, offset 0, flags [DF], proto TCP (6), length 52)
    127.0.0.1.40304 > 127.0.0.1.11950: Flags [.], cksum 0xfe28 (incorrect -> 0x02aa), seq 942, ack 9211, win 494, options [nop,nop,TS val 381783041 ecr 381783041], length 0
2022-04-07 02:45:00.548210 IP (tos 0x0, ttl 64, id 25192, offset 0, flags [DF], proto TCP (6), length 3228)
    127.0.0.1.11950 > 127.0.0.1.40304: Flags [P.], cksum 0x0a91 (incorrect -> 0x4e36), seq 9211:12387, ack 942, win 512, options [nop,nop,TS val 381783051 ecr 381783041], length 3176
2022-04-07 02:45:00.548219 IP (tos 0x0, ttl 64, id 51014, offset 0, flags [DF], proto TCP (6), length 52)
    127.0.0.1.40304 > 127.0.0.1.11950: Flags [.], cksum 0xfe28 (incorrect -> 0xf62c), seq 942, ack 12387, win 495, options [nop,nop,TS val 381783051 ecr 381783051], length 0
2022-04-07 02:45:00.548682 IP (tos 0x0, ttl 64, id 25193, offset 0, flags [DF], proto TCP (6), length 1546)
    127.0.0.1.11950 > 127.0.0.1.40304: Flags [P.], cksum 0x03ff (incorrect -> 0x72f1), seq 12387:13881, ack 942, win 512, options [nop,nop,TS val 381783051 ecr 381783051], length 1494
2022-04-07 02:45:00.548686 IP (tos 0x0, ttl 64, id 51015, offset 0, flags [DF], proto TCP (6), length 52)
    127.0.0.1.40304 > 127.0.0.1.11950: Flags [.], cksum 0xfe28 (incorrect -> 0xf04f), seq 942, ack 13881, win 502, options [nop,nop,TS val 381783051 ecr 381783051], length 0
2022-04-07 02:45:00.642560 IP (tos 0x0, ttl 64, id 25194, offset 0, flags [DF], proto TCP (6), length 3538)
    127.0.0.1.11950 > 127.0.0.1.40304: Flags [P.], cksum 0x0bc7 (incorrect -> 0xd3d2), seq 13881:17367, ack 942, win 512, options [nop,nop,TS val 381783145 ecr 381783051], length 3486
2022-04-07 02:45:00.642565 IP (tos 0x0, ttl 64, id 51016, offset 0, flags [DF], proto TCP (6), length 52)
    127.0.0.1.40304 > 127.0.0.1.11950: Flags [.], cksum 0xfe28 (incorrect -> 0xe1fd), seq 942, ack 17367, win 494, options [nop,nop,TS val 381783145 ecr 381783145], length 0
2022-04-07 02:45:00.657747 IP (tos 0x0, ttl 64, id 25195, offset 0, flags [DF], proto TCP (6), length 3502)
    127.0.0.1.11950 > 127.0.0.1.40304: Flags [P.], cksum 0x0ba3 (incorrect -> 0x6fd0), seq 17367:20817, ack 942, win 512, options [nop,nop,TS val 381783160 ecr 381783145], length 3450
2022-04-07 02:45:00.657752 IP (tos 0x0, ttl 64, id 51017, offset 0, flags [DF], proto TCP (6), length 52)
    127.0.0.1.40304 > 127.0.0.1.11950: Flags [.], cksum 0xfe28 (incorrect -> 0xd465), seq 942, ack 20817, win 494, options [nop,nop,TS val 381783160 ecr 381783160], length 0
2022-04-07 02:45:00.662672 IP (tos 0x0, ttl 64, id 25196, offset 0, flags [DF], proto TCP (6), length 1048)
    127.0.0.1.11950 > 127.0.0.1.40304: Flags [P.], cksum 0x020d (incorrect -> 0x53c0), seq 20817:21813, ack 942, win 512, options [nop,nop,TS val 381783165 ecr 381783160], length 996
2022-04-07 02:45:00.662677 IP (tos 0x0, ttl 64, id 51018, offset 0, flags [DF], proto TCP (6), length 52)
    127.0.0.1.40304 > 127.0.0.1.11950: Flags [.], cksum 0xfe28 (incorrect -> 0xd06d), seq 942, ack 21813, win 504, options [nop,nop,TS val 381783165 ecr 381783165], length 0
2022-04-07 02:45:00.662741 IP (tos 0x0, ttl 64, id 25197, offset 0, flags [DF], proto TCP (6), length 3538)
    127.0.0.1.11950 > 127.0.0.1.40304: Flags [P.], cksum 0x0bc7 (incorrect -> 0xd72b), seq 21813:25299, ack 942, win 512, options [nop,nop,TS val 381783165 ecr 381783165], length 3486
2022-04-07 02:45:00.662744 IP (tos 0x0, ttl 64, id 51019, offset 0, flags [DF], proto TCP (6), length 52)
    127.0.0.1.40304 > 127.0.0.1.11950: Flags [.], cksum 0xfe28 (incorrect -> 0xc2dd), seq 942, ack 25299, win 490, options [nop,nop,TS val 381783165 ecr 381783165], length 0
2022-04-07 02:45:00.664078 IP (tos 0x0, ttl 64, id 25198, offset 0, flags [DF], proto TCP (6), length 550)
    127.0.0.1.11950 > 127.0.0.1.40304: Flags [P.], cksum 0x001b (incorrect -> 0x86c5), seq 25299:25797, ack 942, win 512, options [nop,nop,TS val 381783167 ecr 381783165], length 498
2022-04-07 02:45:00.664089 IP (tos 0x0, ttl 64, id 51020, offset 0, flags [DF], proto TCP (6), length 52)
    127.0.0.1.40304 > 127.0.0.1.11950: Flags [.], cksum 0xfe28 (incorrect -> 0xc0d7), seq 942, ack 25797, win 506, options [nop,nop,TS val 381783167 ecr 381783167], length 0
2022-04-07 02:45:00.664148 IP (tos 0x0, ttl 64, id 25199, offset 0, flags [DF], proto TCP (6), length 4100)
    127.0.0.1.11950 > 127.0.0.1.40304: Flags [P.], cksum 0x0df9 (incorrect -> 0x5543), seq 25797:29845, ack 942, win 512, options [nop,nop,TS val 381783167 ecr 381783167], length 4048
2022-04-07 02:45:00.664156 IP (tos 0x0, ttl 64, id 51021, offset 0, flags [DF], proto TCP (6), length 52)
    127.0.0.1.40304 > 127.0.0.1.11950: Flags [.], cksum 0xfe28 (incorrect -> 0xb115), seq 942, ack 29845, win 492, options [nop,nop,TS val 381783167 ecr 381783167], length 0
2022-04-07 02:45:00.664160 IP (tos 0x0, ttl 64, id 25200, offset 0, flags [DF], proto TCP (6), length 2128)
    127.0.0.1.11950 > 127.0.0.1.40304: Flags [P.], cksum 0x0645 (incorrect -> 0x8d26), seq 29845:31921, ack 942, win 512, options [nop,nop,TS val 381783167 ecr 381783167], length 2076
2022-04-07 02:45:00.664448 IP (tos 0x0, ttl 64, id 51022, offset 0, flags [DF], proto TCP (6), length 52)
    127.0.0.1.40304 > 127.0.0.1.11950: Flags [.], cksum 0xfe28 (incorrect -> 0xa8e5), seq 942, ack 31921, win 512, options [nop,nop,TS val 381783167 ecr 381783167], length 0
2022-04-07 02:45:00.665781 IP (tos 0x0, ttl 64, id 25201, offset 0, flags [DF], proto TCP (6), length 1048)
    127.0.0.1.11950 > 127.0.0.1.40304: Flags [P.], cksum 0x020d (incorrect -> 0x4cb2), seq 31921:32917, ack 942, win 512, options [nop,nop,TS val 381783168 ecr 381783167], length 996
2022-04-07 02:45:00.665801 IP (tos 0x0, ttl 64, id 51023, offset 0, flags [DF], proto TCP (6), length 52)
    127.0.0.1.40304 > 127.0.0.1.11950: Flags [.], cksum 0xfe28 (incorrect -> 0xa4ff), seq 942, ack 32917, win 512, options [nop,nop,TS val 381783168 ecr 381783168], length 0
2022-04-07 02:45:00.667844 IP (tos 0x0, ttl 64, id 25202, offset 0, flags [DF], proto TCP (6), length 4036)
    127.0.0.1.11950 > 127.0.0.1.40304: Flags [P.], cksum 0x0db9 (incorrect -> 0x1b07), seq 32917:36901, ack 942, win 512, options [nop,nop,TS val 381783170 ecr 381783168], length 3984
2022-04-07 02:45:00.668026 IP (tos 0x0, ttl 64, id 51024, offset 0, flags [DF], proto TCP (6), length 52)
    127.0.0.1.40304 > 127.0.0.1.11950: Flags [.], cksum 0xfe28 (incorrect -> 0x956b), seq 942, ack 36901, win 512, options [nop,nop,TS val 381783170 ecr 381783170], length 0
2022-04-07 02:45:00.668662 IP (tos 0x0, ttl 64, id 25203, offset 0, flags [DF], proto TCP (6), length 3538)
    127.0.0.1.11950 > 127.0.0.1.40304: Flags [P.], cksum 0x0bc7 (incorrect -> 0x9469), seq 36901:40387, ack 942, win 512, options [nop,nop,TS val 381783171 ecr 381783170], length 3486
2022-04-07 02:45:00.668803 IP (tos 0x0, ttl 64, id 51025, offset 0, flags [DF], proto TCP (6), length 52)
    127.0.0.1.40304 > 127.0.0.1.11950: Flags [.], cksum 0xfe28 (incorrect -> 0x87cb), seq 942, ack 40387, win 512, options [nop,nop,TS val 381783171 ecr 381783171], length 0
2022-04-07 02:45:00.713127 IP (tos 0x0, ttl 64, id 25204, offset 0, flags [DF], proto TCP (6), length 550)
    127.0.0.1.11950 > 127.0.0.1.40304: Flags [P.], cksum 0x001b (incorrect -> 0xa850), seq 40387:40885, ack 942, win 512, options [nop,nop,TS val 381783216 ecr 381783171], length 498
2022-04-07 02:45:00.713153 IP (tos 0x0, ttl 64, id 51026, offset 0, flags [DF], proto TCP (6), length 52)
    127.0.0.1.40304 > 127.0.0.1.11950: Flags [.], cksum 0xfe28 (incorrect -> 0x857f), seq 942, ack 40885, win 512, options [nop,nop,TS val 381783216 ecr 381783216], length 0
2022-04-07 02:45:00.763216 IP (tos 0x0, ttl 64, id 25205, offset 0, flags [DF], proto TCP (6), length 3538)
    127.0.0.1.11950 > 127.0.0.1.40304: Flags [P.], cksum 0x0bc7 (incorrect -> 0x5f06), seq 40885:44371, ack 942, win 512, options [nop,nop,TS val 381783266 ecr 381783216], length 3486
2022-04-07 02:45:00.763362 IP (tos 0x0, ttl 64, id 51027, offset 0, flags [DF], proto TCP (6), length 52)
    127.0.0.1.40304 > 127.0.0.1.11950: Flags [.], cksum 0xfe28 (incorrect -> 0x777d), seq 942, ack 44371, win 512, options [nop,nop,TS val 381783266 ecr 381783266], length 0
2022-04-07 02:45:00.767257 IP (tos 0x0, ttl 64, id 25206, offset 0, flags [DF], proto TCP (6), length 1768)
    127.0.0.1.11950 > 127.0.0.1.40304: Flags [P.], cksum 0x04dd (incorrect -> 0xeaba), seq 44371:46087, ack 942, win 512, options [nop,nop,TS val 381783270 ecr 381783266], length 1716
2022-04-07 02:45:00.767476 IP (tos 0x0, ttl 64, id 51028, offset 0, flags [DF], proto TCP (6), length 52)
    127.0.0.1.40304 > 127.0.0.1.11950: Flags [.], cksum 0xfe28 (incorrect -> 0x70c1), seq 942, ack 46087, win 512, options [nop,nop,TS val 381783270 ecr 381783270], length 0
2022-04-07 02:45:00.783951 IP (tos 0x0, ttl 64, id 25207, offset 0, flags [DF], proto TCP (6), length 3538)
    127.0.0.1.11950 > 127.0.0.1.40304: Flags [P.], cksum 0x0bc7 (incorrect -> 0xee8a), seq 46087:49573, ack 942, win 512, options [nop,nop,TS val 381783286 ecr 381783270], length 3486
2022-04-07 02:45:00.784123 IP (tos 0x0, ttl 64, id 51029, offset 0, flags [DF], proto TCP (6), length 52)
    127.0.0.1.40304 > 127.0.0.1.11950: Flags [.], cksum 0xfe28 (incorrect -> 0x6302), seq 942, ack 49573, win 512, options [nop,nop,TS val 381783287 ecr 381783286], length 0
2022-04-07 02:45:00.786219 IP (tos 0x0, ttl 64, id 25208, offset 0, flags [DF], proto TCP (6), length 3538)
    127.0.0.1.11950 > 127.0.0.1.40304: Flags [P.], cksum 0x0bc7 (incorrect -> 0xa1f9), seq 49573:53059, ack 942, win 512, options [nop,nop,TS val 381783289 ecr 381783287], length 3486
2022-04-07 02:45:00.823605 IP (tos 0x0, ttl 64, id 25209, offset 0, flags [DF], proto TCP (6), length 32820)
    127.0.0.1.11950 > 127.0.0.1.40304: Flags [.], cksum 0x7e29 (incorrect -> 0x6e28), seq 53059:85827, ack 942, win 512, options [nop,nop,TS val 381783326 ecr 381783287], length 32768
2022-04-07 02:45:00.823611 IP (tos 0x0, ttl 64, id 51030, offset 0, flags [DF], proto TCP (6), length 52)
    127.0.0.1.40304 > 127.0.0.1.11950: Flags [.], cksum 0xfe28 (incorrect -> 0xd5be), seq 942, ack 85827, win 379, options [nop,nop,TS val 381783326 ecr 381783289], length 0
2022-04-07 02:45:00.823617 IP (tos 0x0, ttl 64, id 25210, offset 0, flags [DF], proto TCP (6), length 2328)
    127.0.0.1.11950 > 127.0.0.1.40304: Flags [P.], cksum 0x070d (incorrect -> 0x8a92), seq 85827:88103, ack 942, win 512, options [nop,nop,TS val 381783326 ecr 381783326], length 2276
2022-04-07 02:45:00.824897 IP (tos 0x0, ttl 64, id 51031, offset 0, flags [DF], proto TCP (6), length 52)
    127.0.0.1.40304 > 127.0.0.1.11950: Flags [.], cksum 0xfe28 (incorrect -> 0xcc2f), seq 942, ack 88103, win 512, options [nop,nop,TS val 381783327 ecr 381783326], length 0
2022-04-07 02:45:00.833766 IP (tos 0x0, ttl 64, id 25211, offset 0, flags [DF], proto TCP (6), length 1048)
    127.0.0.1.11950 > 127.0.0.1.40304: Flags [P.], cksum 0x020d (incorrect -> 0x29ec), seq 88103:89099, ack 942, win 512, options [nop,nop,TS val 381783336 ecr 381783327], length 996
2022-04-07 02:45:00.833871 IP (tos 0x0, ttl 64, id 51032, offset 0, flags [DF], proto TCP (6), length 52)
    127.0.0.1.40304 > 127.0.0.1.11950: Flags [.], cksum 0xfe28 (incorrect -> 0xc838), seq 942, ack 89099, win 512, options [nop,nop,TS val 381783336 ecr 381783336], length 0
2022-04-07 02:45:00.858313 IP (tos 0x0, ttl 64, id 25212, offset 0, flags [DF], proto TCP (6), length 3538)
    127.0.0.1.11950 > 127.0.0.1.40304: Flags [P.], cksum 0x0bc7 (incorrect -> 0x219a), seq 89099:92585, ack 942, win 512, options [nop,nop,TS val 381783361 ecr 381783336], length 3486
2022-04-07 02:45:00.858338 IP (tos 0x0, ttl 64, id 51033, offset 0, flags [DF], proto TCP (6), length 52)
    127.0.0.1.40304 > 127.0.0.1.11950: Flags [.], cksum 0xfe28 (incorrect -> 0xba68), seq 942, ack 92585, win 512, options [nop,nop,TS val 381783361 ecr 381783361], length 0
2022-04-07 02:45:00.867220 IP (tos 0x0, ttl 64, id 25213, offset 0, flags [DF], proto TCP (6), length 550)
    127.0.0.1.11950 > 127.0.0.1.40304: Flags [P.], cksum 0x001b (incorrect -> 0xbde5), seq 92585:93083, ack 942, win 512, options [nop,nop,TS val 381783370 ecr 381783361], length 498
2022-04-07 02:45:00.867494 IP (tos 0x0, ttl 64, id 51034, offset 0, flags [DF], proto TCP (6), length 52)
    127.0.0.1.40304 > 127.0.0.1.11950: Flags [.], cksum 0xfe28 (incorrect -> 0xb864), seq 942, ack 93083, win 512, options [nop,nop,TS val 381783370 ecr 381783370], length 0
2022-04-07 02:45:00.867501 IP (tos 0x0, ttl 64, id 25214, offset 0, flags [DF], proto TCP (6), length 3538)
    127.0.0.1.11950 > 127.0.0.1.40304: Flags [P.], cksum 0x0bc7 (incorrect -> 0xbdcd), seq 93083:96569, ack 942, win 512, options [nop,nop,TS val 381783370 ecr 381783370], length 3486
2022-04-07 02:45:00.867777 IP (tos 0x0, ttl 64, id 51035, offset 0, flags [DF], proto TCP (6), length 52)
    127.0.0.1.40304 > 127.0.0.1.11950: Flags [.], cksum 0xfe28 (incorrect -> 0xaac6), seq 942, ack 96569, win 512, options [nop,nop,TS val 381783370 ecr 381783370], length 0
2022-04-07 02:45:00.871360 IP (tos 0x0, ttl 64, id 25215, offset 0, flags [DF], proto TCP (6), length 2488)
    127.0.0.1.11950 > 127.0.0.1.40304: Flags [P.], cksum 0x07ad (incorrect -> 0xa7c4), seq 96569:99005, ack 942, win 512, options [nop,nop,TS val 381783374 ecr 381783370], length 2436
2022-04-07 02:45:00.871382 IP (tos 0x0, ttl 64, id 51036, offset 0, flags [DF], proto TCP (6), length 52)
    127.0.0.1.40304 > 127.0.0.1.11950: Flags [.], cksum 0xfe28 (incorrect -> 0xa13a), seq 942, ack 99005, win 512, options [nop,nop,TS val 381783374 ecr 381783374], length 0
2022-04-07 02:45:00.930736 IP (tos 0x0, ttl 64, id 25216, offset 0, flags [DF], proto TCP (6), length 4100)
    127.0.0.1.11950 > 127.0.0.1.40304: Flags [P.], cksum 0x0df9 (incorrect -> 0xd6de), seq 99005:103053, ack 942, win 512, options [nop,nop,TS val 381783433 ecr 381783374], length 4048
2022-04-07 02:45:00.930927 IP (tos 0x0, ttl 64, id 51037, offset 0, flags [DF], proto TCP (6), length 52)
    127.0.0.1.40304 > 127.0.0.1.11950: Flags [.], cksum 0xfe28 (incorrect -> 0x90f4), seq 942, ack 103053, win 512, options [nop,nop,TS val 381783433 ecr 381783433], length 0
2022-04-07 02:45:00.930932 IP (tos 0x0, ttl 64, id 25217, offset 0, flags [DF], proto TCP (6), length 7458)
    127.0.0.1.11950 > 127.0.0.1.40304: Flags [P.], cksum 0x1b17 (incorrect -> 0x625f), seq 103053:110459, ack 942, win 512, options [nop,nop,TS val 381783433 ecr 381783433], length 7406
2022-04-07 02:45:00.931202 IP (tos 0x0, ttl 64, id 51038, offset 0, flags [DF], proto TCP (6), length 52)
    127.0.0.1.40304 > 127.0.0.1.11950: Flags [.], cksum 0xfe28 (incorrect -> 0x7405), seq 942, ack 110459, win 512, options [nop,nop,TS val 381783434 ecr 381783433], length 0
2022-04-07 02:45:00.933472 IP (tos 0x0, ttl 64, id 25218, offset 0, flags [DF], proto TCP (6), length 4100)
    127.0.0.1.11950 > 127.0.0.1.40304: Flags [P.], cksum 0x0df9 (incorrect -> 0xb4d4), seq 110459:114507, ack 942, win 512, options [nop,nop,TS val 381783436 ecr 381783434], length 4048
2022-04-07 02:45:00.933726 IP (tos 0x0, ttl 64, id 51039, offset 0, flags [DF], proto TCP (6), length 52)
    127.0.0.1.40304 > 127.0.0.1.11950: Flags [.], cksum 0xfe28 (incorrect -> 0x6430), seq 942, ack 114507, win 512, options [nop,nop,TS val 381783436 ecr 381783436], length 0
2022-04-07 02:45:00.933731 IP (tos 0x0, ttl 64, id 25219, offset 0, flags [DF], proto TCP (6), length 11442)
    127.0.0.1.11950 > 127.0.0.1.40304: Flags [P.], cksum 0x2aa7 (incorrect -> 0x0992), seq 114507:125897, ack 942, win 512, options [nop,nop,TS val 381783436 ecr 381783436], length 11390
2022-04-07 02:45:00.933986 IP (tos 0x0, ttl 64, id 51040, offset 0, flags [DF], proto TCP (6), length 52)
    127.0.0.1.40304 > 127.0.0.1.11950: Flags [.], cksum 0xfe28 (incorrect -> 0x37b2), seq 942, ack 125897, win 512, options [nop,nop,TS val 381783436 ecr 381783436], length 0
2022-04-07 02:45:00.934329 IP (tos 0x0, ttl 64, id 25220, offset 0, flags [DF], proto TCP (6), length 550)
    127.0.0.1.11950 > 127.0.0.1.40304: Flags [P.], cksum 0x001b (incorrect -> 0x70a9), seq 125897:126395, ack 942, win 512, options [nop,nop,TS val 381783437 ecr 381783436], length 498
2022-04-07 02:45:00.934448 IP (tos 0x0, ttl 64, id 51041, offset 0, flags [DF], proto TCP (6), length 52)
    127.0.0.1.40304 > 127.0.0.1.11950: Flags [.], cksum 0xfe28 (incorrect -> 0x35be), seq 942, ack 126395, win 512, options [nop,nop,TS val 381783437 ecr 381783437], length 0
2022-04-07 02:45:00.934479 IP (tos 0x0, ttl 64, id 25221, offset 0, flags [DF], proto TCP (6), length 3538)
    127.0.0.1.11950 > 127.0.0.1.40304: Flags [P.], cksum 0x0bc7 (incorrect -> 0x4840), seq 126395:129881, ack 942, win 512, options [nop,nop,TS val 381783437 ecr 381783437], length 3486
2022-04-07 02:45:00.934620 IP (tos 0x0, ttl 64, id 51042, offset 0, flags [DF], proto TCP (6), length 52)
    127.0.0.1.40304 > 127.0.0.1.11950: Flags [.], cksum 0xfe28 (incorrect -> 0x2820), seq 942, ack 129881, win 512, options [nop,nop,TS val 381783437 ecr 381783437], length 0
2022-04-07 02:45:00.934868 IP (tos 0x0, ttl 64, id 25222, offset 0, flags [DF], proto TCP (6), length 550)
    127.0.0.1.11950 > 127.0.0.1.40304: Flags [P.], cksum 0x001b (incorrect -> 0xbc20), seq 129881:130379, ack 942, win 512, options [nop,nop,TS val 381783437 ecr 381783437], length 498
2022-04-07 02:45:00.934882 IP (tos 0x0, ttl 64, id 51043, offset 0, flags [DF], proto TCP (6), length 52)
    127.0.0.1.40304 > 127.0.0.1.11950: Flags [.], cksum 0xfe28 (incorrect -> 0x262e), seq 942, ack 130379, win 512, options [nop,nop,TS val 381783437 ecr 381783437], length 0
2022-04-07 02:45:00.935115 IP (tos 0x0, ttl 64, id 25223, offset 0, flags [DF], proto TCP (6), length 4100)
    127.0.0.1.11950 > 127.0.0.1.40304: Flags [P.], cksum 0x0df9 (incorrect -> 0xe400), seq 130379:134427, ack 942, win 512, options [nop,nop,TS val 381783438 ecr 381783437], length 4048
2022-04-07 02:45:00.935276 IP (tos 0x0, ttl 64, id 51044, offset 0, flags [DF], proto TCP (6), length 52)
    127.0.0.1.40304 > 127.0.0.1.11950: Flags [.], cksum 0xfe28 (incorrect -> 0x165c), seq 942, ack 134427, win 512, options [nop,nop,TS val 381783438 ecr 381783438], length 0
200, 4.811308860778809, 96.73033809661865