2022-04-07 23:33:46.396628 IP (tos 0x0, ttl 64, id 7640, offset 0, flags [DF], proto TCP (6), length 60)
    127.0.0.1.52756 > 127.0.0.1.11850: Flags [S], cksum 0xfe30 (incorrect -> 0x8104), seq 3090429020, win 65495, options [mss 65495,sackOK,TS val 3530625948 ecr 0,nop,wscale 7], length 0
2022-04-07 23:33:46.396643 IP (tos 0x0, ttl 64, id 0, offset 0, flags [DF], proto TCP (6), length 60)
    127.0.0.1.11850 > 127.0.0.1.52756: Flags [S.], cksum 0xfe30 (incorrect -> 0xf3e7), seq 3620065091, ack 3090429021, win 65483, options [mss 65495,sackOK,TS val 3530625948 ecr 3530625948,nop,wscale 7], length 0
2022-04-07 23:33:46.396655 IP (tos 0x0, ttl 64, id 7641, offset 0, flags [DF], proto TCP (6), length 52)
    127.0.0.1.52756 > 127.0.0.1.11850: Flags [.], cksum 0xfe28 (incorrect -> 0x1aa4), seq 1, ack 1, win 512, options [nop,nop,TS val 3530625948 ecr 3530625948], length 0
2022-04-07 23:33:46.396752 IP (tos 0x0, ttl 64, id 7642, offset 0, flags [DF], proto TCP (6), length 55)
    127.0.0.1.52756 > 127.0.0.1.11850: Flags [P.], cksum 0xfe2b (incorrect -> 0x1598), seq 1:4, ack 1, win 512, options [nop,nop,TS val 3530625948 ecr 3530625948], length 3
2022-04-07 23:33:46.396759 IP (tos 0x0, ttl 64, id 22081, offset 0, flags [DF], proto TCP (6), length 52)
    127.0.0.1.11850 > 127.0.0.1.52756: Flags [.], cksum 0xfe28 (incorrect -> 0x1aa1), seq 1, ack 4, win 512, options [nop,nop,TS val 3530625948 ecr 3530625948], length 0
2022-04-07 23:33:46.396843 IP (tos 0x0, ttl 64, id 22082, offset 0, flags [DF], proto TCP (6), length 54)
    127.0.0.1.11850 > 127.0.0.1.52756: Flags [P.], cksum 0xfe2a (incorrect -> 0x1597), seq 1:3, ack 4, win 512, options [nop,nop,TS val 3530625948 ecr 3530625948], length 2
2022-04-07 23:33:46.396850 IP (tos 0x0, ttl 64, id 7643, offset 0, flags [DF], proto TCP (6), length 52)
    127.0.0.1.52756 > 127.0.0.1.11850: Flags [.], cksum 0xfe28 (incorrect -> 0x1a9f), seq 4, ack 3, win 512, options [nop,nop,TS val 3530625948 ecr 3530625948], length 0
2022-04-07 23:33:46.398448 IP (tos 0x0, ttl 64, id 7644, offset 0, flags [DF], proto TCP (6), length 62)
    127.0.0.1.52756 > 127.0.0.1.11850: Flags [P.], cksum 0xfe32 (incorrect -> 0x5faa), seq 4:14, ack 3, win 512, options [nop,nop,TS val 3530625950 ecr 3530625948], length 10
2022-04-07 23:33:46.398469 IP (tos 0x0, ttl 64, id 22083, offset 0, flags [DF], proto TCP (6), length 52)
    127.0.0.1.11850 > 127.0.0.1.52756: Flags [.], cksum 0xfe28 (incorrect -> 0x1a91), seq 3, ack 14, win 512, options [nop,nop,TS val 3530625950 ecr 3530625950], length 0
2022-04-07 23:33:46.430180 IP (tos 0x0, ttl 64, id 22084, offset 0, flags [DF], proto TCP (6), length 62)
    127.0.0.1.11850 > 127.0.0.1.52756: Flags [P.], cksum 0xfe32 (incorrect -> 0x155f), seq 3:13, ack 14, win 512, options [nop,nop,TS val 3530625981 ecr 3530625950], length 10
2022-04-07 23:33:46.430195 IP (tos 0x0, ttl 64, id 7645, offset 0, flags [DF], proto TCP (6), length 52)
    127.0.0.1.52756 > 127.0.0.1.11850: Flags [.], cksum 0xfe28 (incorrect -> 0x1a49), seq 14, ack 13, win 512, options [nop,nop,TS val 3530625981 ecr 3530625981], length 0
2022-04-07 23:33:46.436289 IP (tos 0x0, ttl 64, id 7646, offset 0, flags [DF], proto TCP (6), length 569)
    127.0.0.1.52756 > 127.0.0.1.11850: Flags [P.], cksum 0x002e (incorrect -> 0x5df0), seq 14:531, ack 13, win 512, options [nop,nop,TS val 3530625988 ecr 3530625981], length 517
2022-04-07 23:33:46.436299 IP (tos 0x0, ttl 64, id 22085, offset 0, flags [DF], proto TCP (6), length 52)
    127.0.0.1.11850 > 127.0.0.1.52756: Flags [.], cksum 0xfe28 (incorrect -> 0x183a), seq 13, ack 531, win 508, options [nop,nop,TS val 3530625988 ecr 3530625988], length 0
2022-04-07 23:33:46.493484 IP (tos 0x0, ttl 64, id 22086, offset 0, flags [DF], proto TCP (6), length 3538)
    127.0.0.1.11850 > 127.0.0.1.52756: Flags [P.], cksum 0x0bc7 (incorrect -> 0x50e0), seq 13:3499, ack 531, win 512, options [nop,nop,TS val 3530626045 ecr 3530625988], length 3486
2022-04-07 23:33:46.493494 IP (tos 0x0, ttl 64, id 7647, offset 0, flags [DF], proto TCP (6), length 52)
    127.0.0.1.52756 > 127.0.0.1.11850: Flags [.], cksum 0xfe28 (incorrect -> 0x0a38), seq 531, ack 3499, win 494, options [nop,nop,TS val 3530626045 ecr 3530626045], length 0
2022-04-07 23:33:46.507022 IP (tos 0x0, ttl 64, id 22087, offset 0, flags [DF], proto TCP (6), length 181)
    127.0.0.1.11850 > 127.0.0.1.52756: Flags [P.], cksum 0xfea9 (incorrect -> 0x83e7), seq 3499:3628, ack 531, win 512, options [nop,nop,TS val 3530626058 ecr 3530626045], length 129
2022-04-07 23:33:46.507030 IP (tos 0x0, ttl 64, id 7648, offset 0, flags [DF], proto TCP (6), length 52)
    127.0.0.1.52756 > 127.0.0.1.11850: Flags [.], cksum 0xfe28 (incorrect -> 0x0990), seq 531, ack 3628, win 507, options [nop,nop,TS val 3530626058 ecr 3530626058], length 0
2022-04-07 23:33:46.507143 IP (tos 0x0, ttl 64, id 7649, offset 0, flags [DF], proto TCP (6), length 132)
    127.0.0.1.52756 > 127.0.0.1.11850: Flags [P.], cksum 0xfe78 (incorrect -> 0x175e), seq 531:611, ack 3628, win 512, options [nop,nop,TS val 3530626058 ecr 3530626058], length 80
2022-04-07 23:33:46.507152 IP (tos 0x0, ttl 64, id 22088, offset 0, flags [DF], proto TCP (6), length 52)
    127.0.0.1.11850 > 127.0.0.1.52756: Flags [.], cksum 0xfe28 (incorrect -> 0x093b), seq 3628, ack 611, win 512, options [nop,nop,TS val 3530626058 ecr 3530626058], length 0
2022-04-07 23:33:46.507614 IP (tos 0x0, ttl 64, id 7650, offset 0, flags [DF], proto TCP (6), length 285)
    127.0.0.1.52756 > 127.0.0.1.11850: Flags [P.], cksum 0xff11 (incorrect -> 0x4bcd), seq 611:844, ack 3628, win 512, options [nop,nop,TS val 3530626059 ecr 3530626058], length 233
2022-04-07 23:33:46.507622 IP (tos 0x0, ttl 64, id 22089, offset 0, flags [DF], proto TCP (6), length 52)
    127.0.0.1.11850 > 127.0.0.1.52756: Flags [.], cksum 0xfe28 (incorrect -> 0x0851), seq 3628, ack 844, win 511, options [nop,nop,TS val 3530626059 ecr 3530626059], length 0
2022-04-07 23:33:46.538682 IP (tos 0x0, ttl 64, id 22090, offset 0, flags [DF], proto TCP (6), length 594)
    127.0.0.1.11850 > 127.0.0.1.52756: Flags [P.], cksum 0x0047 (incorrect -> 0x748d), seq 3628:4170, ack 844, win 512, options [nop,nop,TS val 3530626090 ecr 3530626059], length 542
2022-04-07 23:33:46.538690 IP (tos 0x0, ttl 64, id 7651, offset 0, flags [DF], proto TCP (6), length 52)
    127.0.0.1.52756 > 127.0.0.1.11850: Flags [.], cksum 0xfe28 (incorrect -> 0x05f8), seq 844, ack 4170, win 508, options [nop,nop,TS val 3530626090 ecr 3530626090], length 0
2022-04-07 23:33:46.561812 IP (tos 0x0, ttl 64, id 22091, offset 0, flags [DF], proto TCP (6), length 855)
    127.0.0.1.11850 > 127.0.0.1.52756: Flags [P.], cksum 0x014c (incorrect -> 0x7934), seq 4170:4973, ack 844, win 512, options [nop,nop,TS val 3530626113 ecr 3530626090], length 803
2022-04-07 23:33:46.561819 IP (tos 0x0, ttl 64, id 7652, offset 0, flags [DF], proto TCP (6), length 52)
    127.0.0.1.52756 > 127.0.0.1.11850: Flags [.], cksum 0xfe28 (incorrect -> 0x02ab), seq 844, ack 4973, win 504, options [nop,nop,TS val 3530626113 ecr 3530626113], length 0
2022-04-07 23:33:46.562523 IP (tos 0x0, ttl 64, id 7653, offset 0, flags [DF], proto TCP (6), length 52)
    127.0.0.1.52756 > 127.0.0.1.11850: Flags [F.], cksum 0xfe28 (incorrect -> 0x02a1), seq 844, ack 4973, win 512, options [nop,nop,TS val 3530626114 ecr 3530626113], length 0
2022-04-07 23:33:46.562561 IP (tos 0x0, ttl 64, id 22092, offset 0, flags [DF], proto TCP (6), length 52)
    127.0.0.1.11850 > 127.0.0.1.52756: Flags [F.], cksum 0xfe28 (incorrect -> 0x029f), seq 4973, ack 845, win 512, options [nop,nop,TS val 3530626114 ecr 3530626114], length 0
2022-04-07 23:33:46.562575 IP (tos 0x0, ttl 64, id 7654, offset 0, flags [DF], proto TCP (6), length 52)
    127.0.0.1.52756 > 127.0.0.1.11850: Flags [.], cksum 0xfe28 (incorrect -> 0x029f), seq 845, ack 4974, win 512, options [nop,nop,TS val 3530626114 ecr 3530626114], length 0
403, 2.7429444789886475, 0.1705939769744873