2022-04-07 11:45:19.340664 IP (tos 0x0, ttl 64, id 17180, offset 0, flags [DF], proto TCP (6), length 60)
    127.0.0.1.49004 > 127.0.0.1.10650: Flags [S], cksum 0xfe30 (incorrect -> 0x8119), seq 2162171052, win 65495, options [mss 65495,sackOK,TS val 3488118892 ecr 0,nop,wscale 7], length 0
2022-04-07 11:45:19.340679 IP (tos 0x0, ttl 64, id 0, offset 0, flags [DF], proto TCP (6), length 60)
    127.0.0.1.10650 > 127.0.0.1.49004: Flags [S.], cksum 0xfe30 (incorrect -> 0xd6ee), seq 592133765, ack 2162171053, win 65483, options [mss 65495,sackOK,TS val 3488118892 ecr 3488118892,nop,wscale 7], length 0
2022-04-07 11:45:19.340690 IP (tos 0x0, ttl 64, id 17181, offset 0, flags [DF], proto TCP (6), length 52)
    127.0.0.1.49004 > 127.0.0.1.10650: Flags [.], cksum 0xfe28 (incorrect -> 0xfdaa), seq 1, ack 1, win 512, options [nop,nop,TS val 3488118892 ecr 3488118892], length 0
2022-04-07 11:45:19.340801 IP (tos 0x0, ttl 64, id 17182, offset 0, flags [DF], proto TCP (6), length 55)
    127.0.0.1.49004 > 127.0.0.1.10650: Flags [P.], cksum 0xfe2b (incorrect -> 0xf89e), seq 1:4, ack 1, win 512, options [nop,nop,TS val 3488118892 ecr 3488118892], length 3
2022-04-07 11:45:19.340817 IP (tos 0x0, ttl 64, id 25534, offset 0, flags [DF], proto TCP (6), length 52)
    127.0.0.1.10650 > 127.0.0.1.49004: Flags [.], cksum 0xfe28 (incorrect -> 0xfda7), seq 1, ack 4, win 512, options [nop,nop,TS val 3488118892 ecr 3488118892], length 0
2022-04-07 11:45:19.340873 IP (tos 0x0, ttl 64, id 25535, offset 0, flags [DF], proto TCP (6), length 54)
    127.0.0.1.10650 > 127.0.0.1.49004: Flags [P.], cksum 0xfe2a (incorrect -> 0xf89d), seq 1:3, ack 4, win 512, options [nop,nop,TS val 3488118892 ecr 3488118892], length 2
2022-04-07 11:45:19.340889 IP (tos 0x0, ttl 64, id 17183, offset 0, flags [DF], proto TCP (6), length 52)
    127.0.0.1.49004 > 127.0.0.1.10650: Flags [.], cksum 0xfe28 (incorrect -> 0xfda5), seq 4, ack 3, win 512, options [nop,nop,TS val 3488118892 ecr 3488118892], length 0
2022-04-07 11:45:19.342268 IP (tos 0x0, ttl 64, id 17184, offset 0, flags [DF], proto TCP (6), length 62)
    127.0.0.1.49004 > 127.0.0.1.10650: Flags [P.], cksum 0xfe32 (incorrect -> 0x2dd0), seq 4:14, ack 3, win 512, options [nop,nop,TS val 3488118894 ecr 3488118892], length 10
2022-04-07 11:45:19.342286 IP (tos 0x0, ttl 64, id 25536, offset 0, flags [DF], proto TCP (6), length 52)
    127.0.0.1.10650 > 127.0.0.1.49004: Flags [.], cksum 0xfe28 (incorrect -> 0xfd97), seq 3, ack 14, win 512, options [nop,nop,TS val 3488118894 ecr 3488118894], length 0
2022-04-07 11:45:19.528306 IP (tos 0x0, ttl 64, id 25537, offset 0, flags [DF], proto TCP (6), length 62)
    127.0.0.1.10650 > 127.0.0.1.49004: Flags [P.], cksum 0xfe32 (incorrect -> 0xf7ca), seq 3:13, ack 14, win 512, options [nop,nop,TS val 3488119080 ecr 3488118894], length 10
2022-04-07 11:45:19.528318 IP (tos 0x0, ttl 64, id 17185, offset 0, flags [DF], proto TCP (6), length 52)
    127.0.0.1.49004 > 127.0.0.1.10650: Flags [.], cksum 0xfe28 (incorrect -> 0xfc19), seq 14, ack 13, win 512, options [nop,nop,TS val 3488119080 ecr 3488119080], length 0
2022-04-07 11:45:19.534011 IP (tos 0x0, ttl 64, id 17186, offset 0, flags [DF], proto TCP (6), length 569)
    127.0.0.1.49004 > 127.0.0.1.10650: Flags [P.], cksum 0x002e (incorrect -> 0x1800), seq 14:531, ack 13, win 512, options [nop,nop,TS val 3488119085 ecr 3488119080], length 517
2022-04-07 11:45:19.534021 IP (tos 0x0, ttl 64, id 25538, offset 0, flags [DF], proto TCP (6), length 52)
    127.0.0.1.10650 > 127.0.0.1.49004: Flags [.], cksum 0xfe28 (incorrect -> 0xfa0e), seq 13, ack 531, win 508, options [nop,nop,TS val 3488119085 ecr 3488119085], length 0
2022-04-07 11:45:19.717456 IP (tos 0x0, ttl 64, id 25539, offset 0, flags [DF], proto TCP (6), length 3487)
    127.0.0.1.10650 > 127.0.0.1.49004: Flags [P.], cksum 0x0b94 (incorrect -> 0x34a2), seq 13:3448, ack 531, win 512, options [nop,nop,TS val 3488119269 ecr 3488119085], length 3435
2022-04-07 11:45:19.717466 IP (tos 0x0, ttl 64, id 17187, offset 0, flags [DF], proto TCP (6), length 52)
    127.0.0.1.49004 > 127.0.0.1.10650: Flags [.], cksum 0xfe28 (incorrect -> 0xeb41), seq 531, ack 3448, win 494, options [nop,nop,TS val 3488119269 ecr 3488119269], length 0
2022-04-07 11:45:19.718102 IP (tos 0x0, ttl 64, id 17188, offset 0, flags [DF], proto TCP (6), length 145)
    127.0.0.1.49004 > 127.0.0.1.10650: Flags [P.], cksum 0xfe85 (incorrect -> 0x90bf), seq 531:624, ack 3448, win 512, options [nop,nop,TS val 3488119269 ecr 3488119269], length 93
2022-04-07 11:45:19.718111 IP (tos 0x0, ttl 64, id 25540, offset 0, flags [DF], proto TCP (6), length 52)
    127.0.0.1.10650 > 127.0.0.1.49004: Flags [.], cksum 0xfe28 (incorrect -> 0xead2), seq 3448, ack 624, win 512, options [nop,nop,TS val 3488119269 ecr 3488119269], length 0
2022-04-07 11:45:19.940672 IP (tos 0x0, ttl 64, id 25541, offset 0, flags [DF], proto TCP (6), length 103)
    127.0.0.1.10650 > 127.0.0.1.49004: Flags [P.], cksum 0xfe5b (incorrect -> 0x6d94), seq 3448:3499, ack 624, win 512, options [nop,nop,TS val 3488119492 ecr 3488119269], length 51
2022-04-07 11:45:19.940681 IP (tos 0x0, ttl 64, id 17189, offset 0, flags [DF], proto TCP (6), length 52)
    127.0.0.1.49004 > 127.0.0.1.10650: Flags [.], cksum 0xfe28 (incorrect -> 0xe8e1), seq 624, ack 3499, win 512, options [nop,nop,TS val 3488119492 ecr 3488119492], length 0
2022-04-07 11:45:19.941111 IP (tos 0x0, ttl 64, id 17190, offset 0, flags [DF], proto TCP (6), length 447)
    127.0.0.1.49004 > 127.0.0.1.10650: Flags [P.], cksum 0xffb3 (incorrect -> 0xd684), seq 624:1019, ack 3499, win 512, options [nop,nop,TS val 3488119492 ecr 3488119492], length 395
2022-04-07 11:45:19.941121 IP (tos 0x0, ttl 64, id 25542, offset 0, flags [DF], proto TCP (6), length 52)
    127.0.0.1.10650 > 127.0.0.1.49004: Flags [.], cksum 0xfe28 (incorrect -> 0xe759), seq 3499, ack 1019, win 509, options [nop,nop,TS val 3488119492 ecr 3488119492], length 0
2022-04-07 11:45:20.398916 IP (tos 0x0, ttl 64, id 25543, offset 0, flags [DF], proto TCP (6), length 4100)
    127.0.0.1.10650 > 127.0.0.1.49004: Flags [P.], cksum 0x0df9 (incorrect -> 0x305a), seq 3499:7547, ack 1019, win 512, options [nop,nop,TS val 3488119950 ecr 3488119492], length 4048
2022-04-07 11:45:20.442783 IP (tos 0x0, ttl 64, id 17191, offset 0, flags [DF], proto TCP (6), length 52)
    127.0.0.1.49004 > 127.0.0.1.10650: Flags [.], cksum 0xfe28 (incorrect -> 0xd3c6), seq 1019, ack 7547, win 512, options [nop,nop,TS val 3488119994 ecr 3488119950], length 0
2022-04-07 11:45:20.442792 IP (tos 0x0, ttl 64, id 25544, offset 0, flags [DF], proto TCP (6), length 10944)
    127.0.0.1.10650 > 127.0.0.1.49004: Flags [P.], cksum 0x28b5 (incorrect -> 0xb40b), seq 7547:18439, ack 1019, win 512, options [nop,nop,TS val 3488119994 ecr 3488119994], length 10892
2022-04-07 11:45:20.442798 IP (tos 0x0, ttl 64, id 17192, offset 0, flags [DF], proto TCP (6), length 52)
    127.0.0.1.49004 > 127.0.0.1.10650: Flags [.], cksum 0xfe28 (incorrect -> 0xa93d), seq 1019, ack 18439, win 465, options [nop,nop,TS val 3488119994 ecr 3488119994], length 0
2022-04-07 11:45:20.446553 IP (tos 0x0, ttl 64, id 25545, offset 0, flags [DF], proto TCP (6), length 2488)
    127.0.0.1.10650 > 127.0.0.1.49004: Flags [P.], cksum 0x07ad (incorrect -> 0x8d65), seq 18439:20875, ack 1019, win 512, options [nop,nop,TS val 3488119998 ecr 3488119994], length 2436
2022-04-07 11:45:20.446559 IP (tos 0x0, ttl 64, id 17193, offset 0, flags [DF], proto TCP (6), length 52)
    127.0.0.1.49004 > 127.0.0.1.10650: Flags [.], cksum 0xfe28 (incorrect -> 0x9f90), seq 1019, ack 20875, win 498, options [nop,nop,TS val 3488119998 ecr 3488119998], length 0
2022-04-07 11:45:20.508673 IP (tos 0x0, ttl 64, id 25546, offset 0, flags [DF], proto TCP (6), length 3538)
    127.0.0.1.10650 > 127.0.0.1.49004: Flags [P.], cksum 0x0bc7 (incorrect -> 0x7e44), seq 20875:24361, ack 1019, win 512, options [nop,nop,TS val 3488120060 ecr 3488119998], length 3486
2022-04-07 11:45:20.508681 IP (tos 0x0, ttl 64, id 17194, offset 0, flags [DF], proto TCP (6), length 52)
    127.0.0.1.49004 > 127.0.0.1.10650: Flags [.], cksum 0xfe28 (incorrect -> 0x917a), seq 1019, ack 24361, win 494, options [nop,nop,TS val 3488120060 ecr 3488120060], length 0
2022-04-07 11:45:20.524556 IP (tos 0x0, ttl 64, id 25547, offset 0, flags [DF], proto TCP (6), length 3040)
    127.0.0.1.10650 > 127.0.0.1.49004: Flags [P.], cksum 0x09d5 (incorrect -> 0xc447), seq 24361:27349, ack 1019, win 512, options [nop,nop,TS val 3488120076 ecr 3488120060], length 2988
2022-04-07 11:45:20.524562 IP (tos 0x0, ttl 64, id 17195, offset 0, flags [DF], proto TCP (6), length 52)
    127.0.0.1.49004 > 127.0.0.1.10650: Flags [.], cksum 0xfe28 (incorrect -> 0x85ac), seq 1019, ack 27349, win 496, options [nop,nop,TS val 3488120076 ecr 3488120076], length 0
2022-04-07 11:45:20.540441 IP (tos 0x0, ttl 64, id 25548, offset 0, flags [DF], proto TCP (6), length 1048)
    127.0.0.1.10650 > 127.0.0.1.49004: Flags [P.], cksum 0x020d (incorrect -> 0x74d5), seq 27349:28345, ack 1019, win 512, options [nop,nop,TS val 3488120092 ecr 3488120076], length 996
2022-04-07 11:45:20.540448 IP (tos 0x0, ttl 64, id 17196, offset 0, flags [DF], proto TCP (6), length 52)
    127.0.0.1.49004 > 127.0.0.1.10650: Flags [.], cksum 0xfe28 (incorrect -> 0x81a0), seq 1019, ack 28345, win 504, options [nop,nop,TS val 3488120092 ecr 3488120092], length 0
200, 3.7670228481292725, 1.2223000526428223