2022-04-07 12:18:21.923151 IP (tos 0x0, ttl 64, id 25577, offset 0, flags [DF], proto TCP (6), length 60)
    127.0.0.1.34328 > 127.0.0.1.9450: Flags [S], cksum 0xfe30 (incorrect -> 0x95d2), seq 2487480831, win 65495, options [mss 65495,sackOK,TS val 3490101474 ecr 0,nop,wscale 7], length 0
2022-04-07 12:18:21.923162 IP (tos 0x0, ttl 64, id 0, offset 0, flags [DF], proto TCP (6), length 60)
    127.0.0.1.9450 > 127.0.0.1.34328: Flags [S.], cksum 0xfe30 (incorrect -> 0x2603), seq 1200791374, ack 2487480832, win 65483, options [mss 65495,sackOK,TS val 3490101474 ecr 3490101474,nop,wscale 7], length 0
2022-04-07 12:18:21.923170 IP (tos 0x0, ttl 64, id 25578, offset 0, flags [DF], proto TCP (6), length 52)
    127.0.0.1.34328 > 127.0.0.1.9450: Flags [.], cksum 0xfe28 (incorrect -> 0x4cbf), seq 1, ack 1, win 512, options [nop,nop,TS val 3490101474 ecr 3490101474], length 0
2022-04-07 12:18:21.923286 IP (tos 0x0, ttl 64, id 25579, offset 0, flags [DF], proto TCP (6), length 55)
    127.0.0.1.34328 > 127.0.0.1.9450: Flags [P.], cksum 0xfe2b (incorrect -> 0x47b2), seq 1:4, ack 1, win 512, options [nop,nop,TS val 3490101475 ecr 3490101474], length 3
2022-04-07 12:18:21.923299 IP (tos 0x0, ttl 64, id 25465, offset 0, flags [DF], proto TCP (6), length 52)
    127.0.0.1.9450 > 127.0.0.1.34328: Flags [.], cksum 0xfe28 (incorrect -> 0x4cba), seq 1, ack 4, win 512, options [nop,nop,TS val 3490101475 ecr 3490101475], length 0
2022-04-07 12:18:21.923371 IP (tos 0x0, ttl 64, id 25466, offset 0, flags [DF], proto TCP (6), length 54)
    127.0.0.1.9450 > 127.0.0.1.34328: Flags [P.], cksum 0xfe2a (incorrect -> 0x47b0), seq 1:3, ack 4, win 512, options [nop,nop,TS val 3490101475 ecr 3490101475], length 2
2022-04-07 12:18:21.923384 IP (tos 0x0, ttl 64, id 25580, offset 0, flags [DF], proto TCP (6), length 52)
    127.0.0.1.34328 > 127.0.0.1.9450: Flags [.], cksum 0xfe28 (incorrect -> 0x4cb8), seq 4, ack 3, win 512, options [nop,nop,TS val 3490101475 ecr 3490101475], length 0
2022-04-07 12:18:21.926492 IP (tos 0x0, ttl 64, id 25581, offset 0, flags [DF], proto TCP (6), length 62)
    127.0.0.1.34328 > 127.0.0.1.9450: Flags [P.], cksum 0xfe32 (incorrect -> 0x2556), seq 4:14, ack 3, win 512, options [nop,nop,TS val 3490101478 ecr 3490101475], length 10
2022-04-07 12:18:21.926511 IP (tos 0x0, ttl 64, id 25467, offset 0, flags [DF], proto TCP (6), length 52)
    127.0.0.1.9450 > 127.0.0.1.34328: Flags [.], cksum 0xfe28 (incorrect -> 0x4ca8), seq 3, ack 14, win 512, options [nop,nop,TS val 3490101478 ecr 3490101478], length 0
2022-04-07 12:18:21.990518 IP (tos 0x0, ttl 64, id 25468, offset 0, flags [DF], proto TCP (6), length 62)
    127.0.0.1.9450 > 127.0.0.1.34328: Flags [P.], cksum 0xfe32 (incorrect -> 0x4755), seq 3:13, ack 14, win 512, options [nop,nop,TS val 3490101542 ecr 3490101478], length 10
2022-04-07 12:18:21.990527 IP (tos 0x0, ttl 64, id 25582, offset 0, flags [DF], proto TCP (6), length 52)
    127.0.0.1.34328 > 127.0.0.1.9450: Flags [.], cksum 0xfe28 (incorrect -> 0x4c1e), seq 14, ack 13, win 512, options [nop,nop,TS val 3490101542 ecr 3490101542], length 0
2022-04-07 12:18:21.996306 IP (tos 0x0, ttl 64, id 25583, offset 0, flags [DF], proto TCP (6), length 569)
    127.0.0.1.34328 > 127.0.0.1.9450: Flags [P.], cksum 0x002e (incorrect -> 0xb521), seq 14:531, ack 13, win 512, options [nop,nop,TS val 3490101548 ecr 3490101542], length 517
2022-04-07 12:18:21.996315 IP (tos 0x0, ttl 64, id 25469, offset 0, flags [DF], proto TCP (6), length 52)
    127.0.0.1.9450 > 127.0.0.1.34328: Flags [.], cksum 0xfe28 (incorrect -> 0x4a11), seq 13, ack 531, win 508, options [nop,nop,TS val 3490101548 ecr 3490101548], length 0
2022-04-07 12:18:22.070118 IP (tos 0x0, ttl 64, id 25470, offset 0, flags [DF], proto TCP (6), length 3538)
    127.0.0.1.9450 > 127.0.0.1.34328: Flags [P.], cksum 0x0bc7 (incorrect -> 0x7718), seq 13:3499, ack 531, win 512, options [nop,nop,TS val 3490101621 ecr 3490101548], length 3486
2022-04-07 12:18:22.070126 IP (tos 0x0, ttl 64, id 25584, offset 0, flags [DF], proto TCP (6), length 52)
    127.0.0.1.34328 > 127.0.0.1.9450: Flags [.], cksum 0xfe28 (incorrect -> 0x3bef), seq 531, ack 3499, win 494, options [nop,nop,TS val 3490101621 ecr 3490101621], length 0
200, 5.04022741317749, 0.5610322952270508