2022-04-07 18:05:45.750060 IP (tos 0x0, ttl 64, id 60932, offset 0, flags [DF], proto TCP (6), length 60)
    127.0.0.1.49258 > 127.0.0.1.9650: Flags [S], cksum 0xfe30 (incorrect -> 0xa908), seq 2835710076, win 65495, options [mss 65495,sackOK,TS val 3510945301 ecr 0,nop,wscale 7], length 0
2022-04-07 18:05:45.750069 IP (tos 0x0, ttl 64, id 0, offset 0, flags [DF], proto TCP (6), length 60)
    127.0.0.1.9650 > 127.0.0.1.49258: Flags [S.], cksum 0xfe30 (incorrect -> 0xb847), seq 1396639266, ack 2835710077, win 65483, options [mss 65495,sackOK,TS val 3510945301 ecr 3510945301,nop,wscale 7], length 0
2022-04-07 18:05:45.750077 IP (tos 0x0, ttl 64, id 60933, offset 0, flags [DF], proto TCP (6), length 52)
    127.0.0.1.49258 > 127.0.0.1.9650: Flags [.], cksum 0xfe28 (incorrect -> 0xdf03), seq 1, ack 1, win 512, options [nop,nop,TS val 3510945301 ecr 3510945301], length 0
2022-04-07 18:05:45.750180 IP (tos 0x0, ttl 64, id 60934, offset 0, flags [DF], proto TCP (6), length 55)
    127.0.0.1.49258 > 127.0.0.1.9650: Flags [P.], cksum 0xfe2b (incorrect -> 0xd9f7), seq 1:4, ack 1, win 512, options [nop,nop,TS val 3510945301 ecr 3510945301], length 3
2022-04-07 18:05:45.750192 IP (tos 0x0, ttl 64, id 52720, offset 0, flags [DF], proto TCP (6), length 52)
    127.0.0.1.9650 > 127.0.0.1.49258: Flags [.], cksum 0xfe28 (incorrect -> 0xdf00), seq 1, ack 4, win 512, options [nop,nop,TS val 3510945301 ecr 3510945301], length 0
2022-04-07 18:05:45.750231 IP (tos 0x0, ttl 64, id 52721, offset 0, flags [DF], proto TCP (6), length 54)
    127.0.0.1.9650 > 127.0.0.1.49258: Flags [P.], cksum 0xfe2a (incorrect -> 0xd9f5), seq 1:3, ack 4, win 512, options [nop,nop,TS val 3510945302 ecr 3510945301], length 2
2022-04-07 18:05:45.750245 IP (tos 0x0, ttl 64, id 60935, offset 0, flags [DF], proto TCP (6), length 52)
    127.0.0.1.49258 > 127.0.0.1.9650: Flags [.], cksum 0xfe28 (incorrect -> 0xdefc), seq 4, ack 3, win 512, options [nop,nop,TS val 3510945302 ecr 3510945302], length 0
2022-04-07 18:05:45.751861 IP (tos 0x0, ttl 64, id 60936, offset 0, flags [DF], proto TCP (6), length 62)
    127.0.0.1.49258 > 127.0.0.1.9650: Flags [P.], cksum 0xfe32 (incorrect -> 0x2995), seq 4:14, ack 3, win 512, options [nop,nop,TS val 3510945303 ecr 3510945302], length 10
2022-04-07 18:05:45.751873 IP (tos 0x0, ttl 64, id 52722, offset 0, flags [DF], proto TCP (6), length 52)
    127.0.0.1.9650 > 127.0.0.1.49258: Flags [.], cksum 0xfe28 (incorrect -> 0xdef0), seq 3, ack 14, win 512, options [nop,nop,TS val 3510945303 ecr 3510945303], length 0
2022-04-07 18:05:45.846465 IP (tos 0x0, ttl 64, id 52723, offset 0, flags [DF], proto TCP (6), length 62)
    127.0.0.1.9650 > 127.0.0.1.49258: Flags [P.], cksum 0xfe32 (incorrect -> 0xd97e), seq 3:13, ack 14, win 512, options [nop,nop,TS val 3510945398 ecr 3510945303], length 10
2022-04-07 18:05:45.846476 IP (tos 0x0, ttl 64, id 60937, offset 0, flags [DF], proto TCP (6), length 52)
    127.0.0.1.49258 > 127.0.0.1.9650: Flags [.], cksum 0xfe28 (incorrect -> 0xde28), seq 14, ack 13, win 512, options [nop,nop,TS val 3510945398 ecr 3510945398], length 0
2022-04-07 18:05:45.852061 IP (tos 0x0, ttl 64, id 60938, offset 0, flags [DF], proto TCP (6), length 569)
    127.0.0.1.49258 > 127.0.0.1.9650: Flags [P.], cksum 0x002e (incorrect -> 0xfbb7), seq 14:531, ack 13, win 512, options [nop,nop,TS val 3510945403 ecr 3510945398], length 517
2022-04-07 18:05:45.852071 IP (tos 0x0, ttl 64, id 52724, offset 0, flags [DF], proto TCP (6), length 52)
    127.0.0.1.9650 > 127.0.0.1.49258: Flags [.], cksum 0xfe28 (incorrect -> 0xdc1d), seq 13, ack 531, win 508, options [nop,nop,TS val 3510945403 ecr 3510945403], length 0
2022-04-07 18:05:45.954272 IP (tos 0x0, ttl 64, id 52725, offset 0, flags [DF], proto TCP (6), length 3538)
    127.0.0.1.9650 > 127.0.0.1.49258: Flags [P.], cksum 0x0bc7 (incorrect -> 0x94ae), seq 13:3499, ack 531, win 512, options [nop,nop,TS val 3510945506 ecr 3510945403], length 3486
2022-04-07 18:05:45.954281 IP (tos 0x0, ttl 64, id 60939, offset 0, flags [DF], proto TCP (6), length 52)
    127.0.0.1.49258 > 127.0.0.1.9650: Flags [.], cksum 0xfe28 (incorrect -> 0xcdbf), seq 531, ack 3499, win 494, options [nop,nop,TS val 3510945506 ecr 3510945506], length 0
2022-04-07 18:05:45.977131 IP (tos 0x0, ttl 64, id 52726, offset 0, flags [DF], proto TCP (6), length 781)
    127.0.0.1.9650 > 127.0.0.1.49258: Flags [P.], cksum 0x0102 (incorrect -> 0xa0a9), seq 3499:4228, ack 531, win 512, options [nop,nop,TS val 3510945528 ecr 3510945506], length 729
2022-04-07 18:05:45.977139 IP (tos 0x0, ttl 64, id 60940, offset 0, flags [DF], proto TCP (6), length 52)
    127.0.0.1.49258 > 127.0.0.1.9650: Flags [.], cksum 0xfe28 (incorrect -> 0xcaaf), seq 531, ack 4228, win 505, options [nop,nop,TS val 3510945528 ecr 3510945528], length 0
2022-04-07 18:05:45.977493 IP (tos 0x0, ttl 64, id 60941, offset 0, flags [DF], proto TCP (6), length 132)
    127.0.0.1.49258 > 127.0.0.1.9650: Flags [P.], cksum 0xfe78 (incorrect -> 0xa9fa), seq 531:611, ack 4228, win 512, options [nop,nop,TS val 3510945529 ecr 3510945528], length 80
2022-04-07 18:05:45.977502 IP (tos 0x0, ttl 64, id 52727, offset 0, flags [DF], proto TCP (6), length 52)
    127.0.0.1.9650 > 127.0.0.1.49258: Flags [.], cksum 0xfe28 (incorrect -> 0xca56), seq 4228, ack 611, win 512, options [nop,nop,TS val 3510945529 ecr 3510945529], length 0
2022-04-07 18:05:45.977860 IP (tos 0x0, ttl 64, id 60942, offset 0, flags [DF], proto TCP (6), length 340)
    127.0.0.1.49258 > 127.0.0.1.9650: Flags [P.], cksum 0xff48 (incorrect -> 0x3085), seq 611:899, ack 4228, win 512, options [nop,nop,TS val 3510945529 ecr 3510945529], length 288
2022-04-07 18:05:45.977868 IP (tos 0x0, ttl 64, id 52728, offset 0, flags [DF], proto TCP (6), length 52)
    127.0.0.1.9650 > 127.0.0.1.49258: Flags [.], cksum 0xfe28 (incorrect -> 0xc938), seq 4228, ack 899, win 510, options [nop,nop,TS val 3510945529 ecr 3510945529], length 0
2022-04-07 18:05:46.059089 IP (tos 0x0, ttl 64, id 52729, offset 0, flags [DF], proto TCP (6), length 594)
    127.0.0.1.9650 > 127.0.0.1.49258: Flags [P.], cksum 0x0047 (incorrect -> 0xe6e5), seq 4228:4770, ack 899, win 512, options [nop,nop,TS val 3510945610 ecr 3510945529], length 542
2022-04-07 18:05:46.059108 IP (tos 0x0, ttl 64, id 60943, offset 0, flags [DF], proto TCP (6), length 52)
    127.0.0.1.49258 > 127.0.0.1.9650: Flags [.], cksum 0xfe28 (incorrect -> 0xc67a), seq 899, ack 4770, win 508, options [nop,nop,TS val 3510945610 ecr 3510945610], length 0
2022-04-07 18:05:46.135845 IP (tos 0x0, ttl 64, id 52730, offset 0, flags [DF], proto TCP (6), length 3538)
    127.0.0.1.9650 > 127.0.0.1.49258: Flags [P.], cksum 0x0bc7 (incorrect -> 0x6e01), seq 4770:8256, ack 899, win 512, options [nop,nop,TS val 3510945687 ecr 3510945610], length 3486
2022-04-07 18:05:46.135853 IP (tos 0x0, ttl 64, id 60944, offset 0, flags [DF], proto TCP (6), length 52)
    127.0.0.1.49258 > 127.0.0.1.9650: Flags [.], cksum 0xfe28 (incorrect -> 0xb850), seq 899, ack 8256, win 494, options [nop,nop,TS val 3510945687 ecr 3510945687], length 0
2022-04-07 18:05:46.135921 IP (tos 0x0, ttl 64, id 52731, offset 0, flags [DF], proto TCP (6), length 4036)
    127.0.0.1.9650 > 127.0.0.1.49258: Flags [P.], cksum 0x0db9 (incorrect -> 0x4de0), seq 8256:12240, ack 899, win 512, options [nop,nop,TS val 3510945687 ecr 3510945687], length 3984
2022-04-07 18:05:46.135926 IP (tos 0x0, ttl 64, id 60945, offset 0, flags [DF], proto TCP (6), length 52)
    127.0.0.1.49258 > 127.0.0.1.9650: Flags [.], cksum 0xfe28 (incorrect -> 0xa8c2), seq 899, ack 12240, win 492, options [nop,nop,TS val 3510945687 ecr 3510945687], length 0
2022-04-07 18:05:46.148399 IP (tos 0x0, ttl 64, id 52732, offset 0, flags [DF], proto TCP (6), length 2044)
    127.0.0.1.9650 > 127.0.0.1.49258: Flags [P.], cksum 0x05f1 (incorrect -> 0x9f5b), seq 12240:14232, ack 899, win 512, options [nop,nop,TS val 3510945700 ecr 3510945687], length 1992
2022-04-07 18:05:46.148406 IP (tos 0x0, ttl 64, id 60946, offset 0, flags [DF], proto TCP (6), length 52)
    127.0.0.1.49258 > 127.0.0.1.9650: Flags [.], cksum 0xfe28 (incorrect -> 0xa0d8), seq 899, ack 14232, win 500, options [nop,nop,TS val 3510945700 ecr 3510945700], length 0
2022-04-07 18:05:46.158257 IP (tos 0x0, ttl 64, id 52733, offset 0, flags [DF], proto TCP (6), length 4100)
    127.0.0.1.9650 > 127.0.0.1.49258: Flags [P.], cksum 0x0df9 (incorrect -> 0x90a7), seq 14232:18280, ack 899, win 512, options [nop,nop,TS val 3510945710 ecr 3510945700], length 4048
2022-04-07 18:05:46.158263 IP (tos 0x0, ttl 64, id 60947, offset 0, flags [DF], proto TCP (6), length 52)
    127.0.0.1.49258 > 127.0.0.1.9650: Flags [.], cksum 0xfe28 (incorrect -> 0x90fc), seq 899, ack 18280, win 492, options [nop,nop,TS val 3510945710 ecr 3510945710], length 0
2022-04-07 18:05:46.158270 IP (tos 0x0, ttl 64, id 52734, offset 0, flags [DF], proto TCP (6), length 3474)
    127.0.0.1.9650 > 127.0.0.1.49258: Flags [P.], cksum 0x0b87 (incorrect -> 0xb9ac), seq 18280:21702, ack 899, win 512, options [nop,nop,TS val 3510945710 ecr 3510945710], length 3422
2022-04-07 18:05:46.158274 IP (tos 0x0, ttl 64, id 60948, offset 0, flags [DF], proto TCP (6), length 52)
    127.0.0.1.49258 > 127.0.0.1.9650: Flags [.], cksum 0xfe28 (incorrect -> 0x83ac), seq 899, ack 21702, win 478, options [nop,nop,TS val 3510945710 ecr 3510945710], length 0
2022-04-07 18:05:46.158333 IP (tos 0x0, ttl 64, id 52735, offset 0, flags [DF], proto TCP (6), length 4036)
    127.0.0.1.9650 > 127.0.0.1.49258: Flags [P.], cksum 0x0db9 (incorrect -> 0x2edd), seq 21702:25686, ack 899, win 512, options [nop,nop,TS val 3510945710 ecr 3510945710], length 3984
2022-04-07 18:05:46.158338 IP (tos 0x0, ttl 64, id 60949, offset 0, flags [DF], proto TCP (6), length 52)
    127.0.0.1.49258 > 127.0.0.1.9650: Flags [.], cksum 0xfe28 (incorrect -> 0x742b), seq 899, ack 25686, win 463, options [nop,nop,TS val 3510945710 ecr 3510945710], length 0
2022-04-07 18:05:46.160900 IP (tos 0x0, ttl 64, id 52736, offset 0, flags [DF], proto TCP (6), length 4100)
    127.0.0.1.9650 > 127.0.0.1.49258: Flags [P.], cksum 0x0df9 (incorrect -> 0x819b), seq 25686:29734, ack 899, win 512, options [nop,nop,TS val 3510945712 ecr 3510945710], length 4048
2022-04-07 18:05:46.160908 IP (tos 0x0, ttl 64, id 60950, offset 0, flags [DF], proto TCP (6), length 52)
    127.0.0.1.49258 > 127.0.0.1.9650: Flags [.], cksum 0xfe28 (incorrect -> 0x643a), seq 899, ack 29734, win 492, options [nop,nop,TS val 3510945712 ecr 3510945712], length 0
2022-04-07 18:05:46.160914 IP (tos 0x0, ttl 64, id 52737, offset 0, flags [DF], proto TCP (6), length 72)
    127.0.0.1.9650 > 127.0.0.1.49258: Flags [P.], cksum 0xfe3c (incorrect -> 0x7eca), seq 29734:29754, ack 899, win 512, options [nop,nop,TS val 3510945712 ecr 3510945712], length 20
2022-04-07 18:05:46.160951 IP (tos 0x0, ttl 64, id 60951, offset 0, flags [DF], proto TCP (6), length 52)
    127.0.0.1.49258 > 127.0.0.1.9650: Flags [.], cksum 0xfe28 (incorrect -> 0x6412), seq 899, ack 29754, win 512, options [nop,nop,TS val 3510945712 ecr 3510945712], length 0
2022-04-07 18:05:46.160956 IP (tos 0x0, ttl 64, id 52738, offset 0, flags [DF], proto TCP (6), length 1048)
    127.0.0.1.9650 > 127.0.0.1.49258: Flags [P.], cksum 0x020d (incorrect -> 0x529b), seq 29754:30750, ack 899, win 512, options [nop,nop,TS val 3510945712 ecr 3510945712], length 996
2022-04-07 18:05:46.160961 IP (tos 0x0, ttl 64, id 60952, offset 0, flags [DF], proto TCP (6), length 52)
    127.0.0.1.49258 > 127.0.0.1.9650: Flags [.], cksum 0xfe28 (incorrect -> 0x602e), seq 899, ack 30750, win 512, options [nop,nop,TS val 3510945712 ecr 3510945712], length 0
2022-04-07 18:05:46.183467 IP (tos 0x0, ttl 64, id 52739, offset 0, flags [DF], proto TCP (6), length 3326)
    127.0.0.1.9650 > 127.0.0.1.49258: Flags [P.], cksum 0x0af3 (incorrect -> 0xe948), seq 30750:34024, ack 899, win 512, options [nop,nop,TS val 3510945735 ecr 3510945712], length 3274
2022-04-07 18:05:46.183507 IP (tos 0x0, ttl 64, id 60953, offset 0, flags [DF], proto TCP (6), length 52)
    127.0.0.1.49258 > 127.0.0.1.9650: Flags [.], cksum 0xfe28 (incorrect -> 0x5336), seq 899, ack 34024, win 512, options [nop,nop,TS val 3510945735 ecr 3510945735], length 0
2022-04-07 18:05:46.196017 IP (tos 0x0, ttl 64, id 52740, offset 0, flags [DF], proto TCP (6), length 3824)
    127.0.0.1.9650 > 127.0.0.1.49258: Flags [P.], cksum 0x0ce5 (incorrect -> 0xf280), seq 34024:37796, ack 899, win 512, options [nop,nop,TS val 3510945747 ecr 3510945735], length 3772
2022-04-07 18:05:46.196398 IP (tos 0x0, ttl 64, id 60954, offset 0, flags [DF], proto TCP (6), length 52)
    127.0.0.1.49258 > 127.0.0.1.9650: Flags [.], cksum 0xfe28 (incorrect -> 0x4461), seq 899, ack 37796, win 512, options [nop,nop,TS val 3510945748 ecr 3510945747], length 0
2022-04-07 18:05:46.271329 IP (tos 0x0, ttl 64, id 52741, offset 0, flags [DF], proto TCP (6), length 3114)
    127.0.0.1.9650 > 127.0.0.1.49258: Flags [P.], cksum 0x0a1f (incorrect -> 0xd5cb), seq 37796:40858, ack 899, win 512, options [nop,nop,TS val 3510945823 ecr 3510945748], length 3062
2022-04-07 18:05:46.271560 IP (tos 0x0, ttl 64, id 60955, offset 0, flags [DF], proto TCP (6), length 52)
    127.0.0.1.49258 > 127.0.0.1.9650: Flags [.], cksum 0xfe28 (incorrect -> 0x37d4), seq 899, ack 40858, win 512, options [nop,nop,TS val 3510945823 ecr 3510945823], length 0
2022-04-07 18:05:46.271568 IP (tos 0x0, ttl 64, id 52742, offset 0, flags [DF], proto TCP (6), length 7988)
    127.0.0.1.9650 > 127.0.0.1.49258: Flags [P.], cksum 0x1d29 (incorrect -> 0xe26a), seq 40858:48794, ack 899, win 512, options [nop,nop,TS val 3510945823 ecr 3510945823], length 7936
2022-04-07 18:05:46.283998 IP (tos 0x0, ttl 64, id 52743, offset 0, flags [DF], proto TCP (6), length 32820)
    127.0.0.1.9650 > 127.0.0.1.49258: Flags [.], cksum 0x7e29 (incorrect -> 0x3a4c), seq 48794:81562, ack 899, win 512, options [nop,nop,TS val 3510945835 ecr 3510945823], length 32768
2022-04-07 18:05:46.284029 IP (tos 0x0, ttl 64, id 60956, offset 0, flags [DF], proto TCP (6), length 52)
    127.0.0.1.49258 > 127.0.0.1.9650: Flags [.], cksum 0xfe28 (incorrect -> 0x994c), seq 899, ack 81562, win 379, options [nop,nop,TS val 3510945835 ecr 3510945823], length 0
2022-04-07 18:05:46.284036 IP (tos 0x0, ttl 64, id 52744, offset 0, flags [DF], proto TCP (6), length 3372)
    127.0.0.1.9650 > 127.0.0.1.49258: Flags [P.], cksum 0x0b21 (incorrect -> 0xd371), seq 81562:84882, ack 899, win 512, options [nop,nop,TS val 3510945835 ecr 3510945835], length 3320
2022-04-07 18:05:46.284640 IP (tos 0x0, ttl 64, id 60957, offset 0, flags [DF], proto TCP (6), length 52)
    127.0.0.1.49258 > 127.0.0.1.9650: Flags [.], cksum 0xfe28 (incorrect -> 0x8bc2), seq 899, ack 84882, win 512, options [nop,nop,TS val 3510945836 ecr 3510945835], length 0
2022-04-07 18:05:46.330217 IP (tos 0x0, ttl 64, id 52745, offset 0, flags [DF], proto TCP (6), length 4100)
    127.0.0.1.9650 > 127.0.0.1.49258: Flags [P.], cksum 0x0df9 (incorrect -> 0xe05d), seq 84882:88930, ack 899, win 512, options [nop,nop,TS val 3510945881 ecr 3510945836], length 4048
2022-04-07 18:05:46.330411 IP (tos 0x0, ttl 64, id 60958, offset 0, flags [DF], proto TCP (6), length 52)
    127.0.0.1.49258 > 127.0.0.1.9650: Flags [.], cksum 0xfe28 (incorrect -> 0x7b96), seq 899, ack 88930, win 512, options [nop,nop,TS val 3510945882 ecr 3510945881], length 0
2022-04-07 18:05:46.330418 IP (tos 0x0, ttl 64, id 52746, offset 0, flags [DF], proto TCP (6), length 6610)
    127.0.0.1.9650 > 127.0.0.1.49258: Flags [P.], cksum 0x17c7 (incorrect -> 0xddf4), seq 88930:95488, ack 899, win 512, options [nop,nop,TS val 3510945882 ecr 3510945882], length 6558
2022-04-07 18:05:46.330423 IP (tos 0x0, ttl 64, id 60959, offset 0, flags [DF], proto TCP (6), length 52)
    127.0.0.1.49258 > 127.0.0.1.9650: Flags [.], cksum 0xfe28 (incorrect -> 0x61f7), seq 899, ack 95488, win 512, options [nop,nop,TS val 3510945882 ecr 3510945882], length 0
2022-04-07 18:05:46.342716 IP (tos 0x0, ttl 64, id 52747, offset 0, flags [DF], proto TCP (6), length 4100)
    127.0.0.1.9650 > 127.0.0.1.49258: Flags [P.], cksum 0x0df9 (incorrect -> 0x2a0b), seq 95488:99536, ack 899, win 512, options [nop,nop,TS val 3510945894 ecr 3510945882], length 4048
2022-04-07 18:05:46.342746 IP (tos 0x0, ttl 64, id 60960, offset 0, flags [DF], proto TCP (6), length 52)
    127.0.0.1.49258 > 127.0.0.1.9650: Flags [.], cksum 0xfe28 (incorrect -> 0x520f), seq 899, ack 99536, win 512, options [nop,nop,TS val 3510945894 ecr 3510945894], length 0
2022-04-07 18:05:46.342751 IP (tos 0x0, ttl 64, id 52748, offset 0, flags [DF], proto TCP (6), length 772)
    127.0.0.1.9650 > 127.0.0.1.49258: Flags [P.], cksum 0x00f9 (incorrect -> 0xf8da), seq 99536:100256, ack 899, win 512, options [nop,nop,TS val 3510945894 ecr 3510945894], length 720
2022-04-07 18:05:46.342756 IP (tos 0x0, ttl 64, id 60961, offset 0, flags [DF], proto TCP (6), length 52)
    127.0.0.1.49258 > 127.0.0.1.9650: Flags [.], cksum 0xfe28 (incorrect -> 0x4f3f), seq 899, ack 100256, win 512, options [nop,nop,TS val 3510945894 ecr 3510945894], length 0
2022-04-07 18:05:46.352170 IP (tos 0x0, ttl 64, id 52749, offset 0, flags [DF], proto TCP (6), length 4100)
    127.0.0.1.9650 > 127.0.0.1.49258: Flags [P.], cksum 0x0df9 (incorrect -> 0x93aa), seq 100256:104304, ack 899, win 512, options [nop,nop,TS val 3510945903 ecr 3510945894], length 4048
2022-04-07 18:05:46.352384 IP (tos 0x0, ttl 64, id 60962, offset 0, flags [DF], proto TCP (6), length 52)
    127.0.0.1.49258 > 127.0.0.1.9650: Flags [.], cksum 0xfe28 (incorrect -> 0x3f5c), seq 899, ack 104304, win 512, options [nop,nop,TS val 3510945904 ecr 3510945903], length 0
2022-04-07 18:05:46.352389 IP (tos 0x0, ttl 64, id 52750, offset 0, flags [DF], proto TCP (6), length 3050)
    127.0.0.1.9650 > 127.0.0.1.49258: Flags [P.], cksum 0x09df (incorrect -> 0x9cc4), seq 104304:107302, ack 899, win 512, options [nop,nop,TS val 3510945904 ecr 3510945904], length 2998
2022-04-07 18:05:46.352396 IP (tos 0x0, ttl 64, id 60963, offset 0, flags [DF], proto TCP (6), length 52)
    127.0.0.1.49258 > 127.0.0.1.9650: Flags [.], cksum 0xfe28 (incorrect -> 0x33a5), seq 899, ack 107302, win 512, options [nop,nop,TS val 3510945904 ecr 3510945904], length 0
2022-04-07 18:05:46.354404 IP (tos 0x0, ttl 64, id 52751, offset 0, flags [DF], proto TCP (6), length 1546)
    127.0.0.1.9650 > 127.0.0.1.49258: Flags [P.], cksum 0x03ff (incorrect -> 0x90fd), seq 107302:108796, ack 899, win 512, options [nop,nop,TS val 3510945906 ecr 3510945904], length 1494
2022-04-07 18:05:46.354418 IP (tos 0x0, ttl 64, id 60964, offset 0, flags [DF], proto TCP (6), length 52)
    127.0.0.1.49258 > 127.0.0.1.9650: Flags [.], cksum 0xfe28 (incorrect -> 0x2dcb), seq 899, ack 108796, win 512, options [nop,nop,TS val 3510945906 ecr 3510945906], length 0
2022-04-07 18:05:46.354525 IP (tos 0x0, ttl 64, id 52752, offset 0, flags [DF], proto TCP (6), length 4100)
    127.0.0.1.9650 > 127.0.0.1.49258: Flags [P.], cksum 0x0df9 (incorrect -> 0xd0e5), seq 108796:112844, ack 899, win 512, options [nop,nop,TS val 3510945906 ecr 3510945906], length 4048
2022-04-07 18:05:46.354645 IP (tos 0x0, ttl 64, id 60965, offset 0, flags [DF], proto TCP (6), length 52)
    127.0.0.1.49258 > 127.0.0.1.9650: Flags [.], cksum 0xfe28 (incorrect -> 0x1dfb), seq 899, ack 112844, win 512, options [nop,nop,TS val 3510945906 ecr 3510945906], length 0
2022-04-07 18:05:46.354650 IP (tos 0x0, ttl 64, id 52753, offset 0, flags [DF], proto TCP (6), length 3474)
    127.0.0.1.9650 > 127.0.0.1.49258: Flags [P.], cksum 0x0b87 (incorrect -> 0x55af), seq 112844:116266, ack 899, win 512, options [nop,nop,TS val 3510945906 ecr 3510945906], length 3422
2022-04-07 18:05:46.354656 IP (tos 0x0, ttl 64, id 60966, offset 0, flags [DF], proto TCP (6), length 52)
    127.0.0.1.49258 > 127.0.0.1.9650: Flags [.], cksum 0xfe28 (incorrect -> 0x109d), seq 899, ack 116266, win 512, options [nop,nop,TS val 3510945906 ecr 3510945906], length 0
2022-04-07 18:05:46.355179 IP (tos 0x0, ttl 64, id 52754, offset 0, flags [DF], proto TCP (6), length 3538)
    127.0.0.1.9650 > 127.0.0.1.49258: Flags [P.], cksum 0x0bc7 (incorrect -> 0xb307), seq 116266:119752, ack 899, win 512, options [nop,nop,TS val 3510945906 ecr 3510945906], length 3486
2022-04-07 18:05:46.355215 IP (tos 0x0, ttl 64, id 60967, offset 0, flags [DF], proto TCP (6), length 52)
    127.0.0.1.49258 > 127.0.0.1.9650: Flags [.], cksum 0xfe28 (incorrect -> 0x02ff), seq 899, ack 119752, win 512, options [nop,nop,TS val 3510945906 ecr 3510945906], length 0
2022-04-07 18:05:46.375105 IP (tos 0x0, ttl 64, id 52755, offset 0, flags [DF], proto TCP (6), length 3538)
    127.0.0.1.9650 > 127.0.0.1.49258: Flags [P.], cksum 0x0bc7 (incorrect -> 0x9a44), seq 119752:123238, ack 899, win 512, options [nop,nop,TS val 3510945926 ecr 3510945906], length 3486
2022-04-07 18:05:46.418783 IP (tos 0x0, ttl 64, id 60968, offset 0, flags [DF], proto TCP (6), length 52)
    127.0.0.1.49258 > 127.0.0.1.9650: Flags [.], cksum 0xfe28 (incorrect -> 0xf50c), seq 899, ack 123238, win 512, options [nop,nop,TS val 3510945970 ecr 3510945926], length 0
200, 4.698805570602417, 0.8229899406433105