2022-04-07 22:34:40.843254 IP (tos 0x0, ttl 64, id 44476, offset 0, flags [DF], proto TCP (6), length 60)
    127.0.0.1.39774 > 127.0.0.1.11650: Flags [S], cksum 0xfe30 (incorrect -> 0x1ff0), seq 174231752, win 65495, options [mss 65495,sackOK,TS val 3527080395 ecr 0,nop,wscale 7], length 0
2022-04-07 22:34:40.843264 IP (tos 0x0, ttl 64, id 0, offset 0, flags [DF], proto TCP (6), length 60)
    127.0.0.1.11650 > 127.0.0.1.39774: Flags [S.], cksum 0xfe30 (incorrect -> 0xd909), seq 3233790490, ack 174231753, win 65483, options [mss 65495,sackOK,TS val 3527080395 ecr 3527080395,nop,wscale 7], length 0
2022-04-07 22:34:40.843272 IP (tos 0x0, ttl 64, id 44477, offset 0, flags [DF], proto TCP (6), length 52)
    127.0.0.1.39774 > 127.0.0.1.11650: Flags [.], cksum 0xfe28 (incorrect -> 0xffc5), seq 1, ack 1, win 512, options [nop,nop,TS val 3527080395 ecr 3527080395], length 0
2022-04-07 22:34:40.843448 IP (tos 0x0, ttl 64, id 44478, offset 0, flags [DF], proto TCP (6), length 55)
    127.0.0.1.39774 > 127.0.0.1.11650: Flags [P.], cksum 0xfe2b (incorrect -> 0xfab9), seq 1:4, ack 1, win 512, options [nop,nop,TS val 3527080395 ecr 3527080395], length 3
2022-04-07 22:34:40.843456 IP (tos 0x0, ttl 64, id 12678, offset 0, flags [DF], proto TCP (6), length 52)
    127.0.0.1.11650 > 127.0.0.1.39774: Flags [.], cksum 0xfe28 (incorrect -> 0xffc2), seq 1, ack 4, win 512, options [nop,nop,TS val 3527080395 ecr 3527080395], length 0
2022-04-07 22:34:40.843490 IP (tos 0x0, ttl 64, id 12679, offset 0, flags [DF], proto TCP (6), length 54)
    127.0.0.1.11650 > 127.0.0.1.39774: Flags [P.], cksum 0xfe2a (incorrect -> 0xfab8), seq 1:3, ack 4, win 512, options [nop,nop,TS val 3527080395 ecr 3527080395], length 2
2022-04-07 22:34:40.843499 IP (tos 0x0, ttl 64, id 44479, offset 0, flags [DF], proto TCP (6), length 52)
    127.0.0.1.39774 > 127.0.0.1.11650: Flags [.], cksum 0xfe28 (incorrect -> 0xffc0), seq 4, ack 3, win 512, options [nop,nop,TS val 3527080395 ecr 3527080395], length 0
2022-04-07 22:34:40.844736 IP (tos 0x0, ttl 64, id 44480, offset 0, flags [DF], proto TCP (6), length 62)
    127.0.0.1.39774 > 127.0.0.1.11650: Flags [P.], cksum 0xfe32 (incorrect -> 0x581e), seq 4:14, ack 3, win 512, options [nop,nop,TS val 3527080396 ecr 3527080395], length 10
2022-04-07 22:34:40.844756 IP (tos 0x0, ttl 64, id 12680, offset 0, flags [DF], proto TCP (6), length 52)
    127.0.0.1.11650 > 127.0.0.1.39774: Flags [.], cksum 0xfe28 (incorrect -> 0xffb4), seq 3, ack 14, win 512, options [nop,nop,TS val 3527080396 ecr 3527080396], length 0
2022-04-07 22:34:40.901385 IP (tos 0x0, ttl 64, id 12681, offset 0, flags [DF], proto TCP (6), length 62)
    127.0.0.1.11650 > 127.0.0.1.39774: Flags [P.], cksum 0xfe32 (incorrect -> 0xfa68), seq 3:13, ack 14, win 512, options [nop,nop,TS val 3527080453 ecr 3527080396], length 10
2022-04-07 22:34:40.901399 IP (tos 0x0, ttl 64, id 44481, offset 0, flags [DF], proto TCP (6), length 52)
    127.0.0.1.39774 > 127.0.0.1.11650: Flags [.], cksum 0xfe28 (incorrect -> 0xff38), seq 14, ack 13, win 512, options [nop,nop,TS val 3527080453 ecr 3527080453], length 0
2022-04-07 22:34:40.907389 IP (tos 0x0, ttl 64, id 44482, offset 0, flags [DF], proto TCP (6), length 569)
    127.0.0.1.39774 > 127.0.0.1.11650: Flags [P.], cksum 0x002e (incorrect -> 0x899d), seq 14:531, ack 13, win 512, options [nop,nop,TS val 3527080459 ecr 3527080453], length 517
2022-04-07 22:34:40.907400 IP (tos 0x0, ttl 64, id 12682, offset 0, flags [DF], proto TCP (6), length 52)
    127.0.0.1.11650 > 127.0.0.1.39774: Flags [.], cksum 0xfe28 (incorrect -> 0xfd2b), seq 13, ack 531, win 508, options [nop,nop,TS val 3527080459 ecr 3527080459], length 0
2022-04-07 22:34:40.959677 IP (tos 0x0, ttl 64, id 12683, offset 0, flags [DF], proto TCP (6), length 3538)
    127.0.0.1.11650 > 127.0.0.1.39774: Flags [P.], cksum 0x0bc7 (incorrect -> 0x64b6), seq 13:3499, ack 531, win 512, options [nop,nop,TS val 3527080511 ecr 3527080459], length 3486
2022-04-07 22:34:40.959691 IP (tos 0x0, ttl 64, id 44483, offset 0, flags [DF], proto TCP (6), length 52)
    127.0.0.1.39774 > 127.0.0.1.11650: Flags [.], cksum 0xfe28 (incorrect -> 0xef33), seq 531, ack 3499, win 494, options [nop,nop,TS val 3527080511 ecr 3527080511], length 0
2022-04-07 22:34:40.973442 IP (tos 0x0, ttl 64, id 12684, offset 0, flags [DF], proto TCP (6), length 1157)
    127.0.0.1.11650 > 127.0.0.1.39774: Flags [P.], cksum 0x027a (incorrect -> 0x6b79), seq 3499:4604, ack 531, win 512, options [nop,nop,TS val 3527080525 ecr 3527080511], length 1105
2022-04-07 22:34:40.973451 IP (tos 0x0, ttl 64, id 44484, offset 0, flags [DF], proto TCP (6), length 52)
    127.0.0.1.39774 > 127.0.0.1.11650: Flags [.], cksum 0xfe28 (incorrect -> 0xeabd), seq 531, ack 4604, win 503, options [nop,nop,TS val 3527080525 ecr 3527080525], length 0
2022-04-07 22:34:40.973889 IP (tos 0x0, ttl 64, id 44485, offset 0, flags [DF], proto TCP (6), length 132)
    127.0.0.1.39774 > 127.0.0.1.11650: Flags [P.], cksum 0xfe78 (incorrect -> 0xe36a), seq 531:611, ack 4604, win 512, options [nop,nop,TS val 3527080525 ecr 3527080525], length 80
2022-04-07 22:34:40.973900 IP (tos 0x0, ttl 64, id 12685, offset 0, flags [DF], proto TCP (6), length 52)
    127.0.0.1.11650 > 127.0.0.1.39774: Flags [.], cksum 0xfe28 (incorrect -> 0xea64), seq 4604, ack 611, win 512, options [nop,nop,TS val 3527080525 ecr 3527080525], length 0
2022-04-07 22:34:40.974379 IP (tos 0x0, ttl 64, id 44486, offset 0, flags [DF], proto TCP (6), length 378)
    127.0.0.1.39774 > 127.0.0.1.11650: Flags [P.], cksum 0xff6e (incorrect -> 0x33f2), seq 611:937, ack 4604, win 512, options [nop,nop,TS val 3527080526 ecr 3527080525], length 326
2022-04-07 22:34:40.974389 IP (tos 0x0, ttl 64, id 12686, offset 0, flags [DF], proto TCP (6), length 52)
    127.0.0.1.11650 > 127.0.0.1.39774: Flags [.], cksum 0xfe28 (incorrect -> 0xe91e), seq 4604, ack 937, win 510, options [nop,nop,TS val 3527080526 ecr 3527080526], length 0
200, 4.777903079986572, 0.32171010971069336