2022-04-07 23:54:54.736807 IP (tos 0x0, ttl 64, id 56401, offset 0, flags [DF], proto TCP (6), length 60)
    127.0.0.1.35400 > 127.0.0.1.9450: Flags [S], cksum 0xfe30 (incorrect -> 0xc226), seq 2370965697, win 65495, options [mss 65495,sackOK,TS val 3531894288 ecr 0,nop,wscale 7], length 0
2022-04-07 23:54:54.736816 IP (tos 0x0, ttl 64, id 0, offset 0, flags [DF], proto TCP (6), length 60)
    127.0.0.1.9450 > 127.0.0.1.35400: Flags [S.], cksum 0xfe30 (incorrect -> 0xa76f), seq 194694786, ack 2370965698, win 65483, options [mss 65495,sackOK,TS val 3531894288 ecr 3531894288,nop,wscale 7], length 0
2022-04-07 23:54:54.736824 IP (tos 0x0, ttl 64, id 56402, offset 0, flags [DF], proto TCP (6), length 52)
    127.0.0.1.35400 > 127.0.0.1.9450: Flags [.], cksum 0xfe28 (incorrect -> 0xce2b), seq 1, ack 1, win 512, options [nop,nop,TS val 3531894288 ecr 3531894288], length 0
2022-04-07 23:54:54.736951 IP (tos 0x0, ttl 64, id 56403, offset 0, flags [DF], proto TCP (6), length 55)
    127.0.0.1.35400 > 127.0.0.1.9450: Flags [P.], cksum 0xfe2b (incorrect -> 0xc91f), seq 1:4, ack 1, win 512, options [nop,nop,TS val 3531894288 ecr 3531894288], length 3
2022-04-07 23:54:54.736956 IP (tos 0x0, ttl 64, id 36667, offset 0, flags [DF], proto TCP (6), length 52)
    127.0.0.1.9450 > 127.0.0.1.35400: Flags [.], cksum 0xfe28 (incorrect -> 0xce28), seq 1, ack 4, win 512, options [nop,nop,TS val 3531894288 ecr 3531894288], length 0
2022-04-07 23:54:54.736976 IP (tos 0x0, ttl 64, id 36668, offset 0, flags [DF], proto TCP (6), length 54)
    127.0.0.1.9450 > 127.0.0.1.35400: Flags [P.], cksum 0xfe2a (incorrect -> 0xc91e), seq 1:3, ack 4, win 512, options [nop,nop,TS val 3531894288 ecr 3531894288], length 2
2022-04-07 23:54:54.736983 IP (tos 0x0, ttl 64, id 56404, offset 0, flags [DF], proto TCP (6), length 52)
    127.0.0.1.35400 > 127.0.0.1.9450: Flags [.], cksum 0xfe28 (incorrect -> 0xce26), seq 4, ack 3, win 512, options [nop,nop,TS val 3531894288 ecr 3531894288], length 0
2022-04-07 23:54:54.756046 IP (tos 0x0, ttl 64, id 56405, offset 0, flags [DF], proto TCP (6), length 62)
    127.0.0.1.35400 > 127.0.0.1.9450: Flags [P.], cksum 0xfe32 (incorrect -> 0xb12f), seq 4:14, ack 3, win 512, options [nop,nop,TS val 3531894307 ecr 3531894288], length 10
2022-04-07 23:54:54.756055 IP (tos 0x0, ttl 64, id 36669, offset 0, flags [DF], proto TCP (6), length 52)
    127.0.0.1.9450 > 127.0.0.1.35400: Flags [.], cksum 0xfe28 (incorrect -> 0xcdf6), seq 3, ack 14, win 512, options [nop,nop,TS val 3531894307 ecr 3531894307], length 0
2022-04-07 23:54:54.883339 IP (tos 0x0, ttl 64, id 36670, offset 0, flags [DF], proto TCP (6), length 62)
    127.0.0.1.9450 > 127.0.0.1.35400: Flags [P.], cksum 0xfe32 (incorrect -> 0xc863), seq 3:13, ack 14, win 512, options [nop,nop,TS val 3531894435 ecr 3531894307], length 10
2022-04-07 23:54:54.883347 IP (tos 0x0, ttl 64, id 56406, offset 0, flags [DF], proto TCP (6), length 52)
    127.0.0.1.35400 > 127.0.0.1.9450: Flags [.], cksum 0xfe28 (incorrect -> 0xccec), seq 14, ack 13, win 512, options [nop,nop,TS val 3531894435 ecr 3531894435], length 0
2022-04-07 23:54:54.888842 IP (tos 0x0, ttl 64, id 56407, offset 0, flags [DF], proto TCP (6), length 569)
    127.0.0.1.35400 > 127.0.0.1.9450: Flags [P.], cksum 0x002e (incorrect -> 0x2f19), seq 14:531, ack 13, win 512, options [nop,nop,TS val 3531894440 ecr 3531894435], length 517
2022-04-07 23:54:54.888849 IP (tos 0x0, ttl 64, id 36671, offset 0, flags [DF], proto TCP (6), length 52)
    127.0.0.1.9450 > 127.0.0.1.35400: Flags [.], cksum 0xfe28 (incorrect -> 0xcae1), seq 13, ack 531, win 508, options [nop,nop,TS val 3531894440 ecr 3531894440], length 0
2022-04-07 23:54:55.025507 IP (tos 0x0, ttl 64, id 36672, offset 0, flags [DF], proto TCP (6), length 2864)
    127.0.0.1.9450 > 127.0.0.1.35400: Flags [P.], cksum 0x0925 (incorrect -> 0x309c), seq 13:2825, ack 531, win 512, options [nop,nop,TS val 3531894577 ecr 3531894440], length 2812
2022-04-07 23:54:55.025513 IP (tos 0x0, ttl 64, id 56408, offset 0, flags [DF], proto TCP (6), length 52)
    127.0.0.1.35400 > 127.0.0.1.9450: Flags [.], cksum 0xfe28 (incorrect -> 0xbede), seq 531, ack 2825, win 497, options [nop,nop,TS val 3531894577 ecr 3531894577], length 0
2022-04-07 23:54:55.026792 IP (tos 0x0, ttl 64, id 56409, offset 0, flags [DF], proto TCP (6), length 116)
    127.0.0.1.35400 > 127.0.0.1.9450: Flags [P.], cksum 0xfe68 (incorrect -> 0x4c0b), seq 531:595, ack 2825, win 512, options [nop,nop,TS val 3531894578 ecr 3531894577], length 64
2022-04-07 23:54:55.026799 IP (tos 0x0, ttl 64, id 36673, offset 0, flags [DF], proto TCP (6), length 52)
    127.0.0.1.9450 > 127.0.0.1.35400: Flags [.], cksum 0xfe28 (incorrect -> 0xbe8d), seq 2825, ack 595, win 512, options [nop,nop,TS val 3531894578 ecr 3531894578], length 0
2022-04-07 23:54:55.027130 IP (tos 0x0, ttl 64, id 56410, offset 0, flags [DF], proto TCP (6), length 388)
    127.0.0.1.35400 > 127.0.0.1.9450: Flags [P.], cksum 0xff78 (incorrect -> 0x9ea9), seq 595:931, ack 2825, win 512, options [nop,nop,TS val 3531894578 ecr 3531894578], length 336
2022-04-07 23:54:55.027137 IP (tos 0x0, ttl 64, id 36674, offset 0, flags [DF], proto TCP (6), length 52)
    127.0.0.1.9450 > 127.0.0.1.35400: Flags [.], cksum 0xfe28 (incorrect -> 0xbd3f), seq 2825, ack 931, win 510, options [nop,nop,TS val 3531894578 ecr 3531894578], length 0
2022-04-07 23:54:55.164865 IP (tos 0x0, ttl 64, id 36675, offset 0, flags [DF], proto TCP (6), length 307)
    127.0.0.1.9450 > 127.0.0.1.35400: Flags [P.], cksum 0xff27 (incorrect -> 0x17e9), seq 2825:3080, ack 931, win 512, options [nop,nop,TS val 3531894716 ecr 3531894578], length 255
2022-04-07 23:54:55.164875 IP (tos 0x0, ttl 64, id 56411, offset 0, flags [DF], proto TCP (6), length 52)
    127.0.0.1.35400 > 127.0.0.1.9450: Flags [.], cksum 0xfe28 (incorrect -> 0xbb2b), seq 931, ack 3080, win 511, options [nop,nop,TS val 3531894716 ecr 3531894716], length 0
2022-04-07 23:54:55.524600 IP (tos 0x0, ttl 64, id 36676, offset 0, flags [DF], proto TCP (6), length 3538)
    127.0.0.1.9450 > 127.0.0.1.35400: Flags [P.], cksum 0x0bc7 (incorrect -> 0xcb01), seq 3080:6566, ack 931, win 512, options [nop,nop,TS val 3531895076 ecr 3531894716], length 3486
2022-04-07 23:54:55.524608 IP (tos 0x0, ttl 64, id 56412, offset 0, flags [DF], proto TCP (6), length 52)
    127.0.0.1.35400 > 127.0.0.1.9450: Flags [.], cksum 0xfe28 (incorrect -> 0xaace), seq 931, ack 6566, win 494, options [nop,nop,TS val 3531895076 ecr 3531895076], length 0
2022-04-07 23:54:55.582617 IP (tos 0x0, ttl 64, id 36677, offset 0, flags [DF], proto TCP (6), length 2083)
    127.0.0.1.9450 > 127.0.0.1.35400: Flags [P.], cksum 0x0618 (incorrect -> 0x208e), seq 6566:8597, ack 931, win 512, options [nop,nop,TS val 3531895134 ecr 3531895076], length 2031
2022-04-07 23:54:55.582624 IP (tos 0x0, ttl 64, id 56413, offset 0, flags [DF], proto TCP (6), length 52)
    127.0.0.1.35400 > 127.0.0.1.9450: Flags [.], cksum 0xfe28 (incorrect -> 0xa265), seq 931, ack 8597, win 500, options [nop,nop,TS val 3531895134 ecr 3531895134], length 0
200, 3.385033369064331, 1.736560583114624