2022-04-07 21:25:17.364140 IP (tos 0x0, ttl 64, id 64052, offset 0, flags [DF], proto TCP (6), length 60)
    127.0.0.1.45884 > 127.0.0.1.9750: Flags [S], cksum 0xfe30 (incorrect -> 0x8bd2), seq 334860984, win 65495, options [mss 65495,sackOK,TS val 3522916915 ecr 0,nop,wscale 7], length 0
2022-04-07 21:25:17.364153 IP (tos 0x0, ttl 64, id 0, offset 0, flags [DF], proto TCP (6), length 60)
    127.0.0.1.9750 > 127.0.0.1.45884: Flags [S.], cksum 0xfe30 (incorrect -> 0x64c6), seq 1437699366, ack 334860985, win 65483, options [mss 65495,sackOK,TS val 3522916915 ecr 3522916915,nop,wscale 7], length 0
2022-04-07 21:25:17.364164 IP (tos 0x0, ttl 64, id 64053, offset 0, flags [DF], proto TCP (6), length 52)
    127.0.0.1.45884 > 127.0.0.1.9750: Flags [.], cksum 0xfe28 (incorrect -> 0x8b82), seq 1, ack 1, win 512, options [nop,nop,TS val 3522916915 ecr 3522916915], length 0
2022-04-07 21:25:17.364267 IP (tos 0x0, ttl 64, id 64054, offset 0, flags [DF], proto TCP (6), length 55)
    127.0.0.1.45884 > 127.0.0.1.9750: Flags [P.], cksum 0xfe2b (incorrect -> 0x8675), seq 1:4, ack 1, win 512, options [nop,nop,TS val 3522916916 ecr 3522916915], length 3
2022-04-07 21:25:17.364273 IP (tos 0x0, ttl 64, id 20796, offset 0, flags [DF], proto TCP (6), length 52)
    127.0.0.1.9750 > 127.0.0.1.45884: Flags [.], cksum 0xfe28 (incorrect -> 0x8b7d), seq 1, ack 4, win 512, options [nop,nop,TS val 3522916916 ecr 3522916916], length 0
2022-04-07 21:25:17.364340 IP (tos 0x0, ttl 64, id 20797, offset 0, flags [DF], proto TCP (6), length 54)
    127.0.0.1.9750 > 127.0.0.1.45884: Flags [P.], cksum 0xfe2a (incorrect -> 0x8673), seq 1:3, ack 4, win 512, options [nop,nop,TS val 3522916916 ecr 3522916916], length 2
2022-04-07 21:25:17.364354 IP (tos 0x0, ttl 64, id 64055, offset 0, flags [DF], proto TCP (6), length 52)
    127.0.0.1.45884 > 127.0.0.1.9750: Flags [.], cksum 0xfe28 (incorrect -> 0x8b7b), seq 4, ack 3, win 512, options [nop,nop,TS val 3522916916 ecr 3522916916], length 0
2022-04-07 21:25:17.365912 IP (tos 0x0, ttl 64, id 64056, offset 0, flags [DF], proto TCP (6), length 62)
    127.0.0.1.45884 > 127.0.0.1.9750: Flags [P.], cksum 0xfe32 (incorrect -> 0xd286), seq 4:14, ack 3, win 512, options [nop,nop,TS val 3522916917 ecr 3522916916], length 10
2022-04-07 21:25:17.365918 IP (tos 0x0, ttl 64, id 20798, offset 0, flags [DF], proto TCP (6), length 52)
    127.0.0.1.9750 > 127.0.0.1.45884: Flags [.], cksum 0xfe28 (incorrect -> 0x8b6f), seq 3, ack 14, win 512, options [nop,nop,TS val 3522916917 ecr 3522916917], length 0
2022-04-07 21:25:17.583496 IP (tos 0x0, ttl 64, id 20799, offset 0, flags [DF], proto TCP (6), length 62)
    127.0.0.1.9750 > 127.0.0.1.45884: Flags [P.], cksum 0xfe32 (incorrect -> 0x8582), seq 3:13, ack 14, win 512, options [nop,nop,TS val 3522917135 ecr 3522916917], length 10
2022-04-07 21:25:17.583507 IP (tos 0x0, ttl 64, id 64057, offset 0, flags [DF], proto TCP (6), length 52)
    127.0.0.1.45884 > 127.0.0.1.9750: Flags [.], cksum 0xfe28 (incorrect -> 0x89b1), seq 14, ack 13, win 512, options [nop,nop,TS val 3522917135 ecr 3522917135], length 0
2022-04-07 21:25:17.589165 IP (tos 0x0, ttl 64, id 64058, offset 0, flags [DF], proto TCP (6), length 569)
    127.0.0.1.45884 > 127.0.0.1.9750: Flags [P.], cksum 0x002e (incorrect -> 0x40b0), seq 14:531, ack 13, win 512, options [nop,nop,TS val 3522917140 ecr 3522917135], length 517
2022-04-07 21:25:17.589174 IP (tos 0x0, ttl 64, id 20800, offset 0, flags [DF], proto TCP (6), length 52)
    127.0.0.1.9750 > 127.0.0.1.45884: Flags [.], cksum 0xfe28 (incorrect -> 0x87a6), seq 13, ack 531, win 508, options [nop,nop,TS val 3522917140 ecr 3522917140], length 0
2022-04-07 21:25:17.822423 IP (tos 0x0, ttl 64, id 20801, offset 0, flags [DF], proto TCP (6), length 3215)
    127.0.0.1.9750 > 127.0.0.1.45884: Flags [P.], cksum 0x0a84 (incorrect -> 0xdfca), seq 13:3176, ack 531, win 512, options [nop,nop,TS val 3522917374 ecr 3522917140], length 3163
2022-04-07 21:25:17.822431 IP (tos 0x0, ttl 64, id 64059, offset 0, flags [DF], proto TCP (6), length 52)
    127.0.0.1.45884 > 127.0.0.1.9750: Flags [.], cksum 0xfe28 (incorrect -> 0x7984), seq 531, ack 3176, win 495, options [nop,nop,TS val 3522917374 ecr 3522917374], length 0
2022-04-07 21:25:17.823009 IP (tos 0x0, ttl 64, id 64060, offset 0, flags [DF], proto TCP (6), length 116)
    127.0.0.1.45884 > 127.0.0.1.9750: Flags [P.], cksum 0xfe68 (incorrect -> 0x5835), seq 531:595, ack 3176, win 512, options [nop,nop,TS val 3522917374 ecr 3522917374], length 64
2022-04-07 21:25:17.823018 IP (tos 0x0, ttl 64, id 20802, offset 0, flags [DF], proto TCP (6), length 52)
    127.0.0.1.9750 > 127.0.0.1.45884: Flags [.], cksum 0xfe28 (incorrect -> 0x7933), seq 3176, ack 595, win 512, options [nop,nop,TS val 3522917374 ecr 3522917374], length 0
2022-04-07 21:25:17.823491 IP (tos 0x0, ttl 64, id 64061, offset 0, flags [DF], proto TCP (6), length 355)
    127.0.0.1.45884 > 127.0.0.1.9750: Flags [P.], cksum 0xff57 (incorrect -> 0x28ad), seq 595:898, ack 3176, win 512, options [nop,nop,TS val 3522917375 ecr 3522917374], length 303
2022-04-07 21:25:17.823499 IP (tos 0x0, ttl 64, id 20803, offset 0, flags [DF], proto TCP (6), length 52)
    127.0.0.1.9750 > 127.0.0.1.45884: Flags [.], cksum 0xfe28 (incorrect -> 0x7804), seq 3176, ack 898, win 510, options [nop,nop,TS val 3522917375 ecr 3522917375], length 0
2022-04-07 21:25:18.096399 IP (tos 0x0, ttl 64, id 20804, offset 0, flags [DF], proto TCP (6), length 221)
    127.0.0.1.9750 > 127.0.0.1.45884: Flags [P.], cksum 0xfed1 (incorrect -> 0xd1ca), seq 3176:3345, ack 898, win 512, options [nop,nop,TS val 3522917648 ecr 3522917375], length 169
2022-04-07 21:25:18.096411 IP (tos 0x0, ttl 64, id 64062, offset 0, flags [DF], proto TCP (6), length 52)
    127.0.0.1.45884 > 127.0.0.1.9750: Flags [.], cksum 0xfe28 (incorrect -> 0x7538), seq 898, ack 3345, win 511, options [nop,nop,TS val 3522917648 ecr 3522917648], length 0
2022-04-07 21:25:18.352669 IP (tos 0x0, ttl 64, id 20805, offset 0, flags [DF], proto TCP (6), length 2252)
    127.0.0.1.9750 > 127.0.0.1.45884: Flags [P.], cksum 0x06c1 (incorrect -> 0x67f6), seq 3345:5545, ack 898, win 512, options [nop,nop,TS val 3522917904 ecr 3522917648], length 2200
2022-04-07 21:25:18.352679 IP (tos 0x0, ttl 64, id 64063, offset 0, flags [DF], proto TCP (6), length 52)
    127.0.0.1.45884 > 127.0.0.1.9750: Flags [.], cksum 0xfe28 (incorrect -> 0x6aac), seq 898, ack 5545, win 499, options [nop,nop,TS val 3522917904 ecr 3522917904], length 0
2022-04-07 21:25:18.442014 IP (tos 0x0, ttl 64, id 20806, offset 0, flags [DF], proto TCP (6), length 3097)
    127.0.0.1.9750 > 127.0.0.1.45884: Flags [P.], cksum 0x0a0e (incorrect -> 0xc041), seq 5545:8590, ack 898, win 512, options [nop,nop,TS val 3522917993 ecr 3522917904], length 3045
2022-04-07 21:25:18.442021 IP (tos 0x0, ttl 64, id 64064, offset 0, flags [DF], proto TCP (6), length 52)
    127.0.0.1.45884 > 127.0.0.1.9750: Flags [.], cksum 0xfe28 (incorrect -> 0x5e18), seq 898, ack 8590, win 496, options [nop,nop,TS val 3522917993 ecr 3522917993], length 0
2022-04-07 21:25:18.443721 IP (tos 0x0, ttl 64, id 20807, offset 0, flags [DF], proto TCP (6), length 2542)
    127.0.0.1.9750 > 127.0.0.1.45884: Flags [P.], cksum 0x07e3 (incorrect -> 0x2d87), seq 8590:11080, ack 898, win 512, options [nop,nop,TS val 3522917995 ecr 3522917993], length 2490
2022-04-07 21:25:18.443726 IP (tos 0x0, ttl 64, id 64065, offset 0, flags [DF], proto TCP (6), length 52)
    127.0.0.1.45884 > 127.0.0.1.9750: Flags [.], cksum 0xfe28 (incorrect -> 0x5458), seq 898, ack 11080, win 498, options [nop,nop,TS val 3522917995 ecr 3522917995], length 0
2022-04-07 21:25:18.455934 IP (tos 0x0, ttl 64, id 20808, offset 0, flags [DF], proto TCP (6), length 3466)
    127.0.0.1.9750 > 127.0.0.1.45884: Flags [P.], cksum 0x0b7f (incorrect -> 0x8e8d), seq 11080:14494, ack 898, win 512, options [nop,nop,TS val 3522918007 ecr 3522917995], length 3414
2022-04-07 21:25:18.455941 IP (tos 0x0, ttl 64, id 64066, offset 0, flags [DF], proto TCP (6), length 52)
    127.0.0.1.45884 > 127.0.0.1.9750: Flags [.], cksum 0xfe28 (incorrect -> 0x46ee), seq 898, ack 14494, win 494, options [nop,nop,TS val 3522918007 ecr 3522918007], length 0
2022-04-07 21:25:18.469879 IP (tos 0x0, ttl 64, id 20809, offset 0, flags [DF], proto TCP (6), length 4036)
    127.0.0.1.9750 > 127.0.0.1.45884: Flags [P.], cksum 0x0db9 (incorrect -> 0x4305), seq 14494:18478, ack 898, win 512, options [nop,nop,TS val 3522918021 ecr 3522918007], length 3984
2022-04-07 21:25:18.469886 IP (tos 0x0, ttl 64, id 64067, offset 0, flags [DF], proto TCP (6), length 52)
    127.0.0.1.45884 > 127.0.0.1.9750: Flags [.], cksum 0xfe28 (incorrect -> 0x3744), seq 898, ack 18478, win 492, options [nop,nop,TS val 3522918021 ecr 3522918021], length 0
2022-04-07 21:25:18.483714 IP (tos 0x0, ttl 64, id 20810, offset 0, flags [DF], proto TCP (6), length 2828)
    127.0.0.1.9750 > 127.0.0.1.45884: Flags [P.], cksum 0x0901 (incorrect -> 0x87fa), seq 18478:21254, ack 898, win 512, options [nop,nop,TS val 3522918035 ecr 3522918021], length 2776
2022-04-07 21:25:18.483720 IP (tos 0x0, ttl 64, id 64068, offset 0, flags [DF], proto TCP (6), length 52)
    127.0.0.1.45884 > 127.0.0.1.9750: Flags [.], cksum 0xfe28 (incorrect -> 0x2c4b), seq 898, ack 21254, win 497, options [nop,nop,TS val 3522918035 ecr 3522918035], length 0
2022-04-07 21:25:18.508528 IP (tos 0x0, ttl 64, id 20811, offset 0, flags [DF], proto TCP (6), length 3097)
    127.0.0.1.9750 > 127.0.0.1.45884: Flags [P.], cksum 0x0a0e (incorrect -> 0xd346), seq 21254:24299, ack 898, win 512, options [nop,nop,TS val 3522918060 ecr 3522918035], length 3045
2022-04-07 21:25:18.508535 IP (tos 0x0, ttl 64, id 64069, offset 0, flags [DF], proto TCP (6), length 52)
    127.0.0.1.45884 > 127.0.0.1.9750: Flags [.], cksum 0xfe28 (incorrect -> 0x2035), seq 898, ack 24299, win 496, options [nop,nop,TS val 3522918060 ecr 3522918060], length 0
2022-04-07 21:25:18.529551 IP (tos 0x0, ttl 64, id 20812, offset 0, flags [DF], proto TCP (6), length 3538)
    127.0.0.1.9750 > 127.0.0.1.45884: Flags [P.], cksum 0x0bc7 (incorrect -> 0x4b22), seq 24299:27785, ack 898, win 512, options [nop,nop,TS val 3522918081 ecr 3522918060], length 3486
2022-04-07 21:25:18.529563 IP (tos 0x0, ttl 64, id 64070, offset 0, flags [DF], proto TCP (6), length 52)
    127.0.0.1.45884 > 127.0.0.1.9750: Flags [.], cksum 0xfe28 (incorrect -> 0x126f), seq 898, ack 27785, win 494, options [nop,nop,TS val 3522918081 ecr 3522918081], length 0
2022-04-07 21:25:18.539204 IP (tos 0x0, ttl 64, id 20813, offset 0, flags [DF], proto TCP (6), length 3466)
    127.0.0.1.9750 > 127.0.0.1.45884: Flags [P.], cksum 0x0b7f (incorrect -> 0x45e0), seq 27785:31199, ack 898, win 512, options [nop,nop,TS val 3522918090 ecr 3522918081], length 3414
2022-04-07 21:25:18.539211 IP (tos 0x0, ttl 64, id 64071, offset 0, flags [DF], proto TCP (6), length 52)
    127.0.0.1.45884 > 127.0.0.1.9750: Flags [.], cksum 0xfe28 (incorrect -> 0x0507), seq 898, ack 31199, win 494, options [nop,nop,TS val 3522918090 ecr 3522918090], length 0
2022-04-07 21:25:18.539263 IP (tos 0x0, ttl 64, id 20814, offset 0, flags [DF], proto TCP (6), length 3538)
    127.0.0.1.9750 > 127.0.0.1.45884: Flags [P.], cksum 0x0bc7 (incorrect -> 0x8d07), seq 31199:34685, ack 898, win 512, options [nop,nop,TS val 3522918091 ecr 3522918090], length 3486
2022-04-07 21:25:18.539268 IP (tos 0x0, ttl 64, id 64072, offset 0, flags [DF], proto TCP (6), length 52)
    127.0.0.1.45884 > 127.0.0.1.9750: Flags [.], cksum 0xfe28 (incorrect -> 0xf766), seq 898, ack 34685, win 494, options [nop,nop,TS val 3522918091 ecr 3522918091], length 0
2022-04-07 21:25:18.541315 IP (tos 0x0, ttl 64, id 20815, offset 0, flags [DF], proto TCP (6), length 3108)
    127.0.0.1.9750 > 127.0.0.1.45884: Flags [P.], cksum 0x0a19 (incorrect -> 0x19eb), seq 34685:37741, ack 898, win 512, options [nop,nop,TS val 3522918093 ecr 3522918091], length 3056
2022-04-07 21:25:18.541328 IP (tos 0x0, ttl 64, id 64073, offset 0, flags [DF], proto TCP (6), length 52)
    127.0.0.1.45884 > 127.0.0.1.9750: Flags [.], cksum 0xfe28 (incorrect -> 0xeb60), seq 898, ack 37741, win 512, options [nop,nop,TS val 3522918093 ecr 3522918093], length 0
2022-04-07 21:25:18.543386 IP (tos 0x0, ttl 64, id 20816, offset 0, flags [DF], proto TCP (6), length 4100)
    127.0.0.1.9750 > 127.0.0.1.45884: Flags [P.], cksum 0x0df9 (incorrect -> 0x535d), seq 37741:41789, ack 898, win 512, options [nop,nop,TS val 3522918095 ecr 3522918093], length 4048
200, 4.233846426010132, 1.2315514087677002