2022-04-07 06:54:08.442885 IP (tos 0x0, ttl 64, id 5815, offset 0, flags [DF], proto TCP (6), length 60)
    127.0.0.1.50182 > 127.0.0.1.9750: Flags [S], cksum 0xfe30 (incorrect -> 0x8852), seq 1322636502, win 65495, options [mss 65495,sackOK,TS val 396730945 ecr 0,nop,wscale 7], length 0
2022-04-07 06:54:08.442899 IP (tos 0x0, ttl 64, id 0, offset 0, flags [DF], proto TCP (6), length 60)
    127.0.0.1.9750 > 127.0.0.1.50182: Flags [S.], cksum 0xfe30 (incorrect -> 0x1442), seq 2583437352, ack 1322636503, win 65483, options [mss 65495,sackOK,TS val 396730945 ecr 396730945,nop,wscale 7], length 0
2022-04-07 06:54:08.442909 IP (tos 0x0, ttl 64, id 5816, offset 0, flags [DF], proto TCP (6), length 52)
    127.0.0.1.50182 > 127.0.0.1.9750: Flags [.], cksum 0xfe28 (incorrect -> 0x3afe), seq 1, ack 1, win 512, options [nop,nop,TS val 396730945 ecr 396730945], length 0
2022-04-07 06:54:08.443022 IP (tos 0x0, ttl 64, id 5817, offset 0, flags [DF], proto TCP (6), length 55)
    127.0.0.1.50182 > 127.0.0.1.9750: Flags [P.], cksum 0xfe2b (incorrect -> 0x35f2), seq 1:4, ack 1, win 512, options [nop,nop,TS val 396730945 ecr 396730945], length 3
2022-04-07 06:54:08.443037 IP (tos 0x0, ttl 64, id 64120, offset 0, flags [DF], proto TCP (6), length 52)
    127.0.0.1.9750 > 127.0.0.1.50182: Flags [.], cksum 0xfe28 (incorrect -> 0x3afb), seq 1, ack 4, win 512, options [nop,nop,TS val 396730945 ecr 396730945], length 0
2022-04-07 06:54:08.443072 IP (tos 0x0, ttl 64, id 64121, offset 0, flags [DF], proto TCP (6), length 54)
    127.0.0.1.9750 > 127.0.0.1.50182: Flags [P.], cksum 0xfe2a (incorrect -> 0x35f0), seq 1:3, ack 4, win 512, options [nop,nop,TS val 396730946 ecr 396730945], length 2
2022-04-07 06:54:08.443084 IP (tos 0x0, ttl 64, id 5818, offset 0, flags [DF], proto TCP (6), length 52)
    127.0.0.1.50182 > 127.0.0.1.9750: Flags [.], cksum 0xfe28 (incorrect -> 0x3af7), seq 4, ack 3, win 512, options [nop,nop,TS val 396730946 ecr 396730946], length 0
2022-04-07 06:54:08.444818 IP (tos 0x0, ttl 64, id 5819, offset 0, flags [DF], proto TCP (6), length 62)
    127.0.0.1.50182 > 127.0.0.1.9750: Flags [P.], cksum 0xfe32 (incorrect -> 0x29a0), seq 4:14, ack 3, win 512, options [nop,nop,TS val 396730947 ecr 396730946], length 10
2022-04-07 06:54:08.444835 IP (tos 0x0, ttl 64, id 64122, offset 0, flags [DF], proto TCP (6), length 52)
    127.0.0.1.9750 > 127.0.0.1.50182: Flags [.], cksum 0xfe28 (incorrect -> 0x3aeb), seq 3, ack 14, win 512, options [nop,nop,TS val 396730947 ecr 396730947], length 0
2022-04-07 06:54:08.540204 IP (tos 0x0, ttl 64, id 64123, offset 0, flags [DF], proto TCP (6), length 62)
    127.0.0.1.9750 > 127.0.0.1.50182: Flags [P.], cksum 0xfe32 (incorrect -> 0x3578), seq 3:13, ack 14, win 512, options [nop,nop,TS val 396731043 ecr 396730947], length 10
2022-04-07 06:54:08.540213 IP (tos 0x0, ttl 64, id 5820, offset 0, flags [DF], proto TCP (6), length 52)
    127.0.0.1.50182 > 127.0.0.1.9750: Flags [.], cksum 0xfe28 (incorrect -> 0x3a21), seq 14, ack 13, win 512, options [nop,nop,TS val 396731043 ecr 396731043], length 0
2022-04-07 06:54:08.546448 IP (tos 0x0, ttl 64, id 5821, offset 0, flags [DF], proto TCP (6), length 569)
    127.0.0.1.50182 > 127.0.0.1.9750: Flags [P.], cksum 0x002e (incorrect -> 0x36b4), seq 14:531, ack 13, win 512, options [nop,nop,TS val 396731049 ecr 396731043], length 517
2022-04-07 06:54:08.546457 IP (tos 0x0, ttl 64, id 64124, offset 0, flags [DF], proto TCP (6), length 52)
    127.0.0.1.9750 > 127.0.0.1.50182: Flags [.], cksum 0xfe28 (incorrect -> 0x3814), seq 13, ack 531, win 508, options [nop,nop,TS val 396731049 ecr 396731049], length 0
200, 6.790335416793823, 0.4946870803833008