2022-04-07 06:33:30.075318 IP (tos 0x0, ttl 64, id 40182, offset 0, flags [DF], proto TCP (6), length 60)
    127.0.0.1.50146 > 127.0.0.1.9750: Flags [S], cksum 0xfe30 (incorrect -> 0x4bd3), seq 2305932367, win 65495, options [mss 65495,sackOK,TS val 395492578 ecr 0,nop,wscale 7], length 0
2022-04-07 06:33:30.075328 IP (tos 0x0, ttl 64, id 0, offset 0, flags [DF], proto TCP (6), length 60)
    127.0.0.1.9750 > 127.0.0.1.50146: Flags [S.], cksum 0xfe30 (incorrect -> 0xa560), seq 1485273457, ack 2305932368, win 65483, options [mss 65495,sackOK,TS val 395492578 ecr 395492578,nop,wscale 7], length 0
2022-04-07 06:33:30.075335 IP (tos 0x0, ttl 64, id 40183, offset 0, flags [DF], proto TCP (6), length 52)
    127.0.0.1.50146 > 127.0.0.1.9750: Flags [.], cksum 0xfe28 (incorrect -> 0xcc1c), seq 1, ack 1, win 512, options [nop,nop,TS val 395492578 ecr 395492578], length 0
2022-04-07 06:33:30.075427 IP (tos 0x0, ttl 64, id 40184, offset 0, flags [DF], proto TCP (6), length 55)
    127.0.0.1.50146 > 127.0.0.1.9750: Flags [P.], cksum 0xfe2b (incorrect -> 0xc710), seq 1:4, ack 1, win 512, options [nop,nop,TS val 395492578 ecr 395492578], length 3
2022-04-07 06:33:30.075431 IP (tos 0x0, ttl 64, id 4487, offset 0, flags [DF], proto TCP (6), length 52)
    127.0.0.1.9750 > 127.0.0.1.50146: Flags [.], cksum 0xfe28 (incorrect -> 0xcc19), seq 1, ack 4, win 512, options [nop,nop,TS val 395492578 ecr 395492578], length 0
2022-04-07 06:33:30.075529 IP (tos 0x0, ttl 64, id 4488, offset 0, flags [DF], proto TCP (6), length 54)
    127.0.0.1.9750 > 127.0.0.1.50146: Flags [P.], cksum 0xfe2a (incorrect -> 0xc70f), seq 1:3, ack 4, win 512, options [nop,nop,TS val 395492578 ecr 395492578], length 2
2022-04-07 06:33:30.075548 IP (tos 0x0, ttl 64, id 40185, offset 0, flags [DF], proto TCP (6), length 52)
    127.0.0.1.50146 > 127.0.0.1.9750: Flags [.], cksum 0xfe28 (incorrect -> 0xcc17), seq 4, ack 3, win 512, options [nop,nop,TS val 395492578 ecr 395492578], length 0
2022-04-07 06:33:30.077158 IP (tos 0x0, ttl 64, id 40186, offset 0, flags [DF], proto TCP (6), length 62)
    127.0.0.1.50146 > 127.0.0.1.9750: Flags [P.], cksum 0xfe32 (incorrect -> 0x6749), seq 4:14, ack 3, win 512, options [nop,nop,TS val 395492580 ecr 395492578], length 10
2022-04-07 06:33:30.077180 IP (tos 0x0, ttl 64, id 4489, offset 0, flags [DF], proto TCP (6), length 52)
    127.0.0.1.9750 > 127.0.0.1.50146: Flags [.], cksum 0xfe28 (incorrect -> 0xcc09), seq 3, ack 14, win 512, options [nop,nop,TS val 395492580 ecr 395492580], length 0
2022-04-07 06:33:30.169104 IP (tos 0x0, ttl 64, id 4490, offset 0, flags [DF], proto TCP (6), length 62)
    127.0.0.1.9750 > 127.0.0.1.50146: Flags [P.], cksum 0xfe32 (incorrect -> 0xc69a), seq 3:13, ack 14, win 512, options [nop,nop,TS val 395492672 ecr 395492580], length 10
2022-04-07 06:33:30.169111 IP (tos 0x0, ttl 64, id 40187, offset 0, flags [DF], proto TCP (6), length 52)
    127.0.0.1.50146 > 127.0.0.1.9750: Flags [.], cksum 0xfe28 (incorrect -> 0xcb47), seq 14, ack 13, win 512, options [nop,nop,TS val 395492672 ecr 395492672], length 0
2022-04-07 06:33:30.174522 IP (tos 0x0, ttl 64, id 40188, offset 0, flags [DF], proto TCP (6), length 569)
    127.0.0.1.50146 > 127.0.0.1.9750: Flags [P.], cksum 0x002e (incorrect -> 0x8476), seq 14:531, ack 13, win 512, options [nop,nop,TS val 395492677 ecr 395492672], length 517
2022-04-07 06:33:30.174540 IP (tos 0x0, ttl 64, id 4491, offset 0, flags [DF], proto TCP (6), length 52)
    127.0.0.1.9750 > 127.0.0.1.50146: Flags [.], cksum 0xfe28 (incorrect -> 0xc93c), seq 13, ack 531, win 508, options [nop,nop,TS val 395492677 ecr 395492677], length 0
2022-04-07 06:33:30.257657 IP (tos 0x0, ttl 64, id 4492, offset 0, flags [DF], proto TCP (6), length 3538)
    127.0.0.1.9750 > 127.0.0.1.50146: Flags [P.], cksum 0x0bc7 (incorrect -> 0x6c90), seq 13:3499, ack 531, win 512, options [nop,nop,TS val 395492760 ecr 395492677], length 3486
2022-04-07 06:33:30.257663 IP (tos 0x0, ttl 64, id 40189, offset 0, flags [DF], proto TCP (6), length 52)
    127.0.0.1.50146 > 127.0.0.1.9750: Flags [.], cksum 0xfe28 (incorrect -> 0xbb06), seq 531, ack 3499, win 494, options [nop,nop,TS val 395492760 ecr 395492760], length 0
2022-04-07 06:33:30.284465 IP (tos 0x0, ttl 64, id 4493, offset 0, flags [DF], proto TCP (6), length 850)
    127.0.0.1.9750 > 127.0.0.1.50146: Flags [P.], cksum 0x0147 (incorrect -> 0x4bca), seq 3499:4297, ack 531, win 512, options [nop,nop,TS val 395492787 ecr 395492760], length 798
2022-04-07 06:33:30.284471 IP (tos 0x0, ttl 64, id 40190, offset 0, flags [DF], proto TCP (6), length 52)
    127.0.0.1.50146 > 127.0.0.1.9750: Flags [.], cksum 0xfe28 (incorrect -> 0xb7a8), seq 531, ack 4297, win 504, options [nop,nop,TS val 395492787 ecr 395492787], length 0
2022-04-07 06:33:30.315712 IP (tos 0x0, ttl 64, id 4494, offset 0, flags [DF], proto TCP (6), length 1336)
    127.0.0.1.9750 > 127.0.0.1.50146: Flags [P.], cksum 0x032d (incorrect -> 0xe73b), seq 4297:5581, ack 531, win 512, options [nop,nop,TS val 395492818 ecr 395492787], length 1284
2022-04-07 06:33:30.315718 IP (tos 0x0, ttl 64, id 40191, offset 0, flags [DF], proto TCP (6), length 52)
    127.0.0.1.50146 > 127.0.0.1.9750: Flags [.], cksum 0xfe28 (incorrect -> 0xb268), seq 531, ack 5581, win 502, options [nop,nop,TS val 395492818 ecr 395492818], length 0
2022-04-07 06:33:30.316046 IP (tos 0x0, ttl 64, id 40192, offset 0, flags [DF], proto TCP (6), length 116)
    127.0.0.1.50146 > 127.0.0.1.9750: Flags [P.], cksum 0xfe68 (incorrect -> 0x787d), seq 531:595, ack 5581, win 512, options [nop,nop,TS val 395492818 ecr 395492818], length 64
2022-04-07 06:33:30.316052 IP (tos 0x0, ttl 64, id 4495, offset 0, flags [DF], proto TCP (6), length 52)
    127.0.0.1.9750 > 127.0.0.1.50146: Flags [.], cksum 0xfe28 (incorrect -> 0xb21e), seq 5581, ack 595, win 512, options [nop,nop,TS val 395492818 ecr 395492818], length 0
2022-04-07 06:33:30.316328 IP (tos 0x0, ttl 64, id 40193, offset 0, flags [DF], proto TCP (6), length 323)
    127.0.0.1.50146 > 127.0.0.1.9750: Flags [P.], cksum 0xff37 (incorrect -> 0xf1a5), seq 595:866, ack 5581, win 512, options [nop,nop,TS val 395492819 ecr 395492818], length 271
2022-04-07 06:33:30.316332 IP (tos 0x0, ttl 64, id 4496, offset 0, flags [DF], proto TCP (6), length 52)
    127.0.0.1.9750 > 127.0.0.1.50146: Flags [.], cksum 0xfe28 (incorrect -> 0xb10f), seq 5581, ack 866, win 510, options [nop,nop,TS val 395492819 ecr 395492819], length 0
2022-04-07 06:33:30.402055 IP (tos 0x0, ttl 64, id 4497, offset 0, flags [DF], proto TCP (6), length 4100)
    127.0.0.1.9750 > 127.0.0.1.50146: Flags [P.], cksum 0x0df9 (incorrect -> 0x861f), seq 5581:9629, ack 866, win 512, options [nop,nop,TS val 395492904 ecr 395492819], length 4048
2022-04-07 06:33:30.402061 IP (tos 0x0, ttl 64, id 40194, offset 0, flags [DF], proto TCP (6), length 52)
    127.0.0.1.50146 > 127.0.0.1.9750: Flags [.], cksum 0xfe28 (incorrect -> 0xa0a6), seq 866, ack 9629, win 492, options [nop,nop,TS val 395492905 ecr 395492904], length 0
2022-04-07 06:33:30.402068 IP (tos 0x0, ttl 64, id 4498, offset 0, flags [DF], proto TCP (6), length 3474)
    127.0.0.1.9750 > 127.0.0.1.50146: Flags [P.], cksum 0x0b87 (incorrect -> 0xe443), seq 9629:13051, ack 866, win 512, options [nop,nop,TS val 395492905 ecr 395492905], length 3422
2022-04-07 06:33:30.402070 IP (tos 0x0, ttl 64, id 40195, offset 0, flags [DF], proto TCP (6), length 52)
    127.0.0.1.50146 > 127.0.0.1.9750: Flags [.], cksum 0xfe28 (incorrect -> 0x9355), seq 866, ack 13051, win 478, options [nop,nop,TS val 395492905 ecr 395492905], length 0
2022-04-07 06:33:30.414619 IP (tos 0x0, ttl 64, id 4499, offset 0, flags [DF], proto TCP (6), length 4036)
    127.0.0.1.9750 > 127.0.0.1.50146: Flags [P.], cksum 0x0db9 (incorrect -> 0xe5c3), seq 13051:17035, ack 866, win 512, options [nop,nop,TS val 395492917 ecr 395492905], length 3984
2022-04-07 06:33:30.414624 IP (tos 0x0, ttl 64, id 40196, offset 0, flags [DF], proto TCP (6), length 52)
    127.0.0.1.50146 > 127.0.0.1.9750: Flags [.], cksum 0xfe28 (incorrect -> 0x839f), seq 866, ack 17035, win 492, options [nop,nop,TS val 395492917 ecr 395492917], length 0
2022-04-07 06:33:30.428900 IP (tos 0x0, ttl 64, id 4500, offset 0, flags [DF], proto TCP (6), length 1450)
    127.0.0.1.9750 > 127.0.0.1.50146: Flags [P.], cksum 0x039f (incorrect -> 0x535b), seq 17035:18433, ack 866, win 512, options [nop,nop,TS val 395492931 ecr 395492917], length 1398
2022-04-07 06:33:30.428906 IP (tos 0x0, ttl 64, id 40197, offset 0, flags [DF], proto TCP (6), length 52)
    127.0.0.1.50146 > 127.0.0.1.9750: Flags [.], cksum 0xfe28 (incorrect -> 0x7e03), seq 866, ack 18433, win 502, options [nop,nop,TS val 395492931 ecr 395492931], length 0
2022-04-07 06:33:30.433695 IP (tos 0x0, ttl 64, id 4501, offset 0, flags [DF], proto TCP (6), length 3538)
    127.0.0.1.9750 > 127.0.0.1.50146: Flags [P.], cksum 0x0bc7 (incorrect -> 0x67d1), seq 18433:21919, ack 866, win 512, options [nop,nop,TS val 395492936 ecr 395492931], length 3486
2022-04-07 06:33:30.433699 IP (tos 0x0, ttl 64, id 40198, offset 0, flags [DF], proto TCP (6), length 52)
    127.0.0.1.50146 > 127.0.0.1.9750: Flags [.], cksum 0xfe28 (incorrect -> 0x7063), seq 866, ack 21919, win 494, options [nop,nop,TS val 395492936 ecr 395492936], length 0
2022-04-07 06:33:30.433808 IP (tos 0x0, ttl 64, id 4502, offset 0, flags [DF], proto TCP (6), length 4100)
    127.0.0.1.9750 > 127.0.0.1.50146: Flags [P.], cksum 0x0df9 (incorrect -> 0xf303), seq 21919:25967, ack 866, win 512, options [nop,nop,TS val 395492936 ecr 395492936], length 4048
2022-04-07 06:33:30.433813 IP (tos 0x0, ttl 64, id 40199, offset 0, flags [DF], proto TCP (6), length 52)
    127.0.0.1.50146 > 127.0.0.1.9750: Flags [.], cksum 0xfe28 (incorrect -> 0x6095), seq 866, ack 25967, win 492, options [nop,nop,TS val 395492936 ecr 395492936], length 0
2022-04-07 06:33:30.433818 IP (tos 0x0, ttl 64, id 4503, offset 0, flags [DF], proto TCP (6), length 3972)
    127.0.0.1.9750 > 127.0.0.1.50146: Flags [P.], cksum 0x0d79 (incorrect -> 0xe60e), seq 25967:29887, ack 866, win 512, options [nop,nop,TS val 395492936 ecr 395492936], length 3920
2022-04-07 06:33:30.433821 IP (tos 0x0, ttl 64, id 40200, offset 0, flags [DF], proto TCP (6), length 52)
    127.0.0.1.50146 > 127.0.0.1.9750: Flags [.], cksum 0xfe28 (incorrect -> 0x5155), seq 866, ack 29887, win 476, options [nop,nop,TS val 395492936 ecr 395492936], length 0
2022-04-07 06:33:30.461457 IP (tos 0x0, ttl 64, id 4504, offset 0, flags [DF], proto TCP (6), length 4100)
    127.0.0.1.9750 > 127.0.0.1.50146: Flags [P.], cksum 0x0df9 (incorrect -> 0x34f0), seq 29887:33935, ack 866, win 512, options [nop,nop,TS val 395492964 ecr 395492936], length 4048
2022-04-07 06:33:30.502666 IP (tos 0x0, ttl 64, id 40201, offset 0, flags [DF], proto TCP (6), length 52)
    127.0.0.1.50146 > 127.0.0.1.9750: Flags [.], cksum 0xfe28 (incorrect -> 0x4100), seq 866, ack 33935, win 512, options [nop,nop,TS val 395493005 ecr 395492964], length 0
2022-04-07 06:33:30.502679 IP (tos 0x0, ttl 64, id 4505, offset 0, flags [DF], proto TCP (6), length 31474)
    127.0.0.1.9750 > 127.0.0.1.50146: Flags [P.], cksum 0x78e7 (incorrect -> 0xdbb1), seq 33935:65357, ack 866, win 512, options [nop,nop,TS val 395493005 ecr 395493005], length 31422
2022-04-07 06:33:30.546655 IP (tos 0x0, ttl 64, id 40202, offset 0, flags [DF], proto TCP (6), length 52)
    127.0.0.1.50146 > 127.0.0.1.9750: Flags [.], cksum 0xfe28 (incorrect -> 0xc5ec), seq 866, ack 65357, win 512, options [nop,nop,TS val 395493049 ecr 395493005], length 0
2022-04-07 06:33:30.546666 IP (tos 0x0, ttl 64, id 4506, offset 0, flags [DF], proto TCP (6), length 30904)
    127.0.0.1.9750 > 127.0.0.1.50146: Flags [P.], cksum 0x76ad (incorrect -> 0xc16f), seq 65357:96209, ack 866, win 512, options [nop,nop,TS val 395493049 ecr 395493049], length 30852
2022-04-07 06:33:30.547526 IP (tos 0x0, ttl 64, id 40203, offset 0, flags [DF], proto TCP (6), length 52)
    127.0.0.1.50146 > 127.0.0.1.9750: Flags [.], cksum 0xfe28 (incorrect -> 0x4d3b), seq 866, ack 96209, win 512, options [nop,nop,TS val 395493050 ecr 395493049], length 0
2022-04-07 06:33:30.547533 IP (tos 0x0, ttl 64, id 4507, offset 0, flags [DF], proto TCP (6), length 3538)
    127.0.0.1.9750 > 127.0.0.1.50146: Flags [P.], cksum 0x0bc7 (incorrect -> 0x2b56), seq 96209:99695, ack 866, win 512, options [nop,nop,TS val 395493050 ecr 395493050], length 3486
2022-04-07 06:33:30.547537 IP (tos 0x0, ttl 64, id 40204, offset 0, flags [DF], proto TCP (6), length 52)
    127.0.0.1.50146 > 127.0.0.1.9750: Flags [.], cksum 0xfe28 (incorrect -> 0x3f9c), seq 866, ack 99695, win 512, options [nop,nop,TS val 395493050 ecr 395493050], length 0
2022-04-07 06:33:30.570143 IP (tos 0x0, ttl 64, id 4508, offset 0, flags [DF], proto TCP (6), length 4100)
    127.0.0.1.9750 > 127.0.0.1.50146: Flags [P.], cksum 0x0df9 (incorrect -> 0x6bc0), seq 99695:103743, ack 866, win 512, options [nop,nop,TS val 395493073 ecr 395493050], length 4048
2022-04-07 06:33:30.570177 IP (tos 0x0, ttl 64, id 40205, offset 0, flags [DF], proto TCP (6), length 52)
    127.0.0.1.50146 > 127.0.0.1.9750: Flags [.], cksum 0xfe28 (incorrect -> 0x2f9e), seq 866, ack 103743, win 512, options [nop,nop,TS val 395493073 ecr 395493073], length 0
2022-04-07 06:33:30.570182 IP (tos 0x0, ttl 64, id 4509, offset 0, flags [DF], proto TCP (6), length 6102)
    127.0.0.1.9750 > 127.0.0.1.50146: Flags [P.], cksum 0x15cb (incorrect -> 0x3d32), seq 103743:109793, ack 866, win 512, options [nop,nop,TS val 395493073 ecr 395493073], length 6050
2022-04-07 06:33:30.570661 IP (tos 0x0, ttl 64, id 40206, offset 0, flags [DF], proto TCP (6), length 52)
    127.0.0.1.50146 > 127.0.0.1.9750: Flags [.], cksum 0xfe28 (incorrect -> 0x17fc), seq 866, ack 109793, win 512, options [nop,nop,TS val 395493073 ecr 395493073], length 0
2022-04-07 06:33:30.571988 IP (tos 0x0, ttl 64, id 4510, offset 0, flags [DF], proto TCP (6), length 3538)
    127.0.0.1.9750 > 127.0.0.1.50146: Flags [P.], cksum 0x0bc7 (incorrect -> 0x24c8), seq 109793:113279, ack 866, win 512, options [nop,nop,TS val 395493074 ecr 395493073], length 3486
2022-04-07 06:33:30.572001 IP (tos 0x0, ttl 64, id 40207, offset 0, flags [DF], proto TCP (6), length 52)
    127.0.0.1.50146 > 127.0.0.1.9750: Flags [.], cksum 0xfe28 (incorrect -> 0x0a5c), seq 866, ack 113279, win 512, options [nop,nop,TS val 395493074 ecr 395493074], length 0
2022-04-07 06:33:30.573499 IP (tos 0x0, ttl 64, id 4511, offset 0, flags [DF], proto TCP (6), length 3040)
    127.0.0.1.9750 > 127.0.0.1.50146: Flags [P.], cksum 0x09d5 (incorrect -> 0xd56b), seq 113279:116267, ack 866, win 512, options [nop,nop,TS val 395493076 ecr 395493074], length 2988
2022-04-07 06:33:30.573511 IP (tos 0x0, ttl 64, id 40208, offset 0, flags [DF], proto TCP (6), length 52)
    127.0.0.1.50146 > 127.0.0.1.9750: Flags [.], cksum 0xfe28 (incorrect -> 0xfeab), seq 866, ack 116267, win 512, options [nop,nop,TS val 395493076 ecr 395493076], length 0
2022-04-07 06:33:30.597773 IP (tos 0x0, ttl 64, id 4512, offset 0, flags [DF], proto TCP (6), length 4100)
    127.0.0.1.9750 > 127.0.0.1.50146: Flags [P.], cksum 0x0df9 (incorrect -> 0xe0ee), seq 116267:120315, ack 866, win 512, options [nop,nop,TS val 395493100 ecr 395493076], length 4048
2022-04-07 06:33:30.597845 IP (tos 0x0, ttl 64, id 40209, offset 0, flags [DF], proto TCP (6), length 52)
    127.0.0.1.50146 > 127.0.0.1.9750: Flags [.], cksum 0xfe28 (incorrect -> 0xeeab), seq 866, ack 120315, win 512, options [nop,nop,TS val 395493100 ecr 395493100], length 0
200, 5.4818949699401855, 0.5321884155273438