2022-04-07 23:17:54.916844 IP (tos 0x0, ttl 64, id 35836, offset 0, flags [DF], proto TCP (6), length 60)
    127.0.0.1.48496 > 127.0.0.1.10050: Flags [S], cksum 0xfe30 (incorrect -> 0x86a6), seq 522937398, win 65495, options [mss 65495,sackOK,TS val 3529674468 ecr 0,nop,wscale 7], length 0
2022-04-07 23:17:54.916860 IP (tos 0x0, ttl 64, id 0, offset 0, flags [DF], proto TCP (6), length 60)
    127.0.0.1.10050 > 127.0.0.1.48496: Flags [S.], cksum 0xfe30 (incorrect -> 0x3391), seq 1333568076, ack 522937399, win 65483, options [mss 65495,sackOK,TS val 3529674468 ecr 3529674468,nop,wscale 7], length 0
2022-04-07 23:17:54.916873 IP (tos 0x0, ttl 64, id 35837, offset 0, flags [DF], proto TCP (6), length 52)
    127.0.0.1.48496 > 127.0.0.1.10050: Flags [.], cksum 0xfe28 (incorrect -> 0x5a4d), seq 1, ack 1, win 512, options [nop,nop,TS val 3529674468 ecr 3529674468], length 0
2022-04-07 23:17:54.917015 IP (tos 0x0, ttl 64, id 35838, offset 0, flags [DF], proto TCP (6), length 55)
    127.0.0.1.48496 > 127.0.0.1.10050: Flags [P.], cksum 0xfe2b (incorrect -> 0x5541), seq 1:4, ack 1, win 512, options [nop,nop,TS val 3529674468 ecr 3529674468], length 3
2022-04-07 23:17:54.917024 IP (tos 0x0, ttl 64, id 20587, offset 0, flags [DF], proto TCP (6), length 52)
    127.0.0.1.10050 > 127.0.0.1.48496: Flags [.], cksum 0xfe28 (incorrect -> 0x5a4a), seq 1, ack 4, win 512, options [nop,nop,TS val 3529674468 ecr 3529674468], length 0
2022-04-07 23:17:54.917049 IP (tos 0x0, ttl 64, id 20588, offset 0, flags [DF], proto TCP (6), length 54)
    127.0.0.1.10050 > 127.0.0.1.48496: Flags [P.], cksum 0xfe2a (incorrect -> 0x5540), seq 1:3, ack 4, win 512, options [nop,nop,TS val 3529674468 ecr 3529674468], length 2
2022-04-07 23:17:54.917058 IP (tos 0x0, ttl 64, id 35839, offset 0, flags [DF], proto TCP (6), length 52)
    127.0.0.1.48496 > 127.0.0.1.10050: Flags [.], cksum 0xfe28 (incorrect -> 0x5a48), seq 4, ack 3, win 512, options [nop,nop,TS val 3529674468 ecr 3529674468], length 0
2022-04-07 23:17:54.918365 IP (tos 0x0, ttl 64, id 35840, offset 0, flags [DF], proto TCP (6), length 62)
    127.0.0.1.48496 > 127.0.0.1.10050: Flags [P.], cksum 0xfe32 (incorrect -> 0xa0d8), seq 4:14, ack 3, win 512, options [nop,nop,TS val 3529674470 ecr 3529674468], length 10
2022-04-07 23:17:54.918382 IP (tos 0x0, ttl 64, id 20589, offset 0, flags [DF], proto TCP (6), length 52)
    127.0.0.1.10050 > 127.0.0.1.48496: Flags [.], cksum 0xfe28 (incorrect -> 0x5a3a), seq 3, ack 14, win 512, options [nop,nop,TS val 3529674470 ecr 3529674470], length 0
2022-04-07 23:17:56.137151 IP (tos 0x0, ttl 64, id 20590, offset 0, flags [DF], proto TCP (6), length 62)
    127.0.0.1.10050 > 127.0.0.1.48496: Flags [P.], cksum 0xfe32 (incorrect -> 0x5065), seq 3:13, ack 14, win 512, options [nop,nop,TS val 3529675688 ecr 3529674470], length 10
2022-04-07 23:17:56.137163 IP (tos 0x0, ttl 64, id 35841, offset 0, flags [DF], proto TCP (6), length 52)
    127.0.0.1.48496 > 127.0.0.1.10050: Flags [.], cksum 0xfe28 (incorrect -> 0x50ac), seq 14, ack 13, win 512, options [nop,nop,TS val 3529675688 ecr 3529675688], length 0
2022-04-07 23:17:56.143228 IP (tos 0x0, ttl 64, id 35842, offset 0, flags [DF], proto TCP (6), length 569)
    127.0.0.1.48496 > 127.0.0.1.10050: Flags [P.], cksum 0x002e (incorrect -> 0x61e4), seq 14:531, ack 13, win 512, options [nop,nop,TS val 3529675694 ecr 3529675688], length 517
2022-04-07 23:17:56.143238 IP (tos 0x0, ttl 64, id 20591, offset 0, flags [DF], proto TCP (6), length 52)
    127.0.0.1.10050 > 127.0.0.1.48496: Flags [.], cksum 0xfe28 (incorrect -> 0x4e9e), seq 13, ack 531, win 508, options [nop,nop,TS val 3529675695 ecr 3529675694], length 0
2022-04-07 23:17:56.616114 IP (tos 0x0, ttl 64, id 20592, offset 0, flags [DF], proto TCP (6), length 3538)
    127.0.0.1.10050 > 127.0.0.1.48496: Flags [P.], cksum 0x0bc7 (incorrect -> 0x3b8d), seq 13:3499, ack 531, win 512, options [nop,nop,TS val 3529676167 ecr 3529675694], length 3486
2022-04-07 23:17:56.616137 IP (tos 0x0, ttl 64, id 35843, offset 0, flags [DF], proto TCP (6), length 52)
    127.0.0.1.48496 > 127.0.0.1.10050: Flags [.], cksum 0xfe28 (incorrect -> 0x3d5d), seq 531, ack 3499, win 494, options [nop,nop,TS val 3529676167 ecr 3529676167], length 0
2022-04-07 23:17:56.860691 IP (tos 0x0, ttl 64, id 20593, offset 0, flags [DF], proto TCP (6), length 56)
    127.0.0.1.10050 > 127.0.0.1.48496: Flags [P.], cksum 0xfe2c (incorrect -> 0xd9d9), seq 3499:3503, ack 531, win 512, options [nop,nop,TS val 3529676412 ecr 3529676167], length 4
2022-04-07 23:17:56.860701 IP (tos 0x0, ttl 64, id 35844, offset 0, flags [DF], proto TCP (6), length 52)
    127.0.0.1.48496 > 127.0.0.1.10050: Flags [.], cksum 0xfe28 (incorrect -> 0x3b62), seq 531, ack 3503, win 507, options [nop,nop,TS val 3529676412 ecr 3529676412], length 0
2022-04-07 23:17:56.861063 IP (tos 0x0, ttl 64, id 35845, offset 0, flags [DF], proto TCP (6), length 116)
    127.0.0.1.48496 > 127.0.0.1.10050: Flags [P.], cksum 0xfe68 (incorrect -> 0x188e), seq 531:595, ack 3503, win 512, options [nop,nop,TS val 3529676412 ecr 3529676412], length 64
2022-04-07 23:17:56.861071 IP (tos 0x0, ttl 64, id 20594, offset 0, flags [DF], proto TCP (6), length 52)
    127.0.0.1.10050 > 127.0.0.1.48496: Flags [.], cksum 0xfe28 (incorrect -> 0x3b1d), seq 3503, ack 595, win 512, options [nop,nop,TS val 3529676412 ecr 3529676412], length 0
2022-04-07 23:17:56.861447 IP (tos 0x0, ttl 64, id 35846, offset 0, flags [DF], proto TCP (6), length 387)
    127.0.0.1.48496 > 127.0.0.1.10050: Flags [P.], cksum 0xff77 (incorrect -> 0xd750), seq 595:930, ack 3503, win 512, options [nop,nop,TS val 3529676413 ecr 3529676412], length 335
2022-04-07 23:17:56.861456 IP (tos 0x0, ttl 64, id 20595, offset 0, flags [DF], proto TCP (6), length 52)
    127.0.0.1.10050 > 127.0.0.1.48496: Flags [.], cksum 0xfe28 (incorrect -> 0x39ce), seq 3503, ack 930, win 510, options [nop,nop,TS val 3529676413 ecr 3529676413], length 0
2022-04-07 23:17:57.269139 IP (tos 0x0, ttl 64, id 20596, offset 0, flags [DF], proto TCP (6), length 226)
    127.0.0.1.10050 > 127.0.0.1.48496: Flags [P.], cksum 0xfed6 (incorrect -> 0xfefe), seq 3503:3677, ack 930, win 512, options [nop,nop,TS val 3529676820 ecr 3529676413], length 174
2022-04-07 23:17:57.269148 IP (tos 0x0, ttl 64, id 35847, offset 0, flags [DF], proto TCP (6), length 52)
    127.0.0.1.48496 > 127.0.0.1.10050: Flags [.], cksum 0xfe28 (incorrect -> 0x35f1), seq 930, ack 3677, win 511, options [nop,nop,TS val 3529676820 ecr 3529676820], length 0
2022-04-07 23:17:57.396392 IP (tos 0x0, ttl 64, id 20597, offset 0, flags [DF], proto TCP (6), length 2510)
    127.0.0.1.10050 > 127.0.0.1.48496: Flags [P.], cksum 0x07c3 (incorrect -> 0x7ec3), seq 3677:6135, ack 930, win 512, options [nop,nop,TS val 3529676948 ecr 3529676820], length 2458
2022-04-07 23:17:57.396403 IP (tos 0x0, ttl 64, id 35848, offset 0, flags [DF], proto TCP (6), length 52)
    127.0.0.1.48496 > 127.0.0.1.10050: Flags [.], cksum 0xfe28 (incorrect -> 0x2b64), seq 930, ack 6135, win 498, options [nop,nop,TS val 3529676948 ecr 3529676948], length 0
2022-04-07 23:17:57.398238 IP (tos 0x0, ttl 64, id 35849, offset 0, flags [DF], proto TCP (6), length 402)
    127.0.0.1.48496 > 127.0.0.1.10050: Flags [P.], cksum 0xff86 (incorrect -> 0xad67), seq 930:1280, ack 6135, win 512, options [nop,nop,TS val 3529676950 ecr 3529676948], length 350
2022-04-07 23:17:57.398248 IP (tos 0x0, ttl 64, id 20598, offset 0, flags [DF], proto TCP (6), length 52)
    127.0.0.1.10050 > 127.0.0.1.48496: Flags [.], cksum 0xfe28 (incorrect -> 0x29f6), seq 6135, ack 1280, win 510, options [nop,nop,TS val 3529676950 ecr 3529676950], length 0
2022-04-07 23:17:58.126665 IP (tos 0x0, ttl 64, id 20599, offset 0, flags [DF], proto TCP (6), length 3538)
    127.0.0.1.10050 > 127.0.0.1.48496: Flags [P.], cksum 0x0bc7 (incorrect -> 0xfeca), seq 6135:9621, ack 1280, win 512, options [nop,nop,TS val 3529677678 ecr 3529676950], length 3486
200, 4.383346080780029, 3.353205680847168