2022-04-07 17:59:03.155891 IP (tos 0x0, ttl 64, id 35107, offset 0, flags [DF], proto TCP (6), length 60)
    127.0.0.1.36522 > 127.0.0.1.10950: Flags [S], cksum 0xfe30 (incorrect -> 0x175a), seq 4040956840, win 65495, options [mss 65495,sackOK,TS val 3510542707 ecr 0,nop,wscale 7], length 0
2022-04-07 17:59:03.155899 IP (tos 0x0, ttl 64, id 0, offset 0, flags [DF], proto TCP (6), length 60)
    127.0.0.1.10950 > 127.0.0.1.36522: Flags [S.], cksum 0xfe30 (incorrect -> 0x2257), seq 3405494095, ack 4040956841, win 65483, options [mss 65495,sackOK,TS val 3510542707 ecr 3510542707,nop,wscale 7], length 0
2022-04-07 17:59:03.155906 IP (tos 0x0, ttl 64, id 35108, offset 0, flags [DF], proto TCP (6), length 52)
    127.0.0.1.36522 > 127.0.0.1.10950: Flags [.], cksum 0xfe28 (incorrect -> 0x4913), seq 1, ack 1, win 512, options [nop,nop,TS val 3510542707 ecr 3510542707], length 0
2022-04-07 17:59:03.155993 IP (tos 0x0, ttl 64, id 35109, offset 0, flags [DF], proto TCP (6), length 55)
    127.0.0.1.36522 > 127.0.0.1.10950: Flags [P.], cksum 0xfe2b (incorrect -> 0x4407), seq 1:4, ack 1, win 512, options [nop,nop,TS val 3510542707 ecr 3510542707], length 3
2022-04-07 17:59:03.155996 IP (tos 0x0, ttl 64, id 65090, offset 0, flags [DF], proto TCP (6), length 52)
    127.0.0.1.10950 > 127.0.0.1.36522: Flags [.], cksum 0xfe28 (incorrect -> 0x4910), seq 1, ack 4, win 512, options [nop,nop,TS val 3510542707 ecr 3510542707], length 0
2022-04-07 17:59:03.156049 IP (tos 0x0, ttl 64, id 65091, offset 0, flags [DF], proto TCP (6), length 54)
    127.0.0.1.10950 > 127.0.0.1.36522: Flags [P.], cksum 0xfe2a (incorrect -> 0x4406), seq 1:3, ack 4, win 512, options [nop,nop,TS val 3510542707 ecr 3510542707], length 2
2022-04-07 17:59:03.156053 IP (tos 0x0, ttl 64, id 35110, offset 0, flags [DF], proto TCP (6), length 52)
    127.0.0.1.36522 > 127.0.0.1.10950: Flags [.], cksum 0xfe28 (incorrect -> 0x490e), seq 4, ack 3, win 512, options [nop,nop,TS val 3510542707 ecr 3510542707], length 0
2022-04-07 17:59:03.157992 IP (tos 0x0, ttl 64, id 35111, offset 0, flags [DF], proto TCP (6), length 62)
    127.0.0.1.36522 > 127.0.0.1.10950: Flags [P.], cksum 0xfe32 (incorrect -> 0x9344), seq 4:14, ack 3, win 512, options [nop,nop,TS val 3510542709 ecr 3510542707], length 10
2022-04-07 17:59:03.157998 IP (tos 0x0, ttl 64, id 65092, offset 0, flags [DF], proto TCP (6), length 52)
    127.0.0.1.10950 > 127.0.0.1.36522: Flags [.], cksum 0xfe28 (incorrect -> 0x4900), seq 3, ack 14, win 512, options [nop,nop,TS val 3510542709 ecr 3510542709], length 0
2022-04-07 17:59:03.228828 IP (tos 0x0, ttl 64, id 65093, offset 0, flags [DF], proto TCP (6), length 62)
    127.0.0.1.10950 > 127.0.0.1.36522: Flags [P.], cksum 0xfe32 (incorrect -> 0x43a6), seq 3:13, ack 14, win 512, options [nop,nop,TS val 3510542780 ecr 3510542709], length 10
2022-04-07 17:59:03.228836 IP (tos 0x0, ttl 64, id 35112, offset 0, flags [DF], proto TCP (6), length 52)
    127.0.0.1.36522 > 127.0.0.1.10950: Flags [.], cksum 0xfe28 (incorrect -> 0x4868), seq 14, ack 13, win 512, options [nop,nop,TS val 3510542780 ecr 3510542780], length 0
2022-04-07 17:59:03.234547 IP (tos 0x0, ttl 64, id 35113, offset 0, flags [DF], proto TCP (6), length 569)
    127.0.0.1.36522 > 127.0.0.1.10950: Flags [P.], cksum 0x002e (incorrect -> 0x9467), seq 14:531, ack 13, win 512, options [nop,nop,TS val 3510542786 ecr 3510542780], length 517
2022-04-07 17:59:03.234554 IP (tos 0x0, ttl 64, id 65094, offset 0, flags [DF], proto TCP (6), length 52)
    127.0.0.1.10950 > 127.0.0.1.36522: Flags [.], cksum 0xfe28 (incorrect -> 0x465b), seq 13, ack 531, win 508, options [nop,nop,TS val 3510542786 ecr 3510542786], length 0
2022-04-07 17:59:03.337200 IP (tos 0x0, ttl 64, id 65095, offset 0, flags [DF], proto TCP (6), length 3538)
    127.0.0.1.10950 > 127.0.0.1.36522: Flags [P.], cksum 0x0bc7 (incorrect -> 0x140f), seq 13:3499, ack 531, win 512, options [nop,nop,TS val 3510542888 ecr 3510542786], length 3486
2022-04-07 17:59:03.337207 IP (tos 0x0, ttl 64, id 35114, offset 0, flags [DF], proto TCP (6), length 52)
    127.0.0.1.36522 > 127.0.0.1.10950: Flags [.], cksum 0xfe28 (incorrect -> 0x37ff), seq 531, ack 3499, win 494, options [nop,nop,TS val 3510542888 ecr 3510542888], length 0
2022-04-07 17:59:03.356182 IP (tos 0x0, ttl 64, id 65096, offset 0, flags [DF], proto TCP (6), length 659)
    127.0.0.1.10950 > 127.0.0.1.36522: Flags [P.], cksum 0x0088 (incorrect -> 0xa11c), seq 3499:4106, ack 531, win 512, options [nop,nop,TS val 3510542907 ecr 3510542888], length 607
2022-04-07 17:59:03.356196 IP (tos 0x0, ttl 64, id 35115, offset 0, flags [DF], proto TCP (6), length 52)
    127.0.0.1.36522 > 127.0.0.1.10950: Flags [.], cksum 0xfe28 (incorrect -> 0x356f), seq 531, ack 4106, win 505, options [nop,nop,TS val 3510542907 ecr 3510542907], length 0
2022-04-07 17:59:03.356661 IP (tos 0x0, ttl 64, id 35116, offset 0, flags [DF], proto TCP (6), length 132)
    127.0.0.1.36522 > 127.0.0.1.10950: Flags [P.], cksum 0xfe78 (incorrect -> 0x0f6c), seq 531:611, ack 4106, win 512, options [nop,nop,TS val 3510542908 ecr 3510542907], length 80
2022-04-07 17:59:03.356667 IP (tos 0x0, ttl 64, id 65097, offset 0, flags [DF], proto TCP (6), length 52)
    127.0.0.1.10950 > 127.0.0.1.36522: Flags [.], cksum 0xfe28 (incorrect -> 0x3516), seq 4106, ack 611, win 512, options [nop,nop,TS val 3510542908 ecr 3510542908], length 0
2022-04-07 17:59:03.357103 IP (tos 0x0, ttl 64, id 35117, offset 0, flags [DF], proto TCP (6), length 375)
    127.0.0.1.36522 > 127.0.0.1.10950: Flags [P.], cksum 0xff6b (incorrect -> 0x8d80), seq 611:934, ack 4106, win 512, options [nop,nop,TS val 3510542908 ecr 3510542908], length 323
2022-04-07 17:59:03.357107 IP (tos 0x0, ttl 64, id 65098, offset 0, flags [DF], proto TCP (6), length 52)
    127.0.0.1.10950 > 127.0.0.1.36522: Flags [.], cksum 0xfe28 (incorrect -> 0x33d5), seq 4106, ack 934, win 510, options [nop,nop,TS val 3510542908 ecr 3510542908], length 0
2022-04-07 17:59:03.425183 IP (tos 0x0, ttl 64, id 65099, offset 0, flags [DF], proto TCP (6), length 594)
    127.0.0.1.10950 > 127.0.0.1.36522: Flags [P.], cksum 0x0047 (incorrect -> 0x2d51), seq 4106:4648, ack 934, win 512, options [nop,nop,TS val 3510542976 ecr 3510542908], length 542
2022-04-07 17:59:03.425189 IP (tos 0x0, ttl 64, id 35118, offset 0, flags [DF], proto TCP (6), length 52)
    127.0.0.1.36522 > 127.0.0.1.10950: Flags [.], cksum 0xfe28 (incorrect -> 0x3131), seq 934, ack 4648, win 508, options [nop,nop,TS val 3510542976 ecr 3510542976], length 0
2022-04-07 17:59:03.429767 IP (tos 0x0, ttl 64, id 65100, offset 0, flags [DF], proto TCP (6), length 3487)
    127.0.0.1.10950 > 127.0.0.1.36522: Flags [P.], cksum 0x0b94 (incorrect -> 0x0702), seq 4648:8083, ack 934, win 512, options [nop,nop,TS val 3510542981 ecr 3510542976], length 3435
2022-04-07 17:59:03.429771 IP (tos 0x0, ttl 64, id 35119, offset 0, flags [DF], proto TCP (6), length 52)
    127.0.0.1.36522 > 127.0.0.1.10950: Flags [.], cksum 0xfe28 (incorrect -> 0x23ca), seq 934, ack 8083, win 494, options [nop,nop,TS val 3510542981 ecr 3510542981], length 0
2022-04-07 17:59:03.441981 IP (tos 0x0, ttl 64, id 65101, offset 0, flags [DF], proto TCP (6), length 4100)
    127.0.0.1.10950 > 127.0.0.1.36522: Flags [P.], cksum 0x0df9 (incorrect -> 0x2148), seq 8083:12131, ack 934, win 512, options [nop,nop,TS val 3510542993 ecr 3510542981], length 4048
2022-04-07 17:59:03.441986 IP (tos 0x0, ttl 64, id 35120, offset 0, flags [DF], proto TCP (6), length 52)
    127.0.0.1.36522 > 127.0.0.1.10950: Flags [.], cksum 0xfe28 (incorrect -> 0x13e4), seq 934, ack 12131, win 492, options [nop,nop,TS val 3510542993 ecr 3510542993], length 0
2022-04-07 17:59:03.441991 IP (tos 0x0, ttl 64, id 65102, offset 0, flags [DF], proto TCP (6), length 486)
    127.0.0.1.10950 > 127.0.0.1.36522: Flags [P.], cksum 0xffda (incorrect -> 0x88d6), seq 12131:12565, ack 934, win 512, options [nop,nop,TS val 3510542993 ecr 3510542993], length 434
2022-04-07 17:59:03.441994 IP (tos 0x0, ttl 64, id 35121, offset 0, flags [DF], proto TCP (6), length 52)
    127.0.0.1.36522 > 127.0.0.1.10950: Flags [.], cksum 0xfe28 (incorrect -> 0x1234), seq 934, ack 12565, win 490, options [nop,nop,TS val 3510542993 ecr 3510542993], length 0
2022-04-07 17:59:03.444323 IP (tos 0x0, ttl 64, id 65103, offset 0, flags [DF], proto TCP (6), length 3538)
    127.0.0.1.10950 > 127.0.0.1.36522: Flags [P.], cksum 0x0bc7 (incorrect -> 0x0f91), seq 12565:16051, ack 934, win 512, options [nop,nop,TS val 3510542996 ecr 3510542993], length 3486
2022-04-07 17:59:03.444327 IP (tos 0x0, ttl 64, id 35122, offset 0, flags [DF], proto TCP (6), length 52)
    127.0.0.1.36522 > 127.0.0.1.10950: Flags [.], cksum 0xfe28 (incorrect -> 0x048c), seq 934, ack 16051, win 494, options [nop,nop,TS val 3510542996 ecr 3510542996], length 0
2022-04-07 17:59:03.448009 IP (tos 0x0, ttl 64, id 65104, offset 0, flags [DF], proto TCP (6), length 4036)
    127.0.0.1.10950 > 127.0.0.1.36522: Flags [P.], cksum 0x0db9 (incorrect -> 0x1578), seq 16051:20035, ack 934, win 512, options [nop,nop,TS val 3510542999 ecr 3510542996], length 3984
2022-04-07 17:59:03.448013 IP (tos 0x0, ttl 64, id 35123, offset 0, flags [DF], proto TCP (6), length 52)
    127.0.0.1.36522 > 127.0.0.1.10950: Flags [.], cksum 0xfe28 (incorrect -> 0xf4f7), seq 934, ack 20035, win 492, options [nop,nop,TS val 3510542999 ecr 3510542999], length 0
2022-04-07 17:59:03.448954 IP (tos 0x0, ttl 64, id 65105, offset 0, flags [DF], proto TCP (6), length 2580)
    127.0.0.1.10950 > 127.0.0.1.36522: Flags [P.], cksum 0x0809 (incorrect -> 0x72a1), seq 20035:22563, ack 934, win 512, options [nop,nop,TS val 3510543000 ecr 3510542999], length 2528
2022-04-07 17:59:03.448961 IP (tos 0x0, ttl 64, id 35124, offset 0, flags [DF], proto TCP (6), length 52)
    127.0.0.1.36522 > 127.0.0.1.10950: Flags [.], cksum 0xfe28 (incorrect -> 0xeb0f), seq 934, ack 22563, win 498, options [nop,nop,TS val 3510543000 ecr 3510543000], length 0
2022-04-07 17:59:03.449681 IP (tos 0x0, ttl 64, id 65106, offset 0, flags [DF], proto TCP (6), length 4100)
    127.0.0.1.10950 > 127.0.0.1.36522: Flags [P.], cksum 0x0df9 (incorrect -> 0x86f5), seq 22563:26611, ack 934, win 512, options [nop,nop,TS val 3510543001 ecr 3510543000], length 4048
2022-04-07 17:59:03.449686 IP (tos 0x0, ttl 64, id 35125, offset 0, flags [DF], proto TCP (6), length 52)
    127.0.0.1.36522 > 127.0.0.1.10950: Flags [.], cksum 0xfe28 (incorrect -> 0xdb43), seq 934, ack 26611, win 492, options [nop,nop,TS val 3510543001 ecr 3510543001], length 0
2022-04-07 17:59:03.449690 IP (tos 0x0, ttl 64, id 65107, offset 0, flags [DF], proto TCP (6), length 302)
    127.0.0.1.10950 > 127.0.0.1.36522: Flags [P.], cksum 0xff22 (incorrect -> 0x3fab), seq 26611:26861, ack 934, win 512, options [nop,nop,TS val 3510543001 ecr 3510543001], length 250
2022-04-07 17:59:03.450079 IP (tos 0x0, ttl 64, id 35126, offset 0, flags [DF], proto TCP (6), length 52)
    127.0.0.1.36522 > 127.0.0.1.10950: Flags [.], cksum 0xfe28 (incorrect -> 0xda35), seq 934, ack 26861, win 512, options [nop,nop,TS val 3510543001 ecr 3510543001], length 0
2022-04-07 17:59:03.450084 IP (tos 0x0, ttl 64, id 65108, offset 0, flags [DF], proto TCP (6), length 2542)
    127.0.0.1.10950 > 127.0.0.1.36522: Flags [P.], cksum 0x07e3 (incorrect -> 0x0340), seq 26861:29351, ack 934, win 512, options [nop,nop,TS val 3510543001 ecr 3510543001], length 2490
2022-04-07 17:59:03.450087 IP (tos 0x0, ttl 64, id 35127, offset 0, flags [DF], proto TCP (6), length 52)
    127.0.0.1.36522 > 127.0.0.1.10950: Flags [.], cksum 0xfe28 (incorrect -> 0xd07b), seq 934, ack 29351, win 512, options [nop,nop,TS val 3510543001 ecr 3510543001], length 0
2022-04-07 17:59:03.461754 IP (tos 0x0, ttl 64, id 65109, offset 0, flags [DF], proto TCP (6), length 3354)
    127.0.0.1.10950 > 127.0.0.1.36522: Flags [P.], cksum 0x0b0f (incorrect -> 0x148c), seq 29351:32653, ack 934, win 512, options [nop,nop,TS val 3510543013 ecr 3510543001], length 3302
2022-04-07 17:59:03.462097 IP (tos 0x0, ttl 64, id 35128, offset 0, flags [DF], proto TCP (6), length 52)
    127.0.0.1.36522 > 127.0.0.1.10950: Flags [.], cksum 0xfe28 (incorrect -> 0xc37d), seq 934, ack 32653, win 512, options [nop,nop,TS val 3510543013 ecr 3510543013], length 0
2022-04-07 17:59:03.462151 IP (tos 0x0, ttl 64, id 65110, offset 0, flags [DF], proto TCP (6), length 4100)
    127.0.0.1.10950 > 127.0.0.1.36522: Flags [P.], cksum 0x0df9 (incorrect -> 0x7c60), seq 32653:36701, ack 934, win 512, options [nop,nop,TS val 3510543013 ecr 3510543013], length 4048
2022-04-07 17:59:03.477487 IP (tos 0x0, ttl 64, id 65111, offset 0, flags [DF], proto TCP (6), length 32820)
    127.0.0.1.10950 > 127.0.0.1.36522: Flags [.], cksum 0x7e29 (incorrect -> 0x2752), seq 36701:69469, ack 934, win 512, options [nop,nop,TS val 3510543029 ecr 3510543013], length 32768
2022-04-07 17:59:03.477504 IP (tos 0x0, ttl 64, id 35129, offset 0, flags [DF], proto TCP (6), length 52)
    127.0.0.1.36522 > 127.0.0.1.10950: Flags [.], cksum 0xfe28 (incorrect -> 0x3422), seq 934, ack 69469, win 379, options [nop,nop,TS val 3510543029 ecr 3510543013], length 0
2022-04-07 17:59:03.477507 IP (tos 0x0, ttl 64, id 65112, offset 0, flags [DF], proto TCP (6), length 2378)
    127.0.0.1.10950 > 127.0.0.1.36522: Flags [P.], cksum 0x073f (incorrect -> 0xb8af), seq 69469:71795, ack 934, win 512, options [nop,nop,TS val 3510543029 ecr 3510543029], length 2326
2022-04-07 17:59:03.478238 IP (tos 0x0, ttl 64, id 35130, offset 0, flags [DF], proto TCP (6), length 52)
    127.0.0.1.36522 > 127.0.0.1.10950: Flags [.], cksum 0xfe28 (incorrect -> 0x2a76), seq 934, ack 71795, win 512, options [nop,nop,TS val 3510543030 ecr 3510543029], length 0
2022-04-07 17:59:03.480640 IP (tos 0x0, ttl 64, id 65113, offset 0, flags [DF], proto TCP (6), length 3400)
    127.0.0.1.10950 > 127.0.0.1.36522: Flags [P.], cksum 0x0b3d (incorrect -> 0x0731), seq 71795:75143, ack 934, win 512, options [nop,nop,TS val 3510543032 ecr 3510543030], length 3348
2022-04-07 17:59:03.481375 IP (tos 0x0, ttl 64, id 35131, offset 0, flags [DF], proto TCP (6), length 52)
    127.0.0.1.36522 > 127.0.0.1.10950: Flags [.], cksum 0xfe28 (incorrect -> 0x1d5c), seq 934, ack 75143, win 512, options [nop,nop,TS val 3510543033 ecr 3510543032], length 0
2022-04-07 17:59:03.481414 IP (tos 0x0, ttl 64, id 65114, offset 0, flags [DF], proto TCP (6), length 3538)
    127.0.0.1.10950 > 127.0.0.1.36522: Flags [P.], cksum 0x0bc7 (incorrect -> 0x7d00), seq 75143:78629, ack 934, win 512, options [nop,nop,TS val 3510543033 ecr 3510543033], length 3486
2022-04-07 17:59:03.481424 IP (tos 0x0, ttl 64, id 35132, offset 0, flags [DF], proto TCP (6), length 52)
    127.0.0.1.36522 > 127.0.0.1.10950: Flags [.], cksum 0xfe28 (incorrect -> 0x0fbd), seq 934, ack 78629, win 512, options [nop,nop,TS val 3510543033 ecr 3510543033], length 0
2022-04-07 17:59:03.482738 IP (tos 0x0, ttl 64, id 65115, offset 0, flags [DF], proto TCP (6), length 3308)
    127.0.0.1.10950 > 127.0.0.1.36522: Flags [P.], cksum 0x0ae1 (incorrect -> 0x8d5e), seq 78629:81885, ack 934, win 512, options [nop,nop,TS val 3510543034 ecr 3510543033], length 3256
2022-04-07 17:59:03.483116 IP (tos 0x0, ttl 64, id 35133, offset 0, flags [DF], proto TCP (6), length 52)
    127.0.0.1.36522 > 127.0.0.1.10950: Flags [.], cksum 0xfe28 (incorrect -> 0x0303), seq 934, ack 81885, win 512, options [nop,nop,TS val 3510543034 ecr 3510543034], length 0
2022-04-07 17:59:03.483165 IP (tos 0x0, ttl 64, id 65116, offset 0, flags [DF], proto TCP (6), length 4100)
    127.0.0.1.10950 > 127.0.0.1.36522: Flags [P.], cksum 0x0df9 (incorrect -> 0xc78e), seq 81885:85933, ack 934, win 512, options [nop,nop,TS val 3510543034 ecr 3510543034], length 4048
2022-04-07 17:59:03.483184 IP (tos 0x0, ttl 64, id 35134, offset 0, flags [DF], proto TCP (6), length 52)
    127.0.0.1.36522 > 127.0.0.1.10950: Flags [.], cksum 0xfe28 (incorrect -> 0xf332), seq 934, ack 85933, win 512, options [nop,nop,TS val 3510543034 ecr 3510543034], length 0
2022-04-07 17:59:03.483187 IP (tos 0x0, ttl 64, id 65117, offset 0, flags [DF], proto TCP (6), length 3336)
    127.0.0.1.10950 > 127.0.0.1.36522: Flags [P.], cksum 0x0afd (incorrect -> 0x4049), seq 85933:89217, ack 934, win 512, options [nop,nop,TS val 3510543034 ecr 3510543034], length 3284
2022-04-07 17:59:03.483189 IP (tos 0x0, ttl 64, id 35135, offset 0, flags [DF], proto TCP (6), length 52)
    127.0.0.1.36522 > 127.0.0.1.10950: Flags [.], cksum 0xfe28 (incorrect -> 0xe65e), seq 934, ack 89217, win 512, options [nop,nop,TS val 3510543034 ecr 3510543034], length 0
2022-04-07 17:59:03.483512 IP (tos 0x0, ttl 64, id 65118, offset 0, flags [DF], proto TCP (6), length 3852)
    127.0.0.1.10950 > 127.0.0.1.36522: Flags [P.], cksum 0x0d01 (incorrect -> 0x85d9), seq 89217:93017, ack 934, win 512, options [nop,nop,TS val 3510543035 ecr 3510543034], length 3800
2022-04-07 17:59:03.483522 IP (tos 0x0, ttl 64, id 35136, offset 0, flags [DF], proto TCP (6), length 52)
    127.0.0.1.36522 > 127.0.0.1.10950: Flags [.], cksum 0xfe28 (incorrect -> 0xd784), seq 934, ack 93017, win 512, options [nop,nop,TS val 3510543035 ecr 3510543035], length 0
2022-04-07 17:59:03.483678 IP (tos 0x0, ttl 64, id 65119, offset 0, flags [DF], proto TCP (6), length 4100)
    127.0.0.1.10950 > 127.0.0.1.36522: Flags [P.], cksum 0x0df9 (incorrect -> 0xe0ef), seq 93017:97065, ack 934, win 512, options [nop,nop,TS val 3510543035 ecr 3510543035], length 4048
2022-04-07 17:59:03.484060 IP (tos 0x0, ttl 64, id 35137, offset 0, flags [DF], proto TCP (6), length 52)
    127.0.0.1.36522 > 127.0.0.1.10950: Flags [.], cksum 0xfe28 (incorrect -> 0xc7b4), seq 934, ack 97065, win 512, options [nop,nop,TS val 3510543035 ecr 3510543035], length 0
2022-04-07 17:59:03.484064 IP (tos 0x0, ttl 64, id 65120, offset 0, flags [DF], proto TCP (6), length 3696)
    127.0.0.1.10950 > 127.0.0.1.36522: Flags [P.], cksum 0x0c65 (incorrect -> 0xc614), seq 97065:100709, ack 934, win 512, options [nop,nop,TS val 3510543035 ecr 3510543035], length 3644
2022-04-07 17:59:03.484066 IP (tos 0x0, ttl 64, id 35138, offset 0, flags [DF], proto TCP (6), length 52)
    127.0.0.1.36522 > 127.0.0.1.10950: Flags [.], cksum 0xfe28 (incorrect -> 0xb978), seq 934, ack 100709, win 512, options [nop,nop,TS val 3510543035 ecr 3510543035], length 0
2022-04-07 17:59:03.487988 IP (tos 0x0, ttl 64, id 65121, offset 0, flags [DF], proto TCP (6), length 2496)
    127.0.0.1.10950 > 127.0.0.1.36522: Flags [P.], cksum 0x07b5 (incorrect -> 0x3e2a), seq 100709:103153, ack 934, win 512, options [nop,nop,TS val 3510543039 ecr 3510543035], length 2444
2022-04-07 17:59:03.488000 IP (tos 0x0, ttl 64, id 35139, offset 0, flags [DF], proto TCP (6), length 52)
    127.0.0.1.36522 > 127.0.0.1.10950: Flags [.], cksum 0xfe28 (incorrect -> 0xafe4), seq 934, ack 103153, win 512, options [nop,nop,TS val 3510543039 ecr 3510543039], length 0
2022-04-07 17:59:03.488277 IP (tos 0x0, ttl 64, id 65122, offset 0, flags [DF], proto TCP (6), length 4100)
    127.0.0.1.10950 > 127.0.0.1.36522: Flags [P.], cksum 0x0df9 (incorrect -> 0x289b), seq 103153:107201, ack 934, win 512, options [nop,nop,TS val 3510543040 ecr 3510543039], length 4048
2022-04-07 17:59:03.488682 IP (tos 0x0, ttl 64, id 35140, offset 0, flags [DF], proto TCP (6), length 52)
    127.0.0.1.36522 > 127.0.0.1.10950: Flags [.], cksum 0xfe28 (incorrect -> 0xa012), seq 934, ack 107201, win 512, options [nop,nop,TS val 3510543040 ecr 3510543040], length 0
2022-04-07 17:59:03.488687 IP (tos 0x0, ttl 64, id 65123, offset 0, flags [DF], proto TCP (6), length 9036)
    127.0.0.1.10950 > 127.0.0.1.36522: Flags [P.], cksum 0x2141 (incorrect -> 0xec8c), seq 107201:116185, ack 934, win 512, options [nop,nop,TS val 3510543040 ecr 3510543040], length 8984
2022-04-07 17:59:03.488690 IP (tos 0x0, ttl 64, id 35141, offset 0, flags [DF], proto TCP (6), length 52)
    127.0.0.1.36522 > 127.0.0.1.10950: Flags [.], cksum 0xfe28 (incorrect -> 0x7cfa), seq 934, ack 116185, win 512, options [nop,nop,TS val 3510543040 ecr 3510543040], length 0
2022-04-07 17:59:03.490360 IP (tos 0x0, ttl 64, id 65124, offset 0, flags [DF], proto TCP (6), length 3040)
    127.0.0.1.10950 > 127.0.0.1.36522: Flags [P.], cksum 0x09d5 (incorrect -> 0x1e0b), seq 116185:119173, ack 934, win 512, options [nop,nop,TS val 3510543042 ecr 3510543040], length 2988
2022-04-07 17:59:03.490370 IP (tos 0x0, ttl 64, id 35142, offset 0, flags [DF], proto TCP (6), length 52)
    127.0.0.1.36522 > 127.0.0.1.10950: Flags [.], cksum 0xfe28 (incorrect -> 0x714a), seq 934, ack 119173, win 512, options [nop,nop,TS val 3510543042 ecr 3510543042], length 0
2022-04-07 17:59:03.507527 IP (tos 0x0, ttl 64, id 65125, offset 0, flags [DF], proto TCP (6), length 3308)
    127.0.0.1.10950 > 127.0.0.1.36522: Flags [P.], cksum 0x0ae1 (incorrect -> 0x4956), seq 119173:122429, ack 934, win 512, options [nop,nop,TS val 3510543059 ecr 3510543042], length 3256
2022-04-07 17:59:03.508719 IP (tos 0x0, ttl 64, id 35143, offset 0, flags [DF], proto TCP (6), length 52)
    127.0.0.1.36522 > 127.0.0.1.10950: Flags [.], cksum 0xfe28 (incorrect -> 0x646f), seq 934, ack 122429, win 512, options [nop,nop,TS val 3510543060 ecr 3510543059], length 0
2022-04-07 17:59:03.509754 IP (tos 0x0, ttl 64, id 65126, offset 0, flags [DF], proto TCP (6), length 3944)
    127.0.0.1.10950 > 127.0.0.1.36522: Flags [P.], cksum 0x0d5d (incorrect -> 0x4d2b), seq 122429:126321, ack 934, win 512, options [nop,nop,TS val 3510543061 ecr 3510543060], length 3892
2022-04-07 17:59:03.509765 IP (tos 0x0, ttl 64, id 35144, offset 0, flags [DF], proto TCP (6), length 52)
    127.0.0.1.36522 > 127.0.0.1.10950: Flags [.], cksum 0xfe28 (incorrect -> 0x5538), seq 934, ack 126321, win 512, options [nop,nop,TS val 3510543061 ecr 3510543061], length 0
2022-04-07 17:59:03.513676 IP (tos 0x0, ttl 64, id 65127, offset 0, flags [DF], proto TCP (6), length 4100)
    127.0.0.1.10950 > 127.0.0.1.36522: Flags [P.], cksum 0x0df9 (incorrect -> 0xc065), seq 126321:130369, ack 934, win 512, options [nop,nop,TS val 3510543065 ecr 3510543061], length 4048
2022-04-07 17:59:03.514018 IP (tos 0x0, ttl 64, id 35145, offset 0, flags [DF], proto TCP (6), length 52)
    127.0.0.1.36522 > 127.0.0.1.10950: Flags [.], cksum 0xfe28 (incorrect -> 0x4560), seq 934, ack 130369, win 512, options [nop,nop,TS val 3510543065 ecr 3510543065], length 0
2022-04-07 17:59:03.514022 IP (tos 0x0, ttl 64, id 65128, offset 0, flags [DF], proto TCP (6), length 3290)
    127.0.0.1.10950 > 127.0.0.1.36522: Flags [P.], cksum 0x0acf (incorrect -> 0x4ac9), seq 130369:133607, ack 934, win 512, options [nop,nop,TS val 3510543065 ecr 3510543065], length 3238
2022-04-07 17:59:03.514026 IP (tos 0x0, ttl 64, id 35146, offset 0, flags [DF], proto TCP (6), length 52)
    127.0.0.1.36522 > 127.0.0.1.10950: Flags [.], cksum 0xfe28 (incorrect -> 0x38ba), seq 934, ack 133607, win 512, options [nop,nop,TS val 3510543065 ecr 3510543065], length 0
2022-04-07 17:59:03.514063 IP (tos 0x0, ttl 64, id 65129, offset 0, flags [DF], proto TCP (6), length 3898)
    127.0.0.1.10950 > 127.0.0.1.36522: Flags [P.], cksum 0x0d2f (incorrect -> 0xe3df), seq 133607:137453, ack 934, win 512, options [nop,nop,TS val 3510543065 ecr 3510543065], length 3846
2022-04-07 17:59:03.514072 IP (tos 0x0, ttl 64, id 35147, offset 0, flags [DF], proto TCP (6), length 52)
    127.0.0.1.36522 > 127.0.0.1.10950: Flags [.], cksum 0xfe28 (incorrect -> 0x29b4), seq 934, ack 137453, win 512, options [nop,nop,TS val 3510543065 ecr 3510543065], length 0
2022-04-07 17:59:03.517146 IP (tos 0x0, ttl 64, id 65130, offset 0, flags [DF], proto TCP (6), length 3852)
    127.0.0.1.10950 > 127.0.0.1.36522: Flags [P.], cksum 0x0d01 (incorrect -> 0xfe40), seq 137453:141253, ack 934, win 512, options [nop,nop,TS val 3510543068 ecr 3510543065], length 3800
2022-04-07 17:59:03.517158 IP (tos 0x0, ttl 64, id 35148, offset 0, flags [DF], proto TCP (6), length 52)
    127.0.0.1.36522 > 127.0.0.1.10950: Flags [.], cksum 0xfe28 (incorrect -> 0x1ad6), seq 934, ack 141253, win 512, options [nop,nop,TS val 3510543068 ecr 3510543068], length 0
2022-04-07 17:59:03.517481 IP (tos 0x0, ttl 64, id 65131, offset 0, flags [DF], proto TCP (6), length 4100)
    127.0.0.1.10950 > 127.0.0.1.36522: Flags [P.], cksum 0x0df9 (incorrect -> 0x0041), seq 141253:145301, ack 934, win 512, options [nop,nop,TS val 3510543069 ecr 3510543068], length 4048
2022-04-07 17:59:03.517534 IP (tos 0x0, ttl 64, id 35149, offset 0, flags [DF], proto TCP (6), length 52)
    127.0.0.1.36522 > 127.0.0.1.10950: Flags [.], cksum 0xfe28 (incorrect -> 0x0b04), seq 934, ack 145301, win 512, options [nop,nop,TS val 3510543069 ecr 3510543069], length 0
2022-04-07 17:59:03.517538 IP (tos 0x0, ttl 64, id 65132, offset 0, flags [DF], proto TCP (6), length 11526)
    127.0.0.1.10950 > 127.0.0.1.36522: Flags [P.], cksum 0x2afb (incorrect -> 0x5587), seq 145301:156775, ack 934, win 512, options [nop,nop,TS val 3510543069 ecr 3510543069], length 11474
2022-04-07 17:59:03.518361 IP (tos 0x0, ttl 64, id 35150, offset 0, flags [DF], proto TCP (6), length 52)
    127.0.0.1.36522 > 127.0.0.1.10950: Flags [.], cksum 0xfe28 (incorrect -> 0xde30), seq 934, ack 156775, win 512, options [nop,nop,TS val 3510543070 ecr 3510543069], length 0
2022-04-07 17:59:03.518417 IP (tos 0x0, ttl 64, id 65133, offset 0, flags [DF], proto TCP (6), length 4100)
    127.0.0.1.10950 > 127.0.0.1.36522: Flags [P.], cksum 0x0df9 (incorrect -> 0x9ca7), seq 156775:160823, ack 934, win 512, options [nop,nop,TS val 3510543070 ecr 3510543070], length 4048
2022-04-07 17:59:03.518517 IP (tos 0x0, ttl 64, id 35151, offset 0, flags [DF], proto TCP (6), length 52)
    127.0.0.1.36522 > 127.0.0.1.10950: Flags [.], cksum 0xfe28 (incorrect -> 0xce5f), seq 934, ack 160823, win 512, options [nop,nop,TS val 3510543070 ecr 3510543070], length 0
2022-04-07 17:59:03.518523 IP (tos 0x0, ttl 64, id 65134, offset 0, flags [DF], proto TCP (6), length 20076)
    127.0.0.1.10950 > 127.0.0.1.36522: Flags [P.], cksum 0x4c61 (incorrect -> 0x6755), seq 160823:180847, ack 934, win 512, options [nop,nop,TS val 3510543070 ecr 3510543070], length 20024
2022-04-07 17:59:03.519295 IP (tos 0x0, ttl 64, id 35152, offset 0, flags [DF], proto TCP (6), length 52)
    127.0.0.1.36522 > 127.0.0.1.10950: Flags [.], cksum 0xfe28 (incorrect -> 0x8026), seq 934, ack 180847, win 512, options [nop,nop,TS val 3510543071 ecr 3510543070], length 0
2022-04-07 17:59:03.522339 IP (tos 0x0, ttl 64, id 65135, offset 0, flags [DF], proto TCP (6), length 3538)
    127.0.0.1.10950 > 127.0.0.1.36522: Flags [P.], cksum 0x0bc7 (incorrect -> 0xf258), seq 180847:184333, ack 934, win 512, options [nop,nop,TS val 3510543074 ecr 3510543071], length 3486
2022-04-07 17:59:03.522351 IP (tos 0x0, ttl 64, id 35153, offset 0, flags [DF], proto TCP (6), length 52)
    127.0.0.1.36522 > 127.0.0.1.10950: Flags [.], cksum 0xfe28 (incorrect -> 0x7281), seq 934, ack 184333, win 512, options [nop,nop,TS val 3510543074 ecr 3510543074], length 0
2022-04-07 17:59:03.522395 IP (tos 0x0, ttl 64, id 65136, offset 0, flags [DF], proto TCP (6), length 3538)
    127.0.0.1.10950 > 127.0.0.1.36522: Flags [P.], cksum 0x0bc7 (incorrect -> 0xbd47), seq 184333:187819, ack 934, win 512, options [nop,nop,TS val 3510543074 ecr 3510543074], length 3486
2022-04-07 17:59:03.540276 IP (tos 0x0, ttl 64, id 65137, offset 0, flags [DF], proto TCP (6), length 32820)
    127.0.0.1.10950 > 127.0.0.1.36522: Flags [.], cksum 0x7e29 (incorrect -> 0x2200), seq 187819:220587, ack 934, win 512, options [nop,nop,TS val 3510543092 ecr 3510543074], length 32768
2022-04-07 17:59:03.540303 IP (tos 0x0, ttl 64, id 35154, offset 0, flags [DF], proto TCP (6), length 52)
    127.0.0.1.36522 > 127.0.0.1.10950: Flags [.], cksum 0xfe28 (incorrect -> 0xe555), seq 934, ack 220587, win 379, options [nop,nop,TS val 3510543092 ecr 3510543074], length 0
2022-04-07 17:59:03.540308 IP (tos 0x0, ttl 64, id 65138, offset 0, flags [DF], proto TCP (6), length 2304)
    127.0.0.1.10950 > 127.0.0.1.36522: Flags [P.], cksum 0x06f5 (incorrect -> 0xa998), seq 220587:222839, ack 934, win 512, options [nop,nop,TS val 3510543092 ecr 3510543092], length 2252
2022-04-07 17:59:03.541838 IP (tos 0x0, ttl 64, id 35155, offset 0, flags [DF], proto TCP (6), length 52)
    127.0.0.1.36522 > 127.0.0.1.10950: Flags [.], cksum 0xfe28 (incorrect -> 0xdbf1), seq 934, ack 222839, win 512, options [nop,nop,TS val 3510543093 ecr 3510543092], length 0
2022-04-07 17:59:03.541842 IP (tos 0x0, ttl 64, id 65139, offset 0, flags [DF], proto TCP (6), length 3492)
    127.0.0.1.10950 > 127.0.0.1.36522: Flags [P.], cksum 0x0b99 (incorrect -> 0x518a), seq 222839:226279, ack 934, win 512, options [nop,nop,TS val 3510543093 ecr 3510543093], length 3440
2022-04-07 17:59:03.541845 IP (tos 0x0, ttl 64, id 35156, offset 0, flags [DF], proto TCP (6), length 52)
    127.0.0.1.36522 > 127.0.0.1.10950: Flags [.], cksum 0xfe28 (incorrect -> 0xce80), seq 934, ack 226279, win 512, options [nop,nop,TS val 3510543093 ecr 3510543093], length 0
2022-04-07 17:59:03.543342 IP (tos 0x0, ttl 64, id 65140, offset 0, flags [DF], proto TCP (6), length 4100)
    127.0.0.1.10950 > 127.0.0.1.36522: Flags [P.], cksum 0x0df9 (incorrect -> 0x6309), seq 226279:230327, ack 934, win 512, options [nop,nop,TS val 3510543095 ecr 3510543093], length 4048
2022-04-07 17:59:03.543766 IP (tos 0x0, ttl 64, id 35157, offset 0, flags [DF], proto TCP (6), length 52)
    127.0.0.1.36522 > 127.0.0.1.10950: Flags [.], cksum 0xfe28 (incorrect -> 0xbeac), seq 934, ack 230327, win 512, options [nop,nop,TS val 3510543095 ecr 3510543095], length 0
2022-04-07 17:59:03.543770 IP (tos 0x0, ttl 64, id 65141, offset 0, flags [DF], proto TCP (6), length 3972)
    127.0.0.1.10950 > 127.0.0.1.36522: Flags [P.], cksum 0x0d79 (incorrect -> 0x71fa), seq 230327:234247, ack 934, win 512, options [nop,nop,TS val 3510543095 ecr 3510543095], length 3920
2022-04-07 17:59:03.543773 IP (tos 0x0, ttl 64, id 35158, offset 0, flags [DF], proto TCP (6), length 52)
    127.0.0.1.36522 > 127.0.0.1.10950: Flags [.], cksum 0xfe28 (incorrect -> 0xaf5c), seq 934, ack 234247, win 512, options [nop,nop,TS val 3510543095 ecr 3510543095], length 0
2022-04-07 17:59:03.549161 IP (tos 0x0, ttl 64, id 65142, offset 0, flags [DF], proto TCP (6), length 4100)
    127.0.0.1.10950 > 127.0.0.1.36522: Flags [P.], cksum 0x0df9 (incorrect -> 0xa3c4), seq 234247:238295, ack 934, win 512, options [nop,nop,TS val 3510543100 ecr 3510543095], length 4048
2022-04-07 17:59:03.549178 IP (tos 0x0, ttl 64, id 35159, offset 0, flags [DF], proto TCP (6), length 52)
    127.0.0.1.36522 > 127.0.0.1.10950: Flags [.], cksum 0xfe28 (incorrect -> 0x9f82), seq 934, ack 238295, win 512, options [nop,nop,TS val 3510543100 ecr 3510543100], length 0
2022-04-07 17:59:03.549180 IP (tos 0x0, ttl 64, id 65143, offset 0, flags [DF], proto TCP (6), length 72)
    127.0.0.1.10950 > 127.0.0.1.36522: Flags [P.], cksum 0xfe3c (incorrect -> 0x8aea), seq 238295:238315, ack 934, win 512, options [nop,nop,TS val 3510543100 ecr 3510543100], length 20
2022-04-07 17:59:03.549183 IP (tos 0x0, ttl 64, id 35160, offset 0, flags [DF], proto TCP (6), length 52)
    127.0.0.1.36522 > 127.0.0.1.10950: Flags [.], cksum 0xfe28 (incorrect -> 0x9f6e), seq 934, ack 238315, win 512, options [nop,nop,TS val 3510543100 ecr 3510543100], length 0
2022-04-07 17:59:03.553130 IP (tos 0x0, ttl 64, id 65144, offset 0, flags [DF], proto TCP (6), length 4036)
    127.0.0.1.10950 > 127.0.0.1.36522: Flags [P.], cksum 0x0db9 (incorrect -> 0x1429), seq 238315:242299, ack 934, win 512, options [nop,nop,TS val 3510543104 ecr 3510543100], length 3984
2022-04-07 17:59:03.553151 IP (tos 0x0, ttl 64, id 35161, offset 0, flags [DF], proto TCP (6), length 52)
    127.0.0.1.36522 > 127.0.0.1.10950: Flags [.], cksum 0xfe28 (incorrect -> 0x8fd6), seq 934, ack 242299, win 512, options [nop,nop,TS val 3510543104 ecr 3510543104], length 0
200, 126.50575613975525, 0.4640359878540039