2022-04-07 04:44:04.539873 IP (tos 0x0, ttl 64, id 51719, offset 0, flags [DF], proto TCP (6), length 60)
    127.0.0.1.51338 > 127.0.0.1.10150: Flags [S], cksum 0xfe30 (incorrect -> 0x8a3b), seq 1744226350, win 65495, options [mss 65495,sackOK,TS val 388927042 ecr 0,nop,wscale 7], length 0
2022-04-07 04:44:04.539886 IP (tos 0x0, ttl 64, id 0, offset 0, flags [DF], proto TCP (6), length 60)
    127.0.0.1.10150 > 127.0.0.1.51338: Flags [S.], cksum 0xfe30 (incorrect -> 0x5d0d), seq 1500786244, ack 1744226351, win 65483, options [mss 65495,sackOK,TS val 388927042 ecr 388927042,nop,wscale 7], length 0
2022-04-07 04:44:04.539896 IP (tos 0x0, ttl 64, id 51720, offset 0, flags [DF], proto TCP (6), length 52)
    127.0.0.1.51338 > 127.0.0.1.10150: Flags [.], cksum 0xfe28 (incorrect -> 0x83c9), seq 1, ack 1, win 512, options [nop,nop,TS val 388927042 ecr 388927042], length 0
2022-04-07 04:44:04.540188 IP (tos 0x0, ttl 64, id 51721, offset 0, flags [DF], proto TCP (6), length 55)
    127.0.0.1.51338 > 127.0.0.1.10150: Flags [P.], cksum 0xfe2b (incorrect -> 0x7ebc), seq 1:4, ack 1, win 512, options [nop,nop,TS val 388927043 ecr 388927042], length 3
2022-04-07 04:44:04.540194 IP (tos 0x0, ttl 64, id 4625, offset 0, flags [DF], proto TCP (6), length 52)
    127.0.0.1.10150 > 127.0.0.1.51338: Flags [.], cksum 0xfe28 (incorrect -> 0x83c4), seq 1, ack 4, win 512, options [nop,nop,TS val 388927043 ecr 388927043], length 0
2022-04-07 04:44:04.540214 IP (tos 0x0, ttl 64, id 4626, offset 0, flags [DF], proto TCP (6), length 54)
    127.0.0.1.10150 > 127.0.0.1.51338: Flags [P.], cksum 0xfe2a (incorrect -> 0x7eba), seq 1:3, ack 4, win 512, options [nop,nop,TS val 388927043 ecr 388927043], length 2
2022-04-07 04:44:04.540220 IP (tos 0x0, ttl 64, id 51722, offset 0, flags [DF], proto TCP (6), length 52)
    127.0.0.1.51338 > 127.0.0.1.10150: Flags [.], cksum 0xfe28 (incorrect -> 0x83c2), seq 4, ack 3, win 512, options [nop,nop,TS val 388927043 ecr 388927043], length 0
2022-04-07 04:44:04.541564 IP (tos 0x0, ttl 64, id 51723, offset 0, flags [DF], proto TCP (6), length 62)
    127.0.0.1.51338 > 127.0.0.1.10150: Flags [P.], cksum 0xfe32 (incorrect -> 0x3493), seq 4:14, ack 3, win 512, options [nop,nop,TS val 388927044 ecr 388927043], length 10
2022-04-07 04:44:04.541579 IP (tos 0x0, ttl 64, id 4627, offset 0, flags [DF], proto TCP (6), length 52)
    127.0.0.1.10150 > 127.0.0.1.51338: Flags [.], cksum 0xfe28 (incorrect -> 0x83b6), seq 3, ack 14, win 512, options [nop,nop,TS val 388927044 ecr 388927044], length 0
2022-04-07 04:44:04.599625 IP (tos 0x0, ttl 64, id 4628, offset 0, flags [DF], proto TCP (6), length 62)
    127.0.0.1.10150 > 127.0.0.1.51338: Flags [P.], cksum 0xfe32 (incorrect -> 0x7e69), seq 3:13, ack 14, win 512, options [nop,nop,TS val 388927102 ecr 388927044], length 10
2022-04-07 04:44:04.599634 IP (tos 0x0, ttl 64, id 51724, offset 0, flags [DF], proto TCP (6), length 52)
    127.0.0.1.51338 > 127.0.0.1.10150: Flags [.], cksum 0xfe28 (incorrect -> 0x8338), seq 14, ack 13, win 512, options [nop,nop,TS val 388927102 ecr 388927102], length 0
2022-04-07 04:44:04.605217 IP (tos 0x0, ttl 64, id 51725, offset 0, flags [DF], proto TCP (6), length 569)
    127.0.0.1.51338 > 127.0.0.1.10150: Flags [P.], cksum 0x002e (incorrect -> 0xe76d), seq 14:531, ack 13, win 512, options [nop,nop,TS val 388927108 ecr 388927102], length 517
2022-04-07 04:44:04.605224 IP (tos 0x0, ttl 64, id 4629, offset 0, flags [DF], proto TCP (6), length 52)
    127.0.0.1.10150 > 127.0.0.1.51338: Flags [.], cksum 0xfe28 (incorrect -> 0x812b), seq 13, ack 531, win 508, options [nop,nop,TS val 388927108 ecr 388927108], length 0
2022-04-07 04:44:04.658153 IP (tos 0x0, ttl 64, id 4630, offset 0, flags [DF], proto TCP (6), length 3386)
    127.0.0.1.10150 > 127.0.0.1.51338: Flags [P.], cksum 0x0b2f (incorrect -> 0xb94a), seq 13:3347, ack 531, win 512, options [nop,nop,TS val 388927161 ecr 388927108], length 3334
2022-04-07 04:44:04.658159 IP (tos 0x0, ttl 64, id 51726, offset 0, flags [DF], proto TCP (6), length 52)
    127.0.0.1.51338 > 127.0.0.1.10150: Flags [.], cksum 0xfe28 (incorrect -> 0x73c9), seq 531, ack 3347, win 494, options [nop,nop,TS val 388927161 ecr 388927161], length 0
2022-04-07 04:44:04.670619 IP (tos 0x0, ttl 64, id 4631, offset 0, flags [DF], proto TCP (6), length 1011)
    127.0.0.1.10150 > 127.0.0.1.51338: Flags [P.], cksum 0x01e8 (incorrect -> 0xd5af), seq 3347:4306, ack 531, win 512, options [nop,nop,TS val 388927173 ecr 388927161], length 959
2022-04-07 04:44:04.670624 IP (tos 0x0, ttl 64, id 51727, offset 0, flags [DF], proto TCP (6), length 52)
    127.0.0.1.51338 > 127.0.0.1.10150: Flags [.], cksum 0xfe28 (incorrect -> 0x6fe8), seq 531, ack 4306, win 504, options [nop,nop,TS val 388927173 ecr 388927173], length 0
2022-04-07 04:44:04.671137 IP (tos 0x0, ttl 64, id 51728, offset 0, flags [DF], proto TCP (6), length 132)
    127.0.0.1.51338 > 127.0.0.1.10150: Flags [P.], cksum 0xfe78 (incorrect -> 0x951b), seq 531:611, ack 4306, win 512, options [nop,nop,TS val 388927174 ecr 388927173], length 80
2022-04-07 04:44:04.671144 IP (tos 0x0, ttl 64, id 4632, offset 0, flags [DF], proto TCP (6), length 52)
    127.0.0.1.10150 > 127.0.0.1.51338: Flags [.], cksum 0xfe28 (incorrect -> 0x6f8e), seq 4306, ack 611, win 512, options [nop,nop,TS val 388927174 ecr 388927174], length 0
2022-04-07 04:44:04.671450 IP (tos 0x0, ttl 64, id 51729, offset 0, flags [DF], proto TCP (6), length 373)
    127.0.0.1.51338 > 127.0.0.1.10150: Flags [P.], cksum 0xff69 (incorrect -> 0x55e4), seq 611:932, ack 4306, win 512, options [nop,nop,TS val 388927174 ecr 388927174], length 321
2022-04-07 04:44:04.671456 IP (tos 0x0, ttl 64, id 4633, offset 0, flags [DF], proto TCP (6), length 52)
    127.0.0.1.10150 > 127.0.0.1.51338: Flags [.], cksum 0xfe28 (incorrect -> 0x6e4f), seq 4306, ack 932, win 510, options [nop,nop,TS val 388927174 ecr 388927174], length 0
200, 124.31925868988037, 0.36136317253112793