2022-04-07 02:51:51.715674 IP (tos 0x0, ttl 64, id 48301, offset 0, flags [DF], proto TCP (6), length 60)
    127.0.0.1.37854 > 127.0.0.1.11850: Flags [S], cksum 0xfe30 (incorrect -> 0xc03b), seq 3107269494, win 65495, options [mss 65495,sackOK,TS val 382194218 ecr 0,nop,wscale 7], length 0
2022-04-07 02:51:51.715683 IP (tos 0x0, ttl 64, id 0, offset 0, flags [DF], proto TCP (6), length 60)
    127.0.0.1.11850 > 127.0.0.1.37854: Flags [S.], cksum 0xfe30 (incorrect -> 0xfb51), seq 2491959146, ack 3107269495, win 65483, options [mss 65495,sackOK,TS val 382194218 ecr 382194218,nop,wscale 7], length 0
2022-04-07 02:51:51.715692 IP (tos 0x0, ttl 64, id 48302, offset 0, flags [DF], proto TCP (6), length 52)
    127.0.0.1.37854 > 127.0.0.1.11850: Flags [.], cksum 0xfe28 (incorrect -> 0x220e), seq 1, ack 1, win 512, options [nop,nop,TS val 382194218 ecr 382194218], length 0
2022-04-07 02:51:51.715794 IP (tos 0x0, ttl 64, id 48303, offset 0, flags [DF], proto TCP (6), length 55)
    127.0.0.1.37854 > 127.0.0.1.11850: Flags [P.], cksum 0xfe2b (incorrect -> 0x1d02), seq 1:4, ack 1, win 512, options [nop,nop,TS val 382194218 ecr 382194218], length 3
2022-04-07 02:51:51.715811 IP (tos 0x0, ttl 64, id 31627, offset 0, flags [DF], proto TCP (6), length 52)
    127.0.0.1.11850 > 127.0.0.1.37854: Flags [.], cksum 0xfe28 (incorrect -> 0x220b), seq 1, ack 4, win 512, options [nop,nop,TS val 382194218 ecr 382194218], length 0
2022-04-07 02:51:51.715849 IP (tos 0x0, ttl 64, id 31628, offset 0, flags [DF], proto TCP (6), length 54)
    127.0.0.1.11850 > 127.0.0.1.37854: Flags [P.], cksum 0xfe2a (incorrect -> 0x1d01), seq 1:3, ack 4, win 512, options [nop,nop,TS val 382194218 ecr 382194218], length 2
2022-04-07 02:51:51.715864 IP (tos 0x0, ttl 64, id 48304, offset 0, flags [DF], proto TCP (6), length 52)
    127.0.0.1.37854 > 127.0.0.1.11850: Flags [.], cksum 0xfe28 (incorrect -> 0x2209), seq 4, ack 3, win 512, options [nop,nop,TS val 382194218 ecr 382194218], length 0
2022-04-07 02:51:51.733491 IP (tos 0x0, ttl 64, id 48305, offset 0, flags [DF], proto TCP (6), length 62)
    127.0.0.1.37854 > 127.0.0.1.11850: Flags [P.], cksum 0xfe32 (incorrect -> 0xb69b), seq 4:14, ack 3, win 512, options [nop,nop,TS val 382194236 ecr 382194218], length 10
2022-04-07 02:51:51.733512 IP (tos 0x0, ttl 64, id 31629, offset 0, flags [DF], proto TCP (6), length 52)
    127.0.0.1.11850 > 127.0.0.1.37854: Flags [.], cksum 0xfe28 (incorrect -> 0x21db), seq 3, ack 14, win 512, options [nop,nop,TS val 382194236 ecr 382194236], length 0
2022-04-07 02:51:51.831611 IP (tos 0x0, ttl 64, id 31630, offset 0, flags [DF], proto TCP (6), length 62)
    127.0.0.1.11850 > 127.0.0.1.37854: Flags [P.], cksum 0xfe32 (incorrect -> 0x1c66), seq 3:13, ack 14, win 512, options [nop,nop,TS val 382194334 ecr 382194236], length 10
2022-04-07 02:51:51.831628 IP (tos 0x0, ttl 64, id 48306, offset 0, flags [DF], proto TCP (6), length 52)
    127.0.0.1.37854 > 127.0.0.1.11850: Flags [.], cksum 0xfe28 (incorrect -> 0x210d), seq 14, ack 13, win 512, options [nop,nop,TS val 382194334 ecr 382194334], length 0
2022-04-07 02:51:51.837322 IP (tos 0x0, ttl 64, id 48307, offset 0, flags [DF], proto TCP (6), length 569)
    127.0.0.1.37854 > 127.0.0.1.11850: Flags [P.], cksum 0x002e (incorrect -> 0xbfc7), seq 14:531, ack 13, win 512, options [nop,nop,TS val 382194340 ecr 382194334], length 517
2022-04-07 02:51:51.837338 IP (tos 0x0, ttl 64, id 31631, offset 0, flags [DF], proto TCP (6), length 52)
    127.0.0.1.11850 > 127.0.0.1.37854: Flags [.], cksum 0xfe28 (incorrect -> 0x1f00), seq 13, ack 531, win 508, options [nop,nop,TS val 382194340 ecr 382194340], length 0
200, 4.884424448013306, 1.0294921398162842