2022-04-07 08:37:05.634242 IP (tos 0x0, ttl 64, id 45942, offset 0, flags [DF], proto TCP (6), length 60)
    127.0.0.1.49218 > 127.0.0.1.9250: Flags [S], cksum 0xfe30 (incorrect -> 0x4bb0), seq 567607851, win 65495, options [mss 65495,sackOK,TS val 402908137 ecr 0,nop,wscale 7], length 0
2022-04-07 08:37:05.634251 IP (tos 0x0, ttl 64, id 0, offset 0, flags [DF], proto TCP (6), length 60)
    127.0.0.1.9250 > 127.0.0.1.49218: Flags [S.], cksum 0xfe30 (incorrect -> 0x352c), seq 2518123642, ack 567607852, win 65483, options [mss 65495,sackOK,TS val 402908137 ecr 402908137,nop,wscale 7], length 0
2022-04-07 08:37:05.634258 IP (tos 0x0, ttl 64, id 45943, offset 0, flags [DF], proto TCP (6), length 52)
    127.0.0.1.49218 > 127.0.0.1.9250: Flags [.], cksum 0xfe28 (incorrect -> 0x5be8), seq 1, ack 1, win 512, options [nop,nop,TS val 402908137 ecr 402908137], length 0
2022-04-07 08:37:05.634363 IP (tos 0x0, ttl 64, id 45944, offset 0, flags [DF], proto TCP (6), length 55)
    127.0.0.1.49218 > 127.0.0.1.9250: Flags [P.], cksum 0xfe2b (incorrect -> 0x56dc), seq 1:4, ack 1, win 512, options [nop,nop,TS val 402908137 ecr 402908137], length 3
2022-04-07 08:37:05.634376 IP (tos 0x0, ttl 64, id 29189, offset 0, flags [DF], proto TCP (6), length 52)
    127.0.0.1.9250 > 127.0.0.1.49218: Flags [.], cksum 0xfe28 (incorrect -> 0x5be5), seq 1, ack 4, win 512, options [nop,nop,TS val 402908137 ecr 402908137], length 0
2022-04-07 08:37:05.634407 IP (tos 0x0, ttl 64, id 29190, offset 0, flags [DF], proto TCP (6), length 54)
    127.0.0.1.9250 > 127.0.0.1.49218: Flags [P.], cksum 0xfe2a (incorrect -> 0x56db), seq 1:3, ack 4, win 512, options [nop,nop,TS val 402908137 ecr 402908137], length 2
2022-04-07 08:37:05.634418 IP (tos 0x0, ttl 64, id 45945, offset 0, flags [DF], proto TCP (6), length 52)
    127.0.0.1.49218 > 127.0.0.1.9250: Flags [.], cksum 0xfe28 (incorrect -> 0x5be3), seq 4, ack 3, win 512, options [nop,nop,TS val 402908137 ecr 402908137], length 0
2022-04-07 08:37:05.635880 IP (tos 0x0, ttl 64, id 45946, offset 0, flags [DF], proto TCP (6), length 62)
    127.0.0.1.49218 > 127.0.0.1.9250: Flags [P.], cksum 0xfe32 (incorrect -> 0xcbd1), seq 4:14, ack 3, win 512, options [nop,nop,TS val 402908138 ecr 402908137], length 10
2022-04-07 08:37:05.635898 IP (tos 0x0, ttl 64, id 29191, offset 0, flags [DF], proto TCP (6), length 52)
    127.0.0.1.9250 > 127.0.0.1.49218: Flags [.], cksum 0xfe28 (incorrect -> 0x5bd7), seq 3, ack 14, win 512, options [nop,nop,TS val 402908138 ecr 402908138], length 0
2022-04-07 08:37:05.950101 IP (tos 0x0, ttl 64, id 29192, offset 0, flags [DF], proto TCP (6), length 62)
    127.0.0.1.9250 > 127.0.0.1.49218: Flags [P.], cksum 0xfe32 (incorrect -> 0x5589), seq 3:13, ack 14, win 512, options [nop,nop,TS val 402908453 ecr 402908138], length 10
2022-04-07 08:37:05.950114 IP (tos 0x0, ttl 64, id 45947, offset 0, flags [DF], proto TCP (6), length 52)
    127.0.0.1.49218 > 127.0.0.1.9250: Flags [.], cksum 0xfe28 (incorrect -> 0x5957), seq 14, ack 13, win 512, options [nop,nop,TS val 402908453 ecr 402908453], length 0
2022-04-07 08:37:05.955999 IP (tos 0x0, ttl 64, id 45948, offset 0, flags [DF], proto TCP (6), length 569)
    127.0.0.1.49218 > 127.0.0.1.9250: Flags [P.], cksum 0x002e (incorrect -> 0xe763), seq 14:531, ack 13, win 512, options [nop,nop,TS val 402908458 ecr 402908453], length 517
2022-04-07 08:37:05.956010 IP (tos 0x0, ttl 64, id 29193, offset 0, flags [DF], proto TCP (6), length 52)
    127.0.0.1.9250 > 127.0.0.1.49218: Flags [.], cksum 0xfe28 (incorrect -> 0x574c), seq 13, ack 531, win 508, options [nop,nop,TS val 402908458 ecr 402908458], length 0
2022-04-07 08:37:06.270066 IP (tos 0x0, ttl 64, id 29194, offset 0, flags [DF], proto TCP (6), length 3538)
    127.0.0.1.9250 > 127.0.0.1.49218: Flags [P.], cksum 0x0bc7 (incorrect -> 0x86d8), seq 13:3499, ack 531, win 512, options [nop,nop,TS val 402908773 ecr 402908458], length 3486
2022-04-07 08:37:06.270077 IP (tos 0x0, ttl 64, id 45949, offset 0, flags [DF], proto TCP (6), length 52)
    127.0.0.1.49218 > 127.0.0.1.9250: Flags [.], cksum 0xfe28 (incorrect -> 0x4746), seq 531, ack 3499, win 494, options [nop,nop,TS val 402908773 ecr 402908773], length 0
2022-04-07 08:37:06.444924 IP (tos 0x0, ttl 64, id 29195, offset 0, flags [DF], proto TCP (6), length 1151)
    127.0.0.1.9250 > 127.0.0.1.49218: Flags [P.], cksum 0x0274 (incorrect -> 0xa457), seq 3499:4598, ack 531, win 512, options [nop,nop,TS val 402908947 ecr 402908773], length 1099
2022-04-07 08:37:06.444939 IP (tos 0x0, ttl 64, id 45950, offset 0, flags [DF], proto TCP (6), length 52)
    127.0.0.1.49218 > 127.0.0.1.9250: Flags [.], cksum 0xfe28 (incorrect -> 0x4196), seq 531, ack 4598, win 503, options [nop,nop,TS val 402908947 ecr 402908947], length 0
2022-04-07 08:37:06.445649 IP (tos 0x0, ttl 64, id 45951, offset 0, flags [DF], proto TCP (6), length 132)
    127.0.0.1.49218 > 127.0.0.1.9250: Flags [P.], cksum 0xfe78 (incorrect -> 0x83d9), seq 531:611, ack 4598, win 512, options [nop,nop,TS val 402908948 ecr 402908947], length 80
2022-04-07 08:37:06.445657 IP (tos 0x0, ttl 64, id 29196, offset 0, flags [DF], proto TCP (6), length 52)
    127.0.0.1.9250 > 127.0.0.1.49218: Flags [.], cksum 0xfe28 (incorrect -> 0x413b), seq 4598, ack 611, win 512, options [nop,nop,TS val 402908948 ecr 402908948], length 0
2022-04-07 08:37:06.446150 IP (tos 0x0, ttl 64, id 45952, offset 0, flags [DF], proto TCP (6), length 303)
    127.0.0.1.49218 > 127.0.0.1.9250: Flags [P.], cksum 0xff23 (incorrect -> 0xb1e3), seq 611:862, ack 4598, win 512, options [nop,nop,TS val 402908949 ecr 402908948], length 251
2022-04-07 08:37:06.446155 IP (tos 0x0, ttl 64, id 29197, offset 0, flags [DF], proto TCP (6), length 52)
    127.0.0.1.9250 > 127.0.0.1.49218: Flags [.], cksum 0xfe28 (incorrect -> 0x403f), seq 4598, ack 862, win 511, options [nop,nop,TS val 402908949 ecr 402908949], length 0
2022-04-07 08:37:06.764698 IP (tos 0x0, ttl 64, id 29198, offset 0, flags [DF], proto TCP (6), length 210)
    127.0.0.1.9250 > 127.0.0.1.49218: Flags [P.], cksum 0xfec6 (incorrect -> 0xc3fc), seq 4598:4756, ack 862, win 512, options [nop,nop,TS val 402909267 ecr 402908949], length 158
2022-04-07 08:37:06.764709 IP (tos 0x0, ttl 64, id 45953, offset 0, flags [DF], proto TCP (6), length 52)
    127.0.0.1.49218 > 127.0.0.1.9250: Flags [.], cksum 0xfe28 (incorrect -> 0x3d25), seq 862, ack 4756, win 511, options [nop,nop,TS val 402909267 ecr 402909267], length 0
2022-04-07 08:37:06.768612 IP (tos 0x0, ttl 64, id 29199, offset 0, flags [DF], proto TCP (6), length 4100)
    127.0.0.1.9250 > 127.0.0.1.49218: Flags [P.], cksum 0x0df9 (incorrect -> 0x9b75), seq 4756:8804, ack 862, win 512, options [nop,nop,TS val 402909271 ecr 402909267], length 4048
2022-04-07 08:37:06.768622 IP (tos 0x0, ttl 64, id 45954, offset 0, flags [DF], proto TCP (6), length 52)
    127.0.0.1.49218 > 127.0.0.1.9250: Flags [.], cksum 0xfe28 (incorrect -> 0x2d60), seq 862, ack 8804, win 492, options [nop,nop,TS val 402909271 ecr 402909271], length 0
2022-04-07 08:37:06.768633 IP (tos 0x0, ttl 64, id 29200, offset 0, flags [DF], proto TCP (6), length 2976)
    127.0.0.1.9250 > 127.0.0.1.49218: Flags [P.], cksum 0x0995 (incorrect -> 0x35ef), seq 8804:11728, ack 862, win 512, options [nop,nop,TS val 402909271 ecr 402909271], length 2924
2022-04-07 08:37:06.768638 IP (tos 0x0, ttl 64, id 45955, offset 0, flags [DF], proto TCP (6), length 52)
    127.0.0.1.49218 > 127.0.0.1.9250: Flags [.], cksum 0xfe28 (incorrect -> 0x2200), seq 862, ack 11728, win 480, options [nop,nop,TS val 402909271 ecr 402909271], length 0
2022-04-07 08:37:06.908953 IP (tos 0x0, ttl 64, id 29201, offset 0, flags [DF], proto TCP (6), length 550)
    127.0.0.1.9250 > 127.0.0.1.49218: Flags [P.], cksum 0x001b (incorrect -> 0x92a5), seq 11728:12226, ack 862, win 512, options [nop,nop,TS val 402909411 ecr 402909271], length 498
2022-04-07 08:37:06.908959 IP (tos 0x0, ttl 64, id 45956, offset 0, flags [DF], proto TCP (6), length 52)
    127.0.0.1.49218 > 127.0.0.1.9250: Flags [.], cksum 0xfe28 (incorrect -> 0x1edc), seq 862, ack 12226, win 506, options [nop,nop,TS val 402909411 ecr 402909411], length 0
2022-04-07 08:37:06.915524 IP (tos 0x0, ttl 64, id 29202, offset 0, flags [DF], proto TCP (6), length 3538)
    127.0.0.1.9250 > 127.0.0.1.49218: Flags [P.], cksum 0x0bc7 (incorrect -> 0x7c33), seq 12226:15712, ack 862, win 512, options [nop,nop,TS val 402909418 ecr 402909411], length 3486
2022-04-07 08:37:06.915530 IP (tos 0x0, ttl 64, id 45957, offset 0, flags [DF], proto TCP (6), length 52)
    127.0.0.1.49218 > 127.0.0.1.9250: Flags [.], cksum 0xfe28 (incorrect -> 0x113c), seq 862, ack 15712, win 494, options [nop,nop,TS val 402909418 ecr 402909418], length 0
2022-04-07 08:37:06.915753 IP (tos 0x0, ttl 64, id 29203, offset 0, flags [DF], proto TCP (6), length 2672)
    127.0.0.1.9250 > 127.0.0.1.49218: Flags [P.], cksum 0x0865 (incorrect -> 0x1df3), seq 15712:18332, ack 862, win 512, options [nop,nop,TS val 402909418 ecr 402909418], length 2620
2022-04-07 08:37:06.915759 IP (tos 0x0, ttl 64, id 45958, offset 0, flags [DF], proto TCP (6), length 52)
    127.0.0.1.49218 > 127.0.0.1.9250: Flags [.], cksum 0xfe28 (incorrect -> 0x06fd), seq 862, ack 18332, win 497, options [nop,nop,TS val 402909418 ecr 402909418], length 0
2022-04-07 08:37:06.918475 IP (tos 0x0, ttl 64, id 29204, offset 0, flags [DF], proto TCP (6), length 1048)
    127.0.0.1.9250 > 127.0.0.1.49218: Flags [P.], cksum 0x020d (incorrect -> 0xe8ee), seq 18332:19328, ack 862, win 512, options [nop,nop,TS val 402909421 ecr 402909418], length 996
2022-04-07 08:37:06.918480 IP (tos 0x0, ttl 64, id 45959, offset 0, flags [DF], proto TCP (6), length 52)
    127.0.0.1.49218 > 127.0.0.1.9250: Flags [.], cksum 0xfe28 (incorrect -> 0x030c), seq 862, ack 19328, win 504, options [nop,nop,TS val 402909421 ecr 402909421], length 0
2022-04-07 08:37:06.921576 IP (tos 0x0, ttl 64, id 29205, offset 0, flags [DF], proto TCP (6), length 2882)
    127.0.0.1.9250 > 127.0.0.1.49218: Flags [P.], cksum 0x0937 (incorrect -> 0xd776), seq 19328:22158, ack 862, win 512, options [nop,nop,TS val 402909424 ecr 402909421], length 2830
2022-04-07 08:37:06.921582 IP (tos 0x0, ttl 64, id 45960, offset 0, flags [DF], proto TCP (6), length 52)
    127.0.0.1.49218 > 127.0.0.1.9250: Flags [.], cksum 0xfe28 (incorrect -> 0xf7ff), seq 862, ack 22158, win 496, options [nop,nop,TS val 402909424 ecr 402909424], length 0
2022-04-07 08:37:07.054397 IP (tos 0x0, ttl 64, id 29206, offset 0, flags [DF], proto TCP (6), length 1048)
    127.0.0.1.9250 > 127.0.0.1.49218: Flags [P.], cksum 0x020d (incorrect -> 0x57a1), seq 22158:23154, ack 862, win 512, options [nop,nop,TS val 402909557 ecr 402909424], length 996
2022-04-07 08:37:07.054408 IP (tos 0x0, ttl 64, id 45961, offset 0, flags [DF], proto TCP (6), length 52)
    127.0.0.1.49218 > 127.0.0.1.9250: Flags [.], cksum 0xfe28 (incorrect -> 0xf309), seq 862, ack 23154, win 504, options [nop,nop,TS val 402909557 ecr 402909557], length 0
2022-04-07 08:37:07.061765 IP (tos 0x0, ttl 64, id 29207, offset 0, flags [DF], proto TCP (6), length 3538)
    127.0.0.1.9250 > 127.0.0.1.49218: Flags [P.], cksum 0x0bc7 (incorrect -> 0xd5b8), seq 23154:26640, ack 862, win 512, options [nop,nop,TS val 402909564 ecr 402909557], length 3486
2022-04-07 08:37:07.061779 IP (tos 0x0, ttl 64, id 45962, offset 0, flags [DF], proto TCP (6), length 52)
    127.0.0.1.49218 > 127.0.0.1.9250: Flags [.], cksum 0xfe28 (incorrect -> 0xe567), seq 862, ack 26640, win 494, options [nop,nop,TS val 402909564 ecr 402909564], length 0
2022-04-07 08:37:07.066950 IP (tos 0x0, ttl 64, id 29208, offset 0, flags [DF], proto TCP (6), length 4036)
    127.0.0.1.9250 > 127.0.0.1.49218: Flags [P.], cksum 0x0db9 (incorrect -> 0xb644), seq 26640:30624, ack 862, win 512, options [nop,nop,TS val 402909569 ecr 402909564], length 3984
2022-04-07 08:37:07.066977 IP (tos 0x0, ttl 64, id 45963, offset 0, flags [DF], proto TCP (6), length 52)
    127.0.0.1.49218 > 127.0.0.1.9250: Flags [.], cksum 0xfe28 (incorrect -> 0xd5bb), seq 862, ack 30624, win 512, options [nop,nop,TS val 402909569 ecr 402909569], length 0
2022-04-07 08:37:07.200931 IP (tos 0x0, ttl 64, id 29209, offset 0, flags [DF], proto TCP (6), length 3538)
    127.0.0.1.9250 > 127.0.0.1.49218: Flags [P.], cksum 0x0bc7 (incorrect -> 0x600b), seq 30624:34110, ack 862, win 512, options [nop,nop,TS val 402909703 ecr 402909569], length 3486
2022-04-07 08:37:07.200956 IP (tos 0x0, ttl 64, id 45964, offset 0, flags [DF], proto TCP (6), length 52)
    127.0.0.1.49218 > 127.0.0.1.9250: Flags [.], cksum 0xfe28 (incorrect -> 0xc711), seq 862, ack 34110, win 512, options [nop,nop,TS val 402909703 ecr 402909703], length 0
2022-04-07 08:37:07.205419 IP (tos 0x0, ttl 64, id 29210, offset 0, flags [DF], proto TCP (6), length 1546)
    127.0.0.1.9250 > 127.0.0.1.49218: Flags [P.], cksum 0x03ff (incorrect -> 0x2153), seq 34110:35604, ack 862, win 512, options [nop,nop,TS val 402909708 ecr 402909703], length 1494
2022-04-07 08:37:07.205434 IP (tos 0x0, ttl 64, id 45965, offset 0, flags [DF], proto TCP (6), length 52)
    127.0.0.1.49218 > 127.0.0.1.9250: Flags [.], cksum 0xfe28 (incorrect -> 0xc131), seq 862, ack 35604, win 512, options [nop,nop,TS val 402909708 ecr 402909708], length 0
2022-04-07 08:37:07.206798 IP (tos 0x0, ttl 64, id 29211, offset 0, flags [DF], proto TCP (6), length 3538)
    127.0.0.1.9250 > 127.0.0.1.49218: Flags [P.], cksum 0x0bc7 (incorrect -> 0xec71), seq 35604:39090, ack 862, win 512, options [nop,nop,TS val 402909709 ecr 402909708], length 3486
2022-04-07 08:37:07.207357 IP (tos 0x0, ttl 64, id 45966, offset 0, flags [DF], proto TCP (6), length 52)
    127.0.0.1.49218 > 127.0.0.1.9250: Flags [.], cksum 0xfe28 (incorrect -> 0xb390), seq 862, ack 39090, win 512, options [nop,nop,TS val 402909710 ecr 402909709], length 0
2022-04-07 08:37:07.213594 IP (tos 0x0, ttl 64, id 29212, offset 0, flags [DF], proto TCP (6), length 4100)
    127.0.0.1.9250 > 127.0.0.1.49218: Flags [P.], cksum 0x0df9 (incorrect -> 0xeab7), seq 39090:43138, ack 862, win 512, options [nop,nop,TS val 402909716 ecr 402909710], length 4048
2022-04-07 08:37:07.254671 IP (tos 0x0, ttl 64, id 45967, offset 0, flags [DF], proto TCP (6), length 52)
    127.0.0.1.49218 > 127.0.0.1.9250: Flags [.], cksum 0xfe28 (incorrect -> 0xa38a), seq 862, ack 43138, win 512, options [nop,nop,TS val 402909757 ecr 402909716], length 0
2022-04-07 08:37:07.254685 IP (tos 0x0, ttl 64, id 29213, offset 0, flags [DF], proto TCP (6), length 486)
    127.0.0.1.9250 > 127.0.0.1.49218: Flags [P.], cksum 0xffda (incorrect -> 0x0e2f), seq 43138:43572, ack 862, win 512, options [nop,nop,TS val 402909757 ecr 402909757], length 434
2022-04-07 08:37:07.254732 IP (tos 0x0, ttl 64, id 45968, offset 0, flags [DF], proto TCP (6), length 52)
    127.0.0.1.49218 > 127.0.0.1.9250: Flags [.], cksum 0xfe28 (incorrect -> 0xa1af), seq 862, ack 43572, win 512, options [nop,nop,TS val 402909757 ecr 402909757], length 0
2022-04-07 08:37:07.349063 IP (tos 0x0, ttl 64, id 29214, offset 0, flags [DF], proto TCP (6), length 3538)
    127.0.0.1.9250 > 127.0.0.1.49218: Flags [P.], cksum 0x0bc7 (incorrect -> 0x4782), seq 43572:47058, ack 862, win 512, options [nop,nop,TS val 402909852 ecr 402909757], length 3486
2022-04-07 08:37:07.349085 IP (tos 0x0, ttl 64, id 45969, offset 0, flags [DF], proto TCP (6), length 52)
    127.0.0.1.49218 > 127.0.0.1.9250: Flags [.], cksum 0xfe28 (incorrect -> 0x9353), seq 862, ack 47058, win 512, options [nop,nop,TS val 402909852 ecr 402909852], length 0
2022-04-07 08:37:07.361721 IP (tos 0x0, ttl 64, id 29215, offset 0, flags [DF], proto TCP (6), length 1048)
    127.0.0.1.9250 > 127.0.0.1.49218: Flags [P.], cksum 0x020d (incorrect -> 0xb8d1), seq 47058:48054, ack 862, win 512, options [nop,nop,TS val 402909864 ecr 402909852], length 996
2022-04-07 08:37:07.361735 IP (tos 0x0, ttl 64, id 45970, offset 0, flags [DF], proto TCP (6), length 52)
    127.0.0.1.49218 > 127.0.0.1.9250: Flags [.], cksum 0xfe28 (incorrect -> 0x8f57), seq 862, ack 48054, win 512, options [nop,nop,TS val 402909864 ecr 402909864], length 0
2022-04-07 08:37:07.363638 IP (tos 0x0, ttl 64, id 29216, offset 0, flags [DF], proto TCP (6), length 4100)
    127.0.0.1.9250 > 127.0.0.1.49218: Flags [P.], cksum 0x0df9 (incorrect -> 0xe03c), seq 48054:52102, ack 862, win 512, options [nop,nop,TS val 402909866 ecr 402909864], length 4048
2022-04-07 08:37:07.410654 IP (tos 0x0, ttl 64, id 45971, offset 0, flags [DF], proto TCP (6), length 52)
    127.0.0.1.49218 > 127.0.0.1.9250: Flags [.], cksum 0xfe28 (incorrect -> 0x7f54), seq 862, ack 52102, win 512, options [nop,nop,TS val 402909913 ecr 402909866], length 0
2022-04-07 08:37:07.410662 IP (tos 0x0, ttl 64, id 29217, offset 0, flags [DF], proto TCP (6), length 7376)
    127.0.0.1.9250 > 127.0.0.1.49218: Flags [P.], cksum 0x1ac5 (incorrect -> 0xe1e8), seq 52102:59426, ack 862, win 512, options [nop,nop,TS val 402909913 ecr 402909913], length 7324
2022-04-07 08:37:07.458658 IP (tos 0x0, ttl 64, id 45972, offset 0, flags [DF], proto TCP (6), length 52)
    127.0.0.1.49218 > 127.0.0.1.9250: Flags [.], cksum 0xfe28 (incorrect -> 0x6259), seq 862, ack 59426, win 512, options [nop,nop,TS val 402909961 ecr 402909913], length 0
2022-04-07 08:37:07.495543 IP (tos 0x0, ttl 64, id 29218, offset 0, flags [DF], proto TCP (6), length 1546)
    127.0.0.1.9250 > 127.0.0.1.49218: Flags [P.], cksum 0x03ff (incorrect -> 0x1b0d), seq 59426:60920, ack 862, win 512, options [nop,nop,TS val 402909998 ecr 402909961], length 1494
2022-04-07 08:37:07.495564 IP (tos 0x0, ttl 64, id 45973, offset 0, flags [DF], proto TCP (6), length 52)
    127.0.0.1.49218 > 127.0.0.1.9250: Flags [.], cksum 0xfe28 (incorrect -> 0x5c09), seq 862, ack 60920, win 512, options [nop,nop,TS val 402909998 ecr 402909998], length 0
2022-04-07 08:37:07.509107 IP (tos 0x0, ttl 64, id 29219, offset 0, flags [DF], proto TCP (6), length 4100)
    127.0.0.1.9250 > 127.0.0.1.49218: Flags [P.], cksum 0x0df9 (incorrect -> 0xccda), seq 60920:64968, ack 862, win 512, options [nop,nop,TS val 402910012 ecr 402909998], length 4048
2022-04-07 08:37:07.509176 IP (tos 0x0, ttl 64, id 45974, offset 0, flags [DF], proto TCP (6), length 52)
    127.0.0.1.49218 > 127.0.0.1.9250: Flags [.], cksum 0xfe28 (incorrect -> 0x4c1d), seq 862, ack 64968, win 512, options [nop,nop,TS val 402910012 ecr 402910012], length 0
2022-04-07 08:37:07.509191 IP (tos 0x0, ttl 64, id 29220, offset 0, flags [DF], proto TCP (6), length 3474)
    127.0.0.1.9250 > 127.0.0.1.49218: Flags [P.], cksum 0x0b87 (incorrect -> 0x5143), seq 64968:68390, ack 862, win 512, options [nop,nop,TS val 402910012 ecr 402910012], length 3422
2022-04-07 08:37:07.509197 IP (tos 0x0, ttl 64, id 45975, offset 0, flags [DF], proto TCP (6), length 52)
    127.0.0.1.49218 > 127.0.0.1.9250: Flags [.], cksum 0xfe28 (incorrect -> 0x3ebf), seq 862, ack 68390, win 512, options [nop,nop,TS val 402910012 ecr 402910012], length 0
2022-04-07 08:37:07.521813 IP (tos 0x0, ttl 64, id 29221, offset 0, flags [DF], proto TCP (6), length 2542)
    127.0.0.1.9250 > 127.0.0.1.49218: Flags [P.], cksum 0x07e3 (incorrect -> 0xcc28), seq 68390:70880, ack 862, win 512, options [nop,nop,TS val 402910024 ecr 402910012], length 2490
2022-04-07 08:37:07.522372 IP (tos 0x0, ttl 64, id 45976, offset 0, flags [DF], proto TCP (6), length 52)
    127.0.0.1.49218 > 127.0.0.1.9250: Flags [.], cksum 0xfe28 (incorrect -> 0x34ec), seq 862, ack 70880, win 512, options [nop,nop,TS val 402910025 ecr 402910024], length 0
2022-04-07 08:37:07.640350 IP (tos 0x0, ttl 64, id 29222, offset 0, flags [DF], proto TCP (6), length 2542)
    127.0.0.1.9250 > 127.0.0.1.49218: Flags [P.], cksum 0x07e3 (incorrect -> 0x91f4), seq 70880:73370, ack 862, win 512, options [nop,nop,TS val 402910143 ecr 402910025], length 2490
2022-04-07 08:37:07.682648 IP (tos 0x0, ttl 64, id 45977, offset 0, flags [DF], proto TCP (6), length 52)
    127.0.0.1.49218 > 127.0.0.1.9250: Flags [.], cksum 0xfe28 (incorrect -> 0x2a1b), seq 862, ack 73370, win 512, options [nop,nop,TS val 402910185 ecr 402910143], length 0
2022-04-07 08:37:07.682657 IP (tos 0x0, ttl 64, id 29223, offset 0, flags [DF], proto TCP (6), length 14976)
    127.0.0.1.9250 > 127.0.0.1.49218: Flags [P.], cksum 0x3875 (incorrect -> 0x48d8), seq 73370:88294, ack 862, win 512, options [nop,nop,TS val 402910185 ecr 402910185], length 14924
2022-04-07 08:37:07.726649 IP (tos 0x0, ttl 64, id 45978, offset 0, flags [DF], proto TCP (6), length 52)
    127.0.0.1.49218 > 127.0.0.1.9250: Flags [.], cksum 0xfe28 (incorrect -> 0xef78), seq 862, ack 88294, win 512, options [nop,nop,TS val 402910229 ecr 402910185], length 0
2022-04-07 08:37:07.786269 IP (tos 0x0, ttl 64, id 29224, offset 0, flags [DF], proto TCP (6), length 3040)
    127.0.0.1.9250 > 127.0.0.1.49218: Flags [P.], cksum 0x09d5 (incorrect -> 0x3a52), seq 88294:91282, ack 862, win 512, options [nop,nop,TS val 402910289 ecr 402910229], length 2988
2022-04-07 08:37:07.786285 IP (tos 0x0, ttl 64, id 45979, offset 0, flags [DF], proto TCP (6), length 52)
    127.0.0.1.49218 > 127.0.0.1.9250: Flags [.], cksum 0xfe28 (incorrect -> 0xe328), seq 862, ack 91282, win 512, options [nop,nop,TS val 402910289 ecr 402910289], length 0
2022-04-07 08:37:07.801073 IP (tos 0x0, ttl 64, id 29225, offset 0, flags [DF], proto TCP (6), length 3538)
    127.0.0.1.9250 > 127.0.0.1.49218: Flags [P.], cksum 0x0bc7 (incorrect -> 0xdf81), seq 91282:94768, ack 862, win 512, options [nop,nop,TS val 402910304 ecr 402910289], length 3486
2022-04-07 08:37:07.801086 IP (tos 0x0, ttl 64, id 45980, offset 0, flags [DF], proto TCP (6), length 52)
    127.0.0.1.49218 > 127.0.0.1.9250: Flags [.], cksum 0xfe28 (incorrect -> 0xd56c), seq 862, ack 94768, win 512, options [nop,nop,TS val 402910304 ecr 402910304], length 0
2022-04-07 08:37:07.813819 IP (tos 0x0, ttl 64, id 29226, offset 0, flags [DF], proto TCP (6), length 4036)
    127.0.0.1.9250 > 127.0.0.1.49218: Flags [P.], cksum 0x0db9 (incorrect -> 0x11e0), seq 94768:98752, ack 862, win 512, options [nop,nop,TS val 402910316 ecr 402910304], length 3984
2022-04-07 08:37:07.813862 IP (tos 0x0, ttl 64, id 45981, offset 0, flags [DF], proto TCP (6), length 52)
    127.0.0.1.49218 > 127.0.0.1.9250: Flags [.], cksum 0xfe28 (incorrect -> 0xc5c4), seq 862, ack 98752, win 512, options [nop,nop,TS val 402910316 ecr 402910316], length 0
200, 5.973625421524048, 2.474942207336426