2022-04-07 18:17:23.115664 IP (tos 0x0, ttl 64, id 15714, offset 0, flags [DF], proto TCP (6), length 60)
    127.0.0.1.52420 > 127.0.0.1.11850: Flags [S], cksum 0xfe30 (incorrect -> 0xb653), seq 3003101220, win 65495, options [mss 65495,sackOK,TS val 3511642667 ecr 0,nop,wscale 7], length 0
2022-04-07 18:17:23.115674 IP (tos 0x0, ttl 64, id 0, offset 0, flags [DF], proto TCP (6), length 60)
    127.0.0.1.11850 > 127.0.0.1.52420: Flags [S.], cksum 0xfe30 (incorrect -> 0xa785), seq 2995134663, ack 3003101221, win 65483, options [mss 65495,sackOK,TS val 3511642667 ecr 3511642667,nop,wscale 7], length 0
2022-04-07 18:17:23.115681 IP (tos 0x0, ttl 64, id 15715, offset 0, flags [DF], proto TCP (6), length 52)
    127.0.0.1.52420 > 127.0.0.1.11850: Flags [.], cksum 0xfe28 (incorrect -> 0xce41), seq 1, ack 1, win 512, options [nop,nop,TS val 3511642667 ecr 3511642667], length 0
2022-04-07 18:17:23.115769 IP (tos 0x0, ttl 64, id 15716, offset 0, flags [DF], proto TCP (6), length 55)
    127.0.0.1.52420 > 127.0.0.1.11850: Flags [P.], cksum 0xfe2b (incorrect -> 0xc935), seq 1:4, ack 1, win 512, options [nop,nop,TS val 3511642667 ecr 3511642667], length 3
2022-04-07 18:17:23.115772 IP (tos 0x0, ttl 64, id 10217, offset 0, flags [DF], proto TCP (6), length 52)
    127.0.0.1.11850 > 127.0.0.1.52420: Flags [.], cksum 0xfe28 (incorrect -> 0xce3e), seq 1, ack 4, win 512, options [nop,nop,TS val 3511642667 ecr 3511642667], length 0
2022-04-07 18:17:23.115835 IP (tos 0x0, ttl 64, id 10218, offset 0, flags [DF], proto TCP (6), length 54)
    127.0.0.1.11850 > 127.0.0.1.52420: Flags [P.], cksum 0xfe2a (incorrect -> 0xc934), seq 1:3, ack 4, win 512, options [nop,nop,TS val 3511642667 ecr 3511642667], length 2
2022-04-07 18:17:23.115840 IP (tos 0x0, ttl 64, id 15717, offset 0, flags [DF], proto TCP (6), length 52)
    127.0.0.1.52420 > 127.0.0.1.11850: Flags [.], cksum 0xfe28 (incorrect -> 0xce3c), seq 4, ack 3, win 512, options [nop,nop,TS val 3511642667 ecr 3511642667], length 0
2022-04-07 18:17:23.117204 IP (tos 0x0, ttl 64, id 15718, offset 0, flags [DF], proto TCP (6), length 62)
    127.0.0.1.52420 > 127.0.0.1.11850: Flags [P.], cksum 0xfe32 (incorrect -> 0xf71c), seq 4:14, ack 3, win 512, options [nop,nop,TS val 3511642668 ecr 3511642667], length 10
2022-04-07 18:17:23.117211 IP (tos 0x0, ttl 64, id 10219, offset 0, flags [DF], proto TCP (6), length 52)
    127.0.0.1.11850 > 127.0.0.1.52420: Flags [.], cksum 0xfe28 (incorrect -> 0xce30), seq 3, ack 14, win 512, options [nop,nop,TS val 3511642668 ecr 3511642668], length 0
2022-04-07 18:17:23.530474 IP (tos 0x0, ttl 64, id 10220, offset 0, flags [DF], proto TCP (6), length 62)
    127.0.0.1.11850 > 127.0.0.1.52420: Flags [P.], cksum 0xfe32 (incorrect -> 0xc77f), seq 3:13, ack 14, win 512, options [nop,nop,TS val 3511643082 ecr 3511642668], length 10
2022-04-07 18:17:23.530482 IP (tos 0x0, ttl 64, id 15719, offset 0, flags [DF], proto TCP (6), length 52)
    127.0.0.1.52420 > 127.0.0.1.11850: Flags [.], cksum 0xfe28 (incorrect -> 0xcaea), seq 14, ack 13, win 512, options [nop,nop,TS val 3511643082 ecr 3511643082], length 0
2022-04-07 18:17:23.535790 IP (tos 0x0, ttl 64, id 15720, offset 0, flags [DF], proto TCP (6), length 569)
    127.0.0.1.52420 > 127.0.0.1.11850: Flags [P.], cksum 0x002e (incorrect -> 0x71d3), seq 14:531, ack 13, win 512, options [nop,nop,TS val 3511643087 ecr 3511643082], length 517
2022-04-07 18:17:23.535798 IP (tos 0x0, ttl 64, id 10221, offset 0, flags [DF], proto TCP (6), length 52)
    127.0.0.1.11850 > 127.0.0.1.52420: Flags [.], cksum 0xfe28 (incorrect -> 0xc8df), seq 13, ack 531, win 508, options [nop,nop,TS val 3511643087 ecr 3511643087], length 0
2022-04-07 18:17:23.790268 IP (tos 0x0, ttl 64, id 10222, offset 0, flags [DF], proto TCP (6), length 3538)
    127.0.0.1.11850 > 127.0.0.1.52420: Flags [P.], cksum 0x0bc7 (incorrect -> 0x5048), seq 13:3499, ack 531, win 512, options [nop,nop,TS val 3511643342 ecr 3511643087], length 3486
2022-04-07 18:17:23.790274 IP (tos 0x0, ttl 64, id 15721, offset 0, flags [DF], proto TCP (6), length 52)
    127.0.0.1.52420 > 127.0.0.1.11850: Flags [.], cksum 0xfe28 (incorrect -> 0xb951), seq 531, ack 3499, win 494, options [nop,nop,TS val 3511643342 ecr 3511643342], length 0
2022-04-07 18:17:23.799696 IP (tos 0x0, ttl 64, id 10223, offset 0, flags [DF], proto TCP (6), length 662)
    127.0.0.1.11850 > 127.0.0.1.52420: Flags [P.], cksum 0x008b (incorrect -> 0xcfc0), seq 3499:4109, ack 531, win 512, options [nop,nop,TS val 3511643351 ecr 3511643342], length 610
2022-04-07 18:17:23.799700 IP (tos 0x0, ttl 64, id 15722, offset 0, flags [DF], proto TCP (6), length 52)
    127.0.0.1.52420 > 127.0.0.1.11850: Flags [.], cksum 0xfe28 (incorrect -> 0xb6d2), seq 531, ack 4109, win 505, options [nop,nop,TS val 3511643351 ecr 3511643351], length 0
2022-04-07 18:17:23.817351 IP (tos 0x0, ttl 64, id 10224, offset 0, flags [DF], proto TCP (6), length 927)
    127.0.0.1.11850 > 127.0.0.1.52420: Flags [P.], cksum 0x0194 (incorrect -> 0xb2b5), seq 4109:4984, ack 531, win 512, options [nop,nop,TS val 3511643369 ecr 3511643351], length 875
2022-04-07 18:17:23.817355 IP (tos 0x0, ttl 64, id 15723, offset 0, flags [DF], proto TCP (6), length 52)
    127.0.0.1.52420 > 127.0.0.1.11850: Flags [.], cksum 0xfe28 (incorrect -> 0xb344), seq 531, ack 4984, win 504, options [nop,nop,TS val 3511643369 ecr 3511643369], length 0
2022-04-07 18:17:23.817885 IP (tos 0x0, ttl 64, id 15724, offset 0, flags [DF], proto TCP (6), length 145)
    127.0.0.1.52420 > 127.0.0.1.11850: Flags [P.], cksum 0xfe85 (incorrect -> 0x81c7), seq 531:624, ack 4984, win 512, options [nop,nop,TS val 3511643369 ecr 3511643369], length 93
2022-04-07 18:17:23.817892 IP (tos 0x0, ttl 64, id 10225, offset 0, flags [DF], proto TCP (6), length 52)
    127.0.0.1.11850 > 127.0.0.1.52420: Flags [.], cksum 0xfe28 (incorrect -> 0xb2df), seq 4984, ack 624, win 512, options [nop,nop,TS val 3511643369 ecr 3511643369], length 0
2022-04-07 18:17:24.011294 IP (tos 0x0, ttl 64, id 10226, offset 0, flags [DF], proto TCP (6), length 326)
    127.0.0.1.11850 > 127.0.0.1.52420: Flags [P.], cksum 0xff3a (incorrect -> 0xe9a5), seq 4984:5258, ack 624, win 512, options [nop,nop,TS val 3511643563 ecr 3511643369], length 274
2022-04-07 18:17:24.011300 IP (tos 0x0, ttl 64, id 15725, offset 0, flags [DF], proto TCP (6), length 52)
    127.0.0.1.52420 > 127.0.0.1.11850: Flags [.], cksum 0xfe28 (incorrect -> 0xb04b), seq 624, ack 5258, win 510, options [nop,nop,TS val 3511643563 ecr 3511643563], length 0
2022-04-07 18:17:24.011677 IP (tos 0x0, ttl 64, id 15726, offset 0, flags [DF], proto TCP (6), length 316)
    127.0.0.1.52420 > 127.0.0.1.11850: Flags [P.], cksum 0xff30 (incorrect -> 0x469d), seq 624:888, ack 5258, win 512, options [nop,nop,TS val 3511643563 ecr 3511643563], length 264
2022-04-07 18:17:24.011684 IP (tos 0x0, ttl 64, id 10227, offset 0, flags [DF], proto TCP (6), length 52)
    127.0.0.1.11850 > 127.0.0.1.52420: Flags [.], cksum 0xfe28 (incorrect -> 0xaf43), seq 5258, ack 888, win 510, options [nop,nop,TS val 3511643563 ecr 3511643563], length 0
2022-04-07 18:17:24.231052 IP (tos 0x0, ttl 64, id 10228, offset 0, flags [DF], proto TCP (6), length 4100)
    127.0.0.1.11850 > 127.0.0.1.52420: Flags [P.], cksum 0x0df9 (incorrect -> 0xe40e), seq 5258:9306, ack 888, win 512, options [nop,nop,TS val 3511643782 ecr 3511643563], length 4048
2022-04-07 18:17:24.274793 IP (tos 0x0, ttl 64, id 15727, offset 0, flags [DF], proto TCP (6), length 52)
    127.0.0.1.52420 > 127.0.0.1.11850: Flags [.], cksum 0xfe28 (incorrect -> 0x9d8f), seq 888, ack 9306, win 512, options [nop,nop,TS val 3511643826 ecr 3511643782], length 0
2022-04-07 18:17:24.274804 IP (tos 0x0, ttl 64, id 10229, offset 0, flags [DF], proto TCP (6), length 7458)
    127.0.0.1.11850 > 127.0.0.1.52420: Flags [P.], cksum 0x1b17 (incorrect -> 0x8e5a), seq 9306:16712, ack 888, win 512, options [nop,nop,TS val 3511643826 ecr 3511643826], length 7406
2022-04-07 18:17:24.274811 IP (tos 0x0, ttl 64, id 15728, offset 0, flags [DF], proto TCP (6), length 52)
    127.0.0.1.52420 > 127.0.0.1.11850: Flags [.], cksum 0xfe28 (incorrect -> 0x8096), seq 888, ack 16712, win 479, options [nop,nop,TS val 3511643826 ecr 3511643826], length 0
2022-04-07 18:17:24.280337 IP (tos 0x0, ttl 64, id 10230, offset 0, flags [DF], proto TCP (6), length 3078)
    127.0.0.1.11850 > 127.0.0.1.52420: Flags [P.], cksum 0x09fb (incorrect -> 0x7fc5), seq 16712:19738, ack 888, win 512, options [nop,nop,TS val 3511643832 ecr 3511643826], length 3026
2022-04-07 18:17:24.280341 IP (tos 0x0, ttl 64, id 15729, offset 0, flags [DF], proto TCP (6), length 52)
    127.0.0.1.52420 > 127.0.0.1.11850: Flags [.], cksum 0xfe28 (incorrect -> 0x74a7), seq 888, ack 19738, win 496, options [nop,nop,TS val 3511643832 ecr 3511643832], length 0
2022-04-07 18:17:24.312779 IP (tos 0x0, ttl 64, id 10231, offset 0, flags [DF], proto TCP (6), length 4100)
    127.0.0.1.11850 > 127.0.0.1.52420: Flags [P.], cksum 0x0df9 (incorrect -> 0x2b91), seq 19738:23786, ack 888, win 512, options [nop,nop,TS val 3511643864 ecr 3511643832], length 4048
2022-04-07 18:17:24.312785 IP (tos 0x0, ttl 64, id 15730, offset 0, flags [DF], proto TCP (6), length 52)
    127.0.0.1.52420 > 127.0.0.1.11850: Flags [.], cksum 0xfe28 (incorrect -> 0x649b), seq 888, ack 23786, win 492, options [nop,nop,TS val 3511643864 ecr 3511643864], length 0
2022-04-07 18:17:24.312790 IP (tos 0x0, ttl 64, id 10232, offset 0, flags [DF], proto TCP (6), length 486)
    127.0.0.1.11850 > 127.0.0.1.52420: Flags [P.], cksum 0xffda (incorrect -> 0x9ebf), seq 23786:24220, ack 888, win 512, options [nop,nop,TS val 3511643864 ecr 3511643864], length 434
2022-04-07 18:17:24.312792 IP (tos 0x0, ttl 64, id 15731, offset 0, flags [DF], proto TCP (6), length 52)
    127.0.0.1.52420 > 127.0.0.1.11850: Flags [.], cksum 0xfe28 (incorrect -> 0x62eb), seq 888, ack 24220, win 490, options [nop,nop,TS val 3511643864 ecr 3511643864], length 0
2022-04-07 18:17:24.313523 IP (tos 0x0, ttl 64, id 10233, offset 0, flags [DF], proto TCP (6), length 4100)
    127.0.0.1.11850 > 127.0.0.1.52420: Flags [P.], cksum 0x0df9 (incorrect -> 0x0983), seq 24220:28268, ack 888, win 512, options [nop,nop,TS val 3511643865 ecr 3511643864], length 4048
2022-04-07 18:17:24.313528 IP (tos 0x0, ttl 64, id 15732, offset 0, flags [DF], proto TCP (6), length 52)
    127.0.0.1.52420 > 127.0.0.1.11850: Flags [.], cksum 0xfe28 (incorrect -> 0x5329), seq 888, ack 28268, win 474, options [nop,nop,TS val 3511643865 ecr 3511643865], length 0
2022-04-07 18:17:24.313533 IP (tos 0x0, ttl 64, id 10234, offset 0, flags [DF], proto TCP (6), length 486)
    127.0.0.1.11850 > 127.0.0.1.52420: Flags [P.], cksum 0xffda (incorrect -> 0xbba1), seq 28268:28702, ack 888, win 512, options [nop,nop,TS val 3511643865 ecr 3511643865], length 434
2022-04-07 18:17:24.313535 IP (tos 0x0, ttl 64, id 15733, offset 0, flags [DF], proto TCP (6), length 52)
    127.0.0.1.52420 > 127.0.0.1.11850: Flags [.], cksum 0xfe28 (incorrect -> 0x5179), seq 888, ack 28702, win 472, options [nop,nop,TS val 3511643865 ecr 3511643865], length 0
2022-04-07 18:17:24.314123 IP (tos 0x0, ttl 64, id 10235, offset 0, flags [DF], proto TCP (6), length 4100)
    127.0.0.1.11850 > 127.0.0.1.52420: Flags [P.], cksum 0x0df9 (incorrect -> 0x6af6), seq 28702:32750, ack 888, win 512, options [nop,nop,TS val 3511643865 ecr 3511643865], length 4048
2022-04-07 18:17:24.314128 IP (tos 0x0, ttl 64, id 15734, offset 0, flags [DF], proto TCP (6), length 52)
    127.0.0.1.52420 > 127.0.0.1.11850: Flags [.], cksum 0xfe28 (incorrect -> 0x4195), seq 888, ack 32750, win 492, options [nop,nop,TS val 3511643865 ecr 3511643865], length 0
2022-04-07 18:17:24.314132 IP (tos 0x0, ttl 64, id 10236, offset 0, flags [DF], proto TCP (6), length 486)
    127.0.0.1.11850 > 127.0.0.1.52420: Flags [P.], cksum 0xffda (incorrect -> 0x79f1), seq 32750:33184, ack 888, win 512, options [nop,nop,TS val 3511643865 ecr 3511643865], length 434
2022-04-07 18:17:24.314146 IP (tos 0x0, ttl 64, id 15735, offset 0, flags [DF], proto TCP (6), length 52)
    127.0.0.1.52420 > 127.0.0.1.11850: Flags [.], cksum 0xfe28 (incorrect -> 0x3fcf), seq 888, ack 33184, win 512, options [nop,nop,TS val 3511643865 ecr 3511643865], length 0
2022-04-07 18:17:24.317166 IP (tos 0x0, ttl 64, id 10237, offset 0, flags [DF], proto TCP (6), length 2542)
    127.0.0.1.11850 > 127.0.0.1.52420: Flags [P.], cksum 0x07e3 (incorrect -> 0xb6df), seq 33184:35674, ack 888, win 512, options [nop,nop,TS val 3511643868 ecr 3511643865], length 2490
2022-04-07 18:17:24.317197 IP (tos 0x0, ttl 64, id 15736, offset 0, flags [DF], proto TCP (6), length 52)
    127.0.0.1.52420 > 127.0.0.1.11850: Flags [.], cksum 0xfe28 (incorrect -> 0x360f), seq 888, ack 35674, win 512, options [nop,nop,TS val 3511643868 ecr 3511643868], length 0
2022-04-07 18:17:24.322254 IP (tos 0x0, ttl 64, id 10238, offset 0, flags [DF], proto TCP (6), length 4100)
    127.0.0.1.11850 > 127.0.0.1.52420: Flags [P.], cksum 0x0df9 (incorrect -> 0x39c3), seq 35674:39722, ack 888, win 512, options [nop,nop,TS val 3511643874 ecr 3511643868], length 4048
2022-04-07 18:17:24.322738 IP (tos 0x0, ttl 64, id 15737, offset 0, flags [DF], proto TCP (6), length 52)
    127.0.0.1.52420 > 127.0.0.1.11850: Flags [.], cksum 0xfe28 (incorrect -> 0x2633), seq 888, ack 39722, win 512, options [nop,nop,TS val 3511643874 ecr 3511643874], length 0
2022-04-07 18:17:24.322742 IP (tos 0x0, ttl 64, id 10239, offset 0, flags [DF], proto TCP (6), length 3474)
    127.0.0.1.11850 > 127.0.0.1.52420: Flags [P.], cksum 0x0b87 (incorrect -> 0x00fe), seq 39722:43144, ack 888, win 512, options [nop,nop,TS val 3511643874 ecr 3511643874], length 3422
2022-04-07 18:17:24.322745 IP (tos 0x0, ttl 64, id 15738, offset 0, flags [DF], proto TCP (6), length 52)
    127.0.0.1.52420 > 127.0.0.1.11850: Flags [.], cksum 0xfe28 (incorrect -> 0x18d5), seq 888, ack 43144, win 512, options [nop,nop,TS val 3511643874 ecr 3511643874], length 0
200, 7.551715135574341, 1.3618965148925781