2022-04-07 20:16:21.418729 IP (tos 0x0, ttl 64, id 57980, offset 0, flags [DF], proto TCP (6), length 60)
    127.0.0.1.33660 > 127.0.0.1.12150: Flags [S], cksum 0xfe30 (incorrect -> 0xb595), seq 26656252, win 65495, options [mss 65495,sackOK,TS val 3518780970 ecr 0,nop,wscale 7], length 0
2022-04-07 20:16:21.418739 IP (tos 0x0, ttl 64, id 0, offset 0, flags [DF], proto TCP (6), length 60)
    127.0.0.1.12150 > 127.0.0.1.33660: Flags [S.], cksum 0xfe30 (incorrect -> 0x32d8), seq 1230442874, ack 26656253, win 65483, options [mss 65495,sackOK,TS val 3518780970 ecr 3518780970,nop,wscale 7], length 0
2022-04-07 20:16:21.418747 IP (tos 0x0, ttl 64, id 57981, offset 0, flags [DF], proto TCP (6), length 52)
    127.0.0.1.33660 > 127.0.0.1.12150: Flags [.], cksum 0xfe28 (incorrect -> 0x5994), seq 1, ack 1, win 512, options [nop,nop,TS val 3518780970 ecr 3518780970], length 0
2022-04-07 20:16:21.418874 IP (tos 0x0, ttl 64, id 57982, offset 0, flags [DF], proto TCP (6), length 55)
    127.0.0.1.33660 > 127.0.0.1.12150: Flags [P.], cksum 0xfe2b (incorrect -> 0x5488), seq 1:4, ack 1, win 512, options [nop,nop,TS val 3518780970 ecr 3518780970], length 3
2022-04-07 20:16:21.418887 IP (tos 0x0, ttl 64, id 27068, offset 0, flags [DF], proto TCP (6), length 52)
    127.0.0.1.12150 > 127.0.0.1.33660: Flags [.], cksum 0xfe28 (incorrect -> 0x5991), seq 1, ack 4, win 512, options [nop,nop,TS val 3518780970 ecr 3518780970], length 0
2022-04-07 20:16:21.418946 IP (tos 0x0, ttl 64, id 27069, offset 0, flags [DF], proto TCP (6), length 54)
    127.0.0.1.12150 > 127.0.0.1.33660: Flags [P.], cksum 0xfe2a (incorrect -> 0x5487), seq 1:3, ack 4, win 512, options [nop,nop,TS val 3518780970 ecr 3518780970], length 2
2022-04-07 20:16:21.418962 IP (tos 0x0, ttl 64, id 57983, offset 0, flags [DF], proto TCP (6), length 52)
    127.0.0.1.33660 > 127.0.0.1.12150: Flags [.], cksum 0xfe28 (incorrect -> 0x598f), seq 4, ack 3, win 512, options [nop,nop,TS val 3518780970 ecr 3518780970], length 0
2022-04-07 20:16:21.420265 IP (tos 0x0, ttl 64, id 57984, offset 0, flags [DF], proto TCP (6), length 62)
    127.0.0.1.33660 > 127.0.0.1.12150: Flags [P.], cksum 0xfe32 (incorrect -> 0x4b6f), seq 4:14, ack 3, win 512, options [nop,nop,TS val 3518780972 ecr 3518780970], length 10
2022-04-07 20:16:21.420280 IP (tos 0x0, ttl 64, id 27070, offset 0, flags [DF], proto TCP (6), length 52)
    127.0.0.1.12150 > 127.0.0.1.33660: Flags [.], cksum 0xfe28 (incorrect -> 0x5981), seq 3, ack 14, win 512, options [nop,nop,TS val 3518780972 ecr 3518780972], length 0
2022-04-07 20:16:28.715908 IP (tos 0x0, ttl 64, id 27071, offset 0, flags [DF], proto TCP (6), length 62)
    127.0.0.1.12150 > 127.0.0.1.33660: Flags [P.], cksum 0xfe32 (incorrect -> 0x37ef), seq 3:13, ack 14, win 512, options [nop,nop,TS val 3518788267 ecr 3518780972], length 10
2022-04-07 20:16:28.715923 IP (tos 0x0, ttl 64, id 57985, offset 0, flags [DF], proto TCP (6), length 52)
    127.0.0.1.33660 > 127.0.0.1.12150: Flags [.], cksum 0xfe28 (incorrect -> 0x2079), seq 14, ack 13, win 512, options [nop,nop,TS val 3518788267 ecr 3518788267], length 0
2022-04-07 20:16:28.722120 IP (tos 0x0, ttl 64, id 57986, offset 0, flags [DF], proto TCP (6), length 569)
    127.0.0.1.33660 > 127.0.0.1.12150: Flags [P.], cksum 0x002e (incorrect -> 0xa0ce), seq 14:531, ack 13, win 512, options [nop,nop,TS val 3518788273 ecr 3518788267], length 517
2022-04-07 20:16:28.722129 IP (tos 0x0, ttl 64, id 27072, offset 0, flags [DF], proto TCP (6), length 52)
    127.0.0.1.12150 > 127.0.0.1.33660: Flags [.], cksum 0xfe28 (incorrect -> 0x1e6c), seq 13, ack 531, win 508, options [nop,nop,TS val 3518788273 ecr 3518788273], length 0
200, 6.072223663330078, 7.514692783355713