2022-04-07 10:47:32.275351 IP (tos 0x0, ttl 64, id 54193, offset 0, flags [DF], proto TCP (6), length 60)
    127.0.0.1.58520 > 127.0.0.1.10850: Flags [S], cksum 0xfe30 (incorrect -> 0x98a1), seq 931008512, win 65495, options [mss 65495,sackOK,TS val 3484651827 ecr 0,nop,wscale 7], length 0
2022-04-07 10:47:32.275363 IP (tos 0x0, ttl 64, id 0, offset 0, flags [DF], proto TCP (6), length 60)
    127.0.0.1.10850 > 127.0.0.1.58520: Flags [S.], cksum 0xfe30 (incorrect -> 0xcb90), seq 1322523984, ack 931008513, win 65483, options [mss 65495,sackOK,TS val 3484651827 ecr 3484651827,nop,wscale 7], length 0
2022-04-07 10:47:32.275373 IP (tos 0x0, ttl 64, id 54194, offset 0, flags [DF], proto TCP (6), length 52)
    127.0.0.1.58520 > 127.0.0.1.10850: Flags [.], cksum 0xfe28 (incorrect -> 0xf24c), seq 1, ack 1, win 512, options [nop,nop,TS val 3484651827 ecr 3484651827], length 0
2022-04-07 10:47:32.275488 IP (tos 0x0, ttl 64, id 54195, offset 0, flags [DF], proto TCP (6), length 55)
    127.0.0.1.58520 > 127.0.0.1.10850: Flags [P.], cksum 0xfe2b (incorrect -> 0xed40), seq 1:4, ack 1, win 512, options [nop,nop,TS val 3484651827 ecr 3484651827], length 3
2022-04-07 10:47:32.275501 IP (tos 0x0, ttl 64, id 49286, offset 0, flags [DF], proto TCP (6), length 52)
    127.0.0.1.10850 > 127.0.0.1.58520: Flags [.], cksum 0xfe28 (incorrect -> 0xf249), seq 1, ack 4, win 512, options [nop,nop,TS val 3484651827 ecr 3484651827], length 0
2022-04-07 10:47:32.275541 IP (tos 0x0, ttl 64, id 49287, offset 0, flags [DF], proto TCP (6), length 54)
    127.0.0.1.10850 > 127.0.0.1.58520: Flags [P.], cksum 0xfe2a (incorrect -> 0xed3f), seq 1:3, ack 4, win 512, options [nop,nop,TS val 3484651827 ecr 3484651827], length 2
2022-04-07 10:47:32.275554 IP (tos 0x0, ttl 64, id 54196, offset 0, flags [DF], proto TCP (6), length 52)
    127.0.0.1.58520 > 127.0.0.1.10850: Flags [.], cksum 0xfe28 (incorrect -> 0xf247), seq 4, ack 3, win 512, options [nop,nop,TS val 3484651827 ecr 3484651827], length 0
2022-04-07 10:47:32.324090 IP (tos 0x0, ttl 64, id 54197, offset 0, flags [DF], proto TCP (6), length 62)
    127.0.0.1.58520 > 127.0.0.1.10850: Flags [P.], cksum 0xfe32 (incorrect -> 0x7726), seq 4:14, ack 3, win 512, options [nop,nop,TS val 3484651875 ecr 3484651827], length 10
2022-04-07 10:47:32.324109 IP (tos 0x0, ttl 64, id 49288, offset 0, flags [DF], proto TCP (6), length 52)
    127.0.0.1.10850 > 127.0.0.1.58520: Flags [.], cksum 0xfe28 (incorrect -> 0xf1dd), seq 3, ack 14, win 512, options [nop,nop,TS val 3484651875 ecr 3484651875], length 0
2022-04-07 10:47:32.536873 IP (tos 0x0, ttl 64, id 49289, offset 0, flags [DF], proto TCP (6), length 62)
    127.0.0.1.10850 > 127.0.0.1.58520: Flags [P.], cksum 0xfe32 (incorrect -> 0xebf5), seq 3:13, ack 14, win 512, options [nop,nop,TS val 3484652088 ecr 3484651875], length 10
2022-04-07 10:47:32.536887 IP (tos 0x0, ttl 64, id 54198, offset 0, flags [DF], proto TCP (6), length 52)
    127.0.0.1.58520 > 127.0.0.1.10850: Flags [.], cksum 0xfe28 (incorrect -> 0xf029), seq 14, ack 13, win 512, options [nop,nop,TS val 3484652088 ecr 3484652088], length 0
2022-04-07 10:47:32.542748 IP (tos 0x0, ttl 64, id 54199, offset 0, flags [DF], proto TCP (6), length 569)
    127.0.0.1.58520 > 127.0.0.1.10850: Flags [P.], cksum 0x002e (incorrect -> 0x1898), seq 14:531, ack 13, win 512, options [nop,nop,TS val 3484652094 ecr 3484652088], length 517
2022-04-07 10:47:32.542779 IP (tos 0x0, ttl 64, id 49290, offset 0, flags [DF], proto TCP (6), length 52)
    127.0.0.1.10850 > 127.0.0.1.58520: Flags [.], cksum 0xfe28 (incorrect -> 0xee1c), seq 13, ack 531, win 508, options [nop,nop,TS val 3484652094 ecr 3484652094], length 0
2022-04-07 10:47:32.734677 IP (tos 0x0, ttl 64, id 49291, offset 0, flags [DF], proto TCP (6), length 1500)
    127.0.0.1.10850 > 127.0.0.1.58520: Flags [P.], cksum 0x03d1 (incorrect -> 0xc17a), seq 13:1461, ack 531, win 512, options [nop,nop,TS val 3484652286 ecr 3484652094], length 1448
2022-04-07 10:47:32.734687 IP (tos 0x0, ttl 64, id 54200, offset 0, flags [DF], proto TCP (6), length 52)
    127.0.0.1.58520 > 127.0.0.1.10850: Flags [.], cksum 0xfe28 (incorrect -> 0xe6fa), seq 531, ack 1461, win 502, options [nop,nop,TS val 3484652286 ecr 3484652286], length 0
2022-04-07 10:47:32.767852 IP (tos 0x0, ttl 64, id 49292, offset 0, flags [DF], proto TCP (6), length 1933)
    127.0.0.1.10850 > 127.0.0.1.58520: Flags [P.], cksum 0x0582 (incorrect -> 0x3861), seq 1461:3342, ack 531, win 512, options [nop,nop,TS val 3484652319 ecr 3484652286], length 1881
2022-04-07 10:47:32.767861 IP (tos 0x0, ttl 64, id 54201, offset 0, flags [DF], proto TCP (6), length 52)
    127.0.0.1.58520 > 127.0.0.1.10850: Flags [.], cksum 0xfe28 (incorrect -> 0xdf61), seq 531, ack 3342, win 500, options [nop,nop,TS val 3484652319 ecr 3484652319], length 0
2022-04-07 10:47:32.768379 IP (tos 0x0, ttl 64, id 54202, offset 0, flags [DF], proto TCP (6), length 145)
    127.0.0.1.58520 > 127.0.0.1.10850: Flags [P.], cksum 0xfe85 (incorrect -> 0x0407), seq 531:624, ack 3342, win 512, options [nop,nop,TS val 3484652320 ecr 3484652319], length 93
2022-04-07 10:47:32.768389 IP (tos 0x0, ttl 64, id 49293, offset 0, flags [DF], proto TCP (6), length 52)
    127.0.0.1.10850 > 127.0.0.1.58520: Flags [.], cksum 0xfe28 (incorrect -> 0xdef6), seq 3342, ack 624, win 512, options [nop,nop,TS val 3484652320 ecr 3484652320], length 0
2022-04-07 10:47:32.916778 IP (tos 0x0, ttl 64, id 49294, offset 0, flags [DF], proto TCP (6), length 310)
    127.0.0.1.10850 > 127.0.0.1.58520: Flags [P.], cksum 0xff2a (incorrect -> 0xe2f1), seq 3342:3600, ack 624, win 512, options [nop,nop,TS val 3484652468 ecr 3484652320], length 258
2022-04-07 10:47:32.916787 IP (tos 0x0, ttl 64, id 54203, offset 0, flags [DF], proto TCP (6), length 52)
    127.0.0.1.58520 > 127.0.0.1.10850: Flags [.], cksum 0xfe28 (incorrect -> 0xdcce), seq 624, ack 3600, win 510, options [nop,nop,TS val 3484652468 ecr 3484652468], length 0
2022-04-07 10:47:32.917241 IP (tos 0x0, ttl 64, id 54204, offset 0, flags [DF], proto TCP (6), length 437)
    127.0.0.1.58520 > 127.0.0.1.10850: Flags [P.], cksum 0xffa9 (incorrect -> 0x3d83), seq 624:1009, ack 3600, win 512, options [nop,nop,TS val 3484652469 ecr 3484652468], length 385
2022-04-07 10:47:32.917249 IP (tos 0x0, ttl 64, id 49295, offset 0, flags [DF], proto TCP (6), length 52)
    127.0.0.1.10850 > 127.0.0.1.58520: Flags [.], cksum 0xfe28 (incorrect -> 0xdb4c), seq 3600, ack 1009, win 509, options [nop,nop,TS val 3484652469 ecr 3484652469], length 0
2022-04-07 10:47:33.268756 IP (tos 0x0, ttl 64, id 49296, offset 0, flags [DF], proto TCP (6), length 220)
    127.0.0.1.10850 > 127.0.0.1.58520: Flags [P.], cksum 0xfed0 (incorrect -> 0xea76), seq 3600:3768, ack 1009, win 512, options [nop,nop,TS val 3484652820 ecr 3484652469], length 168
2022-04-07 10:47:33.270856 IP (tos 0x0, ttl 64, id 3970, offset 0, flags [DF], proto TCP (6), length 60)
    127.0.0.1.58522 > 127.0.0.1.10850: Flags [S], cksum 0xfe30 (incorrect -> 0xad92), seq 1689897454, win 65495, options [mss 65495,sackOK,TS val 3484652822 ecr 0,nop,wscale 7], length 0
2022-04-07 10:47:33.270868 IP (tos 0x0, ttl 64, id 0, offset 0, flags [DF], proto TCP (6), length 60)
    127.0.0.1.10850 > 127.0.0.1.58522: Flags [S.], cksum 0xfe30 (incorrect -> 0x0dc1), seq 398598976, ack 1689897455, win 65483, options [mss 65495,sackOK,TS val 3484652822 ecr 3484652822,nop,wscale 7], length 0
2022-04-07 10:47:33.270880 IP (tos 0x0, ttl 64, id 3971, offset 0, flags [DF], proto TCP (6), length 52)
    127.0.0.1.58522 > 127.0.0.1.10850: Flags [.], cksum 0xfe28 (incorrect -> 0x347d), seq 1, ack 1, win 512, options [nop,nop,TS val 3484652822 ecr 3484652822], length 0
2022-04-07 10:47:33.270946 IP (tos 0x0, ttl 64, id 3972, offset 0, flags [DF], proto TCP (6), length 55)
    127.0.0.1.58522 > 127.0.0.1.10850: Flags [P.], cksum 0xfe2b (incorrect -> 0x2f71), seq 1:4, ack 1, win 512, options [nop,nop,TS val 3484652822 ecr 3484652822], length 3
2022-04-07 10:47:33.270951 IP (tos 0x0, ttl 64, id 9303, offset 0, flags [DF], proto TCP (6), length 52)
    127.0.0.1.10850 > 127.0.0.1.58522: Flags [.], cksum 0xfe28 (incorrect -> 0x347a), seq 1, ack 4, win 512, options [nop,nop,TS val 3484652822 ecr 3484652822], length 0
2022-04-07 10:47:33.270995 IP (tos 0x0, ttl 64, id 9304, offset 0, flags [DF], proto TCP (6), length 54)
    127.0.0.1.10850 > 127.0.0.1.58522: Flags [P.], cksum 0xfe2a (incorrect -> 0x2f70), seq 1:3, ack 4, win 512, options [nop,nop,TS val 3484652822 ecr 3484652822], length 2
2022-04-07 10:47:33.271012 IP (tos 0x0, ttl 64, id 3973, offset 0, flags [DF], proto TCP (6), length 52)
    127.0.0.1.58522 > 127.0.0.1.10850: Flags [.], cksum 0xfe28 (incorrect -> 0x3478), seq 4, ack 3, win 512, options [nop,nop,TS val 3484652822 ecr 3484652822], length 0
2022-04-07 10:47:33.272419 IP (tos 0x0, ttl 64, id 3974, offset 0, flags [DF], proto TCP (6), length 62)
    127.0.0.1.58522 > 127.0.0.1.10850: Flags [P.], cksum 0xfe32 (incorrect -> 0xc190), seq 4:14, ack 3, win 512, options [nop,nop,TS val 3484652824 ecr 3484652822], length 10
2022-04-07 10:47:33.272442 IP (tos 0x0, ttl 64, id 9305, offset 0, flags [DF], proto TCP (6), length 52)
    127.0.0.1.10850 > 127.0.0.1.58522: Flags [.], cksum 0xfe28 (incorrect -> 0x346a), seq 3, ack 14, win 512, options [nop,nop,TS val 3484652824 ecr 3484652824], length 0
2022-04-07 10:47:33.310789 IP (tos 0x0, ttl 64, id 54205, offset 0, flags [DF], proto TCP (6), length 52)
    127.0.0.1.58520 > 127.0.0.1.10850: Flags [.], cksum 0xfe28 (incorrect -> 0xd7b9), seq 1009, ack 3768, win 512, options [nop,nop,TS val 3484652862 ecr 3484652820], length 0
2022-04-07 10:47:33.450295 IP (tos 0x0, ttl 64, id 9306, offset 0, flags [DF], proto TCP (6), length 62)
    127.0.0.1.10850 > 127.0.0.1.58522: Flags [P.], cksum 0xfe32 (incorrect -> 0x2ea5), seq 3:13, ack 14, win 512, options [nop,nop,TS val 3484653002 ecr 3484652824], length 10
2022-04-07 10:47:33.450328 IP (tos 0x0, ttl 64, id 3975, offset 0, flags [DF], proto TCP (6), length 52)
    127.0.0.1.58522 > 127.0.0.1.10850: Flags [.], cksum 0xfe28 (incorrect -> 0x32fc), seq 14, ack 13, win 512, options [nop,nop,TS val 3484653002 ecr 3484653002], length 0
2022-04-07 10:47:33.455686 IP (tos 0x0, ttl 64, id 3976, offset 0, flags [DF], proto TCP (6), length 569)
    127.0.0.1.58522 > 127.0.0.1.10850: Flags [P.], cksum 0x002e (incorrect -> 0xa847), seq 14:531, ack 13, win 512, options [nop,nop,TS val 3484653007 ecr 3484653002], length 517
2022-04-07 10:47:33.455710 IP (tos 0x0, ttl 64, id 9307, offset 0, flags [DF], proto TCP (6), length 52)
    127.0.0.1.10850 > 127.0.0.1.58522: Flags [.], cksum 0xfe28 (incorrect -> 0x30f1), seq 13, ack 531, win 508, options [nop,nop,TS val 3484653007 ecr 3484653007], length 0
200, 5.879735469818115, 2.0295045375823975