2022-04-07 04:44:41.624095 IP (tos 0x0, ttl 64, id 56610, offset 0, flags [DF], proto TCP (6), length 60)
    127.0.0.1.58076 > 127.0.0.1.11450: Flags [S], cksum 0xfe30 (incorrect -> 0x74ac), seq 4286354932, win 65495, options [mss 65495,sackOK,TS val 388964126 ecr 0,nop,wscale 7], length 0
2022-04-07 04:44:41.624110 IP (tos 0x0, ttl 64, id 0, offset 0, flags [DF], proto TCP (6), length 60)
    127.0.0.1.11450 > 127.0.0.1.58076: Flags [S.], cksum 0xfe30 (incorrect -> 0x7469), seq 2924813210, ack 4286354933, win 65483, options [mss 65495,sackOK,TS val 388964127 ecr 388964126,nop,wscale 7], length 0
2022-04-07 04:44:41.624122 IP (tos 0x0, ttl 64, id 56611, offset 0, flags [DF], proto TCP (6), length 52)
    127.0.0.1.58076 > 127.0.0.1.11450: Flags [.], cksum 0xfe28 (incorrect -> 0x9b24), seq 1, ack 1, win 512, options [nop,nop,TS val 388964127 ecr 388964127], length 0
2022-04-07 04:44:41.624218 IP (tos 0x0, ttl 64, id 56612, offset 0, flags [DF], proto TCP (6), length 55)
    127.0.0.1.58076 > 127.0.0.1.11450: Flags [P.], cksum 0xfe2b (incorrect -> 0x9618), seq 1:4, ack 1, win 512, options [nop,nop,TS val 388964127 ecr 388964127], length 3
2022-04-07 04:44:41.624231 IP (tos 0x0, ttl 64, id 56801, offset 0, flags [DF], proto TCP (6), length 52)
    127.0.0.1.11450 > 127.0.0.1.58076: Flags [.], cksum 0xfe28 (incorrect -> 0x9b21), seq 1, ack 4, win 512, options [nop,nop,TS val 388964127 ecr 388964127], length 0
2022-04-07 04:44:41.624310 IP (tos 0x0, ttl 64, id 56802, offset 0, flags [DF], proto TCP (6), length 54)
    127.0.0.1.11450 > 127.0.0.1.58076: Flags [P.], cksum 0xfe2a (incorrect -> 0x9617), seq 1:3, ack 4, win 512, options [nop,nop,TS val 388964127 ecr 388964127], length 2
2022-04-07 04:44:41.624325 IP (tos 0x0, ttl 64, id 56613, offset 0, flags [DF], proto TCP (6), length 52)
    127.0.0.1.58076 > 127.0.0.1.11450: Flags [.], cksum 0xfe28 (incorrect -> 0x9b1f), seq 4, ack 3, win 512, options [nop,nop,TS val 388964127 ecr 388964127], length 0
2022-04-07 04:44:41.646113 IP (tos 0x0, ttl 64, id 56614, offset 0, flags [DF], proto TCP (6), length 62)
    127.0.0.1.58076 > 127.0.0.1.11450: Flags [P.], cksum 0xfe32 (incorrect -> 0x2df8), seq 4:14, ack 3, win 512, options [nop,nop,TS val 388964149 ecr 388964127], length 10
2022-04-07 04:44:41.646135 IP (tos 0x0, ttl 64, id 56803, offset 0, flags [DF], proto TCP (6), length 52)
    127.0.0.1.11450 > 127.0.0.1.58076: Flags [.], cksum 0xfe28 (incorrect -> 0x9ae9), seq 3, ack 14, win 512, options [nop,nop,TS val 388964149 ecr 388964149], length 0
2022-04-07 04:44:41.776594 IP (tos 0x0, ttl 64, id 56804, offset 0, flags [DF], proto TCP (6), length 62)
    127.0.0.1.11450 > 127.0.0.1.58076: Flags [P.], cksum 0xfe32 (incorrect -> 0x9554), seq 3:13, ack 14, win 512, options [nop,nop,TS val 388964279 ecr 388964149], length 10
2022-04-07 04:44:41.776611 IP (tos 0x0, ttl 64, id 56615, offset 0, flags [DF], proto TCP (6), length 52)
    127.0.0.1.58076 > 127.0.0.1.11450: Flags [.], cksum 0xfe28 (incorrect -> 0x99db), seq 14, ack 13, win 512, options [nop,nop,TS val 388964279 ecr 388964279], length 0
2022-04-07 04:44:41.782151 IP (tos 0x0, ttl 64, id 56616, offset 0, flags [DF], proto TCP (6), length 569)
    127.0.0.1.58076 > 127.0.0.1.11450: Flags [P.], cksum 0x002e (incorrect -> 0xff95), seq 14:531, ack 13, win 512, options [nop,nop,TS val 388964285 ecr 388964279], length 517
2022-04-07 04:44:41.782161 IP (tos 0x0, ttl 64, id 56805, offset 0, flags [DF], proto TCP (6), length 52)
    127.0.0.1.11450 > 127.0.0.1.58076: Flags [.], cksum 0xfe28 (incorrect -> 0x97ce), seq 13, ack 531, win 508, options [nop,nop,TS val 388964285 ecr 388964285], length 0
200, 2.6301939487457275, 0.7326445579528809