2022-04-07 17:26:28.940089 IP (tos 0x0, ttl 64, id 18033, offset 0, flags [DF], proto TCP (6), length 60)
    127.0.0.1.58908 > 127.0.0.1.10850: Flags [S], cksum 0xfe30 (incorrect -> 0x1b41), seq 3061894356, win 65495, options [mss 65495,sackOK,TS val 3508588491 ecr 0,nop,wscale 7], length 0
2022-04-07 17:26:28.940110 IP (tos 0x0, ttl 64, id 0, offset 0, flags [DF], proto TCP (6), length 60)
    127.0.0.1.10850 > 127.0.0.1.58908: Flags [S.], cksum 0xfe30 (incorrect -> 0x55c5), seq 1969532709, ack 3061894357, win 65483, options [mss 65495,sackOK,TS val 3508588491 ecr 3508588491,nop,wscale 7], length 0
2022-04-07 17:26:28.940123 IP (tos 0x0, ttl 64, id 18034, offset 0, flags [DF], proto TCP (6), length 52)
    127.0.0.1.58908 > 127.0.0.1.10850: Flags [.], cksum 0xfe28 (incorrect -> 0x7c81), seq 1, ack 1, win 512, options [nop,nop,TS val 3508588491 ecr 3508588491], length 0
2022-04-07 17:26:28.940321 IP (tos 0x0, ttl 64, id 18035, offset 0, flags [DF], proto TCP (6), length 55)
    127.0.0.1.58908 > 127.0.0.1.10850: Flags [P.], cksum 0xfe2b (incorrect -> 0x7774), seq 1:4, ack 1, win 512, options [nop,nop,TS val 3508588492 ecr 3508588491], length 3
2022-04-07 17:26:28.940330 IP (tos 0x0, ttl 64, id 17122, offset 0, flags [DF], proto TCP (6), length 52)
    127.0.0.1.10850 > 127.0.0.1.58908: Flags [.], cksum 0xfe28 (incorrect -> 0x7c7c), seq 1, ack 4, win 512, options [nop,nop,TS val 3508588492 ecr 3508588492], length 0
2022-04-07 17:26:28.940359 IP (tos 0x0, ttl 64, id 17123, offset 0, flags [DF], proto TCP (6), length 54)
    127.0.0.1.10850 > 127.0.0.1.58908: Flags [P.], cksum 0xfe2a (incorrect -> 0x7772), seq 1:3, ack 4, win 512, options [nop,nop,TS val 3508588492 ecr 3508588492], length 2
2022-04-07 17:26:28.940365 IP (tos 0x0, ttl 64, id 18036, offset 0, flags [DF], proto TCP (6), length 52)
    127.0.0.1.58908 > 127.0.0.1.10850: Flags [.], cksum 0xfe28 (incorrect -> 0x7c7a), seq 4, ack 3, win 512, options [nop,nop,TS val 3508588492 ecr 3508588492], length 0
2022-04-07 17:26:28.962391 IP (tos 0x0, ttl 64, id 18037, offset 0, flags [DF], proto TCP (6), length 62)
    127.0.0.1.58908 > 127.0.0.1.10850: Flags [P.], cksum 0xfe32 (incorrect -> 0x9d6d), seq 4:14, ack 3, win 512, options [nop,nop,TS val 3508588514 ecr 3508588492], length 10
2022-04-07 17:26:28.962410 IP (tos 0x0, ttl 64, id 17124, offset 0, flags [DF], proto TCP (6), length 52)
    127.0.0.1.10850 > 127.0.0.1.58908: Flags [.], cksum 0xfe28 (incorrect -> 0x7c44), seq 3, ack 14, win 512, options [nop,nop,TS val 3508588514 ecr 3508588514], length 0
2022-04-07 17:26:29.061447 IP (tos 0x0, ttl 64, id 17125, offset 0, flags [DF], proto TCP (6), length 62)
    127.0.0.1.10850 > 127.0.0.1.58908: Flags [P.], cksum 0xfe32 (incorrect -> 0x76ce), seq 3:13, ack 14, win 512, options [nop,nop,TS val 3508588613 ecr 3508588514], length 10
2022-04-07 17:26:29.061459 IP (tos 0x0, ttl 64, id 18038, offset 0, flags [DF], proto TCP (6), length 52)
    127.0.0.1.58908 > 127.0.0.1.10850: Flags [.], cksum 0xfe28 (incorrect -> 0x7b74), seq 14, ack 13, win 512, options [nop,nop,TS val 3508588613 ecr 3508588613], length 0
2022-04-07 17:26:29.071608 IP (tos 0x0, ttl 64, id 18039, offset 0, flags [DF], proto TCP (6), length 569)
    127.0.0.1.58908 > 127.0.0.1.10850: Flags [P.], cksum 0x002e (incorrect -> 0x0362), seq 14:531, ack 13, win 512, options [nop,nop,TS val 3508588623 ecr 3508588613], length 517
2022-04-07 17:26:29.071626 IP (tos 0x0, ttl 64, id 17126, offset 0, flags [DF], proto TCP (6), length 52)
    127.0.0.1.10850 > 127.0.0.1.58908: Flags [.], cksum 0xfe28 (incorrect -> 0x795f), seq 13, ack 531, win 508, options [nop,nop,TS val 3508588623 ecr 3508588623], length 0
200, 6.69022798538208, 0.37935972213745117