2022-04-08 00:49:08.347984 IP (tos 0x0, ttl 64, id 43938, offset 0, flags [DF], proto TCP (6), length 60)
    127.0.0.1.36350 > 127.0.0.1.10450: Flags [S], cksum 0xfe30 (incorrect -> 0xbe75), seq 1617794076, win 65495, options [mss 65495,sackOK,TS val 3535147899 ecr 0,nop,wscale 7], length 0
2022-04-08 00:49:08.347993 IP (tos 0x0, ttl 64, id 0, offset 0, flags [DF], proto TCP (6), length 60)
    127.0.0.1.10450 > 127.0.0.1.36350: Flags [S.], cksum 0xfe30 (incorrect -> 0xd4d4), seq 4280157259, ack 1617794077, win 65483, options [mss 65495,sackOK,TS val 3535147899 ecr 3535147899,nop,wscale 7], length 0
2022-04-08 00:49:08.348002 IP (tos 0x0, ttl 64, id 43939, offset 0, flags [DF], proto TCP (6), length 52)
    127.0.0.1.36350 > 127.0.0.1.10450: Flags [.], cksum 0xfe28 (incorrect -> 0xfb90), seq 1, ack 1, win 512, options [nop,nop,TS val 3535147899 ecr 3535147899], length 0
2022-04-08 00:49:08.348087 IP (tos 0x0, ttl 64, id 43940, offset 0, flags [DF], proto TCP (6), length 55)
    127.0.0.1.36350 > 127.0.0.1.10450: Flags [P.], cksum 0xfe2b (incorrect -> 0xf684), seq 1:4, ack 1, win 512, options [nop,nop,TS val 3535147899 ecr 3535147899], length 3
2022-04-08 00:49:08.348090 IP (tos 0x0, ttl 64, id 44983, offset 0, flags [DF], proto TCP (6), length 52)
    127.0.0.1.10450 > 127.0.0.1.36350: Flags [.], cksum 0xfe28 (incorrect -> 0xfb8d), seq 1, ack 4, win 512, options [nop,nop,TS val 3535147899 ecr 3535147899], length 0
2022-04-08 00:49:08.348140 IP (tos 0x0, ttl 64, id 44984, offset 0, flags [DF], proto TCP (6), length 54)
    127.0.0.1.10450 > 127.0.0.1.36350: Flags [P.], cksum 0xfe2a (incorrect -> 0xf683), seq 1:3, ack 4, win 512, options [nop,nop,TS val 3535147899 ecr 3535147899], length 2
2022-04-08 00:49:08.348144 IP (tos 0x0, ttl 64, id 43941, offset 0, flags [DF], proto TCP (6), length 52)
    127.0.0.1.36350 > 127.0.0.1.10450: Flags [.], cksum 0xfe28 (incorrect -> 0xfb8b), seq 4, ack 3, win 512, options [nop,nop,TS val 3535147899 ecr 3535147899], length 0
2022-04-08 00:49:08.369641 IP (tos 0x0, ttl 64, id 43942, offset 0, flags [DF], proto TCP (6), length 62)
    127.0.0.1.36350 > 127.0.0.1.10450: Flags [P.], cksum 0xfe32 (incorrect -> 0x37d6), seq 4:14, ack 3, win 512, options [nop,nop,TS val 3535147921 ecr 3535147899], length 10
2022-04-08 00:49:08.369655 IP (tos 0x0, ttl 64, id 44985, offset 0, flags [DF], proto TCP (6), length 52)
    127.0.0.1.10450 > 127.0.0.1.36350: Flags [.], cksum 0xfe28 (incorrect -> 0xfb55), seq 3, ack 14, win 512, options [nop,nop,TS val 3535147921 ecr 3535147921], length 0
2022-04-08 00:49:08.440572 IP (tos 0x0, ttl 64, id 44986, offset 0, flags [DF], proto TCP (6), length 62)
    127.0.0.1.10450 > 127.0.0.1.36350: Flags [P.], cksum 0xfe32 (incorrect -> 0xf5fb), seq 3:13, ack 14, win 512, options [nop,nop,TS val 3535147992 ecr 3535147921], length 10
2022-04-08 00:49:08.440580 IP (tos 0x0, ttl 64, id 43943, offset 0, flags [DF], proto TCP (6), length 52)
    127.0.0.1.36350 > 127.0.0.1.10450: Flags [.], cksum 0xfe28 (incorrect -> 0xfabd), seq 14, ack 13, win 512, options [nop,nop,TS val 3535147992 ecr 3535147992], length 0
2022-04-08 00:49:08.446109 IP (tos 0x0, ttl 64, id 43944, offset 0, flags [DF], proto TCP (6), length 569)
    127.0.0.1.36350 > 127.0.0.1.10450: Flags [P.], cksum 0x002e (incorrect -> 0xf60e), seq 14:531, ack 13, win 512, options [nop,nop,TS val 3535147997 ecr 3535147992], length 517
2022-04-08 00:49:08.446124 IP (tos 0x0, ttl 64, id 44987, offset 0, flags [DF], proto TCP (6), length 52)
    127.0.0.1.10450 > 127.0.0.1.36350: Flags [.], cksum 0xfe28 (incorrect -> 0xf8b2), seq 13, ack 531, win 508, options [nop,nop,TS val 3535147997 ecr 3535147997], length 0
2022-04-08 00:49:08.556777 IP (tos 0x0, ttl 64, id 44988, offset 0, flags [DF], proto TCP (6), length 3421)
    127.0.0.1.10450 > 127.0.0.1.36350: Flags [P.], cksum 0x0b52 (incorrect -> 0x2f3a), seq 13:3382, ack 531, win 512, options [nop,nop,TS val 3535148108 ecr 3535147997], length 3369
2022-04-08 00:49:08.556792 IP (tos 0x0, ttl 64, id 43945, offset 0, flags [DF], proto TCP (6), length 52)
    127.0.0.1.36350 > 127.0.0.1.10450: Flags [.], cksum 0xfe28 (incorrect -> 0xeab9), seq 531, ack 3382, win 494, options [nop,nop,TS val 3535148108 ecr 3535148108], length 0
2022-04-08 00:49:08.557452 IP (tos 0x0, ttl 64, id 43946, offset 0, flags [DF], proto TCP (6), length 116)
    127.0.0.1.36350 > 127.0.0.1.10450: Flags [P.], cksum 0xfe68 (incorrect -> 0xfca4), seq 531:595, ack 3382, win 512, options [nop,nop,TS val 3535148109 ecr 3535148108], length 64
2022-04-08 00:49:08.557458 IP (tos 0x0, ttl 64, id 44989, offset 0, flags [DF], proto TCP (6), length 52)
    127.0.0.1.10450 > 127.0.0.1.36350: Flags [.], cksum 0xfe28 (incorrect -> 0xea65), seq 3382, ack 595, win 512, options [nop,nop,TS val 3535148109 ecr 3535148109], length 0
2022-04-08 00:49:08.557856 IP (tos 0x0, ttl 64, id 43947, offset 0, flags [DF], proto TCP (6), length 360)
    127.0.0.1.36350 > 127.0.0.1.10450: Flags [P.], cksum 0xff5c (incorrect -> 0x0253), seq 595:903, ack 3382, win 512, options [nop,nop,TS val 3535148109 ecr 3535148109], length 308
2022-04-08 00:49:08.557860 IP (tos 0x0, ttl 64, id 44990, offset 0, flags [DF], proto TCP (6), length 52)
    127.0.0.1.10450 > 127.0.0.1.36350: Flags [.], cksum 0xfe28 (incorrect -> 0xe933), seq 3382, ack 903, win 510, options [nop,nop,TS val 3535148109 ecr 3535148109], length 0
2022-04-08 00:49:08.646977 IP (tos 0x0, ttl 64, id 44991, offset 0, flags [DF], proto TCP (6), length 323)
    127.0.0.1.10450 > 127.0.0.1.36350: Flags [P.], cksum 0xff37 (incorrect -> 0x911d), seq 3382:3653, ack 903, win 512, options [nop,nop,TS val 3535148198 ecr 3535148109], length 271
2022-04-08 00:49:08.646983 IP (tos 0x0, ttl 64, id 43948, offset 0, flags [DF], proto TCP (6), length 52)
    127.0.0.1.36350 > 127.0.0.1.10450: Flags [.], cksum 0xfe28 (incorrect -> 0xe772), seq 903, ack 3653, win 510, options [nop,nop,TS val 3535148198 ecr 3535148198], length 0
2022-04-08 00:49:08.659204 IP (tos 0x0, ttl 64, id 44992, offset 0, flags [DF], proto TCP (6), length 323)
    127.0.0.1.10450 > 127.0.0.1.36350: Flags [P.], cksum 0xff37 (incorrect -> 0x470d), seq 3653:3924, ack 903, win 512, options [nop,nop,TS val 3535148210 ecr 3535148198], length 271
2022-04-08 00:49:08.659213 IP (tos 0x0, ttl 64, id 43949, offset 0, flags [DF], proto TCP (6), length 52)
    127.0.0.1.36350 > 127.0.0.1.10450: Flags [.], cksum 0xfe28 (incorrect -> 0xe64d), seq 903, ack 3924, win 508, options [nop,nop,TS val 3535148210 ecr 3535148210], length 0
2022-04-08 00:49:08.673399 IP (tos 0x0, ttl 64, id 44993, offset 0, flags [DF], proto TCP (6), length 1486)
    127.0.0.1.10450 > 127.0.0.1.36350: Flags [P.], cksum 0x03c3 (incorrect -> 0x0683), seq 3924:5358, ack 903, win 512, options [nop,nop,TS val 3535148225 ecr 3535148210], length 1434
2022-04-08 00:49:08.673408 IP (tos 0x0, ttl 64, id 43950, offset 0, flags [DF], proto TCP (6), length 52)
    127.0.0.1.36350 > 127.0.0.1.10450: Flags [.], cksum 0xfe28 (incorrect -> 0xe09b), seq 903, ack 5358, win 502, options [nop,nop,TS val 3535148225 ecr 3535148225], length 0
2022-04-08 00:49:08.675991 IP (tos 0x0, ttl 64, id 40038, offset 0, flags [DF], proto TCP (6), length 60)
    127.0.0.1.36352 > 127.0.0.1.10450: Flags [S], cksum 0xfe30 (incorrect -> 0x01b2), seq 454071539, win 65495, options [mss 65495,sackOK,TS val 3535148227 ecr 0,nop,wscale 7], length 0
2022-04-08 00:49:08.675998 IP (tos 0x0, ttl 64, id 0, offset 0, flags [DF], proto TCP (6), length 60)
    127.0.0.1.10450 > 127.0.0.1.36352: Flags [S.], cksum 0xfe30 (incorrect -> 0x67a5), seq 173516854, ack 454071540, win 65483, options [mss 65495,sackOK,TS val 3535148227 ecr 3535148227,nop,wscale 7], length 0
2022-04-08 00:49:08.676004 IP (tos 0x0, ttl 64, id 40039, offset 0, flags [DF], proto TCP (6), length 52)
    127.0.0.1.36352 > 127.0.0.1.10450: Flags [.], cksum 0xfe28 (incorrect -> 0x8e61), seq 1, ack 1, win 512, options [nop,nop,TS val 3535148227 ecr 3535148227], length 0
2022-04-08 00:49:08.676112 IP (tos 0x0, ttl 64, id 40040, offset 0, flags [DF], proto TCP (6), length 55)
    127.0.0.1.36352 > 127.0.0.1.10450: Flags [P.], cksum 0xfe2b (incorrect -> 0x8955), seq 1:4, ack 1, win 512, options [nop,nop,TS val 3535148227 ecr 3535148227], length 3
2022-04-08 00:49:08.676114 IP (tos 0x0, ttl 64, id 41409, offset 0, flags [DF], proto TCP (6), length 52)
    127.0.0.1.10450 > 127.0.0.1.36352: Flags [.], cksum 0xfe28 (incorrect -> 0x8e5e), seq 1, ack 4, win 512, options [nop,nop,TS val 3535148227 ecr 3535148227], length 0
2022-04-08 00:49:08.676167 IP (tos 0x0, ttl 64, id 41410, offset 0, flags [DF], proto TCP (6), length 54)
    127.0.0.1.10450 > 127.0.0.1.36352: Flags [P.], cksum 0xfe2a (incorrect -> 0x8954), seq 1:3, ack 4, win 512, options [nop,nop,TS val 3535148227 ecr 3535148227], length 2
2022-04-08 00:49:08.676170 IP (tos 0x0, ttl 64, id 40041, offset 0, flags [DF], proto TCP (6), length 52)
    127.0.0.1.36352 > 127.0.0.1.10450: Flags [.], cksum 0xfe28 (incorrect -> 0x8e5c), seq 4, ack 3, win 512, options [nop,nop,TS val 3535148227 ecr 3535148227], length 0
2022-04-08 00:49:08.697578 IP (tos 0x0, ttl 64, id 40042, offset 0, flags [DF], proto TCP (6), length 62)
    127.0.0.1.36352 > 127.0.0.1.10450: Flags [P.], cksum 0xfe32 (incorrect -> 0xb783), seq 4:14, ack 3, win 512, options [nop,nop,TS val 3535148249 ecr 3535148227], length 10
2022-04-08 00:49:08.697584 IP (tos 0x0, ttl 64, id 41411, offset 0, flags [DF], proto TCP (6), length 52)
    127.0.0.1.10450 > 127.0.0.1.36352: Flags [.], cksum 0xfe28 (incorrect -> 0x8e26), seq 3, ack 14, win 512, options [nop,nop,TS val 3535148249 ecr 3535148249], length 0
2022-04-08 00:49:08.742625 IP (tos 0x0, ttl 64, id 41412, offset 0, flags [DF], proto TCP (6), length 62)
    127.0.0.1.10450 > 127.0.0.1.36352: Flags [P.], cksum 0xfe32 (incorrect -> 0x88e6), seq 3:13, ack 14, win 512, options [nop,nop,TS val 3535148294 ecr 3535148249], length 10
2022-04-08 00:49:08.742635 IP (tos 0x0, ttl 64, id 40043, offset 0, flags [DF], proto TCP (6), length 52)
    127.0.0.1.36352 > 127.0.0.1.10450: Flags [.], cksum 0xfe28 (incorrect -> 0x8dc2), seq 14, ack 13, win 512, options [nop,nop,TS val 3535148294 ecr 3535148294], length 0
2022-04-08 00:49:08.747753 IP (tos 0x0, ttl 64, id 40044, offset 0, flags [DF], proto TCP (6), length 569)
    127.0.0.1.36352 > 127.0.0.1.10450: Flags [P.], cksum 0x002e (incorrect -> 0x6f55), seq 14:531, ack 13, win 512, options [nop,nop,TS val 3535148299 ecr 3535148294], length 517
2022-04-08 00:49:08.747761 IP (tos 0x0, ttl 64, id 41413, offset 0, flags [DF], proto TCP (6), length 52)
    127.0.0.1.10450 > 127.0.0.1.36352: Flags [.], cksum 0xfe28 (incorrect -> 0x8bb7), seq 13, ack 531, win 508, options [nop,nop,TS val 3535148299 ecr 3535148299], length 0
2022-04-08 00:49:08.799353 IP (tos 0x0, ttl 64, id 41414, offset 0, flags [DF], proto TCP (6), length 3446)
    127.0.0.1.10450 > 127.0.0.1.36352: Flags [P.], cksum 0x0b6b (incorrect -> 0x04c6), seq 13:3407, ack 531, win 512, options [nop,nop,TS val 3535148351 ecr 3535148299], length 3394
2022-04-08 00:49:08.799358 IP (tos 0x0, ttl 64, id 40045, offset 0, flags [DF], proto TCP (6), length 52)
    127.0.0.1.36352 > 127.0.0.1.10450: Flags [.], cksum 0xfe28 (incorrect -> 0x7e1b), seq 531, ack 3407, win 494, options [nop,nop,TS val 3535148351 ecr 3535148351], length 0
2022-04-08 00:49:08.824600 IP (tos 0x0, ttl 64, id 41415, offset 0, flags [DF], proto TCP (6), length 1366)
    127.0.0.1.10450 > 127.0.0.1.36352: Flags [P.], cksum 0x034b (incorrect -> 0x8a00), seq 3407:4721, ack 531, win 512, options [nop,nop,TS val 3535148376 ecr 3535148351], length 1314
2022-04-08 00:49:08.824605 IP (tos 0x0, ttl 64, id 40046, offset 0, flags [DF], proto TCP (6), length 52)
    127.0.0.1.36352 > 127.0.0.1.10450: Flags [.], cksum 0xfe28 (incorrect -> 0x78bf), seq 531, ack 4721, win 502, options [nop,nop,TS val 3535148376 ecr 3535148376], length 0
2022-04-08 00:49:08.824982 IP (tos 0x0, ttl 64, id 40047, offset 0, flags [DF], proto TCP (6), length 116)
    127.0.0.1.36352 > 127.0.0.1.10450: Flags [P.], cksum 0xfe68 (incorrect -> 0xfef1), seq 531:595, ack 4721, win 512, options [nop,nop,TS val 3535148376 ecr 3535148376], length 64
2022-04-08 00:49:08.824988 IP (tos 0x0, ttl 64, id 41416, offset 0, flags [DF], proto TCP (6), length 52)
    127.0.0.1.10450 > 127.0.0.1.36352: Flags [.], cksum 0xfe28 (incorrect -> 0x7875), seq 4721, ack 595, win 512, options [nop,nop,TS val 3535148376 ecr 3535148376], length 0
2022-04-08 00:49:08.825242 IP (tos 0x0, ttl 64, id 40048, offset 0, flags [DF], proto TCP (6), length 364)
    127.0.0.1.36352 > 127.0.0.1.10450: Flags [P.], cksum 0xff60 (incorrect -> 0x015e), seq 595:907, ack 4721, win 512, options [nop,nop,TS val 3535148377 ecr 3535148376], length 312
2022-04-08 00:49:08.825248 IP (tos 0x0, ttl 64, id 41417, offset 0, flags [DF], proto TCP (6), length 52)
    127.0.0.1.10450 > 127.0.0.1.36352: Flags [.], cksum 0xfe28 (incorrect -> 0x773d), seq 4721, ack 907, win 510, options [nop,nop,TS val 3535148377 ecr 3535148377], length 0
2022-04-08 00:49:08.868991 IP (tos 0x0, ttl 64, id 41418, offset 0, flags [DF], proto TCP (6), length 323)
    127.0.0.1.10450 > 127.0.0.1.36352: Flags [P.], cksum 0xff37 (incorrect -> 0x7878), seq 4721:4992, ack 907, win 512, options [nop,nop,TS val 3535148420 ecr 3535148377], length 271
2022-04-08 00:49:08.868997 IP (tos 0x0, ttl 64, id 40049, offset 0, flags [DF], proto TCP (6), length 52)
    127.0.0.1.36352 > 127.0.0.1.10450: Flags [.], cksum 0xfe28 (incorrect -> 0x75d8), seq 907, ack 4992, win 510, options [nop,nop,TS val 3535148420 ecr 3535148420], length 0
2022-04-08 00:49:08.920822 IP (tos 0x0, ttl 64, id 41419, offset 0, flags [DF], proto TCP (6), length 323)
    127.0.0.1.10450 > 127.0.0.1.36352: Flags [P.], cksum 0xff37 (incorrect -> 0xdc32), seq 4992:5263, ack 907, win 512, options [nop,nop,TS val 3535148472 ecr 3535148420], length 271
2022-04-08 00:49:08.920827 IP (tos 0x0, ttl 64, id 40050, offset 0, flags [DF], proto TCP (6), length 52)
    127.0.0.1.36352 > 127.0.0.1.10450: Flags [.], cksum 0xfe28 (incorrect -> 0x7463), seq 907, ack 5263, win 508, options [nop,nop,TS val 3535148472 ecr 3535148472], length 0
2022-04-08 00:49:08.957763 IP (tos 0x0, ttl 64, id 41420, offset 0, flags [DF], proto TCP (6), length 1962)
    127.0.0.1.10450 > 127.0.0.1.36352: Flags [P.], cksum 0x059f (incorrect -> 0xa410), seq 5263:7173, ack 907, win 512, options [nop,nop,TS val 3535148509 ecr 3535148472], length 1910
2022-04-08 00:49:08.957768 IP (tos 0x0, ttl 64, id 40051, offset 0, flags [DF], proto TCP (6), length 52)
    127.0.0.1.36352 > 127.0.0.1.10450: Flags [.], cksum 0xfe28 (incorrect -> 0x6cab), seq 907, ack 7173, win 500, options [nop,nop,TS val 3535148509 ecr 3535148509], length 0
2022-04-08 00:49:08.977586 IP (tos 0x0, ttl 64, id 41421, offset 0, flags [DF], proto TCP (6), length 1068)
    127.0.0.1.10450 > 127.0.0.1.36352: Flags [P.], cksum 0x0221 (incorrect -> 0x0648), seq 7173:8189, ack 907, win 512, options [nop,nop,TS val 3535148529 ecr 3535148509], length 1016
2022-04-08 00:49:08.977592 IP (tos 0x0, ttl 64, id 40052, offset 0, flags [DF], proto TCP (6), length 52)
    127.0.0.1.36352 > 127.0.0.1.10450: Flags [.], cksum 0xfe28 (incorrect -> 0x6887), seq 907, ack 8189, win 504, options [nop,nop,TS val 3535148529 ecr 3535148529], length 0
2022-04-08 00:49:08.986874 IP (tos 0x0, ttl 64, id 41422, offset 0, flags [DF], proto TCP (6), length 1310)
    127.0.0.1.10450 > 127.0.0.1.36352: Flags [P.], cksum 0x0313 (incorrect -> 0x0757), seq 8189:9447, ack 907, win 512, options [nop,nop,TS val 3535148538 ecr 3535148529], length 1258
2022-04-08 00:49:08.986879 IP (tos 0x0, ttl 64, id 40053, offset 0, flags [DF], proto TCP (6), length 52)
    127.0.0.1.36352 > 127.0.0.1.10450: Flags [.], cksum 0xfe28 (incorrect -> 0x638c), seq 907, ack 9447, win 503, options [nop,nop,TS val 3535148538 ecr 3535148538], length 0
2022-04-08 00:49:08.991901 IP (tos 0x0, ttl 64, id 41423, offset 0, flags [DF], proto TCP (6), length 2538)
    127.0.0.1.10450 > 127.0.0.1.36352: Flags [P.], cksum 0x07df (incorrect -> 0x4aa2), seq 9447:11933, ack 907, win 512, options [nop,nop,TS val 3535148543 ecr 3535148538], length 2486
2022-04-08 00:49:08.991906 IP (tos 0x0, ttl 64, id 40054, offset 0, flags [DF], proto TCP (6), length 52)
    127.0.0.1.36352 > 127.0.0.1.10450: Flags [.], cksum 0xfe28 (incorrect -> 0x59d1), seq 907, ack 11933, win 498, options [nop,nop,TS val 3535148543 ecr 3535148543], length 0
2022-04-08 00:49:09.001531 IP (tos 0x0, ttl 64, id 41424, offset 0, flags [DF], proto TCP (6), length 564)
    127.0.0.1.10450 > 127.0.0.1.36352: Flags [P.], cksum 0x0029 (incorrect -> 0x9aea), seq 11933:12445, ack 907, win 512, options [nop,nop,TS val 3535148553 ecr 3535148543], length 512
2022-04-08 00:49:09.001536 IP (tos 0x0, ttl 64, id 40055, offset 0, flags [DF], proto TCP (6), length 52)
    127.0.0.1.36352 > 127.0.0.1.10450: Flags [.], cksum 0xfe28 (incorrect -> 0x57b6), seq 907, ack 12445, win 505, options [nop,nop,TS val 3535148553 ecr 3535148553], length 0
2022-04-08 00:49:09.067357 IP (tos 0x0, ttl 64, id 41425, offset 0, flags [DF], proto TCP (6), length 3320)
    127.0.0.1.10450 > 127.0.0.1.36352: Flags [P.], cksum 0x0aed (incorrect -> 0xb8a5), seq 12445:15713, ack 907, win 512, options [nop,nop,TS val 3535148619 ecr 3535148553], length 3268
2022-04-08 00:49:09.067363 IP (tos 0x0, ttl 64, id 40056, offset 0, flags [DF], proto TCP (6), length 52)
    127.0.0.1.36352 > 127.0.0.1.10450: Flags [.], cksum 0xfe28 (incorrect -> 0x4a78), seq 907, ack 15713, win 495, options [nop,nop,TS val 3535148619 ecr 3535148619], length 0
2022-04-08 00:49:09.068999 IP (tos 0x0, ttl 64, id 41426, offset 0, flags [DF], proto TCP (6), length 1048)
    127.0.0.1.10450 > 127.0.0.1.36352: Flags [P.], cksum 0x020d (incorrect -> 0x2927), seq 15713:16709, ack 907, win 512, options [nop,nop,TS val 3535148620 ecr 3535148619], length 996
2022-04-08 00:49:09.069020 IP (tos 0x0, ttl 64, id 40057, offset 0, flags [DF], proto TCP (6), length 52)
    127.0.0.1.36352 > 127.0.0.1.10450: Flags [.], cksum 0xfe28 (incorrect -> 0x4681), seq 907, ack 16709, win 512, options [nop,nop,TS val 3535148620 ecr 3535148620], length 0
2022-04-08 00:49:09.074243 IP (tos 0x0, ttl 64, id 41427, offset 0, flags [DF], proto TCP (6), length 4100)
    127.0.0.1.10450 > 127.0.0.1.36352: Flags [P.], cksum 0x0df9 (incorrect -> 0x53ce), seq 16709:20757, ack 907, win 512, options [nop,nop,TS val 3535148626 ecr 3535148620], length 4048
2022-04-08 00:49:09.096439 IP (tos 0x0, ttl 64, id 41428, offset 0, flags [DF], proto TCP (6), length 32820)
    127.0.0.1.10450 > 127.0.0.1.36352: Flags [.], cksum 0x7e29 (incorrect -> 0xd824), seq 20757:53525, ack 907, win 512, options [nop,nop,TS val 3535148648 ecr 3535148620], length 32768
2022-04-08 00:49:09.096453 IP (tos 0x0, ttl 64, id 40058, offset 0, flags [DF], proto TCP (6), length 52)
    127.0.0.1.36352 > 127.0.0.1.10450: Flags [.], cksum 0xfe28 (incorrect -> 0xb713), seq 907, ack 53525, win 379, options [nop,nop,TS val 3535148648 ecr 3535148626], length 0
2022-04-08 00:49:09.096458 IP (tos 0x0, ttl 64, id 41429, offset 0, flags [DF], proto TCP (6), length 3116)
    127.0.0.1.10450 > 127.0.0.1.36352: Flags [P.], cksum 0x0a21 (incorrect -> 0x2188), seq 53525:56589, ack 907, win 512, options [nop,nop,TS val 3535148648 ecr 3535148648], length 3064
2022-04-08 00:49:09.097312 IP (tos 0x0, ttl 64, id 40059, offset 0, flags [DF], proto TCP (6), length 52)
    127.0.0.1.36352 > 127.0.0.1.10450: Flags [.], cksum 0xfe28 (incorrect -> 0xaa7f), seq 907, ack 56589, win 512, options [nop,nop,TS val 3535148649 ecr 3535148648], length 0
2022-04-08 00:49:09.097878 IP (tos 0x0, ttl 64, id 41430, offset 0, flags [DF], proto TCP (6), length 1906)
    127.0.0.1.10450 > 127.0.0.1.36352: Flags [P.], cksum 0x0567 (incorrect -> 0xc133), seq 56589:58443, ack 907, win 512, options [nop,nop,TS val 3535148649 ecr 3535148649], length 1854
2022-04-08 00:49:09.097904 IP (tos 0x0, ttl 64, id 40060, offset 0, flags [DF], proto TCP (6), length 52)
    127.0.0.1.36352 > 127.0.0.1.10450: Flags [.], cksum 0xfe28 (incorrect -> 0xa340), seq 907, ack 58443, win 512, options [nop,nop,TS val 3535148649 ecr 3535148649], length 0
2022-04-08 00:49:09.102061 IP (tos 0x0, ttl 64, id 41431, offset 0, flags [DF], proto TCP (6), length 2496)
    127.0.0.1.10450 > 127.0.0.1.36352: Flags [P.], cksum 0x07b5 (incorrect -> 0xe138), seq 58443:60887, ack 907, win 512, options [nop,nop,TS val 3535148653 ecr 3535148649], length 2444
2022-04-08 00:49:09.102111 IP (tos 0x0, ttl 64, id 40061, offset 0, flags [DF], proto TCP (6), length 52)
    127.0.0.1.36352 > 127.0.0.1.10450: Flags [.], cksum 0xfe28 (incorrect -> 0x99ac), seq 907, ack 60887, win 512, options [nop,nop,TS val 3535148653 ecr 3535148653], length 0
2022-04-08 00:49:09.102309 IP (tos 0x0, ttl 64, id 41432, offset 0, flags [DF], proto TCP (6), length 3400)
    127.0.0.1.10450 > 127.0.0.1.36352: Flags [P.], cksum 0x0b3d (incorrect -> 0x7ced), seq 60887:64235, ack 907, win 512, options [nop,nop,TS val 3535148654 ecr 3535148653], length 3348
2022-04-08 00:49:09.102691 IP (tos 0x0, ttl 64, id 40062, offset 0, flags [DF], proto TCP (6), length 52)
    127.0.0.1.36352 > 127.0.0.1.10450: Flags [.], cksum 0xfe28 (incorrect -> 0x8c96), seq 907, ack 64235, win 512, options [nop,nop,TS val 3535148654 ecr 3535148654], length 0
2022-04-08 00:49:09.109154 IP (tos 0x0, ttl 64, id 41433, offset 0, flags [DF], proto TCP (6), length 3935)
    127.0.0.1.10450 > 127.0.0.1.36352: Flags [P.], cksum 0x0d54 (incorrect -> 0x1364), seq 64235:68118, ack 907, win 512, options [nop,nop,TS val 3535148660 ecr 3535148654], length 3883
2022-04-08 00:49:09.109216 IP (tos 0x0, ttl 64, id 40063, offset 0, flags [DF], proto TCP (6), length 52)
    127.0.0.1.36352 > 127.0.0.1.10450: Flags [.], cksum 0xfe28 (incorrect -> 0x7d5f), seq 907, ack 68118, win 512, options [nop,nop,TS val 3535148660 ecr 3535148660], length 0
2022-04-08 00:49:09.112229 IP (tos 0x0, ttl 64, id 41434, offset 0, flags [DF], proto TCP (6), length 3882)
    127.0.0.1.10450 > 127.0.0.1.36352: Flags [P.], cksum 0x0d1f (incorrect -> 0xe573), seq 68118:71948, ack 907, win 512, options [nop,nop,TS val 3535148664 ecr 3535148660], length 3830
2022-04-08 00:49:09.112259 IP (tos 0x0, ttl 64, id 40064, offset 0, flags [DF], proto TCP (6), length 52)
    127.0.0.1.36352 > 127.0.0.1.10450: Flags [.], cksum 0xfe28 (incorrect -> 0x6e61), seq 907, ack 71948, win 512, options [nop,nop,TS val 3535148664 ecr 3535148664], length 0
2022-04-08 00:49:09.121048 IP (tos 0x0, ttl 64, id 41435, offset 0, flags [DF], proto TCP (6), length 3366)
    127.0.0.1.10450 > 127.0.0.1.36352: Flags [P.], cksum 0x0b1b (incorrect -> 0x781f), seq 71948:75262, ack 907, win 512, options [nop,nop,TS val 3535148672 ecr 3535148664], length 3314
2022-04-08 00:49:09.121455 IP (tos 0x0, ttl 64, id 40065, offset 0, flags [DF], proto TCP (6), length 52)
    127.0.0.1.36352 > 127.0.0.1.10450: Flags [.], cksum 0xfe28 (incorrect -> 0x615e), seq 907, ack 75262, win 512, options [nop,nop,TS val 3535148673 ecr 3535148672], length 0
2022-04-08 00:49:09.121460 IP (tos 0x0, ttl 64, id 41436, offset 0, flags [DF], proto TCP (6), length 7319)
    127.0.0.1.10450 > 127.0.0.1.36352: Flags [P.], cksum 0x1a8c (incorrect -> 0xecb4), seq 75262:82529, ack 907, win 512, options [nop,nop,TS val 3535148673 ecr 3535148673], length 7267
2022-04-08 00:49:09.121488 IP (tos 0x0, ttl 64, id 40066, offset 0, flags [DF], proto TCP (6), length 52)
    127.0.0.1.36352 > 127.0.0.1.10450: Flags [.], cksum 0xfe28 (incorrect -> 0x44fa), seq 907, ack 82529, win 512, options [nop,nop,TS val 3535148673 ecr 3535148673], length 0
2022-04-08 00:49:09.122638 IP (tos 0x0, ttl 64, id 41437, offset 0, flags [DF], proto TCP (6), length 4036)
    127.0.0.1.10450 > 127.0.0.1.36352: Flags [P.], cksum 0x0db9 (incorrect -> 0x3ee2), seq 82529:86513, ack 907, win 512, options [nop,nop,TS val 3535148674 ecr 3535148673], length 3984
2022-04-08 00:49:09.122990 IP (tos 0x0, ttl 64, id 40067, offset 0, flags [DF], proto TCP (6), length 52)
    127.0.0.1.36352 > 127.0.0.1.10450: Flags [.], cksum 0xfe28 (incorrect -> 0x3568), seq 907, ack 86513, win 512, options [nop,nop,TS val 3535148674 ecr 3535148674], length 0
2022-04-08 00:49:09.122995 IP (tos 0x0, ttl 64, id 41438, offset 0, flags [DF], proto TCP (6), length 7093)
    127.0.0.1.10450 > 127.0.0.1.36352: Flags [P.], cksum 0x19aa (incorrect -> 0x23a7), seq 86513:93554, ack 907, win 512, options [nop,nop,TS val 3535148674 ecr 3535148674], length 7041
2022-04-08 00:49:09.123016 IP (tos 0x0, ttl 64, id 40068, offset 0, flags [DF], proto TCP (6), length 52)
    127.0.0.1.36352 > 127.0.0.1.10450: Flags [.], cksum 0xfe28 (incorrect -> 0x19e7), seq 907, ack 93554, win 512, options [nop,nop,TS val 3535148674 ecr 3535148674], length 0
2022-04-08 00:49:09.123103 IP (tos 0x0, ttl 64, id 41439, offset 0, flags [DF], proto TCP (6), length 3880)
    127.0.0.1.10450 > 127.0.0.1.36352: Flags [P.], cksum 0x0d1d (incorrect -> 0x7fb9), seq 93554:97382, ack 907, win 512, options [nop,nop,TS val 3535148674 ecr 3535148674], length 3828
2022-04-08 00:49:09.123377 IP (tos 0x0, ttl 64, id 40069, offset 0, flags [DF], proto TCP (6), length 52)
    127.0.0.1.36352 > 127.0.0.1.10450: Flags [.], cksum 0xfe28 (incorrect -> 0x0af2), seq 907, ack 97382, win 512, options [nop,nop,TS val 3535148675 ecr 3535148674], length 0
2022-04-08 00:49:09.123381 IP (tos 0x0, ttl 64, id 41440, offset 0, flags [DF], proto TCP (6), length 3990)
    127.0.0.1.10450 > 127.0.0.1.36352: Flags [P.], cksum 0x0d8b (incorrect -> 0xda28), seq 97382:101320, ack 907, win 512, options [nop,nop,TS val 3535148675 ecr 3535148675], length 3938
2022-04-08 00:49:09.123395 IP (tos 0x0, ttl 64, id 40070, offset 0, flags [DF], proto TCP (6), length 52)
    127.0.0.1.36352 > 127.0.0.1.10450: Flags [.], cksum 0xfe28 (incorrect -> 0xfb8e), seq 907, ack 101320, win 512, options [nop,nop,TS val 3535148675 ecr 3535148675], length 0
2022-04-08 00:49:09.123533 IP (tos 0x0, ttl 64, id 41441, offset 0, flags [DF], proto TCP (6), length 550)
    127.0.0.1.10450 > 127.0.0.1.36352: Flags [P.], cksum 0x001b (incorrect -> 0x03f8), seq 101320:101818, ack 907, win 512, options [nop,nop,TS val 3535148675 ecr 3535148675], length 498
2022-04-08 00:49:09.123555 IP (tos 0x0, ttl 64, id 40071, offset 0, flags [DF], proto TCP (6), length 52)
    127.0.0.1.36352 > 127.0.0.1.10450: Flags [.], cksum 0xfe28 (incorrect -> 0xf99c), seq 907, ack 101818, win 512, options [nop,nop,TS val 3535148675 ecr 3535148675], length 0
2022-04-08 00:49:09.123737 IP (tos 0x0, ttl 64, id 41442, offset 0, flags [DF], proto TCP (6), length 3310)
    127.0.0.1.10450 > 127.0.0.1.36352: Flags [P.], cksum 0x0ae3 (incorrect -> 0x5f0e), seq 101818:105076, ack 907, win 512, options [nop,nop,TS val 3535148675 ecr 3535148675], length 3258
2022-04-08 00:49:09.123974 IP (tos 0x0, ttl 64, id 40072, offset 0, flags [DF], proto TCP (6), length 52)
    127.0.0.1.36352 > 127.0.0.1.10450: Flags [.], cksum 0xfe28 (incorrect -> 0xece2), seq 907, ack 105076, win 512, options [nop,nop,TS val 3535148675 ecr 3535148675], length 0
2022-04-08 00:49:09.126772 IP (tos 0x0, ttl 64, id 41443, offset 0, flags [DF], proto TCP (6), length 3818)
    127.0.0.1.10450 > 127.0.0.1.36352: Flags [P.], cksum 0x0cdf (incorrect -> 0x06e4), seq 105076:108842, ack 907, win 512, options [nop,nop,TS val 3535148678 ecr 3535148675], length 3766
2022-04-08 00:49:09.127019 IP (tos 0x0, ttl 64, id 40073, offset 0, flags [DF], proto TCP (6), length 52)
    127.0.0.1.36352 > 127.0.0.1.10450: Flags [.], cksum 0xfe28 (incorrect -> 0xde26), seq 907, ack 108842, win 512, options [nop,nop,TS val 3535148678 ecr 3535148678], length 0
200, 123.30184698104858, 0.8218996524810791