2022-04-08 00:49:31.919203 IP (tos 0x0, ttl 64, id 36955, offset 0, flags [DF], proto TCP (6), length 60)
    127.0.0.1.43658 > 127.0.0.1.11250: Flags [S], cksum 0xfe30 (incorrect -> 0x2bd4), seq 3845465654, win 65495, options [mss 65495,sackOK,TS val 3535171470 ecr 0,nop,wscale 7], length 0
2022-04-08 00:49:31.919216 IP (tos 0x0, ttl 64, id 0, offset 0, flags [DF], proto TCP (6), length 60)
    127.0.0.1.11250 > 127.0.0.1.43658: Flags [S.], cksum 0xfe30 (incorrect -> 0x1f80), seq 4164276691, ack 3845465655, win 65483, options [mss 65495,sackOK,TS val 3535171470 ecr 3535171470,nop,wscale 7], length 0
2022-04-08 00:49:31.919225 IP (tos 0x0, ttl 64, id 36956, offset 0, flags [DF], proto TCP (6), length 52)
    127.0.0.1.43658 > 127.0.0.1.11250: Flags [.], cksum 0xfe28 (incorrect -> 0x463b), seq 1, ack 1, win 512, options [nop,nop,TS val 3535171471 ecr 3535171470], length 0
2022-04-08 00:49:31.919392 IP (tos 0x0, ttl 64, id 36957, offset 0, flags [DF], proto TCP (6), length 55)
    127.0.0.1.43658 > 127.0.0.1.11250: Flags [P.], cksum 0xfe2b (incorrect -> 0x412f), seq 1:4, ack 1, win 512, options [nop,nop,TS val 3535171471 ecr 3535171470], length 3
2022-04-08 00:49:31.919399 IP (tos 0x0, ttl 64, id 7704, offset 0, flags [DF], proto TCP (6), length 52)
    127.0.0.1.11250 > 127.0.0.1.43658: Flags [.], cksum 0xfe28 (incorrect -> 0x4637), seq 1, ack 4, win 512, options [nop,nop,TS val 3535171471 ecr 3535171471], length 0
2022-04-08 00:49:31.919429 IP (tos 0x0, ttl 64, id 7705, offset 0, flags [DF], proto TCP (6), length 54)
    127.0.0.1.11250 > 127.0.0.1.43658: Flags [P.], cksum 0xfe2a (incorrect -> 0x412d), seq 1:3, ack 4, win 512, options [nop,nop,TS val 3535171471 ecr 3535171471], length 2
2022-04-08 00:49:31.919437 IP (tos 0x0, ttl 64, id 36958, offset 0, flags [DF], proto TCP (6), length 52)
    127.0.0.1.43658 > 127.0.0.1.11250: Flags [.], cksum 0xfe28 (incorrect -> 0x4635), seq 4, ack 3, win 512, options [nop,nop,TS val 3535171471 ecr 3535171471], length 0
2022-04-08 00:49:31.930924 IP (tos 0x0, ttl 64, id 36959, offset 0, flags [DF], proto TCP (6), length 62)
    127.0.0.1.43658 > 127.0.0.1.11250: Flags [P.], cksum 0xfe32 (incorrect -> 0xb61d), seq 4:14, ack 3, win 512, options [nop,nop,TS val 3535171482 ecr 3535171471], length 10
2022-04-08 00:49:31.930940 IP (tos 0x0, ttl 64, id 7706, offset 0, flags [DF], proto TCP (6), length 52)
    127.0.0.1.11250 > 127.0.0.1.43658: Flags [.], cksum 0xfe28 (incorrect -> 0x4615), seq 3, ack 14, win 512, options [nop,nop,TS val 3535171482 ecr 3535171482], length 0
2022-04-08 00:49:31.985687 IP (tos 0x0, ttl 64, id 7707, offset 0, flags [DF], proto TCP (6), length 62)
    127.0.0.1.11250 > 127.0.0.1.43658: Flags [P.], cksum 0xfe32 (incorrect -> 0x40cb), seq 3:13, ack 14, win 512, options [nop,nop,TS val 3535171537 ecr 3535171482], length 10
2022-04-08 00:49:31.985697 IP (tos 0x0, ttl 64, id 36960, offset 0, flags [DF], proto TCP (6), length 52)
    127.0.0.1.43658 > 127.0.0.1.11250: Flags [.], cksum 0xfe28 (incorrect -> 0x459d), seq 14, ack 13, win 512, options [nop,nop,TS val 3535171537 ecr 3535171537], length 0
2022-04-08 00:49:31.995569 IP (tos 0x0, ttl 64, id 36961, offset 0, flags [DF], proto TCP (6), length 569)
    127.0.0.1.43658 > 127.0.0.1.11250: Flags [P.], cksum 0x002e (incorrect -> 0x389d), seq 14:531, ack 13, win 512, options [nop,nop,TS val 3535171547 ecr 3535171537], length 517
2022-04-08 00:49:31.995590 IP (tos 0x0, ttl 64, id 7708, offset 0, flags [DF], proto TCP (6), length 52)
    127.0.0.1.11250 > 127.0.0.1.43658: Flags [.], cksum 0xfe28 (incorrect -> 0x4388), seq 13, ack 531, win 508, options [nop,nop,TS val 3535171547 ecr 3535171547], length 0
2022-04-08 00:49:32.058974 IP (tos 0x0, ttl 64, id 7709, offset 0, flags [DF], proto TCP (6), length 3538)
    127.0.0.1.11250 > 127.0.0.1.43658: Flags [P.], cksum 0x0bc7 (incorrect -> 0x4d12), seq 13:3499, ack 531, win 512, options [nop,nop,TS val 3535171610 ecr 3535171547], length 3486
2022-04-08 00:49:32.058995 IP (tos 0x0, ttl 64, id 36962, offset 0, flags [DF], proto TCP (6), length 52)
    127.0.0.1.43658 > 127.0.0.1.11250: Flags [.], cksum 0xfe28 (incorrect -> 0x357a), seq 531, ack 3499, win 494, options [nop,nop,TS val 3535171610 ecr 3535171610], length 0
200, 3.88405704498291, 0.28703761100769043