2022-04-08 00:38:06.128403 IP (tos 0x0, ttl 64, id 51599, offset 0, flags [DF], proto TCP (6), length 60)
    127.0.0.1.36910 > 127.0.0.1.10950: Flags [S], cksum 0xfe30 (incorrect -> 0xfeaf), seq 2747410238, win 65495, options [mss 65495,sackOK,TS val 3534485680 ecr 0,nop,wscale 7], length 0
2022-04-08 00:38:06.128423 IP (tos 0x0, ttl 64, id 0, offset 0, flags [DF], proto TCP (6), length 60)
    127.0.0.1.10950 > 127.0.0.1.36910: Flags [S.], cksum 0xfe30 (incorrect -> 0x345d), seq 954058259, ack 2747410239, win 65483, options [mss 65495,sackOK,TS val 3534485680 ecr 3534485680,nop,wscale 7], length 0
2022-04-08 00:38:06.128439 IP (tos 0x0, ttl 64, id 51600, offset 0, flags [DF], proto TCP (6), length 52)
    127.0.0.1.36910 > 127.0.0.1.10950: Flags [.], cksum 0xfe28 (incorrect -> 0x5b19), seq 1, ack 1, win 512, options [nop,nop,TS val 3534485680 ecr 3534485680], length 0
2022-04-08 00:38:06.128556 IP (tos 0x0, ttl 64, id 51601, offset 0, flags [DF], proto TCP (6), length 55)
    127.0.0.1.36910 > 127.0.0.1.10950: Flags [P.], cksum 0xfe2b (incorrect -> 0x560d), seq 1:4, ack 1, win 512, options [nop,nop,TS val 3534485680 ecr 3534485680], length 3
2022-04-08 00:38:06.128565 IP (tos 0x0, ttl 64, id 292, offset 0, flags [DF], proto TCP (6), length 52)
    127.0.0.1.10950 > 127.0.0.1.36910: Flags [.], cksum 0xfe28 (incorrect -> 0x5b16), seq 1, ack 4, win 512, options [nop,nop,TS val 3534485680 ecr 3534485680], length 0
2022-04-08 00:38:06.128623 IP (tos 0x0, ttl 64, id 293, offset 0, flags [DF], proto TCP (6), length 54)
    127.0.0.1.10950 > 127.0.0.1.36910: Flags [P.], cksum 0xfe2a (incorrect -> 0x560c), seq 1:3, ack 4, win 512, options [nop,nop,TS val 3534485680 ecr 3534485680], length 2
2022-04-08 00:38:06.128640 IP (tos 0x0, ttl 64, id 51602, offset 0, flags [DF], proto TCP (6), length 52)
    127.0.0.1.36910 > 127.0.0.1.10950: Flags [.], cksum 0xfe28 (incorrect -> 0x5b14), seq 4, ack 3, win 512, options [nop,nop,TS val 3534485680 ecr 3534485680], length 0
2022-04-08 00:38:06.160791 IP (tos 0x0, ttl 64, id 51603, offset 0, flags [DF], proto TCP (6), length 62)
    127.0.0.1.36910 > 127.0.0.1.10950: Flags [P.], cksum 0xfe32 (incorrect -> 0xb11c), seq 4:14, ack 3, win 512, options [nop,nop,TS val 3534485712 ecr 3534485680], length 10
2022-04-08 00:38:06.160805 IP (tos 0x0, ttl 64, id 294, offset 0, flags [DF], proto TCP (6), length 52)
    127.0.0.1.10950 > 127.0.0.1.36910: Flags [.], cksum 0xfe28 (incorrect -> 0x5aca), seq 3, ack 14, win 512, options [nop,nop,TS val 3534485712 ecr 3534485712], length 0
2022-04-08 00:38:07.363629 IP (tos 0x0, ttl 64, id 295, offset 0, flags [DF], proto TCP (6), length 62)
    127.0.0.1.10950 > 127.0.0.1.36910: Flags [P.], cksum 0xfe32 (incorrect -> 0x5104), seq 3:13, ack 14, win 512, options [nop,nop,TS val 3534486915 ecr 3534485712], length 10
2022-04-08 00:38:07.363638 IP (tos 0x0, ttl 64, id 51604, offset 0, flags [DF], proto TCP (6), length 52)
    127.0.0.1.36910 > 127.0.0.1.10950: Flags [.], cksum 0xfe28 (incorrect -> 0x515a), seq 14, ack 13, win 512, options [nop,nop,TS val 3534486915 ecr 3534486915], length 0
2022-04-08 00:38:07.369252 IP (tos 0x0, ttl 64, id 51605, offset 0, flags [DF], proto TCP (6), length 569)
    127.0.0.1.36910 > 127.0.0.1.10950: Flags [P.], cksum 0x002e (incorrect -> 0xc165), seq 14:531, ack 13, win 512, options [nop,nop,TS val 3534486921 ecr 3534486915], length 517
2022-04-08 00:38:07.369268 IP (tos 0x0, ttl 64, id 296, offset 0, flags [DF], proto TCP (6), length 52)
    127.0.0.1.10950 > 127.0.0.1.36910: Flags [.], cksum 0xfe28 (incorrect -> 0x4f4d), seq 13, ack 531, win 508, options [nop,nop,TS val 3534486921 ecr 3534486921], length 0
2022-04-08 00:38:11.616963 IP (tos 0x0, ttl 64, id 297, offset 0, flags [DF], proto TCP (6), length 151)
    127.0.0.1.10950 > 127.0.0.1.36910: Flags [P.], cksum 0xfe8b (incorrect -> 0x090c), seq 13:112, ack 531, win 512, options [nop,nop,TS val 3534491168 ecr 3534486921], length 99
2022-04-08 00:38:11.616972 IP (tos 0x0, ttl 64, id 51606, offset 0, flags [DF], proto TCP (6), length 52)
    127.0.0.1.36910 > 127.0.0.1.10950: Flags [.], cksum 0xfe28 (incorrect -> 0x2db8), seq 531, ack 112, win 512, options [nop,nop,TS val 3534491168 ecr 3534491168], length 0
2022-04-08 00:38:11.617171 IP (tos 0x0, ttl 64, id 51607, offset 0, flags [DF], proto TCP (6), length 575)
    127.0.0.1.36910 > 127.0.0.1.10950: Flags [P.], cksum 0x0034 (incorrect -> 0x48c9), seq 531:1054, ack 112, win 512, options [nop,nop,TS val 3534491168 ecr 3534491168], length 523
2022-04-08 00:38:11.617176 IP (tos 0x0, ttl 64, id 298, offset 0, flags [DF], proto TCP (6), length 52)
    127.0.0.1.10950 > 127.0.0.1.36910: Flags [.], cksum 0xfe28 (incorrect -> 0x2bb1), seq 112, ack 1054, win 508, options [nop,nop,TS val 3534491168 ecr 3534491168], length 0
2022-04-08 00:38:12.884198 IP (tos 0x0, ttl 64, id 299, offset 0, flags [DF], proto TCP (6), length 3538)
    127.0.0.1.10950 > 127.0.0.1.36910: Flags [P.], cksum 0x0bc7 (incorrect -> 0x8fec), seq 112:3598, ack 1054, win 512, options [nop,nop,TS val 3534492435 ecr 3534491168], length 3486
2022-04-08 00:38:12.884205 IP (tos 0x0, ttl 64, id 51608, offset 0, flags [DF], proto TCP (6), length 52)
    127.0.0.1.36910 > 127.0.0.1.10950: Flags [.], cksum 0xfe28 (incorrect -> 0x143b), seq 1054, ack 3598, win 494, options [nop,nop,TS val 3534492435 ecr 3534492435], length 0
2022-04-08 00:38:12.891728 IP (tos 0x0, ttl 64, id 300, offset 0, flags [DF], proto TCP (6), length 1048)
    127.0.0.1.10950 > 127.0.0.1.36910: Flags [P.], cksum 0x020d (incorrect -> 0x7ffd), seq 3598:4594, ack 1054, win 512, options [nop,nop,TS val 3534492443 ecr 3534492435], length 996
2022-04-08 00:38:12.891736 IP (tos 0x0, ttl 64, id 51609, offset 0, flags [DF], proto TCP (6), length 52)
    127.0.0.1.36910 > 127.0.0.1.10950: Flags [.], cksum 0xfe28 (incorrect -> 0x103d), seq 1054, ack 4594, win 504, options [nop,nop,TS val 3534492443 ecr 3534492443], length 0
2022-04-08 00:38:12.900465 IP (tos 0x0, ttl 64, id 301, offset 0, flags [DF], proto TCP (6), length 4100)
    127.0.0.1.10950 > 127.0.0.1.36910: Flags [P.], cksum 0x0df9 (incorrect -> 0xe9df), seq 4594:8642, ack 1054, win 512, options [nop,nop,TS val 3534492452 ecr 3534492443], length 4048
2022-04-08 00:38:12.900468 IP (tos 0x0, ttl 64, id 51610, offset 0, flags [DF], proto TCP (6), length 52)
    127.0.0.1.36910 > 127.0.0.1.10950: Flags [.], cksum 0xfe28 (incorrect -> 0x0067), seq 1054, ack 8642, win 492, options [nop,nop,TS val 3534492452 ecr 3534492452], length 0
2022-04-08 00:38:12.900473 IP (tos 0x0, ttl 64, id 302, offset 0, flags [DF], proto TCP (6), length 486)
    127.0.0.1.10950 > 127.0.0.1.36910: Flags [P.], cksum 0xffda (incorrect -> 0x6aed), seq 8642:9076, ack 1054, win 512, options [nop,nop,TS val 3534492452 ecr 3534492452], length 434
2022-04-08 00:38:12.900475 IP (tos 0x0, ttl 64, id 51611, offset 0, flags [DF], proto TCP (6), length 52)
    127.0.0.1.36910 > 127.0.0.1.10950: Flags [.], cksum 0xfe28 (incorrect -> 0xfeb6), seq 1054, ack 9076, win 490, options [nop,nop,TS val 3534492452 ecr 3534492452], length 0
2022-04-08 00:38:12.952450 IP (tos 0x0, ttl 64, id 303, offset 0, flags [DF], proto TCP (6), length 1388)
    127.0.0.1.10950 > 127.0.0.1.36910: Flags [P.], cksum 0x0361 (incorrect -> 0x9ca9), seq 9076:10412, ack 1054, win 512, options [nop,nop,TS val 3534492504 ecr 3534492452], length 1336
2022-04-08 00:38:12.952456 IP (tos 0x0, ttl 64, id 51612, offset 0, flags [DF], proto TCP (6), length 52)
    127.0.0.1.36910 > 127.0.0.1.10950: Flags [.], cksum 0xfe28 (incorrect -> 0xf90a), seq 1054, ack 10412, win 502, options [nop,nop,TS val 3534492504 ecr 3534492504], length 0
2022-04-08 00:38:12.953107 IP (tos 0x0, ttl 64, id 51613, offset 0, flags [DF], proto TCP (6), length 126)
    127.0.0.1.36910 > 127.0.0.1.10950: Flags [P.], cksum 0xfe72 (incorrect -> 0xb96d), seq 1054:1128, ack 10412, win 512, options [nop,nop,TS val 3534492504 ecr 3534492504], length 74
2022-04-08 00:38:12.953114 IP (tos 0x0, ttl 64, id 304, offset 0, flags [DF], proto TCP (6), length 52)
    127.0.0.1.10950 > 127.0.0.1.36910: Flags [.], cksum 0xfe28 (incorrect -> 0xf8b6), seq 10412, ack 1128, win 512, options [nop,nop,TS val 3534492504 ecr 3534492504], length 0
2022-04-08 00:38:12.953558 IP (tos 0x0, ttl 64, id 51614, offset 0, flags [DF], proto TCP (6), length 404)
    127.0.0.1.36910 > 127.0.0.1.10950: Flags [P.], cksum 0xff88 (incorrect -> 0x9a28), seq 1128:1480, ack 10412, win 512, options [nop,nop,TS val 3534492505 ecr 3534492504], length 352
2022-04-08 00:38:12.953564 IP (tos 0x0, ttl 64, id 305, offset 0, flags [DF], proto TCP (6), length 52)
    127.0.0.1.10950 > 127.0.0.1.36910: Flags [.], cksum 0xfe28 (incorrect -> 0xf756), seq 10412, ack 1480, win 510, options [nop,nop,TS val 3534492505 ecr 3534492505], length 0
2022-04-08 00:38:13.054469 IP (tos 0x0, ttl 64, id 306, offset 0, flags [DF], proto TCP (6), length 626)
    127.0.0.1.10950 > 127.0.0.1.36910: Flags [P.], cksum 0x0067 (incorrect -> 0x4382), seq 10412:10986, ack 1480, win 512, options [nop,nop,TS val 3534492606 ecr 3534492505], length 574
2022-04-08 00:38:13.094777 IP (tos 0x0, ttl 64, id 51615, offset 0, flags [DF], proto TCP (6), length 52)
    127.0.0.1.36910 > 127.0.0.1.10950: Flags [.], cksum 0xfe28 (incorrect -> 0xf424), seq 1480, ack 10986, win 512, options [nop,nop,TS val 3534492646 ecr 3534492606], length 0
200, 8.94054889678955, 7.671635389328003