2022-04-08 02:29:20.602835 IP (tos 0x0, ttl 64, id 21960, offset 0, flags [DF], proto TCP (6), length 60)
    127.0.0.1.59420 > 127.0.0.1.10850: Flags [S], cksum 0xfe30 (incorrect -> 0x564a), seq 1820972738, win 65495, options [mss 65495,sackOK,TS val 3541160154 ecr 0,nop,wscale 7], length 0
2022-04-08 02:29:20.602849 IP (tos 0x0, ttl 64, id 0, offset 0, flags [DF], proto TCP (6), length 60)
    127.0.0.1.10850 > 127.0.0.1.59420: Flags [S.], cksum 0xfe30 (incorrect -> 0xa281), seq 2587784600, ack 1820972739, win 65483, options [mss 65495,sackOK,TS val 3541160154 ecr 3541160154,nop,wscale 7], length 0
2022-04-08 02:29:20.602860 IP (tos 0x0, ttl 64, id 21961, offset 0, flags [DF], proto TCP (6), length 52)
    127.0.0.1.59420 > 127.0.0.1.10850: Flags [.], cksum 0xfe28 (incorrect -> 0xc93d), seq 1, ack 1, win 512, options [nop,nop,TS val 3541160154 ecr 3541160154], length 0
2022-04-08 02:29:20.602954 IP (tos 0x0, ttl 64, id 21962, offset 0, flags [DF], proto TCP (6), length 55)
    127.0.0.1.59420 > 127.0.0.1.10850: Flags [P.], cksum 0xfe2b (incorrect -> 0xc431), seq 1:4, ack 1, win 512, options [nop,nop,TS val 3541160154 ecr 3541160154], length 3
2022-04-08 02:29:20.602964 IP (tos 0x0, ttl 64, id 3541, offset 0, flags [DF], proto TCP (6), length 52)
    127.0.0.1.10850 > 127.0.0.1.59420: Flags [.], cksum 0xfe28 (incorrect -> 0xc93a), seq 1, ack 4, win 512, options [nop,nop,TS val 3541160154 ecr 3541160154], length 0
2022-04-08 02:29:20.602999 IP (tos 0x0, ttl 64, id 3542, offset 0, flags [DF], proto TCP (6), length 54)
    127.0.0.1.10850 > 127.0.0.1.59420: Flags [P.], cksum 0xfe2a (incorrect -> 0xc430), seq 1:3, ack 4, win 512, options [nop,nop,TS val 3541160154 ecr 3541160154], length 2
2022-04-08 02:29:20.603009 IP (tos 0x0, ttl 64, id 21963, offset 0, flags [DF], proto TCP (6), length 52)
    127.0.0.1.59420 > 127.0.0.1.10850: Flags [.], cksum 0xfe28 (incorrect -> 0xc938), seq 4, ack 3, win 512, options [nop,nop,TS val 3541160154 ecr 3541160154], length 0
2022-04-08 02:29:20.842205 IP (tos 0x0, ttl 64, id 21964, offset 0, flags [DF], proto TCP (6), length 62)
    127.0.0.1.59420 > 127.0.0.1.10850: Flags [P.], cksum 0xfe32 (incorrect -> 0x1dca), seq 4:14, ack 3, win 512, options [nop,nop,TS val 3541160393 ecr 3541160154], length 10
2022-04-08 02:29:20.842229 IP (tos 0x0, ttl 64, id 3543, offset 0, flags [DF], proto TCP (6), length 52)
    127.0.0.1.10850 > 127.0.0.1.59420: Flags [.], cksum 0xfe28 (incorrect -> 0xc750), seq 3, ack 14, win 512, options [nop,nop,TS val 3541160393 ecr 3541160393], length 0
2022-04-08 02:29:21.119128 IP (tos 0x0, ttl 64, id 3544, offset 0, flags [DF], proto TCP (6), length 62)
    127.0.0.1.10850 > 127.0.0.1.59420: Flags [P.], cksum 0xfe32 (incorrect -> 0xc128), seq 3:13, ack 14, win 512, options [nop,nop,TS val 3541160670 ecr 3541160393], length 10
2022-04-08 02:29:21.119139 IP (tos 0x0, ttl 64, id 21965, offset 0, flags [DF], proto TCP (6), length 52)
    127.0.0.1.59420 > 127.0.0.1.10850: Flags [.], cksum 0xfe28 (incorrect -> 0xc51c), seq 14, ack 13, win 512, options [nop,nop,TS val 3541160670 ecr 3541160670], length 0
2022-04-08 02:29:21.124814 IP (tos 0x0, ttl 64, id 21966, offset 0, flags [DF], proto TCP (6), length 569)
    127.0.0.1.59420 > 127.0.0.1.10850: Flags [P.], cksum 0x002e (incorrect -> 0x4f1d), seq 14:531, ack 13, win 512, options [nop,nop,TS val 3541160676 ecr 3541160670], length 517
2022-04-08 02:29:21.124822 IP (tos 0x0, ttl 64, id 3545, offset 0, flags [DF], proto TCP (6), length 52)
    127.0.0.1.10850 > 127.0.0.1.59420: Flags [.], cksum 0xfe28 (incorrect -> 0xc30f), seq 13, ack 531, win 508, options [nop,nop,TS val 3541160676 ecr 3541160676], length 0
