2022-04-08 00:42:25.330324 IP (tos 0x0, ttl 64, id 26479, offset 0, flags [DF], proto TCP (6), length 60)
    127.0.0.1.46676 > 127.0.0.1.10250: Flags [S], cksum 0xfe30 (incorrect -> 0x1dff), seq 1993415920, win 65495, options [mss 65495,sackOK,TS val 3534744882 ecr 0,nop,wscale 7], length 0
2022-04-08 00:42:25.330333 IP (tos 0x0, ttl 64, id 0, offset 0, flags [DF], proto TCP (6), length 60)
    127.0.0.1.10250 > 127.0.0.1.46676: Flags [S.], cksum 0xfe30 (incorrect -> 0x8ad2), seq 2123322549, ack 1993415921, win 65483, options [mss 65495,sackOK,TS val 3534744882 ecr 3534744882,nop,wscale 7], length 0
2022-04-08 00:42:25.330340 IP (tos 0x0, ttl 64, id 26480, offset 0, flags [DF], proto TCP (6), length 52)
    127.0.0.1.46676 > 127.0.0.1.10250: Flags [.], cksum 0xfe28 (incorrect -> 0xb18e), seq 1, ack 1, win 512, options [nop,nop,TS val 3534744882 ecr 3534744882], length 0
2022-04-08 00:42:25.330432 IP (tos 0x0, ttl 64, id 26481, offset 0, flags [DF], proto TCP (6), length 55)
    127.0.0.1.46676 > 127.0.0.1.10250: Flags [P.], cksum 0xfe2b (incorrect -> 0xac82), seq 1:4, ack 1, win 512, options [nop,nop,TS val 3534744882 ecr 3534744882], length 3
2022-04-08 00:42:25.330446 IP (tos 0x0, ttl 64, id 239, offset 0, flags [DF], proto TCP (6), length 52)
    127.0.0.1.10250 > 127.0.0.1.46676: Flags [.], cksum 0xfe28 (incorrect -> 0xb18b), seq 1, ack 4, win 512, options [nop,nop,TS val 3534744882 ecr 3534744882], length 0
2022-04-08 00:42:25.330470 IP (tos 0x0, ttl 64, id 240, offset 0, flags [DF], proto TCP (6), length 54)
    127.0.0.1.10250 > 127.0.0.1.46676: Flags [P.], cksum 0xfe2a (incorrect -> 0xac81), seq 1:3, ack 4, win 512, options [nop,nop,TS val 3534744882 ecr 3534744882], length 2
2022-04-08 00:42:25.330480 IP (tos 0x0, ttl 64, id 26482, offset 0, flags [DF], proto TCP (6), length 52)
    127.0.0.1.46676 > 127.0.0.1.10250: Flags [.], cksum 0xfe28 (incorrect -> 0xb189), seq 4, ack 3, win 512, options [nop,nop,TS val 3534744882 ecr 3534744882], length 0
2022-04-08 00:42:25.355642 IP (tos 0x0, ttl 64, id 26483, offset 0, flags [DF], proto TCP (6), length 62)
    127.0.0.1.46676 > 127.0.0.1.10250: Flags [P.], cksum 0xfe32 (incorrect -> 0x7271), seq 4:14, ack 3, win 512, options [nop,nop,TS val 3534744907 ecr 3534744882], length 10
2022-04-08 00:42:25.355657 IP (tos 0x0, ttl 64, id 241, offset 0, flags [DF], proto TCP (6), length 52)
    127.0.0.1.10250 > 127.0.0.1.46676: Flags [.], cksum 0xfe28 (incorrect -> 0xb14d), seq 3, ack 14, win 512, options [nop,nop,TS val 3534744907 ecr 3534744907], length 0
2022-04-08 00:42:25.520332 IP (tos 0x0, ttl 64, id 242, offset 0, flags [DF], proto TCP (6), length 62)
    127.0.0.1.10250 > 127.0.0.1.46676: Flags [P.], cksum 0xfe32 (incorrect -> 0xab95), seq 3:13, ack 14, win 512, options [nop,nop,TS val 3534745072 ecr 3534744907], length 10
2022-04-08 00:42:25.520350 IP (tos 0x0, ttl 64, id 26484, offset 0, flags [DF], proto TCP (6), length 52)
    127.0.0.1.46676 > 127.0.0.1.10250: Flags [.], cksum 0xfe28 (incorrect -> 0xaff9), seq 14, ack 13, win 512, options [nop,nop,TS val 3534745072 ecr 3534745072], length 0
2022-04-08 00:42:25.526045 IP (tos 0x0, ttl 64, id 26485, offset 0, flags [DF], proto TCP (6), length 569)
    127.0.0.1.46676 > 127.0.0.1.10250: Flags [P.], cksum 0x002e (incorrect -> 0x728d), seq 14:531, ack 13, win 512, options [nop,nop,TS val 3534745077 ecr 3534745072], length 517
2022-04-08 00:42:25.526057 IP (tos 0x0, ttl 64, id 243, offset 0, flags [DF], proto TCP (6), length 52)
    127.0.0.1.10250 > 127.0.0.1.46676: Flags [.], cksum 0xfe28 (incorrect -> 0xadee), seq 13, ack 531, win 508, options [nop,nop,TS val 3534745077 ecr 3534745077], length 0
2022-04-08 00:42:25.683382 IP (tos 0x0, ttl 64, id 244, offset 0, flags [DF], proto TCP (6), length 3538)
    127.0.0.1.10250 > 127.0.0.1.46676: Flags [P.], cksum 0x0bc7 (incorrect -> 0x8c43), seq 13:3499, ack 531, win 512, options [nop,nop,TS val 3534745235 ecr 3534745077], length 3486
2022-04-08 00:42:25.683391 IP (tos 0x0, ttl 64, id 26486, offset 0, flags [DF], proto TCP (6), length 52)
    127.0.0.1.46676 > 127.0.0.1.10250: Flags [.], cksum 0xfe28 (incorrect -> 0x9f22), seq 531, ack 3499, win 494, options [nop,nop,TS val 3534745235 ecr 3534745235], length 0
2022-04-08 00:42:25.794911 IP (tos 0x0, ttl 64, id 245, offset 0, flags [DF], proto TCP (6), length 807)
    127.0.0.1.10250 > 127.0.0.1.46676: Flags [P.], cksum 0x011c (incorrect -> 0x1f64), seq 3499:4254, ack 531, win 512, options [nop,nop,TS val 3534745346 ecr 3534745235], length 755
2022-04-08 00:42:25.794921 IP (tos 0x0, ttl 64, id 26487, offset 0, flags [DF], proto TCP (6), length 52)
    127.0.0.1.46676 > 127.0.0.1.10250: Flags [.], cksum 0xfe28 (incorrect -> 0x9b46), seq 531, ack 4254, win 505, options [nop,nop,TS val 3534745346 ecr 3534745346], length 0
2022-04-08 00:42:25.795353 IP (tos 0x0, ttl 64, id 26488, offset 0, flags [DF], proto TCP (6), length 116)
    127.0.0.1.46676 > 127.0.0.1.10250: Flags [P.], cksum 0xfe68 (incorrect -> 0xa308), seq 531:595, ack 4254, win 512, options [nop,nop,TS val 3534745347 ecr 3534745346], length 64
2022-04-08 00:42:25.795361 IP (tos 0x0, ttl 64, id 246, offset 0, flags [DF], proto TCP (6), length 52)
    127.0.0.1.10250 > 127.0.0.1.46676: Flags [.], cksum 0xfe28 (incorrect -> 0x9afd), seq 4254, ack 595, win 512, options [nop,nop,TS val 3534745347 ecr 3534745347], length 0
2022-04-08 00:42:25.795774 IP (tos 0x0, ttl 64, id 26489, offset 0, flags [DF], proto TCP (6), length 372)
    127.0.0.1.46676 > 127.0.0.1.10250: Flags [P.], cksum 0xff68 (incorrect -> 0x05a4), seq 595:915, ack 4254, win 512, options [nop,nop,TS val 3534745347 ecr 3534745347], length 320
2022-04-08 00:42:25.795782 IP (tos 0x0, ttl 64, id 247, offset 0, flags [DF], proto TCP (6), length 52)
    127.0.0.1.10250 > 127.0.0.1.46676: Flags [.], cksum 0xfe28 (incorrect -> 0x99bf), seq 4254, ack 915, win 510, options [nop,nop,TS val 3534745347 ecr 3534745347], length 0
2022-04-08 00:42:26.026257 IP (tos 0x0, ttl 64, id 248, offset 0, flags [DF], proto TCP (6), length 607)
    127.0.0.1.10250 > 127.0.0.1.46676: Flags [P.], cksum 0x0054 (incorrect -> 0x6862), seq 4254:4809, ack 915, win 512, options [nop,nop,TS val 3534745578 ecr 3534745347], length 555
2022-04-08 00:42:26.026268 IP (tos 0x0, ttl 64, id 26490, offset 0, flags [DF], proto TCP (6), length 52)
    127.0.0.1.46676 > 127.0.0.1.10250: Flags [.], cksum 0xfe28 (incorrect -> 0x95c8), seq 915, ack 4809, win 508, options [nop,nop,TS val 3534745578 ecr 3534745578], length 0
2022-04-08 00:42:26.028045 IP (tos 0x0, ttl 64, id 5241, offset 0, flags [DF], proto TCP (6), length 60)
    127.0.0.1.46678 > 127.0.0.1.10250: Flags [S], cksum 0xfe30 (incorrect -> 0xa88d), seq 1725276066, win 65495, options [mss 65495,sackOK,TS val 3534745579 ecr 0,nop,wscale 7], length 0
2022-04-08 00:42:26.028054 IP (tos 0x0, ttl 64, id 0, offset 0, flags [DF], proto TCP (6), length 60)
    127.0.0.1.10250 > 127.0.0.1.46678: Flags [S.], cksum 0xfe30 (incorrect -> 0xe7fc), seq 2664980247, ack 1725276067, win 65483, options [mss 65495,sackOK,TS val 3534745579 ecr 3534745579,nop,wscale 7], length 0
2022-04-08 00:42:26.028062 IP (tos 0x0, ttl 64, id 5242, offset 0, flags [DF], proto TCP (6), length 52)
    127.0.0.1.46678 > 127.0.0.1.10250: Flags [.], cksum 0xfe28 (incorrect -> 0x0eb9), seq 1, ack 1, win 512, options [nop,nop,TS val 3534745579 ecr 3534745579], length 0
2022-04-08 00:42:26.028142 IP (tos 0x0, ttl 64, id 5243, offset 0, flags [DF], proto TCP (6), length 55)
    127.0.0.1.46678 > 127.0.0.1.10250: Flags [P.], cksum 0xfe2b (incorrect -> 0x09ad), seq 1:4, ack 1, win 512, options [nop,nop,TS val 3534745579 ecr 3534745579], length 3
2022-04-08 00:42:26.028148 IP (tos 0x0, ttl 64, id 6923, offset 0, flags [DF], proto TCP (6), length 52)
    127.0.0.1.10250 > 127.0.0.1.46678: Flags [.], cksum 0xfe28 (incorrect -> 0x0eb6), seq 1, ack 4, win 512, options [nop,nop,TS val 3534745579 ecr 3534745579], length 0
2022-04-08 00:42:26.028169 IP (tos 0x0, ttl 64, id 6924, offset 0, flags [DF], proto TCP (6), length 54)
    127.0.0.1.10250 > 127.0.0.1.46678: Flags [P.], cksum 0xfe2a (incorrect -> 0x09ac), seq 1:3, ack 4, win 512, options [nop,nop,TS val 3534745579 ecr 3534745579], length 2
2022-04-08 00:42:26.028178 IP (tos 0x0, ttl 64, id 5244, offset 0, flags [DF], proto TCP (6), length 52)
    127.0.0.1.46678 > 127.0.0.1.10250: Flags [.], cksum 0xfe28 (incorrect -> 0x0eb4), seq 4, ack 3, win 512, options [nop,nop,TS val 3534745579 ecr 3534745579], length 0
2022-04-08 00:42:26.029248 IP (tos 0x0, ttl 64, id 5245, offset 0, flags [DF], proto TCP (6), length 62)
    127.0.0.1.46678 > 127.0.0.1.10250: Flags [P.], cksum 0xfe32 (incorrect -> 0xcfe9), seq 4:14, ack 3, win 512, options [nop,nop,TS val 3534745581 ecr 3534745579], length 10
2022-04-08 00:42:26.029254 IP (tos 0x0, ttl 64, id 6925, offset 0, flags [DF], proto TCP (6), length 52)
    127.0.0.1.10250 > 127.0.0.1.46678: Flags [.], cksum 0xfe28 (incorrect -> 0x0ea6), seq 3, ack 14, win 512, options [nop,nop,TS val 3534745581 ecr 3534745581], length 0
2022-04-08 00:42:26.183891 IP (tos 0x0, ttl 64, id 6926, offset 0, flags [DF], proto TCP (6), length 62)
    127.0.0.1.10250 > 127.0.0.1.46678: Flags [P.], cksum 0xfe32 (incorrect -> 0x08f9), seq 3:13, ack 14, win 512, options [nop,nop,TS val 3534745735 ecr 3534745581], length 10
2022-04-08 00:42:26.183900 IP (tos 0x0, ttl 64, id 5246, offset 0, flags [DF], proto TCP (6), length 52)
    127.0.0.1.46678 > 127.0.0.1.10250: Flags [.], cksum 0xfe28 (incorrect -> 0x0d68), seq 14, ack 13, win 512, options [nop,nop,TS val 3534745735 ecr 3534745735], length 0
2022-04-08 00:42:26.188881 IP (tos 0x0, ttl 64, id 5247, offset 0, flags [DF], proto TCP (6), length 569)
    127.0.0.1.46678 > 127.0.0.1.10250: Flags [P.], cksum 0x002e (incorrect -> 0xd1c1), seq 14:531, ack 13, win 512, options [nop,nop,TS val 3534745740 ecr 3534745735], length 517
2022-04-08 00:42:26.188891 IP (tos 0x0, ttl 64, id 6927, offset 0, flags [DF], proto TCP (6), length 52)
    127.0.0.1.10250 > 127.0.0.1.46678: Flags [.], cksum 0xfe28 (incorrect -> 0x0b5d), seq 13, ack 531, win 508, options [nop,nop,TS val 3534745740 ecr 3534745740], length 0
2022-04-08 00:42:26.367316 IP (tos 0x0, ttl 64, id 6928, offset 0, flags [DF], proto TCP (6), length 3538)
    127.0.0.1.10250 > 127.0.0.1.46678: Flags [P.], cksum 0x0bc7 (incorrect -> 0x049c), seq 13:3499, ack 531, win 512, options [nop,nop,TS val 3534745919 ecr 3534745740], length 3486
2022-04-08 00:42:26.367338 IP (tos 0x0, ttl 64, id 5248, offset 0, flags [DF], proto TCP (6), length 52)
    127.0.0.1.46678 > 127.0.0.1.10250: Flags [.], cksum 0xfe28 (incorrect -> 0xfc66), seq 531, ack 3499, win 494, options [nop,nop,TS val 3534745919 ecr 3534745919], length 0
2022-04-08 00:42:26.464545 IP (tos 0x0, ttl 64, id 6929, offset 0, flags [DF], proto TCP (6), length 807)
    127.0.0.1.10250 > 127.0.0.1.46678: Flags [P.], cksum 0x011c (incorrect -> 0x1d09), seq 3499:4254, ack 531, win 512, options [nop,nop,TS val 3534746016 ecr 3534745919], length 755
2022-04-08 00:42:26.464561 IP (tos 0x0, ttl 64, id 5249, offset 0, flags [DF], proto TCP (6), length 52)
    127.0.0.1.46678 > 127.0.0.1.10250: Flags [.], cksum 0xfe28 (incorrect -> 0xf8a6), seq 531, ack 4254, win 505, options [nop,nop,TS val 3534746016 ecr 3534746016], length 0
2022-04-08 00:42:26.464933 IP (tos 0x0, ttl 64, id 5250, offset 0, flags [DF], proto TCP (6), length 116)
    127.0.0.1.46678 > 127.0.0.1.10250: Flags [P.], cksum 0xfe68 (incorrect -> 0x1a6f), seq 531:595, ack 4254, win 512, options [nop,nop,TS val 3534746016 ecr 3534746016], length 64
2022-04-08 00:42:26.464952 IP (tos 0x0, ttl 64, id 6930, offset 0, flags [DF], proto TCP (6), length 52)
    127.0.0.1.10250 > 127.0.0.1.46678: Flags [.], cksum 0xfe28 (incorrect -> 0xf85f), seq 4254, ack 595, win 512, options [nop,nop,TS val 3534746016 ecr 3534746016], length 0
2022-04-08 00:42:26.465234 IP (tos 0x0, ttl 64, id 5251, offset 0, flags [DF], proto TCP (6), length 368)
    127.0.0.1.46678 > 127.0.0.1.10250: Flags [P.], cksum 0xff64 (incorrect -> 0x74e6), seq 595:911, ack 4254, win 512, options [nop,nop,TS val 3534746017 ecr 3534746016], length 316
2022-04-08 00:42:26.465248 IP (tos 0x0, ttl 64, id 6931, offset 0, flags [DF], proto TCP (6), length 52)
    127.0.0.1.10250 > 127.0.0.1.46678: Flags [.], cksum 0xfe28 (incorrect -> 0xf723), seq 4254, ack 911, win 510, options [nop,nop,TS val 3534746017 ecr 3534746017], length 0
200, 5.898890972137451, 1.7140023708343506