2022-04-08 00:58:47.162741 IP (tos 0x0, ttl 64, id 38593, offset 0, flags [DF], proto TCP (6), length 60)
    127.0.0.1.53664 > 127.0.0.1.11750: Flags [S], cksum 0xfe30 (incorrect -> 0xa1c5), seq 1253615811, win 65495, options [mss 65495,sackOK,TS val 3535726714 ecr 0,nop,wscale 7], length 0
2022-04-08 00:58:47.162754 IP (tos 0x0, ttl 64, id 0, offset 0, flags [DF], proto TCP (6), length 60)
    127.0.0.1.11750 > 127.0.0.1.53664: Flags [S.], cksum 0xfe30 (incorrect -> 0x6b23), seq 2962279122, ack 1253615812, win 65483, options [mss 65495,sackOK,TS val 3535726714 ecr 3535726714,nop,wscale 7], length 0
2022-04-08 00:58:47.162783 IP (tos 0x0, ttl 64, id 38594, offset 0, flags [DF], proto TCP (6), length 52)
    127.0.0.1.53664 > 127.0.0.1.11750: Flags [.], cksum 0xfe28 (incorrect -> 0x91df), seq 1, ack 1, win 512, options [nop,nop,TS val 3535726714 ecr 3535726714], length 0
2022-04-08 00:58:47.162923 IP (tos 0x0, ttl 64, id 38595, offset 0, flags [DF], proto TCP (6), length 55)
    127.0.0.1.53664 > 127.0.0.1.11750: Flags [P.], cksum 0xfe2b (incorrect -> 0x8cd3), seq 1:4, ack 1, win 512, options [nop,nop,TS val 3535726714 ecr 3535726714], length 3
2022-04-08 00:58:47.162931 IP (tos 0x0, ttl 64, id 41507, offset 0, flags [DF], proto TCP (6), length 52)
    127.0.0.1.11750 > 127.0.0.1.53664: Flags [.], cksum 0xfe28 (incorrect -> 0x91dc), seq 1, ack 4, win 512, options [nop,nop,TS val 3535726714 ecr 3535726714], length 0
2022-04-08 00:58:47.162962 IP (tos 0x0, ttl 64, id 41508, offset 0, flags [DF], proto TCP (6), length 54)
    127.0.0.1.11750 > 127.0.0.1.53664: Flags [P.], cksum 0xfe2a (incorrect -> 0x8cd2), seq 1:3, ack 4, win 512, options [nop,nop,TS val 3535726714 ecr 3535726714], length 2
2022-04-08 00:58:47.162967 IP (tos 0x0, ttl 64, id 38596, offset 0, flags [DF], proto TCP (6), length 52)
    127.0.0.1.53664 > 127.0.0.1.11750: Flags [.], cksum 0xfe28 (incorrect -> 0x91da), seq 4, ack 3, win 512, options [nop,nop,TS val 3535726714 ecr 3535726714], length 0
2022-04-08 00:58:47.164213 IP (tos 0x0, ttl 64, id 38597, offset 0, flags [DF], proto TCP (6), length 62)
    127.0.0.1.53664 > 127.0.0.1.11750: Flags [P.], cksum 0xfe32 (incorrect -> 0xf29a), seq 4:14, ack 3, win 512, options [nop,nop,TS val 3535726715 ecr 3535726714], length 10
2022-04-08 00:58:47.164221 IP (tos 0x0, ttl 64, id 41509, offset 0, flags [DF], proto TCP (6), length 52)
    127.0.0.1.11750 > 127.0.0.1.53664: Flags [.], cksum 0xfe28 (incorrect -> 0x91ce), seq 3, ack 14, win 512, options [nop,nop,TS val 3535726715 ecr 3535726715], length 0
200, 4.567552804946899, 0.7246415615081787