2022-04-08 01:30:27.122994 IP (tos 0x0, ttl 64, id 62120, offset 0, flags [DF], proto TCP (6), length 60)
    127.0.0.1.42988 > 127.0.0.1.12250: Flags [S], cksum 0xfe30 (incorrect -> 0x49d1), seq 2594167483, win 65495, options [mss 65495,sackOK,TS val 3537626674 ecr 0,nop,wscale 7], length 0
2022-04-08 01:30:27.123006 IP (tos 0x0, ttl 64, id 0, offset 0, flags [DF], proto TCP (6), length 60)
    127.0.0.1.12250 > 127.0.0.1.42988: Flags [S.], cksum 0xfe30 (incorrect -> 0x7f42), seq 547352795, ack 2594167484, win 65483, options [mss 65495,sackOK,TS val 3537626674 ecr 3537626674,nop,wscale 7], length 0
2022-04-08 01:30:27.123015 IP (tos 0x0, ttl 64, id 62121, offset 0, flags [DF], proto TCP (6), length 52)
    127.0.0.1.42988 > 127.0.0.1.12250: Flags [.], cksum 0xfe28 (incorrect -> 0xa5fe), seq 1, ack 1, win 512, options [nop,nop,TS val 3537626674 ecr 3537626674], length 0
2022-04-08 01:30:27.123110 IP (tos 0x0, ttl 64, id 62122, offset 0, flags [DF], proto TCP (6), length 55)
    127.0.0.1.42988 > 127.0.0.1.12250: Flags [P.], cksum 0xfe2b (incorrect -> 0xa0f2), seq 1:4, ack 1, win 512, options [nop,nop,TS val 3537626674 ecr 3537626674], length 3
2022-04-08 01:30:27.123122 IP (tos 0x0, ttl 64, id 40086, offset 0, flags [DF], proto TCP (6), length 52)
    127.0.0.1.12250 > 127.0.0.1.42988: Flags [.], cksum 0xfe28 (incorrect -> 0xa5fb), seq 1, ack 4, win 512, options [nop,nop,TS val 3537626674 ecr 3537626674], length 0
2022-04-08 01:30:27.123152 IP (tos 0x0, ttl 64, id 40087, offset 0, flags [DF], proto TCP (6), length 54)
    127.0.0.1.12250 > 127.0.0.1.42988: Flags [P.], cksum 0xfe2a (incorrect -> 0xa0f1), seq 1:3, ack 4, win 512, options [nop,nop,TS val 3537626674 ecr 3537626674], length 2
2022-04-08 01:30:27.123163 IP (tos 0x0, ttl 64, id 62123, offset 0, flags [DF], proto TCP (6), length 52)
    127.0.0.1.42988 > 127.0.0.1.12250: Flags [.], cksum 0xfe28 (incorrect -> 0xa5f9), seq 4, ack 3, win 512, options [nop,nop,TS val 3537626674 ecr 3537626674], length 0
2022-04-08 01:30:27.135700 IP (tos 0x0, ttl 64, id 62124, offset 0, flags [DF], proto TCP (6), length 62)
    127.0.0.1.42988 > 127.0.0.1.12250: Flags [P.], cksum 0xfe32 (incorrect -> 0x0be8), seq 4:14, ack 3, win 512, options [nop,nop,TS val 3537626687 ecr 3537626674], length 10
2022-04-08 01:30:27.135709 IP (tos 0x0, ttl 64, id 40088, offset 0, flags [DF], proto TCP (6), length 52)
    127.0.0.1.12250 > 127.0.0.1.42988: Flags [.], cksum 0xfe28 (incorrect -> 0xa5d5), seq 3, ack 14, win 512, options [nop,nop,TS val 3537626687 ecr 3537626687], length 0
2022-04-08 01:30:27.209567 IP (tos 0x0, ttl 64, id 40089, offset 0, flags [DF], proto TCP (6), length 62)
    127.0.0.1.12250 > 127.0.0.1.42988: Flags [P.], cksum 0xfe32 (incorrect -> 0xa078), seq 3:13, ack 14, win 512, options [nop,nop,TS val 3537626761 ecr 3537626687], length 10
2022-04-08 01:30:27.209584 IP (tos 0x0, ttl 64, id 62125, offset 0, flags [DF], proto TCP (6), length 52)
    127.0.0.1.42988 > 127.0.0.1.12250: Flags [.], cksum 0xfe28 (incorrect -> 0xa537), seq 14, ack 13, win 512, options [nop,nop,TS val 3537626761 ecr 3537626761], length 0
2022-04-08 01:30:27.215480 IP (tos 0x0, ttl 64, id 62126, offset 0, flags [DF], proto TCP (6), length 569)
    127.0.0.1.42988 > 127.0.0.1.12250: Flags [P.], cksum 0x002e (incorrect -> 0x94ff), seq 14:531, ack 13, win 512, options [nop,nop,TS val 3537626767 ecr 3537626761], length 517
2022-04-08 01:30:27.215490 IP (tos 0x0, ttl 64, id 40090, offset 0, flags [DF], proto TCP (6), length 52)
    127.0.0.1.12250 > 127.0.0.1.42988: Flags [.], cksum 0xfe28 (incorrect -> 0xa32a), seq 13, ack 531, win 508, options [nop,nop,TS val 3537626767 ecr 3537626767], length 0
200, 4.0907087326049805, 1.1563076972961426