2022-04-08 00:17:32.960390 IP (tos 0x0, ttl 64, id 29270, offset 0, flags [DF], proto TCP (6), length 60)
    127.0.0.1.57424 > 127.0.0.1.9550: Flags [S], cksum 0xfe30 (incorrect -> 0xedd2), seq 931932874, win 65495, options [mss 65495,sackOK,TS val 3533252512 ecr 0,nop,wscale 7], length 0
2022-04-08 00:17:32.960411 IP (tos 0x0, ttl 64, id 0, offset 0, flags [DF], proto TCP (6), length 60)
    127.0.0.1.9550 > 127.0.0.1.57424: Flags [S.], cksum 0xfe30 (incorrect -> 0x2f12), seq 1205959840, ack 931932875, win 65483, options [mss 65495,sackOK,TS val 3533252512 ecr 3533252512,nop,wscale 7], length 0
2022-04-08 00:17:32.960425 IP (tos 0x0, ttl 64, id 29271, offset 0, flags [DF], proto TCP (6), length 52)
    127.0.0.1.57424 > 127.0.0.1.9550: Flags [.], cksum 0xfe28 (incorrect -> 0x55ce), seq 1, ack 1, win 512, options [nop,nop,TS val 3533252512 ecr 3533252512], length 0
2022-04-08 00:17:32.960552 IP (tos 0x0, ttl 64, id 29272, offset 0, flags [DF], proto TCP (6), length 55)
    127.0.0.1.57424 > 127.0.0.1.9550: Flags [P.], cksum 0xfe2b (incorrect -> 0x50c2), seq 1:4, ack 1, win 512, options [nop,nop,TS val 3533252512 ecr 3533252512], length 3
2022-04-08 00:17:32.960567 IP (tos 0x0, ttl 64, id 56760, offset 0, flags [DF], proto TCP (6), length 52)
    127.0.0.1.9550 > 127.0.0.1.57424: Flags [.], cksum 0xfe28 (incorrect -> 0x55cb), seq 1, ack 4, win 512, options [nop,nop,TS val 3533252512 ecr 3533252512], length 0
2022-04-08 00:17:32.960651 IP (tos 0x0, ttl 64, id 56761, offset 0, flags [DF], proto TCP (6), length 54)
    127.0.0.1.9550 > 127.0.0.1.57424: Flags [P.], cksum 0xfe2a (incorrect -> 0x50c1), seq 1:3, ack 4, win 512, options [nop,nop,TS val 3533252512 ecr 3533252512], length 2
2022-04-08 00:17:32.960668 IP (tos 0x0, ttl 64, id 29273, offset 0, flags [DF], proto TCP (6), length 52)
    127.0.0.1.57424 > 127.0.0.1.9550: Flags [.], cksum 0xfe28 (incorrect -> 0x55c9), seq 4, ack 3, win 512, options [nop,nop,TS val 3533252512 ecr 3533252512], length 0
2022-04-08 00:17:32.962654 IP (tos 0x0, ttl 64, id 29274, offset 0, flags [DF], proto TCP (6), length 62)
    127.0.0.1.57424 > 127.0.0.1.9550: Flags [P.], cksum 0xfe32 (incorrect -> 0x177f), seq 4:14, ack 3, win 512, options [nop,nop,TS val 3533252514 ecr 3533252512], length 10
2022-04-08 00:17:32.962671 IP (tos 0x0, ttl 64, id 56762, offset 0, flags [DF], proto TCP (6), length 52)
    127.0.0.1.9550 > 127.0.0.1.57424: Flags [.], cksum 0xfe28 (incorrect -> 0x55bb), seq 3, ack 14, win 512, options [nop,nop,TS val 3533252514 ecr 3533252514], length 0
2022-04-08 00:17:33.023882 IP (tos 0x0, ttl 64, id 56763, offset 0, flags [DF], proto TCP (6), length 62)
    127.0.0.1.9550 > 127.0.0.1.57424: Flags [P.], cksum 0xfe32 (incorrect -> 0x506b), seq 3:13, ack 14, win 512, options [nop,nop,TS val 3533252575 ecr 3533252514], length 10
2022-04-08 00:17:33.023894 IP (tos 0x0, ttl 64, id 29275, offset 0, flags [DF], proto TCP (6), length 52)
    127.0.0.1.57424 > 127.0.0.1.9550: Flags [.], cksum 0xfe28 (incorrect -> 0x5537), seq 14, ack 13, win 512, options [nop,nop,TS val 3533252575 ecr 3533252575], length 0
2022-04-08 00:17:33.029911 IP (tos 0x0, ttl 64, id 29276, offset 0, flags [DF], proto TCP (6), length 569)
    127.0.0.1.57424 > 127.0.0.1.9550: Flags [P.], cksum 0x002e (incorrect -> 0xa21a), seq 14:531, ack 13, win 512, options [nop,nop,TS val 3533252581 ecr 3533252575], length 517
2022-04-08 00:17:33.029923 IP (tos 0x0, ttl 64, id 56764, offset 0, flags [DF], proto TCP (6), length 52)
    127.0.0.1.9550 > 127.0.0.1.57424: Flags [.], cksum 0xfe28 (incorrect -> 0x532a), seq 13, ack 531, win 508, options [nop,nop,TS val 3533252581 ecr 3533252581], length 0
2022-04-08 00:17:33.084676 IP (tos 0x0, ttl 64, id 56765, offset 0, flags [DF], proto TCP (6), length 3538)
    127.0.0.1.9550 > 127.0.0.1.57424: Flags [P.], cksum 0x0bc7 (incorrect -> 0xf5fc), seq 13:3499, ack 531, win 512, options [nop,nop,TS val 3533252636 ecr 3533252581], length 3486
2022-04-08 00:17:33.084688 IP (tos 0x0, ttl 64, id 29277, offset 0, flags [DF], proto TCP (6), length 52)
    127.0.0.1.57424 > 127.0.0.1.9550: Flags [.], cksum 0xfe28 (incorrect -> 0x452c), seq 531, ack 3499, win 494, options [nop,nop,TS val 3533252636 ecr 3533252636], length 0
200, 4.615376710891724, 0.6284871101379395