2022-04-08 03:18:16.198666 IP (tos 0x0, ttl 64, id 32777, offset 0, flags [DF], proto TCP (6), length 60)
    127.0.0.1.48900 > 127.0.0.1.10050: Flags [S], cksum 0xfe30 (incorrect -> 0xb792), seq 2200027073, win 65495, options [mss 65495,sackOK,TS val 3544095750 ecr 0,nop,wscale 7], length 0
2022-04-08 03:18:16.198681 IP (tos 0x0, ttl 64, id 0, offset 0, flags [DF], proto TCP (6), length 60)
    127.0.0.1.10050 > 127.0.0.1.48900: Flags [S.], cksum 0xfe30 (incorrect -> 0xcb5e), seq 1355492382, ack 2200027074, win 65483, options [mss 65495,sackOK,TS val 3544095750 ecr 3544095750,nop,wscale 7], length 0
2022-04-08 03:18:16.198692 IP (tos 0x0, ttl 64, id 32778, offset 0, flags [DF], proto TCP (6), length 52)
    127.0.0.1.48900 > 127.0.0.1.10050: Flags [.], cksum 0xfe28 (incorrect -> 0xf21a), seq 1, ack 1, win 512, options [nop,nop,TS val 3544095750 ecr 3544095750], length 0
2022-04-08 03:18:16.198815 IP (tos 0x0, ttl 64, id 32779, offset 0, flags [DF], proto TCP (6), length 55)
    127.0.0.1.48900 > 127.0.0.1.10050: Flags [P.], cksum 0xfe2b (incorrect -> 0xed0e), seq 1:4, ack 1, win 512, options [nop,nop,TS val 3544095750 ecr 3544095750], length 3
2022-04-08 03:18:16.198826 IP (tos 0x0, ttl 64, id 32231, offset 0, flags [DF], proto TCP (6), length 52)
    127.0.0.1.10050 > 127.0.0.1.48900: Flags [.], cksum 0xfe28 (incorrect -> 0xf217), seq 1, ack 4, win 512, options [nop,nop,TS val 3544095750 ecr 3544095750], length 0
2022-04-08 03:18:16.198892 IP (tos 0x0, ttl 64, id 32232, offset 0, flags [DF], proto TCP (6), length 54)
    127.0.0.1.10050 > 127.0.0.1.48900: Flags [P.], cksum 0xfe2a (incorrect -> 0xed0d), seq 1:3, ack 4, win 512, options [nop,nop,TS val 3544095750 ecr 3544095750], length 2
2022-04-08 03:18:16.198908 IP (tos 0x0, ttl 64, id 32780, offset 0, flags [DF], proto TCP (6), length 52)
    127.0.0.1.48900 > 127.0.0.1.10050: Flags [.], cksum 0xfe28 (incorrect -> 0xf215), seq 4, ack 3, win 512, options [nop,nop,TS val 3544095750 ecr 3544095750], length 0
2022-04-08 03:18:16.230403 IP (tos 0x0, ttl 64, id 32781, offset 0, flags [DF], proto TCP (6), length 62)
    127.0.0.1.48900 > 127.0.0.1.10050: Flags [P.], cksum 0xfe32 (incorrect -> 0x1ad9), seq 4:14, ack 3, win 512, options [nop,nop,TS val 3544095782 ecr 3544095750], length 10
2022-04-08 03:18:16.230411 IP (tos 0x0, ttl 64, id 32233, offset 0, flags [DF], proto TCP (6), length 52)
    127.0.0.1.10050 > 127.0.0.1.48900: Flags [.], cksum 0xfe28 (incorrect -> 0xf1cb), seq 3, ack 14, win 512, options [nop,nop,TS val 3544095782 ecr 3544095782], length 0
2022-04-08 03:18:16.473596 IP (tos 0x0, ttl 64, id 32234, offset 0, flags [DF], proto TCP (6), length 62)
    127.0.0.1.10050 > 127.0.0.1.48900: Flags [P.], cksum 0xfe32 (incorrect -> 0xebc5), seq 3:13, ack 14, win 512, options [nop,nop,TS val 3544096025 ecr 3544095782], length 10
2022-04-08 03:18:16.473605 IP (tos 0x0, ttl 64, id 32782, offset 0, flags [DF], proto TCP (6), length 52)
    127.0.0.1.48900 > 127.0.0.1.10050: Flags [.], cksum 0xfe28 (incorrect -> 0xefdb), seq 14, ack 13, win 512, options [nop,nop,TS val 3544096025 ecr 3544096025], length 0
2022-04-08 03:18:16.479191 IP (tos 0x0, ttl 64, id 32783, offset 0, flags [DF], proto TCP (6), length 569)
    127.0.0.1.48900 > 127.0.0.1.10050: Flags [P.], cksum 0x002e (incorrect -> 0x7fdd), seq 14:531, ack 13, win 512, options [nop,nop,TS val 3544096030 ecr 3544096025], length 517
2022-04-08 03:18:16.479200 IP (tos 0x0, ttl 64, id 32235, offset 0, flags [DF], proto TCP (6), length 52)
    127.0.0.1.10050 > 127.0.0.1.48900: Flags [.], cksum 0xfe28 (incorrect -> 0xedd0), seq 13, ack 531, win 508, options [nop,nop,TS val 3544096030 ecr 3544096030], length 0
2022-04-08 03:18:17.086950 IP (tos 0x0, ttl 64, id 32236, offset 0, flags [DF], proto TCP (6), length 3538)
    127.0.0.1.10050 > 127.0.0.1.48900: Flags [P.], cksum 0x0bc7 (incorrect -> 0x6bba), seq 13:3499, ack 531, win 512, options [nop,nop,TS val 3544096638 ecr 3544096030], length 3486
2022-04-08 03:18:17.086961 IP (tos 0x0, ttl 64, id 32784, offset 0, flags [DF], proto TCP (6), length 52)
    127.0.0.1.48900 > 127.0.0.1.10050: Flags [.], cksum 0xfe28 (incorrect -> 0xdb80), seq 531, ack 3499, win 494, options [nop,nop,TS val 3544096638 ecr 3544096638], length 0
2022-04-08 03:18:17.148769 IP (tos 0x0, ttl 64, id 32237, offset 0, flags [DF], proto TCP (6), length 1537)
    127.0.0.1.10050 > 127.0.0.1.48900: Flags [P.], cksum 0x03f6 (incorrect -> 0xcfb9), seq 3499:4984, ack 531, win 512, options [nop,nop,TS val 3544096700 ecr 3544096638], length 1485
2022-04-08 03:18:17.148777 IP (tos 0x0, ttl 64, id 32785, offset 0, flags [DF], proto TCP (6), length 52)
    127.0.0.1.48900 > 127.0.0.1.10050: Flags [.], cksum 0xfe28 (incorrect -> 0xd52f), seq 531, ack 4984, win 502, options [nop,nop,TS val 3544096700 ecr 3544096700], length 0
2022-04-08 03:18:17.149464 IP (tos 0x0, ttl 64, id 32786, offset 0, flags [DF], proto TCP (6), length 145)
    127.0.0.1.48900 > 127.0.0.1.10050: Flags [P.], cksum 0xfe85 (incorrect -> 0x907d), seq 531:624, ack 4984, win 512, options [nop,nop,TS val 3544096701 ecr 3544096700], length 93
2022-04-08 03:18:17.149480 IP (tos 0x0, ttl 64, id 32238, offset 0, flags [DF], proto TCP (6), length 52)
    127.0.0.1.10050 > 127.0.0.1.48900: Flags [.], cksum 0xfe28 (incorrect -> 0xd4c6), seq 4984, ack 624, win 512, options [nop,nop,TS val 3544096701 ecr 3544096701], length 0
2022-04-08 03:18:17.375682 IP (tos 0x0, ttl 64, id 32239, offset 0, flags [DF], proto TCP (6), length 326)
    127.0.0.1.10050 > 127.0.0.1.48900: Flags [P.], cksum 0xff3a (incorrect -> 0xa952), seq 4984:5258, ack 624, win 512, options [nop,nop,TS val 3544096927 ecr 3544096701], length 274
2022-04-08 03:18:17.375695 IP (tos 0x0, ttl 64, id 32787, offset 0, flags [DF], proto TCP (6), length 52)
    127.0.0.1.48900 > 127.0.0.1.10050: Flags [.], cksum 0xfe28 (incorrect -> 0xd1f2), seq 624, ack 5258, win 510, options [nop,nop,TS val 3544096927 ecr 3544096927], length 0
2022-04-08 03:18:17.376320 IP (tos 0x0, ttl 64, id 32788, offset 0, flags [DF], proto TCP (6), length 345)
    127.0.0.1.48900 > 127.0.0.1.10050: Flags [P.], cksum 0xff4d (incorrect -> 0xe0e1), seq 624:917, ack 5258, win 512, options [nop,nop,TS val 3544096928 ecr 3544096927], length 293
2022-04-08 03:18:17.376456 IP (tos 0x0, ttl 64, id 32240, offset 0, flags [DF], proto TCP (6), length 52)
    127.0.0.1.10050 > 127.0.0.1.48900: Flags [.], cksum 0xfe28 (incorrect -> 0xd0cb), seq 5258, ack 917, win 510, options [nop,nop,TS val 3544096928 ecr 3544096928], length 0
200, 5.9280805587768555, 1.6061749458312988