2022-04-08 01:23:40.586903 IP (tos 0x0, ttl 64, id 2856, offset 0, flags [DF], proto TCP (6), length 60)
    127.0.0.1.49814 > 127.0.0.1.10650: Flags [S], cksum 0xfe30 (incorrect -> 0x6e30), seq 2145644732, win 65495, options [mss 65495,sackOK,TS val 3537220138 ecr 0,nop,wscale 7], length 0
2022-04-08 01:23:40.586915 IP (tos 0x0, ttl 64, id 0, offset 0, flags [DF], proto TCP (6), length 60)
    127.0.0.1.10650 > 127.0.0.1.49814: Flags [S.], cksum 0xfe30 (incorrect -> 0xf79b), seq 1328456288, ack 2145644733, win 65483, options [mss 65495,sackOK,TS val 3537220138 ecr 3537220138,nop,wscale 7], length 0
2022-04-08 01:23:40.586925 IP (tos 0x0, ttl 64, id 2857, offset 0, flags [DF], proto TCP (6), length 52)
    127.0.0.1.49814 > 127.0.0.1.10650: Flags [.], cksum 0xfe28 (incorrect -> 0x1e58), seq 1, ack 1, win 512, options [nop,nop,TS val 3537220138 ecr 3537220138], length 0
2022-04-08 01:23:40.587064 IP (tos 0x0, ttl 64, id 2858, offset 0, flags [DF], proto TCP (6), length 55)
    127.0.0.1.49814 > 127.0.0.1.10650: Flags [P.], cksum 0xfe2b (incorrect -> 0x194c), seq 1:4, ack 1, win 512, options [nop,nop,TS val 3537220138 ecr 3537220138], length 3
2022-04-08 01:23:40.587071 IP (tos 0x0, ttl 64, id 56822, offset 0, flags [DF], proto TCP (6), length 52)
    127.0.0.1.10650 > 127.0.0.1.49814: Flags [.], cksum 0xfe28 (incorrect -> 0x1e55), seq 1, ack 4, win 512, options [nop,nop,TS val 3537220138 ecr 3537220138], length 0
2022-04-08 01:23:40.587093 IP (tos 0x0, ttl 64, id 56823, offset 0, flags [DF], proto TCP (6), length 54)
    127.0.0.1.10650 > 127.0.0.1.49814: Flags [P.], cksum 0xfe2a (incorrect -> 0x194b), seq 1:3, ack 4, win 512, options [nop,nop,TS val 3537220138 ecr 3537220138], length 2
2022-04-08 01:23:40.587101 IP (tos 0x0, ttl 64, id 2859, offset 0, flags [DF], proto TCP (6), length 52)
    127.0.0.1.49814 > 127.0.0.1.10650: Flags [.], cksum 0xfe28 (incorrect -> 0x1e53), seq 4, ack 3, win 512, options [nop,nop,TS val 3537220138 ecr 3537220138], length 0
2022-04-08 01:23:40.599344 IP (tos 0x0, ttl 64, id 2860, offset 0, flags [DF], proto TCP (6), length 62)
    127.0.0.1.49814 > 127.0.0.1.10650: Flags [P.], cksum 0xfe32 (incorrect -> 0x1028), seq 4:14, ack 3, win 512, options [nop,nop,TS val 3537220151 ecr 3537220138], length 10
2022-04-08 01:23:40.599353 IP (tos 0x0, ttl 64, id 56824, offset 0, flags [DF], proto TCP (6), length 52)
    127.0.0.1.10650 > 127.0.0.1.49814: Flags [.], cksum 0xfe28 (incorrect -> 0x1e2f), seq 3, ack 14, win 512, options [nop,nop,TS val 3537220151 ecr 3537220151], length 0
2022-04-08 01:23:40.662876 IP (tos 0x0, ttl 64, id 56825, offset 0, flags [DF], proto TCP (6), length 62)
    127.0.0.1.10650 > 127.0.0.1.49814: Flags [P.], cksum 0xfe32 (incorrect -> 0x18dd), seq 3:13, ack 14, win 512, options [nop,nop,TS val 3537220214 ecr 3537220151], length 10
2022-04-08 01:23:40.662886 IP (tos 0x0, ttl 64, id 2861, offset 0, flags [DF], proto TCP (6), length 52)
    127.0.0.1.49814 > 127.0.0.1.10650: Flags [.], cksum 0xfe28 (incorrect -> 0x1da7), seq 14, ack 13, win 512, options [nop,nop,TS val 3537220214 ecr 3537220214], length 0
2022-04-08 01:23:40.668423 IP (tos 0x0, ttl 64, id 2862, offset 0, flags [DF], proto TCP (6), length 569)
    127.0.0.1.49814 > 127.0.0.1.10650: Flags [P.], cksum 0x002e (incorrect -> 0x96c3), seq 14:531, ack 13, win 512, options [nop,nop,TS val 3537220220 ecr 3537220214], length 517
2022-04-08 01:23:40.668433 IP (tos 0x0, ttl 64, id 56826, offset 0, flags [DF], proto TCP (6), length 52)
    127.0.0.1.10650 > 127.0.0.1.49814: Flags [.], cksum 0xfe28 (incorrect -> 0x1b9a), seq 13, ack 531, win 508, options [nop,nop,TS val 3537220220 ecr 3537220220], length 0
2022-04-08 01:23:40.725570 IP (tos 0x0, ttl 64, id 56827, offset 0, flags [DF], proto TCP (6), length 3470)
    127.0.0.1.10650 > 127.0.0.1.49814: Flags [P.], cksum 0x0b83 (incorrect -> 0x198b), seq 13:3431, ack 531, win 512, options [nop,nop,TS val 3537220277 ecr 3537220220], length 3418
2022-04-08 01:23:40.725600 IP (tos 0x0, ttl 64, id 2863, offset 0, flags [DF], proto TCP (6), length 52)
    127.0.0.1.49814 > 127.0.0.1.10650: Flags [.], cksum 0xfe28 (incorrect -> 0x0ddc), seq 531, ack 3431, win 494, options [nop,nop,TS val 3537220277 ecr 3537220277], length 0
2022-04-08 01:23:40.737068 IP (tos 0x0, ttl 64, id 56828, offset 0, flags [DF], proto TCP (6), length 218)
    127.0.0.1.10650 > 127.0.0.1.49814: Flags [P.], cksum 0xfece (incorrect -> 0x18fa), seq 3431:3597, ack 531, win 512, options [nop,nop,TS val 3537220288 ecr 3537220277], length 166
2022-04-08 01:23:40.737084 IP (tos 0x0, ttl 64, id 2864, offset 0, flags [DF], proto TCP (6), length 52)
    127.0.0.1.49814 > 127.0.0.1.10650: Flags [.], cksum 0xfe28 (incorrect -> 0x0d13), seq 531, ack 3597, win 507, options [nop,nop,TS val 3537220288 ecr 3537220288], length 0
2022-04-08 01:23:40.737250 IP (tos 0x0, ttl 64, id 2865, offset 0, flags [DF], proto TCP (6), length 132)
    127.0.0.1.49814 > 127.0.0.1.10650: Flags [P.], cksum 0xfe78 (incorrect -> 0x2a38), seq 531:611, ack 3597, win 512, options [nop,nop,TS val 3537220289 ecr 3537220288], length 80
2022-04-08 01:23:40.737261 IP (tos 0x0, ttl 64, id 56829, offset 0, flags [DF], proto TCP (6), length 52)
    127.0.0.1.10650 > 127.0.0.1.49814: Flags [.], cksum 0xfe28 (incorrect -> 0x0cbc), seq 3597, ack 611, win 512, options [nop,nop,TS val 3537220289 ecr 3537220289], length 0
2022-04-08 01:23:40.737709 IP (tos 0x0, ttl 64, id 2866, offset 0, flags [DF], proto TCP (6), length 342)
    127.0.0.1.49814 > 127.0.0.1.10650: Flags [P.], cksum 0xff4a (incorrect -> 0xb6d2), seq 611:901, ack 3597, win 512, options [nop,nop,TS val 3537220289 ecr 3537220289], length 290
2022-04-08 01:23:40.737714 IP (tos 0x0, ttl 64, id 56830, offset 0, flags [DF], proto TCP (6), length 52)
    127.0.0.1.10650 > 127.0.0.1.49814: Flags [.], cksum 0xfe28 (incorrect -> 0x0b9c), seq 3597, ack 901, win 510, options [nop,nop,TS val 3537220289 ecr 3537220289], length 0
200, 5.458644866943359, 0.3705861568450928