2022-04-08 03:13:52.482738 IP (tos 0x0, ttl 64, id 23138, offset 0, flags [DF], proto TCP (6), length 60)
    127.0.0.1.53826 > 127.0.0.1.11750: Flags [S], cksum 0xfe30 (incorrect -> 0xef79), seq 3743488032, win 65495, options [mss 65495,sackOK,TS val 3543832034 ecr 0,nop,wscale 7], length 0
2022-04-08 03:13:52.482751 IP (tos 0x0, ttl 64, id 0, offset 0, flags [DF], proto TCP (6), length 60)
    127.0.0.1.11750 > 127.0.0.1.53826: Flags [S.], cksum 0xfe30 (incorrect -> 0xe397), seq 3874405328, ack 3743488033, win 65483, options [mss 65495,sackOK,TS val 3543832034 ecr 3543832034,nop,wscale 7], length 0
2022-04-08 03:13:52.482782 IP (tos 0x0, ttl 64, id 23139, offset 0, flags [DF], proto TCP (6), length 52)
    127.0.0.1.53826 > 127.0.0.1.11750: Flags [.], cksum 0xfe28 (incorrect -> 0x0a54), seq 1, ack 1, win 512, options [nop,nop,TS val 3543832034 ecr 3543832034], length 0
2022-04-08 03:13:52.482886 IP (tos 0x0, ttl 64, id 23140, offset 0, flags [DF], proto TCP (6), length 55)
    127.0.0.1.53826 > 127.0.0.1.11750: Flags [P.], cksum 0xfe2b (incorrect -> 0x0548), seq 1:4, ack 1, win 512, options [nop,nop,TS val 3543832034 ecr 3543832034], length 3
2022-04-08 03:13:52.482898 IP (tos 0x0, ttl 64, id 27479, offset 0, flags [DF], proto TCP (6), length 52)
    127.0.0.1.11750 > 127.0.0.1.53826: Flags [.], cksum 0xfe28 (incorrect -> 0x0a51), seq 1, ack 4, win 512, options [nop,nop,TS val 3543832034 ecr 3543832034], length 0
2022-04-08 03:13:52.482928 IP (tos 0x0, ttl 64, id 27480, offset 0, flags [DF], proto TCP (6), length 54)
    127.0.0.1.11750 > 127.0.0.1.53826: Flags [P.], cksum 0xfe2a (incorrect -> 0x0547), seq 1:3, ack 4, win 512, options [nop,nop,TS val 3543832034 ecr 3543832034], length 2
2022-04-08 03:13:52.482939 IP (tos 0x0, ttl 64, id 23141, offset 0, flags [DF], proto TCP (6), length 52)
    127.0.0.1.53826 > 127.0.0.1.11750: Flags [.], cksum 0xfe28 (incorrect -> 0x0a4f), seq 4, ack 3, win 512, options [nop,nop,TS val 3543832034 ecr 3543832034], length 0
2022-04-08 03:13:52.484509 IP (tos 0x0, ttl 64, id 23142, offset 0, flags [DF], proto TCP (6), length 62)
    127.0.0.1.53826 > 127.0.0.1.11750: Flags [P.], cksum 0xfe32 (incorrect -> 0xbb3e), seq 4:14, ack 3, win 512, options [nop,nop,TS val 3543832036 ecr 3543832034], length 10
2022-04-08 03:13:52.484529 IP (tos 0x0, ttl 64, id 27481, offset 0, flags [DF], proto TCP (6), length 52)
    127.0.0.1.11750 > 127.0.0.1.53826: Flags [.], cksum 0xfe28 (incorrect -> 0x0a41), seq 3, ack 14, win 512, options [nop,nop,TS val 3543832036 ecr 3543832036], length 0
2022-04-08 03:13:52.534196 IP (tos 0x0, ttl 64, id 27482, offset 0, flags [DF], proto TCP (6), length 62)
    127.0.0.1.11750 > 127.0.0.1.53826: Flags [P.], cksum 0xfe32 (incorrect -> 0x04fd), seq 3:13, ack 14, win 512, options [nop,nop,TS val 3543832085 ecr 3543832036], length 10
2022-04-08 03:13:52.534204 IP (tos 0x0, ttl 64, id 23143, offset 0, flags [DF], proto TCP (6), length 52)
    127.0.0.1.53826 > 127.0.0.1.11750: Flags [.], cksum 0xfe28 (incorrect -> 0x09d5), seq 14, ack 13, win 512, options [nop,nop,TS val 3543832085 ecr 3543832085], length 0
2022-04-08 03:13:52.539960 IP (tos 0x0, ttl 64, id 23144, offset 0, flags [DF], proto TCP (6), length 569)
    127.0.0.1.53826 > 127.0.0.1.11750: Flags [P.], cksum 0x002e (incorrect -> 0x48ba), seq 14:531, ack 13, win 512, options [nop,nop,TS val 3543832091 ecr 3543832085], length 517
2022-04-08 03:13:52.539970 IP (tos 0x0, ttl 64, id 27483, offset 0, flags [DF], proto TCP (6), length 52)
    127.0.0.1.11750 > 127.0.0.1.53826: Flags [.], cksum 0xfe28 (incorrect -> 0x07c8), seq 13, ack 531, win 508, options [nop,nop,TS val 3543832091 ecr 3543832091], length 0
2022-04-08 03:13:52.595725 IP (tos 0x0, ttl 64, id 27484, offset 0, flags [DF], proto TCP (6), length 3538)
    127.0.0.1.11750 > 127.0.0.1.53826: Flags [P.], cksum 0x0bc7 (incorrect -> 0xdb5a), seq 13:3499, ack 531, win 512, options [nop,nop,TS val 3543832147 ecr 3543832091], length 3486
2022-04-08 03:13:52.595735 IP (tos 0x0, ttl 64, id 23145, offset 0, flags [DF], proto TCP (6), length 52)
    127.0.0.1.53826 > 127.0.0.1.11750: Flags [.], cksum 0xfe28 (incorrect -> 0xf9c7), seq 531, ack 3499, win 494, options [nop,nop,TS val 3543832147 ecr 3543832147], length 0
200, 5.3910322189331055, 0.4134407043457031