2022-04-08 01:10:06.478979 IP (tos 0x0, ttl 64, id 44109, offset 0, flags [DF], proto TCP (6), length 60)
    127.0.0.1.49980 > 127.0.0.1.9650: Flags [S], cksum 0xfe30 (incorrect -> 0x44f7), seq 638116667, win 65495, options [mss 65495,sackOK,TS val 3536406030 ecr 0,nop,wscale 7], length 0
2022-04-08 01:10:06.478991 IP (tos 0x0, ttl 64, id 0, offset 0, flags [DF], proto TCP (6), length 60)
    127.0.0.1.9650 > 127.0.0.1.49980: Flags [S.], cksum 0xfe30 (incorrect -> 0xee2c), seq 338635198, ack 638116668, win 65483, options [mss 65495,sackOK,TS val 3536406030 ecr 3536406030,nop,wscale 7], length 0
2022-04-08 01:10:06.479000 IP (tos 0x0, ttl 64, id 44110, offset 0, flags [DF], proto TCP (6), length 52)
    127.0.0.1.49980 > 127.0.0.1.9650: Flags [.], cksum 0xfe28 (incorrect -> 0x14e9), seq 1, ack 1, win 512, options [nop,nop,TS val 3536406030 ecr 3536406030], length 0
2022-04-08 01:10:06.479100 IP (tos 0x0, ttl 64, id 44111, offset 0, flags [DF], proto TCP (6), length 55)
    127.0.0.1.49980 > 127.0.0.1.9650: Flags [P.], cksum 0xfe2b (incorrect -> 0x0fdd), seq 1:4, ack 1, win 512, options [nop,nop,TS val 3536406030 ecr 3536406030], length 3
2022-04-08 01:10:06.479112 IP (tos 0x0, ttl 64, id 36547, offset 0, flags [DF], proto TCP (6), length 52)
    127.0.0.1.9650 > 127.0.0.1.49980: Flags [.], cksum 0xfe28 (incorrect -> 0x14e6), seq 1, ack 4, win 512, options [nop,nop,TS val 3536406030 ecr 3536406030], length 0
2022-04-08 01:10:06.479144 IP (tos 0x0, ttl 64, id 36548, offset 0, flags [DF], proto TCP (6), length 54)
    127.0.0.1.9650 > 127.0.0.1.49980: Flags [P.], cksum 0xfe2a (incorrect -> 0x0fdc), seq 1:3, ack 4, win 512, options [nop,nop,TS val 3536406030 ecr 3536406030], length 2
2022-04-08 01:10:06.479155 IP (tos 0x0, ttl 64, id 44112, offset 0, flags [DF], proto TCP (6), length 52)
    127.0.0.1.49980 > 127.0.0.1.9650: Flags [.], cksum 0xfe28 (incorrect -> 0x14e4), seq 4, ack 3, win 512, options [nop,nop,TS val 3536406030 ecr 3536406030], length 0
2022-04-08 01:10:06.491604 IP (tos 0x0, ttl 64, id 44113, offset 0, flags [DF], proto TCP (6), length 62)
    127.0.0.1.49980 > 127.0.0.1.9650: Flags [P.], cksum 0xfe32 (incorrect -> 0xd330), seq 4:14, ack 3, win 512, options [nop,nop,TS val 3536406043 ecr 3536406030], length 10
2022-04-08 01:10:06.491631 IP (tos 0x0, ttl 64, id 36549, offset 0, flags [DF], proto TCP (6), length 52)
    127.0.0.1.9650 > 127.0.0.1.49980: Flags [.], cksum 0xfe28 (incorrect -> 0x14c0), seq 3, ack 14, win 512, options [nop,nop,TS val 3536406043 ecr 3536406043], length 0
2022-04-08 01:10:06.549311 IP (tos 0x0, ttl 64, id 36550, offset 0, flags [DF], proto TCP (6), length 62)
    127.0.0.1.9650 > 127.0.0.1.49980: Flags [P.], cksum 0xfe32 (incorrect -> 0x0f73), seq 3:13, ack 14, win 512, options [nop,nop,TS val 3536406101 ecr 3536406043], length 10
2022-04-08 01:10:06.549326 IP (tos 0x0, ttl 64, id 44114, offset 0, flags [DF], proto TCP (6), length 52)
    127.0.0.1.49980 > 127.0.0.1.9650: Flags [.], cksum 0xfe28 (incorrect -> 0x1442), seq 14, ack 13, win 512, options [nop,nop,TS val 3536406101 ecr 3536406101], length 0
2022-04-08 01:10:06.555173 IP (tos 0x0, ttl 64, id 44115, offset 0, flags [DF], proto TCP (6), length 569)
    127.0.0.1.49980 > 127.0.0.1.9650: Flags [P.], cksum 0x002e (incorrect -> 0x04d5), seq 14:531, ack 13, win 512, options [nop,nop,TS val 3536406106 ecr 3536406101], length 517
2022-04-08 01:10:06.555190 IP (tos 0x0, ttl 64, id 36551, offset 0, flags [DF], proto TCP (6), length 52)
    127.0.0.1.9650 > 127.0.0.1.49980: Flags [.], cksum 0xfe28 (incorrect -> 0x1237), seq 13, ack 531, win 508, options [nop,nop,TS val 3536406106 ecr 3536406106], length 0
2022-04-08 01:10:06.616512 IP (tos 0x0, ttl 64, id 36552, offset 0, flags [DF], proto TCP (6), length 3538)
    127.0.0.1.9650 > 127.0.0.1.49980: Flags [P.], cksum 0x0bc7 (incorrect -> 0x794b), seq 13:3499, ack 531, win 512, options [nop,nop,TS val 3536406168 ecr 3536406106], length 3486
2022-04-08 01:10:06.616522 IP (tos 0x0, ttl 64, id 44116, offset 0, flags [DF], proto TCP (6), length 52)
    127.0.0.1.49980 > 127.0.0.1.9650: Flags [.], cksum 0xfe28 (incorrect -> 0x042b), seq 531, ack 3499, win 494, options [nop,nop,TS val 3536406168 ecr 3536406168], length 0
2022-04-08 01:10:06.630702 IP (tos 0x0, ttl 64, id 36553, offset 0, flags [DF], proto TCP (6), length 1266)
    127.0.0.1.9650 > 127.0.0.1.49980: Flags [P.], cksum 0x02e7 (incorrect -> 0x9e8e), seq 3499:4713, ack 531, win 512, options [nop,nop,TS val 3536406182 ecr 3536406168], length 1214
2022-04-08 01:10:06.630710 IP (tos 0x0, ttl 64, id 44117, offset 0, flags [DF], proto TCP (6), length 52)
    127.0.0.1.49980 > 127.0.0.1.9650: Flags [.], cksum 0xfe28 (incorrect -> 0xff47), seq 531, ack 4713, win 503, options [nop,nop,TS val 3536406182 ecr 3536406182], length 0
2022-04-08 01:10:06.631101 IP (tos 0x0, ttl 64, id 44118, offset 0, flags [DF], proto TCP (6), length 132)
    127.0.0.1.49980 > 127.0.0.1.9650: Flags [P.], cksum 0xfe78 (incorrect -> 0x8d64), seq 531:611, ack 4713, win 512, options [nop,nop,TS val 3536406182 ecr 3536406182], length 80
2022-04-08 01:10:06.631111 IP (tos 0x0, ttl 64, id 36554, offset 0, flags [DF], proto TCP (6), length 52)
    127.0.0.1.9650 > 127.0.0.1.49980: Flags [.], cksum 0xfe28 (incorrect -> 0xfeee), seq 4713, ack 611, win 512, options [nop,nop,TS val 3536406182 ecr 3536406182], length 0
2022-04-08 01:10:06.631536 IP (tos 0x0, ttl 64, id 44119, offset 0, flags [DF], proto TCP (6), length 350)
    127.0.0.1.49980 > 127.0.0.1.9650: Flags [P.], cksum 0xff52 (incorrect -> 0xedb8), seq 611:909, ack 4713, win 512, options [nop,nop,TS val 3536406183 ecr 3536406182], length 298
2022-04-08 01:10:06.631550 IP (tos 0x0, ttl 64, id 36555, offset 0, flags [DF], proto TCP (6), length 52)
    127.0.0.1.9650 > 127.0.0.1.49980: Flags [.], cksum 0xfe28 (incorrect -> 0xfdc4), seq 4713, ack 909, win 510, options [nop,nop,TS val 3536406183 ecr 3536406183], length 0
200, 7.867744207382202, 0.48720240592956543