2022-04-08 02:11:45.131992 IP (tos 0x0, ttl 64, id 54685, offset 0, flags [DF], proto TCP (6), length 60)
    127.0.0.1.39984 > 127.0.0.1.11650: Flags [S], cksum 0xfe30 (incorrect -> 0x2006), seq 1511490372, win 65495, options [mss 65495,sackOK,TS val 3540104683 ecr 0,nop,wscale 7], length 0
2022-04-08 02:11:45.132005 IP (tos 0x0, ttl 64, id 0, offset 0, flags [DF], proto TCP (6), length 60)
    127.0.0.1.11650 > 127.0.0.1.39984: Flags [S.], cksum 0xfe30 (incorrect -> 0x35f2), seq 2261703250, ack 1511490373, win 65483, options [mss 65495,sackOK,TS val 3540104683 ecr 3540104683,nop,wscale 7], length 0
2022-04-08 02:11:45.132015 IP (tos 0x0, ttl 64, id 54686, offset 0, flags [DF], proto TCP (6), length 52)
    127.0.0.1.39984 > 127.0.0.1.11650: Flags [.], cksum 0xfe28 (incorrect -> 0x5cae), seq 1, ack 1, win 512, options [nop,nop,TS val 3540104683 ecr 3540104683], length 0
2022-04-08 02:11:45.132115 IP (tos 0x0, ttl 64, id 54687, offset 0, flags [DF], proto TCP (6), length 55)
    127.0.0.1.39984 > 127.0.0.1.11650: Flags [P.], cksum 0xfe2b (incorrect -> 0x57a2), seq 1:4, ack 1, win 512, options [nop,nop,TS val 3540104683 ecr 3540104683], length 3
2022-04-08 02:11:45.132118 IP (tos 0x0, ttl 64, id 15677, offset 0, flags [DF], proto TCP (6), length 52)
    127.0.0.1.11650 > 127.0.0.1.39984: Flags [.], cksum 0xfe28 (incorrect -> 0x5cab), seq 1, ack 4, win 512, options [nop,nop,TS val 3540104683 ecr 3540104683], length 0
2022-04-08 02:11:45.132186 IP (tos 0x0, ttl 64, id 15678, offset 0, flags [DF], proto TCP (6), length 54)
    127.0.0.1.11650 > 127.0.0.1.39984: Flags [P.], cksum 0xfe2a (incorrect -> 0x57a1), seq 1:3, ack 4, win 512, options [nop,nop,TS val 3540104683 ecr 3540104683], length 2
2022-04-08 02:11:45.132190 IP (tos 0x0, ttl 64, id 54688, offset 0, flags [DF], proto TCP (6), length 52)
    127.0.0.1.39984 > 127.0.0.1.11650: Flags [.], cksum 0xfe28 (incorrect -> 0x5ca9), seq 4, ack 3, win 512, options [nop,nop,TS val 3540104683 ecr 3540104683], length 0
2022-04-08 02:11:45.143590 IP (tos 0x0, ttl 64, id 54689, offset 0, flags [DF], proto TCP (6), length 62)
    127.0.0.1.39984 > 127.0.0.1.11650: Flags [P.], cksum 0xfe32 (incorrect -> 0x93f2), seq 4:14, ack 3, win 512, options [nop,nop,TS val 3540104695 ecr 3540104683], length 10
2022-04-08 02:11:45.143607 IP (tos 0x0, ttl 64, id 15679, offset 0, flags [DF], proto TCP (6), length 52)
    127.0.0.1.11650 > 127.0.0.1.39984: Flags [.], cksum 0xfe28 (incorrect -> 0x5c87), seq 3, ack 14, win 512, options [nop,nop,TS val 3540104695 ecr 3540104695], length 0
2022-04-08 02:11:45.202670 IP (tos 0x0, ttl 64, id 15680, offset 0, flags [DF], proto TCP (6), length 62)
    127.0.0.1.11650 > 127.0.0.1.39984: Flags [P.], cksum 0xfe32 (incorrect -> 0x5739), seq 3:13, ack 14, win 512, options [nop,nop,TS val 3540104754 ecr 3540104695], length 10
2022-04-08 02:11:45.202679 IP (tos 0x0, ttl 64, id 54690, offset 0, flags [DF], proto TCP (6), length 52)
    127.0.0.1.39984 > 127.0.0.1.11650: Flags [.], cksum 0xfe28 (incorrect -> 0x5c07), seq 14, ack 13, win 512, options [nop,nop,TS val 3540104754 ecr 3540104754], length 0
2022-04-08 02:11:45.208197 IP (tos 0x0, ttl 64, id 54691, offset 0, flags [DF], proto TCP (6), length 569)
    127.0.0.1.39984 > 127.0.0.1.11650: Flags [P.], cksum 0x002e (incorrect -> 0x4845), seq 14:531, ack 13, win 512, options [nop,nop,TS val 3540104759 ecr 3540104754], length 517
2022-04-08 02:11:45.208218 IP (tos 0x0, ttl 64, id 15681, offset 0, flags [DF], proto TCP (6), length 52)
    127.0.0.1.11650 > 127.0.0.1.39984: Flags [.], cksum 0xfe28 (incorrect -> 0x59fc), seq 13, ack 531, win 508, options [nop,nop,TS val 3540104759 ecr 3540104759], length 0
2022-04-08 02:11:45.279040 IP (tos 0x0, ttl 64, id 15682, offset 0, flags [DF], proto TCP (6), length 3538)
    127.0.0.1.11650 > 127.0.0.1.39984: Flags [P.], cksum 0x0bc7 (incorrect -> 0xde8c), seq 13:3499, ack 531, win 512, options [nop,nop,TS val 3540104830 ecr 3540104759], length 3486
2022-04-08 02:11:45.279060 IP (tos 0x0, ttl 64, id 54692, offset 0, flags [DF], proto TCP (6), length 52)
    127.0.0.1.39984 > 127.0.0.1.11650: Flags [.], cksum 0xfe28 (incorrect -> 0x4bde), seq 531, ack 3499, win 494, options [nop,nop,TS val 3540104830 ecr 3540104830], length 0
200, 124.20545196533203, 0.8295378684997559