2022-02-27 22:19:42.358817 IP (tos 0x0, ttl 64, id 47210, offset 0, flags [DF], proto TCP (6), length 60)
    127.0.0.1.45130 > 127.0.0.1.12050: Flags [S], cksum 0xfe30 (incorrect -> 0x9f56), seq 2719570125, win 65495, options [mss 65495,sackOK,TS val 1269926582 ecr 0,nop,wscale 7], length 0
2022-02-27 22:19:42.358836 IP (tos 0x0, ttl 64, id 0, offset 0, flags [DF], proto TCP (6), length 60)
    127.0.0.1.12050 > 127.0.0.1.45130: Flags [S.], cksum 0xfe30 (incorrect -> 0xafa1), seq 1166005192, ack 2719570126, win 65483, options [mss 65495,sackOK,TS val 1269926582 ecr 1269926582,nop,wscale 7], length 0
2022-02-27 22:19:42.358849 IP (tos 0x0, ttl 64, id 47211, offset 0, flags [DF], proto TCP (6), length 52)
    127.0.0.1.45130 > 127.0.0.1.12050: Flags [.], cksum 0xfe28 (incorrect -> 0xd65d), seq 1, ack 1, win 512, options [nop,nop,TS val 1269926582 ecr 1269926582], length 0
2022-02-27 22:19:42.359029 IP (tos 0x0, ttl 64, id 47212, offset 0, flags [DF], proto TCP (6), length 55)
    127.0.0.1.45130 > 127.0.0.1.12050: Flags [P.], cksum 0xfe2b (incorrect -> 0xd151), seq 1:4, ack 1, win 512, options [nop,nop,TS val 1269926582 ecr 1269926582], length 3
2022-02-27 22:19:42.359039 IP (tos 0x0, ttl 64, id 21678, offset 0, flags [DF], proto TCP (6), length 52)
    127.0.0.1.12050 > 127.0.0.1.45130: Flags [.], cksum 0xfe28 (incorrect -> 0xd65a), seq 1, ack 4, win 512, options [nop,nop,TS val 1269926582 ecr 1269926582], length 0
2022-02-27 22:19:42.359068 IP (tos 0x0, ttl 64, id 21679, offset 0, flags [DF], proto TCP (6), length 54)
    127.0.0.1.12050 > 127.0.0.1.45130: Flags [P.], cksum 0xfe2a (incorrect -> 0xd150), seq 1:3, ack 4, win 512, options [nop,nop,TS val 1269926582 ecr 1269926582], length 2
2022-02-27 22:19:42.359078 IP (tos 0x0, ttl 64, id 47213, offset 0, flags [DF], proto TCP (6), length 52)
    127.0.0.1.45130 > 127.0.0.1.12050: Flags [.], cksum 0xfe28 (incorrect -> 0xd658), seq 4, ack 3, win 512, options [nop,nop,TS val 1269926582 ecr 1269926582], length 0
2022-02-27 22:19:42.390516 IP (tos 0x0, ttl 64, id 47214, offset 0, flags [DF], proto TCP (6), length 62)
    127.0.0.1.45130 > 127.0.0.1.12050: Flags [P.], cksum 0xfe32 (incorrect -> 0x889b), seq 4:14, ack 3, win 512, options [nop,nop,TS val 1269926614 ecr 1269926582], length 10
2022-02-27 22:19:42.390535 IP (tos 0x0, ttl 64, id 21680, offset 0, flags [DF], proto TCP (6), length 52)
    127.0.0.1.12050 > 127.0.0.1.45130: Flags [.], cksum 0xfe28 (incorrect -> 0xd60e), seq 3, ack 14, win 512, options [nop,nop,TS val 1269926614 ecr 1269926614], length 0
2022-02-27 22:19:42.769103 IP (tos 0x0, ttl 64, id 21681, offset 0, flags [DF], proto TCP (6), length 62)
    127.0.0.1.12050 > 127.0.0.1.45130: Flags [P.], cksum 0xfe32 (incorrect -> 0xcf81), seq 3:13, ack 14, win 512, options [nop,nop,TS val 1269926992 ecr 1269926614], length 10
2022-02-27 22:19:42.769129 IP (tos 0x0, ttl 64, id 47215, offset 0, flags [DF], proto TCP (6), length 52)
    127.0.0.1.45130 > 127.0.0.1.12050: Flags [.], cksum 0xfe28 (incorrect -> 0xd310), seq 14, ack 13, win 512, options [nop,nop,TS val 1269926992 ecr 1269926992], length 0
2022-02-27 22:19:42.775348 IP (tos 0x0, ttl 64, id 47216, offset 0, flags [DF], proto TCP (6), length 569)
    127.0.0.1.45130 > 127.0.0.1.12050: Flags [P.], cksum 0x002e (incorrect -> 0xfd44), seq 14:531, ack 13, win 512, options [nop,nop,TS val 1269926998 ecr 1269926992], length 517
2022-02-27 22:19:42.775366 IP (tos 0x0, ttl 64, id 21682, offset 0, flags [DF], proto TCP (6), length 52)
    127.0.0.1.12050 > 127.0.0.1.45130: Flags [.], cksum 0xfe28 (incorrect -> 0xd103), seq 13, ack 531, win 508, options [nop,nop,TS val 1269926998 ecr 1269926998], length 0
2022-02-27 22:19:43.160715 IP (tos 0x0, ttl 64, id 21683, offset 0, flags [DF], proto TCP (6), length 3340)
    127.0.0.1.12050 > 127.0.0.1.45130: Flags [P.], cksum 0x0b01 (incorrect -> 0x25fe), seq 13:3301, ack 531, win 512, options [nop,nop,TS val 1269927384 ecr 1269926998], length 3288
2022-02-27 22:19:43.160733 IP (tos 0x0, ttl 64, id 47217, offset 0, flags [DF], proto TCP (6), length 52)
    127.0.0.1.45130 > 127.0.0.1.12050: Flags [.], cksum 0xfe28 (incorrect -> 0xc134), seq 531, ack 3301, win 495, options [nop,nop,TS val 1269927384 ecr 1269927384], length 0
2022-02-27 22:19:43.161494 IP (tos 0x0, ttl 64, id 47218, offset 0, flags [DF], proto TCP (6), length 145)
    127.0.0.1.45130 > 127.0.0.1.12050: Flags [P.], cksum 0xfe85 (incorrect -> 0xfd39), seq 531:624, ack 3301, win 512, options [nop,nop,TS val 1269927385 ecr 1269927384], length 93
2022-02-27 22:19:43.161517 IP (tos 0x0, ttl 64, id 21684, offset 0, flags [DF], proto TCP (6), length 52)
    127.0.0.1.12050 > 127.0.0.1.45130: Flags [.], cksum 0xfe28 (incorrect -> 0xc0c4), seq 3301, ack 624, win 512, options [nop,nop,TS val 1269927385 ecr 1269927385], length 0
2022-02-27 22:19:43.560090 IP (tos 0x0, ttl 64, id 21685, offset 0, flags [DF], proto TCP (6), length 103)
    127.0.0.1.12050 > 127.0.0.1.45130: Flags [P.], cksum 0xfe5b (incorrect -> 0x45b0), seq 3301:3352, ack 624, win 512, options [nop,nop,TS val 1269927783 ecr 1269927385], length 51
2022-02-27 22:19:43.560105 IP (tos 0x0, ttl 64, id 47219, offset 0, flags [DF], proto TCP (6), length 52)
    127.0.0.1.45130 > 127.0.0.1.12050: Flags [.], cksum 0xfe28 (incorrect -> 0xbd75), seq 624, ack 3352, win 512, options [nop,nop,TS val 1269927783 ecr 1269927783], length 0
2022-02-27 22:19:43.560832 IP (tos 0x0, ttl 64, id 47220, offset 0, flags [DF], proto TCP (6), length 324)
    127.0.0.1.45130 > 127.0.0.1.12050: Flags [P.], cksum 0xff38 (incorrect -> 0xadf8), seq 624:896, ack 3352, win 512, options [nop,nop,TS val 1269927784 ecr 1269927783], length 272
2022-02-27 22:19:43.560856 IP (tos 0x0, ttl 64, id 21686, offset 0, flags [DF], proto TCP (6), length 52)
    127.0.0.1.12050 > 127.0.0.1.45130: Flags [.], cksum 0xfe28 (incorrect -> 0xbc65), seq 3352, ack 896, win 510, options [nop,nop,TS val 1269927784 ecr 1269927784], length 0
2022-02-27 22:19:44.087036 IP (tos 0x0, ttl 64, id 21687, offset 0, flags [DF], proto TCP (6), length 3538)
    127.0.0.1.12050 > 127.0.0.1.45130: Flags [P.], cksum 0x0bc7 (incorrect -> 0xcafd), seq 3352:6838, ack 896, win 512, options [nop,nop,TS val 1269928310 ecr 1269927784], length 3486
2022-02-27 22:19:44.130158 IP (tos 0x0, ttl 64, id 47221, offset 0, flags [DF], proto TCP (6), length 52)
    127.0.0.1.45130 > 127.0.0.1.12050: Flags [.], cksum 0xfe28 (incorrect -> 0xaa7e), seq 896, ack 6838, win 512, options [nop,nop,TS val 1269928353 ecr 1269928310], length 0
2022-02-27 22:19:44.130166 IP (tos 0x0, ttl 64, id 21688, offset 0, flags [DF], proto TCP (6), length 1048)
    127.0.0.1.12050 > 127.0.0.1.45130: Flags [P.], cksum 0x020d (incorrect -> 0xb97a), seq 6838:7834, ack 896, win 512, options [nop,nop,TS val 1269928353 ecr 1269928353], length 996
2022-02-27 22:19:44.130176 IP (tos 0x0, ttl 64, id 47222, offset 0, flags [DF], proto TCP (6), length 52)
    127.0.0.1.45130 > 127.0.0.1.12050: Flags [.], cksum 0xfe28 (incorrect -> 0xa676), seq 896, ack 7834, win 505, options [nop,nop,TS val 1269928353 ecr 1269928353], length 0
2022-02-27 22:19:44.167404 IP (tos 0x0, ttl 64, id 21689, offset 0, flags [DF], proto TCP (6), length 3538)
    127.0.0.1.12050 > 127.0.0.1.45130: Flags [P.], cksum 0x0bc7 (incorrect -> 0xa4de), seq 7834:11320, ack 896, win 512, options [nop,nop,TS val 1269928390 ecr 1269928353], length 3486
2022-02-27 22:19:44.167418 IP (tos 0x0, ttl 64, id 47223, offset 0, flags [DF], proto TCP (6), length 52)
    127.0.0.1.45130 > 127.0.0.1.12050: Flags [.], cksum 0xfe28 (incorrect -> 0x9899), seq 896, ack 11320, win 494, options [nop,nop,TS val 1269928390 ecr 1269928390], length 0
2022-02-27 22:19:44.219116 IP (tos 0x0, ttl 64, id 21690, offset 0, flags [DF], proto TCP (6), length 4100)
    127.0.0.1.12050 > 127.0.0.1.45130: Flags [P.], cksum 0x0df9 (incorrect -> 0x7ea1), seq 11320:15368, ack 896, win 512, options [nop,nop,TS val 1269928442 ecr 1269928390], length 4048
2022-02-27 22:19:44.219133 IP (tos 0x0, ttl 64, id 47224, offset 0, flags [DF], proto TCP (6), length 52)
    127.0.0.1.45130 > 127.0.0.1.12050: Flags [.], cksum 0xfe28 (incorrect -> 0x8863), seq 896, ack 15368, win 492, options [nop,nop,TS val 1269928442 ecr 1269928442], length 0
2022-02-27 22:19:44.219146 IP (tos 0x0, ttl 64, id 21691, offset 0, flags [DF], proto TCP (6), length 486)
    127.0.0.1.12050 > 127.0.0.1.45130: Flags [P.], cksum 0xffda (incorrect -> 0x08b7), seq 15368:15802, ack 896, win 512, options [nop,nop,TS val 1269928442 ecr 1269928442], length 434
2022-02-27 22:19:44.219154 IP (tos 0x0, ttl 64, id 47225, offset 0, flags [DF], proto TCP (6), length 52)
    127.0.0.1.45130 > 127.0.0.1.12050: Flags [.], cksum 0xfe28 (incorrect -> 0x86b3), seq 896, ack 15802, win 490, options [nop,nop,TS val 1269928442 ecr 1269928442], length 0
2022-02-27 22:19:44.219243 IP (tos 0x0, ttl 64, id 21692, offset 0, flags [DF], proto TCP (6), length 4100)
    127.0.0.1.12050 > 127.0.0.1.45130: Flags [P.], cksum 0x0df9 (incorrect -> 0x5c59), seq 15802:19850, ack 896, win 512, options [nop,nop,TS val 1269928442 ecr 1269928442], length 4048
2022-02-27 22:19:44.219260 IP (tos 0x0, ttl 64, id 47226, offset 0, flags [DF], proto TCP (6), length 52)
    127.0.0.1.45130 > 127.0.0.1.12050: Flags [.], cksum 0xfe28 (incorrect -> 0x76e1), seq 896, ack 19850, win 492, options [nop,nop,TS val 1269928442 ecr 1269928442], length 0
2022-02-27 22:19:44.219272 IP (tos 0x0, ttl 64, id 21693, offset 0, flags [DF], proto TCP (6), length 486)
    127.0.0.1.12050 > 127.0.0.1.45130: Flags [P.], cksum 0xffda (incorrect -> 0x51cb), seq 19850:20284, ack 896, win 512, options [nop,nop,TS val 1269928442 ecr 1269928442], length 434
2022-02-27 22:19:44.219281 IP (tos 0x0, ttl 64, id 47227, offset 0, flags [DF], proto TCP (6), length 52)
    127.0.0.1.45130 > 127.0.0.1.12050: Flags [.], cksum 0xfe28 (incorrect -> 0x7531), seq 896, ack 20284, win 490, options [nop,nop,TS val 1269928442 ecr 1269928442], length 0
2022-02-27 22:19:44.219356 IP (tos 0x0, ttl 64, id 21694, offset 0, flags [DF], proto TCP (6), length 4100)
    127.0.0.1.12050 > 127.0.0.1.45130: Flags [P.], cksum 0x0df9 (incorrect -> 0x0d90), seq 20284:24332, ack 896, win 512, options [nop,nop,TS val 1269928442 ecr 1269928442], length 4048
2022-02-27 22:19:44.219363 IP (tos 0x0, ttl 64, id 47228, offset 0, flags [DF], proto TCP (6), length 52)
    127.0.0.1.45130 > 127.0.0.1.12050: Flags [.], cksum 0xfe28 (incorrect -> 0x6571), seq 896, ack 24332, win 474, options [nop,nop,TS val 1269928442 ecr 1269928442], length 0
2022-02-27 22:19:44.219374 IP (tos 0x0, ttl 64, id 21695, offset 0, flags [DF], proto TCP (6), length 78)
    127.0.0.1.12050 > 127.0.0.1.45130: Flags [P.], cksum 0xfe42 (incorrect -> 0xce24), seq 24332:24358, ack 896, win 512, options [nop,nop,TS val 1269928442 ecr 1269928442], length 26
2022-02-27 22:19:44.219381 IP (tos 0x0, ttl 64, id 47229, offset 0, flags [DF], proto TCP (6), length 52)
    127.0.0.1.45130 > 127.0.0.1.12050: Flags [.], cksum 0xfe28 (incorrect -> 0x6557), seq 896, ack 24358, win 474, options [nop,nop,TS val 1269928442 ecr 1269928442], length 0
2022-02-27 22:19:44.249639 IP (tos 0x0, ttl 64, id 21696, offset 0, flags [DF], proto TCP (6), length 3538)
    127.0.0.1.12050 > 127.0.0.1.45130: Flags [P.], cksum 0x0bc7 (incorrect -> 0x46ad), seq 24358:27844, ack 896, win 512, options [nop,nop,TS val 1269928473 ecr 1269928442], length 3486
2022-02-27 22:19:44.249654 IP (tos 0x0, ttl 64, id 47230, offset 0, flags [DF], proto TCP (6), length 52)
    127.0.0.1.45130 > 127.0.0.1.12050: Flags [.], cksum 0xfe28 (incorrect -> 0x5767), seq 896, ack 27844, win 494, options [nop,nop,TS val 1269928473 ecr 1269928473], length 0
2022-02-27 22:19:44.284998 IP (tos 0x0, ttl 64, id 21697, offset 0, flags [DF], proto TCP (6), length 4100)
    127.0.0.1.12050 > 127.0.0.1.45130: Flags [P.], cksum 0x0df9 (incorrect -> 0xcd6a), seq 27844:31892, ack 896, win 512, options [nop,nop,TS val 1269928508 ecr 1269928473], length 4048
2022-02-27 22:19:44.326159 IP (tos 0x0, ttl 64, id 47231, offset 0, flags [DF], proto TCP (6), length 52)
    127.0.0.1.45130 > 127.0.0.1.12050: Flags [.], cksum 0xfe28 (incorrect -> 0x4716), seq 896, ack 31892, win 512, options [nop,nop,TS val 1269928549 ecr 1269928508], length 0
2022-02-27 22:19:44.326173 IP (tos 0x0, ttl 64, id 21698, offset 0, flags [DF], proto TCP (6), length 5964)
    127.0.0.1.12050 > 127.0.0.1.45130: Flags [P.], cksum 0x1541 (incorrect -> 0x7f4f), seq 31892:37804, ack 896, win 512, options [nop,nop,TS val 1269928549 ecr 1269928549], length 5912
2022-02-27 22:19:44.370175 IP (tos 0x0, ttl 64, id 47232, offset 0, flags [DF], proto TCP (6), length 52)
    127.0.0.1.45130 > 127.0.0.1.12050: Flags [.], cksum 0xfe28 (incorrect -> 0x2fa9), seq 896, ack 37804, win 512, options [nop,nop,TS val 1269928593 ecr 1269928549], length 0
2022-02-27 22:19:44.370203 IP (tos 0x0, ttl 64, id 21699, offset 0, flags [DF], proto TCP (6), length 22212)
    127.0.0.1.12050 > 127.0.0.1.45130: Flags [P.], cksum 0x54b9 (incorrect -> 0x770b), seq 37804:59964, ack 896, win 512, options [nop,nop,TS val 1269928593 ecr 1269928593], length 22160
2022-02-27 22:19:44.414156 IP (tos 0x0, ttl 64, id 47233, offset 0, flags [DF], proto TCP (6), length 52)
    127.0.0.1.45130 > 127.0.0.1.12050: Flags [.], cksum 0xfe28 (incorrect -> 0xd8c0), seq 896, ack 59964, win 512, options [nop,nop,TS val 1269928637 ecr 1269928593], length 0
2022-02-27 22:19:44.414174 IP (tos 0x0, ttl 64, id 21700, offset 0, flags [DF], proto TCP (6), length 3538)
    127.0.0.1.12050 > 127.0.0.1.45130: Flags [P.], cksum 0x0bc7 (incorrect -> 0x2b50), seq 59964:63450, ack 896, win 512, options [nop,nop,TS val 1269928637 ecr 1269928637], length 3486
2022-02-27 22:19:44.414200 IP (tos 0x0, ttl 64, id 47234, offset 0, flags [DF], proto TCP (6), length 52)
    127.0.0.1.45130 > 127.0.0.1.12050: Flags [.], cksum 0xfe28 (incorrect -> 0xcaf6), seq 896, ack 63450, win 512, options [nop,nop,TS val 1269928637 ecr 1269928637], length 0
2022-02-27 22:19:44.417662 IP (tos 0x0, ttl 64, id 21701, offset 0, flags [DF], proto TCP (6), length 1048)
    127.0.0.1.12050 > 127.0.0.1.45130: Flags [P.], cksum 0x020d (incorrect -> 0x23a4), seq 63450:64446, ack 896, win 512, options [nop,nop,TS val 1269928641 ecr 1269928637], length 996
2022-02-27 22:19:44.417699 IP (tos 0x0, ttl 64, id 47235, offset 0, flags [DF], proto TCP (6), length 52)
    127.0.0.1.45130 > 127.0.0.1.12050: Flags [.], cksum 0xfe28 (incorrect -> 0xc70a), seq 896, ack 64446, win 512, options [nop,nop,TS val 1269928641 ecr 1269928641], length 0
2022-02-27 22:19:44.417968 IP (tos 0x0, ttl 64, id 21702, offset 0, flags [DF], proto TCP (6), length 3538)
    127.0.0.1.12050 > 127.0.0.1.45130: Flags [P.], cksum 0x0bc7 (incorrect -> 0xc935), seq 64446:67932, ack 896, win 512, options [nop,nop,TS val 1269928641 ecr 1269928641], length 3486
2022-02-27 22:19:44.418001 IP (tos 0x0, ttl 64, id 47236, offset 0, flags [DF], proto TCP (6), length 52)
    127.0.0.1.45130 > 127.0.0.1.12050: Flags [.], cksum 0xfe28 (incorrect -> 0xb96c), seq 896, ack 67932, win 512, options [nop,nop,TS val 1269928641 ecr 1269928641], length 0
2022-02-27 22:19:44.418091 IP (tos 0x0, ttl 64, id 21703, offset 0, flags [DF], proto TCP (6), length 4036)
    127.0.0.1.12050 > 127.0.0.1.45130: Flags [P.], cksum 0x0db9 (incorrect -> 0xc5fb), seq 67932:71916, ack 896, win 512, options [nop,nop,TS val 1269928641 ecr 1269928641], length 3984
2022-02-27 22:19:44.418203 IP (tos 0x0, ttl 64, id 47237, offset 0, flags [DF], proto TCP (6), length 52)
    127.0.0.1.45130 > 127.0.0.1.12050: Flags [.], cksum 0xfe28 (incorrect -> 0xa9dc), seq 896, ack 71916, win 512, options [nop,nop,TS val 1269928641 ecr 1269928641], length 0
2022-02-27 22:19:44.418214 IP (tos 0x0, ttl 64, id 21704, offset 0, flags [DF], proto TCP (6), length 4036)
    127.0.0.1.12050 > 127.0.0.1.45130: Flags [P.], cksum 0x0db9 (incorrect -> 0x63b0), seq 71916:75900, ack 896, win 512, options [nop,nop,TS val 1269928641 ecr 1269928641], length 3984
2022-02-27 22:19:44.462167 IP (tos 0x0, ttl 64, id 47238, offset 0, flags [DF], proto TCP (6), length 52)
    127.0.0.1.45130 > 127.0.0.1.12050: Flags [.], cksum 0xfe28 (incorrect -> 0x9a20), seq 896, ack 75900, win 512, options [nop,nop,TS val 1269928685 ecr 1269928641], length 0
2022-02-27 22:19:44.462181 IP (tos 0x0, ttl 64, id 21705, offset 0, flags [DF], proto TCP (6), length 13498)
    127.0.0.1.12050 > 127.0.0.1.45130: Flags [P.], cksum 0x32af (incorrect -> 0x9b93), seq 75900:89346, ack 896, win 512, options [nop,nop,TS val 1269928685 ecr 1269928685], length 13446
2022-02-27 22:19:44.506141 IP (tos 0x0, ttl 64, id 47239, offset 0, flags [DF], proto TCP (6), length 52)
    127.0.0.1.45130 > 127.0.0.1.12050: Flags [.], cksum 0xfe28 (incorrect -> 0x6542), seq 896, ack 89346, win 512, options [nop,nop,TS val 1269928729 ecr 1269928685], length 0
2022-02-27 22:19:44.506154 IP (tos 0x0, ttl 64, id 21706, offset 0, flags [DF], proto TCP (6), length 3538)
    127.0.0.1.12050 > 127.0.0.1.45130: Flags [P.], cksum 0x0bc7 (incorrect -> 0xc5e6), seq 89346:92832, ack 896, win 512, options [nop,nop,TS val 1269928729 ecr 1269928729], length 3486
2022-02-27 22:19:44.506171 IP (tos 0x0, ttl 64, id 47240, offset 0, flags [DF], proto TCP (6), length 52)
    127.0.0.1.45130 > 127.0.0.1.12050: Flags [.], cksum 0xfe28 (incorrect -> 0x5778), seq 896, ack 92832, win 512, options [nop,nop,TS val 1269928729 ecr 1269928729], length 0
2022-02-27 22:19:44.528311 IP (tos 0x0, ttl 64, id 21707, offset 0, flags [DF], proto TCP (6), length 3050)
    127.0.0.1.12050 > 127.0.0.1.45130: Flags [P.], cksum 0x09df (incorrect -> 0x118f), seq 92832:95830, ack 896, win 512, options [nop,nop,TS val 1269928751 ecr 1269928729], length 2998
2022-02-27 22:19:44.528350 IP (tos 0x0, ttl 64, id 47241, offset 0, flags [DF], proto TCP (6), length 52)
    127.0.0.1.45130 > 127.0.0.1.12050: Flags [.], cksum 0xfe28 (incorrect -> 0x4b96), seq 896, ack 95830, win 512, options [nop,nop,TS val 1269928751 ecr 1269928751], length 0
2022-02-27 22:19:44.530818 IP (tos 0x0, ttl 64, id 21708, offset 0, flags [DF], proto TCP (6), length 4100)
    127.0.0.1.12050 > 127.0.0.1.45130: Flags [P.], cksum 0x0df9 (incorrect -> 0x3d5e), seq 95830:99878, ack 896, win 512, options [nop,nop,TS val 1269928754 ecr 1269928751], length 4048
2022-02-27 22:19:44.530851 IP (tos 0x0, ttl 64, id 47242, offset 0, flags [DF], proto TCP (6), length 52)
    127.0.0.1.45130 > 127.0.0.1.12050: Flags [.], cksum 0xfe28 (incorrect -> 0x3bc0), seq 896, ack 99878, win 512, options [nop,nop,TS val 1269928754 ecr 1269928754], length 0
2022-02-27 22:19:44.530860 IP (tos 0x0, ttl 64, id 21709, offset 0, flags [DF], proto TCP (6), length 486)
    127.0.0.1.12050 > 127.0.0.1.45130: Flags [P.], cksum 0xffda (incorrect -> 0xbad6), seq 99878:100312, ack 896, win 512, options [nop,nop,TS val 1269928754 ecr 1269928754], length 434
2022-02-27 22:19:44.530865 IP (tos 0x0, ttl 64, id 47243, offset 0, flags [DF], proto TCP (6), length 52)
    127.0.0.1.45130 > 127.0.0.1.12050: Flags [.], cksum 0xfe28 (incorrect -> 0x3a0e), seq 896, ack 100312, win 512, options [nop,nop,TS val 1269928754 ecr 1269928754], length 0
2022-02-27 22:19:44.532050 IP (tos 0x0, ttl 64, id 21710, offset 0, flags [DF], proto TCP (6), length 2542)
    127.0.0.1.12050 > 127.0.0.1.45130: Flags [P.], cksum 0x07e3 (incorrect -> 0x34a1), seq 100312:102802, ack 896, win 512, options [nop,nop,TS val 1269928755 ecr 1269928754], length 2490
2022-02-27 22:19:44.532143 IP (tos 0x0, ttl 64, id 47244, offset 0, flags [DF], proto TCP (6), length 52)
    127.0.0.1.45130 > 127.0.0.1.12050: Flags [.], cksum 0xfe28 (incorrect -> 0x3052), seq 896, ack 102802, win 512, options [nop,nop,TS val 1269928755 ecr 1269928755], length 0
2022-02-27 22:19:44.537801 IP (tos 0x0, ttl 64, id 21711, offset 0, flags [DF], proto TCP (6), length 3538)
    127.0.0.1.12050 > 127.0.0.1.45130: Flags [P.], cksum 0x0bc7 (incorrect -> 0xb3e3), seq 102802:106288, ack 896, win 512, options [nop,nop,TS val 1269928761 ecr 1269928755], length 3486
2022-02-27 22:19:44.537860 IP (tos 0x0, ttl 64, id 47245, offset 0, flags [DF], proto TCP (6), length 52)
    127.0.0.1.45130 > 127.0.0.1.12050: Flags [.], cksum 0xfe28 (incorrect -> 0x22a8), seq 896, ack 106288, win 512, options [nop,nop,TS val 1269928761 ecr 1269928761], length 0
2022-02-27 22:19:44.537900 IP (tos 0x0, ttl 64, id 21712, offset 0, flags [DF], proto TCP (6), length 1546)
    127.0.0.1.12050 > 127.0.0.1.45130: Flags [P.], cksum 0x03ff (incorrect -> 0x22c6), seq 106288:107782, ack 896, win 512, options [nop,nop,TS val 1269928761 ecr 1269928761], length 1494
2022-02-27 22:19:44.537931 IP (tos 0x0, ttl 64, id 47246, offset 0, flags [DF], proto TCP (6), length 52)
    127.0.0.1.45130 > 127.0.0.1.12050: Flags [.], cksum 0xfe28 (incorrect -> 0x1cd2), seq 896, ack 107782, win 512, options [nop,nop,TS val 1269928761 ecr 1269928761], length 0
2022-02-27 22:19:44.537996 IP (tos 0x0, ttl 64, id 21713, offset 0, flags [DF], proto TCP (6), length 4100)
    127.0.0.1.12050 > 127.0.0.1.45130: Flags [P.], cksum 0x0df9 (incorrect -> 0x7fd3), seq 107782:111830, ack 896, win 512, options [nop,nop,TS val 1269928761 ecr 1269928761], length 4048
2022-02-27 22:19:44.538032 IP (tos 0x0, ttl 64, id 47247, offset 0, flags [DF], proto TCP (6), length 52)
    127.0.0.1.45130 > 127.0.0.1.12050: Flags [.], cksum 0xfe28 (incorrect -> 0x0d02), seq 896, ack 111830, win 512, options [nop,nop,TS val 1269928761 ecr 1269928761], length 0
2022-02-27 22:19:44.538044 IP (tos 0x0, ttl 64, id 21714, offset 0, flags [DF], proto TCP (6), length 486)
    127.0.0.1.12050 > 127.0.0.1.45130: Flags [P.], cksum 0xffda (incorrect -> 0xf10c), seq 111830:112264, ack 896, win 512, options [nop,nop,TS val 1269928761 ecr 1269928761], length 434
2022-02-27 22:19:44.538051 IP (tos 0x0, ttl 64, id 47248, offset 0, flags [DF], proto TCP (6), length 52)
    127.0.0.1.45130 > 127.0.0.1.12050: Flags [.], cksum 0xfe28 (incorrect -> 0x0b50), seq 896, ack 112264, win 512, options [nop,nop,TS val 1269928761 ecr 1269928761], length 0
2022-02-27 22:19:44.538064 IP (tos 0x0, ttl 64, id 21715, offset 0, flags [DF], proto TCP (6), length 7522)
    127.0.0.1.12050 > 127.0.0.1.45130: Flags [P.], cksum 0x1b57 (incorrect -> 0x3084), seq 112264:119734, ack 896, win 512, options [nop,nop,TS val 1269928761 ecr 1269928761], length 7470
2022-02-27 22:19:44.538277 IP (tos 0x0, ttl 64, id 47249, offset 0, flags [DF], proto TCP (6), length 52)
    127.0.0.1.45130 > 127.0.0.1.12050: Flags [.], cksum 0xfe28 (incorrect -> 0xee21), seq 896, ack 119734, win 512, options [nop,nop,TS val 1269928761 ecr 1269928761], length 0
2022-02-27 22:19:44.538288 IP (tos 0x0, ttl 64, id 21716, offset 0, flags [DF], proto TCP (6), length 4036)
    127.0.0.1.12050 > 127.0.0.1.45130: Flags [P.], cksum 0x0db9 (incorrect -> 0x051d), seq 119734:123718, ack 896, win 512, options [nop,nop,TS val 1269928761 ecr 1269928761], length 3984
2022-02-27 22:19:44.538297 IP (tos 0x0, ttl 64, id 47250, offset 0, flags [DF], proto TCP (6), length 52)
    127.0.0.1.45130 > 127.0.0.1.12050: Flags [.], cksum 0xfe28 (incorrect -> 0xde91), seq 896, ack 123718, win 512, options [nop,nop,TS val 1269928761 ecr 1269928761], length 0
2022-02-27 22:19:44.545883 IP (tos 0x0, ttl 64, id 21717, offset 0, flags [DF], proto TCP (6), length 2542)
    127.0.0.1.12050 > 127.0.0.1.45130: Flags [P.], cksum 0x07e3 (incorrect -> 0x5939), seq 123718:126208, ack 896, win 512, options [nop,nop,TS val 1269928769 ecr 1269928761], length 2490
2022-02-27 22:19:44.545927 IP (tos 0x0, ttl 64, id 47251, offset 0, flags [DF], proto TCP (6), length 52)
    127.0.0.1.45130 > 127.0.0.1.12050: Flags [.], cksum 0xfe28 (incorrect -> 0xd4c7), seq 896, ack 126208, win 512, options [nop,nop,TS val 1269928769 ecr 1269928769], length 0
2022-02-27 22:19:44.547961 IP (tos 0x0, ttl 64, id 21718, offset 0, flags [DF], proto TCP (6), length 3254)
    127.0.0.1.12050 > 127.0.0.1.45130: Flags [P.], cksum 0x0aab (incorrect -> 0x935b), seq 126208:129410, ack 896, win 512, options [nop,nop,TS val 1269928771 ecr 1269928769], length 3202
2022-02-27 22:19:44.547998 IP (tos 0x0, ttl 64, id 47252, offset 0, flags [DF], proto TCP (6), length 52)
    127.0.0.1.45130 > 127.0.0.1.12050: Flags [.], cksum 0xfe28 (incorrect -> 0xc841), seq 896, ack 129410, win 512, options [nop,nop,TS val 1269928771 ecr 1269928771], length 0
2022-02-27 22:19:44.556749 IP (tos 0x0, ttl 64, id 21719, offset 0, flags [DF], proto TCP (6), length 4100)
    127.0.0.1.12050 > 127.0.0.1.45130: Flags [P.], cksum 0x0df9 (incorrect -> 0x928c), seq 129410:133458, ack 896, win 512, options [nop,nop,TS val 1269928780 ecr 1269928771], length 4048
2022-02-27 22:19:44.556784 IP (tos 0x0, ttl 64, id 47253, offset 0, flags [DF], proto TCP (6), length 52)
    127.0.0.1.45130 > 127.0.0.1.12050: Flags [.], cksum 0xfe28 (incorrect -> 0xb85f), seq 896, ack 133458, win 512, options [nop,nop,TS val 1269928780 ecr 1269928780], length 0
2022-02-27 22:19:44.556793 IP (tos 0x0, ttl 64, id 21720, offset 0, flags [DF], proto TCP (6), length 486)
    127.0.0.1.12050 > 127.0.0.1.45130: Flags [P.], cksum 0xffda (incorrect -> 0x47cb), seq 133458:133892, ack 896, win 512, options [nop,nop,TS val 1269928780 ecr 1269928780], length 434
2022-02-27 22:19:44.556799 IP (tos 0x0, ttl 64, id 47254, offset 0, flags [DF], proto TCP (6), length 52)
    127.0.0.1.45130 > 127.0.0.1.12050: Flags [.], cksum 0xfe28 (incorrect -> 0xb6ad), seq 896, ack 133892, win 512, options [nop,nop,TS val 1269928780 ecr 1269928780], length 0
2022-02-27 22:19:44.558552 IP (tos 0x0, ttl 64, id 21721, offset 0, flags [DF], proto TCP (6), length 4100)
    127.0.0.1.12050 > 127.0.0.1.45130: Flags [P.], cksum 0x0df9 (incorrect -> 0x8d16), seq 133892:137940, ack 896, win 512, options [nop,nop,TS val 1269928782 ecr 1269928780], length 4048
2022-02-27 22:19:44.558682 IP (tos 0x0, ttl 64, id 47255, offset 0, flags [DF], proto TCP (6), length 52)
    127.0.0.1.45130 > 127.0.0.1.12050: Flags [.], cksum 0xfe28 (incorrect -> 0xa6d9), seq 896, ack 137940, win 512, options [nop,nop,TS val 1269928782 ecr 1269928782], length 0
2022-02-27 22:19:44.558692 IP (tos 0x0, ttl 64, id 21722, offset 0, flags [DF], proto TCP (6), length 282)
    127.0.0.1.12050 > 127.0.0.1.45130: Flags [P.], cksum 0xff0e (incorrect -> 0xf0db), seq 137940:138170, ack 896, win 512, options [nop,nop,TS val 1269928782 ecr 1269928782], length 230
2022-02-27 22:19:44.558697 IP (tos 0x0, ttl 64, id 47256, offset 0, flags [DF], proto TCP (6), length 52)
    127.0.0.1.45130 > 127.0.0.1.12050: Flags [.], cksum 0xfe28 (incorrect -> 0xa5f3), seq 896, ack 138170, win 512, options [nop,nop,TS val 1269928782 ecr 1269928782], length 0
2022-02-27 22:19:44.559664 IP (tos 0x0, ttl 64, id 21723, offset 0, flags [DF], proto TCP (6), length 2010)
    127.0.0.1.12050 > 127.0.0.1.45130: Flags [P.], cksum 0x05cf (incorrect -> 0x09f4), seq 138170:140128, ack 896, win 512, options [nop,nop,TS val 1269928783 ecr 1269928782], length 1958
2022-02-27 22:19:44.559698 IP (tos 0x0, ttl 64, id 47257, offset 0, flags [DF], proto TCP (6), length 52)
    127.0.0.1.45130 > 127.0.0.1.12050: Flags [.], cksum 0xfe28 (incorrect -> 0x9e4b), seq 896, ack 140128, win 512, options [nop,nop,TS val 1269928783 ecr 1269928783], length 0
2022-02-27 22:19:44.583115 IP (tos 0x0, ttl 64, id 21724, offset 0, flags [DF], proto TCP (6), length 3538)
    127.0.0.1.12050 > 127.0.0.1.45130: Flags [P.], cksum 0x0bc7 (incorrect -> 0x10c2), seq 140128:143614, ack 896, win 512, options [nop,nop,TS val 1269928806 ecr 1269928783], length 3486
2022-02-27 22:19:44.583155 IP (tos 0x0, ttl 64, id 47258, offset 0, flags [DF], proto TCP (6), length 52)
    127.0.0.1.45130 > 127.0.0.1.12050: Flags [.], cksum 0xfe28 (incorrect -> 0x907f), seq 896, ack 143614, win 512, options [nop,nop,TS val 1269928806 ecr 1269928806], length 0
2022-02-27 22:19:44.640091 IP (tos 0x0, ttl 64, id 21725, offset 0, flags [DF], proto TCP (6), length 4100)
    127.0.0.1.12050 > 127.0.0.1.45130: Flags [P.], cksum 0x0df9 (incorrect -> 0x9f4c), seq 143614:147662, ack 896, win 512, options [nop,nop,TS val 1269928863 ecr 1269928806], length 4048
2022-02-27 22:19:44.640132 IP (tos 0x0, ttl 64, id 47259, offset 0, flags [DF], proto TCP (6), length 52)
    127.0.0.1.45130 > 127.0.0.1.12050: Flags [.], cksum 0xfe28 (incorrect -> 0x803d), seq 896, ack 147662, win 512, options [nop,nop,TS val 1269928863 ecr 1269928863], length 0
2022-02-27 22:19:44.640141 IP (tos 0x0, ttl 64, id 21726, offset 0, flags [DF], proto TCP (6), length 3304)
    127.0.0.1.12050 > 127.0.0.1.45130: Flags [P.], cksum 0x0add (incorrect -> 0x6e36), seq 147662:150914, ack 896, win 512, options [nop,nop,TS val 1269928863 ecr 1269928863], length 3252
2022-02-27 22:19:44.640147 IP (tos 0x0, ttl 64, id 47260, offset 0, flags [DF], proto TCP (6), length 52)
    127.0.0.1.45130 > 127.0.0.1.12050: Flags [.], cksum 0xfe28 (incorrect -> 0x7389), seq 896, ack 150914, win 512, options [nop,nop,TS val 1269928863 ecr 1269928863], length 0
2022-02-27 22:19:44.640156 IP (tos 0x0, ttl 64, id 21727, offset 0, flags [DF], proto TCP (6), length 5032)
    127.0.0.1.12050 > 127.0.0.1.45130: Flags [P.], cksum 0x119d (incorrect -> 0x8782), seq 150914:155894, ack 896, win 512, options [nop,nop,TS val 1269928863 ecr 1269928863], length 4980
2022-02-27 22:19:44.640227 IP (tos 0x0, ttl 64, id 47261, offset 0, flags [DF], proto TCP (6), length 52)
    127.0.0.1.45130 > 127.0.0.1.12050: Flags [.], cksum 0xfe28 (incorrect -> 0x6015), seq 896, ack 155894, win 512, options [nop,nop,TS val 1269928863 ecr 1269928863], length 0
2022-02-27 22:19:44.649873 IP (tos 0x0, ttl 64, id 21728, offset 0, flags [DF], proto TCP (6), length 4100)
    127.0.0.1.12050 > 127.0.0.1.45130: Flags [P.], cksum 0x0df9 (incorrect -> 0xed5d), seq 155894:159942, ack 896, win 512, options [nop,nop,TS val 1269928873 ecr 1269928863], length 4048
2022-02-27 22:19:44.649915 IP (tos 0x0, ttl 64, id 47262, offset 0, flags [DF], proto TCP (6), length 52)
    127.0.0.1.45130 > 127.0.0.1.12050: Flags [.], cksum 0xfe28 (incorrect -> 0x5031), seq 896, ack 159942, win 512, options [nop,nop,TS val 1269928873 ecr 1269928873], length 0
2022-02-27 22:19:44.649924 IP (tos 0x0, ttl 64, id 21729, offset 0, flags [DF], proto TCP (6), length 3474)
    127.0.0.1.12050 > 127.0.0.1.45130: Flags [P.], cksum 0x0b87 (incorrect -> 0x48ae), seq 159942:163364, ack 896, win 512, options [nop,nop,TS val 1269928873 ecr 1269928873], length 3422
2022-02-27 22:19:44.649931 IP (tos 0x0, ttl 64, id 47263, offset 0, flags [DF], proto TCP (6), length 52)
    127.0.0.1.45130 > 127.0.0.1.12050: Flags [.], cksum 0xfe28 (incorrect -> 0x42d3), seq 896, ack 163364, win 512, options [nop,nop,TS val 1269928873 ecr 1269928873], length 0
2022-02-27 22:19:44.649940 IP (tos 0x0, ttl 64, id 21730, offset 0, flags [DF], proto TCP (6), length 6526)
    127.0.0.1.12050 > 127.0.0.1.45130: Flags [P.], cksum 0x1773 (incorrect -> 0x306e), seq 163364:169838, ack 896, win 512, options [nop,nop,TS val 1269928873 ecr 1269928873], length 6474
2022-02-27 22:19:44.649988 IP (tos 0x0, ttl 64, id 47264, offset 0, flags [DF], proto TCP (6), length 52)
    127.0.0.1.45130 > 127.0.0.1.12050: Flags [.], cksum 0xfe28 (incorrect -> 0x2989), seq 896, ack 169838, win 512, options [nop,nop,TS val 1269928873 ecr 1269928873], length 0
2022-02-27 22:19:44.649996 IP (tos 0x0, ttl 64, id 21731, offset 0, flags [DF], proto TCP (6), length 3538)
    127.0.0.1.12050 > 127.0.0.1.45130: Flags [P.], cksum 0x0bc7 (incorrect -> 0x55de), seq 169838:173324, ack 896, win 512, options [nop,nop,TS val 1269928873 ecr 1269928873], length 3486
2022-02-27 22:19:44.650001 IP (tos 0x0, ttl 64, id 47265, offset 0, flags [DF], proto TCP (6), length 52)
    127.0.0.1.45130 > 127.0.0.1.12050: Flags [.], cksum 0xfe28 (incorrect -> 0x1beb), seq 896, ack 173324, win 512, options [nop,nop,TS val 1269928873 ecr 1269928873], length 0
2022-02-27 22:19:44.653806 IP (tos 0x0, ttl 64, id 21732, offset 0, flags [DF], proto TCP (6), length 2044)
    127.0.0.1.12050 > 127.0.0.1.45130: Flags [P.], cksum 0x05f1 (incorrect -> 0xcbef), seq 173324:175316, ack 896, win 512, options [nop,nop,TS val 1269928877 ecr 1269928873], length 1992
2022-02-27 22:19:44.653845 IP (tos 0x0, ttl 64, id 47266, offset 0, flags [DF], proto TCP (6), length 52)
    127.0.0.1.45130 > 127.0.0.1.12050: Flags [.], cksum 0xfe28 (incorrect -> 0x141b), seq 896, ack 175316, win 512, options [nop,nop,TS val 1269928877 ecr 1269928877], length 0
2022-02-27 22:19:44.659970 IP (tos 0x0, ttl 64, id 21733, offset 0, flags [DF], proto TCP (6), length 4100)
    127.0.0.1.12050 > 127.0.0.1.45130: Flags [P.], cksum 0x0df9 (incorrect -> 0xed1f), seq 175316:179364, ack 896, win 512, options [nop,nop,TS val 1269928883 ecr 1269928877], length 4048
2022-02-27 22:19:44.660045 IP (tos 0x0, ttl 64, id 47267, offset 0, flags [DF], proto TCP (6), length 52)
    127.0.0.1.45130 > 127.0.0.1.12050: Flags [.], cksum 0xfe28 (incorrect -> 0x043f), seq 896, ack 179364, win 512, options [nop,nop,TS val 1269928883 ecr 1269928883], length 0
2022-02-27 22:19:44.660054 IP (tos 0x0, ttl 64, id 21734, offset 0, flags [DF], proto TCP (6), length 3224)
    127.0.0.1.12050 > 127.0.0.1.45130: Flags [P.], cksum 0x0a8d (incorrect -> 0xa920), seq 179364:182536, ack 896, win 512, options [nop,nop,TS val 1269928883 ecr 1269928883], length 3172
2022-02-27 22:19:44.660059 IP (tos 0x0, ttl 64, id 47268, offset 0, flags [DF], proto TCP (6), length 52)
    127.0.0.1.45130 > 127.0.0.1.12050: Flags [.], cksum 0xfe28 (incorrect -> 0xf7da), seq 896, ack 182536, win 512, options [nop,nop,TS val 1269928883 ecr 1269928883], length 0
2022-02-27 22:19:44.660097 IP (tos 0x0, ttl 64, id 21735, offset 0, flags [DF], proto TCP (6), length 4100)
    127.0.0.1.12050 > 127.0.0.1.45130: Flags [P.], cksum 0x0df9 (incorrect -> 0xaf93), seq 182536:186584, ack 896, win 512, options [nop,nop,TS val 1269928883 ecr 1269928883], length 4048
2022-02-27 22:19:44.660184 IP (tos 0x0, ttl 64, id 47269, offset 0, flags [DF], proto TCP (6), length 52)
    127.0.0.1.45130 > 127.0.0.1.12050: Flags [.], cksum 0xfe28 (incorrect -> 0xe80a), seq 896, ack 186584, win 512, options [nop,nop,TS val 1269928883 ecr 1269928883], length 0
2022-02-27 22:19:44.660195 IP (tos 0x0, ttl 64, id 21736, offset 0, flags [DF], proto TCP (6), length 7956)
    127.0.0.1.12050 > 127.0.0.1.45130: Flags [P.], cksum 0x1d09 (incorrect -> 0x8bbb), seq 186584:194488, ack 896, win 512, options [nop,nop,TS val 1269928883 ecr 1269928883], length 7904
2022-02-27 22:19:44.660203 IP (tos 0x0, ttl 64, id 47270, offset 0, flags [DF], proto TCP (6), length 52)
    127.0.0.1.45130 > 127.0.0.1.12050: Flags [.], cksum 0xfe28 (incorrect -> 0xc92a), seq 896, ack 194488, win 512, options [nop,nop,TS val 1269928883 ecr 1269928883], length 0
2022-02-27 22:19:44.660263 IP (tos 0x0, ttl 64, id 21737, offset 0, flags [DF], proto TCP (6), length 4100)
    127.0.0.1.12050 > 127.0.0.1.45130: Flags [P.], cksum 0x0df9 (incorrect -> 0xe41b), seq 194488:198536, ack 896, win 512, options [nop,nop,TS val 1269928883 ecr 1269928883], length 4048
2022-02-27 22:19:44.660299 IP (tos 0x0, ttl 64, id 47271, offset 0, flags [DF], proto TCP (6), length 52)
    127.0.0.1.45130 > 127.0.0.1.12050: Flags [.], cksum 0xfe28 (incorrect -> 0xb95a), seq 896, ack 198536, win 512, options [nop,nop,TS val 1269928883 ecr 1269928883], length 0
2022-02-27 22:19:44.660308 IP (tos 0x0, ttl 64, id 21738, offset 0, flags [DF], proto TCP (6), length 3972)
    127.0.0.1.12050 > 127.0.0.1.45130: Flags [P.], cksum 0x0d79 (incorrect -> 0x768f), seq 198536:202456, ack 896, win 512, options [nop,nop,TS val 1269928883 ecr 1269928883], length 3920
2022-02-27 22:19:44.660358 IP (tos 0x0, ttl 64, id 47272, offset 0, flags [DF], proto TCP (6), length 52)
    127.0.0.1.45130 > 127.0.0.1.12050: Flags [.], cksum 0xfe28 (incorrect -> 0xaa0a), seq 896, ack 202456, win 512, options [nop,nop,TS val 1269928883 ecr 1269928883], length 0
2022-02-27 22:19:44.667630 IP (tos 0x0, ttl 64, id 21739, offset 0, flags [DF], proto TCP (6), length 4100)
    127.0.0.1.12050 > 127.0.0.1.45130: Flags [P.], cksum 0x0df9 (incorrect -> 0x7822), seq 202456:206504, ack 896, win 512, options [nop,nop,TS val 1269928891 ecr 1269928883], length 4048
2022-02-27 22:19:44.667669 IP (tos 0x0, ttl 64, id 47273, offset 0, flags [DF], proto TCP (6), length 52)
    127.0.0.1.45130 > 127.0.0.1.12050: Flags [.], cksum 0xfe28 (incorrect -> 0x9a2a), seq 896, ack 206504, win 512, options [nop,nop,TS val 1269928891 ecr 1269928891], length 0
2022-02-27 22:19:44.667678 IP (tos 0x0, ttl 64, id 21740, offset 0, flags [DF], proto TCP (6), length 486)
    127.0.0.1.12050 > 127.0.0.1.45130: Flags [P.], cksum 0xffda (incorrect -> 0x323c), seq 206504:206938, ack 896, win 512, options [nop,nop,TS val 1269928891 ecr 1269928891], length 434
2022-02-27 22:19:44.667684 IP (tos 0x0, ttl 64, id 47274, offset 0, flags [DF], proto TCP (6), length 52)
    127.0.0.1.45130 > 127.0.0.1.12050: Flags [.], cksum 0xfe28 (incorrect -> 0x9878), seq 896, ack 206938, win 512, options [nop,nop,TS val 1269928891 ecr 1269928891], length 0
2022-02-27 22:19:44.671795 IP (tos 0x0, ttl 64, id 21741, offset 0, flags [DF], proto TCP (6), length 4100)
    127.0.0.1.12050 > 127.0.0.1.45130: Flags [P.], cksum 0x0df9 (incorrect -> 0x5b55), seq 206938:210986, ack 896, win 512, options [nop,nop,TS val 1269928895 ecr 1269928891], length 4048
2022-02-27 22:19:44.671836 IP (tos 0x0, ttl 64, id 47275, offset 0, flags [DF], proto TCP (6), length 52)
    127.0.0.1.45130 > 127.0.0.1.12050: Flags [.], cksum 0xfe28 (incorrect -> 0x88a0), seq 896, ack 210986, win 512, options [nop,nop,TS val 1269928895 ecr 1269928895], length 0
2022-02-27 22:19:44.671846 IP (tos 0x0, ttl 64, id 21742, offset 0, flags [DF], proto TCP (6), length 2976)
    127.0.0.1.12050 > 127.0.0.1.45130: Flags [P.], cksum 0x0995 (incorrect -> 0x389b), seq 210986:213910, ack 896, win 512, options [nop,nop,TS val 1269928895 ecr 1269928895], length 2924
2022-02-27 22:19:44.671851 IP (tos 0x0, ttl 64, id 47276, offset 0, flags [DF], proto TCP (6), length 52)
    127.0.0.1.45130 > 127.0.0.1.12050: Flags [.], cksum 0xfe28 (incorrect -> 0x7d34), seq 896, ack 213910, win 512, options [nop,nop,TS val 1269928895 ecr 1269928895], length 0
2022-02-27 22:19:44.689227 IP (tos 0x0, ttl 64, id 21743, offset 0, flags [DF], proto TCP (6), length 2542)
    127.0.0.1.12050 > 127.0.0.1.45130: Flags [P.], cksum 0x07e3 (incorrect -> 0x5b22), seq 213910:216400, ack 896, win 512, options [nop,nop,TS val 1269928912 ecr 1269928895], length 2490
2022-02-27 22:19:44.689267 IP (tos 0x0, ttl 64, id 47277, offset 0, flags [DF], proto TCP (6), length 52)
    127.0.0.1.45130 > 127.0.0.1.12050: Flags [.], cksum 0xfe28 (incorrect -> 0x7358), seq 896, ack 216400, win 512, options [nop,nop,TS val 1269928912 ecr 1269928912], length 0
2022-02-27 22:19:44.719306 IP (tos 0x0, ttl 64, id 21744, offset 0, flags [DF], proto TCP (6), length 3538)
    127.0.0.1.12050 > 127.0.0.1.45130: Flags [P.], cksum 0x0bc7 (incorrect -> 0x4127), seq 216400:219886, ack 896, win 512, options [nop,nop,TS val 1269928942 ecr 1269928912], length 3486
2022-02-27 22:19:44.719320 IP (tos 0x0, ttl 64, id 47278, offset 0, flags [DF], proto TCP (6), length 52)
    127.0.0.1.45130 > 127.0.0.1.12050: Flags [.], cksum 0xfe28 (incorrect -> 0x617f), seq 896, ack 219886, win 1535, options [nop,nop,TS val 1269928942 ecr 1269928942], length 0
2022-02-27 22:19:44.766273 IP (tos 0x0, ttl 64, id 21745, offset 0, flags [DF], proto TCP (6), length 3518)
    127.0.0.1.12050 > 127.0.0.1.45130: Flags [P.], cksum 0x0bb3 (incorrect -> 0x82bb), seq 219886:223352, ack 896, win 512, options [nop,nop,TS val 1269928989 ecr 1269928942], length 3466
2022-02-27 22:19:44.766285 IP (tos 0x0, ttl 64, id 47279, offset 0, flags [DF], proto TCP (6), length 52)
    127.0.0.1.45130 > 127.0.0.1.12050: Flags [.], cksum 0xfe28 (incorrect -> 0x4f97), seq 896, ack 223352, win 2559, options [nop,nop,TS val 1269928989 ecr 1269928989], length 0
2022-02-27 22:19:44.766338 IP (tos 0x0, ttl 64, id 21746, offset 0, flags [DF], proto TCP (6), length 4100)
    127.0.0.1.12050 > 127.0.0.1.45130: Flags [P.], cksum 0x0df9 (incorrect -> 0xd12b), seq 223352:227400, ack 896, win 512, options [nop,nop,TS val 1269928989 ecr 1269928989], length 4048
2022-02-27 22:19:44.766350 IP (tos 0x0, ttl 64, id 47280, offset 0, flags [DF], proto TCP (6), length 52)
    127.0.0.1.45130 > 127.0.0.1.12050: Flags [.], cksum 0xfe28 (incorrect -> 0x3bc8), seq 896, ack 227400, win 3582, options [nop,nop,TS val 1269928989 ecr 1269928989], length 0
2022-02-27 22:19:44.766358 IP (tos 0x0, ttl 64, id 21747, offset 0, flags [DF], proto TCP (6), length 3494)
    127.0.0.1.12050 > 127.0.0.1.45130: Flags [P.], cksum 0x0b9b (incorrect -> 0x6623), seq 227400:230842, ack 896, win 512, options [nop,nop,TS val 1269928989 ecr 1269928989], length 3442
2022-02-27 22:19:44.766362 IP (tos 0x0, ttl 64, id 47281, offset 0, flags [DF], proto TCP (6), length 52)
    127.0.0.1.45130 > 127.0.0.1.12050: Flags [.], cksum 0xfe28 (incorrect -> 0x2a57), seq 896, ack 230842, win 4605, options [nop,nop,TS val 1269928989 ecr 1269928989], length 0
2022-02-27 22:19:44.766415 IP (tos 0x0, ttl 64, id 21748, offset 0, flags [DF], proto TCP (6), length 4100)
    127.0.0.1.12050 > 127.0.0.1.45130: Flags [P.], cksum 0x0df9 (incorrect -> 0xe898), seq 230842:234890, ack 896, win 512, options [nop,nop,TS val 1269928989 ecr 1269928989], length 4048
2022-02-27 22:19:44.766427 IP (tos 0x0, ttl 64, id 47282, offset 0, flags [DF], proto TCP (6), length 52)
    127.0.0.1.45130 > 127.0.0.1.12050: Flags [.], cksum 0xfe28 (incorrect -> 0x1688), seq 896, ack 234890, win 5628, options [nop,nop,TS val 1269928989 ecr 1269928989], length 0
2022-02-27 22:19:44.766434 IP (tos 0x0, ttl 64, id 21749, offset 0, flags [DF], proto TCP (6), length 486)
    127.0.0.1.12050 > 127.0.0.1.45130: Flags [P.], cksum 0xffda (incorrect -> 0x0876), seq 234890:235324, ack 896, win 512, options [nop,nop,TS val 1269928990 ecr 1269928989], length 434
2022-02-27 22:19:44.766438 IP (tos 0x0, ttl 64, id 47283, offset 0, flags [DF], proto TCP (6), length 52)
    127.0.0.1.45130 > 127.0.0.1.12050: Flags [.], cksum 0xfe28 (incorrect -> 0x1402), seq 896, ack 235324, win 5838, options [nop,nop,TS val 1269928990 ecr 1269928990], length 0
2022-02-27 22:19:44.766490 IP (tos 0x0, ttl 64, id 21750, offset 0, flags [DF], proto TCP (6), length 4100)
    127.0.0.1.12050 > 127.0.0.1.45130: Flags [P.], cksum 0x0df9 (incorrect -> 0xae0b), seq 235324:239372, ack 896, win 512, options [nop,nop,TS val 1269928990 ecr 1269928990], length 4048
2022-02-27 22:19:44.766497 IP (tos 0x0, ttl 64, id 47284, offset 0, flags [DF], proto TCP (6), length 52)
    127.0.0.1.45130 > 127.0.0.1.12050: Flags [.], cksum 0xfe28 (incorrect -> 0x0033), seq 896, ack 239372, win 6861, options [nop,nop,TS val 1269928990 ecr 1269928990], length 0
2022-02-27 22:19:44.766504 IP (tos 0x0, ttl 64, id 21751, offset 0, flags [DF], proto TCP (6), length 3474)
    127.0.0.1.12050 > 127.0.0.1.45130: Flags [P.], cksum 0x0b87 (incorrect -> 0x067f), seq 239372:242794, ack 896, win 512, options [nop,nop,TS val 1269928990 ecr 1269928990], length 3422
2022-02-27 22:19:44.766508 IP (tos 0x0, ttl 64, id 47285, offset 0, flags [DF], proto TCP (6), length 52)
    127.0.0.1.45130 > 127.0.0.1.12050: Flags [.], cksum 0xfe28 (incorrect -> 0xeed5), seq 896, ack 242794, win 7884, options [nop,nop,TS val 1269928990 ecr 1269928990], length 0
200, 5.163616418838501, 2.4781274795532227