2022-02-27 23:34:42.631968 IP (tos 0x0, ttl 64, id 32548, offset 0, flags [DF], proto TCP (6), length 60)
    127.0.0.1.53218 > 127.0.0.1.9250: Flags [S], cksum 0xfe30 (incorrect -> 0x42aa), seq 2171737603, win 65495, options [mss 65495,sackOK,TS val 1274426855 ecr 0,nop,wscale 7], length 0
2022-02-27 23:34:42.631995 IP (tos 0x0, ttl 64, id 0, offset 0, flags [DF], proto TCP (6), length 60)
    127.0.0.1.9250 > 127.0.0.1.53218: Flags [S.], cksum 0xfe30 (incorrect -> 0x0154), seq 3401118906, ack 2171737604, win 65483, options [mss 65495,sackOK,TS val 1274426855 ecr 1274426855,nop,wscale 7], length 0
2022-02-27 23:34:42.632013 IP (tos 0x0, ttl 64, id 32549, offset 0, flags [DF], proto TCP (6), length 52)
    127.0.0.1.53218 > 127.0.0.1.9250: Flags [.], cksum 0xfe28 (incorrect -> 0x2810), seq 1, ack 1, win 512, options [nop,nop,TS val 1274426855 ecr 1274426855], length 0
2022-02-27 23:34:42.632191 IP (tos 0x0, ttl 64, id 32550, offset 0, flags [DF], proto TCP (6), length 55)
    127.0.0.1.53218 > 127.0.0.1.9250: Flags [P.], cksum 0xfe2b (incorrect -> 0x2304), seq 1:4, ack 1, win 512, options [nop,nop,TS val 1274426855 ecr 1274426855], length 3
2022-02-27 23:34:42.632205 IP (tos 0x0, ttl 64, id 61383, offset 0, flags [DF], proto TCP (6), length 52)
    127.0.0.1.9250 > 127.0.0.1.53218: Flags [.], cksum 0xfe28 (incorrect -> 0x280d), seq 1, ack 4, win 512, options [nop,nop,TS val 1274426855 ecr 1274426855], length 0
2022-02-27 23:34:42.632250 IP (tos 0x0, ttl 64, id 61384, offset 0, flags [DF], proto TCP (6), length 54)
    127.0.0.1.9250 > 127.0.0.1.53218: Flags [P.], cksum 0xfe2a (incorrect -> 0x2303), seq 1:3, ack 4, win 512, options [nop,nop,TS val 1274426855 ecr 1274426855], length 2
2022-02-27 23:34:42.632265 IP (tos 0x0, ttl 64, id 32551, offset 0, flags [DF], proto TCP (6), length 52)
    127.0.0.1.53218 > 127.0.0.1.9250: Flags [.], cksum 0xfe28 (incorrect -> 0x280b), seq 4, ack 3, win 512, options [nop,nop,TS val 1274426855 ecr 1274426855], length 0
2022-02-27 23:34:42.634248 IP (tos 0x0, ttl 64, id 32552, offset 0, flags [DF], proto TCP (6), length 62)
    127.0.0.1.53218 > 127.0.0.1.9250: Flags [P.], cksum 0xfe32 (incorrect -> 0x6f26), seq 4:14, ack 3, win 512, options [nop,nop,TS val 1274426857 ecr 1274426855], length 10
2022-02-27 23:34:42.634259 IP (tos 0x0, ttl 64, id 61385, offset 0, flags [DF], proto TCP (6), length 52)
    127.0.0.1.9250 > 127.0.0.1.53218: Flags [.], cksum 0xfe28 (incorrect -> 0x27fd), seq 3, ack 14, win 512, options [nop,nop,TS val 1274426857 ecr 1274426857], length 0
2022-02-27 23:34:42.702650 IP (tos 0x0, ttl 64, id 61386, offset 0, flags [DF], proto TCP (6), length 62)
    127.0.0.1.9250 > 127.0.0.1.53218: Flags [P.], cksum 0xfe32 (incorrect -> 0x22a5), seq 3:13, ack 14, win 512, options [nop,nop,TS val 1274426926 ecr 1274426857], length 10
2022-02-27 23:34:42.702661 IP (tos 0x0, ttl 64, id 32553, offset 0, flags [DF], proto TCP (6), length 52)
    127.0.0.1.53218 > 127.0.0.1.9250: Flags [.], cksum 0xfe28 (incorrect -> 0x2769), seq 14, ack 13, win 512, options [nop,nop,TS val 1274426926 ecr 1274426926], length 0
2022-02-27 23:34:42.708444 IP (tos 0x0, ttl 64, id 32554, offset 0, flags [DF], proto TCP (6), length 569)
    127.0.0.1.53218 > 127.0.0.1.9250: Flags [P.], cksum 0x002e (incorrect -> 0x635d), seq 14:531, ack 13, win 512, options [nop,nop,TS val 1274426932 ecr 1274426926], length 517
2022-02-27 23:34:42.708455 IP (tos 0x0, ttl 64, id 61387, offset 0, flags [DF], proto TCP (6), length 52)
    127.0.0.1.9250 > 127.0.0.1.53218: Flags [.], cksum 0xfe28 (incorrect -> 0x255c), seq 13, ack 531, win 508, options [nop,nop,TS val 1274426932 ecr 1274426932], length 0
200, 4.45805025100708, 0.435305118560791