2022-02-27 22:49:04.789346 IP (tos 0x0, ttl 64, id 54878, offset 0, flags [DF], proto TCP (6), length 60)
    127.0.0.1.45152 > 127.0.0.1.12050: Flags [S], cksum 0xfe30 (incorrect -> 0xfbca), seq 1760448725, win 65495, options [mss 65495,sackOK,TS val 1271689012 ecr 0,nop,wscale 7], length 0
2022-02-27 22:49:04.789357 IP (tos 0x0, ttl 64, id 0, offset 0, flags [DF], proto TCP (6), length 60)
    127.0.0.1.12050 > 127.0.0.1.45152: Flags [S.], cksum 0xfe30 (incorrect -> 0x9dea), seq 2201952155, ack 1760448726, win 65483, options [mss 65495,sackOK,TS val 1271689012 ecr 1271689012,nop,wscale 7], length 0
2022-02-27 22:49:04.789366 IP (tos 0x0, ttl 64, id 54879, offset 0, flags [DF], proto TCP (6), length 52)
    127.0.0.1.45152 > 127.0.0.1.12050: Flags [.], cksum 0xfe28 (incorrect -> 0xc4a6), seq 1, ack 1, win 512, options [nop,nop,TS val 1271689012 ecr 1271689012], length 0
2022-02-27 22:49:04.789561 IP (tos 0x0, ttl 64, id 54880, offset 0, flags [DF], proto TCP (6), length 55)
    127.0.0.1.45152 > 127.0.0.1.12050: Flags [P.], cksum 0xfe2b (incorrect -> 0xbf99), seq 1:4, ack 1, win 512, options [nop,nop,TS val 1271689013 ecr 1271689012], length 3
2022-02-27 22:49:04.789569 IP (tos 0x0, ttl 64, id 60706, offset 0, flags [DF], proto TCP (6), length 52)
    127.0.0.1.12050 > 127.0.0.1.45152: Flags [.], cksum 0xfe28 (incorrect -> 0xc4a1), seq 1, ack 4, win 512, options [nop,nop,TS val 1271689013 ecr 1271689013], length 0
2022-02-27 22:49:04.789594 IP (tos 0x0, ttl 64, id 60707, offset 0, flags [DF], proto TCP (6), length 54)
    127.0.0.1.12050 > 127.0.0.1.45152: Flags [P.], cksum 0xfe2a (incorrect -> 0xbf97), seq 1:3, ack 4, win 512, options [nop,nop,TS val 1271689013 ecr 1271689013], length 2
2022-02-27 22:49:04.789603 IP (tos 0x0, ttl 64, id 54881, offset 0, flags [DF], proto TCP (6), length 52)
    127.0.0.1.45152 > 127.0.0.1.12050: Flags [.], cksum 0xfe28 (incorrect -> 0xc49f), seq 4, ack 3, win 512, options [nop,nop,TS val 1271689013 ecr 1271689013], length 0
2022-02-27 22:49:04.790436 IP (tos 0x0, ttl 64, id 54882, offset 0, flags [DF], proto TCP (6), length 62)
    127.0.0.1.45152 > 127.0.0.1.12050: Flags [P.], cksum 0xfe32 (incorrect -> 0x2b09), seq 4:14, ack 3, win 512, options [nop,nop,TS val 1271689013 ecr 1271689013], length 10
2022-02-27 22:49:04.790457 IP (tos 0x0, ttl 64, id 60708, offset 0, flags [DF], proto TCP (6), length 52)
    127.0.0.1.12050 > 127.0.0.1.45152: Flags [.], cksum 0xfe28 (incorrect -> 0xc494), seq 3, ack 14, win 512, options [nop,nop,TS val 1271689014 ecr 1271689013], length 0
