2022-02-27 22:43:45.285327 IP (tos 0x0, ttl 64, id 6084, offset 0, flags [DF], proto TCP (6), length 60)
    127.0.0.1.35964 > 127.0.0.1.10650: Flags [S], cksum 0xfe30 (incorrect -> 0x6eaa), seq 1529279790, win 65495, options [mss 65495,sackOK,TS val 1271369508 ecr 0,nop,wscale 7], length 0
2022-02-27 22:43:45.285341 IP (tos 0x0, ttl 64, id 0, offset 0, flags [DF], proto TCP (6), length 60)
    127.0.0.1.10650 > 127.0.0.1.35964: Flags [S.], cksum 0xfe30 (incorrect -> 0x6855), seq 2140056533, ack 1529279791, win 65483, options [mss 65495,sackOK,TS val 1271369508 ecr 1271369508,nop,wscale 7], length 0
2022-02-27 22:43:45.285352 IP (tos 0x0, ttl 64, id 6085, offset 0, flags [DF], proto TCP (6), length 52)
    127.0.0.1.35964 > 127.0.0.1.10650: Flags [.], cksum 0xfe28 (incorrect -> 0x8f11), seq 1, ack 1, win 512, options [nop,nop,TS val 1271369508 ecr 1271369508], length 0
2022-02-27 22:43:45.285463 IP (tos 0x0, ttl 64, id 6086, offset 0, flags [DF], proto TCP (6), length 55)
    127.0.0.1.35964 > 127.0.0.1.10650: Flags [P.], cksum 0xfe2b (incorrect -> 0x8a04), seq 1:4, ack 1, win 512, options [nop,nop,TS val 1271369509 ecr 1271369508], length 3
2022-02-27 22:43:45.285474 IP (tos 0x0, ttl 64, id 8808, offset 0, flags [DF], proto TCP (6), length 52)
    127.0.0.1.10650 > 127.0.0.1.35964: Flags [.], cksum 0xfe28 (incorrect -> 0x8f0c), seq 1, ack 4, win 512, options [nop,nop,TS val 1271369509 ecr 1271369509], length 0
2022-02-27 22:43:45.285517 IP (tos 0x0, ttl 64, id 8809, offset 0, flags [DF], proto TCP (6), length 54)
    127.0.0.1.10650 > 127.0.0.1.35964: Flags [P.], cksum 0xfe2a (incorrect -> 0x8a02), seq 1:3, ack 4, win 512, options [nop,nop,TS val 1271369509 ecr 1271369509], length 2
2022-02-27 22:43:45.285530 IP (tos 0x0, ttl 64, id 6087, offset 0, flags [DF], proto TCP (6), length 52)
    127.0.0.1.35964 > 127.0.0.1.10650: Flags [.], cksum 0xfe28 (incorrect -> 0x8f0a), seq 4, ack 3, win 512, options [nop,nop,TS val 1271369509 ecr 1271369509], length 0
2022-02-27 22:43:45.312243 IP (tos 0x0, ttl 64, id 6088, offset 0, flags [DF], proto TCP (6), length 62)
    127.0.0.1.35964 > 127.0.0.1.10650: Flags [P.], cksum 0xfe32 (incorrect -> 0xf559), seq 4:14, ack 3, win 512, options [nop,nop,TS val 1271369535 ecr 1271369509], length 10
2022-02-27 22:43:45.312258 IP (tos 0x0, ttl 64, id 8810, offset 0, flags [DF], proto TCP (6), length 52)
    127.0.0.1.10650 > 127.0.0.1.35964: Flags [.], cksum 0xfe28 (incorrect -> 0x8ecc), seq 3, ack 14, win 512, options [nop,nop,TS val 1271369535 ecr 1271369535], length 0
2022-02-27 22:43:56.204664 IP (tos 0x0, ttl 64, id 8811, offset 0, flags [DF], proto TCP (6), length 62)
    127.0.0.1.10650 > 127.0.0.1.35964: Flags [P.], cksum 0xfe32 (incorrect -> 0x5f2c), seq 3:13, ack 14, win 512, options [nop,nop,TS val 1271380428 ecr 1271369535], length 10
2022-02-27 22:43:56.204672 IP (tos 0x0, ttl 64, id 6089, offset 0, flags [DF], proto TCP (6), length 52)
    127.0.0.1.35964 > 127.0.0.1.10650: Flags [.], cksum 0xfe28 (incorrect -> 0x39a8), seq 14, ack 13, win 512, options [nop,nop,TS val 1271380428 ecr 1271380428], length 0
2022-02-27 22:43:56.210931 IP (tos 0x0, ttl 64, id 6090, offset 0, flags [DF], proto TCP (6), length 569)
    127.0.0.1.35964 > 127.0.0.1.10650: Flags [P.], cksum 0x002e (incorrect -> 0x624d), seq 14:531, ack 13, win 512, options [nop,nop,TS val 1271380434 ecr 1271380428], length 517
2022-02-27 22:43:56.210946 IP (tos 0x0, ttl 64, id 8812, offset 0, flags [DF], proto TCP (6), length 52)
    127.0.0.1.10650 > 127.0.0.1.35964: Flags [.], cksum 0xfe28 (incorrect -> 0x379b), seq 13, ack 531, win 508, options [nop,nop,TS val 1271380434 ecr 1271380434], length 0
2022-02-27 22:43:56.474546 IP (tos 0x0, ttl 64, id 8813, offset 0, flags [DF], proto TCP (6), length 3538)
    127.0.0.1.10650 > 127.0.0.1.35964: Flags [P.], cksum 0x0bc7 (incorrect -> 0xf6c7), seq 13:3499, ack 531, win 512, options [nop,nop,TS val 1271380698 ecr 1271380434], length 3486
2022-02-27 22:43:56.474550 IP (tos 0x0, ttl 64, id 6091, offset 0, flags [DF], proto TCP (6), length 52)
    127.0.0.1.35964 > 127.0.0.1.10650: Flags [.], cksum 0xfe28 (incorrect -> 0x27fb), seq 531, ack 3499, win 494, options [nop,nop,TS val 1271380698 ecr 1271380698], length 0
2022-02-27 22:43:56.491553 IP (tos 0x0, ttl 64, id 8814, offset 0, flags [DF], proto TCP (6), length 1048)
    127.0.0.1.10650 > 127.0.0.1.35964: Flags [P.], cksum 0x020d (incorrect -> 0x2f0e), seq 3499:4495, ack 531, win 512, options [nop,nop,TS val 1271380715 ecr 1271380698], length 996
2022-02-27 22:43:56.491557 IP (tos 0x0, ttl 64, id 6092, offset 0, flags [DF], proto TCP (6), length 52)
    127.0.0.1.35964 > 127.0.0.1.10650: Flags [.], cksum 0xfe28 (incorrect -> 0x23eb), seq 531, ack 4495, win 504, options [nop,nop,TS val 1271380715 ecr 1271380715], length 0
2022-02-27 22:43:56.577713 IP (tos 0x0, ttl 64, id 8815, offset 0, flags [DF], proto TCP (6), length 997)
    127.0.0.1.10650 > 127.0.0.1.35964: Flags [P.], cksum 0x01da (incorrect -> 0x7015), seq 4495:5440, ack 531, win 512, options [nop,nop,TS val 1271380801 ecr 1271380715], length 945
2022-02-27 22:43:56.577722 IP (tos 0x0, ttl 64, id 6093, offset 0, flags [DF], proto TCP (6), length 52)
    127.0.0.1.35964 > 127.0.0.1.10650: Flags [.], cksum 0xfe28 (incorrect -> 0x1f8e), seq 531, ack 5440, win 504, options [nop,nop,TS val 1271380801 ecr 1271380801], length 0
2022-02-27 22:43:56.578561 IP (tos 0x0, ttl 64, id 6094, offset 0, flags [DF], proto TCP (6), length 132)
    127.0.0.1.35964 > 127.0.0.1.10650: Flags [P.], cksum 0xfe78 (incorrect -> 0x689e), seq 531:611, ack 5440, win 512, options [nop,nop,TS val 1271380802 ecr 1271380801], length 80
2022-02-27 22:43:56.578574 IP (tos 0x0, ttl 64, id 8816, offset 0, flags [DF], proto TCP (6), length 52)
    127.0.0.1.10650 > 127.0.0.1.35964: Flags [.], cksum 0xfe28 (incorrect -> 0x1f34), seq 5440, ack 611, win 512, options [nop,nop,TS val 1271380802 ecr 1271380802], length 0
2022-02-27 22:43:56.578938 IP (tos 0x0, ttl 64, id 6095, offset 0, flags [DF], proto TCP (6), length 343)
    127.0.0.1.35964 > 127.0.0.1.10650: Flags [P.], cksum 0xff4b (incorrect -> 0x9c32), seq 611:902, ack 5440, win 512, options [nop,nop,TS val 1271380802 ecr 1271380802], length 291
2022-02-27 22:43:56.578941 IP (tos 0x0, ttl 64, id 8817, offset 0, flags [DF], proto TCP (6), length 52)
    127.0.0.1.10650 > 127.0.0.1.35964: Flags [.], cksum 0xfe28 (incorrect -> 0x1e13), seq 5440, ack 902, win 510, options [nop,nop,TS val 1271380802 ecr 1271380802], length 0
2022-02-27 22:43:56.801384 IP (tos 0x0, ttl 64, id 8818, offset 0, flags [DF], proto TCP (6), length 903)
    127.0.0.1.10650 > 127.0.0.1.35964: Flags [P.], cksum 0x017c (incorrect -> 0x160a), seq 5440:6291, ack 902, win 512, options [nop,nop,TS val 1271381024 ecr 1271380802], length 851
2022-02-27 22:43:56.801393 IP (tos 0x0, ttl 64, id 6096, offset 0, flags [DF], proto TCP (6), length 52)
    127.0.0.1.35964 > 127.0.0.1.10650: Flags [.], cksum 0xfe28 (incorrect -> 0x1908), seq 902, ack 6291, win 506, options [nop,nop,TS val 1271381024 ecr 1271381024], length 0
2022-02-27 22:43:56.803837 IP (tos 0x0, ttl 64, id 6097, offset 0, flags [DF], proto TCP (6), length 442)
    127.0.0.1.35964 > 127.0.0.1.10650: Flags [P.], cksum 0xffae (incorrect -> 0xa41b), seq 902:1292, ack 6291, win 512, options [nop,nop,TS val 1271381027 ecr 1271381024], length 390
2022-02-27 22:43:56.803845 IP (tos 0x0, ttl 64, id 8819, offset 0, flags [DF], proto TCP (6), length 52)
    127.0.0.1.10650 > 127.0.0.1.35964: Flags [.], cksum 0xfe28 (incorrect -> 0x1779), seq 6291, ack 1292, win 509, options [nop,nop,TS val 1271381027 ecr 1271381027], length 0
2022-02-27 22:43:57.036302 IP (tos 0x0, ttl 64, id 8820, offset 0, flags [DF], proto TCP (6), length 775)
    127.0.0.1.10650 > 127.0.0.1.35964: Flags [P.], cksum 0x00fc (incorrect -> 0x0f60), seq 6291:7014, ack 1292, win 512, options [nop,nop,TS val 1271381259 ecr 1271381027], length 723
2022-02-27 22:43:57.037997 IP (tos 0x0, ttl 64, id 6098, offset 0, flags [DF], proto TCP (6), length 441)
    127.0.0.1.35964 > 127.0.0.1.10650: Flags [P.], cksum 0xffad (incorrect -> 0xdfc3), seq 1292:1681, ack 7014, win 512, options [nop,nop,TS val 1271381261 ecr 1271381259], length 389
2022-02-27 22:43:57.038009 IP (tos 0x0, ttl 64, id 8821, offset 0, flags [DF], proto TCP (6), length 52)
    127.0.0.1.10650 > 127.0.0.1.35964: Flags [.], cksum 0xfe28 (incorrect -> 0x114d), seq 7014, ack 1681, win 509, options [nop,nop,TS val 1271381261 ecr 1271381261], length 0
2022-02-27 22:43:57.628084 IP (tos 0x0, ttl 64, id 8822, offset 0, flags [DF], proto TCP (6), length 3538)
    127.0.0.1.10650 > 127.0.0.1.35964: Flags [P.], cksum 0x0bc7 (incorrect -> 0xc541), seq 7014:10500, ack 1681, win 512, options [nop,nop,TS val 1271381851 ecr 1271381261], length 3486
2022-02-27 22:43:57.670141 IP (tos 0x0, ttl 64, id 6099, offset 0, flags [DF], proto TCP (6), length 52)
    127.0.0.1.35964 > 127.0.0.1.10650: Flags [.], cksum 0xfe28 (incorrect -> 0xfee5), seq 1681, ack 10500, win 512, options [nop,nop,TS val 1271381893 ecr 1271381851], length 0
2022-02-27 22:43:57.670147 IP (tos 0x0, ttl 64, id 8823, offset 0, flags [DF], proto TCP (6), length 1048)
    127.0.0.1.10650 > 127.0.0.1.35964: Flags [P.], cksum 0x020d (incorrect -> 0x688b), seq 10500:11496, ack 1681, win 512, options [nop,nop,TS val 1271381893 ecr 1271381893], length 996
2022-02-27 22:43:57.670150 IP (tos 0x0, ttl 64, id 6100, offset 0, flags [DF], proto TCP (6), length 52)
    127.0.0.1.35964 > 127.0.0.1.10650: Flags [.], cksum 0xfe28 (incorrect -> 0xfade), seq 1681, ack 11496, win 505, options [nop,nop,TS val 1271381893 ecr 1271381893], length 0
2022-02-27 22:43:57.701462 IP (tos 0x0, ttl 64, id 8824, offset 0, flags [DF], proto TCP (6), length 3538)
    127.0.0.1.10650 > 127.0.0.1.35964: Flags [P.], cksum 0x0bc7 (incorrect -> 0xe874), seq 11496:14982, ack 1681, win 512, options [nop,nop,TS val 1271381925 ecr 1271381893], length 3486
2022-02-27 22:43:57.701467 IP (tos 0x0, ttl 64, id 6101, offset 0, flags [DF], proto TCP (6), length 52)
    127.0.0.1.35964 > 127.0.0.1.10650: Flags [.], cksum 0xfe28 (incorrect -> 0xed0b), seq 1681, ack 14982, win 494, options [nop,nop,TS val 1271381925 ecr 1271381925], length 0
2022-02-27 22:43:57.704523 IP (tos 0x0, ttl 64, id 8825, offset 0, flags [DF], proto TCP (6), length 1048)
    127.0.0.1.10650 > 127.0.0.1.35964: Flags [P.], cksum 0x020d (incorrect -> 0x073c), seq 14982:15978, ack 1681, win 512, options [nop,nop,TS val 1271381928 ecr 1271381925], length 996
2022-02-27 22:43:57.704527 IP (tos 0x0, ttl 64, id 6102, offset 0, flags [DF], proto TCP (6), length 52)
    127.0.0.1.35964 > 127.0.0.1.10650: Flags [.], cksum 0xfe28 (incorrect -> 0xe917), seq 1681, ack 15978, win 504, options [nop,nop,TS val 1271381928 ecr 1271381928], length 0
200, 123.54285025596619, 12.61125922203064