2022-02-27 22:17:27.535995 IP (tos 0x0, ttl 64, id 61817, offset 0, flags [DF], proto TCP (6), length 60)
    127.0.0.1.36934 > 127.0.0.1.9950: Flags [S], cksum 0xfe30 (incorrect -> 0x2136), seq 2534938832, win 65495, options [mss 65495,sackOK,TS val 1269791759 ecr 0,nop,wscale 7], length 0
2022-02-27 22:17:27.536013 IP (tos 0x0, ttl 64, id 0, offset 0, flags [DF], proto TCP (6), length 60)
    127.0.0.1.9950 > 127.0.0.1.36934: Flags [S.], cksum 0xfe30 (incorrect -> 0x5056), seq 1156498477, ack 2534938833, win 65483, options [mss 65495,sackOK,TS val 1269791759 ecr 1269791759,nop,wscale 7], length 0
2022-02-27 22:17:27.536027 IP (tos 0x0, ttl 64, id 61818, offset 0, flags [DF], proto TCP (6), length 52)
    127.0.0.1.36934 > 127.0.0.1.9950: Flags [.], cksum 0xfe28 (incorrect -> 0x7712), seq 1, ack 1, win 512, options [nop,nop,TS val 1269791759 ecr 1269791759], length 0
2022-02-27 22:17:27.536131 IP (tos 0x0, ttl 64, id 61819, offset 0, flags [DF], proto TCP (6), length 55)
    127.0.0.1.36934 > 127.0.0.1.9950: Flags [P.], cksum 0xfe2b (incorrect -> 0x7206), seq 1:4, ack 1, win 512, options [nop,nop,TS val 1269791759 ecr 1269791759], length 3
2022-02-27 22:17:27.536135 IP (tos 0x0, ttl 64, id 20146, offset 0, flags [DF], proto TCP (6), length 52)
    127.0.0.1.9950 > 127.0.0.1.36934: Flags [.], cksum 0xfe28 (incorrect -> 0x770f), seq 1, ack 4, win 512, options [nop,nop,TS val 1269791759 ecr 1269791759], length 0
2022-02-27 22:17:27.536203 IP (tos 0x0, ttl 64, id 20147, offset 0, flags [DF], proto TCP (6), length 54)
    127.0.0.1.9950 > 127.0.0.1.36934: Flags [P.], cksum 0xfe2a (incorrect -> 0x7205), seq 1:3, ack 4, win 512, options [nop,nop,TS val 1269791759 ecr 1269791759], length 2
2022-02-27 22:17:27.536208 IP (tos 0x0, ttl 64, id 61820, offset 0, flags [DF], proto TCP (6), length 52)
    127.0.0.1.36934 > 127.0.0.1.9950: Flags [.], cksum 0xfe28 (incorrect -> 0x770d), seq 4, ack 3, win 512, options [nop,nop,TS val 1269791759 ecr 1269791759], length 0
2022-02-27 22:17:27.548910 IP (tos 0x0, ttl 64, id 61821, offset 0, flags [DF], proto TCP (6), length 62)
    127.0.0.1.36934 > 127.0.0.1.9950: Flags [P.], cksum 0xfe32 (incorrect -> 0x76f3), seq 4:14, ack 3, win 512, options [nop,nop,TS val 1269791772 ecr 1269791759], length 10
2022-02-27 22:17:27.548930 IP (tos 0x0, ttl 64, id 20148, offset 0, flags [DF], proto TCP (6), length 52)
    127.0.0.1.9950 > 127.0.0.1.36934: Flags [.], cksum 0xfe28 (incorrect -> 0x76e9), seq 3, ack 14, win 512, options [nop,nop,TS val 1269791772 ecr 1269791772], length 0
2022-02-27 22:17:27.811975 IP (tos 0x0, ttl 64, id 20149, offset 0, flags [DF], proto TCP (6), length 62)
    127.0.0.1.9950 > 127.0.0.1.36934: Flags [P.], cksum 0xfe32 (incorrect -> 0x70cf), seq 3:13, ack 14, win 512, options [nop,nop,TS val 1269792035 ecr 1269791772], length 10
2022-02-27 22:17:27.811987 IP (tos 0x0, ttl 64, id 61822, offset 0, flags [DF], proto TCP (6), length 52)
    127.0.0.1.36934 > 127.0.0.1.9950: Flags [.], cksum 0xfe28 (incorrect -> 0x74d1), seq 14, ack 13, win 512, options [nop,nop,TS val 1269792035 ecr 1269792035], length 0
2022-02-27 22:17:27.817519 IP (tos 0x0, ttl 64, id 61823, offset 0, flags [DF], proto TCP (6), length 569)
    127.0.0.1.36934 > 127.0.0.1.9950: Flags [P.], cksum 0x002e (incorrect -> 0x8ef9), seq 14:531, ack 13, win 512, options [nop,nop,TS val 1269792041 ecr 1269792035], length 517
2022-02-27 22:17:27.817536 IP (tos 0x0, ttl 64, id 20150, offset 0, flags [DF], proto TCP (6), length 52)
    127.0.0.1.9950 > 127.0.0.1.36934: Flags [.], cksum 0xfe28 (incorrect -> 0x72c4), seq 13, ack 531, win 508, options [nop,nop,TS val 1269792041 ecr 1269792041], length 0
2022-02-27 22:17:28.119758 IP (tos 0x0, ttl 64, id 20151, offset 0, flags [DF], proto TCP (6), length 3538)
    127.0.0.1.9950 > 127.0.0.1.36934: Flags [P.], cksum 0x0bc7 (incorrect -> 0xd08e), seq 13:3499, ack 531, win 512, options [nop,nop,TS val 1269792343 ecr 1269792041], length 3486
2022-02-27 22:17:28.119784 IP (tos 0x0, ttl 64, id 61824, offset 0, flags [DF], proto TCP (6), length 52)
    127.0.0.1.36934 > 127.0.0.1.9950: Flags [.], cksum 0xfe28 (incorrect -> 0x62d8), seq 531, ack 3499, win 494, options [nop,nop,TS val 1269792343 ecr 1269792343], length 0
2022-02-27 22:17:28.143283 IP (tos 0x0, ttl 64, id 20152, offset 0, flags [DF], proto TCP (6), length 662)
    127.0.0.1.9950 > 127.0.0.1.36934: Flags [P.], cksum 0x008b (incorrect -> 0xc78c), seq 3499:4109, ack 531, win 512, options [nop,nop,TS val 1269792366 ecr 1269792343], length 610
2022-02-27 22:17:28.143293 IP (tos 0x0, ttl 64, id 61825, offset 0, flags [DF], proto TCP (6), length 52)
    127.0.0.1.36934 > 127.0.0.1.9950: Flags [.], cksum 0xfe28 (incorrect -> 0x603d), seq 531, ack 4109, win 505, options [nop,nop,TS val 1269792366 ecr 1269792366], length 0
2022-02-27 22:17:28.201422 IP (tos 0x0, ttl 64, id 20153, offset 0, flags [DF], proto TCP (6), length 1058)
    127.0.0.1.9950 > 127.0.0.1.36934: Flags [P.], cksum 0x0217 (incorrect -> 0x5107), seq 4109:5115, ack 531, win 512, options [nop,nop,TS val 1269792424 ecr 1269792366], length 1006
2022-02-27 22:17:28.201432 IP (tos 0x0, ttl 64, id 61826, offset 0, flags [DF], proto TCP (6), length 52)
    127.0.0.1.36934 > 127.0.0.1.9950: Flags [.], cksum 0xfe28 (incorrect -> 0x5bdb), seq 531, ack 5115, win 504, options [nop,nop,TS val 1269792425 ecr 1269792424], length 0
2022-02-27 22:17:28.201893 IP (tos 0x0, ttl 64, id 61827, offset 0, flags [DF], proto TCP (6), length 132)
    127.0.0.1.36934 > 127.0.0.1.9950: Flags [P.], cksum 0xfe78 (incorrect -> 0xcd22), seq 531:611, ack 5115, win 512, options [nop,nop,TS val 1269792425 ecr 1269792424], length 80
2022-02-27 22:17:28.202263 IP (tos 0x0, ttl 64, id 20154, offset 0, flags [DF], proto TCP (6), length 52)
    127.0.0.1.9950 > 127.0.0.1.36934: Flags [.], cksum 0xfe28 (incorrect -> 0x5b82), seq 5115, ack 611, win 512, options [nop,nop,TS val 1269792425 ecr 1269792425], length 0
2022-02-27 22:17:28.202413 IP (tos 0x0, ttl 64, id 61828, offset 0, flags [DF], proto TCP (6), length 309)
    127.0.0.1.36934 > 127.0.0.1.9950: Flags [P.], cksum 0xff29 (incorrect -> 0xdea0), seq 611:868, ack 5115, win 512, options [nop,nop,TS val 1269792425 ecr 1269792425], length 257
2022-02-27 22:17:28.202419 IP (tos 0x0, ttl 64, id 20155, offset 0, flags [DF], proto TCP (6), length 52)
    127.0.0.1.9950 > 127.0.0.1.36934: Flags [.], cksum 0xfe28 (incorrect -> 0x5a83), seq 5115, ack 868, win 510, options [nop,nop,TS val 1269792425 ecr 1269792425], length 0
2022-02-27 22:17:28.469155 IP (tos 0x0, ttl 64, id 20156, offset 0, flags [DF], proto TCP (6), length 594)
    127.0.0.1.9950 > 127.0.0.1.36934: Flags [P.], cksum 0x0047 (incorrect -> 0xc2cd), seq 5115:5657, ack 868, win 512, options [nop,nop,TS val 1269792692 ecr 1269792425], length 542
2022-02-27 22:17:28.469167 IP (tos 0x0, ttl 64, id 61829, offset 0, flags [DF], proto TCP (6), length 52)
    127.0.0.1.36934 > 127.0.0.1.9950: Flags [.], cksum 0xfe28 (incorrect -> 0x5651), seq 868, ack 5657, win 508, options [nop,nop,TS val 1269792692 ecr 1269792692], length 0
200, 14.358178615570068, 1.4244780540466309