2022-02-27 23:46:31.902080 IP (tos 0x0, ttl 64, id 51199, offset 0, flags [DF], proto TCP (6), length 60)
    127.0.0.1.45420 > 127.0.0.1.10250: Flags [S], cksum 0xfe30 (incorrect -> 0xffe5), seq 3997774813, win 65495, options [mss 65495,sackOK,TS val 1275136125 ecr 0,nop,wscale 7], length 0
2022-02-27 23:46:31.902093 IP (tos 0x0, ttl 64, id 0, offset 0, flags [DF], proto TCP (6), length 60)
    127.0.0.1.10250 > 127.0.0.1.45420: Flags [S.], cksum 0xfe30 (incorrect -> 0x4965), seq 3818815070, ack 3997774814, win 65483, options [mss 65495,sackOK,TS val 1275136125 ecr 1275136125,nop,wscale 7], length 0
2022-02-27 23:46:31.902103 IP (tos 0x0, ttl 64, id 51200, offset 0, flags [DF], proto TCP (6), length 52)
    127.0.0.1.45420 > 127.0.0.1.10250: Flags [.], cksum 0xfe28 (incorrect -> 0x7021), seq 1, ack 1, win 512, options [nop,nop,TS val 1275136125 ecr 1275136125], length 0
2022-02-27 23:46:31.902291 IP (tos 0x0, ttl 64, id 51201, offset 0, flags [DF], proto TCP (6), length 55)
    127.0.0.1.45420 > 127.0.0.1.10250: Flags [P.], cksum 0xfe2b (incorrect -> 0x6b15), seq 1:4, ack 1, win 512, options [nop,nop,TS val 1275136125 ecr 1275136125], length 3
2022-02-27 23:46:31.902300 IP (tos 0x0, ttl 64, id 51422, offset 0, flags [DF], proto TCP (6), length 52)
    127.0.0.1.10250 > 127.0.0.1.45420: Flags [.], cksum 0xfe28 (incorrect -> 0x701e), seq 1, ack 4, win 512, options [nop,nop,TS val 1275136125 ecr 1275136125], length 0
2022-02-27 23:46:31.902324 IP (tos 0x0, ttl 64, id 51423, offset 0, flags [DF], proto TCP (6), length 54)
    127.0.0.1.10250 > 127.0.0.1.45420: Flags [P.], cksum 0xfe2a (incorrect -> 0x6b14), seq 1:3, ack 4, win 512, options [nop,nop,TS val 1275136125 ecr 1275136125], length 2
2022-02-27 23:46:31.902333 IP (tos 0x0, ttl 64, id 51202, offset 0, flags [DF], proto TCP (6), length 52)
    127.0.0.1.45420 > 127.0.0.1.10250: Flags [.], cksum 0xfe28 (incorrect -> 0x701c), seq 4, ack 3, win 512, options [nop,nop,TS val 1275136125 ecr 1275136125], length 0
2022-02-27 23:46:31.914199 IP (tos 0x0, ttl 64, id 51203, offset 0, flags [DF], proto TCP (6), length 62)
    127.0.0.1.45420 > 127.0.0.1.10250: Flags [P.], cksum 0xfe32 (incorrect -> 0xc638), seq 4:14, ack 3, win 512, options [nop,nop,TS val 1275136137 ecr 1275136125], length 10
2022-02-27 23:46:31.914211 IP (tos 0x0, ttl 64, id 51424, offset 0, flags [DF], proto TCP (6), length 52)
    127.0.0.1.10250 > 127.0.0.1.45420: Flags [.], cksum 0xfe28 (incorrect -> 0x6ffa), seq 3, ack 14, win 512, options [nop,nop,TS val 1275136137 ecr 1275136137], length 0
2022-02-27 23:46:32.053620 IP (tos 0x0, ttl 64, id 51425, offset 0, flags [DF], proto TCP (6), length 62)
    127.0.0.1.10250 > 127.0.0.1.45420: Flags [P.], cksum 0xfe32 (incorrect -> 0x6a5b), seq 3:13, ack 14, win 512, options [nop,nop,TS val 1275136277 ecr 1275136137], length 10
2022-02-27 23:46:32.053627 IP (tos 0x0, ttl 64, id 51204, offset 0, flags [DF], proto TCP (6), length 52)
    127.0.0.1.45420 > 127.0.0.1.10250: Flags [.], cksum 0xfe28 (incorrect -> 0x6ed8), seq 14, ack 13, win 512, options [nop,nop,TS val 1275136277 ecr 1275136277], length 0
2022-02-27 23:46:32.059152 IP (tos 0x0, ttl 64, id 51205, offset 0, flags [DF], proto TCP (6), length 569)
    127.0.0.1.45420 > 127.0.0.1.10250: Flags [P.], cksum 0x002e (incorrect -> 0x7800), seq 14:531, ack 13, win 512, options [nop,nop,TS val 1275136282 ecr 1275136277], length 517
2022-02-27 23:46:32.059162 IP (tos 0x0, ttl 64, id 51426, offset 0, flags [DF], proto TCP (6), length 52)
    127.0.0.1.10250 > 127.0.0.1.45420: Flags [.], cksum 0xfe28 (incorrect -> 0x6ccd), seq 13, ack 531, win 508, options [nop,nop,TS val 1275136282 ecr 1275136282], length 0
2022-02-27 23:46:32.199098 IP (tos 0x0, ttl 64, id 51427, offset 0, flags [DF], proto TCP (6), length 151)
    127.0.0.1.10250 > 127.0.0.1.45420: Flags [P.], cksum 0xfe8b (incorrect -> 0xc63a), seq 13:112, ack 531, win 512, options [nop,nop,TS val 1275136422 ecr 1275136282], length 99
2022-02-27 23:46:32.199105 IP (tos 0x0, ttl 64, id 51206, offset 0, flags [DF], proto TCP (6), length 52)
    127.0.0.1.45420 > 127.0.0.1.10250: Flags [.], cksum 0xfe28 (incorrect -> 0x6b4e), seq 531, ack 112, win 512, options [nop,nop,TS val 1275136422 ecr 1275136422], length 0
2022-02-27 23:46:32.199229 IP (tos 0x0, ttl 64, id 51207, offset 0, flags [DF], proto TCP (6), length 575)
    127.0.0.1.45420 > 127.0.0.1.10250: Flags [P.], cksum 0x0034 (incorrect -> 0x1ddf), seq 531:1054, ack 112, win 512, options [nop,nop,TS val 1275136422 ecr 1275136422], length 523
2022-02-27 23:46:32.199236 IP (tos 0x0, ttl 64, id 51428, offset 0, flags [DF], proto TCP (6), length 52)
    127.0.0.1.10250 > 127.0.0.1.45420: Flags [.], cksum 0xfe28 (incorrect -> 0x6947), seq 112, ack 1054, win 508, options [nop,nop,TS val 1275136422 ecr 1275136422], length 0
2022-02-27 23:46:32.338746 IP (tos 0x0, ttl 64, id 51429, offset 0, flags [DF], proto TCP (6), length 3538)
    127.0.0.1.10250 > 127.0.0.1.45420: Flags [P.], cksum 0x0bc7 (incorrect -> 0xfdc7), seq 112:3598, ack 1054, win 512, options [nop,nop,TS val 1275136562 ecr 1275136422], length 3486
2022-02-27 23:46:32.338756 IP (tos 0x0, ttl 64, id 51208, offset 0, flags [DF], proto TCP (6), length 52)
    127.0.0.1.45420 > 127.0.0.1.10250: Flags [.], cksum 0xfe28 (incorrect -> 0x5a9f), seq 1054, ack 3598, win 494, options [nop,nop,TS val 1275136562 ecr 1275136562], length 0
2022-02-27 23:46:32.365565 IP (tos 0x0, ttl 64, id 51430, offset 0, flags [DF], proto TCP (6), length 3538)
    127.0.0.1.10250 > 127.0.0.1.45420: Flags [P.], cksum 0x0bc7 (incorrect -> 0x95c8), seq 3598:7084, ack 1054, win 512, options [nop,nop,TS val 1275136589 ecr 1275136562], length 3486
2022-02-27 23:46:32.365571 IP (tos 0x0, ttl 64, id 51209, offset 0, flags [DF], proto TCP (6), length 52)
    127.0.0.1.45420 > 127.0.0.1.10250: Flags [.], cksum 0xfe28 (incorrect -> 0x4ccb), seq 1054, ack 7084, win 494, options [nop,nop,TS val 1275136589 ecr 1275136589], length 0
2022-02-27 23:46:32.381035 IP (tos 0x0, ttl 64, id 51431, offset 0, flags [DF], proto TCP (6), length 550)
    127.0.0.1.10250 > 127.0.0.1.45420: Flags [P.], cksum 0x001b (incorrect -> 0xc212), seq 7084:7582, ack 1054, win 512, options [nop,nop,TS val 1275136604 ecr 1275136589], length 498
2022-02-27 23:46:32.381042 IP (tos 0x0, ttl 64, id 51210, offset 0, flags [DF], proto TCP (6), length 52)
    127.0.0.1.45420 > 127.0.0.1.10250: Flags [.], cksum 0xfe28 (incorrect -> 0x4aaf), seq 1054, ack 7582, win 506, options [nop,nop,TS val 1275136604 ecr 1275136604], length 0
2022-02-27 23:46:32.438188 IP (tos 0x0, ttl 64, id 51432, offset 0, flags [DF], proto TCP (6), length 2882)
    127.0.0.1.10250 > 127.0.0.1.45420: Flags [P.], cksum 0x0937 (incorrect -> 0x71cb), seq 7582:10412, ack 1054, win 512, options [nop,nop,TS val 1275136661 ecr 1275136604], length 2830
2022-02-27 23:46:32.438196 IP (tos 0x0, ttl 64, id 51211, offset 0, flags [DF], proto TCP (6), length 52)
    127.0.0.1.45420 > 127.0.0.1.10250: Flags [.], cksum 0xfe28 (incorrect -> 0x3f39), seq 1054, ack 10412, win 496, options [nop,nop,TS val 1275136661 ecr 1275136661], length 0
2022-02-27 23:46:32.438864 IP (tos 0x0, ttl 64, id 51212, offset 0, flags [DF], proto TCP (6), length 126)
    127.0.0.1.45420 > 127.0.0.1.10250: Flags [P.], cksum 0xfe72 (incorrect -> 0xfb75), seq 1054:1128, ack 10412, win 512, options [nop,nop,TS val 1275136662 ecr 1275136661], length 74
2022-02-27 23:46:32.438872 IP (tos 0x0, ttl 64, id 51433, offset 0, flags [DF], proto TCP (6), length 52)
    127.0.0.1.10250 > 127.0.0.1.45420: Flags [.], cksum 0xfe28 (incorrect -> 0x3edd), seq 10412, ack 1128, win 512, options [nop,nop,TS val 1275136662 ecr 1275136662], length 0
2022-02-27 23:46:32.439257 IP (tos 0x0, ttl 64, id 51213, offset 0, flags [DF], proto TCP (6), length 343)
    127.0.0.1.45420 > 127.0.0.1.10250: Flags [P.], cksum 0xff4b (incorrect -> 0x5780), seq 1128:1419, ack 10412, win 512, options [nop,nop,TS val 1275136662 ecr 1275136662], length 291
2022-02-27 23:46:32.439262 IP (tos 0x0, ttl 64, id 51434, offset 0, flags [DF], proto TCP (6), length 52)
    127.0.0.1.10250 > 127.0.0.1.45420: Flags [.], cksum 0xfe28 (incorrect -> 0x3dbc), seq 10412, ack 1419, win 510, options [nop,nop,TS val 1275136662 ecr 1275136662], length 0
2022-02-27 23:46:32.591241 IP (tos 0x0, ttl 64, id 51435, offset 0, flags [DF], proto TCP (6), length 339)
    127.0.0.1.10250 > 127.0.0.1.45420: Flags [P.], cksum 0xff47 (incorrect -> 0x488d), seq 10412:10699, ack 1419, win 512, options [nop,nop,TS val 1275136814 ecr 1275136662], length 287
2022-02-27 23:46:32.634153 IP (tos 0x0, ttl 64, id 51214, offset 0, flags [DF], proto TCP (6), length 52)
    127.0.0.1.45420 > 127.0.0.1.10250: Flags [.], cksum 0xfe28 (incorrect -> 0x3b40), seq 1419, ack 10699, win 512, options [nop,nop,TS val 1275136857 ecr 1275136814], length 0
2022-02-27 23:46:32.681446 IP (tos 0x0, ttl 64, id 51436, offset 0, flags [DF], proto TCP (6), length 339)
    127.0.0.1.10250 > 127.0.0.1.45420: Flags [P.], cksum 0xff47 (incorrect -> 0x79fe), seq 10699:10986, ack 1419, win 512, options [nop,nop,TS val 1275136905 ecr 1275136857], length 287
2022-02-27 23:46:32.681456 IP (tos 0x0, ttl 64, id 51215, offset 0, flags [DF], proto TCP (6), length 52)
    127.0.0.1.45420 > 127.0.0.1.10250: Flags [.], cksum 0xfe28 (incorrect -> 0x3998), seq 1419, ack 10986, win 510, options [nop,nop,TS val 1275136905 ecr 1275136905], length 0
2022-02-27 23:46:33.637339 IP (tos 0x0, ttl 64, id 51437, offset 0, flags [DF], proto TCP (6), length 3538)
    127.0.0.1.10250 > 127.0.0.1.45420: Flags [P.], cksum 0x0bc7 (incorrect -> 0x5886), seq 10986:14472, ack 1419, win 512, options [nop,nop,TS val 1275137860 ecr 1275136905], length 3486
2022-02-27 23:46:33.637349 IP (tos 0x0, ttl 64, id 51216, offset 0, flags [DF], proto TCP (6), length 52)
    127.0.0.1.45420 > 127.0.0.1.10250: Flags [.], cksum 0xfe28 (incorrect -> 0x2494), seq 1419, ack 14472, win 494, options [nop,nop,TS val 1275137860 ecr 1275137860], length 0
2022-02-27 23:46:33.652696 IP (tos 0x0, ttl 64, id 51438, offset 0, flags [DF], proto TCP (6), length 4036)
    127.0.0.1.10250 > 127.0.0.1.45420: Flags [P.], cksum 0x0db9 (incorrect -> 0xd05e), seq 14472:18456, ack 1419, win 512, options [nop,nop,TS val 1275137876 ecr 1275137860], length 3984
2022-02-27 23:46:33.652702 IP (tos 0x0, ttl 64, id 51217, offset 0, flags [DF], proto TCP (6), length 52)
    127.0.0.1.45420 > 127.0.0.1.10250: Flags [.], cksum 0xfe28 (incorrect -> 0x14e6), seq 1419, ack 18456, win 492, options [nop,nop,TS val 1275137876 ecr 1275137876], length 0
2022-02-27 23:46:33.668907 IP (tos 0x0, ttl 64, id 51439, offset 0, flags [DF], proto TCP (6), length 4036)
    127.0.0.1.10250 > 127.0.0.1.45420: Flags [P.], cksum 0x0db9 (incorrect -> 0x1657), seq 18456:22440, ack 1419, win 512, options [nop,nop,TS val 1275137892 ecr 1275137876], length 3984
2022-02-27 23:46:33.668925 IP (tos 0x0, ttl 64, id 51218, offset 0, flags [DF], proto TCP (6), length 52)
    127.0.0.1.45420 > 127.0.0.1.10250: Flags [.], cksum 0xfe28 (incorrect -> 0x0536), seq 1419, ack 22440, win 492, options [nop,nop,TS val 1275137892 ecr 1275137892], length 0
2022-02-27 23:46:33.736910 IP (tos 0x0, ttl 64, id 51440, offset 0, flags [DF], proto TCP (6), length 3538)
    127.0.0.1.10250 > 127.0.0.1.45420: Flags [P.], cksum 0x0bc7 (incorrect -> 0x7fc2), seq 22440:25926, ack 1419, win 512, options [nop,nop,TS val 1275137960 ecr 1275137892], length 3486
2022-02-27 23:46:33.736926 IP (tos 0x0, ttl 64, id 51219, offset 0, flags [DF], proto TCP (6), length 52)
    127.0.0.1.45420 > 127.0.0.1.10250: Flags [.], cksum 0xfe28 (incorrect -> 0xf70d), seq 1419, ack 25926, win 494, options [nop,nop,TS val 1275137960 ecr 1275137960], length 0
2022-02-27 23:46:33.754882 IP (tos 0x0, ttl 64, id 51441, offset 0, flags [DF], proto TCP (6), length 1780)
    127.0.0.1.10250 > 127.0.0.1.45420: Flags [P.], cksum 0x04e9 (incorrect -> 0xce07), seq 25926:27654, ack 1419, win 512, options [nop,nop,TS val 1275137978 ecr 1275137960], length 1728
2022-02-27 23:46:33.754890 IP (tos 0x0, ttl 64, id 51220, offset 0, flags [DF], proto TCP (6), length 52)
    127.0.0.1.45420 > 127.0.0.1.10250: Flags [.], cksum 0xfe28 (incorrect -> 0xf022), seq 1419, ack 27654, win 501, options [nop,nop,TS val 1275137978 ecr 1275137978], length 0
2022-02-27 23:46:33.826989 IP (tos 0x0, ttl 64, id 51442, offset 0, flags [DF], proto TCP (6), length 3538)
    127.0.0.1.10250 > 127.0.0.1.45420: Flags [P.], cksum 0x0bc7 (incorrect -> 0x5854), seq 27654:31140, ack 1419, win 512, options [nop,nop,TS val 1275138050 ecr 1275137978], length 3486
2022-02-27 23:46:33.826998 IP (tos 0x0, ttl 64, id 51221, offset 0, flags [DF], proto TCP (6), length 52)
    127.0.0.1.45420 > 127.0.0.1.10250: Flags [.], cksum 0xfe28 (incorrect -> 0xe1fb), seq 1419, ack 31140, win 494, options [nop,nop,TS val 1275138050 ecr 1275138050], length 0
2022-02-27 23:46:33.842441 IP (tos 0x0, ttl 64, id 51443, offset 0, flags [DF], proto TCP (6), length 4036)
    127.0.0.1.10250 > 127.0.0.1.45420: Flags [P.], cksum 0x0db9 (incorrect -> 0x0047), seq 31140:35124, ack 1419, win 512, options [nop,nop,TS val 1275138066 ecr 1275138050], length 3984
2022-02-27 23:46:33.842456 IP (tos 0x0, ttl 64, id 51222, offset 0, flags [DF], proto TCP (6), length 52)
    127.0.0.1.45420 > 127.0.0.1.10250: Flags [.], cksum 0xfe28 (incorrect -> 0xd24d), seq 1419, ack 35124, win 492, options [nop,nop,TS val 1275138066 ecr 1275138066], length 0
2022-02-27 23:46:33.857884 IP (tos 0x0, ttl 64, id 51444, offset 0, flags [DF], proto TCP (6), length 4036)
    127.0.0.1.10250 > 127.0.0.1.45420: Flags [P.], cksum 0x0db9 (incorrect -> 0xbbde), seq 35124:39108, ack 1419, win 512, options [nop,nop,TS val 1275138081 ecr 1275138066], length 3984
2022-02-27 23:46:33.857897 IP (tos 0x0, ttl 64, id 51223, offset 0, flags [DF], proto TCP (6), length 52)
    127.0.0.1.45420 > 127.0.0.1.10250: Flags [.], cksum 0xfe28 (incorrect -> 0xc29f), seq 1419, ack 39108, win 492, options [nop,nop,TS val 1275138081 ecr 1275138081], length 0
2022-02-27 23:46:33.883208 IP (tos 0x0, ttl 64, id 51445, offset 0, flags [DF], proto TCP (6), length 3538)
    127.0.0.1.10250 > 127.0.0.1.45420: Flags [P.], cksum 0x0bc7 (incorrect -> 0x1499), seq 39108:42594, ack 1419, win 512, options [nop,nop,TS val 1275138106 ecr 1275138081], length 3486
2022-02-27 23:46:33.883216 IP (tos 0x0, ttl 64, id 51224, offset 0, flags [DF], proto TCP (6), length 52)
    127.0.0.1.45420 > 127.0.0.1.10250: Flags [.], cksum 0xfe28 (incorrect -> 0xb4cd), seq 1419, ack 42594, win 494, options [nop,nop,TS val 1275138106 ecr 1275138106], length 0
2022-02-27 23:46:33.900545 IP (tos 0x0, ttl 64, id 51446, offset 0, flags [DF], proto TCP (6), length 1518)
    127.0.0.1.10250 > 127.0.0.1.45420: Flags [P.], cksum 0x03e3 (incorrect -> 0x47ae), seq 42594:44060, ack 1419, win 512, options [nop,nop,TS val 1275138124 ecr 1275138106], length 1466
2022-02-27 23:46:33.900561 IP (tos 0x0, ttl 64, id 51225, offset 0, flags [DF], proto TCP (6), length 52)
    127.0.0.1.45420 > 127.0.0.1.10250: Flags [.], cksum 0xfe28 (incorrect -> 0xaedd), seq 1419, ack 44060, win 512, options [nop,nop,TS val 1275138124 ecr 1275138124], length 0
2022-02-27 23:46:34.030362 IP (tos 0x0, ttl 64, id 51447, offset 0, flags [DF], proto TCP (6), length 3538)
    127.0.0.1.10250 > 127.0.0.1.45420: Flags [P.], cksum 0x0bc7 (incorrect -> 0x5230), seq 44060:47546, ack 1419, win 512, options [nop,nop,TS val 1275138253 ecr 1275138124], length 3486
2022-02-27 23:46:34.030385 IP (tos 0x0, ttl 64, id 51226, offset 0, flags [DF], proto TCP (6), length 52)
    127.0.0.1.45420 > 127.0.0.1.10250: Flags [.], cksum 0xfe28 (incorrect -> 0xa03d), seq 1419, ack 47546, win 512, options [nop,nop,TS val 1275138253 ecr 1275138253], length 0
2022-02-27 23:46:34.032451 IP (tos 0x0, ttl 64, id 51448, offset 0, flags [DF], proto TCP (6), length 4036)
    127.0.0.1.10250 > 127.0.0.1.45420: Flags [P.], cksum 0x0db9 (incorrect -> 0xbf0d), seq 47546:51530, ack 1419, win 512, options [nop,nop,TS val 1275138256 ecr 1275138253], length 3984
2022-02-27 23:46:34.074146 IP (tos 0x0, ttl 64, id 51227, offset 0, flags [DF], proto TCP (6), length 52)
    127.0.0.1.45420 > 127.0.0.1.10250: Flags [.], cksum 0xfe28 (incorrect -> 0x907e), seq 1419, ack 51530, win 512, options [nop,nop,TS val 1275138297 ecr 1275138256], length 0
2022-02-27 23:46:34.074156 IP (tos 0x0, ttl 64, id 51449, offset 0, flags [DF], proto TCP (6), length 8518)
    127.0.0.1.10250 > 127.0.0.1.45420: Flags [P.], cksum 0x1f3b (incorrect -> 0x2e2c), seq 51530:59996, ack 1419, win 512, options [nop,nop,TS val 1275138297 ecr 1275138297], length 8466
200, 4.771066427230835, 2.44211483001709