2022-02-27 22:17:19.263416 IP (tos 0x0, ttl 64, id 4490, offset 0, flags [DF], proto TCP (6), length 60)
    127.0.0.1.45274 > 127.0.0.1.10250: Flags [S], cksum 0xfe30 (incorrect -> 0x245f), seq 2829845156, win 65495, options [mss 65495,sackOK,TS val 1269783486 ecr 0,nop,wscale 7], length 0
2022-02-27 22:17:19.263430 IP (tos 0x0, ttl 64, id 0, offset 0, flags [DF], proto TCP (6), length 60)
    127.0.0.1.10250 > 127.0.0.1.45274: Flags [S.], cksum 0xfe30 (incorrect -> 0xd286), seq 996896505, ack 2829845157, win 65483, options [mss 65495,sackOK,TS val 1269783487 ecr 1269783486,nop,wscale 7], length 0
2022-02-27 22:17:19.263441 IP (tos 0x0, ttl 64, id 4491, offset 0, flags [DF], proto TCP (6), length 52)
    127.0.0.1.45274 > 127.0.0.1.10250: Flags [.], cksum 0xfe28 (incorrect -> 0xf941), seq 1, ack 1, win 512, options [nop,nop,TS val 1269783487 ecr 1269783487], length 0
2022-02-27 22:17:19.263568 IP (tos 0x0, ttl 64, id 4492, offset 0, flags [DF], proto TCP (6), length 55)
    127.0.0.1.45274 > 127.0.0.1.10250: Flags [P.], cksum 0xfe2b (incorrect -> 0xf435), seq 1:4, ack 1, win 512, options [nop,nop,TS val 1269783487 ecr 1269783487], length 3
2022-02-27 22:17:19.263585 IP (tos 0x0, ttl 64, id 37277, offset 0, flags [DF], proto TCP (6), length 52)
    127.0.0.1.10250 > 127.0.0.1.45274: Flags [.], cksum 0xfe28 (incorrect -> 0xf93e), seq 1, ack 4, win 512, options [nop,nop,TS val 1269783487 ecr 1269783487], length 0
2022-02-27 22:17:19.263617 IP (tos 0x0, ttl 64, id 37278, offset 0, flags [DF], proto TCP (6), length 54)
    127.0.0.1.10250 > 127.0.0.1.45274: Flags [P.], cksum 0xfe2a (incorrect -> 0xf434), seq 1:3, ack 4, win 512, options [nop,nop,TS val 1269783487 ecr 1269783487], length 2
2022-02-27 22:17:19.263630 IP (tos 0x0, ttl 64, id 4493, offset 0, flags [DF], proto TCP (6), length 52)
    127.0.0.1.45274 > 127.0.0.1.10250: Flags [.], cksum 0xfe28 (incorrect -> 0xf93c), seq 4, ack 3, win 512, options [nop,nop,TS val 1269783487 ecr 1269783487], length 0
2022-02-27 22:17:19.265460 IP (tos 0x0, ttl 64, id 4494, offset 0, flags [DF], proto TCP (6), length 62)
    127.0.0.1.45274 > 127.0.0.1.10250: Flags [P.], cksum 0xfe32 (incorrect -> 0x3fce), seq 4:14, ack 3, win 512, options [nop,nop,TS val 1269783488 ecr 1269783487], length 10
2022-02-27 22:17:19.265470 IP (tos 0x0, ttl 64, id 37279, offset 0, flags [DF], proto TCP (6), length 52)
    127.0.0.1.10250 > 127.0.0.1.45274: Flags [.], cksum 0xfe28 (incorrect -> 0xf92f), seq 3, ack 14, win 512, options [nop,nop,TS val 1269783489 ecr 1269783488], length 0
2022-02-27 22:17:19.537869 IP (tos 0x0, ttl 64, id 37280, offset 0, flags [DF], proto TCP (6), length 62)
    127.0.0.1.10250 > 127.0.0.1.45274: Flags [P.], cksum 0xfe32 (incorrect -> 0xf30c), seq 3:13, ack 14, win 512, options [nop,nop,TS val 1269783761 ecr 1269783488], length 10
2022-02-27 22:17:19.537881 IP (tos 0x0, ttl 64, id 4495, offset 0, flags [DF], proto TCP (6), length 52)
    127.0.0.1.45274 > 127.0.0.1.10250: Flags [.], cksum 0xfe28 (incorrect -> 0xf704), seq 14, ack 13, win 512, options [nop,nop,TS val 1269783761 ecr 1269783761], length 0
2022-02-27 22:17:19.543846 IP (tos 0x0, ttl 64, id 4496, offset 0, flags [DF], proto TCP (6), length 569)
    127.0.0.1.45274 > 127.0.0.1.10250: Flags [P.], cksum 0x002e (incorrect -> 0x80a6), seq 14:531, ack 13, win 512, options [nop,nop,TS val 1269783767 ecr 1269783761], length 517
2022-02-27 22:17:19.543857 IP (tos 0x0, ttl 64, id 37281, offset 0, flags [DF], proto TCP (6), length 52)
    127.0.0.1.10250 > 127.0.0.1.45274: Flags [.], cksum 0xfe28 (incorrect -> 0xf4f7), seq 13, ack 531, win 508, options [nop,nop,TS val 1269783767 ecr 1269783767], length 0
2022-02-27 22:17:19.812589 IP (tos 0x0, ttl 64, id 37282, offset 0, flags [DF], proto TCP (6), length 3538)
    127.0.0.1.10250 > 127.0.0.1.45274: Flags [P.], cksum 0x0bc7 (incorrect -> 0xe9c6), seq 13:3499, ack 531, win 512, options [nop,nop,TS val 1269784036 ecr 1269783767], length 3486
2022-02-27 22:17:19.812606 IP (tos 0x0, ttl 64, id 4497, offset 0, flags [DF], proto TCP (6), length 52)
    127.0.0.1.45274 > 127.0.0.1.10250: Flags [.], cksum 0xfe28 (incorrect -> 0xe54d), seq 531, ack 3499, win 494, options [nop,nop,TS val 1269784036 ecr 1269784036], length 0
2022-02-27 22:17:19.958268 IP (tos 0x0, ttl 64, id 37283, offset 0, flags [DF], proto TCP (6), length 56)
    127.0.0.1.10250 > 127.0.0.1.45274: Flags [P.], cksum 0xfe2c (incorrect -> 0x3f37), seq 3499:3503, ack 531, win 512, options [nop,nop,TS val 1269784181 ecr 1269784036], length 4
2022-02-27 22:17:19.958276 IP (tos 0x0, ttl 64, id 4498, offset 0, flags [DF], proto TCP (6), length 52)
    127.0.0.1.45274 > 127.0.0.1.10250: Flags [.], cksum 0xfe28 (incorrect -> 0xe41a), seq 531, ack 3503, win 507, options [nop,nop,TS val 1269784181 ecr 1269784181], length 0
2022-02-27 22:17:19.958762 IP (tos 0x0, ttl 64, id 4499, offset 0, flags [DF], proto TCP (6), length 116)
    127.0.0.1.45274 > 127.0.0.1.10250: Flags [P.], cksum 0xfe68 (incorrect -> 0xd0a6), seq 531:595, ack 3503, win 512, options [nop,nop,TS val 1269784182 ecr 1269784181], length 64
2022-02-27 22:17:19.958771 IP (tos 0x0, ttl 64, id 37284, offset 0, flags [DF], proto TCP (6), length 52)
    127.0.0.1.10250 > 127.0.0.1.45274: Flags [.], cksum 0xfe28 (incorrect -> 0xe3d3), seq 3503, ack 595, win 512, options [nop,nop,TS val 1269784182 ecr 1269784182], length 0
2022-02-27 22:17:19.959245 IP (tos 0x0, ttl 64, id 4500, offset 0, flags [DF], proto TCP (6), length 379)
    127.0.0.1.45274 > 127.0.0.1.10250: Flags [P.], cksum 0xff6f (incorrect -> 0xf8ce), seq 595:922, ack 3503, win 512, options [nop,nop,TS val 1269784182 ecr 1269784182], length 327
2022-02-27 22:17:19.959251 IP (tos 0x0, ttl 64, id 37285, offset 0, flags [DF], proto TCP (6), length 52)
    127.0.0.1.10250 > 127.0.0.1.45274: Flags [.], cksum 0xfe28 (incorrect -> 0xe28e), seq 3503, ack 922, win 510, options [nop,nop,TS val 1269784182 ecr 1269784182], length 0
2022-02-27 22:17:20.303839 IP (tos 0x0, ttl 64, id 37286, offset 0, flags [DF], proto TCP (6), length 226)
    127.0.0.1.10250 > 127.0.0.1.45274: Flags [P.], cksum 0xfed6 (incorrect -> 0xf1d2), seq 3503:3677, ack 922, win 512, options [nop,nop,TS val 1269784527 ecr 1269784182], length 174
2022-02-27 22:17:20.303849 IP (tos 0x0, ttl 64, id 4501, offset 0, flags [DF], proto TCP (6), length 52)
    127.0.0.1.45274 > 127.0.0.1.10250: Flags [.], cksum 0xfe28 (incorrect -> 0xdf2d), seq 922, ack 3677, win 511, options [nop,nop,TS val 1269784527 ecr 1269784527], length 0
429, 6.120797634124756, 1.7051961421966553