2022-02-27 22:08:13.694998 IP (tos 0x0, ttl 64, id 62387, offset 0, flags [DF], proto TCP (6), length 60)
    127.0.0.1.50046 > 127.0.0.1.9350: Flags [S], cksum 0xfe30 (incorrect -> 0xf7fe), seq 2527495442, win 65495, options [mss 65495,sackOK,TS val 1269237918 ecr 0,nop,wscale 7], length 0
2022-02-27 22:08:13.695020 IP (tos 0x0, ttl 64, id 0, offset 0, flags [DF], proto TCP (6), length 60)
    127.0.0.1.9350 > 127.0.0.1.50046: Flags [S.], cksum 0xfe30 (incorrect -> 0x2b5f), seq 3554387065, ack 2527495443, win 65483, options [mss 65495,sackOK,TS val 1269237918 ecr 1269237918,nop,wscale 7], length 0
2022-02-27 22:08:13.695036 IP (tos 0x0, ttl 64, id 62388, offset 0, flags [DF], proto TCP (6), length 52)
    127.0.0.1.50046 > 127.0.0.1.9350: Flags [.], cksum 0xfe28 (incorrect -> 0x521b), seq 1, ack 1, win 512, options [nop,nop,TS val 1269237918 ecr 1269237918], length 0
2022-02-27 22:08:13.695143 IP (tos 0x0, ttl 64, id 62389, offset 0, flags [DF], proto TCP (6), length 55)
    127.0.0.1.50046 > 127.0.0.1.9350: Flags [P.], cksum 0xfe2b (incorrect -> 0x4d0f), seq 1:4, ack 1, win 512, options [nop,nop,TS val 1269237918 ecr 1269237918], length 3
2022-02-27 22:08:13.695150 IP (tos 0x0, ttl 64, id 5027, offset 0, flags [DF], proto TCP (6), length 52)
    127.0.0.1.9350 > 127.0.0.1.50046: Flags [.], cksum 0xfe28 (incorrect -> 0x5218), seq 1, ack 4, win 512, options [nop,nop,TS val 1269237918 ecr 1269237918], length 0
2022-02-27 22:08:13.695243 IP (tos 0x0, ttl 64, id 5028, offset 0, flags [DF], proto TCP (6), length 54)
    127.0.0.1.9350 > 127.0.0.1.50046: Flags [P.], cksum 0xfe2a (incorrect -> 0x4d0e), seq 1:3, ack 4, win 512, options [nop,nop,TS val 1269237918 ecr 1269237918], length 2
2022-02-27 22:08:13.695251 IP (tos 0x0, ttl 64, id 62390, offset 0, flags [DF], proto TCP (6), length 52)
    127.0.0.1.50046 > 127.0.0.1.9350: Flags [.], cksum 0xfe28 (incorrect -> 0x5216), seq 4, ack 3, win 512, options [nop,nop,TS val 1269237918 ecr 1269237918], length 0
2022-02-27 22:08:13.708914 IP (tos 0x0, ttl 64, id 62391, offset 0, flags [DF], proto TCP (6), length 62)
    127.0.0.1.50046 > 127.0.0.1.9350: Flags [P.], cksum 0xfe32 (incorrect -> 0xc1f9), seq 4:14, ack 3, win 512, options [nop,nop,TS val 1269237932 ecr 1269237918], length 10
2022-02-27 22:08:13.708942 IP (tos 0x0, ttl 64, id 5029, offset 0, flags [DF], proto TCP (6), length 52)
    127.0.0.1.9350 > 127.0.0.1.50046: Flags [.], cksum 0xfe28 (incorrect -> 0x51f0), seq 3, ack 14, win 512, options [nop,nop,TS val 1269237932 ecr 1269237932], length 0
2022-02-27 22:08:13.784535 IP (tos 0x0, ttl 64, id 5030, offset 0, flags [DF], proto TCP (6), length 62)
    127.0.0.1.9350 > 127.0.0.1.50046: Flags [P.], cksum 0xfe32 (incorrect -> 0x4c91), seq 3:13, ack 14, win 512, options [nop,nop,TS val 1269238008 ecr 1269237932], length 10
2022-02-27 22:08:13.784560 IP (tos 0x0, ttl 64, id 62392, offset 0, flags [DF], proto TCP (6), length 52)
    127.0.0.1.50046 > 127.0.0.1.9350: Flags [.], cksum 0xfe28 (incorrect -> 0x514e), seq 14, ack 13, win 512, options [nop,nop,TS val 1269238008 ecr 1269238008], length 0
2022-02-27 22:08:13.790609 IP (tos 0x0, ttl 64, id 62393, offset 0, flags [DF], proto TCP (6), length 569)
    127.0.0.1.50046 > 127.0.0.1.9350: Flags [P.], cksum 0x002e (incorrect -> 0xdadd), seq 14:531, ack 13, win 512, options [nop,nop,TS val 1269238014 ecr 1269238008], length 517
2022-02-27 22:08:13.790637 IP (tos 0x0, ttl 64, id 5031, offset 0, flags [DF], proto TCP (6), length 52)
    127.0.0.1.9350 > 127.0.0.1.50046: Flags [.], cksum 0xfe28 (incorrect -> 0x4f41), seq 13, ack 531, win 508, options [nop,nop,TS val 1269238014 ecr 1269238014], length 0
2022-02-27 22:08:13.868384 IP (tos 0x0, ttl 64, id 5032, offset 0, flags [DF], proto TCP (6), length 3538)
    127.0.0.1.9350 > 127.0.0.1.50046: Flags [P.], cksum 0x0bc7 (incorrect -> 0x3f4a), seq 13:3499, ack 531, win 512, options [nop,nop,TS val 1269238091 ecr 1269238014], length 3486
2022-02-27 22:08:13.868398 IP (tos 0x0, ttl 64, id 62394, offset 0, flags [DF], proto TCP (6), length 52)
    127.0.0.1.50046 > 127.0.0.1.9350: Flags [.], cksum 0xfe28 (incorrect -> 0x4117), seq 531, ack 3499, win 494, options [nop,nop,TS val 1269238091 ecr 1269238091], length 0
2022-02-27 22:08:13.892999 IP (tos 0x0, ttl 64, id 5033, offset 0, flags [DF], proto TCP (6), length 1151)
    127.0.0.1.9350 > 127.0.0.1.50046: Flags [P.], cksum 0x0274 (incorrect -> 0x78db), seq 3499:4598, ack 531, win 512, options [nop,nop,TS val 1269238116 ecr 1269238091], length 1099
2022-02-27 22:08:13.893009 IP (tos 0x0, ttl 64, id 62395, offset 0, flags [DF], proto TCP (6), length 52)
    127.0.0.1.50046 > 127.0.0.1.9350: Flags [.], cksum 0xfe28 (incorrect -> 0x3c91), seq 531, ack 4598, win 503, options [nop,nop,TS val 1269238116 ecr 1269238116], length 0
2022-02-27 22:08:13.893431 IP (tos 0x0, ttl 64, id 62396, offset 0, flags [DF], proto TCP (6), length 132)
    127.0.0.1.50046 > 127.0.0.1.9350: Flags [P.], cksum 0xfe78 (incorrect -> 0xf0b3), seq 531:611, ack 4598, win 512, options [nop,nop,TS val 1269238116 ecr 1269238116], length 80
2022-02-27 22:08:13.893441 IP (tos 0x0, ttl 64, id 5034, offset 0, flags [DF], proto TCP (6), length 52)
    127.0.0.1.9350 > 127.0.0.1.50046: Flags [.], cksum 0xfe28 (incorrect -> 0x3c37), seq 4598, ack 611, win 512, options [nop,nop,TS val 1269238117 ecr 1269238116], length 0
2022-02-27 22:08:13.893869 IP (tos 0x0, ttl 64, id 62397, offset 0, flags [DF], proto TCP (6), length 349)
    127.0.0.1.50046 > 127.0.0.1.9350: Flags [P.], cksum 0xff51 (incorrect -> 0xdd63), seq 611:908, ack 4598, win 512, options [nop,nop,TS val 1269238117 ecr 1269238117], length 297
2022-02-27 22:08:13.893880 IP (tos 0x0, ttl 64, id 5035, offset 0, flags [DF], proto TCP (6), length 52)
    127.0.0.1.9350 > 127.0.0.1.50046: Flags [.], cksum 0xfe28 (incorrect -> 0x3b0f), seq 4598, ack 908, win 510, options [nop,nop,TS val 1269238117 ecr 1269238117], length 0
2022-02-27 22:08:13.967251 IP (tos 0x0, ttl 64, id 5036, offset 0, flags [DF], proto TCP (6), length 210)
    127.0.0.1.9350 > 127.0.0.1.50046: Flags [P.], cksum 0xfec6 (incorrect -> 0xfb15), seq 4598:4756, ack 908, win 512, options [nop,nop,TS val 1269238190 ecr 1269238117], length 158
2022-02-27 22:08:13.967277 IP (tos 0x0, ttl 64, id 62398, offset 0, flags [DF], proto TCP (6), length 52)
    127.0.0.1.50046 > 127.0.0.1.9350: Flags [.], cksum 0xfe28 (incorrect -> 0x39de), seq 908, ack 4756, win 511, options [nop,nop,TS val 1269238190 ecr 1269238190], length 0
2022-02-27 22:08:14.019378 IP (tos 0x0, ttl 64, id 5037, offset 0, flags [DF], proto TCP (6), length 3538)
    127.0.0.1.9350 > 127.0.0.1.50046: Flags [P.], cksum 0x0bc7 (incorrect -> 0x4f13), seq 4756:8242, ack 908, win 512, options [nop,nop,TS val 1269238242 ecr 1269238190], length 3486
2022-02-27 22:08:14.019402 IP (tos 0x0, ttl 64, id 62399, offset 0, flags [DF], proto TCP (6), length 52)
    127.0.0.1.50046 > 127.0.0.1.9350: Flags [.], cksum 0xfe28 (incorrect -> 0x2be9), seq 908, ack 8242, win 494, options [nop,nop,TS val 1269238242 ecr 1269238242], length 0
2022-02-27 22:08:14.032134 IP (tos 0x0, ttl 64, id 5038, offset 0, flags [DF], proto TCP (6), length 4100)
    127.0.0.1.9350 > 127.0.0.1.50046: Flags [P.], cksum 0x0df9 (incorrect -> 0xca3d), seq 8242:12290, ack 908, win 512, options [nop,nop,TS val 1269238255 ecr 1269238242], length 4048
2022-02-27 22:08:14.032144 IP (tos 0x0, ttl 64, id 62400, offset 0, flags [DF], proto TCP (6), length 52)
    127.0.0.1.50046 > 127.0.0.1.9350: Flags [.], cksum 0xfe28 (incorrect -> 0x1c01), seq 908, ack 12290, win 492, options [nop,nop,TS val 1269238255 ecr 1269238255], length 0
2022-02-27 22:08:14.032155 IP (tos 0x0, ttl 64, id 5039, offset 0, flags [DF], proto TCP (6), length 2976)
    127.0.0.1.9350 > 127.0.0.1.50046: Flags [P.], cksum 0x0995 (incorrect -> 0xe921), seq 12290:15214, ack 908, win 512, options [nop,nop,TS val 1269238255 ecr 1269238255], length 2924
2022-02-27 22:08:14.032162 IP (tos 0x0, ttl 64, id 62401, offset 0, flags [DF], proto TCP (6), length 52)
    127.0.0.1.50046 > 127.0.0.1.9350: Flags [.], cksum 0xfe28 (incorrect -> 0x10a1), seq 908, ack 15214, win 480, options [nop,nop,TS val 1269238255 ecr 1269238255], length 0
2022-02-27 22:08:14.043999 IP (tos 0x0, ttl 64, id 5040, offset 0, flags [DF], proto TCP (6), length 3474)
    127.0.0.1.9350 > 127.0.0.1.50046: Flags [P.], cksum 0x0b87 (incorrect -> 0x9e51), seq 15214:18636, ack 908, win 512, options [nop,nop,TS val 1269238267 ecr 1269238255], length 3422
2022-02-27 22:08:14.044009 IP (tos 0x0, ttl 64, id 62402, offset 0, flags [DF], proto TCP (6), length 52)
    127.0.0.1.50046 > 127.0.0.1.9350: Flags [.], cksum 0xfe28 (incorrect -> 0x031d), seq 908, ack 18636, win 494, options [nop,nop,TS val 1269238267 ecr 1269238267], length 0
2022-02-27 22:08:14.059208 IP (tos 0x0, ttl 64, id 5041, offset 0, flags [DF], proto TCP (6), length 4100)
    127.0.0.1.9350 > 127.0.0.1.50046: Flags [P.], cksum 0x0df9 (incorrect -> 0x7836), seq 18636:22684, ack 908, win 512, options [nop,nop,TS val 1269238282 ecr 1269238267], length 4048
2022-02-27 22:08:14.059221 IP (tos 0x0, ttl 64, id 62403, offset 0, flags [DF], proto TCP (6), length 52)
    127.0.0.1.50046 > 127.0.0.1.9350: Flags [.], cksum 0xfe28 (incorrect -> 0xf330), seq 908, ack 22684, win 492, options [nop,nop,TS val 1269238282 ecr 1269238282], length 0
2022-02-27 22:08:14.059232 IP (tos 0x0, ttl 64, id 5042, offset 0, flags [DF], proto TCP (6), length 984)
    127.0.0.1.9350 > 127.0.0.1.50046: Flags [P.], cksum 0x01cd (incorrect -> 0x9cd3), seq 22684:23616, ack 908, win 512, options [nop,nop,TS val 1269238282 ecr 1269238282], length 932
2022-02-27 22:08:14.059237 IP (tos 0x0, ttl 64, id 62404, offset 0, flags [DF], proto TCP (6), length 52)
    127.0.0.1.50046 > 127.0.0.1.9350: Flags [.], cksum 0xfe28 (incorrect -> 0xef90), seq 908, ack 23616, win 488, options [nop,nop,TS val 1269238282 ecr 1269238282], length 0
2022-02-27 22:08:14.068683 IP (tos 0x0, ttl 64, id 5043, offset 0, flags [DF], proto TCP (6), length 1546)
    127.0.0.1.9350 > 127.0.0.1.50046: Flags [P.], cksum 0x03ff (incorrect -> 0xb802), seq 23616:25110, ack 908, win 512, options [nop,nop,TS val 1269238292 ecr 1269238282], length 1494
2022-02-27 22:08:14.068696 IP (tos 0x0, ttl 64, id 62405, offset 0, flags [DF], proto TCP (6), length 52)
    127.0.0.1.50046 > 127.0.0.1.9350: Flags [.], cksum 0xfe28 (incorrect -> 0xe998), seq 908, ack 25110, win 502, options [nop,nop,TS val 1269238292 ecr 1269238292], length 0
2022-02-27 22:08:14.073599 IP (tos 0x0, ttl 64, id 5044, offset 0, flags [DF], proto TCP (6), length 3400)
    127.0.0.1.9350 > 127.0.0.1.50046: Flags [P.], cksum 0x0b3d (incorrect -> 0xbadf), seq 25110:28458, ack 908, win 512, options [nop,nop,TS val 1269238297 ecr 1269238292], length 3348
2022-02-27 22:08:14.073619 IP (tos 0x0, ttl 64, id 62406, offset 0, flags [DF], proto TCP (6), length 52)
    127.0.0.1.50046 > 127.0.0.1.9350: Flags [.], cksum 0xfe28 (incorrect -> 0xdc70), seq 908, ack 28458, win 512, options [nop,nop,TS val 1269238297 ecr 1269238297], length 0
2022-02-27 22:08:14.084007 IP (tos 0x0, ttl 64, id 5045, offset 0, flags [DF], proto TCP (6), length 4100)
    127.0.0.1.9350 > 127.0.0.1.50046: Flags [P.], cksum 0x0df9 (incorrect -> 0x45f1), seq 28458:32506, ack 908, win 512, options [nop,nop,TS val 1269238307 ecr 1269238297], length 4048
2022-02-27 22:08:14.126152 IP (tos 0x0, ttl 64, id 62407, offset 0, flags [DF], proto TCP (6), length 52)
    127.0.0.1.50046 > 127.0.0.1.9350: Flags [.], cksum 0xfe28 (incorrect -> 0xcc62), seq 908, ack 32506, win 512, options [nop,nop,TS val 1269238349 ecr 1269238307], length 0
2022-02-27 22:08:14.126171 IP (tos 0x0, ttl 64, id 5046, offset 0, flags [DF], proto TCP (6), length 23404)
    127.0.0.1.9350 > 127.0.0.1.50046: Flags [P.], cksum 0x5961 (incorrect -> 0x7d83), seq 32506:55858, ack 908, win 512, options [nop,nop,TS val 1269238349 ecr 1269238349], length 23352
2022-02-27 22:08:14.160762 IP (tos 0x0, ttl 64, id 5047, offset 0, flags [DF], proto TCP (6), length 32820)
    127.0.0.1.9350 > 127.0.0.1.50046: Flags [.], cksum 0x7e29 (incorrect -> 0x966b), seq 55858:88626, ack 908, win 512, options [nop,nop,TS val 1269238384 ecr 1269238349], length 32768
2022-02-27 22:08:14.160775 IP (tos 0x0, ttl 64, id 62408, offset 0, flags [DF], proto TCP (6), length 52)
    127.0.0.1.50046 > 127.0.0.1.9350: Flags [.], cksum 0xfe28 (incorrect -> 0xf161), seq 908, ack 88626, win 379, options [nop,nop,TS val 1269238384 ecr 1269238349], length 0
2022-02-27 22:08:14.160790 IP (tos 0x0, ttl 64, id 5048, offset 0, flags [DF], proto TCP (6), length 1666)
    127.0.0.1.9350 > 127.0.0.1.50046: Flags [P.], cksum 0x0477 (incorrect -> 0xa2a3), seq 88626:90240, ack 908, win 512, options [nop,nop,TS val 1269238384 ecr 1269238384], length 1614
2022-02-27 22:08:14.161545 IP (tos 0x0, ttl 64, id 62409, offset 0, flags [DF], proto TCP (6), length 52)
    127.0.0.1.50046 > 127.0.0.1.9350: Flags [.], cksum 0xfe28 (incorrect -> 0xea6a), seq 908, ack 90240, win 512, options [nop,nop,TS val 1269238385 ecr 1269238384], length 0
2022-02-27 22:08:14.169726 IP (tos 0x0, ttl 64, id 5049, offset 0, flags [DF], proto TCP (6), length 3538)
    127.0.0.1.9350 > 127.0.0.1.50046: Flags [P.], cksum 0x0bc7 (incorrect -> 0x051f), seq 90240:93726, ack 908, win 512, options [nop,nop,TS val 1269238393 ecr 1269238385], length 3486
2022-02-27 22:08:14.169749 IP (tos 0x0, ttl 64, id 62410, offset 0, flags [DF], proto TCP (6), length 52)
    127.0.0.1.50046 > 127.0.0.1.9350: Flags [.], cksum 0xfe28 (incorrect -> 0xdcbb), seq 908, ack 93726, win 512, options [nop,nop,TS val 1269238393 ecr 1269238393], length 0
2022-02-27 22:08:14.169844 IP (tos 0x0, ttl 64, id 5050, offset 0, flags [DF], proto TCP (6), length 3538)
    127.0.0.1.9350 > 127.0.0.1.50046: Flags [P.], cksum 0x0bc7 (incorrect -> 0xd6b2), seq 93726:97212, ack 908, win 512, options [nop,nop,TS val 1269238393 ecr 1269238393], length 3486
2022-02-27 22:08:14.210155 IP (tos 0x0, ttl 64, id 62411, offset 0, flags [DF], proto TCP (6), length 52)
    127.0.0.1.50046 > 127.0.0.1.9350: Flags [.], cksum 0xfe28 (incorrect -> 0xcef5), seq 908, ack 97212, win 512, options [nop,nop,TS val 1269238433 ecr 1269238393], length 0
2022-02-27 22:08:14.210174 IP (tos 0x0, ttl 64, id 5051, offset 0, flags [DF], proto TCP (6), length 23680)
    127.0.0.1.9350 > 127.0.0.1.50046: Flags [P.], cksum 0x5a75 (incorrect -> 0xc96f), seq 97212:120840, ack 908, win 512, options [nop,nop,TS val 1269238433 ecr 1269238433], length 23628
2022-02-27 22:08:14.254198 IP (tos 0x0, ttl 64, id 62412, offset 0, flags [DF], proto TCP (6), length 52)
    127.0.0.1.50046 > 127.0.0.1.9350: Flags [.], cksum 0xfe28 (incorrect -> 0x7255), seq 908, ack 120840, win 512, options [nop,nop,TS val 1269238477 ecr 1269238433], length 0
200, 3.5881147384643555, 0.5661487579345703