2022-02-27 23:01:20.563879 IP (tos 0x0, ttl 64, id 14064, offset 0, flags [DF], proto TCP (6), length 60)
    127.0.0.1.53190 > 127.0.0.1.9250: Flags [S], cksum 0xfe30 (incorrect -> 0xa1df), seq 2838174691, win 65495, options [mss 65495,sackOK,TS val 1272424787 ecr 0,nop,wscale 7], length 0
2022-02-27 23:01:20.563890 IP (tos 0x0, ttl 64, id 0, offset 0, flags [DF], proto TCP (6), length 60)
    127.0.0.1.9250 > 127.0.0.1.53190: Flags [S.], cksum 0xfe30 (incorrect -> 0xc813), seq 1142202503, ack 2838174692, win 65483, options [mss 65495,sackOK,TS val 1272424787 ecr 1272424787,nop,wscale 7], length 0
2022-02-27 23:01:20.563899 IP (tos 0x0, ttl 64, id 14065, offset 0, flags [DF], proto TCP (6), length 52)
    127.0.0.1.53190 > 127.0.0.1.9250: Flags [.], cksum 0xfe28 (incorrect -> 0xeecf), seq 1, ack 1, win 512, options [nop,nop,TS val 1272424787 ecr 1272424787], length 0
2022-02-27 23:01:20.564031 IP (tos 0x0, ttl 64, id 14066, offset 0, flags [DF], proto TCP (6), length 55)
    127.0.0.1.53190 > 127.0.0.1.9250: Flags [P.], cksum 0xfe2b (incorrect -> 0xe9c3), seq 1:4, ack 1, win 512, options [nop,nop,TS val 1272424787 ecr 1272424787], length 3
2022-02-27 23:01:20.564047 IP (tos 0x0, ttl 64, id 6859, offset 0, flags [DF], proto TCP (6), length 52)
    127.0.0.1.9250 > 127.0.0.1.53190: Flags [.], cksum 0xfe28 (incorrect -> 0xeecc), seq 1, ack 4, win 512, options [nop,nop,TS val 1272424787 ecr 1272424787], length 0
2022-02-27 23:01:20.564124 IP (tos 0x0, ttl 64, id 6860, offset 0, flags [DF], proto TCP (6), length 54)
    127.0.0.1.9250 > 127.0.0.1.53190: Flags [P.], cksum 0xfe2a (incorrect -> 0xe9c2), seq 1:3, ack 4, win 512, options [nop,nop,TS val 1272424787 ecr 1272424787], length 2
2022-02-27 23:01:20.564149 IP (tos 0x0, ttl 64, id 14067, offset 0, flags [DF], proto TCP (6), length 52)
    127.0.0.1.53190 > 127.0.0.1.9250: Flags [.], cksum 0xfe28 (incorrect -> 0xeeca), seq 4, ack 3, win 512, options [nop,nop,TS val 1272424787 ecr 1272424787], length 0
2022-02-27 23:01:20.566110 IP (tos 0x0, ttl 64, id 14068, offset 0, flags [DF], proto TCP (6), length 62)
    127.0.0.1.53190 > 127.0.0.1.9250: Flags [P.], cksum 0xfe32 (incorrect -> 0xb080), seq 4:14, ack 3, win 512, options [nop,nop,TS val 1272424789 ecr 1272424787], length 10
2022-02-27 23:01:20.566153 IP (tos 0x0, ttl 64, id 6861, offset 0, flags [DF], proto TCP (6), length 52)
    127.0.0.1.9250 > 127.0.0.1.53190: Flags [.], cksum 0xfe28 (incorrect -> 0xeebc), seq 3, ack 14, win 512, options [nop,nop,TS val 1272424789 ecr 1272424789], length 0
200, 5.024412631988525, 1.170492172241211