2022-02-27 23:53:39.531444 IP (tos 0x0, ttl 64, id 50824, offset 0, flags [DF], proto TCP (6), length 60)
    127.0.0.1.45922 > 127.0.0.1.11750: Flags [S], cksum 0xfe30 (incorrect -> 0xb2fe), seq 3185386219, win 65495, options [mss 65495,sackOK,TS val 1275563754 ecr 0,nop,wscale 7], length 0
2022-02-27 23:53:39.531458 IP (tos 0x0, ttl 64, id 0, offset 0, flags [DF], proto TCP (6), length 60)
    127.0.0.1.11750 > 127.0.0.1.45922: Flags [S.], cksum 0xfe30 (incorrect -> 0xff3f), seq 3268417014, ack 3185386220, win 65483, options [mss 65495,sackOK,TS val 1275563755 ecr 1275563754,nop,wscale 7], length 0
2022-02-27 23:53:39.531470 IP (tos 0x0, ttl 64, id 50825, offset 0, flags [DF], proto TCP (6), length 52)
    127.0.0.1.45922 > 127.0.0.1.11750: Flags [.], cksum 0xfe28 (incorrect -> 0x25fb), seq 1, ack 1, win 512, options [nop,nop,TS val 1275563755 ecr 1275563755], length 0
2022-02-27 23:53:39.531654 IP (tos 0x0, ttl 64, id 50826, offset 0, flags [DF], proto TCP (6), length 55)
    127.0.0.1.45922 > 127.0.0.1.11750: Flags [P.], cksum 0xfe2b (incorrect -> 0x20ef), seq 1:4, ack 1, win 512, options [nop,nop,TS val 1275563755 ecr 1275563755], length 3
2022-02-27 23:53:39.531663 IP (tos 0x0, ttl 64, id 60352, offset 0, flags [DF], proto TCP (6), length 52)
    127.0.0.1.11750 > 127.0.0.1.45922: Flags [.], cksum 0xfe28 (incorrect -> 0x25f8), seq 1, ack 4, win 512, options [nop,nop,TS val 1275563755 ecr 1275563755], length 0
2022-02-27 23:53:39.531690 IP (tos 0x0, ttl 64, id 60353, offset 0, flags [DF], proto TCP (6), length 54)
    127.0.0.1.11750 > 127.0.0.1.45922: Flags [P.], cksum 0xfe2a (incorrect -> 0x20ee), seq 1:3, ack 4, win 512, options [nop,nop,TS val 1275563755 ecr 1275563755], length 2
2022-02-27 23:53:39.531700 IP (tos 0x0, ttl 64, id 50827, offset 0, flags [DF], proto TCP (6), length 52)
    127.0.0.1.45922 > 127.0.0.1.11750: Flags [.], cksum 0xfe28 (incorrect -> 0x25f6), seq 4, ack 3, win 512, options [nop,nop,TS val 1275563755 ecr 1275563755], length 0
2022-02-27 23:53:39.532837 IP (tos 0x0, ttl 64, id 50828, offset 0, flags [DF], proto TCP (6), length 62)
    127.0.0.1.45922 > 127.0.0.1.11750: Flags [P.], cksum 0xfe32 (incorrect -> 0x149f), seq 4:14, ack 3, win 512, options [nop,nop,TS val 1275563756 ecr 1275563755], length 10
2022-02-27 23:53:39.532856 IP (tos 0x0, ttl 64, id 60354, offset 0, flags [DF], proto TCP (6), length 52)
    127.0.0.1.11750 > 127.0.0.1.45922: Flags [.], cksum 0xfe28 (incorrect -> 0x25ea), seq 3, ack 14, win 512, options [nop,nop,TS val 1275563756 ecr 1275563756], length 0
2022-02-27 23:53:39.575103 IP (tos 0x0, ttl 64, id 60355, offset 0, flags [DF], proto TCP (6), length 62)
    127.0.0.1.11750 > 127.0.0.1.45922: Flags [P.], cksum 0xfe32 (incorrect -> 0x20ad), seq 3:13, ack 14, win 512, options [nop,nop,TS val 1275563798 ecr 1275563756], length 10
2022-02-27 23:53:39.575118 IP (tos 0x0, ttl 64, id 50829, offset 0, flags [DF], proto TCP (6), length 52)
    127.0.0.1.45922 > 127.0.0.1.11750: Flags [.], cksum 0xfe28 (incorrect -> 0x258c), seq 14, ack 13, win 512, options [nop,nop,TS val 1275563798 ecr 1275563798], length 0
2022-02-27 23:53:39.580985 IP (tos 0x0, ttl 64, id 50830, offset 0, flags [DF], proto TCP (6), length 569)
    127.0.0.1.45922 > 127.0.0.1.11750: Flags [P.], cksum 0x002e (incorrect -> 0x4bed), seq 14:531, ack 13, win 512, options [nop,nop,TS val 1275563804 ecr 1275563798], length 517
2022-02-27 23:53:39.581002 IP (tos 0x0, ttl 64, id 60356, offset 0, flags [DF], proto TCP (6), length 52)
    127.0.0.1.11750 > 127.0.0.1.45922: Flags [.], cksum 0xfe28 (incorrect -> 0x237f), seq 13, ack 531, win 508, options [nop,nop,TS val 1275563804 ecr 1275563804], length 0
2022-02-27 23:53:39.623962 IP (tos 0x0, ttl 64, id 60357, offset 0, flags [DF], proto TCP (6), length 3499)
    127.0.0.1.11750 > 127.0.0.1.45922: Flags [P.], cksum 0x0ba0 (incorrect -> 0x423b), seq 13:3460, ack 531, win 512, options [nop,nop,TS val 1275563847 ecr 1275563804], length 3447
2022-02-27 23:53:39.623977 IP (tos 0x0, ttl 64, id 50831, offset 0, flags [DF], proto TCP (6), length 52)
    127.0.0.1.45922 > 127.0.0.1.11750: Flags [.], cksum 0xfe28 (incorrect -> 0x15c0), seq 531, ack 3460, win 494, options [nop,nop,TS val 1275563847 ecr 1275563847], length 0
2022-02-27 23:53:39.625325 IP (tos 0x0, ttl 64, id 50832, offset 0, flags [DF], proto TCP (6), length 132)
    127.0.0.1.45922 > 127.0.0.1.11750: Flags [P.], cksum 0xfe78 (incorrect -> 0x4403), seq 531:611, ack 3460, win 512, options [nop,nop,TS val 1275563848 ecr 1275563847], length 80
2022-02-27 23:53:39.625345 IP (tos 0x0, ttl 64, id 60358, offset 0, flags [DF], proto TCP (6), length 52)
    127.0.0.1.11750 > 127.0.0.1.45922: Flags [.], cksum 0xfe28 (incorrect -> 0x155c), seq 3460, ack 611, win 512, options [nop,nop,TS val 1275563848 ecr 1275563848], length 0
2022-02-27 23:53:39.625716 IP (tos 0x0, ttl 64, id 50833, offset 0, flags [DF], proto TCP (6), length 373)
    127.0.0.1.45922 > 127.0.0.1.11750: Flags [P.], cksum 0xff69 (incorrect -> 0x39f9), seq 611:932, ack 3460, win 512, options [nop,nop,TS val 1275563849 ecr 1275563848], length 321
2022-02-27 23:53:39.625732 IP (tos 0x0, ttl 64, id 60359, offset 0, flags [DF], proto TCP (6), length 52)
    127.0.0.1.11750 > 127.0.0.1.45922: Flags [.], cksum 0xfe28 (incorrect -> 0x141b), seq 3460, ack 932, win 510, options [nop,nop,TS val 1275563849 ecr 1275563849], length 0
200, 4.888145685195923, 0.21775031089782715