2022-02-27 23:59:04.422801 IP (tos 0x0, ttl 64, id 58546, offset 0, flags [DF], proto TCP (6), length 60)
    127.0.0.1.57996 > 127.0.0.1.9850: Flags [S], cksum 0xfe30 (incorrect -> 0xa6f1), seq 3915245208, win 65495, options [mss 65495,sackOK,TS val 1275888646 ecr 0,nop,wscale 7], length 0
2022-02-27 23:59:04.422811 IP (tos 0x0, ttl 64, id 0, offset 0, flags [DF], proto TCP (6), length 60)
    127.0.0.1.9850 > 127.0.0.1.57996: Flags [S.], cksum 0xfe30 (incorrect -> 0xcb9e), seq 2437708270, ack 3915245209, win 65483, options [mss 65495,sackOK,TS val 1275888646 ecr 1275888646,nop,wscale 7], length 0
2022-02-27 23:59:04.422821 IP (tos 0x0, ttl 64, id 58547, offset 0, flags [DF], proto TCP (6), length 52)
    127.0.0.1.57996 > 127.0.0.1.9850: Flags [.], cksum 0xfe28 (incorrect -> 0xf25a), seq 1, ack 1, win 512, options [nop,nop,TS val 1275888646 ecr 1275888646], length 0
2022-02-27 23:59:04.422933 IP (tos 0x0, ttl 64, id 58548, offset 0, flags [DF], proto TCP (6), length 55)
    127.0.0.1.57996 > 127.0.0.1.9850: Flags [P.], cksum 0xfe2b (incorrect -> 0xed4e), seq 1:4, ack 1, win 512, options [nop,nop,TS val 1275888646 ecr 1275888646], length 3
2022-02-27 23:59:04.422937 IP (tos 0x0, ttl 64, id 8114, offset 0, flags [DF], proto TCP (6), length 52)
    127.0.0.1.9850 > 127.0.0.1.57996: Flags [.], cksum 0xfe28 (incorrect -> 0xf257), seq 1, ack 4, win 512, options [nop,nop,TS val 1275888646 ecr 1275888646], length 0
2022-02-27 23:59:04.423017 IP (tos 0x0, ttl 64, id 8115, offset 0, flags [DF], proto TCP (6), length 54)
    127.0.0.1.9850 > 127.0.0.1.57996: Flags [P.], cksum 0xfe2a (incorrect -> 0xed4d), seq 1:3, ack 4, win 512, options [nop,nop,TS val 1275888646 ecr 1275888646], length 2
2022-02-27 23:59:04.423022 IP (tos 0x0, ttl 64, id 58549, offset 0, flags [DF], proto TCP (6), length 52)
    127.0.0.1.57996 > 127.0.0.1.9850: Flags [.], cksum 0xfe28 (incorrect -> 0xf255), seq 4, ack 3, win 512, options [nop,nop,TS val 1275888646 ecr 1275888646], length 0
2022-02-27 23:59:04.424740 IP (tos 0x0, ttl 64, id 58550, offset 0, flags [DF], proto TCP (6), length 62)
    127.0.0.1.57996 > 127.0.0.1.9850: Flags [P.], cksum 0xfe32 (incorrect -> 0xb40b), seq 4:14, ack 3, win 512, options [nop,nop,TS val 1275888648 ecr 1275888646], length 10
2022-02-27 23:59:04.424748 IP (tos 0x0, ttl 64, id 8116, offset 0, flags [DF], proto TCP (6), length 52)
    127.0.0.1.9850 > 127.0.0.1.57996: Flags [.], cksum 0xfe28 (incorrect -> 0xf247), seq 3, ack 14, win 512, options [nop,nop,TS val 1275888648 ecr 1275888648], length 0
2022-02-27 23:59:04.546636 IP (tos 0x0, ttl 64, id 8117, offset 0, flags [DF], proto TCP (6), length 62)
    127.0.0.1.9850 > 127.0.0.1.57996: Flags [P.], cksum 0xfe32 (incorrect -> 0xecba), seq 3:13, ack 14, win 512, options [nop,nop,TS val 1275888770 ecr 1275888648], length 10
2022-02-27 23:59:04.546646 IP (tos 0x0, ttl 64, id 58551, offset 0, flags [DF], proto TCP (6), length 52)
    127.0.0.1.57996 > 127.0.0.1.9850: Flags [.], cksum 0xfe28 (incorrect -> 0xf149), seq 14, ack 13, win 512, options [nop,nop,TS val 1275888770 ecr 1275888770], length 0
200, 32.12677478790283, 0.8643472194671631