2022-02-27 23:28:11.334071 IP (tos 0x0, ttl 64, id 52466, offset 0, flags [DF], proto TCP (6), length 60)
    127.0.0.1.37962 > 127.0.0.1.11250: Flags [S], cksum 0xfe30 (incorrect -> 0x113e), seq 28636029, win 65495, options [mss 65495,sackOK,TS val 1274035557 ecr 0,nop,wscale 7], length 0
2022-02-27 23:28:11.334086 IP (tos 0x0, ttl 64, id 0, offset 0, flags [DF], proto TCP (6), length 60)
    127.0.0.1.11250 > 127.0.0.1.37962: Flags [S.], cksum 0xfe30 (incorrect -> 0x6e40), seq 276498728, ack 28636030, win 65483, options [mss 65495,sackOK,TS val 1274035557 ecr 1274035557,nop,wscale 7], length 0
2022-02-27 23:28:11.334096 IP (tos 0x0, ttl 64, id 52467, offset 0, flags [DF], proto TCP (6), length 52)
    127.0.0.1.37962 > 127.0.0.1.11250: Flags [.], cksum 0xfe28 (incorrect -> 0x94fc), seq 1, ack 1, win 512, options [nop,nop,TS val 1274035557 ecr 1274035557], length 0
2022-02-27 23:28:11.334303 IP (tos 0x0, ttl 64, id 52468, offset 0, flags [DF], proto TCP (6), length 55)
    127.0.0.1.37962 > 127.0.0.1.11250: Flags [P.], cksum 0xfe2b (incorrect -> 0x8ff0), seq 1:4, ack 1, win 512, options [nop,nop,TS val 1274035557 ecr 1274035557], length 3
2022-02-27 23:28:11.334313 IP (tos 0x0, ttl 64, id 21770, offset 0, flags [DF], proto TCP (6), length 52)
    127.0.0.1.11250 > 127.0.0.1.37962: Flags [.], cksum 0xfe28 (incorrect -> 0x94f9), seq 1, ack 4, win 512, options [nop,nop,TS val 1274035557 ecr 1274035557], length 0
2022-02-27 23:28:11.334338 IP (tos 0x0, ttl 64, id 21771, offset 0, flags [DF], proto TCP (6), length 54)
    127.0.0.1.11250 > 127.0.0.1.37962: Flags [P.], cksum 0xfe2a (incorrect -> 0x8fef), seq 1:3, ack 4, win 512, options [nop,nop,TS val 1274035557 ecr 1274035557], length 2
2022-02-27 23:28:11.334348 IP (tos 0x0, ttl 64, id 52469, offset 0, flags [DF], proto TCP (6), length 52)
    127.0.0.1.37962 > 127.0.0.1.11250: Flags [.], cksum 0xfe28 (incorrect -> 0x94f7), seq 4, ack 3, win 512, options [nop,nop,TS val 1274035557 ecr 1274035557], length 0
2022-02-27 23:28:11.377690 IP (tos 0x0, ttl 64, id 52470, offset 0, flags [DF], proto TCP (6), length 62)
    127.0.0.1.37962 > 127.0.0.1.11250: Flags [P.], cksum 0xfe32 (incorrect -> 0x4e71), seq 4:14, ack 3, win 512, options [nop,nop,TS val 1274035601 ecr 1274035557], length 10
2022-02-27 23:28:11.377713 IP (tos 0x0, ttl 64, id 21772, offset 0, flags [DF], proto TCP (6), length 52)
    127.0.0.1.11250 > 127.0.0.1.37962: Flags [.], cksum 0xfe28 (incorrect -> 0x9495), seq 3, ack 14, win 512, options [nop,nop,TS val 1274035601 ecr 1274035601], length 0
2022-02-27 23:30:01.639817 IP (tos 0x0, ttl 64, id 21773, offset 0, flags [DF], proto TCP (6), length 62)
    127.0.0.1.11250 > 127.0.0.1.37962: Flags [P.], cksum 0xfe32 (incorrect -> 0xe0ca), seq 3:13, ack 14, win 512, options [nop,nop,TS val 1274145863 ecr 1274035601], length 10
2022-02-27 23:30:01.639831 IP (tos 0x0, ttl 64, id 52471, offset 0, flags [DF], proto TCP (6), length 52)
    127.0.0.1.37962 > 127.0.0.1.11250: Flags [.], cksum 0xfe28 (incorrect -> 0x371c), seq 14, ack 13, win 512, options [nop,nop,TS val 1274145863 ecr 1274145863], length 0
2022-02-27 23:30:01.645834 IP (tos 0x0, ttl 64, id 52472, offset 0, flags [DF], proto TCP (6), length 569)
    127.0.0.1.37962 > 127.0.0.1.11250: Flags [P.], cksum 0x002e (incorrect -> 0xad49), seq 14:531, ack 13, win 512, options [nop,nop,TS val 1274145869 ecr 1274145863], length 517
2022-02-27 23:30:01.645853 IP (tos 0x0, ttl 64, id 21774, offset 0, flags [DF], proto TCP (6), length 52)
    127.0.0.1.11250 > 127.0.0.1.37962: Flags [.], cksum 0xfe28 (incorrect -> 0x350f), seq 13, ack 531, win 508, options [nop,nop,TS val 1274145869 ecr 1274145869], length 0
2022-02-27 23:30:01.783408 IP (tos 0x0, ttl 64, id 21775, offset 0, flags [DF], proto TCP (6), length 3538)
    127.0.0.1.11250 > 127.0.0.1.37962: Flags [P.], cksum 0x0bc7 (incorrect -> 0xd097), seq 13:3499, ack 531, win 512, options [nop,nop,TS val 1274146006 ecr 1274145869], length 3486
2022-02-27 23:30:01.783413 IP (tos 0x0, ttl 64, id 52473, offset 0, flags [DF], proto TCP (6), length 52)
    127.0.0.1.37962 > 127.0.0.1.11250: Flags [.], cksum 0xfe28 (incorrect -> 0x266d), seq 531, ack 3499, win 494, options [nop,nop,TS val 1274146006 ecr 1274146006], length 0
2022-02-27 23:30:01.848640 IP (tos 0x0, ttl 64, id 21776, offset 0, flags [DF], proto TCP (6), length 636)
    127.0.0.1.11250 > 127.0.0.1.37962: Flags [P.], cksum 0x0071 (incorrect -> 0x8fb2), seq 3499:4083, ack 531, win 512, options [nop,nop,TS val 1274146072 ecr 1274146006], length 584
2022-02-27 23:30:01.848644 IP (tos 0x0, ttl 64, id 52474, offset 0, flags [DF], proto TCP (6), length 52)
    127.0.0.1.37962 > 127.0.0.1.11250: Flags [.], cksum 0xfe28 (incorrect -> 0x2396), seq 531, ack 4083, win 505, options [nop,nop,TS val 1274146072 ecr 1274146072], length 0
2022-02-27 23:30:01.849084 IP (tos 0x0, ttl 64, id 52475, offset 0, flags [DF], proto TCP (6), length 132)
    127.0.0.1.37962 > 127.0.0.1.11250: Flags [P.], cksum 0xfe78 (incorrect -> 0xd6f5), seq 531:611, ack 4083, win 512, options [nop,nop,TS val 1274146072 ecr 1274146072], length 80
2022-02-27 23:30:01.849408 IP (tos 0x0, ttl 64, id 52476, offset 0, flags [DF], proto TCP (6), length 407)
    127.0.0.1.37962 > 127.0.0.1.11250: Flags [P.], cksum 0xff8b (incorrect -> 0xed2b), seq 611:966, ack 4083, win 512, options [nop,nop,TS val 1274146072 ecr 1274146072], length 355
2022-02-27 23:30:01.849507 IP (tos 0x0, ttl 64, id 21777, offset 0, flags [DF], proto TCP (6), length 52)
    127.0.0.1.11250 > 127.0.0.1.37962: Flags [.], cksum 0xfe28 (incorrect -> 0x233e), seq 4083, ack 611, win 512, options [nop,nop,TS val 1274146073 ecr 1274146072], length 0
2022-02-27 23:30:01.849511 IP (tos 0x0, ttl 64, id 21778, offset 0, flags [DF], proto TCP (6), length 52)
    127.0.0.1.11250 > 127.0.0.1.37962: Flags [.], cksum 0xfe28 (incorrect -> 0x21dd), seq 4083, ack 966, win 510, options [nop,nop,TS val 1274146073 ecr 1274146072], length 0
2022-02-27 23:30:02.006960 IP (tos 0x0, ttl 64, id 21779, offset 0, flags [DF], proto TCP (6), length 594)
    127.0.0.1.11250 > 127.0.0.1.37962: Flags [P.], cksum 0x0047 (incorrect -> 0x9951), seq 4083:4625, ack 966, win 512, options [nop,nop,TS val 1274146230 ecr 1274146072], length 542
2022-02-27 23:30:02.006965 IP (tos 0x0, ttl 64, id 52477, offset 0, flags [DF], proto TCP (6), length 52)
    127.0.0.1.37962 > 127.0.0.1.11250: Flags [.], cksum 0xfe28 (incorrect -> 0x1e86), seq 966, ack 4625, win 508, options [nop,nop,TS val 1274146230 ecr 1274146230], length 0
2022-02-27 23:30:02.035687 IP (tos 0x0, ttl 64, id 21780, offset 0, flags [DF], proto TCP (6), length 476)
    127.0.0.1.11250 > 127.0.0.1.37962: Flags [P.], cksum 0xffd0 (incorrect -> 0xf884), seq 4625:5049, ack 966, win 512, options [nop,nop,TS val 1274146259 ecr 1274146230], length 424
2022-02-27 23:30:02.035698 IP (tos 0x0, ttl 64, id 52478, offset 0, flags [DF], proto TCP (6), length 52)
    127.0.0.1.37962 > 127.0.0.1.11250: Flags [.], cksum 0xfe28 (incorrect -> 0x1ca6), seq 966, ack 5049, win 506, options [nop,nop,TS val 1274146259 ecr 1274146259], length 0
2022-02-27 23:30:02.038337 IP (tos 0x0, ttl 64, id 40413, offset 0, flags [DF], proto TCP (6), length 60)
    127.0.0.1.37966 > 127.0.0.1.11250: Flags [S], cksum 0xfe30 (incorrect -> 0x38b0), seq 3941413468, win 65495, options [mss 65495,sackOK,TS val 1274146261 ecr 0,nop,wscale 7], length 0
2022-02-27 23:30:02.038354 IP (tos 0x0, ttl 64, id 0, offset 0, flags [DF], proto TCP (6), length 60)
    127.0.0.1.11250 > 127.0.0.1.37966: Flags [S.], cksum 0xfe30 (incorrect -> 0x0505), seq 3809089236, ack 3941413469, win 65483, options [mss 65495,sackOK,TS val 1274146261 ecr 1274146261,nop,wscale 7], length 0
2022-02-27 23:30:02.038365 IP (tos 0x0, ttl 64, id 40414, offset 0, flags [DF], proto TCP (6), length 52)
    127.0.0.1.37966 > 127.0.0.1.11250: Flags [.], cksum 0xfe28 (incorrect -> 0x2bc1), seq 1, ack 1, win 512, options [nop,nop,TS val 1274146261 ecr 1274146261], length 0
2022-02-27 23:30:02.038448 IP (tos 0x0, ttl 64, id 40415, offset 0, flags [DF], proto TCP (6), length 55)
    127.0.0.1.37966 > 127.0.0.1.11250: Flags [P.], cksum 0xfe2b (incorrect -> 0x26b4), seq 1:4, ack 1, win 512, options [nop,nop,TS val 1274146262 ecr 1274146261], length 3
2022-02-27 23:30:02.038463 IP (tos 0x0, ttl 64, id 43724, offset 0, flags [DF], proto TCP (6), length 52)
    127.0.0.1.11250 > 127.0.0.1.37966: Flags [.], cksum 0xfe28 (incorrect -> 0x2bbc), seq 1, ack 4, win 512, options [nop,nop,TS val 1274146262 ecr 1274146262], length 0
2022-02-27 23:30:02.038491 IP (tos 0x0, ttl 64, id 43725, offset 0, flags [DF], proto TCP (6), length 54)
    127.0.0.1.11250 > 127.0.0.1.37966: Flags [P.], cksum 0xfe2a (incorrect -> 0x26b2), seq 1:3, ack 4, win 512, options [nop,nop,TS val 1274146262 ecr 1274146262], length 2
2022-02-27 23:30:02.038500 IP (tos 0x0, ttl 64, id 40416, offset 0, flags [DF], proto TCP (6), length 52)
    127.0.0.1.37966 > 127.0.0.1.11250: Flags [.], cksum 0xfe28 (incorrect -> 0x2bba), seq 4, ack 3, win 512, options [nop,nop,TS val 1274146262 ecr 1274146262], length 0
200, 3.963951826095581, 111.57971954345703