2022-02-27 22:03:26.861982 IP (tos 0x0, ttl 64, id 6189, offset 0, flags [DF], proto TCP (6), length 60)
    127.0.0.1.41310 > 127.0.0.1.10050: Flags [S], cksum 0xfe30 (incorrect -> 0x3ebd), seq 3619126556, win 65495, options [mss 65495,sackOK,TS val 1268951085 ecr 0,nop,wscale 7], length 0
2022-02-27 22:03:26.861991 IP (tos 0x0, ttl 64, id 0, offset 0, flags [DF], proto TCP (6), length 60)
    127.0.0.1.10050 > 127.0.0.1.41310: Flags [S.], cksum 0xfe30 (incorrect -> 0x4f55), seq 1395697762, ack 3619126557, win 65483, options [mss 65495,sackOK,TS val 1268951085 ecr 1268951085,nop,wscale 7], length 0
2022-02-27 22:03:26.862000 IP (tos 0x0, ttl 64, id 6190, offset 0, flags [DF], proto TCP (6), length 52)
    127.0.0.1.41310 > 127.0.0.1.10050: Flags [.], cksum 0xfe28 (incorrect -> 0x7611), seq 1, ack 1, win 512, options [nop,nop,TS val 1268951085 ecr 1268951085], length 0
2022-02-27 22:03:26.862096 IP (tos 0x0, ttl 64, id 6191, offset 0, flags [DF], proto TCP (6), length 55)
    127.0.0.1.41310 > 127.0.0.1.10050: Flags [P.], cksum 0xfe2b (incorrect -> 0x7105), seq 1:4, ack 1, win 512, options [nop,nop,TS val 1268951085 ecr 1268951085], length 3
2022-02-27 22:03:26.862101 IP (tos 0x0, ttl 64, id 30647, offset 0, flags [DF], proto TCP (6), length 52)
    127.0.0.1.10050 > 127.0.0.1.41310: Flags [.], cksum 0xfe28 (incorrect -> 0x760e), seq 1, ack 4, win 512, options [nop,nop,TS val 1268951085 ecr 1268951085], length 0
2022-02-27 22:03:26.862202 IP (tos 0x0, ttl 64, id 30648, offset 0, flags [DF], proto TCP (6), length 54)
    127.0.0.1.10050 > 127.0.0.1.41310: Flags [P.], cksum 0xfe2a (incorrect -> 0x7104), seq 1:3, ack 4, win 512, options [nop,nop,TS val 1268951085 ecr 1268951085], length 2
2022-02-27 22:03:26.862210 IP (tos 0x0, ttl 64, id 6192, offset 0, flags [DF], proto TCP (6), length 52)
    127.0.0.1.41310 > 127.0.0.1.10050: Flags [.], cksum 0xfe28 (incorrect -> 0x760c), seq 4, ack 3, win 512, options [nop,nop,TS val 1268951085 ecr 1268951085], length 0
2022-02-27 22:03:26.863350 IP (tos 0x0, ttl 64, id 6193, offset 0, flags [DF], proto TCP (6), length 62)
    127.0.0.1.41310 > 127.0.0.1.10050: Flags [P.], cksum 0xfe32 (incorrect -> 0x9ef1), seq 4:14, ack 3, win 512, options [nop,nop,TS val 1268951086 ecr 1268951085], length 10
2022-02-27 22:03:26.863360 IP (tos 0x0, ttl 64, id 30649, offset 0, flags [DF], proto TCP (6), length 52)
    127.0.0.1.10050 > 127.0.0.1.41310: Flags [.], cksum 0xfe28 (incorrect -> 0x7600), seq 3, ack 14, win 512, options [nop,nop,TS val 1268951086 ecr 1268951086], length 0
200, 4.870602369308472, 0.9667935371398926