2022-02-28 08:43:57.673503 IP (tos 0x0, ttl 64, id 1665, offset 0, flags [DF], proto TCP (6), length 60)
    127.0.0.1.37810 > 127.0.0.1.9650: Flags [S], cksum 0xfe30 (incorrect -> 0xea51), seq 1725490940, win 65495, options [mss 65495,sackOK,TS val 1307381897 ecr 0,nop,wscale 7], length 0
2022-02-28 08:43:57.673514 IP (tos 0x0, ttl 64, id 0, offset 0, flags [DF], proto TCP (6), length 60)
    127.0.0.1.9650 > 127.0.0.1.37810: Flags [S.], cksum 0xfe30 (incorrect -> 0x7987), seq 1328202532, ack 1725490941, win 65483, options [mss 65495,sackOK,TS val 1307381897 ecr 1307381897,nop,wscale 7], length 0
2022-02-28 08:43:57.673524 IP (tos 0x0, ttl 64, id 1666, offset 0, flags [DF], proto TCP (6), length 52)
    127.0.0.1.37810 > 127.0.0.1.9650: Flags [.], cksum 0xfe28 (incorrect -> 0xa043), seq 1, ack 1, win 512, options [nop,nop,TS val 1307381897 ecr 1307381897], length 0
2022-02-28 08:43:57.673641 IP (tos 0x0, ttl 64, id 1667, offset 0, flags [DF], proto TCP (6), length 55)
    127.0.0.1.37810 > 127.0.0.1.9650: Flags [P.], cksum 0xfe2b (incorrect -> 0x9b37), seq 1:4, ack 1, win 512, options [nop,nop,TS val 1307381897 ecr 1307381897], length 3
2022-02-28 08:43:57.673655 IP (tos 0x0, ttl 64, id 53962, offset 0, flags [DF], proto TCP (6), length 52)
    127.0.0.1.9650 > 127.0.0.1.37810: Flags [.], cksum 0xfe28 (incorrect -> 0xa040), seq 1, ack 4, win 512, options [nop,nop,TS val 1307381897 ecr 1307381897], length 0
2022-02-28 08:43:57.673725 IP (tos 0x0, ttl 64, id 53963, offset 0, flags [DF], proto TCP (6), length 54)
    127.0.0.1.9650 > 127.0.0.1.37810: Flags [P.], cksum 0xfe2a (incorrect -> 0x9b36), seq 1:3, ack 4, win 512, options [nop,nop,TS val 1307381897 ecr 1307381897], length 2
2022-02-28 08:43:57.673738 IP (tos 0x0, ttl 64, id 1668, offset 0, flags [DF], proto TCP (6), length 52)
    127.0.0.1.37810 > 127.0.0.1.9650: Flags [.], cksum 0xfe28 (incorrect -> 0xa03e), seq 4, ack 3, win 512, options [nop,nop,TS val 1307381897 ecr 1307381897], length 0
2022-02-28 08:43:57.675463 IP (tos 0x0, ttl 64, id 1669, offset 0, flags [DF], proto TCP (6), length 62)
    127.0.0.1.37810 > 127.0.0.1.9650: Flags [P.], cksum 0xfe32 (incorrect -> 0x6c7e), seq 4:14, ack 3, win 512, options [nop,nop,TS val 1307381899 ecr 1307381897], length 10
2022-02-28 08:43:57.675486 IP (tos 0x0, ttl 64, id 53964, offset 0, flags [DF], proto TCP (6), length 52)
    127.0.0.1.9650 > 127.0.0.1.37810: Flags [.], cksum 0xfe28 (incorrect -> 0xa030), seq 3, ack 14, win 512, options [nop,nop,TS val 1307381899 ecr 1307381899], length 0
2022-02-28 08:43:57.764451 IP (tos 0x0, ttl 64, id 53965, offset 0, flags [DF], proto TCP (6), length 62)
    127.0.0.1.9650 > 127.0.0.1.37810: Flags [P.], cksum 0xfe32 (incorrect -> 0x9ac4), seq 3:13, ack 14, win 512, options [nop,nop,TS val 1307381988 ecr 1307381899], length 10
2022-02-28 08:43:57.764463 IP (tos 0x0, ttl 64, id 1670, offset 0, flags [DF], proto TCP (6), length 52)
    127.0.0.1.37810 > 127.0.0.1.9650: Flags [.], cksum 0xfe28 (incorrect -> 0x9f74), seq 14, ack 13, win 512, options [nop,nop,TS val 1307381988 ecr 1307381988], length 0
2022-02-28 08:43:57.770657 IP (tos 0x0, ttl 64, id 1671, offset 0, flags [DF], proto TCP (6), length 569)
    127.0.0.1.37810 > 127.0.0.1.9650: Flags [P.], cksum 0x002e (incorrect -> 0x1ce6), seq 14:531, ack 13, win 512, options [nop,nop,TS val 1307381994 ecr 1307381988], length 517
2022-02-28 08:43:57.770671 IP (tos 0x0, ttl 64, id 53966, offset 0, flags [DF], proto TCP (6), length 52)
    127.0.0.1.9650 > 127.0.0.1.37810: Flags [.], cksum 0xfe28 (incorrect -> 0x9d67), seq 13, ack 531, win 508, options [nop,nop,TS val 1307381994 ecr 1307381994], length 0
2022-02-28 08:43:57.840904 IP (tos 0x0, ttl 64, id 53967, offset 0, flags [DF], proto TCP (6), length 3538)
    127.0.0.1.9650 > 127.0.0.1.37810: Flags [P.], cksum 0x0bc7 (incorrect -> 0x9cfe), seq 13:3499, ack 531, win 512, options [nop,nop,TS val 1307382064 ecr 1307381994], length 3486
2022-02-28 08:43:57.840914 IP (tos 0x0, ttl 64, id 1672, offset 0, flags [DF], proto TCP (6), length 52)
    127.0.0.1.37810 > 127.0.0.1.9650: Flags [.], cksum 0xfe28 (incorrect -> 0x8f4b), seq 531, ack 3499, win 494, options [nop,nop,TS val 1307382064 ecr 1307382064], length 0
2022-02-28 08:43:57.854692 IP (tos 0x0, ttl 64, id 53968, offset 0, flags [DF], proto TCP (6), length 1334)
    127.0.0.1.9650 > 127.0.0.1.37810: Flags [P.], cksum 0x032b (incorrect -> 0x5680), seq 3499:4781, ack 531, win 512, options [nop,nop,TS val 1307382078 ecr 1307382064], length 1282
2022-02-28 08:43:57.854700 IP (tos 0x0, ttl 64, id 1673, offset 0, flags [DF], proto TCP (6), length 52)
    127.0.0.1.37810 > 127.0.0.1.9650: Flags [.], cksum 0xfe28 (incorrect -> 0x8a25), seq 531, ack 4781, win 502, options [nop,nop,TS val 1307382078 ecr 1307382078], length 0
2022-02-28 08:43:57.855182 IP (tos 0x0, ttl 64, id 1674, offset 0, flags [DF], proto TCP (6), length 116)
    127.0.0.1.37810 > 127.0.0.1.9650: Flags [P.], cksum 0xfe68 (incorrect -> 0xc32f), seq 531:595, ack 4781, win 512, options [nop,nop,TS val 1307382078 ecr 1307382078], length 64
2022-02-28 08:43:57.855191 IP (tos 0x0, ttl 64, id 53969, offset 0, flags [DF], proto TCP (6), length 52)
    127.0.0.1.9650 > 127.0.0.1.37810: Flags [.], cksum 0xfe28 (incorrect -> 0x89db), seq 4781, ack 595, win 512, options [nop,nop,TS val 1307382078 ecr 1307382078], length 0
2022-02-28 08:43:57.855705 IP (tos 0x0, ttl 64, id 1675, offset 0, flags [DF], proto TCP (6), length 313)
    127.0.0.1.37810 > 127.0.0.1.9650: Flags [P.], cksum 0xff2d (incorrect -> 0x2aa3), seq 595:856, ack 4781, win 512, options [nop,nop,TS val 1307382079 ecr 1307382078], length 261
2022-02-28 08:43:57.855715 IP (tos 0x0, ttl 64, id 53970, offset 0, flags [DF], proto TCP (6), length 52)
    127.0.0.1.9650 > 127.0.0.1.37810: Flags [.], cksum 0xfe28 (incorrect -> 0x88d6), seq 4781, ack 856, win 510, options [nop,nop,TS val 1307382079 ecr 1307382079], length 0
2022-02-28 08:43:57.986825 IP (tos 0x0, ttl 64, id 53971, offset 0, flags [DF], proto TCP (6), length 3538)
    127.0.0.1.9650 > 127.0.0.1.37810: Flags [P.], cksum 0x0bc7 (incorrect -> 0x5b54), seq 4781:8267, ack 856, win 512, options [nop,nop,TS val 1307382210 ecr 1307382079], length 3486
2022-02-28 08:43:57.986834 IP (tos 0x0, ttl 64, id 1676, offset 0, flags [DF], proto TCP (6), length 52)
    127.0.0.1.37810 > 127.0.0.1.9650: Flags [.], cksum 0xfe28 (incorrect -> 0x7a42), seq 856, ack 8267, win 494, options [nop,nop,TS val 1307382210 ecr 1307382210], length 0
2022-02-28 08:43:57.996708 IP (tos 0x0, ttl 64, id 53972, offset 0, flags [DF], proto TCP (6), length 4100)
    127.0.0.1.9650 > 127.0.0.1.37810: Flags [P.], cksum 0x0df9 (incorrect -> 0x366c), seq 8267:12315, ack 856, win 512, options [nop,nop,TS val 1307382220 ecr 1307382210], length 4048
2022-02-28 08:43:57.996716 IP (tos 0x0, ttl 64, id 1677, offset 0, flags [DF], proto TCP (6), length 52)
    127.0.0.1.37810 > 127.0.0.1.9650: Flags [.], cksum 0xfe28 (incorrect -> 0x6a60), seq 856, ack 12315, win 492, options [nop,nop,TS val 1307382220 ecr 1307382220], length 0
2022-02-28 08:43:57.996723 IP (tos 0x0, ttl 64, id 53973, offset 0, flags [DF], proto TCP (6), length 984)
    127.0.0.1.9650 > 127.0.0.1.37810: Flags [P.], cksum 0x01cd (incorrect -> 0x416a), seq 12315:13247, ack 856, win 512, options [nop,nop,TS val 1307382220 ecr 1307382220], length 932
2022-02-28 08:43:57.996728 IP (tos 0x0, ttl 64, id 1678, offset 0, flags [DF], proto TCP (6), length 52)
    127.0.0.1.37810 > 127.0.0.1.9650: Flags [.], cksum 0xfe28 (incorrect -> 0x66c0), seq 856, ack 13247, win 488, options [nop,nop,TS val 1307382220 ecr 1307382220], length 0
2022-02-28 08:43:58.000640 IP (tos 0x0, ttl 64, id 53974, offset 0, flags [DF], proto TCP (6), length 2542)
    127.0.0.1.9650 > 127.0.0.1.37810: Flags [P.], cksum 0x07e3 (incorrect -> 0x1cf8), seq 13247:15737, ack 856, win 512, options [nop,nop,TS val 1307382224 ecr 1307382220], length 2490
2022-02-28 08:43:58.000647 IP (tos 0x0, ttl 64, id 1679, offset 0, flags [DF], proto TCP (6), length 52)
    127.0.0.1.37810 > 127.0.0.1.9650: Flags [.], cksum 0xfe28 (incorrect -> 0x5cf4), seq 856, ack 15737, win 498, options [nop,nop,TS val 1307382224 ecr 1307382224], length 0
2022-02-28 08:43:58.003313 IP (tos 0x0, ttl 64, id 53975, offset 0, flags [DF], proto TCP (6), length 3538)
    127.0.0.1.9650 > 127.0.0.1.37810: Flags [P.], cksum 0x0bc7 (incorrect -> 0xe04c), seq 15737:19223, ack 856, win 512, options [nop,nop,TS val 1307382226 ecr 1307382224], length 3486
2022-02-28 08:43:58.003320 IP (tos 0x0, ttl 64, id 1680, offset 0, flags [DF], proto TCP (6), length 52)
    127.0.0.1.37810 > 127.0.0.1.9650: Flags [.], cksum 0xfe28 (incorrect -> 0x4f56), seq 856, ack 19223, win 494, options [nop,nop,TS val 1307382226 ecr 1307382226], length 0
2022-02-28 08:43:58.007921 IP (tos 0x0, ttl 64, id 53976, offset 0, flags [DF], proto TCP (6), length 2044)
    127.0.0.1.9650 > 127.0.0.1.37810: Flags [P.], cksum 0x05f1 (incorrect -> 0x05a6), seq 19223:21215, ack 856, win 512, options [nop,nop,TS val 1307382231 ecr 1307382226], length 1992
2022-02-28 08:43:58.007934 IP (tos 0x0, ttl 64, id 1681, offset 0, flags [DF], proto TCP (6), length 52)
    127.0.0.1.37810 > 127.0.0.1.9650: Flags [.], cksum 0xfe28 (incorrect -> 0x477e), seq 856, ack 21215, win 500, options [nop,nop,TS val 1307382231 ecr 1307382231], length 0
2022-02-28 08:43:58.008568 IP (tos 0x0, ttl 64, id 53977, offset 0, flags [DF], proto TCP (6), length 3484)
    127.0.0.1.9650 > 127.0.0.1.37810: Flags [P.], cksum 0x0b91 (incorrect -> 0x291d), seq 21215:24647, ack 856, win 512, options [nop,nop,TS val 1307382232 ecr 1307382231], length 3432
2022-02-28 08:43:58.008574 IP (tos 0x0, ttl 64, id 1682, offset 0, flags [DF], proto TCP (6), length 52)
    127.0.0.1.37810 > 127.0.0.1.9650: Flags [.], cksum 0xfe28 (incorrect -> 0x3a22), seq 856, ack 24647, win 486, options [nop,nop,TS val 1307382232 ecr 1307382232], length 0
2022-02-28 08:43:58.011669 IP (tos 0x0, ttl 64, id 53978, offset 0, flags [DF], proto TCP (6), length 1048)
    127.0.0.1.9650 > 127.0.0.1.37810: Flags [P.], cksum 0x020d (incorrect -> 0x6b60), seq 24647:25643, ack 856, win 512, options [nop,nop,TS val 1307382235 ecr 1307382232], length 996
2022-02-28 08:43:58.011676 IP (tos 0x0, ttl 64, id 1683, offset 0, flags [DF], proto TCP (6), length 52)
    127.0.0.1.37810 > 127.0.0.1.9650: Flags [.], cksum 0xfe28 (incorrect -> 0x3626), seq 856, ack 25643, win 504, options [nop,nop,TS val 1307382235 ecr 1307382235], length 0
2022-02-28 08:43:58.011753 IP (tos 0x0, ttl 64, id 53979, offset 0, flags [DF], proto TCP (6), length 3538)
    127.0.0.1.9650 > 127.0.0.1.37810: Flags [P.], cksum 0x0bc7 (incorrect -> 0xdfb2), seq 25643:29129, ack 856, win 512, options [nop,nop,TS val 1307382235 ecr 1307382235], length 3486
2022-02-28 08:43:58.011766 IP (tos 0x0, ttl 64, id 1684, offset 0, flags [DF], proto TCP (6), length 52)
    127.0.0.1.37810 > 127.0.0.1.9650: Flags [.], cksum 0xfe28 (incorrect -> 0x2880), seq 856, ack 29129, win 512, options [nop,nop,TS val 1307382235 ecr 1307382235], length 0
2022-02-28 08:43:58.014506 IP (tos 0x0, ttl 64, id 53980, offset 0, flags [DF], proto TCP (6), length 550)
    127.0.0.1.9650 > 127.0.0.1.37810: Flags [P.], cksum 0x001b (incorrect -> 0xb99d), seq 29129:29627, ack 856, win 512, options [nop,nop,TS val 1307382238 ecr 1307382235], length 498
2022-02-28 08:43:58.014521 IP (tos 0x0, ttl 64, id 1685, offset 0, flags [DF], proto TCP (6), length 52)
    127.0.0.1.37810 > 127.0.0.1.9650: Flags [.], cksum 0xfe28 (incorrect -> 0x2688), seq 856, ack 29627, win 512, options [nop,nop,TS val 1307382238 ecr 1307382238], length 0
2022-02-28 08:43:58.027535 IP (tos 0x0, ttl 64, id 53981, offset 0, flags [DF], proto TCP (6), length 4036)
    127.0.0.1.9650 > 127.0.0.1.37810: Flags [P.], cksum 0x0db9 (incorrect -> 0x92ca), seq 29627:33611, ack 856, win 512, options [nop,nop,TS val 1307382251 ecr 1307382238], length 3984
2022-02-28 08:43:58.027584 IP (tos 0x0, ttl 64, id 1686, offset 0, flags [DF], proto TCP (6), length 52)
    127.0.0.1.37810 > 127.0.0.1.9650: Flags [.], cksum 0xfe28 (incorrect -> 0x16de), seq 856, ack 33611, win 512, options [nop,nop,TS val 1307382251 ecr 1307382251], length 0
2022-02-28 08:43:58.028397 IP (tos 0x0, ttl 64, id 53982, offset 0, flags [DF], proto TCP (6), length 3538)
    127.0.0.1.9650 > 127.0.0.1.37810: Flags [P.], cksum 0x0bc7 (incorrect -> 0x9775), seq 33611:37097, ack 856, win 512, options [nop,nop,TS val 1307382251 ecr 1307382251], length 3486
2022-02-28 08:43:58.028713 IP (tos 0x0, ttl 64, id 1687, offset 0, flags [DF], proto TCP (6), length 52)
    127.0.0.1.37810 > 127.0.0.1.9650: Flags [.], cksum 0xfe28 (incorrect -> 0x093f), seq 856, ack 37097, win 512, options [nop,nop,TS val 1307382252 ecr 1307382251], length 0
2022-02-28 08:43:58.028815 IP (tos 0x0, ttl 64, id 53983, offset 0, flags [DF], proto TCP (6), length 3040)
    127.0.0.1.9650 > 127.0.0.1.37810: Flags [P.], cksum 0x09d5 (incorrect -> 0x84ba), seq 37097:40085, ack 856, win 512, options [nop,nop,TS val 1307382252 ecr 1307382252], length 2988
2022-02-28 08:43:58.028831 IP (tos 0x0, ttl 64, id 1688, offset 0, flags [DF], proto TCP (6), length 52)
    127.0.0.1.37810 > 127.0.0.1.9650: Flags [.], cksum 0xfe28 (incorrect -> 0xfd91), seq 856, ack 40085, win 512, options [nop,nop,TS val 1307382252 ecr 1307382252], length 0
2022-02-28 08:43:58.029439 IP (tos 0x0, ttl 64, id 53984, offset 0, flags [DF], proto TCP (6), length 1546)
    127.0.0.1.9650 > 127.0.0.1.37810: Flags [P.], cksum 0x03ff (incorrect -> 0x97f7), seq 40085:41579, ack 856, win 512, options [nop,nop,TS val 1307382253 ecr 1307382252], length 1494
2022-02-28 08:43:58.029452 IP (tos 0x0, ttl 64, id 1689, offset 0, flags [DF], proto TCP (6), length 52)
    127.0.0.1.37810 > 127.0.0.1.9650: Flags [.], cksum 0xfe28 (incorrect -> 0xf7b9), seq 856, ack 41579, win 512, options [nop,nop,TS val 1307382253 ecr 1307382253], length 0
2022-02-28 08:43:58.044579 IP (tos 0x0, ttl 64, id 53985, offset 0, flags [DF], proto TCP (6), length 3915)
    127.0.0.1.9650 > 127.0.0.1.37810: Flags [P.], cksum 0x0d40 (incorrect -> 0xa42e), seq 41579:45442, ack 856, win 512, options [nop,nop,TS val 1307382268 ecr 1307382253], length 3863
2022-02-28 08:43:58.044850 IP (tos 0x0, ttl 64, id 1690, offset 0, flags [DF], proto TCP (6), length 52)
    127.0.0.1.37810 > 127.0.0.1.9650: Flags [.], cksum 0xfe28 (incorrect -> 0xe884), seq 856, ack 45442, win 512, options [nop,nop,TS val 1307382268 ecr 1307382268], length 0
2022-02-28 08:43:58.052760 IP (tos 0x0, ttl 64, id 53986, offset 0, flags [DF], proto TCP (6), length 4036)
    127.0.0.1.9650 > 127.0.0.1.37810: Flags [P.], cksum 0x0db9 (incorrect -> 0x5a63), seq 45442:49426, ack 856, win 512, options [nop,nop,TS val 1307382276 ecr 1307382268], length 3984
2022-02-28 08:43:58.053029 IP (tos 0x0, ttl 64, id 1691, offset 0, flags [DF], proto TCP (6), length 52)
    127.0.0.1.37810 > 127.0.0.1.9650: Flags [.], cksum 0xfe28 (incorrect -> 0xd8e4), seq 856, ack 49426, win 512, options [nop,nop,TS val 1307382276 ecr 1307382276], length 0
2022-02-28 08:43:58.061116 IP (tos 0x0, ttl 64, id 53987, offset 0, flags [DF], proto TCP (6), length 4036)
    127.0.0.1.9650 > 127.0.0.1.37810: Flags [P.], cksum 0x0db9 (incorrect -> 0x2413), seq 49426:53410, ack 856, win 512, options [nop,nop,TS val 1307382284 ecr 1307382276], length 3984
2022-02-28 08:43:58.102144 IP (tos 0x0, ttl 64, id 1692, offset 0, flags [DF], proto TCP (6), length 52)
    127.0.0.1.37810 > 127.0.0.1.9650: Flags [.], cksum 0xfe28 (incorrect -> 0xc91b), seq 856, ack 53410, win 512, options [nop,nop,TS val 1307382325 ecr 1307382284], length 0
2022-02-28 08:43:58.102168 IP (tos 0x0, ttl 64, id 53988, offset 0, flags [DF], proto TCP (6), length 23060)
    127.0.0.1.9650 > 127.0.0.1.37810: Flags [P.], cksum 0x5809 (incorrect -> 0x701f), seq 53410:76418, ack 856, win 512, options [nop,nop,TS val 1307382325 ecr 1307382325], length 23008
2022-02-28 08:43:58.146146 IP (tos 0x0, ttl 64, id 1693, offset 0, flags [DF], proto TCP (6), length 52)
    127.0.0.1.37810 > 127.0.0.1.9650: Flags [.], cksum 0xfe28 (incorrect -> 0x6ee6), seq 856, ack 76418, win 512, options [nop,nop,TS val 1307382369 ecr 1307382325], length 0
2022-02-28 08:43:58.146169 IP (tos 0x0, ttl 64, id 53989, offset 0, flags [DF], proto TCP (6), length 30974)
    127.0.0.1.9650 > 127.0.0.1.37810: Flags [P.], cksum 0x76f3 (incorrect -> 0xfca6), seq 76418:107340, ack 856, win 512, options [nop,nop,TS val 1307382369 ecr 1307382369], length 30922
2022-02-28 08:43:58.190143 IP (tos 0x0, ttl 64, id 1694, offset 0, flags [DF], proto TCP (6), length 52)
    127.0.0.1.37810 > 127.0.0.1.9650: Flags [.], cksum 0xfe28 (incorrect -> 0xf5c3), seq 856, ack 107340, win 512, options [nop,nop,TS val 1307382413 ecr 1307382369], length 0
200, 5.8053178787231445, 0.6118865013122559