2022-02-28 11:41:32.006823 IP (tos 0x0, ttl 64, id 43559, offset 0, flags [DF], proto TCP (6), length 60)
    127.0.0.1.44682 > 127.0.0.1.9150: Flags [S], cksum 0xfe30 (incorrect -> 0x25ab), seq 1415844372, win 65495, options [mss 65495,sackOK,TS val 1318036230 ecr 0,nop,wscale 7], length 0
2022-02-28 11:41:32.006836 IP (tos 0x0, ttl 64, id 0, offset 0, flags [DF], proto TCP (6), length 60)
    127.0.0.1.9150 > 127.0.0.1.44682: Flags [S.], cksum 0xfe30 (incorrect -> 0x7f28), seq 1493982171, ack 1415844373, win 65483, options [mss 65495,sackOK,TS val 1318036230 ecr 1318036230,nop,wscale 7], length 0
2022-02-28 11:41:32.006844 IP (tos 0x0, ttl 64, id 43560, offset 0, flags [DF], proto TCP (6), length 52)
    127.0.0.1.44682 > 127.0.0.1.9150: Flags [.], cksum 0xfe28 (incorrect -> 0xa5e4), seq 1, ack 1, win 512, options [nop,nop,TS val 1318036230 ecr 1318036230], length 0
2022-02-28 11:41:32.007081 IP (tos 0x0, ttl 64, id 43561, offset 0, flags [DF], proto TCP (6), length 55)
    127.0.0.1.44682 > 127.0.0.1.9150: Flags [P.], cksum 0xfe2b (incorrect -> 0xa0d8), seq 1:4, ack 1, win 512, options [nop,nop,TS val 1318036230 ecr 1318036230], length 3
2022-02-28 11:41:32.007090 IP (tos 0x0, ttl 64, id 15996, offset 0, flags [DF], proto TCP (6), length 52)
    127.0.0.1.9150 > 127.0.0.1.44682: Flags [.], cksum 0xfe28 (incorrect -> 0xa5e1), seq 1, ack 4, win 512, options [nop,nop,TS val 1318036230 ecr 1318036230], length 0
2022-02-28 11:41:32.007119 IP (tos 0x0, ttl 64, id 15997, offset 0, flags [DF], proto TCP (6), length 54)
    127.0.0.1.9150 > 127.0.0.1.44682: Flags [P.], cksum 0xfe2a (incorrect -> 0xa0d7), seq 1:3, ack 4, win 512, options [nop,nop,TS val 1318036230 ecr 1318036230], length 2
2022-02-28 11:41:32.007126 IP (tos 0x0, ttl 64, id 43562, offset 0, flags [DF], proto TCP (6), length 52)
    127.0.0.1.44682 > 127.0.0.1.9150: Flags [.], cksum 0xfe28 (incorrect -> 0xa5df), seq 4, ack 3, win 512, options [nop,nop,TS val 1318036230 ecr 1318036230], length 0
2022-02-28 11:41:32.008473 IP (tos 0x0, ttl 64, id 43563, offset 0, flags [DF], proto TCP (6), length 62)
    127.0.0.1.44682 > 127.0.0.1.9150: Flags [P.], cksum 0xfe32 (incorrect -> 0x711f), seq 4:14, ack 3, win 512, options [nop,nop,TS val 1318036232 ecr 1318036230], length 10
2022-02-28 11:41:32.008494 IP (tos 0x0, ttl 64, id 15998, offset 0, flags [DF], proto TCP (6), length 52)
    127.0.0.1.9150 > 127.0.0.1.44682: Flags [.], cksum 0xfe28 (incorrect -> 0xa5d1), seq 3, ack 14, win 512, options [nop,nop,TS val 1318036232 ecr 1318036232], length 0
2022-02-28 11:41:32.184051 IP (tos 0x0, ttl 64, id 15999, offset 0, flags [DF], proto TCP (6), length 62)
    127.0.0.1.9150 > 127.0.0.1.44682: Flags [P.], cksum 0xfe32 (incorrect -> 0xa00f), seq 3:13, ack 14, win 512, options [nop,nop,TS val 1318036407 ecr 1318036232], length 10
2022-02-28 11:41:32.184063 IP (tos 0x0, ttl 64, id 43564, offset 0, flags [DF], proto TCP (6), length 52)
    127.0.0.1.44682 > 127.0.0.1.9150: Flags [.], cksum 0xfe28 (incorrect -> 0xa469), seq 14, ack 13, win 512, options [nop,nop,TS val 1318036407 ecr 1318036407], length 0
2022-02-28 11:41:32.190254 IP (tos 0x0, ttl 64, id 43565, offset 0, flags [DF], proto TCP (6), length 569)
    127.0.0.1.44682 > 127.0.0.1.9150: Flags [P.], cksum 0x002e (incorrect -> 0xf15f), seq 14:531, ack 13, win 512, options [nop,nop,TS val 1318036413 ecr 1318036407], length 517
2022-02-28 11:41:32.190263 IP (tos 0x0, ttl 64, id 16000, offset 0, flags [DF], proto TCP (6), length 52)
    127.0.0.1.9150 > 127.0.0.1.44682: Flags [.], cksum 0xfe28 (incorrect -> 0xa25c), seq 13, ack 531, win 508, options [nop,nop,TS val 1318036413 ecr 1318036413], length 0
2022-02-28 11:41:32.377431 IP (tos 0x0, ttl 64, id 16001, offset 0, flags [DF], proto TCP (6), length 3538)
    127.0.0.1.9150 > 127.0.0.1.44682: Flags [P.], cksum 0x0bc7 (incorrect -> 0xe65a), seq 13:3499, ack 531, win 512, options [nop,nop,TS val 1318036601 ecr 1318036413], length 3486
2022-02-28 11:41:32.377441 IP (tos 0x0, ttl 64, id 43566, offset 0, flags [DF], proto TCP (6), length 52)
    127.0.0.1.44682 > 127.0.0.1.9150: Flags [.], cksum 0xfe28 (incorrect -> 0x9354), seq 531, ack 3499, win 494, options [nop,nop,TS val 1318036601 ecr 1318036601], length 0
2022-02-28 11:41:32.410417 IP (tos 0x0, ttl 64, id 16002, offset 0, flags [DF], proto TCP (6), length 1334)
    127.0.0.1.9150 > 127.0.0.1.44682: Flags [P.], cksum 0x032b (incorrect -> 0x747a), seq 3499:4781, ack 531, win 512, options [nop,nop,TS val 1318036633 ecr 1318036601], length 1282
2022-02-28 11:41:32.410424 IP (tos 0x0, ttl 64, id 43567, offset 0, flags [DF], proto TCP (6), length 52)
    127.0.0.1.44682 > 127.0.0.1.9150: Flags [.], cksum 0xfe28 (incorrect -> 0x8e0a), seq 531, ack 4781, win 502, options [nop,nop,TS val 1318036633 ecr 1318036633], length 0
2022-02-28 11:41:32.410913 IP (tos 0x0, ttl 64, id 43568, offset 0, flags [DF], proto TCP (6), length 116)
    127.0.0.1.44682 > 127.0.0.1.9150: Flags [P.], cksum 0xfe68 (incorrect -> 0x0174), seq 531:595, ack 4781, win 512, options [nop,nop,TS val 1318036634 ecr 1318036633], length 64
2022-02-28 11:41:32.410922 IP (tos 0x0, ttl 64, id 16003, offset 0, flags [DF], proto TCP (6), length 52)
    127.0.0.1.9150 > 127.0.0.1.44682: Flags [.], cksum 0xfe28 (incorrect -> 0x8dbe), seq 4781, ack 595, win 512, options [nop,nop,TS val 1318036634 ecr 1318036634], length 0
2022-02-28 11:41:32.411514 IP (tos 0x0, ttl 64, id 43569, offset 0, flags [DF], proto TCP (6), length 394)
    127.0.0.1.44682 > 127.0.0.1.9150: Flags [P.], cksum 0xff7e (incorrect -> 0xf89b), seq 595:937, ack 4781, win 512, options [nop,nop,TS val 1318036635 ecr 1318036634], length 342
2022-02-28 11:41:32.411523 IP (tos 0x0, ttl 64, id 16004, offset 0, flags [DF], proto TCP (6), length 52)
    127.0.0.1.9150 > 127.0.0.1.44682: Flags [.], cksum 0xfe28 (incorrect -> 0x8c68), seq 4781, ack 937, win 510, options [nop,nop,TS val 1318036635 ecr 1318036635], length 0
2022-02-28 11:41:32.613178 IP (tos 0x0, ttl 64, id 16005, offset 0, flags [DF], proto TCP (6), length 4100)
    127.0.0.1.9150 > 127.0.0.1.44682: Flags [P.], cksum 0x0df9 (incorrect -> 0x5181), seq 4781:8829, ack 937, win 512, options [nop,nop,TS val 1318036836 ecr 1318036635], length 4048
2022-02-28 11:41:32.613185 IP (tos 0x0, ttl 64, id 43570, offset 0, flags [DF], proto TCP (6), length 52)
    127.0.0.1.44682 > 127.0.0.1.9150: Flags [.], cksum 0xfe28 (incorrect -> 0x7b18), seq 937, ack 8829, win 492, options [nop,nop,TS val 1318036836 ecr 1318036836], length 0
2022-02-28 11:41:32.613206 IP (tos 0x0, ttl 64, id 16006, offset 0, flags [DF], proto TCP (6), length 486)
    127.0.0.1.9150 > 127.0.0.1.44682: Flags [P.], cksum 0xffda (incorrect -> 0x93a4), seq 8829:9263, ack 937, win 512, options [nop,nop,TS val 1318036836 ecr 1318036836], length 434
2022-02-28 11:41:32.613209 IP (tos 0x0, ttl 64, id 43571, offset 0, flags [DF], proto TCP (6), length 52)
    127.0.0.1.44682 > 127.0.0.1.9150: Flags [.], cksum 0xfe28 (incorrect -> 0x7968), seq 937, ack 9263, win 490, options [nop,nop,TS val 1318036836 ecr 1318036836], length 0
2022-02-28 11:41:32.629644 IP (tos 0x0, ttl 64, id 16007, offset 0, flags [DF], proto TCP (6), length 4036)
    127.0.0.1.9150 > 127.0.0.1.44682: Flags [P.], cksum 0x0db9 (incorrect -> 0x5637), seq 9263:13247, ack 937, win 512, options [nop,nop,TS val 1318036853 ecr 1318036836], length 3984
2022-02-28 11:41:32.629650 IP (tos 0x0, ttl 64, id 43572, offset 0, flags [DF], proto TCP (6), length 52)
    127.0.0.1.44682 > 127.0.0.1.9150: Flags [.], cksum 0xfe28 (incorrect -> 0x69b4), seq 937, ack 13247, win 492, options [nop,nop,TS val 1318036853 ecr 1318036853], length 0
2022-02-28 11:41:32.659834 IP (tos 0x0, ttl 64, id 16008, offset 0, flags [DF], proto TCP (6), length 3040)
    127.0.0.1.9150 > 127.0.0.1.44682: Flags [P.], cksum 0x09d5 (incorrect -> 0x7ec6), seq 13247:16235, ack 937, win 512, options [nop,nop,TS val 1318036883 ecr 1318036853], length 2988
2022-02-28 11:41:32.659841 IP (tos 0x0, ttl 64, id 43573, offset 0, flags [DF], proto TCP (6), length 52)
    127.0.0.1.44682 > 127.0.0.1.9150: Flags [.], cksum 0xfe28 (incorrect -> 0x5dc8), seq 937, ack 16235, win 496, options [nop,nop,TS val 1318036883 ecr 1318036883], length 0
2022-02-28 11:41:32.669542 IP (tos 0x0, ttl 64, id 16009, offset 0, flags [DF], proto TCP (6), length 3538)
    127.0.0.1.9150 > 127.0.0.1.44682: Flags [P.], cksum 0x0bc7 (incorrect -> 0xb810), seq 16235:19721, ack 937, win 512, options [nop,nop,TS val 1318036893 ecr 1318036883], length 3486
2022-02-28 11:41:32.669548 IP (tos 0x0, ttl 64, id 43574, offset 0, flags [DF], proto TCP (6), length 52)
    127.0.0.1.44682 > 127.0.0.1.9150: Flags [.], cksum 0xfe28 (incorrect -> 0x5018), seq 937, ack 19721, win 494, options [nop,nop,TS val 1318036893 ecr 1318036893], length 0
2022-02-28 11:41:32.671320 IP (tos 0x0, ttl 64, id 16010, offset 0, flags [DF], proto TCP (6), length 3982)
    127.0.0.1.9150 > 127.0.0.1.44682: Flags [P.], cksum 0x0d83 (incorrect -> 0xaf08), seq 19721:23651, ack 937, win 512, options [nop,nop,TS val 1318036894 ecr 1318036893], length 3930
2022-02-28 11:41:32.671326 IP (tos 0x0, ttl 64, id 43575, offset 0, flags [DF], proto TCP (6), length 52)
    127.0.0.1.44682 > 127.0.0.1.9150: Flags [.], cksum 0xfe28 (incorrect -> 0x40be), seq 937, ack 23651, win 492, options [nop,nop,TS val 1318036894 ecr 1318036894], length 0
2022-02-28 11:41:32.681009 IP (tos 0x0, ttl 64, id 16011, offset 0, flags [DF], proto TCP (6), length 4100)
    127.0.0.1.9150 > 127.0.0.1.44682: Flags [P.], cksum 0x0df9 (incorrect -> 0x70db), seq 23651:27699, ack 937, win 512, options [nop,nop,TS val 1318036904 ecr 1318036894], length 4048
2022-02-28 11:41:32.681016 IP (tos 0x0, ttl 64, id 43576, offset 0, flags [DF], proto TCP (6), length 52)
    127.0.0.1.44682 > 127.0.0.1.9150: Flags [.], cksum 0xfe28 (incorrect -> 0x30da), seq 937, ack 27699, win 492, options [nop,nop,TS val 1318036904 ecr 1318036904], length 0
2022-02-28 11:41:32.681021 IP (tos 0x0, ttl 64, id 16012, offset 0, flags [DF], proto TCP (6), length 486)
    127.0.0.1.9150 > 127.0.0.1.44682: Flags [P.], cksum 0xffda (incorrect -> 0x8307), seq 27699:28133, ack 937, win 512, options [nop,nop,TS val 1318036904 ecr 1318036904], length 434
2022-02-28 11:41:32.681025 IP (tos 0x0, ttl 64, id 43577, offset 0, flags [DF], proto TCP (6), length 52)
    127.0.0.1.44682 > 127.0.0.1.9150: Flags [.], cksum 0xfe28 (incorrect -> 0x2f2a), seq 937, ack 28133, win 490, options [nop,nop,TS val 1318036904 ecr 1318036904], length 0
2022-02-28 11:41:32.681053 IP (tos 0x0, ttl 64, id 16013, offset 0, flags [DF], proto TCP (6), length 3538)
    127.0.0.1.9150 > 127.0.0.1.44682: Flags [P.], cksum 0x0bc7 (incorrect -> 0xb9f3), seq 28133:31619, ack 937, win 512, options [nop,nop,TS val 1318036904 ecr 1318036904], length 3486
2022-02-28 11:41:32.681065 IP (tos 0x0, ttl 64, id 43578, offset 0, flags [DF], proto TCP (6), length 52)
    127.0.0.1.44682 > 127.0.0.1.9150: Flags [.], cksum 0xfe28 (incorrect -> 0x2176), seq 937, ack 31619, win 512, options [nop,nop,TS val 1318036904 ecr 1318036904], length 0
2022-02-28 11:41:32.686090 IP (tos 0x0, ttl 64, id 16014, offset 0, flags [DF], proto TCP (6), length 2044)
    127.0.0.1.9150 > 127.0.0.1.44682: Flags [P.], cksum 0x05f1 (incorrect -> 0xf78c), seq 31619:33611, ack 937, win 512, options [nop,nop,TS val 1318036909 ecr 1318036904], length 1992
2022-02-28 11:41:32.686107 IP (tos 0x0, ttl 64, id 43579, offset 0, flags [DF], proto TCP (6), length 52)
    127.0.0.1.44682 > 127.0.0.1.9150: Flags [.], cksum 0xfe28 (incorrect -> 0x19a4), seq 937, ack 33611, win 512, options [nop,nop,TS val 1318036909 ecr 1318036909], length 0
2022-02-28 11:41:32.692016 IP (tos 0x0, ttl 64, id 16015, offset 0, flags [DF], proto TCP (6), length 4036)
    127.0.0.1.9150 > 127.0.0.1.44682: Flags [P.], cksum 0x0db9 (incorrect -> 0x6897), seq 33611:37595, ack 937, win 512, options [nop,nop,TS val 1318036915 ecr 1318036909], length 3984
2022-02-28 11:41:32.692506 IP (tos 0x0, ttl 64, id 43580, offset 0, flags [DF], proto TCP (6), length 52)
    127.0.0.1.44682 > 127.0.0.1.9150: Flags [.], cksum 0xfe28 (incorrect -> 0x0a07), seq 937, ack 37595, win 512, options [nop,nop,TS val 1318036916 ecr 1318036915], length 0
2022-02-28 11:41:32.692517 IP (tos 0x0, ttl 64, id 16016, offset 0, flags [DF], proto TCP (6), length 7401)
    127.0.0.1.9150 > 127.0.0.1.44682: Flags [P.], cksum 0x1ade (incorrect -> 0x96c5), seq 37595:44944, ack 937, win 512, options [nop,nop,TS val 1318036916 ecr 1318036916], length 7349
2022-02-28 11:41:32.734144 IP (tos 0x0, ttl 64, id 43581, offset 0, flags [DF], proto TCP (6), length 52)
    127.0.0.1.44682 > 127.0.0.1.9150: Flags [.], cksum 0xfe28 (incorrect -> 0xed27), seq 937, ack 44944, win 512, options [nop,nop,TS val 1318036957 ecr 1318036916], length 0
2022-02-28 11:41:32.734162 IP (tos 0x0, ttl 64, id 16017, offset 0, flags [DF], proto TCP (6), length 29508)
    127.0.0.1.9150 > 127.0.0.1.44682: Flags [P.], cksum 0x7139 (incorrect -> 0x1749), seq 44944:74400, ack 937, win 512, options [nop,nop,TS val 1318036957 ecr 1318036957], length 29456
2022-02-28 11:41:32.778149 IP (tos 0x0, ttl 64, id 43582, offset 0, flags [DF], proto TCP (6), length 52)
    127.0.0.1.44682 > 127.0.0.1.9150: Flags [.], cksum 0xfe28 (incorrect -> 0x79c2), seq 937, ack 74400, win 512, options [nop,nop,TS val 1318037001 ecr 1318036957], length 0
2022-02-28 11:41:32.784189 IP (tos 0x0, ttl 64, id 16018, offset 0, flags [DF], proto TCP (6), length 4100)
    127.0.0.1.9150 > 127.0.0.1.44682: Flags [P.], cksum 0x0df9 (incorrect -> 0xa3f4), seq 74400:78448, ack 937, win 512, options [nop,nop,TS val 1318037007 ecr 1318037001], length 4048
2022-02-28 11:41:32.784982 IP (tos 0x0, ttl 64, id 43583, offset 0, flags [DF], proto TCP (6), length 52)
    127.0.0.1.44682 > 127.0.0.1.9150: Flags [.], cksum 0xfe28 (incorrect -> 0x69b9), seq 937, ack 78448, win 512, options [nop,nop,TS val 1318037008 ecr 1318037007], length 0
2022-02-28 11:41:32.784992 IP (tos 0x0, ttl 64, id 16019, offset 0, flags [DF], proto TCP (6), length 3474)
    127.0.0.1.9150 > 127.0.0.1.44682: Flags [P.], cksum 0x0b87 (incorrect -> 0x4f52), seq 78448:81870, ack 937, win 512, options [nop,nop,TS val 1318037008 ecr 1318037008], length 3422
2022-02-28 11:41:32.785012 IP (tos 0x0, ttl 64, id 43584, offset 0, flags [DF], proto TCP (6), length 52)
    127.0.0.1.44682 > 127.0.0.1.9150: Flags [.], cksum 0xfe28 (incorrect -> 0x5c5a), seq 937, ack 81870, win 512, options [nop,nop,TS val 1318037008 ecr 1318037008], length 0
2022-02-28 11:41:32.792826 IP (tos 0x0, ttl 64, id 16020, offset 0, flags [DF], proto TCP (6), length 4036)
    127.0.0.1.9150 > 127.0.0.1.44682: Flags [P.], cksum 0x0db9 (incorrect -> 0x5de0), seq 81870:85854, ack 937, win 512, options [nop,nop,TS val 1318037016 ecr 1318037008], length 3984
2022-02-28 11:41:32.792851 IP (tos 0x0, ttl 64, id 43585, offset 0, flags [DF], proto TCP (6), length 52)
    127.0.0.1.44682 > 127.0.0.1.9150: Flags [.], cksum 0xfe28 (incorrect -> 0x4cba), seq 937, ack 85854, win 512, options [nop,nop,TS val 1318037016 ecr 1318037016], length 0
2022-02-28 11:41:32.796044 IP (tos 0x0, ttl 64, id 16021, offset 0, flags [DF], proto TCP (6), length 4100)
    127.0.0.1.9150 > 127.0.0.1.44682: Flags [P.], cksum 0x0df9 (incorrect -> 0x9bc3), seq 85854:89902, ack 937, win 512, options [nop,nop,TS val 1318037019 ecr 1318037016], length 4048
2022-02-28 11:41:32.796137 IP (tos 0x0, ttl 64, id 43586, offset 0, flags [DF], proto TCP (6), length 52)
    127.0.0.1.44682 > 127.0.0.1.9150: Flags [.], cksum 0xfe28 (incorrect -> 0x3ce4), seq 937, ack 89902, win 512, options [nop,nop,TS val 1318037019 ecr 1318037019], length 0
2022-02-28 11:41:32.796145 IP (tos 0x0, ttl 64, id 16022, offset 0, flags [DF], proto TCP (6), length 11940)
    127.0.0.1.9150 > 127.0.0.1.44682: Flags [P.], cksum 0x2c99 (incorrect -> 0xc995), seq 89902:101790, ack 937, win 512, options [nop,nop,TS val 1318037019 ecr 1318037019], length 11888
2022-02-28 11:41:32.796389 IP (tos 0x0, ttl 64, id 43587, offset 0, flags [DF], proto TCP (6), length 52)
    127.0.0.1.44682 > 127.0.0.1.9150: Flags [.], cksum 0xfe28 (incorrect -> 0x0e74), seq 937, ack 101790, win 512, options [nop,nop,TS val 1318037019 ecr 1318037019], length 0
2022-02-28 11:41:32.807012 IP (tos 0x0, ttl 64, id 16023, offset 0, flags [DF], proto TCP (6), length 4036)
    127.0.0.1.9150 > 127.0.0.1.44682: Flags [P.], cksum 0x0db9 (incorrect -> 0x1571), seq 101790:105774, ack 937, win 512, options [nop,nop,TS val 1318037030 ecr 1318037019], length 3984
2022-02-28 11:41:32.807207 IP (tos 0x0, ttl 64, id 43588, offset 0, flags [DF], proto TCP (6), length 52)
    127.0.0.1.44682 > 127.0.0.1.9150: Flags [.], cksum 0xfe28 (incorrect -> 0xfecd), seq 937, ack 105774, win 512, options [nop,nop,TS val 1318037030 ecr 1318037030], length 0
2022-02-28 11:41:32.811438 IP (tos 0x0, ttl 64, id 16024, offset 0, flags [DF], proto TCP (6), length 3538)
    127.0.0.1.9150 > 127.0.0.1.44682: Flags [P.], cksum 0x0bc7 (incorrect -> 0xde8b), seq 105774:109260, ack 937, win 512, options [nop,nop,TS val 1318037035 ecr 1318037030], length 3486
2022-02-28 11:41:32.811490 IP (tos 0x0, ttl 64, id 43589, offset 0, flags [DF], proto TCP (6), length 52)
    127.0.0.1.44682 > 127.0.0.1.9150: Flags [.], cksum 0xfe28 (incorrect -> 0xf125), seq 937, ack 109260, win 512, options [nop,nop,TS val 1318037035 ecr 1318037035], length 0
2022-02-28 11:41:32.811494 IP (tos 0x0, ttl 64, id 16025, offset 0, flags [DF], proto TCP (6), length 3538)
    127.0.0.1.9150 > 127.0.0.1.44682: Flags [P.], cksum 0x0bc7 (incorrect -> 0xadfb), seq 109260:112746, ack 937, win 512, options [nop,nop,TS val 1318037035 ecr 1318037035], length 3486
200, 6.895132064819336, 0.8638784885406494