2022-02-28 13:07:09.262737 IP (tos 0x0, ttl 64, id 3792, offset 0, flags [DF], proto TCP (6), length 60)
    127.0.0.1.54282 > 127.0.0.1.9250: Flags [S], cksum 0xfe30 (incorrect -> 0xaa29), seq 1271729298, win 65495, options [mss 65495,sackOK,TS val 1323173486 ecr 0,nop,wscale 7], length 0
2022-02-28 13:07:09.262747 IP (tos 0x0, ttl 64, id 0, offset 0, flags [DF], proto TCP (6), length 60)
    127.0.0.1.9250 > 127.0.0.1.54282: Flags [S.], cksum 0xfe30 (incorrect -> 0xd90f), seq 4201677143, ack 1271729299, win 65483, options [mss 65495,sackOK,TS val 1323173486 ecr 1323173486,nop,wscale 7], length 0
2022-02-28 13:07:09.262754 IP (tos 0x0, ttl 64, id 3793, offset 0, flags [DF], proto TCP (6), length 52)
    127.0.0.1.54282 > 127.0.0.1.9250: Flags [.], cksum 0xfe28 (incorrect -> 0xffcb), seq 1, ack 1, win 512, options [nop,nop,TS val 1323173486 ecr 1323173486], length 0
2022-02-28 13:07:09.262860 IP (tos 0x0, ttl 64, id 3794, offset 0, flags [DF], proto TCP (6), length 55)
    127.0.0.1.54282 > 127.0.0.1.9250: Flags [P.], cksum 0xfe2b (incorrect -> 0xfabf), seq 1:4, ack 1, win 512, options [nop,nop,TS val 1323173486 ecr 1323173486], length 3
2022-02-28 13:07:09.262862 IP (tos 0x0, ttl 64, id 62478, offset 0, flags [DF], proto TCP (6), length 52)
    127.0.0.1.9250 > 127.0.0.1.54282: Flags [.], cksum 0xfe28 (incorrect -> 0xffc8), seq 1, ack 4, win 512, options [nop,nop,TS val 1323173486 ecr 1323173486], length 0
2022-02-28 13:07:09.262930 IP (tos 0x0, ttl 64, id 62479, offset 0, flags [DF], proto TCP (6), length 54)
    127.0.0.1.9250 > 127.0.0.1.54282: Flags [P.], cksum 0xfe2a (incorrect -> 0xfabe), seq 1:3, ack 4, win 512, options [nop,nop,TS val 1323173486 ecr 1323173486], length 2
2022-02-28 13:07:09.262935 IP (tos 0x0, ttl 64, id 3795, offset 0, flags [DF], proto TCP (6), length 52)
    127.0.0.1.54282 > 127.0.0.1.9250: Flags [.], cksum 0xfe28 (incorrect -> 0xffc6), seq 4, ack 3, win 512, options [nop,nop,TS val 1323173486 ecr 1323173486], length 0
2022-02-28 13:07:09.276746 IP (tos 0x0, ttl 64, id 3796, offset 0, flags [DF], proto TCP (6), length 62)
    127.0.0.1.54282 > 127.0.0.1.9250: Flags [P.], cksum 0xfe32 (incorrect -> 0x762b), seq 4:14, ack 3, win 512, options [nop,nop,TS val 1323173500 ecr 1323173486], length 10
2022-02-28 13:07:09.276753 IP (tos 0x0, ttl 64, id 62480, offset 0, flags [DF], proto TCP (6), length 52)
    127.0.0.1.9250 > 127.0.0.1.54282: Flags [.], cksum 0xfe28 (incorrect -> 0xffa0), seq 3, ack 14, win 512, options [nop,nop,TS val 1323173500 ecr 1323173500], length 0
2022-02-28 13:07:09.333614 IP (tos 0x0, ttl 64, id 62481, offset 0, flags [DF], proto TCP (6), length 62)
    127.0.0.1.9250 > 127.0.0.1.54282: Flags [P.], cksum 0xfe32 (incorrect -> 0xfa54), seq 3:13, ack 14, win 512, options [nop,nop,TS val 1323173557 ecr 1323173500], length 10
2022-02-28 13:07:09.333619 IP (tos 0x0, ttl 64, id 3797, offset 0, flags [DF], proto TCP (6), length 52)
    127.0.0.1.54282 > 127.0.0.1.9250: Flags [.], cksum 0xfe28 (incorrect -> 0xff24), seq 14, ack 13, win 512, options [nop,nop,TS val 1323173557 ecr 1323173557], length 0
2022-02-28 13:07:09.339386 IP (tos 0x0, ttl 64, id 3798, offset 0, flags [DF], proto TCP (6), length 569)
    127.0.0.1.54282 > 127.0.0.1.9250: Flags [P.], cksum 0x002e (incorrect -> 0x8489), seq 14:531, ack 13, win 512, options [nop,nop,TS val 1323173562 ecr 1323173557], length 517
2022-02-28 13:07:09.339404 IP (tos 0x0, ttl 64, id 62482, offset 0, flags [DF], proto TCP (6), length 52)
    127.0.0.1.9250 > 127.0.0.1.54282: Flags [.], cksum 0xfe28 (incorrect -> 0xfd19), seq 13, ack 531, win 508, options [nop,nop,TS val 1323173562 ecr 1323173562], length 0
2022-02-28 13:07:09.396439 IP (tos 0x0, ttl 64, id 62483, offset 0, flags [DF], proto TCP (6), length 3538)
    127.0.0.1.9250 > 127.0.0.1.54282: Flags [P.], cksum 0x0bc7 (incorrect -> 0x12aa), seq 13:3499, ack 531, win 512, options [nop,nop,TS val 1323173620 ecr 1323173562], length 3486
2022-02-28 13:07:09.396445 IP (tos 0x0, ttl 64, id 3799, offset 0, flags [DF], proto TCP (6), length 52)
    127.0.0.1.54282 > 127.0.0.1.9250: Flags [.], cksum 0xfe28 (incorrect -> 0xef15), seq 531, ack 3499, win 494, options [nop,nop,TS val 1323173620 ecr 1323173620], length 0
2022-02-28 13:07:09.419527 IP (tos 0x0, ttl 64, id 62484, offset 0, flags [DF], proto TCP (6), length 2134)
    127.0.0.1.9250 > 127.0.0.1.54282: Flags [P.], cksum 0x064b (incorrect -> 0x8246), seq 3499:5581, ack 531, win 512, options [nop,nop,TS val 1323173643 ecr 1323173620], length 2082
2022-02-28 13:07:09.419531 IP (tos 0x0, ttl 64, id 3800, offset 0, flags [DF], proto TCP (6), length 52)
    127.0.0.1.54282 > 127.0.0.1.9250: Flags [.], cksum 0xfe28 (incorrect -> 0xe6c0), seq 531, ack 5581, win 499, options [nop,nop,TS val 1323173643 ecr 1323173643], length 0
2022-02-28 13:07:09.419883 IP (tos 0x0, ttl 64, id 3801, offset 0, flags [DF], proto TCP (6), length 116)
    127.0.0.1.54282 > 127.0.0.1.9250: Flags [P.], cksum 0xfe68 (incorrect -> 0x7a54), seq 531:595, ack 5581, win 512, options [nop,nop,TS val 1323173643 ecr 1323173643], length 64
2022-02-28 13:07:09.419899 IP (tos 0x0, ttl 64, id 62485, offset 0, flags [DF], proto TCP (6), length 52)
    127.0.0.1.9250 > 127.0.0.1.54282: Flags [.], cksum 0xfe28 (incorrect -> 0xe673), seq 5581, ack 595, win 512, options [nop,nop,TS val 1323173643 ecr 1323173643], length 0
2022-02-28 13:07:09.420193 IP (tos 0x0, ttl 64, id 3802, offset 0, flags [DF], proto TCP (6), length 331)
    127.0.0.1.54282 > 127.0.0.1.9250: Flags [P.], cksum 0xff3f (incorrect -> 0x9a85), seq 595:874, ack 5581, win 512, options [nop,nop,TS val 1323173643 ecr 1323173643], length 279
2022-02-28 13:07:09.420198 IP (tos 0x0, ttl 64, id 62486, offset 0, flags [DF], proto TCP (6), length 52)
    127.0.0.1.9250 > 127.0.0.1.54282: Flags [.], cksum 0xfe28 (incorrect -> 0xe55e), seq 5581, ack 874, win 510, options [nop,nop,TS val 1323173643 ecr 1323173643], length 0
2022-02-28 13:07:09.474037 IP (tos 0x0, ttl 64, id 62487, offset 0, flags [DF], proto TCP (6), length 3179)
    127.0.0.1.9250 > 127.0.0.1.54282: Flags [P.], cksum 0x0a60 (incorrect -> 0xfe25), seq 5581:8708, ack 874, win 512, options [nop,nop,TS val 1323173697 ecr 1323173643], length 3127
2022-02-28 13:07:09.474046 IP (tos 0x0, ttl 64, id 3803, offset 0, flags [DF], proto TCP (6), length 52)
    127.0.0.1.54282 > 127.0.0.1.9250: Flags [.], cksum 0xfe28 (incorrect -> 0xd8ca), seq 874, ack 8708, win 495, options [nop,nop,TS val 1323173697 ecr 1323173697], length 0
2022-02-28 13:07:09.487907 IP (tos 0x0, ttl 64, id 62488, offset 0, flags [DF], proto TCP (6), length 4036)
    127.0.0.1.9250 > 127.0.0.1.54282: Flags [P.], cksum 0x0db9 (incorrect -> 0x04aa), seq 8708:12692, ack 874, win 512, options [nop,nop,TS val 1323173711 ecr 1323173697], length 3984
2022-02-28 13:07:09.487915 IP (tos 0x0, ttl 64, id 3804, offset 0, flags [DF], proto TCP (6), length 52)
    127.0.0.1.54282 > 127.0.0.1.9250: Flags [.], cksum 0xfe28 (incorrect -> 0xc921), seq 874, ack 12692, win 492, options [nop,nop,TS val 1323173711 ecr 1323173711], length 0
2022-02-28 13:07:09.489458 IP (tos 0x0, ttl 64, id 62489, offset 0, flags [DF], proto TCP (6), length 4100)
    127.0.0.1.9250 > 127.0.0.1.54282: Flags [P.], cksum 0x0df9 (incorrect -> 0x7c3c), seq 12692:16740, ack 874, win 512, options [nop,nop,TS val 1323173713 ecr 1323173711], length 4048
2022-02-28 13:07:09.489462 IP (tos 0x0, ttl 64, id 3805, offset 0, flags [DF], proto TCP (6), length 52)
    127.0.0.1.54282 > 127.0.0.1.9250: Flags [.], cksum 0xfe28 (incorrect -> 0xb94d), seq 874, ack 16740, win 492, options [nop,nop,TS val 1323173713 ecr 1323173713], length 0
2022-02-28 13:07:09.489467 IP (tos 0x0, ttl 64, id 62490, offset 0, flags [DF], proto TCP (6), length 3474)
    127.0.0.1.9250 > 127.0.0.1.54282: Flags [P.], cksum 0x0b87 (incorrect -> 0x519b), seq 16740:20162, ack 874, win 512, options [nop,nop,TS val 1323173713 ecr 1323173713], length 3422
2022-02-28 13:07:09.489469 IP (tos 0x0, ttl 64, id 3806, offset 0, flags [DF], proto TCP (6), length 52)
    127.0.0.1.54282 > 127.0.0.1.9250: Flags [.], cksum 0xfe28 (incorrect -> 0xabfd), seq 874, ack 20162, win 478, options [nop,nop,TS val 1323173713 ecr 1323173713], length 0
2022-02-28 13:07:09.489517 IP (tos 0x0, ttl 64, id 62491, offset 0, flags [DF], proto TCP (6), length 3576)
    127.0.0.1.9250 > 127.0.0.1.54282: Flags [P.], cksum 0x0bed (incorrect -> 0x3fa2), seq 20162:23686, ack 874, win 512, options [nop,nop,TS val 1323173713 ecr 1323173713], length 3524
2022-02-28 13:07:09.489519 IP (tos 0x0, ttl 64, id 3807, offset 0, flags [DF], proto TCP (6), length 52)
    127.0.0.1.54282 > 127.0.0.1.9250: Flags [.], cksum 0xfe28 (incorrect -> 0x9e46), seq 874, ack 23686, win 465, options [nop,nop,TS val 1323173713 ecr 1323173713], length 0
2022-02-28 13:07:09.489555 IP (tos 0x0, ttl 64, id 62492, offset 0, flags [DF], proto TCP (6), length 982)
    127.0.0.1.9250 > 127.0.0.1.54282: Flags [P.], cksum 0x01cb (incorrect -> 0x463a), seq 23686:24616, ack 874, win 512, options [nop,nop,TS val 1323173713 ecr 1323173713], length 930
2022-02-28 13:07:09.489557 IP (tos 0x0, ttl 64, id 3808, offset 0, flags [DF], proto TCP (6), length 52)
    127.0.0.1.54282 > 127.0.0.1.9250: Flags [.], cksum 0xfe28 (incorrect -> 0x9aa8), seq 874, ack 24616, win 461, options [nop,nop,TS val 1323173713 ecr 1323173713], length 0
2022-02-28 13:07:09.503144 IP (tos 0x0, ttl 64, id 62493, offset 0, flags [DF], proto TCP (6), length 3538)
    127.0.0.1.9250 > 127.0.0.1.54282: Flags [P.], cksum 0x0bc7 (incorrect -> 0x60f4), seq 24616:28102, ack 874, win 512, options [nop,nop,TS val 1323173726 ecr 1323173713], length 3486
2022-02-28 13:07:09.503152 IP (tos 0x0, ttl 64, id 3809, offset 0, flags [DF], proto TCP (6), length 52)
    127.0.0.1.54282 > 127.0.0.1.9250: Flags [.], cksum 0xfe28 (incorrect -> 0x8ccf), seq 874, ack 28102, win 494, options [nop,nop,TS val 1323173726 ecr 1323173726], length 0
2022-02-28 13:07:09.503224 IP (tos 0x0, ttl 64, id 62494, offset 0, flags [DF], proto TCP (6), length 3040)
    127.0.0.1.9250 > 127.0.0.1.54282: Flags [P.], cksum 0x09d5 (incorrect -> 0x7283), seq 28102:31090, ack 874, win 512, options [nop,nop,TS val 1323173726 ecr 1323173726], length 2988
2022-02-28 13:07:09.503227 IP (tos 0x0, ttl 64, id 3810, offset 0, flags [DF], proto TCP (6), length 52)
    127.0.0.1.54282 > 127.0.0.1.9250: Flags [.], cksum 0xfe28 (incorrect -> 0x8121), seq 874, ack 31090, win 496, options [nop,nop,TS val 1323173726 ecr 1323173726], length 0
2022-02-28 13:07:09.503849 IP (tos 0x0, ttl 64, id 62495, offset 0, flags [DF], proto TCP (6), length 3538)
    127.0.0.1.9250 > 127.0.0.1.54282: Flags [P.], cksum 0x0bc7 (incorrect -> 0xa0df), seq 31090:34576, ack 874, win 512, options [nop,nop,TS val 1323173727 ecr 1323173726], length 3486
2022-02-28 13:07:09.503861 IP (tos 0x0, ttl 64, id 3811, offset 0, flags [DF], proto TCP (6), length 52)
    127.0.0.1.54282 > 127.0.0.1.9250: Flags [.], cksum 0xfe28 (incorrect -> 0x7371), seq 874, ack 34576, win 512, options [nop,nop,TS val 1323173727 ecr 1323173727], length 0
2022-02-28 13:07:09.505420 IP (tos 0x0, ttl 64, id 62496, offset 0, flags [DF], proto TCP (6), length 4100)
    127.0.0.1.9250 > 127.0.0.1.54282: Flags [P.], cksum 0x0df9 (incorrect -> 0xf563), seq 34576:38624, ack 874, win 512, options [nop,nop,TS val 1323173728 ecr 1323173727], length 4048
2022-02-28 13:07:09.517903 IP (tos 0x0, ttl 64, id 62497, offset 0, flags [DF], proto TCP (6), length 32820)
    127.0.0.1.9250 > 127.0.0.1.54282: Flags [.], cksum 0x7e29 (incorrect -> 0x8c03), seq 38624:71392, ack 874, win 512, options [nop,nop,TS val 1323173741 ecr 1323173727], length 32768
2022-02-28 13:07:09.517933 IP (tos 0x0, ttl 64, id 3812, offset 0, flags [DF], proto TCP (6), length 52)
    127.0.0.1.54282 > 127.0.0.1.9250: Flags [.], cksum 0xfe28 (incorrect -> 0xe416), seq 874, ack 71392, win 379, options [nop,nop,TS val 1323173741 ecr 1323173728], length 0
2022-02-28 13:07:09.517938 IP (tos 0x0, ttl 64, id 62498, offset 0, flags [DF], proto TCP (6), length 6010)
    127.0.0.1.9250 > 127.0.0.1.54282: Flags [P.], cksum 0x156f (incorrect -> 0xa527), seq 71392:77350, ack 874, win 512, options [nop,nop,TS val 1323173741 ecr 1323173741], length 5958
2022-02-28 13:07:09.519345 IP (tos 0x0, ttl 64, id 3813, offset 0, flags [DF], proto TCP (6), length 52)
    127.0.0.1.54282 > 127.0.0.1.9250: Flags [.], cksum 0xfe28 (incorrect -> 0xcc3d), seq 874, ack 77350, win 512, options [nop,nop,TS val 1323173742 ecr 1323173741], length 0
2022-02-28 13:07:09.519476 IP (tos 0x0, ttl 64, id 62499, offset 0, flags [DF], proto TCP (6), length 3076)
    127.0.0.1.9250 > 127.0.0.1.54282: Flags [P.], cksum 0x09f9 (incorrect -> 0x8054), seq 77350:80374, ack 874, win 512, options [nop,nop,TS val 1323173743 ecr 1323173742], length 3024
2022-02-28 13:07:09.519488 IP (tos 0x0, ttl 64, id 3814, offset 0, flags [DF], proto TCP (6), length 52)
    127.0.0.1.54282 > 127.0.0.1.9250: Flags [.], cksum 0xfe28 (incorrect -> 0xc06a), seq 874, ack 80374, win 512, options [nop,nop,TS val 1323173743 ecr 1323173743], length 0
2022-02-28 13:07:09.519809 IP (tos 0x0, ttl 64, id 62500, offset 0, flags [DF], proto TCP (6), length 4100)
    127.0.0.1.9250 > 127.0.0.1.54282: Flags [P.], cksum 0x0df9 (incorrect -> 0x3a15), seq 80374:84422, ack 874, win 512, options [nop,nop,TS val 1323173743 ecr 1323173743], length 4048
2022-02-28 13:07:09.519824 IP (tos 0x0, ttl 64, id 3815, offset 0, flags [DF], proto TCP (6), length 52)
    127.0.0.1.54282 > 127.0.0.1.9250: Flags [.], cksum 0xfe28 (incorrect -> 0xb09a), seq 874, ack 84422, win 512, options [nop,nop,TS val 1323173743 ecr 1323173743], length 0
2022-02-28 13:07:09.519828 IP (tos 0x0, ttl 64, id 62501, offset 0, flags [DF], proto TCP (6), length 3972)
    127.0.0.1.9250 > 127.0.0.1.54282: Flags [P.], cksum 0x0d79 (incorrect -> 0x072a), seq 84422:88342, ack 874, win 512, options [nop,nop,TS val 1323173743 ecr 1323173743], length 3920
2022-02-28 13:07:09.520377 IP (tos 0x0, ttl 64, id 3816, offset 0, flags [DF], proto TCP (6), length 52)
    127.0.0.1.54282 > 127.0.0.1.9250: Flags [.], cksum 0xfe28 (incorrect -> 0xa14a), seq 874, ack 88342, win 512, options [nop,nop,TS val 1323173743 ecr 1323173743], length 0
2022-02-28 13:07:09.520601 IP (tos 0x0, ttl 64, id 62502, offset 0, flags [DF], proto TCP (6), length 1546)
    127.0.0.1.9250 > 127.0.0.1.54282: Flags [P.], cksum 0x03ff (incorrect -> 0x230b), seq 88342:89836, ack 874, win 512, options [nop,nop,TS val 1323173744 ecr 1323173743], length 1494
2022-02-28 13:07:09.520612 IP (tos 0x0, ttl 64, id 3817, offset 0, flags [DF], proto TCP (6), length 52)
    127.0.0.1.54282 > 127.0.0.1.9250: Flags [.], cksum 0xfe28 (incorrect -> 0x9b72), seq 874, ack 89836, win 512, options [nop,nop,TS val 1323173744 ecr 1323173744], length 0
2022-02-28 13:07:09.520827 IP (tos 0x0, ttl 64, id 62503, offset 0, flags [DF], proto TCP (6), length 4100)
    127.0.0.1.9250 > 127.0.0.1.54282: Flags [P.], cksum 0x0df9 (incorrect -> 0x2315), seq 89836:93884, ack 874, win 512, options [nop,nop,TS val 1323173744 ecr 1323173744], length 4048
2022-02-28 13:07:09.520889 IP (tos 0x0, ttl 64, id 3818, offset 0, flags [DF], proto TCP (6), length 52)
    127.0.0.1.54282 > 127.0.0.1.9250: Flags [.], cksum 0xfe28 (incorrect -> 0x8ba2), seq 874, ack 93884, win 512, options [nop,nop,TS val 1323173744 ecr 1323173744], length 0
2022-02-28 13:07:09.520896 IP (tos 0x0, ttl 64, id 62504, offset 0, flags [DF], proto TCP (6), length 9588)
    127.0.0.1.9250 > 127.0.0.1.54282: Flags [P.], cksum 0x2369 (incorrect -> 0x8f65), seq 93884:103420, ack 874, win 512, options [nop,nop,TS val 1323173744 ecr 1323173744], length 9536
2022-02-28 13:07:09.520899 IP (tos 0x0, ttl 64, id 3819, offset 0, flags [DF], proto TCP (6), length 52)
    127.0.0.1.54282 > 127.0.0.1.9250: Flags [.], cksum 0xfe28 (incorrect -> 0x6662), seq 874, ack 103420, win 512, options [nop,nop,TS val 1323173744 ecr 1323173744], length 0
2022-02-28 13:07:09.529743 IP (tos 0x0, ttl 64, id 62505, offset 0, flags [DF], proto TCP (6), length 4036)
    127.0.0.1.9250 > 127.0.0.1.54282: Flags [P.], cksum 0x0db9 (incorrect -> 0xd650), seq 103420:107404, ack 874, win 512, options [nop,nop,TS val 1323173753 ecr 1323173744], length 3984
2022-02-28 13:07:09.529958 IP (tos 0x0, ttl 64, id 3820, offset 0, flags [DF], proto TCP (6), length 52)
    127.0.0.1.54282 > 127.0.0.1.9250: Flags [.], cksum 0xfe28 (incorrect -> 0x56c0), seq 874, ack 107404, win 512, options [nop,nop,TS val 1323173753 ecr 1323173753], length 0
2022-02-28 13:07:09.531057 IP (tos 0x0, ttl 64, id 62506, offset 0, flags [DF], proto TCP (6), length 3742)
    127.0.0.1.9250 > 127.0.0.1.54282: Flags [P.], cksum 0x0c93 (incorrect -> 0x4789), seq 107404:111094, ack 874, win 512, options [nop,nop,TS val 1323173754 ecr 1323173753], length 3690
2022-02-28 13:07:09.531061 IP (tos 0x0, ttl 64, id 3821, offset 0, flags [DF], proto TCP (6), length 52)
    127.0.0.1.54282 > 127.0.0.1.9250: Flags [.], cksum 0xfe28 (incorrect -> 0x4455), seq 874, ack 111094, win 1535, options [nop,nop,TS val 1323173754 ecr 1323173754], length 0
2022-02-28 13:07:09.531174 IP (tos 0x0, ttl 64, id 62507, offset 0, flags [DF], proto TCP (6), length 4100)
    127.0.0.1.9250 > 127.0.0.1.54282: Flags [P.], cksum 0x0df9 (incorrect -> 0x8d13), seq 111094:115142, ack 874, win 512, options [nop,nop,TS val 1323173754 ecr 1323173754], length 4048
2022-02-28 13:07:09.531178 IP (tos 0x0, ttl 64, id 3822, offset 0, flags [DF], proto TCP (6), length 52)
    127.0.0.1.54282 > 127.0.0.1.9250: Flags [.], cksum 0xfe28 (incorrect -> 0x3085), seq 874, ack 115142, win 2559, options [nop,nop,TS val 1323173754 ecr 1323173754], length 0
2022-02-28 13:07:09.531181 IP (tos 0x0, ttl 64, id 62508, offset 0, flags [DF], proto TCP (6), length 354)
    127.0.0.1.9250 > 127.0.0.1.54282: Flags [P.], cksum 0xff56 (incorrect -> 0xf3e5), seq 115142:115444, ack 874, win 512, options [nop,nop,TS val 1323173754 ecr 1323173754], length 302
2022-02-28 13:07:09.531183 IP (tos 0x0, ttl 64, id 3823, offset 0, flags [DF], proto TCP (6), length 52)
    127.0.0.1.54282 > 127.0.0.1.9250: Flags [.], cksum 0xfe28 (incorrect -> 0x2d57), seq 874, ack 115444, win 3071, options [nop,nop,TS val 1323173754 ecr 1323173754], length 0
2022-02-28 13:07:09.531207 IP (tos 0x0, ttl 64, id 62509, offset 0, flags [DF], proto TCP (6), length 3538)
    127.0.0.1.9250 > 127.0.0.1.54282: Flags [P.], cksum 0x0bc7 (incorrect -> 0x791b), seq 115444:118930, ack 874, win 512, options [nop,nop,TS val 1323173754 ecr 1323173754], length 3486
2022-02-28 13:07:09.531209 IP (tos 0x0, ttl 64, id 3824, offset 0, flags [DF], proto TCP (6), length 52)
    127.0.0.1.54282 > 127.0.0.1.9250: Flags [.], cksum 0xfe28 (incorrect -> 0x1bba), seq 874, ack 118930, win 4094, options [nop,nop,TS val 1323173754 ecr 1323173754], length 0
2022-02-28 13:07:09.531523 IP (tos 0x0, ttl 64, id 62510, offset 0, flags [DF], proto TCP (6), length 1048)
    127.0.0.1.9250 > 127.0.0.1.54282: Flags [P.], cksum 0x020d (incorrect -> 0xdbb2), seq 118930:119926, ack 874, win 512, options [nop,nop,TS val 1323173755 ecr 1323173754], length 996
2022-02-28 13:07:09.531526 IP (tos 0x0, ttl 64, id 3825, offset 0, flags [DF], proto TCP (6), length 52)
    127.0.0.1.54282 > 127.0.0.1.9250: Flags [.], cksum 0xfe28 (incorrect -> 0x15d4), seq 874, ack 119926, win 4606, options [nop,nop,TS val 1323173755 ecr 1323173755], length 0
2022-02-28 13:07:09.531697 IP (tos 0x0, ttl 64, id 62511, offset 0, flags [DF], proto TCP (6), length 4100)
    127.0.0.1.9250 > 127.0.0.1.54282: Flags [P.], cksum 0x0df9 (incorrect -> 0xfaca), seq 119926:123974, ack 874, win 512, options [nop,nop,TS val 1323173755 ecr 1323173755], length 4048
2022-02-28 13:07:09.531701 IP (tos 0x0, ttl 64, id 3826, offset 0, flags [DF], proto TCP (6), length 52)
    127.0.0.1.54282 > 127.0.0.1.9250: Flags [.], cksum 0xfe28 (incorrect -> 0x0205), seq 874, ack 123974, win 5629, options [nop,nop,TS val 1323173755 ecr 1323173755], length 0
2022-02-28 13:07:09.531705 IP (tos 0x0, ttl 64, id 62512, offset 0, flags [DF], proto TCP (6), length 486)
    127.0.0.1.9250 > 127.0.0.1.54282: Flags [P.], cksum 0xffda (incorrect -> 0x9509), seq 123974:124408, ack 874, win 512, options [nop,nop,TS val 1323173755 ecr 1323173755], length 434
2022-02-28 13:07:09.531707 IP (tos 0x0, ttl 64, id 3827, offset 0, flags [DF], proto TCP (6), length 52)
    127.0.0.1.54282 > 127.0.0.1.9250: Flags [.], cksum 0xfe28 (incorrect -> 0xfe52), seq 874, ack 124408, win 6141, options [nop,nop,TS val 1323173755 ecr 1323173755], length 0
200, 123.20484614372253, 0.2762110233306885