2022-02-28 00:47:42.438689 IP (tos 0x0, ttl 64, id 33471, offset 0, flags [DF], proto TCP (6), length 60)
    127.0.0.1.57420 > 127.0.0.1.11350: Flags [S], cksum 0xfe30 (incorrect -> 0xf485), seq 914145693, win 65495, options [mss 65495,sackOK,TS val 1278806662 ecr 0,nop,wscale 7], length 0
2022-02-28 00:47:42.438708 IP (tos 0x0, ttl 64, id 0, offset 0, flags [DF], proto TCP (6), length 60)
    127.0.0.1.11350 > 127.0.0.1.57420: Flags [S.], cksum 0xfe30 (incorrect -> 0xc0bf), seq 3455848197, ack 914145694, win 65483, options [mss 65495,sackOK,TS val 1278806662 ecr 1278806662,nop,wscale 7], length 0
2022-02-28 00:47:42.438723 IP (tos 0x0, ttl 64, id 33472, offset 0, flags [DF], proto TCP (6), length 52)
    127.0.0.1.57420 > 127.0.0.1.11350: Flags [.], cksum 0xfe28 (incorrect -> 0xe77b), seq 1, ack 1, win 512, options [nop,nop,TS val 1278806662 ecr 1278806662], length 0
2022-02-28 00:47:42.438853 IP (tos 0x0, ttl 64, id 33473, offset 0, flags [DF], proto TCP (6), length 55)
    127.0.0.1.57420 > 127.0.0.1.11350: Flags [P.], cksum 0xfe2b (incorrect -> 0xe26f), seq 1:4, ack 1, win 512, options [nop,nop,TS val 1278806662 ecr 1278806662], length 3
2022-02-28 00:47:42.438867 IP (tos 0x0, ttl 64, id 7928, offset 0, flags [DF], proto TCP (6), length 52)
    127.0.0.1.11350 > 127.0.0.1.57420: Flags [.], cksum 0xfe28 (incorrect -> 0xe778), seq 1, ack 4, win 512, options [nop,nop,TS val 1278806662 ecr 1278806662], length 0
2022-02-28 00:47:42.438902 IP (tos 0x0, ttl 64, id 7929, offset 0, flags [DF], proto TCP (6), length 54)
    127.0.0.1.11350 > 127.0.0.1.57420: Flags [P.], cksum 0xfe2a (incorrect -> 0xe26e), seq 1:3, ack 4, win 512, options [nop,nop,TS val 1278806662 ecr 1278806662], length 2
2022-02-28 00:47:42.438915 IP (tos 0x0, ttl 64, id 33474, offset 0, flags [DF], proto TCP (6), length 52)
    127.0.0.1.57420 > 127.0.0.1.11350: Flags [.], cksum 0xfe28 (incorrect -> 0xe776), seq 4, ack 3, win 512, options [nop,nop,TS val 1278806662 ecr 1278806662], length 0
2022-02-28 00:47:42.451210 IP (tos 0x0, ttl 64, id 33475, offset 0, flags [DF], proto TCP (6), length 62)
    127.0.0.1.57420 > 127.0.0.1.11350: Flags [P.], cksum 0xfe32 (incorrect -> 0xd94c), seq 4:14, ack 3, win 512, options [nop,nop,TS val 1278806674 ecr 1278806662], length 10
2022-02-28 00:47:42.451231 IP (tos 0x0, ttl 64, id 7930, offset 0, flags [DF], proto TCP (6), length 52)
    127.0.0.1.11350 > 127.0.0.1.57420: Flags [.], cksum 0xfe28 (incorrect -> 0xe754), seq 3, ack 14, win 512, options [nop,nop,TS val 1278806674 ecr 1278806674], length 0
2022-02-28 00:47:42.553351 IP (tos 0x0, ttl 64, id 7931, offset 0, flags [DF], proto TCP (6), length 62)
    127.0.0.1.11350 > 127.0.0.1.57420: Flags [P.], cksum 0xfe32 (incorrect -> 0xe1db), seq 3:13, ack 14, win 512, options [nop,nop,TS val 1278806776 ecr 1278806674], length 10
2022-02-28 00:47:42.553357 IP (tos 0x0, ttl 64, id 33476, offset 0, flags [DF], proto TCP (6), length 52)
    127.0.0.1.57420 > 127.0.0.1.11350: Flags [.], cksum 0xfe28 (incorrect -> 0xe67e), seq 14, ack 13, win 512, options [nop,nop,TS val 1278806776 ecr 1278806776], length 0
2022-02-28 00:47:42.559881 IP (tos 0x0, ttl 64, id 33477, offset 0, flags [DF], proto TCP (6), length 569)
    127.0.0.1.57420 > 127.0.0.1.11350: Flags [P.], cksum 0x002e (incorrect -> 0xef9d), seq 14:531, ack 13, win 512, options [nop,nop,TS val 1278806783 ecr 1278806776], length 517
2022-02-28 00:47:42.559899 IP (tos 0x0, ttl 64, id 7932, offset 0, flags [DF], proto TCP (6), length 52)
    127.0.0.1.11350 > 127.0.0.1.57420: Flags [.], cksum 0xfe28 (incorrect -> 0xe46f), seq 13, ack 531, win 508, options [nop,nop,TS val 1278806783 ecr 1278806783], length 0
200, 123.41610980033875, 0.5423190593719482