2022-02-28 03:31:02.988639 IP (tos 0x0, ttl 64, id 42903, offset 0, flags [DF], proto TCP (6), length 60)
    127.0.0.1.46162 > 127.0.0.1.11750: Flags [S], cksum 0xfe30 (incorrect -> 0x552c), seq 187312824, win 65495, options [mss 65495,sackOK,TS val 1288607212 ecr 0,nop,wscale 7], length 0
2022-02-28 03:31:02.988653 IP (tos 0x0, ttl 64, id 0, offset 0, flags [DF], proto TCP (6), length 60)
    127.0.0.1.11750 > 127.0.0.1.46162: Flags [S.], cksum 0xfe30 (incorrect -> 0x0483), seq 65563137, ack 187312825, win 65483, options [mss 65495,sackOK,TS val 1288607212 ecr 1288607212,nop,wscale 7], length 0
2022-02-28 03:31:02.988664 IP (tos 0x0, ttl 64, id 42904, offset 0, flags [DF], proto TCP (6), length 52)
    127.0.0.1.46162 > 127.0.0.1.11750: Flags [.], cksum 0xfe28 (incorrect -> 0x2b3f), seq 1, ack 1, win 512, options [nop,nop,TS val 1288607212 ecr 1288607212], length 0
2022-02-28 03:31:02.988837 IP (tos 0x0, ttl 64, id 42905, offset 0, flags [DF], proto TCP (6), length 55)
    127.0.0.1.46162 > 127.0.0.1.11750: Flags [P.], cksum 0xfe2b (incorrect -> 0x2633), seq 1:4, ack 1, win 512, options [nop,nop,TS val 1288607212 ecr 1288607212], length 3
2022-02-28 03:31:02.988846 IP (tos 0x0, ttl 64, id 48138, offset 0, flags [DF], proto TCP (6), length 52)
    127.0.0.1.11750 > 127.0.0.1.46162: Flags [.], cksum 0xfe28 (incorrect -> 0x2b3c), seq 1, ack 4, win 512, options [nop,nop,TS val 1288607212 ecr 1288607212], length 0
2022-02-28 03:31:02.988870 IP (tos 0x0, ttl 64, id 48139, offset 0, flags [DF], proto TCP (6), length 54)
    127.0.0.1.11750 > 127.0.0.1.46162: Flags [P.], cksum 0xfe2a (incorrect -> 0x2632), seq 1:3, ack 4, win 512, options [nop,nop,TS val 1288607212 ecr 1288607212], length 2
2022-02-28 03:31:02.988879 IP (tos 0x0, ttl 64, id 42906, offset 0, flags [DF], proto TCP (6), length 52)
    127.0.0.1.46162 > 127.0.0.1.11750: Flags [.], cksum 0xfe28 (incorrect -> 0x2b3a), seq 4, ack 3, win 512, options [nop,nop,TS val 1288607212 ecr 1288607212], length 0
2022-02-28 03:31:02.990485 IP (tos 0x0, ttl 64, id 42907, offset 0, flags [DF], proto TCP (6), length 62)
    127.0.0.1.46162 > 127.0.0.1.11750: Flags [P.], cksum 0xfe32 (incorrect -> 0x9250), seq 4:14, ack 3, win 512, options [nop,nop,TS val 1288607214 ecr 1288607212], length 10
2022-02-28 03:31:02.990496 IP (tos 0x0, ttl 64, id 48140, offset 0, flags [DF], proto TCP (6), length 52)
    127.0.0.1.11750 > 127.0.0.1.46162: Flags [.], cksum 0xfe28 (incorrect -> 0x2b2c), seq 3, ack 14, win 512, options [nop,nop,TS val 1288607214 ecr 1288607214], length 0
2022-02-28 03:31:03.223988 IP (tos 0x0, ttl 64, id 48141, offset 0, flags [DF], proto TCP (6), length 62)
    127.0.0.1.11750 > 127.0.0.1.46162: Flags [P.], cksum 0xfe32 (incorrect -> 0x2530), seq 3:13, ack 14, win 512, options [nop,nop,TS val 1288607447 ecr 1288607214], length 10
2022-02-28 03:31:03.223999 IP (tos 0x0, ttl 64, id 42908, offset 0, flags [DF], proto TCP (6), length 52)
    127.0.0.1.46162 > 127.0.0.1.11750: Flags [.], cksum 0xfe28 (incorrect -> 0x2950), seq 14, ack 13, win 512, options [nop,nop,TS val 1288607447 ecr 1288607447], length 0
2022-02-28 03:31:03.229482 IP (tos 0x0, ttl 64, id 42909, offset 0, flags [DF], proto TCP (6), length 569)
    127.0.0.1.46162 > 127.0.0.1.11750: Flags [P.], cksum 0x002e (incorrect -> 0x13c5), seq 14:531, ack 13, win 512, options [nop,nop,TS val 1288607453 ecr 1288607447], length 517
2022-02-28 03:31:03.229495 IP (tos 0x0, ttl 64, id 48142, offset 0, flags [DF], proto TCP (6), length 52)
    127.0.0.1.11750 > 127.0.0.1.46162: Flags [.], cksum 0xfe28 (incorrect -> 0x2743), seq 13, ack 531, win 508, options [nop,nop,TS val 1288607453 ecr 1288607453], length 0
2022-02-28 03:31:03.462610 IP (tos 0x0, ttl 64, id 48143, offset 0, flags [DF], proto TCP (6), length 3538)
    127.0.0.1.11750 > 127.0.0.1.46162: Flags [P.], cksum 0x0bc7 (incorrect -> 0xe20f), seq 13:3499, ack 531, win 512, options [nop,nop,TS val 1288607686 ecr 1288607453], length 3486
2022-02-28 03:31:03.462620 IP (tos 0x0, ttl 64, id 42910, offset 0, flags [DF], proto TCP (6), length 52)
    127.0.0.1.46162 > 127.0.0.1.11750: Flags [.], cksum 0xfe28 (incorrect -> 0x17e1), seq 531, ack 3499, win 494, options [nop,nop,TS val 1288607686 ecr 1288607686], length 0
2022-02-28 03:31:03.580775 IP (tos 0x0, ttl 64, id 48144, offset 0, flags [DF], proto TCP (6), length 1838)
    127.0.0.1.11750 > 127.0.0.1.46162: Flags [P.], cksum 0x0523 (incorrect -> 0x500b), seq 3499:5285, ack 531, win 512, options [nop,nop,TS val 1288607804 ecr 1288607686], length 1786
2022-02-28 03:31:03.580785 IP (tos 0x0, ttl 64, id 42911, offset 0, flags [DF], proto TCP (6), length 52)
    127.0.0.1.46162 > 127.0.0.1.11750: Flags [.], cksum 0xfe28 (incorrect -> 0x0ff4), seq 531, ack 5285, win 501, options [nop,nop,TS val 1288607804 ecr 1288607804], length 0
2022-02-28 03:31:03.583267 IP (tos 0x0, ttl 64, id 42912, offset 0, flags [DF], proto TCP (6), length 210)
    127.0.0.1.46162 > 127.0.0.1.11750: Flags [P.], cksum 0xfec6 (incorrect -> 0xb861), seq 531:689, ack 5285, win 512, options [nop,nop,TS val 1288607806 ecr 1288607804], length 158
2022-02-28 03:31:03.583279 IP (tos 0x0, ttl 64, id 48145, offset 0, flags [DF], proto TCP (6), length 52)
    127.0.0.1.11750 > 127.0.0.1.46162: Flags [.], cksum 0xfe28 (incorrect -> 0x0f48), seq 5285, ack 689, win 511, options [nop,nop,TS val 1288607806 ecr 1288607806], length 0
2022-02-28 03:31:03.816238 IP (tos 0x0, ttl 64, id 48146, offset 0, flags [DF], proto TCP (6), length 378)
    127.0.0.1.11750 > 127.0.0.1.46162: Flags [P.], cksum 0xff6e (incorrect -> 0x96d3), seq 5285:5611, ack 689, win 512, options [nop,nop,TS val 1288608039 ecr 1288607806], length 326
2022-02-28 03:31:03.816258 IP (tos 0x0, ttl 64, id 42913, offset 0, flags [DF], proto TCP (6), length 52)
    127.0.0.1.46162 > 127.0.0.1.11750: Flags [.], cksum 0xfe28 (incorrect -> 0x0c31), seq 689, ack 5611, win 510, options [nop,nop,TS val 1288608039 ecr 1288608039], length 0
2022-02-28 03:31:03.816969 IP (tos 0x0, ttl 64, id 42914, offset 0, flags [DF], proto TCP (6), length 352)
    127.0.0.1.46162 > 127.0.0.1.11750: Flags [P.], cksum 0xff54 (incorrect -> 0x37f3), seq 689:989, ack 5611, win 512, options [nop,nop,TS val 1288608040 ecr 1288608039], length 300
2022-02-28 03:31:03.816979 IP (tos 0x0, ttl 64, id 48147, offset 0, flags [DF], proto TCP (6), length 52)
    127.0.0.1.11750 > 127.0.0.1.46162: Flags [.], cksum 0xfe28 (incorrect -> 0x0b03), seq 5611, ack 989, win 510, options [nop,nop,TS val 1288608040 ecr 1288608040], length 0
2022-02-28 03:31:04.106451 IP (tos 0x0, ttl 64, id 48148, offset 0, flags [DF], proto TCP (6), length 3538)
    127.0.0.1.11750 > 127.0.0.1.46162: Flags [P.], cksum 0x0bc7 (incorrect -> 0x4d11), seq 5611:9097, ack 989, win 512, options [nop,nop,TS val 1288608330 ecr 1288608040], length 3486
2022-02-28 03:31:04.150154 IP (tos 0x0, ttl 64, id 42915, offset 0, flags [DF], proto TCP (6), length 52)
    127.0.0.1.46162 > 127.0.0.1.11750: Flags [.], cksum 0xfe28 (incorrect -> 0xfaf3), seq 989, ack 9097, win 512, options [nop,nop,TS val 1288608373 ecr 1288608330], length 0
2022-02-28 03:31:04.150728 IP (tos 0x0, ttl 64, id 48149, offset 0, flags [DF], proto TCP (6), length 3538)
    127.0.0.1.11750 > 127.0.0.1.46162: Flags [P.], cksum 0x0bc7 (incorrect -> 0x3f26), seq 9097:12583, ack 989, win 512, options [nop,nop,TS val 1288608374 ecr 1288608373], length 3486
2022-02-28 03:31:04.150735 IP (tos 0x0, ttl 64, id 42916, offset 0, flags [DF], proto TCP (6), length 52)
    127.0.0.1.46162 > 127.0.0.1.11750: Flags [.], cksum 0xfe28 (incorrect -> 0xed3a), seq 989, ack 12583, win 494, options [nop,nop,TS val 1288608374 ecr 1288608374], length 0
2022-02-28 03:31:04.161245 IP (tos 0x0, ttl 64, id 48150, offset 0, flags [DF], proto TCP (6), length 1477)
    127.0.0.1.11750 > 127.0.0.1.46162: Flags [P.], cksum 0x03ba (incorrect -> 0x2e17), seq 12583:14008, ack 989, win 512, options [nop,nop,TS val 1288608384 ecr 1288608374], length 1425
2022-02-28 03:31:04.161260 IP (tos 0x0, ttl 64, id 42917, offset 0, flags [DF], proto TCP (6), length 52)
    127.0.0.1.46162 > 127.0.0.1.11750: Flags [.], cksum 0xfe28 (incorrect -> 0xe78d), seq 989, ack 14008, win 502, options [nop,nop,TS val 1288608384 ecr 1288608384], length 0
2022-02-28 03:31:04.194036 IP (tos 0x0, ttl 64, id 48151, offset 0, flags [DF], proto TCP (6), length 3040)
    127.0.0.1.11750 > 127.0.0.1.46162: Flags [P.], cksum 0x09d5 (incorrect -> 0xb7b0), seq 14008:16996, ack 989, win 512, options [nop,nop,TS val 1288608417 ecr 1288608384], length 2988
2022-02-28 03:31:04.194046 IP (tos 0x0, ttl 64, id 42918, offset 0, flags [DF], proto TCP (6), length 52)
    127.0.0.1.46162 > 127.0.0.1.11750: Flags [.], cksum 0xfe28 (incorrect -> 0xdba5), seq 989, ack 16996, win 496, options [nop,nop,TS val 1288608417 ecr 1288608417], length 0
200, 3.958226203918457, 1.3877060413360596