2022-02-28 10:35:39.623374 IP (tos 0x0, ttl 64, id 50930, offset 0, flags [DF], proto TCP (6), length 60)
    127.0.0.1.45454 > 127.0.0.1.10150: Flags [S], cksum 0xfe30 (incorrect -> 0x242d), seq 3194876376, win 65495, options [mss 65495,sackOK,TS val 1314083846 ecr 0,nop,wscale 7], length 0
2022-02-28 10:35:39.623382 IP (tos 0x0, ttl 64, id 0, offset 0, flags [DF], proto TCP (6), length 60)
    127.0.0.1.10150 > 127.0.0.1.45454: Flags [S.], cksum 0xfe30 (incorrect -> 0x6272), seq 442762488, ack 3194876377, win 65483, options [mss 65495,sackOK,TS val 1314083846 ecr 1314083846,nop,wscale 7], length 0
2022-02-28 10:35:39.623389 IP (tos 0x0, ttl 64, id 50931, offset 0, flags [DF], proto TCP (6), length 52)
    127.0.0.1.45454 > 127.0.0.1.10150: Flags [.], cksum 0xfe28 (incorrect -> 0x892e), seq 1, ack 1, win 512, options [nop,nop,TS val 1314083846 ecr 1314083846], length 0
2022-02-28 10:35:39.623502 IP (tos 0x0, ttl 64, id 50932, offset 0, flags [DF], proto TCP (6), length 55)
    127.0.0.1.45454 > 127.0.0.1.10150: Flags [P.], cksum 0xfe2b (incorrect -> 0x8421), seq 1:4, ack 1, win 512, options [nop,nop,TS val 1314083847 ecr 1314083846], length 3
2022-02-28 10:35:39.623515 IP (tos 0x0, ttl 64, id 31753, offset 0, flags [DF], proto TCP (6), length 52)
    127.0.0.1.10150 > 127.0.0.1.45454: Flags [.], cksum 0xfe28 (incorrect -> 0x8929), seq 1, ack 4, win 512, options [nop,nop,TS val 1314083847 ecr 1314083847], length 0
2022-02-28 10:35:39.623549 IP (tos 0x0, ttl 64, id 31754, offset 0, flags [DF], proto TCP (6), length 54)
    127.0.0.1.10150 > 127.0.0.1.45454: Flags [P.], cksum 0xfe2a (incorrect -> 0x841f), seq 1:3, ack 4, win 512, options [nop,nop,TS val 1314083847 ecr 1314083847], length 2
2022-02-28 10:35:39.623560 IP (tos 0x0, ttl 64, id 50933, offset 0, flags [DF], proto TCP (6), length 52)
    127.0.0.1.45454 > 127.0.0.1.10150: Flags [.], cksum 0xfe28 (incorrect -> 0x8927), seq 4, ack 3, win 512, options [nop,nop,TS val 1314083847 ecr 1314083847], length 0
2022-02-28 10:35:39.625110 IP (tos 0x0, ttl 64, id 50934, offset 0, flags [DF], proto TCP (6), length 62)
    127.0.0.1.45454 > 127.0.0.1.10150: Flags [P.], cksum 0xfe32 (incorrect -> 0xb20c), seq 4:14, ack 3, win 512, options [nop,nop,TS val 1314083848 ecr 1314083847], length 10
2022-02-28 10:35:39.625126 IP (tos 0x0, ttl 64, id 31755, offset 0, flags [DF], proto TCP (6), length 52)
    127.0.0.1.10150 > 127.0.0.1.45454: Flags [.], cksum 0xfe28 (incorrect -> 0x891b), seq 3, ack 14, win 512, options [nop,nop,TS val 1314083848 ecr 1314083848], length 0
200, 5.76826810836792, 0.8501391410827637