2022-02-28 11:55:31.656523 IP (tos 0x0, ttl 64, id 26395, offset 0, flags [DF], proto TCP (6), length 60)
    127.0.0.1.51358 > 127.0.0.1.9350: Flags [S], cksum 0xfe30 (incorrect -> 0x2536), seq 1390618943, win 65495, options [mss 65495,sackOK,TS val 1318875880 ecr 0,nop,wscale 7], length 0
2022-02-28 11:55:31.656540 IP (tos 0x0, ttl 64, id 0, offset 0, flags [DF], proto TCP (6), length 60)
    127.0.0.1.9350 > 127.0.0.1.51358: Flags [S.], cksum 0xfe30 (incorrect -> 0xbe33), seq 2591427330, ack 1390618944, win 65483, options [mss 65495,sackOK,TS val 1318875880 ecr 1318875880,nop,wscale 7], length 0
2022-02-28 11:55:31.656554 IP (tos 0x0, ttl 64, id 26396, offset 0, flags [DF], proto TCP (6), length 52)
    127.0.0.1.51358 > 127.0.0.1.9350: Flags [.], cksum 0xfe28 (incorrect -> 0xe4ef), seq 1, ack 1, win 512, options [nop,nop,TS val 1318875880 ecr 1318875880], length 0
2022-02-28 11:55:31.656678 IP (tos 0x0, ttl 64, id 26397, offset 0, flags [DF], proto TCP (6), length 55)
    127.0.0.1.51358 > 127.0.0.1.9350: Flags [P.], cksum 0xfe2b (incorrect -> 0xdfe3), seq 1:4, ack 1, win 512, options [nop,nop,TS val 1318875880 ecr 1318875880], length 3
2022-02-28 11:55:31.656691 IP (tos 0x0, ttl 64, id 3136, offset 0, flags [DF], proto TCP (6), length 52)
    127.0.0.1.9350 > 127.0.0.1.51358: Flags [.], cksum 0xfe28 (incorrect -> 0xe4ec), seq 1, ack 4, win 512, options [nop,nop,TS val 1318875880 ecr 1318875880], length 0
2022-02-28 11:55:31.656762 IP (tos 0x0, ttl 64, id 3137, offset 0, flags [DF], proto TCP (6), length 54)
    127.0.0.1.9350 > 127.0.0.1.51358: Flags [P.], cksum 0xfe2a (incorrect -> 0xdfe2), seq 1:3, ack 4, win 512, options [nop,nop,TS val 1318875880 ecr 1318875880], length 2
2022-02-28 11:55:31.656783 IP (tos 0x0, ttl 64, id 26398, offset 0, flags [DF], proto TCP (6), length 52)
    127.0.0.1.51358 > 127.0.0.1.9350: Flags [.], cksum 0xfe28 (incorrect -> 0xe4ea), seq 4, ack 3, win 512, options [nop,nop,TS val 1318875880 ecr 1318875880], length 0
2022-02-28 11:55:31.668680 IP (tos 0x0, ttl 64, id 26399, offset 0, flags [DF], proto TCP (6), length 62)
    127.0.0.1.51358 > 127.0.0.1.9350: Flags [P.], cksum 0xfe32 (incorrect -> 0xa338), seq 4:14, ack 3, win 512, options [nop,nop,TS val 1318875892 ecr 1318875880], length 10
2022-02-28 11:55:31.668688 IP (tos 0x0, ttl 64, id 3138, offset 0, flags [DF], proto TCP (6), length 52)
    127.0.0.1.9350 > 127.0.0.1.51358: Flags [.], cksum 0xfe28 (incorrect -> 0xe4c8), seq 3, ack 14, win 512, options [nop,nop,TS val 1318875892 ecr 1318875892], length 0
2022-02-28 11:55:31.704767 IP (tos 0x0, ttl 64, id 3139, offset 0, flags [DF], proto TCP (6), length 62)
    127.0.0.1.9350 > 127.0.0.1.51358: Flags [P.], cksum 0xfe32 (incorrect -> 0xdf91), seq 3:13, ack 14, win 512, options [nop,nop,TS val 1318875928 ecr 1318875892], length 10
2022-02-28 11:55:31.704773 IP (tos 0x0, ttl 64, id 26400, offset 0, flags [DF], proto TCP (6), length 52)
    127.0.0.1.51358 > 127.0.0.1.9350: Flags [.], cksum 0xfe28 (incorrect -> 0xe476), seq 14, ack 13, win 512, options [nop,nop,TS val 1318875928 ecr 1318875928], length 0
2022-02-28 11:55:31.710419 IP (tos 0x0, ttl 64, id 26401, offset 0, flags [DF], proto TCP (6), length 569)
    127.0.0.1.51358 > 127.0.0.1.9350: Flags [P.], cksum 0x002e (incorrect -> 0x6b81), seq 14:531, ack 13, win 512, options [nop,nop,TS val 1318875933 ecr 1318875928], length 517
2022-02-28 11:55:31.710435 IP (tos 0x0, ttl 64, id 3140, offset 0, flags [DF], proto TCP (6), length 52)
    127.0.0.1.9350 > 127.0.0.1.51358: Flags [.], cksum 0xfe28 (incorrect -> 0xe26b), seq 13, ack 531, win 508, options [nop,nop,TS val 1318875933 ecr 1318875933], length 0
2022-02-28 11:55:31.749239 IP (tos 0x0, ttl 64, id 3141, offset 0, flags [DF], proto TCP (6), length 3538)
    127.0.0.1.9350 > 127.0.0.1.51358: Flags [P.], cksum 0x0bc7 (incorrect -> 0x3e4c), seq 13:3499, ack 531, win 512, options [nop,nop,TS val 1318875972 ecr 1318875933], length 3486
2022-02-28 11:55:31.749255 IP (tos 0x0, ttl 64, id 26402, offset 0, flags [DF], proto TCP (6), length 52)
    127.0.0.1.51358 > 127.0.0.1.9350: Flags [.], cksum 0xfe28 (incorrect -> 0xd48d), seq 531, ack 3499, win 494, options [nop,nop,TS val 1318875972 ecr 1318875972], length 0
2022-02-28 11:55:31.758970 IP (tos 0x0, ttl 64, id 3142, offset 0, flags [DF], proto TCP (6), length 662)
    127.0.0.1.9350 > 127.0.0.1.51358: Flags [P.], cksum 0x008b (incorrect -> 0x2f2e), seq 3499:4109, ack 531, win 512, options [nop,nop,TS val 1318875982 ecr 1318875972], length 610
2022-02-28 11:55:31.758976 IP (tos 0x0, ttl 64, id 26403, offset 0, flags [DF], proto TCP (6), length 52)
    127.0.0.1.51358 > 127.0.0.1.9350: Flags [.], cksum 0xfe28 (incorrect -> 0xd20c), seq 531, ack 4109, win 505, options [nop,nop,TS val 1318875982 ecr 1318875982], length 0
2022-02-28 11:55:31.791120 IP (tos 0x0, ttl 64, id 3143, offset 0, flags [DF], proto TCP (6), length 656)
    127.0.0.1.9350 > 127.0.0.1.51358: Flags [P.], cksum 0x0085 (incorrect -> 0xa23f), seq 4109:4713, ack 531, win 512, options [nop,nop,TS val 1318876014 ecr 1318875982], length 604
2022-02-28 11:55:31.791124 IP (tos 0x0, ttl 64, id 26404, offset 0, flags [DF], proto TCP (6), length 52)
    127.0.0.1.51358 > 127.0.0.1.9350: Flags [.], cksum 0xfe28 (incorrect -> 0xcf70), seq 531, ack 4713, win 505, options [nop,nop,TS val 1318876014 ecr 1318876014], length 0
2022-02-28 11:55:31.791820 IP (tos 0x0, ttl 64, id 26405, offset 0, flags [DF], proto TCP (6), length 132)
    127.0.0.1.51358 > 127.0.0.1.9350: Flags [P.], cksum 0xfe78 (incorrect -> 0x828c), seq 531:611, ack 4713, win 512, options [nop,nop,TS val 1318876015 ecr 1318876014], length 80
2022-02-28 11:55:31.791833 IP (tos 0x0, ttl 64, id 3144, offset 0, flags [DF], proto TCP (6), length 52)
    127.0.0.1.9350 > 127.0.0.1.51358: Flags [.], cksum 0xfe28 (incorrect -> 0xcf17), seq 4713, ack 611, win 512, options [nop,nop,TS val 1318876015 ecr 1318876015], length 0
2022-02-28 11:55:31.792370 IP (tos 0x0, ttl 64, id 26406, offset 0, flags [DF], proto TCP (6), length 343)
    127.0.0.1.51358 > 127.0.0.1.9350: Flags [P.], cksum 0xff4b (incorrect -> 0xee9c), seq 611:902, ack 4713, win 512, options [nop,nop,TS val 1318876015 ecr 1318876015], length 291
2022-02-28 11:55:31.792374 IP (tos 0x0, ttl 64, id 3145, offset 0, flags [DF], proto TCP (6), length 52)
    127.0.0.1.9350 > 127.0.0.1.51358: Flags [.], cksum 0xfe28 (incorrect -> 0xcdf6), seq 4713, ack 902, win 510, options [nop,nop,TS val 1318876015 ecr 1318876015], length 0
200, 11.773491859436035, 0.3283534049987793