2022-02-28 03:52:15.532227 IP (tos 0x0, ttl 64, id 59104, offset 0, flags [DF], proto TCP (6), length 60)
    127.0.0.1.37312 > 127.0.0.1.9950: Flags [S], cksum 0xfe30 (incorrect -> 0x326e), seq 514193570, win 65495, options [mss 65495,sackOK,TS val 1289879755 ecr 0,nop,wscale 7], length 0
2022-02-28 03:52:15.532241 IP (tos 0x0, ttl 64, id 0, offset 0, flags [DF], proto TCP (6), length 60)
    127.0.0.1.9950 > 127.0.0.1.37312: Flags [S.], cksum 0xfe30 (incorrect -> 0x76d5), seq 3728969634, ack 514193571, win 65483, options [mss 65495,sackOK,TS val 1289879755 ecr 1289879755,nop,wscale 7], length 0
2022-02-28 03:52:15.532252 IP (tos 0x0, ttl 64, id 59105, offset 0, flags [DF], proto TCP (6), length 52)
    127.0.0.1.37312 > 127.0.0.1.9950: Flags [.], cksum 0xfe28 (incorrect -> 0x9d91), seq 1, ack 1, win 512, options [nop,nop,TS val 1289879755 ecr 1289879755], length 0
2022-02-28 03:52:15.532421 IP (tos 0x0, ttl 64, id 59106, offset 0, flags [DF], proto TCP (6), length 55)
    127.0.0.1.37312 > 127.0.0.1.9950: Flags [P.], cksum 0xfe2b (incorrect -> 0x9885), seq 1:4, ack 1, win 512, options [nop,nop,TS val 1289879755 ecr 1289879755], length 3
2022-02-28 03:52:15.532430 IP (tos 0x0, ttl 64, id 63046, offset 0, flags [DF], proto TCP (6), length 52)
    127.0.0.1.9950 > 127.0.0.1.37312: Flags [.], cksum 0xfe28 (incorrect -> 0x9d8d), seq 1, ack 4, win 512, options [nop,nop,TS val 1289879756 ecr 1289879755], length 0
2022-02-28 03:52:15.532455 IP (tos 0x0, ttl 64, id 63047, offset 0, flags [DF], proto TCP (6), length 54)
    127.0.0.1.9950 > 127.0.0.1.37312: Flags [P.], cksum 0xfe2a (incorrect -> 0x9883), seq 1:3, ack 4, win 512, options [nop,nop,TS val 1289879756 ecr 1289879755], length 2
2022-02-28 03:52:15.532463 IP (tos 0x0, ttl 64, id 59107, offset 0, flags [DF], proto TCP (6), length 52)
    127.0.0.1.37312 > 127.0.0.1.9950: Flags [.], cksum 0xfe28 (incorrect -> 0x9d8a), seq 4, ack 3, win 512, options [nop,nop,TS val 1289879756 ecr 1289879756], length 0
2022-02-28 03:52:15.550023 IP (tos 0x0, ttl 64, id 59108, offset 0, flags [DF], proto TCP (6), length 62)
    127.0.0.1.37312 > 127.0.0.1.9950: Flags [P.], cksum 0xfe32 (incorrect -> 0xf3a1), seq 4:14, ack 3, win 512, options [nop,nop,TS val 1289879773 ecr 1289879756], length 10
2022-02-28 03:52:15.550034 IP (tos 0x0, ttl 64, id 63048, offset 0, flags [DF], proto TCP (6), length 52)
    127.0.0.1.9950 > 127.0.0.1.37312: Flags [.], cksum 0xfe28 (incorrect -> 0x9d5e), seq 3, ack 14, win 512, options [nop,nop,TS val 1289879773 ecr 1289879773], length 0
2022-02-28 03:52:15.614708 IP (tos 0x0, ttl 64, id 63049, offset 0, flags [DF], proto TCP (6), length 62)
    127.0.0.1.9950 > 127.0.0.1.37312: Flags [P.], cksum 0xfe32 (incorrect -> 0x980a), seq 3:13, ack 14, win 512, options [nop,nop,TS val 1289879838 ecr 1289879773], length 10
2022-02-28 03:52:15.614718 IP (tos 0x0, ttl 64, id 59109, offset 0, flags [DF], proto TCP (6), length 52)
    127.0.0.1.37312 > 127.0.0.1.9950: Flags [.], cksum 0xfe28 (incorrect -> 0x9cd2), seq 14, ack 13, win 512, options [nop,nop,TS val 1289879838 ecr 1289879838], length 0
2022-02-28 03:52:15.620698 IP (tos 0x0, ttl 64, id 59110, offset 0, flags [DF], proto TCP (6), length 569)
    127.0.0.1.37312 > 127.0.0.1.9950: Flags [P.], cksum 0x002e (incorrect -> 0x73fc), seq 14:531, ack 13, win 512, options [nop,nop,TS val 1289879844 ecr 1289879838], length 517
2022-02-28 03:52:15.620710 IP (tos 0x0, ttl 64, id 63050, offset 0, flags [DF], proto TCP (6), length 52)
    127.0.0.1.9950 > 127.0.0.1.37312: Flags [.], cksum 0xfe28 (incorrect -> 0x9ac5), seq 13, ack 531, win 508, options [nop,nop,TS val 1289879844 ecr 1289879844], length 0
2022-02-28 03:52:15.688138 IP (tos 0x0, ttl 64, id 63051, offset 0, flags [DF], proto TCP (6), length 151)
    127.0.0.1.9950 > 127.0.0.1.37312: Flags [P.], cksum 0xfe8b (incorrect -> 0x39cc), seq 13:112, ack 531, win 512, options [nop,nop,TS val 1289879911 ecr 1289879844], length 99
2022-02-28 03:52:15.688147 IP (tos 0x0, ttl 64, id 59111, offset 0, flags [DF], proto TCP (6), length 52)
    127.0.0.1.37312 > 127.0.0.1.9950: Flags [.], cksum 0xfe28 (incorrect -> 0x99d8), seq 531, ack 112, win 512, options [nop,nop,TS val 1289879911 ecr 1289879911], length 0
2022-02-28 03:52:15.688555 IP (tos 0x0, ttl 64, id 59112, offset 0, flags [DF], proto TCP (6), length 575)
    127.0.0.1.37312 > 127.0.0.1.9950: Flags [P.], cksum 0x0034 (incorrect -> 0x864d), seq 531:1054, ack 112, win 512, options [nop,nop,TS val 1289879912 ecr 1289879911], length 523
2022-02-28 03:52:15.688569 IP (tos 0x0, ttl 64, id 63052, offset 0, flags [DF], proto TCP (6), length 52)
    127.0.0.1.9950 > 127.0.0.1.37312: Flags [.], cksum 0xfe28 (incorrect -> 0x97cf), seq 112, ack 1054, win 508, options [nop,nop,TS val 1289879912 ecr 1289879912], length 0
2022-02-28 03:52:15.755976 IP (tos 0x0, ttl 64, id 63053, offset 0, flags [DF], proto TCP (6), length 3538)
    127.0.0.1.9950 > 127.0.0.1.37312: Flags [P.], cksum 0x0bc7 (incorrect -> 0x9f2e), seq 112:3598, ack 1054, win 512, options [nop,nop,TS val 1289879979 ecr 1289879912], length 3486
2022-02-28 03:52:15.755988 IP (tos 0x0, ttl 64, id 59113, offset 0, flags [DF], proto TCP (6), length 52)
    127.0.0.1.37312 > 127.0.0.1.9950: Flags [.], cksum 0xfe28 (incorrect -> 0x89b9), seq 1054, ack 3598, win 494, options [nop,nop,TS val 1289879979 ecr 1289879979], length 0
2022-02-28 03:52:15.772886 IP (tos 0x0, ttl 64, id 63054, offset 0, flags [DF], proto TCP (6), length 3538)
    127.0.0.1.9950 > 127.0.0.1.37312: Flags [P.], cksum 0x0bc7 (incorrect -> 0x4982), seq 3598:7084, ack 1054, win 512, options [nop,nop,TS val 1289879996 ecr 1289879979], length 3486
2022-02-28 03:52:15.772895 IP (tos 0x0, ttl 64, id 59114, offset 0, flags [DF], proto TCP (6), length 52)
    127.0.0.1.37312 > 127.0.0.1.9950: Flags [.], cksum 0xfe28 (incorrect -> 0x7bf9), seq 1054, ack 7084, win 494, options [nop,nop,TS val 1289879996 ecr 1289879996], length 0
2022-02-28 03:52:15.786742 IP (tos 0x0, ttl 64, id 63055, offset 0, flags [DF], proto TCP (6), length 550)
    127.0.0.1.9950 > 127.0.0.1.37312: Flags [P.], cksum 0x001b (incorrect -> 0x58cc), seq 7084:7582, ack 1054, win 512, options [nop,nop,TS val 1289880010 ecr 1289879996], length 498
2022-02-28 03:52:15.786757 IP (tos 0x0, ttl 64, id 59115, offset 0, flags [DF], proto TCP (6), length 52)
    127.0.0.1.37312 > 127.0.0.1.9950: Flags [.], cksum 0xfe28 (incorrect -> 0x79df), seq 1054, ack 7582, win 506, options [nop,nop,TS val 1289880010 ecr 1289880010], length 0
2022-02-28 03:52:15.800493 IP (tos 0x0, ttl 64, id 63056, offset 0, flags [DF], proto TCP (6), length 2882)
    127.0.0.1.9950 > 127.0.0.1.37312: Flags [P.], cksum 0x0937 (incorrect -> 0x15d6), seq 7582:10412, ack 1054, win 512, options [nop,nop,TS val 1289880024 ecr 1289880010], length 2830
2022-02-28 03:52:15.800500 IP (tos 0x0, ttl 64, id 59116, offset 0, flags [DF], proto TCP (6), length 52)
    127.0.0.1.37312 > 127.0.0.1.9950: Flags [.], cksum 0xfe28 (incorrect -> 0x6ebf), seq 1054, ack 10412, win 496, options [nop,nop,TS val 1289880024 ecr 1289880024], length 0
2022-02-28 03:52:15.801050 IP (tos 0x0, ttl 64, id 59117, offset 0, flags [DF], proto TCP (6), length 126)
    127.0.0.1.37312 > 127.0.0.1.9950: Flags [P.], cksum 0xfe72 (incorrect -> 0x3aca), seq 1054:1128, ack 10412, win 512, options [nop,nop,TS val 1289880024 ecr 1289880024], length 74
2022-02-28 03:52:15.801058 IP (tos 0x0, ttl 64, id 63057, offset 0, flags [DF], proto TCP (6), length 52)
    127.0.0.1.9950 > 127.0.0.1.37312: Flags [.], cksum 0xfe28 (incorrect -> 0x6e65), seq 10412, ack 1128, win 512, options [nop,nop,TS val 1289880024 ecr 1289880024], length 0
2022-02-28 03:52:15.801327 IP (tos 0x0, ttl 64, id 59118, offset 0, flags [DF], proto TCP (6), length 361)
    127.0.0.1.37312 > 127.0.0.1.9950: Flags [P.], cksum 0xff5d (incorrect -> 0x1189), seq 1128:1437, ack 10412, win 512, options [nop,nop,TS val 1289880024 ecr 1289880024], length 309
2022-02-28 03:52:15.801334 IP (tos 0x0, ttl 64, id 63058, offset 0, flags [DF], proto TCP (6), length 52)
    127.0.0.1.9950 > 127.0.0.1.37312: Flags [.], cksum 0xfe28 (incorrect -> 0x6d32), seq 10412, ack 1437, win 510, options [nop,nop,TS val 1289880024 ecr 1289880024], length 0
2022-02-28 03:52:15.873922 IP (tos 0x0, ttl 64, id 63059, offset 0, flags [DF], proto TCP (6), length 626)
    127.0.0.1.9950 > 127.0.0.1.37312: Flags [P.], cksum 0x0067 (incorrect -> 0x08dc), seq 10412:10986, ack 1437, win 512, options [nop,nop,TS val 1289880097 ecr 1289880024], length 574
2022-02-28 03:52:15.914182 IP (tos 0x0, ttl 64, id 59119, offset 0, flags [DF], proto TCP (6), length 52)
    127.0.0.1.37312 > 127.0.0.1.9950: Flags [.], cksum 0xfe28 (incorrect -> 0x6a38), seq 1437, ack 10986, win 512, options [nop,nop,TS val 1289880137 ecr 1289880097], length 0
2022-02-28 03:52:16.588781 IP (tos 0x0, ttl 64, id 63060, offset 0, flags [DF], proto TCP (6), length 3538)
    127.0.0.1.9950 > 127.0.0.1.37312: Flags [P.], cksum 0x0bc7 (incorrect -> 0x8ee9), seq 10986:14472, ack 1437, win 512, options [nop,nop,TS val 1289880812 ecr 1289880137], length 3486
2022-02-28 03:52:16.588801 IP (tos 0x0, ttl 64, id 59120, offset 0, flags [DF], proto TCP (6), length 52)
    127.0.0.1.37312 > 127.0.0.1.9950: Flags [.], cksum 0xfe28 (incorrect -> 0x573e), seq 1437, ack 14472, win 494, options [nop,nop,TS val 1289880812 ecr 1289880812], length 0
2022-02-28 03:52:16.590171 IP (tos 0x0, ttl 64, id 63061, offset 0, flags [DF], proto TCP (6), length 3400)
    127.0.0.1.9950 > 127.0.0.1.37312: Flags [P.], cksum 0x0b3d (incorrect -> 0xb055), seq 14472:17820, ack 1437, win 512, options [nop,nop,TS val 1289880813 ecr 1289880812], length 3348
2022-02-28 03:52:16.590178 IP (tos 0x0, ttl 64, id 59121, offset 0, flags [DF], proto TCP (6), length 52)
    127.0.0.1.37312 > 127.0.0.1.9950: Flags [.], cksum 0xfe28 (incorrect -> 0x4a28), seq 1437, ack 17820, win 494, options [nop,nop,TS val 1289880813 ecr 1289880813], length 0
2022-02-28 03:52:16.590380 IP (tos 0x0, ttl 64, id 63062, offset 0, flags [DF], proto TCP (6), length 2902)
    127.0.0.1.9950 > 127.0.0.1.37312: Flags [P.], cksum 0x094b (incorrect -> 0xbf02), seq 17820:20670, ack 1437, win 512, options [nop,nop,TS val 1289880813 ecr 1289880813], length 2850
2022-02-28 03:52:16.590386 IP (tos 0x0, ttl 64, id 59122, offset 0, flags [DF], proto TCP (6), length 52)
    127.0.0.1.37312 > 127.0.0.1.9950: Flags [.], cksum 0xfe28 (incorrect -> 0x3f04), seq 1437, ack 20670, win 496, options [nop,nop,TS val 1289880813 ecr 1289880813], length 0
2022-02-28 03:52:16.602637 IP (tos 0x0, ttl 64, id 63063, offset 0, flags [DF], proto TCP (6), length 1048)
    127.0.0.1.9950 > 127.0.0.1.37312: Flags [P.], cksum 0x020d (incorrect -> 0xde48), seq 20670:21666, ack 1437, win 512, options [nop,nop,TS val 1289880826 ecr 1289880813], length 996
2022-02-28 03:52:16.602644 IP (tos 0x0, ttl 64, id 59123, offset 0, flags [DF], proto TCP (6), length 52)
    127.0.0.1.37312 > 127.0.0.1.9950: Flags [.], cksum 0xfe28 (incorrect -> 0x3afe), seq 1437, ack 21666, win 504, options [nop,nop,TS val 1289880826 ecr 1289880826], length 0
2022-02-28 03:52:16.617353 IP (tos 0x0, ttl 64, id 63064, offset 0, flags [DF], proto TCP (6), length 3538)
    127.0.0.1.9950 > 127.0.0.1.37312: Flags [P.], cksum 0x0bc7 (incorrect -> 0x0824), seq 21666:25152, ack 1437, win 512, options [nop,nop,TS val 1289880840 ecr 1289880826], length 3486
2022-02-28 03:52:16.617361 IP (tos 0x0, ttl 64, id 59124, offset 0, flags [DF], proto TCP (6), length 52)
    127.0.0.1.37312 > 127.0.0.1.9950: Flags [.], cksum 0xfe28 (incorrect -> 0x2d4e), seq 1437, ack 25152, win 494, options [nop,nop,TS val 1289880840 ecr 1289880840], length 0
2022-02-28 03:52:16.624069 IP (tos 0x0, ttl 64, id 63065, offset 0, flags [DF], proto TCP (6), length 1546)
    127.0.0.1.9950 > 127.0.0.1.37312: Flags [P.], cksum 0x03ff (incorrect -> 0x1015), seq 25152:26646, ack 1437, win 512, options [nop,nop,TS val 1289880847 ecr 1289880840], length 1494
2022-02-28 03:52:16.624075 IP (tos 0x0, ttl 64, id 59125, offset 0, flags [DF], proto TCP (6), length 52)
    127.0.0.1.37312 > 127.0.0.1.9950: Flags [.], cksum 0xfe28 (incorrect -> 0x2762), seq 1437, ack 26646, win 502, options [nop,nop,TS val 1289880847 ecr 1289880847], length 0
2022-02-28 03:52:16.631168 IP (tos 0x0, ttl 64, id 63066, offset 0, flags [DF], proto TCP (6), length 1037)
    127.0.0.1.9950 > 127.0.0.1.37312: Flags [P.], cksum 0x0202 (incorrect -> 0x72cb), seq 26646:27631, ack 1437, win 512, options [nop,nop,TS val 1289880854 ecr 1289880847], length 985
2022-02-28 03:52:16.631175 IP (tos 0x0, ttl 64, id 59126, offset 0, flags [DF], proto TCP (6), length 52)
    127.0.0.1.37312 > 127.0.0.1.9950: Flags [.], cksum 0xfe28 (incorrect -> 0x2379), seq 1437, ack 27631, win 504, options [nop,nop,TS val 1289880854 ecr 1289880854], length 0
2022-02-28 03:52:16.686213 IP (tos 0x0, ttl 64, id 63067, offset 0, flags [DF], proto TCP (6), length 4100)
    127.0.0.1.9950 > 127.0.0.1.37312: Flags [P.], cksum 0x0df9 (incorrect -> 0x9064), seq 27631:31679, ack 1437, win 512, options [nop,nop,TS val 1289880909 ecr 1289880854], length 4048
2022-02-28 03:52:16.686227 IP (tos 0x0, ttl 64, id 59127, offset 0, flags [DF], proto TCP (6), length 52)
    127.0.0.1.37312 > 127.0.0.1.9950: Flags [.], cksum 0xfe28 (incorrect -> 0x1347), seq 1437, ack 31679, win 492, options [nop,nop,TS val 1289880909 ecr 1289880909], length 0
2022-02-28 03:52:16.686277 IP (tos 0x0, ttl 64, id 63068, offset 0, flags [DF], proto TCP (6), length 1842)
    127.0.0.1.9950 > 127.0.0.1.37312: Flags [P.], cksum 0x0527 (incorrect -> 0x8147), seq 31679:33469, ack 1437, win 512, options [nop,nop,TS val 1289880909 ecr 1289880909], length 1790
2022-02-28 03:52:16.686282 IP (tos 0x0, ttl 64, id 59128, offset 0, flags [DF], proto TCP (6), length 52)
    127.0.0.1.37312 > 127.0.0.1.9950: Flags [.], cksum 0xfe28 (incorrect -> 0x0c40), seq 1437, ack 33469, win 501, options [nop,nop,TS val 1289880909 ecr 1289880909], length 0
2022-02-28 03:52:16.688175 IP (tos 0x0, ttl 64, id 63069, offset 0, flags [DF], proto TCP (6), length 4100)
    127.0.0.1.9950 > 127.0.0.1.37312: Flags [P.], cksum 0x0df9 (incorrect -> 0x7760), seq 33469:37517, ack 1437, win 512, options [nop,nop,TS val 1289880911 ecr 1289880909], length 4048
200, 4.817265033721924, 1.2928297519683838