2022-02-28 10:33:08.950277 IP (tos 0x0, ttl 64, id 62556, offset 0, flags [DF], proto TCP (6), length 60)
    127.0.0.1.42156 > 127.0.0.1.10050: Flags [S], cksum 0xfe30 (incorrect -> 0x8368), seq 1676822258, win 65495, options [mss 65495,sackOK,TS val 1313933173 ecr 0,nop,wscale 7], length 0
2022-02-28 10:33:08.950292 IP (tos 0x0, ttl 64, id 0, offset 0, flags [DF], proto TCP (6), length 60)
    127.0.0.1.10050 > 127.0.0.1.42156: Flags [S.], cksum 0xfe30 (incorrect -> 0x5f3b), seq 3552377508, ack 1676822259, win 65483, options [mss 65495,sackOK,TS val 1313933173 ecr 1313933173,nop,wscale 7], length 0
2022-02-28 10:33:08.950303 IP (tos 0x0, ttl 64, id 62557, offset 0, flags [DF], proto TCP (6), length 52)
    127.0.0.1.42156 > 127.0.0.1.10050: Flags [.], cksum 0xfe28 (incorrect -> 0x85f7), seq 1, ack 1, win 512, options [nop,nop,TS val 1313933173 ecr 1313933173], length 0
2022-02-28 10:33:08.950498 IP (tos 0x0, ttl 64, id 62558, offset 0, flags [DF], proto TCP (6), length 55)
    127.0.0.1.42156 > 127.0.0.1.10050: Flags [P.], cksum 0xfe2b (incorrect -> 0x80ea), seq 1:4, ack 1, win 512, options [nop,nop,TS val 1313933174 ecr 1313933173], length 3
2022-02-28 10:33:08.950507 IP (tos 0x0, ttl 64, id 19509, offset 0, flags [DF], proto TCP (6), length 52)
    127.0.0.1.10050 > 127.0.0.1.42156: Flags [.], cksum 0xfe28 (incorrect -> 0x85f2), seq 1, ack 4, win 512, options [nop,nop,TS val 1313933174 ecr 1313933174], length 0
2022-02-28 10:33:08.950537 IP (tos 0x0, ttl 64, id 19510, offset 0, flags [DF], proto TCP (6), length 54)
    127.0.0.1.10050 > 127.0.0.1.42156: Flags [P.], cksum 0xfe2a (incorrect -> 0x80e8), seq 1:3, ack 4, win 512, options [nop,nop,TS val 1313933174 ecr 1313933174], length 2
2022-02-28 10:33:08.950548 IP (tos 0x0, ttl 64, id 62559, offset 0, flags [DF], proto TCP (6), length 52)
    127.0.0.1.42156 > 127.0.0.1.10050: Flags [.], cksum 0xfe28 (incorrect -> 0x85f0), seq 4, ack 3, win 512, options [nop,nop,TS val 1313933174 ecr 1313933174], length 0
2022-02-28 10:33:08.970556 IP (tos 0x0, ttl 64, id 62560, offset 0, flags [DF], proto TCP (6), length 62)
    127.0.0.1.42156 > 127.0.0.1.10050: Flags [P.], cksum 0xfe32 (incorrect -> 0xece8), seq 4:14, ack 3, win 512, options [nop,nop,TS val 1313933194 ecr 1313933174], length 10
2022-02-28 10:33:08.970572 IP (tos 0x0, ttl 64, id 19511, offset 0, flags [DF], proto TCP (6), length 52)
    127.0.0.1.10050 > 127.0.0.1.42156: Flags [.], cksum 0xfe28 (incorrect -> 0x85be), seq 3, ack 14, win 512, options [nop,nop,TS val 1313933194 ecr 1313933194], length 0
2022-02-28 10:33:09.032735 IP (tos 0x0, ttl 64, id 19512, offset 0, flags [DF], proto TCP (6), length 62)
    127.0.0.1.10050 > 127.0.0.1.42156: Flags [P.], cksum 0xfe32 (incorrect -> 0x806d), seq 3:13, ack 14, win 512, options [nop,nop,TS val 1313933256 ecr 1313933194], length 10
2022-02-28 10:33:09.032754 IP (tos 0x0, ttl 64, id 62561, offset 0, flags [DF], proto TCP (6), length 52)
    127.0.0.1.42156 > 127.0.0.1.10050: Flags [.], cksum 0xfe28 (incorrect -> 0x8538), seq 14, ack 13, win 512, options [nop,nop,TS val 1313933256 ecr 1313933256], length 0
2022-02-28 10:33:09.038759 IP (tos 0x0, ttl 64, id 62562, offset 0, flags [DF], proto TCP (6), length 569)
    127.0.0.1.42156 > 127.0.0.1.10050: Flags [P.], cksum 0x002e (incorrect -> 0xe3a2), seq 14:531, ack 13, win 512, options [nop,nop,TS val 1313933262 ecr 1313933256], length 517
2022-02-28 10:33:09.038770 IP (tos 0x0, ttl 64, id 19513, offset 0, flags [DF], proto TCP (6), length 52)
    127.0.0.1.10050 > 127.0.0.1.42156: Flags [.], cksum 0xfe28 (incorrect -> 0x832b), seq 13, ack 531, win 508, options [nop,nop,TS val 1313933262 ecr 1313933262], length 0
2022-02-28 10:33:09.092618 IP (tos 0x0, ttl 64, id 19514, offset 0, flags [DF], proto TCP (6), length 3538)
    127.0.0.1.10050 > 127.0.0.1.42156: Flags [P.], cksum 0x0bc7 (incorrect -> 0x050e), seq 13:3499, ack 531, win 512, options [nop,nop,TS val 1313933316 ecr 1313933262], length 3486
2022-02-28 10:33:09.092629 IP (tos 0x0, ttl 64, id 62563, offset 0, flags [DF], proto TCP (6), length 52)
    127.0.0.1.42156 > 127.0.0.1.10050: Flags [.], cksum 0xfe28 (incorrect -> 0x752f), seq 531, ack 3499, win 494, options [nop,nop,TS val 1313933316 ecr 1313933316], length 0
200, 4.676348686218262, 0.7155125141143799