2022-02-28 13:43:31.473969 IP (tos 0x0, ttl 64, id 2748, offset 0, flags [DF], proto TCP (6), length 60)
    127.0.0.1.45794 > 127.0.0.1.12050: Flags [S], cksum 0xfe30 (incorrect -> 0x89cb), seq 2815007431, win 65495, options [mss 65495,sackOK,TS val 1325355697 ecr 0,nop,wscale 7], length 0
2022-02-28 13:43:31.473985 IP (tos 0x0, ttl 64, id 0, offset 0, flags [DF], proto TCP (6), length 60)
    127.0.0.1.12050 > 127.0.0.1.45794: Flags [S.], cksum 0xfe30 (incorrect -> 0x1c5d), seq 36489612, ack 2815007432, win 65483, options [mss 65495,sackOK,TS val 1325355697 ecr 1325355697,nop,wscale 7], length 0
2022-02-28 13:43:31.473999 IP (tos 0x0, ttl 64, id 2749, offset 0, flags [DF], proto TCP (6), length 52)
    127.0.0.1.45794 > 127.0.0.1.12050: Flags [.], cksum 0xfe28 (incorrect -> 0x4319), seq 1, ack 1, win 512, options [nop,nop,TS val 1325355697 ecr 1325355697], length 0
2022-02-28 13:43:31.474117 IP (tos 0x0, ttl 64, id 2750, offset 0, flags [DF], proto TCP (6), length 55)
    127.0.0.1.45794 > 127.0.0.1.12050: Flags [P.], cksum 0xfe2b (incorrect -> 0x3e0d), seq 1:4, ack 1, win 512, options [nop,nop,TS val 1325355697 ecr 1325355697], length 3
2022-02-28 13:43:31.474147 IP (tos 0x0, ttl 64, id 37262, offset 0, flags [DF], proto TCP (6), length 52)
    127.0.0.1.12050 > 127.0.0.1.45794: Flags [.], cksum 0xfe28 (incorrect -> 0x4316), seq 1, ack 4, win 512, options [nop,nop,TS val 1325355697 ecr 1325355697], length 0
2022-02-28 13:43:31.474196 IP (tos 0x0, ttl 64, id 37263, offset 0, flags [DF], proto TCP (6), length 54)
    127.0.0.1.12050 > 127.0.0.1.45794: Flags [P.], cksum 0xfe2a (incorrect -> 0x3e0c), seq 1:3, ack 4, win 512, options [nop,nop,TS val 1325355697 ecr 1325355697], length 2
2022-02-28 13:43:31.474215 IP (tos 0x0, ttl 64, id 2751, offset 0, flags [DF], proto TCP (6), length 52)
    127.0.0.1.45794 > 127.0.0.1.12050: Flags [.], cksum 0xfe28 (incorrect -> 0x4314), seq 4, ack 3, win 512, options [nop,nop,TS val 1325355697 ecr 1325355697], length 0
2022-02-28 13:43:31.520212 IP (tos 0x0, ttl 64, id 2752, offset 0, flags [DF], proto TCP (6), length 62)
    127.0.0.1.45794 > 127.0.0.1.12050: Flags [P.], cksum 0xfe32 (incorrect -> 0xd78a), seq 4:14, ack 3, win 512, options [nop,nop,TS val 1325355743 ecr 1325355697], length 10
2022-02-28 13:43:31.520233 IP (tos 0x0, ttl 64, id 37264, offset 0, flags [DF], proto TCP (6), length 52)
    127.0.0.1.12050 > 127.0.0.1.45794: Flags [.], cksum 0xfe28 (incorrect -> 0x42ae), seq 3, ack 14, win 512, options [nop,nop,TS val 1325355743 ecr 1325355743], length 0
2022-02-28 13:43:31.636777 IP (tos 0x0, ttl 64, id 37265, offset 0, flags [DF], proto TCP (6), length 62)
    127.0.0.1.12050 > 127.0.0.1.45794: Flags [P.], cksum 0xfe32 (incorrect -> 0x3d26), seq 3:13, ack 14, win 512, options [nop,nop,TS val 1325355860 ecr 1325355743], length 10
2022-02-28 13:43:31.636798 IP (tos 0x0, ttl 64, id 2753, offset 0, flags [DF], proto TCP (6), length 52)
    127.0.0.1.45794 > 127.0.0.1.12050: Flags [.], cksum 0xfe28 (incorrect -> 0x41ba), seq 14, ack 13, win 512, options [nop,nop,TS val 1325355860 ecr 1325355860], length 0
2022-02-28 13:43:31.642746 IP (tos 0x0, ttl 64, id 2754, offset 0, flags [DF], proto TCP (6), length 569)
    127.0.0.1.45794 > 127.0.0.1.12050: Flags [P.], cksum 0x002e (incorrect -> 0x47e9), seq 14:531, ack 13, win 512, options [nop,nop,TS val 1325355866 ecr 1325355860], length 517
2022-02-28 13:43:31.642757 IP (tos 0x0, ttl 64, id 37266, offset 0, flags [DF], proto TCP (6), length 52)
    127.0.0.1.12050 > 127.0.0.1.45794: Flags [.], cksum 0xfe28 (incorrect -> 0x3fad), seq 13, ack 531, win 508, options [nop,nop,TS val 1325355866 ecr 1325355866], length 0
2022-02-28 13:43:31.830499 IP (tos 0x0, ttl 64, id 37267, offset 0, flags [DF], proto TCP (6), length 2972)
    127.0.0.1.12050 > 127.0.0.1.45794: Flags [P.], cksum 0x0991 (incorrect -> 0xad3c), seq 13:2933, ack 531, win 512, options [nop,nop,TS val 1325356054 ecr 1325355866], length 2920
2022-02-28 13:43:31.830510 IP (tos 0x0, ttl 64, id 2755, offset 0, flags [DF], proto TCP (6), length 52)
    127.0.0.1.45794 > 127.0.0.1.12050: Flags [.], cksum 0xfe28 (incorrect -> 0x32d9), seq 531, ack 2933, win 496, options [nop,nop,TS val 1325356054 ecr 1325356054], length 0
2022-02-28 13:43:31.880466 IP (tos 0x0, ttl 64, id 37268, offset 0, flags [DF], proto TCP (6), length 354)
    127.0.0.1.12050 > 127.0.0.1.45794: Flags [P.], cksum 0xff56 (incorrect -> 0x8497), seq 2933:3235, ack 531, win 512, options [nop,nop,TS val 1325356104 ecr 1325356054], length 302
2022-02-28 13:43:31.880481 IP (tos 0x0, ttl 64, id 2756, offset 0, flags [DF], proto TCP (6), length 52)
    127.0.0.1.45794 > 127.0.0.1.12050: Flags [.], cksum 0xfe28 (incorrect -> 0x313d), seq 531, ack 3235, win 506, options [nop,nop,TS val 1325356104 ecr 1325356104], length 0
2022-02-28 13:43:31.880793 IP (tos 0x0, ttl 64, id 2757, offset 0, flags [DF], proto TCP (6), length 178)
    127.0.0.1.45794 > 127.0.0.1.12050: Flags [P.], cksum 0xfea6 (incorrect -> 0x0f64), seq 531:657, ack 3235, win 512, options [nop,nop,TS val 1325356104 ecr 1325356104], length 126
2022-02-28 13:43:31.880802 IP (tos 0x0, ttl 64, id 37269, offset 0, flags [DF], proto TCP (6), length 52)
    127.0.0.1.12050 > 127.0.0.1.45794: Flags [.], cksum 0xfe28 (incorrect -> 0x30b9), seq 3235, ack 657, win 512, options [nop,nop,TS val 1325356104 ecr 1325356104], length 0
2022-02-28 13:43:32.005663 IP (tos 0x0, ttl 64, id 37270, offset 0, flags [DF], proto TCP (6), length 310)
    127.0.0.1.12050 > 127.0.0.1.45794: Flags [P.], cksum 0xff2a (incorrect -> 0xb387), seq 3235:3493, ack 657, win 512, options [nop,nop,TS val 1325356229 ecr 1325356104], length 258
2022-02-28 13:43:32.005675 IP (tos 0x0, ttl 64, id 2758, offset 0, flags [DF], proto TCP (6), length 52)
    127.0.0.1.45794 > 127.0.0.1.12050: Flags [.], cksum 0xfe28 (incorrect -> 0x2ebf), seq 657, ack 3493, win 510, options [nop,nop,TS val 1325356229 ecr 1325356229], length 0
2022-02-28 13:43:32.006253 IP (tos 0x0, ttl 64, id 2759, offset 0, flags [DF], proto TCP (6), length 352)
    127.0.0.1.45794 > 127.0.0.1.12050: Flags [P.], cksum 0xff54 (incorrect -> 0x2ee5), seq 657:957, ack 3493, win 512, options [nop,nop,TS val 1325356229 ecr 1325356229], length 300
2022-02-28 13:43:32.006264 IP (tos 0x0, ttl 64, id 37271, offset 0, flags [DF], proto TCP (6), length 52)
    127.0.0.1.12050 > 127.0.0.1.45794: Flags [.], cksum 0xfe28 (incorrect -> 0x2d93), seq 3493, ack 957, win 510, options [nop,nop,TS val 1325356229 ecr 1325356229], length 0
2022-02-28 13:43:32.126095 IP (tos 0x0, ttl 64, id 37272, offset 0, flags [DF], proto TCP (6), length 510)
    127.0.0.1.12050 > 127.0.0.1.45794: Flags [P.], cksum 0xfff2 (incorrect -> 0x5426), seq 3493:3951, ack 957, win 512, options [nop,nop,TS val 1325356349 ecr 1325356229], length 458
2022-02-28 13:43:32.126154 IP (tos 0x0, ttl 64, id 37273, offset 0, flags [DF], proto TCP (6), length 52)
    127.0.0.1.12050 > 127.0.0.1.45794: Flags [F.], cksum 0xfe28 (incorrect -> 0x2b4e), seq 3951, ack 957, win 512, options [nop,nop,TS val 1325356349 ecr 1325356229], length 0
2022-02-28 13:43:32.127583 IP (tos 0x0, ttl 64, id 2760, offset 0, flags [DF], proto TCP (6), length 52)
    127.0.0.1.45794 > 127.0.0.1.12050: Flags [R.], cksum 0xfe28 (incorrect -> 0x2ad0), seq 957, ack 3952, win 512, options [nop,nop,TS val 1325356351 ecr 1325356349], length 0
2022-02-28 13:43:32.128950 IP (tos 0x0, ttl 64, id 50550, offset 0, flags [DF], proto TCP (6), length 60)
    127.0.0.1.45796 > 127.0.0.1.12050: Flags [S], cksum 0xfe30 (incorrect -> 0xf9f2), seq 1713203643, win 65495, options [mss 65495,sackOK,TS val 1325356352 ecr 0,nop,wscale 7], length 0
2022-02-28 13:43:32.128962 IP (tos 0x0, ttl 64, id 0, offset 0, flags [DF], proto TCP (6), length 60)
    127.0.0.1.12050 > 127.0.0.1.45796: Flags [S.], cksum 0xfe30 (incorrect -> 0x7982), seq 3210550478, ack 1713203644, win 65483, options [mss 65495,sackOK,TS val 1325356352 ecr 1325356352,nop,wscale 7], length 0
2022-02-28 13:43:32.128975 IP (tos 0x0, ttl 64, id 50551, offset 0, flags [DF], proto TCP (6), length 52)
    127.0.0.1.45796 > 127.0.0.1.12050: Flags [.], cksum 0xfe28 (incorrect -> 0xa03e), seq 1, ack 1, win 512, options [nop,nop,TS val 1325356352 ecr 1325356352], length 0
2022-02-28 13:43:32.129213 IP (tos 0x0, ttl 64, id 50552, offset 0, flags [DF], proto TCP (6), length 55)
    127.0.0.1.45796 > 127.0.0.1.12050: Flags [P.], cksum 0xfe2b (incorrect -> 0x9b32), seq 1:4, ack 1, win 512, options [nop,nop,TS val 1325356352 ecr 1325356352], length 3
2022-02-28 13:43:32.129224 IP (tos 0x0, ttl 64, id 30847, offset 0, flags [DF], proto TCP (6), length 52)
    127.0.0.1.12050 > 127.0.0.1.45796: Flags [.], cksum 0xfe28 (incorrect -> 0xa03b), seq 1, ack 4, win 512, options [nop,nop,TS val 1325356352 ecr 1325356352], length 0
2022-02-28 13:43:32.129255 IP (tos 0x0, ttl 64, id 30848, offset 0, flags [DF], proto TCP (6), length 54)
    127.0.0.1.12050 > 127.0.0.1.45796: Flags [P.], cksum 0xfe2a (incorrect -> 0x9b31), seq 1:3, ack 4, win 512, options [nop,nop,TS val 1325356352 ecr 1325356352], length 2
2022-02-28 13:43:32.129266 IP (tos 0x0, ttl 64, id 50553, offset 0, flags [DF], proto TCP (6), length 52)
    127.0.0.1.45796 > 127.0.0.1.12050: Flags [.], cksum 0xfe28 (incorrect -> 0xa039), seq 4, ack 3, win 512, options [nop,nop,TS val 1325356352 ecr 1325356352], length 0
2022-02-28 13:43:32.173216 IP (tos 0x0, ttl 64, id 50554, offset 0, flags [DF], proto TCP (6), length 62)
    127.0.0.1.45796 > 127.0.0.1.12050: Flags [P.], cksum 0xfe32 (incorrect -> 0x342e), seq 4:14, ack 3, win 512, options [nop,nop,TS val 1325356396 ecr 1325356352], length 10
2022-02-28 13:43:32.173232 IP (tos 0x0, ttl 64, id 30849, offset 0, flags [DF], proto TCP (6), length 52)
    127.0.0.1.12050 > 127.0.0.1.45796: Flags [.], cksum 0xfe28 (incorrect -> 0x9fd7), seq 3, ack 14, win 512, options [nop,nop,TS val 1325356396 ecr 1325356396], length 0
2022-02-28 13:43:32.347605 IP (tos 0x0, ttl 64, id 30850, offset 0, flags [DF], proto TCP (6), length 62)
    127.0.0.1.12050 > 127.0.0.1.45796: Flags [P.], cksum 0xfe32 (incorrect -> 0x9a15), seq 3:13, ack 14, win 512, options [nop,nop,TS val 1325356571 ecr 1325356396], length 10
2022-02-28 13:43:32.347619 IP (tos 0x0, ttl 64, id 50555, offset 0, flags [DF], proto TCP (6), length 52)
    127.0.0.1.45796 > 127.0.0.1.12050: Flags [.], cksum 0xfe28 (incorrect -> 0x9e6f), seq 14, ack 13, win 512, options [nop,nop,TS val 1325356571 ecr 1325356571], length 0
2022-02-28 13:43:32.353129 IP (tos 0x0, ttl 64, id 50556, offset 0, flags [DF], proto TCP (6), length 569)
    127.0.0.1.45796 > 127.0.0.1.12050: Flags [P.], cksum 0x002e (incorrect -> 0x1851), seq 14:531, ack 13, win 512, options [nop,nop,TS val 1325356576 ecr 1325356571], length 517
2022-02-28 13:43:32.353141 IP (tos 0x0, ttl 64, id 30851, offset 0, flags [DF], proto TCP (6), length 52)
    127.0.0.1.12050 > 127.0.0.1.45796: Flags [.], cksum 0xfe28 (incorrect -> 0x9c64), seq 13, ack 531, win 508, options [nop,nop,TS val 1325356576 ecr 1325356576], length 0
2022-02-28 13:43:32.521636 IP (tos 0x0, ttl 64, id 30852, offset 0, flags [DF], proto TCP (6), length 3342)
    127.0.0.1.12050 > 127.0.0.1.45796: Flags [P.], cksum 0x0b03 (incorrect -> 0x71d4), seq 13:3303, ack 531, win 512, options [nop,nop,TS val 1325356745 ecr 1325356576], length 3290
2022-02-28 13:43:32.521645 IP (tos 0x0, ttl 64, id 50557, offset 0, flags [DF], proto TCP (6), length 52)
    127.0.0.1.45796 > 127.0.0.1.12050: Flags [.], cksum 0xfe28 (incorrect -> 0x8e45), seq 531, ack 3303, win 495, options [nop,nop,TS val 1325356745 ecr 1325356745], length 0
2022-02-28 13:43:32.522170 IP (tos 0x0, ttl 64, id 50558, offset 0, flags [DF], proto TCP (6), length 178)
    127.0.0.1.45796 > 127.0.0.1.12050: Flags [P.], cksum 0xfea6 (incorrect -> 0x9451), seq 531:657, ack 3303, win 512, options [nop,nop,TS val 1325356745 ecr 1325356745], length 126
2022-02-28 13:43:32.522182 IP (tos 0x0, ttl 64, id 30853, offset 0, flags [DF], proto TCP (6), length 52)
    127.0.0.1.12050 > 127.0.0.1.45796: Flags [.], cksum 0xfe28 (incorrect -> 0x8db6), seq 3303, ack 657, win 512, options [nop,nop,TS val 1325356745 ecr 1325356745], length 0
2022-02-28 13:43:32.676747 IP (tos 0x0, ttl 64, id 30854, offset 0, flags [DF], proto TCP (6), length 310)
    127.0.0.1.12050 > 127.0.0.1.45796: Flags [P.], cksum 0xff2a (incorrect -> 0xc8c4), seq 3303:3561, ack 657, win 512, options [nop,nop,TS val 1325356900 ecr 1325356745], length 258
2022-02-28 13:43:32.676756 IP (tos 0x0, ttl 64, id 50559, offset 0, flags [DF], proto TCP (6), length 52)
    127.0.0.1.45796 > 127.0.0.1.12050: Flags [.], cksum 0xfe28 (incorrect -> 0x8b80), seq 657, ack 3561, win 510, options [nop,nop,TS val 1325356900 ecr 1325356900], length 0
2022-02-28 13:43:32.677219 IP (tos 0x0, ttl 64, id 50560, offset 0, flags [DF], proto TCP (6), length 348)
    127.0.0.1.45796 > 127.0.0.1.12050: Flags [P.], cksum 0xff50 (incorrect -> 0xc914), seq 657:953, ack 3561, win 512, options [nop,nop,TS val 1325356900 ecr 1325356900], length 296
2022-02-28 13:43:32.677229 IP (tos 0x0, ttl 64, id 30855, offset 0, flags [DF], proto TCP (6), length 52)
    127.0.0.1.12050 > 127.0.0.1.45796: Flags [.], cksum 0xfe28 (incorrect -> 0x8a58), seq 3561, ack 953, win 510, options [nop,nop,TS val 1325356900 ecr 1325356900], length 0
200, 3.726431369781494, 1.6685142517089844