2022-02-28 05:09:52.233847 IP (tos 0x0, ttl 64, id 32431, offset 0, flags [DF], proto TCP (6), length 60)
    127.0.0.1.48972 > 127.0.0.1.11850: Flags [S], cksum 0xfe30 (incorrect -> 0x670a), seq 3422343985, win 65495, options [mss 65495,sackOK,TS val 1294536457 ecr 0,nop,wscale 7], length 0
2022-02-28 05:09:52.233856 IP (tos 0x0, ttl 64, id 0, offset 0, flags [DF], proto TCP (6), length 60)
    127.0.0.1.11850 > 127.0.0.1.48972: Flags [S.], cksum 0xfe30 (incorrect -> 0x92aa), seq 369254950, ack 3422343986, win 65483, options [mss 65495,sackOK,TS val 1294536457 ecr 1294536457,nop,wscale 7], length 0
2022-02-28 05:09:52.233864 IP (tos 0x0, ttl 64, id 32432, offset 0, flags [DF], proto TCP (6), length 52)
    127.0.0.1.48972 > 127.0.0.1.11850: Flags [.], cksum 0xfe28 (incorrect -> 0xb966), seq 1, ack 1, win 512, options [nop,nop,TS val 1294536457 ecr 1294536457], length 0
2022-02-28 05:09:52.233954 IP (tos 0x0, ttl 64, id 32433, offset 0, flags [DF], proto TCP (6), length 55)
    127.0.0.1.48972 > 127.0.0.1.11850: Flags [P.], cksum 0xfe2b (incorrect -> 0xb45a), seq 1:4, ack 1, win 512, options [nop,nop,TS val 1294536457 ecr 1294536457], length 3
2022-02-28 05:09:52.233960 IP (tos 0x0, ttl 64, id 63801, offset 0, flags [DF], proto TCP (6), length 52)
    127.0.0.1.11850 > 127.0.0.1.48972: Flags [.], cksum 0xfe28 (incorrect -> 0xb963), seq 1, ack 4, win 512, options [nop,nop,TS val 1294536457 ecr 1294536457], length 0
2022-02-28 05:09:52.234021 IP (tos 0x0, ttl 64, id 63802, offset 0, flags [DF], proto TCP (6), length 54)
    127.0.0.1.11850 > 127.0.0.1.48972: Flags [P.], cksum 0xfe2a (incorrect -> 0xb459), seq 1:3, ack 4, win 512, options [nop,nop,TS val 1294536457 ecr 1294536457], length 2
2022-02-28 05:09:52.234028 IP (tos 0x0, ttl 64, id 32434, offset 0, flags [DF], proto TCP (6), length 52)
    127.0.0.1.48972 > 127.0.0.1.11850: Flags [.], cksum 0xfe28 (incorrect -> 0xb961), seq 4, ack 3, win 512, options [nop,nop,TS val 1294536457 ecr 1294536457], length 0
2022-02-28 05:09:52.255670 IP (tos 0x0, ttl 64, id 32435, offset 0, flags [DF], proto TCP (6), length 62)
    127.0.0.1.48972 > 127.0.0.1.11850: Flags [P.], cksum 0xfe32 (incorrect -> 0x6107), seq 4:14, ack 3, win 512, options [nop,nop,TS val 1294536479 ecr 1294536457], length 10
2022-02-28 05:09:52.255690 IP (tos 0x0, ttl 64, id 63803, offset 0, flags [DF], proto TCP (6), length 52)
    127.0.0.1.11850 > 127.0.0.1.48972: Flags [.], cksum 0xfe28 (incorrect -> 0xb92b), seq 3, ack 14, win 512, options [nop,nop,TS val 1294536479 ecr 1294536479], length 0
2022-02-28 05:09:52.394893 IP (tos 0x0, ttl 64, id 63804, offset 0, flags [DF], proto TCP (6), length 62)
    127.0.0.1.11850 > 127.0.0.1.48972: Flags [P.], cksum 0xfe32 (incorrect -> 0xb38d), seq 3:13, ack 14, win 512, options [nop,nop,TS val 1294536618 ecr 1294536479], length 10
2022-02-28 05:09:52.394904 IP (tos 0x0, ttl 64, id 32436, offset 0, flags [DF], proto TCP (6), length 52)
    127.0.0.1.48972 > 127.0.0.1.11850: Flags [.], cksum 0xfe28 (incorrect -> 0xb80b), seq 14, ack 13, win 512, options [nop,nop,TS val 1294536618 ecr 1294536618], length 0
2022-02-28 05:09:52.400715 IP (tos 0x0, ttl 64, id 32437, offset 0, flags [DF], proto TCP (6), length 569)
    127.0.0.1.48972 > 127.0.0.1.11850: Flags [P.], cksum 0x002e (incorrect -> 0xda52), seq 14:531, ack 13, win 512, options [nop,nop,TS val 1294536624 ecr 1294536618], length 517
2022-02-28 05:09:52.400728 IP (tos 0x0, ttl 64, id 63805, offset 0, flags [DF], proto TCP (6), length 52)
    127.0.0.1.11850 > 127.0.0.1.48972: Flags [.], cksum 0xfe28 (incorrect -> 0xb5fe), seq 13, ack 531, win 508, options [nop,nop,TS val 1294536624 ecr 1294536624], length 0
2022-02-28 05:09:52.523493 IP (tos 0x0, ttl 64, id 63806, offset 0, flags [DF], proto TCP (6), length 3538)
    127.0.0.1.11850 > 127.0.0.1.48972: Flags [P.], cksum 0x0bc7 (incorrect -> 0xed38), seq 13:3499, ack 531, win 512, options [nop,nop,TS val 1294536747 ecr 1294536624], length 3486
2022-02-28 05:09:52.523504 IP (tos 0x0, ttl 64, id 32438, offset 0, flags [DF], proto TCP (6), length 52)
    127.0.0.1.48972 > 127.0.0.1.11850: Flags [.], cksum 0xfe28 (incorrect -> 0xa778), seq 531, ack 3499, win 494, options [nop,nop,TS val 1294536747 ecr 1294536747], length 0
2022-02-28 05:09:52.618267 IP (tos 0x0, ttl 64, id 63807, offset 0, flags [DF], proto TCP (6), length 272)
    127.0.0.1.11850 > 127.0.0.1.48972: Flags [P.], cksum 0xff04 (incorrect -> 0xb611), seq 3499:3719, ack 531, win 512, options [nop,nop,TS val 1294536841 ecr 1294536747], length 220
2022-02-28 05:09:52.618278 IP (tos 0x0, ttl 64, id 32439, offset 0, flags [DF], proto TCP (6), length 52)
    127.0.0.1.48972 > 127.0.0.1.11850: Flags [.], cksum 0xfe28 (incorrect -> 0xa5d3), seq 531, ack 3719, win 507, options [nop,nop,TS val 1294536841 ecr 1294536841], length 0
2022-02-28 05:09:52.618355 IP (tos 0x0, ttl 64, id 32440, offset 0, flags [DF], proto TCP (6), length 132)
    127.0.0.1.48972 > 127.0.0.1.11850: Flags [P.], cksum 0xfe78 (incorrect -> 0xfd2f), seq 531:611, ack 3719, win 507, options [nop,nop,TS val 1294536841 ecr 1294536841], length 80
2022-02-28 05:09:52.618362 IP (tos 0x0, ttl 64, id 63808, offset 0, flags [DF], proto TCP (6), length 52)
    127.0.0.1.11850 > 127.0.0.1.48972: Flags [.], cksum 0xfe28 (incorrect -> 0xa57e), seq 3719, ack 611, win 512, options [nop,nop,TS val 1294536841 ecr 1294536841], length 0
2022-02-28 05:09:52.618797 IP (tos 0x0, ttl 64, id 32441, offset 0, flags [DF], proto TCP (6), length 350)
    127.0.0.1.48972 > 127.0.0.1.11850: Flags [P.], cksum 0xff52 (incorrect -> 0xbdca), seq 611:909, ack 3719, win 507, options [nop,nop,TS val 1294536842 ecr 1294536841], length 298
2022-02-28 05:09:52.618806 IP (tos 0x0, ttl 64, id 63809, offset 0, flags [DF], proto TCP (6), length 52)
    127.0.0.1.11850 > 127.0.0.1.48972: Flags [.], cksum 0xfe28 (incorrect -> 0xa454), seq 3719, ack 909, win 510, options [nop,nop,TS val 1294536842 ecr 1294536842], length 0
2022-02-28 05:09:53.438323 IP (tos 0x0, ttl 64, id 63810, offset 0, flags [DF], proto TCP (6), length 1736)
    127.0.0.1.11850 > 127.0.0.1.48972: Flags [P.], cksum 0x04bd (incorrect -> 0x5397), seq 3719:5403, ack 909, win 512, options [nop,nop,TS val 1294537661 ecr 1294536842], length 1684
2022-02-28 05:09:53.438335 IP (tos 0x0, ttl 64, id 32442, offset 0, flags [DF], proto TCP (6), length 52)
    127.0.0.1.48972 > 127.0.0.1.11850: Flags [.], cksum 0xfe28 (incorrect -> 0x9763), seq 909, ack 5403, win 501, options [nop,nop,TS val 1294537661 ecr 1294537661], length 0
2022-02-28 05:09:53.549567 IP (tos 0x0, ttl 64, id 63811, offset 0, flags [DF], proto TCP (6), length 3538)
    127.0.0.1.11850 > 127.0.0.1.48972: Flags [P.], cksum 0x0bc7 (incorrect -> 0x04da), seq 5403:8889, ack 909, win 512, options [nop,nop,TS val 1294537773 ecr 1294537661], length 3486
2022-02-28 05:09:53.549576 IP (tos 0x0, ttl 64, id 32443, offset 0, flags [DF], proto TCP (6), length 52)
    127.0.0.1.48972 > 127.0.0.1.11850: Flags [.], cksum 0xfe28 (incorrect -> 0x88ec), seq 909, ack 8889, win 494, options [nop,nop,TS val 1294537773 ecr 1294537773], length 0
2022-02-28 05:09:53.553089 IP (tos 0x0, ttl 64, id 63812, offset 0, flags [DF], proto TCP (6), length 2542)
    127.0.0.1.11850 > 127.0.0.1.48972: Flags [P.], cksum 0x07e3 (incorrect -> 0x80a6), seq 8889:11379, ack 909, win 512, options [nop,nop,TS val 1294537776 ecr 1294537773], length 2490
2022-02-28 05:09:53.553096 IP (tos 0x0, ttl 64, id 32444, offset 0, flags [DF], proto TCP (6), length 52)
    127.0.0.1.48972 > 127.0.0.1.11850: Flags [.], cksum 0xfe28 (incorrect -> 0x7f28), seq 909, ack 11379, win 498, options [nop,nop,TS val 1294537776 ecr 1294537776], length 0
2022-02-28 05:09:53.556562 IP (tos 0x0, ttl 64, id 63813, offset 0, flags [DF], proto TCP (6), length 1546)
    127.0.0.1.11850 > 127.0.0.1.48972: Flags [P.], cksum 0x03ff (incorrect -> 0x4cb1), seq 11379:12873, ack 909, win 512, options [nop,nop,TS val 1294537780 ecr 1294537776], length 1494
2022-02-28 05:09:53.556569 IP (tos 0x0, ttl 64, id 32445, offset 0, flags [DF], proto TCP (6), length 52)
    127.0.0.1.48972 > 127.0.0.1.11850: Flags [.], cksum 0xfe28 (incorrect -> 0x7946), seq 909, ack 12873, win 502, options [nop,nop,TS val 1294537780 ecr 1294537780], length 0
2022-02-28 05:09:53.559192 IP (tos 0x0, ttl 64, id 63814, offset 0, flags [DF], proto TCP (6), length 910)
    127.0.0.1.11850 > 127.0.0.1.48972: Flags [P.], cksum 0x0183 (incorrect -> 0x0436), seq 12873:13731, ack 909, win 512, options [nop,nop,TS val 1294537782 ecr 1294537780], length 858
2022-02-28 05:09:53.559199 IP (tos 0x0, ttl 64, id 32446, offset 0, flags [DF], proto TCP (6), length 52)
    127.0.0.1.48972 > 127.0.0.1.11850: Flags [.], cksum 0xfe28 (incorrect -> 0x75e6), seq 909, ack 13731, win 504, options [nop,nop,TS val 1294537782 ecr 1294537782], length 0
2022-02-28 05:09:53.568625 IP (tos 0x0, ttl 64, id 63815, offset 0, flags [DF], proto TCP (6), length 2828)
    127.0.0.1.11850 > 127.0.0.1.48972: Flags [P.], cksum 0x0901 (incorrect -> 0x76a8), seq 13731:16507, ack 909, win 512, options [nop,nop,TS val 1294537792 ecr 1294537782], length 2776
2022-02-28 05:09:53.568632 IP (tos 0x0, ttl 64, id 32447, offset 0, flags [DF], proto TCP (6), length 52)
    127.0.0.1.48972 > 127.0.0.1.11850: Flags [.], cksum 0xfe28 (incorrect -> 0x6b01), seq 909, ack 16507, win 497, options [nop,nop,TS val 1294537792 ecr 1294537792], length 0
2022-02-28 05:09:53.645142 IP (tos 0x0, ttl 64, id 63816, offset 0, flags [DF], proto TCP (6), length 4100)
    127.0.0.1.11850 > 127.0.0.1.48972: Flags [P.], cksum 0x0df9 (incorrect -> 0xa9f9), seq 16507:20555, ack 909, win 512, options [nop,nop,TS val 1294537868 ecr 1294537792], length 4048
2022-02-28 05:09:53.645151 IP (tos 0x0, ttl 64, id 32448, offset 0, flags [DF], proto TCP (6), length 52)
    127.0.0.1.48972 > 127.0.0.1.11850: Flags [.], cksum 0xfe28 (incorrect -> 0x5a9e), seq 909, ack 20555, win 492, options [nop,nop,TS val 1294537868 ecr 1294537868], length 0
2022-02-28 05:09:53.645158 IP (tos 0x0, ttl 64, id 63817, offset 0, flags [DF], proto TCP (6), length 3050)
    127.0.0.1.11850 > 127.0.0.1.48972: Flags [P.], cksum 0x09df (incorrect -> 0x1e23), seq 20555:23553, ack 909, win 512, options [nop,nop,TS val 1294537868 ecr 1294537868], length 2998
2022-02-28 05:09:53.645162 IP (tos 0x0, ttl 64, id 32449, offset 0, flags [DF], proto TCP (6), length 52)
    127.0.0.1.48972 > 127.0.0.1.11850: Flags [.], cksum 0xfe28 (incorrect -> 0x4ef4), seq 909, ack 23553, win 480, options [nop,nop,TS val 1294537868 ecr 1294537868], length 0
2022-02-28 05:09:53.645632 IP (tos 0x0, ttl 64, id 63818, offset 0, flags [DF], proto TCP (6), length 4100)
    127.0.0.1.11850 > 127.0.0.1.48972: Flags [P.], cksum 0x0df9 (incorrect -> 0xe4cd), seq 23553:27601, ack 909, win 512, options [nop,nop,TS val 1294537869 ecr 1294537868], length 4048
2022-02-28 05:09:53.645639 IP (tos 0x0, ttl 64, id 32450, offset 0, flags [DF], proto TCP (6), length 52)
    127.0.0.1.48972 > 127.0.0.1.11850: Flags [.], cksum 0xfe28 (incorrect -> 0x3f16), seq 909, ack 27601, win 492, options [nop,nop,TS val 1294537869 ecr 1294537869], length 0
2022-02-28 05:09:53.645646 IP (tos 0x0, ttl 64, id 63819, offset 0, flags [DF], proto TCP (6), length 62)
    127.0.0.1.11850 > 127.0.0.1.48972: Flags [P.], cksum 0xfe32 (incorrect -> 0x5ade), seq 27601:27611, ack 909, win 512, options [nop,nop,TS val 1294537869 ecr 1294537869], length 10
2022-02-28 05:09:53.645681 IP (tos 0x0, ttl 64, id 32451, offset 0, flags [DF], proto TCP (6), length 52)
    127.0.0.1.48972 > 127.0.0.1.11850: Flags [.], cksum 0xfe28 (incorrect -> 0x3ef8), seq 909, ack 27611, win 512, options [nop,nop,TS val 1294537869 ecr 1294537869], length 0
2022-02-28 05:09:53.646710 IP (tos 0x0, ttl 64, id 63820, offset 0, flags [DF], proto TCP (6), length 2044)
    127.0.0.1.11850 > 127.0.0.1.48972: Flags [P.], cksum 0x05f1 (incorrect -> 0x6fe2), seq 27611:29603, ack 909, win 512, options [nop,nop,TS val 1294537870 ecr 1294537869], length 1992
2022-02-28 05:09:53.646740 IP (tos 0x0, ttl 64, id 32452, offset 0, flags [DF], proto TCP (6), length 52)
    127.0.0.1.48972 > 127.0.0.1.11850: Flags [.], cksum 0xfe28 (incorrect -> 0x372e), seq 909, ack 29603, win 512, options [nop,nop,TS val 1294537870 ecr 1294537870], length 0
2022-02-28 05:09:53.654510 IP (tos 0x0, ttl 64, id 63821, offset 0, flags [DF], proto TCP (6), length 4100)
    127.0.0.1.11850 > 127.0.0.1.48972: Flags [P.], cksum 0x0df9 (incorrect -> 0xbd98), seq 29603:33651, ack 909, win 512, options [nop,nop,TS val 1294537878 ecr 1294537870], length 4048
2022-02-28 05:09:53.698144 IP (tos 0x0, ttl 64, id 32453, offset 0, flags [DF], proto TCP (6), length 52)
    127.0.0.1.48972 > 127.0.0.1.11850: Flags [.], cksum 0xfe28 (incorrect -> 0x2723), seq 909, ack 33651, win 512, options [nop,nop,TS val 1294537921 ecr 1294537878], length 0
2022-02-28 05:09:53.698152 IP (tos 0x0, ttl 64, id 63822, offset 0, flags [DF], proto TCP (6), length 7836)
    127.0.0.1.11850 > 127.0.0.1.48972: Flags [P.], cksum 0x1c91 (incorrect -> 0x3605), seq 33651:41435, ack 909, win 512, options [nop,nop,TS val 1294537921 ecr 1294537921], length 7784
2022-02-28 05:09:53.742151 IP (tos 0x0, ttl 64, id 32454, offset 0, flags [DF], proto TCP (6), length 52)
    127.0.0.1.48972 > 127.0.0.1.11850: Flags [.], cksum 0xfe28 (incorrect -> 0x0864), seq 909, ack 41435, win 512, options [nop,nop,TS val 1294537965 ecr 1294537921], length 0
2022-02-28 05:09:53.742166 IP (tos 0x0, ttl 64, id 63823, offset 0, flags [DF], proto TCP (6), length 30588)
    127.0.0.1.11850 > 127.0.0.1.48972: Flags [P.], cksum 0x7571 (incorrect -> 0x3ac7), seq 41435:71971, ack 909, win 512, options [nop,nop,TS val 1294537965 ecr 1294537965], length 30536
2022-02-28 05:09:53.786147 IP (tos 0x0, ttl 64, id 32455, offset 0, flags [DF], proto TCP (6), length 52)
    127.0.0.1.48972 > 127.0.0.1.11850: Flags [.], cksum 0xfe28 (incorrect -> 0x90c3), seq 909, ack 71971, win 512, options [nop,nop,TS val 1294538009 ecr 1294537965], length 0
2022-02-28 05:09:53.786158 IP (tos 0x0, ttl 64, id 63824, offset 0, flags [DF], proto TCP (6), length 7384)
    127.0.0.1.11850 > 127.0.0.1.48972: Flags [P.], cksum 0x1acd (incorrect -> 0x4aa4), seq 71971:79303, ack 909, win 512, options [nop,nop,TS val 1294538009 ecr 1294538009], length 7332
2022-02-28 05:09:53.786481 IP (tos 0x0, ttl 64, id 32456, offset 0, flags [DF], proto TCP (6), length 52)
    127.0.0.1.48972 > 127.0.0.1.11850: Flags [.], cksum 0xfe28 (incorrect -> 0x73f2), seq 909, ack 79303, win 512, options [nop,nop,TS val 1294538010 ecr 1294538009], length 0
2022-02-28 05:09:53.830686 IP (tos 0x0, ttl 64, id 63825, offset 0, flags [DF], proto TCP (6), length 2908)
    127.0.0.1.11850 > 127.0.0.1.48972: Flags [P.], cksum 0x0951 (incorrect -> 0xc4e7), seq 79303:82159, ack 909, win 512, options [nop,nop,TS val 1294538054 ecr 1294538010], length 2856
2022-02-28 05:09:53.830728 IP (tos 0x0, ttl 64, id 32457, offset 0, flags [DF], proto TCP (6), length 52)
    127.0.0.1.48972 > 127.0.0.1.11850: Flags [.], cksum 0xfe28 (incorrect -> 0x6871), seq 909, ack 82159, win 512, options [nop,nop,TS val 1294538054 ecr 1294538054], length 0
2022-02-28 05:09:54.327845 IP (tos 0x0, ttl 64, id 63826, offset 0, flags [DF], proto TCP (6), length 603)
    127.0.0.1.11850 > 127.0.0.1.48972: Flags [P.], cksum 0x0050 (incorrect -> 0x832b), seq 82159:82710, ack 909, win 512, options [nop,nop,TS val 1294538551 ecr 1294538054], length 551
2022-02-28 05:09:54.327856 IP (tos 0x0, ttl 64, id 32458, offset 0, flags [DF], proto TCP (6), length 52)
    127.0.0.1.48972 > 127.0.0.1.11850: Flags [.], cksum 0xfe28 (incorrect -> 0x626c), seq 909, ack 82710, win 508, options [nop,nop,TS val 1294538551 ecr 1294538551], length 0
2022-02-28 05:09:54.394611 IP (tos 0x0, ttl 64, id 63827, offset 0, flags [DF], proto TCP (6), length 3174)
    127.0.0.1.11850 > 127.0.0.1.48972: Flags [P.], cksum 0x0a5b (incorrect -> 0xa0fd), seq 82710:85832, ack 909, win 512, options [nop,nop,TS val 1294538618 ecr 1294538551], length 3122
2022-02-28 05:09:54.394672 IP (tos 0x0, ttl 64, id 32459, offset 0, flags [DF], proto TCP (6), length 52)
    127.0.0.1.48972 > 127.0.0.1.11850: Flags [.], cksum 0xfe28 (incorrect -> 0x55b0), seq 909, ack 85832, win 512, options [nop,nop,TS val 1294538618 ecr 1294538618], length 0
2022-02-28 05:09:54.401027 IP (tos 0x0, ttl 64, id 63828, offset 0, flags [DF], proto TCP (6), length 4100)
    127.0.0.1.11850 > 127.0.0.1.48972: Flags [P.], cksum 0x0df9 (incorrect -> 0x6b57), seq 85832:89880, ack 909, win 512, options [nop,nop,TS val 1294538624 ecr 1294538618], length 4048
2022-02-28 05:09:54.401312 IP (tos 0x0, ttl 64, id 32460, offset 0, flags [DF], proto TCP (6), length 52)
    127.0.0.1.48972 > 127.0.0.1.11850: Flags [.], cksum 0xfe28 (incorrect -> 0x45d4), seq 909, ack 89880, win 512, options [nop,nop,TS val 1294538624 ecr 1294538624], length 0
2022-02-28 05:09:54.401319 IP (tos 0x0, ttl 64, id 63829, offset 0, flags [DF], proto TCP (6), length 6850)
    127.0.0.1.11850 > 127.0.0.1.48972: Flags [P.], cksum 0x18b7 (incorrect -> 0x3e61), seq 89880:96678, ack 909, win 512, options [nop,nop,TS val 1294538624 ecr 1294538624], length 6798
2022-02-28 05:09:54.401324 IP (tos 0x0, ttl 64, id 32461, offset 0, flags [DF], proto TCP (6), length 52)
    127.0.0.1.48972 > 127.0.0.1.11850: Flags [.], cksum 0xfe28 (incorrect -> 0x2b46), seq 909, ack 96678, win 512, options [nop,nop,TS val 1294538624 ecr 1294538624], length 0
2022-02-28 05:09:54.404499 IP (tos 0x0, ttl 64, id 63830, offset 0, flags [DF], proto TCP (6), length 4042)
    127.0.0.1.11850 > 127.0.0.1.48972: Flags [P.], cksum 0x0dbf (incorrect -> 0x6a6b), seq 96678:100668, ack 909, win 512, options [nop,nop,TS val 1294538628 ecr 1294538624], length 3990
2022-02-28 05:09:54.404880 IP (tos 0x0, ttl 64, id 32462, offset 0, flags [DF], proto TCP (6), length 52)
    127.0.0.1.48972 > 127.0.0.1.11850: Flags [.], cksum 0xfe28 (incorrect -> 0x1ba8), seq 909, ack 100668, win 512, options [nop,nop,TS val 1294538628 ecr 1294538628], length 0
2022-02-28 05:09:54.404890 IP (tos 0x0, ttl 64, id 63831, offset 0, flags [DF], proto TCP (6), length 3538)
    127.0.0.1.11850 > 127.0.0.1.48972: Flags [P.], cksum 0x0bc7 (incorrect -> 0xd5fd), seq 100668:104154, ack 909, win 512, options [nop,nop,TS val 1294538628 ecr 1294538628], length 3486
2022-02-28 05:09:54.404898 IP (tos 0x0, ttl 64, id 32463, offset 0, flags [DF], proto TCP (6), length 52)
    127.0.0.1.48972 > 127.0.0.1.11850: Flags [.], cksum 0xfe28 (incorrect -> 0x0e0a), seq 909, ack 104154, win 512, options [nop,nop,TS val 1294538628 ecr 1294538628], length 0
2022-02-28 05:09:54.412422 IP (tos 0x0, ttl 64, id 63832, offset 0, flags [DF], proto TCP (6), length 4100)
    127.0.0.1.11850 > 127.0.0.1.48972: Flags [P.], cksum 0x0df9 (incorrect -> 0xea8a), seq 104154:108202, ack 909, win 512, options [nop,nop,TS val 1294538635 ecr 1294538628], length 4048
2022-02-28 05:09:54.413107 IP (tos 0x0, ttl 64, id 32464, offset 0, flags [DF], proto TCP (6), length 52)
    127.0.0.1.48972 > 127.0.0.1.11850: Flags [.], cksum 0xfe28 (incorrect -> 0xfe2a), seq 909, ack 108202, win 512, options [nop,nop,TS val 1294538636 ecr 1294538635], length 0
2022-02-28 05:09:54.413120 IP (tos 0x0, ttl 64, id 63833, offset 0, flags [DF], proto TCP (6), length 13240)
    127.0.0.1.11850 > 127.0.0.1.48972: Flags [P.], cksum 0x31ad (incorrect -> 0x98f7), seq 108202:121390, ack 909, win 512, options [nop,nop,TS val 1294538636 ecr 1294538636], length 13188
2022-02-28 05:09:54.413349 IP (tos 0x0, ttl 64, id 32465, offset 0, flags [DF], proto TCP (6), length 52)
    127.0.0.1.48972 > 127.0.0.1.11850: Flags [.], cksum 0xfe28 (incorrect -> 0xcaa5), seq 909, ack 121390, win 512, options [nop,nop,TS val 1294538636 ecr 1294538636], length 0
2022-02-28 05:09:54.414046 IP (tos 0x0, ttl 64, id 63834, offset 0, flags [DF], proto TCP (6), length 3538)
    127.0.0.1.11850 > 127.0.0.1.48972: Flags [P.], cksum 0x0bc7 (incorrect -> 0x662f), seq 121390:124876, ack 909, win 512, options [nop,nop,TS val 1294538637 ecr 1294538636], length 3486
2022-02-28 05:09:54.414287 IP (tos 0x0, ttl 64, id 32466, offset 0, flags [DF], proto TCP (6), length 52)
    127.0.0.1.48972 > 127.0.0.1.11850: Flags [.], cksum 0xfe28 (incorrect -> 0xbd05), seq 909, ack 124876, win 512, options [nop,nop,TS val 1294538637 ecr 1294538637], length 0
2022-02-28 05:09:54.464611 IP (tos 0x0, ttl 64, id 63835, offset 0, flags [DF], proto TCP (6), length 3538)
    127.0.0.1.11850 > 127.0.0.1.48972: Flags [P.], cksum 0x0bc7 (incorrect -> 0xc7bb), seq 124876:128362, ack 909, win 512, options [nop,nop,TS val 1294538688 ecr 1294538637], length 3486
2022-02-28 05:09:54.506146 IP (tos 0x0, ttl 64, id 32467, offset 0, flags [DF], proto TCP (6), length 52)
    127.0.0.1.48972 > 127.0.0.1.11850: Flags [.], cksum 0xfe28 (incorrect -> 0xaed8), seq 909, ack 128362, win 512, options [nop,nop,TS val 1294538729 ecr 1294538688], length 0
2022-02-28 05:09:54.506158 IP (tos 0x0, ttl 64, id 63836, offset 0, flags [DF], proto TCP (6), length 17325)
    127.0.0.1.11850 > 127.0.0.1.48972: Flags [P.], cksum 0x41a2 (incorrect -> 0xed9f), seq 128362:145635, ack 909, win 512, options [nop,nop,TS val 1294538729 ecr 1294538729], length 17273
2022-02-28 05:09:54.511699 IP (tos 0x0, ttl 64, id 63837, offset 0, flags [DF], proto TCP (6), length 32820)
    127.0.0.1.11850 > 127.0.0.1.48972: Flags [.], cksum 0x7e29 (incorrect -> 0x108f), seq 145635:178403, ack 909, win 512, options [nop,nop,TS val 1294538735 ecr 1294538729], length 32768
2022-02-28 05:09:54.511717 IP (tos 0x0, ttl 64, id 32468, offset 0, flags [DF], proto TCP (6), length 52)
    127.0.0.1.48972 > 127.0.0.1.11850: Flags [.], cksum 0xfe28 (incorrect -> 0xebb4), seq 909, ack 178403, win 379, options [nop,nop,TS val 1294538735 ecr 1294538729], length 0
2022-02-28 05:09:54.511723 IP (tos 0x0, ttl 64, id 63838, offset 0, flags [DF], proto TCP (6), length 2243)
    127.0.0.1.11850 > 127.0.0.1.48972: Flags [P.], cksum 0x06b8 (incorrect -> 0x4448), seq 178403:180594, ack 909, win 512, options [nop,nop,TS val 1294538735 ecr 1294538735], length 2191
2022-02-28 05:09:54.512169 IP (tos 0x0, ttl 64, id 32469, offset 0, flags [DF], proto TCP (6), length 52)
    127.0.0.1.48972 > 127.0.0.1.11850: Flags [.], cksum 0xfe28 (incorrect -> 0xe29a), seq 909, ack 180594, win 512, options [nop,nop,TS val 1294538735 ecr 1294538735], length 0
2022-02-28 05:09:54.512813 IP (tos 0x0, ttl 64, id 63839, offset 0, flags [DF], proto TCP (6), length 4078)
    127.0.0.1.11850 > 127.0.0.1.48972: Flags [P.], cksum 0x0de3 (incorrect -> 0x7d15), seq 180594:184620, ack 909, win 512, options [nop,nop,TS val 1294538736 ecr 1294538735], length 4026
2022-02-28 05:09:54.512827 IP (tos 0x0, ttl 64, id 32470, offset 0, flags [DF], proto TCP (6), length 52)
    127.0.0.1.48972 > 127.0.0.1.11850: Flags [.], cksum 0xfe28 (incorrect -> 0xd2de), seq 909, ack 184620, win 512, options [nop,nop,TS val 1294538736 ecr 1294538736], length 0
2022-02-28 05:09:54.513106 IP (tos 0x0, ttl 64, id 63840, offset 0, flags [DF], proto TCP (6), length 4100)
    127.0.0.1.11850 > 127.0.0.1.48972: Flags [P.], cksum 0x0df9 (incorrect -> 0xbd8a), seq 184620:188668, ack 909, win 512, options [nop,nop,TS val 1294538736 ecr 1294538736], length 4048
2022-02-28 05:09:54.513318 IP (tos 0x0, ttl 64, id 32471, offset 0, flags [DF], proto TCP (6), length 52)
    127.0.0.1.48972 > 127.0.0.1.11850: Flags [.], cksum 0xfe28 (incorrect -> 0xc30e), seq 909, ack 188668, win 512, options [nop,nop,TS val 1294538736 ecr 1294538736], length 0
2022-02-28 05:09:54.513325 IP (tos 0x0, ttl 64, id 63841, offset 0, flags [DF], proto TCP (6), length 3021)
    127.0.0.1.11850 > 127.0.0.1.48972: Flags [P.], cksum 0x09c2 (incorrect -> 0xf35f), seq 188668:191637, ack 909, win 512, options [nop,nop,TS val 1294538736 ecr 1294538736], length 2969
2022-02-28 05:09:54.513329 IP (tos 0x0, ttl 64, id 32472, offset 0, flags [DF], proto TCP (6), length 52)
    127.0.0.1.48972 > 127.0.0.1.11850: Flags [.], cksum 0xfe28 (incorrect -> 0xb775), seq 909, ack 191637, win 512, options [nop,nop,TS val 1294538736 ecr 1294538736], length 0
2022-02-28 05:09:54.513702 IP (tos 0x0, ttl 64, id 63842, offset 0, flags [DF], proto TCP (6), length 4100)
    127.0.0.1.11850 > 127.0.0.1.48972: Flags [P.], cksum 0x0df9 (incorrect -> 0x5c8c), seq 191637:195685, ack 909, win 512, options [nop,nop,TS val 1294538737 ecr 1294538736], length 4048
2022-02-28 05:09:54.513774 IP (tos 0x0, ttl 64, id 32473, offset 0, flags [DF], proto TCP (6), length 52)
    127.0.0.1.48972 > 127.0.0.1.11850: Flags [.], cksum 0xfe28 (incorrect -> 0xa7a3), seq 909, ack 195685, win 512, options [nop,nop,TS val 1294538737 ecr 1294538737], length 0
2022-02-28 05:09:54.513787 IP (tos 0x0, ttl 64, id 63843, offset 0, flags [DF], proto TCP (6), length 7892)
    127.0.0.1.11850 > 127.0.0.1.48972: Flags [P.], cksum 0x1cc9 (incorrect -> 0x3e84), seq 195685:203525, ack 909, win 512, options [nop,nop,TS val 1294538737 ecr 1294538737], length 7840
2022-02-28 05:09:54.513799 IP (tos 0x0, ttl 64, id 32474, offset 0, flags [DF], proto TCP (6), length 52)
    127.0.0.1.48972 > 127.0.0.1.11850: Flags [.], cksum 0xfe28 (incorrect -> 0x8903), seq 909, ack 203525, win 512, options [nop,nop,TS val 1294538737 ecr 1294538737], length 0
2022-02-28 05:09:54.517045 IP (tos 0x0, ttl 64, id 63844, offset 0, flags [DF], proto TCP (6), length 4100)
    127.0.0.1.11850 > 127.0.0.1.48972: Flags [P.], cksum 0x0df9 (incorrect -> 0x07cd), seq 203525:207573, ack 909, win 512, options [nop,nop,TS val 1294538740 ecr 1294538737], length 4048
2022-02-28 05:09:54.517300 IP (tos 0x0, ttl 64, id 32475, offset 0, flags [DF], proto TCP (6), length 52)
    127.0.0.1.48972 > 127.0.0.1.11850: Flags [.], cksum 0xfe28 (incorrect -> 0x792d), seq 909, ack 207573, win 512, options [nop,nop,TS val 1294538740 ecr 1294538740], length 0
2022-02-28 05:09:54.517307 IP (tos 0x0, ttl 64, id 63845, offset 0, flags [DF], proto TCP (6), length 3735)
    127.0.0.1.11850 > 127.0.0.1.48972: Flags [P.], cksum 0x0c8c (incorrect -> 0x17c4), seq 207573:211256, ack 909, win 512, options [nop,nop,TS val 1294538740 ecr 1294538740], length 3683
2022-02-28 05:09:54.517315 IP (tos 0x0, ttl 64, id 32476, offset 0, flags [DF], proto TCP (6), length 52)
    127.0.0.1.48972 > 127.0.0.1.11850: Flags [.], cksum 0xfe28 (incorrect -> 0x6aca), seq 909, ack 211256, win 512, options [nop,nop,TS val 1294538740 ecr 1294538740], length 0
2022-02-28 05:09:54.522360 IP (tos 0x0, ttl 64, id 63846, offset 0, flags [DF], proto TCP (6), length 1546)
    127.0.0.1.11850 > 127.0.0.1.48972: Flags [P.], cksum 0x03ff (incorrect -> 0x3c22), seq 211256:212750, ack 909, win 512, options [nop,nop,TS val 1294538745 ecr 1294538740], length 1494
2022-02-28 05:09:54.522380 IP (tos 0x0, ttl 64, id 32477, offset 0, flags [DF], proto TCP (6), length 52)
    127.0.0.1.48972 > 127.0.0.1.11850: Flags [.], cksum 0xfe28 (incorrect -> 0x64ea), seq 909, ack 212750, win 512, options [nop,nop,TS val 1294538745 ecr 1294538745], length 0
2022-02-28 05:09:54.560174 IP (tos 0x0, ttl 64, id 63847, offset 0, flags [DF], proto TCP (6), length 3538)
    127.0.0.1.11850 > 127.0.0.1.48972: Flags [P.], cksum 0x0bc7 (incorrect -> 0x32d1), seq 212750:216236, ack 909, win 512, options [nop,nop,TS val 1294538783 ecr 1294538745], length 3486
2022-02-28 05:09:54.560180 IP (tos 0x0, ttl 64, id 32478, offset 0, flags [DF], proto TCP (6), length 52)
    127.0.0.1.48972 > 127.0.0.1.11850: Flags [.], cksum 0xfe28 (incorrect -> 0x5301), seq 909, ack 216236, win 1535, options [nop,nop,TS val 1294538783 ecr 1294538783], length 0
2022-02-28 05:09:54.570135 IP (tos 0x0, ttl 64, id 63848, offset 0, flags [DF], proto TCP (6), length 3474)
    127.0.0.1.11850 > 127.0.0.1.48972: Flags [P.], cksum 0x0b87 (incorrect -> 0x3941), seq 216236:219658, ack 909, win 512, options [nop,nop,TS val 1294538793 ecr 1294538783], length 3422
2022-02-28 05:09:54.570142 IP (tos 0x0, ttl 64, id 32479, offset 0, flags [DF], proto TCP (6), length 52)
    127.0.0.1.48972 > 127.0.0.1.11850: Flags [.], cksum 0xfe28 (incorrect -> 0x418f), seq 909, ack 219658, win 2559, options [nop,nop,TS val 1294538793 ecr 1294538793], length 0
2022-02-28 05:09:54.577145 IP (tos 0x0, ttl 64, id 63849, offset 0, flags [DF], proto TCP (6), length 4070)
    127.0.0.1.11850 > 127.0.0.1.48972: Flags [P.], cksum 0x0ddb (incorrect -> 0x65cf), seq 219658:223676, ack 909, win 512, options [nop,nop,TS val 1294538800 ecr 1294538793], length 4018
2022-02-28 05:09:54.577155 IP (tos 0x0, ttl 64, id 32480, offset 0, flags [DF], proto TCP (6), length 52)
    127.0.0.1.48972 > 127.0.0.1.11850: Flags [.], cksum 0xfe28 (incorrect -> 0x2dd0), seq 909, ack 223676, win 3582, options [nop,nop,TS val 1294538800 ecr 1294538800], length 0
2022-02-28 05:09:54.577235 IP (tos 0x0, ttl 64, id 63850, offset 0, flags [DF], proto TCP (6), length 4100)
    127.0.0.1.11850 > 127.0.0.1.48972: Flags [P.], cksum 0x0df9 (incorrect -> 0x803e), seq 223676:227724, ack 909, win 512, options [nop,nop,TS val 1294538800 ecr 1294538800], length 4048
2022-02-28 05:09:54.577241 IP (tos 0x0, ttl 64, id 32481, offset 0, flags [DF], proto TCP (6), length 52)
    127.0.0.1.48972 > 127.0.0.1.11850: Flags [.], cksum 0xfe28 (incorrect -> 0x1a01), seq 909, ack 227724, win 4605, options [nop,nop,TS val 1294538800 ecr 1294538800], length 0
2022-02-28 05:09:54.577252 IP (tos 0x0, ttl 64, id 63851, offset 0, flags [DF], proto TCP (6), length 3972)
    127.0.0.1.11850 > 127.0.0.1.48972: Flags [P.], cksum 0x0d79 (incorrect -> 0xe038), seq 227724:231644, ack 909, win 512, options [nop,nop,TS val 1294538800 ecr 1294538800], length 3920
2022-02-28 05:09:54.577258 IP (tos 0x0, ttl 64, id 32482, offset 0, flags [DF], proto TCP (6), length 52)
    127.0.0.1.48972 > 127.0.0.1.11850: Flags [.], cksum 0xfe28 (incorrect -> 0x06b2), seq 909, ack 231644, win 5628, options [nop,nop,TS val 1294538800 ecr 1294538800], length 0
2022-02-28 05:09:54.578603 IP (tos 0x0, ttl 64, id 63852, offset 0, flags [DF], proto TCP (6), length 4100)
    127.0.0.1.11850 > 127.0.0.1.48972: Flags [P.], cksum 0x0df9 (incorrect -> 0x9a45), seq 231644:235692, ack 909, win 512, options [nop,nop,TS val 1294538802 ecr 1294538800], length 4048
2022-02-28 05:09:54.578624 IP (tos 0x0, ttl 64, id 32483, offset 0, flags [DF], proto TCP (6), length 52)
    127.0.0.1.48972 > 127.0.0.1.11850: Flags [.], cksum 0xfe28 (incorrect -> 0xf2de), seq 909, ack 235692, win 6651, options [nop,nop,TS val 1294538802 ecr 1294538802], length 0
2022-02-28 05:09:54.578637 IP (tos 0x0, ttl 64, id 63853, offset 0, flags [DF], proto TCP (6), length 422)
    127.0.0.1.11850 > 127.0.0.1.48972: Flags [P.], cksum 0xff9a (incorrect -> 0x21be), seq 235692:236062, ack 909, win 512, options [nop,nop,TS val 1294538802 ecr 1294538802], length 370
2022-02-28 05:09:54.578772 IP (tos 0x0, ttl 64, id 32484, offset 0, flags [DF], proto TCP (6), length 52)
    127.0.0.1.48972 > 127.0.0.1.11850: Flags [.], cksum 0xfe28 (incorrect -> 0xf16c), seq 909, ack 236062, win 6651, options [nop,nop,TS val 1294538802 ecr 1294538802], length 0
2022-02-28 05:09:54.578780 IP (tos 0x0, ttl 64, id 63854, offset 0, flags [DF], proto TCP (6), length 3191)
    127.0.0.1.11850 > 127.0.0.1.48972: Flags [P.], cksum 0x0a6c (incorrect -> 0xcd69), seq 236062:239201, ack 909, win 512, options [nop,nop,TS val 1294538802 ecr 1294538802], length 3139
2022-02-28 05:09:54.578786 IP (tos 0x0, ttl 64, id 32485, offset 0, flags [DF], proto TCP (6), length 52)
    127.0.0.1.48972 > 127.0.0.1.11850: Flags [.], cksum 0xfe28 (incorrect -> 0xe12a), seq 909, ack 239201, win 7674, options [nop,nop,TS val 1294538802 ecr 1294538802], length 0
2022-02-28 05:09:54.586005 IP (tos 0x0, ttl 64, id 63855, offset 0, flags [DF], proto TCP (6), length 4100)
    127.0.0.1.11850 > 127.0.0.1.48972: Flags [P.], cksum 0x0df9 (incorrect -> 0xa43d), seq 239201:243249, ack 909, win 512, options [nop,nop,TS val 1294538809 ecr 1294538802], length 4048
2022-02-28 05:09:54.586015 IP (tos 0x0, ttl 64, id 32486, offset 0, flags [DF], proto TCP (6), length 52)
    127.0.0.1.48972 > 127.0.0.1.11850: Flags [.], cksum 0xfe28 (incorrect -> 0xcd4c), seq 909, ack 243249, win 8698, options [nop,nop,TS val 1294538809 ecr 1294538809], length 0
2022-02-28 05:09:54.586024 IP (tos 0x0, ttl 64, id 63856, offset 0, flags [DF], proto TCP (6), length 3474)
    127.0.0.1.11850 > 127.0.0.1.48972: Flags [P.], cksum 0x0b87 (incorrect -> 0x2da4), seq 243249:246671, ack 909, win 512, options [nop,nop,TS val 1294538809 ecr 1294538809], length 3422
2022-02-28 05:09:54.586027 IP (tos 0x0, ttl 64, id 32487, offset 0, flags [DF], proto TCP (6), length 52)
    127.0.0.1.48972 > 127.0.0.1.11850: Flags [.], cksum 0xfe28 (incorrect -> 0xbbef), seq 909, ack 246671, win 9721, options [nop,nop,TS val 1294538809 ecr 1294538809], length 0
200, 3.916644334793091, 2.46482253074646