2022-02-28 03:13:11.387210 IP (tos 0x0, ttl 64, id 14590, offset 0, flags [DF], proto TCP (6), length 60)
    127.0.0.1.36616 > 127.0.0.1.10550: Flags [S], cksum 0xfe30 (incorrect -> 0x96ea), seq 1366566572, win 65495, options [mss 65495,sackOK,TS val 1287535610 ecr 0,nop,wscale 7], length 0
2022-02-28 03:13:11.387222 IP (tos 0x0, ttl 64, id 0, offset 0, flags [DF], proto TCP (6), length 60)
    127.0.0.1.10550 > 127.0.0.1.36616: Flags [S.], cksum 0xfe30 (incorrect -> 0xb8c9), seq 3669719719, ack 1366566573, win 65483, options [mss 65495,sackOK,TS val 1287535610 ecr 1287535610,nop,wscale 7], length 0
2022-02-28 03:13:11.387231 IP (tos 0x0, ttl 64, id 14591, offset 0, flags [DF], proto TCP (6), length 52)
    127.0.0.1.36616 > 127.0.0.1.10550: Flags [.], cksum 0xfe28 (incorrect -> 0xdf85), seq 1, ack 1, win 512, options [nop,nop,TS val 1287535610 ecr 1287535610], length 0
2022-02-28 03:13:11.387359 IP (tos 0x0, ttl 64, id 14592, offset 0, flags [DF], proto TCP (6), length 55)
    127.0.0.1.36616 > 127.0.0.1.10550: Flags [P.], cksum 0xfe2b (incorrect -> 0xda79), seq 1:4, ack 1, win 512, options [nop,nop,TS val 1287535610 ecr 1287535610], length 3
2022-02-28 03:13:11.387375 IP (tos 0x0, ttl 64, id 16620, offset 0, flags [DF], proto TCP (6), length 52)
    127.0.0.1.10550 > 127.0.0.1.36616: Flags [.], cksum 0xfe28 (incorrect -> 0xdf82), seq 1, ack 4, win 512, options [nop,nop,TS val 1287535610 ecr 1287535610], length 0
2022-02-28 03:13:11.387404 IP (tos 0x0, ttl 64, id 16621, offset 0, flags [DF], proto TCP (6), length 54)
    127.0.0.1.10550 > 127.0.0.1.36616: Flags [P.], cksum 0xfe2a (incorrect -> 0xda78), seq 1:3, ack 4, win 512, options [nop,nop,TS val 1287535610 ecr 1287535610], length 2
2022-02-28 03:13:11.387414 IP (tos 0x0, ttl 64, id 14593, offset 0, flags [DF], proto TCP (6), length 52)
    127.0.0.1.36616 > 127.0.0.1.10550: Flags [.], cksum 0xfe28 (incorrect -> 0xdf80), seq 4, ack 3, win 512, options [nop,nop,TS val 1287535610 ecr 1287535610], length 0
2022-02-28 03:13:11.400668 IP (tos 0x0, ttl 64, id 14594, offset 0, flags [DF], proto TCP (6), length 62)
    127.0.0.1.36616 > 127.0.0.1.10550: Flags [P.], cksum 0xfe32 (incorrect -> 0x4f64), seq 4:14, ack 3, win 512, options [nop,nop,TS val 1287535624 ecr 1287535610], length 10
2022-02-28 03:13:11.400689 IP (tos 0x0, ttl 64, id 16622, offset 0, flags [DF], proto TCP (6), length 52)
    127.0.0.1.10550 > 127.0.0.1.36616: Flags [.], cksum 0xfe28 (incorrect -> 0xdf5a), seq 3, ack 14, win 512, options [nop,nop,TS val 1287535624 ecr 1287535624], length 0
2022-02-28 03:13:11.564148 IP (tos 0x0, ttl 64, id 16623, offset 0, flags [DF], proto TCP (6), length 62)
    127.0.0.1.10550 > 127.0.0.1.36616: Flags [P.], cksum 0xfe32 (incorrect -> 0xd9a4), seq 3:13, ack 14, win 512, options [nop,nop,TS val 1287535787 ecr 1287535624], length 10
2022-02-28 03:13:11.564159 IP (tos 0x0, ttl 64, id 14595, offset 0, flags [DF], proto TCP (6), length 52)
    127.0.0.1.36616 > 127.0.0.1.10550: Flags [.], cksum 0xfe28 (incorrect -> 0xde0a), seq 14, ack 13, win 512, options [nop,nop,TS val 1287535787 ecr 1287535787], length 0
2022-02-28 03:13:11.570073 IP (tos 0x0, ttl 64, id 14596, offset 0, flags [DF], proto TCP (6), length 569)
    127.0.0.1.36616 > 127.0.0.1.10550: Flags [P.], cksum 0x002e (incorrect -> 0x5451), seq 14:531, ack 13, win 512, options [nop,nop,TS val 1287535793 ecr 1287535787], length 517
2022-02-28 03:13:11.570085 IP (tos 0x0, ttl 64, id 16624, offset 0, flags [DF], proto TCP (6), length 52)
    127.0.0.1.10550 > 127.0.0.1.36616: Flags [.], cksum 0xfe28 (incorrect -> 0xdbfd), seq 13, ack 531, win 508, options [nop,nop,TS val 1287535793 ecr 1287535793], length 0
2022-02-28 03:13:11.681396 IP (tos 0x0, ttl 64, id 16625, offset 0, flags [DF], proto TCP (6), length 3538)
    127.0.0.1.10550 > 127.0.0.1.36616: Flags [P.], cksum 0x0bc7 (incorrect -> 0x6ebc), seq 13:3499, ack 531, win 512, options [nop,nop,TS val 1287535904 ecr 1287535793], length 3486
2022-02-28 03:13:11.681408 IP (tos 0x0, ttl 64, id 14597, offset 0, flags [DF], proto TCP (6), length 52)
    127.0.0.1.36616 > 127.0.0.1.10550: Flags [.], cksum 0xfe28 (incorrect -> 0xcd8f), seq 531, ack 3499, win 494, options [nop,nop,TS val 1287535904 ecr 1287535904], length 0
2022-02-28 03:13:11.720914 IP (tos 0x0, ttl 64, id 16626, offset 0, flags [DF], proto TCP (6), length 1151)
    127.0.0.1.10550 > 127.0.0.1.36616: Flags [P.], cksum 0x0274 (incorrect -> 0xc0c1), seq 3499:4598, ack 531, win 512, options [nop,nop,TS val 1287535944 ecr 1287535904], length 1099
2022-02-28 03:13:11.720923 IP (tos 0x0, ttl 64, id 14598, offset 0, flags [DF], proto TCP (6), length 52)
    127.0.0.1.36616 > 127.0.0.1.10550: Flags [.], cksum 0xfe28 (incorrect -> 0xc8eb), seq 531, ack 4598, win 503, options [nop,nop,TS val 1287535944 ecr 1287535944], length 0
2022-02-28 03:13:11.721354 IP (tos 0x0, ttl 64, id 14599, offset 0, flags [DF], proto TCP (6), length 132)
    127.0.0.1.36616 > 127.0.0.1.10550: Flags [P.], cksum 0xfe78 (incorrect -> 0x9c01), seq 531:611, ack 4598, win 512, options [nop,nop,TS val 1287535944 ecr 1287535944], length 80
2022-02-28 03:13:11.721363 IP (tos 0x0, ttl 64, id 16627, offset 0, flags [DF], proto TCP (6), length 52)
    127.0.0.1.10550 > 127.0.0.1.36616: Flags [.], cksum 0xfe28 (incorrect -> 0xc892), seq 4598, ack 611, win 512, options [nop,nop,TS val 1287535944 ecr 1287535944], length 0
2022-02-28 03:13:11.721771 IP (tos 0x0, ttl 64, id 14600, offset 0, flags [DF], proto TCP (6), length 381)
    127.0.0.1.36616 > 127.0.0.1.10550: Flags [P.], cksum 0xff71 (incorrect -> 0x0b1f), seq 611:940, ack 4598, win 512, options [nop,nop,TS val 1287535945 ecr 1287535944], length 329
2022-02-28 03:13:11.721780 IP (tos 0x0, ttl 64, id 16628, offset 0, flags [DF], proto TCP (6), length 52)
    127.0.0.1.10550 > 127.0.0.1.36616: Flags [.], cksum 0xfe28 (incorrect -> 0xc749), seq 4598, ack 940, win 510, options [nop,nop,TS val 1287535945 ecr 1287535945], length 0
2022-02-28 03:13:11.831958 IP (tos 0x0, ttl 64, id 16629, offset 0, flags [DF], proto TCP (6), length 210)
    127.0.0.1.10550 > 127.0.0.1.36616: Flags [P.], cksum 0xfec6 (incorrect -> 0x63cf), seq 4598:4756, ack 940, win 512, options [nop,nop,TS val 1287536055 ecr 1287535945], length 158
2022-02-28 03:13:11.831967 IP (tos 0x0, ttl 64, id 14601, offset 0, flags [DF], proto TCP (6), length 52)
    127.0.0.1.36616 > 127.0.0.1.10550: Flags [.], cksum 0xfe28 (incorrect -> 0xc5ce), seq 940, ack 4756, win 511, options [nop,nop,TS val 1287536055 ecr 1287536055], length 0
2022-02-28 03:13:11.889168 IP (tos 0x0, ttl 64, id 16630, offset 0, flags [DF], proto TCP (6), length 4100)
    127.0.0.1.10550 > 127.0.0.1.36616: Flags [P.], cksum 0x0df9 (incorrect -> 0xdeca), seq 4756:8804, ack 940, win 512, options [nop,nop,TS val 1287536112 ecr 1287536055], length 4048
2022-02-28 03:13:11.889176 IP (tos 0x0, ttl 64, id 14602, offset 0, flags [DF], proto TCP (6), length 52)
    127.0.0.1.36616 > 127.0.0.1.10550: Flags [.], cksum 0xfe28 (incorrect -> 0xb59f), seq 940, ack 8804, win 492, options [nop,nop,TS val 1287536112 ecr 1287536112], length 0
2022-02-28 03:13:11.889184 IP (tos 0x0, ttl 64, id 16631, offset 0, flags [DF], proto TCP (6), length 486)
    127.0.0.1.10550 > 127.0.0.1.36616: Flags [P.], cksum 0xffda (incorrect -> 0x25de), seq 8804:9238, ack 940, win 512, options [nop,nop,TS val 1287536112 ecr 1287536112], length 434
2022-02-28 03:13:11.889188 IP (tos 0x0, ttl 64, id 14603, offset 0, flags [DF], proto TCP (6), length 52)
    127.0.0.1.36616 > 127.0.0.1.10550: Flags [.], cksum 0xfe28 (incorrect -> 0xb3ef), seq 940, ack 9238, win 490, options [nop,nop,TS val 1287536112 ecr 1287536112], length 0
2022-02-28 03:13:11.903063 IP (tos 0x0, ttl 64, id 16632, offset 0, flags [DF], proto TCP (6), length 3040)
    127.0.0.1.10550 > 127.0.0.1.36616: Flags [P.], cksum 0x09d5 (incorrect -> 0x3eda), seq 9238:12226, ack 940, win 512, options [nop,nop,TS val 1287536126 ecr 1287536112], length 2988
2022-02-28 03:13:11.903071 IP (tos 0x0, ttl 64, id 14604, offset 0, flags [DF], proto TCP (6), length 52)
    127.0.0.1.36616 > 127.0.0.1.10550: Flags [.], cksum 0xfe28 (incorrect -> 0xa821), seq 940, ack 12226, win 496, options [nop,nop,TS val 1287536126 ecr 1287536126], length 0
2022-02-28 03:13:11.916886 IP (tos 0x0, ttl 64, id 16633, offset 0, flags [DF], proto TCP (6), length 4036)
    127.0.0.1.10550 > 127.0.0.1.36616: Flags [P.], cksum 0x0db9 (incorrect -> 0x24ff), seq 12226:16210, ack 940, win 512, options [nop,nop,TS val 1287536140 ecr 1287536126], length 3984
2022-02-28 03:13:11.916895 IP (tos 0x0, ttl 64, id 14605, offset 0, flags [DF], proto TCP (6), length 52)
    127.0.0.1.36616 > 127.0.0.1.10550: Flags [.], cksum 0xfe28 (incorrect -> 0x9879), seq 940, ack 16210, win 492, options [nop,nop,TS val 1287536140 ecr 1287536140], length 0
2022-02-28 03:13:11.929158 IP (tos 0x0, ttl 64, id 16634, offset 0, flags [DF], proto TCP (6), length 4100)
    127.0.0.1.10550 > 127.0.0.1.36616: Flags [P.], cksum 0x0df9 (incorrect -> 0xe312), seq 16210:20258, ack 940, win 512, options [nop,nop,TS val 1287536152 ecr 1287536140], length 4048
2022-02-28 03:13:11.929166 IP (tos 0x0, ttl 64, id 14606, offset 0, flags [DF], proto TCP (6), length 52)
    127.0.0.1.36616 > 127.0.0.1.10550: Flags [.], cksum 0xfe28 (incorrect -> 0x8891), seq 940, ack 20258, win 492, options [nop,nop,TS val 1287536152 ecr 1287536152], length 0
2022-02-28 03:13:11.929172 IP (tos 0x0, ttl 64, id 16635, offset 0, flags [DF], proto TCP (6), length 524)
    127.0.0.1.10550 > 127.0.0.1.36616: Flags [P.], cksum 0x0001 (incorrect -> 0xfd0c), seq 20258:20730, ack 940, win 512, options [nop,nop,TS val 1287536152 ecr 1287536152], length 472
2022-02-28 03:13:11.929176 IP (tos 0x0, ttl 64, id 14607, offset 0, flags [DF], proto TCP (6), length 52)
    127.0.0.1.36616 > 127.0.0.1.10550: Flags [.], cksum 0xfe28 (incorrect -> 0x86bb), seq 940, ack 20730, win 490, options [nop,nop,TS val 1287536152 ecr 1287536152], length 0
2022-02-28 03:13:11.929242 IP (tos 0x0, ttl 64, id 16636, offset 0, flags [DF], proto TCP (6), length 3538)
    127.0.0.1.10550 > 127.0.0.1.36616: Flags [P.], cksum 0x0bc7 (incorrect -> 0x7ed0), seq 20730:24216, ack 940, win 512, options [nop,nop,TS val 1287536152 ecr 1287536152], length 3486
2022-02-28 03:13:11.929247 IP (tos 0x0, ttl 64, id 14608, offset 0, flags [DF], proto TCP (6), length 52)
    127.0.0.1.36616 > 127.0.0.1.10550: Flags [.], cksum 0xfe28 (incorrect -> 0x792b), seq 940, ack 24216, win 476, options [nop,nop,TS val 1287536152 ecr 1287536152], length 0
2022-02-28 03:13:11.930734 IP (tos 0x0, ttl 64, id 16637, offset 0, flags [DF], proto TCP (6), length 3040)
    127.0.0.1.10550 > 127.0.0.1.36616: Flags [P.], cksum 0x09d5 (incorrect -> 0xfa5d), seq 24216:27204, ack 940, win 512, options [nop,nop,TS val 1287536154 ecr 1287536152], length 2988
2022-02-28 03:13:11.930754 IP (tos 0x0, ttl 64, id 14609, offset 0, flags [DF], proto TCP (6), length 52)
    127.0.0.1.36616 > 127.0.0.1.10550: Flags [.], cksum 0xfe28 (incorrect -> 0x6d57), seq 940, ack 27204, win 512, options [nop,nop,TS val 1287536154 ecr 1287536154], length 0
2022-02-28 03:13:11.955190 IP (tos 0x0, ttl 64, id 16638, offset 0, flags [DF], proto TCP (6), length 4100)
    127.0.0.1.10550 > 127.0.0.1.36616: Flags [P.], cksum 0x0df9 (incorrect -> 0x9db6), seq 27204:31252, ack 940, win 512, options [nop,nop,TS val 1287536178 ecr 1287536154], length 4048
2022-02-28 03:13:11.998233 IP (tos 0x0, ttl 64, id 14610, offset 0, flags [DF], proto TCP (6), length 52)
    127.0.0.1.36616 > 127.0.0.1.10550: Flags [.], cksum 0xfe28 (incorrect -> 0x5d2c), seq 940, ack 31252, win 512, options [nop,nop,TS val 1287536221 ecr 1287536178], length 0
2022-02-28 03:13:11.998246 IP (tos 0x0, ttl 64, id 16639, offset 0, flags [DF], proto TCP (6), length 11618)
    127.0.0.1.10550 > 127.0.0.1.36616: Flags [P.], cksum 0x2b57 (incorrect -> 0xba9c), seq 31252:42818, ack 940, win 512, options [nop,nop,TS val 1287536221 ecr 1287536221], length 11566
2022-02-28 03:13:12.042149 IP (tos 0x0, ttl 64, id 14611, offset 0, flags [DF], proto TCP (6), length 52)
    127.0.0.1.36616 > 127.0.0.1.10550: Flags [.], cksum 0xfe28 (incorrect -> 0x2fa7), seq 940, ack 42818, win 512, options [nop,nop,TS val 1287536265 ecr 1287536221], length 0
2022-02-28 03:13:12.042162 IP (tos 0x0, ttl 64, id 16640, offset 0, flags [DF], proto TCP (6), length 23358)
    127.0.0.1.10550 > 127.0.0.1.36616: Flags [P.], cksum 0x5933 (incorrect -> 0x67a2), seq 42818:66124, ack 940, win 512, options [nop,nop,TS val 1287536265 ecr 1287536265], length 23306
2022-02-28 03:13:12.086152 IP (tos 0x0, ttl 64, id 14612, offset 0, flags [DF], proto TCP (6), length 52)
    127.0.0.1.36616 > 127.0.0.1.10550: Flags [.], cksum 0xfe28 (incorrect -> 0xd444), seq 940, ack 66124, win 512, options [nop,nop,TS val 1287536309 ecr 1287536265], length 0
2022-02-28 03:13:12.086167 IP (tos 0x0, ttl 64, id 16641, offset 0, flags [DF], proto TCP (6), length 19474)
    127.0.0.1.10550 > 127.0.0.1.36616: Flags [P.], cksum 0x4a07 (incorrect -> 0x349a), seq 66124:85546, ack 940, win 512, options [nop,nop,TS val 1287536309 ecr 1287536309], length 19422
2022-02-28 03:13:12.086621 IP (tos 0x0, ttl 64, id 14613, offset 0, flags [DF], proto TCP (6), length 52)
    127.0.0.1.36616 > 127.0.0.1.10550: Flags [.], cksum 0xfe28 (incorrect -> 0x8839), seq 940, ack 85546, win 512, options [nop,nop,TS val 1287536310 ecr 1287536309], length 0
2022-02-28 03:13:12.188903 IP (tos 0x0, ttl 64, id 16642, offset 0, flags [DF], proto TCP (6), length 3080)
    127.0.0.1.10550 > 127.0.0.1.36616: Flags [P.], cksum 0x09fd (incorrect -> 0x7fc8), seq 85546:88574, ack 940, win 512, options [nop,nop,TS val 1287536412 ecr 1287536310], length 3028
2022-02-28 03:13:12.189199 IP (tos 0x0, ttl 64, id 14614, offset 0, flags [DF], proto TCP (6), length 52)
    127.0.0.1.36616 > 127.0.0.1.10550: Flags [.], cksum 0xfe28 (incorrect -> 0x7b98), seq 940, ack 88574, win 512, options [nop,nop,TS val 1287536412 ecr 1287536412], length 0
2022-02-28 03:13:12.217627 IP (tos 0x0, ttl 64, id 16643, offset 0, flags [DF], proto TCP (6), length 3538)
    127.0.0.1.10550 > 127.0.0.1.36616: Flags [P.], cksum 0x0bc7 (incorrect -> 0x0daf), seq 88574:92060, ack 940, win 512, options [nop,nop,TS val 1287536441 ecr 1287536412], length 3486
2022-02-28 03:13:12.217643 IP (tos 0x0, ttl 64, id 14615, offset 0, flags [DF], proto TCP (6), length 52)
    127.0.0.1.36616 > 127.0.0.1.10550: Flags [.], cksum 0xfe28 (incorrect -> 0x6dc0), seq 940, ack 92060, win 512, options [nop,nop,TS val 1287536441 ecr 1287536441], length 0
2022-02-28 03:13:12.217916 IP (tos 0x0, ttl 64, id 16644, offset 0, flags [DF], proto TCP (6), length 4100)
    127.0.0.1.10550 > 127.0.0.1.36616: Flags [P.], cksum 0x0df9 (incorrect -> 0x6356), seq 92060:96108, ack 940, win 512, options [nop,nop,TS val 1287536441 ecr 1287536441], length 4048
2022-02-28 03:13:12.217996 IP (tos 0x0, ttl 64, id 14616, offset 0, flags [DF], proto TCP (6), length 52)
    127.0.0.1.36616 > 127.0.0.1.10550: Flags [.], cksum 0xfe28 (incorrect -> 0x5df0), seq 940, ack 96108, win 512, options [nop,nop,TS val 1287536441 ecr 1287536441], length 0
2022-02-28 03:13:12.218003 IP (tos 0x0, ttl 64, id 16645, offset 0, flags [DF], proto TCP (6), length 8454)
    127.0.0.1.10550 > 127.0.0.1.36616: Flags [P.], cksum 0x1efb (incorrect -> 0x993a), seq 96108:104510, ack 940, win 512, options [nop,nop,TS val 1287536441 ecr 1287536441], length 8402
2022-02-28 03:13:12.218397 IP (tos 0x0, ttl 64, id 14617, offset 0, flags [DF], proto TCP (6), length 52)
    127.0.0.1.36616 > 127.0.0.1.10550: Flags [.], cksum 0xfe28 (incorrect -> 0x3d1e), seq 940, ack 104510, win 512, options [nop,nop,TS val 1287536441 ecr 1287536441], length 0
2022-02-28 03:13:12.218461 IP (tos 0x0, ttl 64, id 16646, offset 0, flags [DF], proto TCP (6), length 4100)
    127.0.0.1.10550 > 127.0.0.1.36616: Flags [P.], cksum 0x0df9 (incorrect -> 0x5f4d), seq 104510:108558, ack 940, win 512, options [nop,nop,TS val 1287536442 ecr 1287536441], length 4048
2022-02-28 03:13:12.218478 IP (tos 0x0, ttl 64, id 14618, offset 0, flags [DF], proto TCP (6), length 52)
    127.0.0.1.36616 > 127.0.0.1.10550: Flags [.], cksum 0xfe28 (incorrect -> 0x2d4c), seq 940, ack 108558, win 512, options [nop,nop,TS val 1287536442 ecr 1287536442], length 0
2022-02-28 03:13:12.218482 IP (tos 0x0, ttl 64, id 16647, offset 0, flags [DF], proto TCP (6), length 1980)
    127.0.0.1.10550 > 127.0.0.1.36616: Flags [P.], cksum 0x05b1 (incorrect -> 0x9580), seq 108558:110486, ack 940, win 512, options [nop,nop,TS val 1287536442 ecr 1287536442], length 1928
2022-02-28 03:13:12.218487 IP (tos 0x0, ttl 64, id 14619, offset 0, flags [DF], proto TCP (6), length 52)
    127.0.0.1.36616 > 127.0.0.1.10550: Flags [.], cksum 0xfe28 (incorrect -> 0x25c4), seq 940, ack 110486, win 512, options [nop,nop,TS val 1287536442 ecr 1287536442], length 0
2022-02-28 03:13:12.267254 IP (tos 0x0, ttl 64, id 16648, offset 0, flags [DF], proto TCP (6), length 3538)
    127.0.0.1.10550 > 127.0.0.1.36616: Flags [P.], cksum 0x0bc7 (incorrect -> 0x0350), seq 110486:113972, ack 940, win 512, options [nop,nop,TS val 1287536490 ecr 1287536442], length 3486
2022-02-28 03:13:12.267275 IP (tos 0x0, ttl 64, id 14620, offset 0, flags [DF], proto TCP (6), length 52)
    127.0.0.1.36616 > 127.0.0.1.10550: Flags [.], cksum 0xfe28 (incorrect -> 0x17c6), seq 940, ack 113972, win 512, options [nop,nop,TS val 1287536490 ecr 1287536490], length 0
2022-02-28 03:13:12.267375 IP (tos 0x0, ttl 64, id 16649, offset 0, flags [DF], proto TCP (6), length 4036)
    127.0.0.1.10550 > 127.0.0.1.36616: Flags [P.], cksum 0x0db9 (incorrect -> 0x2f7c), seq 113972:117956, ack 940, win 512, options [nop,nop,TS val 1287536490 ecr 1287536490], length 3984
2022-02-28 03:13:12.267390 IP (tos 0x0, ttl 64, id 14621, offset 0, flags [DF], proto TCP (6), length 52)
    127.0.0.1.36616 > 127.0.0.1.10550: Flags [.], cksum 0xfe28 (incorrect -> 0x0836), seq 940, ack 117956, win 512, options [nop,nop,TS val 1287536490 ecr 1287536490], length 0
200, 4.786417245864868, 0.9297516345977783