2022-02-28 01:39:34.888014 IP (tos 0x0, ttl 64, id 29065, offset 0, flags [DF], proto TCP (6), length 60)
    127.0.0.1.41560 > 127.0.0.1.10050: Flags [S], cksum 0xfe30 (incorrect -> 0x04e6), seq 1627016087, win 65495, options [mss 65495,sackOK,TS val 1281919111 ecr 0,nop,wscale 7], length 0
2022-02-28 01:39:34.888025 IP (tos 0x0, ttl 64, id 0, offset 0, flags [DF], proto TCP (6), length 60)
    127.0.0.1.10050 > 127.0.0.1.41560: Flags [S.], cksum 0xfe30 (incorrect -> 0x0045), seq 1568330289, ack 1627016088, win 65483, options [mss 65495,sackOK,TS val 1281919111 ecr 1281919111,nop,wscale 7], length 0
2022-02-28 01:39:34.888033 IP (tos 0x0, ttl 64, id 29066, offset 0, flags [DF], proto TCP (6), length 52)
    127.0.0.1.41560 > 127.0.0.1.10050: Flags [.], cksum 0xfe28 (incorrect -> 0x2701), seq 1, ack 1, win 512, options [nop,nop,TS val 1281919111 ecr 1281919111], length 0
2022-02-28 01:39:34.888139 IP (tos 0x0, ttl 64, id 29067, offset 0, flags [DF], proto TCP (6), length 55)
    127.0.0.1.41560 > 127.0.0.1.10050: Flags [P.], cksum 0xfe2b (incorrect -> 0x21f5), seq 1:4, ack 1, win 512, options [nop,nop,TS val 1281919111 ecr 1281919111], length 3
2022-02-28 01:39:34.888153 IP (tos 0x0, ttl 64, id 101, offset 0, flags [DF], proto TCP (6), length 52)
    127.0.0.1.10050 > 127.0.0.1.41560: Flags [.], cksum 0xfe28 (incorrect -> 0x26fe), seq 1, ack 4, win 512, options [nop,nop,TS val 1281919111 ecr 1281919111], length 0
2022-02-28 01:39:34.888186 IP (tos 0x0, ttl 64, id 102, offset 0, flags [DF], proto TCP (6), length 54)
    127.0.0.1.10050 > 127.0.0.1.41560: Flags [P.], cksum 0xfe2a (incorrect -> 0x21f4), seq 1:3, ack 4, win 512, options [nop,nop,TS val 1281919111 ecr 1281919111], length 2
2022-02-28 01:39:34.888199 IP (tos 0x0, ttl 64, id 29068, offset 0, flags [DF], proto TCP (6), length 52)
    127.0.0.1.41560 > 127.0.0.1.10050: Flags [.], cksum 0xfe28 (incorrect -> 0x26fc), seq 4, ack 3, win 512, options [nop,nop,TS val 1281919111 ecr 1281919111], length 0
2022-02-28 01:39:34.899940 IP (tos 0x0, ttl 64, id 29069, offset 0, flags [DF], proto TCP (6), length 62)
    127.0.0.1.41560 > 127.0.0.1.10050: Flags [P.], cksum 0xfe32 (incorrect -> 0x0ef6), seq 4:14, ack 3, win 512, options [nop,nop,TS val 1281919123 ecr 1281919111], length 10
2022-02-28 01:39:34.899960 IP (tos 0x0, ttl 64, id 103, offset 0, flags [DF], proto TCP (6), length 52)
    127.0.0.1.10050 > 127.0.0.1.41560: Flags [.], cksum 0xfe28 (incorrect -> 0x26da), seq 3, ack 14, win 512, options [nop,nop,TS val 1281919123 ecr 1281919123], length 0
2022-02-28 01:39:34.991509 IP (tos 0x0, ttl 64, id 104, offset 0, flags [DF], proto TCP (6), length 62)
    127.0.0.1.10050 > 127.0.0.1.41560: Flags [P.], cksum 0xfe32 (incorrect -> 0x216b), seq 3:13, ack 14, win 512, options [nop,nop,TS val 1281919215 ecr 1281919123], length 10
2022-02-28 01:39:34.991522 IP (tos 0x0, ttl 64, id 29070, offset 0, flags [DF], proto TCP (6), length 52)
    127.0.0.1.41560 > 127.0.0.1.10050: Flags [.], cksum 0xfe28 (incorrect -> 0x2618), seq 14, ack 13, win 512, options [nop,nop,TS val 1281919215 ecr 1281919215], length 0
2022-02-28 01:39:34.997670 IP (tos 0x0, ttl 64, id 29071, offset 0, flags [DF], proto TCP (6), length 569)
    127.0.0.1.41560 > 127.0.0.1.10050: Flags [P.], cksum 0x002e (incorrect -> 0xbb82), seq 14:531, ack 13, win 512, options [nop,nop,TS val 1281919221 ecr 1281919215], length 517
2022-02-28 01:39:34.997680 IP (tos 0x0, ttl 64, id 105, offset 0, flags [DF], proto TCP (6), length 52)
    127.0.0.1.10050 > 127.0.0.1.41560: Flags [.], cksum 0xfe28 (incorrect -> 0x240b), seq 13, ack 531, win 508, options [nop,nop,TS val 1281919221 ecr 1281919221], length 0
200, 5.863945722579956, 0.5005829334259033