2022-02-28 10:07:29.740722 IP (tos 0x0, ttl 64, id 1706, offset 0, flags [DF], proto TCP (6), length 60)
    127.0.0.1.38040 > 127.0.0.1.9550: Flags [S], cksum 0xfe30 (incorrect -> 0x31f1), seq 3448356218, win 65495, options [mss 65495,sackOK,TS val 1312393964 ecr 0,nop,wscale 7], length 0
2022-02-28 10:07:29.740738 IP (tos 0x0, ttl 64, id 0, offset 0, flags [DF], proto TCP (6), length 60)
    127.0.0.1.9550 > 127.0.0.1.38040: Flags [S.], cksum 0xfe30 (incorrect -> 0x50fb), seq 1661969595, ack 3448356219, win 65483, options [mss 65495,sackOK,TS val 1312393964 ecr 1312393964,nop,wscale 7], length 0
2022-02-28 10:07:29.740750 IP (tos 0x0, ttl 64, id 1707, offset 0, flags [DF], proto TCP (6), length 52)
    127.0.0.1.38040 > 127.0.0.1.9550: Flags [.], cksum 0xfe28 (incorrect -> 0x77b7), seq 1, ack 1, win 512, options [nop,nop,TS val 1312393964 ecr 1312393964], length 0
2022-02-28 10:07:29.740870 IP (tos 0x0, ttl 64, id 1708, offset 0, flags [DF], proto TCP (6), length 55)
    127.0.0.1.38040 > 127.0.0.1.9550: Flags [P.], cksum 0xfe2b (incorrect -> 0x72ab), seq 1:4, ack 1, win 512, options [nop,nop,TS val 1312393964 ecr 1312393964], length 3
2022-02-28 10:07:29.740881 IP (tos 0x0, ttl 64, id 26811, offset 0, flags [DF], proto TCP (6), length 52)
    127.0.0.1.9550 > 127.0.0.1.38040: Flags [.], cksum 0xfe28 (incorrect -> 0x77b4), seq 1, ack 4, win 512, options [nop,nop,TS val 1312393964 ecr 1312393964], length 0
2022-02-28 10:07:29.740911 IP (tos 0x0, ttl 64, id 26812, offset 0, flags [DF], proto TCP (6), length 54)
    127.0.0.1.9550 > 127.0.0.1.38040: Flags [P.], cksum 0xfe2a (incorrect -> 0x72aa), seq 1:3, ack 4, win 512, options [nop,nop,TS val 1312393964 ecr 1312393964], length 2
2022-02-28 10:07:29.740925 IP (tos 0x0, ttl 64, id 1709, offset 0, flags [DF], proto TCP (6), length 52)
    127.0.0.1.38040 > 127.0.0.1.9550: Flags [.], cksum 0xfe28 (incorrect -> 0x77b2), seq 4, ack 3, win 512, options [nop,nop,TS val 1312393964 ecr 1312393964], length 0
2022-02-28 10:07:29.751342 IP (tos 0x0, ttl 64, id 1710, offset 0, flags [DF], proto TCP (6), length 62)
    127.0.0.1.38040 > 127.0.0.1.9550: Flags [P.], cksum 0xfe32 (incorrect -> 0x3602), seq 4:14, ack 3, win 512, options [nop,nop,TS val 1312393974 ecr 1312393964], length 10
2022-02-28 10:07:29.751361 IP (tos 0x0, ttl 64, id 26813, offset 0, flags [DF], proto TCP (6), length 52)
    127.0.0.1.9550 > 127.0.0.1.38040: Flags [.], cksum 0xfe28 (incorrect -> 0x7794), seq 3, ack 14, win 512, options [nop,nop,TS val 1312393974 ecr 1312393974], length 0
403, 5.024394273757935, 0.690091609954834