2022-02-28 08:32:46.089115 IP (tos 0x0, ttl 64, id 51120, offset 0, flags [DF], proto TCP (6), length 60)
    127.0.0.1.36738 > 127.0.0.1.12250: Flags [S], cksum 0xfe30 (incorrect -> 0xf0ba), seq 3436950531, win 65495, options [mss 65495,sackOK,TS val 1306710312 ecr 0,nop,wscale 7], length 0
2022-02-28 08:32:46.089127 IP (tos 0x0, ttl 64, id 0, offset 0, flags [DF], proto TCP (6), length 60)
    127.0.0.1.12250 > 127.0.0.1.36738: Flags [S.], cksum 0xfe30 (incorrect -> 0x1c04), seq 671714717, ack 3436950532, win 65483, options [mss 65495,sackOK,TS val 1306710312 ecr 1306710312,nop,wscale 7], length 0
2022-02-28 08:32:46.089137 IP (tos 0x0, ttl 64, id 51121, offset 0, flags [DF], proto TCP (6), length 52)
    127.0.0.1.36738 > 127.0.0.1.12250: Flags [.], cksum 0xfe28 (incorrect -> 0x42c0), seq 1, ack 1, win 512, options [nop,nop,TS val 1306710312 ecr 1306710312], length 0
2022-02-28 08:32:46.089251 IP (tos 0x0, ttl 64, id 51122, offset 0, flags [DF], proto TCP (6), length 55)
    127.0.0.1.36738 > 127.0.0.1.12250: Flags [P.], cksum 0xfe2b (incorrect -> 0x3db4), seq 1:4, ack 1, win 512, options [nop,nop,TS val 1306710312 ecr 1306710312], length 3
2022-02-28 08:32:46.089264 IP (tos 0x0, ttl 64, id 14720, offset 0, flags [DF], proto TCP (6), length 52)
    127.0.0.1.12250 > 127.0.0.1.36738: Flags [.], cksum 0xfe28 (incorrect -> 0x42bd), seq 1, ack 4, win 512, options [nop,nop,TS val 1306710312 ecr 1306710312], length 0
2022-02-28 08:32:46.089294 IP (tos 0x0, ttl 64, id 14721, offset 0, flags [DF], proto TCP (6), length 54)
    127.0.0.1.12250 > 127.0.0.1.36738: Flags [P.], cksum 0xfe2a (incorrect -> 0x3db3), seq 1:3, ack 4, win 512, options [nop,nop,TS val 1306710312 ecr 1306710312], length 2
2022-02-28 08:32:46.089306 IP (tos 0x0, ttl 64, id 51123, offset 0, flags [DF], proto TCP (6), length 52)
    127.0.0.1.36738 > 127.0.0.1.12250: Flags [.], cksum 0xfe28 (incorrect -> 0x42bb), seq 4, ack 3, win 512, options [nop,nop,TS val 1306710312 ecr 1306710312], length 0
2022-02-28 08:32:46.091021 IP (tos 0x0, ttl 64, id 51124, offset 0, flags [DF], proto TCP (6), length 62)
    127.0.0.1.36738 > 127.0.0.1.12250: Flags [P.], cksum 0xfe32 (incorrect -> 0xd1f2), seq 4:14, ack 3, win 512, options [nop,nop,TS val 1306710314 ecr 1306710312], length 10
2022-02-28 08:32:46.091041 IP (tos 0x0, ttl 64, id 14722, offset 0, flags [DF], proto TCP (6), length 52)
    127.0.0.1.12250 > 127.0.0.1.36738: Flags [.], cksum 0xfe28 (incorrect -> 0x42ad), seq 3, ack 14, win 512, options [nop,nop,TS val 1306710314 ecr 1306710314], length 0
2022-02-28 08:32:46.192153 IP (tos 0x0, ttl 64, id 14723, offset 0, flags [DF], proto TCP (6), length 62)
    127.0.0.1.12250 > 127.0.0.1.36738: Flags [P.], cksum 0xfe32 (incorrect -> 0x3d35), seq 3:13, ack 14, win 512, options [nop,nop,TS val 1306710415 ecr 1306710314], length 10
2022-02-28 08:32:46.192170 IP (tos 0x0, ttl 64, id 51125, offset 0, flags [DF], proto TCP (6), length 52)
    127.0.0.1.36738 > 127.0.0.1.12250: Flags [.], cksum 0xfe28 (incorrect -> 0x41d9), seq 14, ack 13, win 512, options [nop,nop,TS val 1306710415 ecr 1306710415], length 0
2022-02-28 08:32:46.198184 IP (tos 0x0, ttl 64, id 51126, offset 0, flags [DF], proto TCP (6), length 569)
    127.0.0.1.36738 > 127.0.0.1.12250: Flags [P.], cksum 0x002e (incorrect -> 0x8999), seq 14:531, ack 13, win 512, options [nop,nop,TS val 1306710421 ecr 1306710415], length 517
2022-02-28 08:32:46.198195 IP (tos 0x0, ttl 64, id 14724, offset 0, flags [DF], proto TCP (6), length 52)
    127.0.0.1.12250 > 127.0.0.1.36738: Flags [.], cksum 0xfe28 (incorrect -> 0x3fcc), seq 13, ack 531, win 508, options [nop,nop,TS val 1306710421 ecr 1306710421], length 0
2022-02-28 08:32:46.302960 IP (tos 0x0, ttl 64, id 14725, offset 0, flags [DF], proto TCP (6), length 3538)
    127.0.0.1.12250 > 127.0.0.1.36738: Flags [P.], cksum 0x0bc7 (incorrect -> 0xe42d), seq 13:3499, ack 531, win 512, options [nop,nop,TS val 1306710526 ecr 1306710421], length 3486
2022-02-28 08:32:46.302969 IP (tos 0x0, ttl 64, id 51127, offset 0, flags [DF], proto TCP (6), length 52)
    127.0.0.1.36738 > 127.0.0.1.12250: Flags [.], cksum 0xfe28 (incorrect -> 0x316a), seq 531, ack 3499, win 494, options [nop,nop,TS val 1306710526 ecr 1306710526], length 0
2022-02-28 08:32:46.330485 IP (tos 0x0, ttl 64, id 14726, offset 0, flags [DF], proto TCP (6), length 64)
    127.0.0.1.12250 > 127.0.0.1.36738: Flags [P.], cksum 0xfe34 (incorrect -> 0x065a), seq 3499:3511, ack 531, win 512, options [nop,nop,TS val 1306710554 ecr 1306710526], length 12
2022-02-28 08:32:46.330495 IP (tos 0x0, ttl 64, id 51128, offset 0, flags [DF], proto TCP (6), length 52)
    127.0.0.1.36738 > 127.0.0.1.12250: Flags [.], cksum 0xfe28 (incorrect -> 0x3119), seq 531, ack 3511, win 507, options [nop,nop,TS val 1306710554 ecr 1306710554], length 0
2022-02-28 08:32:46.330757 IP (tos 0x0, ttl 64, id 51129, offset 0, flags [DF], proto TCP (6), length 178)
    127.0.0.1.36738 > 127.0.0.1.12250: Flags [P.], cksum 0xfea6 (incorrect -> 0xa9cc), seq 531:657, ack 3511, win 512, options [nop,nop,TS val 1306710554 ecr 1306710554], length 126
2022-02-28 08:32:46.330765 IP (tos 0x0, ttl 64, id 14727, offset 0, flags [DF], proto TCP (6), length 52)
    127.0.0.1.12250 > 127.0.0.1.36738: Flags [.], cksum 0xfe28 (incorrect -> 0x3096), seq 3511, ack 657, win 512, options [nop,nop,TS val 1306710554 ecr 1306710554], length 0
2022-02-28 08:32:46.431598 IP (tos 0x0, ttl 64, id 14728, offset 0, flags [DF], proto TCP (6), length 103)
    127.0.0.1.12250 > 127.0.0.1.36738: Flags [P.], cksum 0xfe5b (incorrect -> 0xed4a), seq 3511:3562, ack 657, win 512, options [nop,nop,TS val 1306710655 ecr 1306710554], length 51
2022-02-28 08:32:46.431607 IP (tos 0x0, ttl 64, id 51130, offset 0, flags [DF], proto TCP (6), length 52)
    127.0.0.1.36738 > 127.0.0.1.12250: Flags [.], cksum 0xfe28 (incorrect -> 0x2f99), seq 657, ack 3562, win 512, options [nop,nop,TS val 1306710655 ecr 1306710655], length 0
2022-02-28 08:32:46.432012 IP (tos 0x0, ttl 64, id 51131, offset 0, flags [DF], proto TCP (6), length 357)
    127.0.0.1.36738 > 127.0.0.1.12250: Flags [P.], cksum 0xff59 (incorrect -> 0x935d), seq 657:962, ack 3562, win 512, options [nop,nop,TS val 1306710655 ecr 1306710655], length 305
2022-02-28 08:32:46.432020 IP (tos 0x0, ttl 64, id 14729, offset 0, flags [DF], proto TCP (6), length 52)
    127.0.0.1.12250 > 127.0.0.1.36738: Flags [.], cksum 0xfe28 (incorrect -> 0x2e6a), seq 3562, ack 962, win 510, options [nop,nop,TS val 1306710655 ecr 1306710655], length 0
2022-02-28 08:32:46.542077 IP (tos 0x0, ttl 64, id 14730, offset 0, flags [DF], proto TCP (6), length 3538)
    127.0.0.1.12250 > 127.0.0.1.36738: Flags [P.], cksum 0x0bc7 (incorrect -> 0xab65), seq 3562:7048, ack 962, win 512, options [nop,nop,TS val 1306710765 ecr 1306710655], length 3486
2022-02-28 08:32:46.586141 IP (tos 0x0, ttl 64, id 51132, offset 0, flags [DF], proto TCP (6), length 52)
    127.0.0.1.36738 > 127.0.0.1.12250: Flags [.], cksum 0xfe28 (incorrect -> 0x1fc2), seq 962, ack 7048, win 512, options [nop,nop,TS val 1306710809 ecr 1306710765], length 0
2022-02-28 08:32:46.586149 IP (tos 0x0, ttl 64, id 14731, offset 0, flags [DF], proto TCP (6), length 8020)
    127.0.0.1.12250 > 127.0.0.1.36738: Flags [P.], cksum 0x1d49 (incorrect -> 0xd4bd), seq 7048:15016, ack 962, win 512, options [nop,nop,TS val 1306710809 ecr 1306710809], length 7968
2022-02-28 08:32:46.586155 IP (tos 0x0, ttl 64, id 51133, offset 0, flags [DF], proto TCP (6), length 52)
    127.0.0.1.36738 > 127.0.0.1.12250: Flags [.], cksum 0xfe28 (incorrect -> 0x009a), seq 962, ack 15016, win 476, options [nop,nop,TS val 1306710809 ecr 1306710809], length 0
2022-02-28 08:32:46.589722 IP (tos 0x0, ttl 64, id 14732, offset 0, flags [DF], proto TCP (6), length 3078)
    127.0.0.1.12250 > 127.0.0.1.36738: Flags [P.], cksum 0x09fb (incorrect -> 0x92ea), seq 15016:18042, ack 962, win 512, options [nop,nop,TS val 1306710813 ecr 1306710809], length 3026
2022-02-28 08:32:46.589729 IP (tos 0x0, ttl 64, id 51134, offset 0, flags [DF], proto TCP (6), length 52)
    127.0.0.1.36738 > 127.0.0.1.12250: Flags [.], cksum 0xfe28 (incorrect -> 0xf4ab), seq 962, ack 18042, win 496, options [nop,nop,TS val 1306710813 ecr 1306710813], length 0
2022-02-28 08:32:46.591031 IP (tos 0x0, ttl 64, id 14733, offset 0, flags [DF], proto TCP (6), length 3538)
    127.0.0.1.12250 > 127.0.0.1.36738: Flags [P.], cksum 0x0bc7 (incorrect -> 0xf284), seq 18042:21528, ack 962, win 512, options [nop,nop,TS val 1306710814 ecr 1306710813], length 3486
2022-02-28 08:32:46.591038 IP (tos 0x0, ttl 64, id 51135, offset 0, flags [DF], proto TCP (6), length 52)
    127.0.0.1.36738 > 127.0.0.1.12250: Flags [.], cksum 0xfe28 (incorrect -> 0xe70d), seq 962, ack 21528, win 494, options [nop,nop,TS val 1306710814 ecr 1306710814], length 0
2022-02-28 08:32:46.606295 IP (tos 0x0, ttl 64, id 14734, offset 0, flags [DF], proto TCP (6), length 4036)
    127.0.0.1.12250 > 127.0.0.1.36738: Flags [P.], cksum 0x0db9 (incorrect -> 0xd591), seq 21528:25512, ack 962, win 512, options [nop,nop,TS val 1306710829 ecr 1306710814], length 3984
2022-02-28 08:32:46.606305 IP (tos 0x0, ttl 64, id 51136, offset 0, flags [DF], proto TCP (6), length 52)
    127.0.0.1.36738 > 127.0.0.1.12250: Flags [.], cksum 0xfe28 (incorrect -> 0xd761), seq 962, ack 25512, win 492, options [nop,nop,TS val 1306710829 ecr 1306710829], length 0
2022-02-28 08:32:46.613421 IP (tos 0x0, ttl 64, id 14735, offset 0, flags [DF], proto TCP (6), length 4036)
    127.0.0.1.12250 > 127.0.0.1.36738: Flags [P.], cksum 0x0db9 (incorrect -> 0x94ce), seq 25512:29496, ack 962, win 512, options [nop,nop,TS val 1306710836 ecr 1306710829], length 3984
2022-02-28 08:32:46.613434 IP (tos 0x0, ttl 64, id 51137, offset 0, flags [DF], proto TCP (6), length 52)
    127.0.0.1.36738 > 127.0.0.1.12250: Flags [.], cksum 0xfe28 (incorrect -> 0xc7c2), seq 962, ack 29496, win 492, options [nop,nop,TS val 1306710837 ecr 1306710836], length 0
2022-02-28 08:32:46.622629 IP (tos 0x0, ttl 64, id 14736, offset 0, flags [DF], proto TCP (6), length 3538)
    127.0.0.1.12250 > 127.0.0.1.36738: Flags [P.], cksum 0x0bc7 (incorrect -> 0xc95f), seq 29496:32982, ack 962, win 512, options [nop,nop,TS val 1306710846 ecr 1306710837], length 3486
2022-02-28 08:32:46.622636 IP (tos 0x0, ttl 64, id 51138, offset 0, flags [DF], proto TCP (6), length 52)
    127.0.0.1.36738 > 127.0.0.1.12250: Flags [.], cksum 0xfe28 (incorrect -> 0xba0f), seq 962, ack 32982, win 494, options [nop,nop,TS val 1306710846 ecr 1306710846], length 0
2022-02-28 08:32:46.637362 IP (tos 0x0, ttl 64, id 14737, offset 0, flags [DF], proto TCP (6), length 1048)
    127.0.0.1.12250 > 127.0.0.1.36738: Flags [P.], cksum 0x020d (incorrect -> 0xe220), seq 32982:33978, ack 962, win 512, options [nop,nop,TS val 1306710860 ecr 1306710846], length 996
2022-02-28 08:32:46.637386 IP (tos 0x0, ttl 64, id 51139, offset 0, flags [DF], proto TCP (6), length 52)
    127.0.0.1.36738 > 127.0.0.1.12250: Flags [.], cksum 0xfe28 (incorrect -> 0xb5fd), seq 962, ack 33978, win 512, options [nop,nop,TS val 1306710860 ecr 1306710860], length 0
2022-02-28 08:32:46.641333 IP (tos 0x0, ttl 64, id 14738, offset 0, flags [DF], proto TCP (6), length 3538)
    127.0.0.1.12250 > 127.0.0.1.36738: Flags [P.], cksum 0x0bc7 (incorrect -> 0x8359), seq 33978:37464, ack 962, win 512, options [nop,nop,TS val 1306710864 ecr 1306710860], length 3486
2022-02-28 08:32:46.641958 IP (tos 0x0, ttl 64, id 51140, offset 0, flags [DF], proto TCP (6), length 52)
    127.0.0.1.36738 > 127.0.0.1.12250: Flags [.], cksum 0xfe28 (incorrect -> 0xa856), seq 962, ack 37464, win 512, options [nop,nop,TS val 1306710865 ecr 1306710864], length 0
2022-02-28 08:32:46.653575 IP (tos 0x0, ttl 64, id 14739, offset 0, flags [DF], proto TCP (6), length 4036)
    127.0.0.1.12250 > 127.0.0.1.36738: Flags [P.], cksum 0x0db9 (incorrect -> 0x257a), seq 37464:41448, ack 962, win 512, options [nop,nop,TS val 1306710877 ecr 1306710865], length 3984
2022-02-28 08:32:46.694145 IP (tos 0x0, ttl 64, id 51141, offset 0, flags [DF], proto TCP (6), length 52)
    127.0.0.1.36738 > 127.0.0.1.12250: Flags [.], cksum 0xfe28 (incorrect -> 0x9885), seq 962, ack 41448, win 512, options [nop,nop,TS val 1306710917 ecr 1306710877], length 0
2022-02-28 08:32:46.694157 IP (tos 0x0, ttl 64, id 14740, offset 0, flags [DF], proto TCP (6), length 13076)
    127.0.0.1.12250 > 127.0.0.1.36738: Flags [P.], cksum 0x3109 (incorrect -> 0xa2a9), seq 41448:54472, ack 962, win 512, options [nop,nop,TS val 1306710917 ecr 1306710917], length 13024
2022-02-28 08:32:46.738139 IP (tos 0x0, ttl 64, id 51142, offset 0, flags [DF], proto TCP (6), length 52)
    127.0.0.1.36738 > 127.0.0.1.12250: Flags [.], cksum 0xfe28 (incorrect -> 0x6551), seq 962, ack 54472, win 512, options [nop,nop,TS val 1306710961 ecr 1306710917], length 0
2022-02-28 08:32:46.738152 IP (tos 0x0, ttl 64, id 14741, offset 0, flags [DF], proto TCP (6), length 18976)
    127.0.0.1.12250 > 127.0.0.1.36738: Flags [P.], cksum 0x4815 (incorrect -> 0x8bd9), seq 54472:73396, ack 962, win 512, options [nop,nop,TS val 1306710961 ecr 1306710961], length 18924
2022-02-28 08:32:46.782148 IP (tos 0x0, ttl 64, id 51143, offset 0, flags [DF], proto TCP (6), length 52)
    127.0.0.1.36738 > 127.0.0.1.12250: Flags [.], cksum 0xfe28 (incorrect -> 0x1b0d), seq 962, ack 73396, win 512, options [nop,nop,TS val 1306711005 ecr 1306710961], length 0
2022-02-28 08:32:46.782164 IP (tos 0x0, ttl 64, id 14742, offset 0, flags [DF], proto TCP (6), length 24952)
    127.0.0.1.12250 > 127.0.0.1.36738: Flags [P.], cksum 0x5f6d (incorrect -> 0xc480), seq 73396:98296, ack 962, win 512, options [nop,nop,TS val 1306711005 ecr 1306711005], length 24900
2022-02-28 08:32:46.826157 IP (tos 0x0, ttl 64, id 51144, offset 0, flags [DF], proto TCP (6), length 52)
    127.0.0.1.36738 > 127.0.0.1.12250: Flags [.], cksum 0xfe28 (incorrect -> 0xb970), seq 962, ack 98296, win 512, options [nop,nop,TS val 1306711049 ecr 1306711005], length 0
2022-02-28 08:32:46.826179 IP (tos 0x0, ttl 64, id 14743, offset 0, flags [DF], proto TCP (6), length 25602)
    127.0.0.1.12250 > 127.0.0.1.36738: Flags [P.], cksum 0x61f7 (incorrect -> 0x1ebe), seq 98296:123846, ack 962, win 512, options [nop,nop,TS val 1306711049 ecr 1306711049], length 25550
2022-02-28 08:32:46.870151 IP (tos 0x0, ttl 64, id 51145, offset 0, flags [DF], proto TCP (6), length 52)
    127.0.0.1.36738 > 127.0.0.1.12250: Flags [.], cksum 0xfe28 (incorrect -> 0x554a), seq 962, ack 123846, win 512, options [nop,nop,TS val 1306711093 ecr 1306711049], length 0
200, 5.559859275817871, 0.7870197296142578