2022-02-28 03:23:19.078828 IP (tos 0x0, ttl 64, id 30073, offset 0, flags [DF], proto TCP (6), length 60)
    127.0.0.1.57548 > 127.0.0.1.11350: Flags [S], cksum 0xfe30 (incorrect -> 0xdac9), seq 3797858088, win 65495, options [mss 65495,sackOK,TS val 1288143302 ecr 0,nop,wscale 7], length 0
2022-02-28 03:23:19.078841 IP (tos 0x0, ttl 64, id 0, offset 0, flags [DF], proto TCP (6), length 60)
    127.0.0.1.11350 > 127.0.0.1.57548: Flags [S.], cksum 0xfe30 (incorrect -> 0x224b), seq 571197408, ack 3797858089, win 65483, options [mss 65495,sackOK,TS val 1288143302 ecr 1288143302,nop,wscale 7], length 0
2022-02-28 03:23:19.078852 IP (tos 0x0, ttl 64, id 30074, offset 0, flags [DF], proto TCP (6), length 52)
    127.0.0.1.57548 > 127.0.0.1.11350: Flags [.], cksum 0xfe28 (incorrect -> 0x4907), seq 1, ack 1, win 512, options [nop,nop,TS val 1288143302 ecr 1288143302], length 0
2022-02-28 03:23:19.078962 IP (tos 0x0, ttl 64, id 30075, offset 0, flags [DF], proto TCP (6), length 55)
    127.0.0.1.57548 > 127.0.0.1.11350: Flags [P.], cksum 0xfe2b (incorrect -> 0x43fb), seq 1:4, ack 1, win 512, options [nop,nop,TS val 1288143302 ecr 1288143302], length 3
2022-02-28 03:23:19.078978 IP (tos 0x0, ttl 64, id 43913, offset 0, flags [DF], proto TCP (6), length 52)
    127.0.0.1.11350 > 127.0.0.1.57548: Flags [.], cksum 0xfe28 (incorrect -> 0x4904), seq 1, ack 4, win 512, options [nop,nop,TS val 1288143302 ecr 1288143302], length 0
2022-02-28 03:23:19.079015 IP (tos 0x0, ttl 64, id 43914, offset 0, flags [DF], proto TCP (6), length 54)
    127.0.0.1.11350 > 127.0.0.1.57548: Flags [P.], cksum 0xfe2a (incorrect -> 0x43fa), seq 1:3, ack 4, win 512, options [nop,nop,TS val 1288143302 ecr 1288143302], length 2
2022-02-28 03:23:19.079030 IP (tos 0x0, ttl 64, id 30076, offset 0, flags [DF], proto TCP (6), length 52)
    127.0.0.1.57548 > 127.0.0.1.11350: Flags [.], cksum 0xfe28 (incorrect -> 0x4902), seq 4, ack 3, win 512, options [nop,nop,TS val 1288143302 ecr 1288143302], length 0
2022-02-28 03:23:19.101872 IP (tos 0x0, ttl 64, id 30077, offset 0, flags [DF], proto TCP (6), length 62)
    127.0.0.1.57548 > 127.0.0.1.11350: Flags [P.], cksum 0xfe32 (incorrect -> 0xa9f4), seq 4:14, ack 3, win 512, options [nop,nop,TS val 1288143325 ecr 1288143302], length 10
2022-02-28 03:23:19.101892 IP (tos 0x0, ttl 64, id 43915, offset 0, flags [DF], proto TCP (6), length 52)
    127.0.0.1.11350 > 127.0.0.1.57548: Flags [.], cksum 0xfe28 (incorrect -> 0x48ca), seq 3, ack 14, win 512, options [nop,nop,TS val 1288143325 ecr 1288143325], length 0
2022-02-28 03:23:19.147781 IP (tos 0x0, ttl 64, id 43916, offset 0, flags [DF], proto TCP (6), length 62)
    127.0.0.1.11350 > 127.0.0.1.57548: Flags [P.], cksum 0xfe32 (incorrect -> 0x4389), seq 3:13, ack 14, win 512, options [nop,nop,TS val 1288143371 ecr 1288143325], length 10
2022-02-28 03:23:19.147793 IP (tos 0x0, ttl 64, id 30078, offset 0, flags [DF], proto TCP (6), length 52)
    127.0.0.1.57548 > 127.0.0.1.11350: Flags [.], cksum 0xfe28 (incorrect -> 0x4864), seq 14, ack 13, win 512, options [nop,nop,TS val 1288143371 ecr 1288143371], length 0
2022-02-28 03:23:19.153784 IP (tos 0x0, ttl 64, id 30079, offset 0, flags [DF], proto TCP (6), length 569)
    127.0.0.1.57548 > 127.0.0.1.11350: Flags [P.], cksum 0x002e (incorrect -> 0x029f), seq 14:531, ack 13, win 512, options [nop,nop,TS val 1288143377 ecr 1288143371], length 517
2022-02-28 03:23:19.153795 IP (tos 0x0, ttl 64, id 43917, offset 0, flags [DF], proto TCP (6), length 52)
    127.0.0.1.11350 > 127.0.0.1.57548: Flags [.], cksum 0xfe28 (incorrect -> 0x4657), seq 13, ack 531, win 508, options [nop,nop,TS val 1288143377 ecr 1288143377], length 0
200, 3.768003463745117, 0.36894989013671875