2022-02-28 08:27:50.034838 IP (tos 0x0, ttl 64, id 30916, offset 0, flags [DF], proto TCP (6), length 60)
    127.0.0.1.37594 > 127.0.0.1.9950: Flags [S], cksum 0xfe30 (incorrect -> 0xca9d), seq 3744158191, win 65495, options [mss 65495,sackOK,TS val 1306414258 ecr 0,nop,wscale 7], length 0
2022-02-28 08:27:50.034846 IP (tos 0x0, ttl 64, id 0, offset 0, flags [DF], proto TCP (6), length 60)
    127.0.0.1.9950 > 127.0.0.1.37594: Flags [S.], cksum 0xfe30 (incorrect -> 0x00ec), seq 139273935, ack 3744158192, win 65483, options [mss 65495,sackOK,TS val 1306414258 ecr 1306414258,nop,wscale 7], length 0
2022-02-28 08:27:50.034852 IP (tos 0x0, ttl 64, id 30917, offset 0, flags [DF], proto TCP (6), length 52)
    127.0.0.1.37594 > 127.0.0.1.9950: Flags [.], cksum 0xfe28 (incorrect -> 0x27a8), seq 1, ack 1, win 512, options [nop,nop,TS val 1306414258 ecr 1306414258], length 0
2022-02-28 08:27:50.034967 IP (tos 0x0, ttl 64, id 30918, offset 0, flags [DF], proto TCP (6), length 55)
    127.0.0.1.37594 > 127.0.0.1.9950: Flags [P.], cksum 0xfe2b (incorrect -> 0x229c), seq 1:4, ack 1, win 512, options [nop,nop,TS val 1306414258 ecr 1306414258], length 3
2022-02-28 08:27:50.034971 IP (tos 0x0, ttl 64, id 38267, offset 0, flags [DF], proto TCP (6), length 52)
    127.0.0.1.9950 > 127.0.0.1.37594: Flags [.], cksum 0xfe28 (incorrect -> 0x27a5), seq 1, ack 4, win 512, options [nop,nop,TS val 1306414258 ecr 1306414258], length 0
2022-02-28 08:27:50.035043 IP (tos 0x0, ttl 64, id 38268, offset 0, flags [DF], proto TCP (6), length 54)
    127.0.0.1.9950 > 127.0.0.1.37594: Flags [P.], cksum 0xfe2a (incorrect -> 0x229b), seq 1:3, ack 4, win 512, options [nop,nop,TS val 1306414258 ecr 1306414258], length 2
2022-02-28 08:27:50.035048 IP (tos 0x0, ttl 64, id 30919, offset 0, flags [DF], proto TCP (6), length 52)
    127.0.0.1.37594 > 127.0.0.1.9950: Flags [.], cksum 0xfe28 (incorrect -> 0x27a3), seq 4, ack 3, win 512, options [nop,nop,TS val 1306414258 ecr 1306414258], length 0
2022-02-28 08:27:50.047056 IP (tos 0x0, ttl 64, id 30920, offset 0, flags [DF], proto TCP (6), length 62)
    127.0.0.1.37594 > 127.0.0.1.9950: Flags [P.], cksum 0xfe32 (incorrect -> 0x52fe), seq 4:14, ack 3, win 512, options [nop,nop,TS val 1306414270 ecr 1306414258], length 10
2022-02-28 08:27:50.047064 IP (tos 0x0, ttl 64, id 38269, offset 0, flags [DF], proto TCP (6), length 52)
    127.0.0.1.9950 > 127.0.0.1.37594: Flags [.], cksum 0xfe28 (incorrect -> 0x2781), seq 3, ack 14, win 512, options [nop,nop,TS val 1306414270 ecr 1306414270], length 0
2022-02-28 08:27:50.279290 IP (tos 0x0, ttl 64, id 38270, offset 0, flags [DF], proto TCP (6), length 62)
    127.0.0.1.9950 > 127.0.0.1.37594: Flags [P.], cksum 0xfe32 (incorrect -> 0x2186), seq 3:13, ack 14, win 512, options [nop,nop,TS val 1306414502 ecr 1306414270], length 10
2022-02-28 08:27:50.279299 IP (tos 0x0, ttl 64, id 30921, offset 0, flags [DF], proto TCP (6), length 52)
    127.0.0.1.37594 > 127.0.0.1.9950: Flags [.], cksum 0xfe28 (incorrect -> 0x25a7), seq 14, ack 13, win 512, options [nop,nop,TS val 1306414502 ecr 1306414502], length 0
2022-02-28 08:27:50.285519 IP (tos 0x0, ttl 64, id 30922, offset 0, flags [DF], proto TCP (6), length 569)
    127.0.0.1.37594 > 127.0.0.1.9950: Flags [P.], cksum 0x002e (incorrect -> 0x9885), seq 14:531, ack 13, win 512, options [nop,nop,TS val 1306414509 ecr 1306414502], length 517
2022-02-28 08:27:50.285529 IP (tos 0x0, ttl 64, id 38271, offset 0, flags [DF], proto TCP (6), length 52)
    127.0.0.1.9950 > 127.0.0.1.37594: Flags [.], cksum 0xfe28 (incorrect -> 0x2398), seq 13, ack 531, win 508, options [nop,nop,TS val 1306414509 ecr 1306414509], length 0
2022-02-28 08:27:50.521917 IP (tos 0x0, ttl 64, id 38272, offset 0, flags [DF], proto TCP (6), length 3538)
    127.0.0.1.9950 > 127.0.0.1.37594: Flags [P.], cksum 0x0bc7 (incorrect -> 0x4320), seq 13:3499, ack 531, win 512, options [nop,nop,TS val 1306414745 ecr 1306414509], length 3486
2022-02-28 08:27:50.521924 IP (tos 0x0, ttl 64, id 30923, offset 0, flags [DF], proto TCP (6), length 52)
    127.0.0.1.37594 > 127.0.0.1.9950: Flags [.], cksum 0xfe28 (incorrect -> 0x1430), seq 531, ack 3499, win 494, options [nop,nop,TS val 1306414745 ecr 1306414745], length 0
2022-02-28 08:27:50.612663 IP (tos 0x0, ttl 64, id 38273, offset 0, flags [DF], proto TCP (6), length 811)
    127.0.0.1.9950 > 127.0.0.1.37594: Flags [P.], cksum 0x0120 (incorrect -> 0xaf2a), seq 3499:4258, ack 531, win 512, options [nop,nop,TS val 1306414836 ecr 1306414745], length 759
2022-02-28 08:27:50.612668 IP (tos 0x0, ttl 64, id 30924, offset 0, flags [DF], proto TCP (6), length 52)
    127.0.0.1.37594 > 127.0.0.1.9950: Flags [.], cksum 0xfe28 (incorrect -> 0x1078), seq 531, ack 4258, win 505, options [nop,nop,TS val 1306414836 ecr 1306414836], length 0
2022-02-28 08:27:50.613053 IP (tos 0x0, ttl 64, id 30925, offset 0, flags [DF], proto TCP (6), length 132)
    127.0.0.1.37594 > 127.0.0.1.9950: Flags [P.], cksum 0xfe78 (incorrect -> 0x3ca9), seq 531:611, ack 4258, win 512, options [nop,nop,TS val 1306414836 ecr 1306414836], length 80
2022-02-28 08:27:50.613061 IP (tos 0x0, ttl 64, id 38274, offset 0, flags [DF], proto TCP (6), length 52)
    127.0.0.1.9950 > 127.0.0.1.37594: Flags [.], cksum 0xfe28 (incorrect -> 0x1021), seq 4258, ack 611, win 512, options [nop,nop,TS val 1306414836 ecr 1306414836], length 0
2022-02-28 08:27:50.613396 IP (tos 0x0, ttl 64, id 30926, offset 0, flags [DF], proto TCP (6), length 300)
    127.0.0.1.37594 > 127.0.0.1.9950: Flags [P.], cksum 0xff20 (incorrect -> 0x5ef4), seq 611:859, ack 4258, win 512, options [nop,nop,TS val 1306414836 ecr 1306414836], length 248
2022-02-28 08:27:50.613401 IP (tos 0x0, ttl 64, id 38275, offset 0, flags [DF], proto TCP (6), length 52)
    127.0.0.1.9950 > 127.0.0.1.37594: Flags [.], cksum 0xfe28 (incorrect -> 0x0f2a), seq 4258, ack 859, win 511, options [nop,nop,TS val 1306414836 ecr 1306414836], length 0
2022-02-28 08:27:50.849710 IP (tos 0x0, ttl 64, id 38276, offset 0, flags [DF], proto TCP (6), length 594)
    127.0.0.1.9950 > 127.0.0.1.37594: Flags [P.], cksum 0x0047 (incorrect -> 0x6e1a), seq 4258:4800, ack 859, win 512, options [nop,nop,TS val 1306415073 ecr 1306414836], length 542
2022-02-28 08:27:50.849719 IP (tos 0x0, ttl 64, id 30927, offset 0, flags [DF], proto TCP (6), length 52)
    127.0.0.1.37594 > 127.0.0.1.9950: Flags [.], cksum 0xfe28 (incorrect -> 0x0b35), seq 859, ack 4800, win 508, options [nop,nop,TS val 1306415073 ecr 1306415073], length 0
2022-02-28 08:27:50.985315 IP (tos 0x0, ttl 64, id 38277, offset 0, flags [DF], proto TCP (6), length 314)
    127.0.0.1.9950 > 127.0.0.1.37594: Flags [P.], cksum 0xff2e (incorrect -> 0xfc36), seq 4800:5062, ack 859, win 512, options [nop,nop,TS val 1306415208 ecr 1306415073], length 262
2022-02-28 08:27:50.985321 IP (tos 0x0, ttl 64, id 30928, offset 0, flags [DF], proto TCP (6), length 52)
    127.0.0.1.37594 > 127.0.0.1.9950: Flags [.], cksum 0xfe28 (incorrect -> 0x0923), seq 859, ack 5062, win 506, options [nop,nop,TS val 1306415208 ecr 1306415208], length 0
2022-02-28 08:27:50.987726 IP (tos 0x0, ttl 64, id 30929, offset 0, flags [DF], proto TCP (6), length 306)
    127.0.0.1.37594 > 127.0.0.1.9950: Flags [P.], cksum 0xff26 (incorrect -> 0x4b1c), seq 859:1113, ack 5062, win 512, options [nop,nop,TS val 1306415211 ecr 1306415208], length 254
2022-02-28 08:27:50.987746 IP (tos 0x0, ttl 64, id 38278, offset 0, flags [DF], proto TCP (6), length 52)
    127.0.0.1.9950 > 127.0.0.1.37594: Flags [.], cksum 0xfe28 (incorrect -> 0x081a), seq 5062, ack 1113, win 511, options [nop,nop,TS val 1306415211 ecr 1306415211], length 0
200, 4.597426652908325, 1.775301218032837