2022-02-28 05:37:37.010207 IP (tos 0x0, ttl 64, id 1765, offset 0, flags [DF], proto TCP (6), length 60)
    127.0.0.1.36748 > 127.0.0.1.10550: Flags [S], cksum 0xfe30 (incorrect -> 0xca6d), seq 1326496365, win 65495, options [mss 65495,sackOK,TS val 1296201233 ecr 0,nop,wscale 7], length 0
2022-02-28 05:37:37.010225 IP (tos 0x0, ttl 64, id 0, offset 0, flags [DF], proto TCP (6), length 60)
    127.0.0.1.10550 > 127.0.0.1.36748: Flags [S.], cksum 0xfe30 (incorrect -> 0x16a2), seq 1389665694, ack 1326496366, win 65483, options [mss 65495,sackOK,TS val 1296201233 ecr 1296201233,nop,wscale 7], length 0
2022-02-28 05:37:37.010239 IP (tos 0x0, ttl 64, id 1766, offset 0, flags [DF], proto TCP (6), length 52)
    127.0.0.1.36748 > 127.0.0.1.10550: Flags [.], cksum 0xfe28 (incorrect -> 0x3d5e), seq 1, ack 1, win 512, options [nop,nop,TS val 1296201233 ecr 1296201233], length 0
2022-02-28 05:37:37.010382 IP (tos 0x0, ttl 64, id 1767, offset 0, flags [DF], proto TCP (6), length 55)
    127.0.0.1.36748 > 127.0.0.1.10550: Flags [P.], cksum 0xfe2b (incorrect -> 0x3852), seq 1:4, ack 1, win 512, options [nop,nop,TS val 1296201233 ecr 1296201233], length 3
2022-02-28 05:37:37.010398 IP (tos 0x0, ttl 64, id 53717, offset 0, flags [DF], proto TCP (6), length 52)
    127.0.0.1.10550 > 127.0.0.1.36748: Flags [.], cksum 0xfe28 (incorrect -> 0x3d5b), seq 1, ack 4, win 512, options [nop,nop,TS val 1296201233 ecr 1296201233], length 0
2022-02-28 05:37:37.010435 IP (tos 0x0, ttl 64, id 53718, offset 0, flags [DF], proto TCP (6), length 54)
    127.0.0.1.10550 > 127.0.0.1.36748: Flags [P.], cksum 0xfe2a (incorrect -> 0x3850), seq 1:3, ack 4, win 512, options [nop,nop,TS val 1296201234 ecr 1296201233], length 2
2022-02-28 05:37:37.010449 IP (tos 0x0, ttl 64, id 1768, offset 0, flags [DF], proto TCP (6), length 52)
    127.0.0.1.36748 > 127.0.0.1.10550: Flags [.], cksum 0xfe28 (incorrect -> 0x3d57), seq 4, ack 3, win 512, options [nop,nop,TS val 1296201234 ecr 1296201234], length 0
2022-02-28 05:37:37.021465 IP (tos 0x0, ttl 64, id 1769, offset 0, flags [DF], proto TCP (6), length 62)
    127.0.0.1.36748 > 127.0.0.1.10550: Flags [P.], cksum 0xfe32 (incorrect -> 0xa93b), seq 4:14, ack 3, win 512, options [nop,nop,TS val 1296201245 ecr 1296201234], length 10
2022-02-28 05:37:37.021484 IP (tos 0x0, ttl 64, id 53719, offset 0, flags [DF], proto TCP (6), length 52)
    127.0.0.1.10550 > 127.0.0.1.36748: Flags [.], cksum 0xfe28 (incorrect -> 0x3d37), seq 3, ack 14, win 512, options [nop,nop,TS val 1296201245 ecr 1296201245], length 0
200, 4.918196439743042, 0.5405654907226562