2022-02-28 04:18:47.614064 IP (tos 0x0, ttl 64, id 47461, offset 0, flags [DF], proto TCP (6), length 60)
    127.0.0.1.38414 > 127.0.0.1.11250: Flags [S], cksum 0xfe30 (incorrect -> 0xd2ff), seq 1942204006, win 65495, options [mss 65495,sackOK,TS val 1291471837 ecr 0,nop,wscale 7], length 0
2022-02-28 04:18:47.614078 IP (tos 0x0, ttl 64, id 0, offset 0, flags [DF], proto TCP (6), length 60)
    127.0.0.1.11250 > 127.0.0.1.38414: Flags [S.], cksum 0xfe30 (incorrect -> 0x82f0), seq 1061320688, ack 1942204007, win 65483, options [mss 65495,sackOK,TS val 1291471837 ecr 1291471837,nop,wscale 7], length 0
2022-02-28 04:18:47.614088 IP (tos 0x0, ttl 64, id 47462, offset 0, flags [DF], proto TCP (6), length 52)
    127.0.0.1.38414 > 127.0.0.1.11250: Flags [.], cksum 0xfe28 (incorrect -> 0xa9ac), seq 1, ack 1, win 512, options [nop,nop,TS val 1291471837 ecr 1291471837], length 0
2022-02-28 04:18:47.614229 IP (tos 0x0, ttl 64, id 47463, offset 0, flags [DF], proto TCP (6), length 55)
    127.0.0.1.38414 > 127.0.0.1.11250: Flags [P.], cksum 0xfe2b (incorrect -> 0xa4a0), seq 1:4, ack 1, win 512, options [nop,nop,TS val 1291471837 ecr 1291471837], length 3
2022-02-28 04:18:47.614244 IP (tos 0x0, ttl 64, id 46287, offset 0, flags [DF], proto TCP (6), length 52)
    127.0.0.1.11250 > 127.0.0.1.38414: Flags [.], cksum 0xfe28 (incorrect -> 0xa9a9), seq 1, ack 4, win 512, options [nop,nop,TS val 1291471837 ecr 1291471837], length 0
2022-02-28 04:18:47.614278 IP (tos 0x0, ttl 64, id 46288, offset 0, flags [DF], proto TCP (6), length 54)
    127.0.0.1.11250 > 127.0.0.1.38414: Flags [P.], cksum 0xfe2a (incorrect -> 0xa49f), seq 1:3, ack 4, win 512, options [nop,nop,TS val 1291471837 ecr 1291471837], length 2
2022-02-28 04:18:47.614292 IP (tos 0x0, ttl 64, id 47464, offset 0, flags [DF], proto TCP (6), length 52)
    127.0.0.1.38414 > 127.0.0.1.11250: Flags [.], cksum 0xfe28 (incorrect -> 0xa9a7), seq 4, ack 3, win 512, options [nop,nop,TS val 1291471837 ecr 1291471837], length 0
2022-02-28 04:18:47.625715 IP (tos 0x0, ttl 64, id 47465, offset 0, flags [DF], proto TCP (6), length 62)
    127.0.0.1.38414 > 127.0.0.1.11250: Flags [P.], cksum 0xfe32 (incorrect -> 0x592d), seq 4:14, ack 3, win 512, options [nop,nop,TS val 1291471849 ecr 1291471837], length 10
2022-02-28 04:18:47.625732 IP (tos 0x0, ttl 64, id 46289, offset 0, flags [DF], proto TCP (6), length 52)
    127.0.0.1.11250 > 127.0.0.1.38414: Flags [.], cksum 0xfe28 (incorrect -> 0xa985), seq 3, ack 14, win 512, options [nop,nop,TS val 1291471849 ecr 1291471849], length 0
2022-02-28 04:18:47.694061 IP (tos 0x0, ttl 64, id 46290, offset 0, flags [DF], proto TCP (6), length 62)
    127.0.0.1.11250 > 127.0.0.1.38414: Flags [P.], cksum 0xfe32 (incorrect -> 0xa42e), seq 3:13, ack 14, win 512, options [nop,nop,TS val 1291471917 ecr 1291471849], length 10
2022-02-28 04:18:47.694071 IP (tos 0x0, ttl 64, id 47466, offset 0, flags [DF], proto TCP (6), length 52)
    127.0.0.1.38414 > 127.0.0.1.11250: Flags [.], cksum 0xfe28 (incorrect -> 0xa8f3), seq 14, ack 13, win 512, options [nop,nop,TS val 1291471917 ecr 1291471917], length 0
2022-02-28 04:18:47.700281 IP (tos 0x0, ttl 64, id 47467, offset 0, flags [DF], proto TCP (6), length 569)
    127.0.0.1.38414 > 127.0.0.1.11250: Flags [P.], cksum 0x002e (incorrect -> 0x4894), seq 14:531, ack 13, win 512, options [nop,nop,TS val 1291471923 ecr 1291471917], length 517
2022-02-28 04:18:47.700292 IP (tos 0x0, ttl 64, id 46291, offset 0, flags [DF], proto TCP (6), length 52)
    127.0.0.1.11250 > 127.0.0.1.38414: Flags [.], cksum 0xfe28 (incorrect -> 0xa6e6), seq 13, ack 531, win 508, options [nop,nop,TS val 1291471923 ecr 1291471923], length 0
2022-02-28 04:18:47.764807 IP (tos 0x0, ttl 64, id 46292, offset 0, flags [DF], proto TCP (6), length 3538)
    127.0.0.1.11250 > 127.0.0.1.38414: Flags [P.], cksum 0x0bc7 (incorrect -> 0xd6a3), seq 13:3499, ack 531, win 512, options [nop,nop,TS val 1291471988 ecr 1291471923], length 3486
2022-02-28 04:18:47.764815 IP (tos 0x0, ttl 64, id 47468, offset 0, flags [DF], proto TCP (6), length 52)
    127.0.0.1.38414 > 127.0.0.1.11250: Flags [.], cksum 0xfe28 (incorrect -> 0x98d4), seq 531, ack 3499, win 494, options [nop,nop,TS val 1291471988 ecr 1291471988], length 0
2022-02-28 04:18:47.817701 IP (tos 0x0, ttl 64, id 46293, offset 0, flags [DF], proto TCP (6), length 541)
    127.0.0.1.11250 > 127.0.0.1.38414: Flags [P.], cksum 0x0012 (incorrect -> 0xb78c), seq 3499:3988, ack 531, win 512, options [nop,nop,TS val 1291472041 ecr 1291471988], length 489
2022-02-28 04:18:47.817709 IP (tos 0x0, ttl 64, id 47469, offset 0, flags [DF], proto TCP (6), length 52)
    127.0.0.1.38414 > 127.0.0.1.11250: Flags [.], cksum 0xfe28 (incorrect -> 0x9675), seq 531, ack 3988, win 506, options [nop,nop,TS val 1291472041 ecr 1291472041], length 0
2022-02-28 04:18:47.818059 IP (tos 0x0, ttl 64, id 47470, offset 0, flags [DF], proto TCP (6), length 132)
    127.0.0.1.38414 > 127.0.0.1.11250: Flags [P.], cksum 0xfe78 (incorrect -> 0x169f), seq 531:611, ack 3988, win 512, options [nop,nop,TS val 1291472041 ecr 1291472041], length 80
2022-02-28 04:18:47.818068 IP (tos 0x0, ttl 64, id 46294, offset 0, flags [DF], proto TCP (6), length 52)
    127.0.0.1.11250 > 127.0.0.1.38414: Flags [.], cksum 0xfe28 (incorrect -> 0x961f), seq 3988, ack 611, win 512, options [nop,nop,TS val 1291472041 ecr 1291472041], length 0
2022-02-28 04:18:47.818504 IP (tos 0x0, ttl 64, id 47471, offset 0, flags [DF], proto TCP (6), length 352)
    127.0.0.1.38414 > 127.0.0.1.11250: Flags [P.], cksum 0xff54 (incorrect -> 0x71b9), seq 611:911, ack 3988, win 512, options [nop,nop,TS val 1291472042 ecr 1291472041], length 300
2022-02-28 04:18:47.818516 IP (tos 0x0, ttl 64, id 46295, offset 0, flags [DF], proto TCP (6), length 52)
    127.0.0.1.11250 > 127.0.0.1.38414: Flags [.], cksum 0xfe28 (incorrect -> 0x94f3), seq 3988, ack 911, win 510, options [nop,nop,TS val 1291472042 ecr 1291472042], length 0
2022-02-28 04:18:47.883959 IP (tos 0x0, ttl 64, id 46296, offset 0, flags [DF], proto TCP (6), length 594)
    127.0.0.1.11250 > 127.0.0.1.38414: Flags [P.], cksum 0x0047 (incorrect -> 0x916c), seq 3988:4530, ack 911, win 512, options [nop,nop,TS val 1291472107 ecr 1291472042], length 542
2022-02-28 04:18:47.883967 IP (tos 0x0, ttl 64, id 47472, offset 0, flags [DF], proto TCP (6), length 52)
    127.0.0.1.38414 > 127.0.0.1.11250: Flags [.], cksum 0xfe28 (incorrect -> 0x9255), seq 911, ack 4530, win 508, options [nop,nop,TS val 1291472107 ecr 1291472107], length 0
2022-02-28 04:18:47.927874 IP (tos 0x0, ttl 64, id 46297, offset 0, flags [DF], proto TCP (6), length 3538)
    127.0.0.1.11250 > 127.0.0.1.38414: Flags [P.], cksum 0x0bc7 (incorrect -> 0x07b4), seq 4530:8016, ack 911, win 512, options [nop,nop,TS val 1291472151 ecr 1291472107], length 3486
2022-02-28 04:18:47.927882 IP (tos 0x0, ttl 64, id 47473, offset 0, flags [DF], proto TCP (6), length 52)
    127.0.0.1.38414 > 127.0.0.1.11250: Flags [.], cksum 0xfe28 (incorrect -> 0x846d), seq 911, ack 8016, win 494, options [nop,nop,TS val 1291472151 ecr 1291472151], length 0
2022-02-28 04:18:47.927913 IP (tos 0x0, ttl 64, id 46298, offset 0, flags [DF], proto TCP (6), length 4036)
    127.0.0.1.11250 > 127.0.0.1.38414: Flags [P.], cksum 0x0db9 (incorrect -> 0x474a), seq 8016:12000, ack 911, win 512, options [nop,nop,TS val 1291472151 ecr 1291472151], length 3984
2022-02-28 04:18:47.927918 IP (tos 0x0, ttl 64, id 47474, offset 0, flags [DF], proto TCP (6), length 52)
    127.0.0.1.38414 > 127.0.0.1.11250: Flags [.], cksum 0xfe28 (incorrect -> 0x74ed), seq 911, ack 12000, win 478, options [nop,nop,TS val 1291472151 ecr 1291472151], length 0
2022-02-28 04:18:47.929729 IP (tos 0x0, ttl 64, id 46299, offset 0, flags [DF], proto TCP (6), length 3538)
    127.0.0.1.11250 > 127.0.0.1.38414: Flags [P.], cksum 0x0bc7 (incorrect -> 0x9686), seq 12000:15486, ack 911, win 512, options [nop,nop,TS val 1291472153 ecr 1291472151], length 3486
2022-02-28 04:18:47.929736 IP (tos 0x0, ttl 64, id 47475, offset 0, flags [DF], proto TCP (6), length 52)
    127.0.0.1.38414 > 127.0.0.1.11250: Flags [.], cksum 0xfe28 (incorrect -> 0x673b), seq 911, ack 15486, win 494, options [nop,nop,TS val 1291472153 ecr 1291472153], length 0
2022-02-28 04:18:47.940512 IP (tos 0x0, ttl 64, id 46300, offset 0, flags [DF], proto TCP (6), length 550)
    127.0.0.1.11250 > 127.0.0.1.38414: Flags [P.], cksum 0x001b (incorrect -> 0x75f1), seq 15486:15984, ack 911, win 512, options [nop,nop,TS val 1291472164 ecr 1291472153], length 498
2022-02-28 04:18:47.940519 IP (tos 0x0, ttl 64, id 47476, offset 0, flags [DF], proto TCP (6), length 52)
    127.0.0.1.38414 > 127.0.0.1.11250: Flags [.], cksum 0xfe28 (incorrect -> 0x6527), seq 911, ack 15984, win 506, options [nop,nop,TS val 1291472164 ecr 1291472164], length 0
2022-02-28 04:18:47.941014 IP (tos 0x0, ttl 64, id 46301, offset 0, flags [DF], proto TCP (6), length 2044)
    127.0.0.1.11250 > 127.0.0.1.38414: Flags [P.], cksum 0x05f1 (incorrect -> 0x759c), seq 15984:17976, ack 911, win 512, options [nop,nop,TS val 1291472164 ecr 1291472164], length 1992
2022-02-28 04:18:47.941020 IP (tos 0x0, ttl 64, id 47477, offset 0, flags [DF], proto TCP (6), length 52)
    127.0.0.1.38414 > 127.0.0.1.11250: Flags [.], cksum 0xfe28 (incorrect -> 0x5d65), seq 911, ack 17976, win 500, options [nop,nop,TS val 1291472164 ecr 1291472164], length 0
2022-02-28 04:18:47.948723 IP (tos 0x0, ttl 64, id 46302, offset 0, flags [DF], proto TCP (6), length 4100)
    127.0.0.1.11250 > 127.0.0.1.38414: Flags [P.], cksum 0x0df9 (incorrect -> 0x2b84), seq 17976:22024, ack 911, win 512, options [nop,nop,TS val 1291472172 ecr 1291472164], length 4048
2022-02-28 04:18:47.948730 IP (tos 0x0, ttl 64, id 47478, offset 0, flags [DF], proto TCP (6), length 52)
    127.0.0.1.38414 > 127.0.0.1.11250: Flags [.], cksum 0xfe28 (incorrect -> 0x4d8d), seq 911, ack 22024, win 492, options [nop,nop,TS val 1291472172 ecr 1291472172], length 0
2022-02-28 04:18:47.948738 IP (tos 0x0, ttl 64, id 46303, offset 0, flags [DF], proto TCP (6), length 3378)
    127.0.0.1.11250 > 127.0.0.1.38414: Flags [P.], cksum 0x0b27 (incorrect -> 0x4d84), seq 22024:25350, ack 911, win 512, options [nop,nop,TS val 1291472172 ecr 1291472172], length 3326
2022-02-28 04:18:47.948743 IP (tos 0x0, ttl 64, id 47479, offset 0, flags [DF], proto TCP (6), length 52)
    127.0.0.1.38414 > 127.0.0.1.11250: Flags [.], cksum 0xfe28 (incorrect -> 0x409c), seq 911, ack 25350, win 479, options [nop,nop,TS val 1291472172 ecr 1291472172], length 0
2022-02-28 04:18:47.948810 IP (tos 0x0, ttl 64, id 46304, offset 0, flags [DF], proto TCP (6), length 4100)
    127.0.0.1.11250 > 127.0.0.1.38414: Flags [P.], cksum 0x0df9 (incorrect -> 0xfa7c), seq 25350:29398, ack 911, win 512, options [nop,nop,TS val 1291472172 ecr 1291472172], length 4048
2022-02-28 04:18:47.976811 IP (tos 0x0, ttl 64, id 46305, offset 0, flags [DF], proto TCP (6), length 32820)
    127.0.0.1.11250 > 127.0.0.1.38414: Flags [.], cksum 0x7e29 (incorrect -> 0x91e9), seq 29398:62166, ack 911, win 512, options [nop,nop,TS val 1291472200 ecr 1291472172], length 32768
2022-02-28 04:18:47.976864 IP (tos 0x0, ttl 64, id 47480, offset 0, flags [DF], proto TCP (6), length 52)
    127.0.0.1.38414 > 127.0.0.1.11250: Flags [.], cksum 0xfe28 (incorrect -> 0xb113), seq 911, ack 62166, win 379, options [nop,nop,TS val 1291472200 ecr 1291472172], length 0
2022-02-28 04:18:47.976872 IP (tos 0x0, ttl 64, id 46306, offset 0, flags [DF], proto TCP (6), length 11088)
    127.0.0.1.11250 > 127.0.0.1.38414: Flags [P.], cksum 0x2945 (incorrect -> 0xeda0), seq 62166:73202, ack 911, win 512, options [nop,nop,TS val 1291472200 ecr 1291472200], length 11036
2022-02-28 04:18:47.978195 IP (tos 0x0, ttl 64, id 47481, offset 0, flags [DF], proto TCP (6), length 52)
    127.0.0.1.38414 > 127.0.0.1.11250: Flags [.], cksum 0xfe28 (incorrect -> 0x8555), seq 911, ack 73202, win 512, options [nop,nop,TS val 1291472201 ecr 1291472200], length 0
2022-02-28 04:18:47.980369 IP (tos 0x0, ttl 64, id 46307, offset 0, flags [DF], proto TCP (6), length 3968)
    127.0.0.1.11250 > 127.0.0.1.38414: Flags [P.], cksum 0x0d75 (incorrect -> 0x018d), seq 73202:77118, ack 911, win 512, options [nop,nop,TS val 1291472203 ecr 1291472201], length 3916
2022-02-28 04:18:47.980485 IP (tos 0x0, ttl 64, id 47482, offset 0, flags [DF], proto TCP (6), length 52)
    127.0.0.1.38414 > 127.0.0.1.11250: Flags [.], cksum 0xfe28 (incorrect -> 0x7603), seq 911, ack 77118, win 512, options [nop,nop,TS val 1291472204 ecr 1291472203], length 0
2022-02-28 04:18:47.980497 IP (tos 0x0, ttl 64, id 46308, offset 0, flags [DF], proto TCP (6), length 7884)
    127.0.0.1.11250 > 127.0.0.1.38414: Flags [P.], cksum 0x1cc1 (incorrect -> 0x95bb), seq 77118:84950, ack 911, win 512, options [nop,nop,TS val 1291472204 ecr 1291472204], length 7832
2022-02-28 04:18:47.981071 IP (tos 0x0, ttl 64, id 47483, offset 0, flags [DF], proto TCP (6), length 52)
    127.0.0.1.38414 > 127.0.0.1.11250: Flags [.], cksum 0xfe28 (incorrect -> 0x576a), seq 911, ack 84950, win 512, options [nop,nop,TS val 1291472204 ecr 1291472204], length 0
2022-02-28 04:18:47.988265 IP (tos 0x0, ttl 64, id 46309, offset 0, flags [DF], proto TCP (6), length 4100)
    127.0.0.1.11250 > 127.0.0.1.38414: Flags [P.], cksum 0x0df9 (incorrect -> 0xf00b), seq 84950:88998, ack 911, win 512, options [nop,nop,TS val 1291472211 ecr 1291472204], length 4048
2022-02-28 04:18:47.988359 IP (tos 0x0, ttl 64, id 47484, offset 0, flags [DF], proto TCP (6), length 52)
    127.0.0.1.38414 > 127.0.0.1.11250: Flags [.], cksum 0xfe28 (incorrect -> 0x478c), seq 911, ack 88998, win 512, options [nop,nop,TS val 1291472211 ecr 1291472211], length 0
2022-02-28 04:18:47.988367 IP (tos 0x0, ttl 64, id 46310, offset 0, flags [DF], proto TCP (6), length 9970)
    127.0.0.1.11250 > 127.0.0.1.38414: Flags [P.], cksum 0x24e7 (incorrect -> 0x6051), seq 88998:98916, ack 911, win 512, options [nop,nop,TS val 1291472211 ecr 1291472211], length 9918
2022-02-28 04:18:47.988373 IP (tos 0x0, ttl 64, id 47485, offset 0, flags [DF], proto TCP (6), length 52)
    127.0.0.1.38414 > 127.0.0.1.11250: Flags [.], cksum 0xfe28 (incorrect -> 0x20ce), seq 911, ack 98916, win 512, options [nop,nop,TS val 1291472211 ecr 1291472211], length 0
2022-02-28 04:18:48.052760 IP (tos 0x0, ttl 64, id 46311, offset 0, flags [DF], proto TCP (6), length 3402)
    127.0.0.1.11250 > 127.0.0.1.38414: Flags [P.], cksum 0x0b3f (incorrect -> 0x5c7d), seq 98916:102266, ack 911, win 512, options [nop,nop,TS val 1291472276 ecr 1291472211], length 3350
2022-02-28 04:18:48.053452 IP (tos 0x0, ttl 64, id 47486, offset 0, flags [DF], proto TCP (6), length 52)
    127.0.0.1.38414 > 127.0.0.1.11250: Flags [.], cksum 0xfe28 (incorrect -> 0x1335), seq 911, ack 102266, win 512, options [nop,nop,TS val 1291472277 ecr 1291472276], length 0
2022-02-28 04:18:48.064553 IP (tos 0x0, ttl 64, id 46312, offset 0, flags [DF], proto TCP (6), length 4100)
    127.0.0.1.11250 > 127.0.0.1.38414: Flags [P.], cksum 0x0df9 (incorrect -> 0xe153), seq 102266:106314, ack 911, win 512, options [nop,nop,TS val 1291472288 ecr 1291472277], length 4048
2022-02-28 04:18:48.064650 IP (tos 0x0, ttl 64, id 47487, offset 0, flags [DF], proto TCP (6), length 52)
    127.0.0.1.38414 > 127.0.0.1.11250: Flags [.], cksum 0xfe28 (incorrect -> 0x034e), seq 911, ack 106314, win 512, options [nop,nop,TS val 1291472288 ecr 1291472288], length 0
2022-02-28 04:18:48.064658 IP (tos 0x0, ttl 64, id 46313, offset 0, flags [DF], proto TCP (6), length 14452)
    127.0.0.1.11250 > 127.0.0.1.38414: Flags [P.], cksum 0x3669 (incorrect -> 0x9e24), seq 106314:120714, ack 911, win 512, options [nop,nop,TS val 1291472288 ecr 1291472288], length 14400
2022-02-28 04:18:48.065006 IP (tos 0x0, ttl 64, id 47488, offset 0, flags [DF], proto TCP (6), length 52)
    127.0.0.1.38414 > 127.0.0.1.11250: Flags [.], cksum 0xfe28 (incorrect -> 0xcb0d), seq 911, ack 120714, win 512, options [nop,nop,TS val 1291472288 ecr 1291472288], length 0
2022-02-28 04:18:48.071429 IP (tos 0x0, ttl 64, id 46314, offset 0, flags [DF], proto TCP (6), length 4100)
    127.0.0.1.11250 > 127.0.0.1.38414: Flags [P.], cksum 0x0df9 (incorrect -> 0x06d1), seq 120714:124762, ack 911, win 512, options [nop,nop,TS val 1291472294 ecr 1291472288], length 4048
2022-02-28 04:18:48.071523 IP (tos 0x0, ttl 64, id 47489, offset 0, flags [DF], proto TCP (6), length 52)
    127.0.0.1.38414 > 127.0.0.1.11250: Flags [.], cksum 0xfe28 (incorrect -> 0xbb30), seq 911, ack 124762, win 512, options [nop,nop,TS val 1291472295 ecr 1291472294], length 0
200, 4.789688587188721, 0.48299241065979004