2022-02-28 12:18:29.966299 IP (tos 0x0, ttl 64, id 48272, offset 0, flags [DF], proto TCP (6), length 60)
    127.0.0.1.37212 > 127.0.0.1.9450: Flags [S], cksum 0xfe30 (incorrect -> 0x58f8), seq 3845034485, win 65495, options [mss 65495,sackOK,TS val 1320254189 ecr 0,nop,wscale 7], length 0
2022-02-28 12:18:29.966312 IP (tos 0x0, ttl 64, id 0, offset 0, flags [DF], proto TCP (6), length 60)
    127.0.0.1.9450 > 127.0.0.1.37212: Flags [S.], cksum 0xfe30 (incorrect -> 0xbeee), seq 755540829, ack 3845034486, win 65483, options [mss 65495,sackOK,TS val 1320254189 ecr 1320254189,nop,wscale 7], length 0
2022-02-28 12:18:29.966322 IP (tos 0x0, ttl 64, id 48273, offset 0, flags [DF], proto TCP (6), length 52)
    127.0.0.1.37212 > 127.0.0.1.9450: Flags [.], cksum 0xfe28 (incorrect -> 0xe5aa), seq 1, ack 1, win 512, options [nop,nop,TS val 1320254189 ecr 1320254189], length 0
2022-02-28 12:18:29.966421 IP (tos 0x0, ttl 64, id 48274, offset 0, flags [DF], proto TCP (6), length 55)
    127.0.0.1.37212 > 127.0.0.1.9450: Flags [P.], cksum 0xfe2b (incorrect -> 0xe09e), seq 1:4, ack 1, win 512, options [nop,nop,TS val 1320254189 ecr 1320254189], length 3
2022-02-28 12:18:29.966426 IP (tos 0x0, ttl 64, id 14485, offset 0, flags [DF], proto TCP (6), length 52)
    127.0.0.1.9450 > 127.0.0.1.37212: Flags [.], cksum 0xfe28 (incorrect -> 0xe5a7), seq 1, ack 4, win 512, options [nop,nop,TS val 1320254189 ecr 1320254189], length 0
2022-02-28 12:18:29.966483 IP (tos 0x0, ttl 64, id 14486, offset 0, flags [DF], proto TCP (6), length 54)
    127.0.0.1.9450 > 127.0.0.1.37212: Flags [P.], cksum 0xfe2a (incorrect -> 0xe09c), seq 1:3, ack 4, win 512, options [nop,nop,TS val 1320254190 ecr 1320254189], length 2
2022-02-28 12:18:29.966488 IP (tos 0x0, ttl 64, id 48275, offset 0, flags [DF], proto TCP (6), length 52)
    127.0.0.1.37212 > 127.0.0.1.9450: Flags [.], cksum 0xfe28 (incorrect -> 0xe5a3), seq 4, ack 3, win 512, options [nop,nop,TS val 1320254190 ecr 1320254190], length 0
2022-02-28 12:18:29.967885 IP (tos 0x0, ttl 64, id 48276, offset 0, flags [DF], proto TCP (6), length 62)
    127.0.0.1.37212 > 127.0.0.1.9450: Flags [P.], cksum 0xfe32 (incorrect -> 0xa75a), seq 4:14, ack 3, win 512, options [nop,nop,TS val 1320254191 ecr 1320254190], length 10
2022-02-28 12:18:29.967894 IP (tos 0x0, ttl 64, id 14487, offset 0, flags [DF], proto TCP (6), length 52)
    127.0.0.1.9450 > 127.0.0.1.37212: Flags [.], cksum 0xfe28 (incorrect -> 0xe597), seq 3, ack 14, win 512, options [nop,nop,TS val 1320254191 ecr 1320254191], length 0
2022-02-28 12:18:30.037516 IP (tos 0x0, ttl 64, id 14488, offset 0, flags [DF], proto TCP (6), length 62)
    127.0.0.1.9450 > 127.0.0.1.37212: Flags [P.], cksum 0xfe32 (incorrect -> 0xe03e), seq 3:13, ack 14, win 512, options [nop,nop,TS val 1320254261 ecr 1320254191], length 10
2022-02-28 12:18:30.037524 IP (tos 0x0, ttl 64, id 48277, offset 0, flags [DF], proto TCP (6), length 52)
    127.0.0.1.37212 > 127.0.0.1.9450: Flags [.], cksum 0xfe28 (incorrect -> 0xe501), seq 14, ack 13, win 512, options [nop,nop,TS val 1320254261 ecr 1320254261], length 0
2022-02-28 12:18:30.043050 IP (tos 0x0, ttl 64, id 48278, offset 0, flags [DF], proto TCP (6), length 569)
    127.0.0.1.37212 > 127.0.0.1.9450: Flags [P.], cksum 0x002e (incorrect -> 0x3892), seq 14:531, ack 13, win 512, options [nop,nop,TS val 1320254266 ecr 1320254261], length 517
2022-02-28 12:18:30.043058 IP (tos 0x0, ttl 64, id 14489, offset 0, flags [DF], proto TCP (6), length 52)
    127.0.0.1.9450 > 127.0.0.1.37212: Flags [.], cksum 0xfe28 (incorrect -> 0xe2f6), seq 13, ack 531, win 508, options [nop,nop,TS val 1320254266 ecr 1320254266], length 0
2022-02-28 12:18:30.097606 IP (tos 0x0, ttl 64, id 14490, offset 0, flags [DF], proto TCP (6), length 3538)
    127.0.0.1.9450 > 127.0.0.1.37212: Flags [P.], cksum 0x0bc7 (incorrect -> 0xc9e1), seq 13:3499, ack 531, win 512, options [nop,nop,TS val 1320254321 ecr 1320254266], length 3486
2022-02-28 12:18:30.097614 IP (tos 0x0, ttl 64, id 48279, offset 0, flags [DF], proto TCP (6), length 52)
    127.0.0.1.37212 > 127.0.0.1.9450: Flags [.], cksum 0xfe28 (incorrect -> 0xd4f8), seq 531, ack 3499, win 494, options [nop,nop,TS val 1320254321 ecr 1320254321], length 0
200, 8.729961395263672, 0.7696397304534912