2022-02-28 03:23:19.105262 IP (tos 0x0, ttl 64, id 55648, offset 0, flags [DF], proto TCP (6), length 60)
    127.0.0.1.33168 > 127.0.0.1.11950: Flags [S], cksum 0xfe30 (incorrect -> 0xd732), seq 3113304151, win 65495, options [mss 65495,sackOK,TS val 1288143328 ecr 0,nop,wscale 7], length 0
2022-02-28 03:23:19.105282 IP (tos 0x0, ttl 64, id 0, offset 0, flags [DF], proto TCP (6), length 60)
    127.0.0.1.11950 > 127.0.0.1.33168: Flags [S.], cksum 0xfe30 (incorrect -> 0xb948), seq 3307178525, ack 3113304152, win 65483, options [mss 65495,sackOK,TS val 1288143328 ecr 1288143328,nop,wscale 7], length 0
2022-02-28 03:23:19.105296 IP (tos 0x0, ttl 64, id 55649, offset 0, flags [DF], proto TCP (6), length 52)
    127.0.0.1.33168 > 127.0.0.1.11950: Flags [.], cksum 0xfe28 (incorrect -> 0xe004), seq 1, ack 1, win 512, options [nop,nop,TS val 1288143328 ecr 1288143328], length 0
2022-02-28 03:23:19.105424 IP (tos 0x0, ttl 64, id 55650, offset 0, flags [DF], proto TCP (6), length 55)
    127.0.0.1.33168 > 127.0.0.1.11950: Flags [P.], cksum 0xfe2b (incorrect -> 0xdaf8), seq 1:4, ack 1, win 512, options [nop,nop,TS val 1288143328 ecr 1288143328], length 3
2022-02-28 03:23:19.105441 IP (tos 0x0, ttl 64, id 47701, offset 0, flags [DF], proto TCP (6), length 52)
    127.0.0.1.11950 > 127.0.0.1.33168: Flags [.], cksum 0xfe28 (incorrect -> 0xe000), seq 1, ack 4, win 512, options [nop,nop,TS val 1288143329 ecr 1288143328], length 0
2022-02-28 03:23:19.105503 IP (tos 0x0, ttl 64, id 47702, offset 0, flags [DF], proto TCP (6), length 54)
    127.0.0.1.11950 > 127.0.0.1.33168: Flags [P.], cksum 0xfe2a (incorrect -> 0xdaf6), seq 1:3, ack 4, win 512, options [nop,nop,TS val 1288143329 ecr 1288143328], length 2
2022-02-28 03:23:19.105524 IP (tos 0x0, ttl 64, id 55651, offset 0, flags [DF], proto TCP (6), length 52)
    127.0.0.1.33168 > 127.0.0.1.11950: Flags [.], cksum 0xfe28 (incorrect -> 0xdffd), seq 4, ack 3, win 512, options [nop,nop,TS val 1288143329 ecr 1288143329], length 0
2022-02-28 03:23:19.107073 IP (tos 0x0, ttl 64, id 55652, offset 0, flags [DF], proto TCP (6), length 62)
    127.0.0.1.33168 > 127.0.0.1.11950: Flags [P.], cksum 0xfe32 (incorrect -> 0x4712), seq 4:14, ack 3, win 512, options [nop,nop,TS val 1288143330 ecr 1288143329], length 10
2022-02-28 03:23:19.107092 IP (tos 0x0, ttl 64, id 47703, offset 0, flags [DF], proto TCP (6), length 52)
    127.0.0.1.11950 > 127.0.0.1.33168: Flags [.], cksum 0xfe28 (incorrect -> 0xdff1), seq 3, ack 14, win 512, options [nop,nop,TS val 1288143330 ecr 1288143330], length 0
2022-02-28 03:23:20.009754 IP (tos 0x0, ttl 64, id 47704, offset 0, flags [DF], proto TCP (6), length 62)
    127.0.0.1.11950 > 127.0.0.1.33168: Flags [P.], cksum 0xfe32 (incorrect -> 0xd757), seq 3:13, ack 14, win 512, options [nop,nop,TS val 1288144233 ecr 1288143330], length 10
2022-02-28 03:23:20.009782 IP (tos 0x0, ttl 64, id 55653, offset 0, flags [DF], proto TCP (6), length 52)
    127.0.0.1.33168 > 127.0.0.1.11950: Flags [.], cksum 0xfe28 (incorrect -> 0xd8d9), seq 14, ack 13, win 512, options [nop,nop,TS val 1288144233 ecr 1288144233], length 0
2022-02-28 03:23:20.016790 IP (tos 0x0, ttl 64, id 55654, offset 0, flags [DF], proto TCP (6), length 569)
    127.0.0.1.33168 > 127.0.0.1.11950: Flags [P.], cksum 0x002e (incorrect -> 0x4afa), seq 14:531, ack 13, win 512, options [nop,nop,TS val 1288144240 ecr 1288144233], length 517
2022-02-28 03:23:20.016869 IP (tos 0x0, ttl 64, id 47705, offset 0, flags [DF], proto TCP (6), length 52)
    127.0.0.1.11950 > 127.0.0.1.33168: Flags [.], cksum 0xfe28 (incorrect -> 0xd6ca), seq 13, ack 531, win 508, options [nop,nop,TS val 1288144240 ecr 1288144240], length 0
2022-02-28 03:23:20.808176 IP (tos 0x0, ttl 64, id 47706, offset 0, flags [DF], proto TCP (6), length 3538)
    127.0.0.1.11950 > 127.0.0.1.33168: Flags [P.], cksum 0x0bc7 (incorrect -> 0x50b4), seq 13:3499, ack 531, win 512, options [nop,nop,TS val 1288145031 ecr 1288144240], length 3486
2022-02-28 03:23:20.808202 IP (tos 0x0, ttl 64, id 55655, offset 0, flags [DF], proto TCP (6), length 52)
    127.0.0.1.33168 > 127.0.0.1.11950: Flags [.], cksum 0xfe28 (incorrect -> 0xc30c), seq 531, ack 3499, win 494, options [nop,nop,TS val 1288145031 ecr 1288145031], length 0
2022-02-28 03:23:20.824570 IP (tos 0x0, ttl 64, id 47707, offset 0, flags [DF], proto TCP (6), length 494)
    127.0.0.1.11950 > 127.0.0.1.33168: Flags [P.], cksum 0xffe2 (incorrect -> 0x4eeb), seq 3499:3941, ack 531, win 512, options [nop,nop,TS val 1288145048 ecr 1288145031], length 442
2022-02-28 03:23:20.824588 IP (tos 0x0, ttl 64, id 55656, offset 0, flags [DF], proto TCP (6), length 52)
    127.0.0.1.33168 > 127.0.0.1.11950: Flags [.], cksum 0xfe28 (incorrect -> 0xc124), seq 531, ack 3941, win 506, options [nop,nop,TS val 1288145048 ecr 1288145048], length 0
2022-02-28 03:23:20.827210 IP (tos 0x0, ttl 64, id 55657, offset 0, flags [DF], proto TCP (6), length 210)
    127.0.0.1.33168 > 127.0.0.1.11950: Flags [P.], cksum 0xfec6 (incorrect -> 0x00d3), seq 531:689, ack 3941, win 512, options [nop,nop,TS val 1288145050 ecr 1288145048], length 158
2022-02-28 03:23:20.827223 IP (tos 0x0, ttl 64, id 47708, offset 0, flags [DF], proto TCP (6), length 52)
    127.0.0.1.11950 > 127.0.0.1.33168: Flags [.], cksum 0xfe28 (incorrect -> 0xc07d), seq 3941, ack 689, win 511, options [nop,nop,TS val 1288145050 ecr 1288145050], length 0
2022-02-28 03:23:21.125285 IP (tos 0x0, ttl 64, id 47709, offset 0, flags [DF], proto TCP (6), length 378)
    127.0.0.1.11950 > 127.0.0.1.33168: Flags [P.], cksum 0xff6e (incorrect -> 0x5162), seq 3941:4267, ack 689, win 512, options [nop,nop,TS val 1288145348 ecr 1288145050], length 326
2022-02-28 03:23:21.125298 IP (tos 0x0, ttl 64, id 55658, offset 0, flags [DF], proto TCP (6), length 52)
    127.0.0.1.33168 > 127.0.0.1.11950: Flags [.], cksum 0xfe28 (incorrect -> 0xbce4), seq 689, ack 4267, win 510, options [nop,nop,TS val 1288145348 ecr 1288145348], length 0
2022-02-28 03:23:21.125899 IP (tos 0x0, ttl 64, id 55659, offset 0, flags [DF], proto TCP (6), length 333)
    127.0.0.1.33168 > 127.0.0.1.11950: Flags [P.], cksum 0xff41 (incorrect -> 0xa9c1), seq 689:970, ack 4267, win 512, options [nop,nop,TS val 1288145349 ecr 1288145348], length 281
2022-02-28 03:23:21.125908 IP (tos 0x0, ttl 64, id 47710, offset 0, flags [DF], proto TCP (6), length 52)
    127.0.0.1.11950 > 127.0.0.1.33168: Flags [.], cksum 0xfe28 (incorrect -> 0xbbc9), seq 4267, ack 970, win 510, options [nop,nop,TS val 1288145349 ecr 1288145349], length 0
200, 3.7928850650787354, 2.861253023147583