2022-02-28 01:22:20.089100 IP (tos 0x0, ttl 64, id 53047, offset 0, flags [DF], proto TCP (6), length 60)
    127.0.0.1.55558 > 127.0.0.1.11050: Flags [S], cksum 0xfe30 (incorrect -> 0xc0dc), seq 2977484490, win 65495, options [mss 65495,sackOK,TS val 1280884312 ecr 0,nop,wscale 7], length 0
2022-02-28 01:22:20.089117 IP (tos 0x0, ttl 64, id 0, offset 0, flags [DF], proto TCP (6), length 60)
    127.0.0.1.11050 > 127.0.0.1.55558: Flags [S.], cksum 0xfe30 (incorrect -> 0x6080), seq 2795679491, ack 2977484491, win 65483, options [mss 65495,sackOK,TS val 1280884312 ecr 1280884312,nop,wscale 7], length 0
2022-02-28 01:22:20.089130 IP (tos 0x0, ttl 64, id 53048, offset 0, flags [DF], proto TCP (6), length 52)
    127.0.0.1.55558 > 127.0.0.1.11050: Flags [.], cksum 0xfe28 (incorrect -> 0x873c), seq 1, ack 1, win 512, options [nop,nop,TS val 1280884312 ecr 1280884312], length 0
2022-02-28 01:22:20.089232 IP (tos 0x0, ttl 64, id 53049, offset 0, flags [DF], proto TCP (6), length 55)
    127.0.0.1.55558 > 127.0.0.1.11050: Flags [P.], cksum 0xfe2b (incorrect -> 0x8230), seq 1:4, ack 1, win 512, options [nop,nop,TS val 1280884312 ecr 1280884312], length 3
2022-02-28 01:22:20.089236 IP (tos 0x0, ttl 64, id 15918, offset 0, flags [DF], proto TCP (6), length 52)
    127.0.0.1.11050 > 127.0.0.1.55558: Flags [.], cksum 0xfe28 (incorrect -> 0x8739), seq 1, ack 4, win 512, options [nop,nop,TS val 1280884312 ecr 1280884312], length 0
2022-02-28 01:22:20.089358 IP (tos 0x0, ttl 64, id 15919, offset 0, flags [DF], proto TCP (6), length 54)
    127.0.0.1.11050 > 127.0.0.1.55558: Flags [P.], cksum 0xfe2a (incorrect -> 0x822f), seq 1:3, ack 4, win 512, options [nop,nop,TS val 1280884312 ecr 1280884312], length 2
2022-02-28 01:22:20.089385 IP (tos 0x0, ttl 64, id 53050, offset 0, flags [DF], proto TCP (6), length 52)
    127.0.0.1.55558 > 127.0.0.1.11050: Flags [.], cksum 0xfe28 (incorrect -> 0x8737), seq 4, ack 3, win 512, options [nop,nop,TS val 1280884312 ecr 1280884312], length 0
2022-02-28 01:22:20.091172 IP (tos 0x0, ttl 64, id 53051, offset 0, flags [DF], proto TCP (6), length 62)
    127.0.0.1.55558 > 127.0.0.1.11050: Flags [P.], cksum 0xfe32 (incorrect -> 0x75df), seq 4:14, ack 3, win 512, options [nop,nop,TS val 1280884314 ecr 1280884312], length 10
2022-02-28 01:22:20.091186 IP (tos 0x0, ttl 64, id 15920, offset 0, flags [DF], proto TCP (6), length 52)
    127.0.0.1.11050 > 127.0.0.1.55558: Flags [.], cksum 0xfe28 (incorrect -> 0x8729), seq 3, ack 14, win 512, options [nop,nop,TS val 1280884314 ecr 1280884314], length 0
2022-02-28 01:22:20.157279 IP (tos 0x0, ttl 64, id 15921, offset 0, flags [DF], proto TCP (6), length 62)
    127.0.0.1.11050 > 127.0.0.1.55558: Flags [P.], cksum 0xfe32 (incorrect -> 0x81d4), seq 3:13, ack 14, win 512, options [nop,nop,TS val 1280884380 ecr 1280884314], length 10
2022-02-28 01:22:20.157288 IP (tos 0x0, ttl 64, id 53052, offset 0, flags [DF], proto TCP (6), length 52)
    127.0.0.1.55558 > 127.0.0.1.11050: Flags [.], cksum 0xfe28 (incorrect -> 0x869b), seq 14, ack 13, win 512, options [nop,nop,TS val 1280884380 ecr 1280884380], length 0
2022-02-28 01:22:20.162948 IP (tos 0x0, ttl 64, id 53053, offset 0, flags [DF], proto TCP (6), length 569)
    127.0.0.1.55558 > 127.0.0.1.11050: Flags [P.], cksum 0x002e (incorrect -> 0xa0b2), seq 14:531, ack 13, win 512, options [nop,nop,TS val 1280884386 ecr 1280884380], length 517
2022-02-28 01:22:20.162964 IP (tos 0x0, ttl 64, id 15922, offset 0, flags [DF], proto TCP (6), length 52)
    127.0.0.1.11050 > 127.0.0.1.55558: Flags [.], cksum 0xfe28 (incorrect -> 0x848e), seq 13, ack 531, win 508, options [nop,nop,TS val 1280884386 ecr 1280884386], length 0
200, 132.95704579353333, 0.28592538833618164