2022-02-28 09:00:18.570760 IP (tos 0x0, ttl 64, id 2923, offset 0, flags [DF], proto TCP (6), length 60)
    127.0.0.1.53988 > 127.0.0.1.9250: Flags [S], cksum 0xfe30 (incorrect -> 0xcadc), seq 3577766583, win 65495, options [mss 65495,sackOK,TS val 1308362794 ecr 0,nop,wscale 7], length 0
2022-02-28 09:00:18.570781 IP (tos 0x0, ttl 64, id 0, offset 0, flags [DF], proto TCP (6), length 60)
    127.0.0.1.9250 > 127.0.0.1.53988: Flags [S.], cksum 0xfe30 (incorrect -> 0x13e3), seq 2115232442, ack 3577766584, win 65483, options [mss 65495,sackOK,TS val 1308362794 ecr 1308362794,nop,wscale 7], length 0
2022-02-28 09:00:18.570795 IP (tos 0x0, ttl 64, id 2924, offset 0, flags [DF], proto TCP (6), length 52)
    127.0.0.1.53988 > 127.0.0.1.9250: Flags [.], cksum 0xfe28 (incorrect -> 0x3a9f), seq 1, ack 1, win 512, options [nop,nop,TS val 1308362794 ecr 1308362794], length 0
2022-02-28 09:00:18.570909 IP (tos 0x0, ttl 64, id 2925, offset 0, flags [DF], proto TCP (6), length 55)
    127.0.0.1.53988 > 127.0.0.1.9250: Flags [P.], cksum 0xfe2b (incorrect -> 0x3593), seq 1:4, ack 1, win 512, options [nop,nop,TS val 1308362794 ecr 1308362794], length 3
2022-02-28 09:00:18.570914 IP (tos 0x0, ttl 64, id 7485, offset 0, flags [DF], proto TCP (6), length 52)
    127.0.0.1.9250 > 127.0.0.1.53988: Flags [.], cksum 0xfe28 (incorrect -> 0x3a9c), seq 1, ack 4, win 512, options [nop,nop,TS val 1308362794 ecr 1308362794], length 0
2022-02-28 09:00:18.570994 IP (tos 0x0, ttl 64, id 7486, offset 0, flags [DF], proto TCP (6), length 54)
    127.0.0.1.9250 > 127.0.0.1.53988: Flags [P.], cksum 0xfe2a (incorrect -> 0x3592), seq 1:3, ack 4, win 512, options [nop,nop,TS val 1308362794 ecr 1308362794], length 2
2022-02-28 09:00:18.570999 IP (tos 0x0, ttl 64, id 2926, offset 0, flags [DF], proto TCP (6), length 52)
    127.0.0.1.53988 > 127.0.0.1.9250: Flags [.], cksum 0xfe28 (incorrect -> 0x3a9a), seq 4, ack 3, win 512, options [nop,nop,TS val 1308362794 ecr 1308362794], length 0
2022-02-28 09:00:18.582532 IP (tos 0x0, ttl 64, id 2927, offset 0, flags [DF], proto TCP (6), length 62)
    127.0.0.1.53988 > 127.0.0.1.9250: Flags [P.], cksum 0xfe32 (incorrect -> 0xc81f), seq 4:14, ack 3, win 512, options [nop,nop,TS val 1308362806 ecr 1308362794], length 10
2022-02-28 09:00:18.582552 IP (tos 0x0, ttl 64, id 7487, offset 0, flags [DF], proto TCP (6), length 52)
    127.0.0.1.9250 > 127.0.0.1.53988: Flags [.], cksum 0xfe28 (incorrect -> 0x3a78), seq 3, ack 14, win 512, options [nop,nop,TS val 1308362806 ecr 1308362806], length 0
200, 10.827463865280151, 0.8246212005615234