2022-02-28 13:33:45.906353 IP (tos 0x0, ttl 64, id 25797, offset 0, flags [DF], proto TCP (6), length 60)
    127.0.0.1.46710 > 127.0.0.1.10250: Flags [S], cksum 0xfe30 (incorrect -> 0x5f02), seq 666318976, win 65495, options [mss 65495,sackOK,TS val 1324770129 ecr 0,nop,wscale 7], length 0
2022-02-28 13:33:45.906363 IP (tos 0x0, ttl 64, id 0, offset 0, flags [DF], proto TCP (6), length 60)
    127.0.0.1.10250 > 127.0.0.1.46710: Flags [S.], cksum 0xfe30 (incorrect -> 0x23cd), seq 3892224233, ack 666318977, win 65483, options [mss 65495,sackOK,TS val 1324770129 ecr 1324770129,nop,wscale 7], length 0
2022-02-28 13:33:45.906372 IP (tos 0x0, ttl 64, id 25798, offset 0, flags [DF], proto TCP (6), length 52)
    127.0.0.1.46710 > 127.0.0.1.10250: Flags [.], cksum 0xfe28 (incorrect -> 0x4a89), seq 1, ack 1, win 512, options [nop,nop,TS val 1324770129 ecr 1324770129], length 0
2022-02-28 13:33:45.906476 IP (tos 0x0, ttl 64, id 25799, offset 0, flags [DF], proto TCP (6), length 55)
    127.0.0.1.46710 > 127.0.0.1.10250: Flags [P.], cksum 0xfe2b (incorrect -> 0x457c), seq 1:4, ack 1, win 512, options [nop,nop,TS val 1324770130 ecr 1324770129], length 3
2022-02-28 13:33:45.906488 IP (tos 0x0, ttl 64, id 2267, offset 0, flags [DF], proto TCP (6), length 52)
    127.0.0.1.10250 > 127.0.0.1.46710: Flags [.], cksum 0xfe28 (incorrect -> 0x4a84), seq 1, ack 4, win 512, options [nop,nop,TS val 1324770130 ecr 1324770130], length 0
2022-02-28 13:33:45.906516 IP (tos 0x0, ttl 64, id 2268, offset 0, flags [DF], proto TCP (6), length 54)
    127.0.0.1.10250 > 127.0.0.1.46710: Flags [P.], cksum 0xfe2a (incorrect -> 0x457a), seq 1:3, ack 4, win 512, options [nop,nop,TS val 1324770130 ecr 1324770130], length 2
2022-02-28 13:33:45.906529 IP (tos 0x0, ttl 64, id 25800, offset 0, flags [DF], proto TCP (6), length 52)
    127.0.0.1.46710 > 127.0.0.1.10250: Flags [.], cksum 0xfe28 (incorrect -> 0x4a82), seq 4, ack 3, win 512, options [nop,nop,TS val 1324770130 ecr 1324770130], length 0
2022-02-28 13:33:45.907924 IP (tos 0x0, ttl 64, id 25801, offset 0, flags [DF], proto TCP (6), length 62)
    127.0.0.1.46710 > 127.0.0.1.10250: Flags [P.], cksum 0xfe32 (incorrect -> 0xcfd4), seq 4:14, ack 3, win 512, options [nop,nop,TS val 1324770131 ecr 1324770130], length 10
2022-02-28 13:33:45.907941 IP (tos 0x0, ttl 64, id 2269, offset 0, flags [DF], proto TCP (6), length 52)
    127.0.0.1.10250 > 127.0.0.1.46710: Flags [.], cksum 0xfe28 (incorrect -> 0x4a76), seq 3, ack 14, win 512, options [nop,nop,TS val 1324770131 ecr 1324770131], length 0
2022-02-28 13:33:45.998010 IP (tos 0x0, ttl 64, id 2270, offset 0, flags [DF], proto TCP (6), length 62)
    127.0.0.1.10250 > 127.0.0.1.46710: Flags [P.], cksum 0xfe32 (incorrect -> 0x4509), seq 3:13, ack 14, win 512, options [nop,nop,TS val 1324770221 ecr 1324770131], length 10
2022-02-28 13:33:45.998021 IP (tos 0x0, ttl 64, id 25802, offset 0, flags [DF], proto TCP (6), length 52)
    127.0.0.1.46710 > 127.0.0.1.10250: Flags [.], cksum 0xfe28 (incorrect -> 0x49b8), seq 14, ack 13, win 512, options [nop,nop,TS val 1324770221 ecr 1324770221], length 0
2022-02-28 13:33:46.003929 IP (tos 0x0, ttl 64, id 25803, offset 0, flags [DF], proto TCP (6), length 569)
    127.0.0.1.46710 > 127.0.0.1.10250: Flags [P.], cksum 0x002e (incorrect -> 0x98bb), seq 14:531, ack 13, win 512, options [nop,nop,TS val 1324770227 ecr 1324770221], length 517
2022-02-28 13:33:46.003940 IP (tos 0x0, ttl 64, id 2271, offset 0, flags [DF], proto TCP (6), length 52)
    127.0.0.1.10250 > 127.0.0.1.46710: Flags [.], cksum 0xfe28 (incorrect -> 0x47ab), seq 13, ack 531, win 508, options [nop,nop,TS val 1324770227 ecr 1324770227], length 0
2022-02-28 13:33:46.093416 IP (tos 0x0, ttl 64, id 2272, offset 0, flags [DF], proto TCP (6), length 3538)
    127.0.0.1.10250 > 127.0.0.1.46710: Flags [P.], cksum 0x0bc7 (incorrect -> 0x806d), seq 13:3499, ack 531, win 512, options [nop,nop,TS val 1324770316 ecr 1324770227], length 3486
2022-02-28 13:33:46.093428 IP (tos 0x0, ttl 64, id 25804, offset 0, flags [DF], proto TCP (6), length 52)
    127.0.0.1.46710 > 127.0.0.1.10250: Flags [.], cksum 0xfe28 (incorrect -> 0x3969), seq 531, ack 3499, win 494, options [nop,nop,TS val 1324770316 ecr 1324770316], length 0
2022-02-28 13:33:46.121559 IP (tos 0x0, ttl 64, id 2273, offset 0, flags [DF], proto TCP (6), length 2134)
    127.0.0.1.10250 > 127.0.0.1.46710: Flags [P.], cksum 0x064b (incorrect -> 0x8121), seq 3499:5581, ack 531, win 512, options [nop,nop,TS val 1324770345 ecr 1324770316], length 2082
2022-02-28 13:33:46.121567 IP (tos 0x0, ttl 64, id 25805, offset 0, flags [DF], proto TCP (6), length 52)
    127.0.0.1.46710 > 127.0.0.1.10250: Flags [.], cksum 0xfe28 (incorrect -> 0x3108), seq 531, ack 5581, win 499, options [nop,nop,TS val 1324770345 ecr 1324770345], length 0
2022-02-28 13:33:46.121944 IP (tos 0x0, ttl 64, id 25806, offset 0, flags [DF], proto TCP (6), length 116)
    127.0.0.1.46710 > 127.0.0.1.10250: Flags [P.], cksum 0xfe68 (incorrect -> 0x90d5), seq 531:595, ack 5581, win 512, options [nop,nop,TS val 1324770345 ecr 1324770345], length 64
2022-02-28 13:33:46.121954 IP (tos 0x0, ttl 64, id 2274, offset 0, flags [DF], proto TCP (6), length 52)
    127.0.0.1.10250 > 127.0.0.1.46710: Flags [.], cksum 0xfe28 (incorrect -> 0x30bb), seq 5581, ack 595, win 512, options [nop,nop,TS val 1324770345 ecr 1324770345], length 0
2022-02-28 13:33:46.122339 IP (tos 0x0, ttl 64, id 25807, offset 0, flags [DF], proto TCP (6), length 341)
    127.0.0.1.46710 > 127.0.0.1.10250: Flags [P.], cksum 0xff49 (incorrect -> 0x42c2), seq 595:884, ack 5581, win 512, options [nop,nop,TS val 1324770345 ecr 1324770345], length 289
2022-02-28 13:33:46.122349 IP (tos 0x0, ttl 64, id 2275, offset 0, flags [DF], proto TCP (6), length 52)
    127.0.0.1.10250 > 127.0.0.1.46710: Flags [.], cksum 0xfe28 (incorrect -> 0x2f9c), seq 5581, ack 884, win 510, options [nop,nop,TS val 1324770345 ecr 1324770345], length 0
2022-02-28 13:33:46.294072 IP (tos 0x0, ttl 64, id 2276, offset 0, flags [DF], proto TCP (6), length 3538)
    127.0.0.1.10250 > 127.0.0.1.46710: Flags [P.], cksum 0x0bc7 (incorrect -> 0x9083), seq 5581:9067, ack 884, win 512, options [nop,nop,TS val 1324770517 ecr 1324770345], length 3486
2022-02-28 13:33:46.294083 IP (tos 0x0, ttl 64, id 25808, offset 0, flags [DF], proto TCP (6), length 52)
    127.0.0.1.46710 > 127.0.0.1.10250: Flags [.], cksum 0xfe28 (incorrect -> 0x20b6), seq 884, ack 9067, win 494, options [nop,nop,TS val 1324770517 ecr 1324770517], length 0
2022-02-28 13:33:46.301930 IP (tos 0x0, ttl 64, id 2277, offset 0, flags [DF], proto TCP (6), length 4100)
    127.0.0.1.10250 > 127.0.0.1.46710: Flags [P.], cksum 0x0df9 (incorrect -> 0xecfc), seq 9067:13115, ack 884, win 512, options [nop,nop,TS val 1324770525 ecr 1324770517], length 4048
2022-02-28 13:33:46.301941 IP (tos 0x0, ttl 64, id 25809, offset 0, flags [DF], proto TCP (6), length 52)
    127.0.0.1.46710 > 127.0.0.1.10250: Flags [.], cksum 0xfe28 (incorrect -> 0x10d8), seq 884, ack 13115, win 492, options [nop,nop,TS val 1324770525 ecr 1324770525], length 0
2022-02-28 13:33:46.301950 IP (tos 0x0, ttl 64, id 2278, offset 0, flags [DF], proto TCP (6), length 486)
    127.0.0.1.10250 > 127.0.0.1.46710: Flags [P.], cksum 0xffda (incorrect -> 0x27dc), seq 13115:13549, ack 884, win 512, options [nop,nop,TS val 1324770525 ecr 1324770525], length 434
2022-02-28 13:33:46.301955 IP (tos 0x0, ttl 64, id 25810, offset 0, flags [DF], proto TCP (6), length 52)
    127.0.0.1.46710 > 127.0.0.1.10250: Flags [.], cksum 0xfe28 (incorrect -> 0x0f28), seq 884, ack 13549, win 490, options [nop,nop,TS val 1324770525 ecr 1324770525], length 0
2022-02-28 13:33:46.317356 IP (tos 0x0, ttl 64, id 2279, offset 0, flags [DF], proto TCP (6), length 3538)
    127.0.0.1.10250 > 127.0.0.1.46710: Flags [P.], cksum 0x0bc7 (incorrect -> 0x163b), seq 13549:17035, ack 884, win 512, options [nop,nop,TS val 1324770540 ecr 1324770525], length 3486
2022-02-28 13:33:46.317365 IP (tos 0x0, ttl 64, id 25811, offset 0, flags [DF], proto TCP (6), length 52)
    127.0.0.1.46710 > 127.0.0.1.10250: Flags [.], cksum 0xfe28 (incorrect -> 0x0168), seq 884, ack 17035, win 494, options [nop,nop,TS val 1324770540 ecr 1324770540], length 0
2022-02-28 13:33:46.322978 IP (tos 0x0, ttl 64, id 2280, offset 0, flags [DF], proto TCP (6), length 3496)
    127.0.0.1.10250 > 127.0.0.1.46710: Flags [P.], cksum 0x0b9d (incorrect -> 0x215a), seq 17035:20479, ack 884, win 512, options [nop,nop,TS val 1324770546 ecr 1324770540], length 3444
2022-02-28 13:33:46.322986 IP (tos 0x0, ttl 64, id 25812, offset 0, flags [DF], proto TCP (6), length 52)
    127.0.0.1.46710 > 127.0.0.1.10250: Flags [.], cksum 0xfe28 (incorrect -> 0xf3e7), seq 884, ack 20479, win 494, options [nop,nop,TS val 1324770546 ecr 1324770546], length 0
2022-02-28 13:33:46.323203 IP (tos 0x0, ttl 64, id 2281, offset 0, flags [DF], proto TCP (6), length 4036)
    127.0.0.1.10250 > 127.0.0.1.46710: Flags [P.], cksum 0x0db9 (incorrect -> 0xd05e), seq 20479:24463, ack 884, win 512, options [nop,nop,TS val 1324770546 ecr 1324770546], length 3984
2022-02-28 13:33:46.323211 IP (tos 0x0, ttl 64, id 25813, offset 0, flags [DF], proto TCP (6), length 52)
    127.0.0.1.46710 > 127.0.0.1.10250: Flags [.], cksum 0xfe28 (incorrect -> 0xe459), seq 884, ack 24463, win 492, options [nop,nop,TS val 1324770546 ecr 1324770546], length 0
2022-02-28 13:33:46.323256 IP (tos 0x0, ttl 64, id 2282, offset 0, flags [DF], proto TCP (6), length 4100)
    127.0.0.1.10250 > 127.0.0.1.46710: Flags [P.], cksum 0x0df9 (incorrect -> 0xb9a5), seq 24463:28511, ack 884, win 512, options [nop,nop,TS val 1324770546 ecr 1324770546], length 4048
2022-02-28 13:33:46.323261 IP (tos 0x0, ttl 64, id 25814, offset 0, flags [DF], proto TCP (6), length 52)
    127.0.0.1.46710 > 127.0.0.1.10250: Flags [.], cksum 0xfe28 (incorrect -> 0xd499), seq 884, ack 28511, win 476, options [nop,nop,TS val 1324770546 ecr 1324770546], length 0
2022-02-28 13:33:46.323267 IP (tos 0x0, ttl 64, id 2283, offset 0, flags [DF], proto TCP (6), length 714)
    127.0.0.1.10250 > 127.0.0.1.46710: Flags [P.], cksum 0x00bf (incorrect -> 0x4923), seq 28511:29173, ack 884, win 512, options [nop,nop,TS val 1324770546 ecr 1324770546], length 662
2022-02-28 13:33:46.323271 IP (tos 0x0, ttl 64, id 25815, offset 0, flags [DF], proto TCP (6), length 52)
    127.0.0.1.46710 > 127.0.0.1.10250: Flags [.], cksum 0xfe28 (incorrect -> 0xd205), seq 884, ack 29173, win 474, options [nop,nop,TS val 1324770546 ecr 1324770546], length 0
2022-02-28 13:33:46.323297 IP (tos 0x0, ttl 64, id 2284, offset 0, flags [DF], proto TCP (6), length 3538)
    127.0.0.1.10250 > 127.0.0.1.46710: Flags [P.], cksum 0x0bc7 (incorrect -> 0x10fa), seq 29173:32659, ack 884, win 512, options [nop,nop,TS val 1324770546 ecr 1324770546], length 3486
2022-02-28 13:33:46.324528 IP (tos 0x0, ttl 64, id 25816, offset 0, flags [DF], proto TCP (6), length 52)
    127.0.0.1.46710 > 127.0.0.1.10250: Flags [.], cksum 0xfe28 (incorrect -> 0xc43f), seq 884, ack 32659, win 512, options [nop,nop,TS val 1324770548 ecr 1324770546], length 0
2022-02-28 13:33:46.329773 IP (tos 0x0, ttl 64, id 2285, offset 0, flags [DF], proto TCP (6), length 4100)
    127.0.0.1.10250 > 127.0.0.1.46710: Flags [P.], cksum 0x0df9 (incorrect -> 0x16d8), seq 32659:36707, ack 884, win 512, options [nop,nop,TS val 1324770553 ecr 1324770548], length 4048
2022-02-28 13:33:46.352741 IP (tos 0x0, ttl 64, id 2286, offset 0, flags [DF], proto TCP (6), length 32820)
    127.0.0.1.10250 > 127.0.0.1.46710: Flags [.], cksum 0x7e29 (incorrect -> 0xfd2a), seq 36707:69475, ack 884, win 512, options [nop,nop,TS val 1324770576 ecr 1324770548], length 32768
2022-02-28 13:33:46.352762 IP (tos 0x0, ttl 64, id 25817, offset 0, flags [DF], proto TCP (6), length 52)
    127.0.0.1.46710 > 127.0.0.1.10250: Flags [.], cksum 0xfe28 (incorrect -> 0x34d1), seq 884, ack 69475, win 379, options [nop,nop,TS val 1324770576 ecr 1324770553], length 0
2022-02-28 13:33:46.352769 IP (tos 0x0, ttl 64, id 2287, offset 0, flags [DF], proto TCP (6), length 3112)
    127.0.0.1.10250 > 127.0.0.1.46710: Flags [P.], cksum 0x0a1d (incorrect -> 0x8a1d), seq 69475:72535, ack 884, win 512, options [nop,nop,TS val 1324770576 ecr 1324770576], length 3060
2022-02-28 13:33:46.354186 IP (tos 0x0, ttl 64, id 25818, offset 0, flags [DF], proto TCP (6), length 52)
    127.0.0.1.46710 > 127.0.0.1.10250: Flags [.], cksum 0xfe28 (incorrect -> 0x2840), seq 884, ack 72535, win 512, options [nop,nop,TS val 1324770577 ecr 1324770576], length 0
2022-02-28 13:33:46.357967 IP (tos 0x0, ttl 64, id 2288, offset 0, flags [DF], proto TCP (6), length 4100)
    127.0.0.1.10250 > 127.0.0.1.46710: Flags [P.], cksum 0x0df9 (incorrect -> 0x7e3c), seq 72535:76583, ack 884, win 512, options [nop,nop,TS val 1324770581 ecr 1324770577], length 4048
2022-02-28 13:33:46.357990 IP (tos 0x0, ttl 64, id 25819, offset 0, flags [DF], proto TCP (6), length 52)
    127.0.0.1.46710 > 127.0.0.1.10250: Flags [.], cksum 0xfe28 (incorrect -> 0x1867), seq 884, ack 76583, win 512, options [nop,nop,TS val 1324770581 ecr 1324770581], length 0
2022-02-28 13:33:46.357996 IP (tos 0x0, ttl 64, id 2289, offset 0, flags [DF], proto TCP (6), length 3150)
    127.0.0.1.10250 > 127.0.0.1.46710: Flags [P.], cksum 0x0a43 (incorrect -> 0x4baf), seq 76583:79681, ack 884, win 512, options [nop,nop,TS val 1324770581 ecr 1324770581], length 3098
2022-02-28 13:33:46.358002 IP (tos 0x0, ttl 64, id 25820, offset 0, flags [DF], proto TCP (6), length 52)
    127.0.0.1.46710 > 127.0.0.1.10250: Flags [.], cksum 0xfe28 (incorrect -> 0x0c4d), seq 884, ack 79681, win 512, options [nop,nop,TS val 1324770581 ecr 1324770581], length 0
2022-02-28 13:33:46.358106 IP (tos 0x0, ttl 64, id 2290, offset 0, flags [DF], proto TCP (6), length 4100)
    127.0.0.1.10250 > 127.0.0.1.46710: Flags [P.], cksum 0x0df9 (incorrect -> 0x3cef), seq 79681:83729, ack 884, win 512, options [nop,nop,TS val 1324770581 ecr 1324770581], length 4048
2022-02-28 13:33:46.358156 IP (tos 0x0, ttl 64, id 25821, offset 0, flags [DF], proto TCP (6), length 52)
    127.0.0.1.46710 > 127.0.0.1.10250: Flags [.], cksum 0xfe28 (incorrect -> 0xfc7c), seq 884, ack 83729, win 512, options [nop,nop,TS val 1324770581 ecr 1324770581], length 0
2022-02-28 13:33:46.358163 IP (tos 0x0, ttl 64, id 2291, offset 0, flags [DF], proto TCP (6), length 4286)
    127.0.0.1.10250 > 127.0.0.1.46710: Flags [P.], cksum 0x0eb3 (incorrect -> 0x93d1), seq 83729:87963, ack 884, win 512, options [nop,nop,TS val 1324770581 ecr 1324770581], length 4234
2022-02-28 13:33:46.358443 IP (tos 0x0, ttl 64, id 25822, offset 0, flags [DF], proto TCP (6), length 52)
    127.0.0.1.46710 > 127.0.0.1.10250: Flags [.], cksum 0xfe28 (incorrect -> 0xebf1), seq 884, ack 87963, win 512, options [nop,nop,TS val 1324770582 ecr 1324770581], length 0
2022-02-28 13:33:46.374187 IP (tos 0x0, ttl 64, id 2292, offset 0, flags [DF], proto TCP (6), length 4100)
    127.0.0.1.10250 > 127.0.0.1.46710: Flags [P.], cksum 0x0df9 (incorrect -> 0xd12f), seq 87963:92011, ack 884, win 512, options [nop,nop,TS val 1324770597 ecr 1324770582], length 4048
2022-02-28 13:33:46.374325 IP (tos 0x0, ttl 64, id 25823, offset 0, flags [DF], proto TCP (6), length 52)
    127.0.0.1.46710 > 127.0.0.1.10250: Flags [.], cksum 0xfe28 (incorrect -> 0xdc02), seq 884, ack 92011, win 512, options [nop,nop,TS val 1324770597 ecr 1324770597], length 0
2022-02-28 13:33:46.374338 IP (tos 0x0, ttl 64, id 2293, offset 0, flags [DF], proto TCP (6), length 6886)
    127.0.0.1.10250 > 127.0.0.1.46710: Flags [P.], cksum 0x18db (incorrect -> 0x6857), seq 92011:98845, ack 884, win 512, options [nop,nop,TS val 1324770597 ecr 1324770597], length 6834
2022-02-28 13:33:46.374350 IP (tos 0x0, ttl 64, id 25824, offset 0, flags [DF], proto TCP (6), length 52)
    127.0.0.1.46710 > 127.0.0.1.10250: Flags [.], cksum 0xfe28 (incorrect -> 0xc150), seq 884, ack 98845, win 512, options [nop,nop,TS val 1324770597 ecr 1324770597], length 0
2022-02-28 13:33:46.380760 IP (tos 0x0, ttl 64, id 2294, offset 0, flags [DF], proto TCP (6), length 550)
    127.0.0.1.10250 > 127.0.0.1.46710: Flags [P.], cksum 0x001b (incorrect -> 0x82f0), seq 98845:99343, ack 884, win 512, options [nop,nop,TS val 1324770604 ecr 1324770597], length 498
2022-02-28 13:33:46.380783 IP (tos 0x0, ttl 64, id 25825, offset 0, flags [DF], proto TCP (6), length 52)
    127.0.0.1.46710 > 127.0.0.1.10250: Flags [.], cksum 0xfe28 (incorrect -> 0xbf50), seq 884, ack 99343, win 512, options [nop,nop,TS val 1324770604 ecr 1324770604], length 0
2022-02-28 13:33:46.380816 IP (tos 0x0, ttl 64, id 2295, offset 0, flags [DF], proto TCP (6), length 3538)
    127.0.0.1.10250 > 127.0.0.1.46710: Flags [P.], cksum 0x0bc7 (incorrect -> 0xee8e), seq 99343:102829, ack 884, win 512, options [nop,nop,TS val 1324770604 ecr 1324770604], length 3486
2022-02-28 13:33:46.380831 IP (tos 0x0, ttl 64, id 25826, offset 0, flags [DF], proto TCP (6), length 52)
    127.0.0.1.46710 > 127.0.0.1.10250: Flags [.], cksum 0xfe28 (incorrect -> 0xb1b2), seq 884, ack 102829, win 512, options [nop,nop,TS val 1324770604 ecr 1324770604], length 0
2022-02-28 13:33:46.380903 IP (tos 0x0, ttl 64, id 2296, offset 0, flags [DF], proto TCP (6), length 4100)
    127.0.0.1.10250 > 127.0.0.1.46710: Flags [P.], cksum 0x0df9 (incorrect -> 0x185f), seq 102829:106877, ack 884, win 512, options [nop,nop,TS val 1324770604 ecr 1324770604], length 4048
2022-02-28 13:33:46.381473 IP (tos 0x0, ttl 64, id 25827, offset 0, flags [DF], proto TCP (6), length 52)
    127.0.0.1.46710 > 127.0.0.1.10250: Flags [.], cksum 0xfe28 (incorrect -> 0xa1e1), seq 884, ack 106877, win 512, options [nop,nop,TS val 1324770605 ecr 1324770604], length 0
2022-02-28 13:33:46.381482 IP (tos 0x0, ttl 64, id 2297, offset 0, flags [DF], proto TCP (6), length 11682)
    127.0.0.1.10250 > 127.0.0.1.46710: Flags [P.], cksum 0x2b97 (incorrect -> 0x8874), seq 106877:118507, ack 884, win 512, options [nop,nop,TS val 1324770605 ecr 1324770605], length 11630
2022-02-28 13:33:46.381488 IP (tos 0x0, ttl 64, id 25828, offset 0, flags [DF], proto TCP (6), length 52)
    127.0.0.1.46710 > 127.0.0.1.10250: Flags [.], cksum 0xfe28 (incorrect -> 0x7472), seq 884, ack 118507, win 512, options [nop,nop,TS val 1324770605 ecr 1324770605], length 0
200, 5.035504341125488, 0.5088257789611816