2022-02-28 08:00:51.431790 IP (tos 0x0, ttl 64, id 41141, offset 0, flags [DF], proto TCP (6), length 60)
    127.0.0.1.46484 > 127.0.0.1.11750: Flags [S], cksum 0xfe30 (incorrect -> 0xac08), seq 1129026918, win 65495, options [mss 65495,sackOK,TS val 1304795655 ecr 0,nop,wscale 7], length 0
2022-02-28 08:00:51.431810 IP (tos 0x0, ttl 64, id 0, offset 0, flags [DF], proto TCP (6), length 60)
    127.0.0.1.11750 > 127.0.0.1.46484: Flags [S.], cksum 0xfe30 (incorrect -> 0xd013), seq 19395323, ack 1129026919, win 65483, options [mss 65495,sackOK,TS val 1304795655 ecr 1304795655,nop,wscale 7], length 0
2022-02-28 08:00:51.431824 IP (tos 0x0, ttl 64, id 41142, offset 0, flags [DF], proto TCP (6), length 52)
    127.0.0.1.46484 > 127.0.0.1.11750: Flags [.], cksum 0xfe28 (incorrect -> 0xf6cf), seq 1, ack 1, win 512, options [nop,nop,TS val 1304795655 ecr 1304795655], length 0
2022-02-28 08:00:51.431995 IP (tos 0x0, ttl 64, id 41143, offset 0, flags [DF], proto TCP (6), length 55)
    127.0.0.1.46484 > 127.0.0.1.11750: Flags [P.], cksum 0xfe2b (incorrect -> 0xf1c3), seq 1:4, ack 1, win 512, options [nop,nop,TS val 1304795655 ecr 1304795655], length 3
2022-02-28 08:00:51.432002 IP (tos 0x0, ttl 64, id 61544, offset 0, flags [DF], proto TCP (6), length 52)
    127.0.0.1.11750 > 127.0.0.1.46484: Flags [.], cksum 0xfe28 (incorrect -> 0xf6cc), seq 1, ack 4, win 512, options [nop,nop,TS val 1304795655 ecr 1304795655], length 0
2022-02-28 08:00:51.432032 IP (tos 0x0, ttl 64, id 61545, offset 0, flags [DF], proto TCP (6), length 54)
    127.0.0.1.11750 > 127.0.0.1.46484: Flags [P.], cksum 0xfe2a (incorrect -> 0xf1c2), seq 1:3, ack 4, win 512, options [nop,nop,TS val 1304795655 ecr 1304795655], length 2
2022-02-28 08:00:51.432039 IP (tos 0x0, ttl 64, id 41144, offset 0, flags [DF], proto TCP (6), length 52)
    127.0.0.1.46484 > 127.0.0.1.11750: Flags [.], cksum 0xfe28 (incorrect -> 0xf6ca), seq 4, ack 3, win 512, options [nop,nop,TS val 1304795655 ecr 1304795655], length 0
2022-02-28 08:00:51.433312 IP (tos 0x0, ttl 64, id 41145, offset 0, flags [DF], proto TCP (6), length 62)
    127.0.0.1.46484 > 127.0.0.1.11750: Flags [P.], cksum 0xfe32 (incorrect -> 0x7bd8), seq 4:14, ack 3, win 512, options [nop,nop,TS val 1304795656 ecr 1304795655], length 10
2022-02-28 08:00:51.433331 IP (tos 0x0, ttl 64, id 61546, offset 0, flags [DF], proto TCP (6), length 52)
    127.0.0.1.11750 > 127.0.0.1.46484: Flags [.], cksum 0xfe28 (incorrect -> 0xf6be), seq 3, ack 14, win 512, options [nop,nop,TS val 1304795656 ecr 1304795656], length 0
2022-02-28 08:00:51.647617 IP (tos 0x0, ttl 64, id 61547, offset 0, flags [DF], proto TCP (6), length 62)
    127.0.0.1.11750 > 127.0.0.1.46484: Flags [P.], cksum 0xfe32 (incorrect -> 0xf0d4), seq 3:13, ack 14, win 512, options [nop,nop,TS val 1304795871 ecr 1304795656], length 10
2022-02-28 08:00:51.647634 IP (tos 0x0, ttl 64, id 41146, offset 0, flags [DF], proto TCP (6), length 52)
    127.0.0.1.46484 > 127.0.0.1.11750: Flags [.], cksum 0xfe28 (incorrect -> 0xf506), seq 14, ack 13, win 512, options [nop,nop,TS val 1304795871 ecr 1304795871], length 0
2022-02-28 08:00:51.653319 IP (tos 0x0, ttl 64, id 41147, offset 0, flags [DF], proto TCP (6), length 569)
    127.0.0.1.46484 > 127.0.0.1.11750: Flags [P.], cksum 0x002e (incorrect -> 0xf862), seq 14:531, ack 13, win 512, options [nop,nop,TS val 1304795876 ecr 1304795871], length 517
2022-02-28 08:00:51.653328 IP (tos 0x0, ttl 64, id 61548, offset 0, flags [DF], proto TCP (6), length 52)
    127.0.0.1.11750 > 127.0.0.1.46484: Flags [.], cksum 0xfe28 (incorrect -> 0xf2fb), seq 13, ack 531, win 508, options [nop,nop,TS val 1304795876 ecr 1304795876], length 0
2022-02-28 08:00:51.899813 IP (tos 0x0, ttl 64, id 61549, offset 0, flags [DF], proto TCP (6), length 3263)
    127.0.0.1.11750 > 127.0.0.1.46484: Flags [P.], cksum 0x0ab4 (incorrect -> 0x75e9), seq 13:3224, ack 531, win 512, options [nop,nop,TS val 1304796123 ecr 1304795876], length 3211
2022-02-28 08:00:51.899827 IP (tos 0x0, ttl 64, id 41148, offset 0, flags [DF], proto TCP (6), length 52)
    127.0.0.1.46484 > 127.0.0.1.11750: Flags [.], cksum 0xfe28 (incorrect -> 0xe48f), seq 531, ack 3224, win 495, options [nop,nop,TS val 1304796123 ecr 1304796123], length 0
2022-02-28 08:00:51.900329 IP (tos 0x0, ttl 64, id 41149, offset 0, flags [DF], proto TCP (6), length 145)
    127.0.0.1.46484 > 127.0.0.1.11750: Flags [P.], cksum 0xfe85 (incorrect -> 0xa932), seq 531:624, ack 3224, win 512, options [nop,nop,TS val 1304796123 ecr 1304796123], length 93
2022-02-28 08:00:51.900337 IP (tos 0x0, ttl 64, id 61550, offset 0, flags [DF], proto TCP (6), length 52)
    127.0.0.1.11750 > 127.0.0.1.46484: Flags [.], cksum 0xfe28 (incorrect -> 0xe421), seq 3224, ack 624, win 512, options [nop,nop,TS val 1304796123 ecr 1304796123], length 0
2022-02-28 08:00:52.122545 IP (tos 0x0, ttl 64, id 61551, offset 0, flags [DF], proto TCP (6), length 310)
    127.0.0.1.11750 > 127.0.0.1.46484: Flags [P.], cksum 0xff2a (incorrect -> 0x0f43), seq 3224:3482, ack 624, win 512, options [nop,nop,TS val 1304796346 ecr 1304796123], length 258
2022-02-28 08:00:52.122558 IP (tos 0x0, ttl 64, id 41150, offset 0, flags [DF], proto TCP (6), length 52)
    127.0.0.1.46484 > 127.0.0.1.11750: Flags [.], cksum 0xfe28 (incorrect -> 0xe163), seq 624, ack 3482, win 510, options [nop,nop,TS val 1304796346 ecr 1304796346], length 0
2022-02-28 08:00:52.122999 IP (tos 0x0, ttl 64, id 41151, offset 0, flags [DF], proto TCP (6), length 372)
    127.0.0.1.46484 > 127.0.0.1.11750: Flags [P.], cksum 0xff68 (incorrect -> 0xe9a3), seq 624:944, ack 3482, win 512, options [nop,nop,TS val 1304796346 ecr 1304796346], length 320
2022-02-28 08:00:52.123007 IP (tos 0x0, ttl 64, id 61552, offset 0, flags [DF], proto TCP (6), length 52)
    127.0.0.1.11750 > 127.0.0.1.46484: Flags [.], cksum 0xfe28 (incorrect -> 0xe023), seq 3482, ack 944, win 510, options [nop,nop,TS val 1304796346 ecr 1304796346], length 0
2022-02-28 08:00:52.374929 IP (tos 0x0, ttl 64, id 61553, offset 0, flags [DF], proto TCP (6), length 220)
    127.0.0.1.11750 > 127.0.0.1.46484: Flags [P.], cksum 0xfed0 (incorrect -> 0xee83), seq 3482:3650, ack 944, win 512, options [nop,nop,TS val 1304796598 ecr 1304796346], length 168
2022-02-28 08:00:52.376785 IP (tos 0x0, ttl 64, id 28917, offset 0, flags [DF], proto TCP (6), length 60)
    127.0.0.1.46486 > 127.0.0.1.11750: Flags [S], cksum 0xfe30 (incorrect -> 0xf5c2), seq 2610950052, win 65495, options [mss 65495,sackOK,TS val 1304796600 ecr 0,nop,wscale 7], length 0
2022-02-28 08:00:52.376795 IP (tos 0x0, ttl 64, id 0, offset 0, flags [DF], proto TCP (6), length 60)
    127.0.0.1.11750 > 127.0.0.1.46486: Flags [S.], cksum 0xfe30 (incorrect -> 0xb977), seq 4058537695, ack 2610950053, win 65483, options [mss 65495,sackOK,TS val 1304796600 ecr 1304796600,nop,wscale 7], length 0
2022-02-28 08:00:52.376803 IP (tos 0x0, ttl 64, id 28918, offset 0, flags [DF], proto TCP (6), length 52)
    127.0.0.1.46486 > 127.0.0.1.11750: Flags [.], cksum 0xfe28 (incorrect -> 0xe033), seq 1, ack 1, win 512, options [nop,nop,TS val 1304796600 ecr 1304796600], length 0
2022-02-28 08:00:52.376884 IP (tos 0x0, ttl 64, id 28919, offset 0, flags [DF], proto TCP (6), length 55)
    127.0.0.1.46486 > 127.0.0.1.11750: Flags [P.], cksum 0xfe2b (incorrect -> 0xdb27), seq 1:4, ack 1, win 512, options [nop,nop,TS val 1304796600 ecr 1304796600], length 3
2022-02-28 08:00:52.376889 IP (tos 0x0, ttl 64, id 37527, offset 0, flags [DF], proto TCP (6), length 52)
    127.0.0.1.11750 > 127.0.0.1.46486: Flags [.], cksum 0xfe28 (incorrect -> 0xe030), seq 1, ack 4, win 512, options [nop,nop,TS val 1304796600 ecr 1304796600], length 0
2022-02-28 08:00:52.376906 IP (tos 0x0, ttl 64, id 37528, offset 0, flags [DF], proto TCP (6), length 54)
    127.0.0.1.11750 > 127.0.0.1.46486: Flags [P.], cksum 0xfe2a (incorrect -> 0xdb26), seq 1:3, ack 4, win 512, options [nop,nop,TS val 1304796600 ecr 1304796600], length 2
2022-02-28 08:00:52.376912 IP (tos 0x0, ttl 64, id 28920, offset 0, flags [DF], proto TCP (6), length 52)
    127.0.0.1.46486 > 127.0.0.1.11750: Flags [.], cksum 0xfe28 (incorrect -> 0xe02e), seq 4, ack 3, win 512, options [nop,nop,TS val 1304796600 ecr 1304796600], length 0
2022-02-28 08:00:52.377800 IP (tos 0x0, ttl 64, id 28921, offset 0, flags [DF], proto TCP (6), length 62)
    127.0.0.1.46486 > 127.0.0.1.11750: Flags [P.], cksum 0xfe32 (incorrect -> 0x6d48), seq 4:14, ack 3, win 512, options [nop,nop,TS val 1304796601 ecr 1304796600], length 10
2022-02-28 08:00:52.377806 IP (tos 0x0, ttl 64, id 37529, offset 0, flags [DF], proto TCP (6), length 52)
    127.0.0.1.11750 > 127.0.0.1.46486: Flags [.], cksum 0xfe28 (incorrect -> 0xe022), seq 3, ack 14, win 512, options [nop,nop,TS val 1304796601 ecr 1304796601], length 0
2022-02-28 08:00:52.418145 IP (tos 0x0, ttl 64, id 41152, offset 0, flags [DF], proto TCP (6), length 52)
    127.0.0.1.46484 > 127.0.0.1.11750: Flags [.], cksum 0xfe28 (incorrect -> 0xdd56), seq 944, ack 3650, win 512, options [nop,nop,TS val 1304796641 ecr 1304796598], length 0
2022-02-28 08:00:52.590639 IP (tos 0x0, ttl 64, id 37530, offset 0, flags [DF], proto TCP (6), length 62)
    127.0.0.1.11750 > 127.0.0.1.46486: Flags [P.], cksum 0xfe32 (incorrect -> 0xda3a), seq 3:13, ack 14, win 512, options [nop,nop,TS val 1304796814 ecr 1304796601], length 10
2022-02-28 08:00:52.590656 IP (tos 0x0, ttl 64, id 28922, offset 0, flags [DF], proto TCP (6), length 52)
    127.0.0.1.46486 > 127.0.0.1.11750: Flags [.], cksum 0xfe28 (incorrect -> 0xde6e), seq 14, ack 13, win 512, options [nop,nop,TS val 1304796814 ecr 1304796814], length 0
2022-02-28 08:00:52.595832 IP (tos 0x0, ttl 64, id 28923, offset 0, flags [DF], proto TCP (6), length 569)
    127.0.0.1.46486 > 127.0.0.1.11750: Flags [P.], cksum 0x002e (incorrect -> 0x7ab8), seq 14:531, ack 13, win 512, options [nop,nop,TS val 1304796819 ecr 1304796814], length 517
2022-02-28 08:00:52.595841 IP (tos 0x0, ttl 64, id 37531, offset 0, flags [DF], proto TCP (6), length 52)
    127.0.0.1.11750 > 127.0.0.1.46486: Flags [.], cksum 0xfe28 (incorrect -> 0xdc63), seq 13, ack 531, win 508, options [nop,nop,TS val 1304796819 ecr 1304796819], length 0
200, 8.416531562805176, 1.9746794700622559