2022-02-28 03:28:42.235929 IP (tos 0x0, ttl 64, id 8802, offset 0, flags [DF], proto TCP (6), length 60)
    127.0.0.1.45096 > 127.0.0.1.10150: Flags [S], cksum 0xfe30 (incorrect -> 0xce48), seq 2985769739, win 65495, options [mss 65495,sackOK,TS val 1288466459 ecr 0,nop,wscale 7], length 0
2022-02-28 03:28:42.235942 IP (tos 0x0, ttl 64, id 0, offset 0, flags [DF], proto TCP (6), length 60)
    127.0.0.1.10150 > 127.0.0.1.45096: Flags [S.], cksum 0xfe30 (incorrect -> 0x6114), seq 1773880972, ack 2985769740, win 65483, options [mss 65495,sackOK,TS val 1288466459 ecr 1288466459,nop,wscale 7], length 0
2022-02-28 03:28:42.235952 IP (tos 0x0, ttl 64, id 8803, offset 0, flags [DF], proto TCP (6), length 52)
    127.0.0.1.45096 > 127.0.0.1.10150: Flags [.], cksum 0xfe28 (incorrect -> 0x87d0), seq 1, ack 1, win 512, options [nop,nop,TS val 1288466459 ecr 1288466459], length 0
2022-02-28 03:28:42.236083 IP (tos 0x0, ttl 64, id 8804, offset 0, flags [DF], proto TCP (6), length 55)
    127.0.0.1.45096 > 127.0.0.1.10150: Flags [P.], cksum 0xfe2b (incorrect -> 0x82c4), seq 1:4, ack 1, win 512, options [nop,nop,TS val 1288466459 ecr 1288466459], length 3
2022-02-28 03:28:42.236099 IP (tos 0x0, ttl 64, id 31168, offset 0, flags [DF], proto TCP (6), length 52)
    127.0.0.1.10150 > 127.0.0.1.45096: Flags [.], cksum 0xfe28 (incorrect -> 0x87cd), seq 1, ack 4, win 512, options [nop,nop,TS val 1288466459 ecr 1288466459], length 0
2022-02-28 03:28:42.236133 IP (tos 0x0, ttl 64, id 31169, offset 0, flags [DF], proto TCP (6), length 54)
    127.0.0.1.10150 > 127.0.0.1.45096: Flags [P.], cksum 0xfe2a (incorrect -> 0x82c3), seq 1:3, ack 4, win 512, options [nop,nop,TS val 1288466459 ecr 1288466459], length 2
2022-02-28 03:28:42.236144 IP (tos 0x0, ttl 64, id 8805, offset 0, flags [DF], proto TCP (6), length 52)
    127.0.0.1.45096 > 127.0.0.1.10150: Flags [.], cksum 0xfe28 (incorrect -> 0x87cb), seq 4, ack 3, win 512, options [nop,nop,TS val 1288466459 ecr 1288466459], length 0
2022-02-28 03:28:42.272424 IP (tos 0x0, ttl 64, id 8806, offset 0, flags [DF], proto TCP (6), length 62)
    127.0.0.1.45096 > 127.0.0.1.10150: Flags [P.], cksum 0xfe32 (incorrect -> 0x7ba1), seq 4:14, ack 3, win 512, options [nop,nop,TS val 1288466495 ecr 1288466459], length 10
2022-02-28 03:28:42.272442 IP (tos 0x0, ttl 64, id 31170, offset 0, flags [DF], proto TCP (6), length 52)
    127.0.0.1.10150 > 127.0.0.1.45096: Flags [.], cksum 0xfe28 (incorrect -> 0x8778), seq 3, ack 14, win 512, options [nop,nop,TS val 1288466496 ecr 1288466495], length 0
2022-02-28 03:28:42.394642 IP (tos 0x0, ttl 64, id 31171, offset 0, flags [DF], proto TCP (6), length 62)
    127.0.0.1.10150 > 127.0.0.1.45096: Flags [P.], cksum 0xfe32 (incorrect -> 0x81eb), seq 3:13, ack 14, win 512, options [nop,nop,TS val 1288466618 ecr 1288466495], length 10
2022-02-28 03:28:42.394652 IP (tos 0x0, ttl 64, id 8807, offset 0, flags [DF], proto TCP (6), length 52)
    127.0.0.1.45096 > 127.0.0.1.10150: Flags [.], cksum 0xfe28 (incorrect -> 0x8679), seq 14, ack 13, win 512, options [nop,nop,TS val 1288466618 ecr 1288466618], length 0
2022-02-28 03:28:42.401597 IP (tos 0x0, ttl 64, id 8808, offset 0, flags [DF], proto TCP (6), length 569)
    127.0.0.1.45096 > 127.0.0.1.10150: Flags [P.], cksum 0x002e (incorrect -> 0x37da), seq 14:531, ack 13, win 512, options [nop,nop,TS val 1288466625 ecr 1288466618], length 517
2022-02-28 03:28:42.401609 IP (tos 0x0, ttl 64, id 31172, offset 0, flags [DF], proto TCP (6), length 52)
    127.0.0.1.10150 > 127.0.0.1.45096: Flags [.], cksum 0xfe28 (incorrect -> 0x846a), seq 13, ack 531, win 508, options [nop,nop,TS val 1288466625 ecr 1288466625], length 0
200, 5.010621070861816, 0.8600125312805176