2022-02-28 12:54:06.217242 IP (tos 0x0, ttl 64, id 11277, offset 0, flags [DF], proto TCP (6), length 60)
    127.0.0.1.37240 > 127.0.0.1.9450: Flags [S], cksum 0xfe30 (incorrect -> 0x00bf), seq 1759366536, win 65495, options [mss 65495,sackOK,TS val 1322390440 ecr 0,nop,wscale 7], length 0
2022-02-28 12:54:06.217260 IP (tos 0x0, ttl 64, id 0, offset 0, flags [DF], proto TCP (6), length 60)
    127.0.0.1.9450 > 127.0.0.1.37240: Flags [S.], cksum 0xfe30 (incorrect -> 0x3d3f), seq 2653733587, ack 1759366537, win 65483, options [mss 65495,sackOK,TS val 1322390440 ecr 1322390440,nop,wscale 7], length 0
2022-02-28 12:54:06.217273 IP (tos 0x0, ttl 64, id 11278, offset 0, flags [DF], proto TCP (6), length 52)
    127.0.0.1.37240 > 127.0.0.1.9450: Flags [.], cksum 0xfe28 (incorrect -> 0x63fb), seq 1, ack 1, win 512, options [nop,nop,TS val 1322390440 ecr 1322390440], length 0
2022-02-28 12:54:06.217403 IP (tos 0x0, ttl 64, id 11279, offset 0, flags [DF], proto TCP (6), length 55)
    127.0.0.1.37240 > 127.0.0.1.9450: Flags [P.], cksum 0xfe2b (incorrect -> 0x5eef), seq 1:4, ack 1, win 512, options [nop,nop,TS val 1322390440 ecr 1322390440], length 3
2022-02-28 12:54:06.217421 IP (tos 0x0, ttl 64, id 49364, offset 0, flags [DF], proto TCP (6), length 52)
    127.0.0.1.9450 > 127.0.0.1.37240: Flags [.], cksum 0xfe28 (incorrect -> 0x63f8), seq 1, ack 4, win 512, options [nop,nop,TS val 1322390440 ecr 1322390440], length 0
2022-02-28 12:54:06.217470 IP (tos 0x0, ttl 64, id 49365, offset 0, flags [DF], proto TCP (6), length 54)
    127.0.0.1.9450 > 127.0.0.1.37240: Flags [P.], cksum 0xfe2a (incorrect -> 0x5eed), seq 1:3, ack 4, win 512, options [nop,nop,TS val 1322390441 ecr 1322390440], length 2
2022-02-28 12:54:06.217481 IP (tos 0x0, ttl 64, id 11280, offset 0, flags [DF], proto TCP (6), length 52)
    127.0.0.1.37240 > 127.0.0.1.9450: Flags [.], cksum 0xfe28 (incorrect -> 0x63f4), seq 4, ack 3, win 512, options [nop,nop,TS val 1322390441 ecr 1322390441], length 0
2022-02-28 12:54:06.229044 IP (tos 0x0, ttl 64, id 11281, offset 0, flags [DF], proto TCP (6), length 62)
    127.0.0.1.37240 > 127.0.0.1.9450: Flags [P.], cksum 0xfe32 (incorrect -> 0xa04a), seq 4:14, ack 3, win 512, options [nop,nop,TS val 1322390452 ecr 1322390441], length 10
2022-02-28 12:54:06.229055 IP (tos 0x0, ttl 64, id 49366, offset 0, flags [DF], proto TCP (6), length 52)
    127.0.0.1.9450 > 127.0.0.1.37240: Flags [.], cksum 0xfe28 (incorrect -> 0x63d4), seq 3, ack 14, win 512, options [nop,nop,TS val 1322390452 ecr 1322390452], length 0
2022-02-28 12:54:06.345773 IP (tos 0x0, ttl 64, id 49367, offset 0, flags [DF], proto TCP (6), length 62)
    127.0.0.1.9450 > 127.0.0.1.37240: Flags [P.], cksum 0xfe32 (incorrect -> 0x5e4c), seq 3:13, ack 14, win 512, options [nop,nop,TS val 1322390569 ecr 1322390452], length 10
2022-02-28 12:54:06.345791 IP (tos 0x0, ttl 64, id 11282, offset 0, flags [DF], proto TCP (6), length 52)
    127.0.0.1.37240 > 127.0.0.1.9450: Flags [.], cksum 0xfe28 (incorrect -> 0x62e0), seq 14, ack 13, win 512, options [nop,nop,TS val 1322390569 ecr 1322390569], length 0
2022-02-28 12:54:06.351745 IP (tos 0x0, ttl 64, id 11283, offset 0, flags [DF], proto TCP (6), length 569)
    127.0.0.1.37240 > 127.0.0.1.9450: Flags [P.], cksum 0x002e (incorrect -> 0xadfc), seq 14:531, ack 13, win 512, options [nop,nop,TS val 1322390575 ecr 1322390569], length 517
2022-02-28 12:54:06.351756 IP (tos 0x0, ttl 64, id 49368, offset 0, flags [DF], proto TCP (6), length 52)
    127.0.0.1.9450 > 127.0.0.1.37240: Flags [.], cksum 0xfe28 (incorrect -> 0x60d3), seq 13, ack 531, win 508, options [nop,nop,TS val 1322390575 ecr 1322390575], length 0
2022-02-28 12:54:06.484370 IP (tos 0x0, ttl 64, id 49369, offset 0, flags [DF], proto TCP (6), length 3427)
    127.0.0.1.9450 > 127.0.0.1.37240: Flags [P.], cksum 0x0b58 (incorrect -> 0x09ca), seq 13:3388, ack 531, win 512, options [nop,nop,TS val 1322390707 ecr 1322390575], length 3375
2022-02-28 12:54:06.484380 IP (tos 0x0, ttl 64, id 11284, offset 0, flags [DF], proto TCP (6), length 52)
    127.0.0.1.37240 > 127.0.0.1.9450: Flags [.], cksum 0xfe28 (incorrect -> 0x52aa), seq 531, ack 3388, win 494, options [nop,nop,TS val 1322390707 ecr 1322390707], length 0
2022-02-28 12:54:06.484887 IP (tos 0x0, ttl 64, id 11285, offset 0, flags [DF], proto TCP (6), length 116)
    127.0.0.1.37240 > 127.0.0.1.9450: Flags [P.], cksum 0xfe68 (incorrect -> 0xd992), seq 531:595, ack 3388, win 512, options [nop,nop,TS val 1322390708 ecr 1322390707], length 64
2022-02-28 12:54:06.484897 IP (tos 0x0, ttl 64, id 49370, offset 0, flags [DF], proto TCP (6), length 52)
    127.0.0.1.9450 > 127.0.0.1.37240: Flags [.], cksum 0xfe28 (incorrect -> 0x5256), seq 3388, ack 595, win 512, options [nop,nop,TS val 1322390708 ecr 1322390708], length 0
2022-02-28 12:54:06.485221 IP (tos 0x0, ttl 64, id 11286, offset 0, flags [DF], proto TCP (6), length 359)
    127.0.0.1.37240 > 127.0.0.1.9450: Flags [P.], cksum 0xff5b (incorrect -> 0x5d1e), seq 595:902, ack 3388, win 512, options [nop,nop,TS val 1322390708 ecr 1322390708], length 307
2022-02-28 12:54:06.485230 IP (tos 0x0, ttl 64, id 49371, offset 0, flags [DF], proto TCP (6), length 52)
    127.0.0.1.9450 > 127.0.0.1.37240: Flags [.], cksum 0xfe28 (incorrect -> 0x5125), seq 3388, ack 902, win 510, options [nop,nop,TS val 1322390708 ecr 1322390708], length 0
2022-02-28 12:54:06.604854 IP (tos 0x0, ttl 64, id 49372, offset 0, flags [DF], proto TCP (6), length 594)
    127.0.0.1.9450 > 127.0.0.1.37240: Flags [P.], cksum 0x0047 (incorrect -> 0xddc8), seq 3388:3930, ack 902, win 512, options [nop,nop,TS val 1322390828 ecr 1322390708], length 542
2022-02-28 12:54:06.604865 IP (tos 0x0, ttl 64, id 11287, offset 0, flags [DF], proto TCP (6), length 52)
    127.0.0.1.37240 > 127.0.0.1.9450: Flags [.], cksum 0xfe28 (incorrect -> 0x4e19), seq 902, ack 3930, win 508, options [nop,nop,TS val 1322390828 ecr 1322390828], length 0
2022-02-28 12:54:06.697726 IP (tos 0x0, ttl 64, id 49373, offset 0, flags [DF], proto TCP (6), length 1486)
    127.0.0.1.9450 > 127.0.0.1.37240: Flags [P.], cksum 0x03c3 (incorrect -> 0x9b65), seq 3930:5364, ack 902, win 512, options [nop,nop,TS val 1322390921 ecr 1322390828], length 1434
2022-02-28 12:54:06.697733 IP (tos 0x0, ttl 64, id 11288, offset 0, flags [DF], proto TCP (6), length 52)
    127.0.0.1.37240 > 127.0.0.1.9450: Flags [.], cksum 0xfe28 (incorrect -> 0x47cb), seq 902, ack 5364, win 502, options [nop,nop,TS val 1322390921 ecr 1322390921], length 0
2022-02-28 12:54:06.700119 IP (tos 0x0, ttl 64, id 34546, offset 0, flags [DF], proto TCP (6), length 60)
    127.0.0.1.37242 > 127.0.0.1.9450: Flags [S], cksum 0xfe30 (incorrect -> 0xe7f9), seq 4156380552, win 65495, options [mss 65495,sackOK,TS val 1322390923 ecr 0,nop,wscale 7], length 0
2022-02-28 12:54:06.700130 IP (tos 0x0, ttl 64, id 0, offset 0, flags [DF], proto TCP (6), length 60)
    127.0.0.1.9450 > 127.0.0.1.37242: Flags [S.], cksum 0xfe30 (incorrect -> 0x0e6e), seq 1386619523, ack 4156380553, win 65483, options [mss 65495,sackOK,TS val 1322390923 ecr 1322390923,nop,wscale 7], length 0
2022-02-28 12:54:06.700138 IP (tos 0x0, ttl 64, id 34547, offset 0, flags [DF], proto TCP (6), length 52)
    127.0.0.1.37242 > 127.0.0.1.9450: Flags [.], cksum 0xfe28 (incorrect -> 0x352a), seq 1, ack 1, win 512, options [nop,nop,TS val 1322390923 ecr 1322390923], length 0
2022-02-28 12:54:06.700223 IP (tos 0x0, ttl 64, id 34548, offset 0, flags [DF], proto TCP (6), length 55)
    127.0.0.1.37242 > 127.0.0.1.9450: Flags [P.], cksum 0xfe2b (incorrect -> 0x301e), seq 1:4, ack 1, win 512, options [nop,nop,TS val 1322390923 ecr 1322390923], length 3
2022-02-28 12:54:06.700230 IP (tos 0x0, ttl 64, id 8536, offset 0, flags [DF], proto TCP (6), length 52)
    127.0.0.1.9450 > 127.0.0.1.37242: Flags [.], cksum 0xfe28 (incorrect -> 0x3527), seq 1, ack 4, win 512, options [nop,nop,TS val 1322390923 ecr 1322390923], length 0
2022-02-28 12:54:06.700248 IP (tos 0x0, ttl 64, id 8537, offset 0, flags [DF], proto TCP (6), length 54)
    127.0.0.1.9450 > 127.0.0.1.37242: Flags [P.], cksum 0xfe2a (incorrect -> 0x301d), seq 1:3, ack 4, win 512, options [nop,nop,TS val 1322390923 ecr 1322390923], length 2
2022-02-28 12:54:06.700256 IP (tos 0x0, ttl 64, id 34549, offset 0, flags [DF], proto TCP (6), length 52)
    127.0.0.1.37242 > 127.0.0.1.9450: Flags [.], cksum 0xfe28 (incorrect -> 0x3525), seq 4, ack 3, win 512, options [nop,nop,TS val 1322390923 ecr 1322390923], length 0
2022-02-28 12:54:06.720881 IP (tos 0x0, ttl 64, id 34550, offset 0, flags [DF], proto TCP (6), length 62)
    127.0.0.1.37242 > 127.0.0.1.9450: Flags [P.], cksum 0xfe32 (incorrect -> 0x7170), seq 4:14, ack 3, win 512, options [nop,nop,TS val 1322390944 ecr 1322390923], length 10
2022-02-28 12:54:06.720891 IP (tos 0x0, ttl 64, id 8538, offset 0, flags [DF], proto TCP (6), length 52)
    127.0.0.1.9450 > 127.0.0.1.37242: Flags [.], cksum 0xfe28 (incorrect -> 0x34f1), seq 3, ack 14, win 512, options [nop,nop,TS val 1322390944 ecr 1322390944], length 0
2022-02-28 12:54:06.837265 IP (tos 0x0, ttl 64, id 8539, offset 0, flags [DF], proto TCP (6), length 62)
    127.0.0.1.9450 > 127.0.0.1.37242: Flags [P.], cksum 0xfe32 (incorrect -> 0x2f6a), seq 3:13, ack 14, win 512, options [nop,nop,TS val 1322391060 ecr 1322390944], length 10
2022-02-28 12:54:06.837275 IP (tos 0x0, ttl 64, id 34551, offset 0, flags [DF], proto TCP (6), length 52)
    127.0.0.1.37242 > 127.0.0.1.9450: Flags [.], cksum 0xfe28 (incorrect -> 0x33ff), seq 14, ack 13, win 512, options [nop,nop,TS val 1322391060 ecr 1322391060], length 0
2022-02-28 12:54:06.842214 IP (tos 0x0, ttl 64, id 34552, offset 0, flags [DF], proto TCP (6), length 569)
    127.0.0.1.37242 > 127.0.0.1.9450: Flags [P.], cksum 0x002e (incorrect -> 0x62d9), seq 14:531, ack 13, win 512, options [nop,nop,TS val 1322391065 ecr 1322391060], length 517
2022-02-28 12:54:06.842221 IP (tos 0x0, ttl 64, id 8540, offset 0, flags [DF], proto TCP (6), length 52)
    127.0.0.1.9450 > 127.0.0.1.37242: Flags [.], cksum 0xfe28 (incorrect -> 0x31f4), seq 13, ack 531, win 508, options [nop,nop,TS val 1322391065 ecr 1322391065], length 0
2022-02-28 12:54:06.959933 IP (tos 0x0, ttl 64, id 8541, offset 0, flags [DF], proto TCP (6), length 3427)
    127.0.0.1.9450 > 127.0.0.1.37242: Flags [P.], cksum 0x0b58 (incorrect -> 0x3f69), seq 13:3388, ack 531, win 512, options [nop,nop,TS val 1322391183 ecr 1322391065], length 3375
2022-02-28 12:54:06.959942 IP (tos 0x0, ttl 64, id 34553, offset 0, flags [DF], proto TCP (6), length 52)
    127.0.0.1.37242 > 127.0.0.1.9450: Flags [.], cksum 0xfe28 (incorrect -> 0x23e7), seq 531, ack 3388, win 494, options [nop,nop,TS val 1322391183 ecr 1322391183], length 0
2022-02-28 12:54:06.960398 IP (tos 0x0, ttl 64, id 34554, offset 0, flags [DF], proto TCP (6), length 116)
    127.0.0.1.37242 > 127.0.0.1.9450: Flags [P.], cksum 0xfe68 (incorrect -> 0x1dd3), seq 531:595, ack 3388, win 512, options [nop,nop,TS val 1322391183 ecr 1322391183], length 64
2022-02-28 12:54:06.960407 IP (tos 0x0, ttl 64, id 8542, offset 0, flags [DF], proto TCP (6), length 52)
    127.0.0.1.9450 > 127.0.0.1.37242: Flags [.], cksum 0xfe28 (incorrect -> 0x2395), seq 3388, ack 595, win 512, options [nop,nop,TS val 1322391183 ecr 1322391183], length 0
2022-02-28 12:54:06.960631 IP (tos 0x0, ttl 64, id 34555, offset 0, flags [DF], proto TCP (6), length 363)
    127.0.0.1.37242 > 127.0.0.1.9450: Flags [P.], cksum 0xff5f (incorrect -> 0x4c4b), seq 595:906, ack 3388, win 512, options [nop,nop,TS val 1322391184 ecr 1322391183], length 311
2022-02-28 12:54:06.960640 IP (tos 0x0, ttl 64, id 8543, offset 0, flags [DF], proto TCP (6), length 52)
    127.0.0.1.9450 > 127.0.0.1.37242: Flags [.], cksum 0xfe28 (incorrect -> 0x225e), seq 3388, ack 906, win 510, options [nop,nop,TS val 1322391184 ecr 1322391184], length 0
2022-02-28 12:54:07.085100 IP (tos 0x0, ttl 64, id 8544, offset 0, flags [DF], proto TCP (6), length 594)
    127.0.0.1.9450 > 127.0.0.1.37242: Flags [P.], cksum 0x0047 (incorrect -> 0x9647), seq 3388:3930, ack 906, win 512, options [nop,nop,TS val 1322391308 ecr 1322391184], length 542
2022-02-28 12:54:07.085110 IP (tos 0x0, ttl 64, id 34556, offset 0, flags [DF], proto TCP (6), length 52)
    127.0.0.1.37242 > 127.0.0.1.9450: Flags [.], cksum 0xfe28 (incorrect -> 0x1f4a), seq 906, ack 3930, win 508, options [nop,nop,TS val 1322391308 ecr 1322391308], length 0
2022-02-28 12:54:07.169987 IP (tos 0x0, ttl 64, id 8545, offset 0, flags [DF], proto TCP (6), length 2098)
    127.0.0.1.9450 > 127.0.0.1.37242: Flags [P.], cksum 0x0627 (incorrect -> 0x38a4), seq 3930:5976, ack 906, win 512, options [nop,nop,TS val 1322391393 ecr 1322391308], length 2046
2022-02-28 12:54:07.170003 IP (tos 0x0, ttl 64, id 34557, offset 0, flags [DF], proto TCP (6), length 52)
    127.0.0.1.37242 > 127.0.0.1.9450: Flags [.], cksum 0xfe28 (incorrect -> 0x16aa), seq 906, ack 5976, win 500, options [nop,nop,TS val 1322391393 ecr 1322391393], length 0
2022-02-28 12:54:07.180660 IP (tos 0x0, ttl 64, id 8546, offset 0, flags [DF], proto TCP (6), length 985)
    127.0.0.1.9450 > 127.0.0.1.37242: Flags [P.], cksum 0x01ce (incorrect -> 0x75a1), seq 5976:6909, ack 906, win 512, options [nop,nop,TS val 1322391404 ecr 1322391393], length 933
2022-02-28 12:54:07.180668 IP (tos 0x0, ttl 64, id 34558, offset 0, flags [DF], proto TCP (6), length 52)
    127.0.0.1.37242 > 127.0.0.1.9450: Flags [.], cksum 0xfe28 (incorrect -> 0x12eb), seq 906, ack 6909, win 504, options [nop,nop,TS val 1322391404 ecr 1322391404], length 0
2022-02-28 12:54:07.196943 IP (tos 0x0, ttl 64, id 8547, offset 0, flags [DF], proto TCP (6), length 3129)
    127.0.0.1.9450 > 127.0.0.1.37242: Flags [P.], cksum 0x0a2e (incorrect -> 0x1b3f), seq 6909:9986, ack 906, win 512, options [nop,nop,TS val 1322391420 ecr 1322391404], length 3077
2022-02-28 12:54:07.196953 IP (tos 0x0, ttl 64, id 34559, offset 0, flags [DF], proto TCP (6), length 52)
    127.0.0.1.37242 > 127.0.0.1.9450: Flags [.], cksum 0xfe28 (incorrect -> 0x06cf), seq 906, ack 9986, win 495, options [nop,nop,TS val 1322391420 ecr 1322391420], length 0
2022-02-28 12:54:07.239691 IP (tos 0x0, ttl 64, id 8548, offset 0, flags [DF], proto TCP (6), length 383)
    127.0.0.1.9450 > 127.0.0.1.37242: Flags [P.], cksum 0xff73 (incorrect -> 0x7bbf), seq 9986:10317, ack 906, win 512, options [nop,nop,TS val 1322391463 ecr 1322391420], length 331
2022-02-28 12:54:07.239700 IP (tos 0x0, ttl 64, id 34560, offset 0, flags [DF], proto TCP (6), length 52)
    127.0.0.1.37242 > 127.0.0.1.9450: Flags [.], cksum 0xfe28 (incorrect -> 0x0523), seq 906, ack 10317, win 506, options [nop,nop,TS val 1322391463 ecr 1322391463], length 0
2022-02-28 12:54:07.314108 IP (tos 0x0, ttl 64, id 8549, offset 0, flags [DF], proto TCP (6), length 4100)
    127.0.0.1.9450 > 127.0.0.1.37242: Flags [P.], cksum 0x0df9 (incorrect -> 0x76fb), seq 10317:14365, ack 906, win 512, options [nop,nop,TS val 1322391537 ecr 1322391463], length 4048
2022-02-28 12:54:07.314119 IP (tos 0x0, ttl 64, id 34561, offset 0, flags [DF], proto TCP (6), length 52)
    127.0.0.1.37242 > 127.0.0.1.9450: Flags [.], cksum 0xfe28 (incorrect -> 0xf4cc), seq 906, ack 14365, win 492, options [nop,nop,TS val 1322391537 ecr 1322391537], length 0
2022-02-28 12:54:07.314145 IP (tos 0x0, ttl 64, id 8550, offset 0, flags [DF], proto TCP (6), length 3474)
    127.0.0.1.9450 > 127.0.0.1.37242: Flags [P.], cksum 0x0b87 (incorrect -> 0xcd80), seq 14365:17787, ack 906, win 512, options [nop,nop,TS val 1322391537 ecr 1322391537], length 3422
2022-02-28 12:54:07.314150 IP (tos 0x0, ttl 64, id 34562, offset 0, flags [DF], proto TCP (6), length 52)
    127.0.0.1.37242 > 127.0.0.1.9450: Flags [.], cksum 0xfe28 (incorrect -> 0xe77c), seq 906, ack 17787, win 478, options [nop,nop,TS val 1322391537 ecr 1322391537], length 0
2022-02-28 12:54:07.315290 IP (tos 0x0, ttl 64, id 8551, offset 0, flags [DF], proto TCP (6), length 3538)
    127.0.0.1.9450 > 127.0.0.1.37242: Flags [P.], cksum 0x0bc7 (incorrect -> 0x3188), seq 17787:21273, ack 906, win 512, options [nop,nop,TS val 1322391538 ecr 1322391537], length 3486
2022-02-28 12:54:07.315300 IP (tos 0x0, ttl 64, id 34563, offset 0, flags [DF], proto TCP (6), length 52)
    127.0.0.1.37242 > 127.0.0.1.9450: Flags [.], cksum 0xfe28 (incorrect -> 0xd9cc), seq 906, ack 21273, win 494, options [nop,nop,TS val 1322391538 ecr 1322391538], length 0
2022-02-28 12:54:07.318762 IP (tos 0x0, ttl 64, id 8552, offset 0, flags [DF], proto TCP (6), length 4036)
    127.0.0.1.9450 > 127.0.0.1.37242: Flags [P.], cksum 0x0db9 (incorrect -> 0x8e1c), seq 21273:25257, ack 906, win 512, options [nop,nop,TS val 1322391542 ecr 1322391538], length 3984
2022-02-28 12:54:07.318771 IP (tos 0x0, ttl 64, id 34564, offset 0, flags [DF], proto TCP (6), length 52)
    127.0.0.1.37242 > 127.0.0.1.9450: Flags [.], cksum 0xfe28 (incorrect -> 0xca36), seq 906, ack 25257, win 492, options [nop,nop,TS val 1322391542 ecr 1322391542], length 0
2022-02-28 12:54:07.329394 IP (tos 0x0, ttl 64, id 8553, offset 0, flags [DF], proto TCP (6), length 1048)
    127.0.0.1.9450 > 127.0.0.1.37242: Flags [P.], cksum 0x020d (incorrect -> 0xb3db), seq 25257:26253, ack 906, win 512, options [nop,nop,TS val 1322391552 ecr 1322391542], length 996
2022-02-28 12:54:07.329514 IP (tos 0x0, ttl 64, id 34565, offset 0, flags [DF], proto TCP (6), length 52)
    127.0.0.1.37242 > 127.0.0.1.9450: Flags [.], cksum 0xfe28 (incorrect -> 0xc629), seq 906, ack 26253, win 512, options [nop,nop,TS val 1322391553 ecr 1322391552], length 0
2022-02-28 12:54:07.370573 IP (tos 0x0, ttl 64, id 8554, offset 0, flags [DF], proto TCP (6), length 4100)
    127.0.0.1.9450 > 127.0.0.1.37242: Flags [P.], cksum 0x0df9 (incorrect -> 0xeb41), seq 26253:30301, ack 906, win 512, options [nop,nop,TS val 1322391594 ecr 1322391553], length 4048
2022-02-28 12:54:07.414147 IP (tos 0x0, ttl 64, id 34566, offset 0, flags [DF], proto TCP (6), length 52)
    127.0.0.1.37242 > 127.0.0.1.9450: Flags [.], cksum 0xfe28 (incorrect -> 0xb5db), seq 906, ack 30301, win 512, options [nop,nop,TS val 1322391637 ecr 1322391594], length 0
2022-02-28 12:54:07.414161 IP (tos 0x0, ttl 64, id 8555, offset 0, flags [DF], proto TCP (6), length 29826)
    127.0.0.1.9450 > 127.0.0.1.37242: Flags [P.], cksum 0x7277 (incorrect -> 0xafdd), seq 30301:60075, ack 906, win 512, options [nop,nop,TS val 1322391637 ecr 1322391637], length 29774
2022-02-28 12:54:07.418302 IP (tos 0x0, ttl 64, id 8556, offset 0, flags [DF], proto TCP (6), length 32820)
    127.0.0.1.9450 > 127.0.0.1.37242: Flags [.], cksum 0x7e29 (incorrect -> 0x5a6a), seq 60075:92843, ack 906, win 512, options [nop,nop,TS val 1322391641 ecr 1322391637], length 32768
2022-02-28 12:54:07.418421 IP (tos 0x0, ttl 64, id 34567, offset 0, flags [DF], proto TCP (6), length 52)
    127.0.0.1.37242 > 127.0.0.1.9450: Flags [.], cksum 0xfe28 (incorrect -> 0xc1e2), seq 906, ack 92843, win 379, options [nop,nop,TS val 1322391641 ecr 1322391637], length 0
2022-02-28 12:54:07.418431 IP (tos 0x0, ttl 64, id 8557, offset 0, flags [DF], proto TCP (6), length 14126)
    127.0.0.1.9450 > 127.0.0.1.37242: Flags [P.], cksum 0x3523 (incorrect -> 0x1fda), seq 92843:106917, ack 906, win 512, options [nop,nop,TS val 1322391642 ecr 1322391641], length 14074
2022-02-28 12:54:07.419393 IP (tos 0x0, ttl 64, id 34568, offset 0, flags [DF], proto TCP (6), length 52)
    127.0.0.1.37242 > 127.0.0.1.9450: Flags [.], cksum 0xfe28 (incorrect -> 0x8a5d), seq 906, ack 106917, win 512, options [nop,nop,TS val 1322391642 ecr 1322391642], length 0
2022-02-28 12:54:07.420012 IP (tos 0x0, ttl 64, id 8558, offset 0, flags [DF], proto TCP (6), length 1546)
    127.0.0.1.9450 > 127.0.0.1.37242: Flags [P.], cksum 0x03ff (incorrect -> 0xad79), seq 106917:108411, ack 906, win 512, options [nop,nop,TS val 1322391643 ecr 1322391642], length 1494
2022-02-28 12:54:07.420061 IP (tos 0x0, ttl 64, id 34569, offset 0, flags [DF], proto TCP (6), length 52)
    127.0.0.1.37242 > 127.0.0.1.9450: Flags [.], cksum 0xfe28 (incorrect -> 0x8485), seq 906, ack 108411, win 512, options [nop,nop,TS val 1322391643 ecr 1322391643], length 0
2022-02-28 12:54:07.420073 IP (tos 0x0, ttl 64, id 8559, offset 0, flags [DF], proto TCP (6), length 4100)
    127.0.0.1.9450 > 127.0.0.1.37242: Flags [P.], cksum 0x0df9 (incorrect -> 0xc41f), seq 108411:112459, ack 906, win 512, options [nop,nop,TS val 1322391643 ecr 1322391643], length 4048
2022-02-28 12:54:07.420125 IP (tos 0x0, ttl 64, id 34570, offset 0, flags [DF], proto TCP (6), length 52)
    127.0.0.1.37242 > 127.0.0.1.9450: Flags [.], cksum 0xfe28 (incorrect -> 0x74b5), seq 906, ack 112459, win 512, options [nop,nop,TS val 1322391643 ecr 1322391643], length 0
2022-02-28 12:54:07.420133 IP (tos 0x0, ttl 64, id 8560, offset 0, flags [DF], proto TCP (6), length 3190)
    127.0.0.1.9450 > 127.0.0.1.37242: Flags [P.], cksum 0x0a6b (incorrect -> 0x9eea), seq 112459:115597, ack 906, win 512, options [nop,nop,TS val 1322391643 ecr 1322391643], length 3138
2022-02-28 12:54:07.420328 IP (tos 0x0, ttl 64, id 34571, offset 0, flags [DF], proto TCP (6), length 52)
    127.0.0.1.37242 > 127.0.0.1.9450: Flags [.], cksum 0xfe28 (incorrect -> 0x6873), seq 906, ack 115597, win 512, options [nop,nop,TS val 1322391643 ecr 1322391643], length 0
2022-02-28 12:54:07.421444 IP (tos 0x0, ttl 64, id 8561, offset 0, flags [DF], proto TCP (6), length 910)
    127.0.0.1.9450 > 127.0.0.1.37242: Flags [P.], cksum 0x0183 (incorrect -> 0xe681), seq 115597:116455, ack 906, win 512, options [nop,nop,TS val 1322391645 ecr 1322391643], length 858
2022-02-28 12:54:07.421473 IP (tos 0x0, ttl 64, id 34572, offset 0, flags [DF], proto TCP (6), length 52)
    127.0.0.1.37242 > 127.0.0.1.9450: Flags [.], cksum 0xfe28 (incorrect -> 0x6515), seq 906, ack 116455, win 512, options [nop,nop,TS val 1322391645 ecr 1322391645], length 0
2022-02-28 12:54:07.425683 IP (tos 0x0, ttl 64, id 8562, offset 0, flags [DF], proto TCP (6), length 3446)
    127.0.0.1.9450 > 127.0.0.1.37242: Flags [P.], cksum 0x0b6b (incorrect -> 0x1241), seq 116455:119849, ack 906, win 512, options [nop,nop,TS val 1322391649 ecr 1322391645], length 3394
2022-02-28 12:54:07.425745 IP (tos 0x0, ttl 64, id 34573, offset 0, flags [DF], proto TCP (6), length 52)
    127.0.0.1.37242 > 127.0.0.1.9450: Flags [.], cksum 0xfe28 (incorrect -> 0x57cb), seq 906, ack 119849, win 512, options [nop,nop,TS val 1322391649 ecr 1322391649], length 0
2022-02-28 12:54:07.425812 IP (tos 0x0, ttl 64, id 8563, offset 0, flags [DF], proto TCP (6), length 4100)
    127.0.0.1.9450 > 127.0.0.1.37242: Flags [P.], cksum 0x0df9 (incorrect -> 0x0c77), seq 119849:123897, ack 906, win 512, options [nop,nop,TS val 1322391649 ecr 1322391649], length 4048
2022-02-28 12:54:07.425854 IP (tos 0x0, ttl 64, id 34574, offset 0, flags [DF], proto TCP (6), length 52)
    127.0.0.1.37242 > 127.0.0.1.9450: Flags [.], cksum 0xfe28 (incorrect -> 0x47fb), seq 906, ack 123897, win 512, options [nop,nop,TS val 1322391649 ecr 1322391649], length 0
2022-02-28 12:54:07.425863 IP (tos 0x0, ttl 64, id 8564, offset 0, flags [DF], proto TCP (6), length 7772)
    127.0.0.1.9450 > 127.0.0.1.37242: Flags [P.], cksum 0x1c51 (incorrect -> 0xc60a), seq 123897:131617, ack 906, win 512, options [nop,nop,TS val 1322391649 ecr 1322391649], length 7720
2022-02-28 12:54:07.426058 IP (tos 0x0, ttl 64, id 34575, offset 0, flags [DF], proto TCP (6), length 52)
    127.0.0.1.37242 > 127.0.0.1.9450: Flags [.], cksum 0xfe28 (incorrect -> 0x29d3), seq 906, ack 131617, win 512, options [nop,nop,TS val 1322391649 ecr 1322391649], length 0
2022-02-28 12:54:07.463018 IP (tos 0x0, ttl 64, id 8565, offset 0, flags [DF], proto TCP (6), length 4100)
    127.0.0.1.9450 > 127.0.0.1.37242: Flags [P.], cksum 0x0df9 (incorrect -> 0x0fd6), seq 131617:135665, ack 906, win 512, options [nop,nop,TS val 1322391686 ecr 1322391649], length 4048
2022-02-28 12:54:07.463077 IP (tos 0x0, ttl 64, id 34576, offset 0, flags [DF], proto TCP (6), length 52)
    127.0.0.1.37242 > 127.0.0.1.9450: Flags [.], cksum 0xfe28 (incorrect -> 0x19b9), seq 906, ack 135665, win 512, options [nop,nop,TS val 1322391686 ecr 1322391686], length 0
2022-02-28 12:54:07.463088 IP (tos 0x0, ttl 64, id 8566, offset 0, flags [DF], proto TCP (6), length 7458)
    127.0.0.1.9450 > 127.0.0.1.37242: Flags [P.], cksum 0x1b17 (incorrect -> 0x65b8), seq 135665:143071, ack 906, win 512, options [nop,nop,TS val 1322391686 ecr 1322391686], length 7406
2022-02-28 12:54:07.463316 IP (tos 0x0, ttl 64, id 34577, offset 0, flags [DF], proto TCP (6), length 52)
    127.0.0.1.37242 > 127.0.0.1.9450: Flags [.], cksum 0xfe28 (incorrect -> 0xfcca), seq 906, ack 143071, win 512, options [nop,nop,TS val 1322391686 ecr 1322391686], length 0
2022-02-28 12:54:07.464260 IP (tos 0x0, ttl 64, id 8567, offset 0, flags [DF], proto TCP (6), length 3538)
    127.0.0.1.9450 > 127.0.0.1.37242: Flags [P.], cksum 0x0bc7 (incorrect -> 0xaa10), seq 143071:146557, ack 906, win 512, options [nop,nop,TS val 1322391687 ecr 1322391686], length 3486
2022-02-28 12:54:07.464331 IP (tos 0x0, ttl 64, id 34578, offset 0, flags [DF], proto TCP (6), length 52)
    127.0.0.1.37242 > 127.0.0.1.9450: Flags [.], cksum 0xfe28 (incorrect -> 0xef2a), seq 906, ack 146557, win 512, options [nop,nop,TS val 1322391687 ecr 1322391687], length 0
2022-02-28 12:54:07.464351 IP (tos 0x0, ttl 64, id 8568, offset 0, flags [DF], proto TCP (6), length 8020)
    127.0.0.1.9450 > 127.0.0.1.37242: Flags [P.], cksum 0x1d49 (incorrect -> 0x4818), seq 146557:154525, ack 906, win 512, options [nop,nop,TS val 1322391687 ecr 1322391687], length 7968
2022-02-28 12:54:07.464543 IP (tos 0x0, ttl 64, id 34579, offset 0, flags [DF], proto TCP (6), length 52)
    127.0.0.1.37242 > 127.0.0.1.9450: Flags [.], cksum 0xfe28 (incorrect -> 0xd009), seq 906, ack 154525, win 512, options [nop,nop,TS val 1322391688 ecr 1322391687], length 0
200, 4.64993691444397, 1.258556604385376