2022-02-28 07:51:36.826597 IP (tos 0x0, ttl 64, id 49171, offset 0, flags [DF], proto TCP (6), length 60)
    127.0.0.1.52818 > 127.0.0.1.10450: Flags [S], cksum 0xfe30 (incorrect -> 0xfb77), seq 1543016469, win 65495, options [mss 65495,sackOK,TS val 1304241050 ecr 0,nop,wscale 7], length 0
2022-02-28 07:51:36.826618 IP (tos 0x0, ttl 64, id 0, offset 0, flags [DF], proto TCP (6), length 60)
    127.0.0.1.10450 > 127.0.0.1.52818: Flags [S.], cksum 0xfe30 (incorrect -> 0x075a), seq 652827608, ack 1543016470, win 65483, options [mss 65495,sackOK,TS val 1304241050 ecr 1304241050,nop,wscale 7], length 0
2022-02-28 07:51:36.826632 IP (tos 0x0, ttl 64, id 49172, offset 0, flags [DF], proto TCP (6), length 52)
    127.0.0.1.52818 > 127.0.0.1.10450: Flags [.], cksum 0xfe28 (incorrect -> 0x2e16), seq 1, ack 1, win 512, options [nop,nop,TS val 1304241050 ecr 1304241050], length 0
2022-02-28 07:51:36.826759 IP (tos 0x0, ttl 64, id 49173, offset 0, flags [DF], proto TCP (6), length 55)
    127.0.0.1.52818 > 127.0.0.1.10450: Flags [P.], cksum 0xfe2b (incorrect -> 0x290a), seq 1:4, ack 1, win 512, options [nop,nop,TS val 1304241050 ecr 1304241050], length 3
2022-02-28 07:51:36.826773 IP (tos 0x0, ttl 64, id 16271, offset 0, flags [DF], proto TCP (6), length 52)
    127.0.0.1.10450 > 127.0.0.1.52818: Flags [.], cksum 0xfe28 (incorrect -> 0x2e13), seq 1, ack 4, win 512, options [nop,nop,TS val 1304241050 ecr 1304241050], length 0
2022-02-28 07:51:36.826812 IP (tos 0x0, ttl 64, id 16272, offset 0, flags [DF], proto TCP (6), length 54)
    127.0.0.1.10450 > 127.0.0.1.52818: Flags [P.], cksum 0xfe2a (incorrect -> 0x2909), seq 1:3, ack 4, win 512, options [nop,nop,TS val 1304241050 ecr 1304241050], length 2
2022-02-28 07:51:36.826823 IP (tos 0x0, ttl 64, id 49174, offset 0, flags [DF], proto TCP (6), length 52)
    127.0.0.1.52818 > 127.0.0.1.10450: Flags [.], cksum 0xfe28 (incorrect -> 0x2e11), seq 4, ack 3, win 512, options [nop,nop,TS val 1304241050 ecr 1304241050], length 0
2022-02-28 07:51:36.828323 IP (tos 0x0, ttl 64, id 49175, offset 0, flags [DF], proto TCP (6), length 62)
    127.0.0.1.52818 > 127.0.0.1.10450: Flags [P.], cksum 0xfe32 (incorrect -> 0xfa51), seq 4:14, ack 3, win 512, options [nop,nop,TS val 1304241051 ecr 1304241050], length 10
2022-02-28 07:51:36.828342 IP (tos 0x0, ttl 64, id 16273, offset 0, flags [DF], proto TCP (6), length 52)
    127.0.0.1.10450 > 127.0.0.1.52818: Flags [.], cksum 0xfe28 (incorrect -> 0x2e05), seq 3, ack 14, win 512, options [nop,nop,TS val 1304241051 ecr 1304241051], length 0
2022-02-28 07:51:46.560507 IP (tos 0x0, ttl 64, id 16274, offset 0, flags [DF], proto TCP (6), length 62)
    127.0.0.1.10450 > 127.0.0.1.52818: Flags [P.], cksum 0xfe32 (incorrect -> 0x02ed), seq 3:13, ack 14, win 512, options [nop,nop,TS val 1304250784 ecr 1304241051], length 10
2022-02-28 07:51:46.560518 IP (tos 0x0, ttl 64, id 49176, offset 0, flags [DF], proto TCP (6), length 52)
    127.0.0.1.52818 > 127.0.0.1.10450: Flags [.], cksum 0xfe28 (incorrect -> 0xe1f0), seq 14, ack 13, win 512, options [nop,nop,TS val 1304250784 ecr 1304250784], length 0
2022-02-28 07:51:46.566851 IP (tos 0x0, ttl 64, id 49177, offset 0, flags [DF], proto TCP (6), length 569)
    127.0.0.1.52818 > 127.0.0.1.10450: Flags [P.], cksum 0x002e (incorrect -> 0x3da3), seq 14:531, ack 13, win 512, options [nop,nop,TS val 1304250790 ecr 1304250784], length 517
2022-02-28 07:51:46.566867 IP (tos 0x0, ttl 64, id 16275, offset 0, flags [DF], proto TCP (6), length 52)
    127.0.0.1.10450 > 127.0.0.1.52818: Flags [.], cksum 0xfe28 (incorrect -> 0xdfe3), seq 13, ack 531, win 508, options [nop,nop,TS val 1304250790 ecr 1304250790], length 0
2022-02-28 07:51:46.722461 IP (tos 0x0, ttl 64, id 16276, offset 0, flags [DF], proto TCP (6), length 3538)
    127.0.0.1.10450 > 127.0.0.1.52818: Flags [P.], cksum 0x0bc7 (incorrect -> 0x2021), seq 13:3499, ack 531, win 512, options [nop,nop,TS val 1304250946 ecr 1304250790], length 3486
2022-02-28 07:51:46.722473 IP (tos 0x0, ttl 64, id 49178, offset 0, flags [DF], proto TCP (6), length 52)
    127.0.0.1.52818 > 127.0.0.1.10450: Flags [.], cksum 0xfe28 (incorrect -> 0xd11b), seq 531, ack 3499, win 494, options [nop,nop,TS val 1304250946 ecr 1304250946], length 0
2022-02-28 07:51:46.774184 IP (tos 0x0, ttl 64, id 16277, offset 0, flags [DF], proto TCP (6), length 1334)
    127.0.0.1.10450 > 127.0.0.1.52818: Flags [P.], cksum 0x032b (incorrect -> 0xc48c), seq 3499:4781, ack 531, win 512, options [nop,nop,TS val 1304250997 ecr 1304250946], length 1282
2022-02-28 07:51:46.774193 IP (tos 0x0, ttl 64, id 49179, offset 0, flags [DF], proto TCP (6), length 52)
    127.0.0.1.52818 > 127.0.0.1.10450: Flags [.], cksum 0xfe28 (incorrect -> 0xcbab), seq 531, ack 4781, win 502, options [nop,nop,TS val 1304250997 ecr 1304250997], length 0
2022-02-28 07:51:46.774688 IP (tos 0x0, ttl 64, id 49180, offset 0, flags [DF], proto TCP (6), length 116)
    127.0.0.1.52818 > 127.0.0.1.10450: Flags [P.], cksum 0xfe68 (incorrect -> 0xa42f), seq 531:595, ack 4781, win 512, options [nop,nop,TS val 1304250998 ecr 1304250997], length 64
2022-02-28 07:51:46.774695 IP (tos 0x0, ttl 64, id 16278, offset 0, flags [DF], proto TCP (6), length 52)
    127.0.0.1.10450 > 127.0.0.1.52818: Flags [.], cksum 0xfe28 (incorrect -> 0xcb5f), seq 4781, ack 595, win 512, options [nop,nop,TS val 1304250998 ecr 1304250998], length 0
2022-02-28 07:51:46.775080 IP (tos 0x0, ttl 64, id 49181, offset 0, flags [DF], proto TCP (6), length 319)
    127.0.0.1.52818 > 127.0.0.1.10450: Flags [P.], cksum 0xff33 (incorrect -> 0x4ace), seq 595:862, ack 4781, win 512, options [nop,nop,TS val 1304250998 ecr 1304250998], length 267
2022-02-28 07:51:46.775084 IP (tos 0x0, ttl 64, id 16279, offset 0, flags [DF], proto TCP (6), length 52)
    127.0.0.1.10450 > 127.0.0.1.52818: Flags [.], cksum 0xfe28 (incorrect -> 0xca56), seq 4781, ack 862, win 510, options [nop,nop,TS val 1304250998 ecr 1304250998], length 0
2022-02-28 07:51:46.923748 IP (tos 0x0, ttl 64, id 16280, offset 0, flags [DF], proto TCP (6), length 3538)
    127.0.0.1.10450 > 127.0.0.1.52818: Flags [P.], cksum 0x0bc7 (incorrect -> 0xf1a7), seq 4781:8267, ack 862, win 512, options [nop,nop,TS val 1304251147 ecr 1304250998], length 3486
2022-02-28 07:51:46.923761 IP (tos 0x0, ttl 64, id 49182, offset 0, flags [DF], proto TCP (6), length 52)
    127.0.0.1.52818 > 127.0.0.1.10450: Flags [.], cksum 0xfe28 (incorrect -> 0xbb9e), seq 862, ack 8267, win 494, options [nop,nop,TS val 1304251147 ecr 1304251147], length 0
2022-02-28 07:51:46.937734 IP (tos 0x0, ttl 64, id 16281, offset 0, flags [DF], proto TCP (6), length 4036)
    127.0.0.1.10450 > 127.0.0.1.52818: Flags [P.], cksum 0x0db9 (incorrect -> 0x2290), seq 8267:12251, ack 862, win 512, options [nop,nop,TS val 1304251161 ecr 1304251147], length 3984
2022-02-28 07:51:46.937739 IP (tos 0x0, ttl 64, id 49183, offset 0, flags [DF], proto TCP (6), length 52)
    127.0.0.1.52818 > 127.0.0.1.10450: Flags [.], cksum 0xfe28 (incorrect -> 0xabf4), seq 862, ack 12251, win 492, options [nop,nop,TS val 1304251161 ecr 1304251161], length 0
2022-02-28 07:51:46.956464 IP (tos 0x0, ttl 64, id 16282, offset 0, flags [DF], proto TCP (6), length 3538)
    127.0.0.1.10450 > 127.0.0.1.52818: Flags [P.], cksum 0x0bc7 (incorrect -> 0x0264), seq 12251:15737, ack 862, win 512, options [nop,nop,TS val 1304251180 ecr 1304251161], length 3486
2022-02-28 07:51:46.956471 IP (tos 0x0, ttl 64, id 49184, offset 0, flags [DF], proto TCP (6), length 52)
    127.0.0.1.52818 > 127.0.0.1.10450: Flags [.], cksum 0xfe28 (incorrect -> 0x9e2e), seq 862, ack 15737, win 494, options [nop,nop,TS val 1304251180 ecr 1304251180], length 0
2022-02-28 07:51:46.970791 IP (tos 0x0, ttl 64, id 16283, offset 0, flags [DF], proto TCP (6), length 550)
    127.0.0.1.10450 > 127.0.0.1.52818: Flags [P.], cksum 0x001b (incorrect -> 0xd6af), seq 15737:16235, ack 862, win 512, options [nop,nop,TS val 1304251194 ecr 1304251180], length 498
2022-02-28 07:51:46.970796 IP (tos 0x0, ttl 64, id 49185, offset 0, flags [DF], proto TCP (6), length 52)
    127.0.0.1.52818 > 127.0.0.1.10450: Flags [.], cksum 0xfe28 (incorrect -> 0x9c14), seq 862, ack 16235, win 506, options [nop,nop,TS val 1304251194 ecr 1304251194], length 0
2022-02-28 07:51:46.976995 IP (tos 0x0, ttl 64, id 16284, offset 0, flags [DF], proto TCP (6), length 3538)
    127.0.0.1.10450 > 127.0.0.1.52818: Flags [P.], cksum 0x0bc7 (incorrect -> 0x669e), seq 16235:19721, ack 862, win 512, options [nop,nop,TS val 1304251200 ecr 1304251194], length 3486
2022-02-28 07:51:46.977004 IP (tos 0x0, ttl 64, id 49186, offset 0, flags [DF], proto TCP (6), length 52)
    127.0.0.1.52818 > 127.0.0.1.10450: Flags [.], cksum 0xfe28 (incorrect -> 0x8e76), seq 862, ack 19721, win 494, options [nop,nop,TS val 1304251200 ecr 1304251200], length 0
2022-02-28 07:51:46.978561 IP (tos 0x0, ttl 64, id 16285, offset 0, flags [DF], proto TCP (6), length 3982)
    127.0.0.1.10450 > 127.0.0.1.52818: Flags [P.], cksum 0x0d83 (incorrect -> 0x4dea), seq 19721:23651, ack 862, win 512, options [nop,nop,TS val 1304251202 ecr 1304251200], length 3930
2022-02-28 07:51:46.978567 IP (tos 0x0, ttl 64, id 49187, offset 0, flags [DF], proto TCP (6), length 52)
    127.0.0.1.52818 > 127.0.0.1.10450: Flags [.], cksum 0xfe28 (incorrect -> 0x7f1a), seq 862, ack 23651, win 492, options [nop,nop,TS val 1304251202 ecr 1304251202], length 0
2022-02-28 07:51:46.985035 IP (tos 0x0, ttl 64, id 16286, offset 0, flags [DF], proto TCP (6), length 4100)
    127.0.0.1.10450 > 127.0.0.1.52818: Flags [P.], cksum 0x0df9 (incorrect -> 0x9a11), seq 23651:27699, ack 862, win 512, options [nop,nop,TS val 1304251208 ecr 1304251202], length 4048
2022-02-28 07:51:46.985046 IP (tos 0x0, ttl 64, id 49188, offset 0, flags [DF], proto TCP (6), length 52)
    127.0.0.1.52818 > 127.0.0.1.10450: Flags [.], cksum 0xfe28 (incorrect -> 0x6f3e), seq 862, ack 27699, win 492, options [nop,nop,TS val 1304251208 ecr 1304251208], length 0
2022-02-28 07:51:46.985055 IP (tos 0x0, ttl 64, id 16287, offset 0, flags [DF], proto TCP (6), length 1482)
    127.0.0.1.10450 > 127.0.0.1.52818: Flags [P.], cksum 0x03bf (incorrect -> 0x559a), seq 27699:29129, ack 862, win 512, options [nop,nop,TS val 1304251208 ecr 1304251208], length 1430
2022-02-28 07:51:46.985060 IP (tos 0x0, ttl 64, id 49189, offset 0, flags [DF], proto TCP (6), length 52)
    127.0.0.1.52818 > 127.0.0.1.10450: Flags [.], cksum 0xfe28 (incorrect -> 0x69ae), seq 862, ack 29129, win 486, options [nop,nop,TS val 1304251208 ecr 1304251208], length 0
2022-02-28 07:51:46.993641 IP (tos 0x0, ttl 64, id 16288, offset 0, flags [DF], proto TCP (6), length 3538)
    127.0.0.1.10450 > 127.0.0.1.52818: Flags [P.], cksum 0x0bc7 (incorrect -> 0x9353), seq 29129:32615, ack 862, win 512, options [nop,nop,TS val 1304251217 ecr 1304251208], length 3486
2022-02-28 07:51:46.993647 IP (tos 0x0, ttl 64, id 49190, offset 0, flags [DF], proto TCP (6), length 52)
    127.0.0.1.52818 > 127.0.0.1.10450: Flags [.], cksum 0xfe28 (incorrect -> 0x5bf6), seq 862, ack 32615, win 494, options [nop,nop,TS val 1304251217 ecr 1304251217], length 0
2022-02-28 07:51:46.998740 IP (tos 0x0, ttl 64, id 16289, offset 0, flags [DF], proto TCP (6), length 3040)
    127.0.0.1.10450 > 127.0.0.1.52818: Flags [P.], cksum 0x09d5 (incorrect -> 0xe949), seq 32615:35603, ack 862, win 512, options [nop,nop,TS val 1304251222 ecr 1304251217], length 2988
2022-02-28 07:51:46.998745 IP (tos 0x0, ttl 64, id 49191, offset 0, flags [DF], proto TCP (6), length 52)
    127.0.0.1.52818 > 127.0.0.1.10450: Flags [.], cksum 0xfe28 (incorrect -> 0x503e), seq 862, ack 35603, win 496, options [nop,nop,TS val 1304251222 ecr 1304251222], length 0
2022-02-28 07:51:47.008618 IP (tos 0x0, ttl 64, id 16290, offset 0, flags [DF], proto TCP (6), length 3538)
    127.0.0.1.10450 > 127.0.0.1.52818: Flags [P.], cksum 0x0bc7 (incorrect -> 0xece1), seq 35603:39089, ack 862, win 512, options [nop,nop,TS val 1304251232 ecr 1304251222], length 3486
2022-02-28 07:51:47.008633 IP (tos 0x0, ttl 64, id 49192, offset 0, flags [DF], proto TCP (6), length 52)
    127.0.0.1.52818 > 127.0.0.1.10450: Flags [.], cksum 0xfe28 (incorrect -> 0x427c), seq 862, ack 39089, win 512, options [nop,nop,TS val 1304251232 ecr 1304251232], length 0
2022-02-28 07:51:47.008746 IP (tos 0x0, ttl 64, id 16291, offset 0, flags [DF], proto TCP (6), length 4036)
    127.0.0.1.10450 > 127.0.0.1.52818: Flags [P.], cksum 0x0db9 (incorrect -> 0x2597), seq 39089:43073, ack 862, win 512, options [nop,nop,TS val 1304251232 ecr 1304251232], length 3984
2022-02-28 07:51:47.008757 IP (tos 0x0, ttl 64, id 49193, offset 0, flags [DF], proto TCP (6), length 52)
    127.0.0.1.52818 > 127.0.0.1.10450: Flags [.], cksum 0xfe28 (incorrect -> 0x32ec), seq 862, ack 43073, win 512, options [nop,nop,TS val 1304251232 ecr 1304251232], length 0
2022-02-28 07:51:47.023015 IP (tos 0x0, ttl 64, id 16292, offset 0, flags [DF], proto TCP (6), length 2542)
    127.0.0.1.10450 > 127.0.0.1.52818: Flags [P.], cksum 0x07e3 (incorrect -> 0x66f0), seq 43073:45563, ack 862, win 512, options [nop,nop,TS val 1304251246 ecr 1304251232], length 2490
2022-02-28 07:51:47.023027 IP (tos 0x0, ttl 64, id 49194, offset 0, flags [DF], proto TCP (6), length 52)
    127.0.0.1.52818 > 127.0.0.1.10450: Flags [.], cksum 0xfe28 (incorrect -> 0x2916), seq 862, ack 45563, win 512, options [nop,nop,TS val 1304251246 ecr 1304251246], length 0
2022-02-28 07:51:47.030702 IP (tos 0x0, ttl 64, id 16293, offset 0, flags [DF], proto TCP (6), length 3325)
    127.0.0.1.10450 > 127.0.0.1.52818: Flags [P.], cksum 0x0af2 (incorrect -> 0xcd6c), seq 45563:48836, ack 862, win 512, options [nop,nop,TS val 1304251254 ecr 1304251246], length 3273
2022-02-28 07:51:47.030718 IP (tos 0x0, ttl 64, id 49195, offset 0, flags [DF], proto TCP (6), length 52)
    127.0.0.1.52818 > 127.0.0.1.10450: Flags [.], cksum 0xfe28 (incorrect -> 0x1c3d), seq 862, ack 48836, win 512, options [nop,nop,TS val 1304251254 ecr 1304251254], length 0
2022-02-28 07:51:47.032385 IP (tos 0x0, ttl 64, id 16294, offset 0, flags [DF], proto TCP (6), length 4036)
    127.0.0.1.10450 > 127.0.0.1.52818: Flags [P.], cksum 0x0db9 (incorrect -> 0x7c7a), seq 48836:52820, ack 862, win 512, options [nop,nop,TS val 1304251255 ecr 1304251254], length 3984
2022-02-28 07:51:47.032785 IP (tos 0x0, ttl 64, id 49196, offset 0, flags [DF], proto TCP (6), length 52)
    127.0.0.1.52818 > 127.0.0.1.10450: Flags [.], cksum 0xfe28 (incorrect -> 0x0caa), seq 862, ack 52820, win 512, options [nop,nop,TS val 1304251256 ecr 1304251255], length 0
2022-02-28 07:51:47.036150 IP (tos 0x0, ttl 64, id 16295, offset 0, flags [DF], proto TCP (6), length 4100)
    127.0.0.1.10450 > 127.0.0.1.52818: Flags [P.], cksum 0x0df9 (incorrect -> 0x5296), seq 52820:56868, ack 862, win 512, options [nop,nop,TS val 1304251259 ecr 1304251256], length 4048
2022-02-28 07:51:47.053222 IP (tos 0x0, ttl 64, id 16296, offset 0, flags [DF], proto TCP (6), length 32820)
    127.0.0.1.10450 > 127.0.0.1.52818: Flags [.], cksum 0x7e29 (incorrect -> 0xd6c6), seq 56868:89636, ack 862, win 512, options [nop,nop,TS val 1304251276 ecr 1304251256], length 32768
2022-02-28 07:51:47.053240 IP (tos 0x0, ttl 64, id 49197, offset 0, flags [DF], proto TCP (6), length 52)
    127.0.0.1.52818 > 127.0.0.1.10450: Flags [.], cksum 0xfe28 (incorrect -> 0x7d46), seq 862, ack 89636, win 379, options [nop,nop,TS val 1304251276 ecr 1304251259], length 0
2022-02-28 07:51:47.053251 IP (tos 0x0, ttl 64, id 16297, offset 0, flags [DF], proto TCP (6), length 2466)
    127.0.0.1.10450 > 127.0.0.1.52818: Flags [P.], cksum 0x0797 (incorrect -> 0xc8e0), seq 89636:92050, ack 862, win 512, options [nop,nop,TS val 1304251276 ecr 1304251276], length 2414
2022-02-28 07:51:47.053982 IP (tos 0x0, ttl 64, id 49198, offset 0, flags [DF], proto TCP (6), length 52)
    127.0.0.1.52818 > 127.0.0.1.10450: Flags [.], cksum 0xfe28 (incorrect -> 0x7341), seq 862, ack 92050, win 512, options [nop,nop,TS val 1304251277 ecr 1304251276], length 0
2022-02-28 07:51:47.054026 IP (tos 0x0, ttl 64, id 16298, offset 0, flags [DF], proto TCP (6), length 3538)
    127.0.0.1.10450 > 127.0.0.1.52818: Flags [P.], cksum 0x0bc7 (incorrect -> 0xbe8d), seq 92050:95536, ack 862, win 512, options [nop,nop,TS val 1304251277 ecr 1304251277], length 3486
2022-02-28 07:51:47.054038 IP (tos 0x0, ttl 64, id 49199, offset 0, flags [DF], proto TCP (6), length 52)
    127.0.0.1.52818 > 127.0.0.1.10450: Flags [.], cksum 0xfe28 (incorrect -> 0x65a2), seq 862, ack 95536, win 512, options [nop,nop,TS val 1304251277 ecr 1304251277], length 0
2022-02-28 07:51:47.065076 IP (tos 0x0, ttl 64, id 16299, offset 0, flags [DF], proto TCP (6), length 1048)
    127.0.0.1.10450 > 127.0.0.1.52818: Flags [P.], cksum 0x020d (incorrect -> 0x3de4), seq 95536:96532, ack 862, win 512, options [nop,nop,TS val 1304251288 ecr 1304251277], length 996
2022-02-28 07:51:47.065087 IP (tos 0x0, ttl 64, id 49200, offset 0, flags [DF], proto TCP (6), length 52)
    127.0.0.1.52818 > 127.0.0.1.10450: Flags [.], cksum 0xfe28 (incorrect -> 0x61a8), seq 862, ack 96532, win 512, options [nop,nop,TS val 1304251288 ecr 1304251288], length 0
2022-02-28 07:51:47.082678 IP (tos 0x0, ttl 64, id 16300, offset 0, flags [DF], proto TCP (6), length 3538)
    127.0.0.1.10450 > 127.0.0.1.52818: Flags [P.], cksum 0x0bc7 (incorrect -> 0x999d), seq 96532:100018, ack 862, win 512, options [nop,nop,TS val 1304251306 ecr 1304251288], length 3486
2022-02-28 07:51:47.082695 IP (tos 0x0, ttl 64, id 49201, offset 0, flags [DF], proto TCP (6), length 52)
    127.0.0.1.52818 > 127.0.0.1.10450: Flags [.], cksum 0xfe28 (incorrect -> 0x53e6), seq 862, ack 100018, win 512, options [nop,nop,TS val 1304251306 ecr 1304251306], length 0
2022-02-28 07:51:47.083658 IP (tos 0x0, ttl 64, id 16301, offset 0, flags [DF], proto TCP (6), length 550)
    127.0.0.1.10450 > 127.0.0.1.52818: Flags [P.], cksum 0x001b (incorrect -> 0xd79d), seq 100018:100516, ack 862, win 512, options [nop,nop,TS val 1304251307 ecr 1304251306], length 498
2022-02-28 07:51:47.083681 IP (tos 0x0, ttl 64, id 49202, offset 0, flags [DF], proto TCP (6), length 52)
    127.0.0.1.52818 > 127.0.0.1.10450: Flags [.], cksum 0xfe28 (incorrect -> 0x51f2), seq 862, ack 100516, win 512, options [nop,nop,TS val 1304251307 ecr 1304251307], length 0
2022-02-28 07:51:47.085060 IP (tos 0x0, ttl 64, id 16302, offset 0, flags [DF], proto TCP (6), length 4100)
    127.0.0.1.10450 > 127.0.0.1.52818: Flags [P.], cksum 0x0df9 (incorrect -> 0xf4bb), seq 100516:104564, ack 862, win 512, options [nop,nop,TS val 1304251308 ecr 1304251307], length 4048
2022-02-28 07:51:47.085080 IP (tos 0x0, ttl 64, id 49203, offset 0, flags [DF], proto TCP (6), length 52)
    127.0.0.1.52818 > 127.0.0.1.10450: Flags [.], cksum 0xfe28 (incorrect -> 0x4220), seq 862, ack 104564, win 512, options [nop,nop,TS val 1304251308 ecr 1304251308], length 0
2022-02-28 07:51:47.085084 IP (tos 0x0, ttl 64, id 16303, offset 0, flags [DF], proto TCP (6), length 2976)
    127.0.0.1.10450 > 127.0.0.1.52818: Flags [P.], cksum 0x0995 (incorrect -> 0xa901), seq 104564:107488, ack 862, win 512, options [nop,nop,TS val 1304251308 ecr 1304251308], length 2924
2022-02-28 07:51:47.085263 IP (tos 0x0, ttl 64, id 49204, offset 0, flags [DF], proto TCP (6), length 52)
    127.0.0.1.52818 > 127.0.0.1.10450: Flags [.], cksum 0xfe28 (incorrect -> 0x36b4), seq 862, ack 107488, win 512, options [nop,nop,TS val 1304251308 ecr 1304251308], length 0
2022-02-28 07:51:47.085316 IP (tos 0x0, ttl 64, id 16304, offset 0, flags [DF], proto TCP (6), length 4100)
    127.0.0.1.10450 > 127.0.0.1.52818: Flags [P.], cksum 0x0df9 (incorrect -> 0x797a), seq 107488:111536, ack 862, win 512, options [nop,nop,TS val 1304251308 ecr 1304251308], length 4048
2022-02-28 07:51:47.085332 IP (tos 0x0, ttl 64, id 49205, offset 0, flags [DF], proto TCP (6), length 52)
    127.0.0.1.52818 > 127.0.0.1.10450: Flags [.], cksum 0xfe28 (incorrect -> 0x26e4), seq 862, ack 111536, win 512, options [nop,nop,TS val 1304251308 ecr 1304251308], length 0
2022-02-28 07:51:47.085336 IP (tos 0x0, ttl 64, id 16305, offset 0, flags [DF], proto TCP (6), length 3972)
    127.0.0.1.10450 > 127.0.0.1.52818: Flags [P.], cksum 0x0d79 (incorrect -> 0x295c), seq 111536:115456, ack 862, win 512, options [nop,nop,TS val 1304251308 ecr 1304251308], length 3920
2022-02-28 07:51:47.085339 IP (tos 0x0, ttl 64, id 49206, offset 0, flags [DF], proto TCP (6), length 52)
    127.0.0.1.52818 > 127.0.0.1.10450: Flags [.], cksum 0xfe28 (incorrect -> 0x1794), seq 862, ack 115456, win 512, options [nop,nop,TS val 1304251308 ecr 1304251308], length 0
2022-02-28 07:51:47.086841 IP (tos 0x0, ttl 64, id 16306, offset 0, flags [DF], proto TCP (6), length 1048)
    127.0.0.1.10450 > 127.0.0.1.52818: Flags [P.], cksum 0x020d (incorrect -> 0x335e), seq 115456:116452, ack 862, win 512, options [nop,nop,TS val 1304251310 ecr 1304251308], length 996
2022-02-28 07:51:47.086855 IP (tos 0x0, ttl 64, id 49207, offset 0, flags [DF], proto TCP (6), length 52)
    127.0.0.1.52818 > 127.0.0.1.10450: Flags [.], cksum 0xfe28 (incorrect -> 0x13ac), seq 862, ack 116452, win 512, options [nop,nop,TS val 1304251310 ecr 1304251310], length 0
200, 5.9827985763549805, 10.417192220687866