2022-02-28 07:05:29.662632 IP (tos 0x0, ttl 64, id 24071, offset 0, flags [DF], proto TCP (6), length 60)
    127.0.0.1.50260 > 127.0.0.1.10750: Flags [S], cksum 0xfe30 (incorrect -> 0x8ff4), seq 1397114499, win 65495, options [mss 65495,sackOK,TS val 1301473886 ecr 0,nop,wscale 7], length 0
2022-02-28 07:05:29.662642 IP (tos 0x0, ttl 64, id 0, offset 0, flags [DF], proto TCP (6), length 60)
    127.0.0.1.10750 > 127.0.0.1.50260: Flags [S.], cksum 0xfe30 (incorrect -> 0x1aba), seq 3306256434, ack 1397114500, win 65483, options [mss 65495,sackOK,TS val 1301473886 ecr 1301473886,nop,wscale 7], length 0
2022-02-28 07:05:29.662649 IP (tos 0x0, ttl 64, id 24072, offset 0, flags [DF], proto TCP (6), length 52)
    127.0.0.1.50260 > 127.0.0.1.10750: Flags [.], cksum 0xfe28 (incorrect -> 0x4176), seq 1, ack 1, win 512, options [nop,nop,TS val 1301473886 ecr 1301473886], length 0
2022-02-28 07:05:29.662758 IP (tos 0x0, ttl 64, id 24073, offset 0, flags [DF], proto TCP (6), length 55)
    127.0.0.1.50260 > 127.0.0.1.10750: Flags [P.], cksum 0xfe2b (incorrect -> 0x3c6a), seq 1:4, ack 1, win 512, options [nop,nop,TS val 1301473886 ecr 1301473886], length 3
2022-02-28 07:05:29.662771 IP (tos 0x0, ttl 64, id 7839, offset 0, flags [DF], proto TCP (6), length 52)
    127.0.0.1.10750 > 127.0.0.1.50260: Flags [.], cksum 0xfe28 (incorrect -> 0x4173), seq 1, ack 4, win 512, options [nop,nop,TS val 1301473886 ecr 1301473886], length 0
2022-02-28 07:05:29.662819 IP (tos 0x0, ttl 64, id 7840, offset 0, flags [DF], proto TCP (6), length 54)
    127.0.0.1.10750 > 127.0.0.1.50260: Flags [P.], cksum 0xfe2a (incorrect -> 0x3c69), seq 1:3, ack 4, win 512, options [nop,nop,TS val 1301473886 ecr 1301473886], length 2
2022-02-28 07:05:29.662839 IP (tos 0x0, ttl 64, id 24074, offset 0, flags [DF], proto TCP (6), length 52)
    127.0.0.1.50260 > 127.0.0.1.10750: Flags [.], cksum 0xfe28 (incorrect -> 0x4171), seq 4, ack 3, win 512, options [nop,nop,TS val 1301473886 ecr 1301473886], length 0
2022-02-28 07:05:29.665248 IP (tos 0x0, ttl 64, id 24075, offset 0, flags [DF], proto TCP (6), length 62)
    127.0.0.1.50260 > 127.0.0.1.10750: Flags [P.], cksum 0xfe32 (incorrect -> 0xa6ea), seq 4:14, ack 3, win 512, options [nop,nop,TS val 1301473888 ecr 1301473886], length 10
2022-02-28 07:05:29.665272 IP (tos 0x0, ttl 64, id 7841, offset 0, flags [DF], proto TCP (6), length 52)
    127.0.0.1.10750 > 127.0.0.1.50260: Flags [.], cksum 0xfe28 (incorrect -> 0x4163), seq 3, ack 14, win 512, options [nop,nop,TS val 1301473888 ecr 1301473888], length 0
2022-02-28 07:05:29.870454 IP (tos 0x0, ttl 64, id 7842, offset 0, flags [DF], proto TCP (6), length 62)
    127.0.0.1.10750 > 127.0.0.1.50260: Flags [P.], cksum 0xfe32 (incorrect -> 0x3b82), seq 3:13, ack 14, win 512, options [nop,nop,TS val 1301474094 ecr 1301473888], length 10
2022-02-28 07:05:29.870470 IP (tos 0x0, ttl 64, id 24076, offset 0, flags [DF], proto TCP (6), length 52)
    127.0.0.1.50260 > 127.0.0.1.10750: Flags [.], cksum 0xfe28 (incorrect -> 0x3fbd), seq 14, ack 13, win 512, options [nop,nop,TS val 1301474094 ecr 1301474094], length 0
2022-02-28 07:05:29.876640 IP (tos 0x0, ttl 64, id 24077, offset 0, flags [DF], proto TCP (6), length 569)
    127.0.0.1.50260 > 127.0.0.1.10750: Flags [P.], cksum 0x002e (incorrect -> 0x1ab5), seq 14:531, ack 13, win 512, options [nop,nop,TS val 1301474100 ecr 1301474094], length 517
2022-02-28 07:05:29.876647 IP (tos 0x0, ttl 64, id 7843, offset 0, flags [DF], proto TCP (6), length 52)
    127.0.0.1.10750 > 127.0.0.1.50260: Flags [.], cksum 0xfe28 (incorrect -> 0x3db0), seq 13, ack 531, win 508, options [nop,nop,TS val 1301474100 ecr 1301474100], length 0
2022-02-28 07:05:30.027547 IP (tos 0x0, ttl 64, id 7844, offset 0, flags [DF], proto TCP (6), length 3497)
    127.0.0.1.10750 > 127.0.0.1.50260: Flags [P.], cksum 0x0b9e (incorrect -> 0x8fbb), seq 13:3458, ack 531, win 512, options [nop,nop,TS val 1301474251 ecr 1301474100], length 3445
2022-02-28 07:05:30.027559 IP (tos 0x0, ttl 64, id 24078, offset 0, flags [DF], proto TCP (6), length 52)
    127.0.0.1.50260 > 127.0.0.1.10750: Flags [.], cksum 0xfe28 (incorrect -> 0x2f1b), seq 531, ack 3458, win 494, options [nop,nop,TS val 1301474251 ecr 1301474251], length 0
2022-02-28 07:05:30.028008 IP (tos 0x0, ttl 64, id 24079, offset 0, flags [DF], proto TCP (6), length 132)
    127.0.0.1.50260 > 127.0.0.1.10750: Flags [P.], cksum 0xfe78 (incorrect -> 0xa7cb), seq 531:611, ack 3458, win 512, options [nop,nop,TS val 1301474251 ecr 1301474251], length 80
2022-02-28 07:05:30.028015 IP (tos 0x0, ttl 64, id 7845, offset 0, flags [DF], proto TCP (6), length 52)
    127.0.0.1.10750 > 127.0.0.1.50260: Flags [.], cksum 0xfe28 (incorrect -> 0x2eb9), seq 3458, ack 611, win 512, options [nop,nop,TS val 1301474251 ecr 1301474251], length 0
2022-02-28 07:05:30.028352 IP (tos 0x0, ttl 64, id 24080, offset 0, flags [DF], proto TCP (6), length 278)
    127.0.0.1.50260 > 127.0.0.1.10750: Flags [P.], cksum 0xff0a (incorrect -> 0x5a34), seq 611:837, ack 3458, win 512, options [nop,nop,TS val 1301474251 ecr 1301474251], length 226
2022-02-28 07:05:30.028356 IP (tos 0x0, ttl 64, id 7846, offset 0, flags [DF], proto TCP (6), length 52)
    127.0.0.1.10750 > 127.0.0.1.50260: Flags [.], cksum 0xfe28 (incorrect -> 0x2dd8), seq 3458, ack 837, win 511, options [nop,nop,TS val 1301474251 ecr 1301474251], length 0
2022-02-28 07:05:30.185163 IP (tos 0x0, ttl 64, id 7847, offset 0, flags [DF], proto TCP (6), length 844)
    127.0.0.1.10750 > 127.0.0.1.50260: Flags [P.], cksum 0x0141 (incorrect -> 0xd7b1), seq 3458:4250, ack 837, win 512, options [nop,nop,TS val 1301474408 ecr 1301474251], length 792
2022-02-28 07:05:30.185169 IP (tos 0x0, ttl 64, id 24081, offset 0, flags [DF], proto TCP (6), length 52)
    127.0.0.1.50260 > 127.0.0.1.10750: Flags [.], cksum 0xfe28 (incorrect -> 0x298b), seq 837, ack 4250, win 506, options [nop,nop,TS val 1301474408 ecr 1301474408], length 0
2022-02-28 07:05:30.187461 IP (tos 0x0, ttl 64, id 28961, offset 0, flags [DF], proto TCP (6), length 60)
    127.0.0.1.50262 > 127.0.0.1.10750: Flags [S], cksum 0xfe30 (incorrect -> 0x2254), seq 820302966, win 65495, options [mss 65495,sackOK,TS val 1301474411 ecr 0,nop,wscale 7], length 0
2022-02-28 07:05:30.187471 IP (tos 0x0, ttl 64, id 0, offset 0, flags [DF], proto TCP (6), length 60)
    127.0.0.1.10750 > 127.0.0.1.50262: Flags [S.], cksum 0xfe30 (incorrect -> 0x80c4), seq 134307723, ack 820302967, win 65483, options [mss 65495,sackOK,TS val 1301474411 ecr 1301474411,nop,wscale 7], length 0
2022-02-28 07:05:30.187477 IP (tos 0x0, ttl 64, id 28962, offset 0, flags [DF], proto TCP (6), length 52)
    127.0.0.1.50262 > 127.0.0.1.10750: Flags [.], cksum 0xfe28 (incorrect -> 0xa780), seq 1, ack 1, win 512, options [nop,nop,TS val 1301474411 ecr 1301474411], length 0
2022-02-28 07:05:30.187556 IP (tos 0x0, ttl 64, id 28963, offset 0, flags [DF], proto TCP (6), length 55)
    127.0.0.1.50262 > 127.0.0.1.10750: Flags [P.], cksum 0xfe2b (incorrect -> 0xa274), seq 1:4, ack 1, win 512, options [nop,nop,TS val 1301474411 ecr 1301474411], length 3
2022-02-28 07:05:30.187560 IP (tos 0x0, ttl 64, id 12255, offset 0, flags [DF], proto TCP (6), length 52)
    127.0.0.1.10750 > 127.0.0.1.50262: Flags [.], cksum 0xfe28 (incorrect -> 0xa77d), seq 1, ack 4, win 512, options [nop,nop,TS val 1301474411 ecr 1301474411], length 0
2022-02-28 07:05:30.187575 IP (tos 0x0, ttl 64, id 12256, offset 0, flags [DF], proto TCP (6), length 54)
    127.0.0.1.10750 > 127.0.0.1.50262: Flags [P.], cksum 0xfe2a (incorrect -> 0xa273), seq 1:3, ack 4, win 512, options [nop,nop,TS val 1301474411 ecr 1301474411], length 2
2022-02-28 07:05:30.187581 IP (tos 0x0, ttl 64, id 28964, offset 0, flags [DF], proto TCP (6), length 52)
    127.0.0.1.50262 > 127.0.0.1.10750: Flags [.], cksum 0xfe28 (incorrect -> 0xa77b), seq 4, ack 3, win 512, options [nop,nop,TS val 1301474411 ecr 1301474411], length 0
2022-02-28 07:05:30.188730 IP (tos 0x0, ttl 64, id 28965, offset 0, flags [DF], proto TCP (6), length 62)
    127.0.0.1.50262 > 127.0.0.1.10750: Flags [P.], cksum 0xfe32 (incorrect -> 0x0cf6), seq 4:14, ack 3, win 512, options [nop,nop,TS val 1301474412 ecr 1301474411], length 10
2022-02-28 07:05:30.188744 IP (tos 0x0, ttl 64, id 12257, offset 0, flags [DF], proto TCP (6), length 52)
    127.0.0.1.10750 > 127.0.0.1.50262: Flags [.], cksum 0xfe28 (incorrect -> 0xa76f), seq 3, ack 14, win 512, options [nop,nop,TS val 1301474412 ecr 1301474412], length 0
2022-02-28 07:05:30.401545 IP (tos 0x0, ttl 64, id 12258, offset 0, flags [DF], proto TCP (6), length 62)
    127.0.0.1.10750 > 127.0.0.1.50262: Flags [P.], cksum 0xfe32 (incorrect -> 0xa187), seq 3:13, ack 14, win 512, options [nop,nop,TS val 1301474625 ecr 1301474412], length 10
2022-02-28 07:05:30.401554 IP (tos 0x0, ttl 64, id 28966, offset 0, flags [DF], proto TCP (6), length 52)
    127.0.0.1.50262 > 127.0.0.1.10750: Flags [.], cksum 0xfe28 (incorrect -> 0xa5bb), seq 14, ack 13, win 512, options [nop,nop,TS val 1301474625 ecr 1301474625], length 0
2022-02-28 07:05:30.407119 IP (tos 0x0, ttl 64, id 28967, offset 0, flags [DF], proto TCP (6), length 569)
    127.0.0.1.50262 > 127.0.0.1.10750: Flags [P.], cksum 0x002e (incorrect -> 0x3258), seq 14:531, ack 13, win 512, options [nop,nop,TS val 1301474630 ecr 1301474625], length 517
2022-02-28 07:05:30.407127 IP (tos 0x0, ttl 64, id 12259, offset 0, flags [DF], proto TCP (6), length 52)
    127.0.0.1.10750 > 127.0.0.1.50262: Flags [.], cksum 0xfe28 (incorrect -> 0xa3b0), seq 13, ack 531, win 508, options [nop,nop,TS val 1301474630 ecr 1301474630], length 0
2022-02-28 07:05:30.558791 IP (tos 0x0, ttl 64, id 12260, offset 0, flags [DF], proto TCP (6), length 3497)
    127.0.0.1.10750 > 127.0.0.1.50262: Flags [P.], cksum 0x0b9e (incorrect -> 0x42d4), seq 13:3458, ack 531, win 512, options [nop,nop,TS val 1301474782 ecr 1301474630], length 3445
2022-02-28 07:05:30.558798 IP (tos 0x0, ttl 64, id 28968, offset 0, flags [DF], proto TCP (6), length 52)
    127.0.0.1.50262 > 127.0.0.1.10750: Flags [.], cksum 0xfe28 (incorrect -> 0x9519), seq 531, ack 3458, win 494, options [nop,nop,TS val 1301474782 ecr 1301474782], length 0
2022-02-28 07:05:30.559275 IP (tos 0x0, ttl 64, id 28969, offset 0, flags [DF], proto TCP (6), length 132)
    127.0.0.1.50262 > 127.0.0.1.10750: Flags [P.], cksum 0xfe78 (incorrect -> 0x52c7), seq 531:611, ack 3458, win 512, options [nop,nop,TS val 1301474782 ecr 1301474782], length 80
2022-02-28 07:05:30.559281 IP (tos 0x0, ttl 64, id 12261, offset 0, flags [DF], proto TCP (6), length 52)
    127.0.0.1.10750 > 127.0.0.1.50262: Flags [.], cksum 0xfe28 (incorrect -> 0x94b7), seq 3458, ack 611, win 512, options [nop,nop,TS val 1301474782 ecr 1301474782], length 0
2022-02-28 07:05:30.559622 IP (tos 0x0, ttl 64, id 28970, offset 0, flags [DF], proto TCP (6), length 274)
    127.0.0.1.50262 > 127.0.0.1.10750: Flags [P.], cksum 0xff06 (incorrect -> 0x8299), seq 611:833, ack 3458, win 512, options [nop,nop,TS val 1301474783 ecr 1301474782], length 222
2022-02-28 07:05:30.559625 IP (tos 0x0, ttl 64, id 12262, offset 0, flags [DF], proto TCP (6), length 52)
    127.0.0.1.10750 > 127.0.0.1.50262: Flags [.], cksum 0xfe28 (incorrect -> 0x93d8), seq 3458, ack 833, win 511, options [nop,nop,TS val 1301474783 ecr 1301474783], length 0
2022-02-28 07:05:30.743529 IP (tos 0x0, ttl 64, id 12263, offset 0, flags [DF], proto TCP (6), length 3538)
    127.0.0.1.10750 > 127.0.0.1.50262: Flags [P.], cksum 0x0bc7 (incorrect -> 0x85bf), seq 3458:6944, ack 833, win 512, options [nop,nop,TS val 1301474967 ecr 1301474783], length 3486
2022-02-28 07:05:30.743542 IP (tos 0x0, ttl 64, id 28971, offset 0, flags [DF], proto TCP (6), length 52)
    127.0.0.1.50262 > 127.0.0.1.10750: Flags [.], cksum 0xfe28 (incorrect -> 0x84db), seq 833, ack 6944, win 494, options [nop,nop,TS val 1301474967 ecr 1301474967], length 0
2022-02-28 07:05:30.759793 IP (tos 0x0, ttl 64, id 12264, offset 0, flags [DF], proto TCP (6), length 2474)
    127.0.0.1.10750 > 127.0.0.1.50262: Flags [P.], cksum 0x079f (incorrect -> 0xdc00), seq 6944:9366, ack 833, win 512, options [nop,nop,TS val 1301474983 ecr 1301474967], length 2422
2022-02-28 07:05:30.759805 IP (tos 0x0, ttl 64, id 28972, offset 0, flags [DF], proto TCP (6), length 52)
    127.0.0.1.50262 > 127.0.0.1.10750: Flags [.], cksum 0xfe28 (incorrect -> 0x7b41), seq 833, ack 9366, win 498, options [nop,nop,TS val 1301474983 ecr 1301474983], length 0
2022-02-28 07:05:30.762882 IP (tos 0x0, ttl 64, id 12265, offset 0, flags [DF], proto TCP (6), length 1190)
    127.0.0.1.10750 > 127.0.0.1.50262: Flags [P.], cksum 0x029b (incorrect -> 0xa36a), seq 9366:10504, ack 833, win 512, options [nop,nop,TS val 1301474986 ecr 1301474983], length 1138
2022-02-28 07:05:30.762890 IP (tos 0x0, ttl 64, id 28973, offset 0, flags [DF], proto TCP (6), length 52)
    127.0.0.1.50262 > 127.0.0.1.10750: Flags [.], cksum 0xfe28 (incorrect -> 0x76c4), seq 833, ack 10504, win 503, options [nop,nop,TS val 1301474986 ecr 1301474986], length 0
2022-02-28 07:05:30.776096 IP (tos 0x0, ttl 64, id 12266, offset 0, flags [DF], proto TCP (6), length 1818)
    127.0.0.1.10750 > 127.0.0.1.50262: Flags [P.], cksum 0x050f (incorrect -> 0xdecf), seq 10504:12270, ack 833, win 512, options [nop,nop,TS val 1301474999 ecr 1301474986], length 1766
2022-02-28 07:05:30.776107 IP (tos 0x0, ttl 64, id 28974, offset 0, flags [DF], proto TCP (6), length 52)
    127.0.0.1.50262 > 127.0.0.1.10750: Flags [.], cksum 0xfe28 (incorrect -> 0x6fc6), seq 833, ack 12270, win 501, options [nop,nop,TS val 1301474999 ecr 1301474999], length 0
2022-02-28 07:05:30.792369 IP (tos 0x0, ttl 64, id 12267, offset 0, flags [DF], proto TCP (6), length 1986)
    127.0.0.1.10750 > 127.0.0.1.50262: Flags [P.], cksum 0x05b7 (incorrect -> 0xbc90), seq 12270:14204, ack 833, win 512, options [nop,nop,TS val 1301475015 ecr 1301474999], length 1934
2022-02-28 07:05:30.792382 IP (tos 0x0, ttl 64, id 28975, offset 0, flags [DF], proto TCP (6), length 52)
    127.0.0.1.50262 > 127.0.0.1.10750: Flags [.], cksum 0xfe28 (incorrect -> 0x6819), seq 833, ack 14204, win 500, options [nop,nop,TS val 1301475015 ecr 1301475015], length 0
200, 50.10740423202515, 1.207416296005249