2022-02-28 05:07:29.038342 IP (tos 0x0, ttl 64, id 24237, offset 0, flags [DF], proto TCP (6), length 60)
    127.0.0.1.36758 > 127.0.0.1.9450: Flags [S], cksum 0xfe30 (incorrect -> 0xd1c8), seq 3456224994, win 65495, options [mss 65495,sackOK,TS val 1294393261 ecr 0,nop,wscale 7], length 0
2022-02-28 05:07:29.038358 IP (tos 0x0, ttl 64, id 0, offset 0, flags [DF], proto TCP (6), length 60)
    127.0.0.1.9450 > 127.0.0.1.36758: Flags [S.], cksum 0xfe30 (incorrect -> 0x6a21), seq 3650773299, ack 3456224995, win 65483, options [mss 65495,sackOK,TS val 1294393261 ecr 1294393261,nop,wscale 7], length 0
2022-02-28 05:07:29.038370 IP (tos 0x0, ttl 64, id 24238, offset 0, flags [DF], proto TCP (6), length 52)
    127.0.0.1.36758 > 127.0.0.1.9450: Flags [.], cksum 0xfe28 (incorrect -> 0x90dd), seq 1, ack 1, win 512, options [nop,nop,TS val 1294393261 ecr 1294393261], length 0
2022-02-28 05:07:29.038499 IP (tos 0x0, ttl 64, id 24239, offset 0, flags [DF], proto TCP (6), length 55)
    127.0.0.1.36758 > 127.0.0.1.9450: Flags [P.], cksum 0xfe2b (incorrect -> 0x8bd0), seq 1:4, ack 1, win 512, options [nop,nop,TS val 1294393262 ecr 1294393261], length 3
2022-02-28 05:07:29.038512 IP (tos 0x0, ttl 64, id 16693, offset 0, flags [DF], proto TCP (6), length 52)
    127.0.0.1.9450 > 127.0.0.1.36758: Flags [.], cksum 0xfe28 (incorrect -> 0x90d8), seq 1, ack 4, win 512, options [nop,nop,TS val 1294393262 ecr 1294393262], length 0
2022-02-28 05:07:29.038572 IP (tos 0x0, ttl 64, id 16694, offset 0, flags [DF], proto TCP (6), length 54)
    127.0.0.1.9450 > 127.0.0.1.36758: Flags [P.], cksum 0xfe2a (incorrect -> 0x8bce), seq 1:3, ack 4, win 512, options [nop,nop,TS val 1294393262 ecr 1294393262], length 2
2022-02-28 05:07:29.038588 IP (tos 0x0, ttl 64, id 24240, offset 0, flags [DF], proto TCP (6), length 52)
    127.0.0.1.36758 > 127.0.0.1.9450: Flags [.], cksum 0xfe28 (incorrect -> 0x90d6), seq 4, ack 3, win 512, options [nop,nop,TS val 1294393262 ecr 1294393262], length 0
2022-02-28 05:07:29.050372 IP (tos 0x0, ttl 64, id 24241, offset 0, flags [DF], proto TCP (6), length 62)
    127.0.0.1.36758 > 127.0.0.1.9450: Flags [P.], cksum 0xfe32 (incorrect -> 0xd7d7), seq 4:14, ack 3, win 512, options [nop,nop,TS val 1294393273 ecr 1294393262], length 10
2022-02-28 05:07:29.050383 IP (tos 0x0, ttl 64, id 16695, offset 0, flags [DF], proto TCP (6), length 52)
    127.0.0.1.9450 > 127.0.0.1.36758: Flags [.], cksum 0xfe28 (incorrect -> 0x90b6), seq 3, ack 14, win 512, options [nop,nop,TS val 1294393273 ecr 1294393273], length 0
2022-02-28 05:07:29.269996 IP (tos 0x0, ttl 64, id 16696, offset 0, flags [DF], proto TCP (6), length 62)
    127.0.0.1.9450 > 127.0.0.1.36758: Flags [P.], cksum 0xfe32 (incorrect -> 0x8ac7), seq 3:13, ack 14, win 512, options [nop,nop,TS val 1294393493 ecr 1294393273], length 10
2022-02-28 05:07:29.270007 IP (tos 0x0, ttl 64, id 24242, offset 0, flags [DF], proto TCP (6), length 52)
    127.0.0.1.36758 > 127.0.0.1.9450: Flags [.], cksum 0xfe28 (incorrect -> 0x8ef4), seq 14, ack 13, win 512, options [nop,nop,TS val 1294393493 ecr 1294393493], length 0
2022-02-28 05:07:29.275975 IP (tos 0x0, ttl 64, id 24243, offset 0, flags [DF], proto TCP (6), length 569)
    127.0.0.1.36758 > 127.0.0.1.9450: Flags [P.], cksum 0x002e (incorrect -> 0xa5fd), seq 14:531, ack 13, win 512, options [nop,nop,TS val 1294393499 ecr 1294393493], length 517
2022-02-28 05:07:29.275987 IP (tos 0x0, ttl 64, id 16697, offset 0, flags [DF], proto TCP (6), length 52)
    127.0.0.1.9450 > 127.0.0.1.36758: Flags [.], cksum 0xfe28 (incorrect -> 0x8ce7), seq 13, ack 531, win 508, options [nop,nop,TS val 1294393499 ecr 1294393499], length 0
2022-02-28 05:07:29.490267 IP (tos 0x0, ttl 64, id 16698, offset 0, flags [DF], proto TCP (6), length 3216)
    127.0.0.1.9450 > 127.0.0.1.36758: Flags [P.], cksum 0x0a85 (incorrect -> 0xf5e1), seq 13:3177, ack 531, win 512, options [nop,nop,TS val 1294393713 ecr 1294393499], length 3164
2022-02-28 05:07:29.490279 IP (tos 0x0, ttl 64, id 24244, offset 0, flags [DF], proto TCP (6), length 52)
    127.0.0.1.36758 > 127.0.0.1.9450: Flags [.], cksum 0xfe28 (incorrect -> 0x7eec), seq 531, ack 3177, win 495, options [nop,nop,TS val 1294393713 ecr 1294393713], length 0
2022-02-28 05:07:29.490772 IP (tos 0x0, ttl 64, id 24245, offset 0, flags [DF], proto TCP (6), length 116)
    127.0.0.1.36758 > 127.0.0.1.9450: Flags [P.], cksum 0xfe68 (incorrect -> 0x62f8), seq 531:595, ack 3177, win 512, options [nop,nop,TS val 1294393714 ecr 1294393713], length 64
2022-02-28 05:07:29.490782 IP (tos 0x0, ttl 64, id 16699, offset 0, flags [DF], proto TCP (6), length 52)
    127.0.0.1.9450 > 127.0.0.1.36758: Flags [.], cksum 0xfe28 (incorrect -> 0x7e99), seq 3177, ack 595, win 512, options [nop,nop,TS val 1294393714 ecr 1294393714], length 0
2022-02-28 05:07:29.491169 IP (tos 0x0, ttl 64, id 24246, offset 0, flags [DF], proto TCP (6), length 330)
    127.0.0.1.36758 > 127.0.0.1.9450: Flags [P.], cksum 0xff3e (incorrect -> 0x80e3), seq 595:873, ack 3177, win 512, options [nop,nop,TS val 1294393714 ecr 1294393714], length 278
2022-02-28 05:07:29.491180 IP (tos 0x0, ttl 64, id 16700, offset 0, flags [DF], proto TCP (6), length 52)
    127.0.0.1.9450 > 127.0.0.1.36758: Flags [.], cksum 0xfe28 (incorrect -> 0x7d85), seq 3177, ack 873, win 510, options [nop,nop,TS val 1294393714 ecr 1294393714], length 0
2022-02-28 05:07:29.744036 IP (tos 0x0, ttl 64, id 16701, offset 0, flags [DF], proto TCP (6), length 221)
    127.0.0.1.9450 > 127.0.0.1.36758: Flags [P.], cksum 0xfed1 (incorrect -> 0xc68b), seq 3177:3346, ack 873, win 512, options [nop,nop,TS val 1294393967 ecr 1294393714], length 169
2022-02-28 05:07:29.744049 IP (tos 0x0, ttl 64, id 24247, offset 0, flags [DF], proto TCP (6), length 52)
    127.0.0.1.36758 > 127.0.0.1.9450: Flags [.], cksum 0xfe28 (incorrect -> 0x7ae1), seq 873, ack 3346, win 511, options [nop,nop,TS val 1294393967 ecr 1294393967], length 0
2022-02-28 05:07:30.010626 IP (tos 0x0, ttl 64, id 16702, offset 0, flags [DF], proto TCP (6), length 3538)
    127.0.0.1.9450 > 127.0.0.1.36758: Flags [P.], cksum 0x0bc7 (incorrect -> 0xe71f), seq 3346:6832, ack 873, win 512, options [nop,nop,TS val 1294394234 ecr 1294393967], length 3486
2022-02-28 05:07:30.010647 IP (tos 0x0, ttl 64, id 24248, offset 0, flags [DF], proto TCP (6), length 52)
    127.0.0.1.36758 > 127.0.0.1.9450: Flags [.], cksum 0xfe28 (incorrect -> 0x6b3e), seq 873, ack 6832, win 494, options [nop,nop,TS val 1294394234 ecr 1294394234], length 0
2022-02-28 05:07:30.024705 IP (tos 0x0, ttl 64, id 16703, offset 0, flags [DF], proto TCP (6), length 3538)
    127.0.0.1.9450 > 127.0.0.1.36758: Flags [P.], cksum 0x0bc7 (incorrect -> 0x7cdf), seq 6832:10318, ack 873, win 512, options [nop,nop,TS val 1294394248 ecr 1294394234], length 3486
2022-02-28 05:07:30.024715 IP (tos 0x0, ttl 64, id 24249, offset 0, flags [DF], proto TCP (6), length 52)
    127.0.0.1.36758 > 127.0.0.1.9450: Flags [.], cksum 0xfe28 (incorrect -> 0x5d84), seq 873, ack 10318, win 494, options [nop,nop,TS val 1294394248 ecr 1294394248], length 0
2022-02-28 05:07:30.103577 IP (tos 0x0, ttl 64, id 16704, offset 0, flags [DF], proto TCP (6), length 3306)
    127.0.0.1.9450 > 127.0.0.1.36758: Flags [P.], cksum 0x0adf (incorrect -> 0x8c4e), seq 10318:13572, ack 873, win 512, options [nop,nop,TS val 1294394327 ecr 1294394248], length 3254
2022-02-28 05:07:30.103586 IP (tos 0x0, ttl 64, id 24250, offset 0, flags [DF], proto TCP (6), length 52)
    127.0.0.1.36758 > 127.0.0.1.9450: Flags [.], cksum 0xfe28 (incorrect -> 0x502f), seq 873, ack 13572, win 495, options [nop,nop,TS val 1294394327 ecr 1294394327], length 0
2022-02-28 05:07:30.103685 IP (tos 0x0, ttl 64, id 16705, offset 0, flags [DF], proto TCP (6), length 4036)
    127.0.0.1.9450 > 127.0.0.1.36758: Flags [P.], cksum 0x0db9 (incorrect -> 0xc5b0), seq 13572:17556, ack 873, win 512, options [nop,nop,TS val 1294394327 ecr 1294394327], length 3984
2022-02-28 05:07:30.103691 IP (tos 0x0, ttl 64, id 24251, offset 0, flags [DF], proto TCP (6), length 52)
    127.0.0.1.36758 > 127.0.0.1.9450: Flags [.], cksum 0xfe28 (incorrect -> 0x40af), seq 873, ack 17556, win 479, options [nop,nop,TS val 1294394327 ecr 1294394327], length 0
2022-02-28 05:07:30.103798 IP (tos 0x0, ttl 64, id 16706, offset 0, flags [DF], proto TCP (6), length 4100)
    127.0.0.1.9450 > 127.0.0.1.36758: Flags [P.], cksum 0x0df9 (incorrect -> 0xf9f9), seq 17556:21604, ack 873, win 512, options [nop,nop,TS val 1294394327 ecr 1294394327], length 4048
2022-02-28 05:07:30.103804 IP (tos 0x0, ttl 64, id 24252, offset 0, flags [DF], proto TCP (6), length 52)
    127.0.0.1.36758 > 127.0.0.1.9450: Flags [.], cksum 0xfe28 (incorrect -> 0x30ef), seq 873, ack 21604, win 463, options [nop,nop,TS val 1294394327 ecr 1294394327], length 0
2022-02-28 05:07:30.103810 IP (tos 0x0, ttl 64, id 16707, offset 0, flags [DF], proto TCP (6), length 186)
    127.0.0.1.9450 > 127.0.0.1.36758: Flags [P.], cksum 0xfeae (incorrect -> 0x49e8), seq 21604:21738, ack 873, win 512, options [nop,nop,TS val 1294394327 ecr 1294394327], length 134
2022-02-28 05:07:30.103815 IP (tos 0x0, ttl 64, id 24253, offset 0, flags [DF], proto TCP (6), length 52)
    127.0.0.1.36758 > 127.0.0.1.9450: Flags [.], cksum 0xfe28 (incorrect -> 0x3069), seq 873, ack 21738, win 463, options [nop,nop,TS val 1294394327 ecr 1294394327], length 0
2022-02-28 05:07:30.117550 IP (tos 0x0, ttl 64, id 16708, offset 0, flags [DF], proto TCP (6), length 3196)
    127.0.0.1.9450 > 127.0.0.1.36758: Flags [P.], cksum 0x0a71 (incorrect -> 0xcf25), seq 21738:24882, ack 873, win 512, options [nop,nop,TS val 1294394341 ecr 1294394327], length 3144
2022-02-28 05:07:30.117559 IP (tos 0x0, ttl 64, id 24254, offset 0, flags [DF], proto TCP (6), length 52)
    127.0.0.1.36758 > 127.0.0.1.9450: Flags [.], cksum 0xfe28 (incorrect -> 0x23e5), seq 873, ack 24882, win 495, options [nop,nop,TS val 1294394341 ecr 1294394341], length 0
2022-02-28 05:07:30.117740 IP (tos 0x0, ttl 64, id 16709, offset 0, flags [DF], proto TCP (6), length 1048)
    127.0.0.1.9450 > 127.0.0.1.36758: Flags [P.], cksum 0x020d (incorrect -> 0x859b), seq 24882:25878, ack 873, win 512, options [nop,nop,TS val 1294394341 ecr 1294394341], length 996
2022-02-28 05:07:30.117748 IP (tos 0x0, ttl 64, id 24255, offset 0, flags [DF], proto TCP (6), length 52)
    127.0.0.1.36758 > 127.0.0.1.9450: Flags [.], cksum 0xfe28 (incorrect -> 0x1ff8), seq 873, ack 25878, win 504, options [nop,nop,TS val 1294394341 ecr 1294394341], length 0
2022-02-28 05:07:30.118046 IP (tos 0x0, ttl 64, id 16710, offset 0, flags [DF], proto TCP (6), length 4100)
    127.0.0.1.9450 > 127.0.0.1.36758: Flags [P.], cksum 0x0df9 (incorrect -> 0x98b4), seq 25878:29926, ack 873, win 512, options [nop,nop,TS val 1294394341 ecr 1294394341], length 4048
2022-02-28 05:07:30.118054 IP (tos 0x0, ttl 64, id 24256, offset 0, flags [DF], proto TCP (6), length 52)
    127.0.0.1.36758 > 127.0.0.1.9450: Flags [.], cksum 0xfe28 (incorrect -> 0x1034), seq 873, ack 29926, win 492, options [nop,nop,TS val 1294394341 ecr 1294394341], length 0
2022-02-28 05:07:30.118061 IP (tos 0x0, ttl 64, id 16711, offset 0, flags [DF], proto TCP (6), length 984)
    127.0.0.1.9450 > 127.0.0.1.36758: Flags [P.], cksum 0x01cd (incorrect -> 0x9979), seq 29926:30858, ack 873, win 512, options [nop,nop,TS val 1294394341 ecr 1294394341], length 932
2022-02-28 05:07:30.118066 IP (tos 0x0, ttl 64, id 24257, offset 0, flags [DF], proto TCP (6), length 52)
    127.0.0.1.36758 > 127.0.0.1.9450: Flags [.], cksum 0xfe28 (incorrect -> 0x0c94), seq 873, ack 30858, win 488, options [nop,nop,TS val 1294394341 ecr 1294394341], length 0
2022-02-28 05:07:30.118108 IP (tos 0x0, ttl 64, id 16712, offset 0, flags [DF], proto TCP (6), length 3538)
    127.0.0.1.9450 > 127.0.0.1.36758: Flags [P.], cksum 0x0bc7 (incorrect -> 0x142c), seq 30858:34344, ack 873, win 512, options [nop,nop,TS val 1294394341 ecr 1294394341], length 3486
2022-02-28 05:07:30.118381 IP (tos 0x0, ttl 64, id 24258, offset 0, flags [DF], proto TCP (6), length 52)
    127.0.0.1.36758 > 127.0.0.1.9450: Flags [.], cksum 0xfe28 (incorrect -> 0xfedd), seq 873, ack 34344, win 512, options [nop,nop,TS val 1294394341 ecr 1294394341], length 0
2022-02-28 05:07:30.118389 IP (tos 0x0, ttl 64, id 16713, offset 0, flags [DF], proto TCP (6), length 1630)
    127.0.0.1.9450 > 127.0.0.1.36758: Flags [P.], cksum 0x0453 (incorrect -> 0xd7ad), seq 34344:35922, ack 873, win 512, options [nop,nop,TS val 1294394341 ecr 1294394341], length 1578
2022-02-28 05:07:30.118404 IP (tos 0x0, ttl 64, id 24259, offset 0, flags [DF], proto TCP (6), length 52)
    127.0.0.1.36758 > 127.0.0.1.9450: Flags [.], cksum 0xfe28 (incorrect -> 0xf8b3), seq 873, ack 35922, win 512, options [nop,nop,TS val 1294394341 ecr 1294394341], length 0
2022-02-28 05:07:30.132104 IP (tos 0x0, ttl 64, id 16714, offset 0, flags [DF], proto TCP (6), length 4036)
    127.0.0.1.9450 > 127.0.0.1.36758: Flags [P.], cksum 0x0db9 (incorrect -> 0x31fd), seq 35922:39906, ack 873, win 512, options [nop,nop,TS val 1294394355 ecr 1294394341], length 3984
2022-02-28 05:07:30.132342 IP (tos 0x0, ttl 64, id 24260, offset 0, flags [DF], proto TCP (6), length 52)
    127.0.0.1.36758 > 127.0.0.1.9450: Flags [.], cksum 0xfe28 (incorrect -> 0xe907), seq 873, ack 39906, win 512, options [nop,nop,TS val 1294394355 ecr 1294394355], length 0
2022-02-28 05:07:30.199972 IP (tos 0x0, ttl 64, id 16715, offset 0, flags [DF], proto TCP (6), length 3538)
    127.0.0.1.9450 > 127.0.0.1.36758: Flags [P.], cksum 0x0bc7 (incorrect -> 0xa7b9), seq 39906:43392, ack 873, win 512, options [nop,nop,TS val 1294394423 ecr 1294394355], length 3486
2022-02-28 05:07:30.200054 IP (tos 0x0, ttl 64, id 24261, offset 0, flags [DF], proto TCP (6), length 52)
    127.0.0.1.36758 > 127.0.0.1.9450: Flags [.], cksum 0xfe28 (incorrect -> 0xdae1), seq 873, ack 43392, win 512, options [nop,nop,TS val 1294394423 ecr 1294394423], length 0
2022-02-28 05:07:30.202888 IP (tos 0x0, ttl 64, id 16716, offset 0, flags [DF], proto TCP (6), length 4100)
    127.0.0.1.9450 > 127.0.0.1.36758: Flags [P.], cksum 0x0df9 (incorrect -> 0x1c04), seq 43392:47440, ack 873, win 512, options [nop,nop,TS val 1294394426 ecr 1294394423], length 4048
200, 3.91036319732666, 1.2138466835021973