2022-02-28 08:57:44.533306 IP (tos 0x0, ttl 64, id 41250, offset 0, flags [DF], proto TCP (6), length 60)
    127.0.0.1.46280 > 127.0.0.1.10250: Flags [S], cksum 0xfe30 (incorrect -> 0xd63e), seq 2375160560, win 65495, options [mss 65495,sackOK,TS val 1308208756 ecr 0,nop,wscale 7], length 0
2022-02-28 08:57:44.533315 IP (tos 0x0, ttl 64, id 0, offset 0, flags [DF], proto TCP (6), length 60)
    127.0.0.1.10250 > 127.0.0.1.46280: Flags [S.], cksum 0xfe30 (incorrect -> 0x0535), seq 2388018752, ack 2375160561, win 65483, options [mss 65495,sackOK,TS val 1308208756 ecr 1308208756,nop,wscale 7], length 0
2022-02-28 08:57:44.533322 IP (tos 0x0, ttl 64, id 41251, offset 0, flags [DF], proto TCP (6), length 52)
    127.0.0.1.46280 > 127.0.0.1.10250: Flags [.], cksum 0xfe28 (incorrect -> 0x2bf1), seq 1, ack 1, win 512, options [nop,nop,TS val 1308208756 ecr 1308208756], length 0
2022-02-28 08:57:44.533413 IP (tos 0x0, ttl 64, id 41252, offset 0, flags [DF], proto TCP (6), length 55)
    127.0.0.1.46280 > 127.0.0.1.10250: Flags [P.], cksum 0xfe2b (incorrect -> 0x26e5), seq 1:4, ack 1, win 512, options [nop,nop,TS val 1308208756 ecr 1308208756], length 3
2022-02-28 08:57:44.533417 IP (tos 0x0, ttl 64, id 46220, offset 0, flags [DF], proto TCP (6), length 52)
    127.0.0.1.10250 > 127.0.0.1.46280: Flags [.], cksum 0xfe28 (incorrect -> 0x2bee), seq 1, ack 4, win 512, options [nop,nop,TS val 1308208756 ecr 1308208756], length 0
2022-02-28 08:57:44.533494 IP (tos 0x0, ttl 64, id 46221, offset 0, flags [DF], proto TCP (6), length 54)
    127.0.0.1.10250 > 127.0.0.1.46280: Flags [P.], cksum 0xfe2a (incorrect -> 0x26e3), seq 1:3, ack 4, win 512, options [nop,nop,TS val 1308208757 ecr 1308208756], length 2
2022-02-28 08:57:44.533499 IP (tos 0x0, ttl 64, id 41253, offset 0, flags [DF], proto TCP (6), length 52)
    127.0.0.1.46280 > 127.0.0.1.10250: Flags [.], cksum 0xfe28 (incorrect -> 0x2bea), seq 4, ack 3, win 512, options [nop,nop,TS val 1308208757 ecr 1308208757], length 0
2022-02-28 08:57:44.534981 IP (tos 0x0, ttl 64, id 41254, offset 0, flags [DF], proto TCP (6), length 62)
    127.0.0.1.46280 > 127.0.0.1.10250: Flags [P.], cksum 0xfe32 (incorrect -> 0x67bc), seq 4:14, ack 3, win 512, options [nop,nop,TS val 1308208758 ecr 1308208757], length 10
2022-02-28 08:57:44.535001 IP (tos 0x0, ttl 64, id 46222, offset 0, flags [DF], proto TCP (6), length 52)
    127.0.0.1.10250 > 127.0.0.1.46280: Flags [.], cksum 0xfe28 (incorrect -> 0x2bde), seq 3, ack 14, win 512, options [nop,nop,TS val 1308208758 ecr 1308208758], length 0
2022-02-28 08:57:44.596158 IP (tos 0x0, ttl 64, id 46223, offset 0, flags [DF], proto TCP (6), length 62)
    127.0.0.1.10250 > 127.0.0.1.46280: Flags [P.], cksum 0xfe32 (incorrect -> 0x268e), seq 3:13, ack 14, win 512, options [nop,nop,TS val 1308208819 ecr 1308208758], length 10
2022-02-28 08:57:44.596170 IP (tos 0x0, ttl 64, id 41255, offset 0, flags [DF], proto TCP (6), length 52)
    127.0.0.1.46280 > 127.0.0.1.10250: Flags [.], cksum 0xfe28 (incorrect -> 0x2b5a), seq 14, ack 13, win 512, options [nop,nop,TS val 1308208819 ecr 1308208819], length 0
2022-02-28 08:57:44.601937 IP (tos 0x0, ttl 64, id 41256, offset 0, flags [DF], proto TCP (6), length 569)
    127.0.0.1.46280 > 127.0.0.1.10250: Flags [P.], cksum 0x002e (incorrect -> 0x056a), seq 14:531, ack 13, win 512, options [nop,nop,TS val 1308208825 ecr 1308208819], length 517
2022-02-28 08:57:44.601947 IP (tos 0x0, ttl 64, id 46224, offset 0, flags [DF], proto TCP (6), length 52)
    127.0.0.1.10250 > 127.0.0.1.46280: Flags [.], cksum 0xfe28 (incorrect -> 0x294d), seq 13, ack 531, win 508, options [nop,nop,TS val 1308208825 ecr 1308208825], length 0
2022-02-28 08:57:44.664513 IP (tos 0x0, ttl 64, id 46225, offset 0, flags [DF], proto TCP (6), length 3538)
    127.0.0.1.10250 > 127.0.0.1.46280: Flags [P.], cksum 0x0bc7 (incorrect -> 0x0939), seq 13:3499, ack 531, win 512, options [nop,nop,TS val 1308208888 ecr 1308208825], length 3486
2022-02-28 08:57:44.664521 IP (tos 0x0, ttl 64, id 41257, offset 0, flags [DF], proto TCP (6), length 52)
    127.0.0.1.46280 > 127.0.0.1.10250: Flags [.], cksum 0xfe28 (incorrect -> 0x1b3f), seq 531, ack 3499, win 494, options [nop,nop,TS val 1308208888 ecr 1308208888], length 0
2022-02-28 08:57:44.677606 IP (tos 0x0, ttl 64, id 46226, offset 0, flags [DF], proto TCP (6), length 859)
    127.0.0.1.10250 > 127.0.0.1.46280: Flags [P.], cksum 0x0150 (incorrect -> 0xa830), seq 3499:4306, ack 531, win 512, options [nop,nop,TS val 1308208901 ecr 1308208888], length 807
2022-02-28 08:57:44.677613 IP (tos 0x0, ttl 64, id 41258, offset 0, flags [DF], proto TCP (6), length 52)
    127.0.0.1.46280 > 127.0.0.1.10250: Flags [.], cksum 0xfe28 (incorrect -> 0x17f4), seq 531, ack 4306, win 504, options [nop,nop,TS val 1308208901 ecr 1308208901], length 0
200, 4.580326080322266, 0.41814589500427246