2022-02-28 00:50:04.251775 IP (tos 0x0, ttl 64, id 4501, offset 0, flags [DF], proto TCP (6), length 60)
    127.0.0.1.45692 > 127.0.0.1.11450: Flags [S], cksum 0xfe30 (incorrect -> 0x99a6), seq 3957418636, win 65495, options [mss 65495,sackOK,TS val 1278948475 ecr 0,nop,wscale 7], length 0
2022-02-28 00:50:04.251787 IP (tos 0x0, ttl 64, id 0, offset 0, flags [DF], proto TCP (6), length 60)
    127.0.0.1.11450 > 127.0.0.1.45692: Flags [S.], cksum 0xfe30 (incorrect -> 0xabb3), seq 1831141394, ack 3957418637, win 65483, options [mss 65495,sackOK,TS val 1278948475 ecr 1278948475,nop,wscale 7], length 0
2022-02-28 00:50:04.251795 IP (tos 0x0, ttl 64, id 4502, offset 0, flags [DF], proto TCP (6), length 52)
    127.0.0.1.45692 > 127.0.0.1.11450: Flags [.], cksum 0xfe28 (incorrect -> 0xd26f), seq 1, ack 1, win 512, options [nop,nop,TS val 1278948475 ecr 1278948475], length 0
2022-02-28 00:50:04.252115 IP (tos 0x0, ttl 64, id 4503, offset 0, flags [DF], proto TCP (6), length 55)
    127.0.0.1.45692 > 127.0.0.1.11450: Flags [P.], cksum 0xfe2b (incorrect -> 0xcd63), seq 1:4, ack 1, win 512, options [nop,nop,TS val 1278948475 ecr 1278948475], length 3
2022-02-28 00:50:04.252128 IP (tos 0x0, ttl 64, id 1274, offset 0, flags [DF], proto TCP (6), length 52)
    127.0.0.1.11450 > 127.0.0.1.45692: Flags [.], cksum 0xfe28 (incorrect -> 0xd26c), seq 1, ack 4, win 512, options [nop,nop,TS val 1278948475 ecr 1278948475], length 0
2022-02-28 00:50:04.252163 IP (tos 0x0, ttl 64, id 1275, offset 0, flags [DF], proto TCP (6), length 54)
    127.0.0.1.11450 > 127.0.0.1.45692: Flags [P.], cksum 0xfe2a (incorrect -> 0xcd62), seq 1:3, ack 4, win 512, options [nop,nop,TS val 1278948475 ecr 1278948475], length 2
2022-02-28 00:50:04.252180 IP (tos 0x0, ttl 64, id 4504, offset 0, flags [DF], proto TCP (6), length 52)
    127.0.0.1.45692 > 127.0.0.1.11450: Flags [.], cksum 0xfe28 (incorrect -> 0xd26a), seq 4, ack 3, win 512, options [nop,nop,TS val 1278948475 ecr 1278948475], length 0
2022-02-28 00:50:04.253625 IP (tos 0x0, ttl 64, id 4505, offset 0, flags [DF], proto TCP (6), length 62)
    127.0.0.1.45692 > 127.0.0.1.11450: Flags [P.], cksum 0xfe32 (incorrect -> 0xb55a), seq 4:14, ack 3, win 512, options [nop,nop,TS val 1278948477 ecr 1278948475], length 10
2022-02-28 00:50:04.253640 IP (tos 0x0, ttl 64, id 1276, offset 0, flags [DF], proto TCP (6), length 52)
    127.0.0.1.11450 > 127.0.0.1.45692: Flags [.], cksum 0xfe28 (incorrect -> 0xd25c), seq 3, ack 14, win 512, options [nop,nop,TS val 1278948477 ecr 1278948477], length 0
