2022-02-28 05:00:47.026401 IP (tos 0x0, ttl 64, id 47570, offset 0, flags [DF], proto TCP (6), length 60)
    127.0.0.1.33320 > 127.0.0.1.11950: Flags [S], cksum 0xfe30 (incorrect -> 0xf78a), seq 1982605058, win 65495, options [mss 65495,sackOK,TS val 1293991249 ecr 0,nop,wscale 7], length 0
2022-02-28 05:00:47.026413 IP (tos 0x0, ttl 64, id 0, offset 0, flags [DF], proto TCP (6), length 60)
    127.0.0.1.11950 > 127.0.0.1.33320: Flags [S.], cksum 0xfe30 (incorrect -> 0x6e06), seq 649877585, ack 1982605059, win 65483, options [mss 65495,sackOK,TS val 1293991249 ecr 1293991249,nop,wscale 7], length 0
2022-02-28 05:00:47.026422 IP (tos 0x0, ttl 64, id 47571, offset 0, flags [DF], proto TCP (6), length 52)
    127.0.0.1.33320 > 127.0.0.1.11950: Flags [.], cksum 0xfe28 (incorrect -> 0x94c2), seq 1, ack 1, win 512, options [nop,nop,TS val 1293991249 ecr 1293991249], length 0
2022-02-28 05:00:47.026524 IP (tos 0x0, ttl 64, id 47572, offset 0, flags [DF], proto TCP (6), length 55)
    127.0.0.1.33320 > 127.0.0.1.11950: Flags [P.], cksum 0xfe2b (incorrect -> 0x8fb5), seq 1:4, ack 1, win 512, options [nop,nop,TS val 1293991250 ecr 1293991249], length 3
2022-02-28 05:00:47.026534 IP (tos 0x0, ttl 64, id 24885, offset 0, flags [DF], proto TCP (6), length 52)
    127.0.0.1.11950 > 127.0.0.1.33320: Flags [.], cksum 0xfe28 (incorrect -> 0x94bd), seq 1, ack 4, win 512, options [nop,nop,TS val 1293991250 ecr 1293991250], length 0
2022-02-28 05:00:47.026563 IP (tos 0x0, ttl 64, id 24886, offset 0, flags [DF], proto TCP (6), length 54)
    127.0.0.1.11950 > 127.0.0.1.33320: Flags [P.], cksum 0xfe2a (incorrect -> 0x8fb3), seq 1:3, ack 4, win 512, options [nop,nop,TS val 1293991250 ecr 1293991250], length 2
2022-02-28 05:00:47.026572 IP (tos 0x0, ttl 64, id 47573, offset 0, flags [DF], proto TCP (6), length 52)
    127.0.0.1.33320 > 127.0.0.1.11950: Flags [.], cksum 0xfe28 (incorrect -> 0x94bb), seq 4, ack 3, win 512, options [nop,nop,TS val 1293991250 ecr 1293991250], length 0
2022-02-28 05:00:47.027976 IP (tos 0x0, ttl 64, id 47574, offset 0, flags [DF], proto TCP (6), length 62)
    127.0.0.1.33320 > 127.0.0.1.11950: Flags [P.], cksum 0xfe32 (incorrect -> 0xe9e2), seq 4:14, ack 3, win 512, options [nop,nop,TS val 1293991251 ecr 1293991250], length 10
2022-02-28 05:00:47.027984 IP (tos 0x0, ttl 64, id 24887, offset 0, flags [DF], proto TCP (6), length 52)
    127.0.0.1.11950 > 127.0.0.1.33320: Flags [.], cksum 0xfe28 (incorrect -> 0x94af), seq 3, ack 14, win 512, options [nop,nop,TS val 1293991251 ecr 1293991251], length 0
2022-02-28 05:00:47.132630 IP (tos 0x0, ttl 64, id 24888, offset 0, flags [DF], proto TCP (6), length 62)
    127.0.0.1.11950 > 127.0.0.1.33320: Flags [P.], cksum 0xfe32 (incorrect -> 0x8f33), seq 3:13, ack 14, win 512, options [nop,nop,TS val 1293991356 ecr 1293991251], length 10
2022-02-28 05:00:47.132636 IP (tos 0x0, ttl 64, id 47575, offset 0, flags [DF], proto TCP (6), length 52)
    127.0.0.1.33320 > 127.0.0.1.11950: Flags [.], cksum 0xfe28 (incorrect -> 0x93d3), seq 14, ack 13, win 512, options [nop,nop,TS val 1293991356 ecr 1293991356], length 0
2022-02-28 05:00:47.138117 IP (tos 0x0, ttl 64, id 47576, offset 0, flags [DF], proto TCP (6), length 569)
    127.0.0.1.33320 > 127.0.0.1.11950: Flags [P.], cksum 0x002e (incorrect -> 0xf12b), seq 14:531, ack 13, win 512, options [nop,nop,TS val 1293991361 ecr 1293991356], length 517
2022-02-28 05:00:47.138145 IP (tos 0x0, ttl 64, id 24889, offset 0, flags [DF], proto TCP (6), length 52)
    127.0.0.1.11950 > 127.0.0.1.33320: Flags [.], cksum 0xfe28 (incorrect -> 0x91c8), seq 13, ack 531, win 508, options [nop,nop,TS val 1293991361 ecr 1293991361], length 0
2022-02-28 05:00:47.232595 IP (tos 0x0, ttl 64, id 24890, offset 0, flags [DF], proto TCP (6), length 151)
    127.0.0.1.11950 > 127.0.0.1.33320: Flags [P.], cksum 0xfe8b (incorrect -> 0x8da7), seq 13:112, ack 531, win 512, options [nop,nop,TS val 1293991456 ecr 1293991361], length 99
2022-02-28 05:00:47.232604 IP (tos 0x0, ttl 64, id 47577, offset 0, flags [DF], proto TCP (6), length 52)
    127.0.0.1.33320 > 127.0.0.1.11950: Flags [.], cksum 0xfe28 (incorrect -> 0x90a3), seq 531, ack 112, win 512, options [nop,nop,TS val 1293991456 ecr 1293991456], length 0
2022-02-28 05:00:47.232968 IP (tos 0x0, ttl 64, id 47578, offset 0, flags [DF], proto TCP (6), length 575)
    127.0.0.1.33320 > 127.0.0.1.11950: Flags [P.], cksum 0x0034 (incorrect -> 0xbe5e), seq 531:1054, ack 112, win 512, options [nop,nop,TS val 1293991456 ecr 1293991456], length 523
2022-02-28 05:00:47.233015 IP (tos 0x0, ttl 64, id 24891, offset 0, flags [DF], proto TCP (6), length 52)
    127.0.0.1.11950 > 127.0.0.1.33320: Flags [.], cksum 0xfe28 (incorrect -> 0x8e9c), seq 112, ack 1054, win 508, options [nop,nop,TS val 1293991456 ecr 1293991456], length 0
2022-02-28 05:00:47.325668 IP (tos 0x0, ttl 64, id 24892, offset 0, flags [DF], proto TCP (6), length 3538)
    127.0.0.1.11950 > 127.0.0.1.33320: Flags [P.], cksum 0x0bc7 (incorrect -> 0xc38a), seq 112:3598, ack 1054, win 512, options [nop,nop,TS val 1293991549 ecr 1293991456], length 3486
2022-02-28 05:00:47.325675 IP (tos 0x0, ttl 64, id 47579, offset 0, flags [DF], proto TCP (6), length 52)
    127.0.0.1.33320 > 127.0.0.1.11950: Flags [.], cksum 0xfe28 (incorrect -> 0x8052), seq 1054, ack 3598, win 494, options [nop,nop,TS val 1293991549 ecr 1293991549], length 0
2022-02-28 05:00:47.353244 IP (tos 0x0, ttl 64, id 24893, offset 0, flags [DF], proto TCP (6), length 2542)
    127.0.0.1.11950 > 127.0.0.1.33320: Flags [P.], cksum 0x07e3 (incorrect -> 0xf1cd), seq 3598:6088, ack 1054, win 512, options [nop,nop,TS val 1293991576 ecr 1293991549], length 2490
2022-02-28 05:00:47.353250 IP (tos 0x0, ttl 64, id 47580, offset 0, flags [DF], proto TCP (6), length 52)
    127.0.0.1.33320 > 127.0.0.1.11950: Flags [.], cksum 0xfe28 (incorrect -> 0x765e), seq 1054, ack 6088, win 498, options [nop,nop,TS val 1293991576 ecr 1293991576], length 0
2022-02-28 05:00:47.362777 IP (tos 0x0, ttl 64, id 24894, offset 0, flags [DF], proto TCP (6), length 3538)
    127.0.0.1.11950 > 127.0.0.1.33320: Flags [P.], cksum 0x0bc7 (incorrect -> 0x1073), seq 6088:9574, ack 1054, win 512, options [nop,nop,TS val 1293991586 ecr 1293991576], length 3486
2022-02-28 05:00:47.362781 IP (tos 0x0, ttl 64, id 47581, offset 0, flags [DF], proto TCP (6), length 52)
    127.0.0.1.33320 > 127.0.0.1.11950: Flags [.], cksum 0xfe28 (incorrect -> 0x68b0), seq 1054, ack 9574, win 494, options [nop,nop,TS val 1293991586 ecr 1293991586], length 0
2022-02-28 05:00:47.372987 IP (tos 0x0, ttl 64, id 24895, offset 0, flags [DF], proto TCP (6), length 890)
    127.0.0.1.11950 > 127.0.0.1.33320: Flags [P.], cksum 0x016f (incorrect -> 0x665a), seq 9574:10412, ack 1054, win 512, options [nop,nop,TS val 1293991596 ecr 1293991586], length 838
2022-02-28 05:00:47.372992 IP (tos 0x0, ttl 64, id 47582, offset 0, flags [DF], proto TCP (6), length 52)
    127.0.0.1.33320 > 127.0.0.1.11950: Flags [.], cksum 0xfe28 (incorrect -> 0x654c), seq 1054, ack 10412, win 504, options [nop,nop,TS val 1293991596 ecr 1293991596], length 0
2022-02-28 05:00:47.373524 IP (tos 0x0, ttl 64, id 47583, offset 0, flags [DF], proto TCP (6), length 126)
    127.0.0.1.33320 > 127.0.0.1.11950: Flags [P.], cksum 0xfe72 (incorrect -> 0xb40c), seq 1054:1128, ack 10412, win 512, options [nop,nop,TS val 1293991597 ecr 1293991596], length 74
2022-02-28 05:00:47.373531 IP (tos 0x0, ttl 64, id 24896, offset 0, flags [DF], proto TCP (6), length 52)
    127.0.0.1.11950 > 127.0.0.1.33320: Flags [.], cksum 0xfe28 (incorrect -> 0x64f8), seq 10412, ack 1128, win 512, options [nop,nop,TS val 1293991597 ecr 1293991597], length 0
2022-02-28 05:00:47.373881 IP (tos 0x0, ttl 64, id 47584, offset 0, flags [DF], proto TCP (6), length 314)
    127.0.0.1.33320 > 127.0.0.1.11950: Flags [P.], cksum 0xff2e (incorrect -> 0x38d6), seq 1128:1390, ack 10412, win 512, options [nop,nop,TS val 1293991597 ecr 1293991597], length 262
2022-02-28 05:00:47.373889 IP (tos 0x0, ttl 64, id 24897, offset 0, flags [DF], proto TCP (6), length 52)
    127.0.0.1.11950 > 127.0.0.1.33320: Flags [.], cksum 0xfe28 (incorrect -> 0x63f4), seq 10412, ack 1390, win 510, options [nop,nop,TS val 1293991597 ecr 1293991597], length 0
2022-02-28 05:00:47.463761 IP (tos 0x0, ttl 64, id 24898, offset 0, flags [DF], proto TCP (6), length 626)
    127.0.0.1.11950 > 127.0.0.1.33320: Flags [P.], cksum 0x0067 (incorrect -> 0x6556), seq 10412:10986, ack 1390, win 512, options [nop,nop,TS val 1293991687 ecr 1293991597], length 574
2022-02-28 05:00:47.506158 IP (tos 0x0, ttl 64, id 47585, offset 0, flags [DF], proto TCP (6), length 52)
    127.0.0.1.33320 > 127.0.0.1.11950: Flags [.], cksum 0xfe28 (incorrect -> 0x60d6), seq 1390, ack 10986, win 512, options [nop,nop,TS val 1293991729 ecr 1293991687], length 0
2022-02-28 05:00:47.985908 IP (tos 0x0, ttl 64, id 24899, offset 0, flags [DF], proto TCP (6), length 3538)
    127.0.0.1.11950 > 127.0.0.1.33320: Flags [P.], cksum 0x0bc7 (incorrect -> 0xf377), seq 10986:14472, ack 1390, win 512, options [nop,nop,TS val 1293992209 ecr 1293991729], length 3486
2022-02-28 05:00:47.985914 IP (tos 0x0, ttl 64, id 47586, offset 0, flags [DF], proto TCP (6), length 52)
    127.0.0.1.33320 > 127.0.0.1.11950: Flags [.], cksum 0xfe28 (incorrect -> 0x4f60), seq 1390, ack 14472, win 494, options [nop,nop,TS val 1293992209 ecr 1293992209], length 0
2022-02-28 05:00:47.995942 IP (tos 0x0, ttl 64, id 24900, offset 0, flags [DF], proto TCP (6), length 3436)
    127.0.0.1.11950 > 127.0.0.1.33320: Flags [P.], cksum 0x0b61 (incorrect -> 0x8b5c), seq 14472:17856, ack 1390, win 512, options [nop,nop,TS val 1293992219 ecr 1293992209], length 3384
2022-02-28 05:00:47.995947 IP (tos 0x0, ttl 64, id 47587, offset 0, flags [DF], proto TCP (6), length 52)
    127.0.0.1.33320 > 127.0.0.1.11950: Flags [.], cksum 0xfe28 (incorrect -> 0x4214), seq 1390, ack 17856, win 494, options [nop,nop,TS val 1293992219 ecr 1293992219], length 0
2022-02-28 05:00:47.996070 IP (tos 0x0, ttl 64, id 24901, offset 0, flags [DF], proto TCP (6), length 2938)
    127.0.0.1.11950 > 127.0.0.1.33320: Flags [P.], cksum 0x096f (incorrect -> 0x2a63), seq 17856:20742, ack 1390, win 512, options [nop,nop,TS val 1293992219 ecr 1293992219], length 2886
2022-02-28 05:00:47.996075 IP (tos 0x0, ttl 64, id 47588, offset 0, flags [DF], proto TCP (6), length 52)
    127.0.0.1.33320 > 127.0.0.1.11950: Flags [.], cksum 0xfe28 (incorrect -> 0x36cc), seq 1390, ack 20742, win 496, options [nop,nop,TS val 1293992219 ecr 1293992219], length 0
2022-02-28 05:00:48.024125 IP (tos 0x0, ttl 64, id 24902, offset 0, flags [DF], proto TCP (6), length 4100)
    127.0.0.1.11950 > 127.0.0.1.33320: Flags [P.], cksum 0x0df9 (incorrect -> 0xaa0d), seq 20742:24790, ack 1390, win 512, options [nop,nop,TS val 1293992247 ecr 1293992219], length 4048
2022-02-28 05:00:48.024131 IP (tos 0x0, ttl 64, id 47589, offset 0, flags [DF], proto TCP (6), length 52)
    127.0.0.1.33320 > 127.0.0.1.11950: Flags [.], cksum 0xfe28 (incorrect -> 0x26c8), seq 1390, ack 24790, win 492, options [nop,nop,TS val 1293992247 ecr 1293992247], length 0
2022-02-28 05:00:48.024137 IP (tos 0x0, ttl 64, id 24903, offset 0, flags [DF], proto TCP (6), length 2893)
    127.0.0.1.11950 > 127.0.0.1.33320: Flags [P.], cksum 0x0942 (incorrect -> 0x8be4), seq 24790:27631, ack 1390, win 512, options [nop,nop,TS val 1293992247 ecr 1293992247], length 2841
2022-02-28 05:00:48.024140 IP (tos 0x0, ttl 64, id 47590, offset 0, flags [DF], proto TCP (6), length 52)
    127.0.0.1.33320 > 127.0.0.1.11950: Flags [.], cksum 0xfe28 (incorrect -> 0x1bba), seq 1390, ack 27631, win 481, options [nop,nop,TS val 1293992247 ecr 1293992247], length 0
2022-02-28 05:00:48.073626 IP (tos 0x0, ttl 64, id 24904, offset 0, flags [DF], proto TCP (6), length 3538)
    127.0.0.1.11950 > 127.0.0.1.33320: Flags [P.], cksum 0x0bc7 (incorrect -> 0x09c7), seq 27631:31117, ack 1390, win 512, options [nop,nop,TS val 1293992297 ecr 1293992247], length 3486
2022-02-28 05:00:48.073635 IP (tos 0x0, ttl 64, id 47591, offset 0, flags [DF], proto TCP (6), length 52)
    127.0.0.1.33320 > 127.0.0.1.11950: Flags [.], cksum 0xfe28 (incorrect -> 0x0dab), seq 1390, ack 31117, win 494, options [nop,nop,TS val 1293992297 ecr 1293992297], length 0
2022-02-28 05:00:48.074850 IP (tos 0x0, ttl 64, id 24905, offset 0, flags [DF], proto TCP (6), length 3436)
    127.0.0.1.11950 > 127.0.0.1.33320: Flags [P.], cksum 0x0b61 (incorrect -> 0x14d0), seq 31117:34501, ack 1390, win 512, options [nop,nop,TS val 1293992298 ecr 1293992297], length 3384
2022-02-28 05:00:48.074855 IP (tos 0x0, ttl 64, id 47592, offset 0, flags [DF], proto TCP (6), length 52)
    127.0.0.1.33320 > 127.0.0.1.11950: Flags [.], cksum 0xfe28 (incorrect -> 0x0071), seq 1390, ack 34501, win 494, options [nop,nop,TS val 1293992298 ecr 1293992298], length 0
2022-02-28 05:00:48.077112 IP (tos 0x0, ttl 64, id 24906, offset 0, flags [DF], proto TCP (6), length 3436)
    127.0.0.1.11950 > 127.0.0.1.33320: Flags [P.], cksum 0x0b61 (incorrect -> 0x1241), seq 34501:37885, ack 1390, win 512, options [nop,nop,TS val 1293992300 ecr 1293992298], length 3384
2022-02-28 05:00:48.077116 IP (tos 0x0, ttl 64, id 47593, offset 0, flags [DF], proto TCP (6), length 52)
    127.0.0.1.33320 > 127.0.0.1.11950: Flags [.], cksum 0xfe28 (incorrect -> 0xf334), seq 1390, ack 37885, win 494, options [nop,nop,TS val 1293992300 ecr 1293992300], length 0
2022-02-28 05:00:48.087099 IP (tos 0x0, ttl 64, id 24907, offset 0, flags [DF], proto TCP (6), length 1048)
    127.0.0.1.11950 > 127.0.0.1.33320: Flags [P.], cksum 0x020d (incorrect -> 0x1b04), seq 37885:38881, ack 1390, win 512, options [nop,nop,TS val 1293992310 ecr 1293992300], length 996
2022-02-28 05:00:48.087103 IP (tos 0x0, ttl 64, id 47594, offset 0, flags [DF], proto TCP (6), length 52)
    127.0.0.1.33320 > 127.0.0.1.11950: Flags [.], cksum 0xfe28 (incorrect -> 0xef32), seq 1390, ack 38881, win 504, options [nop,nop,TS val 1293992310 ecr 1293992310], length 0
2022-02-28 05:00:48.109424 IP (tos 0x0, ttl 64, id 24908, offset 0, flags [DF], proto TCP (6), length 1942)
    127.0.0.1.11950 > 127.0.0.1.33320: Flags [P.], cksum 0x058b (incorrect -> 0xb4e9), seq 38881:40771, ack 1390, win 512, options [nop,nop,TS val 1293992332 ecr 1293992310], length 1890
2022-02-28 05:00:48.109438 IP (tos 0x0, ttl 64, id 47595, offset 0, flags [DF], proto TCP (6), length 52)
    127.0.0.1.33320 > 127.0.0.1.11950: Flags [.], cksum 0xfe28 (incorrect -> 0xe79b), seq 1390, ack 40771, win 512, options [nop,nop,TS val 1293992333 ecr 1293992332], length 0
2022-02-28 05:00:48.163097 IP (tos 0x0, ttl 64, id 24909, offset 0, flags [DF], proto TCP (6), length 4100)
    127.0.0.1.11950 > 127.0.0.1.33320: Flags [P.], cksum 0x0df9 (incorrect -> 0xbeef), seq 40771:44819, ack 1390, win 512, options [nop,nop,TS val 1293992386 ecr 1293992333], length 4048
200, 8.907167434692383, 1.274994134902954