2022-02-28 04:07:21.623089 IP (tos 0x0, ttl 64, id 17645, offset 0, flags [DF], proto TCP (6), length 60)
    127.0.0.1.37180 > 127.0.0.1.9550: Flags [S], cksum 0xfe30 (incorrect -> 0x79d0), seq 1340386972, win 65495, options [mss 65495,sackOK,TS val 1290785846 ecr 0,nop,wscale 7], length 0
2022-02-28 04:07:21.623107 IP (tos 0x0, ttl 64, id 0, offset 0, flags [DF], proto TCP (6), length 60)
    127.0.0.1.9550 > 127.0.0.1.37180: Flags [S.], cksum 0xfe30 (incorrect -> 0x480b), seq 4273541600, ack 1340386973, win 65483, options [mss 65495,sackOK,TS val 1290785846 ecr 1290785846,nop,wscale 7], length 0
2022-02-28 04:07:21.623121 IP (tos 0x0, ttl 64, id 17646, offset 0, flags [DF], proto TCP (6), length 52)
    127.0.0.1.37180 > 127.0.0.1.9550: Flags [.], cksum 0xfe28 (incorrect -> 0x6ec7), seq 1, ack 1, win 512, options [nop,nop,TS val 1290785846 ecr 1290785846], length 0
2022-02-28 04:07:21.623244 IP (tos 0x0, ttl 64, id 17647, offset 0, flags [DF], proto TCP (6), length 55)
    127.0.0.1.37180 > 127.0.0.1.9550: Flags [P.], cksum 0xfe2b (incorrect -> 0x69bb), seq 1:4, ack 1, win 512, options [nop,nop,TS val 1290785846 ecr 1290785846], length 3
2022-02-28 04:07:21.623255 IP (tos 0x0, ttl 64, id 21094, offset 0, flags [DF], proto TCP (6), length 52)
    127.0.0.1.9550 > 127.0.0.1.37180: Flags [.], cksum 0xfe28 (incorrect -> 0x6ec4), seq 1, ack 4, win 512, options [nop,nop,TS val 1290785846 ecr 1290785846], length 0
2022-02-28 04:07:21.623288 IP (tos 0x0, ttl 64, id 21095, offset 0, flags [DF], proto TCP (6), length 54)
    127.0.0.1.9550 > 127.0.0.1.37180: Flags [P.], cksum 0xfe2a (incorrect -> 0x69ba), seq 1:3, ack 4, win 512, options [nop,nop,TS val 1290785846 ecr 1290785846], length 2
2022-02-28 04:07:21.623297 IP (tos 0x0, ttl 64, id 17648, offset 0, flags [DF], proto TCP (6), length 52)
    127.0.0.1.37180 > 127.0.0.1.9550: Flags [.], cksum 0xfe28 (incorrect -> 0x6ec2), seq 4, ack 3, win 512, options [nop,nop,TS val 1290785846 ecr 1290785846], length 0
2022-02-28 04:07:21.624991 IP (tos 0x0, ttl 64, id 17649, offset 0, flags [DF], proto TCP (6), length 62)
    127.0.0.1.37180 > 127.0.0.1.9550: Flags [P.], cksum 0xfe32 (incorrect -> 0xd5d8), seq 4:14, ack 3, win 512, options [nop,nop,TS val 1290785848 ecr 1290785846], length 10
2022-02-28 04:07:21.625010 IP (tos 0x0, ttl 64, id 21096, offset 0, flags [DF], proto TCP (6), length 52)
    127.0.0.1.9550 > 127.0.0.1.37180: Flags [.], cksum 0xfe28 (incorrect -> 0x6eb4), seq 3, ack 14, win 512, options [nop,nop,TS val 1290785848 ecr 1290785848], length 0
2022-02-28 04:07:21.683671 IP (tos 0x0, ttl 64, id 21097, offset 0, flags [DF], proto TCP (6), length 62)
    127.0.0.1.9550 > 127.0.0.1.37180: Flags [P.], cksum 0xfe32 (incorrect -> 0x6966), seq 3:13, ack 14, win 512, options [nop,nop,TS val 1290785907 ecr 1290785848], length 10
2022-02-28 04:07:21.683683 IP (tos 0x0, ttl 64, id 17650, offset 0, flags [DF], proto TCP (6), length 52)
    127.0.0.1.37180 > 127.0.0.1.9550: Flags [.], cksum 0xfe28 (incorrect -> 0x6e34), seq 14, ack 13, win 512, options [nop,nop,TS val 1290785907 ecr 1290785907], length 0
2022-02-28 04:07:21.689465 IP (tos 0x0, ttl 64, id 17651, offset 0, flags [DF], proto TCP (6), length 569)
    127.0.0.1.37180 > 127.0.0.1.9550: Flags [P.], cksum 0x002e (incorrect -> 0x1af0), seq 14:531, ack 13, win 512, options [nop,nop,TS val 1290785913 ecr 1290785907], length 517
2022-02-28 04:07:21.689474 IP (tos 0x0, ttl 64, id 21098, offset 0, flags [DF], proto TCP (6), length 52)
    127.0.0.1.9550 > 127.0.0.1.37180: Flags [.], cksum 0xfe28 (incorrect -> 0x6c27), seq 13, ack 531, win 508, options [nop,nop,TS val 1290785913 ecr 1290785913], length 0
2022-02-28 04:07:21.744228 IP (tos 0x0, ttl 64, id 21099, offset 0, flags [DF], proto TCP (6), length 3538)
    127.0.0.1.9550 > 127.0.0.1.37180: Flags [P.], cksum 0x0bc7 (incorrect -> 0x51ff), seq 13:3499, ack 531, win 512, options [nop,nop,TS val 1290785967 ecr 1290785913], length 3486
2022-02-28 04:07:21.744242 IP (tos 0x0, ttl 64, id 17652, offset 0, flags [DF], proto TCP (6), length 52)
    127.0.0.1.37180 > 127.0.0.1.9550: Flags [.], cksum 0xfe28 (incorrect -> 0x5e2b), seq 531, ack 3499, win 494, options [nop,nop,TS val 1290785967 ecr 1290785967], length 0
2022-02-28 04:07:21.766421 IP (tos 0x0, ttl 64, id 21100, offset 0, flags [DF], proto TCP (6), length 1838)
    127.0.0.1.9550 > 127.0.0.1.37180: Flags [P.], cksum 0x0523 (incorrect -> 0x5d06), seq 3499:5285, ack 531, win 512, options [nop,nop,TS val 1290785989 ecr 1290785967], length 1786
2022-02-28 04:07:21.766428 IP (tos 0x0, ttl 64, id 17653, offset 0, flags [DF], proto TCP (6), length 52)
    127.0.0.1.37180 > 127.0.0.1.9550: Flags [.], cksum 0xfe28 (incorrect -> 0x56fd), seq 531, ack 5285, win 501, options [nop,nop,TS val 1290785990 ecr 1290785989], length 0
2022-02-28 04:07:21.768916 IP (tos 0x0, ttl 64, id 17654, offset 0, flags [DF], proto TCP (6), length 210)
    127.0.0.1.37180 > 127.0.0.1.9550: Flags [P.], cksum 0xfec6 (incorrect -> 0x955d), seq 531:689, ack 5285, win 512, options [nop,nop,TS val 1290785992 ecr 1290785989], length 158
2022-02-28 04:07:21.768923 IP (tos 0x0, ttl 64, id 21101, offset 0, flags [DF], proto TCP (6), length 52)
    127.0.0.1.9550 > 127.0.0.1.37180: Flags [.], cksum 0xfe28 (incorrect -> 0x5650), seq 5285, ack 689, win 511, options [nop,nop,TS val 1290785992 ecr 1290785992], length 0
200, 8.88548493385315, 0.47052574157714844