2022-02-28 11:00:55.916949 IP (tos 0x0, ttl 64, id 14263, offset 0, flags [DF], proto TCP (6), length 60)
    127.0.0.1.54420 > 127.0.0.1.11650: Flags [S], cksum 0xfe30 (incorrect -> 0xa0d9), seq 197778385, win 65495, options [mss 65495,sackOK,TS val 1315600140 ecr 0,nop,wscale 7], length 0
2022-02-28 11:00:55.916960 IP (tos 0x0, ttl 64, id 0, offset 0, flags [DF], proto TCP (6), length 60)
    127.0.0.1.11650 > 127.0.0.1.54420: Flags [S.], cksum 0xfe30 (incorrect -> 0x9091), seq 1882380953, ack 197778386, win 65483, options [mss 65495,sackOK,TS val 1315600140 ecr 1315600140,nop,wscale 7], length 0
2022-02-28 11:00:55.916968 IP (tos 0x0, ttl 64, id 14264, offset 0, flags [DF], proto TCP (6), length 52)
    127.0.0.1.54420 > 127.0.0.1.11650: Flags [.], cksum 0xfe28 (incorrect -> 0xb74d), seq 1, ack 1, win 512, options [nop,nop,TS val 1315600140 ecr 1315600140], length 0
2022-02-28 11:00:55.917159 IP (tos 0x0, ttl 64, id 14265, offset 0, flags [DF], proto TCP (6), length 55)
    127.0.0.1.54420 > 127.0.0.1.11650: Flags [P.], cksum 0xfe2b (incorrect -> 0xb241), seq 1:4, ack 1, win 512, options [nop,nop,TS val 1315600140 ecr 1315600140], length 3
2022-02-28 11:00:55.917165 IP (tos 0x0, ttl 64, id 59555, offset 0, flags [DF], proto TCP (6), length 52)
    127.0.0.1.11650 > 127.0.0.1.54420: Flags [.], cksum 0xfe28 (incorrect -> 0xb74a), seq 1, ack 4, win 512, options [nop,nop,TS val 1315600140 ecr 1315600140], length 0
2022-02-28 11:00:55.917197 IP (tos 0x0, ttl 64, id 59556, offset 0, flags [DF], proto TCP (6), length 54)
    127.0.0.1.11650 > 127.0.0.1.54420: Flags [P.], cksum 0xfe2a (incorrect -> 0xb240), seq 1:3, ack 4, win 512, options [nop,nop,TS val 1315600140 ecr 1315600140], length 2
2022-02-28 11:00:55.917204 IP (tos 0x0, ttl 64, id 14266, offset 0, flags [DF], proto TCP (6), length 52)
    127.0.0.1.54420 > 127.0.0.1.11650: Flags [.], cksum 0xfe28 (incorrect -> 0xb748), seq 4, ack 3, win 512, options [nop,nop,TS val 1315600140 ecr 1315600140], length 0
2022-02-28 11:00:55.918731 IP (tos 0x0, ttl 64, id 14267, offset 0, flags [DF], proto TCP (6), length 62)
    127.0.0.1.54420 > 127.0.0.1.11650: Flags [P.], cksum 0xfe32 (incorrect -> 0x9a43), seq 4:14, ack 3, win 512, options [nop,nop,TS val 1315600142 ecr 1315600140], length 10
2022-02-28 11:00:55.918742 IP (tos 0x0, ttl 64, id 59557, offset 0, flags [DF], proto TCP (6), length 52)
    127.0.0.1.11650 > 127.0.0.1.54420: Flags [.], cksum 0xfe28 (incorrect -> 0xb73a), seq 3, ack 14, win 512, options [nop,nop,TS val 1315600142 ecr 1315600142], length 0
