2022-02-28 00:34:35.521229 IP (tos 0x0, ttl 64, id 62952, offset 0, flags [DF], proto TCP (6), length 60)
    127.0.0.1.49124 > 127.0.0.1.10850: Flags [S], cksum 0xfe30 (incorrect -> 0x8e07), seq 2351429310, win 65495, options [mss 65495,sackOK,TS val 1278019744 ecr 0,nop,wscale 7], length 0
2022-02-28 00:34:35.521244 IP (tos 0x0, ttl 64, id 0, offset 0, flags [DF], proto TCP (6), length 60)
    127.0.0.1.10850 > 127.0.0.1.49124: Flags [S.], cksum 0xfe30 (incorrect -> 0x6420), seq 2170835888, ack 2351429311, win 65483, options [mss 65495,sackOK,TS val 1278019744 ecr 1278019744,nop,wscale 7], length 0
2022-02-28 00:34:35.521257 IP (tos 0x0, ttl 64, id 62953, offset 0, flags [DF], proto TCP (6), length 52)
    127.0.0.1.49124 > 127.0.0.1.10850: Flags [.], cksum 0xfe28 (incorrect -> 0x8adc), seq 1, ack 1, win 512, options [nop,nop,TS val 1278019744 ecr 1278019744], length 0
2022-02-28 00:34:35.521476 IP (tos 0x0, ttl 64, id 62954, offset 0, flags [DF], proto TCP (6), length 55)
    127.0.0.1.49124 > 127.0.0.1.10850: Flags [P.], cksum 0xfe2b (incorrect -> 0x85cf), seq 1:4, ack 1, win 512, options [nop,nop,TS val 1278019745 ecr 1278019744], length 3
2022-02-28 00:34:35.521486 IP (tos 0x0, ttl 64, id 26513, offset 0, flags [DF], proto TCP (6), length 52)
    127.0.0.1.10850 > 127.0.0.1.49124: Flags [.], cksum 0xfe28 (incorrect -> 0x8ad7), seq 1, ack 4, win 512, options [nop,nop,TS val 1278019745 ecr 1278019745], length 0
2022-02-28 00:34:35.521516 IP (tos 0x0, ttl 64, id 26514, offset 0, flags [DF], proto TCP (6), length 54)
    127.0.0.1.10850 > 127.0.0.1.49124: Flags [P.], cksum 0xfe2a (incorrect -> 0x85cd), seq 1:3, ack 4, win 512, options [nop,nop,TS val 1278019745 ecr 1278019745], length 2
2022-02-28 00:34:35.521526 IP (tos 0x0, ttl 64, id 62955, offset 0, flags [DF], proto TCP (6), length 52)
    127.0.0.1.49124 > 127.0.0.1.10850: Flags [.], cksum 0xfe28 (incorrect -> 0x8ad5), seq 4, ack 3, win 512, options [nop,nop,TS val 1278019745 ecr 1278019745], length 0
2022-02-28 00:34:35.523037 IP (tos 0x0, ttl 64, id 62956, offset 0, flags [DF], proto TCP (6), length 62)
    127.0.0.1.49124 > 127.0.0.1.10850: Flags [P.], cksum 0xfe32 (incorrect -> 0x4c8c), seq 4:14, ack 3, win 512, options [nop,nop,TS val 1278019746 ecr 1278019745], length 10
2022-02-28 00:34:35.523048 IP (tos 0x0, ttl 64, id 26515, offset 0, flags [DF], proto TCP (6), length 52)
    127.0.0.1.10850 > 127.0.0.1.49124: Flags [.], cksum 0xfe28 (incorrect -> 0x8ac9), seq 3, ack 14, win 512, options [nop,nop,TS val 1278019746 ecr 1278019746], length 0
2022-02-28 00:34:35.682143 IP (tos 0x0, ttl 64, id 26516, offset 0, flags [DF], proto TCP (6), length 62)
    127.0.0.1.10850 > 127.0.0.1.49124: Flags [P.], cksum 0xfe32 (incorrect -> 0x8517), seq 3:13, ack 14, win 512, options [nop,nop,TS val 1278019905 ecr 1278019746], length 10
2022-02-28 00:34:35.682156 IP (tos 0x0, ttl 64, id 62957, offset 0, flags [DF], proto TCP (6), length 52)
    127.0.0.1.49124 > 127.0.0.1.10850: Flags [.], cksum 0xfe28 (incorrect -> 0x8981), seq 14, ack 13, win 512, options [nop,nop,TS val 1278019905 ecr 1278019905], length 0
200, 3.9525206089019775, 1.1471898555755615