2022-02-28 04:42:34.265825 IP (tos 0x0, ttl 64, id 21175, offset 0, flags [DF], proto TCP (6), length 60)
    127.0.0.1.44228 > 127.0.0.1.9150: Flags [S], cksum 0xfe30 (incorrect -> 0x5ec3), seq 541369006, win 65495, options [mss 65495,sackOK,TS val 1292898489 ecr 0,nop,wscale 7], length 0
2022-02-28 04:42:34.265839 IP (tos 0x0, ttl 64, id 0, offset 0, flags [DF], proto TCP (6), length 60)
    127.0.0.1.9150 > 127.0.0.1.44228: Flags [S.], cksum 0xfe30 (incorrect -> 0xf218), seq 2440920414, ack 541369007, win 65483, options [mss 65495,sackOK,TS val 1292898489 ecr 1292898489,nop,wscale 7], length 0
2022-02-28 04:42:34.265850 IP (tos 0x0, ttl 64, id 21176, offset 0, flags [DF], proto TCP (6), length 52)
    127.0.0.1.44228 > 127.0.0.1.9150: Flags [.], cksum 0xfe28 (incorrect -> 0x18d5), seq 1, ack 1, win 512, options [nop,nop,TS val 1292898489 ecr 1292898489], length 0
2022-02-28 04:42:34.265969 IP (tos 0x0, ttl 64, id 21177, offset 0, flags [DF], proto TCP (6), length 55)
    127.0.0.1.44228 > 127.0.0.1.9150: Flags [P.], cksum 0xfe2b (incorrect -> 0x13c9), seq 1:4, ack 1, win 512, options [nop,nop,TS val 1292898489 ecr 1292898489], length 3
2022-02-28 04:42:34.265984 IP (tos 0x0, ttl 64, id 55675, offset 0, flags [DF], proto TCP (6), length 52)
    127.0.0.1.9150 > 127.0.0.1.44228: Flags [.], cksum 0xfe28 (incorrect -> 0x18d2), seq 1, ack 4, win 512, options [nop,nop,TS val 1292898489 ecr 1292898489], length 0
2022-02-28 04:42:34.266029 IP (tos 0x0, ttl 64, id 55676, offset 0, flags [DF], proto TCP (6), length 54)
    127.0.0.1.9150 > 127.0.0.1.44228: Flags [P.], cksum 0xfe2a (incorrect -> 0x13c8), seq 1:3, ack 4, win 512, options [nop,nop,TS val 1292898489 ecr 1292898489], length 2
2022-02-28 04:42:34.266045 IP (tos 0x0, ttl 64, id 21178, offset 0, flags [DF], proto TCP (6), length 52)
    127.0.0.1.44228 > 127.0.0.1.9150: Flags [.], cksum 0xfe28 (incorrect -> 0x18d0), seq 4, ack 3, win 512, options [nop,nop,TS val 1292898489 ecr 1292898489], length 0
2022-02-28 04:42:34.277037 IP (tos 0x0, ttl 64, id 21179, offset 0, flags [DF], proto TCP (6), length 62)
    127.0.0.1.44228 > 127.0.0.1.9150: Flags [P.], cksum 0xfe32 (incorrect -> 0xd71e), seq 4:14, ack 3, win 512, options [nop,nop,TS val 1292898500 ecr 1292898489], length 10
2022-02-28 04:42:34.277083 IP (tos 0x0, ttl 64, id 55677, offset 0, flags [DF], proto TCP (6), length 52)
    127.0.0.1.9150 > 127.0.0.1.44228: Flags [.], cksum 0xfe28 (incorrect -> 0x18b0), seq 3, ack 14, win 512, options [nop,nop,TS val 1292898500 ecr 1292898500], length 0
2022-02-28 04:42:34.559645 IP (tos 0x0, ttl 64, id 55678, offset 0, flags [DF], proto TCP (6), length 62)
    127.0.0.1.9150 > 127.0.0.1.44228: Flags [P.], cksum 0xfe32 (incorrect -> 0x1282), seq 3:13, ack 14, win 512, options [nop,nop,TS val 1292898783 ecr 1292898500], length 10
2022-02-28 04:42:34.559654 IP (tos 0x0, ttl 64, id 21180, offset 0, flags [DF], proto TCP (6), length 52)
    127.0.0.1.44228 > 127.0.0.1.9150: Flags [.], cksum 0xfe28 (incorrect -> 0x1670), seq 14, ack 13, win 512, options [nop,nop,TS val 1292898783 ecr 1292898783], length 0
2022-02-28 04:42:34.565749 IP (tos 0x0, ttl 64, id 21181, offset 0, flags [DF], proto TCP (6), length 569)
    127.0.0.1.44228 > 127.0.0.1.9150: Flags [P.], cksum 0x002e (incorrect -> 0xc9c5), seq 14:531, ack 13, win 512, options [nop,nop,TS val 1292898789 ecr 1292898783], length 517
2022-02-28 04:42:34.565760 IP (tos 0x0, ttl 64, id 55679, offset 0, flags [DF], proto TCP (6), length 52)
    127.0.0.1.9150 > 127.0.0.1.44228: Flags [.], cksum 0xfe28 (incorrect -> 0x1463), seq 13, ack 531, win 508, options [nop,nop,TS val 1292898789 ecr 1292898789], length 0
2022-02-28 04:42:34.849026 IP (tos 0x0, ttl 64, id 55680, offset 0, flags [DF], proto TCP (6), length 3538)
    127.0.0.1.9150 > 127.0.0.1.44228: Flags [P.], cksum 0x0bc7 (incorrect -> 0x4358), seq 13:3499, ack 531, win 512, options [nop,nop,TS val 1292899072 ecr 1292898789], length 3486
2022-02-28 04:42:34.849056 IP (tos 0x0, ttl 64, id 21182, offset 0, flags [DF], proto TCP (6), length 52)
    127.0.0.1.44228 > 127.0.0.1.9150: Flags [.], cksum 0xfe28 (incorrect -> 0x049d), seq 531, ack 3499, win 494, options [nop,nop,TS val 1292899072 ecr 1292899072], length 0
2022-02-28 04:42:34.958181 IP (tos 0x0, ttl 64, id 55681, offset 0, flags [DF], proto TCP (6), length 1266)
    127.0.0.1.9150 > 127.0.0.1.44228: Flags [P.], cksum 0x02e7 (incorrect -> 0x3c6c), seq 3499:4713, ack 531, win 512, options [nop,nop,TS val 1292899181 ecr 1292899072], length 1214
2022-02-28 04:42:34.958191 IP (tos 0x0, ttl 64, id 21183, offset 0, flags [DF], proto TCP (6), length 52)
    127.0.0.1.44228 > 127.0.0.1.9150: Flags [.], cksum 0xfe28 (incorrect -> 0xfefb), seq 531, ack 4713, win 503, options [nop,nop,TS val 1292899181 ecr 1292899181], length 0
2022-02-28 04:42:34.958747 IP (tos 0x0, ttl 64, id 21184, offset 0, flags [DF], proto TCP (6), length 132)
    127.0.0.1.44228 > 127.0.0.1.9150: Flags [P.], cksum 0xfe78 (incorrect -> 0xf78c), seq 531:611, ack 4713, win 512, options [nop,nop,TS val 1292899182 ecr 1292899181], length 80
2022-02-28 04:42:34.958758 IP (tos 0x0, ttl 64, id 55682, offset 0, flags [DF], proto TCP (6), length 52)
    127.0.0.1.9150 > 127.0.0.1.44228: Flags [.], cksum 0xfe28 (incorrect -> 0xfea0), seq 4713, ack 611, win 512, options [nop,nop,TS val 1292899182 ecr 1292899182], length 0
2022-02-28 04:42:34.959333 IP (tos 0x0, ttl 64, id 21185, offset 0, flags [DF], proto TCP (6), length 333)
    127.0.0.1.44228 > 127.0.0.1.9150: Flags [P.], cksum 0xff41 (incorrect -> 0x07b6), seq 611:892, ack 4713, win 512, options [nop,nop,TS val 1292899182 ecr 1292899182], length 281
2022-02-28 04:42:34.959340 IP (tos 0x0, ttl 64, id 55683, offset 0, flags [DF], proto TCP (6), length 52)
    127.0.0.1.9150 > 127.0.0.1.44228: Flags [.], cksum 0xfe28 (incorrect -> 0xfd89), seq 4713, ack 892, win 510, options [nop,nop,TS val 1292899182 ecr 1292899182], length 0
2022-02-28 04:42:35.254907 IP (tos 0x0, ttl 64, id 55684, offset 0, flags [DF], proto TCP (6), length 594)
    127.0.0.1.9150 > 127.0.0.1.44228: Flags [P.], cksum 0x0047 (incorrect -> 0x972f), seq 4713:5255, ack 892, win 512, options [nop,nop,TS val 1292899478 ecr 1292899182], length 542
2022-02-28 04:42:35.254921 IP (tos 0x0, ttl 64, id 21186, offset 0, flags [DF], proto TCP (6), length 52)
    127.0.0.1.44228 > 127.0.0.1.9150: Flags [.], cksum 0xfe28 (incorrect -> 0xf91d), seq 892, ack 5255, win 508, options [nop,nop,TS val 1292899478 ecr 1292899478], length 0
2022-02-28 04:42:35.301650 IP (tos 0x0, ttl 64, id 55685, offset 0, flags [DF], proto TCP (6), length 3538)
    127.0.0.1.9150 > 127.0.0.1.44228: Flags [P.], cksum 0x0bc7 (incorrect -> 0x5dc6), seq 5255:8741, ack 892, win 512, options [nop,nop,TS val 1292899525 ecr 1292899478], length 3486
2022-02-28 04:42:35.301660 IP (tos 0x0, ttl 64, id 21187, offset 0, flags [DF], proto TCP (6), length 52)
    127.0.0.1.44228 > 127.0.0.1.9150: Flags [.], cksum 0xfe28 (incorrect -> 0xeb2f), seq 892, ack 8741, win 494, options [nop,nop,TS val 1292899525 ecr 1292899525], length 0
2022-02-28 04:42:35.374011 IP (tos 0x0, ttl 64, id 55686, offset 0, flags [DF], proto TCP (6), length 2135)
    127.0.0.1.9150 > 127.0.0.1.44228: Flags [P.], cksum 0x064c (incorrect -> 0xde5b), seq 8741:10824, ack 892, win 512, options [nop,nop,TS val 1292899597 ecr 1292899525], length 2083
2022-02-28 04:42:35.374019 IP (tos 0x0, ttl 64, id 21188, offset 0, flags [DF], proto TCP (6), length 52)
    127.0.0.1.44228 > 127.0.0.1.9150: Flags [.], cksum 0xfe28 (incorrect -> 0xe277), seq 892, ack 10824, win 499, options [nop,nop,TS val 1292899597 ecr 1292899597], length 0
2022-02-28 04:42:35.377295 IP (tos 0x0, ttl 64, id 21189, offset 0, flags [DF], proto TCP (6), length 1352)
    127.0.0.1.44228 > 127.0.0.1.9150: Flags [P.], cksum 0x033d (incorrect -> 0x6d0d), seq 892:2192, ack 10824, win 512, options [nop,nop,TS val 1292899600 ecr 1292899597], length 1300
2022-02-28 04:42:35.377306 IP (tos 0x0, ttl 64, id 55687, offset 0, flags [DF], proto TCP (6), length 52)
    127.0.0.1.9150 > 127.0.0.1.44228: Flags [.], cksum 0xfe28 (incorrect -> 0xdd5a), seq 10824, ack 2192, win 502, options [nop,nop,TS val 1292899600 ecr 1292899600], length 0
200, 5.009034872055054, 1.6110424995422363