2022-02-28 13:41:01.390047 IP (tos 0x0, ttl 64, id 53484, offset 0, flags [DF], proto TCP (6), length 60)
    127.0.0.1.54600 > 127.0.0.1.11650: Flags [S], cksum 0xfe30 (incorrect -> 0xfbbb), seq 375251891, win 65495, options [mss 65495,sackOK,TS val 1325205613 ecr 0,nop,wscale 7], length 0
2022-02-28 13:41:01.390057 IP (tos 0x0, ttl 64, id 0, offset 0, flags [DF], proto TCP (6), length 60)
    127.0.0.1.11650 > 127.0.0.1.54600: Flags [S.], cksum 0xfe30 (incorrect -> 0x91a6), seq 829284664, ack 375251892, win 65483, options [mss 65495,sackOK,TS val 1325205613 ecr 1325205613,nop,wscale 7], length 0
2022-02-28 13:41:01.390066 IP (tos 0x0, ttl 64, id 53485, offset 0, flags [DF], proto TCP (6), length 52)
    127.0.0.1.54600 > 127.0.0.1.11650: Flags [.], cksum 0xfe28 (incorrect -> 0xb862), seq 1, ack 1, win 512, options [nop,nop,TS val 1325205613 ecr 1325205613], length 0
2022-02-28 13:41:01.390230 IP (tos 0x0, ttl 64, id 53486, offset 0, flags [DF], proto TCP (6), length 55)
    127.0.0.1.54600 > 127.0.0.1.11650: Flags [P.], cksum 0xfe2b (incorrect -> 0xb356), seq 1:4, ack 1, win 512, options [nop,nop,TS val 1325205613 ecr 1325205613], length 3
2022-02-28 13:41:01.390251 IP (tos 0x0, ttl 64, id 105, offset 0, flags [DF], proto TCP (6), length 52)
    127.0.0.1.11650 > 127.0.0.1.54600: Flags [.], cksum 0xfe28 (incorrect -> 0xb85f), seq 1, ack 4, win 512, options [nop,nop,TS val 1325205613 ecr 1325205613], length 0
2022-02-28 13:41:01.390304 IP (tos 0x0, ttl 64, id 106, offset 0, flags [DF], proto TCP (6), length 54)
    127.0.0.1.11650 > 127.0.0.1.54600: Flags [P.], cksum 0xfe2a (incorrect -> 0xb355), seq 1:3, ack 4, win 512, options [nop,nop,TS val 1325205613 ecr 1325205613], length 2
2022-02-28 13:41:01.390317 IP (tos 0x0, ttl 64, id 53487, offset 0, flags [DF], proto TCP (6), length 52)
    127.0.0.1.54600 > 127.0.0.1.11650: Flags [.], cksum 0xfe28 (incorrect -> 0xb85d), seq 4, ack 3, win 512, options [nop,nop,TS val 1325205613 ecr 1325205613], length 0
2022-02-28 13:41:01.620371 IP (tos 0x0, ttl 64, id 53488, offset 0, flags [DF], proto TCP (6), length 62)
    127.0.0.1.54600 > 127.0.0.1.11650: Flags [P.], cksum 0xfe32 (incorrect -> 0x2df4), seq 4:14, ack 3, win 512, options [nop,nop,TS val 1325205843 ecr 1325205613], length 10
2022-02-28 13:41:01.620389 IP (tos 0x0, ttl 64, id 107, offset 0, flags [DF], proto TCP (6), length 52)
    127.0.0.1.11650 > 127.0.0.1.54600: Flags [.], cksum 0xfe28 (incorrect -> 0xb687), seq 3, ack 14, win 512, options [nop,nop,TS val 1325205843 ecr 1325205843], length 0
2022-02-28 13:41:01.678676 IP (tos 0x0, ttl 64, id 108, offset 0, flags [DF], proto TCP (6), length 62)
    127.0.0.1.11650 > 127.0.0.1.54600: Flags [P.], cksum 0xfe32 (incorrect -> 0xb139), seq 3:13, ack 14, win 512, options [nop,nop,TS val 1325205902 ecr 1325205843], length 10
2022-02-28 13:41:01.678686 IP (tos 0x0, ttl 64, id 53489, offset 0, flags [DF], proto TCP (6), length 52)
    127.0.0.1.54600 > 127.0.0.1.11650: Flags [.], cksum 0xfe28 (incorrect -> 0xb607), seq 14, ack 13, win 512, options [nop,nop,TS val 1325205902 ecr 1325205902], length 0
2022-02-28 13:41:01.685009 IP (tos 0x0, ttl 64, id 53490, offset 0, flags [DF], proto TCP (6), length 569)
    127.0.0.1.54600 > 127.0.0.1.11650: Flags [P.], cksum 0x002e (incorrect -> 0xd6a3), seq 14:531, ack 13, win 512, options [nop,nop,TS val 1325205908 ecr 1325205902], length 517
2022-02-28 13:41:01.685021 IP (tos 0x0, ttl 64, id 109, offset 0, flags [DF], proto TCP (6), length 52)
    127.0.0.1.11650 > 127.0.0.1.54600: Flags [.], cksum 0xfe28 (incorrect -> 0xb3fa), seq 13, ack 531, win 508, options [nop,nop,TS val 1325205908 ecr 1325205908], length 0
2022-02-28 13:41:01.735353 IP (tos 0x0, ttl 64, id 110, offset 0, flags [DF], proto TCP (6), length 3538)
    127.0.0.1.11650 > 127.0.0.1.54600: Flags [P.], cksum 0x0bc7 (incorrect -> 0x20f6), seq 13:3499, ack 531, win 512, options [nop,nop,TS val 1325205958 ecr 1325205908], length 3486
2022-02-28 13:41:01.735367 IP (tos 0x0, ttl 64, id 53491, offset 0, flags [DF], proto TCP (6), length 52)
    127.0.0.1.54600 > 127.0.0.1.11650: Flags [.], cksum 0xfe28 (incorrect -> 0xa606), seq 531, ack 3499, win 494, options [nop,nop,TS val 1325205958 ecr 1325205958], length 0
2022-02-28 13:41:01.746039 IP (tos 0x0, ttl 64, id 111, offset 0, flags [DF], proto TCP (6), length 850)
    127.0.0.1.11650 > 127.0.0.1.54600: Flags [P.], cksum 0x0147 (incorrect -> 0xc616), seq 3499:4297, ack 531, win 512, options [nop,nop,TS val 1325205969 ecr 1325205958], length 798
2022-02-28 13:41:01.746048 IP (tos 0x0, ttl 64, id 53492, offset 0, flags [DF], proto TCP (6), length 52)
    127.0.0.1.54600 > 127.0.0.1.11650: Flags [.], cksum 0xfe28 (incorrect -> 0xa2c8), seq 531, ack 4297, win 504, options [nop,nop,TS val 1325205969 ecr 1325205969], length 0
2022-02-28 13:41:01.756974 IP (tos 0x0, ttl 64, id 112, offset 0, flags [DF], proto TCP (6), length 1336)
    127.0.0.1.11650 > 127.0.0.1.54600: Flags [P.], cksum 0x032d (incorrect -> 0xf41d), seq 4297:5581, ack 531, win 512, options [nop,nop,TS val 1325205980 ecr 1325205969], length 1284
2022-02-28 13:41:01.756982 IP (tos 0x0, ttl 64, id 53493, offset 0, flags [DF], proto TCP (6), length 52)
    127.0.0.1.54600 > 127.0.0.1.11650: Flags [.], cksum 0xfe28 (incorrect -> 0x9db0), seq 531, ack 5581, win 502, options [nop,nop,TS val 1325205980 ecr 1325205980], length 0
2022-02-28 13:41:01.757506 IP (tos 0x0, ttl 64, id 53494, offset 0, flags [DF], proto TCP (6), length 116)
    127.0.0.1.54600 > 127.0.0.1.11650: Flags [P.], cksum 0xfe68 (incorrect -> 0xd2b7), seq 531:595, ack 5581, win 512, options [nop,nop,TS val 1325205981 ecr 1325205980], length 64
2022-02-28 13:41:01.757517 IP (tos 0x0, ttl 64, id 113, offset 0, flags [DF], proto TCP (6), length 52)
    127.0.0.1.11650 > 127.0.0.1.54600: Flags [.], cksum 0xfe28 (incorrect -> 0x9d64), seq 5581, ack 595, win 512, options [nop,nop,TS val 1325205981 ecr 1325205981], length 0
2022-02-28 13:41:01.758215 IP (tos 0x0, ttl 64, id 53495, offset 0, flags [DF], proto TCP (6), length 328)
    127.0.0.1.54600 > 127.0.0.1.11650: Flags [P.], cksum 0xff3c (incorrect -> 0x1d7c), seq 595:871, ack 5581, win 512, options [nop,nop,TS val 1325205981 ecr 1325205981], length 276
2022-02-28 13:41:01.758226 IP (tos 0x0, ttl 64, id 114, offset 0, flags [DF], proto TCP (6), length 52)
    127.0.0.1.11650 > 127.0.0.1.54600: Flags [.], cksum 0xfe28 (incorrect -> 0x9c52), seq 5581, ack 871, win 510, options [nop,nop,TS val 1325205981 ecr 1325205981], length 0
2022-02-28 13:41:01.900239 IP (tos 0x0, ttl 64, id 115, offset 0, flags [DF], proto TCP (6), length 4100)
    127.0.0.1.11650 > 127.0.0.1.54600: Flags [P.], cksum 0x0df9 (incorrect -> 0xbb6d), seq 5581:9629, ack 871, win 512, options [nop,nop,TS val 1325206123 ecr 1325205981], length 4048
2022-02-28 13:41:01.900251 IP (tos 0x0, ttl 64, id 53496, offset 0, flags [DF], proto TCP (6), length 52)
    127.0.0.1.54600 > 127.0.0.1.11650: Flags [.], cksum 0xfe28 (incorrect -> 0x8b78), seq 871, ack 9629, win 492, options [nop,nop,TS val 1325206123 ecr 1325206123], length 0
2022-02-28 13:41:01.900261 IP (tos 0x0, ttl 64, id 116, offset 0, flags [DF], proto TCP (6), length 1482)
    127.0.0.1.11650 > 127.0.0.1.54600: Flags [P.], cksum 0x03bf (incorrect -> 0xc78a), seq 9629:11059, ack 871, win 512, options [nop,nop,TS val 1325206123 ecr 1325206123], length 1430
2022-02-28 13:41:01.900267 IP (tos 0x0, ttl 64, id 53497, offset 0, flags [DF], proto TCP (6), length 52)
    127.0.0.1.54600 > 127.0.0.1.11650: Flags [.], cksum 0xfe28 (incorrect -> 0x85e8), seq 871, ack 11059, win 486, options [nop,nop,TS val 1325206123 ecr 1325206123], length 0
2022-02-28 13:41:01.900724 IP (tos 0x0, ttl 64, id 117, offset 0, flags [DF], proto TCP (6), length 2542)
    127.0.0.1.11650 > 127.0.0.1.54600: Flags [P.], cksum 0x07e3 (incorrect -> 0x27f2), seq 11059:13549, ack 871, win 512, options [nop,nop,TS val 1325206124 ecr 1325206123], length 2490
2022-02-28 13:41:01.900731 IP (tos 0x0, ttl 64, id 53498, offset 0, flags [DF], proto TCP (6), length 52)
    127.0.0.1.54600 > 127.0.0.1.11650: Flags [.], cksum 0xfe28 (incorrect -> 0x7c20), seq 871, ack 13549, win 498, options [nop,nop,TS val 1325206124 ecr 1325206124], length 0
2022-02-28 13:41:01.902586 IP (tos 0x0, ttl 64, id 118, offset 0, flags [DF], proto TCP (6), length 2080)
    127.0.0.1.11650 > 127.0.0.1.54600: Flags [P.], cksum 0x0615 (incorrect -> 0xf6ee), seq 13549:15577, ack 871, win 512, options [nop,nop,TS val 1325206126 ecr 1325206124], length 2028
2022-02-28 13:41:01.902593 IP (tos 0x0, ttl 64, id 53499, offset 0, flags [DF], proto TCP (6), length 52)
    127.0.0.1.54600 > 127.0.0.1.11650: Flags [.], cksum 0xfe28 (incorrect -> 0x742e), seq 871, ack 15577, win 500, options [nop,nop,TS val 1325206126 ecr 1325206126], length 0
2022-02-28 13:41:01.910317 IP (tos 0x0, ttl 64, id 119, offset 0, flags [DF], proto TCP (6), length 3538)
    127.0.0.1.11650 > 127.0.0.1.54600: Flags [P.], cksum 0x0bc7 (incorrect -> 0x2cf3), seq 15577:19063, ack 871, win 512, options [nop,nop,TS val 1325206133 ecr 1325206126], length 3486
2022-02-28 13:41:01.910326 IP (tos 0x0, ttl 64, id 53500, offset 0, flags [DF], proto TCP (6), length 52)
    127.0.0.1.54600 > 127.0.0.1.11650: Flags [.], cksum 0xfe28 (incorrect -> 0x6688), seq 871, ack 19063, win 494, options [nop,nop,TS val 1325206133 ecr 1325206133], length 0
2022-02-28 13:41:01.910466 IP (tos 0x0, ttl 64, id 120, offset 0, flags [DF], proto TCP (6), length 4100)
    127.0.0.1.11650 > 127.0.0.1.54600: Flags [P.], cksum 0x0df9 (incorrect -> 0x631f), seq 19063:23111, ack 871, win 512, options [nop,nop,TS val 1325206134 ecr 1325206133], length 4048
2022-02-28 13:41:01.910473 IP (tos 0x0, ttl 64, id 53501, offset 0, flags [DF], proto TCP (6), length 52)
    127.0.0.1.54600 > 127.0.0.1.11650: Flags [.], cksum 0xfe28 (incorrect -> 0x56b8), seq 871, ack 23111, win 492, options [nop,nop,TS val 1325206134 ecr 1325206134], length 0
2022-02-28 13:41:01.910482 IP (tos 0x0, ttl 64, id 121, offset 0, flags [DF], proto TCP (6), length 920)
    127.0.0.1.11650 > 127.0.0.1.54600: Flags [P.], cksum 0x018d (incorrect -> 0xc6bb), seq 23111:23979, ack 871, win 512, options [nop,nop,TS val 1325206134 ecr 1325206134], length 868
2022-02-28 13:41:01.910487 IP (tos 0x0, ttl 64, id 53502, offset 0, flags [DF], proto TCP (6), length 52)
    127.0.0.1.54600 > 127.0.0.1.11650: Flags [.], cksum 0xfe28 (incorrect -> 0x5358), seq 871, ack 23979, win 488, options [nop,nop,TS val 1325206134 ecr 1325206134], length 0
2022-02-28 13:41:01.912423 IP (tos 0x0, ttl 64, id 122, offset 0, flags [DF], proto TCP (6), length 4100)
    127.0.0.1.11650 > 127.0.0.1.54600: Flags [P.], cksum 0x0df9 (incorrect -> 0x0a1e), seq 23979:28027, ack 871, win 512, options [nop,nop,TS val 1325206135 ecr 1325206134], length 4048
2022-02-28 13:41:01.912432 IP (tos 0x0, ttl 64, id 53503, offset 0, flags [DF], proto TCP (6), length 52)
    127.0.0.1.54600 > 127.0.0.1.11650: Flags [.], cksum 0xfe28 (incorrect -> 0x4381), seq 871, ack 28027, win 492, options [nop,nop,TS val 1325206136 ecr 1325206135], length 0
2022-02-28 13:41:01.912442 IP (tos 0x0, ttl 64, id 123, offset 0, flags [DF], proto TCP (6), length 2478)
    127.0.0.1.11650 > 127.0.0.1.54600: Flags [P.], cksum 0x07a3 (incorrect -> 0xa48d), seq 28027:30453, ack 871, win 512, options [nop,nop,TS val 1325206136 ecr 1325206136], length 2426
2022-02-28 13:41:01.912447 IP (tos 0x0, ttl 64, id 53504, offset 0, flags [DF], proto TCP (6), length 52)
    127.0.0.1.54600 > 127.0.0.1.11650: Flags [.], cksum 0xfe28 (incorrect -> 0x3a10), seq 871, ack 30453, win 482, options [nop,nop,TS val 1325206136 ecr 1325206136], length 0
2022-02-28 13:41:01.912870 IP (tos 0x0, ttl 64, id 124, offset 0, flags [DF], proto TCP (6), length 4100)
    127.0.0.1.11650 > 127.0.0.1.54600: Flags [P.], cksum 0x0df9 (incorrect -> 0xecdb), seq 30453:34501, ack 871, win 512, options [nop,nop,TS val 1325206136 ecr 1325206136], length 4048
2022-02-28 13:41:01.924560 IP (tos 0x0, ttl 64, id 125, offset 0, flags [DF], proto TCP (6), length 32820)
    127.0.0.1.11650 > 127.0.0.1.54600: Flags [.], cksum 0x7e29 (incorrect -> 0x94cf), seq 34501:67269, ack 871, win 512, options [nop,nop,TS val 1325206148 ecr 1325206136], length 32768
2022-02-28 13:41:01.924601 IP (tos 0x0, ttl 64, id 53505, offset 0, flags [DF], proto TCP (6), length 52)
    127.0.0.1.54600 > 127.0.0.1.11650: Flags [.], cksum 0xfe28 (incorrect -> 0xaa9a), seq 871, ack 67269, win 379, options [nop,nop,TS val 1325206148 ecr 1325206136], length 0
2022-02-28 13:41:01.924611 IP (tos 0x0, ttl 64, id 126, offset 0, flags [DF], proto TCP (6), length 6310)
    127.0.0.1.11650 > 127.0.0.1.54600: Flags [P.], cksum 0x169b (incorrect -> 0x6052), seq 67269:73527, ack 871, win 512, options [nop,nop,TS val 1325206148 ecr 1325206148], length 6258
2022-02-28 13:41:01.926527 IP (tos 0x0, ttl 64, id 53506, offset 0, flags [DF], proto TCP (6), length 52)
    127.0.0.1.54600 > 127.0.0.1.11650: Flags [.], cksum 0xfe28 (incorrect -> 0x9195), seq 871, ack 73527, win 512, options [nop,nop,TS val 1325206150 ecr 1325206148], length 0
2022-02-28 13:41:01.930817 IP (tos 0x0, ttl 64, id 127, offset 0, flags [DF], proto TCP (6), length 4100)
    127.0.0.1.11650 > 127.0.0.1.54600: Flags [P.], cksum 0x0df9 (incorrect -> 0x84bb), seq 73527:77575, ack 871, win 512, options [nop,nop,TS val 1325206154 ecr 1325206150], length 4048
2022-02-28 13:41:01.930904 IP (tos 0x0, ttl 64, id 53507, offset 0, flags [DF], proto TCP (6), length 52)
    127.0.0.1.54600 > 127.0.0.1.11650: Flags [.], cksum 0xfe28 (incorrect -> 0x81bb), seq 871, ack 77575, win 512, options [nop,nop,TS val 1325206154 ecr 1325206154], length 0
2022-02-28 13:41:01.930913 IP (tos 0x0, ttl 64, id 128, offset 0, flags [DF], proto TCP (6), length 10116)
    127.0.0.1.11650 > 127.0.0.1.54600: Flags [P.], cksum 0x2579 (incorrect -> 0x7e67), seq 77575:87639, ack 871, win 512, options [nop,nop,TS val 1325206154 ecr 1325206154], length 10064
2022-02-28 13:41:01.931254 IP (tos 0x0, ttl 64, id 53508, offset 0, flags [DF], proto TCP (6), length 52)
    127.0.0.1.54600 > 127.0.0.1.11650: Flags [.], cksum 0xfe28 (incorrect -> 0x5a6b), seq 871, ack 87639, win 512, options [nop,nop,TS val 1325206154 ecr 1325206154], length 0
2022-02-28 13:41:01.931339 IP (tos 0x0, ttl 64, id 129, offset 0, flags [DF], proto TCP (6), length 4100)
    127.0.0.1.11650 > 127.0.0.1.54600: Flags [P.], cksum 0x0df9 (incorrect -> 0xfef7), seq 87639:91687, ack 871, win 512, options [nop,nop,TS val 1325206154 ecr 1325206154], length 4048
2022-02-28 13:41:01.931416 IP (tos 0x0, ttl 64, id 53509, offset 0, flags [DF], proto TCP (6), length 52)
    127.0.0.1.54600 > 127.0.0.1.11650: Flags [.], cksum 0xfe28 (incorrect -> 0x4a9b), seq 871, ack 91687, win 512, options [nop,nop,TS val 1325206154 ecr 1325206154], length 0
2022-02-28 13:41:01.931423 IP (tos 0x0, ttl 64, id 130, offset 0, flags [DF], proto TCP (6), length 4806)
    127.0.0.1.11650 > 127.0.0.1.54600: Flags [P.], cksum 0x10bb (incorrect -> 0x50e8), seq 91687:96441, ack 871, win 512, options [nop,nop,TS val 1325206154 ecr 1325206154], length 4754
2022-02-28 13:41:01.931431 IP (tos 0x0, ttl 64, id 53510, offset 0, flags [DF], proto TCP (6), length 52)
    127.0.0.1.54600 > 127.0.0.1.11650: Flags [.], cksum 0xfe28 (incorrect -> 0x3808), seq 871, ack 96441, win 512, options [nop,nop,TS val 1325206155 ecr 1325206154], length 0
2022-02-28 13:41:01.932254 IP (tos 0x0, ttl 64, id 131, offset 0, flags [DF], proto TCP (6), length 3274)
    127.0.0.1.11650 > 127.0.0.1.54600: Flags [P.], cksum 0x0abf (incorrect -> 0x60cf), seq 96441:99663, ack 871, win 512, options [nop,nop,TS val 1325206155 ecr 1325206155], length 3222
2022-02-28 13:41:01.932271 IP (tos 0x0, ttl 64, id 53511, offset 0, flags [DF], proto TCP (6), length 52)
    127.0.0.1.54600 > 127.0.0.1.11650: Flags [.], cksum 0xfe28 (incorrect -> 0x2b71), seq 871, ack 99663, win 512, options [nop,nop,TS val 1325206155 ecr 1325206155], length 0
2022-02-28 13:41:01.932797 IP (tos 0x0, ttl 64, id 132, offset 0, flags [DF], proto TCP (6), length 4100)
    127.0.0.1.11650 > 127.0.0.1.54600: Flags [P.], cksum 0x0df9 (incorrect -> 0x86d7), seq 99663:103711, ack 871, win 512, options [nop,nop,TS val 1325206156 ecr 1325206155], length 4048
2022-02-28 13:41:01.932814 IP (tos 0x0, ttl 64, id 53512, offset 0, flags [DF], proto TCP (6), length 52)
    127.0.0.1.54600 > 127.0.0.1.11650: Flags [.], cksum 0xfe28 (incorrect -> 0x1b9f), seq 871, ack 103711, win 512, options [nop,nop,TS val 1325206156 ecr 1325206156], length 0
2022-02-28 13:41:01.932821 IP (tos 0x0, ttl 64, id 133, offset 0, flags [DF], proto TCP (6), length 2478)
    127.0.0.1.11650 > 127.0.0.1.54600: Flags [P.], cksum 0x07a3 (incorrect -> 0x4687), seq 103711:106137, ack 871, win 512, options [nop,nop,TS val 1325206156 ecr 1325206156], length 2426
2022-02-28 13:41:01.933380 IP (tos 0x0, ttl 64, id 53513, offset 0, flags [DF], proto TCP (6), length 52)
    127.0.0.1.54600 > 127.0.0.1.11650: Flags [.], cksum 0xfe28 (incorrect -> 0x1225), seq 871, ack 106137, win 512, options [nop,nop,TS val 1325206156 ecr 1325206156], length 0
2022-02-28 13:41:01.933604 IP (tos 0x0, ttl 64, id 134, offset 0, flags [DF], proto TCP (6), length 4100)
    127.0.0.1.11650 > 127.0.0.1.54600: Flags [P.], cksum 0x0df9 (incorrect -> 0xc455), seq 106137:110185, ack 871, win 512, options [nop,nop,TS val 1325206157 ecr 1325206156], length 4048
2022-02-28 13:41:01.933637 IP (tos 0x0, ttl 64, id 53514, offset 0, flags [DF], proto TCP (6), length 52)
    127.0.0.1.54600 > 127.0.0.1.11650: Flags [.], cksum 0xfe28 (incorrect -> 0x0253), seq 871, ack 110185, win 512, options [nop,nop,TS val 1325206157 ecr 1325206157], length 0
2022-02-28 13:41:01.933644 IP (tos 0x0, ttl 64, id 135, offset 0, flags [DF], proto TCP (6), length 5004)
    127.0.0.1.11650 > 127.0.0.1.54600: Flags [P.], cksum 0x1181 (incorrect -> 0x82fd), seq 110185:115137, ack 871, win 512, options [nop,nop,TS val 1325206157 ecr 1325206157], length 4952
2022-02-28 13:41:01.933650 IP (tos 0x0, ttl 64, id 53515, offset 0, flags [DF], proto TCP (6), length 52)
    127.0.0.1.54600 > 127.0.0.1.11650: Flags [.], cksum 0xfe28 (incorrect -> 0xeefa), seq 871, ack 115137, win 512, options [nop,nop,TS val 1325206157 ecr 1325206157], length 0
2022-02-28 13:41:01.934732 IP (tos 0x0, ttl 64, id 136, offset 0, flags [DF], proto TCP (6), length 4100)
    127.0.0.1.11650 > 127.0.0.1.54600: Flags [P.], cksum 0x0df9 (incorrect -> 0x1c5b), seq 115137:119185, ack 871, win 512, options [nop,nop,TS val 1325206158 ecr 1325206157], length 4048
2022-02-28 13:41:01.934814 IP (tos 0x0, ttl 64, id 53516, offset 0, flags [DF], proto TCP (6), length 52)
    127.0.0.1.54600 > 127.0.0.1.11650: Flags [.], cksum 0xfe28 (incorrect -> 0xdf28), seq 871, ack 119185, win 512, options [nop,nop,TS val 1325206158 ecr 1325206158], length 0
200, 3.7867984771728516, 0.5541284084320068