2022-02-28 09:10:11.334694 IP (tos 0x0, ttl 64, id 53308, offset 0, flags [DF], proto TCP (6), length 60)
    127.0.0.1.49250 > 127.0.0.1.11850: Flags [S], cksum 0xfe30 (incorrect -> 0x7fe8), seq 2922434960, win 65495, options [mss 65495,sackOK,TS val 1308955558 ecr 0,nop,wscale 7], length 0
2022-02-28 09:10:11.334704 IP (tos 0x0, ttl 64, id 0, offset 0, flags [DF], proto TCP (6), length 60)
    127.0.0.1.11850 > 127.0.0.1.49250: Flags [S.], cksum 0xfe30 (incorrect -> 0x1754), seq 3319611654, ack 2922434961, win 65483, options [mss 65495,sackOK,TS val 1308955558 ecr 1308955558,nop,wscale 7], length 0
2022-02-28 09:10:11.334712 IP (tos 0x0, ttl 64, id 53309, offset 0, flags [DF], proto TCP (6), length 52)
    127.0.0.1.49250 > 127.0.0.1.11850: Flags [.], cksum 0xfe28 (incorrect -> 0x3e10), seq 1, ack 1, win 512, options [nop,nop,TS val 1308955558 ecr 1308955558], length 0
2022-02-28 09:10:11.334823 IP (tos 0x0, ttl 64, id 53310, offset 0, flags [DF], proto TCP (6), length 55)
    127.0.0.1.49250 > 127.0.0.1.11850: Flags [P.], cksum 0xfe2b (incorrect -> 0x3904), seq 1:4, ack 1, win 512, options [nop,nop,TS val 1308955558 ecr 1308955558], length 3
2022-02-28 09:10:11.334836 IP (tos 0x0, ttl 64, id 14481, offset 0, flags [DF], proto TCP (6), length 52)
    127.0.0.1.11850 > 127.0.0.1.49250: Flags [.], cksum 0xfe28 (incorrect -> 0x3e0d), seq 1, ack 4, win 512, options [nop,nop,TS val 1308955558 ecr 1308955558], length 0
2022-02-28 09:10:11.334870 IP (tos 0x0, ttl 64, id 14482, offset 0, flags [DF], proto TCP (6), length 54)
    127.0.0.1.11850 > 127.0.0.1.49250: Flags [P.], cksum 0xfe2a (incorrect -> 0x3903), seq 1:3, ack 4, win 512, options [nop,nop,TS val 1308955558 ecr 1308955558], length 2
2022-02-28 09:10:11.334884 IP (tos 0x0, ttl 64, id 53311, offset 0, flags [DF], proto TCP (6), length 52)
    127.0.0.1.49250 > 127.0.0.1.11850: Flags [.], cksum 0xfe28 (incorrect -> 0x3e0b), seq 4, ack 3, win 512, options [nop,nop,TS val 1308955558 ecr 1308955558], length 0
2022-02-28 09:10:11.336567 IP (tos 0x0, ttl 64, id 53312, offset 0, flags [DF], proto TCP (6), length 62)
    127.0.0.1.49250 > 127.0.0.1.11850: Flags [P.], cksum 0xfe32 (incorrect -> 0x9667), seq 4:14, ack 3, win 512, options [nop,nop,TS val 1308955560 ecr 1308955558], length 10
2022-02-28 09:10:11.336576 IP (tos 0x0, ttl 64, id 14483, offset 0, flags [DF], proto TCP (6), length 52)
    127.0.0.1.11850 > 127.0.0.1.49250: Flags [.], cksum 0xfe28 (incorrect -> 0x3dfd), seq 3, ack 14, win 512, options [nop,nop,TS val 1308955560 ecr 1308955560], length 0
2022-02-28 09:10:11.416419 IP (tos 0x0, ttl 64, id 14484, offset 0, flags [DF], proto TCP (6), length 62)
    127.0.0.1.11850 > 127.0.0.1.49250: Flags [P.], cksum 0xfe32 (incorrect -> 0x389b), seq 3:13, ack 14, win 512, options [nop,nop,TS val 1308955639 ecr 1308955560], length 10
2022-02-28 09:10:11.416432 IP (tos 0x0, ttl 64, id 53313, offset 0, flags [DF], proto TCP (6), length 52)
    127.0.0.1.49250 > 127.0.0.1.11850: Flags [.], cksum 0xfe28 (incorrect -> 0x3d55), seq 14, ack 13, win 512, options [nop,nop,TS val 1308955639 ecr 1308955639], length 0
2022-02-28 09:10:11.422009 IP (tos 0x0, ttl 64, id 53314, offset 0, flags [DF], proto TCP (6), length 569)
    127.0.0.1.49250 > 127.0.0.1.11850: Flags [P.], cksum 0x002e (incorrect -> 0x7527), seq 14:531, ack 13, win 512, options [nop,nop,TS val 1308955645 ecr 1308955639], length 517
2022-02-28 09:10:11.422019 IP (tos 0x0, ttl 64, id 14485, offset 0, flags [DF], proto TCP (6), length 52)
    127.0.0.1.11850 > 127.0.0.1.49250: Flags [.], cksum 0xfe28 (incorrect -> 0x3b48), seq 13, ack 531, win 508, options [nop,nop,TS val 1308955645 ecr 1308955645], length 0
200, 5.842203617095947, 0.3920269012451172