2022-02-28 06:37:00.089163 IP (tos 0x0, ttl 64, id 41198, offset 0, flags [DF], proto TCP (6), length 60)
    127.0.0.1.38664 > 127.0.0.1.11250: Flags [S], cksum 0xfe30 (incorrect -> 0x9689), seq 3373927314, win 65495, options [mss 65495,sackOK,TS val 1299764312 ecr 0,nop,wscale 7], length 0
2022-02-28 06:37:00.089175 IP (tos 0x0, ttl 64, id 0, offset 0, flags [DF], proto TCP (6), length 60)
    127.0.0.1.11250 > 127.0.0.1.38664: Flags [S.], cksum 0xfe30 (incorrect -> 0x32f5), seq 1499195490, ack 3373927315, win 65483, options [mss 65495,sackOK,TS val 1299764312 ecr 1299764312,nop,wscale 7], length 0
2022-02-28 06:37:00.089187 IP (tos 0x0, ttl 64, id 41199, offset 0, flags [DF], proto TCP (6), length 52)
    127.0.0.1.38664 > 127.0.0.1.11250: Flags [.], cksum 0xfe28 (incorrect -> 0x59b1), seq 1, ack 1, win 512, options [nop,nop,TS val 1299764312 ecr 1299764312], length 0
2022-02-28 06:37:00.089300 IP (tos 0x0, ttl 64, id 41200, offset 0, flags [DF], proto TCP (6), length 55)
    127.0.0.1.38664 > 127.0.0.1.11250: Flags [P.], cksum 0xfe2b (incorrect -> 0x54a5), seq 1:4, ack 1, win 512, options [nop,nop,TS val 1299764312 ecr 1299764312], length 3
2022-02-28 06:37:00.089303 IP (tos 0x0, ttl 64, id 44971, offset 0, flags [DF], proto TCP (6), length 52)
    127.0.0.1.11250 > 127.0.0.1.38664: Flags [.], cksum 0xfe28 (incorrect -> 0x59ae), seq 1, ack 4, win 512, options [nop,nop,TS val 1299764312 ecr 1299764312], length 0
2022-02-28 06:37:00.089387 IP (tos 0x0, ttl 64, id 44972, offset 0, flags [DF], proto TCP (6), length 54)
    127.0.0.1.11250 > 127.0.0.1.38664: Flags [P.], cksum 0xfe2a (incorrect -> 0x54a4), seq 1:3, ack 4, win 512, options [nop,nop,TS val 1299764312 ecr 1299764312], length 2
2022-02-28 06:37:00.089392 IP (tos 0x0, ttl 64, id 41201, offset 0, flags [DF], proto TCP (6), length 52)
    127.0.0.1.38664 > 127.0.0.1.11250: Flags [.], cksum 0xfe28 (incorrect -> 0x59ac), seq 4, ack 3, win 512, options [nop,nop,TS val 1299764312 ecr 1299764312], length 0
2022-02-28 06:37:00.101373 IP (tos 0x0, ttl 64, id 41202, offset 0, flags [DF], proto TCP (6), length 62)
    127.0.0.1.38664 > 127.0.0.1.11250: Flags [P.], cksum 0xfe32 (incorrect -> 0x9601), seq 4:14, ack 3, win 512, options [nop,nop,TS val 1299764324 ecr 1299764312], length 10
2022-02-28 06:37:00.101382 IP (tos 0x0, ttl 64, id 44973, offset 0, flags [DF], proto TCP (6), length 52)
    127.0.0.1.11250 > 127.0.0.1.38664: Flags [.], cksum 0xfe28 (incorrect -> 0x598a), seq 3, ack 14, win 512, options [nop,nop,TS val 1299764324 ecr 1299764324], length 0
2022-02-28 06:37:00.196060 IP (tos 0x0, ttl 64, id 44974, offset 0, flags [DF], proto TCP (6), length 62)
    127.0.0.1.11250 > 127.0.0.1.38664: Flags [P.], cksum 0xfe32 (incorrect -> 0x5418), seq 3:13, ack 14, win 512, options [nop,nop,TS val 1299764419 ecr 1299764324], length 10
2022-02-28 06:37:00.196065 IP (tos 0x0, ttl 64, id 41203, offset 0, flags [DF], proto TCP (6), length 52)
    127.0.0.1.38664 > 127.0.0.1.11250: Flags [.], cksum 0xfe28 (incorrect -> 0x58c2), seq 14, ack 13, win 512, options [nop,nop,TS val 1299764419 ecr 1299764419], length 0
2022-02-28 06:37:00.201941 IP (tos 0x0, ttl 64, id 41204, offset 0, flags [DF], proto TCP (6), length 569)
    127.0.0.1.38664 > 127.0.0.1.11250: Flags [P.], cksum 0x002e (incorrect -> 0x662f), seq 14:531, ack 13, win 512, options [nop,nop,TS val 1299764425 ecr 1299764419], length 517
2022-02-28 06:37:00.201958 IP (tos 0x0, ttl 64, id 44975, offset 0, flags [DF], proto TCP (6), length 52)
    127.0.0.1.11250 > 127.0.0.1.38664: Flags [.], cksum 0xfe28 (incorrect -> 0x56b5), seq 13, ack 531, win 508, options [nop,nop,TS val 1299764425 ecr 1299764425], length 0
2022-02-28 06:37:00.290880 IP (tos 0x0, ttl 64, id 44976, offset 0, flags [DF], proto TCP (6), length 3429)
    127.0.0.1.11250 > 127.0.0.1.38664: Flags [P.], cksum 0x0b5a (incorrect -> 0x924b), seq 13:3390, ack 531, win 512, options [nop,nop,TS val 1299764514 ecr 1299764425], length 3377
2022-02-28 06:37:00.290904 IP (tos 0x0, ttl 64, id 41205, offset 0, flags [DF], proto TCP (6), length 52)
    127.0.0.1.38664 > 127.0.0.1.11250: Flags [.], cksum 0xfe28 (incorrect -> 0x48e0), seq 531, ack 3390, win 494, options [nop,nop,TS val 1299764514 ecr 1299764514], length 0
2022-02-28 06:37:00.291650 IP (tos 0x0, ttl 64, id 41206, offset 0, flags [DF], proto TCP (6), length 116)
    127.0.0.1.38664 > 127.0.0.1.11250: Flags [P.], cksum 0xfe68 (incorrect -> 0xce92), seq 531:595, ack 3390, win 512, options [nop,nop,TS val 1299764515 ecr 1299764514], length 64
2022-02-28 06:37:00.291657 IP (tos 0x0, ttl 64, id 44977, offset 0, flags [DF], proto TCP (6), length 52)
    127.0.0.1.11250 > 127.0.0.1.38664: Flags [.], cksum 0xfe28 (incorrect -> 0x488c), seq 3390, ack 595, win 512, options [nop,nop,TS val 1299764515 ecr 1299764515], length 0
2022-02-28 06:37:00.292207 IP (tos 0x0, ttl 64, id 41207, offset 0, flags [DF], proto TCP (6), length 337)
    127.0.0.1.38664 > 127.0.0.1.11250: Flags [P.], cksum 0xff45 (incorrect -> 0x1336), seq 595:880, ack 3390, win 512, options [nop,nop,TS val 1299764515 ecr 1299764515], length 285
2022-02-28 06:37:00.292212 IP (tos 0x0, ttl 64, id 44978, offset 0, flags [DF], proto TCP (6), length 52)
    127.0.0.1.11250 > 127.0.0.1.38664: Flags [.], cksum 0xfe28 (incorrect -> 0x4771), seq 3390, ack 880, win 510, options [nop,nop,TS val 1299764515 ecr 1299764515], length 0
2022-02-28 06:37:00.382401 IP (tos 0x0, ttl 64, id 44979, offset 0, flags [DF], proto TCP (6), length 594)
    127.0.0.1.11250 > 127.0.0.1.38664: Flags [P.], cksum 0x0047 (incorrect -> 0xe6d9), seq 3390:3932, ack 880, win 512, options [nop,nop,TS val 1299764605 ecr 1299764515], length 542
2022-02-28 06:37:00.382412 IP (tos 0x0, ttl 64, id 41208, offset 0, flags [DF], proto TCP (6), length 52)
    127.0.0.1.38664 > 127.0.0.1.11250: Flags [.], cksum 0xfe28 (incorrect -> 0x44a1), seq 880, ack 3932, win 508, options [nop,nop,TS val 1299764605 ecr 1299764605], length 0
2022-02-28 06:37:00.495127 IP (tos 0x0, ttl 64, id 44980, offset 0, flags [DF], proto TCP (6), length 1647)
    127.0.0.1.11250 > 127.0.0.1.38664: Flags [P.], cksum 0x0464 (incorrect -> 0x29de), seq 3932:5527, ack 880, win 512, options [nop,nop,TS val 1299764718 ecr 1299764605], length 1595
2022-02-28 06:37:00.495134 IP (tos 0x0, ttl 64, id 41209, offset 0, flags [DF], proto TCP (6), length 52)
    127.0.0.1.38664 > 127.0.0.1.11250: Flags [.], cksum 0xfe28 (incorrect -> 0x3d8b), seq 880, ack 5527, win 501, options [nop,nop,TS val 1299764718 ecr 1299764718], length 0
2022-02-28 06:37:00.556051 IP (tos 0x0, ttl 64, id 44981, offset 0, flags [DF], proto TCP (6), length 3038)
    127.0.0.1.11250 > 127.0.0.1.38664: Flags [P.], cksum 0x09d3 (incorrect -> 0x2cf3), seq 5527:8513, ack 880, win 512, options [nop,nop,TS val 1299764779 ecr 1299764718], length 2986
2022-02-28 06:37:00.556057 IP (tos 0x0, ttl 64, id 41210, offset 0, flags [DF], proto TCP (6), length 52)
    127.0.0.1.38664 > 127.0.0.1.11250: Flags [.], cksum 0xfe28 (incorrect -> 0x316c), seq 880, ack 8513, win 496, options [nop,nop,TS val 1299764779 ecr 1299764779], length 0
2022-02-28 06:37:00.578550 IP (tos 0x0, ttl 64, id 44982, offset 0, flags [DF], proto TCP (6), length 273)
    127.0.0.1.11250 > 127.0.0.1.38664: Flags [P.], cksum 0xff05 (incorrect -> 0x9a1b), seq 8513:8734, ack 880, win 512, options [nop,nop,TS val 1299764802 ecr 1299764779], length 221
2022-02-28 06:37:00.578558 IP (tos 0x0, ttl 64, id 41211, offset 0, flags [DF], proto TCP (6), length 52)
    127.0.0.1.38664 > 127.0.0.1.11250: Flags [.], cksum 0xfe28 (incorrect -> 0x3056), seq 880, ack 8734, win 507, options [nop,nop,TS val 1299764802 ecr 1299764802], length 0
2022-02-28 06:37:00.588677 IP (tos 0x0, ttl 64, id 44983, offset 0, flags [DF], proto TCP (6), length 3538)
    127.0.0.1.11250 > 127.0.0.1.38664: Flags [P.], cksum 0x0bc7 (incorrect -> 0xc044), seq 8734:12220, ack 880, win 512, options [nop,nop,TS val 1299764812 ecr 1299764802], length 3486
2022-02-28 06:37:00.588685 IP (tos 0x0, ttl 64, id 41212, offset 0, flags [DF], proto TCP (6), length 52)
    127.0.0.1.38664 > 127.0.0.1.11250: Flags [.], cksum 0xfe28 (incorrect -> 0x22b1), seq 880, ack 12220, win 494, options [nop,nop,TS val 1299764812 ecr 1299764812], length 0
2022-02-28 06:37:00.599097 IP (tos 0x0, ttl 64, id 44984, offset 0, flags [DF], proto TCP (6), length 1048)
    127.0.0.1.11250 > 127.0.0.1.38664: Flags [P.], cksum 0x020d (incorrect -> 0xa134), seq 12220:13216, ack 880, win 512, options [nop,nop,TS val 1299764822 ecr 1299764812], length 996
2022-02-28 06:37:00.599102 IP (tos 0x0, ttl 64, id 41213, offset 0, flags [DF], proto TCP (6), length 52)
    127.0.0.1.38664 > 127.0.0.1.11250: Flags [.], cksum 0xfe28 (incorrect -> 0x1eaf), seq 880, ack 13216, win 504, options [nop,nop,TS val 1299764822 ecr 1299764822], length 0
2022-02-28 06:37:00.600984 IP (tos 0x0, ttl 64, id 44985, offset 0, flags [DF], proto TCP (6), length 3040)
    127.0.0.1.11250 > 127.0.0.1.38664: Flags [P.], cksum 0x09d5 (incorrect -> 0x4f72), seq 13216:16204, ack 880, win 512, options [nop,nop,TS val 1299764824 ecr 1299764822], length 2988
2022-02-28 06:37:00.600989 IP (tos 0x0, ttl 64, id 41214, offset 0, flags [DF], proto TCP (6), length 52)
    127.0.0.1.38664 > 127.0.0.1.11250: Flags [.], cksum 0xfe28 (incorrect -> 0x1307), seq 880, ack 16204, win 496, options [nop,nop,TS val 1299764824 ecr 1299764824], length 0
2022-02-28 06:37:00.601066 IP (tos 0x0, ttl 64, id 44986, offset 0, flags [DF], proto TCP (6), length 4100)
    127.0.0.1.11250 > 127.0.0.1.38664: Flags [P.], cksum 0x0df9 (incorrect -> 0x53ce), seq 16204:20252, ack 880, win 512, options [nop,nop,TS val 1299764824 ecr 1299764824], length 4048
2022-02-28 06:37:00.601071 IP (tos 0x0, ttl 64, id 41215, offset 0, flags [DF], proto TCP (6), length 52)
    127.0.0.1.38664 > 127.0.0.1.11250: Flags [.], cksum 0xfe28 (incorrect -> 0x033b), seq 880, ack 20252, win 492, options [nop,nop,TS val 1299764824 ecr 1299764824], length 0
2022-02-28 06:37:00.601075 IP (tos 0x0, ttl 64, id 44987, offset 0, flags [DF], proto TCP (6), length 328)
    127.0.0.1.11250 > 127.0.0.1.38664: Flags [P.], cksum 0xff3c (incorrect -> 0x2552), seq 20252:20528, ack 880, win 512, options [nop,nop,TS val 1299764824 ecr 1299764824], length 276
2022-02-28 06:37:00.601078 IP (tos 0x0, ttl 64, id 41216, offset 0, flags [DF], proto TCP (6), length 52)
    127.0.0.1.38664 > 127.0.0.1.11250: Flags [.], cksum 0xfe28 (incorrect -> 0x0228), seq 880, ack 20528, win 491, options [nop,nop,TS val 1299764824 ecr 1299764824], length 0
2022-02-28 06:37:00.617597 IP (tos 0x0, ttl 64, id 44988, offset 0, flags [DF], proto TCP (6), length 3538)
    127.0.0.1.11250 > 127.0.0.1.38664: Flags [P.], cksum 0x0bc7 (incorrect -> 0xe55a), seq 20528:24014, ack 880, win 512, options [nop,nop,TS val 1299764841 ecr 1299764824], length 3486
2022-02-28 06:37:00.617648 IP (tos 0x0, ttl 64, id 41217, offset 0, flags [DF], proto TCP (6), length 52)
    127.0.0.1.38664 > 127.0.0.1.11250: Flags [.], cksum 0xfe28 (incorrect -> 0xf452), seq 880, ack 24014, win 512, options [nop,nop,TS val 1299764841 ecr 1299764841], length 0
2022-02-28 06:37:00.617686 IP (tos 0x0, ttl 64, id 44989, offset 0, flags [DF], proto TCP (6), length 4036)
    127.0.0.1.11250 > 127.0.0.1.38664: Flags [P.], cksum 0x0db9 (incorrect -> 0x6057), seq 24014:27998, ack 880, win 512, options [nop,nop,TS val 1299764841 ecr 1299764841], length 3984
2022-02-28 06:37:00.617713 IP (tos 0x0, ttl 64, id 41218, offset 0, flags [DF], proto TCP (6), length 52)
    127.0.0.1.38664 > 127.0.0.1.11250: Flags [.], cksum 0xfe28 (incorrect -> 0xe4c2), seq 880, ack 27998, win 512, options [nop,nop,TS val 1299764841 ecr 1299764841], length 0
2022-02-28 06:37:00.621677 IP (tos 0x0, ttl 64, id 44990, offset 0, flags [DF], proto TCP (6), length 4100)
    127.0.0.1.11250 > 127.0.0.1.38664: Flags [P.], cksum 0x0df9 (incorrect -> 0xc767), seq 27998:32046, ack 880, win 512, options [nop,nop,TS val 1299764845 ecr 1299764841], length 4048
2022-02-28 06:37:00.662146 IP (tos 0x0, ttl 64, id 41219, offset 0, flags [DF], proto TCP (6), length 52)
    127.0.0.1.38664 > 127.0.0.1.11250: Flags [.], cksum 0xfe28 (incorrect -> 0xd4c2), seq 880, ack 32046, win 512, options [nop,nop,TS val 1299764885 ecr 1299764845], length 0
2022-02-28 06:37:00.662156 IP (tos 0x0, ttl 64, id 44991, offset 0, flags [DF], proto TCP (6), length 16812)
    127.0.0.1.11250 > 127.0.0.1.38664: Flags [P.], cksum 0x3fa1 (incorrect -> 0x6a2a), seq 32046:48806, ack 880, win 512, options [nop,nop,TS val 1299764885 ecr 1299764885], length 16760
2022-02-28 06:37:00.694791 IP (tos 0x0, ttl 64, id 44992, offset 0, flags [DF], proto TCP (6), length 32820)
    127.0.0.1.11250 > 127.0.0.1.38664: Flags [.], cksum 0x7e29 (incorrect -> 0x2c78), seq 48806:81574, ack 880, win 512, options [nop,nop,TS val 1299764918 ecr 1299764885], length 32768
2022-02-28 06:37:00.694796 IP (tos 0x0, ttl 64, id 41220, offset 0, flags [DF], proto TCP (6), length 52)
    127.0.0.1.38664 > 127.0.0.1.11250: Flags [.], cksum 0xfe28 (incorrect -> 0x1386), seq 880, ack 81574, win 379, options [nop,nop,TS val 1299764918 ecr 1299764885], length 0
2022-02-28 06:37:00.694802 IP (tos 0x0, ttl 64, id 44993, offset 0, flags [DF], proto TCP (6), length 1731)
    127.0.0.1.11250 > 127.0.0.1.38664: Flags [P.], cksum 0x04b8 (incorrect -> 0x1a9f), seq 81574:83253, ack 880, win 512, options [nop,nop,TS val 1299764918 ecr 1299764918], length 1679
2022-02-28 06:37:00.695806 IP (tos 0x0, ttl 64, id 41221, offset 0, flags [DF], proto TCP (6), length 52)
    127.0.0.1.38664 > 127.0.0.1.11250: Flags [.], cksum 0xfe28 (incorrect -> 0x0c50), seq 880, ack 83253, win 512, options [nop,nop,TS val 1299764919 ecr 1299764918], length 0
2022-02-28 06:37:00.695812 IP (tos 0x0, ttl 64, id 44994, offset 0, flags [DF], proto TCP (6), length 3972)
    127.0.0.1.11250 > 127.0.0.1.38664: Flags [P.], cksum 0x0d79 (incorrect -> 0xe17b), seq 83253:87173, ack 880, win 512, options [nop,nop,TS val 1299764919 ecr 1299764919], length 3920
2022-02-28 06:37:00.695828 IP (tos 0x0, ttl 64, id 41222, offset 0, flags [DF], proto TCP (6), length 52)
    127.0.0.1.38664 > 127.0.0.1.11250: Flags [.], cksum 0xfe28 (incorrect -> 0xfcfe), seq 880, ack 87173, win 512, options [nop,nop,TS val 1299764919 ecr 1299764919], length 0
2022-02-28 06:37:00.695880 IP (tos 0x0, ttl 64, id 44995, offset 0, flags [DF], proto TCP (6), length 4100)
    127.0.0.1.11250 > 127.0.0.1.38664: Flags [P.], cksum 0x0df9 (incorrect -> 0x6ffc), seq 87173:91221, ack 880, win 512, options [nop,nop,TS val 1299764919 ecr 1299764919], length 4048
2022-02-28 06:37:00.696111 IP (tos 0x0, ttl 64, id 41223, offset 0, flags [DF], proto TCP (6), length 52)
    127.0.0.1.38664 > 127.0.0.1.11250: Flags [.], cksum 0xfe28 (incorrect -> 0xed2e), seq 880, ack 91221, win 512, options [nop,nop,TS val 1299764919 ecr 1299764919], length 0
2022-02-28 06:37:00.696115 IP (tos 0x0, ttl 64, id 44996, offset 0, flags [DF], proto TCP (6), length 2585)
    127.0.0.1.11250 > 127.0.0.1.38664: Flags [P.], cksum 0x080e (incorrect -> 0x3273), seq 91221:93754, ack 880, win 512, options [nop,nop,TS val 1299764919 ecr 1299764919], length 2533
2022-02-28 06:37:00.696123 IP (tos 0x0, ttl 64, id 41224, offset 0, flags [DF], proto TCP (6), length 52)
    127.0.0.1.38664 > 127.0.0.1.11250: Flags [.], cksum 0xfe28 (incorrect -> 0xe349), seq 880, ack 93754, win 512, options [nop,nop,TS val 1299764919 ecr 1299764919], length 0
2022-02-28 06:37:00.704214 IP (tos 0x0, ttl 64, id 44997, offset 0, flags [DF], proto TCP (6), length 2542)
    127.0.0.1.11250 > 127.0.0.1.38664: Flags [P.], cksum 0x07e3 (incorrect -> 0x1770), seq 93754:96244, ack 880, win 512, options [nop,nop,TS val 1299764927 ecr 1299764919], length 2490
2022-02-28 06:37:00.704241 IP (tos 0x0, ttl 64, id 41225, offset 0, flags [DF], proto TCP (6), length 52)
    127.0.0.1.38664 > 127.0.0.1.11250: Flags [.], cksum 0xfe28 (incorrect -> 0xd97f), seq 880, ack 96244, win 512, options [nop,nop,TS val 1299764927 ecr 1299764927], length 0
2022-02-28 06:37:00.708602 IP (tos 0x0, ttl 64, id 44998, offset 0, flags [DF], proto TCP (6), length 4100)
    127.0.0.1.11250 > 127.0.0.1.38664: Flags [P.], cksum 0x0df9 (incorrect -> 0xf37f), seq 96244:100292, ack 880, win 512, options [nop,nop,TS val 1299764932 ecr 1299764927], length 4048
2022-02-28 06:37:00.708686 IP (tos 0x0, ttl 64, id 41226, offset 0, flags [DF], proto TCP (6), length 52)
    127.0.0.1.38664 > 127.0.0.1.11250: Flags [.], cksum 0xfe28 (incorrect -> 0xc9a5), seq 880, ack 100292, win 512, options [nop,nop,TS val 1299764932 ecr 1299764932], length 0
2022-02-28 06:37:00.708691 IP (tos 0x0, ttl 64, id 44999, offset 0, flags [DF], proto TCP (6), length 7118)
    127.0.0.1.11250 > 127.0.0.1.38664: Flags [P.], cksum 0x19c3 (incorrect -> 0xe731), seq 100292:107358, ack 880, win 512, options [nop,nop,TS val 1299764932 ecr 1299764932], length 7066
2022-02-28 06:37:00.708927 IP (tos 0x0, ttl 64, id 41227, offset 0, flags [DF], proto TCP (6), length 52)
    127.0.0.1.38664 > 127.0.0.1.11250: Flags [.], cksum 0xfe28 (incorrect -> 0xae0b), seq 880, ack 107358, win 512, options [nop,nop,TS val 1299764932 ecr 1299764932], length 0
2022-02-28 06:37:00.709734 IP (tos 0x0, ttl 64, id 45000, offset 0, flags [DF], proto TCP (6), length 4100)
    127.0.0.1.11250 > 127.0.0.1.38664: Flags [P.], cksum 0x0df9 (incorrect -> 0xb204), seq 107358:111406, ack 880, win 512, options [nop,nop,TS val 1299764933 ecr 1299764932], length 4048
2022-02-28 06:37:00.709794 IP (tos 0x0, ttl 64, id 41228, offset 0, flags [DF], proto TCP (6), length 52)
    127.0.0.1.38664 > 127.0.0.1.11250: Flags [.], cksum 0xfe28 (incorrect -> 0x9e39), seq 880, ack 111406, win 512, options [nop,nop,TS val 1299764933 ecr 1299764933], length 0
2022-02-28 06:37:00.709798 IP (tos 0x0, ttl 64, id 45001, offset 0, flags [DF], proto TCP (6), length 814)
    127.0.0.1.11250 > 127.0.0.1.38664: Flags [P.], cksum 0x0123 (incorrect -> 0xe5f1), seq 111406:112168, ack 880, win 512, options [nop,nop,TS val 1299764933 ecr 1299764933], length 762
2022-02-28 06:37:00.710014 IP (tos 0x0, ttl 64, id 41229, offset 0, flags [DF], proto TCP (6), length 52)
    127.0.0.1.38664 > 127.0.0.1.11250: Flags [.], cksum 0xfe28 (incorrect -> 0x9b3f), seq 880, ack 112168, win 512, options [nop,nop,TS val 1299764933 ecr 1299764933], length 0
2022-02-28 06:37:00.710050 IP (tos 0x0, ttl 64, id 45002, offset 0, flags [DF], proto TCP (6), length 3504)
    127.0.0.1.11250 > 127.0.0.1.38664: Flags [P.], cksum 0x0ba5 (incorrect -> 0x9d01), seq 112168:115620, ack 880, win 512, options [nop,nop,TS val 1299764933 ecr 1299764933], length 3452
2022-02-28 06:37:00.710076 IP (tos 0x0, ttl 64, id 41230, offset 0, flags [DF], proto TCP (6), length 52)
    127.0.0.1.38664 > 127.0.0.1.11250: Flags [.], cksum 0xfe28 (incorrect -> 0x8dc3), seq 880, ack 115620, win 512, options [nop,nop,TS val 1299764933 ecr 1299764933], length 0
2022-02-28 06:37:00.721375 IP (tos 0x0, ttl 64, id 45003, offset 0, flags [DF], proto TCP (6), length 3944)
    127.0.0.1.11250 > 127.0.0.1.38664: Flags [P.], cksum 0x0d5d (incorrect -> 0xd232), seq 115620:119512, ack 880, win 512, options [nop,nop,TS val 1299764944 ecr 1299764933], length 3892
2022-02-28 06:37:00.721438 IP (tos 0x0, ttl 64, id 41231, offset 0, flags [DF], proto TCP (6), length 52)
    127.0.0.1.38664 > 127.0.0.1.11250: Flags [.], cksum 0xfe28 (incorrect -> 0x7e78), seq 880, ack 119512, win 512, options [nop,nop,TS val 1299764945 ecr 1299764944], length 0
2022-02-28 06:37:00.721447 IP (tos 0x0, ttl 64, id 45004, offset 0, flags [DF], proto TCP (6), length 3194)
    127.0.0.1.11250 > 127.0.0.1.38664: Flags [P.], cksum 0x0a6f (incorrect -> 0xd516), seq 119512:122654, ack 880, win 512, options [nop,nop,TS val 1299764945 ecr 1299764945], length 3142
2022-02-28 06:37:00.721631 IP (tos 0x0, ttl 64, id 41232, offset 0, flags [DF], proto TCP (6), length 52)
    127.0.0.1.38664 > 127.0.0.1.11250: Flags [.], cksum 0xfe28 (incorrect -> 0x7231), seq 880, ack 122654, win 512, options [nop,nop,TS val 1299764945 ecr 1299764945], length 0
2022-02-28 06:37:00.722298 IP (tos 0x0, ttl 64, id 45005, offset 0, flags [DF], proto TCP (6), length 4100)
    127.0.0.1.11250 > 127.0.0.1.38664: Flags [P.], cksum 0x0df9 (incorrect -> 0xf9c4), seq 122654:126702, ack 880, win 512, options [nop,nop,TS val 1299764945 ecr 1299764945], length 4048
2022-02-28 06:37:00.722374 IP (tos 0x0, ttl 64, id 41233, offset 0, flags [DF], proto TCP (6), length 52)
    127.0.0.1.38664 > 127.0.0.1.11250: Flags [.], cksum 0xfe28 (incorrect -> 0x6261), seq 880, ack 126702, win 512, options [nop,nop,TS val 1299764945 ecr 1299764945], length 0
2022-02-28 06:37:00.722381 IP (tos 0x0, ttl 64, id 45006, offset 0, flags [DF], proto TCP (6), length 3972)
    127.0.0.1.11250 > 127.0.0.1.38664: Flags [P.], cksum 0x0d79 (incorrect -> 0xcc10), seq 126702:130622, ack 880, win 512, options [nop,nop,TS val 1299764945 ecr 1299764945], length 3920
2022-02-28 06:37:00.722397 IP (tos 0x0, ttl 64, id 41234, offset 0, flags [DF], proto TCP (6), length 52)
    127.0.0.1.38664 > 127.0.0.1.11250: Flags [.], cksum 0xfe28 (incorrect -> 0x5311), seq 880, ack 130622, win 512, options [nop,nop,TS val 1299764945 ecr 1299764945], length 0
2022-02-28 06:37:00.722694 IP (tos 0x0, ttl 64, id 45007, offset 0, flags [DF], proto TCP (6), length 4036)
    127.0.0.1.11250 > 127.0.0.1.38664: Flags [P.], cksum 0x0db9 (incorrect -> 0x4c1c), seq 130622:134606, ack 880, win 512, options [nop,nop,TS val 1299764946 ecr 1299764945], length 3984
2022-02-28 06:37:00.722946 IP (tos 0x0, ttl 64, id 41235, offset 0, flags [DF], proto TCP (6), length 52)
    127.0.0.1.38664 > 127.0.0.1.11250: Flags [.], cksum 0xfe28 (incorrect -> 0x437f), seq 880, ack 134606, win 512, options [nop,nop,TS val 1299764946 ecr 1299764946], length 0
2022-02-28 06:37:00.726743 IP (tos 0x0, ttl 64, id 45008, offset 0, flags [DF], proto TCP (6), length 2686)
    127.0.0.1.11250 > 127.0.0.1.38664: Flags [P.], cksum 0x0873 (incorrect -> 0x5f57), seq 134606:137240, ack 880, win 512, options [nop,nop,TS val 1299764950 ecr 1299764946], length 2634
2022-02-28 06:37:00.726773 IP (tos 0x0, ttl 64, id 41236, offset 0, flags [DF], proto TCP (6), length 52)
    127.0.0.1.38664 > 127.0.0.1.11250: Flags [.], cksum 0xfe28 (incorrect -> 0x392d), seq 880, ack 137240, win 512, options [nop,nop,TS val 1299764950 ecr 1299764950], length 0
2022-02-28 06:37:00.747076 IP (tos 0x0, ttl 64, id 45009, offset 0, flags [DF], proto TCP (6), length 3538)
    127.0.0.1.11250 > 127.0.0.1.38664: Flags [P.], cksum 0x0bc7 (incorrect -> 0x4d0f), seq 137240:140726, ack 880, win 512, options [nop,nop,TS val 1299764970 ecr 1299764950], length 3486
2022-02-28 06:37:00.747115 IP (tos 0x0, ttl 64, id 41237, offset 0, flags [DF], proto TCP (6), length 52)
    127.0.0.1.38664 > 127.0.0.1.11250: Flags [.], cksum 0xfe28 (incorrect -> 0x2b67), seq 880, ack 140726, win 512, options [nop,nop,TS val 1299764970 ecr 1299764970], length 0
2022-02-28 06:37:00.749268 IP (tos 0x0, ttl 64, id 45010, offset 0, flags [DF], proto TCP (6), length 4036)
    127.0.0.1.11250 > 127.0.0.1.38664: Flags [P.], cksum 0x0db9 (incorrect -> 0xde56), seq 140726:144710, ack 880, win 512, options [nop,nop,TS val 1299764972 ecr 1299764970], length 3984
2022-02-28 06:37:00.749506 IP (tos 0x0, ttl 64, id 41238, offset 0, flags [DF], proto TCP (6), length 52)
    127.0.0.1.38664 > 127.0.0.1.11250: Flags [.], cksum 0xfe28 (incorrect -> 0x1bd2), seq 880, ack 144710, win 512, options [nop,nop,TS val 1299764973 ecr 1299764972], length 0
2022-02-28 06:37:00.759157 IP (tos 0x0, ttl 64, id 45011, offset 0, flags [DF], proto TCP (6), length 1235)
    127.0.0.1.11250 > 127.0.0.1.38664: Flags [P.], cksum 0x02c8 (incorrect -> 0x8122), seq 144710:145893, ack 880, win 512, options [nop,nop,TS val 1299764982 ecr 1299764973], length 1183
2022-02-28 06:37:00.759171 IP (tos 0x0, ttl 64, id 41239, offset 0, flags [DF], proto TCP (6), length 52)
    127.0.0.1.38664 > 127.0.0.1.11250: Flags [.], cksum 0xfe28 (incorrect -> 0x1720), seq 880, ack 145893, win 512, options [nop,nop,TS val 1299764982 ecr 1299764982], length 0
2022-02-28 06:37:00.771777 IP (tos 0x0, ttl 64, id 45012, offset 0, flags [DF], proto TCP (6), length 1911)
    127.0.0.1.11250 > 127.0.0.1.38664: Flags [P.], cksum 0x056c (incorrect -> 0x0919), seq 145893:147752, ack 880, win 512, options [nop,nop,TS val 1299764995 ecr 1299764982], length 1859
2022-02-28 06:37:00.771841 IP (tos 0x0, ttl 64, id 41240, offset 0, flags [DF], proto TCP (6), length 52)
    127.0.0.1.38664 > 127.0.0.1.11250: Flags [.], cksum 0xfe28 (incorrect -> 0x0fc3), seq 880, ack 147752, win 512, options [nop,nop,TS val 1299764995 ecr 1299764995], length 0
2022-02-28 06:37:00.872121 IP (tos 0x0, ttl 64, id 45013, offset 0, flags [DF], proto TCP (6), length 4100)
    127.0.0.1.11250 > 127.0.0.1.38664: Flags [P.], cksum 0x0df9 (incorrect -> 0xa90f), seq 147752:151800, ack 880, win 512, options [nop,nop,TS val 1299765095 ecr 1299764995], length 4048
2022-02-28 06:37:00.872182 IP (tos 0x0, ttl 64, id 41241, offset 0, flags [DF], proto TCP (6), length 52)
    127.0.0.1.38664 > 127.0.0.1.11250: Flags [.], cksum 0xfe28 (incorrect -> 0xff2a), seq 880, ack 151800, win 512, options [nop,nop,TS val 1299765095 ecr 1299765095], length 0
2022-02-28 06:37:00.872194 IP (tos 0x0, ttl 64, id 45014, offset 0, flags [DF], proto TCP (6), length 2786)
    127.0.0.1.11250 > 127.0.0.1.38664: Flags [P.], cksum 0x08d7 (incorrect -> 0x88d1), seq 151800:154534, ack 880, win 512, options [nop,nop,TS val 1299765095 ecr 1299765095], length 2734
2022-02-28 06:37:00.872212 IP (tos 0x0, ttl 64, id 41242, offset 0, flags [DF], proto TCP (6), length 52)
    127.0.0.1.38664 > 127.0.0.1.11250: Flags [.], cksum 0xfe28 (incorrect -> 0xf47c), seq 880, ack 154534, win 512, options [nop,nop,TS val 1299765095 ecr 1299765095], length 0
2022-02-28 06:37:00.872260 IP (tos 0x0, ttl 64, id 45015, offset 0, flags [DF], proto TCP (6), length 4100)
    127.0.0.1.11250 > 127.0.0.1.38664: Flags [P.], cksum 0x0df9 (incorrect -> 0x1cff), seq 154534:158582, ack 880, win 512, options [nop,nop,TS val 1299765095 ecr 1299765095], length 4048
2022-02-28 06:37:00.872285 IP (tos 0x0, ttl 64, id 41243, offset 0, flags [DF], proto TCP (6), length 52)
    127.0.0.1.38664 > 127.0.0.1.11250: Flags [.], cksum 0xfe28 (incorrect -> 0xe4ac), seq 880, ack 158582, win 512, options [nop,nop,TS val 1299765095 ecr 1299765095], length 0
2022-02-28 06:37:00.872294 IP (tos 0x0, ttl 64, id 45016, offset 0, flags [DF], proto TCP (6), length 3836)
    127.0.0.1.11250 > 127.0.0.1.38664: Flags [P.], cksum 0x0cf1 (incorrect -> 0x8389), seq 158582:162366, ack 880, win 512, options [nop,nop,TS val 1299765095 ecr 1299765095], length 3784
2022-02-28 06:37:00.872560 IP (tos 0x0, ttl 64, id 41244, offset 0, flags [DF], proto TCP (6), length 52)
    127.0.0.1.38664 > 127.0.0.1.11250: Flags [.], cksum 0xfe28 (incorrect -> 0xd5e3), seq 880, ack 162366, win 512, options [nop,nop,TS val 1299765096 ecr 1299765095], length 0
2022-02-28 06:37:00.872606 IP (tos 0x0, ttl 64, id 45017, offset 0, flags [DF], proto TCP (6), length 4100)
    127.0.0.1.11250 > 127.0.0.1.38664: Flags [P.], cksum 0x0df9 (incorrect -> 0xec4a), seq 162366:166414, ack 880, win 512, options [nop,nop,TS val 1299765096 ecr 1299765096], length 4048
2022-02-28 06:37:00.872639 IP (tos 0x0, ttl 64, id 41245, offset 0, flags [DF], proto TCP (6), length 52)
    127.0.0.1.38664 > 127.0.0.1.11250: Flags [.], cksum 0xfe28 (incorrect -> 0xc612), seq 880, ack 166414, win 512, options [nop,nop,TS val 1299765096 ecr 1299765096], length 0
2022-02-28 06:37:00.872648 IP (tos 0x0, ttl 64, id 45018, offset 0, flags [DF], proto TCP (6), length 486)
    127.0.0.1.11250 > 127.0.0.1.38664: Flags [P.], cksum 0xffda (incorrect -> 0x2ccf), seq 166414:166848, ack 880, win 512, options [nop,nop,TS val 1299765096 ecr 1299765096], length 434
2022-02-28 06:37:00.872661 IP (tos 0x0, ttl 64, id 41246, offset 0, flags [DF], proto TCP (6), length 52)
    127.0.0.1.38664 > 127.0.0.1.11250: Flags [.], cksum 0xfe28 (incorrect -> 0xc460), seq 880, ack 166848, win 512, options [nop,nop,TS val 1299765096 ecr 1299765096], length 0
2022-02-28 06:37:00.881674 IP (tos 0x0, ttl 64, id 45019, offset 0, flags [DF], proto TCP (6), length 3594)
    127.0.0.1.11250 > 127.0.0.1.38664: Flags [P.], cksum 0x0bff (incorrect -> 0x2db1), seq 166848:170390, ack 880, win 512, options [nop,nop,TS val 1299765105 ecr 1299765096], length 3542
2022-02-28 06:37:00.881910 IP (tos 0x0, ttl 64, id 41247, offset 0, flags [DF], proto TCP (6), length 52)
    127.0.0.1.38664 > 127.0.0.1.11250: Flags [.], cksum 0xfe28 (incorrect -> 0xb678), seq 880, ack 170390, win 512, options [nop,nop,TS val 1299765105 ecr 1299765105], length 0
2022-02-28 06:37:00.882782 IP (tos 0x0, ttl 64, id 45020, offset 0, flags [DF], proto TCP (6), length 3658)
    127.0.0.1.11250 > 127.0.0.1.38664: Flags [P.], cksum 0x0c3f (incorrect -> 0x6e83), seq 170390:173996, ack 880, win 512, options [nop,nop,TS val 1299765106 ecr 1299765105], length 3606
2022-02-28 06:37:00.882836 IP (tos 0x0, ttl 64, id 41248, offset 0, flags [DF], proto TCP (6), length 52)
    127.0.0.1.38664 > 127.0.0.1.11250: Flags [.], cksum 0xfe28 (incorrect -> 0xa860), seq 880, ack 173996, win 512, options [nop,nop,TS val 1299765106 ecr 1299765106], length 0
2022-02-28 06:37:00.882886 IP (tos 0x0, ttl 64, id 45021, offset 0, flags [DF], proto TCP (6), length 4100)
    127.0.0.1.11250 > 127.0.0.1.38664: Flags [P.], cksum 0x0df9 (incorrect -> 0x8f67), seq 173996:178044, ack 880, win 512, options [nop,nop,TS val 1299765106 ecr 1299765106], length 4048
2022-02-28 06:37:00.882916 IP (tos 0x0, ttl 64, id 41249, offset 0, flags [DF], proto TCP (6), length 52)
    127.0.0.1.38664 > 127.0.0.1.11250: Flags [.], cksum 0xfe28 (incorrect -> 0x9890), seq 880, ack 178044, win 512, options [nop,nop,TS val 1299765106 ecr 1299765106], length 0
2022-02-28 06:37:00.882930 IP (tos 0x0, ttl 64, id 45022, offset 0, flags [DF], proto TCP (6), length 3471)
    127.0.0.1.11250 > 127.0.0.1.38664: Flags [P.], cksum 0x0b84 (incorrect -> 0x3c52), seq 178044:181463, ack 880, win 512, options [nop,nop,TS val 1299765106 ecr 1299765106], length 3419
2022-02-28 06:37:00.883173 IP (tos 0x0, ttl 64, id 41250, offset 0, flags [DF], proto TCP (6), length 52)
    127.0.0.1.38664 > 127.0.0.1.11250: Flags [.], cksum 0xfe28 (incorrect -> 0x8b35), seq 880, ack 181463, win 512, options [nop,nop,TS val 1299765106 ecr 1299765106], length 0
2022-02-28 06:37:00.884146 IP (tos 0x0, ttl 64, id 45023, offset 0, flags [DF], proto TCP (6), length 4100)
    127.0.0.1.11250 > 127.0.0.1.38664: Flags [P.], cksum 0x0df9 (incorrect -> 0x2819), seq 181463:185511, ack 880, win 512, options [nop,nop,TS val 1299765107 ecr 1299765106], length 4048
2022-02-28 06:37:00.884201 IP (tos 0x0, ttl 64, id 41251, offset 0, flags [DF], proto TCP (6), length 52)
    127.0.0.1.38664 > 127.0.0.1.11250: Flags [.], cksum 0xfe28 (incorrect -> 0x7b63), seq 880, ack 185511, win 512, options [nop,nop,TS val 1299765107 ecr 1299765107], length 0
2022-02-28 06:37:00.884211 IP (tos 0x0, ttl 64, id 45024, offset 0, flags [DF], proto TCP (6), length 350)
    127.0.0.1.11250 > 127.0.0.1.38664: Flags [P.], cksum 0xff52 (incorrect -> 0x57b8), seq 185511:185809, ack 880, win 512, options [nop,nop,TS val 1299765107 ecr 1299765107], length 298
2022-02-28 06:37:00.884218 IP (tos 0x0, ttl 64, id 41252, offset 0, flags [DF], proto TCP (6), length 52)
    127.0.0.1.38664 > 127.0.0.1.11250: Flags [.], cksum 0xfe28 (incorrect -> 0x7a39), seq 880, ack 185809, win 512, options [nop,nop,TS val 1299765107 ecr 1299765107], length 0
2022-02-28 06:37:00.884297 IP (tos 0x0, ttl 64, id 45025, offset 0, flags [DF], proto TCP (6), length 4100)
    127.0.0.1.11250 > 127.0.0.1.38664: Flags [P.], cksum 0x0df9 (incorrect -> 0xcab8), seq 185809:189857, ack 880, win 512, options [nop,nop,TS val 1299765107 ecr 1299765107], length 4048
2022-02-28 06:37:00.884472 IP (tos 0x0, ttl 64, id 41253, offset 0, flags [DF], proto TCP (6), length 52)
    127.0.0.1.38664 > 127.0.0.1.11250: Flags [.], cksum 0xfe28 (incorrect -> 0x6a68), seq 880, ack 189857, win 512, options [nop,nop,TS val 1299765108 ecr 1299765107], length 0
2022-02-28 06:37:00.884482 IP (tos 0x0, ttl 64, id 45026, offset 0, flags [DF], proto TCP (6), length 3474)
    127.0.0.1.11250 > 127.0.0.1.38664: Flags [P.], cksum 0x0b87 (incorrect -> 0x66d2), seq 189857:193279, ack 880, win 512, options [nop,nop,TS val 1299765108 ecr 1299765108], length 3422
2022-02-28 06:37:00.884514 IP (tos 0x0, ttl 64, id 41254, offset 0, flags [DF], proto TCP (6), length 52)
    127.0.0.1.38664 > 127.0.0.1.11250: Flags [.], cksum 0xfe28 (incorrect -> 0x5d09), seq 880, ack 193279, win 512, options [nop,nop,TS val 1299765108 ecr 1299765108], length 0
2022-02-28 06:37:00.884587 IP (tos 0x0, ttl 64, id 45027, offset 0, flags [DF], proto TCP (6), length 4100)
    127.0.0.1.11250 > 127.0.0.1.38664: Flags [P.], cksum 0x0df9 (incorrect -> 0x266e), seq 193279:197327, ack 880, win 512, options [nop,nop,TS val 1299765108 ecr 1299765108], length 4048
2022-02-28 06:37:00.884614 IP (tos 0x0, ttl 64, id 41255, offset 0, flags [DF], proto TCP (6), length 52)
    127.0.0.1.38664 > 127.0.0.1.11250: Flags [.], cksum 0xfe28 (incorrect -> 0x4d39), seq 880, ack 197327, win 512, options [nop,nop,TS val 1299765108 ecr 1299765108], length 0
2022-02-28 06:37:00.884623 IP (tos 0x0, ttl 64, id 45028, offset 0, flags [DF], proto TCP (6), length 3587)
    127.0.0.1.11250 > 127.0.0.1.38664: Flags [P.], cksum 0x0bf8 (incorrect -> 0x94f7), seq 197327:200862, ack 880, win 512, options [nop,nop,TS val 1299765108 ecr 1299765108], length 3535
2022-02-28 06:37:00.884780 IP (tos 0x0, ttl 64, id 41256, offset 0, flags [DF], proto TCP (6), length 52)
    127.0.0.1.38664 > 127.0.0.1.11250: Flags [.], cksum 0xfe28 (incorrect -> 0x3f6a), seq 880, ack 200862, win 512, options [nop,nop,TS val 1299765108 ecr 1299765108], length 0
2022-02-28 06:37:00.891644 IP (tos 0x0, ttl 64, id 45029, offset 0, flags [DF], proto TCP (6), length 550)
    127.0.0.1.11250 > 127.0.0.1.38664: Flags [P.], cksum 0x001b (incorrect -> 0x8726), seq 200862:201360, ack 880, win 512, options [nop,nop,TS val 1299765115 ecr 1299765108], length 498
2022-02-28 06:37:00.891654 IP (tos 0x0, ttl 64, id 41257, offset 0, flags [DF], proto TCP (6), length 52)
    127.0.0.1.38664 > 127.0.0.1.11250: Flags [.], cksum 0xfe28 (incorrect -> 0x3d6a), seq 880, ack 201360, win 512, options [nop,nop,TS val 1299765115 ecr 1299765115], length 0
2022-02-28 06:37:00.895410 IP (tos 0x0, ttl 64, id 45030, offset 0, flags [DF], proto TCP (6), length 3538)
    127.0.0.1.11250 > 127.0.0.1.38664: Flags [P.], cksum 0x0bc7 (incorrect -> 0xb457), seq 201360:204846, ack 880, win 512, options [nop,nop,TS val 1299765118 ecr 1299765115], length 3486
2022-02-28 06:37:00.895475 IP (tos 0x0, ttl 64, id 41258, offset 0, flags [DF], proto TCP (6), length 52)
    127.0.0.1.38664 > 127.0.0.1.11250: Flags [.], cksum 0xfe28 (incorrect -> 0x2fc5), seq 880, ack 204846, win 512, options [nop,nop,TS val 1299765119 ecr 1299765118], length 0
2022-02-28 06:37:00.895718 IP (tos 0x0, ttl 64, id 45031, offset 0, flags [DF], proto TCP (6), length 4100)
    127.0.0.1.11250 > 127.0.0.1.38664: Flags [P.], cksum 0x0df9 (incorrect -> 0x178b), seq 204846:208894, ack 880, win 512, options [nop,nop,TS val 1299765119 ecr 1299765119], length 4048
2022-02-28 06:37:00.895752 IP (tos 0x0, ttl 64, id 41259, offset 0, flags [DF], proto TCP (6), length 52)
    127.0.0.1.38664 > 127.0.0.1.11250: Flags [.], cksum 0xfe28 (incorrect -> 0x1ff4), seq 880, ack 208894, win 512, options [nop,nop,TS val 1299765119 ecr 1299765119], length 0
2022-02-28 06:37:00.895762 IP (tos 0x0, ttl 64, id 45032, offset 0, flags [DF], proto TCP (6), length 2353)
    127.0.0.1.11250 > 127.0.0.1.38664: Flags [P.], cksum 0x0726 (incorrect -> 0x4afa), seq 208894:211195, ack 880, win 512, options [nop,nop,TS val 1299765119 ecr 1299765119], length 2301
2022-02-28 06:37:00.895931 IP (tos 0x0, ttl 64, id 41260, offset 0, flags [DF], proto TCP (6), length 52)
    127.0.0.1.38664 > 127.0.0.1.11250: Flags [.], cksum 0xfe28 (incorrect -> 0x16f7), seq 880, ack 211195, win 512, options [nop,nop,TS val 1299765119 ecr 1299765119], length 0
2022-02-28 06:37:00.903749 IP (tos 0x0, ttl 64, id 45033, offset 0, flags [DF], proto TCP (6), length 2144)
    127.0.0.1.11250 > 127.0.0.1.38664: Flags [P.], cksum 0x0655 (incorrect -> 0x7893), seq 211195:213287, ack 880, win 512, options [nop,nop,TS val 1299765127 ecr 1299765119], length 2092
2022-02-28 06:37:00.903774 IP (tos 0x0, ttl 64, id 41261, offset 0, flags [DF], proto TCP (6), length 52)
    127.0.0.1.38664 > 127.0.0.1.11250: Flags [.], cksum 0xfe28 (incorrect -> 0x0ebb), seq 880, ack 213287, win 512, options [nop,nop,TS val 1299765127 ecr 1299765127], length 0
2022-02-28 06:37:00.905873 IP (tos 0x0, ttl 64, id 45034, offset 0, flags [DF], proto TCP (6), length 4100)
    127.0.0.1.11250 > 127.0.0.1.38664: Flags [P.], cksum 0x0df9 (incorrect -> 0xfe7c), seq 213287:217335, ack 880, win 512, options [nop,nop,TS val 1299765129 ecr 1299765127], length 4048
2022-02-28 06:37:00.905917 IP (tos 0x0, ttl 64, id 41262, offset 0, flags [DF], proto TCP (6), length 52)
    127.0.0.1.38664 > 127.0.0.1.11250: Flags [.], cksum 0xfe28 (incorrect -> 0xfee6), seq 880, ack 217335, win 512, options [nop,nop,TS val 1299765129 ecr 1299765129], length 0
2022-02-28 06:37:00.905929 IP (tos 0x0, ttl 64, id 45035, offset 0, flags [DF], proto TCP (6), length 2976)
    127.0.0.1.11250 > 127.0.0.1.38664: Flags [P.], cksum 0x0995 (incorrect -> 0x1db4), seq 217335:220259, ack 880, win 512, options [nop,nop,TS val 1299765129 ecr 1299765129], length 2924
2022-02-28 06:37:00.906179 IP (tos 0x0, ttl 64, id 41263, offset 0, flags [DF], proto TCP (6), length 52)
    127.0.0.1.38664 > 127.0.0.1.11250: Flags [.], cksum 0xfe28 (incorrect -> 0xf37a), seq 880, ack 220259, win 512, options [nop,nop,TS val 1299765129 ecr 1299765129], length 0
2022-02-28 06:37:00.907145 IP (tos 0x0, ttl 64, id 45036, offset 0, flags [DF], proto TCP (6), length 4100)
    127.0.0.1.11250 > 127.0.0.1.38664: Flags [P.], cksum 0x0df9 (incorrect -> 0xbcf8), seq 220259:224307, ack 880, win 512, options [nop,nop,TS val 1299765130 ecr 1299765129], length 4048
2022-02-28 06:37:00.907256 IP (tos 0x0, ttl 64, id 41264, offset 0, flags [DF], proto TCP (6), length 52)
    127.0.0.1.38664 > 127.0.0.1.11250: Flags [.], cksum 0xfe28 (incorrect -> 0xe3a8), seq 880, ack 224307, win 512, options [nop,nop,TS val 1299765130 ecr 1299765130], length 0
2022-02-28 06:37:00.907267 IP (tos 0x0, ttl 64, id 45037, offset 0, flags [DF], proto TCP (6), length 316)
    127.0.0.1.11250 > 127.0.0.1.38664: Flags [P.], cksum 0xff30 (incorrect -> 0xc6be), seq 224307:224571, ack 880, win 512, options [nop,nop,TS val 1299765130 ecr 1299765130], length 264
2022-02-28 06:37:00.907281 IP (tos 0x0, ttl 64, id 41265, offset 0, flags [DF], proto TCP (6), length 52)
    127.0.0.1.38664 > 127.0.0.1.11250: Flags [.], cksum 0xfe28 (incorrect -> 0xe2a0), seq 880, ack 224571, win 512, options [nop,nop,TS val 1299765130 ecr 1299765130], length 0
2022-02-28 06:37:00.908789 IP (tos 0x0, ttl 64, id 45038, offset 0, flags [DF], proto TCP (6), length 4100)
    127.0.0.1.11250 > 127.0.0.1.38664: Flags [P.], cksum 0x0df9 (incorrect -> 0x11dc), seq 224571:228619, ack 880, win 512, options [nop,nop,TS val 1299765132 ecr 1299765130], length 4048
2022-02-28 06:37:00.908837 IP (tos 0x0, ttl 64, id 41266, offset 0, flags [DF], proto TCP (6), length 52)
    127.0.0.1.38664 > 127.0.0.1.11250: Flags [.], cksum 0xfe28 (incorrect -> 0xd2cc), seq 880, ack 228619, win 512, options [nop,nop,TS val 1299765132 ecr 1299765132], length 0
2022-02-28 06:37:00.908848 IP (tos 0x0, ttl 64, id 45039, offset 0, flags [DF], proto TCP (6), length 2806)
    127.0.0.1.11250 > 127.0.0.1.38664: Flags [P.], cksum 0x08eb (incorrect -> 0x4304), seq 228619:231373, ack 880, win 512, options [nop,nop,TS val 1299765132 ecr 1299765132], length 2754
2022-02-28 06:37:00.908865 IP (tos 0x0, ttl 64, id 41267, offset 0, flags [DF], proto TCP (6), length 52)
    127.0.0.1.38664 > 127.0.0.1.11250: Flags [.], cksum 0xfe28 (incorrect -> 0xc80a), seq 880, ack 231373, win 512, options [nop,nop,TS val 1299765132 ecr 1299765132], length 0
2022-02-28 06:37:00.908901 IP (tos 0x0, ttl 64, id 45040, offset 0, flags [DF], proto TCP (6), length 4036)
    127.0.0.1.11250 > 127.0.0.1.38664: Flags [P.], cksum 0x0db9 (incorrect -> 0x15dc), seq 231373:235357, ack 880, win 512, options [nop,nop,TS val 1299765132 ecr 1299765132], length 3984
2022-02-28 06:37:00.909202 IP (tos 0x0, ttl 64, id 41268, offset 0, flags [DF], proto TCP (6), length 52)
    127.0.0.1.38664 > 127.0.0.1.11250: Flags [.], cksum 0xfe28 (incorrect -> 0xb87a), seq 880, ack 235357, win 512, options [nop,nop,TS val 1299765132 ecr 1299765132], length 0
2022-02-28 06:37:00.909272 IP (tos 0x0, ttl 64, id 45041, offset 0, flags [DF], proto TCP (6), length 4036)
    127.0.0.1.11250 > 127.0.0.1.38664: Flags [P.], cksum 0x0db9 (incorrect -> 0x7367), seq 235357:239341, ack 880, win 512, options [nop,nop,TS val 1299765132 ecr 1299765132], length 3984
2022-02-28 06:37:00.954137 IP (tos 0x0, ttl 64, id 41269, offset 0, flags [DF], proto TCP (6), length 52)
    127.0.0.1.38664 > 127.0.0.1.11250: Flags [.], cksum 0xfe28 (incorrect -> 0xa8bd), seq 880, ack 239341, win 512, options [nop,nop,TS val 1299765177 ecr 1299765132], length 0
200, 126.35820698738098, 0.8718416690826416