2022-02-28 08:20:16.346948 IP (tos 0x0, ttl 64, id 169, offset 0, flags [DF], proto TCP (6), length 60)
    127.0.0.1.46494 > 127.0.0.1.11750: Flags [S], cksum 0xfe30 (incorrect -> 0x3ba7), seq 1069564612, win 65495, options [mss 65495,sackOK,TS val 1305960570 ecr 0,nop,wscale 7], length 0
2022-02-28 08:20:16.346961 IP (tos 0x0, ttl 64, id 0, offset 0, flags [DF], proto TCP (6), length 60)
    127.0.0.1.11750 > 127.0.0.1.46494: Flags [S.], cksum 0xfe30 (incorrect -> 0x75ef), seq 2392295625, ack 1069564613, win 65483, options [mss 65495,sackOK,TS val 1305960570 ecr 1305960570,nop,wscale 7], length 0
2022-02-28 08:20:16.346973 IP (tos 0x0, ttl 64, id 170, offset 0, flags [DF], proto TCP (6), length 52)
    127.0.0.1.46494 > 127.0.0.1.11750: Flags [.], cksum 0xfe28 (incorrect -> 0x9cab), seq 1, ack 1, win 512, options [nop,nop,TS val 1305960570 ecr 1305960570], length 0
2022-02-28 08:20:16.347133 IP (tos 0x0, ttl 64, id 171, offset 0, flags [DF], proto TCP (6), length 55)
    127.0.0.1.46494 > 127.0.0.1.11750: Flags [P.], cksum 0xfe2b (incorrect -> 0x979f), seq 1:4, ack 1, win 512, options [nop,nop,TS val 1305960570 ecr 1305960570], length 3
2022-02-28 08:20:16.347141 IP (tos 0x0, ttl 64, id 42157, offset 0, flags [DF], proto TCP (6), length 52)
    127.0.0.1.11750 > 127.0.0.1.46494: Flags [.], cksum 0xfe28 (incorrect -> 0x9ca8), seq 1, ack 4, win 512, options [nop,nop,TS val 1305960570 ecr 1305960570], length 0
2022-02-28 08:20:16.347164 IP (tos 0x0, ttl 64, id 42158, offset 0, flags [DF], proto TCP (6), length 54)
    127.0.0.1.11750 > 127.0.0.1.46494: Flags [P.], cksum 0xfe2a (incorrect -> 0x979e), seq 1:3, ack 4, win 512, options [nop,nop,TS val 1305960570 ecr 1305960570], length 2
2022-02-28 08:20:16.347172 IP (tos 0x0, ttl 64, id 172, offset 0, flags [DF], proto TCP (6), length 52)
    127.0.0.1.46494 > 127.0.0.1.11750: Flags [.], cksum 0xfe28 (incorrect -> 0x9ca6), seq 4, ack 3, win 512, options [nop,nop,TS val 1305960570 ecr 1305960570], length 0
2022-02-28 08:20:16.348571 IP (tos 0x0, ttl 64, id 173, offset 0, flags [DF], proto TCP (6), length 62)
    127.0.0.1.46494 > 127.0.0.1.11750: Flags [P.], cksum 0xfe32 (incorrect -> 0xc35f), seq 4:14, ack 3, win 512, options [nop,nop,TS val 1305960572 ecr 1305960570], length 10
2022-02-28 08:20:16.348594 IP (tos 0x0, ttl 64, id 42159, offset 0, flags [DF], proto TCP (6), length 52)
    127.0.0.1.11750 > 127.0.0.1.46494: Flags [.], cksum 0xfe28 (incorrect -> 0x9c98), seq 3, ack 14, win 512, options [nop,nop,TS val 1305960572 ecr 1305960572], length 0
2022-02-28 08:20:16.547687 IP (tos 0x0, ttl 64, id 42160, offset 0, flags [DF], proto TCP (6), length 62)
    127.0.0.1.11750 > 127.0.0.1.46494: Flags [P.], cksum 0xfe32 (incorrect -> 0x96be), seq 3:13, ack 14, win 512, options [nop,nop,TS val 1305960771 ecr 1305960572], length 10
2022-02-28 08:20:16.547699 IP (tos 0x0, ttl 64, id 174, offset 0, flags [DF], proto TCP (6), length 52)
    127.0.0.1.46494 > 127.0.0.1.11750: Flags [.], cksum 0xfe28 (incorrect -> 0x9b00), seq 14, ack 13, win 512, options [nop,nop,TS val 1305960771 ecr 1305960771], length 0
2022-02-28 08:20:16.553903 IP (tos 0x0, ttl 64, id 175, offset 0, flags [DF], proto TCP (6), length 569)
    127.0.0.1.46494 > 127.0.0.1.11750: Flags [P.], cksum 0x002e (incorrect -> 0xec08), seq 14:531, ack 13, win 512, options [nop,nop,TS val 1305960777 ecr 1305960771], length 517
2022-02-28 08:20:16.553914 IP (tos 0x0, ttl 64, id 42161, offset 0, flags [DF], proto TCP (6), length 52)
    127.0.0.1.11750 > 127.0.0.1.46494: Flags [.], cksum 0xfe28 (incorrect -> 0x98f3), seq 13, ack 531, win 508, options [nop,nop,TS val 1305960777 ecr 1305960777], length 0
2022-02-28 08:20:16.751620 IP (tos 0x0, ttl 64, id 42162, offset 0, flags [DF], proto TCP (6), length 3538)
    127.0.0.1.11750 > 127.0.0.1.46494: Flags [P.], cksum 0x0bc7 (incorrect -> 0x4584), seq 13:3499, ack 531, win 512, options [nop,nop,TS val 1305960975 ecr 1305960777], length 3486
2022-02-28 08:20:16.751637 IP (tos 0x0, ttl 64, id 176, offset 0, flags [DF], proto TCP (6), length 52)
    127.0.0.1.46494 > 127.0.0.1.11750: Flags [.], cksum 0xfe28 (incorrect -> 0x89d7), seq 531, ack 3499, win 494, options [nop,nop,TS val 1305960975 ecr 1305960975], length 0
2022-02-28 08:20:16.761754 IP (tos 0x0, ttl 64, id 42163, offset 0, flags [DF], proto TCP (6), length 730)
    127.0.0.1.11750 > 127.0.0.1.46494: Flags [P.], cksum 0x00cf (incorrect -> 0xd470), seq 3499:4177, ack 531, win 512, options [nop,nop,TS val 1305960985 ecr 1305960975], length 678
2022-02-28 08:20:16.761762 IP (tos 0x0, ttl 64, id 177, offset 0, flags [DF], proto TCP (6), length 52)
    127.0.0.1.46494 > 127.0.0.1.11750: Flags [.], cksum 0xfe28 (incorrect -> 0x8712), seq 531, ack 4177, win 505, options [nop,nop,TS val 1305960985 ecr 1305960985], length 0
2022-02-28 08:20:16.835853 IP (tos 0x0, ttl 64, id 42164, offset 0, flags [DF], proto TCP (6), length 1456)
    127.0.0.1.11750 > 127.0.0.1.46494: Flags [P.], cksum 0x03a5 (incorrect -> 0x04e9), seq 4177:5581, ack 531, win 512, options [nop,nop,TS val 1305961059 ecr 1305960985], length 1404
2022-02-28 08:20:16.835871 IP (tos 0x0, ttl 64, id 178, offset 0, flags [DF], proto TCP (6), length 52)
    127.0.0.1.46494 > 127.0.0.1.11750: Flags [.], cksum 0xfe28 (incorrect -> 0x8105), seq 531, ack 5581, win 502, options [nop,nop,TS val 1305961059 ecr 1305961059], length 0
2022-02-28 08:20:16.836332 IP (tos 0x0, ttl 64, id 179, offset 0, flags [DF], proto TCP (6), length 116)
    127.0.0.1.46494 > 127.0.0.1.11750: Flags [P.], cksum 0xfe68 (incorrect -> 0x5884), seq 531:595, ack 5581, win 512, options [nop,nop,TS val 1305961059 ecr 1305961059], length 64
2022-02-28 08:20:16.836342 IP (tos 0x0, ttl 64, id 42165, offset 0, flags [DF], proto TCP (6), length 52)
    127.0.0.1.11750 > 127.0.0.1.46494: Flags [.], cksum 0xfe28 (incorrect -> 0x80bb), seq 5581, ack 595, win 512, options [nop,nop,TS val 1305961059 ecr 1305961059], length 0
2022-02-28 08:20:16.836795 IP (tos 0x0, ttl 64, id 180, offset 0, flags [DF], proto TCP (6), length 373)
    127.0.0.1.46494 > 127.0.0.1.11750: Flags [P.], cksum 0xff69 (incorrect -> 0xa58e), seq 595:916, ack 5581, win 512, options [nop,nop,TS val 1305961060 ecr 1305961059], length 321
2022-02-28 08:20:16.836804 IP (tos 0x0, ttl 64, id 42166, offset 0, flags [DF], proto TCP (6), length 52)
    127.0.0.1.11750 > 127.0.0.1.46494: Flags [.], cksum 0xfe28 (incorrect -> 0x7f7a), seq 5581, ack 916, win 510, options [nop,nop,TS val 1305961060 ecr 1305961060], length 0
2022-02-28 08:20:17.134483 IP (tos 0x0, ttl 64, id 42167, offset 0, flags [DF], proto TCP (6), length 4100)
    127.0.0.1.11750 > 127.0.0.1.46494: Flags [P.], cksum 0x0df9 (incorrect -> 0x9575), seq 5581:9629, ack 916, win 512, options [nop,nop,TS val 1305961358 ecr 1305961060], length 4048
2022-02-28 08:20:17.134505 IP (tos 0x0, ttl 64, id 181, offset 0, flags [DF], proto TCP (6), length 52)
    127.0.0.1.46494 > 127.0.0.1.11750: Flags [.], cksum 0xfe28 (incorrect -> 0x6d68), seq 916, ack 9629, win 492, options [nop,nop,TS val 1305961358 ecr 1305961358], length 0
2022-02-28 08:20:17.135458 IP (tos 0x0, ttl 64, id 42168, offset 0, flags [DF], proto TCP (6), length 2267)
    127.0.0.1.11750 > 127.0.0.1.46494: Flags [P.], cksum 0x06d0 (incorrect -> 0xe115), seq 9629:11844, ack 916, win 512, options [nop,nop,TS val 1305961359 ecr 1305961358], length 2215
2022-02-28 08:20:17.135466 IP (tos 0x0, ttl 64, id 182, offset 0, flags [DF], proto TCP (6), length 52)
    127.0.0.1.46494 > 127.0.0.1.11750: Flags [.], cksum 0xfe28 (incorrect -> 0x64b8), seq 916, ack 11844, win 499, options [nop,nop,TS val 1305961359 ecr 1305961359], length 0
2022-02-28 08:20:17.142560 IP (tos 0x0, ttl 64, id 42169, offset 0, flags [DF], proto TCP (6), length 2828)
    127.0.0.1.11750 > 127.0.0.1.46494: Flags [P.], cksum 0x0901 (incorrect -> 0x0402), seq 11844:14620, ack 916, win 512, options [nop,nop,TS val 1305961366 ecr 1305961359], length 2776
2022-02-28 08:20:17.142576 IP (tos 0x0, ttl 64, id 183, offset 0, flags [DF], proto TCP (6), length 52)
    127.0.0.1.46494 > 127.0.0.1.11750: Flags [.], cksum 0xfe28 (incorrect -> 0x59d4), seq 916, ack 14620, win 497, options [nop,nop,TS val 1305961366 ecr 1305961366], length 0
2022-02-28 08:20:17.157160 IP (tos 0x0, ttl 64, id 42170, offset 0, flags [DF], proto TCP (6), length 2828)
    127.0.0.1.11750 > 127.0.0.1.46494: Flags [P.], cksum 0x0901 (incorrect -> 0xb3bf), seq 14620:17396, ack 916, win 512, options [nop,nop,TS val 1305961380 ecr 1305961366], length 2776
2022-02-28 08:20:17.157168 IP (tos 0x0, ttl 64, id 184, offset 0, flags [DF], proto TCP (6), length 52)
    127.0.0.1.46494 > 127.0.0.1.11750: Flags [.], cksum 0xfe28 (incorrect -> 0x4ee0), seq 916, ack 17396, win 497, options [nop,nop,TS val 1305961380 ecr 1305961380], length 0
2022-02-28 08:20:17.215614 IP (tos 0x0, ttl 64, id 42171, offset 0, flags [DF], proto TCP (6), length 4100)
    127.0.0.1.11750 > 127.0.0.1.46494: Flags [P.], cksum 0x0df9 (incorrect -> 0x9895), seq 17396:21444, ack 916, win 512, options [nop,nop,TS val 1305961439 ecr 1305961380], length 4048
2022-02-28 08:20:17.215626 IP (tos 0x0, ttl 64, id 185, offset 0, flags [DF], proto TCP (6), length 52)
    127.0.0.1.46494 > 127.0.0.1.11750: Flags [.], cksum 0xfe28 (incorrect -> 0x3e9f), seq 916, ack 21444, win 492, options [nop,nop,TS val 1305961439 ecr 1305961439], length 0
2022-02-28 08:20:17.215657 IP (tos 0x0, ttl 64, id 42172, offset 0, flags [DF], proto TCP (6), length 2976)
    127.0.0.1.11750 > 127.0.0.1.46494: Flags [P.], cksum 0x0995 (incorrect -> 0x58f0), seq 21444:24368, ack 916, win 512, options [nop,nop,TS val 1305961439 ecr 1305961439], length 2924
2022-02-28 08:20:17.215661 IP (tos 0x0, ttl 64, id 186, offset 0, flags [DF], proto TCP (6), length 52)
    127.0.0.1.46494 > 127.0.0.1.11750: Flags [.], cksum 0xfe28 (incorrect -> 0x332f), seq 916, ack 24368, win 496, options [nop,nop,TS val 1305961439 ecr 1305961439], length 0
2022-02-28 08:20:17.218517 IP (tos 0x0, ttl 64, id 42173, offset 0, flags [DF], proto TCP (6), length 3538)
    127.0.0.1.11750 > 127.0.0.1.46494: Flags [P.], cksum 0x0bc7 (incorrect -> 0x4788), seq 24368:27854, ack 916, win 512, options [nop,nop,TS val 1305961442 ecr 1305961439], length 3486
2022-02-28 08:20:17.218525 IP (tos 0x0, ttl 64, id 187, offset 0, flags [DF], proto TCP (6), length 52)
    127.0.0.1.46494 > 127.0.0.1.11750: Flags [.], cksum 0xfe28 (incorrect -> 0x258d), seq 916, ack 27854, win 494, options [nop,nop,TS val 1305961442 ecr 1305961442], length 0
2022-02-28 08:20:17.219620 IP (tos 0x0, ttl 64, id 42174, offset 0, flags [DF], proto TCP (6), length 3188)
    127.0.0.1.11750 > 127.0.0.1.46494: Flags [P.], cksum 0x0a69 (incorrect -> 0x1eda), seq 27854:30990, ack 916, win 512, options [nop,nop,TS val 1305961443 ecr 1305961442], length 3136
2022-02-28 08:20:17.219626 IP (tos 0x0, ttl 64, id 188, offset 0, flags [DF], proto TCP (6), length 52)
    127.0.0.1.46494 > 127.0.0.1.11750: Flags [.], cksum 0xfe28 (incorrect -> 0x194a), seq 916, ack 30990, win 495, options [nop,nop,TS val 1305961443 ecr 1305961443], length 0
2022-02-28 08:20:17.221198 IP (tos 0x0, ttl 64, id 42175, offset 0, flags [DF], proto TCP (6), length 4100)
    127.0.0.1.11750 > 127.0.0.1.46494: Flags [P.], cksum 0x0df9 (incorrect -> 0xf260), seq 30990:35038, ack 916, win 512, options [nop,nop,TS val 1305961444 ecr 1305961443], length 4048
2022-02-28 08:20:17.266149 IP (tos 0x0, ttl 64, id 189, offset 0, flags [DF], proto TCP (6), length 52)
    127.0.0.1.46494 > 127.0.0.1.11750: Flags [.], cksum 0xfe28 (incorrect -> 0x093a), seq 916, ack 35038, win 512, options [nop,nop,TS val 1305961489 ecr 1305961444], length 0
2022-02-28 08:20:17.266161 IP (tos 0x0, ttl 64, id 42176, offset 0, flags [DF], proto TCP (6), length 6610)
    127.0.0.1.11750 > 127.0.0.1.46494: Flags [P.], cksum 0x17c7 (incorrect -> 0x7a7f), seq 35038:41596, ack 916, win 512, options [nop,nop,TS val 1305961489 ecr 1305961489], length 6558
2022-02-28 08:20:17.314149 IP (tos 0x0, ttl 64, id 190, offset 0, flags [DF], proto TCP (6), length 52)
    127.0.0.1.46494 > 127.0.0.1.11750: Flags [.], cksum 0xfe28 (incorrect -> 0xef3e), seq 916, ack 41596, win 512, options [nop,nop,TS val 1305961537 ecr 1305961489], length 0
2022-02-28 08:20:17.327784 IP (tos 0x0, ttl 64, id 42177, offset 0, flags [DF], proto TCP (6), length 3326)
    127.0.0.1.11750 > 127.0.0.1.46494: Flags [P.], cksum 0x0af3 (incorrect -> 0xd354), seq 41596:44870, ack 916, win 512, options [nop,nop,TS val 1305961551 ecr 1305961537], length 3274
2022-02-28 08:20:17.327815 IP (tos 0x0, ttl 64, id 191, offset 0, flags [DF], proto TCP (6), length 52)
    127.0.0.1.46494 > 127.0.0.1.11750: Flags [.], cksum 0xfe28 (incorrect -> 0xe228), seq 916, ack 44870, win 512, options [nop,nop,TS val 1305961551 ecr 1305961551], length 0
2022-02-28 08:20:17.329251 IP (tos 0x0, ttl 64, id 42178, offset 0, flags [DF], proto TCP (6), length 4100)
    127.0.0.1.11750 > 127.0.0.1.46494: Flags [P.], cksum 0x0df9 (incorrect -> 0xfbe1), seq 44870:48918, ack 916, win 512, options [nop,nop,TS val 1305961552 ecr 1305961551], length 4048
2022-02-28 08:20:17.329383 IP (tos 0x0, ttl 64, id 192, offset 0, flags [DF], proto TCP (6), length 52)
    127.0.0.1.46494 > 127.0.0.1.11750: Flags [.], cksum 0xfe28 (incorrect -> 0xd256), seq 916, ack 48918, win 512, options [nop,nop,TS val 1305961552 ecr 1305961552], length 0
2022-02-28 08:20:17.329391 IP (tos 0x0, ttl 64, id 42179, offset 0, flags [DF], proto TCP (6), length 16824)
    127.0.0.1.11750 > 127.0.0.1.46494: Flags [P.], cksum 0x3fad (incorrect -> 0x5230), seq 48918:65690, ack 916, win 512, options [nop,nop,TS val 1305961552 ecr 1305961552], length 16772
2022-02-28 08:20:17.374143 IP (tos 0x0, ttl 64, id 193, offset 0, flags [DF], proto TCP (6), length 52)
    127.0.0.1.46494 > 127.0.0.1.11750: Flags [.], cksum 0xfe28 (incorrect -> 0x90a5), seq 916, ack 65690, win 512, options [nop,nop,TS val 1305961597 ecr 1305961552], length 0
2022-02-28 08:20:17.374156 IP (tos 0x0, ttl 64, id 42180, offset 0, flags [DF], proto TCP (6), length 23934)
    127.0.0.1.11750 > 127.0.0.1.46494: Flags [P.], cksum 0x5b73 (incorrect -> 0xe0e2), seq 65690:89572, ack 916, win 512, options [nop,nop,TS val 1305961597 ecr 1305961597], length 23882
2022-02-28 08:20:17.418147 IP (tos 0x0, ttl 64, id 194, offset 0, flags [DF], proto TCP (6), length 52)
    127.0.0.1.46494 > 127.0.0.1.11750: Flags [.], cksum 0xfe28 (incorrect -> 0x3302), seq 916, ack 89572, win 512, options [nop,nop,TS val 1305961641 ecr 1305961597], length 0
2022-02-28 08:20:17.418168 IP (tos 0x0, ttl 64, id 42181, offset 0, flags [DF], proto TCP (6), length 14198)
    127.0.0.1.11750 > 127.0.0.1.46494: Flags [P.], cksum 0x356b (incorrect -> 0xabe3), seq 89572:103718, ack 916, win 512, options [nop,nop,TS val 1305961641 ecr 1305961641], length 14146
2022-02-28 08:20:17.418239 IP (tos 0x0, ttl 64, id 195, offset 0, flags [DF], proto TCP (6), length 52)
    127.0.0.1.46494 > 127.0.0.1.11750: Flags [.], cksum 0xfe28 (incorrect -> 0xfb93), seq 916, ack 103718, win 512, options [nop,nop,TS val 1305961641 ecr 1305961641], length 0
2022-02-28 08:20:17.418244 IP (tos 0x0, ttl 64, id 42182, offset 0, flags [DF], proto TCP (6), length 3944)
    127.0.0.1.11750 > 127.0.0.1.46494: Flags [P.], cksum 0x0d5d (incorrect -> 0xe831), seq 103718:107610, ack 916, win 512, options [nop,nop,TS val 1305961641 ecr 1305961641], length 3892
2022-02-28 08:20:17.418457 IP (tos 0x0, ttl 64, id 196, offset 0, flags [DF], proto TCP (6), length 52)
    127.0.0.1.46494 > 127.0.0.1.11750: Flags [.], cksum 0xfe28 (incorrect -> 0xec5e), seq 916, ack 107610, win 512, options [nop,nop,TS val 1305961642 ecr 1305961641], length 0
2022-02-28 08:20:17.418520 IP (tos 0x0, ttl 64, id 42183, offset 0, flags [DF], proto TCP (6), length 4100)
    127.0.0.1.11750 > 127.0.0.1.46494: Flags [P.], cksum 0x0df9 (incorrect -> 0x3fa7), seq 107610:111658, ack 916, win 512, options [nop,nop,TS val 1305961642 ecr 1305961642], length 4048
2022-02-28 08:20:17.418577 IP (tos 0x0, ttl 64, id 197, offset 0, flags [DF], proto TCP (6), length 52)
    127.0.0.1.46494 > 127.0.0.1.11750: Flags [.], cksum 0xfe28 (incorrect -> 0xdc8d), seq 916, ack 111658, win 512, options [nop,nop,TS val 1305961642 ecr 1305961642], length 0
2022-02-28 08:20:17.418583 IP (tos 0x0, ttl 64, id 42184, offset 0, flags [DF], proto TCP (6), length 7956)
    127.0.0.1.11750 > 127.0.0.1.46494: Flags [P.], cksum 0x1d09 (incorrect -> 0x7ff2), seq 111658:119562, ack 916, win 512, options [nop,nop,TS val 1305961642 ecr 1305961642], length 7904
2022-02-28 08:20:17.418588 IP (tos 0x0, ttl 64, id 198, offset 0, flags [DF], proto TCP (6), length 52)
    127.0.0.1.46494 > 127.0.0.1.11750: Flags [.], cksum 0xfe28 (incorrect -> 0xbdad), seq 916, ack 119562, win 512, options [nop,nop,TS val 1305961642 ecr 1305961642], length 0
200, 4.800004005432129, 1.0821125507354736