2022-02-28 08:00:26.441745 IP (tos 0x0, ttl 64, id 16883, offset 0, flags [DF], proto TCP (6), length 60)
    127.0.0.1.33604 > 127.0.0.1.11950: Flags [S], cksum 0xfe30 (incorrect -> 0xc776), seq 1345585206, win 65495, options [mss 65495,sackOK,TS val 1304770665 ecr 0,nop,wscale 7], length 0
2022-02-28 08:00:26.441763 IP (tos 0x0, ttl 64, id 0, offset 0, flags [DF], proto TCP (6), length 60)
    127.0.0.1.11950 > 127.0.0.1.33604: Flags [S.], cksum 0xfe30 (incorrect -> 0x5048), seq 304275160, ack 1345585207, win 65483, options [mss 65495,sackOK,TS val 1304770665 ecr 1304770665,nop,wscale 7], length 0
2022-02-28 08:00:26.441776 IP (tos 0x0, ttl 64, id 16884, offset 0, flags [DF], proto TCP (6), length 52)
    127.0.0.1.33604 > 127.0.0.1.11950: Flags [.], cksum 0xfe28 (incorrect -> 0x7704), seq 1, ack 1, win 512, options [nop,nop,TS val 1304770665 ecr 1304770665], length 0
2022-02-28 08:00:26.441896 IP (tos 0x0, ttl 64, id 16885, offset 0, flags [DF], proto TCP (6), length 55)
    127.0.0.1.33604 > 127.0.0.1.11950: Flags [P.], cksum 0xfe2b (incorrect -> 0x71f8), seq 1:4, ack 1, win 512, options [nop,nop,TS val 1304770665 ecr 1304770665], length 3
2022-02-28 08:00:26.441909 IP (tos 0x0, ttl 64, id 132, offset 0, flags [DF], proto TCP (6), length 52)
    127.0.0.1.11950 > 127.0.0.1.33604: Flags [.], cksum 0xfe28 (incorrect -> 0x7701), seq 1, ack 4, win 512, options [nop,nop,TS val 1304770665 ecr 1304770665], length 0
2022-02-28 08:00:26.441945 IP (tos 0x0, ttl 64, id 133, offset 0, flags [DF], proto TCP (6), length 54)
    127.0.0.1.11950 > 127.0.0.1.33604: Flags [P.], cksum 0xfe2a (incorrect -> 0x71f7), seq 1:3, ack 4, win 512, options [nop,nop,TS val 1304770665 ecr 1304770665], length 2
2022-02-28 08:00:26.441958 IP (tos 0x0, ttl 64, id 16886, offset 0, flags [DF], proto TCP (6), length 52)
    127.0.0.1.33604 > 127.0.0.1.11950: Flags [.], cksum 0xfe28 (incorrect -> 0x76ff), seq 4, ack 3, win 512, options [nop,nop,TS val 1304770665 ecr 1304770665], length 0
2022-02-28 08:00:26.444044 IP (tos 0x0, ttl 64, id 16887, offset 0, flags [DF], proto TCP (6), length 62)
    127.0.0.1.33604 > 127.0.0.1.11950: Flags [P.], cksum 0xfe32 (incorrect -> 0xc34e), seq 4:14, ack 3, win 512, options [nop,nop,TS val 1304770667 ecr 1304770665], length 10
2022-02-28 08:00:26.444062 IP (tos 0x0, ttl 64, id 134, offset 0, flags [DF], proto TCP (6), length 52)
    127.0.0.1.11950 > 127.0.0.1.33604: Flags [.], cksum 0xfe28 (incorrect -> 0x76f1), seq 3, ack 14, win 512, options [nop,nop,TS val 1304770667 ecr 1304770667], length 0
2022-02-28 08:00:26.532317 IP (tos 0x0, ttl 64, id 135, offset 0, flags [DF], proto TCP (6), length 62)
    127.0.0.1.11950 > 127.0.0.1.33604: Flags [P.], cksum 0xfe32 (incorrect -> 0x7186), seq 3:13, ack 14, win 512, options [nop,nop,TS val 1304770755 ecr 1304770667], length 10
2022-02-28 08:00:26.532325 IP (tos 0x0, ttl 64, id 16888, offset 0, flags [DF], proto TCP (6), length 52)
    127.0.0.1.33604 > 127.0.0.1.11950: Flags [.], cksum 0xfe28 (incorrect -> 0x7637), seq 14, ack 13, win 512, options [nop,nop,TS val 1304770755 ecr 1304770755], length 0
2022-02-28 08:00:26.538251 IP (tos 0x0, ttl 64, id 16889, offset 0, flags [DF], proto TCP (6), length 569)
    127.0.0.1.33604 > 127.0.0.1.11950: Flags [P.], cksum 0x002e (incorrect -> 0x0e2d), seq 14:531, ack 13, win 512, options [nop,nop,TS val 1304770761 ecr 1304770755], length 517
2022-02-28 08:00:26.538257 IP (tos 0x0, ttl 64, id 136, offset 0, flags [DF], proto TCP (6), length 52)
    127.0.0.1.11950 > 127.0.0.1.33604: Flags [.], cksum 0xfe28 (incorrect -> 0x742a), seq 13, ack 531, win 508, options [nop,nop,TS val 1304770761 ecr 1304770761], length 0
200, 125.61735081672668, 0.4949026107788086