2022-02-28 11:41:30.930287 IP (tos 0x0, ttl 64, id 21867, offset 0, flags [DF], proto TCP (6), length 60)
    127.0.0.1.56096 > 127.0.0.1.11050: Flags [S], cksum 0xfe30 (incorrect -> 0x211b), seq 2002109413, win 65495, options [mss 65495,sackOK,TS val 1318035153 ecr 0,nop,wscale 7], length 0
2022-02-28 11:41:30.930304 IP (tos 0x0, ttl 64, id 0, offset 0, flags [DF], proto TCP (6), length 60)
    127.0.0.1.11050 > 127.0.0.1.56096: Flags [S.], cksum 0xfe30 (incorrect -> 0x8dd9), seq 447449904, ack 2002109414, win 65483, options [mss 65495,sackOK,TS val 1318035153 ecr 1318035153,nop,wscale 7], length 0
2022-02-28 11:41:30.930316 IP (tos 0x0, ttl 64, id 21868, offset 0, flags [DF], proto TCP (6), length 52)
    127.0.0.1.56096 > 127.0.0.1.11050: Flags [.], cksum 0xfe28 (incorrect -> 0xb495), seq 1, ack 1, win 512, options [nop,nop,TS val 1318035153 ecr 1318035153], length 0
2022-02-28 11:41:30.930424 IP (tos 0x0, ttl 64, id 21869, offset 0, flags [DF], proto TCP (6), length 55)
    127.0.0.1.56096 > 127.0.0.1.11050: Flags [P.], cksum 0xfe2b (incorrect -> 0xaf89), seq 1:4, ack 1, win 512, options [nop,nop,TS val 1318035153 ecr 1318035153], length 3
2022-02-28 11:41:30.930437 IP (tos 0x0, ttl 64, id 30776, offset 0, flags [DF], proto TCP (6), length 52)
    127.0.0.1.11050 > 127.0.0.1.56096: Flags [.], cksum 0xfe28 (incorrect -> 0xb491), seq 1, ack 4, win 512, options [nop,nop,TS val 1318035154 ecr 1318035153], length 0
2022-02-28 11:41:30.930472 IP (tos 0x0, ttl 64, id 30777, offset 0, flags [DF], proto TCP (6), length 54)
    127.0.0.1.11050 > 127.0.0.1.56096: Flags [P.], cksum 0xfe2a (incorrect -> 0xaf87), seq 1:3, ack 4, win 512, options [nop,nop,TS val 1318035154 ecr 1318035153], length 2
2022-02-28 11:41:30.930486 IP (tos 0x0, ttl 64, id 21870, offset 0, flags [DF], proto TCP (6), length 52)
    127.0.0.1.56096 > 127.0.0.1.11050: Flags [.], cksum 0xfe28 (incorrect -> 0xb48e), seq 4, ack 3, win 512, options [nop,nop,TS val 1318035154 ecr 1318035154], length 0
2022-02-28 11:41:30.932489 IP (tos 0x0, ttl 64, id 21871, offset 0, flags [DF], proto TCP (6), length 62)
    127.0.0.1.56096 > 127.0.0.1.11050: Flags [P.], cksum 0xfe32 (incorrect -> 0x9542), seq 4:14, ack 3, win 512, options [nop,nop,TS val 1318035156 ecr 1318035154], length 10
2022-02-28 11:41:30.932499 IP (tos 0x0, ttl 64, id 30778, offset 0, flags [DF], proto TCP (6), length 52)
    127.0.0.1.11050 > 127.0.0.1.56096: Flags [.], cksum 0xfe28 (incorrect -> 0xb480), seq 3, ack 14, win 512, options [nop,nop,TS val 1318035156 ecr 1318035156], length 0
2022-02-28 11:41:31.066707 IP (tos 0x0, ttl 64, id 30779, offset 0, flags [DF], proto TCP (6), length 62)
    127.0.0.1.11050 > 127.0.0.1.56096: Flags [P.], cksum 0xfe32 (incorrect -> 0xaee7), seq 3:13, ack 14, win 512, options [nop,nop,TS val 1318035290 ecr 1318035156], length 10
2022-02-28 11:41:31.066716 IP (tos 0x0, ttl 64, id 21872, offset 0, flags [DF], proto TCP (6), length 52)
    127.0.0.1.56096 > 127.0.0.1.11050: Flags [.], cksum 0xfe28 (incorrect -> 0xb36a), seq 14, ack 13, win 512, options [nop,nop,TS val 1318035290 ecr 1318035290], length 0
2022-02-28 11:41:31.073070 IP (tos 0x0, ttl 64, id 21873, offset 0, flags [DF], proto TCP (6), length 569)
    127.0.0.1.56096 > 127.0.0.1.11050: Flags [P.], cksum 0x002e (incorrect -> 0xf515), seq 14:531, ack 13, win 512, options [nop,nop,TS val 1318035296 ecr 1318035290], length 517
2022-02-28 11:41:31.073080 IP (tos 0x0, ttl 64, id 30780, offset 0, flags [DF], proto TCP (6), length 52)
    127.0.0.1.11050 > 127.0.0.1.56096: Flags [.], cksum 0xfe28 (incorrect -> 0xb15d), seq 13, ack 531, win 508, options [nop,nop,TS val 1318035296 ecr 1318035296], length 0
2022-02-28 11:41:31.192329 IP (tos 0x0, ttl 64, id 30781, offset 0, flags [DF], proto TCP (6), length 3538)
    127.0.0.1.11050 > 127.0.0.1.56096: Flags [P.], cksum 0x0bc7 (incorrect -> 0x22be), seq 13:3499, ack 531, win 512, options [nop,nop,TS val 1318035415 ecr 1318035296], length 3486
2022-02-28 11:41:31.192340 IP (tos 0x0, ttl 64, id 21874, offset 0, flags [DF], proto TCP (6), length 52)
    127.0.0.1.56096 > 127.0.0.1.11050: Flags [.], cksum 0xfe28 (incorrect -> 0xa2df), seq 531, ack 3499, win 494, options [nop,nop,TS val 1318035415 ecr 1318035415], length 0
2022-02-28 11:41:31.201559 IP (tos 0x0, ttl 64, id 30782, offset 0, flags [DF], proto TCP (6), length 1048)
    127.0.0.1.11050 > 127.0.0.1.56096: Flags [P.], cksum 0x020d (incorrect -> 0xa016), seq 3499:4495, ack 531, win 512, options [nop,nop,TS val 1318035425 ecr 1318035415], length 996
2022-02-28 11:41:31.201565 IP (tos 0x0, ttl 64, id 21875, offset 0, flags [DF], proto TCP (6), length 52)
    127.0.0.1.56096 > 127.0.0.1.11050: Flags [.], cksum 0xfe28 (incorrect -> 0x9edd), seq 531, ack 4495, win 504, options [nop,nop,TS val 1318035425 ecr 1318035425], length 0
2022-02-28 11:41:31.202054 IP (tos 0x0, ttl 64, id 21876, offset 0, flags [DF], proto TCP (6), length 132)
    127.0.0.1.56096 > 127.0.0.1.11050: Flags [P.], cksum 0xfe78 (incorrect -> 0x3e9a), seq 531:611, ack 4495, win 504, options [nop,nop,TS val 1318035425 ecr 1318035425], length 80
2022-02-28 11:41:31.202063 IP (tos 0x0, ttl 64, id 30783, offset 0, flags [DF], proto TCP (6), length 52)
    127.0.0.1.11050 > 127.0.0.1.56096: Flags [.], cksum 0xfe28 (incorrect -> 0x9e85), seq 4495, ack 611, win 512, options [nop,nop,TS val 1318035425 ecr 1318035425], length 0
2022-02-28 11:41:31.202615 IP (tos 0x0, ttl 64, id 21877, offset 0, flags [DF], proto TCP (6), length 363)
    127.0.0.1.56096 > 127.0.0.1.11050: Flags [P.], cksum 0xff5f (incorrect -> 0x5fc6), seq 611:922, ack 4495, win 504, options [nop,nop,TS val 1318035426 ecr 1318035425], length 311
2022-02-28 11:41:31.202625 IP (tos 0x0, ttl 64, id 30784, offset 0, flags [DF], proto TCP (6), length 52)
    127.0.0.1.11050 > 127.0.0.1.56096: Flags [.], cksum 0xfe28 (incorrect -> 0x9d4e), seq 4495, ack 922, win 510, options [nop,nop,TS val 1318035426 ecr 1318035426], length 0
2022-02-28 11:41:31.210838 IP (tos 0x0, ttl 64, id 30785, offset 0, flags [DF], proto TCP (6), length 221)
    127.0.0.1.11050 > 127.0.0.1.56096: Flags [P.], cksum 0xfed1 (incorrect -> 0x7768), seq 4495:4664, ack 922, win 512, options [nop,nop,TS val 1318035434 ecr 1318035426], length 169
2022-02-28 11:41:31.210845 IP (tos 0x0, ttl 64, id 21878, offset 0, flags [DF], proto TCP (6), length 52)
    127.0.0.1.56096 > 127.0.0.1.11050: Flags [.], cksum 0xfe28 (incorrect -> 0x9c98), seq 922, ack 4664, win 507, options [nop,nop,TS val 1318035434 ecr 1318035434], length 0
2022-02-28 11:41:31.284021 IP (tos 0x0, ttl 64, id 30786, offset 0, flags [DF], proto TCP (6), length 507)
    127.0.0.1.11050 > 127.0.0.1.56096: Flags [P.], cksum 0xffef (incorrect -> 0xfd51), seq 4664:5119, ack 922, win 512, options [nop,nop,TS val 1318035507 ecr 1318035434], length 455
2022-02-28 11:41:31.284030 IP (tos 0x0, ttl 64, id 21879, offset 0, flags [DF], proto TCP (6), length 52)
    127.0.0.1.56096 > 127.0.0.1.11050: Flags [.], cksum 0xfe28 (incorrect -> 0x9a40), seq 922, ack 5119, win 506, options [nop,nop,TS val 1318035507 ecr 1318035507], length 0
2022-02-28 11:41:31.284049 IP (tos 0x0, ttl 64, id 30787, offset 0, flags [DF], proto TCP (6), length 52)
    127.0.0.1.11050 > 127.0.0.1.56096: Flags [F.], cksum 0xfe28 (incorrect -> 0x9a39), seq 5119, ack 922, win 512, options [nop,nop,TS val 1318035507 ecr 1318035507], length 0
2022-02-28 11:41:31.285119 IP (tos 0x0, ttl 64, id 21880, offset 0, flags [DF], proto TCP (6), length 52)
    127.0.0.1.56096 > 127.0.0.1.11050: Flags [R.], cksum 0xfe28 (incorrect -> 0x9a34), seq 922, ack 5120, win 512, options [nop,nop,TS val 1318035508 ecr 1318035507], length 0
2022-02-28 11:41:31.286394 IP (tos 0x0, ttl 64, id 31832, offset 0, flags [DF], proto TCP (6), length 60)
    127.0.0.1.56098 > 127.0.0.1.11050: Flags [S], cksum 0xfe30 (incorrect -> 0x25f1), seq 1801898392, win 65495, options [mss 65495,sackOK,TS val 1318035509 ecr 0,nop,wscale 7], length 0
2022-02-28 11:41:31.286404 IP (tos 0x0, ttl 64, id 0, offset 0, flags [DF], proto TCP (6), length 60)
    127.0.0.1.11050 > 127.0.0.1.56098: Flags [S.], cksum 0xfe30 (incorrect -> 0xbdfd), seq 2819674392, ack 1801898393, win 65483, options [mss 65495,sackOK,TS val 1318035509 ecr 1318035509,nop,wscale 7], length 0
2022-02-28 11:41:31.286413 IP (tos 0x0, ttl 64, id 31833, offset 0, flags [DF], proto TCP (6), length 52)
    127.0.0.1.56098 > 127.0.0.1.11050: Flags [.], cksum 0xfe28 (incorrect -> 0xe4b9), seq 1, ack 1, win 512, options [nop,nop,TS val 1318035509 ecr 1318035509], length 0
2022-02-28 11:41:31.286512 IP (tos 0x0, ttl 64, id 31834, offset 0, flags [DF], proto TCP (6), length 55)
    127.0.0.1.56098 > 127.0.0.1.11050: Flags [P.], cksum 0xfe2b (incorrect -> 0xdfac), seq 1:4, ack 1, win 512, options [nop,nop,TS val 1318035510 ecr 1318035509], length 3
2022-02-28 11:41:31.286520 IP (tos 0x0, ttl 64, id 23753, offset 0, flags [DF], proto TCP (6), length 52)
    127.0.0.1.11050 > 127.0.0.1.56098: Flags [.], cksum 0xfe28 (incorrect -> 0xe4b4), seq 1, ack 4, win 512, options [nop,nop,TS val 1318035510 ecr 1318035510], length 0
2022-02-28 11:41:31.286539 IP (tos 0x0, ttl 64, id 23754, offset 0, flags [DF], proto TCP (6), length 54)
    127.0.0.1.11050 > 127.0.0.1.56098: Flags [P.], cksum 0xfe2a (incorrect -> 0xdfaa), seq 1:3, ack 4, win 512, options [nop,nop,TS val 1318035510 ecr 1318035510], length 2
2022-02-28 11:41:31.286547 IP (tos 0x0, ttl 64, id 31835, offset 0, flags [DF], proto TCP (6), length 52)
    127.0.0.1.56098 > 127.0.0.1.11050: Flags [.], cksum 0xfe28 (incorrect -> 0xe4b2), seq 4, ack 3, win 512, options [nop,nop,TS val 1318035510 ecr 1318035510], length 0
2022-02-28 11:41:31.287675 IP (tos 0x0, ttl 64, id 31836, offset 0, flags [DF], proto TCP (6), length 62)
    127.0.0.1.56098 > 127.0.0.1.11050: Flags [P.], cksum 0xfe32 (incorrect -> 0xc567), seq 4:14, ack 3, win 512, options [nop,nop,TS val 1318035511 ecr 1318035510], length 10
2022-02-28 11:41:31.287695 IP (tos 0x0, ttl 64, id 23755, offset 0, flags [DF], proto TCP (6), length 52)
    127.0.0.1.11050 > 127.0.0.1.56098: Flags [.], cksum 0xfe28 (incorrect -> 0xe4a6), seq 3, ack 14, win 512, options [nop,nop,TS val 1318035511 ecr 1318035511], length 0
2022-02-28 11:41:31.353473 IP (tos 0x0, ttl 64, id 23756, offset 0, flags [DF], proto TCP (6), length 62)
    127.0.0.1.11050 > 127.0.0.1.56098: Flags [P.], cksum 0xfe32 (incorrect -> 0xdf51), seq 3:13, ack 14, win 512, options [nop,nop,TS val 1318035577 ecr 1318035511], length 10
2022-02-28 11:41:31.353483 IP (tos 0x0, ttl 64, id 31837, offset 0, flags [DF], proto TCP (6), length 52)
    127.0.0.1.56098 > 127.0.0.1.11050: Flags [.], cksum 0xfe28 (incorrect -> 0xe418), seq 14, ack 13, win 512, options [nop,nop,TS val 1318035577 ecr 1318035577], length 0
2022-02-28 11:41:31.360313 IP (tos 0x0, ttl 64, id 31838, offset 0, flags [DF], proto TCP (6), length 569)
    127.0.0.1.56098 > 127.0.0.1.11050: Flags [P.], cksum 0x002e (incorrect -> 0x4f65), seq 14:531, ack 13, win 512, options [nop,nop,TS val 1318035583 ecr 1318035577], length 517
2022-02-28 11:41:31.360324 IP (tos 0x0, ttl 64, id 23757, offset 0, flags [DF], proto TCP (6), length 52)
    127.0.0.1.11050 > 127.0.0.1.56098: Flags [.], cksum 0xfe28 (incorrect -> 0xe20b), seq 13, ack 531, win 508, options [nop,nop,TS val 1318035583 ecr 1318035583], length 0
2022-02-28 11:41:31.420646 IP (tos 0x0, ttl 64, id 23758, offset 0, flags [DF], proto TCP (6), length 3538)
    127.0.0.1.11050 > 127.0.0.1.56098: Flags [P.], cksum 0x0bc7 (incorrect -> 0x7383), seq 13:3499, ack 531, win 512, options [nop,nop,TS val 1318035644 ecr 1318035583], length 3486
2022-02-28 11:41:31.420655 IP (tos 0x0, ttl 64, id 31839, offset 0, flags [DF], proto TCP (6), length 52)
    127.0.0.1.56098 > 127.0.0.1.11050: Flags [.], cksum 0xfe28 (incorrect -> 0xd401), seq 531, ack 3499, win 494, options [nop,nop,TS val 1318035644 ecr 1318035644], length 0
2022-02-28 11:41:31.444002 IP (tos 0x0, ttl 64, id 23759, offset 0, flags [DF], proto TCP (6), length 1217)
    127.0.0.1.11050 > 127.0.0.1.56098: Flags [P.], cksum 0x02b6 (incorrect -> 0x6d32), seq 3499:4664, ack 531, win 512, options [nop,nop,TS val 1318035667 ecr 1318035644], length 1165
2022-02-28 11:41:31.444010 IP (tos 0x0, ttl 64, id 31840, offset 0, flags [DF], proto TCP (6), length 52)
    127.0.0.1.56098 > 127.0.0.1.11050: Flags [.], cksum 0xfe28 (incorrect -> 0xcf3d), seq 531, ack 4664, win 503, options [nop,nop,TS val 1318035667 ecr 1318035667], length 0
2022-02-28 11:41:31.444427 IP (tos 0x0, ttl 64, id 31841, offset 0, flags [DF], proto TCP (6), length 132)
    127.0.0.1.56098 > 127.0.0.1.11050: Flags [P.], cksum 0xfe78 (incorrect -> 0xf932), seq 531:611, ack 4664, win 503, options [nop,nop,TS val 1318035667 ecr 1318035667], length 80
2022-02-28 11:41:31.444437 IP (tos 0x0, ttl 64, id 23760, offset 0, flags [DF], proto TCP (6), length 52)
    127.0.0.1.11050 > 127.0.0.1.56098: Flags [.], cksum 0xfe28 (incorrect -> 0xcee3), seq 4664, ack 611, win 512, options [nop,nop,TS val 1318035668 ecr 1318035667], length 0
2022-02-28 11:41:31.444904 IP (tos 0x0, ttl 64, id 31842, offset 0, flags [DF], proto TCP (6), length 370)
    127.0.0.1.56098 > 127.0.0.1.11050: Flags [P.], cksum 0xff66 (incorrect -> 0x7db2), seq 611:929, ack 4664, win 503, options [nop,nop,TS val 1318035668 ecr 1318035668], length 318
2022-02-28 11:41:31.444914 IP (tos 0x0, ttl 64, id 23761, offset 0, flags [DF], proto TCP (6), length 52)
    127.0.0.1.11050 > 127.0.0.1.56098: Flags [.], cksum 0xfe28 (incorrect -> 0xcda6), seq 4664, ack 929, win 510, options [nop,nop,TS val 1318035668 ecr 1318035668], length 0
200, 5.790868043899536, 1.439573049545288