2022-02-28 05:42:36.307894 IP (tos 0x0, ttl 64, id 25843, offset 0, flags [DF], proto TCP (6), length 60)
    127.0.0.1.36802 > 127.0.0.1.9450: Flags [S], cksum 0xfe30 (incorrect -> 0x44fc), seq 3988460579, win 65495, options [mss 65495,sackOK,TS val 1296500531 ecr 0,nop,wscale 7], length 0
2022-02-28 05:42:36.307911 IP (tos 0x0, ttl 64, id 0, offset 0, flags [DF], proto TCP (6), length 60)
    127.0.0.1.9450 > 127.0.0.1.36802: Flags [S.], cksum 0xfe30 (incorrect -> 0x401f), seq 3769683884, ack 3988460580, win 65483, options [mss 65495,sackOK,TS val 1296500531 ecr 1296500531,nop,wscale 7], length 0
2022-02-28 05:42:36.307924 IP (tos 0x0, ttl 64, id 25844, offset 0, flags [DF], proto TCP (6), length 52)
    127.0.0.1.36802 > 127.0.0.1.9450: Flags [.], cksum 0xfe28 (incorrect -> 0x66db), seq 1, ack 1, win 512, options [nop,nop,TS val 1296500531 ecr 1296500531], length 0
2022-02-28 05:42:36.308048 IP (tos 0x0, ttl 64, id 25845, offset 0, flags [DF], proto TCP (6), length 55)
    127.0.0.1.36802 > 127.0.0.1.9450: Flags [P.], cksum 0xfe2b (incorrect -> 0x61cf), seq 1:4, ack 1, win 512, options [nop,nop,TS val 1296500531 ecr 1296500531], length 3
2022-02-28 05:42:36.308062 IP (tos 0x0, ttl 64, id 41947, offset 0, flags [DF], proto TCP (6), length 52)
    127.0.0.1.9450 > 127.0.0.1.36802: Flags [.], cksum 0xfe28 (incorrect -> 0x66d8), seq 1, ack 4, win 512, options [nop,nop,TS val 1296500531 ecr 1296500531], length 0
2022-02-28 05:42:36.308100 IP (tos 0x0, ttl 64, id 41948, offset 0, flags [DF], proto TCP (6), length 54)
    127.0.0.1.9450 > 127.0.0.1.36802: Flags [P.], cksum 0xfe2a (incorrect -> 0x61ce), seq 1:3, ack 4, win 512, options [nop,nop,TS val 1296500531 ecr 1296500531], length 2
2022-02-28 05:42:36.308114 IP (tos 0x0, ttl 64, id 25846, offset 0, flags [DF], proto TCP (6), length 52)
    127.0.0.1.36802 > 127.0.0.1.9450: Flags [.], cksum 0xfe28 (incorrect -> 0x66d6), seq 4, ack 3, win 512, options [nop,nop,TS val 1296500531 ecr 1296500531], length 0
2022-02-28 05:42:36.320291 IP (tos 0x0, ttl 64, id 25847, offset 0, flags [DF], proto TCP (6), length 62)
    127.0.0.1.36802 > 127.0.0.1.9450: Flags [P.], cksum 0xfe32 (incorrect -> 0x87d3), seq 4:14, ack 3, win 512, options [nop,nop,TS val 1296500543 ecr 1296500531], length 10
2022-02-28 05:42:36.320312 IP (tos 0x0, ttl 64, id 41949, offset 0, flags [DF], proto TCP (6), length 52)
    127.0.0.1.9450 > 127.0.0.1.36802: Flags [.], cksum 0xfe28 (incorrect -> 0x66b4), seq 3, ack 14, win 512, options [nop,nop,TS val 1296500543 ecr 1296500543], length 0
2022-02-28 05:42:36.409871 IP (tos 0x0, ttl 64, id 41950, offset 0, flags [DF], proto TCP (6), length 62)
    127.0.0.1.9450 > 127.0.0.1.36802: Flags [P.], cksum 0xfe32 (incorrect -> 0x6147), seq 3:13, ack 14, win 512, options [nop,nop,TS val 1296500633 ecr 1296500543], length 10
2022-02-28 05:42:36.409882 IP (tos 0x0, ttl 64, id 25848, offset 0, flags [DF], proto TCP (6), length 52)
    127.0.0.1.36802 > 127.0.0.1.9450: Flags [.], cksum 0xfe28 (incorrect -> 0x65f6), seq 14, ack 13, win 512, options [nop,nop,TS val 1296500633 ecr 1296500633], length 0
2022-02-28 05:42:36.417440 IP (tos 0x0, ttl 64, id 25849, offset 0, flags [DF], proto TCP (6), length 569)
    127.0.0.1.36802 > 127.0.0.1.9450: Flags [P.], cksum 0x002e (incorrect -> 0x56fc), seq 14:531, ack 13, win 512, options [nop,nop,TS val 1296500640 ecr 1296500633], length 517
2022-02-28 05:42:36.417452 IP (tos 0x0, ttl 64, id 41951, offset 0, flags [DF], proto TCP (6), length 52)
    127.0.0.1.9450 > 127.0.0.1.36802: Flags [.], cksum 0xfe28 (incorrect -> 0x63e6), seq 13, ack 531, win 508, options [nop,nop,TS val 1296500641 ecr 1296500640], length 0
200, 3.6221771240234375, 0.46592259407043457