2022-02-28 04:14:23.076305 IP (tos 0x0, ttl 64, id 28173, offset 0, flags [DF], proto TCP (6), length 60)
    127.0.0.1.44196 > 127.0.0.1.9150: Flags [S], cksum 0xfe30 (incorrect -> 0x5fd1), seq 1384005078, win 65495, options [mss 65495,sackOK,TS val 1291207299 ecr 0,nop,wscale 7], length 0
2022-02-28 04:14:23.076320 IP (tos 0x0, ttl 64, id 0, offset 0, flags [DF], proto TCP (6), length 60)
    127.0.0.1.9150 > 127.0.0.1.44196: Flags [S.], cksum 0xfe30 (incorrect -> 0x3ffc), seq 1808868485, ack 1384005079, win 65483, options [mss 65495,sackOK,TS val 1291207299 ecr 1291207299,nop,wscale 7], length 0
2022-02-28 04:14:23.076332 IP (tos 0x0, ttl 64, id 28174, offset 0, flags [DF], proto TCP (6), length 52)
    127.0.0.1.44196 > 127.0.0.1.9150: Flags [.], cksum 0xfe28 (incorrect -> 0x66b8), seq 1, ack 1, win 512, options [nop,nop,TS val 1291207299 ecr 1291207299], length 0
2022-02-28 04:14:23.076535 IP (tos 0x0, ttl 64, id 28175, offset 0, flags [DF], proto TCP (6), length 55)
    127.0.0.1.44196 > 127.0.0.1.9150: Flags [P.], cksum 0xfe2b (incorrect -> 0x61ab), seq 1:4, ack 1, win 512, options [nop,nop,TS val 1291207300 ecr 1291207299], length 3
2022-02-28 04:14:23.076545 IP (tos 0x0, ttl 64, id 16835, offset 0, flags [DF], proto TCP (6), length 52)
    127.0.0.1.9150 > 127.0.0.1.44196: Flags [.], cksum 0xfe28 (incorrect -> 0x66b3), seq 1, ack 4, win 512, options [nop,nop,TS val 1291207300 ecr 1291207300], length 0
2022-02-28 04:14:23.076578 IP (tos 0x0, ttl 64, id 16836, offset 0, flags [DF], proto TCP (6), length 54)
    127.0.0.1.9150 > 127.0.0.1.44196: Flags [P.], cksum 0xfe2a (incorrect -> 0x61a9), seq 1:3, ack 4, win 512, options [nop,nop,TS val 1291207300 ecr 1291207300], length 2
2022-02-28 04:14:23.076589 IP (tos 0x0, ttl 64, id 28176, offset 0, flags [DF], proto TCP (6), length 52)
    127.0.0.1.44196 > 127.0.0.1.9150: Flags [.], cksum 0xfe28 (incorrect -> 0x66b1), seq 4, ack 3, win 512, options [nop,nop,TS val 1291207300 ecr 1291207300], length 0
2022-02-28 04:14:23.078219 IP (tos 0x0, ttl 64, id 28177, offset 0, flags [DF], proto TCP (6), length 62)
    127.0.0.1.44196 > 127.0.0.1.9150: Flags [P.], cksum 0xfe32 (incorrect -> 0x8f93), seq 4:14, ack 3, win 512, options [nop,nop,TS val 1291207301 ecr 1291207300], length 10
2022-02-28 04:14:23.078246 IP (tos 0x0, ttl 64, id 16837, offset 0, flags [DF], proto TCP (6), length 52)
    127.0.0.1.9150 > 127.0.0.1.44196: Flags [.], cksum 0xfe28 (incorrect -> 0x66a5), seq 3, ack 14, win 512, options [nop,nop,TS val 1291207301 ecr 1291207301], length 0
200, 3.8752357959747314, 1.0336277484893799