2022-02-28 09:49:38.412790 IP (tos 0x0, ttl 64, id 51627, offset 0, flags [DF], proto TCP (6), length 60)
    127.0.0.1.38008 > 127.0.0.1.9550: Flags [S], cksum 0xfe30 (incorrect -> 0xf5af), seq 908847658, win 65495, options [mss 65495,sackOK,TS val 1311322636 ecr 0,nop,wscale 7], length 0
2022-02-28 09:49:38.412799 IP (tos 0x0, ttl 64, id 0, offset 0, flags [DF], proto TCP (6), length 60)
    127.0.0.1.9550 > 127.0.0.1.38008: Flags [S.], cksum 0xfe30 (incorrect -> 0xddd0), seq 1151554305, ack 908847659, win 65483, options [mss 65495,sackOK,TS val 1311322636 ecr 1311322636,nop,wscale 7], length 0
2022-02-28 09:49:38.412805 IP (tos 0x0, ttl 64, id 51628, offset 0, flags [DF], proto TCP (6), length 52)
    127.0.0.1.38008 > 127.0.0.1.9550: Flags [.], cksum 0xfe28 (incorrect -> 0x048d), seq 1, ack 1, win 512, options [nop,nop,TS val 1311322636 ecr 1311322636], length 0
2022-02-28 09:49:38.412904 IP (tos 0x0, ttl 64, id 51629, offset 0, flags [DF], proto TCP (6), length 55)
    127.0.0.1.38008 > 127.0.0.1.9550: Flags [P.], cksum 0xfe2b (incorrect -> 0xff80), seq 1:4, ack 1, win 512, options [nop,nop,TS val 1311322636 ecr 1311322636], length 3
2022-02-28 09:49:38.412907 IP (tos 0x0, ttl 64, id 61867, offset 0, flags [DF], proto TCP (6), length 52)
    127.0.0.1.9550 > 127.0.0.1.38008: Flags [.], cksum 0xfe28 (incorrect -> 0x048a), seq 1, ack 4, win 512, options [nop,nop,TS val 1311322636 ecr 1311322636], length 0
2022-02-28 09:49:38.412966 IP (tos 0x0, ttl 64, id 61868, offset 0, flags [DF], proto TCP (6), length 54)
    127.0.0.1.9550 > 127.0.0.1.38008: Flags [P.], cksum 0xfe2a (incorrect -> 0xff7f), seq 1:3, ack 4, win 512, options [nop,nop,TS val 1311322636 ecr 1311322636], length 2
2022-02-28 09:49:38.412986 IP (tos 0x0, ttl 64, id 51630, offset 0, flags [DF], proto TCP (6), length 52)
    127.0.0.1.38008 > 127.0.0.1.9550: Flags [.], cksum 0xfe28 (incorrect -> 0x0488), seq 4, ack 3, win 512, options [nop,nop,TS val 1311322636 ecr 1311322636], length 0
2022-02-28 09:49:38.425129 IP (tos 0x0, ttl 64, id 51631, offset 0, flags [DF], proto TCP (6), length 62)
    127.0.0.1.38008 > 127.0.0.1.9550: Flags [P.], cksum 0xfe32 (incorrect -> 0xf65d), seq 4:14, ack 3, win 512, options [nop,nop,TS val 1311322648 ecr 1311322636], length 10
2022-02-28 09:49:38.425144 IP (tos 0x0, ttl 64, id 61869, offset 0, flags [DF], proto TCP (6), length 52)
    127.0.0.1.9550 > 127.0.0.1.38008: Flags [.], cksum 0xfe28 (incorrect -> 0x0466), seq 3, ack 14, win 512, options [nop,nop,TS val 1311322648 ecr 1311322648], length 0
2022-02-28 09:49:46.370761 IP (tos 0x0, ttl 64, id 61870, offset 0, flags [DF], proto TCP (6), length 62)
    127.0.0.1.9550 > 127.0.0.1.38008: Flags [P.], cksum 0xfe32 (incorrect -> 0xe048), seq 3:13, ack 14, win 512, options [nop,nop,TS val 1311330594 ecr 1311322648], length 10
2022-02-28 09:49:46.370770 IP (tos 0x0, ttl 64, id 51632, offset 0, flags [DF], proto TCP (6), length 52)
    127.0.0.1.38008 > 127.0.0.1.9550: Flags [.], cksum 0xfe28 (incorrect -> 0xc647), seq 14, ack 13, win 512, options [nop,nop,TS val 1311330594 ecr 1311330594], length 0
2022-02-28 09:49:46.376664 IP (tos 0x0, ttl 64, id 51633, offset 0, flags [DF], proto TCP (6), length 569)
    127.0.0.1.38008 > 127.0.0.1.9550: Flags [P.], cksum 0x002e (incorrect -> 0xd963), seq 14:531, ack 13, win 512, options [nop,nop,TS val 1311330600 ecr 1311330594], length 517
2022-02-28 09:49:46.376678 IP (tos 0x0, ttl 64, id 61871, offset 0, flags [DF], proto TCP (6), length 52)
    127.0.0.1.9550 > 127.0.0.1.38008: Flags [.], cksum 0xfe28 (incorrect -> 0xc43a), seq 13, ack 531, win 508, options [nop,nop,TS val 1311330600 ecr 1311330600], length 0
2022-02-28 09:49:46.719949 IP (tos 0x0, ttl 64, id 61872, offset 0, flags [DF], proto TCP (6), length 3538)
    127.0.0.1.9550 > 127.0.0.1.38008: Flags [P.], cksum 0x0bc7 (incorrect -> 0x8cf6), seq 13:3499, ack 531, win 512, options [nop,nop,TS val 1311330943 ecr 1311330600], length 3486
2022-02-28 09:49:46.719964 IP (tos 0x0, ttl 64, id 51634, offset 0, flags [DF], proto TCP (6), length 52)
    127.0.0.1.38008 > 127.0.0.1.9550: Flags [.], cksum 0xfe28 (incorrect -> 0xb3fc), seq 531, ack 3499, win 494, options [nop,nop,TS val 1311330943 ecr 1311330943], length 0
200, 132.44606828689575, 8.813842535018921