2022-02-28 03:17:45.314212 IP (tos 0x0, ttl 64, id 36143, offset 0, flags [DF], proto TCP (6), length 60)
    127.0.0.1.48812 > 127.0.0.1.11850: Flags [S], cksum 0xfe30 (incorrect -> 0x0741), seq 4179930081, win 65495, options [mss 65495,sackOK,TS val 1287809537 ecr 0,nop,wscale 7], length 0
2022-02-28 03:17:45.314225 IP (tos 0x0, ttl 64, id 0, offset 0, flags [DF], proto TCP (6), length 60)
    127.0.0.1.11850 > 127.0.0.1.48812: Flags [S.], cksum 0xfe30 (incorrect -> 0x6137), seq 2169859563, ack 4179930082, win 65483, options [mss 65495,sackOK,TS val 1287809537 ecr 1287809537,nop,wscale 7], length 0
2022-02-28 03:17:45.314234 IP (tos 0x0, ttl 64, id 36144, offset 0, flags [DF], proto TCP (6), length 52)
    127.0.0.1.48812 > 127.0.0.1.11850: Flags [.], cksum 0xfe28 (incorrect -> 0x87f3), seq 1, ack 1, win 512, options [nop,nop,TS val 1287809537 ecr 1287809537], length 0
2022-02-28 03:17:45.314358 IP (tos 0x0, ttl 64, id 36145, offset 0, flags [DF], proto TCP (6), length 55)
    127.0.0.1.48812 > 127.0.0.1.11850: Flags [P.], cksum 0xfe2b (incorrect -> 0x82e7), seq 1:4, ack 1, win 512, options [nop,nop,TS val 1287809537 ecr 1287809537], length 3
2022-02-28 03:17:45.314361 IP (tos 0x0, ttl 64, id 44072, offset 0, flags [DF], proto TCP (6), length 52)
    127.0.0.1.11850 > 127.0.0.1.48812: Flags [.], cksum 0xfe28 (incorrect -> 0x87f0), seq 1, ack 4, win 512, options [nop,nop,TS val 1287809537 ecr 1287809537], length 0
2022-02-28 03:17:45.314448 IP (tos 0x0, ttl 64, id 44073, offset 0, flags [DF], proto TCP (6), length 54)
    127.0.0.1.11850 > 127.0.0.1.48812: Flags [P.], cksum 0xfe2a (incorrect -> 0x82e5), seq 1:3, ack 4, win 512, options [nop,nop,TS val 1287809538 ecr 1287809537], length 2
2022-02-28 03:17:45.314452 IP (tos 0x0, ttl 64, id 36146, offset 0, flags [DF], proto TCP (6), length 52)
    127.0.0.1.48812 > 127.0.0.1.11850: Flags [.], cksum 0xfe28 (incorrect -> 0x87ec), seq 4, ack 3, win 512, options [nop,nop,TS val 1287809538 ecr 1287809538], length 0
2022-02-28 03:17:45.316344 IP (tos 0x0, ttl 64, id 36147, offset 0, flags [DF], proto TCP (6), length 62)
    127.0.0.1.48812 > 127.0.0.1.11850: Flags [P.], cksum 0xfe32 (incorrect -> 0x3a4e), seq 4:14, ack 3, win 512, options [nop,nop,TS val 1287809539 ecr 1287809538], length 10
2022-02-28 03:17:45.316352 IP (tos 0x0, ttl 64, id 44074, offset 0, flags [DF], proto TCP (6), length 52)
    127.0.0.1.11850 > 127.0.0.1.48812: Flags [.], cksum 0xfe28 (incorrect -> 0x87e0), seq 3, ack 14, win 512, options [nop,nop,TS val 1287809539 ecr 1287809539], length 0
2022-02-28 03:17:45.473700 IP (tos 0x0, ttl 64, id 44075, offset 0, flags [DF], proto TCP (6), length 62)
    127.0.0.1.11850 > 127.0.0.1.48812: Flags [P.], cksum 0xfe32 (incorrect -> 0x822f), seq 3:13, ack 14, win 512, options [nop,nop,TS val 1287809697 ecr 1287809539], length 10
2022-02-28 03:17:45.473706 IP (tos 0x0, ttl 64, id 36148, offset 0, flags [DF], proto TCP (6), length 52)
    127.0.0.1.48812 > 127.0.0.1.11850: Flags [.], cksum 0xfe28 (incorrect -> 0x869a), seq 14, ack 13, win 512, options [nop,nop,TS val 1287809697 ecr 1287809697], length 0
2022-02-28 03:17:45.480468 IP (tos 0x0, ttl 64, id 36149, offset 0, flags [DF], proto TCP (6), length 569)
    127.0.0.1.48812 > 127.0.0.1.11850: Flags [P.], cksum 0x002e (incorrect -> 0x717d), seq 14:531, ack 13, win 512, options [nop,nop,TS val 1287809704 ecr 1287809697], length 517
2022-02-28 03:17:45.480477 IP (tos 0x0, ttl 64, id 44076, offset 0, flags [DF], proto TCP (6), length 52)
    127.0.0.1.11850 > 127.0.0.1.48812: Flags [.], cksum 0xfe28 (incorrect -> 0x848b), seq 13, ack 531, win 508, options [nop,nop,TS val 1287809704 ecr 1287809704], length 0
2022-02-28 03:17:45.641173 IP (tos 0x0, ttl 64, id 44077, offset 0, flags [DF], proto TCP (6), length 3340)
    127.0.0.1.11850 > 127.0.0.1.48812: Flags [P.], cksum 0x0b01 (incorrect -> 0x241d), seq 13:3301, ack 531, win 512, options [nop,nop,TS val 1287809864 ecr 1287809704], length 3288
2022-02-28 03:17:45.641179 IP (tos 0x0, ttl 64, id 36150, offset 0, flags [DF], proto TCP (6), length 52)
    127.0.0.1.48812 > 127.0.0.1.11850: Flags [.], cksum 0xfe28 (incorrect -> 0x7680), seq 531, ack 3301, win 495, options [nop,nop,TS val 1287809864 ecr 1287809864], length 0
2022-02-28 03:17:45.641676 IP (tos 0x0, ttl 64, id 36151, offset 0, flags [DF], proto TCP (6), length 145)
    127.0.0.1.48812 > 127.0.0.1.11850: Flags [P.], cksum 0xfe85 (incorrect -> 0xe857), seq 531:624, ack 3301, win 512, options [nop,nop,TS val 1287809865 ecr 1287809864], length 93
2022-02-28 03:17:45.641683 IP (tos 0x0, ttl 64, id 44078, offset 0, flags [DF], proto TCP (6), length 52)
    127.0.0.1.11850 > 127.0.0.1.48812: Flags [.], cksum 0xfe28 (incorrect -> 0x7610), seq 3301, ack 624, win 512, options [nop,nop,TS val 1287809865 ecr 1287809865], length 0
2022-02-28 03:17:45.801477 IP (tos 0x0, ttl 64, id 44079, offset 0, flags [DF], proto TCP (6), length 103)
    127.0.0.1.11850 > 127.0.0.1.48812: Flags [P.], cksum 0xfe5b (incorrect -> 0x8919), seq 3301:3352, ack 624, win 512, options [nop,nop,TS val 1287810025 ecr 1287809865], length 51
2022-02-28 03:17:45.801487 IP (tos 0x0, ttl 64, id 36152, offset 0, flags [DF], proto TCP (6), length 52)
    127.0.0.1.48812 > 127.0.0.1.11850: Flags [.], cksum 0xfe28 (incorrect -> 0x749d), seq 624, ack 3352, win 512, options [nop,nop,TS val 1287810025 ecr 1287810025], length 0
2022-02-28 03:17:45.802180 IP (tos 0x0, ttl 64, id 36153, offset 0, flags [DF], proto TCP (6), length 371)
    127.0.0.1.48812 > 127.0.0.1.11850: Flags [P.], cksum 0xff67 (incorrect -> 0xa85a), seq 624:943, ack 3352, win 512, options [nop,nop,TS val 1287810025 ecr 1287810025], length 319
2022-02-28 03:17:45.802186 IP (tos 0x0, ttl 64, id 44080, offset 0, flags [DF], proto TCP (6), length 52)
    127.0.0.1.11850 > 127.0.0.1.48812: Flags [.], cksum 0xfe28 (incorrect -> 0x7360), seq 3352, ack 943, win 510, options [nop,nop,TS val 1287810025 ecr 1287810025], length 0
2022-02-28 03:17:46.001210 IP (tos 0x0, ttl 64, id 44081, offset 0, flags [DF], proto TCP (6), length 3538)
    127.0.0.1.11850 > 127.0.0.1.48812: Flags [P.], cksum 0x0bc7 (incorrect -> 0xfb3e), seq 3352:6838, ack 943, win 512, options [nop,nop,TS val 1287810224 ecr 1287810025], length 3486
2022-02-28 03:17:46.042146 IP (tos 0x0, ttl 64, id 36154, offset 0, flags [DF], proto TCP (6), length 52)
    127.0.0.1.48812 > 127.0.0.1.11850: Flags [.], cksum 0xfe28 (incorrect -> 0x6409), seq 943, ack 6838, win 512, options [nop,nop,TS val 1287810265 ecr 1287810224], length 0
2022-02-28 03:17:46.042154 IP (tos 0x0, ttl 64, id 44082, offset 0, flags [DF], proto TCP (6), length 14086)
    127.0.0.1.11850 > 127.0.0.1.48812: Flags [P.], cksum 0x34fb (incorrect -> 0xdbaa), seq 6838:20872, ack 943, win 512, options [nop,nop,TS val 1287810265 ecr 1287810265], length 14034
2022-02-28 03:17:46.042159 IP (tos 0x0, ttl 64, id 36155, offset 0, flags [DF], proto TCP (6), length 52)
    127.0.0.1.48812 > 127.0.0.1.11850: Flags [.], cksum 0xfe28 (incorrect -> 0x2d49), seq 943, ack 20872, win 453, options [nop,nop,TS val 1287810265 ecr 1287810265], length 0
2022-02-28 03:17:46.110065 IP (tos 0x0, ttl 64, id 44083, offset 0, flags [DF], proto TCP (6), length 3538)
    127.0.0.1.11850 > 127.0.0.1.48812: Flags [P.], cksum 0x0bc7 (incorrect -> 0x31f5), seq 20872:24358, ack 943, win 512, options [nop,nop,TS val 1287810333 ecr 1287810265], length 3486
2022-02-28 03:17:46.110071 IP (tos 0x0, ttl 64, id 36156, offset 0, flags [DF], proto TCP (6), length 52)
    127.0.0.1.48812 > 127.0.0.1.11850: Flags [.], cksum 0xfe28 (incorrect -> 0x1efa), seq 943, ack 24358, win 494, options [nop,nop,TS val 1287810333 ecr 1287810333], length 0
2022-02-28 03:17:46.110122 IP (tos 0x0, ttl 64, id 44084, offset 0, flags [DF], proto TCP (6), length 3040)
    127.0.0.1.11850 > 127.0.0.1.48812: Flags [P.], cksum 0x09d5 (incorrect -> 0xb6f9), seq 24358:27346, ack 943, win 512, options [nop,nop,TS val 1287810333 ecr 1287810333], length 2988
2022-02-28 03:17:46.110144 IP (tos 0x0, ttl 64, id 36157, offset 0, flags [DF], proto TCP (6), length 52)
    127.0.0.1.48812 > 127.0.0.1.11850: Flags [.], cksum 0xfe28 (incorrect -> 0x135a), seq 943, ack 27346, win 482, options [nop,nop,TS val 1287810333 ecr 1287810333], length 0
2022-02-28 03:17:46.110237 IP (tos 0x0, ttl 64, id 44085, offset 0, flags [DF], proto TCP (6), length 4100)
    127.0.0.1.11850 > 127.0.0.1.48812: Flags [P.], cksum 0x0df9 (incorrect -> 0xd1de), seq 27346:31394, ack 943, win 512, options [nop,nop,TS val 1287810333 ecr 1287810333], length 4048
2022-02-28 03:17:46.110248 IP (tos 0x0, ttl 64, id 36158, offset 0, flags [DF], proto TCP (6), length 52)
    127.0.0.1.48812 > 127.0.0.1.11850: Flags [.], cksum 0xfe28 (incorrect -> 0x0380), seq 943, ack 31394, win 492, options [nop,nop,TS val 1287810333 ecr 1287810333], length 0
2022-02-28 03:17:46.110253 IP (tos 0x0, ttl 64, id 44086, offset 0, flags [DF], proto TCP (6), length 3236)
    127.0.0.1.11850 > 127.0.0.1.48812: Flags [P.], cksum 0x0a99 (incorrect -> 0x840a), seq 31394:34578, ack 943, win 512, options [nop,nop,TS val 1287810333 ecr 1287810333], length 3184
2022-02-28 03:17:46.110255 IP (tos 0x0, ttl 64, id 36159, offset 0, flags [DF], proto TCP (6), length 52)
    127.0.0.1.48812 > 127.0.0.1.11850: Flags [.], cksum 0xfe28 (incorrect -> 0xf71c), seq 943, ack 34578, win 479, options [nop,nop,TS val 1287810333 ecr 1287810333], length 0
2022-02-28 03:17:46.111829 IP (tos 0x0, ttl 64, id 44087, offset 0, flags [DF], proto TCP (6), length 2542)
    127.0.0.1.11850 > 127.0.0.1.48812: Flags [P.], cksum 0x07e3 (incorrect -> 0xa714), seq 34578:37068, ack 943, win 512, options [nop,nop,TS val 1287810335 ecr 1287810333], length 2490
2022-02-28 03:17:46.111833 IP (tos 0x0, ttl 64, id 36160, offset 0, flags [DF], proto TCP (6), length 52)
    127.0.0.1.48812 > 127.0.0.1.11850: Flags [.], cksum 0xfe28 (incorrect -> 0xed4b), seq 943, ack 37068, win 498, options [nop,nop,TS val 1287810335 ecr 1287810335], length 0
2022-02-28 03:17:46.115375 IP (tos 0x0, ttl 64, id 44088, offset 0, flags [DF], proto TCP (6), length 4100)
    127.0.0.1.11850 > 127.0.0.1.48812: Flags [P.], cksum 0x0df9 (incorrect -> 0x074c), seq 37068:41116, ack 943, win 512, options [nop,nop,TS val 1287810338 ecr 1287810335], length 4048
2022-02-28 03:17:46.115380 IP (tos 0x0, ttl 64, id 36161, offset 0, flags [DF], proto TCP (6), length 52)
    127.0.0.1.48812 > 127.0.0.1.11850: Flags [.], cksum 0xfe28 (incorrect -> 0xdd7b), seq 943, ack 41116, win 492, options [nop,nop,TS val 1287810338 ecr 1287810338], length 0
2022-02-28 03:17:46.115385 IP (tos 0x0, ttl 64, id 44089, offset 0, flags [DF], proto TCP (6), length 486)
    127.0.0.1.11850 > 127.0.0.1.48812: Flags [P.], cksum 0xffda (incorrect -> 0xede2), seq 41116:41550, ack 943, win 512, options [nop,nop,TS val 1287810338 ecr 1287810338], length 434
2022-02-28 03:17:46.115409 IP (tos 0x0, ttl 64, id 36162, offset 0, flags [DF], proto TCP (6), length 52)
    127.0.0.1.48812 > 127.0.0.1.11850: Flags [.], cksum 0xfe28 (incorrect -> 0xdbb5), seq 943, ack 41550, win 512, options [nop,nop,TS val 1287810338 ecr 1287810338], length 0
2022-02-28 03:17:46.121627 IP (tos 0x0, ttl 64, id 44090, offset 0, flags [DF], proto TCP (6), length 3232)
    127.0.0.1.11850 > 127.0.0.1.48812: Flags [P.], cksum 0x0a95 (incorrect -> 0x7d5a), seq 41550:44730, ack 943, win 512, options [nop,nop,TS val 1287810345 ecr 1287810338], length 3180
2022-02-28 03:17:46.121652 IP (tos 0x0, ttl 64, id 36163, offset 0, flags [DF], proto TCP (6), length 52)
    127.0.0.1.48812 > 127.0.0.1.11850: Flags [.], cksum 0xfe28 (incorrect -> 0xcf3b), seq 943, ack 44730, win 512, options [nop,nop,TS val 1287810345 ecr 1287810345], length 0
2022-02-28 03:17:46.125780 IP (tos 0x0, ttl 64, id 44091, offset 0, flags [DF], proto TCP (6), length 4100)
    127.0.0.1.11850 > 127.0.0.1.48812: Flags [P.], cksum 0x0df9 (incorrect -> 0xb0cb), seq 44730:48778, ack 943, win 512, options [nop,nop,TS val 1287810349 ecr 1287810345], length 4048
2022-02-28 03:17:46.125834 IP (tos 0x0, ttl 64, id 36164, offset 0, flags [DF], proto TCP (6), length 52)
    127.0.0.1.48812 > 127.0.0.1.11850: Flags [.], cksum 0xfe28 (incorrect -> 0xbf63), seq 943, ack 48778, win 512, options [nop,nop,TS val 1287810349 ecr 1287810349], length 0
2022-02-28 03:17:46.125838 IP (tos 0x0, ttl 64, id 44092, offset 0, flags [DF], proto TCP (6), length 7186)
    127.0.0.1.11850 > 127.0.0.1.48812: Flags [P.], cksum 0x1a07 (incorrect -> 0x8637), seq 48778:55912, ack 943, win 512, options [nop,nop,TS val 1287810349 ecr 1287810349], length 7134
2022-02-28 03:17:46.125897 IP (tos 0x0, ttl 64, id 36165, offset 0, flags [DF], proto TCP (6), length 52)
    127.0.0.1.48812 > 127.0.0.1.11850: Flags [.], cksum 0xfe28 (incorrect -> 0xa385), seq 943, ack 55912, win 512, options [nop,nop,TS val 1287810349 ecr 1287810349], length 0
2022-02-28 03:17:46.219591 IP (tos 0x0, ttl 64, id 44093, offset 0, flags [DF], proto TCP (6), length 4100)
    127.0.0.1.11850 > 127.0.0.1.48812: Flags [P.], cksum 0x0df9 (incorrect -> 0x081a), seq 55912:59960, ack 943, win 512, options [nop,nop,TS val 1287810443 ecr 1287810349], length 4048
2022-02-28 03:17:46.219620 IP (tos 0x0, ttl 64, id 36166, offset 0, flags [DF], proto TCP (6), length 52)
    127.0.0.1.48812 > 127.0.0.1.11850: Flags [.], cksum 0xfe28 (incorrect -> 0x92f9), seq 943, ack 59960, win 512, options [nop,nop,TS val 1287810443 ecr 1287810443], length 0
2022-02-28 03:17:46.219624 IP (tos 0x0, ttl 64, id 44094, offset 0, flags [DF], proto TCP (6), length 3474)
    127.0.0.1.11850 > 127.0.0.1.48812: Flags [P.], cksum 0x0b87 (incorrect -> 0xb4bd), seq 59960:63382, ack 943, win 512, options [nop,nop,TS val 1287810443 ecr 1287810443], length 3422
2022-02-28 03:17:46.219627 IP (tos 0x0, ttl 64, id 36167, offset 0, flags [DF], proto TCP (6), length 52)
    127.0.0.1.48812 > 127.0.0.1.11850: Flags [.], cksum 0xfe28 (incorrect -> 0x859b), seq 943, ack 63382, win 512, options [nop,nop,TS val 1287810443 ecr 1287810443], length 0
2022-02-28 03:17:46.222964 IP (tos 0x0, ttl 64, id 44095, offset 0, flags [DF], proto TCP (6), length 4036)
    127.0.0.1.11850 > 127.0.0.1.48812: Flags [P.], cksum 0x0db9 (incorrect -> 0xda89), seq 63382:67366, ack 943, win 512, options [nop,nop,TS val 1287810446 ecr 1287810443], length 3984
2022-02-28 03:17:46.223019 IP (tos 0x0, ttl 64, id 36168, offset 0, flags [DF], proto TCP (6), length 52)
    127.0.0.1.48812 > 127.0.0.1.11850: Flags [.], cksum 0xfe28 (incorrect -> 0x7605), seq 943, ack 67366, win 512, options [nop,nop,TS val 1287810446 ecr 1287810446], length 0
2022-02-28 03:17:46.223023 IP (tos 0x0, ttl 64, id 44096, offset 0, flags [DF], proto TCP (6), length 3538)
    127.0.0.1.11850 > 127.0.0.1.48812: Flags [P.], cksum 0x0bc7 (incorrect -> 0x76a3), seq 67366:70852, ack 943, win 512, options [nop,nop,TS val 1287810446 ecr 1287810446], length 3486
2022-02-28 03:17:46.223173 IP (tos 0x0, ttl 64, id 36169, offset 0, flags [DF], proto TCP (6), length 52)
    127.0.0.1.48812 > 127.0.0.1.11850: Flags [.], cksum 0xfe28 (incorrect -> 0x6867), seq 943, ack 70852, win 512, options [nop,nop,TS val 1287810446 ecr 1287810446], length 0
2022-02-28 03:17:46.223258 IP (tos 0x0, ttl 64, id 44097, offset 0, flags [DF], proto TCP (6), length 4100)
    127.0.0.1.11850 > 127.0.0.1.48812: Flags [P.], cksum 0x0df9 (incorrect -> 0xef0e), seq 70852:74900, ack 943, win 512, options [nop,nop,TS val 1287810446 ecr 1287810446], length 4048
2022-02-28 03:17:46.223288 IP (tos 0x0, ttl 64, id 36170, offset 0, flags [DF], proto TCP (6), length 52)
    127.0.0.1.48812 > 127.0.0.1.11850: Flags [.], cksum 0xfe28 (incorrect -> 0x5897), seq 943, ack 74900, win 512, options [nop,nop,TS val 1287810446 ecr 1287810446], length 0
2022-02-28 03:17:46.223291 IP (tos 0x0, ttl 64, id 44098, offset 0, flags [DF], proto TCP (6), length 3972)
    127.0.0.1.11850 > 127.0.0.1.48812: Flags [P.], cksum 0x0d79 (incorrect -> 0xa996), seq 74900:78820, ack 943, win 512, options [nop,nop,TS val 1287810446 ecr 1287810446], length 3920
2022-02-28 03:17:46.223295 IP (tos 0x0, ttl 64, id 36171, offset 0, flags [DF], proto TCP (6), length 52)
    127.0.0.1.48812 > 127.0.0.1.11850: Flags [.], cksum 0xfe28 (incorrect -> 0x4947), seq 943, ack 78820, win 512, options [nop,nop,TS val 1287810446 ecr 1287810446], length 0
2022-02-28 03:17:46.223783 IP (tos 0x0, ttl 64, id 44099, offset 0, flags [DF], proto TCP (6), length 4100)
    127.0.0.1.11850 > 127.0.0.1.48812: Flags [P.], cksum 0x0df9 (incorrect -> 0x849d), seq 78820:82868, ack 943, win 512, options [nop,nop,TS val 1287810447 ecr 1287810446], length 4048
2022-02-28 03:17:46.223866 IP (tos 0x0, ttl 64, id 36172, offset 0, flags [DF], proto TCP (6), length 52)
    127.0.0.1.48812 > 127.0.0.1.11850: Flags [.], cksum 0xfe28 (incorrect -> 0x3975), seq 943, ack 82868, win 512, options [nop,nop,TS val 1287810447 ecr 1287810447], length 0
2022-02-28 03:17:46.223892 IP (tos 0x0, ttl 64, id 44100, offset 0, flags [DF], proto TCP (6), length 486)
    127.0.0.1.11850 > 127.0.0.1.48812: Flags [P.], cksum 0xffda (incorrect -> 0x7401), seq 82868:83302, ack 943, win 512, options [nop,nop,TS val 1287810447 ecr 1287810447], length 434
2022-02-28 03:17:46.223902 IP (tos 0x0, ttl 64, id 36173, offset 0, flags [DF], proto TCP (6), length 52)
    127.0.0.1.48812 > 127.0.0.1.11850: Flags [.], cksum 0xfe28 (incorrect -> 0x37c3), seq 943, ack 83302, win 512, options [nop,nop,TS val 1287810447 ecr 1287810447], length 0
2022-02-28 03:17:46.224601 IP (tos 0x0, ttl 64, id 44101, offset 0, flags [DF], proto TCP (6), length 4100)
    127.0.0.1.11850 > 127.0.0.1.48812: Flags [P.], cksum 0x0df9 (incorrect -> 0x7588), seq 83302:87350, ack 943, win 512, options [nop,nop,TS val 1287810448 ecr 1287810447], length 4048
2022-02-28 03:17:46.224808 IP (tos 0x0, ttl 64, id 36174, offset 0, flags [DF], proto TCP (6), length 52)
    127.0.0.1.48812 > 127.0.0.1.11850: Flags [.], cksum 0xfe28 (incorrect -> 0x27f1), seq 943, ack 87350, win 512, options [nop,nop,TS val 1287810448 ecr 1287810448], length 0
2022-02-28 03:17:46.224814 IP (tos 0x0, ttl 64, id 44102, offset 0, flags [DF], proto TCP (6), length 10626)
    127.0.0.1.11850 > 127.0.0.1.48812: Flags [P.], cksum 0x2777 (incorrect -> 0x3900), seq 87350:97924, ack 943, win 512, options [nop,nop,TS val 1287810448 ecr 1287810448], length 10574
2022-02-28 03:17:46.224818 IP (tos 0x0, ttl 64, id 36175, offset 0, flags [DF], proto TCP (6), length 52)
    127.0.0.1.48812 > 127.0.0.1.11850: Flags [.], cksum 0xfe28 (incorrect -> 0xfea2), seq 943, ack 97924, win 512, options [nop,nop,TS val 1287810448 ecr 1287810448], length 0
2022-02-28 03:17:46.231512 IP (tos 0x0, ttl 64, id 44103, offset 0, flags [DF], proto TCP (6), length 4036)
    127.0.0.1.11850 > 127.0.0.1.48812: Flags [P.], cksum 0x0db9 (incorrect -> 0x50fb), seq 97924:101908, ack 943, win 512, options [nop,nop,TS val 1287810455 ecr 1287810448], length 3984
2022-02-28 03:17:46.231646 IP (tos 0x0, ttl 64, id 36176, offset 0, flags [DF], proto TCP (6), length 52)
    127.0.0.1.48812 > 127.0.0.1.11850: Flags [.], cksum 0xfe28 (incorrect -> 0xef04), seq 943, ack 101908, win 512, options [nop,nop,TS val 1287810455 ecr 1287810455], length 0
2022-02-28 03:17:46.235314 IP (tos 0x0, ttl 64, id 44104, offset 0, flags [DF], proto TCP (6), length 4100)
    127.0.0.1.11850 > 127.0.0.1.48812: Flags [P.], cksum 0x0df9 (incorrect -> 0xdd45), seq 101908:105956, ack 943, win 512, options [nop,nop,TS val 1287810458 ecr 1287810455], length 4048
2022-02-28 03:17:46.235353 IP (tos 0x0, ttl 64, id 36177, offset 0, flags [DF], proto TCP (6), length 52)
    127.0.0.1.48812 > 127.0.0.1.11850: Flags [.], cksum 0xfe28 (incorrect -> 0xdf2e), seq 943, ack 105956, win 512, options [nop,nop,TS val 1287810458 ecr 1287810458], length 0
2022-02-28 03:17:46.235358 IP (tos 0x0, ttl 64, id 44105, offset 0, flags [DF], proto TCP (6), length 486)
    127.0.0.1.11850 > 127.0.0.1.48812: Flags [P.], cksum 0xffda (incorrect -> 0x10ae), seq 105956:106390, ack 943, win 512, options [nop,nop,TS val 1287810458 ecr 1287810458], length 434
2022-02-28 03:17:46.235364 IP (tos 0x0, ttl 64, id 36178, offset 0, flags [DF], proto TCP (6), length 52)
    127.0.0.1.48812 > 127.0.0.1.11850: Flags [.], cksum 0xfe28 (incorrect -> 0xdd7c), seq 943, ack 106390, win 512, options [nop,nop,TS val 1287810458 ecr 1287810458], length 0
2022-02-28 03:17:46.246230 IP (tos 0x0, ttl 64, id 44106, offset 0, flags [DF], proto TCP (6), length 3594)
    127.0.0.1.11850 > 127.0.0.1.48812: Flags [P.], cksum 0x0bff (incorrect -> 0x9429), seq 106390:109932, ack 943, win 512, options [nop,nop,TS val 1287810469 ecr 1287810458], length 3542
2022-02-28 03:17:46.246258 IP (tos 0x0, ttl 64, id 36179, offset 0, flags [DF], proto TCP (6), length 52)
    127.0.0.1.48812 > 127.0.0.1.11850: Flags [.], cksum 0xfe28 (incorrect -> 0xcf90), seq 943, ack 109932, win 512, options [nop,nop,TS val 1287810469 ecr 1287810469], length 0
2022-02-28 03:17:46.332816 IP (tos 0x0, ttl 64, id 44107, offset 0, flags [DF], proto TCP (6), length 4100)
    127.0.0.1.11850 > 127.0.0.1.48812: Flags [P.], cksum 0x0df9 (incorrect -> 0x12ba), seq 109932:113980, ack 943, win 512, options [nop,nop,TS val 1287810556 ecr 1287810469], length 4048
2022-02-28 03:17:46.333141 IP (tos 0x0, ttl 64, id 36180, offset 0, flags [DF], proto TCP (6), length 52)
    127.0.0.1.48812 > 127.0.0.1.11850: Flags [.], cksum 0xfe28 (incorrect -> 0xbf12), seq 943, ack 113980, win 512, options [nop,nop,TS val 1287810556 ecr 1287810556], length 0
2022-02-28 03:17:46.333163 IP (tos 0x0, ttl 64, id 44108, offset 0, flags [DF], proto TCP (6), length 29120)
    127.0.0.1.11850 > 127.0.0.1.48812: Flags [P.], cksum 0x6fb5 (incorrect -> 0xe062), seq 113980:143048, ack 943, win 512, options [nop,nop,TS val 1287810556 ecr 1287810556], length 29068
2022-02-28 03:17:46.337595 IP (tos 0x0, ttl 64, id 44109, offset 0, flags [DF], proto TCP (6), length 32820)
    127.0.0.1.11850 > 127.0.0.1.48812: Flags [.], cksum 0x7e29 (incorrect -> 0xfc1b), seq 143048:175816, ack 943, win 512, options [nop,nop,TS val 1287810561 ecr 1287810556], length 32768
2022-02-28 03:17:46.337611 IP (tos 0x0, ttl 64, id 36181, offset 0, flags [DF], proto TCP (6), length 52)
    127.0.0.1.48812 > 127.0.0.1.11850: Flags [.], cksum 0xfe28 (incorrect -> 0xce05), seq 943, ack 175816, win 379, options [nop,nop,TS val 1287810561 ecr 1287810556], length 0
2022-02-28 03:17:46.337616 IP (tos 0x0, ttl 64, id 44110, offset 0, flags [DF], proto TCP (6), length 3660)
    127.0.0.1.11850 > 127.0.0.1.48812: Flags [P.], cksum 0x0c41 (incorrect -> 0x15e8), seq 175816:179424, ack 943, win 512, options [nop,nop,TS val 1287810561 ecr 1287810561], length 3608
2022-02-28 03:17:46.337740 IP (tos 0x0, ttl 64, id 36182, offset 0, flags [DF], proto TCP (6), length 52)
    127.0.0.1.48812 > 127.0.0.1.11850: Flags [.], cksum 0xfe28 (incorrect -> 0xbf63), seq 943, ack 179424, win 512, options [nop,nop,TS val 1287810561 ecr 1287810561], length 0
2022-02-28 03:17:46.343794 IP (tos 0x0, ttl 64, id 44111, offset 0, flags [DF], proto TCP (6), length 4100)
    127.0.0.1.11850 > 127.0.0.1.48812: Flags [P.], cksum 0x0df9 (incorrect -> 0xbad3), seq 179424:183472, ack 943, win 512, options [nop,nop,TS val 1287810567 ecr 1287810561], length 4048
2022-02-28 03:17:46.343812 IP (tos 0x0, ttl 64, id 36183, offset 0, flags [DF], proto TCP (6), length 52)
    127.0.0.1.48812 > 127.0.0.1.11850: Flags [.], cksum 0xfe28 (incorrect -> 0xaf87), seq 943, ack 183472, win 512, options [nop,nop,TS val 1287810567 ecr 1287810567], length 0
2022-02-28 03:17:46.343814 IP (tos 0x0, ttl 64, id 44112, offset 0, flags [DF], proto TCP (6), length 486)
    127.0.0.1.11850 > 127.0.0.1.48812: Flags [P.], cksum 0xffda (incorrect -> 0xb092), seq 183472:183906, ack 943, win 512, options [nop,nop,TS val 1287810567 ecr 1287810567], length 434
2022-02-28 03:17:46.343883 IP (tos 0x0, ttl 64, id 36184, offset 0, flags [DF], proto TCP (6), length 52)
    127.0.0.1.48812 > 127.0.0.1.11850: Flags [.], cksum 0xfe28 (incorrect -> 0xadd5), seq 943, ack 183906, win 512, options [nop,nop,TS val 1287810567 ecr 1287810567], length 0
2022-02-28 03:17:46.344035 IP (tos 0x0, ttl 64, id 44113, offset 0, flags [DF], proto TCP (6), length 4100)
    127.0.0.1.11850 > 127.0.0.1.48812: Flags [P.], cksum 0x0df9 (incorrect -> 0xe526), seq 183906:187954, ack 943, win 512, options [nop,nop,TS val 1287810567 ecr 1287810567], length 4048
2022-02-28 03:17:46.344198 IP (tos 0x0, ttl 64, id 36185, offset 0, flags [DF], proto TCP (6), length 52)
    127.0.0.1.48812 > 127.0.0.1.11850: Flags [.], cksum 0xfe28 (incorrect -> 0x9e05), seq 943, ack 187954, win 512, options [nop,nop,TS val 1287810567 ecr 1287810567], length 0
2022-02-28 03:17:46.344208 IP (tos 0x0, ttl 64, id 44114, offset 0, flags [DF], proto TCP (6), length 11442)
    127.0.0.1.11850 > 127.0.0.1.48812: Flags [P.], cksum 0x2aa7 (incorrect -> 0xb51c), seq 187954:199344, ack 943, win 512, options [nop,nop,TS val 1287810567 ecr 1287810567], length 11390
2022-02-28 03:17:46.344229 IP (tos 0x0, ttl 64, id 36186, offset 0, flags [DF], proto TCP (6), length 52)
    127.0.0.1.48812 > 127.0.0.1.11850: Flags [.], cksum 0xfe28 (incorrect -> 0x7187), seq 943, ack 199344, win 512, options [nop,nop,TS val 1287810567 ecr 1287810567], length 0
2022-02-28 03:17:46.348413 IP (tos 0x0, ttl 64, id 44115, offset 0, flags [DF], proto TCP (6), length 550)
    127.0.0.1.11850 > 127.0.0.1.48812: Flags [P.], cksum 0x001b (incorrect -> 0xb8fd), seq 199344:199842, ack 943, win 512, options [nop,nop,TS val 1287810571 ecr 1287810567], length 498
2022-02-28 03:17:46.348424 IP (tos 0x0, ttl 64, id 36187, offset 0, flags [DF], proto TCP (6), length 52)
    127.0.0.1.48812 > 127.0.0.1.11850: Flags [.], cksum 0xfe28 (incorrect -> 0x6f8c), seq 943, ack 199842, win 512, options [nop,nop,TS val 1287810572 ecr 1287810571], length 0
2022-02-28 03:17:46.348566 IP (tos 0x0, ttl 64, id 44116, offset 0, flags [DF], proto TCP (6), length 4100)
    127.0.0.1.11850 > 127.0.0.1.48812: Flags [P.], cksum 0x0df9 (incorrect -> 0xbdeb), seq 199842:203890, ack 943, win 512, options [nop,nop,TS val 1287810572 ecr 1287810572], length 4048
2022-02-28 03:17:46.348683 IP (tos 0x0, ttl 64, id 36188, offset 0, flags [DF], proto TCP (6), length 52)
    127.0.0.1.48812 > 127.0.0.1.11850: Flags [.], cksum 0xfe28 (incorrect -> 0x5fbb), seq 943, ack 203890, win 512, options [nop,nop,TS val 1287810572 ecr 1287810572], length 0
2022-02-28 03:17:46.348687 IP (tos 0x0, ttl 64, id 44117, offset 0, flags [DF], proto TCP (6), length 2976)
    127.0.0.1.11850 > 127.0.0.1.48812: Flags [P.], cksum 0x0995 (incorrect -> 0xcd5f), seq 203890:206814, ack 943, win 512, options [nop,nop,TS val 1287810572 ecr 1287810572], length 2924
2022-02-28 03:17:46.348694 IP (tos 0x0, ttl 64, id 36189, offset 0, flags [DF], proto TCP (6), length 52)
    127.0.0.1.48812 > 127.0.0.1.11850: Flags [.], cksum 0xfe28 (incorrect -> 0x544f), seq 943, ack 206814, win 512, options [nop,nop,TS val 1287810572 ecr 1287810572], length 0
2022-02-28 03:17:46.348752 IP (tos 0x0, ttl 64, id 44118, offset 0, flags [DF], proto TCP (6), length 4100)
    127.0.0.1.11850 > 127.0.0.1.48812: Flags [P.], cksum 0x0df9 (incorrect -> 0xabc9), seq 206814:210862, ack 943, win 512, options [nop,nop,TS val 1287810572 ecr 1287810572], length 4048
2022-02-28 03:17:46.348791 IP (tos 0x0, ttl 64, id 36190, offset 0, flags [DF], proto TCP (6), length 52)
    127.0.0.1.48812 > 127.0.0.1.11850: Flags [.], cksum 0xfe28 (incorrect -> 0x447f), seq 943, ack 210862, win 512, options [nop,nop,TS val 1287810572 ecr 1287810572], length 0
2022-02-28 03:17:46.348796 IP (tos 0x0, ttl 64, id 44119, offset 0, flags [DF], proto TCP (6), length 4968)
    127.0.0.1.11850 > 127.0.0.1.48812: Flags [P.], cksum 0x115d (incorrect -> 0xa231), seq 210862:215778, ack 943, win 512, options [nop,nop,TS val 1287810572 ecr 1287810572], length 4916
2022-02-28 03:17:46.348804 IP (tos 0x0, ttl 64, id 36191, offset 0, flags [DF], proto TCP (6), length 52)
    127.0.0.1.48812 > 127.0.0.1.11850: Flags [.], cksum 0xfe28 (incorrect -> 0x314b), seq 943, ack 215778, win 512, options [nop,nop,TS val 1287810572 ecr 1287810572], length 0
2022-02-28 03:17:46.364165 IP (tos 0x0, ttl 64, id 44120, offset 0, flags [DF], proto TCP (6), length 1546)
    127.0.0.1.11850 > 127.0.0.1.48812: Flags [P.], cksum 0x03ff (incorrect -> 0xb18e), seq 215778:217272, ack 943, win 512, options [nop,nop,TS val 1287810587 ecr 1287810572], length 1494
2022-02-28 03:17:46.364242 IP (tos 0x0, ttl 64, id 36192, offset 0, flags [DF], proto TCP (6), length 52)
    127.0.0.1.48812 > 127.0.0.1.11850: Flags [.], cksum 0xfe28 (incorrect -> 0x2b57), seq 943, ack 217272, win 512, options [nop,nop,TS val 1287810587 ecr 1287810587], length 0
2022-02-28 03:17:46.394191 IP (tos 0x0, ttl 64, id 44121, offset 0, flags [DF], proto TCP (6), length 752)
    127.0.0.1.11850 > 127.0.0.1.48812: Flags [P.], cksum 0x00e5 (incorrect -> 0x089d), seq 217272:217972, ack 943, win 512, options [nop,nop,TS val 1287810617 ecr 1287810587], length 700
2022-02-28 03:17:46.394212 IP (tos 0x0, ttl 64, id 36193, offset 0, flags [DF], proto TCP (6), length 52)
    127.0.0.1.48812 > 127.0.0.1.11850: Flags [.], cksum 0xfe28 (incorrect -> 0x285f), seq 943, ack 217972, win 512, options [nop,nop,TS val 1287810617 ecr 1287810617], length 0
2022-02-28 03:17:46.440606 IP (tos 0x0, ttl 64, id 44122, offset 0, flags [DF], proto TCP (6), length 3538)
    127.0.0.1.11850 > 127.0.0.1.48812: Flags [P.], cksum 0x0bc7 (incorrect -> 0x2342), seq 217972:221458, ack 943, win 512, options [nop,nop,TS val 1287810664 ecr 1287810617], length 3486
2022-02-28 03:17:46.440651 IP (tos 0x0, ttl 64, id 36194, offset 0, flags [DF], proto TCP (6), length 52)
    127.0.0.1.48812 > 127.0.0.1.11850: Flags [.], cksum 0xfe28 (incorrect -> 0x1a63), seq 943, ack 221458, win 512, options [nop,nop,TS val 1287810664 ecr 1287810664], length 0
2022-02-28 03:17:46.441798 IP (tos 0x0, ttl 64, id 44123, offset 0, flags [DF], proto TCP (6), length 4036)
    127.0.0.1.11850 > 127.0.0.1.48812: Flags [P.], cksum 0x0db9 (incorrect -> 0x2393), seq 221458:225442, ack 943, win 512, options [nop,nop,TS val 1287810665 ecr 1287810664], length 3984
2022-02-28 03:17:46.441820 IP (tos 0x0, ttl 64, id 36195, offset 0, flags [DF], proto TCP (6), length 52)
    127.0.0.1.48812 > 127.0.0.1.11850: Flags [.], cksum 0xfe28 (incorrect -> 0x0ad1), seq 943, ack 225442, win 512, options [nop,nop,TS val 1287810665 ecr 1287810665], length 0
2022-02-28 03:17:46.441934 IP (tos 0x0, ttl 64, id 44124, offset 0, flags [DF], proto TCP (6), length 4100)
    127.0.0.1.11850 > 127.0.0.1.48812: Flags [P.], cksum 0x0df9 (incorrect -> 0x3fe3), seq 225442:229490, ack 943, win 512, options [nop,nop,TS val 1287810665 ecr 1287810665], length 4048
2022-02-28 03:17:46.441954 IP (tos 0x0, ttl 64, id 36196, offset 0, flags [DF], proto TCP (6), length 52)
    127.0.0.1.48812 > 127.0.0.1.11850: Flags [.], cksum 0xfe28 (incorrect -> 0xfb00), seq 943, ack 229490, win 512, options [nop,nop,TS val 1287810665 ecr 1287810665], length 0
2022-02-28 03:17:46.441957 IP (tos 0x0, ttl 64, id 44125, offset 0, flags [DF], proto TCP (6), length 3270)
    127.0.0.1.11850 > 127.0.0.1.48812: Flags [P.], cksum 0x0abb (incorrect -> 0x33f6), seq 229490:232708, ack 943, win 512, options [nop,nop,TS val 1287810665 ecr 1287810665], length 3218
2022-02-28 03:17:46.441960 IP (tos 0x0, ttl 64, id 36197, offset 0, flags [DF], proto TCP (6), length 52)
    127.0.0.1.48812 > 127.0.0.1.11850: Flags [.], cksum 0xfe28 (incorrect -> 0xee6e), seq 943, ack 232708, win 512, options [nop,nop,TS val 1287810665 ecr 1287810665], length 0
2022-02-28 03:17:46.443742 IP (tos 0x0, ttl 64, id 44126, offset 0, flags [DF], proto TCP (6), length 4036)
    127.0.0.1.11850 > 127.0.0.1.48812: Flags [P.], cksum 0x0db9 (incorrect -> 0x4ff8), seq 232708:236692, ack 943, win 512, options [nop,nop,TS val 1287810667 ecr 1287810665], length 3984
2022-02-28 03:17:46.443857 IP (tos 0x0, ttl 64, id 36198, offset 0, flags [DF], proto TCP (6), length 52)
    127.0.0.1.48812 > 127.0.0.1.11850: Flags [.], cksum 0xfe28 (incorrect -> 0xdeda), seq 943, ack 236692, win 512, options [nop,nop,TS val 1287810667 ecr 1287810667], length 0
200, 124.30893325805664, 1.168900728225708