2022-02-28 13:14:17.433686 IP (tos 0x0, ttl 64, id 9085, offset 0, flags [DF], proto TCP (6), length 60)
    127.0.0.1.36784 > 127.0.0.1.10650: Flags [S], cksum 0xfe30 (incorrect -> 0x04d9), seq 3593854410, win 65495, options [mss 65495,sackOK,TS val 1323601657 ecr 0,nop,wscale 7], length 0
2022-02-28 13:14:17.433702 IP (tos 0x0, ttl 64, id 0, offset 0, flags [DF], proto TCP (6), length 60)
    127.0.0.1.10650 > 127.0.0.1.36784: Flags [S.], cksum 0xfe30 (incorrect -> 0x3165), seq 970046399, ack 3593854411, win 65483, options [mss 65495,sackOK,TS val 1323601657 ecr 1323601657,nop,wscale 7], length 0
2022-02-28 13:14:17.433714 IP (tos 0x0, ttl 64, id 9086, offset 0, flags [DF], proto TCP (6), length 52)
    127.0.0.1.36784 > 127.0.0.1.10650: Flags [.], cksum 0xfe28 (incorrect -> 0x5821), seq 1, ack 1, win 512, options [nop,nop,TS val 1323601657 ecr 1323601657], length 0
2022-02-28 13:14:17.433828 IP (tos 0x0, ttl 64, id 9087, offset 0, flags [DF], proto TCP (6), length 55)
    127.0.0.1.36784 > 127.0.0.1.10650: Flags [P.], cksum 0xfe2b (incorrect -> 0x5315), seq 1:4, ack 1, win 512, options [nop,nop,TS val 1323601657 ecr 1323601657], length 3
2022-02-28 13:14:17.433839 IP (tos 0x0, ttl 64, id 21957, offset 0, flags [DF], proto TCP (6), length 52)
    127.0.0.1.10650 > 127.0.0.1.36784: Flags [.], cksum 0xfe28 (incorrect -> 0x581e), seq 1, ack 4, win 512, options [nop,nop,TS val 1323601657 ecr 1323601657], length 0
2022-02-28 13:14:17.433868 IP (tos 0x0, ttl 64, id 21958, offset 0, flags [DF], proto TCP (6), length 54)
    127.0.0.1.10650 > 127.0.0.1.36784: Flags [P.], cksum 0xfe2a (incorrect -> 0x5314), seq 1:3, ack 4, win 512, options [nop,nop,TS val 1323601657 ecr 1323601657], length 2
2022-02-28 13:14:17.433878 IP (tos 0x0, ttl 64, id 9088, offset 0, flags [DF], proto TCP (6), length 52)
    127.0.0.1.36784 > 127.0.0.1.10650: Flags [.], cksum 0xfe28 (incorrect -> 0x581c), seq 4, ack 3, win 512, options [nop,nop,TS val 1323601657 ecr 1323601657], length 0
2022-02-28 13:14:17.447200 IP (tos 0x0, ttl 64, id 9089, offset 0, flags [DF], proto TCP (6), length 62)
    127.0.0.1.36784 > 127.0.0.1.10650: Flags [P.], cksum 0xfe32 (incorrect -> 0xdd74), seq 4:14, ack 3, win 512, options [nop,nop,TS val 1323601670 ecr 1323601657], length 10
2022-02-28 13:14:17.447217 IP (tos 0x0, ttl 64, id 21959, offset 0, flags [DF], proto TCP (6), length 52)
    127.0.0.1.10650 > 127.0.0.1.36784: Flags [.], cksum 0xfe28 (incorrect -> 0x57f8), seq 3, ack 14, win 512, options [nop,nop,TS val 1323601670 ecr 1323601670], length 0
2022-02-28 13:14:17.560440 IP (tos 0x0, ttl 64, id 21960, offset 0, flags [DF], proto TCP (6), length 62)
    127.0.0.1.10650 > 127.0.0.1.36784: Flags [P.], cksum 0xfe32 (incorrect -> 0x5273), seq 3:13, ack 14, win 512, options [nop,nop,TS val 1323601784 ecr 1323601670], length 10
2022-02-28 13:14:17.560448 IP (tos 0x0, ttl 64, id 9090, offset 0, flags [DF], proto TCP (6), length 52)
    127.0.0.1.36784 > 127.0.0.1.10650: Flags [.], cksum 0xfe28 (incorrect -> 0x570a), seq 14, ack 13, win 512, options [nop,nop,TS val 1323601784 ecr 1323601784], length 0
2022-02-28 13:14:17.566369 IP (tos 0x0, ttl 64, id 9091, offset 0, flags [DF], proto TCP (6), length 569)
    127.0.0.1.36784 > 127.0.0.1.10650: Flags [P.], cksum 0x002e (incorrect -> 0x1be0), seq 14:531, ack 13, win 512, options [nop,nop,TS val 1323601789 ecr 1323601784], length 517
2022-02-28 13:14:17.566383 IP (tos 0x0, ttl 64, id 21961, offset 0, flags [DF], proto TCP (6), length 52)
    127.0.0.1.10650 > 127.0.0.1.36784: Flags [.], cksum 0xfe28 (incorrect -> 0x54ff), seq 13, ack 531, win 508, options [nop,nop,TS val 1323601789 ecr 1323601789], length 0
2022-02-28 13:14:17.666259 IP (tos 0x0, ttl 64, id 21962, offset 0, flags [DF], proto TCP (6), length 3538)
    127.0.0.1.10650 > 127.0.0.1.36784: Flags [P.], cksum 0x0bc7 (incorrect -> 0x8eb3), seq 13:3499, ack 531, win 512, options [nop,nop,TS val 1323601889 ecr 1323601789], length 3486
2022-02-28 13:14:17.666268 IP (tos 0x0, ttl 64, id 9092, offset 0, flags [DF], proto TCP (6), length 52)
    127.0.0.1.36784 > 127.0.0.1.10650: Flags [.], cksum 0xfe28 (incorrect -> 0x46a7), seq 531, ack 3499, win 494, options [nop,nop,TS val 1323601889 ecr 1323601889], length 0
2022-02-28 13:14:17.697624 IP (tos 0x0, ttl 64, id 21963, offset 0, flags [DF], proto TCP (6), length 2134)
    127.0.0.1.10650 > 127.0.0.1.36784: Flags [P.], cksum 0x064b (incorrect -> 0x0688), seq 3499:5581, ack 531, win 512, options [nop,nop,TS val 1323601921 ecr 1323601889], length 2082
2022-02-28 13:14:17.697630 IP (tos 0x0, ttl 64, id 9093, offset 0, flags [DF], proto TCP (6), length 52)
    127.0.0.1.36784 > 127.0.0.1.10650: Flags [.], cksum 0xfe28 (incorrect -> 0x3e40), seq 531, ack 5581, win 499, options [nop,nop,TS val 1323601921 ecr 1323601921], length 0
2022-02-28 13:14:17.698070 IP (tos 0x0, ttl 64, id 9094, offset 0, flags [DF], proto TCP (6), length 116)
    127.0.0.1.36784 > 127.0.0.1.10650: Flags [P.], cksum 0xfe68 (incorrect -> 0x9f90), seq 531:595, ack 5581, win 512, options [nop,nop,TS val 1323601921 ecr 1323601921], length 64
2022-02-28 13:14:17.698078 IP (tos 0x0, ttl 64, id 21964, offset 0, flags [DF], proto TCP (6), length 52)
    127.0.0.1.10650 > 127.0.0.1.36784: Flags [.], cksum 0xfe28 (incorrect -> 0x3df3), seq 5581, ack 595, win 512, options [nop,nop,TS val 1323601921 ecr 1323601921], length 0
2022-02-28 13:14:17.698416 IP (tos 0x0, ttl 64, id 9095, offset 0, flags [DF], proto TCP (6), length 292)
    127.0.0.1.36784 > 127.0.0.1.10650: Flags [P.], cksum 0xff18 (incorrect -> 0xe988), seq 595:835, ack 5581, win 512, options [nop,nop,TS val 1323601921 ecr 1323601921], length 240
2022-02-28 13:14:17.698431 IP (tos 0x0, ttl 64, id 21965, offset 0, flags [DF], proto TCP (6), length 52)
    127.0.0.1.10650 > 127.0.0.1.36784: Flags [.], cksum 0xfe28 (incorrect -> 0x3d04), seq 5581, ack 835, win 511, options [nop,nop,TS val 1323601921 ecr 1323601921], length 0
2022-02-28 13:14:17.888038 IP (tos 0x0, ttl 64, id 21966, offset 0, flags [DF], proto TCP (6), length 3538)
    127.0.0.1.10650 > 127.0.0.1.36784: Flags [P.], cksum 0x0bc7 (incorrect -> 0x020f), seq 5581:9067, ack 835, win 512, options [nop,nop,TS val 1323602111 ecr 1323601921], length 3486
2022-02-28 13:14:17.888050 IP (tos 0x0, ttl 64, id 9096, offset 0, flags [DF], proto TCP (6), length 52)
    127.0.0.1.36784 > 127.0.0.1.10650: Flags [.], cksum 0xfe28 (incorrect -> 0x2dfb), seq 835, ack 9067, win 494, options [nop,nop,TS val 1323602111 ecr 1323602111], length 0
2022-02-28 13:14:17.914984 IP (tos 0x0, ttl 64, id 21967, offset 0, flags [DF], proto TCP (6), length 3538)
    127.0.0.1.10650 > 127.0.0.1.36784: Flags [P.], cksum 0x0bc7 (incorrect -> 0x0591), seq 9067:12553, ack 835, win 512, options [nop,nop,TS val 1323602138 ecr 1323602111], length 3486
2022-02-28 13:14:17.914992 IP (tos 0x0, ttl 64, id 9097, offset 0, flags [DF], proto TCP (6), length 52)
    127.0.0.1.36784 > 127.0.0.1.10650: Flags [.], cksum 0xfe28 (incorrect -> 0x2027), seq 835, ack 12553, win 494, options [nop,nop,TS val 1323602138 ecr 1323602138], length 0
2022-02-28 13:14:17.923041 IP (tos 0x0, ttl 64, id 21968, offset 0, flags [DF], proto TCP (6), length 550)
    127.0.0.1.10650 > 127.0.0.1.36784: Flags [P.], cksum 0x001b (incorrect -> 0xcbce), seq 12553:13051, ack 835, win 512, options [nop,nop,TS val 1323602146 ecr 1323602138], length 498
2022-02-28 13:14:17.923046 IP (tos 0x0, ttl 64, id 9098, offset 0, flags [DF], proto TCP (6), length 52)
    127.0.0.1.36784 > 127.0.0.1.10650: Flags [.], cksum 0xfe28 (incorrect -> 0x1e19), seq 835, ack 13051, win 506, options [nop,nop,TS val 1323602146 ecr 1323602146], length 0
2022-02-28 13:14:17.923202 IP (tos 0x0, ttl 64, id 21969, offset 0, flags [DF], proto TCP (6), length 4100)
    127.0.0.1.10650 > 127.0.0.1.36784: Flags [P.], cksum 0x0df9 (incorrect -> 0x65e4), seq 13051:17099, ack 835, win 512, options [nop,nop,TS val 1323602146 ecr 1323602146], length 4048
2022-02-28 13:14:17.923207 IP (tos 0x0, ttl 64, id 9099, offset 0, flags [DF], proto TCP (6), length 52)
    127.0.0.1.36784 > 127.0.0.1.10650: Flags [.], cksum 0xfe28 (incorrect -> 0x0e57), seq 835, ack 17099, win 492, options [nop,nop,TS val 1323602146 ecr 1323602146], length 0
2022-02-28 13:14:17.923213 IP (tos 0x0, ttl 64, id 21970, offset 0, flags [DF], proto TCP (6), length 3474)
    127.0.0.1.10650 > 127.0.0.1.36784: Flags [P.], cksum 0x0b87 (incorrect -> 0x7166), seq 17099:20521, ack 835, win 512, options [nop,nop,TS val 1323602146 ecr 1323602146], length 3422
2022-02-28 13:14:17.923216 IP (tos 0x0, ttl 64, id 9100, offset 0, flags [DF], proto TCP (6), length 52)
    127.0.0.1.36784 > 127.0.0.1.10650: Flags [.], cksum 0xfe28 (incorrect -> 0x0107), seq 835, ack 20521, win 478, options [nop,nop,TS val 1323602146 ecr 1323602146], length 0
2022-02-28 13:14:17.932930 IP (tos 0x0, ttl 64, id 21971, offset 0, flags [DF], proto TCP (6), length 2044)
    127.0.0.1.10650 > 127.0.0.1.36784: Flags [P.], cksum 0x05f1 (incorrect -> 0x3722), seq 20521:22513, ack 835, win 512, options [nop,nop,TS val 1323602156 ecr 1323602146], length 1992
2022-02-28 13:14:17.932935 IP (tos 0x0, ttl 64, id 9101, offset 0, flags [DF], proto TCP (6), length 52)
    127.0.0.1.36784 > 127.0.0.1.10650: Flags [.], cksum 0xfe28 (incorrect -> 0xf914), seq 835, ack 22513, win 500, options [nop,nop,TS val 1323602156 ecr 1323602156], length 0
2022-02-28 13:14:17.951830 IP (tos 0x0, ttl 64, id 21972, offset 0, flags [DF], proto TCP (6), length 3538)
    127.0.0.1.10650 > 127.0.0.1.36784: Flags [P.], cksum 0x0bc7 (incorrect -> 0xff57), seq 22513:25999, ack 835, win 512, options [nop,nop,TS val 1323602175 ecr 1323602156], length 3486
2022-02-28 13:14:17.951836 IP (tos 0x0, ttl 64, id 9102, offset 0, flags [DF], proto TCP (6), length 52)
    127.0.0.1.36784 > 127.0.0.1.10650: Flags [.], cksum 0xfe28 (incorrect -> 0xeb56), seq 835, ack 25999, win 494, options [nop,nop,TS val 1323602175 ecr 1323602175], length 0
2022-02-28 13:14:17.952504 IP (tos 0x0, ttl 64, id 21973, offset 0, flags [DF], proto TCP (6), length 4100)
    127.0.0.1.10650 > 127.0.0.1.36784: Flags [P.], cksum 0x0df9 (incorrect -> 0x7055), seq 25999:30047, ack 835, win 512, options [nop,nop,TS val 1323602176 ecr 1323602175], length 4048
2022-02-28 13:14:17.952515 IP (tos 0x0, ttl 64, id 9103, offset 0, flags [DF], proto TCP (6), length 52)
    127.0.0.1.36784 > 127.0.0.1.10650: Flags [.], cksum 0xfe28 (incorrect -> 0xdb86), seq 835, ack 30047, win 492, options [nop,nop,TS val 1323602176 ecr 1323602176], length 0
2022-02-28 13:14:17.952524 IP (tos 0x0, ttl 64, id 21974, offset 0, flags [DF], proto TCP (6), length 486)
    127.0.0.1.10650 > 127.0.0.1.36784: Flags [P.], cksum 0xffda (incorrect -> 0xb02a), seq 30047:30481, ack 835, win 512, options [nop,nop,TS val 1323602176 ecr 1323602176], length 434
2022-02-28 13:14:17.952552 IP (tos 0x0, ttl 64, id 9104, offset 0, flags [DF], proto TCP (6), length 52)
    127.0.0.1.36784 > 127.0.0.1.10650: Flags [.], cksum 0xfe28 (incorrect -> 0xd9c0), seq 835, ack 30481, win 512, options [nop,nop,TS val 1323602176 ecr 1323602176], length 0
2022-02-28 13:14:17.956312 IP (tos 0x0, ttl 64, id 21975, offset 0, flags [DF], proto TCP (6), length 2044)
    127.0.0.1.10650 > 127.0.0.1.36784: Flags [P.], cksum 0x05f1 (incorrect -> 0x3ec0), seq 30481:32473, ack 835, win 512, options [nop,nop,TS val 1323602179 ecr 1323602176], length 1992
2022-02-28 13:14:17.956324 IP (tos 0x0, ttl 64, id 9105, offset 0, flags [DF], proto TCP (6), length 52)
    127.0.0.1.36784 > 127.0.0.1.10650: Flags [.], cksum 0xfe28 (incorrect -> 0xd1f2), seq 835, ack 32473, win 512, options [nop,nop,TS val 1323602179 ecr 1323602179], length 0
2022-02-28 13:14:17.958149 IP (tos 0x0, ttl 64, id 21976, offset 0, flags [DF], proto TCP (6), length 3538)
    127.0.0.1.10650 > 127.0.0.1.36784: Flags [P.], cksum 0x0bc7 (incorrect -> 0x69c7), seq 32473:35959, ack 835, win 512, options [nop,nop,TS val 1323602181 ecr 1323602179], length 3486
2022-02-28 13:14:17.958197 IP (tos 0x0, ttl 64, id 9106, offset 0, flags [DF], proto TCP (6), length 52)
    127.0.0.1.36784 > 127.0.0.1.10650: Flags [.], cksum 0xfe28 (incorrect -> 0xc450), seq 835, ack 35959, win 512, options [nop,nop,TS val 1323602181 ecr 1323602181], length 0
2022-02-28 13:14:17.973175 IP (tos 0x0, ttl 64, id 21977, offset 0, flags [DF], proto TCP (6), length 3447)
    127.0.0.1.10650 > 127.0.0.1.36784: Flags [P.], cksum 0x0b6c (incorrect -> 0x0bdd), seq 35959:39354, ack 835, win 512, options [nop,nop,TS val 1323602196 ecr 1323602181], length 3395
2022-02-28 13:14:17.973731 IP (tos 0x0, ttl 64, id 9107, offset 0, flags [DF], proto TCP (6), length 52)
    127.0.0.1.36784 > 127.0.0.1.10650: Flags [.], cksum 0xfe28 (incorrect -> 0xb6ee), seq 835, ack 39354, win 512, options [nop,nop,TS val 1323602197 ecr 1323602196], length 0
2022-02-28 13:14:17.976491 IP (tos 0x0, ttl 64, id 21978, offset 0, flags [DF], proto TCP (6), length 3538)
    127.0.0.1.10650 > 127.0.0.1.36784: Flags [P.], cksum 0x0bc7 (incorrect -> 0x7b2f), seq 39354:42840, ack 835, win 512, options [nop,nop,TS val 1323602200 ecr 1323602197], length 3486
2022-02-28 13:14:17.976503 IP (tos 0x0, ttl 64, id 9108, offset 0, flags [DF], proto TCP (6), length 52)
    127.0.0.1.36784 > 127.0.0.1.10650: Flags [.], cksum 0xfe28 (incorrect -> 0xa949), seq 835, ack 42840, win 512, options [nop,nop,TS val 1323602200 ecr 1323602200], length 0
2022-02-28 13:14:17.987605 IP (tos 0x0, ttl 64, id 21979, offset 0, flags [DF], proto TCP (6), length 3538)
    127.0.0.1.10650 > 127.0.0.1.36784: Flags [P.], cksum 0x0bc7 (incorrect -> 0xd47a), seq 42840:46326, ack 835, win 512, options [nop,nop,TS val 1323602211 ecr 1323602200], length 3486
2022-02-28 13:14:18.027431 IP (tos 0x0, ttl 64, id 21980, offset 0, flags [DF], proto TCP (6), length 32820)
    127.0.0.1.10650 > 127.0.0.1.36784: Flags [.], cksum 0x7e29 (incorrect -> 0xf81c), seq 46326:79094, ack 835, win 512, options [nop,nop,TS val 1323602250 ecr 1323602200], length 32768
2022-02-28 13:14:18.027438 IP (tos 0x0, ttl 64, id 9109, offset 0, flags [DF], proto TCP (6), length 52)
    127.0.0.1.36784 > 127.0.0.1.10650: Flags [.], cksum 0xfe28 (incorrect -> 0x1bf2), seq 835, ack 79094, win 379, options [nop,nop,TS val 1323602251 ecr 1323602211], length 0
2022-02-28 13:14:18.027445 IP (tos 0x0, ttl 64, id 21981, offset 0, flags [DF], proto TCP (6), length 130)
    127.0.0.1.10650 > 127.0.0.1.36784: Flags [P.], cksum 0xfe76 (incorrect -> 0x5861), seq 79094:79172, ack 835, win 512, options [nop,nop,TS val 1323602251 ecr 1323602251], length 78
2022-02-28 13:14:18.028275 IP (tos 0x0, ttl 64, id 9110, offset 0, flags [DF], proto TCP (6), length 52)
    127.0.0.1.36784 > 127.0.0.1.10650: Flags [.], cksum 0xfe28 (incorrect -> 0x1af7), seq 835, ack 79172, win 512, options [nop,nop,TS val 1323602251 ecr 1323602251], length 0
2022-02-28 13:14:18.033819 IP (tos 0x0, ttl 64, id 21982, offset 0, flags [DF], proto TCP (6), length 4036)
    127.0.0.1.10650 > 127.0.0.1.36784: Flags [P.], cksum 0x0db9 (incorrect -> 0x1766), seq 79172:83156, ack 835, win 512, options [nop,nop,TS val 1323602257 ecr 1323602251], length 3984
2022-02-28 13:14:18.033832 IP (tos 0x0, ttl 64, id 9111, offset 0, flags [DF], proto TCP (6), length 52)
    127.0.0.1.36784 > 127.0.0.1.10650: Flags [.], cksum 0xfe28 (incorrect -> 0x0b5b), seq 835, ack 83156, win 512, options [nop,nop,TS val 1323602257 ecr 1323602257], length 0
2022-02-28 13:14:18.033936 IP (tos 0x0, ttl 64, id 21983, offset 0, flags [DF], proto TCP (6), length 3440)
    127.0.0.1.10650 > 127.0.0.1.36784: Flags [P.], cksum 0x0b65 (incorrect -> 0x075c), seq 83156:86544, ack 835, win 512, options [nop,nop,TS val 1323602257 ecr 1323602257], length 3388
2022-02-28 13:14:18.033948 IP (tos 0x0, ttl 64, id 9112, offset 0, flags [DF], proto TCP (6), length 52)
    127.0.0.1.36784 > 127.0.0.1.10650: Flags [.], cksum 0xfe28 (incorrect -> 0xfe1e), seq 835, ack 86544, win 512, options [nop,nop,TS val 1323602257 ecr 1323602257], length 0
2022-02-28 13:14:18.037878 IP (tos 0x0, ttl 64, id 21984, offset 0, flags [DF], proto TCP (6), length 4100)
    127.0.0.1.10650 > 127.0.0.1.36784: Flags [P.], cksum 0x0df9 (incorrect -> 0x9760), seq 86544:90592, ack 835, win 512, options [nop,nop,TS val 1323602261 ecr 1323602257], length 4048
2022-02-28 13:14:18.038427 IP (tos 0x0, ttl 64, id 9113, offset 0, flags [DF], proto TCP (6), length 52)
    127.0.0.1.36784 > 127.0.0.1.10650: Flags [.], cksum 0xfe28 (incorrect -> 0xee45), seq 835, ack 90592, win 512, options [nop,nop,TS val 1323602262 ecr 1323602261], length 0
2022-02-28 13:14:18.038432 IP (tos 0x0, ttl 64, id 21985, offset 0, flags [DF], proto TCP (6), length 486)
    127.0.0.1.10650 > 127.0.0.1.36784: Flags [P.], cksum 0xffda (incorrect -> 0xbf83), seq 90592:91026, ack 835, win 512, options [nop,nop,TS val 1323602262 ecr 1323602262], length 434
2022-02-28 13:14:18.038435 IP (tos 0x0, ttl 64, id 9114, offset 0, flags [DF], proto TCP (6), length 52)
    127.0.0.1.36784 > 127.0.0.1.10650: Flags [.], cksum 0xfe28 (incorrect -> 0xec92), seq 835, ack 91026, win 512, options [nop,nop,TS val 1323602262 ecr 1323602262], length 0
2022-02-28 13:14:18.052557 IP (tos 0x0, ttl 64, id 21986, offset 0, flags [DF], proto TCP (6), length 3538)
    127.0.0.1.10650 > 127.0.0.1.36784: Flags [P.], cksum 0x0bc7 (incorrect -> 0x75a1), seq 91026:94512, ack 835, win 512, options [nop,nop,TS val 1323602276 ecr 1323602262], length 3486
2022-02-28 13:14:18.052572 IP (tos 0x0, ttl 64, id 9115, offset 0, flags [DF], proto TCP (6), length 52)
    127.0.0.1.36784 > 127.0.0.1.10650: Flags [.], cksum 0xfe28 (incorrect -> 0xded8), seq 835, ack 94512, win 512, options [nop,nop,TS val 1323602276 ecr 1323602276], length 0
2022-02-28 13:14:18.065301 IP (tos 0x0, ttl 64, id 21987, offset 0, flags [DF], proto TCP (6), length 4100)
    127.0.0.1.10650 > 127.0.0.1.36784: Flags [P.], cksum 0x0df9 (incorrect -> 0xc9e0), seq 94512:98560, ack 835, win 512, options [nop,nop,TS val 1323602288 ecr 1323602276], length 4048
2022-02-28 13:14:18.065368 IP (tos 0x0, ttl 64, id 9116, offset 0, flags [DF], proto TCP (6), length 52)
    127.0.0.1.36784 > 127.0.0.1.10650: Flags [.], cksum 0xfe28 (incorrect -> 0xcef0), seq 835, ack 98560, win 512, options [nop,nop,TS val 1323602288 ecr 1323602288], length 0
2022-02-28 13:14:18.065372 IP (tos 0x0, ttl 64, id 21988, offset 0, flags [DF], proto TCP (6), length 4470)
    127.0.0.1.10650 > 127.0.0.1.36784: Flags [P.], cksum 0x0f6b (incorrect -> 0xa9c2), seq 98560:102978, ack 835, win 512, options [nop,nop,TS val 1323602288 ecr 1323602288], length 4418
2022-02-28 13:14:18.065376 IP (tos 0x0, ttl 64, id 9117, offset 0, flags [DF], proto TCP (6), length 52)
    127.0.0.1.36784 > 127.0.0.1.10650: Flags [.], cksum 0xfe28 (incorrect -> 0xbdae), seq 835, ack 102978, win 512, options [nop,nop,TS val 1323602288 ecr 1323602288], length 0
2022-02-28 13:14:18.070295 IP (tos 0x0, ttl 64, id 21989, offset 0, flags [DF], proto TCP (6), length 4100)
    127.0.0.1.10650 > 127.0.0.1.36784: Flags [P.], cksum 0x0df9 (incorrect -> 0x54b3), seq 102978:107026, ack 835, win 512, options [nop,nop,TS val 1323602293 ecr 1323602288], length 4048
2022-02-28 13:14:18.070510 IP (tos 0x0, ttl 64, id 9118, offset 0, flags [DF], proto TCP (6), length 52)
    127.0.0.1.36784 > 127.0.0.1.10650: Flags [.], cksum 0xfe28 (incorrect -> 0xadd3), seq 835, ack 107026, win 512, options [nop,nop,TS val 1323602294 ecr 1323602293], length 0
2022-02-28 13:14:18.070514 IP (tos 0x0, ttl 64, id 21990, offset 0, flags [DF], proto TCP (6), length 486)
    127.0.0.1.10650 > 127.0.0.1.36784: Flags [P.], cksum 0xffda (incorrect -> 0xa99c), seq 107026:107460, ack 835, win 512, options [nop,nop,TS val 1323602294 ecr 1323602294], length 434
2022-02-28 13:14:18.070517 IP (tos 0x0, ttl 64, id 9119, offset 0, flags [DF], proto TCP (6), length 52)
    127.0.0.1.36784 > 127.0.0.1.10650: Flags [.], cksum 0xfe28 (incorrect -> 0xac20), seq 835, ack 107460, win 512, options [nop,nop,TS val 1323602294 ecr 1323602294], length 0
2022-02-28 13:14:18.086378 IP (tos 0x0, ttl 64, id 21991, offset 0, flags [DF], proto TCP (6), length 4036)
    127.0.0.1.10650 > 127.0.0.1.36784: Flags [P.], cksum 0x0db9 (incorrect -> 0x1433), seq 107460:111444, ack 835, win 512, options [nop,nop,TS val 1323602309 ecr 1323602294], length 3984
2022-02-28 13:14:18.086406 IP (tos 0x0, ttl 64, id 9120, offset 0, flags [DF], proto TCP (6), length 52)
    127.0.0.1.36784 > 127.0.0.1.10650: Flags [.], cksum 0xfe28 (incorrect -> 0x9c72), seq 835, ack 111444, win 512, options [nop,nop,TS val 1323602309 ecr 1323602309], length 0
2022-02-28 13:14:18.090549 IP (tos 0x0, ttl 64, id 21992, offset 0, flags [DF], proto TCP (6), length 4036)
    127.0.0.1.10650 > 127.0.0.1.36784: Flags [P.], cksum 0x0db9 (incorrect -> 0x2d97), seq 111444:115428, ack 835, win 512, options [nop,nop,TS val 1323602314 ecr 1323602309], length 3984
2022-02-28 13:14:18.134147 IP (tos 0x0, ttl 64, id 9121, offset 0, flags [DF], proto TCP (6), length 52)
    127.0.0.1.36784 > 127.0.0.1.10650: Flags [.], cksum 0xfe28 (incorrect -> 0x8cad), seq 835, ack 115428, win 512, options [nop,nop,TS val 1323602357 ecr 1323602314], length 0
200, 9.917356252670288, 0.7511177062988281