2022-02-28 05:48:55.333441 IP (tos 0x0, ttl 64, id 38428, offset 0, flags [DF], proto TCP (6), length 60)
    127.0.0.1.50192 > 127.0.0.1.10750: Flags [S], cksum 0xfe30 (incorrect -> 0x72da), seq 1751542177, win 65495, options [mss 65495,sackOK,TS val 1296879556 ecr 0,nop,wscale 7], length 0
2022-02-28 05:48:55.333455 IP (tos 0x0, ttl 64, id 0, offset 0, flags [DF], proto TCP (6), length 60)
    127.0.0.1.10750 > 127.0.0.1.50192: Flags [S.], cksum 0xfe30 (incorrect -> 0x8f22), seq 1428124033, ack 1751542178, win 65483, options [mss 65495,sackOK,TS val 1296879557 ecr 1296879556,nop,wscale 7], length 0
2022-02-28 05:48:55.333464 IP (tos 0x0, ttl 64, id 38429, offset 0, flags [DF], proto TCP (6), length 52)
    127.0.0.1.50192 > 127.0.0.1.10750: Flags [.], cksum 0xfe28 (incorrect -> 0xb5dd), seq 1, ack 1, win 512, options [nop,nop,TS val 1296879557 ecr 1296879557], length 0
2022-02-28 05:48:55.333585 IP (tos 0x0, ttl 64, id 38430, offset 0, flags [DF], proto TCP (6), length 55)
    127.0.0.1.50192 > 127.0.0.1.10750: Flags [P.], cksum 0xfe2b (incorrect -> 0xb0d1), seq 1:4, ack 1, win 512, options [nop,nop,TS val 1296879557 ecr 1296879557], length 3
2022-02-28 05:48:55.333597 IP (tos 0x0, ttl 64, id 12642, offset 0, flags [DF], proto TCP (6), length 52)
    127.0.0.1.10750 > 127.0.0.1.50192: Flags [.], cksum 0xfe28 (incorrect -> 0xb5da), seq 1, ack 4, win 512, options [nop,nop,TS val 1296879557 ecr 1296879557], length 0
2022-02-28 05:48:55.333658 IP (tos 0x0, ttl 64, id 12643, offset 0, flags [DF], proto TCP (6), length 54)
    127.0.0.1.10750 > 127.0.0.1.50192: Flags [P.], cksum 0xfe2a (incorrect -> 0xb0d0), seq 1:3, ack 4, win 512, options [nop,nop,TS val 1296879557 ecr 1296879557], length 2
2022-02-28 05:48:55.333678 IP (tos 0x0, ttl 64, id 38431, offset 0, flags [DF], proto TCP (6), length 52)
    127.0.0.1.50192 > 127.0.0.1.10750: Flags [.], cksum 0xfe28 (incorrect -> 0xb5d8), seq 4, ack 3, win 512, options [nop,nop,TS val 1296879557 ecr 1296879557], length 0
2022-02-28 05:48:55.335594 IP (tos 0x0, ttl 64, id 38432, offset 0, flags [DF], proto TCP (6), length 62)
    127.0.0.1.50192 > 127.0.0.1.10750: Flags [P.], cksum 0xfe32 (incorrect -> 0x1cef), seq 4:14, ack 3, win 512, options [nop,nop,TS val 1296879559 ecr 1296879557], length 10
2022-02-28 05:48:55.335602 IP (tos 0x0, ttl 64, id 12644, offset 0, flags [DF], proto TCP (6), length 52)
    127.0.0.1.10750 > 127.0.0.1.50192: Flags [.], cksum 0xfe28 (incorrect -> 0xb5ca), seq 3, ack 14, win 512, options [nop,nop,TS val 1296879559 ecr 1296879559], length 0
2022-02-28 05:48:55.422955 IP (tos 0x0, ttl 64, id 12645, offset 0, flags [DF], proto TCP (6), length 62)
    127.0.0.1.10750 > 127.0.0.1.50192: Flags [P.], cksum 0xfe32 (incorrect -> 0xb060), seq 3:13, ack 14, win 512, options [nop,nop,TS val 1296879646 ecr 1296879559], length 10
2022-02-28 05:48:55.422962 IP (tos 0x0, ttl 64, id 38433, offset 0, flags [DF], proto TCP (6), length 52)
    127.0.0.1.50192 > 127.0.0.1.10750: Flags [.], cksum 0xfe28 (incorrect -> 0xb512), seq 14, ack 13, win 512, options [nop,nop,TS val 1296879646 ecr 1296879646], length 0
2022-02-28 05:48:55.428879 IP (tos 0x0, ttl 64, id 38434, offset 0, flags [DF], proto TCP (6), length 569)
    127.0.0.1.50192 > 127.0.0.1.10750: Flags [P.], cksum 0x002e (incorrect -> 0x61f4), seq 14:531, ack 13, win 512, options [nop,nop,TS val 1296879652 ecr 1296879646], length 517
2022-02-28 05:48:55.428899 IP (tos 0x0, ttl 64, id 12646, offset 0, flags [DF], proto TCP (6), length 52)
    127.0.0.1.10750 > 127.0.0.1.50192: Flags [.], cksum 0xfe28 (incorrect -> 0xb305), seq 13, ack 531, win 508, options [nop,nop,TS val 1296879652 ecr 1296879652], length 0
200, 124.50108695030212, 0.653723955154419