2022-02-28 01:17:38.855734 IP (tos 0x0, ttl 64, id 32212, offset 0, flags [DF], proto TCP (6), length 60)
    127.0.0.1.45556 > 127.0.0.1.10250: Flags [S], cksum 0xfe30 (incorrect -> 0xdb76), seq 3393327150, win 65495, options [mss 65495,sackOK,TS val 1280603079 ecr 0,nop,wscale 7], length 0
2022-02-28 01:17:38.855748 IP (tos 0x0, ttl 64, id 0, offset 0, flags [DF], proto TCP (6), length 60)
    127.0.0.1.10250 > 127.0.0.1.45556: Flags [S.], cksum 0xfe30 (incorrect -> 0x0774), seq 629206625, ack 3393327151, win 65483, options [mss 65495,sackOK,TS val 1280603079 ecr 1280603079,nop,wscale 7], length 0
2022-02-28 01:17:38.855759 IP (tos 0x0, ttl 64, id 32213, offset 0, flags [DF], proto TCP (6), length 52)
    127.0.0.1.45556 > 127.0.0.1.10250: Flags [.], cksum 0xfe28 (incorrect -> 0x2e30), seq 1, ack 1, win 512, options [nop,nop,TS val 1280603079 ecr 1280603079], length 0
2022-02-28 01:17:38.855883 IP (tos 0x0, ttl 64, id 32214, offset 0, flags [DF], proto TCP (6), length 55)
    127.0.0.1.45556 > 127.0.0.1.10250: Flags [P.], cksum 0xfe2b (incorrect -> 0x2924), seq 1:4, ack 1, win 512, options [nop,nop,TS val 1280603079 ecr 1280603079], length 3
2022-02-28 01:17:38.855896 IP (tos 0x0, ttl 64, id 61799, offset 0, flags [DF], proto TCP (6), length 52)
    127.0.0.1.10250 > 127.0.0.1.45556: Flags [.], cksum 0xfe28 (incorrect -> 0x2e2d), seq 1, ack 4, win 512, options [nop,nop,TS val 1280603079 ecr 1280603079], length 0
2022-02-28 01:17:38.855969 IP (tos 0x0, ttl 64, id 61800, offset 0, flags [DF], proto TCP (6), length 54)
    127.0.0.1.10250 > 127.0.0.1.45556: Flags [P.], cksum 0xfe2a (incorrect -> 0x2923), seq 1:3, ack 4, win 512, options [nop,nop,TS val 1280603079 ecr 1280603079], length 2
2022-02-28 01:17:38.855991 IP (tos 0x0, ttl 64, id 32215, offset 0, flags [DF], proto TCP (6), length 52)
    127.0.0.1.45556 > 127.0.0.1.10250: Flags [.], cksum 0xfe28 (incorrect -> 0x2e2b), seq 4, ack 3, win 512, options [nop,nop,TS val 1280603079 ecr 1280603079], length 0
2022-02-28 01:17:38.857719 IP (tos 0x0, ttl 64, id 32216, offset 0, flags [DF], proto TCP (6), length 62)
    127.0.0.1.45556 > 127.0.0.1.10250: Flags [P.], cksum 0xfe32 (incorrect -> 0x7535), seq 4:14, ack 3, win 512, options [nop,nop,TS val 1280603081 ecr 1280603079], length 10
2022-02-28 01:17:38.857730 IP (tos 0x0, ttl 64, id 61801, offset 0, flags [DF], proto TCP (6), length 52)
    127.0.0.1.10250 > 127.0.0.1.45556: Flags [.], cksum 0xfe28 (incorrect -> 0x2e1d), seq 3, ack 14, win 512, options [nop,nop,TS val 1280603081 ecr 1280603081], length 0
2022-02-28 01:17:38.923401 IP (tos 0x0, ttl 64, id 61802, offset 0, flags [DF], proto TCP (6), length 62)
    127.0.0.1.10250 > 127.0.0.1.45556: Flags [P.], cksum 0xfe32 (incorrect -> 0x28c9), seq 3:13, ack 14, win 512, options [nop,nop,TS val 1280603146 ecr 1280603081], length 10
2022-02-28 01:17:38.923410 IP (tos 0x0, ttl 64, id 32217, offset 0, flags [DF], proto TCP (6), length 52)
    127.0.0.1.45556 > 127.0.0.1.10250: Flags [.], cksum 0xfe28 (incorrect -> 0x2d91), seq 14, ack 13, win 512, options [nop,nop,TS val 1280603146 ecr 1280603146], length 0
2022-02-28 01:17:38.930273 IP (tos 0x0, ttl 64, id 32218, offset 0, flags [DF], proto TCP (6), length 569)
    127.0.0.1.45556 > 127.0.0.1.10250: Flags [P.], cksum 0x002e (incorrect -> 0xf09a), seq 14:531, ack 13, win 512, options [nop,nop,TS val 1280603153 ecr 1280603146], length 517
2022-02-28 01:17:38.930286 IP (tos 0x0, ttl 64, id 61803, offset 0, flags [DF], proto TCP (6), length 52)
    127.0.0.1.10250 > 127.0.0.1.45556: Flags [.], cksum 0xfe28 (incorrect -> 0x2b82), seq 13, ack 531, win 508, options [nop,nop,TS val 1280603153 ecr 1280603153], length 0
2022-02-28 01:17:39.017950 IP (tos 0x0, ttl 64, id 61804, offset 0, flags [DF], proto TCP (6), length 3215)
    127.0.0.1.10250 > 127.0.0.1.45556: Flags [P.], cksum 0x0a84 (incorrect -> 0x6892), seq 13:3176, ack 531, win 512, options [nop,nop,TS val 1280603241 ecr 1280603153], length 3163
2022-02-28 01:17:39.017962 IP (tos 0x0, ttl 64, id 32219, offset 0, flags [DF], proto TCP (6), length 52)
    127.0.0.1.45556 > 127.0.0.1.10250: Flags [.], cksum 0xfe28 (incorrect -> 0x1e84), seq 531, ack 3176, win 495, options [nop,nop,TS val 1280603241 ecr 1280603241], length 0
200, 4.757776975631714, 0.593163251876831