2022-02-28 12:44:44.401673 IP (tos 0x0, ttl 64, id 12238, offset 0, flags [DF], proto TCP (6), length 60)
    127.0.0.1.36762 > 127.0.0.1.10650: Flags [S], cksum 0xfe30 (incorrect -> 0x9865), seq 3002825617, win 65495, options [mss 65495,sackOK,TS val 1321828625 ecr 0,nop,wscale 7], length 0
2022-02-28 12:44:44.401684 IP (tos 0x0, ttl 64, id 0, offset 0, flags [DF], proto TCP (6), length 60)
    127.0.0.1.10650 > 127.0.0.1.36762: Flags [S.], cksum 0xfe30 (incorrect -> 0x0015), seq 3439590252, ack 3002825618, win 65483, options [mss 65495,sackOK,TS val 1321828625 ecr 1321828625,nop,wscale 7], length 0
2022-02-28 12:44:44.401695 IP (tos 0x0, ttl 64, id 12239, offset 0, flags [DF], proto TCP (6), length 52)
    127.0.0.1.36762 > 127.0.0.1.10650: Flags [.], cksum 0xfe28 (incorrect -> 0x26d1), seq 1, ack 1, win 512, options [nop,nop,TS val 1321828625 ecr 1321828625], length 0
2022-02-28 12:44:44.401824 IP (tos 0x0, ttl 64, id 12240, offset 0, flags [DF], proto TCP (6), length 55)
    127.0.0.1.36762 > 127.0.0.1.10650: Flags [P.], cksum 0xfe2b (incorrect -> 0x21c5), seq 1:4, ack 1, win 512, options [nop,nop,TS val 1321828625 ecr 1321828625], length 3
2022-02-28 12:44:44.401837 IP (tos 0x0, ttl 64, id 60722, offset 0, flags [DF], proto TCP (6), length 52)
    127.0.0.1.10650 > 127.0.0.1.36762: Flags [.], cksum 0xfe28 (incorrect -> 0x26ce), seq 1, ack 4, win 512, options [nop,nop,TS val 1321828625 ecr 1321828625], length 0
2022-02-28 12:44:44.401899 IP (tos 0x0, ttl 64, id 60723, offset 0, flags [DF], proto TCP (6), length 54)
    127.0.0.1.10650 > 127.0.0.1.36762: Flags [P.], cksum 0xfe2a (incorrect -> 0x21c4), seq 1:3, ack 4, win 512, options [nop,nop,TS val 1321828625 ecr 1321828625], length 2
2022-02-28 12:44:44.401924 IP (tos 0x0, ttl 64, id 12241, offset 0, flags [DF], proto TCP (6), length 52)
    127.0.0.1.36762 > 127.0.0.1.10650: Flags [.], cksum 0xfe28 (incorrect -> 0x26cc), seq 4, ack 3, win 512, options [nop,nop,TS val 1321828625 ecr 1321828625], length 0
2022-02-28 12:44:44.413740 IP (tos 0x0, ttl 64, id 12242, offset 0, flags [DF], proto TCP (6), length 62)
    127.0.0.1.36762 > 127.0.0.1.10650: Flags [P.], cksum 0xfe32 (incorrect -> 0xcd60), seq 4:14, ack 3, win 512, options [nop,nop,TS val 1321828637 ecr 1321828625], length 10
2022-02-28 12:44:44.413766 IP (tos 0x0, ttl 64, id 60724, offset 0, flags [DF], proto TCP (6), length 52)
    127.0.0.1.10650 > 127.0.0.1.36762: Flags [.], cksum 0xfe28 (incorrect -> 0x26aa), seq 3, ack 14, win 512, options [nop,nop,TS val 1321828637 ecr 1321828637], length 0
2022-02-28 12:44:44.462144 IP (tos 0x0, ttl 64, id 60725, offset 0, flags [DF], proto TCP (6), length 62)
    127.0.0.1.10650 > 127.0.0.1.36762: Flags [P.], cksum 0xfe32 (incorrect -> 0x2167), seq 3:13, ack 14, win 512, options [nop,nop,TS val 1321828685 ecr 1321828637], length 10
2022-02-28 12:44:44.462155 IP (tos 0x0, ttl 64, id 12243, offset 0, flags [DF], proto TCP (6), length 52)
    127.0.0.1.36762 > 127.0.0.1.10650: Flags [.], cksum 0xfe28 (incorrect -> 0x2640), seq 14, ack 13, win 512, options [nop,nop,TS val 1321828685 ecr 1321828685], length 0
2022-02-28 12:44:44.468120 IP (tos 0x0, ttl 64, id 12244, offset 0, flags [DF], proto TCP (6), length 569)
    127.0.0.1.36762 > 127.0.0.1.10650: Flags [P.], cksum 0x002e (incorrect -> 0xe641), seq 14:531, ack 13, win 512, options [nop,nop,TS val 1321828691 ecr 1321828685], length 517
2022-02-28 12:44:44.468144 IP (tos 0x0, ttl 64, id 60726, offset 0, flags [DF], proto TCP (6), length 52)
    127.0.0.1.10650 > 127.0.0.1.36762: Flags [.], cksum 0xfe28 (incorrect -> 0x2433), seq 13, ack 531, win 508, options [nop,nop,TS val 1321828691 ecr 1321828691], length 0
2022-02-28 12:44:44.520282 IP (tos 0x0, ttl 64, id 60727, offset 0, flags [DF], proto TCP (6), length 3538)
    127.0.0.1.10650 > 127.0.0.1.36762: Flags [P.], cksum 0x0bc7 (incorrect -> 0xac00), seq 13:3499, ack 531, win 512, options [nop,nop,TS val 1321828743 ecr 1321828691], length 3486
2022-02-28 12:44:44.520298 IP (tos 0x0, ttl 64, id 12245, offset 0, flags [DF], proto TCP (6), length 52)
    127.0.0.1.36762 > 127.0.0.1.10650: Flags [.], cksum 0xfe28 (incorrect -> 0x163b), seq 531, ack 3499, win 494, options [nop,nop,TS val 1321828743 ecr 1321828743], length 0
2022-02-28 12:44:44.520996 IP (tos 0x0, ttl 64, id 12246, offset 0, flags [DF], proto TCP (6), length 132)
    127.0.0.1.36762 > 127.0.0.1.10650: Flags [P.], cksum 0xfe78 (incorrect -> 0xa72b), seq 531:611, ack 3499, win 494, options [nop,nop,TS val 1321828744 ecr 1321828743], length 80
2022-02-28 12:44:44.521005 IP (tos 0x0, ttl 64, id 60728, offset 0, flags [DF], proto TCP (6), length 52)
    127.0.0.1.10650 > 127.0.0.1.36762: Flags [.], cksum 0xfe28 (incorrect -> 0x15d7), seq 3499, ack 611, win 512, options [nop,nop,TS val 1321828744 ecr 1321828744], length 0
2022-02-28 12:44:44.521502 IP (tos 0x0, ttl 64, id 12247, offset 0, flags [DF], proto TCP (6), length 400)
    127.0.0.1.36762 > 127.0.0.1.10650: Flags [P.], cksum 0xff84 (incorrect -> 0x0505), seq 611:959, ack 3499, win 494, options [nop,nop,TS val 1321828745 ecr 1321828744], length 348
2022-02-28 12:44:44.521510 IP (tos 0x0, ttl 64, id 60729, offset 0, flags [DF], proto TCP (6), length 52)
    127.0.0.1.10650 > 127.0.0.1.36762: Flags [.], cksum 0xfe28 (incorrect -> 0x147b), seq 3499, ack 959, win 510, options [nop,nop,TS val 1321828745 ecr 1321828745], length 0
2022-02-28 12:44:44.534055 IP (tos 0x0, ttl 64, id 60730, offset 0, flags [DF], proto TCP (6), length 194)
    127.0.0.1.10650 > 127.0.0.1.36762: Flags [P.], cksum 0xfeb6 (incorrect -> 0x1e61), seq 3499:3641, ack 959, win 512, options [nop,nop,TS val 1321828757 ecr 1321828745], length 142
2022-02-28 12:44:44.534063 IP (tos 0x0, ttl 64, id 12248, offset 0, flags [DF], proto TCP (6), length 52)
    127.0.0.1.36762 > 127.0.0.1.10650: Flags [.], cksum 0xfe28 (incorrect -> 0x13d8), seq 959, ack 3641, win 507, options [nop,nop,TS val 1321828757 ecr 1321828757], length 0
200, 6.707644939422607, 0.3161036968231201