2022-02-28 05:27:20.791483 IP (tos 0x0, ttl 64, id 60585, offset 0, flags [DF], proto TCP (6), length 60)
    127.0.0.1.40378 > 127.0.0.1.11550: Flags [S], cksum 0xfe30 (incorrect -> 0x5905), seq 3765038985, win 65495, options [mss 65495,sackOK,TS val 1295585015 ecr 0,nop,wscale 7], length 0
2022-02-28 05:27:20.791497 IP (tos 0x0, ttl 64, id 0, offset 0, flags [DF], proto TCP (6), length 60)
    127.0.0.1.11550 > 127.0.0.1.40378: Flags [S.], cksum 0xfe30 (incorrect -> 0x6399), seq 2708928447, ack 3765038986, win 65483, options [mss 65495,sackOK,TS val 1295585015 ecr 1295585015,nop,wscale 7], length 0
2022-02-28 05:27:20.791507 IP (tos 0x0, ttl 64, id 60586, offset 0, flags [DF], proto TCP (6), length 52)
    127.0.0.1.40378 > 127.0.0.1.11550: Flags [.], cksum 0xfe28 (incorrect -> 0x8a55), seq 1, ack 1, win 512, options [nop,nop,TS val 1295585015 ecr 1295585015], length 0
2022-02-28 05:27:20.791626 IP (tos 0x0, ttl 64, id 60587, offset 0, flags [DF], proto TCP (6), length 55)
    127.0.0.1.40378 > 127.0.0.1.11550: Flags [P.], cksum 0xfe2b (incorrect -> 0x8549), seq 1:4, ack 1, win 512, options [nop,nop,TS val 1295585015 ecr 1295585015], length 3
2022-02-28 05:27:20.791632 IP (tos 0x0, ttl 64, id 28468, offset 0, flags [DF], proto TCP (6), length 52)
    127.0.0.1.11550 > 127.0.0.1.40378: Flags [.], cksum 0xfe28 (incorrect -> 0x8a52), seq 1, ack 4, win 512, options [nop,nop,TS val 1295585015 ecr 1295585015], length 0
2022-02-28 05:27:20.791695 IP (tos 0x0, ttl 64, id 28469, offset 0, flags [DF], proto TCP (6), length 54)
    127.0.0.1.11550 > 127.0.0.1.40378: Flags [P.], cksum 0xfe2a (incorrect -> 0x8548), seq 1:3, ack 4, win 512, options [nop,nop,TS val 1295585015 ecr 1295585015], length 2
2022-02-28 05:27:20.791701 IP (tos 0x0, ttl 64, id 60588, offset 0, flags [DF], proto TCP (6), length 52)
    127.0.0.1.40378 > 127.0.0.1.11550: Flags [.], cksum 0xfe28 (incorrect -> 0x8a50), seq 4, ack 3, win 512, options [nop,nop,TS val 1295585015 ecr 1295585015], length 0
2022-02-28 05:27:20.805488 IP (tos 0x0, ttl 64, id 60589, offset 0, flags [DF], proto TCP (6), length 62)
    127.0.0.1.40378 > 127.0.0.1.11550: Flags [P.], cksum 0xfe32 (incorrect -> 0x141a), seq 4:14, ack 3, win 512, options [nop,nop,TS val 1295585029 ecr 1295585015], length 10
2022-02-28 05:27:20.805509 IP (tos 0x0, ttl 64, id 28470, offset 0, flags [DF], proto TCP (6), length 52)
    127.0.0.1.11550 > 127.0.0.1.40378: Flags [.], cksum 0xfe28 (incorrect -> 0x8a2a), seq 3, ack 14, win 512, options [nop,nop,TS val 1295585029 ecr 1295585029], length 0
2022-02-28 05:27:20.853991 IP (tos 0x0, ttl 64, id 28471, offset 0, flags [DF], proto TCP (6), length 62)
    127.0.0.1.11550 > 127.0.0.1.40378: Flags [P.], cksum 0xfe32 (incorrect -> 0x84e7), seq 3:13, ack 14, win 512, options [nop,nop,TS val 1295585077 ecr 1295585029], length 10
2022-02-28 05:27:20.854001 IP (tos 0x0, ttl 64, id 60590, offset 0, flags [DF], proto TCP (6), length 52)
    127.0.0.1.40378 > 127.0.0.1.11550: Flags [.], cksum 0xfe28 (incorrect -> 0x89c0), seq 14, ack 13, win 512, options [nop,nop,TS val 1295585077 ecr 1295585077], length 0
2022-02-28 05:27:20.859550 IP (tos 0x0, ttl 64, id 60591, offset 0, flags [DF], proto TCP (6), length 569)
    127.0.0.1.40378 > 127.0.0.1.11550: Flags [P.], cksum 0x002e (incorrect -> 0xb2be), seq 14:531, ack 13, win 512, options [nop,nop,TS val 1295585083 ecr 1295585077], length 517
2022-02-28 05:27:20.859561 IP (tos 0x0, ttl 64, id 28472, offset 0, flags [DF], proto TCP (6), length 52)
    127.0.0.1.11550 > 127.0.0.1.40378: Flags [.], cksum 0xfe28 (incorrect -> 0x87b3), seq 13, ack 531, win 508, options [nop,nop,TS val 1295585083 ecr 1295585083], length 0
2022-02-28 05:27:20.916410 IP (tos 0x0, ttl 64, id 28473, offset 0, flags [DF], proto TCP (6), length 3538)
    127.0.0.1.11550 > 127.0.0.1.40378: Flags [P.], cksum 0x0bc7 (incorrect -> 0x81a0), seq 13:3499, ack 531, win 512, options [nop,nop,TS val 1295585139 ecr 1295585083], length 3486
2022-02-28 05:27:20.916427 IP (tos 0x0, ttl 64, id 60592, offset 0, flags [DF], proto TCP (6), length 52)
    127.0.0.1.40378 > 127.0.0.1.11550: Flags [.], cksum 0xfe28 (incorrect -> 0x79b3), seq 531, ack 3499, win 494, options [nop,nop,TS val 1295585139 ecr 1295585139], length 0
2022-02-28 05:27:20.932622 IP (tos 0x0, ttl 64, id 28474, offset 0, flags [DF], proto TCP (6), length 1494)
    127.0.0.1.11550 > 127.0.0.1.40378: Flags [P.], cksum 0x03cb (incorrect -> 0x6621), seq 3499:4941, ack 531, win 512, options [nop,nop,TS val 1295585156 ecr 1295585139], length 1442
2022-02-28 05:27:20.932628 IP (tos 0x0, ttl 64, id 60593, offset 0, flags [DF], proto TCP (6), length 52)
    127.0.0.1.40378 > 127.0.0.1.11550: Flags [.], cksum 0xfe28 (incorrect -> 0x73e7), seq 531, ack 4941, win 502, options [nop,nop,TS val 1295585156 ecr 1295585156], length 0
2022-02-28 05:27:20.932992 IP (tos 0x0, ttl 64, id 60594, offset 0, flags [DF], proto TCP (6), length 116)
    127.0.0.1.40378 > 127.0.0.1.11550: Flags [P.], cksum 0xfe68 (incorrect -> 0x9398), seq 531:595, ack 4941, win 512, options [nop,nop,TS val 1295585156 ecr 1295585156], length 64
2022-02-28 05:27:20.933002 IP (tos 0x0, ttl 64, id 28475, offset 0, flags [DF], proto TCP (6), length 52)
    127.0.0.1.11550 > 127.0.0.1.40378: Flags [.], cksum 0xfe28 (incorrect -> 0x739d), seq 4941, ack 595, win 512, options [nop,nop,TS val 1295585156 ecr 1295585156], length 0
2022-02-28 05:27:20.933354 IP (tos 0x0, ttl 64, id 60595, offset 0, flags [DF], proto TCP (6), length 312)
    127.0.0.1.40378 > 127.0.0.1.11550: Flags [P.], cksum 0xff2c (incorrect -> 0x291d), seq 595:855, ack 4941, win 512, options [nop,nop,TS val 1295585156 ecr 1295585156], length 260
2022-02-28 05:27:20.933364 IP (tos 0x0, ttl 64, id 28476, offset 0, flags [DF], proto TCP (6), length 52)
    127.0.0.1.11550 > 127.0.0.1.40378: Flags [.], cksum 0xfe28 (incorrect -> 0x729b), seq 4941, ack 855, win 510, options [nop,nop,TS val 1295585156 ecr 1295585156], length 0
200, 4.795549631118774, 0.9454851150512695