2022-02-28 13:38:41.292189 IP (tos 0x0, ttl 64, id 11460, offset 0, flags [DF], proto TCP (6), length 60)
    127.0.0.1.58108 > 127.0.0.1.11350: Flags [S], cksum 0xfe30 (incorrect -> 0x33de), seq 3957779651, win 65495, options [mss 65495,sackOK,TS val 1325065515 ecr 0,nop,wscale 7], length 0
2022-02-28 13:38:41.292203 IP (tos 0x0, ttl 64, id 0, offset 0, flags [DF], proto TCP (6), length 60)
    127.0.0.1.11350 > 127.0.0.1.58108: Flags [S.], cksum 0xfe30 (incorrect -> 0x71e5), seq 244743991, ack 3957779652, win 65483, options [mss 65495,sackOK,TS val 1325065515 ecr 1325065515,nop,wscale 7], length 0
2022-02-28 13:38:41.292213 IP (tos 0x0, ttl 64, id 11461, offset 0, flags [DF], proto TCP (6), length 52)
    127.0.0.1.58108 > 127.0.0.1.11350: Flags [.], cksum 0xfe28 (incorrect -> 0x98a1), seq 1, ack 1, win 512, options [nop,nop,TS val 1325065515 ecr 1325065515], length 0
2022-02-28 13:38:41.292403 IP (tos 0x0, ttl 64, id 11462, offset 0, flags [DF], proto TCP (6), length 55)
    127.0.0.1.58108 > 127.0.0.1.11350: Flags [P.], cksum 0xfe2b (incorrect -> 0x9395), seq 1:4, ack 1, win 512, options [nop,nop,TS val 1325065515 ecr 1325065515], length 3
2022-02-28 13:38:41.292411 IP (tos 0x0, ttl 64, id 55660, offset 0, flags [DF], proto TCP (6), length 52)
    127.0.0.1.11350 > 127.0.0.1.58108: Flags [.], cksum 0xfe28 (incorrect -> 0x989e), seq 1, ack 4, win 512, options [nop,nop,TS val 1325065515 ecr 1325065515], length 0
2022-02-28 13:38:41.292439 IP (tos 0x0, ttl 64, id 55661, offset 0, flags [DF], proto TCP (6), length 54)
    127.0.0.1.11350 > 127.0.0.1.58108: Flags [P.], cksum 0xfe2a (incorrect -> 0x9393), seq 1:3, ack 4, win 512, options [nop,nop,TS val 1325065516 ecr 1325065515], length 2
2022-02-28 13:38:41.292447 IP (tos 0x0, ttl 64, id 11463, offset 0, flags [DF], proto TCP (6), length 52)
    127.0.0.1.58108 > 127.0.0.1.11350: Flags [.], cksum 0xfe28 (incorrect -> 0x989a), seq 4, ack 3, win 512, options [nop,nop,TS val 1325065516 ecr 1325065516], length 0
2022-02-28 13:38:41.294042 IP (tos 0x0, ttl 64, id 11464, offset 0, flags [DF], proto TCP (6), length 62)
    127.0.0.1.58108 > 127.0.0.1.11350: Flags [P.], cksum 0xfe32 (incorrect -> 0x482b), seq 4:14, ack 3, win 512, options [nop,nop,TS val 1325065517 ecr 1325065516], length 10
2022-02-28 13:38:41.294052 IP (tos 0x0, ttl 64, id 55662, offset 0, flags [DF], proto TCP (6), length 52)
    127.0.0.1.11350 > 127.0.0.1.58108: Flags [.], cksum 0xfe28 (incorrect -> 0x988e), seq 3, ack 14, win 512, options [nop,nop,TS val 1325065517 ecr 1325065517], length 0
2022-02-28 13:38:41.337993 IP (tos 0x0, ttl 64, id 55663, offset 0, flags [DF], proto TCP (6), length 62)
    127.0.0.1.11350 > 127.0.0.1.58108: Flags [P.], cksum 0xfe32 (incorrect -> 0x934f), seq 3:13, ack 14, win 512, options [nop,nop,TS val 1325065561 ecr 1325065517], length 10
2022-02-28 13:38:41.338001 IP (tos 0x0, ttl 64, id 11465, offset 0, flags [DF], proto TCP (6), length 52)
    127.0.0.1.58108 > 127.0.0.1.11350: Flags [.], cksum 0xfe28 (incorrect -> 0x982c), seq 14, ack 13, win 512, options [nop,nop,TS val 1325065561 ecr 1325065561], length 0
2022-02-28 13:38:41.345121 IP (tos 0x0, ttl 64, id 11466, offset 0, flags [DF], proto TCP (6), length 569)
    127.0.0.1.58108 > 127.0.0.1.11350: Flags [P.], cksum 0x002e (incorrect -> 0xa389), seq 14:531, ack 13, win 512, options [nop,nop,TS val 1325065568 ecr 1325065561], length 517
2022-02-28 13:38:41.345142 IP (tos 0x0, ttl 64, id 55664, offset 0, flags [DF], proto TCP (6), length 52)
    127.0.0.1.11350 > 127.0.0.1.58108: Flags [.], cksum 0xfe28 (incorrect -> 0x961d), seq 13, ack 531, win 508, options [nop,nop,TS val 1325065568 ecr 1325065568], length 0
2022-02-28 13:38:41.412548 IP (tos 0x0, ttl 64, id 55665, offset 0, flags [DF], proto TCP (6), length 3538)
    127.0.0.1.11350 > 127.0.0.1.58108: Flags [P.], cksum 0x0bc7 (incorrect -> 0xd680), seq 13:3499, ack 531, win 512, options [nop,nop,TS val 1325065636 ecr 1325065568], length 3486
2022-02-28 13:38:41.412558 IP (tos 0x0, ttl 64, id 11467, offset 0, flags [DF], proto TCP (6), length 52)
    127.0.0.1.58108 > 127.0.0.1.11350: Flags [.], cksum 0xfe28 (incorrect -> 0x8805), seq 531, ack 3499, win 494, options [nop,nop,TS val 1325065636 ecr 1325065636], length 0
2022-02-28 13:38:41.421475 IP (tos 0x0, ttl 64, id 55666, offset 0, flags [DF], proto TCP (6), length 541)
    127.0.0.1.11350 > 127.0.0.1.58108: Flags [P.], cksum 0x0012 (incorrect -> 0xfd01), seq 3499:3988, ack 531, win 512, options [nop,nop,TS val 1325065645 ecr 1325065636], length 489
2022-02-28 13:38:41.421482 IP (tos 0x0, ttl 64, id 11468, offset 0, flags [DF], proto TCP (6), length 52)
    127.0.0.1.58108 > 127.0.0.1.11350: Flags [.], cksum 0xfe28 (incorrect -> 0x85fe), seq 531, ack 3988, win 506, options [nop,nop,TS val 1325065645 ecr 1325065645], length 0
2022-02-28 13:38:41.421925 IP (tos 0x0, ttl 64, id 11469, offset 0, flags [DF], proto TCP (6), length 132)
    127.0.0.1.58108 > 127.0.0.1.11350: Flags [P.], cksum 0xfe78 (incorrect -> 0x5631), seq 531:611, ack 3988, win 512, options [nop,nop,TS val 1325065645 ecr 1325065645], length 80
2022-02-28 13:38:41.421936 IP (tos 0x0, ttl 64, id 55667, offset 0, flags [DF], proto TCP (6), length 52)
    127.0.0.1.11350 > 127.0.0.1.58108: Flags [.], cksum 0xfe28 (incorrect -> 0x85a8), seq 3988, ack 611, win 512, options [nop,nop,TS val 1325065645 ecr 1325065645], length 0
2022-02-28 13:38:41.422490 IP (tos 0x0, ttl 64, id 11470, offset 0, flags [DF], proto TCP (6), length 307)
    127.0.0.1.58108 > 127.0.0.1.11350: Flags [P.], cksum 0xff27 (incorrect -> 0x846b), seq 611:866, ack 3988, win 512, options [nop,nop,TS val 1325065646 ecr 1325065645], length 255
2022-02-28 13:38:41.422500 IP (tos 0x0, ttl 64, id 55668, offset 0, flags [DF], proto TCP (6), length 52)
    127.0.0.1.11350 > 127.0.0.1.58108: Flags [.], cksum 0xfe28 (incorrect -> 0x84a8), seq 3988, ack 866, win 511, options [nop,nop,TS val 1325065646 ecr 1325065646], length 0
2022-02-28 13:38:41.472433 IP (tos 0x0, ttl 64, id 55669, offset 0, flags [DF], proto TCP (6), length 323)
    127.0.0.1.11350 > 127.0.0.1.58108: Flags [P.], cksum 0xff37 (incorrect -> 0xedfe), seq 3988:4259, ack 866, win 512, options [nop,nop,TS val 1325065695 ecr 1325065646], length 271
2022-02-28 13:38:41.472444 IP (tos 0x0, ttl 64, id 11471, offset 0, flags [DF], proto TCP (6), length 52)
    127.0.0.1.58108 > 127.0.0.1.11350: Flags [.], cksum 0xfe28 (incorrect -> 0x8337), seq 866, ack 4259, win 510, options [nop,nop,TS val 1325065696 ecr 1325065695], length 0
2022-02-28 13:38:41.492422 IP (tos 0x0, ttl 64, id 55670, offset 0, flags [DF], proto TCP (6), length 323)
    127.0.0.1.11350 > 127.0.0.1.58108: Flags [P.], cksum 0xff37 (incorrect -> 0x0913), seq 4259:4530, ack 866, win 512, options [nop,nop,TS val 1325065715 ecr 1325065696], length 271
2022-02-28 13:38:41.492444 IP (tos 0x0, ttl 64, id 11472, offset 0, flags [DF], proto TCP (6), length 52)
    127.0.0.1.58108 > 127.0.0.1.11350: Flags [.], cksum 0xfe28 (incorrect -> 0x8202), seq 866, ack 4530, win 508, options [nop,nop,TS val 1325065716 ecr 1325065715], length 0
2022-02-28 13:38:41.500960 IP (tos 0x0, ttl 64, id 55671, offset 0, flags [DF], proto TCP (6), length 3538)
    127.0.0.1.11350 > 127.0.0.1.58108: Flags [P.], cksum 0x0bc7 (incorrect -> 0x37fa), seq 4530:8016, ack 866, win 512, options [nop,nop,TS val 1325065724 ecr 1325065716], length 3486
2022-02-28 13:38:41.500970 IP (tos 0x0, ttl 64, id 11473, offset 0, flags [DF], proto TCP (6), length 52)
    127.0.0.1.58108 > 127.0.0.1.11350: Flags [.], cksum 0xfe28 (incorrect -> 0x7461), seq 866, ack 8016, win 494, options [nop,nop,TS val 1325065724 ecr 1325065724], length 0
2022-02-28 13:38:41.506585 IP (tos 0x0, ttl 64, id 55672, offset 0, flags [DF], proto TCP (6), length 4100)
    127.0.0.1.11350 > 127.0.0.1.58108: Flags [P.], cksum 0x0df9 (incorrect -> 0xb1c0), seq 8016:12064, ack 866, win 512, options [nop,nop,TS val 1325065730 ecr 1325065724], length 4048
2022-02-28 13:38:41.506594 IP (tos 0x0, ttl 64, id 11474, offset 0, flags [DF], proto TCP (6), length 52)
    127.0.0.1.58108 > 127.0.0.1.11350: Flags [.], cksum 0xfe28 (incorrect -> 0x6487), seq 866, ack 12064, win 492, options [nop,nop,TS val 1325065730 ecr 1325065730], length 0
2022-02-28 13:38:41.506603 IP (tos 0x0, ttl 64, id 55673, offset 0, flags [DF], proto TCP (6), length 3474)
    127.0.0.1.11350 > 127.0.0.1.58108: Flags [P.], cksum 0x0b87 (incorrect -> 0x312a), seq 12064:15486, ack 866, win 512, options [nop,nop,TS val 1325065730 ecr 1325065730], length 3422
2022-02-28 13:38:41.506607 IP (tos 0x0, ttl 64, id 11475, offset 0, flags [DF], proto TCP (6), length 52)
    127.0.0.1.58108 > 127.0.0.1.11350: Flags [.], cksum 0xfe28 (incorrect -> 0x5737), seq 866, ack 15486, win 478, options [nop,nop,TS val 1325065730 ecr 1325065730], length 0
2022-02-28 13:38:41.509860 IP (tos 0x0, ttl 64, id 55674, offset 0, flags [DF], proto TCP (6), length 1048)
    127.0.0.1.11350 > 127.0.0.1.58108: Flags [P.], cksum 0x020d (incorrect -> 0x8fc7), seq 15486:16482, ack 866, win 512, options [nop,nop,TS val 1325065733 ecr 1325065730], length 996
2022-02-28 13:38:41.509868 IP (tos 0x0, ttl 64, id 11476, offset 0, flags [DF], proto TCP (6), length 52)
    127.0.0.1.58108 > 127.0.0.1.11350: Flags [.], cksum 0xfe28 (incorrect -> 0x5333), seq 866, ack 16482, win 504, options [nop,nop,TS val 1325065733 ecr 1325065733], length 0
2022-02-28 13:38:41.516137 IP (tos 0x0, ttl 64, id 55675, offset 0, flags [DF], proto TCP (6), length 3538)
    127.0.0.1.11350 > 127.0.0.1.58108: Flags [P.], cksum 0x0bc7 (incorrect -> 0x851b), seq 16482:19968, ack 866, win 512, options [nop,nop,TS val 1325065739 ecr 1325065733], length 3486
2022-02-28 13:38:41.516145 IP (tos 0x0, ttl 64, id 11477, offset 0, flags [DF], proto TCP (6), length 52)
    127.0.0.1.58108 > 127.0.0.1.11350: Flags [.], cksum 0xfe28 (incorrect -> 0x4593), seq 866, ack 19968, win 494, options [nop,nop,TS val 1325065739 ecr 1325065739], length 0
2022-02-28 13:38:41.518816 IP (tos 0x0, ttl 64, id 55676, offset 0, flags [DF], proto TCP (6), length 3982)
    127.0.0.1.11350 > 127.0.0.1.58108: Flags [P.], cksum 0x0d83 (incorrect -> 0x846f), seq 19968:23898, ack 866, win 512, options [nop,nop,TS val 1325065742 ecr 1325065739], length 3930
2022-02-28 13:38:41.518825 IP (tos 0x0, ttl 64, id 11478, offset 0, flags [DF], proto TCP (6), length 52)
    127.0.0.1.58108 > 127.0.0.1.11350: Flags [.], cksum 0xfe28 (incorrect -> 0x3635), seq 866, ack 23898, win 492, options [nop,nop,TS val 1325065742 ecr 1325065742], length 0
2022-02-28 13:38:41.520212 IP (tos 0x0, ttl 64, id 55677, offset 0, flags [DF], proto TCP (6), length 3446)
    127.0.0.1.11350 > 127.0.0.1.58108: Flags [P.], cksum 0x0b6b (incorrect -> 0x4683), seq 23898:27292, ack 866, win 512, options [nop,nop,TS val 1325065743 ecr 1325065742], length 3394
2022-02-28 13:38:41.520230 IP (tos 0x0, ttl 64, id 11479, offset 0, flags [DF], proto TCP (6), length 52)
    127.0.0.1.58108 > 127.0.0.1.11350: Flags [.], cksum 0xfe28 (incorrect -> 0x28dd), seq 866, ack 27292, win 512, options [nop,nop,TS val 1325065743 ecr 1325065743], length 0
2022-02-28 13:38:41.520444 IP (tos 0x0, ttl 64, id 55678, offset 0, flags [DF], proto TCP (6), length 956)
    127.0.0.1.11350 > 127.0.0.1.58108: Flags [P.], cksum 0x01b1 (incorrect -> 0x9483), seq 27292:28196, ack 866, win 512, options [nop,nop,TS val 1325065744 ecr 1325065743], length 904
2022-02-28 13:38:41.520459 IP (tos 0x0, ttl 64, id 11480, offset 0, flags [DF], proto TCP (6), length 52)
    127.0.0.1.58108 > 127.0.0.1.11350: Flags [.], cksum 0xfe28 (incorrect -> 0x2553), seq 866, ack 28196, win 512, options [nop,nop,TS val 1325065744 ecr 1325065744], length 0
2022-02-28 13:38:41.524231 IP (tos 0x0, ttl 64, id 55679, offset 0, flags [DF], proto TCP (6), length 3944)
    127.0.0.1.11350 > 127.0.0.1.58108: Flags [P.], cksum 0x0d5d (incorrect -> 0x4b75), seq 28196:32088, ack 866, win 512, options [nop,nop,TS val 1325065747 ecr 1325065744], length 3892
2022-02-28 13:38:41.524278 IP (tos 0x0, ttl 64, id 11481, offset 0, flags [DF], proto TCP (6), length 52)
    127.0.0.1.58108 > 127.0.0.1.11350: Flags [.], cksum 0xfe28 (incorrect -> 0x1619), seq 866, ack 32088, win 512, options [nop,nop,TS val 1325065747 ecr 1325065747], length 0
2022-02-28 13:38:41.524284 IP (tos 0x0, ttl 64, id 55680, offset 0, flags [DF], proto TCP (6), length 3446)
    127.0.0.1.11350 > 127.0.0.1.58108: Flags [P.], cksum 0x0b6b (incorrect -> 0x8eb9), seq 32088:35482, ack 866, win 512, options [nop,nop,TS val 1325065747 ecr 1325065747], length 3394
2022-02-28 13:38:41.524289 IP (tos 0x0, ttl 64, id 11482, offset 0, flags [DF], proto TCP (6), length 52)
    127.0.0.1.58108 > 127.0.0.1.11350: Flags [.], cksum 0xfe28 (incorrect -> 0x08d7), seq 866, ack 35482, win 512, options [nop,nop,TS val 1325065747 ecr 1325065747], length 0
2022-02-28 13:38:41.527720 IP (tos 0x0, ttl 64, id 55681, offset 0, flags [DF], proto TCP (6), length 1952)
    127.0.0.1.11350 > 127.0.0.1.58108: Flags [P.], cksum 0x0595 (incorrect -> 0x3b25), seq 35482:37382, ack 866, win 512, options [nop,nop,TS val 1325065751 ecr 1325065747], length 1900
2022-02-28 13:38:41.528274 IP (tos 0x0, ttl 64, id 11483, offset 0, flags [DF], proto TCP (6), length 52)
    127.0.0.1.58108 > 127.0.0.1.11350: Flags [.], cksum 0xfe28 (incorrect -> 0x0163), seq 866, ack 37382, win 512, options [nop,nop,TS val 1325065751 ecr 1325065751], length 0
2022-02-28 13:38:41.531005 IP (tos 0x0, ttl 64, id 55682, offset 0, flags [DF], proto TCP (6), length 3446)
    127.0.0.1.11350 > 127.0.0.1.58108: Flags [P.], cksum 0x0b6b (incorrect -> 0x6eb4), seq 37382:40776, ack 866, win 512, options [nop,nop,TS val 1325065754 ecr 1325065751], length 3394
2022-02-28 13:38:41.531038 IP (tos 0x0, ttl 64, id 11484, offset 0, flags [DF], proto TCP (6), length 52)
    127.0.0.1.58108 > 127.0.0.1.11350: Flags [.], cksum 0xfe28 (incorrect -> 0xf41a), seq 866, ack 40776, win 512, options [nop,nop,TS val 1325065754 ecr 1325065754], length 0
2022-02-28 13:38:41.536066 IP (tos 0x0, ttl 64, id 55683, offset 0, flags [DF], proto TCP (6), length 4100)
    127.0.0.1.11350 > 127.0.0.1.58108: Flags [P.], cksum 0x0df9 (incorrect -> 0xedb8), seq 40776:44824, ack 866, win 512, options [nop,nop,TS val 1325065759 ecr 1325065754], length 4048
2022-02-28 13:38:41.578156 IP (tos 0x0, ttl 64, id 11485, offset 0, flags [DF], proto TCP (6), length 52)
    127.0.0.1.58108 > 127.0.0.1.11350: Flags [.], cksum 0xfe28 (incorrect -> 0xe416), seq 866, ack 44824, win 512, options [nop,nop,TS val 1325065801 ecr 1325065759], length 0
2022-02-28 13:38:41.578174 IP (tos 0x0, ttl 64, id 55684, offset 0, flags [DF], proto TCP (6), length 26550)
    127.0.0.1.11350 > 127.0.0.1.58108: Flags [P.], cksum 0x65ab (incorrect -> 0xea8b), seq 44824:71322, ack 866, win 512, options [nop,nop,TS val 1325065801 ecr 1325065801], length 26498
2022-02-28 13:38:41.620503 IP (tos 0x0, ttl 64, id 55685, offset 0, flags [DF], proto TCP (6), length 32820)
    127.0.0.1.11350 > 127.0.0.1.58108: Flags [.], cksum 0x7e29 (incorrect -> 0x2dd1), seq 71322:104090, ack 866, win 512, options [nop,nop,TS val 1325065844 ecr 1325065801], length 32768
2022-02-28 13:38:41.620515 IP (tos 0x0, ttl 64, id 11486, offset 0, flags [DF], proto TCP (6), length 52)
    127.0.0.1.58108 > 127.0.0.1.11350: Flags [.], cksum 0xfe28 (incorrect -> 0xfcc3), seq 866, ack 104090, win 379, options [nop,nop,TS val 1325065844 ecr 1325065801], length 0
2022-02-28 13:38:41.620525 IP (tos 0x0, ttl 64, id 55686, offset 0, flags [DF], proto TCP (6), length 496)
    127.0.0.1.11350 > 127.0.0.1.58108: Flags [P.], cksum 0xffe4 (incorrect -> 0xceaa), seq 104090:104534, ack 866, win 512, options [nop,nop,TS val 1325065844 ecr 1325065844], length 444
2022-02-28 13:38:41.622195 IP (tos 0x0, ttl 64, id 11487, offset 0, flags [DF], proto TCP (6), length 52)
    127.0.0.1.58108 > 127.0.0.1.11350: Flags [.], cksum 0xfe28 (incorrect -> 0xfa56), seq 866, ack 104534, win 512, options [nop,nop,TS val 1325065845 ecr 1325065844], length 0
2022-02-28 13:38:41.622284 IP (tos 0x0, ttl 64, id 55687, offset 0, flags [DF], proto TCP (6), length 3040)
    127.0.0.1.11350 > 127.0.0.1.58108: Flags [P.], cksum 0x09d5 (incorrect -> 0x9baf), seq 104534:107522, ack 866, win 512, options [nop,nop,TS val 1325065845 ecr 1325065845], length 2988
2022-02-28 13:38:41.622330 IP (tos 0x0, ttl 64, id 11488, offset 0, flags [DF], proto TCP (6), length 52)
    127.0.0.1.58108 > 127.0.0.1.11350: Flags [.], cksum 0xfe28 (incorrect -> 0xeea9), seq 866, ack 107522, win 512, options [nop,nop,TS val 1325065845 ecr 1325065845], length 0
2022-02-28 13:38:41.623369 IP (tos 0x0, ttl 64, id 55688, offset 0, flags [DF], proto TCP (6), length 4100)
    127.0.0.1.11350 > 127.0.0.1.58108: Flags [P.], cksum 0x0df9 (incorrect -> 0xad1d), seq 107522:111570, ack 866, win 512, options [nop,nop,TS val 1325065846 ecr 1325065845], length 4048
2022-02-28 13:38:41.623738 IP (tos 0x0, ttl 64, id 11489, offset 0, flags [DF], proto TCP (6), length 52)
    127.0.0.1.58108 > 127.0.0.1.11350: Flags [.], cksum 0xfe28 (incorrect -> 0xded6), seq 866, ack 111570, win 512, options [nop,nop,TS val 1325065847 ecr 1325065846], length 0
2022-02-28 13:38:41.623744 IP (tos 0x0, ttl 64, id 55689, offset 0, flags [DF], proto TCP (6), length 2746)
    127.0.0.1.11350 > 127.0.0.1.58108: Flags [P.], cksum 0x08af (incorrect -> 0x57e7), seq 111570:114264, ack 866, win 512, options [nop,nop,TS val 1325065847 ecr 1325065847], length 2694
2022-02-28 13:38:41.623750 IP (tos 0x0, ttl 64, id 11490, offset 0, flags [DF], proto TCP (6), length 52)
    127.0.0.1.58108 > 127.0.0.1.11350: Flags [.], cksum 0xfe28 (incorrect -> 0xd44f), seq 866, ack 114264, win 512, options [nop,nop,TS val 1325065847 ecr 1325065847], length 0
2022-02-28 13:38:41.627303 IP (tos 0x0, ttl 64, id 55690, offset 0, flags [DF], proto TCP (6), length 1546)
    127.0.0.1.11350 > 127.0.0.1.58108: Flags [P.], cksum 0x03ff (incorrect -> 0x6dd9), seq 114264:115758, ack 866, win 512, options [nop,nop,TS val 1325065850 ecr 1325065847], length 1494
2022-02-28 13:38:41.627319 IP (tos 0x0, ttl 64, id 11491, offset 0, flags [DF], proto TCP (6), length 52)
    127.0.0.1.58108 > 127.0.0.1.11350: Flags [.], cksum 0xfe28 (incorrect -> 0xce73), seq 866, ack 115758, win 512, options [nop,nop,TS val 1325065850 ecr 1325065850], length 0
2022-02-28 13:38:41.630965 IP (tos 0x0, ttl 64, id 55691, offset 0, flags [DF], proto TCP (6), length 2266)
    127.0.0.1.11350 > 127.0.0.1.58108: Flags [P.], cksum 0x06cf (incorrect -> 0x6df3), seq 115758:117972, ack 866, win 512, options [nop,nop,TS val 1325065854 ecr 1325065850], length 2214
2022-02-28 13:38:41.630980 IP (tos 0x0, ttl 64, id 11492, offset 0, flags [DF], proto TCP (6), length 52)
    127.0.0.1.58108 > 127.0.0.1.11350: Flags [.], cksum 0xfe28 (incorrect -> 0xc5c5), seq 866, ack 117972, win 512, options [nop,nop,TS val 1325065854 ecr 1325065854], length 0
2022-02-28 13:38:41.632930 IP (tos 0x0, ttl 64, id 55692, offset 0, flags [DF], proto TCP (6), length 3538)
    127.0.0.1.11350 > 127.0.0.1.58108: Flags [P.], cksum 0x0bc7 (incorrect -> 0xbf4f), seq 117972:121458, ack 866, win 512, options [nop,nop,TS val 1325065856 ecr 1325065854], length 3486
2022-02-28 13:38:41.632988 IP (tos 0x0, ttl 64, id 11493, offset 0, flags [DF], proto TCP (6), length 52)
    127.0.0.1.58108 > 127.0.0.1.11350: Flags [.], cksum 0xfe28 (incorrect -> 0xb823), seq 866, ack 121458, win 512, options [nop,nop,TS val 1325065856 ecr 1325065856], length 0
2022-02-28 13:38:41.634625 IP (tos 0x0, ttl 64, id 55693, offset 0, flags [DF], proto TCP (6), length 3852)
    127.0.0.1.11350 > 127.0.0.1.58108: Flags [P.], cksum 0x0d01 (incorrect -> 0x1bf0), seq 121458:125258, ack 866, win 512, options [nop,nop,TS val 1325065858 ecr 1325065856], length 3800
2022-02-28 13:38:41.634649 IP (tos 0x0, ttl 64, id 11494, offset 0, flags [DF], proto TCP (6), length 52)
    127.0.0.1.58108 > 127.0.0.1.11350: Flags [.], cksum 0xfe28 (incorrect -> 0xa947), seq 866, ack 125258, win 512, options [nop,nop,TS val 1325065858 ecr 1325065858], length 0
200, 3.3580715656280518, 0.42932677268981934