2022-02-28 11:33:38.315949 IP (tos 0x0, ttl 64, id 15848, offset 0, flags [DF], proto TCP (6), length 60)
    127.0.0.1.50670 > 127.0.0.1.10850: Flags [S], cksum 0xfe30 (incorrect -> 0x6c30), seq 1855376822, win 65495, options [mss 65495,sackOK,TS val 1317562539 ecr 0,nop,wscale 7], length 0
2022-02-28 11:33:38.315961 IP (tos 0x0, ttl 64, id 0, offset 0, flags [DF], proto TCP (6), length 60)
    127.0.0.1.10850 > 127.0.0.1.50670: Flags [S.], cksum 0xfe30 (incorrect -> 0x8538), seq 3936765208, ack 1855376823, win 65483, options [mss 65495,sackOK,TS val 1317562539 ecr 1317562539,nop,wscale 7], length 0
2022-02-28 11:33:38.315972 IP (tos 0x0, ttl 64, id 15849, offset 0, flags [DF], proto TCP (6), length 52)
    127.0.0.1.50670 > 127.0.0.1.10850: Flags [.], cksum 0xfe28 (incorrect -> 0xabf4), seq 1, ack 1, win 512, options [nop,nop,TS val 1317562539 ecr 1317562539], length 0
2022-02-28 11:33:38.316083 IP (tos 0x0, ttl 64, id 15850, offset 0, flags [DF], proto TCP (6), length 55)
    127.0.0.1.50670 > 127.0.0.1.10850: Flags [P.], cksum 0xfe2b (incorrect -> 0xa6e8), seq 1:4, ack 1, win 512, options [nop,nop,TS val 1317562539 ecr 1317562539], length 3
2022-02-28 11:33:38.316094 IP (tos 0x0, ttl 64, id 34988, offset 0, flags [DF], proto TCP (6), length 52)
    127.0.0.1.10850 > 127.0.0.1.50670: Flags [.], cksum 0xfe28 (incorrect -> 0xabf1), seq 1, ack 4, win 512, options [nop,nop,TS val 1317562539 ecr 1317562539], length 0
2022-02-28 11:33:38.316136 IP (tos 0x0, ttl 64, id 34989, offset 0, flags [DF], proto TCP (6), length 54)
    127.0.0.1.10850 > 127.0.0.1.50670: Flags [P.], cksum 0xfe2a (incorrect -> 0xa6e7), seq 1:3, ack 4, win 512, options [nop,nop,TS val 1317562539 ecr 1317562539], length 2
2022-02-28 11:33:38.316148 IP (tos 0x0, ttl 64, id 15851, offset 0, flags [DF], proto TCP (6), length 52)
    127.0.0.1.50670 > 127.0.0.1.10850: Flags [.], cksum 0xfe28 (incorrect -> 0xabef), seq 4, ack 3, win 512, options [nop,nop,TS val 1317562539 ecr 1317562539], length 0
2022-02-28 11:33:38.361527 IP (tos 0x0, ttl 64, id 15852, offset 0, flags [DF], proto TCP (6), length 62)
    127.0.0.1.50670 > 127.0.0.1.10850: Flags [P.], cksum 0xfe32 (incorrect -> 0x88aa), seq 4:14, ack 3, win 512, options [nop,nop,TS val 1317562585 ecr 1317562539], length 10
2022-02-28 11:33:38.361544 IP (tos 0x0, ttl 64, id 34990, offset 0, flags [DF], proto TCP (6), length 52)
    127.0.0.1.10850 > 127.0.0.1.50670: Flags [.], cksum 0xfe28 (incorrect -> 0xab89), seq 3, ack 14, win 512, options [nop,nop,TS val 1317562585 ecr 1317562585], length 0
2022-02-28 11:33:38.928120 IP (tos 0x0, ttl 64, id 34991, offset 0, flags [DF], proto TCP (6), length 62)
    127.0.0.1.10850 > 127.0.0.1.50670: Flags [P.], cksum 0xfe32 (incorrect -> 0xa440), seq 3:13, ack 14, win 512, options [nop,nop,TS val 1317563151 ecr 1317562585], length 10
2022-02-28 11:33:38.928130 IP (tos 0x0, ttl 64, id 15853, offset 0, flags [DF], proto TCP (6), length 52)
    127.0.0.1.50670 > 127.0.0.1.10850: Flags [.], cksum 0xfe28 (incorrect -> 0xa713), seq 14, ack 13, win 512, options [nop,nop,TS val 1317563151 ecr 1317563151], length 0
2022-02-28 11:33:38.934230 IP (tos 0x0, ttl 64, id 15854, offset 0, flags [DF], proto TCP (6), length 569)
    127.0.0.1.50670 > 127.0.0.1.10850: Flags [P.], cksum 0x002e (incorrect -> 0x5d50), seq 14:531, ack 13, win 512, options [nop,nop,TS val 1317563157 ecr 1317563151], length 517
2022-02-28 11:33:38.934237 IP (tos 0x0, ttl 64, id 34992, offset 0, flags [DF], proto TCP (6), length 52)
    127.0.0.1.10850 > 127.0.0.1.50670: Flags [.], cksum 0xfe28 (incorrect -> 0xa506), seq 13, ack 531, win 508, options [nop,nop,TS val 1317563157 ecr 1317563157], length 0
2022-02-28 11:33:39.294368 IP (tos 0x0, ttl 64, id 34993, offset 0, flags [DF], proto TCP (6), length 3263)
    127.0.0.1.10850 > 127.0.0.1.50670: Flags [P.], cksum 0x0ab4 (incorrect -> 0x0e18), seq 13:3224, ack 531, win 512, options [nop,nop,TS val 1317563517 ecr 1317563157], length 3211
2022-02-28 11:33:39.294376 IP (tos 0x0, ttl 64, id 15855, offset 0, flags [DF], proto TCP (6), length 52)
    127.0.0.1.50670 > 127.0.0.1.10850: Flags [.], cksum 0xfe28 (incorrect -> 0x95b8), seq 531, ack 3224, win 495, options [nop,nop,TS val 1317563517 ecr 1317563517], length 0
2022-02-28 11:33:39.294923 IP (tos 0x0, ttl 64, id 15856, offset 0, flags [DF], proto TCP (6), length 145)
    127.0.0.1.50670 > 127.0.0.1.10850: Flags [P.], cksum 0xfe85 (incorrect -> 0x5d1f), seq 531:624, ack 3224, win 512, options [nop,nop,TS val 1317563518 ecr 1317563517], length 93
2022-02-28 11:33:39.294930 IP (tos 0x0, ttl 64, id 34994, offset 0, flags [DF], proto TCP (6), length 52)
    127.0.0.1.10850 > 127.0.0.1.50670: Flags [.], cksum 0xfe28 (incorrect -> 0x9548), seq 3224, ack 624, win 512, options [nop,nop,TS val 1317563518 ecr 1317563518], length 0
2022-02-28 11:33:40.409551 IP (tos 0x0, ttl 64, id 34995, offset 0, flags [DF], proto TCP (6), length 310)
    127.0.0.1.10850 > 127.0.0.1.50670: Flags [P.], cksum 0xff2a (incorrect -> 0xb33f), seq 3224:3482, ack 624, win 512, options [nop,nop,TS val 1317564633 ecr 1317563518], length 258
2022-02-28 11:33:40.409561 IP (tos 0x0, ttl 64, id 15857, offset 0, flags [DF], proto TCP (6), length 52)
    127.0.0.1.50670 > 127.0.0.1.10850: Flags [.], cksum 0xfe28 (incorrect -> 0x8b92), seq 624, ack 3482, win 510, options [nop,nop,TS val 1317564633 ecr 1317564633], length 0
2022-02-28 11:33:40.410142 IP (tos 0x0, ttl 64, id 15858, offset 0, flags [DF], proto TCP (6), length 356)
    127.0.0.1.50670 > 127.0.0.1.10850: Flags [P.], cksum 0xff58 (incorrect -> 0xf1de), seq 624:928, ack 3482, win 512, options [nop,nop,TS val 1317564633 ecr 1317564633], length 304
2022-02-28 11:33:40.410149 IP (tos 0x0, ttl 64, id 34996, offset 0, flags [DF], proto TCP (6), length 52)
    127.0.0.1.10850 > 127.0.0.1.50670: Flags [.], cksum 0xfe28 (incorrect -> 0x8a62), seq 3482, ack 928, win 510, options [nop,nop,TS val 1317564633 ecr 1317564633], length 0
2022-02-28 11:33:40.967860 IP (tos 0x0, ttl 64, id 34997, offset 0, flags [DF], proto TCP (6), length 220)
    127.0.0.1.10850 > 127.0.0.1.50670: Flags [P.], cksum 0xfed0 (incorrect -> 0x1bc6), seq 3482:3650, ack 928, win 512, options [nop,nop,TS val 1317565191 ecr 1317564633], length 168
2022-02-28 11:33:40.970281 IP (tos 0x0, ttl 64, id 15544, offset 0, flags [DF], proto TCP (6), length 60)
    127.0.0.1.50674 > 127.0.0.1.10850: Flags [S], cksum 0xfe30 (incorrect -> 0xb460), seq 4063754114, win 65495, options [mss 65495,sackOK,TS val 1317565193 ecr 0,nop,wscale 7], length 0
2022-02-28 11:33:40.970294 IP (tos 0x0, ttl 64, id 0, offset 0, flags [DF], proto TCP (6), length 60)
    127.0.0.1.10850 > 127.0.0.1.50674: Flags [S.], cksum 0xfe30 (incorrect -> 0xa9c9), seq 2927270533, ack 4063754115, win 65483, options [mss 65495,sackOK,TS val 1317565193 ecr 1317565193,nop,wscale 7], length 0
2022-02-28 11:33:40.970304 IP (tos 0x0, ttl 64, id 15545, offset 0, flags [DF], proto TCP (6), length 52)
    127.0.0.1.50674 > 127.0.0.1.10850: Flags [.], cksum 0xfe28 (incorrect -> 0xd085), seq 1, ack 1, win 512, options [nop,nop,TS val 1317565193 ecr 1317565193], length 0
2022-02-28 11:33:40.970376 IP (tos 0x0, ttl 64, id 15546, offset 0, flags [DF], proto TCP (6), length 55)
    127.0.0.1.50674 > 127.0.0.1.10850: Flags [P.], cksum 0xfe2b (incorrect -> 0xcb79), seq 1:4, ack 1, win 512, options [nop,nop,TS val 1317565193 ecr 1317565193], length 3
2022-02-28 11:33:40.970388 IP (tos 0x0, ttl 64, id 47309, offset 0, flags [DF], proto TCP (6), length 52)
    127.0.0.1.10850 > 127.0.0.1.50674: Flags [.], cksum 0xfe28 (incorrect -> 0xd082), seq 1, ack 4, win 512, options [nop,nop,TS val 1317565193 ecr 1317565193], length 0
2022-02-28 11:33:40.970412 IP (tos 0x0, ttl 64, id 47310, offset 0, flags [DF], proto TCP (6), length 54)
    127.0.0.1.10850 > 127.0.0.1.50674: Flags [P.], cksum 0xfe2a (incorrect -> 0xcb78), seq 1:3, ack 4, win 512, options [nop,nop,TS val 1317565193 ecr 1317565193], length 2
2022-02-28 11:33:40.970421 IP (tos 0x0, ttl 64, id 15547, offset 0, flags [DF], proto TCP (6), length 52)
    127.0.0.1.50674 > 127.0.0.1.10850: Flags [.], cksum 0xfe28 (incorrect -> 0xd080), seq 4, ack 3, win 512, options [nop,nop,TS val 1317565193 ecr 1317565193], length 0
2022-02-28 11:33:41.010143 IP (tos 0x0, ttl 64, id 15859, offset 0, flags [DF], proto TCP (6), length 52)
    127.0.0.1.50670 > 127.0.0.1.10850: Flags [.], cksum 0xfe28 (incorrect -> 0x8532), seq 928, ack 3650, win 512, options [nop,nop,TS val 1317565233 ecr 1317565191], length 0
2022-02-28 11:33:41.014292 IP (tos 0x0, ttl 64, id 15548, offset 0, flags [DF], proto TCP (6), length 62)
    127.0.0.1.50674 > 127.0.0.1.10850: Flags [P.], cksum 0xfe32 (incorrect -> 0x5d6f), seq 4:14, ack 3, win 512, options [nop,nop,TS val 1317565237 ecr 1317565193], length 10
2022-02-28 11:33:41.014299 IP (tos 0x0, ttl 64, id 47311, offset 0, flags [DF], proto TCP (6), length 52)
    127.0.0.1.10850 > 127.0.0.1.50674: Flags [.], cksum 0xfe28 (incorrect -> 0xd01e), seq 3, ack 14, win 512, options [nop,nop,TS val 1317565237 ecr 1317565237], length 0
2022-02-28 11:33:41.158504 IP (tos 0x0, ttl 64, id 47312, offset 0, flags [DF], proto TCP (6), length 62)
    127.0.0.1.10850 > 127.0.0.1.50674: Flags [P.], cksum 0xfe32 (incorrect -> 0xca7a), seq 3:13, ack 14, win 512, options [nop,nop,TS val 1317565382 ecr 1317565237], length 10
2022-02-28 11:33:41.158511 IP (tos 0x0, ttl 64, id 15549, offset 0, flags [DF], proto TCP (6), length 52)
    127.0.0.1.50674 > 127.0.0.1.10850: Flags [.], cksum 0xfe28 (incorrect -> 0xcef2), seq 14, ack 13, win 512, options [nop,nop,TS val 1317565382 ecr 1317565382], length 0
2022-02-28 11:33:41.163878 IP (tos 0x0, ttl 64, id 15550, offset 0, flags [DF], proto TCP (6), length 569)
    127.0.0.1.50674 > 127.0.0.1.10850: Flags [P.], cksum 0x002e (incorrect -> 0x9926), seq 14:531, ack 13, win 512, options [nop,nop,TS val 1317565387 ecr 1317565382], length 517
2022-02-28 11:33:41.163886 IP (tos 0x0, ttl 64, id 47313, offset 0, flags [DF], proto TCP (6), length 52)
    127.0.0.1.10850 > 127.0.0.1.50674: Flags [.], cksum 0xfe28 (incorrect -> 0xcce7), seq 13, ack 531, win 508, options [nop,nop,TS val 1317565387 ecr 1317565387], length 0
2022-02-28 11:33:41.349582 IP (tos 0x0, ttl 64, id 47314, offset 0, flags [DF], proto TCP (6), length 3263)
    127.0.0.1.10850 > 127.0.0.1.50674: Flags [P.], cksum 0x0ab4 (incorrect -> 0x106c), seq 13:3224, ack 531, win 512, options [nop,nop,TS val 1317565573 ecr 1317565387], length 3211
2022-02-28 11:33:41.349587 IP (tos 0x0, ttl 64, id 15551, offset 0, flags [DF], proto TCP (6), length 52)
    127.0.0.1.50674 > 127.0.0.1.10850: Flags [.], cksum 0xfe28 (incorrect -> 0xbef5), seq 531, ack 3224, win 495, options [nop,nop,TS val 1317565573 ecr 1317565573], length 0
2022-02-28 11:33:41.350004 IP (tos 0x0, ttl 64, id 15552, offset 0, flags [DF], proto TCP (6), length 145)
    127.0.0.1.50674 > 127.0.0.1.10850: Flags [P.], cksum 0xfe85 (incorrect -> 0xb393), seq 531:624, ack 3224, win 512, options [nop,nop,TS val 1317565573 ecr 1317565573], length 93
2022-02-28 11:33:41.350011 IP (tos 0x0, ttl 64, id 47315, offset 0, flags [DF], proto TCP (6), length 52)
    127.0.0.1.10850 > 127.0.0.1.50674: Flags [.], cksum 0xfe28 (incorrect -> 0xbe87), seq 3224, ack 624, win 512, options [nop,nop,TS val 1317565573 ecr 1317565573], length 0
2022-02-28 11:33:41.519852 IP (tos 0x0, ttl 64, id 47316, offset 0, flags [DF], proto TCP (6), length 310)
    127.0.0.1.10850 > 127.0.0.1.50674: Flags [P.], cksum 0xff2a (incorrect -> 0x3437), seq 3224:3482, ack 624, win 512, options [nop,nop,TS val 1317565743 ecr 1317565573], length 258
2022-02-28 11:33:41.519857 IP (tos 0x0, ttl 64, id 15553, offset 0, flags [DF], proto TCP (6), length 52)
    127.0.0.1.50674 > 127.0.0.1.10850: Flags [.], cksum 0xfe28 (incorrect -> 0xbc33), seq 624, ack 3482, win 510, options [nop,nop,TS val 1317565743 ecr 1317565743], length 0
2022-02-28 11:33:41.520145 IP (tos 0x0, ttl 64, id 15554, offset 0, flags [DF], proto TCP (6), length 352)
    127.0.0.1.50674 > 127.0.0.1.10850: Flags [P.], cksum 0xff54 (incorrect -> 0x3a78), seq 624:924, ack 3482, win 512, options [nop,nop,TS val 1317565743 ecr 1317565743], length 300
2022-02-28 11:33:41.520152 IP (tos 0x0, ttl 64, id 47317, offset 0, flags [DF], proto TCP (6), length 52)
    127.0.0.1.10850 > 127.0.0.1.50674: Flags [.], cksum 0xfe28 (incorrect -> 0xbb07), seq 3482, ack 924, win 510, options [nop,nop,TS val 1317565743 ecr 1317565743], length 0
200, 132.16921734809875, 3.804075002670288