2022-02-28 06:49:19.453695 IP (tos 0x0, ttl 64, id 49358, offset 0, flags [DF], proto TCP (6), length 60)
    127.0.0.1.36692 > 127.0.0.1.12150: Flags [S], cksum 0xfe30 (incorrect -> 0x665b), seq 962955125, win 65495, options [mss 65495,sackOK,TS val 1300503677 ecr 0,nop,wscale 7], length 0
2022-02-28 06:49:19.453706 IP (tos 0x0, ttl 64, id 0, offset 0, flags [DF], proto TCP (6), length 60)
    127.0.0.1.12150 > 127.0.0.1.36692: Flags [S.], cksum 0xfe30 (incorrect -> 0x251e), seq 1092523544, ack 962955126, win 65483, options [mss 65495,sackOK,TS val 1300503677 ecr 1300503677,nop,wscale 7], length 0
2022-02-28 06:49:19.453715 IP (tos 0x0, ttl 64, id 49359, offset 0, flags [DF], proto TCP (6), length 52)
    127.0.0.1.36692 > 127.0.0.1.12150: Flags [.], cksum 0xfe28 (incorrect -> 0x4bda), seq 1, ack 1, win 512, options [nop,nop,TS val 1300503677 ecr 1300503677], length 0
2022-02-28 06:49:19.453830 IP (tos 0x0, ttl 64, id 49360, offset 0, flags [DF], proto TCP (6), length 55)
    127.0.0.1.36692 > 127.0.0.1.12150: Flags [P.], cksum 0xfe2b (incorrect -> 0x46ce), seq 1:4, ack 1, win 512, options [nop,nop,TS val 1300503677 ecr 1300503677], length 3
2022-02-28 06:49:19.453842 IP (tos 0x0, ttl 64, id 61956, offset 0, flags [DF], proto TCP (6), length 52)
    127.0.0.1.12150 > 127.0.0.1.36692: Flags [.], cksum 0xfe28 (incorrect -> 0x4bd7), seq 1, ack 4, win 512, options [nop,nop,TS val 1300503677 ecr 1300503677], length 0
2022-02-28 06:49:19.453873 IP (tos 0x0, ttl 64, id 61957, offset 0, flags [DF], proto TCP (6), length 54)
    127.0.0.1.12150 > 127.0.0.1.36692: Flags [P.], cksum 0xfe2a (incorrect -> 0x46cd), seq 1:3, ack 4, win 512, options [nop,nop,TS val 1300503677 ecr 1300503677], length 2
2022-02-28 06:49:19.453885 IP (tos 0x0, ttl 64, id 49361, offset 0, flags [DF], proto TCP (6), length 52)
    127.0.0.1.36692 > 127.0.0.1.12150: Flags [.], cksum 0xfe28 (incorrect -> 0x4bd5), seq 4, ack 3, win 512, options [nop,nop,TS val 1300503677 ecr 1300503677], length 0
2022-02-28 06:49:19.456021 IP (tos 0x0, ttl 64, id 49362, offset 0, flags [DF], proto TCP (6), length 62)
    127.0.0.1.36692 > 127.0.0.1.12150: Flags [P.], cksum 0xfe32 (incorrect -> 0xf38e), seq 4:14, ack 3, win 512, options [nop,nop,TS val 1300503679 ecr 1300503677], length 10
2022-02-28 06:49:19.456042 IP (tos 0x0, ttl 64, id 61958, offset 0, flags [DF], proto TCP (6), length 52)
    127.0.0.1.12150 > 127.0.0.1.36692: Flags [.], cksum 0xfe28 (incorrect -> 0x4bc7), seq 3, ack 14, win 512, options [nop,nop,TS val 1300503679 ecr 1300503679], length 0
2022-02-28 06:49:19.521866 IP (tos 0x0, ttl 64, id 61959, offset 0, flags [DF], proto TCP (6), length 62)
    127.0.0.1.12150 > 127.0.0.1.36692: Flags [P.], cksum 0xfe32 (incorrect -> 0x4672), seq 3:13, ack 14, win 512, options [nop,nop,TS val 1300503745 ecr 1300503679], length 10
2022-02-28 06:49:19.521883 IP (tos 0x0, ttl 64, id 49363, offset 0, flags [DF], proto TCP (6), length 52)
    127.0.0.1.36692 > 127.0.0.1.12150: Flags [.], cksum 0xfe28 (incorrect -> 0x4b39), seq 14, ack 13, win 512, options [nop,nop,TS val 1300503745 ecr 1300503745], length 0
2022-02-28 06:49:19.528176 IP (tos 0x0, ttl 64, id 49364, offset 0, flags [DF], proto TCP (6), length 569)
    127.0.0.1.36692 > 127.0.0.1.12150: Flags [P.], cksum 0x002e (incorrect -> 0xa179), seq 14:531, ack 13, win 512, options [nop,nop,TS val 1300503751 ecr 1300503745], length 517
2022-02-28 06:49:19.528187 IP (tos 0x0, ttl 64, id 61960, offset 0, flags [DF], proto TCP (6), length 52)
    127.0.0.1.12150 > 127.0.0.1.36692: Flags [.], cksum 0xfe28 (incorrect -> 0x492c), seq 13, ack 531, win 508, options [nop,nop,TS val 1300503751 ecr 1300503751], length 0
2022-02-28 06:49:19.594676 IP (tos 0x0, ttl 64, id 61961, offset 0, flags [DF], proto TCP (6), length 3538)
    127.0.0.1.12150 > 127.0.0.1.36692: Flags [P.], cksum 0x0bc7 (incorrect -> 0x54df), seq 13:3499, ack 531, win 512, options [nop,nop,TS val 1300503818 ecr 1300503751], length 3486
2022-02-28 06:49:19.594695 IP (tos 0x0, ttl 64, id 49365, offset 0, flags [DF], proto TCP (6), length 52)
    127.0.0.1.36692 > 127.0.0.1.12150: Flags [.], cksum 0xfe28 (incorrect -> 0x3b16), seq 531, ack 3499, win 494, options [nop,nop,TS val 1300503818 ecr 1300503818], length 0
2022-02-28 06:49:19.653374 IP (tos 0x0, ttl 64, id 61962, offset 0, flags [DF], proto TCP (6), length 272)
    127.0.0.1.12150 > 127.0.0.1.36692: Flags [P.], cksum 0xff04 (incorrect -> 0x11b0), seq 3499:3719, ack 531, win 512, options [nop,nop,TS val 1300503876 ecr 1300503818], length 220
2022-02-28 06:49:19.653383 IP (tos 0x0, ttl 64, id 49366, offset 0, flags [DF], proto TCP (6), length 52)
    127.0.0.1.36692 > 127.0.0.1.12150: Flags [.], cksum 0xfe28 (incorrect -> 0x39b9), seq 531, ack 3719, win 507, options [nop,nop,TS val 1300503876 ecr 1300503876], length 0
2022-02-28 06:49:19.653455 IP (tos 0x0, ttl 64, id 49367, offset 0, flags [DF], proto TCP (6), length 132)
    127.0.0.1.36692 > 127.0.0.1.12150: Flags [P.], cksum 0xfe78 (incorrect -> 0xa232), seq 531:611, ack 3719, win 507, options [nop,nop,TS val 1300503877 ecr 1300503876], length 80
2022-02-28 06:49:19.653462 IP (tos 0x0, ttl 64, id 61963, offset 0, flags [DF], proto TCP (6), length 52)
    127.0.0.1.12150 > 127.0.0.1.36692: Flags [.], cksum 0xfe28 (incorrect -> 0x3962), seq 3719, ack 611, win 512, options [nop,nop,TS val 1300503877 ecr 1300503877], length 0
2022-02-28 06:49:19.653816 IP (tos 0x0, ttl 64, id 49368, offset 0, flags [DF], proto TCP (6), length 352)
    127.0.0.1.36692 > 127.0.0.1.12150: Flags [P.], cksum 0xff54 (incorrect -> 0x268e), seq 611:911, ack 3719, win 507, options [nop,nop,TS val 1300503877 ecr 1300503877], length 300
2022-02-28 06:49:19.653826 IP (tos 0x0, ttl 64, id 61964, offset 0, flags [DF], proto TCP (6), length 52)
    127.0.0.1.12150 > 127.0.0.1.36692: Flags [.], cksum 0xfe28 (incorrect -> 0x3838), seq 3719, ack 911, win 510, options [nop,nop,TS val 1300503877 ecr 1300503877], length 0
2022-02-28 06:49:20.308646 IP (tos 0x0, ttl 64, id 61965, offset 0, flags [DF], proto TCP (6), length 1736)
    127.0.0.1.12150 > 127.0.0.1.36692: Flags [P.], cksum 0x04bd (incorrect -> 0x8da2), seq 3719:5403, ack 911, win 512, options [nop,nop,TS val 1300504532 ecr 1300503877], length 1684
2022-02-28 06:49:20.308658 IP (tos 0x0, ttl 64, id 49369, offset 0, flags [DF], proto TCP (6), length 52)
    127.0.0.1.36692 > 127.0.0.1.12150: Flags [.], cksum 0xfe28 (incorrect -> 0x2c8f), seq 911, ack 5403, win 501, options [nop,nop,TS val 1300504532 ecr 1300504532], length 0
2022-02-28 06:49:20.326409 IP (tos 0x0, ttl 64, id 61966, offset 0, flags [DF], proto TCP (6), length 3538)
    127.0.0.1.12150 > 127.0.0.1.36692: Flags [P.], cksum 0x0bc7 (incorrect -> 0xb475), seq 5403:8889, ack 911, win 512, options [nop,nop,TS val 1300504549 ecr 1300504532], length 3486
2022-02-28 06:49:20.326418 IP (tos 0x0, ttl 64, id 49370, offset 0, flags [DF], proto TCP (6), length 52)
    127.0.0.1.36692 > 127.0.0.1.12150: Flags [.], cksum 0xfe28 (incorrect -> 0x1ed6), seq 911, ack 8889, win 494, options [nop,nop,TS val 1300504549 ecr 1300504549], length 0
2022-02-28 06:49:20.326459 IP (tos 0x0, ttl 64, id 61967, offset 0, flags [DF], proto TCP (6), length 4036)
    127.0.0.1.12150 > 127.0.0.1.36692: Flags [P.], cksum 0x0db9 (incorrect -> 0x6e8e), seq 8889:12873, ack 911, win 512, options [nop,nop,TS val 1300504550 ecr 1300504549], length 3984
2022-02-28 06:49:20.326464 IP (tos 0x0, ttl 64, id 49371, offset 0, flags [DF], proto TCP (6), length 52)
    127.0.0.1.36692 > 127.0.0.1.12150: Flags [.], cksum 0xfe28 (incorrect -> 0x0f54), seq 911, ack 12873, win 478, options [nop,nop,TS val 1300504550 ecr 1300504550], length 0
2022-02-28 06:49:20.343090 IP (tos 0x0, ttl 64, id 61968, offset 0, flags [DF], proto TCP (6), length 952)
    127.0.0.1.12150 > 127.0.0.1.36692: Flags [P.], cksum 0x01ad (incorrect -> 0x04f6), seq 12873:13773, ack 911, win 512, options [nop,nop,TS val 1300504566 ecr 1300504550], length 900
2022-02-28 06:49:20.343097 IP (tos 0x0, ttl 64, id 49372, offset 0, flags [DF], proto TCP (6), length 52)
    127.0.0.1.36692 > 127.0.0.1.12150: Flags [.], cksum 0xfe28 (incorrect -> 0x0b96), seq 911, ack 13773, win 504, options [nop,nop,TS val 1300504566 ecr 1300504566], length 0
2022-02-28 06:49:20.402657 IP (tos 0x0, ttl 64, id 61969, offset 0, flags [DF], proto TCP (6), length 2948)
    127.0.0.1.12150 > 127.0.0.1.36692: Flags [P.], cksum 0x0979 (incorrect -> 0xac09), seq 13773:16669, ack 911, win 512, options [nop,nop,TS val 1300504626 ecr 1300504566], length 2896
2022-02-28 06:49:20.402664 IP (tos 0x0, ttl 64, id 49373, offset 0, flags [DF], proto TCP (6), length 52)
    127.0.0.1.36692 > 127.0.0.1.12150: Flags [.], cksum 0xfe28 (incorrect -> 0xffd5), seq 911, ack 16669, win 496, options [nop,nop,TS val 1300504626 ecr 1300504626], length 0
2022-02-28 06:49:20.412191 IP (tos 0x0, ttl 64, id 61970, offset 0, flags [DF], proto TCP (6), length 3446)
    127.0.0.1.12150 > 127.0.0.1.36692: Flags [P.], cksum 0x0b6b (incorrect -> 0x0b7e), seq 16669:20063, ack 911, win 512, options [nop,nop,TS val 1300504635 ecr 1300504626], length 3394
2022-02-28 06:49:20.412205 IP (tos 0x0, ttl 64, id 49374, offset 0, flags [DF], proto TCP (6), length 52)
    127.0.0.1.36692 > 127.0.0.1.12150: Flags [.], cksum 0xfe28 (incorrect -> 0xf283), seq 911, ack 20063, win 494, options [nop,nop,TS val 1300504635 ecr 1300504635], length 0
2022-02-28 06:49:20.413108 IP (tos 0x0, ttl 64, id 61971, offset 0, flags [DF], proto TCP (6), length 3638)
    127.0.0.1.12150 > 127.0.0.1.36692: Flags [P.], cksum 0x0c2b (incorrect -> 0x24e8), seq 20063:23649, ack 911, win 512, options [nop,nop,TS val 1300504636 ecr 1300504635], length 3586
2022-02-28 06:49:20.413114 IP (tos 0x0, ttl 64, id 49375, offset 0, flags [DF], proto TCP (6), length 52)
    127.0.0.1.36692 > 127.0.0.1.12150: Flags [.], cksum 0xfe28 (incorrect -> 0xe480), seq 911, ack 23649, win 493, options [nop,nop,TS val 1300504636 ecr 1300504636], length 0
2022-02-28 06:49:20.418778 IP (tos 0x0, ttl 64, id 61972, offset 0, flags [DF], proto TCP (6), length 3446)
    127.0.0.1.12150 > 127.0.0.1.36692: Flags [P.], cksum 0x0b6b (incorrect -> 0x7c6a), seq 23649:27043, ack 911, win 512, options [nop,nop,TS val 1300504642 ecr 1300504636], length 3394
2022-02-28 06:49:20.418786 IP (tos 0x0, ttl 64, id 49376, offset 0, flags [DF], proto TCP (6), length 52)
    127.0.0.1.36692 > 127.0.0.1.12150: Flags [.], cksum 0xfe28 (incorrect -> 0xd731), seq 911, ack 27043, win 494, options [nop,nop,TS val 1300504642 ecr 1300504642], length 0
2022-02-28 06:49:20.418892 IP (tos 0x0, ttl 64, id 61973, offset 0, flags [DF], proto TCP (6), length 3446)
    127.0.0.1.12150 > 127.0.0.1.36692: Flags [P.], cksum 0x0b6b (incorrect -> 0x7c2e), seq 27043:30437, ack 911, win 512, options [nop,nop,TS val 1300504642 ecr 1300504642], length 3394
2022-02-28 06:49:20.418898 IP (tos 0x0, ttl 64, id 49377, offset 0, flags [DF], proto TCP (6), length 52)
    127.0.0.1.36692 > 127.0.0.1.12150: Flags [.], cksum 0xfe28 (incorrect -> 0xc9ef), seq 911, ack 30437, win 494, options [nop,nop,TS val 1300504642 ecr 1300504642], length 0
2022-02-28 06:49:20.418949 IP (tos 0x0, ttl 64, id 61974, offset 0, flags [DF], proto TCP (6), length 956)
    127.0.0.1.12150 > 127.0.0.1.36692: Flags [P.], cksum 0x01b1 (incorrect -> 0x4a6a), seq 30437:31341, ack 911, win 512, options [nop,nop,TS val 1300504642 ecr 1300504642], length 904
2022-02-28 06:49:20.418968 IP (tos 0x0, ttl 64, id 49378, offset 0, flags [DF], proto TCP (6), length 52)
    127.0.0.1.36692 > 127.0.0.1.12150: Flags [.], cksum 0xfe28 (incorrect -> 0xc655), seq 911, ack 31341, win 512, options [nop,nop,TS val 1300504642 ecr 1300504642], length 0
2022-02-28 06:49:20.429561 IP (tos 0x0, ttl 64, id 61975, offset 0, flags [DF], proto TCP (6), length 4100)
    127.0.0.1.12150 > 127.0.0.1.36692: Flags [P.], cksum 0x0df9 (incorrect -> 0xa6ae), seq 31341:35389, ack 911, win 512, options [nop,nop,TS val 1300504653 ecr 1300504642], length 4048
2022-02-28 06:49:20.474145 IP (tos 0x0, ttl 64, id 49379, offset 0, flags [DF], proto TCP (6), length 52)
    127.0.0.1.36692 > 127.0.0.1.12150: Flags [.], cksum 0xfe28 (incorrect -> 0xb643), seq 911, ack 35389, win 512, options [nop,nop,TS val 1300504697 ecr 1300504653], length 0
2022-02-28 06:49:20.474155 IP (tos 0x0, ttl 64, id 61976, offset 0, flags [DF], proto TCP (6), length 11888)
    127.0.0.1.12150 > 127.0.0.1.36692: Flags [P.], cksum 0x2c65 (incorrect -> 0x5f7d), seq 35389:47225, ack 911, win 512, options [nop,nop,TS val 1300504697 ecr 1300504697], length 11836
2022-02-28 06:49:20.507421 IP (tos 0x0, ttl 64, id 61977, offset 0, flags [DF], proto TCP (6), length 32820)
    127.0.0.1.12150 > 127.0.0.1.36692: Flags [.], cksum 0x7e29 (incorrect -> 0xc433), seq 47225:79993, ack 911, win 512, options [nop,nop,TS val 1300504730 ecr 1300504697], length 32768
2022-02-28 06:49:20.507429 IP (tos 0x0, ttl 64, id 49380, offset 0, flags [DF], proto TCP (6), length 52)
    127.0.0.1.36692 > 127.0.0.1.12150: Flags [.], cksum 0xfe28 (incorrect -> 0x083e), seq 911, ack 79993, win 379, options [nop,nop,TS val 1300504731 ecr 1300504697], length 0
2022-02-28 06:49:20.507436 IP (tos 0x0, ttl 64, id 61978, offset 0, flags [DF], proto TCP (6), length 858)
    127.0.0.1.12150 > 127.0.0.1.36692: Flags [P.], cksum 0x014f (incorrect -> 0x800c), seq 79993:80799, ack 911, win 512, options [nop,nop,TS val 1300504731 ecr 1300504731], length 806
2022-02-28 06:49:20.507958 IP (tos 0x0, ttl 64, id 49381, offset 0, flags [DF], proto TCP (6), length 52)
    127.0.0.1.36692 > 127.0.0.1.12150: Flags [.], cksum 0xfe28 (incorrect -> 0x0471), seq 911, ack 80799, win 512, options [nop,nop,TS val 1300504731 ecr 1300504731], length 0
2022-02-28 06:49:20.523934 IP (tos 0x0, ttl 64, id 61979, offset 0, flags [DF], proto TCP (6), length 1303)
    127.0.0.1.12150 > 127.0.0.1.36692: Flags [P.], cksum 0x030c (incorrect -> 0x4dfa), seq 80799:82050, ack 911, win 512, options [nop,nop,TS val 1300504747 ecr 1300504731], length 1251
2022-02-28 06:49:20.523967 IP (tos 0x0, ttl 64, id 49382, offset 0, flags [DF], proto TCP (6), length 52)
    127.0.0.1.36692 > 127.0.0.1.12150: Flags [.], cksum 0xfe28 (incorrect -> 0xff6d), seq 911, ack 82050, win 512, options [nop,nop,TS val 1300504747 ecr 1300504747], length 0
2022-02-28 06:49:21.534150 IP (tos 0x0, ttl 64, id 61980, offset 0, flags [DF], proto TCP (6), length 663)
    127.0.0.1.12150 > 127.0.0.1.36692: Flags [P.], cksum 0x008c (incorrect -> 0x32d6), seq 82050:82661, ack 911, win 512, options [nop,nop,TS val 1300505757 ecr 1300504747], length 611
2022-02-28 06:49:21.534158 IP (tos 0x0, ttl 64, id 49383, offset 0, flags [DF], proto TCP (6), length 52)
    127.0.0.1.36692 > 127.0.0.1.12150: Flags [.], cksum 0xfe28 (incorrect -> 0xf52a), seq 911, ack 82661, win 508, options [nop,nop,TS val 1300505757 ecr 1300505757], length 0
2022-02-28 06:49:21.563702 IP (tos 0x0, ttl 64, id 61981, offset 0, flags [DF], proto TCP (6), length 3538)
    127.0.0.1.12150 > 127.0.0.1.36692: Flags [P.], cksum 0x0bc7 (incorrect -> 0xd955), seq 82661:86147, ack 911, win 512, options [nop,nop,TS val 1300505787 ecr 1300505757], length 3486
2022-02-28 06:49:21.563761 IP (tos 0x0, ttl 64, id 49384, offset 0, flags [DF], proto TCP (6), length 52)
    127.0.0.1.36692 > 127.0.0.1.12150: Flags [.], cksum 0xfe28 (incorrect -> 0xe74c), seq 911, ack 86147, win 512, options [nop,nop,TS val 1300505787 ecr 1300505787], length 0
2022-02-28 06:49:21.580468 IP (tos 0x0, ttl 64, id 61982, offset 0, flags [DF], proto TCP (6), length 4036)
    127.0.0.1.12150 > 127.0.0.1.36692: Flags [P.], cksum 0x0db9 (incorrect -> 0xe1fc), seq 86147:90131, ack 911, win 512, options [nop,nop,TS val 1300505804 ecr 1300505787], length 3984
2022-02-28 06:49:21.580487 IP (tos 0x0, ttl 64, id 49385, offset 0, flags [DF], proto TCP (6), length 52)
    127.0.0.1.36692 > 127.0.0.1.12150: Flags [.], cksum 0xfe28 (incorrect -> 0xd79a), seq 911, ack 90131, win 512, options [nop,nop,TS val 1300505804 ecr 1300505804], length 0
2022-02-28 06:49:21.581161 IP (tos 0x0, ttl 64, id 61983, offset 0, flags [DF], proto TCP (6), length 1270)
    127.0.0.1.12150 > 127.0.0.1.36692: Flags [P.], cksum 0x02eb (incorrect -> 0xc804), seq 90131:91349, ack 911, win 512, options [nop,nop,TS val 1300505804 ecr 1300505804], length 1218
2022-02-28 06:49:21.581172 IP (tos 0x0, ttl 64, id 49386, offset 0, flags [DF], proto TCP (6), length 52)
    127.0.0.1.36692 > 127.0.0.1.12150: Flags [.], cksum 0xfe28 (incorrect -> 0xd2d8), seq 911, ack 91349, win 512, options [nop,nop,TS val 1300505804 ecr 1300505804], length 0
2022-02-28 06:49:21.588524 IP (tos 0x0, ttl 64, id 61984, offset 0, flags [DF], proto TCP (6), length 3538)
    127.0.0.1.12150 > 127.0.0.1.36692: Flags [P.], cksum 0x0bc7 (incorrect -> 0x33a2), seq 91349:94835, ack 911, win 512, options [nop,nop,TS val 1300505812 ecr 1300505804], length 3486
2022-02-28 06:49:21.588553 IP (tos 0x0, ttl 64, id 49387, offset 0, flags [DF], proto TCP (6), length 52)
    127.0.0.1.36692 > 127.0.0.1.12150: Flags [.], cksum 0xfe28 (incorrect -> 0xc52a), seq 911, ack 94835, win 512, options [nop,nop,TS val 1300505812 ecr 1300505812], length 0
2022-02-28 06:49:21.592299 IP (tos 0x0, ttl 64, id 61985, offset 0, flags [DF], proto TCP (6), length 4100)
    127.0.0.1.12150 > 127.0.0.1.36692: Flags [P.], cksum 0x0df9 (incorrect -> 0x0aa7), seq 94835:98883, ack 911, win 512, options [nop,nop,TS val 1300505815 ecr 1300505812], length 4048
2022-02-28 06:49:21.592328 IP (tos 0x0, ttl 64, id 49388, offset 0, flags [DF], proto TCP (6), length 52)
    127.0.0.1.36692 > 127.0.0.1.12150: Flags [.], cksum 0xfe28 (incorrect -> 0xb554), seq 911, ack 98883, win 512, options [nop,nop,TS val 1300505815 ecr 1300505815], length 0
2022-02-28 06:49:21.592332 IP (tos 0x0, ttl 64, id 61986, offset 0, flags [DF], proto TCP (6), length 2705)
    127.0.0.1.12150 > 127.0.0.1.36692: Flags [P.], cksum 0x0886 (incorrect -> 0x6d99), seq 98883:101536, ack 911, win 512, options [nop,nop,TS val 1300505815 ecr 1300505815], length 2653
2022-02-28 06:49:21.592646 IP (tos 0x0, ttl 64, id 49389, offset 0, flags [DF], proto TCP (6), length 52)
    127.0.0.1.36692 > 127.0.0.1.12150: Flags [.], cksum 0xfe28 (incorrect -> 0xaaf6), seq 911, ack 101536, win 512, options [nop,nop,TS val 1300505816 ecr 1300505815], length 0
2022-02-28 06:49:21.596292 IP (tos 0x0, ttl 64, id 61987, offset 0, flags [DF], proto TCP (6), length 1048)
    127.0.0.1.12150 > 127.0.0.1.36692: Flags [P.], cksum 0x020d (incorrect -> 0x16d4), seq 101536:102532, ack 911, win 512, options [nop,nop,TS val 1300505819 ecr 1300505816], length 996
2022-02-28 06:49:21.596377 IP (tos 0x0, ttl 64, id 49390, offset 0, flags [DF], proto TCP (6), length 52)
    127.0.0.1.36692 > 127.0.0.1.12150: Flags [.], cksum 0xfe28 (incorrect -> 0xa70b), seq 911, ack 102532, win 512, options [nop,nop,TS val 1300505819 ecr 1300505819], length 0
2022-02-28 06:49:21.596743 IP (tos 0x0, ttl 64, id 61988, offset 0, flags [DF], proto TCP (6), length 3538)
    127.0.0.1.12150 > 127.0.0.1.36692: Flags [P.], cksum 0x0bc7 (incorrect -> 0x2952), seq 102532:106018, ack 911, win 512, options [nop,nop,TS val 1300505820 ecr 1300505819], length 3486
2022-02-28 06:49:21.596757 IP (tos 0x0, ttl 64, id 49391, offset 0, flags [DF], proto TCP (6), length 52)
    127.0.0.1.36692 > 127.0.0.1.12150: Flags [.], cksum 0xfe28 (incorrect -> 0x996b), seq 911, ack 106018, win 512, options [nop,nop,TS val 1300505820 ecr 1300505820], length 0
2022-02-28 06:49:21.597429 IP (tos 0x0, ttl 64, id 61989, offset 0, flags [DF], proto TCP (6), length 3806)
    127.0.0.1.12150 > 127.0.0.1.36692: Flags [P.], cksum 0x0cd3 (incorrect -> 0x84b2), seq 106018:109772, ack 911, win 512, options [nop,nop,TS val 1300505821 ecr 1300505820], length 3754
2022-02-28 06:49:21.597443 IP (tos 0x0, ttl 64, id 49392, offset 0, flags [DF], proto TCP (6), length 52)
    127.0.0.1.36692 > 127.0.0.1.12150: Flags [.], cksum 0xfe28 (incorrect -> 0x8abf), seq 911, ack 109772, win 512, options [nop,nop,TS val 1300505821 ecr 1300505821], length 0
2022-02-28 06:49:21.604985 IP (tos 0x0, ttl 64, id 61990, offset 0, flags [DF], proto TCP (6), length 4069)
    127.0.0.1.12150 > 127.0.0.1.36692: Flags [P.], cksum 0x0dda (incorrect -> 0xacc3), seq 109772:113789, ack 911, win 512, options [nop,nop,TS val 1300505828 ecr 1300505821], length 4017
2022-02-28 06:49:21.605444 IP (tos 0x0, ttl 64, id 49393, offset 0, flags [DF], proto TCP (6), length 52)
    127.0.0.1.36692 > 127.0.0.1.12150: Flags [.], cksum 0xfe28 (incorrect -> 0x7aff), seq 911, ack 113789, win 512, options [nop,nop,TS val 1300505829 ecr 1300505828], length 0
2022-02-28 06:49:21.605485 IP (tos 0x0, ttl 64, id 61991, offset 0, flags [DF], proto TCP (6), length 3285)
    127.0.0.1.12150 > 127.0.0.1.36692: Flags [P.], cksum 0x0aca (incorrect -> 0x1a0a), seq 113789:117022, ack 911, win 512, options [nop,nop,TS val 1300505829 ecr 1300505829], length 3233
2022-02-28 06:49:21.605613 IP (tos 0x0, ttl 64, id 49394, offset 0, flags [DF], proto TCP (6), length 52)
    127.0.0.1.36692 > 127.0.0.1.12150: Flags [.], cksum 0xfe28 (incorrect -> 0x6e5d), seq 911, ack 117022, win 512, options [nop,nop,TS val 1300505829 ecr 1300505829], length 0
2022-02-28 06:49:21.608193 IP (tos 0x0, ttl 64, id 61992, offset 0, flags [DF], proto TCP (6), length 2542)
    127.0.0.1.12150 > 127.0.0.1.36692: Flags [P.], cksum 0x07e3 (incorrect -> 0xd7a1), seq 117022:119512, ack 911, win 512, options [nop,nop,TS val 1300505831 ecr 1300505829], length 2490
2022-02-28 06:49:21.608221 IP (tos 0x0, ttl 64, id 49395, offset 0, flags [DF], proto TCP (6), length 52)
    127.0.0.1.36692 > 127.0.0.1.12150: Flags [.], cksum 0xfe28 (incorrect -> 0x649f), seq 911, ack 119512, win 512, options [nop,nop,TS val 1300505831 ecr 1300505831], length 0
2022-02-28 06:49:21.609582 IP (tos 0x0, ttl 64, id 61993, offset 0, flags [DF], proto TCP (6), length 4036)
    127.0.0.1.12150 > 127.0.0.1.36692: Flags [P.], cksum 0x0db9 (incorrect -> 0x3cfe), seq 119512:123496, ack 911, win 512, options [nop,nop,TS val 1300505833 ecr 1300505831], length 3984
2022-02-28 06:49:21.609645 IP (tos 0x0, ttl 64, id 49396, offset 0, flags [DF], proto TCP (6), length 52)
    127.0.0.1.36692 > 127.0.0.1.12150: Flags [.], cksum 0xfe28 (incorrect -> 0x550b), seq 911, ack 123496, win 512, options [nop,nop,TS val 1300505833 ecr 1300505833], length 0
2022-02-28 06:49:21.609651 IP (tos 0x0, ttl 64, id 61994, offset 0, flags [DF], proto TCP (6), length 3216)
    127.0.0.1.12150 > 127.0.0.1.36692: Flags [P.], cksum 0x0a85 (incorrect -> 0x99ce), seq 123496:126660, ack 911, win 512, options [nop,nop,TS val 1300505833 ecr 1300505833], length 3164
2022-02-28 06:49:21.609655 IP (tos 0x0, ttl 64, id 49397, offset 0, flags [DF], proto TCP (6), length 52)
    127.0.0.1.36692 > 127.0.0.1.12150: Flags [.], cksum 0xfe28 (incorrect -> 0x48af), seq 911, ack 126660, win 512, options [nop,nop,TS val 1300505833 ecr 1300505833], length 0
2022-02-28 06:49:21.609780 IP (tos 0x0, ttl 64, id 61995, offset 0, flags [DF], proto TCP (6), length 4036)
    127.0.0.1.12150 > 127.0.0.1.36692: Flags [P.], cksum 0x0db9 (incorrect -> 0x77cd), seq 126660:130644, ack 911, win 512, options [nop,nop,TS val 1300505833 ecr 1300505833], length 3984
2022-02-28 06:49:21.609792 IP (tos 0x0, ttl 64, id 49398, offset 0, flags [DF], proto TCP (6), length 52)
    127.0.0.1.36692 > 127.0.0.1.12150: Flags [.], cksum 0xfe28 (incorrect -> 0x391f), seq 911, ack 130644, win 512, options [nop,nop,TS val 1300505833 ecr 1300505833], length 0
2022-02-28 06:49:21.613731 IP (tos 0x0, ttl 64, id 61996, offset 0, flags [DF], proto TCP (6), length 3849)
    127.0.0.1.12150 > 127.0.0.1.36692: Flags [P.], cksum 0x0cfe (incorrect -> 0x9221), seq 130644:134441, ack 911, win 512, options [nop,nop,TS val 1300505837 ecr 1300505833], length 3797
2022-02-28 06:49:21.614380 IP (tos 0x0, ttl 64, id 49399, offset 0, flags [DF], proto TCP (6), length 52)
    127.0.0.1.36692 > 127.0.0.1.12150: Flags [.], cksum 0xfe28 (incorrect -> 0x2a42), seq 911, ack 134441, win 512, options [nop,nop,TS val 1300505837 ecr 1300505837], length 0
2022-02-28 06:49:21.630840 IP (tos 0x0, ttl 64, id 61997, offset 0, flags [DF], proto TCP (6), length 3799)
    127.0.0.1.12150 > 127.0.0.1.36692: Flags [P.], cksum 0x0ccc (incorrect -> 0xc548), seq 134441:138188, ack 911, win 512, options [nop,nop,TS val 1300505854 ecr 1300505837], length 3747
2022-02-28 06:49:21.630875 IP (tos 0x0, ttl 64, id 49400, offset 0, flags [DF], proto TCP (6), length 52)
    127.0.0.1.36692 > 127.0.0.1.12150: Flags [.], cksum 0xfe28 (incorrect -> 0x1b7d), seq 911, ack 138188, win 512, options [nop,nop,TS val 1300505854 ecr 1300505854], length 0
2022-02-28 06:49:21.650834 IP (tos 0x0, ttl 64, id 61998, offset 0, flags [DF], proto TCP (6), length 3538)
    127.0.0.1.12150 > 127.0.0.1.36692: Flags [P.], cksum 0x0bc7 (incorrect -> 0xabe1), seq 138188:141674, ack 911, win 512, options [nop,nop,TS val 1300505874 ecr 1300505854], length 3486
2022-02-28 06:49:21.650887 IP (tos 0x0, ttl 64, id 49401, offset 0, flags [DF], proto TCP (6), length 52)
    127.0.0.1.36692 > 127.0.0.1.12150: Flags [.], cksum 0xfe28 (incorrect -> 0x0db7), seq 911, ack 141674, win 512, options [nop,nop,TS val 1300505874 ecr 1300505874], length 0
2022-02-28 06:49:21.653804 IP (tos 0x0, ttl 64, id 61999, offset 0, flags [DF], proto TCP (6), length 3538)
    127.0.0.1.12150 > 127.0.0.1.36692: Flags [P.], cksum 0x0bc7 (incorrect -> 0x1815), seq 141674:145160, ack 911, win 512, options [nop,nop,TS val 1300505877 ecr 1300505874], length 3486
2022-02-28 06:49:21.656774 IP (tos 0x0, ttl 64, id 62000, offset 0, flags [DF], proto TCP (6), length 32820)
    127.0.0.1.12150 > 127.0.0.1.36692: Flags [.], cksum 0x7e29 (incorrect -> 0x784d), seq 145160:177928, ack 911, win 512, options [nop,nop,TS val 1300505880 ecr 1300505874], length 32768
2022-02-28 06:49:21.656815 IP (tos 0x0, ttl 64, id 49402, offset 0, flags [DF], proto TCP (6), length 52)
    127.0.0.1.36692 > 127.0.0.1.12150: Flags [.], cksum 0xfe28 (incorrect -> 0x8094), seq 911, ack 177928, win 379, options [nop,nop,TS val 1300505880 ecr 1300505877], length 0
2022-02-28 06:49:21.656829 IP (tos 0x0, ttl 64, id 62001, offset 0, flags [DF], proto TCP (6), length 1245)
    127.0.0.1.12150 > 127.0.0.1.36692: Flags [P.], cksum 0x02d2 (incorrect -> 0xaa8c), seq 177928:179121, ack 911, win 512, options [nop,nop,TS val 1300505880 ecr 1300505880], length 1193
2022-02-28 06:49:21.657457 IP (tos 0x0, ttl 64, id 49403, offset 0, flags [DF], proto TCP (6), length 52)
    127.0.0.1.36692 > 127.0.0.1.12150: Flags [.], cksum 0xfe28 (incorrect -> 0x7b62), seq 911, ack 179121, win 512, options [nop,nop,TS val 1300505881 ecr 1300505880], length 0
2022-02-28 06:49:21.657466 IP (tos 0x0, ttl 64, id 62002, offset 0, flags [DF], proto TCP (6), length 3714)
    127.0.0.1.12150 > 127.0.0.1.36692: Flags [P.], cksum 0x0c77 (incorrect -> 0xc62c), seq 179121:182783, ack 911, win 512, options [nop,nop,TS val 1300505881 ecr 1300505881], length 3662
2022-02-28 06:49:21.657471 IP (tos 0x0, ttl 64, id 49404, offset 0, flags [DF], proto TCP (6), length 52)
    127.0.0.1.36692 > 127.0.0.1.12150: Flags [.], cksum 0xfe28 (incorrect -> 0x6d13), seq 911, ack 182783, win 512, options [nop,nop,TS val 1300505881 ecr 1300505881], length 0
2022-02-28 06:49:21.658321 IP (tos 0x0, ttl 64, id 62003, offset 0, flags [DF], proto TCP (6), length 4100)
    127.0.0.1.12150 > 127.0.0.1.36692: Flags [P.], cksum 0x0df9 (incorrect -> 0x13bc), seq 182783:186831, ack 911, win 512, options [nop,nop,TS val 1300505881 ecr 1300505881], length 4048
2022-02-28 06:49:21.658410 IP (tos 0x0, ttl 64, id 49405, offset 0, flags [DF], proto TCP (6), length 52)
    127.0.0.1.36692 > 127.0.0.1.12150: Flags [.], cksum 0xfe28 (incorrect -> 0x5d43), seq 911, ack 186831, win 512, options [nop,nop,TS val 1300505881 ecr 1300505881], length 0
2022-02-28 06:49:21.658418 IP (tos 0x0, ttl 64, id 62004, offset 0, flags [DF], proto TCP (6), length 6430)
    127.0.0.1.12150 > 127.0.0.1.36692: Flags [P.], cksum 0x1713 (incorrect -> 0x0666), seq 186831:193209, ack 911, win 512, options [nop,nop,TS val 1300505881 ecr 1300505881], length 6378
2022-02-28 06:49:21.658658 IP (tos 0x0, ttl 64, id 49406, offset 0, flags [DF], proto TCP (6), length 52)
    127.0.0.1.36692 > 127.0.0.1.12150: Flags [.], cksum 0xfe28 (incorrect -> 0x4458), seq 911, ack 193209, win 512, options [nop,nop,TS val 1300505882 ecr 1300505881], length 0
2022-02-28 06:49:21.667148 IP (tos 0x0, ttl 64, id 62005, offset 0, flags [DF], proto TCP (6), length 4100)
    127.0.0.1.12150 > 127.0.0.1.36692: Flags [P.], cksum 0x0df9 (incorrect -> 0xb3ec), seq 193209:197257, ack 911, win 512, options [nop,nop,TS val 1300505890 ecr 1300505882], length 4048
2022-02-28 06:49:21.667191 IP (tos 0x0, ttl 64, id 49407, offset 0, flags [DF], proto TCP (6), length 52)
    127.0.0.1.36692 > 127.0.0.1.12150: Flags [.], cksum 0xfe28 (incorrect -> 0x3477), seq 911, ack 197257, win 512, options [nop,nop,TS val 1300505890 ecr 1300505890], length 0
2022-02-28 06:49:21.667197 IP (tos 0x0, ttl 64, id 62006, offset 0, flags [DF], proto TCP (6), length 5190)
    127.0.0.1.12150 > 127.0.0.1.36692: Flags [P.], cksum 0x123b (incorrect -> 0x718e), seq 197257:202395, ack 911, win 512, options [nop,nop,TS val 1300505890 ecr 1300505890], length 5138
2022-02-28 06:49:21.667205 IP (tos 0x0, ttl 64, id 49408, offset 0, flags [DF], proto TCP (6), length 52)
    127.0.0.1.36692 > 127.0.0.1.12150: Flags [.], cksum 0xfe28 (incorrect -> 0x2065), seq 911, ack 202395, win 512, options [nop,nop,TS val 1300505890 ecr 1300505890], length 0
2022-02-28 06:49:21.670051 IP (tos 0x0, ttl 64, id 62007, offset 0, flags [DF], proto TCP (6), length 1818)
    127.0.0.1.12150 > 127.0.0.1.36692: Flags [P.], cksum 0x050f (incorrect -> 0x8754), seq 202395:204161, ack 911, win 512, options [nop,nop,TS val 1300505893 ecr 1300505890], length 1766
2022-02-28 06:49:21.670192 IP (tos 0x0, ttl 64, id 49409, offset 0, flags [DF], proto TCP (6), length 52)
    127.0.0.1.36692 > 127.0.0.1.12150: Flags [.], cksum 0xfe28 (incorrect -> 0x1979), seq 911, ack 204161, win 512, options [nop,nop,TS val 1300505893 ecr 1300505893], length 0
2022-02-28 06:49:21.670376 IP (tos 0x0, ttl 64, id 62008, offset 0, flags [DF], proto TCP (6), length 3538)
    127.0.0.1.12150 > 127.0.0.1.36692: Flags [P.], cksum 0x0bc7 (incorrect -> 0x1ff3), seq 204161:207647, ack 911, win 512, options [nop,nop,TS val 1300505893 ecr 1300505893], length 3486
2022-02-28 06:49:21.670405 IP (tos 0x0, ttl 64, id 49410, offset 0, flags [DF], proto TCP (6), length 52)
    127.0.0.1.36692 > 127.0.0.1.12150: Flags [.], cksum 0xfe28 (incorrect -> 0x0bdb), seq 911, ack 207647, win 512, options [nop,nop,TS val 1300505893 ecr 1300505893], length 0
2022-02-28 06:49:21.671673 IP (tos 0x0, ttl 64, id 62009, offset 0, flags [DF], proto TCP (6), length 3538)
    127.0.0.1.12150 > 127.0.0.1.36692: Flags [P.], cksum 0x0bc7 (incorrect -> 0xb468), seq 207647:211133, ack 911, win 512, options [nop,nop,TS val 1300505895 ecr 1300505893], length 3486
2022-02-28 06:49:21.714143 IP (tos 0x0, ttl 64, id 49411, offset 0, flags [DF], proto TCP (6), length 52)
    127.0.0.1.36692 > 127.0.0.1.12150: Flags [.], cksum 0xfe28 (incorrect -> 0xfe0e), seq 911, ack 211133, win 512, options [nop,nop,TS val 1300505937 ecr 1300505895], length 0
2022-02-28 06:49:21.714159 IP (tos 0x0, ttl 64, id 62010, offset 0, flags [DF], proto TCP (6), length 20266)
    127.0.0.1.12150 > 127.0.0.1.36692: Flags [P.], cksum 0x4d1f (incorrect -> 0x3ddc), seq 211133:231347, ack 911, win 512, options [nop,nop,TS val 1300505937 ecr 1300505937], length 20214
2022-02-28 06:49:21.754302 IP (tos 0x0, ttl 64, id 62011, offset 0, flags [DF], proto TCP (6), length 32820)
    127.0.0.1.12150 > 127.0.0.1.36692: Flags [.], cksum 0x7e29 (incorrect -> 0x911f), seq 231347:264115, ack 911, win 512, options [nop,nop,TS val 1300505977 ecr 1300505937], length 32768
2022-02-28 06:49:21.754314 IP (tos 0x0, ttl 64, id 49412, offset 0, flags [DF], proto TCP (6), length 52)
    127.0.0.1.36692 > 127.0.0.1.12150: Flags [.], cksum 0xfe28 (incorrect -> 0x2f4b), seq 911, ack 264115, win 379, options [nop,nop,TS val 1300505977 ecr 1300505937], length 0
2022-02-28 06:49:21.754328 IP (tos 0x0, ttl 64, id 62012, offset 0, flags [DF], proto TCP (6), length 186)
    127.0.0.1.12150 > 127.0.0.1.36692: Flags [P.], cksum 0xfeae (incorrect -> 0x294a), seq 264115:264249, ack 911, win 512, options [nop,nop,TS val 1300505977 ecr 1300505977], length 134
2022-02-28 06:49:21.755332 IP (tos 0x0, ttl 64, id 49413, offset 0, flags [DF], proto TCP (6), length 52)
    127.0.0.1.36692 > 127.0.0.1.12150: Flags [.], cksum 0xfe28 (incorrect -> 0x2e17), seq 911, ack 264249, win 512, options [nop,nop,TS val 1300505978 ecr 1300505977], length 0
2022-02-28 06:49:21.755358 IP (tos 0x0, ttl 64, id 62013, offset 0, flags [DF], proto TCP (6), length 30616)
    127.0.0.1.12150 > 127.0.0.1.36692: Flags [P.], cksum 0x758d (incorrect -> 0x1722), seq 264249:294813, ack 911, win 512, options [nop,nop,TS val 1300505978 ecr 1300505978], length 30564
2022-02-28 06:49:21.755680 IP (tos 0x0, ttl 64, id 49414, offset 0, flags [DF], proto TCP (6), length 52)
    127.0.0.1.36692 > 127.0.0.1.12150: Flags [.], cksum 0xfe28 (incorrect -> 0xb6b0), seq 911, ack 294813, win 512, options [nop,nop,TS val 1300505979 ecr 1300505978], length 0
2022-02-28 06:49:21.755690 IP (tos 0x0, ttl 64, id 62014, offset 0, flags [DF], proto TCP (6), length 5254)
    127.0.0.1.12150 > 127.0.0.1.36692: Flags [P.], cksum 0x127b (incorrect -> 0xf12c), seq 294813:300015, ack 911, win 512, options [nop,nop,TS val 1300505979 ecr 1300505979], length 5202
2022-02-28 06:49:21.755696 IP (tos 0x0, ttl 64, id 49415, offset 0, flags [DF], proto TCP (6), length 52)
    127.0.0.1.36692 > 127.0.0.1.12150: Flags [.], cksum 0xfe28 (incorrect -> 0xa25d), seq 911, ack 300015, win 512, options [nop,nop,TS val 1300505979 ecr 1300505979], length 0
2022-02-28 06:49:21.768242 IP (tos 0x0, ttl 64, id 62015, offset 0, flags [DF], proto TCP (6), length 1500)
    127.0.0.1.12150 > 127.0.0.1.36692: Flags [P.], cksum 0x03d1 (incorrect -> 0xb3f0), seq 300015:301463, ack 911, win 512, options [nop,nop,TS val 1300505991 ecr 1300505979], length 1448
2022-02-28 06:49:21.768271 IP (tos 0x0, ttl 64, id 49416, offset 0, flags [DF], proto TCP (6), length 52)
    127.0.0.1.36692 > 127.0.0.1.12150: Flags [.], cksum 0xfe28 (incorrect -> 0x9c9d), seq 911, ack 301463, win 512, options [nop,nop,TS val 1300505991 ecr 1300505991], length 0
2022-02-28 06:49:21.776963 IP (tos 0x0, ttl 64, id 62016, offset 0, flags [DF], proto TCP (6), length 1606)
    127.0.0.1.12150 > 127.0.0.1.36692: Flags [P.], cksum 0x043b (incorrect -> 0x634a), seq 301463:303017, ack 911, win 512, options [nop,nop,TS val 1300506000 ecr 1300505991], length 1554
2022-02-28 06:49:21.777275 IP (tos 0x0, ttl 64, id 49417, offset 0, flags [DF], proto TCP (6), length 52)
    127.0.0.1.36692 > 127.0.0.1.12150: Flags [.], cksum 0xfe28 (incorrect -> 0x9679), seq 911, ack 303017, win 512, options [nop,nop,TS val 1300506000 ecr 1300506000], length 0
2022-02-28 06:49:21.777391 IP (tos 0x0, ttl 64, id 62017, offset 0, flags [DF], proto TCP (6), length 4100)
    127.0.0.1.12150 > 127.0.0.1.36692: Flags [P.], cksum 0x0df9 (incorrect -> 0x4b68), seq 303017:307065, ack 911, win 512, options [nop,nop,TS val 1300506000 ecr 1300506000], length 4048
2022-02-28 06:49:21.777448 IP (tos 0x0, ttl 64, id 49418, offset 0, flags [DF], proto TCP (6), length 52)
    127.0.0.1.36692 > 127.0.0.1.12150: Flags [.], cksum 0xfe28 (incorrect -> 0x86a8), seq 911, ack 307065, win 512, options [nop,nop,TS val 1300506001 ecr 1300506000], length 0
2022-02-28 06:49:21.777455 IP (tos 0x0, ttl 64, id 62018, offset 0, flags [DF], proto TCP (6), length 3474)
    127.0.0.1.12150 > 127.0.0.1.36692: Flags [P.], cksum 0x0b87 (incorrect -> 0xd4b2), seq 307065:310487, ack 911, win 512, options [nop,nop,TS val 1300506001 ecr 1300506001], length 3422
2022-02-28 06:49:21.777463 IP (tos 0x0, ttl 64, id 49419, offset 0, flags [DF], proto TCP (6), length 52)
    127.0.0.1.36692 > 127.0.0.1.12150: Flags [.], cksum 0xfe28 (incorrect -> 0x7949), seq 911, ack 310487, win 512, options [nop,nop,TS val 1300506001 ecr 1300506001], length 0
2022-02-28 06:49:21.778901 IP (tos 0x0, ttl 64, id 62019, offset 0, flags [DF], proto TCP (6), length 4100)
    127.0.0.1.12150 > 127.0.0.1.36692: Flags [P.], cksum 0x0df9 (incorrect -> 0xe68c), seq 310487:314535, ack 911, win 512, options [nop,nop,TS val 1300506002 ecr 1300506001], length 4048
2022-02-28 06:49:21.778944 IP (tos 0x0, ttl 64, id 49420, offset 0, flags [DF], proto TCP (6), length 52)
    127.0.0.1.36692 > 127.0.0.1.12150: Flags [.], cksum 0xfe28 (incorrect -> 0x6977), seq 911, ack 314535, win 512, options [nop,nop,TS val 1300506002 ecr 1300506002], length 0
2022-02-28 06:49:21.778948 IP (tos 0x0, ttl 64, id 62020, offset 0, flags [DF], proto TCP (6), length 6467)
    127.0.0.1.12150 > 127.0.0.1.36692: Flags [P.], cksum 0x1738 (incorrect -> 0xe0ca), seq 314535:320950, ack 911, win 512, options [nop,nop,TS val 1300506002 ecr 1300506002], length 6415
2022-02-28 06:49:21.779112 IP (tos 0x0, ttl 64, id 49421, offset 0, flags [DF], proto TCP (6), length 52)
    127.0.0.1.36692 > 127.0.0.1.12150: Flags [.], cksum 0xfe28 (incorrect -> 0x5068), seq 911, ack 320950, win 512, options [nop,nop,TS val 1300506002 ecr 1300506002], length 0
2022-02-28 06:49:21.779152 IP (tos 0x0, ttl 64, id 62021, offset 0, flags [DF], proto TCP (6), length 4036)
    127.0.0.1.12150 > 127.0.0.1.36692: Flags [P.], cksum 0x0db9 (incorrect -> 0x4a82), seq 320950:324934, ack 911, win 512, options [nop,nop,TS val 1300506002 ecr 1300506002], length 3984
2022-02-28 06:49:21.779163 IP (tos 0x0, ttl 64, id 49422, offset 0, flags [DF], proto TCP (6), length 52)
    127.0.0.1.36692 > 127.0.0.1.12150: Flags [.], cksum 0xfe28 (incorrect -> 0x40d8), seq 911, ack 324934, win 512, options [nop,nop,TS val 1300506002 ecr 1300506002], length 0
2022-02-28 06:49:21.780924 IP (tos 0x0, ttl 64, id 62022, offset 0, flags [DF], proto TCP (6), length 4100)
    127.0.0.1.12150 > 127.0.0.1.36692: Flags [P.], cksum 0x0df9 (incorrect -> 0x4dfa), seq 324934:328982, ack 911, win 512, options [nop,nop,TS val 1300506004 ecr 1300506002], length 4048
2022-02-28 06:49:21.780943 IP (tos 0x0, ttl 64, id 49423, offset 0, flags [DF], proto TCP (6), length 52)
    127.0.0.1.36692 > 127.0.0.1.12150: Flags [.], cksum 0xfe28 (incorrect -> 0x3104), seq 911, ack 328982, win 512, options [nop,nop,TS val 1300506004 ecr 1300506004], length 0
2022-02-28 06:49:21.780946 IP (tos 0x0, ttl 64, id 62023, offset 0, flags [DF], proto TCP (6), length 486)
    127.0.0.1.12150 > 127.0.0.1.36692: Flags [P.], cksum 0xffda (incorrect -> 0x6442), seq 328982:329416, ack 911, win 512, options [nop,nop,TS val 1300506004 ecr 1300506004], length 434
2022-02-28 06:49:21.780950 IP (tos 0x0, ttl 64, id 49424, offset 0, flags [DF], proto TCP (6), length 52)
    127.0.0.1.36692 > 127.0.0.1.12150: Flags [.], cksum 0xfe28 (incorrect -> 0x2f52), seq 911, ack 329416, win 512, options [nop,nop,TS val 1300506004 ecr 1300506004], length 0
2022-02-28 06:49:21.784608 IP (tos 0x0, ttl 64, id 62024, offset 0, flags [DF], proto TCP (6), length 3714)
    127.0.0.1.12150 > 127.0.0.1.36692: Flags [P.], cksum 0x0c77 (incorrect -> 0xad41), seq 329416:333078, ack 911, win 512, options [nop,nop,TS val 1300506008 ecr 1300506004], length 3662
2022-02-28 06:49:21.784922 IP (tos 0x0, ttl 64, id 49425, offset 0, flags [DF], proto TCP (6), length 52)
    127.0.0.1.36692 > 127.0.0.1.12150: Flags [.], cksum 0xfe28 (incorrect -> 0x20fc), seq 911, ack 333078, win 512, options [nop,nop,TS val 1300506008 ecr 1300506008], length 0
2022-02-28 06:49:21.799900 IP (tos 0x0, ttl 64, id 62025, offset 0, flags [DF], proto TCP (6), length 2954)
    127.0.0.1.12150 > 127.0.0.1.36692: Flags [P.], cksum 0x097f (incorrect -> 0x191f), seq 333078:335980, ack 911, win 512, options [nop,nop,TS val 1300506023 ecr 1300506008], length 2902
2022-02-28 06:49:21.800075 IP (tos 0x0, ttl 64, id 49426, offset 0, flags [DF], proto TCP (6), length 52)
    127.0.0.1.36692 > 127.0.0.1.12150: Flags [.], cksum 0xfe28 (incorrect -> 0x1588), seq 911, ack 335980, win 512, options [nop,nop,TS val 1300506023 ecr 1300506023], length 0
2022-02-28 06:49:21.800989 IP (tos 0x0, ttl 64, id 62026, offset 0, flags [DF], proto TCP (6), length 3538)
    127.0.0.1.12150 > 127.0.0.1.36692: Flags [P.], cksum 0x0bc7 (incorrect -> 0xa59d), seq 335980:339466, ack 911, win 512, options [nop,nop,TS val 1300506024 ecr 1300506023], length 3486
2022-02-28 06:49:21.801086 IP (tos 0x0, ttl 64, id 49427, offset 0, flags [DF], proto TCP (6), length 52)
    127.0.0.1.36692 > 127.0.0.1.12150: Flags [.], cksum 0xfe28 (incorrect -> 0x07e8), seq 911, ack 339466, win 512, options [nop,nop,TS val 1300506024 ecr 1300506024], length 0
2022-02-28 06:49:21.801091 IP (tos 0x0, ttl 64, id 62027, offset 0, flags [DF], proto TCP (6), length 3538)
    127.0.0.1.12150 > 127.0.0.1.36692: Flags [P.], cksum 0x0bc7 (incorrect -> 0xa340), seq 339466:342952, ack 911, win 512, options [nop,nop,TS val 1300506024 ecr 1300506024], length 3486
2022-02-28 06:49:21.821664 IP (tos 0x0, ttl 64, id 62028, offset 0, flags [DF], proto TCP (6), length 32820)
    127.0.0.1.12150 > 127.0.0.1.36692: Flags [.], cksum 0x7e29 (incorrect -> 0xbf73), seq 342952:375720, ack 911, win 512, options [nop,nop,TS val 1300506045 ecr 1300506024], length 32768
2022-02-28 06:49:21.821712 IP (tos 0x0, ttl 64, id 49428, offset 0, flags [DF], proto TCP (6), length 52)
    127.0.0.1.36692 > 127.0.0.1.12150: Flags [.], cksum 0xfe28 (incorrect -> 0x7ab9), seq 911, ack 375720, win 379, options [nop,nop,TS val 1300506045 ecr 1300506024], length 0
2022-02-28 06:49:21.821719 IP (tos 0x0, ttl 64, id 62029, offset 0, flags [DF], proto TCP (6), length 6472)
    127.0.0.1.12150 > 127.0.0.1.36692: Flags [P.], cksum 0x173d (incorrect -> 0x3560), seq 375720:382140, ack 911, win 512, options [nop,nop,TS val 1300506045 ecr 1300506045], length 6420
2022-02-28 06:49:21.822100 IP (tos 0x0, ttl 64, id 49429, offset 0, flags [DF], proto TCP (6), length 52)
    127.0.0.1.36692 > 127.0.0.1.12150: Flags [.], cksum 0xfe28 (incorrect -> 0x610b), seq 911, ack 382140, win 512, options [nop,nop,TS val 1300506045 ecr 1300506045], length 0
2022-02-28 06:49:21.822530 IP (tos 0x0, ttl 64, id 62030, offset 0, flags [DF], proto TCP (6), length 4100)
    127.0.0.1.12150 > 127.0.0.1.36692: Flags [P.], cksum 0x0df9 (incorrect -> 0xfabf), seq 382140:386188, ack 911, win 512, options [nop,nop,TS val 1300506046 ecr 1300506045], length 4048
2022-02-28 06:49:21.822844 IP (tos 0x0, ttl 64, id 49430, offset 0, flags [DF], proto TCP (6), length 52)
    127.0.0.1.36692 > 127.0.0.1.12150: Flags [.], cksum 0xfe28 (incorrect -> 0x5139), seq 911, ack 386188, win 512, options [nop,nop,TS val 1300506046 ecr 1300506046], length 0
2022-02-28 06:49:21.822848 IP (tos 0x0, ttl 64, id 62031, offset 0, flags [DF], proto TCP (6), length 820)
    127.0.0.1.12150 > 127.0.0.1.36692: Flags [P.], cksum 0x0129 (incorrect -> 0xb684), seq 386188:386956, ack 911, win 512, options [nop,nop,TS val 1300506046 ecr 1300506046], length 768
2022-02-28 06:49:21.822852 IP (tos 0x0, ttl 64, id 49431, offset 0, flags [DF], proto TCP (6), length 52)
    127.0.0.1.36692 > 127.0.0.1.12150: Flags [.], cksum 0xfe28 (incorrect -> 0x4e39), seq 911, ack 386956, win 512, options [nop,nop,TS val 1300506046 ecr 1300506046], length 0
2022-02-28 06:49:21.826033 IP (tos 0x0, ttl 64, id 62032, offset 0, flags [DF], proto TCP (6), length 4100)
    127.0.0.1.12150 > 127.0.0.1.36692: Flags [P.], cksum 0x0df9 (incorrect -> 0x1e77), seq 386956:391004, ack 911, win 512, options [nop,nop,TS val 1300506049 ecr 1300506046], length 4048
2022-02-28 06:49:21.826155 IP (tos 0x0, ttl 64, id 49432, offset 0, flags [DF], proto TCP (6), length 52)
    127.0.0.1.36692 > 127.0.0.1.12150: Flags [.], cksum 0xfe28 (incorrect -> 0x3e63), seq 911, ack 391004, win 512, options [nop,nop,TS val 1300506049 ecr 1300506049], length 0
2022-02-28 06:49:21.826160 IP (tos 0x0, ttl 64, id 62033, offset 0, flags [DF], proto TCP (6), length 2976)
    127.0.0.1.12150 > 127.0.0.1.36692: Flags [P.], cksum 0x0995 (incorrect -> 0x9c27), seq 391004:393928, ack 911, win 512, options [nop,nop,TS val 1300506049 ecr 1300506049], length 2924
2022-02-28 06:49:21.826164 IP (tos 0x0, ttl 64, id 49433, offset 0, flags [DF], proto TCP (6), length 52)
    127.0.0.1.36692 > 127.0.0.1.12150: Flags [.], cksum 0xfe28 (incorrect -> 0x32f7), seq 911, ack 393928, win 512, options [nop,nop,TS val 1300506049 ecr 1300506049], length 0
2022-02-28 06:49:21.826802 IP (tos 0x0, ttl 64, id 62034, offset 0, flags [DF], proto TCP (6), length 4100)
    127.0.0.1.12150 > 127.0.0.1.36692: Flags [P.], cksum 0x0df9 (incorrect -> 0xf256), seq 393928:397976, ack 911, win 512, options [nop,nop,TS val 1300506050 ecr 1300506049], length 4048
2022-02-28 06:49:21.826843 IP (tos 0x0, ttl 64, id 49434, offset 0, flags [DF], proto TCP (6), length 52)
    127.0.0.1.36692 > 127.0.0.1.12150: Flags [.], cksum 0xfe28 (incorrect -> 0x2325), seq 911, ack 397976, win 512, options [nop,nop,TS val 1300506050 ecr 1300506050], length 0
2022-02-28 06:49:21.826847 IP (tos 0x0, ttl 64, id 62035, offset 0, flags [DF], proto TCP (6), length 6944)
    127.0.0.1.12150 > 127.0.0.1.36692: Flags [P.], cksum 0x1915 (incorrect -> 0x8a35), seq 397976:404868, ack 911, win 512, options [nop,nop,TS val 1300506050 ecr 1300506050], length 6892
2022-02-28 06:49:21.827004 IP (tos 0x0, ttl 64, id 49435, offset 0, flags [DF], proto TCP (6), length 52)
    127.0.0.1.36692 > 127.0.0.1.12150: Flags [.], cksum 0xfe28 (incorrect -> 0x0839), seq 911, ack 404868, win 512, options [nop,nop,TS val 1300506050 ecr 1300506050], length 0
2022-02-28 06:49:21.828068 IP (tos 0x0, ttl 64, id 62036, offset 0, flags [DF], proto TCP (6), length 4100)
    127.0.0.1.12150 > 127.0.0.1.36692: Flags [P.], cksum 0x0df9 (incorrect -> 0x9d40), seq 404868:408916, ack 911, win 512, options [nop,nop,TS val 1300506051 ecr 1300506050], length 4048
2022-02-28 06:49:21.828090 IP (tos 0x0, ttl 64, id 49436, offset 0, flags [DF], proto TCP (6), length 52)
    127.0.0.1.36692 > 127.0.0.1.12150: Flags [.], cksum 0xfe28 (incorrect -> 0xf866), seq 911, ack 408916, win 512, options [nop,nop,TS val 1300506051 ecr 1300506051], length 0
2022-02-28 06:49:21.828093 IP (tos 0x0, ttl 64, id 62037, offset 0, flags [DF], proto TCP (6), length 486)
    127.0.0.1.12150 > 127.0.0.1.36692: Flags [P.], cksum 0xffda (incorrect -> 0x1cca), seq 408916:409350, ack 911, win 512, options [nop,nop,TS val 1300506051 ecr 1300506051], length 434
2022-02-28 06:49:21.828096 IP (tos 0x0, ttl 64, id 49437, offset 0, flags [DF], proto TCP (6), length 52)
    127.0.0.1.36692 > 127.0.0.1.12150: Flags [.], cksum 0xfe28 (incorrect -> 0xf6b4), seq 911, ack 409350, win 512, options [nop,nop,TS val 1300506051 ecr 1300506051], length 0
2022-02-28 06:49:21.832972 IP (tos 0x0, ttl 64, id 62038, offset 0, flags [DF], proto TCP (6), length 3714)
    127.0.0.1.12150 > 127.0.0.1.36692: Flags [P.], cksum 0x0c77 (incorrect -> 0x69f5), seq 409350:413012, ack 911, win 512, options [nop,nop,TS val 1300506056 ecr 1300506051], length 3662
2022-02-28 06:49:21.833002 IP (tos 0x0, ttl 64, id 49438, offset 0, flags [DF], proto TCP (6), length 52)
    127.0.0.1.36692 > 127.0.0.1.12150: Flags [.], cksum 0xfe28 (incorrect -> 0xe85c), seq 911, ack 413012, win 512, options [nop,nop,TS val 1300506056 ecr 1300506056], length 0
2022-02-28 06:49:21.833005 IP (tos 0x0, ttl 64, id 62039, offset 0, flags [DF], proto TCP (6), length 550)
    127.0.0.1.12150 > 127.0.0.1.36692: Flags [P.], cksum 0x001b (incorrect -> 0x7d15), seq 413012:413510, ack 911, win 512, options [nop,nop,TS val 1300506056 ecr 1300506056], length 498
2022-02-28 06:49:21.833009 IP (tos 0x0, ttl 64, id 49439, offset 0, flags [DF], proto TCP (6), length 52)
    127.0.0.1.36692 > 127.0.0.1.12150: Flags [.], cksum 0xfe28 (incorrect -> 0xe66a), seq 911, ack 413510, win 512, options [nop,nop,TS val 1300506056 ecr 1300506056], length 0
2022-02-28 06:49:21.836158 IP (tos 0x0, ttl 64, id 62040, offset 0, flags [DF], proto TCP (6), length 4036)
    127.0.0.1.12150 > 127.0.0.1.36692: Flags [P.], cksum 0x0db9 (incorrect -> 0x2a8e), seq 413510:417494, ack 911, win 512, options [nop,nop,TS val 1300506059 ecr 1300506056], length 3984
2022-02-28 06:49:21.836173 IP (tos 0x0, ttl 64, id 49440, offset 0, flags [DF], proto TCP (6), length 52)
    127.0.0.1.36692 > 127.0.0.1.12150: Flags [.], cksum 0xfe28 (incorrect -> 0xd6d4), seq 911, ack 417494, win 512, options [nop,nop,TS val 1300506059 ecr 1300506059], length 0
2022-02-28 06:49:21.844094 IP (tos 0x0, ttl 64, id 62041, offset 0, flags [DF], proto TCP (6), length 1119)
    127.0.0.1.12150 > 127.0.0.1.36692: Flags [P.], cksum 0x0254 (incorrect -> 0xcec4), seq 417494:418561, ack 911, win 512, options [nop,nop,TS val 1300506067 ecr 1300506059], length 1067
2022-02-28 06:49:21.844215 IP (tos 0x0, ttl 64, id 49441, offset 0, flags [DF], proto TCP (6), length 52)
    127.0.0.1.36692 > 127.0.0.1.12150: Flags [.], cksum 0xfe28 (incorrect -> 0xd299), seq 911, ack 418561, win 512, options [nop,nop,TS val 1300506067 ecr 1300506067], length 0
2022-02-28 06:49:21.848269 IP (tos 0x0, ttl 64, id 62042, offset 0, flags [DF], proto TCP (6), length 3538)
    127.0.0.1.12150 > 127.0.0.1.36692: Flags [P.], cksum 0x0bc7 (incorrect -> 0x5337), seq 418561:422047, ack 911, win 512, options [nop,nop,TS val 1300506071 ecr 1300506067], length 3486
2022-02-28 06:49:21.848331 IP (tos 0x0, ttl 64, id 49442, offset 0, flags [DF], proto TCP (6), length 52)
    127.0.0.1.36692 > 127.0.0.1.12150: Flags [.], cksum 0xfe28 (incorrect -> 0xc4f3), seq 911, ack 422047, win 512, options [nop,nop,TS val 1300506071 ecr 1300506071], length 0
2022-02-28 06:49:21.848336 IP (tos 0x0, ttl 64, id 62043, offset 0, flags [DF], proto TCP (6), length 3538)
    127.0.0.1.12150 > 127.0.0.1.36692: Flags [P.], cksum 0x0bc7 (incorrect -> 0x306c), seq 422047:425533, ack 911, win 512, options [nop,nop,TS val 1300506071 ecr 1300506071], length 3486
2022-02-28 06:49:21.894171 IP (tos 0x0, ttl 64, id 49443, offset 0, flags [DF], proto TCP (6), length 52)
    127.0.0.1.36692 > 127.0.0.1.12150: Flags [.], cksum 0xfe28 (incorrect -> 0xb727), seq 911, ack 425533, win 512, options [nop,nop,TS val 1300506117 ecr 1300506071], length 0
2022-02-28 06:49:21.894214 IP (tos 0x0, ttl 64, id 62044, offset 0, flags [DF], proto TCP (6), length 25537)
    127.0.0.1.12150 > 127.0.0.1.36692: Flags [P.], cksum 0x61b6 (incorrect -> 0xb8c6), seq 425533:451018, ack 911, win 512, options [nop,nop,TS val 1300506117 ecr 1300506117], length 25485
200, 5.1721367835998535, 2.499396324157715