2022-02-28 04:40:15.715225 IP (tos 0x0, ttl 64, id 7544, offset 0, flags [DF], proto TCP (6), length 60)
    127.0.0.1.57924 > 127.0.0.1.10950: Flags [S], cksum 0xfe30 (incorrect -> 0x9d18), seq 3829104914, win 65495, options [mss 65495,sackOK,TS val 1292759938 ecr 0,nop,wscale 7], length 0
2022-02-28 04:40:15.715234 IP (tos 0x0, ttl 64, id 0, offset 0, flags [DF], proto TCP (6), length 60)
    127.0.0.1.10950 > 127.0.0.1.57924: Flags [S.], cksum 0xfe30 (incorrect -> 0xc88d), seq 106728857, ack 3829104915, win 65483, options [mss 65495,sackOK,TS val 1292759938 ecr 1292759938,nop,wscale 7], length 0
2022-02-28 04:40:15.715242 IP (tos 0x0, ttl 64, id 7545, offset 0, flags [DF], proto TCP (6), length 52)
    127.0.0.1.57924 > 127.0.0.1.10950: Flags [.], cksum 0xfe28 (incorrect -> 0xef49), seq 1, ack 1, win 512, options [nop,nop,TS val 1292759938 ecr 1292759938], length 0
2022-02-28 04:40:15.715354 IP (tos 0x0, ttl 64, id 7546, offset 0, flags [DF], proto TCP (6), length 55)
    127.0.0.1.57924 > 127.0.0.1.10950: Flags [P.], cksum 0xfe2b (incorrect -> 0xea3d), seq 1:4, ack 1, win 512, options [nop,nop,TS val 1292759938 ecr 1292759938], length 3
2022-02-28 04:40:15.715360 IP (tos 0x0, ttl 64, id 6338, offset 0, flags [DF], proto TCP (6), length 52)
    127.0.0.1.10950 > 127.0.0.1.57924: Flags [.], cksum 0xfe28 (incorrect -> 0xef46), seq 1, ack 4, win 512, options [nop,nop,TS val 1292759938 ecr 1292759938], length 0
2022-02-28 04:40:15.715420 IP (tos 0x0, ttl 64, id 6339, offset 0, flags [DF], proto TCP (6), length 54)
    127.0.0.1.10950 > 127.0.0.1.57924: Flags [P.], cksum 0xfe2a (incorrect -> 0xea3c), seq 1:3, ack 4, win 512, options [nop,nop,TS val 1292759938 ecr 1292759938], length 2
2022-02-28 04:40:15.715441 IP (tos 0x0, ttl 64, id 7547, offset 0, flags [DF], proto TCP (6), length 52)
    127.0.0.1.57924 > 127.0.0.1.10950: Flags [.], cksum 0xfe28 (incorrect -> 0xef43), seq 4, ack 3, win 512, options [nop,nop,TS val 1292759939 ecr 1292759938], length 0
2022-02-28 04:40:15.742075 IP (tos 0x0, ttl 64, id 7548, offset 0, flags [DF], proto TCP (6), length 62)
    127.0.0.1.57924 > 127.0.0.1.10950: Flags [P.], cksum 0xfe32 (incorrect -> 0x7901), seq 4:14, ack 3, win 512, options [nop,nop,TS val 1292759965 ecr 1292759938], length 10
2022-02-28 04:40:15.742110 IP (tos 0x0, ttl 64, id 6340, offset 0, flags [DF], proto TCP (6), length 52)
    127.0.0.1.10950 > 127.0.0.1.57924: Flags [.], cksum 0xfe28 (incorrect -> 0xef04), seq 3, ack 14, win 512, options [nop,nop,TS val 1292759965 ecr 1292759965], length 0
2022-02-28 04:40:15.898093 IP (tos 0x0, ttl 64, id 6341, offset 0, flags [DF], proto TCP (6), length 62)
    127.0.0.1.10950 > 127.0.0.1.57924: Flags [P.], cksum 0xfe32 (incorrect -> 0xe955), seq 3:13, ack 14, win 512, options [nop,nop,TS val 1292760121 ecr 1292759965], length 10
2022-02-28 04:40:15.898107 IP (tos 0x0, ttl 64, id 7549, offset 0, flags [DF], proto TCP (6), length 52)
    127.0.0.1.57924 > 127.0.0.1.10950: Flags [.], cksum 0xfe28 (incorrect -> 0xedc2), seq 14, ack 13, win 512, options [nop,nop,TS val 1292760121 ecr 1292760121], length 0
2022-02-28 04:40:15.904378 IP (tos 0x0, ttl 64, id 7550, offset 0, flags [DF], proto TCP (6), length 569)
    127.0.0.1.57924 > 127.0.0.1.10950: Flags [P.], cksum 0x002e (incorrect -> 0x019f), seq 14:531, ack 13, win 512, options [nop,nop,TS val 1292760127 ecr 1292760121], length 517
2022-02-28 04:40:15.904389 IP (tos 0x0, ttl 64, id 6342, offset 0, flags [DF], proto TCP (6), length 52)
    127.0.0.1.10950 > 127.0.0.1.57924: Flags [.], cksum 0xfe28 (incorrect -> 0xebb5), seq 13, ack 531, win 508, options [nop,nop,TS val 1292760127 ecr 1292760127], length 0
2022-02-28 04:40:16.029271 IP (tos 0x0, ttl 64, id 6343, offset 0, flags [DF], proto TCP (6), length 3538)
    127.0.0.1.10950 > 127.0.0.1.57924: Flags [P.], cksum 0x0bc7 (incorrect -> 0x730d), seq 13:3499, ack 531, win 512, options [nop,nop,TS val 1292760252 ecr 1292760127], length 3486
2022-02-28 04:40:16.029280 IP (tos 0x0, ttl 64, id 7551, offset 0, flags [DF], proto TCP (6), length 52)
    127.0.0.1.57924 > 127.0.0.1.10950: Flags [.], cksum 0xfe28 (incorrect -> 0xdd2b), seq 531, ack 3499, win 494, options [nop,nop,TS val 1292760252 ecr 1292760252], length 0
2022-02-28 04:40:16.077003 IP (tos 0x0, ttl 64, id 6344, offset 0, flags [DF], proto TCP (6), length 1494)
    127.0.0.1.10950 > 127.0.0.1.57924: Flags [P.], cksum 0x03cb (incorrect -> 0xae73), seq 3499:4941, ack 531, win 512, options [nop,nop,TS val 1292760300 ecr 1292760252], length 1442
2022-02-28 04:40:16.077010 IP (tos 0x0, ttl 64, id 7552, offset 0, flags [DF], proto TCP (6), length 52)
    127.0.0.1.57924 > 127.0.0.1.10950: Flags [.], cksum 0xfe28 (incorrect -> 0xd721), seq 531, ack 4941, win 502, options [nop,nop,TS val 1292760300 ecr 1292760300], length 0
2022-02-28 04:40:16.077403 IP (tos 0x0, ttl 64, id 7553, offset 0, flags [DF], proto TCP (6), length 116)
    127.0.0.1.57924 > 127.0.0.1.10950: Flags [P.], cksum 0xfe68 (incorrect -> 0xa23d), seq 531:595, ack 4941, win 512, options [nop,nop,TS val 1292760300 ecr 1292760300], length 64
2022-02-28 04:40:16.077412 IP (tos 0x0, ttl 64, id 6345, offset 0, flags [DF], proto TCP (6), length 52)
    127.0.0.1.10950 > 127.0.0.1.57924: Flags [.], cksum 0xfe28 (incorrect -> 0xd6d7), seq 4941, ack 595, win 512, options [nop,nop,TS val 1292760300 ecr 1292760300], length 0
2022-02-28 04:40:16.077866 IP (tos 0x0, ttl 64, id 7554, offset 0, flags [DF], proto TCP (6), length 364)
    127.0.0.1.57924 > 127.0.0.1.10950: Flags [P.], cksum 0xff60 (incorrect -> 0x6502), seq 595:907, ack 4941, win 512, options [nop,nop,TS val 1292760301 ecr 1292760300], length 312
2022-02-28 04:40:16.077874 IP (tos 0x0, ttl 64, id 6346, offset 0, flags [DF], proto TCP (6), length 52)
    127.0.0.1.10950 > 127.0.0.1.57924: Flags [.], cksum 0xfe28 (incorrect -> 0xd59f), seq 4941, ack 907, win 510, options [nop,nop,TS val 1292760301 ecr 1292760301], length 0
2022-02-28 04:40:16.421281 IP (tos 0x0, ttl 64, id 6347, offset 0, flags [DF], proto TCP (6), length 3327)
    127.0.0.1.10950 > 127.0.0.1.57924: Flags [P.], cksum 0x0af4 (incorrect -> 0xa510), seq 4941:8216, ack 907, win 512, options [nop,nop,TS val 1292760644 ecr 1292760301], length 3275
2022-02-28 04:40:16.421295 IP (tos 0x0, ttl 64, id 7555, offset 0, flags [DF], proto TCP (6), length 52)
    127.0.0.1.57924 > 127.0.0.1.10950: Flags [.], cksum 0xfe28 (incorrect -> 0xc635), seq 907, ack 8216, win 495, options [nop,nop,TS val 1292760644 ecr 1292760644], length 0
2022-02-28 04:40:16.463948 IP (tos 0x0, ttl 64, id 6348, offset 0, flags [DF], proto TCP (6), length 1048)
    127.0.0.1.10950 > 127.0.0.1.57924: Flags [P.], cksum 0x020d (incorrect -> 0x7f95), seq 8216:9212, ack 907, win 512, options [nop,nop,TS val 1292760687 ecr 1292760644], length 996
2022-02-28 04:40:16.463965 IP (tos 0x0, ttl 64, id 7556, offset 0, flags [DF], proto TCP (6), length 52)
    127.0.0.1.57924 > 127.0.0.1.10950: Flags [.], cksum 0xfe28 (incorrect -> 0xc1f2), seq 907, ack 9212, win 504, options [nop,nop,TS val 1292760687 ecr 1292760687], length 0
2022-02-28 04:40:16.509230 IP (tos 0x0, ttl 64, id 6349, offset 0, flags [DF], proto TCP (6), length 2232)
    127.0.0.1.10950 > 127.0.0.1.57924: Flags [P.], cksum 0x06ad (incorrect -> 0x90d8), seq 9212:11392, ack 907, win 512, options [nop,nop,TS val 1292760732 ecr 1292760687], length 2180
2022-02-28 04:40:16.509237 IP (tos 0x0, ttl 64, id 7557, offset 0, flags [DF], proto TCP (6), length 52)
    127.0.0.1.57924 > 127.0.0.1.10950: Flags [.], cksum 0xfe28 (incorrect -> 0xb919), seq 907, ack 11392, win 499, options [nop,nop,TS val 1292760732 ecr 1292760732], length 0
2022-02-28 04:40:16.795366 IP (tos 0x0, ttl 64, id 6350, offset 0, flags [DF], proto TCP (6), length 4100)
    127.0.0.1.10950 > 127.0.0.1.57924: Flags [P.], cksum 0x0df9 (incorrect -> 0x8bc9), seq 11392:15440, ack 907, win 512, options [nop,nop,TS val 1292761018 ecr 1292760732], length 4048
2022-02-28 04:40:16.795384 IP (tos 0x0, ttl 64, id 7558, offset 0, flags [DF], proto TCP (6), length 52)
    127.0.0.1.57924 > 127.0.0.1.10950: Flags [.], cksum 0xfe28 (incorrect -> 0xa714), seq 907, ack 15440, win 492, options [nop,nop,TS val 1292761018 ecr 1292761018], length 0
2022-02-28 04:40:16.795397 IP (tos 0x0, ttl 64, id 6351, offset 0, flags [DF], proto TCP (6), length 3276)
    127.0.0.1.10950 > 127.0.0.1.57924: Flags [P.], cksum 0x0ac1 (incorrect -> 0x8b10), seq 15440:18664, ack 907, win 512, options [nop,nop,TS val 1292761018 ecr 1292761018], length 3224
2022-02-28 04:40:16.795402 IP (tos 0x0, ttl 64, id 7559, offset 0, flags [DF], proto TCP (6), length 52)
    127.0.0.1.57924 > 127.0.0.1.10950: Flags [.], cksum 0xfe28 (incorrect -> 0x9a89), seq 907, ack 18664, win 479, options [nop,nop,TS val 1292761018 ecr 1292761018], length 0
2022-02-28 04:40:16.811914 IP (tos 0x0, ttl 64, id 6352, offset 0, flags [DF], proto TCP (6), length 2542)
    127.0.0.1.10950 > 127.0.0.1.57924: Flags [P.], cksum 0x07e3 (incorrect -> 0x2df6), seq 18664:21154, ack 907, win 512, options [nop,nop,TS val 1292761035 ecr 1292761018], length 2490
2022-02-28 04:40:16.811927 IP (tos 0x0, ttl 64, id 7560, offset 0, flags [DF], proto TCP (6), length 52)
    127.0.0.1.57924 > 127.0.0.1.10950: Flags [.], cksum 0xfe28 (incorrect -> 0x909a), seq 907, ack 21154, win 498, options [nop,nop,TS val 1292761035 ecr 1292761035], length 0
2022-02-28 04:40:16.846326 IP (tos 0x0, ttl 64, id 6353, offset 0, flags [DF], proto TCP (6), length 3538)
    127.0.0.1.10950 > 127.0.0.1.57924: Flags [P.], cksum 0x0bc7 (incorrect -> 0xaf7f), seq 21154:24640, ack 907, win 512, options [nop,nop,TS val 1292761069 ecr 1292761035], length 3486
2022-02-28 04:40:16.846336 IP (tos 0x0, ttl 64, id 7561, offset 0, flags [DF], proto TCP (6), length 52)
    127.0.0.1.57924 > 127.0.0.1.10950: Flags [.], cksum 0xfe28 (incorrect -> 0x82bc), seq 907, ack 24640, win 494, options [nop,nop,TS val 1292761069 ecr 1292761069], length 0
2022-02-28 04:40:16.862937 IP (tos 0x0, ttl 64, id 6354, offset 0, flags [DF], proto TCP (6), length 4100)
    127.0.0.1.10950 > 127.0.0.1.57924: Flags [P.], cksum 0x0df9 (incorrect -> 0x114a), seq 24640:28688, ack 907, win 512, options [nop,nop,TS val 1292761086 ecr 1292761069], length 4048
2022-02-28 04:40:16.862947 IP (tos 0x0, ttl 64, id 7562, offset 0, flags [DF], proto TCP (6), length 52)
    127.0.0.1.57924 > 127.0.0.1.10950: Flags [.], cksum 0xfe28 (incorrect -> 0x72cc), seq 907, ack 28688, win 492, options [nop,nop,TS val 1292761086 ecr 1292761086], length 0
2022-02-28 04:40:16.862953 IP (tos 0x0, ttl 64, id 6355, offset 0, flags [DF], proto TCP (6), length 108)
    127.0.0.1.10950 > 127.0.0.1.57924: Flags [P.], cksum 0xfe60 (incorrect -> 0xd879), seq 28688:28744, ack 907, win 512, options [nop,nop,TS val 1292761086 ecr 1292761086], length 56
2022-02-28 04:40:16.862956 IP (tos 0x0, ttl 64, id 7563, offset 0, flags [DF], proto TCP (6), length 52)
    127.0.0.1.57924 > 127.0.0.1.10950: Flags [.], cksum 0xfe28 (incorrect -> 0x7294), seq 907, ack 28744, win 492, options [nop,nop,TS val 1292761086 ecr 1292761086], length 0
200, 5.897168397903442, 1.627183437347412